tensilelite/try/yamlGen/tunning_BFVF_Round1/tunning_BFVF_Round1_23/3_LibraryLogic/aldebaran_Cijk_Ailk_Bljk_HHS_BH.yaml
- {MinimumRequiredVersion: 4.33.0}
- aldebaran
- gfx90a
- [Device 0050, Device 0051, Device 0052, Device 0054, Device 0062, Device 7400, Device
    SolutionIndex: 0
    SolutionNameMin: Cijk_Ailk_Bljk_HHS_BH_MT192x32x32_MI16x16x16x1_SN_1LDSB0_GRVW4_LPB4_LRVW4_MIWT3_2_NLCA3_PLR3_SS0_SRVW0_SVW4_VW1
    SolutionIndex: 1
    SolutionNameMin: Cijk_Ailk_Bljk_HHS_BH_MT192x32x64_MI16x16x16x1_SN_1LDSB0_GRVW8_LPB16_LRVW8_MIWT3_2_NLCA3_PLR5_SS0_SRVW0_SVW4_VW1
    SolutionIndex: 2
    SolutionNameMin: Cijk_Ailk_Bljk_HHS_BH_MT192x32x16_MI16x16x16x1_SN_1LDSB0_GRVW2_LPB4_LRVW4_MIWT3_2_NLCA3_PLR1_SS1_SRVW0_SVW1_VW1
    SolutionIndex: 3
    SolutionNameMin: Cijk_Ailk_Bljk_HHS_BH_MT192x32x32_MI16x16x16x1_SN_1LDSB0_GRVW4_LPB4_LRVW4_MIWT3_2_NLCA3_PLR1_SS1_SRVW0_SVW1_VW1
    SolutionIndex: 4
    SolutionNameMin: Cijk_Ailk_Bljk_HHS_BH_MT192x32x32_MI16x16x16x1_SN_1LDSB0_GRVW8_LPB8_LRVW4_MIWT3_2_NLCA3_PLR1_SS1_SRVW0_SVW1_VW1
    SolutionIndex: 5
    SolutionNameMin: Cijk_Ailk_Bljk_HHS_BH_MT192x32x32_MI16x16x16x1_SN_1LDSB0_GRVW4_LPB4_LRVW4_MIWT3_2_NLCA3_PLR3_SS1_SRVW0_SVW1_VW1
    SolutionIndex: 6
    SolutionNameMin: Cijk_Ailk_Bljk_HHS_BH_MT192x32x32_MI16x16x16x1_SN_1LDSB0_GRVW8_LPB8_LRVW4_MIWT3_2_NLCA3_PLR3_SS1_SRVW0_SVW1_VW1
    SolutionIndex: 7
    SolutionNameMin: Cijk_Ailk_Bljk_HHS_BH_MT192x32x64_MI16x16x16x1_SN_1LDSB0_GRVW8_LPB16_LRVW8_MIWT3_2_NLCA3_PLR5_SS1_SRVW0_SVW1_VW1
- - - [1104, 1335, 1, 4608, 1104, 1104, 1104, 4608]
    - [1, 65302.0]
  - - [1104, 1408, 1, 4608, 1104, 1104, 1104, 4608]
    - [7, 69010.9]
  - - [4608, 1, 1, 320, 4608, 4608, 4608, 320]
    - [1, 326.23]
  - - [4608, 16, 1, 320, 4608, 4608, 4608, 320]
    - [1, 5067.16]
  - - [4608, 1335, 1, 320, 4608, 4608, 4608, 320]
    - [6, 65338.7]
  - - [4608, 1408, 1, 320, 4608, 4608, 4608, 320]
    - [4, 67707.1]
  - - [768, 1335, 1, 4608, 768, 768, 768, 4608]
    - [5, 73134.1]
  - - [768, 1408, 1, 4608, 768, 768, 768, 4608]
    - [5, 77228.8]
  - - [4608, 1, 1, 768, 4608, 4608, 4608, 768]
    - [1, 456.517]
  - - [4608, 16, 1, 768, 4608, 4608, 4608, 768]
    - [1, 7092.03]
  - - [4608, 1335, 1, 768, 4608, 4608, 4608, 768]
    - [4, 75877.9]
  - - [4608, 1408, 1, 768, 4608, 4608, 4608, 768]
    - [4, 79465.4]
  - - [320, 8192, 1, 320, 320, 320, 320, 320]
    - [6, 49601.1]
  - - [640, 2048, 1, 640, 640, 640, 640, 640]
    - [6, 48793.4]
  - - [320, 8192, 1, 1280, 320, 320, 320, 1280]
    - [6, 66702.9]
  - - [1280, 512, 1, 1280, 1280, 1280, 1280, 1280]
    - [0, 44601.0]
  - - [10240, 512, 1, 1280, 10240, 10240, 10240, 1280]
    - [6, 78758.4]
  - - [2560, 8192, 1, 320, 2560, 2560, 2560, 320]
    - [2, 69974.6]
  - - [5120, 2048, 1, 640, 5120, 5120, 5120, 640]
    - [4, 80119.9]
  - - [1280, 512, 1, 5120, 1280, 1280, 1280, 5120]
    - [3, 49648.2]
  - - [640, 2048, 1, 2560, 640, 640, 640, 2560]
    - [7, 60004.0]
  - - [320, 154, 1, 768, 320, 320, 320, 768]
    - [1, 4892.29]
  - - [1280, 154, 1, 768, 1280, 1280, 1280, 768]
    - [1, 19877.5]
- null
- null
- DeviceEfficiency
