library/src/amd_detail/rocblaslt/src/Tensile/Logic/asm_full/aldebaran/110CU/GridBased/aldebaran_Cijk_Ailk_Bjlk_HSS_BH_GG.yaml
- {MinimumRequiredVersion: 4.33.0}
- aldebaran
- gfx90a
- [Device 0050, Device 0051, Device 0052, Device 0054, Device 0062, Device 7400, Device
    SolutionIndex: 0
    SolutionNameMin: Cijk_Ailk_Bjlk_HHS_BH_GG_MT128x16x32_MI16x16x16x1_SN_1LDSB0_GRVW2_MIWT2_1_NEPBS2_NLCA1_NLCB1_PLR3_SVW2_VW2_WG64_4_1
    SolutionIndex: 1
    SolutionNameMin: Cijk_Ailk_Bjlk_HHS_BH_GG_MT192x16x32_MI16x16x16x1_SN_1LDSB0_GRVW2_MIWT3_1_NEPBS2_NLCA3_NLCB1_PLR3_SVW1_VW1_WG64_4_1
    SolutionIndex: 2
    SolutionNameMin: Cijk_Ailk_Bjlk_HHS_BH_GG_MT32x32x32_MI16x16x16x1_SN_1LDSB0_GRVW4_MIWT1_1_NEPBS2_NLCA1_NLCB1_PLR3_SVW1_VW1_WG32_8_1
    SolutionIndex: 3
    SolutionNameMin: Cijk_Ailk_Bjlk_HHS_BH_GG_MT64x32x32_MI16x16x16x1_SN_1LDSB0_GRVW4_MIWT2_1_NEPBS2_NLCA1_NLCB1_PLR3_SVW2_VW2_WG32_8_1
    SolutionIndex: 4
    SolutionNameMin: Cijk_Ailk_Bjlk_HHS_BH_GG_MT96x32x32_MI16x16x16x1_SN_1LDSB0_GRVW4_MIWT3_1_NEPBS2_NLCA3_NLCB1_PLR3_SVW1_VW1_WG32_8_1
    SolutionIndex: 5
    SolutionNameMin: Cijk_Ailk_Bjlk_HHS_BH_GG_MT128x32x32_MI32x32x8x1_SN_1LDSB0_GRVW4_MIWT1_1_NEPBS2_NLCA1_NLCB1_PLR5_SVW1_VW1_WG128_2_1
    SolutionIndex: 6
    SolutionNameMin: Cijk_Ailk_Bjlk_HHS_BH_GG_MT160x32x32_MI16x16x16x1_SN_1LDSB0_GRVW4_MIWT5_1_NEPBS2_NLCA5_NLCB1_PLR3_SVW1_VW1_WG32_8_1
    SolutionIndex: 7
    SolutionNameMin: Cijk_Ailk_Bjlk_HHS_BH_GG_MT192x32x32_MI16x16x16x1_SN_1LDSB0_GRVW4_MIWT6_1_NEPBS2_NLCA3_NLCB1_PLR3_SVW2_VW2_WG32_8_1
    SolutionIndex: 8
    SolutionNameMin: Cijk_Ailk_Bjlk_HHS_BH_GG_MT224x32x32_MI16x16x16x1_SN_1LDSB0_GRVW4_MIWT7_1_NEPBS2_NLCA7_NLCB1_PLR3_SVW1_VW1_WG32_8_1
    SolutionIndex: 9
    SolutionNameMin: Cijk_Ailk_Bjlk_HHS_BH_GG_MT64x48x32_MI16x16x16x1_SN_1LDSB0_GRVW2_MIWT1_3_NEPBS2_NLCA1_NLCB3_PLR3_SVW1_VW1_WG64_4_1
    SolutionIndex: 10
    SolutionNameMin: Cijk_Ailk_Bjlk_HHS_BH_GG_MT128x48x32_MI16x16x16x1_SN_1LDSB0_GRVW2_MIWT2_3_NEPBS2_NLCA1_NLCB3_PLR3_SVW2_VW2_WG64_4_1
    SolutionIndex: 11
    SolutionNameMin: Cijk_Ailk_Bjlk_HHS_BH_GG_MT192x48x32_MI16x16x16x1_SN_1LDSB0_GRVW2_MIWT3_3_NEPBS2_NLCA3_NLCB3_PLR3_SVW1_VW1_WG64_4_1
    SolutionIndex: 12
    SolutionNameMin: Cijk_Ailk_Bjlk_HHS_BH_GG_MT16x64x32_MI16x16x16x1_SN_1LDSB0_GRVW2_MIWT1_1_NEPBS2_NLCA1_NLCB1_PLR3_SVW1_VW1_WG16_16_1
    SolutionIndex: 13
    SolutionNameMin: Cijk_Ailk_Bjlk_HHS_BH_GG_MT32x64x32_MI16x16x16x1_SN_1LDSB0_GRVW4_MIWT2_1_NEPBS2_NLCA1_NLCB1_PLR3_SVW2_VW2_WG16_16_1
    SolutionIndex: 14
    SolutionNameMin: Cijk_Ailk_Bjlk_HHS_BH_GG_MT48x64x32_MI16x16x16x1_SN_1LDSB0_GRVW2_MIWT3_1_NEPBS2_NLCA3_NLCB1_PLR3_SVW1_VW1_WG16_16_1
    SolutionIndex: 15
    SolutionNameMin: Cijk_Ailk_Bjlk_HHS_BH_GG_MT64x64x32_MI32x32x8x1_SN_1LDSB0_GRVW8_MIWT1_1_NEPBS2_NLCA1_NLCB1_PLR5_SVW1_VW1_WG64_4_1
    SolutionIndex: 16
    SolutionNameMin: Cijk_Ailk_Bjlk_HHS_BH_GG_MT80x64x32_MI16x16x16x1_SN_1LDSB0_GRVW2_MIWT5_1_NEPBS2_NLCA5_NLCB1_PLR3_SVW1_VW1_WG16_16_1
    SolutionIndex: 17
    SolutionNameMin: Cijk_Ailk_Bjlk_HHS_BH_GG_MT96x64x32_MI16x16x16x1_SN_1LDSB0_GRVW4_MIWT6_1_NEPBS2_NLCA3_NLCB1_PLR3_SVW2_VW2_WG16_16_1
    SolutionIndex: 18
    SolutionNameMin: Cijk_Ailk_Bjlk_HHS_BH_GG_MT112x64x32_MI16x16x16x1_SN_1LDSB0_GRVW2_MIWT7_1_NEPBS2_NLCA7_NLCB1_PLR3_SVW1_VW1_WG16_16_1
    SolutionIndex: 19
    SolutionNameMin: Cijk_Ailk_Bjlk_HHS_BH_GG_MT128x64x32_MI32x32x8x1_SN_1LDSB0_GRVW8_MIWT2_1_NEPBS2_NLCA1_NLCB1_PLR5_SVW2_VW2_WG64_4_1
    SolutionIndex: 20
    SolutionNameMin: Cijk_Ailk_Bjlk_HHS_BH_GG_MT144x64x32_MI16x16x16x1_SN_1LDSB0_GRVW2_MIWT9_1_NEPBS2_NLCA9_NLCB1_PLR3_SVW1_VW1_WG16_16_1
    SolutionIndex: 21
    SolutionNameMin: Cijk_Ailk_Bjlk_HHS_BH_GG_MT160x64x32_MI16x16x16x1_SN_1LDSB0_GRVW4_MIWT10_1_NEPBS2_NLCA5_NLCB1_PLR3_SVW2_VW2_WG16_16_1
    SolutionIndex: 22
    SolutionNameMin: Cijk_Ailk_Bjlk_HHS_BH_GG_MT176x64x32_MI16x16x16x1_SN_1LDSB0_GRVW2_MIWT11_1_NEPBS2_NLCA11_NLCB1_PLR3_SVW1_VW1_WG16_16_1
    SolutionIndex: 23
    SolutionNameMin: Cijk_Ailk_Bjlk_HHS_BH_GG_MT192x64x32_MI32x32x8x1_SN_1LDSB0_GRVW8_MIWT3_1_NEPBS2_NLCA3_NLCB1_PLR5_SVW1_VW1_WG64_4_1
    SolutionIndex: 24
    SolutionNameMin: Cijk_Ailk_Bjlk_HHS_BH_GG_MT256x64x32_MI32x32x8x1_SN_1LDSB1_GRVW8_MIWT2_2_NEPBS2_NLCA1_NLCB1_PLR5_SVW2_VW2_WG128_2_1
    SolutionIndex: 25
    SolutionNameMin: Cijk_Ailk_Bjlk_HHS_BH_GG_MT64x80x32_MI16x16x16x1_SN_1LDSB0_GRVW2_MIWT1_5_NEPBS2_NLCA1_NLCB5_PLR3_SVW1_VW1_WG64_4_1
    SolutionIndex: 26
    SolutionNameMin: Cijk_Ailk_Bjlk_HHS_BH_GG_MT128x80x32_MI16x16x16x1_SN_1LDSB0_GRVW2_MIWT2_5_NEPBS2_NLCA1_NLCB5_PLR3_SVW2_VW2_WG64_4_1
    SolutionIndex: 27
    SolutionNameMin: Cijk_Ailk_Bjlk_HHS_BH_GG_MT32x96x32_MI16x16x16x1_SN_1LDSB0_GRVW4_MIWT1_3_NEPBS2_NLCA1_NLCB3_PLR3_SVW1_VW1_WG32_8_1
    SolutionIndex: 28
    SolutionNameMin: Cijk_Ailk_Bjlk_HHS_BH_GG_MT64x96x32_MI16x16x16x1_SN_1LDSB0_GRVW4_MIWT2_3_NEPBS2_NLCA1_NLCB3_PLR3_SVW2_VW2_WG32_8_1
    SolutionIndex: 29
    SolutionNameMin: Cijk_Ailk_Bjlk_HHS_BH_GG_MT96x96x32_MI16x16x16x1_SN_1LDSB0_GRVW4_MIWT3_3_NEPBS2_NLCA3_NLCB3_PLR3_SVW1_VW1_WG32_8_1
    SolutionIndex: 30
    SolutionNameMin: Cijk_Ailk_Bjlk_HHS_BH_GG_MT128x96x32_MI32x32x8x1_SN_1LDSB0_GRVW4_MIWT1_3_NEPBS2_NLCA1_NLCB3_PLR5_SVW1_VW1_WG128_2_1
    SolutionIndex: 31
    SolutionNameMin: Cijk_Ailk_Bjlk_HHS_BH_GG_MT160x96x32_MI16x16x16x1_SN_1LDSB0_GRVW4_MIWT5_3_NEPBS2_NLCA5_NLCB3_PLR3_SVW1_VW1_WG32_8_1
    SolutionIndex: 32
    SolutionNameMin: Cijk_Ailk_Bjlk_HHS_BH_GG_MT256x96x32_MI32x32x8x1_SN_1LDSB1_GRVW4_MIWT2_3_NEPBS2_NLCA1_NLCB3_PLR5_SVW2_VW2_WG128_2_1
    SolutionIndex: 33
    SolutionNameMin: Cijk_Ailk_Bjlk_HHS_BH_GG_MT64x112x32_MI16x16x16x1_SN_1LDSB0_GRVW2_MIWT1_7_NEPBS2_NLCA1_NLCB7_PLR3_SVW1_VW1_WG64_4_1
    SolutionIndex: 34
    SolutionNameMin: Cijk_Ailk_Bjlk_HHS_BH_GG_MT128x112x32_MI16x16x16x1_SN_1LDSB0_GRVW2_MIWT2_7_NEPBS2_NLCA1_NLCB7_PLR3_SVW2_VW2_WG64_4_1
    SolutionIndex: 35
    SolutionNameMin: Cijk_Ailk_Bjlk_HHS_BH_GG_MT16x128x32_MI16x16x16x1_SN_1LDSB0_GRVW2_MIWT1_2_NEPBS2_NLCA1_NLCB1_PLR3_SVW1_VW1_WG16_16_1
    SolutionIndex: 36
    SolutionNameMin: Cijk_Ailk_Bjlk_HHS_BH_GG_MT32x128x32_MI32x32x8x1_SN_1LDSB0_GRVW4_MIWT1_1_NEPBS2_NLCA1_NLCB1_PLR5_SVW1_VW1_WG32_8_1
    SolutionIndex: 37
    SolutionNameMin: Cijk_Ailk_Bjlk_HHS_BH_GG_MT48x128x32_MI16x16x16x1_SN_1LDSB0_GRVW2_MIWT3_2_NEPBS2_NLCA3_NLCB1_PLR3_SVW1_VW1_WG16_16_1
    SolutionIndex: 38
    SolutionNameMin: Cijk_Ailk_Bjlk_HHS_BH_GG_MT64x128x32_MI32x32x8x1_SN_1LDSB0_GRVW8_MIWT2_1_NEPBS2_NLCA1_NLCB1_PLR5_SVW2_VW2_WG32_8_1
    SolutionIndex: 39
    SolutionNameMin: Cijk_Ailk_Bjlk_HHS_BH_GG_MT80x128x32_MI16x16x16x1_SN_1LDSB0_GRVW2_MIWT5_2_NEPBS2_NLCA5_NLCB1_PLR3_SVW1_VW1_WG16_16_1
    SolutionIndex: 40
    SolutionNameMin: Cijk_Ailk_Bjlk_HHS_BH_GG_MT96x128x32_MI32x32x8x1_SN_1LDSB0_GRVW4_MIWT3_1_NEPBS2_NLCA3_NLCB1_PLR5_SVW1_VW1_WG32_8_1
    SolutionIndex: 41
    SolutionNameMin: Cijk_Ailk_Bjlk_HHS_BH_GG_MT112x128x32_MI16x16x16x1_SN_1LDSB0_GRVW2_MIWT7_2_NEPBS2_NLCA7_NLCB1_PLR3_SVW1_VW1_WG16_16_1
    SolutionIndex: 42
    SolutionNameMin: Cijk_Ailk_Bjlk_HHS_BH_GG_MT128x128x32_MI32x32x8x1_SN_1LDSB0_GRVW8_MIWT2_2_NEPBS2_NLCA1_NLCB1_PLR5_SVW2_VW2_WG64_4_1
    SolutionIndex: 43
    SolutionNameMin: Cijk_Ailk_Bjlk_HHS_BH_GG_MT160x128x32_MI32x32x8x1_SN_1LDSB1_GRVW4_MIWT5_1_NEPBS2_NLCA5_NLCB1_PLR5_SVW1_VW1_WG32_8_1
    SolutionIndex: 44
    SolutionNameMin: Cijk_Ailk_Bjlk_HHS_BH_GG_MT192x128x32_MI32x32x8x1_SN_1LDSB1_GRVW8_MIWT6_1_NEPBS2_NLCA3_NLCB1_PLR5_SVW2_VW2_WG32_8_1
    SolutionIndex: 45
    SolutionNameMin: Cijk_Ailk_Bjlk_HHS_BH_GG_MT224x128x32_MI32x32x8x1_SN_1LDSB1_GRVW4_MIWT7_1_NEPBS2_NLCA7_NLCB1_PLR5_SVW1_VW1_WG32_8_1
    SolutionIndex: 46
    SolutionNameMin: Cijk_Ailk_Bjlk_HHS_BH_GG_MT256x128x32_MI32x32x8x1_SN_1LDSB1_GRVW8_MIWT4_2_NEPBS2_NLCA1_NLCB1_PLR5_SVW4_VW4_WG64_4_1
    SolutionIndex: 47
    SolutionNameMin: Cijk_Ailk_Bjlk_HHS_BH_GG_MT64x144x32_MI16x16x16x1_SN_1LDSB0_GRVW2_MIWT1_9_NEPBS2_NLCA1_NLCB9_PLR3_SVW1_VW1_WG64_4_1
    SolutionIndex: 48
    SolutionNameMin: Cijk_Ailk_Bjlk_HHS_BH_GG_MT256x144x32_MI16x16x16x1_SN_1LDSB0_GRVW2_MIWT4_9_NEPBS0_NLCA1_NLCB9_PLR3_SVW4_VW4_WG64_4_1
    SolutionIndex: 49
    SolutionNameMin: Cijk_Ailk_Bjlk_HHS_BH_GG_MT32x160x32_MI16x16x16x1_SN_1LDSB0_GRVW4_MIWT1_5_NEPBS2_NLCA1_NLCB5_PLR3_SVW1_VW1_WG32_8_1
    SolutionIndex: 50
    SolutionNameMin: Cijk_Ailk_Bjlk_HHS_BH_GG_MT64x160x32_MI16x16x16x1_SN_1LDSB0_GRVW4_MIWT2_5_NEPBS2_NLCA1_NLCB5_PLR3_SVW2_VW2_WG32_8_1
    SolutionIndex: 51
    SolutionNameMin: Cijk_Ailk_Bjlk_HHS_BH_GG_MT96x160x32_MI16x16x16x1_SN_1LDSB0_GRVW4_MIWT3_5_NEPBS2_NLCA3_NLCB5_PLR3_SVW1_VW1_WG32_8_1
    SolutionIndex: 52
    SolutionNameMin: Cijk_Ailk_Bjlk_HHS_BH_GG_MT128x160x32_MI32x32x8x1_SN_1LDSB1_GRVW4_MIWT1_5_NEPBS2_NLCA1_NLCB5_PLR5_SVW1_VW1_WG128_2_1
    SolutionIndex: 53
    SolutionNameMin: Cijk_Ailk_Bjlk_HHS_BH_GG_MT224x160x32_MI16x16x16x1_SN_1LDSB0_GRVW4_MIWT7_5_NEPBS0_NLCA7_NLCB5_PLR3_SVW1_VW1_WG32_8_1
    SolutionIndex: 54
    SolutionNameMin: Cijk_Ailk_Bjlk_HHS_BH_GG_MT256x160x32_MI32x32x8x1_SN_1LDSB0_GRVW4_MIWT2_5_NEPBS0_NLCA1_NLCB5_PLR5_SVW2_VW2_WG128_2_1
    SolutionIndex: 55
    SolutionNameMin: Cijk_Ailk_Bjlk_HHS_BH_GG_MT64x176x32_MI16x16x16x1_SN_1LDSB0_GRVW2_MIWT1_11_NEPBS2_NLCA1_NLCB11_PLR3_SVW1_VW1_WG64_4_1
    SolutionIndex: 56
    SolutionNameMin: Cijk_Ailk_Bjlk_HHS_BH_GG_MT192x176x32_MI16x16x16x1_SN_1LDSB0_GRVW2_MIWT3_11_NEPBS0_NLCA3_NLCB11_PLR3_SVW1_VW1_WG64_4_1
    SolutionIndex: 57
    SolutionNameMin: Cijk_Ailk_Bjlk_HHS_BH_GG_MT256x176x32_MI16x16x16x1_SN_1LDSB0_GRVW2_MIWT4_11_NEPBS0_NLCA1_NLCB11_PLR3_SVW4_VW4_WG64_4_1
    SolutionIndex: 58
    SolutionNameMin: Cijk_Ailk_Bjlk_HHS_BH_GG_MT16x192x32_MI16x16x16x1_SN_1LDSB0_GRVW2_MIWT1_3_NEPBS2_NLCA1_NLCB3_PLR3_SVW1_VW1_WG16_16_1
    SolutionIndex: 59
    SolutionNameMin: Cijk_Ailk_Bjlk_HHS_BH_GG_MT32x192x32_MI16x16x16x1_SN_1LDSB0_GRVW4_MIWT2_3_NEPBS2_NLCA1_NLCB3_PLR3_SVW2_VW2_WG16_16_1
    SolutionIndex: 60
    SolutionNameMin: Cijk_Ailk_Bjlk_HHS_BH_GG_MT48x192x32_MI16x16x16x1_SN_1LDSB0_GRVW2_MIWT3_3_NEPBS2_NLCA3_NLCB3_PLR3_SVW1_VW1_WG16_16_1
    SolutionIndex: 61
    SolutionNameMin: Cijk_Ailk_Bjlk_HHS_BH_GG_MT64x192x32_MI32x32x8x1_SN_1LDSB0_GRVW8_MIWT1_3_NEPBS2_NLCA1_NLCB3_PLR5_SVW1_VW1_WG64_4_1
    SolutionIndex: 62
    SolutionNameMin: Cijk_Ailk_Bjlk_HHS_BH_GG_MT128x192x32_MI32x32x8x1_SN_1LDSB1_GRVW8_MIWT2_3_NEPBS2_NLCA1_NLCB3_PLR5_SVW2_VW2_WG64_4_1
    SolutionIndex: 63
    SolutionNameMin: Cijk_Ailk_Bjlk_HHS_BH_GG_MT176x192x32_MI16x16x16x1_SN_1LDSB0_GRVW2_MIWT11_3_NEPBS0_NLCA11_NLCB3_PLR3_SVW1_VW1_WG16_16_1
    SolutionIndex: 64
    SolutionNameMin: Cijk_Ailk_Bjlk_HHS_BH_GG_MT192x192x32_MI32x32x8x1_SN_1LDSB0_GRVW8_MIWT3_3_NEPBS0_NLCA3_NLCB3_PLR5_SVW1_VW1_WG64_4_1
    SolutionIndex: 65
    SolutionNameMin: Cijk_Ailk_Bjlk_HHS_BH_GG_MT208x192x32_MI16x16x16x1_SN_1LDSB0_GRVW2_MIWT13_3_NEPBS0_NLCA13_NLCB3_PLR3_SVW1_VW1_WG16_16_1
    SolutionIndex: 66
    SolutionNameMin: Cijk_Ailk_Bjlk_HHS_BH_GG_MT224x192x32_MI16x16x16x1_SN_1LDSB0_GRVW4_MIWT7_6_NEPBS0_NLCA7_NLCB3_PLR3_SVW1_VW1_WG32_8_1
    SolutionIndex: 67
    SolutionNameMin: Cijk_Ailk_Bjlk_HHS_BH_GG_MT240x192x32_MI16x16x16x1_SN_1LDSB0_GRVW2_MIWT15_3_NEPBS0_NLCA15_NLCB3_PLR3_SVW1_VW1_WG16_16_1
    SolutionIndex: 68
    SolutionNameMin: Cijk_Ailk_Bjlk_HHS_BH_GG_MT256x192x32_MI32x32x8x1_SN_1LDSB0_GRVW8_MIWT2_6_NEPBS0_NLCA1_NLCB3_PLR5_SVW2_VW2_WG128_2_1
    SolutionIndex: 69
    SolutionNameMin: Cijk_Ailk_Bjlk_HHS_BH_GG_MT192x208x32_MI16x16x16x1_SN_1LDSB0_GRVW2_MIWT3_13_NEPBS0_NLCA3_NLCB13_PLR3_SVW1_VW1_WG64_4_1
    SolutionIndex: 70
    SolutionNameMin: Cijk_Ailk_Bjlk_HHS_BH_GG_MT256x208x32_MI16x16x16x1_SN_1LDSB0_GRVW2_MIWT4_13_NEPBS0_NLCA1_NLCB13_PLR3_SVW4_VW4_WG64_4_1
    SolutionIndex: 71
    SolutionNameMin: Cijk_Ailk_Bjlk_HHS_BH_GG_MT32x224x32_MI16x16x16x1_SN_1LDSB0_GRVW4_MIWT1_7_NEPBS2_NLCA1_NLCB7_PLR3_SVW1_VW1_WG32_8_1
    SolutionIndex: 72
    SolutionNameMin: Cijk_Ailk_Bjlk_HHS_BH_GG_MT128x224x32_MI32x32x8x1_SN_1LDSB1_GRVW4_MIWT1_7_NEPBS2_NLCA1_NLCB7_PLR5_SVW1_VW1_WG128_2_1
    SolutionIndex: 73
    SolutionNameMin: Cijk_Ailk_Bjlk_HHS_BH_GG_MT160x224x32_MI16x16x16x1_SN_1LDSB0_GRVW4_MIWT5_7_NEPBS0_NLCA5_NLCB7_PLR3_SVW1_VW1_WG32_8_1
    SolutionIndex: 74
    SolutionNameMin: Cijk_Ailk_Bjlk_HHS_BH_GG_MT192x224x32_MI16x16x16x1_SN_1LDSB0_GRVW4_MIWT3_14_NEPBS0_NLCA3_NLCB7_PLR3_SVW1_VW1_WG64_4_1
    SolutionIndex: 75
    SolutionNameMin: Cijk_Ailk_Bjlk_HHS_BH_GG_MT224x224x32_MI16x16x16x1_SN_1LDSB0_GRVW4_MIWT7_7_NEPBS0_NLCA7_NLCB7_PLR3_SVW1_VW1_WG32_8_1
    SolutionIndex: 76
    SolutionNameMin: Cijk_Ailk_Bjlk_HHS_BH_GG_MT256x224x32_MI32x32x8x1_SN_1LDSB0_GRVW4_MIWT2_7_NEPBS0_NLCA1_NLCB7_PLR5_SVW2_VW2_WG128_2_1
    SolutionIndex: 77
    SolutionNameMin: Cijk_Ailk_Bjlk_HHS_BH_GG_MT192x240x32_MI16x16x16x1_SN_1LDSB0_GRVW2_MIWT3_15_NEPBS0_NLCA3_NLCB15_PLR3_SVW1_VW1_WG64_4_1
    SolutionIndex: 78
    SolutionNameMin: Cijk_Ailk_Bjlk_HHS_BH_GG_MT256x240x32_MI16x16x16x1_SN_1LDSB0_GRVW2_MIWT4_15_NEPBS0_NLCA1_NLCB15_PLR3_SVW4_VW4_WG64_4_1
    SolutionIndex: 79
    SolutionNameMin: Cijk_Ailk_Bjlk_HHS_BH_GG_MT64x256x32_MI32x32x8x1_SN_1LDSB1_GRVW8_MIWT2_2_NEPBS2_NLCA1_NLCB1_PLR5_SVW2_VW2_WG32_8_1
    SolutionIndex: 80
    SolutionNameMin: Cijk_Ailk_Bjlk_HHS_BH_GG_MT96x256x32_MI32x32x8x1_SN_1LDSB1_GRVW4_MIWT3_2_NEPBS2_NLCA3_NLCB1_PLR5_SVW1_VW1_WG32_8_1
    SolutionIndex: 81
    SolutionNameMin: Cijk_Ailk_Bjlk_HHS_BH_GG_MT128x256x32_MI32x32x8x1_SN_1LDSB1_GRVW8_MIWT2_4_NEPBS2_NLCA1_NLCB1_PLR5_SVW2_VW2_WG64_4_1
    SolutionIndex: 82
    SolutionNameMin: Cijk_Ailk_Bjlk_HHS_BH_GG_MT144x256x32_MI16x16x16x1_SN_1LDSB0_GRVW2_MIWT9_4_NEPBS0_NLCA9_NLCB1_PLR3_SVW1_VW1_WG16_16_1
    SolutionIndex: 83
    SolutionNameMin: Cijk_Ailk_Bjlk_HHS_BH_GG_MT160x256x32_MI32x32x8x1_SN_1LDSB0_GRVW4_MIWT5_2_NEPBS0_NLCA5_NLCB1_PLR5_SVW1_VW1_WG32_8_1
    SolutionIndex: 84
    SolutionNameMin: Cijk_Ailk_Bjlk_HHS_BH_GG_MT176x256x32_MI16x16x16x1_SN_1LDSB0_GRVW2_MIWT11_4_NEPBS0_NLCA11_NLCB1_PLR3_SVW1_VW1_WG16_16_1
    SolutionIndex: 85
    SolutionNameMin: Cijk_Ailk_Bjlk_HHS_BH_GG_MT192x256x32_MI32x32x8x1_SN_1LDSB0_GRVW8_MIWT3_4_NEPBS0_NLCA3_NLCB1_PLR5_SVW1_VW1_WG64_4_1
    SolutionIndex: 86
    SolutionNameMin: Cijk_Ailk_Bjlk_HHS_BH_GG_MT208x256x32_MI16x16x16x1_SN_1LDSB0_GRVW2_MIWT13_4_NEPBS0_NLCA13_NLCB1_PLR3_SVW1_VW1_WG16_16_1
    SolutionIndex: 87
    SolutionNameMin: Cijk_Ailk_Bjlk_HHS_BH_GG_MT224x256x32_MI32x32x8x1_SN_1LDSB0_GRVW4_MIWT7_2_NEPBS0_NLCA7_NLCB1_PLR5_SVW1_VW1_WG32_8_1
    SolutionIndex: 88
    SolutionNameMin: Cijk_Ailk_Bjlk_HHS_BH_GG_MT240x256x32_MI16x16x16x1_SN_1LDSB0_GRVW2_MIWT15_4_NEPBS0_NLCA15_NLCB1_PLR3_SVW1_VW1_WG16_16_1
    SolutionIndex: 89
    SolutionNameMin: Cijk_Ailk_Bjlk_HHS_BH_GG_MT256x256x32_MI32x32x8x1_SN_1LDSB0_GRVW8_MIWT2_8_NEPBS0_NLCA1_NLCB1_PLR5_SVW2_VW2_WG128_2_1
    SolutionIndex: 90
    SolutionNameMin: Cijk_Ailk_Bjlk_HHS_BH_GG_MT32x32x64_MI16x16x16x1_SN_1LDSB0_GRVW8_MIWT1_1_NEPBS2_NLCA1_NLCB1_PLR5_SVW1_VW1_WG32_8_1
    SolutionIndex: 91
    SolutionNameMin: Cijk_Ailk_Bjlk_HHS_BH_GG_MT64x32x64_MI16x16x16x1_SN_1LDSB0_GRVW8_MIWT2_1_NEPBS2_NLCA1_NLCB1_PLR5_SVW2_VW2_WG32_8_1
    SolutionIndex: 92
    SolutionNameMin: Cijk_Ailk_Bjlk_HHS_BH_GG_MT96x32x64_MI16x16x16x1_SN_1LDSB0_GRVW8_MIWT3_1_NEPBS2_NLCA3_NLCB1_PLR5_SVW1_VW1_WG32_8_1
    SolutionIndex: 93
    SolutionNameMin: Cijk_Ailk_Bjlk_HHS_BH_GG_MT128x32x64_MI32x32x8x1_SN_1LDSB0_GRVW8_MIWT1_1_NEPBS0_NLCA1_NLCB1_PLR9_SVW1_VW1_WG128_2_1
    SolutionIndex: 94
    SolutionNameMin: Cijk_Ailk_Bjlk_HHS_BH_GG_MT64x48x64_MI16x16x16x1_SN_1LDSB0_GRVW4_MIWT1_3_NEPBS2_NLCA1_NLCB3_PLR5_SVW1_VW1_WG64_4_1
    SolutionIndex: 95
    SolutionNameMin: Cijk_Ailk_Bjlk_HHS_BH_GG_MT16x64x64_MI16x16x16x1_SN_1LDSB0_GRVW4_MIWT1_1_NEPBS2_NLCA1_NLCB1_PLR5_SVW1_VW1_WG16_16_1
    SolutionIndex: 96
    SolutionNameMin: Cijk_Ailk_Bjlk_HHS_BH_GG_MT32x64x64_MI16x16x16x1_SN_1LDSB0_GRVW8_MIWT2_1_NEPBS2_NLCA1_NLCB1_PLR5_SVW2_VW2_WG16_16_1
    SolutionIndex: 97
    SolutionNameMin: Cijk_Ailk_Bjlk_HHS_BH_GG_MT48x64x64_MI16x16x16x1_SN_1LDSB0_GRVW4_MIWT3_1_NEPBS2_NLCA3_NLCB1_PLR5_SVW1_VW1_WG16_16_1
    SolutionIndex: 98
    SolutionNameMin: Cijk_Ailk_Bjlk_HHS_BH_GG_MT64x64x64_MI32x32x8x1_SN_1LDSB0_GRVW8_MIWT1_1_NEPBS2_NLCA1_NLCB1_PLR9_SVW1_VW1_WG64_4_1
    SolutionIndex: 99
    SolutionNameMin: Cijk_Ailk_Bjlk_HHS_BH_GG_MT256x64x64_MI32x32x8x1_SN_1LDSB1_GRVW8_MIWT2_2_NEPBS0_NLCA1_NLCB1_PLR9_SVW2_VW2_WG128_2_1
    SolutionIndex: 100
    SolutionNameMin: Cijk_Ailk_Bjlk_HHS_BH_GG_MT32x96x64_MI16x16x16x1_SN_1LDSB0_GRVW8_MIWT1_3_NEPBS2_NLCA1_NLCB3_PLR5_SVW1_VW1_WG32_8_1
    SolutionIndex: 101
    SolutionNameMin: Cijk_Ailk_Bjlk_HHS_BH_GG_MT256x96x64_MI32x32x8x1_SN_1LDSB1_GRVW8_MIWT2_3_NEPBS0_NLCA1_NLCB3_PLR9_SVW2_VW2_WG128_2_1
    SolutionIndex: 102
    SolutionNameMin: Cijk_Ailk_Bjlk_HHS_BH_GG_MT256x112x64_MI16x16x16x1_SN_1LDSB1_GRVW4_MIWT4_7_NEPBS0_NLCA1_NLCB7_PLR5_SVW4_VW4_WG64_4_1
    SolutionIndex: 103
    SolutionNameMin: Cijk_Ailk_Bjlk_HHS_BH_GG_MT32x128x64_MI32x32x8x1_SN_1LDSB0_GRVW8_MIWT1_1_NEPBS0_NLCA1_NLCB1_PLR9_SVW1_VW1_WG32_8_1
    SolutionIndex: 104
    SolutionNameMin: Cijk_Ailk_Bjlk_HHS_BH_GG_MT128x128x64_MI32x32x8x1_SN_1LDSB1_GRVW8_MIWT2_2_NEPBS2_NLCA1_NLCB1_PLR9_SVW2_VW2_WG64_4_1
    SolutionIndex: 105
    SolutionNameMin: Cijk_Ailk_Bjlk_HHS_BH_GG_MT160x128x64_MI32x32x8x1_SN_1LDSB1_GRVW8_MIWT5_1_NEPBS0_NLCA5_NLCB1_PLR9_SVW1_VW1_WG32_8_1
    SolutionIndex: 106
    SolutionNameMin: Cijk_Ailk_Bjlk_HHS_BH_GG_MT192x128x64_MI32x32x8x1_SN_1LDSB1_GRVW8_MIWT6_1_NEPBS0_NLCA3_NLCB1_PLR9_SVW2_VW2_WG32_8_1
    SolutionIndex: 107
    SolutionNameMin: Cijk_Ailk_Bjlk_HHS_BH_GG_MT224x128x64_MI32x32x8x1_SN_1LDSB1_GRVW8_MIWT7_1_NEPBS0_NLCA7_NLCB1_PLR9_SVW1_VW1_WG32_8_1
    SolutionIndex: 108
    SolutionNameMin: Cijk_Ailk_Bjlk_HHS_BH_GG_MT256x128x64_MI32x32x8x1_SN_1LDSB1_GRVW8_MIWT4_2_NEPBS0_NLCA1_NLCB1_PLR9_SVW4_VW4_WG64_4_1
    SolutionIndex: 109
    SolutionNameMin: Cijk_Ailk_Bjlk_HHS_BH_GG_MT256x144x64_MI16x16x16x1_SN_1LDSB1_GRVW4_MIWT4_9_NEPBS0_NLCA1_NLCB9_PLR5_SVW4_VW4_WG64_4_1
    SolutionIndex: 110
    SolutionNameMin: Cijk_Ailk_Bjlk_HHS_BH_GG_MT128x160x64_MI32x32x8x1_SN_1LDSB1_GRVW8_MIWT1_5_NEPBS0_NLCA1_NLCB5_PLR9_SVW1_VW1_WG128_2_1
    SolutionIndex: 111
    SolutionNameMin: Cijk_Ailk_Bjlk_HHS_BH_GG_MT160x160x64_MI16x16x16x1_SN_1LDSB1_GRVW8_MIWT5_5_NEPBS0_NLCA5_NLCB5_PLR5_SVW1_VW1_WG32_8_1
    SolutionIndex: 112
    SolutionNameMin: Cijk_Ailk_Bjlk_HHS_BH_GG_MT192x160x64_MI16x16x16x1_SN_1LDSB1_GRVW8_MIWT6_5_NEPBS0_NLCA3_NLCB5_PLR5_SVW2_VW2_WG32_8_1
    SolutionIndex: 113
    SolutionNameMin: Cijk_Ailk_Bjlk_HHS_BH_GG_MT224x160x64_MI16x16x16x1_SN_1LDSB1_GRVW8_MIWT7_5_NEPBS0_NLCA7_NLCB5_PLR5_SVW1_VW1_WG32_8_1
    SolutionIndex: 114
    SolutionNameMin: Cijk_Ailk_Bjlk_HHS_BH_GG_MT256x160x64_MI32x32x8x1_SN_1LDSB1_GRVW8_MIWT2_5_NEPBS0_NLCA1_NLCB5_PLR9_SVW2_VW2_WG128_2_1
    SolutionIndex: 115
    SolutionNameMin: Cijk_Ailk_Bjlk_HHS_BH_GG_MT128x192x64_MI32x32x8x1_SN_1LDSB1_GRVW8_MIWT2_3_NEPBS0_NLCA1_NLCB3_PLR9_SVW2_VW2_WG64_4_1
    SolutionIndex: 116
    SolutionNameMin: Cijk_Ailk_Bjlk_HHS_BH_GG_MT192x192x64_MI32x32x8x1_SN_1LDSB1_GRVW8_MIWT3_3_NEPBS0_NLCA3_NLCB3_PLR9_SVW1_VW1_WG64_4_1
    SolutionIndex: 117
    SolutionNameMin: Cijk_Ailk_Bjlk_HHS_BH_GG_MT224x192x64_MI16x16x16x1_SN_1LDSB1_GRVW8_MIWT7_6_NEPBS0_NLCA7_NLCB3_PLR5_SVW1_VW1_WG32_8_1
    SolutionIndex: 118
    SolutionNameMin: Cijk_Ailk_Bjlk_HHS_BH_GG_MT256x192x64_MI32x32x8x1_SN_1LDSB1_GRVW8_MIWT2_6_NEPBS0_NLCA1_NLCB3_PLR9_SVW2_VW2_WG128_2_1
    SolutionIndex: 119
    SolutionNameMin: Cijk_Ailk_Bjlk_HHS_BH_GG_MT128x224x64_MI32x32x8x1_SN_1LDSB1_GRVW8_MIWT1_7_NEPBS0_NLCA1_NLCB7_PLR9_SVW1_VW1_WG128_2_1
    SolutionIndex: 120
    SolutionNameMin: Cijk_Ailk_Bjlk_HHS_BH_GG_MT160x224x64_MI16x16x16x1_SN_1LDSB1_GRVW8_MIWT5_7_NEPBS0_NLCA5_NLCB7_PLR5_SVW1_VW1_WG32_8_1
    SolutionIndex: 121
    SolutionNameMin: Cijk_Ailk_Bjlk_HHS_BH_GG_MT224x224x64_MI16x16x16x1_SN_1LDSB1_GRVW8_MIWT7_7_NEPBS0_NLCA7_NLCB7_PLR5_SVW1_VW1_WG32_8_1
    SolutionIndex: 122
    SolutionNameMin: Cijk_Ailk_Bjlk_HHS_BH_GG_MT64x256x64_MI32x32x8x1_SN_1LDSB1_GRVW8_MIWT2_2_NEPBS0_NLCA1_NLCB1_PLR9_SVW2_VW2_WG32_8_1
    SolutionIndex: 123
    SolutionNameMin: Cijk_Ailk_Bjlk_HHS_BH_GG_MT96x256x64_MI32x32x8x1_SN_1LDSB1_GRVW8_MIWT3_2_NEPBS0_NLCA3_NLCB1_PLR9_SVW1_VW1_WG32_8_1
    SolutionIndex: 124
    SolutionNameMin: Cijk_Ailk_Bjlk_HHS_BH_GG_MT112x256x64_MI16x16x16x1_SN_1LDSB1_GRVW4_MIWT7_4_NEPBS0_NLCA7_NLCB1_PLR5_SVW1_VW1_WG16_16_1
    SolutionIndex: 125
    SolutionNameMin: Cijk_Ailk_Bjlk_HHS_BH_GG_MT128x256x64_MI32x32x8x1_SN_1LDSB1_GRVW8_MIWT2_4_NEPBS0_NLCA1_NLCB1_PLR9_SVW2_VW2_WG64_4_1
    SolutionIndex: 126
    SolutionNameMin: Cijk_Ailk_Bjlk_HHS_BH_GG_MT144x256x64_MI16x16x16x1_SN_1LDSB1_GRVW4_MIWT9_4_NEPBS0_NLCA9_NLCB1_PLR5_SVW1_VW1_WG16_16_1
    SolutionIndex: 127
    SolutionNameMin: Cijk_Ailk_Bjlk_HHS_BH_GG_MT160x256x64_MI32x32x8x1_SN_1LDSB1_GRVW8_MIWT5_2_NEPBS0_NLCA5_NLCB1_PLR9_SVW1_VW1_WG32_8_1
    SolutionIndex: 128
    SolutionNameMin: Cijk_Ailk_Bjlk_HHS_BH_GG_MT192x256x64_MI32x32x8x1_SN_1LDSB1_GRVW8_MIWT3_4_NEPBS0_NLCA3_NLCB1_PLR9_SVW1_VW1_WG64_4_1
- - - [8, 1, 1, 8, 512, 512, 512, 512]
    - [0, 0.0]
  - - [8, 2, 1, 8, 512, 512, 512, 512]
    - [1, 0.0]
  - - [8, 3, 1, 8, 512, 512, 512, 512]
    - [2, 0.0]
  - - [8, 4, 1, 8, 512, 512, 512, 512]
    - [3, 0.0]
  - - [8, 5, 1, 8, 512, 512, 512, 512]
    - [4, 0.0]
  - - [8, 6, 1, 8, 512, 512, 512, 512]
    - [5, 0.0]
  - - [8, 7, 1, 8, 512, 512, 512, 512]
    - [6, 0.0]
  - - [8, 8, 1, 8, 512, 512, 512, 512]
    - [7, 0.0]
  - - [8, 9, 1, 8, 512, 512, 512, 512]
    - [8, 0.0]
  - - [8, 10, 1, 8, 512, 512, 512, 512]
    - [9, 0.0]
  - - [8, 11, 1, 8, 512, 512, 512, 512]
    - [10, 0.0]
  - - [8, 12, 1, 8, 512, 512, 512, 512]
    - [11, 0.0]
  - - [8, 13, 1, 8, 512, 512, 512, 512]
    - [12, 0.0]
  - - [8, 14, 1, 8, 512, 512, 512, 512]
    - [13, 0.0]
  - - [8, 15, 1, 8, 512, 512, 512, 512]
    - [14, 0.0]
  - - [8, 16, 1, 8, 512, 512, 512, 512]
    - [15, 0.0]
  - - [8, 17, 1, 8, 512, 512, 512, 512]
    - [16, 0.0]
  - - [8, 18, 1, 8, 512, 512, 512, 512]
    - [17, 0.0]
  - - [8, 19, 1, 8, 512, 512, 512, 512]
    - [18, 0.0]
  - - [8, 20, 1, 8, 512, 512, 512, 512]
    - [19, 0.0]
  - - [8, 21, 1, 8, 512, 512, 512, 512]
    - [20, 0.0]
  - - [8, 22, 1, 8, 512, 512, 512, 512]
    - [21, 0.0]
  - - [8, 23, 1, 8, 512, 512, 512, 512]
    - [22, 0.0]
  - - [8, 24, 1, 8, 512, 512, 512, 512]
    - [23, 0.0]
  - - [8, 25, 1, 8, 512, 512, 512, 512]
    - [24, 0.0]
  - - [8, 26, 1, 8, 512, 512, 512, 512]
    - [25, 0.0]
  - - [8, 27, 1, 8, 512, 512, 512, 512]
    - [26, 0.0]
  - - [8, 28, 1, 8, 512, 512, 512, 512]
    - [27, 0.0]
  - - [8, 29, 1, 8, 512, 512, 512, 512]
    - [28, 0.0]
  - - [8, 30, 1, 8, 512, 512, 512, 512]
    - [29, 0.0]
  - - [8, 31, 1, 8, 512, 512, 512, 512]
    - [30, 0.0]
  - - [8, 32, 1, 8, 512, 512, 512, 512]
    - [31, 0.0]
  - - [8, 33, 1, 8, 512, 512, 512, 512]
    - [32, 0.0]
  - - [8, 34, 1, 8, 512, 512, 512, 512]
    - [33, 0.0]
  - - [8, 35, 1, 8, 512, 512, 512, 512]
    - [34, 0.0]
  - - [8, 36, 1, 8, 512, 512, 512, 512]
    - [35, 0.0]
  - - [8, 37, 1, 8, 512, 512, 512, 512]
    - [36, 0.0]
  - - [8, 38, 1, 8, 512, 512, 512, 512]
    - [37, 0.0]
  - - [8, 39, 1, 8, 512, 512, 512, 512]
    - [38, 0.0]
  - - [8, 40, 1, 8, 512, 512, 512, 512]
    - [39, 0.0]
  - - [8, 41, 1, 8, 512, 512, 512, 512]
    - [40, 0.0]
  - - [8, 42, 1, 8, 512, 512, 512, 512]
    - [41, 0.0]
  - - [8, 43, 1, 8, 512, 512, 512, 512]
    - [42, 0.0]
  - - [8, 44, 1, 8, 512, 512, 512, 512]
    - [43, 0.0]
  - - [8, 45, 1, 8, 512, 512, 512, 512]
    - [44, 0.0]
  - - [8, 46, 1, 8, 512, 512, 512, 512]
    - [45, 0.0]
  - - [8, 47, 1, 8, 512, 512, 512, 512]
    - [46, 0.0]
  - - [8, 48, 1, 8, 512, 512, 512, 512]
    - [47, 0.0]
  - - [8, 49, 1, 8, 512, 512, 512, 512]
    - [48, 0.0]
  - - [8, 50, 1, 8, 512, 512, 512, 512]
    - [49, 0.0]
  - - [8, 51, 1, 8, 512, 512, 512, 512]
    - [50, 0.0]
  - - [8, 52, 1, 8, 512, 512, 512, 512]
    - [51, 0.0]
  - - [8, 53, 1, 8, 512, 512, 512, 512]
    - [52, 0.0]
  - - [8, 54, 1, 8, 512, 512, 512, 512]
    - [53, 0.0]
  - - [8, 55, 1, 8, 512, 512, 512, 512]
    - [54, 0.0]
  - - [8, 56, 1, 8, 512, 512, 512, 512]
    - [55, 0.0]
  - - [8, 57, 1, 8, 512, 512, 512, 512]
    - [56, 0.0]
  - - [8, 58, 1, 8, 512, 512, 512, 512]
    - [57, 0.0]
  - - [8, 59, 1, 8, 512, 512, 512, 512]
    - [58, 0.0]
  - - [8, 60, 1, 8, 512, 512, 512, 512]
    - [59, 0.0]
  - - [8, 61, 1, 8, 512, 512, 512, 512]
    - [60, 0.0]
  - - [8, 62, 1, 8, 512, 512, 512, 512]
    - [61, 0.0]
  - - [8, 63, 1, 8, 512, 512, 512, 512]
    - [62, 0.0]
  - - [8, 64, 1, 8, 512, 512, 512, 512]
    - [63, 0.0]
  - - [8, 65, 1, 8, 512, 512, 512, 512]
    - [64, 0.0]
  - - [8, 66, 1, 8, 512, 512, 512, 512]
    - [65, 0.0]
  - - [8, 67, 1, 8, 512, 512, 512, 512]
    - [66, 0.0]
  - - [8, 68, 1, 8, 512, 512, 512, 512]
    - [67, 0.0]
  - - [8, 69, 1, 8, 512, 512, 512, 512]
    - [68, 0.0]
  - - [8, 70, 1, 8, 512, 512, 512, 512]
    - [69, 0.0]
  - - [8, 71, 1, 8, 512, 512, 512, 512]
    - [70, 0.0]
  - - [8, 72, 1, 8, 512, 512, 512, 512]
    - [71, 0.0]
  - - [8, 73, 1, 8, 512, 512, 512, 512]
    - [72, 0.0]
  - - [8, 74, 1, 8, 512, 512, 512, 512]
    - [73, 0.0]
  - - [8, 75, 1, 8, 512, 512, 512, 512]
    - [74, 0.0]
  - - [8, 76, 1, 8, 512, 512, 512, 512]
    - [75, 0.0]
  - - [8, 77, 1, 8, 512, 512, 512, 512]
    - [76, 0.0]
  - - [8, 78, 1, 8, 512, 512, 512, 512]
    - [77, 0.0]
  - - [8, 79, 1, 8, 512, 512, 512, 512]
    - [78, 0.0]
  - - [8, 80, 1, 8, 512, 512, 512, 512]
    - [79, 0.0]
  - - [8, 81, 1, 8, 512, 512, 512, 512]
    - [80, 0.0]
  - - [8, 82, 1, 8, 512, 512, 512, 512]
    - [81, 0.0]
  - - [8, 83, 1, 8, 512, 512, 512, 512]
    - [82, 0.0]
  - - [8, 84, 1, 8, 512, 512, 512, 512]
    - [83, 0.0]
  - - [8, 85, 1, 8, 512, 512, 512, 512]
    - [84, 0.0]
  - - [8, 86, 1, 8, 512, 512, 512, 512]
    - [85, 0.0]
  - - [8, 87, 1, 8, 512, 512, 512, 512]
    - [86, 0.0]
  - - [8, 88, 1, 8, 512, 512, 512, 512]
    - [87, 0.0]
  - - [8, 89, 1, 8, 512, 512, 512, 512]
    - [88, 0.0]
  - - [8, 90, 1, 8, 512, 512, 512, 512]
    - [89, 0.0]
  - - [8, 91, 1, 8, 512, 512, 512, 512]
    - [90, 0.0]
  - - [8, 92, 1, 8, 512, 512, 512, 512]
    - [91, 0.0]
  - - [8, 93, 1, 8, 512, 512, 512, 512]
    - [92, 0.0]
  - - [8, 94, 1, 8, 512, 512, 512, 512]
    - [93, 0.0]
  - - [8, 95, 1, 8, 512, 512, 512, 512]
    - [94, 0.0]
  - - [8, 96, 1, 8, 512, 512, 512, 512]
    - [95, 0.0]
  - - [8, 97, 1, 8, 512, 512, 512, 512]
    - [96, 0.0]
  - - [8, 98, 1, 8, 512, 512, 512, 512]
    - [97, 0.0]
  - - [8, 99, 1, 8, 512, 512, 512, 512]
    - [98, 0.0]
  - - [8, 100, 1, 8, 512, 512, 512, 512]
    - [99, 0.0]
  - - [8, 101, 1, 8, 512, 512, 512, 512]
    - [100, 0.0]
  - - [8, 102, 1, 8, 512, 512, 512, 512]
    - [101, 0.0]
  - - [8, 103, 1, 8, 512, 512, 512, 512]
    - [102, 0.0]
  - - [8, 104, 1, 8, 512, 512, 512, 512]
    - [103, 0.0]
  - - [8, 105, 1, 8, 512, 512, 512, 512]
    - [104, 0.0]
  - - [8, 106, 1, 8, 512, 512, 512, 512]
    - [105, 0.0]
  - - [8, 107, 1, 8, 512, 512, 512, 512]
    - [106, 0.0]
  - - [8, 108, 1, 8, 512, 512, 512, 512]
    - [107, 0.0]
  - - [8, 109, 1, 8, 512, 512, 512, 512]
    - [108, 0.0]
  - - [8, 110, 1, 8, 512, 512, 512, 512]
    - [109, 0.0]
  - - [8, 111, 1, 8, 512, 512, 512, 512]
    - [110, 0.0]
  - - [8, 112, 1, 8, 512, 512, 512, 512]
    - [111, 0.0]
  - - [8, 113, 1, 8, 512, 512, 512, 512]
    - [112, 0.0]
  - - [8, 114, 1, 8, 512, 512, 512, 512]
    - [113, 0.0]
  - - [8, 115, 1, 8, 512, 512, 512, 512]
    - [114, 0.0]
  - - [8, 116, 1, 8, 512, 512, 512, 512]
    - [115, 0.0]
  - - [8, 117, 1, 8, 512, 512, 512, 512]
    - [116, 0.0]
  - - [8, 118, 1, 8, 512, 512, 512, 512]
    - [117, 0.0]
  - - [8, 119, 1, 8, 512, 512, 512, 512]
    - [118, 0.0]
  - - [8, 120, 1, 8, 512, 512, 512, 512]
    - [119, 0.0]
  - - [8, 121, 1, 8, 512, 512, 512, 512]
    - [120, 0.0]
  - - [8, 122, 1, 8, 512, 512, 512, 512]
    - [121, 0.0]
  - - [8, 123, 1, 8, 512, 512, 512, 512]
    - [122, 0.0]
  - - [8, 124, 1, 8, 512, 512, 512, 512]
    - [123, 0.0]
  - - [8, 125, 1, 8, 512, 512, 512, 512]
    - [124, 0.0]
  - - [8, 126, 1, 8, 512, 512, 512, 512]
    - [125, 0.0]
  - - [8, 127, 1, 8, 512, 512, 512, 512]
    - [126, 0.0]
  - - [8, 128, 1, 8, 512, 512, 512, 512]
    - [127, 0.0]
  - - [8, 129, 1, 8, 512, 512, 512, 512]
    - [128, 0.0]
- null
- null
- DeviceEfficiency
- null
- GridBased
