library/src/amd_detail/rocblaslt/src/Tensile/Logic/asm_full/aldebaran/110CU/GridBased/aldebaran_Cijk_Alik_Bljk_HHS_BH_Bias_GG_AH_SDV.yaml
- {MinimumRequiredVersion: 4.33.0}
- aldebaran
- gfx90a
- [Device 0050, Device 0051, Device 0052, Device 0054, Device 0062, Device 7400, Device
    SolutionIndex: 0
    SolutionNameMin: Cijk_Alik_Bljk_HHS_BH_Bias_GG_AH_SDV_MT128x16x32_MI16x16x16x1_SN_1LDSB0_GRVW2_LPA4_LPB4_LRVW4_MIWT2_1_NEPBS2_PLR3_WG64_4_1
    SolutionIndex: 1
    SolutionNameMin: Cijk_Alik_Bljk_HHS_BH_Bias_GG_AH_SDV_MT192x16x32_MI16x16x16x1_SN_1LDSB0_GRVW2_LPA4_LPB4_LRVW4_MIWT3_1_NEPBS2_PLR3_WG64_4_1
    SolutionIndex: 2
    SolutionNameMin: Cijk_Alik_Bljk_HHS_BH_Bias_GG_AH_SDV_MT32x32x32_MI16x16x16x1_SN_1LDSB0_GRVW4_LPA4_LPB4_LRVW4_MIWT1_1_NEPBS2_PLR3_WG32_8_1
    SolutionIndex: 3
    SolutionNameMin: Cijk_Alik_Bljk_HHS_BH_Bias_GG_AH_SDV_MT64x32x32_MI16x16x16x1_SN_1LDSB0_GRVW4_LPA4_LPB4_LRVW4_MIWT2_1_NEPBS2_PLR3_WG32_8_1
    SolutionIndex: 4
    SolutionNameMin: Cijk_Alik_Bljk_HHS_BH_Bias_GG_AH_SDV_MT96x32x32_MI16x16x16x1_SN_1LDSB0_GRVW4_LPA4_LPB4_LRVW4_MIWT3_1_NEPBS2_PLR3_WG32_8_1
    SolutionIndex: 5
    SolutionNameMin: Cijk_Alik_Bljk_HHS_BH_Bias_GG_AH_SDV_MT128x32x32_MI32x32x8x1_SN_1LDSB0_GRVW4_LPA8_LPB8_LRVW8_MIWT1_1_NEPBS2_PLR5_WG128_2_1
    SolutionIndex: 6
    SolutionNameMin: Cijk_Alik_Bljk_HHS_BH_Bias_GG_AH_SDV_MT160x32x32_MI16x16x16x1_SN_1LDSB0_GRVW4_LPA4_LPB4_LRVW4_MIWT5_1_NEPBS2_PLR3_WG32_8_1
    SolutionIndex: 7
    SolutionNameMin: Cijk_Alik_Bljk_HHS_BH_Bias_GG_AH_SDV_MT192x32x32_MI16x16x16x1_SN_1LDSB0_GRVW4_LPA4_LPB4_LRVW4_MIWT6_1_NEPBS2_PLR3_WG32_8_1
    SolutionIndex: 8
    SolutionNameMin: Cijk_Alik_Bljk_HHS_BH_Bias_GG_AH_SDV_MT256x32x32_MI32x32x8x1_SN_1LDSB1_GRVW4_LPA8_LPB8_LRVW8_MIWT2_1_NEPBS2_PLR5_WG128_2_1
    SolutionIndex: 9
    SolutionNameMin: Cijk_Alik_Bljk_HHS_BH_Bias_GG_AH_SDV_MT64x48x32_MI16x16x16x1_SN_1LDSB0_GRVW2_LPA4_LPB4_LRVW4_MIWT1_3_NEPBS2_PLR3_WG64_4_1
    SolutionIndex: 10
    SolutionNameMin: Cijk_Alik_Bljk_HHS_BH_Bias_GG_AH_SDV_MT128x48x32_MI16x16x16x1_SN_1LDSB0_GRVW2_LPA4_LPB4_LRVW4_MIWT2_3_NEPBS2_PLR3_WG64_4_1
    SolutionIndex: 11
    SolutionNameMin: Cijk_Alik_Bljk_HHS_BH_Bias_GG_AH_SDV_MT192x48x32_MI16x16x16x1_SN_1LDSB0_GRVW2_LPA4_LPB4_LRVW4_MIWT3_3_NEPBS2_PLR3_WG64_4_1
    SolutionIndex: 12
    SolutionNameMin: Cijk_Alik_Bljk_HHS_BH_Bias_GG_AH_SDV_MT256x48x32_MI16x16x16x1_SN_1LDSB1_GRVW2_LPA4_LPB4_LRVW4_MIWT4_3_NEPBS2_PLR3_WG64_4_1
    SolutionIndex: 13
    SolutionNameMin: Cijk_Alik_Bljk_HHS_BH_Bias_GG_AH_SDV_MT16x64x32_MI16x16x16x1_SN_1LDSB0_GRVW2_LPA4_LPB4_LRVW4_MIWT1_1_NEPBS2_PLR3_WG16_16_1
    SolutionIndex: 14
    SolutionNameMin: Cijk_Alik_Bljk_HHS_BH_Bias_GG_AH_SDV_MT32x64x32_MI16x16x16x1_SN_1LDSB0_GRVW4_LPA4_LPB4_LRVW4_MIWT2_1_NEPBS2_PLR3_WG16_16_1
    SolutionIndex: 15
    SolutionNameMin: Cijk_Alik_Bljk_HHS_BH_Bias_GG_AH_SDV_MT48x64x32_MI16x16x16x1_SN_1LDSB0_GRVW2_LPA4_LPB4_LRVW4_MIWT3_1_NEPBS2_PLR3_WG16_16_1
    SolutionIndex: 16
    SolutionNameMin: Cijk_Alik_Bljk_HHS_BH_Bias_GG_AH_SDV_MT64x64x32_MI32x32x8x1_SN_1LDSB0_GRVW8_LPA8_LPB8_LRVW8_MIWT1_1_NEPBS2_PLR5_WG64_4_1
    SolutionIndex: 17
    SolutionNameMin: Cijk_Alik_Bljk_HHS_BH_Bias_GG_AH_SDV_MT80x64x32_MI16x16x16x1_SN_1LDSB0_GRVW2_LPA4_LPB4_LRVW4_MIWT5_1_NEPBS2_PLR3_WG16_16_1
    SolutionIndex: 18
    SolutionNameMin: Cijk_Alik_Bljk_HHS_BH_Bias_GG_AH_SDV_MT96x64x32_MI16x16x16x1_SN_1LDSB0_GRVW4_LPA4_LPB4_LRVW4_MIWT6_1_NEPBS2_PLR3_WG16_16_1
    SolutionIndex: 19
    SolutionNameMin: Cijk_Alik_Bljk_HHS_BH_Bias_GG_AH_SDV_MT112x64x32_MI16x16x16x1_SN_1LDSB0_GRVW2_LPA4_LPB4_LRVW4_MIWT7_1_NEPBS2_PLR3_WG16_16_1
    SolutionIndex: 20
    SolutionNameMin: Cijk_Alik_Bljk_HHS_BH_Bias_GG_AH_SDV_MT128x64x32_MI32x32x8x1_SN_1LDSB0_GRVW8_LPA8_LPB8_LRVW8_MIWT2_1_NEPBS2_PLR5_WG64_4_1
    SolutionIndex: 21
    SolutionNameMin: Cijk_Alik_Bljk_HHS_BH_Bias_GG_AH_SDV_MT144x64x32_MI16x16x16x1_SN_1LDSB0_GRVW2_LPA4_LPB4_LRVW4_MIWT9_1_NEPBS2_PLR3_WG16_16_1
    SolutionIndex: 22
    SolutionNameMin: Cijk_Alik_Bljk_HHS_BH_Bias_GG_AH_SDV_MT160x64x32_MI16x16x16x1_SN_1LDSB0_GRVW4_LPA4_LPB4_LRVW4_MIWT10_1_NEPBS2_PLR3_WG16_16_1
    SolutionIndex: 23
    SolutionNameMin: Cijk_Alik_Bljk_HHS_BH_Bias_GG_AH_SDV_MT176x64x32_MI16x16x16x1_SN_1LDSB0_GRVW2_LPA4_LPB4_LRVW4_MIWT11_1_NEPBS2_PLR3_WG16_16_1
    SolutionIndex: 24
    SolutionNameMin: Cijk_Alik_Bljk_HHS_BH_Bias_GG_AH_SDV_MT192x64x32_MI32x32x8x1_SN_1LDSB1_GRVW8_LPA8_LPB8_LRVW8_MIWT3_1_NEPBS2_PLR5_WG64_4_1
    SolutionIndex: 25
    SolutionNameMin: Cijk_Alik_Bljk_HHS_BH_Bias_GG_AH_SDV_MT208x64x32_MI16x16x16x1_SN_1LDSB1_GRVW2_LPA4_LPB4_LRVW4_MIWT13_1_NEPBS2_PLR3_WG16_16_1
    SolutionIndex: 26
    SolutionNameMin: Cijk_Alik_Bljk_HHS_BH_Bias_GG_AH_SDV_MT224x64x32_MI16x16x16x1_SN_1LDSB1_GRVW4_LPA4_LPB4_LRVW4_MIWT14_1_NEPBS2_PLR3_WG16_16_1
    SolutionIndex: 27
    SolutionNameMin: Cijk_Alik_Bljk_HHS_BH_Bias_GG_AH_SDV_MT240x64x32_MI16x16x16x1_SN_1LDSB1_GRVW2_LPA4_LPB4_LRVW4_MIWT15_1_NEPBS2_PLR3_WG16_16_1
    SolutionIndex: 28
    SolutionNameMin: Cijk_Alik_Bljk_HHS_BH_Bias_GG_AH_SDV_MT256x64x32_MI32x32x8x1_SN_1LDSB1_GRVW8_LPA8_LPB8_LRVW8_MIWT2_2_NEPBS2_PLR5_WG128_2_1
    SolutionIndex: 29
    SolutionNameMin: Cijk_Alik_Bljk_HHS_BH_Bias_GG_AH_SDV_MT64x80x32_MI16x16x16x1_SN_1LDSB0_GRVW2_LPA4_LPB4_LRVW4_MIWT1_5_NEPBS2_PLR3_WG64_4_1
    SolutionIndex: 30
    SolutionNameMin: Cijk_Alik_Bljk_HHS_BH_Bias_GG_AH_SDV_MT128x80x32_MI16x16x16x1_SN_1LDSB0_GRVW2_LPA4_LPB4_LRVW4_MIWT2_5_NEPBS2_PLR3_WG64_4_1
    SolutionIndex: 31
    SolutionNameMin: Cijk_Alik_Bljk_HHS_BH_Bias_GG_AH_SDV_MT192x80x32_MI16x16x16x1_SN_1LDSB1_GRVW2_LPA4_LPB4_LRVW4_MIWT3_5_NEPBS2_PLR3_WG64_4_1
    SolutionIndex: 32
    SolutionNameMin: Cijk_Alik_Bljk_HHS_BH_Bias_GG_AH_SDV_MT256x80x32_MI16x16x16x1_SN_1LDSB1_GRVW2_LPA4_LPB4_LRVW4_MIWT4_5_NEPBS2_PLR3_WG64_4_1
    SolutionIndex: 33
    SolutionNameMin: Cijk_Alik_Bljk_HHS_BH_Bias_GG_AH_SDV_MT32x96x32_MI16x16x16x1_SN_1LDSB0_GRVW4_LPA4_LPB4_LRVW4_MIWT1_3_NEPBS2_PLR3_WG32_8_1
    SolutionIndex: 34
    SolutionNameMin: Cijk_Alik_Bljk_HHS_BH_Bias_GG_AH_SDV_MT64x96x32_MI16x16x16x1_SN_1LDSB0_GRVW4_LPA4_LPB4_LRVW4_MIWT2_3_NEPBS2_PLR3_WG32_8_1
    SolutionIndex: 35
    SolutionNameMin: Cijk_Alik_Bljk_HHS_BH_Bias_GG_AH_SDV_MT96x96x32_MI16x16x16x1_SN_1LDSB0_GRVW4_LPA4_LPB4_LRVW4_MIWT3_3_NEPBS2_PLR3_WG32_8_1
    SolutionIndex: 36
    SolutionNameMin: Cijk_Alik_Bljk_HHS_BH_Bias_GG_AH_SDV_MT128x96x32_MI32x32x8x1_SN_1LDSB0_GRVW4_LPA8_LPB8_LRVW8_MIWT1_3_NEPBS2_PLR5_WG128_2_1
    SolutionIndex: 37
    SolutionNameMin: Cijk_Alik_Bljk_HHS_BH_Bias_GG_AH_SDV_MT160x96x32_MI16x16x16x1_SN_1LDSB1_GRVW4_LPA4_LPB4_LRVW4_MIWT5_3_NEPBS2_PLR3_WG32_8_1
    SolutionIndex: 38
    SolutionNameMin: Cijk_Alik_Bljk_HHS_BH_Bias_GG_AH_SDV_MT192x96x32_MI16x16x16x1_SN_1LDSB1_GRVW4_LPA4_LPB4_LRVW4_MIWT6_3_NEPBS2_PLR3_WG32_8_1
    SolutionIndex: 39
    SolutionNameMin: Cijk_Alik_Bljk_HHS_BH_Bias_GG_AH_SDV_MT224x96x32_MI16x16x16x1_SN_1LDSB1_GRVW4_LPA4_LPB4_LRVW4_MIWT7_3_NEPBS2_PLR3_WG32_8_1
    SolutionIndex: 40
    SolutionNameMin: Cijk_Alik_Bljk_HHS_BH_Bias_GG_AH_SDV_MT256x96x32_MI32x32x8x1_SN_1LDSB1_GRVW4_LPA8_LPB8_LRVW8_MIWT2_3_NEPBS2_PLR5_WG128_2_1
    SolutionIndex: 41
    SolutionNameMin: Cijk_Alik_Bljk_HHS_BH_Bias_GG_AH_SDV_MT64x112x32_MI16x16x16x1_SN_1LDSB0_GRVW2_LPA4_LPB4_LRVW4_MIWT1_7_NEPBS2_PLR3_WG64_4_1
    SolutionIndex: 42
    SolutionNameMin: Cijk_Alik_Bljk_HHS_BH_Bias_GG_AH_SDV_MT128x112x32_MI16x16x16x1_SN_1LDSB0_GRVW2_LPA4_LPB4_LRVW4_MIWT2_7_NEPBS2_PLR3_WG64_4_1
    SolutionIndex: 43
    SolutionNameMin: Cijk_Alik_Bljk_HHS_BH_Bias_GG_AH_SDV_MT192x112x32_MI16x16x16x1_SN_1LDSB1_GRVW2_LPA4_LPB4_LRVW4_MIWT3_7_NEPBS2_PLR3_WG64_4_1
    SolutionIndex: 44
    SolutionNameMin: Cijk_Alik_Bljk_HHS_BH_Bias_GG_AH_SDV_MT256x112x32_MI16x16x16x1_SN_1LDSB1_GRVW2_LPA4_LPB4_LRVW4_MIWT4_7_NEPBS2_PLR3_WG64_4_1
    SolutionIndex: 45
    SolutionNameMin: Cijk_Alik_Bljk_HHS_BH_Bias_GG_AH_SDV_MT16x128x32_MI16x16x16x1_SN_1LDSB0_GRVW2_LPA4_LPB4_LRVW4_MIWT1_2_NEPBS2_PLR3_WG16_16_1
    SolutionIndex: 46
    SolutionNameMin: Cijk_Alik_Bljk_HHS_BH_Bias_GG_AH_SDV_MT32x128x32_MI32x32x8x1_SN_1LDSB0_GRVW4_LPA8_LPB8_LRVW8_MIWT1_1_NEPBS2_PLR5_WG32_8_1
    SolutionIndex: 47
    SolutionNameMin: Cijk_Alik_Bljk_HHS_BH_Bias_GG_AH_SDV_MT48x128x32_MI16x16x16x1_SN_1LDSB0_GRVW2_LPA4_LPB4_LRVW4_MIWT3_2_NEPBS2_PLR3_WG16_16_1
    SolutionIndex: 48
    SolutionNameMin: Cijk_Alik_Bljk_HHS_BH_Bias_GG_AH_SDV_MT64x128x32_MI32x32x8x1_SN_1LDSB0_GRVW8_LPA8_LPB8_LRVW8_MIWT2_1_NEPBS2_PLR5_WG32_8_1
    SolutionIndex: 49
    SolutionNameMin: Cijk_Alik_Bljk_HHS_BH_Bias_GG_AH_SDV_MT80x128x32_MI16x16x16x1_SN_1LDSB0_GRVW2_LPA4_LPB4_LRVW4_MIWT5_2_NEPBS2_PLR3_WG16_16_1
    SolutionIndex: 50
    SolutionNameMin: Cijk_Alik_Bljk_HHS_BH_Bias_GG_AH_SDV_MT96x128x32_MI32x32x8x1_SN_1LDSB0_GRVW4_LPA8_LPB8_LRVW8_MIWT3_1_NEPBS2_PLR5_WG32_8_1
    SolutionIndex: 51
    SolutionNameMin: Cijk_Alik_Bljk_HHS_BH_Bias_GG_AH_SDV_MT112x128x32_MI16x16x16x1_SN_1LDSB0_GRVW2_LPA4_LPB4_LRVW4_MIWT7_2_NEPBS2_PLR3_WG16_16_1
    SolutionIndex: 52
    SolutionNameMin: Cijk_Alik_Bljk_HHS_BH_Bias_GG_AH_SDV_MT128x128x32_MI32x32x8x1_SN_1LDSB1_GRVW8_LPA8_LPB8_LRVW8_MIWT2_2_NEPBS2_PLR5_WG64_4_1
    SolutionIndex: 53
    SolutionNameMin: Cijk_Alik_Bljk_HHS_BH_Bias_GG_AH_SDV_MT144x128x32_MI16x16x16x1_SN_1LDSB1_GRVW2_LPA4_LPB4_LRVW4_MIWT9_2_NEPBS2_PLR3_WG16_16_1
    SolutionIndex: 54
    SolutionNameMin: Cijk_Alik_Bljk_HHS_BH_Bias_GG_AH_SDV_MT160x128x32_MI32x32x8x1_SN_1LDSB1_GRVW4_LPA8_LPB8_LRVW8_MIWT5_1_NEPBS2_PLR5_WG32_8_1
    SolutionIndex: 55
    SolutionNameMin: Cijk_Alik_Bljk_HHS_BH_Bias_GG_AH_SDV_MT176x128x32_MI16x16x16x1_SN_1LDSB1_GRVW2_LPA4_LPB4_LRVW4_MIWT11_2_NEPBS2_PLR3_WG16_16_1
    SolutionIndex: 56
    SolutionNameMin: Cijk_Alik_Bljk_HHS_BH_Bias_GG_AH_SDV_MT192x128x32_MI32x32x8x1_SN_1LDSB1_GRVW8_LPA8_LPB8_LRVW8_MIWT6_1_NEPBS2_PLR5_WG32_8_1
    SolutionIndex: 57
    SolutionNameMin: Cijk_Alik_Bljk_HHS_BH_Bias_GG_AH_SDV_MT208x128x32_MI16x16x16x1_SN_1LDSB1_GRVW2_LPA4_LPB4_LRVW4_MIWT13_2_NEPBS2_PLR3_WG16_16_1
    SolutionIndex: 58
    SolutionNameMin: Cijk_Alik_Bljk_HHS_BH_Bias_GG_AH_SDV_MT224x128x32_MI32x32x8x1_SN_1LDSB1_GRVW4_LPA8_LPB8_LRVW8_MIWT7_1_NEPBS2_PLR5_WG32_8_1
    SolutionIndex: 59
    SolutionNameMin: Cijk_Alik_Bljk_HHS_BH_Bias_GG_AH_SDV_MT240x128x32_MI16x16x16x1_SN_1LDSB1_GRVW2_LPA4_LPB4_LRVW4_MIWT15_2_NEPBS2_PLR3_WG16_16_1
    SolutionIndex: 60
    SolutionNameMin: Cijk_Alik_Bljk_HHS_BH_Bias_GG_AH_SDV_MT256x128x32_MI32x32x8x1_SN_1LDSB1_GRVW8_LPA8_LPB8_LRVW8_MIWT4_2_NEPBS2_PLR5_WG64_4_1
    SolutionIndex: 61
    SolutionNameMin: Cijk_Alik_Bljk_HHS_BH_Bias_GG_AH_SDV_MT64x144x32_MI16x16x16x1_SN_1LDSB0_GRVW2_LPA4_LPB4_LRVW4_MIWT1_9_NEPBS2_PLR3_WG64_4_1
    SolutionIndex: 62
    SolutionNameMin: Cijk_Alik_Bljk_HHS_BH_Bias_GG_AH_SDV_MT128x144x32_MI16x16x16x1_SN_1LDSB1_GRVW2_LPA4_LPB4_LRVW4_MIWT2_9_NEPBS2_PLR3_WG64_4_1
    SolutionIndex: 63
    SolutionNameMin: Cijk_Alik_Bljk_HHS_BH_Bias_GG_AH_SDV_MT192x144x32_MI16x16x16x1_SN_1LDSB1_GRVW2_LPA4_LPB4_LRVW4_MIWT3_9_NEPBS2_PLR3_WG64_4_1
    SolutionIndex: 64
    SolutionNameMin: Cijk_Alik_Bljk_HHS_BH_Bias_GG_AH_SDV_MT256x144x32_MI16x16x16x1_SN_1LDSB0_GRVW2_LPA4_LPB4_LRVW4_MIWT4_9_NEPBS0_PLR3_WG64_4_1
    SolutionIndex: 65
    SolutionNameMin: Cijk_Alik_Bljk_HHS_BH_Bias_GG_AH_SDV_MT32x160x32_MI16x16x16x1_SN_1LDSB0_GRVW4_LPA4_LPB4_LRVW4_MIWT1_5_NEPBS2_PLR3_WG32_8_1
    SolutionIndex: 66
    SolutionNameMin: Cijk_Alik_Bljk_HHS_BH_Bias_GG_AH_SDV_MT64x160x32_MI16x16x16x1_SN_1LDSB0_GRVW4_LPA4_LPB4_LRVW4_MIWT2_5_NEPBS2_PLR3_WG32_8_1
    SolutionIndex: 67
    SolutionNameMin: Cijk_Alik_Bljk_HHS_BH_Bias_GG_AH_SDV_MT96x160x32_MI16x16x16x1_SN_1LDSB1_GRVW4_LPA4_LPB4_LRVW4_MIWT3_5_NEPBS2_PLR3_WG32_8_1
    SolutionIndex: 68
    SolutionNameMin: Cijk_Alik_Bljk_HHS_BH_Bias_GG_AH_SDV_MT128x160x32_MI32x32x8x1_SN_1LDSB1_GRVW4_LPA8_LPB8_LRVW8_MIWT1_5_NEPBS2_PLR5_WG128_2_1
    SolutionIndex: 69
    SolutionNameMin: Cijk_Alik_Bljk_HHS_BH_Bias_GG_AH_SDV_MT160x160x32_MI16x16x16x1_SN_1LDSB1_GRVW4_LPA4_LPB4_LRVW4_MIWT5_5_NEPBS2_PLR3_WG32_8_1
    SolutionIndex: 70
    SolutionNameMin: Cijk_Alik_Bljk_HHS_BH_Bias_GG_AH_SDV_MT192x160x32_MI16x16x16x1_SN_1LDSB1_GRVW4_LPA4_LPB4_LRVW4_MIWT6_5_NEPBS2_PLR3_WG32_8_1
    SolutionIndex: 71
    SolutionNameMin: Cijk_Alik_Bljk_HHS_BH_Bias_GG_AH_SDV_MT224x160x32_MI16x16x16x1_SN_1LDSB0_GRVW4_LPA4_LPB4_LRVW4_MIWT7_5_NEPBS0_PLR3_WG32_8_1
    SolutionIndex: 72
    SolutionNameMin: Cijk_Alik_Bljk_HHS_BH_Bias_GG_AH_SDV_MT256x160x32_MI32x32x8x1_SN_1LDSB0_GRVW4_LPA8_LPB8_LRVW8_MIWT2_5_NEPBS0_PLR5_WG128_2_1
    SolutionIndex: 73
    SolutionNameMin: Cijk_Alik_Bljk_HHS_BH_Bias_GG_AH_SDV_MT64x176x32_MI16x16x16x1_SN_1LDSB0_GRVW2_LPA4_LPB4_LRVW4_MIWT1_11_NEPBS2_PLR3_WG64_4_1
    SolutionIndex: 74
    SolutionNameMin: Cijk_Alik_Bljk_HHS_BH_Bias_GG_AH_SDV_MT128x176x32_MI16x16x16x1_SN_1LDSB1_GRVW2_LPA4_LPB4_LRVW4_MIWT2_11_NEPBS2_PLR3_WG64_4_1
    SolutionIndex: 75
    SolutionNameMin: Cijk_Alik_Bljk_HHS_BH_Bias_GG_AH_SDV_MT192x176x32_MI16x16x16x1_SN_1LDSB0_GRVW2_LPA4_LPB4_LRVW4_MIWT3_11_NEPBS0_PLR3_WG64_4_1
    SolutionIndex: 76
    SolutionNameMin: Cijk_Alik_Bljk_HHS_BH_Bias_GG_AH_SDV_MT256x176x32_MI16x16x16x1_SN_1LDSB0_GRVW2_LPA4_LPB4_LRVW4_MIWT4_11_NEPBS0_PLR3_WG64_4_1
    SolutionIndex: 77
    SolutionNameMin: Cijk_Alik_Bljk_HHS_BH_Bias_GG_AH_SDV_MT16x192x32_MI16x16x16x1_SN_1LDSB0_GRVW2_LPA4_LPB4_LRVW4_MIWT1_3_NEPBS2_PLR3_WG16_16_1
    SolutionIndex: 78
    SolutionNameMin: Cijk_Alik_Bljk_HHS_BH_Bias_GG_AH_SDV_MT32x192x32_MI16x16x16x1_SN_1LDSB0_GRVW4_LPA4_LPB4_LRVW4_MIWT2_3_NEPBS2_PLR3_WG16_16_1
    SolutionIndex: 79
    SolutionNameMin: Cijk_Alik_Bljk_HHS_BH_Bias_GG_AH_SDV_MT48x192x32_MI16x16x16x1_SN_1LDSB0_GRVW2_LPA4_LPB4_LRVW4_MIWT3_3_NEPBS2_PLR3_WG16_16_1
    SolutionIndex: 80
    SolutionNameMin: Cijk_Alik_Bljk_HHS_BH_Bias_GG_AH_SDV_MT64x192x32_MI32x32x8x1_SN_1LDSB1_GRVW8_LPA8_LPB8_LRVW8_MIWT1_3_NEPBS2_PLR5_WG64_4_1
    SolutionIndex: 81
    SolutionNameMin: Cijk_Alik_Bljk_HHS_BH_Bias_GG_AH_SDV_MT80x192x32_MI16x16x16x1_SN_1LDSB1_GRVW2_LPA4_LPB4_LRVW4_MIWT5_3_NEPBS2_PLR3_WG16_16_1
    SolutionIndex: 82
    SolutionNameMin: Cijk_Alik_Bljk_HHS_BH_Bias_GG_AH_SDV_MT96x192x32_MI16x16x16x1_SN_1LDSB1_GRVW4_LPA4_LPB4_LRVW4_MIWT6_3_NEPBS2_PLR3_WG16_16_1
    SolutionIndex: 83
    SolutionNameMin: Cijk_Alik_Bljk_HHS_BH_Bias_GG_AH_SDV_MT112x192x32_MI16x16x16x1_SN_1LDSB1_GRVW2_LPA4_LPB4_LRVW4_MIWT7_3_NEPBS2_PLR3_WG16_16_1
    SolutionIndex: 84
    SolutionNameMin: Cijk_Alik_Bljk_HHS_BH_Bias_GG_AH_SDV_MT128x192x32_MI32x32x8x1_SN_1LDSB1_GRVW8_LPA8_LPB8_LRVW8_MIWT2_3_NEPBS2_PLR5_WG64_4_1
    SolutionIndex: 85
    SolutionNameMin: Cijk_Alik_Bljk_HHS_BH_Bias_GG_AH_SDV_MT144x192x32_MI16x16x16x1_SN_1LDSB1_GRVW2_LPA4_LPB4_LRVW4_MIWT9_3_NEPBS2_PLR3_WG16_16_1
    SolutionIndex: 86
    SolutionNameMin: Cijk_Alik_Bljk_HHS_BH_Bias_GG_AH_SDV_MT160x192x32_MI16x16x16x1_SN_1LDSB1_GRVW4_LPA4_LPB4_LRVW4_MIWT10_3_NEPBS2_PLR3_WG16_16_1
    SolutionIndex: 87
    SolutionNameMin: Cijk_Alik_Bljk_HHS_BH_Bias_GG_AH_SDV_MT176x192x32_MI16x16x16x1_SN_1LDSB0_GRVW2_LPA4_LPB4_LRVW4_MIWT11_3_NEPBS0_PLR3_WG16_16_1
    SolutionIndex: 88
    SolutionNameMin: Cijk_Alik_Bljk_HHS_BH_Bias_GG_AH_SDV_MT192x192x32_MI32x32x8x1_SN_1LDSB0_GRVW8_LPA8_LPB8_LRVW8_MIWT3_3_NEPBS0_PLR5_WG64_4_1
    SolutionIndex: 89
    SolutionNameMin: Cijk_Alik_Bljk_HHS_BH_Bias_GG_AH_SDV_MT208x192x32_MI16x16x16x1_SN_1LDSB0_GRVW2_LPA4_LPB4_LRVW4_MIWT13_3_NEPBS0_PLR3_WG16_16_1
    SolutionIndex: 90
    SolutionNameMin: Cijk_Alik_Bljk_HHS_BH_Bias_GG_AH_SDV_MT224x192x32_MI16x16x16x1_SN_1LDSB0_GRVW4_LPA4_LPB4_LRVW4_MIWT7_6_NEPBS0_PLR3_WG32_8_1
    SolutionIndex: 91
    SolutionNameMin: Cijk_Alik_Bljk_HHS_BH_Bias_GG_AH_SDV_MT240x192x32_MI16x16x16x1_SN_1LDSB0_GRVW2_LPA4_LPB4_LRVW4_MIWT15_3_NEPBS0_PLR3_WG16_16_1
    SolutionIndex: 92
    SolutionNameMin: Cijk_Alik_Bljk_HHS_BH_Bias_GG_AH_SDV_MT256x192x32_MI32x32x8x1_SN_1LDSB0_GRVW8_LPA8_LPB8_LRVW8_MIWT2_6_NEPBS0_PLR5_WG128_2_1
    SolutionIndex: 93
    SolutionNameMin: Cijk_Alik_Bljk_HHS_BH_Bias_GG_AH_SDV_MT64x208x32_MI16x16x16x1_SN_1LDSB1_GRVW2_LPA4_LPB4_LRVW4_MIWT1_13_NEPBS2_PLR3_WG64_4_1
    SolutionIndex: 94
    SolutionNameMin: Cijk_Alik_Bljk_HHS_BH_Bias_GG_AH_SDV_MT128x208x32_MI16x16x16x1_SN_1LDSB1_GRVW2_LPA4_LPB4_LRVW4_MIWT2_13_NEPBS2_PLR3_WG64_4_1
    SolutionIndex: 95
    SolutionNameMin: Cijk_Alik_Bljk_HHS_BH_Bias_GG_AH_SDV_MT192x208x32_MI16x16x16x1_SN_1LDSB0_GRVW2_LPA4_LPB4_LRVW4_MIWT3_13_NEPBS0_PLR3_WG64_4_1
    SolutionIndex: 96
    SolutionNameMin: Cijk_Alik_Bljk_HHS_BH_Bias_GG_AH_SDV_MT256x208x32_MI16x16x16x1_SN_1LDSB0_GRVW2_LPA4_LPB4_LRVW4_MIWT4_13_NEPBS0_PLR3_WG64_4_1
    SolutionIndex: 97
    SolutionNameMin: Cijk_Alik_Bljk_HHS_BH_Bias_GG_AH_SDV_MT64x224x32_MI16x16x16x1_SN_1LDSB1_GRVW4_LPA4_LPB4_LRVW4_MIWT2_7_NEPBS2_PLR3_WG32_8_1
    SolutionIndex: 98
    SolutionNameMin: Cijk_Alik_Bljk_HHS_BH_Bias_GG_AH_SDV_MT96x224x32_MI16x16x16x1_SN_1LDSB1_GRVW4_LPA4_LPB4_LRVW4_MIWT3_7_NEPBS2_PLR3_WG32_8_1
    SolutionIndex: 99
    SolutionNameMin: Cijk_Alik_Bljk_HHS_BH_Bias_GG_AH_SDV_MT128x224x32_MI32x32x8x1_SN_1LDSB1_GRVW4_LPA8_LPB8_LRVW8_MIWT1_7_NEPBS2_PLR5_WG128_2_1
    SolutionIndex: 100
    SolutionNameMin: Cijk_Alik_Bljk_HHS_BH_Bias_GG_AH_SDV_MT160x224x32_MI16x16x16x1_SN_1LDSB0_GRVW4_LPA4_LPB4_LRVW4_MIWT5_7_NEPBS0_PLR3_WG32_8_1
    SolutionIndex: 101
    SolutionNameMin: Cijk_Alik_Bljk_HHS_BH_Bias_GG_AH_SDV_MT192x224x32_MI16x16x16x1_SN_1LDSB0_GRVW4_LPA4_LPB4_LRVW4_MIWT3_14_NEPBS0_PLR3_WG64_4_1
    SolutionIndex: 102
    SolutionNameMin: Cijk_Alik_Bljk_HHS_BH_Bias_GG_AH_SDV_MT224x224x32_MI16x16x16x1_SN_1LDSB0_GRVW4_LPA4_LPB4_LRVW4_MIWT7_7_NEPBS0_PLR3_WG32_8_1
    SolutionIndex: 103
    SolutionNameMin: Cijk_Alik_Bljk_HHS_BH_Bias_GG_AH_SDV_MT256x224x32_MI32x32x8x1_SN_1LDSB1_GRVW4_LPA8_LPB8_LRVW8_MIWT2_7_NEPBS0_PLR5_WG128_2_1
    SolutionIndex: 104
    SolutionNameMin: Cijk_Alik_Bljk_HHS_BH_Bias_GG_AH_SDV_MT64x240x32_MI16x16x16x1_SN_1LDSB1_GRVW2_LPA4_LPB4_LRVW4_MIWT1_15_NEPBS2_PLR3_WG64_4_1
    SolutionIndex: 105
    SolutionNameMin: Cijk_Alik_Bljk_HHS_BH_Bias_GG_AH_SDV_MT128x240x32_MI16x16x16x1_SN_1LDSB1_GRVW2_LPA4_LPB4_LRVW4_MIWT2_15_NEPBS2_PLR3_WG64_4_1
    SolutionIndex: 106
    SolutionNameMin: Cijk_Alik_Bljk_HHS_BH_Bias_GG_AH_SDV_MT192x240x32_MI16x16x16x1_SN_1LDSB0_GRVW2_LPA4_LPB4_LRVW4_MIWT3_15_NEPBS0_PLR3_WG64_4_1
    SolutionIndex: 107
    SolutionNameMin: Cijk_Alik_Bljk_HHS_BH_Bias_GG_AH_SDV_MT256x240x32_MI16x16x16x1_SN_1LDSB1_GRVW2_LPA4_LPB4_LRVW4_MIWT4_15_NEPBS0_PLR3_WG64_4_1
    SolutionIndex: 108
    SolutionNameMin: Cijk_Alik_Bljk_HHS_BH_Bias_GG_AH_SDV_MT32x256x32_MI32x32x8x1_SN_1LDSB1_GRVW4_LPA8_LPB8_LRVW8_MIWT1_2_NEPBS2_PLR5_WG32_8_1
    SolutionIndex: 109
    SolutionNameMin: Cijk_Alik_Bljk_HHS_BH_Bias_GG_AH_SDV_MT48x256x32_MI16x16x16x1_SN_1LDSB1_GRVW2_LPA4_LPB4_LRVW4_MIWT3_4_NEPBS2_PLR3_WG16_16_1
    SolutionIndex: 110
    SolutionNameMin: Cijk_Alik_Bljk_HHS_BH_Bias_GG_AH_SDV_MT64x256x32_MI32x32x8x1_SN_1LDSB1_GRVW8_LPA8_LPB8_LRVW8_MIWT2_2_NEPBS2_PLR5_WG32_8_1
    SolutionIndex: 111
    SolutionNameMin: Cijk_Alik_Bljk_HHS_BH_Bias_GG_AH_SDV_MT80x256x32_MI16x16x16x1_SN_1LDSB1_GRVW2_LPA4_LPB4_LRVW4_MIWT5_4_NEPBS2_PLR3_WG16_16_1
    SolutionIndex: 112
    SolutionNameMin: Cijk_Alik_Bljk_HHS_BH_Bias_GG_AH_SDV_MT96x256x32_MI32x32x8x1_SN_1LDSB1_GRVW4_LPA8_LPB8_LRVW8_MIWT3_2_NEPBS2_PLR5_WG32_8_1
    SolutionIndex: 113
    SolutionNameMin: Cijk_Alik_Bljk_HHS_BH_Bias_GG_AH_SDV_MT112x256x32_MI16x16x16x1_SN_1LDSB1_GRVW2_LPA4_LPB4_LRVW4_MIWT7_4_NEPBS2_PLR3_WG16_16_1
    SolutionIndex: 114
    SolutionNameMin: Cijk_Alik_Bljk_HHS_BH_Bias_GG_AH_SDV_MT128x256x32_MI32x32x8x1_SN_1LDSB1_GRVW8_LPA8_LPB8_LRVW8_MIWT2_4_NEPBS2_PLR5_WG64_4_1
    SolutionIndex: 115
    SolutionNameMin: Cijk_Alik_Bljk_HHS_BH_Bias_GG_AH_SDV_MT144x256x32_MI16x16x16x1_SN_1LDSB0_GRVW2_LPA4_LPB4_LRVW4_MIWT9_4_NEPBS0_PLR3_WG16_16_1
    SolutionIndex: 116
    SolutionNameMin: Cijk_Alik_Bljk_HHS_BH_Bias_GG_AH_SDV_MT160x256x32_MI32x32x8x1_SN_1LDSB0_GRVW4_LPA8_LPB8_LRVW8_MIWT5_2_NEPBS0_PLR5_WG32_8_1
    SolutionIndex: 117
    SolutionNameMin: Cijk_Alik_Bljk_HHS_BH_Bias_GG_AH_SDV_MT176x256x32_MI16x16x16x1_SN_1LDSB0_GRVW2_LPA4_LPB4_LRVW4_MIWT11_4_NEPBS0_PLR3_WG16_16_1
    SolutionIndex: 118
    SolutionNameMin: Cijk_Alik_Bljk_HHS_BH_Bias_GG_AH_SDV_MT192x256x32_MI32x32x8x1_SN_1LDSB0_GRVW8_LPA8_LPB8_LRVW8_MIWT3_4_NEPBS0_PLR5_WG64_4_1
    SolutionIndex: 119
    SolutionNameMin: Cijk_Alik_Bljk_HHS_BH_Bias_GG_AH_SDV_MT208x256x32_MI16x16x16x1_SN_1LDSB0_GRVW2_LPA4_LPB4_LRVW4_MIWT13_4_NEPBS0_PLR3_WG16_16_1
    SolutionIndex: 120
    SolutionNameMin: Cijk_Alik_Bljk_HHS_BH_Bias_GG_AH_SDV_MT224x256x32_MI32x32x8x1_SN_1LDSB1_GRVW4_LPA8_LPB8_LRVW8_MIWT7_2_NEPBS0_PLR5_WG32_8_1
    SolutionIndex: 121
    SolutionNameMin: Cijk_Alik_Bljk_HHS_BH_Bias_GG_AH_SDV_MT240x256x32_MI16x16x16x1_SN_1LDSB1_GRVW2_LPA4_LPB4_LRVW4_MIWT15_4_NEPBS0_PLR3_WG16_16_1
    SolutionIndex: 122
    SolutionNameMin: Cijk_Alik_Bljk_HHS_BH_Bias_GG_AH_SDV_MT256x256x32_MI32x32x8x1_SN_1LDSB1_GRVW8_LPA8_LPB8_LRVW8_MIWT2_8_NEPBS0_PLR5_WG128_2_1
    SolutionIndex: 123
    SolutionNameMin: Cijk_Alik_Bljk_HHS_BH_Bias_GG_AH_SDV_MT128x16x64_MI16x16x16x1_SN_1LDSB1_GRVW4_LPA16_LPB16_LRVW8_MIWT2_1_NEPBS2_PLR5_WG64_4_1
    SolutionIndex: 124
    SolutionNameMin: Cijk_Alik_Bljk_HHS_BH_Bias_GG_AH_SDV_MT192x16x64_MI16x16x16x1_SN_1LDSB1_GRVW4_LPA16_LPB16_LRVW8_MIWT3_1_NEPBS0_PLR5_WG64_4_1
    SolutionIndex: 125
    SolutionNameMin: Cijk_Alik_Bljk_HHS_BH_Bias_GG_AH_SDV_MT256x16x64_MI16x16x16x1_SN_1LDSB1_GRVW4_LPA16_LPB16_LRVW8_MIWT4_1_NEPBS0_PLR5_WG64_4_1
    SolutionIndex: 126
    SolutionNameMin: Cijk_Alik_Bljk_HHS_BH_Bias_GG_AH_SDV_MT32x32x64_MI16x16x16x1_SN_1LDSB0_GRVW8_LPA16_LPB16_LRVW8_MIWT1_1_NEPBS2_PLR5_WG32_8_1
    SolutionIndex: 127
    SolutionNameMin: Cijk_Alik_Bljk_HHS_BH_Bias_GG_AH_SDV_MT64x32x64_MI16x16x16x1_SN_1LDSB0_GRVW8_LPA16_LPB16_LRVW8_MIWT2_1_NEPBS2_PLR5_WG32_8_1
    SolutionIndex: 128
    SolutionNameMin: Cijk_Alik_Bljk_HHS_BH_Bias_GG_AH_SDV_MT96x32x64_MI16x16x16x1_SN_1LDSB1_GRVW8_LPA16_LPB16_LRVW8_MIWT3_1_NEPBS2_PLR5_WG32_8_1
    SolutionIndex: 129
    SolutionNameMin: Cijk_Alik_Bljk_HHS_BH_Bias_GG_AH_SDV_MT128x32x64_MI32x32x8x1_SN_1LDSB0_GRVW8_LPA8_LPB8_LRVW8_MIWT1_1_NEPBS0_PLR9_WG128_2_1
    SolutionIndex: 130
    SolutionNameMin: Cijk_Alik_Bljk_HHS_BH_Bias_GG_AH_SDV_MT160x32x64_MI16x16x16x1_SN_1LDSB1_GRVW8_LPA16_LPB16_LRVW8_MIWT5_1_NEPBS2_PLR5_WG32_8_1
    SolutionIndex: 131
    SolutionNameMin: Cijk_Alik_Bljk_HHS_BH_Bias_GG_AH_SDV_MT192x32x64_MI16x16x16x1_SN_1LDSB1_GRVW8_LPA16_LPB16_LRVW8_MIWT6_1_NEPBS0_PLR5_WG32_8_1
    SolutionIndex: 132
    SolutionNameMin: Cijk_Alik_Bljk_HHS_BH_Bias_GG_AH_SDV_MT224x32x64_MI16x16x16x1_SN_1LDSB1_GRVW8_LPA16_LPB16_LRVW8_MIWT7_1_NEPBS0_PLR5_WG32_8_1
    SolutionIndex: 133
    SolutionNameMin: Cijk_Alik_Bljk_HHS_BH_Bias_GG_AH_SDV_MT256x32x64_MI32x32x8x1_SN_1LDSB1_GRVW8_LPA8_LPB8_LRVW8_MIWT2_1_NEPBS0_PLR9_WG128_2_1
    SolutionIndex: 134
    SolutionNameMin: Cijk_Alik_Bljk_HHS_BH_Bias_GG_AH_SDV_MT64x48x64_MI16x16x16x1_SN_1LDSB1_GRVW4_LPA16_LPB16_LRVW8_MIWT1_3_NEPBS2_PLR5_WG64_4_1
    SolutionIndex: 135
    SolutionNameMin: Cijk_Alik_Bljk_HHS_BH_Bias_GG_AH_SDV_MT128x48x64_MI16x16x16x1_SN_1LDSB1_GRVW4_LPA16_LPB16_LRVW8_MIWT2_3_NEPBS2_PLR5_WG64_4_1
    SolutionIndex: 136
    SolutionNameMin: Cijk_Alik_Bljk_HHS_BH_Bias_GG_AH_SDV_MT192x48x64_MI16x16x16x1_SN_1LDSB1_GRVW4_LPA16_LPB16_LRVW8_MIWT3_3_NEPBS0_PLR5_WG64_4_1
    SolutionIndex: 137
    SolutionNameMin: Cijk_Alik_Bljk_HHS_BH_Bias_GG_AH_SDV_MT256x48x64_MI16x16x16x1_SN_1LDSB1_GRVW4_LPA16_LPB16_LRVW8_MIWT4_3_NEPBS0_PLR5_WG64_4_1
    SolutionIndex: 138
    SolutionNameMin: Cijk_Alik_Bljk_HHS_BH_Bias_GG_AH_SDV_MT16x64x64_MI16x16x16x1_SN_1LDSB0_GRVW4_LPA16_LPB16_LRVW8_MIWT1_1_NEPBS2_PLR5_WG16_16_1
    SolutionIndex: 139
    SolutionNameMin: Cijk_Alik_Bljk_HHS_BH_Bias_GG_AH_SDV_MT32x64x64_MI16x16x16x1_SN_1LDSB0_GRVW8_LPA16_LPB16_LRVW8_MIWT2_1_NEPBS2_PLR5_WG16_16_1
    SolutionIndex: 140
    SolutionNameMin: Cijk_Alik_Bljk_HHS_BH_Bias_GG_AH_SDV_MT48x64x64_MI16x16x16x1_SN_1LDSB1_GRVW4_LPA16_LPB16_LRVW8_MIWT3_1_NEPBS2_PLR5_WG16_16_1
    SolutionIndex: 141
    SolutionNameMin: Cijk_Alik_Bljk_HHS_BH_Bias_GG_AH_SDV_MT64x64x64_MI32x32x8x1_SN_1LDSB0_GRVW8_LPA8_LPB8_LRVW8_MIWT1_1_NEPBS0_PLR9_WG64_4_1
    SolutionIndex: 142
    SolutionNameMin: Cijk_Alik_Bljk_HHS_BH_Bias_GG_AH_SDV_MT80x64x64_MI16x16x16x1_SN_1LDSB1_GRVW4_LPA16_LPB16_LRVW8_MIWT5_1_NEPBS2_PLR5_WG16_16_1
    SolutionIndex: 143
    SolutionNameMin: Cijk_Alik_Bljk_HHS_BH_Bias_GG_AH_SDV_MT96x64x64_MI16x16x16x1_SN_1LDSB1_GRVW8_LPA16_LPB16_LRVW8_MIWT6_1_NEPBS2_PLR5_WG16_16_1
    SolutionIndex: 144
    SolutionNameMin: Cijk_Alik_Bljk_HHS_BH_Bias_GG_AH_SDV_MT112x64x64_MI16x16x16x1_SN_1LDSB1_GRVW4_LPA16_LPB16_LRVW8_MIWT7_1_NEPBS2_PLR5_WG16_16_1
    SolutionIndex: 145
    SolutionNameMin: Cijk_Alik_Bljk_HHS_BH_Bias_GG_AH_SDV_MT128x64x64_MI32x32x8x1_SN_1LDSB1_GRVW8_LPA8_LPB8_LRVW8_MIWT2_1_NEPBS2_PLR9_WG64_4_1
    SolutionIndex: 146
    SolutionNameMin: Cijk_Alik_Bljk_HHS_BH_Bias_GG_AH_SDV_MT144x64x64_MI16x16x16x1_SN_1LDSB1_GRVW4_LPA16_LPB16_LRVW8_MIWT9_1_NEPBS0_PLR5_WG16_16_1
    SolutionIndex: 147
    SolutionNameMin: Cijk_Alik_Bljk_HHS_BH_Bias_GG_AH_SDV_MT160x64x64_MI16x16x16x1_SN_1LDSB1_GRVW8_LPA16_LPB16_LRVW8_MIWT10_1_NEPBS0_PLR5_WG16_16_1
    SolutionIndex: 148
    SolutionNameMin: Cijk_Alik_Bljk_HHS_BH_Bias_GG_AH_SDV_MT176x64x64_MI16x16x16x1_SN_1LDSB1_GRVW4_LPA16_LPB16_LRVW8_MIWT11_1_NEPBS0_PLR5_WG16_16_1
    SolutionIndex: 149
    SolutionNameMin: Cijk_Alik_Bljk_HHS_BH_Bias_GG_AH_SDV_MT192x64x64_MI32x32x8x1_SN_1LDSB1_GRVW8_LPA8_LPB8_LRVW8_MIWT3_1_NEPBS0_PLR9_WG64_4_1
    SolutionIndex: 150
    SolutionNameMin: Cijk_Alik_Bljk_HHS_BH_Bias_GG_AH_SDV_MT208x64x64_MI16x16x16x1_SN_1LDSB1_GRVW4_LPA16_LPB16_LRVW8_MIWT13_1_NEPBS0_PLR5_WG16_16_1
    SolutionIndex: 151
    SolutionNameMin: Cijk_Alik_Bljk_HHS_BH_Bias_GG_AH_SDV_MT224x64x64_MI16x16x16x1_SN_1LDSB1_GRVW8_LPA16_LPB16_LRVW8_MIWT14_1_NEPBS0_PLR5_WG16_16_1
    SolutionIndex: 152
    SolutionNameMin: Cijk_Alik_Bljk_HHS_BH_Bias_GG_AH_SDV_MT240x64x64_MI16x16x16x1_SN_1LDSB1_GRVW4_LPA16_LPB16_LRVW8_MIWT15_1_NEPBS0_PLR5_WG16_16_1
    SolutionIndex: 153
    SolutionNameMin: Cijk_Alik_Bljk_HHS_BH_Bias_GG_AH_SDV_MT256x64x64_MI32x32x8x1_SN_1LDSB1_GRVW8_LPA8_LPB8_LRVW8_MIWT2_2_NEPBS0_PLR9_WG128_2_1
    SolutionIndex: 154
    SolutionNameMin: Cijk_Alik_Bljk_HHS_BH_Bias_GG_AH_SDV_MT64x80x64_MI16x16x16x1_SN_1LDSB1_GRVW4_LPA16_LPB16_LRVW8_MIWT1_5_NEPBS2_PLR5_WG64_4_1
    SolutionIndex: 155
    SolutionNameMin: Cijk_Alik_Bljk_HHS_BH_Bias_GG_AH_SDV_MT128x80x64_MI16x16x16x1_SN_1LDSB1_GRVW4_LPA16_LPB16_LRVW8_MIWT2_5_NEPBS0_PLR5_WG64_4_1
    SolutionIndex: 156
    SolutionNameMin: Cijk_Alik_Bljk_HHS_BH_Bias_GG_AH_SDV_MT192x80x64_MI16x16x16x1_SN_1LDSB1_GRVW4_LPA16_LPB16_LRVW8_MIWT3_5_NEPBS0_PLR5_WG64_4_1
    SolutionIndex: 157
    SolutionNameMin: Cijk_Alik_Bljk_HHS_BH_Bias_GG_AH_SDV_MT256x80x64_MI16x16x16x1_SN_1LDSB1_GRVW4_LPA16_LPB16_LRVW8_MIWT4_5_NEPBS0_PLR5_WG64_4_1
    SolutionIndex: 158
    SolutionNameMin: Cijk_Alik_Bljk_HHS_BH_Bias_GG_AH_SDV_MT32x96x64_MI16x16x16x1_SN_1LDSB1_GRVW8_LPA16_LPB16_LRVW8_MIWT1_3_NEPBS2_PLR5_WG32_8_1
    SolutionIndex: 159
    SolutionNameMin: Cijk_Alik_Bljk_HHS_BH_Bias_GG_AH_SDV_MT64x96x64_MI16x16x16x1_SN_1LDSB1_GRVW8_LPA16_LPB16_LRVW8_MIWT2_3_NEPBS2_PLR5_WG32_8_1
    SolutionIndex: 160
    SolutionNameMin: Cijk_Alik_Bljk_HHS_BH_Bias_GG_AH_SDV_MT96x96x64_MI16x16x16x1_SN_1LDSB1_GRVW8_LPA16_LPB16_LRVW8_MIWT3_3_NEPBS2_PLR5_WG32_8_1
    SolutionIndex: 161
    SolutionNameMin: Cijk_Alik_Bljk_HHS_BH_Bias_GG_AH_SDV_MT128x96x64_MI32x32x8x1_SN_1LDSB1_GRVW8_LPA8_LPB8_LRVW8_MIWT1_3_NEPBS2_PLR9_WG128_2_1
    SolutionIndex: 162
    SolutionNameMin: Cijk_Alik_Bljk_HHS_BH_Bias_GG_AH_SDV_MT160x96x64_MI16x16x16x1_SN_1LDSB1_GRVW8_LPA16_LPB16_LRVW8_MIWT5_3_NEPBS0_PLR5_WG32_8_1
    SolutionIndex: 163
    SolutionNameMin: Cijk_Alik_Bljk_HHS_BH_Bias_GG_AH_SDV_MT192x96x64_MI16x16x16x1_SN_1LDSB1_GRVW8_LPA16_LPB16_LRVW8_MIWT6_3_NEPBS0_PLR5_WG32_8_1
    SolutionIndex: 164
    SolutionNameMin: Cijk_Alik_Bljk_HHS_BH_Bias_GG_AH_SDV_MT224x96x64_MI16x16x16x1_SN_1LDSB1_GRVW8_LPA16_LPB16_LRVW8_MIWT7_3_NEPBS0_PLR5_WG32_8_1
    SolutionIndex: 165
    SolutionNameMin: Cijk_Alik_Bljk_HHS_BH_Bias_GG_AH_SDV_MT256x96x64_MI32x32x8x1_SN_1LDSB1_GRVW8_LPA8_LPB8_LRVW8_MIWT2_3_NEPBS0_PLR9_WG128_2_1
    SolutionIndex: 166
    SolutionNameMin: Cijk_Alik_Bljk_HHS_BH_Bias_GG_AH_SDV_MT64x112x64_MI16x16x16x1_SN_1LDSB1_GRVW4_LPA16_LPB16_LRVW8_MIWT1_7_NEPBS2_PLR5_WG64_4_1
    SolutionIndex: 167
    SolutionNameMin: Cijk_Alik_Bljk_HHS_BH_Bias_GG_AH_SDV_MT128x112x64_MI16x16x16x1_SN_1LDSB1_GRVW4_LPA16_LPB16_LRVW8_MIWT2_7_NEPBS0_PLR5_WG64_4_1
    SolutionIndex: 168
    SolutionNameMin: Cijk_Alik_Bljk_HHS_BH_Bias_GG_AH_SDV_MT192x112x64_MI16x16x16x1_SN_1LDSB1_GRVW4_LPA16_LPB16_LRVW8_MIWT3_7_NEPBS0_PLR5_WG64_4_1
    SolutionIndex: 169
    SolutionNameMin: Cijk_Alik_Bljk_HHS_BH_Bias_GG_AH_SDV_MT256x112x64_MI16x16x16x1_SN_1LDSB1_GRVW4_LPA16_LPB16_LRVW8_MIWT4_7_NEPBS0_PLR5_WG64_4_1
    SolutionIndex: 170
    SolutionNameMin: Cijk_Alik_Bljk_HHS_BH_Bias_GG_AH_SDV_MT16x128x64_MI16x16x16x1_SN_1LDSB1_GRVW4_LPA16_LPB16_LRVW8_MIWT1_2_NEPBS2_PLR5_WG16_16_1
    SolutionIndex: 171
    SolutionNameMin: Cijk_Alik_Bljk_HHS_BH_Bias_GG_AH_SDV_MT32x128x64_MI32x32x8x1_SN_1LDSB0_GRVW8_LPA8_LPB8_LRVW8_MIWT1_1_NEPBS0_PLR9_WG32_8_1
    SolutionIndex: 172
    SolutionNameMin: Cijk_Alik_Bljk_HHS_BH_Bias_GG_AH_SDV_MT48x128x64_MI16x16x16x1_SN_1LDSB1_GRVW4_LPA16_LPB16_LRVW8_MIWT3_2_NEPBS2_PLR5_WG16_16_1
    SolutionIndex: 173
    SolutionNameMin: Cijk_Alik_Bljk_HHS_BH_Bias_GG_AH_SDV_MT64x128x64_MI32x32x8x1_SN_1LDSB1_GRVW8_LPA8_LPB8_LRVW8_MIWT2_1_NEPBS2_PLR9_WG32_8_1
    SolutionIndex: 174
    SolutionNameMin: Cijk_Alik_Bljk_HHS_BH_Bias_GG_AH_SDV_MT80x128x64_MI16x16x16x1_SN_1LDSB1_GRVW4_LPA16_LPB16_LRVW8_MIWT5_2_NEPBS0_PLR5_WG16_16_1
    SolutionIndex: 175
    SolutionNameMin: Cijk_Alik_Bljk_HHS_BH_Bias_GG_AH_SDV_MT96x128x64_MI32x32x8x1_SN_1LDSB1_GRVW8_LPA8_LPB8_LRVW8_MIWT3_1_NEPBS2_PLR9_WG32_8_1
    SolutionIndex: 176
    SolutionNameMin: Cijk_Alik_Bljk_HHS_BH_Bias_GG_AH_SDV_MT112x128x64_MI16x16x16x1_SN_1LDSB1_GRVW4_LPA16_LPB16_LRVW8_MIWT7_2_NEPBS0_PLR5_WG16_16_1
    SolutionIndex: 177
    SolutionNameMin: Cijk_Alik_Bljk_HHS_BH_Bias_GG_AH_SDV_MT128x128x64_MI32x32x8x1_SN_1LDSB1_GRVW8_LPA8_LPB8_LRVW8_MIWT2_2_NEPBS0_PLR9_WG64_4_1
    SolutionIndex: 178
    SolutionNameMin: Cijk_Alik_Bljk_HHS_BH_Bias_GG_AH_SDV_MT144x128x64_MI16x16x16x1_SN_1LDSB1_GRVW4_LPA16_LPB16_LRVW8_MIWT9_2_NEPBS0_PLR5_WG16_16_1
    SolutionIndex: 179
    SolutionNameMin: Cijk_Alik_Bljk_HHS_BH_Bias_GG_AH_SDV_MT160x128x64_MI32x32x8x1_SN_1LDSB1_GRVW8_LPA8_LPB8_LRVW8_MIWT5_1_NEPBS0_PLR9_WG32_8_1
    SolutionIndex: 180
    SolutionNameMin: Cijk_Alik_Bljk_HHS_BH_Bias_GG_AH_SDV_MT176x128x64_MI16x16x16x1_SN_1LDSB1_GRVW4_LPA16_LPB16_LRVW8_MIWT11_2_NEPBS0_PLR5_WG16_16_1
    SolutionIndex: 181
    SolutionNameMin: Cijk_Alik_Bljk_HHS_BH_Bias_GG_AH_SDV_MT192x128x64_MI32x32x8x1_SN_1LDSB1_GRVW8_LPA8_LPB8_LRVW8_MIWT6_1_NEPBS0_PLR9_WG32_8_1
    SolutionIndex: 182
    SolutionNameMin: Cijk_Alik_Bljk_HHS_BH_Bias_GG_AH_SDV_MT208x128x64_MI16x16x16x1_SN_1LDSB1_GRVW4_LPA16_LPB16_LRVW8_MIWT13_2_NEPBS0_PLR5_WG16_16_1
    SolutionIndex: 183
    SolutionNameMin: Cijk_Alik_Bljk_HHS_BH_Bias_GG_AH_SDV_MT224x128x64_MI32x32x8x1_SN_1LDSB1_GRVW8_LPA8_LPB8_LRVW8_MIWT7_1_NEPBS0_PLR9_WG32_8_1
    SolutionIndex: 184
    SolutionNameMin: Cijk_Alik_Bljk_HHS_BH_Bias_GG_AH_SDV_MT240x128x64_MI16x16x16x1_SN_1LDSB1_GRVW4_LPA16_LPB16_LRVW8_MIWT15_2_NEPBS0_PLR5_WG16_16_1
    SolutionIndex: 185
    SolutionNameMin: Cijk_Alik_Bljk_HHS_BH_Bias_GG_AH_SDV_MT256x128x64_MI32x32x8x1_SN_1LDSB1_GRVW8_LPA8_LPB8_LRVW8_MIWT4_2_NEPBS0_PLR9_WG64_4_1
    SolutionIndex: 186
    SolutionNameMin: Cijk_Alik_Bljk_HHS_BH_Bias_GG_AH_SDV_MT64x144x64_MI16x16x16x1_SN_1LDSB1_GRVW4_LPA16_LPB16_LRVW8_MIWT1_9_NEPBS0_PLR5_WG64_4_1
    SolutionIndex: 187
    SolutionNameMin: Cijk_Alik_Bljk_HHS_BH_Bias_GG_AH_SDV_MT128x144x64_MI16x16x16x1_SN_1LDSB1_GRVW4_LPA16_LPB16_LRVW8_MIWT2_9_NEPBS0_PLR5_WG64_4_1
    SolutionIndex: 188
    SolutionNameMin: Cijk_Alik_Bljk_HHS_BH_Bias_GG_AH_SDV_MT192x144x64_MI16x16x16x1_SN_1LDSB1_GRVW4_LPA16_LPB16_LRVW8_MIWT3_9_NEPBS0_PLR5_WG64_4_1
    SolutionIndex: 189
    SolutionNameMin: Cijk_Alik_Bljk_HHS_BH_Bias_GG_AH_SDV_MT256x144x64_MI16x16x16x1_SN_1LDSB1_GRVW4_LPA16_LPB16_LRVW8_MIWT4_9_NEPBS0_PLR5_WG64_4_1
    SolutionIndex: 190
    SolutionNameMin: Cijk_Alik_Bljk_HHS_BH_Bias_GG_AH_SDV_MT32x160x64_MI16x16x16x1_SN_1LDSB1_GRVW8_LPA16_LPB16_LRVW8_MIWT1_5_NEPBS2_PLR5_WG32_8_1
    SolutionIndex: 191
    SolutionNameMin: Cijk_Alik_Bljk_HHS_BH_Bias_GG_AH_SDV_MT64x160x64_MI16x16x16x1_SN_1LDSB1_GRVW8_LPA16_LPB16_LRVW8_MIWT2_5_NEPBS0_PLR5_WG32_8_1
    SolutionIndex: 192
    SolutionNameMin: Cijk_Alik_Bljk_HHS_BH_Bias_GG_AH_SDV_MT96x160x64_MI16x16x16x1_SN_1LDSB1_GRVW8_LPA16_LPB16_LRVW8_MIWT3_5_NEPBS0_PLR5_WG32_8_1
    SolutionIndex: 193
    SolutionNameMin: Cijk_Alik_Bljk_HHS_BH_Bias_GG_AH_SDV_MT128x160x64_MI32x32x8x1_SN_1LDSB1_GRVW8_LPA8_LPB8_LRVW8_MIWT1_5_NEPBS0_PLR9_WG128_2_1
    SolutionIndex: 194
    SolutionNameMin: Cijk_Alik_Bljk_HHS_BH_Bias_GG_AH_SDV_MT160x160x64_MI16x16x16x1_SN_1LDSB1_GRVW8_LPA16_LPB16_LRVW8_MIWT5_5_NEPBS0_PLR5_WG32_8_1
    SolutionIndex: 195
    SolutionNameMin: Cijk_Alik_Bljk_HHS_BH_Bias_GG_AH_SDV_MT192x160x64_MI16x16x16x1_SN_1LDSB1_GRVW8_LPA16_LPB16_LRVW8_MIWT6_5_NEPBS0_PLR5_WG32_8_1
    SolutionIndex: 196
    SolutionNameMin: Cijk_Alik_Bljk_HHS_BH_Bias_GG_AH_SDV_MT224x160x64_MI16x16x16x1_SN_1LDSB1_GRVW8_LPA16_LPB16_LRVW8_MIWT7_5_NEPBS0_PLR5_WG32_8_1
    SolutionIndex: 197
    SolutionNameMin: Cijk_Alik_Bljk_HHS_BH_Bias_GG_AH_SDV_MT256x160x64_MI32x32x8x1_SN_1LDSB1_GRVW8_LPA8_LPB8_LRVW8_MIWT2_5_NEPBS0_PLR9_WG128_2_1
    SolutionIndex: 198
    SolutionNameMin: Cijk_Alik_Bljk_HHS_BH_Bias_GG_AH_SDV_MT64x176x64_MI16x16x16x1_SN_1LDSB1_GRVW4_LPA16_LPB16_LRVW8_MIWT1_11_NEPBS0_PLR5_WG64_4_1
    SolutionIndex: 199
    SolutionNameMin: Cijk_Alik_Bljk_HHS_BH_Bias_GG_AH_SDV_MT128x176x64_MI16x16x16x1_SN_1LDSB1_GRVW4_LPA16_LPB16_LRVW8_MIWT2_11_NEPBS0_PLR5_WG64_4_1
    SolutionIndex: 200
    SolutionNameMin: Cijk_Alik_Bljk_HHS_BH_Bias_GG_AH_SDV_MT192x176x64_MI16x16x16x1_SN_1LDSB1_GRVW4_LPA16_LPB16_LRVW8_MIWT3_11_NEPBS0_PLR5_WG64_4_1
    SolutionIndex: 201
    SolutionNameMin: Cijk_Alik_Bljk_HHS_BH_Bias_GG_AH_SDV_MT16x192x64_MI16x16x16x1_SN_1LDSB1_GRVW4_LPA16_LPB16_LRVW8_MIWT1_3_NEPBS0_PLR5_WG16_16_1
    SolutionIndex: 202
    SolutionNameMin: Cijk_Alik_Bljk_HHS_BH_Bias_GG_AH_SDV_MT32x192x64_MI16x16x16x1_SN_1LDSB1_GRVW8_LPA16_LPB16_LRVW8_MIWT2_3_NEPBS0_PLR5_WG16_16_1
    SolutionIndex: 203
    SolutionNameMin: Cijk_Alik_Bljk_HHS_BH_Bias_GG_AH_SDV_MT48x192x64_MI16x16x16x1_SN_1LDSB1_GRVW4_LPA16_LPB16_LRVW8_MIWT3_3_NEPBS0_PLR5_WG16_16_1
    SolutionIndex: 204
    SolutionNameMin: Cijk_Alik_Bljk_HHS_BH_Bias_GG_AH_SDV_MT64x192x64_MI32x32x8x1_SN_1LDSB1_GRVW8_LPA8_LPB8_LRVW8_MIWT1_3_NEPBS0_PLR9_WG64_4_1
    SolutionIndex: 205
    SolutionNameMin: Cijk_Alik_Bljk_HHS_BH_Bias_GG_AH_SDV_MT80x192x64_MI16x16x16x1_SN_1LDSB1_GRVW4_LPA16_LPB16_LRVW8_MIWT5_3_NEPBS0_PLR5_WG16_16_1
    SolutionIndex: 206
    SolutionNameMin: Cijk_Alik_Bljk_HHS_BH_Bias_GG_AH_SDV_MT96x192x64_MI16x16x16x1_SN_1LDSB1_GRVW8_LPA16_LPB16_LRVW8_MIWT6_3_NEPBS0_PLR5_WG16_16_1
    SolutionIndex: 207
    SolutionNameMin: Cijk_Alik_Bljk_HHS_BH_Bias_GG_AH_SDV_MT112x192x64_MI16x16x16x1_SN_1LDSB1_GRVW4_LPA16_LPB16_LRVW8_MIWT7_3_NEPBS0_PLR5_WG16_16_1
    SolutionIndex: 208
    SolutionNameMin: Cijk_Alik_Bljk_HHS_BH_Bias_GG_AH_SDV_MT128x192x64_MI32x32x8x1_SN_1LDSB1_GRVW8_LPA8_LPB8_LRVW8_MIWT2_3_NEPBS0_PLR9_WG64_4_1
    SolutionIndex: 209
    SolutionNameMin: Cijk_Alik_Bljk_HHS_BH_Bias_GG_AH_SDV_MT144x192x64_MI16x16x16x1_SN_1LDSB1_GRVW4_LPA16_LPB16_LRVW8_MIWT9_3_NEPBS0_PLR5_WG16_16_1
    SolutionIndex: 210
    SolutionNameMin: Cijk_Alik_Bljk_HHS_BH_Bias_GG_AH_SDV_MT160x192x64_MI16x16x16x1_SN_1LDSB1_GRVW8_LPA16_LPB16_LRVW8_MIWT10_3_NEPBS0_PLR5_WG16_16_1
    SolutionIndex: 211
    SolutionNameMin: Cijk_Alik_Bljk_HHS_BH_Bias_GG_AH_SDV_MT176x192x64_MI16x16x16x1_SN_1LDSB1_GRVW4_LPA16_LPB16_LRVW8_MIWT11_3_NEPBS0_PLR5_WG16_16_1
    SolutionIndex: 212
    SolutionNameMin: Cijk_Alik_Bljk_HHS_BH_Bias_GG_AH_SDV_MT192x192x64_MI32x32x8x1_SN_1LDSB1_GRVW8_LPA8_LPB8_LRVW8_MIWT3_3_NEPBS0_PLR9_WG64_4_1
    SolutionIndex: 213
    SolutionNameMin: Cijk_Alik_Bljk_HHS_BH_Bias_GG_AH_SDV_MT208x192x64_MI16x16x16x1_SN_1LDSB1_GRVW4_LPA16_LPB16_LRVW8_MIWT13_3_NEPBS0_PLR5_WG16_16_1
    SolutionIndex: 214
    SolutionNameMin: Cijk_Alik_Bljk_HHS_BH_Bias_GG_AH_SDV_MT256x192x64_MI32x32x8x1_SN_1LDSB1_GRVW8_LPA8_LPB8_LRVW8_MIWT2_6_NEPBS0_PLR9_WG128_2_1
    SolutionIndex: 215
    SolutionNameMin: Cijk_Alik_Bljk_HHS_BH_Bias_GG_AH_SDV_MT64x208x64_MI16x16x16x1_SN_1LDSB1_GRVW4_LPA16_LPB16_LRVW8_MIWT1_13_NEPBS0_PLR5_WG64_4_1
    SolutionIndex: 216
    SolutionNameMin: Cijk_Alik_Bljk_HHS_BH_Bias_GG_AH_SDV_MT128x208x64_MI16x16x16x1_SN_1LDSB1_GRVW4_LPA16_LPB16_LRVW8_MIWT2_13_NEPBS0_PLR5_WG64_4_1
    SolutionIndex: 217
    SolutionNameMin: Cijk_Alik_Bljk_HHS_BH_Bias_GG_AH_SDV_MT192x208x64_MI16x16x16x1_SN_1LDSB1_GRVW4_LPA16_LPB16_LRVW8_MIWT3_13_NEPBS0_PLR5_WG64_4_1
    SolutionIndex: 218
    SolutionNameMin: Cijk_Alik_Bljk_HHS_BH_Bias_GG_AH_SDV_MT32x224x64_MI16x16x16x1_SN_1LDSB1_GRVW8_LPA16_LPB16_LRVW8_MIWT1_7_NEPBS0_PLR5_WG32_8_1
    SolutionIndex: 219
    SolutionNameMin: Cijk_Alik_Bljk_HHS_BH_Bias_GG_AH_SDV_MT64x224x64_MI16x16x16x1_SN_1LDSB1_GRVW8_LPA16_LPB16_LRVW8_MIWT2_7_NEPBS0_PLR5_WG32_8_1
    SolutionIndex: 220
    SolutionNameMin: Cijk_Alik_Bljk_HHS_BH_Bias_GG_AH_SDV_MT96x224x64_MI16x16x16x1_SN_1LDSB1_GRVW8_LPA16_LPB16_LRVW8_MIWT3_7_NEPBS0_PLR5_WG32_8_1
    SolutionIndex: 221
    SolutionNameMin: Cijk_Alik_Bljk_HHS_BH_Bias_GG_AH_SDV_MT128x224x64_MI32x32x8x1_SN_1LDSB1_GRVW8_LPA8_LPB8_LRVW8_MIWT1_7_NEPBS0_PLR9_WG128_2_1
    SolutionIndex: 222
    SolutionNameMin: Cijk_Alik_Bljk_HHS_BH_Bias_GG_AH_SDV_MT160x224x64_MI16x16x16x1_SN_1LDSB1_GRVW8_LPA16_LPB16_LRVW8_MIWT5_7_NEPBS0_PLR5_WG32_8_1
    SolutionIndex: 223
    SolutionNameMin: Cijk_Alik_Bljk_HHS_BH_Bias_GG_AH_SDV_MT64x240x64_MI16x16x16x1_SN_1LDSB1_GRVW4_LPA16_LPB16_LRVW8_MIWT1_15_NEPBS0_PLR5_WG64_4_1
    SolutionIndex: 224
    SolutionNameMin: Cijk_Alik_Bljk_HHS_BH_Bias_GG_AH_SDV_MT128x240x64_MI16x16x16x1_SN_1LDSB1_GRVW4_LPA16_LPB16_LRVW8_MIWT2_15_NEPBS0_PLR5_WG64_4_1
    SolutionIndex: 225
    SolutionNameMin: Cijk_Alik_Bljk_HHS_BH_Bias_GG_AH_SDV_MT16x256x64_MI16x16x16x1_SN_1LDSB1_GRVW4_LPA16_LPB16_LRVW8_MIWT1_4_NEPBS0_PLR5_WG16_16_1
    SolutionIndex: 226
    SolutionNameMin: Cijk_Alik_Bljk_HHS_BH_Bias_GG_AH_SDV_MT32x256x64_MI32x32x8x1_SN_1LDSB1_GRVW8_LPA8_LPB8_LRVW8_MIWT1_2_NEPBS0_PLR9_WG32_8_1
    SolutionIndex: 227
    SolutionNameMin: Cijk_Alik_Bljk_HHS_BH_Bias_GG_AH_SDV_MT48x256x64_MI16x16x16x1_SN_1LDSB1_GRVW4_LPA16_LPB16_LRVW8_MIWT3_4_NEPBS0_PLR5_WG16_16_1
    SolutionIndex: 228
    SolutionNameMin: Cijk_Alik_Bljk_HHS_BH_Bias_GG_AH_SDV_MT64x256x64_MI32x32x8x1_SN_1LDSB1_GRVW8_LPA8_LPB8_LRVW8_MIWT2_2_NEPBS0_PLR9_WG32_8_1
    SolutionIndex: 229
    SolutionNameMin: Cijk_Alik_Bljk_HHS_BH_Bias_GG_AH_SDV_MT80x256x64_MI16x16x16x1_SN_1LDSB1_GRVW4_LPA16_LPB16_LRVW8_MIWT5_4_NEPBS0_PLR5_WG16_16_1
    SolutionIndex: 230
    SolutionNameMin: Cijk_Alik_Bljk_HHS_BH_Bias_GG_AH_SDV_MT96x256x64_MI32x32x8x1_SN_1LDSB1_GRVW8_LPA8_LPB8_LRVW8_MIWT3_2_NEPBS0_PLR9_WG32_8_1
    SolutionIndex: 231
    SolutionNameMin: Cijk_Alik_Bljk_HHS_BH_Bias_GG_AH_SDV_MT112x256x64_MI16x16x16x1_SN_1LDSB1_GRVW4_LPA16_LPB16_LRVW8_MIWT7_4_NEPBS0_PLR5_WG16_16_1
    SolutionIndex: 232
    SolutionNameMin: Cijk_Alik_Bljk_HHS_BH_Bias_GG_AH_SDV_MT128x256x64_MI32x32x8x1_SN_1LDSB1_GRVW8_LPA8_LPB8_LRVW8_MIWT2_4_NEPBS0_PLR9_WG64_4_1
    SolutionIndex: 233
    SolutionNameMin: Cijk_Alik_Bljk_HHS_BH_Bias_GG_AH_SDV_MT144x256x64_MI16x16x16x1_SN_1LDSB1_GRVW4_LPA16_LPB16_LRVW8_MIWT9_4_NEPBS0_PLR5_WG16_16_1
    SolutionIndex: 234
    SolutionNameMin: Cijk_Alik_Bljk_HHS_BH_Bias_GG_AH_SDV_MT160x256x64_MI32x32x8x1_SN_1LDSB1_GRVW8_LPA8_LPB8_LRVW8_MIWT5_2_NEPBS0_PLR9_WG32_8_1
    SolutionIndex: 235
    SolutionNameMin: Cijk_Alik_Bljk_HHS_BH_Bias_GG_AH_SDV_MT192x256x64_MI32x32x8x1_SN_1LDSB1_GRVW8_LPA8_LPB8_LRVW8_MIWT3_4_NEPBS0_PLR9_WG64_4_1
    SolutionIndex: 236
    SolutionNameMin: Cijk_Alik_Bljk_HHS_BH_Bias_GG_AH_SDV_MT32x16x64_MI16x16x16x1_SN_1LDSB0_AFC0_GRVW8_GSU6_LPA16_LPB16_MIWT1_1_PLR5_WG32_4_1
    SolutionIndex: 237
    SolutionNameMin: Cijk_Alik_Bljk_HHS_BH_Bias_GG_AH_SDV_MT32x16x64_MI16x16x16x1_SN_1LDSB0_AFC0_GRVW8_GSU11_LPA16_LPB16_MIWT1_1_PLR5_WG32_4_1
- - - [8, 1, 1, 8, 512, 512, 512, 512]
    - [0, 0.0]
  - - [8, 2, 1, 8, 512, 512, 512, 512]
    - [1, 0.0]
  - - [8, 3, 1, 8, 512, 512, 512, 512]
    - [2, 0.0]
  - - [8, 4, 1, 8, 512, 512, 512, 512]
    - [3, 0.0]
  - - [8, 5, 1, 8, 512, 512, 512, 512]
    - [4, 0.0]
  - - [8, 6, 1, 8, 512, 512, 512, 512]
    - [5, 0.0]
  - - [8, 7, 1, 8, 512, 512, 512, 512]
    - [6, 0.0]
  - - [8, 8, 1, 8, 512, 512, 512, 512]
    - [7, 0.0]
  - - [8, 9, 1, 8, 512, 512, 512, 512]
    - [8, 0.0]
  - - [8, 10, 1, 8, 512, 512, 512, 512]
    - [9, 0.0]
  - - [8, 11, 1, 8, 512, 512, 512, 512]
    - [10, 0.0]
  - - [8, 12, 1, 8, 512, 512, 512, 512]
    - [11, 0.0]
  - - [8, 13, 1, 8, 512, 512, 512, 512]
    - [12, 0.0]
  - - [8, 14, 1, 8, 512, 512, 512, 512]
    - [13, 0.0]
  - - [8, 15, 1, 8, 512, 512, 512, 512]
    - [14, 0.0]
  - - [8, 16, 1, 8, 512, 512, 512, 512]
    - [15, 0.0]
  - - [8, 17, 1, 8, 512, 512, 512, 512]
    - [16, 0.0]
  - - [8, 18, 1, 8, 512, 512, 512, 512]
    - [17, 0.0]
  - - [8, 19, 1, 8, 512, 512, 512, 512]
    - [18, 0.0]
  - - [8, 20, 1, 8, 512, 512, 512, 512]
    - [19, 0.0]
  - - [8, 21, 1, 8, 512, 512, 512, 512]
    - [20, 0.0]
  - - [8, 22, 1, 8, 512, 512, 512, 512]
    - [21, 0.0]
  - - [8, 23, 1, 8, 512, 512, 512, 512]
    - [22, 0.0]
  - - [8, 24, 1, 8, 512, 512, 512, 512]
    - [23, 0.0]
  - - [8, 25, 1, 8, 512, 512, 512, 512]
    - [24, 0.0]
  - - [8, 26, 1, 8, 512, 512, 512, 512]
    - [25, 0.0]
  - - [8, 27, 1, 8, 512, 512, 512, 512]
    - [26, 0.0]
  - - [8, 28, 1, 8, 512, 512, 512, 512]
    - [27, 0.0]
  - - [8, 29, 1, 8, 512, 512, 512, 512]
    - [28, 0.0]
  - - [8, 30, 1, 8, 512, 512, 512, 512]
    - [29, 0.0]
  - - [8, 31, 1, 8, 512, 512, 512, 512]
    - [30, 0.0]
  - - [8, 32, 1, 8, 512, 512, 512, 512]
    - [31, 0.0]
  - - [8, 33, 1, 8, 512, 512, 512, 512]
    - [32, 0.0]
  - - [8, 34, 1, 8, 512, 512, 512, 512]
    - [33, 0.0]
  - - [8, 35, 1, 8, 512, 512, 512, 512]
    - [34, 0.0]
  - - [8, 36, 1, 8, 512, 512, 512, 512]
    - [35, 0.0]
  - - [8, 37, 1, 8, 512, 512, 512, 512]
    - [36, 0.0]
  - - [8, 38, 1, 8, 512, 512, 512, 512]
    - [37, 0.0]
  - - [8, 39, 1, 8, 512, 512, 512, 512]
    - [38, 0.0]
  - - [8, 40, 1, 8, 512, 512, 512, 512]
    - [39, 0.0]
  - - [8, 41, 1, 8, 512, 512, 512, 512]
    - [40, 0.0]
  - - [8, 42, 1, 8, 512, 512, 512, 512]
    - [41, 0.0]
  - - [8, 43, 1, 8, 512, 512, 512, 512]
    - [42, 0.0]
  - - [8, 44, 1, 8, 512, 512, 512, 512]
    - [43, 0.0]
  - - [8, 45, 1, 8, 512, 512, 512, 512]
    - [44, 0.0]
  - - [8, 46, 1, 8, 512, 512, 512, 512]
    - [45, 0.0]
  - - [8, 47, 1, 8, 512, 512, 512, 512]
    - [46, 0.0]
  - - [8, 48, 1, 8, 512, 512, 512, 512]
    - [47, 0.0]
  - - [8, 49, 1, 8, 512, 512, 512, 512]
    - [48, 0.0]
  - - [8, 50, 1, 8, 512, 512, 512, 512]
    - [49, 0.0]
  - - [8, 51, 1, 8, 512, 512, 512, 512]
    - [50, 0.0]
  - - [8, 52, 1, 8, 512, 512, 512, 512]
    - [51, 0.0]
  - - [8, 53, 1, 8, 512, 512, 512, 512]
    - [52, 0.0]
  - - [8, 54, 1, 8, 512, 512, 512, 512]
    - [53, 0.0]
  - - [8, 55, 1, 8, 512, 512, 512, 512]
    - [54, 0.0]
  - - [8, 56, 1, 8, 512, 512, 512, 512]
    - [55, 0.0]
  - - [8, 57, 1, 8, 512, 512, 512, 512]
    - [56, 0.0]
  - - [8, 58, 1, 8, 512, 512, 512, 512]
    - [57, 0.0]
  - - [8, 59, 1, 8, 512, 512, 512, 512]
    - [58, 0.0]
  - - [8, 60, 1, 8, 512, 512, 512, 512]
    - [59, 0.0]
  - - [8, 61, 1, 8, 512, 512, 512, 512]
    - [60, 0.0]
  - - [8, 62, 1, 8, 512, 512, 512, 512]
    - [61, 0.0]
  - - [8, 63, 1, 8, 512, 512, 512, 512]
    - [62, 0.0]
  - - [8, 64, 1, 8, 512, 512, 512, 512]
    - [63, 0.0]
  - - [8, 65, 1, 8, 512, 512, 512, 512]
    - [64, 0.0]
  - - [8, 66, 1, 8, 512, 512, 512, 512]
    - [65, 0.0]
  - - [8, 67, 1, 8, 512, 512, 512, 512]
    - [66, 0.0]
  - - [8, 68, 1, 8, 512, 512, 512, 512]
    - [67, 0.0]
  - - [8, 69, 1, 8, 512, 512, 512, 512]
    - [68, 0.0]
  - - [8, 70, 1, 8, 512, 512, 512, 512]
    - [69, 0.0]
  - - [8, 71, 1, 8, 512, 512, 512, 512]
    - [70, 0.0]
  - - [8, 72, 1, 8, 512, 512, 512, 512]
    - [71, 0.0]
  - - [8, 73, 1, 8, 512, 512, 512, 512]
    - [72, 0.0]
  - - [8, 74, 1, 8, 512, 512, 512, 512]
    - [73, 0.0]
  - - [8, 75, 1, 8, 512, 512, 512, 512]
    - [74, 0.0]
  - - [8, 76, 1, 8, 512, 512, 512, 512]
    - [75, 0.0]
  - - [8, 77, 1, 8, 512, 512, 512, 512]
    - [76, 0.0]
  - - [8, 78, 1, 8, 512, 512, 512, 512]
    - [77, 0.0]
  - - [8, 79, 1, 8, 512, 512, 512, 512]
    - [78, 0.0]
  - - [8, 80, 1, 8, 512, 512, 512, 512]
    - [79, 0.0]
  - - [8, 81, 1, 8, 512, 512, 512, 512]
    - [80, 0.0]
  - - [8, 82, 1, 8, 512, 512, 512, 512]
    - [81, 0.0]
  - - [8, 83, 1, 8, 512, 512, 512, 512]
    - [82, 0.0]
  - - [8, 84, 1, 8, 512, 512, 512, 512]
    - [83, 0.0]
  - - [8, 85, 1, 8, 512, 512, 512, 512]
    - [84, 0.0]
  - - [8, 86, 1, 8, 512, 512, 512, 512]
    - [85, 0.0]
  - - [8, 87, 1, 8, 512, 512, 512, 512]
    - [86, 0.0]
  - - [8, 88, 1, 8, 512, 512, 512, 512]
    - [87, 0.0]
  - - [8, 89, 1, 8, 512, 512, 512, 512]
    - [88, 0.0]
  - - [8, 90, 1, 8, 512, 512, 512, 512]
    - [89, 0.0]
  - - [8, 91, 1, 8, 512, 512, 512, 512]
    - [90, 0.0]
  - - [8, 92, 1, 8, 512, 512, 512, 512]
    - [91, 0.0]
  - - [8, 93, 1, 8, 512, 512, 512, 512]
    - [92, 0.0]
  - - [8, 94, 1, 8, 512, 512, 512, 512]
    - [93, 0.0]
  - - [8, 95, 1, 8, 512, 512, 512, 512]
    - [94, 0.0]
  - - [8, 96, 1, 8, 512, 512, 512, 512]
    - [95, 0.0]
  - - [8, 97, 1, 8, 512, 512, 512, 512]
    - [96, 0.0]
  - - [8, 98, 1, 8, 512, 512, 512, 512]
    - [97, 0.0]
  - - [8, 99, 1, 8, 512, 512, 512, 512]
    - [98, 0.0]
  - - [8, 100, 1, 8, 512, 512, 512, 512]
    - [99, 0.0]
  - - [8, 101, 1, 8, 512, 512, 512, 512]
    - [100, 0.0]
  - - [8, 102, 1, 8, 512, 512, 512, 512]
    - [101, 0.0]
  - - [8, 103, 1, 8, 512, 512, 512, 512]
    - [102, 0.0]
  - - [8, 104, 1, 8, 512, 512, 512, 512]
    - [103, 0.0]
  - - [8, 105, 1, 8, 512, 512, 512, 512]
    - [104, 0.0]
  - - [8, 106, 1, 8, 512, 512, 512, 512]
    - [105, 0.0]
  - - [8, 107, 1, 8, 512, 512, 512, 512]
    - [106, 0.0]
  - - [8, 108, 1, 8, 512, 512, 512, 512]
    - [107, 0.0]
  - - [8, 109, 1, 8, 512, 512, 512, 512]
    - [108, 0.0]
  - - [8, 110, 1, 8, 512, 512, 512, 512]
    - [109, 0.0]
  - - [8, 111, 1, 8, 512, 512, 512, 512]
    - [110, 0.0]
  - - [8, 112, 1, 8, 512, 512, 512, 512]
    - [111, 0.0]
  - - [8, 113, 1, 8, 512, 512, 512, 512]
    - [112, 0.0]
  - - [8, 114, 1, 8, 512, 512, 512, 512]
    - [113, 0.0]
  - - [8, 115, 1, 8, 512, 512, 512, 512]
    - [114, 0.0]
  - - [8, 116, 1, 8, 512, 512, 512, 512]
    - [115, 0.0]
  - - [8, 117, 1, 8, 512, 512, 512, 512]
    - [116, 0.0]
  - - [8, 118, 1, 8, 512, 512, 512, 512]
    - [117, 0.0]
  - - [8, 119, 1, 8, 512, 512, 512, 512]
    - [118, 0.0]
  - - [8, 120, 1, 8, 512, 512, 512, 512]
    - [119, 0.0]
  - - [8, 121, 1, 8, 512, 512, 512, 512]
    - [120, 0.0]
  - - [8, 122, 1, 8, 512, 512, 512, 512]
    - [121, 0.0]
  - - [8, 123, 1, 8, 512, 512, 512, 512]
    - [122, 0.0]
  - - [8, 124, 1, 8, 512, 512, 512, 512]
    - [123, 0.0]
  - - [8, 125, 1, 8, 512, 512, 512, 512]
    - [124, 0.0]
  - - [8, 126, 1, 8, 512, 512, 512, 512]
    - [125, 0.0]
  - - [8, 127, 1, 8, 512, 512, 512, 512]
    - [126, 0.0]
  - - [8, 128, 1, 8, 512, 512, 512, 512]
    - [127, 0.0]
  - - [8, 129, 1, 8, 512, 512, 512, 512]
    - [128, 0.0]
  - - [8, 130, 1, 8, 512, 512, 512, 512]
    - [129, 0.0]
  - - [8, 131, 1, 8, 512, 512, 512, 512]
    - [130, 0.0]
  - - [8, 132, 1, 8, 512, 512, 512, 512]
    - [131, 0.0]
  - - [8, 133, 1, 8, 512, 512, 512, 512]
    - [132, 0.0]
  - - [8, 134, 1, 8, 512, 512, 512, 512]
    - [133, 0.0]
  - - [8, 135, 1, 8, 512, 512, 512, 512]
    - [134, 0.0]
  - - [8, 136, 1, 8, 512, 512, 512, 512]
    - [135, 0.0]
  - - [8, 137, 1, 8, 512, 512, 512, 512]
    - [136, 0.0]
  - - [8, 138, 1, 8, 512, 512, 512, 512]
    - [137, 0.0]
  - - [8, 139, 1, 8, 512, 512, 512, 512]
    - [138, 0.0]
  - - [8, 140, 1, 8, 512, 512, 512, 512]
    - [139, 0.0]
  - - [8, 141, 1, 8, 512, 512, 512, 512]
    - [140, 0.0]
  - - [8, 142, 1, 8, 512, 512, 512, 512]
    - [141, 0.0]
  - - [8, 143, 1, 8, 512, 512, 512, 512]
    - [142, 0.0]
  - - [8, 144, 1, 8, 512, 512, 512, 512]
    - [143, 0.0]
  - - [8, 145, 1, 8, 512, 512, 512, 512]
    - [144, 0.0]
  - - [8, 146, 1, 8, 512, 512, 512, 512]
    - [145, 0.0]
  - - [8, 147, 1, 8, 512, 512, 512, 512]
    - [146, 0.0]
  - - [8, 148, 1, 8, 512, 512, 512, 512]
    - [147, 0.0]
  - - [8, 149, 1, 8, 512, 512, 512, 512]
    - [148, 0.0]
  - - [8, 150, 1, 8, 512, 512, 512, 512]
    - [149, 0.0]
  - - [8, 151, 1, 8, 512, 512, 512, 512]
    - [150, 0.0]
  - - [8, 152, 1, 8, 512, 512, 512, 512]
    - [151, 0.0]
  - - [8, 153, 1, 8, 512, 512, 512, 512]
    - [152, 0.0]
  - - [8, 154, 1, 8, 512, 512, 512, 512]
    - [153, 0.0]
  - - [8, 155, 1, 8, 512, 512, 512, 512]
    - [154, 0.0]
  - - [8, 156, 1, 8, 512, 512, 512, 512]
    - [155, 0.0]
  - - [8, 157, 1, 8, 512, 512, 512, 512]
    - [156, 0.0]
  - - [8, 158, 1, 8, 512, 512, 512, 512]
    - [157, 0.0]
  - - [8, 159, 1, 8, 512, 512, 512, 512]
    - [158, 0.0]
  - - [8, 160, 1, 8, 512, 512, 512, 512]
    - [159, 0.0]
  - - [8, 161, 1, 8, 512, 512, 512, 512]
    - [160, 0.0]
  - - [8, 162, 1, 8, 512, 512, 512, 512]
    - [161, 0.0]
  - - [8, 163, 1, 8, 512, 512, 512, 512]
    - [162, 0.0]
  - - [8, 164, 1, 8, 512, 512, 512, 512]
    - [163, 0.0]
  - - [8, 165, 1, 8, 512, 512, 512, 512]
    - [164, 0.0]
  - - [8, 166, 1, 8, 512, 512, 512, 512]
    - [165, 0.0]
  - - [8, 167, 1, 8, 512, 512, 512, 512]
    - [166, 0.0]
  - - [8, 168, 1, 8, 512, 512, 512, 512]
    - [167, 0.0]
  - - [8, 169, 1, 8, 512, 512, 512, 512]
    - [168, 0.0]
  - - [8, 170, 1, 8, 512, 512, 512, 512]
    - [169, 0.0]
  - - [8, 171, 1, 8, 512, 512, 512, 512]
    - [170, 0.0]
  - - [8, 172, 1, 8, 512, 512, 512, 512]
    - [171, 0.0]
  - - [8, 173, 1, 8, 512, 512, 512, 512]
    - [172, 0.0]
  - - [8, 174, 1, 8, 512, 512, 512, 512]
    - [173, 0.0]
  - - [8, 175, 1, 8, 512, 512, 512, 512]
    - [174, 0.0]
  - - [8, 176, 1, 8, 512, 512, 512, 512]
    - [175, 0.0]
  - - [8, 177, 1, 8, 512, 512, 512, 512]
    - [176, 0.0]
  - - [8, 178, 1, 8, 512, 512, 512, 512]
    - [177, 0.0]
  - - [8, 179, 1, 8, 512, 512, 512, 512]
    - [178, 0.0]
  - - [8, 180, 1, 8, 512, 512, 512, 512]
    - [179, 0.0]
  - - [8, 181, 1, 8, 512, 512, 512, 512]
    - [180, 0.0]
  - - [8, 182, 1, 8, 512, 512, 512, 512]
    - [181, 0.0]
  - - [8, 183, 1, 8, 512, 512, 512, 512]
    - [182, 0.0]
  - - [8, 184, 1, 8, 512, 512, 512, 512]
    - [183, 0.0]
  - - [8, 185, 1, 8, 512, 512, 512, 512]
    - [184, 0.0]
  - - [8, 186, 1, 8, 512, 512, 512, 512]
    - [185, 0.0]
  - - [8, 187, 1, 8, 512, 512, 512, 512]
    - [186, 0.0]
  - - [8, 188, 1, 8, 512, 512, 512, 512]
    - [187, 0.0]
  - - [8, 189, 1, 8, 512, 512, 512, 512]
    - [188, 0.0]
  - - [8, 190, 1, 8, 512, 512, 512, 512]
    - [189, 0.0]
  - - [8, 191, 1, 8, 512, 512, 512, 512]
    - [190, 0.0]
  - - [8, 192, 1, 8, 512, 512, 512, 512]
    - [191, 0.0]
  - - [8, 193, 1, 8, 512, 512, 512, 512]
    - [192, 0.0]
  - - [8, 194, 1, 8, 512, 512, 512, 512]
    - [193, 0.0]
  - - [8, 195, 1, 8, 512, 512, 512, 512]
    - [194, 0.0]
  - - [8, 196, 1, 8, 512, 512, 512, 512]
    - [195, 0.0]
  - - [8, 197, 1, 8, 512, 512, 512, 512]
    - [196, 0.0]
  - - [8, 198, 1, 8, 512, 512, 512, 512]
    - [197, 0.0]
  - - [8, 199, 1, 8, 512, 512, 512, 512]
    - [198, 0.0]
  - - [8, 200, 1, 8, 512, 512, 512, 512]
    - [199, 0.0]
  - - [8, 201, 1, 8, 512, 512, 512, 512]
    - [200, 0.0]
  - - [8, 202, 1, 8, 512, 512, 512, 512]
    - [201, 0.0]
  - - [8, 203, 1, 8, 512, 512, 512, 512]
    - [202, 0.0]
  - - [8, 204, 1, 8, 512, 512, 512, 512]
    - [203, 0.0]
  - - [8, 205, 1, 8, 512, 512, 512, 512]
    - [204, 0.0]
  - - [8, 206, 1, 8, 512, 512, 512, 512]
    - [205, 0.0]
  - - [8, 207, 1, 8, 512, 512, 512, 512]
    - [206, 0.0]
  - - [8, 208, 1, 8, 512, 512, 512, 512]
    - [207, 0.0]
  - - [8, 209, 1, 8, 512, 512, 512, 512]
    - [208, 0.0]
  - - [8, 210, 1, 8, 512, 512, 512, 512]
    - [209, 0.0]
  - - [8, 211, 1, 8, 512, 512, 512, 512]
    - [210, 0.0]
  - - [8, 212, 1, 8, 512, 512, 512, 512]
    - [211, 0.0]
  - - [8, 213, 1, 8, 512, 512, 512, 512]
    - [212, 0.0]
  - - [8, 214, 1, 8, 512, 512, 512, 512]
    - [213, 0.0]
  - - [8, 215, 1, 8, 512, 512, 512, 512]
    - [214, 0.0]
  - - [8, 216, 1, 8, 512, 512, 512, 512]
    - [215, 0.0]
  - - [8, 217, 1, 8, 512, 512, 512, 512]
    - [216, 0.0]
  - - [8, 218, 1, 8, 512, 512, 512, 512]
    - [217, 0.0]
  - - [8, 219, 1, 8, 512, 512, 512, 512]
    - [218, 0.0]
  - - [8, 220, 1, 8, 512, 512, 512, 512]
    - [219, 0.0]
  - - [8, 221, 1, 8, 512, 512, 512, 512]
    - [220, 0.0]
  - - [8, 222, 1, 8, 512, 512, 512, 512]
    - [221, 0.0]
  - - [8, 223, 1, 8, 512, 512, 512, 512]
    - [222, 0.0]
  - - [8, 224, 1, 8, 512, 512, 512, 512]
    - [223, 0.0]
  - - [8, 225, 1, 8, 512, 512, 512, 512]
    - [224, 0.0]
  - - [8, 226, 1, 8, 512, 512, 512, 512]
    - [225, 0.0]
  - - [8, 227, 1, 8, 512, 512, 512, 512]
    - [226, 0.0]
  - - [8, 228, 1, 8, 512, 512, 512, 512]
    - [227, 0.0]
  - - [8, 229, 1, 8, 512, 512, 512, 512]
    - [228, 0.0]
  - - [8, 230, 1, 8, 512, 512, 512, 512]
    - [229, 0.0]
  - - [8, 231, 1, 8, 512, 512, 512, 512]
    - [230, 0.0]
  - - [8, 232, 1, 8, 512, 512, 512, 512]
    - [231, 0.0]
  - - [8, 233, 1, 8, 512, 512, 512, 512]
    - [232, 0.0]
  - - [8, 234, 1, 8, 512, 512, 512, 512]
    - [233, 0.0]
  - - [8, 235, 1, 8, 512, 512, 512, 512]
    - [234, 0.0]
  - - [8, 236, 1, 8, 512, 512, 512, 512]
    - [235, 0.0]
  - - [9, 1, 1, 8, 512, 512, 512, 512]
    - [236, 0.0]
  - - [9, 2, 1, 8, 512, 512, 512, 512]
    - [237, 0.0]
- null
- null
- DeviceEfficiency
- null
- GridBased
