library/src/amd_detail/rocblaslt/src/Tensile/Logic/asm_full/aquavanjaram/gfx942/GridBased/aquavanjaram_Cijk_Alik_Bljk_F8B8BS_BH_BiasSB_HAS_SAB_SAV_UserArgs.yaml
- {MinimumRequiredVersion: 4.33.0}
- aquavanjaram
- gfx942
- [Device 0049, Device 0050]
    SolutionIndex: 0
    SolutionNameMin: Cijk_Alik_Bljk_F8B8BS_BH_BiasB_HAS_SAB_SAV_MT16x16x32_MI16x16x1_SN_CLR0_GSU1_MIWT1_1_NEPBS0_PLR0_SPO0_WGM8
    SolutionIndex: 1
    SolutionNameMin: Cijk_Alik_Bljk_F8B8BS_BH_BiasB_HAS_SAB_SAV_MT16x16x32_MI16x16x1_SN_CLR0_GSU1_MIWT1_1_NEPBS0_PLR0_SPO1_WGM8
    SolutionIndex: 2
    SolutionNameMin: Cijk_Alik_Bljk_F8B8BS_BH_BiasB_HAS_SAB_SAV_MT16x16x64_MI16x16x1_SN_CLR1_GSU1_MIWT1_1_NEPBS0_PLR1_SPO1_WGM8
    SolutionIndex: 3
    SolutionNameMin: Cijk_Alik_Bljk_F8B8BS_BH_BiasB_HAS_SAB_SAV_MT16x16x32_MI16x16x1_SN_CLR0_GSU1_MIWT1_1_NEPBS2_PLR0_SPO0_WGM8
    SolutionIndex: 4
    SolutionNameMin: Cijk_Alik_Bljk_F8B8BS_BH_BiasB_HAS_SAB_SAV_MT16x16x64_MI16x16x1_SN_CLR1_GSU1_MIWT1_1_NEPBS2_PLR1_SPO0_WGM8
    SolutionIndex: 5
    SolutionNameMin: Cijk_Alik_Bljk_F8B8BS_BH_BiasB_HAS_SAB_SAV_MT16x16x64_MI16x16x1_SN_CLR1_GSU1_MIWT1_1_NEPBS2_PLR1_SPO1_WGM8
    SolutionIndex: 6
    SolutionNameMin: Cijk_Alik_Bljk_F8B8BS_BH_BiasB_HAS_SAB_SAV_UserArgs_MT64x96x256_MI16x16x1_SN_LDSB1_GRVWA16_GRVWB16_GSU1_LBSPPA512_LBSPPB256_LPA32_LPB32_LRVW16_MIWT2_3_SU4_SUM0_SUS256_SVW2_VWA2_WG32_8_1_WGM1
    SolutionIndex: 7
    SolutionNameMin: Cijk_Alik_Bljk_F8B8BS_BH_BiasB_HAS_SAB_SAV_UserArgs_MT96x96x256_MI16x16x1_SN_LDSB1_GRVWA16_GRVWB16_GSU1_LBSPPA256_LBSPPB256_LPA32_LPB32_LRVW16_MIWT3_3_SU4_SUM0_SUS256_SVW1_VWA1_WG32_8_1_WGM1
    SolutionIndex: 8
    SolutionNameMin: Cijk_Alik_Bljk_F8B8BS_BH_BiasB_HAS_SAB_SAV_UserArgs_MT128x96x256_MI32x32x1_SN_LDSB1_GRVWA16_GRVWB16_GSU2_LBSPPA256_LBSPPB256_LPA16_LPB16_LRVW16_MIWT1_3_SU4_SUM0_SUS256_SVW1_VWA1_WG128_2_1_WGM1
    SolutionIndex: 9
    SolutionNameMin: Cijk_Alik_Bljk_F8B8BS_BH_BiasB_HAS_SAB_SAV_UserArgs_MT96x96x256_MI16x16x1_SN_LDSB1_GRVWA16_GRVWB16_GSU1_LBSPPA256_LBSPPB256_LPA32_LPB32_LRVW16_MIWT3_3_SU0_SUM0_SUS0_SVW1_VWA1_WG32_8_1_WGM1
    SolutionIndex: 10
    SolutionNameMin: Cijk_Alik_Bljk_F8B8BS_BH_BiasB_HAS_SAB_SAV_UserArgs_MT128x112x256_MI16x16x1_SN_LDSB1_GRVWA8_GRVWB8_GSU7_LBSPPA512_LBSPPB256_LPA8_LPB8_LRVW8_MIWT2_7_SU4_SUM0_SUS256_SVW2_VWA2_WG64_4_1_WGM1
    SolutionIndex: 11
    SolutionNameMin: Cijk_Alik_Bljk_F8B8BS_BH_BiasB_HAS_SAB_SAV_UserArgs_MT256x128x128_MI32x32x1_SN_LDSB1_GRVWA16_GRVWB16_GSU1_LBSPPA512_LBSPPB128_LPA16_LPB16_LRVW16_MIWT4_2_SU0_SUM0_SUS0_SVW4_VWA4_WG64_4_1_WGM1
    SolutionIndex: 12
    SolutionNameMin: Cijk_Alik_Bljk_F8B8BS_BH_BiasB_HAS_SAB_SAV_UserArgs_MT256x128x128_MI32x32x1_SN_LDSB1_GRVWA16_GRVWB16_GSU1_LBSPPA512_LBSPPB128_LPA16_LPB16_LRVW16_MIWT4_2_SU4_SUM0_SUS256_SVW4_VWA4_WG64_4_1_WGM1
    SolutionIndex: 13
    SolutionNameMin: Cijk_Alik_Bljk_F8B8BS_BH_BiasB_HAS_SAB_SAV_UserArgs_MT128x96x256_MI32x32x1_SN_LDSB1_GRVWA16_GRVWB16_GSU1_LBSPPA256_LBSPPB256_LPA16_LPB16_LRVW16_MIWT1_3_SU4_SUM0_SUS256_SVW1_VWA1_WG128_2_1_WGM1
    SolutionIndex: 14
    SolutionNameMin: Cijk_Alik_Bljk_F8B8BS_BH_BiasB_HAS_SAB_SAV_UserArgs_MT128x128x128_MI32x32x1_SN_LDSB1_GRVWA16_GRVWB16_GSU1_LBSPPA256_LBSPPB128_LPA16_LPB16_LRVW16_MIWT2_2_SU4_SUM0_SUS256_SVW2_VWA2_WG64_4_1_WGM1
    SolutionIndex: 15
    SolutionNameMin: Cijk_Alik_Bljk_F8B8BS_BH_BiasB_HAS_SAB_SAV_UserArgs_MT256x256x64_MI32x32x1_SN_LDSB1_GRVWA16_GRVWB16_GSU1_LBSPPA128_LBSPPB128_LPA16_LPB16_LRVW16_MIWT2_8_SU4_SUM0_SUS256_SVW2_VWA2_WG128_2_1_WGM1
    SolutionIndex: 16
    SolutionNameMin: Cijk_Alik_Bljk_F8B8BS_BH_BiasB_HAS_SAB_SAV_UserArgs_MT112x128x256_MI16x16x1_SN_LDSB1_GRVWA8_GRVWB8_GSU1_LBSPPA256_LBSPPB256_LPA8_LPB8_LRVW8_MIWT7_2_SU0_SUM0_SUS0_SVW1_VWA1_WG16_16_1_WGM1
    SolutionIndex: 17
    SolutionNameMin: Cijk_Alik_Bljk_F8B8BS_BH_BiasB_HAS_SAB_SAV_UserArgs_MT256x128x64_MI32x32x1_SN_LDSB1_GRVWA16_GRVWB8_GSU1_LBSPPA256_LBSPPB128_LPA16_LPB16_LRVW16_MIWT4_2_SU4_SUM0_SUS256_SVW4_VWA4_WG64_4_1_WGM1
    SolutionIndex: 18
    SolutionNameMin: Cijk_Alik_Bljk_F8B8BS_BH_BiasB_HAS_SAB_SAV_UserArgs_MT256x208x128_MI16x16x1_SN_LDSB1_GRVWA8_GRVWB8_GSU1_LBSPPA512_LBSPPB128_LPA8_LPB8_LRVW8_MIWT4_13_SU4_SUM0_SUS256_SVW4_VWA4_WG64_4_1_WGM1
    SolutionIndex: 19
    SolutionNameMin: Cijk_Alik_Bljk_F8B8BS_BH_BiasB_HAS_SAB_SAV_UserArgs_MT256x192x128_MI32x32x1_SN_LDSB1_GRVWA16_GRVWB16_GSU1_LBSPPA256_LBSPPB128_LPA16_LPB16_LRVW16_MIWT2_6_SU0_SUM0_SUS0_SVW2_VWA2_WG128_2_1_WGM1
    SolutionIndex: 20
    SolutionNameMin: Cijk_Alik_Bljk_F8B8BS_BH_BiasB_HAS_SAB_SAV_UserArgs_MT256x128x64_MI32x32x1_SN_LDSB1_GRVWA16_GRVWB16_GSU1_LBSPPA256_LBSPPB128_LPA16_LPB16_LRVW16_MIWT4_2_SU0_SUM0_SUS0_SVW4_VWA4_WG64_4_1_WGM1
- - - [128, 1, 1, 128]
    - [4, 0.0]
  - - [1, 128, 1, 128]
    - [0, 0.0]
  - - [1, 1, 1, 128]
    - [1, 0.0]
  - - [128, 128, 1, 128]
    - [3, 0.0]
  - - [127, 127, 1, 128]
    - [2, 0.0]
  - - [129, 129, 1, 128]
    - [5, 0.0]
  - - [1024, 1024, 1, 8192]
    - [6, 0.0]
  - - [3072, 768, 1, 262144]
    - [7, 0.0]
  - - [768, 2304, 1, 262144]
    - [8, 0.0]
  - - [768, 3072, 1, 262144]
    - [9, 0.0]
  - - [768, 768, 1, 262144]
    - [10, 0.0]
  - - [1024, 8192, 1, 1024]
    - [11, 0.0]
  - - [1024, 8192, 1, 3072]
    - [12, 0.0]
  - - [1024, 8192, 1, 4096]
    - [11, 0.0]
  - - [1024, 3072, 1, 8192]
    - [13, 0.0]
  - - [1024, 4096, 1, 8192]
    - [14, 0.0]
  - - [4096, 8192, 1, 1024]
    - [15, 0.0]
  - - [4096, 1024, 1, 8192]
    - [16, 0.0]
  - - [3072, 262144, 1, 768]
    - [17, 0.0]
  - - [768, 262144, 1, 2304]
    - [18, 0.0]
  - - [768, 262144, 1, 3072]
    - [19, 0.0]
  - - [768, 262144, 1, 768]
    - [20, 0.0]
- null
- null
- DeviceEfficiency
- GridBased
