library/src/amd_detail/rocblaslt/src/Tensile/Logic/asm_full/aquavanjaram/gfx942/GridBased/aquavanjaram_Cijk_Ailk_Bljk_F8H_F8HS_BH_BiasSH_AS_SAB_SAV_UserArgs.yaml
- {MinimumRequiredVersion: 4.33.0}
- aquavanjaram
- gfx942
- [Device 0049, Device 0050]
    SolutionIndex: 0
    SolutionNameMin: Cijk_Ailk_Bljk_F8H_F8HS_BH_BiasSH_AS_SAB_SAV_UserArgs_MT128x16x128_MI16x16x1_SN_LDSB1_GRVWA16_GRVWB8_GSU16_GSUAMB_LBSPPA2048_LPA32_LPB32_LRVW16_MIWT2_1_NLCA1_SU32_SUM0_SUS256_SVW2_VWA2_WG64_4_1_WGM1
    SolutionIndex: 1
    SolutionNameMin: Cijk_Ailk_Bljk_F8H_F8HS_BH_BiasSH_AS_SAB_SAV_UserArgs_MT128x16x128_MI16x16x1_SN_LDSB1_GRVWA16_GRVWB8_GSU8_GSUAMBSK_LBSPPA2048_LPA32_LPB32_LRVW16_MIWT2_1_NLCA1_SU32_SUM0_SUS256_SVW2_VWA2_WG64_4_1_WGM1
    SolutionIndex: 2
    SolutionNameMin: Cijk_Ailk_Bljk_F8H_F8HS_BH_BiasSH_AS_SAB_SAV_UserArgs_MT128x32x64_MI16x16x1_SN_LDSB0_GRVWA16_GRVWB8_GSU8_GSUAMBSK_LBSPPA1024_LPA64_LPB8_LRVW8_MIWT4_1_NLCA1_SU32_SUM0_SUS256_SVW4_VWA4_WG32_8_1_WGM1
    SolutionIndex: 3
    SolutionNameMin: Cijk_Ailk_Bljk_F8H_F8HS_BH_BiasSH_AS_SAB_SAV_UserArgs_MT256x16x128_MI16x16x1_SN_LDSB1_GRVWA16_GRVWB8_GSU2_GSUAMBSK_LBSPPA4096_LPA64_LPB32_LRVW16_MIWT4_1_NLCA1_SU32_SUM0_SUS256_SVW4_VWA4_WG64_4_1_WGM1
    SolutionIndex: 4
    SolutionNameMin: Cijk_Ailk_Bljk_F8H_F8HS_BH_BiasSH_AS_SAB_SAV_UserArgs_MT128x16x128_MI16x16x1_SN_LDSB1_GRVWA16_GRVWB8_GSU1_GSUAMB_LBSPPA2048_LPA32_LPB32_LRVW16_MIWT2_1_NLCA1_SU32_SUM0_SUS256_SVW2_VWA2_WG64_4_1_WGM1
    SolutionIndex: 5
    SolutionNameMin: Cijk_Ailk_Bljk_F8H_F8HS_BH_BiasSH_AS_SAB_SAV_UserArgs_MT256x16x128_MI16x16x1_SN_LDSB1_GRVWA16_GRVWB8_GSU3_GSUAMBSK_LBSPPA4096_LPA64_LPB32_LRVW16_MIWT4_1_NLCA1_SU32_SUM0_SUS256_SVW4_VWA4_WG64_4_1_WGM1
    SolutionIndex: 6
    SolutionNameMin: Cijk_Ailk_Bljk_F8H_F8HS_BH_BiasSH_AS_SAB_SAV_UserArgs_MT16x16x256_MI16x16x1_SN_GRVWA8_GSU4_LBSPPA256_LBSPPB256_LPA32_LPB32_LRVW16_MIWT1_1_SU32_SUM0_SUS256_WSGRB1_WG16_4_1_WGM16
    SolutionIndex: 7
    SolutionNameMin: Cijk_Ailk_Bljk_F8H_F8HS_BH_BiasSH_AS_SAB_SAV_UserArgs_MT16x32x256_MI16x16x1_SN_GRVWA8_GSU1_LBSPPA256_LBSPPB256_LPA32_LPB32_LRVW16_MIWT1_1_SU32_SUM0_SUS256_WSGRB1_WG16_8_1_WGM16
    SolutionIndex: 8
    SolutionNameMin: Cijk_Ailk_Bljk_F8H_F8HS_BH_BiasSH_AS_SAB_SAV_UserArgs_MT16x128x128_MI16x16x1_SN_GRVWA8_GSU4_LBSPPA128_LBSPPB128_MIWT1_2_SU32_SUM0_SUS256_WSGRA0_WSGRB2_WG16_16_1_WGM16
    SolutionIndex: 9
    SolutionNameMin: Cijk_Ailk_Bljk_F8H_F8HS_BH_BiasSH_AS_SAB_SAV_UserArgs_MT64x16x64_MI16x16x1_SN_GRVWA8_GRVWB4_GSU4_LBSPPA128_LBSPPB128_LPA8_LPB8_LRVW8_MIWT1_1_SU32_SUM0_SUS256_SVW1_TLDS2_VWA1_WSGRA1_WSGRB0_WG64_4_1_WGM16
    SolutionIndex: 10
    SolutionNameMin: Cijk_Ailk_Bljk_F8H_F8HS_BH_BiasSH_AS_SAB_SAV_UserArgs_MT128x16x128_MI16x16x1_SN_GRVWA16_GRVWB8_GSU8_LBSPPA2048_LBSPPB128_LPA32_LPB32_LRVW16_MIWT2_1_SU32_SUM0_SUS256_SVW2_TLDS1_VWA2_WSGRA2_WSGRB0_WG64_4_1_WGM16
    SolutionIndex: 11
    SolutionNameMin: Cijk_Ailk_Bljk_F8H_F8HS_BH_BiasSH_AS_SAB_SAV_UserArgs_MT128x16x128_MI16x16x1_SN_GRVWA8_GRVWB8_GSU3_LBSPPA2048_LBSPPB128_LPA32_LPB32_LRVW16_MIWT2_1_SU32_SUM0_SUS256_SVW2_TLDS1_VWA2_WSGRA1_WSGRB0_WG64_4_1_WGM16
    SolutionIndex: 12
    SolutionNameMin: Cijk_Ailk_Bljk_F8H_F8HS_BH_BiasSH_AS_SAB_SAV_UserArgs_MT128x16x128_MI16x16x1_SN_CLR1_GRVWA8_GRVWB8_GSU4_LBSPPA2048_LBSPPB128_LPA32_LPB32_LRVW16_MIWT2_1_PLR1_SU32_SUM0_SUS256_SVW2_TLDS1_VWA2_WSGRA2_WSGRB0_WG64_4_1_WGM16
    SolutionIndex: 13
    SolutionNameMin: Cijk_Ailk_Bljk_F8H_F8HS_BH_BiasSH_AS_SAB_SAV_UserArgs_MT256x16x64_MI16x16x1_SN_GRVWA16_GRVWB4_GSU8_LBSPPA2048_LBSPPB128_LPA64_LPB8_LRVW8_MIWT4_1_SU32_SUM0_SUS256_SVW4_VWA4_WSGRA0_WSGRB0_WG64_4_1_WGM16
    SolutionIndex: 14
    SolutionNameMin: Cijk_Ailk_Bljk_F8H_F8HS_BH_BiasSH_AS_SAB_SAV_UserArgs_MT128x32x128_MI16x16x1_SN_GRVWB8_GSU1_LPA32_MIWT2_2_SU32_SUM0_SUS256_SVW2_VWA2_WG64_4_1_WGM1
    SolutionIndex: 15
    SolutionNameMin: Cijk_Ailk_Bljk_F8H_F8HS_BH_BiasSH_AS_SAB_SAV_UserArgs_MT256x224x64_MI16x16x1_SN_GSU1_MIWT4_14_SU32_SUM0_SUS256_WGM16
    SolutionIndex: 16
    SolutionNameMin: Cijk_Ailk_Bljk_F8H_F8HS_BH_BiasSH_AS_SAB_SAV_UserArgs_MT128x128x128_MI32x32x1_SN_GSU1_MIWT2_2_SU32_SUM0_SUS256_WGM1
    SolutionIndex: 17
    SolutionNameMin: Cijk_Ailk_Bljk_F8H_F8HS_BH_BiasSH_AS_SAB_SAV_UserArgs_MT256x80x128_MI16x16x1_SN_GSU1_MIWT4_5_SU32_SUM0_SUS256_WGM16
    SolutionIndex: 18
    SolutionNameMin: Cijk_Ailk_Bljk_F8H_F8HS_BH_BiasSH_AS_SAB_SAV_UserArgs_MT256x80x128_MI16x16x1_SN_GSU1_MIWT4_5_SU32_SUM0_SUS256_WGM16
    SolutionIndex: 19
    SolutionNameMin: Cijk_Ailk_Bljk_F8H_F8HS_BH_BiasSH_AS_SAB_SAV_UserArgs_MT256x224x64_MI16x16x1_SN_GSU1_MIWT4_14_SU32_SUM0_SUS256_WGM16
    SolutionIndex: 20
    SolutionNameMin: Cijk_Ailk_Bljk_F8H_F8HS_BH_BiasSH_AS_SAB_SAV_UserArgs_MT256x240x64_MI16x16x1_SN_GSU1_MIWT4_15_SU32_SUM0_SUS256_WGM16
    SolutionIndex: 21
    SolutionNameMin: Cijk_Ailk_Bljk_F8H_F8HS_BH_BiasSH_AS_SAB_SAV_UserArgs_MT256x240x64_MI16x16x1_SN_GSU1_MIWT4_15_SU32_SUM0_SUS256_WGM1
    SolutionIndex: 22
    SolutionNameMin: Cijk_Ailk_Bljk_F8H_F8HS_BH_BiasSH_AS_SAB_SAV_UserArgs_MT256x256x64_MI16x16x1_SN_GSU1_MIWT8_8_SU32_SUM0_SUS256_WGM16
    SolutionIndex: 23
    SolutionNameMin: Cijk_Ailk_Bljk_F8H_F8HS_BH_BiasSH_AS_SAB_SAV_UserArgs_MT256x256x64_MI16x16x1_SN_GSU1_MIWT8_8_SU32_SUM0_SUS256_WGM16
    SolutionIndex: 24
    SolutionNameMin: Cijk_Ailk_Bljk_F8H_F8HS_BH_BiasSH_AS_SAB_SAV_UserArgs_MT256x128x64_MI16x16x1_SN_GSU1_MIWT8_4_SU32_SUM0_SUS256_WGM16
    SolutionIndex: 25
    SolutionNameMin: Cijk_Ailk_Bljk_F8H_F8HS_BH_BiasSH_AS_SAB_SAV_UserArgs_MT256x224x64_MI16x16x1_SN_GSU1_MIWT4_14_SU32_SUM0_SUS256_WGM16
    SolutionIndex: 26
    SolutionNameMin: Cijk_Ailk_Bljk_F8H_F8HS_BH_BiasSH_AS_SAB_SAV_UserArgs_MT256x224x64_MI16x16x1_SN_GSU1_MIWT4_14_SU32_SUM0_SUS256_WGM1
    SolutionIndex: 27
    SolutionNameMin: Cijk_Ailk_Bljk_F8H_F8HS_BH_BiasSH_AS_SAB_SAV_UserArgs_MT16x64x256_MI16x16x1_SN_GRVWB8_GSU8_LBSPPA256_LBSPPB256_LPB32_LRVW16_MIWT1_1_SU32_SUM0_SUS256_VWB1_WG16_16_1_WGM16
    SolutionIndex: 28
    SolutionNameMin: Cijk_Ailk_Bljk_F8H_F8HS_BH_BiasSH_AS_SAB_SAV_UserArgs_MT16x32x128_MI16x16x1_SN_GSU8_LBSPPA128_LBSPPB128_LPA32_LPB32_LRVW16_MIWT1_1_SU32_SUM0_SUS256_VWB1_WSGRA1_WG16_8_1_WGM1
    SolutionIndex: 29
    SolutionNameMin: Cijk_Ailk_Bljk_F8H_F8HS_BH_BiasSH_AS_SAB_SAV_UserArgs_MT16x64x256_MI16x16x1_SN_GSU4_LBSPPA256_LBSPPB256_LPA32_LPB32_LRVW16_MIWT1_1_SU32_SUM0_SUS256_VWB1_WSGRA1_WG16_16_1_WGM16
    SolutionIndex: 30
    SolutionNameMin: Cijk_Ailk_Bljk_F8H_F8HS_BH_BiasSH_AS_SAB_SAV_UserArgs_MT16x16x256_MI16x16x1_SN_CLR1_GRVWA8_GRVWB8_GSU4_LBSPPA256_LBSPPB256_LPA32_LPB32_LRVW16_MIWT1_1_PLR1_SU32_SUM0_SUS256_TLDS2_WSGRA1_WSGRB0_WGM16
    SolutionIndex: 31
    SolutionNameMin: Cijk_Ailk_Bljk_F8H_F8HS_BH_BiasSH_AS_SAB_SAV_UserArgs_MT128x16x128_MI16x16x1_SN_GSU16_LBSPPA2048_LBSPPB128_LPA64_LPB32_LRVW16_MIWT4_1_SU32_SUM0_SUS256_SVW4_VWA4_WG32_4_1_WGM1
    SolutionIndex: 32
    SolutionNameMin: Cijk_Ailk_Bljk_F8H_F8HS_BH_BiasSH_AS_SAB_SAV_UserArgs_MT16x16x128_MI16x16x1_SN_GSU1_LBSPPA256_LBSPPB128_LPB32_LRVW16_MIWT1_1_SU32_SUM0_SUS256_VWB1_WSGRA0_WSGRB0_WG16_4_1_WGM16
    SolutionIndex: 33
    SolutionNameMin: Cijk_Ailk_Bljk_F8H_F8HS_BH_BiasSH_AS_SAB_SAV_UserArgs_MT128x16x128_MI16x16x1_SN_GSU8_GSUAMBSK_MIWT2_1_SU32_SUM0_SUS128_WGM1
    SolutionIndex: 34
    SolutionNameMin: Cijk_Ailk_Bljk_F8H_F8HS_BH_BiasSH_AS_SAB_SAV_UserArgs_MT16x16x32_MI16x16x1_SN_CLR0_GRVWA8_GRVWB8_GSU64_LBSPPA128_LBSPPB128_LPA16_LPB8_LRVW8_MIWT1_1_PLR0_SU32_SUM0_SUS256_TLDS1_WSGRA1_WSGRB1_WGM16
    SolutionIndex: 35
    SolutionNameMin: Cijk_Ailk_Bljk_F8H_F8HS_BH_BiasSH_AS_SAB_SAV_UserArgs_MT16x16x256_MI16x16x1_SN_CLR1_GRVWA8_GRVWB4_GSU128_LBSPPA256_LBSPPB256_LPA16_LPB32_LRVW16_MIWT1_1_PLR1_SU32_SUM0_SUS256_TLDS1_WSGRA0_WSGRB2_WGM1
- - - [16384, 32, 1, 2048]
    - [4, 0.0]
  - - [16384, 32, 1, 4096]
    - [14, 0.0]
  - - [2048, 16, 1, 16384]
    - [0, 0.0]
  - - [2048, 32, 1, 16384]
    - [1, 0.0]
  - - [4096, 16, 1, 16384]
    - [33, 0.0]
  - - [4096, 32, 1, 16384]
    - [2, 0.0]
  - - [16384, 16, 1, 2048]
    - [3, 0.0]
  - - [16384, 16, 1, 4096]
    - [5, 0.0]
  - - [16, 16, 1, 1024]
    - [30, 0.0]
  - - [16, 16, 1, 8192]
    - [34, 0.0]
  - - [16, 16, 1, 65536]
    - [35, 0.0]
  - - [16, 2048, 1, 1024]
    - [6, 0.0]
  - - [16, 2048, 1, 8192]
    - [28, 0.0]
  - - [16, 2048, 1, 16384]
    - [29, 0.0]
  - - [16, 2048, 1, 65536]
    - [27, 0.0]
  - - [16, 8192, 1, 1024]
    - [32, 11032.2]
  - - [16, 8192, 1, 8192]
    - [7, 0.0]
  - - [16, 8192, 1, 65536]
    - [8, 0.0]
  - - [2048, 16, 1, 1024]
    - [9, 0.0]
  - - [2048, 16, 1, 8192]
    - [10, 0.0]
  - - [2048, 16, 1, 65536]
    - [31, 0.0]
  - - [8192, 16, 1, 1024]
    - [11, 0.0]
  - - [8192, 16, 1, 8192]
    - [12, 0.0]
  - - [8192, 16, 1, 65536]
    - [13, 0.0]
  - - [2048, 8192, 1, 1024]
    - [15, 0.0]
  - - [2048, 2048, 1, 1024]
    - [16, 0.0]
  - - [2048, 2048, 1, 8192]
    - [17, 0.0]
  - - [2048, 2048, 1, 65536]
    - [18, 0.0]
  - - [2048, 8192, 1, 8192]
    - [19, 0.0]
  - - [2048, 8192, 1, 65536]
    - [20, 0.0]
  - - [8192, 2048, 1, 1024]
    - [21, 0.0]
  - - [8192, 2048, 1, 8192]
    - [22, 0.0]
  - - [8192, 2048, 1, 65536]
    - [23, 0.0]
  - - [8192, 8192, 1, 1024]
    - [24, 0.0]
  - - [8192, 8192, 1, 8192]
    - [25, 0.0]
  - - [8192, 8192, 1, 65536]
    - [26, 0.0]
- null
- null
- DeviceEfficiency
- GridBased
