library/src/amd_detail/rocblaslt/src/Tensile/Logic/asm_full/aquavanjaram/gfx942/GridBased/aquavanjaram_Cijk_Alik_Bjlk_BBS_BH_Bias_HAS_SAV_UserArgs.yaml
- {MinimumRequiredVersion: 4.33.0}
- aquavanjaram
- gfx942
- [Device 0049, Device 0050]
    SolutionIndex: 0
    SolutionNameMin: Cijk_Alik_Bjlk_BBS_BH_Bias_HAS_SAV_UserArgs_MT16x16x32_MI16x16x1_SN_LDSB0_GRVWA4_GSU1_LBSPPA128_LBSPPB128_LPA4_LRVW4_MIWT1_1_SU0_SUM0_SUS0_SVW1_VWA1_WG16_4_1_WGM8
    SolutionIndex: 1
    SolutionNameMin: Cijk_Alik_Bjlk_BBS_BH_Bias_HAS_SAV_UserArgs_MT32x16x64_MI16x16x1_SN_LDSB0_GRVWA8_GSU1_LBSPPA128_LBSPPB256_LPA16_LRVW8_MIWT1_1_SU0_SUM0_SUS0_SVW1_VWA1_WG32_4_1_WGM8
    SolutionIndex: 2
    SolutionNameMin: Cijk_Alik_Bjlk_BBS_BH_Bias_HAS_SAV_UserArgs_MT128x16x64_MI16x16x1_SN_LDSB1_GRVWA8_GSU1_LBSPPA256_LBSPPB256_LPA16_LRVW8_MIWT2_1_SU0_SUM0_SUS0_SVW2_VWA2_WG64_4_1_WGM8
    SolutionIndex: 3
    SolutionNameMin: Cijk_Alik_Bjlk_BBS_BH_Bias_HAS_SAV_UserArgs_MT256x16x64_MI16x16x1_SN_LDSB1_GRVWA8_GSU1_LBSPPA512_LBSPPB256_LPA16_LRVW8_MIWT4_1_SU0_SUM0_SUS0_SVW4_VWA4_WG64_4_1_WGM8
    SolutionIndex: 4
    SolutionNameMin: Cijk_Alik_Bjlk_BBS_BH_Bias_HAS_SAV_UserArgs_MT448x16x64_MI16x16x1_SN_LDSB1_GRVWA4_GSU1_LBSPPA128_LBSPPB128_LPA4_LRVW4_MIWT7_1_SU0_SUM0_SUS0_SVW1_VWA1_WG64_4_1_WGM8
    SolutionIndex: 5
    SolutionNameMin: Cijk_Alik_Bjlk_BBS_BH_Bias_HAS_SAV_UserArgs_MT32x16x128_MI16x16x1_SN_LDSB0_GRVWA8_GSU1_LBSPPA256_LBSPPB256_LPA16_LRVW8_MIWT1_1_SU0_SUM0_SUS0_SVW1_VWA1_WG32_4_1_WGM8
    SolutionIndex: 6
    SolutionNameMin: Cijk_Alik_Bjlk_BBS_BH_Bias_HAS_SAV_UserArgs_MT64x16x128_MI16x16x1_SN_LDSB1_GRVWA8_GSU1_LBSPPA256_LBSPPB256_LPA16_LRVW8_MIWT1_1_SU0_SUM0_SUS0_SVW1_VWA1_WG64_4_1_WGM8
- - - [1024, 1, 1, 256, 1024, 1024, 256, 1]
    - [0, 81.9512]
  - - [4096, 1, 1, 256, 4096, 4096, 256, 1]
    - [6, 290.293]
  - - [16384, 1, 1, 256, 16384, 16384, 256, 1]
    - [6, 1069.21]
  - - [65536, 1, 1, 256, 65536, 65536, 256, 1]
    - [3, 2220.6]
  - - [262144, 1, 1, 256, 262144, 262144, 256, 1]
    - [2, 2891.53]
  - - [1024, 1, 1, 1024, 1024, 1024, 1024, 1]
    - [5, 187.547]
  - - [4096, 1, 1, 1024, 4096, 4096, 1024, 1]
    - [5, 728.137]
  - - [16384, 1, 1, 1024, 16384, 16384, 1024, 1]
    - [6, 2177.77]
  - - [65536, 1, 1, 1024, 65536, 65536, 1024, 1]
    - [2, 2970.89]
  - - [262144, 1, 1, 1024, 262144, 262144, 1024, 1]
    - [2, 3382.82]
  - - [1024, 1, 1, 4096, 1024, 1024, 4096, 1]
    - [5, 363.399]
  - - [4096, 1, 1, 4096, 4096, 4096, 4096, 1]
    - [5, 1404.42]
  - - [16384, 1, 1, 4096, 16384, 16384, 4096, 1]
    - [1, 2248.02]
  - - [65536, 1, 1, 4096, 65536, 65536, 4096, 1]
    - [3, 3303.42]
  - - [262144, 1, 1, 4096, 262144, 262144, 4096, 1]
    - [4, 3603.88]
- null
- null
- DeviceEfficiency
- GridBased
