library/src/amd_detail/rocblaslt/src/Tensile/Logic/asm_full/aquavanjaram/gfx942/GridBased/aquavanjaram_Cijk_Alik_Bljk_F8BS_BH_BiasB_AS_SAB_SAV_UserArgs.yaml
- {MinimumRequiredVersion: 4.33.0}
- aquavanjaram
- gfx942
- [Device 0049, Device 0050]
    SolutionIndex: 0
    SolutionNameMin: Cijk_Alik_Bljk_F8BS_BH_BiasB_AS_SAB_SAV_MT16x16x32_MI16x16x1_SN_CLR0_GSU1_MIWT1_1_NEPBS2_PLR0_SPO0_WGM8
    SolutionIndex: 1
    SolutionNameMin: Cijk_Alik_Bljk_F8BS_BH_BiasB_AS_SAB_SAV_MT16x16x64_MI16x16x1_SN_CLR1_GSU1_MIWT1_1_NEPBS2_PLR1_SPO0_WGM8
    SolutionIndex: 2
    SolutionNameMin: Cijk_Alik_Bljk_F8BS_BH_BiasB_AS_SAB_SAV_MT16x16x32_MI16x16x1_SN_CLR0_GSU1_MIWT1_1_NEPBS2_PLR0_SPO1_WGM8
    SolutionIndex: 3
    SolutionNameMin: Cijk_Alik_Bljk_F8BS_BH_BiasB_AS_SAB_SAV_MT16x16x64_MI16x16x1_SN_CLR1_GSU1_MIWT1_1_NEPBS2_PLR1_SPO1_WGM8
    SolutionIndex: 4
    SolutionNameMin: Cijk_Alik_Bljk_F8BS_BH_BiasB_AS_SAB_SAV_UserArgs_MT256x128x64_MI32x32x1_SN_LDSB1_GRVWA16_GRVWB16_GSU1_LBSPPA256_LBSPPB128_LPA16_LPB16_LRVW16_MIWT4_2_SU4_SUM0_SUS256_SVW4_VWA4_WG64_4_1_WGM1
    SolutionIndex: 5
    SolutionNameMin: Cijk_Alik_Bljk_F8BS_BH_BiasB_AS_SAB_SAV_UserArgs_MT256x128x64_MI32x32x1_SN_LDSB1_GRVWA16_GRVWB16_GSU1_LBSPPA256_LBSPPB128_LPA16_LPB16_LRVW16_MIWT4_2_SU0_SUM0_SUS0_SVW4_VWA4_WG64_4_1_WGM1
    SolutionIndex: 6
    SolutionNameMin: Cijk_Alik_Bljk_F8BS_BH_BiasB_AS_SAB_SAV_UserArgs_MT192x160x64_MI16x16x1_SN_LDSB1_GRVWA16_GRVWB8_GSU1_LBSPPA128_LBSPPB128_LPA16_LPB8_LRVW8_MIWT6_5_SU4_SUM0_SUS256_SVW2_VWA2_WG32_8_1_WGM1
    SolutionIndex: 7
    SolutionNameMin: Cijk_Alik_Bljk_F8BS_BH_BiasB_AS_SAB_SAV_UserArgs_MT256x208x128_MI16x16x1_SN_LDSB1_GRVWA8_GRVWB8_GSU1_LBSPPA512_LBSPPB128_LPA8_LPB8_LRVW8_MIWT4_13_SU0_SUM0_SUS0_SVW4_VWA4_WG64_4_1_WGM1
    SolutionIndex: 8
    SolutionNameMin: Cijk_Alik_Bljk_F8BS_BH_BiasB_AS_SAB_SAV_UserArgs_MT256x128x128_MI32x32x1_SN_LDSB1_GRVWA16_GRVWB16_GSU1_LBSPPA512_LBSPPB128_LPA16_LPB16_LRVW16_MIWT4_2_SU4_SUM0_SUS256_SVW4_VWA4_WG64_4_1_WGM1
- - - [128, 1, 1, 128]
    - [2, 0.0]
  - - [1, 128, 1, 128]
    - [2, 0.0]
  - - [1, 1, 1, 128]
    - [1, 0.0]
  - - [128, 128, 1, 128]
    - [3, 0.0]
  - - [127, 127, 1, 128]
    - [2, 0.0]
  - - [129, 129, 1, 128]
    - [0, 0.0]
  - - [3072, 8192, 1, 1024]
    - [4, 0.0]
  - - [4096, 8192, 1, 1024]
    - [5, 0.0]
  - - [2304, 262144, 1, 768]
    - [6, 0.0]
  - - [3072, 262144, 1, 768]
    - [7, 0.0]
  - - [1024, 8192, 1, 1024]
    - [8, 0.0]
  - - [1024, 8192, 1, 4096]
    - [8, 0.0]
  - - [768, 262144, 1, 3072]
    - [7, 0.0]
  - - [768, 262144, 1, 768]
    - [4, 0.0]
- null
- null
- DeviceEfficiency
- GridBased
