library/src/amd_detail/rocblaslt/src/Tensile/Logic/asm_full/aldebaran/104CU/Equality/aldebaran_Cijk_Alik_Bljk_BBS_BH_Bias_HAH_SAV.yaml
- {MinimumRequiredVersion: 4.33.0}
- aldebaran
- {Architecture: gfx90a, CUCount: 104}
- [Device 0050, Device 0051, Device 0052, Device 0054, Device 0062, Device 7400, Device
    SolutionIndex: 0
    SolutionNameMin: Cijk_Alik_Bljk_BBS_BBiasH_HAH_SAV_MT64x16x32_MI16x16x16x1_SN_1LDSB0_AFC1_GRVW4_GSU1_LPA4_LPB4_LRVW4_MIWT1_1_PLR3_WG64_4_1
    SolutionIndex: 1
    SolutionNameMin: Cijk_Alik_Bljk_BBS_BBiasH_HAH_SAV_MT192x64x32_MI32x32x8x1_SN_1LDSB0_AFC1_GRVW8_GSU1_LPA8_LPB8_LRVW8_MIWT3_1_PLR5_WG64_4_1
    SolutionIndex: 2
    SolutionNameMin: Cijk_Alik_Bljk_BBS_BBiasH_HAH_SAV_MT128x128x32_MI32x32x8x1_SN_1LDSB0_AFC1_GRVW8_GSU1_LPA8_LPB8_LRVW8_MIWT2_2_PLR5_WG64_4_1
    SolutionIndex: 3
    SolutionNameMin: Cijk_Alik_Bljk_BBS_BBiasH_HAH_SAV_MT256x128x32_MI32x32x8x1_SN_1LDSB0_AFC1_GRVW8_GSU1_LPA8_LPB8_LRVW8_MIWT4_2_PLR5_WG64_4_1
    SolutionIndex: 4
    SolutionNameMin: Cijk_Alik_Bljk_BBS_BBiasH_HAH_SAV_MT64x192x32_MI32x32x8x1_SN_1LDSB0_AFC1_GRVW2_GSU1_LPA4_LPB4_LRVW4_MIWT1_3_PLR5_WG64_4_1
    SolutionIndex: 5
    SolutionNameMin: Cijk_Alik_Bljk_BBS_BBiasH_HAH_SAV_MT96x256x32_MI32x32x8x1_SN_1LDSB0_AFC1_GRVW4_GSU1_LPA4_LPB4_LRVW4_MIWT3_2_PLR5_WG32_8_1
    SolutionIndex: 6
    SolutionNameMin: Cijk_Alik_Bljk_BBS_BBiasH_HAH_SAV_MT128x256x32_MI32x32x8x1_SN_1LDSB0_AFC1_GRVW4_GSU1_LPA4_LPB4_LRVW4_MIWT2_4_PLR5_WG64_4_1
    SolutionIndex: 7
    SolutionNameMin: Cijk_Alik_Bljk_BBS_BBiasH_HAH_SAV_MT128x128x32_MI32x32x8x1_SN_1LDSB1_AFC1_GRVW8_GSU1_LPA8_LPB8_LRVW4_MIWT2_2_PLR5_WG64_4_1
    SolutionIndex: 8
    SolutionNameMin: Cijk_Alik_Bljk_BBS_BBiasH_HAH_SAV_MT160x128x32_MI32x32x8x1_SN_1LDSB1_AFC1_GRVW4_GSU1_LPA8_LPB8_LRVW8_MIWT5_1_PLR5_WG32_8_1
    SolutionIndex: 9
    SolutionNameMin: Cijk_Alik_Bljk_BBS_BBiasH_HAH_SAV_MT176x128x32_MI16x16x16x1_SN_1LDSB1_AFC1_GRVW2_GSU1_LPA4_LPB4_LRVW4_MIWT11_2_PLR3_WG16_16_1
    SolutionIndex: 10
    SolutionNameMin: Cijk_Alik_Bljk_BBS_BBiasH_HAH_SAV_MT128x208x32_MI16x16x16x1_SN_1LDSB1_AFC1_GRVW2_GSU1_LPA4_LPB4_LRVW4_MIWT2_13_PLR3_WG64_4_1
    SolutionIndex: 11
    SolutionNameMin: Cijk_Alik_Bljk_BBS_BBiasH_HAH_SAV_MT128x256x32_MI32x32x8x1_SN_1LDSB1_AFC1_GRVW4_GSU1_LPA4_LPB4_LRVW4_MIWT2_4_PLR5_WG64_4_1
    SolutionIndex: 12
    SolutionNameMin: Cijk_Alik_Bljk_BBS_BBiasH_HAH_SAV_MT160x256x32_MI32x32x8x1_SN_1LDSB1_AFC1_GRVW4_GSU1_LPA8_LPB8_LRVW8_MIWT5_2_PLR5_WG32_8_1
    SolutionIndex: 13
    SolutionNameMin: Cijk_Alik_Bljk_BBS_BBiasH_HAH_SAV_MT256x256x32_MI32x32x8x1_SN_1LDSB1_AFC1_GRVW8_GSU1_LPA8_LPB8_LRVW8_MIWT2_8_PLR5_WG128_2_1
    SolutionIndex: 14
    SolutionNameMin: Cijk_Alik_Bljk_BBS_BBiasH_HAH_SAV_MT64x16x64_MI16x16x16x1_SN_1LDSB0_AFC1_GRVW2_GSU1_LPA4_LPB4_LRVW4_MIWT1_1_PLR5_WG64_4_1
    SolutionIndex: 15
    SolutionNameMin: Cijk_Alik_Bljk_BBS_BBiasH_HAH_SAV_MT64x16x64_MI16x16x16x1_SN_1LDSB0_AFC1_GRVW4_GSU1_LPA4_LPB4_LRVW4_MIWT1_1_PLR5_WG64_4_1
    SolutionIndex: 16
    SolutionNameMin: Cijk_Alik_Bljk_BBS_BBiasH_HAH_SAV_MT64x16x64_MI16x16x16x1_SN_1LDSB0_AFC1_GRVW8_GSU1_LPA8_LPB8_LRVW4_MIWT1_1_PLR5_WG64_4_1
    SolutionIndex: 17
    SolutionNameMin: Cijk_Alik_Bljk_BBS_BBiasH_HAH_SAV_MT64x16x64_MI16x16x16x1_SN_1LDSB0_AFC1_GRVW8_GSU1_LPA16_LPB16_LRVW8_MIWT1_1_PLR5_WG64_4_1
    SolutionIndex: 18
    SolutionNameMin: Cijk_Alik_Bljk_BBS_BBiasH_HAH_SAV_MT64x16x64_MI16x16x16x1_SN_1LDSB0_AFC0_GRVW8_GSU2_LPA16_LPB16_LRVW8_MIWT1_1_PLR5_WG64_4_1
    SolutionIndex: 19
    SolutionNameMin: Cijk_Alik_Bljk_BBS_BBiasH_HAH_SAV_MT32x32x64_MI16x16x16x1_SN_1LDSB0_AFC1_GRVW2_GSU1_LPA16_LPB16_LRVW8_MIWT1_1_PLR5_WG32_8_1
    SolutionIndex: 20
    SolutionNameMin: Cijk_Alik_Bljk_BBS_BBiasH_HAH_SAV_MT32x32x64_MI16x16x16x1_SN_1LDSB0_AFC1_GRVW8_GSU1_LPA16_LPB16_LRVW8_MIWT1_1_PLR5_WG32_8_1
    SolutionIndex: 21
    SolutionNameMin: Cijk_Alik_Bljk_BBS_BBiasH_HAH_SAV_MT32x32x64_MI16x16x16x1_SN_1LDSB0_AFC0_GRVW4_GSU2_LPA16_LPB16_LRVW8_MIWT1_1_PLR5_WG32_8_1
    SolutionIndex: 22
    SolutionNameMin: Cijk_Alik_Bljk_BBS_BBiasH_HAH_SAV_MT32x32x64_MI16x16x16x1_SN_1LDSB0_AFC0_GRVW8_GSU2_LPA16_LPB16_LRVW8_MIWT1_1_PLR5_WG32_8_1
    SolutionIndex: 23
    SolutionNameMin: Cijk_Alik_Bljk_BBS_BBiasH_HAH_SAV_MT64x32x64_MI16x16x16x1_SN_1LDSB0_AFC1_GRVW4_GSU1_LPA4_LPB4_LRVW4_MIWT2_1_PLR5_WG32_8_1
    SolutionIndex: 24
    SolutionNameMin: Cijk_Alik_Bljk_BBS_BBiasH_HAH_SAV_MT64x32x64_MI16x16x16x1_SN_1LDSB0_AFC1_GRVW8_GSU1_LPA16_LPB16_LRVW8_MIWT2_1_PLR5_WG32_8_1
    SolutionIndex: 25
    SolutionNameMin: Cijk_Alik_Bljk_BBS_BBiasH_HAH_SAV_MT96x32x64_MI16x16x16x1_SN_1LDSB0_AFC1_GRVW8_GSU1_LPA16_LPB16_LRVW8_MIWT3_1_PLR5_WG32_8_1
    SolutionIndex: 26
    SolutionNameMin: Cijk_Alik_Bljk_BBS_BBiasH_HAH_SAV_MT128x32x64_MI32x32x8x1_SN_1LDSB0_AFC0_GRVW8_GSU2_LPA8_LPB8_LRVW8_MIWT1_1_PLR9_WG128_2_1
    SolutionIndex: 27
    SolutionNameMin: Cijk_Alik_Bljk_BBS_BBiasH_HAH_SAV_MT32x64x64_MI16x16x16x1_SN_1LDSB0_AFC1_GRVW4_GSU1_LPA4_LPB4_LRVW4_MIWT2_1_PLR5_WG16_16_1
    SolutionIndex: 28
    SolutionNameMin: Cijk_Alik_Bljk_BBS_BBiasH_HAH_SAV_MT32x64x64_MI16x16x16x1_SN_1LDSB0_AFC1_GRVW8_GSU1_LPA16_LPB16_LRVW8_MIWT2_1_PLR5_WG16_16_1
    SolutionIndex: 29
    SolutionNameMin: Cijk_Alik_Bljk_BBS_BBiasH_HAH_SAV_MT48x64x64_MI16x16x16x1_SN_1LDSB0_AFC1_GRVW4_GSU1_LPA16_LPB16_LRVW8_MIWT3_1_PLR5_WG16_16_1
    SolutionIndex: 30
    SolutionNameMin: Cijk_Alik_Bljk_BBS_BBiasH_HAH_SAV_MT64x64x64_MI32x32x8x1_SN_1LDSB0_AFC1_GRVW2_GSU1_LPA8_LPB8_LRVW8_MIWT1_1_PLR9_WG64_4_1
    SolutionIndex: 31
    SolutionNameMin: Cijk_Alik_Bljk_BBS_BBiasH_HAH_SAV_MT64x64x64_MI32x32x8x1_SN_1LDSB0_AFC1_GRVW8_GSU1_LPA8_LPB8_LRVW8_MIWT1_1_PLR9_WG64_4_1
    SolutionIndex: 32
    SolutionNameMin: Cijk_Alik_Bljk_BBS_BBiasH_HAH_SAV_MT80x64x64_MI16x16x16x1_SN_1LDSB0_AFC1_GRVW4_GSU1_LPA4_LPB4_LRVW4_MIWT5_1_PLR5_WG16_16_1
    SolutionIndex: 33
    SolutionNameMin: Cijk_Alik_Bljk_BBS_BBiasH_HAH_SAV_MT96x64x64_MI16x16x16x1_SN_1LDSB0_AFC0_GRVW8_GSU2_LPA16_LPB16_LRVW8_MIWT6_1_PLR5_WG16_16_1
    SolutionIndex: 34
    SolutionNameMin: Cijk_Alik_Bljk_BBS_BBiasH_HAH_SAV_MT128x64x64_MI32x32x8x1_SN_1LDSB0_AFC1_GRVW8_GSU1_LPA8_LPB8_LRVW8_MIWT2_1_PLR9_WG64_4_1
    SolutionIndex: 35
    SolutionNameMin: Cijk_Alik_Bljk_BBS_BBiasH_HAH_SAV_MT160x64x64_MI16x16x16x1_SN_1LDSB0_AFC1_GRVW4_GSU1_LPA4_LPB4_LRVW4_MIWT10_1_PLR5_WG16_16_1
    SolutionIndex: 36
    SolutionNameMin: Cijk_Alik_Bljk_BBS_BBiasH_HAH_SAV_MT176x64x64_MI16x16x16x1_SN_1LDSB0_AFC1_GRVW4_GSU1_LPA4_LPB4_LRVW4_MIWT11_1_PLR5_WG16_16_1
    SolutionIndex: 37
    SolutionNameMin: Cijk_Alik_Bljk_BBS_BBiasH_HAH_SAV_MT128x80x64_MI16x16x16x1_SN_1LDSB0_AFC1_GRVW4_GSU1_LPA4_LPB4_LRVW4_MIWT2_5_PLR5_WG64_4_1
    SolutionIndex: 38
    SolutionNameMin: Cijk_Alik_Bljk_BBS_BBiasH_HAH_SAV_MT128x112x64_MI16x16x16x1_SN_1LDSB0_AFC1_GRVW4_GSU1_LPA4_LPB4_LRVW4_MIWT2_7_PLR5_WG64_4_1
    SolutionIndex: 39
    SolutionNameMin: Cijk_Alik_Bljk_BBS_BBiasH_HAH_SAV_MT64x128x64_MI32x32x8x1_SN_1LDSB0_AFC1_GRVW8_GSU1_LPA8_LPB8_LRVW8_MIWT2_1_PLR9_WG32_8_1
    SolutionIndex: 40
    SolutionNameMin: Cijk_Alik_Bljk_BBS_BBiasH_HAH_SAV_MT80x128x64_MI16x16x16x1_SN_1LDSB0_AFC1_GRVW4_GSU1_LPA4_LPB4_LRVW4_MIWT5_2_PLR5_WG16_16_1
    SolutionIndex: 41
    SolutionNameMin: Cijk_Alik_Bljk_BBS_BBiasH_HAH_SAV_MT96x128x64_MI32x32x8x1_SN_1LDSB0_AFC1_GRVW4_GSU1_LPA4_LPB4_LRVW4_MIWT3_1_PLR9_WG32_8_1
    SolutionIndex: 42
    SolutionNameMin: Cijk_Alik_Bljk_BBS_BBiasH_HAH_SAV_MT128x32x64_MI32x32x8x1_SN_1LDSB1_AFC1_GRVW8_GSU1_LPA8_LPB8_LRVW8_MIWT1_1_PLR9_WG128_2_1
    SolutionIndex: 43
    SolutionNameMin: Cijk_Alik_Bljk_BBS_BBiasH_HAH_SAV_MT160x32x64_MI16x16x16x1_SN_1LDSB1_AFC1_GRVW8_GSU1_LPA16_LPB16_LRVW8_MIWT5_1_PLR5_WG32_8_1
    SolutionIndex: 44
    SolutionNameMin: Cijk_Alik_Bljk_BBS_BBiasH_HAH_SAV_MT128x64x64_MI32x32x8x1_SN_1LDSB1_AFC1_GRVW8_GSU1_LPA8_LPB8_LRVW8_MIWT2_1_PLR9_WG64_4_1
    SolutionIndex: 45
    SolutionNameMin: Cijk_Alik_Bljk_BBS_BBiasH_HAH_SAV_MT64x96x64_MI16x16x16x1_SN_1LDSB1_AFC1_GRVW8_GSU1_LPA16_LPB16_LRVW8_MIWT2_3_PLR5_WG32_8_1
    SolutionIndex: 46
    SolutionNameMin: Cijk_Alik_Bljk_BBS_BBiasH_HAH_SAV_MT32x128x64_MI32x32x8x1_SN_1LDSB1_AFC1_GRVW8_GSU1_LPA8_LPB8_LRVW8_MIWT1_1_PLR9_WG32_8_1
    SolutionIndex: 47
    SolutionNameMin: Cijk_Alik_Bljk_BBS_BBiasH_HAH_SAV_MT64x128x64_MI32x32x8x1_SN_1LDSB1_AFC1_GRVW8_GSU1_LPA8_LPB8_LRVW8_MIWT2_1_PLR9_WG32_8_1
    SolutionIndex: 48
    SolutionNameMin: Cijk_Alik_Bljk_BBS_BBiasH_HAH_SAV_MT80x128x64_MI16x16x16x1_SN_1LDSB1_AFC1_GRVW4_GSU1_LPA4_LPB4_LRVW4_MIWT5_2_PLR5_WG16_16_1
    SolutionIndex: 49
    SolutionNameMin: Cijk_Alik_Bljk_BBS_BBiasH_HAH_SAV_MT96x128x64_MI32x32x8x1_SN_1LDSB1_AFC1_GRVW8_GSU1_LPA8_LPB8_LRVW8_MIWT3_1_PLR9_WG32_8_1
    SolutionIndex: 50
    SolutionNameMin: Cijk_Alik_Bljk_BBS_BBiasH_HAH_SAV_MT96x128x64_MI32x32x8x1_SN_1LDSB1_AFC0_GRVW8_GSU2_LPA8_LPB8_LRVW8_MIWT3_1_PLR9_WG32_8_1
    SolutionIndex: 51
    SolutionNameMin: Cijk_Alik_Bljk_BBS_BBiasH_HAH_SAV_MT128x128x64_MI32x32x8x1_SN_1LDSB1_AFC1_GRVW8_GSU1_LPA8_LPB8_LRVW8_MIWT2_2_PLR9_WG64_4_1
    SolutionIndex: 52
    SolutionNameMin: Cijk_Alik_Bljk_BBS_BBiasH_HAH_SAV_MT160x128x64_MI32x32x8x1_SN_1LDSB1_AFC1_GRVW8_GSU1_LPA8_LPB8_LRVW8_MIWT5_1_PLR9_WG32_8_1
    SolutionIndex: 53
    SolutionNameMin: Cijk_Alik_Bljk_BBS_BBiasH_HAH_SAV_MT160x128x64_MI32x32x8x1_SN_1LDSB1_AFC0_GRVW8_GSU2_LPA8_LPB8_LRVW8_MIWT5_1_PLR9_WG32_8_1
    SolutionIndex: 54
    SolutionNameMin: Cijk_Alik_Bljk_BBS_BBiasH_HAH_SAV_MT176x128x64_MI16x16x16x1_SN_1LDSB1_AFC1_GRVW4_GSU1_LPA4_LPB4_LRVW4_MIWT11_2_PLR5_WG16_16_1
    SolutionIndex: 55
    SolutionNameMin: Cijk_Alik_Bljk_BBS_BBiasH_HAH_SAV_MT176x128x64_MI16x16x16x1_SN_1LDSB1_AFC0_GRVW4_GSU2_LPA4_LPB4_LRVW4_MIWT11_2_PLR5_WG16_16_1
    SolutionIndex: 56
    SolutionNameMin: Cijk_Alik_Bljk_BBS_BBiasH_HAH_SAV_MT224x128x64_MI32x32x8x1_SN_1LDSB1_AFC1_GRVW8_GSU1_LPA8_LPB8_LRVW8_MIWT7_1_PLR9_WG32_8_1
    SolutionIndex: 57
    SolutionNameMin: Cijk_Alik_Bljk_BBS_BBiasH_HAH_SAV_MT256x128x64_MI32x32x8x1_SN_1LDSB1_AFC1_GRVW8_GSU1_LPA8_LPB8_LRVW8_MIWT4_2_PLR9_WG64_4_1
    SolutionIndex: 58
    SolutionNameMin: Cijk_Alik_Bljk_BBS_BBiasH_HAH_SAV_MT128x160x64_MI32x32x8x1_SN_1LDSB1_AFC1_GRVW8_GSU1_LPA8_LPB8_LRVW8_MIWT1_5_PLR9_WG128_2_1
    SolutionIndex: 59
    SolutionNameMin: Cijk_Alik_Bljk_BBS_BBiasH_HAH_SAV_MT96x192x64_MI16x16x16x1_SN_1LDSB1_AFC1_GRVW8_GSU1_LPA16_LPB16_LRVW8_MIWT6_3_PLR5_WG16_16_1
    SolutionIndex: 60
    SolutionNameMin: Cijk_Alik_Bljk_BBS_BBiasH_HAH_SAV_MT80x256x64_MI16x16x16x1_SN_1LDSB1_AFC1_GRVW2_GSU1_LPA4_LPB4_LRVW4_MIWT5_4_PLR5_WG16_16_1
    SolutionIndex: 61
    SolutionNameMin: Cijk_Alik_Bljk_BBS_BBiasH_HAH_SAV_MT80x256x64_MI16x16x16x1_SN_1LDSB1_AFC1_GRVW4_GSU1_LPA16_LPB16_LRVW8_MIWT5_4_PLR5_WG16_16_1
- - - [256, 1024, 1, 7616, 256, 256, 7616, 7616]
    - [33, 43279.6]
  - - [7616, 1024, 1, 256, 7616, 7616, 256, 256]
    - [56, 37009.7]
  - - [256, 512, 1, 7616, 256, 256, 7616, 7616]
    - [26, 25132.0]
  - - [7616, 512, 1, 256, 7616, 7616, 256, 256]
    - [47, 26352.8]
  - - [256, 1024, 1, 2400, 256, 256, 2400, 2400]
    - [29, 19944.4]
  - - [256, 1024, 1, 256, 256, 256, 256, 256]
    - [24, 3439.72]
  - - [9630, 1024, 1, 256, 9630, 9630, 256, 256]
    - [11, 37927.4]
  - - [2400, 1024, 1, 256, 2400, 2400, 256, 256]
    - [5, 22211.7]
  - - [256, 1024, 1, 4800, 256, 256, 4800, 4800]
    - [31, 34067.3]
  - - [12840, 1024, 1, 256, 12840, 12840, 256, 256]
    - [3, 41919.5]
  - - [3200, 1024, 1, 256, 3200, 3200, 256, 256]
    - [6, 26951.4]
  - - [256, 512, 1, 2400, 256, 256, 2400, 2400]
    - [27, 11129.4]
  - - [256, 512, 1, 256, 256, 256, 256, 256]
    - [0, 1734.08]
  - - [9630, 512, 1, 256, 9630, 9630, 256, 256]
    - [7, 28184.1]
  - - [2400, 512, 1, 256, 2400, 2400, 256, 256]
    - [41, 13641.5]
  - - [256, 512, 1, 4800, 256, 256, 4800, 4800]
    - [24, 19010.0]
  - - [12840, 512, 1, 256, 12840, 12840, 256, 256]
    - [59, 31328.5]
  - - [3200, 512, 1, 256, 3200, 3200, 256, 256]
    - [2, 16428.9]
  - - [2048, 1024, 1, 1024, 2048, 2048, 1024, 1024]
    - [61, 53268.3]
  - - [2048, 512, 1, 1024, 2048, 2048, 1024, 1024]
    - [40, 35536.7]
  - - [2048, 1024, 1, 7616, 2048, 2048, 7616, 7616]
    - [60, 118812.0]
  - - [2048, 512, 1, 7616, 2048, 2048, 7616, 7616]
    - [40, 99606.5]
  - - [1024, 1024, 1, 2048, 1024, 1024, 2048, 2048]
    - [37, 57542.4]
  - - [1024, 512, 1, 2048, 1024, 1024, 2048, 2048]
    - [32, 34011.5]
  - - [1024, 1024, 1, 1024, 1024, 1024, 1024, 1024]
    - [40, 35274.0]
  - - [1024, 256, 1, 1024, 1024, 1024, 1024, 1024]
    - [46, 11520.8]
  - - [1024, 512, 1, 1024, 1024, 1024, 1024, 1024]
    - [45, 20629.4]
  - - [4000, 1024, 1, 11190, 4000, 4000, 11190, 11190]
    - [12, 130789.0]
  - - [4000, 256, 1, 11190, 4000, 4000, 11190, 11190]
    - [49, 89046.9]
  - - [4000, 512, 1, 11190, 4000, 4000, 11190, 11190]
    - [52, 117681.0]
  - - [2200, 1024, 1, 2200, 2200, 2200, 2200, 2200]
    - [9, 71378.4]
  - - [2200, 256, 1, 2200, 2200, 2200, 2200, 2200]
    - [44, 31934.0]
  - - [2200, 512, 1, 2200, 2200, 2200, 2200, 2200]
    - [36, 49601.3]
  - - [2200, 1024, 1, 22374, 2200, 2200, 22374, 22374]
    - [54, 125922.0]
  - - [2200, 256, 1, 22374, 2200, 2200, 22374, 22374]
    - [50, 90815.0]
  - - [2200, 512, 1, 22374, 2200, 2200, 22374, 22374]
    - [55, 111194.0]
  - - [4000, 1024, 1, 4000, 4000, 4000, 4000, 4000]
    - [12, 116194.0]
  - - [4000, 256, 1, 4000, 4000, 4000, 4000, 4000]
    - [48, 68828.8]
  - - [4000, 512, 1, 4000, 4000, 4000, 4000, 4000]
    - [8, 99254.9]
  - - [3465, 1024, 1, 128, 3465, 3465, 128, 128]
    - [1, 13756.3]
  - - [3465, 512, 1, 128, 3465, 3465, 128, 128]
    - [4, 8667.26]
  - - [9375, 1024, 1, 128, 9375, 9375, 128, 128]
    - [10, 20990.8]
  - - [9375, 512, 1, 128, 9375, 9375, 128, 128]
    - [38, 15162.9]
  - - [128, 1024, 1, 1677, 128, 128, 1677, 1677]
    - [24, 8582.89]
  - - [128, 512, 1, 1677, 128, 128, 1677, 1677]
    - [20, 4615.0]
  - - [2048, 1024, 1, 3465, 2048, 2048, 3465, 3465]
    - [52, 85955.0]
  - - [2048, 512, 1, 3465, 2048, 2048, 3465, 3465]
    - [49, 59145.6]
  - - [2048, 1024, 1, 9375, 2048, 2048, 9375, 9375]
    - [52, 111721.0]
  - - [2048, 512, 1, 9375, 2048, 2048, 9375, 9375]
    - [53, 83294.4]
  - - [1024, 1, 1, 1024, 1024, 1024, 1024, 1024]
    - [15, 49.5195]
  - - [1024, 128, 1, 1024, 1024, 1024, 1024, 1024]
    - [28, 6144.09]
  - - [1024, 16384, 1, 1024, 1024, 1024, 1024, 1024]
    - [57, 92357.4]
  - - [1024, 2048, 1, 1024, 1024, 1024, 1024, 1024]
    - [58, 53559.2]
  - - [1024, 32, 1, 1024, 1024, 1024, 1024, 1024]
    - [17, 1651.3]
  - - [1024, 4096, 1, 1024, 1024, 1024, 1024, 1024]
    - [34, 69554.1]
  - - [1024, 64, 1, 1024, 1024, 1024, 1024, 1024]
    - [16, 3275.2]
  - - [1024, 8192, 1, 1024, 1024, 1024, 1024, 1024]
    - [51, 83111.0]
  - - [2, 1, 1, 1024, 2, 2, 1024, 1024]
    - [21, 0.100887]
  - - [2, 32, 1, 1024, 2, 2, 1024, 1024]
    - [18, 3.30656]
  - - [2, 64, 1, 1024, 2, 2, 1024, 1024]
    - [22, 6.57167]
  - - [3072, 128, 1, 1024, 3072, 3072, 1024, 1024]
    - [30, 16249.1]
  - - [3072, 256, 1, 1024, 3072, 3072, 1024, 1024]
    - [39, 29449.3]
  - - [3072, 32, 1, 1024, 3072, 3072, 1024, 1024]
    - [14, 4591.26]
  - - [3072, 64, 1, 1024, 3072, 3072, 1024, 1024]
    - [25, 8841.75]
  - - [4096, 1024, 1, 1024, 4096, 4096, 1024, 1024]
    - [39, 70704.3]
  - - [4096, 128, 1, 1024, 4096, 4096, 1024, 1024]
    - [43, 20849.4]
  - - [4096, 16384, 1, 1024, 4096, 4096, 1024, 1024]
    - [13, 107128.0]
  - - [4096, 2048, 1, 1024, 4096, 4096, 1024, 1024]
    - [51, 85285.3]
  - - [4096, 256, 1, 1024, 4096, 4096, 1024, 1024]
    - [35, 35935.1]
  - - [4096, 32, 1, 1024, 4096, 4096, 1024, 1024]
    - [23, 5894.5]
  - - [4096, 4096, 1, 1024, 4096, 4096, 1024, 1024]
    - [51, 94275.7]
  - - [4096, 64, 1, 1024, 4096, 4096, 1024, 1024]
    - [42, 11686.3]
  - - [4096, 8192, 1, 1024, 4096, 4096, 1024, 1024]
    - [13, 105887.0]
  - - [1024, 1024, 1, 4096, 1024, 1024, 4096, 4096]
    - [37, 75080.3]
  - - [1024, 128, 1, 4096, 1024, 1024, 4096, 4096]
    - [28, 16483.6]
  - - [1024, 16384, 1, 4096, 1024, 1024, 4096, 4096]
    - [51, 126554.0]
  - - [1024, 2048, 1, 4096, 1024, 1024, 4096, 4096]
    - [58, 101698.0]
  - - [1024, 256, 1, 4096, 1024, 1024, 4096, 4096]
    - [31, 30009.6]
  - - [1024, 32, 1, 4096, 1024, 1024, 4096, 4096]
    - [14, 4486.64]
  - - [1024, 4096, 1, 4096, 1024, 1024, 4096, 4096]
    - [60, 106209.0]
  - - [1024, 64, 1, 4096, 1024, 1024, 4096, 4096]
    - [19, 8704.13]
  - - [1024, 8192, 1, 4096, 1024, 1024, 4096, 4096]
    - [51, 122488.0]
- null
- null
- DeviceEfficiency
- Equality
