library/src/amd_detail/rocblaslt/src/Tensile/Logic/asm_full/aldebaran/104CU/Equality/aldebaran_Cijk_Alik_Bljk_SB_Bias_HA_SAV.yaml
- {MinimumRequiredVersion: 4.33.0}
- aldebaran
- {Architecture: gfx90a, CUCount: 104}
- [Device 0050, Device 0051, Device 0052, Device 0054, Device 0062, Device 7400, Device
    SolutionIndex: 0
    SolutionNameMin: Cijk_Alik_Bljk_SBBias_HA_SAV_MT64x32x16_MI16x16x4x1_SN_1LDSB0_AFC1_GRVW4_GSU1_LPA4_LPB4_LRVW2_MIWT2_1_PLR5_WG32_8_1
    SolutionIndex: 1
    SolutionNameMin: Cijk_Alik_Bljk_SBBias_HA_SAV_MT192x64x16_MI32x32x2x1_SN_1LDSB0_AFC1_GRVW4_GSU1_LPA4_LPB4_LRVW4_MIWT3_1_PLR9_WG64_4_1
    SolutionIndex: 2
    SolutionNameMin: Cijk_Alik_Bljk_SBBias_HA_SAV_MT96x128x16_MI32x32x2x1_SN_1LDSB0_AFC1_GRVW1_GSU1_LPA2_LPB2_LRVW2_MIWT3_1_PLR9_WG32_8_1
    SolutionIndex: 3
    SolutionNameMin: Cijk_Alik_Bljk_SBBias_HA_SAV_MT128x128x16_MI32x32x2x1_SN_1LDSB0_AFC1_GRVW4_GSU1_LPA4_LPB4_LRVW4_MIWT2_2_PLR9_WG64_4_1
    SolutionIndex: 4
    SolutionNameMin: Cijk_Alik_Bljk_SBBias_HA_SAV_MT160x128x16_MI32x32x2x1_SN_1LDSB0_AFC1_GRVW1_GSU1_LPA4_LPB4_LRVW4_MIWT5_1_PLR9_WG32_8_1
    SolutionIndex: 5
    SolutionNameMin: Cijk_Alik_Bljk_SBBias_HA_SAV_MT160x128x16_MI32x32x2x1_SN_1LDSB0_AFC1_GRVW2_GSU1_LPA4_LPB4_LRVW4_MIWT5_1_PLR9_WG32_8_1
    SolutionIndex: 6
    SolutionNameMin: Cijk_Alik_Bljk_SBBias_HA_SAV_MT224x128x16_MI32x32x2x1_SN_1LDSB0_AFC1_GRVW1_GSU1_LPA1_LPB1_LRVW1_MIWT7_1_PLR9_WG32_8_1
    SolutionIndex: 7
    SolutionNameMin: Cijk_Alik_Bljk_SBBias_HA_SAV_MT256x128x16_MI32x32x2x1_SN_1LDSB0_AFC1_GRVW2_GSU1_LPA2_LPB2_LRVW2_MIWT4_2_PLR9_WG64_4_1
    SolutionIndex: 8
    SolutionNameMin: Cijk_Alik_Bljk_SBBias_HA_SAV_MT256x160x16_MI32x32x2x1_SN_1LDSB0_AFC1_GRVW2_GSU1_LPA4_LPB4_LRVW4_MIWT2_5_PLR9_WG128_2_1
    SolutionIndex: 9
    SolutionNameMin: Cijk_Alik_Bljk_SBBias_HA_SAV_MT128x208x16_MI16x16x4x1_SN_1LDSB0_AFC1_GRVW1_GSU1_LPA2_LPB2_LRVW1_MIWT2_13_PLR5_WG64_4_1
    SolutionIndex: 10
    SolutionNameMin: Cijk_Alik_Bljk_SBBias_HA_SAV_MT96x256x16_MI32x32x2x1_SN_1LDSB0_AFC1_GRVW1_GSU1_LPA2_LPB2_LRVW2_MIWT3_2_PLR9_WG32_8_1
    SolutionIndex: 11
    SolutionNameMin: Cijk_Alik_Bljk_SBBias_HA_SAV_MT128x256x16_MI32x32x2x1_SN_1LDSB0_AFC1_GRVW2_GSU1_LPA4_LPB4_LRVW4_MIWT2_4_PLR9_WG64_4_1
    SolutionIndex: 12
    SolutionNameMin: Cijk_Alik_Bljk_SBBias_HA_SAV_MT160x256x16_MI32x32x2x1_SN_1LDSB0_AFC1_GRVW2_GSU1_LPA4_LPB4_LRVW4_MIWT5_2_PLR9_WG32_8_1
    SolutionIndex: 13
    SolutionNameMin: Cijk_Alik_Bljk_SBBias_HA_SAV_MT176x64x16_MI16x16x4x1_SN_1LDSB1_AFC1_GRVW1_GSU1_LPA2_LPB2_LRVW2_MIWT11_1_PLR5_WG16_16_1
    SolutionIndex: 14
    SolutionNameMin: Cijk_Alik_Bljk_SBBias_HA_SAV_MT256x96x16_MI32x32x2x1_SN_1LDSB1_AFC1_GRVW1_GSU1_LPA1_LPB1_LRVW1_MIWT2_3_PLR9_WG128_2_1
    SolutionIndex: 15
    SolutionNameMin: Cijk_Alik_Bljk_SBBias_HA_SAV_MT96x128x16_MI32x32x2x1_SN_1LDSB1_AFC1_GRVW2_GSU1_LPA4_LPB4_LRVW4_MIWT3_1_PLR9_WG32_8_1
    SolutionIndex: 16
    SolutionNameMin: Cijk_Alik_Bljk_SBBias_HA_SAV_MT160x128x16_MI32x32x2x1_SN_1LDSB1_AFC1_GRVW1_GSU1_LPA4_LPB4_LRVW4_MIWT5_1_PLR9_WG32_8_1
    SolutionIndex: 17
    SolutionNameMin: Cijk_Alik_Bljk_SBBias_HA_SAV_MT160x128x16_MI32x32x2x1_SN_1LDSB1_AFC1_GRVW2_GSU1_LPA4_LPB4_LRVW4_MIWT5_1_PLR9_WG32_8_1
    SolutionIndex: 18
    SolutionNameMin: Cijk_Alik_Bljk_SBBias_HA_SAV_MT176x128x16_MI16x16x4x1_SN_1LDSB1_AFC1_GRVW1_GSU1_LPA2_LPB2_LRVW2_MIWT11_2_PLR5_WG16_16_1
    SolutionIndex: 19
    SolutionNameMin: Cijk_Alik_Bljk_SBBias_HA_SAV_MT256x128x16_MI32x32x2x1_SN_1LDSB1_AFC1_GRVW4_GSU1_LPA4_LPB4_LRVW4_MIWT4_2_PLR9_WG64_4_1
    SolutionIndex: 20
    SolutionNameMin: Cijk_Alik_Bljk_SBBias_HA_SAV_MT128x160x16_MI32x32x2x1_SN_1LDSB1_AFC1_GRVW2_GSU1_LPA4_LPB4_LRVW4_MIWT1_5_PLR9_WG128_2_1
    SolutionIndex: 21
    SolutionNameMin: Cijk_Alik_Bljk_SBBias_HA_SAV_MT128x176x16_MI16x16x4x1_SN_1LDSB1_AFC1_GRVW1_GSU1_LPA2_LPB2_LRVW2_MIWT2_11_PLR5_WG64_4_1
    SolutionIndex: 22
    SolutionNameMin: Cijk_Alik_Bljk_SBBias_HA_SAV_MT256x256x16_MI32x32x2x1_SN_1LDSB1_AFC1_GRVW4_GSU1_LPA4_LPB4_LRVW4_MIWT2_8_PLR9_WG128_2_1
    SolutionIndex: 23
    SolutionNameMin: Cijk_Alik_Bljk_SBBias_HA_SAV_MT64x16x32_MI16x16x4x1_SN_1LDSB0_AFC1_GRVW4_GSU1_LPA4_LPB4_LRVW2_MIWT1_1_PLR9_WG64_4_1
    SolutionIndex: 24
    SolutionNameMin: Cijk_Alik_Bljk_SBBias_HA_SAV_MT64x16x32_MI16x16x4x1_SN_1LDSB0_AFC0_GRVW4_GSU2_LPA4_LPB4_LRVW2_MIWT1_1_PLR9_WG64_4_1
    SolutionIndex: 25
    SolutionNameMin: Cijk_Alik_Bljk_SBBias_HA_SAV_MT64x16x32_MI16x16x4x1_SN_1LDSB0_AFC0_GRVW2_GSU2_LPA8_LPB8_LRVW4_MIWT1_1_PLR9_WG64_4_1
    SolutionIndex: 26
    SolutionNameMin: Cijk_Alik_Bljk_SBBias_HA_SAV_MT32x32x32_MI16x16x4x1_SN_1LDSB0_AFC1_GRVW1_GSU1_LPA2_LPB2_LRVW2_MIWT1_1_PLR9_WG32_8_1
    SolutionIndex: 27
    SolutionNameMin: Cijk_Alik_Bljk_SBBias_HA_SAV_MT32x32x32_MI16x16x4x1_SN_1LDSB0_AFC1_GRVW4_GSU1_LPA8_LPB8_LRVW4_MIWT1_1_PLR9_WG32_8_1
    SolutionIndex: 28
    SolutionNameMin: Cijk_Alik_Bljk_SBBias_HA_SAV_MT32x32x32_MI16x16x4x1_SN_1LDSB0_AFC0_GRVW4_GSU2_LPA4_LPB4_LRVW2_MIWT1_1_PLR9_WG32_8_1
    SolutionIndex: 29
    SolutionNameMin: Cijk_Alik_Bljk_SBBias_HA_SAV_MT32x32x32_MI16x16x4x1_SN_1LDSB0_AFC0_GRVW1_GSU2_LPA8_LPB8_LRVW4_MIWT1_1_PLR9_WG32_8_1
    SolutionIndex: 30
    SolutionNameMin: Cijk_Alik_Bljk_SBBias_HA_SAV_MT32x32x32_MI16x16x4x1_SN_1LDSB0_AFC0_GRVW2_GSU2_LPA8_LPB8_LRVW4_MIWT1_1_PLR9_WG32_8_1
    SolutionIndex: 31
    SolutionNameMin: Cijk_Alik_Bljk_SBBias_HA_SAV_MT64x32x32_MI16x16x4x1_SN_1LDSB0_AFC1_GRVW4_GSU1_LPA4_LPB4_LRVW2_MIWT2_1_PLR9_WG32_8_1
    SolutionIndex: 32
    SolutionNameMin: Cijk_Alik_Bljk_SBBias_HA_SAV_MT64x32x32_MI16x16x4x1_SN_1LDSB0_AFC0_GRVW4_GSU2_LPA8_LPB8_LRVW4_MIWT2_1_PLR9_WG32_8_1
    SolutionIndex: 33
    SolutionNameMin: Cijk_Alik_Bljk_SBBias_HA_SAV_MT96x32x32_MI16x16x4x1_SN_1LDSB0_AFC0_GRVW4_GSU2_LPA8_LPB8_LRVW4_MIWT3_1_PLR9_WG32_8_1
    SolutionIndex: 34
    SolutionNameMin: Cijk_Alik_Bljk_SBBias_HA_SAV_MT192x32x32_MI16x16x4x1_SN_1LDSB0_AFC1_GRVW2_GSU1_LPA2_LPB2_LRVW1_MIWT6_1_PLR9_WG32_8_1
    SolutionIndex: 35
    SolutionNameMin: Cijk_Alik_Bljk_SBBias_HA_SAV_MT64x48x32_MI16x16x4x1_SN_1LDSB0_AFC0_GRVW2_GSU2_LPA2_LPB2_LRVW1_MIWT1_3_PLR9_WG64_4_1
    SolutionIndex: 36
    SolutionNameMin: Cijk_Alik_Bljk_SBBias_HA_SAV_MT32x64x32_MI16x16x4x1_SN_1LDSB0_AFC0_GRVW4_GSU2_LPA8_LPB8_LRVW4_MIWT2_1_PLR9_WG16_16_1
    SolutionIndex: 37
    SolutionNameMin: Cijk_Alik_Bljk_SBBias_HA_SAV_MT48x64x32_MI16x16x4x1_SN_1LDSB0_AFC1_GRVW2_GSU1_LPA2_LPB2_LRVW2_MIWT3_1_PLR9_WG16_16_1
    SolutionIndex: 38
    SolutionNameMin: Cijk_Alik_Bljk_SBBias_HA_SAV_MT48x64x32_MI16x16x4x1_SN_1LDSB0_AFC1_GRVW2_GSU1_LPA8_LPB8_LRVW4_MIWT3_1_PLR9_WG16_16_1
    SolutionIndex: 39
    SolutionNameMin: Cijk_Alik_Bljk_SBBias_HA_SAV_MT48x64x32_MI16x16x4x1_SN_1LDSB0_AFC0_GRVW2_GSU2_LPA2_LPB2_LRVW1_MIWT3_1_PLR9_WG16_16_1
    SolutionIndex: 40
    SolutionNameMin: Cijk_Alik_Bljk_SBBias_HA_SAV_MT48x64x32_MI16x16x4x1_SN_1LDSB0_AFC0_GRVW2_GSU2_LPA2_LPB2_LRVW2_MIWT3_1_PLR9_WG16_16_1
    SolutionIndex: 41
    SolutionNameMin: Cijk_Alik_Bljk_SBBias_HA_SAV_MT64x64x32_MI32x32x2x1_SN_1LDSB0_AFC1_GRVW4_GSU1_LPA4_LPB4_LRVW4_MIWT1_1_PLR17_WG64_4_1
    SolutionIndex: 42
    SolutionNameMin: Cijk_Alik_Bljk_SBBias_HA_SAV_MT80x64x32_MI16x16x4x1_SN_1LDSB0_AFC1_GRVW1_GSU1_LPA2_LPB2_LRVW1_MIWT5_1_PLR9_WG16_16_1
    SolutionIndex: 43
    SolutionNameMin: Cijk_Alik_Bljk_SBBias_HA_SAV_MT80x64x32_MI16x16x4x1_SN_1LDSB0_AFC1_GRVW2_GSU1_LPA2_LPB2_LRVW1_MIWT5_1_PLR9_WG16_16_1
    SolutionIndex: 44
    SolutionNameMin: Cijk_Alik_Bljk_SBBias_HA_SAV_MT80x64x32_MI16x16x4x1_SN_1LDSB0_AFC0_GRVW2_GSU2_LPA2_LPB2_LRVW2_MIWT5_1_PLR9_WG16_16_1
    SolutionIndex: 45
    SolutionNameMin: Cijk_Alik_Bljk_SBBias_HA_SAV_MT176x64x32_MI16x16x4x1_SN_1LDSB0_AFC1_GRVW2_GSU1_LPA2_LPB2_LRVW1_MIWT11_1_PLR9_WG16_16_1
    SolutionIndex: 46
    SolutionNameMin: Cijk_Alik_Bljk_SBBias_HA_SAV_MT176x64x32_MI16x16x4x1_SN_1LDSB0_AFC0_GRVW1_GSU2_LPA2_LPB2_LRVW2_MIWT11_1_PLR9_WG16_16_1
    SolutionIndex: 47
    SolutionNameMin: Cijk_Alik_Bljk_SBBias_HA_SAV_MT64x80x32_MI16x16x4x1_SN_1LDSB0_AFC0_GRVW2_GSU2_LPA2_LPB2_LRVW1_MIWT1_5_PLR9_WG64_4_1
    SolutionIndex: 48
    SolutionNameMin: Cijk_Alik_Bljk_SBBias_HA_SAV_MT80x128x32_MI16x16x4x1_SN_1LDSB0_AFC1_GRVW2_GSU1_LPA2_LPB2_LRVW1_MIWT5_2_PLR9_WG16_16_1
    SolutionIndex: 49
    SolutionNameMin: Cijk_Alik_Bljk_SBBias_HA_SAV_MT80x128x32_MI16x16x4x1_SN_1LDSB0_AFC1_GRVW2_GSU1_LPA2_LPB2_LRVW2_MIWT5_2_PLR9_WG16_16_1
    SolutionIndex: 50
    SolutionNameMin: Cijk_Alik_Bljk_SBBias_HA_SAV_MT64x32x32_MI16x16x4x1_SN_1LDSB1_AFC1_GRVW2_GSU1_LPA2_LPB2_LRVW2_MIWT2_1_PLR9_WG32_8_1
    SolutionIndex: 51
    SolutionNameMin: Cijk_Alik_Bljk_SBBias_HA_SAV_MT64x32x32_MI16x16x4x1_SN_1LDSB1_AFC1_GRVW4_GSU1_LPA8_LPB8_LRVW4_MIWT2_1_PLR9_WG32_8_1
    SolutionIndex: 52
    SolutionNameMin: Cijk_Alik_Bljk_SBBias_HA_SAV_MT96x32x32_MI16x16x4x1_SN_1LDSB1_AFC1_GRVW1_GSU1_LPA8_LPB8_LRVW4_MIWT3_1_PLR9_WG32_8_1
    SolutionIndex: 53
    SolutionNameMin: Cijk_Alik_Bljk_SBBias_HA_SAV_MT192x32x32_MI16x16x4x1_SN_1LDSB1_AFC1_GRVW4_GSU1_LPA8_LPB8_LRVW4_MIWT6_1_PLR9_WG32_8_1
    SolutionIndex: 54
    SolutionNameMin: Cijk_Alik_Bljk_SBBias_HA_SAV_MT64x48x32_MI16x16x4x1_SN_1LDSB1_AFC1_GRVW2_GSU1_LPA8_LPB8_LRVW4_MIWT1_3_PLR9_WG64_4_1
    SolutionIndex: 55
    SolutionNameMin: Cijk_Alik_Bljk_SBBias_HA_SAV_MT80x64x32_MI16x16x4x1_SN_1LDSB1_AFC1_GRVW2_GSU1_LPA2_LPB2_LRVW2_MIWT5_1_PLR9_WG16_16_1
    SolutionIndex: 56
    SolutionNameMin: Cijk_Alik_Bljk_SBBias_HA_SAV_MT128x64x32_MI32x32x2x1_SN_1LDSB1_AFC1_GRVW2_GSU1_LPA4_LPB4_LRVW4_MIWT2_1_PLR17_WG64_4_1
    SolutionIndex: 57
    SolutionNameMin: Cijk_Alik_Bljk_SBBias_HA_SAV_MT160x64x32_MI16x16x4x1_SN_1LDSB1_AFC1_GRVW4_GSU1_LPA4_LPB4_LRVW1_MIWT10_1_PLR9_WG16_16_1
    SolutionIndex: 58
    SolutionNameMin: Cijk_Alik_Bljk_SBBias_HA_SAV_MT256x80x32_MI16x16x4x1_SN_1LDSB1_AFC1_GRVW2_GSU1_LPA2_LPB2_LRVW1_MIWT4_5_PLR9_WG64_4_1
    SolutionIndex: 59
    SolutionNameMin: Cijk_Alik_Bljk_SBBias_HA_SAV_MT256x80x32_MI16x16x4x1_SN_1LDSB1_AFC1_GRVW1_GSU1_LPA8_LPB8_LRVW4_MIWT4_5_PLR9_WG64_4_1
    SolutionIndex: 60
    SolutionNameMin: Cijk_Alik_Bljk_SBBias_HA_SAV_MT80x128x32_MI16x16x4x1_SN_1LDSB1_AFC1_GRVW2_GSU1_LPA2_LPB2_LRVW2_MIWT5_2_PLR9_WG16_16_1
    SolutionIndex: 61
    SolutionNameMin: Cijk_Alik_Bljk_SBBias_HA_SAV_MT80x128x32_MI16x16x4x1_SN_1LDSB1_AFC1_GRVW2_GSU1_LPA8_LPB8_LRVW4_MIWT5_2_PLR9_WG16_16_1
    SolutionIndex: 62
    SolutionNameMin: Cijk_Alik_Bljk_SBBias_HA_SAV_MT176x128x32_MI16x16x4x1_SN_1LDSB1_AFC1_GRVW1_GSU1_LPA2_LPB2_LRVW2_MIWT11_2_PLR9_WG16_16_1
    SolutionIndex: 63
    SolutionNameMin: Cijk_Alik_Bljk_SBBias_HA_SAV_MT64x256x32_MI32x32x2x1_SN_1LDSB1_AFC1_GRVW2_GSU1_LPA4_LPB4_LRVW4_MIWT2_2_PLR17_WG32_8_1
    SolutionIndex: 64
    SolutionNameMin: Cijk_Alik_Bljk_SBBias_HA_SAV_MT80x256x32_MI16x16x4x1_SN_1LDSB1_AFC1_GRVW1_GSU1_LPA8_LPB8_LRVW4_MIWT5_4_PLR9_WG16_16_1
- - - [256, 1024, 1, 7616, 256, 256, 7616, 7616]
    - [47, 25294.4]
  - - [7616, 1024, 1, 256, 7616, 7616, 256, 256]
    - [6, 21074.5]
  - - [256, 512, 1, 7616, 256, 256, 7616, 7616]
    - [40, 17313.9]
  - - [7616, 512, 1, 256, 7616, 7616, 256, 256]
    - [64, 17279.6]
  - - [256, 1024, 1, 2400, 256, 256, 2400, 2400]
    - [37, 16375.5]
  - - [256, 1024, 1, 256, 256, 256, 256, 256]
    - [52, 3469.95]
  - - [9630, 1024, 1, 256, 9630, 9630, 256, 256]
    - [7, 22801.3]
  - - [2400, 1024, 1, 256, 2400, 2400, 256, 256]
    - [10, 16433.2]
  - - [256, 1024, 1, 4800, 256, 256, 4800, 4800]
    - [47, 21798.0]
  - - [12840, 1024, 1, 256, 12840, 12840, 256, 256]
    - [9, 23033.8]
  - - [3200, 1024, 1, 256, 3200, 3200, 256, 256]
    - [11, 18554.8]
  - - [256, 512, 1, 2400, 256, 256, 2400, 2400]
    - [33, 9640.6]
  - - [256, 512, 1, 256, 256, 256, 256, 256]
    - [0, 1840.62]
  - - [9630, 512, 1, 256, 9630, 9630, 256, 256]
    - [3, 17654.8]
  - - [2400, 512, 1, 256, 2400, 2400, 256, 256]
    - [2, 11884.1]
  - - [256, 512, 1, 4800, 256, 256, 4800, 4800]
    - [39, 14643.2]
  - - [12840, 512, 1, 256, 12840, 12840, 256, 256]
    - [21, 20012.7]
  - - [3200, 512, 1, 256, 3200, 3200, 256, 256]
    - [63, 13626.7]
  - - [2048, 1024, 1, 1024, 2048, 2048, 1024, 1024]
    - [59, 26936.0]
  - - [2048, 512, 1, 1024, 2048, 2048, 1024, 1024]
    - [57, 22524.5]
  - - [2048, 1024, 1, 7616, 2048, 2048, 7616, 7616]
    - [58, 35026.5]
  - - [2048, 512, 1, 7616, 2048, 2048, 7616, 7616]
    - [60, 33780.1]
  - - [1024, 1024, 1, 2048, 1024, 1024, 2048, 2048]
    - [48, 27994.8]
  - - [1024, 512, 1, 2048, 1024, 1024, 2048, 2048]
    - [55, 23041.7]
  - - [1024, 1024, 1, 1024, 1024, 1024, 1024, 1024]
    - [60, 22621.5]
  - - [1024, 256, 1, 1024, 1024, 1024, 1024, 1024]
    - [54, 10263.3]
  - - [1024, 512, 1, 1024, 1024, 1024, 1024, 1024]
    - [43, 17254.4]
  - - [4000, 1024, 1, 11190, 4000, 4000, 11190, 11190]
    - [12, 35207.9]
  - - [4000, 256, 1, 11190, 4000, 4000, 11190, 11190]
    - [48, 33513.4]
  - - [4000, 512, 1, 11190, 4000, 4000, 11190, 11190]
    - [17, 34814.7]
  - - [2200, 1024, 1, 2200, 2200, 2200, 2200, 2200]
    - [18, 30934.3]
  - - [2200, 256, 1, 2200, 2200, 2200, 2200, 2200]
    - [34, 21214.6]
  - - [2200, 512, 1, 2200, 2200, 2200, 2200, 2200]
    - [13, 28021.5]
  - - [2200, 1024, 1, 22374, 2200, 2200, 22374, 22374]
    - [62, 35300.1]
  - - [2200, 256, 1, 22374, 2200, 2200, 22374, 22374]
    - [46, 33245.9]
  - - [2200, 512, 1, 22374, 2200, 2200, 22374, 22374]
    - [45, 34747.3]
  - - [4000, 1024, 1, 4000, 4000, 4000, 4000, 4000]
    - [12, 34132.6]
  - - [4000, 256, 1, 4000, 4000, 4000, 4000, 4000]
    - [61, 30976.3]
  - - [4000, 512, 1, 4000, 4000, 4000, 4000, 4000]
    - [4, 33116.4]
  - - [3465, 1024, 1, 128, 3465, 3465, 128, 128]
    - [1, 11179.4]
  - - [3465, 512, 1, 128, 3465, 3465, 128, 128]
    - [53, 7786.12]
  - - [9375, 1024, 1, 128, 9375, 9375, 128, 128]
    - [14, 15059.7]
  - - [9375, 512, 1, 128, 9375, 9375, 128, 128]
    - [15, 12379.5]
  - - [128, 1024, 1, 1677, 128, 128, 1677, 1677]
    - [40, 7434.73]
  - - [128, 512, 1, 1677, 128, 128, 1677, 1677]
    - [32, 4015.49]
  - - [2048, 1024, 1, 3465, 2048, 2048, 3465, 3465]
    - [16, 33088.8]
  - - [2048, 512, 1, 3465, 2048, 2048, 3465, 3465]
    - [61, 30434.9]
  - - [2048, 1024, 1, 9375, 2048, 2048, 9375, 9375]
    - [5, 35361.5]
  - - [2048, 512, 1, 9375, 2048, 2048, 9375, 9375]
    - [48, 34011.6]
  - - [1024, 1, 1, 1024, 1024, 1024, 1024, 1024]
    - [30, 46.7582]
  - - [1024, 128, 1, 1024, 1024, 1024, 1024, 1024]
    - [51, 5710.18]
  - - [1024, 16384, 1, 1024, 1024, 1024, 1024, 1024]
    - [19, 32666.9]
  - - [1024, 2048, 1, 1024, 1024, 1024, 1024, 1024]
    - [59, 27107.8]
  - - [1024, 32, 1, 1024, 1024, 1024, 1024, 1024]
    - [23, 1484.71]
  - - [1024, 4096, 1, 1024, 1024, 1024, 1024, 1024]
    - [8, 29828.2]
  - - [1024, 64, 1, 1024, 1024, 1024, 1024, 1024]
    - [27, 3007.34]
  - - [1024, 8192, 1, 1024, 1024, 1024, 1024, 1024]
    - [8, 31939.4]
  - - [2, 1, 1, 1024, 2, 2, 1024, 1024]
    - [28, 0.0930698]
  - - [2, 32, 1, 1024, 2, 2, 1024, 1024]
    - [24, 3.11705]
  - - [2, 64, 1, 1024, 2, 2, 1024, 1024]
    - [25, 6.11629]
  - - [3072, 128, 1, 1024, 3072, 3072, 1024, 1024]
    - [41, 14118.3]
  - - [3072, 256, 1, 1024, 3072, 3072, 1024, 1024]
    - [56, 19948.1]
  - - [3072, 32, 1, 1024, 3072, 3072, 1024, 1024]
    - [26, 4285.37]
  - - [3072, 64, 1, 1024, 3072, 3072, 1024, 1024]
    - [31, 7864.32]
  - - [4096, 1024, 1, 1024, 4096, 4096, 1024, 1024]
    - [12, 30231.3]
  - - [4096, 128, 1, 1024, 4096, 4096, 1024, 1024]
    - [42, 16800.8]
  - - [4096, 16384, 1, 1024, 4096, 4096, 1024, 1024]
    - [22, 33734.6]
  - - [4096, 2048, 1, 1024, 4096, 4096, 1024, 1024]
    - [3, 31431.5]
  - - [4096, 256, 1, 1024, 4096, 4096, 1024, 1024]
    - [49, 22482.0]
  - - [4096, 32, 1, 1024, 4096, 4096, 1024, 1024]
    - [50, 4905.62]
  - - [4096, 4096, 1, 1024, 4096, 4096, 1024, 1024]
    - [19, 32897.1]
  - - [4096, 64, 1, 1024, 4096, 4096, 1024, 1024]
    - [38, 9364.57]
  - - [4096, 8192, 1, 1024, 4096, 4096, 1024, 1024]
    - [22, 33294.0]
  - - [1024, 1024, 1, 4096, 1024, 1024, 4096, 4096]
    - [60, 31731.1]
  - - [1024, 128, 1, 4096, 1024, 1024, 4096, 4096]
    - [35, 13015.1]
  - - [1024, 16384, 1, 4096, 1024, 1024, 4096, 4096]
    - [19, 35590.7]
  - - [1024, 2048, 1, 4096, 1024, 1024, 4096, 4096]
    - [20, 33627.3]
  - - [1024, 256, 1, 4096, 1024, 1024, 4096, 4096]
    - [44, 20639.0]
  - - [1024, 32, 1, 4096, 1024, 1024, 4096, 4096]
    - [29, 3828.78]
  - - [1024, 4096, 1, 4096, 1024, 1024, 4096, 4096]
    - [8, 34731.4]
  - - [1024, 64, 1, 4096, 1024, 1024, 4096, 4096]
    - [36, 7213.1]
  - - [1024, 8192, 1, 4096, 1024, 1024, 4096, 4096]
    - [8, 35379.7]
- null
- null
- DeviceEfficiency
- Equality
