library/src/amd_detail/rocblaslt/src/Tensile/Logic/asm_full/navi3.5/GridBased/navi3.5_Cijk_Alik_Bljk_HHS_BH_AuxH_AS_SAV_UserArgs.yaml
- {MinimumRequiredVersion: 4.33.0}
- navi3.5
- gfx1150
- [Device 73f0]
    SolutionIndex: 0
    SolutionNameMin: Cijk_Alik_Bljk_HHS_BH_AuxH_AS_SAV_UserArgs_MT192x48x32_MI16x16x1_SN_LDSB1_GRVWB4_GSU1_LBSPPA128_LBSPPB128_MIWT3_3_SS1_SU32_SUM0_SUS256_TLDS1_WG64_2_1_WGM8
    SolutionIndex: 1
    SolutionNameMin: Cijk_Alik_Bljk_HHS_BH_AuxH_AS_SAV_UserArgs_MT128x80x32_MI16x16x1_SN_LDSB1_GRVWB4_GSU1_LBSPPA128_LBSPPB128_MIWT2_5_SS1_SU32_SUM0_SUS256_TLDS1_WG64_2_1_WGM8
    SolutionIndex: 2
    SolutionNameMin: Cijk_Alik_Bljk_HHS_BH_AuxH_AS_SAV_UserArgs_MT96x96x32_MI16x16x1_SN_LDSB0_GRVWB8_GSU1_LBSPPA128_LBSPPB128_MIWT3_3_SS1_SU32_SUM0_SUS256_TLDS1_WG32_4_1_WGM8
    SolutionIndex: 3
    SolutionNameMin: Cijk_Alik_Bljk_HHS_BH_AuxH_AS_SAV_UserArgs_MT64x16x64_MI16x16x1_SN_LDSB0_GRVWB8_GSU1_LBSPPA128_LBSPPB128_MIWT1_1_SS1_SU32_SUM0_SUS256_TLDS1_WG64_2_1_WGM8
    SolutionIndex: 4
    SolutionNameMin: Cijk_Alik_Bljk_HHS_BH_AuxH_AS_SAV_UserArgs_MT64x48x64_MI16x16x1_SN_LDSB1_GRVWB8_GSU1_LBSPPA128_LBSPPB128_MIWT1_3_SS1_SU32_SUM0_SUS256_TLDS1_WG64_2_1_WGM8
    SolutionIndex: 5
    SolutionNameMin: Cijk_Alik_Bljk_HHS_BH_AuxH_AS_SAV_UserArgs_MT16x64x64_MI16x16x1_SN_LDSB0_GRVWB8_GSU1_LBSPPA512_LBSPPB2048_MIWT1_1_SS1_SU32_SUM0_SUS256_TLDS0_WG16_8_1_WGM8
- - - [64, 64, 1, 64, 64, 64, 64, 64]
    - [5, 84.0899]
  - - [128, 128, 1, 128, 128, 128, 128, 128]
    - [5, 622.455]
  - - [256, 256, 1, 256, 256, 256, 256, 256]
    - [3, 3772.29]
  - - [512, 512, 1, 512, 512, 512, 512, 512]
    - [4, 22697.9]
  - - [1024, 1024, 1, 1024, 1024, 1024, 1024, 1024]
    - [2, 56283.9]
  - - [1536, 1536, 1, 1536, 1536, 1536, 1536, 1536]
    - [1, 60737.8]
  - - [2048, 2048, 1, 2048, 2048, 2048, 2048, 2048]
    - [0, 59722.6]
  - - [2560, 2560, 1, 2560, 2560, 2560, 2560, 2560]
    - [2, 69849.0]
  - - [3072, 3072, 1, 3072, 3072, 3072, 3072, 3072]
    - [2, 71905.7]
  - - [3584, 3584, 1, 3584, 3584, 3584, 3584, 3584]
    - [2, 75253.6]
  - - [4096, 4096, 1, 4096, 4096, 4096, 4096, 4096]
    - [2, 79789.5]
- null
- null
- DeviceEfficiency
- GridBased
