library/src/amd_detail/rocblaslt/src/Tensile/Logic/asm_full/aquavanjaram/gfx942_20cu/Equality/aquavanjaram_Cijk_Ailk_Bljk_SB_UserArgs.yaml
- {MinimumRequiredVersion: 4.33.0}
- aquavanjaram
- {Architecture: gfx942, CUCount: 20}
- [Device 0049, Device 0050]
    SolutionIndex: 0
    SolutionNameMin: Cijk_Ailk_Bljk_SB_UserArgs_MT32x16x32_MI16x16x1_SN_LDSB0_GRVWA2_GRVWB4_GSU1_GSUC0_GSUWGMRR0_K1_LBSPPA512_LBSPPB128_LPA16_LPB8_LRVW4_MIWT1_1_NLCA1_SU0_SUM0_SUS0_SVW1_VWA1_VWB1_WG32_4_1_WGM1_WGMXCC1_WGMXCCG20
    SolutionIndex: 1
    SolutionNameMin: Cijk_Ailk_Bljk_SB_UserArgs_MT32x16x32_MI16x16x1_SN_LDSB0_GRVWA2_GRVWB2_GSU1_GSUC0_GSUWGMRR0_K1_LBSPPA512_LBSPPB128_LPA16_LPB8_LRVW4_MIWT1_1_NLCA1_SU0_SUM0_SUS0_SVW1_VWA1_VWB1_WG32_4_1_WGM1_WGMXCC1_WGMXCCG20
    SolutionIndex: 2
    SolutionNameMin: Cijk_Ailk_Bljk_SB_UserArgs_MT64x144x32_MI16x16x1_SN_LDSB1_GRVWA2_GRVWB2_GSU1_GSUC0_GSUWGMRR0_K1_LBSPPA1024_LBSPPB128_LPA16_LPB8_LRVW4_MIWT1_9_NLCA1_SU0_SUM0_SUS0_SVW1_VWA1_VWB1_WG64_4_1_WGM1_WGMXCC1_WGMXCCG20
    SolutionIndex: 3
    SolutionNameMin: Cijk_Ailk_Bljk_SB_UserArgs_MT64x144x32_MI16x16x1_SN_LDSB1_GRVWA2_GRVWB2_GSU1_GSUC0_GSUWGMRR0_K1_LBSPPA1024_LBSPPB128_LPA16_LPB8_LRVW4_MIWT1_9_NLCA1_SU0_SUM0_SUS0_SVW1_VWA1_VWB1_WG64_4_1_WGM8_WGMXCC1_WGMXCCG20
    SolutionIndex: 4
    SolutionNameMin: Cijk_Ailk_Bljk_SB_UserArgs_MT64x112x32_MI16x16x1_SN_LDSB1_GRVWA2_GRVWB2_GSU1_GSUC0_GSUWGMRR0_K1_LBSPPA1024_LBSPPB128_LPA16_LPB8_LRVW4_MIWT1_7_NLCA1_SU0_SUM0_SUS0_SVW1_VWA1_VWB1_WG64_4_1_WGM1_WGMXCC1_WGMXCCG20
    SolutionIndex: 5
    SolutionNameMin: Cijk_Ailk_Bljk_SB_UserArgs_MT64x112x32_MI16x16x1_SN_LDSB1_GRVWA2_GRVWB2_GSU1_GSUC0_GSUWGMRR0_K1_LBSPPA1024_LBSPPB128_LPA16_LPB8_LRVW4_MIWT1_7_NLCA1_SU0_SUM0_SUS0_SVW1_VWA1_VWB1_WG64_4_1_WGM6_WGMXCC1_WGMXCCG20
    SolutionIndex: 6
    SolutionNameMin: Cijk_Ailk_Bljk_SB_UserArgs_MT128x80x32_MI16x16x1_SN_LDSB1_GRVWA4_GRVWB2_GSU1_GSUC0_GSUWGMRR0_K1_LBSPPA2048_LBSPPB128_LPA0_LPB8_LRVW4_MIWT2_5_NLCA1_SU0_SUM0_SUS0_SVW2_VWA2_VWB1_WG64_4_1_WGM1_WGMXCC1_WGMXCCG20
    SolutionIndex: 7
    SolutionNameMin: Cijk_Ailk_Bljk_SB_UserArgs_MT128x80x32_MI16x16x1_SN_LDSB1_GRVWA2_GRVWB2_GSU1_GSUC0_GSUWGMRR0_K1_LBSPPA2048_LBSPPB128_LPA0_LPB8_LRVW4_MIWT2_5_NLCA1_SU0_SUM0_SUS0_SVW2_VWA2_VWB1_WG64_4_1_WGM1_WGMXCC1_WGMXCCG20
    SolutionIndex: 8
    SolutionNameMin: Cijk_Ailk_Bljk_SB_UserArgs_MT128x80x32_MI16x16x1_SN_LDSB1_GRVWA2_GRVWB2_GSU1_GSUC0_GSUWGMRR0_K1_LBSPPA2048_LBSPPB128_LPA0_LPB8_LRVW4_MIWT2_5_NLCA1_SU0_SUM0_SUS0_SVW2_VWA2_VWB1_WG64_4_1_WGM8_WGMXCC1_WGMXCCG20
    SolutionIndex: 9
    SolutionNameMin: Cijk_Ailk_Bljk_SB_UserArgs_MT128x80x32_MI16x16x1_SN_LDSB1_GRVWA2_GRVWB2_GSU1_GSUC0_GSUWGMRR0_K1_LBSPPA2048_LBSPPB128_LPA0_LPB8_LRVW4_MIWT2_5_NLCA1_SU0_SUM0_SUS0_SVW2_VWA2_VWB1_WG64_4_1_WGM6_WGMXCC1_WGMXCCG20
    SolutionIndex: 10
    SolutionNameMin: Cijk_Ailk_Bljk_SB_UserArgs_MT128x16x32_MI16x16x1_SN_LDSB1_GRVWA4_GRVWB2_GSU4_GSUC0_GSUWGMRR0_K1_LBSPPA2048_LBSPPB128_LPA0_LPB8_LRVW4_MIWT2_1_NLCA1_SU0_SUM0_SUS0_SVW2_VWA2_VWB1_WG64_4_1_WGM1_WGMXCC1_WGMXCCG20
    SolutionIndex: 11
    SolutionNameMin: Cijk_Ailk_Bljk_SB_UserArgs_MT64x128x32_MI16x16x1_SN_LDSB1_GRVWA2_GRVWB4_GSU1_GSUC0_GSUWGMRR0_K1_LBSPPA1024_LBSPPB256_LPA0_LPB8_LRVW4_MIWT4_2_NLCA1_SU0_SUM0_SUS0_SVW4_VWA4_VWB2_WG16_16_1_WGM1_WGMXCC1_WGMXCCG20
    SolutionIndex: 12
    SolutionNameMin: Cijk_Ailk_Bljk_SB_UserArgs_MT64x64x32_MI16x16x1_SN_LDSB1_GRVWA4_GRVWB4_GSU1_GSUC0_GSUWGMRR0_K1_LBSPPA1024_LBSPPB128_LPA0_LPB8_LRVW4_MIWT4_1_NLCA1_SU0_SUM0_SUS0_SVW4_VWA4_VWB1_WG16_16_1_WGM1_WGMXCC1_WGMXCCG20
    SolutionIndex: 13
    SolutionNameMin: Cijk_Ailk_Bljk_SB_UserArgs_MT128x64x32_MI16x16x1_SN_LDSB1_GRVWA2_GRVWB4_GSU1_GSUC0_GSUWGMRR0_K1_LBSPPA2048_LBSPPB128_LPA0_LPB8_LRVW4_MIWT8_1_NLCA1_SU0_SUM0_SUS0_SVW4_VWA4_VWB1_WG16_16_1_WGM1_WGMXCC1_WGMXCCG20
    SolutionIndex: 14
    SolutionNameMin: Cijk_Ailk_Bljk_SB_UserArgs_MT128x64x32_MI16x16x1_SN_LDSB1_GRVWA2_GRVWB2_GSU1_GSUC0_GSUWGMRR0_K1_LBSPPA2048_LBSPPB128_LPA0_LPB8_LRVW4_MIWT8_1_NLCA1_SU0_SUM0_SUS0_SVW4_VWA4_VWB1_WG16_16_1_WGM1_WGMXCC1_WGMXCCG20
    SolutionIndex: 15
    SolutionNameMin: Cijk_Ailk_Bljk_SB_UserArgs_MT128x64x32_MI16x16x1_SN_LDSB1_GRVWA2_GRVWB4_GSU1_GSUC0_GSUWGMRR0_K1_LBSPPA2048_LBSPPB256_LPA0_LPB8_LRVW4_MIWT4_2_NLCA1_SU0_SUM0_SUS0_SVW4_VWA4_VWB2_WG32_8_1_WGM1_WGMXCC1_WGMXCCG20
    SolutionIndex: 16
    SolutionNameMin: Cijk_Ailk_Bljk_SB_UserArgs_MT128x64x32_MI16x16x1_SN_LDSB1_GRVWA2_GRVWB4_GSU1_GSUC0_GSUWGMRR0_K1_LBSPPA2048_LBSPPB256_LPA0_LPB8_LRVW4_MIWT4_2_NLCA1_SU0_SUM0_SUS0_SVW4_VWA4_VWB2_WG32_8_1_WGM8_WGMXCC1_WGMXCCG20
    SolutionIndex: 17
    SolutionNameMin: Cijk_Ailk_Bljk_SB_UserArgs_MT128x64x32_MI16x16x1_SN_LDSB1_GRVWA4_GRVWB4_GSU1_GSUC0_GSUWGMRR0_K1_LBSPPA2048_LBSPPB256_LPA0_LPB8_LRVW4_MIWT4_2_NLCA1_SU0_SUM0_SUS0_SVW4_VWA4_VWB2_WG32_8_1_WGM6_WGMXCC1_WGMXCCG20
    SolutionIndex: 18
    SolutionNameMin: Cijk_Ailk_Bljk_SB_UserArgs_MT128x64x32_MI16x16x1_SN_LDSB1_GRVWA2_GRVWB4_GSU1_GSUC0_GSUWGMRR0_K1_LBSPPA2048_LBSPPB256_LPA0_LPB8_LRVW4_MIWT4_2_NLCA1_SU0_SUM0_SUS0_SVW4_VWA4_VWB2_WG32_8_1_WGM6_WGMXCC1_WGMXCCG20
    SolutionIndex: 19
    SolutionNameMin: Cijk_Ailk_Bljk_SB_UserArgs_MT64x176x32_MI16x16x1_SN_LDSB1_GRVWA2_GRVWB2_GSU1_GSUC0_GSUWGMRR0_K1_LBSPPA1024_LBSPPB128_LPA16_LPB8_LRVW4_MIWT1_11_NLCA1_SU0_SUM0_SUS0_SVW1_VWA1_VWB1_WG64_4_1_WGM1_WGMXCC1_WGMXCCG20
    SolutionIndex: 20
    SolutionNameMin: Cijk_Ailk_Bljk_SB_UserArgs_MT64x96x32_MI16x16x1_SN_LDSB1_GRVWA2_GRVWB2_GSU1_GSUC0_GSUWGMRR0_K1_LBSPPA1024_LBSPPB128_LPA0_LPB8_LRVW4_MIWT2_3_NLCA1_SU0_SUM0_SUS0_SVW2_VWA2_VWB1_WG32_8_1_WGM1_WGMXCC1_WGMXCCG20
    SolutionIndex: 21
    SolutionNameMin: Cijk_Ailk_Bljk_SB_UserArgs_MT64x176x32_MI16x16x1_SN_LDSB1_GRVWA2_GRVWB2_GSU1_GSUC0_GSUWGMRR0_K1_LBSPPA1024_LBSPPB128_LPA16_LPB8_LRVW4_MIWT1_11_NLCA1_SU0_SUM0_SUS0_SVW1_VWA1_VWB1_WG64_4_1_WGM8_WGMXCC1_WGMXCCG20
    SolutionIndex: 22
    SolutionNameMin: Cijk_Ailk_Bljk_SB_UserArgs_MT96x64x32_MI16x16x1_SN_LDSB1_GRVWA2_GRVWB2_GSU1_GSUC0_GSUWGMRR0_K1_LBSPPA1536_LBSPPB128_LPA0_LPB8_LRVW4_MIWT6_1_NLCA3_SU0_SUM0_SUS0_SVW2_VWA2_VWB1_WG16_16_1_WGM1_WGMXCC1_WGMXCCG20
    SolutionIndex: 23
    SolutionNameMin: Cijk_Ailk_Bljk_SB_UserArgs_MT64x176x32_MI16x16x1_SN_LDSB1_GRVWA2_GRVWB2_GSU1_GSUC0_GSUWGMRR0_K1_LBSPPA1024_LBSPPB128_LPA16_LPB8_LRVW4_MIWT1_11_NLCA1_SU0_SUM0_SUS0_SVW1_VWA1_VWB1_WG64_4_1_WGM6_WGMXCC1_WGMXCCG20
    SolutionIndex: 24
    SolutionNameMin: Cijk_Ailk_Bljk_SB_UserArgs_MT32x16x64_MI16x16x1_SN_LDSB0_GRVWA4_GRVWB4_GSU1_GSUC0_GSUWGMRR0_K1_LBSPPA512_LBSPPB256_LPA16_LPB8_LRVW4_MIWT1_1_NLCA1_SU0_SUM0_SUS0_SVW1_VWA1_VWB1_WG32_4_1_WGM1_WGMXCC1_WGMXCCG20
    SolutionIndex: 25
    SolutionNameMin: Cijk_Ailk_Bljk_SB_UserArgs_MT64x32x32_MI16x16x1_SN_LDSB0_GRVWA4_GRVWB4_GSU1_GSUC0_GSUWGMRR0_K1_LBSPPA1024_LBSPPB128_LPA0_LPB8_LRVW4_MIWT2_1_NLCA1_SU0_SUM0_SUS0_SVW2_VWA2_VWB1_WG32_8_1_WGM1_WGMXCC1_WGMXCCG20
    SolutionIndex: 26
    SolutionNameMin: Cijk_Ailk_Bljk_SB_UserArgs_MT64x32x32_MI16x16x1_SN_LDSB0_GRVWA2_GRVWB2_GSU1_GSUC0_GSUWGMRR0_K1_LBSPPA1024_LBSPPB128_LPA0_LPB8_LRVW4_MIWT2_1_NLCA1_SU0_SUM0_SUS0_SVW2_VWA2_VWB1_WG32_8_1_WGM1_WGMXCC1_WGMXCCG20
    SolutionIndex: 27
    SolutionNameMin: Cijk_Ailk_Bljk_SB_UserArgs_MT64x32x32_MI16x16x1_SN_LDSB0_GRVWA2_GRVWB4_GSU1_GSUC0_GSUWGMRR0_K1_LBSPPA1024_LBSPPB128_LPA0_LPB8_LRVW4_MIWT2_1_NLCA1_SU0_SUM0_SUS0_SVW2_VWA2_VWB1_WG32_8_1_WGM1_WGMXCC1_WGMXCCG20
    SolutionIndex: 28
    SolutionNameMin: Cijk_Ailk_Bljk_SB_UserArgs_MT64x16x32_MI16x16x1_SN_LDSB0_GRVWA4_GRVWB2_GSU1_GSUC0_GSUWGMRR0_K1_LBSPPA1024_LBSPPB128_LPA16_LPB8_LRVW4_MIWT1_1_NLCA1_SU0_SUM0_SUS0_SVW1_VWA1_VWB1_WG64_4_1_WGM1_WGMXCC1_WGMXCCG20
    SolutionIndex: 29
    SolutionNameMin: Cijk_Ailk_Bljk_SB_UserArgs_MT32x16x32_MI16x16x1_SN_LDSB0_GRVWA2_GRVWB4_GSU1_GSUC0_GSUWGMRR0_K1_LBSPPA512_LBSPPB128_LPA16_LPB8_LRVW4_MIWT1_1_NLCA1_SU0_SUM0_SUS0_SVW1_VWA1_VWB1_WG32_4_1_WGM6_WGMXCC1_WGMXCCG20
    SolutionIndex: 30
    SolutionNameMin: Cijk_Ailk_Bljk_SB_UserArgs_MT64x48x32_MI16x16x1_SN_LDSB0_GRVWA4_GRVWB2_GSU1_GSUC0_GSUWGMRR0_K1_LBSPPA1024_LBSPPB128_LPA16_LPB8_LRVW4_MIWT1_3_NLCA1_SU0_SUM0_SUS0_SVW1_VWA1_VWB1_WG64_4_1_WGM1_WGMXCC1_WGMXCCG20
    SolutionIndex: 31
    SolutionNameMin: Cijk_Ailk_Bljk_SB_UserArgs_MT64x48x32_MI16x16x1_SN_LDSB0_GRVWA2_GRVWB2_GSU1_GSUC0_GSUWGMRR0_K1_LBSPPA1024_LBSPPB128_LPA16_LPB8_LRVW4_MIWT1_3_NLCA1_SU0_SUM0_SUS0_SVW1_VWA1_VWB1_WG64_4_1_WGM1_WGMXCC1_WGMXCCG20
    SolutionIndex: 32
    SolutionNameMin: Cijk_Ailk_Bljk_SB_UserArgs_MT128x48x32_MI16x16x1_SN_LDSB1_GRVWA2_GRVWB2_GSU1_GSUC0_GSUWGMRR0_K1_LBSPPA2048_LBSPPB128_LPA0_LPB8_LRVW4_MIWT2_3_NLCA1_SU0_SUM0_SUS0_SVW2_VWA2_VWB1_WG64_4_1_WGM1_WGMXCC1_WGMXCCG20
    SolutionIndex: 33
    SolutionNameMin: Cijk_Ailk_Bljk_SB_UserArgs_MT64x96x32_MI16x16x1_SN_LDSB1_GRVWA2_GRVWB4_GSU1_GSUC0_GSUWGMRR0_K1_LBSPPA1024_LBSPPB128_LPA0_LPB8_LRVW4_MIWT2_3_NLCA1_SU0_SUM0_SUS0_SVW2_VWA2_VWB1_WG32_8_1_WGM1_WGMXCC1_WGMXCCG20
    SolutionIndex: 34
    SolutionNameMin: Cijk_Ailk_Bljk_SB_UserArgs_MT128x48x32_MI16x16x1_SN_LDSB1_GRVWA2_GRVWB2_GSU1_GSUC0_GSUWGMRR0_K1_LBSPPA2048_LBSPPB128_LPA0_LPB8_LRVW4_MIWT2_3_NLCA1_SU0_SUM0_SUS0_SVW2_VWA2_VWB1_WG64_4_1_WGM8_WGMXCC1_WGMXCCG20
    SolutionIndex: 35
    SolutionNameMin: Cijk_Ailk_Bljk_SB_UserArgs_MT128x48x32_MI16x16x1_SN_LDSB1_GRVWA2_GRVWB2_GSU1_GSUC0_GSUWGMRR0_K1_LBSPPA2048_LBSPPB128_LPA0_LPB8_LRVW4_MIWT2_3_NLCA1_SU0_SUM0_SUS0_SVW2_VWA2_VWB1_WG64_4_1_WGM6_WGMXCC1_WGMXCCG20
    SolutionIndex: 36
    SolutionNameMin: Cijk_Ailk_Bljk_SB_UserArgs_MT80x64x32_MI16x16x1_SN_LDSB1_GRVWA2_GRVWB4_GSU1_GSUC0_GSUWGMRR0_K1_LBSPPA1280_LBSPPB128_LPA16_LPB8_LRVW4_MIWT5_1_NLCA5_SU0_SUM0_SUS0_SVW1_VWA1_VWB1_WG16_16_1_WGM6_WGMXCC1_WGMXCCG20
    SolutionIndex: 37
    SolutionNameMin: Cijk_Ailk_Bljk_SB_UserArgs_MT80x64x32_MI16x16x1_SN_LDSB1_GRVWA2_GRVWB4_GSU1_GSUC0_GSUWGMRR0_K1_LBSPPA1280_LBSPPB128_LPA16_LPB8_LRVW4_MIWT5_1_NLCA5_SU0_SUM0_SUS0_SVW1_VWA1_VWB1_WG16_16_1_WGM8_WGMXCC1_WGMXCCG20
    SolutionIndex: 38
    SolutionNameMin: Cijk_Ailk_Bljk_SB_UserArgs_MT80x64x32_MI16x16x1_SN_LDSB1_GRVWA2_GRVWB4_GSU1_GSUC0_GSUWGMRR0_K1_LBSPPA1280_LBSPPB128_LPA16_LPB8_LRVW4_MIWT5_1_NLCA5_SU0_SUM0_SUS0_SVW1_VWA1_VWB1_WG16_16_1_WGM1_WGMXCC1_WGMXCCG20
    SolutionIndex: 39
    SolutionNameMin: Cijk_Ailk_Bljk_SB_UserArgs_MT192x32x32_MI16x16x1_SN_LDSB1_GRVWA2_GRVWB4_GSU1_GSUC0_GSUWGMRR0_K1_LBSPPA3072_LBSPPB128_LPA0_LPB8_LRVW4_MIWT6_1_NLCA3_SU0_SUM0_SUS0_SVW2_VWA2_VWB1_WG32_8_1_WGM1_WGMXCC1_WGMXCCG20
    SolutionIndex: 40
    SolutionNameMin: Cijk_Ailk_Bljk_SB_UserArgs_MT192x32x32_MI16x16x1_SN_LDSB1_GRVWA4_GRVWB2_GSU1_GSUC0_GSUWGMRR0_K1_LBSPPA3072_LBSPPB128_LPA0_LPB8_LRVW4_MIWT6_1_NLCA3_SU0_SUM0_SUS0_SVW2_VWA2_VWB1_WG32_8_1_WGM1_WGMXCC1_WGMXCCG20
    SolutionIndex: 41
    SolutionNameMin: Cijk_Ailk_Bljk_SB_UserArgs_MT192x32x32_MI16x16x1_SN_LDSB1_GRVWA2_GRVWB4_GSU1_GSUC0_GSUWGMRR0_K1_LBSPPA3072_LBSPPB128_LPA0_LPB8_LRVW4_MIWT6_1_NLCA3_SU0_SUM0_SUS0_SVW2_VWA2_VWB1_WG32_8_1_WGM6_WGMXCC1_WGMXCCG20
    SolutionIndex: 42
    SolutionNameMin: Cijk_Ailk_Bljk_SB_UserArgs_MT112x64x32_MI16x16x1_SN_LDSB1_GRVWA2_GRVWB4_GSU1_GSUC0_GSUWGMRR0_K1_LBSPPA1792_LBSPPB128_LPA16_LPB8_LRVW4_MIWT7_1_NLCA7_SU0_SUM0_SUS0_SVW1_VWA1_VWB1_WG16_16_1_WGM1_WGMXCC1_WGMXCCG20
    SolutionIndex: 43
    SolutionNameMin: Cijk_Ailk_Bljk_SB_UserArgs_MT112x64x32_MI16x16x1_SN_LDSB1_GRVWA2_GRVWB4_GSU1_GSUC0_GSUWGMRR0_K1_LBSPPA1792_LBSPPB128_LPA16_LPB8_LRVW4_MIWT7_1_NLCA7_SU0_SUM0_SUS0_SVW1_VWA1_VWB1_WG16_16_1_WGM6_WGMXCC1_WGMXCCG20
    SolutionIndex: 44
    SolutionNameMin: Cijk_Ailk_Bljk_SB_UserArgs_MT64x32x32_MI16x16x1_SN_LDSB0_GRVWA4_GRVWB4_GSU3_GSUC0_GSUWGMRR0_K1_LBSPPA1024_LBSPPB128_LPA0_LPB8_LRVW4_MIWT2_1_NLCA1_SU0_SUM0_SUS0_SVW2_VWA2_VWB1_WG32_8_1_WGM1_WGMXCC1_WGMXCCG20
    SolutionIndex: 45
    SolutionNameMin: Cijk_Ailk_Bljk_SB_UserArgs_MT128x16x32_MI16x16x1_SN_LDSB1_GRVWA4_GRVWB2_GSU1_GSUC0_GSUWGMRR0_K1_LBSPPA2048_LBSPPB128_LPA0_LPB8_LRVW4_MIWT2_1_NLCA1_SU0_SUM0_SUS0_SVW2_VWA2_VWB1_WG64_4_1_WGM1_WGMXCC1_WGMXCCG20
    SolutionIndex: 46
    SolutionNameMin: Cijk_Ailk_Bljk_SB_UserArgs_MT128x32x32_MI16x16x1_SN_LDSB1_GRVWA4_GRVWB4_GSU1_GSUC0_GSUWGMRR0_K1_LBSPPA2048_LBSPPB128_LPA0_LPB8_LRVW4_MIWT4_1_NLCA1_SU0_SUM0_SUS0_SVW4_VWA4_VWB1_WG32_8_1_WGM1_WGMXCC1_WGMXCCG20
    SolutionIndex: 47
    SolutionNameMin: Cijk_Ailk_Bljk_SB_UserArgs_MT128x32x32_MI16x16x1_SN_LDSB1_GRVWA2_GRVWB4_GSU1_GSUC0_GSUWGMRR0_K1_LBSPPA2048_LBSPPB128_LPA0_LPB8_LRVW4_MIWT4_1_NLCA1_SU0_SUM0_SUS0_SVW4_VWA4_VWB1_WG32_8_1_WGM1_WGMXCC1_WGMXCCG20
    SolutionIndex: 48
    SolutionNameMin: Cijk_Ailk_Bljk_SB_UserArgs_MT128x16x32_MI16x16x1_SN_LDSB1_GRVWA4_GRVWB2_GSU3_GSUC0_GSUWGMRR0_K1_LBSPPA2048_LBSPPB128_LPA0_LPB8_LRVW4_MIWT2_1_NLCA1_SU0_SUM0_SUS0_SVW2_VWA2_VWB1_WG64_4_1_WGM8_WGMXCC1_WGMXCCG20
    SolutionIndex: 49
    SolutionNameMin: Cijk_Ailk_Bljk_SB_UserArgs_MT192x32x32_MI16x16x1_SN_LDSB1_GRVWA4_GRVWB4_GSU1_GSUC0_GSUWGMRR0_K1_LBSPPA3072_LBSPPB128_LPA0_LPB8_LRVW4_MIWT6_1_NLCA3_SU0_SUM0_SUS0_SVW2_VWA2_VWB1_WG32_8_1_WGM1_WGMXCC1_WGMXCCG20
    SolutionIndex: 50
    SolutionNameMin: Cijk_Ailk_Bljk_SB_UserArgs_MT192x32x32_MI16x16x1_SN_LDSB1_GRVWA4_GRVWB4_GSU1_GSUC0_GSUWGMRR0_K1_LBSPPA3072_LBSPPB256_LPA16_LPB8_LRVW4_MIWT3_2_NLCA3_SU0_SUM0_SUS0_SVW1_VWA1_VWB2_WG64_4_1_WGM1_WGMXCC1_WGMXCCG20
    SolutionIndex: 51
    SolutionNameMin: Cijk_Ailk_Bljk_SB_UserArgs_MT128x64x32_MI16x16x1_SN_LDSB1_GRVWA4_GRVWB4_GSU1_GSUC0_GSUWGMRR0_K1_LBSPPA2048_LBSPPB512_LPA0_LPB8_LRVW4_MIWT2_4_NLCA1_SU0_SUM0_SUS0_SVW2_VWA2_VWB4_WG64_4_1_WGM1_WGMXCC1_WGMXCCG20
    SolutionIndex: 52
    SolutionNameMin: Cijk_Ailk_Bljk_SB_UserArgs_MT128x64x32_MI16x16x1_SN_LDSB1_GRVWA4_GRVWB4_GSU1_GSUC0_GSUWGMRR0_K1_LBSPPA2048_LBSPPB256_LPA0_LPB8_LRVW4_MIWT4_2_NLCA1_SU0_SUM0_SUS0_SVW4_VWA4_VWB2_WG32_8_1_WGM1_WGMXCC1_WGMXCCG20
    SolutionIndex: 53
    SolutionNameMin: Cijk_Ailk_Bljk_SB_UserArgs_MT128x32x32_MI16x16x1_SN_LDSB1_GRVWA4_GRVWB4_GSU3_GSUC0_GSUWGMRR0_K1_LBSPPA2048_LBSPPB128_LPA0_LPB8_LRVW4_MIWT4_1_NLCA1_SU0_SUM0_SUS0_SVW4_VWA4_VWB1_WG32_8_1_WGM1_WGMXCC1_WGMXCCG20
    SolutionIndex: 54
    SolutionNameMin: Cijk_Ailk_Bljk_SB_UserArgs_MT128x32x32_MI16x16x1_SN_LDSB1_GRVWA4_GRVWB4_GSU3_GSUC0_GSUWGMRR0_K1_LBSPPA2048_LBSPPB256_LPA0_LPB8_LRVW4_MIWT2_2_NLCA1_SU0_SUM0_SUS0_SVW2_VWA2_VWB2_WG64_4_1_WGM1_WGMXCC1_WGMXCCG20
    SolutionIndex: 55
    SolutionNameMin: Cijk_Ailk_Bljk_SB_UserArgs_MT128x16x32_MI16x16x1_SN_LDSB1_GRVWA4_GRVWB2_GSU3_GSUC0_GSUWGMRR0_K1_LBSPPA2048_LBSPPB128_LPA0_LPB8_LRVW4_MIWT2_1_NLCA1_SU0_SUM0_SUS0_SVW2_VWA2_VWB1_WG64_4_1_WGM1_WGMXCC1_WGMXCCG20
    SolutionIndex: 56
    SolutionNameMin: Cijk_Ailk_Bljk_SB_UserArgs_MT128x32x32_MI16x16x1_SN_LDSB1_GRVWA4_GRVWB2_GSU1_GSUC0_GSUWGMRR0_K1_LBSPPA2048_LBSPPB256_LPA0_LPB8_LRVW4_MIWT2_2_NLCA1_SU0_SUM0_SUS0_SVW2_VWA2_VWB2_WG64_4_1_WGM1_WGMXCC1_WGMXCCG20
    SolutionIndex: 57
    SolutionNameMin: Cijk_Ailk_Bljk_SB_UserArgs_MT32x64x32_MI16x16x1_SN_LDSB0_GRVWA4_GRVWB4_GSU3_GSUC0_GSUWGMRR0_K1_LBSPPA512_LBSPPB128_LPA0_LPB8_LRVW4_MIWT2_1_NLCA1_SU0_SUM0_SUS0_SVW2_VWA2_VWB1_WG16_16_1_WGM1_WGMXCC1_WGMXCCG20
    SolutionIndex: 58
    SolutionNameMin: Cijk_Ailk_Bljk_SB_UserArgs_MT32x64x32_MI16x16x1_SN_LDSB0_GRVWA4_GRVWB4_GSU3_GSUC0_GSUWGMRR0_K1_LBSPPA512_LBSPPB256_LPA16_LPB8_LRVW4_MIWT1_2_NLCA1_SU0_SUM0_SUS0_SVW1_VWA1_VWB2_WG32_8_1_WGM1_WGMXCC1_WGMXCCG20
    SolutionIndex: 59
    SolutionNameMin: Cijk_Ailk_Bljk_SB_UserArgs_MT32x16x64_MI16x16x1_SN_LDSB0_GRVWA4_GRVWB2_GSU1_GSUC0_GSUWGMRR0_K1_LBSPPA512_LBSPPB256_LPA16_LPB8_LRVW4_MIWT1_1_NLCA1_SU0_SUM0_SUS0_SVW1_VWA1_VWB1_WG32_4_1_WGM1_WGMXCC1_WGMXCCG20
    SolutionIndex: 60
    SolutionNameMin: Cijk_Ailk_Bljk_SB_UserArgs_MT32x16x32_MI16x16x1_SN_LDSB0_GRVWA4_GRVWB4_GSU4_GSUC0_GSUWGMRR0_K1_LBSPPA512_LBSPPB128_LPA16_LPB8_LRVW4_MIWT1_1_NLCA1_SU0_SUM0_SUS0_SVW1_VWA1_VWB1_WG32_4_1_WGM1_WGMXCC1_WGMXCCG20
    SolutionIndex: 61
    SolutionNameMin: Cijk_Ailk_Bljk_SB_UserArgs_MT32x16x64_MI16x16x1_SN_LDSB0_GRVWA4_GRVWB4_GSU4_GSUC0_GSUWGMRR0_K1_LBSPPA512_LBSPPB256_LPA16_LPB8_LRVW4_MIWT1_1_NLCA1_SU0_SUM0_SUS0_SVW1_VWA1_VWB1_WG32_4_1_WGM1_WGMXCC1_WGMXCCG20
    SolutionIndex: 62
    SolutionNameMin: Cijk_Ailk_Bljk_SB_UserArgs_MT32x16x32_MI16x16x1_SN_LDSB0_GRVWA4_GRVWB2_GSU4_GSUC0_GSUWGMRR0_K1_LBSPPA512_LBSPPB128_LPA16_LPB8_LRVW4_MIWT1_1_NLCA1_SU0_SUM0_SUS0_SVW1_VWA1_VWB1_WG32_4_1_WGM1_WGMXCC1_WGMXCCG20
    SolutionIndex: 63
    SolutionNameMin: Cijk_Ailk_Bljk_SB_UserArgs_MT96x64x32_MI16x16x1_SN_LDSB1_GRVWA2_GRVWB2_GSU1_GSUC0_GSUWGMRR0_K1_LBSPPA1536_LBSPPB256_LPA16_LPB8_LRVW4_MIWT3_2_NLCA3_SU0_SUM0_SUS0_SVW1_VWA1_VWB2_WG32_8_1_WGM1_WGMXCC1_WGMXCCG20
    SolutionIndex: 64
    SolutionNameMin: Cijk_Ailk_Bljk_SB_UserArgs_MT96x64x32_MI16x16x1_SN_LDSB1_GRVWA2_GRVWB2_GSU1_GSUC0_GSUWGMRR0_K1_LBSPPA1536_LBSPPB256_LPA16_LPB8_LRVW4_MIWT3_2_NLCA3_SU0_SUM0_SUS0_SVW1_VWA1_VWB2_WG32_8_1_WGM6_WGMXCC1_WGMXCCG20
    SolutionIndex: 65
    SolutionNameMin: Cijk_Ailk_Bljk_SB_UserArgs_MT96x64x32_MI16x16x1_SN_LDSB1_GRVWA2_GRVWB2_GSU1_GSUC0_GSUWGMRR0_K1_LBSPPA1536_LBSPPB256_LPA16_LPB8_LRVW4_MIWT3_2_NLCA3_SU0_SUM0_SUS0_SVW1_VWA1_VWB2_WG32_8_1_WGM8_WGMXCC1_WGMXCCG20
    SolutionIndex: 66
    SolutionNameMin: Cijk_Ailk_Bljk_SB_UserArgs_MT96x64x32_MI16x16x1_SN_LDSB1_GRVWA4_GRVWB2_GSU1_GSUC0_GSUWGMRR0_K1_LBSPPA1536_LBSPPB128_LPA0_LPB8_LRVW4_MIWT6_1_NLCA3_SU0_SUM0_SUS0_SVW2_VWA2_VWB1_WG16_16_1_WGM1_WGMXCC1_WGMXCCG20
    SolutionIndex: 67
    SolutionNameMin: Cijk_Ailk_Bljk_SB_UserArgs_MT96x64x32_MI16x16x1_SN_LDSB1_GRVWA4_GRVWB4_GSU1_GSUC0_GSUWGMRR0_K1_LBSPPA1536_LBSPPB128_LPA0_LPB8_LRVW4_MIWT6_1_NLCA3_SU0_SUM0_SUS0_SVW2_VWA2_VWB1_WG16_16_1_WGM1_WGMXCC1_WGMXCCG20
    SolutionIndex: 68
    SolutionNameMin: Cijk_Ailk_Bljk_SB_UserArgs_MT32x16x64_MI16x16x1_SN_LDSB0_GRVWA4_GRVWB4_GSU1_GSUC0_GSUWGMRR0_K1_LBSPPA512_LBSPPB256_LPA16_LPB8_LRVW4_MIWT1_1_NLCA1_SU0_SUM0_SUS0_SVW1_VWA1_VWB1_WG32_4_1_WGM6_WGMXCC1_WGMXCCG20
    SolutionIndex: 69
    SolutionNameMin: Cijk_Ailk_Bljk_SB_UserArgs_MT128x32x32_MI16x16x1_SN_LDSB1_GRVWA4_GRVWB4_GSU1_GSUC0_GSUWGMRR0_K1_LBSPPA2048_LBSPPB256_LPA0_LPB8_LRVW4_MIWT2_2_NLCA1_SU0_SUM0_SUS0_SVW2_VWA2_VWB2_WG64_4_1_WGM1_WGMXCC1_WGMXCCG20
    SolutionIndex: 70
    SolutionNameMin: Cijk_Ailk_Bljk_SB_UserArgs_MT128x32x32_MI16x16x1_SN_LDSB1_GRVWA4_GRVWB2_GSU1_GSUC0_GSUWGMRR0_K1_LBSPPA2048_LBSPPB128_LPA0_LPB8_LRVW4_MIWT4_1_NLCA1_SU0_SUM0_SUS0_SVW4_VWA4_VWB1_WG32_8_1_WGM1_WGMXCC1_WGMXCCG20
    SolutionIndex: 71
    SolutionNameMin: Cijk_Ailk_Bljk_SB_UserArgs_MT96x96x32_MI16x16x1_SN_LDSB1_GRVWA4_GRVWB2_GSU1_GSUC0_GSUWGMRR0_K1_LBSPPA1536_LBSPPB128_LPA16_LPB8_LRVW4_MIWT3_3_NLCA3_SU0_SUM0_SUS0_SVW1_VWA1_VWB1_WG32_8_1_WGM8_WGMXCC1_WGMXCCG20
    SolutionIndex: 72
    SolutionNameMin: Cijk_Ailk_Bljk_SB_UserArgs_MT96x96x32_MI16x16x1_SN_LDSB1_GRVWA4_GRVWB4_GSU1_GSUC0_GSUWGMRR0_K1_LBSPPA1536_LBSPPB128_LPA16_LPB8_LRVW4_MIWT3_3_NLCA3_SU0_SUM0_SUS0_SVW1_VWA1_VWB1_WG32_8_1_WGM8_WGMXCC1_WGMXCCG20
    SolutionIndex: 73
    SolutionNameMin: Cijk_Ailk_Bljk_SB_UserArgs_MT96x96x32_MI16x16x1_SN_LDSB1_GRVWA4_GRVWB4_GSU1_GSUC0_GSUWGMRR0_K1_LBSPPA1536_LBSPPB128_LPA16_LPB8_LRVW4_MIWT3_3_NLCA3_SU0_SUM0_SUS0_SVW1_VWA1_VWB1_WG32_8_1_WGM1_WGMXCC1_WGMXCCG20
    SolutionIndex: 74
    SolutionNameMin: Cijk_Ailk_Bljk_SB_UserArgs_MT96x96x32_MI16x16x1_SN_LDSB1_GRVWA4_GRVWB4_GSU1_GSUC0_GSUWGMRR0_K1_LBSPPA1536_LBSPPB128_LPA16_LPB8_LRVW4_MIWT3_3_NLCA3_SU0_SUM0_SUS0_SVW1_VWA1_VWB1_WG32_8_1_WGM6_WGMXCC1_WGMXCCG20
    SolutionIndex: 75
    SolutionNameMin: Cijk_Ailk_Bljk_SB_UserArgs_MT96x96x32_MI16x16x1_SN_LDSB1_GRVWA4_GRVWB2_GSU1_GSUC0_GSUWGMRR0_K1_LBSPPA1536_LBSPPB128_LPA16_LPB8_LRVW4_MIWT3_3_NLCA3_SU0_SUM0_SUS0_SVW1_VWA1_VWB1_WG32_8_1_WGM6_WGMXCC1_WGMXCCG20
    SolutionIndex: 76
    SolutionNameMin: Cijk_Ailk_Bljk_SB_UserArgs_MT96x32x32_MI16x16x1_SN_LDSB1_GRVWA4_GRVWB2_GSU4_GSUC0_GSUWGMRR0_K1_LBSPPA1536_LBSPPB128_LPA16_LPB8_LRVW4_MIWT3_1_NLCA3_SU0_SUM0_SUS0_SVW1_VWA1_VWB1_WG32_8_1_WGM1_WGMXCC1_WGMXCCG20
    SolutionIndex: 77
    SolutionNameMin: Cijk_Ailk_Bljk_SB_UserArgs_MT160x32x32_MI16x16x1_SN_LDSB1_GRVWA4_GRVWB4_GSU1_GSUC0_GSUWGMRR0_K1_LBSPPA2560_LBSPPB128_LPA16_LPB8_LRVW4_MIWT5_1_NLCA5_SU0_SUM0_SUS0_SVW1_VWA1_VWB1_WG32_8_1_WGM1_WGMXCC1_WGMXCCG20
    SolutionIndex: 78
    SolutionNameMin: Cijk_Ailk_Bljk_SB_UserArgs_MT16x16x32_MI16x16x1_SN_LDSB0_GRVWA2_GRVWB4_GSU1_GSUC0_GSUWGMRR0_K1_LBSPPA256_LBSPPB128_LPA16_LPB8_LRVW4_MIWT1_1_NLCA1_SU0_SUM0_SUS0_SVW1_VWA1_VWB1_WG16_4_1_WGM1_WGMXCC1_WGMXCCG20
    SolutionIndex: 79
    SolutionNameMin: Cijk_Ailk_Bljk_SB_UserArgs_MT16x16x32_MI16x16x1_SN_LDSB0_GRVWA2_GRVWB2_GSU1_GSUC0_GSUWGMRR0_K1_LBSPPA256_LBSPPB128_LPA16_LPB8_LRVW4_MIWT1_1_NLCA1_SU0_SUM0_SUS0_SVW1_VWA1_VWB1_WG16_4_1_WGM1_WGMXCC1_WGMXCCG20
    SolutionIndex: 80
    SolutionNameMin: Cijk_Ailk_Bljk_SB_UserArgs_MT64x32x64_MI16x16x1_SN_LDSB1_GRVWA4_GRVWB4_GSU1_GSUC0_GSUWGMRR0_K1_LBSPPA1024_LBSPPB256_LPA0_LPB8_LRVW4_MIWT2_1_NLCA1_SU0_SUM0_SUS0_SVW2_VWA2_VWB1_WG32_8_1_WGM1_WGMXCC1_WGMXCCG20
    SolutionIndex: 81
    SolutionNameMin: Cijk_Ailk_Bljk_SB_UserArgs_MT64x48x64_MI16x16x1_SN_LDSB1_GRVWA2_GRVWB4_GSU1_GSUC0_GSUWGMRR0_K1_LBSPPA1024_LBSPPB256_LPA16_LPB8_LRVW4_MIWT1_3_NLCA1_SU0_SUM0_SUS0_SVW1_VWA1_VWB1_WG64_4_1_WGM1_WGMXCC1_WGMXCCG20
    SolutionIndex: 82
    SolutionNameMin: Cijk_Ailk_Bljk_SB_UserArgs_MT64x64x32_MI16x16x1_SN_LDSB1_GRVWA4_GRVWB4_GSU1_GSUC0_GSUWGMRR0_K1_LBSPPA1024_LBSPPB256_LPA0_LPB8_LRVW4_MIWT2_2_NLCA1_SU0_SUM0_SUS0_SVW2_VWA2_VWB2_WG32_8_1_WGM1_WGMXCC1_WGMXCCG20
    SolutionIndex: 83
    SolutionNameMin: Cijk_Ailk_Bljk_SB_UserArgs_MT32x32x64_MI16x16x1_SN_LDSB1_GRVWA4_GRVWB4_GSU1_GSUC0_GSUWGMRR0_K1_LBSPPA512_LBSPPB256_LPA16_LPB8_LRVW4_MIWT1_1_NLCA1_SU0_SUM0_SUS0_SVW1_VWA1_VWB1_WG32_8_1_WGM1_WGMXCC1_WGMXCCG20
    SolutionIndex: 84
    SolutionNameMin: Cijk_Ailk_Bljk_SB_UserArgs_MT64x80x32_MI16x16x1_SN_LDSB1_GRVWA4_GRVWB2_GSU1_GSUC0_GSUWGMRR0_K1_LBSPPA1024_LBSPPB128_LPA16_LPB8_LRVW4_MIWT1_5_NLCA1_SU0_SUM0_SUS0_SVW1_VWA1_VWB1_WG64_4_1_WGM1_WGMXCC1_WGMXCCG20
    SolutionIndex: 85
    SolutionNameMin: Cijk_Ailk_Bljk_SB_UserArgs_MT32x16x32_MI16x16x1_SN_LDSB0_GRVWA4_GRVWB2_GSU1_GSUC0_GSUWGMRR0_K1_LBSPPA512_LBSPPB128_LPA16_LPB8_LRVW4_MIWT1_1_NLCA1_SU0_SUM0_SUS0_SVW1_VWA1_VWB1_WG32_4_1_WGM1_WGMXCC1_WGMXCCG20
    SolutionIndex: 86
    SolutionNameMin: Cijk_Ailk_Bljk_SB_UserArgs_MT16x16x32_MI16x16x1_SN_LDSB0_GRVWA4_GRVWB4_GSU1_GSUC0_GSUWGMRR0_K1_LBSPPA256_LBSPPB128_LPA16_LPB8_LRVW4_MIWT1_1_NLCA1_SU0_SUM0_SUS0_SVW1_VWA1_VWB1_WG16_4_1_WGM1_WGMXCC1_WGMXCCG20
    SolutionIndex: 87
    SolutionNameMin: Cijk_Ailk_Bljk_SB_UserArgs_MT64x208x32_MI16x16x1_SN_LDSB1_GRVWA4_GRVWB2_GSU1_GSUC0_GSUWGMRR0_K1_LBSPPA1024_LBSPPB128_LPA16_LPB8_LRVW4_MIWT1_13_NLCA1_SU0_SUM0_SUS0_SVW1_VWA1_VWB1_WG64_4_1_WGM1_WGMXCC1_WGMXCCG20
    SolutionIndex: 88
    SolutionNameMin: Cijk_Ailk_Bljk_SB_UserArgs_MT64x48x64_MI16x16x1_SN_LDSB1_GRVWA4_GRVWB4_GSU1_GSUC0_GSUWGMRR0_K1_LBSPPA1024_LBSPPB256_LPA16_LPB8_LRVW4_MIWT1_3_NLCA1_SU0_SUM0_SUS0_SVW1_VWA1_VWB1_WG64_4_1_WGM1_WGMXCC1_WGMXCCG20
    SolutionIndex: 89
    SolutionNameMin: Cijk_Ailk_Bljk_SB_UserArgs_MT16x64x32_MI16x16x1_SN_LDSB0_GRVWA2_GRVWB4_GSU1_GSUC0_GSUWGMRR0_K1_LBSPPA256_LBSPPB128_LPA16_LPB8_LRVW4_MIWT1_1_NLCA1_SU0_SUM0_SUS0_SVW1_VWA1_VWB1_WG16_16_1_WGM1_WGMXCC1_WGMXCCG20
    SolutionIndex: 90
    SolutionNameMin: Cijk_Ailk_Bljk_SB_UserArgs_MT32x16x32_MI16x16x1_SN_LDSB0_GRVWA4_GRVWB4_GSU1_GSUC0_GSUWGMRR0_K1_LBSPPA512_LBSPPB128_LPA16_LPB8_LRVW4_MIWT1_1_NLCA1_SU0_SUM0_SUS0_SVW1_VWA1_VWB1_WG32_4_1_WGM1_WGMXCC1_WGMXCCG20
    SolutionIndex: 91
    SolutionNameMin: Cijk_Ailk_Bljk_SB_UserArgs_MT128x208x32_MI16x16x1_SN_LDSB1_GRVWA2_GRVWB2_GSU1_GSUC0_GSUWGMRR0_K1_LBSPPA2048_LBSPPB128_LPA0_LPB8_LRVW4_MIWT2_13_NLCA1_SU0_SUM0_SUS0_SVW2_VWA2_VWB1_WG64_4_1_WGM1_WGMXCC1_WGMXCCG20
    SolutionIndex: 92
    SolutionNameMin: Cijk_Ailk_Bljk_SB_UserArgs_MT128x48x32_MI16x16x1_SN_LDSB1_GRVWA4_GRVWB2_GSU1_GSUC0_GSUWGMRR0_K1_LBSPPA2048_LBSPPB128_LPA0_LPB8_LRVW4_MIWT2_3_NLCA1_SU0_SUM0_SUS0_SVW2_VWA2_VWB1_WG64_4_1_WGM1_WGMXCC1_WGMXCCG20
    SolutionIndex: 93
    SolutionNameMin: Cijk_Ailk_Bljk_SB_UserArgs_MT128x112x32_MI16x16x1_SN_LDSB1_GRVWA2_GRVWB2_GSU1_GSUC0_GSUWGMRR0_K1_LBSPPA2048_LBSPPB128_LPA0_LPB8_LRVW4_MIWT2_7_NLCA1_SU0_SUM0_SUS0_SVW2_VWA2_VWB1_WG64_4_1_WGM1_WGMXCC1_WGMXCCG20
    SolutionIndex: 94
    SolutionNameMin: Cijk_Ailk_Bljk_SB_UserArgs_MT128x160x32_MI16x16x1_SN_LDSB1_GRVWA4_GRVWB4_GSU1_GSUC0_GSUWGMRR0_K1_LBSPPA2048_LBSPPB256_LPA0_LPB8_LRVW4_MIWT2_10_NLCA1_SU0_SUM0_SUS0_SVW2_VWA2_VWB2_WG64_4_1_WGM1_WGMXCC1_WGMXCCG20
    SolutionIndex: 95
    SolutionNameMin: Cijk_Ailk_Bljk_SB_UserArgs_MT32x64x32_MI16x16x1_SN_LDSB0_GRVWA2_GRVWB2_GSU1_GSUC0_GSUWGMRR0_K1_LBSPPA512_LBSPPB128_LPA0_LPB8_LRVW4_MIWT2_1_NLCA1_SU0_SUM0_SUS0_SVW2_VWA2_VWB1_WG16_16_1_WGM1_WGMXCC1_WGMXCCG20
    SolutionIndex: 96
    SolutionNameMin: Cijk_Ailk_Bljk_SB_UserArgs_MT32x32x32_MI16x16x1_SN_LDSB0_GRVWA2_GRVWB4_GSU1_GSUC0_GSUWGMRR0_K1_LBSPPA512_LBSPPB128_LPA16_LPB8_LRVW4_MIWT1_1_NLCA1_SU0_SUM0_SUS0_SVW1_VWA1_VWB1_WG32_8_1_WGM1_WGMXCC1_WGMXCCG20
    SolutionIndex: 97
    SolutionNameMin: Cijk_Ailk_Bljk_SB_UserArgs_MT32x96x32_MI16x16x1_SN_LDSB1_GRVWA2_GRVWB4_GSU1_GSUC0_GSUWGMRR0_K1_LBSPPA512_LBSPPB128_LPA16_LPB8_LRVW4_MIWT1_3_NLCA1_SU0_SUM0_SUS0_SVW1_VWA1_VWB1_WG32_8_1_WGM1_WGMXCC1_WGMXCCG20
    SolutionIndex: 98
    SolutionNameMin: Cijk_Ailk_Bljk_SB_UserArgs_MT32x96x32_MI16x16x1_SN_LDSB1_GRVWA4_GRVWB4_GSU1_GSUC0_GSUWGMRR0_K1_LBSPPA512_LBSPPB128_LPA16_LPB8_LRVW4_MIWT1_3_NLCA1_SU0_SUM0_SUS0_SVW1_VWA1_VWB1_WG32_8_1_WGM1_WGMXCC1_WGMXCCG20
    SolutionIndex: 99
    SolutionNameMin: Cijk_Ailk_Bljk_SB_UserArgs_MT16x16x64_MI16x16x1_SN_LDSB0_GRVWA4_GRVWB4_GSU1_GSUC0_GSUWGMRR0_K1_LBSPPA256_LBSPPB256_LPA16_LPB8_LRVW4_MIWT1_1_NLCA1_SU0_SUM0_SUS0_SVW1_VWA1_VWB1_WG16_4_1_WGM1_WGMXCC1_WGMXCCG20
    SolutionIndex: 100
    SolutionNameMin: Cijk_Ailk_Bljk_SB_UserArgs_MT32x64x32_MI16x16x1_SN_LDSB0_GRVWA4_GRVWB4_GSU1_GSUC0_GSUWGMRR0_K1_LBSPPA512_LBSPPB128_LPA0_LPB8_LRVW4_MIWT2_1_NLCA1_SU0_SUM0_SUS0_SVW2_VWA2_VWB1_WG16_16_1_WGM1_WGMXCC1_WGMXCCG20
    SolutionIndex: 101
    SolutionNameMin: Cijk_Ailk_Bljk_SB_UserArgs_MT32x32x32_MI16x16x1_SN_LDSB0_GRVWA4_GRVWB4_GSU1_GSUC0_GSUWGMRR0_K1_LBSPPA512_LBSPPB128_LPA16_LPB8_LRVW4_MIWT1_1_NLCA1_SU0_SUM0_SUS0_SVW1_VWA1_VWB1_WG32_8_1_WGM1_WGMXCC1_WGMXCCG20
    SolutionIndex: 102
    SolutionNameMin: Cijk_Ailk_Bljk_SB_Bias_AS_SAV_UserArgs_MT16x16x128_MI16x16x1_SN_LDSB0_GRVWB4_GSU1_GSUC0_GSUWGMRR0_K1_LBSPPA256_LBSPPB512_LPA16_LPB8_LRVW4_MIWT1_1_NLCB1_SU0_SUM0_SUS0_SVW1_VWA1_VWB1_WG16_4_4_WGM1
    SolutionIndex: 103
    SolutionNameMin: Cijk_Ailk_Bljk_SB_Bias_AS_SAV_UserArgs_MT16x16x128_MI16x16x1_SN_LDSB0_GRVWB4_GSU1_GSUC0_GSUWGMRR0_K1_LBSPPA256_LBSPPB512_LPA16_LPB8_LRVW4_MIWT1_1_NLCA1_NLCB1_SU0_SUM0_SUS0_SVW1_VWA1_VWB1_WG16_4_4_WGM1
    SolutionIndex: 104
    SolutionNameMin: Cijk_Ailk_Bljk_SB_Bias_AS_SAV_UserArgs_MT128x16x32_MI16x16x1_SN_GRVWB1_GSU9_GSUC0_GSUWGMRR0_K1_LBSPPA2048_LBSPPB128_LPA0_LPB8_LRVW4_MIWT2_1_NLCA1_NLCB1_SU0_SUM0_SUS0_SVW2_VWA2_WG64_4_1_WGM1
    SolutionIndex: 105
    SolutionNameMin: Cijk_Ailk_Bljk_SB_Bias_AS_SAV_UserArgs_MT16x64x32_MI16x16x1_SN_GRVWB4_GSU1_GSUC0_GSUWGMRR0_K1_LBSPPA256_LBSPPB128_LPB8_LRVW4_MIWT1_1_NTB4_SU0_SUM0_SUS0_VWB1_WG16_16_1_WGM1
    SolutionIndex: 106
    SolutionNameMin: Cijk_Ailk_Bljk_SB_Bias_AS_SAV_UserArgs_MT16x64x32_MI16x16x1_SN_GRVWB4_GSU1_GSUC0_GSUWGMRR0_K1_LBSPPA256_LBSPPB128_LPB8_LRVW4_MIWT1_1_NTB4_NTC0_NTD0_SU0_SUM0_SUS0_VWB1_WGM1
    SolutionIndex: 107
    SolutionNameMin: Cijk_Ailk_Bljk_SB_Bias_AS_SAV_UserArgs_MT16x16x32_MI16x16x1_SN_LDSB1_GRVWB4_GSU16_GSUC0_GSUWGMRR0_K1_LBSPPA256_LBSPPB128_LPA16_LPB8_LRVW4_MIWT1_1_NLCB1_SU0_SUM0_SUS0_SVW1_VWA1_WG16_4_1_WGM1
    SolutionIndex: 108
    SolutionNameMin: Cijk_Ailk_Bljk_SB_Bias_AS_SAV_UserArgs_MT16x16x64_MI16x16x1_SN_LDSB1_GRVWB4_GSU13_GSUC0_GSUWGMRR0_K1_LBSPPA256_LBSPPB256_LPA16_LPB8_LRVW4_MIWT1_1_NLCB1_SU0_SUM0_SUS0_SVW1_VWA1_VWB1_WG16_4_1_WGM1
    SolutionIndex: 109
    SolutionNameMin: Cijk_Ailk_Bljk_SB_Bias_AS_SAV_UserArgs_MT16x32x128_MI16x16x1_SN_GRVWB1_GSU1_GSUC0_GSUWGMRR0_K1_LBSPPA256_LBSPPB512_LPA16_LPB8_LRVW4_MIWT1_1_NLCA1_NLCB1_SU0_SUM0_SUS0_SVW1_VWA1_VWB1_WG16_8_2_WGM1
    SolutionIndex: 110
    SolutionNameMin: Cijk_Ailk_Bljk_SB_Bias_AS_SAV_UserArgs_MT32x64x32_MI16x16x1_SN_LDSB1_GRVWB4_GSU3_GSUC0_GSUWGMRR0_K1_LBSPPA512_LBSPPB128_LPA0_LPB8_LRVW4_MIWT2_1_NLCA1_NLCB1_SU0_SUM0_SUS0_SVW2_VWA2_VWB1_WG16_16_1_WGM1
    SolutionIndex: 111
    SolutionNameMin: Cijk_Ailk_Bljk_SB_Bias_AS_SAV_UserArgs_MT16x32x128_MI16x16x1_SN_LDSB0_GRVWB4_GSU1_GSUC0_GSUWGMRR0_K1_LBSPPA256_LBSPPB512_LPB8_LRVW4_MIWT1_1_NLCB1_SU0_SUM0_SUS0_VWB1_WG16_8_2_WGM1
    SolutionIndex: 112
    SolutionNameMin: Cijk_Ailk_Bljk_SB_Bias_AS_SAV_UserArgs_MT256x64x8_MI32x32x1_SN_GRVWB1_GSU5_GSUC0_GSUWGMRR0_K1_LBSPPA0_LBSPPB128_LPA0_LPB2_LRVW2_MIAV1_MIWT2_2_NLCA1_SU0_SUM0_SUS0_SVW2_VWA2_VWB2_WG128_2_1_WGM1
    SolutionIndex: 113
    SolutionNameMin: Cijk_Ailk_Bljk_SB_Bias_AS_SAV_UserArgs_MT64x208x16_MI16x16x1_SN_GRVWB1_GSU1_GSUC0_GSUWGMRR0_K1_LBSPPA512_LBSPPB128_LPA16_LPB2_LRVW2_MIAV1_MIWT1_13_NTB0_NLCA1_SU0_SUM0_SUS0_SVW1_VWA1_VWB1_WG64_4_1_WGM1
    SolutionIndex: 114
    SolutionNameMin: Cijk_Ailk_Bljk_SB_Bias_AS_SAV_UserArgs_MT128x32x32_MI16x16x1_SN_GRVWB4_GSU5_GSUC0_GSUWGMRR0_K1_LBSPPA2048_LBSPPB128_LPA0_LPB8_LRVW4_MIWT4_1_NLCA1_SU0_SUM0_SUS0_SVW4_VWA4_VWB1_WG32_8_1_WGM1
    SolutionIndex: 115
    SolutionNameMin: Cijk_Ailk_Bljk_SB_Bias_AS_SAV_UserArgs_MT256x16x32_MI16x16x1_SN_GRVWB1_GSU5_GSUC0_GSUWGMRR0_K1_LBSPPA4096_LBSPPB128_LPA0_LPB8_LRVW4_MIWT4_1_NLCA1_SU0_SUM0_SUS0_SVW4_VWA4_WG64_4_1_WGM1
    SolutionIndex: 116
    SolutionNameMin: Cijk_Ailk_Bljk_SB_Bias_AS_SAV_UserArgs_MT128x48x32_MI16x16x1_SN_GRVWB1_GSU5_GSUC0_GSUWGMRR0_K1_LBSPPA2048_LBSPPB128_LPA0_LPB8_LRVW4_MIAV1_MIWT2_3_NLCA1_SU0_SUM0_SUS0_SVW2_VWA2_VWB1_WG64_4_1_WGM1
    SolutionIndex: 117
    SolutionNameMin: Cijk_Ailk_Bljk_SB_Bias_AS_SAV_UserArgs_MT128x16x64_MI16x16x1_SN_GRVWB4_GSU2_GSUC0_GSUWGMRR0_K1_LBSPPA2048_LBSPPB256_LPA0_LPB8_LRVW4_MIWT4_1_NLCA1_SU0_SUM0_SUS0_SVW4_VWA4_WG32_4_2_WGM1
    SolutionIndex: 118
    SolutionNameMin: Cijk_Ailk_Bljk_SB_Bias_AS_SAV_UserArgs_MT64x64x16_MI16x16x1_SN_GRVWB4_GSU1_GSUC0_GSUWGMRR0_K1_LBSPPA512_LBSPPB128_LPA0_LPB4_LRVW2_MIAV1_MIWT4_1_NLCA1_SU0_SUM0_SUS0_SVW4_VWA4_VWB1_WG16_16_1_WGM1
    SolutionIndex: 119
    SolutionNameMin: Cijk_Ailk_Bljk_SB_Bias_AS_SAV_UserArgs_MT64x64x16_MI16x16x1_SN_GRVWB4_GSU1_GSUC0_GSUWGMRR0_K1_LBSPPA512_LBSPPB128_LPA0_LPB4_LRVW2_MIAV1_MIWT4_1_NTB0_NLCA1_SU0_SUM0_SUS0_SVW4_VWA4_VWB1_WG16_16_1_WGM1
    SolutionIndex: 120
    SolutionNameMin: Cijk_Ailk_Bljk_SB_Bias_AS_SAV_UserArgs_MT64x80x16_MI16x16x1_SN_GRVWB1_GSU1_GSUC0_GSUWGMRR0_K1_LBSPPA512_LBSPPB128_LPA16_LPB2_LRVW2_MIAV1_MIWT1_5_NLCA1_SU0_SUM0_SUS0_SVW1_VWA1_VWB1_WG64_4_1_WGM1
    SolutionIndex: 121
    SolutionNameMin: Cijk_Ailk_Bljk_SB_Bias_AS_SAV_UserArgs_MT64x80x16_MI16x16x1_SN_LDSB1_GRVWB1_GSU1_GSUC0_GSUWGMRR0_K1_LBSPPA512_LBSPPB128_LPA16_LPB2_LRVW2_MIAV1_MIWT1_5_NLCA1_SU0_SUM0_SUS0_SVW1_VWA1_VWB1_WG64_4_1_WGM1
    SolutionIndex: 122
    SolutionNameMin: Cijk_Ailk_Bljk_SB_SAV_MT64x32x32_MI16x16x4x1_SN_1LDSB0_GRVW4_GSU7_LPB8_LRVW4_NEPBS2_NLCA1_PLR9_SPO1_TT2_16_WG32_8_1
    SolutionIndex: 123
    SolutionNameMin: Cijk_Ailk_Bljk_SB_SAV_MT192x48x16_MI16x16x4x1_SN_1LDSB0_GRVW1_GSU5_LPB2_LRVW2_NEPBS2_NLCA3_PLR5_SPO1_TT3_48_WG64_4_1
    SolutionIndex: 124
    SolutionNameMin: Cijk_Ailk_Bljk_SB_SAV_MT192x48x16_MI16x16x4x1_SN_1LDSB0_GRVW1_GSU2_LPB2_LRVW2_NEPBS2_NLCA3_PLR5_SPO1_TT3_48_WG64_4_1
    SolutionIndex: 125
    SolutionNameMin: Cijk_Ailk_Bljk_SB_SAV_MT64x32x16_MI16x16x4x1_SN_1LDSB0_GRVW2_GSU1_LPB2_LRVW2_NEPBS2_NLCA1_PLR5_SPO1_TT2_16_WG32_8_1
    SolutionIndex: 126
    SolutionNameMin: Cijk_Ailk_Bljk_SB_SAV_MT64x48x16_MI16x16x4x1_SN_1LDSB0_GRVW1_GSU1_LPB2_LRVW2_NEPBS2_NLCA1_PLR5_SPO1_TT1_48_WG64_4_1
- - - [1154, 101, 1, 144]
    - [118, 0.0]
  - - [1154, 101, 1, 176]
    - [118, 0.0]
  - - [1154, 101, 1, 212]
    - [12, 0.0]
  - - [1154, 107, 1, 1196]
    - [4, 0.0]
  - - [1154, 107, 1, 144]
    - [119, 0.0]
  - - [1154, 107, 1, 176]
    - [118, 0.0]
  - - [1154, 107, 1, 212]
    - [12, 0.0]
  - - [1154, 108, 1, 1196]
    - [5, 0.0]
  - - [1154, 108, 1, 144]
    - [118, 0.0]
  - - [1154, 108, 1, 176]
    - [119, 0.0]
  - - [1154, 108, 1, 212]
    - [12, 0.0]
  - - [1154, 112, 1, 1196]
    - [5, 0.0]
  - - [1154, 112, 1, 144]
    - [118, 0.0]
  - - [1154, 112, 1, 176]
    - [118, 0.0]
  - - [1154, 112, 1, 212]
    - [12, 0.0]
  - - [1154, 114, 1, 1196]
    - [15, 0.0]
  - - [1154, 114, 1, 144]
    - [118, 0.0]
  - - [1154, 114, 1, 176]
    - [118, 0.0]
  - - [1154, 114, 1, 212]
    - [12, 0.0]
  - - [1154, 115, 1, 1196]
    - [14, 0.0]
  - - [1154, 115, 1, 144]
    - [119, 0.0]
  - - [1154, 115, 1, 176]
    - [119, 0.0]
  - - [1154, 115, 1, 212]
    - [12, 0.0]
  - - [1154, 117, 1, 1196]
    - [15, 0.0]
  - - [1154, 117, 1, 144]
    - [118, 0.0]
  - - [1154, 117, 1, 176]
    - [118, 0.0]
  - - [1154, 117, 1, 212]
    - [12, 0.0]
  - - [1154, 118, 1, 1196]
    - [13, 0.0]
  - - [1154, 118, 1, 144]
    - [118, 0.0]
  - - [1154, 118, 1, 176]
    - [119, 0.0]
  - - [1154, 118, 1, 212]
    - [12, 0.0]
  - - [1154, 119, 1, 1196]
    - [15, 0.0]
  - - [1154, 119, 1, 144]
    - [118, 0.0]
  - - [1154, 119, 1, 176]
    - [119, 0.0]
  - - [1154, 119, 1, 212]
    - [12, 0.0]
  - - [1154, 120, 1, 1196]
    - [18, 0.0]
  - - [1154, 120, 1, 144]
    - [118, 0.0]
  - - [1154, 120, 1, 176]
    - [118, 0.0]
  - - [1154, 120, 1, 212]
    - [12, 0.0]
  - - [1154, 121, 1, 1196]
    - [16, 0.0]
  - - [1154, 121, 1, 144]
    - [118, 0.0]
  - - [1154, 121, 1, 176]
    - [118, 0.0]
  - - [1154, 121, 1, 212]
    - [12, 0.0]
  - - [1154, 122, 1, 1196]
    - [18, 0.0]
  - - [1154, 122, 1, 144]
    - [118, 0.0]
  - - [1154, 122, 1, 176]
    - [119, 0.0]
  - - [1154, 122, 1, 212]
    - [12, 0.0]
  - - [1154, 123, 1, 1196]
    - [17, 0.0]
  - - [1154, 123, 1, 144]
    - [118, 0.0]
  - - [1154, 123, 1, 176]
    - [118, 0.0]
  - - [1154, 123, 1, 212]
    - [12, 0.0]
  - - [1154, 124, 1, 1196]
    - [11, 0.0]
  - - [1154, 124, 1, 144]
    - [119, 0.0]
  - - [1154, 124, 1, 176]
    - [119, 0.0]
  - - [1154, 124, 1, 212]
    - [12, 0.0]
  - - [1154, 125, 1, 1196]
    - [11, 0.0]
  - - [1154, 125, 1, 144]
    - [118, 0.0]
  - - [1154, 125, 1, 176]
    - [118, 0.0]
  - - [1154, 125, 1, 212]
    - [12, 0.0]
  - - [1154, 126, 1, 1196]
    - [11, 0.0]
  - - [1154, 126, 1, 144]
    - [118, 0.0]
  - - [1154, 126, 1, 176]
    - [118, 0.0]
  - - [1154, 126, 1, 212]
    - [12, 0.0]
  - - [1154, 127, 1, 1196]
    - [18, 0.0]
  - - [1154, 127, 1, 144]
    - [119, 0.0]
  - - [1154, 127, 1, 176]
    - [119, 0.0]
  - - [1154, 127, 1, 212]
    - [12, 0.0]
  - - [1154, 12, 1, 1196]
    - [10, 0.0]
  - - [1154, 12, 1, 144]
    - [1, 0.0]
  - - [1154, 12, 1, 176]
    - [1, 0.0]
  - - [1154, 12, 1, 212]
    - [0, 0.0]
  - - [1154, 136, 1, 1196]
    - [2, 0.0]
  - - [1154, 136, 1, 144]
    - [126, 0.0]
  - - [1154, 136, 1, 176]
    - [126, 0.0]
  - - [1154, 136, 1, 212]
    - [126, 0.0]
  - - [1154, 138, 1, 1196]
    - [2, 0.0]
  - - [1154, 138, 1, 144]
    - [126, 0.0]
  - - [1154, 138, 1, 176]
    - [126, 0.0]
  - - [1154, 138, 1, 212]
    - [126, 0.0]
  - - [1154, 139, 1, 1196]
    - [3, 0.0]
  - - [1154, 139, 1, 144]
    - [126, 0.0]
  - - [1154, 139, 1, 176]
    - [126, 0.0]
  - - [1154, 139, 1, 212]
    - [126, 0.0]
  - - [1154, 141, 1, 1196]
    - [2, 0.0]
  - - [1154, 141, 1, 144]
    - [126, 0.0]
  - - [1154, 141, 1, 176]
    - [126, 0.0]
  - - [1154, 141, 1, 212]
    - [126, 0.0]
  - - [1154, 142, 1, 1196]
    - [2, 0.0]
  - - [1154, 142, 1, 144]
    - [126, 0.0]
  - - [1154, 142, 1, 176]
    - [126, 0.0]
  - - [1154, 142, 1, 212]
    - [126, 0.0]
  - - [1154, 145, 1, 1196]
    - [6, 0.0]
  - - [1154, 145, 1, 144]
    - [120, 0.0]
  - - [1154, 145, 1, 176]
    - [120, 0.0]
  - - [1154, 145, 1, 212]
    - [8, 0.0]
  - - [1154, 147, 1, 1196]
    - [9, 0.0]
  - - [1154, 147, 1, 144]
    - [121, 0.0]
  - - [1154, 147, 1, 176]
    - [121, 0.0]
  - - [1154, 147, 1, 212]
    - [7, 0.0]
  - - [1154, 149, 1, 1196]
    - [9, 0.0]
  - - [1154, 149, 1, 144]
    - [120, 0.0]
  - - [1154, 149, 1, 176]
    - [121, 0.0]
  - - [1154, 149, 1, 212]
    - [9, 0.0]
  - - [1154, 150, 1, 1196]
    - [9, 0.0]
  - - [1154, 150, 1, 144]
    - [121, 0.0]
  - - [1154, 150, 1, 176]
    - [121, 0.0]
  - - [1154, 150, 1, 212]
    - [8, 0.0]
  - - [1154, 151, 1, 1196]
    - [8, 0.0]
  - - [1154, 151, 1, 144]
    - [121, 0.0]
  - - [1154, 151, 1, 176]
    - [121, 0.0]
  - - [1154, 151, 1, 212]
    - [8, 0.0]
  - - [1154, 152, 1, 1196]
    - [8, 0.0]
  - - [1154, 152, 1, 144]
    - [121, 0.0]
  - - [1154, 152, 1, 176]
    - [121, 0.0]
  - - [1154, 152, 1, 212]
    - [9, 0.0]
  - - [1154, 153, 1, 1196]
    - [7, 0.0]
  - - [1154, 153, 1, 144]
    - [121, 0.0]
  - - [1154, 153, 1, 176]
    - [121, 0.0]
  - - [1154, 153, 1, 212]
    - [9, 0.0]
  - - [1154, 154, 1, 1196]
    - [7, 0.0]
  - - [1154, 154, 1, 144]
    - [121, 0.0]
  - - [1154, 154, 1, 176]
    - [121, 0.0]
  - - [1154, 154, 1, 212]
    - [9, 0.0]
  - - [1154, 156, 1, 1196]
    - [9, 0.0]
  - - [1154, 156, 1, 144]
    - [121, 0.0]
  - - [1154, 156, 1, 176]
    - [120, 0.0]
  - - [1154, 156, 1, 212]
    - [9, 0.0]
  - - [1154, 157, 1, 1196]
    - [7, 0.0]
  - - [1154, 157, 1, 144]
    - [121, 0.0]
  - - [1154, 157, 1, 176]
    - [121, 0.0]
  - - [1154, 157, 1, 212]
    - [9, 0.0]
  - - [1154, 160, 1, 1196]
    - [8, 0.0]
  - - [1154, 160, 1, 144]
    - [120, 0.0]
  - - [1154, 160, 1, 176]
    - [120, 0.0]
  - - [1154, 160, 1, 212]
    - [7, 0.0]
  - - [1154, 161, 1, 1196]
    - [19, 0.0]
  - - [1154, 161, 1, 144]
    - [118, 0.0]
  - - [1154, 161, 1, 176]
    - [119, 0.0]
  - - [1154, 161, 1, 212]
    - [12, 0.0]
  - - [1154, 163, 1, 1196]
    - [19, 0.0]
  - - [1154, 163, 1, 144]
    - [118, 0.0]
  - - [1154, 163, 1, 176]
    - [118, 0.0]
  - - [1154, 163, 1, 212]
    - [12, 0.0]
  - - [1154, 164, 1, 1196]
    - [21, 0.0]
  - - [1154, 164, 1, 144]
    - [119, 0.0]
  - - [1154, 164, 1, 176]
    - [118, 0.0]
  - - [1154, 164, 1, 212]
    - [12, 0.0]
  - - [1154, 165, 1, 1196]
    - [21, 0.0]
  - - [1154, 165, 1, 144]
    - [119, 0.0]
  - - [1154, 165, 1, 176]
    - [119, 0.0]
  - - [1154, 165, 1, 212]
    - [12, 0.0]
  - - [1154, 166, 1, 1196]
    - [19, 0.0]
  - - [1154, 166, 1, 144]
    - [118, 0.0]
  - - [1154, 166, 1, 176]
    - [118, 0.0]
  - - [1154, 166, 1, 212]
    - [12, 0.0]
  - - [1154, 167, 1, 1196]
    - [21, 0.0]
  - - [1154, 167, 1, 144]
    - [119, 0.0]
  - - [1154, 167, 1, 176]
    - [118, 0.0]
  - - [1154, 167, 1, 212]
    - [12, 0.0]
  - - [1154, 172, 1, 1196]
    - [23, 0.0]
  - - [1154, 172, 1, 144]
    - [119, 0.0]
  - - [1154, 172, 1, 176]
    - [118, 0.0]
  - - [1154, 172, 1, 212]
    - [12, 0.0]
  - - [1154, 173, 1, 1196]
    - [21, 0.0]
  - - [1154, 173, 1, 144]
    - [119, 0.0]
  - - [1154, 173, 1, 176]
    - [119, 0.0]
  - - [1154, 173, 1, 212]
    - [12, 0.0]
  - - [1154, 1, 1, 2048]
    - [117, 0.0]
  - - [1154, 1, 1, 2460]
    - [10, 0.0]
  - - [1154, 1, 1, 512]
    - [24, 0.0]
  - - [1154, 25, 1, 144]
    - [26, 0.0]
  - - [1154, 25, 1, 176]
    - [27, 0.0]
  - - [1154, 25, 1, 212]
    - [27, 0.0]
  - - [1154, 27, 1, 1196]
    - [25, 0.0]
  - - [1154, 27, 1, 144]
    - [27, 0.0]
  - - [1154, 27, 1, 176]
    - [27, 0.0]
  - - [1154, 27, 1, 212]
    - [27, 0.0]
  - - [1154, 2, 1, 1196]
    - [10, 0.0]
  - - [1154, 2, 1, 144]
    - [28, 0.0]
  - - [1154, 2, 1, 176]
    - [0, 0.0]
  - - [1154, 2, 1, 212]
    - [29, 0.0]
  - - [1154, 38, 1, 1196]
    - [30, 0.0]
  - - [1154, 38, 1, 144]
    - [27, 0.0]
  - - [1154, 38, 1, 176]
    - [30, 0.0]
  - - [1154, 38, 1, 212]
    - [31, 0.0]
  - - [1154, 40, 1, 1196]
    - [31, 0.0]
  - - [1154, 40, 1, 144]
    - [27, 0.0]
  - - [1154, 40, 1, 176]
    - [30, 0.0]
  - - [1154, 40, 1, 212]
    - [30, 0.0]
  - - [1154, 43, 1, 1196]
    - [30, 0.0]
  - - [1154, 43, 1, 144]
    - [27, 0.0]
  - - [1154, 43, 1, 176]
    - [31, 0.0]
  - - [1154, 43, 1, 212]
    - [31, 0.0]
  - - [1154, 88, 1, 1196]
    - [32, 0.0]
  - - [1154, 88, 1, 144]
    - [125, 0.0]
  - - [1154, 88, 1, 176]
    - [125, 0.0]
  - - [1154, 88, 1, 212]
    - [33, 0.0]
  - - [1154, 89, 1, 1196]
    - [20, 0.0]
  - - [1154, 89, 1, 144]
    - [125, 0.0]
  - - [1154, 89, 1, 176]
    - [125, 0.0]
  - - [1154, 89, 1, 212]
    - [33, 0.0]
  - - [1154, 92, 1, 1196]
    - [34, 0.0]
  - - [1154, 92, 1, 144]
    - [125, 0.0]
  - - [1154, 92, 1, 176]
    - [125, 0.0]
  - - [1154, 92, 1, 212]
    - [33, 0.0]
  - - [1154, 93, 1, 1196]
    - [35, 0.0]
  - - [1154, 93, 1, 144]
    - [125, 0.0]
  - - [1154, 93, 1, 176]
    - [125, 0.0]
  - - [1154, 93, 1, 212]
    - [33, 0.0]
  - - [664, 101, 1, 684]
    - [36, 0.0]
  - - [664, 107, 1, 684]
    - [37, 0.0]
  - - [664, 108, 1, 684]
    - [36, 0.0]
  - - [664, 112, 1, 684]
    - [37, 0.0]
  - - [664, 114, 1, 684]
    - [37, 0.0]
  - - [664, 115, 1, 684]
    - [36, 0.0]
  - - [664, 117, 1, 684]
    - [36, 0.0]
  - - [664, 118, 1, 684]
    - [38, 0.0]
  - - [664, 119, 1, 684]
    - [37, 0.0]
  - - [664, 120, 1, 684]
    - [36, 0.0]
  - - [664, 121, 1, 684]
    - [36, 0.0]
  - - [664, 122, 1, 684]
    - [37, 0.0]
  - - [664, 123, 1, 684]
    - [38, 0.0]
  - - [664, 124, 1, 684]
    - [37, 0.0]
  - - [664, 125, 1, 684]
    - [37, 0.0]
  - - [664, 126, 1, 684]
    - [37, 0.0]
  - - [664, 127, 1, 684]
    - [38, 0.0]
  - - [664, 12, 1, 684]
    - [10, 0.0]
  - - [664, 136, 1, 684]
    - [32, 0.0]
  - - [664, 138, 1, 684]
    - [32, 0.0]
  - - [664, 139, 1, 684]
    - [32, 0.0]
  - - [664, 141, 1, 684]
    - [34, 0.0]
  - - [664, 142, 1, 684]
    - [32, 0.0]
  - - [664, 145, 1, 684]
    - [39, 0.0]
  - - [664, 147, 1, 684]
    - [39, 0.0]
  - - [664, 149, 1, 684]
    - [39, 0.0]
  - - [664, 150, 1, 684]
    - [39, 0.0]
  - - [664, 151, 1, 684]
    - [40, 0.0]
  - - [664, 152, 1, 684]
    - [39, 0.0]
  - - [664, 153, 1, 684]
    - [40, 0.0]
  - - [664, 154, 1, 684]
    - [39, 0.0]
  - - [664, 156, 1, 684]
    - [39, 0.0]
  - - [664, 157, 1, 684]
    - [41, 0.0]
  - - [664, 160, 1, 684]
    - [40, 0.0]
  - - [664, 161, 1, 684]
    - [42, 0.0]
  - - [664, 163, 1, 684]
    - [42, 0.0]
  - - [664, 164, 1, 684]
    - [42, 0.0]
  - - [664, 165, 1, 684]
    - [43, 0.0]
  - - [664, 166, 1, 684]
    - [42, 0.0]
  - - [664, 167, 1, 684]
    - [42, 0.0]
  - - [664, 172, 1, 684]
    - [42, 0.0]
  - - [664, 173, 1, 684]
    - [42, 0.0]
  - - [664, 25, 1, 684]
    - [44, 0.0]
  - - [664, 27, 1, 684]
    - [44, 0.0]
  - - [664, 2, 1, 684]
    - [10, 0.0]
  - - [664, 38, 1, 684]
    - [45, 0.0]
  - - [664, 40, 1, 684]
    - [45, 0.0]
  - - [664, 43, 1, 684]
    - [45, 0.0]
  - - [664, 88, 1, 684]
    - [46, 0.0]
  - - [664, 89, 1, 684]
    - [46, 0.0]
  - - [664, 92, 1, 684]
    - [47, 0.0]
  - - [664, 93, 1, 684]
    - [46, 0.0]
  - - [684, 101, 1, 936]
    - [38, 0.0]
  - - [684, 107, 1, 936]
    - [38, 0.0]
  - - [684, 108, 1, 936]
    - [37, 0.0]
  - - [684, 112, 1, 936]
    - [37, 0.0]
  - - [684, 114, 1, 936]
    - [36, 0.0]
  - - [684, 115, 1, 936]
    - [37, 0.0]
  - - [684, 117, 1, 936]
    - [36, 0.0]
  - - [684, 118, 1, 936]
    - [38, 0.0]
  - - [684, 119, 1, 936]
    - [38, 0.0]
  - - [684, 120, 1, 936]
    - [37, 0.0]
  - - [684, 121, 1, 936]
    - [37, 0.0]
  - - [684, 122, 1, 936]
    - [37, 0.0]
  - - [684, 123, 1, 936]
    - [37, 0.0]
  - - [684, 124, 1, 936]
    - [37, 0.0]
  - - [684, 125, 1, 936]
    - [37, 0.0]
  - - [684, 126, 1, 936]
    - [36, 0.0]
  - - [684, 127, 1, 936]
    - [38, 0.0]
  - - [684, 12, 1, 936]
    - [48, 0.0]
  - - [684, 136, 1, 936]
    - [32, 0.0]
  - - [684, 138, 1, 936]
    - [32, 0.0]
  - - [684, 139, 1, 936]
    - [32, 0.0]
  - - [684, 141, 1, 936]
    - [35, 0.0]
  - - [684, 142, 1, 936]
    - [32, 0.0]
  - - [684, 145, 1, 936]
    - [40, 0.0]
  - - [684, 147, 1, 936]
    - [40, 0.0]
  - - [684, 149, 1, 936]
    - [40, 0.0]
  - - [684, 150, 1, 936]
    - [40, 0.0]
  - - [684, 151, 1, 936]
    - [40, 0.0]
  - - [684, 152, 1, 936]
    - [40, 0.0]
  - - [684, 153, 1, 936]
    - [40, 0.0]
  - - [684, 154, 1, 936]
    - [40, 0.0]
  - - [684, 156, 1, 936]
    - [49, 0.0]
  - - [684, 157, 1, 936]
    - [40, 0.0]
  - - [684, 160, 1, 936]
    - [50, 0.0]
  - - [684, 161, 1, 936]
    - [51, 0.0]
  - - [684, 163, 1, 936]
    - [52, 0.0]
  - - [684, 164, 1, 936]
    - [52, 0.0]
  - - [684, 165, 1, 936]
    - [52, 0.0]
  - - [684, 166, 1, 936]
    - [52, 0.0]
  - - [684, 167, 1, 936]
    - [52, 0.0]
  - - [684, 172, 1, 936]
    - [52, 0.0]
  - - [684, 173, 1, 936]
    - [52, 0.0]
  - - [684, 25, 1, 936]
    - [53, 0.0]
  - - [684, 27, 1, 936]
    - [54, 0.0]
  - - [684, 2, 1, 936]
    - [55, 0.0]
  - - [684, 38, 1, 936]
    - [123, 0.0]
  - - [684, 40, 1, 936]
    - [123, 0.0]
  - - [684, 43, 1, 936]
    - [123, 0.0]
  - - [684, 88, 1, 936]
    - [46, 0.0]
  - - [684, 89, 1, 936]
    - [46, 0.0]
  - - [684, 92, 1, 936]
    - [46, 0.0]
  - - [684, 93, 1, 936]
    - [56, 0.0]
  - - [88, 101, 1, 664]
    - [57, 0.0]
  - - [88, 107, 1, 664]
    - [57, 0.0]
  - - [88, 108, 1, 664]
    - [58, 0.0]
  - - [88, 112, 1, 664]
    - [58, 0.0]
  - - [88, 114, 1, 664]
    - [58, 0.0]
  - - [88, 115, 1, 664]
    - [58, 0.0]
  - - [88, 117, 1, 664]
    - [57, 0.0]
  - - [88, 118, 1, 664]
    - [57, 0.0]
  - - [88, 119, 1, 664]
    - [110, 0.0]
  - - [88, 120, 1, 664]
    - [58, 0.0]
  - - [88, 121, 1, 664]
    - [57, 0.0]
  - - [88, 122, 1, 664]
    - [58, 0.0]
  - - [88, 123, 1, 664]
    - [58, 0.0]
  - - [88, 124, 1, 664]
    - [58, 0.0]
  - - [88, 125, 1, 664]
    - [110, 0.0]
  - - [88, 126, 1, 664]
    - [57, 0.0]
  - - [88, 127, 1, 664]
    - [58, 0.0]
  - - [88, 12, 1, 664]
    - [108, 0.0]
  - - [88, 136, 1, 664]
    - [24, 0.0]
  - - [88, 138, 1, 664]
    - [24, 0.0]
  - - [88, 139, 1, 664]
    - [59, 0.0]
  - - [88, 141, 1, 664]
    - [24, 0.0]
  - - [88, 142, 1, 664]
    - [24, 0.0]
  - - [88, 145, 1, 664]
    - [24, 0.0]
  - - [88, 147, 1, 664]
    - [24, 0.0]
  - - [88, 149, 1, 664]
    - [59, 0.0]
  - - [88, 150, 1, 664]
    - [24, 0.0]
  - - [88, 151, 1, 664]
    - [24, 0.0]
  - - [88, 152, 1, 664]
    - [24, 0.0]
  - - [88, 153, 1, 664]
    - [24, 0.0]
  - - [88, 154, 1, 664]
    - [24, 0.0]
  - - [88, 156, 1, 664]
    - [24, 0.0]
  - - [88, 157, 1, 664]
    - [24, 0.0]
  - - [88, 160, 1, 664]
    - [24, 0.0]
  - - [88, 161, 1, 664]
    - [24, 0.0]
  - - [88, 163, 1, 664]
    - [24, 0.0]
  - - [88, 164, 1, 664]
    - [24, 0.0]
  - - [88, 165, 1, 664]
    - [24, 0.0]
  - - [88, 166, 1, 664]
    - [24, 0.0]
  - - [88, 167, 1, 664]
    - [24, 0.0]
  - - [88, 172, 1, 664]
    - [24, 0.0]
  - - [88, 173, 1, 664]
    - [59, 0.0]
  - - [88, 25, 1, 664]
    - [60, 0.0]
  - - [88, 2, 1, 664]
    - [107, 0.0]
  - - [88, 38, 1, 664]
    - [62, 0.0]
  - - [88, 40, 1, 664]
    - [62, 0.0]
  - - [88, 43, 1, 664]
    - [61, 0.0]
  - - [88, 88, 1, 664]
    - [109, 0.0]
  - - [88, 89, 1, 664]
    - [109, 0.0]
  - - [88, 92, 1, 664]
    - [109, 0.0]
  - - [88, 93, 1, 664]
    - [109, 0.0]
  - - [936, 101, 1, 1154]
    - [63, 0.0]
  - - [936, 107, 1, 1154]
    - [63, 0.0]
  - - [936, 108, 1, 1154]
    - [64, 0.0]
  - - [936, 112, 1, 1154]
    - [63, 0.0]
  - - [936, 114, 1, 1154]
    - [65, 0.0]
  - - [936, 115, 1, 1154]
    - [63, 0.0]
  - - [936, 117, 1, 1154]
    - [66, 0.0]
  - - [936, 118, 1, 1154]
    - [65, 0.0]
  - - [936, 119, 1, 1154]
    - [65, 0.0]
  - - [936, 120, 1, 1154]
    - [64, 0.0]
  - - [936, 121, 1, 1154]
    - [65, 0.0]
  - - [936, 122, 1, 1154]
    - [64, 0.0]
  - - [936, 123, 1, 1154]
    - [63, 0.0]
  - - [936, 124, 1, 1154]
    - [22, 0.0]
  - - [936, 125, 1, 1154]
    - [64, 0.0]
  - - [936, 126, 1, 1154]
    - [64, 0.0]
  - - [936, 127, 1, 1154]
    - [67, 0.0]
  - - [936, 12, 1, 1154]
    - [68, 0.0]
  - - [936, 136, 1, 1154]
    - [69, 0.0]
  - - [936, 138, 1, 1154]
    - [69, 0.0]
  - - [936, 139, 1, 1154]
    - [69, 0.0]
  - - [936, 141, 1, 1154]
    - [69, 0.0]
  - - [936, 142, 1, 1154]
    - [46, 0.0]
  - - [936, 145, 1, 1154]
    - [69, 0.0]
  - - [936, 147, 1, 1154]
    - [69, 0.0]
  - - [936, 149, 1, 1154]
    - [46, 0.0]
  - - [936, 150, 1, 1154]
    - [46, 0.0]
  - - [936, 151, 1, 1154]
    - [46, 0.0]
  - - [936, 152, 1, 1154]
    - [70, 0.0]
  - - [936, 153, 1, 1154]
    - [46, 0.0]
  - - [936, 154, 1, 1154]
    - [46, 0.0]
  - - [936, 156, 1, 1154]
    - [46, 0.0]
  - - [936, 157, 1, 1154]
    - [46, 0.0]
  - - [936, 160, 1, 1154]
    - [69, 0.0]
  - - [936, 161, 1, 1154]
    - [71, 0.0]
  - - [936, 163, 1, 1154]
    - [72, 0.0]
  - - [936, 164, 1, 1154]
    - [73, 0.0]
  - - [936, 165, 1, 1154]
    - [73, 0.0]
  - - [936, 166, 1, 1154]
    - [74, 0.0]
  - - [936, 167, 1, 1154]
    - [75, 0.0]
  - - [936, 172, 1, 1154]
    - [73, 0.0]
  - - [936, 173, 1, 1154]
    - [71, 0.0]
  - - [936, 25, 1, 1154]
    - [76, 0.0]
  - - [936, 27, 1, 1154]
    - [76, 0.0]
  - - [936, 2, 1, 1154]
    - [115, 0.0]
  - - [936, 38, 1, 1154]
    - [116, 0.0]
  - - [936, 40, 1, 1154]
    - [116, 0.0]
  - - [936, 43, 1, 1154]
    - [116, 0.0]
  - - [936, 88, 1, 1154]
    - [77, 0.0]
  - - [936, 89, 1, 1154]
    - [77, 0.0]
  - - [936, 92, 1, 1154]
    - [124, 0.0]
  - - [936, 93, 1, 1154]
    - [77, 0.0]
  - - [14, 1024, 1, 32]
    - [78, 0.0]
  - - [14, 160, 1, 32]
    - [79, 0.0]
  - - [14, 200, 1, 32]
    - [78, 0.0]
  - - [14, 256, 1, 32]
    - [78, 0.0]
  - - [14, 32, 1, 32]
    - [78, 0.0]
  - - [14, 512, 1, 32]
    - [106, 0.0]
  - - [256, 1024, 1, 1236]
    - [113, 0.0]
  - - [256, 160, 1, 1236]
    - [80, 0.0]
  - - [256, 200, 1, 1236]
    - [81, 0.0]
  - - [256, 256, 1, 1236]
    - [112, 0.0]
  - - [256, 32, 1, 1236]
    - [122, 0.0]
  - - [256, 512, 1, 1236]
    - [4, 0.0]
  - - [2, 1024, 1, 16]
    - [79, 0.0]
  - - [2, 160, 1, 16]
    - [78, 0.0]
  - - [2, 200, 1, 16]
    - [79, 0.0]
  - - [2, 256, 1, 16]
    - [78, 0.0]
  - - [2, 32, 1, 16]
    - [78, 0.0]
  - - [2, 512, 1, 16]
    - [79, 0.0]
  - - [64, 1024, 1, 192]
    - [82, 0.0]
  - - [64, 160, 1, 192]
    - [24, 0.0]
  - - [64, 200, 1, 192]
    - [83, 0.0]
  - - [64, 256, 1, 192]
    - [83, 0.0]
  - - [64, 32, 1, 192]
    - [24, 0.0]
  - - [64, 512, 1, 192]
    - [80, 0.0]
  - - [128, 800, 1, 256]
    - [84, 0.0]
  - - [19, 1024, 1, 58]
    - [85, 0.0]
  - - [19, 160, 1, 58]
    - [106, 0.0]
  - - [19, 200, 1, 58]
    - [86, 0.0]
  - - [19, 256, 1, 58]
    - [86, 0.0]
  - - [19, 512, 1, 58]
    - [86, 0.0]
  - - [19, 800, 1, 58]
    - [85, 0.0]
  - - [256, 1024, 1, 512]
    - [87, 0.0]
  - - [256, 160, 1, 512]
    - [80, 0.0]
  - - [256, 200, 1, 512]
    - [88, 0.0]
  - - [256, 256, 1, 512]
    - [82, 0.0]
  - - [256, 32, 1, 512]
    - [111, 0.0]
  - - [256, 512, 1, 512]
    - [4, 0.0]
  - - [256, 800, 1, 512]
    - [6, 0.0]
  - - [2, 1024, 1, 32]
    - [89, 0.0]
  - - [2, 160, 1, 32]
    - [78, 0.0]
  - - [2, 200, 1, 32]
    - [78, 0.0]
  - - [2, 256, 1, 32]
    - [105, 0.0]
  - - [2, 32, 1, 32]
    - [78, 0.0]
  - - [2, 512, 1, 32]
    - [78, 0.0]
  - - [2, 800, 1, 32]
    - [79, 0.0]
  - - [32, 800, 1, 64]
    - [90, 0.0]
  - - [512, 1024, 1, 928]
    - [91, 0.0]
  - - [512, 160, 1, 928]
    - [46, 0.0]
  - - [512, 200, 1, 928]
    - [92, 0.0]
  - - [512, 256, 1, 928]
    - [42, 0.0]
  - - [512, 32, 1, 928]
    - [114, 0.0]
  - - [512, 512, 1, 928]
    - [93, 0.0]
  - - [512, 800, 1, 928]
    - [94, 0.0]
  - - [58, 1024, 1, 19]
    - [95, 0.0]
  - - [58, 160, 1, 19]
    - [0, 0.0]
  - - [58, 200, 1, 19]
    - [96, 0.0]
  - - [58, 256, 1, 19]
    - [96, 0.0]
  - - [58, 32, 1, 19]
    - [78, 0.0]
  - - [58, 512, 1, 19]
    - [95, 0.0]
  - - [58, 800, 1, 19]
    - [97, 0.0]
  - - [64, 800, 1, 128]
    - [98, 0.0]
  - - [128, 1, 1, 256]
    - [102, 0.0]
  - - [16, 79, 1, 16]
    - [79, 0.0]
  - - [256, 1, 1, 512]
    - [103, 0.0]
  - - [26, 1, 1, 79]
    - [78, 0.0]
  - - [32, 150, 1, 96]
    - [86, 0.0]
  - - [32, 1, 1, 96]
    - [90, 0.0]
  - - [512, 1, 1, 1264]
    - [104, 0.0]
  - - [64, 1, 1, 128]
    - [99, 0.0]
  - - [79, 1, 1, 26]
    - [78, 0.0]
  - - [96, 1, 1, 208]
    - [86, 0.0]
  - - [128, 1024, 1, 256]
    - [46, 0.0]
  - - [128, 160, 1, 256]
    - [83, 0.0]
  - - [128, 200, 1, 256]
    - [80, 0.0]
  - - [128, 256, 1, 256]
    - [80, 0.0]
  - - [128, 32, 1, 256]
    - [24, 0.0]
  - - [128, 512, 1, 256]
    - [46, 0.0]
  - - [32, 1024, 1, 64]
    - [100, 0.0]
  - - [32, 160, 1, 64]
    - [101, 0.0]
  - - [32, 200, 1, 64]
    - [86, 0.0]
  - - [32, 256, 1, 64]
    - [101, 0.0]
  - - [32, 32, 1, 64]
    - [101, 0.0]
  - - [32, 512, 1, 64]
    - [101, 0.0]
  - - [64, 1024, 1, 128]
    - [82, 0.0]
  - - [64, 160, 1, 128]
    - [24, 0.0]
  - - [64, 200, 1, 128]
    - [101, 0.0]
  - - [64, 256, 1, 128]
    - [83, 0.0]
  - - [64, 32, 1, 128]
    - [24, 0.0]
  - - [64, 512, 1, 128]
    - [25, 0.0]
- null
- null
- DeviceEfficiency
- Equality
