library/src/amd_detail/rocblaslt/src/Tensile/Logic/asm_full/gfx1200/GridBased/gfx1200_Cijk_Alik_Bjlk_F8BS_BH_BiasSHB_HAS_SAB_SAV_UserArgs.yaml
- {MinimumRequiredVersion: 4.33.0}
- gfx1200
- gfx1200
- [Device 73f0]
    SolutionIndex: 0
    SolutionNameMin: Cijk_Alik_Bjlk_F8BS_BH_BiasSHB_HAS_SAB_SAV_UserArgs_MT32x32x32_MI16x16x1_SN_CLR0_GSU1_LBSPPA256_LBSPPB256_LPA16_MIWT1_1_PGR1_PLR0_SS1_SU32_SUM0_SUS256_SVW1_TLDS0_WG32_4_1_WGM8
    SolutionIndex: 1
    SolutionNameMin: Cijk_Alik_Bjlk_F8BS_BH_BiasSHB_HAS_SAB_SAV_UserArgs_MT32x32x32_MI16x16x1_SN_CLR0_GSU1_LBSPPA256_LBSPPB256_LPA16_MIWT1_1_PGR2_PLR0_SS1_SU32_SUM0_SUS256_SVW1_TLDS0_WG32_4_1_WGM8
    SolutionIndex: 2
    SolutionNameMin: Cijk_Alik_Bjlk_F8BS_BH_BiasSHB_HAS_SAB_SAV_UserArgs_MT16x64x32_MI16x16x1_SN_CLR0_GSU1_LBSPPA128_LBSPPB512_LPA16_MIWT1_1_PGR2_PLR0_SS1_SU32_SUM0_SUS256_SVW1_TLDS0_WG16_8_1_WGM8
    SolutionIndex: 3
    SolutionNameMin: Cijk_Alik_Bjlk_F8BS_BH_BiasSHB_HAS_SAB_SAV_UserArgs_MT32x32x64_MI16x16x1_SN_CLR1_GSU1_LBSPPA128_LBSPPB256_LPA8_MIWT1_1_PGR2_PLR1_SS1_SU32_SUM0_SUS256_SVW1_TLDS1_WG32_4_1_WGM8
    SolutionIndex: 4
    SolutionNameMin: Cijk_Alik_Bjlk_F8BS_BH_BiasSHB_HAS_SAB_SAV_UserArgs_MT128x16x64_MI16x16x1_SN_LDSB0_CLR0_GRVWA8_GRVWB8_GSU1_LBSPPA128_LBSPPB128_LPA8_MIWT2_1_PGR1_PLR0_SS0_SU32_SUM0_SUS256_SVW8_TLDS1_WG64_2_1_WGM8
    SolutionIndex: 5
    SolutionNameMin: Cijk_Alik_Bjlk_F8BS_BH_BiasSHB_HAS_SAB_SAV_UserArgs_MT256x16x64_MI16x16x1_SN_LDSB1_CLR1_GRVWA8_GRVWB8_GSU1_LBSPPA128_LBSPPB128_LPA8_MIWT4_1_PGR1_PLR3_SS0_SU32_SUM0_SUS256_SVW8_TLDS1_WG64_2_1_WGM8
    SolutionIndex: 6
    SolutionNameMin: Cijk_Alik_Bjlk_F8BS_BH_BiasSHB_HAS_SAB_SAV_UserArgs_MT256x16x64_MI16x16x1_SN_LDSB1_CLR1_GRVWA8_GRVWB8_GSU1_LBSPPA128_LBSPPB128_LPA8_MIWT4_1_PGR1_PLR1_SS0_SU32_SUM0_SUS256_SVW8_TLDS1_WG64_2_1_WGM8
    SolutionIndex: 7
    SolutionNameMin: Cijk_Alik_Bjlk_F8BS_BH_BiasSHB_HAS_SAB_SAV_UserArgs_MT256x16x64_MI16x16x1_SN_LDSB1_CLR1_GRVWA8_GRVWB8_GSU1_LBSPPA128_LBSPPB128_LPA8_MIWT4_1_PGR2_PLR1_SS0_SU32_SUM0_SUS256_SVW8_TLDS1_WG64_2_1_WGM8
    SolutionIndex: 8
    SolutionNameMin: Cijk_Alik_Bjlk_F8BS_BH_BiasSHB_HAS_SAB_SAV_UserArgs_MT256x16x64_MI16x16x1_SN_LDSB1_CLR1_GRVWA8_GRVWB8_GSU1_LBSPPA128_LBSPPB128_LPA8_MIWT4_1_PGR2_PLR3_SS0_SU32_SUM0_SUS256_SVW8_TLDS1_WG64_2_1_WGM8
    SolutionIndex: 9
    SolutionNameMin: Cijk_Alik_Bjlk_F8BS_BH_BiasSHB_HAS_SAB_SAV_UserArgs_MT64x32x64_MI16x16x1_SN_LDSB0_CLR0_GRVWA8_GRVWB16_GSU1_LBSPPA128_LBSPPB256_LPA8_MIWT2_1_PGR1_PLR0_SS1_SU32_SUM0_SUS256_SVW1_TLDS1_WG32_4_1_WGM8
    SolutionIndex: 10
    SolutionNameMin: Cijk_Alik_Bjlk_F8BS_BH_BiasSHB_HAS_SAB_SAV_UserArgs_MT32x64x64_MI16x16x1_SN_LDSB0_CLR1_GRVWA8_GRVWB16_GSU1_LBSPPA128_LBSPPB512_LPA8_MIWT2_1_PGR2_PLR1_SS0_SU32_SUM0_SUS256_SVW8_TLDS1_WG16_8_1_WGM8
    SolutionIndex: 11
    SolutionNameMin: Cijk_Alik_Bjlk_F8BS_BH_BiasSHB_HAS_SAB_SAV_UserArgs_MT32x64x32_MI16x16x1_SN_LDSB0_CLR1_GRVWA8_GRVWB16_GSU1_LBSPPA128_LBSPPB512_LPA8_MIWT2_1_PGR2_PLR1_SS0_SU32_SUM0_SUS256_SVW8_TLDS1_WG16_8_1_WGM8
    SolutionIndex: 12
    SolutionNameMin: Cijk_Alik_Bjlk_F8BS_BH_BiasSHB_HAS_SAB_SAV_UserArgs_MT32x64x32_MI16x16x1_SN_LDSB0_CLR1_GRVWA8_GRVWB16_GSU1_LBSPPA128_LBSPPB512_LPA8_MIWT2_1_PGR1_PLR1_SS0_SU32_SUM0_SUS256_SVW8_TLDS1_WG16_8_1_WGM8
    SolutionIndex: 13
    SolutionNameMin: Cijk_Alik_Bjlk_F8BS_BH_BiasSHB_HAS_SAB_SAV_UserArgs_MT32x64x64_MI16x16x1_SN_LDSB0_CLR1_GRVWA8_GRVWB16_GSU1_LBSPPA128_LBSPPB512_LPA8_MIWT2_1_PGR1_PLR1_SS0_SU32_SUM0_SUS256_SVW8_TLDS1_WG16_8_1_WGM8
    SolutionIndex: 14
    SolutionNameMin: Cijk_Alik_Bjlk_F8BS_BH_BiasSHB_HAS_SAB_SAV_UserArgs_MT32x64x64_MI16x16x1_SN_LDSB0_CLR1_GRVWA8_GRVWB16_GSU1_LBSPPA128_LBSPPB512_LPA8_MIWT2_1_PGR1_PLR3_SS0_SU32_SUM0_SUS256_SVW8_TLDS1_WG16_8_1_WGM8
    SolutionIndex: 15
    SolutionNameMin: Cijk_Alik_Bjlk_F8BS_BH_BiasSHB_HAS_SAB_SAV_UserArgs_MT32x64x64_MI16x16x1_SN_LDSB0_CLR0_GRVWA8_GRVWB16_GSU1_LBSPPA128_LBSPPB512_LPA8_MIWT2_1_PGR1_PLR0_SS0_SU32_SUM0_SUS256_SVW8_TLDS1_WG16_8_1_WGM8
    SolutionIndex: 16
    SolutionNameMin: Cijk_Alik_Bjlk_F8BS_BH_BiasSHB_HAS_SAB_SAV_UserArgs_MT32x64x64_MI16x16x1_SN_LDSB0_CLR1_GRVWA8_GRVWB16_GSU1_LBSPPA128_LBSPPB512_LPA8_MIWT2_1_PGR1_PLR3_SS1_SU32_SUM0_SUS256_SVW1_TLDS1_WG16_8_1_WGM8
    SolutionIndex: 17
    SolutionNameMin: Cijk_Alik_Bjlk_F8BS_BH_BiasSHB_HAS_SAB_SAV_UserArgs_MT32x64x64_MI16x16x1_SN_LDSB0_CLR0_GRVWA8_GRVWB16_GSU1_LBSPPA128_LBSPPB512_LPA8_MIWT2_1_PGR2_PLR0_SS0_SU32_SUM0_SUS256_SVW8_TLDS1_WG16_8_1_WGM8
    SolutionIndex: 18
    SolutionNameMin: Cijk_Alik_Bjlk_F8BS_BH_BiasSHB_HAS_SAB_SAV_UserArgs_MT64x32x64_MI16x16x1_SN_LDSB0_CLR1_GRVWA8_GRVWB16_GSU1_LBSPPA128_LBSPPB256_LPA8_MIWT2_1_PGR1_PLR1_SS0_SU32_SUM0_SUS256_SVW8_TLDS1_WG32_4_1_WGM8
    SolutionIndex: 19
    SolutionNameMin: Cijk_Alik_Bjlk_F8BS_BH_BiasSHB_HAS_SAB_SAV_UserArgs_MT256x16x64_MI16x16x1_SN_LDSB1_CLR1_GRVWA8_GRVWB8_GSU1_LBSPPA128_LBSPPB128_LPA8_MIWT4_1_PGR1_PLR3_SS1_SU32_SUM0_SUS256_SVW1_TLDS1_WG64_2_1_WGM8
    SolutionIndex: 20
    SolutionNameMin: Cijk_Alik_Bjlk_F8BS_BH_BiasSHB_HAS_SAB_SAV_UserArgs_MT32x64x64_MI16x16x1_SN_LDSB0_CLR1_GRVWA8_GRVWB16_GSU1_LBSPPA128_LBSPPB512_LPA8_MIWT2_1_PGR2_PLR3_SS0_SU32_SUM0_SUS256_SVW8_TLDS1_WG16_8_1_WGM8
    SolutionIndex: 21
    SolutionNameMin: Cijk_Alik_Bjlk_F8BS_BH_BiasSHB_HAS_SAB_SAV_UserArgs_MT64x32x64_MI16x16x1_SN_LDSB0_CLR0_GRVWA8_GRVWB16_GSU1_LBSPPA128_LBSPPB256_LPA8_MIWT2_1_PGR1_PLR0_SS0_SU32_SUM0_SUS256_SVW8_TLDS1_WG32_4_1_WGM8
    SolutionIndex: 22
    SolutionNameMin: Cijk_Alik_Bjlk_F8BS_BH_BiasSHB_HAS_SAB_SAV_UserArgs_MT64x32x64_MI16x16x1_SN_LDSB0_CLR1_GRVWA8_GRVWB16_GSU1_LBSPPA128_LBSPPB256_LPA8_MIWT2_1_PGR2_PLR1_SS0_SU32_SUM0_SUS256_SVW8_TLDS1_WG32_4_1_WGM8
    SolutionIndex: 23
    SolutionNameMin: Cijk_Alik_Bjlk_F8BS_BH_BiasSHB_HAS_SAB_SAV_UserArgs_MT64x32x64_MI16x16x1_SN_LDSB0_CLR1_GRVWA8_GRVWB16_GSU1_LBSPPA128_LBSPPB256_LPA8_MIWT2_1_PGR1_PLR3_SS0_SU32_SUM0_SUS256_SVW8_TLDS1_WG32_4_1_WGM8
    SolutionIndex: 24
    SolutionNameMin: Cijk_Alik_Bjlk_F8BS_BH_BiasSHB_HAS_SAB_SAV_UserArgs_MT32x64x64_MI16x16x1_SN_LDSB0_CLR1_GRVWA8_GRVWB16_GSU1_LBSPPA128_LBSPPB512_LPA8_MIWT2_1_PGR2_PLR1_SS1_SU32_SUM0_SUS256_SVW1_TLDS1_WG16_8_1_WGM8
    SolutionIndex: 25
    SolutionNameMin: Cijk_Alik_Bjlk_F8BS_BH_BiasSHB_HAS_SAB_SAV_UserArgs_MT16x64x64_MI16x16x1_SN_LDSB0_CLR1_GRVWA8_GRVWB16_GSU1_LBSPPA128_LBSPPB512_LPA8_MIWT1_1_PGR1_PLR1_SS0_SU32_SUM0_SUS256_SVW8_TLDS1_WG16_8_1_WGM8
    SolutionIndex: 26
    SolutionNameMin: Cijk_Alik_Bjlk_F8BS_BH_BiasSHB_HAS_SAB_SAV_UserArgs_MT32x32x64_MI16x16x1_SN_LDSB0_CLR1_GRVWA8_GRVWB16_GSU1_LBSPPA128_LBSPPB256_LPA8_MIWT1_1_PGR1_PLR1_SS1_SU32_SUM0_SUS256_SVW1_TLDS1_WG32_4_1_WGM8
    SolutionIndex: 27
    SolutionNameMin: Cijk_Alik_Bjlk_F8BS_BH_BiasSHB_HAS_SAB_SAV_UserArgs_MT32x32x64_MI16x16x1_SN_LDSB0_CLR0_GRVWA8_GRVWB16_GSU1_LBSPPA128_LBSPPB256_LPA8_MIWT1_1_PGR1_PLR0_SS0_SU32_SUM0_SUS256_SVW8_TLDS1_WG32_4_1_WGM8
    SolutionIndex: 28
    SolutionNameMin: Cijk_Alik_Bjlk_F8BS_BH_BiasSHB_HAS_SAB_SAV_UserArgs_MT32x32x64_MI16x16x1_SN_LDSB0_CLR1_GRVWA8_GRVWB16_GSU1_LBSPPA128_LBSPPB256_LPA8_MIWT1_1_PGR1_PLR1_SS0_SU32_SUM0_SUS256_SVW8_TLDS1_WG32_4_1_WGM8
- - - [1, 1, 1, 1]
    - [2, 7.25374e-05]
  - - [1, 64, 1, 1]
    - [0, 0.00416152]
  - - [64, 1, 1, 1]
    - [3, 0.00466438]
  - - [64, 64, 1, 1]
    - [1, 0.300613]
  - - [512, 512, 1, 64]
    - [4, 0]
  - - [1024, 512, 1, 64]
    - [5, 0]
  - - [1536, 512, 1, 64]
    - [6, 0]
  - - [2048, 512, 1, 64]
    - [6, 0]
  - - [2560, 512, 1, 64]
    - [7, 0]
  - - [3072, 512, 1, 64]
    - [7, 0]
  - - [512, 1024, 1, 64]
    - [8, 0]
  - - [1024, 1024, 1, 64]
    - [6, 0]
  - - [1536, 1024, 1, 64]
    - [5, 0]
  - - [2048, 1024, 1, 64]
    - [5, 0]
  - - [2560, 1024, 1, 64]
    - [6, 0]
  - - [3072, 1024, 1, 64]
    - [6, 0]
  - - [512, 1536, 1, 64]
    - [8, 0]
  - - [1024, 1536, 1, 64]
    - [6, 0]
  - - [1536, 1536, 1, 64]
    - [7, 0]
  - - [2048, 1536, 1, 64]
    - [6, 0]
  - - [2560, 1536, 1, 64]
    - [5, 0]
  - - [3072, 1536, 1, 64]
    - [6, 0]
  - - [512, 2048, 1, 64]
    - [7, 0]
  - - [1024, 2048, 1, 64]
    - [6, 0]
  - - [1536, 2048, 1, 64]
    - [5, 0]
  - - [2048, 2048, 1, 64]
    - [8, 0]
  - - [2560, 2048, 1, 64]
    - [6, 0]
  - - [3072, 2048, 1, 64]
    - [8, 0]
  - - [512, 2560, 1, 64]
    - [6, 0]
  - - [1024, 2560, 1, 64]
    - [7, 0]
  - - [1536, 2560, 1, 64]
    - [7, 0]
  - - [2048, 2560, 1, 64]
    - [8, 0]
  - - [2560, 2560, 1, 64]
    - [5, 0]
  - - [3072, 2560, 1, 64]
    - [5, 0]
  - - [512, 3072, 1, 64]
    - [7, 0]
  - - [1024, 3072, 1, 64]
    - [5, 0]
  - - [1536, 3072, 1, 64]
    - [8, 0]
  - - [2048, 3072, 1, 64]
    - [5, 0]
  - - [2560, 3072, 1, 64]
    - [6, 0]
  - - [3072, 3072, 1, 64]
    - [5, 0]
  - - [512, 512, 1, 512]
    - [9, 0]
  - - [1024, 512, 1, 512]
    - [10, 0]
  - - [1536, 512, 1, 512]
    - [5, 0]
  - - [2048, 512, 1, 512]
    - [11, 0]
  - - [2560, 512, 1, 512]
    - [12, 0]
  - - [3072, 512, 1, 512]
    - [13, 0]
  - - [512, 1024, 1, 512]
    - [11, 0]
  - - [1024, 1024, 1, 512]
    - [13, 0]
  - - [1536, 1024, 1, 512]
    - [5, 0]
  - - [2048, 1024, 1, 512]
    - [14, 0]
  - - [2560, 1024, 1, 512]
    - [14, 0]
  - - [3072, 1024, 1, 512]
    - [15, 0]
  - - [512, 1536, 1, 512]
    - [5, 0]
  - - [1024, 1536, 1, 512]
    - [5, 0]
  - - [1536, 1536, 1, 512]
    - [13, 0]
  - - [2048, 1536, 1, 512]
    - [5, 0]
  - - [2560, 1536, 1, 512]
    - [14, 0]
  - - [3072, 1536, 1, 512]
    - [15, 0]
  - - [512, 2048, 1, 512]
    - [12, 0]
  - - [1024, 2048, 1, 512]
    - [5, 0]
  - - [1536, 2048, 1, 512]
    - [5, 0]
  - - [2048, 2048, 1, 512]
    - [15, 0]
  - - [2560, 2048, 1, 512]
    - [16, 0]
  - - [3072, 2048, 1, 512]
    - [13, 0]
  - - [512, 2560, 1, 512]
    - [5, 0]
  - - [1024, 2560, 1, 512]
    - [14, 0]
  - - [1536, 2560, 1, 512]
    - [14, 0]
  - - [2048, 2560, 1, 512]
    - [17, 0]
  - - [2560, 2560, 1, 512]
    - [14, 0]
  - - [3072, 2560, 1, 512]
    - [17, 0]
  - - [512, 3072, 1, 512]
    - [5, 0]
  - - [1024, 3072, 1, 512]
    - [14, 0]
  - - [1536, 3072, 1, 512]
    - [14, 0]
  - - [2048, 3072, 1, 512]
    - [15, 0]
  - - [2560, 3072, 1, 512]
    - [14, 0]
  - - [3072, 3072, 1, 512]
    - [15, 0]
  - - [512, 512, 1, 1024]
    - [18, 0]
  - - [1024, 512, 1, 1024]
    - [14, 0]
  - - [1536, 512, 1, 1024]
    - [16, 0]
  - - [2048, 512, 1, 1024]
    - [11, 0]
  - - [2560, 512, 1, 1024]
    - [14, 0]
  - - [3072, 512, 1, 1024]
    - [10, 0]
  - - [512, 1024, 1, 1024]
    - [13, 0]
  - - [1024, 1024, 1, 1024]
    - [14, 0]
  - - [1536, 1024, 1, 1024]
    - [16, 0]
  - - [2048, 1024, 1, 1024]
    - [13, 0]
  - - [2560, 1024, 1, 1024]
    - [14, 0]
  - - [3072, 1024, 1, 1024]
    - [13, 0]
  - - [512, 1536, 1, 1024]
    - [5, 0]
  - - [1024, 1536, 1, 1024]
    - [19, 0]
  - - [1536, 1536, 1, 1024]
    - [10, 0]
  - - [2048, 1536, 1, 1024]
    - [20, 0]
  - - [2560, 1536, 1, 1024]
    - [10, 0]
  - - [3072, 1536, 1, 1024]
    - [10, 0]
  - - [512, 2048, 1, 1024]
    - [20, 0]
  - - [1024, 2048, 1, 1024]
    - [17, 0]
  - - [1536, 2048, 1, 1024]
    - [17, 0]
  - - [2048, 2048, 1, 1024]
    - [20, 0]
  - - [2560, 2048, 1, 1024]
    - [10, 0]
  - - [3072, 2048, 1, 1024]
    - [17, 0]
  - - [512, 2560, 1, 1024]
    - [19, 0]
  - - [1024, 2560, 1, 1024]
    - [17, 0]
  - - [1536, 2560, 1, 1024]
    - [17, 0]
  - - [2048, 2560, 1, 1024]
    - [20, 0]
  - - [2560, 2560, 1, 1024]
    - [20, 0]
  - - [3072, 2560, 1, 1024]
    - [20, 0]
  - - [512, 3072, 1, 1024]
    - [5, 0]
  - - [1024, 3072, 1, 1024]
    - [14, 0]
  - - [1536, 3072, 1, 1024]
    - [10, 0]
  - - [2048, 3072, 1, 1024]
    - [17, 0]
  - - [2560, 3072, 1, 1024]
    - [17, 0]
  - - [3072, 3072, 1, 1024]
    - [10, 0]
  - - [512, 512, 1, 2048]
    - [21, 0]
  - - [1024, 512, 1, 2048]
    - [22, 0]
  - - [1536, 512, 1, 2048]
    - [14, 0]
  - - [2048, 512, 1, 2048]
    - [10, 0]
  - - [2560, 512, 1, 2048]
    - [14, 0]
  - - [3072, 512, 1, 2048]
    - [20, 0]
  - - [512, 1024, 1, 2048]
    - [12, 0]
  - - [1024, 1024, 1, 2048]
    - [10, 0]
  - - [1536, 1024, 1, 2048]
    - [10, 0]
  - - [2048, 1024, 1, 2048]
    - [10, 0]
  - - [2560, 1024, 1, 2048]
    - [10, 0]
  - - [3072, 1024, 1, 2048]
    - [10, 0]
  - - [512, 1536, 1, 2048]
    - [13, 0]
  - - [1024, 1536, 1, 2048]
    - [10, 0]
  - - [1536, 1536, 1, 2048]
    - [20, 0]
  - - [2048, 1536, 1, 2048]
    - [20, 0]
  - - [2560, 1536, 1, 2048]
    - [20, 0]
  - - [3072, 1536, 1, 2048]
    - [20, 0]
  - - [512, 2048, 1, 2048]
    - [10, 0]
  - - [1024, 2048, 1, 2048]
    - [10, 0]
  - - [1536, 2048, 1, 2048]
    - [20, 0]
  - - [2048, 2048, 1, 2048]
    - [20, 0]
  - - [2560, 2048, 1, 2048]
    - [20, 0]
  - - [3072, 2048, 1, 2048]
    - [20, 0]
  - - [512, 2560, 1, 2048]
    - [14, 0]
  - - [1024, 2560, 1, 2048]
    - [20, 0]
  - - [1536, 2560, 1, 2048]
    - [20, 0]
  - - [2048, 2560, 1, 2048]
    - [20, 0]
  - - [2560, 2560, 1, 2048]
    - [20, 0]
  - - [3072, 2560, 1, 2048]
    - [20, 0]
  - - [512, 3072, 1, 2048]
    - [10, 0]
  - - [1024, 3072, 1, 2048]
    - [10, 0]
  - - [1536, 3072, 1, 2048]
    - [10, 0]
  - - [2048, 3072, 1, 2048]
    - [10, 0]
  - - [2560, 3072, 1, 2048]
    - [20, 0]
  - - [3072, 3072, 1, 2048]
    - [20, 0]
  - - [512, 512, 1, 4096]
    - [23, 0]
  - - [1024, 512, 1, 4096]
    - [12, 0]
  - - [1536, 512, 1, 4096]
    - [14, 0]
  - - [2048, 512, 1, 4096]
    - [10, 0]
  - - [2560, 512, 1, 4096]
    - [14, 0]
  - - [3072, 512, 1, 4096]
    - [20, 0]
  - - [512, 1024, 1, 4096]
    - [12, 0]
  - - [1024, 1024, 1, 4096]
    - [10, 0]
  - - [1536, 1024, 1, 4096]
    - [10, 0]
  - - [2048, 1024, 1, 4096]
    - [10, 0]
  - - [2560, 1024, 1, 4096]
    - [10, 0]
  - - [3072, 1024, 1, 4096]
    - [10, 0]
  - - [512, 1536, 1, 4096]
    - [5, 0]
  - - [1024, 1536, 1, 4096]
    - [10, 0]
  - - [1536, 1536, 1, 4096]
    - [10, 0]
  - - [2048, 1536, 1, 4096]
    - [10, 0]
  - - [2560, 1536, 1, 4096]
    - [10, 0]
  - - [3072, 1536, 1, 4096]
    - [20, 0]
  - - [512, 2048, 1, 4096]
    - [10, 0]
  - - [1024, 2048, 1, 4096]
    - [10, 0]
  - - [1536, 2048, 1, 4096]
    - [10, 0]
  - - [2048, 2048, 1, 4096]
    - [10, 0]
  - - [2560, 2048, 1, 4096]
    - [24, 0]
  - - [3072, 2048, 1, 4096]
    - [20, 0]
  - - [512, 2560, 1, 4096]
    - [13, 0]
  - - [1024, 2560, 1, 4096]
    - [10, 0]
  - - [1536, 2560, 1, 4096]
    - [10, 0]
  - - [2048, 2560, 1, 4096]
    - [20, 0]
  - - [2560, 2560, 1, 4096]
    - [20, 0]
  - - [3072, 2560, 1, 4096]
    - [20, 0]
  - - [512, 3072, 1, 4096]
    - [10, 0]
  - - [1024, 3072, 1, 4096]
    - [10, 0]
  - - [1536, 3072, 1, 4096]
    - [24, 0]
  - - [2048, 3072, 1, 4096]
    - [24, 0]
  - - [2560, 3072, 1, 4096]
    - [24, 0]
  - - [3072, 3072, 1, 4096]
    - [24, 0]
  - - [64, 64, 1, 64]
    - [25, 0]
  - - [64, 64, 1, 512]
    - [26, 0]
  - - [64, 64, 1, 1024]
    - [27, 0]
  - - [64, 64, 1, 2048]
    - [28, 0]
  - - [64, 64, 1, 4096]
    - [28, 0]
- null
- null
- DeviceEfficiency
- GridBased
