library/src/amd_detail/rocblaslt/src/Tensile/Logic/asm_full/gfx1200/GridBased/gfx1200_Cijk_Alik_Bljk_HSS_BH_Bias_HAS_SAV_UserArgs.yaml
- {MinimumRequiredVersion: 4.33.0}
- gfx1200
- gfx1200
- [Device 73f0]
    SolutionIndex: 0
    SolutionNameMin: Cijk_Alik_Bljk_HSS_BH_Bias_HAS_SAV_UserArgs_MT64x32x32_MI16x16x1_SN_CLR1_GSU1_LBSPPA128_LBSPPB128_MIWT2_1_PGR1_PLR1_SS0_SU32_SUM0_SUS256_SVW8_TLDS1_WG32_4_1_WGM8
    SolutionIndex: 1
    SolutionNameMin: Cijk_Alik_Bljk_HSS_BH_Bias_HAS_SAV_UserArgs_MT64x32x32_MI16x16x1_SN_CLR1_GSU1_LBSPPA128_LBSPPB128_MIWT2_1_PGR2_PLR1_SS0_SU32_SUM0_SUS256_SVW8_TLDS1_WG32_4_1_WGM8
    SolutionIndex: 2
    SolutionNameMin: Cijk_Alik_Bljk_HSS_BH_Bias_HAS_SAV_UserArgs_MT64x32x32_MI16x16x1_SN_CLR0_GSU1_LBSPPA128_LBSPPB128_MIWT2_1_PGR1_PLR0_SS0_SU32_SUM0_SUS256_SVW8_TLDS1_WG32_4_1_WGM8
    SolutionIndex: 3
    SolutionNameMin: Cijk_Alik_Bljk_HSS_BH_Bias_HAS_SAV_UserArgs_MT64x32x32_MI16x16x1_SN_CLR0_GSU1_LBSPPA128_LBSPPB128_MIWT2_1_PGR2_PLR0_SS0_SU32_SUM0_SUS256_SVW8_TLDS1_WG32_4_1_WGM8
    SolutionIndex: 4
    SolutionNameMin: Cijk_Alik_Bljk_HSS_BH_Bias_HAS_SAV_UserArgs_MT32x64x32_MI16x16x1_SN_CLR1_GSU1_LBSPPA128_LBSPPB128_MIWT2_1_PGR1_PLR1_SS0_SU32_SUM0_SUS256_SVW8_TLDS1_WG16_8_1_WGM8
    SolutionIndex: 5
    SolutionNameMin: Cijk_Alik_Bljk_HSS_BH_Bias_HAS_SAV_UserArgs_MT32x64x32_MI16x16x1_SN_CLR0_GSU1_LBSPPA128_LBSPPB128_MIWT2_1_PGR1_PLR0_SS0_SU32_SUM0_SUS256_SVW8_TLDS1_WG16_8_1_WGM8
    SolutionIndex: 6
    SolutionNameMin: Cijk_Alik_Bljk_HSS_BH_Bias_HAS_SAV_UserArgs_MT32x32x64_MI16x16x1_SN_CLR0_GSU1_LBSPPA128_LBSPPB128_MIWT1_1_PGR1_PLR0_SS0_SU32_SUM0_SUS256_SVW8_TLDS1_WG32_4_1_WGM8
    SolutionIndex: 7
    SolutionNameMin: Cijk_Alik_Bljk_HSS_BH_Bias_HAS_SAV_UserArgs_MT64x16x32_MI16x16x1_SN_CLR1_GSU1_LBSPPA128_LBSPPB128_MIWT1_1_PGR1_PLR1_SS1_SU32_SUM0_SUS256_SVW1_TLDS1_WG64_2_1_WGM8
    SolutionIndex: 8
    SolutionNameMin: Cijk_Alik_Bljk_HSS_BH_Bias_HAS_SAV_UserArgs_MT64x16x32_MI16x16x1_SN_CLR1_GSU1_LBSPPA128_LBSPPB128_MIWT1_1_PGR2_PLR1_SS1_SU32_SUM0_SUS256_SVW1_TLDS1_WG64_2_1_WGM8
    SolutionIndex: 9
    SolutionNameMin: Cijk_Alik_Bljk_HSS_BH_Bias_HAS_SAV_UserArgs_MT32x32x32_MI16x16x1_SN_CLR1_GSU1_LBSPPA128_LBSPPB128_MIWT1_1_PGR1_PLR1_SS1_SU32_SUM0_SUS256_SVW1_TLDS1_WG32_4_1_WGM8
    SolutionIndex: 10
    SolutionNameMin: Cijk_Alik_Bljk_HSS_BH_Bias_HAS_SAV_UserArgs_MT32x32x32_MI16x16x1_SN_CLR0_GSU1_LBSPPA128_LBSPPB128_MIWT1_1_PGR1_PLR0_SS1_SU32_SUM0_SUS256_SVW1_TLDS1_WG32_4_1_WGM8
    SolutionIndex: 11
    SolutionNameMin: Cijk_Alik_Bljk_HSS_BH_Bias_HAS_SAV_UserArgs_MT64x32x32_MI16x16x1_SN_CLR1_GSU1_LBSPPA128_LBSPPB128_MIWT2_1_PGR1_PLR1_SS1_SU32_SUM0_SUS256_SVW1_TLDS1_WG32_4_1_WGM8
    SolutionIndex: 12
    SolutionNameMin: Cijk_Alik_Bljk_HSS_BH_Bias_HAS_SAV_UserArgs_MT64x32x32_MI16x16x1_SN_CLR1_GSU1_LBSPPA128_LBSPPB128_MIWT2_1_PGR2_PLR1_SS1_SU32_SUM0_SUS256_SVW1_TLDS1_WG32_4_1_WGM8
    SolutionIndex: 13
    SolutionNameMin: Cijk_Alik_Bljk_HSS_BH_Bias_HAS_SAV_UserArgs_MT64x32x32_MI16x16x1_SN_CLR0_GSU1_LBSPPA128_LBSPPB128_MIWT2_1_PGR1_PLR0_SS1_SU32_SUM0_SUS256_SVW1_TLDS1_WG32_4_1_WGM8
    SolutionIndex: 14
    SolutionNameMin: Cijk_Alik_Bljk_HSS_BH_Bias_HAS_SAV_UserArgs_MT32x64x32_MI16x16x1_SN_CLR1_GSU1_LBSPPA128_LBSPPB128_MIWT2_1_PGR1_PLR1_SS1_SU32_SUM0_SUS256_SVW1_TLDS1_WG16_8_1_WGM8
    SolutionIndex: 15
    SolutionNameMin: Cijk_Alik_Bljk_HSS_BH_Bias_HAS_SAV_UserArgs_MT32x64x32_MI16x16x1_SN_CLR1_GSU1_LBSPPA128_LBSPPB128_MIWT2_1_PGR2_PLR1_SS1_SU32_SUM0_SUS256_SVW1_TLDS1_WG16_8_1_WGM8
    SolutionIndex: 16
    SolutionNameMin: Cijk_Alik_Bljk_HSS_BH_Bias_HAS_SAV_UserArgs_MT32x64x32_MI16x16x1_SN_CLR0_GSU1_LBSPPA128_LBSPPB128_MIWT2_1_PGR1_PLR0_SS1_SU32_SUM0_SUS256_SVW1_TLDS1_WG16_8_1_WGM8
    SolutionIndex: 17
    SolutionNameMin: Cijk_Alik_Bljk_HSS_BH_Bias_HAS_SAV_UserArgs_MT32x32x64_MI16x16x1_SN_CLR1_GSU1_LBSPPA128_LBSPPB128_MIWT1_1_PGR1_PLR3_SS1_SU32_SUM0_SUS256_SVW1_TLDS1_WG32_4_1_WGM8
- - - [512, 512, 1, 64, 512, 512, 64, 64]
    - [13, 1073.09]
  - - [1024, 512, 1, 64, 1024, 1024, 64, 64]
    - [12, 2153.82]
  - - [1536, 512, 1, 64, 1536, 1536, 64, 64]
    - [1, 2942.17]
  - - [2048, 512, 1, 64, 2048, 2048, 64, 64]
    - [12, 3777.91]
  - - [2560, 512, 1, 64, 2560, 2560, 64, 64]
    - [14, 4430.1]
  - - [3072, 512, 1, 64, 3072, 3072, 64, 64]
    - [12, 4798.17]
  - - [512, 1024, 1, 64, 512, 512, 64, 64]
    - [11, 2046.56]
  - - [1024, 1024, 1, 64, 1024, 1024, 64, 64]
    - [4, 3748.37]
  - - [1536, 1024, 1, 64, 1536, 1536, 64, 64]
    - [4, 5041.36]
  - - [2048, 1024, 1, 64, 2048, 2048, 64, 64]
    - [16, 6177.75]
  - - [2560, 1024, 1, 64, 2560, 2560, 64, 64]
    - [0, 6832.23]
  - - [3072, 1024, 1, 64, 3072, 3072, 64, 64]
    - [0, 7640.77]
  - - [512, 1536, 1, 64, 512, 512, 64, 64]
    - [2, 2962.17]
  - - [1024, 1536, 1, 64, 1024, 1024, 64, 64]
    - [4, 4741.67]
  - - [1536, 1536, 1, 64, 1536, 1536, 64, 64]
    - [0, 6696.75]
  - - [2048, 1536, 1, 64, 2048, 2048, 64, 64]
    - [0, 8042.77]
  - - [2560, 1536, 1, 64, 2560, 2560, 64, 64]
    - [0, 8970.97]
  - - [3072, 1536, 1, 64, 3072, 3072, 64, 64]
    - [15, 10040.7]
  - - [512, 2048, 1, 64, 512, 512, 64, 64]
    - [11, 3769.42]
  - - [1024, 2048, 1, 64, 1024, 1024, 64, 64]
    - [0, 6232.39]
  - - [1536, 2048, 1, 64, 1536, 1536, 64, 64]
    - [3, 8012.36]
  - - [2048, 2048, 1, 64, 2048, 2048, 64, 64]
    - [12, 9267.9]
  - - [2560, 2048, 1, 64, 2560, 2560, 64, 64]
    - [0, 10612.1]
  - - [3072, 2048, 1, 64, 3072, 3072, 64, 64]
    - [14, 11991.6]
  - - [512, 2560, 1, 64, 512, 512, 64, 64]
    - [4, 4446.53]
  - - [1024, 2560, 1, 64, 1024, 1024, 64, 64]
    - [14, 6935.46]
  - - [1536, 2560, 1, 64, 1536, 1536, 64, 64]
    - [0, 9530.7]
  - - [2048, 2560, 1, 64, 2048, 2048, 64, 64]
    - [14, 10351.4]
  - - [2560, 2560, 1, 64, 2560, 2560, 64, 64]
    - [0, 11981.8]
  - - [3072, 2560, 1, 64, 3072, 3072, 64, 64]
    - [0, 13272.8]
  - - [512, 3072, 1, 64, 512, 512, 64, 64]
    - [4, 5065.58]
  - - [1024, 3072, 1, 64, 1024, 1024, 64, 64]
    - [14, 7837.38]
  - - [1536, 3072, 1, 64, 1536, 1536, 64, 64]
    - [4, 10604.1]
  - - [2048, 3072, 1, 64, 2048, 2048, 64, 64]
    - [11, 12036.6]
  - - [2560, 3072, 1, 64, 2560, 2560, 64, 64]
    - [0, 13614.4]
  - - [3072, 3072, 1, 64, 3072, 3072, 64, 64]
    - [1, 14032.8]
  - - [512, 512, 1, 256, 512, 512, 256, 256]
    - [9, 4027.78]
  - - [1024, 512, 1, 256, 1024, 1024, 256, 256]
    - [14, 7370.96]
  - - [1536, 512, 1, 256, 1536, 1536, 256, 256]
    - [11, 9313.99]
  - - [2048, 512, 1, 256, 2048, 2048, 256, 256]
    - [14, 11541.1]
  - - [2560, 512, 1, 256, 2560, 2560, 256, 256]
    - [4, 12810.0]
  - - [3072, 512, 1, 256, 3072, 3072, 256, 256]
    - [16, 13996.3]
  - - [512, 1024, 1, 256, 512, 512, 256, 256]
    - [14, 7401.44]
  - - [1024, 1024, 1, 256, 1024, 1024, 256, 256]
    - [5, 11396.4]
  - - [1536, 1024, 1, 256, 1536, 1536, 256, 256]
    - [4, 14764.9]
  - - [2048, 1024, 1, 256, 2048, 2048, 256, 256]
    - [14, 17139.3]
  - - [2560, 1024, 1, 256, 2560, 2560, 256, 256]
    - [0, 18922.0]
  - - [3072, 1024, 1, 256, 3072, 3072, 256, 256]
    - [11, 19827.1]
  - - [512, 1536, 1, 256, 512, 512, 256, 256]
    - [0, 9350.98]
  - - [1024, 1536, 1, 256, 1024, 1024, 256, 256]
    - [11, 13858.5]
  - - [1536, 1536, 1, 256, 1536, 1536, 256, 256]
    - [0, 17653.0]
  - - [2048, 1536, 1, 256, 2048, 2048, 256, 256]
    - [11, 19761.4]
  - - [2560, 1536, 1, 256, 2560, 2560, 256, 256]
    - [0, 21526.5]
  - - [3072, 1536, 1, 256, 3072, 3072, 256, 256]
    - [14, 23464.0]
  - - [512, 2048, 1, 256, 512, 512, 256, 256]
    - [11, 11201.1]
  - - [1024, 2048, 1, 256, 1024, 1024, 256, 256]
    - [14, 17027.8]
  - - [1536, 2048, 1, 256, 1536, 1536, 256, 256]
    - [14, 19837.1]
  - - [2048, 2048, 1, 256, 2048, 2048, 256, 256]
    - [14, 22624.9]
  - - [2560, 2048, 1, 256, 2560, 2560, 256, 256]
    - [14, 23905.3]
  - - [3072, 2048, 1, 256, 3072, 3072, 256, 256]
    - [11, 25515.3]
  - - [512, 2560, 1, 256, 512, 512, 256, 256]
    - [11, 12873.9]
  - - [1024, 2560, 1, 256, 1024, 1024, 256, 256]
    - [14, 18634.9]
  - - [1536, 2560, 1, 256, 1536, 1536, 256, 256]
    - [0, 21911.4]
  - - [2048, 2560, 1, 256, 2048, 2048, 256, 256]
    - [14, 24326.5]
  - - [2560, 2560, 1, 256, 2560, 2560, 256, 256]
    - [0, 25376.2]
  - - [3072, 2560, 1, 256, 3072, 3072, 256, 256]
    - [11, 26745.1]
  - - [512, 3072, 1, 256, 512, 512, 256, 256]
    - [0, 14582.8]
  - - [1024, 3072, 1, 256, 1024, 1024, 256, 256]
    - [14, 19844.4]
  - - [1536, 3072, 1, 256, 1536, 1536, 256, 256]
    - [11, 23018.2]
  - - [2048, 3072, 1, 256, 2048, 2048, 256, 256]
    - [14, 25539.7]
  - - [2560, 3072, 1, 256, 2560, 2560, 256, 256]
    - [0, 26584.1]
  - - [3072, 3072, 1, 256, 3072, 3072, 256, 256]
    - [14, 27941.8]
  - - [512, 512, 1, 512, 512, 512, 512, 512]
    - [9, 7175.31]
  - - [1024, 512, 1, 512, 1024, 1024, 512, 512]
    - [11, 12220.2]
  - - [1536, 512, 1, 512, 1536, 1536, 512, 512]
    - [14, 14545.7]
  - - [2048, 512, 1, 512, 2048, 2048, 512, 512]
    - [14, 17612.7]
  - - [2560, 512, 1, 512, 2560, 2560, 512, 512]
    - [11, 18781.2]
  - - [3072, 512, 1, 512, 3072, 3072, 512, 512]
    - [11, 21247.6]
  - - [512, 1024, 1, 512, 512, 512, 512, 512]
    - [14, 11759.0]
  - - [1024, 1024, 1, 512, 1024, 1024, 512, 512]
    - [11, 17749.6]
  - - [1536, 1024, 1, 512, 1536, 1536, 512, 512]
    - [0, 21253.2]
  - - [2048, 1024, 1, 512, 2048, 2048, 512, 512]
    - [11, 23495.2]
  - - [2560, 1024, 1, 512, 2560, 2560, 512, 512]
    - [0, 25179.4]
  - - [3072, 1024, 1, 512, 3072, 3072, 512, 512]
    - [11, 26528.1]
  - - [512, 1536, 1, 512, 512, 512, 512, 512]
    - [4, 14678.8]
  - - [1024, 1536, 1, 512, 1024, 1024, 512, 512]
    - [4, 21604.8]
  - - [1536, 1536, 1, 512, 1536, 1536, 512, 512]
    - [0, 24085.0]
  - - [2048, 1536, 1, 512, 2048, 2048, 512, 512]
    - [14, 26613.3]
  - - [2560, 1536, 1, 512, 2560, 2560, 512, 512]
    - [0, 27686.5]
  - - [3072, 1536, 1, 512, 3072, 3072, 512, 512]
    - [11, 28659.3]
  - - [512, 2048, 1, 512, 512, 512, 512, 512]
    - [11, 17788.1]
  - - [1024, 2048, 1, 512, 1024, 1024, 512, 512]
    - [0, 24048.8]
  - - [1536, 2048, 1, 512, 1536, 1536, 512, 512]
    - [4, 26693.2]
  - - [2048, 2048, 1, 512, 2048, 2048, 512, 512]
    - [14, 28496.0]
  - - [2560, 2048, 1, 512, 2560, 2560, 512, 512]
    - [0, 30135.2]
  - - [3072, 2048, 1, 512, 3072, 3072, 512, 512]
    - [11, 30546.6]
  - - [512, 2560, 1, 512, 512, 512, 512, 512]
    - [4, 18948.7]
  - - [1024, 2560, 1, 512, 1024, 1024, 512, 512]
    - [4, 25355.4]
  - - [1536, 2560, 1, 512, 1536, 1536, 512, 512]
    - [4, 27380.8]
  - - [2048, 2560, 1, 512, 2048, 2048, 512, 512]
    - [14, 29679.4]
  - - [2560, 2560, 1, 512, 2560, 2560, 512, 512]
    - [4, 30972.0]
  - - [3072, 2560, 1, 512, 3072, 3072, 512, 512]
    - [14, 31894.2]
  - - [512, 3072, 1, 512, 512, 512, 512, 512]
    - [0, 21312.3]
  - - [1024, 3072, 1, 512, 1024, 1024, 512, 512]
    - [14, 26338.9]
  - - [1536, 3072, 1, 512, 1536, 1536, 512, 512]
    - [0, 29275.0]
  - - [2048, 3072, 1, 512, 2048, 2048, 512, 512]
    - [14, 30591.7]
  - - [2560, 3072, 1, 512, 2560, 2560, 512, 512]
    - [4, 31531.3]
  - - [3072, 3072, 1, 512, 3072, 3072, 512, 512]
    - [11, 32169.0]
  - - [512, 512, 1, 1024, 512, 512, 1024, 1024]
    - [10, 11271.9]
  - - [1024, 512, 1, 1024, 1024, 1024, 1024, 1024]
    - [11, 18583.9]
  - - [1536, 512, 1, 1024, 1536, 1536, 1024, 1024]
    - [4, 20092.5]
  - - [2048, 512, 1, 1024, 2048, 2048, 1024, 1024]
    - [0, 24008.2]
  - - [2560, 512, 1, 1024, 2560, 2560, 1024, 1024]
    - [14, 24342.1]
  - - [3072, 512, 1, 1024, 3072, 3072, 1024, 1024]
    - [11, 27805.6]
  - - [512, 1024, 1, 1024, 512, 512, 1024, 1024]
    - [14, 18012.2]
  - - [1024, 1024, 1, 1024, 1024, 1024, 1024, 1024]
    - [4, 24388.0]
  - - [1536, 1024, 1, 1024, 1536, 1536, 1024, 1024]
    - [14, 27588.7]
  - - [2048, 1024, 1, 1024, 2048, 2048, 1024, 1024]
    - [11, 29624.1]
  - - [2560, 1024, 1, 1024, 2560, 2560, 1024, 1024]
    - [14, 30605.2]
  - - [3072, 1024, 1, 1024, 3072, 3072, 1024, 1024]
    - [14, 31222.8]
  - - [512, 1536, 1, 1024, 512, 512, 1024, 1024]
    - [11, 20333.7]
  - - [1024, 1536, 1, 1024, 1024, 1024, 1024, 1024]
    - [14, 27496.6]
  - - [1536, 1536, 1, 1024, 1536, 1536, 1024, 1024]
    - [14, 28666.1]
  - - [2048, 1536, 1, 1024, 2048, 2048, 1024, 1024]
    - [11, 31455.1]
  - - [2560, 1536, 1, 1024, 2560, 2560, 1024, 1024]
    - [4, 31389.7]
  - - [3072, 1536, 1, 1024, 3072, 3072, 1024, 1024]
    - [4, 33160.0]
  - - [512, 2048, 1, 1024, 512, 512, 1024, 1024]
    - [11, 23962.6]
  - - [1024, 2048, 1, 1024, 1024, 1024, 1024, 1024]
    - [14, 28825.3]
  - - [1536, 2048, 1, 1024, 1536, 1536, 1024, 1024]
    - [2, 31157.9]
  - - [2048, 2048, 1, 1024, 2048, 2048, 1024, 1024]
    - [16, 32612.5]
  - - [2560, 2048, 1, 1024, 2560, 2560, 1024, 1024]
    - [11, 33871.6]
  - - [3072, 2048, 1, 1024, 3072, 3072, 1024, 1024]
    - [4, 34453.4]
  - - [512, 2560, 1, 1024, 512, 512, 1024, 1024]
    - [4, 24933.2]
  - - [1024, 2560, 1, 1024, 1024, 1024, 1024, 1024]
    - [4, 30355.4]
  - - [1536, 2560, 1, 1024, 1536, 1536, 1024, 1024]
    - [5, 31825.9]
  - - [2048, 2560, 1, 1024, 2048, 2048, 1024, 1024]
    - [11, 33087.3]
  - - [2560, 2560, 1, 1024, 2560, 2560, 1024, 1024]
    - [14, 33705.5]
  - - [3072, 2560, 1, 1024, 3072, 3072, 1024, 1024]
    - [11, 34605.4]
  - - [512, 3072, 1, 1024, 512, 512, 1024, 1024]
    - [4, 27532.1]
  - - [1024, 3072, 1, 1024, 1024, 1024, 1024, 1024]
    - [4, 32131.0]
  - - [1536, 3072, 1, 1024, 1536, 1536, 1024, 1024]
    - [11, 33140.5]
  - - [2048, 3072, 1, 1024, 2048, 2048, 1024, 1024]
    - [11, 33821.8]
  - - [2560, 3072, 1, 1024, 2560, 2560, 1024, 1024]
    - [4, 34302.5]
  - - [3072, 3072, 1, 1024, 3072, 3072, 1024, 1024]
    - [4, 35045.4]
  - - [512, 512, 1, 2048, 512, 512, 2048, 2048]
    - [9, 16169.8]
  - - [1024, 512, 1, 2048, 1024, 1024, 2048, 2048]
    - [14, 24851.4]
  - - [1536, 512, 1, 2048, 1536, 1536, 2048, 2048]
    - [4, 24372.2]
  - - [2048, 512, 1, 2048, 2048, 2048, 2048, 2048]
    - [14, 29306.2]
  - - [2560, 512, 1, 2048, 2560, 2560, 2048, 2048]
    - [4, 28005.9]
  - - [3072, 512, 1, 2048, 3072, 3072, 2048, 2048]
    - [14, 32432.3]
  - - [512, 1024, 1, 2048, 512, 512, 2048, 2048]
    - [4, 24825.8]
  - - [1024, 1024, 1, 2048, 1024, 1024, 2048, 2048]
    - [14, 30425.4]
  - - [1536, 1024, 1, 2048, 1536, 1536, 2048, 2048]
    - [4, 31817.7]
  - - [2048, 1024, 1, 2048, 2048, 2048, 2048, 2048]
    - [4, 33788.4]
  - - [2560, 1024, 1, 2048, 2560, 2560, 2048, 2048]
    - [0, 33934.7]
  - - [3072, 1024, 1, 2048, 3072, 3072, 2048, 2048]
    - [14, 34395.2]
  - - [512, 1536, 1, 2048, 512, 512, 2048, 2048]
    - [4, 25102.9]
  - - [1024, 1536, 1, 2048, 1024, 1024, 2048, 2048]
    - [4, 32119.7]
  - - [1536, 1536, 1, 2048, 1536, 1536, 2048, 2048]
    - [4, 31957.9]
  - - [2048, 1536, 1, 2048, 2048, 2048, 2048, 2048]
    - [14, 34209.5]
  - - [2560, 1536, 1, 2048, 2560, 2560, 2048, 2048]
    - [14, 33886.7]
  - - [3072, 1536, 1, 2048, 3072, 3072, 2048, 2048]
    - [4, 35971.3]
  - - [512, 2048, 1, 2048, 512, 512, 2048, 2048]
    - [14, 30215.2]
  - - [1024, 2048, 1, 2048, 1024, 1024, 2048, 2048]
    - [4, 34108.3]
  - - [1536, 2048, 1, 2048, 1536, 1536, 2048, 2048]
    - [4, 34635.2]
  - - [2048, 2048, 1, 2048, 2048, 2048, 2048, 2048]
    - [14, 34885.5]
  - - [2560, 2048, 1, 2048, 2560, 2560, 2048, 2048]
    - [11, 35650.0]
  - - [3072, 2048, 1, 2048, 3072, 3072, 2048, 2048]
    - [11, 35634.6]
  - - [512, 2560, 1, 2048, 512, 512, 2048, 2048]
    - [4, 28351.1]
  - - [1024, 2560, 1, 2048, 1024, 1024, 2048, 2048]
    - [14, 33854.3]
  - - [1536, 2560, 1, 2048, 1536, 1536, 2048, 2048]
    - [11, 33820.6]
  - - [2048, 2560, 1, 2048, 2048, 2048, 2048, 2048]
    - [14, 36288.5]
  - - [2560, 2560, 1, 2048, 2560, 2560, 2048, 2048]
    - [11, 35653.9]
  - - [3072, 2560, 1, 2048, 3072, 3072, 2048, 2048]
    - [14, 36201.2]
  - - [512, 3072, 1, 2048, 512, 512, 2048, 2048]
    - [4, 31858.6]
  - - [1024, 3072, 1, 2048, 1024, 1024, 2048, 2048]
    - [11, 35061.1]
  - - [1536, 3072, 1, 2048, 1536, 1536, 2048, 2048]
    - [4, 35211.0]
  - - [2048, 3072, 1, 2048, 2048, 2048, 2048, 2048]
    - [14, 35905.8]
  - - [2560, 3072, 1, 2048, 2560, 2560, 2048, 2048]
    - [4, 36054.7]
  - - [3072, 3072, 1, 2048, 3072, 3072, 2048, 2048]
    - [4, 36216.9]
  - - [512, 512, 1, 3072, 512, 512, 3072, 3072]
    - [10, 19004.5]
  - - [1024, 512, 1, 3072, 1024, 1024, 3072, 3072]
    - [14, 27527.1]
  - - [1536, 512, 1, 3072, 1536, 1536, 3072, 3072]
    - [4, 25795.7]
  - - [2048, 512, 1, 3072, 2048, 2048, 3072, 3072]
    - [4, 32044.5]
  - - [2560, 512, 1, 3072, 2560, 2560, 3072, 3072]
    - [14, 30219.0]
  - - [3072, 512, 1, 3072, 3072, 3072, 3072, 3072]
    - [4, 34181.0]
  - - [512, 1024, 1, 3072, 512, 512, 3072, 3072]
    - [11, 28350.1]
  - - [1024, 1024, 1, 3072, 1024, 1024, 3072, 3072]
    - [4, 32180.7]
  - - [1536, 1024, 1, 3072, 1536, 1536, 3072, 3072]
    - [0, 33628.1]
  - - [2048, 1024, 1, 3072, 2048, 2048, 3072, 3072]
    - [0, 34775.6]
  - - [2560, 1024, 1, 3072, 2560, 2560, 3072, 3072]
    - [11, 35323.9]
  - - [3072, 1024, 1, 3072, 3072, 3072, 3072, 3072]
    - [4, 35638.4]
  - - [512, 1536, 1, 3072, 512, 512, 3072, 3072]
    - [5, 26814.1]
  - - [1024, 1536, 1, 3072, 1024, 1024, 3072, 3072]
    - [14, 34622.7]
  - - [1536, 1536, 1, 3072, 1536, 1536, 3072, 3072]
    - [16, 32922.1]
  - - [2048, 1536, 1, 3072, 2048, 2048, 3072, 3072]
    - [14, 35358.2]
  - - [2560, 1536, 1, 3072, 2560, 2560, 3072, 3072]
    - [11, 35012.1]
  - - [3072, 1536, 1, 3072, 3072, 3072, 3072, 3072]
    - [14, 36411.9]
  - - [512, 2048, 1, 3072, 512, 512, 3072, 3072]
    - [0, 32070.0]
  - - [1024, 2048, 1, 3072, 1024, 1024, 3072, 3072]
    - [4, 34241.3]
  - - [1536, 2048, 1, 3072, 1536, 1536, 3072, 3072]
    - [14, 36570.0]
  - - [2048, 2048, 1, 3072, 2048, 2048, 3072, 3072]
    - [0, 35963.5]
  - - [2560, 2048, 1, 3072, 2560, 2560, 3072, 3072]
    - [4, 36374.6]
  - - [3072, 2048, 1, 3072, 3072, 3072, 3072, 3072]
    - [4, 36581.9]
  - - [512, 2560, 1, 3072, 512, 512, 3072, 3072]
    - [16, 30527.7]
  - - [1024, 2560, 1, 3072, 1024, 1024, 3072, 3072]
    - [14, 35292.8]
  - - [1536, 2560, 1, 3072, 1536, 1536, 3072, 3072]
    - [5, 34731.7]
  - - [2048, 2560, 1, 3072, 2048, 2048, 3072, 3072]
    - [4, 36425.2]
  - - [2560, 2560, 1, 3072, 2560, 2560, 3072, 3072]
    - [5, 35627.9]
  - - [3072, 2560, 1, 3072, 3072, 3072, 3072, 3072]
    - [4, 37042.9]
  - - [512, 3072, 1, 3072, 512, 512, 3072, 3072]
    - [4, 33981.1]
  - - [1024, 3072, 1, 3072, 1024, 1024, 3072, 3072]
    - [4, 35664.2]
  - - [1536, 3072, 1, 3072, 1536, 1536, 3072, 3072]
    - [11, 36750.4]
  - - [2048, 3072, 1, 3072, 2048, 2048, 3072, 3072]
    - [4, 36458.7]
  - - [2560, 3072, 1, 3072, 2560, 2560, 3072, 3072]
    - [14, 36624.6]
  - - [3072, 3072, 1, 3072, 3072, 3072, 3072, 3072]
    - [0, 37078.8]
  - - [1, 1, 1, 1, 1, 1, 1, 1]
    - [9, 6.64297e-05]
  - - [1, 1, 1, 64, 1, 1, 64, 64]
    - [7, 0.00428151]
  - - [1, 64, 1, 1, 1, 1, 1, 1]
    - [8, 0.00424868]
  - - [64, 1, 1, 1, 64, 64, 1, 1]
    - [8, 0.00427722]
  - - [64, 64, 1, 1, 64, 64, 1, 1]
    - [10, 0.276141]
  - - [64, 1, 1, 64, 64, 64, 64, 64]
    - [10, 0.273468]
  - - [1, 64, 1, 64, 1, 1, 64, 64]
    - [7, 0.271834]
  - - [64, 64, 1, 64, 64, 64, 64, 64]
    - [10, 17.8603]
  - - [64, 64, 1, 256, 64, 64, 256, 256]
    - [9, 66.4729]
  - - [64, 64, 1, 512, 64, 64, 512, 512]
    - [10, 122.016]
  - - [64, 64, 1, 1024, 64, 64, 1024, 1024]
    - [6, 207.3]
  - - [64, 64, 1, 2048, 64, 64, 2048, 2048]
    - [17, 321.107]
  - - [64, 64, 1, 4096, 64, 64, 4096, 4096]
    - [17, 451.243]
- null
- null
- DeviceEfficiency
- GridBased
