library/src/amd_detail/rocblaslt/src/Tensile/Logic/asm_full/gfx1200/GridBased/gfx1200_Cijk_Alik_Bljk_BSS_BH_Bias_HAS_SAV_UserArgs.yaml
- {MinimumRequiredVersion: 4.33.0}
- gfx1200
- gfx1200
- [Device 73f0]
    SolutionIndex: 0
    SolutionNameMin: Cijk_Alik_Bljk_BSS_BH_Bias_HAS_SAV_UserArgs_MT32x32x32_MI16x16x1_SN_CLR0_GSU1_LBSPPA128_LBSPPB128_MIWT1_1_PGR1_PLR0_SS0_SU32_SUM0_SUS256_SVW8_TLDS1_WG32_4_1_WGM8
    SolutionIndex: 1
    SolutionNameMin: Cijk_Alik_Bljk_BSS_BH_Bias_HAS_SAV_UserArgs_MT64x32x32_MI16x16x1_SN_CLR1_GSU1_LBSPPA128_LBSPPB128_MIWT2_1_PGR1_PLR1_SS0_SU32_SUM0_SUS256_SVW8_TLDS1_WG32_4_1_WGM8
    SolutionIndex: 2
    SolutionNameMin: Cijk_Alik_Bljk_BSS_BH_Bias_HAS_SAV_UserArgs_MT64x32x32_MI16x16x1_SN_CLR1_GSU1_LBSPPA128_LBSPPB128_MIWT2_1_PGR2_PLR1_SS0_SU32_SUM0_SUS256_SVW8_TLDS1_WG32_4_1_WGM8
    SolutionIndex: 3
    SolutionNameMin: Cijk_Alik_Bljk_BSS_BH_Bias_HAS_SAV_UserArgs_MT64x32x32_MI16x16x1_SN_CLR0_GSU1_LBSPPA128_LBSPPB128_MIWT2_1_PGR1_PLR0_SS0_SU32_SUM0_SUS256_SVW8_TLDS1_WG32_4_1_WGM8
    SolutionIndex: 4
    SolutionNameMin: Cijk_Alik_Bljk_BSS_BH_Bias_HAS_SAV_UserArgs_MT32x64x32_MI16x16x1_SN_CLR1_GSU1_LBSPPA128_LBSPPB128_MIWT2_1_PGR1_PLR1_SS0_SU32_SUM0_SUS256_SVW8_TLDS1_WG16_8_1_WGM8
    SolutionIndex: 5
    SolutionNameMin: Cijk_Alik_Bljk_BSS_BH_Bias_HAS_SAV_UserArgs_MT32x64x32_MI16x16x1_SN_CLR0_GSU1_LBSPPA128_LBSPPB128_MIWT2_1_PGR1_PLR0_SS0_SU32_SUM0_SUS256_SVW8_TLDS1_WG16_8_1_WGM8
    SolutionIndex: 6
    SolutionNameMin: Cijk_Alik_Bljk_BSS_BH_Bias_HAS_SAV_UserArgs_MT64x16x32_MI16x16x1_SN_CLR1_GSU1_LBSPPA128_LBSPPB128_MIWT1_1_PGR2_PLR1_SS1_SU32_SUM0_SUS256_SVW1_TLDS1_WG64_2_1_WGM8
    SolutionIndex: 7
    SolutionNameMin: Cijk_Alik_Bljk_BSS_BH_Bias_HAS_SAV_UserArgs_MT64x16x32_MI16x16x1_SN_CLR0_GSU1_LBSPPA128_LBSPPB128_MIWT1_1_PGR1_PLR0_SS1_SU32_SUM0_SUS256_SVW1_TLDS1_WG64_2_1_WGM8
    SolutionIndex: 8
    SolutionNameMin: Cijk_Alik_Bljk_BSS_BH_Bias_HAS_SAV_UserArgs_MT32x32x32_MI16x16x1_SN_CLR1_GSU1_LBSPPA128_LBSPPB128_MIWT1_1_PGR1_PLR1_SS1_SU32_SUM0_SUS256_SVW1_TLDS1_WG32_4_1_WGM8
    SolutionIndex: 9
    SolutionNameMin: Cijk_Alik_Bljk_BSS_BH_Bias_HAS_SAV_UserArgs_MT32x32x32_MI16x16x1_SN_CLR0_GSU1_LBSPPA512_LBSPPB512_MIWT1_1_PGR1_PLR0_SS1_SU32_SUM0_SUS256_SVW1_TLDS0_WG32_4_1_WGM8
    SolutionIndex: 10
    SolutionNameMin: Cijk_Alik_Bljk_BSS_BH_Bias_HAS_SAV_UserArgs_MT32x32x32_MI16x16x1_SN_CLR0_GSU1_LBSPPA128_LBSPPB128_MIWT1_1_PGR1_PLR0_SS1_SU32_SUM0_SUS256_SVW1_TLDS1_WG32_4_1_WGM8
    SolutionIndex: 11
    SolutionNameMin: Cijk_Alik_Bljk_BSS_BH_Bias_HAS_SAV_UserArgs_MT64x32x32_MI16x16x1_SN_CLR1_GSU1_LBSPPA128_LBSPPB128_MIWT2_1_PGR1_PLR1_SS1_SU32_SUM0_SUS256_SVW1_TLDS1_WG32_4_1_WGM8
    SolutionIndex: 12
    SolutionNameMin: Cijk_Alik_Bljk_BSS_BH_Bias_HAS_SAV_UserArgs_MT64x32x32_MI16x16x1_SN_CLR1_GSU1_LBSPPA128_LBSPPB128_MIWT2_1_PGR2_PLR1_SS1_SU32_SUM0_SUS256_SVW1_TLDS1_WG32_4_1_WGM8
    SolutionIndex: 13
    SolutionNameMin: Cijk_Alik_Bljk_BSS_BH_Bias_HAS_SAV_UserArgs_MT64x32x32_MI16x16x1_SN_CLR0_GSU1_LBSPPA128_LBSPPB128_MIWT2_1_PGR1_PLR0_SS1_SU32_SUM0_SUS256_SVW1_TLDS1_WG32_4_1_WGM8
    SolutionIndex: 14
    SolutionNameMin: Cijk_Alik_Bljk_BSS_BH_Bias_HAS_SAV_UserArgs_MT64x32x32_MI16x16x1_SN_CLR0_GSU1_LBSPPA128_LBSPPB128_MIWT2_1_PGR2_PLR0_SS1_SU32_SUM0_SUS256_SVW1_TLDS1_WG32_4_1_WGM8
    SolutionIndex: 15
    SolutionNameMin: Cijk_Alik_Bljk_BSS_BH_Bias_HAS_SAV_UserArgs_MT16x64x32_MI16x16x1_SN_CLR0_GSU1_LBSPPA128_LBSPPB128_MIWT1_1_PGR2_PLR0_SS1_SU32_SUM0_SUS256_SVW1_TLDS1_WG16_8_1_WGM8
    SolutionIndex: 16
    SolutionNameMin: Cijk_Alik_Bljk_BSS_BH_Bias_HAS_SAV_UserArgs_MT32x64x32_MI16x16x1_SN_CLR1_GSU1_LBSPPA128_LBSPPB128_MIWT2_1_PGR1_PLR1_SS1_SU32_SUM0_SUS256_SVW1_TLDS1_WG16_8_1_WGM8
    SolutionIndex: 17
    SolutionNameMin: Cijk_Alik_Bljk_BSS_BH_Bias_HAS_SAV_UserArgs_MT32x64x32_MI16x16x1_SN_CLR1_GSU1_LBSPPA128_LBSPPB128_MIWT2_1_PGR2_PLR1_SS1_SU32_SUM0_SUS256_SVW1_TLDS1_WG16_8_1_WGM8
    SolutionIndex: 18
    SolutionNameMin: Cijk_Alik_Bljk_BSS_BH_Bias_HAS_SAV_UserArgs_MT32x64x32_MI16x16x1_SN_CLR0_GSU1_LBSPPA128_LBSPPB128_MIWT2_1_PGR1_PLR0_SS1_SU32_SUM0_SUS256_SVW1_TLDS1_WG16_8_1_WGM8
    SolutionIndex: 19
    SolutionNameMin: Cijk_Alik_Bljk_BSS_BH_Bias_HAS_SAV_UserArgs_MT32x32x64_MI16x16x1_SN_CLR1_GSU1_LBSPPA128_LBSPPB128_MIWT1_1_PGR1_PLR1_SS1_SU32_SUM0_SUS256_SVW1_TLDS1_WG32_4_1_WGM8
    SolutionIndex: 20
    SolutionNameMin: Cijk_Alik_Bljk_BSS_BH_Bias_HAS_SAV_UserArgs_MT32x32x64_MI16x16x1_SN_CLR1_GSU1_LBSPPA128_LBSPPB128_MIWT1_1_PGR1_PLR3_SS1_SU32_SUM0_SUS256_SVW1_TLDS1_WG32_4_1_WGM8
    SolutionIndex: 21
    SolutionNameMin: Cijk_Alik_Bljk_BSS_BH_Bias_HAS_SAV_UserArgs_MT32x32x64_MI16x16x1_SN_CLR0_GSU1_LBSPPA128_LBSPPB128_MIWT1_1_PGR1_PLR0_SS1_SU32_SUM0_SUS256_SVW1_TLDS1_WG32_4_1_WGM8
    SolutionIndex: 22
    SolutionNameMin: Cijk_Alik_Bljk_BSS_BH_Bias_HAS_SAV_UserArgs_MT32x32x64_MI16x16x1_SN_CLR0_GSU1_LBSPPA128_LBSPPB128_MIWT1_1_PGR2_PLR0_SS1_SU32_SUM0_SUS256_SVW1_TLDS1_WG32_4_1_WGM8
- - - [512, 512, 1, 64, 512, 512, 64, 64]
    - [12, 1079.3]
  - - [1024, 512, 1, 64, 1024, 1024, 64, 64]
    - [14, 2082.77]
  - - [1536, 512, 1, 64, 1536, 1536, 64, 64]
    - [17, 2892.21]
  - - [2048, 512, 1, 64, 2048, 2048, 64, 64]
    - [13, 3539.4]
  - - [2560, 512, 1, 64, 2560, 2560, 64, 64]
    - [13, 4421.81]
  - - [3072, 512, 1, 64, 3072, 3072, 64, 64]
    - [12, 4884.55]
  - - [512, 1024, 1, 64, 512, 512, 64, 64]
    - [11, 2155.21]
  - - [1024, 1024, 1, 64, 1024, 1024, 64, 64]
    - [16, 3558.17]
  - - [1536, 1024, 1, 64, 1536, 1536, 64, 64]
    - [3, 4695.01]
  - - [2048, 1024, 1, 64, 2048, 2048, 64, 64]
    - [18, 6179.17]
  - - [2560, 1024, 1, 64, 2560, 2560, 64, 64]
    - [1, 7287.15]
  - - [3072, 1024, 1, 64, 3072, 3072, 64, 64]
    - [16, 7844.86]
  - - [512, 1536, 1, 64, 512, 512, 64, 64]
    - [16, 2963.91]
  - - [1024, 1536, 1, 64, 1024, 1024, 64, 64]
    - [13, 4738.21]
  - - [1536, 1536, 1, 64, 1536, 1536, 64, 64]
    - [3, 6367.2]
  - - [2048, 1536, 1, 64, 2048, 2048, 64, 64]
    - [18, 8173.71]
  - - [2560, 1536, 1, 64, 2560, 2560, 64, 64]
    - [1, 9427.17]
  - - [3072, 1536, 1, 64, 3072, 3072, 64, 64]
    - [11, 10306.8]
  - - [512, 2048, 1, 64, 512, 512, 64, 64]
    - [4, 3771.54]
  - - [1024, 2048, 1, 64, 1024, 1024, 64, 64]
    - [16, 6176.33]
  - - [1536, 2048, 1, 64, 1536, 1536, 64, 64]
    - [1, 8242.31]
  - - [2048, 2048, 1, 64, 2048, 2048, 64, 64]
    - [2, 9144.45]
  - - [2560, 2048, 1, 64, 2560, 2560, 64, 64]
    - [1, 11221.7]
  - - [3072, 2048, 1, 64, 3072, 3072, 64, 64]
    - [16, 12096.2]
  - - [512, 2560, 1, 64, 512, 512, 64, 64]
    - [16, 4206.4]
  - - [1024, 2560, 1, 64, 1024, 1024, 64, 64]
    - [2, 7162.4]
  - - [1536, 2560, 1, 64, 1536, 1536, 64, 64]
    - [16, 9106.01]
  - - [2048, 2560, 1, 64, 2048, 2048, 64, 64]
    - [2, 10380.0]
  - - [2560, 2560, 1, 64, 2560, 2560, 64, 64]
    - [1, 12407.9]
  - - [3072, 2560, 1, 64, 3072, 3072, 64, 64]
    - [17, 13146.1]
  - - [512, 3072, 1, 64, 512, 512, 64, 64]
    - [4, 5077.08]
  - - [1024, 3072, 1, 64, 1024, 1024, 64, 64]
    - [4, 8175.37]
  - - [1536, 3072, 1, 64, 1536, 1536, 64, 64]
    - [2, 10515.3]
  - - [2048, 3072, 1, 64, 2048, 2048, 64, 64]
    - [1, 11950.6]
  - - [2560, 3072, 1, 64, 2560, 2560, 64, 64]
    - [1, 13526.4]
  - - [3072, 3072, 1, 64, 3072, 3072, 64, 64]
    - [2, 14089.9]
  - - [512, 512, 1, 256, 512, 512, 256, 256]
    - [13, 4081.8]
  - - [1024, 512, 1, 256, 1024, 1024, 256, 256]
    - [11, 6999.26]
  - - [1536, 512, 1, 256, 1536, 1536, 256, 256]
    - [11, 9296.79]
  - - [2048, 512, 1, 256, 2048, 2048, 256, 256]
    - [16, 10980.8]
  - - [2560, 512, 1, 256, 2560, 2560, 256, 256]
    - [16, 12635.8]
  - - [3072, 512, 1, 256, 3072, 3072, 256, 256]
    - [11, 13872.9]
  - - [512, 1024, 1, 256, 512, 512, 256, 256]
    - [13, 7377.03]
  - - [1024, 1024, 1, 256, 1024, 1024, 256, 256]
    - [11, 11509.2]
  - - [1536, 1024, 1, 256, 1536, 1536, 256, 256]
    - [1, 14587.8]
  - - [2048, 1024, 1, 256, 2048, 2048, 256, 256]
    - [16, 16827.2]
  - - [2560, 1024, 1, 256, 2560, 2560, 256, 256]
    - [16, 18681.6]
  - - [3072, 1024, 1, 256, 3072, 3072, 256, 256]
    - [16, 20205.9]
  - - [512, 1536, 1, 256, 512, 512, 256, 256]
    - [4, 8968.98]
  - - [1024, 1536, 1, 256, 1024, 1024, 256, 256]
    - [11, 14619.9]
  - - [1536, 1536, 1, 256, 1536, 1536, 256, 256]
    - [16, 17114.0]
  - - [2048, 1536, 1, 256, 2048, 2048, 256, 256]
    - [16, 19552.4]
  - - [2560, 1536, 1, 256, 2560, 2560, 256, 256]
    - [16, 21966.4]
  - - [3072, 1536, 1, 256, 3072, 3072, 256, 256]
    - [11, 22759.7]
  - - [512, 2048, 1, 256, 512, 512, 256, 256]
    - [4, 11113.0]
  - - [1024, 2048, 1, 256, 1024, 1024, 256, 256]
    - [16, 17003.3]
  - - [1536, 2048, 1, 256, 1536, 1536, 256, 256]
    - [4, 19511.9]
  - - [2048, 2048, 1, 256, 2048, 2048, 256, 256]
    - [16, 22624.4]
  - - [2560, 2048, 1, 256, 2560, 2560, 256, 256]
    - [1, 24269.1]
  - - [3072, 2048, 1, 256, 3072, 3072, 256, 256]
    - [11, 25416.4]
  - - [512, 2560, 1, 256, 512, 512, 256, 256]
    - [1, 12834.5]
  - - [1024, 2560, 1, 256, 1024, 1024, 256, 256]
    - [16, 18076.5]
  - - [1536, 2560, 1, 256, 1536, 1536, 256, 256]
    - [16, 21811.3]
  - - [2048, 2560, 1, 256, 2048, 2048, 256, 256]
    - [11, 24205.6]
  - - [2560, 2560, 1, 256, 2560, 2560, 256, 256]
    - [1, 25946.2]
  - - [3072, 2560, 1, 256, 3072, 3072, 256, 256]
    - [11, 26787.8]
  - - [512, 3072, 1, 256, 512, 512, 256, 256]
    - [16, 14724.1]
  - - [1024, 3072, 1, 256, 1024, 1024, 256, 256]
    - [18, 19604.8]
  - - [1536, 3072, 1, 256, 1536, 1536, 256, 256]
    - [1, 23514.0]
  - - [2048, 3072, 1, 256, 2048, 2048, 256, 256]
    - [16, 25474.7]
  - - [2560, 3072, 1, 256, 2560, 2560, 256, 256]
    - [16, 26873.6]
  - - [3072, 3072, 1, 256, 3072, 3072, 256, 256]
    - [16, 27734.6]
  - - [512, 512, 1, 512, 512, 512, 512, 512]
    - [8, 7097.52]
  - - [1024, 512, 1, 512, 1024, 1024, 512, 512]
    - [16, 12131.9]
  - - [1536, 512, 1, 512, 1536, 1536, 512, 512]
    - [11, 14514.2]
  - - [2048, 512, 1, 512, 2048, 2048, 512, 512]
    - [16, 16848.6]
  - - [2560, 512, 1, 512, 2560, 2560, 512, 512]
    - [11, 18364.1]
  - - [3072, 512, 1, 512, 3072, 3072, 512, 512]
    - [16, 21303.8]
  - - [512, 1024, 1, 512, 512, 512, 512, 512]
    - [16, 12338.5]
  - - [1024, 1024, 1, 512, 1024, 1024, 512, 512]
    - [4, 17572.1]
  - - [1536, 1024, 1, 512, 1536, 1536, 512, 512]
    - [4, 20274.8]
  - - [2048, 1024, 1, 512, 2048, 2048, 512, 512]
    - [16, 22836.6]
  - - [2560, 1024, 1, 512, 2560, 2560, 512, 512]
    - [1, 24698.7]
  - - [3072, 1024, 1, 512, 3072, 3072, 512, 512]
    - [1, 25791.5]
  - - [512, 1536, 1, 512, 512, 512, 512, 512]
    - [1, 14697.2]
  - - [1024, 1536, 1, 512, 1024, 1024, 512, 512]
    - [4, 21180.3]
  - - [1536, 1536, 1, 512, 1536, 1536, 512, 512]
    - [1, 23734.1]
  - - [2048, 1536, 1, 512, 2048, 2048, 512, 512]
    - [16, 26499.5]
  - - [2560, 1536, 1, 512, 2560, 2560, 512, 512]
    - [1, 27743.7]
  - - [3072, 1536, 1, 512, 3072, 3072, 512, 512]
    - [1, 29107.1]
  - - [512, 2048, 1, 512, 512, 512, 512, 512]
    - [16, 17921.7]
  - - [1024, 2048, 1, 512, 1024, 1024, 512, 512]
    - [18, 23410.4]
  - - [1536, 2048, 1, 512, 1536, 1536, 512, 512]
    - [11, 26175.8]
  - - [2048, 2048, 1, 512, 2048, 2048, 512, 512]
    - [11, 29200.2]
  - - [2560, 2048, 1, 512, 2560, 2560, 512, 512]
    - [11, 29938.1]
  - - [3072, 2048, 1, 512, 3072, 3072, 512, 512]
    - [11, 30403.4]
  - - [512, 2560, 1, 512, 512, 512, 512, 512]
    - [16, 18660.5]
  - - [1024, 2560, 1, 512, 1024, 1024, 512, 512]
    - [1, 25176.8]
  - - [1536, 2560, 1, 512, 1536, 1536, 512, 512]
    - [16, 27491.4]
  - - [2048, 2560, 1, 512, 2048, 2048, 512, 512]
    - [18, 29576.2]
  - - [2560, 2560, 1, 512, 2560, 2560, 512, 512]
    - [11, 30720.3]
  - - [3072, 2560, 1, 512, 3072, 3072, 512, 512]
    - [11, 31352.8]
  - - [512, 3072, 1, 512, 512, 512, 512, 512]
    - [11, 21391.8]
  - - [1024, 3072, 1, 512, 1024, 1024, 512, 512]
    - [16, 26708.7]
  - - [1536, 3072, 1, 512, 1536, 1536, 512, 512]
    - [4, 29009.1]
  - - [2048, 3072, 1, 512, 2048, 2048, 512, 512]
    - [16, 30400.7]
  - - [2560, 3072, 1, 512, 2560, 2560, 512, 512]
    - [1, 31269.9]
  - - [3072, 3072, 1, 512, 3072, 3072, 512, 512]
    - [1, 32104.6]
  - - [512, 512, 1, 1024, 512, 512, 1024, 1024]
    - [8, 11336.2]
  - - [1024, 512, 1, 1024, 1024, 1024, 1024, 1024]
    - [11, 17921.7]
  - - [1536, 512, 1, 1024, 1536, 1536, 1024, 1024]
    - [18, 20042.2]
  - - [2048, 512, 1, 1024, 2048, 2048, 1024, 1024]
    - [11, 23813.6]
  - - [2560, 512, 1, 1024, 2560, 2560, 1024, 1024]
    - [16, 24542.7]
  - - [3072, 512, 1, 1024, 3072, 3072, 1024, 1024]
    - [16, 27187.2]
  - - [512, 1024, 1, 1024, 512, 512, 1024, 1024]
    - [16, 17987.7]
  - - [1024, 1024, 1, 1024, 1024, 1024, 1024, 1024]
    - [16, 24165.1]
  - - [1536, 1024, 1, 1024, 1536, 1536, 1024, 1024]
    - [4, 27395.8]
  - - [2048, 1024, 1, 1024, 2048, 2048, 1024, 1024]
    - [11, 28928.4]
  - - [2560, 1024, 1, 1024, 2560, 2560, 1024, 1024]
    - [16, 30165.7]
  - - [3072, 1024, 1, 1024, 3072, 3072, 1024, 1024]
    - [1, 31743.9]
  - - [512, 1536, 1, 1024, 512, 512, 1024, 1024]
    - [11, 20400.7]
  - - [1024, 1536, 1, 1024, 1024, 1024, 1024, 1024]
    - [4, 27384.2]
  - - [1536, 1536, 1, 1024, 1536, 1536, 1024, 1024]
    - [11, 28434.3]
  - - [2048, 1536, 1, 1024, 2048, 2048, 1024, 1024]
    - [11, 31135.1]
  - - [2560, 1536, 1, 1024, 2560, 2560, 1024, 1024]
    - [1, 32165.9]
  - - [3072, 1536, 1, 1024, 3072, 3072, 1024, 1024]
    - [11, 33346.6]
  - - [512, 2048, 1, 1024, 512, 512, 1024, 1024]
    - [16, 24214.2]
  - - [1024, 2048, 1, 1024, 1024, 1024, 1024, 1024]
    - [16, 29097.3]
  - - [1536, 2048, 1, 1024, 1536, 1536, 1024, 1024]
    - [1, 31522.8]
  - - [2048, 2048, 1, 1024, 2048, 2048, 1024, 1024]
    - [5, 32094.7]
  - - [2560, 2048, 1, 1024, 2560, 2560, 1024, 1024]
    - [4, 33138.2]
  - - [3072, 2048, 1, 1024, 3072, 3072, 1024, 1024]
    - [1, 34442.1]
  - - [512, 2560, 1, 1024, 512, 512, 1024, 1024]
    - [1, 24114.1]
  - - [1024, 2560, 1, 1024, 1024, 1024, 1024, 1024]
    - [4, 30388.0]
  - - [1536, 2560, 1, 1024, 1536, 1536, 1024, 1024]
    - [1, 31741.6]
  - - [2048, 2560, 1, 1024, 2048, 2048, 1024, 1024]
    - [11, 33046.3]
  - - [2560, 2560, 1, 1024, 2560, 2560, 1024, 1024]
    - [11, 33499.7]
  - - [3072, 2560, 1, 1024, 3072, 3072, 1024, 1024]
    - [1, 34028.9]
  - - [512, 3072, 1, 1024, 512, 512, 1024, 1024]
    - [4, 26936.7]
  - - [1024, 3072, 1, 1024, 1024, 1024, 1024, 1024]
    - [16, 31858.6]
  - - [1536, 3072, 1, 1024, 1536, 1536, 1024, 1024]
    - [1, 33215.7]
  - - [2048, 3072, 1, 1024, 2048, 2048, 1024, 1024]
    - [11, 33848.5]
  - - [2560, 3072, 1, 1024, 2560, 2560, 1024, 1024]
    - [16, 34407.6]
  - - [3072, 3072, 1, 1024, 3072, 3072, 1024, 1024]
    - [4, 34741.7]
  - - [512, 512, 1, 2048, 512, 512, 2048, 2048]
    - [8, 15661.6]
  - - [1024, 512, 1, 2048, 1024, 1024, 2048, 2048]
    - [16, 24831.3]
  - - [1536, 512, 1, 2048, 1536, 1536, 2048, 2048]
    - [4, 24713.3]
  - - [2048, 512, 1, 2048, 2048, 2048, 2048, 2048]
    - [16, 29695.8]
  - - [2560, 512, 1, 2048, 2560, 2560, 2048, 2048]
    - [11, 28116.1]
  - - [3072, 512, 1, 2048, 3072, 3072, 2048, 2048]
    - [4, 31553.9]
  - - [512, 1024, 1, 2048, 512, 512, 2048, 2048]
    - [16, 25261.5]
  - - [1024, 1024, 1, 2048, 1024, 1024, 2048, 2048]
    - [4, 29240.1]
  - - [1536, 1024, 1, 2048, 1536, 1536, 2048, 2048]
    - [4, 31632.9]
  - - [2048, 1024, 1, 2048, 2048, 2048, 2048, 2048]
    - [16, 32718.2]
  - - [2560, 1024, 1, 2048, 2560, 2560, 2048, 2048]
    - [4, 33326.9]
  - - [3072, 1024, 1, 2048, 3072, 3072, 2048, 2048]
    - [4, 34185.0]
  - - [512, 1536, 1, 2048, 512, 512, 2048, 2048]
    - [16, 25215.1]
  - - [1024, 1536, 1, 2048, 1024, 1024, 2048, 2048]
    - [16, 32061.9]
  - - [1536, 1536, 1, 2048, 1536, 1536, 2048, 2048]
    - [11, 31735.0]
  - - [2048, 1536, 1, 2048, 2048, 2048, 2048, 2048]
    - [16, 33882.4]
  - - [2560, 1536, 1, 2048, 2560, 2560, 2048, 2048]
    - [16, 34701.6]
  - - [3072, 1536, 1, 2048, 3072, 3072, 2048, 2048]
    - [16, 34745.0]
  - - [512, 2048, 1, 2048, 512, 512, 2048, 2048]
    - [11, 29953.3]
  - - [1024, 2048, 1, 2048, 1024, 1024, 2048, 2048]
    - [11, 32789.5]
  - - [1536, 2048, 1, 2048, 1536, 1536, 2048, 2048]
    - [16, 34595.1]
  - - [2048, 2048, 1, 2048, 2048, 2048, 2048, 2048]
    - [4, 35114.0]
  - - [2560, 2048, 1, 2048, 2560, 2560, 2048, 2048]
    - [4, 35550.1]
  - - [3072, 2048, 1, 2048, 3072, 3072, 2048, 2048]
    - [16, 35630.1]
  - - [512, 2560, 1, 2048, 512, 512, 2048, 2048]
    - [4, 28213.6]
  - - [1024, 2560, 1, 2048, 1024, 1024, 2048, 2048]
    - [16, 34194.4]
  - - [1536, 2560, 1, 2048, 1536, 1536, 2048, 2048]
    - [11, 33471.8]
  - - [2048, 2560, 1, 2048, 2048, 2048, 2048, 2048]
    - [16, 35198.5]
  - - [2560, 2560, 1, 2048, 2560, 2560, 2048, 2048]
    - [1, 34712.4]
  - - [3072, 2560, 1, 2048, 3072, 3072, 2048, 2048]
    - [4, 35801.3]
  - - [512, 3072, 1, 2048, 512, 512, 2048, 2048]
    - [4, 31739.0]
  - - [1024, 3072, 1, 2048, 1024, 1024, 2048, 2048]
    - [4, 34144.9]
  - - [1536, 3072, 1, 2048, 1536, 1536, 2048, 2048]
    - [16, 35454.4]
  - - [2048, 3072, 1, 2048, 2048, 2048, 2048, 2048]
    - [16, 36113.9]
  - - [2560, 3072, 1, 2048, 2560, 2560, 2048, 2048]
    - [11, 35660.3]
  - - [3072, 3072, 1, 2048, 3072, 3072, 2048, 2048]
    - [16, 35756.9]
  - - [512, 512, 1, 3072, 512, 512, 3072, 3072]
    - [0, 18645.2]
  - - [1024, 512, 1, 3072, 1024, 1024, 3072, 3072]
    - [1, 28257.9]
  - - [1536, 512, 1, 3072, 1536, 1536, 3072, 3072]
    - [4, 26738.2]
  - - [2048, 512, 1, 3072, 2048, 2048, 3072, 3072]
    - [16, 31544.6]
  - - [2560, 512, 1, 3072, 2560, 2560, 3072, 3072]
    - [4, 30254.2]
  - - [3072, 512, 1, 3072, 3072, 3072, 3072, 3072]
    - [1, 33571.8]
  - - [512, 1024, 1, 3072, 512, 512, 3072, 3072]
    - [11, 28058.0]
  - - [1024, 1024, 1, 3072, 1024, 1024, 3072, 3072]
    - [16, 31852.3]
  - - [1536, 1024, 1, 3072, 1536, 1536, 3072, 3072]
    - [4, 33762.2]
  - - [2048, 1024, 1, 3072, 2048, 2048, 3072, 3072]
    - [4, 34992.2]
  - - [2560, 1024, 1, 3072, 2560, 2560, 3072, 3072]
    - [11, 34834.8]
  - - [3072, 1024, 1, 3072, 3072, 3072, 3072, 3072]
    - [4, 36240.2]
  - - [512, 1536, 1, 3072, 512, 512, 3072, 3072]
    - [1, 26487.0]
  - - [1024, 1536, 1, 3072, 1024, 1024, 3072, 3072]
    - [1, 34236.8]
  - - [1536, 1536, 1, 3072, 1536, 1536, 3072, 3072]
    - [18, 33399.3]
  - - [2048, 1536, 1, 3072, 2048, 2048, 3072, 3072]
    - [4, 35129.7]
  - - [2560, 1536, 1, 3072, 2560, 2560, 3072, 3072]
    - [4, 34251.6]
  - - [3072, 1536, 1, 3072, 3072, 3072, 3072, 3072]
    - [11, 36027.5]
  - - [512, 2048, 1, 3072, 512, 512, 3072, 3072]
    - [4, 32245.3]
  - - [1024, 2048, 1, 3072, 1024, 1024, 3072, 3072]
    - [4, 34611.7]
  - - [1536, 2048, 1, 3072, 1536, 1536, 3072, 3072]
    - [4, 35859.6]
  - - [2048, 2048, 1, 3072, 2048, 2048, 3072, 3072]
    - [16, 35531.7]
  - - [2560, 2048, 1, 3072, 2560, 2560, 3072, 3072]
    - [11, 36530.7]
  - - [3072, 2048, 1, 3072, 3072, 3072, 3072, 3072]
    - [4, 36166.5]
  - - [512, 2560, 1, 3072, 512, 512, 3072, 3072]
    - [18, 30271.3]
  - - [1024, 2560, 1, 3072, 1024, 1024, 3072, 3072]
    - [16, 35425.8]
  - - [1536, 2560, 1, 3072, 1536, 1536, 3072, 3072]
    - [1, 34386.0]
  - - [2048, 2560, 1, 3072, 2048, 2048, 3072, 3072]
    - [1, 36022.3]
  - - [2560, 2560, 1, 3072, 2560, 2560, 3072, 3072]
    - [5, 35608.3]
  - - [3072, 2560, 1, 3072, 3072, 3072, 3072, 3072]
    - [1, 36622.7]
  - - [512, 3072, 1, 3072, 512, 512, 3072, 3072]
    - [16, 33389.3]
  - - [1024, 3072, 1, 3072, 1024, 1024, 3072, 3072]
    - [11, 35558.9]
  - - [1536, 3072, 1, 3072, 1536, 1536, 3072, 3072]
    - [4, 35908.7]
  - - [2048, 3072, 1, 3072, 2048, 2048, 3072, 3072]
    - [1, 36109.6]
  - - [2560, 3072, 1, 3072, 2560, 2560, 3072, 3072]
    - [4, 36522.0]
  - - [3072, 3072, 1, 3072, 3072, 3072, 3072, 3072]
    - [4, 36970.6]
  - - [1, 1, 1, 1, 1, 1, 1, 1]
    - [6, 6.55587e-05]
  - - [1, 1, 1, 64, 1, 1, 64, 64]
    - [7, 0.00426581]
  - - [1, 64, 1, 1, 1, 1, 1, 1]
    - [8, 0.00427565]
  - - [64, 1, 1, 1, 64, 64, 1, 1]
    - [15, 0.00413864]
  - - [64, 64, 1, 1, 64, 64, 1, 1]
    - [9, 0.265646]
  - - [64, 1, 1, 64, 64, 64, 64, 64]
    - [22, 0.26385]
  - - [1, 64, 1, 64, 1, 1, 64, 64]
    - [21, 0.271106]
  - - [64, 64, 1, 64, 64, 64, 64, 64]
    - [0, 18.0453]
  - - [64, 64, 1, 256, 64, 64, 256, 256]
    - [10, 66.7054]
  - - [64, 64, 1, 512, 64, 64, 512, 512]
    - [10, 122.623]
  - - [64, 64, 1, 1024, 64, 64, 1024, 1024]
    - [20, 208.542]
  - - [64, 64, 1, 2048, 64, 64, 2048, 2048]
    - [20, 323.155]
  - - [64, 64, 1, 4096, 64, 64, 4096, 4096]
    - [19, 443.121]
- null
- null
- DeviceEfficiency
- GridBased
