library/src/amd_detail/rocblaslt/src/Tensile/Logic/asm_full/gfx1200/GridBased/gfx1200_Cijk_Ailk_Bjlk_HHS_BH_Bias_HAS_AuxH_SAV_UserArgs.yaml
- {MinimumRequiredVersion: 4.33.0}
- gfx1200
- gfx1200
- [Device 73f0]
    SolutionIndex: 0
    SolutionNameMin: Cijk_Ailk_Bjlk_HHS_BH_Bias_HAS_SAV_UserArgs_MT64x16x32_MI16x16x1_SN_CLR0_GSU1_LBSPPA1024_LBSPPB256_MIWT1_1_PGR1_PLR0_SS0_SU32_SUM0_SUS256_SVW8_WG64_2_1_WGM8
    SolutionIndex: 1
    SolutionNameMin: Cijk_Ailk_Bjlk_HHS_BH_Bias_HAS_SAV_UserArgs_MT64x32x32_MI16x16x1_SN_CLR1_GSU1_LBSPPA1024_LBSPPB512_MIWT2_1_PGR1_PLR1_SS0_SU32_SUM0_SUS256_SVW8_WG32_4_1_WGM8
    SolutionIndex: 2
    SolutionNameMin: Cijk_Ailk_Bjlk_HHS_BH_Bias_HAS_SAV_UserArgs_MT64x32x32_MI16x16x1_SN_CLR1_GSU1_LBSPPA1024_LBSPPB512_MIWT2_1_PGR2_PLR1_SS0_SU32_SUM0_SUS256_SVW8_WG32_4_1_WGM8
    SolutionIndex: 3
    SolutionNameMin: Cijk_Ailk_Bjlk_HHS_BH_Bias_HAS_SAV_UserArgs_MT64x32x32_MI16x16x1_SN_CLR0_GSU1_LBSPPA1024_LBSPPB512_MIWT2_1_PGR1_PLR0_SS0_SU32_SUM0_SUS256_SVW8_WG32_4_1_WGM8
    SolutionIndex: 4
    SolutionNameMin: Cijk_Ailk_Bjlk_HHS_BH_Bias_HAS_SAV_UserArgs_MT64x32x32_MI16x16x1_SN_CLR0_GSU1_LBSPPA1024_LBSPPB512_MIWT2_1_PGR2_PLR0_SS0_SU32_SUM0_SUS256_SVW8_WG32_4_1_WGM8
    SolutionIndex: 5
    SolutionNameMin: Cijk_Ailk_Bjlk_HHS_BH_Bias_HAS_SAV_UserArgs_MT32x64x32_MI16x16x1_SN_CLR1_GSU1_LBSPPA512_LBSPPB1024_MIWT2_1_PGR1_PLR1_SS0_SU32_SUM0_SUS256_SVW8_WG16_8_1_WGM8
    SolutionIndex: 6
    SolutionNameMin: Cijk_Ailk_Bjlk_HHS_BH_Bias_HAS_SAV_UserArgs_MT32x64x32_MI16x16x1_SN_CLR1_GSU1_LBSPPA512_LBSPPB1024_MIWT2_1_PGR2_PLR1_SS0_SU32_SUM0_SUS256_SVW8_WG16_8_1_WGM8
    SolutionIndex: 7
    SolutionNameMin: Cijk_Ailk_Bjlk_HHS_BH_Bias_HAS_SAV_UserArgs_MT32x64x32_MI16x16x1_SN_CLR0_GSU1_LBSPPA512_LBSPPB1024_MIWT2_1_PGR1_PLR0_SS0_SU32_SUM0_SUS256_SVW8_WG16_8_1_WGM8
    SolutionIndex: 8
    SolutionNameMin: Cijk_Ailk_Bjlk_HHS_BH_Bias_HAS_SAV_UserArgs_MT32x64x32_MI16x16x1_SN_CLR0_GSU1_LBSPPA512_LBSPPB1024_MIWT2_1_PGR2_PLR0_SS0_SU32_SUM0_SUS256_SVW8_WG16_8_1_WGM8
    SolutionIndex: 9
    SolutionNameMin: Cijk_Ailk_Bjlk_HHS_BH_Bias_HAS_SAV_UserArgs_MT32x32x64_MI16x16x1_SN_CLR1_GSU1_LBSPPA512_LBSPPB512_MIWT1_1_PGR1_PLR1_SS0_SU32_SUM0_SUS256_SVW8_WG32_4_1_WGM8
    SolutionIndex: 10
    SolutionNameMin: Cijk_Ailk_Bjlk_HHS_BH_Bias_HAS_SAV_UserArgs_MT64x32x64_MI16x16x1_SN_CLR1_GSU1_LBSPPA1024_LBSPPB512_MIWT2_1_PGR1_PLR3_SS0_SU32_SUM0_SUS256_SVW8_WG32_4_1_WGM8
    SolutionIndex: 11
    SolutionNameMin: Cijk_Ailk_Bjlk_HHS_BH_Bias_HAS_SAV_UserArgs_MT32x64x64_MI16x16x1_SN_CLR1_GSU1_LBSPPA512_LBSPPB1024_MIWT2_1_PGR1_PLR3_SS0_SU32_SUM0_SUS256_SVW8_WG16_8_1_WGM8
    SolutionIndex: 12
    SolutionNameMin: Cijk_Ailk_Bjlk_HHS_BH_Bias_HAS_SAV_UserArgs_MT64x16x32_MI16x16x1_SN_CLR1_GSU1_LBSPPA1024_LBSPPB256_MIWT1_1_PGR2_PLR1_SS1_SU32_SUM0_SUS256_SVW1_WG64_2_1_WGM8
    SolutionIndex: 13
    SolutionNameMin: Cijk_Ailk_Bjlk_HHS_BH_Bias_HAS_SAV_UserArgs_MT64x16x32_MI16x16x1_SN_CLR0_GSU1_LBSPPA1024_LBSPPB256_MIWT1_1_PGR2_PLR0_SS1_SU32_SUM0_SUS256_SVW1_WG64_2_1_WGM8
    SolutionIndex: 14
    SolutionNameMin: Cijk_Ailk_Bjlk_HHS_BH_Bias_HAS_SAV_UserArgs_MT32x32x32_MI16x16x1_SN_CLR1_GSU1_LBSPPA512_LBSPPB512_MIWT1_1_PGR1_PLR1_SS1_SU32_SUM0_SUS256_SVW1_WG32_4_1_WGM8
    SolutionIndex: 15
    SolutionNameMin: Cijk_Ailk_Bjlk_HHS_BH_Bias_HAS_SAV_UserArgs_MT32x32x32_MI16x16x1_SN_CLR0_GSU1_LBSPPA512_LBSPPB512_MIWT1_1_PGR2_PLR0_SS1_SU32_SUM0_SUS256_SVW1_WG32_4_1_WGM8
    SolutionIndex: 16
    SolutionNameMin: Cijk_Ailk_Bjlk_HHS_BH_Bias_HAS_SAV_UserArgs_MT64x32x32_MI16x16x1_SN_CLR1_GSU1_LBSPPA1024_LBSPPB512_MIWT2_1_PGR1_PLR1_SS1_SU32_SUM0_SUS256_SVW1_WG32_4_1_WGM8
    SolutionIndex: 17
    SolutionNameMin: Cijk_Ailk_Bjlk_HHS_BH_Bias_HAS_SAV_UserArgs_MT64x32x32_MI16x16x1_SN_CLR1_GSU1_LBSPPA1024_LBSPPB512_MIWT2_1_PGR2_PLR1_SS1_SU32_SUM0_SUS256_SVW1_WG32_4_1_WGM8
    SolutionIndex: 18
    SolutionNameMin: Cijk_Ailk_Bjlk_HHS_BH_Bias_HAS_SAV_UserArgs_MT64x32x32_MI16x16x1_SN_CLR0_GSU1_LBSPPA1024_LBSPPB512_MIWT2_1_PGR2_PLR0_SS1_SU32_SUM0_SUS256_SVW1_WG32_4_1_WGM8
    SolutionIndex: 19
    SolutionNameMin: Cijk_Ailk_Bjlk_HHS_BH_Bias_HAS_SAV_UserArgs_MT32x64x32_MI16x16x1_SN_CLR1_GSU1_LBSPPA512_LBSPPB1024_MIWT2_1_PGR1_PLR1_SS1_SU32_SUM0_SUS256_SVW1_WG16_8_1_WGM8
    SolutionIndex: 20
    SolutionNameMin: Cijk_Ailk_Bjlk_HHS_BH_Bias_HAS_SAV_UserArgs_MT32x64x32_MI16x16x1_SN_CLR0_GSU1_LBSPPA512_LBSPPB1024_MIWT2_1_PGR1_PLR0_SS1_SU32_SUM0_SUS256_SVW1_WG16_8_1_WGM8
    SolutionIndex: 21
    SolutionNameMin: Cijk_Ailk_Bjlk_HHS_BH_Bias_HAS_SAV_UserArgs_MT32x32x64_MI16x16x1_SN_CLR1_GSU1_LBSPPA512_LBSPPB512_MIWT1_1_PGR1_PLR1_SS1_SU32_SUM0_SUS256_SVW1_WG32_4_1_WGM8
    SolutionIndex: 22
    SolutionNameMin: Cijk_Ailk_Bjlk_HHS_BH_Bias_HAS_SAV_UserArgs_MT64x32x64_MI16x16x1_SN_CLR1_GSU1_LBSPPA1024_LBSPPB512_MIWT2_1_PGR1_PLR1_SS1_SU32_SUM0_SUS256_SVW1_WG32_4_1_WGM8
    SolutionIndex: 23
    SolutionNameMin: Cijk_Ailk_Bjlk_HHS_BH_Bias_HAS_SAV_UserArgs_MT64x32x64_MI16x16x1_SN_CLR1_GSU1_LBSPPA1024_LBSPPB512_MIWT2_1_PGR1_PLR3_SS1_SU32_SUM0_SUS256_SVW1_WG32_4_1_WGM8
    SolutionIndex: 24
    SolutionNameMin: Cijk_Ailk_Bjlk_HHS_BH_Bias_HAS_SAV_UserArgs_MT32x64x64_MI16x16x1_SN_CLR1_GSU1_LBSPPA512_LBSPPB1024_MIWT2_1_PGR1_PLR3_SS1_SU32_SUM0_SUS256_SVW1_WG16_8_1_WGM8
- - - [512, 512, 1, 64, 512, 512, 512, 512]
    - [18, 1099.89]
  - - [1024, 512, 1, 64, 1024, 1024, 1024, 512]
    - [6, 2144.12]
  - - [1536, 512, 1, 64, 1536, 1536, 1536, 512]
    - [7, 2764.79]
  - - [2048, 512, 1, 64, 2048, 2048, 2048, 512]
    - [19, 3519.82]
  - - [2560, 512, 1, 64, 2560, 2560, 2560, 512]
    - [8, 4377.96]
  - - [3072, 512, 1, 64, 3072, 3072, 3072, 512]
    - [6, 5057.82]
  - - [512, 1024, 1, 64, 512, 512, 512, 1024]
    - [7, 2087.37]
  - - [1024, 1024, 1, 64, 1024, 1024, 1024, 1024]
    - [6, 3734.7]
  - - [1536, 1024, 1, 64, 1536, 1536, 1536, 1024]
    - [5, 4845.64]
  - - [2048, 1024, 1, 64, 2048, 2048, 2048, 1024]
    - [8, 6096.37]
  - - [2560, 1024, 1, 64, 2560, 2560, 2560, 1024]
    - [5, 7148.67]
  - - [3072, 1024, 1, 64, 3072, 3072, 3072, 1024]
    - [5, 7922.19]
  - - [512, 1536, 1, 64, 512, 512, 512, 1536]
    - [5, 2895.54]
  - - [1024, 1536, 1, 64, 1024, 1024, 1024, 1536]
    - [24, 4027.82]
  - - [1536, 1536, 1, 64, 1536, 1536, 1536, 1536]
    - [5, 6702.84]
  - - [2048, 1536, 1, 64, 2048, 2048, 2048, 1536]
    - [2, 7639.17]
  - - [2560, 1536, 1, 64, 2560, 2560, 2560, 1536]
    - [8, 9019.2]
  - - [3072, 1536, 1, 64, 3072, 3072, 3072, 1536]
    - [6, 9848.67]
  - - [512, 2048, 1, 64, 512, 512, 512, 2048]
    - [5, 3739.91]
  - - [1024, 2048, 1, 64, 1024, 1024, 1024, 2048]
    - [8, 6187.86]
  - - [1536, 2048, 1, 64, 1536, 1536, 1536, 2048]
    - [6, 7769.18]
  - - [2048, 2048, 1, 64, 2048, 2048, 2048, 2048]
    - [5, 9177.28]
  - - [2560, 2048, 1, 64, 2560, 2560, 2560, 2048]
    - [3, 10608.8]
  - - [3072, 2048, 1, 64, 3072, 3072, 3072, 2048]
    - [5, 12018.4]
  - - [512, 2560, 1, 64, 512, 512, 512, 2560]
    - [6, 4229.73]
  - - [1024, 2560, 1, 64, 1024, 1024, 1024, 2560]
    - [5, 7224.09]
  - - [1536, 2560, 1, 64, 1536, 1536, 1536, 2560]
    - [6, 8998.24]
  - - [2048, 2560, 1, 64, 2048, 2048, 2048, 2560]
    - [2, 10791.5]
  - - [2560, 2560, 1, 64, 2560, 2560, 2560, 2560]
    - [6, 12205.3]
  - - [3072, 2560, 1, 64, 3072, 3072, 3072, 2560]
    - [4, 12526.4]
  - - [512, 3072, 1, 64, 512, 512, 512, 3072]
    - [22, 3995.76]
  - - [1024, 3072, 1, 64, 1024, 1024, 1024, 3072]
    - [8, 7679.97]
  - - [1536, 3072, 1, 64, 1536, 1536, 1536, 3072]
    - [2, 10270.0]
  - - [2048, 3072, 1, 64, 2048, 2048, 2048, 3072]
    - [5, 11815.3]
  - - [2560, 3072, 1, 64, 2560, 2560, 2560, 3072]
    - [6, 12965.9]
  - - [3072, 3072, 1, 64, 3072, 3072, 3072, 3072]
    - [8, 13879.2]
  - - [512, 512, 1, 256, 512, 512, 512, 512]
    - [10, 3903.49]
  - - [1024, 512, 1, 256, 1024, 1024, 1024, 512]
    - [7, 6716.76]
  - - [1536, 512, 1, 256, 1536, 1536, 1536, 512]
    - [7, 8778.71]
  - - [2048, 512, 1, 256, 2048, 2048, 2048, 512]
    - [5, 10953.9]
  - - [2560, 512, 1, 256, 2560, 2560, 2560, 512]
    - [19, 12527.3]
  - - [3072, 512, 1, 256, 3072, 3072, 3072, 512]
    - [1, 9610.21]
  - - [512, 1024, 1, 256, 512, 512, 512, 1024]
    - [7, 6923.26]
  - - [1024, 1024, 1, 256, 1024, 1024, 1024, 1024]
    - [5, 11248.1]
  - - [1536, 1024, 1, 256, 1536, 1536, 1536, 1024]
    - [5, 14206.2]
  - - [2048, 1024, 1, 256, 2048, 2048, 2048, 1024]
    - [5, 16510.7]
  - - [2560, 1024, 1, 256, 2560, 2560, 2560, 1024]
    - [5, 18361.3]
  - - [3072, 1024, 1, 256, 3072, 3072, 3072, 1024]
    - [16, 19686.5]
  - - [512, 1536, 1, 256, 512, 512, 512, 1536]
    - [5, 8780.82]
  - - [1024, 1536, 1, 256, 1024, 1024, 1024, 1536]
    - [5, 14508.7]
  - - [1536, 1536, 1, 256, 1536, 1536, 1536, 1536]
    - [16, 16967.2]
  - - [2048, 1536, 1, 256, 2048, 2048, 2048, 1536]
    - [5, 19927.9]
  - - [2560, 1536, 1, 256, 2560, 2560, 2560, 1536]
    - [5, 21248.4]
  - - [3072, 1536, 1, 256, 3072, 3072, 3072, 1536]
    - [5, 22807.0]
  - - [512, 2048, 1, 256, 512, 512, 512, 2048]
    - [17, 7492.55]
  - - [1024, 2048, 1, 256, 1024, 1024, 1024, 2048]
    - [5, 16369.8]
  - - [1536, 2048, 1, 256, 1536, 1536, 1536, 2048]
    - [1, 19975.1]
  - - [2048, 2048, 1, 256, 2048, 2048, 2048, 2048]
    - [16, 21887.6]
  - - [2560, 2048, 1, 256, 2560, 2560, 2560, 2048]
    - [5, 23864.7]
  - - [3072, 2048, 1, 256, 3072, 3072, 3072, 2048]
    - [5, 25187.5]
  - - [512, 2560, 1, 256, 512, 512, 512, 2560]
    - [5, 12600.2]
  - - [1024, 2560, 1, 256, 1024, 1024, 1024, 2560]
    - [19, 18341.3]
  - - [1536, 2560, 1, 256, 1536, 1536, 1536, 2560]
    - [5, 21642.2]
  - - [2048, 2560, 1, 256, 2048, 2048, 2048, 2560]
    - [5, 23746.5]
  - - [2560, 2560, 1, 256, 2560, 2560, 2560, 2560]
    - [5, 25374.1]
  - - [3072, 2560, 1, 256, 3072, 3072, 3072, 2560]
    - [5, 26900.8]
  - - [512, 3072, 1, 256, 512, 512, 512, 3072]
    - [16, 14040.0]
  - - [1024, 3072, 1, 256, 1024, 1024, 1024, 3072]
    - [5, 20017.3]
  - - [1536, 3072, 1, 256, 1536, 1536, 1536, 3072]
    - [5, 22886.9]
  - - [2048, 3072, 1, 256, 2048, 2048, 2048, 3072]
    - [5, 25132.2]
  - - [2560, 3072, 1, 256, 2560, 2560, 2560, 3072]
    - [1, 26647.4]
  - - [3072, 3072, 1, 256, 3072, 3072, 3072, 3072]
    - [19, 27327.5]
  - - [512, 512, 1, 512, 512, 512, 512, 512]
    - [23, 6688.31]
  - - [1024, 512, 1, 512, 1024, 1024, 1024, 512]
    - [16, 11672.1]
  - - [1536, 512, 1, 512, 1536, 1536, 1536, 512]
    - [19, 14221.5]
  - - [2048, 512, 1, 512, 2048, 2048, 2048, 512]
    - [16, 17068.4]
  - - [2560, 512, 1, 512, 2560, 2560, 2560, 512]
    - [19, 18650.2]
  - - [3072, 512, 1, 512, 3072, 3072, 3072, 512]
    - [5, 20663.2]
  - - [512, 1024, 1, 512, 512, 512, 512, 1024]
    - [19, 7379.97]
  - - [1024, 1024, 1, 512, 1024, 1024, 1024, 1024]
    - [5, 16821.9]
  - - [1536, 1024, 1, 512, 1536, 1536, 1536, 1024]
    - [5, 20655.0]
  - - [2048, 1024, 1, 512, 2048, 2048, 2048, 1024]
    - [19, 22773.6]
  - - [2560, 1024, 1, 512, 2560, 2560, 2560, 1024]
    - [16, 24229.7]
  - - [3072, 1024, 1, 512, 3072, 3072, 3072, 1024]
    - [19, 25706.9]
  - - [512, 1536, 1, 512, 512, 512, 512, 1536]
    - [5, 14320.4]
  - - [1024, 1536, 1, 512, 1024, 1024, 1024, 1536]
    - [5, 20400.7]
  - - [1536, 1536, 1, 512, 1536, 1536, 1536, 1536]
    - [5, 23523.4]
  - - [2048, 1536, 1, 512, 2048, 2048, 2048, 1536]
    - [16, 26308.4]
  - - [2560, 1536, 1, 512, 2560, 2560, 2560, 1536]
    - [19, 27021.9]
  - - [3072, 1536, 1, 512, 3072, 3072, 3072, 1536]
    - [5, 29369.5]
  - - [512, 2048, 1, 512, 512, 512, 512, 2048]
    - [5, 16680.5]
  - - [1024, 2048, 1, 512, 1024, 1024, 1024, 2048]
    - [19, 22463.2]
  - - [1536, 2048, 1, 512, 1536, 1536, 1536, 2048]
    - [16, 25764.7]
  - - [2048, 2048, 1, 512, 2048, 2048, 2048, 2048]
    - [5, 27882.2]
  - - [2560, 2048, 1, 512, 2560, 2560, 2560, 2048]
    - [5, 29294.8]
  - - [3072, 2048, 1, 512, 3072, 3072, 3072, 2048]
    - [16, 30521.8]
  - - [512, 2560, 1, 512, 512, 512, 512, 2560]
    - [19, 18251.5]
  - - [1024, 2560, 1, 512, 1024, 1024, 1024, 2560]
    - [16, 19232.6]
  - - [1536, 2560, 1, 512, 1536, 1536, 1536, 2560]
    - [16, 27498.9]
  - - [2048, 2560, 1, 512, 2048, 2048, 2048, 2560]
    - [19, 29866.3]
  - - [2560, 2560, 1, 512, 2560, 2560, 2560, 2560]
    - [19, 30820.6]
  - - [3072, 2560, 1, 512, 3072, 3072, 3072, 2560]
    - [5, 32075.9]
  - - [512, 3072, 1, 512, 512, 512, 512, 3072]
    - [22, 15962.5]
  - - [1024, 3072, 1, 512, 1024, 1024, 1024, 3072]
    - [16, 25657.7]
  - - [1536, 3072, 1, 512, 1536, 1536, 1536, 3072]
    - [16, 28584.3]
  - - [2048, 3072, 1, 512, 2048, 2048, 2048, 3072]
    - [5, 30594.4]
  - - [2560, 3072, 1, 512, 2560, 2560, 2560, 3072]
    - [1, 30950.8]
  - - [3072, 3072, 1, 512, 3072, 3072, 3072, 3072]
    - [16, 32420.7]
  - - [512, 512, 1, 1024, 512, 512, 512, 512]
    - [10, 10387.0]
  - - [1024, 512, 1, 1024, 1024, 1024, 1024, 512]
    - [19, 17022.2]
  - - [1536, 512, 1, 1024, 1536, 1536, 1536, 512]
    - [5, 20059.7]
  - - [2048, 512, 1, 1024, 2048, 2048, 2048, 512]
    - [19, 22638.7]
  - - [2560, 512, 1, 1024, 2560, 2560, 2560, 512]
    - [20, 23365.2]
  - - [3072, 512, 1, 1024, 3072, 3072, 3072, 512]
    - [5, 26126.8]
  - - [512, 1024, 1, 1024, 512, 512, 512, 1024]
    - [0, 13164.4]
  - - [1024, 1024, 1, 1024, 1024, 1024, 1024, 1024]
    - [19, 23349.1]
  - - [1536, 1024, 1, 1024, 1536, 1536, 1536, 1024]
    - [16, 26046.3]
  - - [2048, 1024, 1, 1024, 2048, 2048, 2048, 1024]
    - [16, 28018.9]
  - - [2560, 1024, 1, 1024, 2560, 2560, 2560, 1024]
    - [5, 29343.0]
  - - [3072, 1024, 1, 1024, 3072, 3072, 3072, 1024]
    - [19, 30870.5]
  - - [512, 1536, 1, 1024, 512, 512, 512, 1536]
    - [19, 19795.4]
  - - [1024, 1536, 1, 1024, 1024, 1024, 1024, 1536]
    - [19, 25787.3]
  - - [1536, 1536, 1, 1024, 1536, 1536, 1536, 1536]
    - [16, 24877.5]
  - - [2048, 1536, 1, 1024, 2048, 2048, 2048, 1536]
    - [1, 30148.3]
  - - [2560, 1536, 1, 1024, 2560, 2560, 2560, 1536]
    - [19, 32041.5]
  - - [3072, 1536, 1, 1024, 3072, 3072, 3072, 1536]
    - [5, 32160.4]
  - - [512, 2048, 1, 1024, 512, 512, 512, 2048]
    - [19, 23000.9]
  - - [1024, 2048, 1, 1024, 1024, 1024, 1024, 2048]
    - [19, 27958.6]
  - - [1536, 2048, 1, 1024, 1536, 1536, 1536, 2048]
    - [20, 30353.3]
  - - [2048, 2048, 1, 1024, 2048, 2048, 2048, 2048]
    - [16, 32910.4]
  - - [2560, 2048, 1, 1024, 2560, 2560, 2560, 2048]
    - [1, 33207.0]
  - - [3072, 2048, 1, 1024, 3072, 3072, 3072, 2048]
    - [1, 34410.8]
  - - [512, 2560, 1, 1024, 512, 512, 512, 2560]
    - [19, 19293.7]
  - - [1024, 2560, 1, 1024, 1024, 1024, 1024, 2560]
    - [20, 28586.9]
  - - [1536, 2560, 1, 1024, 1536, 1536, 1536, 2560]
    - [5, 31516.4]
  - - [2048, 2560, 1, 1024, 2048, 2048, 2048, 2560]
    - [5, 32695.5]
  - - [2560, 2560, 1, 1024, 2560, 2560, 2560, 2560]
    - [16, 33584.5]
  - - [3072, 2560, 1, 1024, 3072, 3072, 3072, 2560]
    - [5, 34444.3]
  - - [512, 3072, 1, 1024, 512, 512, 512, 3072]
    - [5, 26250.5]
  - - [1024, 3072, 1, 1024, 1024, 1024, 1024, 3072]
    - [16, 30288.9]
  - - [1536, 3072, 1, 1024, 1536, 1536, 1536, 3072]
    - [19, 32653.5]
  - - [2048, 3072, 1, 1024, 2048, 2048, 2048, 3072]
    - [19, 34049.1]
  - - [2560, 3072, 1, 1024, 2560, 2560, 2560, 3072]
    - [16, 34721.0]
  - - [3072, 3072, 1, 1024, 3072, 3072, 3072, 3072]
    - [5, 34981.8]
  - - [512, 512, 1, 2048, 512, 512, 512, 512]
    - [11, 15358.5]
  - - [1024, 512, 1, 2048, 1024, 1024, 1024, 512]
    - [1, 23129.8]
  - - [1536, 512, 1, 2048, 1536, 1536, 1536, 512]
    - [19, 24494.7]
  - - [2048, 512, 1, 2048, 2048, 2048, 2048, 512]
    - [5, 27958.6]
  - - [2560, 512, 1, 2048, 2560, 2560, 2560, 512]
    - [16, 28495.7]
  - - [3072, 512, 1, 2048, 3072, 3072, 3072, 512]
    - [19, 29965.7]
  - - [512, 1024, 1, 2048, 512, 512, 512, 1024]
    - [19, 22924.3]
  - - [1024, 1024, 1, 2048, 1024, 1024, 1024, 1024]
    - [16, 27329.3]
  - - [1536, 1024, 1, 2048, 1536, 1536, 1536, 1024]
    - [19, 30559.4]
  - - [2048, 1024, 1, 2048, 2048, 2048, 2048, 1024]
    - [19, 31352.9]
  - - [2560, 1024, 1, 2048, 2560, 2560, 2560, 1024]
    - [16, 32903.2]
  - - [3072, 1024, 1, 2048, 3072, 3072, 3072, 1024]
    - [19, 34230.3]
  - - [512, 1536, 1, 2048, 512, 512, 512, 1536]
    - [19, 24394.2]
  - - [1024, 1536, 1, 2048, 1024, 1024, 1024, 1536]
    - [5, 29957.4]
  - - [1536, 1536, 1, 2048, 1536, 1536, 1536, 1536]
    - [5, 32132.4]
  - - [2048, 1536, 1, 2048, 2048, 2048, 2048, 1536]
    - [5, 32967.6]
  - - [2560, 1536, 1, 2048, 2560, 2560, 2560, 1536]
    - [19, 34108.8]
  - - [3072, 1536, 1, 2048, 3072, 3072, 3072, 1536]
    - [5, 35303.1]
  - - [512, 2048, 1, 2048, 512, 512, 512, 2048]
    - [19, 27543.7]
  - - [1024, 2048, 1, 2048, 1024, 1024, 1024, 2048]
    - [19, 31852.7]
  - - [1536, 2048, 1, 2048, 1536, 1536, 1536, 2048]
    - [5, 33429.5]
  - - [2048, 2048, 1, 2048, 2048, 2048, 2048, 2048]
    - [5, 35261.2]
  - - [2560, 2048, 1, 2048, 2560, 2560, 2560, 2048]
    - [19, 35012.8]
  - - [3072, 2048, 1, 2048, 3072, 3072, 3072, 2048]
    - [5, 34927.5]
  - - [512, 2560, 1, 2048, 512, 512, 512, 2560]
    - [19, 28473.1]
  - - [1024, 2560, 1, 2048, 1024, 1024, 1024, 2560]
    - [16, 32443.1]
  - - [1536, 2560, 1, 2048, 1536, 1536, 1536, 2560]
    - [19, 33703.4]
  - - [2048, 2560, 1, 2048, 2048, 2048, 2048, 2560]
    - [19, 34952.8]
  - - [2560, 2560, 1, 2048, 2560, 2560, 2560, 2560]
    - [19, 35427.5]
  - - [3072, 2560, 1, 2048, 3072, 3072, 3072, 2560]
    - [19, 35568.4]
  - - [512, 3072, 1, 2048, 512, 512, 512, 3072]
    - [1, 30643.9]
  - - [1024, 3072, 1, 2048, 1024, 1024, 1024, 3072]
    - [5, 33135.0]
  - - [1536, 3072, 1, 2048, 1536, 1536, 1536, 3072]
    - [19, 35086.0]
  - - [2048, 3072, 1, 2048, 2048, 2048, 2048, 3072]
    - [16, 35286.5]
  - - [2560, 3072, 1, 2048, 2560, 2560, 2560, 3072]
    - [5, 35540.8]
  - - [3072, 3072, 1, 2048, 3072, 3072, 3072, 3072]
    - [19, 35994.4]
  - - [512, 512, 1, 3072, 512, 512, 512, 512]
    - [10, 17907.8]
  - - [1024, 512, 1, 3072, 1024, 1024, 1024, 512]
    - [16, 25523.4]
  - - [1536, 512, 1, 3072, 1536, 1536, 1536, 512]
    - [19, 26395.7]
  - - [2048, 512, 1, 3072, 2048, 2048, 2048, 512]
    - [16, 29236.7]
  - - [2560, 512, 1, 3072, 2560, 2560, 2560, 512]
    - [5, 30260.9]
  - - [3072, 512, 1, 3072, 3072, 3072, 3072, 512]
    - [19, 31219.3]
  - - [512, 1024, 1, 3072, 512, 512, 512, 1024]
    - [3, 24676.9]
  - - [1024, 1024, 1, 3072, 1024, 1024, 1024, 1024]
    - [19, 29555.2]
  - - [1536, 1024, 1, 3072, 1536, 1536, 1536, 1024]
    - [5, 31553.2]
  - - [2048, 1024, 1, 3072, 2048, 2048, 2048, 1024]
    - [5, 32571.0]
  - - [2560, 1024, 1, 3072, 2560, 2560, 2560, 1024]
    - [16, 33635.7]
  - - [3072, 1024, 1, 3072, 3072, 3072, 3072, 1024]
    - [1, 34003.7]
  - - [512, 1536, 1, 3072, 512, 512, 512, 1536]
    - [5, 26965.3]
  - - [1024, 1536, 1, 3072, 1024, 1024, 1024, 1536]
    - [16, 31697.3]
  - - [1536, 1536, 1, 3072, 1536, 1536, 1536, 1536]
    - [19, 33471.2]
  - - [2048, 1536, 1, 3072, 2048, 2048, 2048, 1536]
    - [19, 34142.1]
  - - [2560, 1536, 1, 3072, 2560, 2560, 2560, 1536]
    - [5, 34520.7]
  - - [3072, 1536, 1, 3072, 3072, 3072, 3072, 1536]
    - [1, 35005.5]
  - - [512, 2048, 1, 3072, 512, 512, 512, 2048]
    - [1, 30031.5]
  - - [1024, 2048, 1, 3072, 1024, 1024, 1024, 2048]
    - [19, 33287.7]
  - - [1536, 2048, 1, 3072, 1536, 1536, 1536, 2048]
    - [16, 34538.9]
  - - [2048, 2048, 1, 3072, 2048, 2048, 2048, 2048]
    - [5, 34890.2]
  - - [2560, 2048, 1, 3072, 2560, 2560, 2560, 2048]
    - [19, 35540.9]
  - - [3072, 2048, 1, 3072, 3072, 3072, 3072, 2048]
    - [19, 35493.7]
  - - [512, 2560, 1, 3072, 512, 512, 512, 2560]
    - [19, 30412.2]
  - - [1024, 2560, 1, 3072, 1024, 1024, 1024, 2560]
    - [16, 34182.2]
  - - [1536, 2560, 1, 3072, 1536, 1536, 1536, 2560]
    - [5, 34612.4]
  - - [2048, 2560, 1, 3072, 2048, 2048, 2048, 2560]
    - [5, 34945.9]
  - - [2560, 2560, 1, 3072, 2560, 2560, 2560, 2560]
    - [19, 35803.3]
  - - [3072, 2560, 1, 3072, 3072, 3072, 3072, 2560]
    - [1, 35815.1]
  - - [512, 3072, 1, 3072, 512, 512, 512, 3072]
    - [1, 32031.1]
  - - [1024, 3072, 1, 3072, 1024, 1024, 1024, 3072]
    - [19, 33794.0]
  - - [1536, 3072, 1, 3072, 1536, 1536, 1536, 3072]
    - [1, 34947.1]
  - - [2048, 3072, 1, 3072, 2048, 2048, 2048, 3072]
    - [19, 35799.6]
  - - [2560, 3072, 1, 3072, 2560, 2560, 2560, 3072]
    - [1, 35674.7]
  - - [3072, 3072, 1, 3072, 3072, 3072, 3072, 3072]
    - [19, 36047.4]
  - - [1, 1, 1, 1, 1, 1, 1, 1]
    - [13, 6.37979e-05]
  - - [1, 1, 1, 64, 1, 1, 1, 1]
    - [15, 0.004]
  - - [1, 64, 1, 1, 1, 1, 1, 64]
    - [13, 0.00423883]
  - - [64, 1, 1, 1, 64, 64, 64, 1]
    - [13, 0.00425858]
  - - [64, 64, 1, 1, 64, 64, 64, 64]
    - [9, 0.269323]
  - - [64, 1, 1, 64, 64, 64, 64, 1]
    - [12, 0.267914]
  - - [1, 64, 1, 64, 1, 1, 1, 64]
    - [15, 0.266945]
  - - [64, 64, 1, 64, 64, 64, 64, 64]
    - [14, 17.0789]
  - - [64, 64, 1, 256, 64, 64, 64, 64]
    - [14, 62.8228]
  - - [64, 64, 1, 512, 64, 64, 64, 64]
    - [21, 117.235]
  - - [64, 64, 1, 1024, 64, 64, 64, 64]
    - [9, 196.083]
  - - [64, 64, 1, 2048, 64, 64, 64, 64]
    - [21, 307.602]
  - - [64, 64, 1, 4096, 64, 64, 64, 64]
    - [9, 442.484]
- null
- null
- DeviceEfficiency
- GridBased
