library/src/amd_detail/rocblaslt/src/Tensile/Logic/asm_full/gfx1200/GridBased/gfx1200_Cijk_Ailk_Bjlk_I8BH_HAI_SAV_UserArgs.yaml
- {MinimumRequiredVersion: 4.33.0}
- gfx1200
- gfx1200
- [Device 73f0]
    SolutionIndex: 0
    SolutionNameMin: Cijk_Ailk_Bjlk_I8BH_HAI_SAV_UserArgs_MT256x16x32_MI16x16x1_SN_LDSB0_CLR1_GRVWA16_GRVWB4_GSU1_LBSPPA2048_LBSPPB128_MIWT4_1_PGR1_PLR1_SU32_SUM0_SUS256_WG64_2_1_WGM8
    SolutionIndex: 1
    SolutionNameMin: Cijk_Ailk_Bjlk_I8BH_HAI_SAV_UserArgs_MT256x16x32_MI16x16x1_SN_LDSB0_CLR1_GRVWA16_GRVWB4_GSU1_LBSPPA2048_LBSPPB128_MIWT4_1_PGR2_PLR1_SU32_SUM0_SUS256_WG64_2_1_WGM8
    SolutionIndex: 2
    SolutionNameMin: Cijk_Ailk_Bjlk_I8BH_HAI_SAV_UserArgs_MT256x16x32_MI16x16x1_SN_LDSB0_CLR0_GRVWA16_GRVWB4_GSU1_LBSPPA2048_LBSPPB128_MIWT4_1_PGR1_PLR0_SU32_SUM0_SUS256_WG64_2_1_WGM8
    SolutionIndex: 3
    SolutionNameMin: Cijk_Ailk_Bjlk_I8BH_HAI_SAV_UserArgs_MT256x16x32_MI16x16x1_SN_LDSB0_CLR0_GRVWA16_GRVWB4_GSU1_LBSPPA2048_LBSPPB128_MIWT4_1_PGR2_PLR0_SU32_SUM0_SUS256_WG64_2_1_WGM8
    SolutionIndex: 4
    SolutionNameMin: Cijk_Ailk_Bjlk_I8BH_HAI_SAV_UserArgs_MT64x32x32_MI16x16x1_SN_LDSB0_CLR1_GRVWA16_GRVWB8_GSU1_LBSPPA512_LBSPPB256_MIWT2_1_PGR1_PLR1_SU32_SUM0_SUS256_WG32_4_1_WGM8
    SolutionIndex: 5
    SolutionNameMin: Cijk_Ailk_Bjlk_I8BH_HAI_SAV_UserArgs_MT64x32x32_MI16x16x1_SN_LDSB0_CLR0_GRVWA16_GRVWB8_GSU1_LBSPPA512_LBSPPB256_MIWT2_1_PGR1_PLR0_SU32_SUM0_SUS256_WG32_4_1_WGM8
    SolutionIndex: 6
    SolutionNameMin: Cijk_Ailk_Bjlk_I8BH_HAI_SAV_UserArgs_MT64x32x32_MI16x16x1_SN_LDSB0_CLR0_GRVWA16_GRVWB8_GSU1_LBSPPA512_LBSPPB256_MIWT2_1_PGR2_PLR0_SU32_SUM0_SUS256_WG32_4_1_WGM8
    SolutionIndex: 7
    SolutionNameMin: Cijk_Ailk_Bjlk_I8BH_HAI_SAV_UserArgs_MT16x64x32_MI16x16x1_SN_LDSB0_CLR0_GRVWA4_GRVWB16_GSU1_LBSPPA128_LBSPPB512_MIWT1_1_PGR1_PLR0_SU32_SUM0_SUS256_WG16_8_1_WGM8
    SolutionIndex: 8
    SolutionNameMin: Cijk_Ailk_Bjlk_I8BH_HAI_SAV_UserArgs_MT32x64x32_MI16x16x1_SN_LDSB0_CLR1_GRVWA8_GRVWB16_GSU1_LBSPPA256_LBSPPB512_MIWT2_1_PGR1_PLR1_SU32_SUM0_SUS256_WG16_8_1_WGM8
    SolutionIndex: 9
    SolutionNameMin: Cijk_Ailk_Bjlk_I8BH_HAI_SAV_UserArgs_MT32x64x32_MI16x16x1_SN_LDSB0_CLR1_GRVWA8_GRVWB16_GSU1_LBSPPA256_LBSPPB512_MIWT2_1_PGR2_PLR1_SU32_SUM0_SUS256_WG16_8_1_WGM8
    SolutionIndex: 10
    SolutionNameMin: Cijk_Ailk_Bjlk_I8BH_HAI_SAV_UserArgs_MT32x64x32_MI16x16x1_SN_LDSB0_CLR0_GRVWA8_GRVWB16_GSU1_LBSPPA256_LBSPPB512_MIWT2_1_PGR1_PLR0_SU32_SUM0_SUS256_WG16_8_1_WGM8
    SolutionIndex: 11
    SolutionNameMin: Cijk_Ailk_Bjlk_I8BH_HAI_SAV_UserArgs_MT32x64x32_MI16x16x1_SN_LDSB0_CLR0_GRVWA8_GRVWB16_GSU1_LBSPPA256_LBSPPB512_MIWT2_1_PGR2_PLR0_SU32_SUM0_SUS256_WG16_8_1_WGM8
    SolutionIndex: 12
    SolutionNameMin: Cijk_Ailk_Bjlk_I8BH_HAI_SAV_UserArgs_MT64x16x64_MI16x16x1_SN_LDSB0_CLR1_GRVWA16_GRVWB8_GSU1_LBSPPA512_LBSPPB128_MIWT1_1_PGR1_PLR1_SU32_SUM0_SUS256_WG64_2_1_WGM8
    SolutionIndex: 13
    SolutionNameMin: Cijk_Ailk_Bjlk_I8BH_HAI_SAV_UserArgs_MT128x16x64_MI16x16x1_SN_LDSB0_CLR1_GRVWA16_GRVWB8_GSU1_LBSPPA1024_LBSPPB128_MIWT2_1_PGR1_PLR1_SU32_SUM0_SUS256_WG64_2_1_WGM8
    SolutionIndex: 14
    SolutionNameMin: Cijk_Ailk_Bjlk_I8BH_HAI_SAV_UserArgs_MT256x16x64_MI16x16x1_SN_LDSB1_CLR1_GRVWA16_GRVWB8_GSU1_LBSPPA2048_LBSPPB128_MIWT4_1_PGR1_PLR1_SU32_SUM0_SUS256_WG64_2_1_WGM8
    SolutionIndex: 15
    SolutionNameMin: Cijk_Ailk_Bjlk_I8BH_HAI_SAV_UserArgs_MT256x16x64_MI16x16x1_SN_LDSB1_CLR1_GRVWA16_GRVWB8_GSU1_LBSPPA2048_LBSPPB128_MIWT4_1_PGR2_PLR1_SU32_SUM0_SUS256_WG64_2_1_WGM8
    SolutionIndex: 16
    SolutionNameMin: Cijk_Ailk_Bjlk_I8BH_HAI_SAV_UserArgs_MT256x16x64_MI16x16x1_SN_LDSB1_CLR1_GRVWA16_GRVWB8_GSU1_LBSPPA2048_LBSPPB128_MIWT4_1_PGR1_PLR3_SU32_SUM0_SUS256_WG64_2_1_WGM8
    SolutionIndex: 17
    SolutionNameMin: Cijk_Ailk_Bjlk_I8BH_HAI_SAV_UserArgs_MT256x16x64_MI16x16x1_SN_LDSB1_CLR1_GRVWA16_GRVWB8_GSU1_LBSPPA2048_LBSPPB128_MIWT4_1_PGR2_PLR3_SU32_SUM0_SUS256_WG64_2_1_WGM8
    SolutionIndex: 18
    SolutionNameMin: Cijk_Ailk_Bjlk_I8BH_HAI_SAV_UserArgs_MT32x32x64_MI16x16x1_SN_LDSB0_CLR1_GRVWA16_GRVWB16_GSU1_LBSPPA256_LBSPPB256_MIWT1_1_PGR1_PLR1_SU32_SUM0_SUS256_WG32_4_1_WGM8
    SolutionIndex: 19
    SolutionNameMin: Cijk_Ailk_Bjlk_I8BH_HAI_SAV_UserArgs_MT32x32x64_MI16x16x1_SN_LDSB0_CLR0_GRVWA16_GRVWB16_GSU1_LBSPPA256_LBSPPB256_MIWT1_1_PGR1_PLR0_SU32_SUM0_SUS256_WG32_4_1_WGM8
    SolutionIndex: 20
    SolutionNameMin: Cijk_Ailk_Bjlk_I8BH_HAI_SAV_UserArgs_MT64x32x64_MI16x16x1_SN_LDSB0_CLR1_GRVWA16_GRVWB16_GSU1_LBSPPA512_LBSPPB256_MIWT2_1_PGR1_PLR1_SU32_SUM0_SUS256_WG32_4_1_WGM8
    SolutionIndex: 21
    SolutionNameMin: Cijk_Ailk_Bjlk_I8BH_HAI_SAV_UserArgs_MT64x32x64_MI16x16x1_SN_LDSB0_CLR1_GRVWA16_GRVWB16_GSU1_LBSPPA512_LBSPPB256_MIWT2_1_PGR1_PLR3_SU32_SUM0_SUS256_WG32_4_1_WGM8
    SolutionIndex: 22
    SolutionNameMin: Cijk_Ailk_Bjlk_I8BH_HAI_SAV_UserArgs_MT64x32x64_MI16x16x1_SN_LDSB0_CLR1_GRVWA16_GRVWB16_GSU1_LBSPPA512_LBSPPB256_MIWT2_1_PGR2_PLR3_SU32_SUM0_SUS256_WG32_4_1_WGM8
    SolutionIndex: 23
    SolutionNameMin: Cijk_Ailk_Bjlk_I8BH_HAI_SAV_UserArgs_MT64x32x64_MI16x16x1_SN_LDSB0_CLR0_GRVWA16_GRVWB16_GSU1_LBSPPA512_LBSPPB256_MIWT2_1_PGR1_PLR0_SU32_SUM0_SUS256_WG32_4_1_WGM8
    SolutionIndex: 24
    SolutionNameMin: Cijk_Ailk_Bjlk_I8BH_HAI_SAV_UserArgs_MT64x32x64_MI16x16x1_SN_LDSB0_CLR0_GRVWA16_GRVWB16_GSU1_LBSPPA512_LBSPPB256_MIWT2_1_PGR2_PLR0_SU32_SUM0_SUS256_WG32_4_1_WGM8
    SolutionIndex: 25
    SolutionNameMin: Cijk_Ailk_Bjlk_I8BH_HAI_SAV_UserArgs_MT32x64x64_MI16x16x1_SN_LDSB0_CLR1_GRVWA16_GRVWB16_GSU1_LBSPPA256_LBSPPB512_MIWT2_1_PGR1_PLR1_SU32_SUM0_SUS256_WG16_8_1_WGM8
    SolutionIndex: 26
    SolutionNameMin: Cijk_Ailk_Bjlk_I8BH_HAI_SAV_UserArgs_MT32x64x64_MI16x16x1_SN_LDSB0_CLR1_GRVWA16_GRVWB16_GSU1_LBSPPA256_LBSPPB512_MIWT2_1_PGR2_PLR1_SU32_SUM0_SUS256_WG16_8_1_WGM8
    SolutionIndex: 27
    SolutionNameMin: Cijk_Ailk_Bjlk_I8BH_HAI_SAV_UserArgs_MT32x64x64_MI16x16x1_SN_LDSB0_CLR1_GRVWA16_GRVWB16_GSU1_LBSPPA256_LBSPPB512_MIWT2_1_PGR1_PLR3_SU32_SUM0_SUS256_WG16_8_1_WGM8
    SolutionIndex: 28
    SolutionNameMin: Cijk_Ailk_Bjlk_I8BH_HAI_SAV_UserArgs_MT32x64x64_MI16x16x1_SN_LDSB0_CLR0_GRVWA16_GRVWB16_GSU1_LBSPPA256_LBSPPB512_MIWT2_1_PGR1_PLR0_SU32_SUM0_SUS256_WG16_8_1_WGM8
    SolutionIndex: 29
    SolutionNameMin: Cijk_Ailk_Bjlk_I8BH_HAI_SAV_UserArgs_MT32x64x64_MI16x16x1_SN_LDSB0_CLR0_GRVWA16_GRVWB16_GSU1_LBSPPA256_LBSPPB512_MIWT2_1_PGR2_PLR0_SU32_SUM0_SUS256_WG16_8_1_WGM8
- - - [512, 512, 1, 64, 512, 512, 512, 512]
    - [14, 1029.56]
  - - [1024, 512, 1, 64, 1024, 1024, 1024, 512]
    - [28, 2024.28]
  - - [1536, 512, 1, 64, 1536, 1536, 1536, 512]
    - [28, 2870.68]
  - - [2048, 512, 1, 64, 2048, 2048, 2048, 512]
    - [14, 3713.01]
  - - [2560, 512, 1, 64, 2560, 2560, 2560, 512]
    - [3, 4382.53]
  - - [3072, 512, 1, 64, 3072, 3072, 3072, 512]
    - [2, 5109.29]
  - - [512, 1024, 1, 64, 512, 512, 512, 1024]
    - [14, 2031.63]
  - - [1024, 1024, 1, 64, 1024, 1024, 1024, 1024]
    - [16, 3744.18]
  - - [1536, 1024, 1, 64, 1536, 1536, 1536, 1024]
    - [1, 5059.09]
  - - [2048, 1024, 1, 64, 2048, 2048, 2048, 1024]
    - [14, 6382.35]
  - - [2560, 1024, 1, 64, 2560, 2560, 2560, 1024]
    - [16, 7330.14]
  - - [3072, 1024, 1, 64, 3072, 3072, 3072, 1024]
    - [3, 8293.41]
  - - [512, 1536, 1, 64, 512, 512, 512, 1536]
    - [14, 2906.4]
  - - [1024, 1536, 1, 64, 1024, 1024, 1024, 1536]
    - [14, 5139.29]
  - - [1536, 1536, 1, 64, 1536, 1536, 1536, 1536]
    - [17, 6799.58]
  - - [2048, 1536, 1, 64, 2048, 2048, 2048, 1536]
    - [17, 8393.85]
  - - [2560, 1536, 1, 64, 2560, 2560, 2560, 1536]
    - [16, 9518.09]
  - - [3072, 1536, 1, 64, 3072, 3072, 3072, 1536]
    - [3, 10446.0]
  - - [512, 2048, 1, 64, 512, 512, 512, 2048]
    - [14, 3731.69]
  - - [1024, 2048, 1, 64, 1024, 1024, 1024, 2048]
    - [26, 6019.54]
  - - [1536, 2048, 1, 64, 1536, 1536, 1536, 2048]
    - [2, 8313.96]
  - - [2048, 2048, 1, 64, 2048, 2048, 2048, 2048]
    - [15, 9870.22]
  - - [2560, 2048, 1, 64, 2560, 2560, 2560, 2048]
    - [16, 10998.9]
  - - [3072, 2048, 1, 64, 3072, 3072, 3072, 2048]
    - [14, 12171.4]
  - - [512, 2560, 1, 64, 512, 512, 512, 2560]
    - [14, 4496.71]
  - - [1024, 2560, 1, 64, 1024, 1024, 1024, 2560]
    - [2, 7445.95]
  - - [1536, 2560, 1, 64, 1536, 1536, 1536, 2560]
    - [1, 9391.81]
  - - [2048, 2560, 1, 64, 2048, 2048, 2048, 2560]
    - [1, 10970.0]
  - - [2560, 2560, 1, 64, 2560, 2560, 2560, 2560]
    - [14, 12334.7]
  - - [3072, 2560, 1, 64, 3072, 3072, 3072, 2560]
    - [3, 13464.9]
  - - [512, 3072, 1, 64, 512, 512, 512, 3072]
    - [16, 5147.31]
  - - [1024, 3072, 1, 64, 1024, 1024, 1024, 3072]
    - [16, 8257.69]
  - - [1536, 3072, 1, 64, 1536, 1536, 1536, 3072]
    - [3, 10245.5]
  - - [2048, 3072, 1, 64, 2048, 2048, 2048, 3072]
    - [3, 12087.1]
  - - [2560, 3072, 1, 64, 2560, 2560, 2560, 3072]
    - [3, 13466.7]
  - - [3072, 3072, 1, 64, 3072, 3072, 3072, 3072]
    - [17, 14502.0]
  - - [512, 512, 1, 256, 512, 512, 512, 512]
    - [13, 3926.33]
  - - [1024, 512, 1, 256, 1024, 1024, 1024, 512]
    - [28, 7237.41]
  - - [1536, 512, 1, 256, 1536, 1536, 1536, 512]
    - [24, 10045.0]
  - - [2048, 512, 1, 256, 2048, 2048, 2048, 512]
    - [28, 12479.3]
  - - [2560, 512, 1, 256, 2560, 2560, 2560, 512]
    - [10, 14485.9]
  - - [3072, 512, 1, 256, 3072, 3072, 3072, 512]
    - [14, 16481.2]
  - - [512, 1024, 1, 256, 512, 512, 512, 1024]
    - [14, 7391.25]
  - - [1024, 1024, 1, 256, 1024, 1024, 1024, 1024]
    - [4, 12332.8]
  - - [1536, 1024, 1, 256, 1536, 1536, 1536, 1024]
    - [28, 16212.2]
  - - [2048, 1024, 1, 256, 2048, 2048, 2048, 1024]
    - [29, 19144.6]
  - - [2560, 1024, 1, 256, 2560, 2560, 2560, 1024]
    - [11, 21990.3]
  - - [3072, 1024, 1, 256, 3072, 3072, 3072, 1024]
    - [14, 23847.9]
  - - [512, 1536, 1, 256, 512, 512, 512, 1536]
    - [20, 9980.0]
  - - [1024, 1536, 1, 256, 1024, 1024, 1024, 1536]
    - [23, 16307.7]
  - - [1536, 1536, 1, 256, 1536, 1536, 1536, 1536]
    - [14, 20762.8]
  - - [2048, 1536, 1, 256, 2048, 2048, 2048, 1536]
    - [11, 23840.8]
  - - [2560, 1536, 1, 256, 2560, 2560, 2560, 1536]
    - [4, 25905.4]
  - - [3072, 1536, 1, 256, 3072, 3072, 3072, 1536]
    - [4, 28319.3]
  - - [512, 2048, 1, 256, 512, 512, 512, 2048]
    - [21, 12381.1]
  - - [1024, 2048, 1, 256, 1024, 1024, 1024, 2048]
    - [5, 19352.3]
  - - [1536, 2048, 1, 256, 1536, 1536, 1536, 2048]
    - [6, 23773.6]
  - - [2048, 2048, 1, 256, 2048, 2048, 2048, 2048]
    - [14, 27009.3]
  - - [2560, 2048, 1, 256, 2560, 2560, 2560, 2048]
    - [10, 29132.2]
  - - [3072, 2048, 1, 256, 3072, 3072, 3072, 2048]
    - [5, 31419.5]
  - - [512, 2560, 1, 256, 512, 512, 512, 2560]
    - [11, 14485.9]
  - - [1024, 2560, 1, 256, 1024, 1024, 1024, 2560]
    - [5, 21670.4]
  - - [1536, 2560, 1, 256, 1536, 1536, 1536, 2560]
    - [2, 26236.6]
  - - [2048, 2560, 1, 256, 2048, 2048, 2048, 2560]
    - [14, 29417.3]
  - - [2560, 2560, 1, 256, 2560, 2560, 2560, 2560]
    - [10, 32021.6]
  - - [3072, 2560, 1, 256, 3072, 3072, 3072, 2560]
    - [11, 33631.5]
  - - [512, 3072, 1, 256, 512, 512, 512, 3072]
    - [23, 16290.9]
  - - [1024, 3072, 1, 256, 1024, 1024, 1024, 3072]
    - [5, 23890.3]
  - - [1536, 3072, 1, 256, 1536, 1536, 1536, 3072]
    - [14, 28193.4]
  - - [2048, 3072, 1, 256, 2048, 2048, 2048, 3072]
    - [0, 31230.4]
  - - [2560, 3072, 1, 256, 2560, 2560, 2560, 3072]
    - [8, 33634.3]
  - - [3072, 3072, 1, 256, 3072, 3072, 3072, 3072]
    - [10, 35041.5]
  - - [512, 512, 1, 512, 512, 512, 512, 512]
    - [21, 7342.73]
  - - [1024, 512, 1, 512, 1024, 1024, 1024, 512]
    - [14, 12834.9]
  - - [1536, 512, 1, 512, 1536, 1536, 1536, 512]
    - [27, 17051.1]
  - - [2048, 512, 1, 512, 2048, 2048, 2048, 512]
    - [23, 20515.5]
  - - [2560, 512, 1, 512, 2560, 2560, 2560, 512]
    - [4, 23404.1]
  - - [3072, 512, 1, 512, 3072, 3072, 3072, 512]
    - [21, 25717.1]
  - - [512, 1024, 1, 512, 512, 512, 512, 1024]
    - [21, 12915.5]
  - - [1024, 1024, 1, 512, 1024, 1024, 1024, 1024]
    - [20, 20523.0]
  - - [1536, 1024, 1, 512, 1536, 1536, 1536, 1024]
    - [23, 25680.6]
  - - [2048, 1024, 1, 512, 2048, 2048, 2048, 1024]
    - [20, 29556.5]
  - - [2560, 1024, 1, 512, 2560, 2560, 2560, 1024]
    - [21, 32730.4]
  - - [3072, 1024, 1, 512, 3072, 3072, 3072, 1024]
    - [0, 34412.6]
  - - [512, 1536, 1, 512, 512, 512, 512, 1536]
    - [28, 16957.7]
  - - [1024, 1536, 1, 512, 1024, 1024, 1024, 1536]
    - [14, 25999.9]
  - - [1536, 1536, 1, 512, 1536, 1536, 1536, 1536]
    - [21, 31467.9]
  - - [2048, 1536, 1, 512, 2048, 2048, 2048, 1536]
    - [5, 34519.9]
  - - [2560, 1536, 1, 512, 2560, 2560, 2560, 1536]
    - [21, 37462.4]
  - - [3072, 1536, 1, 512, 3072, 3072, 3072, 1536]
    - [21, 38864.9]
  - - [512, 2048, 1, 512, 512, 512, 512, 2048]
    - [14, 20507.7]
  - - [1024, 2048, 1, 512, 1024, 1024, 1024, 2048]
    - [27, 29725.0]
  - - [1536, 2048, 1, 512, 1536, 1536, 1536, 2048]
    - [27, 35096.5]
  - - [2048, 2048, 1, 512, 2048, 2048, 2048, 2048]
    - [8, 38296.3]
  - - [2560, 2048, 1, 512, 2560, 2560, 2560, 2048]
    - [5, 40335.9]
  - - [3072, 2048, 1, 512, 3072, 3072, 3072, 2048]
    - [14, 42894.8]
  - - [512, 2560, 1, 512, 512, 512, 512, 2560]
    - [21, 23343.0]
  - - [1024, 2560, 1, 512, 1024, 1024, 1024, 2560]
    - [14, 32722.5]
  - - [1536, 2560, 1, 512, 1536, 1536, 1536, 2560]
    - [0, 37368.5]
  - - [2048, 2560, 1, 512, 2048, 2048, 2048, 2560]
    - [21, 41229.6]
  - - [2560, 2560, 1, 512, 2560, 2560, 2560, 2560]
    - [5, 43586.0]
  - - [3072, 2560, 1, 512, 3072, 3072, 3072, 2560]
    - [6, 44484.7]
  - - [512, 3072, 1, 512, 512, 512, 512, 3072]
    - [28, 25778.9]
  - - [1024, 3072, 1, 512, 1024, 1024, 1024, 3072]
    - [20, 34800.0]
  - - [1536, 3072, 1, 512, 1536, 1536, 1536, 3072]
    - [20, 39034.7]
  - - [2048, 3072, 1, 512, 2048, 2048, 2048, 3072]
    - [10, 43246.6]
  - - [2560, 3072, 1, 512, 2560, 2560, 2560, 3072]
    - [8, 45347.9]
  - - [3072, 3072, 1, 512, 3072, 3072, 3072, 3072]
    - [4, 46825.1]
  - - [512, 512, 1, 1024, 512, 512, 512, 512]
    - [21, 13121.0]
  - - [1024, 512, 1, 1024, 1024, 1024, 1024, 512]
    - [16, 21130.4]
  - - [1536, 512, 1, 1024, 1536, 1536, 1536, 512]
    - [25, 25866.2]
  - - [2048, 512, 1, 1024, 2048, 2048, 2048, 512]
    - [9, 28292.5]
  - - [2560, 512, 1, 1024, 2560, 2560, 2560, 512]
    - [27, 33258.4]
  - - [3072, 512, 1, 1024, 3072, 3072, 3072, 512]
    - [25, 35867.5]
  - - [512, 1024, 1, 1024, 512, 512, 512, 1024]
    - [16, 20920.0]
  - - [1024, 1024, 1, 1024, 1024, 1024, 1024, 1024]
    - [27, 29650.7]
  - - [1536, 1024, 1, 1024, 1536, 1536, 1536, 1024]
    - [25, 34200.3]
  - - [2048, 1024, 1, 1024, 2048, 2048, 2048, 1024]
    - [20, 38496.1]
  - - [2560, 1024, 1, 1024, 2560, 2560, 2560, 1024]
    - [0, 41360.1]
  - - [3072, 1024, 1, 1024, 3072, 3072, 3072, 1024]
    - [27, 44842.0]
  - - [512, 1536, 1, 1024, 512, 512, 512, 1536]
    - [27, 25895.3]
  - - [1024, 1536, 1, 1024, 1024, 1024, 1024, 1536]
    - [21, 35296.5]
  - - [1536, 1536, 1, 1024, 1536, 1536, 1536, 1536]
    - [25, 39940.1]
  - - [2048, 1536, 1, 1024, 2048, 2048, 2048, 1536]
    - [14, 44390.3]
  - - [2560, 1536, 1, 1024, 2560, 2560, 2560, 1536]
    - [16, 46803.0]
  - - [3072, 1536, 1, 1024, 3072, 3072, 3072, 1536]
    - [25, 48080.9]
  - - [512, 2048, 1, 1024, 512, 512, 512, 2048]
    - [21, 29745.2]
  - - [1024, 2048, 1, 1024, 1024, 1024, 1024, 2048]
    - [20, 38606.8]
  - - [1536, 2048, 1, 1024, 1536, 1536, 1536, 2048]
    - [27, 45153.8]
  - - [2048, 2048, 1, 1024, 2048, 2048, 2048, 2048]
    - [14, 46910.3]
  - - [2560, 2048, 1, 1024, 2560, 2560, 2560, 2048]
    - [27, 49743.7]
  - - [3072, 2048, 1, 1024, 3072, 3072, 3072, 2048]
    - [27, 51826.3]
  - - [512, 2560, 1, 1024, 512, 512, 512, 2560]
    - [25, 33045.1]
  - - [1024, 2560, 1, 1024, 1024, 1024, 1024, 2560]
    - [25, 41523.6]
  - - [1536, 2560, 1, 1024, 1536, 1536, 1536, 2560]
    - [20, 47002.7]
  - - [2048, 2560, 1, 1024, 2048, 2048, 2048, 2560]
    - [27, 49231.6]
  - - [2560, 2560, 1, 1024, 2560, 2560, 2560, 2560]
    - [20, 52266.9]
  - - [3072, 2560, 1, 1024, 3072, 3072, 3072, 2560]
    - [21, 53650.6]
  - - [512, 3072, 1, 1024, 512, 512, 512, 3072]
    - [27, 35887.5]
  - - [1024, 3072, 1, 1024, 1024, 1024, 1024, 3072]
    - [25, 44061.8]
  - - [1536, 3072, 1, 1024, 1536, 1536, 1536, 3072]
    - [25, 47816.3]
  - - [2048, 3072, 1, 1024, 2048, 2048, 2048, 3072]
    - [21, 52304.7]
  - - [2560, 3072, 1, 1024, 2560, 2560, 2560, 3072]
    - [14, 52896.6]
  - - [3072, 3072, 1, 1024, 3072, 3072, 3072, 3072]
    - [16, 54494.4]
  - - [512, 512, 1, 2048, 512, 512, 512, 512]
    - [21, 19777.2]
  - - [1024, 512, 1, 2048, 1024, 1024, 1024, 512]
    - [20, 27887.6]
  - - [1536, 512, 1, 2048, 1536, 1536, 1536, 512]
    - [29, 33084.7]
  - - [2048, 512, 1, 2048, 2048, 2048, 2048, 512]
    - [25, 38725.5]
  - - [2560, 512, 1, 2048, 2560, 2560, 2560, 512]
    - [0, 42234.1]
  - - [3072, 512, 1, 2048, 3072, 3072, 3072, 512]
    - [27, 43806.5]
  - - [512, 1024, 1, 2048, 512, 512, 512, 1024]
    - [28, 27654.2]
  - - [1024, 1024, 1, 2048, 1024, 1024, 1024, 1024]
    - [23, 30181.0]
  - - [1536, 1024, 1, 2048, 1536, 1536, 1536, 1024]
    - [27, 45014.6]
  - - [2048, 1024, 1, 2048, 2048, 2048, 2048, 1024]
    - [21, 46910.3]
  - - [2560, 1024, 1, 2048, 2560, 2560, 2560, 1024]
    - [25, 50799.9]
  - - [3072, 1024, 1, 2048, 3072, 3072, 3072, 1024]
    - [21, 52061.3]
  - - [512, 1536, 1, 2048, 512, 512, 512, 1536]
    - [21, 35495.6]
  - - [1024, 1536, 1, 2048, 1024, 1024, 1024, 1536]
    - [28, 43723.0]
  - - [1536, 1536, 1, 2048, 1536, 1536, 1536, 1536]
    - [21, 48867.7]
  - - [2048, 1536, 1, 2048, 2048, 2048, 2048, 1536]
    - [21, 51125.7]
  - - [2560, 1536, 1, 2048, 2560, 2560, 2560, 1536]
    - [25, 53691.7]
  - - [3072, 1536, 1, 2048, 3072, 3072, 3072, 1536]
    - [25, 54221.8]
  - - [512, 2048, 1, 2048, 512, 512, 512, 2048]
    - [21, 39039.1]
  - - [1024, 2048, 1, 2048, 1024, 1024, 1024, 2048]
    - [22, 46125.7]
  - - [1536, 2048, 1, 2048, 1536, 1536, 1536, 2048]
    - [25, 52675.5]
  - - [2048, 2048, 1, 2048, 2048, 2048, 2048, 2048]
    - [20, 53276.5]
  - - [2560, 2048, 1, 2048, 2560, 2560, 2560, 2048]
    - [25, 55313.4]
  - - [3072, 2048, 1, 2048, 3072, 3072, 3072, 2048]
    - [4, 55684.8]
  - - [512, 2560, 1, 2048, 512, 512, 512, 2560]
    - [27, 41261.3]
  - - [1024, 2560, 1, 2048, 1024, 1024, 1024, 2560]
    - [27, 49229.4]
  - - [1536, 2560, 1, 2048, 1536, 1536, 1536, 2560]
    - [25, 52968.3]
  - - [2048, 2560, 1, 2048, 2048, 2048, 2048, 2560]
    - [25, 54919.5]
  - - [2560, 2560, 1, 2048, 2560, 2560, 2560, 2560]
    - [20, 56574.4]
  - - [3072, 2560, 1, 2048, 3072, 3072, 3072, 2560]
    - [14, 58878.4]
  - - [512, 3072, 1, 2048, 512, 512, 512, 3072]
    - [21, 44676.9]
  - - [1024, 3072, 1, 2048, 1024, 1024, 1024, 3072]
    - [25, 52088.6]
  - - [1536, 3072, 1, 2048, 1536, 1536, 1536, 3072]
    - [27, 54662.8]
  - - [2048, 3072, 1, 2048, 2048, 2048, 2048, 3072]
    - [25, 57252.7]
  - - [2560, 3072, 1, 2048, 2560, 2560, 2560, 3072]
    - [25, 57539.1]
  - - [3072, 3072, 1, 2048, 3072, 3072, 3072, 3072]
    - [14, 58395.7]
  - - [512, 512, 1, 3072, 512, 512, 512, 512]
    - [21, 24850.5]
  - - [1024, 512, 1, 3072, 1024, 1024, 1024, 512]
    - [27, 32814.4]
  - - [1536, 512, 1, 3072, 1536, 1536, 1536, 512]
    - [25, 40233.1]
  - - [2048, 512, 1, 3072, 2048, 2048, 2048, 512]
    - [25, 44055.5]
  - - [2560, 512, 1, 3072, 2560, 2560, 2560, 512]
    - [0, 45579.4]
  - - [3072, 512, 1, 3072, 3072, 3072, 3072, 512]
    - [25, 49309.8]
  - - [512, 1024, 1, 3072, 512, 512, 512, 1024]
    - [20, 34317.3]
  - - [1024, 1024, 1, 3072, 1024, 1024, 1024, 1024]
    - [20, 43171.3]
  - - [1536, 1024, 1, 3072, 1536, 1536, 1536, 1024]
    - [21, 48435.8]
  - - [2048, 1024, 1, 3072, 2048, 2048, 2048, 1024]
    - [14, 50278.2]
  - - [2560, 1024, 1, 3072, 2560, 2560, 2560, 1024]
    - [27, 53477.5]
  - - [3072, 1024, 1, 3072, 3072, 3072, 3072, 1024]
    - [25, 53902.1]
  - - [512, 1536, 1, 3072, 512, 512, 512, 1536]
    - [21, 40756.8]
  - - [1024, 1536, 1, 3072, 1024, 1024, 1024, 1536]
    - [21, 48249.4]
  - - [1536, 1536, 1, 3072, 1536, 1536, 1536, 1536]
    - [25, 53331.4]
  - - [2048, 1536, 1, 3072, 2048, 2048, 2048, 1536]
    - [27, 55457.9]
  - - [2560, 1536, 1, 3072, 2560, 2560, 2560, 1536]
    - [20, 55672.1]
  - - [3072, 1536, 1, 3072, 3072, 3072, 3072, 1536]
    - [20, 58044.9]
  - - [512, 2048, 1, 3072, 512, 512, 512, 2048]
    - [27, 43791.6]
  - - [1024, 2048, 1, 3072, 1024, 1024, 1024, 2048]
    - [27, 51937.2]
  - - [1536, 2048, 1, 3072, 1536, 1536, 1536, 2048]
    - [8, 53601.0]
  - - [2048, 2048, 1, 3072, 2048, 2048, 2048, 2048]
    - [25, 57229.9]
  - - [2560, 2048, 1, 3072, 2560, 2560, 2560, 2048]
    - [25, 58061.8]
  - - [3072, 2048, 1, 3072, 3072, 3072, 3072, 2048]
    - [25, 57574.8]
  - - [512, 2560, 1, 3072, 512, 512, 512, 2560]
    - [0, 46577.8]
  - - [1024, 2560, 1, 3072, 1024, 1024, 1024, 2560]
    - [21, 54750.5]
  - - [1536, 2560, 1, 3072, 1536, 1536, 1536, 2560]
    - [16, 56175.3]
  - - [2048, 2560, 1, 3072, 2048, 2048, 2048, 2560]
    - [14, 59312.9]
  - - [2560, 2560, 1, 3072, 2560, 2560, 2560, 2560]
    - [14, 59733.1]
  - - [3072, 2560, 1, 3072, 3072, 3072, 3072, 2560]
    - [16, 59084.4]
  - - [512, 3072, 1, 3072, 512, 512, 512, 3072]
    - [14, 48579.7]
  - - [1024, 3072, 1, 3072, 1024, 1024, 1024, 3072]
    - [16, 54852.4]
  - - [1536, 3072, 1, 3072, 1536, 1536, 1536, 3072]
    - [16, 57769.1]
  - - [2048, 3072, 1, 3072, 2048, 2048, 2048, 3072]
    - [16, 58518.0]
  - - [2560, 3072, 1, 3072, 2560, 2560, 2560, 3072]
    - [16, 59427.3]
  - - [3072, 3072, 1, 3072, 3072, 3072, 3072, 3072]
    - [14, 60068.0]
  - - [64, 64, 1, 1, 64, 64, 64, 64]
    - [19, 0.226311]
  - - [64, 64, 1, 64, 64, 64, 64, 64]
    - [7, 15.3687]
  - - [64, 64, 1, 256, 64, 64, 64, 64]
    - [12, 58.9966]
  - - [64, 64, 1, 512, 64, 64, 64, 64]
    - [18, 113.516]
  - - [64, 64, 1, 1024, 64, 64, 64, 64]
    - [12, 210.373]
  - - [64, 64, 1, 2048, 64, 64, 64, 64]
    - [12, 367.47]
  - - [64, 64, 1, 4096, 64, 64, 64, 64]
    - [12, 575.943]
- null
- null
- DeviceEfficiency
- GridBased
