library/src/amd_detail/rocblaslt/src/Tensile/Logic/asm_full/gfx1200/GridBased/gfx1200_Cijk_Ailk_Bljk_HSS_BH_Bias_HAS_SAV_UserArgs.yaml
- {MinimumRequiredVersion: 4.33.0}
- gfx1200
- gfx1200
- [Device 73f0]
    SolutionIndex: 0
    SolutionNameMin: Cijk_Ailk_Bljk_HSS_BH_Bias_HAS_SAV_UserArgs_MT32x32x32_MI16x16x1_SN_LDSB0_CLR1_GSU1_LBSPPA512_LBSPPB128_MIWT1_1_NLCA1_PGR1_PLR1_SS0_SU32_SUM0_SUS256_SVW8_TLDS1_WG32_4_1_WGM8
    SolutionIndex: 1
    SolutionNameMin: Cijk_Ailk_Bljk_HSS_BH_Bias_HAS_SAV_UserArgs_MT64x32x32_MI16x16x1_SN_LDSB0_CLR1_GSU1_LBSPPA1024_LBSPPB128_MIWT2_1_NLCA1_PGR1_PLR1_SS0_SU32_SUM0_SUS256_SVW8_TLDS1_WG32_4_1_WGM8
    SolutionIndex: 2
    SolutionNameMin: Cijk_Ailk_Bljk_HSS_BH_Bias_HAS_SAV_UserArgs_MT64x32x32_MI16x16x1_SN_LDSB0_CLR1_GSU1_LBSPPA1024_LBSPPB128_MIWT2_1_NLCA1_PGR2_PLR1_SS0_SU32_SUM0_SUS256_SVW8_TLDS1_WG32_4_1_WGM8
    SolutionIndex: 3
    SolutionNameMin: Cijk_Ailk_Bljk_HSS_BH_Bias_HAS_SAV_UserArgs_MT32x64x32_MI16x16x1_SN_LDSB0_CLR1_GSU1_LBSPPA512_LBSPPB128_MIWT2_1_NLCA1_PGR1_PLR1_SS0_SU32_SUM0_SUS256_SVW8_TLDS1_WG16_8_1_WGM8
    SolutionIndex: 4
    SolutionNameMin: Cijk_Ailk_Bljk_HSS_BH_Bias_HAS_SAV_UserArgs_MT32x32x64_MI16x16x1_SN_LDSB0_CLR1_GSU1_LBSPPA512_LBSPPB128_MIWT1_1_NLCA1_PGR1_PLR1_SS0_SU32_SUM0_SUS256_SVW8_TLDS1_WG32_4_1_WGM8
    SolutionIndex: 5
    SolutionNameMin: Cijk_Ailk_Bljk_HSS_BH_Bias_HAS_SAV_UserArgs_MT32x32x64_MI16x16x1_SN_LDSB0_CLR1_GSU1_LBSPPA512_LBSPPB512_MIWT1_1_NLCA1_PGR1_PLR3_SS0_SU32_SUM0_SUS256_SVW8_TLDS0_WG32_4_1_WGM8
    SolutionIndex: 6
    SolutionNameMin: Cijk_Ailk_Bljk_HSS_BH_Bias_HAS_SAV_UserArgs_MT32x32x64_MI16x16x1_SN_LDSB0_CLR1_GSU1_LBSPPA512_LBSPPB128_MIWT1_1_NLCA1_PGR2_PLR3_SS0_SU32_SUM0_SUS256_SVW8_TLDS1_WG32_4_1_WGM8
    SolutionIndex: 7
    SolutionNameMin: Cijk_Ailk_Bljk_HSS_BH_Bias_HAS_SAV_UserArgs_MT64x32x64_MI16x16x1_SN_LDSB0_CLR1_GSU1_LBSPPA1024_LBSPPB128_MIWT2_1_NLCA1_PGR1_PLR1_SS0_SU32_SUM0_SUS256_SVW8_TLDS1_WG32_4_1_WGM8
    SolutionIndex: 8
    SolutionNameMin: Cijk_Ailk_Bljk_HSS_BH_Bias_HAS_SAV_UserArgs_MT64x32x64_MI16x16x1_SN_LDSB0_CLR1_GSU1_LBSPPA1024_LBSPPB128_MIWT2_1_NLCA1_PGR1_PLR3_SS0_SU32_SUM0_SUS256_SVW8_TLDS1_WG32_4_1_WGM8
    SolutionIndex: 9
    SolutionNameMin: Cijk_Ailk_Bljk_HSS_BH_Bias_HAS_SAV_UserArgs_MT64x16x32_MI16x16x1_SN_LDSB0_CLR1_GSU1_LBSPPA1024_LBSPPB128_MIWT1_1_NLCA1_PGR1_PLR1_SS1_SU32_SUM0_SUS256_SVW1_TLDS1_WG64_2_1_WGM8
    SolutionIndex: 10
    SolutionNameMin: Cijk_Ailk_Bljk_HSS_BH_Bias_HAS_SAV_UserArgs_MT32x32x32_MI16x16x1_SN_LDSB0_CLR1_GSU1_LBSPPA512_LBSPPB128_MIWT1_1_NLCA1_PGR1_PLR1_SS1_SU32_SUM0_SUS256_SVW1_TLDS1_WG32_4_1_WGM8
    SolutionIndex: 11
    SolutionNameMin: Cijk_Ailk_Bljk_HSS_BH_Bias_HAS_SAV_UserArgs_MT32x32x32_MI16x16x1_SN_LDSB0_CLR1_GSU1_LBSPPA512_LBSPPB128_MIWT1_1_NLCA1_PGR2_PLR1_SS1_SU32_SUM0_SUS256_SVW1_TLDS1_WG32_4_1_WGM8
    SolutionIndex: 12
    SolutionNameMin: Cijk_Ailk_Bljk_HSS_BH_Bias_HAS_SAV_UserArgs_MT32x32x32_MI16x16x1_SN_LDSB0_CLR0_GSU1_LBSPPA512_LBSPPB128_MIWT1_1_NLCA1_PGR2_PLR0_SS1_SU32_SUM0_SUS256_SVW1_TLDS1_WG32_4_1_WGM8
    SolutionIndex: 13
    SolutionNameMin: Cijk_Ailk_Bljk_HSS_BH_Bias_HAS_SAV_UserArgs_MT64x32x32_MI16x16x1_SN_LDSB0_CLR1_GSU1_LBSPPA1024_LBSPPB128_MIWT2_1_NLCA1_PGR1_PLR1_SS1_SU32_SUM0_SUS256_SVW1_TLDS1_WG32_4_1_WGM8
    SolutionIndex: 14
    SolutionNameMin: Cijk_Ailk_Bljk_HSS_BH_Bias_HAS_SAV_UserArgs_MT64x32x32_MI16x16x1_SN_LDSB0_CLR1_GSU1_LBSPPA1024_LBSPPB128_MIWT2_1_NLCA1_PGR2_PLR1_SS1_SU32_SUM0_SUS256_SVW1_TLDS1_WG32_4_1_WGM8
    SolutionIndex: 15
    SolutionNameMin: Cijk_Ailk_Bljk_HSS_BH_Bias_HAS_SAV_UserArgs_MT64x32x32_MI16x16x1_SN_LDSB0_CLR0_GSU1_LBSPPA1024_LBSPPB128_MIWT2_1_NLCA1_PGR1_PLR0_SS1_SU32_SUM0_SUS256_SVW1_TLDS1_WG32_4_1_WGM8
    SolutionIndex: 16
    SolutionNameMin: Cijk_Ailk_Bljk_HSS_BH_Bias_HAS_SAV_UserArgs_MT16x64x32_MI16x16x1_SN_LDSB0_CLR0_GSU1_LBSPPA256_LBSPPB128_MIWT1_1_NLCA1_PGR2_PLR0_SS1_SU32_SUM0_SUS256_SVW1_TLDS1_WG16_8_1_WGM8
    SolutionIndex: 17
    SolutionNameMin: Cijk_Ailk_Bljk_HSS_BH_Bias_HAS_SAV_UserArgs_MT32x64x32_MI16x16x1_SN_LDSB0_CLR1_GSU1_LBSPPA512_LBSPPB128_MIWT2_1_NLCA1_PGR1_PLR1_SS1_SU32_SUM0_SUS256_SVW1_TLDS1_WG16_8_1_WGM8
    SolutionIndex: 18
    SolutionNameMin: Cijk_Ailk_Bljk_HSS_BH_Bias_HAS_SAV_UserArgs_MT32x64x32_MI16x16x1_SN_LDSB0_CLR1_GSU1_LBSPPA512_LBSPPB128_MIWT2_1_NLCA1_PGR2_PLR1_SS1_SU32_SUM0_SUS256_SVW1_TLDS1_WG16_8_1_WGM8
    SolutionIndex: 19
    SolutionNameMin: Cijk_Ailk_Bljk_HSS_BH_Bias_HAS_SAV_UserArgs_MT32x64x32_MI16x16x1_SN_LDSB0_CLR0_GSU1_LBSPPA512_LBSPPB128_MIWT2_1_NLCA1_PGR2_PLR0_SS1_SU32_SUM0_SUS256_SVW1_TLDS1_WG16_8_1_WGM8
    SolutionIndex: 20
    SolutionNameMin: Cijk_Ailk_Bljk_HSS_BH_Bias_HAS_SAV_UserArgs_MT32x32x64_MI16x16x1_SN_LDSB0_CLR1_GSU1_LBSPPA512_LBSPPB128_MIWT1_1_NLCA1_PGR1_PLR3_SS1_SU32_SUM0_SUS256_SVW1_TLDS1_WG32_4_1_WGM8
    SolutionIndex: 21
    SolutionNameMin: Cijk_Ailk_Bljk_HSS_BH_Bias_HAS_SAV_UserArgs_MT32x32x64_MI16x16x1_SN_LDSB0_CLR0_GSU1_LBSPPA512_LBSPPB512_MIWT1_1_NLCA1_PGR2_PLR0_SS1_SU32_SUM0_SUS256_SVW1_TLDS0_WG32_4_1_WGM8
- - - [512, 512, 1, 64, 512, 512, 512, 64]
    - [13, 1122.0]
  - - [1024, 512, 1, 64, 1024, 1024, 1024, 64]
    - [19, 2039.04]
  - - [1536, 512, 1, 64, 1536, 1536, 1536, 64]
    - [13, 2770.88]
  - - [2048, 512, 1, 64, 2048, 2048, 2048, 64]
    - [18, 3333.28]
  - - [2560, 512, 1, 64, 2560, 2560, 2560, 64]
    - [14, 4124.5]
  - - [3072, 512, 1, 64, 3072, 3072, 3072, 64]
    - [2, 4673.21]
  - - [512, 1024, 1, 64, 512, 512, 512, 64]
    - [15, 2129.09]
  - - [1024, 1024, 1, 64, 1024, 1024, 1024, 64]
    - [17, 3722.27]
  - - [1536, 1024, 1, 64, 1536, 1536, 1536, 64]
    - [1, 5052.74]
  - - [2048, 1024, 1, 64, 2048, 2048, 2048, 64]
    - [13, 6166.39]
  - - [2560, 1024, 1, 64, 2560, 2560, 2560, 64]
    - [1, 7236.71]
  - - [3072, 1024, 1, 64, 3072, 3072, 3072, 64]
    - [1, 7668.27]
  - - [512, 1536, 1, 64, 512, 512, 512, 64]
    - [13, 2967.32]
  - - [1024, 1536, 1, 64, 1024, 1024, 1024, 64]
    - [14, 4778.7]
  - - [1536, 1536, 1, 64, 1536, 1536, 1536, 64]
    - [18, 6386.05]
  - - [2048, 1536, 1, 64, 2048, 2048, 2048, 64]
    - [17, 7684.37]
  - - [2560, 1536, 1, 64, 2560, 2560, 2560, 64]
    - [17, 8893.15]
  - - [3072, 1536, 1, 64, 3072, 3072, 3072, 64]
    - [2, 9866.37]
  - - [512, 2048, 1, 64, 512, 512, 512, 64]
    - [17, 3545.95]
  - - [1024, 2048, 1, 64, 1024, 1024, 1024, 64]
    - [18, 5794.36]
  - - [1536, 2048, 1, 64, 1536, 1536, 1536, 64]
    - [2, 8127.35]
  - - [2048, 2048, 1, 64, 2048, 2048, 2048, 64]
    - [1, 9124.1]
  - - [2560, 2048, 1, 64, 2560, 2560, 2560, 64]
    - [1, 10477.4]
  - - [3072, 2048, 1, 64, 3072, 3072, 3072, 64]
    - [2, 11351.3]
  - - [512, 2560, 1, 64, 512, 512, 512, 64]
    - [14, 4355.23]
  - - [1024, 2560, 1, 64, 1024, 1024, 1024, 64]
    - [14, 6922.58]
  - - [1536, 2560, 1, 64, 1536, 1536, 1536, 64]
    - [2, 9400.58]
  - - [2048, 2560, 1, 64, 2048, 2048, 2048, 64]
    - [2, 10397.9]
  - - [2560, 2560, 1, 64, 2560, 2560, 2560, 64]
    - [1, 11789.4]
  - - [3072, 2560, 1, 64, 3072, 3072, 3072, 64]
    - [1, 13052.0]
  - - [512, 3072, 1, 64, 512, 512, 512, 64]
    - [1, 5057.82]
  - - [1024, 3072, 1, 64, 1024, 1024, 1024, 64]
    - [2, 8128.82]
  - - [1536, 3072, 1, 64, 1536, 1536, 1536, 64]
    - [2, 10473.4]
  - - [2048, 3072, 1, 64, 2048, 2048, 2048, 64]
    - [2, 11674.5]
  - - [2560, 3072, 1, 64, 2560, 2560, 2560, 64]
    - [2, 13437.7]
  - - [3072, 3072, 1, 64, 3072, 3072, 3072, 64]
    - [2, 13927.2]
  - - [512, 512, 1, 256, 512, 512, 512, 256]
    - [10, 3788.57]
  - - [1024, 512, 1, 256, 1024, 1024, 1024, 256]
    - [13, 6980.87]
  - - [1536, 512, 1, 256, 1536, 1536, 1536, 256]
    - [17, 9154.75]
  - - [2048, 512, 1, 256, 2048, 2048, 2048, 256]
    - [13, 10953.6]
  - - [2560, 512, 1, 256, 2560, 2560, 2560, 256]
    - [13, 12263.4]
  - - [3072, 512, 1, 256, 3072, 3072, 3072, 256]
    - [13, 14501.1]
  - - [512, 1024, 1, 256, 512, 512, 512, 256]
    - [13, 7282.57]
  - - [1024, 1024, 1, 256, 1024, 1024, 1024, 256]
    - [13, 11369.8]
  - - [1536, 1024, 1, 256, 1536, 1536, 1536, 256]
    - [1, 14461.8]
  - - [2048, 1024, 1, 256, 2048, 2048, 2048, 256]
    - [13, 16835.1]
  - - [2560, 1024, 1, 256, 2560, 2560, 2560, 256]
    - [1, 18078.9]
  - - [3072, 1024, 1, 256, 3072, 3072, 3072, 256]
    - [17, 19645.2]
  - - [512, 1536, 1, 256, 512, 512, 512, 256]
    - [13, 9262.36]
  - - [1024, 1536, 1, 256, 1024, 1024, 1024, 256]
    - [17, 14448.8]
  - - [1536, 1536, 1, 256, 1536, 1536, 1536, 256]
    - [17, 17689.2]
  - - [2048, 1536, 1, 256, 2048, 2048, 2048, 256]
    - [17, 20129.9]
  - - [2560, 1536, 1, 256, 2560, 2560, 2560, 256]
    - [17, 21427.5]
  - - [3072, 1536, 1, 256, 3072, 3072, 3072, 256]
    - [13, 23486.5]
  - - [512, 2048, 1, 256, 512, 512, 512, 256]
    - [13, 11501.6]
  - - [1024, 2048, 1, 256, 1024, 1024, 1024, 256]
    - [17, 16805.8]
  - - [1536, 2048, 1, 256, 1536, 1536, 1536, 256]
    - [1, 20168.0]
  - - [2048, 2048, 1, 256, 2048, 2048, 2048, 256]
    - [13, 22381.0]
  - - [2560, 2048, 1, 256, 2560, 2560, 2560, 256]
    - [1, 23757.0]
  - - [3072, 2048, 1, 256, 3072, 3072, 3072, 256]
    - [1, 25799.7]
  - - [512, 2560, 1, 256, 512, 512, 512, 256]
    - [1, 12800.0]
  - - [1024, 2560, 1, 256, 1024, 1024, 1024, 256]
    - [17, 18791.7]
  - - [1536, 2560, 1, 256, 1536, 1536, 1536, 256]
    - [1, 22012.0]
  - - [2048, 2560, 1, 256, 2048, 2048, 2048, 256]
    - [13, 24146.4]
  - - [2560, 2560, 1, 256, 2560, 2560, 2560, 256]
    - [1, 25638.1]
  - - [3072, 2560, 1, 256, 3072, 3072, 3072, 256]
    - [17, 26760.9]
  - - [512, 3072, 1, 256, 512, 512, 512, 256]
    - [1, 14598.4]
  - - [1024, 3072, 1, 256, 1024, 1024, 1024, 256]
    - [17, 19547.5]
  - - [1536, 3072, 1, 256, 1536, 1536, 1536, 256]
    - [1, 23393.1]
  - - [2048, 3072, 1, 256, 2048, 2048, 2048, 256]
    - [17, 25592.5]
  - - [2560, 3072, 1, 256, 2560, 2560, 2560, 256]
    - [1, 26753.8]
  - - [3072, 3072, 1, 256, 3072, 3072, 3072, 256]
    - [13, 27771.1]
  - - [512, 512, 1, 512, 512, 512, 512, 512]
    - [8, 7004.74]
  - - [1024, 512, 1, 512, 1024, 1024, 1024, 512]
    - [17, 12209.1]
  - - [1536, 512, 1, 512, 1536, 1536, 1536, 512]
    - [1, 14611.9]
  - - [2048, 512, 1, 512, 2048, 2048, 2048, 512]
    - [13, 17041.1]
  - - [2560, 512, 1, 512, 2560, 2560, 2560, 512]
    - [1, 19406.8]
  - - [3072, 512, 1, 512, 3072, 3072, 3072, 512]
    - [13, 21158.0]
  - - [512, 1024, 1, 512, 512, 512, 512, 512]
    - [17, 12104.2]
  - - [1024, 1024, 1, 512, 1024, 1024, 1024, 512]
    - [13, 17024.9]
  - - [1536, 1024, 1, 512, 1536, 1536, 1536, 512]
    - [17, 20967.7]
  - - [2048, 1024, 1, 512, 2048, 2048, 2048, 512]
    - [13, 23366.9]
  - - [2560, 1024, 1, 512, 2560, 2560, 2560, 512]
    - [1, 25160.3]
  - - [3072, 1024, 1, 512, 3072, 3072, 3072, 512]
    - [1, 26429.7]
  - - [512, 1536, 1, 512, 512, 512, 512, 512]
    - [1, 14579.9]
  - - [1024, 1536, 1, 512, 1024, 1024, 1024, 512]
    - [1, 21030.7]
  - - [1536, 1536, 1, 512, 1536, 1536, 1536, 512]
    - [13, 24130.5]
  - - [2048, 1536, 1, 512, 2048, 2048, 2048, 512]
    - [17, 26690.5]
  - - [2560, 1536, 1, 512, 2560, 2560, 2560, 512]
    - [1, 27909.3]
  - - [3072, 1536, 1, 512, 3072, 3072, 3072, 512]
    - [1, 29358.6]
  - - [512, 2048, 1, 512, 512, 512, 512, 512]
    - [17, 17560.6]
  - - [1024, 2048, 1, 512, 1024, 1024, 1024, 512]
    - [13, 23260.5]
  - - [1536, 2048, 1, 512, 1536, 1536, 1536, 512]
    - [13, 26360.3]
  - - [2048, 2048, 1, 512, 2048, 2048, 2048, 512]
    - [13, 28292.3]
  - - [2560, 2048, 1, 512, 2560, 2560, 2560, 512]
    - [13, 29549.9]
  - - [3072, 2048, 1, 512, 3072, 3072, 3072, 512]
    - [13, 30442.3]
  - - [512, 2560, 1, 512, 512, 512, 512, 512]
    - [1, 19127.0]
  - - [1024, 2560, 1, 512, 1024, 1024, 1024, 512]
    - [13, 25136.5]
  - - [1536, 2560, 1, 512, 1536, 1536, 1536, 512]
    - [1, 27805.0]
  - - [2048, 2560, 1, 512, 2048, 2048, 2048, 512]
    - [13, 29234.0]
  - - [2560, 2560, 1, 512, 2560, 2560, 2560, 512]
    - [17, 30947.3]
  - - [3072, 2560, 1, 512, 3072, 3072, 3072, 512]
    - [13, 31436.2]
  - - [512, 3072, 1, 512, 512, 512, 512, 512]
    - [13, 20850.7]
  - - [1024, 3072, 1, 512, 1024, 1024, 1024, 512]
    - [3, 26330.1]
  - - [1536, 3072, 1, 512, 1536, 1536, 1536, 512]
    - [3, 29082.4]
  - - [2048, 3072, 1, 512, 2048, 2048, 2048, 512]
    - [13, 30915.1]
  - - [2560, 3072, 1, 512, 2560, 2560, 2560, 512]
    - [17, 31885.0]
  - - [3072, 3072, 1, 512, 3072, 3072, 3072, 512]
    - [17, 31935.6]
  - - [512, 512, 1, 1024, 512, 512, 512, 1024]
    - [7, 10723.5]
  - - [1024, 512, 1, 1024, 1024, 1024, 1024, 1024]
    - [13, 17537.6]
  - - [1536, 512, 1, 1024, 1536, 1536, 1536, 1024]
    - [1, 19712.8]
  - - [2048, 512, 1, 1024, 2048, 2048, 2048, 1024]
    - [1, 23288.3]
  - - [2560, 512, 1, 1024, 2560, 2560, 2560, 1024]
    - [1, 24817.4]
  - - [3072, 512, 1, 1024, 3072, 3072, 3072, 1024]
    - [13, 27182.6]
  - - [512, 1024, 1, 1024, 512, 512, 512, 1024]
    - [13, 17814.3]
  - - [1024, 1024, 1, 1024, 1024, 1024, 1024, 1024]
    - [17, 23660.9]
  - - [1536, 1024, 1, 1024, 1536, 1536, 1536, 1024]
    - [13, 26981.8]
  - - [2048, 1024, 1, 1024, 2048, 2048, 2048, 1024]
    - [1, 28262.7]
  - - [2560, 1024, 1, 1024, 2560, 2560, 2560, 1024]
    - [1, 29928.1]
  - - [3072, 1024, 1, 1024, 3072, 3072, 3072, 1024]
    - [13, 31244.0]
  - - [512, 1536, 1, 1024, 512, 512, 512, 1024]
    - [17, 20279.7]
  - - [1024, 1536, 1, 1024, 1024, 1024, 1024, 1024]
    - [1, 26866.8]
  - - [1536, 1536, 1, 1024, 1536, 1536, 1536, 1024]
    - [1, 29253.6]
  - - [2048, 1536, 1, 1024, 2048, 2048, 2048, 1024]
    - [13, 30938.8]
  - - [2560, 1536, 1, 1024, 2560, 2560, 2560, 1024]
    - [13, 32433.1]
  - - [3072, 1536, 1, 1024, 3072, 3072, 3072, 1024]
    - [13, 32618.0]
  - - [512, 2048, 1, 1024, 512, 512, 512, 1024]
    - [13, 24043.1]
  - - [1024, 2048, 1, 1024, 1024, 1024, 1024, 1024]
    - [13, 28590.6]
  - - [1536, 2048, 1, 1024, 1536, 1536, 1536, 1024]
    - [17, 31055.4]
  - - [2048, 2048, 1, 1024, 2048, 2048, 2048, 1024]
    - [13, 32320.8]
  - - [2560, 2048, 1, 1024, 2560, 2560, 2560, 1024]
    - [13, 33031.8]
  - - [3072, 2048, 1, 1024, 3072, 3072, 3072, 1024]
    - [13, 33659.6]
  - - [512, 2560, 1, 1024, 512, 512, 512, 1024]
    - [17, 24612.2]
  - - [1024, 2560, 1, 1024, 1024, 1024, 1024, 1024]
    - [3, 30031.9]
  - - [1536, 2560, 1, 1024, 1536, 1536, 1536, 1024]
    - [17, 32208.3]
  - - [2048, 2560, 1, 1024, 2048, 2048, 2048, 1024]
    - [13, 33515.3]
  - - [2560, 2560, 1, 1024, 2560, 2560, 2560, 1024]
    - [1, 33885.2]
  - - [3072, 2560, 1, 1024, 3072, 3072, 3072, 1024]
    - [13, 34324.3]
  - - [512, 3072, 1, 1024, 512, 512, 512, 1024]
    - [1, 26770.8]
  - - [1024, 3072, 1, 1024, 1024, 1024, 1024, 1024]
    - [1, 30854.1]
  - - [1536, 3072, 1, 1024, 1536, 1536, 1536, 1024]
    - [1, 33243.0]
  - - [2048, 3072, 1, 1024, 2048, 2048, 2048, 1024]
    - [13, 34085.1]
  - - [2560, 3072, 1, 1024, 2560, 2560, 2560, 1024]
    - [1, 34216.2]
  - - [3072, 3072, 1, 1024, 3072, 3072, 3072, 1024]
    - [3, 34595.9]
  - - [512, 512, 1, 2048, 512, 512, 512, 2048]
    - [0, 15387.3]
  - - [1024, 512, 1, 2048, 1024, 1024, 1024, 2048]
    - [17, 23658.3]
  - - [1536, 512, 1, 2048, 1536, 1536, 1536, 2048]
    - [13, 24699.6]
  - - [2048, 512, 1, 2048, 2048, 2048, 2048, 2048]
    - [1, 28493.7]
  - - [2560, 512, 1, 2048, 2560, 2560, 2560, 2048]
    - [13, 28273.2]
  - - [3072, 512, 1, 2048, 3072, 3072, 3072, 2048]
    - [13, 30743.5]
  - - [512, 1024, 1, 2048, 512, 512, 512, 2048]
    - [13, 23858.3]
  - - [1024, 1024, 1, 2048, 1024, 1024, 1024, 2048]
    - [13, 28916.5]
  - - [1536, 1024, 1, 2048, 1536, 1536, 1536, 2048]
    - [1, 30553.6]
  - - [2048, 1024, 1, 2048, 2048, 2048, 2048, 2048]
    - [1, 32113.9]
  - - [2560, 1024, 1, 2048, 2560, 2560, 2560, 2048]
    - [3, 32636.6]
  - - [3072, 1024, 1, 2048, 3072, 3072, 3072, 2048]
    - [1, 32993.8]
  - - [512, 1536, 1, 2048, 512, 512, 512, 2048]
    - [1, 25210.9]
  - - [1024, 1536, 1, 2048, 1024, 1024, 1024, 2048]
    - [13, 30950.9]
  - - [1536, 1536, 1, 2048, 1536, 1536, 1536, 2048]
    - [13, 32405.5]
  - - [2048, 1536, 1, 2048, 2048, 2048, 2048, 2048]
    - [13, 33345.4]
  - - [2560, 1536, 1, 2048, 2560, 2560, 2560, 2048]
    - [17, 34742.0]
  - - [3072, 1536, 1, 2048, 3072, 3072, 3072, 2048]
    - [3, 35007.6]
  - - [512, 2048, 1, 2048, 512, 512, 512, 2048]
    - [1, 28533.6]
  - - [1024, 2048, 1, 2048, 1024, 1024, 1024, 2048]
    - [1, 32939.3]
  - - [1536, 2048, 1, 2048, 1536, 1536, 1536, 2048]
    - [17, 34144.8]
  - - [2048, 2048, 1, 2048, 2048, 2048, 2048, 2048]
    - [17, 35104.6]
  - - [2560, 2048, 1, 2048, 2560, 2560, 2560, 2048]
    - [1, 34835.7]
  - - [3072, 2048, 1, 2048, 3072, 3072, 3072, 2048]
    - [3, 35298.0]
  - - [512, 2560, 1, 2048, 512, 512, 512, 2048]
    - [1, 29164.0]
  - - [1024, 2560, 1, 2048, 1024, 1024, 1024, 2048]
    - [17, 33442.2]
  - - [1536, 2560, 1, 2048, 1536, 1536, 1536, 2048]
    - [13, 34198.8]
  - - [2048, 2560, 1, 2048, 2048, 2048, 2048, 2048]
    - [13, 34834.7]
  - - [2560, 2560, 1, 2048, 2560, 2560, 2560, 2048]
    - [13, 35331.6]
  - - [3072, 2560, 1, 2048, 3072, 3072, 3072, 2048]
    - [1, 36081.2]
  - - [512, 3072, 1, 2048, 512, 512, 512, 2048]
    - [13, 31725.0]
  - - [1024, 3072, 1, 2048, 1024, 1024, 1024, 2048]
    - [13, 34403.3]
  - - [1536, 3072, 1, 2048, 1536, 1536, 1536, 2048]
    - [1, 35059.2]
  - - [2048, 3072, 1, 2048, 2048, 2048, 2048, 2048]
    - [17, 36326.9]
  - - [2560, 3072, 1, 2048, 2560, 2560, 2560, 2048]
    - [13, 36111.2]
  - - [3072, 3072, 1, 2048, 3072, 3072, 3072, 2048]
    - [13, 36774.8]
  - - [512, 512, 1, 3072, 512, 512, 512, 3072]
    - [10, 18452.6]
  - - [1024, 512, 1, 3072, 1024, 1024, 1024, 3072]
    - [17, 26790.9]
  - - [1536, 512, 1, 3072, 1536, 1536, 1536, 3072]
    - [17, 26633.3]
  - - [2048, 512, 1, 3072, 2048, 2048, 2048, 3072]
    - [1, 30585.6]
  - - [2560, 512, 1, 3072, 2560, 2560, 2560, 3072]
    - [17, 30212.0]
  - - [3072, 512, 1, 3072, 3072, 3072, 3072, 3072]
    - [3, 32558.6]
  - - [512, 1024, 1, 3072, 512, 512, 512, 3072]
    - [13, 27059.1]
  - - [1024, 1024, 1, 3072, 1024, 1024, 1024, 3072]
    - [3, 30412.0]
  - - [1536, 1024, 1, 3072, 1536, 1536, 1536, 3072]
    - [3, 32087.4]
  - - [2048, 1024, 1, 3072, 2048, 2048, 2048, 3072]
    - [17, 33076.1]
  - - [2560, 1024, 1, 3072, 2560, 2560, 2560, 3072]
    - [3, 34048.8]
  - - [3072, 1024, 1, 3072, 3072, 3072, 3072, 3072]
    - [3, 34138.5]
  - - [512, 1536, 1, 3072, 512, 512, 512, 3072]
    - [17, 27129.0]
  - - [1024, 1536, 1, 3072, 1024, 1024, 1024, 3072]
    - [13, 32860.4]
  - - [1536, 1536, 1, 3072, 1536, 1536, 1536, 3072]
    - [13, 33752.3]
  - - [2048, 1536, 1, 3072, 2048, 2048, 2048, 3072]
    - [3, 34875.5]
  - - [2560, 1536, 1, 3072, 2560, 2560, 2560, 3072]
    - [17, 35011.9]
  - - [3072, 1536, 1, 3072, 3072, 3072, 3072, 3072]
    - [17, 34917.9]
  - - [512, 2048, 1, 3072, 512, 512, 512, 3072]
    - [1, 31330.8]
  - - [1024, 2048, 1, 3072, 1024, 1024, 1024, 3072]
    - [3, 34037.2]
  - - [1536, 2048, 1, 3072, 1536, 1536, 1536, 3072]
    - [13, 34870.4]
  - - [2048, 2048, 1, 3072, 2048, 2048, 2048, 3072]
    - [3, 35681.4]
  - - [2560, 2048, 1, 3072, 2560, 2560, 2560, 3072]
    - [1, 35993.2]
  - - [3072, 2048, 1, 3072, 3072, 3072, 3072, 3072]
    - [17, 35742.3]
  - - [512, 2560, 1, 3072, 512, 512, 512, 3072]
    - [1, 30929.3]
  - - [1024, 2560, 1, 3072, 1024, 1024, 1024, 3072]
    - [13, 34645.4]
  - - [1536, 2560, 1, 3072, 1536, 1536, 1536, 3072]
    - [13, 35888.3]
  - - [2048, 2560, 1, 3072, 2048, 2048, 2048, 3072]
    - [17, 35395.7]
  - - [2560, 2560, 1, 3072, 2560, 2560, 2560, 3072]
    - [3, 35985.3]
  - - [3072, 2560, 1, 3072, 3072, 3072, 3072, 3072]
    - [1, 36223.1]
  - - [512, 3072, 1, 3072, 512, 512, 512, 3072]
    - [1, 32564.1]
  - - [1024, 3072, 1, 3072, 1024, 1024, 1024, 3072]
    - [17, 34536.9]
  - - [1536, 3072, 1, 3072, 1536, 1536, 1536, 3072]
    - [17, 35889.3]
  - - [2048, 3072, 1, 3072, 2048, 2048, 2048, 3072]
    - [3, 36124.8]
  - - [2560, 3072, 1, 3072, 2560, 2560, 2560, 3072]
    - [13, 36610.9]
  - - [3072, 3072, 1, 3072, 3072, 3072, 3072, 3072]
    - [13, 36859.1]
  - - [1, 1, 1, 1, 1, 1, 1, 1]
    - [9, 6.65624e-05]
  - - [1, 1, 1, 64, 1, 1, 1, 64]
    - [11, 0.00420956]
  - - [1, 64, 1, 1, 1, 1, 1, 1]
    - [21, 0.00424024]
  - - [64, 1, 1, 1, 64, 64, 64, 1]
    - [10, 0.00430744]
  - - [64, 64, 1, 1, 64, 64, 64, 1]
    - [16, 0.276514]
  - - [64, 1, 1, 64, 64, 64, 64, 64]
    - [12, 0.27273]
  - - [1, 64, 1, 64, 1, 1, 1, 64]
    - [6, 0.272649]
  - - [64, 64, 1, 64, 64, 64, 64, 64]
    - [5, 17.2764]
  - - [64, 64, 1, 256, 64, 64, 64, 256]
    - [4, 65.0865]
  - - [64, 64, 1, 512, 64, 64, 64, 512]
    - [20, 120.126]
  - - [64, 64, 1, 1024, 64, 64, 64, 1024]
    - [20, 205.825]
  - - [64, 64, 1, 2048, 64, 64, 64, 2048]
    - [20, 322.279]
  - - [64, 64, 1, 4096, 64, 64, 64, 4096]
    - [20, 447.864]
- null
- null
- DeviceEfficiency
- GridBased
