library/src/amd_detail/rocblaslt/src/Tensile/Logic/asm_full/gfx1200/GridBased/gfx1200_Cijk_Ailk_Bljk_I8BH_HAI_SAV_UserArgs.yaml
- {MinimumRequiredVersion: 4.33.0}
- gfx1200
- gfx1200
- [Device 73f0]
    SolutionIndex: 0
    SolutionNameMin: Cijk_Ailk_Bljk_I8BH_HAI_SAV_UserArgs_MT256x16x32_MI16x16x1_SN_LDSB0_CLR1_GRVWA16_GRVWB4_GSU1_LBSPPA2048_LBSPPB128_LPB8_MIWT4_1_PGR2_PLR1_SS0_SU32_SUM0_SUS256_SVW8_TLDS1_WG64_2_1_WGM8
    SolutionIndex: 1
    SolutionNameMin: Cijk_Ailk_Bljk_I8BH_HAI_SAV_UserArgs_MT256x16x32_MI16x16x1_SN_LDSB0_CLR0_GRVWA16_GRVWB4_GSU1_LBSPPA2048_LBSPPB128_LPB8_MIWT4_1_PGR1_PLR0_SS0_SU32_SUM0_SUS256_SVW8_TLDS1_WG64_2_1_WGM8
    SolutionIndex: 2
    SolutionNameMin: Cijk_Ailk_Bljk_I8BH_HAI_SAV_UserArgs_MT256x16x32_MI16x16x1_SN_LDSB0_CLR0_GRVWA16_GRVWB4_GSU1_LBSPPA2048_LBSPPB128_LPB8_MIWT4_1_PGR2_PLR0_SS0_SU32_SUM0_SUS256_SVW8_TLDS1_WG64_2_1_WGM8
    SolutionIndex: 3
    SolutionNameMin: Cijk_Ailk_Bljk_I8BH_HAI_SAV_UserArgs_MT32x32x32_MI16x16x1_SN_LDSB0_CLR1_GRVWA8_GRVWB8_GSU1_LBSPPA256_LBSPPB128_LPB8_MIWT1_1_PGR1_PLR1_SS0_SU32_SUM0_SUS256_SVW8_TLDS1_WG32_4_1_WGM8
    SolutionIndex: 4
    SolutionNameMin: Cijk_Ailk_Bljk_I8BH_HAI_SAV_UserArgs_MT64x32x32_MI16x16x1_SN_LDSB0_CLR1_GRVWA16_GRVWB8_GSU1_LBSPPA512_LBSPPB128_LPB8_MIWT2_1_PGR1_PLR1_SS0_SU32_SUM0_SUS256_SVW8_TLDS1_WG32_4_1_WGM8
    SolutionIndex: 5
    SolutionNameMin: Cijk_Ailk_Bljk_I8BH_HAI_SAV_UserArgs_MT64x32x32_MI16x16x1_SN_LDSB0_CLR1_GRVWA16_GRVWB8_GSU1_LBSPPA512_LBSPPB128_LPB8_MIWT2_1_PGR2_PLR1_SS0_SU32_SUM0_SUS256_SVW8_TLDS1_WG32_4_1_WGM8
    SolutionIndex: 6
    SolutionNameMin: Cijk_Ailk_Bljk_I8BH_HAI_SAV_UserArgs_MT32x64x32_MI16x16x1_SN_LDSB0_CLR1_GRVWA8_GRVWB8_GSU1_LBSPPA256_LBSPPB128_LPB8_MIWT2_1_PGR1_PLR1_SS0_SU32_SUM0_SUS256_SVW8_TLDS1_WG16_8_1_WGM8
    SolutionIndex: 7
    SolutionNameMin: Cijk_Ailk_Bljk_I8BH_HAI_SAV_UserArgs_MT256x16x64_MI16x16x1_SN_LDSB1_CLR1_GRVWA16_GRVWB8_GSU1_LBSPPA2048_LBSPPB128_LPB8_MIWT4_1_PGR1_PLR1_SS0_SU32_SUM0_SUS256_SVW8_TLDS1_WG64_2_1_WGM8
    SolutionIndex: 8
    SolutionNameMin: Cijk_Ailk_Bljk_I8BH_HAI_SAV_UserArgs_MT256x16x64_MI16x16x1_SN_LDSB1_CLR1_GRVWA16_GRVWB8_GSU1_LBSPPA2048_LBSPPB128_LPB8_MIWT4_1_PGR2_PLR1_SS0_SU32_SUM0_SUS256_SVW8_TLDS1_WG64_2_1_WGM8
    SolutionIndex: 9
    SolutionNameMin: Cijk_Ailk_Bljk_I8BH_HAI_SAV_UserArgs_MT256x16x64_MI16x16x1_SN_LDSB1_CLR1_GRVWA16_GRVWB8_GSU1_LBSPPA2048_LBSPPB128_LPB8_MIWT4_1_PGR1_PLR3_SS0_SU32_SUM0_SUS256_SVW8_TLDS1_WG64_2_1_WGM8
    SolutionIndex: 10
    SolutionNameMin: Cijk_Ailk_Bljk_I8BH_HAI_SAV_UserArgs_MT256x16x64_MI16x16x1_SN_LDSB1_CLR1_GRVWA16_GRVWB8_GSU1_LBSPPA2048_LBSPPB128_LPB8_MIWT4_1_PGR2_PLR3_SS0_SU32_SUM0_SUS256_SVW8_TLDS1_WG64_2_1_WGM8
    SolutionIndex: 11
    SolutionNameMin: Cijk_Ailk_Bljk_I8BH_HAI_SAV_UserArgs_MT64x32x64_MI16x16x1_SN_LDSB0_CLR1_GRVWA16_GRVWB8_GSU1_LBSPPA512_LBSPPB128_LPB8_MIWT2_1_PGR1_PLR1_SS0_SU32_SUM0_SUS256_SVW8_TLDS1_WG32_4_1_WGM8
    SolutionIndex: 12
    SolutionNameMin: Cijk_Ailk_Bljk_I8BH_HAI_SAV_UserArgs_MT64x32x64_MI16x16x1_SN_LDSB0_CLR1_GRVWA16_GRVWB8_GSU1_LBSPPA512_LBSPPB128_LPB8_MIWT2_1_PGR1_PLR3_SS0_SU32_SUM0_SUS256_SVW8_TLDS1_WG32_4_1_WGM8
    SolutionIndex: 13
    SolutionNameMin: Cijk_Ailk_Bljk_I8BH_HAI_SAV_UserArgs_MT32x64x64_MI16x16x1_SN_LDSB0_CLR1_GRVWA16_GRVWB8_GSU1_LBSPPA256_LBSPPB128_LPB8_MIWT2_1_PGR1_PLR1_SS0_SU32_SUM0_SUS256_SVW8_TLDS1_WG16_8_1_WGM8
    SolutionIndex: 14
    SolutionNameMin: Cijk_Ailk_Bljk_I8BH_HAI_SAV_UserArgs_MT32x64x64_MI16x16x1_SN_LDSB0_CLR1_GRVWA16_GRVWB8_GSU1_LBSPPA256_LBSPPB128_LPB8_MIWT2_1_PGR2_PLR3_SS0_SU32_SUM0_SUS256_SVW8_TLDS1_WG16_8_1_WGM8
    SolutionIndex: 15
    SolutionNameMin: Cijk_Ailk_Bljk_I8BH_HAI_SAV_UserArgs_MT256x16x32_MI16x16x1_SN_LDSB0_CLR1_GRVWA16_GRVWB4_GSU1_LBSPPA2048_LBSPPB128_LPB8_MIWT4_1_PGR2_PLR1_SS1_SU32_SUM0_SUS256_SVW1_TLDS1_WG64_2_1_WGM8
    SolutionIndex: 16
    SolutionNameMin: Cijk_Ailk_Bljk_I8BH_HAI_SAV_UserArgs_MT64x32x32_MI16x16x1_SN_LDSB0_CLR1_GRVWA16_GRVWB8_GSU1_LBSPPA512_LBSPPB128_LPB8_MIWT2_1_PGR1_PLR1_SS1_SU32_SUM0_SUS256_SVW1_TLDS1_WG32_4_1_WGM8
    SolutionIndex: 17
    SolutionNameMin: Cijk_Ailk_Bljk_I8BH_HAI_SAV_UserArgs_MT64x32x32_MI16x16x1_SN_LDSB0_CLR1_GRVWA16_GRVWB8_GSU1_LBSPPA512_LBSPPB128_LPB8_MIWT2_1_PGR2_PLR1_SS1_SU32_SUM0_SUS256_SVW1_TLDS1_WG32_4_1_WGM8
    SolutionIndex: 18
    SolutionNameMin: Cijk_Ailk_Bljk_I8BH_HAI_SAV_UserArgs_MT64x32x32_MI16x16x1_SN_LDSB0_CLR0_GRVWA16_GRVWB8_GSU1_LBSPPA512_LBSPPB128_LPB8_MIWT2_1_PGR1_PLR0_SS1_SU32_SUM0_SUS256_SVW1_TLDS1_WG32_4_1_WGM8
    SolutionIndex: 19
    SolutionNameMin: Cijk_Ailk_Bljk_I8BH_HAI_SAV_UserArgs_MT64x32x32_MI16x16x1_SN_LDSB0_CLR0_GRVWA16_GRVWB8_GSU1_LBSPPA512_LBSPPB128_LPB8_MIWT2_1_PGR2_PLR0_SS1_SU32_SUM0_SUS256_SVW1_TLDS1_WG32_4_1_WGM8
    SolutionIndex: 20
    SolutionNameMin: Cijk_Ailk_Bljk_I8BH_HAI_SAV_UserArgs_MT32x64x32_MI16x16x1_SN_LDSB0_CLR1_GRVWA8_GRVWB8_GSU1_LBSPPA256_LBSPPB128_LPB8_MIWT2_1_PGR1_PLR1_SS1_SU32_SUM0_SUS256_SVW1_TLDS1_WG16_8_1_WGM8
    SolutionIndex: 21
    SolutionNameMin: Cijk_Ailk_Bljk_I8BH_HAI_SAV_UserArgs_MT32x64x32_MI16x16x1_SN_LDSB0_CLR0_GRVWA8_GRVWB8_GSU1_LBSPPA256_LBSPPB128_LPB8_MIWT2_1_PGR1_PLR0_SS1_SU32_SUM0_SUS256_SVW1_TLDS1_WG16_8_1_WGM8
    SolutionIndex: 22
    SolutionNameMin: Cijk_Ailk_Bljk_I8BH_HAI_SAV_UserArgs_MT64x16x64_MI16x16x1_SN_LDSB0_CLR1_GRVWA16_GRVWB8_GSU1_LBSPPA512_LBSPPB128_LPB8_MIWT1_1_PGR1_PLR1_SS1_SU32_SUM0_SUS256_SVW1_TLDS1_WG64_2_1_WGM8
    SolutionIndex: 23
    SolutionNameMin: Cijk_Ailk_Bljk_I8BH_HAI_SAV_UserArgs_MT64x16x64_MI16x16x1_SN_LDSB0_CLR0_GRVWA16_GRVWB8_GSU1_LBSPPA512_LBSPPB128_LPB8_MIWT1_1_PGR1_PLR0_SS1_SU32_SUM0_SUS256_SVW1_TLDS1_WG64_2_1_WGM8
    SolutionIndex: 24
    SolutionNameMin: Cijk_Ailk_Bljk_I8BH_HAI_SAV_UserArgs_MT256x16x64_MI16x16x1_SN_LDSB1_CLR1_GRVWA16_GRVWB8_GSU1_LBSPPA2048_LBSPPB128_LPB8_MIWT4_1_PGR1_PLR1_SS1_SU32_SUM0_SUS256_SVW1_TLDS1_WG64_2_1_WGM8
    SolutionIndex: 25
    SolutionNameMin: Cijk_Ailk_Bljk_I8BH_HAI_SAV_UserArgs_MT256x16x64_MI16x16x1_SN_LDSB1_CLR1_GRVWA16_GRVWB8_GSU1_LBSPPA2048_LBSPPB128_LPB8_MIWT4_1_PGR2_PLR1_SS1_SU32_SUM0_SUS256_SVW1_TLDS1_WG64_2_1_WGM8
    SolutionIndex: 26
    SolutionNameMin: Cijk_Ailk_Bljk_I8BH_HAI_SAV_UserArgs_MT256x16x64_MI16x16x1_SN_LDSB1_CLR1_GRVWA16_GRVWB8_GSU1_LBSPPA2048_LBSPPB128_LPB8_MIWT4_1_PGR1_PLR3_SS1_SU32_SUM0_SUS256_SVW1_TLDS1_WG64_2_1_WGM8
    SolutionIndex: 27
    SolutionNameMin: Cijk_Ailk_Bljk_I8BH_HAI_SAV_UserArgs_MT256x16x64_MI16x16x1_SN_LDSB1_CLR1_GRVWA16_GRVWB8_GSU1_LBSPPA2048_LBSPPB128_LPB8_MIWT4_1_PGR2_PLR3_SS1_SU32_SUM0_SUS256_SVW1_TLDS1_WG64_2_1_WGM8
    SolutionIndex: 28
    SolutionNameMin: Cijk_Ailk_Bljk_I8BH_HAI_SAV_UserArgs_MT32x32x64_MI16x16x1_SN_LDSB0_CLR1_GRVWA16_GRVWB8_GSU1_LBSPPA256_LBSPPB128_LPB8_MIWT1_1_PGR1_PLR1_SS1_SU32_SUM0_SUS256_SVW1_TLDS1_WG32_4_1_WGM8
    SolutionIndex: 29
    SolutionNameMin: Cijk_Ailk_Bljk_I8BH_HAI_SAV_UserArgs_MT32x32x64_MI16x16x1_SN_LDSB0_CLR1_GRVWA16_GRVWB16_GSU1_LBSPPA256_LBSPPB256_LPB16_MIWT1_1_PGR1_PLR3_SS1_SU32_SUM0_SUS256_SVW1_TLDS0_WG32_4_1_WGM8
    SolutionIndex: 30
    SolutionNameMin: Cijk_Ailk_Bljk_I8BH_HAI_SAV_UserArgs_MT64x32x64_MI16x16x1_SN_LDSB0_CLR1_GRVWA16_GRVWB8_GSU1_LBSPPA512_LBSPPB128_LPB8_MIWT2_1_PGR1_PLR1_SS1_SU32_SUM0_SUS256_SVW1_TLDS1_WG32_4_1_WGM8
    SolutionIndex: 31
    SolutionNameMin: Cijk_Ailk_Bljk_I8BH_HAI_SAV_UserArgs_MT64x32x64_MI16x16x1_SN_LDSB0_CLR1_GRVWA16_GRVWB8_GSU1_LBSPPA512_LBSPPB128_LPB8_MIWT2_1_PGR1_PLR3_SS1_SU32_SUM0_SUS256_SVW1_TLDS1_WG32_4_1_WGM8
    SolutionIndex: 32
    SolutionNameMin: Cijk_Ailk_Bljk_I8BH_HAI_SAV_UserArgs_MT64x32x64_MI16x16x1_SN_LDSB0_CLR0_GRVWA16_GRVWB8_GSU1_LBSPPA512_LBSPPB128_LPB8_MIWT2_1_PGR1_PLR0_SS1_SU32_SUM0_SUS256_SVW1_TLDS1_WG32_4_1_WGM8
    SolutionIndex: 33
    SolutionNameMin: Cijk_Ailk_Bljk_I8BH_HAI_SAV_UserArgs_MT16x64x64_MI16x16x1_SN_LDSB0_CLR1_GRVWA8_GRVWB8_GSU1_LBSPPA128_LBSPPB128_LPB8_MIWT1_1_PGR1_PLR1_SS1_SU32_SUM0_SUS256_SVW1_TLDS1_WG16_8_1_WGM8
    SolutionIndex: 34
    SolutionNameMin: Cijk_Ailk_Bljk_I8BH_HAI_SAV_UserArgs_MT16x64x64_MI16x16x1_SN_LDSB0_CLR0_GRVWA8_GRVWB16_GSU1_LBSPPA128_LBSPPB512_LPB16_MIWT1_1_PGR1_PLR0_SS1_SU32_SUM0_SUS256_SVW1_TLDS0_WG16_8_1_WGM8
    SolutionIndex: 35
    SolutionNameMin: Cijk_Ailk_Bljk_I8BH_HAI_SAV_UserArgs_MT16x64x64_MI16x16x1_SN_LDSB0_CLR0_GRVWA8_GRVWB8_GSU1_LBSPPA128_LBSPPB128_LPB8_MIWT1_1_PGR2_PLR0_SS1_SU32_SUM0_SUS256_SVW1_TLDS1_WG16_8_1_WGM8
    SolutionIndex: 36
    SolutionNameMin: Cijk_Ailk_Bljk_I8BH_HAI_SAV_UserArgs_MT32x64x64_MI16x16x1_SN_LDSB0_CLR1_GRVWA16_GRVWB8_GSU1_LBSPPA256_LBSPPB128_LPB8_MIWT2_1_PGR1_PLR1_SS1_SU32_SUM0_SUS256_SVW1_TLDS1_WG16_8_1_WGM8
    SolutionIndex: 37
    SolutionNameMin: Cijk_Ailk_Bljk_I8BH_HAI_SAV_UserArgs_MT32x64x64_MI16x16x1_SN_LDSB0_CLR1_GRVWA16_GRVWB8_GSU1_LBSPPA256_LBSPPB128_LPB8_MIWT2_1_PGR2_PLR1_SS1_SU32_SUM0_SUS256_SVW1_TLDS1_WG16_8_1_WGM8
    SolutionIndex: 38
    SolutionNameMin: Cijk_Ailk_Bljk_I8BH_HAI_SAV_UserArgs_MT32x64x64_MI16x16x1_SN_LDSB0_CLR1_GRVWA16_GRVWB8_GSU1_LBSPPA256_LBSPPB128_LPB8_MIWT2_1_PGR1_PLR3_SS1_SU32_SUM0_SUS256_SVW1_TLDS1_WG16_8_1_WGM8
    SolutionIndex: 39
    SolutionNameMin: Cijk_Ailk_Bljk_I8BH_HAI_SAV_UserArgs_MT32x64x64_MI16x16x1_SN_LDSB0_CLR1_GRVWA16_GRVWB8_GSU1_LBSPPA256_LBSPPB128_LPB8_MIWT2_1_PGR2_PLR3_SS1_SU32_SUM0_SUS256_SVW1_TLDS1_WG16_8_1_WGM8
    SolutionIndex: 40
    SolutionNameMin: Cijk_Ailk_Bljk_I8BH_HAI_SAV_UserArgs_MT32x64x64_MI16x16x1_SN_LDSB0_CLR0_GRVWA16_GRVWB8_GSU1_LBSPPA256_LBSPPB128_LPB8_MIWT2_1_PGR1_PLR0_SS1_SU32_SUM0_SUS256_SVW1_TLDS1_WG16_8_1_WGM8
    SolutionIndex: 41
    SolutionNameMin: Cijk_Ailk_Bljk_I8BH_HAI_SAV_UserArgs_MT32x64x64_MI16x16x1_SN_LDSB0_CLR0_GRVWA16_GRVWB8_GSU1_LBSPPA256_LBSPPB128_LPB8_MIWT2_1_PGR2_PLR0_SS1_SU32_SUM0_SUS256_SVW1_TLDS1_WG16_8_1_WGM8
- - - [512, 512, 1, 64, 512, 512, 512, 64]
    - [16, 1031.46]
  - - [1024, 512, 1, 64, 1024, 1024, 1024, 64]
    - [2, 1995.92]
  - - [1536, 512, 1, 64, 1536, 1536, 1536, 64]
    - [14, 2904.73]
  - - [2048, 512, 1, 64, 2048, 2048, 2048, 64]
    - [39, 3895.45]
  - - [2560, 512, 1, 64, 2560, 2560, 2560, 64]
    - [0, 4499.12]
  - - [3072, 512, 1, 64, 3072, 3072, 3072, 64]
    - [10, 5245.34]
  - - [512, 1024, 1, 64, 512, 512, 512, 64]
    - [10, 2093.81]
  - - [1024, 1024, 1, 64, 1024, 1024, 1024, 64]
    - [26, 3751.51]
  - - [1536, 1024, 1, 64, 1536, 1536, 1536, 64]
    - [25, 5299.32]
  - - [2048, 1024, 1, 64, 2048, 2048, 2048, 64]
    - [24, 6380.84]
  - - [2560, 1024, 1, 64, 2560, 2560, 2560, 64]
    - [9, 7613.38]
  - - [3072, 1024, 1, 64, 3072, 3072, 3072, 64]
    - [10, 8348.6]
  - - [512, 1536, 1, 64, 512, 512, 512, 64]
    - [9, 2773.17]
  - - [1024, 1536, 1, 64, 1024, 1024, 1024, 64]
    - [41, 5071.84]
  - - [1536, 1536, 1, 64, 1536, 1536, 1536, 64]
    - [25, 7219.63]
  - - [2048, 1536, 1, 64, 2048, 2048, 2048, 64]
    - [9, 8406.12]
  - - [2560, 1536, 1, 64, 2560, 2560, 2560, 64]
    - [25, 9670.24]
  - - [3072, 1536, 1, 64, 3072, 3072, 3072, 64]
    - [9, 10694.5]
  - - [512, 2048, 1, 64, 512, 512, 512, 64]
    - [41, 3897.71]
  - - [1024, 2048, 1, 64, 1024, 1024, 1024, 64]
    - [7, 6379.32]
  - - [1536, 2048, 1, 64, 1536, 1536, 1536, 64]
    - [25, 8511.13]
  - - [2048, 2048, 1, 64, 2048, 2048, 2048, 64]
    - [8, 9925.14]
  - - [2560, 2048, 1, 64, 2560, 2560, 2560, 64]
    - [25, 11505.0]
  - - [3072, 2048, 1, 64, 3072, 3072, 3072, 64]
    - [7, 12198.8]
  - - [512, 2560, 1, 64, 512, 512, 512, 64]
    - [7, 4540.64]
  - - [1024, 2560, 1, 64, 1024, 1024, 1024, 64]
    - [7, 7561.9]
  - - [1536, 2560, 1, 64, 1536, 1536, 1536, 64]
    - [24, 9627.69]
  - - [2048, 2560, 1, 64, 2048, 2048, 2048, 64]
    - [8, 11221.8]
  - - [2560, 2560, 1, 64, 2560, 2560, 2560, 64]
    - [27, 12553.1]
  - - [3072, 2560, 1, 64, 3072, 3072, 3072, 64]
    - [15, 13868.1]
  - - [512, 3072, 1, 64, 512, 512, 512, 64]
    - [1, 5220.85]
  - - [1024, 3072, 1, 64, 1024, 1024, 1024, 64]
    - [24, 8674.51]
  - - [1536, 3072, 1, 64, 1536, 1536, 1536, 64]
    - [25, 10801.7]
  - - [2048, 3072, 1, 64, 2048, 2048, 2048, 64]
    - [15, 12343.2]
  - - [2560, 3072, 1, 64, 2560, 2560, 2560, 64]
    - [9, 13864.1]
  - - [3072, 3072, 1, 64, 3072, 3072, 3072, 64]
    - [7, 15384.5]
  - - [512, 512, 1, 256, 512, 512, 512, 256]
    - [22, 3934.27]
  - - [1024, 512, 1, 256, 1024, 1024, 1024, 256]
    - [30, 7549.44]
  - - [1536, 512, 1, 256, 1536, 1536, 1536, 256]
    - [32, 10977.8]
  - - [2048, 512, 1, 256, 2048, 2048, 2048, 256]
    - [31, 12981.1]
  - - [2560, 512, 1, 256, 2560, 2560, 2560, 256]
    - [21, 15206.1]
  - - [3072, 512, 1, 256, 3072, 3072, 3072, 256]
    - [36, 17724.4]
  - - [512, 1024, 1, 256, 512, 512, 512, 256]
    - [40, 7637.72]
  - - [1024, 1024, 1, 256, 1024, 1024, 1024, 256]
    - [31, 13631.7]
  - - [1536, 1024, 1, 256, 1536, 1536, 1536, 256]
    - [13, 17222.9]
  - - [2048, 1024, 1, 256, 2048, 2048, 2048, 256]
    - [13, 21243.3]
  - - [2560, 1024, 1, 256, 2560, 2560, 2560, 256]
    - [20, 24260.3]
  - - [3072, 1024, 1, 256, 3072, 3072, 3072, 256]
    - [16, 25904.1]
  - - [512, 1536, 1, 256, 512, 512, 512, 256]
    - [16, 10654.7]
  - - [1024, 1536, 1, 256, 1024, 1024, 1024, 256]
    - [36, 17278.3]
  - - [1536, 1536, 1, 256, 1536, 1536, 1536, 256]
    - [5, 22146.9]
  - - [2048, 1536, 1, 256, 2048, 2048, 2048, 256]
    - [4, 24958.4]
  - - [2560, 1536, 1, 256, 2560, 2560, 2560, 256]
    - [17, 29055.2]
  - - [3072, 1536, 1, 256, 3072, 3072, 3072, 256]
    - [16, 30454.4]
  - - [512, 2048, 1, 256, 512, 512, 512, 256]
    - [38, 12918.3]
  - - [1024, 2048, 1, 256, 1024, 1024, 1024, 256]
    - [40, 20786.0]
  - - [1536, 2048, 1, 256, 1536, 1536, 1536, 256]
    - [20, 26536.6]
  - - [2048, 2048, 1, 256, 2048, 2048, 2048, 256]
    - [21, 29687.6]
  - - [2560, 2048, 1, 256, 2560, 2560, 2560, 256]
    - [18, 32976.1]
  - - [3072, 2048, 1, 256, 3072, 3072, 3072, 256]
    - [20, 34497.4]
  - - [512, 2560, 1, 256, 512, 512, 512, 256]
    - [17, 15106.8]
  - - [1024, 2560, 1, 256, 1024, 1024, 1024, 256]
    - [20, 23461.8]
  - - [1536, 2560, 1, 256, 1536, 1536, 1536, 256]
    - [17, 29122.9]
  - - [2048, 2560, 1, 256, 2048, 2048, 2048, 256]
    - [20, 33114.8]
  - - [2560, 2560, 1, 256, 2560, 2560, 2560, 256]
    - [17, 35080.8]
  - - [3072, 2560, 1, 256, 3072, 3072, 3072, 256]
    - [16, 37822.0]
  - - [512, 3072, 1, 256, 512, 512, 512, 256]
    - [31, 18136.3]
  - - [1024, 3072, 1, 256, 1024, 1024, 1024, 256]
    - [40, 26037.7]
  - - [1536, 3072, 1, 256, 1536, 1536, 1536, 256]
    - [17, 31353.6]
  - - [2048, 3072, 1, 256, 2048, 2048, 2048, 256]
    - [16, 35593.3]
  - - [2560, 3072, 1, 256, 2560, 2560, 2560, 256]
    - [16, 38334.0]
  - - [3072, 3072, 1, 256, 3072, 3072, 3072, 256]
    - [16, 40162.9]
  - - [512, 512, 1, 512, 512, 512, 512, 512]
    - [12, 7272.7]
  - - [1024, 512, 1, 512, 1024, 1024, 1024, 512]
    - [37, 13420.1]
  - - [1536, 512, 1, 512, 1536, 1536, 1536, 512]
    - [40, 18602.2]
  - - [2048, 512, 1, 512, 2048, 2048, 2048, 512]
    - [36, 22634.2]
  - - [2560, 512, 1, 512, 2560, 2560, 2560, 512]
    - [30, 25937.3]
  - - [3072, 512, 1, 512, 3072, 3072, 3072, 512]
    - [31, 29101.8]
  - - [512, 1024, 1, 512, 512, 512, 512, 512]
    - [32, 13082.6]
  - - [1024, 1024, 1, 512, 1024, 1024, 1024, 512]
    - [38, 23142.5]
  - - [1536, 1024, 1, 512, 1536, 1536, 1536, 512]
    - [12, 28055.5]
  - - [2048, 1024, 1, 512, 2048, 2048, 2048, 512]
    - [40, 32946.0]
  - - [2560, 1024, 1, 512, 2560, 2560, 2560, 512]
    - [18, 37768.4]
  - - [3072, 1024, 1, 512, 3072, 3072, 3072, 512]
    - [16, 40154.4]
  - - [512, 1536, 1, 512, 512, 512, 512, 512]
    - [31, 19165.3]
  - - [1024, 1536, 1, 512, 1024, 1024, 1024, 512]
    - [31, 29464.9]
  - - [1536, 1536, 1, 512, 1536, 1536, 1536, 512]
    - [4, 35403.8]
  - - [2048, 1536, 1, 512, 2048, 2048, 2048, 512]
    - [16, 41262.3]
  - - [2560, 1536, 1, 512, 2560, 2560, 2560, 512]
    - [16, 45371.4]
  - - [3072, 1536, 1, 512, 3072, 3072, 3072, 512]
    - [19, 46274.4]
  - - [512, 2048, 1, 512, 512, 512, 512, 512]
    - [31, 21247.5]
  - - [1024, 2048, 1, 512, 1024, 1024, 1024, 512]
    - [31, 33283.5]
  - - [1536, 2048, 1, 512, 1536, 1536, 1536, 512]
    - [16, 41480.7]
  - - [2048, 2048, 1, 512, 2048, 2048, 2048, 512]
    - [20, 44837.3]
  - - [2560, 2048, 1, 512, 2560, 2560, 2560, 512]
    - [17, 47632.1]
  - - [3072, 2048, 1, 512, 3072, 3072, 3072, 512]
    - [5, 50716.4]
  - - [512, 2560, 1, 512, 512, 512, 512, 512]
    - [11, 24928.5]
  - - [1024, 2560, 1, 512, 1024, 1024, 1024, 512]
    - [31, 36143.2]
  - - [1536, 2560, 1, 512, 1536, 1536, 1536, 512]
    - [16, 44057.8]
  - - [2048, 2560, 1, 512, 2048, 2048, 2048, 512]
    - [16, 47874.6]
  - - [2560, 2560, 1, 512, 2560, 2560, 2560, 512]
    - [6, 51046.2]
  - - [3072, 2560, 1, 512, 3072, 3072, 3072, 512]
    - [4, 55235.9]
  - - [512, 3072, 1, 512, 512, 512, 512, 512]
    - [11, 27650.5]
  - - [1024, 3072, 1, 512, 1024, 1024, 1024, 512]
    - [21, 40947.1]
  - - [1536, 3072, 1, 512, 1536, 1536, 1536, 512]
    - [16, 48203.7]
  - - [2048, 3072, 1, 512, 2048, 2048, 2048, 512]
    - [20, 52215.5]
  - - [2560, 3072, 1, 512, 2560, 2560, 2560, 512]
    - [17, 56193.7]
  - - [3072, 3072, 1, 512, 3072, 3072, 3072, 512]
    - [16, 57595.6]
  - - [512, 512, 1, 1024, 512, 512, 512, 1024]
    - [36, 13670.2]
  - - [1024, 512, 1, 1024, 1024, 1024, 1024, 1024]
    - [36, 23217.5]
  - - [1536, 512, 1, 1024, 1536, 1536, 1536, 1024]
    - [38, 29573.1]
  - - [2048, 512, 1, 1024, 2048, 2048, 2048, 1024]
    - [36, 33904.6]
  - - [2560, 512, 1, 1024, 2560, 2560, 2560, 1024]
    - [16, 38314.5]
  - - [3072, 512, 1, 1024, 3072, 3072, 3072, 1024]
    - [31, 42897.6]
  - - [512, 1024, 1, 1024, 512, 512, 512, 1024]
    - [31, 22496.2]
  - - [1024, 1024, 1, 1024, 1024, 1024, 1024, 1024]
    - [38, 34881.0]
  - - [1536, 1024, 1, 1024, 1536, 1536, 1536, 1024]
    - [12, 41331.7]
  - - [2048, 1024, 1, 1024, 2048, 2048, 2048, 1024]
    - [17, 47526.5]
  - - [2560, 1024, 1, 1024, 2560, 2560, 2560, 1024]
    - [16, 50961.7]
  - - [3072, 1024, 1, 1024, 3072, 3072, 3072, 1024]
    - [30, 53546.1]
  - - [512, 1536, 1, 1024, 512, 512, 512, 1024]
    - [31, 29459.0]
  - - [1024, 1536, 1, 1024, 1024, 1024, 1024, 1024]
    - [31, 41534.2]
  - - [1536, 1536, 1, 1024, 1536, 1536, 1536, 1024]
    - [36, 49489.8]
  - - [2048, 1536, 1, 1024, 2048, 2048, 2048, 1024]
    - [17, 54292.0]
  - - [2560, 1536, 1, 1024, 2560, 2560, 2560, 1024]
    - [16, 56693.0]
  - - [3072, 1536, 1, 1024, 3072, 3072, 3072, 1024]
    - [30, 59558.9]
  - - [512, 2048, 1, 1024, 512, 512, 512, 1024]
    - [38, 34126.0]
  - - [1024, 2048, 1, 1024, 1024, 1024, 1024, 1024]
    - [36, 46269.5]
  - - [1536, 2048, 1, 1024, 1536, 1536, 1536, 1024]
    - [16, 53351.0]
  - - [2048, 2048, 1, 1024, 2048, 2048, 2048, 1024]
    - [30, 58147.0]
  - - [2560, 2048, 1, 1024, 2560, 2560, 2560, 1024]
    - [36, 61042.4]
  - - [3072, 2048, 1, 1024, 3072, 3072, 3072, 1024]
    - [16, 62732.0]
  - - [512, 2560, 1, 1024, 512, 512, 512, 1024]
    - [31, 37593.4]
  - - [1024, 2560, 1, 1024, 1024, 1024, 1024, 1024]
    - [16, 49080.9]
  - - [1536, 2560, 1, 1024, 1536, 1536, 1536, 1024]
    - [31, 57968.7]
  - - [2048, 2560, 1, 1024, 2048, 2048, 2048, 1024]
    - [12, 60869.0]
  - - [2560, 2560, 1, 1024, 2560, 2560, 2560, 1024]
    - [16, 63747.5]
  - - [3072, 2560, 1, 1024, 3072, 3072, 3072, 1024]
    - [30, 65656.0]
  - - [512, 3072, 1, 1024, 512, 512, 512, 1024]
    - [38, 41874.9]
  - - [1024, 3072, 1, 1024, 1024, 1024, 1024, 1024]
    - [16, 53864.4]
  - - [1536, 3072, 1, 1024, 1536, 1536, 1536, 1024]
    - [31, 59346.1]
  - - [2048, 3072, 1, 1024, 2048, 2048, 2048, 1024]
    - [16, 62273.3]
  - - [2560, 3072, 1, 1024, 2560, 2560, 2560, 1024]
    - [30, 65836.0]
  - - [3072, 3072, 1, 1024, 3072, 3072, 3072, 1024]
    - [30, 68024.4]
  - - [512, 512, 1, 2048, 512, 512, 512, 2048]
    - [31, 22239.9]
  - - [1024, 512, 1, 2048, 1024, 1024, 1024, 2048]
    - [36, 34904.2]
  - - [1536, 512, 1, 2048, 1536, 1536, 1536, 2048]
    - [36, 41696.0]
  - - [2048, 512, 1, 2048, 2048, 2048, 2048, 2048]
    - [38, 45971.9]
  - - [2560, 512, 1, 2048, 2560, 2560, 2560, 2048]
    - [30, 52080.9]
  - - [3072, 512, 1, 2048, 3072, 3072, 3072, 2048]
    - [36, 54894.8]
  - - [512, 1024, 1, 2048, 512, 512, 512, 2048]
    - [36, 33819.2]
  - - [1024, 1024, 1, 2048, 1024, 1024, 1024, 2048]
    - [31, 47738.3]
  - - [1536, 1024, 1, 2048, 1536, 1536, 1536, 2048]
    - [31, 54903.7]
  - - [2048, 1024, 1, 2048, 2048, 2048, 2048, 2048]
    - [31, 59048.3]
  - - [2560, 1024, 1, 2048, 2560, 2560, 2560, 2048]
    - [30, 61557.9]
  - - [3072, 1024, 1, 2048, 3072, 3072, 3072, 2048]
    - [30, 65206.7]
  - - [512, 1536, 1, 2048, 512, 512, 512, 2048]
    - [31, 42006.5]
  - - [1024, 1536, 1, 2048, 1024, 1024, 1024, 2048]
    - [31, 53729.2]
  - - [1536, 1536, 1, 2048, 1536, 1536, 1536, 2048]
    - [36, 59832.2]
  - - [2048, 1536, 1, 2048, 2048, 2048, 2048, 2048]
    - [31, 63729.9]
  - - [2560, 1536, 1, 2048, 2560, 2560, 2560, 2048]
    - [30, 66977.1]
  - - [3072, 1536, 1, 2048, 3072, 3072, 3072, 2048]
    - [31, 68190.2]
  - - [512, 2048, 1, 2048, 512, 512, 512, 2048]
    - [30, 46184.9]
  - - [1024, 2048, 1, 2048, 1024, 1024, 1024, 2048]
    - [11, 58388.5]
  - - [1536, 2048, 1, 2048, 1536, 1536, 1536, 2048]
    - [38, 63600.6]
  - - [2048, 2048, 1, 2048, 2048, 2048, 2048, 2048]
    - [32, 67064.1]
  - - [2560, 2048, 1, 2048, 2560, 2560, 2560, 2048]
    - [11, 69322.4]
  - - [3072, 2048, 1, 2048, 3072, 3072, 3072, 2048]
    - [30, 71803.2]
  - - [512, 2560, 1, 2048, 512, 512, 512, 2048]
    - [30, 51829.0]
  - - [1024, 2560, 1, 2048, 1024, 1024, 1024, 2048]
    - [30, 62096.5]
  - - [1536, 2560, 1, 2048, 1536, 1536, 1536, 2048]
    - [30, 65482.2]
  - - [2048, 2560, 1, 2048, 2048, 2048, 2048, 2048]
    - [36, 68391.2]
  - - [2560, 2560, 1, 2048, 2560, 2560, 2560, 2048]
    - [30, 71754.4]
  - - [3072, 2560, 1, 2048, 3072, 3072, 3072, 2048]
    - [31, 72898.0]
  - - [512, 3072, 1, 2048, 512, 512, 512, 2048]
    - [40, 53761.0]
  - - [1024, 3072, 1, 2048, 1024, 1024, 1024, 2048]
    - [17, 64516.4]
  - - [1536, 3072, 1, 2048, 1536, 1536, 1536, 2048]
    - [16, 68139.7]
  - - [2048, 3072, 1, 2048, 2048, 2048, 2048, 2048]
    - [31, 71392.6]
  - - [2560, 3072, 1, 2048, 2560, 2560, 2560, 2048]
    - [30, 72637.8]
  - - [3072, 3072, 1, 2048, 3072, 3072, 3072, 2048]
    - [31, 72377.1]
  - - [512, 512, 1, 3072, 512, 512, 512, 3072]
    - [31, 29786.4]
  - - [1024, 512, 1, 3072, 1024, 1024, 1024, 3072]
    - [36, 41262.8]
  - - [1536, 512, 1, 3072, 1536, 1536, 1536, 3072]
    - [31, 49307.0]
  - - [2048, 512, 1, 3072, 2048, 2048, 2048, 3072]
    - [31, 53007.7]
  - - [2560, 512, 1, 3072, 2560, 2560, 2560, 3072]
    - [31, 56788.9]
  - - [3072, 512, 1, 3072, 3072, 3072, 3072, 3072]
    - [36, 59746.7]
  - - [512, 1024, 1, 3072, 512, 512, 512, 3072]
    - [31, 41491.9]
  - - [1024, 1024, 1, 3072, 1024, 1024, 1024, 3072]
    - [32, 53025.2]
  - - [1536, 1024, 1, 3072, 1536, 1536, 1536, 3072]
    - [30, 60435.7]
  - - [2048, 1024, 1, 3072, 2048, 2048, 2048, 3072]
    - [31, 64146.1]
  - - [2560, 1024, 1, 3072, 2560, 2560, 2560, 3072]
    - [31, 65420.7]
  - - [3072, 1024, 1, 3072, 3072, 3072, 3072, 3072]
    - [31, 68084.3]
  - - [512, 1536, 1, 3072, 512, 512, 512, 3072]
    - [31, 49566.0]
  - - [1024, 1536, 1, 3072, 1024, 1024, 1024, 3072]
    - [31, 59869.3]
  - - [1536, 1536, 1, 3072, 1536, 1536, 1536, 3072]
    - [31, 64892.0]
  - - [2048, 1536, 1, 3072, 2048, 2048, 2048, 3072]
    - [11, 69300.0]
  - - [2560, 1536, 1, 3072, 2560, 2560, 2560, 3072]
    - [36, 69592.3]
  - - [3072, 1536, 1, 3072, 3072, 3072, 3072, 3072]
    - [30, 71155.0]
  - - [512, 2048, 1, 3072, 512, 512, 512, 3072]
    - [38, 53443.9]
  - - [1024, 2048, 1, 3072, 1024, 1024, 1024, 3072]
    - [30, 63575.5]
  - - [1536, 2048, 1, 3072, 1536, 1536, 1536, 3072]
    - [30, 68349.6]
  - - [2048, 2048, 1, 3072, 2048, 2048, 2048, 3072]
    - [16, 70916.4]
  - - [2560, 2048, 1, 3072, 2560, 2560, 2560, 3072]
    - [31, 71837.9]
  - - [3072, 2048, 1, 3072, 3072, 3072, 3072, 3072]
    - [31, 73835.6]
  - - [512, 2560, 1, 3072, 512, 512, 512, 3072]
    - [30, 57835.0]
  - - [1024, 2560, 1, 3072, 1024, 1024, 1024, 3072]
    - [30, 67080.6]
  - - [1536, 2560, 1, 3072, 1536, 1536, 1536, 3072]
    - [30, 71235.2]
  - - [2048, 2560, 1, 3072, 2048, 2048, 2048, 3072]
    - [30, 73048.8]
  - - [2560, 2560, 1, 3072, 2560, 2560, 2560, 3072]
    - [31, 73282.6]
  - - [3072, 2560, 1, 3072, 3072, 3072, 3072, 3072]
    - [30, 74415.0]
  - - [512, 3072, 1, 3072, 512, 512, 512, 3072]
    - [4, 58885.7]
  - - [1024, 3072, 1, 3072, 1024, 1024, 1024, 3072]
    - [31, 68306.1]
  - - [1536, 3072, 1, 3072, 1536, 1536, 1536, 3072]
    - [31, 72388.5]
  - - [2048, 3072, 1, 3072, 2048, 2048, 2048, 3072]
    - [30, 74053.9]
  - - [2560, 3072, 1, 3072, 2560, 2560, 2560, 3072]
    - [12, 73544.6]
  - - [3072, 3072, 1, 3072, 3072, 3072, 3072, 3072]
    - [17, 74870.1]
  - - [64, 1, 1, 1, 64, 64, 64, 1]
    - [33, 0.00376759]
  - - [64, 64, 1, 1, 64, 64, 64, 1]
    - [34, 0.239085]
  - - [64, 1, 1, 64, 64, 64, 64, 64]
    - [3, 0.232292]
  - - [64, 64, 1, 64, 64, 64, 64, 64]
    - [35, 16.0721]
  - - [64, 64, 1, 256, 64, 64, 64, 256]
    - [29, 59.3153]
  - - [64, 64, 1, 512, 64, 64, 64, 512]
    - [28, 113.762]
  - - [64, 64, 1, 1024, 64, 64, 64, 1024]
    - [22, 218.442]
  - - [64, 64, 1, 2048, 64, 64, 64, 2048]
    - [23, 370.562]
  - - [64, 64, 1, 4096, 64, 64, 64, 4096]
    - [28, 610.825]
- null
- null
- DeviceEfficiency
- GridBased
