library/src/amd_detail/rocblaslt/src/Tensile/Logic/asm_full/gfx1200/GridBased/gfx1200_Cijk_Alik_Bljk_I8II_BH_HAI_SAV_UserArgs.yaml
- {MinimumRequiredVersion: 4.33.0}
- gfx1200
- gfx1200
- [Device 73f0]
    SolutionIndex: 0
    SolutionNameMin: Cijk_Alik_Bljk_I8II_BH_HAI_SAV_UserArgs_MT64x16x32_MI16x16x1_SN_LDSB0_CLR1_GRVWA8_GRVWB4_GSU1_LBSPPA128_LBSPPB128_LPA8_LPB8_MIWT1_1_PGR1_PLR1_SS0_SU32_SUM0_SUS256_SVW8_TLDS1_WG64_2_1_WGM8
    SolutionIndex: 1
    SolutionNameMin: Cijk_Alik_Bljk_I8II_BH_HAI_SAV_UserArgs_MT64x16x32_MI16x16x1_SN_LDSB0_CLR1_GRVWA16_GRVWB4_GSU1_LBSPPA512_LBSPPB128_LPA16_LPB16_MIWT1_1_PGR2_PLR1_SS0_SU32_SUM0_SUS256_SVW8_TLDS0_WG64_2_1_WGM8
    SolutionIndex: 2
    SolutionNameMin: Cijk_Alik_Bljk_I8II_BH_HAI_SAV_UserArgs_MT64x16x32_MI16x16x1_SN_LDSB0_CLR0_GRVWA8_GRVWB4_GSU1_LBSPPA128_LBSPPB128_LPA8_LPB8_MIWT1_1_PGR1_PLR0_SS0_SU32_SUM0_SUS256_SVW8_TLDS1_WG64_2_1_WGM8
    SolutionIndex: 3
    SolutionNameMin: Cijk_Alik_Bljk_I8II_BH_HAI_SAV_UserArgs_MT256x16x64_MI16x16x1_SN_LDSB1_CLR1_GRVWA8_GRVWB8_GSU1_LBSPPA128_LBSPPB128_LPA8_LPB8_MIWT4_1_PGR1_PLR3_SS0_SU32_SUM0_SUS256_SVW8_TLDS1_WG64_2_1_WGM8
    SolutionIndex: 4
    SolutionNameMin: Cijk_Alik_Bljk_I8II_BH_HAI_SAV_UserArgs_MT256x16x64_MI16x16x1_SN_LDSB1_CLR1_GRVWA8_GRVWB8_GSU1_LBSPPA128_LBSPPB128_LPA8_LPB8_MIWT4_1_PGR2_PLR3_SS0_SU32_SUM0_SUS256_SVW8_TLDS1_WG64_2_1_WGM8
    SolutionIndex: 5
    SolutionNameMin: Cijk_Alik_Bljk_I8II_BH_HAI_SAV_UserArgs_MT64x32x64_MI16x16x1_SN_LDSB0_CLR1_GRVWA8_GRVWB8_GSU1_LBSPPA128_LBSPPB128_LPA8_LPB8_MIWT2_1_PGR1_PLR3_SS0_SU32_SUM0_SUS256_SVW8_TLDS1_WG32_4_1_WGM8
    SolutionIndex: 6
    SolutionNameMin: Cijk_Alik_Bljk_I8II_BH_HAI_SAV_UserArgs_MT64x32x64_MI16x16x1_SN_LDSB0_CLR0_GRVWA8_GRVWB8_GSU1_LBSPPA128_LBSPPB128_LPA8_LPB8_MIWT2_1_PGR1_PLR0_SS0_SU32_SUM0_SUS256_SVW8_TLDS1_WG32_4_1_WGM8
    SolutionIndex: 7
    SolutionNameMin: Cijk_Alik_Bljk_I8II_BH_HAI_SAV_UserArgs_MT32x64x64_MI16x16x1_SN_LDSB0_CLR1_GRVWA8_GRVWB8_GSU1_LBSPPA128_LBSPPB128_LPA8_LPB8_MIWT2_1_PGR1_PLR3_SS0_SU32_SUM0_SUS256_SVW8_TLDS1_WG16_8_1_WGM8
    SolutionIndex: 8
    SolutionNameMin: Cijk_Alik_Bljk_I8II_BH_HAI_SAV_UserArgs_MT32x64x64_MI16x16x1_SN_LDSB0_CLR0_GRVWA8_GRVWB8_GSU1_LBSPPA128_LBSPPB128_LPA8_LPB8_MIWT2_1_PGR1_PLR0_SS0_SU32_SUM0_SUS256_SVW8_TLDS1_WG16_8_1_WGM8
    SolutionIndex: 9
    SolutionNameMin: Cijk_Alik_Bljk_I8II_BH_HAI_SAV_UserArgs_MT256x16x32_MI16x16x1_SN_LDSB0_CLR0_GRVWA8_GRVWB4_GSU1_LBSPPA128_LBSPPB128_LPA8_LPB8_MIWT4_1_PGR1_PLR0_SS1_SU32_SUM0_SUS256_SVW1_TLDS1_WG64_2_1_WGM8
    SolutionIndex: 10
    SolutionNameMin: Cijk_Alik_Bljk_I8II_BH_HAI_SAV_UserArgs_MT32x32x32_MI16x16x1_SN_LDSB0_CLR1_GRVWA8_GRVWB8_GSU1_LBSPPA128_LBSPPB128_LPA8_LPB8_MIWT1_1_PGR1_PLR1_SS1_SU32_SUM0_SUS256_SVW1_TLDS1_WG32_4_1_WGM8
    SolutionIndex: 11
    SolutionNameMin: Cijk_Alik_Bljk_I8II_BH_HAI_SAV_UserArgs_MT64x32x32_MI16x16x1_SN_LDSB0_CLR1_GRVWA8_GRVWB8_GSU1_LBSPPA128_LBSPPB128_LPA8_LPB8_MIWT2_1_PGR1_PLR1_SS1_SU32_SUM0_SUS256_SVW1_TLDS1_WG32_4_1_WGM8
    SolutionIndex: 12
    SolutionNameMin: Cijk_Alik_Bljk_I8II_BH_HAI_SAV_UserArgs_MT64x32x32_MI16x16x1_SN_LDSB0_CLR0_GRVWA8_GRVWB8_GSU1_LBSPPA128_LBSPPB128_LPA8_LPB8_MIWT2_1_PGR1_PLR0_SS1_SU32_SUM0_SUS256_SVW1_TLDS1_WG32_4_1_WGM8
    SolutionIndex: 13
    SolutionNameMin: Cijk_Alik_Bljk_I8II_BH_HAI_SAV_UserArgs_MT32x64x32_MI16x16x1_SN_LDSB0_CLR1_GRVWA8_GRVWB8_GSU1_LBSPPA128_LBSPPB128_LPA8_LPB8_MIWT2_1_PGR1_PLR1_SS1_SU32_SUM0_SUS256_SVW1_TLDS1_WG16_8_1_WGM8
    SolutionIndex: 14
    SolutionNameMin: Cijk_Alik_Bljk_I8II_BH_HAI_SAV_UserArgs_MT32x64x32_MI16x16x1_SN_LDSB0_CLR1_GRVWA8_GRVWB8_GSU1_LBSPPA128_LBSPPB128_LPA8_LPB8_MIWT2_1_PGR2_PLR1_SS1_SU32_SUM0_SUS256_SVW1_TLDS1_WG16_8_1_WGM8
    SolutionIndex: 15
    SolutionNameMin: Cijk_Alik_Bljk_I8II_BH_HAI_SAV_UserArgs_MT64x16x64_MI16x16x1_SN_LDSB0_CLR1_GRVWA8_GRVWB8_GSU1_LBSPPA128_LBSPPB128_LPA8_LPB8_MIWT1_1_PGR1_PLR1_SS1_SU32_SUM0_SUS256_SVW1_TLDS1_WG64_2_1_WGM8
    SolutionIndex: 16
    SolutionNameMin: Cijk_Alik_Bljk_I8II_BH_HAI_SAV_UserArgs_MT256x16x64_MI16x16x1_SN_LDSB1_CLR1_GRVWA8_GRVWB8_GSU1_LBSPPA128_LBSPPB128_LPA8_LPB8_MIWT4_1_PGR1_PLR1_SS1_SU32_SUM0_SUS256_SVW1_TLDS1_WG64_2_1_WGM8
    SolutionIndex: 17
    SolutionNameMin: Cijk_Alik_Bljk_I8II_BH_HAI_SAV_UserArgs_MT256x16x64_MI16x16x1_SN_LDSB1_CLR1_GRVWA8_GRVWB8_GSU1_LBSPPA128_LBSPPB128_LPA8_LPB8_MIWT4_1_PGR2_PLR1_SS1_SU32_SUM0_SUS256_SVW1_TLDS1_WG64_2_1_WGM8
    SolutionIndex: 18
    SolutionNameMin: Cijk_Alik_Bljk_I8II_BH_HAI_SAV_UserArgs_MT256x16x64_MI16x16x1_SN_LDSB1_CLR1_GRVWA8_GRVWB8_GSU1_LBSPPA128_LBSPPB128_LPA8_LPB8_MIWT4_1_PGR1_PLR3_SS1_SU32_SUM0_SUS256_SVW1_TLDS1_WG64_2_1_WGM8
    SolutionIndex: 19
    SolutionNameMin: Cijk_Alik_Bljk_I8II_BH_HAI_SAV_UserArgs_MT256x16x64_MI16x16x1_SN_LDSB1_CLR1_GRVWA8_GRVWB8_GSU1_LBSPPA128_LBSPPB128_LPA8_LPB8_MIWT4_1_PGR2_PLR3_SS1_SU32_SUM0_SUS256_SVW1_TLDS1_WG64_2_1_WGM8
    SolutionIndex: 20
    SolutionNameMin: Cijk_Alik_Bljk_I8II_BH_HAI_SAV_UserArgs_MT32x32x64_MI16x16x1_SN_LDSB0_CLR1_GRVWA8_GRVWB8_GSU1_LBSPPA128_LBSPPB128_LPA8_LPB8_MIWT1_1_PGR1_PLR1_SS1_SU32_SUM0_SUS256_SVW1_TLDS1_WG32_4_1_WGM8
    SolutionIndex: 21
    SolutionNameMin: Cijk_Alik_Bljk_I8II_BH_HAI_SAV_UserArgs_MT32x32x64_MI16x16x1_SN_LDSB0_CLR1_GRVWA8_GRVWB8_GSU1_LBSPPA128_LBSPPB128_LPA8_LPB8_MIWT1_1_PGR1_PLR3_SS1_SU32_SUM0_SUS256_SVW1_TLDS1_WG32_4_1_WGM8
    SolutionIndex: 22
    SolutionNameMin: Cijk_Alik_Bljk_I8II_BH_HAI_SAV_UserArgs_MT32x32x64_MI16x16x1_SN_LDSB0_CLR0_GRVWA8_GRVWB8_GSU1_LBSPPA128_LBSPPB128_LPA8_LPB8_MIWT1_1_PGR2_PLR0_SS1_SU32_SUM0_SUS256_SVW1_TLDS1_WG32_4_1_WGM8
    SolutionIndex: 23
    SolutionNameMin: Cijk_Alik_Bljk_I8II_BH_HAI_SAV_UserArgs_MT64x32x64_MI16x16x1_SN_LDSB0_CLR1_GRVWA8_GRVWB8_GSU1_LBSPPA128_LBSPPB128_LPA8_LPB8_MIWT2_1_PGR1_PLR1_SS1_SU32_SUM0_SUS256_SVW1_TLDS1_WG32_4_1_WGM8
    SolutionIndex: 24
    SolutionNameMin: Cijk_Alik_Bljk_I8II_BH_HAI_SAV_UserArgs_MT64x32x64_MI16x16x1_SN_LDSB0_CLR1_GRVWA8_GRVWB8_GSU1_LBSPPA128_LBSPPB128_LPA8_LPB8_MIWT2_1_PGR1_PLR3_SS1_SU32_SUM0_SUS256_SVW1_TLDS1_WG32_4_1_WGM8
    SolutionIndex: 25
    SolutionNameMin: Cijk_Alik_Bljk_I8II_BH_HAI_SAV_UserArgs_MT64x32x64_MI16x16x1_SN_LDSB0_CLR0_GRVWA8_GRVWB8_GSU1_LBSPPA128_LBSPPB128_LPA8_LPB8_MIWT2_1_PGR1_PLR0_SS1_SU32_SUM0_SUS256_SVW1_TLDS1_WG32_4_1_WGM8
    SolutionIndex: 26
    SolutionNameMin: Cijk_Alik_Bljk_I8II_BH_HAI_SAV_UserArgs_MT16x64x64_MI16x16x1_SN_LDSB0_CLR1_GRVWA8_GRVWB8_GSU1_LBSPPA128_LBSPPB128_LPA8_LPB8_MIWT1_1_PGR1_PLR1_SS1_SU32_SUM0_SUS256_SVW1_TLDS1_WG16_8_1_WGM8
    SolutionIndex: 27
    SolutionNameMin: Cijk_Alik_Bljk_I8II_BH_HAI_SAV_UserArgs_MT16x64x64_MI16x16x1_SN_LDSB0_CLR1_GRVWA8_GRVWB8_GSU1_LBSPPA128_LBSPPB128_LPA8_LPB8_MIWT1_1_PGR1_PLR3_SS1_SU32_SUM0_SUS256_SVW1_TLDS1_WG16_8_1_WGM8
    SolutionIndex: 28
    SolutionNameMin: Cijk_Alik_Bljk_I8II_BH_HAI_SAV_UserArgs_MT32x64x64_MI16x16x1_SN_LDSB0_CLR1_GRVWA8_GRVWB8_GSU1_LBSPPA128_LBSPPB128_LPA8_LPB8_MIWT2_1_PGR1_PLR1_SS1_SU32_SUM0_SUS256_SVW1_TLDS1_WG16_8_1_WGM8
    SolutionIndex: 29
    SolutionNameMin: Cijk_Alik_Bljk_I8II_BH_HAI_SAV_UserArgs_MT32x64x64_MI16x16x1_SN_LDSB0_CLR1_GRVWA8_GRVWB8_GSU1_LBSPPA128_LBSPPB128_LPA8_LPB8_MIWT2_1_PGR2_PLR1_SS1_SU32_SUM0_SUS256_SVW1_TLDS1_WG16_8_1_WGM8
    SolutionIndex: 30
    SolutionNameMin: Cijk_Alik_Bljk_I8II_BH_HAI_SAV_UserArgs_MT32x64x64_MI16x16x1_SN_LDSB0_CLR1_GRVWA8_GRVWB8_GSU1_LBSPPA128_LBSPPB128_LPA8_LPB8_MIWT2_1_PGR1_PLR3_SS1_SU32_SUM0_SUS256_SVW1_TLDS1_WG16_8_1_WGM8
    SolutionIndex: 31
    SolutionNameMin: Cijk_Alik_Bljk_I8II_BH_HAI_SAV_UserArgs_MT32x64x64_MI16x16x1_SN_LDSB0_CLR0_GRVWA8_GRVWB8_GSU1_LBSPPA128_LBSPPB128_LPA8_LPB8_MIWT2_1_PGR1_PLR0_SS1_SU32_SUM0_SUS256_SVW1_TLDS1_WG16_8_1_WGM8
    SolutionIndex: 32
    SolutionNameMin: Cijk_Alik_Bljk_I8II_BH_HAI_SAV_UserArgs_MT32x64x64_MI16x16x1_SN_LDSB0_CLR0_GRVWA8_GRVWB8_GSU1_LBSPPA128_LBSPPB128_LPA8_LPB8_MIWT2_1_PGR2_PLR0_SS1_SU32_SUM0_SUS256_SVW1_TLDS1_WG16_8_1_WGM8
- - - [512, 512, 1, 64, 512, 512, 64, 64]
    - [25, 1197.39]
  - - [1024, 512, 1, 64, 1024, 1024, 64, 64]
    - [9, 2276.73]
  - - [1536, 512, 1, 64, 1536, 1536, 64, 64]
    - [19, 3272.86]
  - - [2048, 512, 1, 64, 2048, 2048, 64, 64]
    - [29, 3954.21]
  - - [2560, 512, 1, 64, 2560, 2560, 64, 64]
    - [32, 4434.66]
  - - [3072, 512, 1, 64, 3072, 3072, 64, 64]
    - [16, 5686.07]
  - - [512, 1024, 1, 64, 512, 512, 64, 64]
    - [17, 2256.06]
  - - [1024, 1024, 1, 64, 1024, 1024, 64, 64]
    - [17, 4046.12]
  - - [1536, 1024, 1, 64, 1536, 1536, 64, 64]
    - [18, 5597.54]
  - - [2048, 1024, 1, 64, 2048, 2048, 64, 64]
    - [18, 7131.65]
  - - [2560, 1024, 1, 64, 2560, 2560, 64, 64]
    - [3, 8436.06]
  - - [3072, 1024, 1, 64, 3072, 3072, 64, 64]
    - [18, 9778.59]
  - - [512, 1536, 1, 64, 512, 512, 64, 64]
    - [31, 3169.5]
  - - [1024, 1536, 1, 64, 1024, 1024, 64, 64]
    - [19, 5697.33]
  - - [1536, 1536, 1, 64, 1536, 1536, 64, 64]
    - [17, 7884.44]
  - - [2048, 1536, 1, 64, 2048, 2048, 64, 64]
    - [18, 9661.05]
  - - [2560, 1536, 1, 64, 2560, 2560, 64, 64]
    - [4, 10813.1]
  - - [3072, 1536, 1, 64, 3072, 3072, 64, 64]
    - [18, 12353.6]
  - - [512, 2048, 1, 64, 512, 512, 64, 64]
    - [4, 3673.37]
  - - [1024, 2048, 1, 64, 1024, 1024, 64, 64]
    - [3, 6604.07]
  - - [1536, 2048, 1, 64, 1536, 1536, 64, 64]
    - [16, 9532.51]
  - - [2048, 2048, 1, 64, 2048, 2048, 64, 64]
    - [16, 11541.1]
  - - [2560, 2048, 1, 64, 2560, 2560, 64, 64]
    - [4, 13980.7]
  - - [3072, 2048, 1, 64, 3072, 3072, 64, 64]
    - [16, 14876.7]
  - - [512, 2560, 1, 64, 512, 512, 64, 64]
    - [18, 4796.78]
  - - [1024, 2560, 1, 64, 1024, 1024, 64, 64]
    - [16, 7983.64]
  - - [1536, 2560, 1, 64, 1536, 1536, 64, 64]
    - [3, 11743.3]
  - - [2048, 2560, 1, 64, 2048, 2048, 64, 64]
    - [3, 13216.7]
  - - [2560, 2560, 1, 64, 2560, 2560, 64, 64]
    - [4, 15201.2]
  - - [3072, 2560, 1, 64, 3072, 3072, 64, 64]
    - [4, 17356.0]
  - - [512, 3072, 1, 64, 512, 512, 64, 64]
    - [18, 5643.04]
  - - [1024, 3072, 1, 64, 1024, 1024, 64, 64]
    - [19, 9792.86]
  - - [1536, 3072, 1, 64, 1536, 1536, 64, 64]
    - [3, 12315.6]
  - - [2048, 3072, 1, 64, 2048, 2048, 64, 64]
    - [3, 15574.4]
  - - [2560, 3072, 1, 64, 2560, 2560, 64, 64]
    - [4, 17935.2]
  - - [3072, 3072, 1, 64, 3072, 3072, 64, 64]
    - [17, 18695.9]
  - - [512, 512, 1, 256, 512, 512, 256, 256]
    - [24, 4654.84]
  - - [1024, 512, 1, 256, 1024, 1024, 256, 256]
    - [31, 8607.01]
  - - [1536, 512, 1, 256, 1536, 1536, 256, 256]
    - [30, 11824.0]
  - - [2048, 512, 1, 256, 2048, 2048, 256, 256]
    - [28, 13396.3]
  - - [2560, 512, 1, 256, 2560, 2560, 256, 256]
    - [13, 17393.8]
  - - [3072, 512, 1, 256, 3072, 3072, 256, 256]
    - [30, 19861.5]
  - - [512, 1024, 1, 256, 512, 512, 256, 256]
    - [31, 8462.66]
  - - [1024, 1024, 1, 256, 1024, 1024, 256, 256]
    - [5, 13628.2]
  - - [1536, 1024, 1, 256, 1536, 1536, 256, 256]
    - [14, 18988.6]
  - - [2048, 1024, 1, 256, 2048, 2048, 256, 256]
    - [28, 23018.5]
  - - [2560, 1024, 1, 256, 2560, 2560, 256, 256]
    - [13, 26739.8]
  - - [3072, 1024, 1, 256, 3072, 3072, 256, 256]
    - [28, 30389.5]
  - - [512, 1536, 1, 256, 512, 512, 256, 256]
    - [16, 11273.4]
  - - [1024, 1536, 1, 256, 1024, 1024, 256, 256]
    - [30, 19930.4]
  - - [1536, 1536, 1, 256, 1536, 1536, 256, 256]
    - [13, 25213.1]
  - - [2048, 1536, 1, 256, 2048, 2048, 256, 256]
    - [31, 29836.1]
  - - [2560, 1536, 1, 256, 2560, 2560, 256, 256]
    - [14, 35396.8]
  - - [3072, 1536, 1, 256, 3072, 3072, 256, 256]
    - [30, 38880.5]
  - - [512, 2048, 1, 256, 512, 512, 256, 256]
    - [23, 14872.6]
  - - [1024, 2048, 1, 256, 1024, 1024, 256, 256]
    - [24, 24451.6]
  - - [1536, 2048, 1, 256, 1536, 1536, 256, 256]
    - [30, 30291.8]
  - - [2048, 2048, 1, 256, 2048, 2048, 256, 256]
    - [24, 36634.0]
  - - [2560, 2048, 1, 256, 2560, 2560, 256, 256]
    - [6, 39062.8]
  - - [3072, 2048, 1, 256, 3072, 3072, 256, 256]
    - [30, 43058.8]
  - - [512, 2560, 1, 256, 512, 512, 256, 256]
    - [28, 16996.5]
  - - [1024, 2560, 1, 256, 1024, 1024, 256, 256]
    - [31, 27536.4]
  - - [1536, 2560, 1, 256, 1536, 1536, 256, 256]
    - [30, 35008.4]
  - - [2048, 2560, 1, 256, 2048, 2048, 256, 256]
    - [30, 39989.8]
  - - [2560, 2560, 1, 256, 2560, 2560, 256, 256]
    - [24, 43894.1]
  - - [3072, 2560, 1, 256, 3072, 3072, 256, 256]
    - [24, 45909.9]
  - - [512, 3072, 1, 256, 512, 512, 256, 256]
    - [11, 18766.9]
  - - [1024, 3072, 1, 256, 1024, 1024, 256, 256]
    - [30, 29953.2]
  - - [1536, 3072, 1, 256, 1536, 1536, 256, 256]
    - [30, 37460.8]
  - - [2048, 3072, 1, 256, 2048, 2048, 256, 256]
    - [30, 42732.6]
  - - [2560, 3072, 1, 256, 2560, 2560, 256, 256]
    - [7, 46967.0]
  - - [3072, 3072, 1, 256, 3072, 3072, 256, 256]
    - [30, 49383.1]
  - - [512, 512, 1, 512, 512, 512, 512, 512]
    - [20, 8626.1]
  - - [1024, 512, 1, 512, 1024, 1024, 512, 512]
    - [31, 16213.8]
  - - [1536, 512, 1, 512, 1536, 1536, 512, 512]
    - [13, 21135.5]
  - - [2048, 512, 1, 512, 2048, 2048, 512, 512]
    - [31, 24871.8]
  - - [2560, 512, 1, 512, 2560, 2560, 512, 512]
    - [13, 30111.2]
  - - [3072, 512, 1, 512, 3072, 3072, 512, 512]
    - [24, 34438.3]
  - - [512, 1024, 1, 512, 512, 512, 512, 512]
    - [30, 14774.4]
  - - [1024, 1024, 1, 512, 1024, 1024, 512, 512]
    - [31, 26981.8]
  - - [1536, 1024, 1, 512, 1536, 1536, 512, 512]
    - [30, 34916.9]
  - - [2048, 1024, 1, 512, 2048, 2048, 512, 512]
    - [30, 39452.6]
  - - [2560, 1024, 1, 512, 2560, 2560, 512, 512]
    - [30, 46988.4]
  - - [3072, 1024, 1, 512, 3072, 3072, 512, 512]
    - [30, 50362.3]
  - - [512, 1536, 1, 512, 512, 512, 512, 512]
    - [13, 22057.7]
  - - [1024, 1536, 1, 512, 1024, 1024, 512, 512]
    - [30, 34803.7]
  - - [1536, 1536, 1, 512, 1536, 1536, 512, 512]
    - [7, 43716.0]
  - - [2048, 1536, 1, 512, 2048, 2048, 512, 512]
    - [31, 51205.3]
  - - [2560, 1536, 1, 512, 2560, 2560, 512, 512]
    - [31, 55780.7]
  - - [3072, 1536, 1, 512, 3072, 3072, 512, 512]
    - [30, 61311.5]
  - - [512, 2048, 1, 512, 512, 512, 512, 512]
    - [23, 25547.6]
  - - [1024, 2048, 1, 512, 1024, 1024, 512, 512]
    - [31, 41426.8]
  - - [1536, 2048, 1, 512, 1536, 1536, 512, 512]
    - [30, 52552.8]
  - - [2048, 2048, 1, 512, 2048, 2048, 512, 512]
    - [31, 58692.9]
  - - [2560, 2048, 1, 512, 2560, 2560, 512, 512]
    - [25, 61643.4]
  - - [3072, 2048, 1, 512, 3072, 3072, 512, 512]
    - [24, 67403.8]
  - - [512, 2560, 1, 512, 512, 512, 512, 512]
    - [8, 30712.0]
  - - [1024, 2560, 1, 512, 1024, 1024, 512, 512]
    - [5, 44249.5]
  - - [1536, 2560, 1, 512, 1536, 1536, 512, 512]
    - [5, 57258.5]
  - - [2048, 2560, 1, 512, 2048, 2048, 512, 512]
    - [23, 63984.0]
  - - [2560, 2560, 1, 512, 2560, 2560, 512, 512]
    - [30, 69247.2]
  - - [3072, 2560, 1, 512, 3072, 3072, 512, 512]
    - [30, 71748.0]
  - - [512, 3072, 1, 512, 512, 512, 512, 512]
    - [7, 34743.7]
  - - [1024, 3072, 1, 512, 1024, 1024, 512, 512]
    - [30, 52076.2]
  - - [1536, 3072, 1, 512, 1536, 1536, 512, 512]
    - [30, 61655.8]
  - - [2048, 3072, 1, 512, 2048, 2048, 512, 512]
    - [30, 68803.1]
  - - [2560, 3072, 1, 512, 2560, 2560, 512, 512]
    - [30, 73446.0]
  - - [3072, 3072, 1, 512, 3072, 3072, 512, 512]
    - [24, 78132.6]
  - - [512, 512, 1, 1024, 512, 512, 1024, 1024]
    - [21, 16267.8]
  - - [1024, 512, 1, 1024, 1024, 1024, 1024, 1024]
    - [30, 27728.8]
  - - [1536, 512, 1, 1024, 1536, 1536, 1024, 1024]
    - [30, 34736.2]
  - - [2048, 512, 1, 1024, 2048, 2048, 1024, 1024]
    - [30, 43293.4]
  - - [2560, 512, 1, 1024, 2560, 2560, 1024, 1024]
    - [24, 49699.2]
  - - [3072, 512, 1, 1024, 3072, 3072, 1024, 1024]
    - [30, 57271.3]
  - - [512, 1024, 1, 1024, 512, 512, 1024, 1024]
    - [23, 27565.1]
  - - [1024, 1024, 1, 1024, 1024, 1024, 1024, 1024]
    - [30, 44451.2]
  - - [1536, 1024, 1, 1024, 1536, 1536, 1024, 1024]
    - [30, 57547.6]
  - - [2048, 1024, 1, 1024, 2048, 2048, 1024, 1024]
    - [30, 64397.1]
  - - [2560, 1024, 1, 1024, 2560, 2560, 1024, 1024]
    - [30, 70890.0]
  - - [3072, 1024, 1, 1024, 3072, 3072, 1024, 1024]
    - [30, 76369.5]
  - - [512, 1536, 1, 1024, 512, 512, 1024, 1024]
    - [3, 34313.6]
  - - [1024, 1536, 1, 1024, 1024, 1024, 1024, 1024]
    - [7, 53532.7]
  - - [1536, 1536, 1, 1024, 1536, 1536, 1024, 1024]
    - [7, 64944.1]
  - - [2048, 1536, 1, 1024, 2048, 2048, 1024, 1024]
    - [24, 74322.0]
  - - [2560, 1536, 1, 1024, 2560, 2560, 1024, 1024]
    - [24, 80234.6]
  - - [3072, 1536, 1, 1024, 3072, 3072, 1024, 1024]
    - [30, 86375.4]
  - - [512, 2048, 1, 1024, 512, 512, 1024, 1024]
    - [24, 45230.2]
  - - [1024, 2048, 1, 1024, 1024, 1024, 1024, 1024]
    - [30, 65120.6]
  - - [1536, 2048, 1, 1024, 1536, 1536, 1024, 1024]
    - [7, 75802.5]
  - - [2048, 2048, 1, 1024, 2048, 2048, 1024, 1024]
    - [30, 82951.3]
  - - [2560, 2048, 1, 1024, 2560, 2560, 1024, 1024]
    - [7, 87874.8]
  - - [3072, 2048, 1, 1024, 3072, 3072, 1024, 1024]
    - [30, 91868.3]
  - - [512, 2560, 1, 1024, 512, 512, 1024, 1024]
    - [5, 49874.7]
  - - [1024, 2560, 1, 1024, 1024, 1024, 1024, 1024]
    - [30, 72276.6]
  - - [1536, 2560, 1, 1024, 1536, 1536, 1024, 1024]
    - [7, 78880.5]
  - - [2048, 2560, 1, 1024, 2048, 2048, 1024, 1024]
    - [30, 88301.9]
  - - [2560, 2560, 1, 1024, 2560, 2560, 1024, 1024]
    - [5, 91307.1]
  - - [3072, 2560, 1, 1024, 3072, 3072, 1024, 1024]
    - [30, 96464.7]
  - - [512, 3072, 1, 1024, 512, 512, 1024, 1024]
    - [30, 56694.7]
  - - [1024, 3072, 1, 1024, 1024, 1024, 1024, 1024]
    - [7, 74286.8]
  - - [1536, 3072, 1, 1024, 1536, 1536, 1024, 1024]
    - [24, 86105.2]
  - - [2048, 3072, 1, 1024, 2048, 2048, 1024, 1024]
    - [24, 94209.9]
  - - [2560, 3072, 1, 1024, 2560, 2560, 1024, 1024]
    - [30, 97058.8]
  - - [3072, 3072, 1, 1024, 3072, 3072, 1024, 1024]
    - [30, 98979.1]
  - - [512, 512, 1, 2048, 512, 512, 2048, 2048]
    - [21, 28586.6]
  - - [1024, 512, 1, 2048, 1024, 1024, 2048, 2048]
    - [31, 44451.2]
  - - [1536, 512, 1, 2048, 1536, 1536, 2048, 2048]
    - [13, 61474.9]
  - - [2048, 512, 1, 2048, 2048, 2048, 2048, 2048]
    - [30, 66217.0]
  - - [2560, 512, 1, 2048, 2560, 2560, 2048, 2048]
    - [7, 73084.4]
  - - [3072, 512, 1, 2048, 3072, 3072, 2048, 2048]
    - [30, 76862.4]
  - - [512, 1024, 1, 2048, 512, 512, 2048, 2048]
    - [23, 47516.0]
  - - [1024, 1024, 1, 2048, 1024, 1024, 2048, 2048]
    - [30, 69433.8]
  - - [1536, 1024, 1, 2048, 1536, 1536, 2048, 2048]
    - [30, 81386.2]
  - - [2048, 1024, 1, 2048, 2048, 2048, 2048, 2048]
    - [30, 88884.1]
  - - [2560, 1024, 1, 2048, 2560, 2560, 2048, 2048]
    - [7, 94002.3]
  - - [3072, 1024, 1, 2048, 3072, 3072, 2048, 2048]
    - [30, 97458.6]
  - - [512, 1536, 1, 2048, 512, 512, 2048, 2048]
    - [13, 58098.7]
  - - [1024, 1536, 1, 2048, 1024, 1024, 2048, 2048]
    - [30, 79721.5]
  - - [1536, 1536, 1, 2048, 1536, 1536, 2048, 2048]
    - [7, 86374.6]
  - - [2048, 1536, 1, 2048, 2048, 2048, 2048, 2048]
    - [30, 98247.8]
  - - [2560, 1536, 1, 2048, 2560, 2560, 2048, 2048]
    - [30, 101042.0]
  - - [3072, 1536, 1, 2048, 3072, 3072, 2048, 2048]
    - [30, 104180.0]
  - - [512, 2048, 1, 2048, 512, 512, 2048, 2048]
    - [30, 67298.1]
  - - [1024, 2048, 1, 2048, 1024, 1024, 2048, 2048]
    - [7, 89338.0]
  - - [1536, 2048, 1, 2048, 1536, 1536, 2048, 2048]
    - [7, 99126.1]
  - - [2048, 2048, 1, 2048, 2048, 2048, 2048, 2048]
    - [30, 106434.0]
  - - [2560, 2048, 1, 2048, 2560, 2560, 2048, 2048]
    - [30, 107808.0]
  - - [3072, 2048, 1, 2048, 3072, 3072, 2048, 2048]
    - [30, 111493.0]
  - - [512, 2560, 1, 2048, 512, 512, 2048, 2048]
    - [30, 73355.0]
  - - [1024, 2560, 1, 2048, 1024, 1024, 2048, 2048]
    - [7, 94507.9]
  - - [1536, 2560, 1, 2048, 1536, 1536, 2048, 2048]
    - [7, 101080.0]
  - - [2048, 2560, 1, 2048, 2048, 2048, 2048, 2048]
    - [7, 105996.0]
  - - [2560, 2560, 1, 2048, 2560, 2560, 2048, 2048]
    - [24, 110387.0]
  - - [3072, 2560, 1, 2048, 3072, 3072, 2048, 2048]
    - [30, 112612.0]
  - - [512, 3072, 1, 2048, 512, 512, 2048, 2048]
    - [8, 82165.7]
  - - [1024, 3072, 1, 2048, 1024, 1024, 2048, 2048]
    - [7, 97340.8]
  - - [1536, 3072, 1, 2048, 1536, 1536, 2048, 2048]
    - [7, 106563.0]
  - - [2048, 3072, 1, 2048, 2048, 2048, 2048, 2048]
    - [30, 107643.0]
  - - [2560, 3072, 1, 2048, 2560, 2560, 2048, 2048]
    - [5, 113246.0]
  - - [3072, 3072, 1, 2048, 3072, 3072, 2048, 2048]
    - [30, 116608.0]
  - - [512, 512, 1, 3072, 512, 512, 3072, 3072]
    - [20, 37256.0]
  - - [1024, 512, 1, 3072, 1024, 1024, 3072, 3072]
    - [24, 60812.3]
  - - [1536, 512, 1, 3072, 1536, 1536, 3072, 3072]
    - [13, 75972.3]
  - - [2048, 512, 1, 3072, 2048, 2048, 3072, 3072]
    - [30, 84034.9]
  - - [2560, 512, 1, 3072, 2560, 2560, 3072, 3072]
    - [7, 83832.8]
  - - [3072, 512, 1, 3072, 3072, 3072, 3072, 3072]
    - [30, 94544.5]
  - - [512, 1024, 1, 3072, 512, 512, 3072, 3072]
    - [30, 58500.7]
  - - [1024, 1024, 1, 3072, 1024, 1024, 3072, 3072]
    - [7, 85932.6]
  - - [1536, 1024, 1, 3072, 1536, 1536, 3072, 3072]
    - [7, 96494.0]
  - - [2048, 1024, 1, 3072, 2048, 2048, 3072, 3072]
    - [30, 102385.0]
  - - [2560, 1024, 1, 3072, 2560, 2560, 3072, 3072]
    - [30, 106357.0]
  - - [3072, 1024, 1, 3072, 3072, 3072, 3072, 3072]
    - [7, 110785.0]
  - - [512, 1536, 1, 3072, 512, 512, 3072, 3072]
    - [12, 71670.9]
  - - [1024, 1536, 1, 3072, 1024, 1024, 3072, 3072]
    - [30, 93772.9]
  - - [1536, 1536, 1, 3072, 1536, 1536, 3072, 3072]
    - [7, 102481.0]
  - - [2048, 1536, 1, 3072, 2048, 2048, 3072, 3072]
    - [30, 109453.0]
  - - [2560, 1536, 1, 3072, 2560, 2560, 3072, 3072]
    - [7, 112021.0]
  - - [3072, 1536, 1, 3072, 3072, 3072, 3072, 3072]
    - [30, 117375.0]
  - - [512, 2048, 1, 3072, 512, 512, 3072, 3072]
    - [5, 83969.2]
  - - [1024, 2048, 1, 3072, 1024, 1024, 3072, 3072]
    - [7, 100923.0]
  - - [1536, 2048, 1, 3072, 1536, 1536, 3072, 3072]
    - [30, 110887.0]
  - - [2048, 2048, 1, 3072, 2048, 2048, 3072, 3072]
    - [30, 111353.0]
  - - [2560, 2048, 1, 3072, 2560, 2560, 3072, 3072]
    - [30, 117953.0]
  - - [3072, 2048, 1, 3072, 3072, 3072, 3072, 3072]
    - [30, 121053.0]
  - - [512, 2560, 1, 3072, 512, 512, 3072, 3072]
    - [30, 82635.4]
  - - [1024, 2560, 1, 3072, 1024, 1024, 3072, 3072]
    - [7, 107165.0]
  - - [1536, 2560, 1, 3072, 1536, 1536, 3072, 3072]
    - [30, 113702.0]
  - - [2048, 2560, 1, 3072, 2048, 2048, 3072, 3072]
    - [30, 114350.0]
  - - [2560, 2560, 1, 3072, 2560, 2560, 3072, 3072]
    - [7, 116377.0]
  - - [3072, 2560, 1, 3072, 3072, 3072, 3072, 3072]
    - [30, 120711.0]
  - - [512, 3072, 1, 3072, 512, 512, 3072, 3072]
    - [30, 93427.5]
  - - [1024, 3072, 1, 3072, 1024, 1024, 3072, 3072]
    - [30, 110506.0]
  - - [1536, 3072, 1, 3072, 1536, 1536, 3072, 3072]
    - [30, 115936.0]
  - - [2048, 3072, 1, 3072, 2048, 2048, 3072, 3072]
    - [30, 118546.0]
  - - [2560, 3072, 1, 3072, 2560, 2560, 3072, 3072]
    - [30, 123316.0]
  - - [3072, 3072, 1, 3072, 3072, 3072, 3072, 3072]
    - [30, 126278.0]
  - - [1, 1, 1, 1, 1, 1, 1, 1]
    - [1, 6.42715e-05]
  - - [1, 1, 1, 64, 1, 1, 64, 64]
    - [20, 0.00396027]
  - - [1, 64, 1, 1, 1, 1, 1, 1]
    - [27, 0.00401884]
  - - [64, 1, 1, 1, 64, 64, 1, 1]
    - [10, 0.00382512]
  - - [64, 64, 1, 1, 64, 64, 1, 1]
    - [0, 0.243057]
  - - [64, 1, 1, 64, 64, 64, 64, 64]
    - [10, 0.268793]
  - - [1, 64, 1, 64, 1, 1, 64, 64]
    - [2, 0.261233]
  - - [64, 64, 1, 64, 64, 64, 64, 64]
    - [22, 17.3164]
  - - [64, 64, 1, 256, 64, 64, 256, 256]
    - [26, 68.4941]
  - - [64, 64, 1, 512, 64, 64, 512, 512]
    - [26, 131.896]
  - - [64, 64, 1, 1024, 64, 64, 1024, 1024]
    - [21, 249.342]
  - - [64, 64, 1, 2048, 64, 64, 2048, 2048]
    - [15, 442.776]
  - - [64, 64, 1, 4096, 64, 64, 4096, 4096]
    - [20, 731.894]
- null
- null
- DeviceEfficiency
- GridBased
