library/src/amd_detail/rocblaslt/src/Tensile/Logic/asm_full/gfx1200/GridBased/gfx1200_Cijk_Ailk_Bjlk_BSS_BH_Bias_HAS_SAV_UserArgs.yaml
- {MinimumRequiredVersion: 4.33.0}
- gfx1200
- gfx1200
- [Device 73f0]
    SolutionIndex: 0
    SolutionNameMin: Cijk_Ailk_Bjlk_BSS_BH_Bias_HAS_SAV_UserArgs_MT64x32x32_MI16x16x1_SN_CLR1_GSU1_LBSPPA1024_LBSPPB512_MIWT2_1_PGR1_PLR1_SS0_SU32_SUM0_SUS256_SVW8_WG32_4_1_WGM8
    SolutionIndex: 1
    SolutionNameMin: Cijk_Ailk_Bjlk_BSS_BH_Bias_HAS_SAV_UserArgs_MT64x32x32_MI16x16x1_SN_CLR1_GSU1_LBSPPA1024_LBSPPB512_MIWT2_1_PGR2_PLR1_SS0_SU32_SUM0_SUS256_SVW8_WG32_4_1_WGM8
    SolutionIndex: 2
    SolutionNameMin: Cijk_Ailk_Bjlk_BSS_BH_Bias_HAS_SAV_UserArgs_MT64x32x32_MI16x16x1_SN_CLR0_GSU1_LBSPPA1024_LBSPPB512_MIWT2_1_PGR2_PLR0_SS0_SU32_SUM0_SUS256_SVW8_WG32_4_1_WGM8
    SolutionIndex: 3
    SolutionNameMin: Cijk_Ailk_Bjlk_BSS_BH_Bias_HAS_SAV_UserArgs_MT32x64x32_MI16x16x1_SN_CLR1_GSU1_LBSPPA512_LBSPPB1024_MIWT2_1_PGR1_PLR1_SS0_SU32_SUM0_SUS256_SVW8_WG16_8_1_WGM8
    SolutionIndex: 4
    SolutionNameMin: Cijk_Ailk_Bjlk_BSS_BH_Bias_HAS_SAV_UserArgs_MT32x64x32_MI16x16x1_SN_CLR1_GSU1_LBSPPA512_LBSPPB1024_MIWT2_1_PGR2_PLR1_SS0_SU32_SUM0_SUS256_SVW8_WG16_8_1_WGM8
    SolutionIndex: 5
    SolutionNameMin: Cijk_Ailk_Bjlk_BSS_BH_Bias_HAS_SAV_UserArgs_MT32x64x32_MI16x16x1_SN_CLR0_GSU1_LBSPPA512_LBSPPB1024_MIWT2_1_PGR1_PLR0_SS0_SU32_SUM0_SUS256_SVW8_WG16_8_1_WGM8
    SolutionIndex: 6
    SolutionNameMin: Cijk_Ailk_Bjlk_BSS_BH_Bias_HAS_SAV_UserArgs_MT32x64x32_MI16x16x1_SN_CLR0_GSU1_LBSPPA512_LBSPPB1024_MIWT2_1_PGR2_PLR0_SS0_SU32_SUM0_SUS256_SVW8_WG16_8_1_WGM8
    SolutionIndex: 7
    SolutionNameMin: Cijk_Ailk_Bjlk_BSS_BH_Bias_HAS_SAV_UserArgs_MT32x32x64_MI16x16x1_SN_CLR1_GSU1_LBSPPA512_LBSPPB512_MIWT1_1_PGR1_PLR1_SS0_SU32_SUM0_SUS256_SVW8_WG32_4_1_WGM8
    SolutionIndex: 8
    SolutionNameMin: Cijk_Ailk_Bjlk_BSS_BH_Bias_HAS_SAV_UserArgs_MT32x32x64_MI16x16x1_SN_CLR1_GSU1_LBSPPA512_LBSPPB512_MIWT1_1_PGR1_PLR3_SS0_SU32_SUM0_SUS256_SVW8_WG32_4_1_WGM8
    SolutionIndex: 9
    SolutionNameMin: Cijk_Ailk_Bjlk_BSS_BH_Bias_HAS_SAV_UserArgs_MT32x32x64_MI16x16x1_SN_CLR1_GSU1_LBSPPA512_LBSPPB512_MIWT1_1_PGR2_PLR3_SS0_SU32_SUM0_SUS256_SVW8_WG32_4_1_WGM8
    SolutionIndex: 10
    SolutionNameMin: Cijk_Ailk_Bjlk_BSS_BH_Bias_HAS_SAV_UserArgs_MT32x32x64_MI16x16x1_SN_CLR0_GSU1_LBSPPA512_LBSPPB512_MIWT1_1_PGR1_PLR0_SS0_SU32_SUM0_SUS256_SVW8_WG32_4_1_WGM8
    SolutionIndex: 11
    SolutionNameMin: Cijk_Ailk_Bjlk_BSS_BH_Bias_HAS_SAV_UserArgs_MT64x32x64_MI16x16x1_SN_CLR1_GSU1_LBSPPA1024_LBSPPB512_MIWT2_1_PGR1_PLR3_SS0_SU32_SUM0_SUS256_SVW8_WG32_4_1_WGM8
    SolutionIndex: 12
    SolutionNameMin: Cijk_Ailk_Bjlk_BSS_BH_Bias_HAS_SAV_UserArgs_MT32x64x64_MI16x16x1_SN_CLR1_GSU1_LBSPPA512_LBSPPB1024_MIWT2_1_PGR1_PLR3_SS0_SU32_SUM0_SUS256_SVW8_WG16_8_1_WGM8
    SolutionIndex: 13
    SolutionNameMin: Cijk_Ailk_Bjlk_BSS_BH_Bias_HAS_SAV_UserArgs_MT64x16x32_MI16x16x1_SN_CLR0_GSU1_LBSPPA1024_LBSPPB256_MIWT1_1_PGR1_PLR0_SS1_SU32_SUM0_SUS256_SVW1_WG64_2_1_WGM8
    SolutionIndex: 14
    SolutionNameMin: Cijk_Ailk_Bjlk_BSS_BH_Bias_HAS_SAV_UserArgs_MT32x32x32_MI16x16x1_SN_CLR1_GSU1_LBSPPA512_LBSPPB512_MIWT1_1_PGR1_PLR1_SS1_SU32_SUM0_SUS256_SVW1_WG32_4_1_WGM8
    SolutionIndex: 15
    SolutionNameMin: Cijk_Ailk_Bjlk_BSS_BH_Bias_HAS_SAV_UserArgs_MT32x32x32_MI16x16x1_SN_CLR0_GSU1_LBSPPA512_LBSPPB512_MIWT1_1_PGR1_PLR0_SS1_SU32_SUM0_SUS256_SVW1_WG32_4_1_WGM8
    SolutionIndex: 16
    SolutionNameMin: Cijk_Ailk_Bjlk_BSS_BH_Bias_HAS_SAV_UserArgs_MT32x32x32_MI16x16x1_SN_CLR0_GSU1_LBSPPA512_LBSPPB512_MIWT1_1_PGR2_PLR0_SS1_SU32_SUM0_SUS256_SVW1_WG32_4_1_WGM8
    SolutionIndex: 17
    SolutionNameMin: Cijk_Ailk_Bjlk_BSS_BH_Bias_HAS_SAV_UserArgs_MT64x32x32_MI16x16x1_SN_CLR1_GSU1_LBSPPA1024_LBSPPB512_MIWT2_1_PGR1_PLR1_SS1_SU32_SUM0_SUS256_SVW1_WG32_4_1_WGM8
    SolutionIndex: 18
    SolutionNameMin: Cijk_Ailk_Bjlk_BSS_BH_Bias_HAS_SAV_UserArgs_MT64x32x32_MI16x16x1_SN_CLR1_GSU1_LBSPPA1024_LBSPPB512_MIWT2_1_PGR2_PLR1_SS1_SU32_SUM0_SUS256_SVW1_WG32_4_1_WGM8
    SolutionIndex: 19
    SolutionNameMin: Cijk_Ailk_Bjlk_BSS_BH_Bias_HAS_SAV_UserArgs_MT64x32x32_MI16x16x1_SN_CLR0_GSU1_LBSPPA1024_LBSPPB512_MIWT2_1_PGR2_PLR0_SS1_SU32_SUM0_SUS256_SVW1_WG32_4_1_WGM8
    SolutionIndex: 20
    SolutionNameMin: Cijk_Ailk_Bjlk_BSS_BH_Bias_HAS_SAV_UserArgs_MT16x64x32_MI16x16x1_SN_CLR0_GSU1_LBSPPA256_LBSPPB1024_MIWT1_1_PGR1_PLR0_SS1_SU32_SUM0_SUS256_SVW1_WG16_8_1_WGM8
    SolutionIndex: 21
    SolutionNameMin: Cijk_Ailk_Bjlk_BSS_BH_Bias_HAS_SAV_UserArgs_MT32x64x32_MI16x16x1_SN_CLR1_GSU1_LBSPPA512_LBSPPB1024_MIWT2_1_PGR1_PLR1_SS1_SU32_SUM0_SUS256_SVW1_WG16_8_1_WGM8
    SolutionIndex: 22
    SolutionNameMin: Cijk_Ailk_Bjlk_BSS_BH_Bias_HAS_SAV_UserArgs_MT32x64x32_MI16x16x1_SN_CLR1_GSU1_LBSPPA512_LBSPPB1024_MIWT2_1_PGR2_PLR1_SS1_SU32_SUM0_SUS256_SVW1_WG16_8_1_WGM8
    SolutionIndex: 23
    SolutionNameMin: Cijk_Ailk_Bjlk_BSS_BH_Bias_HAS_SAV_UserArgs_MT32x64x32_MI16x16x1_SN_CLR0_GSU1_LBSPPA512_LBSPPB1024_MIWT2_1_PGR2_PLR0_SS1_SU32_SUM0_SUS256_SVW1_WG16_8_1_WGM8
    SolutionIndex: 24
    SolutionNameMin: Cijk_Ailk_Bjlk_BSS_BH_Bias_HAS_SAV_UserArgs_MT32x32x64_MI16x16x1_SN_CLR1_GSU1_LBSPPA512_LBSPPB512_MIWT1_1_PGR1_PLR1_SS1_SU32_SUM0_SUS256_SVW1_WG32_4_1_WGM8
    SolutionIndex: 25
    SolutionNameMin: Cijk_Ailk_Bjlk_BSS_BH_Bias_HAS_SAV_UserArgs_MT32x32x64_MI16x16x1_SN_CLR1_GSU1_LBSPPA512_LBSPPB512_MIWT1_1_PGR2_PLR3_SS1_SU32_SUM0_SUS256_SVW1_WG32_4_1_WGM8
    SolutionIndex: 26
    SolutionNameMin: Cijk_Ailk_Bjlk_BSS_BH_Bias_HAS_SAV_UserArgs_MT32x32x64_MI16x16x1_SN_CLR0_GSU1_LBSPPA512_LBSPPB512_MIWT1_1_PGR1_PLR0_SS1_SU32_SUM0_SUS256_SVW1_WG32_4_1_WGM8
    SolutionIndex: 27
    SolutionNameMin: Cijk_Ailk_Bjlk_BSS_BH_Bias_HAS_SAV_UserArgs_MT64x32x64_MI16x16x1_SN_CLR1_GSU1_LBSPPA1024_LBSPPB512_MIWT2_1_PGR1_PLR3_SS1_SU32_SUM0_SUS256_SVW1_WG32_4_1_WGM8
- - - [512, 512, 1, 64, 512, 512, 512, 512]
    - [23, 1107.15]
  - - [1024, 512, 1, 64, 1024, 1024, 1024, 512]
    - [23, 2144.81]
  - - [1536, 512, 1, 64, 1536, 1536, 1536, 512]
    - [19, 2757.22]
  - - [2048, 512, 1, 64, 2048, 2048, 2048, 512]
    - [21, 3506.94]
  - - [2560, 512, 1, 64, 2560, 2560, 2560, 512]
    - [4, 4248.04]
  - - [3072, 512, 1, 64, 3072, 3072, 3072, 512]
    - [17, 4666.71]
  - - [512, 1024, 1, 64, 512, 512, 512, 1024]
    - [17, 2138.66]
  - - [1024, 1024, 1, 64, 1024, 1024, 1024, 1024]
    - [22, 3695.52]
  - - [1536, 1024, 1, 64, 1536, 1536, 1536, 1024]
    - [6, 4697.2]
  - - [2048, 1024, 1, 64, 2048, 2048, 2048, 1024]
    - [21, 6059.08]
  - - [2560, 1024, 1, 64, 2560, 2560, 2560, 1024]
    - [0, 6749.49]
  - - [3072, 1024, 1, 64, 3072, 3072, 3072, 1024]
    - [18, 7537.5]
  - - [512, 1536, 1, 64, 512, 512, 512, 1536]
    - [6, 2919.98]
  - - [1024, 1536, 1, 64, 1024, 1024, 1024, 1536]
    - [2, 4645.07]
  - - [1536, 1536, 1, 64, 1536, 1536, 1536, 1536]
    - [0, 6232.89]
  - - [2048, 1536, 1, 64, 2048, 2048, 2048, 1536]
    - [1, 7482.73]
  - - [2560, 1536, 1, 64, 2560, 2560, 2560, 1536]
    - [22, 8931.02]
  - - [3072, 1536, 1, 64, 3072, 3072, 3072, 1536]
    - [18, 9987.43]
  - - [512, 2048, 1, 64, 512, 512, 512, 2048]
    - [4, 3700.72]
  - - [1024, 2048, 1, 64, 1024, 1024, 1024, 2048]
    - [3, 5739.72]
  - - [1536, 2048, 1, 64, 1536, 1536, 1536, 2048]
    - [4, 7464.56]
  - - [2048, 2048, 1, 64, 2048, 2048, 2048, 2048]
    - [21, 9350.22]
  - - [2560, 2048, 1, 64, 2560, 2560, 2560, 2048]
    - [0, 10558.5]
  - - [3072, 2048, 1, 64, 3072, 3072, 3072, 2048]
    - [0, 11173.2]
  - - [512, 2560, 1, 64, 512, 512, 512, 2560]
    - [3, 4334.97]
  - - [1024, 2560, 1, 64, 1024, 1024, 1024, 2560]
    - [1, 7115.17]
  - - [1536, 2560, 1, 64, 1536, 1536, 1536, 2560]
    - [3, 9279.09]
  - - [2048, 2560, 1, 64, 2048, 2048, 2048, 2560]
    - [0, 10660.8]
  - - [2560, 2560, 1, 64, 2560, 2560, 2560, 2560]
    - [3, 12080.2]
  - - [3072, 2560, 1, 64, 3072, 3072, 3072, 2560]
    - [17, 12523.1]
  - - [512, 3072, 1, 64, 512, 512, 512, 3072]
    - [3, 5042.62]
  - - [1024, 3072, 1, 64, 1024, 1024, 1024, 3072]
    - [1, 8092.88]
  - - [1536, 3072, 1, 64, 1536, 1536, 1536, 3072]
    - [3, 10354.7]
  - - [2048, 3072, 1, 64, 2048, 2048, 2048, 3072]
    - [1, 11642.4]
  - - [2560, 3072, 1, 64, 2560, 2560, 2560, 3072]
    - [0, 13265.8]
  - - [3072, 3072, 1, 64, 3072, 3072, 3072, 3072]
    - [0, 13356.5]
  - - [512, 512, 1, 256, 512, 512, 512, 512]
    - [14, 3979.89]
  - - [1024, 512, 1, 256, 1024, 1024, 1024, 512]
    - [17, 6728.55]
  - - [1536, 512, 1, 256, 1536, 1536, 1536, 512]
    - [5, 8670.77]
  - - [2048, 512, 1, 256, 2048, 2048, 2048, 512]
    - [17, 11302.8]
  - - [2560, 512, 1, 256, 2560, 2560, 2560, 512]
    - [17, 12209.6]
  - - [3072, 512, 1, 256, 3072, 3072, 3072, 512]
    - [17, 13653.7]
  - - [512, 1024, 1, 256, 512, 512, 512, 1024]
    - [17, 6829.72]
  - - [1024, 1024, 1, 256, 1024, 1024, 1024, 1024]
    - [21, 11319.5]
  - - [1536, 1024, 1, 256, 1536, 1536, 1536, 1024]
    - [0, 13575.4]
  - - [2048, 1024, 1, 256, 2048, 2048, 2048, 1024]
    - [21, 16041.3]
  - - [2560, 1024, 1, 256, 2560, 2560, 2560, 1024]
    - [21, 18529.1]
  - - [3072, 1024, 1, 256, 3072, 3072, 3072, 1024]
    - [21, 19920.5]
  - - [512, 1536, 1, 256, 512, 512, 512, 1536]
    - [3, 9209.4]
  - - [1024, 1536, 1, 256, 1024, 1024, 1024, 1536]
    - [21, 14168.7]
  - - [1536, 1536, 1, 256, 1536, 1536, 1536, 1536]
    - [3, 16860.3]
  - - [2048, 1536, 1, 256, 2048, 2048, 2048, 1536]
    - [21, 19607.2]
  - - [2560, 1536, 1, 256, 2560, 2560, 2560, 1536]
    - [21, 21574.9]
  - - [3072, 1536, 1, 256, 3072, 3072, 3072, 1536]
    - [17, 23128.6]
  - - [512, 2048, 1, 256, 512, 512, 512, 2048]
    - [3, 11283.8]
  - - [1024, 2048, 1, 256, 1024, 1024, 1024, 2048]
    - [0, 15893.9]
  - - [1536, 2048, 1, 256, 1536, 1536, 1536, 2048]
    - [21, 20223.7]
  - - [2048, 2048, 1, 256, 2048, 2048, 2048, 2048]
    - [21, 21481.7]
  - - [2560, 2048, 1, 256, 2560, 2560, 2560, 2048]
    - [3, 24341.7]
  - - [3072, 2048, 1, 256, 3072, 3072, 3072, 2048]
    - [17, 25543.6]
  - - [512, 2560, 1, 256, 512, 512, 512, 2560]
    - [0, 12669.2]
  - - [1024, 2560, 1, 256, 1024, 1024, 1024, 2560]
    - [21, 18608.8]
  - - [1536, 2560, 1, 256, 1536, 1536, 1536, 2560]
    - [21, 22024.1]
  - - [2048, 2560, 1, 256, 2048, 2048, 2048, 2560]
    - [17, 23856.5]
  - - [2560, 2560, 1, 256, 2560, 2560, 2560, 2560]
    - [3, 24878.4]
  - - [3072, 2560, 1, 256, 3072, 3072, 3072, 2560]
    - [17, 25877.1]
  - - [512, 3072, 1, 256, 512, 512, 512, 3072]
    - [21, 14317.8]
  - - [1024, 3072, 1, 256, 1024, 1024, 1024, 3072]
    - [17, 19583.1]
  - - [1536, 3072, 1, 256, 1536, 1536, 1536, 3072]
    - [0, 22629.2]
  - - [2048, 3072, 1, 256, 2048, 2048, 2048, 3072]
    - [17, 24991.7]
  - - [2560, 3072, 1, 256, 2560, 2560, 2560, 3072]
    - [3, 26589.2]
  - - [3072, 3072, 1, 256, 3072, 3072, 3072, 3072]
    - [21, 27127.6]
  - - [512, 512, 1, 512, 512, 512, 512, 512]
    - [11, 6914.34]
  - - [1024, 512, 1, 512, 1024, 1024, 1024, 512]
    - [17, 11837.1]
  - - [1536, 512, 1, 512, 1536, 1536, 1536, 512]
    - [17, 13928.1]
  - - [2048, 512, 1, 512, 2048, 2048, 2048, 512]
    - [17, 17269.1]
  - - [2560, 512, 1, 512, 2560, 2560, 2560, 512]
    - [0, 18376.4]
  - - [3072, 512, 1, 512, 3072, 3072, 3072, 512]
    - [17, 19891.0]
  - - [512, 1024, 1, 512, 512, 512, 512, 1024]
    - [21, 11797.8]
  - - [1024, 1024, 1, 512, 1024, 1024, 1024, 1024]
    - [17, 16631.4]
  - - [1536, 1024, 1, 512, 1536, 1536, 1536, 1024]
    - [21, 20610.0]
  - - [2048, 1024, 1, 512, 2048, 2048, 2048, 1024]
    - [21, 23102.4]
  - - [2560, 1024, 1, 512, 2560, 2560, 2560, 1024]
    - [21, 24229.7]
  - - [3072, 1024, 1, 512, 3072, 3072, 3072, 1024]
    - [3, 25586.4]
  - - [512, 1536, 1, 512, 512, 512, 512, 1536]
    - [3, 13969.4]
  - - [1024, 1536, 1, 512, 1024, 1024, 1024, 1536]
    - [21, 20447.3]
  - - [1536, 1536, 1, 512, 1536, 1536, 1536, 1536]
    - [21, 23260.2]
  - - [2048, 1536, 1, 512, 2048, 2048, 2048, 1536]
    - [21, 26306.2]
  - - [2560, 1536, 1, 512, 2560, 2560, 2560, 1536]
    - [3, 27304.6]
  - - [3072, 1536, 1, 512, 3072, 3072, 3072, 1536]
    - [17, 28390.8]
  - - [512, 2048, 1, 512, 512, 512, 512, 2048]
    - [21, 16490.7]
  - - [1024, 2048, 1, 512, 1024, 1024, 1024, 2048]
    - [17, 22924.6]
  - - [1536, 2048, 1, 512, 1536, 1536, 1536, 2048]
    - [17, 26368.9]
  - - [2048, 2048, 1, 512, 2048, 2048, 2048, 2048]
    - [21, 27693.0]
  - - [2560, 2048, 1, 512, 2560, 2560, 2560, 2048]
    - [3, 29078.7]
  - - [3072, 2048, 1, 512, 3072, 3072, 3072, 2048]
    - [17, 29738.5]
  - - [512, 2560, 1, 512, 512, 512, 512, 2560]
    - [0, 18794.3]
  - - [1024, 2560, 1, 512, 1024, 1024, 1024, 2560]
    - [0, 24120.6]
  - - [1536, 2560, 1, 512, 1536, 1536, 1536, 2560]
    - [21, 26897.2]
  - - [2048, 2560, 1, 512, 2048, 2048, 2048, 2560]
    - [21, 28552.0]
  - - [2560, 2560, 1, 512, 2560, 2560, 2560, 2560]
    - [3, 30475.8]
  - - [3072, 2560, 1, 512, 3072, 3072, 3072, 2560]
    - [17, 30916.4]
  - - [512, 3072, 1, 512, 512, 512, 512, 3072]
    - [0, 20557.2]
  - - [1024, 3072, 1, 512, 1024, 1024, 1024, 3072]
    - [0, 26440.5]
  - - [1536, 3072, 1, 512, 1536, 1536, 1536, 3072]
    - [21, 28858.0]
  - - [2048, 3072, 1, 512, 2048, 2048, 2048, 3072]
    - [17, 30034.3]
  - - [2560, 3072, 1, 512, 2560, 2560, 2560, 3072]
    - [21, 31344.3]
  - - [3072, 3072, 1, 512, 3072, 3072, 3072, 3072]
    - [21, 31607.0]
  - - [512, 512, 1, 1024, 512, 512, 512, 512]
    - [27, 11021.3]
  - - [1024, 512, 1, 1024, 1024, 1024, 1024, 512]
    - [0, 16891.0]
  - - [1536, 512, 1, 1024, 1536, 1536, 1536, 512]
    - [0, 19932.8]
  - - [2048, 512, 1, 1024, 2048, 2048, 2048, 512]
    - [17, 22737.4]
  - - [2560, 512, 1, 1024, 2560, 2560, 2560, 512]
    - [21, 24653.1]
  - - [3072, 512, 1, 1024, 3072, 3072, 3072, 512]
    - [21, 26080.1]
  - - [512, 1024, 1, 1024, 512, 512, 512, 1024]
    - [3, 17615.3]
  - - [1024, 1024, 1, 1024, 1024, 1024, 1024, 1024]
    - [3, 23145.0]
  - - [1536, 1024, 1, 1024, 1536, 1536, 1536, 1024]
    - [0, 26604.5]
  - - [2048, 1024, 1, 1024, 2048, 2048, 2048, 1024]
    - [17, 28118.2]
  - - [2560, 1024, 1, 1024, 2560, 2560, 2560, 1024]
    - [0, 30069.1]
  - - [3072, 1024, 1, 1024, 3072, 3072, 3072, 1024]
    - [17, 31418.2]
  - - [512, 1536, 1, 1024, 512, 512, 512, 1536]
    - [17, 20254.4]
  - - [1024, 1536, 1, 1024, 1024, 1024, 1024, 1536]
    - [3, 26302.2]
  - - [1536, 1536, 1, 1024, 1536, 1536, 1536, 1536]
    - [0, 28715.5]
  - - [2048, 1536, 1, 1024, 2048, 2048, 2048, 1536]
    - [3, 29935.1]
  - - [2560, 1536, 1, 1024, 2560, 2560, 2560, 1536]
    - [0, 31707.8]
  - - [3072, 1536, 1, 1024, 3072, 3072, 3072, 1536]
    - [17, 32597.2]
  - - [512, 2048, 1, 1024, 512, 512, 512, 2048]
    - [17, 22732.4]
  - - [1024, 2048, 1, 1024, 1024, 1024, 1024, 2048]
    - [0, 28290.6]
  - - [1536, 2048, 1, 1024, 1536, 1536, 1536, 2048]
    - [17, 31536.7]
  - - [2048, 2048, 1, 1024, 2048, 2048, 2048, 2048]
    - [17, 31268.4]
  - - [2560, 2048, 1, 1024, 2560, 2560, 2560, 2048]
    - [17, 33105.5]
  - - [3072, 2048, 1, 1024, 3072, 3072, 3072, 2048]
    - [3, 33317.0]
  - - [512, 2560, 1, 1024, 512, 512, 512, 2560]
    - [17, 24001.7]
  - - [1024, 2560, 1, 1024, 1024, 1024, 1024, 2560]
    - [21, 29192.7]
  - - [1536, 2560, 1, 1024, 1536, 1536, 1536, 2560]
    - [3, 31528.6]
  - - [2048, 2560, 1, 1024, 2048, 2048, 2048, 2560]
    - [17, 33819.0]
  - - [2560, 2560, 1, 1024, 2560, 2560, 2560, 2560]
    - [21, 33662.2]
  - - [3072, 2560, 1, 1024, 3072, 3072, 3072, 2560]
    - [17, 33705.5]
  - - [512, 3072, 1, 1024, 512, 512, 512, 3072]
    - [17, 26141.6]
  - - [1024, 3072, 1, 1024, 1024, 1024, 1024, 3072]
    - [21, 30297.5]
  - - [1536, 3072, 1, 1024, 1536, 1536, 1536, 3072]
    - [3, 32111.1]
  - - [2048, 3072, 1, 1024, 2048, 2048, 2048, 3072]
    - [21, 33781.7]
  - - [2560, 3072, 1, 1024, 2560, 2560, 2560, 3072]
    - [21, 34285.6]
  - - [3072, 3072, 1, 1024, 3072, 3072, 3072, 3072]
    - [21, 34528.4]
  - - [512, 512, 1, 2048, 512, 512, 512, 512]
    - [12, 15548.0]
  - - [1024, 512, 1, 2048, 1024, 1024, 1024, 512]
    - [0, 22710.8]
  - - [1536, 512, 1, 2048, 1536, 1536, 1536, 512]
    - [21, 24511.5]
  - - [2048, 512, 1, 2048, 2048, 2048, 2048, 512]
    - [21, 27329.5]
  - - [2560, 512, 1, 2048, 2560, 2560, 2560, 512]
    - [17, 28660.3]
  - - [3072, 512, 1, 2048, 3072, 3072, 3072, 512]
    - [21, 29914.1]
  - - [512, 1024, 1, 2048, 512, 512, 512, 1024]
    - [17, 23658.5]
  - - [1024, 1024, 1, 2048, 1024, 1024, 1024, 1024]
    - [17, 27759.6]
  - - [1536, 1024, 1, 2048, 1536, 1536, 1536, 1024]
    - [17, 30259.0]
  - - [2048, 1024, 1, 2048, 2048, 2048, 2048, 1024]
    - [3, 31301.5]
  - - [2560, 1024, 1, 2048, 2560, 2560, 2560, 1024]
    - [0, 32248.8]
  - - [3072, 1024, 1, 2048, 3072, 3072, 3072, 1024]
    - [21, 33374.1]
  - - [512, 1536, 1, 2048, 512, 512, 512, 1536]
    - [21, 25368.4]
  - - [1024, 1536, 1, 2048, 1024, 1024, 1024, 1536]
    - [21, 30060.9]
  - - [1536, 1536, 1, 2048, 1536, 1536, 1536, 1536]
    - [21, 31707.8]
  - - [2048, 1536, 1, 2048, 2048, 2048, 2048, 1536]
    - [21, 32849.8]
  - - [2560, 1536, 1, 2048, 2560, 2560, 2560, 1536]
    - [3, 33586.5]
  - - [3072, 1536, 1, 2048, 3072, 3072, 3072, 1536]
    - [3, 34497.5]
  - - [512, 2048, 1, 2048, 512, 512, 512, 2048]
    - [3, 27838.8]
  - - [1024, 2048, 1, 2048, 1024, 1024, 1024, 2048]
    - [17, 31842.1]
  - - [1536, 2048, 1, 2048, 1536, 1536, 1536, 2048]
    - [21, 33882.2]
  - - [2048, 2048, 1, 2048, 2048, 2048, 2048, 2048]
    - [3, 34089.3]
  - - [2560, 2048, 1, 2048, 2560, 2560, 2560, 2048]
    - [3, 34381.5]
  - - [3072, 2048, 1, 2048, 3072, 3072, 3072, 2048]
    - [17, 34723.9]
  - - [512, 2560, 1, 2048, 512, 512, 512, 2560]
    - [17, 28920.2]
  - - [1024, 2560, 1, 2048, 1024, 1024, 1024, 2560]
    - [17, 32926.5]
  - - [1536, 2560, 1, 2048, 1536, 1536, 1536, 2560]
    - [3, 33897.4]
  - - [2048, 2560, 1, 2048, 2048, 2048, 2048, 2560]
    - [21, 34338.6]
  - - [2560, 2560, 1, 2048, 2560, 2560, 2560, 2560]
    - [0, 35384.9]
  - - [3072, 2560, 1, 2048, 3072, 3072, 3072, 2560]
    - [21, 35376.6]
  - - [512, 3072, 1, 2048, 512, 512, 512, 3072]
    - [0, 30787.7]
  - - [1024, 3072, 1, 2048, 1024, 1024, 1024, 3072]
    - [3, 33875.1]
  - - [1536, 3072, 1, 2048, 1536, 1536, 1536, 3072]
    - [3, 34101.2]
  - - [2048, 3072, 1, 2048, 2048, 2048, 2048, 3072]
    - [3, 34671.5]
  - - [2560, 3072, 1, 2048, 2560, 2560, 2560, 3072]
    - [21, 35154.2]
  - - [3072, 3072, 1, 2048, 3072, 3072, 3072, 3072]
    - [3, 35610.7]
  - - [512, 512, 1, 3072, 512, 512, 512, 512]
    - [11, 18208.1]
  - - [1024, 512, 1, 3072, 1024, 1024, 1024, 512]
    - [21, 25694.8]
  - - [1536, 512, 1, 3072, 1536, 1536, 1536, 512]
    - [3, 25977.6]
  - - [2048, 512, 1, 3072, 2048, 2048, 2048, 512]
    - [17, 29774.2]
  - - [2560, 512, 1, 3072, 2560, 2560, 2560, 512]
    - [17, 30549.6]
  - - [3072, 512, 1, 3072, 3072, 3072, 3072, 512]
    - [21, 31561.6]
  - - [512, 1024, 1, 3072, 512, 512, 512, 1024]
    - [17, 26067.6]
  - - [1024, 1024, 1, 3072, 1024, 1024, 1024, 1024]
    - [17, 29741.2]
  - - [1536, 1024, 1, 3072, 1536, 1536, 1536, 1024]
    - [3, 31350.2]
  - - [2048, 1024, 1, 3072, 2048, 2048, 2048, 1024]
    - [21, 32254.2]
  - - [2560, 1024, 1, 3072, 2560, 2560, 2560, 1024]
    - [3, 33134.5]
  - - [3072, 1024, 1, 3072, 3072, 3072, 3072, 1024]
    - [3, 33645.0]
  - - [512, 1536, 1, 3072, 512, 512, 512, 1536]
    - [17, 27118.5]
  - - [1024, 1536, 1, 3072, 1024, 1024, 1024, 1536]
    - [21, 31338.9]
  - - [1536, 1536, 1, 3072, 1536, 1536, 1536, 1536]
    - [3, 32847.3]
  - - [2048, 1536, 1, 3072, 2048, 2048, 2048, 1536]
    - [3, 33680.2]
  - - [2560, 1536, 1, 3072, 2560, 2560, 2560, 1536]
    - [3, 34386.4]
  - - [3072, 1536, 1, 3072, 3072, 3072, 3072, 1536]
    - [21, 34544.9]
  - - [512, 2048, 1, 3072, 512, 512, 512, 2048]
    - [17, 30526.3]
  - - [1024, 2048, 1, 3072, 1024, 1024, 1024, 2048]
    - [21, 32662.8]
  - - [1536, 2048, 1, 3072, 1536, 1536, 1536, 2048]
    - [0, 34348.3]
  - - [2048, 2048, 1, 3072, 2048, 2048, 2048, 2048]
    - [21, 34498.9]
  - - [2560, 2048, 1, 3072, 2560, 2560, 2560, 2048]
    - [3, 34767.3]
  - - [3072, 2048, 1, 3072, 3072, 3072, 3072, 2048]
    - [3, 35319.6]
  - - [512, 2560, 1, 3072, 512, 512, 512, 2560]
    - [0, 31125.8]
  - - [1024, 2560, 1, 3072, 1024, 1024, 1024, 2560]
    - [17, 33391.2]
  - - [1536, 2560, 1, 3072, 1536, 1536, 1536, 2560]
    - [0, 34482.2]
  - - [2048, 2560, 1, 3072, 2048, 2048, 2048, 2560]
    - [21, 34704.2]
  - - [2560, 2560, 1, 3072, 2560, 2560, 2560, 2560]
    - [21, 35391.0]
  - - [3072, 2560, 1, 3072, 3072, 3072, 3072, 2560]
    - [3, 35701.1]
  - - [512, 3072, 1, 3072, 512, 512, 512, 3072]
    - [0, 31670.4]
  - - [1024, 3072, 1, 3072, 1024, 1024, 1024, 3072]
    - [17, 34030.1]
  - - [1536, 3072, 1, 3072, 1536, 1536, 1536, 3072]
    - [21, 34567.2]
  - - [2048, 3072, 1, 3072, 2048, 2048, 2048, 3072]
    - [21, 35212.9]
  - - [2560, 3072, 1, 3072, 2560, 2560, 2560, 3072]
    - [21, 35887.6]
  - - [3072, 3072, 1, 3072, 3072, 3072, 3072, 3072]
    - [21, 35890.7]
  - - [1, 1, 1, 1, 1, 1, 1, 1]
    - [13, 6.40636e-05]
  - - [1, 1, 1, 64, 1, 1, 1, 1]
    - [24, 0.00416694]
  - - [1, 64, 1, 1, 1, 1, 1, 64]
    - [15, 0.00411986]
  - - [64, 1, 1, 1, 64, 64, 64, 1]
    - [16, 0.00427722]
  - - [64, 64, 1, 1, 64, 64, 64, 64]
    - [20, 0.275955]
  - - [64, 1, 1, 64, 64, 64, 64, 1]
    - [25, 0.270301]
  - - [1, 64, 1, 64, 1, 1, 1, 64]
    - [9, 0.265819]
  - - [64, 64, 1, 64, 64, 64, 64, 64]
    - [10, 17.4084]
  - - [64, 64, 1, 256, 64, 64, 64, 64]
    - [8, 61.473]
  - - [64, 64, 1, 512, 64, 64, 64, 64]
    - [7, 120.298]
  - - [64, 64, 1, 1024, 64, 64, 64, 64]
    - [26, 200.454]
  - - [64, 64, 1, 2048, 64, 64, 64, 64]
    - [24, 320.616]
  - - [64, 64, 1, 4096, 64, 64, 64, 64]
    - [7, 448.044]
- null
- null
- DeviceEfficiency
- GridBased
