library/src/amd_detail/rocblaslt/src/Tensile/Logic/asm_full/gfx1200/GridBased/gfx1200_Cijk_Ailk_Bljk_BBS_BH_Bias_HAS_SAV_UserArgs.yaml
- {MinimumRequiredVersion: 4.33.0}
- gfx1200
- gfx1200
- [Device 73f0]
    SolutionIndex: 0
    SolutionNameMin: Cijk_Ailk_Bljk_BBS_BH_Bias_HAS_SAV_UserArgs_MT32x32x32_MI16x16x1_SN_LDSB0_CLR1_GSU1_LBSPPA512_LBSPPB128_MIWT1_1_NLCA1_PGR1_PLR1_SS0_SU32_SUM0_SUS256_SVW8_TLDS1_WG32_4_1_WGM8
    SolutionIndex: 1
    SolutionNameMin: Cijk_Ailk_Bljk_BBS_BH_Bias_HAS_SAV_UserArgs_MT64x32x32_MI16x16x1_SN_LDSB0_CLR1_GSU1_LBSPPA1024_LBSPPB128_MIWT2_1_NLCA1_PGR1_PLR1_SS0_SU32_SUM0_SUS256_SVW8_TLDS1_WG32_4_1_WGM8
    SolutionIndex: 2
    SolutionNameMin: Cijk_Ailk_Bljk_BBS_BH_Bias_HAS_SAV_UserArgs_MT64x32x32_MI16x16x1_SN_LDSB0_CLR1_GSU1_LBSPPA1024_LBSPPB128_MIWT2_1_NLCA1_PGR2_PLR1_SS0_SU32_SUM0_SUS256_SVW8_TLDS1_WG32_4_1_WGM8
    SolutionIndex: 3
    SolutionNameMin: Cijk_Ailk_Bljk_BBS_BH_Bias_HAS_SAV_UserArgs_MT64x32x32_MI16x16x1_SN_LDSB0_CLR0_GSU1_LBSPPA1024_LBSPPB128_MIWT2_1_NLCA1_PGR2_PLR0_SS0_SU32_SUM0_SUS256_SVW8_TLDS1_WG32_4_1_WGM8
    SolutionIndex: 4
    SolutionNameMin: Cijk_Ailk_Bljk_BBS_BH_Bias_HAS_SAV_UserArgs_MT16x64x32_MI16x16x1_SN_LDSB0_CLR0_GSU1_LBSPPA256_LBSPPB128_MIWT1_1_NLCA1_PGR1_PLR0_SS0_SU32_SUM0_SUS256_SVW8_TLDS1_WG16_8_1_WGM8
    SolutionIndex: 5
    SolutionNameMin: Cijk_Ailk_Bljk_BBS_BH_Bias_HAS_SAV_UserArgs_MT32x64x32_MI16x16x1_SN_LDSB0_CLR1_GSU1_LBSPPA512_LBSPPB128_MIWT2_1_NLCA1_PGR1_PLR1_SS0_SU32_SUM0_SUS256_SVW8_TLDS1_WG16_8_1_WGM8
    SolutionIndex: 6
    SolutionNameMin: Cijk_Ailk_Bljk_BBS_BH_Bias_HAS_SAV_UserArgs_MT32x64x32_MI16x16x1_SN_LDSB0_CLR1_GSU1_LBSPPA512_LBSPPB128_MIWT2_1_NLCA1_PGR2_PLR1_SS0_SU32_SUM0_SUS256_SVW8_TLDS1_WG16_8_1_WGM8
    SolutionIndex: 7
    SolutionNameMin: Cijk_Ailk_Bljk_BBS_BH_Bias_HAS_SAV_UserArgs_MT32x64x32_MI16x16x1_SN_LDSB0_CLR0_GSU1_LBSPPA512_LBSPPB128_MIWT2_1_NLCA1_PGR1_PLR0_SS0_SU32_SUM0_SUS256_SVW8_TLDS1_WG16_8_1_WGM8
    SolutionIndex: 8
    SolutionNameMin: Cijk_Ailk_Bljk_BBS_BH_Bias_HAS_SAV_UserArgs_MT32x64x32_MI16x16x1_SN_LDSB0_CLR0_GSU1_LBSPPA512_LBSPPB128_MIWT2_1_NLCA1_PGR2_PLR0_SS0_SU32_SUM0_SUS256_SVW8_TLDS1_WG16_8_1_WGM8
    SolutionIndex: 9
    SolutionNameMin: Cijk_Ailk_Bljk_BBS_BH_Bias_HAS_SAV_UserArgs_MT32x32x64_MI16x16x1_SN_LDSB0_CLR1_GSU1_LBSPPA512_LBSPPB128_MIWT1_1_NLCA1_PGR2_PLR1_SS0_SU32_SUM0_SUS256_SVW8_TLDS1_WG32_4_1_WGM8
    SolutionIndex: 10
    SolutionNameMin: Cijk_Ailk_Bljk_BBS_BH_Bias_HAS_SAV_UserArgs_MT32x32x64_MI16x16x1_SN_LDSB0_CLR1_GSU1_LBSPPA512_LBSPPB128_MIWT1_1_NLCA1_PGR1_PLR3_SS0_SU32_SUM0_SUS256_SVW8_TLDS1_WG32_4_1_WGM8
    SolutionIndex: 11
    SolutionNameMin: Cijk_Ailk_Bljk_BBS_BH_Bias_HAS_SAV_UserArgs_MT64x16x32_MI16x16x1_SN_LDSB0_CLR1_GSU1_LBSPPA1024_LBSPPB128_MIWT1_1_NLCA1_PGR1_PLR1_SS1_SU32_SUM0_SUS256_SVW1_TLDS1_WG64_2_1_WGM8
    SolutionIndex: 12
    SolutionNameMin: Cijk_Ailk_Bljk_BBS_BH_Bias_HAS_SAV_UserArgs_MT64x16x32_MI16x16x1_SN_LDSB0_CLR1_GSU1_LBSPPA1024_LBSPPB256_MIWT1_1_NLCA1_PGR2_PLR1_SS1_SU32_SUM0_SUS256_SVW1_TLDS0_WG64_2_1_WGM8
    SolutionIndex: 13
    SolutionNameMin: Cijk_Ailk_Bljk_BBS_BH_Bias_HAS_SAV_UserArgs_MT64x16x32_MI16x16x1_SN_LDSB0_CLR0_GSU1_LBSPPA1024_LBSPPB128_MIWT1_1_NLCA1_PGR2_PLR0_SS1_SU32_SUM0_SUS256_SVW1_TLDS1_WG64_2_1_WGM8
    SolutionIndex: 14
    SolutionNameMin: Cijk_Ailk_Bljk_BBS_BH_Bias_HAS_SAV_UserArgs_MT32x32x32_MI16x16x1_SN_LDSB0_CLR1_GSU1_LBSPPA512_LBSPPB128_MIWT1_1_NLCA1_PGR1_PLR1_SS1_SU32_SUM0_SUS256_SVW1_TLDS1_WG32_4_1_WGM8
    SolutionIndex: 15
    SolutionNameMin: Cijk_Ailk_Bljk_BBS_BH_Bias_HAS_SAV_UserArgs_MT64x32x32_MI16x16x1_SN_LDSB0_CLR1_GSU1_LBSPPA1024_LBSPPB128_MIWT2_1_NLCA1_PGR1_PLR1_SS1_SU32_SUM0_SUS256_SVW1_TLDS1_WG32_4_1_WGM8
    SolutionIndex: 16
    SolutionNameMin: Cijk_Ailk_Bljk_BBS_BH_Bias_HAS_SAV_UserArgs_MT64x32x32_MI16x16x1_SN_LDSB0_CLR0_GSU1_LBSPPA1024_LBSPPB128_MIWT2_1_NLCA1_PGR1_PLR0_SS1_SU32_SUM0_SUS256_SVW1_TLDS1_WG32_4_1_WGM8
    SolutionIndex: 17
    SolutionNameMin: Cijk_Ailk_Bljk_BBS_BH_Bias_HAS_SAV_UserArgs_MT32x64x32_MI16x16x1_SN_LDSB0_CLR1_GSU1_LBSPPA512_LBSPPB128_MIWT2_1_NLCA1_PGR1_PLR1_SS1_SU32_SUM0_SUS256_SVW1_TLDS1_WG16_8_1_WGM8
    SolutionIndex: 18
    SolutionNameMin: Cijk_Ailk_Bljk_BBS_BH_Bias_HAS_SAV_UserArgs_MT32x64x32_MI16x16x1_SN_LDSB0_CLR0_GSU1_LBSPPA512_LBSPPB128_MIWT2_1_NLCA1_PGR1_PLR0_SS1_SU32_SUM0_SUS256_SVW1_TLDS1_WG16_8_1_WGM8
    SolutionIndex: 19
    SolutionNameMin: Cijk_Ailk_Bljk_BBS_BH_Bias_HAS_SAV_UserArgs_MT32x32x64_MI16x16x1_SN_LDSB0_CLR1_GSU1_LBSPPA512_LBSPPB128_MIWT1_1_NLCA1_PGR1_PLR3_SS1_SU32_SUM0_SUS256_SVW1_TLDS1_WG32_4_1_WGM8
    SolutionIndex: 20
    SolutionNameMin: Cijk_Ailk_Bljk_BBS_BH_Bias_HAS_SAV_UserArgs_MT32x32x64_MI16x16x1_SN_LDSB0_CLR0_GSU1_LBSPPA512_LBSPPB128_MIWT1_1_NLCA1_PGR1_PLR0_SS1_SU32_SUM0_SUS256_SVW1_TLDS1_WG32_4_1_WGM8
    SolutionIndex: 21
    SolutionNameMin: Cijk_Ailk_Bljk_BBS_BH_Bias_HAS_SAV_UserArgs_MT32x32x64_MI16x16x1_SN_LDSB0_CLR0_GSU1_LBSPPA512_LBSPPB128_MIWT1_1_NLCA1_PGR2_PLR0_SS1_SU32_SUM0_SUS256_SVW1_TLDS1_WG32_4_1_WGM8
- - - [512, 512, 1, 64, 512, 512, 512, 64]
    - [3, 1101.7]
  - - [1024, 512, 1, 64, 1024, 1024, 1024, 64]
    - [8, 2106.37]
  - - [1536, 512, 1, 64, 1536, 1536, 1536, 64]
    - [8, 2903.89]
  - - [2048, 512, 1, 64, 2048, 2048, 2048, 64]
    - [5, 3727.44]
  - - [2560, 512, 1, 64, 2560, 2560, 2560, 64]
    - [3, 4337.22]
  - - [3072, 512, 1, 64, 3072, 3072, 3072, 64]
    - [5, 4827.05]
  - - [512, 1024, 1, 64, 512, 512, 512, 64]
    - [16, 2077.67]
  - - [1024, 1024, 1, 64, 1024, 1024, 1024, 64]
    - [5, 3673.37]
  - - [1536, 1024, 1, 64, 1536, 1536, 1536, 64]
    - [3, 4813.2]
  - - [2048, 1024, 1, 64, 2048, 2048, 2048, 64]
    - [1, 5995.34]
  - - [2560, 1024, 1, 64, 2560, 2560, 2560, 64]
    - [1, 6744.2]
  - - [3072, 1024, 1, 64, 3072, 3072, 3072, 64]
    - [1, 7650.79]
  - - [512, 1536, 1, 64, 512, 512, 512, 64]
    - [3, 2887.23]
  - - [1024, 1536, 1, 64, 1024, 1024, 1024, 64]
    - [1, 4973.97]
  - - [1536, 1536, 1, 64, 1536, 1536, 1536, 64]
    - [8, 6411.81]
  - - [2048, 1536, 1, 64, 2048, 2048, 2048, 64]
    - [2, 7426.01]
  - - [2560, 1536, 1, 64, 2560, 2560, 2560, 64]
    - [6, 8739.95]
  - - [3072, 1536, 1, 64, 3072, 3072, 3072, 64]
    - [2, 9630.09]
  - - [512, 2048, 1, 64, 512, 512, 512, 64]
    - [1, 3685.38]
  - - [1024, 2048, 1, 64, 1024, 1024, 1024, 64]
    - [5, 6048.16]
  - - [1536, 2048, 1, 64, 1536, 1536, 1536, 64]
    - [2, 7677.19]
  - - [2048, 2048, 1, 64, 2048, 2048, 2048, 64]
    - [5, 8944.42]
  - - [2560, 2048, 1, 64, 2560, 2560, 2560, 64]
    - [1, 9896.89]
  - - [3072, 2048, 1, 64, 3072, 3072, 3072, 64]
    - [7, 11126.7]
  - - [512, 2560, 1, 64, 512, 512, 512, 64]
    - [6, 4332.62]
  - - [1024, 2560, 1, 64, 1024, 1024, 1024, 64]
    - [1, 6750.99]
  - - [1536, 2560, 1, 64, 1536, 1536, 1536, 64]
    - [2, 8753.63]
  - - [2048, 2560, 1, 64, 2048, 2048, 2048, 64]
    - [1, 10039.3]
  - - [2560, 2560, 1, 64, 2560, 2560, 2560, 64]
    - [5, 11256.9]
  - - [3072, 2560, 1, 64, 3072, 3072, 3072, 64]
    - [5, 12082.0]
  - - [512, 3072, 1, 64, 512, 512, 512, 64]
    - [1, 4839.81]
  - - [1024, 3072, 1, 64, 1024, 1024, 1024, 64]
    - [1, 7631.93]
  - - [1536, 3072, 1, 64, 1536, 1536, 1536, 64]
    - [6, 9643.93]
  - - [2048, 3072, 1, 64, 2048, 2048, 2048, 64]
    - [1, 11048.8]
  - - [2560, 3072, 1, 64, 2560, 2560, 2560, 64]
    - [1, 12171.4]
  - - [3072, 3072, 1, 64, 3072, 3072, 3072, 64]
    - [5, 12863.4]
  - - [512, 512, 1, 256, 512, 512, 512, 256]
    - [15, 3911.46]
  - - [1024, 512, 1, 256, 1024, 1024, 1024, 256]
    - [17, 7143.04]
  - - [1536, 512, 1, 256, 1536, 1536, 1536, 256]
    - [5, 9159.12]
  - - [2048, 512, 1, 256, 2048, 2048, 2048, 256]
    - [1, 11067.0]
  - - [2560, 512, 1, 256, 2560, 2560, 2560, 256]
    - [5, 12367.6]
  - - [3072, 512, 1, 256, 3072, 3072, 3072, 256]
    - [1, 14015.6]
  - - [512, 1024, 1, 256, 512, 512, 512, 256]
    - [1, 7078.81]
  - - [1024, 1024, 1, 256, 1024, 1024, 1024, 256]
    - [5, 11215.2]
  - - [1536, 1024, 1, 256, 1536, 1536, 1536, 256]
    - [5, 14266.6]
  - - [2048, 1024, 1, 256, 2048, 2048, 2048, 256]
    - [1, 16493.2]
  - - [2560, 1024, 1, 256, 2560, 2560, 2560, 256]
    - [5, 18306.5]
  - - [3072, 1024, 1, 256, 3072, 3072, 3072, 256]
    - [5, 19851.5]
  - - [512, 1536, 1, 256, 512, 512, 512, 256]
    - [1, 8958.8]
  - - [1024, 1536, 1, 256, 1024, 1024, 1024, 256]
    - [5, 14196.4]
  - - [1536, 1536, 1, 256, 1536, 1536, 1536, 256]
    - [1, 17172.7]
  - - [2048, 1536, 1, 256, 2048, 2048, 2048, 256]
    - [15, 19389.6]
  - - [2560, 1536, 1, 256, 2560, 2560, 2560, 256]
    - [1, 21293.6]
  - - [3072, 1536, 1, 256, 3072, 3072, 3072, 256]
    - [5, 23224.2]
  - - [512, 2048, 1, 256, 512, 512, 512, 256]
    - [1, 11312.3]
  - - [1024, 2048, 1, 256, 1024, 1024, 1024, 256]
    - [5, 16285.1]
  - - [1536, 2048, 1, 256, 1536, 1536, 1536, 256]
    - [1, 19564.1]
  - - [2048, 2048, 1, 256, 2048, 2048, 2048, 256]
    - [1, 21616.2]
  - - [2560, 2048, 1, 256, 2560, 2560, 2560, 256]
    - [1, 23597.9]
  - - [3072, 2048, 1, 256, 3072, 3072, 3072, 256]
    - [15, 25110.7]
  - - [512, 2560, 1, 256, 512, 512, 512, 256]
    - [5, 12674.2]
  - - [1024, 2560, 1, 256, 1024, 1024, 1024, 256]
    - [1, 17774.4]
  - - [1536, 2560, 1, 256, 1536, 1536, 1536, 256]
    - [5, 21450.6]
  - - [2048, 2560, 1, 256, 2048, 2048, 2048, 256]
    - [1, 23539.9]
  - - [2560, 2560, 1, 256, 2560, 2560, 2560, 256]
    - [1, 24869.1]
  - - [3072, 2560, 1, 256, 3072, 3072, 3072, 256]
    - [5, 26463.2]
  - - [512, 3072, 1, 256, 512, 512, 512, 256]
    - [5, 14317.6]
  - - [1024, 3072, 1, 256, 1024, 1024, 1024, 256]
    - [5, 19863.8]
  - - [1536, 3072, 1, 256, 1536, 1536, 1536, 256]
    - [5, 22961.3]
  - - [2048, 3072, 1, 256, 2048, 2048, 2048, 256]
    - [1, 25142.1]
  - - [2560, 3072, 1, 256, 2560, 2560, 2560, 256]
    - [1, 26262.6]
  - - [3072, 3072, 1, 256, 3072, 3072, 3072, 256]
    - [5, 27572.8]
  - - [512, 512, 1, 512, 512, 512, 512, 512]
    - [14, 6827.99]
  - - [1024, 512, 1, 512, 1024, 1024, 1024, 512]
    - [1, 11894.8]
  - - [1536, 512, 1, 512, 1536, 1536, 1536, 512]
    - [5, 14399.8]
  - - [2048, 512, 1, 512, 2048, 2048, 2048, 512]
    - [15, 17046.8]
  - - [2560, 512, 1, 512, 2560, 2560, 2560, 512]
    - [5, 18802.2]
  - - [3072, 512, 1, 512, 3072, 3072, 3072, 512]
    - [15, 20705.7]
  - - [512, 1024, 1, 512, 512, 512, 512, 512]
    - [17, 11571.2]
  - - [1024, 1024, 1, 512, 1024, 1024, 1024, 512]
    - [15, 17327.9]
  - - [1536, 1024, 1, 512, 1536, 1536, 1536, 512]
    - [1, 20791.5]
  - - [2048, 1024, 1, 512, 2048, 2048, 2048, 512]
    - [1, 22927.0]
  - - [2560, 1024, 1, 512, 2560, 2560, 2560, 512]
    - [1, 24355.2]
  - - [3072, 1024, 1, 512, 3072, 3072, 3072, 512]
    - [1, 26203.5]
  - - [512, 1536, 1, 512, 512, 512, 512, 512]
    - [15, 14454.0]
  - - [1024, 1536, 1, 512, 1024, 1024, 1024, 512]
    - [15, 20502.2]
  - - [1536, 1536, 1, 512, 1536, 1536, 1536, 512]
    - [1, 23792.5]
  - - [2048, 1536, 1, 512, 2048, 2048, 2048, 512]
    - [5, 26067.6]
  - - [2560, 1536, 1, 512, 2560, 2560, 2560, 512]
    - [17, 27397.7]
  - - [3072, 1536, 1, 512, 3072, 3072, 3072, 512]
    - [5, 28681.4]
  - - [512, 2048, 1, 512, 512, 512, 512, 512]
    - [1, 17457.5]
  - - [1024, 2048, 1, 512, 1024, 1024, 1024, 512]
    - [5, 23127.5]
  - - [1536, 2048, 1, 512, 1536, 1536, 1536, 512]
    - [15, 26073.9]
  - - [2048, 2048, 1, 512, 2048, 2048, 2048, 512]
    - [1, 27969.5]
  - - [2560, 2048, 1, 512, 2560, 2560, 2560, 512]
    - [1, 29028.2]
  - - [3072, 2048, 1, 512, 3072, 3072, 3072, 512]
    - [17, 30402.1]
  - - [512, 2560, 1, 512, 512, 512, 512, 512]
    - [5, 18361.6]
  - - [1024, 2560, 1, 512, 1024, 1024, 1024, 512]
    - [1, 24632.8]
  - - [1536, 2560, 1, 512, 1536, 1536, 1536, 512]
    - [1, 27621.9]
  - - [2048, 2560, 1, 512, 2048, 2048, 2048, 512]
    - [1, 29075.5]
  - - [2560, 2560, 1, 512, 2560, 2560, 2560, 512]
    - [15, 30606.7]
  - - [3072, 2560, 1, 512, 3072, 3072, 3072, 512]
    - [17, 31032.0]
  - - [512, 3072, 1, 512, 512, 512, 512, 512]
    - [15, 20724.3]
  - - [1024, 3072, 1, 512, 1024, 1024, 1024, 512]
    - [1, 26029.7]
  - - [1536, 3072, 1, 512, 1536, 1536, 1536, 512]
    - [15, 28763.5]
  - - [2048, 3072, 1, 512, 2048, 2048, 2048, 512]
    - [15, 30370.6]
  - - [2560, 3072, 1, 512, 2560, 2560, 2560, 512]
    - [15, 31604.3]
  - - [3072, 3072, 1, 512, 3072, 3072, 3072, 512]
    - [1, 32644.6]
  - - [512, 512, 1, 1024, 512, 512, 512, 1024]
    - [14, 10882.8]
  - - [1024, 512, 1, 1024, 1024, 1024, 1024, 1024]
    - [15, 17970.0]
  - - [1536, 512, 1, 1024, 1536, 1536, 1536, 1024]
    - [18, 19450.4]
  - - [2048, 512, 1, 1024, 2048, 2048, 2048, 1024]
    - [15, 23313.6]
  - - [2560, 512, 1, 1024, 2560, 2560, 2560, 1024]
    - [1, 24947.1]
  - - [3072, 512, 1, 1024, 3072, 3072, 3072, 1024]
    - [15, 26615.8]
  - - [512, 1024, 1, 1024, 512, 512, 512, 1024]
    - [17, 17859.1]
  - - [1024, 1024, 1, 1024, 1024, 1024, 1024, 1024]
    - [1, 23466.7]
  - - [1536, 1024, 1, 1024, 1536, 1536, 1536, 1024]
    - [1, 26755.3]
  - - [2048, 1024, 1, 1024, 2048, 2048, 2048, 1024]
    - [1, 28471.0]
  - - [2560, 1024, 1, 1024, 2560, 2560, 2560, 1024]
    - [15, 29633.5]
  - - [3072, 1024, 1, 1024, 3072, 3072, 3072, 1024]
    - [15, 31082.6]
  - - [512, 1536, 1, 1024, 512, 512, 512, 1024]
    - [17, 20057.2]
  - - [1024, 1536, 1, 1024, 1024, 1024, 1024, 1024]
    - [1, 26986.6]
  - - [1536, 1536, 1, 1024, 1536, 1536, 1536, 1024]
    - [15, 29005.6]
  - - [2048, 1536, 1, 1024, 2048, 2048, 2048, 1024]
    - [15, 30842.5]
  - - [2560, 1536, 1, 1024, 2560, 2560, 2560, 1024]
    - [1, 31666.6]
  - - [3072, 1536, 1, 1024, 3072, 3072, 3072, 1024]
    - [15, 33231.8]
  - - [512, 2048, 1, 1024, 512, 512, 512, 1024]
    - [5, 23207.8]
  - - [1024, 2048, 1, 1024, 1024, 1024, 1024, 1024]
    - [5, 28998.9]
  - - [1536, 2048, 1, 1024, 1536, 1536, 1536, 1024]
    - [1, 30553.8]
  - - [2048, 2048, 1, 1024, 2048, 2048, 2048, 1024]
    - [15, 32301.5]
  - - [2560, 2048, 1, 1024, 2560, 2560, 2560, 1024]
    - [1, 33330.9]
  - - [3072, 2048, 1, 1024, 3072, 3072, 3072, 1024]
    - [15, 34131.4]
  - - [512, 2560, 1, 1024, 512, 512, 512, 1024]
    - [1, 24635.0]
  - - [1024, 2560, 1, 1024, 1024, 1024, 1024, 1024]
    - [17, 30204.7]
  - - [1536, 2560, 1, 1024, 1536, 1536, 1536, 1024]
    - [17, 32243.2]
  - - [2048, 2560, 1, 1024, 2048, 2048, 2048, 1024]
    - [1, 33745.6]
  - - [2560, 2560, 1, 1024, 2560, 2560, 2560, 1024]
    - [1, 34423.5]
  - - [3072, 2560, 1, 1024, 3072, 3072, 3072, 1024]
    - [1, 34533.2]
  - - [512, 3072, 1, 1024, 512, 512, 512, 1024]
    - [15, 26556.3]
  - - [1024, 3072, 1, 1024, 1024, 1024, 1024, 1024]
    - [1, 31445.8]
  - - [1536, 3072, 1, 1024, 1536, 1536, 1536, 1024]
    - [15, 32999.7]
  - - [2048, 3072, 1, 1024, 2048, 2048, 2048, 1024]
    - [1, 33497.5]
  - - [2560, 3072, 1, 1024, 2560, 2560, 2560, 1024]
    - [15, 34936.9]
  - - [3072, 3072, 1, 1024, 3072, 3072, 3072, 1024]
    - [7, 34633.9]
  - - [512, 512, 1, 2048, 512, 512, 512, 2048]
    - [0, 15798.0]
  - - [1024, 512, 1, 2048, 1024, 1024, 1024, 2048]
    - [1, 23815.9]
  - - [1536, 512, 1, 2048, 1536, 1536, 1536, 2048]
    - [5, 24564.0]
  - - [2048, 512, 1, 2048, 2048, 2048, 2048, 2048]
    - [5, 28431.4]
  - - [2560, 512, 1, 2048, 2560, 2560, 2560, 2048]
    - [17, 28784.9]
  - - [3072, 512, 1, 2048, 3072, 3072, 3072, 2048]
    - [5, 30195.1]
  - - [512, 1024, 1, 2048, 512, 512, 512, 2048]
    - [15, 23960.0]
  - - [1024, 1024, 1, 2048, 1024, 1024, 1024, 2048]
    - [1, 28726.8]
  - - [1536, 1024, 1, 2048, 1536, 1536, 1536, 2048]
    - [5, 30751.1]
  - - [2048, 1024, 1, 2048, 2048, 2048, 2048, 2048]
    - [17, 32168.2]
  - - [2560, 1024, 1, 2048, 2560, 2560, 2560, 2048]
    - [5, 32857.8]
  - - [3072, 1024, 1, 2048, 3072, 3072, 3072, 2048]
    - [17, 33733.7]
  - - [512, 1536, 1, 2048, 512, 512, 512, 2048]
    - [17, 24883.4]
  - - [1024, 1536, 1, 2048, 1024, 1024, 1024, 2048]
    - [5, 31013.4]
  - - [1536, 1536, 1, 2048, 1536, 1536, 1536, 2048]
    - [15, 32430.5]
  - - [2048, 1536, 1, 2048, 2048, 2048, 2048, 2048]
    - [15, 33931.4]
  - - [2560, 1536, 1, 2048, 2560, 2560, 2560, 2048]
    - [5, 34292.9]
  - - [3072, 1536, 1, 2048, 3072, 3072, 3072, 2048]
    - [17, 34380.6]
  - - [512, 2048, 1, 2048, 512, 512, 512, 2048]
    - [15, 28719.1]
  - - [1024, 2048, 1, 2048, 1024, 1024, 1024, 2048]
    - [15, 32320.9]
  - - [1536, 2048, 1, 2048, 1536, 1536, 1536, 2048]
    - [15, 33235.1]
  - - [2048, 2048, 1, 2048, 2048, 2048, 2048, 2048]
    - [5, 35024.3]
  - - [2560, 2048, 1, 2048, 2560, 2560, 2560, 2048]
    - [5, 34768.4]
  - - [3072, 2048, 1, 2048, 3072, 3072, 3072, 2048]
    - [5, 35335.9]
  - - [512, 2560, 1, 2048, 512, 512, 512, 2048]
    - [15, 28831.5]
  - - [1024, 2560, 1, 2048, 1024, 1024, 1024, 2048]
    - [5, 33386.0]
  - - [1536, 2560, 1, 2048, 1536, 1536, 1536, 2048]
    - [5, 34061.1]
  - - [2048, 2560, 1, 2048, 2048, 2048, 2048, 2048]
    - [1, 35667.0]
  - - [2560, 2560, 1, 2048, 2560, 2560, 2560, 2048]
    - [1, 36016.0]
  - - [3072, 2560, 1, 2048, 3072, 3072, 3072, 2048]
    - [15, 35684.8]
  - - [512, 3072, 1, 2048, 512, 512, 512, 2048]
    - [5, 31027.0]
  - - [1024, 3072, 1, 2048, 1024, 1024, 1024, 2048]
    - [15, 34184.8]
  - - [1536, 3072, 1, 2048, 1536, 1536, 1536, 2048]
    - [17, 35126.3]
  - - [2048, 3072, 1, 2048, 2048, 2048, 2048, 2048]
    - [15, 34831.1]
  - - [2560, 3072, 1, 2048, 2560, 2560, 2560, 2048]
    - [15, 35781.3]
  - - [3072, 3072, 1, 2048, 3072, 3072, 3072, 2048]
    - [17, 36552.0]
  - - [512, 512, 1, 3072, 512, 512, 512, 3072]
    - [14, 18205.8]
  - - [1024, 512, 1, 3072, 1024, 1024, 1024, 3072]
    - [5, 26525.7]
  - - [1536, 512, 1, 3072, 1536, 1536, 1536, 3072]
    - [17, 26935.1]
  - - [2048, 512, 1, 3072, 2048, 2048, 2048, 3072]
    - [17, 30611.9]
  - - [2560, 512, 1, 3072, 2560, 2560, 2560, 3072]
    - [17, 30135.1]
  - - [3072, 512, 1, 3072, 3072, 3072, 3072, 3072]
    - [15, 32224.8]
  - - [512, 1024, 1, 3072, 512, 512, 512, 3072]
    - [1, 26551.9]
  - - [1024, 1024, 1, 3072, 1024, 1024, 1024, 3072]
    - [15, 30413.5]
  - - [1536, 1024, 1, 3072, 1536, 1536, 1536, 3072]
    - [1, 32268.8]
  - - [2048, 1024, 1, 3072, 2048, 2048, 2048, 3072]
    - [15, 33544.6]
  - - [2560, 1024, 1, 3072, 2560, 2560, 2560, 3072]
    - [17, 34201.0]
  - - [3072, 1024, 1, 3072, 3072, 3072, 3072, 3072]
    - [17, 35134.6]
  - - [512, 1536, 1, 3072, 512, 512, 512, 3072]
    - [5, 27358.5]
  - - [1024, 1536, 1, 3072, 1024, 1024, 1024, 3072]
    - [17, 31865.9]
  - - [1536, 1536, 1, 3072, 1536, 1536, 1536, 3072]
    - [5, 33450.4]
  - - [2048, 1536, 1, 3072, 2048, 2048, 2048, 3072]
    - [5, 35226.4]
  - - [2560, 1536, 1, 3072, 2560, 2560, 2560, 3072]
    - [17, 35856.4]
  - - [3072, 1536, 1, 3072, 3072, 3072, 3072, 3072]
    - [5, 35774.9]
  - - [512, 2048, 1, 3072, 512, 512, 512, 3072]
    - [1, 31117.1]
  - - [1024, 2048, 1, 3072, 1024, 1024, 1024, 3072]
    - [1, 33310.1]
  - - [1536, 2048, 1, 3072, 1536, 1536, 1536, 3072]
    - [1, 34719.2]
  - - [2048, 2048, 1, 3072, 2048, 2048, 2048, 3072]
    - [1, 35535.6]
  - - [2560, 2048, 1, 3072, 2560, 2560, 2560, 3072]
    - [5, 35288.1]
  - - [3072, 2048, 1, 3072, 3072, 3072, 3072, 3072]
    - [17, 35724.7]
  - - [512, 2560, 1, 3072, 512, 512, 512, 3072]
    - [15, 30806.0]
  - - [1024, 2560, 1, 3072, 1024, 1024, 1024, 3072]
    - [1, 34444.4]
  - - [1536, 2560, 1, 3072, 1536, 1536, 1536, 3072]
    - [5, 35929.0]
  - - [2048, 2560, 1, 3072, 2048, 2048, 2048, 3072]
    - [1, 35356.8]
  - - [2560, 2560, 1, 3072, 2560, 2560, 2560, 3072]
    - [15, 36366.1]
  - - [3072, 2560, 1, 3072, 3072, 3072, 3072, 3072]
    - [1, 37008.7]
  - - [512, 3072, 1, 3072, 512, 512, 512, 3072]
    - [15, 32797.8]
  - - [1024, 3072, 1, 3072, 1024, 1024, 1024, 3072]
    - [1, 34702.3]
  - - [1536, 3072, 1, 3072, 1536, 1536, 1536, 3072]
    - [5, 35459.7]
  - - [2048, 3072, 1, 3072, 2048, 2048, 2048, 3072]
    - [15, 35757.9]
  - - [2560, 3072, 1, 3072, 2560, 2560, 2560, 3072]
    - [17, 35944.9]
  - - [3072, 3072, 1, 3072, 3072, 3072, 3072, 3072]
    - [15, 36767.7]
  - - [1, 1, 1, 1, 1, 1, 1, 1]
    - [11, 6.60349e-05]
  - - [1, 1, 1, 64, 1, 1, 1, 64]
    - [19, 0.00421371]
  - - [1, 64, 1, 1, 1, 1, 1, 1]
    - [12, 0.00424305]
  - - [64, 1, 1, 1, 64, 64, 64, 1]
    - [21, 0.00408828]
  - - [64, 64, 1, 1, 64, 64, 64, 1]
    - [13, 0.274936]
  - - [64, 1, 1, 64, 64, 64, 64, 64]
    - [4, 0.259077]
  - - [1, 64, 1, 64, 1, 1, 1, 64]
    - [19, 0.267293]
  - - [64, 64, 1, 64, 64, 64, 64, 64]
    - [9, 17.7154]
  - - [64, 64, 1, 256, 64, 64, 64, 256]
    - [10, 65.7003]
  - - [64, 64, 1, 512, 64, 64, 64, 512]
    - [20, 120.129]
  - - [64, 64, 1, 1024, 64, 64, 64, 1024]
    - [19, 205.568]
  - - [64, 64, 1, 2048, 64, 64, 64, 2048]
    - [19, 322.032]
  - - [64, 64, 1, 4096, 64, 64, 64, 4096]
    - [10, 450.698]
- null
- null
- DeviceEfficiency
- GridBased
