library/src/amd_detail/rocblaslt/src/Tensile/Logic/asm_full/gfx1200/GridBased/gfx1200_Cijk_Ailk_Bjlk_BBS_BH_Bias_HAS_SAV_UserArgs.yaml
- {MinimumRequiredVersion: 4.33.0}
- gfx1200
- gfx1200
- [Device 73f0]
    SolutionIndex: 0
    SolutionNameMin: Cijk_Ailk_Bjlk_BBS_BH_Bias_HAS_SAV_UserArgs_MT64x32x32_MI16x16x1_SN_CLR1_GSU1_LBSPPA1024_LBSPPB512_MIWT2_1_PGR1_PLR1_SS0_SU32_SUM0_SUS256_SVW8_WG32_4_1_WGM8
    SolutionIndex: 1
    SolutionNameMin: Cijk_Ailk_Bjlk_BBS_BH_Bias_HAS_SAV_UserArgs_MT64x32x32_MI16x16x1_SN_CLR0_GSU1_LBSPPA1024_LBSPPB512_MIWT2_1_PGR1_PLR0_SS0_SU32_SUM0_SUS256_SVW8_WG32_4_1_WGM8
    SolutionIndex: 2
    SolutionNameMin: Cijk_Ailk_Bjlk_BBS_BH_Bias_HAS_SAV_UserArgs_MT64x32x32_MI16x16x1_SN_CLR0_GSU1_LBSPPA1024_LBSPPB512_MIWT2_1_PGR2_PLR0_SS0_SU32_SUM0_SUS256_SVW8_WG32_4_1_WGM8
    SolutionIndex: 3
    SolutionNameMin: Cijk_Ailk_Bjlk_BBS_BH_Bias_HAS_SAV_UserArgs_MT32x64x32_MI16x16x1_SN_CLR1_GSU1_LBSPPA512_LBSPPB1024_MIWT2_1_PGR1_PLR1_SS0_SU32_SUM0_SUS256_SVW8_WG16_8_1_WGM8
    SolutionIndex: 4
    SolutionNameMin: Cijk_Ailk_Bjlk_BBS_BH_Bias_HAS_SAV_UserArgs_MT32x64x32_MI16x16x1_SN_CLR1_GSU1_LBSPPA512_LBSPPB1024_MIWT2_1_PGR2_PLR1_SS0_SU32_SUM0_SUS256_SVW8_WG16_8_1_WGM8
    SolutionIndex: 5
    SolutionNameMin: Cijk_Ailk_Bjlk_BBS_BH_Bias_HAS_SAV_UserArgs_MT32x64x32_MI16x16x1_SN_CLR0_GSU1_LBSPPA512_LBSPPB1024_MIWT2_1_PGR1_PLR0_SS0_SU32_SUM0_SUS256_SVW8_WG16_8_1_WGM8
    SolutionIndex: 6
    SolutionNameMin: Cijk_Ailk_Bjlk_BBS_BH_Bias_HAS_SAV_UserArgs_MT32x64x32_MI16x16x1_SN_CLR0_GSU1_LBSPPA512_LBSPPB1024_MIWT2_1_PGR2_PLR0_SS0_SU32_SUM0_SUS256_SVW8_WG16_8_1_WGM8
    SolutionIndex: 7
    SolutionNameMin: Cijk_Ailk_Bjlk_BBS_BH_Bias_HAS_SAV_UserArgs_MT32x32x64_MI16x16x1_SN_CLR1_GSU1_LBSPPA512_LBSPPB512_MIWT1_1_PGR1_PLR1_SS0_SU32_SUM0_SUS256_SVW8_WG32_4_1_WGM8
    SolutionIndex: 8
    SolutionNameMin: Cijk_Ailk_Bjlk_BBS_BH_Bias_HAS_SAV_UserArgs_MT32x32x64_MI16x16x1_SN_CLR1_GSU1_LBSPPA512_LBSPPB512_MIWT1_1_PGR1_PLR3_SS0_SU32_SUM0_SUS256_SVW8_WG32_4_1_WGM8
    SolutionIndex: 9
    SolutionNameMin: Cijk_Ailk_Bjlk_BBS_BH_Bias_HAS_SAV_UserArgs_MT32x32x64_MI16x16x1_SN_CLR0_GSU1_LBSPPA512_LBSPPB512_MIWT1_1_PGR2_PLR0_SS0_SU32_SUM0_SUS256_SVW8_WG32_4_1_WGM8
    SolutionIndex: 10
    SolutionNameMin: Cijk_Ailk_Bjlk_BBS_BH_Bias_HAS_SAV_UserArgs_MT64x32x64_MI16x16x1_SN_CLR1_GSU1_LBSPPA1024_LBSPPB512_MIWT2_1_PGR1_PLR3_SS0_SU32_SUM0_SUS256_SVW8_WG32_4_1_WGM8
    SolutionIndex: 11
    SolutionNameMin: Cijk_Ailk_Bjlk_BBS_BH_Bias_HAS_SAV_UserArgs_MT64x16x32_MI16x16x1_SN_CLR0_GSU1_LBSPPA1024_LBSPPB256_MIWT1_1_PGR1_PLR0_SS1_SU32_SUM0_SUS256_SVW1_WG64_2_1_WGM8
    SolutionIndex: 12
    SolutionNameMin: Cijk_Ailk_Bjlk_BBS_BH_Bias_HAS_SAV_UserArgs_MT32x32x32_MI16x16x1_SN_CLR1_GSU1_LBSPPA512_LBSPPB512_MIWT1_1_PGR1_PLR1_SS1_SU32_SUM0_SUS256_SVW1_WG32_4_1_WGM8
    SolutionIndex: 13
    SolutionNameMin: Cijk_Ailk_Bjlk_BBS_BH_Bias_HAS_SAV_UserArgs_MT64x32x32_MI16x16x1_SN_CLR1_GSU1_LBSPPA1024_LBSPPB512_MIWT2_1_PGR1_PLR1_SS1_SU32_SUM0_SUS256_SVW1_WG32_4_1_WGM8
    SolutionIndex: 14
    SolutionNameMin: Cijk_Ailk_Bjlk_BBS_BH_Bias_HAS_SAV_UserArgs_MT32x64x32_MI16x16x1_SN_CLR1_GSU1_LBSPPA512_LBSPPB1024_MIWT2_1_PGR1_PLR1_SS1_SU32_SUM0_SUS256_SVW1_WG16_8_1_WGM8
    SolutionIndex: 15
    SolutionNameMin: Cijk_Ailk_Bjlk_BBS_BH_Bias_HAS_SAV_UserArgs_MT32x64x32_MI16x16x1_SN_CLR1_GSU1_LBSPPA512_LBSPPB1024_MIWT2_1_PGR2_PLR1_SS1_SU32_SUM0_SUS256_SVW1_WG16_8_1_WGM8
    SolutionIndex: 16
    SolutionNameMin: Cijk_Ailk_Bjlk_BBS_BH_Bias_HAS_SAV_UserArgs_MT32x64x32_MI16x16x1_SN_CLR0_GSU1_LBSPPA512_LBSPPB1024_MIWT2_1_PGR2_PLR0_SS1_SU32_SUM0_SUS256_SVW1_WG16_8_1_WGM8
    SolutionIndex: 17
    SolutionNameMin: Cijk_Ailk_Bjlk_BBS_BH_Bias_HAS_SAV_UserArgs_MT32x32x64_MI16x16x1_SN_CLR1_GSU1_LBSPPA512_LBSPPB512_MIWT1_1_PGR1_PLR1_SS1_SU32_SUM0_SUS256_SVW1_WG32_4_1_WGM8
    SolutionIndex: 18
    SolutionNameMin: Cijk_Ailk_Bjlk_BBS_BH_Bias_HAS_SAV_UserArgs_MT32x32x64_MI16x16x1_SN_CLR1_GSU1_LBSPPA512_LBSPPB512_MIWT1_1_PGR2_PLR1_SS1_SU32_SUM0_SUS256_SVW1_WG32_4_1_WGM8
    SolutionIndex: 19
    SolutionNameMin: Cijk_Ailk_Bjlk_BBS_BH_Bias_HAS_SAV_UserArgs_MT32x32x64_MI16x16x1_SN_CLR1_GSU1_LBSPPA512_LBSPPB512_MIWT1_1_PGR1_PLR3_SS1_SU32_SUM0_SUS256_SVW1_WG32_4_1_WGM8
    SolutionIndex: 20
    SolutionNameMin: Cijk_Ailk_Bjlk_BBS_BH_Bias_HAS_SAV_UserArgs_MT32x32x64_MI16x16x1_SN_CLR0_GSU1_LBSPPA512_LBSPPB512_MIWT1_1_PGR1_PLR0_SS1_SU32_SUM0_SUS256_SVW1_WG32_4_1_WGM8
    SolutionIndex: 21
    SolutionNameMin: Cijk_Ailk_Bjlk_BBS_BH_Bias_HAS_SAV_UserArgs_MT32x32x64_MI16x16x1_SN_CLR0_GSU1_LBSPPA512_LBSPPB512_MIWT1_1_PGR2_PLR0_SS1_SU32_SUM0_SUS256_SVW1_WG32_4_1_WGM8
    SolutionIndex: 22
    SolutionNameMin: Cijk_Ailk_Bjlk_BBS_BH_Bias_HAS_SAV_UserArgs_MT64x32x64_MI16x16x1_SN_CLR1_GSU1_LBSPPA1024_LBSPPB512_MIWT2_1_PGR1_PLR3_SS1_SU32_SUM0_SUS256_SVW1_WG32_4_1_WGM8
    SolutionIndex: 23
    SolutionNameMin: Cijk_Ailk_Bjlk_BBS_BH_Bias_HAS_SAV_UserArgs_MT32x64x64_MI16x16x1_SN_CLR1_GSU1_LBSPPA512_LBSPPB1024_MIWT2_1_PGR1_PLR3_SS1_SU32_SUM0_SUS256_SVW1_WG16_8_1_WGM8
- - - [512, 512, 1, 64, 512, 512, 512, 512]
    - [13, 1084.92]
  - - [1024, 512, 1, 64, 1024, 1024, 1024, 512]
    - [15, 2054.08]
  - - [1536, 512, 1, 64, 1536, 1536, 1536, 512]
    - [3, 2864.96]
  - - [2048, 512, 1, 64, 2048, 2048, 2048, 512]
    - [16, 3632.51]
  - - [2560, 512, 1, 64, 2560, 2560, 2560, 512]
    - [3, 4274.12]
  - - [3072, 512, 1, 64, 3072, 3072, 3072, 512]
    - [6, 4927.59]
  - - [512, 1024, 1, 64, 512, 512, 512, 1024]
    - [16, 2073.76]
  - - [1024, 1024, 1, 64, 1024, 1024, 1024, 1024]
    - [16, 3620.66]
  - - [1536, 1024, 1, 64, 1536, 1536, 1536, 1024]
    - [3, 4937.38]
  - - [2048, 1024, 1, 64, 2048, 2048, 2048, 1024]
    - [2, 5922.46]
  - - [2560, 1024, 1, 64, 2560, 2560, 2560, 1024]
    - [3, 6561.8]
  - - [3072, 1024, 1, 64, 3072, 3072, 3072, 1024]
    - [5, 7499.45]
  - - [512, 1536, 1, 64, 512, 512, 512, 1536]
    - [3, 2865.86]
  - - [1024, 1536, 1, 64, 1024, 1024, 1024, 1536]
    - [5, 4913.16]
  - - [1536, 1536, 1, 64, 1536, 1536, 1536, 1536]
    - [6, 6407.87]
  - - [2048, 1536, 1, 64, 2048, 2048, 2048, 1536]
    - [4, 7299.2]
  - - [2560, 1536, 1, 64, 2560, 2560, 2560, 1536]
    - [6, 8447.46]
  - - [3072, 1536, 1, 64, 3072, 3072, 3072, 1536]
    - [6, 9261.65]
  - - [512, 2048, 1, 64, 512, 512, 512, 2048]
    - [6, 3579.04]
  - - [1024, 2048, 1, 64, 1024, 1024, 1024, 2048]
    - [3, 5989.99]
  - - [1536, 2048, 1, 64, 1536, 1536, 1536, 2048]
    - [3, 7585.92]
  - - [2048, 2048, 1, 64, 2048, 2048, 2048, 2048]
    - [3, 8774.55]
  - - [2560, 2048, 1, 64, 2560, 2560, 2560, 2048]
    - [4, 10095.4]
  - - [3072, 2048, 1, 64, 3072, 3072, 3072, 2048]
    - [4, 10825.5]
  - - [512, 2560, 1, 64, 512, 512, 512, 2560]
    - [6, 4130.69]
  - - [1024, 2560, 1, 64, 1024, 1024, 1024, 2560]
    - [3, 6590.28]
  - - [1536, 2560, 1, 64, 1536, 1536, 1536, 2560]
    - [6, 8438.96]
  - - [2048, 2560, 1, 64, 2048, 2048, 2048, 2560]
    - [3, 9873.6]
  - - [2560, 2560, 1, 64, 2560, 2560, 2560, 2560]
    - [4, 10917.8]
  - - [3072, 2560, 1, 64, 3072, 3072, 3072, 2560]
    - [6, 11949.9]
  - - [512, 3072, 1, 64, 512, 512, 512, 3072]
    - [4, 4764.11]
  - - [1024, 3072, 1, 64, 1024, 1024, 1024, 3072]
    - [3, 7605.84]
  - - [1536, 3072, 1, 64, 1536, 1536, 1536, 3072]
    - [3, 9564.36]
  - - [2048, 3072, 1, 64, 2048, 2048, 2048, 3072]
    - [0, 10971.8]
  - - [2560, 3072, 1, 64, 2560, 2560, 2560, 3072]
    - [3, 11785.9]
  - - [3072, 3072, 1, 64, 3072, 3072, 3072, 3072]
    - [6, 13095.3]
  - - [512, 512, 1, 256, 512, 512, 512, 512]
    - [22, 3887.55]
  - - [1024, 512, 1, 256, 1024, 1024, 1024, 512]
    - [13, 7008.39]
  - - [1536, 512, 1, 256, 1536, 1536, 1536, 512]
    - [3, 9064.07]
  - - [2048, 512, 1, 256, 2048, 2048, 2048, 512]
    - [14, 10965.1]
  - - [2560, 512, 1, 256, 2560, 2560, 2560, 512]
    - [3, 12254.4]
  - - [3072, 512, 1, 256, 3072, 3072, 3072, 512]
    - [14, 13810.8]
  - - [512, 1024, 1, 256, 512, 512, 512, 1024]
    - [5, 6817.58]
  - - [1024, 1024, 1, 256, 1024, 1024, 1024, 1024]
    - [3, 11182.5]
  - - [1536, 1024, 1, 256, 1536, 1536, 1536, 1024]
    - [3, 14198.7]
  - - [2048, 1024, 1, 256, 2048, 2048, 2048, 1024]
    - [3, 15884.5]
  - - [2560, 1024, 1, 256, 2560, 2560, 2560, 1024]
    - [3, 18249.0]
  - - [3072, 1024, 1, 256, 3072, 3072, 3072, 1024]
    - [3, 19611.7]
  - - [512, 1536, 1, 256, 512, 512, 512, 1536]
    - [1, 9049.61]
  - - [1024, 1536, 1, 256, 1024, 1024, 1024, 1536]
    - [3, 13954.8]
  - - [1536, 1536, 1, 256, 1536, 1536, 1536, 1536]
    - [3, 16983.9]
  - - [2048, 1536, 1, 256, 2048, 2048, 2048, 1536]
    - [3, 19676.7]
  - - [2560, 1536, 1, 256, 2560, 2560, 2560, 1536]
    - [3, 21409.5]
  - - [3072, 1536, 1, 256, 3072, 3072, 3072, 1536]
    - [3, 22406.6]
  - - [512, 2048, 1, 256, 512, 512, 512, 2048]
    - [3, 11236.3]
  - - [1024, 2048, 1, 256, 1024, 1024, 1024, 2048]
    - [3, 16176.9]
  - - [1536, 2048, 1, 256, 1536, 1536, 1536, 2048]
    - [0, 19108.4]
  - - [2048, 2048, 1, 256, 2048, 2048, 2048, 2048]
    - [3, 21732.1]
  - - [2560, 2048, 1, 256, 2560, 2560, 2560, 2048]
    - [0, 23550.1]
  - - [3072, 2048, 1, 256, 3072, 3072, 3072, 2048]
    - [3, 24918.0]
  - - [512, 2560, 1, 256, 512, 512, 512, 2560]
    - [3, 12392.7]
  - - [1024, 2560, 1, 256, 1024, 1024, 1024, 2560]
    - [3, 17828.7]
  - - [1536, 2560, 1, 256, 1536, 1536, 1536, 2560]
    - [14, 21074.9]
  - - [2048, 2560, 1, 256, 2048, 2048, 2048, 2560]
    - [3, 23055.9]
  - - [2560, 2560, 1, 256, 2560, 2560, 2560, 2560]
    - [3, 25147.4]
  - - [3072, 2560, 1, 256, 3072, 3072, 3072, 2560]
    - [13, 26095.5]
  - - [512, 3072, 1, 256, 512, 512, 512, 3072]
    - [14, 14206.4]
  - - [1024, 3072, 1, 256, 1024, 1024, 1024, 3072]
    - [3, 19666.8]
  - - [1536, 3072, 1, 256, 1536, 1536, 1536, 3072]
    - [13, 22633.7]
  - - [2048, 3072, 1, 256, 2048, 2048, 2048, 3072]
    - [13, 24768.2]
  - - [2560, 3072, 1, 256, 2560, 2560, 2560, 3072]
    - [3, 26076.9]
  - - [3072, 3072, 1, 256, 3072, 3072, 3072, 3072]
    - [3, 27071.4]
  - - [512, 512, 1, 512, 512, 512, 512, 512]
    - [10, 6607.32]
  - - [1024, 512, 1, 512, 1024, 1024, 1024, 512]
    - [14, 11369.8]
  - - [1536, 512, 1, 512, 1536, 1536, 1536, 512]
    - [13, 14161.2]
  - - [2048, 512, 1, 512, 2048, 2048, 2048, 512]
    - [3, 16756.0]
  - - [2560, 512, 1, 512, 2560, 2560, 2560, 512]
    - [3, 18536.8]
  - - [3072, 512, 1, 512, 3072, 3072, 3072, 512]
    - [3, 20193.2]
  - - [512, 1024, 1, 512, 512, 512, 512, 1024]
    - [3, 11486.8]
  - - [1024, 1024, 1, 512, 1024, 1024, 1024, 1024]
    - [3, 17115.0]
  - - [1536, 1024, 1, 512, 1536, 1536, 1536, 1024]
    - [13, 20137.7]
  - - [2048, 1024, 1, 512, 2048, 2048, 2048, 1024]
    - [13, 22783.3]
  - - [2560, 1024, 1, 512, 2560, 2560, 2560, 1024]
    - [3, 24419.7]
  - - [3072, 1024, 1, 512, 3072, 3072, 3072, 1024]
    - [13, 25719.4]
  - - [512, 1536, 1, 512, 512, 512, 512, 1536]
    - [3, 14015.6]
  - - [1024, 1536, 1, 512, 1024, 1024, 1024, 1536]
    - [3, 20390.6]
  - - [1536, 1536, 1, 512, 1536, 1536, 1536, 1536]
    - [3, 23673.6]
  - - [2048, 1536, 1, 512, 2048, 2048, 2048, 1536]
    - [14, 25688.4]
  - - [2560, 1536, 1, 512, 2560, 2560, 2560, 1536]
    - [14, 27177.3]
  - - [3072, 1536, 1, 512, 3072, 3072, 3072, 1536]
    - [3, 28849.4]
  - - [512, 2048, 1, 512, 512, 512, 512, 2048]
    - [13, 17087.5]
  - - [1024, 2048, 1, 512, 1024, 1024, 1024, 2048]
    - [13, 22531.8]
  - - [1536, 2048, 1, 512, 1536, 1536, 1536, 2048]
    - [13, 25515.3]
  - - [2048, 2048, 1, 512, 2048, 2048, 2048, 2048]
    - [3, 27793.7]
  - - [2560, 2048, 1, 512, 2560, 2560, 2560, 2048]
    - [3, 29315.7]
  - - [3072, 2048, 1, 512, 3072, 3072, 3072, 2048]
    - [14, 30086.2]
  - - [512, 2560, 1, 512, 512, 512, 512, 2560]
    - [13, 18308.7]
  - - [1024, 2560, 1, 512, 1024, 1024, 1024, 2560]
    - [3, 24361.8]
  - - [1536, 2560, 1, 512, 1536, 1536, 1536, 2560]
    - [13, 27717.0]
  - - [2048, 2560, 1, 512, 2048, 2048, 2048, 2560]
    - [13, 29402.4]
  - - [2560, 2560, 1, 512, 2560, 2560, 2560, 2560]
    - [14, 30296.8]
  - - [3072, 2560, 1, 512, 3072, 3072, 3072, 2560]
    - [13, 31526.4]
  - - [512, 3072, 1, 512, 512, 512, 512, 3072]
    - [14, 19974.9]
  - - [1024, 3072, 1, 512, 1024, 1024, 1024, 3072]
    - [3, 25318.5]
  - - [1536, 3072, 1, 512, 1536, 1536, 1536, 3072]
    - [13, 28927.4]
  - - [2048, 3072, 1, 512, 2048, 2048, 2048, 3072]
    - [0, 30137.0]
  - - [2560, 3072, 1, 512, 2560, 2560, 2560, 3072]
    - [3, 30854.7]
  - - [3072, 3072, 1, 512, 3072, 3072, 3072, 3072]
    - [3, 31345.1]
  - - [512, 512, 1, 1024, 512, 512, 512, 512]
    - [23, 10598.4]
  - - [1024, 512, 1, 1024, 1024, 1024, 1024, 512]
    - [13, 16838.0]
  - - [1536, 512, 1, 1024, 1536, 1536, 1536, 512]
    - [12, 17254.2]
  - - [2048, 512, 1, 1024, 2048, 2048, 2048, 512]
    - [13, 22725.4]
  - - [2560, 512, 1, 1024, 2560, 2560, 2560, 512]
    - [13, 24251.5]
  - - [3072, 512, 1, 1024, 3072, 3072, 3072, 512]
    - [13, 25843.6]
  - - [512, 1024, 1, 1024, 512, 512, 512, 1024]
    - [3, 17109.2]
  - - [1024, 1024, 1, 1024, 1024, 1024, 1024, 1024]
    - [14, 22963.8]
  - - [1536, 1024, 1, 1024, 1536, 1536, 1536, 1024]
    - [14, 25947.5]
  - - [2048, 1024, 1, 1024, 2048, 2048, 2048, 1024]
    - [13, 27833.2]
  - - [2560, 1024, 1, 1024, 2560, 2560, 2560, 1024]
    - [3, 28875.0]
  - - [3072, 1024, 1, 1024, 3072, 3072, 3072, 1024]
    - [0, 30636.8]
  - - [512, 1536, 1, 1024, 512, 512, 512, 1536]
    - [13, 20012.3]
  - - [1024, 1536, 1, 1024, 1024, 1024, 1024, 1536]
    - [13, 25893.3]
  - - [1536, 1536, 1, 1024, 1536, 1536, 1536, 1536]
    - [13, 28766.9]
  - - [2048, 1536, 1, 1024, 2048, 2048, 2048, 1536]
    - [14, 30420.8]
  - - [2560, 1536, 1, 1024, 2560, 2560, 2560, 1536]
    - [14, 31321.0]
  - - [3072, 1536, 1, 1024, 3072, 3072, 3072, 1536]
    - [3, 31848.2]
  - - [512, 2048, 1, 1024, 512, 512, 512, 2048]
    - [3, 23018.2]
  - - [1024, 2048, 1, 1024, 1024, 1024, 1024, 2048]
    - [3, 28251.5]
  - - [1536, 2048, 1, 1024, 1536, 1536, 1536, 2048]
    - [13, 30129.8]
  - - [2048, 2048, 1, 1024, 2048, 2048, 2048, 2048]
    - [13, 32140.5]
  - - [2560, 2048, 1, 1024, 2560, 2560, 2560, 2048]
    - [3, 33099.3]
  - - [3072, 2048, 1, 1024, 3072, 3072, 3072, 2048]
    - [14, 33729.3]
  - - [512, 2560, 1, 1024, 512, 512, 512, 2560]
    - [14, 23913.9]
  - - [1024, 2560, 1, 1024, 1024, 1024, 1024, 2560]
    - [14, 29199.2]
  - - [1536, 2560, 1, 1024, 1536, 1536, 1536, 2560]
    - [3, 31599.5]
  - - [2048, 2560, 1, 1024, 2048, 2048, 2048, 2560]
    - [13, 32636.6]
  - - [2560, 2560, 1, 1024, 2560, 2560, 2560, 2560]
    - [0, 34168.7]
  - - [3072, 2560, 1, 1024, 3072, 3072, 3072, 2560]
    - [14, 34893.0]
  - - [512, 3072, 1, 1024, 512, 512, 512, 3072]
    - [14, 25870.4]
  - - [1024, 3072, 1, 1024, 1024, 1024, 1024, 3072]
    - [13, 30817.3]
  - - [1536, 3072, 1, 1024, 1536, 1536, 1536, 3072]
    - [14, 32263.6]
  - - [2048, 3072, 1, 1024, 2048, 2048, 2048, 3072]
    - [14, 34083.3]
  - - [2560, 3072, 1, 1024, 2560, 2560, 2560, 3072]
    - [14, 34045.3]
  - - [3072, 3072, 1, 1024, 3072, 3072, 3072, 3072]
    - [13, 35587.0]
  - - [512, 512, 1, 2048, 512, 512, 512, 512]
    - [23, 15354.1]
  - - [1024, 512, 1, 2048, 1024, 1024, 1024, 512]
    - [14, 23119.8]
  - - [1536, 512, 1, 2048, 1536, 1536, 1536, 512]
    - [3, 24745.5]
  - - [2048, 512, 1, 2048, 2048, 2048, 2048, 512]
    - [13, 27541.9]
  - - [2560, 512, 1, 2048, 2560, 2560, 2560, 512]
    - [3, 28201.7]
  - - [3072, 512, 1, 2048, 3072, 3072, 3072, 512]
    - [3, 29605.6]
  - - [512, 1024, 1, 2048, 512, 512, 512, 1024]
    - [13, 22941.7]
  - - [1024, 1024, 1, 2048, 1024, 1024, 1024, 1024]
    - [13, 27535.0]
  - - [1536, 1024, 1, 2048, 1536, 1536, 1536, 1024]
    - [13, 29954.6]
  - - [2048, 1024, 1, 2048, 2048, 2048, 2048, 1024]
    - [14, 31306.1]
  - - [2560, 1024, 1, 2048, 2560, 2560, 2560, 1024]
    - [14, 32468.7]
  - - [3072, 1024, 1, 2048, 3072, 3072, 3072, 1024]
    - [3, 34040.1]
  - - [512, 1536, 1, 2048, 512, 512, 512, 1536]
    - [14, 24925.7]
  - - [1024, 1536, 1, 2048, 1024, 1024, 1024, 1536]
    - [13, 30202.2]
  - - [1536, 1536, 1, 2048, 1536, 1536, 1536, 1536]
    - [13, 32127.1]
  - - [2048, 1536, 1, 2048, 2048, 2048, 2048, 1536]
    - [3, 32999.9]
  - - [2560, 1536, 1, 2048, 2560, 2560, 2560, 1536]
    - [14, 33647.7]
  - - [3072, 1536, 1, 2048, 3072, 3072, 3072, 1536]
    - [3, 35006.4]
  - - [512, 2048, 1, 2048, 512, 512, 512, 2048]
    - [13, 27967.9]
  - - [1024, 2048, 1, 2048, 1024, 1024, 1024, 2048]
    - [3, 31838.4]
  - - [1536, 2048, 1, 2048, 1536, 1536, 1536, 2048]
    - [13, 33365.3]
  - - [2048, 2048, 1, 2048, 2048, 2048, 2048, 2048]
    - [14, 34032.3]
  - - [2560, 2048, 1, 2048, 2560, 2560, 2560, 2048]
    - [13, 34954.6]
  - - [3072, 2048, 1, 2048, 3072, 3072, 3072, 2048]
    - [3, 34955.3]
  - - [512, 2560, 1, 2048, 512, 512, 512, 2560]
    - [13, 29000.0]
  - - [1024, 2560, 1, 2048, 1024, 1024, 1024, 2560]
    - [3, 33216.5]
  - - [1536, 2560, 1, 2048, 1536, 1536, 1536, 2560]
    - [14, 34211.4]
  - - [2048, 2560, 1, 2048, 2048, 2048, 2048, 2560]
    - [3, 34715.8]
  - - [2560, 2560, 1, 2048, 2560, 2560, 2560, 2560]
    - [0, 35272.8]
  - - [3072, 2560, 1, 2048, 3072, 3072, 3072, 2560]
    - [3, 35430.9]
  - - [512, 3072, 1, 2048, 512, 512, 512, 3072]
    - [13, 29975.5]
  - - [1024, 3072, 1, 2048, 1024, 1024, 1024, 3072]
    - [13, 34022.1]
  - - [1536, 3072, 1, 2048, 1536, 1536, 1536, 3072]
    - [14, 34284.8]
  - - [2048, 3072, 1, 2048, 2048, 2048, 2048, 3072]
    - [3, 35445.6]
  - - [2560, 3072, 1, 2048, 2560, 2560, 2560, 3072]
    - [14, 35367.9]
  - - [3072, 3072, 1, 2048, 3072, 3072, 3072, 3072]
    - [14, 35734.5]
  - - [512, 512, 1, 3072, 512, 512, 512, 512]
    - [22, 17810.6]
  - - [1024, 512, 1, 3072, 1024, 1024, 1024, 512]
    - [3, 25402.2]
  - - [1536, 512, 1, 3072, 1536, 1536, 1536, 512]
    - [14, 25906.6]
  - - [2048, 512, 1, 3072, 2048, 2048, 2048, 512]
    - [14, 30152.8]
  - - [2560, 512, 1, 3072, 2560, 2560, 2560, 512]
    - [3, 29456.0]
  - - [3072, 512, 1, 3072, 3072, 3072, 3072, 512]
    - [3, 31217.4]
  - - [512, 1024, 1, 3072, 512, 512, 512, 1024]
    - [13, 25912.0]
  - - [1024, 1024, 1, 3072, 1024, 1024, 1024, 1024]
    - [13, 30058.3]
  - - [1536, 1024, 1, 3072, 1536, 1536, 1536, 1024]
    - [14, 32038.6]
  - - [2048, 1024, 1, 3072, 2048, 2048, 2048, 1024]
    - [13, 32759.5]
  - - [2560, 1024, 1, 3072, 2560, 2560, 2560, 1024]
    - [14, 32922.9]
  - - [3072, 1024, 1, 3072, 3072, 3072, 3072, 1024]
    - [14, 34011.7]
  - - [512, 1536, 1, 3072, 512, 512, 512, 1536]
    - [13, 26759.0]
  - - [1024, 1536, 1, 3072, 1024, 1024, 1024, 1536]
    - [3, 32031.2]
  - - [1536, 1536, 1, 3072, 1536, 1536, 1536, 1536]
    - [13, 32842.9]
  - - [2048, 1536, 1, 3072, 2048, 2048, 2048, 1536]
    - [3, 33666.9]
  - - [2560, 1536, 1, 3072, 2560, 2560, 2560, 1536]
    - [3, 34803.3]
  - - [3072, 1536, 1, 3072, 3072, 3072, 3072, 1536]
    - [3, 35267.9]
  - - [512, 2048, 1, 3072, 512, 512, 512, 2048]
    - [14, 30227.8]
  - - [1024, 2048, 1, 3072, 1024, 1024, 1024, 2048]
    - [3, 32453.6]
  - - [1536, 2048, 1, 3072, 1536, 1536, 1536, 2048]
    - [14, 34431.2]
  - - [2048, 2048, 1, 3072, 2048, 2048, 2048, 2048]
    - [14, 34642.6]
  - - [2560, 2048, 1, 3072, 2560, 2560, 2560, 2048]
    - [14, 35211.7]
  - - [3072, 2048, 1, 3072, 3072, 3072, 3072, 2048]
    - [3, 35932.1]
  - - [512, 2560, 1, 3072, 512, 512, 512, 2560]
    - [14, 31094.6]
  - - [1024, 2560, 1, 3072, 1024, 1024, 1024, 2560]
    - [13, 33574.0]
  - - [1536, 2560, 1, 3072, 1536, 1536, 1536, 2560]
    - [14, 34442.0]
  - - [2048, 2560, 1, 3072, 2048, 2048, 2048, 2560]
    - [3, 34723.0]
  - - [2560, 2560, 1, 3072, 2560, 2560, 2560, 2560]
    - [3, 35522.2]
  - - [3072, 2560, 1, 3072, 3072, 3072, 3072, 2560]
    - [0, 35920.1]
  - - [512, 3072, 1, 3072, 512, 512, 512, 3072]
    - [3, 32193.7]
  - - [1024, 3072, 1, 3072, 1024, 1024, 1024, 3072]
    - [14, 33723.3]
  - - [1536, 3072, 1, 3072, 1536, 1536, 1536, 3072]
    - [13, 34646.8]
  - - [2048, 3072, 1, 3072, 2048, 2048, 2048, 3072]
    - [3, 35517.1]
  - - [2560, 3072, 1, 3072, 2560, 2560, 2560, 3072]
    - [14, 35985.5]
  - - [3072, 3072, 1, 3072, 3072, 3072, 3072, 3072]
    - [3, 35801.8]
  - - [1, 1, 1, 1, 1, 1, 1, 1]
    - [21, 6.3012e-05]
  - - [1, 1, 1, 64, 1, 1, 1, 1]
    - [20, 0.00405333]
  - - [1, 64, 1, 1, 1, 1, 1, 64]
    - [21, 0.00407916]
  - - [64, 1, 1, 1, 64, 64, 64, 1]
    - [18, 0.00422345]
  - - [64, 64, 1, 1, 64, 64, 64, 64]
    - [9, 0.272458]
  - - [64, 1, 1, 64, 64, 64, 64, 1]
    - [17, 0.267555]
  - - [1, 64, 1, 64, 1, 1, 1, 64]
    - [11, 0.265732]
  - - [64, 64, 1, 64, 64, 64, 64, 64]
    - [20, 17.4437]
  - - [64, 64, 1, 256, 64, 64, 64, 64]
    - [7, 64.9655]
  - - [64, 64, 1, 512, 64, 64, 64, 64]
    - [19, 119.578]
  - - [64, 64, 1, 1024, 64, 64, 64, 64]
    - [20, 205.921]
  - - [64, 64, 1, 2048, 64, 64, 64, 64]
    - [8, 319.755]
  - - [64, 64, 1, 4096, 64, 64, 64, 64]
    - [8, 448.769]
- null
- null
- DeviceEfficiency
- GridBased
