library/src/amd_detail/rocblaslt/src/Tensile/Logic/asm_full/gfx1200/GridBased/gfx1200_Cijk_Ailk_Bljk_I8BH_HAI_SAV_UserArgs.yaml
- {MinimumRequiredVersion: 4.33.0}
- gfx1200
- gfx1200
- [Device 73f0]
    SolutionIndex: 0
    SolutionNameMin: Cijk_Ailk_Bljk_I8BH_HAI_SAV_UserArgs_MT64x16x32_MI16x16x1_SN_GSU1_GSUC0_GSUWGMRR0_K1_MIWT1_1_SU0_SUM0_SUS0_WGM8_WGMXCC1_WGMXCCGn1
    SolutionIndex: 1
    SolutionNameMin: Cijk_Ailk_Bljk_I8BH_HAI_SAV_UserArgs_MT64x32x32_MI16x16x1_SN_LDSB0_CLR1_GRVWA16_GRVWB8_GSU1_LBSPPA512_LBSPPB128_LPB8_MIWT2_1_PGR1_PLR1_SS1_SU32_SUM0_SUS256_SVW1_TLDS1_WG32_4_1_WGM8
    SolutionIndex: 2
    SolutionNameMin: Cijk_Ailk_Bljk_I8BH_HAI_SAV_UserArgs_MT256x16x32_MI16x16x1_SN_LDSB0_CLR0_GRVWA16_GRVWB4_GSU1_LBSPPA2048_LBSPPB128_LPB8_MIWT4_1_PGR2_PLR0_SS0_SU32_SUM0_SUS256_SVW8_TLDS1_WG64_2_1_WGM8
    SolutionIndex: 3
    SolutionNameMin: Cijk_Ailk_Bljk_I8BH_HAI_SAV_UserArgs_MT32x64x64_MI16x16x1_SN_LDSB0_CLR1_GRVWA16_GRVWB8_GSU1_LBSPPA256_LBSPPB128_LPB8_MIWT2_1_PGR2_PLR3_SS0_SU32_SUM0_SUS256_SVW8_TLDS1_WG16_8_1_WGM8
    SolutionIndex: 4
    SolutionNameMin: Cijk_Ailk_Bljk_I8BH_HAI_SAV_UserArgs_MT32x64x64_MI16x16x1_SN_LDSB0_CLR1_GRVWA16_GRVWB8_GSU1_LBSPPA256_LBSPPB128_LPB8_MIWT2_1_PGR2_PLR3_SS1_SU32_SUM0_SUS256_SVW1_TLDS1_WG16_8_1_WGM8
    SolutionIndex: 5
    SolutionNameMin: Cijk_Ailk_Bljk_I8BH_HAI_SAV_UserArgs_MT256x16x32_MI16x16x1_SN_LDSB0_CLR1_GRVWA16_GRVWB4_GSU1_LBSPPA2048_LBSPPB128_LPB8_MIWT4_1_PGR2_PLR1_SS0_SU32_SUM0_SUS256_SVW8_TLDS1_WG64_2_1_WGM8
    SolutionIndex: 6
    SolutionNameMin: Cijk_Ailk_Bljk_I8BH_HAI_SAV_UserArgs_MT256x16x64_MI16x16x1_SN_LDSB1_CLR1_GRVWA16_GRVWB8_GSU1_LBSPPA2048_LBSPPB128_LPB8_MIWT4_1_PGR2_PLR3_SS0_SU32_SUM0_SUS256_SVW8_TLDS1_WG64_2_1_WGM8
    SolutionIndex: 7
    SolutionNameMin: Cijk_Ailk_Bljk_I8BH_HAI_SAV_UserArgs_MT256x16x64_MI16x16x1_SN_LDSB1_CLR1_GRVWA16_GRVWB8_GSU1_LBSPPA2048_LBSPPB128_LPB8_MIWT4_1_PGR1_PLR3_SS1_SU32_SUM0_SUS256_SVW1_TLDS1_WG64_2_1_WGM8
    SolutionIndex: 8
    SolutionNameMin: Cijk_Ailk_Bljk_I8BH_HAI_SAV_UserArgs_MT256x16x64_MI16x16x1_SN_LDSB1_CLR1_GRVWA16_GRVWB8_GSU1_LBSPPA2048_LBSPPB128_LPB8_MIWT4_1_PGR2_PLR1_SS1_SU32_SUM0_SUS256_SVW1_TLDS1_WG64_2_1_WGM8
    SolutionIndex: 9
    SolutionNameMin: Cijk_Ailk_Bljk_I8BH_HAI_SAV_UserArgs_MT256x16x64_MI16x16x1_SN_LDSB1_CLR1_GRVWA16_GRVWB8_GSU1_LBSPPA2048_LBSPPB128_LPB8_MIWT4_1_PGR1_PLR1_SS1_SU32_SUM0_SUS256_SVW1_TLDS1_WG64_2_1_WGM8
    SolutionIndex: 10
    SolutionNameMin: Cijk_Ailk_Bljk_I8BH_HAI_SAV_UserArgs_MT256x16x64_MI16x16x1_SN_LDSB1_CLR1_GRVWA16_GRVWB8_GSU1_LBSPPA2048_LBSPPB128_LPB8_MIWT4_1_PGR1_PLR3_SS0_SU32_SUM0_SUS256_SVW8_TLDS1_WG64_2_1_WGM8
    SolutionIndex: 11
    SolutionNameMin: Cijk_Ailk_Bljk_I8BH_HAI_SAV_UserArgs_MT32x64x64_MI16x16x1_SN_LDSB0_CLR0_GRVWA16_GRVWB8_GSU1_LBSPPA256_LBSPPB128_LPB8_MIWT2_1_PGR2_PLR0_SS1_SU32_SUM0_SUS256_SVW1_TLDS1_WG16_8_1_WGM8
    SolutionIndex: 12
    SolutionNameMin: Cijk_Ailk_Bljk_I8BH_HAI_SAV_UserArgs_MT256x16x64_MI16x16x1_SN_LDSB1_CLR1_GRVWA16_GRVWB8_GSU1_LBSPPA2048_LBSPPB128_LPB8_MIWT4_1_PGR1_PLR1_SS0_SU32_SUM0_SUS256_SVW8_TLDS1_WG64_2_1_WGM8
    SolutionIndex: 13
    SolutionNameMin: Cijk_Ailk_Bljk_I8BH_HAI_SAV_UserArgs_MT256x16x64_MI16x16x1_SN_LDSB1_CLR1_GRVWA16_GRVWB8_GSU1_LBSPPA2048_LBSPPB128_LPB8_MIWT4_1_PGR2_PLR1_SS0_SU32_SUM0_SUS256_SVW8_TLDS1_WG64_2_1_WGM8
    SolutionIndex: 14
    SolutionNameMin: Cijk_Ailk_Bljk_I8BH_HAI_SAV_UserArgs_MT256x16x64_MI16x16x1_SN_LDSB1_CLR1_GRVWA16_GRVWB8_GSU1_LBSPPA2048_LBSPPB128_LPB8_MIWT4_1_PGR2_PLR3_SS1_SU32_SUM0_SUS256_SVW1_TLDS1_WG64_2_1_WGM8
    SolutionIndex: 15
    SolutionNameMin: Cijk_Ailk_Bljk_I8BH_HAI_SAV_UserArgs_MT256x16x32_MI16x16x1_SN_LDSB0_CLR1_GRVWA16_GRVWB4_GSU1_LBSPPA2048_LBSPPB128_LPB8_MIWT4_1_PGR2_PLR1_SS1_SU32_SUM0_SUS256_SVW1_TLDS1_WG64_2_1_WGM8
    SolutionIndex: 16
    SolutionNameMin: Cijk_Ailk_Bljk_I8BH_HAI_SAV_UserArgs_MT256x16x32_MI16x16x1_SN_LDSB0_CLR0_GRVWA16_GRVWB4_GSU1_LBSPPA2048_LBSPPB128_LPB8_MIWT4_1_PGR1_PLR0_SS0_SU32_SUM0_SUS256_SVW8_TLDS1_WG64_2_1_WGM8
    SolutionIndex: 17
    SolutionNameMin: Cijk_Ailk_Bljk_I8BH_HAI_SAV_UserArgs_MT64x16x64_MI16x16x1_SN_LDSB0_CLR1_GRVWA16_GRVWB8_GSU1_LBSPPA512_LBSPPB128_LPB8_MIWT1_1_PGR1_PLR1_SS1_SU32_SUM0_SUS256_SVW1_TLDS1_WG64_2_1_WGM8
    SolutionIndex: 18
    SolutionNameMin: Cijk_Ailk_Bljk_I8BH_HAI_SAV_UserArgs_MT64x32x64_MI16x16x1_SN_LDSB0_CLR1_GRVWA16_GRVWB8_GSU1_LBSPPA512_LBSPPB128_LPB8_MIWT2_1_PGR1_PLR1_SS1_SU32_SUM0_SUS256_SVW1_TLDS1_WG32_4_1_WGM8
    SolutionIndex: 19
    SolutionNameMin: Cijk_Ailk_Bljk_I8BH_HAI_SAV_UserArgs_MT64x32x64_MI16x16x1_SN_LDSB0_CLR0_GRVWA16_GRVWB8_GSU1_LBSPPA512_LBSPPB128_LPB8_MIWT2_1_PGR1_PLR0_SS1_SU32_SUM0_SUS256_SVW1_TLDS1_WG32_4_1_WGM8
    SolutionIndex: 20
    SolutionNameMin: Cijk_Ailk_Bljk_I8BH_HAI_SAV_UserArgs_MT64x32x64_MI16x16x1_SN_LDSB0_CLR1_GRVWA16_GRVWB8_GSU1_LBSPPA512_LBSPPB128_LPB8_MIWT2_1_PGR1_PLR3_SS1_SU32_SUM0_SUS256_SVW1_TLDS1_WG32_4_1_WGM8
    SolutionIndex: 21
    SolutionNameMin: Cijk_Ailk_Bljk_I8BH_HAI_SAV_UserArgs_MT32x64x32_MI16x16x1_SN_LDSB0_CLR0_GRVWA8_GRVWB8_GSU1_LBSPPA256_LBSPPB128_LPB8_MIWT2_1_PGR1_PLR0_SS1_SU32_SUM0_SUS256_SVW1_TLDS1_WG16_8_1_WGM8
    SolutionIndex: 22
    SolutionNameMin: Cijk_Ailk_Bljk_I8BH_HAI_SAV_UserArgs_MT32x64x64_MI16x16x1_SN_LDSB0_CLR1_GRVWA16_GRVWB8_GSU1_LBSPPA256_LBSPPB128_LPB8_MIWT2_1_PGR1_PLR1_SS1_SU32_SUM0_SUS256_SVW1_TLDS1_WG16_8_1_WGM8
    SolutionIndex: 23
    SolutionNameMin: Cijk_Ailk_Bljk_I8BH_HAI_SAV_UserArgs_MT32x64x64_MI16x16x1_SN_LDSB0_CLR0_GRVWA16_GRVWB8_GSU1_LBSPPA256_LBSPPB128_LPB8_MIWT2_1_PGR1_PLR0_SS1_SU32_SUM0_SUS256_SVW1_TLDS1_WG16_8_1_WGM8
    SolutionIndex: 24
    SolutionNameMin: Cijk_Ailk_Bljk_I8BH_HAI_SAV_UserArgs_MT32x64x64_MI16x16x1_SN_LDSB0_CLR1_GRVWA16_GRVWB8_GSU1_LBSPPA256_LBSPPB128_LPB8_MIWT2_1_PGR1_PLR1_SS0_SU32_SUM0_SUS256_SVW8_TLDS1_WG16_8_1_WGM8
    SolutionIndex: 25
    SolutionNameMin: Cijk_Ailk_Bljk_I8BH_HAI_SAV_UserArgs_MT32x64x32_MI16x16x1_SN_LDSB0_CLR1_GRVWA8_GRVWB8_GSU1_LBSPPA256_LBSPPB128_LPB8_MIWT2_1_PGR1_PLR1_SS1_SU32_SUM0_SUS256_SVW1_TLDS1_WG16_8_1_WGM8
    SolutionIndex: 26
    SolutionNameMin: Cijk_Ailk_Bljk_I8BH_HAI_SAV_UserArgs_MT64x32x32_MI16x16x1_SN_LDSB0_CLR1_GRVWA16_GRVWB8_GSU1_LBSPPA512_LBSPPB128_LPB8_MIWT2_1_PGR2_PLR1_SS0_SU32_SUM0_SUS256_SVW8_TLDS1_WG32_4_1_WGM8
    SolutionIndex: 27
    SolutionNameMin: Cijk_Ailk_Bljk_I8BH_HAI_SAV_UserArgs_MT64x32x32_MI16x16x1_SN_LDSB0_CLR1_GRVWA16_GRVWB8_GSU1_LBSPPA512_LBSPPB128_LPB8_MIWT2_1_PGR1_PLR1_SS0_SU32_SUM0_SUS256_SVW8_TLDS1_WG32_4_1_WGM8
    SolutionIndex: 28
    SolutionNameMin: Cijk_Ailk_Bljk_I8BH_HAI_SAV_UserArgs_MT64x32x32_MI16x16x1_SN_LDSB0_CLR1_GRVWA16_GRVWB8_GSU1_LBSPPA512_LBSPPB128_LPB8_MIWT2_1_PGR2_PLR1_SS1_SU32_SUM0_SUS256_SVW1_TLDS1_WG32_4_1_WGM8
    SolutionIndex: 29
    SolutionNameMin: Cijk_Ailk_Bljk_I8BH_HAI_SAV_UserArgs_MT32x64x64_MI16x16x1_SN_LDSB0_CLR1_GRVWA16_GRVWB8_GSU1_LBSPPA256_LBSPPB128_LPB8_MIWT2_1_PGR1_PLR3_SS1_SU32_SUM0_SUS256_SVW1_TLDS1_WG16_8_1_WGM8
    SolutionIndex: 30
    SolutionNameMin: Cijk_Ailk_Bljk_I8BH_HAI_SAV_UserArgs_MT64x32x32_MI16x16x1_SN_LDSB0_CLR0_GRVWA16_GRVWB8_GSU1_LBSPPA512_LBSPPB128_LPB8_MIWT2_1_PGR1_PLR0_SS1_SU32_SUM0_SUS256_SVW1_TLDS1_WG32_4_1_WGM8
    SolutionIndex: 31
    SolutionNameMin: Cijk_Ailk_Bljk_I8BH_HAI_SAV_UserArgs_MT64x32x64_MI16x16x1_SN_LDSB0_CLR1_GRVWA16_GRVWB8_GSU1_LBSPPA512_LBSPPB128_LPB8_MIWT2_1_PGR1_PLR3_SS0_SU32_SUM0_SUS256_SVW8_TLDS1_WG32_4_1_WGM8
    SolutionIndex: 32
    SolutionNameMin: Cijk_Ailk_Bljk_I8BH_HAI_SAV_UserArgs_MT32x64x64_MI16x16x1_SN_LDSB0_CLR1_GRVWA16_GRVWB8_GSU1_LBSPPA256_LBSPPB128_LPB8_MIWT2_1_PGR2_PLR1_SS1_SU32_SUM0_SUS256_SVW1_TLDS1_WG16_8_1_WGM8
    SolutionIndex: 33
    SolutionNameMin: Cijk_Ailk_Bljk_I8BH_HAI_SAV_UserArgs_MT64x32x32_MI16x16x1_SN_LDSB0_CLR0_GRVWA16_GRVWB8_GSU1_LBSPPA512_LBSPPB128_LPB8_MIWT2_1_PGR2_PLR0_SS1_SU32_SUM0_SUS256_SVW1_TLDS1_WG32_4_1_WGM8
    SolutionIndex: 34
    SolutionNameMin: Cijk_Ailk_Bljk_I8BH_HAI_SAV_UserArgs_MT64x32x64_MI16x16x1_SN_LDSB0_CLR1_GRVWA16_GRVWB8_GSU1_LBSPPA512_LBSPPB128_LPB8_MIWT2_1_PGR1_PLR1_SS0_SU32_SUM0_SUS256_SVW8_TLDS1_WG32_4_1_WGM8
    SolutionIndex: 35
    SolutionNameMin: Cijk_Ailk_Bljk_I8BH_HAI_SAV_UserArgs_MT32x64x32_MI16x16x1_SN_LDSB0_CLR1_GRVWA8_GRVWB8_GSU1_LBSPPA256_LBSPPB128_LPB8_MIWT2_1_PGR1_PLR1_SS0_SU32_SUM0_SUS256_SVW8_TLDS1_WG16_8_1_WGM8
    SolutionIndex: 36
    SolutionNameMin: Cijk_Ailk_Bljk_I8BH_HAI_SAV_UserArgs_MT16x64x64_MI16x16x1_SN_LDSB0_CLR1_GRVWA8_GRVWB8_GSU1_LBSPPA128_LBSPPB128_LPB8_MIWT1_1_PGR1_PLR1_SS1_SU32_SUM0_SUS256_SVW1_TLDS1_WG16_8_1_WGM8
    SolutionIndex: 37
    SolutionNameMin: Cijk_Ailk_Bljk_I8BH_HAI_SAV_UserArgs_MT16x64x64_MI16x16x1_SN_LDSB0_CLR0_GRVWA8_GRVWB16_GSU1_LBSPPA128_LBSPPB512_LPB16_MIWT1_1_PGR1_PLR0_SS1_SU32_SUM0_SUS256_SVW1_TLDS0_WG16_8_1_WGM8
    SolutionIndex: 38
    SolutionNameMin: Cijk_Ailk_Bljk_I8BH_HAI_SAV_UserArgs_MT32x32x32_MI16x16x1_SN_LDSB0_CLR1_GRVWA8_GRVWB8_GSU1_LBSPPA256_LBSPPB128_LPB8_MIWT1_1_PGR1_PLR1_SS0_SU32_SUM0_SUS256_SVW8_TLDS1_WG32_4_1_WGM8
    SolutionIndex: 39
    SolutionNameMin: Cijk_Ailk_Bljk_I8BH_HAI_SAV_UserArgs_MT16x64x64_MI16x16x1_SN_LDSB0_CLR0_GRVWA8_GRVWB8_GSU1_LBSPPA128_LBSPPB128_LPB8_MIWT1_1_PGR2_PLR0_SS1_SU32_SUM0_SUS256_SVW1_TLDS1_WG16_8_1_WGM8
    SolutionIndex: 40
    SolutionNameMin: Cijk_Ailk_Bljk_I8BH_HAI_SAV_UserArgs_MT32x32x64_MI16x16x1_SN_LDSB0_CLR1_GRVWA16_GRVWB16_GSU1_LBSPPA256_LBSPPB256_LPB16_MIWT1_1_PGR1_PLR3_SS1_SU32_SUM0_SUS256_SVW1_TLDS0_WG32_4_1_WGM8
    SolutionIndex: 41
    SolutionNameMin: Cijk_Ailk_Bljk_I8BH_HAI_SAV_UserArgs_MT32x32x64_MI16x16x1_SN_LDSB0_CLR1_GRVWA16_GRVWB8_GSU1_LBSPPA256_LBSPPB128_LPB8_MIWT1_1_PGR1_PLR1_SS1_SU32_SUM0_SUS256_SVW1_TLDS1_WG32_4_1_WGM8
    SolutionIndex: 42
    SolutionNameMin: Cijk_Ailk_Bljk_I8BH_HAI_SAV_UserArgs_MT64x16x64_MI16x16x1_SN_LDSB0_CLR0_GRVWA16_GRVWB8_GSU1_LBSPPA512_LBSPPB128_LPB8_MIWT1_1_PGR1_PLR0_SS1_SU32_SUM0_SUS256_SVW1_TLDS1_WG64_2_1_WGM8
- - - [1, 1, 1, 1]
    - [0, 1.82365e-06]
  - - [512, 512, 1, 64]
    - [1, 0.0]
  - - [1024, 512, 1, 64]
    - [2, 0.0]
  - - [1536, 512, 1, 64]
    - [3, 0.0]
  - - [2048, 512, 1, 64]
    - [4, 0.0]
  - - [2560, 512, 1, 64]
    - [5, 0.0]
  - - [3072, 512, 1, 64]
    - [6, 0.0]
  - - [512, 1024, 1, 64]
    - [6, 0.0]
  - - [1024, 1024, 1, 64]
    - [7, 0.0]
  - - [1536, 1024, 1, 64]
    - [8, 0.0]
  - - [2048, 1024, 1, 64]
    - [9, 0.0]
  - - [2560, 1024, 1, 64]
    - [10, 0.0]
  - - [3072, 1024, 1, 64]
    - [6, 0.0]
  - - [512, 1536, 1, 64]
    - [10, 0.0]
  - - [1024, 1536, 1, 64]
    - [11, 0.0]
  - - [1536, 1536, 1, 64]
    - [8, 0.0]
  - - [2048, 1536, 1, 64]
    - [10, 0.0]
  - - [2560, 1536, 1, 64]
    - [8, 0.0]
  - - [3072, 1536, 1, 64]
    - [10, 0.0]
  - - [512, 2048, 1, 64]
    - [11, 0.0]
  - - [1024, 2048, 1, 64]
    - [12, 0.0]
  - - [1536, 2048, 1, 64]
    - [8, 0.0]
  - - [2048, 2048, 1, 64]
    - [13, 0.0]
  - - [2560, 2048, 1, 64]
    - [8, 0.0]
  - - [3072, 2048, 1, 64]
    - [12, 0.0]
  - - [512, 2560, 1, 64]
    - [12, 0.0]
  - - [1024, 2560, 1, 64]
    - [12, 0.0]
  - - [1536, 2560, 1, 64]
    - [9, 0.0]
  - - [2048, 2560, 1, 64]
    - [13, 0.0]
  - - [2560, 2560, 1, 64]
    - [14, 0.0]
  - - [3072, 2560, 1, 64]
    - [15, 0.0]
  - - [512, 3072, 1, 64]
    - [16, 0.0]
  - - [1024, 3072, 1, 64]
    - [9, 0.0]
  - - [1536, 3072, 1, 64]
    - [8, 0.0]
  - - [2048, 3072, 1, 64]
    - [15, 0.0]
  - - [2560, 3072, 1, 64]
    - [10, 0.0]
  - - [3072, 3072, 1, 64]
    - [12, 0.0]
  - - [512, 512, 1, 256]
    - [17, 0.0]
  - - [1024, 512, 1, 256]
    - [18, 0.0]
  - - [1536, 512, 1, 256]
    - [19, 0.0]
  - - [2048, 512, 1, 256]
    - [20, 0.0]
  - - [2560, 512, 1, 256]
    - [21, 0.0]
  - - [3072, 512, 1, 256]
    - [22, 0.0]
  - - [512, 1024, 1, 256]
    - [23, 0.0]
  - - [1024, 1024, 1, 256]
    - [20, 0.0]
  - - [1536, 1024, 1, 256]
    - [24, 0.0]
  - - [2048, 1024, 1, 256]
    - [24, 0.0]
  - - [2560, 1024, 1, 256]
    - [25, 0.0]
  - - [3072, 1024, 1, 256]
    - [1, 0.0]
  - - [512, 1536, 1, 256]
    - [1, 0.0]
  - - [1024, 1536, 1, 256]
    - [22, 0.0]
  - - [1536, 1536, 1, 256]
    - [26, 0.0]
  - - [2048, 1536, 1, 256]
    - [27, 0.0]
  - - [2560, 1536, 1, 256]
    - [28, 0.0]
  - - [3072, 1536, 1, 256]
    - [1, 0.0]
  - - [512, 2048, 1, 256]
    - [29, 0.0]
  - - [1024, 2048, 1, 256]
    - [23, 0.0]
  - - [1536, 2048, 1, 256]
    - [25, 0.0]
  - - [2048, 2048, 1, 256]
    - [21, 0.0]
  - - [2560, 2048, 1, 256]
    - [30, 0.0]
  - - [3072, 2048, 1, 256]
    - [25, 0.0]
  - - [512, 2560, 1, 256]
    - [28, 0.0]
  - - [1024, 2560, 1, 256]
    - [25, 0.0]
  - - [1536, 2560, 1, 256]
    - [28, 0.0]
  - - [2048, 2560, 1, 256]
    - [25, 0.0]
  - - [2560, 2560, 1, 256]
    - [28, 0.0]
  - - [3072, 2560, 1, 256]
    - [1, 0.0]
  - - [512, 3072, 1, 256]
    - [20, 0.0]
  - - [1024, 3072, 1, 256]
    - [23, 0.0]
  - - [1536, 3072, 1, 256]
    - [28, 0.0]
  - - [2048, 3072, 1, 256]
    - [1, 0.0]
  - - [2560, 3072, 1, 256]
    - [1, 0.0]
  - - [3072, 3072, 1, 256]
    - [1, 0.0]
  - - [512, 512, 1, 512]
    - [31, 0.0]
  - - [1024, 512, 1, 512]
    - [32, 0.0]
  - - [1536, 512, 1, 512]
    - [23, 0.0]
  - - [2048, 512, 1, 512]
    - [22, 0.0]
  - - [2560, 512, 1, 512]
    - [18, 0.0]
  - - [3072, 512, 1, 512]
    - [20, 0.0]
  - - [512, 1024, 1, 512]
    - [19, 0.0]
  - - [1024, 1024, 1, 512]
    - [29, 0.0]
  - - [1536, 1024, 1, 512]
    - [31, 0.0]
  - - [2048, 1024, 1, 512]
    - [23, 0.0]
  - - [2560, 1024, 1, 512]
    - [30, 0.0]
  - - [3072, 1024, 1, 512]
    - [1, 0.0]
  - - [512, 1536, 1, 512]
    - [20, 0.0]
  - - [1024, 1536, 1, 512]
    - [20, 0.0]
  - - [1536, 1536, 1, 512]
    - [27, 0.0]
  - - [2048, 1536, 1, 512]
    - [1, 0.0]
  - - [2560, 1536, 1, 512]
    - [1, 0.0]
  - - [3072, 1536, 1, 512]
    - [33, 0.0]
  - - [512, 2048, 1, 512]
    - [20, 0.0]
  - - [1024, 2048, 1, 512]
    - [20, 0.0]
  - - [1536, 2048, 1, 512]
    - [1, 0.0]
  - - [2048, 2048, 1, 512]
    - [25, 0.0]
  - - [2560, 2048, 1, 512]
    - [28, 0.0]
  - - [3072, 2048, 1, 512]
    - [26, 0.0]
  - - [512, 2560, 1, 512]
    - [34, 0.0]
  - - [1024, 2560, 1, 512]
    - [20, 0.0]
  - - [1536, 2560, 1, 512]
    - [1, 0.0]
  - - [2048, 2560, 1, 512]
    - [1, 0.0]
  - - [2560, 2560, 1, 512]
    - [35, 0.0]
  - - [3072, 2560, 1, 512]
    - [27, 0.0]
  - - [512, 3072, 1, 512]
    - [34, 0.0]
  - - [1024, 3072, 1, 512]
    - [21, 0.0]
  - - [1536, 3072, 1, 512]
    - [1, 0.0]
  - - [2048, 3072, 1, 512]
    - [25, 0.0]
  - - [2560, 3072, 1, 512]
    - [28, 0.0]
  - - [3072, 3072, 1, 512]
    - [1, 0.0]
  - - [512, 512, 1, 1024]
    - [22, 0.0]
  - - [1024, 512, 1, 1024]
    - [22, 0.0]
  - - [1536, 512, 1, 1024]
    - [29, 0.0]
  - - [2048, 512, 1, 1024]
    - [22, 0.0]
  - - [2560, 512, 1, 1024]
    - [1, 0.0]
  - - [3072, 512, 1, 1024]
    - [20, 0.0]
  - - [512, 1024, 1, 1024]
    - [20, 0.0]
  - - [1024, 1024, 1, 1024]
    - [29, 0.0]
  - - [1536, 1024, 1, 1024]
    - [31, 0.0]
  - - [2048, 1024, 1, 1024]
    - [28, 0.0]
  - - [2560, 1024, 1, 1024]
    - [1, 0.0]
  - - [3072, 1024, 1, 1024]
    - [18, 0.0]
  - - [512, 1536, 1, 1024]
    - [20, 0.0]
  - - [1024, 1536, 1, 1024]
    - [20, 0.0]
  - - [1536, 1536, 1, 1024]
    - [22, 0.0]
  - - [2048, 1536, 1, 1024]
    - [28, 0.0]
  - - [2560, 1536, 1, 1024]
    - [1, 0.0]
  - - [3072, 1536, 1, 1024]
    - [18, 0.0]
  - - [512, 2048, 1, 1024]
    - [29, 0.0]
  - - [1024, 2048, 1, 1024]
    - [22, 0.0]
  - - [1536, 2048, 1, 1024]
    - [1, 0.0]
  - - [2048, 2048, 1, 1024]
    - [18, 0.0]
  - - [2560, 2048, 1, 1024]
    - [22, 0.0]
  - - [3072, 2048, 1, 1024]
    - [1, 0.0]
  - - [512, 2560, 1, 1024]
    - [20, 0.0]
  - - [1024, 2560, 1, 1024]
    - [1, 0.0]
  - - [1536, 2560, 1, 1024]
    - [20, 0.0]
  - - [2048, 2560, 1, 1024]
    - [31, 0.0]
  - - [2560, 2560, 1, 1024]
    - [1, 0.0]
  - - [3072, 2560, 1, 1024]
    - [18, 0.0]
  - - [512, 3072, 1, 1024]
    - [29, 0.0]
  - - [1024, 3072, 1, 1024]
    - [1, 0.0]
  - - [1536, 3072, 1, 1024]
    - [20, 0.0]
  - - [2048, 3072, 1, 1024]
    - [1, 0.0]
  - - [2560, 3072, 1, 1024]
    - [18, 0.0]
  - - [3072, 3072, 1, 1024]
    - [18, 0.0]
  - - [512, 512, 1, 2048]
    - [20, 0.0]
  - - [1024, 512, 1, 2048]
    - [22, 0.0]
  - - [1536, 512, 1, 2048]
    - [22, 0.0]
  - - [2048, 512, 1, 2048]
    - [29, 0.0]
  - - [2560, 512, 1, 2048]
    - [18, 0.0]
  - - [3072, 512, 1, 2048]
    - [22, 0.0]
  - - [512, 1024, 1, 2048]
    - [22, 0.0]
  - - [1024, 1024, 1, 2048]
    - [20, 0.0]
  - - [1536, 1024, 1, 2048]
    - [20, 0.0]
  - - [2048, 1024, 1, 2048]
    - [20, 0.0]
  - - [2560, 1024, 1, 2048]
    - [18, 0.0]
  - - [3072, 1024, 1, 2048]
    - [18, 0.0]
  - - [512, 1536, 1, 2048]
    - [20, 0.0]
  - - [1024, 1536, 1, 2048]
    - [20, 0.0]
  - - [1536, 1536, 1, 2048]
    - [22, 0.0]
  - - [2048, 1536, 1, 2048]
    - [20, 0.0]
  - - [2560, 1536, 1, 2048]
    - [18, 0.0]
  - - [3072, 1536, 1, 2048]
    - [20, 0.0]
  - - [512, 2048, 1, 2048]
    - [18, 0.0]
  - - [1024, 2048, 1, 2048]
    - [34, 0.0]
  - - [1536, 2048, 1, 2048]
    - [29, 0.0]
  - - [2048, 2048, 1, 2048]
    - [19, 0.0]
  - - [2560, 2048, 1, 2048]
    - [34, 0.0]
  - - [3072, 2048, 1, 2048]
    - [18, 0.0]
  - - [512, 2560, 1, 2048]
    - [18, 0.0]
  - - [1024, 2560, 1, 2048]
    - [18, 0.0]
  - - [1536, 2560, 1, 2048]
    - [18, 0.0]
  - - [2048, 2560, 1, 2048]
    - [22, 0.0]
  - - [2560, 2560, 1, 2048]
    - [18, 0.0]
  - - [3072, 2560, 1, 2048]
    - [20, 0.0]
  - - [512, 3072, 1, 2048]
    - [23, 0.0]
  - - [1024, 3072, 1, 2048]
    - [28, 0.0]
  - - [1536, 3072, 1, 2048]
    - [1, 0.0]
  - - [2048, 3072, 1, 2048]
    - [20, 0.0]
  - - [2560, 3072, 1, 2048]
    - [18, 0.0]
  - - [3072, 3072, 1, 2048]
    - [20, 0.0]
  - - [512, 512, 1, 3072]
    - [20, 0.0]
  - - [1024, 512, 1, 3072]
    - [22, 0.0]
  - - [1536, 512, 1, 3072]
    - [20, 0.0]
  - - [2048, 512, 1, 3072]
    - [20, 0.0]
  - - [2560, 512, 1, 3072]
    - [20, 0.0]
  - - [3072, 512, 1, 3072]
    - [22, 0.0]
  - - [512, 1024, 1, 3072]
    - [20, 0.0]
  - - [1024, 1024, 1, 3072]
    - [19, 0.0]
  - - [1536, 1024, 1, 3072]
    - [18, 0.0]
  - - [2048, 1024, 1, 3072]
    - [20, 0.0]
  - - [2560, 1024, 1, 3072]
    - [20, 0.0]
  - - [3072, 1024, 1, 3072]
    - [20, 0.0]
  - - [512, 1536, 1, 3072]
    - [20, 0.0]
  - - [1024, 1536, 1, 3072]
    - [20, 0.0]
  - - [1536, 1536, 1, 3072]
    - [20, 0.0]
  - - [2048, 1536, 1, 3072]
    - [34, 0.0]
  - - [2560, 1536, 1, 3072]
    - [22, 0.0]
  - - [3072, 1536, 1, 3072]
    - [18, 0.0]
  - - [512, 2048, 1, 3072]
    - [29, 0.0]
  - - [1024, 2048, 1, 3072]
    - [18, 0.0]
  - - [1536, 2048, 1, 3072]
    - [18, 0.0]
  - - [2048, 2048, 1, 3072]
    - [1, 0.0]
  - - [2560, 2048, 1, 3072]
    - [20, 0.0]
  - - [3072, 2048, 1, 3072]
    - [20, 0.0]
  - - [512, 2560, 1, 3072]
    - [18, 0.0]
  - - [1024, 2560, 1, 3072]
    - [18, 0.0]
  - - [1536, 2560, 1, 3072]
    - [18, 0.0]
  - - [2048, 2560, 1, 3072]
    - [18, 0.0]
  - - [2560, 2560, 1, 3072]
    - [20, 0.0]
  - - [3072, 2560, 1, 3072]
    - [18, 0.0]
  - - [512, 3072, 1, 3072]
    - [27, 0.0]
  - - [1024, 3072, 1, 3072]
    - [20, 0.0]
  - - [1536, 3072, 1, 3072]
    - [20, 0.0]
  - - [2048, 3072, 1, 3072]
    - [18, 0.0]
  - - [2560, 3072, 1, 3072]
    - [31, 0.0]
  - - [3072, 3072, 1, 3072]
    - [28, 0.0]
  - - [64, 1, 1, 1]
    - [36, 0.0]
  - - [64, 64, 1, 1]
    - [37, 0.0]
  - - [64, 1, 1, 64]
    - [38, 0.0]
  - - [64, 64, 1, 64]
    - [39, 0.0]
  - - [64, 64, 1, 256]
    - [40, 0.0]
  - - [64, 64, 1, 512]
    - [41, 0.0]
  - - [64, 64, 1, 1024]
    - [17, 0.0]
  - - [64, 64, 1, 2048]
    - [42, 0.0]
  - - [64, 64, 1, 4096]
    - [41, 0.0]
- null
- null
- DeviceEfficiency
- GridBased
