library/src/amd_detail/rocblaslt/src/Tensile/Logic/asm_full/gfx1200/GridBased/gfx1200_Cijk_Alik_Bjlk_BBS_BH_Bias_HAS_SAV_UserArgs.yaml
- {MinimumRequiredVersion: 4.33.0}
- gfx1200
- gfx1200
- [Device 73f0]
    SolutionIndex: 0
    SolutionNameMin: Cijk_Alik_Bjlk_BBS_BH_Bias_HAS_SAV_UserArgs_MT32x32x32_MI16x16x1_SN_LDSB0_CLR1_GSU1_LBSPPA128_LBSPPB512_MIWT1_1_PGR1_PLR1_SS0_SU32_SUM0_SUS256_SVW8_TLDS1_WG32_4_1_WGM8
    SolutionIndex: 1
    SolutionNameMin: Cijk_Alik_Bjlk_BBS_BH_Bias_HAS_SAV_UserArgs_MT32x32x32_MI16x16x1_SN_LDSB0_CLR0_GSU1_LBSPPA128_LBSPPB512_MIWT1_1_PGR2_PLR0_SS0_SU32_SUM0_SUS256_SVW8_TLDS1_WG32_4_1_WGM8
    SolutionIndex: 2
    SolutionNameMin: Cijk_Alik_Bjlk_BBS_BH_Bias_HAS_SAV_UserArgs_MT64x32x32_MI16x16x1_SN_LDSB0_CLR1_GSU1_LBSPPA128_LBSPPB512_MIWT2_1_PGR1_PLR1_SS0_SU32_SUM0_SUS256_SVW8_TLDS1_WG32_4_1_WGM8
    SolutionIndex: 3
    SolutionNameMin: Cijk_Alik_Bjlk_BBS_BH_Bias_HAS_SAV_UserArgs_MT64x32x32_MI16x16x1_SN_LDSB0_CLR0_GSU1_LBSPPA128_LBSPPB512_MIWT2_1_PGR1_PLR0_SS0_SU32_SUM0_SUS256_SVW8_TLDS1_WG32_4_1_WGM8
    SolutionIndex: 4
    SolutionNameMin: Cijk_Alik_Bjlk_BBS_BH_Bias_HAS_SAV_UserArgs_MT64x32x32_MI16x16x1_SN_LDSB0_CLR0_GSU1_LBSPPA128_LBSPPB512_MIWT2_1_PGR2_PLR0_SS0_SU32_SUM0_SUS256_SVW8_TLDS1_WG32_4_1_WGM8
    SolutionIndex: 5
    SolutionNameMin: Cijk_Alik_Bjlk_BBS_BH_Bias_HAS_SAV_UserArgs_MT32x64x32_MI16x16x1_SN_LDSB0_CLR1_GSU1_LBSPPA128_LBSPPB1024_MIWT2_1_PGR1_PLR1_SS0_SU32_SUM0_SUS256_SVW8_TLDS1_WG16_8_1_WGM8
    SolutionIndex: 6
    SolutionNameMin: Cijk_Alik_Bjlk_BBS_BH_Bias_HAS_SAV_UserArgs_MT32x64x32_MI16x16x1_SN_LDSB0_CLR1_GSU1_LBSPPA128_LBSPPB1024_MIWT2_1_PGR2_PLR1_SS0_SU32_SUM0_SUS256_SVW8_TLDS1_WG16_8_1_WGM8
    SolutionIndex: 7
    SolutionNameMin: Cijk_Alik_Bjlk_BBS_BH_Bias_HAS_SAV_UserArgs_MT32x64x32_MI16x16x1_SN_LDSB0_CLR0_GSU1_LBSPPA128_LBSPPB1024_MIWT2_1_PGR1_PLR0_SS0_SU32_SUM0_SUS256_SVW8_TLDS1_WG16_8_1_WGM8
    SolutionIndex: 8
    SolutionNameMin: Cijk_Alik_Bjlk_BBS_BH_Bias_HAS_SAV_UserArgs_MT32x64x32_MI16x16x1_SN_LDSB0_CLR0_GSU1_LBSPPA128_LBSPPB1024_MIWT2_1_PGR2_PLR0_SS0_SU32_SUM0_SUS256_SVW8_TLDS1_WG16_8_1_WGM8
    SolutionIndex: 9
    SolutionNameMin: Cijk_Alik_Bjlk_BBS_BH_Bias_HAS_SAV_UserArgs_MT32x32x64_MI16x16x1_SN_LDSB0_CLR1_GSU1_LBSPPA128_LBSPPB512_MIWT1_1_PGR1_PLR3_SS0_SU32_SUM0_SUS256_SVW8_TLDS1_WG32_4_1_WGM8
    SolutionIndex: 10
    SolutionNameMin: Cijk_Alik_Bjlk_BBS_BH_Bias_HAS_SAV_UserArgs_MT32x32x64_MI16x16x1_SN_LDSB0_CLR1_GSU1_LBSPPA128_LBSPPB512_MIWT1_1_PGR2_PLR3_SS0_SU32_SUM0_SUS256_SVW8_TLDS1_WG32_4_1_WGM8
    SolutionIndex: 11
    SolutionNameMin: Cijk_Alik_Bjlk_BBS_BH_Bias_HAS_SAV_UserArgs_MT64x32x64_MI16x16x1_SN_LDSB0_CLR1_GSU1_LBSPPA128_LBSPPB512_MIWT2_1_PGR1_PLR1_SS0_SU32_SUM0_SUS256_SVW8_TLDS1_WG32_4_1_WGM8
    SolutionIndex: 12
    SolutionNameMin: Cijk_Alik_Bjlk_BBS_BH_Bias_HAS_SAV_UserArgs_MT32x64x64_MI16x16x1_SN_LDSB0_CLR1_GSU1_LBSPPA128_LBSPPB1024_MIWT2_1_PGR1_PLR3_SS0_SU32_SUM0_SUS256_SVW8_TLDS1_WG16_8_1_WGM8
    SolutionIndex: 13
    SolutionNameMin: Cijk_Alik_Bjlk_BBS_BH_Bias_HAS_SAV_UserArgs_MT32x32x32_MI16x16x1_SN_LDSB0_CLR1_GSU1_LBSPPA128_LBSPPB512_MIWT1_1_PGR1_PLR1_SS1_SU32_SUM0_SUS256_SVW1_TLDS1_WG32_4_1_WGM8
    SolutionIndex: 14
    SolutionNameMin: Cijk_Alik_Bjlk_BBS_BH_Bias_HAS_SAV_UserArgs_MT32x32x32_MI16x16x1_SN_LDSB0_CLR0_GSU1_LBSPPA128_LBSPPB512_MIWT1_1_PGR1_PLR0_SS1_SU32_SUM0_SUS256_SVW1_TLDS1_WG32_4_1_WGM8
    SolutionIndex: 15
    SolutionNameMin: Cijk_Alik_Bjlk_BBS_BH_Bias_HAS_SAV_UserArgs_MT64x32x32_MI16x16x1_SN_LDSB0_CLR1_GSU1_LBSPPA128_LBSPPB512_MIWT2_1_PGR1_PLR1_SS1_SU32_SUM0_SUS256_SVW1_TLDS1_WG32_4_1_WGM8
    SolutionIndex: 16
    SolutionNameMin: Cijk_Alik_Bjlk_BBS_BH_Bias_HAS_SAV_UserArgs_MT64x32x32_MI16x16x1_SN_LDSB0_CLR1_GSU1_LBSPPA128_LBSPPB512_MIWT2_1_PGR2_PLR1_SS1_SU32_SUM0_SUS256_SVW1_TLDS1_WG32_4_1_WGM8
    SolutionIndex: 17
    SolutionNameMin: Cijk_Alik_Bjlk_BBS_BH_Bias_HAS_SAV_UserArgs_MT64x32x32_MI16x16x1_SN_LDSB0_CLR0_GSU1_LBSPPA128_LBSPPB512_MIWT2_1_PGR1_PLR0_SS1_SU32_SUM0_SUS256_SVW1_TLDS1_WG32_4_1_WGM8
    SolutionIndex: 18
    SolutionNameMin: Cijk_Alik_Bjlk_BBS_BH_Bias_HAS_SAV_UserArgs_MT32x64x32_MI16x16x1_SN_LDSB0_CLR1_GSU1_LBSPPA128_LBSPPB1024_MIWT2_1_PGR1_PLR1_SS1_SU32_SUM0_SUS256_SVW1_TLDS1_WG16_8_1_WGM8
    SolutionIndex: 19
    SolutionNameMin: Cijk_Alik_Bjlk_BBS_BH_Bias_HAS_SAV_UserArgs_MT32x64x32_MI16x16x1_SN_LDSB0_CLR0_GSU1_LBSPPA128_LBSPPB1024_MIWT2_1_PGR1_PLR0_SS1_SU32_SUM0_SUS256_SVW1_TLDS1_WG16_8_1_WGM8
    SolutionIndex: 20
    SolutionNameMin: Cijk_Alik_Bjlk_BBS_BH_Bias_HAS_SAV_UserArgs_MT32x32x64_MI16x16x1_SN_LDSB0_CLR1_GSU1_LBSPPA128_LBSPPB512_MIWT1_1_PGR1_PLR1_SS1_SU32_SUM0_SUS256_SVW1_TLDS1_WG32_4_1_WGM8
    SolutionIndex: 21
    SolutionNameMin: Cijk_Alik_Bjlk_BBS_BH_Bias_HAS_SAV_UserArgs_MT32x32x64_MI16x16x1_SN_LDSB0_CLR1_GSU1_LBSPPA128_LBSPPB512_MIWT1_1_PGR1_PLR3_SS1_SU32_SUM0_SUS256_SVW1_TLDS1_WG32_4_1_WGM8
    SolutionIndex: 22
    SolutionNameMin: Cijk_Alik_Bjlk_BBS_BH_Bias_HAS_SAV_UserArgs_MT32x32x64_MI16x16x1_SN_LDSB0_CLR0_GSU1_LBSPPA128_LBSPPB512_MIWT1_1_PGR1_PLR0_SS1_SU32_SUM0_SUS256_SVW1_TLDS1_WG32_4_1_WGM8
    SolutionIndex: 23
    SolutionNameMin: Cijk_Alik_Bjlk_BBS_BH_Bias_HAS_SAV_UserArgs_MT32x32x64_MI16x16x1_SN_LDSB0_CLR0_GSU1_LBSPPA128_LBSPPB512_MIWT1_1_PGR2_PLR0_SS1_SU32_SUM0_SUS256_SVW1_TLDS1_WG32_4_1_WGM8
- - - [512, 512, 1, 64, 512, 512, 64, 512]
    - [3, 1073.43]
  - - [1024, 512, 1, 64, 1024, 1024, 64, 512]
    - [16, 2031.02]
  - - [1536, 512, 1, 64, 1536, 1536, 64, 512]
    - [4, 2901.38]
  - - [2048, 512, 1, 64, 2048, 2048, 64, 512]
    - [5, 3679.42]
  - - [2560, 512, 1, 64, 2560, 2560, 64, 512]
    - [7, 4334.86]
  - - [3072, 512, 1, 64, 3072, 3072, 64, 512]
    - [5, 4978.89]
  - - [512, 1024, 1, 64, 512, 512, 64, 1024]
    - [17, 2024.89]
  - - [1024, 1024, 1, 64, 1024, 1024, 64, 1024]
    - [8, 3685.38]
  - - [1536, 1024, 1, 64, 1536, 1536, 64, 1024]
    - [8, 4986.29]
  - - [2048, 1024, 1, 64, 2048, 2048, 64, 1024]
    - [8, 5846.23]
  - - [2560, 1024, 1, 64, 2560, 2560, 64, 1024]
    - [2, 6764.6]
  - - [3072, 1024, 1, 64, 3072, 3072, 64, 1024]
    - [7, 7379.74]
  - - [512, 1536, 1, 64, 512, 512, 64, 1536]
    - [5, 2893.87]
  - - [1024, 1536, 1, 64, 1024, 1024, 64, 1536]
    - [7, 4975.2]
  - - [1536, 1536, 1, 64, 1536, 1536, 64, 1536]
    - [5, 6473.8]
  - - [2048, 1536, 1, 64, 2048, 2048, 64, 1536]
    - [8, 7702.15]
  - - [2560, 1536, 1, 64, 2560, 2560, 64, 1536]
    - [6, 8691.51]
  - - [3072, 1536, 1, 64, 3072, 3072, 64, 1536]
    - [2, 9456.39]
  - - [512, 2048, 1, 64, 512, 512, 64, 2048]
    - [7, 3676.29]
  - - [1024, 2048, 1, 64, 1024, 1024, 64, 2048]
    - [7, 5870.52]
  - - [1536, 2048, 1, 64, 1536, 1536, 64, 2048]
    - [6, 7396.0]
  - - [2048, 2048, 1, 64, 2048, 2048, 64, 2048]
    - [6, 8861.6]
  - - [2560, 2048, 1, 64, 2560, 2560, 64, 2048]
    - [4, 10268.7]
  - - [3072, 2048, 1, 64, 3072, 3072, 64, 2048]
    - [2, 11153.1]
  - - [512, 2560, 1, 64, 512, 512, 64, 2560]
    - [7, 4322.58]
  - - [1024, 2560, 1, 64, 1024, 1024, 64, 2560]
    - [2, 6761.87]
  - - [1536, 2560, 1, 64, 1536, 1536, 64, 2560]
    - [2, 8476.05]
  - - [2048, 2560, 1, 64, 2048, 2048, 64, 2560]
    - [2, 9892.66]
  - - [2560, 2560, 1, 64, 2560, 2560, 64, 2560]
    - [7, 11436.9]
  - - [3072, 2560, 1, 64, 3072, 3072, 64, 2560]
    - [7, 12217.2]
  - - [512, 3072, 1, 64, 512, 512, 64, 3072]
    - [2, 4997.56]
  - - [1024, 3072, 1, 64, 1024, 1024, 64, 3072]
    - [5, 7681.58]
  - - [1536, 3072, 1, 64, 1536, 1536, 64, 3072]
    - [5, 9529.65]
  - - [2048, 3072, 1, 64, 2048, 2048, 64, 3072]
    - [2, 11187.0]
  - - [2560, 3072, 1, 64, 2560, 2560, 64, 3072]
    - [6, 12155.1]
  - - [3072, 3072, 1, 64, 3072, 3072, 64, 3072]
    - [6, 13113.9]
  - - [512, 512, 1, 256, 512, 512, 256, 512]
    - [0, 3785.37]
  - - [1024, 512, 1, 256, 1024, 1024, 256, 512]
    - [18, 7049.07]
  - - [1536, 512, 1, 256, 1536, 1536, 256, 512]
    - [2, 8923.06]
  - - [2048, 512, 1, 256, 2048, 2048, 256, 512]
    - [5, 11131.5]
  - - [2560, 512, 1, 256, 2560, 2560, 256, 512]
    - [5, 12605.0]
  - - [3072, 512, 1, 256, 3072, 3072, 256, 512]
    - [5, 14317.8]
  - - [512, 1024, 1, 256, 512, 512, 256, 1024]
    - [5, 6926.83]
  - - [1024, 1024, 1, 256, 1024, 1024, 256, 1024]
    - [5, 11048.8]
  - - [1536, 1024, 1, 256, 1536, 1536, 256, 1024]
    - [5, 14277.0]
  - - [2048, 1024, 1, 256, 2048, 2048, 256, 1024]
    - [5, 16142.9]
  - - [2560, 1024, 1, 256, 2560, 2560, 256, 1024]
    - [5, 18177.1]
  - - [3072, 1024, 1, 256, 3072, 3072, 256, 1024]
    - [5, 19746.9]
  - - [512, 1536, 1, 256, 512, 512, 256, 1536]
    - [2, 8809.64]
  - - [1024, 1536, 1, 256, 1024, 1024, 256, 1536]
    - [5, 14325.2]
  - - [1536, 1536, 1, 256, 1536, 1536, 256, 1536]
    - [5, 16778.4]
  - - [2048, 1536, 1, 256, 2048, 2048, 256, 1536]
    - [5, 19507.2]
  - - [2560, 1536, 1, 256, 2560, 2560, 256, 1536]
    - [5, 21414.1]
  - - [3072, 1536, 1, 256, 3072, 3072, 256, 1536]
    - [5, 22521.4]
  - - [512, 2048, 1, 256, 512, 512, 256, 2048]
    - [5, 11177.6]
  - - [1024, 2048, 1, 256, 1024, 1024, 256, 2048]
    - [5, 16477.8]
  - - [1536, 2048, 1, 256, 1536, 1536, 256, 2048]
    - [5, 19206.4]
  - - [2048, 2048, 1, 256, 2048, 2048, 256, 2048]
    - [5, 21914.4]
  - - [2560, 2048, 1, 256, 2560, 2560, 256, 2048]
    - [18, 23290.4]
  - - [3072, 2048, 1, 256, 3072, 3072, 256, 2048]
    - [2, 25254.6]
  - - [512, 2560, 1, 256, 512, 512, 256, 2560]
    - [5, 12560.1]
  - - [1024, 2560, 1, 256, 1024, 1024, 256, 2560]
    - [5, 18309.0]
  - - [1536, 2560, 1, 256, 1536, 1536, 256, 2560]
    - [18, 21438.9]
  - - [2048, 2560, 1, 256, 2048, 2048, 256, 2560]
    - [5, 23862.8]
  - - [2560, 2560, 1, 256, 2560, 2560, 256, 2560]
    - [5, 25223.2]
  - - [3072, 2560, 1, 256, 3072, 3072, 256, 2560]
    - [5, 26260.9]
  - - [512, 3072, 1, 256, 512, 512, 256, 3072]
    - [5, 14617.2]
  - - [1024, 3072, 1, 256, 1024, 1024, 256, 3072]
    - [5, 19600.0]
  - - [1536, 3072, 1, 256, 1536, 1536, 256, 3072]
    - [5, 22819.9]
  - - [2048, 3072, 1, 256, 2048, 2048, 256, 3072]
    - [18, 24518.9]
  - - [2560, 3072, 1, 256, 2560, 2560, 256, 3072]
    - [5, 26881.0]
  - - [3072, 3072, 1, 256, 3072, 3072, 256, 3072]
    - [5, 28107.9]
  - - [512, 512, 1, 512, 512, 512, 512, 512]
    - [14, 6848.89]
  - - [1024, 512, 1, 512, 1024, 1024, 512, 512]
    - [15, 11982.7]
  - - [1536, 512, 1, 512, 1536, 1536, 512, 512]
    - [5, 14376.6]
  - - [2048, 512, 1, 512, 2048, 2048, 512, 512]
    - [5, 17644.6]
  - - [2560, 512, 1, 512, 2560, 2560, 512, 512]
    - [2, 18699.8]
  - - [3072, 512, 1, 512, 3072, 3072, 512, 512]
    - [2, 21074.7]
  - - [512, 1024, 1, 512, 512, 512, 512, 1024]
    - [5, 11702.7]
  - - [1024, 1024, 1, 512, 1024, 1024, 512, 1024]
    - [5, 17166.7]
  - - [1536, 1024, 1, 512, 1536, 1536, 512, 1024]
    - [2, 20727.0]
  - - [2048, 1024, 1, 512, 2048, 2048, 512, 1024]
    - [5, 23018.0]
  - - [2560, 1024, 1, 512, 2560, 2560, 512, 1024]
    - [5, 24671.2]
  - - [3072, 1024, 1, 512, 3072, 3072, 512, 1024]
    - [5, 25799.7]
  - - [512, 1536, 1, 512, 512, 512, 512, 1536]
    - [5, 14054.7]
  - - [1024, 1536, 1, 512, 1024, 1024, 512, 1536]
    - [5, 20802.2]
  - - [1536, 1536, 1, 512, 1536, 1536, 512, 1536]
    - [5, 23307.5]
  - - [2048, 1536, 1, 512, 2048, 2048, 512, 1536]
    - [5, 26180.1]
  - - [2560, 1536, 1, 512, 2560, 2560, 512, 1536]
    - [5, 26902.4]
  - - [3072, 1536, 1, 512, 3072, 3072, 512, 1536]
    - [18, 29145.9]
  - - [512, 2048, 1, 512, 512, 512, 512, 2048]
    - [5, 17386.8]
  - - [1024, 2048, 1, 512, 1024, 1024, 512, 2048]
    - [5, 22873.3]
  - - [1536, 2048, 1, 512, 1536, 1536, 512, 2048]
    - [5, 25951.9]
  - - [2048, 2048, 1, 512, 2048, 2048, 512, 2048]
    - [5, 27960.6]
  - - [2560, 2048, 1, 512, 2560, 2560, 512, 2048]
    - [5, 29137.2]
  - - [3072, 2048, 1, 512, 3072, 3072, 512, 2048]
    - [5, 30931.5]
  - - [512, 2560, 1, 512, 512, 512, 512, 2560]
    - [5, 18376.7]
  - - [1024, 2560, 1, 512, 1024, 1024, 512, 2560]
    - [5, 24817.7]
  - - [1536, 2560, 1, 512, 1536, 1536, 512, 2560]
    - [2, 27388.4]
  - - [2048, 2560, 1, 512, 2048, 2048, 512, 2560]
    - [5, 29891.4]
  - - [2560, 2560, 1, 512, 2560, 2560, 512, 2560]
    - [5, 30563.3]
  - - [3072, 2560, 1, 512, 3072, 3072, 512, 2560]
    - [5, 31164.4]
  - - [512, 3072, 1, 512, 512, 512, 512, 3072]
    - [5, 20525.7]
  - - [1024, 3072, 1, 512, 1024, 1024, 512, 3072]
    - [5, 25977.0]
  - - [1536, 3072, 1, 512, 1536, 1536, 512, 3072]
    - [5, 28272.7]
  - - [2048, 3072, 1, 512, 2048, 2048, 512, 3072]
    - [19, 30206.4]
  - - [2560, 3072, 1, 512, 2560, 2560, 512, 3072]
    - [5, 31152.4]
  - - [3072, 3072, 1, 512, 3072, 3072, 512, 3072]
    - [18, 32358.8]
  - - [512, 512, 1, 1024, 512, 512, 1024, 512]
    - [11, 10931.6]
  - - [1024, 512, 1, 1024, 1024, 1024, 1024, 512]
    - [18, 18229.9]
  - - [1536, 512, 1, 1024, 1536, 1536, 1024, 512]
    - [5, 19081.1]
  - - [2048, 512, 1, 1024, 2048, 2048, 1024, 512]
    - [2, 23661.1]
  - - [2560, 512, 1, 1024, 2560, 2560, 1024, 512]
    - [2, 23604.1]
  - - [3072, 512, 1, 1024, 3072, 3072, 1024, 512]
    - [5, 27114.0]
  - - [512, 1024, 1, 1024, 512, 512, 1024, 1024]
    - [5, 17856.1]
  - - [1024, 1024, 1, 1024, 1024, 1024, 1024, 1024]
    - [5, 23962.4]
  - - [1536, 1024, 1, 1024, 1536, 1536, 1024, 1024]
    - [2, 26556.5]
  - - [2048, 1024, 1, 1024, 2048, 2048, 1024, 1024]
    - [2, 28979.3]
  - - [2560, 1024, 1, 1024, 2560, 2560, 1024, 1024]
    - [2, 29818.2]
  - - [3072, 1024, 1, 1024, 3072, 3072, 1024, 1024]
    - [5, 31276.0]
  - - [512, 1536, 1, 1024, 512, 512, 1024, 1536]
    - [18, 19903.3]
  - - [1024, 1536, 1, 1024, 1024, 1024, 1024, 1536]
    - [5, 27018.3]
  - - [1536, 1536, 1, 1024, 1536, 1536, 1024, 1536]
    - [5, 28359.0]
  - - [2048, 1536, 1, 1024, 2048, 2048, 1024, 1536]
    - [15, 30874.9]
  - - [2560, 1536, 1, 1024, 2560, 2560, 1024, 1536]
    - [5, 31459.5]
  - - [3072, 1536, 1, 1024, 3072, 3072, 1024, 1536]
    - [5, 33335.2]
  - - [512, 2048, 1, 1024, 512, 512, 1024, 2048]
    - [18, 23551.6]
  - - [1024, 2048, 1, 1024, 1024, 1024, 1024, 2048]
    - [5, 28713.3]
  - - [1536, 2048, 1, 1024, 1536, 1536, 1024, 2048]
    - [2, 31050.9]
  - - [2048, 2048, 1, 1024, 2048, 2048, 1024, 2048]
    - [15, 32339.3]
  - - [2560, 2048, 1, 1024, 2560, 2560, 1024, 2048]
    - [15, 33156.7]
  - - [3072, 2048, 1, 1024, 3072, 3072, 1024, 2048]
    - [7, 33588.5]
  - - [512, 2560, 1, 1024, 512, 512, 1024, 2560]
    - [5, 24055.5]
  - - [1024, 2560, 1, 1024, 1024, 1024, 1024, 2560]
    - [5, 29973.4]
  - - [1536, 2560, 1, 1024, 1536, 1536, 1024, 2560]
    - [5, 31716.6]
  - - [2048, 2560, 1, 1024, 2048, 2048, 1024, 2560]
    - [5, 33255.3]
  - - [2560, 2560, 1, 1024, 2560, 2560, 1024, 2560]
    - [15, 33757.2]
  - - [3072, 2560, 1, 1024, 3072, 3072, 1024, 2560]
    - [5, 34993.8]
  - - [512, 3072, 1, 1024, 512, 512, 1024, 3072]
    - [18, 26735.3]
  - - [1024, 3072, 1, 1024, 1024, 1024, 1024, 3072]
    - [2, 31153.2]
  - - [1536, 3072, 1, 1024, 1536, 1536, 1024, 3072]
    - [18, 32992.0]
  - - [2048, 3072, 1, 1024, 2048, 2048, 1024, 3072]
    - [15, 33486.0]
  - - [2560, 3072, 1, 1024, 2560, 2560, 1024, 3072]
    - [15, 34999.1]
  - - [3072, 3072, 1, 1024, 3072, 3072, 1024, 3072]
    - [18, 35551.7]
  - - [512, 512, 1, 2048, 512, 512, 2048, 512]
    - [0, 15422.7]
  - - [1024, 512, 1, 2048, 1024, 1024, 2048, 512]
    - [5, 24609.0]
  - - [1536, 512, 1, 2048, 1536, 1536, 2048, 512]
    - [5, 24688.3]
  - - [2048, 512, 1, 2048, 2048, 2048, 2048, 512]
    - [18, 29469.3]
  - - [2560, 512, 1, 2048, 2560, 2560, 2048, 512]
    - [5, 28286.7]
  - - [3072, 512, 1, 2048, 3072, 3072, 2048, 512]
    - [5, 31370.6]
  - - [512, 1024, 1, 2048, 512, 512, 2048, 1024]
    - [18, 24365.6]
  - - [1024, 1024, 1, 2048, 1024, 1024, 2048, 1024]
    - [18, 29530.0]
  - - [1536, 1024, 1, 2048, 1536, 1536, 2048, 1024]
    - [5, 31710.9]
  - - [2048, 1024, 1, 2048, 2048, 2048, 2048, 1024]
    - [18, 33016.7]
  - - [2560, 1024, 1, 2048, 2560, 2560, 2048, 1024]
    - [5, 33714.6]
  - - [3072, 1024, 1, 2048, 3072, 3072, 2048, 1024]
    - [5, 34140.4]
  - - [512, 1536, 1, 2048, 512, 512, 2048, 1536]
    - [18, 24552.8]
  - - [1024, 1536, 1, 2048, 1024, 1024, 2048, 1536]
    - [5, 32220.8]
  - - [1536, 1536, 1, 2048, 1536, 1536, 2048, 1536]
    - [5, 31678.7]
  - - [2048, 1536, 1, 2048, 2048, 2048, 2048, 1536]
    - [5, 34385.9]
  - - [2560, 1536, 1, 2048, 2560, 2560, 2048, 1536]
    - [18, 34005.1]
  - - [3072, 1536, 1, 2048, 3072, 3072, 2048, 1536]
    - [18, 35861.5]
  - - [512, 2048, 1, 2048, 512, 512, 2048, 2048]
    - [5, 29366.3]
  - - [1024, 2048, 1, 2048, 1024, 1024, 2048, 2048]
    - [18, 33100.7]
  - - [1536, 2048, 1, 2048, 1536, 1536, 2048, 2048]
    - [5, 34841.4]
  - - [2048, 2048, 1, 2048, 2048, 2048, 2048, 2048]
    - [18, 35080.9]
  - - [2560, 2048, 1, 2048, 2560, 2560, 2048, 2048]
    - [18, 36013.5]
  - - [3072, 2048, 1, 2048, 3072, 3072, 2048, 2048]
    - [18, 35677.1]
  - - [512, 2560, 1, 2048, 512, 512, 2048, 2560]
    - [18, 28233.0]
  - - [1024, 2560, 1, 2048, 1024, 1024, 2048, 2560]
    - [2, 33954.0]
  - - [1536, 2560, 1, 2048, 1536, 1536, 2048, 2560]
    - [5, 34481.3]
  - - [2048, 2560, 1, 2048, 2048, 2048, 2048, 2560]
    - [5, 35471.1]
  - - [2560, 2560, 1, 2048, 2560, 2560, 2048, 2560]
    - [5, 35929.2]
  - - [3072, 2560, 1, 2048, 3072, 3072, 2048, 2560]
    - [18, 36851.8]
  - - [512, 3072, 1, 2048, 512, 512, 2048, 3072]
    - [18, 31177.5]
  - - [1024, 3072, 1, 2048, 1024, 1024, 2048, 3072]
    - [2, 34497.5]
  - - [1536, 3072, 1, 2048, 1536, 1536, 2048, 3072]
    - [15, 35404.2]
  - - [2048, 3072, 1, 2048, 2048, 2048, 2048, 3072]
    - [5, 36686.5]
  - - [2560, 3072, 1, 2048, 2560, 2560, 2048, 3072]
    - [2, 35957.0]
  - - [3072, 3072, 1, 2048, 3072, 3072, 2048, 3072]
    - [5, 36288.9]
  - - [512, 512, 1, 3072, 512, 512, 3072, 512]
    - [12, 18245.2]
  - - [1024, 512, 1, 3072, 1024, 1024, 3072, 512]
    - [18, 27626.5]
  - - [1536, 512, 1, 3072, 1536, 1536, 3072, 512]
    - [18, 26896.1]
  - - [2048, 512, 1, 3072, 2048, 2048, 3072, 512]
    - [15, 31903.0]
  - - [2560, 512, 1, 3072, 2560, 2560, 3072, 512]
    - [5, 29824.2]
  - - [3072, 512, 1, 3072, 3072, 3072, 3072, 512]
    - [2, 33692.6]
  - - [512, 1024, 1, 3072, 512, 512, 3072, 1024]
    - [18, 27724.0]
  - - [1024, 1024, 1, 3072, 1024, 1024, 3072, 1024]
    - [5, 31541.2]
  - - [1536, 1024, 1, 3072, 1536, 1536, 3072, 1024]
    - [18, 33588.1]
  - - [2048, 1024, 1, 3072, 2048, 2048, 3072, 1024]
    - [2, 34428.1]
  - - [2560, 1024, 1, 3072, 2560, 2560, 3072, 1024]
    - [5, 35129.3]
  - - [3072, 1024, 1, 3072, 3072, 3072, 3072, 1024]
    - [2, 35697.6]
  - - [512, 1536, 1, 3072, 512, 512, 3072, 1536]
    - [5, 27130.8]
  - - [1024, 1536, 1, 3072, 1024, 1024, 3072, 1536]
    - [2, 33556.6]
  - - [1536, 1536, 1, 3072, 1536, 1536, 3072, 1536]
    - [5, 33857.4]
  - - [2048, 1536, 1, 3072, 2048, 2048, 3072, 1536]
    - [15, 35248.3]
  - - [2560, 1536, 1, 3072, 2560, 2560, 3072, 1536]
    - [5, 34363.8]
  - - [3072, 1536, 1, 3072, 3072, 3072, 3072, 1536]
    - [15, 36690.7]
  - - [512, 2048, 1, 3072, 512, 512, 3072, 2048]
    - [18, 31731.4]
  - - [1024, 2048, 1, 3072, 1024, 1024, 3072, 2048]
    - [5, 34921.8]
  - - [1536, 2048, 1, 3072, 1536, 1536, 3072, 2048]
    - [5, 35370.4]
  - - [2048, 2048, 1, 3072, 2048, 2048, 3072, 2048]
    - [15, 35519.8]
  - - [2560, 2048, 1, 3072, 2560, 2560, 3072, 2048]
    - [5, 35970.6]
  - - [3072, 2048, 1, 3072, 3072, 3072, 3072, 2048]
    - [18, 36914.0]
  - - [512, 2560, 1, 3072, 512, 512, 3072, 2560]
    - [5, 30214.4]
  - - [1024, 2560, 1, 3072, 1024, 1024, 3072, 2560]
    - [5, 35278.1]
  - - [1536, 2560, 1, 3072, 1536, 1536, 3072, 2560]
    - [5, 35543.4]
  - - [2048, 2560, 1, 3072, 2048, 2048, 3072, 2560]
    - [5, 36044.8]
  - - [2560, 2560, 1, 3072, 2560, 2560, 3072, 2560]
    - [5, 35777.6]
  - - [3072, 2560, 1, 3072, 3072, 3072, 3072, 2560]
    - [5, 36490.7]
  - - [512, 3072, 1, 3072, 512, 512, 3072, 3072]
    - [18, 33332.8]
  - - [1024, 3072, 1, 3072, 1024, 1024, 3072, 3072]
    - [15, 35243.8]
  - - [1536, 3072, 1, 3072, 1536, 1536, 3072, 3072]
    - [18, 36108.4]
  - - [2048, 3072, 1, 3072, 2048, 2048, 3072, 3072]
    - [18, 36702.8]
  - - [2560, 3072, 1, 3072, 2560, 2560, 3072, 3072]
    - [2, 36673.0]
  - - [3072, 3072, 1, 3072, 3072, 3072, 3072, 3072]
    - [18, 36832.9]
  - - [1, 1, 1, 1, 1, 1, 1, 1]
    - [14, 6.62098e-05]
  - - [1, 1, 1, 64, 1, 1, 64, 1]
    - [22, 0.00423182]
  - - [1, 64, 1, 1, 1, 1, 1, 64]
    - [23, 0.0041106]
  - - [64, 1, 1, 1, 64, 64, 1, 1]
    - [13, 0.00424586]
  - - [64, 64, 1, 1, 64, 64, 1, 64]
    - [1, 0.275121]
  - - [64, 1, 1, 64, 64, 64, 64, 1]
    - [21, 0.270658]
  - - [1, 64, 1, 64, 1, 1, 64, 64]
    - [22, 0.272277]
  - - [64, 64, 1, 64, 64, 64, 64, 64]
    - [10, 17.7634]
  - - [64, 64, 1, 256, 64, 64, 256, 64]
    - [21, 62.5791]
  - - [64, 64, 1, 512, 64, 64, 512, 64]
    - [9, 115.073]
  - - [64, 64, 1, 1024, 64, 64, 1024, 64]
    - [22, 206.784]
  - - [64, 64, 1, 2048, 64, 64, 2048, 64]
    - [21, 324.844]
  - - [64, 64, 1, 4096, 64, 64, 4096, 64]
    - [20, 446.428]
- null
- null
- DeviceEfficiency
- GridBased
