library/src/amd_detail/rocblaslt/src/Tensile/Logic/asm_full/gfx1200/GridBased/gfx1200_Cijk_Alik_Bjlk_I8II_BH_HAI_SAV_UserArgs.yaml
- {MinimumRequiredVersion: 4.33.0}
- gfx1200
- gfx1200
- [Device 73f0]
    SolutionIndex: 0
    SolutionNameMin: Cijk_Alik_Bjlk_I8II_BH_HAI_SAV_UserArgs_MT32x64x32_MI16x16x1_SN_LDSB0_CLR1_GRVWA8_GRVWB16_GSU1_LBSPPA128_LBSPPB512_LPA8_MIWT2_1_PGR1_PLR1_SS0_SU32_SUM0_SUS256_SVW8_TLDS1_WG16_8_1_WGM8
    SolutionIndex: 1
    SolutionNameMin: Cijk_Alik_Bjlk_I8II_BH_HAI_SAV_UserArgs_MT32x64x32_MI16x16x1_SN_LDSB0_CLR0_GRVWA8_GRVWB16_GSU1_LBSPPA128_LBSPPB512_LPA8_MIWT2_1_PGR2_PLR0_SS0_SU32_SUM0_SUS256_SVW8_TLDS1_WG16_8_1_WGM8
    SolutionIndex: 2
    SolutionNameMin: Cijk_Alik_Bjlk_I8II_BH_HAI_SAV_UserArgs_MT256x16x64_MI16x16x1_SN_LDSB1_CLR1_GRVWA8_GRVWB8_GSU1_LBSPPA128_LBSPPB128_LPA8_MIWT4_1_PGR1_PLR1_SS0_SU32_SUM0_SUS256_SVW8_TLDS1_WG64_2_1_WGM8
    SolutionIndex: 3
    SolutionNameMin: Cijk_Alik_Bjlk_I8II_BH_HAI_SAV_UserArgs_MT256x16x64_MI16x16x1_SN_LDSB1_CLR1_GRVWA8_GRVWB8_GSU1_LBSPPA128_LBSPPB128_LPA8_MIWT4_1_PGR2_PLR1_SS0_SU32_SUM0_SUS256_SVW8_TLDS1_WG64_2_1_WGM8
    SolutionIndex: 4
    SolutionNameMin: Cijk_Alik_Bjlk_I8II_BH_HAI_SAV_UserArgs_MT256x16x64_MI16x16x1_SN_LDSB1_CLR1_GRVWA8_GRVWB8_GSU1_LBSPPA128_LBSPPB128_LPA8_MIWT4_1_PGR1_PLR3_SS0_SU32_SUM0_SUS256_SVW8_TLDS1_WG64_2_1_WGM8
    SolutionIndex: 5
    SolutionNameMin: Cijk_Alik_Bjlk_I8II_BH_HAI_SAV_UserArgs_MT256x16x64_MI16x16x1_SN_LDSB1_CLR1_GRVWA8_GRVWB8_GSU1_LBSPPA128_LBSPPB128_LPA8_MIWT4_1_PGR2_PLR3_SS0_SU32_SUM0_SUS256_SVW8_TLDS1_WG64_2_1_WGM8
    SolutionIndex: 6
    SolutionNameMin: Cijk_Alik_Bjlk_I8II_BH_HAI_SAV_UserArgs_MT64x32x64_MI16x16x1_SN_LDSB0_CLR1_GRVWA8_GRVWB16_GSU1_LBSPPA128_LBSPPB256_LPA8_MIWT2_1_PGR1_PLR1_SS0_SU32_SUM0_SUS256_SVW8_TLDS1_WG32_4_1_WGM8
    SolutionIndex: 7
    SolutionNameMin: Cijk_Alik_Bjlk_I8II_BH_HAI_SAV_UserArgs_MT64x32x64_MI16x16x1_SN_LDSB0_CLR1_GRVWA8_GRVWB16_GSU1_LBSPPA128_LBSPPB256_LPA8_MIWT2_1_PGR1_PLR3_SS0_SU32_SUM0_SUS256_SVW8_TLDS1_WG32_4_1_WGM8
    SolutionIndex: 8
    SolutionNameMin: Cijk_Alik_Bjlk_I8II_BH_HAI_SAV_UserArgs_MT32x64x64_MI16x16x1_SN_LDSB0_CLR1_GRVWA8_GRVWB16_GSU1_LBSPPA128_LBSPPB512_LPA8_MIWT2_1_PGR1_PLR1_SS0_SU32_SUM0_SUS256_SVW8_TLDS1_WG16_8_1_WGM8
    SolutionIndex: 9
    SolutionNameMin: Cijk_Alik_Bjlk_I8II_BH_HAI_SAV_UserArgs_MT32x64x64_MI16x16x1_SN_LDSB0_CLR1_GRVWA8_GRVWB16_GSU1_LBSPPA128_LBSPPB512_LPA8_MIWT2_1_PGR1_PLR3_SS0_SU32_SUM0_SUS256_SVW8_TLDS1_WG16_8_1_WGM8
    SolutionIndex: 10
    SolutionNameMin: Cijk_Alik_Bjlk_I8II_BH_HAI_SAV_UserArgs_MT32x64x64_MI16x16x1_SN_LDSB0_CLR0_GRVWA8_GRVWB16_GSU1_LBSPPA128_LBSPPB512_LPA8_MIWT2_1_PGR1_PLR0_SS0_SU32_SUM0_SUS256_SVW8_TLDS1_WG16_8_1_WGM8
    SolutionIndex: 11
    SolutionNameMin: Cijk_Alik_Bjlk_I8II_BH_HAI_SAV_UserArgs_MT32x32x32_MI16x16x1_SN_LDSB0_CLR0_GRVWA8_GRVWB8_GSU1_LBSPPA128_LBSPPB256_LPA8_MIWT1_1_PGR1_PLR0_SS1_SU32_SUM0_SUS256_SVW1_TLDS1_WG32_4_1_WGM8
    SolutionIndex: 12
    SolutionNameMin: Cijk_Alik_Bjlk_I8II_BH_HAI_SAV_UserArgs_MT32x32x32_MI16x16x1_SN_LDSB0_CLR0_GRVWA8_GRVWB8_GSU1_LBSPPA128_LBSPPB256_LPA8_MIWT1_1_PGR2_PLR0_SS1_SU32_SUM0_SUS256_SVW1_TLDS1_WG32_4_1_WGM8
    SolutionIndex: 13
    SolutionNameMin: Cijk_Alik_Bjlk_I8II_BH_HAI_SAV_UserArgs_MT64x32x32_MI16x16x1_SN_LDSB0_CLR0_GRVWA8_GRVWB8_GSU1_LBSPPA128_LBSPPB256_LPA8_MIWT2_1_PGR1_PLR0_SS1_SU32_SUM0_SUS256_SVW1_TLDS1_WG32_4_1_WGM8
    SolutionIndex: 14
    SolutionNameMin: Cijk_Alik_Bjlk_I8II_BH_HAI_SAV_UserArgs_MT32x64x32_MI16x16x1_SN_LDSB0_CLR1_GRVWA8_GRVWB16_GSU1_LBSPPA128_LBSPPB512_LPA8_MIWT2_1_PGR1_PLR1_SS1_SU32_SUM0_SUS256_SVW1_TLDS1_WG16_8_1_WGM8
    SolutionIndex: 15
    SolutionNameMin: Cijk_Alik_Bjlk_I8II_BH_HAI_SAV_UserArgs_MT32x64x32_MI16x16x1_SN_LDSB0_CLR1_GRVWA8_GRVWB16_GSU1_LBSPPA128_LBSPPB512_LPA8_MIWT2_1_PGR2_PLR1_SS1_SU32_SUM0_SUS256_SVW1_TLDS1_WG16_8_1_WGM8
    SolutionIndex: 16
    SolutionNameMin: Cijk_Alik_Bjlk_I8II_BH_HAI_SAV_UserArgs_MT32x64x32_MI16x16x1_SN_LDSB0_CLR0_GRVWA8_GRVWB16_GSU1_LBSPPA128_LBSPPB512_LPA8_MIWT2_1_PGR1_PLR0_SS1_SU32_SUM0_SUS256_SVW1_TLDS1_WG16_8_1_WGM8
    SolutionIndex: 17
    SolutionNameMin: Cijk_Alik_Bjlk_I8II_BH_HAI_SAV_UserArgs_MT32x64x32_MI16x16x1_SN_LDSB0_CLR0_GRVWA8_GRVWB16_GSU1_LBSPPA128_LBSPPB512_LPA8_MIWT2_1_PGR2_PLR0_SS1_SU32_SUM0_SUS256_SVW1_TLDS1_WG16_8_1_WGM8
    SolutionIndex: 18
    SolutionNameMin: Cijk_Alik_Bjlk_I8II_BH_HAI_SAV_UserArgs_MT256x16x64_MI16x16x1_SN_LDSB1_CLR1_GRVWA8_GRVWB8_GSU1_LBSPPA128_LBSPPB128_LPA8_MIWT4_1_PGR1_PLR1_SS1_SU32_SUM0_SUS256_SVW1_TLDS1_WG64_2_1_WGM8
    SolutionIndex: 19
    SolutionNameMin: Cijk_Alik_Bjlk_I8II_BH_HAI_SAV_UserArgs_MT256x16x64_MI16x16x1_SN_LDSB1_CLR1_GRVWA8_GRVWB8_GSU1_LBSPPA128_LBSPPB128_LPA8_MIWT4_1_PGR2_PLR1_SS1_SU32_SUM0_SUS256_SVW1_TLDS1_WG64_2_1_WGM8
    SolutionIndex: 20
    SolutionNameMin: Cijk_Alik_Bjlk_I8II_BH_HAI_SAV_UserArgs_MT256x16x64_MI16x16x1_SN_LDSB1_CLR1_GRVWA8_GRVWB8_GSU1_LBSPPA128_LBSPPB128_LPA8_MIWT4_1_PGR1_PLR3_SS1_SU32_SUM0_SUS256_SVW1_TLDS1_WG64_2_1_WGM8
    SolutionIndex: 21
    SolutionNameMin: Cijk_Alik_Bjlk_I8II_BH_HAI_SAV_UserArgs_MT256x16x64_MI16x16x1_SN_LDSB1_CLR1_GRVWA8_GRVWB8_GSU1_LBSPPA128_LBSPPB128_LPA8_MIWT4_1_PGR2_PLR3_SS1_SU32_SUM0_SUS256_SVW1_TLDS1_WG64_2_1_WGM8
    SolutionIndex: 22
    SolutionNameMin: Cijk_Alik_Bjlk_I8II_BH_HAI_SAV_UserArgs_MT32x32x64_MI16x16x1_SN_LDSB0_CLR1_GRVWA8_GRVWB16_GSU1_LBSPPA128_LBSPPB256_LPA8_MIWT1_1_PGR1_PLR1_SS1_SU32_SUM0_SUS256_SVW1_TLDS1_WG32_4_1_WGM8
    SolutionIndex: 23
    SolutionNameMin: Cijk_Alik_Bjlk_I8II_BH_HAI_SAV_UserArgs_MT32x32x64_MI16x16x1_SN_LDSB0_CLR0_GRVWA8_GRVWB16_GSU1_LBSPPA128_LBSPPB256_LPA8_MIWT1_1_PGR1_PLR0_SS1_SU32_SUM0_SUS256_SVW1_TLDS1_WG32_4_1_WGM8
    SolutionIndex: 24
    SolutionNameMin: Cijk_Alik_Bjlk_I8II_BH_HAI_SAV_UserArgs_MT64x32x64_MI16x16x1_SN_LDSB0_CLR1_GRVWA8_GRVWB16_GSU1_LBSPPA128_LBSPPB256_LPA8_MIWT2_1_PGR1_PLR1_SS1_SU32_SUM0_SUS256_SVW1_TLDS1_WG32_4_1_WGM8
    SolutionIndex: 25
    SolutionNameMin: Cijk_Alik_Bjlk_I8II_BH_HAI_SAV_UserArgs_MT64x32x64_MI16x16x1_SN_LDSB0_CLR1_GRVWA8_GRVWB16_GSU1_LBSPPA128_LBSPPB256_LPA8_MIWT2_1_PGR1_PLR3_SS1_SU32_SUM0_SUS256_SVW1_TLDS1_WG32_4_1_WGM8
    SolutionIndex: 26
    SolutionNameMin: Cijk_Alik_Bjlk_I8II_BH_HAI_SAV_UserArgs_MT64x32x64_MI16x16x1_SN_LDSB0_CLR0_GRVWA8_GRVWB16_GSU1_LBSPPA128_LBSPPB256_LPA8_MIWT2_1_PGR1_PLR0_SS1_SU32_SUM0_SUS256_SVW1_TLDS1_WG32_4_1_WGM8
    SolutionIndex: 27
    SolutionNameMin: Cijk_Alik_Bjlk_I8II_BH_HAI_SAV_UserArgs_MT16x64x64_MI16x16x1_SN_LDSB0_CLR1_GRVWA8_GRVWB16_GSU1_LBSPPA128_LBSPPB512_LPA8_MIWT1_1_PGR2_PLR3_SS1_SU32_SUM0_SUS256_SVW1_TLDS1_WG16_8_1_WGM8
    SolutionIndex: 28
    SolutionNameMin: Cijk_Alik_Bjlk_I8II_BH_HAI_SAV_UserArgs_MT32x64x64_MI16x16x1_SN_LDSB0_CLR1_GRVWA8_GRVWB16_GSU1_LBSPPA128_LBSPPB512_LPA8_MIWT2_1_PGR1_PLR1_SS1_SU32_SUM0_SUS256_SVW1_TLDS1_WG16_8_1_WGM8
    SolutionIndex: 29
    SolutionNameMin: Cijk_Alik_Bjlk_I8II_BH_HAI_SAV_UserArgs_MT32x64x64_MI16x16x1_SN_LDSB0_CLR1_GRVWA8_GRVWB16_GSU1_LBSPPA128_LBSPPB512_LPA8_MIWT2_1_PGR1_PLR3_SS1_SU32_SUM0_SUS256_SVW1_TLDS1_WG16_8_1_WGM8
    SolutionIndex: 30
    SolutionNameMin: Cijk_Alik_Bjlk_I8II_BH_HAI_SAV_UserArgs_MT32x64x64_MI16x16x1_SN_LDSB0_CLR0_GRVWA8_GRVWB16_GSU1_LBSPPA128_LBSPPB512_LPA8_MIWT2_1_PGR1_PLR0_SS1_SU32_SUM0_SUS256_SVW1_TLDS1_WG16_8_1_WGM8
    SolutionIndex: 31
    SolutionNameMin: Cijk_Alik_Bjlk_I8II_BH_HAI_SAV_UserArgs_MT32x64x64_MI16x16x1_SN_LDSB0_CLR0_GRVWA8_GRVWB16_GSU1_LBSPPA128_LBSPPB512_LPA8_MIWT2_1_PGR2_PLR0_SS1_SU32_SUM0_SUS256_SVW1_TLDS1_WG16_8_1_WGM8
- - - [512, 512, 1, 64, 512, 512, 64, 512]
    - [18, 1045.93]
  - - [1024, 512, 1, 64, 1024, 1024, 64, 512]
    - [28, 1992.96]
  - - [1536, 512, 1, 64, 1536, 1536, 64, 512]
    - [19, 3162.53]
  - - [2048, 512, 1, 64, 2048, 2048, 64, 512]
    - [2, 3558.17]
  - - [2560, 512, 1, 64, 2560, 2560, 64, 512]
    - [20, 4595.36]
  - - [3072, 512, 1, 64, 3072, 3072, 64, 512]
    - [20, 5381.48]
  - - [512, 1024, 1, 64, 512, 512, 64, 1024]
    - [25, 2180.42]
  - - [1024, 1024, 1, 64, 1024, 1024, 64, 1024]
    - [20, 3594.48]
  - - [1536, 1024, 1, 64, 1536, 1536, 64, 1024]
    - [21, 5365.7]
  - - [2048, 1024, 1, 64, 2048, 2048, 64, 1024]
    - [18, 6747.15]
  - - [2560, 1024, 1, 64, 2560, 2560, 64, 1024]
    - [19, 7665.73]
  - - [3072, 1024, 1, 64, 3072, 3072, 64, 1024]
    - [20, 8727.34]
  - - [512, 1536, 1, 64, 512, 512, 64, 1536]
    - [18, 3020.84]
  - - [1024, 1536, 1, 64, 1024, 1024, 64, 1536]
    - [18, 5327.23]
  - - [1536, 1536, 1, 64, 1536, 1536, 64, 1536]
    - [5, 7130.81]
  - - [2048, 1536, 1, 64, 2048, 2048, 64, 1536]
    - [19, 9059.79]
  - - [2560, 1536, 1, 64, 2560, 2560, 64, 1536]
    - [18, 10394.4]
  - - [3072, 1536, 1, 64, 3072, 3072, 64, 1536]
    - [21, 11767.5]
  - - [512, 2048, 1, 64, 512, 512, 64, 2048]
    - [18, 3803.6]
  - - [1024, 2048, 1, 64, 1024, 1024, 64, 2048]
    - [18, 6547.69]
  - - [1536, 2048, 1, 64, 1536, 1536, 64, 2048]
    - [20, 8931.18]
  - - [2048, 2048, 1, 64, 2048, 2048, 64, 2048]
    - [19, 10640.6]
  - - [2560, 2048, 1, 64, 2560, 2560, 64, 2048]
    - [18, 12452.7]
  - - [3072, 2048, 1, 64, 3072, 3072, 64, 2048]
    - [3, 13554.8]
  - - [512, 2560, 1, 64, 512, 512, 64, 2560]
    - [20, 4610.52]
  - - [1024, 2560, 1, 64, 1024, 1024, 64, 2560]
    - [18, 7688.56]
  - - [1536, 2560, 1, 64, 1536, 1536, 64, 2560]
    - [19, 10734.4]
  - - [2048, 2560, 1, 64, 2048, 2048, 64, 2560]
    - [20, 12688.4]
  - - [2560, 2560, 1, 64, 2560, 2560, 64, 2560]
    - [4, 14420.8]
  - - [3072, 2560, 1, 64, 3072, 3072, 64, 2560]
    - [3, 16358.7]
  - - [512, 3072, 1, 64, 512, 512, 64, 3072]
    - [21, 5391.71]
  - - [1024, 3072, 1, 64, 1024, 1024, 64, 3072]
    - [5, 8576.58]
  - - [1536, 3072, 1, 64, 1536, 1536, 64, 3072]
    - [4, 12190.8]
  - - [2048, 3072, 1, 64, 2048, 2048, 64, 3072]
    - [5, 14161.2]
  - - [2560, 3072, 1, 64, 2560, 2560, 64, 3072]
    - [4, 15945.9]
  - - [3072, 3072, 1, 64, 3072, 3072, 64, 3072]
    - [4, 17746.4]
  - - [512, 512, 1, 256, 512, 512, 256, 512]
    - [29, 4044.77]
  - - [1024, 512, 1, 256, 1024, 1024, 256, 512]
    - [6, 7446.82]
  - - [1536, 512, 1, 256, 1536, 1536, 256, 512]
    - [25, 11093.0]
  - - [2048, 512, 1, 256, 2048, 2048, 256, 512]
    - [31, 13565.9]
  - - [2560, 512, 1, 256, 2560, 2560, 256, 512]
    - [14, 16345.3]
  - - [3072, 512, 1, 256, 3072, 3072, 256, 512]
    - [16, 17293.1]
  - - [512, 1024, 1, 256, 512, 512, 256, 1024]
    - [29, 8126.53]
  - - [1024, 1024, 1, 256, 1024, 1024, 256, 1024]
    - [24, 12566.9]
  - - [1536, 1024, 1, 256, 1536, 1536, 256, 1024]
    - [14, 17109.4]
  - - [2048, 1024, 1, 256, 2048, 2048, 256, 1024]
    - [17, 22184.3]
  - - [2560, 1024, 1, 256, 2560, 2560, 256, 1024]
    - [14, 26319.3]
  - - [3072, 1024, 1, 256, 3072, 3072, 256, 1024]
    - [14, 28267.8]
  - - [512, 1536, 1, 256, 512, 512, 256, 1536]
    - [13, 10930.1]
  - - [1024, 1536, 1, 256, 1024, 1024, 256, 1536]
    - [14, 18473.7]
  - - [1536, 1536, 1, 256, 1536, 1536, 256, 1536]
    - [8, 23479.7]
  - - [2048, 1536, 1, 256, 2048, 2048, 256, 1536]
    - [29, 27536.5]
  - - [2560, 1536, 1, 256, 2560, 2560, 256, 1536]
    - [14, 32500.3]
  - - [3072, 1536, 1, 256, 3072, 3072, 256, 1536]
    - [17, 35130.9]
  - - [512, 2048, 1, 256, 512, 512, 256, 2048]
    - [29, 12924.8]
  - - [1024, 2048, 1, 256, 1024, 1024, 256, 2048]
    - [9, 21988.5]
  - - [1536, 2048, 1, 256, 1536, 1536, 256, 2048]
    - [14, 28965.3]
  - - [2048, 2048, 1, 256, 2048, 2048, 256, 2048]
    - [30, 32044.3]
  - - [2560, 2048, 1, 256, 2560, 2560, 256, 2048]
    - [16, 35857.9]
  - - [3072, 2048, 1, 256, 3072, 3072, 256, 2048]
    - [14, 39488.4]
  - - [512, 2560, 1, 256, 512, 512, 256, 2560]
    - [29, 15812.6]
  - - [1024, 2560, 1, 256, 1024, 1024, 256, 2560]
    - [15, 26175.5]
  - - [1536, 2560, 1, 256, 1536, 1536, 256, 2560]
    - [14, 33281.0]
  - - [2048, 2560, 1, 256, 2048, 2048, 256, 2560]
    - [1, 35954.4]
  - - [2560, 2560, 1, 256, 2560, 2560, 256, 2560]
    - [14, 42287.2]
  - - [3072, 2560, 1, 256, 3072, 3072, 256, 2560]
    - [14, 44009.7]
  - - [512, 3072, 1, 256, 512, 512, 256, 3072]
    - [16, 18602.2]
  - - [1024, 3072, 1, 256, 1024, 1024, 256, 3072]
    - [16, 29464.9]
  - - [1536, 3072, 1, 256, 1536, 1536, 256, 3072]
    - [14, 36103.8]
  - - [2048, 3072, 1, 256, 2048, 2048, 256, 3072]
    - [16, 40832.9]
  - - [2560, 3072, 1, 256, 2560, 2560, 256, 3072]
    - [14, 44839.4]
  - - [3072, 3072, 1, 256, 3072, 3072, 256, 3072]
    - [16, 48179.6]
  - - [512, 512, 1, 512, 512, 512, 512, 512]
    - [30, 8053.14]
  - - [1024, 512, 1, 512, 1024, 1024, 512, 512]
    - [28, 15478.0]
  - - [1536, 512, 1, 512, 1536, 1536, 512, 512]
    - [14, 20200.8]
  - - [2048, 512, 1, 512, 2048, 2048, 512, 512]
    - [14, 23565.1]
  - - [2560, 512, 1, 512, 2560, 2560, 512, 512]
    - [14, 27805.0]
  - - [3072, 512, 1, 512, 3072, 3072, 512, 512]
    - [28, 29792.0]
  - - [512, 1024, 1, 512, 512, 512, 512, 1024]
    - [28, 15345.3]
  - - [1024, 1024, 1, 512, 1024, 1024, 512, 1024]
    - [16, 22855.8]
  - - [1536, 1024, 1, 512, 1536, 1536, 512, 1024]
    - [14, 32352.7]
  - - [2048, 1024, 1, 512, 2048, 2048, 512, 1024]
    - [7, 34943.4]
  - - [2560, 1024, 1, 512, 2560, 2560, 512, 1024]
    - [17, 39401.6]
  - - [3072, 1024, 1, 512, 3072, 3072, 512, 1024]
    - [14, 44098.0]
  - - [512, 1536, 1, 512, 512, 512, 512, 1536]
    - [20, 20893.7]
  - - [1024, 1536, 1, 512, 1024, 1024, 512, 1536]
    - [29, 31713.7]
  - - [1536, 1536, 1, 512, 1536, 1536, 512, 1536]
    - [14, 39699.6]
  - - [2048, 1536, 1, 512, 2048, 2048, 512, 1536]
    - [14, 47115.3]
  - - [2560, 1536, 1, 512, 2560, 2560, 512, 1536]
    - [17, 52364.7]
  - - [3072, 1536, 1, 512, 3072, 3072, 512, 1536]
    - [16, 56065.5]
  - - [512, 2048, 1, 512, 512, 512, 512, 2048]
    - [16, 24774.3]
  - - [1024, 2048, 1, 512, 1024, 1024, 512, 2048]
    - [30, 36176.7]
  - - [1536, 2048, 1, 512, 1536, 1536, 512, 2048]
    - [14, 47136.7]
  - - [2048, 2048, 1, 512, 2048, 2048, 512, 2048]
    - [14, 51987.7]
  - - [2560, 2048, 1, 512, 2560, 2560, 512, 2048]
    - [14, 57650.6]
  - - [3072, 2048, 1, 512, 3072, 3072, 512, 2048]
    - [15, 59183.8]
  - - [512, 2560, 1, 512, 512, 512, 512, 2560]
    - [15, 28346.5]
  - - [1024, 2560, 1, 512, 1024, 1024, 512, 2560]
    - [16, 43103.5]
  - - [1536, 2560, 1, 512, 1536, 1536, 512, 2560]
    - [17, 50744.6]
  - - [2048, 2560, 1, 512, 2048, 2048, 512, 2560]
    - [17, 56909.3]
  - - [2560, 2560, 1, 512, 2560, 2560, 512, 2560]
    - [15, 62015.5]
  - - [3072, 2560, 1, 512, 3072, 3072, 512, 2560]
    - [16, 64489.0]
  - - [512, 3072, 1, 512, 512, 512, 512, 3072]
    - [16, 30737.5]
  - - [1024, 3072, 1, 512, 1024, 1024, 512, 3072]
    - [14, 43630.9]
  - - [1536, 3072, 1, 512, 1536, 1536, 512, 3072]
    - [14, 53331.0]
  - - [2048, 3072, 1, 512, 2048, 2048, 512, 3072]
    - [30, 57199.1]
  - - [2560, 3072, 1, 512, 2560, 2560, 512, 3072]
    - [28, 59535.5]
  - - [3072, 3072, 1, 512, 3072, 3072, 512, 3072]
    - [28, 61225.7]
  - - [512, 512, 1, 1024, 512, 512, 1024, 512]
    - [10, 15137.2]
  - - [1024, 512, 1, 1024, 1024, 1024, 1024, 512]
    - [28, 26235.5]
  - - [1536, 512, 1, 1024, 1536, 1536, 1024, 512]
    - [14, 33030.1]
  - - [2048, 512, 1, 1024, 2048, 2048, 1024, 512]
    - [29, 37803.2]
  - - [2560, 512, 1, 1024, 2560, 2560, 1024, 512]
    - [16, 44088.9]
  - - [3072, 512, 1, 1024, 3072, 3072, 1024, 512]
    - [16, 48217.6]
  - - [512, 1024, 1, 1024, 512, 512, 1024, 1024]
    - [28, 23922.6]
  - - [1024, 1024, 1, 1024, 1024, 1024, 1024, 1024]
    - [28, 38065.2]
  - - [1536, 1024, 1, 1024, 1536, 1536, 1024, 1024]
    - [29, 46016.8]
  - - [2048, 1024, 1, 1024, 2048, 2048, 1024, 1024]
    - [25, 50822.6]
  - - [2560, 1024, 1, 1024, 2560, 2560, 1024, 1024]
    - [25, 56740.9]
  - - [3072, 1024, 1, 1024, 3072, 3072, 1024, 1024]
    - [25, 58516.1]
  - - [512, 1536, 1, 1024, 512, 512, 1024, 1536]
    - [4, 31367.2]
  - - [1024, 1536, 1, 1024, 1024, 1024, 1024, 1536]
    - [14, 47143.6]
  - - [1536, 1536, 1, 1024, 1536, 1536, 1024, 1536]
    - [14, 55909.8]
  - - [2048, 1536, 1, 1024, 2048, 2048, 1024, 1536]
    - [14, 63484.3]
  - - [2560, 1536, 1, 1024, 2560, 2560, 1024, 1536]
    - [14, 68367.4]
  - - [3072, 1536, 1, 1024, 3072, 3072, 1024, 1536]
    - [16, 70777.0]
  - - [512, 2048, 1, 1024, 512, 512, 1024, 2048]
    - [29, 38221.0]
  - - [1024, 2048, 1, 1024, 1024, 1024, 1024, 2048]
    - [17, 54430.1]
  - - [1536, 2048, 1, 1024, 1536, 1536, 1024, 2048]
    - [14, 63774.0]
  - - [2048, 2048, 1, 1024, 2048, 2048, 1024, 2048]
    - [30, 67298.1]
  - - [2560, 2048, 1, 1024, 2560, 2560, 1024, 2048]
    - [30, 72772.4]
  - - [3072, 2048, 1, 1024, 3072, 3072, 1024, 2048]
    - [29, 72507.3]
  - - [512, 2560, 1, 1024, 512, 512, 1024, 2560]
    - [14, 44662.6]
  - - [1024, 2560, 1, 1024, 1024, 1024, 1024, 2560]
    - [28, 59719.3]
  - - [1536, 2560, 1, 1024, 1536, 1536, 1024, 2560]
    - [14, 66384.7]
  - - [2048, 2560, 1, 1024, 2048, 2048, 1024, 2560]
    - [14, 75061.1]
  - - [2560, 2560, 1, 1024, 2560, 2560, 1024, 2560]
    - [14, 76398.5]
  - - [3072, 2560, 1, 1024, 3072, 3072, 1024, 2560]
    - [15, 78499.1]
  - - [512, 3072, 1, 1024, 512, 512, 1024, 3072]
    - [14, 48833.1]
  - - [1024, 3072, 1, 1024, 1024, 1024, 1024, 3072]
    - [15, 61979.4]
  - - [1536, 3072, 1, 1024, 1536, 1536, 1024, 3072]
    - [29, 68074.7]
  - - [2048, 3072, 1, 1024, 2048, 2048, 1024, 3072]
    - [30, 68509.7]
  - - [2560, 3072, 1, 1024, 2560, 2560, 1024, 3072]
    - [29, 72498.5]
  - - [3072, 3072, 1, 1024, 3072, 3072, 1024, 3072]
    - [29, 72596.2]
  - - [512, 512, 1, 2048, 512, 512, 2048, 512]
    - [25, 23981.4]
  - - [1024, 512, 1, 2048, 1024, 1024, 2048, 512]
    - [29, 40411.8]
  - - [1536, 512, 1, 2048, 1536, 1536, 2048, 512]
    - [29, 48810.9]
  - - [2048, 512, 1, 2048, 2048, 2048, 2048, 512]
    - [29, 56877.2]
  - - [2560, 512, 1, 2048, 2560, 2560, 2048, 512]
    - [10, 61248.2]
  - - [3072, 512, 1, 2048, 3072, 3072, 2048, 512]
    - [14, 65931.7]
  - - [512, 1024, 1, 2048, 512, 512, 2048, 1024]
    - [25, 40252.7]
  - - [1024, 1024, 1, 2048, 1024, 1024, 2048, 1024]
    - [28, 55045.3]
  - - [1536, 1024, 1, 2048, 1536, 1536, 2048, 1024]
    - [28, 63976.7]
  - - [2048, 1024, 1, 2048, 2048, 2048, 2048, 1024]
    - [24, 67124.1]
  - - [2560, 1024, 1, 2048, 2560, 2560, 2048, 1024]
    - [14, 71239.4]
  - - [3072, 1024, 1, 2048, 3072, 3072, 2048, 1024]
    - [25, 72939.5]
  - - [512, 1536, 1, 2048, 512, 512, 2048, 1536]
    - [14, 48516.1]
  - - [1024, 1536, 1, 2048, 1024, 1024, 2048, 1536]
    - [29, 64374.3]
  - - [1536, 1536, 1, 2048, 1536, 1536, 2048, 1536]
    - [9, 74898.9]
  - - [2048, 1536, 1, 2048, 2048, 2048, 2048, 1536]
    - [0, 77529.8]
  - - [2560, 1536, 1, 2048, 2560, 2560, 2048, 1536]
    - [16, 83925.0]
  - - [3072, 1536, 1, 2048, 3072, 3072, 2048, 1536]
    - [14, 86541.7]
  - - [512, 2048, 1, 2048, 512, 512, 2048, 2048]
    - [7, 55986.0]
  - - [1024, 2048, 1, 2048, 1024, 1024, 2048, 2048]
    - [8, 70001.9]
  - - [1536, 2048, 1, 2048, 1536, 1536, 2048, 2048]
    - [15, 77868.0]
  - - [2048, 2048, 1, 2048, 2048, 2048, 2048, 2048]
    - [14, 80812.2]
  - - [2560, 2048, 1, 2048, 2560, 2560, 2048, 2048]
    - [28, 84640.9]
  - - [3072, 2048, 1, 2048, 3072, 3072, 2048, 2048]
    - [29, 86802.7]
  - - [512, 2560, 1, 2048, 512, 512, 2048, 2560]
    - [9, 60290.1]
  - - [1024, 2560, 1, 2048, 1024, 1024, 2048, 2560]
    - [28, 74673.8]
  - - [1536, 2560, 1, 2048, 1536, 1536, 2048, 2560]
    - [14, 82698.6]
  - - [2048, 2560, 1, 2048, 2048, 2048, 2048, 2560]
    - [0, 86758.3]
  - - [2560, 2560, 1, 2048, 2560, 2560, 2048, 2560]
    - [14, 90431.3]
  - - [3072, 2560, 1, 2048, 3072, 3072, 2048, 2560]
    - [14, 91838.2]
  - - [512, 3072, 1, 2048, 512, 512, 2048, 3072]
    - [29, 65776.2]
  - - [1024, 3072, 1, 2048, 1024, 1024, 2048, 3072]
    - [15, 78409.2]
  - - [1536, 3072, 1, 2048, 1536, 1536, 2048, 3072]
    - [16, 82152.1]
  - - [2048, 3072, 1, 2048, 2048, 2048, 2048, 3072]
    - [16, 80186.1]
  - - [2560, 3072, 1, 2048, 2560, 2560, 2048, 3072]
    - [0, 82059.2]
  - - [3072, 3072, 1, 2048, 3072, 3072, 2048, 3072]
    - [14, 81837.0]
  - - [512, 512, 1, 3072, 512, 512, 3072, 512]
    - [30, 30956.7]
  - - [1024, 512, 1, 3072, 1024, 1024, 3072, 512]
    - [28, 51393.2]
  - - [1536, 512, 1, 3072, 1536, 1536, 3072, 512]
    - [9, 59189.8]
  - - [2048, 512, 1, 3072, 2048, 2048, 3072, 512]
    - [29, 65803.8]
  - - [2560, 512, 1, 3072, 2560, 2560, 3072, 512]
    - [29, 70750.1]
  - - [3072, 512, 1, 3072, 3072, 3072, 3072, 512]
    - [28, 74133.5]
  - - [512, 1024, 1, 3072, 512, 512, 3072, 1024]
    - [28, 48855.3]
  - - [1024, 1024, 1, 3072, 1024, 1024, 3072, 1024]
    - [9, 64711.2]
  - - [1536, 1024, 1, 3072, 1536, 1536, 3072, 1024]
    - [28, 70001.3]
  - - [2048, 1024, 1, 3072, 2048, 2048, 3072, 1024]
    - [24, 72926.7]
  - - [2560, 1024, 1, 3072, 2560, 2560, 3072, 1024]
    - [24, 75854.6]
  - - [3072, 1024, 1, 3072, 3072, 3072, 3072, 1024]
    - [26, 78530.4]
  - - [512, 1536, 1, 3072, 512, 512, 3072, 1536]
    - [4, 58245.8]
  - - [1024, 1536, 1, 3072, 1024, 1024, 3072, 1536]
    - [28, 74505.6]
  - - [1536, 1536, 1, 3072, 1536, 1536, 3072, 1536]
    - [9, 81676.8]
  - - [2048, 1536, 1, 3072, 2048, 2048, 3072, 1536]
    - [29, 86382.7]
  - - [2560, 1536, 1, 3072, 2560, 2560, 3072, 1536]
    - [30, 87756.5]
  - - [3072, 1536, 1, 3072, 3072, 3072, 3072, 1536]
    - [30, 90525.4]
  - - [512, 2048, 1, 3072, 512, 512, 3072, 2048]
    - [29, 64750.2]
  - - [1024, 2048, 1, 3072, 1024, 1024, 3072, 2048]
    - [29, 80838.8]
  - - [1536, 2048, 1, 3072, 1536, 1536, 3072, 2048]
    - [14, 85680.4]
  - - [2048, 2048, 1, 3072, 2048, 2048, 3072, 2048]
    - [9, 87762.2]
  - - [2560, 2048, 1, 3072, 2560, 2560, 3072, 2048]
    - [29, 90970.4]
  - - [3072, 2048, 1, 3072, 3072, 3072, 3072, 2048]
    - [28, 92803.1]
  - - [512, 2560, 1, 3072, 512, 512, 3072, 2560]
    - [9, 70440.1]
  - - [1024, 2560, 1, 3072, 1024, 1024, 3072, 2560]
    - [28, 82596.8]
  - - [1536, 2560, 1, 3072, 1536, 1536, 3072, 2560]
    - [15, 88364.4]
  - - [2048, 2560, 1, 3072, 2048, 2048, 3072, 2560]
    - [14, 92442.8]
  - - [2560, 2560, 1, 3072, 2560, 2560, 3072, 2560]
    - [15, 93485.9]
  - - [3072, 2560, 1, 3072, 3072, 3072, 3072, 2560]
    - [29, 95328.1]
  - - [512, 3072, 1, 3072, 512, 512, 3072, 3072]
    - [29, 73674.6]
  - - [1024, 3072, 1, 3072, 1024, 1024, 3072, 3072]
    - [14, 80911.6]
  - - [1536, 3072, 1, 3072, 1536, 1536, 3072, 3072]
    - [28, 83513.2]
  - - [2048, 3072, 1, 3072, 2048, 2048, 3072, 3072]
    - [29, 83508.9]
  - - [2560, 3072, 1, 3072, 2560, 2560, 3072, 3072]
    - [9, 82387.9]
  - - [3072, 3072, 1, 3072, 3072, 3072, 3072, 3072]
    - [29, 83636.2]
  - - [1, 64, 1, 1, 1, 1, 1, 64]
    - [12, 0.00409089]
  - - [64, 64, 1, 1, 64, 64, 1, 64]
    - [22, 0.260568]
  - - [1, 64, 1, 64, 1, 1, 64, 64]
    - [11, 0.26232]
  - - [64, 64, 1, 64, 64, 64, 64, 64]
    - [27, 17.1129]
  - - [64, 64, 1, 256, 64, 64, 256, 64]
    - [30, 63.3332]
  - - [64, 64, 1, 512, 64, 64, 512, 64]
    - [30, 122.95]
  - - [64, 64, 1, 1024, 64, 64, 1024, 64]
    - [23, 240.741]
  - - [64, 64, 1, 2048, 64, 64, 2048, 64]
    - [23, 414.805]
  - - [64, 64, 1, 4096, 64, 64, 4096, 64]
    - [23, 634.671]
- null
- null
- DeviceEfficiency
- GridBased
