library/src/amd_detail/rocblaslt/src/Tensile/Logic/asm_full/gfx1200/GridBased/gfx1200_Cijk_Ailk_Bljk_BSS_BH_Bias_HAS_SAV_UserArgs.yaml
- {MinimumRequiredVersion: 4.33.0}
- gfx1200
- gfx1200
- [Device 73f0]
    SolutionIndex: 0
    SolutionNameMin: Cijk_Ailk_Bljk_BSS_BH_Bias_HAS_SAV_UserArgs_MT32x32x32_MI16x16x1_SN_LDSB0_CLR1_GSU1_LBSPPA512_LBSPPB128_MIWT1_1_NLCA1_PGR1_PLR1_SS0_SU32_SUM0_SUS256_SVW8_TLDS1_WG32_4_1_WGM8
    SolutionIndex: 1
    SolutionNameMin: Cijk_Ailk_Bljk_BSS_BH_Bias_HAS_SAV_UserArgs_MT64x32x32_MI16x16x1_SN_LDSB0_CLR1_GSU1_LBSPPA1024_LBSPPB128_MIWT2_1_NLCA1_PGR1_PLR1_SS0_SU32_SUM0_SUS256_SVW8_TLDS1_WG32_4_1_WGM8
    SolutionIndex: 2
    SolutionNameMin: Cijk_Ailk_Bljk_BSS_BH_Bias_HAS_SAV_UserArgs_MT64x32x32_MI16x16x1_SN_LDSB0_CLR1_GSU1_LBSPPA1024_LBSPPB128_MIWT2_1_NLCA1_PGR2_PLR1_SS0_SU32_SUM0_SUS256_SVW8_TLDS1_WG32_4_1_WGM8
    SolutionIndex: 3
    SolutionNameMin: Cijk_Ailk_Bljk_BSS_BH_Bias_HAS_SAV_UserArgs_MT64x32x32_MI16x16x1_SN_LDSB0_CLR0_GSU1_LBSPPA1024_LBSPPB128_MIWT2_1_NLCA1_PGR2_PLR0_SS0_SU32_SUM0_SUS256_SVW8_TLDS1_WG32_4_1_WGM8
    SolutionIndex: 4
    SolutionNameMin: Cijk_Ailk_Bljk_BSS_BH_Bias_HAS_SAV_UserArgs_MT32x64x32_MI16x16x1_SN_LDSB0_CLR1_GSU1_LBSPPA512_LBSPPB128_MIWT2_1_NLCA1_PGR1_PLR1_SS0_SU32_SUM0_SUS256_SVW8_TLDS1_WG16_8_1_WGM8
    SolutionIndex: 5
    SolutionNameMin: Cijk_Ailk_Bljk_BSS_BH_Bias_HAS_SAV_UserArgs_MT32x64x64_MI16x16x1_SN_LDSB0_CLR1_GSU1_LBSPPA512_LBSPPB128_MIWT2_1_NLCA1_PGR1_PLR3_SS0_SU32_SUM0_SUS256_SVW8_TLDS1_WG16_8_1_WGM8
    SolutionIndex: 6
    SolutionNameMin: Cijk_Ailk_Bljk_BSS_BH_Bias_HAS_SAV_UserArgs_MT32x32x32_MI16x16x1_SN_LDSB0_CLR1_GSU1_LBSPPA512_LBSPPB128_MIWT1_1_NLCA1_PGR1_PLR1_SS1_SU32_SUM0_SUS256_SVW1_TLDS1_WG32_4_1_WGM8
    SolutionIndex: 7
    SolutionNameMin: Cijk_Ailk_Bljk_BSS_BH_Bias_HAS_SAV_UserArgs_MT32x32x32_MI16x16x1_SN_LDSB0_CLR1_GSU1_LBSPPA512_LBSPPB128_MIWT1_1_NLCA1_PGR2_PLR1_SS1_SU32_SUM0_SUS256_SVW1_TLDS1_WG32_4_1_WGM8
    SolutionIndex: 8
    SolutionNameMin: Cijk_Ailk_Bljk_BSS_BH_Bias_HAS_SAV_UserArgs_MT32x32x32_MI16x16x1_SN_LDSB0_CLR0_GSU1_LBSPPA512_LBSPPB128_MIWT1_1_NLCA1_PGR1_PLR0_SS1_SU32_SUM0_SUS256_SVW1_TLDS1_WG32_4_1_WGM8
    SolutionIndex: 9
    SolutionNameMin: Cijk_Ailk_Bljk_BSS_BH_Bias_HAS_SAV_UserArgs_MT32x32x32_MI16x16x1_SN_LDSB0_CLR0_GSU1_LBSPPA512_LBSPPB128_MIWT1_1_NLCA1_PGR2_PLR0_SS1_SU32_SUM0_SUS256_SVW1_TLDS1_WG32_4_1_WGM8
    SolutionIndex: 10
    SolutionNameMin: Cijk_Ailk_Bljk_BSS_BH_Bias_HAS_SAV_UserArgs_MT64x32x32_MI16x16x1_SN_LDSB0_CLR1_GSU1_LBSPPA1024_LBSPPB128_MIWT2_1_NLCA1_PGR1_PLR1_SS1_SU32_SUM0_SUS256_SVW1_TLDS1_WG32_4_1_WGM8
    SolutionIndex: 11
    SolutionNameMin: Cijk_Ailk_Bljk_BSS_BH_Bias_HAS_SAV_UserArgs_MT64x32x32_MI16x16x1_SN_LDSB0_CLR1_GSU1_LBSPPA1024_LBSPPB128_MIWT2_1_NLCA1_PGR2_PLR1_SS1_SU32_SUM0_SUS256_SVW1_TLDS1_WG32_4_1_WGM8
    SolutionIndex: 12
    SolutionNameMin: Cijk_Ailk_Bljk_BSS_BH_Bias_HAS_SAV_UserArgs_MT64x32x32_MI16x16x1_SN_LDSB0_CLR0_GSU1_LBSPPA1024_LBSPPB128_MIWT2_1_NLCA1_PGR1_PLR0_SS1_SU32_SUM0_SUS256_SVW1_TLDS1_WG32_4_1_WGM8
    SolutionIndex: 13
    SolutionNameMin: Cijk_Ailk_Bljk_BSS_BH_Bias_HAS_SAV_UserArgs_MT64x32x32_MI16x16x1_SN_LDSB0_CLR0_GSU1_LBSPPA1024_LBSPPB128_MIWT2_1_NLCA1_PGR2_PLR0_SS1_SU32_SUM0_SUS256_SVW1_TLDS1_WG32_4_1_WGM8
    SolutionIndex: 14
    SolutionNameMin: Cijk_Ailk_Bljk_BSS_BH_Bias_HAS_SAV_UserArgs_MT32x64x32_MI16x16x1_SN_LDSB0_CLR1_GSU1_LBSPPA512_LBSPPB128_MIWT2_1_NLCA1_PGR1_PLR1_SS1_SU32_SUM0_SUS256_SVW1_TLDS1_WG16_8_1_WGM8
    SolutionIndex: 15
    SolutionNameMin: Cijk_Ailk_Bljk_BSS_BH_Bias_HAS_SAV_UserArgs_MT32x64x32_MI16x16x1_SN_LDSB0_CLR1_GSU1_LBSPPA512_LBSPPB128_MIWT2_1_NLCA1_PGR2_PLR1_SS1_SU32_SUM0_SUS256_SVW1_TLDS1_WG16_8_1_WGM8
    SolutionIndex: 16
    SolutionNameMin: Cijk_Ailk_Bljk_BSS_BH_Bias_HAS_SAV_UserArgs_MT32x32x64_MI16x16x1_SN_LDSB0_CLR1_GSU1_LBSPPA512_LBSPPB128_MIWT1_1_NLCA1_PGR1_PLR1_SS1_SU32_SUM0_SUS256_SVW1_TLDS1_WG32_4_1_WGM8
    SolutionIndex: 17
    SolutionNameMin: Cijk_Ailk_Bljk_BSS_BH_Bias_HAS_SAV_UserArgs_MT32x32x64_MI16x16x1_SN_LDSB0_CLR1_GSU1_LBSPPA512_LBSPPB128_MIWT1_1_NLCA1_PGR2_PLR1_SS1_SU32_SUM0_SUS256_SVW1_TLDS1_WG32_4_1_WGM8
    SolutionIndex: 18
    SolutionNameMin: Cijk_Ailk_Bljk_BSS_BH_Bias_HAS_SAV_UserArgs_MT32x32x64_MI16x16x1_SN_LDSB0_CLR1_GSU1_LBSPPA512_LBSPPB128_MIWT1_1_NLCA1_PGR1_PLR3_SS1_SU32_SUM0_SUS256_SVW1_TLDS1_WG32_4_1_WGM8
    SolutionIndex: 19
    SolutionNameMin: Cijk_Ailk_Bljk_BSS_BH_Bias_HAS_SAV_UserArgs_MT32x32x64_MI16x16x1_SN_LDSB0_CLR0_GSU1_LBSPPA512_LBSPPB512_MIWT1_1_NLCA1_PGR1_PLR0_SS1_SU32_SUM0_SUS256_SVW1_TLDS0_WG32_4_1_WGM8
    SolutionIndex: 20
    SolutionNameMin: Cijk_Ailk_Bljk_BSS_BH_Bias_HAS_SAV_UserArgs_MT32x32x64_MI16x16x1_SN_LDSB0_CLR0_GSU1_LBSPPA512_LBSPPB128_MIWT1_1_NLCA1_PGR1_PLR0_SS1_SU32_SUM0_SUS256_SVW1_TLDS1_WG32_4_1_WGM8
    SolutionIndex: 21
    SolutionNameMin: Cijk_Ailk_Bljk_BSS_BH_Bias_HAS_SAV_UserArgs_MT64x32x64_MI16x16x1_SN_LDSB0_CLR1_GSU1_LBSPPA1024_LBSPPB128_MIWT2_1_NLCA1_PGR1_PLR1_SS1_SU32_SUM0_SUS256_SVW1_TLDS1_WG32_4_1_WGM8
    SolutionIndex: 22
    SolutionNameMin: Cijk_Ailk_Bljk_BSS_BH_Bias_HAS_SAV_UserArgs_MT64x32x64_MI16x16x1_SN_LDSB0_CLR0_GSU1_LBSPPA1024_LBSPPB128_MIWT2_1_NLCA1_PGR1_PLR0_SS1_SU32_SUM0_SUS256_SVW1_TLDS1_WG32_4_1_WGM8
- - - [512, 512, 1, 64, 512, 512, 512, 64]
    - [11, 1120.5]
  - - [1024, 512, 1, 64, 1024, 1024, 1024, 64]
    - [11, 2016.98]
  - - [1536, 512, 1, 64, 1536, 1536, 1536, 64]
    - [13, 2826.27]
  - - [2048, 512, 1, 64, 2048, 2048, 2048, 64]
    - [10, 3530.09]
  - - [2560, 512, 1, 64, 2560, 2560, 2560, 64]
    - [2, 4332.62]
  - - [3072, 512, 1, 64, 3072, 3072, 3072, 64]
    - [15, 4965.39]
  - - [512, 1024, 1, 64, 512, 512, 512, 64]
    - [13, 2025.5]
  - - [1024, 1024, 1, 64, 1024, 1024, 1024, 64]
    - [14, 3545.95]
  - - [1536, 1024, 1, 64, 1536, 1536, 1536, 64]
    - [2, 5032.54]
  - - [2048, 1024, 1, 64, 2048, 2048, 2048, 64]
    - [11, 6117.07]
  - - [2560, 1024, 1, 64, 2560, 2560, 2560, 64]
    - [2, 6792.12]
  - - [3072, 1024, 1, 64, 3072, 3072, 3072, 64]
    - [2, 8066.94]
  - - [512, 1536, 1, 64, 512, 512, 512, 64]
    - [13, 2943.03]
  - - [1024, 1536, 1, 64, 1024, 1024, 1024, 64]
    - [1, 4999.92]
  - - [1536, 1536, 1, 64, 1536, 1536, 1536, 64]
    - [1, 6702.84]
  - - [2048, 1536, 1, 64, 2048, 2048, 2048, 64]
    - [1, 8026.74]
  - - [2560, 1536, 1, 64, 2560, 2560, 2560, 64]
    - [2, 9455.5]
  - - [3072, 1536, 1, 64, 3072, 3072, 3072, 64]
    - [2, 10207.4]
  - - [512, 2048, 1, 64, 512, 512, 512, 64]
    - [11, 3707.88]
  - - [1024, 2048, 1, 64, 1024, 1024, 1024, 64]
    - [1, 6135.39]
  - - [1536, 2048, 1, 64, 1536, 1536, 1536, 64]
    - [2, 8031.54]
  - - [2048, 2048, 1, 64, 2048, 2048, 2048, 64]
    - [10, 9048.74]
  - - [2560, 2048, 1, 64, 2560, 2560, 2560, 64]
    - [1, 11026.0]
  - - [3072, 2048, 1, 64, 3072, 3072, 3072, 64]
    - [1, 11295.6]
  - - [512, 2560, 1, 64, 512, 512, 512, 64]
    - [1, 4385.97]
  - - [1024, 2560, 1, 64, 1024, 1024, 1024, 64]
    - [3, 7173.12]
  - - [1536, 2560, 1, 64, 1536, 1536, 1536, 64]
    - [1, 9258.61]
  - - [2048, 2560, 1, 64, 2048, 2048, 2048, 64]
    - [10, 10221.8]
  - - [2560, 2560, 1, 64, 2560, 2560, 2560, 64]
    - [2, 12347.4]
  - - [3072, 2560, 1, 64, 3072, 3072, 3072, 64]
    - [2, 12881.3]
  - - [512, 3072, 1, 64, 512, 512, 512, 64]
    - [4, 5033.79]
  - - [1024, 3072, 1, 64, 1024, 1024, 1024, 64]
    - [2, 7831.13]
  - - [1536, 3072, 1, 64, 1536, 1536, 1536, 64]
    - [2, 10344.1]
  - - [2048, 3072, 1, 64, 2048, 2048, 2048, 64]
    - [1, 11737.6]
  - - [2560, 3072, 1, 64, 2560, 2560, 2560, 64]
    - [1, 13281.5]
  - - [3072, 3072, 1, 64, 3072, 3072, 3072, 64]
    - [1, 13498.4]
  - - [512, 512, 1, 256, 512, 512, 512, 256]
    - [10, 4001.36]
  - - [1024, 512, 1, 256, 1024, 1024, 1024, 256]
    - [10, 7300.59]
  - - [1536, 512, 1, 256, 1536, 1536, 1536, 256]
    - [14, 9260.23]
  - - [2048, 512, 1, 256, 2048, 2048, 2048, 256]
    - [10, 11001.0]
  - - [2560, 512, 1, 256, 2560, 2560, 2560, 256]
    - [1, 12202.9]
  - - [3072, 512, 1, 256, 3072, 3072, 3072, 256]
    - [10, 14506.4]
  - - [512, 1024, 1, 256, 512, 512, 512, 256]
    - [10, 7255.21]
  - - [1024, 1024, 1, 256, 1024, 1024, 1024, 256]
    - [1, 10933.6]
  - - [1536, 1024, 1, 256, 1536, 1536, 1536, 256]
    - [1, 14461.8]
  - - [2048, 1024, 1, 256, 2048, 2048, 2048, 256]
    - [10, 16044.0]
  - - [2560, 1024, 1, 256, 2560, 2560, 2560, 256]
    - [10, 18027.9]
  - - [3072, 1024, 1, 256, 3072, 3072, 3072, 256]
    - [1, 19611.7]
  - - [512, 1536, 1, 256, 512, 512, 512, 256]
    - [1, 9277.51]
  - - [1024, 1536, 1, 256, 1024, 1024, 1024, 256]
    - [1, 14561.4]
  - - [1536, 1536, 1, 256, 1536, 1536, 1536, 256]
    - [10, 17642.4]
  - - [2048, 1536, 1, 256, 2048, 2048, 2048, 256]
    - [14, 19443.6]
  - - [2560, 1536, 1, 256, 2560, 2560, 2560, 256]
    - [1, 21253.1]
  - - [3072, 1536, 1, 256, 3072, 3072, 3072, 256]
    - [10, 23146.1]
  - - [512, 2048, 1, 256, 512, 512, 512, 256]
    - [12, 10803.5]
  - - [1024, 2048, 1, 256, 1024, 1024, 1024, 256]
    - [14, 16800.8]
  - - [1536, 2048, 1, 256, 1536, 1536, 1536, 256]
    - [1, 20072.2]
  - - [2048, 2048, 1, 256, 2048, 2048, 2048, 256]
    - [10, 21827.3]
  - - [2560, 2048, 1, 256, 2560, 2560, 2560, 256]
    - [1, 24210.0]
  - - [3072, 2048, 1, 256, 3072, 3072, 3072, 256]
    - [1, 25228.9]
  - - [512, 2560, 1, 256, 512, 512, 512, 256]
    - [10, 12315.4]
  - - [1024, 2560, 1, 256, 1024, 1024, 1024, 256]
    - [10, 18049.7]
  - - [1536, 2560, 1, 256, 1536, 1536, 1536, 256]
    - [1, 21382.0]
  - - [2048, 2560, 1, 256, 2048, 2048, 2048, 256]
    - [10, 24074.9]
  - - [2560, 2560, 1, 256, 2560, 2560, 2560, 256]
    - [4, 26057.2]
  - - [3072, 2560, 1, 256, 3072, 3072, 3072, 256]
    - [10, 27056.4]
  - - [512, 3072, 1, 256, 512, 512, 512, 256]
    - [1, 14516.8]
  - - [1024, 3072, 1, 256, 1024, 1024, 1024, 256]
    - [1, 20195.8]
  - - [1536, 3072, 1, 256, 1536, 1536, 1536, 256]
    - [1, 23816.2]
  - - [2048, 3072, 1, 256, 2048, 2048, 2048, 256]
    - [10, 25422.4]
  - - [2560, 3072, 1, 256, 2560, 2560, 2560, 256]
    - [10, 26619.1]
  - - [3072, 3072, 1, 256, 3072, 3072, 3072, 256]
    - [10, 27571.1]
  - - [512, 512, 1, 512, 512, 512, 512, 512]
    - [21, 7039.64]
  - - [1024, 512, 1, 512, 1024, 1024, 1024, 512]
    - [14, 11977.3]
  - - [1536, 512, 1, 512, 1536, 1536, 1536, 512]
    - [10, 14524.7]
  - - [2048, 512, 1, 512, 2048, 2048, 2048, 512]
    - [14, 17563.5]
  - - [2560, 512, 1, 512, 2560, 2560, 2560, 512]
    - [10, 18412.0]
  - - [3072, 512, 1, 512, 3072, 3072, 3072, 512]
    - [10, 21141.4]
  - - [512, 1024, 1, 512, 512, 512, 512, 512]
    - [14, 11998.7]
  - - [1024, 1024, 1, 512, 1024, 1024, 1024, 512]
    - [10, 16981.8]
  - - [1536, 1024, 1, 512, 1536, 1536, 1536, 512]
    - [1, 20320.9]
  - - [2048, 1024, 1, 512, 2048, 2048, 2048, 512]
    - [1, 22595.8]
  - - [2560, 1024, 1, 512, 2560, 2560, 2560, 512]
    - [1, 24364.0]
  - - [3072, 1024, 1, 512, 3072, 3072, 3072, 512]
    - [10, 26414.5]
  - - [512, 1536, 1, 512, 512, 512, 512, 512]
    - [1, 14521.8]
  - - [1024, 1536, 1, 512, 1024, 1024, 1024, 512]
    - [10, 20967.4]
  - - [1536, 1536, 1, 512, 1536, 1536, 1536, 512]
    - [1, 24099.4]
  - - [2048, 1536, 1, 512, 2048, 2048, 2048, 512]
    - [14, 26679.9]
  - - [2560, 1536, 1, 512, 2560, 2560, 2560, 512]
    - [10, 27529.0]
  - - [3072, 1536, 1, 512, 3072, 3072, 3072, 512]
    - [10, 28937.7]
  - - [512, 2048, 1, 512, 512, 512, 512, 512]
    - [1, 17460.4]
  - - [1024, 2048, 1, 512, 1024, 1024, 1024, 512]
    - [1, 23167.5]
  - - [1536, 2048, 1, 512, 1536, 1536, 1536, 512]
    - [1, 26336.8]
  - - [2048, 2048, 1, 512, 2048, 2048, 2048, 512]
    - [10, 28041.1]
  - - [2560, 2048, 1, 512, 2560, 2560, 2560, 512]
    - [1, 29457.5]
  - - [3072, 2048, 1, 512, 3072, 3072, 3072, 512]
    - [1, 30293.2]
  - - [512, 2560, 1, 512, 512, 512, 512, 512]
    - [1, 18841.8]
  - - [1024, 2560, 1, 512, 1024, 1024, 1024, 512]
    - [14, 24322.1]
  - - [1536, 2560, 1, 512, 1536, 1536, 1536, 512]
    - [4, 27461.4]
  - - [2048, 2560, 1, 512, 2048, 2048, 2048, 512]
    - [10, 29031.5]
  - - [2560, 2560, 1, 512, 2560, 2560, 2560, 512]
    - [14, 30636.2]
  - - [3072, 2560, 1, 512, 3072, 3072, 3072, 512]
    - [10, 31739.2]
  - - [512, 3072, 1, 512, 512, 512, 512, 512]
    - [10, 20973.2]
  - - [1024, 3072, 1, 512, 1024, 1024, 1024, 512]
    - [10, 25649.6]
  - - [1536, 3072, 1, 512, 1536, 1536, 1536, 512]
    - [1, 29691.5]
  - - [2048, 3072, 1, 512, 2048, 2048, 2048, 512]
    - [14, 31117.1]
  - - [2560, 3072, 1, 512, 2560, 2560, 2560, 512]
    - [1, 31392.0]
  - - [3072, 3072, 1, 512, 3072, 3072, 3072, 512]
    - [1, 32346.8]
  - - [512, 512, 1, 1024, 512, 512, 512, 1024]
    - [22, 10663.8]
  - - [1024, 512, 1, 1024, 1024, 1024, 1024, 1024]
    - [14, 17552.0]
  - - [1536, 512, 1, 1024, 1536, 1536, 1536, 1024]
    - [1, 19923.0]
  - - [2048, 512, 1, 1024, 2048, 2048, 2048, 1024]
    - [1, 24070.1]
  - - [2560, 512, 1, 1024, 2560, 2560, 2560, 1024]
    - [1, 24769.6]
  - - [3072, 512, 1, 1024, 3072, 3072, 3072, 1024]
    - [10, 26628.7]
  - - [512, 1024, 1, 1024, 512, 512, 512, 1024]
    - [10, 18149.5]
  - - [1024, 1024, 1, 1024, 1024, 1024, 1024, 1024]
    - [4, 23750.1]
  - - [1536, 1024, 1, 1024, 1536, 1536, 1536, 1024]
    - [10, 27215.0]
  - - [2048, 1024, 1, 1024, 2048, 2048, 2048, 1024]
    - [10, 28524.3]
  - - [2560, 1024, 1, 1024, 2560, 2560, 2560, 1024]
    - [4, 29944.8]
  - - [3072, 1024, 1, 1024, 3072, 3072, 3072, 1024]
    - [1, 30718.7]
  - - [512, 1536, 1, 1024, 512, 512, 512, 1024]
    - [4, 20424.2]
  - - [1024, 1536, 1, 1024, 1024, 1024, 1024, 1024]
    - [14, 26369.1]
  - - [1536, 1536, 1, 1024, 1536, 1536, 1536, 1024]
    - [10, 29096.6]
  - - [2048, 1536, 1, 1024, 2048, 2048, 2048, 1024]
    - [1, 30739.2]
  - - [2560, 1536, 1, 1024, 2560, 2560, 2560, 1024]
    - [10, 32291.2]
  - - [3072, 1536, 1, 1024, 3072, 3072, 3072, 1024]
    - [1, 32793.4]
  - - [512, 2048, 1, 1024, 512, 512, 512, 1024]
    - [14, 23341.5]
  - - [1024, 2048, 1, 1024, 1024, 1024, 1024, 1024]
    - [1, 28507.1]
  - - [1536, 2048, 1, 1024, 1536, 1536, 1536, 1024]
    - [1, 30648.4]
  - - [2048, 2048, 1, 1024, 2048, 2048, 2048, 1024]
    - [10, 33023.1]
  - - [2560, 2048, 1, 1024, 2560, 2560, 2560, 1024]
    - [1, 32991.4]
  - - [3072, 2048, 1, 1024, 3072, 3072, 3072, 1024]
    - [4, 33247.2]
  - - [512, 2560, 1, 1024, 512, 512, 512, 1024]
    - [1, 24350.8]
  - - [1024, 2560, 1, 1024, 1024, 1024, 1024, 1024]
    - [1, 29889.6]
  - - [1536, 2560, 1, 1024, 1536, 1536, 1536, 1024]
    - [1, 32282.1]
  - - [2048, 2560, 1, 1024, 2048, 2048, 2048, 1024]
    - [10, 33280.3]
  - - [2560, 2560, 1, 1024, 2560, 2560, 2560, 1024]
    - [4, 34141.8]
  - - [3072, 2560, 1, 1024, 3072, 3072, 3072, 1024]
    - [10, 35012.3]
  - - [512, 3072, 1, 1024, 512, 512, 512, 1024]
    - [1, 26806.5]
  - - [1024, 3072, 1, 1024, 1024, 1024, 1024, 1024]
    - [10, 30717.2]
  - - [1536, 3072, 1, 1024, 1536, 1536, 1536, 1024]
    - [1, 32592.8]
  - - [2048, 3072, 1, 1024, 2048, 2048, 2048, 1024]
    - [10, 33570.9]
  - - [2560, 3072, 1, 1024, 2560, 2560, 2560, 1024]
    - [10, 34114.0]
  - - [3072, 3072, 1, 1024, 3072, 3072, 3072, 1024]
    - [10, 34375.9]
  - - [512, 512, 1, 2048, 512, 512, 512, 2048]
    - [0, 15879.8]
  - - [1024, 512, 1, 2048, 1024, 1024, 1024, 2048]
    - [4, 23520.7]
  - - [1536, 512, 1, 2048, 1536, 1536, 1536, 2048]
    - [4, 24692.2]
  - - [2048, 512, 1, 2048, 2048, 2048, 2048, 2048]
    - [4, 28335.6]
  - - [2560, 512, 1, 2048, 2560, 2560, 2560, 2048]
    - [1, 28981.2]
  - - [3072, 512, 1, 2048, 3072, 3072, 3072, 2048]
    - [4, 30256.2]
  - - [512, 1024, 1, 2048, 512, 512, 512, 2048]
    - [1, 23374.7]
  - - [1024, 1024, 1, 2048, 1024, 1024, 1024, 2048]
    - [1, 28719.1]
  - - [1536, 1024, 1, 2048, 1536, 1536, 1536, 2048]
    - [10, 30590.1]
  - - [2048, 1024, 1, 2048, 2048, 2048, 2048, 2048]
    - [14, 31752.5]
  - - [2560, 1024, 1, 2048, 2560, 2560, 2560, 2048]
    - [14, 32966.0]
  - - [3072, 1024, 1, 2048, 3072, 3072, 3072, 2048]
    - [14, 33790.6]
  - - [512, 1536, 1, 2048, 512, 512, 512, 2048]
    - [10, 25494.9]
  - - [1024, 1536, 1, 2048, 1024, 1024, 1024, 2048]
    - [1, 30696.8]
  - - [1536, 1536, 1, 2048, 1536, 1536, 1536, 2048]
    - [14, 32092.9]
  - - [2048, 1536, 1, 2048, 2048, 2048, 2048, 2048]
    - [10, 34350.1]
  - - [2560, 1536, 1, 2048, 2560, 2560, 2560, 2048]
    - [10, 34282.7]
  - - [3072, 1536, 1, 2048, 3072, 3072, 3072, 2048]
    - [4, 34823.9]
  - - [512, 2048, 1, 2048, 512, 512, 512, 2048]
    - [14, 28476.9]
  - - [1024, 2048, 1, 2048, 1024, 1024, 1024, 2048]
    - [10, 32040.8]
  - - [1536, 2048, 1, 2048, 1536, 1536, 1536, 2048]
    - [1, 34065.3]
  - - [2048, 2048, 1, 2048, 2048, 2048, 2048, 2048]
    - [14, 34874.1]
  - - [2560, 2048, 1, 2048, 2560, 2560, 2560, 2048]
    - [4, 34690.3]
  - - [3072, 2048, 1, 2048, 3072, 3072, 3072, 2048]
    - [14, 34746.0]
  - - [512, 2560, 1, 2048, 512, 512, 512, 2048]
    - [10, 29129.3]
  - - [1024, 2560, 1, 2048, 1024, 1024, 1024, 2048]
    - [1, 33504.9]
  - - [1536, 2560, 1, 2048, 1536, 1536, 1536, 2048]
    - [1, 34165.4]
  - - [2048, 2560, 1, 2048, 2048, 2048, 2048, 2048]
    - [14, 35185.2]
  - - [2560, 2560, 1, 2048, 2560, 2560, 2560, 2048]
    - [4, 35712.7]
  - - [3072, 2560, 1, 2048, 3072, 3072, 3072, 2048]
    - [14, 35410.1]
  - - [512, 3072, 1, 2048, 512, 512, 512, 2048]
    - [10, 30924.0]
  - - [1024, 3072, 1, 2048, 1024, 1024, 1024, 2048]
    - [10, 34442.1]
  - - [1536, 3072, 1, 2048, 1536, 1536, 1536, 2048]
    - [1, 34416.9]
  - - [2048, 3072, 1, 2048, 2048, 2048, 2048, 2048]
    - [1, 35417.7]
  - - [2560, 3072, 1, 2048, 2560, 2560, 2560, 2048]
    - [1, 36130.8]
  - - [3072, 3072, 1, 2048, 3072, 3072, 3072, 2048]
    - [1, 35781.8]
  - - [512, 512, 1, 3072, 512, 512, 512, 3072]
    - [5, 18505.6]
  - - [1024, 512, 1, 3072, 1024, 1024, 1024, 3072]
    - [14, 26784.2]
  - - [1536, 512, 1, 3072, 1536, 1536, 1536, 3072]
    - [1, 26863.2]
  - - [2048, 512, 1, 3072, 2048, 2048, 2048, 3072]
    - [14, 30330.3]
  - - [2560, 512, 1, 3072, 2560, 2560, 2560, 3072]
    - [10, 30312.4]
  - - [3072, 512, 1, 3072, 3072, 3072, 3072, 3072]
    - [14, 31954.6]
  - - [512, 1024, 1, 3072, 512, 512, 512, 3072]
    - [10, 27581.6]
  - - [1024, 1024, 1, 3072, 1024, 1024, 1024, 3072]
    - [1, 30442.3]
  - - [1536, 1024, 1, 3072, 1536, 1536, 1536, 3072]
    - [1, 32377.3]
  - - [2048, 1024, 1, 3072, 2048, 2048, 2048, 3072]
    - [14, 32833.8]
  - - [2560, 1024, 1, 3072, 2560, 2560, 2560, 3072]
    - [4, 33500.5]
  - - [3072, 1024, 1, 3072, 3072, 3072, 3072, 3072]
    - [14, 34903.2]
  - - [512, 1536, 1, 3072, 512, 512, 512, 3072]
    - [14, 27321.4]
  - - [1024, 1536, 1, 3072, 1024, 1024, 1024, 3072]
    - [4, 31907.1]
  - - [1536, 1536, 1, 3072, 1536, 1536, 1536, 3072]
    - [1, 34141.0]
  - - [2048, 1536, 1, 3072, 2048, 2048, 2048, 3072]
    - [4, 34775.5]
  - - [2560, 1536, 1, 3072, 2560, 2560, 2560, 3072]
    - [14, 34524.7]
  - - [3072, 1536, 1, 3072, 3072, 3072, 3072, 3072]
    - [1, 35341.9]
  - - [512, 2048, 1, 3072, 512, 512, 512, 3072]
    - [1, 30885.4]
  - - [1024, 2048, 1, 3072, 1024, 1024, 1024, 3072]
    - [1, 33169.2]
  - - [1536, 2048, 1, 3072, 1536, 1536, 1536, 3072]
    - [10, 34491.4]
  - - [2048, 2048, 1, 3072, 2048, 2048, 2048, 3072]
    - [1, 34971.3]
  - - [2560, 2048, 1, 3072, 2560, 2560, 2560, 3072]
    - [10, 35169.6]
  - - [3072, 2048, 1, 3072, 3072, 3072, 3072, 3072]
    - [14, 35500.0]
  - - [512, 2560, 1, 3072, 512, 512, 512, 3072]
    - [1, 30661.5]
  - - [1024, 2560, 1, 3072, 1024, 1024, 1024, 3072]
    - [1, 34759.4]
  - - [1536, 2560, 1, 3072, 1536, 1536, 1536, 3072]
    - [1, 35330.0]
  - - [2048, 2560, 1, 3072, 2048, 2048, 2048, 3072]
    - [14, 35628.3]
  - - [2560, 2560, 1, 3072, 2560, 2560, 2560, 3072]
    - [1, 36394.4]
  - - [3072, 2560, 1, 3072, 3072, 3072, 3072, 3072]
    - [1, 35930.1]
  - - [512, 3072, 1, 3072, 512, 512, 512, 3072]
    - [10, 32554.4]
  - - [1024, 3072, 1, 3072, 1024, 1024, 1024, 3072]
    - [10, 34788.7]
  - - [1536, 3072, 1, 3072, 1536, 1536, 1536, 3072]
    - [1, 34971.6]
  - - [2048, 3072, 1, 3072, 2048, 2048, 2048, 3072]
    - [1, 36577.6]
  - - [2560, 3072, 1, 3072, 2560, 2560, 2560, 3072]
    - [10, 35918.9]
  - - [3072, 3072, 1, 3072, 3072, 3072, 3072, 3072]
    - [10, 36407.6]
  - - [1, 1, 1, 1, 1, 1, 1, 1]
    - [9, 6.63416e-05]
  - - [1, 1, 1, 64, 1, 1, 1, 64]
    - [7, 0.00422066]
  - - [1, 64, 1, 1, 1, 1, 1, 1]
    - [8, 0.00427008]
  - - [64, 1, 1, 1, 64, 64, 64, 1]
    - [19, 0.00426866]
  - - [64, 64, 1, 1, 64, 64, 64, 1]
    - [17, 0.278214]
  - - [64, 1, 1, 64, 64, 64, 64, 64]
    - [16, 0.272187]
  - - [1, 64, 1, 64, 1, 1, 1, 64]
    - [18, 0.27039]
  - - [64, 64, 1, 64, 64, 64, 64, 64]
    - [6, 17.6849]
  - - [64, 64, 1, 256, 64, 64, 64, 256]
    - [8, 62.4468]
  - - [64, 64, 1, 512, 64, 64, 64, 512]
    - [20, 117.563]
  - - [64, 64, 1, 1024, 64, 64, 64, 1024]
    - [18, 205.825]
  - - [64, 64, 1, 2048, 64, 64, 64, 2048]
    - [18, 323.903]
  - - [64, 64, 1, 4096, 64, 64, 64, 4096]
    - [18, 451.912]
- null
- null
- DeviceEfficiency
- GridBased
