library/src/amd_detail/rocblaslt/src/Tensile/Logic/asm_full/gfx1200/GridBased/gfx1200_Cijk_Ailk_Bljk_HHS_BH_Bias_HAS_AuxH_SAV_UserArgs.yaml
- {MinimumRequiredVersion: 4.33.0}
- gfx1200
- gfx1200
- [Device 73f0]
    SolutionIndex: 0
    SolutionNameMin: Cijk_Ailk_Bljk_HHS_BH_Bias_HAS_SAV_UserArgs_MT32x32x32_MI16x16x1_SN_LDSB0_CLR1_GSU1_LBSPPA512_LBSPPB128_MIWT1_1_NLCA1_PGR1_PLR1_SS0_SU32_SUM0_SUS256_SVW8_TLDS1_WG32_4_1_WGM8
    SolutionIndex: 1
    SolutionNameMin: Cijk_Ailk_Bljk_HHS_BH_Bias_HAS_SAV_UserArgs_MT32x32x32_MI16x16x1_SN_LDSB0_CLR1_GSU1_LBSPPA512_LBSPPB128_MIWT1_1_NLCA1_PGR2_PLR1_SS0_SU32_SUM0_SUS256_SVW8_TLDS1_WG32_4_1_WGM8
    SolutionIndex: 2
    SolutionNameMin: Cijk_Ailk_Bljk_HHS_BH_Bias_HAS_SAV_UserArgs_MT64x32x32_MI16x16x1_SN_LDSB0_CLR1_GSU1_LBSPPA1024_LBSPPB128_MIWT2_1_NLCA1_PGR1_PLR1_SS0_SU32_SUM0_SUS256_SVW8_TLDS1_WG32_4_1_WGM8
    SolutionIndex: 3
    SolutionNameMin: Cijk_Ailk_Bljk_HHS_BH_Bias_HAS_SAV_UserArgs_MT64x32x32_MI16x16x1_SN_LDSB0_CLR1_GSU1_LBSPPA1024_LBSPPB128_MIWT2_1_NLCA1_PGR2_PLR1_SS0_SU32_SUM0_SUS256_SVW8_TLDS1_WG32_4_1_WGM8
    SolutionIndex: 4
    SolutionNameMin: Cijk_Ailk_Bljk_HHS_BH_Bias_HAS_SAV_UserArgs_MT64x32x32_MI16x16x1_SN_LDSB0_CLR0_GSU1_LBSPPA1024_LBSPPB128_MIWT2_1_NLCA1_PGR1_PLR0_SS0_SU32_SUM0_SUS256_SVW8_TLDS1_WG32_4_1_WGM8
    SolutionIndex: 5
    SolutionNameMin: Cijk_Ailk_Bljk_HHS_BH_Bias_HAS_SAV_UserArgs_MT16x64x32_MI16x16x1_SN_LDSB0_CLR1_GSU1_LBSPPA256_LBSPPB128_MIWT1_1_NLCA1_PGR2_PLR1_SS0_SU32_SUM0_SUS256_SVW8_TLDS1_WG16_8_1_WGM8
    SolutionIndex: 6
    SolutionNameMin: Cijk_Ailk_Bljk_HHS_BH_Bias_HAS_SAV_UserArgs_MT32x64x32_MI16x16x1_SN_LDSB0_CLR1_GSU1_LBSPPA512_LBSPPB128_MIWT2_1_NLCA1_PGR1_PLR1_SS0_SU32_SUM0_SUS256_SVW8_TLDS1_WG16_8_1_WGM8
    SolutionIndex: 7
    SolutionNameMin: Cijk_Ailk_Bljk_HHS_BH_Bias_HAS_SAV_UserArgs_MT32x64x32_MI16x16x1_SN_LDSB0_CLR1_GSU1_LBSPPA512_LBSPPB128_MIWT2_1_NLCA1_PGR2_PLR1_SS0_SU32_SUM0_SUS256_SVW8_TLDS1_WG16_8_1_WGM8
    SolutionIndex: 8
    SolutionNameMin: Cijk_Ailk_Bljk_HHS_BH_Bias_HAS_SAV_UserArgs_MT32x32x64_MI16x16x1_SN_LDSB0_CLR1_GSU1_LBSPPA512_LBSPPB128_MIWT1_1_NLCA1_PGR1_PLR1_SS0_SU32_SUM0_SUS256_SVW8_TLDS1_WG32_4_1_WGM8
    SolutionIndex: 9
    SolutionNameMin: Cijk_Ailk_Bljk_HHS_BH_Bias_HAS_SAV_UserArgs_MT32x32x64_MI16x16x1_SN_LDSB0_CLR1_GSU1_LBSPPA512_LBSPPB512_MIWT1_1_NLCA1_PGR1_PLR3_SS0_SU32_SUM0_SUS256_SVW8_TLDS0_WG32_4_1_WGM8
    SolutionIndex: 10
    SolutionNameMin: Cijk_Ailk_Bljk_HHS_BH_Bias_HAS_SAV_UserArgs_MT32x32x64_MI16x16x1_SN_LDSB0_CLR1_GSU1_LBSPPA512_LBSPPB128_MIWT1_1_NLCA1_PGR1_PLR3_SS0_SU32_SUM0_SUS256_SVW8_TLDS1_WG32_4_1_WGM8
    SolutionIndex: 11
    SolutionNameMin: Cijk_Ailk_Bljk_HHS_BH_Bias_HAS_SAV_UserArgs_MT64x32x64_MI16x16x1_SN_LDSB0_CLR1_GSU1_LBSPPA1024_LBSPPB128_MIWT2_1_NLCA1_PGR1_PLR1_SS0_SU32_SUM0_SUS256_SVW8_TLDS1_WG32_4_1_WGM8
    SolutionIndex: 12
    SolutionNameMin: Cijk_Ailk_Bljk_HHS_BH_Bias_HAS_SAV_UserArgs_MT32x32x32_MI16x16x1_SN_LDSB0_CLR1_GSU1_LBSPPA512_LBSPPB128_MIWT1_1_NLCA1_PGR1_PLR1_SS1_SU32_SUM0_SUS256_SVW1_TLDS1_WG32_4_1_WGM8
    SolutionIndex: 13
    SolutionNameMin: Cijk_Ailk_Bljk_HHS_BH_Bias_HAS_SAV_UserArgs_MT32x32x32_MI16x16x1_SN_LDSB0_CLR1_GSU1_LBSPPA512_LBSPPB128_MIWT1_1_NLCA1_PGR2_PLR1_SS1_SU32_SUM0_SUS256_SVW1_TLDS1_WG32_4_1_WGM8
    SolutionIndex: 14
    SolutionNameMin: Cijk_Ailk_Bljk_HHS_BH_Bias_HAS_SAV_UserArgs_MT64x32x32_MI16x16x1_SN_LDSB0_CLR1_GSU1_LBSPPA1024_LBSPPB128_MIWT2_1_NLCA1_PGR1_PLR1_SS1_SU32_SUM0_SUS256_SVW1_TLDS1_WG32_4_1_WGM8
    SolutionIndex: 15
    SolutionNameMin: Cijk_Ailk_Bljk_HHS_BH_Bias_HAS_SAV_UserArgs_MT64x32x32_MI16x16x1_SN_LDSB0_CLR0_GSU1_LBSPPA1024_LBSPPB128_MIWT2_1_NLCA1_PGR1_PLR0_SS1_SU32_SUM0_SUS256_SVW1_TLDS1_WG32_4_1_WGM8
    SolutionIndex: 16
    SolutionNameMin: Cijk_Ailk_Bljk_HHS_BH_Bias_HAS_SAV_UserArgs_MT64x32x32_MI16x16x1_SN_LDSB0_CLR0_GSU1_LBSPPA1024_LBSPPB128_MIWT2_1_NLCA1_PGR2_PLR0_SS1_SU32_SUM0_SUS256_SVW1_TLDS1_WG32_4_1_WGM8
    SolutionIndex: 17
    SolutionNameMin: Cijk_Ailk_Bljk_HHS_BH_Bias_HAS_SAV_UserArgs_MT16x64x32_MI16x16x1_SN_LDSB0_CLR1_GSU1_LBSPPA256_LBSPPB128_MIWT1_1_NLCA1_PGR1_PLR1_SS1_SU32_SUM0_SUS256_SVW1_TLDS1_WG16_8_1_WGM8
    SolutionIndex: 18
    SolutionNameMin: Cijk_Ailk_Bljk_HHS_BH_Bias_HAS_SAV_UserArgs_MT16x64x32_MI16x16x1_SN_LDSB0_CLR0_GSU1_LBSPPA256_LBSPPB128_MIWT1_1_NLCA1_PGR2_PLR0_SS1_SU32_SUM0_SUS256_SVW1_TLDS1_WG16_8_1_WGM8
    SolutionIndex: 19
    SolutionNameMin: Cijk_Ailk_Bljk_HHS_BH_Bias_HAS_SAV_UserArgs_MT32x64x32_MI16x16x1_SN_LDSB0_CLR1_GSU1_LBSPPA512_LBSPPB128_MIWT2_1_NLCA1_PGR1_PLR1_SS1_SU32_SUM0_SUS256_SVW1_TLDS1_WG16_8_1_WGM8
    SolutionIndex: 20
    SolutionNameMin: Cijk_Ailk_Bljk_HHS_BH_Bias_HAS_SAV_UserArgs_MT32x64x32_MI16x16x1_SN_LDSB0_CLR0_GSU1_LBSPPA512_LBSPPB128_MIWT2_1_NLCA1_PGR2_PLR0_SS1_SU32_SUM0_SUS256_SVW1_TLDS1_WG16_8_1_WGM8
    SolutionIndex: 21
    SolutionNameMin: Cijk_Ailk_Bljk_HHS_BH_Bias_HAS_SAV_UserArgs_MT32x32x64_MI16x16x1_SN_LDSB0_CLR1_GSU1_LBSPPA512_LBSPPB128_MIWT1_1_NLCA1_PGR1_PLR1_SS1_SU32_SUM0_SUS256_SVW1_TLDS1_WG32_4_1_WGM8
    SolutionIndex: 22
    SolutionNameMin: Cijk_Ailk_Bljk_HHS_BH_Bias_HAS_SAV_UserArgs_MT32x32x64_MI16x16x1_SN_LDSB0_CLR1_GSU1_LBSPPA512_LBSPPB128_MIWT1_1_NLCA1_PGR1_PLR3_SS1_SU32_SUM0_SUS256_SVW1_TLDS1_WG32_4_1_WGM8
    SolutionIndex: 23
    SolutionNameMin: Cijk_Ailk_Bljk_HHS_BH_Bias_HAS_SAV_UserArgs_MT32x32x64_MI16x16x1_SN_LDSB0_CLR1_GSU1_LBSPPA512_LBSPPB128_MIWT1_1_NLCA1_PGR2_PLR3_SS1_SU32_SUM0_SUS256_SVW1_TLDS1_WG32_4_1_WGM8
    SolutionIndex: 24
    SolutionNameMin: Cijk_Ailk_Bljk_HHS_BH_Bias_HAS_SAV_UserArgs_MT64x32x64_MI16x16x1_SN_LDSB0_CLR1_GSU1_LBSPPA1024_LBSPPB128_MIWT2_1_NLCA1_PGR1_PLR3_SS1_SU32_SUM0_SUS256_SVW1_TLDS1_WG32_4_1_WGM8
    SolutionIndex: 25
    SolutionNameMin: Cijk_Ailk_Bljk_HHS_BH_Bias_HAS_SAV_UserArgs_MT32x64x64_MI16x16x1_SN_LDSB0_CLR0_GSU1_LBSPPA512_LBSPPB128_MIWT2_1_NLCA1_PGR1_PLR0_SS1_SU32_SUM0_SUS256_SVW1_TLDS1_WG16_8_1_WGM8
- - - [512, 512, 1, 64, 512, 512, 512, 64]
    - [16, 1102.78]
  - - [1024, 512, 1, 64, 1024, 1024, 1024, 64]
    - [6, 2110.34]
  - - [1536, 512, 1, 64, 1536, 1536, 1536, 64]
    - [1, 2716.22]
  - - [2048, 512, 1, 64, 2048, 2048, 2048, 64]
    - [2, 3824.3]
  - - [2560, 512, 1, 64, 2560, 2560, 2560, 64]
    - [3, 4454.8]
  - - [3072, 512, 1, 64, 3072, 3072, 3072, 64]
    - [17, 4254.67]
  - - [512, 1024, 1, 64, 512, 512, 512, 64]
    - [14, 2122.35]
  - - [1024, 1024, 1, 64, 1024, 1024, 1024, 64]
    - [20, 3584.78]
  - - [1536, 1024, 1, 64, 1536, 1536, 1536, 64]
    - [3, 5123.6]
  - - [2048, 1024, 1, 64, 2048, 2048, 2048, 64]
    - [3, 6276.11]
  - - [2560, 1024, 1, 64, 2560, 2560, 2560, 64]
    - [6, 6942.63]
  - - [3072, 1024, 1, 64, 3072, 3072, 3072, 64]
    - [7, 7808.35]
  - - [512, 1536, 1, 64, 512, 512, 512, 64]
    - [4, 2789.38]
  - - [1024, 1536, 1, 64, 1024, 1024, 1024, 64]
    - [3, 5102.82]
  - - [1536, 1536, 1, 64, 1536, 1536, 1536, 64]
    - [2, 6741.75]
  - - [2048, 1536, 1, 64, 2048, 2048, 2048, 64]
    - [3, 8102.81]
  - - [2560, 1536, 1, 64, 2560, 2560, 2560, 64]
    - [2, 9207.63]
  - - [3072, 1536, 1, 64, 3072, 3072, 3072, 64]
    - [3, 10299.8]
  - - [512, 2048, 1, 64, 512, 512, 512, 64]
    - [7, 3766.25]
  - - [1024, 2048, 1, 64, 1024, 1024, 1024, 64]
    - [2, 6254.18]
  - - [1536, 2048, 1, 64, 1536, 1536, 1536, 64]
    - [3, 7919.07]
  - - [2048, 2048, 1, 64, 2048, 2048, 2048, 64]
    - [2, 9321.0]
  - - [2560, 2048, 1, 64, 2560, 2560, 2560, 64]
    - [3, 10635.7]
  - - [3072, 2048, 1, 64, 3072, 3072, 3072, 64]
    - [3, 12069.0]
  - - [512, 2560, 1, 64, 512, 512, 512, 64]
    - [3, 4218.03]
  - - [1024, 2560, 1, 64, 1024, 1024, 1024, 64]
    - [2, 7070.04]
  - - [1536, 2560, 1, 64, 1536, 1536, 1536, 64]
    - [6, 9325.68]
  - - [2048, 2560, 1, 64, 2048, 2048, 2048, 64]
    - [3, 11009.6]
  - - [2560, 2560, 1, 64, 2560, 2560, 2560, 64]
    - [3, 12362.0]
  - - [3072, 2560, 1, 64, 3072, 3072, 3072, 64]
    - [7, 13337.8]
  - - [512, 3072, 1, 64, 512, 512, 512, 64]
    - [6, 5155.08]
  - - [1024, 3072, 1, 64, 1024, 1024, 1024, 64]
    - [7, 7920.79]
  - - [1536, 3072, 1, 64, 1536, 1536, 1536, 64]
    - [6, 10022.4]
  - - [2048, 3072, 1, 64, 2048, 2048, 2048, 64]
    - [3, 12052.6]
  - - [2560, 3072, 1, 64, 2560, 2560, 2560, 64]
    - [3, 13362.6]
  - - [3072, 3072, 1, 64, 3072, 3072, 3072, 64]
    - [2, 14403.3]
  - - [512, 512, 1, 256, 512, 512, 512, 256]
    - [0, 3747.32]
  - - [1024, 512, 1, 256, 1024, 1024, 1024, 256]
    - [6, 7243.46]
  - - [1536, 512, 1, 256, 1536, 1536, 1536, 256]
    - [8, 7307.28]
  - - [2048, 512, 1, 256, 2048, 2048, 2048, 256]
    - [2, 11509.0]
  - - [2560, 512, 1, 256, 2560, 2560, 2560, 256]
    - [2, 12441.2]
  - - [3072, 512, 1, 256, 3072, 3072, 3072, 256]
    - [14, 14099.2]
  - - [512, 1024, 1, 256, 512, 512, 512, 256]
    - [14, 7025.08]
  - - [1024, 1024, 1, 256, 1024, 1024, 1024, 256]
    - [6, 11538.9]
  - - [1536, 1024, 1, 256, 1536, 1536, 1536, 256]
    - [6, 14617.0]
  - - [2048, 1024, 1, 256, 2048, 2048, 2048, 256]
    - [2, 16680.5]
  - - [2560, 1024, 1, 256, 2560, 2560, 2560, 256]
    - [6, 18354.1]
  - - [3072, 1024, 1, 256, 3072, 3072, 3072, 256]
    - [2, 20047.2]
  - - [512, 1536, 1, 256, 512, 512, 512, 256]
    - [2, 9348.59]
  - - [1024, 1536, 1, 256, 1024, 1024, 1024, 256]
    - [6, 14485.5]
  - - [1536, 1536, 1, 256, 1536, 1536, 1536, 256]
    - [6, 17521.9]
  - - [2048, 1536, 1, 256, 2048, 2048, 2048, 256]
    - [2, 20114.8]
  - - [2560, 1536, 1, 256, 2560, 2560, 2560, 256]
    - [6, 22041.2]
  - - [3072, 1536, 1, 256, 3072, 3072, 3072, 256]
    - [2, 23013.8]
  - - [512, 2048, 1, 256, 512, 512, 512, 256]
    - [2, 11085.3]
  - - [1024, 2048, 1, 256, 1024, 1024, 1024, 256]
    - [2, 16850.9]
  - - [1536, 2048, 1, 256, 1536, 1536, 1536, 256]
    - [2, 20295.0]
  - - [2048, 2048, 1, 256, 2048, 2048, 2048, 256]
    - [2, 22703.6]
  - - [2560, 2048, 1, 256, 2560, 2560, 2560, 256]
    - [2, 24267.1]
  - - [3072, 2048, 1, 256, 3072, 3072, 3072, 256]
    - [6, 26107.7]
  - - [512, 2560, 1, 256, 512, 512, 512, 256]
    - [2, 12965.9]
  - - [1024, 2560, 1, 256, 1024, 1024, 1024, 256]
    - [2, 18366.6]
  - - [1536, 2560, 1, 256, 1536, 1536, 1536, 256]
    - [2, 22004.8]
  - - [2048, 2560, 1, 256, 2048, 2048, 2048, 256]
    - [2, 24317.7]
  - - [2560, 2560, 1, 256, 2560, 2560, 2560, 256]
    - [2, 25695.5]
  - - [3072, 2560, 1, 256, 3072, 3072, 3072, 256]
    - [2, 26936.9]
  - - [512, 3072, 1, 256, 512, 512, 512, 256]
    - [14, 14423.2]
  - - [1024, 3072, 1, 256, 1024, 1024, 1024, 256]
    - [6, 20027.0]
  - - [1536, 3072, 1, 256, 1536, 1536, 1536, 256]
    - [2, 23488.8]
  - - [2048, 3072, 1, 256, 2048, 2048, 2048, 256]
    - [19, 25372.4]
  - - [2560, 3072, 1, 256, 2560, 2560, 2560, 256]
    - [2, 26893.4]
  - - [3072, 3072, 1, 256, 3072, 3072, 3072, 256]
    - [6, 28682.9]
  - - [512, 512, 1, 512, 512, 512, 512, 512]
    - [11, 6659.94]
  - - [1024, 512, 1, 512, 1024, 1024, 1024, 512]
    - [14, 11566.3]
  - - [1536, 512, 1, 512, 1536, 1536, 1536, 512]
    - [6, 14604.0]
  - - [2048, 512, 1, 512, 2048, 2048, 2048, 512]
    - [14, 17389.7]
  - - [2560, 512, 1, 512, 2560, 2560, 2560, 512]
    - [6, 19021.2]
  - - [3072, 512, 1, 512, 3072, 3072, 3072, 512]
    - [19, 20904.8]
  - - [512, 1024, 1, 512, 512, 512, 512, 512]
    - [14, 11964.0]
  - - [1024, 1024, 1, 512, 1024, 1024, 1024, 512]
    - [6, 17177.7]
  - - [1536, 1024, 1, 512, 1536, 1536, 1536, 512]
    - [2, 20896.7]
  - - [2048, 1024, 1, 512, 2048, 2048, 2048, 512]
    - [2, 17762.9]
  - - [2560, 1024, 1, 512, 2560, 2560, 2560, 512]
    - [19, 25167.4]
  - - [3072, 1024, 1, 512, 3072, 3072, 3072, 512]
    - [6, 26659.8]
  - - [512, 1536, 1, 512, 512, 512, 512, 512]
    - [2, 14577.3]
  - - [1024, 1536, 1, 512, 1024, 1024, 1024, 512]
    - [25, 15994.3]
  - - [1536, 1536, 1, 512, 1536, 1536, 1536, 512]
    - [14, 23856.2]
  - - [2048, 1536, 1, 512, 2048, 2048, 2048, 512]
    - [14, 26373.2]
  - - [2560, 1536, 1, 512, 2560, 2560, 2560, 512]
    - [6, 27608.5]
  - - [3072, 1536, 1, 512, 3072, 3072, 3072, 512]
    - [2, 29444.8]
  - - [512, 2048, 1, 512, 512, 512, 512, 512]
    - [6, 17566.3]
  - - [1024, 2048, 1, 512, 1024, 1024, 1024, 512]
    - [2, 22682.0]
  - - [1536, 2048, 1, 512, 1536, 1536, 1536, 512]
    - [14, 26297.9]
  - - [2048, 2048, 1, 512, 2048, 2048, 2048, 512]
    - [2, 28275.7]
  - - [2560, 2048, 1, 512, 2560, 2560, 2560, 512]
    - [2, 29643.4]
  - - [3072, 2048, 1, 512, 3072, 3072, 3072, 512]
    - [2, 31025.5]
  - - [512, 2560, 1, 512, 512, 512, 512, 512]
    - [14, 18754.9]
  - - [1024, 2560, 1, 512, 1024, 1024, 1024, 512]
    - [2, 24558.2]
  - - [1536, 2560, 1, 512, 1536, 1536, 1536, 512]
    - [6, 27629.3]
  - - [2048, 2560, 1, 512, 2048, 2048, 2048, 512]
    - [6, 29677.8]
  - - [2560, 2560, 1, 512, 2560, 2560, 2560, 512]
    - [6, 31297.4]
  - - [3072, 2560, 1, 512, 3072, 3072, 3072, 512]
    - [6, 32040.3]
  - - [512, 3072, 1, 512, 512, 512, 512, 512]
    - [2, 20975.6]
  - - [1024, 3072, 1, 512, 1024, 1024, 1024, 512]
    - [2, 26490.8]
  - - [1536, 3072, 1, 512, 1536, 1536, 1536, 512]
    - [14, 29040.5]
  - - [2048, 3072, 1, 512, 2048, 2048, 2048, 512]
    - [6, 31019.4]
  - - [2560, 3072, 1, 512, 2560, 2560, 2560, 512]
    - [2, 31626.8]
  - - [3072, 3072, 1, 512, 3072, 3072, 3072, 512]
    - [2, 33263.9]
  - - [512, 512, 1, 1024, 512, 512, 512, 1024]
    - [11, 10976.3]
  - - [1024, 512, 1, 1024, 1024, 1024, 1024, 1024]
    - [14, 17862.1]
  - - [1536, 512, 1, 1024, 1536, 1536, 1536, 1024]
    - [24, 17439.6]
  - - [2048, 512, 1, 1024, 2048, 2048, 2048, 1024]
    - [14, 23430.8]
  - - [2560, 512, 1, 1024, 2560, 2560, 2560, 1024]
    - [14, 24764.8]
  - - [3072, 512, 1, 1024, 3072, 3072, 3072, 1024]
    - [2, 26835.5]
  - - [512, 1024, 1, 1024, 512, 512, 512, 1024]
    - [19, 18085.3]
  - - [1024, 1024, 1, 1024, 1024, 1024, 1024, 1024]
    - [2, 23671.6]
  - - [1536, 1024, 1, 1024, 1536, 1536, 1536, 1024]
    - [2, 26453.8]
  - - [2048, 1024, 1, 1024, 2048, 2048, 2048, 1024]
    - [2, 28648.2]
  - - [2560, 1024, 1, 1024, 2560, 2560, 2560, 1024]
    - [14, 29639.9]
  - - [3072, 1024, 1, 1024, 3072, 3072, 3072, 1024]
    - [6, 30994.0]
  - - [512, 1536, 1, 1024, 512, 512, 512, 1024]
    - [19, 20362.0]
  - - [1024, 1536, 1, 1024, 1024, 1024, 1024, 1024]
    - [19, 26651.0]
  - - [1536, 1536, 1, 1024, 1536, 1536, 1536, 1024]
    - [14, 28667.6]
  - - [2048, 1536, 1, 1024, 2048, 2048, 2048, 1024]
    - [2, 31269.9]
  - - [2560, 1536, 1, 1024, 2560, 2560, 2560, 1024]
    - [19, 31786.8]
  - - [3072, 1536, 1, 1024, 3072, 3072, 3072, 1024]
    - [2, 32638.1]
  - - [512, 2048, 1, 1024, 512, 512, 512, 1024]
    - [19, 23477.0]
  - - [1024, 2048, 1, 1024, 1024, 1024, 1024, 1024]
    - [2, 28711.4]
  - - [1536, 2048, 1, 1024, 1536, 1536, 1536, 1024]
    - [2, 31338.4]
  - - [2048, 2048, 1, 1024, 2048, 2048, 2048, 1024]
    - [2, 32280.9]
  - - [2560, 2048, 1, 1024, 2560, 2560, 2560, 1024]
    - [14, 33493.4]
  - - [3072, 2048, 1, 1024, 3072, 3072, 3072, 1024]
    - [2, 33769.3]
  - - [512, 2560, 1, 1024, 512, 512, 512, 1024]
    - [6, 24833.8]
  - - [1024, 2560, 1, 1024, 1024, 1024, 1024, 1024]
    - [2, 29926.4]
  - - [1536, 2560, 1, 1024, 1536, 1536, 1536, 1024]
    - [6, 31938.4]
  - - [2048, 2560, 1, 1024, 2048, 2048, 2048, 1024]
    - [14, 33211.2]
  - - [2560, 2560, 1, 1024, 2560, 2560, 2560, 1024]
    - [2, 34754.8]
  - - [3072, 2560, 1, 1024, 3072, 3072, 3072, 1024]
    - [14, 35387.6]
  - - [512, 3072, 1, 1024, 512, 512, 512, 1024]
    - [14, 26864.8]
  - - [1024, 3072, 1, 1024, 1024, 1024, 1024, 1024]
    - [14, 31058.4]
  - - [1536, 3072, 1, 1024, 1536, 1536, 1536, 1024]
    - [14, 32940.1]
  - - [2048, 3072, 1, 1024, 2048, 2048, 2048, 1024]
    - [14, 34567.0]
  - - [2560, 3072, 1, 1024, 2560, 2560, 2560, 1024]
    - [14, 34955.1]
  - - [3072, 3072, 1, 1024, 3072, 3072, 3072, 1024]
    - [2, 35700.4]
  - - [512, 512, 1, 2048, 512, 512, 512, 2048]
    - [12, 15600.1]
  - - [1024, 512, 1, 2048, 1024, 1024, 1024, 2048]
    - [19, 23765.9]
  - - [1536, 512, 1, 2048, 1536, 1536, 1536, 2048]
    - [19, 20093.5]
  - - [2048, 512, 1, 2048, 2048, 2048, 2048, 2048]
    - [6, 27942.4]
  - - [2560, 512, 1, 2048, 2560, 2560, 2560, 2048]
    - [6, 28709.5]
  - - [3072, 512, 1, 2048, 3072, 3072, 3072, 2048]
    - [6, 30761.4]
  - - [512, 1024, 1, 2048, 512, 512, 512, 2048]
    - [6, 23871.8]
  - - [1024, 1024, 1, 2048, 1024, 1024, 1024, 2048]
    - [19, 28220.0]
  - - [1536, 1024, 1, 2048, 1536, 1536, 1536, 2048]
    - [14, 30778.9]
  - - [2048, 1024, 1, 2048, 2048, 2048, 2048, 2048]
    - [2, 32535.7]
  - - [2560, 1024, 1, 2048, 2560, 2560, 2560, 2048]
    - [19, 33459.0]
  - - [3072, 1024, 1, 2048, 3072, 3072, 3072, 2048]
    - [19, 34043.7]
  - - [512, 1536, 1, 2048, 512, 512, 512, 2048]
    - [14, 24983.7]
  - - [1024, 1536, 1, 2048, 1024, 1024, 1024, 2048]
    - [2, 30956.8]
  - - [1536, 1536, 1, 2048, 1536, 1536, 1536, 2048]
    - [2, 32333.8]
  - - [2048, 1536, 1, 2048, 2048, 2048, 2048, 2048]
    - [2, 33769.3]
  - - [2560, 1536, 1, 2048, 2560, 2560, 2560, 2048]
    - [14, 34579.2]
  - - [3072, 1536, 1, 2048, 3072, 3072, 3072, 2048]
    - [19, 34607.7]
  - - [512, 2048, 1, 2048, 512, 512, 512, 2048]
    - [15, 27721.8]
  - - [1024, 2048, 1, 2048, 1024, 1024, 1024, 2048]
    - [19, 32373.6]
  - - [1536, 2048, 1, 2048, 1536, 1536, 1536, 2048]
    - [2, 34114.2]
  - - [2048, 2048, 1, 2048, 2048, 2048, 2048, 2048]
    - [2, 34644.4]
  - - [2560, 2048, 1, 2048, 2560, 2560, 2560, 2048]
    - [2, 35409.6]
  - - [3072, 2048, 1, 2048, 3072, 3072, 3072, 2048]
    - [19, 36021.8]
  - - [512, 2560, 1, 2048, 512, 512, 512, 2048]
    - [2, 28845.4]
  - - [1024, 2560, 1, 2048, 1024, 1024, 1024, 2048]
    - [2, 33035.2]
  - - [1536, 2560, 1, 2048, 1536, 1536, 1536, 2048]
    - [2, 34694.1]
  - - [2048, 2560, 1, 2048, 2048, 2048, 2048, 2048]
    - [6, 35699.2]
  - - [2560, 2560, 1, 2048, 2560, 2560, 2560, 2048]
    - [19, 35409.2]
  - - [3072, 2560, 1, 2048, 3072, 3072, 3072, 2048]
    - [6, 35717.4]
  - - [512, 3072, 1, 2048, 512, 512, 512, 2048]
    - [2, 30754.1]
  - - [1024, 3072, 1, 2048, 1024, 1024, 1024, 2048]
    - [19, 34233.1]
  - - [1536, 3072, 1, 2048, 1536, 1536, 1536, 2048]
    - [14, 35127.6]
  - - [2048, 3072, 1, 2048, 2048, 2048, 2048, 2048]
    - [19, 35648.4]
  - - [2560, 3072, 1, 2048, 2560, 2560, 2560, 2048]
    - [6, 35884.1]
  - - [3072, 3072, 1, 2048, 3072, 3072, 3072, 2048]
    - [6, 37382.1]
  - - [512, 512, 1, 3072, 512, 512, 512, 3072]
    - [12, 18127.9]
  - - [1024, 512, 1, 3072, 1024, 1024, 1024, 3072]
    - [19, 26442.7]
  - - [1536, 512, 1, 3072, 1536, 1536, 1536, 3072]
    - [6, 26322.2]
  - - [2048, 512, 1, 3072, 2048, 2048, 2048, 3072]
    - [19, 30968.7]
  - - [2560, 512, 1, 3072, 2560, 2560, 2560, 3072]
    - [14, 30018.1]
  - - [3072, 512, 1, 3072, 3072, 3072, 3072, 3072]
    - [6, 32424.1]
  - - [512, 1024, 1, 3072, 512, 512, 512, 3072]
    - [2, 27073.0]
  - - [1024, 1024, 1, 3072, 1024, 1024, 1024, 3072]
    - [2, 30600.4]
  - - [1536, 1024, 1, 3072, 1536, 1536, 1536, 3072]
    - [19, 32482.0]
  - - [2048, 1024, 1, 3072, 2048, 2048, 2048, 3072]
    - [19, 33371.5]
  - - [2560, 1024, 1, 3072, 2560, 2560, 2560, 3072]
    - [14, 34360.5]
  - - [3072, 1024, 1, 3072, 3072, 3072, 3072, 3072]
    - [2, 34915.3]
  - - [512, 1536, 1, 3072, 512, 512, 512, 3072]
    - [2, 27553.8]
  - - [1024, 1536, 1, 3072, 1024, 1024, 1024, 3072]
    - [2, 32703.2]
  - - [1536, 1536, 1, 3072, 1536, 1536, 1536, 3072]
    - [6, 33662.8]
  - - [2048, 1536, 1, 3072, 2048, 2048, 2048, 3072]
    - [2, 34536.4]
  - - [2560, 1536, 1, 3072, 2560, 2560, 2560, 3072]
    - [6, 35147.2]
  - - [3072, 1536, 1, 3072, 3072, 3072, 3072, 3072]
    - [19, 35200.9]
  - - [512, 2048, 1, 3072, 512, 512, 512, 3072]
    - [2, 31780.0]
  - - [1024, 2048, 1, 3072, 1024, 1024, 1024, 3072]
    - [14, 33546.5]
  - - [1536, 2048, 1, 3072, 1536, 1536, 1536, 3072]
    - [14, 34553.2]
  - - [2048, 2048, 1, 3072, 2048, 2048, 2048, 3072]
    - [14, 35790.3]
  - - [2560, 2048, 1, 3072, 2560, 2560, 2560, 3072]
    - [2, 36033.7]
  - - [3072, 2048, 1, 3072, 3072, 3072, 3072, 3072]
    - [6, 36455.0]
  - - [512, 2560, 1, 3072, 512, 512, 512, 3072]
    - [6, 31027.4]
  - - [1024, 2560, 1, 3072, 1024, 1024, 1024, 3072]
    - [6, 35006.1]
  - - [1536, 2560, 1, 3072, 1536, 1536, 1536, 3072]
    - [19, 35047.6]
  - - [2048, 2560, 1, 3072, 2048, 2048, 2048, 3072]
    - [2, 36074.1]
  - - [2560, 2560, 1, 3072, 2560, 2560, 2560, 3072]
    - [14, 36488.0]
  - - [3072, 2560, 1, 3072, 3072, 3072, 3072, 3072]
    - [14, 36276.3]
  - - [512, 3072, 1, 3072, 512, 512, 512, 3072]
    - [2, 33344.3]
  - - [1024, 3072, 1, 3072, 1024, 1024, 1024, 3072]
    - [14, 35036.4]
  - - [1536, 3072, 1, 3072, 1536, 1536, 1536, 3072]
    - [14, 36277.7]
  - - [2048, 3072, 1, 3072, 2048, 2048, 2048, 3072]
    - [2, 35989.7]
  - - [2560, 3072, 1, 3072, 2560, 2560, 2560, 3072]
    - [6, 36792.8]
  - - [3072, 3072, 1, 3072, 3072, 3072, 3072, 3072]
    - [2, 37505.2]
  - - [1, 1, 1, 1, 1, 1, 1, 1]
    - [13, 6.53659e-05]
  - - [1, 1, 1, 64, 1, 1, 1, 64]
    - [23, 0.00415476]
  - - [1, 64, 1, 1, 1, 1, 1, 1]
    - [5, 0.00401506]
  - - [64, 1, 1, 1, 64, 64, 64, 1]
    - [12, 0.00426141]
  - - [64, 64, 1, 1, 64, 64, 64, 1]
    - [18, 0.268344]
  - - [64, 1, 1, 64, 64, 64, 64, 64]
    - [22, 0.267642]
  - - [1, 64, 1, 64, 1, 1, 1, 64]
    - [22, 0.266519]
  - - [64, 64, 1, 64, 64, 64, 64, 64]
    - [9, 16.5652]
  - - [64, 64, 1, 256, 64, 64, 64, 256]
    - [10, 65.3522]
  - - [64, 64, 1, 512, 64, 64, 64, 512]
    - [22, 116.908]
  - - [64, 64, 1, 1024, 64, 64, 64, 1024]
    - [22, 202.047]
  - - [64, 64, 1, 2048, 64, 64, 64, 2048]
    - [22, 318.541]
  - - [64, 64, 1, 4096, 64, 64, 64, 4096]
    - [21, 435.687]
- null
- null
- DeviceEfficiency
- GridBased
