library/src/amd_detail/rocblaslt/src/Tensile/Logic/asm_full/gfx1200/GridBased/gfx1200_Cijk_Alik_Bljk_BBS_BH_Bias_HAS_SAV_UserArgs.yaml
- {MinimumRequiredVersion: 4.33.0}
- gfx1200
- gfx1200
- [Device 73f0]
    SolutionIndex: 0
    SolutionNameMin: Cijk_Alik_Bljk_BBS_BH_Bias_HAS_SAV_UserArgs_MT32x32x32_MI16x16x1_SN_CLR1_GSU1_LBSPPA128_LBSPPB128_MIWT1_1_PGR1_PLR1_SS0_SU32_SUM0_SUS256_SVW8_TLDS1_WG32_4_1_WGM8
    SolutionIndex: 1
    SolutionNameMin: Cijk_Alik_Bljk_BBS_BH_Bias_HAS_SAV_UserArgs_MT64x32x32_MI16x16x1_SN_CLR1_GSU1_LBSPPA128_LBSPPB128_MIWT2_1_PGR1_PLR1_SS0_SU32_SUM0_SUS256_SVW8_TLDS1_WG32_4_1_WGM8
    SolutionIndex: 2
    SolutionNameMin: Cijk_Alik_Bljk_BBS_BH_Bias_HAS_SAV_UserArgs_MT64x32x32_MI16x16x1_SN_CLR1_GSU1_LBSPPA128_LBSPPB128_MIWT2_1_PGR2_PLR1_SS0_SU32_SUM0_SUS256_SVW8_TLDS1_WG32_4_1_WGM8
    SolutionIndex: 3
    SolutionNameMin: Cijk_Alik_Bljk_BBS_BH_Bias_HAS_SAV_UserArgs_MT64x32x32_MI16x16x1_SN_CLR0_GSU1_LBSPPA128_LBSPPB128_MIWT2_1_PGR1_PLR0_SS0_SU32_SUM0_SUS256_SVW8_TLDS1_WG32_4_1_WGM8
    SolutionIndex: 4
    SolutionNameMin: Cijk_Alik_Bljk_BBS_BH_Bias_HAS_SAV_UserArgs_MT32x64x32_MI16x16x1_SN_CLR1_GSU1_LBSPPA128_LBSPPB128_MIWT2_1_PGR1_PLR1_SS0_SU32_SUM0_SUS256_SVW8_TLDS1_WG16_8_1_WGM8
    SolutionIndex: 5
    SolutionNameMin: Cijk_Alik_Bljk_BBS_BH_Bias_HAS_SAV_UserArgs_MT32x64x32_MI16x16x1_SN_CLR1_GSU1_LBSPPA128_LBSPPB128_MIWT2_1_PGR2_PLR1_SS0_SU32_SUM0_SUS256_SVW8_TLDS1_WG16_8_1_WGM8
    SolutionIndex: 6
    SolutionNameMin: Cijk_Alik_Bljk_BBS_BH_Bias_HAS_SAV_UserArgs_MT32x64x32_MI16x16x1_SN_CLR0_GSU1_LBSPPA128_LBSPPB128_MIWT2_1_PGR1_PLR0_SS0_SU32_SUM0_SUS256_SVW8_TLDS1_WG16_8_1_WGM8
    SolutionIndex: 7
    SolutionNameMin: Cijk_Alik_Bljk_BBS_BH_Bias_HAS_SAV_UserArgs_MT32x64x32_MI16x16x1_SN_CLR0_GSU1_LBSPPA128_LBSPPB128_MIWT2_1_PGR2_PLR0_SS0_SU32_SUM0_SUS256_SVW8_TLDS1_WG16_8_1_WGM8
    SolutionIndex: 8
    SolutionNameMin: Cijk_Alik_Bljk_BBS_BH_Bias_HAS_SAV_UserArgs_MT32x32x64_MI16x16x1_SN_CLR1_GSU1_LBSPPA128_LBSPPB128_MIWT1_1_PGR1_PLR1_SS0_SU32_SUM0_SUS256_SVW8_TLDS1_WG32_4_1_WGM8
    SolutionIndex: 9
    SolutionNameMin: Cijk_Alik_Bljk_BBS_BH_Bias_HAS_SAV_UserArgs_MT32x32x64_MI16x16x1_SN_CLR1_GSU1_LBSPPA128_LBSPPB128_MIWT1_1_PGR1_PLR3_SS0_SU32_SUM0_SUS256_SVW8_TLDS1_WG32_4_1_WGM8
    SolutionIndex: 10
    SolutionNameMin: Cijk_Alik_Bljk_BBS_BH_Bias_HAS_SAV_UserArgs_MT32x32x64_MI16x16x1_SN_CLR0_GSU1_LBSPPA128_LBSPPB128_MIWT1_1_PGR1_PLR0_SS0_SU32_SUM0_SUS256_SVW8_TLDS1_WG32_4_1_WGM8
    SolutionIndex: 11
    SolutionNameMin: Cijk_Alik_Bljk_BBS_BH_Bias_HAS_SAV_UserArgs_MT64x16x32_MI16x16x1_SN_CLR1_GSU1_LBSPPA128_LBSPPB128_MIWT1_1_PGR2_PLR1_SS1_SU32_SUM0_SUS256_SVW1_TLDS1_WG64_2_1_WGM8
    SolutionIndex: 12
    SolutionNameMin: Cijk_Alik_Bljk_BBS_BH_Bias_HAS_SAV_UserArgs_MT64x16x32_MI16x16x1_SN_CLR0_GSU1_LBSPPA128_LBSPPB128_MIWT1_1_PGR2_PLR0_SS1_SU32_SUM0_SUS256_SVW1_TLDS1_WG64_2_1_WGM8
    SolutionIndex: 13
    SolutionNameMin: Cijk_Alik_Bljk_BBS_BH_Bias_HAS_SAV_UserArgs_MT32x32x32_MI16x16x1_SN_CLR1_GSU1_LBSPPA128_LBSPPB128_MIWT1_1_PGR1_PLR1_SS1_SU32_SUM0_SUS256_SVW1_TLDS1_WG32_4_1_WGM8
    SolutionIndex: 14
    SolutionNameMin: Cijk_Alik_Bljk_BBS_BH_Bias_HAS_SAV_UserArgs_MT32x32x32_MI16x16x1_SN_CLR1_GSU1_LBSPPA128_LBSPPB128_MIWT1_1_PGR2_PLR1_SS1_SU32_SUM0_SUS256_SVW1_TLDS1_WG32_4_1_WGM8
    SolutionIndex: 15
    SolutionNameMin: Cijk_Alik_Bljk_BBS_BH_Bias_HAS_SAV_UserArgs_MT32x32x32_MI16x16x1_SN_CLR0_GSU1_LBSPPA128_LBSPPB128_MIWT1_1_PGR1_PLR0_SS1_SU32_SUM0_SUS256_SVW1_TLDS1_WG32_4_1_WGM8
    SolutionIndex: 16
    SolutionNameMin: Cijk_Alik_Bljk_BBS_BH_Bias_HAS_SAV_UserArgs_MT32x32x32_MI16x16x1_SN_CLR0_GSU1_LBSPPA128_LBSPPB128_MIWT1_1_PGR2_PLR0_SS1_SU32_SUM0_SUS256_SVW1_TLDS1_WG32_4_1_WGM8
    SolutionIndex: 17
    SolutionNameMin: Cijk_Alik_Bljk_BBS_BH_Bias_HAS_SAV_UserArgs_MT64x32x32_MI16x16x1_SN_CLR1_GSU1_LBSPPA128_LBSPPB128_MIWT2_1_PGR1_PLR1_SS1_SU32_SUM0_SUS256_SVW1_TLDS1_WG32_4_1_WGM8
    SolutionIndex: 18
    SolutionNameMin: Cijk_Alik_Bljk_BBS_BH_Bias_HAS_SAV_UserArgs_MT64x32x32_MI16x16x1_SN_CLR0_GSU1_LBSPPA128_LBSPPB128_MIWT2_1_PGR1_PLR0_SS1_SU32_SUM0_SUS256_SVW1_TLDS1_WG32_4_1_WGM8
    SolutionIndex: 19
    SolutionNameMin: Cijk_Alik_Bljk_BBS_BH_Bias_HAS_SAV_UserArgs_MT32x64x32_MI16x16x1_SN_CLR1_GSU1_LBSPPA128_LBSPPB128_MIWT2_1_PGR1_PLR1_SS1_SU32_SUM0_SUS256_SVW1_TLDS1_WG16_8_1_WGM8
    SolutionIndex: 20
    SolutionNameMin: Cijk_Alik_Bljk_BBS_BH_Bias_HAS_SAV_UserArgs_MT32x64x32_MI16x16x1_SN_CLR0_GSU1_LBSPPA128_LBSPPB128_MIWT2_1_PGR1_PLR0_SS1_SU32_SUM0_SUS256_SVW1_TLDS1_WG16_8_1_WGM8
    SolutionIndex: 21
    SolutionNameMin: Cijk_Alik_Bljk_BBS_BH_Bias_HAS_SAV_UserArgs_MT32x32x64_MI16x16x1_SN_CLR1_GSU1_LBSPPA128_LBSPPB128_MIWT1_1_PGR1_PLR1_SS1_SU32_SUM0_SUS256_SVW1_TLDS1_WG32_4_1_WGM8
    SolutionIndex: 22
    SolutionNameMin: Cijk_Alik_Bljk_BBS_BH_Bias_HAS_SAV_UserArgs_MT32x32x64_MI16x16x1_SN_CLR1_GSU1_LBSPPA128_LBSPPB128_MIWT1_1_PGR1_PLR3_SS1_SU32_SUM0_SUS256_SVW1_TLDS1_WG32_4_1_WGM8
- - - [512, 512, 1, 64, 512, 512, 64, 64]
    - [11, 1131.84]
  - - [1024, 512, 1, 64, 1024, 1024, 64, 64]
    - [3, 2046.5]
  - - [1536, 512, 1, 64, 1536, 1536, 64, 64]
    - [5, 2832.63]
  - - [2048, 512, 1, 64, 2048, 2048, 64, 64]
    - [1, 3619.68]
  - - [2560, 512, 1, 64, 2560, 2560, 64, 64]
    - [4, 4289.31]
  - - [3072, 512, 1, 64, 3072, 3072, 64, 64]
    - [4, 5043.88]
  - - [512, 1024, 1, 64, 512, 512, 64, 64]
    - [4, 2088.6]
  - - [1024, 1024, 1, 64, 1024, 1024, 64, 64]
    - [2, 3693.59]
  - - [1536, 1024, 1, 64, 1536, 1536, 64, 64]
    - [4, 5043.76]
  - - [2048, 1024, 1, 64, 2048, 2048, 64, 64]
    - [3, 5929.0]
  - - [2560, 1024, 1, 64, 2560, 2560, 64, 64]
    - [6, 6985.99]
  - - [3072, 1024, 1, 64, 3072, 3072, 64, 64]
    - [4, 7814.41]
  - - [512, 1536, 1, 64, 512, 512, 64, 64]
    - [3, 2822.31]
  - - [1024, 1536, 1, 64, 1024, 1024, 64, 64]
    - [4, 5040.09]
  - - [1536, 1536, 1, 64, 1536, 1536, 64, 64]
    - [1, 6542.53]
  - - [2048, 1536, 1, 64, 2048, 2048, 64, 64]
    - [4, 7775.18]
  - - [2560, 1536, 1, 64, 2560, 2560, 64, 64]
    - [4, 8900.85]
  - - [3072, 1536, 1, 64, 3072, 3072, 64, 64]
    - [4, 9853.65]
  - - [512, 2048, 1, 64, 512, 512, 64, 64]
    - [6, 3716.09]
  - - [1024, 2048, 1, 64, 1024, 1024, 64, 64]
    - [1, 5907.99]
  - - [1536, 2048, 1, 64, 1536, 1536, 64, 64]
    - [4, 7794.75]
  - - [2048, 2048, 1, 64, 2048, 2048, 64, 64]
    - [4, 9256.71]
  - - [2560, 2048, 1, 64, 2560, 2560, 64, 64]
    - [4, 10386.4]
  - - [3072, 2048, 1, 64, 3072, 3072, 64, 64]
    - [5, 11218.2]
  - - [512, 2560, 1, 64, 512, 512, 64, 64]
    - [4, 4281.65]
  - - [1024, 2560, 1, 64, 1024, 1024, 64, 64]
    - [7, 6698.29]
  - - [1536, 2560, 1, 64, 1536, 1536, 64, 64]
    - [5, 8896.13]
  - - [2048, 2560, 1, 64, 2048, 2048, 64, 64]
    - [4, 10133.5]
  - - [2560, 2560, 1, 64, 2560, 2560, 64, 64]
    - [2, 11539.1]
  - - [3072, 2560, 1, 64, 3072, 3072, 64, 64]
    - [1, 12551.4]
  - - [512, 3072, 1, 64, 512, 512, 64, 64]
    - [1, 5022.37]
  - - [1024, 3072, 1, 64, 1024, 1024, 64, 64]
    - [1, 7505.05]
  - - [1536, 3072, 1, 64, 1536, 1536, 64, 64]
    - [1, 9829.44]
  - - [2048, 3072, 1, 64, 2048, 2048, 64, 64]
    - [4, 11303.3]
  - - [2560, 3072, 1, 64, 2560, 2560, 64, 64]
    - [7, 12434.8]
  - - [3072, 3072, 1, 64, 3072, 3072, 64, 64]
    - [1, 13456.3]
  - - [512, 512, 1, 256, 512, 512, 256, 256]
    - [0, 3818.86]
  - - [1024, 512, 1, 256, 1024, 1024, 256, 256]
    - [4, 7196.66]
  - - [1536, 512, 1, 256, 1536, 1536, 256, 256]
    - [4, 9144.35]
  - - [2048, 512, 1, 256, 2048, 2048, 256, 256]
    - [4, 11408.5]
  - - [2560, 512, 1, 256, 2560, 2560, 256, 256]
    - [4, 12809.7]
  - - [3072, 512, 1, 256, 3072, 3072, 256, 256]
    - [4, 14104.2]
  - - [512, 1024, 1, 256, 512, 512, 256, 256]
    - [17, 7202.45]
  - - [1024, 1024, 1, 256, 1024, 1024, 256, 256]
    - [1, 11010.0]
  - - [1536, 1024, 1, 256, 1536, 1536, 256, 256]
    - [1, 14441.1]
  - - [2048, 1024, 1, 256, 2048, 2048, 256, 256]
    - [1, 16287.6]
  - - [2560, 1024, 1, 256, 2560, 2560, 256, 256]
    - [4, 18464.9]
  - - [3072, 1024, 1, 256, 3072, 3072, 256, 256]
    - [1, 20007.1]
  - - [512, 1536, 1, 256, 512, 512, 256, 256]
    - [4, 9232.41]
  - - [1024, 1536, 1, 256, 1024, 1024, 256, 256]
    - [1, 14448.6]
  - - [1536, 1536, 1, 256, 1536, 1536, 256, 256]
    - [4, 17194.7]
  - - [2048, 1536, 1, 256, 2048, 2048, 256, 256]
    - [4, 19878.7]
  - - [2560, 1536, 1, 256, 2560, 2560, 256, 256]
    - [4, 21584.0]
  - - [3072, 1536, 1, 256, 3072, 3072, 256, 256]
    - [1, 22774.3]
  - - [512, 2048, 1, 256, 512, 512, 256, 256]
    - [4, 11154.4]
  - - [1024, 2048, 1, 256, 1024, 1024, 256, 256]
    - [4, 16613.2]
  - - [1536, 2048, 1, 256, 1536, 1536, 256, 256]
    - [4, 19720.0]
  - - [2048, 2048, 1, 256, 2048, 2048, 256, 256]
    - [1, 22195.8]
  - - [2560, 2048, 1, 256, 2560, 2560, 256, 256]
    - [4, 23639.7]
  - - [3072, 2048, 1, 256, 3072, 3072, 256, 256]
    - [1, 25225.1]
  - - [512, 2560, 1, 256, 512, 512, 256, 256]
    - [4, 12506.3]
  - - [1024, 2560, 1, 256, 1024, 1024, 256, 256]
    - [4, 18331.2]
  - - [1536, 2560, 1, 256, 1536, 1536, 256, 256]
    - [4, 21584.0]
  - - [2048, 2560, 1, 256, 2048, 2048, 256, 256]
    - [19, 23933.0]
  - - [2560, 2560, 1, 256, 2560, 2560, 256, 256]
    - [1, 25278.3]
  - - [3072, 2560, 1, 256, 3072, 3072, 256, 256]
    - [1, 26967.2]
  - - [512, 3072, 1, 256, 512, 512, 256, 256]
    - [4, 14335.4]
  - - [1024, 3072, 1, 256, 1024, 1024, 256, 256]
    - [4, 19746.6]
  - - [1536, 3072, 1, 256, 1536, 1536, 256, 256]
    - [4, 22963.0]
  - - [2048, 3072, 1, 256, 2048, 2048, 256, 256]
    - [4, 25016.7]
  - - [2560, 3072, 1, 256, 2560, 2560, 256, 256]
    - [1, 26691.8]
  - - [3072, 3072, 1, 256, 3072, 3072, 256, 256]
    - [4, 27611.9]
  - - [512, 512, 1, 512, 512, 512, 512, 512]
    - [13, 7017.55]
  - - [1024, 512, 1, 512, 1024, 1024, 512, 512]
    - [4, 12074.6]
  - - [1536, 512, 1, 512, 1536, 1536, 512, 512]
    - [1, 14389.5]
  - - [2048, 512, 1, 512, 2048, 2048, 512, 512]
    - [20, 17174.6]
  - - [2560, 512, 1, 512, 2560, 2560, 512, 512]
    - [1, 18346.3]
  - - [3072, 512, 1, 512, 3072, 3072, 512, 512]
    - [1, 20869.9]
  - - [512, 1024, 1, 512, 512, 512, 512, 512]
    - [4, 11858.0]
  - - [1024, 1024, 1, 512, 1024, 1024, 512, 512]
    - [1, 17263.6]
  - - [1536, 1024, 1, 512, 1536, 1536, 512, 512]
    - [1, 20382.3]
  - - [2048, 1024, 1, 512, 2048, 2048, 512, 512]
    - [1, 23074.8]
  - - [2560, 1024, 1, 512, 2560, 2560, 512, 512]
    - [4, 24844.8]
  - - [3072, 1024, 1, 512, 3072, 3072, 512, 512]
    - [4, 26508.2]
  - - [512, 1536, 1, 512, 512, 512, 512, 512]
    - [17, 14428.1]
  - - [1024, 1536, 1, 512, 1024, 1024, 512, 512]
    - [4, 20785.6]
  - - [1536, 1536, 1, 512, 1536, 1536, 512, 512]
    - [4, 23077.5]
  - - [2048, 1536, 1, 512, 2048, 2048, 512, 512]
    - [1, 26148.2]
  - - [2560, 1536, 1, 512, 2560, 2560, 512, 512]
    - [4, 27371.4]
  - - [3072, 1536, 1, 512, 3072, 3072, 512, 512]
    - [17, 29072.1]
  - - [512, 2048, 1, 512, 512, 512, 512, 512]
    - [4, 17664.6]
  - - [1024, 2048, 1, 512, 1024, 1024, 512, 512]
    - [4, 23099.9]
  - - [1536, 2048, 1, 512, 1536, 1536, 512, 512]
    - [4, 26250.3]
  - - [2048, 2048, 1, 512, 2048, 2048, 512, 512]
    - [4, 28624.7]
  - - [2560, 2048, 1, 512, 2560, 2560, 512, 512]
    - [4, 28991.8]
  - - [3072, 2048, 1, 512, 3072, 3072, 512, 512]
    - [1, 30185.2]
  - - [512, 2560, 1, 512, 512, 512, 512, 512]
    - [1, 18773.0]
  - - [1024, 2560, 1, 512, 1024, 1024, 512, 512]
    - [4, 25089.5]
  - - [1536, 2560, 1, 512, 1536, 1536, 512, 512]
    - [17, 26780.5]
  - - [2048, 2560, 1, 512, 2048, 2048, 512, 512]
    - [17, 29535.1]
  - - [2560, 2560, 1, 512, 2560, 2560, 512, 512]
    - [4, 30957.3]
  - - [3072, 2560, 1, 512, 3072, 3072, 512, 512]
    - [4, 31762.6]
  - - [512, 3072, 1, 512, 512, 512, 512, 512]
    - [4, 20753.4]
  - - [1024, 3072, 1, 512, 1024, 1024, 512, 512]
    - [4, 26237.9]
  - - [1536, 3072, 1, 512, 1536, 1536, 512, 512]
    - [4, 28640.1]
  - - [2048, 3072, 1, 512, 2048, 2048, 512, 512]
    - [4, 30390.6]
  - - [2560, 3072, 1, 512, 2560, 2560, 512, 512]
    - [17, 31538.6]
  - - [3072, 3072, 1, 512, 3072, 3072, 512, 512]
    - [1, 32706.3]
  - - [512, 512, 1, 1024, 512, 512, 1024, 1024]
    - [15, 11117.6]
  - - [1024, 512, 1, 1024, 1024, 1024, 1024, 1024]
    - [19, 18357.7]
  - - [1536, 512, 1, 1024, 1536, 1536, 1024, 1024]
    - [4, 20069.4]
  - - [2048, 512, 1, 1024, 2048, 2048, 1024, 1024]
    - [17, 23587.8]
  - - [2560, 512, 1, 1024, 2560, 2560, 1024, 1024]
    - [1, 23693.9]
  - - [3072, 512, 1, 1024, 3072, 3072, 1024, 1024]
    - [1, 26646.6]
  - - [512, 1024, 1, 1024, 512, 512, 1024, 1024]
    - [1, 18124.7]
  - - [1024, 1024, 1, 1024, 1024, 1024, 1024, 1024]
    - [19, 23967.7]
  - - [1536, 1024, 1, 1024, 1536, 1536, 1024, 1024]
    - [1, 26750.4]
  - - [2048, 1024, 1, 1024, 2048, 2048, 1024, 1024]
    - [1, 28711.2]
  - - [2560, 1024, 1, 1024, 2560, 2560, 1024, 1024]
    - [17, 30367.4]
  - - [3072, 1024, 1, 1024, 3072, 3072, 1024, 1024]
    - [6, 31081.1]
  - - [512, 1536, 1, 1024, 512, 512, 1024, 1024]
    - [1, 20246.5]
  - - [1024, 1536, 1, 1024, 1024, 1024, 1024, 1024]
    - [4, 27120.9]
  - - [1536, 1536, 1, 1024, 1536, 1536, 1024, 1024]
    - [6, 27946.7]
  - - [2048, 1536, 1, 1024, 2048, 2048, 1024, 1024]
    - [1, 31691.9]
  - - [2560, 1536, 1, 1024, 2560, 2560, 1024, 1024]
    - [1, 31615.5]
  - - [3072, 1536, 1, 1024, 3072, 3072, 1024, 1024]
    - [20, 32386.7]
  - - [512, 2048, 1, 1024, 512, 512, 1024, 1024]
    - [19, 23890.4]
  - - [1024, 2048, 1, 1024, 1024, 1024, 1024, 1024]
    - [4, 29312.2]
  - - [1536, 2048, 1, 1024, 1536, 1536, 1024, 1024]
    - [4, 31593.8]
  - - [2048, 2048, 1, 1024, 2048, 2048, 1024, 1024]
    - [1, 32514.4]
  - - [2560, 2048, 1, 1024, 2560, 2560, 1024, 1024]
    - [17, 33441.9]
  - - [3072, 2048, 1, 1024, 3072, 3072, 1024, 1024]
    - [1, 33751.2]
  - - [512, 2560, 1, 1024, 512, 512, 1024, 1024]
    - [4, 24273.3]
  - - [1024, 2560, 1, 1024, 1024, 1024, 1024, 1024]
    - [4, 30872.6]
  - - [1536, 2560, 1, 1024, 1536, 1536, 1024, 1024]
    - [1, 30981.5]
  - - [2048, 2560, 1, 1024, 2048, 2048, 1024, 1024]
    - [17, 33489.3]
  - - [2560, 2560, 1, 1024, 2560, 2560, 1024, 1024]
    - [3, 33926.5]
  - - [3072, 2560, 1, 1024, 3072, 3072, 1024, 1024]
    - [1, 35153.9]
  - - [512, 3072, 1, 1024, 512, 512, 1024, 1024]
    - [4, 27201.0]
  - - [1024, 3072, 1, 1024, 1024, 1024, 1024, 1024]
    - [4, 31670.4]
  - - [1536, 3072, 1, 1024, 1536, 1536, 1024, 1024]
    - [17, 32943.5]
  - - [2048, 3072, 1, 1024, 2048, 2048, 1024, 1024]
    - [1, 33271.4]
  - - [2560, 3072, 1, 1024, 2560, 2560, 1024, 1024]
    - [1, 34281.6]
  - - [3072, 3072, 1, 1024, 3072, 3072, 1024, 1024]
    - [1, 35205.5]
  - - [512, 512, 1, 2048, 512, 512, 2048, 2048]
    - [13, 15858.4]
  - - [1024, 512, 1, 2048, 1024, 1024, 2048, 2048]
    - [19, 24837.3]
  - - [1536, 512, 1, 2048, 1536, 1536, 2048, 2048]
    - [1, 24867.8]
  - - [2048, 512, 1, 2048, 2048, 2048, 2048, 2048]
    - [4, 29460.8]
  - - [2560, 512, 1, 2048, 2560, 2560, 2048, 2048]
    - [4, 28262.8]
  - - [3072, 512, 1, 2048, 3072, 3072, 2048, 2048]
    - [19, 31985.2]
  - - [512, 1024, 1, 2048, 512, 512, 2048, 2048]
    - [19, 24779.7]
  - - [1024, 1024, 1, 2048, 1024, 1024, 2048, 2048]
    - [1, 29354.1]
  - - [1536, 1024, 1, 2048, 1536, 1536, 2048, 2048]
    - [4, 31620.5]
  - - [2048, 1024, 1, 2048, 2048, 2048, 2048, 2048]
    - [4, 32749.4]
  - - [2560, 1024, 1, 2048, 2560, 2560, 2048, 2048]
    - [1, 33944.4]
  - - [3072, 1024, 1, 2048, 3072, 3072, 2048, 2048]
    - [19, 34116.6]
  - - [512, 1536, 1, 2048, 512, 512, 2048, 2048]
    - [19, 25092.9]
  - - [1024, 1536, 1, 2048, 1024, 1024, 2048, 2048]
    - [4, 31863.0]
  - - [1536, 1536, 1, 2048, 1536, 1536, 2048, 2048]
    - [19, 31392.0]
  - - [2048, 1536, 1, 2048, 2048, 2048, 2048, 2048]
    - [19, 34443.0]
  - - [2560, 1536, 1, 2048, 2560, 2560, 2048, 2048]
    - [1, 34168.8]
  - - [3072, 1536, 1, 2048, 3072, 3072, 2048, 2048]
    - [4, 34863.3]
  - - [512, 2048, 1, 2048, 512, 512, 2048, 2048]
    - [4, 29461.2]
  - - [1024, 2048, 1, 2048, 1024, 1024, 2048, 2048]
    - [4, 33197.0]
  - - [1536, 2048, 1, 2048, 1536, 1536, 2048, 2048]
    - [17, 34372.8]
  - - [2048, 2048, 1, 2048, 2048, 2048, 2048, 2048]
    - [4, 35018.0]
  - - [2560, 2048, 1, 2048, 2560, 2560, 2048, 2048]
    - [1, 35878.8]
  - - [3072, 2048, 1, 2048, 3072, 3072, 2048, 2048]
    - [1, 36021.0]
  - - [512, 2560, 1, 2048, 512, 512, 2048, 2048]
    - [4, 28241.9]
  - - [1024, 2560, 1, 2048, 1024, 1024, 2048, 2048]
    - [4, 33588.7]
  - - [1536, 2560, 1, 2048, 1536, 1536, 2048, 2048]
    - [1, 34152.1]
  - - [2048, 2560, 1, 2048, 2048, 2048, 2048, 2048]
    - [19, 35289.2]
  - - [2560, 2560, 1, 2048, 2560, 2560, 2048, 2048]
    - [17, 35112.0]
  - - [3072, 2560, 1, 2048, 3072, 3072, 2048, 2048]
    - [4, 36060.8]
  - - [512, 3072, 1, 2048, 512, 512, 2048, 2048]
    - [1, 31668.5]
  - - [1024, 3072, 1, 2048, 1024, 1024, 2048, 2048]
    - [17, 34452.3]
  - - [1536, 3072, 1, 2048, 1536, 1536, 2048, 2048]
    - [4, 36120.6]
  - - [2048, 3072, 1, 2048, 2048, 2048, 2048, 2048]
    - [19, 36110.4]
  - - [2560, 3072, 1, 2048, 2560, 2560, 2048, 2048]
    - [4, 36058.3]
  - - [3072, 3072, 1, 2048, 3072, 3072, 2048, 2048]
    - [4, 36694.5]
  - - [512, 512, 1, 3072, 512, 512, 3072, 3072]
    - [15, 18835.2]
  - - [1024, 512, 1, 3072, 1024, 1024, 3072, 3072]
    - [19, 27916.7]
  - - [1536, 512, 1, 3072, 1536, 1536, 3072, 3072]
    - [4, 27353.8]
  - - [2048, 512, 1, 3072, 2048, 2048, 3072, 3072]
    - [4, 32518.9]
  - - [2560, 512, 1, 3072, 2560, 2560, 3072, 3072]
    - [6, 29850.6]
  - - [3072, 512, 1, 3072, 3072, 3072, 3072, 3072]
    - [1, 33443.5]
  - - [512, 1024, 1, 3072, 512, 512, 3072, 3072]
    - [4, 27945.8]
  - - [1024, 1024, 1, 3072, 1024, 1024, 3072, 3072]
    - [17, 31996.4]
  - - [1536, 1024, 1, 3072, 1536, 1536, 3072, 3072]
    - [1, 33940.1]
  - - [2048, 1024, 1, 3072, 2048, 2048, 3072, 3072]
    - [4, 34608.9]
  - - [2560, 1024, 1, 3072, 2560, 2560, 3072, 3072]
    - [1, 35421.1]
  - - [3072, 1024, 1, 3072, 3072, 3072, 3072, 3072]
    - [1, 36053.7]
  - - [512, 1536, 1, 3072, 512, 512, 3072, 3072]
    - [1, 27516.0]
  - - [1024, 1536, 1, 3072, 1024, 1024, 3072, 3072]
    - [19, 33895.1]
  - - [1536, 1536, 1, 3072, 1536, 1536, 3072, 3072]
    - [1, 32973.2]
  - - [2048, 1536, 1, 3072, 2048, 2048, 3072, 3072]
    - [4, 35897.7]
  - - [2560, 1536, 1, 3072, 2560, 2560, 3072, 3072]
    - [17, 34625.4]
  - - [3072, 1536, 1, 3072, 3072, 3072, 3072, 3072]
    - [1, 35997.5]
  - - [512, 2048, 1, 3072, 512, 512, 3072, 3072]
    - [4, 32305.0]
  - - [1024, 2048, 1, 3072, 1024, 1024, 3072, 3072]
    - [4, 34318.0]
  - - [1536, 2048, 1, 3072, 1536, 1536, 3072, 3072]
    - [17, 35643.7]
  - - [2048, 2048, 1, 3072, 2048, 2048, 3072, 3072]
    - [19, 35777.8]
  - - [2560, 2048, 1, 3072, 2560, 2560, 3072, 3072]
    - [4, 36045.4]
  - - [3072, 2048, 1, 3072, 3072, 3072, 3072, 3072]
    - [17, 36339.3]
  - - [512, 2560, 1, 3072, 512, 512, 3072, 3072]
    - [18, 30484.9]
  - - [1024, 2560, 1, 3072, 1024, 1024, 3072, 3072]
    - [17, 34803.6]
  - - [1536, 2560, 1, 3072, 1536, 1536, 3072, 3072]
    - [20, 35231.7]
  - - [2048, 2560, 1, 3072, 2048, 2048, 3072, 3072]
    - [1, 36340.3]
  - - [2560, 2560, 1, 3072, 2560, 2560, 3072, 3072]
    - [20, 35421.3]
  - - [3072, 2560, 1, 3072, 3072, 3072, 3072, 3072]
    - [4, 36974.8]
  - - [512, 3072, 1, 3072, 512, 512, 3072, 3072]
    - [1, 33797.5]
  - - [1024, 3072, 1, 3072, 1024, 1024, 3072, 3072]
    - [19, 36148.3]
  - - [1536, 3072, 1, 3072, 1536, 1536, 3072, 3072]
    - [1, 37101.5]
  - - [2048, 3072, 1, 3072, 2048, 2048, 3072, 3072]
    - [17, 36773.7]
  - - [2560, 3072, 1, 3072, 2560, 2560, 3072, 3072]
    - [19, 36481.1]
  - - [3072, 3072, 1, 3072, 3072, 3072, 3072, 3072]
    - [4, 36856.4]
  - - [1, 1, 1, 1, 1, 1, 1, 1]
    - [12, 6.63196e-05]
  - - [1, 1, 1, 64, 1, 1, 64, 64]
    - [16, 0.00410401]
  - - [1, 64, 1, 1, 1, 1, 1, 1]
    - [12, 0.00425292]
  - - [64, 1, 1, 1, 64, 64, 1, 1]
    - [16, 0.00425164]
  - - [64, 64, 1, 1, 64, 64, 1, 1]
    - [14, 0.258097]
  - - [64, 1, 1, 64, 64, 64, 64, 64]
    - [21, 0.265036]
  - - [1, 64, 1, 64, 1, 1, 64, 64]
    - [16, 0.271916]
  - - [64, 64, 1, 64, 64, 64, 64, 64]
    - [8, 17.8232]
  - - [64, 64, 1, 256, 64, 64, 256, 256]
    - [9, 66.767]
  - - [64, 64, 1, 512, 64, 64, 512, 512]
    - [10, 122.087]
  - - [64, 64, 1, 1024, 64, 64, 1024, 1024]
    - [9, 207.244]
  - - [64, 64, 1, 2048, 64, 64, 2048, 2048]
    - [21, 317.871]
  - - [64, 64, 1, 4096, 64, 64, 4096, 4096]
    - [22, 445.829]
- null
- null
- DeviceEfficiency
- GridBased
