library/src/amd_detail/rocblaslt/src/Tensile/Logic/asm_full/navi32/Equality/navi32_Cijk_Ailk_Bljk_I8II_BH_UserArgs.yaml
- {MinimumRequiredVersion: 4.33.0}
- navi32
- gfx1101
- [Device 73f0]
    SolutionIndex: 0
    SolutionNameMin: Cijk_Ailk_Bljk_I8II_BH_UserArgs_MT64x16x32_MI16x16x1_SN_GRVWA4_GRVWB4_GSU1_LBSPPA1024_LBSPPB128_LPB32_MIWT1_1_NLCA1_SS0_SU0_SUM0_SUS0_TLDS1_WG64_2_1_WGM18
    SolutionIndex: 1
    SolutionNameMin: Cijk_Ailk_Bljk_I8II_BH_UserArgs_MT64x16x32_MI16x16x1_SN_GRVWA4_GRVWB4_GSU4_LBSPPA1024_LBSPPB128_LPB32_MIWT1_1_NLCA1_SS0_SU0_SUM0_SUS0_TLDS1_WG64_2_1_WGM18
    SolutionIndex: 2
    SolutionNameMin: Cijk_Ailk_Bljk_I8II_BH_UserArgs_MT16x64x32_MI16x16x1_SN_GRVWA4_GRVWB16_GSU1_LBSPPA256_LBSPPB128_LPB32_MIWT1_1_NLCA1_SS0_SU0_SUM0_SUS0_TLDS1_WG16_8_1_WGM18
    SolutionIndex: 3
    SolutionNameMin: Cijk_Ailk_Bljk_I8II_BH_UserArgs_MT64x16x64_MI16x16x1_SN_GRVWA4_GRVWB8_GSU1_LBSPPA1024_LBSPPB128_LPB32_MIWT1_1_NLCA1_SS0_SU0_SUM0_SUS0_TLDS1_WG64_2_1_WGM18
    SolutionIndex: 4
    SolutionNameMin: Cijk_Ailk_Bljk_I8II_BH_UserArgs_MT64x16x64_MI16x16x1_SN_GRVWA4_GRVWB8_GSU4_LBSPPA1024_LBSPPB128_LPB32_MIWT1_1_NLCA1_SS0_SU0_SUM0_SUS0_TLDS1_WG64_2_1_WGM18
    SolutionIndex: 5
    SolutionNameMin: Cijk_Ailk_Bljk_I8II_BH_UserArgs_MT32x32x64_MI16x16x1_SN_GRVWA4_GRVWB16_GSU1_LBSPPA512_LBSPPB128_LPB32_MIWT1_1_NLCA1_SS0_SU0_SUM0_SUS0_TLDS1_WG32_4_1_WGM18
    SolutionIndex: 6
    SolutionNameMin: Cijk_Ailk_Bljk_I8II_BH_UserArgs_MT64x16x32_MI16x16x1_SN_GRVWA16_GRVWB4_GSU1_LBSPPA1024_LBSPPB128_LPB32_MIWT1_1_NLCA1_SS1_SU0_SUM0_SUS0_TLDS1_WG64_2_1_WGM18
    SolutionIndex: 7
    SolutionNameMin: Cijk_Ailk_Bljk_I8II_BH_UserArgs_MT128x16x32_MI16x16x1_SN_GRVWA16_GRVWB4_GSU1_LBSPPA2048_LBSPPB128_LPB32_MIWT2_1_NLCA1_SS1_SU0_SUM0_SUS0_TLDS1_WG64_2_1_WGM18
    SolutionIndex: 8
    SolutionNameMin: Cijk_Ailk_Bljk_I8II_BH_UserArgs_MT192x16x32_MI16x16x1_SN_GRVWA16_GRVWB4_GSU4_LBSPPA3072_LBSPPB128_LPB32_MIWT3_1_NLCA3_SS1_SU0_SUM0_SUS0_TLDS1_WG64_2_1_WGM18
    SolutionIndex: 9
    SolutionNameMin: Cijk_Ailk_Bljk_I8II_BH_UserArgs_MT32x32x32_MI16x16x1_SN_GRVWA8_GRVWB8_GSU1_LBSPPA512_LBSPPB128_LPB32_MIWT1_1_NLCA1_SS1_SU0_SUM0_SUS0_TLDS1_WG32_4_1_WGM18
    SolutionIndex: 10
    SolutionNameMin: Cijk_Ailk_Bljk_I8II_BH_UserArgs_MT96x32x32_MI16x16x1_SN_GRVWA8_GRVWB8_GSU4_LBSPPA1536_LBSPPB128_LPB32_MIWT3_1_NLCA3_SS1_SU0_SUM0_SUS0_TLDS1_WG32_4_1_WGM18
    SolutionIndex: 11
    SolutionNameMin: Cijk_Ailk_Bljk_I8II_BH_UserArgs_MT64x48x32_MI16x16x1_SN_GRVWA16_GRVWB4_GSU1_LBSPPA1024_LBSPPB128_LPB32_MIWT1_3_NLCA1_SS1_SU0_SUM0_SUS0_TLDS1_WG64_2_1_WGM18
    SolutionIndex: 12
    SolutionNameMin: Cijk_Ailk_Bljk_I8II_BH_UserArgs_MT128x48x32_MI16x16x1_SN_GRVWA16_GRVWB4_GSU1_LBSPPA2048_LBSPPB128_LPB32_MIWT2_3_NLCA1_SS1_SU0_SUM0_SUS0_TLDS1_WG64_2_1_WGM18
    SolutionIndex: 13
    SolutionNameMin: Cijk_Ailk_Bljk_I8II_BH_UserArgs_MT192x48x32_MI16x16x1_SN_GRVWA16_GRVWB4_GSU1_LBSPPA3072_LBSPPB128_LPB32_MIWT3_3_NLCA3_SS1_SU0_SUM0_SUS0_TLDS1_WG64_2_1_WGM18
    SolutionIndex: 14
    SolutionNameMin: Cijk_Ailk_Bljk_I8II_BH_UserArgs_MT16x64x32_MI16x16x1_SN_GRVWA4_GRVWB16_GSU1_LBSPPA256_LBSPPB128_LPB32_MIWT1_1_NLCA1_SS1_SU0_SUM0_SUS0_TLDS1_WG16_8_1_WGM18
    SolutionIndex: 15
    SolutionNameMin: Cijk_Ailk_Bljk_I8II_BH_UserArgs_MT32x64x32_MI16x16x1_SN_GRVWA8_GRVWB16_GSU1_LBSPPA512_LBSPPB128_LPB32_MIWT2_1_NLCA1_SS1_SU0_SUM0_SUS0_TLDS1_WG16_8_1_WGM18
    SolutionIndex: 16
    SolutionNameMin: Cijk_Ailk_Bljk_I8II_BH_UserArgs_MT48x64x32_MI16x16x1_SN_GRVWA4_GRVWB16_GSU4_LBSPPA768_LBSPPB128_LPB32_MIWT3_1_NLCA3_SS1_SU0_SUM0_SUS0_TLDS1_WG16_8_1_WGM18
    SolutionIndex: 17
    SolutionNameMin: Cijk_Ailk_Bljk_I8II_BH_UserArgs_MT64x80x32_MI16x16x1_SN_GRVWA16_GRVWB4_GSU1_LBSPPA1024_LBSPPB128_LPB32_MIWT1_5_NLCA1_SS1_SU0_SUM0_SUS0_TLDS1_WG64_2_1_WGM18
    SolutionIndex: 18
    SolutionNameMin: Cijk_Ailk_Bljk_I8II_BH_UserArgs_MT64x80x32_MI16x16x1_SN_GRVWA16_GRVWB4_GSU4_LBSPPA1024_LBSPPB128_LPB32_MIWT1_5_NLCA1_SS1_SU0_SUM0_SUS0_TLDS1_WG64_2_1_WGM18
    SolutionIndex: 19
    SolutionNameMin: Cijk_Ailk_Bljk_I8II_BH_UserArgs_MT64x96x32_MI16x16x1_SN_GRVWA16_GRVWB8_GSU1_LBSPPA1024_LBSPPB128_LPB32_MIWT2_3_NLCA1_SS1_SU0_SUM0_SUS0_TLDS1_WG32_4_1_WGM18
    SolutionIndex: 20
    SolutionNameMin: Cijk_Ailk_Bljk_I8II_BH_UserArgs_MT64x96x32_MI16x16x1_SN_GRVWA16_GRVWB8_GSU4_LBSPPA1024_LBSPPB128_LPB32_MIWT2_3_NLCA1_SS1_SU0_SUM0_SUS0_TLDS1_WG32_4_1_WGM18
    SolutionIndex: 21
    SolutionNameMin: Cijk_Ailk_Bljk_I8II_BH_UserArgs_MT96x96x32_MI16x16x1_SN_GRVWA8_GRVWB8_GSU1_LBSPPA1536_LBSPPB128_LPB32_MIWT3_3_NLCA3_SS1_SU0_SUM0_SUS0_TLDS1_WG32_4_1_WGM18
    SolutionIndex: 22
    SolutionNameMin: Cijk_Ailk_Bljk_I8II_BH_UserArgs_MT96x96x32_MI16x16x1_SN_GRVWA8_GRVWB8_GSU2_LBSPPA1536_LBSPPB128_LPB32_MIWT3_3_NLCA3_SS1_SU0_SUM0_SUS0_TLDS1_WG32_4_1_WGM18
    SolutionIndex: 23
    SolutionNameMin: Cijk_Ailk_Bljk_I8II_BH_UserArgs_MT64x160x32_MI16x16x1_SN_GRVWA16_GRVWB8_GSU1_LBSPPA1024_LBSPPB128_LPB32_MIWT2_5_NLCA1_SS1_SU0_SUM0_SUS0_TLDS1_WG32_4_1_WGM18
    SolutionIndex: 24
    SolutionNameMin: Cijk_Ailk_Bljk_I8II_BH_UserArgs_MT16x256x32_MI16x16x1_SN_GRVWA4_GRVWB16_GSU1_LBSPPA256_LBSPPB128_LPB32_MIWT1_4_NLCA1_SS1_SU0_SUM0_SUS0_TLDS1_WG16_8_1_WGM18
    SolutionIndex: 25
    SolutionNameMin: Cijk_Ailk_Bljk_I8II_BH_UserArgs_MT64x16x64_MI16x16x1_SN_GRVWA16_GRVWB8_GSU1_LBSPPA1024_LBSPPB128_LPB32_MIWT1_1_NLCA1_SS1_SU0_SUM0_SUS0_TLDS1_WG64_2_1_WGM18
    SolutionIndex: 26
    SolutionNameMin: Cijk_Ailk_Bljk_I8II_BH_UserArgs_MT64x16x64_MI16x16x1_SN_GRVWA16_GRVWB8_GSU4_LBSPPA1024_LBSPPB128_LPB32_MIWT1_1_NLCA1_SS1_SU0_SUM0_SUS0_TLDS1_WG64_2_1_WGM18
    SolutionIndex: 27
    SolutionNameMin: Cijk_Ailk_Bljk_I8II_BH_UserArgs_MT32x32x64_MI16x16x1_SN_GRVWA16_GRVWB16_GSU1_LBSPPA512_LBSPPB128_LPB32_MIWT1_1_NLCA1_SS1_SU0_SUM0_SUS0_TLDS1_WG32_4_1_WGM18
    SolutionIndex: 28
    SolutionNameMin: Cijk_Ailk_Bljk_I8II_BH_UserArgs_MT32x32x64_MI16x16x1_SN_GRVWA16_GRVWB16_GSU4_LBSPPA512_LBSPPB128_LPB32_MIWT1_1_NLCA1_SS1_SU0_SUM0_SUS0_TLDS1_WG32_4_1_WGM18
    SolutionIndex: 29
    SolutionNameMin: Cijk_Ailk_Bljk_I8II_BH_UserArgs_MT64x48x64_MI16x16x1_SN_GRVWA16_GRVWB8_GSU1_LBSPPA1024_LBSPPB128_LPB32_MIWT1_3_NLCA1_SS1_SU0_SUM0_SUS0_TLDS1_WG64_2_1_WGM18
    SolutionIndex: 30
    SolutionNameMin: Cijk_Ailk_Bljk_I8II_BH_UserArgs_MT64x48x64_MI16x16x1_SN_GRVWA16_GRVWB8_GSU4_LBSPPA1024_LBSPPB128_LPB32_MIWT1_3_NLCA1_SS1_SU0_SUM0_SUS0_TLDS1_WG64_2_1_WGM18
    SolutionIndex: 31
    SolutionNameMin: Cijk_Ailk_Bljk_I8II_BH_UserArgs_MT16x64x64_MI16x16x1_SN_GRVWA8_GRVWB16_GSU1_LBSPPA256_LBSPPB128_LPB32_MIWT1_1_NLCA1_SS1_SU0_SUM0_SUS0_TLDS1_WG16_8_1_WGM18
    SolutionIndex: 32
    SolutionNameMin: Cijk_Ailk_Bljk_I8II_BH_UserArgs_MT16x128x64_MI16x16x1_SN_GRVWA8_GRVWB16_GSU1_LBSPPA256_LBSPPB128_LPB32_MIWT1_2_NLCA1_SS1_SU0_SUM0_SUS0_TLDS1_WG16_8_1_WGM18
    SolutionIndex: 33
    SolutionNameMin: Cijk_Ailk_Bljk_I8II_BH_UserArgs_MT16x192x64_MI16x16x1_SN_GRVWA8_GRVWB16_GSU1_LBSPPA256_LBSPPB128_LPB32_MIWT1_3_NLCA1_SS1_SU0_SUM0_SUS0_TLDS1_WG16_8_1_WGM18
- - - [1000, 1, 1, 2048, 1000, 1000, 1000, 2048]
    - [4, 269.102]
  - - [1000, 16, 1, 1536, 1000, 1000, 1000, 1536]
    - [26, 3440.67]
  - - [1000, 16, 1, 2048, 1000, 1000, 1000, 2048]
    - [26, 4151.94]
  - - [1000, 32, 1, 1024, 1000, 1000, 1000, 1024]
    - [5, 4970.94]
  - - [1000, 32, 1, 2048, 1000, 1000, 1000, 2048]
    - [28, 6845.0]
  - - [1000, 64, 1, 2048, 1000, 1000, 1000, 2048]
    - [16, 10701.9]
  - - [1001, 1, 1, 1536, 1001, 1001, 1001, 1536]
    - [1, 221.701]
  - - [1001, 1, 1, 2048, 1001, 1001, 1001, 2048]
    - [1, 268.118]
  - - [1001, 64, 1, 2048, 1001, 1001, 1001, 2048]
    - [10, 10123.5]
  - - [1001, 64, 1, 4032, 1001, 1001, 1001, 4032]
    - [30, 12844.7]
  - - [1024, 1, 1, 1024, 1024, 1024, 1024, 1024]
    - [3, 171.352]
  - - [1024, 16, 1, 1024, 1024, 1024, 1024, 1024]
    - [25, 2740.62]
  - - [1024, 32, 1, 1024, 1024, 1024, 1024, 1024]
    - [27, 5005.44]
  - - [1024, 384, 1, 1024, 1024, 1024, 1024, 1024]
    - [17, 24185.0]
  - - [1024, 384, 1, 4096, 1024, 1024, 1024, 4096]
    - [22, 29647.4]
  - - [1280, 2, 1, 1280, 1280, 1280, 1280, 1280]
    - [1, 502.942]
  - - [1280, 2, 1, 320, 1280, 1280, 1280, 320]
    - [3, 229.851]
  - - [20160, 2, 1, 1280, 20160, 20160, 20160, 1280]
    - [8, 2113.03]
  - - [2304, 128, 1, 768, 2304, 2304, 2304, 768]
    - [12, 19878.6]
  - - [2304, 256, 1, 768, 2304, 2304, 2304, 768]
    - [24, 25606.4]
  - - [2304, 3072, 1, 768, 2304, 2304, 2304, 768]
    - [19, 43156.1]
  - - [2304, 384, 1, 768, 2304, 2304, 2304, 768]
    - [19, 32704.3]
  - - [2304, 6144, 1, 768, 2304, 2304, 2304, 768]
    - [19, 45118.2]
  - - [256, 1, 1, 256, 256, 256, 256, 256]
    - [5, 20.4859]
  - - [256, 1, 1, 483, 256, 256, 256, 483]
    - [27, 28.9002]
  - - [3072, 128, 1, 768, 3072, 3072, 3072, 768]
    - [29, 21920.1]
  - - [3072, 256, 1, 768, 3072, 3072, 3072, 768]
    - [19, 28723.5]
  - - [3072, 3072, 1, 768, 3072, 3072, 3072, 768]
    - [13, 41492.9]
  - - [3072, 384, 1, 1024, 3072, 3072, 3072, 1024]
    - [19, 34480.7]
  - - [3072, 384, 1, 768, 3072, 3072, 3072, 768]
    - [19, 33615.8]
  - - [3072, 6144, 1, 768, 3072, 3072, 3072, 768]
    - [13, 40524.6]
  - - [33278, 35, 1, 200, 33278, 33278, 33278, 200]
    - [11, 14875.7]
  - - [4096, 384, 1, 1024, 4096, 4096, 4096, 1024]
    - [19, 35842.6]
  - - [6, 1, 1, 256, 6, 6, 6, 256]
    - [5, 0.482423]
  - - [768, 1, 1, 768, 768, 768, 768, 768]
    - [5, 118.634]
  - - [768, 128, 1, 2, 768, 768, 768, 2]
    - [15, 67.5076]
  - - [768, 128, 1, 3072, 768, 768, 768, 3072]
    - [30, 18588.5]
  - - [768, 128, 1, 768, 768, 768, 768, 768]
    - [32, 10485.6]
  - - [768, 256, 1, 2, 768, 768, 768, 2]
    - [15, 119.582]
  - - [768, 256, 1, 3072, 768, 768, 768, 3072]
    - [20, 24809.3]
  - - [768, 256, 1, 768, 768, 768, 768, 768]
    - [29, 15762.9]
  - - [768, 3072, 1, 3072, 768, 768, 768, 3072]
    - [19, 41999.5]
  - - [768, 3072, 1, 768, 768, 768, 768, 768]
    - [19, 38053.3]
  - - [768, 32, 1, 768, 768, 768, 768, 768]
    - [25, 3748.08]
  - - [768, 384, 1, 3072, 768, 768, 768, 3072]
    - [20, 28793.2]
  - - [768, 384, 1, 768, 768, 768, 768, 768]
    - [29, 20054.9]
  - - [768, 6144, 1, 3072, 768, 768, 768, 3072]
    - [19, 43538.7]
  - - [768, 6144, 1, 768, 768, 768, 768, 768]
    - [19, 41781.2]
  - - [768, 64, 1, 768, 768, 768, 768, 768]
    - [27, 6874.3]
  - - [768, 8, 1, 768, 768, 768, 768, 768]
    - [27, 932.381]
  - - [10240, 256, 1, 1280, 10240, 10240, 10240, 1280]
    - [19, 37406.9]
  - - [10240, 64, 1, 1280, 10240, 10240, 10240, 1280]
    - [17, 24418.6]
  - - [121, 1, 1, 25, 121, 121, 121, 25]
    - [2, 1.15084]
  - - [121, 1, 1, 49, 121, 121, 121, 49]
    - [2, 2.09274]
  - - [121, 1, 1, 9, 121, 121, 121, 9]
    - [2, 0.417404]
  - - [12544, 1, 1, 9, 12544, 12544, 12544, 9]
    - [7, 31.8477]
  - - [1280, 256, 1, 1280, 1280, 1280, 1280, 1280]
    - [19, 24666.7]
  - - [1280, 256, 1, 5120, 1280, 1280, 1280, 5120]
    - [20, 30882.7]
  - - [1280, 64, 1, 1280, 1280, 1280, 1280, 1280]
    - [27, 10771.2]
  - - [1280, 64, 1, 5120, 1280, 1280, 1280, 5120]
    - [18, 18179.7]
  - - [1764, 1, 1, 25, 1764, 1764, 1764, 25]
    - [0, 15.8282]
  - - [1764, 1, 1, 49, 1764, 1764, 1764, 49]
    - [6, 29.2925]
  - - [1764, 1, 1, 9, 1764, 1764, 1764, 9]
    - [0, 5.89626]
  - - [1920, 1024, 1, 640, 1920, 1920, 1920, 640]
    - [19, 35703.0]
  - - [196, 1, 1, 9, 196, 196, 196, 9]
    - [2, 0.676192]
  - - [196, 12, 1, 108, 196, 196, 196, 108]
    - [14, 81.8249]
  - - [196, 16, 1, 144, 196, 196, 196, 144]
    - [27, 138.931]
  - - [24960, 64, 1, 1024, 24960, 24960, 24960, 1024]
    - [17, 28849.9]
  - - [2560, 4096, 1, 320, 2560, 2560, 2560, 320]
    - [19, 39808.5]
  - - [3136, 1, 1, 9, 3136, 3136, 3136, 9]
    - [0, 9.97885]
  - - [3136, 3, 1, 27, 3136, 3136, 3136, 27]
    - [6, 89.306]
  - - [3136, 4, 1, 36, 3136, 3136, 3136, 36]
    - [6, 151.273]
  - - [320, 4096, 1, 1280, 320, 320, 320, 1280]
    - [23, 34775.6]
  - - [320, 4096, 1, 320, 320, 320, 320, 320]
    - [19, 29022.6]
  - - [33278, 1, 1, 200, 33278, 33278, 33278, 200]
    - [7, 724.589]
  - - [384, 384, 1, 64, 384, 384, 384, 64]
    - [33, 3105.6]
  - - [3840, 256, 1, 1280, 3840, 3840, 3840, 1280]
    - [21, 30425.5]
  - - [3840, 64, 1, 1280, 3840, 3840, 3840, 1280]
    - [29, 17961.5]
  - - [441, 1, 1, 25, 441, 441, 441, 25]
    - [2, 4.12737]
  - - [441, 1, 1, 49, 441, 441, 441, 49]
    - [2, 7.6059]
  - - [441, 1, 1, 9, 441, 441, 441, 9]
    - [2, 1.50276]
  - - [49, 1, 1, 9, 49, 49, 49, 9]
    - [2, 0.169341]
  - - [49, 24, 1, 216, 49, 49, 49, 216]
    - [27, 72.5762]
  - - [49, 32, 1, 288, 49, 49, 49, 288]
    - [27, 120.904]
  - - [5120, 1024, 1, 640, 5120, 5120, 5120, 640]
    - [19, 38490.8]
  - - [64, 1024, 1, 1024, 64, 64, 64, 1024]
    - [30, 8783.08]
  - - [64, 1024, 1, 64, 64, 64, 64, 64]
    - [32, 1474.66]
  - - [64, 128, 1, 128, 64, 64, 64, 128]
    - [31, 378.683]
  - - [64, 256, 1, 256, 64, 64, 64, 256]
    - [25, 1306.35]
  - - [64, 256, 1, 64, 64, 64, 64, 64]
    - [31, 410.523]
  - - [64, 384, 1, 384, 64, 64, 64, 384]
    - [31, 2595.64]
  - - [64, 4096, 1, 4096, 64, 64, 64, 4096]
    - [30, 21813.5]
  - - [64, 4096, 1, 64, 64, 64, 64, 64]
    - [32, 4911.52]
  - - [64, 64, 1, 64, 64, 64, 64, 64]
    - [31, 102.94]
  - - [640, 1024, 1, 2560, 640, 640, 640, 2560]
    - [20, 31238.0]
  - - [640, 1024, 1, 640, 640, 640, 640, 640]
    - [19, 27614.0]
  - - [6889, 1, 1, 25, 6889, 6889, 6889, 25]
    - [0, 52.0705]
  - - [6889, 1, 1, 49, 6889, 6889, 6889, 49]
    - [0, 96.8047]
  - - [6889, 1, 1, 9, 6889, 6889, 6889, 9]
    - [7, 19.3737]
  - - [784, 1, 1, 9, 784, 784, 784, 9]
    - [9, 2.71905]
  - - [784, 6, 1, 54, 784, 784, 784, 54]
    - [9, 90.7858]
  - - [784, 8, 1, 72, 784, 784, 784, 72]
    - [9, 157.144]
  - - [960, 4096, 1, 320, 960, 960, 960, 320]
    - [19, 38170.6]
- null
- null
- DeviceEfficiency
- Equality
