library/src/amd_detail/rocblaslt/src/Tensile/Logic/asm_full/navi32/Equality/navi32_Cijk_Alik_Bljk_BBS_UserArgs.yaml
- {MinimumRequiredVersion: 4.33.0}
- navi32
- gfx1101
- [Device 73f0]
    SolutionIndex: 0
    SolutionNameMin: Cijk_Alik_Bljk_BBS_BH_UserArgs_MT192x16x32_MI16x16x1_SN_LDSB1_CLR1_EPS0_GRVWA8_GRVWB4_GSU1_IU1_LBSPPA128_LBSPPB128_MIWT3_1_PGR2_PLR1_SIA3_SS0_SU32_SUM0_SUS256_TLDS1_WG64_2_1_WGM8
    SolutionIndex: 1
    SolutionNameMin: Cijk_Alik_Bljk_BBS_BH_UserArgs_MT32x32x32_MI16x16x1_SN_LDSB0_CLR1_EPS0_GRVWA8_GRVWB8_GSU1_IU1_LBSPPA128_LBSPPB128_MIWT1_1_PGR1_PLR1_SIA1_SS0_SU32_SUM0_SUS256_TLDS1_WG32_4_1_WGM8
    SolutionIndex: 2
    SolutionNameMin: Cijk_Alik_Bljk_BBS_BH_UserArgs_MT64x16x64_MI16x16x1_SN_LDSB0_CLR0_EPS0_GRVWA8_GRVWB8_GSU1_IU1_LBSPPA128_LBSPPB128_MIWT1_1_PGR2_PLR0_SIA1_SS0_SU32_SUM0_SUS256_TLDS1_WG64_2_1_WGM8
    SolutionIndex: 3
    SolutionNameMin: Cijk_Alik_Bljk_BBS_BH_UserArgs_MT64x16x64_MI16x16x1_SN_LDSB0_CLR1_EPS0_GRVWA8_GRVWB8_GSU1_IU1_LBSPPA128_LBSPPB128_MIWT1_1_PGR2_PLR1_SIA3_SS0_SU32_SUM0_SUS256_TLDS1_WG64_2_1_WGM8
    SolutionIndex: 4
    SolutionNameMin: Cijk_Alik_Bljk_BBS_BH_UserArgs_MT64x16x64_MI16x16x1_SN_LDSB0_CLR0_EPS0_GRVWA8_GRVWB8_GSU2_IU1_LBSPPA128_LBSPPB128_MIWT1_1_PGR1_PLR0_SIA3_SS0_SU32_SUM0_SUS256_TLDS1_WG64_2_1_WGM8
    SolutionIndex: 5
    SolutionNameMin: Cijk_Alik_Bljk_BBS_BH_UserArgs_MT128x16x64_MI16x16x1_SN_LDSB1_CLR1_EPS0_GRVWA8_GRVWB8_GSU1_IU1_LBSPPA128_LBSPPB128_MIWT2_1_PGR1_PLR1_SIA3_SS0_SU32_SUM0_SUS256_TLDS1_WG64_2_1_WGM8
    SolutionIndex: 6
    SolutionNameMin: Cijk_Alik_Bljk_BBS_BH_UserArgs_MT192x16x64_MI16x16x1_SN_LDSB1_CLR1_EPS0_GRVWA8_GRVWB8_GSU2_IU1_LBSPPA128_LBSPPB128_MIWT3_1_PGR2_PLR3_SIA3_SS0_SU32_SUM0_SUS256_TLDS1_WG64_2_1_WGM8
    SolutionIndex: 7
    SolutionNameMin: Cijk_Alik_Bljk_BBS_BH_UserArgs_MT16x64x64_MI16x16x1_SN_LDSB0_CLR1_EPS0_GRVWA8_GRVWB8_GSU1_IU1_LBSPPA128_LBSPPB128_MIWT1_1_PGR2_PLR3_SIA3_SS0_SU32_SUM0_SUS256_TLDS1_WG16_8_1_WGM8
    SolutionIndex: 8
    SolutionNameMin: Cijk_Alik_Bljk_BBS_BH_UserArgs_MT128x48x32_MI16x16x1_SN_LDSB1_CLR1_EPS1_GRVWA8_GRVWB4_GSU1_IU2_LBSPPA128_LBSPPB128_MIWT2_3_PGR1_PLR1_SIA2_SS1_SU32_SUM0_SUS256_TLDS1_WG64_2_1_WGM8
    SolutionIndex: 9
    SolutionNameMin: Cijk_Alik_Bljk_BBS_BH_UserArgs_MT96x96x32_MI16x16x1_SN_LDSB0_CLR1_EPS0_GRVWA8_GRVWB8_GSU1_IU1_LBSPPA128_LBSPPB128_MIWT3_3_PGR1_PLR1_SIA1_SS1_SU32_SUM0_SUS256_TLDS1_WG32_4_1_WGM8
    SolutionIndex: 10
    SolutionNameMin: Cijk_Alik_Bljk_BBS_BH_UserArgs_MT96x96x32_MI16x16x1_SN_LDSB0_CLR1_EPS0_GRVWA8_GRVWB8_GSU1_IU1_LBSPPA128_LBSPPB128_MIWT3_3_PGR1_PLR1_SIA3_SS1_SU32_SUM0_SUS256_TLDS1_WG32_4_1_WGM8
    SolutionIndex: 11
    SolutionNameMin: Cijk_Alik_Bljk_BBS_BH_UserArgs_MT96x96x32_MI16x16x1_SN_LDSB0_CLR1_EPS0_GRVWA8_GRVWB8_GSU1_IU1_LBSPPA128_LBSPPB128_MIWT3_3_PGR2_PLR1_SIA3_SS1_SU32_SUM0_SUS256_TLDS1_WG32_4_1_WGM8
    SolutionIndex: 12
    SolutionNameMin: Cijk_Alik_Bljk_BBS_BH_UserArgs_MT48x128x32_MI16x16x1_SN_LDSB1_CLR1_EPS1_GRVWA4_GRVWB8_GSU1_IU2_LBSPPA128_LBSPPB128_MIWT3_2_PGR1_PLR1_SIA2_SS1_SU32_SUM0_SUS256_TLDS1_WG16_8_1_WGM8
    SolutionIndex: 13
    SolutionNameMin: Cijk_Alik_Bljk_BBS_BH_UserArgs_MT80x128x32_MI16x16x1_SN_LDSB1_CLR1_EPS1_GRVWA4_GRVWB8_GSU1_IU2_LBSPPA128_LBSPPB128_MIWT5_2_PGR1_PLR1_SIA2_SS1_SU32_SUM0_SUS256_TLDS1_WG16_8_1_WGM8
    SolutionIndex: 14
    SolutionNameMin: Cijk_Alik_Bljk_BBS_BH_UserArgs_MT80x128x32_MI16x16x1_SN_LDSB1_CLR1_EPS0_GRVWA4_GRVWB8_GSU1_IU1_LBSPPA128_LBSPPB128_MIWT5_2_PGR1_PLR1_SIA3_SS1_SU32_SUM0_SUS256_TLDS1_WG16_8_1_WGM8
    SolutionIndex: 15
    SolutionNameMin: Cijk_Alik_Bljk_BBS_BH_UserArgs_MT80x128x32_MI16x16x1_SN_LDSB1_CLR1_EPS0_GRVWA4_GRVWB8_GSU1_IU1_LBSPPA128_LBSPPB128_MIWT5_2_PGR2_PLR1_SIA3_SS1_SU32_SUM0_SUS256_TLDS1_WG16_8_1_WGM8
    SolutionIndex: 16
    SolutionNameMin: Cijk_Alik_Bljk_BBS_BH_UserArgs_MT64x16x64_MI16x16x1_SN_LDSB0_CLR1_EPS0_GRVWA8_GRVWB8_GSU1_IU1_LBSPPA2048_LBSPPB512_MIWT1_1_PGR2_PLR1_SIA1_SS1_SU32_SUM0_SUS256_TLDS0_WG64_2_1_WGM8
    SolutionIndex: 17
    SolutionNameMin: Cijk_Alik_Bljk_BBS_BH_UserArgs_MT64x16x64_MI16x16x1_SN_LDSB0_CLR1_EPS0_GRVWA8_GRVWB8_GSU1_IU1_LBSPPA128_LBSPPB128_MIWT1_1_PGR2_PLR3_SIA1_SS1_SU32_SUM0_SUS256_TLDS1_WG64_2_1_WGM8
    SolutionIndex: 18
    SolutionNameMin: Cijk_Alik_Bljk_BBS_BH_UserArgs_MT64x16x64_MI16x16x1_SN_LDSB0_CLR0_EPS0_GRVWA8_GRVWB8_GSU1_IU1_LBSPPA128_LBSPPB128_MIWT1_1_PGR2_PLR0_SIA1_SS1_SU32_SUM0_SUS256_TLDS1_WG64_2_1_WGM8
    SolutionIndex: 19
    SolutionNameMin: Cijk_Alik_Bljk_BBS_BH_UserArgs_MT64x16x64_MI16x16x1_SN_LDSB0_CLR1_EPS0_GRVWA8_GRVWB8_GSU1_IU1_LBSPPA128_LBSPPB128_MIWT1_1_PGR1_PLR1_SIA3_SS1_SU32_SUM0_SUS256_TLDS1_WG64_2_1_WGM8
    SolutionIndex: 20
    SolutionNameMin: Cijk_Alik_Bljk_BBS_BH_UserArgs_MT64x16x64_MI16x16x1_SN_LDSB0_CLR1_EPS0_GRVWA8_GRVWB8_GSU1_IU1_LBSPPA128_LBSPPB128_MIWT1_1_PGR1_PLR3_SIA3_SS1_SU32_SUM0_SUS256_TLDS1_WG64_2_1_WGM8
    SolutionIndex: 21
    SolutionNameMin: Cijk_Alik_Bljk_BBS_BH_UserArgs_MT64x16x64_MI16x16x1_SN_LDSB0_CLR1_EPS0_GRVWA8_GRVWB8_GSU1_IU1_LBSPPA128_LBSPPB128_MIWT1_1_PGR2_PLR3_SIA3_SS1_SU32_SUM0_SUS256_TLDS1_WG64_2_1_WGM8
    SolutionIndex: 22
    SolutionNameMin: Cijk_Alik_Bljk_BBS_BH_UserArgs_MT64x16x64_MI16x16x1_SN_LDSB0_CLR0_EPS0_GRVWA8_GRVWB8_GSU1_IU1_LBSPPA128_LBSPPB128_MIWT1_1_PGR2_PLR0_SIA3_SS1_SU32_SUM0_SUS256_TLDS1_WG64_2_1_WGM8
    SolutionIndex: 23
    SolutionNameMin: Cijk_Alik_Bljk_BBS_BH_UserArgs_MT64x16x64_MI16x16x1_SN_LDSB0_CLR1_EPS0_GRVWA8_GRVWB8_GSU2_IU1_LBSPPA128_LBSPPB128_MIWT1_1_PGR2_PLR1_SIA1_SS1_SU32_SUM0_SUS256_TLDS1_WG64_2_1_WGM8
    SolutionIndex: 24
    SolutionNameMin: Cijk_Alik_Bljk_BBS_BH_UserArgs_MT64x16x64_MI16x16x1_SN_LDSB0_CLR1_EPS0_GRVWA8_GRVWB8_GSU2_IU1_LBSPPA2048_LBSPPB512_MIWT1_1_PGR2_PLR3_SIA1_SS1_SU32_SUM0_SUS256_TLDS0_WG64_2_1_WGM8
    SolutionIndex: 25
    SolutionNameMin: Cijk_Alik_Bljk_BBS_BH_UserArgs_MT64x16x64_MI16x16x1_SN_LDSB0_CLR1_EPS0_GRVWA8_GRVWB8_GSU2_IU1_LBSPPA128_LBSPPB128_MIWT1_1_PGR2_PLR3_SIA3_SS1_SU32_SUM0_SUS256_TLDS1_WG64_2_1_WGM8
    SolutionIndex: 26
    SolutionNameMin: Cijk_Alik_Bljk_BBS_BH_UserArgs_MT128x16x64_MI16x16x1_SN_LDSB1_CLR1_EPS0_GRVWA8_GRVWB8_GSU2_IU1_LBSPPA128_LBSPPB128_MIWT2_1_PGR1_PLR1_SIA3_SS1_SU32_SUM0_SUS256_TLDS1_WG64_2_1_WGM8
    SolutionIndex: 27
    SolutionNameMin: Cijk_Alik_Bljk_BBS_BH_UserArgs_MT192x16x64_MI16x16x1_SN_LDSB1_CLR1_EPS0_GRVWA8_GRVWB8_GSU1_IU1_LBSPPA128_LBSPPB128_MIWT3_1_PGR2_PLR3_SIA3_SS1_SU32_SUM0_SUS256_TLDS1_WG64_2_1_WGM8
    SolutionIndex: 28
    SolutionNameMin: Cijk_Alik_Bljk_BBS_BH_UserArgs_MT192x16x64_MI16x16x1_SN_LDSB1_CLR1_EPS0_GRVWA8_GRVWB8_GSU2_IU1_LBSPPA128_LBSPPB128_MIWT3_1_PGR2_PLR1_SIA3_SS1_SU32_SUM0_SUS256_TLDS1_WG64_2_1_WGM8
    SolutionIndex: 29
    SolutionNameMin: Cijk_Alik_Bljk_BBS_BH_UserArgs_MT16x64x64_MI16x16x1_SN_LDSB0_CLR1_EPS0_GRVWA8_GRVWB8_GSU1_IU1_LBSPPA128_LBSPPB128_MIWT1_1_PGR2_PLR3_SIA1_SS1_SU32_SUM0_SUS256_TLDS1_WG16_8_1_WGM8
- - - [8, 8, 1, 80, 8, 8, 80, 80]
    - [1, 0.31153]
  - - [16, 16, 1, 96, 16, 16, 96, 96]
    - [29, 1.46377]
  - - [16, 16, 1, 128, 16, 16, 128, 128]
    - [7, 1.947]
  - - [128, 128, 1, 128, 128, 128, 128, 128]
    - [21, 131.818]
  - - [2048, 2048, 1, 80, 2048, 2048, 80, 80]
    - [8, 7689.8]
  - - [2048, 2048, 1, 96, 2048, 2048, 96, 96]
    - [8, 9198.25]
  - - [2048, 2048, 1, 128, 2048, 2048, 128, 128]
    - [12, 10913.1]
  - - [2560, 2048, 1, 2560, 2560, 2560, 2560, 2560]
    - [9, 23716.6]
  - - [2560, 2048, 1, 10240, 2560, 2560, 10240, 10240]
    - [14, 25031.6]
  - - [3072, 1, 1, 3072, 3072, 3072, 3072, 3072]
    - [3, 252.233]
  - - [3072, 1, 1, 8192, 3072, 3072, 8192, 8192]
    - [26, 391.503]
  - - [3072, 2048, 1, 3072, 3072, 3072, 3072, 3072]
    - [9, 23826.9]
  - - [3072, 2048, 1, 8192, 3072, 3072, 8192, 8192]
    - [9, 24380.1]
  - - [3072, 4096, 1, 3072, 3072, 3072, 3072, 3072]
    - [9, 25420.7]
  - - [3072, 4096, 1, 8192, 3072, 3072, 8192, 8192]
    - [9, 25724.8]
  - - [4096, 1, 1, 4096, 4096, 4096, 4096, 4096]
    - [6, 334.141]
  - - [4096, 1, 1, 11008, 4096, 4096, 11008, 11008]
    - [0, 304.008]
  - - [4096, 1, 1, 14336, 4096, 4096, 14336, 14336]
    - [28, 272.32]
  - - [4096, 2048, 1, 4096, 4096, 4096, 4096, 4096]
    - [9, 24300.7]
  - - [4096, 2048, 1, 11008, 4096, 4096, 11008, 11008]
    - [10, 24940.6]
  - - [4096, 2048, 1, 14336, 4096, 4096, 14336, 14336]
    - [9, 24647.3]
  - - [4096, 4096, 1, 4096, 4096, 4096, 4096, 4096]
    - [9, 25372.9]
  - - [4096, 4096, 1, 11008, 4096, 4096, 11008, 11008]
    - [10, 25805.5]
  - - [4096, 32768, 1, 4096, 4096, 4096, 4096, 4096]
    - [10, 25913.0]
  - - [4096, 32768, 1, 14336, 4096, 4096, 14336, 14336]
    - [11, 26145.1]
  - - [5120, 1, 1, 5120, 5120, 5120, 5120, 5120]
    - [6, 448.535]
  - - [5120, 1, 1, 13824, 5120, 5120, 13824, 13824]
    - [18, 320.804]
  - - [5120, 2048, 1, 5120, 5120, 5120, 5120, 5120]
    - [9, 24799.2]
  - - [5120, 2048, 1, 13824, 5120, 5120, 13824, 13824]
    - [9, 25045.5]
  - - [5120, 4096, 1, 5120, 5120, 5120, 5120, 5120]
    - [9, 25577.2]
  - - [5120, 4096, 1, 13824, 5120, 5120, 13824, 13824]
    - [9, 25630.8]
  - - [6144, 1, 1, 4096, 6144, 6144, 4096, 4096]
    - [5, 411.846]
  - - [6144, 2048, 1, 4096, 6144, 6144, 4096, 4096]
    - [9, 24776.6]
  - - [6144, 32768, 1, 4096, 6144, 6144, 4096, 4096]
    - [10, 26061.4]
  - - [7680, 2048, 1, 2560, 7680, 7680, 2560, 2560]
    - [9, 24700.2]
  - - [9216, 1, 1, 3072, 9216, 9216, 3072, 3072]
    - [27, 453.057]
  - - [9216, 2048, 1, 3072, 9216, 9216, 3072, 3072]
    - [9, 24867.9]
  - - [9216, 4096, 1, 3072, 9216, 9216, 3072, 3072]
    - [9, 25682.2]
  - - [10240, 2048, 1, 2560, 10240, 10240, 2560, 2560]
    - [9, 24750.8]
  - - [12288, 1, 1, 4096, 12288, 12288, 4096, 4096]
    - [17, 305.615]
  - - [12288, 2048, 1, 4096, 12288, 12288, 4096, 4096]
    - [9, 25156.2]
  - - [12288, 4096, 1, 4096, 12288, 12288, 4096, 4096]
    - [9, 25873.1]
  - - [15360, 1, 1, 5120, 15360, 15360, 5120, 5120]
    - [4, 313.47]
  - - [15360, 2048, 1, 5120, 15360, 15360, 5120, 5120]
    - [9, 25326.9]
  - - [15360, 4096, 1, 5120, 15360, 15360, 5120, 5120]
    - [10, 25935.9]
  - - [16384, 1, 1, 3072, 16384, 16384, 3072, 3072]
    - [16, 299.327]
  - - [16384, 2048, 1, 3072, 16384, 16384, 3072, 3072]
    - [9, 25019.6]
  - - [16384, 4096, 1, 3072, 16384, 16384, 3072, 3072]
    - [9, 25697.9]
  - - [22016, 1, 1, 4096, 22016, 22016, 4096, 4096]
    - [23, 320.518]
  - - [22016, 2048, 1, 4096, 22016, 22016, 4096, 4096]
    - [9, 25166.8]
  - - [22016, 4096, 1, 4096, 22016, 22016, 4096, 4096]
    - [9, 25806.2]
  - - [27648, 1, 1, 5120, 27648, 27648, 5120, 5120]
    - [22, 331.727]
  - - [27648, 2048, 1, 5120, 27648, 27648, 5120, 5120]
    - [9, 25339.1]
  - - [27648, 4096, 1, 5120, 27648, 27648, 5120, 5120]
    - [10, 26039.5]
  - - [28672, 1, 1, 4096, 28672, 28672, 4096, 4096]
    - [25, 326.755]
  - - [28672, 2048, 1, 4096, 28672, 28672, 4096, 4096]
    - [11, 25278.0]
  - - [28672, 32768, 1, 4096, 28672, 28672, 4096, 4096]
    - [11, 26219.4]
  - - [32000, 1, 1, 4096, 32000, 32000, 4096, 4096]
    - [20, 331.535]
  - - [32000, 1, 1, 5120, 32000, 32000, 5120, 5120]
    - [24, 331.305]
  - - [32000, 256, 1, 4096, 32000, 32000, 4096, 4096]
    - [15, 24033.1]
  - - [32000, 256, 1, 5120, 32000, 32000, 5120, 5120]
    - [15, 24175.5]
  - - [32064, 1, 1, 3072, 32064, 32064, 3072, 3072]
    - [2, 324.667]
  - - [32064, 256, 1, 3072, 32064, 32064, 3072, 3072]
    - [15, 23854.4]
  - - [51200, 1, 1, 2560, 51200, 51200, 2560, 2560]
    - [19, 331.854]
  - - [51200, 256, 1, 2560, 51200, 51200, 2560, 2560]
    - [13, 23142.9]
- null
- null
- DeviceEfficiency
- Equality
