library/src/amd_detail/rocblaslt/src/Tensile/Logic/asm_full/navi32/Equality/navi32_Cijk_Ailk_Bljk_HHS_BH_UserArgs.yaml
- {MinimumRequiredVersion: 4.33.0}
- navi32
- gfx1101
- [Device 73f0]
    SolutionIndex: 0
    SolutionNameMin: Cijk_Ailk_Bljk_HHS_BH_UserArgs_MT64x16x32_MI16x16x1_SN_LDSB0_GRVWA2_GRVWB4_GSU1_LBSPPA2048_LBSPPB128_MIWT1_1_NLCA1_SS0_SU32_SUM0_SUS256_TLDS1_WG64_2_1_WGM8
    SolutionIndex: 1
    SolutionNameMin: Cijk_Ailk_Bljk_HHS_BH_UserArgs_MT32x32x32_MI16x16x1_SN_LDSB0_GRVWA2_GRVWB8_GSU1_LBSPPA1024_LBSPPB1024_MIWT1_1_NLCA1_SS0_SU32_SUM0_SUS256_TLDS0_WG32_4_1_WGM8
    SolutionIndex: 2
    SolutionNameMin: Cijk_Ailk_Bljk_HHS_BH_UserArgs_MT32x32x32_MI16x16x1_SN_LDSB0_GRVWA2_GRVWB8_GSU1_LBSPPA1024_LBSPPB128_MIWT1_1_NLCA1_SS0_SU32_SUM0_SUS256_TLDS1_WG32_4_1_WGM8
    SolutionIndex: 3
    SolutionNameMin: Cijk_Ailk_Bljk_HHS_BH_UserArgs_MT64x16x32_MI16x16x1_SN_LDSB0_GRVWA8_GRVWB4_GSU1_LBSPPA2048_LBSPPB128_MIWT1_1_NLCA1_SS1_SU32_SUM0_SUS256_TLDS1_WG64_2_1_WGM8
    SolutionIndex: 4
    SolutionNameMin: Cijk_Ailk_Bljk_HHS_BH_UserArgs_MT64x16x32_MI16x16x1_SN_LDSB0_GRVWA8_GRVWB4_GSU4_LBSPPA2048_LBSPPB128_MIWT1_1_NLCA1_SS1_SU32_SUM0_SUS256_TLDS1_WG64_2_1_WGM8
    SolutionIndex: 5
    SolutionNameMin: Cijk_Ailk_Bljk_HHS_BH_UserArgs_MT128x16x32_MI16x16x1_SN_LDSB0_GRVWA8_GRVWB4_GSU1_LBSPPA4096_LBSPPB512_MIWT2_1_NLCA1_SS1_SU32_SUM0_SUS256_TLDS0_WG64_2_1_WGM8
    SolutionIndex: 6
    SolutionNameMin: Cijk_Ailk_Bljk_HHS_BH_UserArgs_MT128x16x32_MI16x16x1_SN_LDSB0_GRVWA8_GRVWB4_GSU1_LBSPPA4096_LBSPPB128_MIWT2_1_NLCA1_SS1_SU32_SUM0_SUS256_TLDS1_WG64_2_1_WGM8
    SolutionIndex: 7
    SolutionNameMin: Cijk_Ailk_Bljk_HHS_BH_UserArgs_MT192x16x32_MI16x16x1_SN_LDSB0_GRVWA8_GRVWB4_GSU4_LBSPPA6144_LBSPPB128_MIWT3_1_NLCA3_SS1_SU32_SUM0_SUS256_TLDS1_WG64_2_1_WGM8
    SolutionIndex: 8
    SolutionNameMin: Cijk_Ailk_Bljk_HHS_BH_UserArgs_MT256x16x32_MI16x16x1_SN_LDSB1_GRVWA8_GRVWB4_GSU1_LBSPPA8192_LBSPPB512_MIWT4_1_NLCA1_SS1_SU32_SUM0_SUS256_TLDS0_WG64_2_1_WGM8
    SolutionIndex: 9
    SolutionNameMin: Cijk_Ailk_Bljk_HHS_BH_UserArgs_MT256x16x32_MI16x16x1_SN_LDSB1_GRVWA8_GRVWB4_GSU1_LBSPPA8192_LBSPPB128_MIWT4_1_NLCA1_SS1_SU32_SUM0_SUS256_TLDS1_WG64_2_1_WGM8
    SolutionIndex: 10
    SolutionNameMin: Cijk_Ailk_Bljk_HHS_BH_UserArgs_MT32x32x32_MI16x16x1_SN_LDSB0_GRVWA8_GRVWB8_GSU1_LBSPPA1024_LBSPPB128_MIWT1_1_NLCA1_SS1_SU32_SUM0_SUS256_TLDS1_WG32_4_1_WGM8
    SolutionIndex: 11
    SolutionNameMin: Cijk_Ailk_Bljk_HHS_BH_UserArgs_MT32x32x32_MI16x16x1_SN_LDSB0_GRVWA8_GRVWB8_GSU4_LBSPPA1024_LBSPPB128_MIWT1_1_NLCA1_SS1_SU32_SUM0_SUS256_TLDS1_WG32_4_1_WGM8
    SolutionIndex: 12
    SolutionNameMin: Cijk_Ailk_Bljk_HHS_BH_UserArgs_MT64x32x32_MI16x16x1_SN_LDSB0_GRVWA8_GRVWB8_GSU1_LBSPPA2048_LBSPPB128_MIWT2_1_NLCA1_SS1_SU32_SUM0_SUS256_TLDS1_WG32_4_1_WGM8
    SolutionIndex: 13
    SolutionNameMin: Cijk_Ailk_Bljk_HHS_BH_UserArgs_MT64x32x32_MI16x16x1_SN_LDSB0_GRVWA8_GRVWB8_GSU4_LBSPPA2048_LBSPPB128_MIWT2_1_NLCA1_SS1_SU32_SUM0_SUS256_TLDS1_WG32_4_1_WGM8
    SolutionIndex: 14
    SolutionNameMin: Cijk_Ailk_Bljk_HHS_BH_UserArgs_MT96x32x32_MI16x16x1_SN_LDSB0_GRVWA8_GRVWB8_GSU1_LBSPPA3072_LBSPPB128_MIWT3_1_NLCA3_SS1_SU32_SUM0_SUS256_TLDS1_WG32_4_1_WGM8
    SolutionIndex: 15
    SolutionNameMin: Cijk_Ailk_Bljk_HHS_BH_UserArgs_MT96x32x32_MI16x16x1_SN_LDSB0_GRVWA8_GRVWB8_GSU4_LBSPPA3072_LBSPPB128_MIWT3_1_NLCA3_SS1_SU32_SUM0_SUS256_TLDS1_WG32_4_1_WGM8
    SolutionIndex: 16
    SolutionNameMin: Cijk_Ailk_Bljk_HHS_BH_UserArgs_MT160x32x32_MI16x16x1_SN_LDSB0_GRVWA8_GRVWB8_GSU1_LBSPPA5120_LBSPPB128_MIWT5_1_NLCA5_SS1_SU32_SUM0_SUS256_TLDS1_WG32_4_1_WGM8
    SolutionIndex: 17
    SolutionNameMin: Cijk_Ailk_Bljk_HHS_BH_UserArgs_MT160x32x32_MI16x16x1_SN_LDSB0_GRVWA8_GRVWB8_GSU4_LBSPPA5120_LBSPPB128_MIWT5_1_NLCA5_SS1_SU32_SUM0_SUS256_TLDS1_WG32_4_1_WGM8
    SolutionIndex: 18
    SolutionNameMin: Cijk_Ailk_Bljk_HHS_BH_UserArgs_MT64x48x32_MI16x16x1_SN_LDSB0_GRVWA8_GRVWB4_GSU1_LBSPPA2048_LBSPPB128_MIWT1_3_NLCA1_SS1_SU32_SUM0_SUS256_TLDS1_WG64_2_1_WGM8
    SolutionIndex: 19
    SolutionNameMin: Cijk_Ailk_Bljk_HHS_BH_UserArgs_MT128x48x32_MI16x16x1_SN_LDSB0_GRVWA8_GRVWB4_GSU1_LBSPPA4096_LBSPPB128_MIWT2_3_NLCA1_SS1_SU32_SUM0_SUS256_TLDS1_WG64_2_1_WGM8
    SolutionIndex: 20
    SolutionNameMin: Cijk_Ailk_Bljk_HHS_BH_UserArgs_MT128x48x32_MI16x16x1_SN_LDSB0_GRVWA8_GRVWB4_GSU4_LBSPPA4096_LBSPPB128_MIWT2_3_NLCA1_SS1_SU32_SUM0_SUS256_TLDS1_WG64_2_1_WGM8
    SolutionIndex: 21
    SolutionNameMin: Cijk_Ailk_Bljk_HHS_BH_UserArgs_MT16x64x32_MI16x16x1_SN_LDSB0_GRVWA4_GRVWB8_GSU1_LBSPPA512_LBSPPB2048_MIWT1_1_NLCA1_SS1_SU32_SUM0_SUS256_TLDS0_WG16_8_1_WGM8
    SolutionIndex: 22
    SolutionNameMin: Cijk_Ailk_Bljk_HHS_BH_UserArgs_MT32x64x32_MI16x16x1_SN_LDSB0_GRVWA8_GRVWB8_GSU1_LBSPPA1024_LBSPPB2048_MIWT2_1_NLCA1_SS1_SU32_SUM0_SUS256_TLDS0_WG16_8_1_WGM8
    SolutionIndex: 23
    SolutionNameMin: Cijk_Ailk_Bljk_HHS_BH_UserArgs_MT64x96x32_MI16x16x1_SN_LDSB0_GRVWA8_GRVWB8_GSU1_LBSPPA2048_LBSPPB128_MIWT2_3_NLCA1_SS1_SU32_SUM0_SUS256_TLDS1_WG32_4_1_WGM8
    SolutionIndex: 24
    SolutionNameMin: Cijk_Ailk_Bljk_HHS_BH_UserArgs_MT64x96x32_MI16x16x1_SN_LDSB0_GRVWA8_GRVWB8_GSU2_LBSPPA2048_LBSPPB128_MIWT2_3_NLCA1_SS1_SU32_SUM0_SUS256_TLDS1_WG32_4_1_WGM8
    SolutionIndex: 25
    SolutionNameMin: Cijk_Ailk_Bljk_HHS_BH_UserArgs_MT64x96x32_MI16x16x1_SN_LDSB0_GRVWA8_GRVWB8_GSU4_LBSPPA2048_LBSPPB128_MIWT2_3_NLCA1_SS1_SU32_SUM0_SUS256_TLDS1_WG32_4_1_WGM8
    SolutionIndex: 26
    SolutionNameMin: Cijk_Ailk_Bljk_HHS_BH_UserArgs_MT96x96x32_MI16x16x1_SN_LDSB0_GRVWA8_GRVWB8_GSU1_LBSPPA3072_LBSPPB128_MIWT3_3_NLCA3_SS1_SU32_SUM0_SUS256_TLDS1_WG32_4_1_WGM8
    SolutionIndex: 27
    SolutionNameMin: Cijk_Ailk_Bljk_HHS_BH_UserArgs_MT96x96x32_MI16x16x1_SN_LDSB0_GRVWA8_GRVWB8_GSU2_LBSPPA3072_LBSPPB128_MIWT3_3_NLCA3_SS1_SU32_SUM0_SUS256_TLDS1_WG32_4_1_WGM8
    SolutionIndex: 28
    SolutionNameMin: Cijk_Ailk_Bljk_HHS_BH_UserArgs_MT96x96x32_MI16x16x1_SN_LDSB0_GRVWA8_GRVWB8_GSU4_LBSPPA3072_LBSPPB128_MIWT3_3_NLCA3_SS1_SU32_SUM0_SUS256_TLDS1_WG32_4_1_WGM8
    SolutionIndex: 29
    SolutionNameMin: Cijk_Ailk_Bljk_HHS_BH_UserArgs_MT48x128x32_MI16x16x1_SN_LDSB0_GRVWA4_GRVWB8_GSU1_LBSPPA1536_LBSPPB4096_MIWT3_2_NLCA3_SS1_SU32_SUM0_SUS256_TLDS0_WG16_8_1_WGM8
    SolutionIndex: 30
    SolutionNameMin: Cijk_Ailk_Bljk_HHS_BH_UserArgs_MT64x16x64_MI16x16x1_SN_LDSB0_GRVWA8_GRVWB8_GSU1_LBSPPA2048_LBSPPB128_MIWT1_1_NLCA1_SS1_SU32_SUM0_SUS256_TLDS1_WG64_2_1_WGM8
    SolutionIndex: 31
    SolutionNameMin: Cijk_Ailk_Bljk_HHS_BH_UserArgs_MT64x16x64_MI16x16x1_SN_LDSB0_GRVWA8_GRVWB8_GSU4_LBSPPA2048_LBSPPB128_MIWT1_1_NLCA1_SS1_SU32_SUM0_SUS256_TLDS1_WG64_2_1_WGM8
    SolutionIndex: 32
    SolutionNameMin: Cijk_Ailk_Bljk_HHS_BH_UserArgs_MT64x32x64_MI16x16x1_SN_LDSB0_GRVWA8_GRVWB8_GSU4_LBSPPA2048_LBSPPB1024_MIWT2_1_NLCA1_SS1_SU32_SUM0_SUS256_TLDS0_WG32_4_1_WGM8
    SolutionIndex: 33
    SolutionNameMin: Cijk_Ailk_Bljk_HHS_BH_UserArgs_MT64x48x64_MI16x16x1_SN_LDSB0_GRVWA8_GRVWB8_GSU1_LBSPPA2048_LBSPPB128_MIWT1_3_NLCA1_SS1_SU32_SUM0_SUS256_TLDS1_WG64_2_1_WGM8
    SolutionIndex: 34
    SolutionNameMin: Cijk_Ailk_Bljk_HHS_BH_UserArgs_MT64x48x64_MI16x16x1_SN_LDSB0_GRVWA8_GRVWB8_GSU4_LBSPPA2048_LBSPPB128_MIWT1_3_NLCA1_SS1_SU32_SUM0_SUS256_TLDS1_WG64_2_1_WGM8
- - - [2304, 1, 1, 768, 2304, 2304, 2304, 768]
    - [30, 302.45]
  - - [3072, 1, 1, 768, 3072, 3072, 3072, 768]
    - [30, 393.114]
  - - [768, 1, 1, 3072, 768, 768, 768, 3072]
    - [31, 290.585]
  - - [768, 1, 1, 768, 768, 768, 768, 768]
    - [30, 133.922]
  - - [1000, 1, 1, 2048, 1000, 1000, 1000, 2048]
    - [30, 262.875]
  - - [1000, 16, 1, 1536, 1000, 1000, 1000, 1536]
    - [30, 3831.04]
  - - [1000, 16, 1, 2048, 1000, 1000, 1000, 2048]
    - [30, 4169.4]
  - - [1000, 32, 1, 1024, 1000, 1000, 1000, 1024]
    - [10, 4719.71]
  - - [1000, 32, 1, 2048, 1000, 1000, 1000, 2048]
    - [17, 6743.87]
  - - [1000, 64, 1, 2048, 1000, 1000, 1000, 2048]
    - [15, 10864.7]
  - - [1001, 1, 1, 1536, 1001, 1001, 1001, 1536]
    - [30, 237.396]
  - - [1001, 1, 1, 2048, 1001, 1001, 1001, 2048]
    - [30, 258.216]
  - - [1001, 64, 1, 2048, 1001, 1001, 1001, 2048]
    - [15, 9971.93]
  - - [1001, 64, 1, 4032, 1001, 1001, 1001, 4032]
    - [15, 13040.0]
  - - [1024, 1, 1, 1024, 1024, 1024, 1024, 1024]
    - [30, 206.104]
  - - [1024, 12288, 1, 1024, 1024, 1024, 1024, 1024]
    - [26, 40631.6]
  - - [1024, 12288, 1, 4096, 1024, 1024, 1024, 4096]
    - [26, 42486.0]
  - - [1024, 1280, 1, 11520, 1024, 1024, 1024, 11520]
    - [27, 36290.2]
  - - [1024, 16, 1, 1024, 1024, 1024, 1024, 1024]
    - [30, 3383.19]
  - - [1024, 32, 1, 1024, 1024, 1024, 1024, 1024]
    - [10, 4835.48]
  - - [1024, 320, 1, 2880, 1024, 1024, 1024, 2880]
    - [27, 26639.8]
  - - [1024, 384, 1, 1024, 1024, 1024, 1024, 1024]
    - [26, 22725.0]
  - - [1024, 384, 1, 4096, 1024, 1024, 1024, 4096]
    - [27, 32496.0]
  - - [1024, 6144, 1, 1024, 1024, 1024, 1024, 1024]
    - [26, 39701.6]
  - - [1024, 6144, 1, 4096, 1024, 1024, 1024, 4096]
    - [26, 41418.0]
  - - [1024, 640, 1, 11520, 1024, 1024, 1024, 11520]
    - [28, 34809.7]
  - - [1024, 640, 1, 17280, 1024, 1024, 1024, 17280]
    - [28, 35049.6]
  - - [1024, 640, 1, 2880, 1024, 1024, 1024, 2880]
    - [26, 30768.0]
  - - [1024, 640, 1, 5760, 1024, 1024, 1024, 5760]
    - [26, 32443.7]
  - - [1024, 640, 1, 8640, 1024, 1024, 1024, 8640]
    - [28, 33868.5]
  - - [10240, 128, 1, 1280, 10240, 10240, 10240, 1280]
    - [19, 24559.2]
  - - [10240, 512, 1, 1280, 10240, 10240, 10240, 1280]
    - [26, 35569.8]
  - - [1225, 192, 1, 1728, 1225, 1225, 1225, 1728]
    - [28, 19081.0]
  - - [1225, 224, 1, 1728, 1225, 1225, 1225, 1728]
    - [23, 20190.8]
  - - [1225, 64, 1, 1200, 1225, 1225, 1225, 1200]
    - [14, 9690.58]
  - - [1225, 96, 1, 576, 1225, 1225, 1225, 576]
    - [12, 9818.97]
  - - [1225, 96, 1, 864, 1225, 1225, 1225, 864]
    - [12, 11354.0]
  - - [12544, 1024, 1, 512, 12544, 12544, 12544, 512]
    - [26, 38572.6]
  - - [12544, 128, 1, 1152, 12544, 12544, 12544, 1152]
    - [19, 26309.3]
  - - [12544, 128, 1, 576, 12544, 12544, 12544, 576]
    - [29, 22566.9]
  - - [12544, 32, 1, 27, 12544, 12544, 12544, 27]
    - [9, 2684.16]
  - - [1280, 128, 1, 1280, 1280, 1280, 1280, 1280]
    - [20, 15852.7]
  - - [1280, 128, 1, 5120, 1280, 1280, 1280, 5120]
    - [20, 25035.7]
  - - [1280, 2, 1, 1280, 1280, 1280, 1280, 1280]
    - [30, 570.664]
  - - [1280, 2, 1, 320, 1280, 1280, 1280, 320]
    - [30, 248.164]
  - - [1280, 512, 1, 1280, 1280, 1280, 1280, 1280]
    - [26, 29266.5]
  - - [1280, 512, 1, 5120, 1280, 1280, 1280, 5120]
    - [26, 32212.9]
  - - [129600, 16, 1, 144, 129600, 129600, 129600, 144]
    - [9, 15136.5]
  - - [1920, 2048, 1, 640, 1920, 1920, 1920, 640]
    - [26, 36932.6]
  - - [196, 1024, 1, 512, 196, 196, 196, 512]
    - [23, 10795.6]
  - - [196, 1072, 1, 704, 196, 196, 196, 704]
    - [23, 12553.8]
  - - [196, 128, 1, 1152, 196, 196, 196, 1152]
    - [10, 5096.73]
  - - [196, 256, 1, 2304, 196, 196, 196, 2304]
    - [25, 9277.22]
  - - [196, 32, 1, 1152, 196, 196, 196, 1152]
    - [11, 1342.53]
  - - [196, 512, 1, 4608, 196, 196, 196, 4608]
    - [20, 18279.1]
  - - [2, 1, 1, 768, 2, 2, 2, 768]
    - [2, 0.346492]
  - - [2, 256, 1, 768, 2, 2, 2, 768]
    - [2, 88.7881]
  - - [2, 384, 1, 1024, 2, 2, 2, 1024]
    - [2, 154.605]
  - - [2, 8, 1, 768, 2, 2, 2, 768]
    - [2, 2.74072]
  - - [20160, 2, 1, 1280, 20160, 20160, 20160, 1280]
    - [7, 1935.06]
  - - [2073600, 16, 1, 144, 2073600, 2073600, 2073600, 144]
    - [6, 6403.63]
  - - [2073600, 16, 1, 72, 2073600, 2073600, 2073600, 72]
    - [5, 5544.34]
  - - [2073600, 4, 1, 144, 2073600, 2073600, 2073600, 144]
    - [9, 1881.98]
  - - [21609, 32, 1, 288, 21609, 21609, 21609, 288]
    - [16, 15091.7]
  - - [21609, 64, 1, 288, 21609, 21609, 21609, 288]
    - [26, 18236.3]
  - - [22201, 32, 1, 27, 22201, 22201, 22201, 27]
    - [14, 3519.41]
  - - [2304, 1024, 1, 768, 2304, 2304, 2304, 768]
    - [26, 34142.1]
  - - [2304, 12288, 1, 768, 2304, 2304, 2304, 768]
    - [26, 42553.2]
  - - [2304, 128, 1, 768, 2304, 2304, 2304, 768]
    - [19, 18583.2]
  - - [2304, 24576, 1, 768, 2304, 2304, 2304, 768]
    - [26, 43193.2]
  - - [2304, 256, 1, 768, 2304, 2304, 2304, 768]
    - [26, 24193.5]
  - - [2304, 3072, 1, 768, 2304, 2304, 2304, 768]
    - [26, 40906.6]
  - - [2304, 384, 1, 768, 2304, 2304, 2304, 768]
    - [26, 29957.5]
  - - [2304, 6144, 1, 768, 2304, 2304, 2304, 768]
    - [26, 41987.8]
  - - [24960, 128, 1, 1024, 24960, 24960, 24960, 1024]
    - [19, 28610.8]
  - - [256, 1, 1, 256, 256, 256, 256, 256]
    - [30, 21.0773]
  - - [256, 1, 1, 483, 256, 256, 256, 483]
    - [10, 32.01]
  - - [256, 1280, 1, 11520, 256, 256, 256, 11520]
    - [27, 31503.3]
  - - [256, 1280, 1, 17280, 256, 256, 256, 17280]
    - [27, 32443.7]
  - - [256, 1280, 1, 23040, 256, 256, 256, 23040]
    - [27, 32820.6]
  - - [256, 1280, 1, 5760, 256, 256, 256, 5760]
    - [27, 29053.6]
  - - [256, 640, 1, 5760, 256, 256, 256, 5760]
    - [28, 26836.0]
  - - [2560, 8192, 1, 320, 2560, 2560, 2560, 320]
    - [26, 38146.6]
  - - [27225, 96, 1, 27, 27225, 27225, 27225, 27]
    - [18, 5974.83]
  - - [289, 192, 1, 1120, 289, 289, 289, 1120]
    - [10, 8134.93]
  - - [289, 192, 1, 1344, 289, 289, 289, 1344]
    - [10, 8584.86]
  - - [289, 192, 1, 896, 289, 289, 289, 896]
    - [10, 7435.28]
  - - [289, 256, 1, 1568, 289, 289, 289, 1568]
    - [25, 10221.3]
  - - [289, 256, 1, 2016, 289, 289, 289, 2016]
    - [25, 11757.3]
  - - [289, 384, 1, 2592, 289, 289, 289, 2592]
    - [25, 15653.3]
  - - [289, 384, 1, 3456, 289, 289, 289, 3456]
    - [25, 17692.3]
  - - [289, 96, 1, 864, 289, 289, 289, 864]
    - [10, 4925.72]
  - - [3072, 1024, 1, 768, 3072, 3072, 3072, 768]
    - [26, 36775.2]
  - - [3072, 12288, 1, 1024, 3072, 3072, 3072, 1024]
    - [26, 43296.5]
  - - [3072, 12288, 1, 768, 3072, 3072, 3072, 768]
    - [26, 42793.2]
  - - [3072, 128, 1, 768, 3072, 3072, 3072, 768]
    - [19, 18968.2]
  - - [3072, 24576, 1, 768, 3072, 3072, 3072, 768]
    - [26, 43251.6]
  - - [3072, 256, 1, 768, 3072, 3072, 3072, 768]
    - [26, 25888.5]
  - - [3072, 3072, 1, 768, 3072, 3072, 3072, 768]
    - [26, 40829.2]
  - - [3072, 384, 1, 1024, 3072, 3072, 3072, 1024]
    - [23, 28296.3]
  - - [3072, 384, 1, 768, 3072, 3072, 3072, 768]
    - [23, 28845.6]
  - - [3072, 6144, 1, 1024, 3072, 3072, 3072, 1024]
    - [26, 42463.2]
  - - [3072, 6144, 1, 768, 3072, 3072, 3072, 768]
    - [26, 41804.2]
  - - [3136, 2048, 1, 1024, 3136, 3136, 3136, 1024]
    - [26, 38731.0]
  - - [3136, 256, 1, 1152, 3136, 3136, 3136, 1152]
    - [27, 25151.1]
  - - [3136, 256, 1, 2304, 3136, 3136, 3136, 2304]
    - [26, 29122.1]
  - - [3136, 32, 1, 1152, 3136, 3136, 3136, 1152]
    - [12, 10739.3]
  - - [3136, 64, 1, 576, 3136, 3136, 3136, 576]
    - [19, 11543.0]
  - - [320, 8192, 1, 1280, 320, 320, 320, 1280]
    - [26, 32390.0]
  - - [320, 8192, 1, 320, 320, 320, 320, 320]
    - [23, 28224.4]
  - - [32400, 16, 1, 144, 32400, 32400, 32400, 144]
    - [9, 8952.9]
  - - [33278, 35, 1, 200, 33278, 33278, 33278, 200]
    - [19, 13098.3]
  - - [3840, 128, 1, 1280, 3840, 3840, 3840, 1280]
    - [19, 25884.7]
  - - [3840, 512, 1, 1280, 3840, 3840, 3840, 1280]
    - [26, 35268.9]
  - - [4096, 12288, 1, 1024, 4096, 4096, 4096, 1024]
    - [26, 43044.3]
  - - [4096, 320, 1, 2880, 4096, 4096, 4096, 2880]
    - [27, 30536.7]
  - - [4096, 320, 1, 36, 4096, 4096, 4096, 36]
    - [8, 5942.34]
  - - [4096, 320, 1, 5760, 4096, 4096, 4096, 5760]
    - [28, 32820.9]
  - - [4096, 320, 1, 8640, 4096, 4096, 4096, 8640]
    - [27, 32839.7]
  - - [4096, 384, 1, 1024, 4096, 4096, 4096, 1024]
    - [23, 29198.9]
  - - [4096, 4, 1, 2880, 4096, 4096, 4096, 2880]
    - [7, 3008.98]
  - - [4096, 6144, 1, 1024, 4096, 4096, 4096, 1024]
    - [26, 42489.5]
  - - [4096, 640, 1, 5760, 4096, 4096, 4096, 5760]
    - [26, 37516.6]
  - - [49, 2048, 1, 1024, 49, 49, 49, 1024]
    - [23, 8659.83]
  - - [49, 2304, 1, 1552, 49, 49, 49, 1552]
    - [23, 10681.8]
  - - [49, 256, 1, 2304, 49, 49, 49, 2304]
    - [34, 3499.47]
  - - [49, 32, 1, 1152, 49, 49, 49, 1152]
    - [4, 333.72]
  - - [49, 512, 1, 4608, 49, 49, 49, 4608]
    - [25, 7435.24]
  - - [50176, 512, 1, 256, 50176, 50176, 50176, 256]
    - [26, 32084.2]
  - - [50176, 64, 1, 27, 50176, 50176, 50176, 27]
    - [9, 6239.36]
  - - [50176, 64, 1, 576, 50176, 50176, 50176, 576]
    - [26, 23890.5]
  - - [5041, 192, 1, 720, 5041, 5041, 5041, 720]
    - [26, 29986.1]
  - - [5041, 96, 1, 576, 5041, 5041, 5041, 576]
    - [26, 23402.0]
  - - [5120, 2048, 1, 640, 5120, 5120, 5120, 640]
    - [26, 39194.4]
  - - [518400, 16, 1, 144, 518400, 518400, 518400, 144]
    - [9, 6414.83]
  - - [5329, 96, 1, 576, 5329, 5329, 5329, 576]
    - [26, 24843.6]
  - - [6, 1, 1, 256, 6, 6, 6, 256]
    - [2, 0.485146]
  - - [600, 1, 1, 200, 600, 600, 600, 200]
    - [10, 38.5752]
  - - [64, 1280, 1, 11520, 64, 64, 64, 11520]
    - [25, 23182.6]
  - - [64, 1280, 1, 23040, 64, 64, 64, 23040]
    - [25, 25355.5]
  - - [64, 192, 1, 1728, 64, 64, 64, 1728]
    - [32, 3234.83]
  - - [64, 256, 1, 1152, 64, 64, 64, 1152]
    - [30, 3585.05]
  - - [64, 256, 1, 1536, 64, 64, 64, 1536]
    - [30, 4032.2]
  - - [64, 320, 1, 1728, 64, 64, 64, 1728]
    - [30, 5254.94]
  - - [64, 320, 1, 2880, 64, 64, 64, 2880]
    - [34, 6638.15]
  - - [64, 384, 1, 1152, 64, 64, 64, 1152]
    - [30, 5353.02]
  - - [64, 384, 1, 4032, 64, 64, 64, 4032]
    - [13, 8290.49]
  - - [640, 2048, 1, 2560, 640, 640, 640, 2560]
    - [27, 31485.3]
  - - [640, 2048, 1, 640, 640, 640, 640, 640]
    - [23, 27572.1]
  - - [768, 1024, 1, 3072, 768, 768, 768, 3072]
    - [26, 37097.8]
  - - [768, 1024, 1, 768, 768, 768, 768, 768]
    - [26, 31985.1]
  - - [768, 12288, 1, 3072, 768, 768, 768, 3072]
    - [26, 42791.1]
  - - [768, 12288, 1, 768, 768, 768, 768, 768]
    - [26, 41119.1]
  - - [768, 128, 1, 2, 768, 768, 768, 2]
    - [22, 69.5279]
  - - [768, 128, 1, 3072, 768, 768, 768, 3072]
    - [20, 16406.9]
  - - [768, 128, 1, 768, 768, 768, 768, 768]
    - [12, 9499.17]
  - - [768, 24576, 1, 3072, 768, 768, 768, 3072]
    - [26, 43753.4]
  - - [768, 24576, 1, 768, 768, 768, 768, 768]
    - [26, 41861.6]
  - - [768, 256, 1, 2, 768, 768, 768, 2]
    - [9, 125.144]
  - - [768, 256, 1, 3072, 768, 768, 768, 3072]
    - [28, 22988.1]
  - - [768, 256, 1, 768, 768, 768, 768, 768]
    - [27, 12902.3]
  - - [768, 3072, 1, 3072, 768, 768, 768, 3072]
    - [26, 38606.6]
  - - [768, 3072, 1, 768, 768, 768, 768, 768]
    - [26, 34621.3]
  - - [768, 32, 1, 768, 768, 768, 768, 768]
    - [30, 4352.44]
  - - [768, 384, 1, 3072, 768, 768, 768, 3072]
    - [28, 25918.2]
  - - [768, 384, 1, 768, 768, 768, 768, 768]
    - [23, 19174.2]
  - - [768, 6144, 1, 3072, 768, 768, 768, 3072]
    - [26, 40843.1]
  - - [768, 6144, 1, 768, 768, 768, 768, 768]
    - [26, 38622.3]
  - - [768, 64, 1, 768, 768, 768, 768, 768]
    - [10, 6477.03]
  - - [768, 8, 1, 768, 768, 768, 768, 768]
    - [30, 1061.69]
  - - [784, 128, 1, 1152, 784, 784, 784, 1152]
    - [20, 10913.2]
  - - [784, 32, 1, 1152, 784, 784, 784, 1152]
    - [30, 5279.03]
  - - [784, 512, 1, 2304, 784, 784, 784, 2304]
    - [26, 24708.0]
  - - [784, 512, 1, 256, 784, 784, 784, 256]
    - [26, 14265.1]
  - - [784, 512, 1, 4608, 784, 784, 784, 4608]
    - [27, 27414.1]
  - - [784, 576, 1, 336, 784, 784, 784, 336]
    - [26, 17765.2]
  - - [784, 64, 1, 576, 784, 784, 784, 576]
    - [10, 5620.71]
  - - [800, 1, 1, 200, 800, 800, 800, 200]
    - [10, 50.5744]
  - - [960, 8192, 1, 320, 960, 960, 960, 320]
    - [26, 35717.4]
  - - [64, 1, 1, 1, 64, 64, 64, 1]
    - [21, 0.0243371]
  - - [121, 1, 1, 25, 121, 121, 121, 25]
    - [1, 1.12186]
  - - [121, 1, 1, 49, 121, 121, 121, 49]
    - [0, 2.08681]
  - - [121, 1, 1, 9, 121, 121, 121, 9]
    - [1, 0.411814]
  - - [121, 1344, 1, 2688, 121, 121, 121, 2688]
    - [20, 19013.9]
  - - [121, 1344, 1, 4032, 121, 121, 121, 4032]
    - [20, 21756.8]
  - - [121, 336, 1, 2016, 121, 121, 121, 2016]
    - [20, 7954.75]
  - - [121, 672, 1, 1344, 121, 121, 121, 1344]
    - [33, 10708.0]
  - - [121, 672, 1, 4032, 121, 121, 121, 4032]
    - [25, 17539.2]
  - - [1225, 32, 1, 192, 1225, 1225, 1225, 192]
    - [10, 2124.47]
  - - [1225, 64, 1, 256, 1225, 1225, 1225, 256]
    - [14, 4693.62]
  - - [1225, 64, 1, 288, 1225, 1225, 1225, 288]
    - [14, 4994.46]
  - - [1225, 96, 1, 384, 1225, 1225, 1225, 384]
    - [12, 8119.38]
  - - [12544, 1, 1, 9, 12544, 12544, 12544, 9]
    - [5, 33.5768]
  - - [129600, 16, 1, 16, 129600, 129600, 129600, 16]
    - [9, 3536.32]
  - - [1764, 1, 1, 25, 1764, 1764, 1764, 25]
    - [0, 16.4992]
  - - [1764, 1, 1, 49, 1764, 1764, 1764, 49]
    - [0, 30.7694]
  - - [1764, 1, 1, 9, 1764, 1764, 1764, 9]
    - [0, 6.12789]
  - - [1764, 168, 1, 1008, 1764, 1764, 1764, 1008]
    - [23, 19104.1]
  - - [1764, 168, 1, 336, 1764, 1764, 1764, 336]
    - [23, 13030.4]
  - - [1764, 336, 1, 1008, 1764, 1764, 1764, 1008]
    - [26, 24678.0]
  - - [1764, 336, 1, 336, 1764, 1764, 1764, 336]
    - [26, 17771.3]
  - - [1764, 84, 1, 168, 1764, 1764, 1764, 168]
    - [14, 5102.71]
  - - [196, 1, 1, 9, 196, 196, 196, 9]
    - [21, 0.687801]
  - - [196, 1024, 1, 256, 196, 196, 196, 256]
    - [23, 7806.48]
  - - [196, 1048, 1, 384, 196, 196, 196, 384]
    - [23, 9832.2]
  - - [196, 12, 1, 108, 196, 196, 196, 108]
    - [0, 85.6011]
  - - [196, 16, 1, 144, 196, 196, 196, 144]
    - [0, 148.349]
  - - [196, 512, 1, 1024, 196, 196, 196, 1024]
    - [20, 9845.23]
  - - [2073600, 16, 1, 16, 2073600, 2073600, 2073600, 16]
    - [9, 3680.82]
  - - [289, 128, 1, 1024, 289, 289, 289, 1024]
    - [10, 5242.15]
  - - [289, 192, 1, 768, 289, 289, 289, 768]
    - [10, 6982.71]
  - - [3136, 1, 1, 9, 3136, 3136, 3136, 9]
    - [0, 10.1926]
  - - [3136, 128, 1, 256, 3136, 3136, 3136, 256]
    - [19, 13460.2]
  - - [3136, 256, 1, 64, 3136, 3136, 3136, 64]
    - [12, 9109.59]
  - - [3136, 272, 1, 96, 3136, 3136, 3136, 96]
    - [26, 11858.7]
  - - [3136, 288, 1, 64, 3136, 3136, 3136, 64]
    - [18, 10750.9]
  - - [3136, 3, 1, 27, 3136, 3136, 3136, 27]
    - [0, 88.1525]
  - - [3136, 4, 1, 36, 3136, 3136, 3136, 36]
    - [0, 153.541]
  - - [384, 384, 1, 64, 384, 384, 384, 64]
    - [18, 3027.17]
  - - [441, 1, 1, 25, 441, 441, 441, 25]
    - [1, 4.1471]
  - - [441, 1, 1, 49, 441, 441, 441, 49]
    - [0, 7.64993]
  - - [441, 1, 1, 9, 441, 441, 441, 9]
    - [0, 1.50566]
  - - [441, 168, 1, 1008, 441, 441, 441, 1008]
    - [14, 8663.39]
  - - [441, 336, 1, 2016, 441, 441, 441, 2016]
    - [28, 16176.7]
  - - [441, 336, 1, 672, 441, 441, 441, 672]
    - [23, 11105.0]
  - - [441, 672, 1, 1344, 441, 441, 441, 1344]
    - [23, 20981.2]
  - - [441, 672, 1, 2016, 441, 441, 441, 2016]
    - [23, 22358.1]
  - - [49, 1, 1, 9, 49, 49, 49, 9]
    - [1, 0.169106]
  - - [49, 2048, 1, 2048, 49, 49, 49, 2048]
    - [25, 11661.4]
  - - [49, 2048, 1, 512, 49, 49, 49, 512]
    - [33, 6708.5]
  - - [49, 2176, 1, 768, 49, 49, 49, 768]
    - [23, 8380.56]
  - - [49, 24, 1, 216, 49, 49, 49, 216]
    - [2, 76.1756]
  - - [49, 32, 1, 288, 49, 49, 49, 288]
    - [2, 137.79]
  - - [518400, 16, 1, 16, 518400, 518400, 518400, 16]
    - [8, 4855.07]
  - - [64, 1024, 1, 1024, 64, 64, 64, 1024]
    - [33, 8285.01]
  - - [64, 1024, 1, 64, 64, 64, 64, 64]
    - [30, 1456.45]
  - - [64, 128, 1, 128, 64, 64, 64, 128]
    - [30, 395.115]
  - - [64, 1280, 1, 2560, 64, 64, 64, 2560]
    - [25, 15835.8]
  - - [64, 192, 1, 1280, 64, 64, 64, 1280]
    - [30, 2823.53]
  - - [64, 192, 1, 2048, 64, 64, 64, 2048]
    - [32, 3665.02]
  - - [64, 256, 1, 256, 64, 64, 64, 256]
    - [30, 1405.84]
  - - [64, 256, 1, 64, 64, 64, 64, 64]
    - [3, 417.259]
  - - [64, 320, 1, 1280, 64, 64, 64, 1280]
    - [30, 4683.82]
  - - [64, 320, 1, 2048, 64, 64, 64, 2048]
    - [30, 5563.28]
  - - [64, 384, 1, 384, 64, 64, 64, 384]
    - [30, 2852.01]
  - - [64, 4096, 1, 4096, 64, 64, 64, 4096]
    - [24, 25841.8]
  - - [64, 4096, 1, 64, 64, 64, 64, 64]
    - [12, 4562.04]
  - - [64, 64, 1, 64, 64, 64, 64, 64]
    - [30, 104.703]
  - - [6889, 1, 1, 25, 6889, 6889, 6889, 25]
    - [6, 53.1594]
  - - [6889, 1, 1, 49, 6889, 6889, 6889, 49]
    - [6, 98.8102]
  - - [6889, 1, 1, 9, 6889, 6889, 6889, 9]
    - [6, 20.146]
  - - [6889, 42, 1, 96, 6889, 6889, 6889, 96]
    - [19, 5820.35]
  - - [784, 1, 1, 9, 784, 784, 784, 9]
    - [1, 2.75079]
  - - [784, 256, 1, 512, 784, 784, 784, 512]
    - [26, 11151.2]
  - - [784, 512, 1, 128, 784, 784, 784, 128]
    - [26, 9353.64]
  - - [784, 544, 1, 192, 784, 784, 784, 192]
    - [26, 12907.0]
  - - [784, 6, 1, 54, 784, 784, 784, 54]
    - [0, 89.1801]
  - - [784, 8, 1, 72, 784, 784, 784, 72]
    - [3, 156.697]
- null
- null
- DeviceEfficiency
- Equality
