library/src/amd_detail/rocblaslt/src/Tensile/Logic/asm_full/navi32/Equality/navi32_Cijk_Alik_Bjlk_SB_Bias_HAS_SAV_UserArgs.yaml
- {MinimumRequiredVersion: 4.33.0}
- navi32
- gfx1101
- [Device 73f0]
    SolutionIndex: 0
    SolutionNameMin: Cijk_Alik_Bjlk_SB_Bias_HAS_SAV_UserArgs_MT8x8x8_SN_GSU1_SU32_SUM0_SUS256_TT1_1_WGM1
    SolutionIndex: 1
    SolutionNameMin: Cijk_Alik_Bjlk_SB_Bias_HAS_SAV_UserArgs_MT16x16x8_SN_GSU1_SU32_SUM0_SUS256_TT2_2_WGM1
    SolutionIndex: 2
    SolutionNameMin: Cijk_Alik_Bjlk_SB_Bias_HAS_SAV_UserArgs_MT8x8x16_SN_GSU1_SU32_SUM0_SUS256_TT1_1_WGM1
    SolutionIndex: 3
    SolutionNameMin: Cijk_Alik_Bjlk_SB_Bias_HAS_SAV_UserArgs_MT16x16x16_SN_GSU1_SU32_SUM0_SUS256_TT2_2_WGM1
- - - [64, 64, 1, 32, 64, 64, 32, 64]
    - [3, 0.419549]
  - - [128, 64, 1, 32, 128, 128, 32, 64]
    - [2, 0.812654]
  - - [192, 64, 1, 32, 192, 192, 32, 64]
    - [1, 1.28648]
  - - [256, 64, 1, 32, 256, 256, 32, 64]
    - [2, 1.6926]
  - - [320, 64, 1, 32, 320, 320, 32, 64]
    - [3, 2.33951]
  - - [384, 64, 1, 32, 384, 384, 32, 64]
    - [3, 80.5771]
  - - [448, 64, 1, 32, 448, 448, 32, 64]
    - [3, 7.01477]
  - - [512, 64, 1, 32, 512, 512, 32, 64]
    - [3, 7.98879]
  - - [576, 64, 1, 32, 576, 576, 32, 64]
    - [3, 6.51824]
  - - [640, 64, 1, 32, 640, 640, 32, 64]
    - [3, 9.81622]
  - - [704, 64, 1, 32, 704, 704, 32, 64]
    - [3, 10.9094]
  - - [768, 64, 1, 32, 768, 768, 32, 64]
    - [2, 21.115]
  - - [832, 64, 1, 32, 832, 832, 32, 64]
    - [2, 179.74]
  - - [896, 64, 1, 32, 896, 896, 32, 64]
    - [2, 202.093]
  - - [960, 64, 1, 32, 960, 960, 32, 64]
    - [2, 207.392]
  - - [1024, 64, 1, 32, 1024, 1024, 32, 64]
    - [1, 78.1062]
  - - [64, 128, 1, 32, 64, 64, 32, 128]
    - [2, 3.52745]
  - - [128, 128, 1, 32, 128, 128, 32, 128]
    - [2, 6.95568]
  - - [192, 128, 1, 32, 192, 192, 32, 128]
    - [2, 10.2673]
  - - [256, 128, 1, 32, 256, 256, 32, 128]
    - [2, 13.9095]
  - - [320, 128, 1, 32, 320, 320, 32, 128]
    - [1, 17.7399]
  - - [384, 128, 1, 32, 384, 384, 32, 128]
    - [1, 160.169]
  - - [448, 128, 1, 32, 448, 448, 32, 128]
    - [2, 193.159]
  - - [512, 128, 1, 32, 512, 512, 32, 128]
    - [3, 80.0745]
  - - [576, 128, 1, 32, 576, 576, 32, 128]
    - [3, 80.6873]
  - - [640, 128, 1, 32, 640, 640, 32, 128]
    - [1, 110.121]
  - - [704, 128, 1, 32, 704, 704, 32, 128]
    - [1, 112.616]
  - - [768, 128, 1, 32, 768, 768, 32, 128]
    - [1, 121.901]
  - - [832, 128, 1, 32, 832, 832, 32, 128]
    - [3, 136.016]
  - - [896, 128, 1, 32, 896, 896, 32, 128]
    - [3, 144.685]
  - - [960, 128, 1, 32, 960, 960, 32, 128]
    - [2, 145.232]
  - - [1024, 128, 1, 32, 1024, 1024, 32, 128]
    - [1, 155.287]
  - - [64, 192, 1, 32, 64, 64, 32, 192]
    - [2, 5.40574]
  - - [128, 192, 1, 32, 128, 128, 32, 192]
    - [1, 10.9393]
  - - [192, 192, 1, 32, 192, 192, 32, 192]
    - [2, 15.8223]
  - - [256, 192, 1, 32, 256, 256, 32, 192]
    - [2, 21.1121]
  - - [320, 192, 1, 32, 320, 320, 32, 192]
    - [2, 78.7219]
  - - [384, 192, 1, 32, 384, 384, 32, 192]
    - [1, 68.9641]
  - - [448, 192, 1, 32, 448, 448, 32, 192]
    - [0, 108.026]
  - - [512, 192, 1, 32, 512, 512, 32, 192]
    - [1, 115.017]
  - - [576, 192, 1, 32, 576, 576, 32, 192]
    - [2, 148.38]
  - - [640, 192, 1, 32, 640, 640, 32, 192]
    - [0, 258.355]
  - - [704, 192, 1, 32, 704, 704, 32, 192]
    - [1, 208.799]
  - - [768, 192, 1, 32, 768, 768, 32, 192]
    - [2, 227.951]
  - - [832, 192, 1, 32, 832, 832, 32, 192]
    - [0, 191.382]
  - - [896, 192, 1, 32, 896, 896, 32, 192]
    - [3, 173.469]
  - - [960, 192, 1, 32, 960, 960, 32, 192]
    - [3, 187.929]
  - - [1024, 192, 1, 32, 1024, 1024, 32, 192]
    - [3, 201.391]
  - - [64, 256, 1, 32, 64, 64, 32, 256]
    - [0, 6.83731]
  - - [128, 256, 1, 32, 128, 128, 32, 256]
    - [2, 20.3627]
  - - [192, 256, 1, 32, 192, 192, 32, 256]
    - [0, 172.463]
  - - [256, 256, 1, 32, 256, 256, 32, 256]
    - [3, 65.4133]
  - - [320, 256, 1, 32, 320, 320, 32, 256]
    - [1, 92.7943]
  - - [384, 256, 1, 32, 384, 384, 32, 256]
    - [2, 25.6572]
  - - [448, 256, 1, 32, 448, 448, 32, 256]
    - [2, 30.3719]
  - - [512, 256, 1, 32, 512, 512, 32, 256]
    - [1, 34.9175]
  - - [576, 256, 1, 32, 576, 576, 32, 256]
    - [2, 39.1518]
  - - [640, 256, 1, 32, 640, 640, 32, 256]
    - [3, 42.7167]
  - - [704, 256, 1, 32, 704, 704, 32, 256]
    - [3, 45.19]
  - - [768, 256, 1, 32, 768, 768, 32, 256]
    - [3, 53.3737]
  - - [832, 256, 1, 32, 832, 832, 32, 256]
    - [3, 57.1644]
  - - [896, 256, 1, 32, 896, 896, 32, 256]
    - [1, 59.8134]
  - - [960, 256, 1, 32, 960, 960, 32, 256]
    - [3, 63.529]
  - - [1024, 256, 1, 32, 1024, 1024, 32, 256]
    - [3, 75.9109]
  - - [64, 320, 1, 32, 64, 64, 32, 320]
    - [2, 4.16363]
  - - [128, 320, 1, 32, 128, 128, 32, 320]
    - [3, 8.56618]
  - - [192, 320, 1, 32, 192, 192, 32, 320]
    - [1, 19.0474]
  - - [256, 320, 1, 32, 256, 256, 32, 320]
    - [3, 23.918]
  - - [320, 320, 1, 32, 320, 320, 32, 320]
    - [2, 28.1933]
  - - [384, 320, 1, 32, 384, 384, 32, 320]
    - [2, 34.6826]
  - - [448, 320, 1, 32, 448, 448, 32, 320]
    - [2, 38.4179]
  - - [512, 320, 1, 32, 512, 512, 32, 320]
    - [2, 41.8256]
  - - [576, 320, 1, 32, 576, 576, 32, 320]
    - [3, 47.3827]
  - - [640, 320, 1, 32, 640, 640, 32, 320]
    - [3, 52.2029]
  - - [704, 320, 1, 32, 704, 704, 32, 320]
    - [1, 61.6145]
  - - [768, 320, 1, 32, 768, 768, 32, 320]
    - [2, 63.2966]
  - - [832, 320, 1, 32, 832, 832, 32, 320]
    - [3, 67.3171]
  - - [896, 320, 1, 32, 896, 896, 32, 320]
    - [3, 77.8532]
  - - [960, 320, 1, 32, 960, 960, 32, 320]
    - [3, 82.1696]
  - - [1024, 320, 1, 32, 1024, 1024, 32, 320]
    - [3, 89.2625]
  - - [64, 384, 1, 32, 64, 64, 32, 384]
    - [3, 4.90475]
  - - [128, 384, 1, 32, 128, 128, 32, 384]
    - [0, 18.2783]
  - - [192, 384, 1, 32, 192, 192, 32, 384]
    - [2, 19.1446]
  - - [256, 384, 1, 32, 256, 256, 32, 384]
    - [3, 26.8645]
  - - [320, 384, 1, 32, 320, 320, 32, 384]
    - [1, 34.065]
  - - [384, 384, 1, 32, 384, 384, 32, 384]
    - [2, 41.471]
  - - [448, 384, 1, 32, 448, 448, 32, 384]
    - [2, 44.2382]
  - - [512, 384, 1, 32, 512, 512, 32, 384]
    - [3, 50.5783]
  - - [576, 384, 1, 32, 576, 576, 32, 384]
    - [1, 57.3966]
  - - [640, 384, 1, 32, 640, 640, 32, 384]
    - [3, 62.1361]
  - - [704, 384, 1, 32, 704, 704, 32, 384]
    - [3, 71.3223]
  - - [768, 384, 1, 32, 768, 768, 32, 384]
    - [1, 70.4289]
  - - [832, 384, 1, 32, 832, 832, 32, 384]
    - [3, 86.0965]
  - - [896, 384, 1, 32, 896, 896, 32, 384]
    - [2, 89.5993]
  - - [960, 384, 1, 32, 960, 960, 32, 384]
    - [3, 100.459]
  - - [1024, 384, 1, 32, 1024, 1024, 32, 384]
    - [2, 100.434]
  - - [64, 448, 1, 32, 64, 64, 32, 448]
    - [3, 5.80034]
  - - [128, 448, 1, 32, 128, 128, 32, 448]
    - [3, 18.9565]
  - - [192, 448, 1, 32, 192, 192, 32, 448]
    - [2, 23.5537]
  - - [256, 448, 1, 32, 256, 256, 32, 448]
    - [3, 32.6904]
  - - [320, 448, 1, 32, 320, 320, 32, 448]
    - [3, 39.9104]
  - - [384, 448, 1, 32, 384, 384, 32, 448]
    - [3, 44.3023]
  - - [448, 448, 1, 32, 448, 448, 32, 448]
    - [3, 49.1128]
  - - [512, 448, 1, 32, 512, 512, 32, 448]
    - [3, 57.0782]
  - - [576, 448, 1, 32, 576, 576, 32, 448]
    - [3, 68.3568]
  - - [640, 448, 1, 32, 640, 640, 32, 448]
    - [3, 76.3658]
  - - [704, 448, 1, 32, 704, 704, 32, 448]
    - [1, 80.7494]
  - - [768, 448, 1, 32, 768, 768, 32, 448]
    - [3, 94.1464]
  - - [832, 448, 1, 32, 832, 832, 32, 448]
    - [3, 95.4735]
  - - [896, 448, 1, 32, 896, 896, 32, 448]
    - [2, 109.65]
  - - [960, 448, 1, 32, 960, 960, 32, 448]
    - [2, 117.498]
  - - [1024, 448, 1, 32, 1024, 1024, 32, 448]
    - [2, 126.989]
  - - [64, 512, 1, 32, 64, 64, 32, 512]
    - [1, 6.58236]
  - - [128, 512, 1, 32, 128, 128, 32, 512]
    - [2, 52.8183]
  - - [192, 512, 1, 32, 192, 192, 32, 512]
    - [0, 100.023]
  - - [256, 512, 1, 32, 256, 256, 32, 512]
    - [3, 35.9406]
  - - [320, 512, 1, 32, 320, 320, 32, 512]
    - [3, 43.2472]
  - - [384, 512, 1, 32, 384, 384, 32, 512]
    - [3, 50.5356]
  - - [448, 512, 1, 32, 448, 448, 32, 512]
    - [1, 60.1489]
  - - [512, 512, 1, 32, 512, 512, 32, 512]
    - [3, 63.646]
  - - [576, 512, 1, 32, 576, 576, 32, 512]
    - [1, 76.4169]
  - - [640, 512, 1, 32, 640, 640, 32, 512]
    - [3, 83.488]
  - - [704, 512, 1, 32, 704, 704, 32, 512]
    - [2, 93.5651]
  - - [768, 512, 1, 32, 768, 768, 32, 512]
    - [1, 89.1324]
  - - [832, 512, 1, 32, 832, 832, 32, 512]
    - [2, 113.685]
  - - [896, 512, 1, 32, 896, 896, 32, 512]
    - [3, 114.236]
  - - [960, 512, 1, 32, 960, 960, 32, 512]
    - [1, 127.589]
  - - [1024, 512, 1, 32, 1024, 1024, 32, 512]
    - [3, 130.969]
  - - [64, 576, 1, 32, 64, 64, 32, 576]
    - [1, 7.22487]
  - - [128, 576, 1, 32, 128, 128, 32, 576]
    - [3, 19.0888]
  - - [192, 576, 1, 32, 192, 192, 32, 576]
    - [2, 28.1369]
  - - [256, 576, 1, 32, 256, 256, 32, 576]
    - [3, 40.3986]
  - - [320, 576, 1, 32, 320, 320, 32, 576]
    - [3, 49.6899]
  - - [384, 576, 1, 32, 384, 384, 32, 576]
    - [1, 60.2522]
  - - [448, 576, 1, 32, 448, 448, 32, 576]
    - [1, 95.3025]
  - - [512, 576, 1, 32, 512, 512, 32, 576]
    - [3, 77.8414]
  - - [576, 576, 1, 32, 576, 576, 32, 576]
    - [3, 83.2265]
  - - [640, 576, 1, 32, 640, 640, 32, 576]
    - [1, 77.7998]
  - - [704, 576, 1, 32, 704, 704, 32, 576]
    - [0, 66.2059]
  - - [768, 576, 1, 32, 768, 768, 32, 576]
    - [1, 57.2061]
  - - [832, 576, 1, 32, 832, 832, 32, 576]
    - [3, 54.0414]
  - - [896, 576, 1, 32, 896, 896, 32, 576]
    - [3, 91.4729]
  - - [960, 576, 1, 32, 960, 960, 32, 576]
    - [3, 149.631]
  - - [1024, 576, 1, 32, 1024, 1024, 32, 576]
    - [2, 163.243]
  - - [64, 640, 1, 32, 64, 64, 32, 640]
    - [0, 7.02116]
  - - [128, 640, 1, 32, 128, 128, 32, 640]
    - [1, 12.3286]
  - - [192, 640, 1, 32, 192, 192, 32, 640]
    - [1, 15.2052]
  - - [256, 640, 1, 32, 256, 256, 32, 640]
    - [2, 16.3037]
  - - [320, 640, 1, 32, 320, 320, 32, 640]
    - [0, 30.9152]
  - - [384, 640, 1, 32, 384, 384, 32, 640]
    - [1, 31.7209]
  - - [448, 640, 1, 32, 448, 448, 32, 640]
    - [2, 30.4407]
  - - [512, 640, 1, 32, 512, 512, 32, 640]
    - [2, 33.3228]
  - - [576, 640, 1, 32, 576, 576, 32, 640]
    - [2, 47.2594]
  - - [640, 640, 1, 32, 640, 640, 32, 640]
    - [2, 53.9509]
  - - [704, 640, 1, 32, 704, 704, 32, 640]
    - [1, 28.5083]
  - - [768, 640, 1, 32, 768, 768, 32, 640]
    - [3, 56.973]
  - - [832, 640, 1, 32, 832, 832, 32, 640]
    - [2, 84.6252]
  - - [896, 640, 1, 32, 896, 896, 32, 640]
    - [3, 80.9418]
  - - [960, 640, 1, 32, 960, 960, 32, 640]
    - [3, 90.108]
  - - [1024, 640, 1, 32, 1024, 1024, 32, 640]
    - [1, 60.8209]
  - - [64, 704, 1, 32, 64, 64, 32, 704]
    - [3, 3.09827]
  - - [128, 704, 1, 32, 128, 128, 32, 704]
    - [2, 10.1627]
  - - [192, 704, 1, 32, 192, 192, 32, 704]
    - [2, 10.6462]
  - - [256, 704, 1, 32, 256, 256, 32, 704]
    - [0, 12.247]
  - - [320, 704, 1, 32, 320, 320, 32, 704]
    - [3, 15.1602]
  - - [384, 704, 1, 32, 384, 384, 32, 704]
    - [3, 83.2435]
  - - [448, 704, 1, 32, 448, 448, 32, 704]
    - [3, 32.9706]
  - - [512, 704, 1, 32, 512, 512, 32, 704]
    - [3, 35.3264]
  - - [576, 704, 1, 32, 576, 576, 32, 704]
    - [3, 41.7095]
  - - [640, 704, 1, 32, 640, 640, 32, 704]
    - [1, 45.1058]
  - - [704, 704, 1, 32, 704, 704, 32, 704]
    - [2, 71.2038]
  - - [768, 704, 1, 32, 768, 768, 32, 704]
    - [1, 60.4563]
  - - [832, 704, 1, 32, 832, 832, 32, 704]
    - [1, 65.3801]
  - - [896, 704, 1, 32, 896, 896, 32, 704]
    - [0, 50.0799]
  - - [960, 704, 1, 32, 960, 960, 32, 704]
    - [1, 51.4322]
  - - [1024, 704, 1, 32, 1024, 1024, 32, 704]
    - [0, 47.4212]
  - - [64, 768, 1, 32, 64, 64, 32, 768]
    - [3, 3.87665]
  - - [128, 768, 1, 32, 128, 128, 32, 768]
    - [2, 14.1874]
  - - [192, 768, 1, 32, 192, 192, 32, 768]
    - [2, 10.2087]
  - - [256, 768, 1, 32, 256, 256, 32, 768]
    - [2, 14.3399]
  - - [320, 768, 1, 32, 320, 320, 32, 768]
    - [3, 19.4383]
  - - [384, 768, 1, 32, 384, 384, 32, 768]
    - [1, 27.2694]
  - - [448, 768, 1, 32, 448, 448, 32, 768]
    - [3, 31.9236]
  - - [512, 768, 1, 32, 512, 512, 32, 768]
    - [2, 29.8716]
  - - [576, 768, 1, 32, 576, 576, 32, 768]
    - [2, 27.2387]
  - - [640, 768, 1, 32, 640, 640, 32, 768]
    - [3, 34.763]
  - - [704, 768, 1, 32, 704, 704, 32, 768]
    - [3, 41.8479]
  - - [768, 768, 1, 32, 768, 768, 32, 768]
    - [1, 39.3767]
  - - [832, 768, 1, 32, 832, 832, 32, 768]
    - [2, 44.7073]
  - - [896, 768, 1, 32, 896, 896, 32, 768]
    - [3, 57.5836]
  - - [960, 768, 1, 32, 960, 960, 32, 768]
    - [0, 58.2322]
  - - [1024, 768, 1, 32, 1024, 1024, 32, 768]
    - [3, 61.9477]
  - - [64, 832, 1, 32, 64, 64, 32, 832]
    - [2, 4.54059]
  - - [128, 832, 1, 32, 128, 128, 32, 832]
    - [3, 8.35574]
  - - [192, 832, 1, 32, 192, 192, 32, 832]
    - [3, 45.7471]
  - - [256, 832, 1, 32, 256, 256, 32, 832]
    - [2, 23.238]
  - - [320, 832, 1, 32, 320, 320, 32, 832]
    - [1, 29.6556]
  - - [384, 832, 1, 32, 384, 384, 32, 832]
    - [3, 34.5565]
  - - [448, 832, 1, 32, 448, 448, 32, 832]
    - [2, 24.5499]
  - - [512, 832, 1, 32, 512, 512, 32, 832]
    - [2, 33.5084]
  - - [576, 832, 1, 32, 576, 576, 32, 832]
    - [3, 29.1835]
  - - [640, 832, 1, 32, 640, 640, 32, 832]
    - [3, 37.8246]
  - - [704, 832, 1, 32, 704, 704, 32, 832]
    - [2, 49.1534]
  - - [768, 832, 1, 32, 768, 768, 32, 832]
    - [3, 46.7688]
  - - [832, 832, 1, 32, 832, 832, 32, 832]
    - [3, 67.0502]
  - - [896, 832, 1, 32, 896, 896, 32, 832]
    - [3, 66.3098]
  - - [960, 832, 1, 32, 960, 960, 32, 832]
    - [1, 68.2097]
  - - [1024, 832, 1, 32, 1024, 1024, 32, 832]
    - [0, 72.9127]
  - - [64, 896, 1, 32, 64, 64, 32, 896]
    - [1, 5.89556]
  - - [128, 896, 1, 32, 128, 128, 32, 896]
    - [3, 9.73279]
  - - [192, 896, 1, 32, 192, 192, 32, 896]
    - [2, 16.2021]
  - - [256, 896, 1, 32, 256, 256, 32, 896]
    - [3, 20.2159]
  - - [320, 896, 1, 32, 320, 320, 32, 896]
    - [0, 22.6408]
  - - [384, 896, 1, 32, 384, 384, 32, 896]
    - [3, 38.6763]
  - - [448, 896, 1, 32, 448, 448, 32, 896]
    - [3, 42.576]
  - - [512, 896, 1, 32, 512, 512, 32, 896]
    - [2, 74.6691]
  - - [576, 896, 1, 32, 576, 576, 32, 896]
    - [3, 57.2571]
  - - [640, 896, 1, 32, 640, 640, 32, 896]
    - [3, 63.5551]
  - - [704, 896, 1, 32, 704, 704, 32, 896]
    - [1, 66.6941]
  - - [768, 896, 1, 32, 768, 768, 32, 896]
    - [1, 70.0235]
  - - [832, 896, 1, 32, 832, 832, 32, 896]
    - [1, 215.715]
  - - [896, 896, 1, 32, 896, 896, 32, 896]
    - [3, 65.4821]
  - - [960, 896, 1, 32, 960, 960, 32, 896]
    - [3, 74.6023]
  - - [1024, 896, 1, 32, 1024, 1024, 32, 896]
    - [2, 89.1748]
  - - [64, 960, 1, 32, 64, 64, 32, 960]
    - [2, 4.11664]
  - - [128, 960, 1, 32, 128, 128, 32, 960]
    - [2, 8.2959]
  - - [192, 960, 1, 32, 192, 192, 32, 960]
    - [2, 14.0256]
  - - [256, 960, 1, 32, 256, 256, 32, 960]
    - [1, 20.8538]
  - - [320, 960, 1, 32, 320, 320, 32, 960]
    - [3, 19.3216]
  - - [384, 960, 1, 32, 384, 384, 32, 960]
    - [1, 50.3764]
  - - [448, 960, 1, 32, 448, 448, 32, 960]
    - [0, 25.7043]
  - - [512, 960, 1, 32, 512, 512, 32, 960]
    - [3, 38.3123]
  - - [576, 960, 1, 32, 576, 576, 32, 960]
    - [2, 49.4151]
  - - [640, 960, 1, 32, 640, 640, 32, 960]
    - [1, 68.2863]
  - - [704, 960, 1, 32, 704, 704, 32, 960]
    - [1, 74.8472]
  - - [768, 960, 1, 32, 768, 768, 32, 960]
    - [3, 81.5385]
  - - [832, 960, 1, 32, 832, 832, 32, 960]
    - [3, 84.3638]
  - - [896, 960, 1, 32, 896, 896, 32, 960]
    - [0, 90.99]
  - - [960, 960, 1, 32, 960, 960, 32, 960]
    - [2, 95.6753]
  - - [1024, 960, 1, 32, 1024, 1024, 32, 960]
    - [2, 57.8452]
  - - [64, 1024, 1, 32, 64, 64, 32, 1024]
    - [1, 4.28105]
  - - [128, 1024, 1, 32, 128, 128, 32, 1024]
    - [2, 12.1434]
  - - [192, 1024, 1, 32, 192, 192, 32, 1024]
    - [2, 14.2685]
  - - [256, 1024, 1, 32, 256, 256, 32, 1024]
    - [2, 29.6436]
  - - [320, 1024, 1, 32, 320, 320, 32, 1024]
    - [3, 43.3266]
  - - [384, 1024, 1, 32, 384, 384, 32, 1024]
    - [2, 23.8555]
  - - [448, 1024, 1, 32, 448, 448, 32, 1024]
    - [1, 24.7521]
  - - [512, 1024, 1, 32, 512, 512, 32, 1024]
    - [0, 36.1946]
  - - [576, 1024, 1, 32, 576, 576, 32, 1024]
    - [3, 33.1869]
  - - [640, 1024, 1, 32, 640, 640, 32, 1024]
    - [1, 31.696]
  - - [704, 1024, 1, 32, 704, 704, 32, 1024]
    - [3, 46.7713]
  - - [768, 1024, 1, 32, 768, 768, 32, 1024]
    - [0, 36.9038]
  - - [832, 1024, 1, 32, 832, 832, 32, 1024]
    - [1, 58.2451]
  - - [896, 1024, 1, 32, 896, 896, 32, 1024]
    - [3, 60.8723]
  - - [960, 1024, 1, 32, 960, 960, 32, 1024]
    - [2, 70.5354]
  - - [1024, 1024, 1, 32, 1024, 1024, 32, 1024]
    - [2, 80.4107]
- null
- null
- DeviceEfficiency
- GridBased
