library/src/amd_detail/rocblaslt/src/Tensile/Logic/asm_full/navi32/Equality/navi32_Cijk_Alik_Bljk_BBS_BH_Bias_HAS_SAV_UserArgs.yaml
- {MinimumRequiredVersion: 4.33.0}
- navi32
- gfx1101
- [Device 73f0]
    SolutionIndex: 0
    SolutionNameMin: Cijk_Alik_Bljk_BBS_BH_Bias_HAS_SAV_UserArgs_MT64x16x64_MI16x16x1_SN_LDSB0_CLR1_EPS0_GRVWA8_GRVWB8_GSU1_GSUC0_GSUWGMRR0_IU1_K1_LBSPPA128_LBSPPB128_MIWT1_1_PGR2_PLR1_SIA1_SS0_SU32_SUM0_SUS256_TLDS1_WG64_2_1_WGM8_WGMXCC1_WGMXCCGn1
    SolutionIndex: 1
    SolutionNameMin: Cijk_Alik_Bljk_BBS_BH_Bias_HAS_SAV_UserArgs_MT128x16x64_MI16x16x1_SN_LDSB1_CLR1_EPS0_GRVWA8_GRVWB8_GSU2_GSUC0_GSUWGMRR0_IU1_K1_LBSPPA128_LBSPPB128_MIWT2_1_PGR1_PLR3_SIA3_SS0_SU32_SUM0_SUS256_TLDS1_WG64_2_1_WGM8_WGMXCC1_WGMXCCGn1
    SolutionIndex: 2
    SolutionNameMin: Cijk_Alik_Bljk_BBS_BH_Bias_HAS_SAV_UserArgs_MT192x16x64_MI16x16x1_SN_LDSB1_CLR1_EPS0_GRVWA8_GRVWB8_GSU2_GSUC0_GSUWGMRR0_IU1_K1_LBSPPA128_LBSPPB128_MIWT3_1_PGR1_PLR1_SIA3_SS0_SU32_SUM0_SUS256_TLDS1_WG64_2_1_WGM8_WGMXCC1_WGMXCCGn1
    SolutionIndex: 3
    SolutionNameMin: Cijk_Alik_Bljk_BBS_BH_Bias_HAS_SAV_UserArgs_MT192x16x64_MI16x16x1_SN_LDSB1_CLR1_EPS0_GRVWA8_GRVWB8_GSU2_GSUC0_GSUWGMRR0_IU1_K1_LBSPPA128_LBSPPB128_MIWT3_1_PGR2_PLR3_SIA3_SS0_SU32_SUM0_SUS256_TLDS1_WG64_2_1_WGM8_WGMXCC1_WGMXCCGn1
    SolutionIndex: 4
    SolutionNameMin: Cijk_Alik_Bljk_BBS_BH_Bias_HAS_SAV_UserArgs_MT32x32x64_MI16x16x1_SN_LDSB0_CLR1_EPS0_GRVWA8_GRVWB8_GSU1_GSUC0_GSUWGMRR0_IU1_K1_LBSPPA128_LBSPPB128_MIWT1_1_PGR2_PLR3_SIA1_SS0_SU32_SUM0_SUS256_TLDS1_WG32_4_1_WGM8_WGMXCC1_WGMXCCGn1
    SolutionIndex: 5
    SolutionNameMin: Cijk_Alik_Bljk_BBS_BH_Bias_HAS_SAV_UserArgs_MT64x96x32_MI16x16x1_SN_LDSB1_CLR1_EPS1_GRVWA8_GRVWB8_GSU1_GSUC0_GSUWGMRR0_IU2_K1_LBSPPA128_LBSPPB128_MIWT2_3_PGR1_PLR1_SIA2_SS1_SU32_SUM0_SUS256_TLDS1_WG32_4_1_WGM8_WGMXCC1_WGMXCCGn1
    SolutionIndex: 6
    SolutionNameMin: Cijk_Alik_Bljk_BBS_BH_Bias_HAS_SAV_UserArgs_MT96x96x32_MI16x16x1_SN_LDSB0_CLR1_EPS0_GRVWA8_GRVWB8_GSU1_GSUC0_GSUWGMRR0_IU1_K1_LBSPPA128_LBSPPB128_MIWT3_3_PGR1_PLR1_SIA1_SS1_SU32_SUM0_SUS256_TLDS1_WG32_4_1_WGM8_WGMXCC1_WGMXCCGn1
    SolutionIndex: 7
    SolutionNameMin: Cijk_Alik_Bljk_BBS_BH_Bias_HAS_SAV_UserArgs_MT96x96x32_MI16x16x1_SN_LDSB0_CLR1_EPS0_GRVWA8_GRVWB8_GSU1_GSUC0_GSUWGMRR0_IU1_K1_LBSPPA128_LBSPPB128_MIWT3_3_PGR2_PLR1_SIA1_SS1_SU32_SUM0_SUS256_TLDS1_WG32_4_1_WGM8_WGMXCC1_WGMXCCGn1
    SolutionIndex: 8
    SolutionNameMin: Cijk_Alik_Bljk_BBS_BH_Bias_HAS_SAV_UserArgs_MT96x96x32_MI16x16x1_SN_LDSB0_CLR1_EPS0_GRVWA8_GRVWB8_GSU1_GSUC0_GSUWGMRR0_IU1_K1_LBSPPA128_LBSPPB128_MIWT3_3_PGR2_PLR1_SIA3_SS1_SU32_SUM0_SUS256_TLDS1_WG32_4_1_WGM8_WGMXCC1_WGMXCCGn1
    SolutionIndex: 9
    SolutionNameMin: Cijk_Alik_Bljk_BBS_BH_Bias_HAS_SAV_UserArgs_MT80x128x32_MI16x16x1_SN_LDSB1_CLR1_EPS0_GRVWA4_GRVWB8_GSU1_GSUC0_GSUWGMRR0_IU1_K1_LBSPPA128_LBSPPB128_MIWT5_2_PGR2_PLR1_SIA3_SS1_SU32_SUM0_SUS256_TLDS1_WG16_8_1_WGM8_WGMXCC1_WGMXCCGn1
    SolutionIndex: 10
    SolutionNameMin: Cijk_Alik_Bljk_BBS_BH_Bias_HAS_SAV_UserArgs_MT64x16x64_MI16x16x1_SN_LDSB0_CLR1_EPS0_GRVWA8_GRVWB8_GSU1_GSUC0_GSUWGMRR0_IU1_K1_LBSPPA128_LBSPPB128_MIWT1_1_PGR2_PLR1_SIA1_SS1_SU32_SUM0_SUS256_TLDS1_WG64_2_1_WGM8_WGMXCC1_WGMXCCGn1
    SolutionIndex: 11
    SolutionNameMin: Cijk_Alik_Bljk_BBS_BH_Bias_HAS_SAV_UserArgs_MT64x16x64_MI16x16x1_SN_LDSB0_CLR0_EPS0_GRVWA8_GRVWB8_GSU1_GSUC0_GSUWGMRR0_IU1_K1_LBSPPA2048_LBSPPB512_MIWT1_1_PGR2_PLR0_SIA3_SS1_SU32_SUM0_SUS256_TLDS0_WG64_2_1_WGM8_WGMXCC1_WGMXCCGn1
- - - [16, 16, 1, 128, 16, 16, 128, 128]
    - [4, 0.982843]
  - - [2048, 2048, 1, 128, 2048, 2048, 128, 128]
    - [5, 7471.07]
  - - [4096, 1, 1, 4096, 4096, 4096, 4096, 4096]
    - [2, 256.376]
  - - [4096, 1, 1, 14336, 4096, 4096, 14336, 14336]
    - [3, 253.018]
  - - [4096, 2048, 1, 4096, 4096, 4096, 4096, 4096]
    - [6, 23751.6]
  - - [4096, 2048, 1, 14336, 4096, 4096, 14336, 14336]
    - [6, 24540.5]
  - - [4096, 4096, 1, 4096, 4096, 4096, 4096, 4096]
    - [6, 24914.4]
  - - [4096, 4096, 1, 14336, 4096, 4096, 14336, 14336]
    - [7, 25456.0]
  - - [6144, 1, 1, 4096, 6144, 6144, 4096, 4096]
    - [1, 323.947]
  - - [6144, 2048, 1, 4096, 6144, 6144, 4096, 4096]
    - [6, 24421.3]
  - - [6144, 4096, 1, 4096, 6144, 6144, 4096, 4096]
    - [6, 25252.0]
  - - [28672, 1, 1, 4096, 28672, 28672, 4096, 4096]
    - [0, 312.954]
  - - [28672, 2048, 1, 4096, 28672, 28672, 4096, 4096]
    - [8, 25058.5]
  - - [28672, 4096, 1, 4096, 28672, 28672, 4096, 4096]
    - [8, 25803.0]
  - - [100352, 1, 1, 4096, 100352, 100352, 4096, 4096]
    - [11, 340.055]
  - - [100352, 256, 1, 4096, 100352, 100352, 4096, 4096]
    - [9, 24177.7]
  - - [128256, 1, 1, 4096, 128256, 128256, 4096, 4096]
    - [10, 343.144]
  - - [128256, 256, 1, 4096, 128256, 128256, 4096, 4096]
    - [9, 24388.8]
- null
- null
- DeviceEfficiency
- Equality
