library/src/amd_detail/rocblaslt/src/Tensile/Logic/asm_full/aquavanjaram/gfx941/GridBased/aquavanjaram_Cijk_Ailk_Bljk_HF8_HHS_BH_Bias_AS_SAB_SAV.yaml
- {MinimumRequiredVersion: 4.33.0}
- aquavanjaram
- gfx941
- [Device 0049, Device 0050]
    SolutionIndex: 0
    SolutionNameMin: Cijk_Ailk_Bljk_HF8_HHS_BH_Bias_AS_SAB_SAV_MT16x64x16_MI16x16x4_SN_GRVWA1_GRVWB4_GSU1_MIWT1_1_TLDS1
    SolutionIndex: 1
    SolutionNameMin: Cijk_Ailk_Bljk_HF8_HHS_BH_Bias_AS_SAB_SAV_MT16x64x16_MI16x16x4_SN_GRVWA4_GRVWB4_GSU1_MIWT1_1_TLDS1
    SolutionIndex: 2
    SolutionNameMin: Cijk_Ailk_Bljk_HF8_HHS_BH_Bias_AS_SAB_SAV_MT16x64x32_MI16x16x4_SN_GRVWA1_GRVWB4_GSU1_MIWT1_1_TLDS1
    SolutionIndex: 3
    SolutionNameMin: Cijk_Ailk_Bljk_HF8_HHS_BH_Bias_AS_SAB_SAV_MT16x64x32_MI16x16x4_SN_GRVWA4_GRVWB4_GSU1_MIWT1_1_TLDS1
    SolutionIndex: 4
    SolutionNameMin: Cijk_Ailk_Bljk_HF8_HHS_BH_Bias_AS_SAB_SAV_MT16x32x128_MI16x16x1_SN_LDSB0_AFC0_GSU18_MIWT1_1_NEPBS16_WG16_8_1
    SolutionIndex: 5
    SolutionNameMin: Cijk_Ailk_Bljk_HF8_HHS_BH_Bias_AS_SAB_SAV_MT16x64x128_MI16x16x1_SN_LDSB0_AFC0_GSU20_MIWT1_1_NEPBS0_WG16_16_1
    SolutionIndex: 6
    SolutionNameMin: Cijk_Ailk_Bljk_HF8_HHS_BH_Bias_AS_SAB_SAV_MT16x64x128_MI16x16x1_SN_LDSB0_AFC0_GSU55_MIWT1_1_NEPBS0_WG16_16_1
    SolutionIndex: 7
    SolutionNameMin: Cijk_Ailk_Bljk_HF8_HHS_BH_Bias_AS_SAB_SAV_MT16x16x128_MI16x16x1_SN_LDSB0_AFC0_GSU12_MIWT1_1_NEPBS0_WG16_4_1
    SolutionIndex: 8
    SolutionNameMin: Cijk_Ailk_Bljk_HF8_HHS_BH_Bias_AS_SAB_SAV_MT16x64x128_MI16x16x1_SN_LDSB0_AFC0_GSU65_MIWT1_1_NEPBS0_WG16_16_1
    SolutionIndex: 9
    SolutionNameMin: Cijk_Ailk_Bljk_HF8_HHS_BH_Bias_AS_SAB_SAV_MT16x32x128_MI16x16x1_SN_LDSB0_AFC0_GSU18_MIWT1_1_NEPBS0_WG16_8_1
    SolutionIndex: 10
    SolutionNameMin: Cijk_Ailk_Bljk_HF8_HHS_BH_Bias_AS_SAB_SAV_MT16x32x128_MI16x16x1_SN_LDSB0_AFC0_GSU20_MIWT1_1_NEPBS0_WG16_8_1
    SolutionIndex: 11
    SolutionNameMin: Cijk_Ailk_Bljk_HF8_HHS_BH_Bias_AS_SAB_SAV_MT16x64x128_MI16x16x1_SN_LDSB0_AFC0_GSU70_MIWT1_1_NEPBS0_WG16_16_1
    SolutionIndex: 12
    SolutionNameMin: Cijk_Ailk_Bljk_HF8_HHS_BH_Bias_AS_SAB_SAV_MT16x32x128_MI16x16x1_SN_LDSB0_AFC0_GSU25_MIWT1_1_NEPBS16_WG16_8_1
    SolutionIndex: 13
    SolutionNameMin: Cijk_Ailk_Bljk_HF8_HHS_BH_Bias_AS_SAB_SAV_MT16x32x128_MI16x16x1_SN_LDSB0_AFC0_GSU55_MIWT1_1_NEPBS0_WG16_8_1
    SolutionIndex: 14
    SolutionNameMin: Cijk_Ailk_Bljk_HF8_HHS_BH_Bias_AS_SAB_SAV_MT16x64x128_MI16x16x1_SN_LDSB0_AFC0_GSU12_MIWT1_1_NEPBS16_WG16_16_1
    SolutionIndex: 15
    SolutionNameMin: Cijk_Ailk_Bljk_HF8_HHS_BH_Bias_AS_SAB_SAV_MT16x32x128_MI16x16x1_SN_LDSB0_AFC0_GSU70_MIWT1_1_NEPBS16_WG16_8_1
    SolutionIndex: 16
    SolutionNameMin: Cijk_Ailk_Bljk_HF8_HHS_BH_Bias_AS_SAB_SAV_MT16x64x128_MI16x16x1_SN_LDSB0_AFC0_GSU19_MIWT1_1_NEPBS0_WG16_16_1
    SolutionIndex: 17
    SolutionNameMin: Cijk_Ailk_Bljk_HF8_HHS_BH_Bias_AS_SAB_SAV_MT16x64x128_MI16x16x1_SN_LDSB0_AFC0_GSU25_MIWT1_1_NEPBS0_WG16_16_1
    SolutionIndex: 18
    SolutionNameMin: Cijk_Ailk_Bljk_HF8_HHS_BH_Bias_AS_SAB_SAV_MT16x32x128_MI16x16x1_SN_LDSB0_AFC0_GSU9_MIWT1_1_NEPBS16_WG16_8_1
    SolutionIndex: 19
    SolutionNameMin: Cijk_Ailk_Bljk_HF8_HHS_BH_Bias_AS_SAB_SAV_MT16x64x128_MI16x16x1_SN_LDSB1_AFC0_GSU20_MIWT1_2_NEPBS0_WG16_8_1
    SolutionIndex: 20
    SolutionNameMin: Cijk_Ailk_Bljk_HF8_HHS_BH_Bias_AS_SAB_SAV_MT16x64x128_MI16x16x1_SN_LDSB0_AFC0_GSU70_MIWT1_1_NEPBS16_WG16_16_1
    SolutionIndex: 21
    SolutionNameMin: Cijk_Ailk_Bljk_HF8_HHS_BH_Bias_AS_SAB_SAV_MT16x64x128_MI16x16x1_SN_LDSB0_AFC0_GSU18_MIWT1_1_NEPBS0_WG16_16_1
    SolutionIndex: 22
    SolutionNameMin: Cijk_Ailk_Bljk_HF8_HHS_BH_Bias_AS_SAB_SAV_MT16x64x128_MI16x16x1_SN_LDSB0_AFC0_GSU35_MIWT1_1_NEPBS16_WG16_16_1
    SolutionIndex: 23
    SolutionNameMin: Cijk_Ailk_Bljk_HF8_HHS_BH_Bias_AS_SAB_SAV_MT16x32x128_MI16x16x1_SN_LDSB0_AFC0_GSU8_MIWT1_1_NEPBS16_WG16_8_1
    SolutionIndex: 24
    SolutionNameMin: Cijk_Ailk_Bljk_HF8_HHS_BH_Bias_AS_SAB_SAV_MT16x64x128_MI16x16x1_SN_LDSB1_AFC0_GSU19_MIWT1_2_NEPBS0_WG16_8_1
    SolutionIndex: 25
    SolutionNameMin: Cijk_Ailk_Bljk_HF8_HHS_BH_Bias_AS_SAB_SAV_MT16x192x128_MI16x16x1_SN_LDSB1_AFC0_GSU11_MIWT1_3_NEPBS0_WG16_16_1
    SolutionIndex: 26
    SolutionNameMin: Cijk_Ailk_Bljk_HF8_HHS_BH_Bias_AS_SAB_SAV_MT16x64x128_MI16x16x1_SN_LDSB0_AFC0_GSU10_MIWT1_1_NEPBS16_WG16_16_1
    SolutionIndex: 27
    SolutionNameMin: Cijk_Ailk_Bljk_HF8_HHS_BH_Bias_AS_SAB_SAV_MT16x64x128_MI16x16x1_SN_LDSB1_AFC0_GSU20_MIWT1_2_NEPBS16_WG16_8_1
    SolutionIndex: 28
    SolutionNameMin: Cijk_Ailk_Bljk_HF8_HHS_BH_Bias_AS_SAB_SAV_MT16x128x128_MI16x16x1_SN_LDSB1_AFC0_GSU70_MIWT1_2_NEPBS16_WG16_16_1
    SolutionIndex: 29
    SolutionNameMin: Cijk_Ailk_Bljk_HF8_HHS_BH_Bias_AS_SAB_SAV_MT16x32x128_MI16x16x1_SN_LDSB0_AFC0_GSU4_MIWT1_1_NEPBS16_WG16_8_1
    SolutionIndex: 30
    SolutionNameMin: Cijk_Ailk_Bljk_HF8_HHS_BH_Bias_AS_SAB_SAV_MT16x64x128_MI16x16x1_SN_LDSB1_AFC0_GSU9_MIWT1_2_NEPBS16_WG16_8_1
    SolutionIndex: 31
    SolutionNameMin: Cijk_Ailk_Bljk_HF8_HHS_BH_Bias_AS_SAB_SAV_MT16x64x128_MI16x16x1_SN_LDSB0_AFC0_GSU10_MIWT1_1_NEPBS0_WG16_16_1
    SolutionIndex: 32
    SolutionNameMin: Cijk_Ailk_Bljk_HF8_HHS_BH_Bias_AS_SAB_SAV_MT16x128x128_MI16x16x1_SN_LDSB1_AFC0_GSU25_MIWT1_2_NEPBS16_WG16_16_1
    SolutionIndex: 33
    SolutionNameMin: Cijk_Ailk_Bljk_HF8_HHS_BH_Bias_AS_SAB_SAV_MT16x128x128_MI16x16x1_SN_LDSB1_AFC0_GSU65_MIWT1_2_NEPBS16_WG16_16_1
    SolutionIndex: 34
    SolutionNameMin: Cijk_Ailk_Bljk_HF8_HHS_BH_Bias_AS_SAB_SAV_MT16x64x128_MI16x16x1_SN_LDSB0_AFC0_GSU4_MIWT1_1_NEPBS16_WG16_16_1
    SolutionIndex: 35
    SolutionNameMin: Cijk_Ailk_Bljk_HF8_HHS_BH_Bias_AS_SAB_SAV_MT16x128x128_MI16x16x1_SN_LDSB1_AFC0_GSU9_MIWT1_2_NEPBS0_WG16_16_1
    SolutionIndex: 36
    SolutionNameMin: Cijk_Ailk_Bljk_HF8_HHS_BH_Bias_AS_SAB_SAV_MT16x128x128_MI16x16x1_SN_LDSB1_AFC0_GSU18_MIWT1_2_NEPBS16_WG16_16_1
    SolutionIndex: 37
    SolutionNameMin: Cijk_Ailk_Bljk_HF8_HHS_BH_Bias_AS_SAB_SAV_MT16x128x128_MI16x16x1_SN_LDSB1_AFC0_GSU25_MIWT1_2_NEPBS0_WG16_16_1
    SolutionIndex: 38
    SolutionNameMin: Cijk_Ailk_Bljk_HF8_HHS_BH_Bias_AS_SAB_SAV_MT16x128x128_MI16x16x1_SN_LDSB1_AFC0_GSU4_MIWT1_2_NEPBS16_WG16_16_1
    SolutionIndex: 39
    SolutionNameMin: Cijk_Ailk_Bljk_HF8_HHS_BH_Bias_AS_SAB_SAV_MT16x96x128_MI16x16x1_SN_LDSB1_AFC0_GSU40_MIWT1_3_NEPBS0_WG16_8_1
    SolutionIndex: 40
    SolutionNameMin: Cijk_Ailk_Bljk_HF8_HHS_BH_Bias_AS_SAB_SAV_MT16x128x128_MI16x16x1_SN_LDSB1_AFC0_GSU4_MIWT1_2_NEPBS0_WG16_16_1
    SolutionIndex: 41
    SolutionNameMin: Cijk_Ailk_Bljk_HF8_HHS_BH_Bias_AS_SAB_SAV_MT16x128x128_MI16x16x1_SN_LDSB1_AFC0_GSU12_MIWT1_2_NEPBS0_WG16_16_1
    SolutionIndex: 42
    SolutionNameMin: Cijk_Ailk_Bljk_HF8_HHS_BH_Bias_AS_SAB_SAV_MT16x192x128_MI16x16x1_SN_LDSB1_AFC0_GSU18_MIWT1_3_NEPBS16_WG16_16_1
    SolutionIndex: 43
    SolutionNameMin: Cijk_Ailk_Bljk_HF8_HHS_BH_Bias_AS_SAB_SAV_MT16x192x128_MI16x16x1_SN_LDSB1_AFC0_GSU10_MIWT1_3_NEPBS16_WG16_16_1
    SolutionIndex: 44
    SolutionNameMin: Cijk_Ailk_Bljk_HF8_HHS_BH_Bias_AS_SAB_SAV_MT16x128x128_MI16x16x1_SN_LDSB1_AFC0_GSU8_MIWT1_2_NEPBS0_WG16_16_1
    SolutionIndex: 45
    SolutionNameMin: Cijk_Ailk_Bljk_HF8_HHS_BH_Bias_AS_SAB_SAV_MT16x96x128_MI16x16x1_SN_LDSB1_AFC0_GSU12_MIWT1_3_NEPBS16_WG16_8_1
    SolutionIndex: 46
    SolutionNameMin: Cijk_Ailk_Bljk_HF8_HHS_BH_Bias_AS_SAB_SAV_MT16x192x128_MI16x16x1_SN_LDSB1_AFC0_GSU9_MIWT1_3_NEPBS0_WG16_16_1
    SolutionIndex: 47
    SolutionNameMin: Cijk_Ailk_Bljk_HF8_HHS_BH_Bias_AS_SAB_SAV_MT16x192x128_MI16x16x1_SN_LDSB1_AFC0_GSU8_MIWT1_3_NEPBS16_WG16_16_1
    SolutionIndex: 48
    SolutionNameMin: Cijk_Ailk_Bljk_HF8_HHS_BH_Bias_AS_SAB_SAV_MT16x96x128_MI16x16x1_SN_LDSB1_AFC0_GSU18_MIWT1_3_NEPBS16_WG16_8_1
    SolutionIndex: 49
    SolutionNameMin: Cijk_Ailk_Bljk_HF8_HHS_BH_Bias_AS_SAB_SAV_MT16x192x128_MI16x16x1_SN_LDSB1_AFC0_GSU4_MIWT1_3_NEPBS16_WG16_16_1
    SolutionIndex: 50
    SolutionNameMin: Cijk_Ailk_Bljk_HF8_HHS_BH_Bias_AS_SAB_SAV_MT16x96x128_MI16x16x1_SN_LDSB1_AFC0_GSU20_MIWT1_3_NEPBS0_WG16_8_1
    SolutionIndex: 51
    SolutionNameMin: Cijk_Ailk_Bljk_HF8_HHS_BH_Bias_AS_SAB_SAV_MT16x128x128_MI16x16x1_SN_LDSB1_AFC0_GSU18_MIWT1_2_NEPBS0_WG16_16_1
    SolutionIndex: 52
    SolutionNameMin: Cijk_Ailk_Bljk_HF8_HHS_BH_Bias_AS_SAB_SAV_MT16x128x128_MI16x16x1_SN_LDSB1_AFC1_GSU1_MIWT1_2_NEPBS0_WG16_16_1
    SolutionIndex: 53
    SolutionNameMin: Cijk_Ailk_Bljk_HF8_HHS_BH_Bias_AS_SAB_SAV_MT16x96x128_MI16x16x1_SN_LDSB1_AFC0_GSU4_MIWT1_3_NEPBS16_WG16_8_1
    SolutionIndex: 54
    SolutionNameMin: Cijk_Ailk_Bljk_HF8_HHS_BH_Bias_AS_SAB_SAV_MT16x96x128_MI16x16x1_SN_LDSB1_AFC0_GSU19_MIWT1_3_NEPBS0_WG16_8_1
    SolutionIndex: 55
    SolutionNameMin: Cijk_Ailk_Bljk_HF8_HHS_BH_Bias_AS_SAB_SAV_MT16x64x128_MI16x16x1_SN_LDSB1_AFC0_GSU9_MIWT1_2_NEPBS0_WG16_8_1
    SolutionIndex: 56
    SolutionNameMin: Cijk_Ailk_Bljk_HF8_HHS_BH_Bias_AS_SAB_SAV_MT16x64x128_MI16x16x1_SN_LDSB1_AFC0_GSU10_MIWT1_2_NEPBS0_WG16_8_1
    SolutionIndex: 57
    SolutionNameMin: Cijk_Ailk_Bljk_HF8_HHS_BH_Bias_AS_SAB_SAV_MT16x32x128_MI16x16x1_SN_LDSB0_AFC0_GSU18_MIWT1_2_NEPBS0_WG16_4_1
    SolutionIndex: 58
    SolutionNameMin: Cijk_Ailk_Bljk_HF8_HHS_BH_Bias_AS_SAB_SAV_MT16x64x128_MI16x16x1_SN_LDSB1_AFC0_GSU25_MIWT1_2_NEPBS0_WG16_8_1
    SolutionIndex: 59
    SolutionNameMin: Cijk_Ailk_Bljk_HF8_HHS_BH_Bias_AS_SAB_SAV_MT16x16x128_MI16x16x1_SN_LDSB0_AFC0_GSU70_MIWT1_1_NEPBS0_WG16_4_1
    SolutionIndex: 60
    SolutionNameMin: Cijk_Ailk_Bljk_HF8_HHS_BH_Bias_AS_SAB_SAV_MT16x32x128_MI16x16x1_SN_LDSB0_AFC0_GSU10_MIWT1_2_NEPBS0_WG16_4_1
    SolutionIndex: 61
    SolutionNameMin: Cijk_Ailk_Bljk_HF8_HHS_BH_Bias_AS_SAB_SAV_MT16x192x128_MI16x16x1_SN_LDSB1_AFC0_GSU18_MIWT1_3_NEPBS16_WG16_16_1
    SolutionIndex: 62
    SolutionNameMin: Cijk_Ailk_Bljk_HF8_HHS_BH_Bias_AS_SAB_SAV_MT16x32x128_MI16x16x1_SN_LDSB0_AFC0_GSU10_MIWT1_1_NEPBS0_WG16_8_1
    SolutionIndex: 63
    SolutionNameMin: Cijk_Ailk_Bljk_HF8_HHS_BH_Bias_AS_SAB_SAV_MT16x64x128_MI16x16x1_SN_LDSB0_AFC0_GSU18_MIWT1_1_NEPBS16_WG16_16_1
    SolutionIndex: 64
    SolutionNameMin: Cijk_Ailk_Bljk_HF8_HHS_BH_Bias_AS_SAB_SAV_MT16x32x128_MI16x16x1_SN_LDSB0_AFC0_GSU70_MIWT1_1_NEPBS16_WG16_8_1
    SolutionIndex: 65
    SolutionNameMin: Cijk_Ailk_Bljk_HF8_HHS_BH_Bias_AS_SAB_SAV_MT16x16x128_MI16x16x1_SN_LDSB0_AFC0_GSU9_MIWT1_1_NEPBS16_WG16_4_1
    SolutionIndex: 66
    SolutionNameMin: Cijk_Ailk_Bljk_HF8_HHS_BH_Bias_AS_SAB_SAV_MT16x16x128_MI16x16x1_SN_LDSB0_AFC0_GSU10_MIWT1_1_NEPBS16_WG16_4_1
    SolutionIndex: 67
    SolutionNameMin: Cijk_Ailk_Bljk_HF8_HHS_BH_Bias_AS_SAB_SAV_MT16x32x128_MI16x16x1_SN_LDSB0_AFC0_GSU11_MIWT1_1_NEPBS0_WG16_8_1
    SolutionIndex: 68
    SolutionNameMin: Cijk_Ailk_Bljk_HF8_HHS_BH_Bias_AS_SAB_SAV_MT16x32x128_MI16x16x1_SN_LDSB0_AFC0_GSU18_MIWT1_1_NEPBS0_WG16_8_1
    SolutionIndex: 69
    SolutionNameMin: Cijk_Ailk_Bljk_HF8_HHS_BH_Bias_AS_SAB_SAV_MT16x192x128_MI16x16x1_SN_LDSB1_AFC0_GSU12_MIWT1_3_NEPBS0_WG16_16_1
    SolutionIndex: 70
    SolutionNameMin: Cijk_Ailk_Bljk_HF8_HHS_BH_Bias_AS_SAB_SAV_MT16x64x128_MI16x16x1_SN_LDSB1_AFC0_GSU11_MIWT1_2_NEPBS0_WG16_8_1
    SolutionIndex: 71
    SolutionNameMin: Cijk_Ailk_Bljk_HF8_HHS_BH_Bias_AS_SAB_SAV_MT16x64x128_MI16x16x1_SN_LDSB0_AFC0_GSU18_MIWT1_1_NEPBS0_WG16_16_1
    SolutionIndex: 72
    SolutionNameMin: Cijk_Ailk_Bljk_HF8_HHS_BH_Bias_AS_SAB_SAV_MT16x64x128_MI16x16x1_SN_LDSB0_AFC0_GSU65_MIWT1_1_NEPBS0_WG16_16_1
    SolutionIndex: 73
    SolutionNameMin: Cijk_Ailk_Bljk_HF8_HHS_BH_Bias_AS_SAB_SAV_MT16x64x128_MI16x16x1_SN_LDSB1_AFC0_GSU8_MIWT1_2_NEPBS16_WG16_8_1
    SolutionIndex: 74
    SolutionNameMin: Cijk_Ailk_Bljk_HF8_HHS_BH_Bias_AS_SAB_SAV_MT16x192x128_MI16x16x1_SN_LDSB1_AFC0_GSU19_MIWT1_3_NEPBS0_WG16_16_1
    SolutionIndex: 75
    SolutionNameMin: Cijk_Ailk_Bljk_HF8_HHS_BH_Bias_AS_SAB_SAV_MT16x64x128_MI16x16x1_SN_LDSB1_AFC0_GSU25_MIWT1_2_NEPBS16_WG16_8_1
    SolutionIndex: 76
    SolutionNameMin: Cijk_Ailk_Bljk_HF8_HHS_BH_Bias_AS_SAB_SAV_MT16x128x128_MI16x16x1_SN_LDSB1_AFC0_GSU55_MIWT1_2_NEPBS16_WG16_16_1
    SolutionIndex: 77
    SolutionNameMin: Cijk_Ailk_Bljk_HF8_HHS_BH_Bias_AS_SAB_SAV_MT16x64x128_MI16x16x1_SN_LDSB0_AFC0_GSU70_MIWT1_1_NEPBS0_WG16_16_1
    SolutionIndex: 78
    SolutionNameMin: Cijk_Ailk_Bljk_HF8_HHS_BH_Bias_AS_SAB_SAV_MT16x64x128_MI16x16x1_SN_LDSB0_AFC0_GSU8_MIWT1_1_NEPBS16_WG16_16_1
    SolutionIndex: 79
    SolutionNameMin: Cijk_Ailk_Bljk_HF8_HHS_BH_Bias_AS_SAB_SAV_MT16x128x128_MI16x16x1_SN_LDSB1_AFC0_GSU18_MIWT1_2_NEPBS0_WG16_16_1
    SolutionIndex: 80
    SolutionNameMin: Cijk_Ailk_Bljk_HF8_HHS_BH_Bias_AS_SAB_SAV_MT16x64x128_MI16x16x1_SN_LDSB0_AFC0_GSU19_MIWT1_1_NEPBS16_WG16_16_1
    SolutionIndex: 81
    SolutionNameMin: Cijk_Ailk_Bljk_HF8_HHS_BH_Bias_AS_SAB_SAV_MT16x64x128_MI16x16x1_SN_LDSB0_AFC0_GSU45_MIWT1_1_NEPBS0_WG16_16_1
    SolutionIndex: 82
    SolutionNameMin: Cijk_Ailk_Bljk_HF8_HHS_BH_Bias_AS_SAB_SAV_MT16x128x128_MI16x16x1_SN_LDSB1_AFC0_GSU10_MIWT1_2_NEPBS0_WG16_16_1
    SolutionIndex: 83
    SolutionNameMin: Cijk_Ailk_Bljk_HF8_HHS_BH_Bias_AS_SAB_SAV_MT16x64x128_MI16x16x1_SN_LDSB0_AFC0_GSU11_MIWT1_1_NEPBS0_WG16_16_1
    SolutionIndex: 84
    SolutionNameMin: Cijk_Ailk_Bljk_HF8_HHS_BH_Bias_AS_SAB_SAV_MT16x64x128_MI16x16x1_SN_LDSB0_AFC0_GSU19_MIWT1_1_NEPBS0_WG16_16_1
    SolutionIndex: 85
    SolutionNameMin: Cijk_Ailk_Bljk_HF8_HHS_BH_Bias_AS_SAB_SAV_MT16x128x128_MI16x16x1_SN_LDSB1_AFC0_GSU9_MIWT1_2_NEPBS16_WG16_16_1
    SolutionIndex: 86
    SolutionNameMin: Cijk_Ailk_Bljk_HF8_HHS_BH_Bias_AS_SAB_SAV_MT16x64x128_MI16x16x1_SN_LDSB0_AFC0_GSU9_MIWT1_1_NEPBS16_WG16_16_1
    SolutionIndex: 87
    SolutionNameMin: Cijk_Ailk_Bljk_HF8_HHS_BH_Bias_AS_SAB_SAV_MT16x64x128_MI16x16x1_SN_LDSB0_AFC0_GSU9_MIWT1_1_NEPBS0_WG16_16_1
    SolutionIndex: 88
    SolutionNameMin: Cijk_Ailk_Bljk_HF8_HHS_BH_Bias_AS_SAB_SAV_MT16x64x128_MI16x16x1_SN_LDSB1_AFC0_GSU40_MIWT1_2_NEPBS0_WG16_8_1
    SolutionIndex: 89
    SolutionNameMin: Cijk_Ailk_Bljk_HF8_HHS_BH_Bias_AS_SAB_SAV_MT16x16x128_MI16x16x1_SN_LDSB0_AFC1_GSU1_MIWT1_1_NEPBS0_WG16_4_1
    SolutionIndex: 90
    SolutionNameMin: Cijk_Ailk_Bljk_HF8_HHS_BH_Bias_AS_SAB_SAV_MT16x64x128_MI16x16x1_SN_LDSB1_AFC0_GSU30_MIWT1_2_NEPBS16_WG16_8_1
    SolutionIndex: 91
    SolutionNameMin: Cijk_Ailk_Bljk_HF8_HHS_BH_Bias_AS_SAB_SAV_MT16x128x128_MI16x16x1_SN_LDSB1_AFC0_GSU4_MIWT1_2_NEPBS16_WG16_16_1
    SolutionIndex: 92
    SolutionNameMin: Cijk_Ailk_Bljk_HF8_HHS_BH_Bias_AS_SAB_SAV_MT16x128x128_MI16x16x1_SN_LDSB1_AFC0_GSU10_MIWT1_2_NEPBS16_WG16_16_1
    SolutionIndex: 93
    SolutionNameMin: Cijk_Ailk_Bljk_HF8_HHS_BH_Bias_AS_SAB_SAV_MT16x128x128_MI16x16x1_SN_LDSB1_AFC0_GSU11_MIWT1_2_NEPBS0_WG16_16_1
    SolutionIndex: 94
    SolutionNameMin: Cijk_Ailk_Bljk_HF8_HHS_BH_Bias_AS_SAB_SAV_MT16x128x128_MI16x16x1_SN_LDSB1_AFC0_GSU19_MIWT1_2_NEPBS0_WG16_16_1
    SolutionIndex: 95
    SolutionNameMin: Cijk_Ailk_Bljk_HF8_HHS_BH_Bias_AS_SAB_SAV_MT16x128x128_MI16x16x1_SN_LDSB1_AFC0_GSU4_MIWT1_2_NEPBS0_WG16_16_1
    SolutionIndex: 96
    SolutionNameMin: Cijk_Ailk_Bljk_HF8_HHS_BH_Bias_AS_SAB_SAV_MT16x128x128_MI16x16x1_SN_LDSB1_AFC0_GSU8_MIWT1_2_NEPBS16_WG16_16_1
    SolutionIndex: 97
    SolutionNameMin: Cijk_Ailk_Bljk_HF8_HHS_BH_Bias_AS_SAB_SAV_MT16x64x128_MI16x16x1_SN_LDSB0_AFC0_GSU4_MIWT1_1_NEPBS0_WG16_16_1
    SolutionIndex: 98
    SolutionNameMin: Cijk_Ailk_Bljk_HF8_HHS_BH_Bias_AS_SAB_SAV_MT16x64x128_MI16x16x1_SN_LDSB1_AFC0_GSU8_MIWT1_2_NEPBS0_WG16_8_1
    SolutionIndex: 99
    SolutionNameMin: Cijk_Ailk_Bljk_HF8_HHS_BH_Bias_AS_SAB_SAV_MT16x64x128_MI16x16x1_SN_LDSB0_AFC1_GSU1_MIWT1_1_NEPBS0_WG16_16_1
    SolutionIndex: 100
    SolutionNameMin: Cijk_Ailk_Bljk_HF8_HHS_BH_Bias_AS_SAB_SAV_MT16x192x128_MI16x16x1_SN_LDSB1_AFC0_GSU8_MIWT1_3_NEPBS16_WG16_16_1
    SolutionIndex: 101
    SolutionNameMin: Cijk_Ailk_Bljk_HF8_HHS_BH_Bias_AS_SAB_SAV_MT16x96x128_MI16x16x1_SN_LDSB1_AFC0_GSU19_MIWT1_3_NEPBS16_WG16_8_1
    SolutionIndex: 102
    SolutionNameMin: Cijk_Ailk_Bljk_HF8_HHS_BH_Bias_AS_SAB_SAV_MT16x192x128_MI16x16x1_SN_LDSB1_AFC0_GSU9_MIWT1_3_NEPBS0_WG16_16_1
    SolutionIndex: 103
    SolutionNameMin: Cijk_Ailk_Bljk_HF8_HHS_BH_Bias_AS_SAB_SAV_MT16x32x128_MI16x16x1_SN_LDSB0_AFC1_GSU1_MIWT1_1_NEPBS0_WG16_8_1
    SolutionIndex: 104
    SolutionNameMin: Cijk_Ailk_Bljk_HF8_HHS_BH_Bias_AS_SAB_SAV_MT16x64x128_MI16x16x1_SN_LDSB1_AFC0_GSU4_MIWT1_2_NEPBS0_WG16_8_1
    SolutionIndex: 105
    SolutionNameMin: Cijk_Ailk_Bljk_HF8_HHS_BH_Bias_AS_SAB_SAV_MT16x32x128_MI16x16x1_SN_LDSB0_AFC0_GSU4_MIWT1_1_NEPBS0_WG16_8_1
    SolutionIndex: 106
    SolutionNameMin: Cijk_Ailk_Bljk_HF8_HHS_BH_Bias_AS_SAB_SAV_MT16x96x128_MI16x16x1_SN_LDSB1_AFC0_GSU20_MIWT1_3_NEPBS16_WG16_8_1
    SolutionIndex: 107
    SolutionNameMin: Cijk_Ailk_Bljk_HF8_HHS_BH_Bias_AS_SAB_SAV_MT16x128x128_MI16x16x1_SN_LDSB1_AFC1_GSU1_MIWT1_2_NEPBS16_WG16_16_1
    SolutionIndex: 108
    SolutionNameMin: Cijk_Ailk_Bljk_HF8_HHS_BH_Bias_AS_SAB_SAV_MT16x192x128_MI16x16x1_SN_LDSB1_AFC0_GSU4_MIWT1_3_NEPBS16_WG16_16_1
    SolutionIndex: 109
    SolutionNameMin: Cijk_Ailk_Bljk_HF8_HHS_BH_Bias_AS_SAB_SAV_MT32x16x128_MI16x16x1_SN_LDSB0_AFC0_GSU11_LBSPPA256_MIWT1_1_NEPBS0_NLCA1_SPO1_SVW1_VWA1_WG32_4_1
    SolutionIndex: 110
    SolutionNameMin: Cijk_Ailk_Bljk_HF8_HHS_BH_Bias_AS_SAB_SAV_MT32x16x128_MI16x16x1_SN_LDSB0_AFC0_GSU18_LBSPPA256_MIWT1_1_NEPBS0_NLCA1_SPO1_SVW1_VWA1_WG32_4_1
    SolutionIndex: 111
    SolutionNameMin: Cijk_Ailk_Bljk_HF8_HHS_BH_Bias_AS_SAB_SAV_MT32x16x128_MI16x16x1_SN_LDSB0_AFC0_GSU35_LBSPPA256_MIWT1_1_NEPBS16_NLCA1_SPO1_SVW1_VWA1_WG32_4_1
    SolutionIndex: 112
    SolutionNameMin: Cijk_Ailk_Bljk_HF8_HHS_BH_Bias_AS_SAB_SAV_MT32x16x128_MI16x16x1_SN_LDSB0_AFC0_GSU65_LBSPPA256_MIWT1_1_NEPBS0_NLCA1_SPO0_SVW1_VWA1_WG32_4_1
    SolutionIndex: 113
    SolutionNameMin: Cijk_Ailk_Bljk_HF8_HHS_BH_Bias_AS_SAB_SAV_MT64x16x128_MI16x16x1_SN_LDSB0_AFC0_GSU12_LBSPPA512_MIWT1_1_NEPBS16_NLCA1_SPO1_SVW1_VWA1_WG64_4_1
    SolutionIndex: 114
    SolutionNameMin: Cijk_Ailk_Bljk_HF8_HHS_BH_Bias_AS_SAB_SAV_MT32x16x128_MI16x16x1_SN_LDSB0_AFC0_GSU18_LBSPPA256_MIWT1_1_NEPBS16_NLCA1_SPO0_SVW1_VWA1_WG32_4_1
    SolutionIndex: 115
    SolutionNameMin: Cijk_Ailk_Bljk_HF8_HHS_BH_Bias_AS_SAB_SAV_MT32x16x128_MI16x16x1_SN_LDSB0_AFC0_GSU18_LBSPPA256_MIWT1_1_NEPBS0_NLCA1_SPO0_SVW1_VWA1_WG32_4_1
    SolutionIndex: 116
    SolutionNameMin: Cijk_Ailk_Bljk_HF8_HHS_BH_Bias_AS_SAB_SAV_MT32x16x128_MI16x16x1_SN_LDSB0_AFC0_GSU25_LBSPPA256_MIWT1_1_NEPBS0_NLCA1_SPO0_SVW1_VWA1_WG32_4_1
    SolutionIndex: 117
    SolutionNameMin: Cijk_Ailk_Bljk_HF8_HHS_BH_Bias_AS_SAB_SAV_MT32x16x128_MI16x16x1_SN_LDSB0_AFC0_GSU70_LBSPPA256_MIWT1_1_NEPBS0_NLCA1_SPO1_SVW1_VWA1_WG32_4_1
    SolutionIndex: 118
    SolutionNameMin: Cijk_Ailk_Bljk_HF8_HHS_BH_Bias_AS_SAB_SAV_MT64x16x128_MI16x16x1_SN_LDSB1_AFC0_GSU12_LBSPPA512_MIWT2_1_NEPBS16_NLCA1_SPO1_SVW2_VWA2_WG32_4_1
    SolutionIndex: 119
    SolutionNameMin: Cijk_Ailk_Bljk_HF8_HHS_BH_Bias_AS_SAB_SAV_MT64x16x128_MI16x16x1_SN_LDSB0_AFC0_GSU18_LBSPPA512_MIWT1_1_NEPBS16_NLCA1_SPO0_SVW1_VWA1_WG64_4_1
    SolutionIndex: 120
    SolutionNameMin: Cijk_Ailk_Bljk_HF8_HHS_BH_Bias_AS_SAB_SAV_MT64x16x128_MI16x16x1_SN_LDSB0_AFC0_GSU20_LBSPPA512_MIWT1_1_NEPBS0_NLCA1_SPO1_SVW1_VWA1_WG64_4_1
    SolutionIndex: 121
    SolutionNameMin: Cijk_Ailk_Bljk_HF8_HHS_BH_Bias_AS_SAB_SAV_MT64x16x128_MI16x16x1_SN_LDSB0_AFC0_GSU25_LBSPPA512_MIWT1_1_NEPBS0_NLCA1_SPO0_SVW1_VWA1_WG64_4_1
    SolutionIndex: 122
    SolutionNameMin: Cijk_Ailk_Bljk_HF8_HHS_BH_Bias_AS_SAB_SAV_MT64x16x128_MI16x16x1_SN_LDSB0_AFC0_GSU70_LBSPPA512_MIWT1_1_NEPBS16_NLCA1_SPO1_SVW1_VWA1_WG64_4_1
    SolutionIndex: 123
    SolutionNameMin: Cijk_Ailk_Bljk_HF8_HHS_BH_Bias_AS_SAB_SAV_MT64x16x128_MI16x16x1_SN_LDSB0_AFC0_GSU19_LBSPPA512_MIWT1_1_NEPBS16_NLCA1_SPO1_SVW1_VWA1_WG64_4_1
    SolutionIndex: 124
    SolutionNameMin: Cijk_Ailk_Bljk_HF8_HHS_BH_Bias_AS_SAB_SAV_MT64x16x128_MI16x16x1_SN_LDSB0_AFC0_GSU19_LBSPPA512_MIWT1_1_NEPBS0_NLCA1_SPO0_SVW1_VWA1_WG64_4_1
    SolutionIndex: 125
    SolutionNameMin: Cijk_Ailk_Bljk_HF8_HHS_BH_Bias_AS_SAB_SAV_MT64x16x128_MI16x16x1_SN_LDSB0_AFC0_GSU55_LBSPPA512_MIWT1_1_NEPBS0_NLCA1_SPO0_SVW1_VWA1_WG64_4_1
    SolutionIndex: 126
    SolutionNameMin: Cijk_Ailk_Bljk_HF8_HHS_BH_Bias_AS_SAB_SAV_MT64x16x128_MI16x16x1_SN_LDSB0_AFC0_GSU11_LBSPPA512_MIWT1_1_NEPBS16_NLCA1_SPO1_SVW1_VWA1_WG64_4_1
    SolutionIndex: 127
    SolutionNameMin: Cijk_Ailk_Bljk_HF8_HHS_BH_Bias_AS_SAB_SAV_MT64x16x128_MI16x16x1_SN_LDSB0_AFC0_GSU20_LBSPPA512_MIWT1_1_NEPBS0_NLCA1_SPO0_SVW1_VWA1_WG64_4_1
    SolutionIndex: 128
    SolutionNameMin: Cijk_Ailk_Bljk_HF8_HHS_BH_Bias_AS_SAB_SAV_MT64x16x128_MI16x16x1_SN_LDSB0_AFC0_GSU35_LBSPPA512_MIWT1_1_NEPBS16_NLCA1_SPO0_SVW1_VWA1_WG64_4_1
    SolutionIndex: 129
    SolutionNameMin: Cijk_Ailk_Bljk_HF8_HHS_BH_Bias_AS_SAB_SAV_MT64x16x128_MI16x16x1_SN_LDSB0_AFC0_GSU19_LBSPPA512_MIWT1_1_NEPBS0_NLCA1_SPO1_SVW1_VWA1_WG64_4_1
    SolutionIndex: 130
    SolutionNameMin: Cijk_Ailk_Bljk_HF8_HHS_BH_Bias_AS_SAB_SAV_MT64x16x128_MI16x16x1_SN_LDSB0_AFC0_GSU50_LBSPPA512_MIWT1_1_NEPBS0_NLCA1_SPO1_SVW1_VWA1_WG64_4_1
    SolutionIndex: 131
    SolutionNameMin: Cijk_Ailk_Bljk_HF8_HHS_BH_Bias_AS_SAB_SAV_MT64x16x128_MI16x16x1_SN_LDSB0_AFC0_GSU20_LBSPPA512_MIWT1_1_NEPBS16_NLCA1_SPO1_SVW1_VWA1_WG64_4_1
    SolutionIndex: 132
    SolutionNameMin: Cijk_Ailk_Bljk_HF8_HHS_BH_Bias_AS_SAB_SAV_MT64x16x128_MI16x16x1_SN_LDSB0_AFC0_GSU25_LBSPPA512_MIWT1_1_NEPBS0_NLCA1_SPO1_SVW1_VWA1_WG64_4_1
    SolutionIndex: 133
    SolutionNameMin: Cijk_Ailk_Bljk_HF8_HHS_BH_Bias_AS_SAB_SAV_MT64x16x128_MI16x16x1_SN_LDSB0_AFC0_GSU60_LBSPPA512_MIWT1_1_NEPBS0_NLCA1_SPO1_SVW1_VWA1_WG64_4_1
    SolutionIndex: 134
    SolutionNameMin: Cijk_Ailk_Bljk_HF8_HHS_BH_Bias_AS_SAB_SAV_MT64x16x128_MI16x16x1_SN_LDSB0_AFC0_GSU8_LBSPPA512_MIWT1_1_NEPBS0_NLCA1_SPO1_SVW1_VWA1_WG64_4_1
    SolutionIndex: 135
    SolutionNameMin: Cijk_Ailk_Bljk_HF8_HHS_BH_Bias_AS_SAB_SAV_MT64x16x128_MI16x16x1_SN_LDSB0_AFC0_GSU9_LBSPPA512_MIWT1_1_NEPBS16_NLCA1_SPO0_SVW1_VWA1_WG64_4_1
    SolutionIndex: 136
    SolutionNameMin: Cijk_Ailk_Bljk_HF8_HHS_BH_Bias_AS_SAB_SAV_MT64x16x128_MI16x16x1_SN_LDSB0_AFC0_GSU18_LBSPPA512_MIWT1_1_NEPBS0_NLCA1_SPO1_SVW1_VWA1_WG64_4_1
    SolutionIndex: 137
    SolutionNameMin: Cijk_Ailk_Bljk_HF8_HHS_BH_Bias_AS_SAB_SAV_MT64x16x128_MI16x16x1_SN_LDSB0_AFC0_GSU18_LBSPPA512_MIWT1_1_NEPBS0_NLCA1_SPO0_SVW1_VWA1_WG64_4_1
    SolutionIndex: 138
    SolutionNameMin: Cijk_Ailk_Bljk_HF8_HHS_BH_Bias_AS_SAB_SAV_MT128x16x128_MI16x16x1_SN_LDSB1_AFC0_GSU65_LBSPPA1024_MIWT2_1_NEPBS0_NLCA1_SPO1_SVW2_VWA2_WG64_4_1
    SolutionIndex: 139
    SolutionNameMin: Cijk_Ailk_Bljk_HF8_HHS_BH_Bias_AS_SAB_SAV_MT64x16x128_MI16x16x1_SN_LDSB0_AFC0_GSU9_LBSPPA512_MIWT1_1_NEPBS16_NLCA1_SPO1_SVW1_VWA1_WG64_4_1
    SolutionIndex: 140
    SolutionNameMin: Cijk_Ailk_Bljk_HF8_HHS_BH_Bias_AS_SAB_SAV_MT64x16x128_MI16x16x1_SN_LDSB0_AFC0_GSU19_LBSPPA512_MIWT1_1_NEPBS16_NLCA1_SPO0_SVW1_VWA1_WG64_4_1
    SolutionIndex: 141
    SolutionNameMin: Cijk_Ailk_Bljk_HF8_HHS_BH_Bias_AS_SAB_SAV_MT64x16x128_MI16x16x1_SN_LDSB0_AFC0_GSU45_LBSPPA512_MIWT1_1_NEPBS0_NLCA1_SPO1_SVW1_VWA1_WG64_4_1
    SolutionIndex: 142
    SolutionNameMin: Cijk_Ailk_Bljk_HF8_HHS_BH_Bias_AS_SAB_SAV_MT128x16x128_MI16x16x1_SN_LDSB1_AFC0_GSU12_LBSPPA1024_MIWT2_1_NEPBS16_NLCA1_SPO1_SVW2_VWA2_WG64_4_1
    SolutionIndex: 143
    SolutionNameMin: Cijk_Ailk_Bljk_HF8_HHS_BH_Bias_AS_SAB_SAV_MT64x16x128_MI16x16x1_SN_LDSB0_AFC0_GSU9_LBSPPA512_MIWT1_1_NEPBS0_NLCA1_SPO0_SVW1_VWA1_WG64_4_1
    SolutionIndex: 144
    SolutionNameMin: Cijk_Ailk_Bljk_HF8_HHS_BH_Bias_AS_SAB_SAV_MT128x16x128_MI16x16x1_SN_LDSB1_AFC0_GSU18_LBSPPA1024_MIWT2_1_NEPBS16_NLCA1_SPO0_SVW2_VWA2_WG64_4_1
    SolutionIndex: 145
    SolutionNameMin: Cijk_Ailk_Bljk_HF8_HHS_BH_Bias_AS_SAB_SAV_MT128x16x128_MI16x16x1_SN_LDSB1_AFC0_GSU20_LBSPPA1024_MIWT2_1_NEPBS0_NLCA1_SPO1_SVW2_VWA2_WG64_4_1
    SolutionIndex: 146
    SolutionNameMin: Cijk_Ailk_Bljk_HF8_HHS_BH_Bias_AS_SAB_SAV_MT128x16x128_MI16x16x1_SN_LDSB1_AFC0_GSU40_LBSPPA1024_MIWT2_1_NEPBS16_NLCA1_SPO1_SVW2_VWA2_WG64_4_1
    SolutionIndex: 147
    SolutionNameMin: Cijk_Ailk_Bljk_HF8_HHS_BH_Bias_AS_SAB_SAV_MT128x16x128_MI16x16x1_SN_LDSB1_AFC0_GSU10_LBSPPA1024_MIWT2_1_NEPBS16_NLCA1_SPO0_SVW2_VWA2_WG64_4_1
    SolutionIndex: 148
    SolutionNameMin: Cijk_Ailk_Bljk_HF8_HHS_BH_Bias_AS_SAB_SAV_MT64x16x128_MI16x16x1_SN_LDSB0_AFC0_GSU11_LBSPPA512_MIWT1_1_NEPBS0_NLCA1_SPO0_SVW1_VWA1_WG64_4_1
    SolutionIndex: 149
    SolutionNameMin: Cijk_Ailk_Bljk_HF8_HHS_BH_Bias_AS_SAB_SAV_MT64x16x128_MI16x16x1_SN_LDSB0_AFC0_GSU11_LBSPPA512_MIWT1_1_NEPBS0_NLCA1_SPO1_SVW1_VWA1_WG64_4_1
    SolutionIndex: 150
    SolutionNameMin: Cijk_Ailk_Bljk_HF8_HHS_BH_Bias_AS_SAB_SAV_MT64x16x128_MI16x16x1_SN_LDSB0_AFC0_GSU35_LBSPPA512_MIWT1_1_NEPBS0_NLCA1_SPO1_SVW1_VWA1_WG64_4_1
    SolutionIndex: 151
    SolutionNameMin: Cijk_Ailk_Bljk_HF8_HHS_BH_Bias_AS_SAB_SAV_MT192x16x128_MI16x16x1_SN_LDSB1_AFC0_GSU12_LBSPPA1536_MIWT3_1_NEPBS16_NLCA3_SPO1_SVW1_VWA1_WG64_4_1
    SolutionIndex: 152
    SolutionNameMin: Cijk_Ailk_Bljk_HF8_HHS_BH_Bias_AS_SAB_SAV_MT64x16x128_MI16x16x1_SN_LDSB0_AFC0_GSU8_LBSPPA512_MIWT1_1_NEPBS16_NLCA1_SPO0_SVW1_VWA1_WG64_4_1
    SolutionIndex: 153
    SolutionNameMin: Cijk_Ailk_Bljk_HF8_HHS_BH_Bias_AS_SAB_SAV_MT128x16x128_MI16x16x1_SN_LDSB1_AFC0_GSU18_LBSPPA1024_MIWT2_1_NEPBS0_NLCA1_SPO0_SVW2_VWA2_WG64_4_1
    SolutionIndex: 154
    SolutionNameMin: Cijk_Ailk_Bljk_HF8_HHS_BH_Bias_AS_SAB_SAV_MT128x16x128_MI16x16x1_SN_LDSB1_AFC0_GSU25_LBSPPA1024_MIWT2_1_NEPBS0_NLCA1_SPO0_SVW2_VWA2_WG64_4_1
    SolutionIndex: 155
    SolutionNameMin: Cijk_Ailk_Bljk_HF8_HHS_BH_Bias_AS_SAB_SAV_MT32x16x128_MI16x16x1_SN_LDSB0_AFC1_GSU1_LBSPPA256_MIWT1_1_NEPBS0_NLCA1_SPO1_SVW1_VWA1_WG32_4_1
    SolutionIndex: 156
    SolutionNameMin: Cijk_Ailk_Bljk_HF8_HHS_BH_Bias_AS_SAB_SAV_MT64x16x128_MI16x16x1_SN_LDSB0_AFC0_GSU9_LBSPPA512_MIWT1_1_NEPBS0_NLCA1_SPO1_SVW1_VWA1_WG64_4_1
    SolutionIndex: 157
    SolutionNameMin: Cijk_Ailk_Bljk_HF8_HHS_BH_Bias_AS_SAB_SAV_MT128x16x128_MI16x16x1_SN_LDSB1_AFC0_GSU35_LBSPPA1024_MIWT2_1_NEPBS0_NLCA1_SPO1_SVW2_VWA2_WG64_4_1
    SolutionIndex: 158
    SolutionNameMin: Cijk_Ailk_Bljk_HF8_HHS_BH_Bias_AS_SAB_SAV_MT64x16x128_MI16x16x1_SN_LDSB0_AFC0_GSU4_LBSPPA512_MIWT1_1_NEPBS16_NLCA1_SPO1_SVW1_VWA1_WG64_4_1
    SolutionIndex: 159
    SolutionNameMin: Cijk_Ailk_Bljk_HF8_HHS_BH_Bias_AS_SAB_SAV_MT128x16x128_MI16x16x1_SN_LDSB1_AFC0_GSU12_LBSPPA1024_MIWT2_1_NEPBS16_NLCA1_SPO0_SVW2_VWA2_WG64_4_1
    SolutionIndex: 160
    SolutionNameMin: Cijk_Ailk_Bljk_HF8_HHS_BH_Bias_AS_SAB_SAV_MT128x16x128_MI16x16x1_SN_LDSB1_AFC0_GSU18_LBSPPA1024_MIWT2_1_NEPBS16_NLCA1_SPO1_SVW2_VWA2_WG64_4_1
    SolutionIndex: 161
    SolutionNameMin: Cijk_Ailk_Bljk_HF8_HHS_BH_Bias_AS_SAB_SAV_MT64x16x128_MI16x16x1_SN_LDSB1_AFC0_GSU18_LBSPPA512_MIWT2_1_NEPBS0_NLCA1_SPO1_SVW2_VWA2_WG32_4_1
    SolutionIndex: 162
    SolutionNameMin: Cijk_Ailk_Bljk_HF8_HHS_BH_Bias_AS_SAB_SAV_MT32x16x128_MI16x16x1_SN_LDSB0_AFC1_GSU1_LBSPPA256_MIWT1_1_NEPBS0_NLCA1_SPO0_SVW1_VWA1_WG32_4_1
    SolutionIndex: 163
    SolutionNameMin: Cijk_Ailk_Bljk_HF8_HHS_BH_Bias_AS_SAB_SAV_MT128x16x128_MI16x16x1_SN_LDSB1_AFC0_GSU10_LBSPPA1024_MIWT2_1_NEPBS16_NLCA1_SPO1_SVW2_VWA2_WG64_4_1
    SolutionIndex: 164
    SolutionNameMin: Cijk_Ailk_Bljk_HF8_HHS_BH_Bias_AS_SAB_SAV_MT128x16x128_MI16x16x1_SN_LDSB1_AFC0_GSU30_LBSPPA1024_MIWT2_1_NEPBS16_NLCA1_SPO1_SVW2_VWA2_WG64_4_1
    SolutionIndex: 165
    SolutionNameMin: Cijk_Ailk_Bljk_HF8_HHS_BH_Bias_AS_SAB_SAV_MT192x16x128_MI16x16x1_SN_LDSB1_AFC0_GSU8_LBSPPA1536_MIWT3_1_NEPBS0_NLCA3_SPO1_SVW1_VWA1_WG64_4_1
    SolutionIndex: 166
    SolutionNameMin: Cijk_Ailk_Bljk_HF8_HHS_BH_Bias_AS_SAB_SAV_MT128x16x128_MI16x16x1_SN_LDSB1_AFC0_GSU9_LBSPPA1024_MIWT2_1_NEPBS16_NLCA1_SPO1_SVW2_VWA2_WG64_4_1
    SolutionIndex: 167
    SolutionNameMin: Cijk_Ailk_Bljk_HF8_HHS_BH_Bias_AS_SAB_SAV_MT128x16x128_MI16x16x1_SN_LDSB1_AFC0_GSU9_LBSPPA1024_MIWT2_1_NEPBS0_NLCA1_SPO0_SVW2_VWA2_WG64_4_1
    SolutionIndex: 168
    SolutionNameMin: Cijk_Ailk_Bljk_HF8_HHS_BH_Bias_AS_SAB_SAV_MT128x16x128_MI16x16x1_SN_LDSB1_AFC0_GSU9_LBSPPA1024_MIWT2_1_NEPBS16_NLCA1_SPO0_SVW2_VWA2_WG64_4_1
    SolutionIndex: 169
    SolutionNameMin: Cijk_Ailk_Bljk_HF8_HHS_BH_Bias_AS_SAB_SAV_MT128x16x128_MI16x16x1_SN_LDSB1_AFC0_GSU35_LBSPPA1024_MIWT2_1_NEPBS16_NLCA1_SPO0_SVW2_VWA2_WG64_4_1
    SolutionIndex: 170
    SolutionNameMin: Cijk_Ailk_Bljk_HF8_HHS_BH_Bias_AS_SAB_SAV_MT32x16x128_MI16x16x1_SN_LDSB0_AFC1_GSU1_LBSPPA256_MIWT1_1_NEPBS16_NLCA1_SPO1_SVW1_VWA1_WG32_4_1
    SolutionIndex: 171
    SolutionNameMin: Cijk_Ailk_Bljk_HF8_HHS_BH_Bias_AS_SAB_SAV_MT128x16x128_MI16x16x1_SN_LDSB1_AFC0_GSU8_LBSPPA1024_MIWT2_1_NEPBS0_NLCA1_SPO0_SVW2_VWA2_WG64_4_1
    SolutionIndex: 172
    SolutionNameMin: Cijk_Ailk_Bljk_HF8_HHS_BH_Bias_AS_SAB_SAV_MT128x16x128_MI16x16x1_SN_LDSB1_AFC0_GSU10_LBSPPA1024_MIWT2_1_NEPBS0_NLCA1_SPO0_SVW2_VWA2_WG64_4_1
    SolutionIndex: 173
    SolutionNameMin: Cijk_Ailk_Bljk_HF8_HHS_BH_Bias_AS_SAB_SAV_MT64x16x128_MI16x16x1_SN_LDSB0_AFC1_GSU1_LBSPPA512_MIWT1_1_NEPBS16_NLCA1_SPO0_SVW1_VWA1_WG64_4_1
    SolutionIndex: 174
    SolutionNameMin: Cijk_Ailk_Bljk_HF8_HHS_BH_Bias_AS_SAB_SAV_MT128x16x128_MI16x16x1_SN_LDSB1_AFC0_GSU4_LBSPPA1024_MIWT2_1_NEPBS0_NLCA1_SPO1_SVW2_VWA2_WG64_4_1
    SolutionIndex: 175
    SolutionNameMin: Cijk_Ailk_Bljk_HF8_HHS_BH_Bias_AS_SAB_SAV_MT192x16x128_MI16x16x1_SN_LDSB1_AFC0_GSU8_LBSPPA1536_MIWT3_1_NEPBS16_NLCA3_SPO0_SVW1_VWA1_WG64_4_1
    SolutionIndex: 176
    SolutionNameMin: Cijk_Ailk_Bljk_HF8_HHS_BH_Bias_AS_SAB_SAV_MT64x16x128_MI16x16x1_SN_LDSB0_AFC0_GSU4_LBSPPA512_MIWT1_1_NEPBS16_NLCA1_SPO0_SVW1_VWA1_WG64_4_1
    SolutionIndex: 177
    SolutionNameMin: Cijk_Ailk_Bljk_HF8_HHS_BH_Bias_AS_SAB_SAV_MT128x16x128_MI16x16x1_SN_LDSB1_AFC0_GSU19_LBSPPA1024_MIWT2_1_NEPBS16_NLCA1_SPO0_SVW2_VWA2_WG64_4_1
    SolutionIndex: 178
    SolutionNameMin: Cijk_Ailk_Bljk_HF8_HHS_BH_Bias_AS_SAB_SAV_MT64x16x128_MI16x16x1_SN_LDSB0_AFC1_GSU1_LBSPPA512_MIWT1_1_NEPBS0_NLCA1_SPO1_SVW1_VWA1_WG64_4_1
    SolutionIndex: 179
    SolutionNameMin: Cijk_Ailk_Bljk_HF8_HHS_BH_Bias_AS_SAB_SAV_MT128x16x128_MI16x16x1_SN_LDSB1_AFC0_GSU4_LBSPPA1024_MIWT2_1_NEPBS16_NLCA1_SPO1_SVW2_VWA2_WG64_4_1
    SolutionIndex: 180
    SolutionNameMin: Cijk_Ailk_Bljk_HF8_HHS_BH_Bias_AS_SAB_SAV_MT128x16x128_MI16x16x1_SN_LDSB1_AFC0_GSU19_LBSPPA1024_MIWT2_1_NEPBS16_NLCA1_SPO1_SVW2_VWA2_WG64_4_1
    SolutionIndex: 181
    SolutionNameMin: Cijk_Ailk_Bljk_HF8_HHS_BH_Bias_AS_SAB_SAV_MT128x16x128_MI16x16x1_SN_LDSB1_AFC0_GSU4_LBSPPA1024_MIWT2_1_NEPBS16_NLCA1_SPO0_SVW2_VWA2_WG64_4_1
    SolutionIndex: 182
    SolutionNameMin: Cijk_Ailk_Bljk_HF8_HHS_BH_Bias_AS_SAB_SAV_MT128x16x128_MI16x16x1_SN_LDSB1_AFC0_GSU4_LBSPPA1024_MIWT2_1_NEPBS0_NLCA1_SPO0_SVW2_VWA2_WG64_4_1
    SolutionIndex: 183
    SolutionNameMin: Cijk_Ailk_Bljk_HF8_HHS_BH_Bias_AS_SAB_SAV_MT128x16x128_MI16x16x1_SN_LDSB1_AFC0_GSU12_LBSPPA1024_MIWT2_1_NEPBS0_NLCA1_SPO0_SVW2_VWA2_WG64_4_1
    SolutionIndex: 184
    SolutionNameMin: Cijk_Ailk_Bljk_HF8_HHS_BH_Bias_AS_SAB_SAV_MT64x16x128_MI16x16x1_SN_LDSB0_AFC1_GSU1_LBSPPA512_MIWT1_1_NEPBS0_NLCA1_SPO0_SVW1_VWA1_WG64_4_1
    SolutionIndex: 185
    SolutionNameMin: Cijk_Ailk_Bljk_HF8_HHS_BH_Bias_AS_SAB_SAV_MT64x16x128_MI16x16x1_SN_LDSB1_AFC0_GSU4_LBSPPA512_MIWT2_1_NEPBS16_NLCA1_SPO1_SVW2_VWA2_WG32_4_1
    SolutionIndex: 186
    SolutionNameMin: Cijk_Ailk_Bljk_HF8_HHS_BH_Bias_AS_SAB_SAV_MT64x16x128_MI16x16x1_SN_LDSB1_AFC0_GSU4_LBSPPA512_MIWT2_1_NEPBS0_NLCA1_SPO1_SVW2_VWA2_WG32_4_1
    SolutionIndex: 187
    SolutionNameMin: Cijk_Ailk_Bljk_HF8_HHS_BH_Bias_AS_SAB_SAV_MT64x16x128_MI16x16x1_SN_LDSB0_AFC0_GSU4_LBSPPA512_MIWT1_1_NEPBS0_NLCA1_SPO1_SVW1_VWA1_WG64_4_1
    SolutionIndex: 188
    SolutionNameMin: Cijk_Ailk_Bljk_HF8_HHS_BH_Bias_AS_SAB_SAV_MT64x16x128_MI16x16x1_SN_LDSB0_AFC0_GSU4_LBSPPA512_MIWT1_1_NEPBS0_NLCA1_SPO0_SVW1_VWA1_WG64_4_1
    SolutionIndex: 189
    SolutionNameMin: Cijk_Ailk_Bljk_HF8_HHS_BH_Bias_AS_SAB_SAV_MT64x16x128_MI16x16x1_SN_LDSB0_AFC1_GSU1_LBSPPA512_MIWT1_1_NEPBS16_NLCA1_SPO1_SVW1_VWA1_WG64_4_1
    SolutionIndex: 190
    SolutionNameMin: Cijk_Ailk_Bljk_HF8_HHS_BH_Bias_AS_SAB_SAV_MT192x16x128_MI16x16x1_SN_LDSB1_AFC0_GSU8_LBSPPA1536_MIWT3_1_NEPBS0_NLCA3_SPO0_SVW1_VWA1_WG64_4_1
    SolutionIndex: 191
    SolutionNameMin: Cijk_Ailk_Bljk_HF8_HHS_BH_Bias_AS_SAB_SAV_MT32x32x128_MI16x16x1_SN_LDSB0_AFC0_GRVWA8_GSU18_LBSPPA256_LBSPPB256_LPA16_MIWT1_1_NEPBS0_NLCA1_SVW1_VWA1_WG32_8_1_WGM1
    SolutionIndex: 192
    SolutionNameMin: Cijk_Ailk_Bljk_HF8_HHS_BH_Bias_AS_SAB_SAV_MT32x32x128_MI16x16x1_SN_LDSB0_AFC0_GRVWA8_GSU18_LBSPPA256_LBSPPB256_LPA16_MIWT1_1_NEPBS16_NLCA1_SVW1_VWA1_WG32_8_1_WGM1
    SolutionIndex: 193
    SolutionNameMin: Cijk_Ailk_Bljk_HF8_HHS_BH_Bias_AS_SAB_SAV_MT32x32x64_MI16x16x1_SN_LDSB0_AFC0_GRVWA8_GSU18_LBSPPA256_LBSPPB128_LPA16_MIWT1_1_NEPBS16_NLCA1_SVW1_VWA1_WG32_8_1_WGM1
    SolutionIndex: 194
    SolutionNameMin: Cijk_Ailk_Bljk_HF8_HHS_BH_Bias_AS_SAB_SAV_MT32x32x128_MI16x16x1_SN_LDSB0_AFC0_GRVWA8_GSU40_LBSPPA256_LBSPPB256_LPA16_MIWT1_1_NEPBS16_NLCA1_SVW1_VWA1_WG32_8_1_WGM20
    SolutionIndex: 195
    SolutionNameMin: Cijk_Ailk_Bljk_HF8_HHS_BH_Bias_AS_SAB_SAV_MT32x32x128_MI16x16x1_SN_LDSB0_AFC0_GRVWA8_GSU12_LBSPPA256_LBSPPB256_LPA16_MIWT1_1_NEPBS0_NLCA1_SVW1_VWA1_WG32_8_1_WGM20
    SolutionIndex: 196
    SolutionNameMin: Cijk_Ailk_Bljk_HF8_HHS_BH_Bias_AS_SAB_SAV_MT32x32x128_MI16x16x1_SN_LDSB0_AFC0_GRVWA8_GSU9_LBSPPA256_LBSPPB256_LPA16_MIWT1_1_NEPBS0_NLCA1_SVW1_VWA1_WG32_8_1_WGM20
    SolutionIndex: 197
    SolutionNameMin: Cijk_Ailk_Bljk_HF8_HHS_BH_Bias_AS_SAB_SAV_MT32x32x128_MI16x16x1_SN_LDSB0_AFC0_GRVWA8_GSU18_LBSPPA256_LBSPPB256_LPA16_MIWT1_1_NEPBS0_NLCA1_SVW1_VWA1_WG32_8_1_WGM20
    SolutionIndex: 198
    SolutionNameMin: Cijk_Ailk_Bljk_HF8_HHS_BH_Bias_AS_SAB_SAV_MT32x64x128_MI16x16x1_SN_LDSB1_AFC0_GRVWA8_GSU40_LBSPPA256_LBSPPB256_LPA16_MIWT2_1_NEPBS0_NLCA1_SVW2_VWA2_WG16_16_1_WGM1
    SolutionIndex: 199
    SolutionNameMin: Cijk_Ailk_Bljk_HF8_HHS_BH_Bias_AS_SAB_SAV_MT32x32x128_MI16x16x1_SN_LDSB0_AFC0_GRVWA8_GSU40_LBSPPA256_LBSPPB256_LPA16_MIWT1_1_NEPBS16_NLCA1_SVW1_VWA1_WG32_8_1_WGM1
    SolutionIndex: 200
    SolutionNameMin: Cijk_Ailk_Bljk_HF8_HHS_BH_Bias_AS_SAB_SAV_MT48x64x32_MI16x16x1_SN_LDSB0_AFC0_GRVWA2_GSU10_LBSPPA384_LBSPPB128_LPA16_MIWT3_1_NEPBS16_NLCA3_SVW1_VWA1_WG16_16_1_WGM20
    SolutionIndex: 201
    SolutionNameMin: Cijk_Ailk_Bljk_HF8_HHS_BH_Bias_AS_SAB_SAV_MT32x64x64_MI16x16x1_SN_LDSB0_AFC0_GRVWA8_GSU9_LBSPPA256_LBSPPB128_LPA16_MIWT2_1_NEPBS0_NLCA1_SVW2_VWA2_WG16_16_1_WGM20
    SolutionIndex: 202
    SolutionNameMin: Cijk_Ailk_Bljk_HF8_HHS_BH_Bias_AS_SAB_SAV_MT32x128x64_MI32x32x1_SN_LDSB0_AFC0_GRVWA8_GSU20_LBSPPA0_LBSPPB128_LPA0_MIWT1_1_NEPBS16_NLCA1_SVW1_VWA1_WG32_8_1_WGM20
    SolutionIndex: 203
    SolutionNameMin: Cijk_Ailk_Bljk_HF8_HHS_BH_Bias_AS_SAB_SAV_MT32x64x64_MI16x16x1_SN_LDSB0_AFC0_GRVWA8_GSU18_LBSPPA256_LBSPPB128_LPA16_MIWT2_1_NEPBS0_NLCA1_SVW2_VWA2_WG16_16_1_WGM20
    SolutionIndex: 204
    SolutionNameMin: Cijk_Ailk_Bljk_HF8_HHS_BH_Bias_AS_SAB_SAV_MT32x32x128_MI16x16x1_SN_LDSB0_AFC0_GRVWA8_GSU35_LBSPPA256_LBSPPB256_LPA16_MIWT1_1_NEPBS0_NLCA1_SVW1_VWA1_WG32_8_1_WGM20
    SolutionIndex: 205
    SolutionNameMin: Cijk_Ailk_Bljk_HF8_HHS_BH_Bias_AS_SAB_SAV_MT32x32x128_MI16x16x1_SN_LDSB0_AFC1_GRVWA8_GSU1_LBSPPA256_LBSPPB256_LPA16_MIWT1_1_NEPBS16_NLCA1_SVW1_VWA1_WG32_8_1_WGM1
    SolutionIndex: 206
    SolutionNameMin: Cijk_Ailk_Bljk_HF8_HHS_BH_Bias_AS_SAB_SAV_MT32x64x128_MI16x16x1_SN_LDSB1_AFC0_GRVWA8_GSU10_LBSPPA256_LBSPPB256_LPA16_MIWT2_1_NEPBS16_NLCA1_SVW2_VWA2_WG16_16_1_WGM20
    SolutionIndex: 207
    SolutionNameMin: Cijk_Ailk_Bljk_HF8_HHS_BH_Bias_AS_SAB_SAV_MT32x128x64_MI32x32x1_SN_LDSB0_AFC0_GRVWA8_GSU20_LBSPPA0_LBSPPB128_LPA0_MIWT1_1_NEPBS0_NLCA1_SVW1_VWA1_WG32_8_1_WGM1
    SolutionIndex: 208
    SolutionNameMin: Cijk_Ailk_Bljk_HF8_HHS_BH_Bias_AS_SAB_SAV_MT32x128x64_MI32x32x1_SN_LDSB0_AFC0_GRVWA8_GSU20_LBSPPA0_LBSPPB128_LPA0_MIWT1_1_NEPBS16_NLCA1_SVW1_VWA1_WG32_8_1_WGM1
    SolutionIndex: 209
    SolutionNameMin: Cijk_Ailk_Bljk_HF8_HHS_BH_Bias_AS_SAB_SAV_MT32x96x128_MI16x16x1_SN_LDSB1_AFC0_GRVWA8_GSU40_LBSPPA256_LBSPPB256_LPA16_MIWT1_3_NEPBS0_NLCA1_SVW1_VWA1_WG32_8_1_WGM20
    SolutionIndex: 210
    SolutionNameMin: Cijk_Ailk_Bljk_HF8_HHS_BH_Bias_AS_SAB_SAV_MT32x32x128_MI16x16x1_SN_LDSB0_AFC1_GRVWA8_GSU1_LBSPPA256_LBSPPB256_LPA16_MIWT1_1_NEPBS16_NLCA1_SVW1_VWA1_WG32_8_1_WGM20
    SolutionIndex: 211
    SolutionNameMin: Cijk_Ailk_Bljk_HF8_HHS_BH_Bias_AS_SAB_SAV_MT32x128x64_MI32x32x1_SN_LDSB0_AFC0_GRVWA8_GSU12_LBSPPA0_LBSPPB128_LPA0_MIWT1_1_NEPBS0_NLCA1_SVW1_VWA1_WG32_8_1_WGM20
    SolutionIndex: 212
    SolutionNameMin: Cijk_Ailk_Bljk_HF8_HHS_BH_Bias_AS_SAB_SAV_MT32x128x64_MI32x32x1_SN_LDSB0_AFC0_GRVWA8_GSU12_LBSPPA0_LBSPPB128_LPA0_MIWT1_1_NEPBS16_NLCA1_SVW1_VWA1_WG32_8_1_WGM1
    SolutionIndex: 213
    SolutionNameMin: Cijk_Ailk_Bljk_HF8_HHS_BH_Bias_AS_SAB_SAV_MT32x128x64_MI32x32x1_SN_LDSB0_AFC0_GRVWA8_GSU20_LBSPPA0_LBSPPB128_LPA0_MIWT1_1_NEPBS0_NLCA1_SVW1_VWA1_WG32_8_1_WGM20
    SolutionIndex: 214
    SolutionNameMin: Cijk_Ailk_Bljk_HF8_HHS_BH_Bias_AS_SAB_SAV_MT32x192x128_MI16x16x1_SN_LDSB1_AFC0_GRVWA8_GSU40_LBSPPA256_LBSPPB256_LPA16_MIWT2_3_NEPBS16_NLCA1_SVW2_VWA2_WG16_16_1_WGM1
    SolutionIndex: 215
    SolutionNameMin: Cijk_Ailk_Bljk_HF8_HHS_BH_Bias_AS_SAB_SAV_MT32x96x64_MI16x16x1_SN_LDSB1_AFC0_GRVWA8_GSU9_LBSPPA256_LBSPPB128_LPA16_MIWT1_3_NEPBS16_NLCA1_SVW1_VWA1_WG32_8_1_WGM1
    SolutionIndex: 216
    SolutionNameMin: Cijk_Ailk_Bljk_HF8_HHS_BH_Bias_AS_SAB_SAV_MT32x64x128_MI16x16x1_SN_LDSB1_AFC0_GRVWA8_GSU9_LBSPPA256_LBSPPB256_LPA16_MIWT2_1_NEPBS0_NLCA1_SVW2_VWA2_WG16_16_1_WGM20
    SolutionIndex: 217
    SolutionNameMin: Cijk_Ailk_Bljk_HF8_HHS_BH_Bias_AS_SAB_SAV_MT32x192x128_MI16x16x1_SN_LDSB1_AFC0_GRVWA8_GSU18_LBSPPA256_LBSPPB256_LPA16_MIWT2_3_NEPBS16_NLCA1_SVW2_VWA2_WG16_16_1_WGM1
    SolutionIndex: 218
    SolutionNameMin: Cijk_Ailk_Bljk_HF8_HHS_BH_Bias_AS_SAB_SAV_MT32x192x128_MI16x16x1_SN_LDSB1_AFC0_GRVWA8_GSU40_LBSPPA256_LBSPPB256_LPA16_MIWT2_3_NEPBS0_NLCA1_SVW2_VWA2_WG16_16_1_WGM1
    SolutionIndex: 219
    SolutionNameMin: Cijk_Ailk_Bljk_HF8_HHS_BH_Bias_AS_SAB_SAV_MT32x128x64_MI32x32x1_SN_LDSB0_AFC0_GRVWA8_GSU8_LBSPPA0_LBSPPB128_LPA0_MIWT1_1_NEPBS0_NLCA1_SVW1_VWA1_WG32_8_1_WGM20
    SolutionIndex: 220
    SolutionNameMin: Cijk_Ailk_Bljk_HF8_HHS_BH_Bias_AS_SAB_SAV_MT32x64x64_MI16x16x1_SN_LDSB0_AFC0_GRVWA8_GSU8_LBSPPA256_LBSPPB128_LPA16_MIWT2_1_NEPBS0_NLCA1_SVW2_VWA2_WG16_16_1_WGM20
    SolutionIndex: 221
    SolutionNameMin: Cijk_Ailk_Bljk_HF8_HHS_BH_Bias_AS_SAB_SAV_MT32x64x64_MI16x16x1_SN_LDSB0_AFC0_GRVWA8_GSU10_LBSPPA256_LBSPPB128_LPA16_MIWT2_1_NEPBS0_NLCA1_SVW2_VWA2_WG16_16_1_WGM1
    SolutionIndex: 222
    SolutionNameMin: Cijk_Ailk_Bljk_HF8_HHS_BH_Bias_AS_SAB_SAV_MT32x192x128_MI16x16x1_SN_LDSB1_AFC0_GRVWA8_GSU30_LBSPPA256_LBSPPB256_LPA16_MIWT2_3_NEPBS16_NLCA1_SVW2_VWA2_WG16_16_1_WGM1
    SolutionIndex: 223
    SolutionNameMin: Cijk_Ailk_Bljk_HF8_HHS_BH_Bias_AS_SAB_SAV_MT32x32x128_MI16x16x1_SN_LDSB0_AFC1_GRVWA8_GSU1_LBSPPA256_LBSPPB256_LPA16_MIWT1_1_NEPBS0_NLCA1_SVW1_VWA1_WG32_8_1_WGM1
    SolutionIndex: 224
    SolutionNameMin: Cijk_Ailk_Bljk_HF8_HHS_BH_Bias_AS_SAB_SAV_MT32x128x64_MI32x32x1_SN_LDSB0_AFC0_GRVWA8_GSU8_LBSPPA0_LBSPPB128_LPA0_MIWT1_1_NEPBS16_NLCA1_SVW1_VWA1_WG32_8_1_WGM20
    SolutionIndex: 225
    SolutionNameMin: Cijk_Ailk_Bljk_HF8_HHS_BH_Bias_AS_SAB_SAV_MT32x96x128_MI16x16x1_SN_LDSB1_AFC0_GRVWA8_GSU9_LBSPPA256_LBSPPB256_LPA16_MIWT1_3_NEPBS0_NLCA1_SVW1_VWA1_WG32_8_1_WGM1
    SolutionIndex: 226
    SolutionNameMin: Cijk_Ailk_Bljk_HF8_HHS_BH_Bias_AS_SAB_SAV_MT32x192x128_MI16x16x1_SN_LDSB1_AFC0_GRVWA8_GSU20_LBSPPA256_LBSPPB256_LPA16_MIWT2_3_NEPBS0_NLCA1_SVW2_VWA2_WG16_16_1_WGM20
    SolutionIndex: 227
    SolutionNameMin: Cijk_Ailk_Bljk_HF8_HHS_BH_Bias_AS_SAB_SAV_MT32x64x64_MI16x16x1_SN_LDSB0_AFC1_GRVWA8_GSU1_LBSPPA256_LBSPPB128_LPA16_MIWT2_1_NEPBS16_NLCA1_SVW2_VWA2_WG16_16_1_WGM1
    SolutionIndex: 228
    SolutionNameMin: Cijk_Ailk_Bljk_HF8_HHS_BH_Bias_AS_SAB_SAV_MT32x192x128_MI16x16x1_SN_LDSB1_AFC0_GRVWA8_GSU10_LBSPPA256_LBSPPB256_LPA16_MIWT2_3_NEPBS16_NLCA1_SVW2_VWA2_WG16_16_1_WGM20
    SolutionIndex: 229
    SolutionNameMin: Cijk_Ailk_Bljk_HF8_HHS_BH_Bias_AS_SAB_SAV_MT32x192x128_MI16x16x1_SN_LDSB1_AFC0_GRVWA8_GSU8_LBSPPA256_LBSPPB256_LPA16_MIWT2_3_NEPBS16_NLCA1_SVW2_VWA2_WG16_16_1_WGM1
    SolutionIndex: 230
    SolutionNameMin: Cijk_Ailk_Bljk_HF8_HHS_BH_Bias_AS_SAB_SAV_MT32x192x128_MI16x16x1_SN_LDSB1_AFC0_GRVWA8_GSU8_LBSPPA256_LBSPPB256_LPA16_MIWT2_3_NEPBS0_NLCA1_SVW2_VWA2_WG16_16_1_WGM1
    SolutionIndex: 231
    SolutionNameMin: Cijk_Ailk_Bljk_HF8_HHS_BH_Bias_AS_SAB_SAV_MT32x32x128_MI16x16x1_SN_LDSB0_AFC1_GRVWA8_GSU1_LBSPPA256_LBSPPB256_LPA16_MIWT1_1_NEPBS0_NLCA1_SVW1_VWA1_WG32_8_1_WGM20
    SolutionIndex: 232
    SolutionNameMin: Cijk_Ailk_Bljk_HF8_HHS_BH_Bias_AS_SAB_SAV_MT32x192x128_MI16x16x1_SN_LDSB1_AFC0_GRVWA8_GSU4_LBSPPA256_LBSPPB256_LPA16_MIWT2_3_NEPBS16_NLCA1_SVW2_VWA2_WG16_16_1_WGM1
    SolutionIndex: 233
    SolutionNameMin: Cijk_Ailk_Bljk_HF8_HHS_BH_Bias_AS_SAB_SAV_MT32x96x128_MI16x16x1_SN_LDSB1_AFC0_GRVWA8_GSU4_LBSPPA256_LBSPPB256_LPA16_MIWT1_3_NEPBS16_NLCA1_SVW1_VWA1_WG32_8_1_WGM20
    SolutionIndex: 234
    SolutionNameMin: Cijk_Ailk_Bljk_HF8_HHS_BH_Bias_AS_SAB_SAV_MT32x128x64_MI32x32x1_SN_LDSB0_AFC1_GRVWA8_GSU1_LBSPPA0_LBSPPB128_LPA0_MIWT1_1_NEPBS0_NLCA1_SVW1_VWA1_WG32_8_1_WGM20
    SolutionIndex: 235
    SolutionNameMin: Cijk_Ailk_Bljk_HF8_HHS_BH_Bias_AS_SAB_SAV_MT32x192x128_MI16x16x1_SN_LDSB1_AFC0_GRVWA8_GSU12_LBSPPA256_LBSPPB256_LPA16_MIWT2_3_NEPBS0_NLCA1_SVW2_VWA2_WG16_16_1_WGM1
    SolutionIndex: 236
    SolutionNameMin: Cijk_Ailk_Bljk_HF8_HHS_BH_Bias_AS_SAB_SAV_MT32x128x64_MI32x32x1_SN_LDSB0_AFC1_GRVWA8_GSU1_LBSPPA0_LBSPPB128_LPA0_MIWT1_1_NEPBS16_NLCA1_SVW1_VWA1_WG32_8_1_WGM20
    SolutionIndex: 237
    SolutionNameMin: Cijk_Ailk_Bljk_HF8_HHS_BH_Bias_AS_SAB_SAV_MT32x64x128_MI16x16x1_SN_LDSB1_AFC1_GRVWA8_GSU1_LBSPPA256_LBSPPB256_LPA16_MIWT2_1_NEPBS16_NLCA1_SVW2_VWA2_WG16_16_1_WGM1
    SolutionIndex: 238
    SolutionNameMin: Cijk_Ailk_Bljk_HF8_HHS_BH_Bias_AS_SAB_SAV_MT32x64x128_MI16x16x1_SN_LDSB1_AFC1_GRVWA8_GSU1_LBSPPA256_LBSPPB256_LPA16_MIWT2_1_NEPBS0_NLCA1_SVW2_VWA2_WG16_16_1_WGM1
    SolutionIndex: 239
    SolutionNameMin: Cijk_Ailk_Bljk_HF8_HHS_BH_Bias_AS_SAB_SAV_MT32x64x128_MI16x16x1_SN_LDSB1_AFC1_GRVWA8_GSU1_LBSPPA256_LBSPPB256_LPA16_MIWT2_1_NEPBS0_NLCA1_SVW2_VWA2_WG16_16_1_WGM20
    SolutionIndex: 240
    SolutionNameMin: Cijk_Ailk_Bljk_HF8_HHS_BH_Bias_AS_SAB_SAV_MT32x192x128_MI16x16x1_SN_LDSB1_AFC0_GRVWA8_GSU9_LBSPPA256_LBSPPB256_LPA16_MIWT2_3_NEPBS16_NLCA1_SVW2_VWA2_WG16_16_1_WGM20
    SolutionIndex: 241
    SolutionNameMin: Cijk_Ailk_Bljk_HF8_HHS_BH_Bias_AS_SAB_SAV_MT32x32x64_MI16x16x1_SN_LDSB0_AFC0_GRVWA8_GSU10_LBSPPA256_LBSPPB128_LPA16_MIWT1_1_NEPBS0_NLCA1_SVW1_VWA1_WG32_8_1_WGM20
    SolutionIndex: 242
    SolutionNameMin: Cijk_Ailk_Bljk_HF8_HHS_BH_Bias_AS_SAB_SAV_MT32x32x128_MI16x16x1_SN_LDSB0_AFC0_GRVWA8_GSU12_LBSPPA256_LBSPPB256_LPA16_MIWT1_1_NEPBS16_NLCA1_SVW1_VWA1_WG32_8_1_WGM20
    SolutionIndex: 243
    SolutionNameMin: Cijk_Ailk_Bljk_HF8_HHS_BH_Bias_AS_SAB_SAV_MT64x32x64_MI16x16x1_SN_LDSB0_AFC0_GRVWA8_GSU25_LBSPPA512_LBSPPB128_LPA16_MIWT2_1_NEPBS16_NLCA1_SVW2_VWA2_WG32_8_1_WGM20
    SolutionIndex: 244
    SolutionNameMin: Cijk_Ailk_Bljk_HF8_HHS_BH_Bias_AS_SAB_SAV_MT64x32x64_MI16x16x1_SN_LDSB0_AFC0_GRVWA8_GSU25_LBSPPA512_LBSPPB128_LPA16_MIWT2_1_NEPBS0_NLCA1_SVW2_VWA2_WG32_8_1_WGM20
    SolutionIndex: 245
    SolutionNameMin: Cijk_Ailk_Bljk_HF8_HHS_BH_Bias_AS_SAB_SAV_MT64x64x64_MI32x32x1_SN_LDSB0_AFC0_GRVWA8_GSU12_LBSPPA0_LBSPPB128_LPA0_MIWT1_1_NEPBS0_NLCA1_SVW1_VWA1_WG64_4_1_WGM20
    SolutionIndex: 246
    SolutionNameMin: Cijk_Ailk_Bljk_HF8_HHS_BH_Bias_AS_SAB_SAV_MT64x64x32_MI32x32x1_SN_LDSB0_AFC0_GRVWA8_GSU18_LBSPPA0_LBSPPB128_LPA0_MIWT1_1_NEPBS0_NLCA1_SVW1_VWA1_WG64_4_1_WGM20
    SolutionIndex: 247
    SolutionNameMin: Cijk_Ailk_Bljk_HF8_HHS_BH_Bias_AS_SAB_SAV_MT64x64x64_MI32x32x1_SN_LDSB0_AFC0_GRVWA8_GSU18_LBSPPA0_LBSPPB128_LPA0_MIWT1_1_NEPBS16_NLCA1_SVW1_VWA1_WG64_4_1_WGM20
    SolutionIndex: 248
    SolutionNameMin: Cijk_Ailk_Bljk_HF8_HHS_BH_Bias_AS_SAB_SAV_MT64x64x64_MI32x32x1_SN_LDSB0_AFC0_GRVWA8_GSU25_LBSPPA0_LBSPPB128_LPA0_MIWT1_1_NEPBS16_NLCA1_SVW1_VWA1_WG64_4_1_WGM1
    SolutionIndex: 249
    SolutionNameMin: Cijk_Ailk_Bljk_HF8_HHS_BH_Bias_AS_SAB_SAV_MT64x32x64_MI16x16x1_SN_LDSB0_AFC0_GRVWA8_GSU40_LBSPPA512_LBSPPB128_LPA16_MIWT2_1_NEPBS0_NLCA1_SVW2_VWA2_WG32_8_1_WGM20
    SolutionIndex: 250
    SolutionNameMin: Cijk_Ailk_Bljk_HF8_HHS_BH_Bias_AS_SAB_SAV_MT64x16x128_MI16x16x1_SN_LDSB0_AFC1_GRVWA8_GSU1_LBSPPA512_LBSPPB256_LPA16_MIWT1_1_NEPBS0_NLCA1_SVW1_VWA1_WG64_4_1_WGM1
    SolutionIndex: 251
    SolutionNameMin: Cijk_Ailk_Bljk_HF8_HHS_BH_Bias_AS_SAB_SAV_MT64x64x32_MI32x32x1_SN_LDSB0_AFC0_GRVWA8_GSU12_LBSPPA0_LBSPPB128_LPA0_MIWT1_1_NEPBS16_NLCA1_SVW1_VWA1_WG64_4_1_WGM1
    SolutionIndex: 252
    SolutionNameMin: Cijk_Ailk_Bljk_HF8_HHS_BH_Bias_AS_SAB_SAV_MT64x64x64_MI32x32x1_SN_LDSB0_AFC0_GRVWA8_GSU20_LBSPPA0_LBSPPB128_LPA0_MIWT1_1_NEPBS16_NLCA1_SVW1_VWA1_WG64_4_1_WGM1
    SolutionIndex: 253
    SolutionNameMin: Cijk_Ailk_Bljk_HF8_HHS_BH_Bias_AS_SAB_SAV_MT64x64x64_MI32x32x1_SN_LDSB0_AFC0_GRVWA8_GSU40_LBSPPA0_LBSPPB128_LPA0_MIWT1_1_NEPBS16_NLCA1_SVW1_VWA1_WG64_4_1_WGM1
    SolutionIndex: 254
    SolutionNameMin: Cijk_Ailk_Bljk_HF8_HHS_BH_Bias_AS_SAB_SAV_MT64x32x64_MI16x16x1_SN_LDSB0_AFC0_GRVWA8_GSU9_LBSPPA512_LBSPPB128_LPA16_MIWT2_1_NEPBS0_NLCA1_SVW2_VWA2_WG32_8_1_WGM20
    SolutionIndex: 255
    SolutionNameMin: Cijk_Ailk_Bljk_HF8_HHS_BH_Bias_AS_SAB_SAV_MT64x64x64_MI32x32x1_SN_LDSB0_AFC0_GRVWA8_GSU12_LBSPPA0_LBSPPB128_LPA0_MIWT1_1_NEPBS16_NLCA1_SVW1_VWA1_WG64_4_1_WGM1
    SolutionIndex: 256
    SolutionNameMin: Cijk_Ailk_Bljk_HF8_HHS_BH_Bias_AS_SAB_SAV_MT64x128x128_MI32x32x1_SN_LDSB1_AFC0_GRVWA8_GSU25_LBSPPA0_LBSPPB256_LPA0_MIWT2_1_NEPBS0_NLCA1_SVW2_VWA2_WG32_8_1_WGM20
    SolutionIndex: 257
    SolutionNameMin: Cijk_Ailk_Bljk_HF8_HHS_BH_Bias_AS_SAB_SAV_MT64x128x128_MI32x32x1_SN_LDSB1_AFC0_GRVWA8_GSU40_LBSPPA0_LBSPPB256_LPA0_MIWT2_1_NEPBS16_NLCA1_SVW2_VWA2_WG32_8_1_WGM1
    SolutionIndex: 258
    SolutionNameMin: Cijk_Ailk_Bljk_HF8_HHS_BH_Bias_AS_SAB_SAV_MT64x128x32_MI32x32x1_SN_LDSB0_AFC0_GRVWA8_GSU12_LBSPPA0_LBSPPB128_LPA0_MIWT2_1_NEPBS0_NLCA1_SVW2_VWA2_WG32_8_1_WGM1
    SolutionIndex: 259
    SolutionNameMin: Cijk_Ailk_Bljk_HF8_HHS_BH_Bias_AS_SAB_SAV_MT64x64x64_MI32x32x1_SN_LDSB0_AFC0_GRVWA8_GSU8_LBSPPA0_LBSPPB128_LPA0_MIWT1_1_NEPBS16_NLCA1_SVW1_VWA1_WG64_4_1_WGM20
    SolutionIndex: 260
    SolutionNameMin: Cijk_Ailk_Bljk_HF8_HHS_BH_Bias_AS_SAB_SAV_MT64x128x128_MI32x32x1_SN_LDSB1_AFC0_GRVWA8_GSU20_LBSPPA0_LBSPPB256_LPA0_MIWT2_1_NEPBS16_NLCA1_SVW2_VWA2_WG32_8_1_WGM20
    SolutionIndex: 261
    SolutionNameMin: Cijk_Ailk_Bljk_HF8_HHS_BH_Bias_AS_SAB_SAV_MT64x96x64_MI16x16x1_SN_LDSB1_AFC0_GRVWA8_GSU8_LBSPPA512_LBSPPB128_LPA16_MIWT2_3_NEPBS16_NLCA1_SVW2_VWA2_WG32_8_1_WGM20
    SolutionIndex: 262
    SolutionNameMin: Cijk_Ailk_Bljk_HF8_HHS_BH_Bias_AS_SAB_SAV_MT64x64x64_MI32x32x1_SN_LDSB0_AFC0_GRVWA8_GSU8_LBSPPA0_LBSPPB128_LPA0_MIWT1_1_NEPBS16_NLCA1_SVW1_VWA1_WG64_4_1_WGM1
    SolutionIndex: 263
    SolutionNameMin: Cijk_Ailk_Bljk_HF8_HHS_BH_Bias_AS_SAB_SAV_MT64x128x128_MI32x32x1_SN_LDSB1_AFC0_GRVWA8_GSU12_LBSPPA0_LBSPPB256_LPA0_MIWT2_1_NEPBS16_NLCA1_SVW2_VWA2_WG32_8_1_WGM20
    SolutionIndex: 264
    SolutionNameMin: Cijk_Ailk_Bljk_HF8_HHS_BH_Bias_AS_SAB_SAV_MT64x160x128_MI16x16x1_SN_LDSB1_AFC0_GRVWA8_GSU35_LBSPPA512_LBSPPB256_LPA16_MIWT2_5_NEPBS16_NLCA1_SVW2_VWA2_WG32_8_1_WGM20
    SolutionIndex: 265
    SolutionNameMin: Cijk_Ailk_Bljk_HF8_HHS_BH_Bias_AS_SAB_SAV_MT64x128x128_MI32x32x1_SN_LDSB1_AFC0_GRVWA8_GSU8_LBSPPA0_LBSPPB256_LPA0_MIWT2_1_NEPBS16_NLCA1_SVW2_VWA2_WG32_8_1_WGM20
    SolutionIndex: 266
    SolutionNameMin: Cijk_Ailk_Bljk_HF8_HHS_BH_Bias_AS_SAB_SAV_MT64x128x64_MI32x32x1_SN_LDSB1_AFC0_GRVWA8_GSU20_LBSPPA0_LBSPPB128_LPA0_MIWT2_1_NEPBS0_NLCA1_SVW2_VWA2_WG32_8_1_WGM20
    SolutionIndex: 267
    SolutionNameMin: Cijk_Ailk_Bljk_HF8_HHS_BH_Bias_AS_SAB_SAV_MT64x96x128_MI16x16x1_SN_LDSB1_AFC0_GRVWA8_GSU20_LBSPPA512_LBSPPB256_LPA16_MIWT2_3_NEPBS16_NLCA1_SVW2_VWA2_WG32_8_1_WGM20
    SolutionIndex: 268
    SolutionNameMin: Cijk_Ailk_Bljk_HF8_HHS_BH_Bias_AS_SAB_SAV_MT64x32x128_MI16x16x1_SN_LDSB1_AFC1_GRVWA8_GSU1_LBSPPA512_LBSPPB256_LPA16_MIWT2_1_NEPBS16_NLCA1_SVW2_VWA2_WG32_8_1_WGM1
    SolutionIndex: 269
    SolutionNameMin: Cijk_Ailk_Bljk_HF8_HHS_BH_Bias_AS_SAB_SAV_MT64x16x128_MI16x16x1_SN_LDSB0_AFC1_GRVWA8_GSU1_LBSPPA512_LBSPPB256_LPA16_MIWT1_1_NEPBS16_NLCA1_SVW1_VWA1_WG64_4_1_WGM20
    SolutionIndex: 270
    SolutionNameMin: Cijk_Ailk_Bljk_HF8_HHS_BH_Bias_AS_SAB_SAV_MT64x128x128_MI32x32x1_SN_LDSB1_AFC0_GRVWA8_GSU8_LBSPPA0_LBSPPB256_LPA0_MIWT2_1_NEPBS0_NLCA1_SVW2_VWA2_WG32_8_1_WGM20
    SolutionIndex: 271
    SolutionNameMin: Cijk_Ailk_Bljk_HF8_HHS_BH_Bias_AS_SAB_SAV_MT64x128x128_MI32x32x1_SN_LDSB1_AFC0_GRVWA8_GSU10_LBSPPA0_LBSPPB256_LPA0_MIWT2_1_NEPBS0_NLCA1_SVW2_VWA2_WG32_8_1_WGM20
    SolutionIndex: 272
    SolutionNameMin: Cijk_Ailk_Bljk_HF8_HHS_BH_Bias_AS_SAB_SAV_MT64x64x64_MI32x32x1_SN_LDSB0_AFC1_GRVWA8_GSU1_LBSPPA0_LBSPPB128_LPA0_MIWT1_1_NEPBS0_NLCA1_SVW1_VWA1_WG64_4_1_WGM20
    SolutionIndex: 273
    SolutionNameMin: Cijk_Ailk_Bljk_HF8_HHS_BH_Bias_AS_SAB_SAV_MT64x32x64_MI16x16x1_SN_LDSB0_AFC1_GRVWA8_GSU1_LBSPPA512_LBSPPB128_LPA16_MIWT2_1_NEPBS0_NLCA1_SVW2_VWA2_WG32_8_1_WGM20
    SolutionIndex: 274
    SolutionNameMin: Cijk_Ailk_Bljk_HF8_HHS_BH_Bias_AS_SAB_SAV_MT64x128x128_MI32x32x1_SN_LDSB1_AFC0_GRVWA8_GSU4_LBSPPA0_LBSPPB256_LPA0_MIWT2_1_NEPBS16_NLCA1_SVW2_VWA2_WG32_8_1_WGM20
    SolutionIndex: 275
    SolutionNameMin: Cijk_Ailk_Bljk_HF8_HHS_BH_Bias_AS_SAB_SAV_MT64x160x128_MI16x16x1_SN_LDSB1_AFC0_GRVWA8_GSU8_LBSPPA512_LBSPPB256_LPA16_MIWT2_5_NEPBS16_NLCA1_SVW2_VWA2_WG32_8_1_WGM1
    SolutionIndex: 276
    SolutionNameMin: Cijk_Ailk_Bljk_HF8_HHS_BH_Bias_AS_SAB_SAV_MT64x64x64_MI32x32x1_SN_LDSB0_AFC1_GRVWA8_GSU1_LBSPPA0_LBSPPB128_LPA0_MIWT1_1_NEPBS16_NLCA1_SVW1_VWA1_WG64_4_1_WGM1
    SolutionIndex: 277
    SolutionNameMin: Cijk_Ailk_Bljk_HF8_HHS_BH_Bias_AS_SAB_SAV_MT64x128x128_MI32x32x1_SN_LDSB1_AFC0_GRVWA8_GSU4_LBSPPA0_LBSPPB256_LPA0_MIWT2_1_NEPBS16_NLCA1_SVW2_VWA2_WG32_8_1_WGM1
    SolutionIndex: 278
    SolutionNameMin: Cijk_Ailk_Bljk_HF8_HHS_BH_Bias_AS_SAB_SAV_MT64x96x128_MI16x16x1_SN_LDSB1_AFC0_GRVWA8_GSU4_LBSPPA512_LBSPPB256_LPA16_MIWT2_3_NEPBS0_NLCA1_SVW2_VWA2_WG32_8_1_WGM20
    SolutionIndex: 279
    SolutionNameMin: Cijk_Ailk_Bljk_HF8_HHS_BH_Bias_AS_SAB_SAV_MT64x64x64_MI32x32x1_SN_LDSB0_AFC1_GRVWA8_GSU1_LBSPPA0_LBSPPB128_LPA0_MIWT1_1_NEPBS16_NLCA1_SVW1_VWA1_WG64_4_1_WGM20
    SolutionIndex: 280
    SolutionNameMin: Cijk_Ailk_Bljk_HF8_HHS_BH_Bias_AS_SAB_SAV_MT64x32x128_MI16x16x1_SN_LDSB1_AFC1_GRVWA8_GSU1_LBSPPA512_LBSPPB256_LPA16_MIWT2_1_NEPBS0_NLCA1_SVW2_VWA2_WG32_8_1_WGM1
    SolutionIndex: 281
    SolutionNameMin: Cijk_Ailk_Bljk_HF8_HHS_BH_Bias_AS_SAB_SAV_MT64x32x64_MI16x16x1_SN_LDSB0_AFC1_GRVWA8_GSU1_LBSPPA512_LBSPPB128_LPA16_MIWT2_1_NEPBS0_NLCA1_SVW2_VWA2_WG32_8_1_WGM1
    SolutionIndex: 282
    SolutionNameMin: Cijk_Ailk_Bljk_HF8_HHS_BH_Bias_AS_SAB_SAV_MT64x128x128_MI32x32x1_SN_LDSB1_AFC1_GRVWA8_GSU1_LBSPPA0_LBSPPB256_LPA0_MIWT2_1_NEPBS0_NLCA1_SVW2_VWA2_WG32_8_1_WGM20
    SolutionIndex: 283
    SolutionNameMin: Cijk_Ailk_Bljk_HF8_HHS_BH_Bias_AS_SAB_SAV_MT64x128x128_MI32x32x1_SN_LDSB1_AFC1_GRVWA8_GSU1_LBSPPA0_LBSPPB256_LPA0_MIWT2_1_NEPBS16_NLCA1_SVW2_VWA2_WG32_8_1_WGM20
    SolutionIndex: 284
    SolutionNameMin: Cijk_Ailk_Bljk_HF8_HHS_BH_Bias_AS_SAB_SAV_MT64x48x128_MI16x16x1_SN_LDSB1_AFC1_GRVWA8_GSU1_LBSPPA512_LBSPPB256_LPA16_MIWT1_3_NEPBS0_NLCA1_SVW1_VWA1_WG64_4_1_WGM1
    SolutionIndex: 285
    SolutionNameMin: Cijk_Ailk_Bljk_HF8_HHS_BH_Bias_AS_SAB_SAV_MT64x48x128_MI16x16x1_SN_LDSB1_AFC1_GRVWA8_GSU1_LBSPPA512_LBSPPB256_LPA16_MIWT1_3_NEPBS16_NLCA1_SVW1_VWA1_WG64_4_1_WGM1
    SolutionIndex: 286
    SolutionNameMin: Cijk_Ailk_Bljk_HF8_HHS_BH_Bias_AS_SAB_SAV_MT64x160x128_MI16x16x1_SN_LDSB1_AFC0_GRVWA8_GSU10_LBSPPA512_LBSPPB256_LPA16_MIWT2_5_NEPBS16_NLCA1_SVW2_VWA2_WG32_8_1_WGM20
    SolutionIndex: 287
    SolutionNameMin: Cijk_Ailk_Bljk_HF8_HHS_BH_Bias_AS_SAB_SAV_MT64x32x64_MI16x16x1_SN_LDSB0_AFC0_GRVWA8_GSU10_LBSPPA512_LBSPPB128_LPA16_MIWT2_1_NEPBS16_NLCA1_SVW2_VWA2_WG32_8_1_WGM20
    SolutionIndex: 288
    SolutionNameMin: Cijk_Ailk_Bljk_HF8_HHS_BH_Bias_AS_SAB_SAV_MT128x32x64_MI32x32x1_SN_LDSB0_AFC0_GRVWA8_GSU20_LBSPPA0_LBSPPB128_LPA0_MIWT1_1_NEPBS0_NLCA1_SVW1_VWA1_WG128_2_1_WGM20
    SolutionIndex: 289
    SolutionNameMin: Cijk_Ailk_Bljk_HF8_HHS_BH_Bias_AS_SAB_SAV_MT128x32x64_MI32x32x1_SN_LDSB0_AFC0_GRVWA8_GSU25_LBSPPA0_LBSPPB128_LPA0_MIWT1_1_NEPBS0_NLCA1_SVW1_VWA1_WG128_2_1_WGM20
    SolutionIndex: 290
    SolutionNameMin: Cijk_Ailk_Bljk_HF8_HHS_BH_Bias_AS_SAB_SAV_MT32x32x128_MI16x16x1_SN_LDSB0_AFC0_GRVWA8_GSU35_LBSPPA256_LBSPPB256_LPA16_MIWT1_1_NEPBS16_NLCA1_SVW1_VWA1_WG32_8_1_WGM20
    SolutionIndex: 291
    SolutionNameMin: Cijk_Ailk_Bljk_HF8_HHS_BH_Bias_AS_SAB_SAV_MT128x32x64_MI32x32x1_SN_LDSB0_AFC0_GRVWA8_GSU12_LBSPPA0_LBSPPB128_LPA0_MIWT1_1_NEPBS16_NLCA1_SVW1_VWA1_WG128_2_1_WGM20
    SolutionIndex: 292
    SolutionNameMin: Cijk_Ailk_Bljk_HF8_HHS_BH_Bias_AS_SAB_SAV_MT128x64x32_MI32x32x1_SN_LDSB0_AFC0_GRVWA8_GSU35_LBSPPA0_LBSPPB128_LPA0_MIWT2_1_NEPBS0_NLCA1_SVW2_VWA2_WG64_4_1_WGM20
    SolutionIndex: 293
    SolutionNameMin: Cijk_Ailk_Bljk_HF8_HHS_BH_Bias_AS_SAB_SAV_MT128x64x128_MI32x32x1_SN_LDSB1_AFC0_GRVWA8_GSU25_LBSPPA0_LBSPPB256_LPA0_MIWT2_1_NEPBS0_NLCA1_SVW2_VWA2_WG64_4_1_WGM20
    SolutionIndex: 294
    SolutionNameMin: Cijk_Ailk_Bljk_HF8_HHS_BH_Bias_AS_SAB_SAV_MT128x64x128_MI32x32x1_SN_LDSB1_AFC0_GRVWA8_GSU40_LBSPPA0_LBSPPB256_LPA0_MIWT2_1_NEPBS0_NLCA1_SVW2_VWA2_WG64_4_1_WGM1
    SolutionIndex: 295
    SolutionNameMin: Cijk_Ailk_Bljk_HF8_HHS_BH_Bias_AS_SAB_SAV_MT128x32x64_MI32x32x1_SN_LDSB0_AFC0_GRVWA8_GSU12_LBSPPA0_LBSPPB128_LPA0_MIWT1_1_NEPBS0_NLCA1_SVW1_VWA1_WG128_2_1_WGM20
    SolutionIndex: 296
    SolutionNameMin: Cijk_Ailk_Bljk_HF8_HHS_BH_Bias_AS_SAB_SAV_MT128x64x64_MI32x32x1_SN_LDSB1_AFC0_GRVWA8_GSU25_LBSPPA0_LBSPPB128_LPA0_MIWT2_1_NEPBS16_NLCA1_SVW2_VWA2_WG64_4_1_WGM1
    SolutionIndex: 297
    SolutionNameMin: Cijk_Ailk_Bljk_HF8_HHS_BH_Bias_AS_SAB_SAV_MT128x64x128_MI32x32x1_SN_LDSB1_AFC0_GRVWA8_GSU25_LBSPPA0_LBSPPB256_LPA0_MIWT2_1_NEPBS16_NLCA1_SVW2_VWA2_WG64_4_1_WGM1
    SolutionIndex: 298
    SolutionNameMin: Cijk_Ailk_Bljk_HF8_HHS_BH_Bias_AS_SAB_SAV_MT64x16x128_MI16x16x1_SN_LDSB0_AFC1_GRVWA8_GSU1_LBSPPA512_LBSPPB256_LPA16_MIWT1_1_NEPBS0_NLCA1_SVW1_VWA1_WG64_4_1_WGM20
    SolutionIndex: 299
    SolutionNameMin: Cijk_Ailk_Bljk_HF8_HHS_BH_Bias_AS_SAB_SAV_MT128x64x32_MI32x32x1_SN_LDSB0_AFC0_GRVWA8_GSU10_LBSPPA0_LBSPPB128_LPA0_MIWT2_1_NEPBS16_NLCA1_SVW2_VWA2_WG64_4_1_WGM20
    SolutionIndex: 300
    SolutionNameMin: Cijk_Ailk_Bljk_HF8_HHS_BH_Bias_AS_SAB_SAV_MT64x128x128_MI32x32x1_SN_LDSB1_AFC0_GRVWA8_GSU12_LBSPPA0_LBSPPB256_LPA0_MIWT2_1_NEPBS0_NLCA1_SVW2_VWA2_WG32_8_1_WGM1
    SolutionIndex: 301
    SolutionNameMin: Cijk_Ailk_Bljk_HF8_HHS_BH_Bias_AS_SAB_SAV_MT128x64x128_MI32x32x1_SN_LDSB1_AFC0_GRVWA8_GSU40_LBSPPA0_LBSPPB256_LPA0_MIWT2_1_NEPBS16_NLCA1_SVW2_VWA2_WG64_4_1_WGM20
    SolutionIndex: 302
    SolutionNameMin: Cijk_Ailk_Bljk_HF8_HHS_BH_Bias_AS_SAB_SAV_MT128x64x128_MI32x32x1_SN_LDSB1_AFC0_GRVWA8_GSU9_LBSPPA0_LBSPPB256_LPA0_MIWT2_1_NEPBS0_NLCA1_SVW2_VWA2_WG64_4_1_WGM1
    SolutionIndex: 303
    SolutionNameMin: Cijk_Ailk_Bljk_HF8_HHS_BH_Bias_AS_SAB_SAV_MT64x128x64_MI32x32x1_SN_LDSB1_AFC0_GRVWA8_GSU12_LBSPPA0_LBSPPB128_LPA0_MIWT2_1_NEPBS16_NLCA1_SVW2_VWA2_WG32_8_1_WGM1
    SolutionIndex: 304
    SolutionNameMin: Cijk_Ailk_Bljk_HF8_HHS_BH_Bias_AS_SAB_SAV_MT128x64x128_MI32x32x1_SN_LDSB1_AFC0_GRVWA8_GSU10_LBSPPA0_LBSPPB256_LPA0_MIWT2_1_NEPBS16_NLCA1_SVW2_VWA2_WG64_4_1_WGM20
    SolutionIndex: 305
    SolutionNameMin: Cijk_Ailk_Bljk_HF8_HHS_BH_Bias_AS_SAB_SAV_MT128x64x128_MI32x32x1_SN_LDSB1_AFC0_GRVWA8_GSU20_LBSPPA0_LBSPPB256_LPA0_MIWT2_1_NEPBS16_NLCA1_SVW2_VWA2_WG64_4_1_WGM20
    SolutionIndex: 306
    SolutionNameMin: Cijk_Ailk_Bljk_HF8_HHS_BH_Bias_AS_SAB_SAV_MT128x64x128_MI32x32x1_SN_LDSB1_AFC0_GRVWA8_GSU8_LBSPPA0_LBSPPB256_LPA0_MIWT2_1_NEPBS16_NLCA1_SVW2_VWA2_WG64_4_1_WGM20
    SolutionIndex: 307
    SolutionNameMin: Cijk_Ailk_Bljk_HF8_HHS_BH_Bias_AS_SAB_SAV_MT128x64x128_MI32x32x1_SN_LDSB1_AFC0_GRVWA8_GSU8_LBSPPA0_LBSPPB256_LPA0_MIWT2_1_NEPBS0_NLCA1_SVW2_VWA2_WG64_4_1_WGM20
    SolutionIndex: 308
    SolutionNameMin: Cijk_Ailk_Bljk_HF8_HHS_BH_Bias_AS_SAB_SAV_MT128x128x64_MI32x32x1_SN_LDSB1_AFC0_GRVWA8_GSU18_LBSPPA0_LBSPPB128_LPA0_MIWT2_2_NEPBS16_NLCA1_SVW2_VWA2_WG64_4_1_WGM20
    SolutionIndex: 309
    SolutionNameMin: Cijk_Ailk_Bljk_HF8_HHS_BH_Bias_AS_SAB_SAV_MT128x64x128_MI32x32x1_SN_LDSB1_AFC0_GRVWA8_GSU12_LBSPPA0_LBSPPB256_LPA0_MIWT2_1_NEPBS16_NLCA1_SVW2_VWA2_WG64_4_1_WGM20
    SolutionIndex: 310
    SolutionNameMin: Cijk_Ailk_Bljk_HF8_HHS_BH_Bias_AS_SAB_SAV_MT128x128x64_MI32x32x1_SN_LDSB1_AFC0_GRVWA8_GSU12_LBSPPA0_LBSPPB128_LPA0_MIWT2_2_NEPBS16_NLCA1_SVW2_VWA2_WG64_4_1_WGM20
    SolutionIndex: 311
    SolutionNameMin: Cijk_Ailk_Bljk_HF8_HHS_BH_Bias_AS_SAB_SAV_MT128x64x128_MI32x32x1_SN_LDSB1_AFC0_GRVWA8_GSU12_LBSPPA0_LBSPPB256_LPA0_MIWT2_1_NEPBS0_NLCA1_SVW2_VWA2_WG64_4_1_WGM1
    SolutionIndex: 312
    SolutionNameMin: Cijk_Ailk_Bljk_HF8_HHS_BH_Bias_AS_SAB_SAV_MT64x32x64_MI16x16x1_SN_LDSB0_AFC1_GRVWA8_GSU1_LBSPPA512_LBSPPB128_LPA16_MIWT2_1_NEPBS16_NLCA1_SVW2_VWA2_WG32_8_1_WGM1
    SolutionIndex: 313
    SolutionNameMin: Cijk_Ailk_Bljk_HF8_HHS_BH_Bias_AS_SAB_SAV_MT128x128x64_MI32x32x1_SN_LDSB1_AFC0_GRVWA8_GSU8_LBSPPA0_LBSPPB128_LPA0_MIWT2_2_NEPBS16_NLCA1_SVW2_VWA2_WG64_4_1_WGM1
    SolutionIndex: 314
    SolutionNameMin: Cijk_Ailk_Bljk_HF8_HHS_BH_Bias_AS_SAB_SAV_MT128x128x64_MI32x32x1_SN_LDSB1_AFC0_GRVWA8_GSU9_LBSPPA0_LBSPPB128_LPA0_MIWT2_2_NEPBS16_NLCA1_SVW2_VWA2_WG64_4_1_WGM20
    SolutionIndex: 315
    SolutionNameMin: Cijk_Ailk_Bljk_HF8_HHS_BH_Bias_AS_SAB_SAV_MT128x112x128_MI16x16x1_SN_LDSB1_AFC0_GRVWA8_GSU12_LBSPPA1024_LBSPPB256_LPA16_MIWT2_7_NEPBS0_NLCA1_SVW2_VWA2_WG64_4_1_WGM1
    SolutionIndex: 316
    SolutionNameMin: Cijk_Ailk_Bljk_HF8_HHS_BH_Bias_AS_SAB_SAV_MT128x64x128_MI32x32x1_SN_LDSB1_AFC1_GRVWA8_GSU1_LBSPPA0_LBSPPB256_LPA0_MIWT2_1_NEPBS16_NLCA1_SVW2_VWA2_WG64_4_1_WGM1
    SolutionIndex: 317
    SolutionNameMin: Cijk_Ailk_Bljk_HF8_HHS_BH_Bias_AS_SAB_SAV_MT128x64x128_MI32x32x1_SN_LDSB1_AFC0_GRVWA8_GSU4_LBSPPA0_LBSPPB256_LPA0_MIWT2_1_NEPBS0_NLCA1_SVW2_VWA2_WG64_4_1_WGM20
    SolutionIndex: 318
    SolutionNameMin: Cijk_Ailk_Bljk_HF8_HHS_BH_Bias_AS_SAB_SAV_MT128x112x128_MI16x16x1_SN_LDSB1_AFC0_GRVWA8_GSU8_LBSPPA1024_LBSPPB256_LPA16_MIWT2_7_NEPBS16_NLCA1_SVW2_VWA2_WG64_4_1_WGM20
    SolutionIndex: 319
    SolutionNameMin: Cijk_Ailk_Bljk_HF8_HHS_BH_Bias_AS_SAB_SAV_MT128x64x64_MI32x32x1_SN_LDSB1_AFC1_GRVWA8_GSU1_LBSPPA0_LBSPPB128_LPA0_MIWT2_1_NEPBS0_NLCA1_SVW2_VWA2_WG64_4_1_WGM20
    SolutionIndex: 320
    SolutionNameMin: Cijk_Ailk_Bljk_HF8_HHS_BH_Bias_AS_SAB_SAV_MT128x32x64_MI32x32x1_SN_LDSB0_AFC1_GRVWA8_GSU1_LBSPPA0_LBSPPB128_LPA0_MIWT1_1_NEPBS0_NLCA1_SVW1_VWA1_WG128_2_1_WGM20
    SolutionIndex: 321
    SolutionNameMin: Cijk_Ailk_Bljk_HF8_HHS_BH_Bias_AS_SAB_SAV_MT128x112x128_MI16x16x1_SN_LDSB1_AFC0_GRVWA8_GSU4_LBSPPA1024_LBSPPB256_LPA16_MIWT2_7_NEPBS0_NLCA1_SVW2_VWA2_WG64_4_1_WGM1
    SolutionIndex: 322
    SolutionNameMin: Cijk_Ailk_Bljk_HF8_HHS_BH_Bias_AS_SAB_SAV_MT128x96x128_MI32x32x1_SN_LDSB1_AFC0_GRVWA8_GSU4_LBSPPA0_LBSPPB256_LPA0_MIWT1_3_NEPBS0_NLCA1_SVW1_VWA1_WG128_2_1_WGM1
    SolutionIndex: 323
    SolutionNameMin: Cijk_Ailk_Bljk_HF8_HHS_BH_Bias_AS_SAB_SAV_MT64x128x64_MI32x32x1_SN_LDSB1_AFC1_GRVWA8_GSU1_LBSPPA0_LBSPPB128_LPA0_MIWT2_1_NEPBS0_NLCA1_SVW2_VWA2_WG32_8_1_WGM20
    SolutionIndex: 324
    SolutionNameMin: Cijk_Ailk_Bljk_HF8_HHS_BH_Bias_AS_SAB_SAV_MT128x64x128_MI32x32x1_SN_LDSB1_AFC1_GRVWA8_GSU1_LBSPPA0_LBSPPB256_LPA0_MIWT2_1_NEPBS0_NLCA1_SVW2_VWA2_WG64_4_1_WGM1
    SolutionIndex: 325
    SolutionNameMin: Cijk_Ailk_Bljk_HF8_HHS_BH_Bias_AS_SAB_SAV_MT128x64x128_MI32x32x1_SN_LDSB1_AFC1_GRVWA8_GSU1_LBSPPA0_LBSPPB256_LPA0_MIWT2_1_NEPBS0_NLCA1_SVW2_VWA2_WG64_4_1_WGM20
    SolutionIndex: 326
    SolutionNameMin: Cijk_Ailk_Bljk_HF8_HHS_BH_Bias_AS_SAB_SAV_MT128x112x128_MI16x16x1_SN_LDSB1_AFC0_GRVWA8_GSU4_LBSPPA1024_LBSPPB256_LPA16_MIWT2_7_NEPBS16_NLCA1_SVW2_VWA2_WG64_4_1_WGM20
    SolutionIndex: 327
    SolutionNameMin: Cijk_Ailk_Bljk_HF8_HHS_BH_Bias_AS_SAB_SAV_MT128x128x64_MI32x32x1_SN_LDSB1_AFC1_GRVWA8_GSU1_LBSPPA0_LBSPPB128_LPA0_MIWT2_2_NEPBS0_NLCA1_SVW2_VWA2_WG64_4_1_WGM20
    SolutionIndex: 328
    SolutionNameMin: Cijk_Ailk_Bljk_HF8_HHS_BH_Bias_AS_SAB_SAV_MT128x64x128_MI32x32x1_SN_LDSB1_AFC1_GRVWA8_GSU1_LBSPPA0_LBSPPB256_LPA0_MIWT2_1_NEPBS16_NLCA1_SVW2_VWA2_WG64_4_1_WGM20
    SolutionIndex: 329
    SolutionNameMin: Cijk_Ailk_Bljk_HF8_HHS_BH_Bias_AS_SAB_SAV_MT128x192x64_MI32x32x1_SN_LDSB1_AFC0_GRVWA8_GSU4_LBSPPA0_LBSPPB128_LPA0_MIWT2_3_NEPBS0_NLCA1_SVW2_VWA2_WG64_4_1_WGM1
    SolutionIndex: 330
    SolutionNameMin: Cijk_Ailk_Bljk_HF8_HHS_BH_Bias_AS_SAB_SAV_MT64x16x128_MI16x16x1_SN_LDSB0_AFC1_GRVWA8_GSU1_LBSPPA512_LBSPPB256_LPA16_MIWT1_1_NEPBS16_NLCA1_SVW1_VWA1_WG64_4_1_WGM1
    SolutionIndex: 331
    SolutionNameMin: Cijk_Ailk_Bljk_HF8_HHS_BH_Bias_AS_SAB_SAV_MT128x32x64_MI32x32x1_SN_LDSB0_AFC0_GRVWA8_GSU12_LBSPPA0_LBSPPB128_LPA0_MIWT1_1_NEPBS16_NLCA1_SVW1_VWA1_WG128_2_1_WGM1
    SolutionIndex: 332
    SolutionNameMin: Cijk_Ailk_Bljk_HF8_HHS_BH_Bias_AS_SAB_SAV_MT128x32x64_MI32x32x1_SN_LDSB0_AFC0_GRVWA8_GSU25_LBSPPA0_LBSPPB128_LPA0_MIWT1_1_NEPBS0_NLCA1_SVW1_VWA1_WG128_2_1_WGM1
    SolutionIndex: 333
    SolutionNameMin: Cijk_Ailk_Bljk_HF8_HHS_BH_Bias_AS_SAB_SAV_MT256x32x64_MI32x32x1_SN_LDSB1_AFC0_GRVWA8_GSU25_LBSPPA0_LBSPPB128_LPA0_MIWT2_1_NEPBS16_NLCA1_SVW2_VWA2_WG128_2_1_WGM1
    SolutionIndex: 334
    SolutionNameMin: Cijk_Ailk_Bljk_HF8_HHS_BH_Bias_AS_SAB_SAV_MT128x32x64_MI32x32x1_SN_LDSB0_AFC0_GRVWA8_GSU40_LBSPPA0_LBSPPB128_LPA0_MIWT1_1_NEPBS0_NLCA1_SVW1_VWA1_WG128_2_1_WGM20
    SolutionIndex: 335
    SolutionNameMin: Cijk_Ailk_Bljk_HF8_HHS_BH_Bias_AS_SAB_SAV_MT256x32x64_MI32x32x1_SN_LDSB1_AFC0_GRVWA8_GSU10_LBSPPA0_LBSPPB128_LPA0_MIWT2_1_NEPBS16_NLCA1_SVW2_VWA2_WG128_2_1_WGM1
    SolutionIndex: 336
    SolutionNameMin: Cijk_Ailk_Bljk_HF8_HHS_BH_Bias_AS_SAB_SAV_MT64x64x64_MI32x32x1_SN_LDSB0_AFC0_GRVWA8_GSU10_LBSPPA0_LBSPPB128_LPA0_MIWT1_1_NEPBS16_NLCA1_SVW1_VWA1_WG64_4_1_WGM20
    SolutionIndex: 337
    SolutionNameMin: Cijk_Ailk_Bljk_HF8_HHS_BH_Bias_AS_SAB_SAV_MT128x64x64_MI32x32x1_SN_LDSB1_AFC0_GRVWA8_GSU25_LBSPPA0_LBSPPB128_LPA0_MIWT2_1_NEPBS16_NLCA1_SVW2_VWA2_WG64_4_1_WGM20
    SolutionIndex: 338
    SolutionNameMin: Cijk_Ailk_Bljk_HF8_HHS_BH_Bias_AS_SAB_SAV_MT128x64x128_MI32x32x1_SN_LDSB1_AFC0_GRVWA8_GSU40_LBSPPA0_LBSPPB256_LPA0_MIWT2_1_NEPBS0_NLCA1_SVW2_VWA2_WG64_4_1_WGM20
    SolutionIndex: 339
    SolutionNameMin: Cijk_Ailk_Bljk_HF8_HHS_BH_Bias_AS_SAB_SAV_MT128x64x32_MI32x32x1_SN_LDSB0_AFC0_GRVWA8_GSU12_LBSPPA0_LBSPPB128_LPA0_MIWT2_1_NEPBS0_NLCA1_SVW2_VWA2_WG64_4_1_WGM20
    SolutionIndex: 340
    SolutionNameMin: Cijk_Ailk_Bljk_HF8_HHS_BH_Bias_AS_SAB_SAV_MT64x64x64_MI32x32x1_SN_LDSB0_AFC0_GRVWA8_GSU8_LBSPPA0_LBSPPB128_LPA0_MIWT1_1_NEPBS0_NLCA1_SVW1_VWA1_WG64_4_1_WGM20
    SolutionIndex: 341
    SolutionNameMin: Cijk_Ailk_Bljk_HF8_HHS_BH_Bias_AS_SAB_SAV_MT128x64x64_MI32x32x1_SN_LDSB1_AFC0_GRVWA8_GSU18_LBSPPA0_LBSPPB128_LPA0_MIWT2_1_NEPBS0_NLCA1_SVW2_VWA2_WG64_4_1_WGM20
    SolutionIndex: 342
    SolutionNameMin: Cijk_Ailk_Bljk_HF8_HHS_BH_Bias_AS_SAB_SAV_MT256x64x64_MI32x32x1_SN_LDSB1_AFC0_GRVWA8_GSU40_LBSPPA0_LBSPPB128_LPA0_MIWT2_2_NEPBS16_NLCA1_SVW2_VWA2_WG128_2_1_WGM20
    SolutionIndex: 343
    SolutionNameMin: Cijk_Ailk_Bljk_HF8_HHS_BH_Bias_AS_SAB_SAV_MT128x64x64_MI32x32x1_SN_LDSB1_AFC0_GRVWA8_GSU8_LBSPPA0_LBSPPB128_LPA0_MIWT2_1_NEPBS0_NLCA1_SVW2_VWA2_WG64_4_1_WGM20
    SolutionIndex: 344
    SolutionNameMin: Cijk_Ailk_Bljk_HF8_HHS_BH_Bias_AS_SAB_SAV_MT128x64x128_MI32x32x1_SN_LDSB1_AFC0_GRVWA8_GSU8_LBSPPA0_LBSPPB256_LPA0_MIWT2_1_NEPBS0_NLCA1_SVW2_VWA2_WG64_4_1_WGM1
    SolutionIndex: 345
    SolutionNameMin: Cijk_Ailk_Bljk_HF8_HHS_BH_Bias_AS_SAB_SAV_MT256x128x64_MI32x32x1_SN_LDSB1_AFC0_GRVWA8_GSU40_LBSPPA0_LBSPPB128_LPA0_MIWT4_2_NEPBS16_NLCA1_SVW4_VWA4_WG64_4_1_WGM20
    SolutionIndex: 346
    SolutionNameMin: Cijk_Ailk_Bljk_HF8_HHS_BH_Bias_AS_SAB_SAV_MT32x64x64_MI16x16x1_SN_LDSB0_AFC1_GRVWA8_GSU1_LBSPPA256_LBSPPB128_LPA16_MIWT2_1_NEPBS0_NLCA1_SVW2_VWA2_WG16_16_1_WGM20
    SolutionIndex: 347
    SolutionNameMin: Cijk_Ailk_Bljk_HF8_HHS_BH_Bias_AS_SAB_SAV_MT256x64x64_MI32x32x1_SN_LDSB1_AFC0_GRVWA8_GSU10_LBSPPA0_LBSPPB128_LPA0_MIWT2_2_NEPBS0_NLCA1_SVW2_VWA2_WG128_2_1_WGM20
    SolutionIndex: 348
    SolutionNameMin: Cijk_Ailk_Bljk_HF8_HHS_BH_Bias_AS_SAB_SAV_MT256x64x64_MI32x32x1_SN_LDSB1_AFC0_GRVWA8_GSU12_LBSPPA0_LBSPPB128_LPA0_MIWT2_2_NEPBS0_NLCA1_SVW2_VWA2_WG128_2_1_WGM20
    SolutionIndex: 349
    SolutionNameMin: Cijk_Ailk_Bljk_HF8_HHS_BH_Bias_AS_SAB_SAV_MT256x64x32_MI32x32x1_SN_LDSB1_AFC0_GRVWA8_GSU20_LBSPPA0_LBSPPB128_LPA0_MIWT2_2_NEPBS16_NLCA1_SVW2_VWA2_WG128_2_1_WGM20
    SolutionIndex: 350
    SolutionNameMin: Cijk_Ailk_Bljk_HF8_HHS_BH_Bias_AS_SAB_SAV_MT256x96x64_MI32x32x1_SN_LDSB1_AFC0_GRVWA8_GSU12_LBSPPA0_LBSPPB128_LPA0_MIWT2_3_NEPBS0_NLCA1_SVW2_VWA2_WG128_2_1_WGM20
    SolutionIndex: 351
    SolutionNameMin: Cijk_Ailk_Bljk_HF8_HHS_BH_Bias_AS_SAB_SAV_MT256x192x64_MI32x32x1_SN_LDSB1_AFC0_GRVWA8_GSU40_LBSPPA0_LBSPPB128_LPA0_MIWT2_6_NEPBS16_NLCA1_SVW2_VWA2_WG128_2_1_WGM20
    SolutionIndex: 352
    SolutionNameMin: Cijk_Ailk_Bljk_HF8_HHS_BH_Bias_AS_SAB_SAV_MT128x128x64_MI32x32x1_SN_LDSB1_AFC0_GRVWA8_GSU8_LBSPPA0_LBSPPB128_LPA0_MIWT2_2_NEPBS0_NLCA1_SVW2_VWA2_WG64_4_1_WGM1
    SolutionIndex: 353
    SolutionNameMin: Cijk_Ailk_Bljk_HF8_HHS_BH_Bias_AS_SAB_SAV_MT128x128x64_MI32x32x1_SN_LDSB1_AFC0_GRVWA8_GSU8_LBSPPA0_LBSPPB128_LPA0_MIWT2_2_NEPBS16_NLCA1_SVW2_VWA2_WG64_4_1_WGM20
    SolutionIndex: 354
    SolutionNameMin: Cijk_Ailk_Bljk_HF8_HHS_BH_Bias_AS_SAB_SAV_MT256x128x64_MI32x32x1_SN_LDSB1_AFC0_GRVWA8_GSU20_LBSPPA0_LBSPPB128_LPA0_MIWT4_2_NEPBS0_NLCA1_SVW4_VWA4_WG64_4_1_WGM20
    SolutionIndex: 355
    SolutionNameMin: Cijk_Ailk_Bljk_HF8_HHS_BH_Bias_AS_SAB_SAV_MT128x32x64_MI32x32x1_SN_LDSB0_AFC1_GRVWA8_GSU1_LBSPPA0_LBSPPB128_LPA0_MIWT1_1_NEPBS16_NLCA1_SVW1_VWA1_WG128_2_1_WGM20
    SolutionIndex: 356
    SolutionNameMin: Cijk_Ailk_Bljk_HF8_HHS_BH_Bias_AS_SAB_SAV_MT128x128x64_MI32x32x1_SN_LDSB1_AFC0_GRVWA8_GSU4_LBSPPA0_LBSPPB128_LPA0_MIWT2_2_NEPBS0_NLCA1_SVW2_VWA2_WG64_4_1_WGM20
    SolutionIndex: 357
    SolutionNameMin: Cijk_Ailk_Bljk_HF8_HHS_BH_Bias_AS_SAB_SAV_MT256x64x64_MI32x32x1_SN_LDSB1_AFC0_GRVWA8_GSU8_LBSPPA0_LBSPPB128_LPA0_MIWT2_2_NEPBS0_NLCA1_SVW2_VWA2_WG128_2_1_WGM1
    SolutionIndex: 358
    SolutionNameMin: Cijk_Ailk_Bljk_HF8_HHS_BH_Bias_AS_SAB_SAV_MT128x64x64_MI32x32x1_SN_LDSB1_AFC1_GRVWA8_GSU1_LBSPPA0_LBSPPB128_LPA0_MIWT2_1_NEPBS0_NLCA1_SVW2_VWA2_WG64_4_1_WGM1
    SolutionIndex: 359
    SolutionNameMin: Cijk_Ailk_Bljk_HF8_HHS_BH_Bias_AS_SAB_SAV_MT128x64x128_MI32x32x1_SN_LDSB1_AFC0_GRVWA8_GSU2_LBSPPA0_LBSPPB256_LPA0_MIWT2_1_NEPBS0_NLCA1_SVW2_VWA2_WG64_4_1_WGM20
    SolutionIndex: 360
    SolutionNameMin: Cijk_Ailk_Bljk_HF8_HHS_BH_Bias_AS_SAB_SAV_MT256x128x64_MI32x32x1_SN_LDSB1_AFC0_GRVWA8_GSU8_LBSPPA0_LBSPPB128_LPA0_MIWT4_2_NEPBS0_NLCA1_SVW4_VWA4_WG64_4_1_WGM1
    SolutionIndex: 361
    SolutionNameMin: Cijk_Ailk_Bljk_HF8_HHS_BH_Bias_AS_SAB_SAV_MT256x64x64_MI32x32x1_SN_LDSB1_AFC1_GRVWA8_GSU1_LBSPPA0_LBSPPB128_LPA0_MIWT2_2_NEPBS0_NLCA1_SVW2_VWA2_WG128_2_1_WGM1
    SolutionIndex: 362
    SolutionNameMin: Cijk_Ailk_Bljk_HF8_HHS_BH_Bias_AS_SAB_SAV_MT256x96x64_MI32x32x1_SN_LDSB1_AFC0_GRVWA8_GSU4_LBSPPA0_LBSPPB128_LPA0_MIWT2_3_NEPBS0_NLCA1_SVW2_VWA2_WG128_2_1_WGM1
    SolutionIndex: 363
    SolutionNameMin: Cijk_Ailk_Bljk_HF8_HHS_BH_Bias_AS_SAB_SAV_MT256x64x32_MI32x32x1_SN_LDSB1_AFC1_GRVWA8_GSU1_LBSPPA0_LBSPPB128_LPA0_MIWT2_2_NEPBS0_NLCA1_SVW2_VWA2_WG128_2_1_WGM20
    SolutionIndex: 364
    SolutionNameMin: Cijk_Ailk_Bljk_HF8_HHS_BH_Bias_AS_SAB_SAV_MT128x128x64_MI32x32x1_SN_LDSB1_AFC1_GRVWA8_GSU1_LBSPPA0_LBSPPB128_LPA0_MIWT2_2_NEPBS0_NLCA1_SVW2_VWA2_WG64_4_1_WGM1
    SolutionIndex: 365
    SolutionNameMin: Cijk_Ailk_Bljk_HF8_HHS_BH_Bias_AS_SAB_SAV_MT256x128x64_MI32x32x1_SN_LDSB1_AFC0_GRVWA8_GSU4_LBSPPA0_LBSPPB128_LPA0_MIWT4_2_NEPBS0_NLCA1_SVW4_VWA4_WG64_4_1_WGM1
    SolutionIndex: 366
    SolutionNameMin: Cijk_Ailk_Bljk_HF8_HHS_BH_Bias_AS_SAB_SAV_MT256x64x32_MI32x32x1_SN_LDSB1_AFC1_GRVWA8_GSU1_LBSPPA0_LBSPPB128_LPA0_MIWT2_2_NEPBS16_NLCA1_SVW2_VWA2_WG128_2_1_WGM20
    SolutionIndex: 367
    SolutionNameMin: Cijk_Ailk_Bljk_HF8_HHS_BH_Bias_AS_SAB_SAV_MT256x64x64_MI32x32x1_SN_LDSB1_AFC1_GRVWA8_GSU1_LBSPPA0_LBSPPB128_LPA0_MIWT2_2_NEPBS16_NLCA1_SVW2_VWA2_WG128_2_1_WGM1
    SolutionIndex: 368
    SolutionNameMin: Cijk_Ailk_Bljk_HF8_HHS_BH_Bias_AS_SAB_SAV_MT256x64x64_MI32x32x1_SN_LDSB1_AFC1_GRVWA8_GSU1_LBSPPA0_LBSPPB128_LPA0_MIWT2_2_NEPBS16_NLCA1_SVW2_VWA2_WG128_2_1_WGM20
    SolutionIndex: 369
    SolutionNameMin: Cijk_Ailk_Bljk_HF8_HHS_BH_Bias_AS_SAB_SAV_MT256x96x64_MI32x32x1_SN_LDSB1_AFC0_GRVWA8_GSU2_LBSPPA0_LBSPPB128_LPA0_MIWT2_3_NEPBS0_NLCA1_SVW2_VWA2_WG128_2_1_WGM1
    SolutionIndex: 370
    SolutionNameMin: Cijk_Ailk_Bljk_HF8_HHS_BH_Bias_AS_SAB_SAV_MT64x32x64_MI16x16x1_SN_LDSB0_AFC0_GRVWA8_GSU10_LBSPPA512_LBSPPB128_LPA16_MIWT2_1_NEPBS0_NLCA1_SVW2_VWA2_WG32_8_1_WGM20
    SolutionIndex: 371
    SolutionNameMin: Cijk_Ailk_Bljk_HF8_HHS_BH_Bias_AS_SAB_SAV_MT256x32x64_MI32x32x1_SN_LDSB1_AFC0_GRVWA8_GSU35_LBSPPA0_LBSPPB128_LPA0_MIWT2_1_NEPBS16_NLCA1_SVW2_VWA2_WG128_2_1_WGM20
    SolutionIndex: 372
    SolutionNameMin: Cijk_Ailk_Bljk_HF8_HHS_BH_Bias_AS_SAB_SAV_MT256x32x64_MI32x32x1_SN_LDSB1_AFC0_GRVWA8_GSU40_LBSPPA0_LBSPPB128_LPA0_MIWT2_1_NEPBS0_NLCA1_SVW2_VWA2_WG128_2_1_WGM20
    SolutionIndex: 373
    SolutionNameMin: Cijk_Ailk_Bljk_HF8_HHS_BH_Bias_AS_SAB_SAV_MT256x64x32_MI32x32x1_SN_LDSB1_AFC0_GRVWA8_GSU10_LBSPPA0_LBSPPB128_LPA0_MIWT2_2_NEPBS0_NLCA1_SVW2_VWA2_WG128_2_1_WGM1
    SolutionIndex: 374
    SolutionNameMin: Cijk_Ailk_Bljk_HF8_HHS_BH_Bias_AS_SAB_SAV_MT128x64x64_MI32x32x1_SN_LDSB1_AFC0_GRVWA8_GSU20_LBSPPA0_LBSPPB128_LPA0_MIWT2_1_NEPBS16_NLCA1_SVW2_VWA2_WG64_4_1_WGM1
    SolutionIndex: 375
    SolutionNameMin: Cijk_Ailk_Bljk_HF8_HHS_BH_Bias_AS_SAB_SAV_MT256x64x64_MI32x32x1_SN_LDSB1_AFC0_GRVWA8_GSU35_LBSPPA0_LBSPPB128_LPA0_MIWT2_2_NEPBS0_NLCA1_SVW2_VWA2_WG128_2_1_WGM20
    SolutionIndex: 376
    SolutionNameMin: Cijk_Ailk_Bljk_HF8_HHS_BH_Bias_AS_SAB_SAV_MT64x128x64_MI32x32x1_SN_LDSB1_AFC0_GRVWA8_GSU10_LBSPPA0_LBSPPB128_LPA0_MIWT2_1_NEPBS0_NLCA1_SVW2_VWA2_WG32_8_1_WGM20
    SolutionIndex: 377
    SolutionNameMin: Cijk_Ailk_Bljk_HF8_HHS_BH_Bias_AS_SAB_SAV_MT64x128x64_MI32x32x1_SN_LDSB1_AFC0_GRVWA8_GSU12_LBSPPA0_LBSPPB128_LPA0_MIWT2_1_NEPBS0_NLCA1_SVW2_VWA2_WG32_8_1_WGM1
    SolutionIndex: 378
    SolutionNameMin: Cijk_Ailk_Bljk_HF8_HHS_BH_Bias_AS_SAB_SAV_MT64x128x64_MI32x32x1_SN_LDSB1_AFC0_GRVWA8_GSU20_LBSPPA0_LBSPPB128_LPA0_MIWT2_1_NEPBS16_NLCA1_SVW2_VWA2_WG32_8_1_WGM1
    SolutionIndex: 379
    SolutionNameMin: Cijk_Ailk_Bljk_HF8_HHS_BH_Bias_AS_SAB_SAV_MT128x16x128_MI16x16x1_SN_LDSB1_AFC1_GRVWA8_GSU1_LBSPPA1024_LBSPPB256_LPA16_MIWT2_1_NEPBS0_NLCA1_SVW2_VWA2_WG64_4_1_WGM20
    SolutionIndex: 380
    SolutionNameMin: Cijk_Ailk_Bljk_HF8_HHS_BH_Bias_AS_SAB_SAV_MT128x128x32_MI32x32x1_SN_LDSB1_AFC0_GRVWA8_GSU12_LBSPPA0_LBSPPB128_LPA0_MIWT2_2_NEPBS16_NLCA1_SVW2_VWA2_WG64_4_1_WGM1
    SolutionIndex: 381
    SolutionNameMin: Cijk_Ailk_Bljk_HF8_HHS_BH_Bias_AS_SAB_SAV_MT128x256x64_MI32x32x1_SN_LDSB1_AFC0_GRVWA8_GSU25_LBSPPA0_LBSPPB128_LPA0_MIWT2_4_NEPBS16_NLCA1_SVW2_VWA2_WG64_4_1_WGM20
    SolutionIndex: 382
    SolutionNameMin: Cijk_Ailk_Bljk_HF8_HHS_BH_Bias_AS_SAB_SAV_MT128x256x64_MI32x32x1_SN_LDSB1_AFC0_GRVWA8_GSU35_LBSPPA0_LBSPPB128_LPA0_MIWT2_4_NEPBS16_NLCA1_SVW2_VWA2_WG64_4_1_WGM20
    SolutionIndex: 383
    SolutionNameMin: Cijk_Ailk_Bljk_HF8_HHS_BH_Bias_AS_SAB_SAV_MT64x32x64_MI16x16x1_SN_LDSB0_AFC1_GRVWA8_GSU1_LBSPPA512_LBSPPB128_LPA16_MIWT2_1_NEPBS16_NLCA1_SVW2_VWA2_WG32_8_1_WGM20
    SolutionIndex: 384
    SolutionNameMin: Cijk_Ailk_Bljk_HF8_HHS_BH_Bias_AS_SAB_SAV_MT128x128x64_MI32x32x1_SN_LDSB1_AFC0_GRVWA8_GSU9_LBSPPA0_LBSPPB128_LPA0_MIWT2_2_NEPBS0_NLCA1_SVW2_VWA2_WG64_4_1_WGM1
    SolutionIndex: 385
    SolutionNameMin: Cijk_Ailk_Bljk_HF8_HHS_BH_Bias_AS_SAB_SAV_MT256x96x64_MI32x32x1_SN_LDSB1_AFC0_GRVWA8_GSU12_LBSPPA0_LBSPPB128_LPA0_MIWT2_3_NEPBS16_NLCA1_SVW2_VWA2_WG128_2_1_WGM1
    SolutionIndex: 386
    SolutionNameMin: Cijk_Ailk_Bljk_HF8_HHS_BH_Bias_AS_SAB_SAV_MT256x128x64_MI32x32x1_SN_LDSB1_AFC0_GRVWA8_GSU20_LBSPPA0_LBSPPB128_LPA0_MIWT4_2_NEPBS16_NLCA1_SVW4_VWA4_WG64_4_1_WGM20
    SolutionIndex: 387
    SolutionNameMin: Cijk_Ailk_Bljk_HF8_HHS_BH_Bias_AS_SAB_SAV_MT64x32x128_MI16x16x1_SN_LDSB1_AFC1_GRVWA8_GSU1_LBSPPA512_LBSPPB256_LPA16_MIWT2_1_NEPBS16_NLCA1_SVW2_VWA2_WG32_8_1_WGM20
    SolutionIndex: 388
    SolutionNameMin: Cijk_Ailk_Bljk_HF8_HHS_BH_Bias_AS_SAB_SAV_MT256x128x32_MI32x32x1_SN_LDSB1_AFC0_GRVWA8_GSU10_LBSPPA0_LBSPPB128_LPA0_MIWT4_2_NEPBS16_NLCA1_SVW4_VWA4_WG64_4_1_WGM20
    SolutionIndex: 389
    SolutionNameMin: Cijk_Ailk_Bljk_HF8_HHS_BH_Bias_AS_SAB_SAV_MT128x32x64_MI32x32x1_SN_LDSB0_AFC1_GRVWA8_GSU1_LBSPPA0_LBSPPB128_LPA0_MIWT1_1_NEPBS16_NLCA1_SVW1_VWA1_WG128_2_1_WGM1
    SolutionIndex: 390
    SolutionNameMin: Cijk_Ailk_Bljk_HF8_HHS_BH_Bias_AS_SAB_SAV_MT64x32x128_MI16x16x1_SN_LDSB1_AFC1_GRVWA8_GSU1_LBSPPA512_LBSPPB256_LPA16_MIWT2_1_NEPBS0_NLCA1_SVW2_VWA2_WG32_8_1_WGM20
    SolutionIndex: 391
    SolutionNameMin: Cijk_Ailk_Bljk_HF8_HHS_BH_Bias_AS_SAB_SAV_MT256x64x64_MI32x32x1_SN_LDSB1_AFC0_GRVWA8_GSU4_LBSPPA0_LBSPPB128_LPA0_MIWT2_2_NEPBS16_NLCA1_SVW2_VWA2_WG128_2_1_WGM20
    SolutionIndex: 392
    SolutionNameMin: Cijk_Ailk_Bljk_HF8_HHS_BH_Bias_AS_SAB_SAV_MT256x128x64_MI32x32x1_SN_LDSB1_AFC0_GRVWA8_GSU12_LBSPPA0_LBSPPB128_LPA0_MIWT4_2_NEPBS0_NLCA1_SVW4_VWA4_WG64_4_1_WGM20
    SolutionIndex: 393
    SolutionNameMin: Cijk_Ailk_Bljk_HF8_HHS_BH_Bias_AS_SAB_SAV_MT256x128x64_MI32x32x1_SN_LDSB1_AFC0_GRVWA8_GSU8_LBSPPA0_LBSPPB128_LPA0_MIWT4_2_NEPBS0_NLCA1_SVW4_VWA4_WG64_4_1_WGM20
    SolutionIndex: 394
    SolutionNameMin: Cijk_Ailk_Bljk_HF8_HHS_BH_Bias_AS_SAB_SAV_MT256x128x64_MI32x32x1_SN_LDSB1_AFC0_GRVWA8_GSU4_LBSPPA0_LBSPPB128_LPA0_MIWT4_2_NEPBS0_NLCA1_SVW4_VWA4_WG64_4_1_WGM20
    SolutionIndex: 395
    SolutionNameMin: Cijk_Ailk_Bljk_HF8_HHS_BH_Bias_AS_SAB_SAV_MT128x128x64_MI32x32x1_SN_LDSB1_AFC1_GRVWA8_GSU1_LBSPPA0_LBSPPB128_LPA0_MIWT2_2_NEPBS16_NLCA1_SVW2_VWA2_WG64_4_1_WGM20
    SolutionIndex: 396
    SolutionNameMin: Cijk_Ailk_Bljk_HF8_HHS_BH_Bias_AS_SAB_SAV_MT256x96x64_MI32x32x1_SN_LDSB1_AFC0_GRVWA8_GSU2_LBSPPA0_LBSPPB128_LPA0_MIWT2_3_NEPBS0_NLCA1_SVW2_VWA2_WG128_2_1_WGM20
    SolutionIndex: 397
    SolutionNameMin: Cijk_Ailk_Bljk_HF8_HHS_BH_Bias_AS_SAB_SAV_MT256x128x32_MI32x32x1_SN_LDSB1_AFC1_GRVWA8_GSU1_LBSPPA0_LBSPPB128_LPA0_MIWT4_2_NEPBS0_NLCA1_SVW4_VWA4_WG64_4_1_WGM1
    SolutionIndex: 398
    SolutionNameMin: Cijk_Ailk_Bljk_HF8_HHS_BH_Bias_AS_SAB_SAV_MT256x128x64_MI32x32x1_SN_LDSB1_AFC0_GRVWA8_GSU2_LBSPPA0_LBSPPB128_LPA0_MIWT4_2_NEPBS16_NLCA1_SVW4_VWA4_WG64_4_1_WGM20
    SolutionIndex: 399
    SolutionNameMin: Cijk_Ailk_Bljk_HF8_HHS_BH_Bias_AS_SAB_SAV_MT256x128x64_MI32x32x1_SN_LDSB1_AFC1_GRVWA8_GSU1_LBSPPA0_LBSPPB128_LPA0_MIWT4_2_NEPBS16_NLCA1_SVW4_VWA4_WG64_4_1_WGM1
    SolutionIndex: 400
    SolutionNameMin: Cijk_Ailk_Bljk_HF8_HHS_BH_Bias_AS_SAB_SAV_MT128x192x32_MI32x32x1_SN_LDSB1_AFC1_GRVWA8_GSU1_LBSPPA0_LBSPPB128_LPA0_MIWT2_3_NEPBS16_NLCA1_SVW2_VWA2_WG64_4_1_WGM20
    SolutionIndex: 401
    SolutionNameMin: Cijk_Ailk_Bljk_HF8_HHS_BH_Bias_AS_SAB_SAV_MT256x96x64_MI32x32x1_SN_LDSB1_AFC1_GRVWA8_GSU1_LBSPPA0_LBSPPB128_LPA0_MIWT2_3_NEPBS0_NLCA1_SVW2_VWA2_WG128_2_1_WGM1
    SolutionIndex: 402
    SolutionNameMin: Cijk_Ailk_Bljk_HF8_HHS_BH_Bias_AS_SAB_SAV_MT256x96x64_MI32x32x1_SN_LDSB1_AFC1_GRVWA8_GSU1_LBSPPA0_LBSPPB128_LPA0_MIWT2_3_NEPBS0_NLCA1_SVW2_VWA2_WG128_2_1_WGM20
    SolutionIndex: 403
    SolutionNameMin: Cijk_Ailk_Bljk_HF8_HHS_BH_Bias_AS_SAB_SAV_MT256x32x64_MI32x32x1_SN_LDSB1_AFC0_GRVWA8_GSU10_LBSPPA0_LBSPPB128_LPA0_MIWT2_1_NEPBS16_NLCA1_SVW2_VWA2_WG128_2_1_WGM20
    SolutionIndex: 404
    SolutionNameMin: Cijk_Ailk_Bljk_HF8_HHS_BH_Bias_AS_SAB_SAV_MT256x32x64_MI32x32x1_SN_LDSB1_AFC0_GRVWA8_GSU18_LBSPPA0_LBSPPB128_LPA0_MIWT2_1_NEPBS0_NLCA1_SVW2_VWA2_WG128_2_1_WGM20
    SolutionIndex: 405
    SolutionNameMin: Cijk_Ailk_Bljk_HF8_HHS_BH_Bias_AS_SAB_SAV_MT256x32x64_MI32x32x1_SN_LDSB1_AFC0_GRVWA8_GSU35_LBSPPA0_LBSPPB128_LPA0_MIWT2_1_NEPBS0_NLCA1_SVW2_VWA2_WG128_2_1_WGM1
    SolutionIndex: 406
    SolutionNameMin: Cijk_Ailk_Bljk_HF8_HHS_BH_Bias_AS_SAB_SAV_MT128x64x64_MI32x32x1_SN_LDSB1_AFC0_GRVWA8_GSU12_LBSPPA0_LBSPPB128_LPA0_MIWT2_1_NEPBS16_NLCA1_SVW2_VWA2_WG64_4_1_WGM20
    SolutionIndex: 407
    SolutionNameMin: Cijk_Ailk_Bljk_HF8_HHS_BH_Bias_AS_SAB_SAV_MT128x64x64_MI32x32x1_SN_LDSB1_AFC0_GRVWA8_GSU12_LBSPPA0_LBSPPB128_LPA0_MIWT2_1_NEPBS0_NLCA1_SVW2_VWA2_WG64_4_1_WGM20
    SolutionIndex: 408
    SolutionNameMin: Cijk_Ailk_Bljk_HF8_HHS_BH_Bias_AS_SAB_SAV_MT128x64x64_MI32x32x1_SN_LDSB1_AFC0_GRVWA8_GSU12_LBSPPA0_LBSPPB128_LPA0_MIWT2_1_NEPBS16_NLCA1_SVW2_VWA2_WG64_4_1_WGM1
    SolutionIndex: 409
    SolutionNameMin: Cijk_Ailk_Bljk_HF8_HHS_BH_Bias_AS_SAB_SAV_MT256x64x64_MI32x32x1_SN_LDSB1_AFC0_GRVWA8_GSU25_LBSPPA0_LBSPPB128_LPA0_MIWT2_2_NEPBS0_NLCA1_SVW2_VWA2_WG128_2_1_WGM20
    SolutionIndex: 410
    SolutionNameMin: Cijk_Ailk_Bljk_HF8_HHS_BH_Bias_AS_SAB_SAV_MT128x64x128_MI32x32x1_SN_LDSB1_AFC0_GRVWA8_GSU9_LBSPPA0_LBSPPB256_LPA0_MIWT2_1_NEPBS16_NLCA1_SVW2_VWA2_WG64_4_1_WGM1
    SolutionIndex: 411
    SolutionNameMin: Cijk_Ailk_Bljk_HF8_HHS_BH_Bias_AS_SAB_SAV_MT128x128x64_MI32x32x1_SN_LDSB1_AFC0_GRVWA8_GSU25_LBSPPA0_LBSPPB128_LPA0_MIWT2_2_NEPBS16_NLCA1_SVW2_VWA2_WG64_4_1_WGM1
    SolutionIndex: 412
    SolutionNameMin: Cijk_Ailk_Bljk_HF8_HHS_BH_Bias_AS_SAB_SAV_MT192x128x64_MI32x32x1_SN_LDSB1_AFC0_GRVWA8_GSU25_LBSPPA0_LBSPPB128_LPA0_MIWT6_1_NEPBS16_NLCA3_SVW2_VWA2_WG32_8_1_WGM20
    SolutionIndex: 413
    SolutionNameMin: Cijk_Ailk_Bljk_HF8_HHS_BH_Bias_AS_SAB_SAV_MT128x128x64_MI32x32x1_SN_LDSB1_AFC0_GRVWA8_GSU20_LBSPPA0_LBSPPB128_LPA0_MIWT2_2_NEPBS16_NLCA1_SVW2_VWA2_WG64_4_1_WGM20
    SolutionIndex: 414
    SolutionNameMin: Cijk_Ailk_Bljk_HF8_HHS_BH_Bias_AS_SAB_SAV_MT64x64x64_MI32x32x1_SN_LDSB0_AFC1_GRVWA8_GSU1_LBSPPA0_LBSPPB128_LPA0_MIWT1_1_NEPBS0_NLCA1_SVW1_VWA1_WG64_4_1_WGM1
    SolutionIndex: 415
    SolutionNameMin: Cijk_Ailk_Bljk_HF8_HHS_BH_Bias_AS_SAB_SAV_MT128x256x64_MI32x32x1_SN_LDSB1_AFC0_GRVWA8_GSU12_LBSPPA0_LBSPPB128_LPA0_MIWT2_4_NEPBS16_NLCA1_SVW2_VWA2_WG64_4_1_WGM1
    SolutionIndex: 416
    SolutionNameMin: Cijk_Ailk_Bljk_HF8_HHS_BH_Bias_AS_SAB_SAV_MT128x256x32_MI32x32x1_SN_LDSB1_AFC0_GRVWA8_GSU18_LBSPPA0_LBSPPB128_LPA0_MIWT2_4_NEPBS0_NLCA1_SVW2_VWA2_WG64_4_1_WGM20
    SolutionIndex: 417
    SolutionNameMin: Cijk_Ailk_Bljk_HF8_HHS_BH_Bias_AS_SAB_SAV_MT192x96x64_MI16x16x1_SN_LDSB1_AFC0_GRVWA8_GSU8_LBSPPA1536_LBSPPB128_LPA16_MIWT6_3_NEPBS16_NLCA3_SVW2_VWA2_WG32_8_1_WGM1
    SolutionIndex: 418
    SolutionNameMin: Cijk_Ailk_Bljk_HF8_HHS_BH_Bias_AS_SAB_SAV_MT192x128x64_MI32x32x1_SN_LDSB1_AFC0_GRVWA8_GSU4_LBSPPA0_LBSPPB128_LPA0_MIWT6_1_NEPBS0_NLCA3_SVW2_VWA2_WG32_8_1_WGM20
    SolutionIndex: 419
    SolutionNameMin: Cijk_Ailk_Bljk_HF8_HHS_BH_Bias_AS_SAB_SAV_MT192x160x64_MI16x16x1_SN_LDSB1_AFC0_GRVWA8_GSU10_LBSPPA1536_LBSPPB128_LPA16_MIWT6_5_NEPBS16_NLCA3_SVW2_VWA2_WG32_8_1_WGM1
    SolutionIndex: 420
    SolutionNameMin: Cijk_Ailk_Bljk_HF8_HHS_BH_Bias_AS_SAB_SAV_MT128x64x64_MI32x32x1_SN_LDSB1_AFC1_GRVWA8_GSU1_LBSPPA0_LBSPPB128_LPA0_MIWT2_1_NEPBS16_NLCA1_SVW2_VWA2_WG64_4_1_WGM1
    SolutionIndex: 421
    SolutionNameMin: Cijk_Ailk_Bljk_HF8_HHS_BH_Bias_AS_SAB_SAV_MT192x128x64_MI32x32x1_SN_LDSB1_AFC0_GRVWA8_GSU4_LBSPPA0_LBSPPB128_LPA0_MIWT6_1_NEPBS16_NLCA3_SVW2_VWA2_WG32_8_1_WGM20
    SolutionIndex: 422
    SolutionNameMin: Cijk_Ailk_Bljk_HF8_HHS_BH_Bias_AS_SAB_SAV_MT192x128x32_MI32x32x1_SN_LDSB1_AFC1_GRVWA8_GSU1_LBSPPA0_LBSPPB128_LPA0_MIWT6_1_NEPBS0_NLCA3_SVW2_VWA2_WG32_8_1_WGM20
    SolutionIndex: 423
    SolutionNameMin: Cijk_Ailk_Bljk_HF8_HHS_BH_Bias_AS_SAB_SAV_MT192x128x64_MI32x32x1_SN_LDSB1_AFC0_GRVWA8_GSU2_LBSPPA0_LBSPPB128_LPA0_MIWT6_1_NEPBS0_NLCA3_SVW2_VWA2_WG32_8_1_WGM20
    SolutionIndex: 424
    SolutionNameMin: Cijk_Ailk_Bljk_HF8_HHS_BH_Bias_AS_SAB_SAV_MT256x128x64_MI32x32x1_SN_LDSB1_AFC1_GRVWA8_GSU1_LBSPPA0_LBSPPB128_LPA0_MIWT4_2_NEPBS0_NLCA1_SVW4_VWA4_WG64_4_1_WGM20
    SolutionIndex: 425
    SolutionNameMin: Cijk_Ailk_Bljk_HF8_HHS_BH_Bias_AS_SAB_SAV_MT192x96x64_MI16x16x1_SN_LDSB1_AFC1_GRVWA8_GSU1_LBSPPA1536_LBSPPB128_LPA16_MIWT6_3_NEPBS16_NLCA3_SVW2_VWA2_WG32_8_1_WGM20
    SolutionIndex: 426
    SolutionNameMin: Cijk_Ailk_Bljk_HF8_HHS_BH_Bias_AS_SAB_SAV_MT256x128x32_MI32x32x1_SN_LDSB1_AFC1_GRVWA8_GSU1_LBSPPA0_LBSPPB128_LPA0_MIWT4_2_NEPBS16_NLCA1_SVW4_VWA4_WG64_4_1_WGM1
    SolutionIndex: 427
    SolutionNameMin: Cijk_Ailk_Bljk_HF8_HHS_BH_Bias_AS_SAB_SAV_MT256x96x64_MI32x32x1_SN_LDSB1_AFC1_GRVWA8_GSU1_LBSPPA0_LBSPPB128_LPA0_MIWT2_3_NEPBS16_NLCA1_SVW2_VWA2_WG128_2_1_WGM20
    SolutionIndex: 428
    SolutionNameMin: Cijk_Ailk_Bljk_HF8_HHS_BH_Bias_AS_SAB_SAV_MT256x192x64_MI32x32x1_SN_LDSB1_AFC1_GRVWA8_GSU1_LBSPPA0_LBSPPB128_LPA0_MIWT2_6_NEPBS0_NLCA1_SVW2_VWA2_WG128_2_1_WGM20
    SolutionIndex: 429
    SolutionNameMin: Cijk_Ailk_Bljk_HF8_HHS_BH_Bias_AS_SAB_SAV_MT128x256x64_MI32x32x1_SN_LDSB1_AFC1_GRVWA8_GSU1_LBSPPA0_LBSPPB128_LPA0_MIWT2_4_NEPBS16_NLCA1_SVW2_VWA2_WG64_4_1_WGM20
    SolutionIndex: 430
    SolutionNameMin: Cijk_Ailk_Bljk_HF8_HHS_BH_Bias_AS_SAB_SAV_MT256x128x64_MI32x32x1_SN_LDSB1_AFC1_GRVWA8_GSU1_LBSPPA0_LBSPPB128_LPA0_MIWT4_2_NEPBS16_NLCA1_SVW4_VWA4_WG64_4_1_WGM20
    SolutionIndex: 431
    SolutionNameMin: Cijk_Ailk_Bljk_HF8_HHS_BH_Bias_AS_SAB_SAV_MT128x32x64_MI32x32x1_SN_LDSB0_AFC0_GRVWA8_GSU9_LBSPPA0_LBSPPB128_LPA0_MIWT1_1_NEPBS16_NLCA1_SVW1_VWA1_WG128_2_1_WGM20
    SolutionIndex: 432
    SolutionNameMin: Cijk_Ailk_Bljk_HF8_HHS_BH_Bias_AS_SAB_SAV_MT256x32x64_MI32x32x1_SN_LDSB1_AFC0_GRVWA8_GSU35_LBSPPA0_LBSPPB128_LPA0_MIWT2_1_NEPBS16_NLCA1_SVW2_VWA2_WG128_2_1_WGM1
    SolutionIndex: 433
    SolutionNameMin: Cijk_Ailk_Bljk_HF8_HHS_BH_Bias_AS_SAB_SAV_MT128x64x64_MI32x32x1_SN_LDSB1_AFC0_GRVWA8_GSU10_LBSPPA0_LBSPPB128_LPA0_MIWT2_1_NEPBS16_NLCA1_SVW2_VWA2_WG64_4_1_WGM20
    SolutionIndex: 434
    SolutionNameMin: Cijk_Ailk_Bljk_HF8_HHS_BH_Bias_AS_SAB_SAV_MT128x64x64_MI32x32x1_SN_LDSB1_AFC0_GRVWA8_GSU10_LBSPPA0_LBSPPB128_LPA0_MIWT2_1_NEPBS0_NLCA1_SVW2_VWA2_WG64_4_1_WGM20
    SolutionIndex: 435
    SolutionNameMin: Cijk_Ailk_Bljk_HF8_HHS_BH_Bias_AS_SAB_SAV_MT128x64x64_MI32x32x1_SN_LDSB1_AFC0_GRVWA8_GSU20_LBSPPA0_LBSPPB128_LPA0_MIWT2_1_NEPBS0_NLCA1_SVW2_VWA2_WG64_4_1_WGM20
    SolutionIndex: 436
    SolutionNameMin: Cijk_Ailk_Bljk_HF8_HHS_BH_Bias_AS_SAB_SAV_MT128x64x128_MI32x32x1_SN_LDSB1_AFC0_GRVWA8_GSU18_LBSPPA0_LBSPPB256_LPA0_MIWT2_1_NEPBS0_NLCA1_SVW2_VWA2_WG64_4_1_WGM1
    SolutionIndex: 437
    SolutionNameMin: Cijk_Ailk_Bljk_HF8_HHS_BH_Bias_AS_SAB_SAV_MT256x64x64_MI32x32x1_SN_LDSB1_AFC0_GRVWA8_GSU9_LBSPPA0_LBSPPB128_LPA0_MIWT2_2_NEPBS16_NLCA1_SVW2_VWA2_WG128_2_1_WGM20
    SolutionIndex: 438
    SolutionNameMin: Cijk_Ailk_Bljk_HF8_HHS_BH_Bias_AS_SAB_SAV_MT128x128x64_MI32x32x1_SN_LDSB1_AFC0_GRVWA8_GSU12_LBSPPA0_LBSPPB128_LPA0_MIWT2_2_NEPBS0_NLCA1_SVW2_VWA2_WG64_4_1_WGM1
    SolutionIndex: 439
    SolutionNameMin: Cijk_Ailk_Bljk_HF8_HHS_BH_Bias_AS_SAB_SAV_MT128x128x64_MI32x32x1_SN_LDSB1_AFC0_GRVWA8_GSU12_LBSPPA0_LBSPPB128_LPA0_MIWT2_2_NEPBS0_NLCA1_SVW2_VWA2_WG64_4_1_WGM20
    SolutionIndex: 440
    SolutionNameMin: Cijk_Ailk_Bljk_HF8_HHS_BH_Bias_AS_SAB_SAV_MT256x128x32_MI32x32x1_SN_LDSB1_AFC0_GRVWA8_GSU30_LBSPPA0_LBSPPB128_LPA0_MIWT4_2_NEPBS16_NLCA1_SVW4_VWA4_WG64_4_1_WGM1
    SolutionIndex: 441
    SolutionNameMin: Cijk_Ailk_Bljk_HF8_HHS_BH_Bias_AS_SAB_SAV_MT128x32x64_MI32x32x1_SN_LDSB0_AFC1_GRVWA8_GSU1_LBSPPA0_LBSPPB128_LPA0_MIWT1_1_NEPBS0_NLCA1_SVW1_VWA1_WG128_2_1_WGM1
    SolutionIndex: 442
    SolutionNameMin: Cijk_Ailk_Bljk_HF8_HHS_BH_Bias_AS_SAB_SAV_MT128x128x64_MI32x32x1_SN_LDSB1_AFC0_GRVWA8_GSU9_LBSPPA0_LBSPPB128_LPA0_MIWT2_2_NEPBS0_NLCA1_SVW2_VWA2_WG64_4_1_WGM20
    SolutionIndex: 443
    SolutionNameMin: Cijk_Ailk_Bljk_HF8_HHS_BH_Bias_AS_SAB_SAV_MT128x256x64_MI32x32x1_SN_LDSB1_AFC0_GRVWA8_GSU18_LBSPPA0_LBSPPB128_LPA0_MIWT2_4_NEPBS0_NLCA1_SVW2_VWA2_WG64_4_1_WGM1
    SolutionIndex: 444
    SolutionNameMin: Cijk_Ailk_Bljk_HF8_HHS_BH_Bias_AS_SAB_SAV_MT128x256x32_MI32x32x1_SN_LDSB1_AFC0_GRVWA8_GSU18_LBSPPA0_LBSPPB128_LPA0_MIWT2_4_NEPBS16_NLCA1_SVW2_VWA2_WG64_4_1_WGM1
    SolutionIndex: 445
    SolutionNameMin: Cijk_Ailk_Bljk_HF8_HHS_BH_Bias_AS_SAB_SAV_MT128x256x32_MI32x32x1_SN_LDSB1_AFC0_GRVWA8_GSU9_LBSPPA0_LBSPPB128_LPA0_MIWT2_4_NEPBS0_NLCA1_SVW2_VWA2_WG64_4_1_WGM1
    SolutionIndex: 446
    SolutionNameMin: Cijk_Ailk_Bljk_HF8_HHS_BH_Bias_AS_SAB_SAV_MT128x256x32_MI32x32x1_SN_LDSB1_AFC0_GRVWA8_GSU12_LBSPPA0_LBSPPB128_LPA0_MIWT2_4_NEPBS0_NLCA1_SVW2_VWA2_WG64_4_1_WGM20
    SolutionIndex: 447
    SolutionNameMin: Cijk_Ailk_Bljk_HF8_HHS_BH_Bias_AS_SAB_SAV_MT256x96x64_MI32x32x1_SN_LDSB1_AFC0_GRVWA8_GSU4_LBSPPA0_LBSPPB128_LPA0_MIWT2_3_NEPBS16_NLCA1_SVW2_VWA2_WG128_2_1_WGM1
    SolutionIndex: 448
    SolutionNameMin: Cijk_Ailk_Bljk_HF8_HHS_BH_Bias_AS_SAB_SAV_MT128x256x64_MI32x32x1_SN_LDSB1_AFC0_GRVWA8_GSU10_LBSPPA0_LBSPPB128_LPA0_MIWT2_4_NEPBS0_NLCA1_SVW2_VWA2_WG64_4_1_WGM1
    SolutionIndex: 449
    SolutionNameMin: Cijk_Ailk_Bljk_HF8_HHS_BH_Bias_AS_SAB_SAV_MT256x128x32_MI32x32x1_SN_LDSB1_AFC0_GRVWA8_GSU4_LBSPPA0_LBSPPB128_LPA0_MIWT4_2_NEPBS16_NLCA1_SVW4_VWA4_WG64_4_1_WGM1
    SolutionIndex: 450
    SolutionNameMin: Cijk_Ailk_Bljk_HF8_HHS_BH_Bias_AS_SAB_SAV_MT256x128x32_MI32x32x1_SN_LDSB1_AFC0_GRVWA8_GSU8_LBSPPA0_LBSPPB128_LPA0_MIWT4_2_NEPBS16_NLCA1_SVW4_VWA4_WG64_4_1_WGM20
    SolutionIndex: 451
    SolutionNameMin: Cijk_Ailk_Bljk_HF8_HHS_BH_Bias_AS_SAB_SAV_MT128x128x64_MI32x32x1_SN_LDSB1_AFC1_GRVWA8_GSU1_LBSPPA0_LBSPPB128_LPA0_MIWT2_2_NEPBS16_NLCA1_SVW2_VWA2_WG64_4_1_WGM1
    SolutionIndex: 452
    SolutionNameMin: Cijk_Ailk_Bljk_HF8_HHS_BH_Bias_AS_SAB_SAV_MT256x128x32_MI32x32x1_SN_LDSB1_AFC0_GRVWA8_GSU2_LBSPPA0_LBSPPB128_LPA0_MIWT4_2_NEPBS16_NLCA1_SVW4_VWA4_WG64_4_1_WGM20
    SolutionIndex: 453
    SolutionNameMin: Cijk_Ailk_Bljk_HF8_HHS_BH_Bias_AS_SAB_SAV_MT256x96x64_MI32x32x1_SN_LDSB1_AFC1_GRVWA8_GSU1_LBSPPA0_LBSPPB128_LPA0_MIWT2_3_NEPBS16_NLCA1_SVW2_VWA2_WG128_2_1_WGM1
    SolutionIndex: 454
    SolutionNameMin: Cijk_Ailk_Bljk_HF8_HHS_BH_Bias_AS_SAB_SAV_MT256x128x32_MI32x32x1_SN_LDSB1_AFC1_GRVWA8_GSU1_LBSPPA0_LBSPPB128_LPA0_MIWT4_2_NEPBS0_NLCA1_SVW4_VWA4_WG64_4_1_WGM20
    SolutionIndex: 455
    SolutionNameMin: Cijk_Ailk_Bljk_HF8_HHS_BH_Bias_AS_SAB_SAV_MT256x192x32_MI32x32x1_SN_LDSB0_AFC1_GRVWA8_GSU1_LBSPPA0_LBSPPB128_LPA0_MIWT2_6_NEPBS0_NLCA1_SVW2_VWA2_WG128_2_1_WGM1
    SolutionIndex: 456
    SolutionNameMin: Cijk_Ailk_Bljk_HF8_HHS_BH_Bias_AS_SAB_SAV_MT256x192x64_MI32x32x1_SN_LDSB1_AFC1_GRVWA8_GSU1_LBSPPA0_LBSPPB128_LPA0_MIWT2_6_NEPBS16_NLCA1_SVW2_VWA2_WG128_2_1_WGM20
    SolutionIndex: 457
    SolutionNameMin: Cijk_Ailk_Bljk_HF8_HHS_BH_Bias_AS_SAB_SAV_MT128x32x64_MI32x32x1_SN_LDSB0_AFC0_GRVWA8_GSU8_LBSPPA0_LBSPPB128_LPA0_MIWT1_1_NEPBS16_NLCA1_SVW1_VWA1_WG128_2_1_WGM1
    SolutionIndex: 458
    SolutionNameMin: Cijk_Ailk_Bljk_HF8_HHS_BH_Bias_AS_SAB_SAV_MT128x32x64_MI32x32x1_SN_LDSB0_AFC0_GRVWA8_GSU8_LBSPPA0_LBSPPB128_LPA0_MIWT1_1_NEPBS0_NLCA1_SVW1_VWA1_WG128_2_1_WGM1
    SolutionIndex: 459
    SolutionNameMin: Cijk_Ailk_Bljk_HF8_HHS_BH_Bias_AS_SAB_SAV_MT256x32x64_MI32x32x1_SN_LDSB1_AFC0_GRVWA8_GSU12_LBSPPA0_LBSPPB128_LPA0_MIWT2_1_NEPBS0_NLCA1_SVW2_VWA2_WG128_2_1_WGM1
    SolutionIndex: 460
    SolutionNameMin: Cijk_Ailk_Bljk_HF8_HHS_BH_Bias_AS_SAB_SAV_MT256x64x64_MI32x32x1_SN_LDSB1_AFC0_GRVWA8_GSU10_LBSPPA0_LBSPPB128_LPA0_MIWT2_2_NEPBS16_NLCA1_SVW2_VWA2_WG128_2_1_WGM20
    SolutionIndex: 461
    SolutionNameMin: Cijk_Ailk_Bljk_HF8_HHS_BH_Bias_AS_SAB_SAV_MT256x64x64_MI32x32x1_SN_LDSB1_AFC0_GRVWA8_GSU12_LBSPPA0_LBSPPB128_LPA0_MIWT2_2_NEPBS16_NLCA1_SVW2_VWA2_WG128_2_1_WGM1
    SolutionIndex: 462
    SolutionNameMin: Cijk_Ailk_Bljk_HF8_HHS_BH_Bias_AS_SAB_SAV_MT128x128x64_MI32x32x1_SN_LDSB1_AFC0_GRVWA8_GSU8_LBSPPA0_LBSPPB128_LPA0_MIWT2_2_NEPBS0_NLCA1_SVW2_VWA2_WG64_4_1_WGM20
    SolutionIndex: 463
    SolutionNameMin: Cijk_Ailk_Bljk_HF8_HHS_BH_Bias_AS_SAB_SAV_MT128x128x32_MI32x32x1_SN_LDSB1_AFC0_GRVWA8_GSU9_LBSPPA0_LBSPPB128_LPA0_MIWT2_2_NEPBS16_NLCA1_SVW2_VWA2_WG64_4_1_WGM20
    SolutionIndex: 464
    SolutionNameMin: Cijk_Ailk_Bljk_HF8_HHS_BH_Bias_AS_SAB_SAV_MT128x128x64_MI32x32x1_SN_LDSB1_AFC0_GRVWA8_GSU4_LBSPPA0_LBSPPB128_LPA0_MIWT2_2_NEPBS0_NLCA1_SVW2_VWA2_WG64_4_1_WGM1
    SolutionIndex: 465
    SolutionNameMin: Cijk_Ailk_Bljk_HF8_HHS_BH_Bias_AS_SAB_SAV_MT256x128x64_MI32x32x1_SN_LDSB1_AFC0_GRVWA8_GSU12_LBSPPA0_LBSPPB128_LPA0_MIWT4_2_NEPBS0_NLCA1_SVW4_VWA4_WG64_4_1_WGM1
    SolutionIndex: 466
    SolutionNameMin: Cijk_Ailk_Bljk_HF8_HHS_BH_Bias_AS_SAB_SAV_MT256x128x64_MI32x32x1_SN_LDSB1_AFC0_GRVWA8_GSU8_LBSPPA0_LBSPPB128_LPA0_MIWT4_2_NEPBS16_NLCA1_SVW4_VWA4_WG64_4_1_WGM1
    SolutionIndex: 467
    SolutionNameMin: Cijk_Ailk_Bljk_HF8_HHS_BH_Bias_AS_SAB_SAV_MT128x48x128_MI16x16x1_SN_LDSB1_AFC1_GRVWA8_GSU1_LBSPPA1024_LBSPPB256_LPA16_MIWT2_3_NEPBS16_NLCA1_SVW2_VWA2_WG64_4_1_WGM1
    SolutionIndex: 468
    SolutionNameMin: Cijk_Ailk_Bljk_HF8_HHS_BH_Bias_AS_SAB_SAV_MT64x128x128_MI32x32x1_SN_LDSB1_AFC1_GRVWA8_GSU1_LBSPPA0_LBSPPB256_LPA0_MIWT2_1_NEPBS16_NLCA1_SVW2_VWA2_WG32_8_1_WGM1
    SolutionIndex: 469
    SolutionNameMin: Cijk_Ailk_Bljk_HF8_HHS_BH_Bias_AS_SAB_SAV_MT128x128x32_MI32x32x1_SN_LDSB1_AFC1_GRVWA8_GSU1_LBSPPA0_LBSPPB128_LPA0_MIWT2_2_NEPBS0_NLCA1_SVW2_VWA2_WG64_4_1_WGM1
    SolutionIndex: 470
    SolutionNameMin: Cijk_Ailk_Bljk_HF8_HHS_BH_Bias_AS_SAB_SAV_MT256x128x64_MI32x32x1_SN_LDSB1_AFC0_GRVWA8_GSU4_LBSPPA0_LBSPPB128_LPA0_MIWT4_2_NEPBS16_NLCA1_SVW4_VWA4_WG64_4_1_WGM1
    SolutionIndex: 471
    SolutionNameMin: Cijk_Ailk_Bljk_HF8_HHS_BH_Bias_AS_SAB_SAV_MT192x160x64_MI16x16x1_SN_LDSB1_AFC0_GRVWA8_GSU2_LBSPPA1536_LBSPPB128_LPA16_MIWT6_5_NEPBS16_NLCA3_SVW2_VWA2_WG32_8_1_WGM1
    SolutionIndex: 472
    SolutionNameMin: Cijk_Ailk_Bljk_HF8_HHS_BH_Bias_AS_SAB_SAV_MT128x256x64_MI32x32x1_SN_LDSB1_AFC1_GRVWA8_GSU1_LBSPPA0_LBSPPB128_LPA0_MIWT2_4_NEPBS16_NLCA1_SVW2_VWA2_WG64_4_1_WGM1
    SolutionIndex: 473
    SolutionNameMin: Cijk_Ailk_Bljk_HF8_HHS_BH_Bias_AS_SAB_SAV_MT192x160x64_MI16x16x1_SN_LDSB1_AFC1_GRVWA8_GSU1_LBSPPA1536_LBSPPB128_LPA16_MIWT6_5_NEPBS0_NLCA3_SVW2_VWA2_WG32_8_1_WGM20
    SolutionIndex: 474
    SolutionNameMin: Cijk_Ailk_Bljk_HF8_HHS_BH_Bias_AS_SAB_SAV_MT256x128x32_MI32x32x1_SN_LDSB1_AFC1_GRVWA8_GSU1_LBSPPA0_LBSPPB128_LPA0_MIWT4_2_NEPBS16_NLCA1_SVW4_VWA4_WG64_4_1_WGM20
    SolutionIndex: 475
    SolutionNameMin: Cijk_Ailk_Bljk_HF8_HHS_BH_Bias_AS_SAB_SAV_MT256x192x32_MI32x32x1_SN_LDSB0_AFC1_GRVWA8_GSU1_LBSPPA0_LBSPPB128_LPA0_MIWT2_6_NEPBS16_NLCA1_SVW2_VWA2_WG128_2_1_WGM20
    SolutionIndex: 476
    SolutionNameMin: Cijk_Ailk_Bljk_HF8_HHS_BH_Bias_AS_SAB_SAV_MT256x192x32_MI32x32x1_SN_LDSB0_AFC1_GRVWA8_GSU1_LBSPPA0_LBSPPB128_LPA0_MIWT2_6_NEPBS0_NLCA1_SVW2_VWA2_WG128_2_1_WGM20
    SolutionIndex: 477
    SolutionNameMin: Cijk_Ailk_Bljk_HF8_HHS_BH_Bias_AS_SAB_SAV_MT256x256x32_MI32x32x1_SN_LDSB1_AFC1_GRVWA8_GSU1_LBSPPA0_LBSPPB128_LPA0_MIWT2_8_NEPBS16_NLCA1_SVW2_VWA2_WG128_2_1_WGM20
    SolutionIndex: 478
    SolutionNameMin: Cijk_Ailk_Bljk_HF8_HHS_BH_Bias_AS_SAB_SAV_MT256x256x32_MI32x32x1_SN_LDSB1_AFC1_GRVWA8_GSU1_LBSPPA0_LBSPPB128_LPA0_MIWT2_8_NEPBS0_NLCA1_SVW2_VWA2_WG128_2_1_WGM20
    SolutionIndex: 479
    SolutionNameMin: Cijk_Ailk_Bljk_HF8_HHS_BH_Bias_AS_SAB_SAV_MT256x224x64_MI32x32x1_SN_LDSB1_AFC1_GRVWA8_GSU1_LBSPPA0_LBSPPB128_LPA0_MIWT2_7_NEPBS16_NLCA1_SVW2_VWA2_WG128_2_1_WGM20
    SolutionIndex: 480
    SolutionNameMin: Cijk_Ailk_Bljk_HF8_HHS_BH_Bias_AS_SAB_SAV_MT192x224x64_MI16x16x1_SN_LDSB1_AFC1_GRVWA8_GSU1_LBSPPA1536_LBSPPB128_LPA16_MIWT3_14_NEPBS16_NLCA3_SVW1_VWA1_WG64_4_1_WGM20
    SolutionIndex: 481
    SolutionNameMin: Cijk_Ailk_Bljk_HF8_HHS_BH_Bias_AS_SAB_SAV_MT128x32x64_MI32x32x1_SN_LDSB0_AFC0_GRVWA8_GSU4_LBSPPA0_LBSPPB128_LPA0_MIWT1_1_NEPBS16_NLCA1_SVW1_VWA1_WG128_2_1_WGM1
    SolutionIndex: 482
    SolutionNameMin: Cijk_Ailk_Bljk_HF8_HHS_BH_Bias_AS_SAB_SAV_MT256x32x64_MI32x32x1_SN_LDSB1_AFC0_GRVWA8_GSU8_LBSPPA0_LBSPPB128_LPA0_MIWT2_1_NEPBS0_NLCA1_SVW2_VWA2_WG128_2_1_WGM20
    SolutionIndex: 483
    SolutionNameMin: Cijk_Ailk_Bljk_HF8_HHS_BH_Bias_AS_SAB_SAV_MT256x32x64_MI32x32x1_SN_LDSB1_AFC0_GRVWA8_GSU8_LBSPPA0_LBSPPB128_LPA0_MIWT2_1_NEPBS16_NLCA1_SVW2_VWA2_WG128_2_1_WGM1
    SolutionIndex: 484
    SolutionNameMin: Cijk_Ailk_Bljk_HF8_HHS_BH_Bias_AS_SAB_SAV_MT192x32x128_MI16x16x1_SN_LDSB1_AFC0_GRVWA8_GSU9_LBSPPA1536_LBSPPB256_LPA16_MIWT6_1_NEPBS16_NLCA3_SVW2_VWA2_WG32_8_1_WGM20
    SolutionIndex: 485
    SolutionNameMin: Cijk_Ailk_Bljk_HF8_HHS_BH_Bias_AS_SAB_SAV_MT256x64x32_MI32x32x1_SN_LDSB1_AFC0_GRVWA8_GSU9_LBSPPA0_LBSPPB128_LPA0_MIWT2_2_NEPBS16_NLCA1_SVW2_VWA2_WG128_2_1_WGM1
    SolutionIndex: 486
    SolutionNameMin: Cijk_Ailk_Bljk_HF8_HHS_BH_Bias_AS_SAB_SAV_MT128x64x64_MI32x32x1_SN_LDSB1_AFC0_GRVWA8_GSU4_LBSPPA0_LBSPPB128_LPA0_MIWT2_1_NEPBS0_NLCA1_SVW2_VWA2_WG64_4_1_WGM1
    SolutionIndex: 487
    SolutionNameMin: Cijk_Ailk_Bljk_HF8_HHS_BH_Bias_AS_SAB_SAV_MT128x128x64_MI32x32x1_SN_LDSB1_AFC0_GRVWA8_GSU4_LBSPPA0_LBSPPB128_LPA0_MIWT2_2_NEPBS16_NLCA1_SVW2_VWA2_WG64_4_1_WGM20
    SolutionIndex: 488
    SolutionNameMin: Cijk_Ailk_Bljk_HF8_HHS_BH_Bias_AS_SAB_SAV_MT256x128x64_MI32x32x1_SN_LDSB1_AFC0_GRVWA8_GSU10_LBSPPA0_LBSPPB128_LPA0_MIWT4_2_NEPBS16_NLCA1_SVW4_VWA4_WG64_4_1_WGM20
    SolutionIndex: 489
    SolutionNameMin: Cijk_Ailk_Bljk_HF8_HHS_BH_Bias_AS_SAB_SAV_MT128x64x32_MI32x32x1_SN_LDSB0_AFC1_GRVWA8_GSU1_LBSPPA0_LBSPPB128_LPA0_MIWT2_1_NEPBS16_NLCA1_SVW2_VWA2_WG64_4_1_WGM1
    SolutionIndex: 490
    SolutionNameMin: Cijk_Ailk_Bljk_HF8_HHS_BH_Bias_AS_SAB_SAV_MT128x256x64_MI32x32x1_SN_LDSB1_AFC0_GRVWA8_GSU8_LBSPPA0_LBSPPB128_LPA0_MIWT2_4_NEPBS0_NLCA1_SVW2_VWA2_WG64_4_1_WGM1
    SolutionIndex: 491
    SolutionNameMin: Cijk_Ailk_Bljk_HF8_HHS_BH_Bias_AS_SAB_SAV_MT192x48x128_MI16x16x1_SN_LDSB1_AFC0_GRVWA8_GSU9_LBSPPA1536_LBSPPB256_LPA16_MIWT3_3_NEPBS16_NLCA3_SVW1_VWA1_WG64_4_1_WGM1
    SolutionIndex: 492
    SolutionNameMin: Cijk_Ailk_Bljk_HF8_HHS_BH_Bias_AS_SAB_SAV_MT256x32x64_MI32x32x1_SN_LDSB1_AFC0_GRVWA8_GSU10_LBSPPA0_LBSPPB128_LPA0_MIWT2_1_NEPBS0_NLCA1_SVW2_VWA2_WG128_2_1_WGM1
    SolutionIndex: 493
    SolutionNameMin: Cijk_Ailk_Bljk_HF8_HHS_BH_Bias_AS_SAB_SAV_MT256x64x64_MI32x32x1_SN_LDSB1_AFC0_GRVWA8_GSU9_LBSPPA0_LBSPPB128_LPA0_MIWT2_2_NEPBS0_NLCA1_SVW2_VWA2_WG128_2_1_WGM1
    SolutionIndex: 494
    SolutionNameMin: Cijk_Ailk_Bljk_HF8_HHS_BH_Bias_AS_SAB_SAV_MT192x128x64_MI32x32x1_SN_LDSB1_AFC0_GRVWA8_GSU4_LBSPPA0_LBSPPB128_LPA0_MIWT6_1_NEPBS16_NLCA3_SVW2_VWA2_WG32_8_1_WGM1
    SolutionIndex: 495
    SolutionNameMin: Cijk_Ailk_Bljk_HF8_HHS_BH_Bias_AS_SAB_SAV_MT128x256x64_MI32x32x1_SN_LDSB1_AFC0_GRVWA8_GSU4_LBSPPA0_LBSPPB128_LPA0_MIWT2_4_NEPBS0_NLCA1_SVW2_VWA2_WG64_4_1_WGM1
    SolutionIndex: 496
    SolutionNameMin: Cijk_Ailk_Bljk_HF8_HHS_BH_Bias_AS_SAB_SAV_MT192x128x64_MI32x32x1_SN_LDSB1_AFC0_GRVWA8_GSU4_LBSPPA0_LBSPPB128_LPA0_MIWT6_1_NEPBS0_NLCA3_SVW2_VWA2_WG32_8_1_WGM1
    SolutionIndex: 497
    SolutionNameMin: Cijk_Ailk_Bljk_HF8_HHS_BH_Bias_AS_SAB_SAV_MT128x128x32_MI32x32x1_SN_LDSB1_AFC1_GRVWA8_GSU1_LBSPPA0_LBSPPB128_LPA0_MIWT2_2_NEPBS16_NLCA1_SVW2_VWA2_WG64_4_1_WGM1
    SolutionIndex: 498
    SolutionNameMin: Cijk_Ailk_Bljk_HF8_HHS_BH_Bias_AS_SAB_SAV_MT128x128x64_MI32x32x1_SN_LDSB1_AFC1_GSU1_LBSPPA0_LBSPPB128_LPA0_LWPM0p40_MIWT2_2_NLCA1_SVW2_VWA2_WG64_4_1_WGM1
    SolutionIndex: 499
    SolutionNameMin: Cijk_Ailk_Bljk_HF8_HHS_BH_Bias_AS_SAB_SAV_MT256x64x64_MI32x32x1_SN_LDSB1_AFC1_GSU1_LBSPPA0_LBSPPB128_LPA0_LWPMn1_MIWT2_2_NLCA1_SVW2_VWA2_WG128_2_1_WGM1
    SolutionIndex: 500
    SolutionNameMin: Cijk_Ailk_Bljk_HF8_HHS_BH_Bias_AS_SAB_SAV_MT128x128x64_MI32x32x1_SN_LDSB1_AFC1_GSU1_LBSPPA0_LBSPPB128_LPA0_LWPMn1_MIWT2_2_NLCA1_SVW2_VWA2_WG64_4_1_WGM1
    SolutionIndex: 501
    SolutionNameMin: Cijk_Ailk_Bljk_HF8_HHS_BH_Bias_AS_SAB_SAV_MT256x128x64_MI32x32x1_SN_LDSB1_AFC1_GSU1_LBSPPA0_LBSPPB128_LPA0_LWPMn1_MIWT4_2_NLCA1_SVW4_VWA4_WG64_4_1_WGM1
    SolutionIndex: 502
    SolutionNameMin: Cijk_Ailk_Bljk_HF8_HHS_BH_Bias_AS_SAB_SAV_MT256x128x32_MI32x32x1_SN_LDSB1_AFC1_GSU1_LBSPPA0_LBSPPB128_LPA0_LWPM0p40_MIWT4_2_NLCA1_SVW4_VWA4_WG64_4_1_WGM1
    SolutionIndex: 503
    SolutionNameMin: Cijk_Ailk_Bljk_HF8_HHS_BH_Bias_AS_SAB_SAV_MT256x128x64_MI32x32x1_SN_LDSB1_AFC1_GSU1_LBSPPA0_LBSPPB128_LPA0_LWPM0p40_MIWT4_2_NLCA1_SVW4_VWA4_WG64_4_1_WGM1
    SolutionIndex: 504
    SolutionNameMin: Cijk_Ailk_Bljk_HF8_HHS_BH_Bias_AS_SAB_SAV_MT192x160x64_MI16x16x1_SN_LDSB1_AFC1_GSU1_LBSPPA1536_LBSPPB128_LPA16_LWPMn1_MIWT6_5_NLCA3_SVW2_VWA2_WG32_8_1_WGM1
    SolutionIndex: 505
    SolutionNameMin: Cijk_Ailk_Bljk_HF8_HHS_BH_Bias_AS_SAB_SAV_MT256x128x32_MI32x32x1_SN_LDSB1_AFC1_GSU1_LBSPPA0_LBSPPB128_LPA0_LWPMn1_MIWT4_2_NLCA1_SVW4_VWA4_WG64_4_1_WGM1
    SolutionIndex: 506
    SolutionNameMin: Cijk_Ailk_Bljk_HF8_HHS_BH_Bias_AS_SAB_SAV_MT256x224x64_MI32x32x1_SN_LDSB1_AFC1_GSU1_LBSPPA0_LBSPPB128_LPA0_LWPM0p40_MIWT2_7_NLCA1_SVW2_VWA2_WG128_2_1_WGM1
    SolutionIndex: 507
    SolutionNameMin: Cijk_Ailk_Bljk_HF8_HHS_BH_Bias_AS_SAB_SAV_MT256x224x64_MI32x32x1_SN_LDSB1_AFC1_GSU1_LBSPPA0_LBSPPB128_LPA0_LWPMn1_MIWT2_7_NLCA1_SVW2_VWA2_WG128_2_1_WGM1
    SolutionIndex: 508
    SolutionNameMin: Cijk_Ailk_Bljk_HF8_HHS_BH_Bias_AS_SAB_SAV_MT256x192x64_MI32x32x1_SN_LDSB1_AFC1_GSU1_LBSPPA0_LBSPPB128_LPA0_LWPM0p40_MIWT2_6_NLCA1_SVW2_VWA2_WG128_2_1_WGM1
    SolutionIndex: 509
    SolutionNameMin: Cijk_Ailk_Bljk_HF8_HHS_BH_Bias_AS_SAB_SAV_MT256x192x64_MI32x32x1_SN_LDSB1_AFC1_GSU1_LBSPPA0_LBSPPB128_LPA0_LWPMn1_MIWT2_6_NLCA1_SVW2_VWA2_WG128_2_1_WGM1
    SolutionIndex: 510
    SolutionNameMin: Cijk_Ailk_Bljk_HF8_HHS_BH_Bias_AS_SAB_SAV_MT192x96x64_MI16x16x1_SN_LDSB1_AFC1_GSU1_LBSPPA1536_LBSPPB128_LPA16_LWPMn1_MIWT6_3_NLCA3_SVW2_VWA2_WG32_8_1_WGM1
    SolutionIndex: 511
    SolutionNameMin: Cijk_Ailk_Bljk_HF8_HHS_BH_Bias_AS_SAB_SAV_MT192x128x64_MI32x32x1_SN_LDSB1_AFC1_GSU1_LBSPPA0_LBSPPB128_LPA0_LWPMn1_MIWT6_1_NLCA3_SVW2_VWA2_WG32_8_1_WGM1
    SolutionIndex: 512
    SolutionNameMin: Cijk_Ailk_Bljk_HF8_HHS_BH_Bias_AS_SAB_SAV_MT256x96x64_MI32x32x1_SN_LDSB1_AFC1_GSU1_LBSPPA0_LBSPPB128_LPA0_LWPMn1_MIWT2_3_NLCA1_SVW2_VWA2_WG128_2_1_WGM1
    SolutionIndex: 513
    SolutionNameMin: Cijk_Ailk_Bljk_HF8_HHS_BH_Bias_AS_SAB_SAV_MT192x256x32_MI32x32x1_SN_LDSB0_AFC1_GSU1_LBSPPA0_LBSPPB128_LPA0_LWPMn1_MIWT3_4_NLCA3_SVW1_VWA1_WG64_4_1_WGM1
    SolutionIndex: 514
    SolutionNameMin: Cijk_Ailk_Bljk_HF8_HHS_BH_Bias_AS_SAB_SAV_MT192x256x64_MI32x32x1_SN_LDSB1_AFC1_GSU1_LBSPPA0_LBSPPB128_LPA0_LWPMn1_MIWT3_4_NLCA3_SVW1_VWA1_WG64_4_1_WGM1
    SolutionIndex: 515
    SolutionNameMin: Cijk_Ailk_Bljk_HF8_HHS_BH_Bias_AS_SAB_SAV_MT192x256x64_MI32x32x1_SN_LDSB1_AFC1_GSU1_LBSPPA0_LBSPPB128_LPA0_LWPM0p40_MIWT3_4_NLCA3_SVW1_VWA1_WG64_4_1_WGM1
    SolutionIndex: 516
    SolutionNameMin: Cijk_Ailk_Bljk_HF8_HHS_BH_Bias_AS_SAB_SAV_MT192x224x64_MI16x16x1_SN_LDSB1_AFC1_GSU1_LBSPPA1536_LBSPPB128_LPA16_LWPM0p40_MIWT3_14_NLCA3_SVW1_VWA1_WG64_4_1_WGM1
    SolutionIndex: 517
    SolutionNameMin: Cijk_Ailk_Bljk_HF8_HHS_BH_Bias_AS_SAB_SAV_MT192x224x64_MI16x16x1_SN_LDSB1_AFC1_GSU1_LBSPPA1536_LBSPPB128_LPA16_LWPMn1_MIWT3_14_NLCA3_SVW1_VWA1_WG64_4_1_WGM1
    SolutionIndex: 518
    SolutionNameMin: Cijk_Ailk_Bljk_HF8_HHS_BH_Bias_AS_SAB_SAV_MT256x256x32_MI32x32x1_SN_LDSB1_AFC1_GSU1_LBSPPA0_LBSPPB128_LPA0_LWPM0p40_MIWT2_8_NLCA1_SVW2_VWA2_WG128_2_1_WGM20
    SolutionIndex: 519
    SolutionNameMin: Cijk_Ailk_Bljk_HF8_HHS_BH_Bias_AS_SAB_SAV_MT128x32x64_MI32x32x1_SN_LDSB0_AFC1_GSU1_LBSPPA0_LBSPPB128_LPA0_LWPM0p40_MIWT1_1_NLCA1_SVW1_VWA1_WG128_2_1_WGM1
    SolutionIndex: 520
    SolutionNameMin: Cijk_Ailk_Bljk_HF8_HHS_BH_Bias_AS_SAB_SAV_MT64x32x128_MI16x16x1_SN_LDSB1_AFC1_GSU1_LBSPPA512_LBSPPB256_LPA16_LWPM0p40_MIWT2_1_NLCA1_SVW2_VWA2_WG32_8_1_WGM1
    SolutionIndex: 521
    SolutionNameMin: Cijk_Ailk_Bljk_HF8_HHS_BH_Bias_AS_SAB_SAV_MT64x16x128_MI16x16x1_SN_LDSB0_AFC1_GSU1_LBSPPA512_LBSPPB256_LPA16_LWPMn1_MIWT1_1_NLCA1_SVW1_VWA1_WG64_4_1_WGM1
    SolutionIndex: 522
    SolutionNameMin: Cijk_Ailk_Bljk_HF8_HHS_BH_Bias_AS_SAB_SAV_MT256x32x64_MI32x32x1_SN_LDSB1_AFC0_GSU4_LBSPPA0_LBSPPB128_LPA0_LWPMn1_MIWT2_1_NLCA1_SVW2_VWA2_WG128_2_1_WGM1
    SolutionIndex: 523
    SolutionNameMin: Cijk_Ailk_Bljk_HF8_HHS_BH_Bias_AS_SAB_SAV_MT256x32x64_MI32x32x1_SN_LDSB1_AFC0_GSU8_LBSPPA0_LBSPPB128_LPA0_LWPMn1_MIWT2_1_NLCA1_SVW2_VWA2_WG128_2_1_WGM20
    SolutionIndex: 524
    SolutionNameMin: Cijk_Ailk_Bljk_HF8_HHS_BH_Bias_AS_SAB_SAV_MT64x32x128_MI16x16x1_SN_LDSB1_AFC1_GSU1_LBSPPA512_LBSPPB256_LPA16_LWPMn1_MIWT2_1_NLCA1_SVW2_VWA2_WG32_8_1_WGM1
    SolutionIndex: 525
    SolutionNameMin: Cijk_Ailk_Bljk_HF8_HHS_BH_Bias_AS_SAB_SAV_MT64x32x64_MI16x16x1_SN_LDSB0_AFC1_GSU1_LBSPPA512_LBSPPB128_LPA16_LWPM0p40_MIWT2_1_NLCA1_SVW2_VWA2_WG32_8_1_WGM1
    SolutionIndex: 526
    SolutionNameMin: Cijk_Ailk_Bljk_HF8_HHS_BH_Bias_AS_SAB_SAV_MT256x64x64_MI32x32x1_SN_LDSB1_AFC0_GSU8_LBSPPA0_LBSPPB128_LPA0_LWPM0p40_MIWT2_2_NLCA1_SVW2_VWA2_WG128_2_1_WGM20
    SolutionIndex: 527
    SolutionNameMin: Cijk_Ailk_Bljk_HF8_HHS_BH_Bias_AS_SAB_SAV_MT256x64x64_MI32x32x1_SN_LDSB1_AFC0_GSU8_LBSPPA0_LBSPPB128_LPA0_LWPM0p40_MIWT2_2_NLCA1_SVW2_VWA2_WG128_2_1_WGM1
    SolutionIndex: 528
    SolutionNameMin: Cijk_Ailk_Bljk_HF8_HHS_BH_Bias_AS_SAB_SAV_MT128x64x128_MI32x32x1_SN_LDSB1_AFC1_GSU1_LBSPPA0_LBSPPB256_LPA0_LWPMn1_MIWT2_1_NLCA1_SVW2_VWA2_WG64_4_1_WGM20
    SolutionIndex: 529
    SolutionNameMin: Cijk_Ailk_Bljk_HF8_HHS_BH_Bias_AS_SAB_SAV_MT64x64x64_MI32x32x1_SN_LDSB0_AFC1_GSU1_LBSPPA0_LBSPPB128_LPA0_LWPMn1_MIWT1_1_NLCA1_SVW1_VWA1_WG64_4_1_WGM1
    SolutionIndex: 530
    SolutionNameMin: Cijk_Ailk_Bljk_HF8_HHS_BH_Bias_AS_SAB_SAV_MT128x128x64_MI32x32x1_SN_LDSB1_AFC0_GSU4_LBSPPA0_LBSPPB128_LPA0_LWPM0p40_MIWT2_2_NLCA1_SVW2_VWA2_WG64_4_1_WGM1
    SolutionIndex: 531
    SolutionNameMin: Cijk_Ailk_Bljk_HF8_HHS_BH_Bias_AS_SAB_SAV_MT256x128x64_MI32x32x1_SN_LDSB1_AFC0_GSU8_LBSPPA0_LBSPPB128_LPA0_LWPM0p40_MIWT4_2_NLCA1_SVW4_VWA4_WG64_4_1_WGM1
    SolutionIndex: 532
    SolutionNameMin: Cijk_Ailk_Bljk_HF8_HHS_BH_Bias_AS_SAB_SAV_MT128x128x64_MI32x32x1_SN_LDSB1_AFC1_GSU1_LBSPPA0_LBSPPB128_LPA0_LWPMn1_MIWT2_2_NLCA1_SVW2_VWA2_WG64_4_1_WGM20
    SolutionIndex: 533
    SolutionNameMin: Cijk_Ailk_Bljk_HF8_HHS_BH_Bias_AS_SAB_SAV_MT64x128x128_MI32x32x1_SN_LDSB1_AFC1_GSU1_LBSPPA0_LBSPPB256_LPA0_LWPMn1_MIWT2_1_NLCA1_SVW2_VWA2_WG32_8_1_WGM1
    SolutionIndex: 534
    SolutionNameMin: Cijk_Ailk_Bljk_HF8_HHS_BH_Bias_AS_SAB_SAV_MT128x256x64_MI32x32x1_SN_LDSB1_AFC0_GSU4_LBSPPA0_LBSPPB128_LPA0_LWPM0p40_MIWT2_4_NLCA1_SVW2_VWA2_WG64_4_1_WGM1
    SolutionIndex: 535
    SolutionNameMin: Cijk_Ailk_Bljk_HF8_HHS_BH_Bias_AS_SAB_SAV_MT256x128x32_MI32x32x1_SN_LDSB1_AFC0_GSU4_LBSPPA0_LBSPPB128_LPA0_LWPM0p40_MIWT4_2_NLCA1_SVW4_VWA4_WG64_4_1_WGM1
    SolutionIndex: 536
    SolutionNameMin: Cijk_Ailk_Bljk_HF8_HHS_BH_Bias_AS_SAB_SAV_MT256x96x64_MI32x32x1_SN_LDSB1_AFC1_GSU1_LBSPPA0_LBSPPB128_LPA0_LWPM0p40_MIWT2_3_NLCA1_SVW2_VWA2_WG128_2_1_WGM1
    SolutionIndex: 537
    SolutionNameMin: Cijk_Ailk_Bljk_HF8_HHS_BH_Bias_AS_SAB_SAV_MT256x256x32_MI32x32x1_SN_LDSB1_AFC1_GSU1_LBSPPA0_LBSPPB128_LPA0_LWPM0p40_MIWT2_8_NLCA1_SVW2_VWA2_WG128_2_1_WGM1
    SolutionIndex: 538
    SolutionNameMin: Cijk_Ailk_Bljk_HF8_HHS_BH_Bias_AS_SAB_SAV_MT256x192x32_MI32x32x1_SN_LDSB0_AFC1_GSU1_LBSPPA0_LBSPPB128_LPA0_LWPM0p40_MIWT2_6_NLCA1_SVW2_VWA2_WG128_2_1_WGM1
    SolutionIndex: 539
    SolutionNameMin: Cijk_Ailk_Bljk_HF8_HHS_BH_Bias_AS_SAB_SAV_MT64x32x64_MI16x16x1_SN_LDSB0_AFC1_GSU1_LBSPPA512_LBSPPB128_LPA16_LWPM0p40_MIWT2_1_NLCA1_SVW2_VWA2_WG32_8_1_WGM20
    SolutionIndex: 540
    SolutionNameMin: Cijk_Ailk_Bljk_HF8_HHS_BH_Bias_AS_SAB_SAV_MT256x32x64_MI32x32x1_SN_LDSB1_AFC0_GSU4_LBSPPA0_LBSPPB128_LPA0_LWPM0p40_MIWT2_1_NLCA1_SVW2_VWA2_WG128_2_1_WGM20
    SolutionIndex: 541
    SolutionNameMin: Cijk_Ailk_Bljk_HF8_HHS_BH_Bias_AS_SAB_SAV_MT128x64x64_MI32x32x1_SN_LDSB1_AFC1_GSU1_LBSPPA0_LBSPPB128_LPA0_LWPMn1_MIWT2_1_NLCA1_SVW2_VWA2_WG64_4_1_WGM1
    SolutionIndex: 542
    SolutionNameMin: Cijk_Ailk_Bljk_HF8_HHS_BH_Bias_AS_SAB_SAV_MT64x64x64_MI32x32x1_SN_LDSB0_AFC1_GSU1_LBSPPA0_LBSPPB128_LPA0_LWPMn1_MIWT1_1_NLCA1_SVW1_VWA1_WG64_4_1_WGM20
    SolutionIndex: 543
    SolutionNameMin: Cijk_Ailk_Bljk_HF8_HHS_BH_Bias_AS_SAB_SAV_MT256x64x64_MI32x32x1_SN_LDSB1_AFC0_GSU10_LBSPPA0_LBSPPB128_LPA0_LWPM0p40_MIWT2_2_NLCA1_SVW2_VWA2_WG128_2_1_WGM20
    SolutionIndex: 544
    SolutionNameMin: Cijk_Ailk_Bljk_HF8_HHS_BH_Bias_AS_SAB_SAV_MT64x128x64_MI32x32x1_SN_LDSB1_AFC1_GSU1_LBSPPA0_LBSPPB128_LPA0_LWPMn1_MIWT2_1_NLCA1_SVW2_VWA2_WG32_8_1_WGM20
    SolutionIndex: 545
    SolutionNameMin: Cijk_Ailk_Bljk_HF8_HHS_BH_Bias_AS_SAB_SAV_MT128x64x128_MI32x32x1_SN_LDSB1_AFC1_GSU1_LBSPPA0_LBSPPB256_LPA0_LWPMn1_MIWT2_1_NLCA1_SVW2_VWA2_WG64_4_1_WGM1
    SolutionIndex: 546
    SolutionNameMin: Cijk_Ailk_Bljk_HF8_HHS_BH_Bias_AS_SAB_SAV_MT192x256x32_MI32x32x1_SN_LDSB0_AFC1_GSU1_LBSPPA0_LBSPPB128_LPA0_LWPM0p40_MIWT3_4_NLCA3_SVW1_VWA1_WG64_4_1_WGM1
    SolutionIndex: 547
    SolutionNameMin: Cijk_Ailk_Bljk_HF8_HHS_BH_Bias_AS_SAB_SAV_MT256x128x32_MI32x32x1_SN_LDSB1_AFC1_GSU1_LBSPPA0_LBSPPB128_LPA0_LWPM0p40_MIWT4_2_NLCA1_SVW4_VWA4_WG64_4_1_WGM20
    SolutionIndex: 548
    SolutionNameMin: Cijk_Ailk_Bljk_HF8_HHS_BH_Bias_AS_SAB_SAV_MT192x160x64_MI16x16x1_SN_LDSB1_AFC1_GSU1_LBSPPA1536_LBSPPB128_LPA16_LWPM0p40_MIWT6_5_NLCA3_SVW2_VWA2_WG32_8_1_WGM1
    SolutionIndex: 549
    SolutionNameMin: Cijk_Ailk_Bljk_HF8_HHS_BH_Bias_AS_SAB_SAV_MT256x256x32_MI32x32x1_SN_LDSB1_AFC1_GSU1_LBSPPA0_LBSPPB128_LPA0_LWPMn1_MIWT2_8_NLCA1_SVW2_VWA2_WG128_2_1_WGM20
- - - [128, 1, 1, 640]
    - [3, 3.16783]
  - - [1, 128, 1, 640]
    - [0, 3.91204]
  - - [1, 1, 1, 640]
    - [2, 0.0344828]
  - - [128, 128, 1, 640]
    - [1, 429.041]
  - - [127, 127, 1, 640]
    - [1, 427.967]
  - - [129, 129, 1, 640]
    - [1, 414.406]
  - - [1, 1, 1, 1536]
    - [4, 0.0]
  - - [1, 1, 1, 4608]
    - [5, 0.0]
  - - [1, 1, 1, 8192]
    - [6, 0.0]
  - - [1, 1, 1, 12288]
    - [7, 0.0]
  - - [1, 1, 1, 65536]
    - [8, 0.0]
  - - [1, 16, 1, 1536]
    - [9, 0.0]
  - - [1, 16, 1, 4608]
    - [10, 0.0]
  - - [1, 16, 1, 8192]
    - [8, 0.0]
  - - [1, 16, 1, 12288]
    - [4, 0.0]
  - - [1, 16, 1, 65536]
    - [11, 0.0]
  - - [1, 32, 1, 1536]
    - [9, 0.0]
  - - [1, 32, 1, 4608]
    - [12, 0.0]
  - - [1, 32, 1, 8192]
    - [13, 0.0]
  - - [1, 32, 1, 12288]
    - [14, 0.0]
  - - [1, 32, 1, 65536]
    - [15, 0.0]
  - - [1, 64, 1, 1536]
    - [16, 0.0]
  - - [1, 64, 1, 4608]
    - [17, 0.0]
  - - [1, 64, 1, 8192]
    - [18, 0.0]
  - - [1, 64, 1, 12288]
    - [19, 0.0]
  - - [1, 64, 1, 65536]
    - [20, 0.0]
  - - [1, 128, 1, 1536]
    - [21, 0.0]
  - - [1, 128, 1, 4608]
    - [22, 0.0]
  - - [1, 128, 1, 8192]
    - [23, 0.0]
  - - [1, 128, 1, 12288]
    - [24, 0.0]
  - - [1, 128, 1, 65536]
    - [6, 0.0]
  - - [1, 256, 1, 1536]
    - [16, 0.0]
  - - [1, 256, 1, 4608]
    - [25, 0.0]
  - - [1, 256, 1, 8192]
    - [26, 0.0]
  - - [1, 256, 1, 12288]
    - [27, 0.0]
  - - [1, 256, 1, 65536]
    - [28, 0.0]
  - - [1, 512, 1, 1536]
    - [29, 0.0]
  - - [1, 512, 1, 4608]
    - [30, 0.0]
  - - [1, 512, 1, 8192]
    - [31, 0.0]
  - - [1, 512, 1, 12288]
    - [32, 0.0]
  - - [1, 512, 1, 65536]
    - [33, 0.0]
  - - [1, 768, 1, 1536]
    - [34, 0.0]
  - - [1, 768, 1, 4608]
    - [35, 0.0]
  - - [1, 768, 1, 8192]
    - [36, 0.0]
  - - [1, 768, 1, 12288]
    - [37, 0.0]
  - - [1, 768, 1, 65536]
    - [21, 0.0]
  - - [1, 1024, 1, 1536]
    - [38, 0.0]
  - - [1, 1024, 1, 4608]
    - [35, 0.0]
  - - [1, 1024, 1, 8192]
    - [26, 0.0]
  - - [1, 1024, 1, 12288]
    - [37, 0.0]
  - - [1, 1024, 1, 65536]
    - [39, 0.0]
  - - [1, 2048, 1, 1536]
    - [40, 0.0]
  - - [1, 2048, 1, 4608]
    - [41, 0.0]
  - - [1, 2048, 1, 8192]
    - [42, 0.0]
  - - [1, 2048, 1, 12288]
    - [41, 0.0]
  - - [1, 2048, 1, 65536]
    - [36, 0.0]
  - - [1, 4096, 1, 1536]
    - [40, 0.0]
  - - [1, 4096, 1, 4608]
    - [43, 0.0]
  - - [1, 4096, 1, 8192]
    - [43, 0.0]
  - - [1, 4096, 1, 12288]
    - [44, 0.0]
  - - [1, 4096, 1, 65536]
    - [45, 0.0]
  - - [1, 6144, 1, 1536]
    - [38, 0.0]
  - - [1, 6144, 1, 4608]
    - [46, 0.0]
  - - [1, 6144, 1, 8192]
    - [47, 0.0]
  - - [1, 6144, 1, 12288]
    - [48, 0.0]
  - - [1, 6144, 1, 65536]
    - [47, 0.0]
  - - [1, 8192, 1, 1536]
    - [40, 0.0]
  - - [1, 8192, 1, 4608]
    - [49, 0.0]
  - - [1, 8192, 1, 8192]
    - [40, 0.0]
  - - [1, 8192, 1, 12288]
    - [50, 0.0]
  - - [1, 8192, 1, 65536]
    - [51, 0.0]
  - - [1, 12288, 1, 1536]
    - [52, 0.0]
  - - [1, 12288, 1, 4608]
    - [49, 0.0]
  - - [1, 12288, 1, 8192]
    - [53, 0.0]
  - - [1, 12288, 1, 12288]
    - [53, 0.0]
  - - [1, 12288, 1, 65536]
    - [54, 0.0]
  - - [16, 1, 1, 1536]
    - [55, 0.0]
  - - [16, 1, 1, 4608]
    - [56, 0.0]
  - - [16, 1, 1, 8192]
    - [57, 0.0]
  - - [16, 1, 1, 12288]
    - [58, 0.0]
  - - [16, 1, 1, 65536]
    - [59, 0.0]
  - - [16, 16, 1, 1536]
    - [60, 0.0]
  - - [16, 16, 1, 4608]
    - [61, 0.0]
  - - [16, 16, 1, 8192]
    - [62, 0.0]
  - - [16, 16, 1, 12288]
    - [63, 0.0]
  - - [16, 16, 1, 65536]
    - [64, 0.0]
  - - [16, 32, 1, 1536]
    - [65, 0.0]
  - - [16, 32, 1, 4608]
    - [66, 0.0]
  - - [16, 32, 1, 8192]
    - [67, 0.0]
  - - [16, 32, 1, 12288]
    - [68, 0.0]
  - - [16, 32, 1, 65536]
    - [64, 0.0]
  - - [16, 64, 1, 1536]
    - [69, 0.0]
  - - [16, 64, 1, 4608]
    - [70, 0.0]
  - - [16, 64, 1, 8192]
    - [71, 0.0]
  - - [16, 64, 1, 12288]
    - [63, 0.0]
  - - [16, 64, 1, 65536]
    - [72, 0.0]
  - - [16, 128, 1, 1536]
    - [73, 0.0]
  - - [16, 128, 1, 4608]
    - [74, 0.0]
  - - [16, 128, 1, 8192]
    - [75, 0.0]
  - - [16, 128, 1, 12288]
    - [76, 0.0]
  - - [16, 128, 1, 65536]
    - [77, 0.0]
  - - [16, 256, 1, 1536]
    - [78, 0.0]
  - - [16, 256, 1, 4608]
    - [79, 0.0]
  - - [16, 256, 1, 8192]
    - [63, 0.0]
  - - [16, 256, 1, 12288]
    - [80, 0.0]
  - - [16, 256, 1, 65536]
    - [81, 0.0]
  - - [16, 512, 1, 1536]
    - [82, 0.0]
  - - [16, 512, 1, 4608]
    - [83, 0.0]
  - - [16, 512, 1, 8192]
    - [83, 0.0]
  - - [16, 512, 1, 12288]
    - [80, 0.0]
  - - [16, 512, 1, 65536]
    - [84, 0.0]
  - - [16, 768, 1, 1536]
    - [85, 0.0]
  - - [16, 768, 1, 4608]
    - [86, 0.0]
  - - [16, 768, 1, 8192]
    - [78, 0.0]
  - - [16, 768, 1, 12288]
    - [87, 0.0]
  - - [16, 768, 1, 65536]
    - [88, 0.0]
  - - [16, 1024, 1, 1536]
    - [89, 0.0]
  - - [16, 1024, 1, 4608]
    - [86, 0.0]
  - - [16, 1024, 1, 8192]
    - [78, 0.0]
  - - [16, 1024, 1, 12288]
    - [87, 0.0]
  - - [16, 1024, 1, 65536]
    - [90, 0.0]
  - - [16, 2048, 1, 1536]
    - [91, 0.0]
  - - [16, 2048, 1, 4608]
    - [92, 0.0]
  - - [16, 2048, 1, 8192]
    - [93, 0.0]
  - - [16, 2048, 1, 12288]
    - [94, 0.0]
  - - [16, 2048, 1, 65536]
    - [79, 0.0]
  - - [16, 4096, 1, 1536]
    - [95, 0.0]
  - - [16, 4096, 1, 4608]
    - [96, 0.0]
  - - [16, 4096, 1, 8192]
    - [97, 0.0]
  - - [16, 4096, 1, 12288]
    - [98, 0.0]
  - - [16, 4096, 1, 65536]
    - [96, 0.0]
  - - [16, 6144, 1, 1536]
    - [99, 0.0]
  - - [16, 6144, 1, 4608]
    - [91, 0.0]
  - - [16, 6144, 1, 8192]
    - [100, 0.0]
  - - [16, 6144, 1, 12288]
    - [101, 0.0]
  - - [16, 6144, 1, 65536]
    - [102, 0.0]
  - - [16, 8192, 1, 1536]
    - [103, 0.0]
  - - [16, 8192, 1, 4608]
    - [99, 0.0]
  - - [16, 8192, 1, 8192]
    - [104, 0.0]
  - - [16, 8192, 1, 12288]
    - [105, 0.0]
  - - [16, 8192, 1, 65536]
    - [106, 0.0]
  - - [16, 12288, 1, 1536]
    - [107, 0.0]
  - - [16, 12288, 1, 4608]
    - [103, 0.0]
  - - [16, 12288, 1, 8192]
    - [108, 0.0]
  - - [16, 12288, 1, 12288]
    - [108, 0.0]
  - - [16, 12288, 1, 65536]
    - [102, 0.0]
  - - [32, 1, 1, 1536]
    - [109, 0.0]
  - - [32, 1, 1, 4608]
    - [110, 0.0]
  - - [32, 1, 1, 8192]
    - [110, 0.0]
  - - [32, 1, 1, 12288]
    - [111, 0.0]
  - - [32, 1, 1, 65536]
    - [112, 0.0]
  - - [32, 16, 1, 1536]
    - [113, 0.0]
  - - [32, 16, 1, 4608]
    - [114, 0.0]
  - - [32, 16, 1, 8192]
    - [115, 0.0]
  - - [32, 16, 1, 12288]
    - [116, 0.0]
  - - [32, 16, 1, 65536]
    - [117, 0.0]
  - - [64, 1, 1, 1536]
    - [118, 0.0]
  - - [64, 1, 1, 4608]
    - [119, 0.0]
  - - [64, 1, 1, 8192]
    - [120, 0.0]
  - - [64, 1, 1, 12288]
    - [121, 0.0]
  - - [64, 1, 1, 65536]
    - [122, 0.0]
  - - [64, 16, 1, 1536]
    - [113, 0.0]
  - - [64, 16, 1, 4608]
    - [113, 0.0]
  - - [64, 16, 1, 8192]
    - [123, 0.0]
  - - [64, 16, 1, 12288]
    - [124, 0.0]
  - - [64, 16, 1, 65536]
    - [125, 0.0]
  - - [128, 1, 1, 1536]
    - [126, 0.0]
  - - [128, 1, 1, 4608]
    - [127, 0.0]
  - - [128, 1, 1, 8192]
    - [128, 0.0]
  - - [128, 1, 1, 12288]
    - [129, 0.0]
  - - [128, 1, 1, 65536]
    - [130, 0.0]
  - - [128, 16, 1, 1536]
    - [113, 0.0]
  - - [128, 16, 1, 4608]
    - [113, 0.0]
  - - [128, 16, 1, 8192]
    - [131, 0.0]
  - - [128, 16, 1, 12288]
    - [132, 0.0]
  - - [128, 16, 1, 65536]
    - [133, 0.0]
  - - [256, 1, 1, 1536]
    - [134, 0.0]
  - - [256, 1, 1, 4608]
    - [135, 0.0]
  - - [256, 1, 1, 8192]
    - [136, 0.0]
  - - [256, 1, 1, 12288]
    - [137, 0.0]
  - - [256, 1, 1, 65536]
    - [138, 0.0]
  - - [256, 16, 1, 1536]
    - [134, 0.0]
  - - [256, 16, 1, 4608]
    - [139, 0.0]
  - - [256, 16, 1, 8192]
    - [140, 0.0]
  - - [256, 16, 1, 12288]
    - [140, 0.0]
  - - [256, 16, 1, 65536]
    - [141, 0.0]
  - - [512, 1, 1, 1536]
    - [142, 0.0]
  - - [512, 1, 1, 4608]
    - [143, 0.0]
  - - [512, 1, 1, 8192]
    - [144, 0.0]
  - - [512, 1, 1, 12288]
    - [145, 0.0]
  - - [512, 1, 1, 65536]
    - [146, 0.0]
  - - [512, 16, 1, 1536]
    - [147, 0.0]
  - - [512, 16, 1, 4608]
    - [134, 0.0]
  - - [512, 16, 1, 8192]
    - [148, 0.0]
  - - [512, 16, 1, 12288]
    - [149, 0.0]
  - - [512, 16, 1, 65536]
    - [150, 0.0]
  - - [768, 1, 1, 1536]
    - [151, 0.0]
  - - [768, 1, 1, 4608]
    - [152, 0.0]
  - - [768, 1, 1, 8192]
    - [153, 0.0]
  - - [768, 1, 1, 12288]
    - [144, 0.0]
  - - [768, 1, 1, 65536]
    - [154, 0.0]
  - - [768, 16, 1, 1536]
    - [155, 0.0]
  - - [768, 16, 1, 4608]
    - [156, 0.0]
  - - [768, 16, 1, 8192]
    - [139, 0.0]
  - - [768, 16, 1, 12288]
    - [144, 0.0]
  - - [768, 16, 1, 65536]
    - [157, 0.0]
  - - [1024, 1, 1, 1536]
    - [158, 0.0]
  - - [1024, 1, 1, 4608]
    - [159, 0.0]
  - - [1024, 1, 1, 8192]
    - [144, 0.0]
  - - [1024, 1, 1, 12288]
    - [160, 0.0]
  - - [1024, 1, 1, 65536]
    - [161, 0.0]
  - - [1024, 16, 1, 1536]
    - [162, 0.0]
  - - [1024, 16, 1, 4608]
    - [163, 0.0]
  - - [1024, 16, 1, 8192]
    - [139, 0.0]
  - - [1024, 16, 1, 12288]
    - [153, 0.0]
  - - [1024, 16, 1, 65536]
    - [164, 0.0]
  - - [2048, 1, 1, 1536]
    - [165, 0.0]
  - - [2048, 1, 1, 4608]
    - [166, 0.0]
  - - [2048, 1, 1, 8192]
    - [167, 0.0]
  - - [2048, 1, 1, 12288]
    - [168, 0.0]
  - - [2048, 1, 1, 65536]
    - [169, 0.0]
  - - [2048, 16, 1, 1536]
    - [170, 0.0]
  - - [2048, 16, 1, 4608]
    - [168, 0.0]
  - - [2048, 16, 1, 8192]
    - [171, 0.0]
  - - [2048, 16, 1, 12288]
    - [172, 0.0]
  - - [2048, 16, 1, 65536]
    - [135, 0.0]
  - - [4096, 1, 1, 1536]
    - [173, 0.0]
  - - [4096, 1, 1, 4608]
    - [174, 0.0]
  - - [4096, 1, 1, 8192]
    - [175, 0.0]
  - - [4096, 1, 1, 12288]
    - [176, 0.0]
  - - [4096, 1, 1, 65536]
    - [177, 0.0]
  - - [4096, 16, 1, 1536]
    - [178, 0.0]
  - - [4096, 16, 1, 4608]
    - [174, 0.0]
  - - [4096, 16, 1, 8192]
    - [179, 0.0]
  - - [4096, 16, 1, 12288]
    - [171, 0.0]
  - - [4096, 16, 1, 65536]
    - [180, 0.0]
  - - [6144, 1, 1, 1536]
    - [173, 0.0]
  - - [6144, 1, 1, 4608]
    - [179, 0.0]
  - - [6144, 1, 1, 8192]
    - [181, 0.0]
  - - [6144, 1, 1, 12288]
    - [182, 0.0]
  - - [6144, 1, 1, 65536]
    - [183, 0.0]
  - - [6144, 16, 1, 1536]
    - [173, 0.0]
  - - [6144, 16, 1, 4608]
    - [173, 0.0]
  - - [6144, 16, 1, 8192]
    - [179, 0.0]
  - - [6144, 16, 1, 12288]
    - [179, 0.0]
  - - [6144, 16, 1, 65536]
    - [147, 0.0]
  - - [8192, 1, 1, 1536]
    - [184, 0.0]
  - - [8192, 1, 1, 4608]
    - [185, 0.0]
  - - [8192, 1, 1, 8192]
    - [179, 0.0]
  - - [8192, 1, 1, 12288]
    - [186, 0.0]
  - - [8192, 1, 1, 65536]
    - [146, 0.0]
  - - [8192, 16, 1, 1536]
    - [173, 0.0]
  - - [8192, 16, 1, 4608]
    - [173, 0.0]
  - - [8192, 16, 1, 8192]
    - [187, 0.0]
  - - [8192, 16, 1, 12288]
    - [188, 0.0]
  - - [8192, 16, 1, 65536]
    - [167, 0.0]
  - - [12288, 1, 1, 1536]
    - [178, 0.0]
  - - [12288, 1, 1, 4608]
    - [173, 0.0]
  - - [12288, 1, 1, 8192]
    - [189, 0.0]
  - - [12288, 1, 1, 12288]
    - [175, 0.0]
  - - [12288, 1, 1, 65536]
    - [183, 0.0]
  - - [12288, 16, 1, 1536]
    - [189, 0.0]
  - - [12288, 16, 1, 4608]
    - [178, 0.0]
  - - [12288, 16, 1, 8192]
    - [178, 0.0]
  - - [12288, 16, 1, 12288]
    - [190, 0.0]
  - - [12288, 16, 1, 65536]
    - [168, 0.0]
  - - [32, 32, 1, 1536]
    - [191, 0.0]
  - - [32, 32, 1, 4608]
    - [191, 0.0]
  - - [32, 32, 1, 8192]
    - [192, 0.0]
  - - [32, 32, 1, 12288]
    - [193, 0.0]
  - - [32, 32, 1, 65536]
    - [194, 0.0]
  - - [32, 64, 1, 1536]
    - [195, 0.0]
  - - [32, 64, 1, 4608]
    - [196, 0.0]
  - - [32, 64, 1, 8192]
    - [197, 0.0]
  - - [32, 64, 1, 12288]
    - [198, 0.0]
  - - [32, 64, 1, 65536]
    - [199, 0.0]
  - - [32, 128, 1, 1536]
    - [200, 0.0]
  - - [32, 128, 1, 4608]
    - [201, 0.0]
  - - [32, 128, 1, 8192]
    - [202, 0.0]
  - - [32, 128, 1, 12288]
    - [203, 0.0]
  - - [32, 128, 1, 65536]
    - [204, 0.0]
  - - [32, 256, 1, 1536]
    - [205, 0.0]
  - - [32, 256, 1, 4608]
    - [206, 0.0]
  - - [32, 256, 1, 8192]
    - [207, 0.0]
  - - [32, 256, 1, 12288]
    - [208, 0.0]
  - - [32, 256, 1, 65536]
    - [209, 0.0]
  - - [32, 512, 1, 1536]
    - [210, 0.0]
  - - [32, 512, 1, 4608]
    - [211, 0.0]
  - - [32, 512, 1, 8192]
    - [212, 0.0]
  - - [32, 512, 1, 12288]
    - [213, 0.0]
  - - [32, 512, 1, 65536]
    - [214, 0.0]
  - - [32, 768, 1, 1536]
    - [205, 0.0]
  - - [32, 768, 1, 4608]
    - [215, 0.0]
  - - [32, 768, 1, 8192]
    - [216, 0.0]
  - - [32, 768, 1, 12288]
    - [217, 0.0]
  - - [32, 768, 1, 65536]
    - [218, 0.0]
  - - [32, 1024, 1, 1536]
    - [205, 0.0]
  - - [32, 1024, 1, 4608]
    - [219, 0.0]
  - - [32, 1024, 1, 8192]
    - [220, 0.0]
  - - [32, 1024, 1, 12288]
    - [221, 0.0]
  - - [32, 1024, 1, 65536]
    - [222, 0.0]
  - - [32, 2048, 1, 1536]
    - [223, 0.0]
  - - [32, 2048, 1, 4608]
    - [224, 0.0]
  - - [32, 2048, 1, 8192]
    - [219, 0.0]
  - - [32, 2048, 1, 12288]
    - [225, 0.0]
  - - [32, 2048, 1, 65536]
    - [226, 0.0]
  - - [32, 4096, 1, 1536]
    - [227, 0.0]
  - - [32, 4096, 1, 4608]
    - [205, 0.0]
  - - [32, 4096, 1, 8192]
    - [228, 0.0]
  - - [32, 4096, 1, 12288]
    - [229, 0.0]
  - - [32, 4096, 1, 65536]
    - [230, 0.0]
  - - [32, 6144, 1, 1536]
    - [227, 0.0]
  - - [32, 6144, 1, 4608]
    - [210, 0.0]
  - - [32, 6144, 1, 8192]
    - [231, 0.0]
  - - [32, 6144, 1, 12288]
    - [232, 0.0]
  - - [32, 6144, 1, 65536]
    - [233, 0.0]
  - - [32, 8192, 1, 1536]
    - [234, 0.0]
  - - [32, 8192, 1, 4608]
    - [231, 0.0]
  - - [32, 8192, 1, 8192]
    - [231, 0.0]
  - - [32, 8192, 1, 12288]
    - [223, 0.0]
  - - [32, 8192, 1, 65536]
    - [235, 0.0]
  - - [32, 12288, 1, 1536]
    - [236, 0.0]
  - - [32, 12288, 1, 4608]
    - [237, 0.0]
  - - [32, 12288, 1, 8192]
    - [238, 0.0]
  - - [32, 12288, 1, 12288]
    - [239, 0.0]
  - - [32, 12288, 1, 65536]
    - [240, 0.0]
  - - [64, 32, 1, 1536]
    - [241, 0.0]
  - - [64, 32, 1, 4608]
    - [242, 0.0]
  - - [64, 32, 1, 8192]
    - [243, 0.0]
  - - [64, 32, 1, 12288]
    - [244, 0.0]
  - - [64, 32, 1, 65536]
    - [204, 0.0]
  - - [64, 64, 1, 1536]
    - [245, 0.0]
  - - [64, 64, 1, 4608]
    - [246, 0.0]
  - - [64, 64, 1, 8192]
    - [247, 0.0]
  - - [64, 64, 1, 12288]
    - [248, 0.0]
  - - [64, 64, 1, 65536]
    - [249, 0.0]
  - - [64, 128, 1, 1536]
    - [250, 0.0]
  - - [64, 128, 1, 4608]
    - [251, 0.0]
  - - [64, 128, 1, 8192]
    - [252, 0.0]
  - - [64, 128, 1, 12288]
    - [252, 0.0]
  - - [64, 128, 1, 65536]
    - [253, 0.0]
  - - [64, 256, 1, 1536]
    - [231, 0.0]
  - - [64, 256, 1, 4608]
    - [254, 0.0]
  - - [64, 256, 1, 8192]
    - [255, 0.0]
  - - [64, 256, 1, 12288]
    - [256, 0.0]
  - - [64, 256, 1, 65536]
    - [257, 0.0]
  - - [64, 512, 1, 1536]
    - [231, 0.0]
  - - [64, 512, 1, 4608]
    - [258, 0.0]
  - - [64, 512, 1, 8192]
    - [259, 0.0]
  - - [64, 512, 1, 12288]
    - [260, 0.0]
  - - [64, 512, 1, 65536]
    - [257, 0.0]
  - - [64, 768, 1, 1536]
    - [205, 0.0]
  - - [64, 768, 1, 4608]
    - [261, 0.0]
  - - [64, 768, 1, 8192]
    - [262, 0.0]
  - - [64, 768, 1, 12288]
    - [263, 0.0]
  - - [64, 768, 1, 65536]
    - [264, 0.0]
  - - [64, 1024, 1, 1536]
    - [205, 0.0]
  - - [64, 1024, 1, 4608]
    - [265, 0.0]
  - - [64, 1024, 1, 8192]
    - [259, 0.0]
  - - [64, 1024, 1, 12288]
    - [266, 0.0]
  - - [64, 1024, 1, 65536]
    - [267, 0.0]
  - - [64, 2048, 1, 1536]
    - [268, 0.0]
  - - [64, 2048, 1, 4608]
    - [269, 0.0]
  - - [64, 2048, 1, 8192]
    - [265, 0.0]
  - - [64, 2048, 1, 12288]
    - [270, 0.0]
  - - [64, 2048, 1, 65536]
    - [271, 0.0]
  - - [64, 4096, 1, 1536]
    - [272, 0.0]
  - - [64, 4096, 1, 4608]
    - [273, 0.0]
  - - [64, 4096, 1, 8192]
    - [269, 0.0]
  - - [64, 4096, 1, 12288]
    - [274, 0.0]
  - - [64, 4096, 1, 65536]
    - [275, 0.0]
  - - [64, 6144, 1, 1536]
    - [276, 0.0]
  - - [64, 6144, 1, 4608]
    - [273, 0.0]
  - - [64, 6144, 1, 8192]
    - [268, 0.0]
  - - [64, 6144, 1, 12288]
    - [277, 0.0]
  - - [64, 6144, 1, 65536]
    - [278, 0.0]
  - - [64, 8192, 1, 1536]
    - [276, 0.0]
  - - [64, 8192, 1, 4608]
    - [279, 0.0]
  - - [64, 8192, 1, 8192]
    - [280, 0.0]
  - - [64, 8192, 1, 12288]
    - [281, 0.0]
  - - [64, 8192, 1, 65536]
    - [277, 0.0]
  - - [64, 12288, 1, 1536]
    - [282, 0.0]
  - - [64, 12288, 1, 4608]
    - [283, 0.0]
  - - [64, 12288, 1, 8192]
    - [284, 0.0]
  - - [64, 12288, 1, 12288]
    - [285, 0.0]
  - - [64, 12288, 1, 65536]
    - [286, 0.0]
  - - [128, 32, 1, 1536]
    - [287, 0.0]
  - - [128, 32, 1, 4608]
    - [288, 0.0]
  - - [128, 32, 1, 8192]
    - [288, 0.0]
  - - [128, 32, 1, 12288]
    - [289, 0.0]
  - - [128, 32, 1, 65536]
    - [290, 0.0]
  - - [128, 64, 1, 1536]
    - [250, 0.0]
  - - [128, 64, 1, 4608]
    - [291, 0.0]
  - - [128, 64, 1, 8192]
    - [292, 0.0]
  - - [128, 64, 1, 12288]
    - [293, 0.0]
  - - [128, 64, 1, 65536]
    - [294, 0.0]
  - - [128, 128, 1, 1536]
    - [250, 0.0]
  - - [128, 128, 1, 4608]
    - [295, 0.0]
  - - [128, 128, 1, 8192]
    - [296, 0.0]
  - - [128, 128, 1, 12288]
    - [297, 0.0]
  - - [128, 128, 1, 65536]
    - [294, 0.0]
  - - [128, 256, 1, 1536]
    - [298, 0.0]
  - - [128, 256, 1, 4608]
    - [299, 0.0]
  - - [128, 256, 1, 8192]
    - [300, 0.0]
  - - [128, 256, 1, 12288]
    - [245, 0.0]
  - - [128, 256, 1, 65536]
    - [301, 0.0]
  - - [128, 512, 1, 1536]
    - [231, 0.0]
  - - [128, 512, 1, 4608]
    - [302, 0.0]
  - - [128, 512, 1, 8192]
    - [303, 0.0]
  - - [128, 512, 1, 12288]
    - [304, 0.0]
  - - [128, 512, 1, 65536]
    - [305, 0.0]
  - - [128, 768, 1, 1536]
    - [205, 0.0]
  - - [128, 768, 1, 4608]
    - [306, 0.0]
  - - [128, 768, 1, 8192]
    - [307, 0.0]
  - - [128, 768, 1, 12288]
    - [308, 0.0]
  - - [128, 768, 1, 65536]
    - [309, 0.0]
  - - [128, 1024, 1, 1536]
    - [273, 0.0]
  - - [128, 1024, 1, 4608]
    - [205, 0.0]
  - - [128, 1024, 1, 8192]
    - [310, 0.0]
  - - [128, 1024, 1, 12288]
    - [304, 0.0]
  - - [128, 1024, 1, 65536]
    - [311, 0.0]
  - - [128, 2048, 1, 1536]
    - [312, 0.0]
  - - [128, 2048, 1, 4608]
    - [281, 0.0]
  - - [128, 2048, 1, 8192]
    - [313, 0.0]
  - - [128, 2048, 1, 12288]
    - [314, 0.0]
  - - [128, 2048, 1, 65536]
    - [315, 0.0]
  - - [128, 4096, 1, 1536]
    - [316, 0.0]
  - - [128, 4096, 1, 4608]
    - [276, 0.0]
  - - [128, 4096, 1, 8192]
    - [281, 0.0]
  - - [128, 4096, 1, 12288]
    - [317, 0.0]
  - - [128, 4096, 1, 65536]
    - [318, 0.0]
  - - [128, 6144, 1, 1536]
    - [319, 0.0]
  - - [128, 6144, 1, 4608]
    - [316, 0.0]
  - - [128, 6144, 1, 8192]
    - [320, 0.0]
  - - [128, 6144, 1, 12288]
    - [321, 0.0]
  - - [128, 6144, 1, 65536]
    - [322, 0.0]
  - - [128, 8192, 1, 1536]
    - [323, 0.0]
  - - [128, 8192, 1, 4608]
    - [324, 0.0]
  - - [128, 8192, 1, 8192]
    - [325, 0.0]
  - - [128, 8192, 1, 12288]
    - [324, 0.0]
  - - [128, 8192, 1, 65536]
    - [326, 0.0]
  - - [128, 12288, 1, 1536]
    - [327, 0.0]
  - - [128, 12288, 1, 4608]
    - [325, 0.0]
  - - [128, 12288, 1, 8192]
    - [328, 0.0]
  - - [128, 12288, 1, 12288]
    - [316, 0.0]
  - - [128, 12288, 1, 65536]
    - [329, 0.0]
  - - [256, 32, 1, 1536]
    - [330, 0.0]
  - - [256, 32, 1, 4608]
    - [331, 0.0]
  - - [256, 32, 1, 8192]
    - [332, 0.0]
  - - [256, 32, 1, 12288]
    - [333, 0.0]
  - - [256, 32, 1, 65536]
    - [334, 0.0]
  - - [256, 64, 1, 1536]
    - [269, 0.0]
  - - [256, 64, 1, 4608]
    - [335, 0.0]
  - - [256, 64, 1, 8192]
    - [336, 0.0]
  - - [256, 64, 1, 12288]
    - [337, 0.0]
  - - [256, 64, 1, 65536]
    - [338, 0.0]
  - - [256, 128, 1, 1536]
    - [298, 0.0]
  - - [256, 128, 1, 4608]
    - [339, 0.0]
  - - [256, 128, 1, 8192]
    - [340, 0.0]
  - - [256, 128, 1, 12288]
    - [341, 0.0]
  - - [256, 128, 1, 65536]
    - [342, 0.0]
  - - [256, 256, 1, 1536]
    - [227, 0.0]
  - - [256, 256, 1, 4608]
    - [343, 0.0]
  - - [256, 256, 1, 8192]
    - [344, 0.0]
  - - [256, 256, 1, 12288]
    - [309, 0.0]
  - - [256, 256, 1, 65536]
    - [345, 0.0]
  - - [256, 512, 1, 1536]
    - [346, 0.0]
  - - [256, 512, 1, 4608]
    - [231, 0.0]
  - - [256, 512, 1, 8192]
    - [347, 0.0]
  - - [256, 512, 1, 12288]
    - [348, 0.0]
  - - [256, 512, 1, 65536]
    - [349, 0.0]
  - - [256, 768, 1, 1536]
    - [281, 0.0]
  - - [256, 768, 1, 4608]
    - [269, 0.0]
  - - [256, 768, 1, 8192]
    - [314, 0.0]
  - - [256, 768, 1, 12288]
    - [350, 0.0]
  - - [256, 768, 1, 65536]
    - [351, 0.0]
  - - [256, 1024, 1, 1536]
    - [276, 0.0]
  - - [256, 1024, 1, 4608]
    - [239, 0.0]
  - - [256, 1024, 1, 8192]
    - [352, 0.0]
  - - [256, 1024, 1, 12288]
    - [353, 0.0]
  - - [256, 1024, 1, 65536]
    - [354, 0.0]
  - - [256, 2048, 1, 1536]
    - [328, 0.0]
  - - [256, 2048, 1, 4608]
    - [355, 0.0]
  - - [256, 2048, 1, 8192]
    - [281, 0.0]
  - - [256, 2048, 1, 12288]
    - [356, 0.0]
  - - [256, 2048, 1, 65536]
    - [357, 0.0]
  - - [256, 4096, 1, 1536]
    - [358, 0.0]
  - - [256, 4096, 1, 4608]
    - [324, 0.0]
  - - [256, 4096, 1, 8192]
    - [325, 0.0]
  - - [256, 4096, 1, 12288]
    - [359, 0.0]
  - - [256, 4096, 1, 65536]
    - [360, 0.0]
  - - [256, 6144, 1, 1536]
    - [361, 0.0]
  - - [256, 6144, 1, 4608]
    - [328, 0.0]
  - - [256, 6144, 1, 8192]
    - [328, 0.0]
  - - [256, 6144, 1, 12288]
    - [316, 0.0]
  - - [256, 6144, 1, 65536]
    - [362, 0.0]
  - - [256, 8192, 1, 1536]
    - [363, 0.0]
  - - [256, 8192, 1, 4608]
    - [364, 0.0]
  - - [256, 8192, 1, 8192]
    - [324, 0.0]
  - - [256, 8192, 1, 12288]
    - [316, 0.0]
  - - [256, 8192, 1, 65536]
    - [365, 0.0]
  - - [256, 12288, 1, 1536]
    - [366, 0.0]
  - - [256, 12288, 1, 4608]
    - [367, 0.0]
  - - [256, 12288, 1, 8192]
    - [368, 0.0]
  - - [256, 12288, 1, 12288]
    - [368, 0.0]
  - - [256, 12288, 1, 65536]
    - [369, 0.0]
  - - [512, 32, 1, 1536]
    - [269, 0.0]
  - - [512, 32, 1, 4608]
    - [370, 0.0]
  - - [512, 32, 1, 8192]
    - [371, 0.0]
  - - [512, 32, 1, 12288]
    - [372, 0.0]
  - - [512, 32, 1, 65536]
    - [372, 0.0]
  - - [512, 64, 1, 1536]
    - [373, 0.0]
  - - [512, 64, 1, 4608]
    - [259, 0.0]
  - - [512, 64, 1, 8192]
    - [374, 0.0]
  - - [512, 64, 1, 12288]
    - [296, 0.0]
  - - [512, 64, 1, 65536]
    - [375, 0.0]
  - - [512, 128, 1, 1536]
    - [330, 0.0]
  - - [512, 128, 1, 4608]
    - [376, 0.0]
  - - [512, 128, 1, 8192]
    - [377, 0.0]
  - - [512, 128, 1, 12288]
    - [378, 0.0]
  - - [512, 128, 1, 65536]
    - [345, 0.0]
  - - [512, 256, 1, 1536]
    - [379, 0.0]
  - - [512, 256, 1, 4608]
    - [210, 0.0]
  - - [512, 256, 1, 8192]
    - [380, 0.0]
  - - [512, 256, 1, 12288]
    - [381, 0.0]
  - - [512, 256, 1, 65536]
    - [382, 0.0]
  - - [512, 512, 1, 1536]
    - [239, 0.0]
  - - [512, 512, 1, 4608]
    - [383, 0.0]
  - - [512, 512, 1, 8192]
    - [384, 0.0]
  - - [512, 512, 1, 12288]
    - [385, 0.0]
  - - [512, 512, 1, 65536]
    - [386, 0.0]
  - - [512, 768, 1, 1536]
    - [316, 0.0]
  - - [512, 768, 1, 4608]
    - [387, 0.0]
  - - [512, 768, 1, 8192]
    - [280, 0.0]
  - - [512, 768, 1, 12288]
    - [388, 0.0]
  - - [512, 768, 1, 65536]
    - [350, 0.0]
  - - [512, 1024, 1, 1536]
    - [328, 0.0]
  - - [512, 1024, 1, 4608]
    - [389, 0.0]
  - - [512, 1024, 1, 8192]
    - [390, 0.0]
  - - [512, 1024, 1, 12288]
    - [391, 0.0]
  - - [512, 1024, 1, 65536]
    - [392, 0.0]
  - - [512, 2048, 1, 1536]
    - [316, 0.0]
  - - [512, 2048, 1, 4608]
    - [325, 0.0]
  - - [512, 2048, 1, 8192]
    - [324, 0.0]
  - - [512, 2048, 1, 12288]
    - [391, 0.0]
  - - [512, 2048, 1, 65536]
    - [393, 0.0]
  - - [512, 4096, 1, 1536]
    - [367, 0.0]
  - - [512, 4096, 1, 4608]
    - [316, 0.0]
  - - [512, 4096, 1, 8192]
    - [325, 0.0]
  - - [512, 4096, 1, 12288]
    - [325, 0.0]
  - - [512, 4096, 1, 65536]
    - [394, 0.0]
  - - [512, 6144, 1, 1536]
    - [395, 0.0]
  - - [512, 6144, 1, 4608]
    - [367, 0.0]
  - - [512, 6144, 1, 8192]
    - [361, 0.0]
  - - [512, 6144, 1, 12288]
    - [361, 0.0]
  - - [512, 6144, 1, 65536]
    - [396, 0.0]
  - - [512, 8192, 1, 1536]
    - [397, 0.0]
  - - [512, 8192, 1, 4608]
    - [395, 0.0]
  - - [512, 8192, 1, 8192]
    - [368, 0.0]
  - - [512, 8192, 1, 12288]
    - [327, 0.0]
  - - [512, 8192, 1, 65536]
    - [398, 0.0]
  - - [512, 12288, 1, 1536]
    - [399, 0.0]
  - - [512, 12288, 1, 4608]
    - [400, 0.0]
  - - [512, 12288, 1, 8192]
    - [401, 0.0]
  - - [512, 12288, 1, 12288]
    - [402, 0.0]
  - - [512, 12288, 1, 65536]
    - [401, 0.0]
  - - [768, 32, 1, 1536]
    - [223, 0.0]
  - - [768, 32, 1, 4608]
    - [403, 0.0]
  - - [768, 32, 1, 8192]
    - [295, 0.0]
  - - [768, 32, 1, 12288]
    - [404, 0.0]
  - - [768, 32, 1, 65536]
    - [405, 0.0]
  - - [768, 64, 1, 1536]
    - [273, 0.0]
  - - [768, 64, 1, 4608]
    - [406, 0.0]
  - - [768, 64, 1, 8192]
    - [407, 0.0]
  - - [768, 64, 1, 12288]
    - [408, 0.0]
  - - [768, 64, 1, 65536]
    - [409, 0.0]
  - - [768, 128, 1, 1536]
    - [227, 0.0]
  - - [768, 128, 1, 4608]
    - [410, 0.0]
  - - [768, 128, 1, 8192]
    - [411, 0.0]
  - - [768, 128, 1, 12288]
    - [412, 0.0]
  - - [768, 128, 1, 65536]
    - [413, 0.0]
  - - [768, 256, 1, 1536]
    - [387, 0.0]
  - - [768, 256, 1, 4608]
    - [312, 0.0]
  - - [768, 256, 1, 8192]
    - [352, 0.0]
  - - [768, 256, 1, 12288]
    - [313, 0.0]
  - - [768, 256, 1, 65536]
    - [310, 0.0]
  - - [768, 512, 1, 1536]
    - [414, 0.0]
  - - [768, 512, 1, 4608]
    - [276, 0.0]
  - - [768, 512, 1, 8192]
    - [280, 0.0]
  - - [768, 512, 1, 12288]
    - [415, 0.0]
  - - [768, 512, 1, 65536]
    - [416, 0.0]
  - - [768, 768, 1, 1536]
    - [328, 0.0]
  - - [768, 768, 1, 4608]
    - [279, 0.0]
  - - [768, 768, 1, 8192]
    - [268, 0.0]
  - - [768, 768, 1, 12288]
    - [393, 0.0]
  - - [768, 768, 1, 65536]
    - [417, 0.0]
  - - [768, 1024, 1, 1536]
    - [325, 0.0]
  - - [768, 1024, 1, 4608]
    - [316, 0.0]
  - - [768, 1024, 1, 8192]
    - [276, 0.0]
  - - [768, 1024, 1, 12288]
    - [418, 0.0]
  - - [768, 1024, 1, 65536]
    - [419, 0.0]
  - - [768, 2048, 1, 1536]
    - [420, 0.0]
  - - [768, 2048, 1, 4608]
    - [328, 0.0]
  - - [768, 2048, 1, 8192]
    - [325, 0.0]
  - - [768, 2048, 1, 12288]
    - [421, 0.0]
  - - [768, 2048, 1, 65536]
    - [418, 0.0]
  - - [768, 4096, 1, 1536]
    - [422, 0.0]
  - - [768, 4096, 1, 4608]
    - [361, 0.0]
  - - [768, 4096, 1, 8192]
    - [327, 0.0]
  - - [768, 4096, 1, 12288]
    - [327, 0.0]
  - - [768, 4096, 1, 65536]
    - [423, 0.0]
  - - [768, 6144, 1, 1536]
    - [424, 0.0]
  - - [768, 6144, 1, 4608]
    - [425, 0.0]
  - - [768, 6144, 1, 8192]
    - [395, 0.0]
  - - [768, 6144, 1, 12288]
    - [395, 0.0]
  - - [768, 6144, 1, 65536]
    - [395, 0.0]
  - - [768, 8192, 1, 1536]
    - [426, 0.0]
  - - [768, 8192, 1, 4608]
    - [397, 0.0]
  - - [768, 8192, 1, 8192]
    - [402, 0.0]
  - - [768, 8192, 1, 12288]
    - [427, 0.0]
  - - [768, 8192, 1, 65536]
    - [427, 0.0]
  - - [768, 12288, 1, 1536]
    - [428, 0.0]
  - - [768, 12288, 1, 4608]
    - [429, 0.0]
  - - [768, 12288, 1, 8192]
    - [430, 0.0]
  - - [768, 12288, 1, 12288]
    - [424, 0.0]
  - - [768, 12288, 1, 65536]
    - [424, 0.0]
  - - [1024, 32, 1, 1536]
    - [231, 0.0]
  - - [1024, 32, 1, 4608]
    - [431, 0.0]
  - - [1024, 32, 1, 8192]
    - [403, 0.0]
  - - [1024, 32, 1, 12288]
    - [295, 0.0]
  - - [1024, 32, 1, 65536]
    - [432, 0.0]
  - - [1024, 64, 1, 1536]
    - [250, 0.0]
  - - [1024, 64, 1, 4608]
    - [433, 0.0]
  - - [1024, 64, 1, 8192]
    - [434, 0.0]
  - - [1024, 64, 1, 12288]
    - [435, 0.0]
  - - [1024, 64, 1, 65536]
    - [436, 0.0]
  - - [1024, 128, 1, 1536]
    - [312, 0.0]
  - - [1024, 128, 1, 4608]
    - [437, 0.0]
  - - [1024, 128, 1, 8192]
    - [438, 0.0]
  - - [1024, 128, 1, 12288]
    - [439, 0.0]
  - - [1024, 128, 1, 65536]
    - [440, 0.0]
  - - [1024, 256, 1, 1536]
    - [441, 0.0]
  - - [1024, 256, 1, 4608]
    - [390, 0.0]
  - - [1024, 256, 1, 8192]
    - [442, 0.0]
  - - [1024, 256, 1, 12288]
    - [443, 0.0]
  - - [1024, 256, 1, 65536]
    - [444, 0.0]
  - - [1024, 512, 1, 1536]
    - [325, 0.0]
  - - [1024, 512, 1, 4608]
    - [276, 0.0]
  - - [1024, 512, 1, 8192]
    - [268, 0.0]
  - - [1024, 512, 1, 12288]
    - [445, 0.0]
  - - [1024, 512, 1, 65536]
    - [446, 0.0]
  - - [1024, 768, 1, 1536]
    - [319, 0.0]
  - - [1024, 768, 1, 4608]
    - [325, 0.0]
  - - [1024, 768, 1, 8192]
    - [276, 0.0]
  - - [1024, 768, 1, 12288]
    - [447, 0.0]
  - - [1024, 768, 1, 65536]
    - [448, 0.0]
  - - [1024, 1024, 1, 1536]
    - [324, 0.0]
  - - [1024, 1024, 1, 4608]
    - [319, 0.0]
  - - [1024, 1024, 1, 8192]
    - [324, 0.0]
  - - [1024, 1024, 1, 12288]
    - [449, 0.0]
  - - [1024, 1024, 1, 65536]
    - [450, 0.0]
  - - [1024, 2048, 1, 1536]
    - [451, 0.0]
  - - [1024, 2048, 1, 4608]
    - [420, 0.0]
  - - [1024, 2048, 1, 8192]
    - [325, 0.0]
  - - [1024, 2048, 1, 12288]
    - [325, 0.0]
  - - [1024, 2048, 1, 65536]
    - [394, 0.0]
  - - [1024, 4096, 1, 1536]
    - [424, 0.0]
  - - [1024, 4096, 1, 4608]
    - [368, 0.0]
  - - [1024, 4096, 1, 8192]
    - [395, 0.0]
  - - [1024, 4096, 1, 12288]
    - [327, 0.0]
  - - [1024, 4096, 1, 65536]
    - [452, 0.0]
  - - [1024, 6144, 1, 1536]
    - [399, 0.0]
  - - [1024, 6144, 1, 4608]
    - [453, 0.0]
  - - [1024, 6144, 1, 8192]
    - [427, 0.0]
  - - [1024, 6144, 1, 12288]
    - [402, 0.0]
  - - [1024, 6144, 1, 65536]
    - [427, 0.0]
  - - [1024, 8192, 1, 1536]
    - [424, 0.0]
  - - [1024, 8192, 1, 4608]
    - [430, 0.0]
  - - [1024, 8192, 1, 8192]
    - [424, 0.0]
  - - [1024, 8192, 1, 12288]
    - [454, 0.0]
  - - [1024, 8192, 1, 65536]
    - [424, 0.0]
  - - [1024, 12288, 1, 1536]
    - [455, 0.0]
  - - [1024, 12288, 1, 4608]
    - [428, 0.0]
  - - [1024, 12288, 1, 8192]
    - [456, 0.0]
  - - [1024, 12288, 1, 12288]
    - [428, 0.0]
  - - [1024, 12288, 1, 65536]
    - [428, 0.0]
  - - [2048, 32, 1, 1536]
    - [250, 0.0]
  - - [2048, 32, 1, 4608]
    - [457, 0.0]
  - - [2048, 32, 1, 8192]
    - [458, 0.0]
  - - [2048, 32, 1, 12288]
    - [459, 0.0]
  - - [2048, 32, 1, 65536]
    - [371, 0.0]
  - - [2048, 64, 1, 1536]
    - [383, 0.0]
  - - [2048, 64, 1, 4608]
    - [437, 0.0]
  - - [2048, 64, 1, 8192]
    - [460, 0.0]
  - - [2048, 64, 1, 12288]
    - [461, 0.0]
  - - [2048, 64, 1, 65536]
    - [348, 0.0]
  - - [2048, 128, 1, 1536]
    - [272, 0.0]
  - - [2048, 128, 1, 4608]
    - [387, 0.0]
  - - [2048, 128, 1, 8192]
    - [462, 0.0]
  - - [2048, 128, 1, 12288]
    - [463, 0.0]
  - - [2048, 128, 1, 65536]
    - [314, 0.0]
  - - [2048, 256, 1, 1536]
    - [358, 0.0]
  - - [2048, 256, 1, 4608]
    - [441, 0.0]
  - - [2048, 256, 1, 8192]
    - [280, 0.0]
  - - [2048, 256, 1, 12288]
    - [464, 0.0]
  - - [2048, 256, 1, 65536]
    - [465, 0.0]
  - - [2048, 512, 1, 1536]
    - [420, 0.0]
  - - [2048, 512, 1, 4608]
    - [316, 0.0]
  - - [2048, 512, 1, 8192]
    - [316, 0.0]
  - - [2048, 512, 1, 12288]
    - [447, 0.0]
  - - [2048, 512, 1, 65536]
    - [466, 0.0]
  - - [2048, 768, 1, 1536]
    - [467, 0.0]
  - - [2048, 768, 1, 4608]
    - [468, 0.0]
  - - [2048, 768, 1, 8192]
    - [316, 0.0]
  - - [2048, 768, 1, 12288]
    - [324, 0.0]
  - - [2048, 768, 1, 65536]
    - [362, 0.0]
  - - [2048, 1024, 1, 1536]
    - [469, 0.0]
  - - [2048, 1024, 1, 4608]
    - [316, 0.0]
  - - [2048, 1024, 1, 8192]
    - [316, 0.0]
  - - [2048, 1024, 1, 12288]
    - [365, 0.0]
  - - [2048, 1024, 1, 65536]
    - [470, 0.0]
  - - [2048, 2048, 1, 1536]
    - [426, 0.0]
  - - [2048, 2048, 1, 4608]
    - [451, 0.0]
  - - [2048, 2048, 1, 8192]
    - [327, 0.0]
  - - [2048, 2048, 1, 12288]
    - [364, 0.0]
  - - [2048, 2048, 1, 65536]
    - [471, 0.0]
  - - [2048, 4096, 1, 1536]
    - [472, 0.0]
  - - [2048, 4096, 1, 4608]
    - [424, 0.0]
  - - [2048, 4096, 1, 8192]
    - [473, 0.0]
  - - [2048, 4096, 1, 12288]
    - [474, 0.0]
  - - [2048, 4096, 1, 65536]
    - [473, 0.0]
  - - [2048, 6144, 1, 1536]
    - [475, 0.0]
  - - [2048, 6144, 1, 4608]
    - [428, 0.0]
  - - [2048, 6144, 1, 8192]
    - [476, 0.0]
  - - [2048, 6144, 1, 12288]
    - [428, 0.0]
  - - [2048, 6144, 1, 65536]
    - [428, 0.0]
  - - [2048, 8192, 1, 1536]
    - [477, 0.0]
  - - [2048, 8192, 1, 4608]
    - [397, 0.0]
  - - [2048, 8192, 1, 8192]
    - [478, 0.0]
  - - [2048, 8192, 1, 12288]
    - [454, 0.0]
  - - [2048, 8192, 1, 65536]
    - [479, 0.0]
  - - [2048, 12288, 1, 1536]
    - [474, 0.0]
  - - [2048, 12288, 1, 4608]
    - [454, 0.0]
  - - [2048, 12288, 1, 8192]
    - [480, 0.0]
  - - [2048, 12288, 1, 12288]
    - [480, 0.0]
  - - [2048, 12288, 1, 65536]
    - [480, 0.0]
  - - [4096, 32, 1, 1536]
    - [268, 0.0]
  - - [4096, 32, 1, 4608]
    - [481, 0.0]
  - - [4096, 32, 1, 8192]
    - [482, 0.0]
  - - [4096, 32, 1, 12288]
    - [483, 0.0]
  - - [4096, 32, 1, 65536]
    - [484, 0.0]
  - - [4096, 64, 1, 1536]
    - [355, 0.0]
  - - [4096, 64, 1, 4608]
    - [268, 0.0]
  - - [4096, 64, 1, 8192]
    - [485, 0.0]
  - - [4096, 64, 1, 12288]
    - [486, 0.0]
  - - [4096, 64, 1, 65536]
    - [486, 0.0]
  - - [4096, 128, 1, 1536]
    - [279, 0.0]
  - - [4096, 128, 1, 4608]
    - [272, 0.0]
  - - [4096, 128, 1, 8192]
    - [441, 0.0]
  - - [4096, 128, 1, 12288]
    - [487, 0.0]
  - - [4096, 128, 1, 65536]
    - [488, 0.0]
  - - [4096, 256, 1, 1536]
    - [489, 0.0]
  - - [4096, 256, 1, 4608]
    - [316, 0.0]
  - - [4096, 256, 1, 8192]
    - [316, 0.0]
  - - [4096, 256, 1, 12288]
    - [365, 0.0]
  - - [4096, 256, 1, 65536]
    - [490, 0.0]
  - - [4096, 512, 1, 1536]
    - [451, 0.0]
  - - [4096, 512, 1, 4608]
    - [420, 0.0]
  - - [4096, 512, 1, 8192]
    - [420, 0.0]
  - - [4096, 512, 1, 12288]
    - [316, 0.0]
  - - [4096, 512, 1, 65536]
    - [365, 0.0]
  - - [4096, 768, 1, 1536]
    - [361, 0.0]
  - - [4096, 768, 1, 4608]
    - [364, 0.0]
  - - [4096, 768, 1, 8192]
    - [451, 0.0]
  - - [4096, 768, 1, 12288]
    - [367, 0.0]
  - - [4096, 768, 1, 65536]
    - [369, 0.0]
  - - [6144, 32, 1, 1536]
    - [390, 0.0]
  - - [6144, 32, 1, 4608]
    - [268, 0.0]
  - - [6144, 32, 1, 8192]
    - [330, 0.0]
  - - [6144, 32, 1, 12288]
    - [491, 0.0]
  - - [6144, 32, 1, 65536]
    - [492, 0.0]
  - - [6144, 64, 1, 1536]
    - [441, 0.0]
  - - [6144, 64, 1, 4608]
    - [279, 0.0]
  - - [6144, 64, 1, 8192]
    - [280, 0.0]
  - - [6144, 64, 1, 12288]
    - [391, 0.0]
  - - [6144, 64, 1, 65536]
    - [493, 0.0]
  - - [6144, 128, 1, 1536]
    - [325, 0.0]
  - - [6144, 128, 1, 4608]
    - [324, 0.0]
  - - [6144, 128, 1, 8192]
    - [276, 0.0]
  - - [6144, 128, 1, 12288]
    - [494, 0.0]
  - - [6144, 128, 1, 65536]
    - [450, 0.0]
  - - [6144, 256, 1, 1536]
    - [451, 0.0]
  - - [6144, 256, 1, 4608]
    - [468, 0.0]
  - - [6144, 256, 1, 8192]
    - [316, 0.0]
  - - [6144, 256, 1, 12288]
    - [495, 0.0]
  - - [6144, 256, 1, 65536]
    - [496, 0.0]
  - - [6144, 512, 1, 1536]
    - [497, 0.0]
  - - [6144, 512, 1, 4608]
    - [451, 0.0]
  - - [6144, 512, 1, 8192]
    - [451, 0.0]
  - - [6144, 512, 1, 12288]
    - [451, 0.0]
  - - [6144, 512, 1, 65536]
    - [369, 0.0]
  - - [4096, 1024, 1, 1536]
    - [498, 0.0]
  - - [4096, 1024, 1, 4608]
    - [499, 0.0]
  - - [4096, 1024, 1, 8192]
    - [500, 0.0]
  - - [4096, 1024, 1, 12288]
    - [499, 0.0]
  - - [4096, 1024, 1, 65536]
    - [500, 0.0]
  - - [4096, 2048, 1, 1536]
    - [501, 0.0]
  - - [4096, 2048, 1, 4608]
    - [502, 0.0]
  - - [4096, 2048, 1, 8192]
    - [501, 0.0]
  - - [4096, 2048, 1, 12288]
    - [503, 0.0]
  - - [4096, 2048, 1, 65536]
    - [504, 0.0]
  - - [4096, 4096, 1, 1536]
    - [505, 0.0]
  - - [4096, 4096, 1, 4608]
    - [506, 0.0]
  - - [4096, 4096, 1, 8192]
    - [506, 0.0]
  - - [4096, 4096, 1, 12288]
    - [506, 0.0]
  - - [4096, 4096, 1, 65536]
    - [507, 0.0]
  - - [4096, 6144, 1, 1536]
    - [508, 0.0]
  - - [4096, 6144, 1, 4608]
    - [502, 0.0]
  - - [4096, 6144, 1, 8192]
    - [509, 0.0]
  - - [4096, 6144, 1, 12288]
    - [502, 0.0]
  - - [4096, 6144, 1, 65536]
    - [509, 0.0]
  - - [4096, 8192, 1, 1536]
    - [505, 0.0]
  - - [4096, 8192, 1, 4608]
    - [506, 0.0]
  - - [4096, 8192, 1, 8192]
    - [507, 0.0]
  - - [4096, 8192, 1, 12288]
    - [507, 0.0]
  - - [4096, 8192, 1, 65536]
    - [507, 0.0]
  - - [4096, 12288, 1, 1536]
    - [505, 0.0]
  - - [4096, 12288, 1, 4608]
    - [505, 0.0]
  - - [4096, 12288, 1, 8192]
    - [507, 0.0]
  - - [4096, 12288, 1, 12288]
    - [506, 0.0]
  - - [4096, 12288, 1, 65536]
    - [507, 0.0]
  - - [6144, 768, 1, 4608]
    - [510, 0.0]
  - - [6144, 768, 1, 8192]
    - [499, 0.0]
  - - [6144, 768, 1, 12288]
    - [499, 0.0]
  - - [6144, 768, 1, 65536]
    - [500, 0.0]
  - - [6144, 1024, 1, 1536]
    - [511, 0.0]
  - - [6144, 1024, 1, 4608]
    - [511, 0.0]
  - - [6144, 1024, 1, 8192]
    - [511, 0.0]
  - - [6144, 1024, 1, 12288]
    - [511, 0.0]
  - - [6144, 1024, 1, 65536]
    - [512, 0.0]
  - - [6144, 2048, 1, 1536]
    - [513, 0.0]
  - - [6144, 2048, 1, 4608]
    - [514, 0.0]
  - - [6144, 2048, 1, 8192]
    - [514, 0.0]
  - - [6144, 2048, 1, 12288]
    - [515, 0.0]
  - - [6144, 2048, 1, 65536]
    - [514, 0.0]
  - - [6144, 4096, 1, 1536]
    - [502, 0.0]
  - - [6144, 4096, 1, 4608]
    - [505, 0.0]
  - - [6144, 4096, 1, 8192]
    - [516, 0.0]
  - - [6144, 4096, 1, 12288]
    - [516, 0.0]
  - - [6144, 4096, 1, 65536]
    - [517, 0.0]
  - - [6144, 6144, 1, 1536]
    - [505, 0.0]
  - - [6144, 6144, 1, 4608]
    - [502, 0.0]
  - - [6144, 6144, 1, 8192]
    - [505, 0.0]
  - - [6144, 6144, 1, 12288]
    - [505, 0.0]
  - - [6144, 6144, 1, 65536]
    - [518, 0.0]
  - - [6144, 8192, 1, 1536]
    - [505, 0.0]
  - - [6144, 8192, 1, 4608]
    - [516, 0.0]
  - - [6144, 8192, 1, 8192]
    - [506, 0.0]
  - - [6144, 8192, 1, 12288]
    - [516, 0.0]
  - - [6144, 8192, 1, 65536]
    - [506, 0.0]
  - - [6144, 12288, 1, 1536]
    - [502, 0.0]
  - - [6144, 12288, 1, 4608]
    - [505, 0.0]
  - - [6144, 12288, 1, 8192]
    - [516, 0.0]
  - - [6144, 12288, 1, 12288]
    - [517, 0.0]
  - - [6144, 12288, 1, 65536]
    - [518, 0.0]
  - - [8192, 32, 1, 1536]
    - [519, 0.0]
  - - [8192, 32, 1, 4608]
    - [520, 0.0]
  - - [8192, 32, 1, 8192]
    - [521, 0.0]
  - - [8192, 32, 1, 12288]
    - [522, 0.0]
  - - [8192, 32, 1, 65536]
    - [523, 0.0]
  - - [8192, 64, 1, 1536]
    - [519, 0.0]
  - - [8192, 64, 1, 4608]
    - [524, 0.0]
  - - [8192, 64, 1, 8192]
    - [525, 0.0]
  - - [8192, 64, 1, 12288]
    - [526, 0.0]
  - - [8192, 64, 1, 65536]
    - [527, 0.0]
  - - [8192, 128, 1, 1536]
    - [528, 0.0]
  - - [8192, 128, 1, 4608]
    - [528, 0.0]
  - - [8192, 128, 1, 8192]
    - [529, 0.0]
  - - [8192, 128, 1, 12288]
    - [530, 0.0]
  - - [8192, 128, 1, 65536]
    - [531, 0.0]
  - - [8192, 256, 1, 1536]
    - [532, 0.0]
  - - [8192, 256, 1, 4608]
    - [533, 0.0]
  - - [8192, 256, 1, 8192]
    - [533, 0.0]
  - - [8192, 256, 1, 12288]
    - [534, 0.0]
  - - [8192, 256, 1, 65536]
    - [535, 0.0]
  - - [8192, 512, 1, 1536]
    - [500, 0.0]
  - - [8192, 512, 1, 4608]
    - [499, 0.0]
  - - [8192, 512, 1, 8192]
    - [499, 0.0]
  - - [8192, 512, 1, 12288]
    - [499, 0.0]
  - - [8192, 512, 1, 65536]
    - [532, 0.0]
  - - [8192, 768, 1, 1536]
    - [512, 0.0]
  - - [8192, 768, 1, 4608]
    - [512, 0.0]
  - - [8192, 768, 1, 8192]
    - [512, 0.0]
  - - [8192, 768, 1, 12288]
    - [536, 0.0]
  - - [8192, 768, 1, 65536]
    - [512, 0.0]
  - - [8192, 1024, 1, 1536]
    - [505, 0.0]
  - - [8192, 1024, 1, 4608]
    - [503, 0.0]
  - - [8192, 1024, 1, 8192]
    - [502, 0.0]
  - - [8192, 1024, 1, 12288]
    - [503, 0.0]
  - - [8192, 1024, 1, 65536]
    - [501, 0.0]
  - - [8192, 2048, 1, 1536]
    - [505, 0.0]
  - - [8192, 2048, 1, 4608]
    - [537, 0.0]
  - - [8192, 2048, 1, 8192]
    - [505, 0.0]
  - - [8192, 2048, 1, 12288]
    - [505, 0.0]
  - - [8192, 2048, 1, 65536]
    - [537, 0.0]
  - - [8192, 4096, 1, 1536]
    - [502, 0.0]
  - - [8192, 4096, 1, 4608]
    - [505, 0.0]
  - - [8192, 4096, 1, 8192]
    - [506, 0.0]
  - - [8192, 4096, 1, 12288]
    - [507, 0.0]
  - - [8192, 4096, 1, 65536]
    - [507, 0.0]
  - - [8192, 6144, 1, 1536]
    - [505, 0.0]
  - - [8192, 6144, 1, 4608]
    - [507, 0.0]
  - - [8192, 6144, 1, 8192]
    - [506, 0.0]
  - - [8192, 6144, 1, 12288]
    - [506, 0.0]
  - - [8192, 6144, 1, 65536]
    - [506, 0.0]
  - - [8192, 8192, 1, 1536]
    - [502, 0.0]
  - - [8192, 8192, 1, 4608]
    - [505, 0.0]
  - - [8192, 8192, 1, 8192]
    - [505, 0.0]
  - - [8192, 8192, 1, 12288]
    - [507, 0.0]
  - - [8192, 8192, 1, 65536]
    - [507, 0.0]
  - - [8192, 12288, 1, 1536]
    - [502, 0.0]
  - - [8192, 12288, 1, 4608]
    - [509, 0.0]
  - - [8192, 12288, 1, 8192]
    - [506, 0.0]
  - - [8192, 12288, 1, 12288]
    - [538, 0.0]
  - - [8192, 12288, 1, 65536]
    - [507, 0.0]
  - - [12288, 32, 1, 1536]
    - [519, 0.0]
  - - [12288, 32, 1, 4608]
    - [520, 0.0]
  - - [12288, 32, 1, 8192]
    - [539, 0.0]
  - - [12288, 32, 1, 12288]
    - [520, 0.0]
  - - [12288, 32, 1, 65536]
    - [540, 0.0]
  - - [12288, 64, 1, 1536]
    - [541, 0.0]
  - - [12288, 64, 1, 4608]
    - [529, 0.0]
  - - [12288, 64, 1, 8192]
    - [542, 0.0]
  - - [12288, 64, 1, 12288]
    - [519, 0.0]
  - - [12288, 64, 1, 65536]
    - [543, 0.0]
  - - [12288, 128, 1, 1536]
    - [528, 0.0]
  - - [12288, 128, 1, 4608]
    - [544, 0.0]
  - - [12288, 128, 1, 8192]
    - [545, 0.0]
  - - [12288, 128, 1, 12288]
    - [541, 0.0]
  - - [12288, 128, 1, 65536]
    - [535, 0.0]
  - - [12288, 256, 1, 1536]
    - [500, 0.0]
  - - [12288, 256, 1, 4608]
    - [532, 0.0]
  - - [12288, 256, 1, 8192]
    - [500, 0.0]
  - - [12288, 256, 1, 12288]
    - [500, 0.0]
  - - [12288, 256, 1, 65536]
    - [500, 0.0]
  - - [12288, 512, 1, 1536]
    - [502, 0.0]
  - - [12288, 512, 1, 4608]
    - [511, 0.0]
  - - [12288, 512, 1, 8192]
    - [511, 0.0]
  - - [12288, 512, 1, 12288]
    - [511, 0.0]
  - - [12288, 512, 1, 65536]
    - [511, 0.0]
  - - [12288, 768, 1, 1536]
    - [502, 0.0]
  - - [12288, 768, 1, 4608]
    - [501, 0.0]
  - - [12288, 768, 1, 8192]
    - [501, 0.0]
  - - [12288, 768, 1, 12288]
    - [502, 0.0]
  - - [12288, 768, 1, 65536]
    - [502, 0.0]
  - - [12288, 1024, 1, 1536]
    - [514, 0.0]
  - - [12288, 1024, 1, 4608]
    - [546, 0.0]
  - - [12288, 1024, 1, 8192]
    - [514, 0.0]
  - - [12288, 1024, 1, 12288]
    - [514, 0.0]
  - - [12288, 1024, 1, 65536]
    - [513, 0.0]
  - - [12288, 2048, 1, 1536]
    - [502, 0.0]
  - - [12288, 2048, 1, 4608]
    - [515, 0.0]
  - - [12288, 2048, 1, 8192]
    - [514, 0.0]
  - - [12288, 2048, 1, 12288]
    - [547, 0.0]
  - - [12288, 2048, 1, 65536]
    - [548, 0.0]
  - - [12288, 4096, 1, 1536]
    - [502, 0.0]
  - - [12288, 4096, 1, 4608]
    - [516, 0.0]
  - - [12288, 4096, 1, 8192]
    - [506, 0.0]
  - - [12288, 4096, 1, 12288]
    - [517, 0.0]
  - - [12288, 4096, 1, 65536]
    - [517, 0.0]
  - - [12288, 6144, 1, 1536]
    - [505, 0.0]
  - - [12288, 6144, 1, 4608]
    - [537, 0.0]
  - - [12288, 6144, 1, 8192]
    - [516, 0.0]
  - - [12288, 6144, 1, 12288]
    - [537, 0.0]
  - - [12288, 6144, 1, 65536]
    - [549, 0.0]
  - - [12288, 8192, 1, 1536]
    - [502, 0.0]
  - - [12288, 8192, 1, 4608]
    - [507, 0.0]
  - - [12288, 8192, 1, 8192]
    - [517, 0.0]
  - - [12288, 8192, 1, 12288]
    - [515, 0.0]
  - - [12288, 8192, 1, 65536]
    - [507, 0.0]
  - - [12288, 12288, 1, 1536]
    - [505, 0.0]
  - - [12288, 12288, 1, 4608]
    - [516, 0.0]
  - - [12288, 12288, 1, 8192]
    - [516, 0.0]
  - - [12288, 12288, 1, 12288]
    - [537, 0.0]
  - - [12288, 12288, 1, 65536]
    - [507, 0.0]
- null
- null
- DeviceEfficiency
- null
- GridBased
