library/src/amd_detail/rocblaslt/src/Tensile/Logic/asm_full/aquavanjaram/gfx941/GridBased/aquavanjaram_Cijk_Ailk_Bljk_B8B8S_BH_BiasSHB_AmaxD_HAS_SAB_SCD_SAV_UserArgs.yaml
- {MinimumRequiredVersion: 4.33.0}
- aquavanjaram
- gfx941
- [Device 0049, Device 0050]
    SolutionIndex: 0
    SolutionNameMin: Cijk_Ailk_Bljk_B8B8S_BH_BiasSHB_AmaxD_HAS_SAB_SCD_SAV_UserArgs_MT16x16x32_MI16x16x1_SN_CLR0_GRVWA1_GRVWB8_GSU1_MIWT1_1_NEPBS0_PLR0_SU32_SUM0_SUS256_SPO1_WGM8
    SolutionIndex: 1
    SolutionNameMin: Cijk_Ailk_Bljk_B8B8S_BH_BiasSHB_AmaxD_HAS_SAB_SCD_SAV_UserArgs_MT16x16x64_MI16x16x1_SN_CLR1_GRVWA16_GRVWB8_GSU1_MIWT1_1_NEPBS0_PLR1_SU32_SUM0_SUS256_SPO1_WGM8
    SolutionIndex: 2
    SolutionNameMin: Cijk_Ailk_Bljk_B8B8S_BH_BiasSHB_AmaxD_HAS_SAB_SCD_SAV_UserArgs_MT16x16x32_MI16x16x1_SN_CLR0_GRVWA1_GRVWB1_GSU1_MIWT1_1_NEPBS2_PLR0_SU32_SUM0_SUS256_SPO0_WGM8
    SolutionIndex: 3
    SolutionNameMin: Cijk_Ailk_Bljk_B8B8S_BH_BiasSHB_AmaxD_HAS_SAB_SCD_SAV_UserArgs_MT16x16x32_MI16x16x1_SN_CLR0_GRVWA1_GRVWB1_GSU1_MIWT1_1_NEPBS2_PLR0_SU32_SUM0_SUS256_SPO1_WGM8
    SolutionIndex: 4
    SolutionNameMin: Cijk_Ailk_Bljk_B8B8S_BH_BiasSHB_AmaxD_HAS_SAB_SCD_SAV_UserArgs_MT16x16x64_MI16x16x1_SN_CLR1_GRVWA1_GRVWB8_GSU1_MIWT1_1_NEPBS2_PLR1_SU32_SUM0_SUS256_SPO1_WGM8
    SolutionIndex: 5
    SolutionNameMin: Cijk_Ailk_Bljk_B8B8S_BH_BiasSHB_AmaxD_HAS_SAB_SCD_SAV_UserArgs_MT16x16x64_MI16x16x1_SN_CLR1_GRVWA1_GRVWB1_GSU1_MIWT1_1_NEPBS2_PLR1_SU32_SUM0_SUS256_SPO1_WGM8
- - - [128, 1, 1, 128, 128, 128, 128, 128]
    - [4, 2.07972]
  - - [1, 128, 1, 128, 1, 1, 1, 128]
    - [5, 2.27666]
  - - [1, 1, 1, 128, 1, 1, 1, 128]
    - [2, 0.024006]
  - - [128, 16, 1, 128, 128, 128, 128, 128]
    - [0, 33.7033]
  - - [16, 128, 1, 128, 16, 16, 16, 128]
    - [1, 33.3601]
  - - [16, 16, 1, 128, 16, 16, 16, 128]
    - [3, 5.83788]
  - - [128, 128, 1, 128, 128, 128, 128, 128]
    - [1, 267.562]
  - - [127, 127, 1, 127, 127, 127, 127, 127]
    - [4, 253.56]
  - - [129, 129, 1, 129, 129, 129, 129, 129]
    - [0, 259.921]
  - - [3, 3, 1, 3, 3, 3, 3, 3]
    - [5, 0.00451958]
- null
- null
- DeviceEfficiency
- GridBased
