library/src/amd_detail/rocblaslt/src/Tensile/Logic/asm_full/aquavanjaram/gfx942_80cu/Equality/aquavanjaram_Cijk_Alik_Bljk_BBS_BH_UserArgs.yaml
- {MinimumRequiredVersion: 4.33.0}
- aquavanjaram
- {Architecture: gfx942, CUCount: 80}
- [Device 0049, Device 0050]
    SolutionIndex: 0
    SolutionNameMin: Cijk_Alik_Bljk_BBS_BH_UserArgs_MT256x128x64_MI16x16x1_SN_GRVWA8_GRVWB8_GSU1_LBSPPA1024_LBSPPB128_LPA16_LPB16_LRVW8_MIWT8_4_SU0_SUM0_SUS0_SVW8_VWA8_WG32_8_1_WGM40
    SolutionIndex: 1
    SolutionNameMin: Cijk_Alik_Bljk_BBS_BH_UserArgs_MT256x128x64_MI16x16x1_SN_GRVWA8_GRVWB8_GSU1_LBSPPA1024_LBSPPB128_LPA16_LPB16_LRVW8_MIWT8_4_SU8_SUM0_SUS256_SVW8_VWA8_WG32_8_1_WGM40
    SolutionIndex: 2
    SolutionNameMin: Cijk_Alik_Bljk_BBS_BH_UserArgs_MT224x256x64_MI16x16x1_SN_GRVWA4_GRVWB4_GSU1_LBSPPA256_LBSPPB128_LPA4_LPB4_LRVW4_MIWT14_4_SU8_SUM0_SUS256_SVW2_VWA2_WG16_16_1_WGM0
    SolutionIndex: 3
    SolutionNameMin: Cijk_Alik_Bljk_BBS_BH_UserArgs_MT224x224x64_MI16x16x1_SN_GRVWA4_GRVWB4_GSU1_LBSPPA128_LBSPPB128_LPA4_LPB4_LRVW4_MIWT7_7_SU8_SUM0_SUS256_SVW1_VWA1_WG32_8_1_WGM0
    SolutionIndex: 4
    SolutionNameMin: Cijk_Alik_Bljk_BBS_BH_MT256x192x64_MI16x16x1_SN_LDSB1_GRVWA4_GRVWB4_GSU1_LBSPPA1024_LPA4_LPB4_LRVW4_MIWT8_6_SU4_SUS512_SVW8_VWA8_WSGRB0_WG32_8_1_WGM1
    SolutionIndex: 5
    SolutionNameMin: Cijk_Alik_Bljk_BBS_BH_MT256x192x64_MI16x16x1_SN_LDSB1_GRVWA4_GRVWB4_GSU1_LBSPPA1024_LPA4_LPB4_LRVW4_MIWT8_6_SU8_SUS256_SVW8_VWA8_WSGRB0_WG32_8_1_WGM40
    SolutionIndex: 6
    SolutionNameMin: Cijk_Alik_Bljk_BBS_BH_MT256x144x64_MI16x16x1_SN_LDSB1_GRVWA8_GRVWB4_GSU1_LBSPPA512_LPA16_LPB16_LRVW8_MIWT4_9_SU8_SUS512_SVW4_VWA4_WSGRB0_WG64_4_1_WGM40
    SolutionIndex: 7
    SolutionNameMin: Cijk_Alik_Bljk_BBS_BH_MT128x256x64_MI16x16x1_SN_LDSB1_GRVWA8_GRVWB8_GSU1_LBSPPA512_LPA16_LPB16_LRVW8_MIWT4_8_SU8_SUS256_SVW4_VWA4_WSGRB1_WG32_8_1_WGM40
    SolutionIndex: 8
    SolutionNameMin: Cijk_Alik_Bljk_BBS_BH_UserArgs_MT256x224x64_MI16x16x1_SN_GRVWA4_GRVWB4_GSU1_LBSPPA512_LBSPPB128_LPA4_LPB4_LRVW4_MIWT4_14_SU8_SUM0_SUS256_SVW4_VWA4_WG64_4_1_WGM40
    SolutionIndex: 9
    SolutionNameMin: Cijk_Alik_Bljk_BBS_BH_MT128x16x128_MI16x16x1_SN_GSU4_MIWT2_1_WGM1
    SolutionIndex: 10
    SolutionNameMin: Cijk_Alik_Bljk_BBS_BH_MT256x224x64_MI16x16x1_SN_LDSB1_GRVWB4_GSU1_LBSPPA512_LBSPPB128_LPA8_LPB4_LRVW4_MIWT4_14_SVW4_VWA4_WG64_4_1
    SolutionIndex: 11
    SolutionNameMin: Cijk_Alik_Bljk_BBS_BH_MT16x128x64_MI16x16x1_SN_LDSB1_GSU10_LBSPPA128_LBSPPB128_MIWT1_2_NTB0_NLCA1_SU0_SUM0_SUS0_SPO1_WG16_16_1
    SolutionIndex: 12
    SolutionNameMin: Cijk_Alik_Bljk_BBS_BH_MT16x32x64_MI16x16x1_SN_LDSB0_GSU8_LBSPPA128_LBSPPB128_MIWT1_1_NTB0_NLCA1_SU4_SUM2_SUS512_SPO1_WG16_8_1
    SolutionIndex: 13
    SolutionNameMin: Cijk_Alik_Bljk_BBS_BH_MT16x32x64_MI16x16x1_SN_LDSB0_GSU15_LBSPPA128_LBSPPB128_MIWT1_1_NTB1_NLCA1_SU4_SUM2_SUS256_SPO1_WG16_8_1
    SolutionIndex: 14
    SolutionNameMin: Cijk_Alik_Bljk_BBS_BH_MT256x224x64_MI16x16x1_SN_LDSB1_GRVWB4_GSU1_LBSPPA1024_LBSPPB128_MIWT8_7_SU0_SUM0_SUS0_SVW8_VWA8_WG32_8_1
    SolutionIndex: 15
    SolutionNameMin: Cijk_Alik_Bljk_BBS_BH_MT256x224x64_MI16x16x1_SN_LDSB1_GRVWB4_GSU1_LBSPPA1024_LBSPPB128_MIWT8_7_SU4_SUM2_SUS256_SVW8_VWA8_WG32_8_1
    SolutionIndex: 16
    SolutionNameMin: Cijk_Alik_Bljk_BBS_BH_MT256x144x64_MI16x16x1_SN_LDSB1_GRVWB4_GSU1_LBSPPA512_LBSPPB128_MIWT4_9_SU0_SUM0_SUS0_SVW4_VWA4_WG64_4_1
    SolutionIndex: 17
    SolutionNameMin: Cijk_Alik_Bljk_BBS_BH_MT16x16x128_MI16x16x1_SN_GSU7_MIWT1_1_WGM1
    SolutionIndex: 18
    SolutionNameMin: Cijk_Alik_Bljk_BBS_BH_UserArgs_MT224x256x64_MI16x16x1_SN_LDSB1_GRVWA4_GRVWB4_GSU1_LBSPPA256_MIWT14_4_SS1_SU8_SUM1_SUS128_SVW2_VWA2_WG16_16_1_WGM0
    SolutionIndex: 19
    SolutionNameMin: Cijk_Alik_Bljk_BBS_BH_UserArgs_MT32x16x512_MI16x16x1_SN_LDSB1_GRVWA8_GRVWB8_GSU1_LBSPPA1024_LBSPPB1024_LPA16_LPB16_LRVW8_MIWT1_1_SU0_SUM0_SUS0_SVW1_VWA1_WG32_4_1_WGM0
    SolutionIndex: 20
    SolutionNameMin: Cijk_Alik_Bljk_BBS_BH_UserArgs_MT32x16x256_MI16x16x1_SN_LDSB0_GRVWA8_GRVWB8_GSU1_LBSPPA512_LBSPPB512_LPA16_LPB16_LRVW8_MIWT1_1_SU0_SUM0_SUS0_SVW1_VWA1_WG32_4_1_WGM0
    SolutionIndex: 21
    SolutionNameMin: Cijk_Alik_Bljk_BBS_BH_UserArgs_MT32x32x128_MI16x16x1_SN_LDSB1_GRVWA8_GRVWB8_GSU1_LBSPPA256_LBSPPB256_LPA16_LPB16_LRVW8_MIWT1_1_SS1_SU8_SUM1_SUS256_SVW1_VWA1_WG32_8_1_WGM8
    SolutionIndex: 22
    SolutionNameMin: Cijk_Alik_Bljk_BBS_BH_UserArgs_MT64x128x128_MI16x16x1_SN_LDSB1_GRVWA8_GRVWB8_GSU1_LBSPPA512_LBSPPB256_LPA16_LPB16_LRVW8_MIWT2_4_SS1_SU0_SUM0_SUS0_SVW2_VWA2_WG32_8_1_WGM8
    SolutionIndex: 23
    SolutionNameMin: Cijk_Alik_Bljk_BBS_BH_UserArgs_MT32x96x128_MI16x16x1_SN_LDSB1_GRVWA8_GRVWB8_GSU1_LBSPPA256_LBSPPB256_LPA16_LPB16_LRVW8_MIWT1_3_SS1_SU8_SUM1_SUS256_SVW1_VWA1_WG32_8_1_WGM8
    SolutionIndex: 24
    SolutionNameMin: Cijk_Alik_Bljk_BBS_BH_UserArgs_MT64x32x128_MI16x16x1_SN_LDSB0_GRVWA8_GRVWB8_GSU1_LBSPPA512_LBSPPB256_LPA16_LPB16_LRVW8_MIWT2_1_SS0_SU8_SUM1_SUS256_SVW8_VWA2_WG32_8_1_WGM8
    SolutionIndex: 25
    SolutionNameMin: Cijk_Alik_Bljk_BBS_BH_UserArgs_MT32x16x512_MI16x16x1_SN_LDSB1_GRVWA8_GRVWB8_GSU1_LBSPPA1024_LBSPPB1024_LPA16_LPB16_LRVW8_MIWT1_1_SS0_SU8_SUM1_SUS1024_SVW4_VWA1_WG32_4_1_WGM0
    SolutionIndex: 26
    SolutionNameMin: Cijk_Alik_Bljk_BBS_BH_UserArgs_MT64x32x256_MI16x16x1_SN_LDSB1_GRVWA8_GRVWB8_GSU1_LBSPPA512_LBSPPB512_LPA16_LPB16_LRVW8_MIWT1_2_SS1_SU0_SUM0_SUS0_SVW1_VWA1_WG64_4_1_WGM8
    SolutionIndex: 27
    SolutionNameMin: Cijk_Alik_Bljk_BBS_BH_UserArgs_MT128x64x128_MI16x16x1_SN_LDSB1_GRVWA8_GRVWB8_GSU1_LBSPPA512_LBSPPB256_LPA16_LPB16_LRVW8_MIWT2_4_SS1_SU8_SUM1_SUS1024_SVW2_VWA2_WG64_4_1_WGM8
    SolutionIndex: 28
    SolutionNameMin: Cijk_Alik_Bljk_BBS_BH_UserArgs_MT32x96x128_MI16x16x1_SN_LDSB1_GRVWA8_GRVWB8_GSU1_LBSPPA256_LBSPPB256_LPA16_LPB16_LRVW8_MIWT1_3_SS1_SU8_SUM1_SUS512_SVW1_VWA1_WG32_8_1_WGM8
    SolutionIndex: 29
    SolutionNameMin: Cijk_Alik_Bljk_BBS_BH_UserArgs_MT64x128x128_MI16x16x1_SN_LDSB1_GRVWA8_GRVWB8_GSU1_LBSPPA1024_LBSPPB256_LPA16_LPB16_LRVW8_MIWT4_2_SS1_SU8_SUM1_SUS1024_SVW4_VWA4_WG16_16_1_WGM0
    SolutionIndex: 30
    SolutionNameMin: Cijk_Alik_Bljk_BBS_BH_UserArgs_MT64x64x128_MI16x16x1_SN_LDSB1_GRVWA8_GRVWB8_GSU1_LBSPPA512_LBSPPB256_LPA16_LPB16_LRVW8_MIWT2_2_SS1_SU8_SUM1_SUS256_SVW2_VWA2_WG32_8_1_WGM0
    SolutionIndex: 31
    SolutionNameMin: Cijk_Alik_Bljk_BBS_BH_UserArgs_MT64x96x128_MI16x16x1_SN_LDSB1_GRVWA8_GRVWB8_GSU1_LBSPPA512_LBSPPB256_LPA16_LPB16_LRVW8_MIWT2_3_SS1_SU8_SUM1_SUS1024_SVW2_VWA2_WG32_8_1_WGM0
    SolutionIndex: 32
    SolutionNameMin: Cijk_Alik_Bljk_BBS_BH_UserArgs_MT128x192x64_MI16x16x1_SN_LDSB1_GRVWA8_GRVWB8_GSU1_LBSPPA512_LPA16_LPB16_LRVW8_MIWT4_6_SS1_SU8_SUM1_SUS512_SVW4_VWA4_WG32_8_1_WGM0
    SolutionIndex: 33
    SolutionNameMin: Cijk_Alik_Bljk_BBS_BH_UserArgs_MT32x64x256_MI16x16x1_SN_LDSB1_GRVWA8_GRVWB8_GSU1_LBSPPA512_LBSPPB512_LPA16_LPB16_LRVW8_MIWT1_2_SS1_SU0_SUM0_SUS0_SVW1_VWA1_WG32_8_1_WGM8
    SolutionIndex: 34
    SolutionNameMin: Cijk_Alik_Bljk_BBS_BH_UserArgs_MT128x64x128_MI16x16x1_SN_LDSB1_GRVWA8_GRVWB8_GSU1_LBSPPA512_LBSPPB256_LPA16_LPB16_LRVW8_MIWT2_4_SS0_SU0_SUM0_SUS0_SVW8_VWA2_WG64_4_1_WGM8
    SolutionIndex: 35
    SolutionNameMin: Cijk_Alik_Bljk_BBS_BH_UserArgs_MT32x16x512_MI16x16x1_SN_LDSB1_GRVWA8_GRVWB8_GSU1_LBSPPA1024_LBSPPB1024_LPA16_LPB16_LRVW8_MIWT1_1_SS1_SU0_SUM0_SUS0_SVW1_VWA1_WG32_4_1_WGM8
    SolutionIndex: 36
    SolutionNameMin: Cijk_Alik_Bljk_BBS_BH_UserArgs_MT16x32x512_MI16x16x1_SN_LDSB1_GRVWA8_GRVWB8_GSU1_LBSPPA1024_LBSPPB1024_LPA16_LPB16_LRVW8_MIWT1_1_SS0_SU0_SUM0_SUS0_SVW4_VWA1_WG16_8_1_WGM8
    SolutionIndex: 37
    SolutionNameMin: Cijk_Alik_Bljk_BBS_BH_UserArgs_MT32x64x256_MI16x16x1_SN_LDSB1_GRVWA8_GRVWB8_GSU1_LBSPPA1024_LBSPPB512_LPA16_LPB16_LRVW8_MIWT2_1_SS0_SU0_SUM0_SUS0_SVW8_VWA2_WG16_16_1_WGM8
    SolutionIndex: 38
    SolutionNameMin: Cijk_Alik_Bljk_BBS_BH_UserArgs_MT96x96x128_MI16x16x1_SN_LDSB1_GRVWA8_GRVWB8_GSU1_LBSPPA256_LBSPPB256_LPA16_LPB16_LRVW8_MIWT3_3_SS1_SU8_SUM1_SUS512_SVW1_VWA1_WG32_8_1_WGM0
    SolutionIndex: 39
    SolutionNameMin: Cijk_Alik_Bljk_BBS_BH_UserArgs_MT256x128x64_MI16x16x1_SN_LDSB1_GRVWA8_GRVWB8_GSU1_LBSPPA512_LPA16_LPB16_LRVW8_MIWT4_8_SS1_SU32_SUM1_SUS128_SVW4_VWA4_WG64_4_1_WGM0
    SolutionIndex: 40
    SolutionNameMin: Cijk_Alik_Bljk_BBS_BH_UserArgs_MT256x192x64_MI16x16x1_SN_LDSB1_GRVWA4_GRVWB4_GSU1_LBSPPA1024_MIWT8_6_SS1_SU0_SUM0_SUS0_SVW8_VWA8_WG32_8_1_WGM8
    SolutionIndex: 41
    SolutionNameMin: Cijk_Alik_Bljk_BBS_BH_UserArgs_MT64x96x128_MI16x16x1_SN_LDSB1_GRVWA8_GRVWB8_GSU1_LBSPPA512_LBSPPB256_LPA16_LPB16_LRVW8_MIWT2_3_SS1_SU8_SUM1_SUS512_SVW2_VWA2_WG32_8_1_WGM0
    SolutionIndex: 42
    SolutionNameMin: Cijk_Alik_Bljk_BBS_BH_UserArgs_MT128x64x128_MI16x16x1_SN_LDSB1_GRVWA8_GRVWB8_GSU1_LBSPPA512_LBSPPB256_LPA16_LPB16_LRVW8_MIWT2_4_SS0_SU8_SUM1_SUS512_SVW8_VWA2_WG64_4_1_WGM8
    SolutionIndex: 43
    SolutionNameMin: Cijk_Alik_Bljk_BBS_BH_UserArgs_MT128x192x64_MI16x16x1_SN_LDSB1_GRVWA8_GRVWB8_GSU1_LBSPPA512_LPA16_LPB16_LRVW8_MIWT4_6_SS1_SU32_SUM1_SUS1024_SVW4_VWA4_WG32_8_1_WGM8
    SolutionIndex: 44
    SolutionNameMin: Cijk_Alik_Bljk_BBS_BH_UserArgs_MT192x256x64_MI16x16x1_SN_LDSB1_GSU1_LBSPPA256_MIWT6_8_SS0_SU8_SUM1_SUS512_SVW8_VWA2_WG32_8_1_WGM0
    SolutionIndex: 45
    SolutionNameMin: Cijk_Alik_Bljk_BBS_BH_UserArgs_MT192x256x64_MI16x16x1_SN_LDSB1_GSU1_LBSPPA256_MIWT6_8_SS0_SU8_SUM1_SUS1024_SVW8_VWA2_WG32_8_1_WGM0
    SolutionIndex: 46
    SolutionNameMin: Cijk_Alik_Bljk_BBS_BH_UserArgs_MT192x288x64_MI16x16x1_SN_LDSB1_GRVWA4_GRVWB4_GSU1_LBSPPA256_MIWT6_9_SS0_SU8_SUM1_SUS1024_SVW8_VWA2_WG32_8_1_WGM8
    SolutionIndex: 47
    SolutionNameMin: Cijk_Alik_Bljk_BBS_BH_UserArgs_MT208x192x64_MI16x16x1_SN_LDSB1_GRVWA4_GRVWB8_GSU1_LBSPPA128_LPA16_LPB16_LRVW8_MIWT13_3_SS0_SU8_SUM1_SUS1024_SVW4_VWA1_WG16_16_1_WGM0
    SolutionIndex: 48
    SolutionNameMin: Cijk_Alik_Bljk_BBS_BH_UserArgs_MT288x192x64_MI16x16x1_SN_LDSB1_GRVWA4_GRVWB4_GSU1_LBSPPA128_MIWT9_6_SS1_SU8_SUM1_SUS128_SVW1_VWA1_WG32_8_1_WGM8
    SolutionIndex: 49
    SolutionNameMin: Cijk_Alik_Bljk_BBS_BH_UserArgs_MT192x256x64_MI16x16x1_SN_LDSB1_GRVWA4_GSU1_LBSPPA256_MIWT6_8_SS1_SU32_SUM1_SUS128_SVW2_VWA2_WG32_8_1_WGM0
    SolutionIndex: 50
    SolutionNameMin: Cijk_Alik_Bljk_BBS_BH_UserArgs_MT64x128x128_MI16x16x1_SN_LDSB1_GRVWA8_GRVWB8_GSU1_LBSPPA1024_LBSPPB256_LPA16_LPB16_LRVW8_MIWT4_2_SS1_SU8_SUM1_SUS256_SVW4_VWA4_WG16_16_1_WGM0
    SolutionIndex: 51
    SolutionNameMin: Cijk_Alik_Bljk_BBS_BH_UserArgs_MT256x224x64_MI16x16x1_SN_LDSB1_GRVWA4_GRVWB4_GSU1_LBSPPA1024_MIWT8_7_SS1_SU8_SUM1_SUS512_SVW8_VWA8_WG32_8_1_WGM0
    SolutionIndex: 52
    SolutionNameMin: Cijk_Alik_Bljk_BBS_BH_UserArgs_MT128x64x128_MI16x16x1_SN_LDSB1_GRVWA8_GRVWB8_GSU1_LBSPPA512_LBSPPB256_LPA16_LPB16_LRVW8_MIWT2_4_SS0_SU8_SUM1_SUS512_SVW8_VWA2_WG64_4_1_WGM0
    SolutionIndex: 53
    SolutionNameMin: Cijk_Alik_Bljk_BBS_BH_UserArgs_MT64x128x128_MI16x16x1_SN_LDSB1_GRVWA8_GRVWB8_GSU1_LBSPPA512_LBSPPB256_LPA16_LPB16_LRVW8_MIWT2_4_SS1_SU8_SUM1_SUS256_SVW2_VWA2_WG32_8_1_WGM0
    SolutionIndex: 54
    SolutionNameMin: Cijk_Alik_Bljk_BBS_BH_UserArgs_MT128x96x64_MI16x16x1_SN_LDSB1_GRVWA8_GRVWB8_GSU1_LBSPPA256_LBSPPB128_LPA16_LPB16_LRVW8_MIWT2_6_SS0_SU8_SUM1_SUS1024_SVW8_VWA2_WG64_4_1_WGM8
    SolutionIndex: 55
    SolutionNameMin: Cijk_Alik_Bljk_BBS_BH_UserArgs_MT128x224x64_MI16x16x1_SN_LDSB1_GRVWA8_GRVWB8_GSU1_LBSPPA512_LPA16_LPB16_LRVW8_MIWT4_7_SS1_SU32_SUM1_SUS512_SVW4_VWA4_WG32_8_1_WGM0
    SolutionIndex: 56
    SolutionNameMin: Cijk_Alik_Bljk_BBS_BH_UserArgs_MT64x64x128_MI16x16x1_SN_LDSB1_GRVWA8_GRVWB8_GSU1_LBSPPA512_LBSPPB256_LPA16_LPB16_LRVW8_MIWT2_2_SS1_SU32_SUM1_SUS512_SVW2_VWA2_WG32_8_1_WGM0
    SolutionIndex: 57
    SolutionNameMin: Cijk_Alik_Bljk_BBS_BH_UserArgs_MT64x64x128_MI16x16x1_SN_LDSB1_GRVWA8_GRVWB8_GSU1_LBSPPA512_LBSPPB256_LPA16_LPB16_LRVW8_MIWT2_2_SS0_SU8_SUM1_SUS1024_SVW8_VWA2_WG32_8_1_WGM0
    SolutionIndex: 58
    SolutionNameMin: Cijk_Alik_Bljk_BBS_BH_UserArgs_MT128x128x64_MI16x16x1_SN_LDSB1_GRVWA8_GRVWB8_GSU1_LBSPPA512_LPA16_LPB16_LRVW8_MIWT4_4_SS1_SU8_SUM1_SUS256_SVW4_VWA4_WG32_8_1_WGM8
    SolutionIndex: 59
    SolutionNameMin: Cijk_Alik_Bljk_BBS_BH_UserArgs_MT32x64x256_MI16x16x1_SN_LDSB1_GRVWA8_GRVWB8_GSU1_LBSPPA1024_LBSPPB512_LPA16_LPB16_LRVW8_MIWT2_1_SS1_SU0_SUM0_SUS0_SVW2_VWA2_WG16_16_1_WGM8
    SolutionIndex: 60
    SolutionNameMin: Cijk_Alik_Bljk_BBS_BH_UserArgs_MT256x192x64_MI16x16x1_SN_LDSB1_GRVWB4_GSU1_LBSPPA1024_MIWT8_6_SS1_SU0_SUM0_SUS0_SVW8_VWA8_WG32_8_1_WGM8
    SolutionIndex: 61
    SolutionNameMin: Cijk_Alik_Bljk_BBS_BH_UserArgs_MT256x224x64_MI16x16x1_SN_LDSB1_GRVWA4_GRVWB4_GSU1_LBSPPA1024_LPA4_LPB4_LRVW4_MIWT8_7_SS1_SU32_SUM1_SUS128_SVW8_VWA8_WG32_8_1_WGM8
    SolutionIndex: 62
    SolutionNameMin: Cijk_Alik_Bljk_BBS_BH_UserArgs_MT128x96x64_MI16x16x1_SN_LDSB0_GRVWA8_GRVWB8_GSU1_LBSPPA512_LBSPPB128_LPA16_LPB16_LRVW8_MIWT4_3_SS1_SU32_SUM1_SUS1024_SVW4_VWA4_WG32_8_1_WGM0
    SolutionIndex: 63
    SolutionNameMin: Cijk_Alik_Bljk_BBS_BH_UserArgs_MT128x96x64_MI16x16x1_SN_LDSB0_GRVWA8_GRVWB8_GSU1_LBSPPA512_LBSPPB128_LPA16_LPB16_LRVW8_MIWT4_3_SS1_SU8_SUM1_SUS256_SVW4_VWA4_WG32_8_1_WGM8
    SolutionIndex: 64
    SolutionNameMin: Cijk_Alik_Bljk_BBS_BH_UserArgs_MT192x160x64_MI16x16x1_SN_LDSB1_GRVWA8_GRVWB8_GSU1_LBSPPA256_LPA16_LPB16_LRVW8_MIWT6_5_SS1_SU8_SUM1_SUS256_SVW2_VWA2_WG32_8_1_WGM0
    SolutionIndex: 65
    SolutionNameMin: Cijk_Alik_Bljk_BBS_BH_UserArgs_MT64x16x128_MI16x16x1_SN_LDSB0_GRVWA8_GRVWB8_GSU1_LBSPPA256_LBSPPB256_LPA16_LPB16_LRVW8_MIWT1_1_SS0_SU8_SUM1_SUS1024_SVW4_VWA1_WG64_4_1_WGM0
    SolutionIndex: 66
    SolutionNameMin: Cijk_Alik_Bljk_BBS_BH_UserArgs_MT224x256x64_MI16x16x1_SN_LDSB1_GRVWA4_GRVWB4_GSU1_LBSPPA128_MIWT7_8_SS1_SU8_SUM1_SUS512_SVW1_VWA1_WG32_8_1_WGM8
    SolutionIndex: 67
    SolutionNameMin: Cijk_Alik_Bljk_BBS_BH_UserArgs_MT128x128x64_MI16x16x1_SN_LDSB1_GRVWA8_GRVWB8_GSU1_LBSPPA512_LPA16_LPB16_LRVW8_MIWT4_4_SS1_SU32_SUM1_SUS256_SVW4_VWA4_WG32_8_1_WGM8
    SolutionIndex: 68
    SolutionNameMin: Cijk_Alik_Bljk_BBS_BH_UserArgs_MT128x128x64_MI16x16x1_SN_LDSB1_GRVWA8_GRVWB8_GSU1_LBSPPA512_LPA16_LPB16_LRVW8_MIWT4_4_SS1_SU8_SUM1_SUS512_SVW4_VWA4_WG32_8_1_WGM8
    SolutionIndex: 69
    SolutionNameMin: Cijk_Alik_Bljk_BBS_BH_UserArgs_MT128x256x64_MI16x16x1_SN_LDSB1_GRVWA8_GRVWB8_GSU1_LBSPPA1024_LPA16_LPB16_LRVW8_MIWT8_4_SS1_SU8_SUM1_SUS512_SVW8_VWA8_WG16_16_1_WGM0
    SolutionIndex: 70
    SolutionNameMin: Cijk_Alik_Bljk_BBS_BH_UserArgs_MT256x224x64_MI16x16x1_SN_LDSB1_GRVWA4_GRVWB4_GSU1_LBSPPA1024_MIWT8_7_SS1_SU8_SUM1_SUS128_SVW8_VWA8_WG32_8_1_WGM8
    SolutionIndex: 71
    SolutionNameMin: Cijk_Alik_Bljk_BBS_BH_UserArgs_MT96x192x64_MI16x16x1_SN_LDSB1_GRVWA8_GRVWB8_GSU1_LBSPPA256_LPA16_LPB16_LRVW8_MIWT6_3_SS1_SU8_SUM1_SUS1024_SVW2_VWA2_WG16_16_1_WGM0
    SolutionIndex: 72
    SolutionNameMin: Cijk_Alik_Bljk_BBS_BH_UserArgs_MT160x128x64_MI16x16x1_SN_LDSB1_GRVWA8_GRVWB8_GSU1_LBSPPA256_LPA16_LPB16_LRVW8_MIWT10_2_SS1_SU0_SUM0_SUS0_SVW2_VWA2_WG16_16_1_WGM0
    SolutionIndex: 73
    SolutionNameMin: Cijk_Alik_Bljk_BBS_BH_UserArgs_MT192x192x64_MI16x16x1_SN_LDSB1_GRVWA8_GRVWB8_GSU1_LBSPPA256_LPA16_LPB16_LRVW8_MIWT6_6_SS0_SU0_SUM0_SUS0_SVW8_VWA2_WG32_8_1_WGM8
    SolutionIndex: 74
    SolutionNameMin: Cijk_Alik_Bljk_BBS_BH_UserArgs_MT32x16x256_MI16x16x1_SN_LDSB0_GRVWA8_GRVWB8_GSU1_LBSPPA512_LBSPPB512_LPA16_LPB16_LRVW8_MIWT1_1_SS1_SU0_SUM0_SUS0_SVW1_VWA1_WG32_4_1_WGM0
    SolutionIndex: 75
    SolutionNameMin: Cijk_Alik_Bljk_BBS_BH_UserArgs_MT32x16x128_MI16x16x1_SN_LDSB0_GRVWA8_GRVWB8_GSU1_LBSPPA256_LBSPPB256_LPA16_LPB16_LRVW8_MIWT1_1_SS1_SU8_SUM1_SUS256_SVW1_VWA1_WG32_4_1_WGM0
    SolutionIndex: 76
    SolutionNameMin: Cijk_Alik_Bljk_BBS_BH_UserArgs_MT32x32x128_MI16x16x1_SN_LDSB0_GRVWA8_GRVWB8_GSU1_LBSPPA256_LBSPPB256_LPA16_LPB16_LRVW8_MIWT1_1_SS1_SU8_SUM1_SUS256_SVW1_VWA1_WG32_8_1_WGM0
    SolutionIndex: 77
    SolutionNameMin: Cijk_Alik_Bljk_BBS_BH_UserArgs_MT32x64x128_MI16x16x1_SN_LDSB0_GRVWA8_GRVWB8_GSU1_LBSPPA512_LBSPPB256_LPA16_LPB16_LRVW8_MIWT2_1_SS1_SU8_SUM1_SUS256_SVW2_VWA2_WG16_16_1_WGM0
    SolutionIndex: 78
    SolutionNameMin: Cijk_Alik_Bljk_BBS_BH_UserArgs_MT64x32x128_MI16x16x1_SN_LDSB0_GRVWA8_GRVWB8_GSU1_LBSPPA512_LBSPPB256_LPA16_LPB16_LRVW8_MIWT2_1_SS1_SU8_SUM1_SUS256_SVW2_VWA2_WG32_8_1_WGM0
    SolutionIndex: 79
    SolutionNameMin: Cijk_Alik_Bljk_BBS_BH_UserArgs_MT64x48x128_MI16x16x1_SN_LDSB0_GRVWA8_GRVWB8_GSU1_LBSPPA256_LBSPPB256_LPA16_LPB16_LRVW8_MIWT1_3_SS1_SU8_SUM1_SUS512_SVW1_VWA1_WG64_4_1_WGM0
    SolutionIndex: 80
    SolutionNameMin: Cijk_Alik_Bljk_BBS_BH_UserArgs_MT192x224x64_MI16x16x1_SN_LDSB1_GSU1_LBSPPA256_MIWT6_7_SS1_SU32_SUM1_SUS256_SVW2_VWA2_WG32_8_1_WGM8
    SolutionIndex: 81
    SolutionNameMin: Cijk_Alik_Bljk_BBS_BH_UserArgs_MT192x224x64_MI16x16x1_SN_LDSB1_GRVWA4_GRVWB4_GSU1_LBSPPA256_MIWT6_7_SS1_SU8_SUM1_SUS1024_SVW2_VWA2_WG32_8_1_WGM8
    SolutionIndex: 82
    SolutionNameMin: Cijk_Alik_Bljk_BBS_BH_UserArgs_MT32x16x128_MI16x16x1_SN_LDSB0_GRVWA8_GRVWB8_GSU1_LBSPPA256_LBSPPB256_LPA16_LPB16_LRVW8_MIWT1_1_SS0_SU8_SUM1_SUS1024_SVW4_VWA1_WG32_4_1_WGM0
    SolutionIndex: 83
    SolutionNameMin: Cijk_Alik_Bljk_BBS_BH_UserArgs_MT80x256x64_MI16x16x1_SN_GSU1_MIWT5_4_NEPBS0_SU32_SUM0_SUS256_WGM32
    SolutionIndex: 84
    SolutionNameMin: Cijk_Alik_Bljk_BBS_BH_UserArgs_MT128x96x64_MI16x16x1_SN_GSU1_MIWT2_6_NEPBS0_SU4_SUM0_SUS512_WGM0
    SolutionIndex: 85
    SolutionNameMin: Cijk_Alik_Bljk_BBS_BH_UserArgs_MT32x16x256_MI16x16x1_SN_GRVWB8_GSU1_LBSPPA1024_LBSPPB512_LPA16_LPB16_LRVW8_MIWT2_1_NTC0_NTD0_SS1_SU0_SUM0_SUS0_SPO1_SVW2_VWA2_WG16_4_4_WGM1
    SolutionIndex: 86
    SolutionNameMin: Cijk_Alik_Bljk_BBS_BH_UserArgs_MT32x16x256_MI16x16x1_SN_GRVWB8_GSU1_LBSPPA1024_LBSPPB512_LPA16_LPB16_LRVW8_MIWT2_1_NTC0_NTD0_SS1_SU0_SUM0_SUS0_SPO0_SVW2_VWA2_WG16_4_4_WGM1
    SolutionIndex: 87
    SolutionNameMin: Cijk_Alik_Bljk_BBS_BH_UserArgs_MT64x16x128_MI16x16x1_SN_GRVWB8_GSU1_LBSPPA256_LBSPPB256_LPA16_LPB16_LRVW8_MIWT2_1_NTC0_NTD0_SS1_SU0_SUM0_SUS0_SPO1_SVW1_VWA1_WG32_4_2_WGM1
    SolutionIndex: 88
    SolutionNameMin: Cijk_Alik_Bljk_BBS_BH_UserArgs_MT64x16x128_MI16x16x1_SN_GRVWB8_GSU1_LBSPPA512_LBSPPB256_LPA16_LPB16_LRVW8_MIWT2_1_NTC3_NTD3_SS1_SU0_SUM0_SUS0_SPO1_SVW2_VWA2_WG32_4_2_WGM1
    SolutionIndex: 89
    SolutionNameMin: Cijk_Alik_Bljk_BBS_BH_UserArgs_MT128x16x128_MI16x16x1_SN_GRVWB8_GSU1_LBSPPA512_LBSPPB256_LPA16_LPB16_LRVW8_MIWT2_1_NTC3_NTD3_SS0_SU0_SUM0_SUS0_SPO1_SVW8_VWA2_WG64_4_1_WGM1
    SolutionIndex: 90
    SolutionNameMin: Cijk_Alik_Bljk_BBS_BH_UserArgs_MT32x16x512_MI16x16x1_SN_GSU1_LBSPPA2048_LBSPPB1024_MIWT2_1_NTC3_NTD3_SS1_SU0_SUM0_SUS0_SPO0_SVW2_VWA2_WG16_4_4_WGM1
    SolutionIndex: 91
    SolutionNameMin: Cijk_Alik_Bljk_BBS_BH_UserArgs_MT96x32x128_MI16x16x1_SN_GRVWA8_GSU1_LBSPPA256_LBSPPB256_LPA16_LPB16_LRVW8_MIWT3_1_NTC0_NTD0_NLCA1_SS1_SU0_SUM0_SUS0_SPO0_SVW1_VWA1_WG32_8_1_WGM1
    SolutionIndex: 92
    SolutionNameMin: Cijk_Alik_Bljk_BBS_BH_UserArgs_MT128x32x128_MI16x16x1_SN_CLR1_GRVWA8_GSU1_LBSPPA1024_LBSPPB256_LPA16_LPB16_LRVW8_MIWT4_1_NTC3_NTD3_NLCA1_PLR1_SS1_SU0_SUM0_SUS0_SPO0_SVW4_VWA4_WG32_8_1_WGM1
    SolutionIndex: 93
    SolutionNameMin: Cijk_Alik_Bljk_BBS_BH_UserArgs_MT64x32x128_MI16x16x1_SN_CLR1_GRVWA8_GSU1_LBSPPA512_LBSPPB256_LPA16_LPB16_LRVW8_MIWT4_2_NTC0_NTD0_NLCA1_PLR1_SS1_SU0_SUM0_SUS0_SPO1_SVW2_VWA2_WG16_4_4_WGM1
    SolutionIndex: 94
    SolutionNameMin: Cijk_Alik_Bljk_BBS_BH_UserArgs_MT32x32x256_MI32x32x1_SN_GSU1_LBSPPA512_LBSPPB512_LPA8_LPB8_LRVW8_MIWT1_1_NTC3_NTD3_SS1_SU0_SUM0_SUS0_SPO0_SVW1_VWA1_WG32_2_4_WGM1
    SolutionIndex: 95
    SolutionNameMin: Cijk_Alik_Bljk_BBS_BH_UserArgs_MT96x64x128_MI16x16x1_SN_GRVWA8_GSU1_LBSPPA256_LBSPPB256_LPA16_LPB16_LRVW8_MIWT3_2_NTC0_NTD0_NLCA1_SS1_SU0_SUM0_SUS0_SPO0_SVW1_VWA1_WG32_8_1_WGM1
    SolutionIndex: 96
    SolutionNameMin: Cijk_Alik_Bljk_BBS_BH_UserArgs_MT128x64x128_MI16x16x1_SN_CLR1_GRVWA8_GSU1_LBSPPA1024_LBSPPB256_LPA16_LPB16_LRVW8_MIWT4_2_NTC3_NTD3_NLCA1_PLR1_SS1_SU0_SUM0_SUS0_SPO0_SVW4_VWA4_WG32_8_1_WGM1
    SolutionIndex: 97
    SolutionNameMin: Cijk_Alik_Bljk_BBS_BH_UserArgs_MT128x64x128_MI16x16x1_SN_CLR1_GRVWA8_GSU1_LBSPPA1024_LBSPPB256_LPA16_LPB16_LRVW8_MIWT4_4_NTC3_NTD3_NLCA1_PLR1_SS1_SU0_SUM0_SUS0_SPO0_SVW4_VWA4_WG32_4_2_WGM1
    SolutionIndex: 98
    SolutionNameMin: Cijk_Alik_Bljk_BBS_BH_UserArgs_MT64x32x256_MI16x16x1_SN_GSU1_LBSPPA2048_LBSPPB512_LPA16_LPB16_LRVW8_MIWT4_2_NTC3_NTD3_SU0_SUM0_SUS0_SPO0_SVW4_VWA4_WG16_4_4_WGM1
    SolutionIndex: 99
    SolutionNameMin: Cijk_Alik_Bljk_BBS_BH_UserArgs_MT96x128x128_MI16x16x1_SN_CLR1_GSU1_LBSPPA256_LBSPPB256_LPA16_LPB16_LRVW8_MIAV1_MIWT3_4_NTC0_NTD0_PLR1_SS1_SU0_SUM0_SUS0_SPO0_SVW1_VWA1_WG32_8_1_WGM1
    SolutionIndex: 100
    SolutionNameMin: Cijk_Alik_Bljk_BBS_BH_UserArgs_MT128x128x64_MI32x32x1_SN_CLR1_GSU1_LBSPPA256_LBSPPB128_LPA8_LPB8_LRVW8_MIAV1_MIWT2_2_NTC3_NTD3_PLR1_SS1_SU0_SUM0_SUS0_SPO0_SVW2_VWA2_WG64_4_1_WGM1
    SolutionIndex: 101
    SolutionNameMin: Cijk_Alik_Bljk_BBS_BH_UserArgs_MT128x128x64_MI16x16x1_SN_CLR1_GSU1_LBSPPA512_LBSPPB128_LPA16_LPB16_LRVW8_MIAV1_MIWT4_4_NTC3_NTD3_PLR1_SS1_SU0_SUM0_SUS0_SPO0_SVW4_VWA4_WG32_8_1_WGM1
    SolutionIndex: 102
    SolutionNameMin: Cijk_Alik_Bljk_BBS_BH_UserArgs_MT256x224x64_MI16x16x1_SN_GSU1_LBSPPA1024_LPA4_LPB4_LRVW4_MIWT8_7_NEPBS16_SU8_SUM0_SUS256_SSO0_SVW8_VWA8_WG32_8_1_WGM16
    SolutionIndex: 103
    SolutionNameMin: Cijk_Alik_Bljk_BBS_BH_UserArgs_MT16x16x512_MI16x16x1_SN_GRVWB8_GSU1_LBSPPA1024_LBSPPB1024_MIWT1_1_NTC0_NTD0_SS1_SU0_SUM0_SUS0_SVW1_VWA1_WG16_4_4_WGM1
    SolutionIndex: 104
    SolutionNameMin: Cijk_Alik_Bljk_BBS_BH_UserArgs_MT16x16x512_MI16x16x1_SN_GRVWB8_GSU1_LBSPPA1024_LBSPPB1024_MIWT1_1_NTC0_NTD0_SS0_SU0_SUM0_SUS0_SVW1_VWA1_WG16_4_4_WGM1
    SolutionIndex: 105
    SolutionNameMin: Cijk_Alik_Bljk_BBS_BH_UserArgs_MT256x176x64_MI16x16x1_SN_GRVWA2_GRVWB2_GSU1_LBSPPA512_LPA4_LPB4_LRVW4_MIWT4_11_NEPBS0_SU8_SUM0_SUS256_SVW4_VWA4_WG64_4_1_WGM32
    SolutionIndex: 106
    SolutionNameMin: Cijk_Alik_Bljk_BBS_BH_UserArgs_MT256x192x64_MI32x32x1_SN_GRVWA8_GRVWB8_GSU1_LBSPPA512_LPA8_LPB8_LRVW8_MIWT4_3_NEPBS0_SU8_SUM0_SUS256_SVW4_VWA4_WG64_4_1_WGM32
    SolutionIndex: 107
    SolutionNameMin: Cijk_Alik_Bljk_BBS_BH_UserArgs_MT256x192x64_MI16x16x1_SN_GSU1_LBSPPA1024_LPA4_LPB4_LRVW4_MIWT8_6_NEPBS16_SU8_SUM0_SUS256_SSO0_SVW8_VWA8_WG32_8_1_WGM16
    SolutionIndex: 108
    SolutionNameMin: Cijk_Alik_Bljk_BBS_BH_UserArgs_MT256x224x64_MI16x16x1_SN_GRVWA2_GRVWB2_GSU1_LBSPPA1024_LPA4_LPB4_LRVW4_MIWT8_7_SU8_SUM0_SUS256_SVW8_VWA8_WG32_8_1_WGM1_WGMXCC4
    SolutionIndex: 109
    SolutionNameMin: Cijk_Alik_Bljk_BBS_BH_UserArgs_MT256x192x64_MI32x32x1_SN_GRVWA8_GRVWB8_GSU1_LBSPPA512_LPA8_LPB8_LRVW8_MIWT4_3_SU8_SUM0_SUS256_SVW4_VWA4_WG64_4_1_WGM16
    SolutionIndex: 110
    SolutionNameMin: Cijk_Alik_Bljk_BBS_BH_UserArgs_MT128x256x32_MI16x16x1_SN_GRVWA2_GRVWB8_GSU1_LBSPPA512_LPA4_LPB8_LRVW4_MIAV1_MIWT8_4_NTC4_NTD4_SU0_SUM0_SUS0_SPO0_SSO0_SVW8_VWA8_WG16_16_1_WGM1
    SolutionIndex: 111
    SolutionNameMin: Cijk_Alik_Bljk_BBS_BH_UserArgs_MT256x224x64_MI16x16x1_SN_GRVWA2_GRVWB2_GSU1_LBSPPA1024_LPA4_LPB4_LRVW4_MIWT8_7_SU8_SUM0_SUS256_SVW8_VWA8_WG32_8_1_WGM16
    SolutionIndex: 112
    SolutionNameMin: Cijk_Alik_Bljk_BBS_BH_UserArgs_MT128x320x32_MI16x16x1_SN_GRVWA2_GRVWB8_GSU1_GSUC0_GSUWGMRR0_K1_LBSPPA512_LBSPPB128_LPA4_LPB8_LRVW4_MIWT8_5_SU8_SUM0_SUS256_SVW8_VWA8_VWB1_WG16_16_1_WGM16_WGMXCC1_WGMXCCGn1
    SolutionIndex: 113
    SolutionNameMin: Cijk_Alik_Bljk_BBS_BH_UserArgs_MT256x192x64_MI32x32x1_SN_GRVWA8_GRVWB8_GSU1_GSUC0_GSUWGMRR0_K1_LBSPPA512_LBSPPB128_LPA8_LPB8_LRVW8_MIWT4_3_SU8_SUM0_SUS256_SVW4_VWA4_VWB1_WG64_4_1_WGM16_WGMXCC1_WGMXCCGn1
    SolutionIndex: 114
    SolutionNameMin: Cijk_Alik_Bljk_BBS_BH_UserArgs_MT128x256x32_MI16x16x1_SN_GRVWA2_GRVWB8_GSU1_GSUC0_GSUWGMRR0_K1_LBSPPA512_LBSPPB256_LPA4_LPB8_LRVW4_MIWT8_4_SU8_SUM0_SUS256_SVW8_VWA8_VWB4_WG16_16_1_WGM16_WGMXCC1_WGMXCCGn1
- - - [7168, 2097152, 1, 8192]
    - [2, 0.0]
  - - [3584, 2097152, 1, 8192]
    - [2, 0.0]
  - - [1280, 2097152, 1, 8192]
    - [0, 0.0]
  - - [1024, 2097152, 1, 8192]
    - [1, 0.0]
  - - [7168, 1048576, 1, 8192]
    - [2, 0.0]
  - - [3584, 1048576, 1, 8192]
    - [2, 0.0]
  - - [1280, 1048576, 1, 8192]
    - [0, 0.0]
  - - [1024, 1048576, 1, 8192]
    - [1, 0.0]
  - - [7168, 524288, 1, 8192]
    - [2, 0.0]
  - - [3584, 524288, 1, 8192]
    - [2, 0.0]
  - - [1280, 524288, 1, 8192]
    - [0, 0.0]
  - - [1024, 524288, 1, 8192]
    - [1, 0.0]
  - - [7168, 262144, 1, 8192]
    - [2, 0.0]
  - - [3584, 262144, 1, 8192]
    - [2, 0.0]
  - - [1280, 262144, 1, 8192]
    - [0, 0.0]
  - - [1024, 262144, 1, 8192]
    - [1, 0.0]
  - - [7168, 131072, 1, 8192]
    - [3, 0.0]
  - - [3584, 131072, 1, 8192]
    - [2, 0.0]
  - - [1280, 131072, 1, 8192]
    - [0, 0.0]
  - - [1024, 131072, 1, 8192]
    - [1, 0.0]
  - - [7168, 8192, 1, 8192]
    - [4, 0.0]
  - - [3584, 8192, 1, 8192]
    - [5, 0.0]
  - - [1280, 8192, 1, 8192]
    - [6, 0.0]
  - - [1024, 8192, 1, 8192]
    - [7, 0.0]
  - - [7168, 16384, 1, 8192]
    - [102, 0.0]
  - - [3584, 16384, 1, 8192]
    - [3, 0.0]
  - - [1280, 16384, 1, 8192]
    - [105, 0.0]
  - - [1024, 16384, 1, 8192]
    - [8, 0.0]
  - - [7168, 32768, 1, 8192]
    - [107, 0.0]
  - - [3584, 32768, 1, 8192]
    - [2, 0.0]
  - - [1280, 32768, 1, 8192]
    - [106, 0.0]
  - - [1024, 32768, 1, 8192]
    - [8, 0.0]
  - - [7168, 65536, 1, 8192]
    - [2, 0.0]
  - - [3584, 65536, 1, 8192]
    - [2, 0.0]
  - - [1280, 65536, 1, 8192]
    - [8, 0.0]
  - - [1024, 65536, 1, 8192]
    - [1, 0.0]
  - - [8192, 1, 1, 1024]
    - [87, 0.0]
  - - [7168, 1, 1, 8192]
    - [86, 0.0]
  - - [8192, 1, 1, 3584]
    - [88, 0.0]
  - - [1280, 1, 1, 8192]
    - [103, 0.0]
  - - [8192, 2, 1, 1024]
    - [87, 0.0]
  - - [7168, 2, 1, 8192]
    - [86, 0.0]
  - - [8192, 2, 1, 3584]
    - [88, 0.0]
  - - [1280, 2, 1, 8192]
    - [103, 0.0]
  - - [8192, 4, 1, 1024]
    - [87, 0.0]
  - - [7168, 4, 1, 8192]
    - [86, 0.0]
  - - [8192, 4, 1, 3584]
    - [88, 0.0]
  - - [1280, 4, 1, 8192]
    - [103, 0.0]
  - - [8192, 8, 1, 1024]
    - [87, 0.0]
  - - [7168, 8, 1, 8192]
    - [86, 0.0]
  - - [8192, 8, 1, 3584]
    - [88, 0.0]
  - - [1280, 8, 1, 8192]
    - [103, 0.0]
  - - [8192, 16, 1, 1024]
    - [89, 0.0]
  - - [7168, 16, 1, 8192]
    - [86, 0.0]
  - - [8192, 16, 1, 3584]
    - [88, 0.0]
  - - [1280, 16, 1, 8192]
    - [104, 0.0]
  - - [8192, 32, 1, 1024]
    - [92, 0.0]
  - - [7168, 32, 1, 8192]
    - [91, 0.0]
  - - [8192, 32, 1, 3584]
    - [93, 0.0]
  - - [1280, 32, 1, 8192]
    - [90, 0.0]
  - - [8192, 64, 1, 1024]
    - [96, 0.0]
  - - [7168, 64, 1, 8192]
    - [95, 0.0]
  - - [8192, 64, 1, 3584]
    - [97, 0.0]
  - - [1280, 64, 1, 8192]
    - [94, 0.0]
  - - [8192, 128, 1, 1024]
    - [100, 0.0]
  - - [7168, 128, 1, 8192]
    - [99, 0.0]
  - - [8192, 128, 1, 3584]
    - [101, 0.0]
  - - [1280, 128, 1, 8192]
    - [98, 0.0]
  - - [512, 512, 1, 512]
    - [76, 0.0]
  - - [1024, 1024, 1, 1024]
    - [30, 0.0]
  - - [2048, 2048, 1, 2048]
    - [67, 0.0]
  - - [4096, 4096, 1, 4096]
    - [108, 0.0]
  - - [4096, 4096, 1, 8192]
    - [10, 0.0]
  - - [8192, 8192, 1, 8192]
    - [111, 0.0]
  - - [2, 7168, 1, 8192]
    - [11, 0.0]
  - - [2, 3584, 1, 8192]
    - [12, 0.0]
  - - [2, 1280, 1, 8192]
    - [13, 0.0]
  - - [8192, 7168, 1, 8192]
    - [14, 0.0]
  - - [8192, 3584, 1, 8192]
    - [15, 0.0]
  - - [8192, 1280, 1, 8192]
    - [16, 0.0]
  - - [3584, 2, 1, 8192]
    - [9, 0.0]
  - - [1024, 2, 1, 8192]
    - [17, 0.0]
  - - [152710, 2048, 1, 512]
    - [18, 0.0]
  - - [6, 384, 1, 1536]
    - [19, 0.0]
  - - [6, 3072, 1, 768]
    - [20, 0.0]
  - - [462, 768, 1, 384]
    - [21, 0.0]
  - - [462, 4096, 1, 384]
    - [22, 0.0]
  - - [462, 1472, 1, 384]
    - [23, 0.0]
  - - [6, 3072, 1, 1536]
    - [19, 0.0]
  - - [462, 768, 1, 768]
    - [24, 0.0]
  - - [462, 4096, 1, 768]
    - [22, 0.0]
  - - [462, 1472, 1, 768]
    - [23, 0.0]
  - - [6, 3072, 1, 3072]
    - [25, 0.0]
  - - [462, 768, 1, 1536]
    - [26, 0.0]
  - - [462, 4096, 1, 1536]
    - [27, 0.0]
  - - [462, 1472, 1, 1536]
    - [28, 0.0]
  - - [16384, 128, 1, 2304]
    - [29, 0.0]
  - - [1152, 1152, 1, 1152]
    - [31, 0.0]
  - - [2560, 2560, 1, 2560]
    - [32, 0.0]
  - - [384, 1536, 1, 12288]
    - [33, 0.0]
  - - [384, 6144, 1, 1536]
    - [34, 0.0]
  - - [96, 1536, 1, 1536]
    - [35, 0.0]
  - - [96, 1536, 1, 12288]
    - [36, 0.0]
  - - [96, 6144, 1, 1536]
    - [37, 0.0]
  - - [6144, 384, 1, 3072]
    - [38, 0.0]
  - - [6144, 1536, 1, 384]
    - [39, 0.0]
  - - [2048, 131072, 1, 16384]
    - [40, 0.0]
  - - [1280, 1280, 1, 1280]
    - [41, 0.0]
  - - [1408, 1408, 1, 1408]
    - [42, 0.0]
  - - [2688, 2688, 1, 2688]
    - [43, 0.0]
  - - [3712, 3712, 1, 3712]
    - [44, 0.0]
  - - [3840, 3840, 1, 3840]
    - [45, 0.0]
  - - [3968, 3968, 1, 3968]
    - [46, 0.0]
  - - [3328, 3328, 1, 3328]
    - [47, 0.0]
  - - [4000, 8192, 1, 8192]
    - [48, 0.0]
  - - [64896, 2048, 1, 512]
    - [49, 0.0]
  - - [6144, 384, 1, 384]
    - [50, 0.0]
  - - [16384, 32768, 1, 2304]
    - [51, 0.0]
  - - [16384, 128, 1, 13312]
    - [52, 0.0]
  - - [1536, 1536, 1, 1536]
    - [53, 0.0]
  - - [1664, 1664, 1, 1664]
    - [54, 0.0]
  - - [2816, 2816, 1, 2816]
    - [55, 0.0]
  - - [1536, 768, 1, 768]
    - [56, 0.0]
  - - [1536, 768, 1, 6144]
    - [57, 0.0]
  - - [1536, 3072, 1, 768]
    - [58, 0.0]
  - - [384, 1536, 1, 1536]
    - [59, 0.0]
  - - [2048, 65536, 1, 16384]
    - [60, 0.0]
  - - [2048, 8192, 1, 16384]
    - [61, 0.0]
  - - [1792, 1792, 1, 1792]
    - [62, 0.0]
  - - [1920, 1920, 1, 1920]
    - [63, 0.0]
  - - [2944, 2944, 1, 2944]
    - [64, 0.0]
  - - [16384, 8, 1, 13312]
    - [65, 0.0]
  - - [16384, 4096, 1, 13312]
    - [66, 0.0]
  - - [2176, 2176, 1, 2176]
    - [68, 0.0]
  - - [3072, 3072, 1, 3072]
    - [69, 0.0]
  - - [2048, 32768, 1, 16384]
    - [70, 0.0]
  - - [2304, 2304, 1, 2304]
    - [71, 0.0]
  - - [2432, 2432, 1, 2432]
    - [72, 0.0]
  - - [3200, 3200, 1, 3200]
    - [73, 0.0]
  - - [256, 256, 1, 256]
    - [74, 0.0]
  - - [384, 384, 1, 384]
    - [75, 0.0]
  - - [640, 640, 1, 640]
    - [77, 0.0]
  - - [768, 768, 1, 768]
    - [78, 0.0]
  - - [896, 896, 1, 896]
    - [79, 0.0]
  - - [3456, 3456, 1, 3456]
    - [80, 0.0]
  - - [3584, 3584, 1, 3584]
    - [81, 0.0]
  - - [16384, 2, 1, 2304]
    - [82, 0.0]
  - - [4000, 2, 1, 8192]
    - [85, 0.0]
  - - [5560, 1024, 1, 2780]
    - [83, 0.0]
  - - [2780, 1024, 1, 5560]
    - [84, 0.0]
  - - [22016, 12288, 1, 4096]
    - [109, 0.0]
  - - [2048, 2048, 192, 128]
    - [110, 0.0]
  - - [2048, 122880, 1, 512]
    - [112, 0.0]
  - - [512, 122880, 1, 2048]
    - [113, 0.0]
  - - [512, 122880, 1, 512]
    - [114, 0.0]
- null
- null
- DeviceEfficiency
- Equality
