library/src/amd_detail/rocblaslt/src/Tensile/Logic/asm_full/aquavanjaram/gfx942_80cu/Equality/aquavanjaram_Cijk_Alik_Bljk_F8F8S_BH_UserArgs.yaml
- {MinimumRequiredVersion: 4.33.0}
- aquavanjaram
- {Architecture: gfx942, CUCount: 80}
- [Device 0049, Device 0050]
    SolutionIndex: 0
    SolutionNameMin: Cijk_Alik_Bljk_F8F8S_BH_UserArgs_MT256x256x64_MI16x16x1_SN_GSU1_LBSPPA512_LBSPPB512_LPA8_LPB8_LRVW8_MIWT8_8_SU4_SUM0_SUS256_SVW8_VWA8_VWB8_WG32_8_1_WGM1
    SolutionIndex: 1
    SolutionNameMin: Cijk_Alik_Bljk_F8F8S_BH_UserArgs_MT256x256x64_MI32x32x1_SN_GSU1_LBSPPA256_LBSPPB256_LPA16_LPB16_LRVW16_MIWT4_4_SU0_SUM0_SUS0_SVW4_VWA4_VWB4_WG64_4_1_WGM1
    SolutionIndex: 2
    SolutionNameMin: Cijk_Alik_Bljk_F8F8S_BH_UserArgs_MT256x256x64_MI32x32x1_SN_GSU1_LBSPPA256_LBSPPB256_LPA16_LPB16_LRVW16_MIWT4_4_SU4_SUM0_SUS256_SVW4_VWA4_VWB4_WG64_4_1_WGM1
    SolutionIndex: 3
    SolutionNameMin: Cijk_Alik_Bljk_F8F8S_BH_UserArgs_MT256x224x128_MI16x16x1_SN_GSU1_LBSPPA1024_LBSPPB128_LPA8_LPB8_LRVW8_MIWT8_7_SU0_SUM0_SUS0_SVW8_VWA8_VWB1_WG32_8_1_WGM1
    SolutionIndex: 4
    SolutionNameMin: Cijk_Alik_Bljk_F8F8S_BH_UserArgs_MT256x224x128_MI16x16x1_SN_GSU1_LBSPPA1024_LBSPPB128_LPA8_LPB8_LRVW8_MIWT8_7_SU4_SUM0_SUS256_SVW8_VWA8_VWB1_WG32_8_1_WGM1
    SolutionIndex: 5
    SolutionNameMin: Cijk_Alik_Bljk_F8F8S_BH_UserArgs_MT256x224x128_MI16x16x1_SN_GSU1_LBSPPA1024_LBSPPB128_LPA8_LPB8_LRVW8_MIWT8_7_SU0_SUM0_SUS0_SVW8_VWA8_VWB1_WG32_8_1_WGM24
    SolutionIndex: 6
    SolutionNameMin: Cijk_Alik_Bljk_F8F8S_BH_UserArgs_MT256x224x128_MI16x16x1_SN_GSU1_LBSPPA1024_LBSPPB128_LPA8_LPB8_LRVW8_MIWT8_7_SU4_SUM0_SUS256_SVW8_VWA8_VWB1_WG32_8_1_WGM24
    SolutionIndex: 7
    SolutionNameMin: Cijk_Alik_Bljk_F8F8S_BH_UserArgs_MT256x192x128_MI32x32x1_SN_GSU1_LBSPPA512_LBSPPB128_LPA16_LPB16_LRVW16_MIWT4_3_SU4_SUM0_SUS256_SVW4_VWA4_VWB1_WG64_4_1_WGM1
- - - [8192, 12288, 1, 4096]
    - [4, 0.0]
  - - [8192, 4096, 1, 4096]
    - [4, 0.0]
  - - [8192, 22016, 1, 4096]
    - [4, 0.0]
  - - [8192, 4096, 1, 11008]
    - [4, 0.0]
  - - [8192, 151936, 1, 4096]
    - [4, 0.0]
  - - [8192, 12288, 1, 8192]
    - [7, 0.0]
  - - [8192, 8192, 1, 4096]
    - [3, 0.0]
  - - [8192, 24576, 1, 8192]
    - [4, 0.0]
  - - [8192, 8192, 1, 12288]
    - [4, 0.0]
  - - [8192, 76032, 1, 8192]
    - [4, 0.0]
  - - [8192, 6144, 1, 8192]
    - [4, 0.0]
  - - [8192, 8192, 1, 2048]
    - [4, 0.0]
  - - [8192, 8192, 1, 6144]
    - [4, 0.0]
  - - [8192, 38016, 1, 8192]
    - [4, 0.0]
  - - [8192, 3072, 1, 8192]
    - [4, 0.0]
  - - [8192, 8192, 1, 1024]
    - [0, 0.0]
  - - [8192, 8192, 1, 3072]
    - [4, 0.0]
  - - [8192, 19008, 1, 8192]
    - [4, 0.0]
  - - [8192, 19968, 1, 13312]
    - [6, 0.0]
  - - [8192, 13312, 1, 6656]
    - [4, 0.0]
  - - [8192, 35584, 1, 13312]
    - [5, 0.0]
  - - [8192, 13312, 1, 17792]
    - [2, 0.0]
  - - [8192, 76032, 1, 13312]
    - [4, 0.0]
  - - [8192, 9984, 1, 13312]
    - [4, 0.0]
  - - [8192, 13312, 1, 3328]
    - [1, 0.0]
  - - [8192, 17792, 1, 13312]
    - [4, 0.0]
  - - [8192, 13312, 1, 8896]
    - [1, 0.0]
  - - [8192, 38016, 1, 13312]
    - [4, 0.0]
  - - [8192, 4992, 1, 13312]
    - [7, 0.0]
  - - [8192, 13312, 1, 1664]
    - [1, 0.0]
  - - [8192, 8896, 1, 13312]
    - [4, 0.0]
  - - [8192, 13312, 1, 4448]
    - [2, 0.0]
  - - [8192, 19008, 1, 13312]
    - [4, 0.0]
- null
- null
- DeviceEfficiency
- Equality
