library/src/amd_detail/rocblaslt/src/Tensile/Logic/asm_full/aquavanjaram/gfx942_80cu/Equality/aquavanjaram_Cijk_Alik_Bljk_I8BH_UserArgs.yaml
- {MinimumRequiredVersion: 4.33.0}
- aquavanjaram
- {Architecture: gfx942, CUCount: 80}
- [Device 0049, Device 0050]
    SolutionIndex: 0
    SolutionNameMin: Cijk_Alik_Bljk_I8BH_UserArgs_MT64x16x128_MI16x16x1_SN_LDSB1_GRVWA16_GRVWB8_GSU3_LBSPPA128_LBSPPB128_LPA32_LPB32_LRVW16_MIWT1_1_NTA0_NTC0_NTD0_PLR1_SU0_SUM0_SUS0_SPO0_SSO0_SVW1_VWA1_WSGRA0_WSGRB0_WGM1
    SolutionIndex: 1
    SolutionNameMin: Cijk_Alik_Bljk_I8BH_UserArgs_MT64x16x256_MI16x16x1_SN_LDSB0_GRVWA16_GRVWB16_GSU1_LBSPPA256_LBSPPB256_LPA32_LPB32_LRVW16_MIWT1_1_NTA0_NTC0_NTD0_PLR2_SU0_SUM0_SUS0_SPO0_SSO0_SVW1_VWA1_WSGRA0_WSGRB1_WGM1
    SolutionIndex: 2
    SolutionNameMin: Cijk_Alik_Bljk_I8BH_UserArgs_MT64x16x128_MI16x16x1_SN_LDSB1_GRVWA16_GRVWB8_GSU1_LBSPPA128_LBSPPB128_LPA32_LPB32_LRVW16_MIWT1_1_NTA0_NTC0_NTD0_PLR1_SU8_SUM0_SUS256_SPO1_SSO0_SVW1_VWA1_WSGRA0_WSGRB0_WGM1
    SolutionIndex: 3
    SolutionNameMin: Cijk_Alik_Bljk_I8BH_UserArgs_MT64x16x256_MI16x16x1_SN_LDSB0_GRVWA16_GRVWB16_GSU1_LBSPPA256_LBSPPB256_LPA32_LPB32_LRVW16_MIWT1_1_NTA0_NTC3_NTD3_PLR1_SU8_SUM0_SUS256_SPO0_SSO0_SVW1_VWA1_WSGRA0_WSGRB1_WGM1
    SolutionIndex: 4
    SolutionNameMin: Cijk_Alik_Bljk_I8BH_UserArgs_MT128x16x256_MI16x16x1_SN_LDSB1_GRVWA16_GRVWB16_GSU1_LBSPPA512_LBSPPB256_LPA32_LPB32_LRVW16_MIWT2_1_NTA0_NTC0_NTD0_PLR2_SU0_SUM0_SUS0_SPO0_SSO0_SVW2_VWA2_WSGRA1_WSGRB1_WGM1
    SolutionIndex: 5
    SolutionNameMin: Cijk_Alik_Bljk_I8BH_UserArgs_MT128x16x256_MI16x16x1_SN_LDSB1_GRVWA16_GRVWB16_GSU1_LBSPPA512_LBSPPB256_LPA32_LPB32_LRVW16_MIWT2_1_NTA0_NTC0_NTD0_PLR2_SU8_SUM0_SUS256_SPO0_SSO0_SVW2_VWA2_WSGRA1_WSGRB0_WGM1
    SolutionIndex: 6
    SolutionNameMin: Cijk_Alik_Bljk_I8BH_UserArgs_MT128x16x256_MI16x16x1_SN_LDSB1_GRVWA16_GRVWB16_GSU1_LBSPPA512_LBSPPB256_LPA32_LPB32_LRVW16_MIWT2_1_NTA0_NTC0_NTD0_PLR2_SU8_SUM0_SUS256_SPO0_SSO0_SVW2_VWA2_WSGRA1_WSGRB1_WGM1
    SolutionIndex: 7
    SolutionNameMin: Cijk_Alik_Bljk_I8BH_UserArgs_MT128x16x256_MI16x16x1_SN_LDSB1_GRVWA16_GRVWB16_GSU2_LBSPPA512_LBSPPB256_LPA32_LPB32_LRVW16_MIWT2_1_NTA0_NTC0_NTD0_PLR1_SU8_SUM0_SUS256_SPO0_SSO0_SVW2_VWA2_WSGRA0_WSGRB0_WGM1
    SolutionIndex: 8
    SolutionNameMin: Cijk_Alik_Bljk_I8BH_UserArgs_MT128x16x256_MI16x16x1_SN_LDSB1_GRVWA16_GRVWB16_GSU3_LBSPPA512_LBSPPB256_LPA32_LPB32_LRVW16_MIWT2_1_NTA0_NTC0_NTD0_PLR2_SU0_SUM0_SUS0_SPO0_SSO0_SVW2_VWA2_WSGRA1_WSGRB0_WGM1
    SolutionIndex: 9
    SolutionNameMin: Cijk_Alik_Bljk_I8BH_UserArgs_MT128x16x256_MI16x16x1_SN_LDSB1_GRVWA16_GRVWB16_GSU1_LBSPPA512_LBSPPB256_LPA32_LPB32_LRVW16_MIWT2_1_NTA4_NTC0_NTD0_PLR2_SU0_SUM0_SUS0_SPO0_SSO0_SVW2_VWA2_WSGRA0_WSGRB0_WGM1
    SolutionIndex: 10
    SolutionNameMin: Cijk_Alik_Bljk_I8BH_UserArgs_MT128x16x256_MI16x16x1_SN_LDSB1_GRVWA16_GRVWB16_GSU1_LBSPPA512_LBSPPB256_LPA32_LPB32_LRVW16_MIWT2_1_NTA4_NTC0_NTD0_PLR2_SU0_SUM0_SUS0_SPO0_SSO0_SVW2_VWA2_WSGRA1_WSGRB0_WGM1
    SolutionIndex: 11
    SolutionNameMin: Cijk_Alik_Bljk_I8BH_UserArgs_MT128x16x256_MI16x16x1_SN_LDSB1_GRVWA16_GRVWB16_GSU1_LBSPPA512_LBSPPB256_LPA32_LPB32_LRVW16_MIWT2_1_NTA4_NTC0_NTD0_PLR2_SU8_SUM0_SUS256_SPO0_SSO0_SVW2_VWA2_WSGRA0_WSGRB1_WGM1
    SolutionIndex: 12
    SolutionNameMin: Cijk_Alik_Bljk_I8BH_UserArgs_MT128x16x256_MI16x16x1_SN_LDSB1_GRVWA16_GRVWB16_GSU1_LBSPPA512_LBSPPB256_LPA32_LPB32_LRVW16_MIWT2_1_NTA0_NTC3_NTD3_PLR2_SU0_SUM0_SUS0_SPO0_SSO0_SVW2_VWA2_WSGRA0_WSGRB1_WGM1
    SolutionIndex: 13
    SolutionNameMin: Cijk_Alik_Bljk_I8BH_UserArgs_MT128x16x256_MI16x16x1_SN_LDSB1_GRVWA16_GRVWB16_GSU1_LBSPPA512_LBSPPB256_LPA32_LPB32_LRVW16_MIWT2_1_NTA0_NTC3_NTD3_PLR2_SU8_SUM0_SUS256_SPO0_SSO0_SVW2_VWA2_WSGRA1_WSGRB0_WGM1
    SolutionIndex: 14
    SolutionNameMin: Cijk_Alik_Bljk_I8BH_UserArgs_MT128x16x256_MI16x16x1_SN_LDSB1_GRVWA16_GRVWB16_GSU1_LBSPPA512_LBSPPB256_LPA32_LPB32_LRVW16_MIWT2_1_NTA0_NTC3_NTD3_PLR2_SU8_SUM0_SUS256_SPO0_SSO0_SVW2_VWA2_WSGRA0_WSGRB1_WGM1
    SolutionIndex: 15
    SolutionNameMin: Cijk_Alik_Bljk_I8BH_UserArgs_MT128x16x256_MI16x16x1_SN_LDSB1_GRVWA16_GRVWB16_GSU3_LBSPPA512_LBSPPB256_LPA32_LPB32_LRVW16_MIWT2_1_NTA0_NTC3_NTD3_PLR2_SU0_SUM0_SUS0_SPO0_SSO0_SVW2_VWA2_WSGRA0_WSGRB1_WGM1
    SolutionIndex: 16
    SolutionNameMin: Cijk_Alik_Bljk_I8BH_UserArgs_MT128x16x256_MI16x16x1_SN_LDSB1_GRVWA16_GRVWB16_GSU1_LBSPPA512_LBSPPB256_LPA32_LPB32_LRVW16_MIWT2_1_NTA4_NTC3_NTD3_PLR2_SU0_SUM0_SUS0_SPO0_SSO0_SVW2_VWA2_WSGRA1_WSGRB0_WGM1
    SolutionIndex: 17
    SolutionNameMin: Cijk_Alik_Bljk_I8BH_UserArgs_MT128x16x256_MI16x16x1_SN_LDSB1_GRVWA16_GRVWB16_GSU1_LBSPPA512_LBSPPB256_LPA32_LPB32_LRVW16_MIWT2_1_NTA4_NTC3_NTD3_PLR2_SU8_SUM0_SUS256_SPO0_SSO0_SVW2_VWA2_WSGRA0_WSGRB0_WGM1
    SolutionIndex: 18
    SolutionNameMin: Cijk_Alik_Bljk_I8BH_UserArgs_MT128x16x256_MI16x16x1_SN_LDSB1_GRVWA16_GRVWB16_GSU1_LBSPPA512_LBSPPB256_LPA32_LPB32_LRVW16_MIWT2_1_NTA4_NTC3_NTD3_PLR2_SU8_SUM0_SUS256_SPO0_SSO0_SVW2_VWA2_WSGRA1_WSGRB1_WGM1
    SolutionIndex: 19
    SolutionNameMin: Cijk_Alik_Bljk_I8BH_UserArgs_MT128x16x128_MI16x16x1_SN_LDSB1_GRVWA16_GRVWB8_GSU4_LBSPPA256_LBSPPB128_LPA32_LPB32_LRVW16_MIWT2_1_NTA0_NTC3_NTD3_PLR1_SU8_SUM0_SUS256_SPO1_SSO0_SVW2_VWA2_WSGRA0_WSGRB0_WGM1
    SolutionIndex: 20
    SolutionNameMin: Cijk_Alik_Bljk_I8BH_UserArgs_MT128x16x256_MI16x16x1_SN_LDSB1_GRVWA16_GRVWB16_GSU1_LBSPPA512_LBSPPB256_LPA32_LPB32_LRVW16_MIWT2_1_NTA0_NTC3_NTD3_PLR2_SU0_SUM0_SUS0_SPO1_SSO0_SVW2_VWA2_WSGRA1_WSGRB1_WGM1
    SolutionIndex: 21
    SolutionNameMin: Cijk_Alik_Bljk_I8BH_UserArgs_MT128x16x256_MI16x16x1_SN_LDSB1_GRVWA16_GRVWB16_GSU1_LBSPPA512_LBSPPB256_LPA32_LPB32_LRVW16_MIWT2_1_NTA0_NTC3_NTD3_PLR2_SU8_SUM0_SUS256_SPO0_SSO4_SVW2_VWA2_WSGRA1_WSGRB0_WGM1
    SolutionIndex: 22
    SolutionNameMin: Cijk_Alik_Bljk_I8BH_UserArgs_MT128x16x256_MI16x16x1_SN_LDSB1_GRVWA16_GRVWB16_GSU1_LBSPPA512_LBSPPB256_LPA32_LPB32_LRVW16_MIWT2_1_NTA4_NTC4_NTD4_PLR2_SU0_SUM0_SUS0_SPO0_SSO0_SVW2_VWA2_WSGRA1_WSGRB0_WGM1
    SolutionIndex: 23
    SolutionNameMin: Cijk_Alik_Bljk_I8BH_UserArgs_MT128x16x256_MI16x16x1_SN_LDSB1_GRVWA16_GRVWB16_GSU1_LBSPPA512_LBSPPB256_LPA32_LPB32_LRVW16_MIWT2_1_NTA0_NTC4_NTD4_PLR2_SU0_SUM0_SUS0_SPO0_SSO4_SVW2_VWA2_WSGRA0_WSGRB1_WGM1
    SolutionIndex: 24
    SolutionNameMin: Cijk_Alik_Bljk_I8BH_UserArgs_MT128x16x128_MI16x16x1_SN_LDSB1_GRVWA16_GRVWB8_GSU2_LBSPPA256_LBSPPB128_LPA32_LPB32_LRVW16_MIWT2_1_NTA4_NTC4_NTD4_PLR1_SU0_SUM0_SUS0_SPO1_SSO4_SVW2_VWA2_WSGRA0_WSGRB0_WGM1
    SolutionIndex: 25
    SolutionNameMin: Cijk_Alik_Bljk_I8BH_UserArgs_MT192x16x128_MI16x16x1_SN_LDSB1_GRVWA16_GRVWB8_GSU1_LBSPPA128_LBSPPB128_LPA32_LPB32_LRVW16_MIWT3_1_NTA0_NTC0_NTD0_PLR1_SU0_SUM0_SUS0_SPO0_SSO0_SVW1_VWA1_WSGRA0_WSGRB0_WGM1
    SolutionIndex: 26
    SolutionNameMin: Cijk_Alik_Bljk_I8BH_UserArgs_MT192x16x128_MI16x16x1_SN_LDSB1_GRVWA16_GRVWB8_GSU1_LBSPPA128_LBSPPB128_LPA32_LPB32_LRVW16_MIWT3_1_NTA0_NTC0_NTD0_PLR1_SU8_SUM0_SUS256_SPO0_SSO0_SVW1_VWA1_WSGRA0_WSGRB0_WGM1
    SolutionIndex: 27
    SolutionNameMin: Cijk_Alik_Bljk_I8BH_UserArgs_MT192x16x256_MI16x16x1_SN_LDSB1_GRVWA4_GRVWB8_GSU1_LBSPPA256_LBSPPB256_LPA8_LPB8_LRVW8_MIWT3_1_NTA0_NTC0_NTD0_PLR2_SU0_SUM0_SUS0_SPO0_SSO0_SVW1_VWA1_WSGRA0_WSGRB1_WGM1
    SolutionIndex: 28
    SolutionNameMin: Cijk_Alik_Bljk_I8BH_UserArgs_MT192x16x256_MI16x16x1_SN_LDSB1_GRVWA4_GRVWB8_GSU1_LBSPPA256_LBSPPB256_LPA8_LPB8_LRVW8_MIWT3_1_NTA0_NTC0_NTD0_PLR2_SU8_SUM0_SUS256_SPO0_SSO0_SVW1_VWA1_WSGRA1_WSGRB1_WGM1
    SolutionIndex: 29
    SolutionNameMin: Cijk_Alik_Bljk_I8BH_UserArgs_MT192x16x256_MI16x16x1_SN_LDSB1_GRVWA4_GRVWB8_GSU1_LBSPPA256_LBSPPB256_LPA8_LPB8_LRVW8_MIWT3_1_NTA0_NTC0_NTD0_PLR2_SU8_SUM0_SUS256_SPO0_SSO4_SVW1_VWA1_WSGRA0_WSGRB1_WGM1
    SolutionIndex: 30
    SolutionNameMin: Cijk_Alik_Bljk_I8BH_UserArgs_MT256x16x128_MI16x16x1_SN_LDSB1_GRVWA16_GRVWB8_GSU5_LBSPPA512_LBSPPB128_LPA32_LPB32_LRVW16_MIWT4_1_NTA0_NTC3_NTD3_PLR1_SU8_SUM0_SUS256_SPO0_SSO0_SVW4_VWA4_WSGRA1_WSGRB0_WGM1
- - - [12288, 1, 1, 4096]
    - [28, 0.0]
  - - [4096, 1, 1, 4096]
    - [1, 0.0]
  - - [22016, 1, 1, 4096]
    - [0, 0.0]
  - - [4096, 1, 1, 11008]
    - [30, 0.0]
  - - [151936, 1, 1, 4096]
    - [9, 0.0]
  - - [12288, 1, 1, 8192]
    - [27, 0.0]
  - - [8192, 1, 1, 4096]
    - [13, 0.0]
  - - [24576, 1, 1, 8192]
    - [7, 0.0]
  - - [8192, 1, 1, 12288]
    - [4, 0.0]
  - - [76032, 1, 1, 8192]
    - [23, 0.0]
  - - [6144, 1, 1, 8192]
    - [8, 0.0]
  - - [8192, 1, 1, 2048]
    - [6, 0.0]
  - - [8192, 1, 1, 6144]
    - [5, 0.0]
  - - [38016, 1, 1, 8192]
    - [18, 0.0]
  - - [3072, 1, 1, 8192]
    - [15, 0.0]
  - - [8192, 1, 1, 1024]
    - [20, 0.0]
  - - [8192, 1, 1, 3072]
    - [14, 0.0]
  - - [19008, 1, 1, 8192]
    - [12, 0.0]
  - - [19968, 1, 1, 13312]
    - [22, 0.0]
  - - [13312, 1, 1, 6656]
    - [29, 0.0]
  - - [35584, 1, 1, 13312]
    - [17, 0.0]
  - - [13312, 1, 1, 17792]
    - [24, 0.0]
  - - [76032, 1, 1, 13312]
    - [10, 0.0]
  - - [9984, 1, 1, 13312]
    - [4, 0.0]
  - - [13312, 1, 1, 3328]
    - [26, 0.0]
  - - [17792, 1, 1, 13312]
    - [11, 0.0]
  - - [13312, 1, 1, 8896]
    - [19, 0.0]
  - - [38016, 1, 1, 13312]
    - [16, 0.0]
  - - [4992, 1, 1, 13312]
    - [3, 0.0]
  - - [13312, 1, 1, 1664]
    - [25, 0.0]
  - - [8896, 1, 1, 13312]
    - [21, 0.0]
  - - [13312, 1, 1, 4448]
    - [2, 0.0]
  - - [19008, 1, 1, 13312]
    - [11, 0.0]
- null
- null
- DeviceEfficiency
- Equality
