library/src/amd_detail/rocblaslt/src/Tensile/Logic/asm_full/aquavanjaram/gfx942_80cu/Equality/aquavanjaram_Cijk_Ailk_Bljk_BBS_BH_UserArgs.yaml
- {MinimumRequiredVersion: 4.33.0}
- aquavanjaram
- {Architecture: gfx942, CUCount: 80}
- [Device 0049, Device 0050]
    SolutionIndex: 0
    SolutionNameMin: Cijk_Ailk_Bljk_BBS_BH_MT128x128x64_MI32x32x1_SN_LDSB1_GRVWB8_GSU1_LBSPPA0_LBSPPB128_LPA0_LPB8_LRVW8_MIWT2_2_SVW2_VWA2_WG64_4_1
    SolutionIndex: 1
    SolutionNameMin: Cijk_Ailk_Bljk_BBS_BH_MT128x32x64_MI16x16x1_SN_LDSB1_GRVWB8_GSU1_LBSPPA2048_LBSPPB128_LPA16_LPB16_LRVW8_MIWT2_2_SVW2_VWA2_WG64_4_1
    SolutionIndex: 2
    SolutionNameMin: Cijk_Ailk_Bljk_BBS_BH_MT256x224x64_MI16x16x1_SN_LDSB1_GRVWB4_GSU1_LBSPPA2048_LBSPPB128_LPA16_LPB4_LRVW4_MIWT4_14_SVW4_VWA4_WG64_4_1
    SolutionIndex: 3
    SolutionNameMin: Cijk_Ailk_Bljk_BBS_BH_MT16x256x64_MI16x16x1_SN_LDSB1_GSU8_LWPM0p30_MIWT1_4_NTB0_SU4_SUM2_SUS256_SPO0_WG16_16_1
    SolutionIndex: 4
    SolutionNameMin: Cijk_Ailk_Bljk_BBS_BH_MT16x32x64_MI16x16x1_SN_LDSB0_GSU8_LWPM0p35_MIWT1_1_NTB0_SU0_SUM0_SUS0_SPO1_WG16_8_1
    SolutionIndex: 5
    SolutionNameMin: Cijk_Ailk_Bljk_BBS_BH_MT16x32x64_MI16x16x1_SN_LDSB0_GSU20_LWPM0p30_MIWT1_1_NTB1_SU0_SUM0_SUS0_SPO1_WG16_8_1
    SolutionIndex: 6
    SolutionNameMin: Cijk_Ailk_Bljk_BBS_BH_MT256x128x32_MI16x16x1_SN_LDSB1_GRVWB4_GSU1_LBSPPA2048_LBSPPB128_LPA16_LWPMn1_MIWT4_8_SU4_SUM2_SUS256_SVW4_VWA4_WG64_4_1
    SolutionIndex: 7
    SolutionNameMin: Cijk_Ailk_Bljk_BBS_BH_MT256x144x64_MI16x16x1_SN_LDSB1_GRVWB4_GSU1_LBSPPA2048_LBSPPB128_LPA16_LWPMn1_MIWT4_9_SU0_SUM0_SUS0_SVW4_VWA4_WG64_4_1
    SolutionIndex: 8
    SolutionNameMin: Cijk_Ailk_Bljk_BBS_BH_UserArgs_MT256x256x32_MI32x32x1_SN_GRVWB2_GSU1_LBSPPA0_LPA0_LPB8_LRVW8_MIWT4_4_NTC0_NTD0_NLCA1_SU0_SUM0_SUS0_SSO0_SVW4_VWA4_WG64_4_1_WGM32
    SolutionIndex: 9
    SolutionNameMin: Cijk_Ailk_Bljk_BBS_BH_UserArgs_MT256x256x32_MI32x32x1_SN_GRVWB8_GSU1_LBSPPA0_LPA16_LPB8_LRVW8_MIWT4_4_NTC0_NTD0_NLCA1_SU0_SUM0_SUS0_SSO0_SVW4_VWA4_WG64_4_1_WGM32
    SolutionIndex: 10
    SolutionNameMin: Cijk_Ailk_Bljk_BBS_BH_UserArgs_MT256x256x32_MI32x32x1_SN_GRVWB2_GSU1_LBSPPA0_LPA16_LPB8_LRVW8_MIWT4_4_NTC0_NTD0_NLCA1_SU0_SUM0_SUS0_SSO0_SVW4_VWA4_WG64_4_1_WGM32
    SolutionIndex: 11
    SolutionNameMin: Cijk_Ailk_Bljk_BBS_BH_UserArgs_MT256x256x32_MI32x32x1_SN_GRVWB8_GSU1_LBSPPA0_LPA0_LPB8_LRVW8_MIWT4_4_NTC0_NTD0_NLCA1_SU0_SUM0_SUS0_SSO0_SVW4_VWA4_WG64_4_1_WGM32
    SolutionIndex: 12
    SolutionNameMin: Cijk_Ailk_Bljk_BBS_BH_UserArgs_MT256x256x32_MI32x32x1_SN_GRVWB2_GSU1_LBSPPA0_LPA16_LPB8_LRVW8_MIWT4_4_NTC0_NTD0_NLCA1_SU8_SUM0_SUS256_SSO0_SVW4_VWA4_WG64_4_1_WGM32
    SolutionIndex: 13
    SolutionNameMin: Cijk_Ailk_Bljk_BBS_BH_UserArgs_MT256x256x32_MI32x32x1_SN_GRVWB2_GSU1_LBSPPA0_LPA0_LPB8_LRVW8_MIWT4_4_NTC0_NTD0_NLCA1_SU8_SUM0_SUS256_SSO0_SVW4_VWA4_WG64_4_1_WGM32
    SolutionIndex: 14
    SolutionNameMin: Cijk_Ailk_Bljk_BBS_BH_UserArgs_MT256x256x32_MI32x32x1_SN_GRVWB8_GSU1_LBSPPA0_LPA16_LPB8_LRVW8_MIWT4_4_NTC0_NTD0_NLCA1_SU8_SUM0_SUS256_SSO0_SVW4_VWA4_WG64_4_1_WGM32
    SolutionIndex: 15
    SolutionNameMin: Cijk_Ailk_Bljk_BBS_BH_UserArgs_MT256x256x32_MI32x32x1_SN_GRVWB2_GSU1_LBSPPA0_LPA0_LPB8_LRVW8_MIWT4_4_NTC3_NTD3_NLCA1_SU8_SUM0_SUS256_SSO0_SVW4_VWA4_WG64_4_1_WGM32
    SolutionIndex: 16
    SolutionNameMin: Cijk_Ailk_Bljk_BBS_BH_UserArgs_MT16x80x128_MI16x16x1_SN_LDSB1_GRVWB8_GSU1_LBSPPA256_LBSPPB256_LPB16_LRVW8_MIWT1_5_NTB0_SU0_SUM0_SUS0_SPO1_WG16_4_4_WGM1
    SolutionIndex: 17
    SolutionNameMin: Cijk_Ailk_Bljk_BBS_BH_UserArgs_MT16x64x256_MI16x16x1_SN_LDSB1_GRVWB2_GSU1_LBSPPA256_LBSPPB512_LPB16_LRVW8_MIWT1_4_NTB0_SU0_SUM0_SUS0_SPO1_WG16_4_4_WGM1
    SolutionIndex: 18
    SolutionNameMin: Cijk_Ailk_Bljk_BBS_BH_UserArgs_MT16x96x128_MI16x16x1_SN_LDSB1_GRVWB8_GSU1_LBSPPA256_LBSPPB256_LPB16_LRVW8_MIWT1_3_NTB4_SU0_SUM0_SUS0_SPO0_WG16_8_2_WGM1
    SolutionIndex: 19
    SolutionNameMin: Cijk_Ailk_Bljk_BBS_BH_UserArgs_MT16x80x128_MI16x16x1_SN_LDSB1_GRVWB8_GSU3_LBSPPA256_LBSPPB256_LPB16_LRVW8_MIWT1_5_NTB0_SU0_SUM0_SUS0_SPO1_WG16_4_4_WGM1
    SolutionIndex: 20
    SolutionNameMin: Cijk_Ailk_Bljk_BBS_BH_UserArgs_MT16x80x128_MI16x16x1_SN_LDSB1_GRVWB8_GSU1_LBSPPA256_LBSPPB256_LPB16_LRVW8_MIWT1_5_NTB4_SU0_SUM0_SUS0_SPO1_WG16_4_4_WGM1
    SolutionIndex: 21
    SolutionNameMin: Cijk_Ailk_Bljk_BBS_BH_UserArgs_MT16x112x128_MI16x16x1_SN_LDSB1_GRVWB8_GSU1_LBSPPA256_LBSPPB256_LPB16_LRVW8_MIWT1_7_NTB0_SU0_SUM0_SUS0_SPO0_WG16_4_4_WGM1
    SolutionIndex: 22
    SolutionNameMin: Cijk_Ailk_Bljk_BBS_BH_UserArgs_MT16x80x128_MI16x16x1_SN_LDSB1_GRVWB8_GSU3_LBSPPA256_LBSPPB256_LPB16_LRVW8_MIWT1_5_NTB4_SU0_SUM0_SUS0_SPO0_WG16_4_4_WGM1
    SolutionIndex: 23
    SolutionNameMin: Cijk_Ailk_Bljk_BBS_BH_UserArgs_MT16x96x128_MI16x16x1_SN_LDSB1_GRVWB8_GSU1_LBSPPA256_LBSPPB256_LPB16_LRVW8_MIWT1_3_NTB4_SU0_SUM0_SUS0_SPO1_WG16_8_2_WGM1
    SolutionIndex: 24
    SolutionNameMin: Cijk_Ailk_Bljk_BBS_BH_UserArgs_MT16x80x256_MI16x16x1_SN_LDSB1_GRVWB2_GSU1_LBSPPA256_LBSPPB512_LPB16_LRVW8_MIWT1_5_NTB0_SU0_SUM0_SUS0_SPO1_WG16_4_4_WGM1
    SolutionIndex: 25
    SolutionNameMin: Cijk_Ailk_Bljk_BBS_BH_UserArgs_MT16x112x128_MI16x16x1_SN_LDSB1_GRVWB8_GSU1_LBSPPA256_LBSPPB256_LPB16_LRVW8_MIWT1_7_NTB0_SU0_SUM0_SUS0_SPO1_WG16_4_4_WGM1
    SolutionIndex: 26
    SolutionNameMin: Cijk_Ailk_Bljk_BBS_BH_UserArgs_MT16x96x128_MI16x16x1_SN_LDSB1_GRVWB8_GSU1_LBSPPA256_LBSPPB256_LPB16_LRVW8_MIWT1_6_NTB4_SU0_SUM0_SUS0_SPO0_WG16_4_4_WGM1
    SolutionIndex: 27
    SolutionNameMin: Cijk_Ailk_Bljk_BBS_BH_UserArgs_MT16x96x128_MI16x16x1_SN_LDSB1_GRVWB8_GSU5_LBSPPA256_LBSPPB256_LPB16_LRVW8_MIWT1_3_NTB0_SU0_SUM0_SUS0_SPO1_WG16_8_2_WGM1
    SolutionIndex: 28
    SolutionNameMin: Cijk_Ailk_Bljk_BBS_BH_UserArgs_MT16x128x128_MI16x16x1_SN_LDSB1_GRVWB8_GSU1_LBSPPA256_LBSPPB256_LPB16_LRVW8_MIWT1_4_NTB0_SU0_SUM0_SUS0_SPO1_WG16_8_2_WGM1
    SolutionIndex: 29
    SolutionNameMin: Cijk_Ailk_Bljk_BBS_BH_UserArgs_MT16x80x256_MI16x16x1_SN_LDSB1_GRVWB2_GSU1_LBSPPA256_LBSPPB512_LPB16_LRVW8_MIWT1_5_NTB4_SU0_SUM0_SUS0_SPO0_WG16_4_4_WGM1
    SolutionIndex: 30
    SolutionNameMin: Cijk_Ailk_Bljk_BBS_BH_UserArgs_MT16x128x128_MI16x16x1_SN_LDSB1_GRVWB8_GSU1_LBSPPA256_LBSPPB256_LPB16_LRVW8_MIWT1_4_NTB4_SU0_SUM0_SUS0_SPO0_WG16_8_2_WGM1
    SolutionIndex: 31
    SolutionNameMin: Cijk_Ailk_Bljk_BBS_BH_UserArgs_MT16x176x128_MI16x16x1_SN_LDSB1_GRVWB8_GSU1_LBSPPA256_LBSPPB256_LPB16_LRVW8_MIWT1_11_NTB4_SU0_SUM0_SUS0_SPO0_WG16_4_4_WGM1
    SolutionIndex: 32
    SolutionNameMin: Cijk_Ailk_Bljk_BBS_BH_UserArgs_MT16x96x256_MI16x16x1_SN_LDSB1_GRVWB2_GSU1_LBSPPA128_LBSPPB512_LPB4_LRVW4_MIWT1_6_NTB4_SU0_SUM0_SUS0_SPO0_WG16_4_4_WGM1
    SolutionIndex: 33
    SolutionNameMin: Cijk_Ailk_Bljk_BBS_BH_UserArgs_MT16x96x128_MI16x16x1_SN_LDSB1_GRVWB8_GSU1_LBSPPA256_LBSPPB256_LPB16_LRVW8_MIWT1_6_NTB4_SU0_SUM0_SUS0_SPO1_WG16_4_4_WGM1
    SolutionIndex: 34
    SolutionNameMin: Cijk_Ailk_Bljk_BBS_BH_UserArgs_MT16x96x128_MI16x16x1_SN_LDSB1_GRVWB8_GSU1_LBSPPA256_LBSPPB256_LPB16_LRVW8_MIWT1_3_NTB0_SU0_SUM0_SUS0_SPO1_WG16_8_2_WGM1
    SolutionIndex: 35
    SolutionNameMin: Cijk_Ailk_Bljk_BBS_BH_UserArgs_MT16x224x128_MI16x16x1_SN_LDSB1_GRVWB2_GSU1_LBSPPA128_LBSPPB256_LPB4_LRVW4_MIWT1_14_NTB4_SU0_SUM0_SUS0_SPO0_WG16_4_4_WGM1
    SolutionIndex: 36
    SolutionNameMin: Cijk_Ailk_Bljk_BBS_BH_UserArgs_MT16x96x128_MI16x16x1_SN_LDSB1_GRVWB8_GSU1_LBSPPA256_LBSPPB256_LPB16_LRVW8_MIWT1_6_NTB0_SU0_SUM0_SUS0_SPO1_WG16_4_4_WGM1
    SolutionIndex: 37
    SolutionNameMin: Cijk_Ailk_Bljk_BBS_BH_UserArgs_MT16x64x256_MI16x16x1_SN_LDSB1_GRVWB2_GSU1_LBSPPA256_LBSPPB512_LPB16_LRVW8_MIWT1_4_NTB4_SU0_SUM0_SUS0_SPO0_WG16_4_4_WGM1
    SolutionIndex: 38
    SolutionNameMin: Cijk_Ailk_Bljk_BBS_BH_UserArgs_MT16x112x128_MI16x16x1_SN_LDSB1_GRVWB8_GSU1_LBSPPA256_LBSPPB256_LPB16_LRVW8_MIWT1_7_NTB4_SU0_SUM0_SUS0_SPO0_WG16_4_4_WGM1
- - - [512, 512, 1, 512]
    - [1, 0.0]
  - - [1024, 1024, 1, 1024]
    - [0, 0.0]
  - - [2048, 2048, 1, 2048]
    - [0, 0.0]
  - - [4096, 4096, 1, 4096]
    - [2, 0.0]
  - - [4096, 4096, 1, 8192]
    - [2, 0.0]
  - - [8192, 8192, 1, 8192]
    - [2, 0.0]
  - - [2, 7168, 1, 8192]
    - [3, 0.0]
  - - [2, 3584, 1, 8192]
    - [4, 0.0]
  - - [2, 1280, 1, 8192]
    - [5, 0.0]
  - - [8192, 7168, 1, 8192]
    - [6, 0.0]
  - - [8192, 3584, 1, 8192]
    - [6, 0.0]
  - - [8192, 1280, 1, 8192]
    - [7, 0.0]
  - - [8192, 6144, 1, 8192]
    - [8, 0.0]
  - - [8192, 8192, 1, 2048]
    - [9, 0.0]
  - - [8192, 8192, 1, 6144]
    - [10, 0.0]
  - - [8192, 38016, 1, 8192]
    - [10, 0.0]
  - - [8192, 3072, 1, 8192]
    - [8, 0.0]
  - - [8192, 8192, 1, 1024]
    - [11, 0.0]
  - - [8192, 8192, 1, 3072]
    - [9, 0.0]
  - - [8192, 19008, 1, 8192]
    - [12, 0.0]
  - - [8192, 19968, 1, 13312]
    - [9, 0.0]
  - - [8192, 13312, 1, 6656]
    - [10, 0.0]
  - - [8192, 35584, 1, 13312]
    - [9, 0.0]
  - - [8192, 13312, 1, 17792]
    - [13, 0.0]
  - - [8192, 76032, 1, 13312]
    - [9, 0.0]
  - - [8192, 9984, 1, 13312]
    - [14, 0.0]
  - - [8192, 13312, 1, 3328]
    - [10, 0.0]
  - - [8192, 17792, 1, 13312]
    - [9, 0.0]
  - - [8192, 13312, 1, 8896]
    - [10, 0.0]
  - - [8192, 38016, 1, 13312]
    - [14, 0.0]
  - - [8192, 4992, 1, 13312]
    - [15, 0.0]
  - - [8192, 13312, 1, 1664]
    - [9, 0.0]
  - - [8192, 8896, 1, 13312]
    - [14, 0.0]
  - - [8192, 13312, 1, 4448]
    - [12, 0.0]
  - - [8192, 19008, 1, 13312]
    - [14, 0.0]
  - - [1, 12288, 1, 4096]
    - [16, 0.0]
  - - [1, 4096, 1, 4096]
    - [17, 0.0]
  - - [1, 22016, 1, 4096]
    - [18, 0.0]
  - - [1, 4096, 1, 11008]
    - [19, 0.0]
  - - [1, 151936, 1, 4096]
    - [18, 0.0]
  - - [1, 12288, 1, 8192]
    - [20, 0.0]
  - - [1, 8192, 1, 4096]
    - [21, 0.0]
  - - [1, 24576, 1, 8192]
    - [20, 0.0]
  - - [1, 8192, 1, 12288]
    - [22, 0.0]
  - - [1, 76032, 1, 8192]
    - [23, 0.0]
  - - [1, 6144, 1, 8192]
    - [24, 0.0]
  - - [1, 8192, 1, 2048]
    - [25, 0.0]
  - - [1, 8192, 1, 6144]
    - [21, 0.0]
  - - [1, 38016, 1, 8192]
    - [26, 0.0]
  - - [1, 3072, 1, 8192]
    - [27, 0.0]
  - - [1, 8192, 1, 1024]
    - [28, 0.0]
  - - [1, 8192, 1, 3072]
    - [21, 0.0]
  - - [1, 19008, 1, 8192]
    - [29, 0.0]
  - - [1, 19968, 1, 13312]
    - [30, 0.0]
  - - [1, 13312, 1, 6656]
    - [31, 0.0]
  - - [1, 35584, 1, 13312]
    - [32, 0.0]
  - - [1, 13312, 1, 17792]
    - [33, 0.0]
  - - [1, 76032, 1, 13312]
    - [26, 0.0]
  - - [1, 9984, 1, 13312]
    - [30, 0.0]
  - - [1, 13312, 1, 3328]
    - [34, 0.0]
  - - [1, 17792, 1, 13312]
    - [35, 0.0]
  - - [1, 13312, 1, 8896]
    - [36, 0.0]
  - - [1, 38016, 1, 13312]
    - [32, 0.0]
  - - [1, 4992, 1, 13312]
    - [37, 0.0]
  - - [1, 13312, 1, 1664]
    - [33, 0.0]
  - - [1, 8896, 1, 13312]
    - [38, 0.0]
  - - [1, 13312, 1, 4448]
    - [36, 0.0]
  - - [1, 19008, 1, 13312]
    - [29, 0.0]
- null
- null
- DeviceEfficiency
- Equality
