library/src/amd_detail/rocblaslt/src/Tensile/Logic/asm_full/aquavanjaram/gfx942_80cu/Equality/aquavanjaram_Cijk_Ailk_Bljk_I8II_BH_UserArgs.yaml
- {MinimumRequiredVersion: 4.33.0}
- aquavanjaram
- {Architecture: gfx942, CUCount: 80}
- [Device 0049, Device 0050]
    SolutionIndex: 0
    SolutionNameMin: Cijk_Ailk_Bljk_I8II_BH_UserArgs_MT256x240x64_MI16x16x1_SN_CLR1_GRVWA4_GRVWB4_GSU1_LBSPPA2048_LPA16_LPB8_LRVW8_MIWT4_15_NTC0_NTD0_NLCA1_PLR1_SU0_SUM0_SUS0_SSO0_SVW4_VWA4_WG64_4_1_WGM32
    SolutionIndex: 1
    SolutionNameMin: Cijk_Ailk_Bljk_I8II_BH_UserArgs_MT256x240x64_MI16x16x1_SN_CLR1_GRVWA4_GRVWB4_GSU1_LBSPPA2048_LPA32_LPB8_LRVW8_MIWT4_15_NTC0_NTD0_NLCA1_PLR1_SU0_SUM0_SUS0_SSO0_SVW4_VWA4_WG64_4_1_WGM32
    SolutionIndex: 2
    SolutionNameMin: Cijk_Ailk_Bljk_I8II_BH_UserArgs_MT256x240x64_MI16x16x1_SN_CLR1_GRVWA4_GRVWB4_GSU1_LBSPPA2048_LPA64_LPB8_LRVW8_MIWT4_15_NTC0_NTD0_NLCA1_PLR1_SU8_SUM0_SUS256_SSO0_SVW4_VWA4_WG64_4_1_WGM32
    SolutionIndex: 3
    SolutionNameMin: Cijk_Ailk_Bljk_I8II_BH_UserArgs_MT256x240x64_MI16x16x1_SN_CLR1_GRVWA4_GRVWB4_GSU1_LBSPPA2048_LPA16_LPB8_LRVW8_MIWT4_15_NTC0_NTD0_NLCA1_PLR1_SU8_SUM0_SUS256_SSO0_SVW4_VWA4_WG64_4_1_WGM32
    SolutionIndex: 4
    SolutionNameMin: Cijk_Ailk_Bljk_I8II_BH_UserArgs_MT256x240x64_MI16x16x1_SN_CLR1_GRVWA4_GRVWB4_GSU1_LBSPPA2048_LPA32_LPB8_LRVW8_MIWT4_15_NTC0_NTD0_NLCA1_PLR1_SU8_SUM0_SUS256_SSO0_SVW4_VWA4_WG64_4_1_WGM32
    SolutionIndex: 5
    SolutionNameMin: Cijk_Ailk_Bljk_I8II_BH_UserArgs_MT256x240x64_MI16x16x1_SN_CLR1_GRVWA4_GRVWB4_GSU1_LBSPPA2048_LPA64_LPB8_LRVW8_MIWT4_15_NTC4_NTD4_NLCA1_PLR1_SU0_SUM0_SUS0_SSO0_SVW4_VWA4_WG64_4_1_WGM32
    SolutionIndex: 6
    SolutionNameMin: Cijk_Ailk_Bljk_I8II_BH_UserArgs_MT256x240x64_MI16x16x1_SN_CLR1_GRVWA4_GRVWB4_GSU1_LBSPPA2048_LPA16_LPB8_LRVW8_MIWT4_15_NTC4_NTD4_NLCA1_PLR1_SU0_SUM0_SUS0_SSO0_SVW4_VWA4_WG64_4_1_WGM32
    SolutionIndex: 7
    SolutionNameMin: Cijk_Ailk_Bljk_I8II_BH_UserArgs_MT256x240x64_MI16x16x1_SN_CLR1_GRVWA4_GRVWB4_GSU1_LBSPPA2048_LPA32_LPB8_LRVW8_MIWT4_15_NTC4_NTD4_NLCA1_PLR1_SU0_SUM0_SUS0_SSO0_SVW4_VWA4_WG64_4_1_WGM32
    SolutionIndex: 8
    SolutionNameMin: Cijk_Ailk_Bljk_I8II_BH_UserArgs_MT256x240x64_MI16x16x1_SN_CLR1_GRVWA4_GRVWB4_GSU1_LBSPPA2048_LPA64_LPB8_LRVW8_MIWT4_15_NTC4_NTD4_NLCA1_PLR1_SU8_SUM0_SUS256_SSO0_SVW4_VWA4_WG64_4_1_WGM32
    SolutionIndex: 9
    SolutionNameMin: Cijk_Ailk_Bljk_I8II_BH_UserArgs_MT256x240x64_MI16x16x1_SN_CLR1_GRVWA4_GRVWB4_GSU1_LBSPPA2048_LPA16_LPB8_LRVW8_MIWT4_15_NTC4_NTD4_NLCA1_PLR1_SU8_SUM0_SUS256_SSO0_SVW4_VWA4_WG64_4_1_WGM32
    SolutionIndex: 10
    SolutionNameMin: Cijk_Ailk_Bljk_I8II_BH_UserArgs_MT256x240x64_MI16x16x1_SN_CLR1_GRVWA4_GRVWB4_GSU1_LBSPPA2048_LPA32_LPB8_LRVW8_MIWT4_15_NTC4_NTD4_NLCA1_PLR1_SU8_SUM0_SUS256_SSO0_SVW4_VWA4_WG64_4_1_WGM32
    SolutionIndex: 11
    SolutionNameMin: Cijk_Ailk_Bljk_I8II_BH_UserArgs_MT256x224x64_MI32x32x1_SN_CLR1_GRVWA4_GRVWB4_GSU1_LBSPPA0_LPA32_LPB16_LRVW16_MIWT2_7_NTC4_NTD4_NLCA1_PLR1_SU8_SUM0_SUS256_SSO0_SVW2_VWA2_WG128_2_1_WGM32
    SolutionIndex: 12
    SolutionNameMin: Cijk_Ailk_Bljk_I8II_BH_UserArgs_MT256x128x32_MI16x16x1_SN_CLR0_GRVWA16_GRVWB8_GSU1_LBSPPA2048_LPA64_LPB8_LRVW8_MIWT4_8_NTC0_NTD0_NLCA1_PLR0_SU0_SUM0_SUS0_SSO0_SVW4_VWA4_WG64_4_1_WGM32
    SolutionIndex: 13
    SolutionNameMin: Cijk_Ailk_Bljk_I8II_BH_UserArgs_MT256x128x64_MI16x16x1_SN_CLR1_GRVWA16_GRVWB8_GSU1_LBSPPA2048_LPA64_LPB8_LRVW8_MIWT4_8_NTC0_NTD0_NLCA1_PLR1_SU0_SUM0_SUS0_SSO4_SVW4_VWA4_WG64_4_1_WGM32
    SolutionIndex: 14
    SolutionNameMin: Cijk_Ailk_Bljk_I8II_BH_UserArgs_MT256x128x64_MI16x16x1_SN_CLR1_GRVWA16_GRVWB8_GSU1_LBSPPA2048_LPA32_LPB8_LRVW8_MIWT4_8_NTC0_NTD0_NLCA1_PLR1_SU0_SUM0_SUS0_SSO4_SVW4_VWA4_WG64_4_1_WGM32
    SolutionIndex: 15
    SolutionNameMin: Cijk_Ailk_Bljk_I8II_BH_UserArgs_MT256x128x64_MI16x16x1_SN_CLR1_GRVWA4_GRVWB8_GSU1_LBSPPA2048_LPA64_LPB8_LRVW8_MIWT4_8_NTC4_NTD4_NLCA1_PLR1_SU0_SUM0_SUS0_SSO4_SVW4_VWA4_WG64_4_1_WGM32
    SolutionIndex: 16
    SolutionNameMin: Cijk_Ailk_Bljk_I8II_BH_UserArgs_MT256x128x64_MI16x16x1_SN_CLR1_GRVWA16_GRVWB8_GSU1_LBSPPA2048_LPA32_LPB8_LRVW8_MIWT4_8_NTC4_NTD4_NLCA1_PLR1_SU0_SUM0_SUS0_SSO4_SVW4_VWA4_WG64_4_1_WGM32
    SolutionIndex: 17
    SolutionNameMin: Cijk_Ailk_Bljk_I8II_BH_UserArgs_MT256x128x64_MI32x32x1_SN_CLR1_GRVWA16_GRVWB16_GSU1_LBSPPA0_LPA32_LPB16_LRVW16_MIWT2_4_NTC0_NTD0_NLCA1_PLR1_SU0_SUM0_SUS0_SSO4_SVW2_VWA2_WG128_2_1_WGM32
    SolutionIndex: 18
    SolutionNameMin: Cijk_Ailk_Bljk_I8II_BH_UserArgs_MT256x128x64_MI32x32x1_SN_CLR1_GRVWA16_GRVWB16_GSU1_LBSPPA0_LPA32_LPB16_LRVW16_MIWT2_4_NTC3_NTD3_NLCA1_PLR1_SU0_SUM0_SUS0_SSO4_SVW2_VWA2_WG128_2_1_WGM32
    SolutionIndex: 19
    SolutionNameMin: Cijk_Ailk_Bljk_I8II_BH_UserArgs_MT256x128x64_MI32x32x1_SN_CLR1_GRVWA16_GRVWB16_GSU1_LBSPPA0_LPA16_LPB16_LRVW16_MIWT2_4_NTC4_NTD4_NLCA1_PLR1_SU0_SUM0_SUS0_SSO4_SVW2_VWA2_WG128_2_1_WGM32
    SolutionIndex: 20
    SolutionNameMin: Cijk_Ailk_Bljk_I8II_BH_UserArgs_MT256x128x64_MI32x32x1_SN_CLR1_GRVWA16_GRVWB16_GSU1_LBSPPA0_LPA32_LPB16_LRVW16_MIWT2_4_NTC4_NTD4_NLCA1_PLR1_SU0_SUM0_SUS0_SSO4_SVW2_VWA2_WG128_2_1_WGM32
    SolutionIndex: 21
    SolutionNameMin: Cijk_Ailk_Bljk_I8II_BH_UserArgs_MT256x128x64_MI32x32x1_SN_CLR1_GRVWA16_GRVWB16_GSU1_LBSPPA0_LPA32_LPB16_LRVW16_MIWT2_4_NTC4_NTD4_NLCA1_PLR1_SU8_SUM0_SUS256_SSO4_SVW2_VWA2_WG128_2_1_WGM32
    SolutionIndex: 22
    SolutionNameMin: Cijk_Ailk_Bljk_I8II_BH_UserArgs_MT256x256x64_MI32x32x1_SN_CLR1_GRVWA8_GRVWB16_GSU1_LBSPPA0_LPA0_LPB16_LRVW16_MIWT4_4_NTC4_NTD4_NLCA1_PLR1_SU8_SUM0_SUS256_SSO0_SVW4_VWA4_WG64_4_1_WGM32
- - - [8192, 12288, 1, 4096, 8192, 8192, 8192, 4096]
    - [16, 312885.0]
  - - [8192, 4096, 1, 4096, 8192, 8192, 8192, 4096]
    - [17, 301573.0]
  - - [8192, 22016, 1, 4096, 8192, 8192, 8192, 4096]
    - [3, 317254.0]
  - - [8192, 4096, 1, 11008, 8192, 8192, 8192, 11008]
    - [11, 326041.0]
  - - [8192, 151936, 1, 4096, 8192, 8192, 8192, 4096]
    - [3, 322843.0]
  - - [8192, 12288, 1, 8192, 8192, 8192, 8192, 8192]
    - [9, 333745.0]
  - - [8192, 8192, 1, 4096, 8192, 8192, 8192, 4096]
    - [19, 314829.0]
  - - [8192, 24576, 1, 8192, 8192, 8192, 8192, 8192]
    - [6, 336001.0]
  - - [8192, 8192, 1, 12288, 8192, 8192, 8192, 12288]
    - [13, 334453.0]
  - - [8192, 76032, 1, 8192, 8192, 8192, 8192, 8192]
    - [4, 341273.0]
  - - [8192, 6144, 1, 8192, 8192, 8192, 8192, 8192]
    - [8, 332042.0]
  - - [8192, 8192, 1, 2048, 8192, 8192, 8192, 2048]
    - [19, 289875.0]
  - - [8192, 8192, 1, 6144, 8192, 8192, 8192, 6144]
    - [14, 323728.0]
  - - [8192, 38016, 1, 8192, 8192, 8192, 8192, 8192]
    - [2, 339980.0]
  - - [8192, 3072, 1, 8192, 8192, 8192, 8192, 8192]
    - [22, 322029.0]
  - - [8192, 8192, 1, 1024, 8192, 8192, 8192, 1024]
    - [15, 239427.0]
  - - [8192, 8192, 1, 3072, 8192, 8192, 8192, 3072]
    - [20, 305873.0]
  - - [8192, 19008, 1, 8192, 8192, 8192, 8192, 8192]
    - [7, 335354.0]
  - - [8192, 19968, 1, 13312, 8192, 8192, 8192, 13312]
    - [1, 341148.0]
  - - [8192, 13312, 1, 6656, 8192, 8192, 8192, 6656]
    - [8, 327066.0]
  - - [8192, 35584, 1, 13312, 8192, 8192, 8192, 13312]
    - [4, 347170.0]
  - - [8192, 13312, 1, 17792, 8192, 8192, 8192, 17792]
    - [0, 345127.0]
  - - [8192, 76032, 1, 13312, 8192, 8192, 8192, 13312]
    - [4, 349689.0]
  - - [8192, 9984, 1, 13312, 8192, 8192, 8192, 13312]
    - [5, 340613.0]
  - - [8192, 13312, 1, 3328, 8192, 8192, 8192, 3328]
    - [18, 313472.0]
  - - [8192, 17792, 1, 13312, 8192, 8192, 8192, 13312]
    - [10, 340999.0]
  - - [8192, 13312, 1, 8896, 8192, 8192, 8192, 8896]
    - [6, 334875.0]
  - - [8192, 38016, 1, 13312, 8192, 8192, 8192, 13312]
    - [10, 348000.0]
  - - [8192, 4992, 1, 13312, 8192, 8192, 8192, 13312]
    - [8, 339548.0]
  - - [8192, 13312, 1, 1664, 8192, 8192, 8192, 1664]
    - [21, 289873.0]
  - - [8192, 8896, 1, 13312, 8192, 8192, 8192, 13312]
    - [5, 340758.0]
  - - [8192, 13312, 1, 4448, 8192, 8192, 8192, 4448]
    - [12, 315214.0]
  - - [8192, 19008, 1, 13312, 8192, 8192, 8192, 13312]
    - [10, 343038.0]
- null
- null
- DeviceEfficiency
- GridBased
