library/src/amd_detail/rocblaslt/src/Tensile/Logic/asm_full/aquavanjaram/gfx942_80cu/Equality/aquavanjaram_Cijk_Ailk_Bljk_BBS_BH_UserArgs.yaml
- {MinimumRequiredVersion: 4.33.0}
- aquavanjaram
- {Architecture: gfx942, CUCount: 80}
- [Device 0049, Device 0050]
    SolutionIndex: 0
    SolutionNameMin: Cijk_Ailk_Bljk_BBS_BH_MT16x256x64_MI16x16x1_SN_LDSB1_GSU8_LWPM0p30_MIWT1_4_NTB0_SU4_SUM2_SUS256_SPO0_WG16_16_1
    SolutionIndex: 1
    SolutionNameMin: Cijk_Ailk_Bljk_BBS_BH_MT16x32x64_MI16x16x1_SN_LDSB0_GSU8_LWPM0p35_MIWT1_1_NTB0_SU0_SUM0_SUS0_SPO1_WG16_8_1
    SolutionIndex: 2
    SolutionNameMin: Cijk_Ailk_Bljk_BBS_BH_MT16x32x64_MI16x16x1_SN_LDSB0_GSU20_LWPM0p30_MIWT1_1_NTB1_SU0_SUM0_SUS0_SPO1_WG16_8_1
    SolutionIndex: 3
    SolutionNameMin: Cijk_Ailk_Bljk_BBS_BH_UserArgs_MT256x16x32_MI16x16x1_SN_CLR1_GRVWA8_GRVWB2_GSU8_LBSPPA2048_LBSPPB128_LPA0_LPB4_LRVW4_LWPM2_MIWT4_1_NTA0_NLCA1_PLR1_SU0_SUM0_SUS0_SVW4_VWA4_WSGRA0_WG64_4_1_WGM1
    SolutionIndex: 4
    SolutionNameMin: Cijk_Ailk_Bljk_BBS_BH_UserArgs_MT256x16x64_MI16x16x1_SN_CLR1_GRVWA8_GRVWB4_GSU5_LBSPPA4096_LBSPPB128_LPA0_LPB16_LRVW8_LWPM4_MIWT4_1_NTA0_NLCA1_PLR1_SU0_SUM0_SUS0_SVW4_VWA4_WSGRA0_WG64_4_1_WGM1
    SolutionIndex: 5
    SolutionNameMin: Cijk_Ailk_Bljk_BBS_BH_UserArgs_MT256x16x32_MI16x16x1_SN_CLR1_GRVWA8_GRVWB2_GSU8_LBSPPA2048_LBSPPB128_LPA0_LPB4_LRVW4_LWPM4_MIWT4_1_NTA4_NLCA1_PLR1_SU0_SUM0_SUS0_SVW4_VWA4_WSGRA0_WG64_4_1_WGM1
    SolutionIndex: 6
    SolutionNameMin: Cijk_Ailk_Bljk_BBS_BH_UserArgs_MT256x16x64_MI16x16x1_SN_CLR1_GRVWA8_GRVWB4_GSU5_LBSPPA4096_LBSPPB128_LPA0_LPB16_LRVW8_LWPMn1_MIWT4_1_NTA0_NLCA1_PLR1_SU0_SUM0_SUS0_SVW4_VWA4_WSGRA0_WG64_4_1_WGM1
    SolutionIndex: 7
    SolutionNameMin: Cijk_Ailk_Bljk_BBS_BH_UserArgs_MT256x16x32_MI16x16x1_SN_CLR1_GRVWA2_GRVWB2_GSU2_LBSPPA2048_LBSPPB128_LPA0_LPB4_LRVW4_LWPMn1_MIWT4_1_NTA4_NLCA2_PLR1_SU4_SUM0_SUS256_SVW4_VWA4_WSGRA1_WG64_4_1_WGM1
    SolutionIndex: 8
    SolutionNameMin: Cijk_Ailk_Bljk_BBS_BH_UserArgs_MT256x16x32_MI16x16x1_SN_CLR1_GRVWA8_GRVWB2_GSU3_LBSPPA2048_LBSPPB128_LPA0_LPB4_LRVW4_LWPMn1_MIWT4_1_NTA4_NLCA1_PLR1_SU4_SUM0_SUS256_SVW4_VWA4_WSGRA1_WG64_4_1_WGM1
    SolutionIndex: 9
    SolutionNameMin: Cijk_Ailk_Bljk_BBS_BH_UserArgs_MT512x16x32_MI16x16x1_SN_CLR1_GRVWA8_GRVWB2_GSU5_LBSPPA4096_LBSPPB128_LPA0_LPB4_LRVW4_LWPM4_MIWT8_1_NTA0_NLCA1_PLR1_SU0_SUM0_SUS0_SVW8_VWA8_WSGRA0_WG64_4_1_WGM1
    SolutionIndex: 10
    SolutionNameMin: Cijk_Ailk_Bljk_BBS_BH_UserArgs_MT256x16x32_MI16x16x1_SN_CLR1_GRVWA8_GRVWB2_GSU6_LBSPPA2048_LBSPPB128_LPA0_LPB4_LRVW4_LWPM4_MIWT4_1_NTA4_NLCA1_PLR1_SU0_SUM0_SUS0_SVW4_VWA4_WSGRA0_WG64_4_1_WGM1
    SolutionIndex: 11
    SolutionNameMin: Cijk_Ailk_Bljk_BBS_BH_UserArgs_MT512x16x32_MI16x16x1_SN_CLR1_GRVWA8_GRVWB2_GSU5_LBSPPA4096_LBSPPB128_LPA0_LPB4_LRVW4_LWPM2_MIWT8_1_NTA0_NLCA1_PLR1_SU4_SUM0_SUS256_SVW8_VWA8_WSGRA1_WG64_4_1_WGM1
    SolutionIndex: 12
    SolutionNameMin: Cijk_Ailk_Bljk_BBS_BH_UserArgs_MT256x16x32_MI16x16x1_SN_CLR1_GRVWA2_GRVWB2_GSU3_LBSPPA2048_LBSPPB128_LPA0_LPB4_LRVW4_LWPM2_MIWT4_1_NTA4_NLCA2_PLR1_SU0_SUM0_SUS0_SVW4_VWA4_WSGRA1_WG64_4_1_WGM1
    SolutionIndex: 13
    SolutionNameMin: Cijk_Ailk_Bljk_BBS_BH_UserArgs_MT256x16x32_MI16x16x1_SN_CLR1_GRVWA8_GRVWB2_GSU6_LBSPPA2048_LBSPPB128_LPA0_LPB4_LRVW4_LWPMn1_MIWT4_1_NTA0_NLCA1_PLR1_SU0_SUM0_SUS0_SVW4_VWA4_WSGRA1_WG64_4_1_WGM1
    SolutionIndex: 14
    SolutionNameMin: Cijk_Ailk_Bljk_BBS_BH_UserArgs_MT128x16x128_MI16x16x1_SN_CLR1_GRVWA8_GRVWB8_GSU1_LBSPPA2048_LBSPPB256_LPA32_LPB16_LRVW8_LWPMn1_MIWT2_1_NTA0_NLCA1_PLR3_SU4_SUM0_SUS256_SVW2_VWA2_WSGRA0_WG64_4_1_WGM1
    SolutionIndex: 15
    SolutionNameMin: Cijk_Ailk_Bljk_BBS_BH_UserArgs_MT512x16x32_MI16x16x1_SN_CLR1_GRVWA8_GRVWB2_GSU5_LBSPPA4096_LBSPPB128_LPA0_LPB4_LRVW4_LWPM4_MIWT8_1_NTA0_NLCA1_PLR1_SU4_SUM0_SUS256_SVW8_VWA8_WSGRA0_WG64_4_1_WGM1
    SolutionIndex: 16
    SolutionNameMin: Cijk_Ailk_Bljk_BBS_BH_UserArgs_MT128x16x64_MI16x16x1_SN_CLR1_GRVWA8_GRVWB4_GSU6_LBSPPA2048_LBSPPB128_LPA32_LPB16_LRVW8_LWPM4_MIWT2_1_NTA0_NLCA1_PLR1_SU0_SUM0_SUS0_SVW2_VWA2_WSGRA0_WG64_4_1_WGM1
    SolutionIndex: 17
    SolutionNameMin: Cijk_Ailk_Bljk_BBS_BH_UserArgs_MT128x16x128_MI16x16x1_SN_CLR1_GRVWA8_GRVWB8_GSU1_LBSPPA2048_LBSPPB256_LPA32_LPB16_LRVW8_LWPMn1_MIWT2_1_NTA0_NLCA1_PLR3_SU0_SUM0_SUS0_SVW2_VWA2_WSGRA0_WG64_4_1_WGM1
    SolutionIndex: 18
    SolutionNameMin: Cijk_Ailk_Bljk_BBS_BH_UserArgs_MT512x16x32_MI16x16x1_SN_CLR1_GRVWA8_GRVWB2_GSU5_LBSPPA4096_LBSPPB128_LPA0_LPB4_LRVW4_LWPMn1_MIWT8_1_NTA0_NLCA1_PLR1_SU0_SUM0_SUS0_SVW8_VWA8_WSGRA0_WG64_4_1_WGM1
    SolutionIndex: 19
    SolutionNameMin: Cijk_Ailk_Bljk_BBS_BH_UserArgs_MT256x16x32_MI16x16x1_SN_CLR1_GRVWA8_GRVWB2_GSU3_LBSPPA2048_LBSPPB128_LPA0_LPB4_LRVW4_LWPM2_MIWT4_1_NTA4_NLCA1_PLR1_SU4_SUM0_SUS256_SVW4_VWA4_WSGRA0_WG64_4_1_WGM1
    SolutionIndex: 20
    SolutionNameMin: Cijk_Ailk_Bljk_BBS_BH_UserArgs_MT256x16x32_MI16x16x1_SN_CLR1_GRVWA8_GRVWB2_GSU2_LBSPPA2048_LBSPPB128_LPA0_LPB4_LRVW4_LWPMn1_MIWT4_1_NTA0_NLCA1_PLR1_SU4_SUM0_SUS256_SVW4_VWA4_WSGRA1_WG64_4_1_WGM1
    SolutionIndex: 21
    SolutionNameMin: Cijk_Ailk_Bljk_BBS_BH_UserArgs_MT256x16x32_MI16x16x1_SN_CLR1_GRVWA8_GRVWB2_GSU4_LBSPPA2048_LBSPPB128_LPA0_LPB4_LRVW4_LWPMn1_MIWT4_1_NTA0_NLCA1_PLR1_SU4_SUM0_SUS256_SVW4_VWA4_WSGRA1_WG64_4_1_WGM1
    SolutionIndex: 22
    SolutionNameMin: Cijk_Ailk_Bljk_BBS_BH_UserArgs_MT512x16x32_MI16x16x1_SN_CLR1_GRVWA8_GRVWB2_GSU3_LBSPPA4096_LBSPPB128_LPA0_LPB4_LRVW4_LWPM4_MIWT8_1_NTA4_NLCA1_PLR1_SU0_SUM0_SUS0_SVW8_VWA8_WSGRA1_WG64_4_1_WGM1
    SolutionIndex: 23
    SolutionNameMin: Cijk_Ailk_Bljk_BBS_BH_UserArgs_MT256x16x32_MI16x16x1_SN_CLR1_GRVWA2_GRVWB2_GSU6_LBSPPA2048_LBSPPB128_LPA0_LPB4_LRVW4_LWPMn1_MIWT4_1_NTA4_NLCA2_PLR1_SU0_SUM0_SUS0_SVW4_VWA4_WSGRA1_WG64_4_1_WGM1
    SolutionIndex: 24
    SolutionNameMin: Cijk_Ailk_Bljk_BBS_BH_UserArgs_MT512x16x32_MI16x16x1_SN_CLR1_GRVWA8_GRVWB2_GSU4_LBSPPA4096_LBSPPB128_LPA0_LPB4_LRVW4_LWPM4_MIWT8_1_NTA4_NLCA1_PLR1_SU0_SUM0_SUS0_SVW8_VWA8_WSGRA1_WG64_4_1_WGM1
    SolutionIndex: 25
    SolutionNameMin: Cijk_Ailk_Bljk_BBS_BH_UserArgs_MT256x16x32_MI16x16x1_SN_CLR1_GRVWA8_GRVWB2_GSU4_LBSPPA2048_LBSPPB128_LPA0_LPB4_LRVW4_LWPM2_MIWT4_1_NTA0_NLCA1_PLR1_SU0_SUM0_SUS0_SVW4_VWA4_WSGRA1_WG64_4_1_WGM1
    SolutionIndex: 26
    SolutionNameMin: Cijk_Ailk_Bljk_BBS_BH_UserArgs_MT256x16x32_MI16x16x1_SN_CLR1_GRVWA8_GRVWB2_GSU8_LBSPPA2048_LBSPPB128_LPA0_LPB4_LRVW4_LWPM2_MIWT4_1_NTA4_NLCA1_PLR1_SU0_SUM0_SUS0_SVW4_VWA4_WSGRA1_WG64_4_1_WGM1
    SolutionIndex: 27
    SolutionNameMin: Cijk_Ailk_Bljk_BBS_BH_UserArgs_MT256x16x32_MI16x16x1_SN_CLR1_GRVWA8_GRVWB2_GSU4_LBSPPA2048_LBSPPB128_LPA0_LPB4_LRVW4_LWPM4_MIWT4_1_NTA4_NLCA1_PLR1_SU0_SUM0_SUS0_SVW4_VWA4_WSGRA1_WG64_4_1_WGM1
    SolutionIndex: 28
    SolutionNameMin: Cijk_Ailk_Bljk_BBS_BH_UserArgs_MT256x16x32_MI16x16x1_SN_CLR1_GRVWA8_GRVWB2_GSU6_LBSPPA2048_LBSPPB128_LPA0_LPB4_LRVW4_LWPM2_MIWT4_1_NTA4_NLCA1_PLR1_SU0_SUM0_SUS0_SVW4_VWA4_WSGRA0_WG64_4_1_WGM1
    SolutionIndex: 29
    SolutionNameMin: Cijk_Ailk_Bljk_BBS_BH_UserArgs_MT512x16x32_MI16x16x1_SN_CLR1_GRVWA8_GRVWB2_GSU8_LBSPPA4096_LBSPPB128_LPA0_LPB4_LRVW4_LWPM4_MIWT8_1_NTA0_NLCA1_PLR1_SU0_SUM0_SUS0_SVW8_VWA8_WSGRA1_WG64_4_1_WGM1
    SolutionIndex: 30
    SolutionNameMin: Cijk_Ailk_Bljk_BBS_BH_UserArgs_MT256x16x32_MI16x16x1_SN_CLR1_GRVWA8_GRVWB2_GSU4_LBSPPA2048_LBSPPB128_LPA0_LPB4_LRVW4_LWPMn1_MIWT4_1_NTA0_NLCA1_PLR1_SU0_SUM0_SUS0_SVW4_VWA4_WSGRA0_WG64_4_1_WGM1
    SolutionIndex: 31
    SolutionNameMin: Cijk_Ailk_Bljk_BBS_BH_UserArgs_MT256x16x32_MI16x16x1_SN_CLR1_GRVWA8_GRVWB2_GSU6_LBSPPA2048_LBSPPB128_LPA0_LPB4_LRVW4_LWPM4_MIWT4_1_NTA0_NLCA1_PLR1_SU4_SUM0_SUS256_SVW4_VWA4_WSGRA1_WG64_4_1_WGM1
    SolutionIndex: 32
    SolutionNameMin: Cijk_Ailk_Bljk_BBS_BH_UserArgs_MT512x16x32_MI16x16x1_SN_CLR1_GRVWA8_GRVWB2_GSU3_LBSPPA4096_LBSPPB128_LPA0_LPB4_LRVW4_LWPMn1_MIWT8_1_NTA0_NLCA1_PLR1_SU4_SUM0_SUS256_SVW8_VWA8_WSGRA0_WG64_4_1_WGM1
    SolutionIndex: 33
    SolutionNameMin: Cijk_Ailk_Bljk_BBS_BH_UserArgs_MT256x16x32_MI16x16x1_SN_CLR1_GRVWA8_GRVWB2_GSU3_LBSPPA2048_LBSPPB128_LPA0_LPB4_LRVW4_LWPM4_MIWT4_1_NTA4_NLCA1_PLR1_SU4_SUM0_SUS256_SVW4_VWA4_WSGRA0_WG64_4_1_WGM1
    SolutionIndex: 34
    SolutionNameMin: Cijk_Ailk_Bljk_BBS_BH_UserArgs_MT256x224x64_MI32x32x1_SN_GRVWB8_GSU1_LBSPPA0_LPA0_LPB8_LRVW8_MIWT2_7_NLCA1_SU8_SUM0_SUS256_SVW2_VWA2_WG128_2_1_WGM32_WGMXCC1
    SolutionIndex: 35
    SolutionNameMin: Cijk_Ailk_Bljk_BBS_BH_UserArgs_MT256x256x32_MI32x32x1_SN_GRVWB8_GSU1_LBSPPA0_LPA0_LPB8_LRVW8_MIWT2_8_NLCA1_SU8_SUM0_SUS256_SVW2_VWA2_WG128_2_1_WGM32_WGMXCC4
    SolutionIndex: 36
    SolutionNameMin: Cijk_Ailk_Bljk_BBS_BH_UserArgs_MT128x256x64_MI32x32x1_SN_GRVWB8_GSU1_MIWT2_4_SU8_SUM0_SUS512_SSO0_SVW2_VWA2_WG64_4_1_WGM1
    SolutionIndex: 37
    SolutionNameMin: Cijk_Ailk_Bljk_BBS_BH_UserArgs_MT256x224x64_MI32x32x1_SN_GRVWB8_GSU1_LBSPPA0_LBSPPB128_LPA0_LPB8_LRVW8_MIWT2_7_NTC4_NTD4_PLR2_SU0_SUM0_SUS0_SVW2_VWA2_VWB1_WSGRA1_WSGRB0_WG128_2_1_WGM1
    SolutionIndex: 38
    SolutionNameMin: Cijk_Ailk_Bljk_BBS_BH_UserArgs_MT256x128x32_MI32x32x1_SN_GRVWB8_GSU1_LBSPPA0_LBSPPB128_LPA0_LPB8_LRVW8_MIWT2_4_NTC0_NTD0_PLR1_SU0_SUM0_SUS0_SVW2_VWA2_VWB1_WSGRA0_WSGRB0_WG128_2_1_WGM1
    SolutionIndex: 39
    SolutionNameMin: Cijk_Ailk_Bljk_BBS_BH_UserArgs_MT256x128x32_MI32x32x1_SN_GRVWB8_GSU1_LBSPPA0_LBSPPB256_LPA0_LPB8_LRVW8_MIWT2_4_NTC0_NTD0_PLR1_SU4_SUM0_SUS256_SVW2_VWA2_VWB4_WSGRA1_WSGRB1_WG128_2_1_WGM1
    SolutionIndex: 40
    SolutionNameMin: Cijk_Ailk_Bljk_BBS_BH_UserArgs_MT256x256x32_MI32x32x1_SN_GRVWB8_GSU1_LBSPPA0_LBSPPB128_LPA16_LPB8_LRVW8_MIWT2_8_NTC3_NTD3_PLR1_SU0_SUM0_SUS0_SVW2_VWA2_VWB1_WSGRA0_WSGRB0_WG128_2_1_WGM1
    SolutionIndex: 41
    SolutionNameMin: Cijk_Ailk_Bljk_BBS_BH_UserArgs_MT256x256x32_MI32x32x1_SN_GRVWB4_GSU1_LBSPPA0_LBSPPB256_LPA0_LPB8_LRVW8_MIWT2_8_NTC4_NTD4_PLR1_SU0_SUM0_SUS0_SVW2_VWA2_VWB4_WSGRA1_WSGRB1_WG128_2_1_WGM1
    SolutionIndex: 42
    SolutionNameMin: Cijk_Ailk_Bljk_BBS_BH_UserArgs_MT256x128x32_MI32x32x1_SN_GRVWB8_GSU1_LBSPPA0_LBSPPB128_LPA0_LPB8_LRVW8_MIWT2_4_NTC4_NTD4_PLR1_SU0_SUM0_SUS0_SVW2_VWA2_VWB1_WSGRA1_WSGRB0_WG128_2_1_WGM1
    SolutionIndex: 43
    SolutionNameMin: Cijk_Ailk_Bljk_BBS_BH_UserArgs_MT256x128x32_MI32x32x1_SN_GRVWB8_GSU1_LBSPPA0_LBSPPB256_LPA0_LPB8_LRVW8_MIWT2_4_NTC0_NTD0_PLR1_SU0_SUM0_SUS0_SVW2_VWA2_VWB4_WSGRA1_WSGRB1_WG128_2_1_WGM1
    SolutionIndex: 44
    SolutionNameMin: Cijk_Ailk_Bljk_BBS_BH_UserArgs_MT256x224x64_MI32x32x1_SN_GRVWB8_GSU1_LBSPPA0_LBSPPB128_LPA0_LPB8_LRVW8_MIWT2_7_NTC3_NTD3_PLR2_SU0_SUM0_SUS0_SVW2_VWA2_VWB1_WSGRA0_WSGRB1_WG128_2_1_WGM1
    SolutionIndex: 45
    SolutionNameMin: Cijk_Ailk_Bljk_BBS_BH_UserArgs_MT256x256x32_MI32x32x1_SN_GRVWB8_GSU1_LBSPPA0_LBSPPB128_LPA16_LPB8_LRVW8_MIWT2_8_NTC4_NTD4_PLR1_SU4_SUM0_SUS256_SVW2_VWA2_VWB1_WSGRA0_WSGRB0_WG128_2_1_WGM1
    SolutionIndex: 46
    SolutionNameMin: Cijk_Ailk_Bljk_BBS_BH_UserArgs_MT256x224x64_MI32x32x1_SN_GRVWB8_GSU1_LBSPPA0_LBSPPB128_LPA0_LPB8_LRVW8_MIWT2_7_NTC4_NTD4_PLR2_SU4_SUM0_SUS256_SVW2_VWA2_VWB1_WSGRA0_WSGRB1_WG128_2_1_WGM1
    SolutionIndex: 47
    SolutionNameMin: Cijk_Ailk_Bljk_BBS_BH_UserArgs_MT256x256x32_MI32x32x1_SN_GRVWB4_GSU1_LBSPPA0_LBSPPB256_LPA0_LPB8_LRVW8_MIWT2_8_NTC0_NTD0_PLR1_SU4_SUM0_SUS256_SVW2_VWA2_VWB4_WSGRA1_WSGRB1_WG128_2_1_WGM8
    SolutionIndex: 48
    SolutionNameMin: Cijk_Ailk_Bljk_BBS_BH_UserArgs_MT256x256x32_MI32x32x1_SN_GRVWB8_GSU1_LBSPPA0_LBSPPB128_LPA16_LPB8_LRVW8_MIWT2_8_NTC0_NTD0_PLR1_SU0_SUM0_SUS0_SVW2_VWA2_VWB1_WSGRA0_WSGRB0_WG128_2_1_WGM1
    SolutionIndex: 49
    SolutionNameMin: Cijk_Ailk_Bljk_BBS_BH_UserArgs_MT256x256x32_MI32x32x1_SN_GRVWB8_GSU1_LBSPPA0_LBSPPB256_LPA0_LPB8_LRVW8_MIWT2_8_NTC4_NTD4_PLR1_SU0_SUM0_SUS0_SVW2_VWA2_VWB4_WSGRA1_WSGRB1_WG128_2_1_WGM1
    SolutionIndex: 50
    SolutionNameMin: Cijk_Ailk_Bljk_BBS_BH_UserArgs_MT256x256x32_MI32x32x1_SN_GRVWB4_GSU1_LBSPPA0_LBSPPB256_LPA0_LPB8_LRVW8_MIWT2_8_NTC3_NTD3_PLR1_SU0_SUM0_SUS0_SVW2_VWA2_VWB4_WSGRA1_WSGRB1_WG128_2_1_WGM1
    SolutionIndex: 51
    SolutionNameMin: Cijk_Ailk_Bljk_BBS_BH_UserArgs_MT256x192x64_MI32x32x1_SN_GRVWB4_GSU1_LBSPPA0_LBSPPB128_LPA0_LPB8_LRVW8_MIWT2_6_NTC0_NTD0_PLR2_SU4_SUM0_SUS256_SVW2_VWA2_VWB1_WSGRA1_WSGRB0_WG128_2_1_WGM32
    SolutionIndex: 52
    SolutionNameMin: Cijk_Ailk_Bljk_BBS_BH_UserArgs_MT256x224x64_MI32x32x1_SN_GRVWB8_GSU1_LBSPPA0_LBSPPB128_LPA0_LPB8_LRVW8_MIWT2_7_NTC0_NTD0_PLR2_SU0_SUM0_SUS0_SVW2_VWA2_VWB1_WSGRA1_WSGRB0_WG128_2_1_WGM1
    SolutionIndex: 53
    SolutionNameMin: Cijk_Ailk_Bljk_BBS_BH_UserArgs_MT256x256x32_MI32x32x1_SN_GRVWB4_GSU1_LBSPPA0_LBSPPB128_LPA16_LPB8_LRVW8_MIWT2_8_NTC0_NTD0_PLR1_SU0_SUM0_SUS0_SVW2_VWA2_VWB1_WSGRA0_WSGRB0_WG128_2_1_WGM1
    SolutionIndex: 54
    SolutionNameMin: Cijk_Ailk_Bljk_BBS_BH_UserArgs_MT256x224x64_MI32x32x1_SN_GRVWB8_GSU1_LBSPPA0_LBSPPB128_LPA0_LPB8_LRVW8_MIWT2_7_NTC0_NTD0_PLR2_SU4_SUM0_SUS256_SVW2_VWA2_VWB1_WSGRA0_WSGRB1_WG128_2_1_WGM1
    SolutionIndex: 55
    SolutionNameMin: Cijk_Ailk_Bljk_BBS_BH_UserArgs_MT16x80x128_MI16x16x1_SN_LDSB1_GRVWB8_GSU1_LBSPPA256_LBSPPB256_LPB16_LRVW8_MIWT1_5_NTB0_SU0_SUM0_SUS0_SPO1_WG16_4_4_WGM1
    SolutionIndex: 56
    SolutionNameMin: Cijk_Ailk_Bljk_BBS_BH_UserArgs_MT16x64x256_MI16x16x1_SN_LDSB1_GRVWB2_GSU1_LBSPPA256_LBSPPB512_LPB16_LRVW8_MIWT1_4_NTB0_SU0_SUM0_SUS0_SPO1_WG16_4_4_WGM1
    SolutionIndex: 57
    SolutionNameMin: Cijk_Ailk_Bljk_BBS_BH_UserArgs_MT16x96x128_MI16x16x1_SN_LDSB1_GRVWB8_GSU1_LBSPPA256_LBSPPB256_LPB16_LRVW8_MIWT1_3_NTB4_SU0_SUM0_SUS0_SPO0_WG16_8_2_WGM1
    SolutionIndex: 58
    SolutionNameMin: Cijk_Ailk_Bljk_BBS_BH_UserArgs_MT16x80x128_MI16x16x1_SN_LDSB1_GRVWB8_GSU1_LBSPPA256_LBSPPB256_LPB16_LRVW8_MIWT1_5_NTB4_SU0_SUM0_SUS0_SPO1_WG16_4_4_WGM1
    SolutionIndex: 59
    SolutionNameMin: Cijk_Ailk_Bljk_BBS_BH_UserArgs_MT16x112x128_MI16x16x1_SN_LDSB1_GRVWB8_GSU1_LBSPPA256_LBSPPB256_LPB16_LRVW8_MIWT1_7_NTB0_SU0_SUM0_SUS0_SPO0_WG16_4_4_WGM1
    SolutionIndex: 60
    SolutionNameMin: Cijk_Ailk_Bljk_BBS_BH_UserArgs_MT16x80x128_MI16x16x1_SN_LDSB1_GRVWB8_GSU3_LBSPPA256_LBSPPB256_LPB16_LRVW8_MIWT1_5_NTB4_SU0_SUM0_SUS0_SPO0_WG16_4_4_WGM1
    SolutionIndex: 61
    SolutionNameMin: Cijk_Ailk_Bljk_BBS_BH_UserArgs_MT16x96x128_MI16x16x1_SN_LDSB1_GRVWB8_GSU1_LBSPPA256_LBSPPB256_LPB16_LRVW8_MIWT1_3_NTB4_SU0_SUM0_SUS0_SPO1_WG16_8_2_WGM1
    SolutionIndex: 62
    SolutionNameMin: Cijk_Ailk_Bljk_BBS_BH_UserArgs_MT16x80x256_MI16x16x1_SN_LDSB1_GRVWB2_GSU1_LBSPPA256_LBSPPB512_LPB16_LRVW8_MIWT1_5_NTB0_SU0_SUM0_SUS0_SPO1_WG16_4_4_WGM1
    SolutionIndex: 63
    SolutionNameMin: Cijk_Ailk_Bljk_BBS_BH_UserArgs_MT16x112x128_MI16x16x1_SN_LDSB1_GRVWB8_GSU1_LBSPPA256_LBSPPB256_LPB16_LRVW8_MIWT1_7_NTB0_SU0_SUM0_SUS0_SPO1_WG16_4_4_WGM1
    SolutionIndex: 64
    SolutionNameMin: Cijk_Ailk_Bljk_BBS_BH_UserArgs_MT16x96x128_MI16x16x1_SN_LDSB1_GRVWB8_GSU1_LBSPPA256_LBSPPB256_LPB16_LRVW8_MIWT1_6_NTB4_SU0_SUM0_SUS0_SPO0_WG16_4_4_WGM1
    SolutionIndex: 65
    SolutionNameMin: Cijk_Ailk_Bljk_BBS_BH_UserArgs_MT16x96x128_MI16x16x1_SN_LDSB1_GRVWB8_GSU5_LBSPPA256_LBSPPB256_LPB16_LRVW8_MIWT1_3_NTB0_SU0_SUM0_SUS0_SPO1_WG16_8_2_WGM1
    SolutionIndex: 66
    SolutionNameMin: Cijk_Ailk_Bljk_BBS_BH_UserArgs_MT16x128x128_MI16x16x1_SN_LDSB1_GRVWB8_GSU1_LBSPPA256_LBSPPB256_LPB16_LRVW8_MIWT1_4_NTB0_SU0_SUM0_SUS0_SPO1_WG16_8_2_WGM1
    SolutionIndex: 67
    SolutionNameMin: Cijk_Ailk_Bljk_BBS_BH_UserArgs_MT16x80x256_MI16x16x1_SN_LDSB1_GRVWB2_GSU1_LBSPPA256_LBSPPB512_LPB16_LRVW8_MIWT1_5_NTB4_SU0_SUM0_SUS0_SPO0_WG16_4_4_WGM1
    SolutionIndex: 68
    SolutionNameMin: Cijk_Ailk_Bljk_BBS_BH_UserArgs_MT16x128x128_MI16x16x1_SN_LDSB1_GRVWB8_GSU1_LBSPPA256_LBSPPB256_LPB16_LRVW8_MIWT1_4_NTB4_SU0_SUM0_SUS0_SPO0_WG16_8_2_WGM1
    SolutionIndex: 69
    SolutionNameMin: Cijk_Ailk_Bljk_BBS_BH_UserArgs_MT16x176x128_MI16x16x1_SN_LDSB1_GRVWB8_GSU1_LBSPPA256_LBSPPB256_LPB16_LRVW8_MIWT1_11_NTB4_SU0_SUM0_SUS0_SPO0_WG16_4_4_WGM1
    SolutionIndex: 70
    SolutionNameMin: Cijk_Ailk_Bljk_BBS_BH_UserArgs_MT16x96x256_MI16x16x1_SN_LDSB1_GRVWB2_GSU1_LBSPPA128_LBSPPB512_LPB4_LRVW4_MIWT1_6_NTB4_SU0_SUM0_SUS0_SPO0_WG16_4_4_WGM1
    SolutionIndex: 71
    SolutionNameMin: Cijk_Ailk_Bljk_BBS_BH_UserArgs_MT16x96x128_MI16x16x1_SN_LDSB1_GRVWB8_GSU1_LBSPPA256_LBSPPB256_LPB16_LRVW8_MIWT1_6_NTB4_SU0_SUM0_SUS0_SPO1_WG16_4_4_WGM1
    SolutionIndex: 72
    SolutionNameMin: Cijk_Ailk_Bljk_BBS_BH_UserArgs_MT16x96x128_MI16x16x1_SN_LDSB1_GRVWB8_GSU1_LBSPPA256_LBSPPB256_LPB16_LRVW8_MIWT1_3_NTB0_SU0_SUM0_SUS0_SPO1_WG16_8_2_WGM1
    SolutionIndex: 73
    SolutionNameMin: Cijk_Ailk_Bljk_BBS_BH_UserArgs_MT16x224x128_MI16x16x1_SN_LDSB1_GRVWB2_GSU1_LBSPPA128_LBSPPB256_LPB4_LRVW4_MIWT1_14_NTB4_SU0_SUM0_SUS0_SPO0_WG16_4_4_WGM1
    SolutionIndex: 74
    SolutionNameMin: Cijk_Ailk_Bljk_BBS_BH_UserArgs_MT16x96x128_MI16x16x1_SN_LDSB1_GRVWB8_GSU1_LBSPPA256_LBSPPB256_LPB16_LRVW8_MIWT1_6_NTB0_SU0_SUM0_SUS0_SPO1_WG16_4_4_WGM1
    SolutionIndex: 75
    SolutionNameMin: Cijk_Ailk_Bljk_BBS_BH_UserArgs_MT16x64x256_MI16x16x1_SN_LDSB1_GRVWB2_GSU1_LBSPPA256_LBSPPB512_LPB16_LRVW8_MIWT1_4_NTB4_SU0_SUM0_SUS0_SPO0_WG16_4_4_WGM1
    SolutionIndex: 76
    SolutionNameMin: Cijk_Ailk_Bljk_BBS_BH_UserArgs_MT16x112x128_MI16x16x1_SN_LDSB1_GRVWB8_GSU1_LBSPPA256_LBSPPB256_LPB16_LRVW8_MIWT1_7_NTB4_SU0_SUM0_SUS0_SPO0_WG16_4_4_WGM1
    SolutionIndex: 77
    SolutionNameMin: Cijk_Ailk_Bljk_BBS_BH_UserArgs_MT128x256x32_MI16x16x1_SN_GRVWB8_GSU1_GSUC0_GSUWGMRR0_K1_LBSPPA1024_LBSPPB256_LPA0_LPB8_LRVW4_MIWT8_4_NLCA1_SU8_SUM0_SUS256_SVW8_VWA8_VWB4_WG16_16_1_WGM16_WGMXCC1_WGMXCCGn1
    SolutionIndex: 78
    SolutionNameMin: Cijk_Ailk_Bljk_BBS_BH_UserArgs_MT256x192x64_MI32x32x1_SN_GRVWB8_GSU1_GSUC0_GSUWGMRR0_K1_LBSPPA0_LBSPPB256_LPA0_LPB8_LRVW8_MIWT2_6_NLCA1_SU8_SUM0_SUS256_SVW2_VWA2_VWB2_WG128_2_1_WGM16_WGMXCC1_WGMXCCGn1
- - - [2, 7168, 1, 8192]
    - [0, 0.0]
  - - [2, 3584, 1, 8192]
    - [1, 0.0]
  - - [2, 1280, 1, 8192]
    - [2, 0.0]
  - - [12288, 1, 1, 4096]
    - [3, 0.0]
  - - [4096, 1, 1, 4096]
    - [4, 0.0]
  - - [22016, 1, 1, 4096]
    - [5, 0.0]
  - - [4096, 1, 1, 11008]
    - [6, 0.0]
  - - [151936, 1, 1, 4096]
    - [7, 0.0]
  - - [12288, 1, 1, 8192]
    - [8, 0.0]
  - - [8192, 1, 1, 4096]
    - [9, 0.0]
  - - [24576, 1, 1, 8192]
    - [10, 0.0]
  - - [8192, 1, 1, 12288]
    - [11, 0.0]
  - - [76032, 1, 1, 8192]
    - [12, 0.0]
  - - [6144, 1, 1, 8192]
    - [13, 0.0]
  - - [8192, 1, 1, 2048]
    - [14, 0.0]
  - - [8192, 1, 1, 6144]
    - [15, 0.0]
  - - [38016, 1, 1, 8192]
    - [10, 0.0]
  - - [3072, 1, 1, 8192]
    - [16, 0.0]
  - - [8192, 1, 1, 1024]
    - [17, 0.0]
  - - [8192, 1, 1, 3072]
    - [18, 0.0]
  - - [19008, 1, 1, 8192]
    - [19, 0.0]
  - - [19968, 1, 1, 13312]
    - [20, 0.0]
  - - [13312, 1, 1, 6656]
    - [21, 0.0]
  - - [35584, 1, 1, 13312]
    - [10, 0.0]
  - - [13312, 1, 1, 17792]
    - [22, 0.0]
  - - [76032, 1, 1, 13312]
    - [23, 0.0]
  - - [9984, 1, 1, 13312]
    - [24, 0.0]
  - - [13312, 1, 1, 3328]
    - [25, 0.0]
  - - [17792, 1, 1, 13312]
    - [26, 0.0]
  - - [13312, 1, 1, 8896]
    - [27, 0.0]
  - - [38016, 1, 1, 13312]
    - [28, 0.0]
  - - [4992, 1, 1, 13312]
    - [29, 0.0]
  - - [13312, 1, 1, 1664]
    - [30, 0.0]
  - - [8896, 1, 1, 13312]
    - [31, 0.0]
  - - [13312, 1, 1, 4448]
    - [32, 0.0]
  - - [19008, 1, 1, 13312]
    - [33, 0.0]
  - - [4096, 12288, 1, 4096]
    - [34, 0.0]
  - - [4096, 12288, 1, 12288]
    - [34, 0.0]
  - - [4096, 12288, 1, 22016]
    - [34, 0.0]
  - - [4096, 12288, 1, 32000]
    - [34, 0.0]
  - - [11008, 12288, 1, 4096]
    - [35, 0.0]
  - - [128, 2048, 192, 2048]
    - [36, 0.0]
  - - [8192, 6144, 1, 8192]
    - [37, 0.0]
  - - [8192, 8192, 1, 2048]
    - [38, 0.0]
  - - [8192, 8192, 1, 6144]
    - [39, 0.0]
  - - [8192, 38016, 1, 8192]
    - [40, 0.0]
  - - [8192, 3072, 1, 8192]
    - [41, 0.0]
  - - [8192, 8192, 1, 1024]
    - [42, 0.0]
  - - [8192, 8192, 1, 3072]
    - [43, 0.0]
  - - [8192, 19008, 1, 8192]
    - [44, 0.0]
  - - [8192, 19968, 1, 13312]
    - [45, 0.0]
  - - [8192, 13312, 1, 6656]
    - [45, 0.0]
  - - [8192, 35584, 1, 13312]
    - [46, 0.0]
  - - [8192, 13312, 1, 17792]
    - [47, 0.0]
  - - [8192, 76032, 1, 13312]
    - [48, 0.0]
  - - [8192, 9984, 1, 13312]
    - [37, 0.0]
  - - [8192, 13312, 1, 3328]
    - [49, 0.0]
  - - [8192, 17792, 1, 13312]
    - [46, 0.0]
  - - [8192, 13312, 1, 8896]
    - [50, 0.0]
  - - [8192, 38016, 1, 13312]
    - [45, 0.0]
  - - [8192, 4992, 1, 13312]
    - [51, 0.0]
  - - [8192, 13312, 1, 1664]
    - [38, 0.0]
  - - [8192, 8896, 1, 13312]
    - [52, 0.0]
  - - [8192, 13312, 1, 4448]
    - [53, 0.0]
  - - [8192, 19008, 1, 13312]
    - [54, 0.0]
  - - [1, 12288, 1, 4096]
    - [55, 0.0]
  - - [1, 4096, 1, 4096]
    - [56, 0.0]
  - - [1, 22016, 1, 4096]
    - [57, 0.0]
  - - [1, 151936, 1, 4096]
    - [57, 0.0]
  - - [1, 12288, 1, 8192]
    - [58, 0.0]
  - - [1, 8192, 1, 4096]
    - [59, 0.0]
  - - [1, 24576, 1, 8192]
    - [58, 0.0]
  - - [1, 8192, 1, 12288]
    - [60, 0.0]
  - - [1, 76032, 1, 8192]
    - [61, 0.0]
  - - [1, 6144, 1, 8192]
    - [62, 0.0]
  - - [1, 8192, 1, 2048]
    - [63, 0.0]
  - - [1, 8192, 1, 6144]
    - [59, 0.0]
  - - [1, 38016, 1, 8192]
    - [64, 0.0]
  - - [1, 3072, 1, 8192]
    - [65, 0.0]
  - - [1, 8192, 1, 1024]
    - [66, 0.0]
  - - [1, 8192, 1, 3072]
    - [59, 0.0]
  - - [1, 19008, 1, 8192]
    - [67, 0.0]
  - - [1, 19968, 1, 13312]
    - [68, 0.0]
  - - [1, 13312, 1, 6656]
    - [69, 0.0]
  - - [1, 35584, 1, 13312]
    - [70, 0.0]
  - - [1, 13312, 1, 17792]
    - [71, 0.0]
  - - [1, 76032, 1, 13312]
    - [64, 0.0]
  - - [1, 9984, 1, 13312]
    - [68, 0.0]
  - - [1, 13312, 1, 3328]
    - [72, 0.0]
  - - [1, 17792, 1, 13312]
    - [73, 0.0]
  - - [1, 13312, 1, 8896]
    - [74, 0.0]
  - - [1, 38016, 1, 13312]
    - [70, 0.0]
  - - [1, 4992, 1, 13312]
    - [75, 0.0]
  - - [1, 13312, 1, 1664]
    - [71, 0.0]
  - - [1, 8896, 1, 13312]
    - [76, 0.0]
  - - [1, 13312, 1, 4448]
    - [74, 0.0]
  - - [1, 19008, 1, 13312]
    - [67, 0.0]
  - - [2048, 122880, 1, 512]
    - [77, 0.0]
  - - [512, 122880, 1, 2048]
    - [78, 0.0]
  - - [512, 122880, 1, 512]
    - [77, 0.0]
- null
- null
- DeviceEfficiency
- Equality
