library/src/amd_detail/rocblaslt/src/Tensile/Logic/asm_full/navi31/Equality/navi31_Cijk_Ailk_Bjlk_SB_Bias_HAS_SAV_UserArgs.yaml
- {MinimumRequiredVersion: 4.33.0}
- navi31
- gfx1100
- [Device 73f0]
    SolutionIndex: 0
    SolutionNameMin: Cijk_Ailk_Bjlk_SB_Bias_HAS_SAV_UserArgs_MT8x8x8_SN_GSU1_SU32_SUM0_SUS256_TT1_1_WGM1
    SolutionIndex: 1
    SolutionNameMin: Cijk_Ailk_Bjlk_SB_Bias_HAS_SAV_UserArgs_MT16x16x8_SN_GSU1_SU32_SUM0_SUS256_TT2_2_WGM1
    SolutionIndex: 2
    SolutionNameMin: Cijk_Ailk_Bjlk_SB_Bias_HAS_SAV_UserArgs_MT8x8x16_SN_GSU1_SU32_SUM0_SUS256_TT1_1_WGM1
    SolutionIndex: 3
    SolutionNameMin: Cijk_Ailk_Bjlk_SB_Bias_HAS_SAV_UserArgs_MT16x16x16_SN_GSU1_SU32_SUM0_SUS256_TT2_2_WGM1
- - - [64, 64, 1, 32, 64, 64, 64, 64]
    - [3, 0.466944]
  - - [128, 64, 1, 32, 128, 128, 128, 64]
    - [0, 0.919783]
  - - [192, 64, 1, 32, 192, 192, 192, 64]
    - [3, 1.39899]
  - - [256, 64, 1, 32, 256, 256, 256, 64]
    - [3, 1.83615]
  - - [320, 64, 1, 32, 320, 320, 320, 64]
    - [1, 2.22223]
  - - [384, 64, 1, 32, 384, 384, 384, 64]
    - [0, 2.15613]
  - - [448, 64, 1, 32, 448, 448, 448, 64]
    - [3, 3.27374]
  - - [512, 64, 1, 32, 512, 512, 512, 64]
    - [2, 3.74643]
  - - [576, 64, 1, 32, 576, 576, 576, 64]
    - [2, 4.21022]
  - - [640, 64, 1, 32, 640, 640, 640, 64]
    - [1, 4.58925]
  - - [704, 64, 1, 32, 704, 704, 704, 64]
    - [0, 4.65588]
  - - [768, 64, 1, 32, 768, 768, 768, 64]
    - [0, 4.08661]
  - - [832, 64, 1, 32, 832, 832, 832, 64]
    - [3, 9.12606]
  - - [896, 64, 1, 32, 896, 896, 896, 64]
    - [0, 10.3514]
  - - [960, 64, 1, 32, 960, 960, 960, 64]
    - [2, 13.2641]
  - - [1024, 64, 1, 32, 1024, 1024, 1024, 64]
    - [3, 7.18099]
  - - [64, 128, 1, 32, 64, 64, 64, 128]
    - [3, 0.690366]
  - - [128, 128, 1, 32, 128, 128, 128, 128]
    - [3, 1.70068]
  - - [192, 128, 1, 32, 192, 192, 192, 128]
    - [1, 2.607]
  - - [256, 128, 1, 32, 256, 256, 256, 128]
    - [3, 4.20159]
  - - [320, 128, 1, 32, 320, 320, 320, 128]
    - [3, 7.1875]
  - - [384, 128, 1, 32, 384, 384, 384, 128]
    - [1, 9.07198]
  - - [448, 128, 1, 32, 448, 448, 448, 128]
    - [0, 14.6501]
  - - [512, 128, 1, 32, 512, 512, 512, 128]
    - [3, 7.45834]
  - - [576, 128, 1, 32, 576, 576, 576, 128]
    - [3, 8.4278]
  - - [640, 128, 1, 32, 640, 640, 640, 128]
    - [2, 10.7054]
  - - [704, 128, 1, 32, 704, 704, 704, 128]
    - [2, 11.2827]
  - - [768, 128, 1, 32, 768, 768, 768, 128]
    - [3, 11.1724]
  - - [832, 128, 1, 32, 832, 832, 832, 128]
    - [0, 9.25569]
  - - [896, 128, 1, 32, 896, 896, 896, 128]
    - [3, 8.93149]
  - - [960, 128, 1, 32, 960, 960, 960, 128]
    - [0, 10.4145]
  - - [1024, 128, 1, 32, 1024, 1024, 1024, 128]
    - [3, 13.2882]
  - - [64, 192, 1, 32, 64, 64, 64, 192]
    - [1, 1.01548]
  - - [128, 192, 1, 32, 128, 128, 128, 192]
    - [3, 2.69976]
  - - [192, 192, 1, 32, 192, 192, 192, 192]
    - [2, 4.04888]
  - - [256, 192, 1, 32, 256, 256, 256, 192]
    - [1, 3.62163]
  - - [320, 192, 1, 32, 320, 320, 320, 192]
    - [3, 6.5066]
  - - [384, 192, 1, 32, 384, 384, 384, 192]
    - [2, 7.63979]
  - - [448, 192, 1, 32, 448, 448, 448, 192]
    - [2, 6.401]
  - - [512, 192, 1, 32, 512, 512, 512, 192]
    - [1, 5.70345]
  - - [576, 192, 1, 32, 576, 576, 576, 192]
    - [2, 9.64955]
  - - [640, 192, 1, 32, 640, 640, 640, 192]
    - [3, 9.35054]
  - - [704, 192, 1, 32, 704, 704, 704, 192]
    - [3, 12.3886]
  - - [768, 192, 1, 32, 768, 768, 768, 192]
    - [3, 10.108]
  - - [832, 192, 1, 32, 832, 832, 832, 192]
    - [3, 14.254]
  - - [896, 192, 1, 32, 896, 896, 896, 192]
    - [0, 9.16094]
  - - [960, 192, 1, 32, 960, 960, 960, 192]
    - [3, 10.4009]
  - - [1024, 192, 1, 32, 1024, 1024, 1024, 192]
    - [3, 15.2968]
  - - [64, 256, 1, 32, 64, 64, 64, 256]
    - [3, 5.67715]
  - - [128, 256, 1, 32, 128, 128, 128, 256]
    - [3, 4.59596]
  - - [192, 256, 1, 32, 192, 192, 192, 256]
    - [1, 3.74462]
  - - [256, 256, 1, 32, 256, 256, 256, 256]
    - [2, 4.98435]
  - - [320, 256, 1, 32, 320, 320, 320, 256]
    - [2, 6.3144]
  - - [384, 256, 1, 32, 384, 384, 384, 256]
    - [3, 8.77758]
  - - [448, 256, 1, 32, 448, 448, 448, 256]
    - [3, 7.18079]
  - - [512, 256, 1, 32, 512, 512, 512, 256]
    - [2, 6.96875]
  - - [576, 256, 1, 32, 576, 576, 576, 256]
    - [2, 13.2008]
  - - [640, 256, 1, 32, 640, 640, 640, 256]
    - [3, 10.4869]
  - - [704, 256, 1, 32, 704, 704, 704, 256]
    - [3, 10.5485]
  - - [768, 256, 1, 32, 768, 768, 768, 256]
    - [2, 14.4163]
  - - [832, 256, 1, 32, 832, 832, 832, 256]
    - [1, 16.1065]
  - - [896, 256, 1, 32, 896, 896, 896, 256]
    - [0, 13.2185]
  - - [960, 256, 1, 32, 960, 960, 960, 256]
    - [1, 18.1984]
  - - [1024, 256, 1, 32, 1024, 1024, 1024, 256]
    - [3, 22.0294]
  - - [64, 320, 1, 32, 64, 64, 64, 320]
    - [3, 2.23047]
  - - [128, 320, 1, 32, 128, 128, 128, 320]
    - [3, 4.29475]
  - - [192, 320, 1, 32, 192, 192, 192, 320]
    - [3, 6.65888]
  - - [256, 320, 1, 32, 256, 256, 256, 320]
    - [3, 8.85077]
  - - [320, 320, 1, 32, 320, 320, 320, 320]
    - [2, 10.5926]
  - - [384, 320, 1, 32, 384, 384, 384, 320]
    - [0, 6.58748]
  - - [448, 320, 1, 32, 448, 448, 448, 320]
    - [1, 10.7245]
  - - [512, 320, 1, 32, 512, 512, 512, 320]
    - [0, 11.4408]
  - - [576, 320, 1, 32, 576, 576, 576, 320]
    - [2, 13.7606]
  - - [640, 320, 1, 32, 640, 640, 640, 320]
    - [3, 11.1315]
  - - [704, 320, 1, 32, 704, 704, 704, 320]
    - [3, 17.7145]
  - - [768, 320, 1, 32, 768, 768, 768, 320]
    - [0, 11.863]
  - - [832, 320, 1, 32, 832, 832, 832, 320]
    - [1, 10.9982]
  - - [896, 320, 1, 32, 896, 896, 896, 320]
    - [2, 19.9741]
  - - [960, 320, 1, 32, 960, 960, 960, 320]
    - [3, 13.1666]
  - - [1024, 320, 1, 32, 1024, 1024, 1024, 320]
    - [1, 18.1637]
  - - [64, 384, 1, 32, 64, 64, 64, 384]
    - [3, 1.30965]
  - - [128, 384, 1, 32, 128, 128, 128, 384]
    - [3, 5.5882]
  - - [192, 384, 1, 32, 192, 192, 192, 384]
    - [2, 5.97756]
  - - [256, 384, 1, 32, 256, 256, 256, 384]
    - [2, 8.83428]
  - - [320, 384, 1, 32, 320, 320, 320, 384]
    - [2, 10.5659]
  - - [384, 384, 1, 32, 384, 384, 384, 384]
    - [1, 11.5088]
  - - [448, 384, 1, 32, 448, 448, 448, 384]
    - [3, 12.2248]
  - - [512, 384, 1, 32, 512, 512, 512, 384]
    - [3, 16.0175]
  - - [576, 384, 1, 32, 576, 576, 576, 384]
    - [2, 24.8259]
  - - [640, 384, 1, 32, 640, 640, 640, 384]
    - [3, 24.7612]
  - - [704, 384, 1, 32, 704, 704, 704, 384]
    - [1, 21.5248]
  - - [768, 384, 1, 32, 768, 768, 768, 384]
    - [3, 25.7335]
  - - [832, 384, 1, 32, 832, 832, 832, 384]
    - [0, 27.6653]
  - - [896, 384, 1, 32, 896, 896, 896, 384]
    - [3, 18.8693]
  - - [960, 384, 1, 32, 960, 960, 960, 384]
    - [3, 19.0009]
  - - [1024, 384, 1, 32, 1024, 1024, 1024, 384]
    - [1, 21.9905]
  - - [64, 448, 1, 32, 64, 64, 64, 448]
    - [3, 2.16075]
  - - [128, 448, 1, 32, 128, 128, 128, 448]
    - [2, 3.97655]
  - - [192, 448, 1, 32, 192, 192, 192, 448]
    - [3, 7.74762]
  - - [256, 448, 1, 32, 256, 256, 256, 448]
    - [3, 10.6212]
  - - [320, 448, 1, 32, 320, 320, 320, 448]
    - [2, 10.1779]
  - - [384, 448, 1, 32, 384, 384, 384, 448]
    - [3, 18.3298]
  - - [448, 448, 1, 32, 448, 448, 448, 448]
    - [1, 11.5017]
  - - [512, 448, 1, 32, 512, 512, 512, 448]
    - [2, 12.2589]
  - - [576, 448, 1, 32, 576, 576, 576, 448]
    - [3, 23.1014]
  - - [640, 448, 1, 32, 640, 640, 640, 448]
    - [1, 21.3479]
  - - [704, 448, 1, 32, 704, 704, 704, 448]
    - [1, 18.2311]
  - - [768, 448, 1, 32, 768, 768, 768, 448]
    - [1, 19.0349]
  - - [832, 448, 1, 32, 832, 832, 832, 448]
    - [3, 25.8154]
  - - [896, 448, 1, 32, 896, 896, 896, 448]
    - [2, 28.0679]
  - - [960, 448, 1, 32, 960, 960, 960, 448]
    - [3, 33.0214]
  - - [1024, 448, 1, 32, 1024, 1024, 1024, 448]
    - [1, 32.5098]
  - - [64, 512, 1, 32, 64, 64, 64, 512]
    - [3, 2.53651]
  - - [128, 512, 1, 32, 128, 128, 128, 512]
    - [2, 5.97484]
  - - [192, 512, 1, 32, 192, 192, 192, 512]
    - [1, 11.1455]
  - - [256, 512, 1, 32, 256, 256, 256, 512]
    - [3, 17.2459]
  - - [320, 512, 1, 32, 320, 320, 320, 512]
    - [2, 20.8716]
  - - [384, 512, 1, 32, 384, 384, 384, 512]
    - [2, 28.7726]
  - - [448, 512, 1, 32, 448, 448, 448, 512]
    - [0, 27.4115]
  - - [512, 512, 1, 32, 512, 512, 512, 512]
    - [1, 28.3053]
  - - [576, 512, 1, 32, 576, 576, 576, 512]
    - [2, 32.2587]
  - - [640, 512, 1, 32, 640, 640, 640, 512]
    - [1, 43.8824]
  - - [704, 512, 1, 32, 704, 704, 704, 512]
    - [1, 48.8513]
  - - [768, 512, 1, 32, 768, 768, 768, 512]
    - [2, 52.1969]
  - - [832, 512, 1, 32, 832, 832, 832, 512]
    - [1, 57.4498]
  - - [896, 512, 1, 32, 896, 896, 896, 512]
    - [0, 39.394]
  - - [960, 512, 1, 32, 960, 960, 960, 512]
    - [1, 57.9385]
  - - [1024, 512, 1, 32, 1024, 1024, 1024, 512]
    - [1, 119.725]
  - - [64, 576, 1, 32, 64, 64, 64, 576]
    - [3, 3.15075]
  - - [128, 576, 1, 32, 128, 128, 128, 576]
    - [2, 7.43843]
  - - [192, 576, 1, 32, 192, 192, 192, 576]
    - [1, 10.2008]
  - - [256, 576, 1, 32, 256, 256, 256, 576]
    - [2, 20.3093]
  - - [320, 576, 1, 32, 320, 320, 320, 576]
    - [1, 22.5592]
  - - [384, 576, 1, 32, 384, 384, 384, 576]
    - [3, 12.2211]
  - - [448, 576, 1, 32, 448, 448, 448, 576]
    - [3, 18.4603]
  - - [512, 576, 1, 32, 512, 512, 512, 576]
    - [3, 23.4524]
  - - [576, 576, 1, 32, 576, 576, 576, 576]
    - [2, 21.3585]
  - - [640, 576, 1, 32, 640, 640, 640, 576]
    - [1, 39.4173]
  - - [704, 576, 1, 32, 704, 704, 704, 576]
    - [0, 33.3982]
  - - [768, 576, 1, 32, 768, 768, 768, 576]
    - [0, 44.4959]
  - - [832, 576, 1, 32, 832, 832, 832, 576]
    - [2, 53.3933]
  - - [896, 576, 1, 32, 896, 896, 896, 576]
    - [1, 93.9525]
  - - [960, 576, 1, 32, 960, 960, 960, 576]
    - [1, 129.531]
  - - [1024, 576, 1, 32, 1024, 1024, 1024, 576]
    - [3, 47.5626]
  - - [64, 640, 1, 32, 64, 64, 64, 640]
    - [0, 2.74205]
  - - [128, 640, 1, 32, 128, 128, 128, 640]
    - [3, 7.3648]
  - - [192, 640, 1, 32, 192, 192, 192, 640]
    - [0, 12.6056]
  - - [256, 640, 1, 32, 256, 256, 256, 640]
    - [1, 34.3298]
  - - [320, 640, 1, 32, 320, 320, 320, 640]
    - [2, 22.423]
  - - [384, 640, 1, 32, 384, 384, 384, 640]
    - [2, 21.0759]
  - - [448, 640, 1, 32, 448, 448, 448, 640]
    - [3, 32.4951]
  - - [512, 640, 1, 32, 512, 512, 512, 640]
    - [2, 33.9129]
  - - [576, 640, 1, 32, 576, 576, 576, 640]
    - [3, 30.1679]
  - - [640, 640, 1, 32, 640, 640, 640, 640]
    - [2, 24.404]
  - - [704, 640, 1, 32, 704, 704, 704, 640]
    - [3, 36.445]
  - - [768, 640, 1, 32, 768, 768, 768, 640]
    - [2, 857.614]
  - - [832, 640, 1, 32, 832, 832, 832, 640]
    - [0, 90.37]
  - - [896, 640, 1, 32, 896, 896, 896, 640]
    - [2, 45.7326]
  - - [960, 640, 1, 32, 960, 960, 960, 640]
    - [3, 48.269]
  - - [1024, 640, 1, 32, 1024, 1024, 1024, 640]
    - [3, 50.5274]
  - - [64, 704, 1, 32, 64, 64, 64, 704]
    - [3, 3.83122]
  - - [128, 704, 1, 32, 128, 128, 128, 704]
    - [1, 10.3113]
  - - [192, 704, 1, 32, 192, 192, 192, 704]
    - [3, 16.5513]
  - - [256, 704, 1, 32, 256, 256, 256, 704]
    - [1, 20.7638]
  - - [320, 704, 1, 32, 320, 320, 320, 704]
    - [0, 19.15]
  - - [384, 704, 1, 32, 384, 384, 384, 704]
    - [3, 21.2671]
  - - [448, 704, 1, 32, 448, 448, 448, 704]
    - [2, 24.7745]
  - - [512, 704, 1, 32, 512, 512, 512, 704]
    - [3, 25.0541]
  - - [576, 704, 1, 32, 576, 576, 576, 704]
    - [0, 37.4711]
  - - [640, 704, 1, 32, 640, 640, 640, 704]
    - [2, 974.184]
  - - [704, 704, 1, 32, 704, 704, 704, 704]
    - [1, 59.9426]
  - - [768, 704, 1, 32, 768, 768, 768, 704]
    - [2, 44.4281]
  - - [832, 704, 1, 32, 832, 832, 832, 704]
    - [2, 59.7935]
  - - [896, 704, 1, 32, 896, 896, 896, 704]
    - [0, 50.2601]
  - - [960, 704, 1, 32, 960, 960, 960, 704]
    - [3, 66.9642]
  - - [1024, 704, 1, 32, 1024, 1024, 1024, 704]
    - [3, 72.6602]
  - - [64, 768, 1, 32, 64, 64, 64, 768]
    - [1, 3.46516]
  - - [128, 768, 1, 32, 128, 128, 128, 768]
    - [2, 10.7985]
  - - [192, 768, 1, 32, 192, 192, 192, 768]
    - [3, 19.3289]
  - - [256, 768, 1, 32, 256, 256, 256, 768]
    - [1, 15.2608]
  - - [320, 768, 1, 32, 320, 320, 320, 768]
    - [3, 18.573]
  - - [384, 768, 1, 32, 384, 384, 384, 768]
    - [2, 17.7268]
  - - [448, 768, 1, 32, 448, 448, 448, 768]
    - [3, 22.4921]
  - - [512, 768, 1, 32, 512, 512, 512, 768]
    - [3, 27.6406]
  - - [576, 768, 1, 32, 576, 576, 576, 768]
    - [2, 47.737]
  - - [640, 768, 1, 32, 640, 640, 640, 768]
    - [0, 33.0696]
  - - [704, 768, 1, 32, 704, 704, 704, 768]
    - [2, 36.8723]
  - - [768, 768, 1, 32, 768, 768, 768, 768]
    - [2, 36.5394]
  - - [832, 768, 1, 32, 832, 832, 832, 768]
    - [3, 45.0387]
  - - [896, 768, 1, 32, 896, 896, 896, 768]
    - [2, 49.3224]
  - - [960, 768, 1, 32, 960, 960, 960, 768]
    - [3, 56.6148]
  - - [1024, 768, 1, 32, 1024, 1024, 1024, 768]
    - [0, 79.4898]
  - - [64, 832, 1, 32, 64, 64, 64, 832]
    - [1, 6.30395]
  - - [128, 832, 1, 32, 128, 128, 128, 832]
    - [1, 11.5937]
  - - [192, 832, 1, 32, 192, 192, 192, 832]
    - [1, 14.7803]
  - - [256, 832, 1, 32, 256, 256, 256, 832]
    - [3, 34.9273]
  - - [320, 832, 1, 32, 320, 320, 320, 832]
    - [0, 26.5]
  - - [384, 832, 1, 32, 384, 384, 384, 832]
    - [2, 20.9135]
  - - [448, 832, 1, 32, 448, 448, 448, 832]
    - [0, 30.2593]
  - - [512, 832, 1, 32, 512, 512, 512, 832]
    - [2, 30.9285]
  - - [576, 832, 1, 32, 576, 576, 576, 832]
    - [0, 31.791]
  - - [640, 832, 1, 32, 640, 640, 640, 832]
    - [0, 33.7485]
  - - [704, 832, 1, 32, 704, 704, 704, 832]
    - [3, 39.7392]
  - - [768, 832, 1, 32, 768, 768, 768, 832]
    - [0, 48.5023]
  - - [832, 832, 1, 32, 832, 832, 832, 832]
    - [1, 70.9879]
  - - [896, 832, 1, 32, 896, 896, 896, 832]
    - [0, 54.5887]
  - - [960, 832, 1, 32, 960, 960, 960, 832]
    - [2, 53.6647]
  - - [1024, 832, 1, 32, 1024, 1024, 1024, 832]
    - [1, 158.096]
  - - [64, 896, 1, 32, 64, 64, 64, 896]
    - [1, 7.84589]
  - - [128, 896, 1, 32, 128, 128, 128, 896]
    - [1, 14.9138]
  - - [192, 896, 1, 32, 192, 192, 192, 896]
    - [3, 24.9371]
  - - [256, 896, 1, 32, 256, 256, 256, 896]
    - [2, 32.9073]
  - - [320, 896, 1, 32, 320, 320, 320, 896]
    - [1, 34.9051]
  - - [384, 896, 1, 32, 384, 384, 384, 896]
    - [2, 49.82]
  - - [448, 896, 1, 32, 448, 448, 448, 896]
    - [1, 30.9327]
  - - [512, 896, 1, 32, 512, 512, 512, 896]
    - [1, 31.6963]
  - - [576, 896, 1, 32, 576, 576, 576, 896]
    - [3, 53.8447]
  - - [640, 896, 1, 32, 640, 640, 640, 896]
    - [1, 79.6216]
  - - [704, 896, 1, 32, 704, 704, 704, 896]
    - [3, 48.6825]
  - - [768, 896, 1, 32, 768, 768, 768, 896]
    - [2, 58.3984]
  - - [832, 896, 1, 32, 832, 832, 832, 896]
    - [1, 82.8542]
  - - [896, 896, 1, 32, 896, 896, 896, 896]
    - [2, 59.4331]
  - - [960, 896, 1, 32, 960, 960, 960, 896]
    - [3, 67.7755]
  - - [1024, 896, 1, 32, 1024, 1024, 1024, 896]
    - [1, 61.8267]
  - - [64, 960, 1, 32, 64, 64, 64, 960]
    - [2, 4.29198]
  - - [128, 960, 1, 32, 128, 128, 128, 960]
    - [3, 8.38552]
  - - [192, 960, 1, 32, 192, 192, 192, 960]
    - [1, 10.9327]
  - - [256, 960, 1, 32, 256, 256, 256, 960]
    - [1, 16.023]
  - - [320, 960, 1, 32, 320, 320, 320, 960]
    - [2, 20.9602]
  - - [384, 960, 1, 32, 384, 384, 384, 960]
    - [2, 24.257]
  - - [448, 960, 1, 32, 448, 448, 448, 960]
    - [1, 30.418]
  - - [512, 960, 1, 32, 512, 512, 512, 960]
    - [1, 33.5854]
  - - [576, 960, 1, 32, 576, 576, 576, 960]
    - [1, 38.1963]
  - - [640, 960, 1, 32, 640, 640, 640, 960]
    - [0, 42.3425]
  - - [704, 960, 1, 32, 704, 704, 704, 960]
    - [1, 48.8735]
  - - [768, 960, 1, 32, 768, 768, 768, 960]
    - [1, 51.9094]
  - - [832, 960, 1, 32, 832, 832, 832, 960]
    - [1, 57.0983]
  - - [896, 960, 1, 32, 896, 896, 896, 960]
    - [2, 68.1758]
  - - [960, 960, 1, 32, 960, 960, 960, 960]
    - [2, 84.0548]
  - - [1024, 960, 1, 32, 1024, 1024, 1024, 960]
    - [2, 66.176]
  - - [64, 1024, 1, 32, 64, 64, 64, 1024]
    - [0, 4.04845]
  - - [128, 1024, 1, 32, 128, 128, 128, 1024]
    - [1, 8.92922]
  - - [192, 1024, 1, 32, 192, 192, 192, 1024]
    - [3, 12.3117]
  - - [256, 1024, 1, 32, 256, 256, 256, 1024]
    - [0, 16.8809]
  - - [320, 1024, 1, 32, 320, 320, 320, 1024]
    - [1, 27.9361]
  - - [384, 1024, 1, 32, 384, 384, 384, 1024]
    - [3, 32.0007]
  - - [448, 1024, 1, 32, 448, 448, 448, 1024]
    - [1, 46.8298]
  - - [512, 1024, 1, 32, 512, 512, 512, 1024]
    - [2, 47.2209]
  - - [576, 1024, 1, 32, 576, 576, 576, 1024]
    - [0, 58.4161]
  - - [640, 1024, 1, 32, 640, 640, 640, 1024]
    - [3, 52.8094]
  - - [704, 1024, 1, 32, 704, 704, 704, 1024]
    - [0, 53.0934]
  - - [768, 1024, 1, 32, 768, 768, 768, 1024]
    - [1, 63.1058]
  - - [832, 1024, 1, 32, 832, 832, 832, 1024]
    - [1, 59.9539]
  - - [896, 1024, 1, 32, 896, 896, 896, 1024]
    - [1, 63.0481]
  - - [960, 1024, 1, 32, 960, 960, 960, 1024]
    - [3, 96.982]
  - - [1024, 1024, 1, 32, 1024, 1024, 1024, 1024]
    - [1, 90.5135]
- null
- null
- DeviceEfficiency
- GridBased
