tensilelite/try/yamlGen/tunning_BFVF_Round1/tunning_BFVF_Round1_1/3_LibraryLogic/aldebaran_Cijk_Ailk_Bljk_HHS_BH.yaml
- {MinimumRequiredVersion: 4.33.0}
- aldebaran
- gfx90a
- [Device 0050, Device 0051, Device 0052, Device 0054, Device 0062, Device 7400, Device
    SolutionIndex: 0
    SolutionNameMin: Cijk_Ailk_Bljk_HHS_BH_MT16x16x64_MI16x16x16x1_SN_GRVW8_LPB8_LRVW4_MIWT1_1_PLR1_SS0_SRVW0_SVW4_WG16_4_1
    SolutionIndex: 1
    SolutionNameMin: Cijk_Ailk_Bljk_HHS_BH_MT16x16x64_MI16x16x16x1_SN_GRVW2_LPB16_LRVW8_MIWT1_1_PLR5_SS0_SRVW0_SVW4_WG16_4_1
    SolutionIndex: 2
    SolutionNameMin: Cijk_Ailk_Bljk_HHS_BH_MT16x32x64_MI16x16x16x1_SN_GRVW8_LPB16_LRVW8_MIWT1_1_PLR5_SS0_SRVW0_SVW4_WG16_8_1
    SolutionIndex: 3
    SolutionNameMin: Cijk_Ailk_Bljk_HHS_BH_MT16x32x64_MI16x16x16x1_SN_GRVW2_LPB16_LRVW8_MIWT1_1_PLR5_SS0_SRVW0_SVW4_WG16_8_1
    SolutionIndex: 4
    SolutionNameMin: Cijk_Ailk_Bljk_HHS_BH_MT16x32x64_MI16x16x16x1_SN_GRVW8_LPB16_LRVW8_MIWT1_1_PLR5_SS0_SRVW4_SVW4_WG16_8_1
    SolutionIndex: 5
    SolutionNameMin: Cijk_Ailk_Bljk_HHS_BH_MT16x16x32_MI16x16x16x1_SN_GRVW4_LPB4_LRVW4_MIWT1_1_PLR3_SS1_SRVW0_SVW1_WG16_4_1
    SolutionIndex: 6
    SolutionNameMin: Cijk_Ailk_Bljk_HHS_BH_MT16x16x64_MI16x16x16x1_SN_GRVW2_LPB16_LRVW8_MIWT1_1_PLR5_SS1_SRVW0_SVW1_WG16_4_1
    SolutionIndex: 7
    SolutionNameMin: Cijk_Ailk_Bljk_HHS_BH_MT16x32x64_MI16x16x16x1_SN_GRVW8_LPB8_LRVW4_MIWT1_1_PLR1_SS1_SRVW0_SVW1_WG16_8_1
    SolutionIndex: 8
    SolutionNameMin: Cijk_Ailk_Bljk_HHS_BH_MT16x32x64_MI16x16x16x1_SN_GRVW8_LPB16_LRVW8_MIWT1_1_PLR5_SS1_SRVW0_SVW1_WG16_8_1
- - - [1104, 1335, 1, 4608, 1104, 1104, 1104, 4608]
    - [3, 28569.1]
  - - [1104, 1408, 1, 4608, 1104, 1104, 1104, 4608]
    - [2, 29269.4]
  - - [4608, 1, 1, 320, 4608, 4608, 4608, 320]
    - [0, 429.65]
  - - [4608, 16, 1, 320, 4608, 4608, 4608, 320]
    - [5, 6642.16]
  - - [4608, 1335, 1, 320, 4608, 4608, 4608, 320]
    - [8, 26030.5]
  - - [4608, 1408, 1, 320, 4608, 4608, 4608, 320]
    - [8, 26174.7]
  - - [768, 1335, 1, 4608, 768, 768, 768, 4608]
    - [2, 26926.8]
  - - [768, 1408, 1, 4608, 768, 768, 768, 4608]
    - [8, 27818.3]
  - - [4608, 1, 1, 768, 4608, 4608, 4608, 768]
    - [1, 587.474]
  - - [4608, 16, 1, 768, 4608, 4608, 4608, 768]
    - [6, 8376.14]
  - - [4608, 1335, 1, 768, 4608, 4608, 4608, 768]
    - [8, 27864.5]
  - - [4608, 1408, 1, 768, 4608, 4608, 4608, 768]
    - [7, 28037.5]
  - - [320, 8192, 1, 320, 320, 320, 320, 320]
    - [8, 25031.6]
  - - [640, 2048, 1, 640, 640, 640, 640, 640]
    - [2, 25929.1]
  - - [320, 8192, 1, 1280, 320, 320, 320, 1280]
    - [2, 28393.5]
  - - [1280, 512, 1, 1280, 1280, 1280, 1280, 1280]
    - [8, 26385.8]
  - - [10240, 512, 1, 1280, 10240, 10240, 10240, 1280]
    - [4, 28291.1]
  - - [2560, 8192, 1, 320, 2560, 2560, 2560, 320]
    - [2, 26873.6]
  - - [5120, 2048, 1, 640, 5120, 5120, 5120, 640]
    - [8, 28032.0]
  - - [1280, 512, 1, 5120, 1280, 1280, 1280, 5120]
    - [2, 27077.4]
  - - [640, 2048, 1, 2560, 640, 640, 640, 2560]
    - [8, 28061.1]
  - - [320, 154, 1, 768, 320, 320, 320, 768]
    - [2, 9499.76]
  - - [1280, 154, 1, 768, 1280, 1280, 1280, 768]
    - [2, 19877.5]
- null
- null
- DeviceEfficiency
