library/src/amd_detail/rocblaslt/src/Tensile/Logic/asm_full/aldebaran/104CU/GridBased/aldebaran_Cijk_Ailk_Bljk_I8II_BH_UserArgs.yaml
- {MinimumRequiredVersion: 4.33.0}
- aldebaran
- gfx90a
- [Device 73f0]
    SolutionIndex: 0
    SolutionNameMin: Cijk_Ailk_Bljk_I8II_BH_MT64x64x64_MI32x32x8x1_SN_1LDSB0_EPS0_GRVWA4_LPB4_MIWT1_1_SVW1_TLDS1_VWA1_WG64_4_1
    SolutionIndex: 1
    SolutionNameMin: Cijk_Ailk_Bljk_I8II_BH_MT64x64x64_MI32x32x8x1_SN_1LDSB0_EPS1_GRVWA4_LPB4_MIWT1_1_SVW1_TLDS1_VWA1_WG64_4_1
    SolutionIndex: 2
    SolutionNameMin: Cijk_Ailk_Bljk_I8II_BH_MT128x128x64_MI32x32x8x1_SN_1LDSB1_EPS0_GRVWA8_LPB4_MIWT2_2_SVW2_TLDS1_VWA2_WG64_4_1
    SolutionIndex: 3
    SolutionNameMin: Cijk_Ailk_Bljk_I8II_BH_MT128x128x64_MI32x32x8x1_SN_1LDSB1_EPS1_GRVWA4_LPB4_MIWT2_2_SVW2_TLDS1_VWA2_WG64_4_1
    SolutionIndex: 4
    SolutionNameMin: Cijk_Ailk_Bljk_I8II_BH_UserArgs_MT16x64x32_MI16x16x1_SN_GRVWB4_GSU1_MIWT1_1_SU0_SUM0_SUS0_WGM8
- - - [512, 512, 1, 512]
    - [0, 30093.3]
  - - [1024, 1024, 1, 1024]
    - [1, 68460.4]
  - - [2048, 2048, 1, 2048]
    - [2, 114349.0]
  - - [4096, 4096, 1, 4096]
    - [3, 144760.0]
  - - [1, 1, 1, 512]
    - [4, 0.105908]
  - - [1, 1024, 1, 512]
    - [4, 117.892]
  - - [1, 6144, 1, 2048]
    - [4, 756.002]
  - - [1, 512, 1, 512]
    - [4, 59.3193]
  - - [4, 6144, 1, 2048]
    - [4, 2973.7]
  - - [4, 1024, 1, 512]
    - [4, 456.299]
  - - [1, 4800, 1, 1600]
    - [4, 589.427]
- null
- null
- DeviceEfficiency
- GridBased
