library/src/amd_detail/rocblaslt/src/Tensile/Logic/asm_full/aldebaran/104CU/GridBased/aldebaran_Cijk_Ailk_Bjlk_I8II_BH_UserArgs.yaml
- {MinimumRequiredVersion: 4.33.0}
- aldebaran
- gfx90a
- [Device 73f0]
    SolutionIndex: 0
    SolutionNameMin: Cijk_Ailk_Bjlk_I8II_BH_MT128x128x64_MI32x32x8x1_SN_1LDSB0_EPS1_GRVWA4_MIWT2_2_SVW2_VWA2_WG64_4_1
    SolutionIndex: 1
    SolutionNameMin: Cijk_Ailk_Bjlk_I8II_BH_MT64x64x64_MI32x32x8x1_SN_1LDSB0_EPS0_GRVWA4_MIWT1_1_SVW1_VWA1_WG64_4_1
    SolutionIndex: 2
    SolutionNameMin: Cijk_Ailk_Bjlk_I8II_BH_MT64x64x64_MI32x32x8x1_SN_1LDSB0_EPS1_GRVWA4_MIWT1_1_SVW1_VWA1_WG64_4_1
    SolutionIndex: 3
    SolutionNameMin: Cijk_Ailk_Bjlk_I8II_BH_UserArgs_MT16x64x32_MI16x16x1_SN_GRVWB1_GSU1_MIWT1_1_SU0_SUM0_SUS0_WGM18
    SolutionIndex: 4
    SolutionNameMin: Cijk_Ailk_Bjlk_I8II_BH_UserArgs_MT16x64x32_MI16x16x1_SN_GRVWB4_GSU1_MIWT1_1_SU0_SUM0_SUS0_WGM18
- - - [512, 512, 1, 512]
    - [1, 26420.6]
  - - [1024, 1024, 1, 1024]
    - [2, 69076.9]
  - - [2048, 2048, 1, 2048]
    - [0, 115610.0]
  - - [4096, 4096, 1, 4096]
    - [0, 147358.0]
  - - [1, 1, 1, 512]
    - [3, 0.0966037]
  - - [1, 1024, 1, 512]
    - [4, 138.261]
  - - [1, 6144, 1, 2048]
    - [4, 827.779]
  - - [1, 512, 1, 512]
    - [4, 69.2183]
  - - [4, 6144, 1, 2048]
    - [4, 3295.33]
  - - [4, 1024, 1, 512]
    - [4, 532.056]
  - - [1, 4800, 1, 1600]
    - [4, 705.674]
- null
- null
- DeviceEfficiency
- GridBased
