tensilelite/try32/yamlGen/tunning_BFVF_Round1/tunning_BFVF_Round1_20/3_LibraryLogic/aldebaran_Cijk_Ailk_Bljk_HHS_BH.yaml
- {MinimumRequiredVersion: 4.33.0}
- aldebaran
- gfx90a
- [Device 0050, Device 0051, Device 0052, Device 0054, Device 0062, Device 7400, Device
    SolutionIndex: 0
    SolutionNameMin: Cijk_Ailk_Bljk_HHS_BH_MT256x64x32_MI32x32x8x1_SN_1LDSB0_GRVW8_LPB8_LRVW8_MIWT2_2_PLR5_SS0_SRVW0_SVW4_VW1_WG128_2_1
    SolutionIndex: 1
    SolutionNameMin: Cijk_Ailk_Bljk_HHS_BH_MT256x64x32_MI32x32x8x1_SN_1LDSB0_GRVW8_LPB8_LRVW4_MIWT2_2_PLR1_SS0_SRVW4_SVW4_VW1_WG128_2_1
    SolutionIndex: 2
    SolutionNameMin: Cijk_Ailk_Bljk_HHS_BH_MT256x64x32_MI32x32x8x1_SN_1LDSB0_GRVW8_LPB8_LRVW8_MIWT2_2_PLR5_SS0_SRVW4_SVW4_VW1_WG128_2_1
    SolutionIndex: 3
    SolutionNameMin: Cijk_Ailk_Bljk_HHS_BH_MT256x64x32_MI32x32x8x1_SN_1LDSB1_GRVW8_LPB8_LRVW4_MIWT2_2_PLR1_SS0_SRVW4_SVW4_VW1_WG128_2_1
    SolutionIndex: 4
    SolutionNameMin: Cijk_Ailk_Bljk_HHS_BH_MT256x64x32_MI32x32x8x1_SN_1LDSB1_GRVW8_LPB8_LRVW4_MIWT2_2_PLR5_SS0_SRVW4_SVW4_VW1_WG128_2_1
    SolutionIndex: 5
    SolutionNameMin: Cijk_Ailk_Bljk_HHS_BH_MT256x64x32_MI32x32x8x1_SN_1LDSB0_GRVW8_LPB8_LRVW4_MIWT2_2_PLR1_SS1_SRVW0_SVW2_VW2_WG128_2_1
    SolutionIndex: 6
    SolutionNameMin: Cijk_Ailk_Bljk_HHS_BH_MT256x64x32_MI32x32x8x1_SN_1LDSB0_GRVW8_LPB8_LRVW4_MIWT2_2_PLR5_SS1_SRVW0_SVW2_VW2_WG128_2_1
    SolutionIndex: 7
    SolutionNameMin: Cijk_Ailk_Bljk_HHS_BH_MT256x64x32_MI32x32x8x1_SN_1LDSB0_GRVW8_LPB8_LRVW8_MIWT2_2_PLR5_SS1_SRVW0_SVW2_VW2_WG128_2_1
    SolutionIndex: 8
    SolutionNameMin: Cijk_Ailk_Bljk_HHS_BH_MT256x64x32_MI32x32x8x1_SN_1LDSB1_GRVW8_LPB8_LRVW4_MIWT2_2_PLR1_SS1_SRVW0_SVW2_VW2_WG128_2_1
    SolutionIndex: 9
    SolutionNameMin: Cijk_Ailk_Bljk_HHS_BH_MT256x64x32_MI32x32x8x1_SN_1LDSB1_GRVW8_LPB8_LRVW4_MIWT2_2_PLR5_SS1_SRVW0_SVW2_VW2_WG128_2_1
- - - [1104, 1335, 1, 4608, 1104, 1104, 1104, 4608]
    - [1, 112173.0]
  - - [1104, 1408, 1, 4608, 1104, 1104, 1104, 4608]
    - [6, 115335.0]
  - - [4608, 1, 1, 320, 4608, 4608, 4608, 320]
    - [0, 254.938]
  - - [4608, 16, 1, 320, 4608, 4608, 4608, 320]
    - [0, 3926.89]
  - - [4608, 1335, 1, 320, 4608, 4608, 4608, 320]
    - [8, 94495.4]
  - - [4608, 1408, 1, 320, 4608, 4608, 4608, 320]
    - [8, 103354.0]
  - - [768, 1335, 1, 4608, 768, 768, 768, 4608]
    - [1, 84329.4]
  - - [768, 1408, 1, 4608, 768, 768, 768, 4608]
    - [7, 88902.6]
  - - [4608, 1, 1, 768, 4608, 4608, 4608, 768]
    - [0, 336.912]
  - - [4608, 16, 1, 768, 4608, 4608, 4608, 768]
    - [2, 5254.53]
  - - [4608, 1335, 1, 768, 4608, 4608, 4608, 768]
    - [4, 119064.0]
  - - [4608, 1408, 1, 768, 4608, 4608, 4608, 768]
    - [9, 125600.0]
  - - [320, 8192, 1, 320, 320, 320, 320, 320]
    - [3, 53608.0]
  - - [640, 2048, 1, 640, 640, 640, 640, 640]
    - [2, 79137.4]
  - - [320, 8192, 1, 1280, 320, 320, 320, 1280]
    - [4, 69672.5]
  - - [1280, 512, 1, 1280, 1280, 1280, 1280, 1280]
    - [7, 55333.6]
  - - [10240, 512, 1, 1280, 10240, 10240, 10240, 1280]
    - [9, 139438.0]
  - - [2560, 8192, 1, 320, 2560, 2560, 2560, 320]
    - [4, 126296.0]
  - - [5120, 2048, 1, 640, 5120, 5120, 5120, 640]
    - [9, 134411.0]
  - - [1280, 512, 1, 5120, 1280, 1280, 1280, 5120]
    - [5, 56794.7]
  - - [640, 2048, 1, 2560, 640, 640, 640, 2560]
    - [5, 100270.0]
  - - [320, 154, 1, 768, 320, 320, 320, 768]
    - [0, 3333.94]
  - - [1280, 154, 1, 768, 1280, 1280, 1280, 768]
    - [2, 13934.8]
- null
- null
- DeviceEfficiency
