tensilelite/try32/yamlGen/tunning_BFVF_Round1/tunning_BFVF_Round1_23/3_LibraryLogic/aldebaran_Cijk_Ailk_Bljk_HHS_BH.yaml
- {MinimumRequiredVersion: 4.33.0}
- aldebaran
- gfx90a
- [Device 0050, Device 0051, Device 0052, Device 0054, Device 0062, Device 7400, Device
    SolutionIndex: 0
    SolutionNameMin: Cijk_Ailk_Bljk_HHS_BH_MT384x64x16_MI32x32x8x1_SN_1LDSB1_GRVW8_LPB8_LRVW4_MIWT3_2_NLCA3_PLR1_SS0_SRVW0_SVW4_VW1
    SolutionIndex: 1
    SolutionNameMin: Cijk_Ailk_Bljk_HHS_BH_MT384x64x32_MI32x32x8x1_SN_1LDSB0_GRVW8_LPB8_LRVW4_MIWT3_2_NLCA3_PLR1_SS0_SRVW0_SVW4_VW1
    SolutionIndex: 2
    SolutionNameMin: Cijk_Ailk_Bljk_HHS_BH_MT384x64x32_MI32x32x8x1_SN_1LDSB0_GRVW8_LPB8_LRVW8_MIWT3_2_NLCA3_PLR5_SS0_SRVW0_SVW4_VW1
    SolutionIndex: 3
    SolutionNameMin: Cijk_Ailk_Bljk_HHS_BH_MT512x32x32_MI32x32x8x1_SN_1LDSB1_GRVW8_LPB8_LRVW8_MIWT4_1_NLCA1_PLR5_SS0_SRVW0_SVW4_VW1
    SolutionIndex: 4
    SolutionNameMin: Cijk_Ailk_Bljk_HHS_BH_MT512x32x32_MI32x32x8x1_SN_1LDSB1_GRVW8_LPB8_LRVW4_MIWT4_1_NLCA1_PLR5_SS0_SRVW8_SVW4_VW1
    SolutionIndex: 5
    SolutionNameMin: Cijk_Ailk_Bljk_HHS_BH_MT512x32x32_MI32x32x8x1_SN_1LDSB1_GRVW8_LPB8_LRVW8_MIWT4_1_NLCA1_PLR5_SS0_SRVW8_SVW4_VW1
    SolutionIndex: 6
    SolutionNameMin: Cijk_Ailk_Bljk_HHS_BH_MT384x64x16_MI32x32x8x1_SN_1LDSB0_GRVW8_LPB8_LRVW4_MIWT3_2_NLCA3_PLR3_SS1_SRVW0_SVW1_VW1
    SolutionIndex: 7
    SolutionNameMin: Cijk_Ailk_Bljk_HHS_BH_MT384x64x16_MI32x32x8x1_SN_1LDSB1_GRVW8_LPB8_LRVW4_MIWT3_2_NLCA3_PLR1_SS1_SRVW0_SVW1_VW1
    SolutionIndex: 8
    SolutionNameMin: Cijk_Ailk_Bljk_HHS_BH_MT384x64x32_MI32x32x8x1_SN_1LDSB0_GRVW8_LPB8_LRVW4_MIWT3_2_NLCA3_PLR1_SS1_SRVW0_SVW1_VW1
    SolutionIndex: 9
    SolutionNameMin: Cijk_Ailk_Bljk_HHS_BH_MT384x64x32_MI32x32x8x1_SN_1LDSB1_GRVW8_LPB8_LRVW8_MIWT3_2_NLCA3_PLR5_SS1_SRVW0_SVW1_VW1
- - - [1104, 1335, 1, 4608, 1104, 1104, 1104, 4608]
    - [8, 85431.0]
  - - [1104, 1408, 1, 4608, 1104, 1104, 1104, 4608]
    - [8, 89472.3]
  - - [4608, 1, 1, 320, 4608, 4608, 4608, 320]
    - [3, 192.602]
  - - [4608, 16, 1, 320, 4608, 4608, 4608, 320]
    - [5, 3003.16]
  - - [4608, 1335, 1, 320, 4608, 4608, 4608, 320]
    - [7, 81940.1]
  - - [4608, 1408, 1, 320, 4608, 4608, 4608, 320]
    - [9, 92126.9]
  - - [768, 1335, 1, 4608, 768, 768, 768, 4608]
    - [1, 61812.7]
  - - [768, 1408, 1, 4608, 768, 768, 768, 4608]
    - [8, 67576.3]
  - - [4608, 1, 1, 768, 4608, 4608, 4608, 768]
    - [2, 244.266]
  - - [4608, 16, 1, 768, 4608, 4608, 4608, 768]
    - [1, 3789.01]
  - - [4608, 1335, 1, 768, 4608, 4608, 4608, 768]
    - [7, 102563.0]
  - - [4608, 1408, 1, 768, 4608, 4608, 4608, 768]
    - [9, 112205.0]
  - - [320, 8192, 1, 320, 320, 320, 320, 320]
    - [6, 51425.7]
  - - [640, 2048, 1, 640, 640, 640, 640, 640]
    - [2, 56925.6]
  - - [320, 8192, 1, 1280, 320, 320, 320, 1280]
    - [9, 70009.8]
  - - [1280, 512, 1, 1280, 1280, 1280, 1280, 1280]
    - [5, 38129.9]
  - - [10240, 512, 1, 1280, 10240, 10240, 10240, 1280]
    - [0, 122389.0]
  - - [2560, 8192, 1, 320, 2560, 2560, 2560, 320]
    - [7, 105530.0]
  - - [5120, 2048, 1, 640, 5120, 5120, 5120, 640]
    - [7, 105596.0]
  - - [1280, 512, 1, 5120, 1280, 1280, 1280, 5120]
    - [1, 41593.5]
  - - [640, 2048, 1, 2560, 640, 640, 640, 2560]
    - [1, 74314.1]
  - - [320, 154, 1, 768, 320, 320, 320, 768]
    - [5, 2512.41]
  - - [1280, 154, 1, 768, 1280, 1280, 1280, 768]
    - [4, 10794.9]
- null
- null
- DeviceEfficiency
