tensilelite/try/yamlGen/tunning_BFVF_Round1/tunning_BFVF_Round1_9/3_LibraryLogic/aldebaran_Cijk_Ailk_Bljk_HHS_BH.yaml
- {MinimumRequiredVersion: 4.33.0}
- aldebaran
- gfx90a
- [Device 0050, Device 0051, Device 0052, Device 0054, Device 0062, Device 7400, Device
    SolutionIndex: 0
    SolutionNameMin: Cijk_Ailk_Bljk_HHS_BH_MT32x64x64_MI16x16x16x1_SN_1LDSB0_GRVW8_LPB8_LRVW4_MIWT1_4_PLR1_SS0_SRVW0_SVW4_WG32_4_1
    SolutionIndex: 1
    SolutionNameMin: Cijk_Ailk_Bljk_HHS_BH_MT32x64x64_MI16x16x16x1_SN_1LDSB0_GRVW8_LPB8_LRVW4_MIWT1_4_PLR5_SS0_SRVW0_SVW4_WG32_4_1
    SolutionIndex: 2
    SolutionNameMin: Cijk_Ailk_Bljk_HHS_BH_MT32x64x64_MI16x16x16x1_SN_1LDSB0_GRVW8_LPB16_LRVW8_MIWT1_4_PLR5_SS0_SRVW0_SVW4_WG32_4_1
    SolutionIndex: 3
    SolutionNameMin: Cijk_Ailk_Bljk_HHS_BH_MT32x64x64_MI16x16x16x1_SN_1LDSB1_GRVW8_LPB16_LRVW8_MIWT1_4_PLR5_SS0_SRVW0_SVW4_WG32_4_1
    SolutionIndex: 4
    SolutionNameMin: Cijk_Ailk_Bljk_HHS_BH_MT32x64x64_MI16x16x16x1_SN_1LDSB0_GRVW8_LPB16_LRVW8_MIWT1_4_PLR5_SS0_SRVW4_SVW4_WG32_4_1
    SolutionIndex: 5
    SolutionNameMin: Cijk_Ailk_Bljk_HHS_BH_MT32x96x64_MI16x16x16x1_SN_1LDSB0_GRVW8_LPB16_LRVW8_MIWT1_3_PLR5_SS0_SRVW4_SVW4_WG32_8_1
    SolutionIndex: 6
    SolutionNameMin: Cijk_Ailk_Bljk_HHS_BH_MT32x64x64_MI16x16x16x1_SN_1LDSB1_GRVW8_LPB16_LRVW8_MIWT1_4_PLR5_SS0_SRVW4_SVW4_WG32_4_1
    SolutionIndex: 7
    SolutionNameMin: Cijk_Ailk_Bljk_HHS_BH_MT32x64x64_MI16x16x16x1_SN_1LDSB0_GRVW8_LPB16_LRVW8_MIWT1_4_PLR5_SS1_SRVW0_SVW1_WG32_4_1
    SolutionIndex: 8
    SolutionNameMin: Cijk_Ailk_Bljk_HHS_BH_MT32x64x64_MI16x16x16x1_SN_1LDSB1_GRVW8_LPB16_LRVW8_MIWT1_4_PLR5_SS1_SRVW0_SVW1_WG32_4_1
- - - [1104, 1335, 1, 4608, 1104, 1104, 1104, 4608]
    - [7, 59931.0]
  - - [1104, 1408, 1, 4608, 1104, 1104, 1104, 4608]
    - [2, 61675.6]
  - - [4608, 1, 1, 320, 4608, 4608, 4608, 320]
    - [2, 355.83]
  - - [4608, 16, 1, 320, 4608, 4608, 4608, 320]
    - [1, 5553.83]
  - - [4608, 1335, 1, 320, 4608, 4608, 4608, 320]
    - [6, 57559.0]
  - - [4608, 1408, 1, 320, 4608, 4608, 4608, 320]
    - [6, 57226.0]
  - - [768, 1335, 1, 4608, 768, 768, 768, 4608]
    - [7, 59827.3]
  - - [768, 1408, 1, 4608, 768, 768, 768, 4608]
    - [4, 59121.8]
  - - [4608, 1, 1, 768, 4608, 4608, 4608, 768]
    - [0, 511.996]
  - - [4608, 16, 1, 768, 4608, 4608, 4608, 768]
    - [2, 7970.48]
  - - [4608, 1335, 1, 768, 4608, 4608, 4608, 768]
    - [6, 69971.0]
  - - [4608, 1408, 1, 768, 4608, 4608, 4608, 768]
    - [6, 70907.1]
  - - [320, 8192, 1, 320, 320, 320, 320, 320]
    - [3, 52115.6]
  - - [640, 2048, 1, 640, 640, 640, 640, 640]
    - [7, 54414.4]
  - - [320, 8192, 1, 1280, 320, 320, 320, 1280]
    - [2, 63597.6]
  - - [1280, 512, 1, 1280, 1280, 1280, 1280, 1280]
    - [8, 61680.3]
  - - [10240, 512, 1, 1280, 10240, 10240, 10240, 1280]
    - [6, 74175.7]
  - - [2560, 8192, 1, 320, 2560, 2560, 2560, 320]
    - [6, 69269.4]
  - - [5120, 2048, 1, 640, 5120, 5120, 5120, 640]
    - [6, 71782.7]
  - - [1280, 512, 1, 5120, 1280, 1280, 1280, 5120]
    - [3, 65637.9]
  - - [640, 2048, 1, 2560, 640, 640, 640, 2560]
    - [7, 63878.5]
  - - [320, 154, 1, 768, 320, 320, 320, 768]
    - [2, 7593.63]
  - - [1280, 154, 1, 768, 1280, 1280, 1280, 768]
    - [5, 27585.1]
- null
- null
- DeviceEfficiency
