tensilelite/try32/yamlGen/tunning_BFVF_Round1/tunning_BFVF_Round1_1/3_LibraryLogic/aldebaran_Cijk_Ailk_Bljk_HHS_BH.yaml
- {MinimumRequiredVersion: 4.33.0}
- aldebaran
- gfx90a
- [Device 0050, Device 0051, Device 0052, Device 0054, Device 0062, Device 7400, Device
    SolutionIndex: 0
    SolutionNameMin: Cijk_Ailk_Bljk_HHS_BH_MT32x32x64_MI32x32x8x1_SN_GRVW8_LPB8_LRVW4_MIWT1_1_PLR9_SS0_SRVW0_SVW4_WG32_2_1
    SolutionIndex: 1
    SolutionNameMin: Cijk_Ailk_Bljk_HHS_BH_MT32x32x64_MI32x32x8x1_SN_GRVW8_LPB8_LRVW8_MIWT1_1_PLR9_SS0_SRVW0_SVW4_WG32_2_1
    SolutionIndex: 2
    SolutionNameMin: Cijk_Ailk_Bljk_HHS_BH_MT32x64x64_MI32x32x8x1_SN_GRVW8_LPB8_LRVW8_MIWT1_1_PLR9_SS0_SRVW0_SVW4_WG32_4_1
    SolutionIndex: 3
    SolutionNameMin: Cijk_Ailk_Bljk_HHS_BH_MT32x32x64_MI32x32x8x1_SN_GRVW8_LPB8_LRVW8_MIWT1_1_PLR9_SS0_SRVW4_SVW4_WG32_2_1
    SolutionIndex: 4
    SolutionNameMin: Cijk_Ailk_Bljk_HHS_BH_MT32x64x64_MI32x32x8x1_SN_GRVW8_LPB8_LRVW4_MIWT1_1_PLR1_SS0_SRVW4_SVW4_WG32_4_1
    SolutionIndex: 5
    SolutionNameMin: Cijk_Ailk_Bljk_HHS_BH_MT32x64x64_MI32x32x8x1_SN_GRVW8_LPB8_LRVW8_MIWT1_1_PLR9_SS0_SRVW4_SVW4_WG32_4_1
    SolutionIndex: 6
    SolutionNameMin: Cijk_Ailk_Bljk_HHS_BH_MT32x64x32_MI32x32x8x1_SN_GRVW2_LPB4_LRVW4_MIWT1_1_PLR1_SS1_SRVW0_SVW1_WG32_4_1
    SolutionIndex: 7
    SolutionNameMin: Cijk_Ailk_Bljk_HHS_BH_MT32x64x32_MI32x32x8x1_SN_GRVW2_LPB4_LRVW4_MIWT1_1_PLR5_SS1_SRVW0_SVW1_WG32_4_1
    SolutionIndex: 8
    SolutionNameMin: Cijk_Ailk_Bljk_HHS_BH_MT32x64x64_MI32x32x8x1_SN_GRVW8_LPB8_LRVW4_MIWT1_1_PLR9_SS1_SRVW0_SVW1_WG32_4_1
    SolutionIndex: 9
    SolutionNameMin: Cijk_Ailk_Bljk_HHS_BH_MT32x64x64_MI32x32x8x1_SN_GRVW8_LPB8_LRVW8_MIWT1_1_PLR9_SS1_SRVW0_SVW1_WG32_4_1
- - - [1104, 1335, 1, 4608, 1104, 1104, 1104, 4608]
    - [5, 59885.0]
  - - [1104, 1408, 1, 4608, 1104, 1104, 1104, 4608]
    - [9, 62090.9]
  - - [4608, 1, 1, 320, 4608, 4608, 4608, 320]
    - [0, 416.072]
  - - [4608, 16, 1, 320, 4608, 4608, 4608, 320]
    - [1, 6369.59]
  - - [4608, 1335, 1, 320, 4608, 4608, 4608, 320]
    - [7, 48135.0]
  - - [4608, 1408, 1, 320, 4608, 4608, 4608, 320]
    - [6, 49114.6]
  - - [768, 1335, 1, 4608, 768, 768, 768, 4608]
    - [4, 58326.9]
  - - [768, 1408, 1, 4608, 768, 768, 768, 4608]
    - [5, 59557.5]
  - - [4608, 1, 1, 768, 4608, 4608, 4608, 768]
    - [1, 611.845]
  - - [4608, 16, 1, 768, 4608, 4608, 4608, 768]
    - [0, 8925.46]
  - - [4608, 1335, 1, 768, 4608, 4608, 4608, 768]
    - [9, 62832.1]
  - - [4608, 1408, 1, 768, 4608, 4608, 4608, 768]
    - [9, 64377.5]
  - - [320, 8192, 1, 320, 320, 320, 320, 320]
    - [9, 48455.3]
  - - [640, 2048, 1, 640, 640, 640, 640, 640]
    - [9, 56284.1]
  - - [320, 8192, 1, 1280, 320, 320, 320, 1280]
    - [9, 64836.7]
  - - [1280, 512, 1, 1280, 1280, 1280, 1280, 1280]
    - [2, 51174.9]
  - - [10240, 512, 1, 1280, 10240, 10240, 10240, 1280]
    - [9, 69557.1]
  - - [2560, 8192, 1, 320, 2560, 2560, 2560, 320]
    - [9, 58298.6]
  - - [5120, 2048, 1, 640, 5120, 5120, 5120, 640]
    - [9, 62629.4]
  - - [1280, 512, 1, 5120, 1280, 1280, 1280, 5120]
    - [8, 54870.4]
  - - [640, 2048, 1, 2560, 640, 640, 640, 2560]
    - [9, 64607.1]
  - - [320, 154, 1, 768, 320, 320, 320, 768]
    - [2, 7884.8]
  - - [1280, 154, 1, 768, 1280, 1280, 1280, 768]
    - [3, 27747.1]
- null
- null
- DeviceEfficiency
