library/src/amd_detail/rocblaslt/src/Tensile/Logic/asm_full/gfx1200/Equality/gfx1200_Cijk_Ailk_Bljk_DB_UserArgs.yaml
- {MinimumRequiredVersion: 4.33.0}
- gfx1200
- gfx1200
- [Device 73f0]
    SolutionIndex: 0
    SolutionNameMin: Cijk_Ailk_Bljk_DB_UserArgs_MT8x8x8_SN_GSU1_SU32_SUM0_SUS256_TT1_1_WGM1
    SolutionIndex: 1
    SolutionNameMin: Cijk_Ailk_Bljk_DB_UserArgs_MT16x16x8_SN_GSU1_SU32_SUM0_SUS256_TT2_2_WGM1
    SolutionIndex: 2
    SolutionNameMin: Cijk_Ailk_Bljk_DB_UserArgs_MT8x8x16_SN_GSU1_SU32_SUM0_SUS256_TT1_1_WGM1
    SolutionIndex: 3
    SolutionNameMin: Cijk_Ailk_Bljk_DB_UserArgs_MT16x16x16_SN_GSU1_SU32_SUM0_SUS256_TT2_2_WGM1
- - - [64, 64, 1, 32, 64, 64, 64, 32]
    - [2, 1.15233]
  - - [128, 64, 1, 32, 128, 128, 128, 32]
    - [2, 2.30557]
  - - [192, 64, 1, 32, 192, 192, 192, 32]
    - [2, 3.45926]
  - - [256, 64, 1, 32, 256, 256, 256, 32]
    - [2, 4.61702]
  - - [320, 64, 1, 32, 320, 320, 320, 32]
    - [2, 5.75784]
  - - [384, 64, 1, 32, 384, 384, 384, 32]
    - [3, 73.7741]
  - - [448, 64, 1, 32, 448, 448, 448, 32]
    - [2, 86.557]
  - - [512, 64, 1, 32, 512, 512, 512, 32]
    - [2, 97.4513]
  - - [576, 64, 1, 32, 576, 576, 576, 32]
    - [2, 107.241]
  - - [640, 64, 1, 32, 640, 640, 640, 32]
    - [0, 11.4934]
  - - [704, 64, 1, 32, 704, 704, 704, 32]
    - [3, 12.5832]
  - - [768, 64, 1, 32, 768, 768, 768, 32]
    - [1, 129.56]
  - - [832, 64, 1, 32, 832, 832, 832, 32]
    - [0, 14.8445]
  - - [896, 64, 1, 32, 896, 896, 896, 32]
    - [2, 16.0774]
  - - [960, 64, 1, 32, 960, 960, 960, 32]
    - [3, 17.2047]
  - - [1024, 64, 1, 32, 1024, 1024, 1024, 32]
    - [3, 18.3397]
  - - [64, 128, 1, 32, 64, 64, 64, 32]
    - [2, 2.29779]
  - - [128, 128, 1, 32, 128, 128, 128, 32]
    - [1, 49.1827]
  - - [192, 128, 1, 32, 192, 192, 192, 32]
    - [2, 6.90061]
  - - [256, 128, 1, 32, 256, 256, 256, 32]
    - [3, 9.25727]
  - - [320, 128, 1, 32, 320, 320, 320, 32]
    - [1, 11.4929]
  - - [384, 128, 1, 32, 384, 384, 384, 32]
    - [3, 13.7801]
  - - [448, 128, 1, 32, 448, 448, 448, 32]
    - [2, 16.0311]
  - - [512, 128, 1, 32, 512, 512, 512, 32]
    - [0, 18.3654]
  - - [576, 128, 1, 32, 576, 576, 576, 32]
    - [1, 20.671]
  - - [640, 128, 1, 32, 640, 640, 640, 32]
    - [3, 22.9547]
  - - [704, 128, 1, 32, 704, 704, 704, 32]
    - [2, 25.2049]
  - - [768, 128, 1, 32, 768, 768, 768, 32]
    - [3, 191.34]
  - - [832, 128, 1, 32, 832, 832, 832, 32]
    - [1, 194.291]
  - - [896, 128, 1, 32, 896, 896, 896, 32]
    - [3, 32.0944]
  - - [960, 128, 1, 32, 960, 960, 960, 32]
    - [1, 34.426]
  - - [1024, 128, 1, 32, 1024, 1024, 1024, 32]
    - [2, 36.7083]
  - - [64, 192, 1, 32, 64, 64, 64, 32]
    - [0, 3.43462]
  - - [128, 192, 1, 32, 128, 128, 128, 32]
    - [0, 6.89094]
  - - [192, 192, 1, 32, 192, 192, 192, 32]
    - [3, 10.3477]
  - - [256, 192, 1, 32, 256, 256, 256, 32]
    - [0, 13.7716]
  - - [320, 192, 1, 32, 320, 320, 320, 32]
    - [1, 17.2334]
  - - [384, 192, 1, 32, 384, 384, 384, 32]
    - [1, 20.7037]
  - - [448, 192, 1, 32, 448, 448, 448, 32]
    - [1, 176.217]
  - - [512, 192, 1, 32, 512, 512, 512, 32]
    - [2, 27.5457]
  - - [576, 192, 1, 32, 576, 576, 576, 32]
    - [2, 30.9428]
  - - [640, 192, 1, 32, 640, 640, 640, 32]
    - [1, 34.4411]
  - - [704, 192, 1, 32, 704, 704, 704, 32]
    - [1, 37.5628]
  - - [768, 192, 1, 32, 768, 768, 768, 32]
    - [3, 41.3149]
  - - [832, 192, 1, 32, 832, 832, 832, 32]
    - [1, 44.7695]
  - - [896, 192, 1, 32, 896, 896, 896, 32]
    - [1, 48.1164]
  - - [960, 192, 1, 32, 960, 960, 960, 32]
    - [3, 51.5691]
  - - [1024, 192, 1, 32, 1024, 1024, 1024, 32]
    - [2, 55.0576]
  - - [64, 256, 1, 32, 64, 64, 64, 32]
    - [3, 4.62759]
  - - [128, 256, 1, 32, 128, 128, 128, 32]
    - [1, 9.19316]
  - - [192, 256, 1, 32, 192, 192, 192, 32]
    - [3, 13.7734]
  - - [256, 256, 1, 32, 256, 256, 256, 32]
    - [0, 18.3645]
  - - [320, 256, 1, 32, 320, 320, 320, 32]
    - [1, 22.9336]
  - - [384, 256, 1, 32, 384, 384, 384, 32]
    - [1, 27.5204]
  - - [448, 256, 1, 32, 448, 448, 448, 32]
    - [3, 32.1352]
  - - [512, 256, 1, 32, 512, 512, 512, 32]
    - [0, 36.7067]
  - - [576, 256, 1, 32, 576, 576, 576, 32]
    - [0, 41.2282]
  - - [640, 256, 1, 32, 640, 640, 640, 32]
    - [2, 45.845]
  - - [704, 256, 1, 32, 704, 704, 704, 32]
    - [3, 50.4231]
  - - [768, 256, 1, 32, 768, 768, 768, 32]
    - [2, 54.9251]
  - - [832, 256, 1, 32, 832, 832, 832, 32]
    - [3, 59.4115]
  - - [896, 256, 1, 32, 896, 896, 896, 32]
    - [2, 64.1858]
  - - [960, 256, 1, 32, 960, 960, 960, 32]
    - [2, 254.016]
  - - [1024, 256, 1, 32, 1024, 1024, 1024, 32]
    - [0, 254.969]
  - - [64, 320, 1, 32, 64, 64, 64, 32]
    - [3, 7.61467]
  - - [128, 320, 1, 32, 128, 128, 128, 32]
    - [2, 14.2299]
  - - [192, 320, 1, 32, 192, 192, 192, 32]
    - [3, 128.163]
  - - [256, 320, 1, 32, 256, 256, 256, 32]
    - [3, 56.1577]
  - - [320, 320, 1, 32, 320, 320, 320, 32]
    - [2, 77.3195]
  - - [384, 320, 1, 32, 384, 384, 384, 32]
    - [2, 94.9098]
  - - [448, 320, 1, 32, 448, 448, 448, 32]
    - [2, 106.13]
  - - [512, 320, 1, 32, 512, 512, 512, 32]
    - [1, 114.111]
  - - [576, 320, 1, 32, 576, 576, 576, 32]
    - [2, 136.423]
  - - [640, 320, 1, 32, 640, 640, 640, 32]
    - [1, 145.136]
  - - [704, 320, 1, 32, 704, 704, 704, 32]
    - [3, 178.043]
  - - [768, 320, 1, 32, 768, 768, 768, 32]
    - [3, 187.805]
  - - [832, 320, 1, 32, 832, 832, 832, 32]
    - [2, 201.408]
  - - [896, 320, 1, 32, 896, 896, 896, 32]
    - [2, 215.225]
  - - [960, 320, 1, 32, 960, 960, 960, 32]
    - [2, 234.057]
  - - [1024, 320, 1, 32, 1024, 1024, 1024, 32]
    - [1, 208.317]
  - - [64, 384, 1, 32, 64, 64, 64, 32]
    - [3, 9.21145]
  - - [128, 384, 1, 32, 128, 128, 128, 32]
    - [1, 17.025]
  - - [192, 384, 1, 32, 192, 192, 192, 32]
    - [1, 7.75723]
  - - [256, 384, 1, 32, 256, 256, 256, 32]
    - [2, 10.3896]
  - - [320, 384, 1, 32, 320, 320, 320, 32]
    - [1, 223.666]
  - - [384, 384, 1, 32, 384, 384, 384, 32]
    - [2, 15.4626]
  - - [448, 384, 1, 32, 448, 448, 448, 32]
    - [2, 18.1659]
  - - [512, 384, 1, 32, 512, 512, 512, 32]
    - [2, 20.8546]
  - - [576, 384, 1, 32, 576, 576, 576, 32]
    - [1, 23.0688]
  - - [640, 384, 1, 32, 640, 640, 640, 32]
    - [3, 25.9462]
  - - [704, 384, 1, 32, 704, 704, 704, 32]
    - [3, 28.3835]
  - - [768, 384, 1, 32, 768, 768, 768, 32]
    - [2, 27.8558]
  - - [832, 384, 1, 32, 832, 832, 832, 32]
    - [3, 32.9007]
  - - [896, 384, 1, 32, 896, 896, 896, 32]
    - [1, 36.1089]
  - - [960, 384, 1, 32, 960, 960, 960, 32]
    - [1, 33.7818]
  - - [1024, 384, 1, 32, 1024, 1024, 1024, 32]
    - [1, 36.0871]
  - - [64, 448, 1, 32, 64, 64, 64, 32]
    - [1, 3.07978]
  - - [128, 448, 1, 32, 128, 128, 128, 32]
    - [2, 136.533]
  - - [192, 448, 1, 32, 192, 192, 192, 32]
    - [1, 179.903]
  - - [256, 448, 1, 32, 256, 256, 256, 32]
    - [1, 207.34]
  - - [320, 448, 1, 32, 320, 320, 320, 32]
    - [1, 234.296]
  - - [384, 448, 1, 32, 384, 384, 384, 32]
    - [3, 18.1899]
  - - [448, 448, 1, 32, 448, 448, 448, 32]
    - [2, 21.0968]
  - - [512, 448, 1, 32, 512, 512, 512, 32]
    - [3, 24.1189]
  - - [576, 448, 1, 32, 576, 576, 576, 32]
    - [3, 24.1095]
  - - [640, 448, 1, 32, 640, 640, 640, 32]
    - [2, 269.221]
  - - [704, 448, 1, 32, 704, 704, 704, 32]
    - [3, 204.303]
  - - [768, 448, 1, 32, 768, 768, 768, 32]
    - [3, 228.899]
  - - [832, 448, 1, 32, 832, 832, 832, 32]
    - [2, 248.18]
  - - [896, 448, 1, 32, 896, 896, 896, 32]
    - [3, 267.157]
  - - [960, 448, 1, 32, 960, 960, 960, 32]
    - [3, 278.144]
  - - [1024, 448, 1, 32, 1024, 1024, 1024, 32]
    - [3, 291.966]
  - - [64, 512, 1, 32, 64, 64, 64, 32]
    - [3, 10.8942]
  - - [128, 512, 1, 32, 128, 128, 128, 32]
    - [2, 55.8645]
  - - [192, 512, 1, 32, 192, 192, 192, 32]
    - [2, 65.906]
  - - [256, 512, 1, 32, 256, 256, 256, 32]
    - [2, 86.2139]
  - - [320, 512, 1, 32, 320, 320, 320, 32]
    - [2, 106.66]
  - - [384, 512, 1, 32, 384, 384, 384, 32]
    - [1, 124.202]
  - - [448, 512, 1, 32, 448, 448, 448, 32]
    - [1, 139.478]
  - - [512, 512, 1, 32, 512, 512, 512, 32]
    - [3, 177.031]
  - - [576, 512, 1, 32, 576, 576, 576, 32]
    - [3, 194.86]
  - - [640, 512, 1, 32, 640, 640, 640, 32]
    - [3, 205.36]
  - - [704, 512, 1, 32, 704, 704, 704, 32]
    - [3, 266.013]
  - - [768, 512, 1, 32, 768, 768, 768, 32]
    - [3, 36.8442]
  - - [832, 512, 1, 32, 832, 832, 832, 32]
    - [2, 40.0112]
  - - [896, 512, 1, 32, 896, 896, 896, 32]
    - [3, 45.583]
  - - [960, 512, 1, 32, 960, 960, 960, 32]
    - [2, 45.1471]
  - - [1024, 512, 1, 32, 1024, 1024, 1024, 32]
    - [2, 632.613]
  - - [64, 576, 1, 32, 64, 64, 64, 32]
    - [2, 12.9474]
  - - [128, 576, 1, 32, 128, 128, 128, 32]
    - [2, 50.4554]
  - - [192, 576, 1, 32, 192, 192, 192, 32]
    - [2, 84.8362]
  - - [256, 576, 1, 32, 256, 256, 256, 32]
    - [2, 111.643]
  - - [320, 576, 1, 32, 320, 320, 320, 32]
    - [1, 130.896]
  - - [384, 576, 1, 32, 384, 384, 384, 32]
    - [3, 61.5439]
  - - [448, 576, 1, 32, 448, 448, 448, 32]
    - [1, 71.8731]
  - - [512, 576, 1, 32, 512, 512, 512, 32]
    - [2, 81.845]
  - - [576, 576, 1, 32, 576, 576, 576, 32]
    - [3, 93.0358]
  - - [640, 576, 1, 32, 640, 640, 640, 32]
    - [1, 103.328]
  - - [704, 576, 1, 32, 704, 704, 704, 32]
    - [3, 113.566]
  - - [768, 576, 1, 32, 768, 768, 768, 32]
    - [2, 123.809]
  - - [832, 576, 1, 32, 832, 832, 832, 32]
    - [2, 135.286]
  - - [896, 576, 1, 32, 896, 896, 896, 32]
    - [0, 144.16]
  - - [960, 576, 1, 32, 960, 960, 960, 32]
    - [0, 154.289]
  - - [1024, 576, 1, 32, 1024, 1024, 1024, 32]
    - [3, 55.2663]
  - - [64, 640, 1, 32, 64, 64, 64, 32]
    - [3, 4.32657]
  - - [128, 640, 1, 32, 128, 128, 128, 32]
    - [3, 8.54722]
  - - [192, 640, 1, 32, 192, 192, 192, 32]
    - [3, 210.501]
  - - [256, 640, 1, 32, 256, 256, 256, 32]
    - [1, 248.478]
  - - [320, 640, 1, 32, 320, 320, 320, 32]
    - [1, 20.9872]
  - - [384, 640, 1, 32, 384, 384, 384, 32]
    - [3, 25.903]
  - - [448, 640, 1, 32, 448, 448, 448, 32]
    - [1, 26.54]
  - - [512, 640, 1, 32, 512, 512, 512, 32]
    - [3, 33.82]
  - - [576, 640, 1, 32, 576, 576, 576, 32]
    - [1, 37.43]
  - - [640, 640, 1, 32, 640, 640, 640, 32]
    - [3, 34.0321]
  - - [704, 640, 1, 32, 704, 704, 704, 32]
    - [2, 45.0431]
  - - [768, 640, 1, 32, 768, 768, 768, 32]
    - [3, 45.9295]
  - - [832, 640, 1, 32, 832, 832, 832, 32]
    - [3, 276.88]
  - - [896, 640, 1, 32, 896, 896, 896, 32]
    - [2, 53.7209]
  - - [960, 640, 1, 32, 960, 960, 960, 32]
    - [2, 57.1025]
  - - [1024, 640, 1, 32, 1024, 1024, 1024, 32]
    - [1, 59.7382]
  - - [64, 704, 1, 32, 64, 64, 64, 32]
    - [3, 4.74053]
  - - [128, 704, 1, 32, 128, 128, 128, 32]
    - [2, 9.37091]
  - - [192, 704, 1, 32, 192, 192, 192, 32]
    - [2, 14.1319]
  - - [256, 704, 1, 32, 256, 256, 256, 32]
    - [2, 19.5838]
  - - [320, 704, 1, 32, 320, 320, 320, 32]
    - [3, 23.6964]
  - - [384, 704, 1, 32, 384, 384, 384, 32]
    - [3, 27.7649]
  - - [448, 704, 1, 32, 448, 448, 448, 32]
    - [2, 32.7588]
  - - [512, 704, 1, 32, 512, 512, 512, 32]
    - [2, 33.4895]
  - - [576, 704, 1, 32, 576, 576, 576, 32]
    - [2, 37.6538]
  - - [640, 704, 1, 32, 640, 640, 640, 32]
    - [0, 36.5703]
  - - [704, 704, 1, 32, 704, 704, 704, 32]
    - [3, 46.5967]
  - - [768, 704, 1, 32, 768, 768, 768, 32]
    - [1, 49.955]
  - - [832, 704, 1, 32, 832, 832, 832, 32]
    - [2, 54.7614]
  - - [896, 704, 1, 32, 896, 896, 896, 32]
    - [2, 58.6893]
  - - [960, 704, 1, 32, 960, 960, 960, 32]
    - [1, 53.1547]
  - - [1024, 704, 1, 32, 1024, 1024, 1024, 32]
    - [3, 66.2851]
  - - [64, 768, 1, 32, 64, 64, 64, 32]
    - [3, 5.20244]
  - - [128, 768, 1, 32, 128, 128, 128, 32]
    - [2, 10.3143]
  - - [192, 768, 1, 32, 192, 192, 192, 32]
    - [3, 15.5431]
  - - [256, 768, 1, 32, 256, 256, 256, 32]
    - [3, 20.7303]
  - - [320, 768, 1, 32, 320, 320, 320, 32]
    - [3, 25.6257]
  - - [384, 768, 1, 32, 384, 384, 384, 32]
    - [3, 30.8031]
  - - [448, 768, 1, 32, 448, 448, 448, 32]
    - [2, 32.4291]
  - - [512, 768, 1, 32, 512, 512, 512, 32]
    - [3, 39.7506]
  - - [576, 768, 1, 32, 576, 576, 576, 32]
    - [2, 41.4418]
  - - [640, 768, 1, 32, 640, 640, 640, 32]
    - [2, 295.426]
  - - [704, 768, 1, 32, 704, 704, 704, 32]
    - [2, 50.5342]
  - - [768, 768, 1, 32, 768, 768, 768, 32]
    - [2, 54.939]
  - - [832, 768, 1, 32, 832, 832, 832, 32]
    - [3, 58.1719]
  - - [896, 768, 1, 32, 896, 896, 896, 32]
    - [1, 63.765]
  - - [960, 768, 1, 32, 960, 960, 960, 32]
    - [2, 68.1401]
  - - [1024, 768, 1, 32, 1024, 1024, 1024, 32]
    - [1, 70.5119]
  - - [64, 832, 1, 32, 64, 64, 64, 32]
    - [2, 131.274]
  - - [128, 832, 1, 32, 128, 128, 128, 32]
    - [1, 193.19]
  - - [192, 832, 1, 32, 192, 192, 192, 32]
    - [1, 242.72]
  - - [256, 832, 1, 32, 256, 256, 256, 32]
    - [1, 269.392]
  - - [320, 832, 1, 32, 320, 320, 320, 32]
    - [0, 72.9044]
  - - [384, 832, 1, 32, 384, 384, 384, 32]
    - [2, 29.7413]
  - - [448, 832, 1, 32, 448, 448, 448, 32]
    - [2, 37.9717]
  - - [512, 832, 1, 32, 512, 512, 512, 32]
    - [3, 42.7618]
  - - [576, 832, 1, 32, 576, 576, 576, 32]
    - [1, 36.6624]
  - - [640, 832, 1, 32, 640, 640, 640, 32]
    - [3, 49.675]
  - - [704, 832, 1, 32, 704, 704, 704, 32]
    - [2, 56.5567]
  - - [768, 832, 1, 32, 768, 768, 768, 32]
    - [3, 59.3651]
  - - [832, 832, 1, 32, 832, 832, 832, 32]
    - [3, 64.4816]
  - - [896, 832, 1, 32, 896, 896, 896, 32]
    - [2, 68.9171]
  - - [960, 832, 1, 32, 960, 960, 960, 32]
    - [1, 63.7849]
  - - [1024, 832, 1, 32, 1024, 1024, 1024, 32]
    - [1, 79.2627]
  - - [64, 896, 1, 32, 64, 64, 64, 32]
    - [2, 6.0592]
  - - [128, 896, 1, 32, 128, 128, 128, 32]
    - [3, 12.0502]
  - - [192, 896, 1, 32, 192, 192, 192, 32]
    - [3, 249.774]
  - - [256, 896, 1, 32, 256, 256, 256, 32]
    - [2, 23.7929]
  - - [320, 896, 1, 32, 320, 320, 320, 32]
    - [2, 83.3031]
  - - [384, 896, 1, 32, 384, 384, 384, 32]
    - [3, 34.9013]
  - - [448, 896, 1, 32, 448, 448, 448, 32]
    - [1, 35.9602]
  - - [512, 896, 1, 32, 512, 512, 512, 32]
    - [1, 42.0896]
  - - [576, 896, 1, 32, 576, 576, 576, 32]
    - [3, 48.2746]
  - - [640, 896, 1, 32, 640, 640, 640, 32]
    - [1, 53.1706]
  - - [704, 896, 1, 32, 704, 704, 704, 32]
    - [2, 59.3754]
  - - [768, 896, 1, 32, 768, 768, 768, 32]
    - [3, 63.9902]
  - - [832, 896, 1, 32, 832, 832, 832, 32]
    - [0, 67.4584]
  - - [896, 896, 1, 32, 896, 896, 896, 32]
    - [2, 72.8681]
  - - [960, 896, 1, 32, 960, 960, 960, 32]
    - [1, 79.6003]
  - - [1024, 896, 1, 32, 1024, 1024, 1024, 32]
    - [1, 82.539]
  - - [64, 960, 1, 32, 64, 64, 64, 32]
    - [1, 6.40329]
  - - [128, 960, 1, 32, 128, 128, 128, 32]
    - [2, 12.9321]
  - - [192, 960, 1, 32, 192, 192, 192, 32]
    - [2, 19.3689]
  - - [256, 960, 1, 32, 256, 256, 256, 32]
    - [1, 25.2785]
  - - [320, 960, 1, 32, 320, 320, 320, 32]
    - [1, 31.4692]
  - - [384, 960, 1, 32, 384, 384, 384, 32]
    - [2, 34.3398]
  - - [448, 960, 1, 32, 448, 448, 448, 32]
    - [2, 40.19]
  - - [512, 960, 1, 32, 512, 512, 512, 32]
    - [3, 45.686]
  - - [576, 960, 1, 32, 576, 576, 576, 32]
    - [3, 51.5217]
  - - [640, 960, 1, 32, 640, 640, 640, 32]
    - [2, 57.8128]
  - - [704, 960, 1, 32, 704, 704, 704, 32]
    - [0, 61.3229]
  - - [768, 960, 1, 32, 768, 768, 768, 32]
    - [0, 65.2042]
  - - [832, 960, 1, 32, 832, 832, 832, 32]
    - [2, 72.6756]
  - - [896, 960, 1, 32, 896, 896, 896, 32]
    - [1, 79.4669]
  - - [960, 960, 1, 32, 960, 960, 960, 32]
    - [2, 78.536]
  - - [1024, 960, 1, 32, 1024, 1024, 1024, 32]
    - [3, 85.7013]
  - - [64, 1024, 1, 32, 64, 64, 64, 32]
    - [3, 6.90076]
  - - [128, 1024, 1, 32, 128, 128, 128, 32]
    - [3, 13.7965]
  - - [192, 1024, 1, 32, 192, 192, 192, 32]
    - [3, 20.4795]
  - - [256, 1024, 1, 32, 256, 256, 256, 32]
    - [3, 27.4706]
  - - [320, 1024, 1, 32, 320, 320, 320, 32]
    - [0, 29.5718]
  - - [384, 1024, 1, 32, 384, 384, 384, 32]
    - [2, 40.0721]
  - - [448, 1024, 1, 32, 448, 448, 448, 32]
    - [2, 42.8763]
  - - [512, 1024, 1, 32, 512, 512, 512, 32]
    - [3, 48.9415]
  - - [576, 1024, 1, 32, 576, 576, 576, 32]
    - [0, 53.6033]
  - - [640, 1024, 1, 32, 640, 640, 640, 32]
    - [1, 59.8688]
  - - [704, 1024, 1, 32, 704, 704, 704, 32]
    - [0, 64.5626]
  - - [768, 1024, 1, 32, 768, 768, 768, 32]
    - [2, 61.8968]
  - - [832, 1024, 1, 32, 832, 832, 832, 32]
    - [1, 78.4519]
  - - [896, 1024, 1, 32, 896, 896, 896, 32]
    - [2, 69.6129]
  - - [960, 1024, 1, 32, 960, 960, 960, 32]
    - [3, 85.3746]
  - - [1024, 1024, 1, 32, 1024, 1024, 1024, 32]
    - [3, 90.2469]
- null
- null
- DeviceEfficiency
- Equality
