library/src/amd_detail/rocblaslt/src/Tensile/Logic/asm_full/gfx1200/Equality/gfx1200_Cijk_Ailk_Bjlk_DB_UserArgs.yaml
- {MinimumRequiredVersion: 4.33.0}
- gfx1200
- gfx1200
- [Device 73f0]
    SolutionIndex: 0
    SolutionNameMin: Cijk_Ailk_Bjlk_DB_UserArgs_MT8x8x8_SN_GSU1_SU32_SUM0_SUS256_TT1_1_WGM1
    SolutionIndex: 1
    SolutionNameMin: Cijk_Ailk_Bjlk_DB_UserArgs_MT16x16x8_SN_GSU1_SU32_SUM0_SUS256_TT2_2_WGM1
    SolutionIndex: 2
    SolutionNameMin: Cijk_Ailk_Bjlk_DB_UserArgs_MT8x8x16_SN_GSU1_SU32_SUM0_SUS256_TT1_1_WGM1
    SolutionIndex: 3
    SolutionNameMin: Cijk_Ailk_Bjlk_DB_UserArgs_MT16x16x16_SN_GSU1_SU32_SUM0_SUS256_TT2_2_WGM1
- - - [64, 64, 1, 32, 64, 64, 64, 64]
    - [1, 1.15349]
  - - [128, 64, 1, 32, 128, 128, 128, 64]
    - [2, 2.30698]
  - - [192, 64, 1, 32, 192, 192, 192, 64]
    - [3, 3.45378]
  - - [256, 64, 1, 32, 256, 256, 256, 64]
    - [1, 4.61519]
  - - [320, 64, 1, 32, 320, 320, 320, 64]
    - [1, 5.7695]
  - - [384, 64, 1, 32, 384, 384, 384, 64]
    - [1, 6.93928]
  - - [448, 64, 1, 32, 448, 448, 448, 64]
    - [3, 8.07161]
  - - [512, 64, 1, 32, 512, 512, 512, 64]
    - [1, 9.23197]
  - - [576, 64, 1, 32, 576, 576, 576, 64]
    - [0, 26.473]
  - - [640, 64, 1, 32, 640, 640, 640, 64]
    - [3, 11.5263]
  - - [704, 64, 1, 32, 704, 704, 704, 64]
    - [3, 12.6861]
  - - [768, 64, 1, 32, 768, 768, 768, 64]
    - [3, 13.8206]
  - - [832, 64, 1, 32, 832, 832, 832, 64]
    - [1, 14.9244]
  - - [896, 64, 1, 32, 896, 896, 896, 64]
    - [2, 16.0613]
  - - [960, 64, 1, 32, 960, 960, 960, 64]
    - [3, 17.1941]
  - - [1024, 64, 1, 32, 1024, 1024, 1024, 64]
    - [1, 156.972]
  - - [64, 128, 1, 32, 64, 64, 64, 128]
    - [2, 28.9982]
  - - [128, 128, 1, 32, 128, 128, 128, 128]
    - [3, 49.9322]
  - - [192, 128, 1, 32, 192, 192, 192, 128]
    - [3, 75.0412]
  - - [256, 128, 1, 32, 256, 256, 256, 128]
    - [3, 87.9678]
  - - [320, 128, 1, 32, 320, 320, 320, 128]
    - [0, 11.4678]
  - - [384, 128, 1, 32, 384, 384, 384, 128]
    - [2, 13.7349]
  - - [448, 128, 1, 32, 448, 448, 448, 128]
    - [0, 16.0824]
  - - [512, 128, 1, 32, 512, 512, 512, 128]
    - [0, 18.2957]
  - - [576, 128, 1, 32, 576, 576, 576, 128]
    - [3, 171.71]
  - - [640, 128, 1, 32, 640, 640, 640, 128]
    - [3, 41.8958]
  - - [704, 128, 1, 32, 704, 704, 704, 128]
    - [3, 184.137]
  - - [768, 128, 1, 32, 768, 768, 768, 128]
    - [2, 9.67241]
  - - [832, 128, 1, 32, 832, 832, 832, 128]
    - [2, 10.4909]
  - - [896, 128, 1, 32, 896, 896, 896, 128]
    - [3, 11.1885]
  - - [960, 128, 1, 32, 960, 960, 960, 128]
    - [1, 11.9394]
  - - [1024, 128, 1, 32, 1024, 1024, 1024, 128]
    - [3, 221.452]
  - - [64, 192, 1, 32, 64, 64, 64, 192]
    - [3, 37.4474]
  - - [128, 192, 1, 32, 128, 128, 128, 192]
    - [2, 77.4047]
  - - [192, 192, 1, 32, 192, 192, 192, 192]
    - [3, 98.304]
  - - [256, 192, 1, 32, 256, 256, 256, 192]
    - [3, 5.21919]
  - - [320, 192, 1, 32, 320, 320, 320, 192]
    - [1, 6.03876]
  - - [384, 192, 1, 32, 384, 384, 384, 192]
    - [1, 7.71751]
  - - [448, 192, 1, 32, 448, 448, 448, 192]
    - [2, 9.04163]
  - - [512, 192, 1, 32, 512, 512, 512, 192]
    - [1, 10.2895]
  - - [576, 192, 1, 32, 576, 576, 576, 192]
    - [1, 11.56]
  - - [640, 192, 1, 32, 640, 640, 640, 192]
    - [2, 12.9306]
  - - [704, 192, 1, 32, 704, 704, 704, 192]
    - [3, 14.0882]
  - - [768, 192, 1, 32, 768, 768, 768, 192]
    - [1, 15.4489]
  - - [832, 192, 1, 32, 832, 832, 832, 192]
    - [1, 16.6423]
  - - [896, 192, 1, 32, 896, 896, 896, 192]
    - [1, 17.955]
  - - [960, 192, 1, 32, 960, 960, 960, 192]
    - [3, 19.4074]
  - - [1024, 192, 1, 32, 1024, 1024, 1024, 192]
    - [2, 20.6185]
  - - [64, 256, 1, 32, 64, 64, 64, 256]
    - [3, 1.74497]
  - - [128, 256, 1, 32, 128, 128, 128, 256]
    - [3, 3.48907]
  - - [192, 256, 1, 32, 192, 192, 192, 256]
    - [2, 5.19085]
  - - [256, 256, 1, 32, 256, 256, 256, 256]
    - [1, 6.85968]
  - - [320, 256, 1, 32, 320, 320, 320, 256]
    - [1, 8.58146]
  - - [384, 256, 1, 32, 384, 384, 384, 256]
    - [2, 10.2789]
  - - [448, 256, 1, 32, 448, 448, 448, 256]
    - [1, 12.0221]
  - - [512, 256, 1, 32, 512, 512, 512, 256]
    - [2, 13.7992]
  - - [576, 256, 1, 32, 576, 576, 576, 256]
    - [2, 15.4454]
  - - [640, 256, 1, 32, 640, 640, 640, 256]
    - [2, 17.294]
  - - [704, 256, 1, 32, 704, 704, 704, 256]
    - [3, 243.546]
  - - [768, 256, 1, 32, 768, 768, 768, 256]
    - [1, 267.488]
  - - [832, 256, 1, 32, 832, 832, 832, 256]
    - [2, 22.3451]
  - - [896, 256, 1, 32, 896, 896, 896, 256]
    - [3, 23.9841]
  - - [960, 256, 1, 32, 960, 960, 960, 256]
    - [3, 25.715]
  - - [1024, 256, 1, 32, 1024, 1024, 1024, 256]
    - [2, 22.0262]
  - - [64, 320, 1, 32, 64, 64, 64, 320]
    - [1, 2.18056]
  - - [128, 320, 1, 32, 128, 128, 128, 320]
    - [3, 4.34212]
  - - [192, 320, 1, 32, 192, 192, 192, 320]
    - [2, 6.47766]
  - - [256, 320, 1, 32, 256, 256, 256, 320]
    - [3, 8.64858]
  - - [320, 320, 1, 32, 320, 320, 320, 320]
    - [1, 10.7349]
  - - [384, 320, 1, 32, 384, 384, 384, 320]
    - [2, 12.5973]
  - - [448, 320, 1, 32, 448, 448, 448, 320]
    - [2, 15.1357]
  - - [512, 320, 1, 32, 512, 512, 512, 320]
    - [3, 252.547]
  - - [576, 320, 1, 32, 576, 576, 576, 320]
    - [1, 248.661]
  - - [640, 320, 1, 32, 640, 640, 640, 320]
    - [1, 21.5383]
  - - [704, 320, 1, 32, 704, 704, 704, 320]
    - [2, 23.9253]
  - - [768, 320, 1, 32, 768, 768, 768, 320]
    - [1, 25.7457]
  - - [832, 320, 1, 32, 832, 832, 832, 320]
    - [3, 28.0186]
  - - [896, 320, 1, 32, 896, 896, 896, 320]
    - [1, 29.7589]
  - - [960, 320, 1, 32, 960, 960, 960, 320]
    - [3, 31.8639]
  - - [1024, 320, 1, 32, 1024, 1024, 1024, 320]
    - [3, 33.5333]
  - - [64, 384, 1, 32, 64, 64, 64, 384]
    - [3, 2.61959]
  - - [128, 384, 1, 32, 128, 128, 128, 384]
    - [2, 5.19532]
  - - [192, 384, 1, 32, 192, 192, 192, 384]
    - [1, 7.73864]
  - - [256, 384, 1, 32, 256, 256, 256, 384]
    - [2, 10.3442]
  - - [320, 384, 1, 32, 320, 320, 320, 384]
    - [3, 13.0091]
  - - [384, 384, 1, 32, 384, 384, 384, 384]
    - [2, 15.506]
  - - [448, 384, 1, 32, 448, 448, 448, 384]
    - [3, 18.2215]
  - - [512, 384, 1, 32, 512, 512, 512, 384]
    - [3, 20.7071]
  - - [576, 384, 1, 32, 576, 576, 576, 384]
    - [2, 23.2403]
  - - [640, 384, 1, 32, 640, 640, 640, 384]
    - [1, 25.7196]
  - - [704, 384, 1, 32, 704, 704, 704, 384]
    - [3, 28.3867]
  - - [768, 384, 1, 32, 768, 768, 768, 384]
    - [3, 30.7539]
  - - [832, 384, 1, 32, 832, 832, 832, 384]
    - [3, 32.7878]
  - - [896, 384, 1, 32, 896, 896, 896, 384]
    - [2, 35.4019]
  - - [960, 384, 1, 32, 960, 960, 960, 384]
    - [1, 317.618]
  - - [1024, 384, 1, 32, 1024, 1024, 1024, 384]
    - [3, 39.8052]
  - - [64, 448, 1, 32, 64, 64, 64, 448]
    - [3, 3.04604]
  - - [128, 448, 1, 32, 128, 128, 128, 448]
    - [1, 6.00949]
  - - [192, 448, 1, 32, 192, 192, 192, 448]
    - [3, 9.07966]
  - - [256, 448, 1, 32, 256, 256, 256, 448]
    - [1, 11.9952]
  - - [320, 448, 1, 32, 320, 320, 320, 448]
    - [2, 15.0959]
  - - [384, 448, 1, 32, 384, 384, 384, 448]
    - [3, 18.0005]
  - - [448, 448, 1, 32, 448, 448, 448, 448]
    - [3, 21.2546]
  - - [512, 448, 1, 32, 512, 512, 512, 448]
    - [2, 23.9822]
  - - [576, 448, 1, 32, 576, 576, 576, 448]
    - [2, 27.2094]
  - - [640, 448, 1, 32, 640, 640, 640, 448]
    - [2, 30.0287]
  - - [704, 448, 1, 32, 704, 704, 704, 448]
    - [1, 307.512]
  - - [768, 448, 1, 32, 768, 768, 768, 448]
    - [3, 29.7306]
  - - [832, 448, 1, 32, 832, 832, 832, 448]
    - [0, 34.5814]
  - - [896, 448, 1, 32, 896, 896, 896, 448]
    - [2, 40.7985]
  - - [960, 448, 1, 32, 960, 960, 960, 448]
    - [2, 39.8658]
  - - [1024, 448, 1, 32, 1024, 1024, 1024, 448]
    - [2, 42.8819]
  - - [64, 512, 1, 32, 64, 64, 64, 512]
    - [1, 3.44874]
  - - [128, 512, 1, 32, 128, 128, 128, 512]
    - [2, 6.86934]
  - - [192, 512, 1, 32, 192, 192, 192, 512]
    - [3, 10.369]
  - - [256, 512, 1, 32, 256, 256, 256, 512]
    - [1, 13.5592]
  - - [320, 512, 1, 32, 320, 320, 320, 512]
    - [3, 17.1914]
  - - [384, 512, 1, 32, 384, 384, 384, 512]
    - [2, 20.7593]
  - - [448, 512, 1, 32, 448, 448, 448, 512]
    - [2, 24.1348]
  - - [512, 512, 1, 32, 512, 512, 512, 512]
    - [2, 27.674]
  - - [576, 512, 1, 32, 576, 576, 576, 512]
    - [3, 27.5609]
  - - [640, 512, 1, 32, 640, 640, 640, 512]
    - [1, 30.388]
  - - [704, 512, 1, 32, 704, 704, 704, 512]
    - [3, 36.7949]
  - - [768, 512, 1, 32, 768, 768, 768, 512]
    - [3, 39.2313]
  - - [832, 512, 1, 32, 832, 832, 832, 512]
    - [2, 39.7191]
  - - [896, 512, 1, 32, 896, 896, 896, 512]
    - [1, 332.877]
  - - [960, 512, 1, 32, 960, 960, 960, 512]
    - [1, 316.344]
  - - [1024, 512, 1, 32, 1024, 1024, 1024, 512]
    - [0, 48.3693]
  - - [64, 576, 1, 32, 64, 64, 64, 576]
    - [3, 3.86628]
  - - [128, 576, 1, 32, 128, 128, 128, 576]
    - [3, 169.246]
  - - [192, 576, 1, 32, 192, 192, 192, 576]
    - [1, 11.5076]
  - - [256, 576, 1, 32, 256, 256, 256, 576]
    - [3, 240.984]
  - - [320, 576, 1, 32, 320, 320, 320, 576]
    - [1, 19.296]
  - - [384, 576, 1, 32, 384, 384, 384, 576]
    - [2, 23.1318]
  - - [448, 576, 1, 32, 448, 448, 448, 576]
    - [1, 26.9123]
  - - [512, 576, 1, 32, 512, 512, 512, 576]
    - [2, 30.8021]
  - - [576, 576, 1, 32, 576, 576, 576, 576]
    - [2, 272.506]
  - - [640, 576, 1, 32, 640, 640, 640, 576]
    - [3, 122.23]
  - - [704, 576, 1, 32, 704, 704, 704, 576]
    - [2, 41.1188]
  - - [768, 576, 1, 32, 768, 768, 768, 576]
    - [2, 39.9551]
  - - [832, 576, 1, 32, 832, 832, 832, 576]
    - [3, 47.4793]
  - - [896, 576, 1, 32, 896, 896, 896, 576]
    - [1, 46.8264]
  - - [960, 576, 1, 32, 960, 960, 960, 576]
    - [3, 52.0216]
  - - [1024, 576, 1, 32, 1024, 1024, 1024, 576]
    - [0, 53.3314]
  - - [64, 640, 1, 32, 64, 64, 64, 640]
    - [2, 4.331]
  - - [128, 640, 1, 32, 128, 128, 128, 640]
    - [1, 8.52829]
  - - [192, 640, 1, 32, 192, 192, 192, 640]
    - [2, 12.8344]
  - - [256, 640, 1, 32, 256, 256, 256, 640]
    - [2, 17.1025]
  - - [320, 640, 1, 32, 320, 320, 320, 640]
    - [3, 21.6428]
  - - [384, 640, 1, 32, 384, 384, 384, 640]
    - [3, 25.6713]
  - - [448, 640, 1, 32, 448, 448, 448, 640]
    - [3, 29.9567]
  - - [512, 640, 1, 32, 512, 512, 512, 640]
    - [1, 33.6966]
  - - [576, 640, 1, 32, 576, 576, 576, 640]
    - [3, 34.7046]
  - - [640, 640, 1, 32, 640, 640, 640, 640]
    - [3, 38.7075]
  - - [704, 640, 1, 32, 704, 704, 704, 640]
    - [2, 41.7002]
  - - [768, 640, 1, 32, 768, 768, 768, 640]
    - [3, 268.407]
  - - [832, 640, 1, 32, 832, 832, 832, 640]
    - [0, 47.4228]
  - - [896, 640, 1, 32, 896, 896, 896, 640]
    - [3, 53.5508]
  - - [960, 640, 1, 32, 960, 960, 960, 640]
    - [3, 57.2031]
  - - [1024, 640, 1, 32, 1024, 1024, 1024, 640]
    - [3, 61.6009]
  - - [64, 704, 1, 32, 64, 64, 64, 704]
    - [3, 4.74723]
  - - [128, 704, 1, 32, 128, 128, 128, 704]
    - [2, 9.33162]
  - - [192, 704, 1, 32, 192, 192, 192, 704]
    - [3, 14.165]
  - - [256, 704, 1, 32, 256, 256, 256, 704]
    - [3, 18.904]
  - - [320, 704, 1, 32, 320, 320, 320, 704]
    - [2, 23.5144]
  - - [384, 704, 1, 32, 384, 384, 384, 704]
    - [3, 249.301]
  - - [448, 704, 1, 32, 448, 448, 448, 704]
    - [1, 304.727]
  - - [512, 704, 1, 32, 512, 512, 512, 704]
    - [2, 33.8328]
  - - [576, 704, 1, 32, 576, 576, 576, 704]
    - [3, 37.3401]
  - - [640, 704, 1, 32, 640, 640, 640, 704]
    - [2, 41.8036]
  - - [704, 704, 1, 32, 704, 704, 704, 704]
    - [1, 45.7716]
  - - [768, 704, 1, 32, 768, 768, 768, 704]
    - [2, 50.4436]
  - - [832, 704, 1, 32, 832, 832, 832, 704]
    - [3, 53.7131]
  - - [896, 704, 1, 32, 896, 896, 896, 704]
    - [1, 56.0678]
  - - [960, 704, 1, 32, 960, 960, 960, 704]
    - [2, 307.985]
  - - [1024, 704, 1, 32, 1024, 1024, 1024, 704]
    - [2, 67.1612]
  - - [64, 768, 1, 32, 64, 64, 64, 768]
    - [3, 5.19884]
  - - [128, 768, 1, 32, 128, 128, 128, 768]
    - [2, 10.2936]
  - - [192, 768, 1, 32, 192, 192, 192, 768]
    - [2, 15.3667]
  - - [256, 768, 1, 32, 256, 256, 256, 768]
    - [3, 20.6856]
  - - [320, 768, 1, 32, 320, 320, 320, 768]
    - [2, 25.3605]
  - - [384, 768, 1, 32, 384, 384, 384, 768]
    - [3, 30.9622]
  - - [448, 768, 1, 32, 448, 448, 448, 768]
    - [2, 35.5596]
  - - [512, 768, 1, 32, 512, 512, 512, 768]
    - [3, 253.685]
  - - [576, 768, 1, 32, 576, 576, 576, 768]
    - [1, 319.252]
  - - [640, 768, 1, 32, 640, 640, 640, 768]
    - [1, 241.292]
  - - [704, 768, 1, 32, 704, 704, 704, 768]
    - [1, 300.788]
  - - [768, 768, 1, 32, 768, 768, 768, 768]
    - [1, 313.942]
  - - [832, 768, 1, 32, 832, 832, 832, 768]
    - [2, 307.385]
  - - [896, 768, 1, 32, 896, 896, 896, 768]
    - [3, 304.819]
  - - [960, 768, 1, 32, 960, 960, 960, 768]
    - [1, 353.821]
  - - [1024, 768, 1, 32, 1024, 1024, 1024, 768]
    - [1, 358.792]
  - - [64, 832, 1, 32, 64, 64, 64, 832]
    - [3, 87.2025]
  - - [128, 832, 1, 32, 128, 128, 128, 832]
    - [3, 61.0068]
  - - [192, 832, 1, 32, 192, 192, 192, 832]
    - [2, 88.1567]
  - - [256, 832, 1, 32, 256, 256, 256, 832]
    - [3, 121.006]
  - - [320, 832, 1, 32, 320, 320, 320, 832]
    - [3, 145.996]
  - - [384, 832, 1, 32, 384, 384, 384, 832]
    - [1, 159.358]
  - - [448, 832, 1, 32, 448, 448, 448, 832]
    - [2, 196.644]
  - - [512, 832, 1, 32, 512, 512, 512, 832]
    - [3, 39.8819]
  - - [576, 832, 1, 32, 576, 576, 576, 832]
    - [0, 44.024]
  - - [640, 832, 1, 32, 640, 640, 640, 832]
    - [3, 49.7875]
  - - [704, 832, 1, 32, 704, 704, 704, 832]
    - [2, 54.7966]
  - - [768, 832, 1, 32, 768, 768, 768, 832]
    - [3, 59.57]
  - - [832, 832, 1, 32, 832, 832, 832, 832]
    - [2, 64.4347]
  - - [896, 832, 1, 32, 896, 896, 896, 832]
    - [3, 62.0957]
  - - [960, 832, 1, 32, 960, 960, 960, 832]
    - [3, 73.2347]
  - - [1024, 832, 1, 32, 1024, 1024, 1024, 832]
    - [1, 76.9799]
  - - [64, 896, 1, 32, 64, 64, 64, 896]
    - [1, 6.00575]
  - - [128, 896, 1, 32, 128, 128, 128, 896]
    - [2, 11.8982]
  - - [192, 896, 1, 32, 192, 192, 192, 896]
    - [3, 17.0944]
  - - [256, 896, 1, 32, 256, 256, 256, 896]
    - [2, 146.566]
  - - [320, 896, 1, 32, 320, 320, 320, 896]
    - [2, 170.017]
  - - [384, 896, 1, 32, 384, 384, 384, 896]
    - [1, 316.017]
  - - [448, 896, 1, 32, 448, 448, 448, 896]
    - [2, 221.179]
  - - [512, 896, 1, 32, 512, 512, 512, 896]
    - [3, 277.503]
  - - [576, 896, 1, 32, 576, 576, 576, 896]
    - [1, 306.855]
  - - [640, 896, 1, 32, 640, 640, 640, 896]
    - [1, 345.316]
  - - [704, 896, 1, 32, 704, 704, 704, 896]
    - [1, 354.619]
  - - [768, 896, 1, 32, 768, 768, 768, 896]
    - [2, 307.715]
  - - [832, 896, 1, 32, 832, 832, 832, 896]
    - [3, 314.626]
  - - [896, 896, 1, 32, 896, 896, 896, 896]
    - [3, 321.929]
  - - [960, 896, 1, 32, 960, 960, 960, 896]
    - [3, 308.716]
  - - [1024, 896, 1, 32, 1024, 1024, 1024, 896]
    - [2, 320.174]
  - - [64, 960, 1, 32, 64, 64, 64, 960]
    - [2, 65.8874]
  - - [128, 960, 1, 32, 128, 128, 128, 960]
    - [1, 78.462]
  - - [192, 960, 1, 32, 192, 192, 192, 960]
    - [2, 113.755]
  - - [256, 960, 1, 32, 256, 256, 256, 960]
    - [1, 152.986]
  - - [320, 960, 1, 32, 320, 320, 320, 960]
    - [3, 189.192]
  - - [384, 960, 1, 32, 384, 384, 384, 960]
    - [2, 228.769]
  - - [448, 960, 1, 32, 448, 448, 448, 960]
    - [3, 286.598]
  - - [512, 960, 1, 32, 512, 512, 512, 960]
    - [2, 278.088]
  - - [576, 960, 1, 32, 576, 576, 576, 960]
    - [1, 321.953]
  - - [640, 960, 1, 32, 640, 640, 640, 960]
    - [2, 304.064]
  - - [704, 960, 1, 32, 704, 704, 704, 960]
    - [2, 311.268]
  - - [768, 960, 1, 32, 768, 768, 768, 960]
    - [2, 312.572]
  - - [832, 960, 1, 32, 832, 832, 832, 960]
    - [3, 296.232]
  - - [896, 960, 1, 32, 896, 896, 896, 960]
    - [2, 319.019]
  - - [960, 960, 1, 32, 960, 960, 960, 960]
    - [3, 320.415]
  - - [1024, 960, 1, 32, 1024, 1024, 1024, 960]
    - [3, 85.4244]
  - - [64, 1024, 1, 32, 64, 64, 64, 1024]
    - [1, 6.77317]
  - - [128, 1024, 1, 32, 128, 128, 128, 1024]
    - [2, 13.688]
  - - [192, 1024, 1, 32, 192, 192, 192, 1024]
    - [2, 20.3846]
  - - [256, 1024, 1, 32, 256, 256, 256, 1024]
    - [2, 27.202]
  - - [320, 1024, 1, 32, 320, 320, 320, 1024]
    - [2, 33.9201]
  - - [384, 1024, 1, 32, 384, 384, 384, 1024]
    - [3, 39.4082]
  - - [448, 1024, 1, 32, 448, 448, 448, 1024]
    - [1, 36.7013]
  - - [512, 1024, 1, 32, 512, 512, 512, 1024]
    - [2, 292.896]
  - - [576, 1024, 1, 32, 576, 576, 576, 1024]
    - [2, 55.0864]
  - - [640, 1024, 1, 32, 640, 640, 640, 1024]
    - [2, 61.8052]
  - - [704, 1024, 1, 32, 704, 704, 704, 1024]
    - [2, 66.8208]
  - - [768, 1024, 1, 32, 768, 768, 768, 1024]
    - [1, 71.9595]
  - - [832, 1024, 1, 32, 832, 832, 832, 1024]
    - [2, 76.7081]
  - - [896, 1024, 1, 32, 896, 896, 896, 1024]
    - [2, 81.1912]
  - - [960, 1024, 1, 32, 960, 960, 960, 1024]
    - [1, 88.5319]
  - - [1024, 1024, 1, 32, 1024, 1024, 1024, 1024]
    - [2, 90.0024]
- null
- null
- DeviceEfficiency
- Equality
