library/src/amd_detail/rocblaslt/src/Tensile/Logic/asm_full/gfx1201/Equality/gfx1201_Cijk_Alik_Bljk_DB_UserArgs.yaml
- {MinimumRequiredVersion: 4.33.0}
- gfx1201
- gfx1201
- [Device 73f0]
    SolutionIndex: 0
    SolutionNameMin: Cijk_Alik_Bljk_DB_UserArgs_MT8x8x8_SN_GSU1_SU32_SUM0_SUS256_TT1_1_WGM1
    SolutionIndex: 1
    SolutionNameMin: Cijk_Alik_Bljk_DB_UserArgs_MT16x16x8_SN_GSU1_SU32_SUM0_SUS256_TT2_2_WGM1
    SolutionIndex: 2
    SolutionNameMin: Cijk_Alik_Bljk_DB_UserArgs_MT8x8x16_SN_GSU1_SU32_SUM0_SUS256_TT1_1_WGM1
    SolutionIndex: 3
    SolutionNameMin: Cijk_Alik_Bljk_DB_UserArgs_MT16x16x16_SN_GSU1_SU32_SUM0_SUS256_TT2_2_WGM1
- - - [64, 64, 1, 32, 64, 64, 32, 32]
    - [1, 1.15885]
  - - [128, 64, 1, 32, 128, 128, 32, 32]
    - [3, 2.32324]
  - - [192, 64, 1, 32, 192, 192, 32, 32]
    - [2, 3.48116]
  - - [256, 64, 1, 32, 256, 256, 32, 32]
    - [2, 4.67611]
  - - [320, 64, 1, 32, 320, 320, 32, 32]
    - [3, 5.79706]
  - - [384, 64, 1, 32, 384, 384, 32, 32]
    - [3, 72.9529]
  - - [448, 64, 1, 32, 448, 448, 32, 32]
    - [2, 8.11405]
  - - [512, 64, 1, 32, 512, 512, 32, 32]
    - [3, 85.8082]
  - - [576, 64, 1, 32, 576, 576, 32, 32]
    - [3, 10.4384]
  - - [640, 64, 1, 32, 640, 640, 32, 32]
    - [1, 11.5436]
  - - [704, 64, 1, 32, 704, 704, 32, 32]
    - [3, 117.41]
  - - [768, 64, 1, 32, 768, 768, 32, 32]
    - [0, 13.8645]
  - - [832, 64, 1, 32, 832, 832, 32, 32]
    - [3, 14.9874]
  - - [896, 64, 1, 32, 896, 896, 32, 32]
    - [3, 16.1559]
  - - [960, 64, 1, 32, 960, 960, 32, 32]
    - [0, 17.3001]
  - - [1024, 64, 1, 32, 1024, 1024, 32, 32]
    - [2, 18.4299]
  - - [64, 128, 1, 32, 64, 64, 32, 32]
    - [2, 2.31268]
  - - [128, 128, 1, 32, 128, 128, 32, 32]
    - [3, 47.0636]
  - - [192, 128, 1, 32, 192, 192, 32, 32]
    - [2, 75.4733]
  - - [256, 128, 1, 32, 256, 256, 32, 32]
    - [2, 93.9542]
  - - [320, 128, 1, 32, 320, 320, 32, 32]
    - [2, 109.227]
  - - [384, 128, 1, 32, 384, 384, 32, 32]
    - [1, 13.8266]
  - - [448, 128, 1, 32, 448, 448, 32, 32]
    - [3, 124.83]
  - - [512, 128, 1, 32, 512, 512, 32, 32]
    - [3, 18.2917]
  - - [576, 128, 1, 32, 576, 576, 32, 32]
    - [0, 20.7346]
  - - [640, 128, 1, 32, 640, 640, 32, 32]
    - [1, 23.0505]
  - - [704, 128, 1, 32, 704, 704, 32, 32]
    - [2, 25.3635]
  - - [768, 128, 1, 32, 768, 768, 32, 32]
    - [1, 27.6814]
  - - [832, 128, 1, 32, 832, 832, 32, 32]
    - [1, 29.9696]
  - - [896, 128, 1, 32, 896, 896, 32, 32]
    - [2, 32.2652]
  - - [960, 128, 1, 32, 960, 960, 32, 32]
    - [2, 34.5972]
  - - [1024, 128, 1, 32, 1024, 1024, 32, 32]
    - [2, 36.8745]
  - - [64, 192, 1, 32, 64, 64, 32, 32]
    - [0, 3.46628]
  - - [128, 192, 1, 32, 128, 128, 32, 32]
    - [3, 6.93591]
  - - [192, 192, 1, 32, 192, 192, 32, 32]
    - [3, 10.3805]
  - - [256, 192, 1, 32, 256, 256, 32, 32]
    - [2, 13.8505]
  - - [320, 192, 1, 32, 320, 320, 32, 32]
    - [3, 17.316]
  - - [384, 192, 1, 32, 384, 384, 32, 32]
    - [1, 7.68846]
  - - [448, 192, 1, 32, 448, 448, 32, 32]
    - [3, 9.14738]
  - - [512, 192, 1, 32, 512, 512, 32, 32]
    - [2, 10.3843]
  - - [576, 192, 1, 32, 576, 576, 32, 32]
    - [1, 11.6535]
  - - [640, 192, 1, 32, 640, 640, 32, 32]
    - [2, 12.944]
  - - [704, 192, 1, 32, 704, 704, 32, 32]
    - [2, 14.3917]
  - - [768, 192, 1, 32, 768, 768, 32, 32]
    - [2, 15.7115]
  - - [832, 192, 1, 32, 832, 832, 32, 32]
    - [2, 220.337]
  - - [896, 192, 1, 32, 896, 896, 32, 32]
    - [2, 18.3103]
  - - [960, 192, 1, 32, 960, 960, 32, 32]
    - [1, 19.5163]
  - - [1024, 192, 1, 32, 1024, 1024, 32, 32]
    - [3, 137.893]
  - - [64, 256, 1, 32, 64, 64, 32, 32]
    - [3, 5.97204]
  - - [128, 256, 1, 32, 128, 128, 32, 32]
    - [2, 3.49203]
  - - [192, 256, 1, 32, 192, 192, 32, 32]
    - [2, 5.33651]
  - - [256, 256, 1, 32, 256, 256, 32, 32]
    - [3, 6.97152]
  - - [320, 256, 1, 32, 320, 320, 32, 32]
    - [2, 8.71078]
  - - [384, 256, 1, 32, 384, 384, 32, 32]
    - [3, 10.4597]
  - - [448, 256, 1, 32, 448, 448, 32, 32]
    - [1, 203.663]
  - - [512, 256, 1, 32, 512, 512, 32, 32]
    - [2, 13.9188]
  - - [576, 256, 1, 32, 576, 576, 32, 32]
    - [2, 29.9022]
  - - [640, 256, 1, 32, 640, 640, 32, 32]
    - [2, 17.1125]
  - - [704, 256, 1, 32, 704, 704, 32, 32]
    - [2, 19.0225]
  - - [768, 256, 1, 32, 768, 768, 32, 32]
    - [3, 20.817]
  - - [832, 256, 1, 32, 832, 832, 32, 32]
    - [3, 22.6918]
  - - [896, 256, 1, 32, 896, 896, 32, 32]
    - [3, 24.2741]
  - - [960, 256, 1, 32, 960, 960, 32, 32]
    - [3, 20.772]
  - - [1024, 256, 1, 32, 1024, 1024, 32, 32]
    - [3, 237.638]
  - - [64, 320, 1, 32, 64, 64, 32, 32]
    - [2, 62.7739]
  - - [128, 320, 1, 32, 128, 128, 32, 32]
    - [2, 4.32093]
  - - [192, 320, 1, 32, 192, 192, 32, 32]
    - [1, 6.51134]
  - - [256, 320, 1, 32, 256, 256, 32, 32]
    - [3, 8.74086]
  - - [320, 320, 1, 32, 320, 320, 32, 32]
    - [2, 10.8937]
  - - [384, 320, 1, 32, 384, 384, 32, 32]
    - [2, 12.66]
  - - [448, 320, 1, 32, 448, 448, 32, 32]
    - [2, 15.2365]
  - - [512, 320, 1, 32, 512, 512, 32, 32]
    - [2, 17.4799]
  - - [576, 320, 1, 32, 576, 576, 32, 32]
    - [2, 19.514]
  - - [640, 320, 1, 32, 640, 640, 32, 32]
    - [2, 21.8103]
  - - [704, 320, 1, 32, 704, 704, 32, 32]
    - [1, 23.6307]
  - - [768, 320, 1, 32, 768, 768, 32, 32]
    - [1, 25.6416]
  - - [832, 320, 1, 32, 832, 832, 32, 32]
    - [3, 28.0408]
  - - [896, 320, 1, 32, 896, 896, 32, 32]
    - [1, 29.8762]
  - - [960, 320, 1, 32, 960, 960, 32, 32]
    - [1, 32.2111]
  - - [1024, 320, 1, 32, 1024, 1024, 32, 32]
    - [3, 31.1564]
  - - [64, 384, 1, 32, 64, 64, 32, 32]
    - [1, 2.61567]
  - - [128, 384, 1, 32, 128, 128, 32, 32]
    - [3, 5.26381]
  - - [192, 384, 1, 32, 192, 192, 32, 32]
    - [2, 7.81608]
  - - [256, 384, 1, 32, 256, 256, 32, 32]
    - [1, 10.3665]
  - - [320, 384, 1, 32, 320, 320, 32, 32]
    - [2, 13.0853]
  - - [384, 384, 1, 32, 384, 384, 32, 32]
    - [2, 15.5012]
  - - [448, 384, 1, 32, 448, 448, 32, 32]
    - [2, 18.2013]
  - - [512, 384, 1, 32, 512, 512, 32, 32]
    - [3, 21.0359]
  - - [576, 384, 1, 32, 576, 576, 32, 32]
    - [2, 23.2003]
  - - [640, 384, 1, 32, 640, 640, 32, 32]
    - [3, 233.224]
  - - [704, 384, 1, 32, 704, 704, 32, 32]
    - [2, 28.4422]
  - - [768, 384, 1, 32, 768, 768, 32, 32]
    - [2, 30.8141]
  - - [832, 384, 1, 32, 832, 832, 32, 32]
    - [3, 32.5949]
  - - [896, 384, 1, 32, 896, 896, 32, 32]
    - [3, 34.7521]
  - - [960, 384, 1, 32, 960, 960, 32, 32]
    - [3, 33.5664]
  - - [1024, 384, 1, 32, 1024, 1024, 32, 32]
    - [3, 37.4289]
  - - [64, 448, 1, 32, 64, 64, 32, 32]
    - [1, 3.0641]
  - - [128, 448, 1, 32, 128, 128, 32, 32]
    - [2, 6.09522]
  - - [192, 448, 1, 32, 192, 192, 32, 32]
    - [1, 179.903]
  - - [256, 448, 1, 32, 256, 256, 32, 32]
    - [2, 11.7963]
  - - [320, 448, 1, 32, 320, 320, 32, 32]
    - [2, 15.1838]
  - - [384, 448, 1, 32, 384, 384, 32, 32]
    - [3, 18.3064]
  - - [448, 448, 1, 32, 448, 448, 32, 32]
    - [3, 21.3841]
  - - [512, 448, 1, 32, 512, 512, 32, 32]
    - [3, 18.3367]
  - - [576, 448, 1, 32, 576, 576, 32, 32]
    - [3, 27.083]
  - - [640, 448, 1, 32, 640, 640, 32, 32]
    - [3, 26.9496]
  - - [704, 448, 1, 32, 704, 704, 32, 32]
    - [1, 32.8944]
  - - [768, 448, 1, 32, 768, 768, 32, 32]
    - [3, 35.0341]
  - - [832, 448, 1, 32, 832, 832, 32, 32]
    - [2, 26.0992]
  - - [896, 448, 1, 32, 896, 896, 32, 32]
    - [1, 41.1343]
  - - [960, 448, 1, 32, 960, 960, 32, 32]
    - [3, 40.0223]
  - - [1024, 448, 1, 32, 1024, 1024, 32, 32]
    - [3, 38.111]
  - - [64, 512, 1, 32, 64, 64, 32, 32]
    - [2, 3.53227]
  - - [128, 512, 1, 32, 128, 128, 32, 32]
    - [1, 6.93958]
  - - [192, 512, 1, 32, 192, 192, 32, 32]
    - [3, 10.4611]
  - - [256, 512, 1, 32, 256, 256, 32, 32]
    - [1, 13.7945]
  - - [320, 512, 1, 32, 320, 320, 32, 32]
    - [2, 17.3286]
  - - [384, 512, 1, 32, 384, 384, 32, 32]
    - [2, 20.6608]
  - - [448, 512, 1, 32, 448, 448, 32, 32]
    - [2, 24.2853]
  - - [512, 512, 1, 32, 512, 512, 32, 32]
    - [1, 27.4679]
  - - [576, 512, 1, 32, 576, 576, 32, 32]
    - [0, 17.8717]
  - - [640, 512, 1, 32, 640, 640, 32, 32]
    - [2, 270.667]
  - - [704, 512, 1, 32, 704, 704, 32, 32]
    - [2, 36.9238]
  - - [768, 512, 1, 32, 768, 768, 32, 32]
    - [3, 39.3362]
  - - [832, 512, 1, 32, 832, 832, 32, 32]
    - [3, 40.6126]
  - - [896, 512, 1, 32, 896, 896, 32, 32]
    - [3, 37.5678]
  - - [960, 512, 1, 32, 960, 960, 32, 32]
    - [2, 46.6799]
  - - [1024, 512, 1, 32, 1024, 1024, 32, 32]
    - [1, 49.4521]
  - - [64, 576, 1, 32, 64, 64, 32, 32]
    - [3, 4.16165]
  - - [128, 576, 1, 32, 128, 128, 32, 32]
    - [1, 165.211]
  - - [192, 576, 1, 32, 192, 192, 32, 32]
    - [1, 11.6914]
  - - [256, 576, 1, 32, 256, 256, 32, 32]
    - [2, 15.6145]
  - - [320, 576, 1, 32, 320, 320, 32, 32]
    - [3, 19.5201]
  - - [384, 576, 1, 32, 384, 384, 32, 32]
    - [2, 23.3173]
  - - [448, 576, 1, 32, 448, 448, 32, 32]
    - [2, 26.4926]
  - - [512, 576, 1, 32, 512, 512, 32, 32]
    - [2, 30.8559]
  - - [576, 576, 1, 32, 576, 576, 32, 32]
    - [1, 25.7695]
  - - [640, 576, 1, 32, 640, 640, 32, 32]
    - [1, 38.4963]
  - - [704, 576, 1, 32, 704, 704, 32, 32]
    - [1, 38.0312]
  - - [768, 576, 1, 32, 768, 768, 32, 32]
    - [1, 45.0796]
  - - [832, 576, 1, 32, 832, 832, 32, 32]
    - [2, 47.4484]
  - - [896, 576, 1, 32, 896, 896, 32, 32]
    - [2, 48.7268]
  - - [960, 576, 1, 32, 960, 960, 32, 32]
    - [2, 49.2269]
  - - [1024, 576, 1, 32, 1024, 1024, 32, 32]
    - [2, 55.1113]
  - - [64, 640, 1, 32, 64, 64, 32, 32]
    - [1, 4.31759]
  - - [128, 640, 1, 32, 128, 128, 32, 32]
    - [3, 8.77126]
  - - [192, 640, 1, 32, 192, 192, 32, 32]
    - [2, 13.0281]
  - - [256, 640, 1, 32, 256, 256, 32, 32]
    - [3, 17.3725]
  - - [320, 640, 1, 32, 320, 320, 32, 32]
    - [2, 21.5674]
  - - [384, 640, 1, 32, 384, 384, 32, 32]
    - [2, 25.8732]
  - - [448, 640, 1, 32, 448, 448, 32, 32]
    - [3, 233.34]
  - - [512, 640, 1, 32, 512, 512, 32, 32]
    - [1, 29.7957]
  - - [576, 640, 1, 32, 576, 576, 32, 32]
    - [2, 37.6816]
  - - [640, 640, 1, 32, 640, 640, 32, 32]
    - [3, 39.1071]
  - - [704, 640, 1, 32, 704, 704, 32, 32]
    - [3, 44.6269]
  - - [768, 640, 1, 32, 768, 768, 32, 32]
    - [0, 45.3769]
  - - [832, 640, 1, 32, 832, 832, 32, 32]
    - [1, 50.2744]
  - - [896, 640, 1, 32, 896, 896, 32, 32]
    - [0, 53.1083]
  - - [960, 640, 1, 32, 960, 960, 32, 32]
    - [3, 55.344]
  - - [1024, 640, 1, 32, 1024, 1024, 32, 32]
    - [1, 61.5259]
  - - [64, 704, 1, 32, 64, 64, 32, 32]
    - [1, 4.78203]
  - - [128, 704, 1, 32, 128, 128, 32, 32]
    - [1, 9.11814]
  - - [192, 704, 1, 32, 192, 192, 32, 32]
    - [3, 14.38]
  - - [256, 704, 1, 32, 256, 256, 32, 32]
    - [3, 19.1484]
  - - [320, 704, 1, 32, 320, 320, 32, 32]
    - [2, 23.4029]
  - - [384, 704, 1, 32, 384, 384, 32, 32]
    - [1, 28.2559]
  - - [448, 704, 1, 32, 448, 448, 32, 32]
    - [3, 22.4257]
  - - [512, 704, 1, 32, 512, 512, 32, 32]
    - [3, 36.3124]
  - - [576, 704, 1, 32, 576, 576, 32, 32]
    - [0, 37.5889]
  - - [640, 704, 1, 32, 640, 640, 32, 32]
    - [3, 42.7372]
  - - [704, 704, 1, 32, 704, 704, 32, 32]
    - [2, 46.9011]
  - - [768, 704, 1, 32, 768, 768, 32, 32]
    - [2, 50.9832]
  - - [832, 704, 1, 32, 832, 832, 32, 32]
    - [2, 54.8969]
  - - [896, 704, 1, 32, 896, 896, 32, 32]
    - [1, 49.5075]
  - - [960, 704, 1, 32, 960, 960, 32, 32]
    - [2, 63.639]
  - - [1024, 704, 1, 32, 1024, 1024, 32, 32]
    - [2, 66.0261]
  - - [64, 768, 1, 32, 64, 64, 32, 32]
    - [1, 5.19274]
  - - [128, 768, 1, 32, 128, 128, 32, 32]
    - [2, 10.3992]
  - - [192, 768, 1, 32, 192, 192, 32, 32]
    - [3, 223.418]
  - - [256, 768, 1, 32, 256, 256, 32, 32]
    - [1, 266.136]
  - - [320, 768, 1, 32, 320, 320, 32, 32]
    - [3, 231.986]
  - - [384, 768, 1, 32, 384, 384, 32, 32]
    - [3, 30.6112]
  - - [448, 768, 1, 32, 448, 448, 32, 32]
    - [2, 31.5821]
  - - [512, 768, 1, 32, 512, 512, 32, 32]
    - [1, 40.6042]
  - - [576, 768, 1, 32, 576, 576, 32, 32]
    - [3, 41.8486]
  - - [640, 768, 1, 32, 640, 640, 32, 32]
    - [1, 41.7104]
  - - [704, 768, 1, 32, 704, 704, 32, 32]
    - [3, 275.064]
  - - [768, 768, 1, 32, 768, 768, 32, 32]
    - [1, 55.7396]
  - - [832, 768, 1, 32, 832, 832, 32, 32]
    - [3, 51.1568]
  - - [896, 768, 1, 32, 896, 896, 32, 32]
    - [1, 61.4199]
  - - [960, 768, 1, 32, 960, 960, 32, 32]
    - [3, 67.4196]
  - - [1024, 768, 1, 32, 1024, 1024, 32, 32]
    - [1, 73.2776]
  - - [64, 832, 1, 32, 64, 64, 32, 32]
    - [1, 5.63096]
  - - [128, 832, 1, 32, 128, 128, 32, 32]
    - [1, 11.1455]
  - - [192, 832, 1, 32, 192, 192, 32, 32]
    - [3, 16.7104]
  - - [256, 832, 1, 32, 256, 256, 32, 32]
    - [1, 22.388]
  - - [320, 832, 1, 32, 320, 320, 32, 32]
    - [0, 24.4102]
  - - [384, 832, 1, 32, 384, 384, 32, 32]
    - [1, 29.782]
  - - [448, 832, 1, 32, 448, 448, 32, 32]
    - [0, 31.3102]
  - - [512, 832, 1, 32, 512, 512, 32, 32]
    - [1, 39.0439]
  - - [576, 832, 1, 32, 576, 576, 32, 32]
    - [3, 44.3718]
  - - [640, 832, 1, 32, 640, 640, 32, 32]
    - [3, 48.3954]
  - - [704, 832, 1, 32, 704, 704, 32, 32]
    - [3, 45.2543]
  - - [768, 832, 1, 32, 768, 768, 32, 32]
    - [1, 56.8015]
  - - [832, 832, 1, 32, 832, 832, 32, 32]
    - [1, 54.7432]
  - - [896, 832, 1, 32, 896, 896, 32, 32]
    - [3, 58.3343]
  - - [960, 832, 1, 32, 960, 960, 32, 32]
    - [3, 71.7503]
  - - [1024, 832, 1, 32, 1024, 1024, 32, 32]
    - [1, 79.1776]
  - - [64, 896, 1, 32, 64, 64, 32, 32]
    - [1, 6.06912]
  - - [128, 896, 1, 32, 128, 128, 32, 32]
    - [2, 12.1569]
  - - [192, 896, 1, 32, 192, 192, 32, 32]
    - [2, 18.2019]
  - - [256, 896, 1, 32, 256, 256, 32, 32]
    - [2, 245.482]
  - - [320, 896, 1, 32, 320, 320, 32, 32]
    - [1, 29.0058]
  - - [384, 896, 1, 32, 384, 384, 32, 32]
    - [2, 35.5104]
  - - [448, 896, 1, 32, 448, 448, 32, 32]
    - [3, 28.1229]
  - - [512, 896, 1, 32, 512, 512, 32, 32]
    - [0, 42.3518]
  - - [576, 896, 1, 32, 576, 576, 32, 32]
    - [2, 48.9644]
  - - [640, 896, 1, 32, 640, 640, 32, 32]
    - [2, 45.7064]
  - - [704, 896, 1, 32, 704, 704, 32, 32]
    - [1, 59.4734]
  - - [768, 896, 1, 32, 768, 768, 32, 32]
    - [3, 51.5563]
  - - [832, 896, 1, 32, 832, 832, 32, 32]
    - [1, 70.0206]
  - - [896, 896, 1, 32, 896, 896, 32, 32]
    - [2, 72.8327]
  - - [960, 896, 1, 32, 960, 960, 32, 32]
    - [3, 75.7387]
  - - [1024, 896, 1, 32, 1024, 1024, 32, 32]
    - [3, 316.72]
  - - [64, 960, 1, 32, 64, 64, 32, 32]
    - [3, 47.761]
  - - [128, 960, 1, 32, 128, 128, 32, 32]
    - [3, 73.8913]
  - - [192, 960, 1, 32, 192, 192, 32, 32]
    - [2, 19.4311]
  - - [256, 960, 1, 32, 256, 256, 32, 32]
    - [2, 24.6167]
  - - [320, 960, 1, 32, 320, 320, 32, 32]
    - [2, 32.1022]
  - - [384, 960, 1, 32, 384, 384, 32, 32]
    - [3, 37.3233]
  - - [448, 960, 1, 32, 448, 448, 32, 32]
    - [0, 39.6573]
  - - [512, 960, 1, 32, 512, 512, 32, 32]
    - [1, 317.879]
  - - [576, 960, 1, 32, 576, 576, 32, 32]
    - [2, 47.8887]
  - - [640, 960, 1, 32, 640, 640, 32, 32]
    - [3, 45.7758]
  - - [704, 960, 1, 32, 704, 704, 32, 32]
    - [0, 62.4041]
  - - [768, 960, 1, 32, 768, 768, 32, 32]
    - [1, 69.5882]
  - - [832, 960, 1, 32, 832, 832, 32, 32]
    - [2, 72.5228]
  - - [896, 960, 1, 32, 896, 896, 32, 32]
    - [2, 77.1612]
  - - [960, 960, 1, 32, 960, 960, 32, 32]
    - [1, 84.0368]
  - - [1024, 960, 1, 32, 1024, 1024, 32, 32]
    - [3, 84.7878]
  - - [64, 1024, 1, 32, 64, 64, 32, 32]
    - [2, 6.94924]
  - - [128, 1024, 1, 32, 128, 128, 32, 32]
    - [1, 13.864]
  - - [192, 1024, 1, 32, 192, 192, 32, 32]
    - [3, 20.9498]
  - - [256, 1024, 1, 32, 256, 256, 32, 32]
    - [3, 27.3377]
  - - [320, 1024, 1, 32, 320, 320, 32, 32]
    - [1, 30.6626]
  - - [384, 1024, 1, 32, 384, 384, 32, 32]
    - [3, 37.2913]
  - - [448, 1024, 1, 32, 448, 448, 32, 32]
    - [3, 43.6989]
  - - [512, 1024, 1, 32, 512, 512, 32, 32]
    - [1, 49.0983]
  - - [576, 1024, 1, 32, 576, 576, 32, 32]
    - [2, 55.7223]
  - - [640, 1024, 1, 32, 640, 640, 32, 32]
    - [1, 61.4772]
  - - [704, 1024, 1, 32, 704, 704, 32, 32]
    - [1, 65.5096]
  - - [768, 1024, 1, 32, 768, 768, 32, 32]
    - [2, 71.6308]
  - - [832, 1024, 1, 32, 832, 832, 32, 32]
    - [3, 76.1074]
  - - [896, 1024, 1, 32, 896, 896, 32, 32]
    - [1, 83.761]
  - - [960, 1024, 1, 32, 960, 960, 32, 32]
    - [0, 85.4755]
  - - [1024, 1024, 1, 32, 1024, 1024, 32, 32]
    - [0, 519.579]
- null
- null
- DeviceEfficiency
- Equality
