tensilelite/try32/yamlGen/tunning_BFVF_Round1/tunning_BFVF_Round1_17/3_LibraryLogic/aldebaran_Cijk_Ailk_Bljk_HHS_BH.yaml
- {MinimumRequiredVersion: 4.33.0}
- aldebaran
- gfx90a
- [Device 0050, Device 0051, Device 0052, Device 0054, Device 0062, Device 7400, Device
    SolutionIndex: 0
    SolutionNameMin: Cijk_Ailk_Bljk_HHS_BH_MT128x256x16_MI32x32x8x1_SN_1LDSB1_GRVW4_LPB4_LRVW4_MIWT2_4_PLR1_SS0_SRVW0_SVW4_VW1_WG64_4_1
    SolutionIndex: 1
    SolutionNameMin: Cijk_Ailk_Bljk_HHS_BH_MT128x256x32_MI32x32x8x1_SN_1LDSB0_GRVW8_LPB8_LRVW4_MIWT2_4_PLR1_SS0_SRVW0_SVW4_VW1_WG64_4_1
    SolutionIndex: 2
    SolutionNameMin: Cijk_Ailk_Bljk_HHS_BH_MT128x256x32_MI32x32x8x1_SN_1LDSB1_GRVW8_LPB8_LRVW4_MIWT2_4_PLR1_SS0_SRVW0_SVW4_VW1_WG64_4_1
    SolutionIndex: 3
    SolutionNameMin: Cijk_Ailk_Bljk_HHS_BH_MT128x256x32_MI32x32x8x1_SN_1LDSB1_GRVW8_LPB8_LRVW8_MIWT2_4_PLR5_SS0_SRVW0_SVW4_VW1_WG64_4_1
    SolutionIndex: 4
    SolutionNameMin: Cijk_Ailk_Bljk_HHS_BH_MT128x256x32_MI32x32x8x1_SN_1LDSB0_GRVW8_LPB8_LRVW4_MIWT2_4_PLR1_SS0_SRVW4_SVW4_VW1_WG64_4_1
    SolutionIndex: 5
    SolutionNameMin: Cijk_Ailk_Bljk_HHS_BH_MT128x256x32_MI32x32x8x1_SN_1LDSB0_GRVW8_LPB8_LRVW4_MIWT4_2_PLR1_SS0_SRVW4_SVW4_VW1_WG32_8_1
    SolutionIndex: 6
    SolutionNameMin: Cijk_Ailk_Bljk_HHS_BH_MT128x256x32_MI32x32x8x1_SN_1LDSB1_GRVW8_LPB8_LRVW4_MIWT2_4_PLR5_SS0_SRVW4_SVW4_VW1_WG64_4_1
    SolutionIndex: 7
    SolutionNameMin: Cijk_Ailk_Bljk_HHS_BH_MT128x256x32_MI32x32x8x1_SN_1LDSB1_GRVW8_LPB8_LRVW8_MIWT2_4_PLR5_SS0_SRVW4_SVW4_VW1_WG64_4_1
    SolutionIndex: 8
    SolutionNameMin: Cijk_Ailk_Bljk_HHS_BH_MT128x256x32_MI32x32x8x1_SN_1LDSB1_GRVW8_LPB8_LRVW8_MIWT4_2_PLR5_SS0_SRVW4_SVW4_VW1_WG32_8_1
    SolutionIndex: 9
    SolutionNameMin: Cijk_Ailk_Bljk_HHS_BH_MT128x256x32_MI32x32x8x1_SN_1LDSB0_GRVW2_LPB4_LRVW4_MIWT2_4_PLR1_SS1_SRVW0_SVW2_VW2_WG64_4_1
    SolutionIndex: 10
    SolutionNameMin: Cijk_Ailk_Bljk_HHS_BH_MT128x256x32_MI32x32x8x1_SN_1LDSB0_GRVW2_LPB4_LRVW4_MIWT2_4_PLR5_SS1_SRVW0_SVW2_VW2_WG64_4_1
    SolutionIndex: 11
    SolutionNameMin: Cijk_Ailk_Bljk_HHS_BH_MT128x256x32_MI32x32x8x1_SN_1LDSB0_GRVW8_LPB8_LRVW8_MIWT2_4_PLR5_SS1_SRVW0_SVW2_VW2_WG64_4_1
    SolutionIndex: 12
    SolutionNameMin: Cijk_Ailk_Bljk_HHS_BH_MT128x256x32_MI32x32x8x1_SN_1LDSB0_GRVW8_LPB8_LRVW8_MIWT4_2_PLR5_SS1_SRVW0_SVW4_VW4_WG32_8_1
    SolutionIndex: 13
    SolutionNameMin: Cijk_Ailk_Bljk_HHS_BH_MT128x256x32_MI32x32x8x1_SN_1LDSB1_GRVW8_LPB8_LRVW4_MIWT2_4_PLR1_SS1_SRVW0_SVW2_VW2_WG64_4_1
    SolutionIndex: 14
    SolutionNameMin: Cijk_Ailk_Bljk_HHS_BH_MT128x256x32_MI32x32x8x1_SN_1LDSB1_GRVW8_LPB8_LRVW8_MIWT2_4_PLR5_SS1_SRVW0_SVW2_VW2_WG64_4_1
    SolutionIndex: 15
    SolutionNameMin: Cijk_Ailk_Bljk_HHS_BH_MT128x256x32_MI32x32x8x1_SN_1LDSB1_GRVW8_LPB8_LRVW8_MIWT4_2_PLR5_SS1_SRVW0_SVW4_VW4_WG32_8_1
- - - [1104, 1335, 1, 4608, 1104, 1104, 1104, 4608]
    - [1, 61628.2]
  - - [1104, 1408, 1, 4608, 1104, 1104, 1104, 4608]
    - [4, 65173.2]
  - - [4608, 1, 1, 320, 4608, 4608, 4608, 320]
    - [0, 156.601]
  - - [4608, 16, 1, 320, 4608, 4608, 4608, 320]
    - [0, 2476.16]
  - - [4608, 1335, 1, 320, 4608, 4608, 4608, 320]
    - [7, 104221.0]
  - - [4608, 1408, 1, 320, 4608, 4608, 4608, 320]
    - [7, 108224.0]
  - - [768, 1335, 1, 4608, 768, 768, 768, 4608]
    - [11, 46169.9]
  - - [768, 1408, 1, 4608, 768, 768, 768, 4608]
    - [5, 48546.5]
  - - [4608, 1, 1, 768, 4608, 4608, 4608, 768]
    - [2, 196.782]
  - - [4608, 16, 1, 768, 4608, 4608, 4608, 768]
    - [3, 3126.27]
  - - [4608, 1335, 1, 768, 4608, 4608, 4608, 768]
    - [6, 114761.0]
  - - [4608, 1408, 1, 768, 4608, 4608, 4608, 768]
    - [6, 119733.0]
  - - [320, 8192, 1, 320, 320, 320, 320, 320]
    - [15, 66873.2]
  - - [640, 2048, 1, 640, 640, 640, 640, 640]
    - [13, 49554.3]
  - - [320, 8192, 1, 1280, 320, 320, 320, 1280]
    - [12, 84426.1]
  - - [1280, 512, 1, 1280, 1280, 1280, 1280, 1280]
    - [14, 30340.6]
  - - [10240, 512, 1, 1280, 10240, 10240, 10240, 1280]
    - [13, 112659.0]
  - - [2560, 8192, 1, 320, 2560, 2560, 2560, 320]
    - [7, 123216.0]
  - - [5120, 2048, 1, 640, 5120, 5120, 5120, 640]
    - [14, 124681.0]
  - - [1280, 512, 1, 5120, 1280, 1280, 1280, 5120]
    - [10, 28138.2]
  - - [640, 2048, 1, 2560, 640, 640, 640, 2560]
    - [9, 53505.4]
  - - [320, 154, 1, 768, 320, 320, 320, 768]
    - [0, 1837.23]
  - - [1280, 154, 1, 768, 1280, 1280, 1280, 768]
    - [8, 8142.61]
- null
- null
- DeviceEfficiency
