library/src/amd_detail/rocblaslt/src/Tensile/Logic/asm_full/navi33/GridBased/navi33_Cijk_Alik_Bjlk_HSS_BH_HAS_SAV_UserArgs.yaml
- {MinimumRequiredVersion: 4.33.0}
- navi33
- gfx1102
- [Device 73f0]
    SolutionIndex: 0
    SolutionNameMin: Cijk_Alik_Bjlk_HSS_BH_HAS_SAV_UserArgs_MT64x96x32_MI16x16x1_SN_LDSB0_GRVWB8_GSU1_LBSPPA128_LBSPPB3072_MIWT2_3_NLCB3_SS0_SU32_SUM0_SUS256_TLDS1_WG32_4_1_WGM8
    SolutionIndex: 1
    SolutionNameMin: Cijk_Alik_Bjlk_HSS_BH_HAS_SAV_UserArgs_MT48x128x32_MI16x16x1_SN_LDSB0_GRVWB8_GSU1_LBSPPA128_LBSPPB4096_MIWT3_2_NLCB1_SS0_SU32_SUM0_SUS256_TLDS1_WG16_8_1_WGM8
    SolutionIndex: 2
    SolutionNameMin: Cijk_Alik_Bjlk_HSS_BH_HAS_SAV_UserArgs_MT32x32x32_MI16x16x1_SN_LDSB0_GRVWB2_GSU1_LBSPPA128_LBSPPB1024_MIWT1_1_NLCB1_SS1_SU32_SUM0_SUS256_TLDS1_WG32_4_1_WGM8
    SolutionIndex: 3
    SolutionNameMin: Cijk_Alik_Bjlk_HSS_BH_HAS_SAV_UserArgs_MT128x48x32_MI16x16x1_SN_LDSB0_GRVWB2_GSU1_LBSPPA128_LBSPPB1536_MIWT2_3_NLCB3_SS1_SU32_SUM0_SUS256_TLDS1_WG64_2_1_WGM8
    SolutionIndex: 4
    SolutionNameMin: Cijk_Alik_Bjlk_HSS_BH_HAS_SAV_UserArgs_MT48x64x32_MI16x16x1_SN_LDSB0_GRVWB2_GSU1_LBSPPA128_LBSPPB2048_MIWT3_1_NLCB1_SS1_SU32_SUM0_SUS256_TLDS1_WG16_8_1_WGM8
    SolutionIndex: 5
    SolutionNameMin: Cijk_Alik_Bjlk_HSS_BH_HAS_SAV_UserArgs_MT64x96x32_MI16x16x1_SN_LDSB0_GRVWB2_GSU1_LBSPPA128_LBSPPB3072_MIWT2_3_NLCB3_SS1_SU32_SUM0_SUS256_TLDS1_WG32_4_1_WGM8
    SolutionIndex: 6
    SolutionNameMin: Cijk_Alik_Bjlk_HSS_BH_HAS_SAV_UserArgs_MT32x32x64_MI16x16x1_SN_LDSB0_GRVWB2_GSU1_LBSPPA128_LBSPPB1024_MIWT1_1_NLCB1_SS1_SU32_SUM0_SUS256_TLDS1_WG32_4_1_WGM8
    SolutionIndex: 7
    SolutionNameMin: Cijk_Alik_Bjlk_HSS_BH_HAS_SAV_UserArgs_MT16x64x64_MI16x16x1_SN_LDSB0_GRVWB2_GSU1_LBSPPA128_LBSPPB2048_MIWT1_1_NLCB1_SS1_SU32_SUM0_SUS256_TLDS1_WG16_8_1_WGM8
- - - [64, 64, 1, 64, 64, 64, 64, 64]
    - [7, 118.474]
  - - [128, 128, 1, 128, 128, 128, 128, 128]
    - [2, 932.982]
  - - [256, 256, 1, 256, 256, 256, 256, 256]
    - [6, 5432.97]
  - - [512, 512, 1, 512, 512, 512, 512, 512]
    - [4, 23684.6]
  - - [1024, 1024, 1, 1024, 1024, 1024, 1024, 1024]
    - [3, 44018.4]
  - - [1536, 1536, 1, 1536, 1536, 1536, 1536, 1536]
    - [5, 55525.7]
  - - [2048, 2048, 1, 2048, 2048, 2048, 2048, 2048]
    - [3, 52925.9]
  - - [2560, 2560, 1, 2560, 2560, 2560, 2560, 2560]
    - [0, 59600.8]
  - - [3072, 3072, 1, 3072, 3072, 3072, 3072, 3072]
    - [0, 63158.6]
  - - [3584, 3584, 1, 3584, 3584, 3584, 3584, 3584]
    - [1, 65516.1]
  - - [4096, 4096, 1, 4096, 4096, 4096, 4096, 4096]
    - [0, 67067.8]
- null
- null
- DeviceEfficiency
- GridBased
