library/src/amd_detail/rocblaslt/src/Tensile/Logic/asm_full/navi33/GridBased/navi33_Cijk_Alik_Bljk_I8BH_HAI_SAV_UserArgs.yaml
- {MinimumRequiredVersion: 4.33.0}
- navi33
- gfx1102
- [Device 73f0]
    SolutionIndex: 0
    SolutionNameMin: Cijk_Alik_Bljk_I8BH_HAI_SAV_UserArgs_MT32x32x32_MI16x16x1_SN_GRVWB8_GSU1_LBSPPA128_LBSPPB128_LPA32_LPB32_MIWT1_1_SS0_SU32_SUM0_SUS256_TLDS1_WG32_4_1_WGM8
    SolutionIndex: 1
    SolutionNameMin: Cijk_Alik_Bljk_I8BH_HAI_SAV_UserArgs_MT64x16x32_MI16x16x1_SN_GRVWB4_GSU1_LBSPPA128_LBSPPB128_LPA32_LPB32_MIWT1_1_SS1_SU32_SUM0_SUS256_TLDS1_WG64_2_1_WGM8
    SolutionIndex: 2
    SolutionNameMin: Cijk_Alik_Bljk_I8BH_HAI_SAV_UserArgs_MT64x96x32_MI16x16x1_SN_GRVWB8_GSU1_LBSPPA128_LBSPPB128_LPA32_LPB32_MIWT2_3_SS1_SU32_SUM0_SUS256_TLDS1_WG32_4_1_WGM8
    SolutionIndex: 3
    SolutionNameMin: Cijk_Alik_Bljk_I8BH_HAI_SAV_UserArgs_MT16x64x64_MI16x16x1_SN_GRVWB16_GSU1_LBSPPA128_LBSPPB128_LPA32_LPB32_MIWT1_1_SS1_SU32_SUM0_SUS256_TLDS1_WG16_8_1_WGM8
    SolutionIndex: 4
    SolutionNameMin: Cijk_Alik_Bljk_I8BH_HAI_SAV_UserArgs_MT64x96x64_MI16x16x1_SN_GRVWB16_GSU1_LBSPPA128_LBSPPB128_LPA32_LPB32_MIWT2_3_SS1_SU32_SUM0_SUS256_TLDS1_WG32_4_1_WGM8
    SolutionIndex: 5
    SolutionNameMin: Cijk_Alik_Bljk_I8BH_HAI_SAV_UserArgs_MT16x128x64_MI16x16x1_SN_GRVWB16_GSU1_LBSPPA128_LBSPPB128_LPA32_LPB32_MIWT1_2_SS1_SU32_SUM0_SUS256_TLDS1_WG16_8_1_WGM8
    SolutionIndex: 6
    SolutionNameMin: Cijk_Alik_Bljk_I8BH_HAI_SAV_UserArgs_MT48x128x64_MI16x16x1_SN_GRVWB16_GSU1_LBSPPA128_LBSPPB128_LPA32_LPB32_MIWT3_2_SS1_SU32_SUM0_SUS256_TLDS1_WG16_8_1_WGM8
    SolutionIndex: 7
    SolutionNameMin: Cijk_Alik_Bljk_I8BH_HAI_SAV_UserArgs_MT32x192x64_MI16x16x1_SN_GRVWB16_GSU1_LBSPPA128_LBSPPB128_LPA32_LPB32_MIWT2_3_SS1_SU32_SUM0_SUS256_TLDS1_WG16_8_1_WGM8
- - - [64, 64, 1, 64, 64, 64, 64, 64]
    - [1, 117.245]
  - - [128, 128, 1, 128, 128, 128, 128, 128]
    - [3, 764.934]
  - - [256, 256, 1, 256, 256, 256, 256, 256]
    - [0, 3535.9]
  - - [512, 512, 1, 512, 512, 512, 512, 512]
    - [5, 27169.0]
  - - [1024, 1024, 1, 1024, 1024, 1024, 1024, 1024]
    - [7, 75923.3]
  - - [1536, 1536, 1, 1536, 1536, 1536, 1536, 1536]
    - [4, 89086.3]
  - - [2048, 2048, 1, 2048, 2048, 2048, 2048, 2048]
    - [4, 88462.1]
  - - [2560, 2560, 1, 2560, 2560, 2560, 2560, 2560]
    - [2, 84945.2]
  - - [3072, 3072, 1, 3072, 3072, 3072, 3072, 3072]
    - [4, 90769.3]
  - - [3584, 3584, 1, 3584, 3584, 3584, 3584, 3584]
    - [6, 94561.8]
  - - [4096, 4096, 1, 4096, 4096, 4096, 4096, 4096]
    - [6, 96751.3]
- null
- null
- DeviceEfficiency
- GridBased
