library/src/amd_detail/rocblaslt/src/Tensile/Logic/asm_full/navi33/GridBased/navi33_Cijk_Ailk_Bljk_HSS_BH_Bias_HAH.yaml
- {MinimumRequiredVersion: 4.33.0}
- navi33
- gfx1102
- [Device 73f0]
    SolutionIndex: 0
    SolutionNameMin: Cijk_Ailk_Bljk_HSS_BH_Bias_HAH_MT32x32x64_MI16x16x16x1_SN_MIWT1_1_WG32_4_1
    SolutionIndex: 1
    SolutionNameMin: Cijk_Ailk_Bljk_HSS_BH_Bias_HAH_MT16x16x64_MI16x16x16x1_SN_MIWT1_1_WG16_2_1
    SolutionIndex: 2
    SolutionNameMin: Cijk_Ailk_Bljk_HSS_BH_Bias_HAH_MT32x16x64_MI16x16x16x1_SN_MIWT1_1_WG32_2_1
    SolutionIndex: 3
    SolutionNameMin: Cijk_Ailk_Bljk_HSS_BH_Bias_HAH_MT16x32x64_MI16x16x16x1_SN_MIWT1_1_WG16_4_1
- - - [64, 64, 1, 64, 64, 64, 64, 64]
    - [1, 0.092]
  - - [192, 64, 1, 64, 192, 192, 192, 64]
    - [1, 0.279]
  - - [320, 64, 1, 64, 320, 320, 320, 64]
    - [2, 0.458]
  - - [448, 64, 1, 64, 448, 448, 448, 64]
    - [2, 0.628]
  - - [576, 64, 1, 64, 576, 576, 576, 64]
    - [2, 0.791]
  - - [704, 64, 1, 64, 704, 704, 704, 64]
    - [0, 0.96]
  - - [832, 64, 1, 64, 832, 832, 832, 64]
    - [2, 1.105]
  - - [960, 64, 1, 64, 960, 960, 960, 64]
    - [2, 1.177]
  - - [1088, 64, 1, 64, 1088, 1088, 1088, 64]
    - [2, 1.319]
  - - [1216, 64, 1, 64, 1216, 1216, 1216, 64]
    - [2, 1.449]
  - - [1344, 64, 1, 64, 1344, 1344, 1344, 64]
    - [2, 1.602]
  - - [1472, 64, 1, 64, 1472, 1472, 1472, 64]
    - [2, 1.751]
  - - [1600, 64, 1, 64, 1600, 1600, 1600, 64]
    - [0, 1.809]
  - - [1728, 64, 1, 64, 1728, 1728, 1728, 64]
    - [2, 2.006]
  - - [1856, 64, 1, 64, 1856, 1856, 1856, 64]
    - [2, 2.106]
  - - [1984, 64, 1, 64, 1984, 1984, 1984, 64]
    - [0, 2.245]
  - - [2112, 64, 1, 64, 2112, 2112, 2112, 64]
    - [2, 2.399]
  - - [2240, 64, 1, 64, 2240, 2240, 2240, 64]
    - [0, 2.522]
  - - [2368, 64, 1, 64, 2368, 2368, 2368, 64]
    - [2, 2.537]
  - - [2496, 64, 1, 64, 2496, 2496, 2496, 64]
    - [2, 2.719]
  - - [2624, 64, 1, 64, 2624, 2624, 2624, 64]
    - [2, 2.795]
  - - [2752, 64, 1, 64, 2752, 2752, 2752, 64]
    - [2, 0.411]
  - - [2880, 64, 1, 64, 2880, 2880, 2880, 64]
    - [0, 0.41]
  - - [3008, 64, 1, 64, 3008, 3008, 3008, 64]
    - [3, 0.449]
  - - [3136, 64, 1, 64, 3136, 3136, 3136, 64]
    - [3, 0.467]
  - - [3264, 64, 1, 64, 3264, 3264, 3264, 64]
    - [1, 0.476]
  - - [3392, 64, 1, 64, 3392, 3392, 3392, 64]
    - [3, 0.508]
  - - [3520, 64, 1, 64, 3520, 3520, 3520, 64]
    - [3, 0.535]
  - - [3648, 64, 1, 64, 3648, 3648, 3648, 64]
    - [0, 0.555]
  - - [3776, 64, 1, 64, 3776, 3776, 3776, 64]
    - [2, 0.581]
  - - [3904, 64, 1, 64, 3904, 3904, 3904, 64]
    - [3, 0.611]
  - - [4032, 64, 1, 64, 4032, 4032, 4032, 64]
    - [3, 0.576]
  - - [64, 192, 1, 64, 64, 64, 64, 64]
    - [2, 0.028]
  - - [192, 192, 1, 64, 192, 192, 192, 64]
    - [1, 0.083]
  - - [320, 192, 1, 64, 320, 320, 320, 64]
    - [2, 0.233]
  - - [448, 192, 1, 64, 448, 448, 448, 64]
    - [0, 0.205]
  - - [576, 192, 1, 64, 576, 576, 576, 64]
    - [3, 0.258]
  - - [704, 192, 1, 64, 704, 704, 704, 64]
    - [0, 0.32]
  - - [832, 192, 1, 64, 832, 832, 832, 64]
    - [2, 0.34]
  - - [960, 192, 1, 64, 960, 960, 960, 64]
    - [1, 0.548]
  - - [1088, 192, 1, 64, 1088, 1088, 1088, 64]
    - [2, 0.487]
  - - [1216, 192, 1, 64, 1216, 1216, 1216, 64]
    - [3, 0.562]
  - - [1344, 192, 1, 64, 1344, 1344, 1344, 64]
    - [1, 0.642]
  - - [1472, 192, 1, 64, 1472, 1472, 1472, 64]
    - [1, 0.78]
  - - [1600, 192, 1, 64, 1600, 1600, 1600, 64]
    - [0, 1.069]
  - - [1728, 192, 1, 64, 1728, 1728, 1728, 64]
    - [1, 1.022]
  - - [1856, 192, 1, 64, 1856, 1856, 1856, 64]
    - [3, 1.239]
  - - [1984, 192, 1, 64, 1984, 1984, 1984, 64]
    - [3, 1.402]
  - - [2112, 192, 1, 64, 2112, 2112, 2112, 64]
    - [1, 1.545]
  - - [2240, 192, 1, 64, 2240, 2240, 2240, 64]
    - [3, 1.746]
  - - [2368, 192, 1, 64, 2368, 2368, 2368, 64]
    - [2, 1.844]
  - - [2496, 192, 1, 64, 2496, 2496, 2496, 64]
    - [2, 1.947]
  - - [2624, 192, 1, 64, 2624, 2624, 2624, 64]
    - [2, 2.044]
  - - [2752, 192, 1, 64, 2752, 2752, 2752, 64]
    - [2, 2.143]
  - - [2880, 192, 1, 64, 2880, 2880, 2880, 64]
    - [3, 2.253]
  - - [3008, 192, 1, 64, 3008, 3008, 3008, 64]
    - [2, 2.355]
  - - [3136, 192, 1, 64, 3136, 3136, 3136, 64]
    - [3, 2.451]
  - - [3264, 192, 1, 64, 3264, 3264, 3264, 64]
    - [1, 2.542]
  - - [3392, 192, 1, 64, 3392, 3392, 3392, 64]
    - [0, 2.646]
  - - [3520, 192, 1, 64, 3520, 3520, 3520, 64]
    - [2, 2.731]
  - - [3648, 192, 1, 64, 3648, 3648, 3648, 64]
    - [0, 2.843]
  - - [3776, 192, 1, 64, 3776, 3776, 3776, 64]
    - [2, 2.936]
  - - [3904, 192, 1, 64, 3904, 3904, 3904, 64]
    - [1, 5.385]
  - - [4032, 192, 1, 64, 4032, 4032, 4032, 64]
    - [3, 3.135]
  - - [64, 320, 1, 64, 64, 64, 64, 64]
    - [3, 0.048]
  - - [192, 320, 1, 64, 192, 192, 192, 64]
    - [3, 0.143]
  - - [320, 320, 1, 64, 320, 320, 320, 64]
    - [0, 0.243]
  - - [448, 320, 1, 64, 448, 448, 448, 64]
    - [0, 0.342]
  - - [576, 320, 1, 64, 576, 576, 576, 64]
    - [0, 0.438]
  - - [704, 320, 1, 64, 704, 704, 704, 64]
    - [3, 1.394]
  - - [832, 320, 1, 64, 832, 832, 832, 64]
    - [3, 0.727]
  - - [960, 320, 1, 64, 960, 960, 960, 64]
    - [3, 0.946]
  - - [1088, 320, 1, 64, 1088, 1088, 1088, 64]
    - [1, 1.086]
  - - [1216, 320, 1, 64, 1216, 1216, 1216, 64]
    - [1, 1.44]
  - - [1344, 320, 1, 64, 1344, 1344, 1344, 64]
    - [2, 1.711]
  - - [1472, 320, 1, 64, 1472, 1472, 1472, 64]
    - [3, 1.91]
  - - [1600, 320, 1, 64, 1600, 1600, 1600, 64]
    - [3, 2.076]
  - - [1728, 320, 1, 64, 1728, 1728, 1728, 64]
    - [1, 2.242]
  - - [1856, 320, 1, 64, 1856, 1856, 1856, 64]
    - [1, 2.404]
  - - [1984, 320, 1, 64, 1984, 1984, 1984, 64]
    - [2, 2.577]
  - - [2112, 320, 1, 64, 2112, 2112, 2112, 64]
    - [3, 2.739]
  - - [2240, 320, 1, 64, 2240, 2240, 2240, 64]
    - [2, 2.911]
  - - [2368, 320, 1, 64, 2368, 2368, 2368, 64]
    - [3, 5.369]
  - - [2496, 320, 1, 64, 2496, 2496, 2496, 64]
    - [3, 3.237]
  - - [2624, 320, 1, 64, 2624, 2624, 2624, 64]
    - [3, 5.533]
  - - [2752, 320, 1, 64, 2752, 2752, 2752, 64]
    - [1, 5.705]
  - - [2880, 320, 1, 64, 2880, 2880, 2880, 64]
    - [2, 6.346]
  - - [3008, 320, 1, 64, 3008, 3008, 3008, 64]
    - [1, 5.876]
  - - [3136, 320, 1, 64, 3136, 3136, 3136, 64]
    - [3, 5.964]
  - - [3264, 320, 1, 64, 3264, 3264, 3264, 64]
    - [3, 6.094]
  - - [3392, 320, 1, 64, 3392, 3392, 3392, 64]
    - [1, 6.261]
  - - [3520, 320, 1, 64, 3520, 3520, 3520, 64]
    - [1, 6.348]
  - - [3648, 320, 1, 64, 3648, 3648, 3648, 64]
    - [1, 6.397]
  - - [3776, 320, 1, 64, 3776, 3776, 3776, 64]
    - [3, 4.899]
  - - [3904, 320, 1, 64, 3904, 3904, 3904, 64]
    - [1, 6.518]
  - - [4032, 320, 1, 64, 4032, 4032, 4032, 64]
    - [1, 6.545]
  - - [64, 448, 1, 64, 64, 64, 64, 64]
    - [0, 0.063]
  - - [192, 448, 1, 64, 192, 192, 192, 64]
    - [0, 0.205]
  - - [320, 448, 1, 64, 320, 320, 320, 64]
    - [0, 0.342]
  - - [448, 448, 1, 64, 448, 448, 448, 64]
    - [3, 0.473]
  - - [576, 448, 1, 64, 576, 576, 576, 64]
    - [0, 0.615]
  - - [704, 448, 1, 64, 704, 704, 704, 64]
    - [0, 0.741]
  - - [832, 448, 1, 64, 832, 832, 832, 64]
    - [1, 1.0]
  - - [960, 448, 1, 64, 960, 960, 960, 64]
    - [3, 1.442]
  - - [1088, 448, 1, 64, 1088, 1088, 1088, 64]
    - [3, 1.498]
  - - [1216, 448, 1, 64, 1216, 1216, 1216, 64]
    - [1, 2.003]
  - - [1344, 448, 1, 64, 1344, 1344, 1344, 64]
    - [3, 2.445]
  - - [1472, 448, 1, 64, 1472, 1472, 1472, 64]
    - [3, 2.676]
  - - [1600, 448, 1, 64, 1600, 1600, 1600, 64]
    - [2, 2.912]
  - - [1728, 448, 1, 64, 1728, 1728, 1728, 64]
    - [3, 3.157]
  - - [1856, 448, 1, 64, 1856, 1856, 1856, 64]
    - [3, 3.376]
  - - [1984, 448, 1, 64, 1984, 1984, 1984, 64]
    - [3, 3.614]
  - - [2112, 448, 1, 64, 2112, 2112, 2112, 64]
    - [3, 5.838]
  - - [2240, 448, 1, 64, 2240, 2240, 2240, 64]
    - [1, 6.122]
  - - [2368, 448, 1, 64, 2368, 2368, 2368, 64]
    - [3, 6.069]
  - - [2496, 448, 1, 64, 2496, 2496, 2496, 64]
    - [1, 6.348]
  - - [2624, 448, 1, 64, 2624, 2624, 2624, 64]
    - [1, 6.418]
  - - [2752, 448, 1, 64, 2752, 2752, 2752, 64]
    - [3, 5.03]
  - - [2880, 448, 1, 64, 2880, 2880, 2880, 64]
    - [1, 6.606]
  - - [3008, 448, 1, 64, 3008, 3008, 3008, 64]
    - [1, 6.574]
  - - [3136, 448, 1, 64, 3136, 3136, 3136, 64]
    - [2, 7.593]
  - - [3264, 448, 1, 64, 3264, 3264, 3264, 64]
    - [1, 6.78]
  - - [3392, 448, 1, 64, 3392, 3392, 3392, 64]
    - [1, 6.825]
  - - [3520, 448, 1, 64, 3520, 3520, 3520, 64]
    - [0, 9.5]
  - - [3648, 448, 1, 64, 3648, 3648, 3648, 64]
    - [1, 6.936]
  - - [3776, 448, 1, 64, 3776, 3776, 3776, 64]
    - [2, 7.927]
  - - [3904, 448, 1, 64, 3904, 3904, 3904, 64]
    - [0, 9.697]
  - - [4032, 448, 1, 64, 4032, 4032, 4032, 64]
    - [0, 9.776]
  - - [64, 576, 1, 64, 64, 64, 64, 64]
    - [2, 0.153]
  - - [192, 576, 1, 64, 192, 192, 192, 64]
    - [3, 0.458]
  - - [320, 576, 1, 64, 320, 320, 320, 64]
    - [3, 1.474]
  - - [448, 576, 1, 64, 448, 448, 448, 64]
    - [2, 1.063]
  - - [576, 576, 1, 64, 576, 576, 576, 64]
    - [1, 2.541]
  - - [704, 576, 1, 64, 704, 704, 704, 64]
    - [3, 3.229]
  - - [832, 576, 1, 64, 832, 832, 832, 64]
    - [0, 5.592]
  - - [960, 576, 1, 64, 960, 960, 960, 64]
    - [0, 4.426]
  - - [1088, 576, 1, 64, 1088, 1088, 1088, 64]
    - [0, 5.004]
  - - [1216, 576, 1, 64, 1216, 1216, 1216, 64]
    - [0, 5.583]
  - - [1344, 576, 1, 64, 1344, 1344, 1344, 64]
    - [0, 6.169]
  - - [1472, 576, 1, 64, 1472, 1472, 1472, 64]
    - [0, 6.751]
  - - [1600, 576, 1, 64, 1600, 1600, 1600, 64]
    - [0, 7.377]
  - - [1728, 576, 1, 64, 1728, 1728, 1728, 64]
    - [0, 7.915]
  - - [1856, 576, 1, 64, 1856, 1856, 1856, 64]
    - [0, 8.355]
  - - [1984, 576, 1, 64, 1984, 1984, 1984, 64]
    - [0, 8.459]
  - - [2112, 576, 1, 64, 2112, 2112, 2112, 64]
    - [0, 8.685]
  - - [2240, 576, 1, 64, 2240, 2240, 2240, 64]
    - [0, 8.843]
  - - [2368, 576, 1, 64, 2368, 2368, 2368, 64]
    - [0, 8.985]
  - - [2496, 576, 1, 64, 2496, 2496, 2496, 64]
    - [0, 9.202]
  - - [2624, 576, 1, 64, 2624, 2624, 2624, 64]
    - [0, 9.38]
  - - [2752, 576, 1, 64, 2752, 2752, 2752, 64]
    - [0, 9.498]
  - - [2880, 576, 1, 64, 2880, 2880, 2880, 64]
    - [0, 9.582]
  - - [3008, 576, 1, 64, 3008, 3008, 3008, 64]
    - [0, 9.723]
  - - [3136, 576, 1, 64, 3136, 3136, 3136, 64]
    - [0, 9.832]
  - - [3264, 576, 1, 64, 3264, 3264, 3264, 64]
    - [0, 9.904]
  - - [3392, 576, 1, 64, 3392, 3392, 3392, 64]
    - [0, 10.036]
  - - [3520, 576, 1, 64, 3520, 3520, 3520, 64]
    - [0, 10.137]
  - - [3648, 576, 1, 64, 3648, 3648, 3648, 64]
    - [0, 10.219]
  - - [3776, 576, 1, 64, 3776, 3776, 3776, 64]
    - [0, 10.343]
  - - [3904, 576, 1, 64, 3904, 3904, 3904, 64]
    - [0, 10.347]
  - - [4032, 576, 1, 64, 4032, 4032, 4032, 64]
    - [0, 10.448]
  - - [64, 704, 1, 64, 64, 64, 64, 64]
    - [2, 0.187]
  - - [192, 704, 1, 64, 192, 192, 192, 64]
    - [0, 0.557]
  - - [320, 704, 1, 64, 320, 320, 320, 64]
    - [3, 0.935]
  - - [448, 704, 1, 64, 448, 448, 448, 64]
    - [1, 2.534]
  - - [576, 704, 1, 64, 576, 576, 576, 64]
    - [3, 1.674]
  - - [704, 704, 1, 64, 704, 704, 704, 64]
    - [1, 3.932]
  - - [832, 704, 1, 64, 832, 832, 832, 64]
    - [3, 4.673]
  - - [960, 704, 1, 64, 960, 960, 960, 64]
    - [1, 5.437]
  - - [1088, 704, 1, 64, 1088, 1088, 1088, 64]
    - [0, 6.105]
  - - [1216, 704, 1, 64, 1216, 1216, 1216, 64]
    - [2, 6.495]
  - - [1344, 704, 1, 64, 1344, 1344, 1344, 64]
    - [0, 7.581]
  - - [1472, 704, 1, 64, 1472, 1472, 1472, 64]
    - [0, 8.238]
  - - [1600, 704, 1, 64, 1600, 1600, 1600, 64]
    - [0, 8.435]
  - - [1728, 704, 1, 64, 1728, 1728, 1728, 64]
    - [0, 8.681]
  - - [1856, 704, 1, 64, 1856, 1856, 1856, 64]
    - [0, 8.905]
  - - [1984, 704, 1, 64, 1984, 1984, 1984, 64]
    - [0, 9.101]
  - - [2112, 704, 1, 64, 2112, 2112, 2112, 64]
    - [0, 9.308]
  - - [2240, 704, 1, 64, 2240, 2240, 2240, 64]
    - [0, 9.509]
  - - [2368, 704, 1, 64, 2368, 2368, 2368, 64]
    - [0, 9.623]
  - - [2496, 704, 1, 64, 2496, 2496, 2496, 64]
    - [0, 9.733]
  - - [2624, 704, 1, 64, 2624, 2624, 2624, 64]
    - [0, 9.865]
  - - [2752, 704, 1, 64, 2752, 2752, 2752, 64]
    - [0, 10.053]
  - - [2880, 704, 1, 64, 2880, 2880, 2880, 64]
    - [0, 10.162]
  - - [3008, 704, 1, 64, 3008, 3008, 3008, 64]
    - [0, 10.238]
  - - [3136, 704, 1, 64, 3136, 3136, 3136, 64]
    - [0, 10.408]
  - - [3264, 704, 1, 64, 3264, 3264, 3264, 64]
    - [0, 10.482]
  - - [3392, 704, 1, 64, 3392, 3392, 3392, 64]
    - [0, 10.481]
  - - [3520, 704, 1, 64, 3520, 3520, 3520, 64]
    - [0, 10.558]
  - - [3648, 704, 1, 64, 3648, 3648, 3648, 64]
    - [0, 10.694]
  - - [3776, 704, 1, 64, 3776, 3776, 3776, 64]
    - [0, 10.739]
  - - [3904, 704, 1, 64, 3904, 3904, 3904, 64]
    - [0, 10.913]
  - - [4032, 704, 1, 64, 4032, 4032, 4032, 64]
    - [0, 10.874]
  - - [64, 832, 1, 64, 64, 64, 64, 64]
    - [3, 0.221]
  - - [192, 832, 1, 64, 192, 192, 192, 64]
    - [1, 1.278]
  - - [320, 832, 1, 64, 320, 320, 320, 64]
    - [3, 2.141]
  - - [448, 832, 1, 64, 448, 448, 448, 64]
    - [3, 1.54]
  - - [576, 832, 1, 64, 576, 576, 576, 64]
    - [3, 3.846]
  - - [704, 832, 1, 64, 704, 704, 704, 64]
    - [3, 4.647]
  - - [832, 832, 1, 64, 832, 832, 832, 64]
    - [2, 5.48]
  - - [960, 832, 1, 64, 960, 960, 960, 64]
    - [2, 6.395]
  - - [1088, 832, 1, 64, 1088, 1088, 1088, 64]
    - [2, 6.607]
  - - [1216, 832, 1, 64, 1216, 1216, 1216, 64]
    - [2, 6.889]
  - - [1344, 832, 1, 64, 1344, 1344, 1344, 64]
    - [0, 8.394]
  - - [1472, 832, 1, 64, 1472, 1472, 1472, 64]
    - [0, 8.694]
  - - [1600, 832, 1, 64, 1600, 1600, 1600, 64]
    - [0, 8.944]
  - - [1728, 832, 1, 64, 1728, 1728, 1728, 64]
    - [0, 9.236]
  - - [1856, 832, 1, 64, 1856, 1856, 1856, 64]
    - [0, 9.407]
  - - [1984, 832, 1, 64, 1984, 1984, 1984, 64]
    - [0, 9.63]
  - - [2112, 832, 1, 64, 2112, 2112, 2112, 64]
    - [0, 9.844]
  - - [2240, 832, 1, 64, 2240, 2240, 2240, 64]
    - [0, 9.904]
  - - [2368, 832, 1, 64, 2368, 2368, 2368, 64]
    - [0, 10.087]
  - - [2496, 832, 1, 64, 2496, 2496, 2496, 64]
    - [0, 10.243]
  - - [2624, 832, 1, 64, 2624, 2624, 2624, 64]
    - [0, 10.33]
  - - [2752, 832, 1, 64, 2752, 2752, 2752, 64]
    - [0, 10.418]
  - - [2880, 832, 1, 64, 2880, 2880, 2880, 64]
    - [0, 10.535]
  - - [3008, 832, 1, 64, 3008, 3008, 3008, 64]
    - [0, 10.682]
  - - [3136, 832, 1, 64, 3136, 3136, 3136, 64]
    - [0, 10.807]
  - - [3264, 832, 1, 64, 3264, 3264, 3264, 64]
    - [0, 11.036]
  - - [3392, 832, 1, 64, 3392, 3392, 3392, 64]
    - [0, 10.867]
  - - [3520, 832, 1, 64, 3520, 3520, 3520, 64]
    - [0, 10.932]
  - - [3648, 832, 1, 64, 3648, 3648, 3648, 64]
    - [0, 11.378]
  - - [3776, 832, 1, 64, 3776, 3776, 3776, 64]
    - [0, 11.202]
  - - [3904, 832, 1, 64, 3904, 3904, 3904, 64]
    - [0, 11.15]
  - - [4032, 832, 1, 64, 4032, 4032, 4032, 64]
    - [0, 11.426]
  - - [64, 960, 1, 64, 64, 64, 64, 64]
    - [2, 1.264]
  - - [192, 960, 1, 64, 192, 192, 192, 64]
    - [2, 3.118]
  - - [320, 960, 1, 64, 320, 320, 320, 64]
    - [0, 4.502]
  - - [448, 960, 1, 64, 448, 448, 448, 64]
    - [0, 5.498]
  - - [576, 960, 1, 64, 576, 576, 576, 64]
    - [0, 6.374]
  - - [704, 960, 1, 64, 704, 704, 704, 64]
    - [0, 6.821]
  - - [832, 960, 1, 64, 832, 832, 832, 64]
    - [0, 7.371]
  - - [960, 960, 1, 64, 960, 960, 960, 64]
    - [0, 7.865]
  - - [1088, 960, 1, 64, 1088, 1088, 1088, 64]
    - [0, 8.245]
  - - [1216, 960, 1, 64, 1216, 1216, 1216, 64]
    - [0, 8.543]
  - - [1344, 960, 1, 64, 1344, 1344, 1344, 64]
    - [0, 8.892]
  - - [1472, 960, 1, 64, 1472, 1472, 1472, 64]
    - [0, 9.153]
  - - [1600, 960, 1, 64, 1600, 1600, 1600, 64]
    - [0, 9.365]
  - - [1728, 960, 1, 64, 1728, 1728, 1728, 64]
    - [0, 9.638]
  - - [1856, 960, 1, 64, 1856, 1856, 1856, 64]
    - [0, 9.803]
  - - [1984, 960, 1, 64, 1984, 1984, 1984, 64]
    - [0, 10.008]
  - - [2112, 960, 1, 64, 2112, 2112, 2112, 64]
    - [0, 10.175]
  - - [2240, 960, 1, 64, 2240, 2240, 2240, 64]
    - [0, 10.298]
  - - [2368, 960, 1, 64, 2368, 2368, 2368, 64]
    - [0, 10.542]
  - - [2496, 960, 1, 64, 2496, 2496, 2496, 64]
    - [0, 10.569]
  - - [2624, 960, 1, 64, 2624, 2624, 2624, 64]
    - [0, 10.572]
  - - [2752, 960, 1, 64, 2752, 2752, 2752, 64]
    - [0, 10.785]
  - - [2880, 960, 1, 64, 2880, 2880, 2880, 64]
    - [0, 10.866]
  - - [3008, 960, 1, 64, 3008, 3008, 3008, 64]
    - [0, 11.147]
  - - [3136, 960, 1, 64, 3136, 3136, 3136, 64]
    - [0, 11.009]
  - - [3264, 960, 1, 64, 3264, 3264, 3264, 64]
    - [0, 11.252]
  - - [3392, 960, 1, 64, 3392, 3392, 3392, 64]
    - [0, 11.222]
  - - [3520, 960, 1, 64, 3520, 3520, 3520, 64]
    - [0, 11.206]
  - - [3648, 960, 1, 64, 3648, 3648, 3648, 64]
    - [0, 11.288]
  - - [3776, 960, 1, 64, 3776, 3776, 3776, 64]
    - [0, 11.35]
  - - [3904, 960, 1, 64, 3904, 3904, 3904, 64]
    - [0, 11.361]
  - - [4032, 960, 1, 64, 4032, 4032, 4032, 64]
    - [0, 11.435]
  - - [64, 1088, 1, 64, 64, 64, 64, 64]
    - [3, 0.289]
  - - [192, 1088, 1, 64, 192, 192, 192, 64]
    - [3, 0.866]
  - - [320, 1088, 1, 64, 320, 320, 320, 64]
    - [3, 2.772]
  - - [448, 1088, 1, 64, 448, 448, 448, 64]
    - [1, 3.871]
  - - [576, 1088, 1, 64, 576, 576, 576, 64]
    - [1, 4.993]
  - - [704, 1088, 1, 64, 704, 704, 704, 64]
    - [0, 6.14]
  - - [832, 1088, 1, 64, 832, 832, 832, 64]
    - [0, 7.245]
  - - [960, 1088, 1, 64, 960, 960, 960, 64]
    - [2, 6.957]
  - - [1088, 1088, 1, 64, 1088, 1088, 1088, 64]
    - [0, 8.557]
  - - [1216, 1088, 1, 64, 1216, 1216, 1216, 64]
    - [0, 8.853]
  - - [1344, 1088, 1, 64, 1344, 1344, 1344, 64]
    - [0, 9.279]
  - - [1472, 1088, 1, 64, 1472, 1472, 1472, 64]
    - [0, 9.488]
  - - [1600, 1088, 1, 64, 1600, 1600, 1600, 64]
    - [0, 9.753]
  - - [1728, 1088, 1, 64, 1728, 1728, 1728, 64]
    - [0, 9.924]
  - - [1856, 1088, 1, 64, 1856, 1856, 1856, 64]
    - [0, 10.108]
  - - [1984, 1088, 1, 64, 1984, 1984, 1984, 64]
    - [0, 10.258]
  - - [2112, 1088, 1, 64, 2112, 2112, 2112, 64]
    - [0, 10.493]
  - - [2240, 1088, 1, 64, 2240, 2240, 2240, 64]
    - [0, 10.578]
  - - [2368, 1088, 1, 64, 2368, 2368, 2368, 64]
    - [0, 10.755]
  - - [2496, 1088, 1, 64, 2496, 2496, 2496, 64]
    - [0, 11.191]
  - - [2624, 1088, 1, 64, 2624, 2624, 2624, 64]
    - [0, 11.193]
  - - [2752, 1088, 1, 64, 2752, 2752, 2752, 64]
    - [0, 11.234]
  - - [2880, 1088, 1, 64, 2880, 2880, 2880, 64]
    - [0, 11.243]
  - - [3008, 1088, 1, 64, 3008, 3008, 3008, 64]
    - [0, 11.144]
  - - [3136, 1088, 1, 64, 3136, 3136, 3136, 64]
    - [0, 10.98]
  - - [3264, 1088, 1, 64, 3264, 3264, 3264, 64]
    - [0, 11.512]
  - - [3392, 1088, 1, 64, 3392, 3392, 3392, 64]
    - [0, 11.794]
  - - [3520, 1088, 1, 64, 3520, 3520, 3520, 64]
    - [0, 11.507]
  - - [3648, 1088, 1, 64, 3648, 3648, 3648, 64]
    - [0, 11.64]
  - - [3776, 1088, 1, 64, 3776, 3776, 3776, 64]
    - [0, 11.518]
  - - [3904, 1088, 1, 64, 3904, 3904, 3904, 64]
    - [0, 11.605]
  - - [4032, 1088, 1, 64, 4032, 4032, 4032, 64]
    - [0, 11.212]
  - - [64, 1216, 1, 64, 64, 64, 64, 64]
    - [2, 0.322]
  - - [192, 1216, 1, 64, 192, 192, 192, 64]
    - [2, 0.968]
  - - [320, 1216, 1, 64, 320, 320, 320, 64]
    - [3, 3.129]
  - - [448, 1216, 1, 64, 448, 448, 448, 64]
    - [1, 4.325]
  - - [576, 1216, 1, 64, 576, 576, 576, 64]
    - [0, 5.586]
  - - [704, 1216, 1, 64, 704, 704, 704, 64]
    - [2, 6.466]
  - - [832, 1216, 1, 64, 832, 832, 832, 64]
    - [0, 8.163]
  - - [960, 1216, 1, 64, 960, 960, 960, 64]
    - [0, 8.546]
  - - [1088, 1216, 1, 64, 1088, 1088, 1088, 64]
    - [0, 8.883]
  - - [1216, 1216, 1, 64, 1216, 1216, 1216, 64]
    - [0, 9.231]
  - - [1344, 1216, 1, 64, 1344, 1344, 1344, 64]
    - [0, 9.625]
  - - [1472, 1216, 1, 64, 1472, 1472, 1472, 64]
    - [0, 9.85]
  - - [1600, 1216, 1, 64, 1600, 1600, 1600, 64]
    - [0, 10.095]
  - - [1728, 1216, 1, 64, 1728, 1728, 1728, 64]
    - [0, 10.247]
  - - [1856, 1216, 1, 64, 1856, 1856, 1856, 64]
    - [0, 10.387]
  - - [1984, 1216, 1, 64, 1984, 1984, 1984, 64]
    - [0, 10.593]
  - - [2112, 1216, 1, 64, 2112, 2112, 2112, 64]
    - [0, 10.737]
  - - [2240, 1216, 1, 64, 2240, 2240, 2240, 64]
    - [0, 10.869]
  - - [2368, 1216, 1, 64, 2368, 2368, 2368, 64]
    - [0, 11.12]
  - - [2496, 1216, 1, 64, 2496, 2496, 2496, 64]
    - [0, 11.042]
  - - [2624, 1216, 1, 64, 2624, 2624, 2624, 64]
    - [0, 11.296]
  - - [2752, 1216, 1, 64, 2752, 2752, 2752, 64]
    - [0, 11.25]
  - - [2880, 1216, 1, 64, 2880, 2880, 2880, 64]
    - [0, 11.019]
  - - [3008, 1216, 1, 64, 3008, 3008, 3008, 64]
    - [0, 11.337]
  - - [3136, 1216, 1, 64, 3136, 3136, 3136, 64]
    - [0, 11.413]
  - - [3264, 1216, 1, 64, 3264, 3264, 3264, 64]
    - [0, 11.513]
  - - [3392, 1216, 1, 64, 3392, 3392, 3392, 64]
    - [0, 11.162]
  - - [3520, 1216, 1, 64, 3520, 3520, 3520, 64]
    - [0, 11.678]
  - - [3648, 1216, 1, 64, 3648, 3648, 3648, 64]
    - [0, 11.246]
  - - [3776, 1216, 1, 64, 3776, 3776, 3776, 64]
    - [0, 11.096]
  - - [3904, 1216, 1, 64, 3904, 3904, 3904, 64]
    - [0, 11.442]
  - - [4032, 1216, 1, 64, 4032, 4032, 4032, 64]
    - [0, 11.452]
  - - [64, 1344, 1, 64, 64, 64, 64, 64]
    - [3, 0.355]
  - - [192, 1344, 1, 64, 192, 192, 192, 64]
    - [3, 1.066]
  - - [320, 1344, 1, 64, 320, 320, 320, 64]
    - [2, 1.775]
  - - [448, 1344, 1, 64, 448, 448, 448, 64]
    - [3, 2.484]
  - - [576, 1344, 1, 64, 576, 576, 576, 64]
    - [2, 3.195]
  - - [704, 1344, 1, 64, 704, 704, 704, 64]
    - [0, 7.536]
  - - [832, 1344, 1, 64, 832, 832, 832, 64]
    - [2, 7.068]
  - - [960, 1344, 1, 64, 960, 960, 960, 64]
    - [2, 7.424]
  - - [1088, 1344, 1, 64, 1088, 1088, 1088, 64]
    - [0, 9.289]
  - - [1216, 1344, 1, 64, 1216, 1216, 1216, 64]
    - [0, 9.584]
  - - [1344, 1344, 1, 64, 1344, 1344, 1344, 64]
    - [0, 9.814]
  - - [1472, 1344, 1, 64, 1472, 1472, 1472, 64]
    - [0, 10.029]
  - - [1600, 1344, 1, 64, 1600, 1600, 1600, 64]
    - [0, 10.293]
  - - [1728, 1344, 1, 64, 1728, 1728, 1728, 64]
    - [0, 10.44]
  - - [1856, 1344, 1, 64, 1856, 1856, 1856, 64]
    - [0, 10.609]
  - - [1984, 1344, 1, 64, 1984, 1984, 1984, 64]
    - [0, 10.804]
  - - [2112, 1344, 1, 64, 2112, 2112, 2112, 64]
    - [0, 11.096]
  - - [2240, 1344, 1, 64, 2240, 2240, 2240, 64]
    - [0, 11.247]
  - - [2368, 1344, 1, 64, 2368, 2368, 2368, 64]
    - [0, 11.247]
  - - [2496, 1344, 1, 64, 2496, 2496, 2496, 64]
    - [0, 11.278]
  - - [2624, 1344, 1, 64, 2624, 2624, 2624, 64]
    - [0, 11.35]
  - - [2752, 1344, 1, 64, 2752, 2752, 2752, 64]
    - [0, 11.446]
  - - [2880, 1344, 1, 64, 2880, 2880, 2880, 64]
    - [0, 11.572]
  - - [3008, 1344, 1, 64, 3008, 3008, 3008, 64]
    - [0, 11.449]
  - - [3136, 1344, 1, 64, 3136, 3136, 3136, 64]
    - [0, 11.478]
  - - [3264, 1344, 1, 64, 3264, 3264, 3264, 64]
    - [0, 10.879]
  - - [3392, 1344, 1, 64, 3392, 3392, 3392, 64]
    - [0, 11.345]
  - - [3520, 1344, 1, 64, 3520, 3520, 3520, 64]
    - [0, 10.847]
  - - [3648, 1344, 1, 64, 3648, 3648, 3648, 64]
    - [0, 12.089]
  - - [3776, 1344, 1, 64, 3776, 3776, 3776, 64]
    - [0, 10.911]
  - - [3904, 1344, 1, 64, 3904, 3904, 3904, 64]
    - [0, 10.719]
  - - [4032, 1344, 1, 64, 4032, 4032, 4032, 64]
    - [0, 10.611]
  - - [64, 1472, 1, 64, 64, 64, 64, 64]
    - [2, 1.849]
  - - [192, 1472, 1, 64, 192, 192, 192, 64]
    - [0, 4.319]
  - - [320, 1472, 1, 64, 320, 320, 320, 64]
    - [0, 5.704]
  - - [448, 1472, 1, 64, 448, 448, 448, 64]
    - [0, 6.763]
  - - [576, 1472, 1, 64, 576, 576, 576, 64]
    - [0, 7.609]
  - - [704, 1472, 1, 64, 704, 704, 704, 64]
    - [0, 8.245]
  - - [832, 1472, 1, 64, 832, 832, 832, 64]
    - [0, 8.626]
  - - [960, 1472, 1, 64, 960, 960, 960, 64]
    - [0, 9.161]
  - - [1088, 1472, 1, 64, 1088, 1088, 1088, 64]
    - [0, 9.52]
  - - [1216, 1472, 1, 64, 1216, 1216, 1216, 64]
    - [0, 9.804]
  - - [1344, 1472, 1, 64, 1344, 1344, 1344, 64]
    - [0, 10.11]
  - - [1472, 1472, 1, 64, 1472, 1472, 1472, 64]
    - [0, 10.333]
  - - [1600, 1472, 1, 64, 1600, 1600, 1600, 64]
    - [0, 10.542]
  - - [1728, 1472, 1, 64, 1728, 1728, 1728, 64]
    - [0, 10.969]
  - - [1856, 1472, 1, 64, 1856, 1856, 1856, 64]
    - [0, 10.867]
  - - [1984, 1472, 1, 64, 1984, 1984, 1984, 64]
    - [0, 10.96]
  - - [2112, 1472, 1, 64, 2112, 2112, 2112, 64]
    - [0, 11.098]
  - - [2240, 1472, 1, 64, 2240, 2240, 2240, 64]
    - [0, 11.23]
  - - [2368, 1472, 1, 64, 2368, 2368, 2368, 64]
    - [0, 11.525]
  - - [2496, 1472, 1, 64, 2496, 2496, 2496, 64]
    - [0, 11.671]
  - - [2624, 1472, 1, 64, 2624, 2624, 2624, 64]
    - [0, 11.443]
  - - [2752, 1472, 1, 64, 2752, 2752, 2752, 64]
    - [0, 11.725]
  - - [2880, 1472, 1, 64, 2880, 2880, 2880, 64]
    - [0, 11.221]
  - - [3008, 1472, 1, 64, 3008, 3008, 3008, 64]
    - [0, 11.975]
  - - [3136, 1472, 1, 64, 3136, 3136, 3136, 64]
    - [0, 12.019]
  - - [3264, 1472, 1, 64, 3264, 3264, 3264, 64]
    - [0, 11.672]
  - - [3392, 1472, 1, 64, 3392, 3392, 3392, 64]
    - [0, 12.118]
  - - [3520, 1472, 1, 64, 3520, 3520, 3520, 64]
    - [0, 11.411]
  - - [3648, 1472, 1, 64, 3648, 3648, 3648, 64]
    - [0, 11.107]
  - - [3776, 1472, 1, 64, 3776, 3776, 3776, 64]
    - [0, 11.189]
  - - [3904, 1472, 1, 64, 3904, 3904, 3904, 64]
    - [0, 10.906]
  - - [4032, 1472, 1, 64, 4032, 4032, 4032, 64]
    - [0, 11.585]
  - - [64, 1600, 1, 64, 64, 64, 64, 64]
    - [2, 0.425]
  - - [192, 1600, 1, 64, 192, 192, 192, 64]
    - [2, 2.454]
  - - [320, 1600, 1, 64, 320, 320, 320, 64]
    - [0, 4.112]
  - - [448, 1600, 1, 64, 448, 448, 448, 64]
    - [0, 5.753]
  - - [576, 1600, 1, 64, 576, 576, 576, 64]
    - [0, 7.359]
  - - [704, 1600, 1, 64, 704, 704, 704, 64]
    - [0, 8.483]
  - - [832, 1600, 1, 64, 832, 832, 832, 64]
    - [0, 8.938]
  - - [960, 1600, 1, 64, 960, 960, 960, 64]
    - [0, 9.35]
  - - [1088, 1600, 1, 64, 1088, 1088, 1088, 64]
    - [0, 9.764]
  - - [1216, 1600, 1, 64, 1216, 1216, 1216, 64]
    - [0, 10.058]
  - - [1344, 1600, 1, 64, 1344, 1344, 1344, 64]
    - [0, 10.336]
  - - [1472, 1600, 1, 64, 1472, 1472, 1472, 64]
    - [0, 10.465]
  - - [1600, 1600, 1, 64, 1600, 1600, 1600, 64]
    - [0, 10.699]
  - - [1728, 1600, 1, 64, 1728, 1728, 1728, 64]
    - [0, 10.88]
  - - [1856, 1600, 1, 64, 1856, 1856, 1856, 64]
    - [0, 11.026]
  - - [1984, 1600, 1, 64, 1984, 1984, 1984, 64]
    - [0, 11.228]
  - - [2112, 1600, 1, 64, 2112, 2112, 2112, 64]
    - [0, 11.034]
  - - [2240, 1600, 1, 64, 2240, 2240, 2240, 64]
    - [0, 11.336]
  - - [2368, 1600, 1, 64, 2368, 2368, 2368, 64]
    - [0, 11.574]
  - - [2496, 1600, 1, 64, 2496, 2496, 2496, 64]
    - [0, 11.952]
  - - [2624, 1600, 1, 64, 2624, 2624, 2624, 64]
    - [0, 11.493]
  - - [2752, 1600, 1, 64, 2752, 2752, 2752, 64]
    - [0, 11.792]
  - - [2880, 1600, 1, 64, 2880, 2880, 2880, 64]
    - [0, 11.8]
  - - [3008, 1600, 1, 64, 3008, 3008, 3008, 64]
    - [0, 11.487]
  - - [3136, 1600, 1, 64, 3136, 3136, 3136, 64]
    - [0, 11.382]
  - - [3264, 1600, 1, 64, 3264, 3264, 3264, 64]
    - [0, 11.126]
  - - [3392, 1600, 1, 64, 3392, 3392, 3392, 64]
    - [0, 11.117]
  - - [3520, 1600, 1, 64, 3520, 3520, 3520, 64]
    - [0, 10.775]
  - - [3648, 1600, 1, 64, 3648, 3648, 3648, 64]
    - [0, 11.307]
  - - [3776, 1600, 1, 64, 3776, 3776, 3776, 64]
    - [0, 10.933]
  - - [3904, 1600, 1, 64, 3904, 3904, 3904, 64]
    - [0, 11.007]
  - - [4032, 1600, 1, 64, 4032, 4032, 4032, 64]
    - [0, 10.765]
  - - [64, 1728, 1, 64, 64, 64, 64, 64]
    - [2, 0.459]
  - - [192, 1728, 1, 64, 192, 192, 192, 64]
    - [1, 2.654]
  - - [320, 1728, 1, 64, 320, 320, 320, 64]
    - [2, 4.415]
  - - [448, 1728, 1, 64, 448, 448, 448, 64]
    - [0, 6.195]
  - - [576, 1728, 1, 64, 576, 576, 576, 64]
    - [0, 8.093]
  - - [704, 1728, 1, 64, 704, 704, 704, 64]
    - [0, 8.645]
  - - [832, 1728, 1, 64, 832, 832, 832, 64]
    - [0, 9.201]
  - - [960, 1728, 1, 64, 960, 960, 960, 64]
    - [0, 9.612]
  - - [1088, 1728, 1, 64, 1088, 1088, 1088, 64]
    - [0, 9.954]
  - - [1216, 1728, 1, 64, 1216, 1216, 1216, 64]
    - [0, 10.225]
  - - [1344, 1728, 1, 64, 1344, 1344, 1344, 64]
    - [0, 10.479]
  - - [1472, 1728, 1, 64, 1472, 1472, 1472, 64]
    - [0, 10.687]
  - - [1600, 1728, 1, 64, 1600, 1600, 1600, 64]
    - [0, 10.914]
  - - [1728, 1728, 1, 64, 1728, 1728, 1728, 64]
    - [0, 11.252]
  - - [1856, 1728, 1, 64, 1856, 1856, 1856, 64]
    - [0, 11.449]
  - - [1984, 1728, 1, 64, 1984, 1984, 1984, 64]
    - [0, 11.339]
  - - [2112, 1728, 1, 64, 2112, 2112, 2112, 64]
    - [0, 11.585]
  - - [2240, 1728, 1, 64, 2240, 2240, 2240, 64]
    - [0, 11.616]
  - - [2368, 1728, 1, 64, 2368, 2368, 2368, 64]
    - [0, 11.537]
  - - [2496, 1728, 1, 64, 2496, 2496, 2496, 64]
    - [0, 11.749]
  - - [2624, 1728, 1, 64, 2624, 2624, 2624, 64]
    - [0, 11.995]
  - - [2752, 1728, 1, 64, 2752, 2752, 2752, 64]
    - [0, 11.736]
  - - [2880, 1728, 1, 64, 2880, 2880, 2880, 64]
    - [0, 11.757]
  - - [3008, 1728, 1, 64, 3008, 3008, 3008, 64]
    - [0, 12.188]
  - - [3136, 1728, 1, 64, 3136, 3136, 3136, 64]
    - [0, 12.089]
  - - [3264, 1728, 1, 64, 3264, 3264, 3264, 64]
    - [0, 11.88]
  - - [3392, 1728, 1, 64, 3392, 3392, 3392, 64]
    - [0, 10.831]
  - - [3520, 1728, 1, 64, 3520, 3520, 3520, 64]
    - [0, 11.856]
  - - [3648, 1728, 1, 64, 3648, 3648, 3648, 64]
    - [0, 11.182]
  - - [3776, 1728, 1, 64, 3776, 3776, 3776, 64]
    - [0, 10.786]
  - - [3904, 1728, 1, 64, 3904, 3904, 3904, 64]
    - [0, 11.979]
  - - [4032, 1728, 1, 64, 4032, 4032, 4032, 64]
    - [0, 10.849]
  - - [64, 1856, 1, 64, 64, 64, 64, 64]
    - [3, 0.494]
  - - [192, 1856, 1, 64, 192, 192, 192, 64]
    - [0, 1.472]
  - - [320, 1856, 1, 64, 320, 320, 320, 64]
    - [0, 4.767]
  - - [448, 1856, 1, 64, 448, 448, 448, 64]
    - [0, 6.638]
  - - [576, 1856, 1, 64, 576, 576, 576, 64]
    - [0, 8.332]
  - - [704, 1856, 1, 64, 704, 704, 704, 64]
    - [0, 8.83]
  - - [832, 1856, 1, 64, 832, 832, 832, 64]
    - [0, 9.407]
  - - [960, 1856, 1, 64, 960, 960, 960, 64]
    - [0, 9.883]
  - - [1088, 1856, 1, 64, 1088, 1088, 1088, 64]
    - [0, 10.136]
  - - [1216, 1856, 1, 64, 1216, 1216, 1216, 64]
    - [0, 10.394]
  - - [1344, 1856, 1, 64, 1344, 1344, 1344, 64]
    - [0, 10.642]
  - - [1472, 1856, 1, 64, 1472, 1472, 1472, 64]
    - [0, 10.843]
  - - [1600, 1856, 1, 64, 1600, 1600, 1600, 64]
    - [0, 10.993]
  - - [1728, 1856, 1, 64, 1728, 1728, 1728, 64]
    - [0, 11.336]
  - - [1856, 1856, 1, 64, 1856, 1856, 1856, 64]
    - [0, 11.262]
  - - [1984, 1856, 1, 64, 1984, 1984, 1984, 64]
    - [0, 11.432]
  - - [2112, 1856, 1, 64, 2112, 2112, 2112, 64]
    - [0, 10.973]
  - - [2240, 1856, 1, 64, 2240, 2240, 2240, 64]
    - [0, 11.603]
  - - [2368, 1856, 1, 64, 2368, 2368, 2368, 64]
    - [0, 11.268]
  - - [2496, 1856, 1, 64, 2496, 2496, 2496, 64]
    - [0, 11.599]
  - - [2624, 1856, 1, 64, 2624, 2624, 2624, 64]
    - [0, 11.356]
  - - [2752, 1856, 1, 64, 2752, 2752, 2752, 64]
    - [0, 11.949]
  - - [2880, 1856, 1, 64, 2880, 2880, 2880, 64]
    - [0, 11.824]
  - - [3008, 1856, 1, 64, 3008, 3008, 3008, 64]
    - [0, 10.779]
  - - [3136, 1856, 1, 64, 3136, 3136, 3136, 64]
    - [0, 11.247]
  - - [3264, 1856, 1, 64, 3264, 3264, 3264, 64]
    - [0, 10.824]
  - - [3392, 1856, 1, 64, 3392, 3392, 3392, 64]
    - [0, 10.811]
  - - [3520, 1856, 1, 64, 3520, 3520, 3520, 64]
    - [0, 10.775]
  - - [3648, 1856, 1, 64, 3648, 3648, 3648, 64]
    - [0, 11.803]
  - - [3776, 1856, 1, 64, 3776, 3776, 3776, 64]
    - [0, 11.185]
  - - [3904, 1856, 1, 64, 3904, 3904, 3904, 64]
    - [0, 11.368]
  - - [4032, 1856, 1, 64, 4032, 4032, 4032, 64]
    - [0, 11.244]
  - - [64, 1984, 1, 64, 64, 64, 64, 64]
    - [2, 2.315]
  - - [192, 1984, 1, 64, 192, 192, 192, 64]
    - [0, 5.266]
  - - [320, 1984, 1, 64, 320, 320, 320, 64]
    - [0, 6.693]
  - - [448, 1984, 1, 64, 448, 448, 448, 64]
    - [0, 7.728]
  - - [576, 1984, 1, 64, 576, 576, 576, 64]
    - [0, 8.523]
  - - [704, 1984, 1, 64, 704, 704, 704, 64]
    - [0, 9.127]
  - - [832, 1984, 1, 64, 832, 832, 832, 64]
    - [0, 9.579]
  - - [960, 1984, 1, 64, 960, 960, 960, 64]
    - [0, 9.921]
  - - [1088, 1984, 1, 64, 1088, 1088, 1088, 64]
    - [0, 10.24]
  - - [1216, 1984, 1, 64, 1216, 1216, 1216, 64]
    - [0, 10.668]
  - - [1344, 1984, 1, 64, 1344, 1344, 1344, 64]
    - [0, 10.787]
  - - [1472, 1984, 1, 64, 1472, 1472, 1472, 64]
    - [0, 11.205]
  - - [1600, 1984, 1, 64, 1600, 1600, 1600, 64]
    - [0, 11.338]
  - - [1728, 1984, 1, 64, 1728, 1728, 1728, 64]
    - [0, 11.262]
  - - [1856, 1984, 1, 64, 1856, 1856, 1856, 64]
    - [0, 11.451]
  - - [1984, 1984, 1, 64, 1984, 1984, 1984, 64]
    - [0, 11.871]
  - - [2112, 1984, 1, 64, 2112, 2112, 2112, 64]
    - [0, 11.995]
  - - [2240, 1984, 1, 64, 2240, 2240, 2240, 64]
    - [0, 11.568]
  - - [2368, 1984, 1, 64, 2368, 2368, 2368, 64]
    - [0, 11.55]
  - - [2496, 1984, 1, 64, 2496, 2496, 2496, 64]
    - [0, 11.686]
  - - [2624, 1984, 1, 64, 2624, 2624, 2624, 64]
    - [0, 11.786]
  - - [2752, 1984, 1, 64, 2752, 2752, 2752, 64]
    - [0, 11.202]
  - - [2880, 1984, 1, 64, 2880, 2880, 2880, 64]
    - [0, 11.208]
  - - [3008, 1984, 1, 64, 3008, 3008, 3008, 64]
    - [0, 11.988]
  - - [3136, 1984, 1, 64, 3136, 3136, 3136, 64]
    - [0, 10.464]
  - - [3264, 1984, 1, 64, 3264, 3264, 3264, 64]
    - [0, 11.391]
  - - [3392, 1984, 1, 64, 3392, 3392, 3392, 64]
    - [0, 11.196]
  - - [3520, 1984, 1, 64, 3520, 3520, 3520, 64]
    - [0, 10.672]
  - - [3648, 1984, 1, 64, 3648, 3648, 3648, 64]
    - [0, 11.831]
  - - [3776, 1984, 1, 64, 3776, 3776, 3776, 64]
    - [0, 11.708]
  - - [3904, 1984, 1, 64, 3904, 3904, 3904, 64]
    - [0, 10.777]
  - - [4032, 1984, 1, 64, 4032, 4032, 4032, 64]
    - [0, 9.757]
  - - [64, 2112, 1, 64, 64, 64, 64, 64]
    - [3, 0.559]
  - - [192, 2112, 1, 64, 192, 192, 192, 64]
    - [3, 3.17]
  - - [320, 2112, 1, 64, 320, 320, 320, 64]
    - [0, 5.402]
  - - [448, 2112, 1, 64, 448, 448, 448, 64]
    - [0, 7.585]
  - - [576, 2112, 1, 64, 576, 576, 576, 64]
    - [0, 8.593]
  - - [704, 2112, 1, 64, 704, 704, 704, 64]
    - [0, 9.159]
  - - [832, 2112, 1, 64, 832, 832, 832, 64]
    - [0, 9.637]
  - - [960, 2112, 1, 64, 960, 960, 960, 64]
    - [0, 9.923]
  - - [1088, 2112, 1, 64, 1088, 1088, 1088, 64]
    - [0, 10.271]
  - - [1216, 2112, 1, 64, 1216, 1216, 1216, 64]
    - [0, 10.5]
  - - [1344, 2112, 1, 64, 1344, 1344, 1344, 64]
    - [0, 11.013]
  - - [1472, 2112, 1, 64, 1472, 1472, 1472, 64]
    - [0, 10.97]
  - - [1600, 2112, 1, 64, 1600, 1600, 1600, 64]
    - [0, 11.028]
  - - [1728, 2112, 1, 64, 1728, 1728, 1728, 64]
    - [0, 11.43]
  - - [1856, 2112, 1, 64, 1856, 1856, 1856, 64]
    - [0, 11.3]
  - - [1984, 2112, 1, 64, 1984, 1984, 1984, 64]
    - [0, 11.451]
  - - [2112, 2112, 1, 64, 2112, 2112, 2112, 64]
    - [0, 10.935]
  - - [2240, 2112, 1, 64, 2240, 2240, 2240, 64]
    - [0, 11.621]
  - - [2368, 2112, 1, 64, 2368, 2368, 2368, 64]
    - [0, 10.911]
  - - [2496, 2112, 1, 64, 2496, 2496, 2496, 64]
    - [0, 10.772]
  - - [2624, 2112, 1, 64, 2624, 2624, 2624, 64]
    - [0, 10.551]
  - - [2752, 2112, 1, 64, 2752, 2752, 2752, 64]
    - [0, 11.313]
  - - [2880, 2112, 1, 64, 2880, 2880, 2880, 64]
    - [0, 10.78]
  - - [3008, 2112, 1, 64, 3008, 3008, 3008, 64]
    - [0, 11.16]
  - - [3136, 2112, 1, 64, 3136, 3136, 3136, 64]
    - [0, 11.704]
  - - [3264, 2112, 1, 64, 3264, 3264, 3264, 64]
    - [0, 11.076]
  - - [3392, 2112, 1, 64, 3392, 3392, 3392, 64]
    - [0, 10.382]
  - - [3520, 2112, 1, 64, 3520, 3520, 3520, 64]
    - [0, 10.451]
  - - [3648, 2112, 1, 64, 3648, 3648, 3648, 64]
    - [0, 10.915]
  - - [3776, 2112, 1, 64, 3776, 3776, 3776, 64]
    - [0, 10.988]
  - - [3904, 2112, 1, 64, 3904, 3904, 3904, 64]
    - [0, 11.13]
  - - [4032, 2112, 1, 64, 4032, 4032, 4032, 64]
    - [0, 11.502]
  - - [64, 2240, 1, 64, 64, 64, 64, 64]
    - [2, 2.594]
  - - [192, 2240, 1, 64, 192, 192, 192, 64]
    - [0, 5.408]
  - - [320, 2240, 1, 64, 320, 320, 320, 64]
    - [0, 6.897]
  - - [448, 2240, 1, 64, 448, 448, 448, 64]
    - [0, 7.972]
  - - [576, 2240, 1, 64, 576, 576, 576, 64]
    - [0, 8.721]
  - - [704, 2240, 1, 64, 704, 704, 704, 64]
    - [0, 9.236]
  - - [832, 2240, 1, 64, 832, 832, 832, 64]
    - [0, 9.835]
  - - [960, 2240, 1, 64, 960, 960, 960, 64]
    - [0, 10.151]
  - - [1088, 2240, 1, 64, 1088, 1088, 1088, 64]
    - [0, 10.432]
  - - [1216, 2240, 1, 64, 1216, 1216, 1216, 64]
    - [0, 10.662]
  - - [1344, 2240, 1, 64, 1344, 1344, 1344, 64]
    - [0, 11.021]
  - - [1472, 2240, 1, 64, 1472, 1472, 1472, 64]
    - [0, 11.053]
  - - [1600, 2240, 1, 64, 1600, 1600, 1600, 64]
    - [0, 10.879]
  - - [1728, 2240, 1, 64, 1728, 1728, 1728, 64]
    - [0, 11.371]
  - - [1856, 2240, 1, 64, 1856, 1856, 1856, 64]
    - [0, 11.263]
  - - [1984, 2240, 1, 64, 1984, 1984, 1984, 64]
    - [0, 10.761]
  - - [2112, 2240, 1, 64, 2112, 2112, 2112, 64]
    - [0, 11.806]
  - - [2240, 2240, 1, 64, 2240, 2240, 2240, 64]
    - [0, 10.673]
  - - [2368, 2240, 1, 64, 2368, 2368, 2368, 64]
    - [0, 10.031]
  - - [2496, 2240, 1, 64, 2496, 2496, 2496, 64]
    - [0, 11.748]
  - - [2624, 2240, 1, 64, 2624, 2624, 2624, 64]
    - [0, 10.803]
  - - [2752, 2240, 1, 64, 2752, 2752, 2752, 64]
    - [0, 11.432]
  - - [2880, 2240, 1, 64, 2880, 2880, 2880, 64]
    - [0, 10.483]
  - - [3008, 2240, 1, 64, 3008, 3008, 3008, 64]
    - [0, 11.76]
  - - [3136, 2240, 1, 64, 3136, 3136, 3136, 64]
    - [0, 10.87]
  - - [3264, 2240, 1, 64, 3264, 3264, 3264, 64]
    - [0, 10.642]
  - - [3392, 2240, 1, 64, 3392, 3392, 3392, 64]
    - [0, 10.571]
  - - [3520, 2240, 1, 64, 3520, 3520, 3520, 64]
    - [0, 10.713]
  - - [3648, 2240, 1, 64, 3648, 3648, 3648, 64]
    - [0, 11.5]
  - - [3776, 2240, 1, 64, 3776, 3776, 3776, 64]
    - [0, 11.163]
  - - [3904, 2240, 1, 64, 3904, 3904, 3904, 64]
    - [0, 10.732]
  - - [4032, 2240, 1, 64, 4032, 4032, 4032, 64]
    - [0, 10.985]
  - - [64, 2368, 1, 64, 64, 64, 64, 64]
    - [2, 0.628]
  - - [192, 2368, 1, 64, 192, 192, 192, 64]
    - [3, 3.614]
  - - [320, 2368, 1, 64, 320, 320, 320, 64]
    - [0, 6.056]
  - - [448, 2368, 1, 64, 448, 448, 448, 64]
    - [0, 8.155]
  - - [576, 2368, 1, 64, 576, 576, 576, 64]
    - [0, 8.859]
  - - [704, 2368, 1, 64, 704, 704, 704, 64]
    - [0, 9.377]
  - - [832, 2368, 1, 64, 832, 832, 832, 64]
    - [0, 9.851]
  - - [960, 2368, 1, 64, 960, 960, 960, 64]
    - [0, 10.19]
  - - [1088, 2368, 1, 64, 1088, 1088, 1088, 64]
    - [0, 10.419]
  - - [1216, 2368, 1, 64, 1216, 1216, 1216, 64]
    - [0, 10.63]
  - - [1344, 2368, 1, 64, 1344, 1344, 1344, 64]
    - [0, 10.891]
  - - [1472, 2368, 1, 64, 1472, 1472, 1472, 64]
    - [0, 10.739]
  - - [1600, 2368, 1, 64, 1600, 1600, 1600, 64]
    - [0, 11.204]
  - - [1728, 2368, 1, 64, 1728, 1728, 1728, 64]
    - [0, 11.533]
  - - [1856, 2368, 1, 64, 1856, 1856, 1856, 64]
    - [0, 11.428]
  - - [1984, 2368, 1, 64, 1984, 1984, 1984, 64]
    - [0, 11.823]
  - - [2112, 2368, 1, 64, 2112, 2112, 2112, 64]
    - [0, 10.834]
  - - [2240, 2368, 1, 64, 2240, 2240, 2240, 64]
    - [0, 10.818]
  - - [2368, 2368, 1, 64, 2368, 2368, 2368, 64]
    - [0, 10.801]
  - - [2496, 2368, 1, 64, 2496, 2496, 2496, 64]
    - [0, 10.758]
  - - [2624, 2368, 1, 64, 2624, 2624, 2624, 64]
    - [0, 10.749]
  - - [2752, 2368, 1, 64, 2752, 2752, 2752, 64]
    - [0, 10.921]
  - - [2880, 2368, 1, 64, 2880, 2880, 2880, 64]
    - [0, 10.774]
  - - [3008, 2368, 1, 64, 3008, 3008, 3008, 64]
    - [0, 10.723]
  - - [3136, 2368, 1, 64, 3136, 3136, 3136, 64]
    - [0, 11.324]
  - - [3264, 2368, 1, 64, 3264, 3264, 3264, 64]
    - [0, 10.512]
  - - [3392, 2368, 1, 64, 3392, 3392, 3392, 64]
    - [0, 10.656]
  - - [3520, 2368, 1, 64, 3520, 3520, 3520, 64]
    - [0, 10.789]
  - - [3648, 2368, 1, 64, 3648, 3648, 3648, 64]
    - [0, 10.736]
  - - [3776, 2368, 1, 64, 3776, 3776, 3776, 64]
    - [0, 11.114]
  - - [3904, 2368, 1, 64, 3904, 3904, 3904, 64]
    - [0, 10.781]
  - - [4032, 2368, 1, 64, 4032, 4032, 4032, 64]
    - [0, 11.747]
  - - [64, 2496, 1, 64, 64, 64, 64, 64]
    - [3, 0.659]
  - - [192, 2496, 1, 64, 192, 192, 192, 64]
    - [3, 3.822]
  - - [320, 2496, 1, 64, 320, 320, 320, 64]
    - [0, 6.378]
  - - [448, 2496, 1, 64, 448, 448, 448, 64]
    - [0, 8.273]
  - - [576, 2496, 1, 64, 576, 576, 576, 64]
    - [0, 9.065]
  - - [704, 2496, 1, 64, 704, 704, 704, 64]
    - [0, 9.545]
  - - [832, 2496, 1, 64, 832, 832, 832, 64]
    - [0, 9.964]
  - - [960, 2496, 1, 64, 960, 960, 960, 64]
    - [0, 10.281]
  - - [1088, 2496, 1, 64, 1088, 1088, 1088, 64]
    - [0, 10.588]
  - - [1216, 2496, 1, 64, 1216, 1216, 1216, 64]
    - [0, 10.765]
  - - [1344, 2496, 1, 64, 1344, 1344, 1344, 64]
    - [0, 10.91]
  - - [1472, 2496, 1, 64, 1472, 1472, 1472, 64]
    - [0, 11.214]
  - - [1600, 2496, 1, 64, 1600, 1600, 1600, 64]
    - [0, 11.425]
  - - [1728, 2496, 1, 64, 1728, 1728, 1728, 64]
    - [0, 11.056]
  - - [1856, 2496, 1, 64, 1856, 1856, 1856, 64]
    - [0, 11.58]
  - - [1984, 2496, 1, 64, 1984, 1984, 1984, 64]
    - [0, 11.256]
  - - [2112, 2496, 1, 64, 2112, 2112, 2112, 64]
    - [0, 11.68]
  - - [2240, 2496, 1, 64, 2240, 2240, 2240, 64]
    - [0, 11.77]
  - - [2368, 2496, 1, 64, 2368, 2368, 2368, 64]
    - [0, 11.722]
  - - [2496, 2496, 1, 64, 2496, 2496, 2496, 64]
    - [0, 10.526]
  - - [2624, 2496, 1, 64, 2624, 2624, 2624, 64]
    - [0, 10.623]
  - - [2752, 2496, 1, 64, 2752, 2752, 2752, 64]
    - [0, 10.398]
  - - [2880, 2496, 1, 64, 2880, 2880, 2880, 64]
    - [0, 10.65]
  - - [3008, 2496, 1, 64, 3008, 3008, 3008, 64]
    - [0, 10.565]
  - - [3136, 2496, 1, 64, 3136, 3136, 3136, 64]
    - [0, 10.662]
  - - [3264, 2496, 1, 64, 3264, 3264, 3264, 64]
    - [0, 10.86]
  - - [3392, 2496, 1, 64, 3392, 3392, 3392, 64]
    - [0, 11.166]
  - - [3520, 2496, 1, 64, 3520, 3520, 3520, 64]
    - [0, 10.557]
  - - [3648, 2496, 1, 64, 3648, 3648, 3648, 64]
    - [0, 10.465]
  - - [3776, 2496, 1, 64, 3776, 3776, 3776, 64]
    - [0, 10.844]
  - - [3904, 2496, 1, 64, 3904, 3904, 3904, 64]
    - [0, 11.668]
  - - [4032, 2496, 1, 64, 4032, 4032, 4032, 64]
    - [0, 11.303]
  - - [64, 2624, 1, 64, 64, 64, 64, 64]
    - [2, 2.901]
  - - [192, 2624, 1, 64, 192, 192, 192, 64]
    - [0, 5.911]
  - - [320, 2624, 1, 64, 320, 320, 320, 64]
    - [0, 7.43]
  - - [448, 2624, 1, 64, 448, 448, 448, 64]
    - [0, 8.411]
  - - [576, 2624, 1, 64, 576, 576, 576, 64]
    - [0, 9.164]
  - - [704, 2624, 1, 64, 704, 704, 704, 64]
    - [0, 9.695]
  - - [832, 2624, 1, 64, 832, 832, 832, 64]
    - [0, 10.085]
  - - [960, 2624, 1, 64, 960, 960, 960, 64]
    - [0, 10.4]
  - - [1088, 2624, 1, 64, 1088, 1088, 1088, 64]
    - [0, 10.67]
  - - [1216, 2624, 1, 64, 1216, 1216, 1216, 64]
    - [0, 10.852]
  - - [1344, 2624, 1, 64, 1344, 1344, 1344, 64]
    - [0, 11.084]
  - - [1472, 2624, 1, 64, 1472, 1472, 1472, 64]
    - [0, 11.169]
  - - [1600, 2624, 1, 64, 1600, 1600, 1600, 64]
    - [0, 11.253]
  - - [1728, 2624, 1, 64, 1728, 1728, 1728, 64]
    - [0, 11.237]
  - - [1856, 2624, 1, 64, 1856, 1856, 1856, 64]
    - [0, 11.554]
  - - [1984, 2624, 1, 64, 1984, 1984, 1984, 64]
    - [0, 10.812]
  - - [2112, 2624, 1, 64, 2112, 2112, 2112, 64]
    - [0, 10.806]
  - - [2240, 2624, 1, 64, 2240, 2240, 2240, 64]
    - [0, 11.831]
  - - [2368, 2624, 1, 64, 2368, 2368, 2368, 64]
    - [0, 10.757]
  - - [2496, 2624, 1, 64, 2496, 2496, 2496, 64]
    - [0, 10.618]
  - - [2624, 2624, 1, 64, 2624, 2624, 2624, 64]
    - [0, 10.436]
  - - [2752, 2624, 1, 64, 2752, 2752, 2752, 64]
    - [0, 10.588]
  - - [2880, 2624, 1, 64, 2880, 2880, 2880, 64]
    - [0, 10.839]
  - - [3008, 2624, 1, 64, 3008, 3008, 3008, 64]
    - [0, 10.732]
  - - [3136, 2624, 1, 64, 3136, 3136, 3136, 64]
    - [0, 10.841]
  - - [3264, 2624, 1, 64, 3264, 3264, 3264, 64]
    - [0, 10.912]
  - - [3392, 2624, 1, 64, 3392, 3392, 3392, 64]
    - [0, 11.238]
  - - [3520, 2624, 1, 64, 3520, 3520, 3520, 64]
    - [0, 10.944]
  - - [3648, 2624, 1, 64, 3648, 3648, 3648, 64]
    - [0, 11.033]
  - - [3776, 2624, 1, 64, 3776, 3776, 3776, 64]
    - [0, 11.068]
  - - [3904, 2624, 1, 64, 3904, 3904, 3904, 64]
    - [0, 10.895]
  - - [4032, 2624, 1, 64, 4032, 4032, 4032, 64]
    - [0, 11.31]
  - - [64, 2752, 1, 64, 64, 64, 64, 64]
    - [2, 3.005]
  - - [192, 2752, 1, 64, 192, 192, 192, 64]
    - [0, 6.026]
  - - [320, 2752, 1, 64, 320, 320, 320, 64]
    - [0, 7.579]
  - - [448, 2752, 1, 64, 448, 448, 448, 64]
    - [0, 8.574]
  - - [576, 2752, 1, 64, 576, 576, 576, 64]
    - [0, 9.253]
  - - [704, 2752, 1, 64, 704, 704, 704, 64]
    - [0, 9.779]
  - - [832, 2752, 1, 64, 832, 832, 832, 64]
    - [0, 10.152]
  - - [960, 2752, 1, 64, 960, 960, 960, 64]
    - [0, 10.482]
  - - [1088, 2752, 1, 64, 1088, 1088, 1088, 64]
    - [0, 10.769]
  - - [1216, 2752, 1, 64, 1216, 1216, 1216, 64]
    - [0, 10.92]
  - - [1344, 2752, 1, 64, 1344, 1344, 1344, 64]
    - [0, 11.318]
  - - [1472, 2752, 1, 64, 1472, 1472, 1472, 64]
    - [0, 11.027]
  - - [1600, 2752, 1, 64, 1600, 1600, 1600, 64]
    - [0, 11.251]
  - - [1728, 2752, 1, 64, 1728, 1728, 1728, 64]
    - [0, 10.718]
  - - [1856, 2752, 1, 64, 1856, 1856, 1856, 64]
    - [0, 11.132]
  - - [1984, 2752, 1, 64, 1984, 1984, 1984, 64]
    - [0, 11.794]
  - - [2112, 2752, 1, 64, 2112, 2112, 2112, 64]
    - [0, 10.884]
  - - [2240, 2752, 1, 64, 2240, 2240, 2240, 64]
    - [0, 10.538]
  - - [2368, 2752, 1, 64, 2368, 2368, 2368, 64]
    - [0, 10.535]
  - - [2496, 2752, 1, 64, 2496, 2496, 2496, 64]
    - [0, 10.047]
  - - [2624, 2752, 1, 64, 2624, 2624, 2624, 64]
    - [0, 10.877]
  - - [2752, 2752, 1, 64, 2752, 2752, 2752, 64]
    - [0, 11.038]
  - - [2880, 2752, 1, 64, 2880, 2880, 2880, 64]
    - [0, 10.581]
  - - [3008, 2752, 1, 64, 3008, 3008, 3008, 64]
    - [0, 10.844]
  - - [3136, 2752, 1, 64, 3136, 3136, 3136, 64]
    - [0, 10.684]
  - - [3264, 2752, 1, 64, 3264, 3264, 3264, 64]
    - [0, 10.801]
  - - [3392, 2752, 1, 64, 3392, 3392, 3392, 64]
    - [0, 11.205]
  - - [3520, 2752, 1, 64, 3520, 3520, 3520, 64]
    - [0, 11.246]
  - - [3648, 2752, 1, 64, 3648, 3648, 3648, 64]
    - [0, 11.368]
  - - [3776, 2752, 1, 64, 3776, 3776, 3776, 64]
    - [0, 11.034]
  - - [3904, 2752, 1, 64, 3904, 3904, 3904, 64]
    - [0, 10.673]
  - - [4032, 2752, 1, 64, 4032, 4032, 4032, 64]
    - [0, 11.442]
  - - [64, 2880, 1, 64, 64, 64, 64, 64]
    - [3, 0.762]
  - - [192, 2880, 1, 64, 192, 192, 192, 64]
    - [0, 4.442]
  - - [320, 2880, 1, 64, 320, 320, 320, 64]
    - [0, 7.383]
  - - [448, 2880, 1, 64, 448, 448, 448, 64]
    - [0, 8.702]
  - - [576, 2880, 1, 64, 576, 576, 576, 64]
    - [0, 9.378]
  - - [704, 2880, 1, 64, 704, 704, 704, 64]
    - [0, 9.862]
  - - [832, 2880, 1, 64, 832, 832, 832, 64]
    - [0, 10.273]
  - - [960, 2880, 1, 64, 960, 960, 960, 64]
    - [0, 10.601]
  - - [1088, 2880, 1, 64, 1088, 1088, 1088, 64]
    - [0, 10.813]
  - - [1216, 2880, 1, 64, 1216, 1216, 1216, 64]
    - [0, 11.228]
  - - [1344, 2880, 1, 64, 1344, 1344, 1344, 64]
    - [0, 11.062]
  - - [1472, 2880, 1, 64, 1472, 1472, 1472, 64]
    - [0, 11.323]
  - - [1600, 2880, 1, 64, 1600, 1600, 1600, 64]
    - [0, 11.497]
  - - [1728, 2880, 1, 64, 1728, 1728, 1728, 64]
    - [0, 10.796]
  - - [1856, 2880, 1, 64, 1856, 1856, 1856, 64]
    - [0, 11.08]
  - - [1984, 2880, 1, 64, 1984, 1984, 1984, 64]
    - [0, 10.964]
  - - [2112, 2880, 1, 64, 2112, 2112, 2112, 64]
    - [0, 11.491]
  - - [2240, 2880, 1, 64, 2240, 2240, 2240, 64]
    - [0, 10.467]
  - - [2368, 2880, 1, 64, 2368, 2368, 2368, 64]
    - [0, 10.506]
  - - [2496, 2880, 1, 64, 2496, 2496, 2496, 64]
    - [0, 10.951]
  - - [2624, 2880, 1, 64, 2624, 2624, 2624, 64]
    - [0, 10.706]
  - - [2752, 2880, 1, 64, 2752, 2752, 2752, 64]
    - [0, 10.817]
  - - [2880, 2880, 1, 64, 2880, 2880, 2880, 64]
    - [0, 9.343]
  - - [3008, 2880, 1, 64, 3008, 3008, 3008, 64]
    - [0, 11.255]
  - - [3136, 2880, 1, 64, 3136, 3136, 3136, 64]
    - [0, 10.823]
  - - [3264, 2880, 1, 64, 3264, 3264, 3264, 64]
    - [0, 10.762]
  - - [3392, 2880, 1, 64, 3392, 3392, 3392, 64]
    - [0, 9.802]
  - - [3520, 2880, 1, 64, 3520, 3520, 3520, 64]
    - [0, 11.257]
  - - [3648, 2880, 1, 64, 3648, 3648, 3648, 64]
    - [0, 11.354]
  - - [3776, 2880, 1, 64, 3776, 3776, 3776, 64]
    - [0, 11.198]
  - - [3904, 2880, 1, 64, 3904, 3904, 3904, 64]
    - [0, 10.952]
  - - [4032, 2880, 1, 64, 4032, 4032, 4032, 64]
    - [0, 11.09]
  - - [64, 3008, 1, 64, 64, 64, 64, 64]
    - [2, 0.801]
  - - [192, 3008, 1, 64, 192, 192, 192, 64]
    - [2, 5.637]
  - - [320, 3008, 1, 64, 320, 320, 320, 64]
    - [0, 7.686]
  - - [448, 3008, 1, 64, 448, 448, 448, 64]
    - [0, 8.803]
  - - [576, 3008, 1, 64, 576, 576, 576, 64]
    - [0, 9.549]
  - - [704, 3008, 1, 64, 704, 704, 704, 64]
    - [0, 10.014]
  - - [832, 3008, 1, 64, 832, 832, 832, 64]
    - [0, 10.383]
  - - [960, 3008, 1, 64, 960, 960, 960, 64]
    - [0, 10.902]
  - - [1088, 3008, 1, 64, 1088, 1088, 1088, 64]
    - [0, 11.221]
  - - [1216, 3008, 1, 64, 1216, 1216, 1216, 64]
    - [0, 11.076]
  - - [1344, 3008, 1, 64, 1344, 1344, 1344, 64]
    - [0, 10.947]
  - - [1472, 3008, 1, 64, 1472, 1472, 1472, 64]
    - [0, 11.755]
  - - [1600, 3008, 1, 64, 1600, 1600, 1600, 64]
    - [0, 11.788]
  - - [1728, 3008, 1, 64, 1728, 1728, 1728, 64]
    - [0, 10.339]
  - - [1856, 3008, 1, 64, 1856, 1856, 1856, 64]
    - [0, 10.76]
  - - [1984, 3008, 1, 64, 1984, 1984, 1984, 64]
    - [0, 11.867]
  - - [2112, 3008, 1, 64, 2112, 2112, 2112, 64]
    - [0, 9.324]
  - - [2240, 3008, 1, 64, 2240, 2240, 2240, 64]
    - [0, 10.93]
  - - [2368, 3008, 1, 64, 2368, 2368, 2368, 64]
    - [0, 10.692]
  - - [2496, 3008, 1, 64, 2496, 2496, 2496, 64]
    - [0, 10.55]
  - - [2624, 3008, 1, 64, 2624, 2624, 2624, 64]
    - [0, 11.153]
  - - [2752, 3008, 1, 64, 2752, 2752, 2752, 64]
    - [0, 11.114]
  - - [2880, 3008, 1, 64, 2880, 2880, 2880, 64]
    - [0, 10.733]
  - - [3008, 3008, 1, 64, 3008, 3008, 3008, 64]
    - [0, 10.848]
  - - [3136, 3008, 1, 64, 3136, 3136, 3136, 64]
    - [2, 9.149]
  - - [3264, 3008, 1, 64, 3264, 3264, 3264, 64]
    - [0, 10.056]
  - - [3392, 3008, 1, 64, 3392, 3392, 3392, 64]
    - [0, 11.317]
  - - [3520, 3008, 1, 64, 3520, 3520, 3520, 64]
    - [0, 11.719]
  - - [3648, 3008, 1, 64, 3648, 3648, 3648, 64]
    - [0, 11.17]
  - - [3776, 3008, 1, 64, 3776, 3776, 3776, 64]
    - [0, 11.31]
  - - [3904, 3008, 1, 64, 3904, 3904, 3904, 64]
    - [0, 11.526]
  - - [4032, 3008, 1, 64, 4032, 4032, 4032, 64]
    - [0, 11.384]
  - - [64, 3136, 1, 64, 64, 64, 64, 64]
    - [2, 3.3]
  - - [192, 3136, 1, 64, 192, 192, 192, 64]
    - [0, 6.494]
  - - [320, 3136, 1, 64, 320, 320, 320, 64]
    - [0, 7.97]
  - - [448, 3136, 1, 64, 448, 448, 448, 64]
    - [0, 8.958]
  - - [576, 3136, 1, 64, 576, 576, 576, 64]
    - [0, 9.649]
  - - [704, 3136, 1, 64, 704, 704, 704, 64]
    - [0, 10.069]
  - - [832, 3136, 1, 64, 832, 832, 832, 64]
    - [0, 10.452]
  - - [960, 3136, 1, 64, 960, 960, 960, 64]
    - [0, 10.772]
  - - [1088, 3136, 1, 64, 1088, 1088, 1088, 64]
    - [0, 11.189]
  - - [1216, 3136, 1, 64, 1216, 1216, 1216, 64]
    - [0, 11.176]
  - - [1344, 3136, 1, 64, 1344, 1344, 1344, 64]
    - [0, 11.527]
  - - [1472, 3136, 1, 64, 1472, 1472, 1472, 64]
    - [0, 11.336]
  - - [1600, 3136, 1, 64, 1600, 1600, 1600, 64]
    - [0, 10.991]
  - - [1728, 3136, 1, 64, 1728, 1728, 1728, 64]
    - [0, 10.829]
  - - [1856, 3136, 1, 64, 1856, 1856, 1856, 64]
    - [0, 10.836]
  - - [1984, 3136, 1, 64, 1984, 1984, 1984, 64]
    - [0, 10.839]
  - - [2112, 3136, 1, 64, 2112, 2112, 2112, 64]
    - [0, 10.552]
  - - [2240, 3136, 1, 64, 2240, 2240, 2240, 64]
    - [0, 10.415]
  - - [2368, 3136, 1, 64, 2368, 2368, 2368, 64]
    - [0, 10.921]
  - - [2496, 3136, 1, 64, 2496, 2496, 2496, 64]
    - [0, 10.736]
  - - [2624, 3136, 1, 64, 2624, 2624, 2624, 64]
    - [0, 11.091]
  - - [2752, 3136, 1, 64, 2752, 2752, 2752, 64]
    - [0, 11.057]
  - - [2880, 3136, 1, 64, 2880, 2880, 2880, 64]
    - [0, 11.359]
  - - [3008, 3136, 1, 64, 3008, 3008, 3008, 64]
    - [0, 10.668]
  - - [3136, 3136, 1, 64, 3136, 3136, 3136, 64]
    - [0, 11.431]
  - - [3264, 3136, 1, 64, 3264, 3264, 3264, 64]
    - [0, 11.397]
  - - [3392, 3136, 1, 64, 3392, 3392, 3392, 64]
    - [0, 10.84]
  - - [3520, 3136, 1, 64, 3520, 3520, 3520, 64]
    - [0, 11.426]
  - - [3648, 3136, 1, 64, 3648, 3648, 3648, 64]
    - [0, 11.177]
  - - [3776, 3136, 1, 64, 3776, 3776, 3776, 64]
    - [0, 11.365]
  - - [3904, 3136, 1, 64, 3904, 3904, 3904, 64]
    - [0, 11.426]
  - - [4032, 3136, 1, 64, 4032, 4032, 4032, 64]
    - [0, 11.505]
  - - [64, 3264, 1, 64, 64, 64, 64, 64]
    - [0, 0.864]
  - - [192, 3264, 1, 64, 192, 192, 192, 64]
    - [0, 5.036]
  - - [320, 3264, 1, 64, 320, 320, 320, 64]
    - [0, 8.128]
  - - [448, 3264, 1, 64, 448, 448, 448, 64]
    - [0, 9.053]
  - - [576, 3264, 1, 64, 576, 576, 576, 64]
    - [0, 9.737]
  - - [704, 3264, 1, 64, 704, 704, 704, 64]
    - [0, 10.144]
  - - [832, 3264, 1, 64, 832, 832, 832, 64]
    - [0, 10.593]
  - - [960, 3264, 1, 64, 960, 960, 960, 64]
    - [0, 10.832]
  - - [1088, 3264, 1, 64, 1088, 1088, 1088, 64]
    - [0, 11.317]
  - - [1216, 3264, 1, 64, 1216, 1216, 1216, 64]
    - [0, 11.139]
  - - [1344, 3264, 1, 64, 1344, 1344, 1344, 64]
    - [0, 11.125]
  - - [1472, 3264, 1, 64, 1472, 1472, 1472, 64]
    - [0, 10.826]
  - - [1600, 3264, 1, 64, 1600, 1600, 1600, 64]
    - [0, 11.364]
  - - [1728, 3264, 1, 64, 1728, 1728, 1728, 64]
    - [0, 11.318]
  - - [1856, 3264, 1, 64, 1856, 1856, 1856, 64]
    - [0, 10.694]
  - - [1984, 3264, 1, 64, 1984, 1984, 1984, 64]
    - [0, 10.943]
  - - [2112, 3264, 1, 64, 2112, 2112, 2112, 64]
    - [0, 11.049]
  - - [2240, 3264, 1, 64, 2240, 2240, 2240, 64]
    - [0, 10.771]
  - - [2368, 3264, 1, 64, 2368, 2368, 2368, 64]
    - [0, 10.573]
  - - [2496, 3264, 1, 64, 2496, 2496, 2496, 64]
    - [0, 10.561]
  - - [2624, 3264, 1, 64, 2624, 2624, 2624, 64]
    - [0, 11.051]
  - - [2752, 3264, 1, 64, 2752, 2752, 2752, 64]
    - [0, 10.852]
  - - [2880, 3264, 1, 64, 2880, 2880, 2880, 64]
    - [0, 11.529]
  - - [3008, 3264, 1, 64, 3008, 3008, 3008, 64]
    - [0, 11.331]
  - - [3136, 3264, 1, 64, 3136, 3136, 3136, 64]
    - [0, 11.326]
  - - [3264, 3264, 1, 64, 3264, 3264, 3264, 64]
    - [0, 11.037]
  - - [3392, 3264, 1, 64, 3392, 3392, 3392, 64]
    - [0, 11.196]
  - - [3520, 3264, 1, 64, 3520, 3520, 3520, 64]
    - [0, 11.219]
  - - [3648, 3264, 1, 64, 3648, 3648, 3648, 64]
    - [0, 11.483]
  - - [3776, 3264, 1, 64, 3776, 3776, 3776, 64]
    - [0, 11.651]
  - - [3904, 3264, 1, 64, 3904, 3904, 3904, 64]
    - [0, 11.286]
  - - [4032, 3264, 1, 64, 4032, 4032, 4032, 64]
    - [0, 10.703]
  - - [64, 3392, 1, 64, 64, 64, 64, 64]
    - [2, 3.523]
  - - [192, 3392, 1, 64, 192, 192, 192, 64]
    - [0, 6.673]
  - - [320, 3392, 1, 64, 320, 320, 320, 64]
    - [0, 8.172]
  - - [448, 3392, 1, 64, 448, 448, 448, 64]
    - [0, 9.156]
  - - [576, 3392, 1, 64, 576, 576, 576, 64]
    - [0, 9.817]
  - - [704, 3392, 1, 64, 704, 704, 704, 64]
    - [0, 10.264]
  - - [832, 3392, 1, 64, 832, 832, 832, 64]
    - [0, 10.6]
  - - [960, 3392, 1, 64, 960, 960, 960, 64]
    - [0, 10.954]
  - - [1088, 3392, 1, 64, 1088, 1088, 1088, 64]
    - [0, 11.128]
  - - [1216, 3392, 1, 64, 1216, 1216, 1216, 64]
    - [0, 11.264]
  - - [1344, 3392, 1, 64, 1344, 1344, 1344, 64]
    - [0, 11.045]
  - - [1472, 3392, 1, 64, 1472, 1472, 1472, 64]
    - [0, 10.915]
  - - [1600, 3392, 1, 64, 1600, 1600, 1600, 64]
    - [0, 10.78]
  - - [1728, 3392, 1, 64, 1728, 1728, 1728, 64]
    - [0, 10.67]
  - - [1856, 3392, 1, 64, 1856, 1856, 1856, 64]
    - [0, 10.653]
  - - [1984, 3392, 1, 64, 1984, 1984, 1984, 64]
    - [0, 10.135]
  - - [2112, 3392, 1, 64, 2112, 2112, 2112, 64]
    - [0, 11.547]
  - - [2240, 3392, 1, 64, 2240, 2240, 2240, 64]
    - [0, 10.565]
  - - [2368, 3392, 1, 64, 2368, 2368, 2368, 64]
    - [0, 10.903]
  - - [2496, 3392, 1, 64, 2496, 2496, 2496, 64]
    - [0, 11.079]
  - - [2624, 3392, 1, 64, 2624, 2624, 2624, 64]
    - [0, 10.893]
  - - [2752, 3392, 1, 64, 2752, 2752, 2752, 64]
    - [0, 11.189]
  - - [2880, 3392, 1, 64, 2880, 2880, 2880, 64]
    - [0, 10.901]
  - - [3008, 3392, 1, 64, 3008, 3008, 3008, 64]
    - [0, 11.339]
  - - [3136, 3392, 1, 64, 3136, 3136, 3136, 64]
    - [0, 11.265]
  - - [3264, 3392, 1, 64, 3264, 3264, 3264, 64]
    - [0, 11.151]
  - - [3392, 3392, 1, 64, 3392, 3392, 3392, 64]
    - [0, 11.593]
  - - [3520, 3392, 1, 64, 3520, 3520, 3520, 64]
    - [0, 11.021]
  - - [3648, 3392, 1, 64, 3648, 3648, 3648, 64]
    - [0, 11.134]
  - - [3776, 3392, 1, 64, 3776, 3776, 3776, 64]
    - [0, 11.205]
  - - [3904, 3392, 1, 64, 3904, 3904, 3904, 64]
    - [0, 10.647]
  - - [4032, 3392, 1, 64, 4032, 4032, 4032, 64]
    - [0, 10.303]
  - - [64, 3520, 1, 64, 64, 64, 64, 64]
    - [3, 3.182]
  - - [192, 3520, 1, 64, 192, 192, 192, 64]
    - [0, 6.684]
  - - [320, 3520, 1, 64, 320, 320, 320, 64]
    - [0, 8.284]
  - - [448, 3520, 1, 64, 448, 448, 448, 64]
    - [0, 9.296]
  - - [576, 3520, 1, 64, 576, 576, 576, 64]
    - [0, 9.886]
  - - [704, 3520, 1, 64, 704, 704, 704, 64]
    - [0, 10.449]
  - - [832, 3520, 1, 64, 832, 832, 832, 64]
    - [0, 10.65]
  - - [960, 3520, 1, 64, 960, 960, 960, 64]
    - [0, 11.119]
  - - [1088, 3520, 1, 64, 1088, 1088, 1088, 64]
    - [0, 11.164]
  - - [1216, 3520, 1, 64, 1216, 1216, 1216, 64]
    - [0, 11.075]
  - - [1344, 3520, 1, 64, 1344, 1344, 1344, 64]
    - [0, 10.605]
  - - [1472, 3520, 1, 64, 1472, 1472, 1472, 64]
    - [0, 10.651]
  - - [1600, 3520, 1, 64, 1600, 1600, 1600, 64]
    - [0, 10.524]
  - - [1728, 3520, 1, 64, 1728, 1728, 1728, 64]
    - [0, 11.018]
  - - [1856, 3520, 1, 64, 1856, 1856, 1856, 64]
    - [0, 10.741]
  - - [1984, 3520, 1, 64, 1984, 1984, 1984, 64]
    - [0, 10.983]
  - - [2112, 3520, 1, 64, 2112, 2112, 2112, 64]
    - [0, 10.838]
  - - [2240, 3520, 1, 64, 2240, 2240, 2240, 64]
    - [0, 10.69]
  - - [2368, 3520, 1, 64, 2368, 2368, 2368, 64]
    - [0, 11.05]
  - - [2496, 3520, 1, 64, 2496, 2496, 2496, 64]
    - [0, 10.442]
  - - [2624, 3520, 1, 64, 2624, 2624, 2624, 64]
    - [0, 11.099]
  - - [2752, 3520, 1, 64, 2752, 2752, 2752, 64]
    - [0, 11.557]
  - - [2880, 3520, 1, 64, 2880, 2880, 2880, 64]
    - [0, 10.88]
  - - [3008, 3520, 1, 64, 3008, 3008, 3008, 64]
    - [0, 11.357]
  - - [3136, 3520, 1, 64, 3136, 3136, 3136, 64]
    - [0, 10.942]
  - - [3264, 3520, 1, 64, 3264, 3264, 3264, 64]
    - [0, 11.383]
  - - [3392, 3520, 1, 64, 3392, 3392, 3392, 64]
    - [0, 11.182]
  - - [3520, 3520, 1, 64, 3520, 3520, 3520, 64]
    - [0, 11.329]
  - - [3648, 3520, 1, 64, 3648, 3648, 3648, 64]
    - [0, 11.158]
  - - [3776, 3520, 1, 64, 3776, 3776, 3776, 64]
    - [0, 10.036]
  - - [3904, 3520, 1, 64, 3904, 3904, 3904, 64]
    - [0, 10.419]
  - - [4032, 3520, 1, 64, 4032, 4032, 4032, 64]
    - [0, 10.067]
  - - [64, 3648, 1, 64, 64, 64, 64, 64]
    - [0, 3.753]
  - - [192, 3648, 1, 64, 192, 192, 192, 64]
    - [0, 6.803]
  - - [320, 3648, 1, 64, 320, 320, 320, 64]
    - [0, 8.394]
  - - [448, 3648, 1, 64, 448, 448, 448, 64]
    - [0, 9.373]
  - - [576, 3648, 1, 64, 576, 576, 576, 64]
    - [0, 10.006]
  - - [704, 3648, 1, 64, 704, 704, 704, 64]
    - [0, 10.442]
  - - [832, 3648, 1, 64, 832, 832, 832, 64]
    - [0, 10.768]
  - - [960, 3648, 1, 64, 960, 960, 960, 64]
    - [0, 11.174]
  - - [1088, 3648, 1, 64, 1088, 1088, 1088, 64]
    - [0, 11.202]
  - - [1216, 3648, 1, 64, 1216, 1216, 1216, 64]
    - [0, 11.52]
  - - [1344, 3648, 1, 64, 1344, 1344, 1344, 64]
    - [0, 10.86]
  - - [1472, 3648, 1, 64, 1472, 1472, 1472, 64]
    - [0, 11.628]
  - - [1600, 3648, 1, 64, 1600, 1600, 1600, 64]
    - [0, 11.352]
  - - [1728, 3648, 1, 64, 1728, 1728, 1728, 64]
    - [0, 10.596]
  - - [1856, 3648, 1, 64, 1856, 1856, 1856, 64]
    - [0, 10.516]
  - - [1984, 3648, 1, 64, 1984, 1984, 1984, 64]
    - [0, 10.507]
  - - [2112, 3648, 1, 64, 2112, 2112, 2112, 64]
    - [0, 10.824]
  - - [2240, 3648, 1, 64, 2240, 2240, 2240, 64]
    - [0, 11.182]
  - - [2368, 3648, 1, 64, 2368, 2368, 2368, 64]
    - [0, 11.01]
  - - [2496, 3648, 1, 64, 2496, 2496, 2496, 64]
    - [0, 11.557]
  - - [2624, 3648, 1, 64, 2624, 2624, 2624, 64]
    - [0, 11.304]
  - - [2752, 3648, 1, 64, 2752, 2752, 2752, 64]
    - [0, 11.447]
  - - [2880, 3648, 1, 64, 2880, 2880, 2880, 64]
    - [0, 11.456]
  - - [3008, 3648, 1, 64, 3008, 3008, 3008, 64]
    - [0, 10.818]
  - - [3136, 3648, 1, 64, 3136, 3136, 3136, 64]
    - [0, 11.224]
  - - [3264, 3648, 1, 64, 3264, 3264, 3264, 64]
    - [0, 11.552]
  - - [3392, 3648, 1, 64, 3392, 3392, 3392, 64]
    - [0, 11.563]
  - - [3520, 3648, 1, 64, 3520, 3520, 3520, 64]
    - [0, 11.19]
  - - [3648, 3648, 1, 64, 3648, 3648, 3648, 64]
    - [0, 10.468]
  - - [3776, 3648, 1, 64, 3776, 3776, 3776, 64]
    - [0, 9.693]
  - - [3904, 3648, 1, 64, 3904, 3904, 3904, 64]
    - [0, 9.798]
  - - [4032, 3648, 1, 64, 4032, 4032, 4032, 64]
    - [2, 8.063]
  - - [64, 3776, 1, 64, 64, 64, 64, 64]
    - [0, 0.998]
  - - [192, 3776, 1, 64, 192, 192, 192, 64]
    - [2, 5.751]
  - - [320, 3776, 1, 64, 320, 320, 320, 64]
    - [0, 8.55]
  - - [448, 3776, 1, 64, 448, 448, 448, 64]
    - [0, 9.474]
  - - [576, 3776, 1, 64, 576, 576, 576, 64]
    - [0, 10.067]
  - - [704, 3776, 1, 64, 704, 704, 704, 64]
    - [0, 10.506]
  - - [832, 3776, 1, 64, 832, 832, 832, 64]
    - [0, 11.04]
  - - [960, 3776, 1, 64, 960, 960, 960, 64]
    - [0, 11.171]
  - - [1088, 3776, 1, 64, 1088, 1088, 1088, 64]
    - [0, 11.32]
  - - [1216, 3776, 1, 64, 1216, 1216, 1216, 64]
    - [0, 10.625]
  - - [1344, 3776, 1, 64, 1344, 1344, 1344, 64]
    - [0, 10.677]
  - - [1472, 3776, 1, 64, 1472, 1472, 1472, 64]
    - [0, 10.582]
  - - [1600, 3776, 1, 64, 1600, 1600, 1600, 64]
    - [0, 10.986]
  - - [1728, 3776, 1, 64, 1728, 1728, 1728, 64]
    - [0, 10.722]
  - - [1856, 3776, 1, 64, 1856, 1856, 1856, 64]
    - [0, 10.731]
  - - [1984, 3776, 1, 64, 1984, 1984, 1984, 64]
    - [0, 11.113]
  - - [2112, 3776, 1, 64, 2112, 2112, 2112, 64]
    - [0, 11.116]
  - - [2240, 3776, 1, 64, 2240, 2240, 2240, 64]
    - [0, 10.943]
  - - [2368, 3776, 1, 64, 2368, 2368, 2368, 64]
    - [0, 10.758]
  - - [2496, 3776, 1, 64, 2496, 2496, 2496, 64]
    - [0, 11.369]
  - - [2624, 3776, 1, 64, 2624, 2624, 2624, 64]
    - [0, 10.929]
  - - [2752, 3776, 1, 64, 2752, 2752, 2752, 64]
    - [0, 11.08]
  - - [2880, 3776, 1, 64, 2880, 2880, 2880, 64]
    - [0, 11.077]
  - - [3008, 3776, 1, 64, 3008, 3008, 3008, 64]
    - [0, 11.152]
  - - [3136, 3776, 1, 64, 3136, 3136, 3136, 64]
    - [0, 11.5]
  - - [3264, 3776, 1, 64, 3264, 3264, 3264, 64]
    - [0, 11.415]
  - - [3392, 3776, 1, 64, 3392, 3392, 3392, 64]
    - [0, 10.968]
  - - [3520, 3776, 1, 64, 3520, 3520, 3520, 64]
    - [0, 10.638]
  - - [3648, 3776, 1, 64, 3648, 3648, 3648, 64]
    - [0, 10.352]
  - - [3776, 3776, 1, 64, 3776, 3776, 3776, 64]
    - [0, 8.942]
  - - [3904, 3776, 1, 64, 3904, 3904, 3904, 64]
    - [2, 8.035]
  - - [4032, 3776, 1, 64, 4032, 4032, 4032, 64]
    - [2, 8.101]
  - - [64, 3904, 1, 64, 64, 64, 64, 64]
    - [0, 3.835]
  - - [192, 3904, 1, 64, 192, 192, 192, 64]
    - [0, 7.047]
  - - [320, 3904, 1, 64, 320, 320, 320, 64]
    - [0, 8.545]
  - - [448, 3904, 1, 64, 448, 448, 448, 64]
    - [0, 9.507]
  - - [576, 3904, 1, 64, 576, 576, 576, 64]
    - [0, 10.182]
  - - [704, 3904, 1, 64, 704, 704, 704, 64]
    - [0, 10.585]
  - - [832, 3904, 1, 64, 832, 832, 832, 64]
    - [0, 10.982]
  - - [960, 3904, 1, 64, 960, 960, 960, 64]
    - [0, 10.794]
  - - [1088, 3904, 1, 64, 1088, 1088, 1088, 64]
    - [0, 10.775]
  - - [1216, 3904, 1, 64, 1216, 1216, 1216, 64]
    - [0, 10.715]
  - - [1344, 3904, 1, 64, 1344, 1344, 1344, 64]
    - [0, 11.472]
  - - [1472, 3904, 1, 64, 1472, 1472, 1472, 64]
    - [0, 11.261]
  - - [1600, 3904, 1, 64, 1600, 1600, 1600, 64]
    - [0, 10.365]
  - - [1728, 3904, 1, 64, 1728, 1728, 1728, 64]
    - [0, 11.011]
  - - [1856, 3904, 1, 64, 1856, 1856, 1856, 64]
    - [0, 11.161]
  - - [1984, 3904, 1, 64, 1984, 1984, 1984, 64]
    - [0, 11.192]
  - - [2112, 3904, 1, 64, 2112, 2112, 2112, 64]
    - [0, 11.252]
  - - [2240, 3904, 1, 64, 2240, 2240, 2240, 64]
    - [0, 10.96]
  - - [2368, 3904, 1, 64, 2368, 2368, 2368, 64]
    - [0, 10.881]
  - - [2496, 3904, 1, 64, 2496, 2496, 2496, 64]
    - [0, 10.911]
  - - [2624, 3904, 1, 64, 2624, 2624, 2624, 64]
    - [0, 11.17]
  - - [2752, 3904, 1, 64, 2752, 2752, 2752, 64]
    - [0, 11.478]
  - - [2880, 3904, 1, 64, 2880, 2880, 2880, 64]
    - [0, 11.537]
  - - [3008, 3904, 1, 64, 3008, 3008, 3008, 64]
    - [0, 11.453]
  - - [3136, 3904, 1, 64, 3136, 3136, 3136, 64]
    - [0, 11.396]
  - - [3264, 3904, 1, 64, 3264, 3264, 3264, 64]
    - [0, 11.231]
  - - [3392, 3904, 1, 64, 3392, 3392, 3392, 64]
    - [0, 10.608]
  - - [3520, 3904, 1, 64, 3520, 3520, 3520, 64]
    - [0, 10.565]
  - - [3648, 3904, 1, 64, 3648, 3648, 3648, 64]
    - [0, 9.821]
  - - [3776, 3904, 1, 64, 3776, 3776, 3776, 64]
    - [0, 7.401]
  - - [3904, 3904, 1, 64, 3904, 3904, 3904, 64]
    - [2, 8.024]
  - - [4032, 3904, 1, 64, 4032, 4032, 4032, 64]
    - [2, 8.096]
  - - [64, 4032, 1, 64, 64, 64, 64, 64]
    - [0, 3.941]
  - - [192, 4032, 1, 64, 192, 192, 192, 64]
    - [0, 7.173]
  - - [320, 4032, 1, 64, 320, 320, 320, 64]
    - [0, 8.721]
  - - [448, 4032, 1, 64, 448, 448, 448, 64]
    - [0, 9.64]
  - - [576, 4032, 1, 64, 576, 576, 576, 64]
    - [0, 10.197]
  - - [704, 4032, 1, 64, 704, 704, 704, 64]
    - [0, 10.885]
  - - [832, 4032, 1, 64, 832, 832, 832, 64]
    - [0, 10.981]
  - - [960, 4032, 1, 64, 960, 960, 960, 64]
    - [0, 11.161]
  - - [1088, 4032, 1, 64, 1088, 1088, 1088, 64]
    - [0, 11.113]
  - - [1216, 4032, 1, 64, 1216, 1216, 1216, 64]
    - [0, 10.997]
  - - [1344, 4032, 1, 64, 1344, 1344, 1344, 64]
    - [0, 11.712]
  - - [1472, 4032, 1, 64, 1472, 1472, 1472, 64]
    - [0, 11.622]
  - - [1600, 4032, 1, 64, 1600, 1600, 1600, 64]
    - [0, 10.661]
  - - [1728, 4032, 1, 64, 1728, 1728, 1728, 64]
    - [0, 10.7]
  - - [1856, 4032, 1, 64, 1856, 1856, 1856, 64]
    - [0, 10.808]
  - - [1984, 4032, 1, 64, 1984, 1984, 1984, 64]
    - [0, 10.641]
  - - [2112, 4032, 1, 64, 2112, 2112, 2112, 64]
    - [0, 10.964]
  - - [2240, 4032, 1, 64, 2240, 2240, 2240, 64]
    - [0, 11.006]
  - - [2368, 4032, 1, 64, 2368, 2368, 2368, 64]
    - [0, 10.969]
  - - [2496, 4032, 1, 64, 2496, 2496, 2496, 64]
    - [0, 11.424]
  - - [2624, 4032, 1, 64, 2624, 2624, 2624, 64]
    - [0, 11.187]
  - - [2752, 4032, 1, 64, 2752, 2752, 2752, 64]
    - [0, 11.023]
  - - [2880, 4032, 1, 64, 2880, 2880, 2880, 64]
    - [0, 11.173]
  - - [3008, 4032, 1, 64, 3008, 3008, 3008, 64]
    - [0, 11.296]
  - - [3136, 4032, 1, 64, 3136, 3136, 3136, 64]
    - [0, 11.222]
  - - [3264, 4032, 1, 64, 3264, 3264, 3264, 64]
    - [0, 10.752]
  - - [3392, 4032, 1, 64, 3392, 3392, 3392, 64]
    - [0, 10.405]
  - - [3520, 4032, 1, 64, 3520, 3520, 3520, 64]
    - [0, 9.808]
  - - [3648, 4032, 1, 64, 3648, 3648, 3648, 64]
    - [2, 8.148]
  - - [3776, 4032, 1, 64, 3776, 3776, 3776, 64]
    - [0, 7.497]
  - - [3904, 4032, 1, 64, 3904, 3904, 3904, 64]
    - [2, 8.002]
  - - [4032, 4032, 1, 64, 4032, 4032, 4032, 64]
    - [2, 8.066]
  - - [64, 64, 1, 256, 64, 64, 64, 256]
    - [1, 0.315]
  - - [192, 64, 1, 256, 192, 192, 192, 256]
    - [1, 0.921]
  - - [320, 64, 1, 256, 320, 320, 320, 256]
    - [2, 1.537]
  - - [448, 64, 1, 256, 448, 448, 448, 256]
    - [0, 1.951]
  - - [576, 64, 1, 256, 576, 576, 576, 256]
    - [0, 2.515]
  - - [704, 64, 1, 256, 704, 704, 704, 256]
    - [0, 3.06]
  - - [832, 64, 1, 256, 832, 832, 832, 256]
    - [2, 3.091]
  - - [960, 64, 1, 256, 960, 960, 960, 256]
    - [2, 3.511]
  - - [1088, 64, 1, 256, 1088, 1088, 1088, 256]
    - [2, 3.965]
  - - [1216, 64, 1, 256, 1216, 1216, 1216, 256]
    - [0, 4.191]
  - - [1344, 64, 1, 256, 1344, 1344, 1344, 256]
    - [0, 4.629]
  - - [1472, 64, 1, 256, 1472, 1472, 1472, 256]
    - [0, 5.075]
  - - [1600, 64, 1, 256, 1600, 1600, 1600, 256]
    - [2, 4.802]
  - - [1728, 64, 1, 256, 1728, 1728, 1728, 256]
    - [2, 5.164]
  - - [1856, 64, 1, 256, 1856, 1856, 1856, 256]
    - [2, 5.566]
  - - [1984, 64, 1, 256, 1984, 1984, 1984, 256]
    - [0, 5.68]
  - - [2112, 64, 1, 256, 2112, 2112, 2112, 256]
    - [0, 6.042]
  - - [2240, 64, 1, 256, 2240, 2240, 2240, 256]
    - [0, 6.402]
  - - [2368, 64, 1, 256, 2368, 2368, 2368, 256]
    - [2, 6.127]
  - - [2496, 64, 1, 256, 2496, 2496, 2496, 256]
    - [2, 6.36]
  - - [2624, 64, 1, 256, 2624, 2624, 2624, 256]
    - [2, 6.581]
  - - [2752, 64, 1, 256, 2752, 2752, 2752, 256]
    - [0, 6.626]
  - - [2880, 64, 1, 256, 2880, 2880, 2880, 256]
    - [0, 6.908]
  - - [3008, 64, 1, 256, 3008, 3008, 3008, 256]
    - [0, 7.191]
  - - [3136, 64, 1, 256, 3136, 3136, 3136, 256]
    - [0, 6.754]
  - - [3264, 64, 1, 256, 3264, 3264, 3264, 256]
    - [2, 7.056]
  - - [3392, 64, 1, 256, 3392, 3392, 3392, 256]
    - [2, 7.341]
  - - [3520, 64, 1, 256, 3520, 3520, 3520, 256]
    - [2, 7.541]
  - - [3648, 64, 1, 256, 3648, 3648, 3648, 256]
    - [0, 7.782]
  - - [3776, 64, 1, 256, 3776, 3776, 3776, 256]
    - [0, 8.048]
  - - [3904, 64, 1, 256, 3904, 3904, 3904, 256]
    - [2, 7.689]
  - - [4032, 64, 1, 256, 4032, 4032, 4032, 256]
    - [2, 7.81]
  - - [64, 192, 1, 256, 64, 64, 64, 256]
    - [1, 0.912]
  - - [192, 192, 1, 256, 192, 192, 192, 256]
    - [0, 2.397]
  - - [320, 192, 1, 256, 320, 320, 320, 256]
    - [2, 3.484]
  - - [448, 192, 1, 256, 448, 448, 448, 256]
    - [0, 4.552]
  - - [576, 192, 1, 256, 576, 576, 576, 256]
    - [2, 5.111]
  - - [704, 192, 1, 256, 704, 704, 704, 256]
    - [0, 5.917]
  - - [832, 192, 1, 256, 832, 832, 832, 256]
    - [2, 6.289]
  - - [960, 192, 1, 256, 960, 960, 960, 256]
    - [0, 6.908]
  - - [1088, 192, 1, 256, 1088, 1088, 1088, 256]
    - [2, 7.084]
  - - [1216, 192, 1, 256, 1216, 1216, 1216, 256]
    - [0, 7.755]
  - - [1344, 192, 1, 256, 1344, 1344, 1344, 256]
    - [2, 7.809]
  - - [1472, 192, 1, 256, 1472, 1472, 1472, 256]
    - [0, 8.358]
  - - [1600, 192, 1, 256, 1600, 1600, 1600, 256]
    - [2, 8.372]
  - - [1728, 192, 1, 256, 1728, 1728, 1728, 256]
    - [0, 8.794]
  - - [1856, 192, 1, 256, 1856, 1856, 1856, 256]
    - [2, 8.89]
  - - [1984, 192, 1, 256, 1984, 1984, 1984, 256]
    - [0, 9.157]
  - - [2112, 192, 1, 256, 2112, 2112, 2112, 256]
    - [2, 9.308]
  - - [2240, 192, 1, 256, 2240, 2240, 2240, 256]
    - [0, 9.504]
  - - [2368, 192, 1, 256, 2368, 2368, 2368, 256]
    - [2, 9.621]
  - - [2496, 192, 1, 256, 2496, 2496, 2496, 256]
    - [0, 9.809]
  - - [2624, 192, 1, 256, 2624, 2624, 2624, 256]
    - [2, 9.903]
  - - [2752, 192, 1, 256, 2752, 2752, 2752, 256]
    - [2, 10.036]
  - - [2880, 192, 1, 256, 2880, 2880, 2880, 256]
    - [2, 10.104]
  - - [3008, 192, 1, 256, 3008, 3008, 3008, 256]
    - [2, 10.238]
  - - [3136, 192, 1, 256, 3136, 3136, 3136, 256]
    - [2, 10.328]
  - - [3264, 192, 1, 256, 3264, 3264, 3264, 256]
    - [2, 10.381]
  - - [3392, 192, 1, 256, 3392, 3392, 3392, 256]
    - [2, 10.454]
  - - [3520, 192, 1, 256, 3520, 3520, 3520, 256]
    - [2, 10.555]
  - - [3648, 192, 1, 256, 3648, 3648, 3648, 256]
    - [2, 10.613]
  - - [3776, 192, 1, 256, 3776, 3776, 3776, 256]
    - [2, 10.7]
  - - [3904, 192, 1, 256, 3904, 3904, 3904, 256]
    - [2, 10.824]
  - - [4032, 192, 1, 256, 4032, 4032, 4032, 256]
    - [2, 10.868]
  - - [64, 320, 1, 256, 64, 64, 64, 256]
    - [2, 1.517]
  - - [192, 320, 1, 256, 192, 192, 192, 256]
    - [2, 3.505]
  - - [320, 320, 1, 256, 320, 320, 320, 256]
    - [2, 4.752]
  - - [448, 320, 1, 256, 448, 448, 448, 256]
    - [0, 6.275]
  - - [576, 320, 1, 256, 576, 576, 576, 256]
    - [0, 6.915]
  - - [704, 320, 1, 256, 704, 704, 704, 256]
    - [2, 7.546]
  - - [832, 320, 1, 256, 832, 832, 832, 256]
    - [2, 7.922]
  - - [960, 320, 1, 256, 960, 960, 960, 256]
    - [2, 8.332]
  - - [1088, 320, 1, 256, 1088, 1088, 1088, 256]
    - [2, 8.753]
  - - [1216, 320, 1, 256, 1216, 1216, 1216, 256]
    - [0, 9.344]
  - - [1344, 320, 1, 256, 1344, 1344, 1344, 256]
    - [0, 9.586]
  - - [1472, 320, 1, 256, 1472, 1472, 1472, 256]
    - [0, 9.614]
  - - [1600, 320, 1, 256, 1600, 1600, 1600, 256]
    - [2, 9.968]
  - - [1728, 320, 1, 256, 1728, 1728, 1728, 256]
    - [2, 10.165]
  - - [1856, 320, 1, 256, 1856, 1856, 1856, 256]
    - [2, 10.274]
  - - [1984, 320, 1, 256, 1984, 1984, 1984, 256]
    - [2, 10.508]
  - - [2112, 320, 1, 256, 2112, 2112, 2112, 256]
    - [2, 10.593]
  - - [2240, 320, 1, 256, 2240, 2240, 2240, 256]
    - [2, 10.706]
  - - [2368, 320, 1, 256, 2368, 2368, 2368, 256]
    - [2, 10.814]
  - - [2496, 320, 1, 256, 2496, 2496, 2496, 256]
    - [2, 10.923]
  - - [2624, 320, 1, 256, 2624, 2624, 2624, 256]
    - [2, 11.147]
  - - [2752, 320, 1, 256, 2752, 2752, 2752, 256]
    - [2, 11.156]
  - - [2880, 320, 1, 256, 2880, 2880, 2880, 256]
    - [2, 11.247]
  - - [3008, 320, 1, 256, 3008, 3008, 3008, 256]
    - [2, 11.683]
  - - [3136, 320, 1, 256, 3136, 3136, 3136, 256]
    - [2, 11.485]
  - - [3264, 320, 1, 256, 3264, 3264, 3264, 256]
    - [2, 11.861]
  - - [3392, 320, 1, 256, 3392, 3392, 3392, 256]
    - [2, 11.538]
  - - [3520, 320, 1, 256, 3520, 3520, 3520, 256]
    - [2, 11.813]
  - - [3648, 320, 1, 256, 3648, 3648, 3648, 256]
    - [2, 11.831]
  - - [3776, 320, 1, 256, 3776, 3776, 3776, 256]
    - [2, 12.007]
  - - [3904, 320, 1, 256, 3904, 3904, 3904, 256]
    - [2, 12.012]
  - - [4032, 320, 1, 256, 4032, 4032, 4032, 256]
    - [2, 12.314]
  - - [64, 448, 1, 256, 64, 64, 64, 256]
    - [2, 1.971]
  - - [192, 448, 1, 256, 192, 192, 192, 256]
    - [0, 4.666]
  - - [320, 448, 1, 256, 320, 320, 320, 256]
    - [0, 6.408]
  - - [448, 448, 1, 256, 448, 448, 448, 256]
    - [2, 7.002]
  - - [576, 448, 1, 256, 576, 576, 576, 256]
    - [2, 7.922]
  - - [704, 448, 1, 256, 704, 704, 704, 256]
    - [2, 8.593]
  - - [832, 448, 1, 256, 832, 832, 832, 256]
    - [2, 9.186]
  - - [960, 448, 1, 256, 960, 960, 960, 256]
    - [0, 9.641]
  - - [1088, 448, 1, 256, 1088, 1088, 1088, 256]
    - [0, 9.964]
  - - [1216, 448, 1, 256, 1216, 1216, 1216, 256]
    - [2, 10.2]
  - - [1344, 448, 1, 256, 1344, 1344, 1344, 256]
    - [2, 10.517]
  - - [1472, 448, 1, 256, 1472, 1472, 1472, 256]
    - [2, 10.647]
  - - [1600, 448, 1, 256, 1600, 1600, 1600, 256]
    - [2, 10.839]
  - - [1728, 448, 1, 256, 1728, 1728, 1728, 256]
    - [2, 11.02]
  - - [1856, 448, 1, 256, 1856, 1856, 1856, 256]
    - [2, 11.252]
  - - [1984, 448, 1, 256, 1984, 1984, 1984, 256]
    - [2, 11.278]
  - - [2112, 448, 1, 256, 2112, 2112, 2112, 256]
    - [2, 11.284]
  - - [2240, 448, 1, 256, 2240, 2240, 2240, 256]
    - [2, 11.511]
  - - [2368, 448, 1, 256, 2368, 2368, 2368, 256]
    - [2, 11.697]
  - - [2496, 448, 1, 256, 2496, 2496, 2496, 256]
    - [2, 11.993]
  - - [2624, 448, 1, 256, 2624, 2624, 2624, 256]
    - [2, 11.923]
  - - [2752, 448, 1, 256, 2752, 2752, 2752, 256]
    - [2, 12.171]
  - - [2880, 448, 1, 256, 2880, 2880, 2880, 256]
    - [2, 12.216]
  - - [3008, 448, 1, 256, 3008, 3008, 3008, 256]
    - [2, 12.302]
  - - [3136, 448, 1, 256, 3136, 3136, 3136, 256]
    - [2, 12.188]
  - - [3264, 448, 1, 256, 3264, 3264, 3264, 256]
    - [2, 12.438]
  - - [3392, 448, 1, 256, 3392, 3392, 3392, 256]
    - [2, 12.4]
  - - [3520, 448, 1, 256, 3520, 3520, 3520, 256]
    - [2, 12.417]
  - - [3648, 448, 1, 256, 3648, 3648, 3648, 256]
    - [2, 11.991]
  - - [3776, 448, 1, 256, 3776, 3776, 3776, 256]
    - [2, 12.336]
  - - [3904, 448, 1, 256, 3904, 3904, 3904, 256]
    - [2, 12.102]
  - - [4032, 448, 1, 256, 4032, 4032, 4032, 256]
    - [2, 12.504]
  - - [64, 576, 1, 256, 64, 64, 64, 256]
    - [1, 1.169]
  - - [192, 576, 1, 256, 192, 192, 192, 256]
    - [1, 3.511]
  - - [320, 576, 1, 256, 320, 320, 320, 256]
    - [2, 5.875]
  - - [448, 576, 1, 256, 448, 448, 448, 256]
    - [2, 7.782]
  - - [576, 576, 1, 256, 576, 576, 576, 256]
    - [0, 8.766]
  - - [704, 576, 1, 256, 704, 704, 704, 256]
    - [2, 9.27]
  - - [832, 576, 1, 256, 832, 832, 832, 256]
    - [0, 9.794]
  - - [960, 576, 1, 256, 960, 960, 960, 256]
    - [2, 10.103]
  - - [1088, 576, 1, 256, 1088, 1088, 1088, 256]
    - [2, 10.451]
  - - [1216, 576, 1, 256, 1216, 1216, 1216, 256]
    - [2, 10.613]
  - - [1344, 576, 1, 256, 1344, 1344, 1344, 256]
    - [2, 10.886]
  - - [1472, 576, 1, 256, 1472, 1472, 1472, 256]
    - [2, 11.007]
  - - [1600, 576, 1, 256, 1600, 1600, 1600, 256]
    - [2, 11.379]
  - - [1728, 576, 1, 256, 1728, 1728, 1728, 256]
    - [2, 11.772]
  - - [1856, 576, 1, 256, 1856, 1856, 1856, 256]
    - [2, 11.75]
  - - [1984, 576, 1, 256, 1984, 1984, 1984, 256]
    - [2, 12.018]
  - - [2112, 576, 1, 256, 2112, 2112, 2112, 256]
    - [2, 12.044]
  - - [2240, 576, 1, 256, 2240, 2240, 2240, 256]
    - [2, 11.995]
  - - [2368, 576, 1, 256, 2368, 2368, 2368, 256]
    - [2, 12.129]
  - - [2496, 576, 1, 256, 2496, 2496, 2496, 256]
    - [2, 12.105]
  - - [2624, 576, 1, 256, 2624, 2624, 2624, 256]
    - [2, 12.013]
  - - [2752, 576, 1, 256, 2752, 2752, 2752, 256]
    - [2, 12.186]
  - - [2880, 576, 1, 256, 2880, 2880, 2880, 256]
    - [2, 12.247]
  - - [3008, 576, 1, 256, 3008, 3008, 3008, 256]
    - [2, 12.238]
  - - [3136, 576, 1, 256, 3136, 3136, 3136, 256]
    - [2, 12.059]
  - - [3264, 576, 1, 256, 3264, 3264, 3264, 256]
    - [0, 12.054]
  - - [3392, 576, 1, 256, 3392, 3392, 3392, 256]
    - [0, 12.185]
  - - [3520, 576, 1, 256, 3520, 3520, 3520, 256]
    - [2, 12.185]
  - - [3648, 576, 1, 256, 3648, 3648, 3648, 256]
    - [2, 12.172]
  - - [3776, 576, 1, 256, 3776, 3776, 3776, 256]
    - [2, 12.189]
  - - [3904, 576, 1, 256, 3904, 3904, 3904, 256]
    - [2, 12.319]
  - - [4032, 576, 1, 256, 4032, 4032, 4032, 256]
    - [2, 12.2]
  - - [64, 704, 1, 256, 64, 64, 64, 256]
    - [1, 1.453]
  - - [192, 704, 1, 256, 192, 192, 192, 256]
    - [3, 4.323]
  - - [320, 704, 1, 256, 320, 320, 320, 256]
    - [0, 7.222]
  - - [448, 704, 1, 256, 448, 448, 448, 256]
    - [2, 8.547]
  - - [576, 704, 1, 256, 576, 576, 576, 256]
    - [2, 9.368]
  - - [704, 704, 1, 256, 704, 704, 704, 256]
    - [2, 9.939]
  - - [832, 704, 1, 256, 832, 832, 832, 256]
    - [2, 10.371]
  - - [960, 704, 1, 256, 960, 960, 960, 256]
    - [2, 10.727]
  - - [1088, 704, 1, 256, 1088, 1088, 1088, 256]
    - [2, 10.815]
  - - [1216, 704, 1, 256, 1216, 1216, 1216, 256]
    - [2, 11.175]
  - - [1344, 704, 1, 256, 1344, 1344, 1344, 256]
    - [2, 11.317]
  - - [1472, 704, 1, 256, 1472, 1472, 1472, 256]
    - [2, 11.721]
  - - [1600, 704, 1, 256, 1600, 1600, 1600, 256]
    - [2, 11.77]
  - - [1728, 704, 1, 256, 1728, 1728, 1728, 256]
    - [2, 11.974]
  - - [1856, 704, 1, 256, 1856, 1856, 1856, 256]
    - [2, 12.318]
  - - [1984, 704, 1, 256, 1984, 1984, 1984, 256]
    - [2, 12.111]
  - - [2112, 704, 1, 256, 2112, 2112, 2112, 256]
    - [2, 12.092]
  - - [2240, 704, 1, 256, 2240, 2240, 2240, 256]
    - [2, 12.252]
  - - [2368, 704, 1, 256, 2368, 2368, 2368, 256]
    - [2, 12.207]
  - - [2496, 704, 1, 256, 2496, 2496, 2496, 256]
    - [2, 12.138]
  - - [2624, 704, 1, 256, 2624, 2624, 2624, 256]
    - [2, 12.228]
  - - [2752, 704, 1, 256, 2752, 2752, 2752, 256]
    - [2, 12.155]
  - - [2880, 704, 1, 256, 2880, 2880, 2880, 256]
    - [2, 12.25]
  - - [3008, 704, 1, 256, 3008, 3008, 3008, 256]
    - [2, 12.167]
  - - [3136, 704, 1, 256, 3136, 3136, 3136, 256]
    - [2, 12.197]
  - - [3264, 704, 1, 256, 3264, 3264, 3264, 256]
    - [2, 12.189]
  - - [3392, 704, 1, 256, 3392, 3392, 3392, 256]
    - [2, 12.251]
  - - [3520, 704, 1, 256, 3520, 3520, 3520, 256]
    - [2, 12.264]
  - - [3648, 704, 1, 256, 3648, 3648, 3648, 256]
    - [2, 12.262]
  - - [3776, 704, 1, 256, 3776, 3776, 3776, 256]
    - [2, 12.378]
  - - [3904, 704, 1, 256, 3904, 3904, 3904, 256]
    - [2, 12.229]
  - - [4032, 704, 1, 256, 4032, 4032, 4032, 256]
    - [2, 12.241]
  - - [64, 832, 1, 256, 64, 64, 64, 256]
    - [3, 1.725]
  - - [192, 832, 1, 256, 192, 192, 192, 256]
    - [2, 5.089]
  - - [320, 832, 1, 256, 320, 320, 320, 256]
    - [2, 8.117]
  - - [448, 832, 1, 256, 448, 448, 448, 256]
    - [2, 9.092]
  - - [576, 832, 1, 256, 576, 576, 576, 256]
    - [0, 9.904]
  - - [704, 832, 1, 256, 704, 704, 704, 256]
    - [2, 10.442]
  - - [832, 832, 1, 256, 832, 832, 832, 256]
    - [2, 10.759]
  - - [960, 832, 1, 256, 960, 960, 960, 256]
    - [2, 11.035]
  - - [1088, 832, 1, 256, 1088, 1088, 1088, 256]
    - [2, 11.31]
  - - [1216, 832, 1, 256, 1216, 1216, 1216, 256]
    - [2, 11.612]
  - - [1344, 832, 1, 256, 1344, 1344, 1344, 256]
    - [2, 11.896]
  - - [1472, 832, 1, 256, 1472, 1472, 1472, 256]
    - [2, 12.034]
  - - [1600, 832, 1, 256, 1600, 1600, 1600, 256]
    - [2, 11.995]
  - - [1728, 832, 1, 256, 1728, 1728, 1728, 256]
    - [2, 12.051]
  - - [1856, 832, 1, 256, 1856, 1856, 1856, 256]
    - [2, 12.183]
  - - [1984, 832, 1, 256, 1984, 1984, 1984, 256]
    - [2, 12.38]
  - - [2112, 832, 1, 256, 2112, 2112, 2112, 256]
    - [2, 12.111]
  - - [2240, 832, 1, 256, 2240, 2240, 2240, 256]
    - [2, 12.439]
  - - [2368, 832, 1, 256, 2368, 2368, 2368, 256]
    - [2, 12.16]
  - - [2496, 832, 1, 256, 2496, 2496, 2496, 256]
    - [0, 12.161]
  - - [2624, 832, 1, 256, 2624, 2624, 2624, 256]
    - [2, 12.251]
  - - [2752, 832, 1, 256, 2752, 2752, 2752, 256]
    - [2, 12.122]
  - - [2880, 832, 1, 256, 2880, 2880, 2880, 256]
    - [2, 12.273]
  - - [3008, 832, 1, 256, 3008, 3008, 3008, 256]
    - [2, 12.222]
  - - [3136, 832, 1, 256, 3136, 3136, 3136, 256]
    - [2, 12.334]
  - - [3264, 832, 1, 256, 3264, 3264, 3264, 256]
    - [2, 12.426]
  - - [3392, 832, 1, 256, 3392, 3392, 3392, 256]
    - [2, 12.491]
  - - [3520, 832, 1, 256, 3520, 3520, 3520, 256]
    - [2, 12.516]
  - - [3648, 832, 1, 256, 3648, 3648, 3648, 256]
    - [2, 12.427]
  - - [3776, 832, 1, 256, 3776, 3776, 3776, 256]
    - [2, 12.413]
  - - [3904, 832, 1, 256, 3904, 3904, 3904, 256]
    - [2, 12.459]
  - - [4032, 832, 1, 256, 4032, 4032, 4032, 256]
    - [2, 12.484]
  - - [64, 960, 1, 256, 64, 64, 64, 256]
    - [0, 1.975]
  - - [192, 960, 1, 256, 192, 192, 192, 256]
    - [0, 5.907]
  - - [320, 960, 1, 256, 320, 320, 320, 256]
    - [2, 8.295]
  - - [448, 960, 1, 256, 448, 448, 448, 256]
    - [0, 9.561]
  - - [576, 960, 1, 256, 576, 576, 576, 256]
    - [2, 10.141]
  - - [704, 960, 1, 256, 704, 704, 704, 256]
    - [2, 10.642]
  - - [832, 960, 1, 256, 832, 832, 832, 256]
    - [2, 10.938]
  - - [960, 960, 1, 256, 960, 960, 960, 256]
    - [2, 11.356]
  - - [1088, 960, 1, 256, 1088, 1088, 1088, 256]
    - [2, 11.775]
  - - [1216, 960, 1, 256, 1216, 1216, 1216, 256]
    - [2, 11.893]
  - - [1344, 960, 1, 256, 1344, 1344, 1344, 256]
    - [2, 11.976]
  - - [1472, 960, 1, 256, 1472, 1472, 1472, 256]
    - [0, 12.128]
  - - [1600, 960, 1, 256, 1600, 1600, 1600, 256]
    - [2, 12.276]
  - - [1728, 960, 1, 256, 1728, 1728, 1728, 256]
    - [2, 12.386]
  - - [1856, 960, 1, 256, 1856, 1856, 1856, 256]
    - [2, 12.47]
  - - [1984, 960, 1, 256, 1984, 1984, 1984, 256]
    - [2, 12.362]
  - - [2112, 960, 1, 256, 2112, 2112, 2112, 256]
    - [2, 12.051]
  - - [2240, 960, 1, 256, 2240, 2240, 2240, 256]
    - [2, 12.24]
  - - [2368, 960, 1, 256, 2368, 2368, 2368, 256]
    - [2, 12.176]
  - - [2496, 960, 1, 256, 2496, 2496, 2496, 256]
    - [2, 12.246]
  - - [2624, 960, 1, 256, 2624, 2624, 2624, 256]
    - [2, 12.323]
  - - [2752, 960, 1, 256, 2752, 2752, 2752, 256]
    - [2, 12.196]
  - - [2880, 960, 1, 256, 2880, 2880, 2880, 256]
    - [2, 12.403]
  - - [3008, 960, 1, 256, 3008, 3008, 3008, 256]
    - [2, 12.124]
  - - [3136, 960, 1, 256, 3136, 3136, 3136, 256]
    - [2, 12.358]
  - - [3264, 960, 1, 256, 3264, 3264, 3264, 256]
    - [2, 12.498]
  - - [3392, 960, 1, 256, 3392, 3392, 3392, 256]
    - [2, 12.357]
  - - [3520, 960, 1, 256, 3520, 3520, 3520, 256]
    - [2, 12.54]
  - - [3648, 960, 1, 256, 3648, 3648, 3648, 256]
    - [2, 12.539]
  - - [3776, 960, 1, 256, 3776, 3776, 3776, 256]
    - [2, 12.723]
  - - [3904, 960, 1, 256, 3904, 3904, 3904, 256]
    - [2, 12.691]
  - - [4032, 960, 1, 256, 4032, 4032, 4032, 256]
    - [2, 12.704]
  - - [64, 1088, 1, 256, 64, 64, 64, 256]
    - [1, 2.226]
  - - [192, 1088, 1, 256, 192, 192, 192, 256]
    - [0, 6.72]
  - - [320, 1088, 1, 256, 320, 320, 320, 256]
    - [2, 8.842]
  - - [448, 1088, 1, 256, 448, 448, 448, 256]
    - [0, 10.059]
  - - [576, 1088, 1, 256, 576, 576, 576, 256]
    - [0, 10.55]
  - - [704, 1088, 1, 256, 704, 704, 704, 256]
    - [2, 10.85]
  - - [832, 1088, 1, 256, 832, 832, 832, 256]
    - [2, 11.284]
  - - [960, 1088, 1, 256, 960, 960, 960, 256]
    - [2, 11.795]
  - - [1088, 1088, 1, 256, 1088, 1088, 1088, 256]
    - [2, 11.846]
  - - [1216, 1088, 1, 256, 1216, 1216, 1216, 256]
    - [2, 12.218]
  - - [1344, 1088, 1, 256, 1344, 1344, 1344, 256]
    - [2, 12.296]
  - - [1472, 1088, 1, 256, 1472, 1472, 1472, 256]
    - [2, 12.139]
  - - [1600, 1088, 1, 256, 1600, 1600, 1600, 256]
    - [2, 12.074]
  - - [1728, 1088, 1, 256, 1728, 1728, 1728, 256]
    - [2, 12.404]
  - - [1856, 1088, 1, 256, 1856, 1856, 1856, 256]
    - [2, 12.597]
  - - [1984, 1088, 1, 256, 1984, 1984, 1984, 256]
    - [2, 12.299]
  - - [2112, 1088, 1, 256, 2112, 2112, 2112, 256]
    - [2, 12.29]
  - - [2240, 1088, 1, 256, 2240, 2240, 2240, 256]
    - [2, 12.365]
  - - [2368, 1088, 1, 256, 2368, 2368, 2368, 256]
    - [2, 12.398]
  - - [2496, 1088, 1, 256, 2496, 2496, 2496, 256]
    - [2, 12.355]
  - - [2624, 1088, 1, 256, 2624, 2624, 2624, 256]
    - [2, 12.296]
  - - [2752, 1088, 1, 256, 2752, 2752, 2752, 256]
    - [2, 12.57]
  - - [2880, 1088, 1, 256, 2880, 2880, 2880, 256]
    - [2, 12.56]
  - - [3008, 1088, 1, 256, 3008, 3008, 3008, 256]
    - [2, 12.718]
  - - [3136, 1088, 1, 256, 3136, 3136, 3136, 256]
    - [2, 12.624]
  - - [3264, 1088, 1, 256, 3264, 3264, 3264, 256]
    - [2, 12.2]
  - - [3392, 1088, 1, 256, 3392, 3392, 3392, 256]
    - [2, 12.725]
  - - [3520, 1088, 1, 256, 3520, 3520, 3520, 256]
    - [2, 12.567]
  - - [3648, 1088, 1, 256, 3648, 3648, 3648, 256]
    - [2, 12.458]
  - - [3776, 1088, 1, 256, 3776, 3776, 3776, 256]
    - [2, 12.588]
  - - [3904, 1088, 1, 256, 3904, 3904, 3904, 256]
    - [2, 12.708]
  - - [4032, 1088, 1, 256, 4032, 4032, 4032, 256]
    - [2, 12.732]
  - - [64, 1216, 1, 256, 64, 64, 64, 256]
    - [0, 4.128]
  - - [192, 1216, 1, 256, 192, 192, 192, 256]
    - [0, 7.761]
  - - [320, 1216, 1, 256, 320, 320, 320, 256]
    - [0, 9.314]
  - - [448, 1216, 1, 256, 448, 448, 448, 256]
    - [2, 10.093]
  - - [576, 1216, 1, 256, 576, 576, 576, 256]
    - [2, 10.656]
  - - [704, 1216, 1, 256, 704, 704, 704, 256]
    - [2, 11.308]
  - - [832, 1216, 1, 256, 832, 832, 832, 256]
    - [2, 11.464]
  - - [960, 1216, 1, 256, 960, 960, 960, 256]
    - [2, 11.977]
  - - [1088, 1216, 1, 256, 1088, 1088, 1088, 256]
    - [2, 12.219]
  - - [1216, 1216, 1, 256, 1216, 1216, 1216, 256]
    - [2, 12.058]
  - - [1344, 1216, 1, 256, 1344, 1344, 1344, 256]
    - [2, 12.158]
  - - [1472, 1216, 1, 256, 1472, 1472, 1472, 256]
    - [2, 12.09]
  - - [1600, 1216, 1, 256, 1600, 1600, 1600, 256]
    - [2, 11.962]
  - - [1728, 1216, 1, 256, 1728, 1728, 1728, 256]
    - [2, 12.26]
  - - [1856, 1216, 1, 256, 1856, 1856, 1856, 256]
    - [2, 12.313]
  - - [1984, 1216, 1, 256, 1984, 1984, 1984, 256]
    - [2, 12.285]
  - - [2112, 1216, 1, 256, 2112, 2112, 2112, 256]
    - [2, 12.304]
  - - [2240, 1216, 1, 256, 2240, 2240, 2240, 256]
    - [2, 12.374]
  - - [2368, 1216, 1, 256, 2368, 2368, 2368, 256]
    - [2, 12.583]
  - - [2496, 1216, 1, 256, 2496, 2496, 2496, 256]
    - [2, 12.542]
  - - [2624, 1216, 1, 256, 2624, 2624, 2624, 256]
    - [2, 12.619]
  - - [2752, 1216, 1, 256, 2752, 2752, 2752, 256]
    - [2, 12.502]
  - - [2880, 1216, 1, 256, 2880, 2880, 2880, 256]
    - [2, 12.398]
  - - [3008, 1216, 1, 256, 3008, 3008, 3008, 256]
    - [2, 12.586]
  - - [3136, 1216, 1, 256, 3136, 3136, 3136, 256]
    - [2, 12.628]
  - - [3264, 1216, 1, 256, 3264, 3264, 3264, 256]
    - [2, 12.616]
  - - [3392, 1216, 1, 256, 3392, 3392, 3392, 256]
    - [2, 12.717]
  - - [3520, 1216, 1, 256, 3520, 3520, 3520, 256]
    - [2, 12.629]
  - - [3648, 1216, 1, 256, 3648, 3648, 3648, 256]
    - [2, 12.69]
  - - [3776, 1216, 1, 256, 3776, 3776, 3776, 256]
    - [2, 12.821]
  - - [3904, 1216, 1, 256, 3904, 3904, 3904, 256]
    - [2, 12.799]
  - - [4032, 1216, 1, 256, 4032, 4032, 4032, 256]
    - [2, 12.583]
  - - [64, 1344, 1, 256, 64, 64, 64, 256]
    - [3, 2.751]
  - - [192, 1344, 1, 256, 192, 192, 192, 256]
    - [2, 8.045]
  - - [320, 1344, 1, 256, 320, 320, 320, 256]
    - [0, 9.654]
  - - [448, 1344, 1, 256, 448, 448, 448, 256]
    - [2, 10.466]
  - - [576, 1344, 1, 256, 576, 576, 576, 256]
    - [2, 11.05]
  - - [704, 1344, 1, 256, 704, 704, 704, 256]
    - [2, 11.442]
  - - [832, 1344, 1, 256, 832, 832, 832, 256]
    - [2, 12.009]
  - - [960, 1344, 1, 256, 960, 960, 960, 256]
    - [2, 12.047]
  - - [1088, 1344, 1, 256, 1088, 1088, 1088, 256]
    - [2, 12.106]
  - - [1216, 1344, 1, 256, 1216, 1216, 1216, 256]
    - [2, 12.458]
  - - [1344, 1344, 1, 256, 1344, 1344, 1344, 256]
    - [2, 12.142]
  - - [1472, 1344, 1, 256, 1472, 1472, 1472, 256]
    - [2, 12.166]
  - - [1600, 1344, 1, 256, 1600, 1600, 1600, 256]
    - [2, 12.272]
  - - [1728, 1344, 1, 256, 1728, 1728, 1728, 256]
    - [2, 12.224]
  - - [1856, 1344, 1, 256, 1856, 1856, 1856, 256]
    - [2, 12.351]
  - - [1984, 1344, 1, 256, 1984, 1984, 1984, 256]
    - [2, 12.313]
  - - [2112, 1344, 1, 256, 2112, 2112, 2112, 256]
    - [2, 12.284]
  - - [2240, 1344, 1, 256, 2240, 2240, 2240, 256]
    - [2, 12.295]
  - - [2368, 1344, 1, 256, 2368, 2368, 2368, 256]
    - [2, 12.456]
  - - [2496, 1344, 1, 256, 2496, 2496, 2496, 256]
    - [2, 12.447]
  - - [2624, 1344, 1, 256, 2624, 2624, 2624, 256]
    - [2, 12.359]
  - - [2752, 1344, 1, 256, 2752, 2752, 2752, 256]
    - [2, 12.547]
  - - [2880, 1344, 1, 256, 2880, 2880, 2880, 256]
    - [2, 12.646]
  - - [3008, 1344, 1, 256, 3008, 3008, 3008, 256]
    - [2, 12.582]
  - - [3136, 1344, 1, 256, 3136, 3136, 3136, 256]
    - [2, 12.67]
  - - [3264, 1344, 1, 256, 3264, 3264, 3264, 256]
    - [2, 12.813]
  - - [3392, 1344, 1, 256, 3392, 3392, 3392, 256]
    - [2, 12.678]
  - - [3520, 1344, 1, 256, 3520, 3520, 3520, 256]
    - [2, 12.682]
  - - [3648, 1344, 1, 256, 3648, 3648, 3648, 256]
    - [2, 12.65]
  - - [3776, 1344, 1, 256, 3776, 3776, 3776, 256]
    - [2, 12.856]
  - - [3904, 1344, 1, 256, 3904, 3904, 3904, 256]
    - [2, 12.676]
  - - [4032, 1344, 1, 256, 4032, 4032, 4032, 256]
    - [2, 12.826]
  - - [64, 1472, 1, 256, 64, 64, 64, 256]
    - [0, 5.102]
  - - [192, 1472, 1, 256, 192, 192, 192, 256]
    - [0, 8.347]
  - - [320, 1472, 1, 256, 320, 320, 320, 256]
    - [2, 9.762]
  - - [448, 1472, 1, 256, 448, 448, 448, 256]
    - [2, 10.519]
  - - [576, 1472, 1, 256, 576, 576, 576, 256]
    - [2, 11.11]
  - - [704, 1472, 1, 256, 704, 704, 704, 256]
    - [2, 11.474]
  - - [832, 1472, 1, 256, 832, 832, 832, 256]
    - [2, 11.891]
  - - [960, 1472, 1, 256, 960, 960, 960, 256]
    - [2, 11.916]
  - - [1088, 1472, 1, 256, 1088, 1088, 1088, 256]
    - [2, 12.273]
  - - [1216, 1472, 1, 256, 1216, 1216, 1216, 256]
    - [2, 12.084]
  - - [1344, 1472, 1, 256, 1344, 1344, 1344, 256]
    - [2, 12.299]
  - - [1472, 1472, 1, 256, 1472, 1472, 1472, 256]
    - [2, 12.12]
  - - [1600, 1472, 1, 256, 1600, 1600, 1600, 256]
    - [2, 12.134]
  - - [1728, 1472, 1, 256, 1728, 1728, 1728, 256]
    - [2, 12.456]
  - - [1856, 1472, 1, 256, 1856, 1856, 1856, 256]
    - [2, 12.234]
  - - [1984, 1472, 1, 256, 1984, 1984, 1984, 256]
    - [2, 12.386]
  - - [2112, 1472, 1, 256, 2112, 2112, 2112, 256]
    - [2, 12.531]
  - - [2240, 1472, 1, 256, 2240, 2240, 2240, 256]
    - [2, 12.388]
  - - [2368, 1472, 1, 256, 2368, 2368, 2368, 256]
    - [2, 12.582]
  - - [2496, 1472, 1, 256, 2496, 2496, 2496, 256]
    - [2, 12.585]
  - - [2624, 1472, 1, 256, 2624, 2624, 2624, 256]
    - [2, 12.691]
  - - [2752, 1472, 1, 256, 2752, 2752, 2752, 256]
    - [2, 12.646]
  - - [2880, 1472, 1, 256, 2880, 2880, 2880, 256]
    - [2, 12.627]
  - - [3008, 1472, 1, 256, 3008, 3008, 3008, 256]
    - [2, 12.762]
  - - [3136, 1472, 1, 256, 3136, 3136, 3136, 256]
    - [2, 12.706]
  - - [3264, 1472, 1, 256, 3264, 3264, 3264, 256]
    - [2, 12.735]
  - - [3392, 1472, 1, 256, 3392, 3392, 3392, 256]
    - [2, 12.76]
  - - [3520, 1472, 1, 256, 3520, 3520, 3520, 256]
    - [2, 12.707]
  - - [3648, 1472, 1, 256, 3648, 3648, 3648, 256]
    - [2, 12.71]
  - - [3776, 1472, 1, 256, 3776, 3776, 3776, 256]
    - [2, 12.785]
  - - [3904, 1472, 1, 256, 3904, 3904, 3904, 256]
    - [2, 12.8]
  - - [4032, 1472, 1, 256, 4032, 4032, 4032, 256]
    - [2, 12.855]
  - - [64, 1600, 1, 256, 64, 64, 64, 256]
    - [2, 3.282]
  - - [192, 1600, 1, 256, 192, 192, 192, 256]
    - [2, 8.484]
  - - [320, 1600, 1, 256, 320, 320, 320, 256]
    - [2, 10.056]
  - - [448, 1600, 1, 256, 448, 448, 448, 256]
    - [2, 10.859]
  - - [576, 1600, 1, 256, 576, 576, 576, 256]
    - [2, 11.607]
  - - [704, 1600, 1, 256, 704, 704, 704, 256]
    - [2, 12.054]
  - - [832, 1600, 1, 256, 832, 832, 832, 256]
    - [2, 12.1]
  - - [960, 1600, 1, 256, 960, 960, 960, 256]
    - [2, 12.267]
  - - [1088, 1600, 1, 256, 1088, 1088, 1088, 256]
    - [2, 12.0]
  - - [1216, 1600, 1, 256, 1216, 1216, 1216, 256]
    - [2, 12.146]
  - - [1344, 1600, 1, 256, 1344, 1344, 1344, 256]
    - [2, 12.237]
  - - [1472, 1600, 1, 256, 1472, 1472, 1472, 256]
    - [2, 12.205]
  - - [1600, 1600, 1, 256, 1600, 1600, 1600, 256]
    - [2, 12.104]
  - - [1728, 1600, 1, 256, 1728, 1728, 1728, 256]
    - [2, 12.352]
  - - [1856, 1600, 1, 256, 1856, 1856, 1856, 256]
    - [2, 12.293]
  - - [1984, 1600, 1, 256, 1984, 1984, 1984, 256]
    - [2, 12.307]
  - - [2112, 1600, 1, 256, 2112, 2112, 2112, 256]
    - [2, 12.57]
  - - [2240, 1600, 1, 256, 2240, 2240, 2240, 256]
    - [2, 12.397]
  - - [2368, 1600, 1, 256, 2368, 2368, 2368, 256]
    - [2, 12.688]
  - - [2496, 1600, 1, 256, 2496, 2496, 2496, 256]
    - [2, 12.512]
  - - [2624, 1600, 1, 256, 2624, 2624, 2624, 256]
    - [2, 12.505]
  - - [2752, 1600, 1, 256, 2752, 2752, 2752, 256]
    - [2, 12.481]
  - - [2880, 1600, 1, 256, 2880, 2880, 2880, 256]
    - [2, 12.733]
  - - [3008, 1600, 1, 256, 3008, 3008, 3008, 256]
    - [2, 12.745]
  - - [3136, 1600, 1, 256, 3136, 3136, 3136, 256]
    - [2, 12.723]
  - - [3264, 1600, 1, 256, 3264, 3264, 3264, 256]
    - [2, 12.84]
  - - [3392, 1600, 1, 256, 3392, 3392, 3392, 256]
    - [2, 12.598]
  - - [3520, 1600, 1, 256, 3520, 3520, 3520, 256]
    - [2, 12.731]
  - - [3648, 1600, 1, 256, 3648, 3648, 3648, 256]
    - [2, 12.706]
  - - [3776, 1600, 1, 256, 3776, 3776, 3776, 256]
    - [2, 12.782]
  - - [3904, 1600, 1, 256, 3904, 3904, 3904, 256]
    - [2, 12.822]
  - - [4032, 1600, 1, 256, 4032, 4032, 4032, 256]
    - [2, 12.774]
  - - [64, 1728, 1, 256, 64, 64, 64, 256]
    - [2, 5.249]
  - - [192, 1728, 1, 256, 192, 192, 192, 256]
    - [0, 8.88]
  - - [320, 1728, 1, 256, 320, 320, 320, 256]
    - [2, 10.211]
  - - [448, 1728, 1, 256, 448, 448, 448, 256]
    - [2, 10.944]
  - - [576, 1728, 1, 256, 576, 576, 576, 256]
    - [2, 11.904]
  - - [704, 1728, 1, 256, 704, 704, 704, 256]
    - [2, 12.116]
  - - [832, 1728, 1, 256, 832, 832, 832, 256]
    - [0, 12.211]
  - - [960, 1728, 1, 256, 960, 960, 960, 256]
    - [2, 12.207]
  - - [1088, 1728, 1, 256, 1088, 1088, 1088, 256]
    - [2, 12.173]
  - - [1216, 1728, 1, 256, 1216, 1216, 1216, 256]
    - [2, 12.229]
  - - [1344, 1728, 1, 256, 1344, 1344, 1344, 256]
    - [2, 12.284]
  - - [1472, 1728, 1, 256, 1472, 1472, 1472, 256]
    - [2, 12.371]
  - - [1600, 1728, 1, 256, 1600, 1600, 1600, 256]
    - [2, 12.37]
  - - [1728, 1728, 1, 256, 1728, 1728, 1728, 256]
    - [2, 12.421]
  - - [1856, 1728, 1, 256, 1856, 1856, 1856, 256]
    - [2, 12.476]
  - - [1984, 1728, 1, 256, 1984, 1984, 1984, 256]
    - [2, 12.57]
  - - [2112, 1728, 1, 256, 2112, 2112, 2112, 256]
    - [2, 12.373]
  - - [2240, 1728, 1, 256, 2240, 2240, 2240, 256]
    - [2, 12.418]
  - - [2368, 1728, 1, 256, 2368, 2368, 2368, 256]
    - [2, 12.488]
  - - [2496, 1728, 1, 256, 2496, 2496, 2496, 256]
    - [2, 12.864]
  - - [2624, 1728, 1, 256, 2624, 2624, 2624, 256]
    - [2, 12.577]
  - - [2752, 1728, 1, 256, 2752, 2752, 2752, 256]
    - [2, 12.655]
  - - [2880, 1728, 1, 256, 2880, 2880, 2880, 256]
    - [2, 12.712]
  - - [3008, 1728, 1, 256, 3008, 3008, 3008, 256]
    - [2, 12.743]
  - - [3136, 1728, 1, 256, 3136, 3136, 3136, 256]
    - [2, 12.72]
  - - [3264, 1728, 1, 256, 3264, 3264, 3264, 256]
    - [2, 12.821]
  - - [3392, 1728, 1, 256, 3392, 3392, 3392, 256]
    - [2, 12.67]
  - - [3520, 1728, 1, 256, 3520, 3520, 3520, 256]
    - [2, 12.884]
  - - [3648, 1728, 1, 256, 3648, 3648, 3648, 256]
    - [2, 12.635]
  - - [3776, 1728, 1, 256, 3776, 3776, 3776, 256]
    - [2, 12.835]
  - - [3904, 1728, 1, 256, 3904, 3904, 3904, 256]
    - [2, 12.713]
  - - [4032, 1728, 1, 256, 4032, 4032, 4032, 256]
    - [2, 12.927]
  - - [64, 1856, 1, 256, 64, 64, 64, 256]
    - [2, 5.639]
  - - [192, 1856, 1, 256, 192, 192, 192, 256]
    - [2, 9.072]
  - - [320, 1856, 1, 256, 320, 320, 320, 256]
    - [2, 10.432]
  - - [448, 1856, 1, 256, 448, 448, 448, 256]
    - [2, 11.484]
  - - [576, 1856, 1, 256, 576, 576, 576, 256]
    - [2, 11.889]
  - - [704, 1856, 1, 256, 704, 704, 704, 256]
    - [2, 12.074]
  - - [832, 1856, 1, 256, 832, 832, 832, 256]
    - [2, 12.053]
  - - [960, 1856, 1, 256, 960, 960, 960, 256]
    - [2, 12.441]
  - - [1088, 1856, 1, 256, 1088, 1088, 1088, 256]
    - [2, 12.041]
  - - [1216, 1856, 1, 256, 1216, 1216, 1216, 256]
    - [2, 12.566]
  - - [1344, 1856, 1, 256, 1344, 1344, 1344, 256]
    - [2, 12.35]
  - - [1472, 1856, 1, 256, 1472, 1472, 1472, 256]
    - [2, 12.36]
  - - [1600, 1856, 1, 256, 1600, 1600, 1600, 256]
    - [2, 12.455]
  - - [1728, 1856, 1, 256, 1728, 1728, 1728, 256]
    - [2, 12.433]
  - - [1856, 1856, 1, 256, 1856, 1856, 1856, 256]
    - [2, 12.512]
  - - [1984, 1856, 1, 256, 1984, 1984, 1984, 256]
    - [2, 12.551]
  - - [2112, 1856, 1, 256, 2112, 2112, 2112, 256]
    - [2, 12.497]
  - - [2240, 1856, 1, 256, 2240, 2240, 2240, 256]
    - [2, 12.559]
  - - [2368, 1856, 1, 256, 2368, 2368, 2368, 256]
    - [2, 12.667]
  - - [2496, 1856, 1, 256, 2496, 2496, 2496, 256]
    - [2, 12.553]
  - - [2624, 1856, 1, 256, 2624, 2624, 2624, 256]
    - [2, 12.724]
  - - [2752, 1856, 1, 256, 2752, 2752, 2752, 256]
    - [2, 12.647]
  - - [2880, 1856, 1, 256, 2880, 2880, 2880, 256]
    - [2, 12.527]
  - - [3008, 1856, 1, 256, 3008, 3008, 3008, 256]
    - [2, 12.618]
  - - [3136, 1856, 1, 256, 3136, 3136, 3136, 256]
    - [2, 12.835]
  - - [3264, 1856, 1, 256, 3264, 3264, 3264, 256]
    - [2, 12.696]
  - - [3392, 1856, 1, 256, 3392, 3392, 3392, 256]
    - [2, 12.742]
  - - [3520, 1856, 1, 256, 3520, 3520, 3520, 256]
    - [2, 12.761]
  - - [3648, 1856, 1, 256, 3648, 3648, 3648, 256]
    - [2, 12.792]
  - - [3776, 1856, 1, 256, 3776, 3776, 3776, 256]
    - [2, 12.818]
  - - [3904, 1856, 1, 256, 3904, 3904, 3904, 256]
    - [2, 12.646]
  - - [4032, 1856, 1, 256, 4032, 4032, 4032, 256]
    - [2, 12.791]
  - - [64, 1984, 1, 256, 64, 64, 64, 256]
    - [0, 5.727]
  - - [192, 1984, 1, 256, 192, 192, 192, 256]
    - [0, 9.298]
  - - [320, 1984, 1, 256, 320, 320, 320, 256]
    - [0, 10.632]
  - - [448, 1984, 1, 256, 448, 448, 448, 256]
    - [2, 11.335]
  - - [576, 1984, 1, 256, 576, 576, 576, 256]
    - [2, 11.903]
  - - [704, 1984, 1, 256, 704, 704, 704, 256]
    - [2, 12.365]
  - - [832, 1984, 1, 256, 832, 832, 832, 256]
    - [2, 12.305]
  - - [960, 1984, 1, 256, 960, 960, 960, 256]
    - [2, 12.489]
  - - [1088, 1984, 1, 256, 1088, 1088, 1088, 256]
    - [2, 12.302]
  - - [1216, 1984, 1, 256, 1216, 1216, 1216, 256]
    - [2, 12.424]
  - - [1344, 1984, 1, 256, 1344, 1344, 1344, 256]
    - [2, 12.531]
  - - [1472, 1984, 1, 256, 1472, 1472, 1472, 256]
    - [2, 12.172]
  - - [1600, 1984, 1, 256, 1600, 1600, 1600, 256]
    - [2, 12.63]
  - - [1728, 1984, 1, 256, 1728, 1728, 1728, 256]
    - [0, 12.287]
  - - [1856, 1984, 1, 256, 1856, 1856, 1856, 256]
    - [2, 12.548]
  - - [1984, 1984, 1, 256, 1984, 1984, 1984, 256]
    - [2, 12.421]
  - - [2112, 1984, 1, 256, 2112, 2112, 2112, 256]
    - [2, 12.588]
  - - [2240, 1984, 1, 256, 2240, 2240, 2240, 256]
    - [2, 12.649]
  - - [2368, 1984, 1, 256, 2368, 2368, 2368, 256]
    - [2, 12.614]
  - - [2496, 1984, 1, 256, 2496, 2496, 2496, 256]
    - [2, 12.732]
  - - [2624, 1984, 1, 256, 2624, 2624, 2624, 256]
    - [2, 12.722]
  - - [2752, 1984, 1, 256, 2752, 2752, 2752, 256]
    - [2, 12.718]
  - - [2880, 1984, 1, 256, 2880, 2880, 2880, 256]
    - [2, 12.678]
  - - [3008, 1984, 1, 256, 3008, 3008, 3008, 256]
    - [2, 12.879]
  - - [3136, 1984, 1, 256, 3136, 3136, 3136, 256]
    - [2, 12.673]
  - - [3264, 1984, 1, 256, 3264, 3264, 3264, 256]
    - [2, 12.703]
  - - [3392, 1984, 1, 256, 3392, 3392, 3392, 256]
    - [2, 12.748]
  - - [3520, 1984, 1, 256, 3520, 3520, 3520, 256]
    - [2, 12.94]
  - - [3648, 1984, 1, 256, 3648, 3648, 3648, 256]
    - [2, 12.733]
  - - [3776, 1984, 1, 256, 3776, 3776, 3776, 256]
    - [2, 12.955]
  - - [3904, 1984, 1, 256, 3904, 3904, 3904, 256]
    - [2, 12.756]
  - - [4032, 1984, 1, 256, 4032, 4032, 4032, 256]
    - [2, 12.897]
  - - [64, 2112, 1, 256, 64, 64, 64, 256]
    - [0, 6.083]
  - - [192, 2112, 1, 256, 192, 192, 192, 256]
    - [2, 9.413]
  - - [320, 2112, 1, 256, 320, 320, 320, 256]
    - [2, 10.771]
  - - [448, 2112, 1, 256, 448, 448, 448, 256]
    - [2, 11.848]
  - - [576, 2112, 1, 256, 576, 576, 576, 256]
    - [2, 12.095]
  - - [704, 2112, 1, 256, 704, 704, 704, 256]
    - [0, 12.156]
  - - [832, 2112, 1, 256, 832, 832, 832, 256]
    - [2, 12.207]
  - - [960, 2112, 1, 256, 960, 960, 960, 256]
    - [2, 12.764]
  - - [1088, 2112, 1, 256, 1088, 1088, 1088, 256]
    - [2, 12.312]
  - - [1216, 2112, 1, 256, 1216, 1216, 1216, 256]
    - [2, 12.527]
  - - [1344, 2112, 1, 256, 1344, 1344, 1344, 256]
    - [2, 12.361]
  - - [1472, 2112, 1, 256, 1472, 1472, 1472, 256]
    - [2, 12.493]
  - - [1600, 2112, 1, 256, 1600, 1600, 1600, 256]
    - [2, 12.35]
  - - [1728, 2112, 1, 256, 1728, 1728, 1728, 256]
    - [2, 12.587]
  - - [1856, 2112, 1, 256, 1856, 1856, 1856, 256]
    - [2, 12.653]
  - - [1984, 2112, 1, 256, 1984, 1984, 1984, 256]
    - [2, 12.709]
  - - [2112, 2112, 1, 256, 2112, 2112, 2112, 256]
    - [2, 12.514]
  - - [2240, 2112, 1, 256, 2240, 2240, 2240, 256]
    - [2, 12.738]
  - - [2368, 2112, 1, 256, 2368, 2368, 2368, 256]
    - [2, 12.69]
  - - [2496, 2112, 1, 256, 2496, 2496, 2496, 256]
    - [2, 12.862]
  - - [2624, 2112, 1, 256, 2624, 2624, 2624, 256]
    - [2, 12.634]
  - - [2752, 2112, 1, 256, 2752, 2752, 2752, 256]
    - [2, 12.71]
  - - [2880, 2112, 1, 256, 2880, 2880, 2880, 256]
    - [2, 12.774]
  - - [3008, 2112, 1, 256, 3008, 3008, 3008, 256]
    - [2, 12.829]
  - - [3136, 2112, 1, 256, 3136, 3136, 3136, 256]
    - [2, 12.72]
  - - [3264, 2112, 1, 256, 3264, 3264, 3264, 256]
    - [2, 12.795]
  - - [3392, 2112, 1, 256, 3392, 3392, 3392, 256]
    - [2, 12.77]
  - - [3520, 2112, 1, 256, 3520, 3520, 3520, 256]
    - [2, 12.811]
  - - [3648, 2112, 1, 256, 3648, 3648, 3648, 256]
    - [2, 12.909]
  - - [3776, 2112, 1, 256, 3776, 3776, 3776, 256]
    - [2, 12.748]
  - - [3904, 2112, 1, 256, 3904, 3904, 3904, 256]
    - [2, 12.766]
  - - [4032, 2112, 1, 256, 4032, 4032, 4032, 256]
    - [2, 12.796]
  - - [64, 2240, 1, 256, 64, 64, 64, 256]
    - [0, 6.435]
  - - [192, 2240, 1, 256, 192, 192, 192, 256]
    - [0, 9.661]
  - - [320, 2240, 1, 256, 320, 320, 320, 256]
    - [2, 10.919]
  - - [448, 2240, 1, 256, 448, 448, 448, 256]
    - [2, 11.607]
  - - [576, 2240, 1, 256, 576, 576, 576, 256]
    - [2, 12.288]
  - - [704, 2240, 1, 256, 704, 704, 704, 256]
    - [2, 12.386]
  - - [832, 2240, 1, 256, 832, 832, 832, 256]
    - [2, 12.352]
  - - [960, 2240, 1, 256, 960, 960, 960, 256]
    - [0, 12.245]
  - - [1088, 2240, 1, 256, 1088, 1088, 1088, 256]
    - [2, 12.278]
  - - [1216, 2240, 1, 256, 1216, 1216, 1216, 256]
    - [2, 12.3]
  - - [1344, 2240, 1, 256, 1344, 1344, 1344, 256]
    - [2, 12.237]
  - - [1472, 2240, 1, 256, 1472, 1472, 1472, 256]
    - [0, 12.329]
  - - [1600, 2240, 1, 256, 1600, 1600, 1600, 256]
    - [2, 12.501]
  - - [1728, 2240, 1, 256, 1728, 1728, 1728, 256]
    - [0, 12.46]
  - - [1856, 2240, 1, 256, 1856, 1856, 1856, 256]
    - [2, 12.776]
  - - [1984, 2240, 1, 256, 1984, 1984, 1984, 256]
    - [2, 12.633]
  - - [2112, 2240, 1, 256, 2112, 2112, 2112, 256]
    - [0, 12.622]
  - - [2240, 2240, 1, 256, 2240, 2240, 2240, 256]
    - [2, 12.577]
  - - [2368, 2240, 1, 256, 2368, 2368, 2368, 256]
    - [2, 12.782]
  - - [2496, 2240, 1, 256, 2496, 2496, 2496, 256]
    - [2, 12.675]
  - - [2624, 2240, 1, 256, 2624, 2624, 2624, 256]
    - [2, 12.683]
  - - [2752, 2240, 1, 256, 2752, 2752, 2752, 256]
    - [2, 12.835]
  - - [2880, 2240, 1, 256, 2880, 2880, 2880, 256]
    - [2, 12.831]
  - - [3008, 2240, 1, 256, 3008, 3008, 3008, 256]
    - [2, 12.769]
  - - [3136, 2240, 1, 256, 3136, 3136, 3136, 256]
    - [2, 12.803]
  - - [3264, 2240, 1, 256, 3264, 3264, 3264, 256]
    - [2, 12.74]
  - - [3392, 2240, 1, 256, 3392, 3392, 3392, 256]
    - [2, 12.964]
  - - [3520, 2240, 1, 256, 3520, 3520, 3520, 256]
    - [2, 12.807]
  - - [3648, 2240, 1, 256, 3648, 3648, 3648, 256]
    - [2, 12.76]
  - - [3776, 2240, 1, 256, 3776, 3776, 3776, 256]
    - [2, 12.87]
  - - [3904, 2240, 1, 256, 3904, 3904, 3904, 256]
    - [2, 12.837]
  - - [4032, 2240, 1, 256, 4032, 4032, 4032, 256]
    - [2, 12.958]
  - - [64, 2368, 1, 256, 64, 64, 64, 256]
    - [0, 5.822]
  - - [192, 2368, 1, 256, 192, 192, 192, 256]
    - [2, 9.68]
  - - [320, 2368, 1, 256, 320, 320, 320, 256]
    - [2, 10.887]
  - - [448, 2368, 1, 256, 448, 448, 448, 256]
    - [2, 11.791]
  - - [576, 2368, 1, 256, 576, 576, 576, 256]
    - [2, 12.095]
  - - [704, 2368, 1, 256, 704, 704, 704, 256]
    - [2, 12.238]
  - - [832, 2368, 1, 256, 832, 832, 832, 256]
    - [2, 12.25]
  - - [960, 2368, 1, 256, 960, 960, 960, 256]
    - [2, 12.214]
  - - [1088, 2368, 1, 256, 1088, 1088, 1088, 256]
    - [2, 12.303]
  - - [1216, 2368, 1, 256, 1216, 1216, 1216, 256]
    - [2, 12.381]
  - - [1344, 2368, 1, 256, 1344, 1344, 1344, 256]
    - [2, 12.456]
  - - [1472, 2368, 1, 256, 1472, 1472, 1472, 256]
    - [2, 12.284]
  - - [1600, 2368, 1, 256, 1600, 1600, 1600, 256]
    - [2, 12.445]
  - - [1728, 2368, 1, 256, 1728, 1728, 1728, 256]
    - [2, 12.594]
  - - [1856, 2368, 1, 256, 1856, 1856, 1856, 256]
    - [2, 12.674]
  - - [1984, 2368, 1, 256, 1984, 1984, 1984, 256]
    - [2, 12.646]
  - - [2112, 2368, 1, 256, 2112, 2112, 2112, 256]
    - [2, 12.749]
  - - [2240, 2368, 1, 256, 2240, 2240, 2240, 256]
    - [2, 12.635]
  - - [2368, 2368, 1, 256, 2368, 2368, 2368, 256]
    - [2, 12.584]
  - - [2496, 2368, 1, 256, 2496, 2496, 2496, 256]
    - [2, 12.646]
  - - [2624, 2368, 1, 256, 2624, 2624, 2624, 256]
    - [2, 12.66]
  - - [2752, 2368, 1, 256, 2752, 2752, 2752, 256]
    - [2, 12.776]
  - - [2880, 2368, 1, 256, 2880, 2880, 2880, 256]
    - [2, 12.86]
  - - [3008, 2368, 1, 256, 3008, 3008, 3008, 256]
    - [2, 12.728]
  - - [3136, 2368, 1, 256, 3136, 3136, 3136, 256]
    - [2, 12.772]
  - - [3264, 2368, 1, 256, 3264, 3264, 3264, 256]
    - [2, 12.889]
  - - [3392, 2368, 1, 256, 3392, 3392, 3392, 256]
    - [2, 12.689]
  - - [3520, 2368, 1, 256, 3520, 3520, 3520, 256]
    - [2, 12.76]
  - - [3648, 2368, 1, 256, 3648, 3648, 3648, 256]
    - [2, 12.832]
  - - [3776, 2368, 1, 256, 3776, 3776, 3776, 256]
    - [2, 12.759]
  - - [3904, 2368, 1, 256, 3904, 3904, 3904, 256]
    - [2, 12.933]
  - - [4032, 2368, 1, 256, 4032, 4032, 4032, 256]
    - [2, 12.816]
  - - [64, 2496, 1, 256, 64, 64, 64, 256]
    - [2, 6.391]
  - - [192, 2496, 1, 256, 192, 192, 192, 256]
    - [0, 9.872]
  - - [320, 2496, 1, 256, 320, 320, 320, 256]
    - [2, 11.003]
  - - [448, 2496, 1, 256, 448, 448, 448, 256]
    - [2, 12.15]
  - - [576, 2496, 1, 256, 576, 576, 576, 256]
    - [2, 12.141]
  - - [704, 2496, 1, 256, 704, 704, 704, 256]
    - [2, 12.258]
  - - [832, 2496, 1, 256, 832, 832, 832, 256]
    - [2, 12.093]
  - - [960, 2496, 1, 256, 960, 960, 960, 256]
    - [2, 12.169]
  - - [1088, 2496, 1, 256, 1088, 1088, 1088, 256]
    - [2, 12.199]
  - - [1216, 2496, 1, 256, 1216, 1216, 1216, 256]
    - [2, 12.155]
  - - [1344, 2496, 1, 256, 1344, 1344, 1344, 256]
    - [2, 12.376]
  - - [1472, 2496, 1, 256, 1472, 1472, 1472, 256]
    - [2, 12.415]
  - - [1600, 2496, 1, 256, 1600, 1600, 1600, 256]
    - [2, 12.421]
  - - [1728, 2496, 1, 256, 1728, 1728, 1728, 256]
    - [2, 12.553]
  - - [1856, 2496, 1, 256, 1856, 1856, 1856, 256]
    - [2, 12.795]
  - - [1984, 2496, 1, 256, 1984, 1984, 1984, 256]
    - [2, 12.718]
  - - [2112, 2496, 1, 256, 2112, 2112, 2112, 256]
    - [2, 12.594]
  - - [2240, 2496, 1, 256, 2240, 2240, 2240, 256]
    - [2, 12.653]
  - - [2368, 2496, 1, 256, 2368, 2368, 2368, 256]
    - [2, 12.623]
  - - [2496, 2496, 1, 256, 2496, 2496, 2496, 256]
    - [2, 12.79]
  - - [2624, 2496, 1, 256, 2624, 2624, 2624, 256]
    - [2, 12.756]
  - - [2752, 2496, 1, 256, 2752, 2752, 2752, 256]
    - [2, 12.615]
  - - [2880, 2496, 1, 256, 2880, 2880, 2880, 256]
    - [2, 12.935]
  - - [3008, 2496, 1, 256, 3008, 3008, 3008, 256]
    - [2, 12.749]
  - - [3136, 2496, 1, 256, 3136, 3136, 3136, 256]
    - [2, 12.758]
  - - [3264, 2496, 1, 256, 3264, 3264, 3264, 256]
    - [2, 12.849]
  - - [3392, 2496, 1, 256, 3392, 3392, 3392, 256]
    - [2, 12.776]
  - - [3520, 2496, 1, 256, 3520, 3520, 3520, 256]
    - [2, 12.851]
  - - [3648, 2496, 1, 256, 3648, 3648, 3648, 256]
    - [2, 12.814]
  - - [3776, 2496, 1, 256, 3776, 3776, 3776, 256]
    - [2, 12.819]
  - - [3904, 2496, 1, 256, 3904, 3904, 3904, 256]
    - [2, 12.779]
  - - [4032, 2496, 1, 256, 4032, 4032, 4032, 256]
    - [2, 12.813]
  - - [64, 2624, 1, 256, 64, 64, 64, 256]
    - [0, 6.431]
  - - [192, 2624, 1, 256, 192, 192, 192, 256]
    - [2, 10.055]
  - - [320, 2624, 1, 256, 320, 320, 320, 256]
    - [2, 11.136]
  - - [448, 2624, 1, 256, 448, 448, 448, 256]
    - [2, 11.917]
  - - [576, 2624, 1, 256, 576, 576, 576, 256]
    - [2, 12.203]
  - - [704, 2624, 1, 256, 704, 704, 704, 256]
    - [2, 12.232]
  - - [832, 2624, 1, 256, 832, 832, 832, 256]
    - [2, 12.207]
  - - [960, 2624, 1, 256, 960, 960, 960, 256]
    - [2, 12.124]
  - - [1088, 2624, 1, 256, 1088, 1088, 1088, 256]
    - [2, 12.346]
  - - [1216, 2624, 1, 256, 1216, 1216, 1216, 256]
    - [2, 12.392]
  - - [1344, 2624, 1, 256, 1344, 1344, 1344, 256]
    - [2, 12.347]
  - - [1472, 2624, 1, 256, 1472, 1472, 1472, 256]
    - [2, 12.403]
  - - [1600, 2624, 1, 256, 1600, 1600, 1600, 256]
    - [2, 12.61]
  - - [1728, 2624, 1, 256, 1728, 1728, 1728, 256]
    - [2, 12.488]
  - - [1856, 2624, 1, 256, 1856, 1856, 1856, 256]
    - [2, 12.673]
  - - [1984, 2624, 1, 256, 1984, 1984, 1984, 256]
    - [2, 12.497]
  - - [2112, 2624, 1, 256, 2112, 2112, 2112, 256]
    - [2, 12.574]
  - - [2240, 2624, 1, 256, 2240, 2240, 2240, 256]
    - [2, 12.668]
  - - [2368, 2624, 1, 256, 2368, 2368, 2368, 256]
    - [2, 12.588]
  - - [2496, 2624, 1, 256, 2496, 2496, 2496, 256]
    - [2, 12.646]
  - - [2624, 2624, 1, 256, 2624, 2624, 2624, 256]
    - [2, 12.74]
  - - [2752, 2624, 1, 256, 2752, 2752, 2752, 256]
    - [2, 12.753]
  - - [2880, 2624, 1, 256, 2880, 2880, 2880, 256]
    - [2, 12.744]
  - - [3008, 2624, 1, 256, 3008, 3008, 3008, 256]
    - [2, 12.734]
  - - [3136, 2624, 1, 256, 3136, 3136, 3136, 256]
    - [2, 12.806]
  - - [3264, 2624, 1, 256, 3264, 3264, 3264, 256]
    - [2, 12.816]
  - - [3392, 2624, 1, 256, 3392, 3392, 3392, 256]
    - [2, 12.917]
  - - [3520, 2624, 1, 256, 3520, 3520, 3520, 256]
    - [2, 12.774]
  - - [3648, 2624, 1, 256, 3648, 3648, 3648, 256]
    - [2, 12.969]
  - - [3776, 2624, 1, 256, 3776, 3776, 3776, 256]
    - [2, 12.892]
  - - [3904, 2624, 1, 256, 3904, 3904, 3904, 256]
    - [2, 12.845]
  - - [4032, 2624, 1, 256, 4032, 4032, 4032, 256]
    - [2, 12.851]
  - - [64, 2752, 1, 256, 64, 64, 64, 256]
    - [0, 6.723]
  - - [192, 2752, 1, 256, 192, 192, 192, 256]
    - [2, 10.112]
  - - [320, 2752, 1, 256, 320, 320, 320, 256]
    - [2, 11.666]
  - - [448, 2752, 1, 256, 448, 448, 448, 256]
    - [2, 12.268]
  - - [576, 2752, 1, 256, 576, 576, 576, 256]
    - [0, 12.183]
  - - [704, 2752, 1, 256, 704, 704, 704, 256]
    - [2, 12.115]
  - - [832, 2752, 1, 256, 832, 832, 832, 256]
    - [2, 12.172]
  - - [960, 2752, 1, 256, 960, 960, 960, 256]
    - [2, 12.228]
  - - [1088, 2752, 1, 256, 1088, 1088, 1088, 256]
    - [2, 12.501]
  - - [1216, 2752, 1, 256, 1216, 1216, 1216, 256]
    - [2, 12.163]
  - - [1344, 2752, 1, 256, 1344, 1344, 1344, 256]
    - [2, 12.476]
  - - [1472, 2752, 1, 256, 1472, 1472, 1472, 256]
    - [2, 12.442]
  - - [1600, 2752, 1, 256, 1600, 1600, 1600, 256]
    - [2, 12.759]
  - - [1728, 2752, 1, 256, 1728, 1728, 1728, 256]
    - [2, 12.707]
  - - [1856, 2752, 1, 256, 1856, 1856, 1856, 256]
    - [2, 12.636]
  - - [1984, 2752, 1, 256, 1984, 1984, 1984, 256]
    - [2, 12.567]
  - - [2112, 2752, 1, 256, 2112, 2112, 2112, 256]
    - [2, 12.721]
  - - [2240, 2752, 1, 256, 2240, 2240, 2240, 256]
    - [2, 12.679]
  - - [2368, 2752, 1, 256, 2368, 2368, 2368, 256]
    - [2, 12.67]
  - - [2496, 2752, 1, 256, 2496, 2496, 2496, 256]
    - [2, 12.858]
  - - [2624, 2752, 1, 256, 2624, 2624, 2624, 256]
    - [2, 12.734]
  - - [2752, 2752, 1, 256, 2752, 2752, 2752, 256]
    - [2, 12.769]
  - - [2880, 2752, 1, 256, 2880, 2880, 2880, 256]
    - [2, 12.934]
  - - [3008, 2752, 1, 256, 3008, 3008, 3008, 256]
    - [2, 12.75]
  - - [3136, 2752, 1, 256, 3136, 3136, 3136, 256]
    - [2, 12.787]
  - - [3264, 2752, 1, 256, 3264, 3264, 3264, 256]
    - [2, 12.795]
  - - [3392, 2752, 1, 256, 3392, 3392, 3392, 256]
    - [2, 12.867]
  - - [3520, 2752, 1, 256, 3520, 3520, 3520, 256]
    - [2, 12.771]
  - - [3648, 2752, 1, 256, 3648, 3648, 3648, 256]
    - [2, 12.837]
  - - [3776, 2752, 1, 256, 3776, 3776, 3776, 256]
    - [2, 12.912]
  - - [3904, 2752, 1, 256, 3904, 3904, 3904, 256]
    - [2, 12.871]
  - - [4032, 2752, 1, 256, 4032, 4032, 4032, 256]
    - [2, 12.832]
  - - [64, 2880, 1, 256, 64, 64, 64, 256]
    - [0, 7.051]
  - - [192, 2880, 1, 256, 192, 192, 192, 256]
    - [2, 10.247]
  - - [320, 2880, 1, 256, 320, 320, 320, 256]
    - [2, 11.418]
  - - [448, 2880, 1, 256, 448, 448, 448, 256]
    - [2, 12.112]
  - - [576, 2880, 1, 256, 576, 576, 576, 256]
    - [2, 12.299]
  - - [704, 2880, 1, 256, 704, 704, 704, 256]
    - [2, 12.216]
  - - [832, 2880, 1, 256, 832, 832, 832, 256]
    - [2, 12.326]
  - - [960, 2880, 1, 256, 960, 960, 960, 256]
    - [2, 12.201]
  - - [1088, 2880, 1, 256, 1088, 1088, 1088, 256]
    - [2, 12.276]
  - - [1216, 2880, 1, 256, 1216, 1216, 1216, 256]
    - [2, 12.263]
  - - [1344, 2880, 1, 256, 1344, 1344, 1344, 256]
    - [2, 12.497]
  - - [1472, 2880, 1, 256, 1472, 1472, 1472, 256]
    - [2, 12.462]
  - - [1600, 2880, 1, 256, 1600, 1600, 1600, 256]
    - [2, 12.54]
  - - [1728, 2880, 1, 256, 1728, 1728, 1728, 256]
    - [2, 12.635]
  - - [1856, 2880, 1, 256, 1856, 1856, 1856, 256]
    - [2, 12.598]
  - - [1984, 2880, 1, 256, 1984, 1984, 1984, 256]
    - [2, 12.629]
  - - [2112, 2880, 1, 256, 2112, 2112, 2112, 256]
    - [2, 12.65]
  - - [2240, 2880, 1, 256, 2240, 2240, 2240, 256]
    - [2, 12.682]
  - - [2368, 2880, 1, 256, 2368, 2368, 2368, 256]
    - [2, 12.794]
  - - [2496, 2880, 1, 256, 2496, 2496, 2496, 256]
    - [2, 12.713]
  - - [2624, 2880, 1, 256, 2624, 2624, 2624, 256]
    - [2, 12.701]
  - - [2752, 2880, 1, 256, 2752, 2752, 2752, 256]
    - [2, 12.736]
  - - [2880, 2880, 1, 256, 2880, 2880, 2880, 256]
    - [2, 12.776]
  - - [3008, 2880, 1, 256, 3008, 3008, 3008, 256]
    - [2, 12.754]
  - - [3136, 2880, 1, 256, 3136, 3136, 3136, 256]
    - [2, 12.838]
  - - [3264, 2880, 1, 256, 3264, 3264, 3264, 256]
    - [2, 12.919]
  - - [3392, 2880, 1, 256, 3392, 3392, 3392, 256]
    - [2, 12.806]
  - - [3520, 2880, 1, 256, 3520, 3520, 3520, 256]
    - [2, 12.884]
  - - [3648, 2880, 1, 256, 3648, 3648, 3648, 256]
    - [2, 12.815]
  - - [3776, 2880, 1, 256, 3776, 3776, 3776, 256]
    - [2, 12.822]
  - - [3904, 2880, 1, 256, 3904, 3904, 3904, 256]
    - [2, 12.937]
  - - [4032, 2880, 1, 256, 4032, 4032, 4032, 256]
    - [2, 12.773]
  - - [64, 3008, 1, 256, 64, 64, 64, 256]
    - [0, 7.31]
  - - [192, 3008, 1, 256, 192, 192, 192, 256]
    - [2, 10.35]
  - - [320, 3008, 1, 256, 320, 320, 320, 256]
    - [2, 11.634]
  - - [448, 3008, 1, 256, 448, 448, 448, 256]
    - [2, 12.154]
  - - [576, 3008, 1, 256, 576, 576, 576, 256]
    - [2, 12.132]
  - - [704, 3008, 1, 256, 704, 704, 704, 256]
    - [2, 12.134]
  - - [832, 3008, 1, 256, 832, 832, 832, 256]
    - [2, 12.352]
  - - [960, 3008, 1, 256, 960, 960, 960, 256]
    - [2, 12.214]
  - - [1088, 3008, 1, 256, 1088, 1088, 1088, 256]
    - [2, 12.413]
  - - [1216, 3008, 1, 256, 1216, 1216, 1216, 256]
    - [2, 12.595]
  - - [1344, 3008, 1, 256, 1344, 1344, 1344, 256]
    - [2, 12.649]
  - - [1472, 3008, 1, 256, 1472, 1472, 1472, 256]
    - [2, 12.678]
  - - [1600, 3008, 1, 256, 1600, 1600, 1600, 256]
    - [2, 12.644]
  - - [1728, 3008, 1, 256, 1728, 1728, 1728, 256]
    - [2, 12.609]
  - - [1856, 3008, 1, 256, 1856, 1856, 1856, 256]
    - [2, 12.555]
  - - [1984, 3008, 1, 256, 1984, 1984, 1984, 256]
    - [2, 12.608]
  - - [2112, 3008, 1, 256, 2112, 2112, 2112, 256]
    - [2, 12.627]
  - - [2240, 3008, 1, 256, 2240, 2240, 2240, 256]
    - [2, 12.693]
  - - [2368, 3008, 1, 256, 2368, 2368, 2368, 256]
    - [2, 12.899]
  - - [2496, 3008, 1, 256, 2496, 2496, 2496, 256]
    - [2, 12.776]
  - - [2624, 3008, 1, 256, 2624, 2624, 2624, 256]
    - [2, 12.746]
  - - [2752, 3008, 1, 256, 2752, 2752, 2752, 256]
    - [2, 12.743]
  - - [2880, 3008, 1, 256, 2880, 2880, 2880, 256]
    - [2, 12.712]
  - - [3008, 3008, 1, 256, 3008, 3008, 3008, 256]
    - [2, 12.83]
  - - [3136, 3008, 1, 256, 3136, 3136, 3136, 256]
    - [2, 12.94]
  - - [3264, 3008, 1, 256, 3264, 3264, 3264, 256]
    - [2, 12.846]
  - - [3392, 3008, 1, 256, 3392, 3392, 3392, 256]
    - [2, 12.829]
  - - [3520, 3008, 1, 256, 3520, 3520, 3520, 256]
    - [2, 12.804]
  - - [3648, 3008, 1, 256, 3648, 3648, 3648, 256]
    - [2, 12.832]
  - - [3776, 3008, 1, 256, 3776, 3776, 3776, 256]
    - [2, 12.79]
  - - [3904, 3008, 1, 256, 3904, 3904, 3904, 256]
    - [2, 12.872]
  - - [4032, 3008, 1, 256, 4032, 4032, 4032, 256]
    - [2, 12.818]
  - - [64, 3136, 1, 256, 64, 64, 64, 256]
    - [2, 6.972]
  - - [192, 3136, 1, 256, 192, 192, 192, 256]
    - [2, 10.455]
  - - [320, 3136, 1, 256, 320, 320, 320, 256]
    - [2, 11.78]
  - - [448, 3136, 1, 256, 448, 448, 448, 256]
    - [2, 12.342]
  - - [576, 3136, 1, 256, 576, 576, 576, 256]
    - [2, 12.169]
  - - [704, 3136, 1, 256, 704, 704, 704, 256]
    - [2, 12.008]
  - - [832, 3136, 1, 256, 832, 832, 832, 256]
    - [2, 12.324]
  - - [960, 3136, 1, 256, 960, 960, 960, 256]
    - [2, 12.236]
  - - [1088, 3136, 1, 256, 1088, 1088, 1088, 256]
    - [2, 12.523]
  - - [1216, 3136, 1, 256, 1216, 1216, 1216, 256]
    - [2, 12.461]
  - - [1344, 3136, 1, 256, 1344, 1344, 1344, 256]
    - [2, 12.495]
  - - [1472, 3136, 1, 256, 1472, 1472, 1472, 256]
    - [2, 12.511]
  - - [1600, 3136, 1, 256, 1600, 1600, 1600, 256]
    - [2, 12.541]
  - - [1728, 3136, 1, 256, 1728, 1728, 1728, 256]
    - [2, 12.676]
  - - [1856, 3136, 1, 256, 1856, 1856, 1856, 256]
    - [2, 12.718]
  - - [1984, 3136, 1, 256, 1984, 1984, 1984, 256]
    - [2, 12.64]
  - - [2112, 3136, 1, 256, 2112, 2112, 2112, 256]
    - [2, 12.616]
  - - [2240, 3136, 1, 256, 2240, 2240, 2240, 256]
    - [2, 12.722]
  - - [2368, 3136, 1, 256, 2368, 2368, 2368, 256]
    - [2, 12.909]
  - - [2496, 3136, 1, 256, 2496, 2496, 2496, 256]
    - [2, 12.708]
  - - [2624, 3136, 1, 256, 2624, 2624, 2624, 256]
    - [2, 12.781]
  - - [2752, 3136, 1, 256, 2752, 2752, 2752, 256]
    - [2, 12.741]
  - - [2880, 3136, 1, 256, 2880, 2880, 2880, 256]
    - [2, 12.909]
  - - [3008, 3136, 1, 256, 3008, 3008, 3008, 256]
    - [2, 12.84]
  - - [3136, 3136, 1, 256, 3136, 3136, 3136, 256]
    - [2, 12.819]
  - - [3264, 3136, 1, 256, 3264, 3264, 3264, 256]
    - [2, 12.804]
  - - [3392, 3136, 1, 256, 3392, 3392, 3392, 256]
    - [2, 12.816]
  - - [3520, 3136, 1, 256, 3520, 3520, 3520, 256]
    - [2, 12.906]
  - - [3648, 3136, 1, 256, 3648, 3648, 3648, 256]
    - [2, 12.881]
  - - [3776, 3136, 1, 256, 3776, 3776, 3776, 256]
    - [2, 12.885]
  - - [3904, 3136, 1, 256, 3904, 3904, 3904, 256]
    - [2, 12.904]
  - - [4032, 3136, 1, 256, 4032, 4032, 4032, 256]
    - [2, 12.863]
  - - [64, 3264, 1, 256, 64, 64, 64, 256]
    - [2, 7.209]
  - - [192, 3264, 1, 256, 192, 192, 192, 256]
    - [2, 10.45]
  - - [320, 3264, 1, 256, 320, 320, 320, 256]
    - [2, 11.642]
  - - [448, 3264, 1, 256, 448, 448, 448, 256]
    - [2, 12.029]
  - - [576, 3264, 1, 256, 576, 576, 576, 256]
    - [2, 12.365]
  - - [704, 3264, 1, 256, 704, 704, 704, 256]
    - [2, 11.921]
  - - [832, 3264, 1, 256, 832, 832, 832, 256]
    - [2, 12.238]
  - - [960, 3264, 1, 256, 960, 960, 960, 256]
    - [2, 12.538]
  - - [1088, 3264, 1, 256, 1088, 1088, 1088, 256]
    - [2, 12.456]
  - - [1216, 3264, 1, 256, 1216, 1216, 1216, 256]
    - [2, 12.641]
  - - [1344, 3264, 1, 256, 1344, 1344, 1344, 256]
    - [2, 12.6]
  - - [1472, 3264, 1, 256, 1472, 1472, 1472, 256]
    - [2, 12.719]
  - - [1600, 3264, 1, 256, 1600, 1600, 1600, 256]
    - [2, 12.705]
  - - [1728, 3264, 1, 256, 1728, 1728, 1728, 256]
    - [2, 12.569]
  - - [1856, 3264, 1, 256, 1856, 1856, 1856, 256]
    - [2, 12.608]
  - - [1984, 3264, 1, 256, 1984, 1984, 1984, 256]
    - [2, 12.671]
  - - [2112, 3264, 1, 256, 2112, 2112, 2112, 256]
    - [2, 12.828]
  - - [2240, 3264, 1, 256, 2240, 2240, 2240, 256]
    - [2, 12.696]
  - - [2368, 3264, 1, 256, 2368, 2368, 2368, 256]
    - [2, 12.795]
  - - [2496, 3264, 1, 256, 2496, 2496, 2496, 256]
    - [2, 12.741]
  - - [2624, 3264, 1, 256, 2624, 2624, 2624, 256]
    - [2, 12.75]
  - - [2752, 3264, 1, 256, 2752, 2752, 2752, 256]
    - [2, 12.828]
  - - [2880, 3264, 1, 256, 2880, 2880, 2880, 256]
    - [2, 12.859]
  - - [3008, 3264, 1, 256, 3008, 3008, 3008, 256]
    - [2, 12.791]
  - - [3136, 3264, 1, 256, 3136, 3136, 3136, 256]
    - [2, 13.03]
  - - [3264, 3264, 1, 256, 3264, 3264, 3264, 256]
    - [2, 12.952]
  - - [3392, 3264, 1, 256, 3392, 3392, 3392, 256]
    - [2, 12.888]
  - - [3520, 3264, 1, 256, 3520, 3520, 3520, 256]
    - [2, 12.948]
  - - [3648, 3264, 1, 256, 3648, 3648, 3648, 256]
    - [2, 12.927]
  - - [3776, 3264, 1, 256, 3776, 3776, 3776, 256]
    - [2, 12.858]
  - - [3904, 3264, 1, 256, 3904, 3904, 3904, 256]
    - [2, 12.982]
  - - [4032, 3264, 1, 256, 4032, 4032, 4032, 256]
    - [2, 13.012]
  - - [64, 3392, 1, 256, 64, 64, 64, 256]
    - [2, 7.486]
  - - [192, 3392, 1, 256, 192, 192, 192, 256]
    - [2, 10.562]
  - - [320, 3392, 1, 256, 320, 320, 320, 256]
    - [2, 12.076]
  - - [448, 3392, 1, 256, 448, 448, 448, 256]
    - [2, 12.36]
  - - [576, 3392, 1, 256, 576, 576, 576, 256]
    - [2, 12.076]
  - - [704, 3392, 1, 256, 704, 704, 704, 256]
    - [2, 12.268]
  - - [832, 3392, 1, 256, 832, 832, 832, 256]
    - [2, 12.255]
  - - [960, 3392, 1, 256, 960, 960, 960, 256]
    - [2, 12.381]
  - - [1088, 3392, 1, 256, 1088, 1088, 1088, 256]
    - [2, 12.44]
  - - [1216, 3392, 1, 256, 1216, 1216, 1216, 256]
    - [2, 12.532]
  - - [1344, 3392, 1, 256, 1344, 1344, 1344, 256]
    - [2, 12.561]
  - - [1472, 3392, 1, 256, 1472, 1472, 1472, 256]
    - [2, 12.641]
  - - [1600, 3392, 1, 256, 1600, 1600, 1600, 256]
    - [2, 12.767]
  - - [1728, 3392, 1, 256, 1728, 1728, 1728, 256]
    - [2, 12.683]
  - - [1856, 3392, 1, 256, 1856, 1856, 1856, 256]
    - [2, 12.783]
  - - [1984, 3392, 1, 256, 1984, 1984, 1984, 256]
    - [2, 12.833]
  - - [2112, 3392, 1, 256, 2112, 2112, 2112, 256]
    - [2, 12.805]
  - - [2240, 3392, 1, 256, 2240, 2240, 2240, 256]
    - [2, 12.696]
  - - [2368, 3392, 1, 256, 2368, 2368, 2368, 256]
    - [2, 12.756]
  - - [2496, 3392, 1, 256, 2496, 2496, 2496, 256]
    - [2, 12.854]
  - - [2624, 3392, 1, 256, 2624, 2624, 2624, 256]
    - [2, 12.894]
  - - [2752, 3392, 1, 256, 2752, 2752, 2752, 256]
    - [2, 12.838]
  - - [2880, 3392, 1, 256, 2880, 2880, 2880, 256]
    - [2, 12.855]
  - - [3008, 3392, 1, 256, 3008, 3008, 3008, 256]
    - [2, 12.839]
  - - [3136, 3392, 1, 256, 3136, 3136, 3136, 256]
    - [2, 12.836]
  - - [3264, 3392, 1, 256, 3264, 3264, 3264, 256]
    - [2, 12.84]
  - - [3392, 3392, 1, 256, 3392, 3392, 3392, 256]
    - [2, 12.874]
  - - [3520, 3392, 1, 256, 3520, 3520, 3520, 256]
    - [2, 12.888]
  - - [3648, 3392, 1, 256, 3648, 3648, 3648, 256]
    - [2, 12.916]
  - - [3776, 3392, 1, 256, 3776, 3776, 3776, 256]
    - [2, 13.013]
  - - [3904, 3392, 1, 256, 3904, 3904, 3904, 256]
    - [2, 13.007]
  - - [4032, 3392, 1, 256, 4032, 4032, 4032, 256]
    - [2, 12.901]
  - - [64, 3520, 1, 256, 64, 64, 64, 256]
    - [2, 7.674]
  - - [192, 3520, 1, 256, 192, 192, 192, 256]
    - [2, 10.658]
  - - [320, 3520, 1, 256, 320, 320, 320, 256]
    - [2, 11.979]
  - - [448, 3520, 1, 256, 448, 448, 448, 256]
    - [2, 12.16]
  - - [576, 3520, 1, 256, 576, 576, 576, 256]
    - [2, 12.212]
  - - [704, 3520, 1, 256, 704, 704, 704, 256]
    - [2, 12.382]
  - - [832, 3520, 1, 256, 832, 832, 832, 256]
    - [2, 12.255]
  - - [960, 3520, 1, 256, 960, 960, 960, 256]
    - [2, 12.339]
  - - [1088, 3520, 1, 256, 1088, 1088, 1088, 256]
    - [2, 12.534]
  - - [1216, 3520, 1, 256, 1216, 1216, 1216, 256]
    - [2, 12.564]
  - - [1344, 3520, 1, 256, 1344, 1344, 1344, 256]
    - [2, 12.616]
  - - [1472, 3520, 1, 256, 1472, 1472, 1472, 256]
    - [2, 12.592]
  - - [1600, 3520, 1, 256, 1600, 1600, 1600, 256]
    - [2, 12.628]
  - - [1728, 3520, 1, 256, 1728, 1728, 1728, 256]
    - [2, 12.678]
  - - [1856, 3520, 1, 256, 1856, 1856, 1856, 256]
    - [2, 12.744]
  - - [1984, 3520, 1, 256, 1984, 1984, 1984, 256]
    - [2, 12.796]
  - - [2112, 3520, 1, 256, 2112, 2112, 2112, 256]
    - [2, 12.766]
  - - [2240, 3520, 1, 256, 2240, 2240, 2240, 256]
    - [2, 12.795]
  - - [2368, 3520, 1, 256, 2368, 2368, 2368, 256]
    - [2, 12.721]
  - - [2496, 3520, 1, 256, 2496, 2496, 2496, 256]
    - [2, 12.839]
  - - [2624, 3520, 1, 256, 2624, 2624, 2624, 256]
    - [2, 12.905]
  - - [2752, 3520, 1, 256, 2752, 2752, 2752, 256]
    - [2, 12.943]
  - - [2880, 3520, 1, 256, 2880, 2880, 2880, 256]
    - [2, 12.853]
  - - [3008, 3520, 1, 256, 3008, 3008, 3008, 256]
    - [2, 12.879]
  - - [3136, 3520, 1, 256, 3136, 3136, 3136, 256]
    - [2, 12.84]
  - - [3264, 3520, 1, 256, 3264, 3264, 3264, 256]
    - [2, 12.87]
  - - [3392, 3520, 1, 256, 3392, 3392, 3392, 256]
    - [2, 12.967]
  - - [3520, 3520, 1, 256, 3520, 3520, 3520, 256]
    - [2, 12.888]
  - - [3648, 3520, 1, 256, 3648, 3648, 3648, 256]
    - [2, 12.901]
  - - [3776, 3520, 1, 256, 3776, 3776, 3776, 256]
    - [2, 13.037]
  - - [3904, 3520, 1, 256, 3904, 3904, 3904, 256]
    - [2, 13.057]
  - - [4032, 3520, 1, 256, 4032, 4032, 4032, 256]
    - [2, 12.955]
  - - [64, 3648, 1, 256, 64, 64, 64, 256]
    - [0, 7.895]
  - - [192, 3648, 1, 256, 192, 192, 192, 256]
    - [2, 10.754]
  - - [320, 3648, 1, 256, 320, 320, 320, 256]
    - [2, 11.998]
  - - [448, 3648, 1, 256, 448, 448, 448, 256]
    - [2, 12.516]
  - - [576, 3648, 1, 256, 576, 576, 576, 256]
    - [2, 12.189]
  - - [704, 3648, 1, 256, 704, 704, 704, 256]
    - [2, 12.419]
  - - [832, 3648, 1, 256, 832, 832, 832, 256]
    - [2, 12.376]
  - - [960, 3648, 1, 256, 960, 960, 960, 256]
    - [2, 12.397]
  - - [1088, 3648, 1, 256, 1088, 1088, 1088, 256]
    - [2, 12.5]
  - - [1216, 3648, 1, 256, 1216, 1216, 1216, 256]
    - [2, 12.484]
  - - [1344, 3648, 1, 256, 1344, 1344, 1344, 256]
    - [2, 12.5]
  - - [1472, 3648, 1, 256, 1472, 1472, 1472, 256]
    - [2, 12.651]
  - - [1600, 3648, 1, 256, 1600, 1600, 1600, 256]
    - [2, 12.745]
  - - [1728, 3648, 1, 256, 1728, 1728, 1728, 256]
    - [2, 12.691]
  - - [1856, 3648, 1, 256, 1856, 1856, 1856, 256]
    - [2, 12.725]
  - - [1984, 3648, 1, 256, 1984, 1984, 1984, 256]
    - [2, 12.788]
  - - [2112, 3648, 1, 256, 2112, 2112, 2112, 256]
    - [2, 12.725]
  - - [2240, 3648, 1, 256, 2240, 2240, 2240, 256]
    - [2, 12.861]
  - - [2368, 3648, 1, 256, 2368, 2368, 2368, 256]
    - [2, 12.729]
  - - [2496, 3648, 1, 256, 2496, 2496, 2496, 256]
    - [2, 12.853]
  - - [2624, 3648, 1, 256, 2624, 2624, 2624, 256]
    - [2, 12.871]
  - - [2752, 3648, 1, 256, 2752, 2752, 2752, 256]
    - [2, 12.825]
  - - [2880, 3648, 1, 256, 2880, 2880, 2880, 256]
    - [2, 12.897]
  - - [3008, 3648, 1, 256, 3008, 3008, 3008, 256]
    - [2, 12.97]
  - - [3136, 3648, 1, 256, 3136, 3136, 3136, 256]
    - [2, 12.992]
  - - [3264, 3648, 1, 256, 3264, 3264, 3264, 256]
    - [2, 12.898]
  - - [3392, 3648, 1, 256, 3392, 3392, 3392, 256]
    - [2, 12.898]
  - - [3520, 3648, 1, 256, 3520, 3520, 3520, 256]
    - [2, 12.902]
  - - [3648, 3648, 1, 256, 3648, 3648, 3648, 256]
    - [2, 12.997]
  - - [3776, 3648, 1, 256, 3776, 3776, 3776, 256]
    - [2, 12.999]
  - - [3904, 3648, 1, 256, 3904, 3904, 3904, 256]
    - [2, 13.042]
  - - [4032, 3648, 1, 256, 4032, 4032, 4032, 256]
    - [2, 12.997]
  - - [64, 3776, 1, 256, 64, 64, 64, 256]
    - [0, 8.152]
  - - [192, 3776, 1, 256, 192, 192, 192, 256]
    - [2, 10.83]
  - - [320, 3776, 1, 256, 320, 320, 320, 256]
    - [2, 11.92]
  - - [448, 3776, 1, 256, 448, 448, 448, 256]
    - [2, 12.157]
  - - [576, 3776, 1, 256, 576, 576, 576, 256]
    - [2, 12.225]
  - - [704, 3776, 1, 256, 704, 704, 704, 256]
    - [2, 12.395]
  - - [832, 3776, 1, 256, 832, 832, 832, 256]
    - [2, 12.581]
  - - [960, 3776, 1, 256, 960, 960, 960, 256]
    - [0, 12.147]
  - - [1088, 3776, 1, 256, 1088, 1088, 1088, 256]
    - [2, 12.709]
  - - [1216, 3776, 1, 256, 1216, 1216, 1216, 256]
    - [2, 12.546]
  - - [1344, 3776, 1, 256, 1344, 1344, 1344, 256]
    - [2, 12.553]
  - - [1472, 3776, 1, 256, 1472, 1472, 1472, 256]
    - [2, 12.699]
  - - [1600, 3776, 1, 256, 1600, 1600, 1600, 256]
    - [2, 12.854]
  - - [1728, 3776, 1, 256, 1728, 1728, 1728, 256]
    - [2, 12.829]
  - - [1856, 3776, 1, 256, 1856, 1856, 1856, 256]
    - [2, 12.665]
  - - [1984, 3776, 1, 256, 1984, 1984, 1984, 256]
    - [2, 12.782]
  - - [2112, 3776, 1, 256, 2112, 2112, 2112, 256]
    - [2, 12.779]
  - - [2240, 3776, 1, 256, 2240, 2240, 2240, 256]
    - [2, 12.828]
  - - [2368, 3776, 1, 256, 2368, 2368, 2368, 256]
    - [2, 12.826]
  - - [2496, 3776, 1, 256, 2496, 2496, 2496, 256]
    - [2, 12.785]
  - - [2624, 3776, 1, 256, 2624, 2624, 2624, 256]
    - [2, 12.931]
  - - [2752, 3776, 1, 256, 2752, 2752, 2752, 256]
    - [2, 12.873]
  - - [2880, 3776, 1, 256, 2880, 2880, 2880, 256]
    - [2, 12.894]
  - - [3008, 3776, 1, 256, 3008, 3008, 3008, 256]
    - [2, 12.991]
  - - [3136, 3776, 1, 256, 3136, 3136, 3136, 256]
    - [2, 12.977]
  - - [3264, 3776, 1, 256, 3264, 3264, 3264, 256]
    - [2, 12.951]
  - - [3392, 3776, 1, 256, 3392, 3392, 3392, 256]
    - [2, 12.864]
  - - [3520, 3776, 1, 256, 3520, 3520, 3520, 256]
    - [2, 12.925]
  - - [3648, 3776, 1, 256, 3648, 3648, 3648, 256]
    - [2, 12.935]
  - - [3776, 3776, 1, 256, 3776, 3776, 3776, 256]
    - [2, 13.027]
  - - [3904, 3776, 1, 256, 3904, 3904, 3904, 256]
    - [2, 12.908]
  - - [4032, 3776, 1, 256, 4032, 4032, 4032, 256]
    - [2, 13.008]
  - - [64, 3904, 1, 256, 64, 64, 64, 256]
    - [2, 7.65]
  - - [192, 3904, 1, 256, 192, 192, 192, 256]
    - [2, 11.309]
  - - [320, 3904, 1, 256, 320, 320, 320, 256]
    - [2, 11.996]
  - - [448, 3904, 1, 256, 448, 448, 448, 256]
    - [2, 12.135]
  - - [576, 3904, 1, 256, 576, 576, 576, 256]
    - [2, 12.252]
  - - [704, 3904, 1, 256, 704, 704, 704, 256]
    - [2, 12.351]
  - - [832, 3904, 1, 256, 832, 832, 832, 256]
    - [2, 12.376]
  - - [960, 3904, 1, 256, 960, 960, 960, 256]
    - [2, 12.51]
  - - [1088, 3904, 1, 256, 1088, 1088, 1088, 256]
    - [2, 12.578]
  - - [1216, 3904, 1, 256, 1216, 1216, 1216, 256]
    - [2, 12.699]
  - - [1344, 3904, 1, 256, 1344, 1344, 1344, 256]
    - [2, 12.682]
  - - [1472, 3904, 1, 256, 1472, 1472, 1472, 256]
    - [2, 12.898]
  - - [1600, 3904, 1, 256, 1600, 1600, 1600, 256]
    - [2, 12.71]
  - - [1728, 3904, 1, 256, 1728, 1728, 1728, 256]
    - [2, 12.73]
  - - [1856, 3904, 1, 256, 1856, 1856, 1856, 256]
    - [2, 12.722]
  - - [1984, 3904, 1, 256, 1984, 1984, 1984, 256]
    - [2, 12.781]
  - - [2112, 3904, 1, 256, 2112, 2112, 2112, 256]
    - [2, 12.785]
  - - [2240, 3904, 1, 256, 2240, 2240, 2240, 256]
    - [2, 12.883]
  - - [2368, 3904, 1, 256, 2368, 2368, 2368, 256]
    - [2, 12.886]
  - - [2496, 3904, 1, 256, 2496, 2496, 2496, 256]
    - [2, 12.957]
  - - [2624, 3904, 1, 256, 2624, 2624, 2624, 256]
    - [2, 13.028]
  - - [2752, 3904, 1, 256, 2752, 2752, 2752, 256]
    - [2, 12.879]
  - - [2880, 3904, 1, 256, 2880, 2880, 2880, 256]
    - [2, 13.016]
  - - [3008, 3904, 1, 256, 3008, 3008, 3008, 256]
    - [2, 13.06]
  - - [3136, 3904, 1, 256, 3136, 3136, 3136, 256]
    - [2, 13.11]
  - - [3264, 3904, 1, 256, 3264, 3264, 3264, 256]
    - [2, 12.981]
  - - [3392, 3904, 1, 256, 3392, 3392, 3392, 256]
    - [2, 12.959]
  - - [3520, 3904, 1, 256, 3520, 3520, 3520, 256]
    - [2, 13.089]
  - - [3648, 3904, 1, 256, 3648, 3648, 3648, 256]
    - [2, 13.025]
  - - [3776, 3904, 1, 256, 3776, 3776, 3776, 256]
    - [2, 13.001]
  - - [3904, 3904, 1, 256, 3904, 3904, 3904, 256]
    - [2, 13.089]
  - - [4032, 3904, 1, 256, 4032, 4032, 4032, 256]
    - [2, 13.129]
  - - [64, 4032, 1, 256, 64, 64, 64, 256]
    - [2, 7.979]
  - - [192, 4032, 1, 256, 192, 192, 192, 256]
    - [2, 11.03]
  - - [320, 4032, 1, 256, 320, 320, 320, 256]
    - [2, 12.207]
  - - [448, 4032, 1, 256, 448, 448, 448, 256]
    - [2, 12.152]
  - - [576, 4032, 1, 256, 576, 576, 576, 256]
    - [2, 12.255]
  - - [704, 4032, 1, 256, 704, 704, 704, 256]
    - [2, 12.38]
  - - [832, 4032, 1, 256, 832, 832, 832, 256]
    - [2, 12.608]
  - - [960, 4032, 1, 256, 960, 960, 960, 256]
    - [2, 12.676]
  - - [1088, 4032, 1, 256, 1088, 1088, 1088, 256]
    - [2, 12.719]
  - - [1216, 4032, 1, 256, 1216, 1216, 1216, 256]
    - [2, 12.773]
  - - [1344, 4032, 1, 256, 1344, 1344, 1344, 256]
    - [2, 12.889]
  - - [1472, 4032, 1, 256, 1472, 1472, 1472, 256]
    - [2, 12.626]
  - - [1600, 4032, 1, 256, 1600, 1600, 1600, 256]
    - [2, 12.799]
  - - [1728, 4032, 1, 256, 1728, 1728, 1728, 256]
    - [2, 12.846]
  - - [1856, 4032, 1, 256, 1856, 1856, 1856, 256]
    - [2, 12.832]
  - - [1984, 4032, 1, 256, 1984, 1984, 1984, 256]
    - [2, 12.795]
  - - [2112, 4032, 1, 256, 2112, 2112, 2112, 256]
    - [2, 13.007]
  - - [2240, 4032, 1, 256, 2240, 2240, 2240, 256]
    - [2, 12.851]
  - - [2368, 4032, 1, 256, 2368, 2368, 2368, 256]
    - [2, 13.003]
  - - [2496, 4032, 1, 256, 2496, 2496, 2496, 256]
    - [2, 12.959]
  - - [2624, 4032, 1, 256, 2624, 2624, 2624, 256]
    - [2, 12.993]
  - - [2752, 4032, 1, 256, 2752, 2752, 2752, 256]
    - [2, 12.944]
  - - [2880, 4032, 1, 256, 2880, 2880, 2880, 256]
    - [2, 13.006]
  - - [3008, 4032, 1, 256, 3008, 3008, 3008, 256]
    - [2, 13.139]
  - - [3136, 4032, 1, 256, 3136, 3136, 3136, 256]
    - [2, 13.059]
  - - [3264, 4032, 1, 256, 3264, 3264, 3264, 256]
    - [2, 13.084]
  - - [3392, 4032, 1, 256, 3392, 3392, 3392, 256]
    - [2, 13.018]
  - - [3520, 4032, 1, 256, 3520, 3520, 3520, 256]
    - [2, 13.15]
  - - [3648, 4032, 1, 256, 3648, 3648, 3648, 256]
    - [2, 13.146]
  - - [3776, 4032, 1, 256, 3776, 3776, 3776, 256]
    - [2, 13.116]
  - - [3904, 4032, 1, 256, 3904, 3904, 3904, 256]
    - [2, 13.094]
  - - [4032, 4032, 1, 256, 4032, 4032, 4032, 256]
    - [2, 13.151]
  - - [64, 64, 1, 512, 64, 64, 64, 512]
    - [1, 0.524]
  - - [192, 64, 1, 512, 192, 192, 192, 512]
    - [1, 1.554]
  - - [320, 64, 1, 512, 320, 320, 320, 512]
    - [2, 2.564]
  - - [448, 64, 1, 512, 448, 448, 448, 512]
    - [0, 3.055]
  - - [576, 64, 1, 512, 576, 576, 576, 512]
    - [0, 3.914]
  - - [704, 64, 1, 512, 704, 704, 704, 512]
    - [0, 4.777]
  - - [832, 64, 1, 512, 832, 832, 832, 512]
    - [2, 4.524]
  - - [960, 64, 1, 512, 960, 960, 960, 512]
    - [2, 5.177]
  - - [1088, 64, 1, 512, 1088, 1088, 1088, 512]
    - [2, 5.842]
  - - [1216, 64, 1, 512, 1216, 1216, 1216, 512]
    - [0, 5.895]
  - - [1344, 64, 1, 512, 1344, 1344, 1344, 512]
    - [0, 6.515]
  - - [1472, 64, 1, 512, 1472, 1472, 1472, 512]
    - [0, 7.113]
  - - [1600, 64, 1, 512, 1600, 1600, 1600, 512]
    - [2, 6.43]
  - - [1728, 64, 1, 512, 1728, 1728, 1728, 512]
    - [2, 6.923]
  - - [1856, 64, 1, 512, 1856, 1856, 1856, 512]
    - [2, 7.431]
  - - [1984, 64, 1, 512, 1984, 1984, 1984, 512]
    - [0, 7.415]
  - - [2112, 64, 1, 512, 2112, 2112, 2112, 512]
    - [0, 7.905]
  - - [2240, 64, 1, 512, 2240, 2240, 2240, 512]
    - [0, 8.368]
  - - [2368, 64, 1, 512, 2368, 2368, 2368, 512]
    - [2, 7.628]
  - - [2496, 64, 1, 512, 2496, 2496, 2496, 512]
    - [2, 7.956]
  - - [2624, 64, 1, 512, 2624, 2624, 2624, 512]
    - [2, 8.378]
  - - [2752, 64, 1, 512, 2752, 2752, 2752, 512]
    - [0, 8.33]
  - - [2880, 64, 1, 512, 2880, 2880, 2880, 512]
    - [0, 8.684]
  - - [3008, 64, 1, 512, 3008, 3008, 3008, 512]
    - [0, 9.063]
  - - [3136, 64, 1, 512, 3136, 3136, 3136, 512]
    - [2, 8.46]
  - - [3264, 64, 1, 512, 3264, 3264, 3264, 512]
    - [2, 8.672]
  - - [3392, 64, 1, 512, 3392, 3392, 3392, 512]
    - [2, 9.017]
  - - [3520, 64, 1, 512, 3520, 3520, 3520, 512]
    - [2, 9.315]
  - - [3648, 64, 1, 512, 3648, 3648, 3648, 512]
    - [0, 9.482]
  - - [3776, 64, 1, 512, 3776, 3776, 3776, 512]
    - [0, 9.772]
  - - [3904, 64, 1, 512, 3904, 3904, 3904, 512]
    - [2, 9.309]
  - - [4032, 64, 1, 512, 4032, 4032, 4032, 512]
    - [2, 9.381]
  - - [64, 192, 1, 512, 64, 64, 64, 512]
    - [1, 1.505]
  - - [192, 192, 1, 512, 192, 192, 192, 512]
    - [0, 3.846]
  - - [320, 192, 1, 512, 320, 320, 320, 512]
    - [2, 5.117]
  - - [448, 192, 1, 512, 448, 448, 448, 512]
    - [0, 6.421]
  - - [576, 192, 1, 512, 576, 576, 576, 512]
    - [2, 6.875]
  - - [704, 192, 1, 512, 704, 704, 704, 512]
    - [0, 7.807]
  - - [832, 192, 1, 512, 832, 832, 832, 512]
    - [2, 7.985]
  - - [960, 192, 1, 512, 960, 960, 960, 512]
    - [0, 8.708]
  - - [1088, 192, 1, 512, 1088, 1088, 1088, 512]
    - [2, 8.717]
  - - [1216, 192, 1, 512, 1216, 1216, 1216, 512]
    - [0, 9.509]
  - - [1344, 192, 1, 512, 1344, 1344, 1344, 512]
    - [2, 9.609]
  - - [1472, 192, 1, 512, 1472, 1472, 1472, 512]
    - [0, 9.979]
  - - [1600, 192, 1, 512, 1600, 1600, 1600, 512]
    - [2, 9.894]
  - - [1728, 192, 1, 512, 1728, 1728, 1728, 512]
    - [0, 10.329]
  - - [1856, 192, 1, 512, 1856, 1856, 1856, 512]
    - [2, 10.342]
  - - [1984, 192, 1, 512, 1984, 1984, 1984, 512]
    - [2, 10.596]
  - - [2112, 192, 1, 512, 2112, 2112, 2112, 512]
    - [2, 10.702]
  - - [2240, 192, 1, 512, 2240, 2240, 2240, 512]
    - [0, 11.052]
  - - [2368, 192, 1, 512, 2368, 2368, 2368, 512]
    - [2, 10.919]
  - - [2496, 192, 1, 512, 2496, 2496, 2496, 512]
    - [0, 10.986]
  - - [2624, 192, 1, 512, 2624, 2624, 2624, 512]
    - [2, 11.384]
  - - [2752, 192, 1, 512, 2752, 2752, 2752, 512]
    - [2, 11.529]
  - - [2880, 192, 1, 512, 2880, 2880, 2880, 512]
    - [2, 11.599]
  - - [3008, 192, 1, 512, 3008, 3008, 3008, 512]
    - [2, 11.718]
  - - [3136, 192, 1, 512, 3136, 3136, 3136, 512]
    - [2, 11.616]
  - - [3264, 192, 1, 512, 3264, 3264, 3264, 512]
    - [2, 11.572]
  - - [3392, 192, 1, 512, 3392, 3392, 3392, 512]
    - [2, 11.683]
  - - [3520, 192, 1, 512, 3520, 3520, 3520, 512]
    - [0, 11.793]
  - - [3648, 192, 1, 512, 3648, 3648, 3648, 512]
    - [2, 11.949]
  - - [3776, 192, 1, 512, 3776, 3776, 3776, 512]
    - [2, 11.889]
  - - [3904, 192, 1, 512, 3904, 3904, 3904, 512]
    - [2, 11.785]
  - - [4032, 192, 1, 512, 4032, 4032, 4032, 512]
    - [2, 11.971]
  - - [64, 320, 1, 512, 64, 64, 64, 512]
    - [3, 0.677]
  - - [192, 320, 1, 512, 192, 192, 192, 512]
    - [0, 3.928]
  - - [320, 320, 1, 512, 320, 320, 320, 512]
    - [2, 6.386]
  - - [448, 320, 1, 512, 448, 448, 448, 512]
    - [0, 8.281]
  - - [576, 320, 1, 512, 576, 576, 576, 512]
    - [0, 8.707]
  - - [704, 320, 1, 512, 704, 704, 704, 512]
    - [2, 9.331]
  - - [832, 320, 1, 512, 832, 832, 832, 512]
    - [2, 9.582]
  - - [960, 320, 1, 512, 960, 960, 960, 512]
    - [2, 9.984]
  - - [1088, 320, 1, 512, 1088, 1088, 1088, 512]
    - [2, 10.18]
  - - [1216, 320, 1, 512, 1216, 1216, 1216, 512]
    - [0, 10.789]
  - - [1344, 320, 1, 512, 1344, 1344, 1344, 512]
    - [0, 10.917]
  - - [1472, 320, 1, 512, 1472, 1472, 1472, 512]
    - [2, 10.885]
  - - [1600, 320, 1, 512, 1600, 1600, 1600, 512]
    - [2, 11.202]
  - - [1728, 320, 1, 512, 1728, 1728, 1728, 512]
    - [2, 11.759]
  - - [1856, 320, 1, 512, 1856, 1856, 1856, 512]
    - [2, 11.781]
  - - [1984, 320, 1, 512, 1984, 1984, 1984, 512]
    - [0, 12.13]
  - - [2112, 320, 1, 512, 2112, 2112, 2112, 512]
    - [0, 11.857]
  - - [2240, 320, 1, 512, 2240, 2240, 2240, 512]
    - [0, 12.046]
  - - [2368, 320, 1, 512, 2368, 2368, 2368, 512]
    - [2, 11.955]
  - - [2496, 320, 1, 512, 2496, 2496, 2496, 512]
    - [2, 12.012]
  - - [2624, 320, 1, 512, 2624, 2624, 2624, 512]
    - [2, 12.133]
  - - [2752, 320, 1, 512, 2752, 2752, 2752, 512]
    - [0, 12.079]
  - - [2880, 320, 1, 512, 2880, 2880, 2880, 512]
    - [2, 12.02]
  - - [3008, 320, 1, 512, 3008, 3008, 3008, 512]
    - [2, 12.099]
  - - [3136, 320, 1, 512, 3136, 3136, 3136, 512]
    - [2, 12.02]
  - - [3264, 320, 1, 512, 3264, 3264, 3264, 512]
    - [2, 11.921]
  - - [3392, 320, 1, 512, 3392, 3392, 3392, 512]
    - [2, 12.016]
  - - [3520, 320, 1, 512, 3520, 3520, 3520, 512]
    - [2, 12.182]
  - - [3648, 320, 1, 512, 3648, 3648, 3648, 512]
    - [2, 12.048]
  - - [3776, 320, 1, 512, 3776, 3776, 3776, 512]
    - [2, 12.081]
  - - [3904, 320, 1, 512, 3904, 3904, 3904, 512]
    - [2, 12.114]
  - - [4032, 320, 1, 512, 4032, 4032, 4032, 512]
    - [2, 12.134]
  - - [64, 448, 1, 512, 64, 64, 64, 512]
    - [2, 3.078]
  - - [192, 448, 1, 512, 192, 192, 192, 512]
    - [0, 6.542]
  - - [320, 448, 1, 512, 320, 320, 320, 512]
    - [0, 8.403]
  - - [448, 448, 1, 512, 448, 448, 448, 512]
    - [2, 8.559]
  - - [576, 448, 1, 512, 576, 576, 576, 512]
    - [2, 9.705]
  - - [704, 448, 1, 512, 704, 704, 704, 512]
    - [2, 10.13]
  - - [832, 448, 1, 512, 832, 832, 832, 512]
    - [2, 10.474]
  - - [960, 448, 1, 512, 960, 960, 960, 512]
    - [0, 10.988]
  - - [1088, 448, 1, 512, 1088, 1088, 1088, 512]
    - [2, 11.384]
  - - [1216, 448, 1, 512, 1216, 1216, 1216, 512]
    - [2, 11.42]
  - - [1344, 448, 1, 512, 1344, 1344, 1344, 512]
    - [2, 11.751]
  - - [1472, 448, 1, 512, 1472, 1472, 1472, 512]
    - [2, 11.693]
  - - [1600, 448, 1, 512, 1600, 1600, 1600, 512]
    - [0, 11.882]
  - - [1728, 448, 1, 512, 1728, 1728, 1728, 512]
    - [2, 11.792]
  - - [1856, 448, 1, 512, 1856, 1856, 1856, 512]
    - [0, 12.086]
  - - [1984, 448, 1, 512, 1984, 1984, 1984, 512]
    - [2, 11.911]
  - - [2112, 448, 1, 512, 2112, 2112, 2112, 512]
    - [2, 12.053]
  - - [2240, 448, 1, 512, 2240, 2240, 2240, 512]
    - [2, 12.106]
  - - [2368, 448, 1, 512, 2368, 2368, 2368, 512]
    - [2, 11.969]
  - - [2496, 448, 1, 512, 2496, 2496, 2496, 512]
    - [2, 11.983]
  - - [2624, 448, 1, 512, 2624, 2624, 2624, 512]
    - [2, 12.29]
  - - [2752, 448, 1, 512, 2752, 2752, 2752, 512]
    - [2, 12.174]
  - - [2880, 448, 1, 512, 2880, 2880, 2880, 512]
    - [2, 12.349]
  - - [3008, 448, 1, 512, 3008, 3008, 3008, 512]
    - [2, 12.25]
  - - [3136, 448, 1, 512, 3136, 3136, 3136, 512]
    - [2, 12.15]
  - - [3264, 448, 1, 512, 3264, 3264, 3264, 512]
    - [2, 12.275]
  - - [3392, 448, 1, 512, 3392, 3392, 3392, 512]
    - [2, 12.274]
  - - [3520, 448, 1, 512, 3520, 3520, 3520, 512]
    - [2, 12.207]
  - - [3648, 448, 1, 512, 3648, 3648, 3648, 512]
    - [2, 12.404]
  - - [3776, 448, 1, 512, 3776, 3776, 3776, 512]
    - [2, 12.418]
  - - [3904, 448, 1, 512, 3904, 3904, 3904, 512]
    - [2, 12.478]
  - - [4032, 448, 1, 512, 4032, 4032, 4032, 512]
    - [2, 12.534]
  - - [64, 576, 1, 512, 64, 64, 64, 512]
    - [3, 2.355]
  - - [192, 576, 1, 512, 192, 192, 192, 512]
    - [2, 6.881]
  - - [320, 576, 1, 512, 320, 320, 320, 512]
    - [0, 8.71]
  - - [448, 576, 1, 512, 448, 448, 448, 512]
    - [2, 9.565]
  - - [576, 576, 1, 512, 576, 576, 576, 512]
    - [0, 10.308]
  - - [704, 576, 1, 512, 704, 704, 704, 512]
    - [2, 10.676]
  - - [832, 576, 1, 512, 832, 832, 832, 512]
    - [0, 11.062]
  - - [960, 576, 1, 512, 960, 960, 960, 512]
    - [2, 11.458]
  - - [1088, 576, 1, 512, 1088, 1088, 1088, 512]
    - [2, 11.842]
  - - [1216, 576, 1, 512, 1216, 1216, 1216, 512]
    - [2, 11.68]
  - - [1344, 576, 1, 512, 1344, 1344, 1344, 512]
    - [0, 11.862]
  - - [1472, 576, 1, 512, 1472, 1472, 1472, 512]
    - [2, 12.002]
  - - [1600, 576, 1, 512, 1600, 1600, 1600, 512]
    - [2, 12.104]
  - - [1728, 576, 1, 512, 1728, 1728, 1728, 512]
    - [2, 12.086]
  - - [1856, 576, 1, 512, 1856, 1856, 1856, 512]
    - [2, 11.983]
  - - [1984, 576, 1, 512, 1984, 1984, 1984, 512]
    - [2, 12.081]
  - - [2112, 576, 1, 512, 2112, 2112, 2112, 512]
    - [0, 12.122]
  - - [2240, 576, 1, 512, 2240, 2240, 2240, 512]
    - [2, 12.197]
  - - [2368, 576, 1, 512, 2368, 2368, 2368, 512]
    - [2, 12.179]
  - - [2496, 576, 1, 512, 2496, 2496, 2496, 512]
    - [2, 12.243]
  - - [2624, 576, 1, 512, 2624, 2624, 2624, 512]
    - [2, 12.335]
  - - [2752, 576, 1, 512, 2752, 2752, 2752, 512]
    - [2, 12.32]
  - - [2880, 576, 1, 512, 2880, 2880, 2880, 512]
    - [2, 12.401]
  - - [3008, 576, 1, 512, 3008, 3008, 3008, 512]
    - [2, 12.225]
  - - [3136, 576, 1, 512, 3136, 3136, 3136, 512]
    - [2, 12.492]
  - - [3264, 576, 1, 512, 3264, 3264, 3264, 512]
    - [2, 12.528]
  - - [3392, 576, 1, 512, 3392, 3392, 3392, 512]
    - [2, 12.431]
  - - [3520, 576, 1, 512, 3520, 3520, 3520, 512]
    - [2, 12.509]
  - - [3648, 576, 1, 512, 3648, 3648, 3648, 512]
    - [2, 12.58]
  - - [3776, 576, 1, 512, 3776, 3776, 3776, 512]
    - [2, 12.622]
  - - [3904, 576, 1, 512, 3904, 3904, 3904, 512]
    - [2, 12.666]
  - - [4032, 576, 1, 512, 4032, 4032, 4032, 512]
    - [2, 12.705]
  - - [64, 704, 1, 512, 64, 64, 64, 512]
    - [0, 4.72]
  - - [192, 704, 1, 512, 192, 192, 192, 512]
    - [0, 7.83]
  - - [320, 704, 1, 512, 320, 320, 320, 512]
    - [2, 9.385]
  - - [448, 704, 1, 512, 448, 448, 448, 512]
    - [2, 10.022]
  - - [576, 704, 1, 512, 576, 576, 576, 512]
    - [2, 10.733]
  - - [704, 704, 1, 512, 704, 704, 704, 512]
    - [2, 11.131]
  - - [832, 704, 1, 512, 832, 832, 832, 512]
    - [2, 11.754]
  - - [960, 704, 1, 512, 960, 960, 960, 512]
    - [0, 11.986]
  - - [1088, 704, 1, 512, 1088, 1088, 1088, 512]
    - [2, 11.788]
  - - [1216, 704, 1, 512, 1216, 1216, 1216, 512]
    - [2, 11.968]
  - - [1344, 704, 1, 512, 1344, 1344, 1344, 512]
    - [2, 11.889]
  - - [1472, 704, 1, 512, 1472, 1472, 1472, 512]
    - [2, 12.073]
  - - [1600, 704, 1, 512, 1600, 1600, 1600, 512]
    - [2, 12.002]
  - - [1728, 704, 1, 512, 1728, 1728, 1728, 512]
    - [2, 12.048]
  - - [1856, 704, 1, 512, 1856, 1856, 1856, 512]
    - [2, 12.098]
  - - [1984, 704, 1, 512, 1984, 1984, 1984, 512]
    - [2, 12.181]
  - - [2112, 704, 1, 512, 2112, 2112, 2112, 512]
    - [2, 12.327]
  - - [2240, 704, 1, 512, 2240, 2240, 2240, 512]
    - [2, 12.369]
  - - [2368, 704, 1, 512, 2368, 2368, 2368, 512]
    - [2, 12.458]
  - - [2496, 704, 1, 512, 2496, 2496, 2496, 512]
    - [2, 12.438]
  - - [2624, 704, 1, 512, 2624, 2624, 2624, 512]
    - [2, 12.499]
  - - [2752, 704, 1, 512, 2752, 2752, 2752, 512]
    - [2, 12.42]
  - - [2880, 704, 1, 512, 2880, 2880, 2880, 512]
    - [2, 12.583]
  - - [3008, 704, 1, 512, 3008, 3008, 3008, 512]
    - [2, 12.614]
  - - [3136, 704, 1, 512, 3136, 3136, 3136, 512]
    - [2, 12.574]
  - - [3264, 704, 1, 512, 3264, 3264, 3264, 512]
    - [2, 12.665]
  - - [3392, 704, 1, 512, 3392, 3392, 3392, 512]
    - [2, 12.712]
  - - [3520, 704, 1, 512, 3520, 3520, 3520, 512]
    - [2, 12.609]
  - - [3648, 704, 1, 512, 3648, 3648, 3648, 512]
    - [2, 12.755]
  - - [3776, 704, 1, 512, 3776, 3776, 3776, 512]
    - [2, 12.646]
  - - [3904, 704, 1, 512, 3904, 3904, 3904, 512]
    - [2, 12.781]
  - - [4032, 704, 1, 512, 4032, 4032, 4032, 512]
    - [2, 12.809]
  - - [64, 832, 1, 512, 64, 64, 64, 512]
    - [2, 4.492]
  - - [192, 832, 1, 512, 192, 192, 192, 512]
    - [2, 8.006]
  - - [320, 832, 1, 512, 320, 320, 320, 512]
    - [2, 9.669]
  - - [448, 832, 1, 512, 448, 448, 448, 512]
    - [2, 10.458]
  - - [576, 832, 1, 512, 576, 576, 576, 512]
    - [0, 11.219]
  - - [704, 832, 1, 512, 704, 704, 704, 512]
    - [0, 11.773]
  - - [832, 832, 1, 512, 832, 832, 832, 512]
    - [2, 11.9]
  - - [960, 832, 1, 512, 960, 960, 960, 512]
    - [2, 11.941]
  - - [1088, 832, 1, 512, 1088, 1088, 1088, 512]
    - [2, 11.957]
  - - [1216, 832, 1, 512, 1216, 1216, 1216, 512]
    - [2, 12.166]
  - - [1344, 832, 1, 512, 1344, 1344, 1344, 512]
    - [0, 11.988]
  - - [1472, 832, 1, 512, 1472, 1472, 1472, 512]
    - [0, 12.021]
  - - [1600, 832, 1, 512, 1600, 1600, 1600, 512]
    - [2, 12.169]
  - - [1728, 832, 1, 512, 1728, 1728, 1728, 512]
    - [2, 12.264]
  - - [1856, 832, 1, 512, 1856, 1856, 1856, 512]
    - [2, 12.29]
  - - [1984, 832, 1, 512, 1984, 1984, 1984, 512]
    - [2, 12.269]
  - - [2112, 832, 1, 512, 2112, 2112, 2112, 512]
    - [2, 12.378]
  - - [2240, 832, 1, 512, 2240, 2240, 2240, 512]
    - [2, 12.518]
  - - [2368, 832, 1, 512, 2368, 2368, 2368, 512]
    - [2, 12.699]
  - - [2496, 832, 1, 512, 2496, 2496, 2496, 512]
    - [2, 12.525]
  - - [2624, 832, 1, 512, 2624, 2624, 2624, 512]
    - [2, 12.701]
  - - [2752, 832, 1, 512, 2752, 2752, 2752, 512]
    - [2, 12.775]
  - - [2880, 832, 1, 512, 2880, 2880, 2880, 512]
    - [2, 12.594]
  - - [3008, 832, 1, 512, 3008, 3008, 3008, 512]
    - [2, 12.774]
  - - [3136, 832, 1, 512, 3136, 3136, 3136, 512]
    - [2, 12.768]
  - - [3264, 832, 1, 512, 3264, 3264, 3264, 512]
    - [2, 12.823]
  - - [3392, 832, 1, 512, 3392, 3392, 3392, 512]
    - [2, 12.779]
  - - [3520, 832, 1, 512, 3520, 3520, 3520, 512]
    - [2, 12.753]
  - - [3648, 832, 1, 512, 3648, 3648, 3648, 512]
    - [2, 12.842]
  - - [3776, 832, 1, 512, 3776, 3776, 3776, 512]
    - [2, 12.875]
  - - [3904, 832, 1, 512, 3904, 3904, 3904, 512]
    - [2, 12.904]
  - - [4032, 832, 1, 512, 4032, 4032, 4032, 512]
    - [2, 12.862]
  - - [64, 960, 1, 512, 64, 64, 64, 512]
    - [2, 5.172]
  - - [192, 960, 1, 512, 192, 192, 192, 512]
    - [0, 8.723]
  - - [320, 960, 1, 512, 320, 320, 320, 512]
    - [2, 10.005]
  - - [448, 960, 1, 512, 448, 448, 448, 512]
    - [0, 10.928]
  - - [576, 960, 1, 512, 576, 576, 576, 512]
    - [2, 11.579]
  - - [704, 960, 1, 512, 704, 704, 704, 512]
    - [0, 11.903]
  - - [832, 960, 1, 512, 832, 832, 832, 512]
    - [2, 12.047]
  - - [960, 960, 1, 512, 960, 960, 960, 512]
    - [2, 11.924]
  - - [1088, 960, 1, 512, 1088, 1088, 1088, 512]
    - [2, 12.128]
  - - [1216, 960, 1, 512, 1216, 1216, 1216, 512]
    - [2, 12.189]
  - - [1344, 960, 1, 512, 1344, 1344, 1344, 512]
    - [2, 12.161]
  - - [1472, 960, 1, 512, 1472, 1472, 1472, 512]
    - [0, 12.162]
  - - [1600, 960, 1, 512, 1600, 1600, 1600, 512]
    - [2, 12.279]
  - - [1728, 960, 1, 512, 1728, 1728, 1728, 512]
    - [2, 12.347]
  - - [1856, 960, 1, 512, 1856, 1856, 1856, 512]
    - [2, 12.64]
  - - [1984, 960, 1, 512, 1984, 1984, 1984, 512]
    - [2, 12.533]
  - - [2112, 960, 1, 512, 2112, 2112, 2112, 512]
    - [2, 12.655]
  - - [2240, 960, 1, 512, 2240, 2240, 2240, 512]
    - [0, 12.473]
  - - [2368, 960, 1, 512, 2368, 2368, 2368, 512]
    - [2, 12.754]
  - - [2496, 960, 1, 512, 2496, 2496, 2496, 512]
    - [2, 12.623]
  - - [2624, 960, 1, 512, 2624, 2624, 2624, 512]
    - [2, 12.799]
  - - [2752, 960, 1, 512, 2752, 2752, 2752, 512]
    - [2, 12.706]
  - - [2880, 960, 1, 512, 2880, 2880, 2880, 512]
    - [2, 12.848]
  - - [3008, 960, 1, 512, 3008, 3008, 3008, 512]
    - [2, 12.856]
  - - [3136, 960, 1, 512, 3136, 3136, 3136, 512]
    - [2, 12.883]
  - - [3264, 960, 1, 512, 3264, 3264, 3264, 512]
    - [2, 12.742]
  - - [3392, 960, 1, 512, 3392, 3392, 3392, 512]
    - [2, 12.923]
  - - [3520, 960, 1, 512, 3520, 3520, 3520, 512]
    - [2, 12.837]
  - - [3648, 960, 1, 512, 3648, 3648, 3648, 512]
    - [2, 12.93]
  - - [3776, 960, 1, 512, 3776, 3776, 3776, 512]
    - [2, 12.958]
  - - [3904, 960, 1, 512, 3904, 3904, 3904, 512]
    - [2, 12.962]
  - - [4032, 960, 1, 512, 4032, 4032, 4032, 512]
    - [2, 12.958]
  - - [64, 1088, 1, 512, 64, 64, 64, 512]
    - [2, 5.942]
  - - [192, 1088, 1, 512, 192, 192, 192, 512]
    - [2, 8.811]
  - - [320, 1088, 1, 512, 320, 320, 320, 512]
    - [2, 10.29]
  - - [448, 1088, 1, 512, 448, 448, 448, 512]
    - [0, 11.324]
  - - [576, 1088, 1, 512, 576, 576, 576, 512]
    - [0, 11.818]
  - - [704, 1088, 1, 512, 704, 704, 704, 512]
    - [2, 12.032]
  - - [832, 1088, 1, 512, 832, 832, 832, 512]
    - [2, 12.062]
  - - [960, 1088, 1, 512, 960, 960, 960, 512]
    - [2, 12.07]
  - - [1088, 1088, 1, 512, 1088, 1088, 1088, 512]
    - [2, 12.037]
  - - [1216, 1088, 1, 512, 1216, 1216, 1216, 512]
    - [2, 12.193]
  - - [1344, 1088, 1, 512, 1344, 1344, 1344, 512]
    - [2, 12.277]
  - - [1472, 1088, 1, 512, 1472, 1472, 1472, 512]
    - [2, 12.202]
  - - [1600, 1088, 1, 512, 1600, 1600, 1600, 512]
    - [2, 12.29]
  - - [1728, 1088, 1, 512, 1728, 1728, 1728, 512]
    - [2, 12.476]
  - - [1856, 1088, 1, 512, 1856, 1856, 1856, 512]
    - [2, 12.48]
  - - [1984, 1088, 1, 512, 1984, 1984, 1984, 512]
    - [2, 12.538]
  - - [2112, 1088, 1, 512, 2112, 2112, 2112, 512]
    - [2, 12.613]
  - - [2240, 1088, 1, 512, 2240, 2240, 2240, 512]
    - [2, 12.798]
  - - [2368, 1088, 1, 512, 2368, 2368, 2368, 512]
    - [2, 12.789]
  - - [2496, 1088, 1, 512, 2496, 2496, 2496, 512]
    - [2, 12.835]
  - - [2624, 1088, 1, 512, 2624, 2624, 2624, 512]
    - [2, 12.716]
  - - [2752, 1088, 1, 512, 2752, 2752, 2752, 512]
    - [2, 12.867]
  - - [2880, 1088, 1, 512, 2880, 2880, 2880, 512]
    - [2, 12.89]
  - - [3008, 1088, 1, 512, 3008, 3008, 3008, 512]
    - [2, 12.847]
  - - [3136, 1088, 1, 512, 3136, 3136, 3136, 512]
    - [2, 12.842]
  - - [3264, 1088, 1, 512, 3264, 3264, 3264, 512]
    - [2, 12.916]
  - - [3392, 1088, 1, 512, 3392, 3392, 3392, 512]
    - [2, 12.897]
  - - [3520, 1088, 1, 512, 3520, 3520, 3520, 512]
    - [2, 13.022]
  - - [3648, 1088, 1, 512, 3648, 3648, 3648, 512]
    - [2, 13.073]
  - - [3776, 1088, 1, 512, 3776, 3776, 3776, 512]
    - [2, 13.04]
  - - [3904, 1088, 1, 512, 3904, 3904, 3904, 512]
    - [2, 13.13]
  - - [4032, 1088, 1, 512, 4032, 4032, 4032, 512]
    - [2, 13.142]
  - - [64, 1216, 1, 512, 64, 64, 64, 512]
    - [0, 5.934]
  - - [192, 1216, 1, 512, 192, 192, 192, 512]
    - [0, 9.592]
  - - [320, 1216, 1, 512, 320, 320, 320, 512]
    - [0, 10.892]
  - - [448, 1216, 1, 512, 448, 448, 448, 512]
    - [2, 11.723]
  - - [576, 1216, 1, 512, 576, 576, 576, 512]
    - [2, 12.01]
  - - [704, 1216, 1, 512, 704, 704, 704, 512]
    - [2, 12.062]
  - - [832, 1216, 1, 512, 832, 832, 832, 512]
    - [0, 12.012]
  - - [960, 1216, 1, 512, 960, 960, 960, 512]
    - [0, 12.074]
  - - [1088, 1216, 1, 512, 1088, 1088, 1088, 512]
    - [2, 12.253]
  - - [1216, 1216, 1, 512, 1216, 1216, 1216, 512]
    - [2, 12.499]
  - - [1344, 1216, 1, 512, 1344, 1344, 1344, 512]
    - [2, 12.48]
  - - [1472, 1216, 1, 512, 1472, 1472, 1472, 512]
    - [2, 12.509]
  - - [1600, 1216, 1, 512, 1600, 1600, 1600, 512]
    - [2, 12.538]
  - - [1728, 1216, 1, 512, 1728, 1728, 1728, 512]
    - [2, 12.526]
  - - [1856, 1216, 1, 512, 1856, 1856, 1856, 512]
    - [2, 12.701]
  - - [1984, 1216, 1, 512, 1984, 1984, 1984, 512]
    - [2, 12.742]
  - - [2112, 1216, 1, 512, 2112, 2112, 2112, 512]
    - [2, 12.669]
  - - [2240, 1216, 1, 512, 2240, 2240, 2240, 512]
    - [2, 12.827]
  - - [2368, 1216, 1, 512, 2368, 2368, 2368, 512]
    - [2, 12.753]
  - - [2496, 1216, 1, 512, 2496, 2496, 2496, 512]
    - [2, 12.775]
  - - [2624, 1216, 1, 512, 2624, 2624, 2624, 512]
    - [2, 12.812]
  - - [2752, 1216, 1, 512, 2752, 2752, 2752, 512]
    - [2, 13.086]
  - - [2880, 1216, 1, 512, 2880, 2880, 2880, 512]
    - [2, 12.866]
  - - [3008, 1216, 1, 512, 3008, 3008, 3008, 512]
    - [2, 12.905]
  - - [3136, 1216, 1, 512, 3136, 3136, 3136, 512]
    - [2, 13.026]
  - - [3264, 1216, 1, 512, 3264, 3264, 3264, 512]
    - [2, 13.048]
  - - [3392, 1216, 1, 512, 3392, 3392, 3392, 512]
    - [2, 12.95]
  - - [3520, 1216, 1, 512, 3520, 3520, 3520, 512]
    - [2, 13.1]
  - - [3648, 1216, 1, 512, 3648, 3648, 3648, 512]
    - [2, 13.063]
  - - [3776, 1216, 1, 512, 3776, 3776, 3776, 512]
    - [2, 13.06]
  - - [3904, 1216, 1, 512, 3904, 3904, 3904, 512]
    - [2, 13.195]
  - - [4032, 1216, 1, 512, 4032, 4032, 4032, 512]
    - [2, 13.093]
  - - [64, 1344, 1, 512, 64, 64, 64, 512]
    - [0, 6.465]
  - - [192, 1344, 1, 512, 192, 192, 192, 512]
    - [2, 9.855]
  - - [320, 1344, 1, 512, 320, 320, 320, 512]
    - [0, 10.978]
  - - [448, 1344, 1, 512, 448, 448, 448, 512]
    - [2, 11.94]
  - - [576, 1344, 1, 512, 576, 576, 576, 512]
    - [2, 12.075]
  - - [704, 1344, 1, 512, 704, 704, 704, 512]
    - [2, 12.217]
  - - [832, 1344, 1, 512, 832, 832, 832, 512]
    - [0, 12.132]
  - - [960, 1344, 1, 512, 960, 960, 960, 512]
    - [2, 12.131]
  - - [1088, 1344, 1, 512, 1088, 1088, 1088, 512]
    - [2, 12.325]
  - - [1216, 1344, 1, 512, 1216, 1216, 1216, 512]
    - [2, 12.702]
  - - [1344, 1344, 1, 512, 1344, 1344, 1344, 512]
    - [2, 12.486]
  - - [1472, 1344, 1, 512, 1472, 1472, 1472, 512]
    - [2, 12.486]
  - - [1600, 1344, 1, 512, 1600, 1600, 1600, 512]
    - [2, 12.61]
  - - [1728, 1344, 1, 512, 1728, 1728, 1728, 512]
    - [2, 12.644]
  - - [1856, 1344, 1, 512, 1856, 1856, 1856, 512]
    - [2, 12.701]
  - - [1984, 1344, 1, 512, 1984, 1984, 1984, 512]
    - [2, 12.7]
  - - [2112, 1344, 1, 512, 2112, 2112, 2112, 512]
    - [2, 12.724]
  - - [2240, 1344, 1, 512, 2240, 2240, 2240, 512]
    - [2, 12.82]
  - - [2368, 1344, 1, 512, 2368, 2368, 2368, 512]
    - [2, 12.966]
  - - [2496, 1344, 1, 512, 2496, 2496, 2496, 512]
    - [2, 12.909]
  - - [2624, 1344, 1, 512, 2624, 2624, 2624, 512]
    - [2, 12.933]
  - - [2752, 1344, 1, 512, 2752, 2752, 2752, 512]
    - [2, 12.919]
  - - [2880, 1344, 1, 512, 2880, 2880, 2880, 512]
    - [2, 12.994]
  - - [3008, 1344, 1, 512, 3008, 3008, 3008, 512]
    - [2, 13.005]
  - - [3136, 1344, 1, 512, 3136, 3136, 3136, 512]
    - [2, 12.979]
  - - [3264, 1344, 1, 512, 3264, 3264, 3264, 512]
    - [2, 13.004]
  - - [3392, 1344, 1, 512, 3392, 3392, 3392, 512]
    - [2, 13.171]
  - - [3520, 1344, 1, 512, 3520, 3520, 3520, 512]
    - [2, 13.176]
  - - [3648, 1344, 1, 512, 3648, 3648, 3648, 512]
    - [2, 13.103]
  - - [3776, 1344, 1, 512, 3776, 3776, 3776, 512]
    - [2, 13.174]
  - - [3904, 1344, 1, 512, 3904, 3904, 3904, 512]
    - [2, 13.097]
  - - [4032, 1344, 1, 512, 4032, 4032, 4032, 512]
    - [2, 13.24]
  - - [64, 1472, 1, 512, 64, 64, 64, 512]
    - [0, 7.035]
  - - [192, 1472, 1, 512, 192, 192, 192, 512]
    - [0, 10.003]
  - - [320, 1472, 1, 512, 320, 320, 320, 512]
    - [2, 10.943]
  - - [448, 1472, 1, 512, 448, 448, 448, 512]
    - [2, 11.697]
  - - [576, 1472, 1, 512, 576, 576, 576, 512]
    - [2, 12.017]
  - - [704, 1472, 1, 512, 704, 704, 704, 512]
    - [2, 12.214]
  - - [832, 1472, 1, 512, 832, 832, 832, 512]
    - [0, 12.228]
  - - [960, 1472, 1, 512, 960, 960, 960, 512]
    - [2, 12.504]
  - - [1088, 1472, 1, 512, 1088, 1088, 1088, 512]
    - [2, 12.43]
  - - [1216, 1472, 1, 512, 1216, 1216, 1216, 512]
    - [2, 12.507]
  - - [1344, 1472, 1, 512, 1344, 1344, 1344, 512]
    - [2, 12.593]
  - - [1472, 1472, 1, 512, 1472, 1472, 1472, 512]
    - [2, 12.608]
  - - [1600, 1472, 1, 512, 1600, 1600, 1600, 512]
    - [2, 12.591]
  - - [1728, 1472, 1, 512, 1728, 1728, 1728, 512]
    - [2, 12.762]
  - - [1856, 1472, 1, 512, 1856, 1856, 1856, 512]
    - [2, 12.81]
  - - [1984, 1472, 1, 512, 1984, 1984, 1984, 512]
    - [2, 12.698]
  - - [2112, 1472, 1, 512, 2112, 2112, 2112, 512]
    - [2, 12.914]
  - - [2240, 1472, 1, 512, 2240, 2240, 2240, 512]
    - [2, 12.914]
  - - [2368, 1472, 1, 512, 2368, 2368, 2368, 512]
    - [2, 13.043]
  - - [2496, 1472, 1, 512, 2496, 2496, 2496, 512]
    - [2, 12.939]
  - - [2624, 1472, 1, 512, 2624, 2624, 2624, 512]
    - [2, 12.982]
  - - [2752, 1472, 1, 512, 2752, 2752, 2752, 512]
    - [2, 13.05]
  - - [2880, 1472, 1, 512, 2880, 2880, 2880, 512]
    - [2, 13.01]
  - - [3008, 1472, 1, 512, 3008, 3008, 3008, 512]
    - [2, 13.045]
  - - [3136, 1472, 1, 512, 3136, 3136, 3136, 512]
    - [2, 13.074]
  - - [3264, 1472, 1, 512, 3264, 3264, 3264, 512]
    - [2, 13.089]
  - - [3392, 1472, 1, 512, 3392, 3392, 3392, 512]
    - [2, 13.114]
  - - [3520, 1472, 1, 512, 3520, 3520, 3520, 512]
    - [2, 13.13]
  - - [3648, 1472, 1, 512, 3648, 3648, 3648, 512]
    - [2, 13.126]
  - - [3776, 1472, 1, 512, 3776, 3776, 3776, 512]
    - [2, 13.187]
  - - [3904, 1472, 1, 512, 3904, 3904, 3904, 512]
    - [2, 13.153]
  - - [4032, 1472, 1, 512, 4032, 4032, 4032, 512]
    - [2, 13.26]
  - - [64, 1600, 1, 512, 64, 64, 64, 512]
    - [2, 6.346]
  - - [192, 1600, 1, 512, 192, 192, 192, 512]
    - [2, 10.083]
  - - [320, 1600, 1, 512, 320, 320, 320, 512]
    - [2, 11.387]
  - - [448, 1600, 1, 512, 448, 448, 448, 512]
    - [0, 11.852]
  - - [576, 1600, 1, 512, 576, 576, 576, 512]
    - [0, 12.083]
  - - [704, 1600, 1, 512, 704, 704, 704, 512]
    - [0, 12.194]
  - - [832, 1600, 1, 512, 832, 832, 832, 512]
    - [2, 12.149]
  - - [960, 1600, 1, 512, 960, 960, 960, 512]
    - [2, 12.407]
  - - [1088, 1600, 1, 512, 1088, 1088, 1088, 512]
    - [2, 12.289]
  - - [1216, 1600, 1, 512, 1216, 1216, 1216, 512]
    - [2, 12.514]
  - - [1344, 1600, 1, 512, 1344, 1344, 1344, 512]
    - [2, 12.488]
  - - [1472, 1600, 1, 512, 1472, 1472, 1472, 512]
    - [2, 12.735]
  - - [1600, 1600, 1, 512, 1600, 1600, 1600, 512]
    - [2, 12.555]
  - - [1728, 1600, 1, 512, 1728, 1728, 1728, 512]
    - [2, 12.726]
  - - [1856, 1600, 1, 512, 1856, 1856, 1856, 512]
    - [2, 12.812]
  - - [1984, 1600, 1, 512, 1984, 1984, 1984, 512]
    - [2, 12.889]
  - - [2112, 1600, 1, 512, 2112, 2112, 2112, 512]
    - [2, 12.9]
  - - [2240, 1600, 1, 512, 2240, 2240, 2240, 512]
    - [2, 12.943]
  - - [2368, 1600, 1, 512, 2368, 2368, 2368, 512]
    - [2, 12.947]
  - - [2496, 1600, 1, 512, 2496, 2496, 2496, 512]
    - [2, 12.978]
  - - [2624, 1600, 1, 512, 2624, 2624, 2624, 512]
    - [2, 13.016]
  - - [2752, 1600, 1, 512, 2752, 2752, 2752, 512]
    - [2, 13.07]
  - - [2880, 1600, 1, 512, 2880, 2880, 2880, 512]
    - [2, 13.064]
  - - [3008, 1600, 1, 512, 3008, 3008, 3008, 512]
    - [2, 13.045]
  - - [3136, 1600, 1, 512, 3136, 3136, 3136, 512]
    - [2, 13.172]
  - - [3264, 1600, 1, 512, 3264, 3264, 3264, 512]
    - [2, 13.092]
  - - [3392, 1600, 1, 512, 3392, 3392, 3392, 512]
    - [2, 13.201]
  - - [3520, 1600, 1, 512, 3520, 3520, 3520, 512]
    - [2, 13.204]
  - - [3648, 1600, 1, 512, 3648, 3648, 3648, 512]
    - [2, 13.181]
  - - [3776, 1600, 1, 512, 3776, 3776, 3776, 512]
    - [2, 13.244]
  - - [3904, 1600, 1, 512, 3904, 3904, 3904, 512]
    - [2, 13.258]
  - - [4032, 1600, 1, 512, 4032, 4032, 4032, 512]
    - [2, 13.196]
  - - [64, 1728, 1, 512, 64, 64, 64, 512]
    - [2, 6.821]
  - - [192, 1728, 1, 512, 192, 192, 192, 512]
    - [0, 10.317]
  - - [320, 1728, 1, 512, 320, 320, 320, 512]
    - [2, 11.637]
  - - [448, 1728, 1, 512, 448, 448, 448, 512]
    - [2, 11.929]
  - - [576, 1728, 1, 512, 576, 576, 576, 512]
    - [2, 11.953]
  - - [704, 1728, 1, 512, 704, 704, 704, 512]
    - [2, 12.136]
  - - [832, 1728, 1, 512, 832, 832, 832, 512]
    - [2, 12.306]
  - - [960, 1728, 1, 512, 960, 960, 960, 512]
    - [2, 12.411]
  - - [1088, 1728, 1, 512, 1088, 1088, 1088, 512]
    - [2, 12.473]
  - - [1216, 1728, 1, 512, 1216, 1216, 1216, 512]
    - [2, 12.508]
  - - [1344, 1728, 1, 512, 1344, 1344, 1344, 512]
    - [2, 12.716]
  - - [1472, 1728, 1, 512, 1472, 1472, 1472, 512]
    - [2, 12.693]
  - - [1600, 1728, 1, 512, 1600, 1600, 1600, 512]
    - [2, 12.788]
  - - [1728, 1728, 1, 512, 1728, 1728, 1728, 512]
    - [2, 12.808]
  - - [1856, 1728, 1, 512, 1856, 1856, 1856, 512]
    - [2, 12.717]
  - - [1984, 1728, 1, 512, 1984, 1984, 1984, 512]
    - [2, 12.994]
  - - [2112, 1728, 1, 512, 2112, 2112, 2112, 512]
    - [2, 12.964]
  - - [2240, 1728, 1, 512, 2240, 2240, 2240, 512]
    - [2, 12.926]
  - - [2368, 1728, 1, 512, 2368, 2368, 2368, 512]
    - [2, 13.023]
  - - [2496, 1728, 1, 512, 2496, 2496, 2496, 512]
    - [2, 13.022]
  - - [2624, 1728, 1, 512, 2624, 2624, 2624, 512]
    - [2, 13.111]
  - - [2752, 1728, 1, 512, 2752, 2752, 2752, 512]
    - [2, 13.07]
  - - [2880, 1728, 1, 512, 2880, 2880, 2880, 512]
    - [2, 13.063]
  - - [3008, 1728, 1, 512, 3008, 3008, 3008, 512]
    - [2, 13.063]
  - - [3136, 1728, 1, 512, 3136, 3136, 3136, 512]
    - [2, 13.173]
  - - [3264, 1728, 1, 512, 3264, 3264, 3264, 512]
    - [2, 13.194]
  - - [3392, 1728, 1, 512, 3392, 3392, 3392, 512]
    - [2, 13.191]
  - - [3520, 1728, 1, 512, 3520, 3520, 3520, 512]
    - [2, 13.246]
  - - [3648, 1728, 1, 512, 3648, 3648, 3648, 512]
    - [2, 13.245]
  - - [3776, 1728, 1, 512, 3776, 3776, 3776, 512]
    - [2, 13.183]
  - - [3904, 1728, 1, 512, 3904, 3904, 3904, 512]
    - [2, 13.214]
  - - [4032, 1728, 1, 512, 4032, 4032, 4032, 512]
    - [2, 13.241]
  - - [64, 1856, 1, 512, 64, 64, 64, 512]
    - [2, 7.419]
  - - [192, 1856, 1, 512, 192, 192, 192, 512]
    - [2, 10.375]
  - - [320, 1856, 1, 512, 320, 320, 320, 512]
    - [2, 11.536]
  - - [448, 1856, 1, 512, 448, 448, 448, 512]
    - [0, 12.119]
  - - [576, 1856, 1, 512, 576, 576, 576, 512]
    - [2, 12.146]
  - - [704, 1856, 1, 512, 704, 704, 704, 512]
    - [2, 12.093]
  - - [832, 1856, 1, 512, 832, 832, 832, 512]
    - [2, 12.27]
  - - [960, 1856, 1, 512, 960, 960, 960, 512]
    - [2, 12.368]
  - - [1088, 1856, 1, 512, 1088, 1088, 1088, 512]
    - [2, 12.532]
  - - [1216, 1856, 1, 512, 1216, 1216, 1216, 512]
    - [2, 12.826]
  - - [1344, 1856, 1, 512, 1344, 1344, 1344, 512]
    - [2, 12.596]
  - - [1472, 1856, 1, 512, 1472, 1472, 1472, 512]
    - [2, 12.811]
  - - [1600, 1856, 1, 512, 1600, 1600, 1600, 512]
    - [2, 12.815]
  - - [1728, 1856, 1, 512, 1728, 1728, 1728, 512]
    - [2, 12.869]
  - - [1856, 1856, 1, 512, 1856, 1856, 1856, 512]
    - [2, 12.806]
  - - [1984, 1856, 1, 512, 1984, 1984, 1984, 512]
    - [2, 12.957]
  - - [2112, 1856, 1, 512, 2112, 2112, 2112, 512]
    - [2, 12.929]
  - - [2240, 1856, 1, 512, 2240, 2240, 2240, 512]
    - [2, 13.046]
  - - [2368, 1856, 1, 512, 2368, 2368, 2368, 512]
    - [2, 13.042]
  - - [2496, 1856, 1, 512, 2496, 2496, 2496, 512]
    - [2, 13.065]
  - - [2624, 1856, 1, 512, 2624, 2624, 2624, 512]
    - [2, 13.038]
  - - [2752, 1856, 1, 512, 2752, 2752, 2752, 512]
    - [2, 13.111]
  - - [2880, 1856, 1, 512, 2880, 2880, 2880, 512]
    - [2, 13.105]
  - - [3008, 1856, 1, 512, 3008, 3008, 3008, 512]
    - [2, 13.154]
  - - [3136, 1856, 1, 512, 3136, 3136, 3136, 512]
    - [2, 13.205]
  - - [3264, 1856, 1, 512, 3264, 3264, 3264, 512]
    - [2, 13.205]
  - - [3392, 1856, 1, 512, 3392, 3392, 3392, 512]
    - [2, 13.22]
  - - [3520, 1856, 1, 512, 3520, 3520, 3520, 512]
    - [2, 13.199]
  - - [3648, 1856, 1, 512, 3648, 3648, 3648, 512]
    - [2, 13.285]
  - - [3776, 1856, 1, 512, 3776, 3776, 3776, 512]
    - [2, 13.272]
  - - [3904, 1856, 1, 512, 3904, 3904, 3904, 512]
    - [2, 13.248]
  - - [4032, 1856, 1, 512, 4032, 4032, 4032, 512]
    - [2, 13.356]
  - - [64, 1984, 1, 512, 64, 64, 64, 512]
    - [0, 7.29]
  - - [192, 1984, 1, 512, 192, 192, 192, 512]
    - [0, 10.622]
  - - [320, 1984, 1, 512, 320, 320, 320, 512]
    - [0, 11.892]
  - - [448, 1984, 1, 512, 448, 448, 448, 512]
    - [0, 11.949]
  - - [576, 1984, 1, 512, 576, 576, 576, 512]
    - [2, 12.263]
  - - [704, 1984, 1, 512, 704, 704, 704, 512]
    - [2, 12.35]
  - - [832, 1984, 1, 512, 832, 832, 832, 512]
    - [2, 12.417]
  - - [960, 1984, 1, 512, 960, 960, 960, 512]
    - [2, 12.546]
  - - [1088, 1984, 1, 512, 1088, 1088, 1088, 512]
    - [2, 12.681]
  - - [1216, 1984, 1, 512, 1216, 1216, 1216, 512]
    - [2, 12.622]
  - - [1344, 1984, 1, 512, 1344, 1344, 1344, 512]
    - [2, 12.747]
  - - [1472, 1984, 1, 512, 1472, 1472, 1472, 512]
    - [2, 12.783]
  - - [1600, 1984, 1, 512, 1600, 1600, 1600, 512]
    - [2, 12.899]
  - - [1728, 1984, 1, 512, 1728, 1728, 1728, 512]
    - [2, 12.97]
  - - [1856, 1984, 1, 512, 1856, 1856, 1856, 512]
    - [2, 12.946]
  - - [1984, 1984, 1, 512, 1984, 1984, 1984, 512]
    - [2, 13.005]
  - - [2112, 1984, 1, 512, 2112, 2112, 2112, 512]
    - [2, 13.075]
  - - [2240, 1984, 1, 512, 2240, 2240, 2240, 512]
    - [2, 12.851]
  - - [2368, 1984, 1, 512, 2368, 2368, 2368, 512]
    - [2, 13.125]
  - - [2496, 1984, 1, 512, 2496, 2496, 2496, 512]
    - [2, 13.146]
  - - [2624, 1984, 1, 512, 2624, 2624, 2624, 512]
    - [2, 13.108]
  - - [2752, 1984, 1, 512, 2752, 2752, 2752, 512]
    - [2, 13.2]
  - - [2880, 1984, 1, 512, 2880, 2880, 2880, 512]
    - [2, 13.151]
  - - [3008, 1984, 1, 512, 3008, 3008, 3008, 512]
    - [2, 13.183]
  - - [3136, 1984, 1, 512, 3136, 3136, 3136, 512]
    - [2, 13.226]
  - - [3264, 1984, 1, 512, 3264, 3264, 3264, 512]
    - [2, 13.139]
  - - [3392, 1984, 1, 512, 3392, 3392, 3392, 512]
    - [2, 13.24]
  - - [3520, 1984, 1, 512, 3520, 3520, 3520, 512]
    - [2, 13.284]
  - - [3648, 1984, 1, 512, 3648, 3648, 3648, 512]
    - [2, 13.236]
  - - [3776, 1984, 1, 512, 3776, 3776, 3776, 512]
    - [2, 13.262]
  - - [3904, 1984, 1, 512, 3904, 3904, 3904, 512]
    - [2, 13.334]
  - - [4032, 1984, 1, 512, 4032, 4032, 4032, 512]
    - [2, 13.356]
  - - [64, 2112, 1, 512, 64, 64, 64, 512]
    - [0, 7.816]
  - - [192, 2112, 1, 512, 192, 192, 192, 512]
    - [2, 10.636]
  - - [320, 2112, 1, 512, 320, 320, 320, 512]
    - [2, 11.882]
  - - [448, 2112, 1, 512, 448, 448, 448, 512]
    - [2, 12.013]
  - - [576, 2112, 1, 512, 576, 576, 576, 512]
    - [2, 12.157]
  - - [704, 2112, 1, 512, 704, 704, 704, 512]
    - [2, 12.455]
  - - [832, 2112, 1, 512, 832, 832, 832, 512]
    - [2, 12.447]
  - - [960, 2112, 1, 512, 960, 960, 960, 512]
    - [2, 12.64]
  - - [1088, 2112, 1, 512, 1088, 1088, 1088, 512]
    - [2, 12.78]
  - - [1216, 2112, 1, 512, 1216, 1216, 1216, 512]
    - [2, 12.764]
  - - [1344, 2112, 1, 512, 1344, 1344, 1344, 512]
    - [2, 12.753]
  - - [1472, 2112, 1, 512, 1472, 1472, 1472, 512]
    - [2, 12.71]
  - - [1600, 2112, 1, 512, 1600, 1600, 1600, 512]
    - [2, 12.838]
  - - [1728, 2112, 1, 512, 1728, 1728, 1728, 512]
    - [2, 12.993]
  - - [1856, 2112, 1, 512, 1856, 1856, 1856, 512]
    - [2, 13.003]
  - - [1984, 2112, 1, 512, 1984, 1984, 1984, 512]
    - [2, 13.052]
  - - [2112, 2112, 1, 512, 2112, 2112, 2112, 512]
    - [2, 13.056]
  - - [2240, 2112, 1, 512, 2240, 2240, 2240, 512]
    - [2, 13.153]
  - - [2368, 2112, 1, 512, 2368, 2368, 2368, 512]
    - [2, 13.173]
  - - [2496, 2112, 1, 512, 2496, 2496, 2496, 512]
    - [2, 13.148]
  - - [2624, 2112, 1, 512, 2624, 2624, 2624, 512]
    - [2, 13.16]
  - - [2752, 2112, 1, 512, 2752, 2752, 2752, 512]
    - [2, 13.225]
  - - [2880, 2112, 1, 512, 2880, 2880, 2880, 512]
    - [2, 13.188]
  - - [3008, 2112, 1, 512, 3008, 3008, 3008, 512]
    - [2, 13.19]
  - - [3136, 2112, 1, 512, 3136, 3136, 3136, 512]
    - [2, 13.173]
  - - [3264, 2112, 1, 512, 3264, 3264, 3264, 512]
    - [2, 13.25]
  - - [3392, 2112, 1, 512, 3392, 3392, 3392, 512]
    - [2, 13.314]
  - - [3520, 2112, 1, 512, 3520, 3520, 3520, 512]
    - [2, 13.307]
  - - [3648, 2112, 1, 512, 3648, 3648, 3648, 512]
    - [2, 13.283]
  - - [3776, 2112, 1, 512, 3776, 3776, 3776, 512]
    - [2, 13.347]
  - - [3904, 2112, 1, 512, 3904, 3904, 3904, 512]
    - [2, 13.324]
  - - [4032, 2112, 1, 512, 4032, 4032, 4032, 512]
    - [2, 13.344]
  - - [64, 2240, 1, 512, 64, 64, 64, 512]
    - [0, 8.197]
  - - [192, 2240, 1, 512, 192, 192, 192, 512]
    - [2, 11.066]
  - - [320, 2240, 1, 512, 320, 320, 320, 512]
    - [2, 11.776]
  - - [448, 2240, 1, 512, 448, 448, 448, 512]
    - [2, 12.185]
  - - [576, 2240, 1, 512, 576, 576, 576, 512]
    - [2, 12.466]
  - - [704, 2240, 1, 512, 704, 704, 704, 512]
    - [2, 12.45]
  - - [832, 2240, 1, 512, 832, 832, 832, 512]
    - [2, 12.324]
  - - [960, 2240, 1, 512, 960, 960, 960, 512]
    - [2, 12.652]
  - - [1088, 2240, 1, 512, 1088, 1088, 1088, 512]
    - [2, 12.772]
  - - [1216, 2240, 1, 512, 1216, 1216, 1216, 512]
    - [2, 12.932]
  - - [1344, 2240, 1, 512, 1344, 1344, 1344, 512]
    - [2, 12.791]
  - - [1472, 2240, 1, 512, 1472, 1472, 1472, 512]
    - [2, 12.88]
  - - [1600, 2240, 1, 512, 1600, 1600, 1600, 512]
    - [2, 12.931]
  - - [1728, 2240, 1, 512, 1728, 1728, 1728, 512]
    - [2, 12.944]
  - - [1856, 2240, 1, 512, 1856, 1856, 1856, 512]
    - [2, 12.957]
  - - [1984, 2240, 1, 512, 1984, 1984, 1984, 512]
    - [2, 13.083]
  - - [2112, 2240, 1, 512, 2112, 2112, 2112, 512]
    - [2, 13.069]
  - - [2240, 2240, 1, 512, 2240, 2240, 2240, 512]
    - [2, 13.154]
  - - [2368, 2240, 1, 512, 2368, 2368, 2368, 512]
    - [2, 13.135]
  - - [2496, 2240, 1, 512, 2496, 2496, 2496, 512]
    - [2, 13.225]
  - - [2624, 2240, 1, 512, 2624, 2624, 2624, 512]
    - [2, 13.167]
  - - [2752, 2240, 1, 512, 2752, 2752, 2752, 512]
    - [2, 13.192]
  - - [2880, 2240, 1, 512, 2880, 2880, 2880, 512]
    - [2, 13.192]
  - - [3008, 2240, 1, 512, 3008, 3008, 3008, 512]
    - [2, 13.202]
  - - [3136, 2240, 1, 512, 3136, 3136, 3136, 512]
    - [2, 13.261]
  - - [3264, 2240, 1, 512, 3264, 3264, 3264, 512]
    - [2, 13.199]
  - - [3392, 2240, 1, 512, 3392, 3392, 3392, 512]
    - [2, 13.264]
  - - [3520, 2240, 1, 512, 3520, 3520, 3520, 512]
    - [2, 13.24]
  - - [3648, 2240, 1, 512, 3648, 3648, 3648, 512]
    - [2, 13.305]
  - - [3776, 2240, 1, 512, 3776, 3776, 3776, 512]
    - [2, 13.33]
  - - [3904, 2240, 1, 512, 3904, 3904, 3904, 512]
    - [2, 13.331]
  - - [4032, 2240, 1, 512, 4032, 4032, 4032, 512]
    - [2, 13.351]
  - - [64, 2368, 1, 512, 64, 64, 64, 512]
    - [2, 7.615]
  - - [192, 2368, 1, 512, 192, 192, 192, 512]
    - [2, 10.862]
  - - [320, 2368, 1, 512, 320, 320, 320, 512]
    - [2, 12.075]
  - - [448, 2368, 1, 512, 448, 448, 448, 512]
    - [2, 11.982]
  - - [576, 2368, 1, 512, 576, 576, 576, 512]
    - [2, 12.308]
  - - [704, 2368, 1, 512, 704, 704, 704, 512]
    - [2, 12.529]
  - - [832, 2368, 1, 512, 832, 832, 832, 512]
    - [2, 12.557]
  - - [960, 2368, 1, 512, 960, 960, 960, 512]
    - [2, 12.665]
  - - [1088, 2368, 1, 512, 1088, 1088, 1088, 512]
    - [2, 12.632]
  - - [1216, 2368, 1, 512, 1216, 1216, 1216, 512]
    - [2, 12.843]
  - - [1344, 2368, 1, 512, 1344, 1344, 1344, 512]
    - [2, 12.889]
  - - [1472, 2368, 1, 512, 1472, 1472, 1472, 512]
    - [2, 12.95]
  - - [1600, 2368, 1, 512, 1600, 1600, 1600, 512]
    - [2, 12.966]
  - - [1728, 2368, 1, 512, 1728, 1728, 1728, 512]
    - [2, 13.011]
  - - [1856, 2368, 1, 512, 1856, 1856, 1856, 512]
    - [2, 12.911]
  - - [1984, 2368, 1, 512, 1984, 1984, 1984, 512]
    - [2, 13.098]
  - - [2112, 2368, 1, 512, 2112, 2112, 2112, 512]
    - [2, 13.087]
  - - [2240, 2368, 1, 512, 2240, 2240, 2240, 512]
    - [2, 13.154]
  - - [2368, 2368, 1, 512, 2368, 2368, 2368, 512]
    - [2, 13.173]
  - - [2496, 2368, 1, 512, 2496, 2496, 2496, 512]
    - [2, 13.213]
  - - [2624, 2368, 1, 512, 2624, 2624, 2624, 512]
    - [2, 13.122]
  - - [2752, 2368, 1, 512, 2752, 2752, 2752, 512]
    - [2, 13.174]
  - - [2880, 2368, 1, 512, 2880, 2880, 2880, 512]
    - [2, 13.206]
  - - [3008, 2368, 1, 512, 3008, 3008, 3008, 512]
    - [2, 13.245]
  - - [3136, 2368, 1, 512, 3136, 3136, 3136, 512]
    - [2, 13.259]
  - - [3264, 2368, 1, 512, 3264, 3264, 3264, 512]
    - [2, 13.26]
  - - [3392, 2368, 1, 512, 3392, 3392, 3392, 512]
    - [2, 13.277]
  - - [3520, 2368, 1, 512, 3520, 3520, 3520, 512]
    - [2, 13.283]
  - - [3648, 2368, 1, 512, 3648, 3648, 3648, 512]
    - [2, 13.306]
  - - [3776, 2368, 1, 512, 3776, 3776, 3776, 512]
    - [2, 13.376]
  - - [3904, 2368, 1, 512, 3904, 3904, 3904, 512]
    - [2, 13.362]
  - - [4032, 2368, 1, 512, 4032, 4032, 4032, 512]
    - [2, 13.339]
  - - [64, 2496, 1, 512, 64, 64, 64, 512]
    - [2, 7.924]
  - - [192, 2496, 1, 512, 192, 192, 192, 512]
    - [2, 11.106]
  - - [320, 2496, 1, 512, 320, 320, 320, 512]
    - [2, 12.007]
  - - [448, 2496, 1, 512, 448, 448, 448, 512]
    - [2, 11.981]
  - - [576, 2496, 1, 512, 576, 576, 576, 512]
    - [2, 12.296]
  - - [704, 2496, 1, 512, 704, 704, 704, 512]
    - [2, 12.511]
  - - [832, 2496, 1, 512, 832, 832, 832, 512]
    - [2, 12.565]
  - - [960, 2496, 1, 512, 960, 960, 960, 512]
    - [2, 12.697]
  - - [1088, 2496, 1, 512, 1088, 1088, 1088, 512]
    - [2, 12.785]
  - - [1216, 2496, 1, 512, 1216, 1216, 1216, 512]
    - [2, 12.78]
  - - [1344, 2496, 1, 512, 1344, 1344, 1344, 512]
    - [2, 12.738]
  - - [1472, 2496, 1, 512, 1472, 1472, 1472, 512]
    - [2, 12.906]
  - - [1600, 2496, 1, 512, 1600, 1600, 1600, 512]
    - [2, 13.023]
  - - [1728, 2496, 1, 512, 1728, 1728, 1728, 512]
    - [2, 12.925]
  - - [1856, 2496, 1, 512, 1856, 1856, 1856, 512]
    - [2, 13.03]
  - - [1984, 2496, 1, 512, 1984, 1984, 1984, 512]
    - [2, 13.117]
  - - [2112, 2496, 1, 512, 2112, 2112, 2112, 512]
    - [2, 13.138]
  - - [2240, 2496, 1, 512, 2240, 2240, 2240, 512]
    - [2, 13.065]
  - - [2368, 2496, 1, 512, 2368, 2368, 2368, 512]
    - [2, 13.132]
  - - [2496, 2496, 1, 512, 2496, 2496, 2496, 512]
    - [2, 13.13]
  - - [2624, 2496, 1, 512, 2624, 2624, 2624, 512]
    - [2, 13.159]
  - - [2752, 2496, 1, 512, 2752, 2752, 2752, 512]
    - [2, 13.169]
  - - [2880, 2496, 1, 512, 2880, 2880, 2880, 512]
    - [2, 13.223]
  - - [3008, 2496, 1, 512, 3008, 3008, 3008, 512]
    - [2, 13.239]
  - - [3136, 2496, 1, 512, 3136, 3136, 3136, 512]
    - [2, 13.363]
  - - [3264, 2496, 1, 512, 3264, 3264, 3264, 512]
    - [2, 13.273]
  - - [3392, 2496, 1, 512, 3392, 3392, 3392, 512]
    - [2, 13.324]
  - - [3520, 2496, 1, 512, 3520, 3520, 3520, 512]
    - [2, 13.351]
  - - [3648, 2496, 1, 512, 3648, 3648, 3648, 512]
    - [2, 13.374]
  - - [3776, 2496, 1, 512, 3776, 3776, 3776, 512]
    - [2, 13.383]
  - - [3904, 2496, 1, 512, 3904, 3904, 3904, 512]
    - [2, 13.392]
  - - [4032, 2496, 1, 512, 4032, 4032, 4032, 512]
    - [2, 13.347]
  - - [64, 2624, 1, 512, 64, 64, 64, 512]
    - [2, 8.422]
  - - [192, 2624, 1, 512, 192, 192, 192, 512]
    - [2, 11.221]
  - - [320, 2624, 1, 512, 320, 320, 320, 512]
    - [2, 11.991]
  - - [448, 2624, 1, 512, 448, 448, 448, 512]
    - [0, 12.01]
  - - [576, 2624, 1, 512, 576, 576, 576, 512]
    - [2, 12.316]
  - - [704, 2624, 1, 512, 704, 704, 704, 512]
    - [2, 12.469]
  - - [832, 2624, 1, 512, 832, 832, 832, 512]
    - [2, 12.603]
  - - [960, 2624, 1, 512, 960, 960, 960, 512]
    - [2, 12.609]
  - - [1088, 2624, 1, 512, 1088, 1088, 1088, 512]
    - [2, 12.779]
  - - [1216, 2624, 1, 512, 1216, 1216, 1216, 512]
    - [2, 12.912]
  - - [1344, 2624, 1, 512, 1344, 1344, 1344, 512]
    - [2, 12.828]
  - - [1472, 2624, 1, 512, 1472, 1472, 1472, 512]
    - [2, 12.976]
  - - [1600, 2624, 1, 512, 1600, 1600, 1600, 512]
    - [2, 13.033]
  - - [1728, 2624, 1, 512, 1728, 1728, 1728, 512]
    - [2, 12.977]
  - - [1856, 2624, 1, 512, 1856, 1856, 1856, 512]
    - [2, 12.961]
  - - [1984, 2624, 1, 512, 1984, 1984, 1984, 512]
    - [2, 12.99]
  - - [2112, 2624, 1, 512, 2112, 2112, 2112, 512]
    - [2, 13.166]
  - - [2240, 2624, 1, 512, 2240, 2240, 2240, 512]
    - [2, 13.084]
  - - [2368, 2624, 1, 512, 2368, 2368, 2368, 512]
    - [2, 13.062]
  - - [2496, 2624, 1, 512, 2496, 2496, 2496, 512]
    - [2, 13.183]
  - - [2624, 2624, 1, 512, 2624, 2624, 2624, 512]
    - [2, 13.121]
  - - [2752, 2624, 1, 512, 2752, 2752, 2752, 512]
    - [2, 13.202]
  - - [2880, 2624, 1, 512, 2880, 2880, 2880, 512]
    - [2, 13.285]
  - - [3008, 2624, 1, 512, 3008, 3008, 3008, 512]
    - [2, 13.342]
  - - [3136, 2624, 1, 512, 3136, 3136, 3136, 512]
    - [2, 13.246]
  - - [3264, 2624, 1, 512, 3264, 3264, 3264, 512]
    - [2, 13.286]
  - - [3392, 2624, 1, 512, 3392, 3392, 3392, 512]
    - [2, 13.424]
  - - [3520, 2624, 1, 512, 3520, 3520, 3520, 512]
    - [2, 13.398]
  - - [3648, 2624, 1, 512, 3648, 3648, 3648, 512]
    - [2, 13.395]
  - - [3776, 2624, 1, 512, 3776, 3776, 3776, 512]
    - [2, 13.355]
  - - [3904, 2624, 1, 512, 3904, 3904, 3904, 512]
    - [2, 13.463]
  - - [4032, 2624, 1, 512, 4032, 4032, 4032, 512]
    - [2, 13.398]
  - - [64, 2752, 1, 512, 64, 64, 64, 512]
    - [0, 8.325]
  - - [192, 2752, 1, 512, 192, 192, 192, 512]
    - [0, 11.543]
  - - [320, 2752, 1, 512, 320, 320, 320, 512]
    - [0, 12.132]
  - - [448, 2752, 1, 512, 448, 448, 448, 512]
    - [0, 12.044]
  - - [576, 2752, 1, 512, 576, 576, 576, 512]
    - [2, 12.261]
  - - [704, 2752, 1, 512, 704, 704, 704, 512]
    - [2, 12.699]
  - - [832, 2752, 1, 512, 832, 832, 832, 512]
    - [2, 12.631]
  - - [960, 2752, 1, 512, 960, 960, 960, 512]
    - [2, 12.745]
  - - [1088, 2752, 1, 512, 1088, 1088, 1088, 512]
    - [2, 12.646]
  - - [1216, 2752, 1, 512, 1216, 1216, 1216, 512]
    - [2, 12.879]
  - - [1344, 2752, 1, 512, 1344, 1344, 1344, 512]
    - [2, 12.941]
  - - [1472, 2752, 1, 512, 1472, 1472, 1472, 512]
    - [2, 13.024]
  - - [1600, 2752, 1, 512, 1600, 1600, 1600, 512]
    - [2, 12.99]
  - - [1728, 2752, 1, 512, 1728, 1728, 1728, 512]
    - [2, 13.015]
  - - [1856, 2752, 1, 512, 1856, 1856, 1856, 512]
    - [2, 13.096]
  - - [1984, 2752, 1, 512, 1984, 1984, 1984, 512]
    - [2, 13.07]
  - - [2112, 2752, 1, 512, 2112, 2112, 2112, 512]
    - [2, 13.126]
  - - [2240, 2752, 1, 512, 2240, 2240, 2240, 512]
    - [2, 13.15]
  - - [2368, 2752, 1, 512, 2368, 2368, 2368, 512]
    - [2, 13.209]
  - - [2496, 2752, 1, 512, 2496, 2496, 2496, 512]
    - [2, 13.199]
  - - [2624, 2752, 1, 512, 2624, 2624, 2624, 512]
    - [2, 13.266]
  - - [2752, 2752, 1, 512, 2752, 2752, 2752, 512]
    - [2, 13.295]
  - - [2880, 2752, 1, 512, 2880, 2880, 2880, 512]
    - [2, 13.268]
  - - [3008, 2752, 1, 512, 3008, 3008, 3008, 512]
    - [2, 13.239]
  - - [3136, 2752, 1, 512, 3136, 3136, 3136, 512]
    - [2, 13.377]
  - - [3264, 2752, 1, 512, 3264, 3264, 3264, 512]
    - [2, 13.328]
  - - [3392, 2752, 1, 512, 3392, 3392, 3392, 512]
    - [2, 13.433]
  - - [3520, 2752, 1, 512, 3520, 3520, 3520, 512]
    - [2, 13.433]
  - - [3648, 2752, 1, 512, 3648, 3648, 3648, 512]
    - [2, 13.465]
  - - [3776, 2752, 1, 512, 3776, 3776, 3776, 512]
    - [2, 13.394]
  - - [3904, 2752, 1, 512, 3904, 3904, 3904, 512]
    - [2, 13.452]
  - - [4032, 2752, 1, 512, 4032, 4032, 4032, 512]
    - [2, 13.459]
  - - [64, 2880, 1, 512, 64, 64, 64, 512]
    - [0, 8.725]
  - - [192, 2880, 1, 512, 192, 192, 192, 512]
    - [2, 11.249]
  - - [320, 2880, 1, 512, 320, 320, 320, 512]
    - [2, 12.157]
  - - [448, 2880, 1, 512, 448, 448, 448, 512]
    - [2, 12.197]
  - - [576, 2880, 1, 512, 576, 576, 576, 512]
    - [2, 12.465]
  - - [704, 2880, 1, 512, 704, 704, 704, 512]
    - [2, 12.592]
  - - [832, 2880, 1, 512, 832, 832, 832, 512]
    - [2, 12.662]
  - - [960, 2880, 1, 512, 960, 960, 960, 512]
    - [2, 12.757]
  - - [1088, 2880, 1, 512, 1088, 1088, 1088, 512]
    - [2, 12.728]
  - - [1216, 2880, 1, 512, 1216, 1216, 1216, 512]
    - [2, 12.882]
  - - [1344, 2880, 1, 512, 1344, 1344, 1344, 512]
    - [2, 12.952]
  - - [1472, 2880, 1, 512, 1472, 1472, 1472, 512]
    - [2, 13.004]
  - - [1600, 2880, 1, 512, 1600, 1600, 1600, 512]
    - [2, 13.153]
  - - [1728, 2880, 1, 512, 1728, 1728, 1728, 512]
    - [2, 12.997]
  - - [1856, 2880, 1, 512, 1856, 1856, 1856, 512]
    - [2, 13.149]
  - - [1984, 2880, 1, 512, 1984, 1984, 1984, 512]
    - [2, 13.129]
  - - [2112, 2880, 1, 512, 2112, 2112, 2112, 512]
    - [2, 13.177]
  - - [2240, 2880, 1, 512, 2240, 2240, 2240, 512]
    - [2, 13.098]
  - - [2368, 2880, 1, 512, 2368, 2368, 2368, 512]
    - [2, 13.164]
  - - [2496, 2880, 1, 512, 2496, 2496, 2496, 512]
    - [2, 13.208]
  - - [2624, 2880, 1, 512, 2624, 2624, 2624, 512]
    - [2, 13.257]
  - - [2752, 2880, 1, 512, 2752, 2752, 2752, 512]
    - [2, 13.261]
  - - [2880, 2880, 1, 512, 2880, 2880, 2880, 512]
    - [2, 13.33]
  - - [3008, 2880, 1, 512, 3008, 3008, 3008, 512]
    - [2, 13.307]
  - - [3136, 2880, 1, 512, 3136, 3136, 3136, 512]
    - [2, 13.328]
  - - [3264, 2880, 1, 512, 3264, 3264, 3264, 512]
    - [2, 13.435]
  - - [3392, 2880, 1, 512, 3392, 3392, 3392, 512]
    - [2, 13.422]
  - - [3520, 2880, 1, 512, 3520, 3520, 3520, 512]
    - [2, 13.464]
  - - [3648, 2880, 1, 512, 3648, 3648, 3648, 512]
    - [2, 13.486]
  - - [3776, 2880, 1, 512, 3776, 3776, 3776, 512]
    - [2, 13.425]
  - - [3904, 2880, 1, 512, 3904, 3904, 3904, 512]
    - [2, 13.503]
  - - [4032, 2880, 1, 512, 4032, 4032, 4032, 512]
    - [2, 13.514]
  - - [64, 3008, 1, 512, 64, 64, 64, 512]
    - [0, 9.088]
  - - [192, 3008, 1, 512, 192, 192, 192, 512]
    - [2, 11.59]
  - - [320, 3008, 1, 512, 320, 320, 320, 512]
    - [2, 12.584]
  - - [448, 3008, 1, 512, 448, 448, 448, 512]
    - [2, 12.322]
  - - [576, 3008, 1, 512, 576, 576, 576, 512]
    - [2, 12.206]
  - - [704, 3008, 1, 512, 704, 704, 704, 512]
    - [2, 12.6]
  - - [832, 3008, 1, 512, 832, 832, 832, 512]
    - [2, 12.675]
  - - [960, 3008, 1, 512, 960, 960, 960, 512]
    - [2, 12.819]
  - - [1088, 3008, 1, 512, 1088, 1088, 1088, 512]
    - [2, 12.823]
  - - [1216, 3008, 1, 512, 1216, 1216, 1216, 512]
    - [2, 12.89]
  - - [1344, 3008, 1, 512, 1344, 1344, 1344, 512]
    - [2, 13.027]
  - - [1472, 3008, 1, 512, 1472, 1472, 1472, 512]
    - [2, 13.014]
  - - [1600, 3008, 1, 512, 1600, 1600, 1600, 512]
    - [2, 13.135]
  - - [1728, 3008, 1, 512, 1728, 1728, 1728, 512]
    - [2, 13.095]
  - - [1856, 3008, 1, 512, 1856, 1856, 1856, 512]
    - [2, 13.182]
  - - [1984, 3008, 1, 512, 1984, 1984, 1984, 512]
    - [2, 13.107]
  - - [2112, 3008, 1, 512, 2112, 2112, 2112, 512]
    - [2, 13.199]
  - - [2240, 3008, 1, 512, 2240, 2240, 2240, 512]
    - [2, 13.129]
  - - [2368, 3008, 1, 512, 2368, 2368, 2368, 512]
    - [2, 13.227]
  - - [2496, 3008, 1, 512, 2496, 2496, 2496, 512]
    - [2, 13.256]
  - - [2624, 3008, 1, 512, 2624, 2624, 2624, 512]
    - [2, 13.285]
  - - [2752, 3008, 1, 512, 2752, 2752, 2752, 512]
    - [2, 13.302]
  - - [2880, 3008, 1, 512, 2880, 2880, 2880, 512]
    - [2, 13.388]
  - - [3008, 3008, 1, 512, 3008, 3008, 3008, 512]
    - [2, 13.305]
  - - [3136, 3008, 1, 512, 3136, 3136, 3136, 512]
    - [2, 13.37]
  - - [3264, 3008, 1, 512, 3264, 3264, 3264, 512]
    - [2, 13.393]
  - - [3392, 3008, 1, 512, 3392, 3392, 3392, 512]
    - [2, 13.384]
  - - [3520, 3008, 1, 512, 3520, 3520, 3520, 512]
    - [2, 13.417]
  - - [3648, 3008, 1, 512, 3648, 3648, 3648, 512]
    - [2, 13.438]
  - - [3776, 3008, 1, 512, 3776, 3776, 3776, 512]
    - [2, 13.543]
  - - [3904, 3008, 1, 512, 3904, 3904, 3904, 512]
    - [2, 13.526]
  - - [4032, 3008, 1, 512, 4032, 4032, 4032, 512]
    - [2, 13.522]
  - - [64, 3136, 1, 512, 64, 64, 64, 512]
    - [2, 8.526]
  - - [192, 3136, 1, 512, 192, 192, 192, 512]
    - [2, 11.645]
  - - [320, 3136, 1, 512, 320, 320, 320, 512]
    - [2, 12.203]
  - - [448, 3136, 1, 512, 448, 448, 448, 512]
    - [2, 12.247]
  - - [576, 3136, 1, 512, 576, 576, 576, 512]
    - [2, 12.579]
  - - [704, 3136, 1, 512, 704, 704, 704, 512]
    - [2, 12.559]
  - - [832, 3136, 1, 512, 832, 832, 832, 512]
    - [2, 12.785]
  - - [960, 3136, 1, 512, 960, 960, 960, 512]
    - [2, 12.874]
  - - [1088, 3136, 1, 512, 1088, 1088, 1088, 512]
    - [2, 12.836]
  - - [1216, 3136, 1, 512, 1216, 1216, 1216, 512]
    - [2, 12.972]
  - - [1344, 3136, 1, 512, 1344, 1344, 1344, 512]
    - [2, 13.056]
  - - [1472, 3136, 1, 512, 1472, 1472, 1472, 512]
    - [2, 13.007]
  - - [1600, 3136, 1, 512, 1600, 1600, 1600, 512]
    - [2, 13.119]
  - - [1728, 3136, 1, 512, 1728, 1728, 1728, 512]
    - [2, 13.153]
  - - [1856, 3136, 1, 512, 1856, 1856, 1856, 512]
    - [2, 13.18]
  - - [1984, 3136, 1, 512, 1984, 1984, 1984, 512]
    - [2, 13.163]
  - - [2112, 3136, 1, 512, 2112, 2112, 2112, 512]
    - [2, 13.275]
  - - [2240, 3136, 1, 512, 2240, 2240, 2240, 512]
    - [2, 13.315]
  - - [2368, 3136, 1, 512, 2368, 2368, 2368, 512]
    - [2, 13.236]
  - - [2496, 3136, 1, 512, 2496, 2496, 2496, 512]
    - [2, 13.262]
  - - [2624, 3136, 1, 512, 2624, 2624, 2624, 512]
    - [2, 13.239]
  - - [2752, 3136, 1, 512, 2752, 2752, 2752, 512]
    - [2, 13.34]
  - - [2880, 3136, 1, 512, 2880, 2880, 2880, 512]
    - [2, 13.397]
  - - [3008, 3136, 1, 512, 3008, 3008, 3008, 512]
    - [2, 13.324]
  - - [3136, 3136, 1, 512, 3136, 3136, 3136, 512]
    - [2, 13.388]
  - - [3264, 3136, 1, 512, 3264, 3264, 3264, 512]
    - [2, 13.42]
  - - [3392, 3136, 1, 512, 3392, 3392, 3392, 512]
    - [2, 13.379]
  - - [3520, 3136, 1, 512, 3520, 3520, 3520, 512]
    - [2, 13.4]
  - - [3648, 3136, 1, 512, 3648, 3648, 3648, 512]
    - [2, 13.449]
  - - [3776, 3136, 1, 512, 3776, 3776, 3776, 512]
    - [2, 13.429]
  - - [3904, 3136, 1, 512, 3904, 3904, 3904, 512]
    - [2, 13.512]
  - - [4032, 3136, 1, 512, 4032, 4032, 4032, 512]
    - [2, 13.577]
  - - [64, 3264, 1, 512, 64, 64, 64, 512]
    - [2, 8.704]
  - - [192, 3264, 1, 512, 192, 192, 192, 512]
    - [2, 11.783]
  - - [320, 3264, 1, 512, 320, 320, 320, 512]
    - [2, 12.287]
  - - [448, 3264, 1, 512, 448, 448, 448, 512]
    - [2, 12.162]
  - - [576, 3264, 1, 512, 576, 576, 576, 512]
    - [2, 12.553]
  - - [704, 3264, 1, 512, 704, 704, 704, 512]
    - [2, 12.576]
  - - [832, 3264, 1, 512, 832, 832, 832, 512]
    - [2, 12.695]
  - - [960, 3264, 1, 512, 960, 960, 960, 512]
    - [2, 12.846]
  - - [1088, 3264, 1, 512, 1088, 1088, 1088, 512]
    - [2, 12.983]
  - - [1216, 3264, 1, 512, 1216, 1216, 1216, 512]
    - [2, 12.891]
  - - [1344, 3264, 1, 512, 1344, 1344, 1344, 512]
    - [2, 12.959]
  - - [1472, 3264, 1, 512, 1472, 1472, 1472, 512]
    - [2, 13.082]
  - - [1600, 3264, 1, 512, 1600, 1600, 1600, 512]
    - [2, 13.132]
  - - [1728, 3264, 1, 512, 1728, 1728, 1728, 512]
    - [2, 13.085]
  - - [1856, 3264, 1, 512, 1856, 1856, 1856, 512]
    - [2, 13.212]
  - - [1984, 3264, 1, 512, 1984, 1984, 1984, 512]
    - [2, 13.108]
  - - [2112, 3264, 1, 512, 2112, 2112, 2112, 512]
    - [2, 13.283]
  - - [2240, 3264, 1, 512, 2240, 2240, 2240, 512]
    - [2, 13.311]
  - - [2368, 3264, 1, 512, 2368, 2368, 2368, 512]
    - [2, 13.242]
  - - [2496, 3264, 1, 512, 2496, 2496, 2496, 512]
    - [2, 13.02]
  - - [2624, 3264, 1, 512, 2624, 2624, 2624, 512]
    - [2, 13.349]
  - - [2752, 3264, 1, 512, 2752, 2752, 2752, 512]
    - [2, 13.355]
  - - [2880, 3264, 1, 512, 2880, 2880, 2880, 512]
    - [2, 13.343]
  - - [3008, 3264, 1, 512, 3008, 3008, 3008, 512]
    - [2, 13.421]
  - - [3136, 3264, 1, 512, 3136, 3136, 3136, 512]
    - [2, 13.419]
  - - [3264, 3264, 1, 512, 3264, 3264, 3264, 512]
    - [2, 13.439]
  - - [3392, 3264, 1, 512, 3392, 3392, 3392, 512]
    - [2, 13.478]
  - - [3520, 3264, 1, 512, 3520, 3520, 3520, 512]
    - [2, 13.395]
  - - [3648, 3264, 1, 512, 3648, 3648, 3648, 512]
    - [2, 13.473]
  - - [3776, 3264, 1, 512, 3776, 3776, 3776, 512]
    - [2, 13.468]
  - - [3904, 3264, 1, 512, 3904, 3904, 3904, 512]
    - [2, 13.539]
  - - [4032, 3264, 1, 512, 4032, 4032, 4032, 512]
    - [2, 13.568]
  - - [64, 3392, 1, 512, 64, 64, 64, 512]
    - [2, 9.013]
  - - [192, 3392, 1, 512, 192, 192, 192, 512]
    - [2, 11.817]
  - - [320, 3392, 1, 512, 320, 320, 320, 512]
    - [2, 12.253]
  - - [448, 3392, 1, 512, 448, 448, 448, 512]
    - [2, 12.254]
  - - [576, 3392, 1, 512, 576, 576, 576, 512]
    - [2, 12.536]
  - - [704, 3392, 1, 512, 704, 704, 704, 512]
    - [2, 12.667]
  - - [832, 3392, 1, 512, 832, 832, 832, 512]
    - [2, 12.747]
  - - [960, 3392, 1, 512, 960, 960, 960, 512]
    - [2, 12.842]
  - - [1088, 3392, 1, 512, 1088, 1088, 1088, 512]
    - [2, 12.949]
  - - [1216, 3392, 1, 512, 1216, 1216, 1216, 512]
    - [2, 12.829]
  - - [1344, 3392, 1, 512, 1344, 1344, 1344, 512]
    - [2, 12.981]
  - - [1472, 3392, 1, 512, 1472, 1472, 1472, 512]
    - [2, 13.039]
  - - [1600, 3392, 1, 512, 1600, 1600, 1600, 512]
    - [2, 13.134]
  - - [1728, 3392, 1, 512, 1728, 1728, 1728, 512]
    - [2, 13.182]
  - - [1856, 3392, 1, 512, 1856, 1856, 1856, 512]
    - [2, 13.082]
  - - [1984, 3392, 1, 512, 1984, 1984, 1984, 512]
    - [2, 13.203]
  - - [2112, 3392, 1, 512, 2112, 2112, 2112, 512]
    - [2, 13.236]
  - - [2240, 3392, 1, 512, 2240, 2240, 2240, 512]
    - [2, 13.209]
  - - [2368, 3392, 1, 512, 2368, 2368, 2368, 512]
    - [2, 13.234]
  - - [2496, 3392, 1, 512, 2496, 2496, 2496, 512]
    - [2, 13.295]
  - - [2624, 3392, 1, 512, 2624, 2624, 2624, 512]
    - [2, 13.257]
  - - [2752, 3392, 1, 512, 2752, 2752, 2752, 512]
    - [2, 13.279]
  - - [2880, 3392, 1, 512, 2880, 2880, 2880, 512]
    - [2, 13.32]
  - - [3008, 3392, 1, 512, 3008, 3008, 3008, 512]
    - [2, 13.358]
  - - [3136, 3392, 1, 512, 3136, 3136, 3136, 512]
    - [2, 13.395]
  - - [3264, 3392, 1, 512, 3264, 3264, 3264, 512]
    - [2, 13.422]
  - - [3392, 3392, 1, 512, 3392, 3392, 3392, 512]
    - [2, 13.468]
  - - [3520, 3392, 1, 512, 3520, 3520, 3520, 512]
    - [2, 13.448]
  - - [3648, 3392, 1, 512, 3648, 3648, 3648, 512]
    - [2, 13.503]
  - - [3776, 3392, 1, 512, 3776, 3776, 3776, 512]
    - [2, 13.588]
  - - [3904, 3392, 1, 512, 3904, 3904, 3904, 512]
    - [2, 13.624]
  - - [4032, 3392, 1, 512, 4032, 4032, 4032, 512]
    - [2, 13.626]
  - - [64, 3520, 1, 512, 64, 64, 64, 512]
    - [2, 9.426]
  - - [192, 3520, 1, 512, 192, 192, 192, 512]
    - [0, 11.852]
  - - [320, 3520, 1, 512, 320, 320, 320, 512]
    - [0, 12.118]
  - - [448, 3520, 1, 512, 448, 448, 448, 512]
    - [2, 12.257]
  - - [576, 3520, 1, 512, 576, 576, 576, 512]
    - [2, 12.628]
  - - [704, 3520, 1, 512, 704, 704, 704, 512]
    - [2, 12.717]
  - - [832, 3520, 1, 512, 832, 832, 832, 512]
    - [2, 12.779]
  - - [960, 3520, 1, 512, 960, 960, 960, 512]
    - [2, 12.772]
  - - [1088, 3520, 1, 512, 1088, 1088, 1088, 512]
    - [2, 12.925]
  - - [1216, 3520, 1, 512, 1216, 1216, 1216, 512]
    - [2, 12.928]
  - - [1344, 3520, 1, 512, 1344, 1344, 1344, 512]
    - [2, 13.167]
  - - [1472, 3520, 1, 512, 1472, 1472, 1472, 512]
    - [2, 13.14]
  - - [1600, 3520, 1, 512, 1600, 1600, 1600, 512]
    - [2, 13.187]
  - - [1728, 3520, 1, 512, 1728, 1728, 1728, 512]
    - [2, 13.166]
  - - [1856, 3520, 1, 512, 1856, 1856, 1856, 512]
    - [2, 13.179]
  - - [1984, 3520, 1, 512, 1984, 1984, 1984, 512]
    - [2, 13.264]
  - - [2112, 3520, 1, 512, 2112, 2112, 2112, 512]
    - [2, 13.268]
  - - [2240, 3520, 1, 512, 2240, 2240, 2240, 512]
    - [2, 13.305]
  - - [2368, 3520, 1, 512, 2368, 2368, 2368, 512]
    - [2, 13.257]
  - - [2496, 3520, 1, 512, 2496, 2496, 2496, 512]
    - [2, 13.353]
  - - [2624, 3520, 1, 512, 2624, 2624, 2624, 512]
    - [2, 13.318]
  - - [2752, 3520, 1, 512, 2752, 2752, 2752, 512]
    - [2, 13.363]
  - - [2880, 3520, 1, 512, 2880, 2880, 2880, 512]
    - [2, 13.408]
  - - [3008, 3520, 1, 512, 3008, 3008, 3008, 512]
    - [2, 13.37]
  - - [3136, 3520, 1, 512, 3136, 3136, 3136, 512]
    - [2, 13.369]
  - - [3264, 3520, 1, 512, 3264, 3264, 3264, 512]
    - [2, 13.441]
  - - [3392, 3520, 1, 512, 3392, 3392, 3392, 512]
    - [2, 13.508]
  - - [3520, 3520, 1, 512, 3520, 3520, 3520, 512]
    - [2, 13.483]
  - - [3648, 3520, 1, 512, 3648, 3648, 3648, 512]
    - [2, 13.552]
  - - [3776, 3520, 1, 512, 3776, 3776, 3776, 512]
    - [2, 13.541]
  - - [3904, 3520, 1, 512, 3904, 3904, 3904, 512]
    - [2, 13.608]
  - - [4032, 3520, 1, 512, 4032, 4032, 4032, 512]
    - [2, 13.621]
  - - [64, 3648, 1, 512, 64, 64, 64, 512]
    - [0, 9.538]
  - - [192, 3648, 1, 512, 192, 192, 192, 512]
    - [2, 11.887]
  - - [320, 3648, 1, 512, 320, 320, 320, 512]
    - [2, 12.091]
  - - [448, 3648, 1, 512, 448, 448, 448, 512]
    - [2, 12.404]
  - - [576, 3648, 1, 512, 576, 576, 576, 512]
    - [2, 12.721]
  - - [704, 3648, 1, 512, 704, 704, 704, 512]
    - [2, 12.759]
  - - [832, 3648, 1, 512, 832, 832, 832, 512]
    - [2, 12.768]
  - - [960, 3648, 1, 512, 960, 960, 960, 512]
    - [2, 12.87]
  - - [1088, 3648, 1, 512, 1088, 1088, 1088, 512]
    - [2, 13.018]
  - - [1216, 3648, 1, 512, 1216, 1216, 1216, 512]
    - [2, 13.042]
  - - [1344, 3648, 1, 512, 1344, 1344, 1344, 512]
    - [2, 13.003]
  - - [1472, 3648, 1, 512, 1472, 1472, 1472, 512]
    - [2, 13.172]
  - - [1600, 3648, 1, 512, 1600, 1600, 1600, 512]
    - [2, 13.127]
  - - [1728, 3648, 1, 512, 1728, 1728, 1728, 512]
    - [2, 13.188]
  - - [1856, 3648, 1, 512, 1856, 1856, 1856, 512]
    - [2, 13.066]
  - - [1984, 3648, 1, 512, 1984, 1984, 1984, 512]
    - [2, 13.169]
  - - [2112, 3648, 1, 512, 2112, 2112, 2112, 512]
    - [2, 13.275]
  - - [2240, 3648, 1, 512, 2240, 2240, 2240, 512]
    - [2, 13.215]
  - - [2368, 3648, 1, 512, 2368, 2368, 2368, 512]
    - [2, 13.255]
  - - [2496, 3648, 1, 512, 2496, 2496, 2496, 512]
    - [2, 13.305]
  - - [2624, 3648, 1, 512, 2624, 2624, 2624, 512]
    - [2, 13.334]
  - - [2752, 3648, 1, 512, 2752, 2752, 2752, 512]
    - [2, 13.364]
  - - [2880, 3648, 1, 512, 2880, 2880, 2880, 512]
    - [2, 13.363]
  - - [3008, 3648, 1, 512, 3008, 3008, 3008, 512]
    - [2, 13.434]
  - - [3136, 3648, 1, 512, 3136, 3136, 3136, 512]
    - [2, 13.474]
  - - [3264, 3648, 1, 512, 3264, 3264, 3264, 512]
    - [2, 13.448]
  - - [3392, 3648, 1, 512, 3392, 3392, 3392, 512]
    - [2, 13.471]
  - - [3520, 3648, 1, 512, 3520, 3520, 3520, 512]
    - [2, 13.491]
  - - [3648, 3648, 1, 512, 3648, 3648, 3648, 512]
    - [2, 13.646]
  - - [3776, 3648, 1, 512, 3776, 3776, 3776, 512]
    - [2, 13.489]
  - - [3904, 3648, 1, 512, 3904, 3904, 3904, 512]
    - [2, 13.667]
  - - [4032, 3648, 1, 512, 4032, 4032, 4032, 512]
    - [2, 13.603]
  - - [64, 3776, 1, 512, 64, 64, 64, 512]
    - [0, 9.878]
  - - [192, 3776, 1, 512, 192, 192, 192, 512]
    - [0, 11.96]
  - - [320, 3776, 1, 512, 320, 320, 320, 512]
    - [2, 12.169]
  - - [448, 3776, 1, 512, 448, 448, 448, 512]
    - [2, 12.385]
  - - [576, 3776, 1, 512, 576, 576, 576, 512]
    - [2, 12.593]
  - - [704, 3776, 1, 512, 704, 704, 704, 512]
    - [2, 12.814]
  - - [832, 3776, 1, 512, 832, 832, 832, 512]
    - [2, 12.818]
  - - [960, 3776, 1, 512, 960, 960, 960, 512]
    - [2, 13.026]
  - - [1088, 3776, 1, 512, 1088, 1088, 1088, 512]
    - [2, 12.808]
  - - [1216, 3776, 1, 512, 1216, 1216, 1216, 512]
    - [2, 13.114]
  - - [1344, 3776, 1, 512, 1344, 1344, 1344, 512]
    - [2, 13.016]
  - - [1472, 3776, 1, 512, 1472, 1472, 1472, 512]
    - [2, 13.071]
  - - [1600, 3776, 1, 512, 1600, 1600, 1600, 512]
    - [2, 13.157]
  - - [1728, 3776, 1, 512, 1728, 1728, 1728, 512]
    - [2, 13.171]
  - - [1856, 3776, 1, 512, 1856, 1856, 1856, 512]
    - [2, 13.261]
  - - [1984, 3776, 1, 512, 1984, 1984, 1984, 512]
    - [2, 13.186]
  - - [2112, 3776, 1, 512, 2112, 2112, 2112, 512]
    - [2, 13.294]
  - - [2240, 3776, 1, 512, 2240, 2240, 2240, 512]
    - [2, 13.254]
  - - [2368, 3776, 1, 512, 2368, 2368, 2368, 512]
    - [2, 13.331]
  - - [2496, 3776, 1, 512, 2496, 2496, 2496, 512]
    - [2, 13.278]
  - - [2624, 3776, 1, 512, 2624, 2624, 2624, 512]
    - [2, 13.296]
  - - [2752, 3776, 1, 512, 2752, 2752, 2752, 512]
    - [2, 13.389]
  - - [2880, 3776, 1, 512, 2880, 2880, 2880, 512]
    - [2, 13.44]
  - - [3008, 3776, 1, 512, 3008, 3008, 3008, 512]
    - [2, 13.505]
  - - [3136, 3776, 1, 512, 3136, 3136, 3136, 512]
    - [2, 13.52]
  - - [3264, 3776, 1, 512, 3264, 3264, 3264, 512]
    - [2, 13.537]
  - - [3392, 3776, 1, 512, 3392, 3392, 3392, 512]
    - [2, 13.486]
  - - [3520, 3776, 1, 512, 3520, 3520, 3520, 512]
    - [2, 13.555]
  - - [3648, 3776, 1, 512, 3648, 3648, 3648, 512]
    - [2, 13.613]
  - - [3776, 3776, 1, 512, 3776, 3776, 3776, 512]
    - [2, 13.661]
  - - [3904, 3776, 1, 512, 3904, 3904, 3904, 512]
    - [2, 13.684]
  - - [4032, 3776, 1, 512, 4032, 4032, 4032, 512]
    - [2, 13.665]
  - - [64, 3904, 1, 512, 64, 64, 64, 512]
    - [2, 9.463]
  - - [192, 3904, 1, 512, 192, 192, 192, 512]
    - [2, 11.922]
  - - [320, 3904, 1, 512, 320, 320, 320, 512]
    - [2, 12.068]
  - - [448, 3904, 1, 512, 448, 448, 448, 512]
    - [2, 12.503]
  - - [576, 3904, 1, 512, 576, 576, 576, 512]
    - [2, 12.618]
  - - [704, 3904, 1, 512, 704, 704, 704, 512]
    - [2, 12.783]
  - - [832, 3904, 1, 512, 832, 832, 832, 512]
    - [2, 12.782]
  - - [960, 3904, 1, 512, 960, 960, 960, 512]
    - [2, 12.952]
  - - [1088, 3904, 1, 512, 1088, 1088, 1088, 512]
    - [2, 13.004]
  - - [1216, 3904, 1, 512, 1216, 1216, 1216, 512]
    - [2, 13.01]
  - - [1344, 3904, 1, 512, 1344, 1344, 1344, 512]
    - [2, 13.066]
  - - [1472, 3904, 1, 512, 1472, 1472, 1472, 512]
    - [2, 13.172]
  - - [1600, 3904, 1, 512, 1600, 1600, 1600, 512]
    - [2, 13.106]
  - - [1728, 3904, 1, 512, 1728, 1728, 1728, 512]
    - [2, 13.242]
  - - [1856, 3904, 1, 512, 1856, 1856, 1856, 512]
    - [2, 13.281]
  - - [1984, 3904, 1, 512, 1984, 1984, 1984, 512]
    - [2, 13.212]
  - - [2112, 3904, 1, 512, 2112, 2112, 2112, 512]
    - [2, 13.195]
  - - [2240, 3904, 1, 512, 2240, 2240, 2240, 512]
    - [2, 13.314]
  - - [2368, 3904, 1, 512, 2368, 2368, 2368, 512]
    - [2, 13.32]
  - - [2496, 3904, 1, 512, 2496, 2496, 2496, 512]
    - [2, 13.31]
  - - [2624, 3904, 1, 512, 2624, 2624, 2624, 512]
    - [2, 13.334]
  - - [2752, 3904, 1, 512, 2752, 2752, 2752, 512]
    - [2, 13.402]
  - - [2880, 3904, 1, 512, 2880, 2880, 2880, 512]
    - [2, 13.401]
  - - [3008, 3904, 1, 512, 3008, 3008, 3008, 512]
    - [2, 13.455]
  - - [3136, 3904, 1, 512, 3136, 3136, 3136, 512]
    - [2, 13.56]
  - - [3264, 3904, 1, 512, 3264, 3264, 3264, 512]
    - [2, 13.49]
  - - [3392, 3904, 1, 512, 3392, 3392, 3392, 512]
    - [2, 13.548]
  - - [3520, 3904, 1, 512, 3520, 3520, 3520, 512]
    - [2, 13.586]
  - - [3648, 3904, 1, 512, 3648, 3648, 3648, 512]
    - [2, 13.561]
  - - [3776, 3904, 1, 512, 3776, 3776, 3776, 512]
    - [2, 13.636]
  - - [3904, 3904, 1, 512, 3904, 3904, 3904, 512]
    - [2, 13.643]
  - - [4032, 3904, 1, 512, 4032, 4032, 4032, 512]
    - [2, 13.723]
  - - [64, 4032, 1, 512, 64, 64, 64, 512]
    - [2, 9.61]
  - - [192, 4032, 1, 512, 192, 192, 192, 512]
    - [2, 11.888]
  - - [320, 4032, 1, 512, 320, 320, 320, 512]
    - [2, 12.157]
  - - [448, 4032, 1, 512, 448, 448, 448, 512]
    - [0, 12.368]
  - - [576, 4032, 1, 512, 576, 576, 576, 512]
    - [2, 12.681]
  - - [704, 4032, 1, 512, 704, 704, 704, 512]
    - [2, 12.686]
  - - [832, 4032, 1, 512, 832, 832, 832, 512]
    - [2, 12.859]
  - - [960, 4032, 1, 512, 960, 960, 960, 512]
    - [2, 12.89]
  - - [1088, 4032, 1, 512, 1088, 1088, 1088, 512]
    - [2, 12.922]
  - - [1216, 4032, 1, 512, 1216, 1216, 1216, 512]
    - [2, 13.025]
  - - [1344, 4032, 1, 512, 1344, 1344, 1344, 512]
    - [2, 12.997]
  - - [1472, 4032, 1, 512, 1472, 1472, 1472, 512]
    - [2, 13.037]
  - - [1600, 4032, 1, 512, 1600, 1600, 1600, 512]
    - [2, 13.182]
  - - [1728, 4032, 1, 512, 1728, 1728, 1728, 512]
    - [2, 13.154]
  - - [1856, 4032, 1, 512, 1856, 1856, 1856, 512]
    - [2, 13.258]
  - - [1984, 4032, 1, 512, 1984, 1984, 1984, 512]
    - [2, 13.206]
  - - [2112, 4032, 1, 512, 2112, 2112, 2112, 512]
    - [2, 13.304]
  - - [2240, 4032, 1, 512, 2240, 2240, 2240, 512]
    - [2, 13.285]
  - - [2368, 4032, 1, 512, 2368, 2368, 2368, 512]
    - [2, 13.372]
  - - [2496, 4032, 1, 512, 2496, 2496, 2496, 512]
    - [2, 13.335]
  - - [2624, 4032, 1, 512, 2624, 2624, 2624, 512]
    - [2, 13.407]
  - - [2752, 4032, 1, 512, 2752, 2752, 2752, 512]
    - [2, 13.424]
  - - [2880, 4032, 1, 512, 2880, 2880, 2880, 512]
    - [2, 13.452]
  - - [3008, 4032, 1, 512, 3008, 3008, 3008, 512]
    - [2, 13.525]
  - - [3136, 4032, 1, 512, 3136, 3136, 3136, 512]
    - [2, 13.534]
  - - [3264, 4032, 1, 512, 3264, 3264, 3264, 512]
    - [2, 13.602]
  - - [3392, 4032, 1, 512, 3392, 3392, 3392, 512]
    - [2, 13.496]
  - - [3520, 4032, 1, 512, 3520, 3520, 3520, 512]
    - [2, 13.629]
  - - [3648, 4032, 1, 512, 3648, 3648, 3648, 512]
    - [2, 13.64]
  - - [3776, 4032, 1, 512, 3776, 3776, 3776, 512]
    - [2, 13.632]
  - - [3904, 4032, 1, 512, 3904, 3904, 3904, 512]
    - [2, 13.656]
  - - [4032, 4032, 1, 512, 4032, 4032, 4032, 512]
    - [2, 13.753]
  - - [64, 64, 1, 1024, 64, 64, 64, 1024]
    - [1, 0.784]
  - - [192, 64, 1, 1024, 192, 192, 192, 1024]
    - [1, 2.337]
  - - [320, 64, 1, 1024, 320, 320, 320, 1024]
    - [2, 3.832]
  - - [448, 64, 1, 1024, 448, 448, 448, 1024]
    - [0, 4.298]
  - - [576, 64, 1, 1024, 576, 576, 576, 1024]
    - [0, 5.514]
  - - [704, 64, 1, 1024, 704, 704, 704, 1024]
    - [0, 6.618]
  - - [832, 64, 1, 1024, 832, 832, 832, 1024]
    - [2, 5.815]
  - - [960, 64, 1, 1024, 960, 960, 960, 1024]
    - [2, 6.686]
  - - [1088, 64, 1, 1024, 1088, 1088, 1088, 1024]
    - [2, 7.556]
  - - [1216, 64, 1, 1024, 1216, 1216, 1216, 1024]
    - [0, 7.333]
  - - [1344, 64, 1, 1024, 1344, 1344, 1344, 1024]
    - [0, 8.192]
  - - [1472, 64, 1, 1024, 1472, 1472, 1472, 1024]
    - [0, 8.96]
  - - [1600, 64, 1, 1024, 1600, 1600, 1600, 1024]
    - [2, 7.795]
  - - [1728, 64, 1, 1024, 1728, 1728, 1728, 1024]
    - [2, 8.409]
  - - [1856, 64, 1, 1024, 1856, 1856, 1856, 1024]
    - [2, 9.001]
  - - [1984, 64, 1, 1024, 1984, 1984, 1984, 1024]
    - [0, 8.822]
  - - [2112, 64, 1, 1024, 2112, 2112, 2112, 1024]
    - [0, 9.367]
  - - [2240, 64, 1, 1024, 2240, 2240, 2240, 1024]
    - [0, 9.879]
  - - [2368, 64, 1, 1024, 2368, 2368, 2368, 1024]
    - [2, 9.003]
  - - [2496, 64, 1, 1024, 2496, 2496, 2496, 1024]
    - [2, 9.334]
  - - [2624, 64, 1, 1024, 2624, 2624, 2624, 1024]
    - [2, 9.728]
  - - [2752, 64, 1, 1024, 2752, 2752, 2752, 1024]
    - [0, 9.568]
  - - [2880, 64, 1, 1024, 2880, 2880, 2880, 1024]
    - [0, 9.999]
  - - [3008, 64, 1, 1024, 3008, 3008, 3008, 1024]
    - [0, 10.457]
  - - [3136, 64, 1, 1024, 3136, 3136, 3136, 1024]
    - [2, 9.595]
  - - [3264, 64, 1, 1024, 3264, 3264, 3264, 1024]
    - [2, 9.933]
  - - [3392, 64, 1, 1024, 3392, 3392, 3392, 1024]
    - [2, 10.214]
  - - [3520, 64, 1, 1024, 3520, 3520, 3520, 1024]
    - [2, 10.612]
  - - [3648, 64, 1, 1024, 3648, 3648, 3648, 1024]
    - [0, 10.69]
  - - [3776, 64, 1, 1024, 3776, 3776, 3776, 1024]
    - [0, 10.93]
  - - [3904, 64, 1, 1024, 3904, 3904, 3904, 1024]
    - [2, 10.533]
  - - [4032, 64, 1, 1024, 4032, 4032, 4032, 1024]
    - [2, 10.675]
  - - [64, 192, 1, 1024, 64, 64, 64, 1024]
    - [1, 2.293]
  - - [192, 192, 1, 1024, 192, 192, 192, 1024]
    - [2, 4.701]
  - - [320, 192, 1, 1024, 320, 320, 320, 1024]
    - [2, 6.741]
  - - [448, 192, 1, 1024, 448, 448, 448, 1024]
    - [0, 8.2]
  - - [576, 192, 1, 1024, 576, 576, 576, 1024]
    - [2, 8.432]
  - - [704, 192, 1, 1024, 704, 704, 704, 1024]
    - [0, 9.407]
  - - [832, 192, 1, 1024, 832, 832, 832, 1024]
    - [2, 9.353]
  - - [960, 192, 1, 1024, 960, 960, 960, 1024]
    - [0, 10.063]
  - - [1088, 192, 1, 1024, 1088, 1088, 1088, 1024]
    - [2, 9.979]
  - - [1216, 192, 1, 1024, 1216, 1216, 1216, 1024]
    - [0, 10.766]
  - - [1344, 192, 1, 1024, 1344, 1344, 1344, 1024]
    - [2, 10.878]
  - - [1472, 192, 1, 1024, 1472, 1472, 1472, 1024]
    - [0, 11.119]
  - - [1600, 192, 1, 1024, 1600, 1600, 1600, 1024]
    - [2, 11.239]
  - - [1728, 192, 1, 1024, 1728, 1728, 1728, 1024]
    - [0, 11.326]
  - - [1856, 192, 1, 1024, 1856, 1856, 1856, 1024]
    - [2, 11.406]
  - - [1984, 192, 1, 1024, 1984, 1984, 1984, 1024]
    - [0, 11.781]
  - - [2112, 192, 1, 1024, 2112, 2112, 2112, 1024]
    - [2, 11.458]
  - - [2240, 192, 1, 1024, 2240, 2240, 2240, 1024]
    - [0, 11.839]
  - - [2368, 192, 1, 1024, 2368, 2368, 2368, 1024]
    - [2, 11.519]
  - - [2496, 192, 1, 1024, 2496, 2496, 2496, 1024]
    - [0, 11.854]
  - - [2624, 192, 1, 1024, 2624, 2624, 2624, 1024]
    - [0, 11.484]
  - - [2752, 192, 1, 1024, 2752, 2752, 2752, 1024]
    - [0, 11.901]
  - - [2880, 192, 1, 1024, 2880, 2880, 2880, 1024]
    - [2, 11.655]
  - - [3008, 192, 1, 1024, 3008, 3008, 3008, 1024]
    - [0, 11.834]
  - - [3136, 192, 1, 1024, 3136, 3136, 3136, 1024]
    - [0, 11.722]
  - - [3264, 192, 1, 1024, 3264, 3264, 3264, 1024]
    - [0, 11.861]
  - - [3392, 192, 1, 1024, 3392, 3392, 3392, 1024]
    - [2, 11.853]
  - - [3520, 192, 1, 1024, 3520, 3520, 3520, 1024]
    - [0, 12.037]
  - - [3648, 192, 1, 1024, 3648, 3648, 3648, 1024]
    - [2, 11.931]
  - - [3776, 192, 1, 1024, 3776, 3776, 3776, 1024]
    - [0, 12.111]
  - - [3904, 192, 1, 1024, 3904, 3904, 3904, 1024]
    - [2, 11.989]
  - - [4032, 192, 1, 1024, 4032, 4032, 4032, 1024]
    - [0, 12.008]
  - - [64, 320, 1, 1024, 64, 64, 64, 1024]
    - [2, 3.776]
  - - [192, 320, 1, 1024, 192, 192, 192, 1024]
    - [2, 6.697]
  - - [320, 320, 1, 1024, 320, 320, 320, 1024]
    - [2, 7.769]
  - - [448, 320, 1, 1024, 448, 448, 448, 1024]
    - [0, 9.876]
  - - [576, 320, 1, 1024, 576, 576, 576, 1024]
    - [0, 10.035]
  - - [704, 320, 1, 1024, 704, 704, 704, 1024]
    - [2, 10.644]
  - - [832, 320, 1, 1024, 832, 832, 832, 1024]
    - [2, 11.121]
  - - [960, 320, 1, 1024, 960, 960, 960, 1024]
    - [2, 11.328]
  - - [1088, 320, 1, 1024, 1088, 1088, 1088, 1024]
    - [2, 11.269]
  - - [1216, 320, 1, 1024, 1216, 1216, 1216, 1024]
    - [0, 11.86]
  - - [1344, 320, 1, 1024, 1344, 1344, 1344, 1024]
    - [0, 11.779]
  - - [1472, 320, 1, 1024, 1472, 1472, 1472, 1024]
    - [2, 11.664]
  - - [1600, 320, 1, 1024, 1600, 1600, 1600, 1024]
    - [2, 11.636]
  - - [1728, 320, 1, 1024, 1728, 1728, 1728, 1024]
    - [2, 11.712]
  - - [1856, 320, 1, 1024, 1856, 1856, 1856, 1024]
    - [0, 11.722]
  - - [1984, 320, 1, 1024, 1984, 1984, 1984, 1024]
    - [0, 12.132]
  - - [2112, 320, 1, 1024, 2112, 2112, 2112, 1024]
    - [2, 12.09]
  - - [2240, 320, 1, 1024, 2240, 2240, 2240, 1024]
    - [2, 12.015]
  - - [2368, 320, 1, 1024, 2368, 2368, 2368, 1024]
    - [2, 12.025]
  - - [2496, 320, 1, 1024, 2496, 2496, 2496, 1024]
    - [2, 12.222]
  - - [2624, 320, 1, 1024, 2624, 2624, 2624, 1024]
    - [2, 12.126]
  - - [2752, 320, 1, 1024, 2752, 2752, 2752, 1024]
    - [0, 12.187]
  - - [2880, 320, 1, 1024, 2880, 2880, 2880, 1024]
    - [0, 12.306]
  - - [3008, 320, 1, 1024, 3008, 3008, 3008, 1024]
    - [2, 12.297]
  - - [3136, 320, 1, 1024, 3136, 3136, 3136, 1024]
    - [2, 12.361]
  - - [3264, 320, 1, 1024, 3264, 3264, 3264, 1024]
    - [2, 12.336]
  - - [3392, 320, 1, 1024, 3392, 3392, 3392, 1024]
    - [2, 12.414]
  - - [3520, 320, 1, 1024, 3520, 3520, 3520, 1024]
    - [2, 12.43]
  - - [3648, 320, 1, 1024, 3648, 3648, 3648, 1024]
    - [0, 12.412]
  - - [3776, 320, 1, 1024, 3776, 3776, 3776, 1024]
    - [2, 12.389]
  - - [3904, 320, 1, 1024, 3904, 3904, 3904, 1024]
    - [2, 12.593]
  - - [4032, 320, 1, 1024, 4032, 4032, 4032, 1024]
    - [2, 12.6]
  - - [64, 448, 1, 1024, 64, 64, 64, 1024]
    - [2, 3.676]
  - - [192, 448, 1, 1024, 192, 192, 192, 1024]
    - [0, 8.194]
  - - [320, 448, 1, 1024, 320, 320, 320, 1024]
    - [0, 9.954]
  - - [448, 448, 1, 1024, 448, 448, 448, 1024]
    - [2, 9.693]
  - - [576, 448, 1, 1024, 576, 576, 576, 1024]
    - [2, 11.04]
  - - [704, 448, 1, 1024, 704, 704, 704, 1024]
    - [2, 11.178]
  - - [832, 448, 1, 1024, 832, 832, 832, 1024]
    - [2, 11.395]
  - - [960, 448, 1, 1024, 960, 960, 960, 1024]
    - [2, 11.735]
  - - [1088, 448, 1, 1024, 1088, 1088, 1088, 1024]
    - [0, 11.961]
  - - [1216, 448, 1, 1024, 1216, 1216, 1216, 1024]
    - [2, 11.919]
  - - [1344, 448, 1, 1024, 1344, 1344, 1344, 1024]
    - [2, 12.015]
  - - [1472, 448, 1, 1024, 1472, 1472, 1472, 1024]
    - [2, 11.836]
  - - [1600, 448, 1, 1024, 1600, 1600, 1600, 1024]
    - [0, 11.901]
  - - [1728, 448, 1, 1024, 1728, 1728, 1728, 1024]
    - [2, 12.017]
  - - [1856, 448, 1, 1024, 1856, 1856, 1856, 1024]
    - [2, 12.273]
  - - [1984, 448, 1, 1024, 1984, 1984, 1984, 1024]
    - [2, 12.271]
  - - [2112, 448, 1, 1024, 2112, 2112, 2112, 1024]
    - [2, 12.229]
  - - [2240, 448, 1, 1024, 2240, 2240, 2240, 1024]
    - [2, 12.514]
  - - [2368, 448, 1, 1024, 2368, 2368, 2368, 1024]
    - [2, 12.395]
  - - [2496, 448, 1, 1024, 2496, 2496, 2496, 1024]
    - [2, 12.411]
  - - [2624, 448, 1, 1024, 2624, 2624, 2624, 1024]
    - [2, 12.445]
  - - [2752, 448, 1, 1024, 2752, 2752, 2752, 1024]
    - [2, 12.567]
  - - [2880, 448, 1, 1024, 2880, 2880, 2880, 1024]
    - [2, 12.459]
  - - [3008, 448, 1, 1024, 3008, 3008, 3008, 1024]
    - [2, 12.488]
  - - [3136, 448, 1, 1024, 3136, 3136, 3136, 1024]
    - [2, 12.601]
  - - [3264, 448, 1, 1024, 3264, 3264, 3264, 1024]
    - [2, 12.664]
  - - [3392, 448, 1, 1024, 3392, 3392, 3392, 1024]
    - [0, 12.566]
  - - [3520, 448, 1, 1024, 3520, 3520, 3520, 1024]
    - [2, 12.683]
  - - [3648, 448, 1, 1024, 3648, 3648, 3648, 1024]
    - [2, 12.745]
  - - [3776, 448, 1, 1024, 3776, 3776, 3776, 1024]
    - [2, 12.772]
  - - [3904, 448, 1, 1024, 3904, 3904, 3904, 1024]
    - [2, 12.723]
  - - [4032, 448, 1, 1024, 4032, 4032, 4032, 1024]
    - [2, 12.769]
  - - [64, 576, 1, 1024, 64, 64, 64, 1024]
    - [0, 5.42]
  - - [192, 576, 1, 1024, 192, 192, 192, 1024]
    - [2, 8.396]
  - - [320, 576, 1, 1024, 320, 320, 320, 1024]
    - [0, 10.041]
  - - [448, 576, 1, 1024, 448, 448, 448, 1024]
    - [2, 10.921]
  - - [576, 576, 1, 1024, 576, 576, 576, 1024]
    - [0, 11.665]
  - - [704, 576, 1, 1024, 704, 704, 704, 1024]
    - [2, 11.596]
  - - [832, 576, 1, 1024, 832, 832, 832, 1024]
    - [0, 11.838]
  - - [960, 576, 1, 1024, 960, 960, 960, 1024]
    - [2, 11.778]
  - - [1088, 576, 1, 1024, 1088, 1088, 1088, 1024]
    - [0, 11.789]
  - - [1216, 576, 1, 1024, 1216, 1216, 1216, 1024]
    - [2, 11.866]
  - - [1344, 576, 1, 1024, 1344, 1344, 1344, 1024]
    - [2, 12.075]
  - - [1472, 576, 1, 1024, 1472, 1472, 1472, 1024]
    - [2, 12.32]
  - - [1600, 576, 1, 1024, 1600, 1600, 1600, 1024]
    - [0, 12.271]
  - - [1728, 576, 1, 1024, 1728, 1728, 1728, 1024]
    - [2, 12.244]
  - - [1856, 576, 1, 1024, 1856, 1856, 1856, 1024]
    - [2, 12.4]
  - - [1984, 576, 1, 1024, 1984, 1984, 1984, 1024]
    - [2, 12.52]
  - - [2112, 576, 1, 1024, 2112, 2112, 2112, 1024]
    - [2, 12.514]
  - - [2240, 576, 1, 1024, 2240, 2240, 2240, 1024]
    - [2, 12.393]
  - - [2368, 576, 1, 1024, 2368, 2368, 2368, 1024]
    - [2, 12.543]
  - - [2496, 576, 1, 1024, 2496, 2496, 2496, 1024]
    - [2, 12.754]
  - - [2624, 576, 1, 1024, 2624, 2624, 2624, 1024]
    - [2, 12.707]
  - - [2752, 576, 1, 1024, 2752, 2752, 2752, 1024]
    - [2, 12.647]
  - - [2880, 576, 1, 1024, 2880, 2880, 2880, 1024]
    - [2, 12.689]
  - - [3008, 576, 1, 1024, 3008, 3008, 3008, 1024]
    - [2, 12.636]
  - - [3136, 576, 1, 1024, 3136, 3136, 3136, 1024]
    - [2, 12.757]
  - - [3264, 576, 1, 1024, 3264, 3264, 3264, 1024]
    - [2, 12.888]
  - - [3392, 576, 1, 1024, 3392, 3392, 3392, 1024]
    - [2, 12.854]
  - - [3520, 576, 1, 1024, 3520, 3520, 3520, 1024]
    - [2, 13.089]
  - - [3648, 576, 1, 1024, 3648, 3648, 3648, 1024]
    - [2, 13.01]
  - - [3776, 576, 1, 1024, 3776, 3776, 3776, 1024]
    - [2, 12.974]
  - - [3904, 576, 1, 1024, 3904, 3904, 3904, 1024]
    - [2, 13.026]
  - - [4032, 576, 1, 1024, 4032, 4032, 4032, 1024]
    - [2, 13.057]
  - - [64, 704, 1, 1024, 64, 64, 64, 1024]
    - [0, 6.618]
  - - [192, 704, 1, 1024, 192, 192, 192, 1024]
    - [0, 9.331]
  - - [320, 704, 1, 1024, 320, 320, 320, 1024]
    - [2, 10.659]
  - - [448, 704, 1, 1024, 448, 448, 448, 1024]
    - [2, 11.376]
  - - [576, 704, 1, 1024, 576, 576, 576, 1024]
    - [2, 11.488]
  - - [704, 704, 1, 1024, 704, 704, 704, 1024]
    - [2, 11.712]
  - - [832, 704, 1, 1024, 832, 832, 832, 1024]
    - [2, 11.922]
  - - [960, 704, 1, 1024, 960, 960, 960, 1024]
    - [0, 12.085]
  - - [1088, 704, 1, 1024, 1088, 1088, 1088, 1024]
    - [2, 11.982]
  - - [1216, 704, 1, 1024, 1216, 1216, 1216, 1024]
    - [2, 12.096]
  - - [1344, 704, 1, 1024, 1344, 1344, 1344, 1024]
    - [2, 12.228]
  - - [1472, 704, 1, 1024, 1472, 1472, 1472, 1024]
    - [2, 12.383]
  - - [1600, 704, 1, 1024, 1600, 1600, 1600, 1024]
    - [2, 12.416]
  - - [1728, 704, 1, 1024, 1728, 1728, 1728, 1024]
    - [2, 12.415]
  - - [1856, 704, 1, 1024, 1856, 1856, 1856, 1024]
    - [0, 12.453]
  - - [1984, 704, 1, 1024, 1984, 1984, 1984, 1024]
    - [2, 12.556]
  - - [2112, 704, 1, 1024, 2112, 2112, 2112, 1024]
    - [2, 12.598]
  - - [2240, 704, 1, 1024, 2240, 2240, 2240, 1024]
    - [2, 12.661]
  - - [2368, 704, 1, 1024, 2368, 2368, 2368, 1024]
    - [2, 12.734]
  - - [2496, 704, 1, 1024, 2496, 2496, 2496, 1024]
    - [2, 12.802]
  - - [2624, 704, 1, 1024, 2624, 2624, 2624, 1024]
    - [2, 12.78]
  - - [2752, 704, 1, 1024, 2752, 2752, 2752, 1024]
    - [2, 12.73]
  - - [2880, 704, 1, 1024, 2880, 2880, 2880, 1024]
    - [2, 12.878]
  - - [3008, 704, 1, 1024, 3008, 3008, 3008, 1024]
    - [2, 12.861]
  - - [3136, 704, 1, 1024, 3136, 3136, 3136, 1024]
    - [2, 12.87]
  - - [3264, 704, 1, 1024, 3264, 3264, 3264, 1024]
    - [2, 13.135]
  - - [3392, 704, 1, 1024, 3392, 3392, 3392, 1024]
    - [2, 13.025]
  - - [3520, 704, 1, 1024, 3520, 3520, 3520, 1024]
    - [2, 13.061]
  - - [3648, 704, 1, 1024, 3648, 3648, 3648, 1024]
    - [2, 13.006]
  - - [3776, 704, 1, 1024, 3776, 3776, 3776, 1024]
    - [2, 13.046]
  - - [3904, 704, 1, 1024, 3904, 3904, 3904, 1024]
    - [2, 13.115]
  - - [4032, 704, 1, 1024, 4032, 4032, 4032, 1024]
    - [2, 13.191]
  - - [64, 832, 1, 1024, 64, 64, 64, 1024]
    - [2, 5.849]
  - - [192, 832, 1, 1024, 192, 192, 192, 1024]
    - [2, 9.3]
  - - [320, 832, 1, 1024, 320, 320, 320, 1024]
    - [2, 11.0]
  - - [448, 832, 1, 1024, 448, 448, 448, 1024]
    - [2, 11.568]
  - - [576, 832, 1, 1024, 576, 576, 576, 1024]
    - [0, 11.794]
  - - [704, 832, 1, 1024, 704, 704, 704, 1024]
    - [0, 11.915]
  - - [832, 832, 1, 1024, 832, 832, 832, 1024]
    - [2, 11.919]
  - - [960, 832, 1, 1024, 960, 960, 960, 1024]
    - [2, 12.073]
  - - [1088, 832, 1, 1024, 1088, 1088, 1088, 1024]
    - [2, 12.268]
  - - [1216, 832, 1, 1024, 1216, 1216, 1216, 1024]
    - [2, 12.369]
  - - [1344, 832, 1, 1024, 1344, 1344, 1344, 1024]
    - [2, 12.456]
  - - [1472, 832, 1, 1024, 1472, 1472, 1472, 1024]
    - [2, 12.591]
  - - [1600, 832, 1, 1024, 1600, 1600, 1600, 1024]
    - [2, 12.686]
  - - [1728, 832, 1, 1024, 1728, 1728, 1728, 1024]
    - [0, 12.682]
  - - [1856, 832, 1, 1024, 1856, 1856, 1856, 1024]
    - [2, 12.712]
  - - [1984, 832, 1, 1024, 1984, 1984, 1984, 1024]
    - [2, 12.827]
  - - [2112, 832, 1, 1024, 2112, 2112, 2112, 1024]
    - [2, 12.766]
  - - [2240, 832, 1, 1024, 2240, 2240, 2240, 1024]
    - [2, 12.969]
  - - [2368, 832, 1, 1024, 2368, 2368, 2368, 1024]
    - [2, 12.863]
  - - [2496, 832, 1, 1024, 2496, 2496, 2496, 1024]
    - [2, 12.975]
  - - [2624, 832, 1, 1024, 2624, 2624, 2624, 1024]
    - [2, 13.18]
  - - [2752, 832, 1, 1024, 2752, 2752, 2752, 1024]
    - [2, 12.974]
  - - [2880, 832, 1, 1024, 2880, 2880, 2880, 1024]
    - [2, 13.051]
  - - [3008, 832, 1, 1024, 3008, 3008, 3008, 1024]
    - [2, 13.03]
  - - [3136, 832, 1, 1024, 3136, 3136, 3136, 1024]
    - [2, 13.008]
  - - [3264, 832, 1, 1024, 3264, 3264, 3264, 1024]
    - [2, 13.151]
  - - [3392, 832, 1, 1024, 3392, 3392, 3392, 1024]
    - [2, 13.118]
  - - [3520, 832, 1, 1024, 3520, 3520, 3520, 1024]
    - [2, 13.207]
  - - [3648, 832, 1, 1024, 3648, 3648, 3648, 1024]
    - [2, 13.167]
  - - [3776, 832, 1, 1024, 3776, 3776, 3776, 1024]
    - [2, 13.169]
  - - [3904, 832, 1, 1024, 3904, 3904, 3904, 1024]
    - [2, 13.087]
  - - [4032, 832, 1, 1024, 4032, 4032, 4032, 1024]
    - [2, 13.316]
  - - [64, 960, 1, 1024, 64, 64, 64, 1024]
    - [2, 6.699]
  - - [192, 960, 1, 1024, 192, 192, 192, 1024]
    - [0, 10.041]
  - - [320, 960, 1, 1024, 320, 320, 320, 1024]
    - [2, 11.313]
  - - [448, 960, 1, 1024, 448, 448, 448, 1024]
    - [0, 11.922]
  - - [576, 960, 1, 1024, 576, 576, 576, 1024]
    - [2, 12.038]
  - - [704, 960, 1, 1024, 704, 704, 704, 1024]
    - [2, 12.228]
  - - [832, 960, 1, 1024, 832, 832, 832, 1024]
    - [2, 11.96]
  - - [960, 960, 1, 1024, 960, 960, 960, 1024]
    - [0, 12.254]
  - - [1088, 960, 1, 1024, 1088, 1088, 1088, 1024]
    - [2, 12.666]
  - - [1216, 960, 1, 1024, 1216, 1216, 1216, 1024]
    - [2, 12.459]
  - - [1344, 960, 1, 1024, 1344, 1344, 1344, 1024]
    - [2, 12.528]
  - - [1472, 960, 1, 1024, 1472, 1472, 1472, 1024]
    - [0, 12.392]
  - - [1600, 960, 1, 1024, 1600, 1600, 1600, 1024]
    - [2, 12.775]
  - - [1728, 960, 1, 1024, 1728, 1728, 1728, 1024]
    - [2, 12.81]
  - - [1856, 960, 1, 1024, 1856, 1856, 1856, 1024]
    - [2, 12.809]
  - - [1984, 960, 1, 1024, 1984, 1984, 1984, 1024]
    - [2, 12.896]
  - - [2112, 960, 1, 1024, 2112, 2112, 2112, 1024]
    - [2, 13.163]
  - - [2240, 960, 1, 1024, 2240, 2240, 2240, 1024]
    - [2, 13.039]
  - - [2368, 960, 1, 1024, 2368, 2368, 2368, 1024]
    - [2, 13.094]
  - - [2496, 960, 1, 1024, 2496, 2496, 2496, 1024]
    - [2, 13.077]
  - - [2624, 960, 1, 1024, 2624, 2624, 2624, 1024]
    - [2, 13.073]
  - - [2752, 960, 1, 1024, 2752, 2752, 2752, 1024]
    - [2, 13.129]
  - - [2880, 960, 1, 1024, 2880, 2880, 2880, 1024]
    - [2, 13.069]
  - - [3008, 960, 1, 1024, 3008, 3008, 3008, 1024]
    - [2, 13.052]
  - - [3136, 960, 1, 1024, 3136, 3136, 3136, 1024]
    - [2, 13.22]
  - - [3264, 960, 1, 1024, 3264, 3264, 3264, 1024]
    - [2, 13.176]
  - - [3392, 960, 1, 1024, 3392, 3392, 3392, 1024]
    - [2, 13.313]
  - - [3520, 960, 1, 1024, 3520, 3520, 3520, 1024]
    - [2, 13.207]
  - - [3648, 960, 1, 1024, 3648, 3648, 3648, 1024]
    - [2, 13.226]
  - - [3776, 960, 1, 1024, 3776, 3776, 3776, 1024]
    - [2, 13.152]
  - - [3904, 960, 1, 1024, 3904, 3904, 3904, 1024]
    - [2, 13.321]
  - - [4032, 960, 1, 1024, 4032, 4032, 4032, 1024]
    - [2, 13.281]
  - - [64, 1088, 1, 1024, 64, 64, 64, 1024]
    - [2, 7.58]
  - - [192, 1088, 1, 1024, 192, 192, 192, 1024]
    - [2, 9.878]
  - - [320, 1088, 1, 1024, 320, 320, 320, 1024]
    - [2, 11.281]
  - - [448, 1088, 1, 1024, 448, 448, 448, 1024]
    - [0, 12.011]
  - - [576, 1088, 1, 1024, 576, 576, 576, 1024]
    - [0, 11.973]
  - - [704, 1088, 1, 1024, 704, 704, 704, 1024]
    - [2, 12.245]
  - - [832, 1088, 1, 1024, 832, 832, 832, 1024]
    - [2, 12.312]
  - - [960, 1088, 1, 1024, 960, 960, 960, 1024]
    - [2, 12.385]
  - - [1088, 1088, 1, 1024, 1088, 1088, 1088, 1024]
    - [2, 12.474]
  - - [1216, 1088, 1, 1024, 1216, 1216, 1216, 1024]
    - [2, 12.647]
  - - [1344, 1088, 1, 1024, 1344, 1344, 1344, 1024]
    - [2, 12.813]
  - - [1472, 1088, 1, 1024, 1472, 1472, 1472, 1024]
    - [2, 12.931]
  - - [1600, 1088, 1, 1024, 1600, 1600, 1600, 1024]
    - [2, 12.805]
  - - [1728, 1088, 1, 1024, 1728, 1728, 1728, 1024]
    - [2, 12.905]
  - - [1856, 1088, 1, 1024, 1856, 1856, 1856, 1024]
    - [2, 13.005]
  - - [1984, 1088, 1, 1024, 1984, 1984, 1984, 1024]
    - [2, 12.97]
  - - [2112, 1088, 1, 1024, 2112, 2112, 2112, 1024]
    - [2, 13.038]
  - - [2240, 1088, 1, 1024, 2240, 2240, 2240, 1024]
    - [2, 12.943]
  - - [2368, 1088, 1, 1024, 2368, 2368, 2368, 1024]
    - [2, 13.115]
  - - [2496, 1088, 1, 1024, 2496, 2496, 2496, 1024]
    - [2, 13.021]
  - - [2624, 1088, 1, 1024, 2624, 2624, 2624, 1024]
    - [2, 13.221]
  - - [2752, 1088, 1, 1024, 2752, 2752, 2752, 1024]
    - [2, 13.078]
  - - [2880, 1088, 1, 1024, 2880, 2880, 2880, 1024]
    - [2, 13.199]
  - - [3008, 1088, 1, 1024, 3008, 3008, 3008, 1024]
    - [2, 13.189]
  - - [3136, 1088, 1, 1024, 3136, 3136, 3136, 1024]
    - [2, 13.241]
  - - [3264, 1088, 1, 1024, 3264, 3264, 3264, 1024]
    - [2, 13.275]
  - - [3392, 1088, 1, 1024, 3392, 3392, 3392, 1024]
    - [2, 13.206]
  - - [3520, 1088, 1, 1024, 3520, 3520, 3520, 1024]
    - [2, 13.257]
  - - [3648, 1088, 1, 1024, 3648, 3648, 3648, 1024]
    - [2, 13.256]
  - - [3776, 1088, 1, 1024, 3776, 3776, 3776, 1024]
    - [2, 13.375]
  - - [3904, 1088, 1, 1024, 3904, 3904, 3904, 1024]
    - [2, 13.393]
  - - [4032, 1088, 1, 1024, 4032, 4032, 4032, 1024]
    - [2, 13.451]
  - - [64, 1216, 1, 1024, 64, 64, 64, 1024]
    - [0, 7.415]
  - - [192, 1216, 1, 1024, 192, 192, 192, 1024]
    - [0, 10.774]
  - - [320, 1216, 1, 1024, 320, 320, 320, 1024]
    - [0, 11.871]
  - - [448, 1216, 1, 1024, 448, 448, 448, 1024]
    - [0, 11.813]
  - - [576, 1216, 1, 1024, 576, 576, 576, 1024]
    - [0, 11.945]
  - - [704, 1216, 1, 1024, 704, 704, 704, 1024]
    - [2, 12.44]
  - - [832, 1216, 1, 1024, 832, 832, 832, 1024]
    - [2, 12.416]
  - - [960, 1216, 1, 1024, 960, 960, 960, 1024]
    - [2, 12.525]
  - - [1088, 1216, 1, 1024, 1088, 1088, 1088, 1024]
    - [2, 12.644]
  - - [1216, 1216, 1, 1024, 1216, 1216, 1216, 1024]
    - [0, 12.716]
  - - [1344, 1216, 1, 1024, 1344, 1344, 1344, 1024]
    - [2, 12.729]
  - - [1472, 1216, 1, 1024, 1472, 1472, 1472, 1024]
    - [2, 12.765]
  - - [1600, 1216, 1, 1024, 1600, 1600, 1600, 1024]
    - [2, 13.073]
  - - [1728, 1216, 1, 1024, 1728, 1728, 1728, 1024]
    - [2, 13.013]
  - - [1856, 1216, 1, 1024, 1856, 1856, 1856, 1024]
    - [2, 12.998]
  - - [1984, 1216, 1, 1024, 1984, 1984, 1984, 1024]
    - [2, 12.892]
  - - [2112, 1216, 1, 1024, 2112, 2112, 2112, 1024]
    - [2, 13.088]
  - - [2240, 1216, 1, 1024, 2240, 2240, 2240, 1024]
    - [2, 13.056]
  - - [2368, 1216, 1, 1024, 2368, 2368, 2368, 1024]
    - [2, 13.153]
  - - [2496, 1216, 1, 1024, 2496, 2496, 2496, 1024]
    - [2, 13.141]
  - - [2624, 1216, 1, 1024, 2624, 2624, 2624, 1024]
    - [2, 13.229]
  - - [2752, 1216, 1, 1024, 2752, 2752, 2752, 1024]
    - [2, 13.245]
  - - [2880, 1216, 1, 1024, 2880, 2880, 2880, 1024]
    - [2, 13.253]
  - - [3008, 1216, 1, 1024, 3008, 3008, 3008, 1024]
    - [2, 13.259]
  - - [3136, 1216, 1, 1024, 3136, 3136, 3136, 1024]
    - [2, 13.268]
  - - [3264, 1216, 1, 1024, 3264, 3264, 3264, 1024]
    - [2, 13.271]
  - - [3392, 1216, 1, 1024, 3392, 3392, 3392, 1024]
    - [2, 13.442]
  - - [3520, 1216, 1, 1024, 3520, 3520, 3520, 1024]
    - [2, 13.407]
  - - [3648, 1216, 1, 1024, 3648, 3648, 3648, 1024]
    - [2, 13.382]
  - - [3776, 1216, 1, 1024, 3776, 3776, 3776, 1024]
    - [2, 13.388]
  - - [3904, 1216, 1, 1024, 3904, 3904, 3904, 1024]
    - [2, 13.42]
  - - [4032, 1216, 1, 1024, 4032, 4032, 4032, 1024]
    - [2, 13.448]
  - - [64, 1344, 1, 1024, 64, 64, 64, 1024]
    - [0, 8.094]
  - - [192, 1344, 1, 1024, 192, 192, 192, 1024]
    - [2, 10.701]
  - - [320, 1344, 1, 1024, 320, 320, 320, 1024]
    - [0, 11.924]
  - - [448, 1344, 1, 1024, 448, 448, 448, 1024]
    - [2, 11.998]
  - - [576, 1344, 1, 1024, 576, 576, 576, 1024]
    - [2, 12.203]
  - - [704, 1344, 1, 1024, 704, 704, 704, 1024]
    - [2, 12.29]
  - - [832, 1344, 1, 1024, 832, 832, 832, 1024]
    - [2, 12.36]
  - - [960, 1344, 1, 1024, 960, 960, 960, 1024]
    - [2, 12.575]
  - - [1088, 1344, 1, 1024, 1088, 1088, 1088, 1024]
    - [2, 12.779]
  - - [1216, 1344, 1, 1024, 1216, 1216, 1216, 1024]
    - [2, 12.577]
  - - [1344, 1344, 1, 1024, 1344, 1344, 1344, 1024]
    - [2, 12.787]
  - - [1472, 1344, 1, 1024, 1472, 1472, 1472, 1024]
    - [2, 12.96]
  - - [1600, 1344, 1, 1024, 1600, 1600, 1600, 1024]
    - [2, 12.89]
  - - [1728, 1344, 1, 1024, 1728, 1728, 1728, 1024]
    - [2, 13.006]
  - - [1856, 1344, 1, 1024, 1856, 1856, 1856, 1024]
    - [2, 13.106]
  - - [1984, 1344, 1, 1024, 1984, 1984, 1984, 1024]
    - [2, 13.046]
  - - [2112, 1344, 1, 1024, 2112, 2112, 2112, 1024]
    - [2, 13.011]
  - - [2240, 1344, 1, 1024, 2240, 2240, 2240, 1024]
    - [2, 13.171]
  - - [2368, 1344, 1, 1024, 2368, 2368, 2368, 1024]
    - [2, 13.161]
  - - [2496, 1344, 1, 1024, 2496, 2496, 2496, 1024]
    - [2, 13.197]
  - - [2624, 1344, 1, 1024, 2624, 2624, 2624, 1024]
    - [2, 13.251]
  - - [2752, 1344, 1, 1024, 2752, 2752, 2752, 1024]
    - [2, 13.323]
  - - [2880, 1344, 1, 1024, 2880, 2880, 2880, 1024]
    - [2, 13.295]
  - - [3008, 1344, 1, 1024, 3008, 3008, 3008, 1024]
    - [2, 13.318]
  - - [3136, 1344, 1, 1024, 3136, 3136, 3136, 1024]
    - [2, 13.259]
  - - [3264, 1344, 1, 1024, 3264, 3264, 3264, 1024]
    - [2, 13.291]
  - - [3392, 1344, 1, 1024, 3392, 3392, 3392, 1024]
    - [2, 13.355]
  - - [3520, 1344, 1, 1024, 3520, 3520, 3520, 1024]
    - [2, 13.417]
  - - [3648, 1344, 1, 1024, 3648, 3648, 3648, 1024]
    - [2, 13.412]
  - - [3776, 1344, 1, 1024, 3776, 3776, 3776, 1024]
    - [2, 13.483]
  - - [3904, 1344, 1, 1024, 3904, 3904, 3904, 1024]
    - [2, 13.469]
  - - [4032, 1344, 1, 1024, 4032, 4032, 4032, 1024]
    - [2, 13.476]
  - - [64, 1472, 1, 1024, 64, 64, 64, 1024]
    - [0, 8.816]
  - - [192, 1472, 1, 1024, 192, 192, 192, 1024]
    - [0, 11.018]
  - - [320, 1472, 1, 1024, 320, 320, 320, 1024]
    - [2, 11.841]
  - - [448, 1472, 1, 1024, 448, 448, 448, 1024]
    - [2, 12.124]
  - - [576, 1472, 1, 1024, 576, 576, 576, 1024]
    - [2, 12.311]
  - - [704, 1472, 1, 1024, 704, 704, 704, 1024]
    - [2, 12.473]
  - - [832, 1472, 1, 1024, 832, 832, 832, 1024]
    - [0, 12.589]
  - - [960, 1472, 1, 1024, 960, 960, 960, 1024]
    - [2, 12.852]
  - - [1088, 1472, 1, 1024, 1088, 1088, 1088, 1024]
    - [2, 12.745]
  - - [1216, 1472, 1, 1024, 1216, 1216, 1216, 1024]
    - [2, 12.801]
  - - [1344, 1472, 1, 1024, 1344, 1344, 1344, 1024]
    - [2, 12.83]
  - - [1472, 1472, 1, 1024, 1472, 1472, 1472, 1024]
    - [2, 12.914]
  - - [1600, 1472, 1, 1024, 1600, 1600, 1600, 1024]
    - [2, 12.997]
  - - [1728, 1472, 1, 1024, 1728, 1728, 1728, 1024]
    - [2, 13.077]
  - - [1856, 1472, 1, 1024, 1856, 1856, 1856, 1024]
    - [2, 13.104]
  - - [1984, 1472, 1, 1024, 1984, 1984, 1984, 1024]
    - [2, 13.134]
  - - [2112, 1472, 1, 1024, 2112, 2112, 2112, 1024]
    - [2, 13.226]
  - - [2240, 1472, 1, 1024, 2240, 2240, 2240, 1024]
    - [2, 13.237]
  - - [2368, 1472, 1, 1024, 2368, 2368, 2368, 1024]
    - [2, 13.201]
  - - [2496, 1472, 1, 1024, 2496, 2496, 2496, 1024]
    - [2, 13.295]
  - - [2624, 1472, 1, 1024, 2624, 2624, 2624, 1024]
    - [2, 13.27]
  - - [2752, 1472, 1, 1024, 2752, 2752, 2752, 1024]
    - [2, 13.267]
  - - [2880, 1472, 1, 1024, 2880, 2880, 2880, 1024]
    - [2, 13.325]
  - - [3008, 1472, 1, 1024, 3008, 3008, 3008, 1024]
    - [2, 13.326]
  - - [3136, 1472, 1, 1024, 3136, 3136, 3136, 1024]
    - [2, 13.328]
  - - [3264, 1472, 1, 1024, 3264, 3264, 3264, 1024]
    - [2, 13.398]
  - - [3392, 1472, 1, 1024, 3392, 3392, 3392, 1024]
    - [2, 13.306]
  - - [3520, 1472, 1, 1024, 3520, 3520, 3520, 1024]
    - [2, 13.391]
  - - [3648, 1472, 1, 1024, 3648, 3648, 3648, 1024]
    - [2, 13.464]
  - - [3776, 1472, 1, 1024, 3776, 3776, 3776, 1024]
    - [2, 13.513]
  - - [3904, 1472, 1, 1024, 3904, 3904, 3904, 1024]
    - [2, 13.515]
  - - [4032, 1472, 1, 1024, 4032, 4032, 4032, 1024]
    - [2, 13.57]
  - - [64, 1600, 1, 1024, 64, 64, 64, 1024]
    - [2, 7.763]
  - - [192, 1600, 1, 1024, 192, 192, 192, 1024]
    - [2, 11.234]
  - - [320, 1600, 1, 1024, 320, 320, 320, 1024]
    - [2, 11.816]
  - - [448, 1600, 1, 1024, 448, 448, 448, 1024]
    - [2, 12.04]
  - - [576, 1600, 1, 1024, 576, 576, 576, 1024]
    - [0, 12.19]
  - - [704, 1600, 1, 1024, 704, 704, 704, 1024]
    - [0, 12.534]
  - - [832, 1600, 1, 1024, 832, 832, 832, 1024]
    - [2, 12.705]
  - - [960, 1600, 1, 1024, 960, 960, 960, 1024]
    - [2, 12.652]
  - - [1088, 1600, 1, 1024, 1088, 1088, 1088, 1024]
    - [2, 12.813]
  - - [1216, 1600, 1, 1024, 1216, 1216, 1216, 1024]
    - [2, 12.838]
  - - [1344, 1600, 1, 1024, 1344, 1344, 1344, 1024]
    - [2, 12.889]
  - - [1472, 1600, 1, 1024, 1472, 1472, 1472, 1024]
    - [2, 13.01]
  - - [1600, 1600, 1, 1024, 1600, 1600, 1600, 1024]
    - [2, 13.136]
  - - [1728, 1600, 1, 1024, 1728, 1728, 1728, 1024]
    - [2, 13.114]
  - - [1856, 1600, 1, 1024, 1856, 1856, 1856, 1024]
    - [2, 13.1]
  - - [1984, 1600, 1, 1024, 1984, 1984, 1984, 1024]
    - [2, 13.103]
  - - [2112, 1600, 1, 1024, 2112, 2112, 2112, 1024]
    - [2, 13.156]
  - - [2240, 1600, 1, 1024, 2240, 2240, 2240, 1024]
    - [2, 13.242]
  - - [2368, 1600, 1, 1024, 2368, 2368, 2368, 1024]
    - [2, 13.297]
  - - [2496, 1600, 1, 1024, 2496, 2496, 2496, 1024]
    - [2, 13.255]
  - - [2624, 1600, 1, 1024, 2624, 2624, 2624, 1024]
    - [2, 13.298]
  - - [2752, 1600, 1, 1024, 2752, 2752, 2752, 1024]
    - [2, 13.225]
  - - [2880, 1600, 1, 1024, 2880, 2880, 2880, 1024]
    - [2, 13.342]
  - - [3008, 1600, 1, 1024, 3008, 3008, 3008, 1024]
    - [2, 13.306]
  - - [3136, 1600, 1, 1024, 3136, 3136, 3136, 1024]
    - [2, 13.377]
  - - [3264, 1600, 1, 1024, 3264, 3264, 3264, 1024]
    - [2, 13.45]
  - - [3392, 1600, 1, 1024, 3392, 3392, 3392, 1024]
    - [2, 13.49]
  - - [3520, 1600, 1, 1024, 3520, 3520, 3520, 1024]
    - [2, 13.601]
  - - [3648, 1600, 1, 1024, 3648, 3648, 3648, 1024]
    - [2, 13.568]
  - - [3776, 1600, 1, 1024, 3776, 3776, 3776, 1024]
    - [2, 13.576]
  - - [3904, 1600, 1, 1024, 3904, 3904, 3904, 1024]
    - [2, 13.618]
  - - [4032, 1600, 1, 1024, 4032, 4032, 4032, 1024]
    - [2, 13.567]
  - - [64, 1728, 1, 1024, 64, 64, 64, 1024]
    - [2, 8.334]
  - - [192, 1728, 1, 1024, 192, 192, 192, 1024]
    - [0, 11.452]
  - - [320, 1728, 1, 1024, 320, 320, 320, 1024]
    - [2, 11.611]
  - - [448, 1728, 1, 1024, 448, 448, 448, 1024]
    - [0, 12.17]
  - - [576, 1728, 1, 1024, 576, 576, 576, 1024]
    - [2, 12.381]
  - - [704, 1728, 1, 1024, 704, 704, 704, 1024]
    - [2, 12.656]
  - - [832, 1728, 1, 1024, 832, 832, 832, 1024]
    - [2, 12.613]
  - - [960, 1728, 1, 1024, 960, 960, 960, 1024]
    - [2, 12.718]
  - - [1088, 1728, 1, 1024, 1088, 1088, 1088, 1024]
    - [2, 12.796]
  - - [1216, 1728, 1, 1024, 1216, 1216, 1216, 1024]
    - [2, 12.914]
  - - [1344, 1728, 1, 1024, 1344, 1344, 1344, 1024]
    - [2, 12.903]
  - - [1472, 1728, 1, 1024, 1472, 1472, 1472, 1024]
    - [2, 13.034]
  - - [1600, 1728, 1, 1024, 1600, 1600, 1600, 1024]
    - [2, 13.024]
  - - [1728, 1728, 1, 1024, 1728, 1728, 1728, 1024]
    - [2, 13.031]
  - - [1856, 1728, 1, 1024, 1856, 1856, 1856, 1024]
    - [2, 13.15]
  - - [1984, 1728, 1, 1024, 1984, 1984, 1984, 1024]
    - [2, 13.154]
  - - [2112, 1728, 1, 1024, 2112, 2112, 2112, 1024]
    - [2, 13.223]
  - - [2240, 1728, 1, 1024, 2240, 2240, 2240, 1024]
    - [2, 13.198]
  - - [2368, 1728, 1, 1024, 2368, 2368, 2368, 1024]
    - [2, 13.189]
  - - [2496, 1728, 1, 1024, 2496, 2496, 2496, 1024]
    - [2, 13.242]
  - - [2624, 1728, 1, 1024, 2624, 2624, 2624, 1024]
    - [2, 13.37]
  - - [2752, 1728, 1, 1024, 2752, 2752, 2752, 1024]
    - [2, 13.426]
  - - [2880, 1728, 1, 1024, 2880, 2880, 2880, 1024]
    - [2, 13.457]
  - - [3008, 1728, 1, 1024, 3008, 3008, 3008, 1024]
    - [2, 13.357]
  - - [3136, 1728, 1, 1024, 3136, 3136, 3136, 1024]
    - [2, 13.467]
  - - [3264, 1728, 1, 1024, 3264, 3264, 3264, 1024]
    - [2, 13.497]
  - - [3392, 1728, 1, 1024, 3392, 3392, 3392, 1024]
    - [2, 13.495]
  - - [3520, 1728, 1, 1024, 3520, 3520, 3520, 1024]
    - [2, 13.594]
  - - [3648, 1728, 1, 1024, 3648, 3648, 3648, 1024]
    - [2, 13.571]
  - - [3776, 1728, 1, 1024, 3776, 3776, 3776, 1024]
    - [2, 13.58]
  - - [3904, 1728, 1, 1024, 3904, 3904, 3904, 1024]
    - [2, 13.666]
  - - [4032, 1728, 1, 1024, 4032, 4032, 4032, 1024]
    - [2, 13.652]
  - - [64, 1856, 1, 1024, 64, 64, 64, 1024]
    - [2, 8.974]
  - - [192, 1856, 1, 1024, 192, 192, 192, 1024]
    - [2, 11.384]
  - - [320, 1856, 1, 1024, 320, 320, 320, 1024]
    - [2, 12.026]
  - - [448, 1856, 1, 1024, 448, 448, 448, 1024]
    - [2, 12.287]
  - - [576, 1856, 1, 1024, 576, 576, 576, 1024]
    - [2, 12.385]
  - - [704, 1856, 1, 1024, 704, 704, 704, 1024]
    - [2, 12.555]
  - - [832, 1856, 1, 1024, 832, 832, 832, 1024]
    - [2, 12.739]
  - - [960, 1856, 1, 1024, 960, 960, 960, 1024]
    - [2, 12.791]
  - - [1088, 1856, 1, 1024, 1088, 1088, 1088, 1024]
    - [2, 12.765]
  - - [1216, 1856, 1, 1024, 1216, 1216, 1216, 1024]
    - [2, 12.874]
  - - [1344, 1856, 1, 1024, 1344, 1344, 1344, 1024]
    - [2, 12.889]
  - - [1472, 1856, 1, 1024, 1472, 1472, 1472, 1024]
    - [2, 13.112]
  - - [1600, 1856, 1, 1024, 1600, 1600, 1600, 1024]
    - [2, 13.078]
  - - [1728, 1856, 1, 1024, 1728, 1728, 1728, 1024]
    - [2, 13.173]
  - - [1856, 1856, 1, 1024, 1856, 1856, 1856, 1024]
    - [2, 13.154]
  - - [1984, 1856, 1, 1024, 1984, 1984, 1984, 1024]
    - [2, 13.263]
  - - [2112, 1856, 1, 1024, 2112, 2112, 2112, 1024]
    - [2, 13.278]
  - - [2240, 1856, 1, 1024, 2240, 2240, 2240, 1024]
    - [2, 13.327]
  - - [2368, 1856, 1, 1024, 2368, 2368, 2368, 1024]
    - [2, 13.274]
  - - [2496, 1856, 1, 1024, 2496, 2496, 2496, 1024]
    - [2, 13.36]
  - - [2624, 1856, 1, 1024, 2624, 2624, 2624, 1024]
    - [2, 13.378]
  - - [2752, 1856, 1, 1024, 2752, 2752, 2752, 1024]
    - [2, 13.363]
  - - [2880, 1856, 1, 1024, 2880, 2880, 2880, 1024]
    - [2, 13.423]
  - - [3008, 1856, 1, 1024, 3008, 3008, 3008, 1024]
    - [2, 13.502]
  - - [3136, 1856, 1, 1024, 3136, 3136, 3136, 1024]
    - [2, 13.555]
  - - [3264, 1856, 1, 1024, 3264, 3264, 3264, 1024]
    - [2, 13.509]
  - - [3392, 1856, 1, 1024, 3392, 3392, 3392, 1024]
    - [2, 13.485]
  - - [3520, 1856, 1, 1024, 3520, 3520, 3520, 1024]
    - [2, 13.685]
  - - [3648, 1856, 1, 1024, 3648, 3648, 3648, 1024]
    - [2, 13.676]
  - - [3776, 1856, 1, 1024, 3776, 3776, 3776, 1024]
    - [2, 13.692]
  - - [3904, 1856, 1, 1024, 3904, 3904, 3904, 1024]
    - [2, 13.715]
  - - [4032, 1856, 1, 1024, 4032, 4032, 4032, 1024]
    - [2, 13.685]
  - - [64, 1984, 1, 1024, 64, 64, 64, 1024]
    - [0, 8.664]
  - - [192, 1984, 1, 1024, 192, 192, 192, 1024]
    - [0, 11.609]
  - - [320, 1984, 1, 1024, 320, 320, 320, 1024]
    - [0, 12.008]
  - - [448, 1984, 1, 1024, 448, 448, 448, 1024]
    - [0, 12.279]
  - - [576, 1984, 1, 1024, 576, 576, 576, 1024]
    - [2, 12.431]
  - - [704, 1984, 1, 1024, 704, 704, 704, 1024]
    - [2, 12.556]
  - - [832, 1984, 1, 1024, 832, 832, 832, 1024]
    - [2, 12.799]
  - - [960, 1984, 1, 1024, 960, 960, 960, 1024]
    - [2, 12.818]
  - - [1088, 1984, 1, 1024, 1088, 1088, 1088, 1024]
    - [2, 12.884]
  - - [1216, 1984, 1, 1024, 1216, 1216, 1216, 1024]
    - [2, 12.973]
  - - [1344, 1984, 1, 1024, 1344, 1344, 1344, 1024]
    - [2, 13.138]
  - - [1472, 1984, 1, 1024, 1472, 1472, 1472, 1024]
    - [2, 13.078]
  - - [1600, 1984, 1, 1024, 1600, 1600, 1600, 1024]
    - [2, 13.108]
  - - [1728, 1984, 1, 1024, 1728, 1728, 1728, 1024]
    - [2, 13.218]
  - - [1856, 1984, 1, 1024, 1856, 1856, 1856, 1024]
    - [2, 13.166]
  - - [1984, 1984, 1, 1024, 1984, 1984, 1984, 1024]
    - [2, 13.189]
  - - [2112, 1984, 1, 1024, 2112, 2112, 2112, 1024]
    - [2, 13.263]
  - - [2240, 1984, 1, 1024, 2240, 2240, 2240, 1024]
    - [2, 13.286]
  - - [2368, 1984, 1, 1024, 2368, 2368, 2368, 1024]
    - [2, 13.319]
  - - [2496, 1984, 1, 1024, 2496, 2496, 2496, 1024]
    - [2, 13.374]
  - - [2624, 1984, 1, 1024, 2624, 2624, 2624, 1024]
    - [2, 13.518]
  - - [2752, 1984, 1, 1024, 2752, 2752, 2752, 1024]
    - [2, 13.454]
  - - [2880, 1984, 1, 1024, 2880, 2880, 2880, 1024]
    - [2, 13.53]
  - - [3008, 1984, 1, 1024, 3008, 3008, 3008, 1024]
    - [2, 13.601]
  - - [3136, 1984, 1, 1024, 3136, 3136, 3136, 1024]
    - [2, 13.503]
  - - [3264, 1984, 1, 1024, 3264, 3264, 3264, 1024]
    - [2, 13.543]
  - - [3392, 1984, 1, 1024, 3392, 3392, 3392, 1024]
    - [2, 13.652]
  - - [3520, 1984, 1, 1024, 3520, 3520, 3520, 1024]
    - [2, 13.663]
  - - [3648, 1984, 1, 1024, 3648, 3648, 3648, 1024]
    - [2, 13.65]
  - - [3776, 1984, 1, 1024, 3776, 3776, 3776, 1024]
    - [2, 13.688]
  - - [3904, 1984, 1, 1024, 3904, 3904, 3904, 1024]
    - [2, 13.684]
  - - [4032, 1984, 1, 1024, 4032, 4032, 4032, 1024]
    - [2, 13.732]
  - - [64, 2112, 1, 1024, 64, 64, 64, 1024]
    - [0, 9.2]
  - - [192, 2112, 1, 1024, 192, 192, 192, 1024]
    - [2, 11.465]
  - - [320, 2112, 1, 1024, 320, 320, 320, 1024]
    - [0, 11.962]
  - - [448, 2112, 1, 1024, 448, 448, 448, 1024]
    - [2, 12.202]
  - - [576, 2112, 1, 1024, 576, 576, 576, 1024]
    - [0, 12.527]
  - - [704, 2112, 1, 1024, 704, 704, 704, 1024]
    - [2, 12.665]
  - - [832, 2112, 1, 1024, 832, 832, 832, 1024]
    - [2, 12.739]
  - - [960, 2112, 1, 1024, 960, 960, 960, 1024]
    - [2, 12.84]
  - - [1088, 2112, 1, 1024, 1088, 1088, 1088, 1024]
    - [2, 12.985]
  - - [1216, 2112, 1, 1024, 1216, 1216, 1216, 1024]
    - [0, 12.692]
  - - [1344, 2112, 1, 1024, 1344, 1344, 1344, 1024]
    - [2, 13.094]
  - - [1472, 2112, 1, 1024, 1472, 1472, 1472, 1024]
    - [2, 13.133]
  - - [1600, 2112, 1, 1024, 1600, 1600, 1600, 1024]
    - [2, 13.184]
  - - [1728, 2112, 1, 1024, 1728, 1728, 1728, 1024]
    - [2, 13.236]
  - - [1856, 2112, 1, 1024, 1856, 1856, 1856, 1024]
    - [2, 13.247]
  - - [1984, 2112, 1, 1024, 1984, 1984, 1984, 1024]
    - [2, 13.294]
  - - [2112, 2112, 1, 1024, 2112, 2112, 2112, 1024]
    - [2, 13.386]
  - - [2240, 2112, 1, 1024, 2240, 2240, 2240, 1024]
    - [2, 13.429]
  - - [2368, 2112, 1, 1024, 2368, 2368, 2368, 1024]
    - [2, 13.346]
  - - [2496, 2112, 1, 1024, 2496, 2496, 2496, 1024]
    - [2, 13.51]
  - - [2624, 2112, 1, 1024, 2624, 2624, 2624, 1024]
    - [2, 13.506]
  - - [2752, 2112, 1, 1024, 2752, 2752, 2752, 1024]
    - [2, 13.6]
  - - [2880, 2112, 1, 1024, 2880, 2880, 2880, 1024]
    - [2, 13.542]
  - - [3008, 2112, 1, 1024, 3008, 3008, 3008, 1024]
    - [2, 13.584]
  - - [3136, 2112, 1, 1024, 3136, 3136, 3136, 1024]
    - [2, 13.656]
  - - [3264, 2112, 1, 1024, 3264, 3264, 3264, 1024]
    - [2, 13.581]
  - - [3392, 2112, 1, 1024, 3392, 3392, 3392, 1024]
    - [2, 13.664]
  - - [3520, 2112, 1, 1024, 3520, 3520, 3520, 1024]
    - [2, 13.682]
  - - [3648, 2112, 1, 1024, 3648, 3648, 3648, 1024]
    - [2, 13.669]
  - - [3776, 2112, 1, 1024, 3776, 3776, 3776, 1024]
    - [2, 13.696]
  - - [3904, 2112, 1, 1024, 3904, 3904, 3904, 1024]
    - [2, 13.731]
  - - [4032, 2112, 1, 1024, 4032, 4032, 4032, 1024]
    - [2, 13.84]
  - - [64, 2240, 1, 1024, 64, 64, 64, 1024]
    - [0, 9.845]
  - - [192, 2240, 1, 1024, 192, 192, 192, 1024]
    - [0, 11.969]
  - - [320, 2240, 1, 1024, 320, 320, 320, 1024]
    - [2, 12.005]
  - - [448, 2240, 1, 1024, 448, 448, 448, 1024]
    - [2, 12.407]
  - - [576, 2240, 1, 1024, 576, 576, 576, 1024]
    - [2, 12.617]
  - - [704, 2240, 1, 1024, 704, 704, 704, 1024]
    - [2, 12.647]
  - - [832, 2240, 1, 1024, 832, 832, 832, 1024]
    - [2, 12.78]
  - - [960, 2240, 1, 1024, 960, 960, 960, 1024]
    - [2, 13.03]
  - - [1088, 2240, 1, 1024, 1088, 1088, 1088, 1024]
    - [2, 13.018]
  - - [1216, 2240, 1, 1024, 1216, 1216, 1216, 1024]
    - [2, 13.158]
  - - [1344, 2240, 1, 1024, 1344, 1344, 1344, 1024]
    - [2, 13.146]
  - - [1472, 2240, 1, 1024, 1472, 1472, 1472, 1024]
    - [2, 13.223]
  - - [1600, 2240, 1, 1024, 1600, 1600, 1600, 1024]
    - [2, 13.25]
  - - [1728, 2240, 1, 1024, 1728, 1728, 1728, 1024]
    - [2, 13.304]
  - - [1856, 2240, 1, 1024, 1856, 1856, 1856, 1024]
    - [2, 13.298]
  - - [1984, 2240, 1, 1024, 1984, 1984, 1984, 1024]
    - [2, 13.337]
  - - [2112, 2240, 1, 1024, 2112, 2112, 2112, 1024]
    - [2, 13.263]
  - - [2240, 2240, 1, 1024, 2240, 2240, 2240, 1024]
    - [2, 13.432]
  - - [2368, 2240, 1, 1024, 2368, 2368, 2368, 1024]
    - [2, 13.574]
  - - [2496, 2240, 1, 1024, 2496, 2496, 2496, 1024]
    - [2, 13.481]
  - - [2624, 2240, 1, 1024, 2624, 2624, 2624, 1024]
    - [2, 13.522]
  - - [2752, 2240, 1, 1024, 2752, 2752, 2752, 1024]
    - [2, 13.587]
  - - [2880, 2240, 1, 1024, 2880, 2880, 2880, 1024]
    - [2, 13.609]
  - - [3008, 2240, 1, 1024, 3008, 3008, 3008, 1024]
    - [2, 13.602]
  - - [3136, 2240, 1, 1024, 3136, 3136, 3136, 1024]
    - [2, 13.592]
  - - [3264, 2240, 1, 1024, 3264, 3264, 3264, 1024]
    - [2, 13.622]
  - - [3392, 2240, 1, 1024, 3392, 3392, 3392, 1024]
    - [2, 13.703]
  - - [3520, 2240, 1, 1024, 3520, 3520, 3520, 1024]
    - [2, 13.71]
  - - [3648, 2240, 1, 1024, 3648, 3648, 3648, 1024]
    - [2, 13.754]
  - - [3776, 2240, 1, 1024, 3776, 3776, 3776, 1024]
    - [2, 13.772]
  - - [3904, 2240, 1, 1024, 3904, 3904, 3904, 1024]
    - [2, 13.768]
  - - [4032, 2240, 1, 1024, 4032, 4032, 4032, 1024]
    - [2, 13.811]
  - - [64, 2368, 1, 1024, 64, 64, 64, 1024]
    - [2, 8.814]
  - - [192, 2368, 1, 1024, 192, 192, 192, 1024]
    - [2, 11.631]
  - - [320, 2368, 1, 1024, 320, 320, 320, 1024]
    - [2, 11.979]
  - - [448, 2368, 1, 1024, 448, 448, 448, 1024]
    - [2, 12.349]
  - - [576, 2368, 1, 1024, 576, 576, 576, 1024]
    - [2, 12.654]
  - - [704, 2368, 1, 1024, 704, 704, 704, 1024]
    - [2, 12.754]
  - - [832, 2368, 1, 1024, 832, 832, 832, 1024]
    - [2, 12.795]
  - - [960, 2368, 1, 1024, 960, 960, 960, 1024]
    - [2, 12.921]
  - - [1088, 2368, 1, 1024, 1088, 1088, 1088, 1024]
    - [2, 12.99]
  - - [1216, 2368, 1, 1024, 1216, 1216, 1216, 1024]
    - [2, 13.057]
  - - [1344, 2368, 1, 1024, 1344, 1344, 1344, 1024]
    - [2, 13.112]
  - - [1472, 2368, 1, 1024, 1472, 1472, 1472, 1024]
    - [2, 13.173]
  - - [1600, 2368, 1, 1024, 1600, 1600, 1600, 1024]
    - [2, 13.237]
  - - [1728, 2368, 1, 1024, 1728, 1728, 1728, 1024]
    - [2, 13.251]
  - - [1856, 2368, 1, 1024, 1856, 1856, 1856, 1024]
    - [2, 13.237]
  - - [1984, 2368, 1, 1024, 1984, 1984, 1984, 1024]
    - [2, 13.34]
  - - [2112, 2368, 1, 1024, 2112, 2112, 2112, 1024]
    - [2, 13.382]
  - - [2240, 2368, 1, 1024, 2240, 2240, 2240, 1024]
    - [2, 13.487]
  - - [2368, 2368, 1, 1024, 2368, 2368, 2368, 1024]
    - [2, 13.47]
  - - [2496, 2368, 1, 1024, 2496, 2496, 2496, 1024]
    - [2, 13.497]
  - - [2624, 2368, 1, 1024, 2624, 2624, 2624, 1024]
    - [2, 13.471]
  - - [2752, 2368, 1, 1024, 2752, 2752, 2752, 1024]
    - [2, 13.633]
  - - [2880, 2368, 1, 1024, 2880, 2880, 2880, 1024]
    - [2, 13.574]
  - - [3008, 2368, 1, 1024, 3008, 3008, 3008, 1024]
    - [2, 13.622]
  - - [3136, 2368, 1, 1024, 3136, 3136, 3136, 1024]
    - [2, 13.677]
  - - [3264, 2368, 1, 1024, 3264, 3264, 3264, 1024]
    - [2, 13.7]
  - - [3392, 2368, 1, 1024, 3392, 3392, 3392, 1024]
    - [2, 13.726]
  - - [3520, 2368, 1, 1024, 3520, 3520, 3520, 1024]
    - [2, 13.707]
  - - [3648, 2368, 1, 1024, 3648, 3648, 3648, 1024]
    - [2, 13.723]
  - - [3776, 2368, 1, 1024, 3776, 3776, 3776, 1024]
    - [2, 13.64]
  - - [3904, 2368, 1, 1024, 3904, 3904, 3904, 1024]
    - [2, 13.825]
  - - [4032, 2368, 1, 1024, 4032, 4032, 4032, 1024]
    - [2, 13.884]
  - - [64, 2496, 1, 1024, 64, 64, 64, 1024]
    - [2, 9.162]
  - - [192, 2496, 1, 1024, 192, 192, 192, 1024]
    - [0, 11.849]
  - - [320, 2496, 1, 1024, 320, 320, 320, 1024]
    - [2, 11.954]
  - - [448, 2496, 1, 1024, 448, 448, 448, 1024]
    - [2, 12.453]
  - - [576, 2496, 1, 1024, 576, 576, 576, 1024]
    - [2, 12.7]
  - - [704, 2496, 1, 1024, 704, 704, 704, 1024]
    - [2, 12.718]
  - - [832, 2496, 1, 1024, 832, 832, 832, 1024]
    - [2, 12.885]
  - - [960, 2496, 1, 1024, 960, 960, 960, 1024]
    - [2, 12.967]
  - - [1088, 2496, 1, 1024, 1088, 1088, 1088, 1024]
    - [2, 13.027]
  - - [1216, 2496, 1, 1024, 1216, 1216, 1216, 1024]
    - [2, 13.147]
  - - [1344, 2496, 1, 1024, 1344, 1344, 1344, 1024]
    - [2, 13.246]
  - - [1472, 2496, 1, 1024, 1472, 1472, 1472, 1024]
    - [2, 13.201]
  - - [1600, 2496, 1, 1024, 1600, 1600, 1600, 1024]
    - [2, 13.314]
  - - [1728, 2496, 1, 1024, 1728, 1728, 1728, 1024]
    - [2, 13.314]
  - - [1856, 2496, 1, 1024, 1856, 1856, 1856, 1024]
    - [2, 13.32]
  - - [1984, 2496, 1, 1024, 1984, 1984, 1984, 1024]
    - [2, 13.468]
  - - [2112, 2496, 1, 1024, 2112, 2112, 2112, 1024]
    - [2, 13.473]
  - - [2240, 2496, 1, 1024, 2240, 2240, 2240, 1024]
    - [2, 13.488]
  - - [2368, 2496, 1, 1024, 2368, 2368, 2368, 1024]
    - [2, 13.49]
  - - [2496, 2496, 1, 1024, 2496, 2496, 2496, 1024]
    - [2, 13.541]
  - - [2624, 2496, 1, 1024, 2624, 2624, 2624, 1024]
    - [2, 13.643]
  - - [2752, 2496, 1, 1024, 2752, 2752, 2752, 1024]
    - [2, 13.609]
  - - [2880, 2496, 1, 1024, 2880, 2880, 2880, 1024]
    - [2, 13.642]
  - - [3008, 2496, 1, 1024, 3008, 3008, 3008, 1024]
    - [2, 13.694]
  - - [3136, 2496, 1, 1024, 3136, 3136, 3136, 1024]
    - [2, 13.663]
  - - [3264, 2496, 1, 1024, 3264, 3264, 3264, 1024]
    - [2, 13.767]
  - - [3392, 2496, 1, 1024, 3392, 3392, 3392, 1024]
    - [2, 13.743]
  - - [3520, 2496, 1, 1024, 3520, 3520, 3520, 1024]
    - [2, 13.825]
  - - [3648, 2496, 1, 1024, 3648, 3648, 3648, 1024]
    - [2, 13.814]
  - - [3776, 2496, 1, 1024, 3776, 3776, 3776, 1024]
    - [2, 13.85]
  - - [3904, 2496, 1, 1024, 3904, 3904, 3904, 1024]
    - [2, 13.808]
  - - [4032, 2496, 1, 1024, 4032, 4032, 4032, 1024]
    - [2, 13.881]
  - - [64, 2624, 1, 1024, 64, 64, 64, 1024]
    - [2, 9.713]
  - - [192, 2624, 1, 1024, 192, 192, 192, 1024]
    - [0, 11.563]
  - - [320, 2624, 1, 1024, 320, 320, 320, 1024]
    - [2, 12.075]
  - - [448, 2624, 1, 1024, 448, 448, 448, 1024]
    - [2, 12.395]
  - - [576, 2624, 1, 1024, 576, 576, 576, 1024]
    - [2, 12.591]
  - - [704, 2624, 1, 1024, 704, 704, 704, 1024]
    - [2, 12.886]
  - - [832, 2624, 1, 1024, 832, 832, 832, 1024]
    - [2, 12.774]
  - - [960, 2624, 1, 1024, 960, 960, 960, 1024]
    - [2, 13.052]
  - - [1088, 2624, 1, 1024, 1088, 1088, 1088, 1024]
    - [2, 12.96]
  - - [1216, 2624, 1, 1024, 1216, 1216, 1216, 1024]
    - [2, 13.138]
  - - [1344, 2624, 1, 1024, 1344, 1344, 1344, 1024]
    - [2, 13.113]
  - - [1472, 2624, 1, 1024, 1472, 1472, 1472, 1024]
    - [2, 13.195]
  - - [1600, 2624, 1, 1024, 1600, 1600, 1600, 1024]
    - [2, 13.264]
  - - [1728, 2624, 1, 1024, 1728, 1728, 1728, 1024]
    - [2, 13.292]
  - - [1856, 2624, 1, 1024, 1856, 1856, 1856, 1024]
    - [2, 13.408]
  - - [1984, 2624, 1, 1024, 1984, 1984, 1984, 1024]
    - [2, 13.184]
  - - [2112, 2624, 1, 1024, 2112, 2112, 2112, 1024]
    - [2, 13.495]
  - - [2240, 2624, 1, 1024, 2240, 2240, 2240, 1024]
    - [2, 13.535]
  - - [2368, 2624, 1, 1024, 2368, 2368, 2368, 1024]
    - [2, 13.495]
  - - [2496, 2624, 1, 1024, 2496, 2496, 2496, 1024]
    - [2, 13.539]
  - - [2624, 2624, 1, 1024, 2624, 2624, 2624, 1024]
    - [2, 13.618]
  - - [2752, 2624, 1, 1024, 2752, 2752, 2752, 1024]
    - [2, 13.664]
  - - [2880, 2624, 1, 1024, 2880, 2880, 2880, 1024]
    - [2, 13.638]
  - - [3008, 2624, 1, 1024, 3008, 3008, 3008, 1024]
    - [2, 13.72]
  - - [3136, 2624, 1, 1024, 3136, 3136, 3136, 1024]
    - [2, 13.689]
  - - [3264, 2624, 1, 1024, 3264, 3264, 3264, 1024]
    - [2, 13.775]
  - - [3392, 2624, 1, 1024, 3392, 3392, 3392, 1024]
    - [2, 13.801]
  - - [3520, 2624, 1, 1024, 3520, 3520, 3520, 1024]
    - [2, 13.848]
  - - [3648, 2624, 1, 1024, 3648, 3648, 3648, 1024]
    - [2, 13.834]
  - - [3776, 2624, 1, 1024, 3776, 3776, 3776, 1024]
    - [2, 13.902]
  - - [3904, 2624, 1, 1024, 3904, 3904, 3904, 1024]
    - [2, 13.898]
  - - [4032, 2624, 1, 1024, 4032, 4032, 4032, 1024]
    - [2, 13.946]
  - - [64, 2752, 1, 1024, 64, 64, 64, 1024]
    - [0, 9.306]
  - - [192, 2752, 1, 1024, 192, 192, 192, 1024]
    - [0, 11.847]
  - - [320, 2752, 1, 1024, 320, 320, 320, 1024]
    - [0, 12.304]
  - - [448, 2752, 1, 1024, 448, 448, 448, 1024]
    - [2, 12.442]
  - - [576, 2752, 1, 1024, 576, 576, 576, 1024]
    - [2, 12.628]
  - - [704, 2752, 1, 1024, 704, 704, 704, 1024]
    - [2, 12.795]
  - - [832, 2752, 1, 1024, 832, 832, 832, 1024]
    - [2, 12.955]
  - - [960, 2752, 1, 1024, 960, 960, 960, 1024]
    - [2, 12.941]
  - - [1088, 2752, 1, 1024, 1088, 1088, 1088, 1024]
    - [2, 13.041]
  - - [1216, 2752, 1, 1024, 1216, 1216, 1216, 1024]
    - [2, 13.106]
  - - [1344, 2752, 1, 1024, 1344, 1344, 1344, 1024]
    - [2, 13.197]
  - - [1472, 2752, 1, 1024, 1472, 1472, 1472, 1024]
    - [2, 13.27]
  - - [1600, 2752, 1, 1024, 1600, 1600, 1600, 1024]
    - [2, 13.243]
  - - [1728, 2752, 1, 1024, 1728, 1728, 1728, 1024]
    - [2, 13.372]
  - - [1856, 2752, 1, 1024, 1856, 1856, 1856, 1024]
    - [2, 13.393]
  - - [1984, 2752, 1, 1024, 1984, 1984, 1984, 1024]
    - [2, 13.509]
  - - [2112, 2752, 1, 1024, 2112, 2112, 2112, 1024]
    - [2, 13.497]
  - - [2240, 2752, 1, 1024, 2240, 2240, 2240, 1024]
    - [2, 13.516]
  - - [2368, 2752, 1, 1024, 2368, 2368, 2368, 1024]
    - [2, 13.518]
  - - [2496, 2752, 1, 1024, 2496, 2496, 2496, 1024]
    - [2, 13.584]
  - - [2624, 2752, 1, 1024, 2624, 2624, 2624, 1024]
    - [2, 13.659]
  - - [2752, 2752, 1, 1024, 2752, 2752, 2752, 1024]
    - [2, 13.684]
  - - [2880, 2752, 1, 1024, 2880, 2880, 2880, 1024]
    - [2, 13.735]
  - - [3008, 2752, 1, 1024, 3008, 3008, 3008, 1024]
    - [2, 13.745]
  - - [3136, 2752, 1, 1024, 3136, 3136, 3136, 1024]
    - [2, 13.786]
  - - [3264, 2752, 1, 1024, 3264, 3264, 3264, 1024]
    - [2, 13.613]
  - - [3392, 2752, 1, 1024, 3392, 3392, 3392, 1024]
    - [2, 13.844]
  - - [3520, 2752, 1, 1024, 3520, 3520, 3520, 1024]
    - [2, 13.843]
  - - [3648, 2752, 1, 1024, 3648, 3648, 3648, 1024]
    - [2, 13.9]
  - - [3776, 2752, 1, 1024, 3776, 3776, 3776, 1024]
    - [2, 13.929]
  - - [3904, 2752, 1, 1024, 3904, 3904, 3904, 1024]
    - [2, 13.919]
  - - [4032, 2752, 1, 1024, 4032, 4032, 4032, 1024]
    - [2, 13.954]
  - - [64, 2880, 1, 1024, 64, 64, 64, 1024]
    - [2, 9.638]
  - - [192, 2880, 1, 1024, 192, 192, 192, 1024]
    - [2, 11.689]
  - - [320, 2880, 1, 1024, 320, 320, 320, 1024]
    - [2, 12.215]
  - - [448, 2880, 1, 1024, 448, 448, 448, 1024]
    - [2, 12.537]
  - - [576, 2880, 1, 1024, 576, 576, 576, 1024]
    - [2, 12.774]
  - - [704, 2880, 1, 1024, 704, 704, 704, 1024]
    - [2, 12.858]
  - - [832, 2880, 1, 1024, 832, 832, 832, 1024]
    - [2, 12.947]
  - - [960, 2880, 1, 1024, 960, 960, 960, 1024]
    - [2, 13.037]
  - - [1088, 2880, 1, 1024, 1088, 1088, 1088, 1024]
    - [2, 13.022]
  - - [1216, 2880, 1, 1024, 1216, 1216, 1216, 1024]
    - [2, 13.196]
  - - [1344, 2880, 1, 1024, 1344, 1344, 1344, 1024]
    - [2, 13.17]
  - - [1472, 2880, 1, 1024, 1472, 1472, 1472, 1024]
    - [2, 13.315]
  - - [1600, 2880, 1, 1024, 1600, 1600, 1600, 1024]
    - [2, 13.35]
  - - [1728, 2880, 1, 1024, 1728, 1728, 1728, 1024]
    - [2, 13.428]
  - - [1856, 2880, 1, 1024, 1856, 1856, 1856, 1024]
    - [2, 13.458]
  - - [1984, 2880, 1, 1024, 1984, 1984, 1984, 1024]
    - [2, 13.526]
  - - [2112, 2880, 1, 1024, 2112, 2112, 2112, 1024]
    - [2, 13.554]
  - - [2240, 2880, 1, 1024, 2240, 2240, 2240, 1024]
    - [2, 13.53]
  - - [2368, 2880, 1, 1024, 2368, 2368, 2368, 1024]
    - [2, 13.732]
  - - [2496, 2880, 1, 1024, 2496, 2496, 2496, 1024]
    - [2, 13.673]
  - - [2624, 2880, 1, 1024, 2624, 2624, 2624, 1024]
    - [2, 13.644]
  - - [2752, 2880, 1, 1024, 2752, 2752, 2752, 1024]
    - [2, 13.73]
  - - [2880, 2880, 1, 1024, 2880, 2880, 2880, 1024]
    - [2, 13.782]
  - - [3008, 2880, 1, 1024, 3008, 3008, 3008, 1024]
    - [2, 13.841]
  - - [3136, 2880, 1, 1024, 3136, 3136, 3136, 1024]
    - [2, 13.771]
  - - [3264, 2880, 1, 1024, 3264, 3264, 3264, 1024]
    - [2, 13.855]
  - - [3392, 2880, 1, 1024, 3392, 3392, 3392, 1024]
    - [2, 13.896]
  - - [3520, 2880, 1, 1024, 3520, 3520, 3520, 1024]
    - [2, 13.874]
  - - [3648, 2880, 1, 1024, 3648, 3648, 3648, 1024]
    - [2, 13.913]
  - - [3776, 2880, 1, 1024, 3776, 3776, 3776, 1024]
    - [2, 13.953]
  - - [3904, 2880, 1, 1024, 3904, 3904, 3904, 1024]
    - [2, 13.94]
  - - [4032, 2880, 1, 1024, 4032, 4032, 4032, 1024]
    - [2, 13.98]
  - - [64, 3008, 1, 1024, 64, 64, 64, 1024]
    - [0, 9.892]
  - - [192, 3008, 1, 1024, 192, 192, 192, 1024]
    - [0, 11.893]
  - - [320, 3008, 1, 1024, 320, 320, 320, 1024]
    - [2, 12.235]
  - - [448, 3008, 1, 1024, 448, 448, 448, 1024]
    - [2, 12.549]
  - - [576, 3008, 1, 1024, 576, 576, 576, 1024]
    - [2, 12.697]
  - - [704, 3008, 1, 1024, 704, 704, 704, 1024]
    - [2, 12.83]
  - - [832, 3008, 1, 1024, 832, 832, 832, 1024]
    - [2, 13.011]
  - - [960, 3008, 1, 1024, 960, 960, 960, 1024]
    - [2, 13.031]
  - - [1088, 3008, 1, 1024, 1088, 1088, 1088, 1024]
    - [2, 13.054]
  - - [1216, 3008, 1, 1024, 1216, 1216, 1216, 1024]
    - [2, 13.205]
  - - [1344, 3008, 1, 1024, 1344, 1344, 1344, 1024]
    - [2, 13.304]
  - - [1472, 3008, 1, 1024, 1472, 1472, 1472, 1024]
    - [2, 13.195]
  - - [1600, 3008, 1, 1024, 1600, 1600, 1600, 1024]
    - [2, 13.395]
  - - [1728, 3008, 1, 1024, 1728, 1728, 1728, 1024]
    - [2, 13.496]
  - - [1856, 3008, 1, 1024, 1856, 1856, 1856, 1024]
    - [2, 13.515]
  - - [1984, 3008, 1, 1024, 1984, 1984, 1984, 1024]
    - [2, 13.541]
  - - [2112, 3008, 1, 1024, 2112, 2112, 2112, 1024]
    - [2, 13.517]
  - - [2240, 3008, 1, 1024, 2240, 2240, 2240, 1024]
    - [2, 13.605]
  - - [2368, 3008, 1, 1024, 2368, 2368, 2368, 1024]
    - [2, 13.677]
  - - [2496, 3008, 1, 1024, 2496, 2496, 2496, 1024]
    - [2, 13.696]
  - - [2624, 3008, 1, 1024, 2624, 2624, 2624, 1024]
    - [2, 13.714]
  - - [2752, 3008, 1, 1024, 2752, 2752, 2752, 1024]
    - [2, 13.765]
  - - [2880, 3008, 1, 1024, 2880, 2880, 2880, 1024]
    - [2, 13.768]
  - - [3008, 3008, 1, 1024, 3008, 3008, 3008, 1024]
    - [2, 13.643]
  - - [3136, 3008, 1, 1024, 3136, 3136, 3136, 1024]
    - [2, 13.857]
  - - [3264, 3008, 1, 1024, 3264, 3264, 3264, 1024]
    - [2, 13.855]
  - - [3392, 3008, 1, 1024, 3392, 3392, 3392, 1024]
    - [2, 13.893]
  - - [3520, 3008, 1, 1024, 3520, 3520, 3520, 1024]
    - [2, 13.914]
  - - [3648, 3008, 1, 1024, 3648, 3648, 3648, 1024]
    - [2, 14.011]
  - - [3776, 3008, 1, 1024, 3776, 3776, 3776, 1024]
    - [2, 13.939]
  - - [3904, 3008, 1, 1024, 3904, 3904, 3904, 1024]
    - [2, 14.016]
  - - [4032, 3008, 1, 1024, 4032, 4032, 4032, 1024]
    - [2, 14.035]
  - - [64, 3136, 1, 1024, 64, 64, 64, 1024]
    - [2, 9.338]
  - - [192, 3136, 1, 1024, 192, 192, 192, 1024]
    - [0, 11.751]
  - - [320, 3136, 1, 1024, 320, 320, 320, 1024]
    - [2, 12.437]
  - - [448, 3136, 1, 1024, 448, 448, 448, 1024]
    - [2, 12.685]
  - - [576, 3136, 1, 1024, 576, 576, 576, 1024]
    - [2, 12.763]
  - - [704, 3136, 1, 1024, 704, 704, 704, 1024]
    - [2, 12.945]
  - - [832, 3136, 1, 1024, 832, 832, 832, 1024]
    - [2, 12.984]
  - - [960, 3136, 1, 1024, 960, 960, 960, 1024]
    - [2, 13.115]
  - - [1088, 3136, 1, 1024, 1088, 1088, 1088, 1024]
    - [2, 13.139]
  - - [1216, 3136, 1, 1024, 1216, 1216, 1216, 1024]
    - [2, 13.235]
  - - [1344, 3136, 1, 1024, 1344, 1344, 1344, 1024]
    - [2, 13.223]
  - - [1472, 3136, 1, 1024, 1472, 1472, 1472, 1024]
    - [2, 13.422]
  - - [1600, 3136, 1, 1024, 1600, 1600, 1600, 1024]
    - [2, 13.301]
  - - [1728, 3136, 1, 1024, 1728, 1728, 1728, 1024]
    - [2, 13.401]
  - - [1856, 3136, 1, 1024, 1856, 1856, 1856, 1024]
    - [2, 13.504]
  - - [1984, 3136, 1, 1024, 1984, 1984, 1984, 1024]
    - [2, 13.514]
  - - [2112, 3136, 1, 1024, 2112, 2112, 2112, 1024]
    - [2, 13.565]
  - - [2240, 3136, 1, 1024, 2240, 2240, 2240, 1024]
    - [2, 13.687]
  - - [2368, 3136, 1, 1024, 2368, 2368, 2368, 1024]
    - [2, 13.649]
  - - [2496, 3136, 1, 1024, 2496, 2496, 2496, 1024]
    - [2, 13.734]
  - - [2624, 3136, 1, 1024, 2624, 2624, 2624, 1024]
    - [2, 13.708]
