library/src/amd_detail/rocblaslt/src/Tensile/Logic/asm_full/navi33/GridBased/navi33_Cijk_Ailk_Bjlk_I8II_BH_HAI_SAV_UserArgs.yaml
- {MinimumRequiredVersion: 4.33.0}
- navi33
- gfx1102
- [Device 73f0]
    SolutionIndex: 0
    SolutionNameMin: Cijk_Ailk_Bjlk_I8II_BH_HAI_SAV_UserArgs_MT32x32x32_MI16x16x1_SN_GRVWB4_GSU1_LBSPPA512_LBSPPB512_MIWT1_1_NLCA1_NLCB1_SS1_SU32_SUM0_SUS256_WG32_4_1_WGM8
    SolutionIndex: 1
    SolutionNameMin: Cijk_Ailk_Bjlk_I8II_BH_HAI_SAV_UserArgs_MT64x32x32_MI16x16x1_SN_GRVWB4_GSU1_LBSPPA1024_LBSPPB512_MIWT2_1_NLCA1_NLCB1_SS1_SU32_SUM0_SUS256_WG32_4_1_WGM8
    SolutionIndex: 2
    SolutionNameMin: Cijk_Ailk_Bjlk_I8II_BH_HAI_SAV_UserArgs_MT16x64x32_MI16x16x1_SN_GRVWB4_GSU1_LBSPPA256_LBSPPB1024_MIWT1_1_NLCA1_NLCB1_SS1_SU32_SUM0_SUS256_WG16_8_1_WGM8
    SolutionIndex: 3
    SolutionNameMin: Cijk_Ailk_Bjlk_I8II_BH_HAI_SAV_UserArgs_MT64x96x32_MI16x16x1_SN_GRVWB4_GSU1_LBSPPA1024_LBSPPB1536_MIWT2_3_NLCA1_NLCB3_SS1_SU32_SUM0_SUS256_WG32_4_1_WGM8
- - - [64, 64, 1, 64, 64, 64, 64, 64]
    - [2, 49.1321]
  - - [128, 128, 1, 128, 128, 128, 128, 128]
    - [0, 358.2]
  - - [256, 256, 1, 256, 256, 256, 256, 256]
    - [0, 2327.63]
  - - [512, 512, 1, 512, 512, 512, 512, 512]
    - [1, 9477.03]
  - - [1024, 1024, 1, 1024, 1024, 1024, 1024, 1024]
    - [3, 47956.5]
  - - [1536, 1536, 1, 1536, 1536, 1536, 1536, 1536]
    - [3, 54019.5]
  - - [2048, 2048, 1, 2048, 2048, 2048, 2048, 2048]
    - [3, 49793.2]
  - - [2560, 2560, 1, 2560, 2560, 2560, 2560, 2560]
    - [3, 53719.4]
  - - [3072, 3072, 1, 3072, 3072, 3072, 3072, 3072]
    - [3, 58828.8]
  - - [3584, 3584, 1, 3584, 3584, 3584, 3584, 3584]
    - [3, 59096.6]
  - - [4096, 4096, 1, 4096, 4096, 4096, 4096, 4096]
    - [3, 60682.3]
- null
- null
- DeviceEfficiency
- GridBased
