library/src/amd_detail/rocblaslt/src/Tensile/Logic/asm_full/navi33/GridBased/navi33_Cijk_Ailk_Bljk_BSS_BH_Bias_HAH.yaml
- {MinimumRequiredVersion: 4.33.0}
- navi33
- gfx1102
- [Device 73f0]
    SolutionIndex: 0
    SolutionNameMin: Cijk_Ailk_Bljk_BSS_BH_Bias_HAH_MT32x32x64_MI16x16x16x1_SN_MIWT1_1_WG32_4_1
    SolutionIndex: 1
    SolutionNameMin: Cijk_Ailk_Bljk_BSS_BH_Bias_HAH_MT16x16x64_MI16x16x16x1_SN_MIWT1_1_WG16_2_1
    SolutionIndex: 2
    SolutionNameMin: Cijk_Ailk_Bljk_BSS_BH_Bias_HAH_MT32x16x64_MI16x16x16x1_SN_MIWT1_1_WG32_2_1
    SolutionIndex: 3
    SolutionNameMin: Cijk_Ailk_Bljk_BSS_BH_Bias_HAH_MT16x32x64_MI16x16x16x1_SN_MIWT1_1_WG16_4_1
- - - [64, 64, 1, 64, 64, 64, 64, 64]
    - [1, 0.089]
  - - [192, 64, 1, 64, 192, 192, 192, 64]
    - [2, 0.266]
  - - [320, 64, 1, 64, 320, 320, 320, 64]
    - [2, 0.44]
  - - [448, 64, 1, 64, 448, 448, 448, 64]
    - [2, 0.602]
  - - [576, 64, 1, 64, 576, 576, 576, 64]
    - [2, 0.776]
  - - [704, 64, 1, 64, 704, 704, 704, 64]
    - [0, 0.937]
  - - [832, 64, 1, 64, 832, 832, 832, 64]
    - [2, 1.065]
  - - [960, 64, 1, 64, 960, 960, 960, 64]
    - [2, 1.226]
  - - [1088, 64, 1, 64, 1088, 1088, 1088, 64]
    - [2, 1.367]
  - - [1216, 64, 1, 64, 1216, 1216, 1216, 64]
    - [0, 1.495]
  - - [1344, 64, 1, 64, 1344, 1344, 1344, 64]
    - [2, 1.602]
  - - [1472, 64, 1, 64, 1472, 1472, 1472, 64]
    - [0, 1.741]
  - - [1600, 64, 1, 64, 1600, 1600, 1600, 64]
    - [2, 1.825]
  - - [1728, 64, 1, 64, 1728, 1728, 1728, 64]
    - [2, 1.973]
  - - [1856, 64, 1, 64, 1856, 1856, 1856, 64]
    - [2, 2.091]
  - - [1984, 64, 1, 64, 1984, 1984, 1984, 64]
    - [2, 2.205]
  - - [2112, 64, 1, 64, 2112, 2112, 2112, 64]
    - [2, 2.366]
  - - [2240, 64, 1, 64, 2240, 2240, 2240, 64]
    - [0, 2.463]
  - - [2368, 64, 1, 64, 2368, 2368, 2368, 64]
    - [2, 2.517]
  - - [2496, 64, 1, 64, 2496, 2496, 2496, 64]
    - [2, 2.673]
  - - [2624, 64, 1, 64, 2624, 2624, 2624, 64]
    - [2, 2.763]
  - - [2752, 64, 1, 64, 2752, 2752, 2752, 64]
    - [0, 2.863]
  - - [2880, 64, 1, 64, 2880, 2880, 2880, 64]
    - [2, 3.103]
  - - [3008, 64, 1, 64, 3008, 3008, 3008, 64]
    - [0, 3.204]
  - - [3136, 64, 1, 64, 3136, 3136, 3136, 64]
    - [0, 3.193]
  - - [3264, 64, 1, 64, 3264, 3264, 3264, 64]
    - [0, 3.281]
  - - [3392, 64, 1, 64, 3392, 3392, 3392, 64]
    - [0, 3.412]
  - - [3520, 64, 1, 64, 3520, 3520, 3520, 64]
    - [0, 3.53]
  - - [3648, 64, 1, 64, 3648, 3648, 3648, 64]
    - [3, 1.841]
  - - [3776, 64, 1, 64, 3776, 3776, 3776, 64]
    - [3, 1.912]
  - - [3904, 64, 1, 64, 3904, 3904, 3904, 64]
    - [3, 1.027]
  - - [4032, 64, 1, 64, 4032, 4032, 4032, 64]
    - [2, 1.061]
  - - [64, 192, 1, 64, 64, 64, 64, 64]
    - [2, 0.05]
  - - [192, 192, 1, 64, 192, 192, 192, 64]
    - [1, 0.152]
  - - [320, 192, 1, 64, 320, 320, 320, 64]
    - [2, 0.252]
  - - [448, 192, 1, 64, 448, 448, 448, 64]
    - [2, 0.683]
  - - [576, 192, 1, 64, 576, 576, 576, 64]
    - [2, 0.872]
  - - [704, 192, 1, 64, 704, 704, 704, 64]
    - [3, 2.165]
  - - [832, 192, 1, 64, 832, 832, 832, 64]
    - [2, 1.265]
  - - [960, 192, 1, 64, 960, 960, 960, 64]
    - [2, 1.457]
  - - [1088, 192, 1, 64, 1088, 1088, 1088, 64]
    - [2, 1.646]
  - - [1216, 192, 1, 64, 1216, 1216, 1216, 64]
    - [0, 3.65]
  - - [1344, 192, 1, 64, 1344, 1344, 1344, 64]
    - [0, 1.062]
  - - [1472, 192, 1, 64, 1472, 1472, 1472, 64]
    - [1, 2.25]
  - - [1600, 192, 1, 64, 1600, 1600, 1600, 64]
    - [2, 2.447]
  - - [1728, 192, 1, 64, 1728, 1728, 1728, 64]
    - [3, 3.612]
  - - [1856, 192, 1, 64, 1856, 1856, 1856, 64]
    - [0, 2.817]
  - - [1984, 192, 1, 64, 1984, 1984, 1984, 64]
    - [3, 2.979]
  - - [2112, 192, 1, 64, 2112, 2112, 2112, 64]
    - [0, 3.209]
  - - [2240, 192, 1, 64, 2240, 2240, 2240, 64]
    - [1, 4.232]
  - - [2368, 192, 1, 64, 2368, 2368, 2368, 64]
    - [3, 3.573]
  - - [2496, 192, 1, 64, 2496, 2496, 2496, 64]
    - [2, 3.76]
  - - [2624, 192, 1, 64, 2624, 2624, 2624, 64]
    - [0, 3.999]
  - - [2752, 192, 1, 64, 2752, 2752, 2752, 64]
    - [0, 4.164]
  - - [2880, 192, 1, 64, 2880, 2880, 2880, 64]
    - [0, 4.356]
  - - [3008, 192, 1, 64, 3008, 3008, 3008, 64]
    - [0, 4.548]
  - - [3136, 192, 1, 64, 3136, 3136, 3136, 64]
    - [0, 4.729]
  - - [3264, 192, 1, 64, 3264, 3264, 3264, 64]
    - [3, 5.0]
  - - [3392, 192, 1, 64, 3392, 3392, 3392, 64]
    - [0, 5.21]
  - - [3520, 192, 1, 64, 3520, 3520, 3520, 64]
    - [0, 5.356]
  - - [3648, 192, 1, 64, 3648, 3648, 3648, 64]
    - [0, 5.589]
  - - [3776, 192, 1, 64, 3776, 3776, 3776, 64]
    - [0, 5.811]
  - - [3904, 192, 1, 64, 3904, 3904, 3904, 64]
    - [0, 5.963]
  - - [4032, 192, 1, 64, 4032, 4032, 4032, 64]
    - [0, 6.149]
  - - [64, 320, 1, 64, 64, 64, 64, 64]
    - [3, 0.085]
  - - [192, 320, 1, 64, 192, 192, 192, 64]
    - [3, 0.255]
  - - [320, 320, 1, 64, 320, 320, 320, 64]
    - [2, 0.423]
  - - [448, 320, 1, 64, 448, 448, 448, 64]
    - [3, 0.592]
  - - [576, 320, 1, 64, 576, 576, 576, 64]
    - [3, 0.763]
  - - [704, 320, 1, 64, 704, 704, 704, 64]
    - [1, 0.928]
  - - [832, 320, 1, 64, 832, 832, 832, 64]
    - [2, 1.097]
  - - [960, 320, 1, 64, 960, 960, 960, 64]
    - [0, 1.271]
  - - [1088, 320, 1, 64, 1088, 1088, 1088, 64]
    - [3, 2.771]
  - - [1216, 320, 1, 64, 1216, 1216, 1216, 64]
    - [1, 3.084]
  - - [1344, 320, 1, 64, 1344, 1344, 1344, 64]
    - [2, 4.842]
  - - [1472, 320, 1, 64, 1472, 1472, 1472, 64]
    - [0, 3.753]
  - - [1600, 320, 1, 64, 1600, 1600, 1600, 64]
    - [0, 4.057]
  - - [1728, 320, 1, 64, 1728, 1728, 1728, 64]
    - [2, 4.39]
  - - [1856, 320, 1, 64, 1856, 1856, 1856, 64]
    - [0, 4.71]
  - - [1984, 320, 1, 64, 1984, 1984, 1984, 64]
    - [0, 5.06]
  - - [2112, 320, 1, 64, 2112, 2112, 2112, 64]
    - [0, 5.395]
  - - [2240, 320, 1, 64, 2240, 2240, 2240, 64]
    - [0, 5.706]
  - - [2368, 320, 1, 64, 2368, 2368, 2368, 64]
    - [2, 5.991]
  - - [2496, 320, 1, 64, 2496, 2496, 2496, 64]
    - [0, 6.38]
  - - [2624, 320, 1, 64, 2624, 2624, 2624, 64]
    - [0, 7.395]
  - - [2752, 320, 1, 64, 2752, 2752, 2752, 64]
    - [0, 7.613]
  - - [2880, 320, 1, 64, 2880, 2880, 2880, 64]
    - [0, 7.753]
  - - [3008, 320, 1, 64, 3008, 3008, 3008, 64]
    - [0, 7.879]
  - - [3136, 320, 1, 64, 3136, 3136, 3136, 64]
    - [0, 7.999]
  - - [3264, 320, 1, 64, 3264, 3264, 3264, 64]
    - [0, 8.108]
  - - [3392, 320, 1, 64, 3392, 3392, 3392, 64]
    - [0, 8.298]
  - - [3520, 320, 1, 64, 3520, 3520, 3520, 64]
    - [0, 8.306]
  - - [3648, 320, 1, 64, 3648, 3648, 3648, 64]
    - [0, 8.396]
  - - [3776, 320, 1, 64, 3776, 3776, 3776, 64]
    - [0, 8.477]
  - - [3904, 320, 1, 64, 3904, 3904, 3904, 64]
    - [0, 8.628]
  - - [4032, 320, 1, 64, 4032, 4032, 4032, 64]
    - [0, 8.732]
  - - [64, 448, 1, 64, 64, 64, 64, 64]
    - [0, 0.603]
  - - [192, 448, 1, 64, 192, 192, 192, 64]
    - [0, 1.65]
  - - [320, 448, 1, 64, 320, 320, 320, 64]
    - [0, 2.552]
  - - [448, 448, 1, 64, 448, 448, 448, 64]
    - [0, 3.16]
  - - [576, 448, 1, 64, 576, 576, 576, 64]
    - [0, 3.87]
  - - [704, 448, 1, 64, 704, 704, 704, 64]
    - [0, 4.466]
  - - [832, 448, 1, 64, 832, 832, 832, 64]
    - [0, 5.029]
  - - [960, 448, 1, 64, 960, 960, 960, 64]
    - [0, 5.331]
  - - [1088, 448, 1, 64, 1088, 1088, 1088, 64]
    - [0, 2.0]
  - - [1216, 448, 1, 64, 1216, 1216, 1216, 64]
    - [2, 4.326]
  - - [1344, 448, 1, 64, 1344, 1344, 1344, 64]
    - [0, 6.46]
  - - [1472, 448, 1, 64, 1472, 1472, 1472, 64]
    - [2, 5.916]
  - - [1600, 448, 1, 64, 1600, 1600, 1600, 64]
    - [0, 6.906]
  - - [1728, 448, 1, 64, 1728, 1728, 1728, 64]
    - [2, 6.105]
  - - [1856, 448, 1, 64, 1856, 1856, 1856, 64]
    - [2, 6.281]
  - - [1984, 448, 1, 64, 1984, 1984, 1984, 64]
    - [0, 7.553]
  - - [2112, 448, 1, 64, 2112, 2112, 2112, 64]
    - [0, 7.791]
  - - [2240, 448, 1, 64, 2240, 2240, 2240, 64]
    - [0, 8.037]
  - - [2368, 448, 1, 64, 2368, 2368, 2368, 64]
    - [0, 8.225]
  - - [2496, 448, 1, 64, 2496, 2496, 2496, 64]
    - [0, 8.322]
  - - [2624, 448, 1, 64, 2624, 2624, 2624, 64]
    - [0, 8.391]
  - - [2752, 448, 1, 64, 2752, 2752, 2752, 64]
    - [0, 8.551]
  - - [2880, 448, 1, 64, 2880, 2880, 2880, 64]
    - [0, 8.717]
  - - [3008, 448, 1, 64, 3008, 3008, 3008, 64]
    - [0, 8.865]
  - - [3136, 448, 1, 64, 3136, 3136, 3136, 64]
    - [0, 8.944]
  - - [3264, 448, 1, 64, 3264, 3264, 3264, 64]
    - [0, 9.101]
  - - [3392, 448, 1, 64, 3392, 3392, 3392, 64]
    - [0, 9.277]
  - - [3520, 448, 1, 64, 3520, 3520, 3520, 64]
    - [0, 9.384]
  - - [3648, 448, 1, 64, 3648, 3648, 3648, 64]
    - [0, 9.433]
  - - [3776, 448, 1, 64, 3776, 3776, 3776, 64]
    - [0, 9.431]
  - - [3904, 448, 1, 64, 3904, 3904, 3904, 64]
    - [0, 9.556]
  - - [4032, 448, 1, 64, 4032, 4032, 4032, 64]
    - [0, 9.611]
  - - [64, 576, 1, 64, 64, 64, 64, 64]
    - [2, 0.152]
  - - [192, 576, 1, 64, 192, 192, 192, 64]
    - [2, 0.455]
  - - [320, 576, 1, 64, 320, 320, 320, 64]
    - [3, 0.761]
  - - [448, 576, 1, 64, 448, 448, 448, 64]
    - [0, 1.061]
  - - [576, 576, 1, 64, 576, 576, 576, 64]
    - [3, 2.644]
  - - [704, 576, 1, 64, 704, 704, 704, 64]
    - [1, 3.21]
  - - [832, 576, 1, 64, 832, 832, 832, 64]
    - [3, 3.818]
  - - [960, 576, 1, 64, 960, 960, 960, 64]
    - [3, 4.382]
  - - [1088, 576, 1, 64, 1088, 1088, 1088, 64]
    - [0, 4.98]
  - - [1216, 576, 1, 64, 1216, 1216, 1216, 64]
    - [0, 5.581]
  - - [1344, 576, 1, 64, 1344, 1344, 1344, 64]
    - [2, 6.231]
  - - [1472, 576, 1, 64, 1472, 1472, 1472, 64]
    - [2, 6.326]
  - - [1600, 576, 1, 64, 1600, 1600, 1600, 64]
    - [0, 7.339]
  - - [1728, 576, 1, 64, 1728, 1728, 1728, 64]
    - [0, 7.939]
  - - [1856, 576, 1, 64, 1856, 1856, 1856, 64]
    - [0, 8.184]
  - - [1984, 576, 1, 64, 1984, 1984, 1984, 64]
    - [0, 8.418]
  - - [2112, 576, 1, 64, 2112, 2112, 2112, 64]
    - [0, 8.565]
  - - [2240, 576, 1, 64, 2240, 2240, 2240, 64]
    - [0, 8.713]
  - - [2368, 576, 1, 64, 2368, 2368, 2368, 64]
    - [0, 8.883]
  - - [2496, 576, 1, 64, 2496, 2496, 2496, 64]
    - [0, 9.099]
  - - [2624, 576, 1, 64, 2624, 2624, 2624, 64]
    - [0, 9.248]
  - - [2752, 576, 1, 64, 2752, 2752, 2752, 64]
    - [0, 9.387]
  - - [2880, 576, 1, 64, 2880, 2880, 2880, 64]
    - [0, 9.538]
  - - [3008, 576, 1, 64, 3008, 3008, 3008, 64]
    - [0, 9.643]
  - - [3136, 576, 1, 64, 3136, 3136, 3136, 64]
    - [0, 9.675]
  - - [3264, 576, 1, 64, 3264, 3264, 3264, 64]
    - [0, 9.752]
  - - [3392, 576, 1, 64, 3392, 3392, 3392, 64]
    - [0, 9.874]
  - - [3520, 576, 1, 64, 3520, 3520, 3520, 64]
    - [0, 10.017]
  - - [3648, 576, 1, 64, 3648, 3648, 3648, 64]
    - [0, 10.08]
  - - [3776, 576, 1, 64, 3776, 3776, 3776, 64]
    - [0, 10.214]
  - - [3904, 576, 1, 64, 3904, 3904, 3904, 64]
    - [0, 10.339]
  - - [4032, 576, 1, 64, 4032, 4032, 4032, 64]
    - [0, 10.351]
  - - [64, 704, 1, 64, 64, 64, 64, 64]
    - [0, 0.945]
  - - [192, 704, 1, 64, 192, 192, 192, 64]
    - [0, 2.406]
  - - [320, 704, 1, 64, 320, 320, 320, 64]
    - [0, 3.543]
  - - [448, 704, 1, 64, 448, 448, 448, 64]
    - [0, 4.466]
  - - [576, 704, 1, 64, 576, 576, 576, 64]
    - [0, 5.248]
  - - [704, 704, 1, 64, 704, 704, 704, 64]
    - [0, 5.809]
  - - [832, 704, 1, 64, 832, 832, 832, 64]
    - [0, 6.383]
  - - [960, 704, 1, 64, 960, 960, 960, 64]
    - [0, 6.696]
  - - [1088, 704, 1, 64, 1088, 1088, 1088, 64]
    - [0, 7.098]
  - - [1216, 704, 1, 64, 1216, 1216, 1216, 64]
    - [0, 7.631]
  - - [1344, 704, 1, 64, 1344, 1344, 1344, 64]
    - [0, 7.757]
  - - [1472, 704, 1, 64, 1472, 1472, 1472, 64]
    - [0, 8.088]
  - - [1600, 704, 1, 64, 1600, 1600, 1600, 64]
    - [0, 8.395]
  - - [1728, 704, 1, 64, 1728, 1728, 1728, 64]
    - [0, 8.559]
  - - [1856, 704, 1, 64, 1856, 1856, 1856, 64]
    - [0, 8.739]
  - - [1984, 704, 1, 64, 1984, 1984, 1984, 64]
    - [0, 8.977]
  - - [2112, 704, 1, 64, 2112, 2112, 2112, 64]
    - [0, 9.206]
  - - [2240, 704, 1, 64, 2240, 2240, 2240, 64]
    - [0, 9.378]
  - - [2368, 704, 1, 64, 2368, 2368, 2368, 64]
    - [0, 9.51]
  - - [2496, 704, 1, 64, 2496, 2496, 2496, 64]
    - [0, 9.734]
  - - [2624, 704, 1, 64, 2624, 2624, 2624, 64]
    - [0, 9.719]
  - - [2752, 704, 1, 64, 2752, 2752, 2752, 64]
    - [0, 9.846]
  - - [2880, 704, 1, 64, 2880, 2880, 2880, 64]
    - [0, 9.988]
  - - [3008, 704, 1, 64, 3008, 3008, 3008, 64]
    - [0, 10.162]
  - - [3136, 704, 1, 64, 3136, 3136, 3136, 64]
    - [0, 10.201]
  - - [3264, 704, 1, 64, 3264, 3264, 3264, 64]
    - [0, 10.313]
  - - [3392, 704, 1, 64, 3392, 3392, 3392, 64]
    - [0, 10.343]
  - - [3520, 704, 1, 64, 3520, 3520, 3520, 64]
    - [0, 10.517]
  - - [3648, 704, 1, 64, 3648, 3648, 3648, 64]
    - [0, 10.638]
  - - [3776, 704, 1, 64, 3776, 3776, 3776, 64]
    - [0, 10.604]
  - - [3904, 704, 1, 64, 3904, 3904, 3904, 64]
    - [0, 10.71]
  - - [4032, 704, 1, 64, 4032, 4032, 4032, 64]
    - [0, 10.763]
  - - [64, 832, 1, 64, 64, 64, 64, 64]
    - [3, 0.22]
  - - [192, 832, 1, 64, 192, 192, 192, 64]
    - [2, 0.66]
  - - [320, 832, 1, 64, 320, 320, 320, 64]
    - [0, 1.097]
  - - [448, 832, 1, 64, 448, 448, 448, 64]
    - [0, 1.542]
  - - [576, 832, 1, 64, 576, 576, 576, 64]
    - [3, 3.796]
  - - [704, 832, 1, 64, 704, 704, 704, 64]
    - [0, 4.673]
  - - [832, 832, 1, 64, 832, 832, 832, 64]
    - [0, 5.537]
  - - [960, 832, 1, 64, 960, 960, 960, 64]
    - [0, 6.36]
  - - [1088, 832, 1, 64, 1088, 1088, 1088, 64]
    - [0, 7.231]
  - - [1216, 832, 1, 64, 1216, 1216, 1216, 64]
    - [2, 6.787]
  - - [1344, 832, 1, 64, 1344, 1344, 1344, 64]
    - [0, 8.266]
  - - [1472, 832, 1, 64, 1472, 1472, 1472, 64]
    - [0, 8.525]
  - - [1600, 832, 1, 64, 1600, 1600, 1600, 64]
    - [0, 8.816]
  - - [1728, 832, 1, 64, 1728, 1728, 1728, 64]
    - [0, 9.041]
  - - [1856, 832, 1, 64, 1856, 1856, 1856, 64]
    - [0, 9.243]
  - - [1984, 832, 1, 64, 1984, 1984, 1984, 64]
    - [0, 9.499]
  - - [2112, 832, 1, 64, 2112, 2112, 2112, 64]
    - [0, 9.632]
  - - [2240, 832, 1, 64, 2240, 2240, 2240, 64]
    - [0, 9.786]
  - - [2368, 832, 1, 64, 2368, 2368, 2368, 64]
    - [0, 9.946]
  - - [2496, 832, 1, 64, 2496, 2496, 2496, 64]
    - [0, 10.1]
  - - [2624, 832, 1, 64, 2624, 2624, 2624, 64]
    - [0, 10.205]
  - - [2752, 832, 1, 64, 2752, 2752, 2752, 64]
    - [0, 10.35]
  - - [2880, 832, 1, 64, 2880, 2880, 2880, 64]
    - [0, 10.471]
  - - [3008, 832, 1, 64, 3008, 3008, 3008, 64]
    - [0, 10.558]
  - - [3136, 832, 1, 64, 3136, 3136, 3136, 64]
    - [0, 10.627]
  - - [3264, 832, 1, 64, 3264, 3264, 3264, 64]
    - [0, 10.673]
  - - [3392, 832, 1, 64, 3392, 3392, 3392, 64]
    - [0, 10.749]
  - - [3520, 832, 1, 64, 3520, 3520, 3520, 64]
    - [0, 10.801]
  - - [3648, 832, 1, 64, 3648, 3648, 3648, 64]
    - [0, 10.855]
  - - [3776, 832, 1, 64, 3776, 3776, 3776, 64]
    - [0, 10.961]
  - - [3904, 832, 1, 64, 3904, 3904, 3904, 64]
    - [0, 11.006]
  - - [4032, 832, 1, 64, 4032, 4032, 4032, 64]
    - [0, 11.029]
  - - [64, 960, 1, 64, 64, 64, 64, 64]
    - [2, 0.253]
  - - [192, 960, 1, 64, 192, 192, 192, 64]
    - [2, 0.758]
  - - [320, 960, 1, 64, 320, 320, 320, 64]
    - [3, 1.26]
  - - [448, 960, 1, 64, 448, 448, 448, 64]
    - [2, 3.415]
  - - [576, 960, 1, 64, 576, 576, 576, 64]
    - [0, 4.38]
  - - [704, 960, 1, 64, 704, 704, 704, 64]
    - [0, 5.375]
  - - [832, 960, 1, 64, 832, 832, 832, 64]
    - [0, 6.353]
  - - [960, 960, 1, 64, 960, 960, 960, 64]
    - [0, 7.667]
  - - [1088, 960, 1, 64, 1088, 1088, 1088, 64]
    - [0, 8.052]
  - - [1216, 960, 1, 64, 1216, 1216, 1216, 64]
    - [0, 8.381]
  - - [1344, 960, 1, 64, 1344, 1344, 1344, 64]
    - [0, 8.636]
  - - [1472, 960, 1, 64, 1472, 1472, 1472, 64]
    - [0, 8.92]
  - - [1600, 960, 1, 64, 1600, 1600, 1600, 64]
    - [0, 9.184]
  - - [1728, 960, 1, 64, 1728, 1728, 1728, 64]
    - [0, 9.372]
  - - [1856, 960, 1, 64, 1856, 1856, 1856, 64]
    - [0, 9.534]
  - - [1984, 960, 1, 64, 1984, 1984, 1984, 64]
    - [0, 9.781]
  - - [2112, 960, 1, 64, 2112, 2112, 2112, 64]
    - [0, 9.915]
  - - [2240, 960, 1, 64, 2240, 2240, 2240, 64]
    - [0, 10.034]
  - - [2368, 960, 1, 64, 2368, 2368, 2368, 64]
    - [0, 10.15]
  - - [2496, 960, 1, 64, 2496, 2496, 2496, 64]
    - [0, 10.229]
  - - [2624, 960, 1, 64, 2624, 2624, 2624, 64]
    - [0, 10.432]
  - - [2752, 960, 1, 64, 2752, 2752, 2752, 64]
    - [0, 10.403]
  - - [2880, 960, 1, 64, 2880, 2880, 2880, 64]
    - [0, 10.573]
  - - [3008, 960, 1, 64, 3008, 3008, 3008, 64]
    - [0, 10.674]
  - - [3136, 960, 1, 64, 3136, 3136, 3136, 64]
    - [0, 10.805]
  - - [3264, 960, 1, 64, 3264, 3264, 3264, 64]
    - [0, 10.841]
  - - [3392, 960, 1, 64, 3392, 3392, 3392, 64]
    - [0, 11.06]
  - - [3520, 960, 1, 64, 3520, 3520, 3520, 64]
    - [0, 11.074]
  - - [3648, 960, 1, 64, 3648, 3648, 3648, 64]
    - [0, 11.031]
  - - [3776, 960, 1, 64, 3776, 3776, 3776, 64]
    - [0, 11.068]
  - - [3904, 960, 1, 64, 3904, 3904, 3904, 64]
    - [0, 11.207]
  - - [4032, 960, 1, 64, 4032, 4032, 4032, 64]
    - [0, 11.265]
  - - [64, 1088, 1, 64, 64, 64, 64, 64]
    - [3, 1.31]
  - - [192, 1088, 1, 64, 192, 192, 192, 64]
    - [3, 0.86]
  - - [320, 1088, 1, 64, 320, 320, 320, 64]
    - [0, 1.439]
  - - [448, 1088, 1, 64, 448, 448, 448, 64]
    - [0, 3.872]
  - - [576, 1088, 1, 64, 576, 576, 576, 64]
    - [3, 4.986]
  - - [704, 1088, 1, 64, 704, 704, 704, 64]
    - [0, 6.078]
  - - [832, 1088, 1, 64, 832, 832, 832, 64]
    - [0, 7.646]
  - - [960, 1088, 1, 64, 960, 960, 960, 64]
    - [0, 8.037]
  - - [1088, 1088, 1, 64, 1088, 1088, 1088, 64]
    - [0, 8.428]
  - - [1216, 1088, 1, 64, 1216, 1216, 1216, 64]
    - [0, 8.739]
  - - [1344, 1088, 1, 64, 1344, 1344, 1344, 64]
    - [0, 8.968]
  - - [1472, 1088, 1, 64, 1472, 1472, 1472, 64]
    - [0, 9.301]
  - - [1600, 1088, 1, 64, 1600, 1600, 1600, 64]
    - [0, 9.506]
  - - [1728, 1088, 1, 64, 1728, 1728, 1728, 64]
    - [0, 9.763]
  - - [1856, 1088, 1, 64, 1856, 1856, 1856, 64]
    - [0, 9.921]
  - - [1984, 1088, 1, 64, 1984, 1984, 1984, 64]
    - [0, 10.099]
  - - [2112, 1088, 1, 64, 2112, 2112, 2112, 64]
    - [0, 10.232]
  - - [2240, 1088, 1, 64, 2240, 2240, 2240, 64]
    - [0, 10.273]
  - - [2368, 1088, 1, 64, 2368, 2368, 2368, 64]
    - [0, 10.432]
  - - [2496, 1088, 1, 64, 2496, 2496, 2496, 64]
    - [0, 10.586]
  - - [2624, 1088, 1, 64, 2624, 2624, 2624, 64]
    - [0, 10.886]
  - - [2752, 1088, 1, 64, 2752, 2752, 2752, 64]
    - [0, 10.722]
  - - [2880, 1088, 1, 64, 2880, 2880, 2880, 64]
    - [0, 10.816]
  - - [3008, 1088, 1, 64, 3008, 3008, 3008, 64]
    - [0, 10.875]
  - - [3136, 1088, 1, 64, 3136, 3136, 3136, 64]
    - [0, 11.009]
  - - [3264, 1088, 1, 64, 3264, 3264, 3264, 64]
    - [0, 11.119]
  - - [3392, 1088, 1, 64, 3392, 3392, 3392, 64]
    - [0, 11.183]
  - - [3520, 1088, 1, 64, 3520, 3520, 3520, 64]
    - [0, 11.18]
  - - [3648, 1088, 1, 64, 3648, 3648, 3648, 64]
    - [0, 11.383]
  - - [3776, 1088, 1, 64, 3776, 3776, 3776, 64]
    - [0, 11.438]
  - - [3904, 1088, 1, 64, 3904, 3904, 3904, 64]
    - [0, 11.349]
  - - [4032, 1088, 1, 64, 4032, 4032, 4032, 64]
    - [0, 11.377]
  - - [64, 1216, 1, 64, 64, 64, 64, 64]
    - [2, 1.476]
  - - [192, 1216, 1, 64, 192, 192, 192, 64]
    - [2, 3.374]
  - - [320, 1216, 1, 64, 320, 320, 320, 64]
    - [0, 5.134]
  - - [448, 1216, 1, 64, 448, 448, 448, 64]
    - [0, 6.01]
  - - [576, 1216, 1, 64, 576, 576, 576, 64]
    - [2, 5.517]
  - - [704, 1216, 1, 64, 704, 704, 704, 64]
    - [0, 6.797]
  - - [832, 1216, 1, 64, 832, 832, 832, 64]
    - [0, 7.979]
  - - [960, 1216, 1, 64, 960, 960, 960, 64]
    - [0, 8.347]
  - - [1088, 1216, 1, 64, 1088, 1088, 1088, 64]
    - [0, 8.743]
  - - [1216, 1216, 1, 64, 1216, 1216, 1216, 64]
    - [0, 9.066]
  - - [1344, 1216, 1, 64, 1344, 1344, 1344, 64]
    - [0, 9.239]
  - - [1472, 1216, 1, 64, 1472, 1472, 1472, 64]
    - [0, 9.566]
  - - [1600, 1216, 1, 64, 1600, 1600, 1600, 64]
    - [0, 9.718]
  - - [1728, 1216, 1, 64, 1728, 1728, 1728, 64]
    - [0, 10.013]
  - - [1856, 1216, 1, 64, 1856, 1856, 1856, 64]
    - [0, 10.169]
  - - [1984, 1216, 1, 64, 1984, 1984, 1984, 64]
    - [0, 10.234]
  - - [2112, 1216, 1, 64, 2112, 2112, 2112, 64]
    - [0, 10.382]
  - - [2240, 1216, 1, 64, 2240, 2240, 2240, 64]
    - [0, 10.533]
  - - [2368, 1216, 1, 64, 2368, 2368, 2368, 64]
    - [0, 10.622]
  - - [2496, 1216, 1, 64, 2496, 2496, 2496, 64]
    - [0, 10.804]
  - - [2624, 1216, 1, 64, 2624, 2624, 2624, 64]
    - [0, 10.838]
  - - [2752, 1216, 1, 64, 2752, 2752, 2752, 64]
    - [0, 10.928]
  - - [2880, 1216, 1, 64, 2880, 2880, 2880, 64]
    - [0, 11.031]
  - - [3008, 1216, 1, 64, 3008, 3008, 3008, 64]
    - [0, 11.027]
  - - [3136, 1216, 1, 64, 3136, 3136, 3136, 64]
    - [0, 11.143]
  - - [3264, 1216, 1, 64, 3264, 3264, 3264, 64]
    - [0, 11.242]
  - - [3392, 1216, 1, 64, 3392, 3392, 3392, 64]
    - [0, 11.334]
  - - [3520, 1216, 1, 64, 3520, 3520, 3520, 64]
    - [0, 11.072]
  - - [3648, 1216, 1, 64, 3648, 3648, 3648, 64]
    - [0, 11.472]
  - - [3776, 1216, 1, 64, 3776, 3776, 3776, 64]
    - [0, 10.786]
  - - [3904, 1216, 1, 64, 3904, 3904, 3904, 64]
    - [0, 11.505]
  - - [4032, 1216, 1, 64, 4032, 4032, 4032, 64]
    - [0, 11.523]
  - - [64, 1344, 1, 64, 64, 64, 64, 64]
    - [0, 1.655]
  - - [192, 1344, 1, 64, 192, 192, 192, 64]
    - [2, 3.486]
  - - [320, 1344, 1, 64, 320, 320, 320, 64]
    - [0, 5.23]
  - - [448, 1344, 1, 64, 448, 448, 448, 64]
    - [0, 6.325]
  - - [576, 1344, 1, 64, 576, 576, 576, 64]
    - [0, 7.118]
  - - [704, 1344, 1, 64, 704, 704, 704, 64]
    - [0, 7.696]
  - - [832, 1344, 1, 64, 832, 832, 832, 64]
    - [0, 8.243]
  - - [960, 1344, 1, 64, 960, 960, 960, 64]
    - [0, 8.615]
  - - [1088, 1344, 1, 64, 1088, 1088, 1088, 64]
    - [0, 9.041]
  - - [1216, 1344, 1, 64, 1216, 1216, 1216, 64]
    - [0, 9.306]
  - - [1344, 1344, 1, 64, 1344, 1344, 1344, 64]
    - [0, 9.595]
  - - [1472, 1344, 1, 64, 1472, 1472, 1472, 64]
    - [0, 9.783]
  - - [1600, 1344, 1, 64, 1600, 1600, 1600, 64]
    - [0, 10.026]
  - - [1728, 1344, 1, 64, 1728, 1728, 1728, 64]
    - [0, 10.149]
  - - [1856, 1344, 1, 64, 1856, 1856, 1856, 64]
    - [0, 10.363]
  - - [1984, 1344, 1, 64, 1984, 1984, 1984, 64]
    - [0, 10.507]
  - - [2112, 1344, 1, 64, 2112, 2112, 2112, 64]
    - [0, 10.605]
  - - [2240, 1344, 1, 64, 2240, 2240, 2240, 64]
    - [0, 10.76]
  - - [2368, 1344, 1, 64, 2368, 2368, 2368, 64]
    - [0, 10.865]
  - - [2496, 1344, 1, 64, 2496, 2496, 2496, 64]
    - [0, 11.031]
  - - [2624, 1344, 1, 64, 2624, 2624, 2624, 64]
    - [0, 11.024]
  - - [2752, 1344, 1, 64, 2752, 2752, 2752, 64]
    - [0, 11.059]
  - - [2880, 1344, 1, 64, 2880, 2880, 2880, 64]
    - [0, 11.201]
  - - [3008, 1344, 1, 64, 3008, 3008, 3008, 64]
    - [0, 11.284]
  - - [3136, 1344, 1, 64, 3136, 3136, 3136, 64]
    - [0, 11.332]
  - - [3264, 1344, 1, 64, 3264, 3264, 3264, 64]
    - [0, 10.781]
  - - [3392, 1344, 1, 64, 3392, 3392, 3392, 64]
    - [0, 11.588]
  - - [3520, 1344, 1, 64, 3520, 3520, 3520, 64]
    - [0, 11.402]
  - - [3648, 1344, 1, 64, 3648, 3648, 3648, 64]
    - [0, 11.534]
  - - [3776, 1344, 1, 64, 3776, 3776, 3776, 64]
    - [0, 11.632]
  - - [3904, 1344, 1, 64, 3904, 3904, 3904, 64]
    - [0, 12.047]
  - - [4032, 1344, 1, 64, 4032, 4032, 4032, 64]
    - [0, 11.562]
  - - [64, 1472, 1, 64, 64, 64, 64, 64]
    - [0, 1.812]
  - - [192, 1472, 1, 64, 192, 192, 192, 64]
    - [0, 4.167]
  - - [320, 1472, 1, 64, 320, 320, 320, 64]
    - [0, 5.592]
  - - [448, 1472, 1, 64, 448, 448, 448, 64]
    - [0, 6.559]
  - - [576, 1472, 1, 64, 576, 576, 576, 64]
    - [0, 7.381]
  - - [704, 1472, 1, 64, 704, 704, 704, 64]
    - [0, 7.989]
  - - [832, 1472, 1, 64, 832, 832, 832, 64]
    - [0, 8.471]
  - - [960, 1472, 1, 64, 960, 960, 960, 64]
    - [0, 8.903]
  - - [1088, 1472, 1, 64, 1088, 1088, 1088, 64]
    - [0, 9.264]
  - - [1216, 1472, 1, 64, 1216, 1216, 1216, 64]
    - [0, 9.546]
  - - [1344, 1472, 1, 64, 1344, 1344, 1344, 64]
    - [0, 9.757]
  - - [1472, 1472, 1, 64, 1472, 1472, 1472, 64]
    - [0, 10.03]
  - - [1600, 1472, 1, 64, 1600, 1600, 1600, 64]
    - [0, 10.197]
  - - [1728, 1472, 1, 64, 1728, 1728, 1728, 64]
    - [0, 10.411]
  - - [1856, 1472, 1, 64, 1856, 1856, 1856, 64]
    - [0, 10.56]
  - - [1984, 1472, 1, 64, 1984, 1984, 1984, 64]
    - [0, 10.642]
  - - [2112, 1472, 1, 64, 2112, 2112, 2112, 64]
    - [0, 10.889]
  - - [2240, 1472, 1, 64, 2240, 2240, 2240, 64]
    - [0, 10.903]
  - - [2368, 1472, 1, 64, 2368, 2368, 2368, 64]
    - [0, 10.935]
  - - [2496, 1472, 1, 64, 2496, 2496, 2496, 64]
    - [0, 11.092]
  - - [2624, 1472, 1, 64, 2624, 2624, 2624, 64]
    - [0, 11.237]
  - - [2752, 1472, 1, 64, 2752, 2752, 2752, 64]
    - [0, 11.374]
  - - [2880, 1472, 1, 64, 2880, 2880, 2880, 64]
    - [0, 11.569]
  - - [3008, 1472, 1, 64, 3008, 3008, 3008, 64]
    - [0, 11.758]
  - - [3136, 1472, 1, 64, 3136, 3136, 3136, 64]
    - [0, 11.383]
  - - [3264, 1472, 1, 64, 3264, 3264, 3264, 64]
    - [0, 11.793]
  - - [3392, 1472, 1, 64, 3392, 3392, 3392, 64]
    - [0, 10.677]
  - - [3520, 1472, 1, 64, 3520, 3520, 3520, 64]
    - [0, 11.48]
  - - [3648, 1472, 1, 64, 3648, 3648, 3648, 64]
    - [0, 11.25]
  - - [3776, 1472, 1, 64, 3776, 3776, 3776, 64]
    - [0, 11.87]
  - - [3904, 1472, 1, 64, 3904, 3904, 3904, 64]
    - [0, 11.156]
  - - [4032, 1472, 1, 64, 4032, 4032, 4032, 64]
    - [0, 11.288]
  - - [64, 1600, 1, 64, 64, 64, 64, 64]
    - [2, 0.424]
  - - [192, 1600, 1, 64, 192, 192, 192, 64]
    - [0, 1.268]
  - - [320, 1600, 1, 64, 320, 320, 320, 64]
    - [0, 4.089]
  - - [448, 1600, 1, 64, 448, 448, 448, 64]
    - [0, 5.695]
  - - [576, 1600, 1, 64, 576, 576, 576, 64]
    - [0, 7.347]
  - - [704, 1600, 1, 64, 704, 704, 704, 64]
    - [0, 8.21]
  - - [832, 1600, 1, 64, 832, 832, 832, 64]
    - [0, 8.691]
  - - [960, 1600, 1, 64, 960, 960, 960, 64]
    - [0, 9.126]
  - - [1088, 1600, 1, 64, 1088, 1088, 1088, 64]
    - [0, 9.491]
  - - [1216, 1600, 1, 64, 1216, 1216, 1216, 64]
    - [0, 9.719]
  - - [1344, 1600, 1, 64, 1344, 1344, 1344, 64]
    - [0, 9.97]
  - - [1472, 1600, 1, 64, 1472, 1472, 1472, 64]
    - [0, 10.249]
  - - [1600, 1600, 1, 64, 1600, 1600, 1600, 64]
    - [0, 10.377]
  - - [1728, 1600, 1, 64, 1728, 1728, 1728, 64]
    - [0, 10.577]
  - - [1856, 1600, 1, 64, 1856, 1856, 1856, 64]
    - [0, 10.703]
  - - [1984, 1600, 1, 64, 1984, 1984, 1984, 64]
    - [0, 10.838]
  - - [2112, 1600, 1, 64, 2112, 2112, 2112, 64]
    - [0, 10.959]
  - - [2240, 1600, 1, 64, 2240, 2240, 2240, 64]
    - [0, 11.12]
  - - [2368, 1600, 1, 64, 2368, 2368, 2368, 64]
    - [0, 11.151]
  - - [2496, 1600, 1, 64, 2496, 2496, 2496, 64]
    - [0, 11.6]
  - - [2624, 1600, 1, 64, 2624, 2624, 2624, 64]
    - [0, 11.479]
  - - [2752, 1600, 1, 64, 2752, 2752, 2752, 64]
    - [0, 11.381]
  - - [2880, 1600, 1, 64, 2880, 2880, 2880, 64]
    - [0, 11.459]
  - - [3008, 1600, 1, 64, 3008, 3008, 3008, 64]
    - [0, 11.413]
  - - [3136, 1600, 1, 64, 3136, 3136, 3136, 64]
    - [0, 11.609]
  - - [3264, 1600, 1, 64, 3264, 3264, 3264, 64]
    - [0, 11.535]
  - - [3392, 1600, 1, 64, 3392, 3392, 3392, 64]
    - [0, 11.509]
  - - [3520, 1600, 1, 64, 3520, 3520, 3520, 64]
    - [0, 11.612]
  - - [3648, 1600, 1, 64, 3648, 3648, 3648, 64]
    - [0, 11.912]
  - - [3776, 1600, 1, 64, 3776, 3776, 3776, 64]
    - [0, 11.854]
  - - [3904, 1600, 1, 64, 3904, 3904, 3904, 64]
    - [0, 11.556]
  - - [4032, 1600, 1, 64, 4032, 4032, 4032, 64]
    - [0, 10.641]
  - - [64, 1728, 1, 64, 64, 64, 64, 64]
    - [2, 0.458]
  - - [192, 1728, 1, 64, 192, 192, 192, 64]
    - [3, 2.632]
  - - [320, 1728, 1, 64, 320, 320, 320, 64]
    - [0, 4.414]
  - - [448, 1728, 1, 64, 448, 448, 448, 64]
    - [2, 6.161]
  - - [576, 1728, 1, 64, 576, 576, 576, 64]
    - [0, 7.85]
  - - [704, 1728, 1, 64, 704, 704, 704, 64]
    - [0, 8.47]
  - - [832, 1728, 1, 64, 832, 832, 832, 64]
    - [0, 8.97]
  - - [960, 1728, 1, 64, 960, 960, 960, 64]
    - [0, 9.33]
  - - [1088, 1728, 1, 64, 1088, 1088, 1088, 64]
    - [0, 9.685]
  - - [1216, 1728, 1, 64, 1216, 1216, 1216, 64]
    - [0, 9.914]
  - - [1344, 1728, 1, 64, 1344, 1344, 1344, 64]
    - [0, 10.159]
  - - [1472, 1728, 1, 64, 1472, 1472, 1472, 64]
    - [0, 10.372]
  - - [1600, 1728, 1, 64, 1600, 1600, 1600, 64]
    - [0, 10.545]
  - - [1728, 1728, 1, 64, 1728, 1728, 1728, 64]
    - [0, 10.775]
  - - [1856, 1728, 1, 64, 1856, 1856, 1856, 64]
    - [0, 10.834]
  - - [1984, 1728, 1, 64, 1984, 1984, 1984, 64]
    - [0, 10.985]
  - - [2112, 1728, 1, 64, 2112, 2112, 2112, 64]
    - [0, 11.33]
  - - [2240, 1728, 1, 64, 2240, 2240, 2240, 64]
    - [0, 11.2]
  - - [2368, 1728, 1, 64, 2368, 2368, 2368, 64]
    - [0, 11.276]
  - - [2496, 1728, 1, 64, 2496, 2496, 2496, 64]
    - [0, 11.426]
  - - [2624, 1728, 1, 64, 2624, 2624, 2624, 64]
    - [0, 11.58]
  - - [2752, 1728, 1, 64, 2752, 2752, 2752, 64]
    - [0, 11.529]
  - - [2880, 1728, 1, 64, 2880, 2880, 2880, 64]
    - [0, 11.489]
  - - [3008, 1728, 1, 64, 3008, 3008, 3008, 64]
    - [0, 11.78]
  - - [3136, 1728, 1, 64, 3136, 3136, 3136, 64]
    - [0, 11.204]
  - - [3264, 1728, 1, 64, 3264, 3264, 3264, 64]
    - [0, 11.071]
  - - [3392, 1728, 1, 64, 3392, 3392, 3392, 64]
    - [0, 12.149]
  - - [3520, 1728, 1, 64, 3520, 3520, 3520, 64]
    - [0, 11.122]
  - - [3648, 1728, 1, 64, 3648, 3648, 3648, 64]
    - [0, 10.761]
  - - [3776, 1728, 1, 64, 3776, 3776, 3776, 64]
    - [0, 10.837]
  - - [3904, 1728, 1, 64, 3904, 3904, 3904, 64]
    - [0, 10.609]
  - - [4032, 1728, 1, 64, 4032, 4032, 4032, 64]
    - [0, 10.364]
  - - [64, 1856, 1, 64, 64, 64, 64, 64]
    - [2, 0.491]
  - - [192, 1856, 1, 64, 192, 192, 192, 64]
    - [3, 2.814]
  - - [320, 1856, 1, 64, 320, 320, 320, 64]
    - [0, 4.743]
  - - [448, 1856, 1, 64, 448, 448, 448, 64]
    - [2, 6.26]
  - - [576, 1856, 1, 64, 576, 576, 576, 64]
    - [0, 8.025]
  - - [704, 1856, 1, 64, 704, 704, 704, 64]
    - [0, 8.626]
  - - [832, 1856, 1, 64, 832, 832, 832, 64]
    - [0, 9.159]
  - - [960, 1856, 1, 64, 960, 960, 960, 64]
    - [0, 9.569]
  - - [1088, 1856, 1, 64, 1088, 1088, 1088, 64]
    - [0, 9.842]
  - - [1216, 1856, 1, 64, 1216, 1216, 1216, 64]
    - [0, 10.123]
  - - [1344, 1856, 1, 64, 1344, 1344, 1344, 64]
    - [0, 10.345]
  - - [1472, 1856, 1, 64, 1472, 1472, 1472, 64]
    - [0, 10.591]
  - - [1600, 1856, 1, 64, 1600, 1600, 1600, 64]
    - [0, 10.738]
  - - [1728, 1856, 1, 64, 1728, 1728, 1728, 64]
    - [0, 10.879]
  - - [1856, 1856, 1, 64, 1856, 1856, 1856, 64]
    - [0, 11.365]
  - - [1984, 1856, 1, 64, 1984, 1984, 1984, 64]
    - [0, 11.133]
  - - [2112, 1856, 1, 64, 2112, 2112, 2112, 64]
    - [0, 11.247]
  - - [2240, 1856, 1, 64, 2240, 2240, 2240, 64]
    - [0, 11.706]
  - - [2368, 1856, 1, 64, 2368, 2368, 2368, 64]
    - [0, 11.404]
  - - [2496, 1856, 1, 64, 2496, 2496, 2496, 64]
    - [0, 11.585]
  - - [2624, 1856, 1, 64, 2624, 2624, 2624, 64]
    - [0, 11.751]
  - - [2752, 1856, 1, 64, 2752, 2752, 2752, 64]
    - [0, 11.632]
  - - [2880, 1856, 1, 64, 2880, 2880, 2880, 64]
    - [0, 11.563]
  - - [3008, 1856, 1, 64, 3008, 3008, 3008, 64]
    - [0, 11.758]
  - - [3136, 1856, 1, 64, 3136, 3136, 3136, 64]
    - [0, 11.82]
  - - [3264, 1856, 1, 64, 3264, 3264, 3264, 64]
    - [0, 10.706]
  - - [3392, 1856, 1, 64, 3392, 3392, 3392, 64]
    - [0, 12.065]
  - - [3520, 1856, 1, 64, 3520, 3520, 3520, 64]
    - [0, 12.23]
  - - [3648, 1856, 1, 64, 3648, 3648, 3648, 64]
    - [0, 10.387]
  - - [3776, 1856, 1, 64, 3776, 3776, 3776, 64]
    - [0, 10.624]
  - - [3904, 1856, 1, 64, 3904, 3904, 3904, 64]
    - [0, 11.542]
  - - [4032, 1856, 1, 64, 4032, 4032, 4032, 64]
    - [0, 10.497]
  - - [64, 1984, 1, 64, 64, 64, 64, 64]
    - [3, 0.523]
  - - [192, 1984, 1, 64, 192, 192, 192, 64]
    - [1, 3.024]
  - - [320, 1984, 1, 64, 320, 320, 320, 64]
    - [0, 5.042]
  - - [448, 1984, 1, 64, 448, 448, 448, 64]
    - [0, 7.082]
  - - [576, 1984, 1, 64, 576, 576, 576, 64]
    - [0, 8.276]
  - - [704, 1984, 1, 64, 704, 704, 704, 64]
    - [0, 8.869]
  - - [832, 1984, 1, 64, 832, 832, 832, 64]
    - [0, 9.367]
  - - [960, 1984, 1, 64, 960, 960, 960, 64]
    - [0, 9.688]
  - - [1088, 1984, 1, 64, 1088, 1088, 1088, 64]
    - [0, 10.074]
  - - [1216, 1984, 1, 64, 1216, 1216, 1216, 64]
    - [0, 10.348]
  - - [1344, 1984, 1, 64, 1344, 1344, 1344, 64]
    - [0, 10.53]
  - - [1472, 1984, 1, 64, 1472, 1472, 1472, 64]
    - [0, 10.703]
  - - [1600, 1984, 1, 64, 1600, 1600, 1600, 64]
    - [0, 10.869]
  - - [1728, 1984, 1, 64, 1728, 1728, 1728, 64]
    - [0, 11.052]
  - - [1856, 1984, 1, 64, 1856, 1856, 1856, 64]
    - [0, 11.185]
  - - [1984, 1984, 1, 64, 1984, 1984, 1984, 64]
    - [0, 11.246]
  - - [2112, 1984, 1, 64, 2112, 2112, 2112, 64]
    - [0, 11.336]
  - - [2240, 1984, 1, 64, 2240, 2240, 2240, 64]
    - [0, 11.392]
  - - [2368, 1984, 1, 64, 2368, 2368, 2368, 64]
    - [0, 11.433]
  - - [2496, 1984, 1, 64, 2496, 2496, 2496, 64]
    - [0, 11.557]
  - - [2624, 1984, 1, 64, 2624, 2624, 2624, 64]
    - [0, 11.758]
  - - [2752, 1984, 1, 64, 2752, 2752, 2752, 64]
    - [0, 11.65]
  - - [2880, 1984, 1, 64, 2880, 2880, 2880, 64]
    - [0, 10.911]
  - - [3008, 1984, 1, 64, 3008, 3008, 3008, 64]
    - [0, 11.97]
  - - [3136, 1984, 1, 64, 3136, 3136, 3136, 64]
    - [0, 10.611]
  - - [3264, 1984, 1, 64, 3264, 3264, 3264, 64]
    - [0, 10.986]
  - - [3392, 1984, 1, 64, 3392, 3392, 3392, 64]
    - [0, 9.721]
  - - [3520, 1984, 1, 64, 3520, 3520, 3520, 64]
    - [0, 10.977]
  - - [3648, 1984, 1, 64, 3648, 3648, 3648, 64]
    - [0, 11.218]
  - - [3776, 1984, 1, 64, 3776, 3776, 3776, 64]
    - [0, 10.532]
  - - [3904, 1984, 1, 64, 3904, 3904, 3904, 64]
    - [0, 10.019]
  - - [4032, 1984, 1, 64, 4032, 4032, 4032, 64]
    - [0, 11.889]
  - - [64, 2112, 1, 64, 64, 64, 64, 64]
    - [2, 0.558]
  - - [192, 2112, 1, 64, 192, 192, 192, 64]
    - [2, 3.208]
  - - [320, 2112, 1, 64, 320, 320, 320, 64]
    - [2, 5.37]
  - - [448, 2112, 1, 64, 448, 448, 448, 64]
    - [0, 7.657]
  - - [576, 2112, 1, 64, 576, 576, 576, 64]
    - [0, 8.474]
  - - [704, 2112, 1, 64, 704, 704, 704, 64]
    - [0, 9.023]
  - - [832, 2112, 1, 64, 832, 832, 832, 64]
    - [0, 9.493]
  - - [960, 2112, 1, 64, 960, 960, 960, 64]
    - [0, 9.956]
  - - [1088, 2112, 1, 64, 1088, 1088, 1088, 64]
    - [0, 10.166]
  - - [1216, 2112, 1, 64, 1216, 1216, 1216, 64]
    - [0, 10.488]
  - - [1344, 2112, 1, 64, 1344, 1344, 1344, 64]
    - [0, 10.731]
  - - [1472, 2112, 1, 64, 1472, 1472, 1472, 64]
    - [0, 10.79]
  - - [1600, 2112, 1, 64, 1600, 1600, 1600, 64]
    - [0, 10.995]
  - - [1728, 2112, 1, 64, 1728, 1728, 1728, 64]
    - [0, 11.134]
  - - [1856, 2112, 1, 64, 1856, 1856, 1856, 64]
    - [0, 11.123]
  - - [1984, 2112, 1, 64, 1984, 1984, 1984, 64]
    - [0, 11.369]
  - - [2112, 2112, 1, 64, 2112, 2112, 2112, 64]
    - [0, 11.767]
  - - [2240, 2112, 1, 64, 2240, 2240, 2240, 64]
    - [0, 11.592]
  - - [2368, 2112, 1, 64, 2368, 2368, 2368, 64]
    - [0, 11.545]
  - - [2496, 2112, 1, 64, 2496, 2496, 2496, 64]
    - [0, 11.137]
  - - [2624, 2112, 1, 64, 2624, 2624, 2624, 64]
    - [0, 10.929]
  - - [2752, 2112, 1, 64, 2752, 2752, 2752, 64]
    - [0, 11.387]
  - - [2880, 2112, 1, 64, 2880, 2880, 2880, 64]
    - [0, 11.009]
  - - [3008, 2112, 1, 64, 3008, 3008, 3008, 64]
    - [0, 10.856]
  - - [3136, 2112, 1, 64, 3136, 3136, 3136, 64]
    - [0, 11.087]
  - - [3264, 2112, 1, 64, 3264, 3264, 3264, 64]
    - [0, 11.804]
  - - [3392, 2112, 1, 64, 3392, 3392, 3392, 64]
    - [0, 10.141]
  - - [3520, 2112, 1, 64, 3520, 3520, 3520, 64]
    - [0, 10.439]
  - - [3648, 2112, 1, 64, 3648, 3648, 3648, 64]
    - [0, 9.912]
  - - [3776, 2112, 1, 64, 3776, 3776, 3776, 64]
    - [0, 11.634]
  - - [3904, 2112, 1, 64, 3904, 3904, 3904, 64]
    - [0, 10.026]
  - - [4032, 2112, 1, 64, 4032, 4032, 4032, 64]
    - [0, 9.586]
  - - [64, 2240, 1, 64, 64, 64, 64, 64]
    - [2, 0.592]
  - - [192, 2240, 1, 64, 192, 192, 192, 64]
    - [1, 3.398]
  - - [320, 2240, 1, 64, 320, 320, 320, 64]
    - [0, 5.694]
  - - [448, 2240, 1, 64, 448, 448, 448, 64]
    - [0, 7.841]
  - - [576, 2240, 1, 64, 576, 576, 576, 64]
    - [0, 8.645]
  - - [704, 2240, 1, 64, 704, 704, 704, 64]
    - [0, 9.174]
  - - [832, 2240, 1, 64, 832, 832, 832, 64]
    - [0, 9.665]
  - - [960, 2240, 1, 64, 960, 960, 960, 64]
    - [0, 9.983]
  - - [1088, 2240, 1, 64, 1088, 1088, 1088, 64]
    - [0, 10.364]
  - - [1216, 2240, 1, 64, 1216, 1216, 1216, 64]
    - [0, 10.543]
  - - [1344, 2240, 1, 64, 1344, 1344, 1344, 64]
    - [0, 10.684]
  - - [1472, 2240, 1, 64, 1472, 1472, 1472, 64]
    - [0, 10.97]
  - - [1600, 2240, 1, 64, 1600, 1600, 1600, 64]
    - [0, 11.041]
  - - [1728, 2240, 1, 64, 1728, 1728, 1728, 64]
    - [0, 11.207]
  - - [1856, 2240, 1, 64, 1856, 1856, 1856, 64]
    - [0, 11.418]
  - - [1984, 2240, 1, 64, 1984, 1984, 1984, 64]
    - [0, 11.7]
  - - [2112, 2240, 1, 64, 2112, 2112, 2112, 64]
    - [0, 11.579]
  - - [2240, 2240, 1, 64, 2240, 2240, 2240, 64]
    - [0, 11.509]
  - - [2368, 2240, 1, 64, 2368, 2368, 2368, 64]
    - [0, 11.451]
  - - [2496, 2240, 1, 64, 2496, 2496, 2496, 64]
    - [0, 11.698]
  - - [2624, 2240, 1, 64, 2624, 2624, 2624, 64]
    - [0, 11.579]
  - - [2752, 2240, 1, 64, 2752, 2752, 2752, 64]
    - [0, 11.895]
  - - [2880, 2240, 1, 64, 2880, 2880, 2880, 64]
    - [0, 12.035]
  - - [3008, 2240, 1, 64, 3008, 3008, 3008, 64]
    - [0, 11.354]
  - - [3136, 2240, 1, 64, 3136, 3136, 3136, 64]
    - [0, 10.903]
  - - [3264, 2240, 1, 64, 3264, 3264, 3264, 64]
    - [0, 10.244]
  - - [3392, 2240, 1, 64, 3392, 3392, 3392, 64]
    - [0, 10.305]
  - - [3520, 2240, 1, 64, 3520, 3520, 3520, 64]
    - [0, 9.657]
  - - [3648, 2240, 1, 64, 3648, 3648, 3648, 64]
    - [0, 9.599]
  - - [3776, 2240, 1, 64, 3776, 3776, 3776, 64]
    - [0, 10.111]
  - - [3904, 2240, 1, 64, 3904, 3904, 3904, 64]
    - [0, 9.339]
  - - [4032, 2240, 1, 64, 4032, 4032, 4032, 64]
    - [0, 9.824]
  - - [64, 2368, 1, 64, 64, 64, 64, 64]
    - [3, 0.625]
  - - [192, 2368, 1, 64, 192, 192, 192, 64]
    - [2, 3.598]
  - - [320, 2368, 1, 64, 320, 320, 320, 64]
    - [0, 5.997]
  - - [448, 2368, 1, 64, 448, 448, 448, 64]
    - [0, 8.061]
  - - [576, 2368, 1, 64, 576, 576, 576, 64]
    - [0, 8.791]
  - - [704, 2368, 1, 64, 704, 704, 704, 64]
    - [0, 9.331]
  - - [832, 2368, 1, 64, 832, 832, 832, 64]
    - [0, 9.814]
  - - [960, 2368, 1, 64, 960, 960, 960, 64]
    - [0, 10.136]
  - - [1088, 2368, 1, 64, 1088, 1088, 1088, 64]
    - [0, 10.426]
  - - [1216, 2368, 1, 64, 1216, 1216, 1216, 64]
    - [0, 10.601]
  - - [1344, 2368, 1, 64, 1344, 1344, 1344, 64]
    - [0, 11.06]
  - - [1472, 2368, 1, 64, 1472, 1472, 1472, 64]
    - [0, 11.121]
  - - [1600, 2368, 1, 64, 1600, 1600, 1600, 64]
    - [0, 11.195]
  - - [1728, 2368, 1, 64, 1728, 1728, 1728, 64]
    - [0, 11.504]
  - - [1856, 2368, 1, 64, 1856, 1856, 1856, 64]
    - [0, 11.517]
  - - [1984, 2368, 1, 64, 1984, 1984, 1984, 64]
    - [0, 11.548]
  - - [2112, 2368, 1, 64, 2112, 2112, 2112, 64]
    - [0, 11.604]
  - - [2240, 2368, 1, 64, 2240, 2240, 2240, 64]
    - [0, 11.742]
  - - [2368, 2368, 1, 64, 2368, 2368, 2368, 64]
    - [0, 11.723]
  - - [2496, 2368, 1, 64, 2496, 2496, 2496, 64]
    - [0, 11.668]
  - - [2624, 2368, 1, 64, 2624, 2624, 2624, 64]
    - [0, 12.086]
  - - [2752, 2368, 1, 64, 2752, 2752, 2752, 64]
    - [0, 11.004]
  - - [2880, 2368, 1, 64, 2880, 2880, 2880, 64]
    - [0, 11.52]
  - - [3008, 2368, 1, 64, 3008, 3008, 3008, 64]
    - [0, 10.732]
  - - [3136, 2368, 1, 64, 3136, 3136, 3136, 64]
    - [0, 10.065]
  - - [3264, 2368, 1, 64, 3264, 3264, 3264, 64]
    - [0, 10.331]
  - - [3392, 2368, 1, 64, 3392, 3392, 3392, 64]
    - [0, 11.585]
  - - [3520, 2368, 1, 64, 3520, 3520, 3520, 64]
    - [0, 9.817]
  - - [3648, 2368, 1, 64, 3648, 3648, 3648, 64]
    - [0, 8.934]
  - - [3776, 2368, 1, 64, 3776, 3776, 3776, 64]
    - [0, 10.359]
  - - [3904, 2368, 1, 64, 3904, 3904, 3904, 64]
    - [0, 9.677]
  - - [4032, 2368, 1, 64, 4032, 4032, 4032, 64]
    - [0, 9.751]
  - - [64, 2496, 1, 64, 64, 64, 64, 64]
    - [2, 0.659]
  - - [192, 2496, 1, 64, 192, 192, 192, 64]
    - [0, 1.969]
  - - [320, 2496, 1, 64, 320, 320, 320, 64]
    - [0, 6.364]
  - - [448, 2496, 1, 64, 448, 448, 448, 64]
    - [0, 8.169]
  - - [576, 2496, 1, 64, 576, 576, 576, 64]
    - [0, 9.0]
  - - [704, 2496, 1, 64, 704, 704, 704, 64]
    - [0, 9.499]
  - - [832, 2496, 1, 64, 832, 832, 832, 64]
    - [0, 9.961]
  - - [960, 2496, 1, 64, 960, 960, 960, 64]
    - [0, 10.274]
  - - [1088, 2496, 1, 64, 1088, 1088, 1088, 64]
    - [0, 10.549]
  - - [1216, 2496, 1, 64, 1216, 1216, 1216, 64]
    - [0, 10.821]
  - - [1344, 2496, 1, 64, 1344, 1344, 1344, 64]
    - [0, 11.141]
  - - [1472, 2496, 1, 64, 1472, 1472, 1472, 64]
    - [0, 11.121]
  - - [1600, 2496, 1, 64, 1600, 1600, 1600, 64]
    - [0, 11.502]
  - - [1728, 2496, 1, 64, 1728, 1728, 1728, 64]
    - [0, 11.541]
  - - [1856, 2496, 1, 64, 1856, 1856, 1856, 64]
    - [0, 11.436]
  - - [1984, 2496, 1, 64, 1984, 1984, 1984, 64]
    - [0, 11.469]
  - - [2112, 2496, 1, 64, 2112, 2112, 2112, 64]
    - [0, 11.827]
  - - [2240, 2496, 1, 64, 2240, 2240, 2240, 64]
    - [0, 11.71]
  - - [2368, 2496, 1, 64, 2368, 2368, 2368, 64]
    - [0, 11.205]
  - - [2496, 2496, 1, 64, 2496, 2496, 2496, 64]
    - [0, 11.437]
  - - [2624, 2496, 1, 64, 2624, 2624, 2624, 64]
    - [0, 11.796]
  - - [2752, 2496, 1, 64, 2752, 2752, 2752, 64]
    - [0, 10.643]
  - - [2880, 2496, 1, 64, 2880, 2880, 2880, 64]
    - [0, 12.035]
  - - [3008, 2496, 1, 64, 3008, 3008, 3008, 64]
    - [0, 10.588]
  - - [3136, 2496, 1, 64, 3136, 3136, 3136, 64]
    - [0, 12.049]
  - - [3264, 2496, 1, 64, 3264, 3264, 3264, 64]
    - [0, 9.661]
  - - [3392, 2496, 1, 64, 3392, 3392, 3392, 64]
    - [0, 10.129]
  - - [3520, 2496, 1, 64, 3520, 3520, 3520, 64]
    - [0, 10.103]
  - - [3648, 2496, 1, 64, 3648, 3648, 3648, 64]
    - [0, 10.245]
  - - [3776, 2496, 1, 64, 3776, 3776, 3776, 64]
    - [0, 9.806]
  - - [3904, 2496, 1, 64, 3904, 3904, 3904, 64]
    - [0, 10.077]
  - - [4032, 2496, 1, 64, 4032, 4032, 4032, 64]
    - [0, 9.755]
  - - [64, 2624, 1, 64, 64, 64, 64, 64]
    - [2, 0.692]
  - - [192, 2624, 1, 64, 192, 192, 192, 64]
    - [2, 3.983]
  - - [320, 2624, 1, 64, 320, 320, 320, 64]
    - [0, 6.693]
  - - [448, 2624, 1, 64, 448, 448, 448, 64]
    - [0, 8.324]
  - - [576, 2624, 1, 64, 576, 576, 576, 64]
    - [0, 9.14]
  - - [704, 2624, 1, 64, 704, 704, 704, 64]
    - [0, 9.618]
  - - [832, 2624, 1, 64, 832, 832, 832, 64]
    - [0, 10.016]
  - - [960, 2624, 1, 64, 960, 960, 960, 64]
    - [0, 10.407]
  - - [1088, 2624, 1, 64, 1088, 1088, 1088, 64]
    - [0, 10.631]
  - - [1216, 2624, 1, 64, 1216, 1216, 1216, 64]
    - [0, 10.909]
  - - [1344, 2624, 1, 64, 1344, 1344, 1344, 64]
    - [0, 11.021]
  - - [1472, 2624, 1, 64, 1472, 1472, 1472, 64]
    - [0, 11.177]
  - - [1600, 2624, 1, 64, 1600, 1600, 1600, 64]
    - [0, 11.372]
  - - [1728, 2624, 1, 64, 1728, 1728, 1728, 64]
    - [0, 11.477]
  - - [1856, 2624, 1, 64, 1856, 1856, 1856, 64]
    - [0, 11.796]
  - - [1984, 2624, 1, 64, 1984, 1984, 1984, 64]
    - [0, 11.634]
  - - [2112, 2624, 1, 64, 2112, 2112, 2112, 64]
    - [0, 11.885]
  - - [2240, 2624, 1, 64, 2240, 2240, 2240, 64]
    - [0, 11.882]
  - - [2368, 2624, 1, 64, 2368, 2368, 2368, 64]
    - [0, 10.591]
  - - [2496, 2624, 1, 64, 2496, 2496, 2496, 64]
    - [0, 10.669]
  - - [2624, 2624, 1, 64, 2624, 2624, 2624, 64]
    - [0, 12.308]
  - - [2752, 2624, 1, 64, 2752, 2752, 2752, 64]
    - [0, 10.307]
  - - [2880, 2624, 1, 64, 2880, 2880, 2880, 64]
    - [0, 10.312]
  - - [3008, 2624, 1, 64, 3008, 3008, 3008, 64]
    - [0, 10.197]
  - - [3136, 2624, 1, 64, 3136, 3136, 3136, 64]
    - [0, 9.911]
  - - [3264, 2624, 1, 64, 3264, 3264, 3264, 64]
    - [0, 10.214]
  - - [3392, 2624, 1, 64, 3392, 3392, 3392, 64]
    - [0, 9.69]
  - - [3520, 2624, 1, 64, 3520, 3520, 3520, 64]
    - [0, 10.644]
  - - [3648, 2624, 1, 64, 3648, 3648, 3648, 64]
    - [0, 9.054]
  - - [3776, 2624, 1, 64, 3776, 3776, 3776, 64]
    - [0, 10.414]
  - - [3904, 2624, 1, 64, 3904, 3904, 3904, 64]
    - [0, 10.075]
  - - [4032, 2624, 1, 64, 4032, 4032, 4032, 64]
    - [0, 10.346]
  - - [64, 2752, 1, 64, 64, 64, 64, 64]
    - [3, 0.727]
  - - [192, 2752, 1, 64, 192, 192, 192, 64]
    - [1, 4.151]
  - - [320, 2752, 1, 64, 320, 320, 320, 64]
    - [0, 7.016]
  - - [448, 2752, 1, 64, 448, 448, 448, 64]
    - [0, 8.462]
  - - [576, 2752, 1, 64, 576, 576, 576, 64]
    - [0, 9.236]
  - - [704, 2752, 1, 64, 704, 704, 704, 64]
    - [0, 9.719]
  - - [832, 2752, 1, 64, 832, 832, 832, 64]
    - [0, 10.165]
  - - [960, 2752, 1, 64, 960, 960, 960, 64]
    - [0, 10.44]
  - - [1088, 2752, 1, 64, 1088, 1088, 1088, 64]
    - [0, 10.697]
  - - [1216, 2752, 1, 64, 1216, 1216, 1216, 64]
    - [0, 10.888]
  - - [1344, 2752, 1, 64, 1344, 1344, 1344, 64]
    - [0, 11.162]
  - - [1472, 2752, 1, 64, 1472, 1472, 1472, 64]
    - [0, 11.241]
  - - [1600, 2752, 1, 64, 1600, 1600, 1600, 64]
    - [0, 11.421]
  - - [1728, 2752, 1, 64, 1728, 1728, 1728, 64]
    - [0, 11.607]
  - - [1856, 2752, 1, 64, 1856, 1856, 1856, 64]
    - [0, 11.267]
  - - [1984, 2752, 1, 64, 1984, 1984, 1984, 64]
    - [0, 11.282]
  - - [2112, 2752, 1, 64, 2112, 2112, 2112, 64]
    - [0, 11.472]
  - - [2240, 2752, 1, 64, 2240, 2240, 2240, 64]
    - [0, 11.642]
  - - [2368, 2752, 1, 64, 2368, 2368, 2368, 64]
    - [0, 10.605]
  - - [2496, 2752, 1, 64, 2496, 2496, 2496, 64]
    - [0, 10.324]
  - - [2624, 2752, 1, 64, 2624, 2624, 2624, 64]
    - [0, 10.791]
  - - [2752, 2752, 1, 64, 2752, 2752, 2752, 64]
    - [0, 10.392]
  - - [2880, 2752, 1, 64, 2880, 2880, 2880, 64]
    - [0, 9.948]
  - - [3008, 2752, 1, 64, 3008, 3008, 3008, 64]
    - [0, 9.713]
  - - [3136, 2752, 1, 64, 3136, 3136, 3136, 64]
    - [0, 8.922]
  - - [3264, 2752, 1, 64, 3264, 3264, 3264, 64]
    - [0, 9.97]
  - - [3392, 2752, 1, 64, 3392, 3392, 3392, 64]
    - [2, 8.738]
  - - [3520, 2752, 1, 64, 3520, 3520, 3520, 64]
    - [0, 9.813]
  - - [3648, 2752, 1, 64, 3648, 3648, 3648, 64]
    - [0, 9.607]
  - - [3776, 2752, 1, 64, 3776, 3776, 3776, 64]
    - [0, 9.876]
  - - [3904, 2752, 1, 64, 3904, 3904, 3904, 64]
    - [0, 9.398]
  - - [4032, 2752, 1, 64, 4032, 4032, 4032, 64]
    - [0, 10.368]
  - - [64, 2880, 1, 64, 64, 64, 64, 64]
    - [3, 1.428]
  - - [192, 2880, 1, 64, 192, 192, 192, 64]
    - [0, 4.378]
  - - [320, 2880, 1, 64, 320, 320, 320, 64]
    - [0, 7.307]
  - - [448, 2880, 1, 64, 448, 448, 448, 64]
    - [0, 8.623]
  - - [576, 2880, 1, 64, 576, 576, 576, 64]
    - [0, 9.377]
  - - [704, 2880, 1, 64, 704, 704, 704, 64]
    - [0, 9.84]
  - - [832, 2880, 1, 64, 832, 832, 832, 64]
    - [0, 10.212]
  - - [960, 2880, 1, 64, 960, 960, 960, 64]
    - [0, 10.529]
  - - [1088, 2880, 1, 64, 1088, 1088, 1088, 64]
    - [0, 10.856]
  - - [1216, 2880, 1, 64, 1216, 1216, 1216, 64]
    - [0, 11.041]
  - - [1344, 2880, 1, 64, 1344, 1344, 1344, 64]
    - [0, 11.186]
  - - [1472, 2880, 1, 64, 1472, 1472, 1472, 64]
    - [0, 11.27]
  - - [1600, 2880, 1, 64, 1600, 1600, 1600, 64]
    - [0, 11.569]
  - - [1728, 2880, 1, 64, 1728, 1728, 1728, 64]
    - [0, 11.394]
  - - [1856, 2880, 1, 64, 1856, 1856, 1856, 64]
    - [0, 11.476]
  - - [1984, 2880, 1, 64, 1984, 1984, 1984, 64]
    - [0, 11.06]
  - - [2112, 2880, 1, 64, 2112, 2112, 2112, 64]
    - [0, 12.006]
  - - [2240, 2880, 1, 64, 2240, 2240, 2240, 64]
    - [0, 11.187]
  - - [2368, 2880, 1, 64, 2368, 2368, 2368, 64]
    - [0, 10.419]
  - - [2496, 2880, 1, 64, 2496, 2496, 2496, 64]
    - [0, 10.829]
  - - [2624, 2880, 1, 64, 2624, 2624, 2624, 64]
    - [0, 10.488]
  - - [2752, 2880, 1, 64, 2752, 2752, 2752, 64]
    - [0, 10.283]
  - - [2880, 2880, 1, 64, 2880, 2880, 2880, 64]
    - [0, 9.749]
  - - [3008, 2880, 1, 64, 3008, 3008, 3008, 64]
    - [0, 9.671]
  - - [3136, 2880, 1, 64, 3136, 3136, 3136, 64]
    - [0, 10.342]
  - - [3264, 2880, 1, 64, 3264, 3264, 3264, 64]
    - [0, 9.157]
  - - [3392, 2880, 1, 64, 3392, 3392, 3392, 64]
    - [2, 9.157]
  - - [3520, 2880, 1, 64, 3520, 3520, 3520, 64]
    - [0, 10.37]
  - - [3648, 2880, 1, 64, 3648, 3648, 3648, 64]
    - [0, 9.678]
  - - [3776, 2880, 1, 64, 3776, 3776, 3776, 64]
    - [0, 10.097]
  - - [3904, 2880, 1, 64, 3904, 3904, 3904, 64]
    - [0, 9.988]
  - - [4032, 2880, 1, 64, 4032, 4032, 4032, 64]
    - [0, 9.852]
  - - [64, 3008, 1, 64, 64, 64, 64, 64]
    - [0, 3.191]
  - - [192, 3008, 1, 64, 192, 192, 192, 64]
    - [0, 6.342]
  - - [320, 3008, 1, 64, 320, 320, 320, 64]
    - [0, 7.758]
  - - [448, 3008, 1, 64, 448, 448, 448, 64]
    - [0, 8.72]
  - - [576, 3008, 1, 64, 576, 576, 576, 64]
    - [0, 9.48]
  - - [704, 3008, 1, 64, 704, 704, 704, 64]
    - [0, 9.973]
  - - [832, 3008, 1, 64, 832, 832, 832, 64]
    - [0, 10.335]
  - - [960, 3008, 1, 64, 960, 960, 960, 64]
    - [0, 10.778]
  - - [1088, 3008, 1, 64, 1088, 1088, 1088, 64]
    - [0, 10.882]
  - - [1216, 3008, 1, 64, 1216, 1216, 1216, 64]
    - [0, 11.106]
  - - [1344, 3008, 1, 64, 1344, 1344, 1344, 64]
    - [0, 11.514]
  - - [1472, 3008, 1, 64, 1472, 1472, 1472, 64]
    - [0, 11.478]
  - - [1600, 3008, 1, 64, 1600, 1600, 1600, 64]
    - [0, 11.357]
  - - [1728, 3008, 1, 64, 1728, 1728, 1728, 64]
    - [0, 11.613]
  - - [1856, 3008, 1, 64, 1856, 1856, 1856, 64]
    - [0, 12.138]
  - - [1984, 3008, 1, 64, 1984, 1984, 1984, 64]
    - [0, 11.128]
  - - [2112, 3008, 1, 64, 2112, 2112, 2112, 64]
    - [0, 11.422]
  - - [2240, 3008, 1, 64, 2240, 2240, 2240, 64]
    - [0, 11.208]
  - - [2368, 3008, 1, 64, 2368, 2368, 2368, 64]
    - [0, 10.946]
  - - [2496, 3008, 1, 64, 2496, 2496, 2496, 64]
    - [0, 9.789]
  - - [2624, 3008, 1, 64, 2624, 2624, 2624, 64]
    - [0, 9.82]
  - - [2752, 3008, 1, 64, 2752, 2752, 2752, 64]
    - [0, 10.783]
  - - [2880, 3008, 1, 64, 2880, 2880, 2880, 64]
    - [0, 10.23]
  - - [3008, 3008, 1, 64, 3008, 3008, 3008, 64]
    - [0, 10.629]
  - - [3136, 3008, 1, 64, 3136, 3136, 3136, 64]
    - [0, 9.71]
  - - [3264, 3008, 1, 64, 3264, 3264, 3264, 64]
    - [0, 10.239]
  - - [3392, 3008, 1, 64, 3392, 3392, 3392, 64]
    - [2, 9.634]
  - - [3520, 3008, 1, 64, 3520, 3520, 3520, 64]
    - [0, 9.995]
  - - [3648, 3008, 1, 64, 3648, 3648, 3648, 64]
    - [0, 9.5]
  - - [3776, 3008, 1, 64, 3776, 3776, 3776, 64]
    - [0, 10.292]
  - - [3904, 3008, 1, 64, 3904, 3904, 3904, 64]
    - [0, 10.608]
  - - [4032, 3008, 1, 64, 4032, 4032, 4032, 64]
    - [0, 10.387]
  - - [64, 3136, 1, 64, 64, 64, 64, 64]
    - [0, 0.826]
  - - [192, 3136, 1, 64, 192, 192, 192, 64]
    - [2, 4.777]
  - - [320, 3136, 1, 64, 320, 320, 320, 64]
    - [0, 7.894]
  - - [448, 3136, 1, 64, 448, 448, 448, 64]
    - [0, 8.862]
  - - [576, 3136, 1, 64, 576, 576, 576, 64]
    - [0, 9.614]
  - - [704, 3136, 1, 64, 704, 704, 704, 64]
    - [2, 8.334]
  - - [832, 3136, 1, 64, 832, 832, 832, 64]
    - [0, 10.435]
  - - [960, 3136, 1, 64, 960, 960, 960, 64]
    - [0, 10.742]
  - - [1088, 3136, 1, 64, 1088, 1088, 1088, 64]
    - [0, 11.009]
  - - [1216, 3136, 1, 64, 1216, 1216, 1216, 64]
    - [0, 11.227]
  - - [1344, 3136, 1, 64, 1344, 1344, 1344, 64]
    - [0, 11.569]
  - - [1472, 3136, 1, 64, 1472, 1472, 1472, 64]
    - [0, 11.616]
  - - [1600, 3136, 1, 64, 1600, 1600, 1600, 64]
    - [0, 10.884]
  - - [1728, 3136, 1, 64, 1728, 1728, 1728, 64]
    - [0, 10.806]
  - - [1856, 3136, 1, 64, 1856, 1856, 1856, 64]
    - [0, 10.997]
  - - [1984, 3136, 1, 64, 1984, 1984, 1984, 64]
    - [0, 11.167]
  - - [2112, 3136, 1, 64, 2112, 2112, 2112, 64]
    - [0, 10.879]
  - - [2240, 3136, 1, 64, 2240, 2240, 2240, 64]
    - [0, 9.62]
  - - [2368, 3136, 1, 64, 2368, 2368, 2368, 64]
    - [0, 10.461]
  - - [2496, 3136, 1, 64, 2496, 2496, 2496, 64]
    - [0, 10.369]
  - - [2624, 3136, 1, 64, 2624, 2624, 2624, 64]
    - [0, 11.25]
  - - [2752, 3136, 1, 64, 2752, 2752, 2752, 64]
    - [0, 9.828]
  - - [2880, 3136, 1, 64, 2880, 2880, 2880, 64]
    - [0, 9.267]
  - - [3008, 3136, 1, 64, 3008, 3008, 3008, 64]
    - [0, 10.103]
  - - [3136, 3136, 1, 64, 3136, 3136, 3136, 64]
    - [0, 10.573]
  - - [3264, 3136, 1, 64, 3264, 3264, 3264, 64]
    - [0, 9.784]
  - - [3392, 3136, 1, 64, 3392, 3392, 3392, 64]
    - [0, 9.933]
  - - [3520, 3136, 1, 64, 3520, 3520, 3520, 64]
    - [0, 10.212]
  - - [3648, 3136, 1, 64, 3648, 3648, 3648, 64]
    - [0, 10.509]
  - - [3776, 3136, 1, 64, 3776, 3776, 3776, 64]
    - [2, 9.392]
  - - [3904, 3136, 1, 64, 3904, 3904, 3904, 64]
    - [0, 10.64]
  - - [4032, 3136, 1, 64, 4032, 4032, 4032, 64]
    - [0, 11.593]
  - - [64, 3264, 1, 64, 64, 64, 64, 64]
    - [2, 0.864]
  - - [192, 3264, 1, 64, 192, 192, 192, 64]
    - [3, 4.986]
  - - [320, 3264, 1, 64, 320, 320, 320, 64]
    - [0, 7.978]
  - - [448, 3264, 1, 64, 448, 448, 448, 64]
    - [0, 8.979]
  - - [576, 3264, 1, 64, 576, 576, 576, 64]
    - [0, 9.629]
  - - [704, 3264, 1, 64, 704, 704, 704, 64]
    - [0, 10.154]
  - - [832, 3264, 1, 64, 832, 832, 832, 64]
    - [0, 10.552]
  - - [960, 3264, 1, 64, 960, 960, 960, 64]
    - [0, 10.854]
  - - [1088, 3264, 1, 64, 1088, 1088, 1088, 64]
    - [0, 11.291]
  - - [1216, 3264, 1, 64, 1216, 1216, 1216, 64]
    - [0, 11.21]
  - - [1344, 3264, 1, 64, 1344, 1344, 1344, 64]
    - [0, 11.364]
  - - [1472, 3264, 1, 64, 1472, 1472, 1472, 64]
    - [0, 10.88]
  - - [1600, 3264, 1, 64, 1600, 1600, 1600, 64]
    - [0, 10.925]
  - - [1728, 3264, 1, 64, 1728, 1728, 1728, 64]
    - [0, 11.764]
  - - [1856, 3264, 1, 64, 1856, 1856, 1856, 64]
    - [0, 10.9]
  - - [1984, 3264, 1, 64, 1984, 1984, 1984, 64]
    - [0, 9.79]
  - - [2112, 3264, 1, 64, 2112, 2112, 2112, 64]
    - [0, 11.802]
  - - [2240, 3264, 1, 64, 2240, 2240, 2240, 64]
    - [0, 9.178]
  - - [2368, 3264, 1, 64, 2368, 2368, 2368, 64]
    - [0, 10.008]
  - - [2496, 3264, 1, 64, 2496, 2496, 2496, 64]
    - [2, 9.203]
  - - [2624, 3264, 1, 64, 2624, 2624, 2624, 64]
    - [0, 10.068]
  - - [2752, 3264, 1, 64, 2752, 2752, 2752, 64]
    - [0, 9.921]
  - - [2880, 3264, 1, 64, 2880, 2880, 2880, 64]
    - [0, 9.759]
  - - [3008, 3264, 1, 64, 3008, 3008, 3008, 64]
    - [2, 9.48]
  - - [3136, 3264, 1, 64, 3136, 3136, 3136, 64]
    - [0, 10.69]
  - - [3264, 3264, 1, 64, 3264, 3264, 3264, 64]
    - [0, 9.73]
  - - [3392, 3264, 1, 64, 3392, 3392, 3392, 64]
    - [0, 9.93]
  - - [3520, 3264, 1, 64, 3520, 3520, 3520, 64]
    - [0, 10.217]
  - - [3648, 3264, 1, 64, 3648, 3648, 3648, 64]
    - [0, 9.952]
  - - [3776, 3264, 1, 64, 3776, 3776, 3776, 64]
    - [0, 12.159]
  - - [3904, 3264, 1, 64, 3904, 3904, 3904, 64]
    - [0, 10.509]
  - - [4032, 3264, 1, 64, 4032, 4032, 4032, 64]
    - [0, 10.612]
  - - [64, 3392, 1, 64, 64, 64, 64, 64]
    - [2, 0.896]
  - - [192, 3392, 1, 64, 192, 192, 192, 64]
    - [1, 5.211]
  - - [320, 3392, 1, 64, 320, 320, 320, 64]
    - [0, 8.101]
  - - [448, 3392, 1, 64, 448, 448, 448, 64]
    - [0, 9.089]
  - - [576, 3392, 1, 64, 576, 576, 576, 64]
    - [0, 9.746]
  - - [704, 3392, 1, 64, 704, 704, 704, 64]
    - [0, 10.23]
  - - [832, 3392, 1, 64, 832, 832, 832, 64]
    - [0, 10.597]
  - - [960, 3392, 1, 64, 960, 960, 960, 64]
    - [0, 10.897]
  - - [1088, 3392, 1, 64, 1088, 1088, 1088, 64]
    - [0, 11.05]
  - - [1216, 3392, 1, 64, 1216, 1216, 1216, 64]
    - [0, 11.134]
  - - [1344, 3392, 1, 64, 1344, 1344, 1344, 64]
    - [0, 11.258]
  - - [1472, 3392, 1, 64, 1472, 1472, 1472, 64]
    - [0, 11.007]
  - - [1600, 3392, 1, 64, 1600, 1600, 1600, 64]
    - [0, 11.295]
  - - [1728, 3392, 1, 64, 1728, 1728, 1728, 64]
    - [0, 11.457]
  - - [1856, 3392, 1, 64, 1856, 1856, 1856, 64]
    - [0, 10.123]
  - - [1984, 3392, 1, 64, 1984, 1984, 1984, 64]
    - [0, 9.177]
  - - [2112, 3392, 1, 64, 2112, 2112, 2112, 64]
    - [0, 9.671]
  - - [2240, 3392, 1, 64, 2240, 2240, 2240, 64]
    - [0, 9.725]
  - - [2368, 3392, 1, 64, 2368, 2368, 2368, 64]
    - [0, 10.422]
  - - [2496, 3392, 1, 64, 2496, 2496, 2496, 64]
    - [0, 9.74]
  - - [2624, 3392, 1, 64, 2624, 2624, 2624, 64]
    - [0, 9.746]
  - - [2752, 3392, 1, 64, 2752, 2752, 2752, 64]
    - [0, 10.295]
  - - [2880, 3392, 1, 64, 2880, 2880, 2880, 64]
    - [0, 9.195]
  - - [3008, 3392, 1, 64, 3008, 3008, 3008, 64]
    - [0, 10.134]
  - - [3136, 3392, 1, 64, 3136, 3136, 3136, 64]
    - [0, 10.041]
  - - [3264, 3392, 1, 64, 3264, 3264, 3264, 64]
    - [0, 9.822]
  - - [3392, 3392, 1, 64, 3392, 3392, 3392, 64]
    - [0, 10.004]
  - - [3520, 3392, 1, 64, 3520, 3520, 3520, 64]
    - [0, 9.867]
  - - [3648, 3392, 1, 64, 3648, 3648, 3648, 64]
    - [0, 10.4]
  - - [3776, 3392, 1, 64, 3776, 3776, 3776, 64]
    - [0, 10.546]
  - - [3904, 3392, 1, 64, 3904, 3904, 3904, 64]
    - [0, 10.275]
  - - [4032, 3392, 1, 64, 4032, 4032, 4032, 64]
    - [0, 10.382]
  - - [64, 3520, 1, 64, 64, 64, 64, 64]
    - [3, 0.93]
  - - [192, 3520, 1, 64, 192, 192, 192, 64]
    - [0, 5.367]
  - - [320, 3520, 1, 64, 320, 320, 320, 64]
    - [0, 8.21]
  - - [448, 3520, 1, 64, 448, 448, 448, 64]
    - [0, 9.242]
  - - [576, 3520, 1, 64, 576, 576, 576, 64]
    - [0, 9.874]
  - - [704, 3520, 1, 64, 704, 704, 704, 64]
    - [0, 10.358]
  - - [832, 3520, 1, 64, 832, 832, 832, 64]
    - [0, 10.647]
  - - [960, 3520, 1, 64, 960, 960, 960, 64]
    - [0, 10.992]
  - - [1088, 3520, 1, 64, 1088, 1088, 1088, 64]
    - [0, 11.276]
  - - [1216, 3520, 1, 64, 1216, 1216, 1216, 64]
    - [0, 11.176]
  - - [1344, 3520, 1, 64, 1344, 1344, 1344, 64]
    - [0, 11.638]
  - - [1472, 3520, 1, 64, 1472, 1472, 1472, 64]
    - [0, 11.457]
  - - [1600, 3520, 1, 64, 1600, 1600, 1600, 64]
    - [0, 11.036]
  - - [1728, 3520, 1, 64, 1728, 1728, 1728, 64]
    - [0, 11.578]
  - - [1856, 3520, 1, 64, 1856, 1856, 1856, 64]
    - [0, 11.06]
  - - [1984, 3520, 1, 64, 1984, 1984, 1984, 64]
    - [0, 11.87]
  - - [2112, 3520, 1, 64, 2112, 2112, 2112, 64]
    - [0, 10.061]
  - - [2240, 3520, 1, 64, 2240, 2240, 2240, 64]
    - [0, 10.345]
  - - [2368, 3520, 1, 64, 2368, 2368, 2368, 64]
    - [0, 9.958]
  - - [2496, 3520, 1, 64, 2496, 2496, 2496, 64]
    - [0, 9.584]
  - - [2624, 3520, 1, 64, 2624, 2624, 2624, 64]
    - [0, 9.093]
  - - [2752, 3520, 1, 64, 2752, 2752, 2752, 64]
    - [0, 9.331]
  - - [2880, 3520, 1, 64, 2880, 2880, 2880, 64]
    - [0, 9.773]
  - - [3008, 3520, 1, 64, 3008, 3008, 3008, 64]
    - [0, 10.419]
  - - [3136, 3520, 1, 64, 3136, 3136, 3136, 64]
    - [0, 10.115]
  - - [3264, 3520, 1, 64, 3264, 3264, 3264, 64]
    - [0, 10.647]
  - - [3392, 3520, 1, 64, 3392, 3392, 3392, 64]
    - [0, 10.703]
  - - [3520, 3520, 1, 64, 3520, 3520, 3520, 64]
    - [0, 10.865]
  - - [3648, 3520, 1, 64, 3648, 3648, 3648, 64]
    - [0, 10.795]
  - - [3776, 3520, 1, 64, 3776, 3776, 3776, 64]
    - [0, 10.131]
  - - [3904, 3520, 1, 64, 3904, 3904, 3904, 64]
    - [0, 10.547]
  - - [4032, 3520, 1, 64, 4032, 4032, 4032, 64]
    - [0, 9.972]
  - - [64, 3648, 1, 64, 64, 64, 64, 64]
    - [3, 0.961]
  - - [192, 3648, 1, 64, 192, 192, 192, 64]
    - [2, 5.542]
  - - [320, 3648, 1, 64, 320, 320, 320, 64]
    - [0, 8.274]
  - - [448, 3648, 1, 64, 448, 448, 448, 64]
    - [0, 9.293]
  - - [576, 3648, 1, 64, 576, 576, 576, 64]
    - [0, 9.871]
  - - [704, 3648, 1, 64, 704, 704, 704, 64]
    - [0, 10.362]
  - - [832, 3648, 1, 64, 832, 832, 832, 64]
    - [0, 10.741]
  - - [960, 3648, 1, 64, 960, 960, 960, 64]
    - [0, 11.048]
  - - [1088, 3648, 1, 64, 1088, 1088, 1088, 64]
    - [0, 11.263]
  - - [1216, 3648, 1, 64, 1216, 1216, 1216, 64]
    - [0, 11.274]
  - - [1344, 3648, 1, 64, 1344, 1344, 1344, 64]
    - [0, 11.626]
  - - [1472, 3648, 1, 64, 1472, 1472, 1472, 64]
    - [0, 10.844]
  - - [1600, 3648, 1, 64, 1600, 1600, 1600, 64]
    - [0, 10.45]
  - - [1728, 3648, 1, 64, 1728, 1728, 1728, 64]
    - [0, 10.051]
  - - [1856, 3648, 1, 64, 1856, 1856, 1856, 64]
    - [0, 10.153]
  - - [1984, 3648, 1, 64, 1984, 1984, 1984, 64]
    - [0, 10.182]
  - - [2112, 3648, 1, 64, 2112, 2112, 2112, 64]
    - [0, 9.677]
  - - [2240, 3648, 1, 64, 2240, 2240, 2240, 64]
    - [0, 9.733]
  - - [2368, 3648, 1, 64, 2368, 2368, 2368, 64]
    - [0, 10.105]
  - - [2496, 3648, 1, 64, 2496, 2496, 2496, 64]
    - [0, 9.643]
  - - [2624, 3648, 1, 64, 2624, 2624, 2624, 64]
    - [2, 8.983]
  - - [2752, 3648, 1, 64, 2752, 2752, 2752, 64]
    - [0, 10.704]
  - - [2880, 3648, 1, 64, 2880, 2880, 2880, 64]
    - [0, 9.635]
  - - [3008, 3648, 1, 64, 3008, 3008, 3008, 64]
    - [0, 9.78]
  - - [3136, 3648, 1, 64, 3136, 3136, 3136, 64]
    - [0, 10.098]
  - - [3264, 3648, 1, 64, 3264, 3264, 3264, 64]
    - [0, 10.279]
  - - [3392, 3648, 1, 64, 3392, 3392, 3392, 64]
    - [0, 12.199]
  - - [3520, 3648, 1, 64, 3520, 3520, 3520, 64]
    - [0, 11.716]
  - - [3648, 3648, 1, 64, 3648, 3648, 3648, 64]
    - [0, 10.953]
  - - [3776, 3648, 1, 64, 3776, 3776, 3776, 64]
    - [0, 9.988]
  - - [3904, 3648, 1, 64, 3904, 3904, 3904, 64]
    - [0, 9.95]
  - - [4032, 3648, 1, 64, 4032, 4032, 4032, 64]
    - [2, 8.132]
  - - [64, 3776, 1, 64, 64, 64, 64, 64]
    - [3, 2.11]
  - - [192, 3776, 1, 64, 192, 192, 192, 64]
    - [0, 6.734]
  - - [320, 3776, 1, 64, 320, 320, 320, 64]
    - [0, 8.441]
  - - [448, 3776, 1, 64, 448, 448, 448, 64]
    - [0, 9.404]
  - - [576, 3776, 1, 64, 576, 576, 576, 64]
    - [0, 10.091]
  - - [704, 3776, 1, 64, 704, 704, 704, 64]
    - [0, 10.513]
  - - [832, 3776, 1, 64, 832, 832, 832, 64]
    - [0, 10.822]
  - - [960, 3776, 1, 64, 960, 960, 960, 64]
    - [0, 11.102]
  - - [1088, 3776, 1, 64, 1088, 1088, 1088, 64]
    - [0, 11.247]
  - - [1216, 3776, 1, 64, 1216, 1216, 1216, 64]
    - [0, 11.469]
  - - [1344, 3776, 1, 64, 1344, 1344, 1344, 64]
    - [0, 11.64]
  - - [1472, 3776, 1, 64, 1472, 1472, 1472, 64]
    - [0, 11.508]
  - - [1600, 3776, 1, 64, 1600, 1600, 1600, 64]
    - [0, 11.752]
  - - [1728, 3776, 1, 64, 1728, 1728, 1728, 64]
    - [0, 11.161]
  - - [1856, 3776, 1, 64, 1856, 1856, 1856, 64]
    - [0, 10.115]
  - - [1984, 3776, 1, 64, 1984, 1984, 1984, 64]
    - [0, 9.484]
  - - [2112, 3776, 1, 64, 2112, 2112, 2112, 64]
    - [0, 9.839]
  - - [2240, 3776, 1, 64, 2240, 2240, 2240, 64]
    - [0, 9.27]
  - - [2368, 3776, 1, 64, 2368, 2368, 2368, 64]
    - [0, 10.102]
  - - [2496, 3776, 1, 64, 2496, 2496, 2496, 64]
    - [0, 9.786]
  - - [2624, 3776, 1, 64, 2624, 2624, 2624, 64]
    - [0, 9.196]
  - - [2752, 3776, 1, 64, 2752, 2752, 2752, 64]
    - [0, 9.879]
  - - [2880, 3776, 1, 64, 2880, 2880, 2880, 64]
    - [0, 9.895]
  - - [3008, 3776, 1, 64, 3008, 3008, 3008, 64]
    - [0, 10.228]
  - - [3136, 3776, 1, 64, 3136, 3136, 3136, 64]
    - [0, 9.841]
  - - [3264, 3776, 1, 64, 3264, 3264, 3264, 64]
    - [0, 10.006]
  - - [3392, 3776, 1, 64, 3392, 3392, 3392, 64]
    - [0, 10.545]
  - - [3520, 3776, 1, 64, 3520, 3520, 3520, 64]
    - [0, 10.152]
  - - [3648, 3776, 1, 64, 3648, 3648, 3648, 64]
    - [0, 10.472]
  - - [3776, 3776, 1, 64, 3776, 3776, 3776, 64]
    - [0, 8.992]
  - - [3904, 3776, 1, 64, 3904, 3904, 3904, 64]
    - [2, 7.865]
  - - [4032, 3776, 1, 64, 4032, 4032, 4032, 64]
    - [2, 8.111]
  - - [64, 3904, 1, 64, 64, 64, 64, 64]
    - [0, 3.71]
  - - [192, 3904, 1, 64, 192, 192, 192, 64]
    - [0, 6.923]
  - - [320, 3904, 1, 64, 320, 320, 320, 64]
    - [0, 8.541]
  - - [448, 3904, 1, 64, 448, 448, 448, 64]
    - [0, 9.48]
  - - [576, 3904, 1, 64, 576, 576, 576, 64]
    - [0, 10.117]
  - - [704, 3904, 1, 64, 704, 704, 704, 64]
    - [0, 10.576]
  - - [832, 3904, 1, 64, 832, 832, 832, 64]
    - [0, 10.82]
  - - [960, 3904, 1, 64, 960, 960, 960, 64]
    - [0, 11.127]
  - - [1088, 3904, 1, 64, 1088, 1088, 1088, 64]
    - [0, 11.391]
  - - [1216, 3904, 1, 64, 1216, 1216, 1216, 64]
    - [0, 11.606]
  - - [1344, 3904, 1, 64, 1344, 1344, 1344, 64]
    - [0, 10.46]
  - - [1472, 3904, 1, 64, 1472, 1472, 1472, 64]
    - [0, 11.735]
  - - [1600, 3904, 1, 64, 1600, 1600, 1600, 64]
    - [0, 10.187]
  - - [1728, 3904, 1, 64, 1728, 1728, 1728, 64]
    - [0, 10.332]
  - - [1856, 3904, 1, 64, 1856, 1856, 1856, 64]
    - [0, 9.108]
  - - [1984, 3904, 1, 64, 1984, 1984, 1984, 64]
    - [0, 10.07]
  - - [2112, 3904, 1, 64, 2112, 2112, 2112, 64]
    - [0, 9.54]
  - - [2240, 3904, 1, 64, 2240, 2240, 2240, 64]
    - [0, 9.691]
  - - [2368, 3904, 1, 64, 2368, 2368, 2368, 64]
    - [0, 9.953]
  - - [2496, 3904, 1, 64, 2496, 2496, 2496, 64]
    - [0, 10.063]
  - - [2624, 3904, 1, 64, 2624, 2624, 2624, 64]
    - [0, 10.129]
  - - [2752, 3904, 1, 64, 2752, 2752, 2752, 64]
    - [0, 9.756]
  - - [2880, 3904, 1, 64, 2880, 2880, 2880, 64]
    - [0, 9.968]
  - - [3008, 3904, 1, 64, 3008, 3008, 3008, 64]
    - [0, 10.404]
  - - [3136, 3904, 1, 64, 3136, 3136, 3136, 64]
    - [0, 11.948]
  - - [3264, 3904, 1, 64, 3264, 3264, 3264, 64]
    - [0, 9.793]
  - - [3392, 3904, 1, 64, 3392, 3392, 3392, 64]
    - [0, 9.775]
  - - [3520, 3904, 1, 64, 3520, 3520, 3520, 64]
    - [0, 10.448]
  - - [3648, 3904, 1, 64, 3648, 3648, 3648, 64]
    - [0, 9.828]
  - - [3776, 3904, 1, 64, 3776, 3776, 3776, 64]
    - [0, 7.41]
  - - [3904, 3904, 1, 64, 3904, 3904, 3904, 64]
    - [2, 8.08]
  - - [4032, 3904, 1, 64, 4032, 4032, 4032, 64]
    - [2, 8.034]
  - - [64, 4032, 1, 64, 64, 64, 64, 64]
    - [0, 3.843]
  - - [192, 4032, 1, 64, 192, 192, 192, 64]
    - [0, 7.056]
  - - [320, 4032, 1, 64, 320, 320, 320, 64]
    - [0, 8.644]
  - - [448, 4032, 1, 64, 448, 448, 448, 64]
    - [0, 9.524]
  - - [576, 4032, 1, 64, 576, 576, 576, 64]
    - [0, 10.146]
  - - [704, 4032, 1, 64, 704, 704, 704, 64]
    - [0, 10.557]
  - - [832, 4032, 1, 64, 832, 832, 832, 64]
    - [0, 10.928]
  - - [960, 4032, 1, 64, 960, 960, 960, 64]
    - [0, 11.323]
  - - [1088, 4032, 1, 64, 1088, 1088, 1088, 64]
    - [0, 11.617]
  - - [1216, 4032, 1, 64, 1216, 1216, 1216, 64]
    - [0, 11.752]
  - - [1344, 4032, 1, 64, 1344, 1344, 1344, 64]
    - [0, 11.263]
  - - [1472, 4032, 1, 64, 1472, 1472, 1472, 64]
    - [0, 11.22]
  - - [1600, 4032, 1, 64, 1600, 1600, 1600, 64]
    - [0, 11.293]
  - - [1728, 4032, 1, 64, 1728, 1728, 1728, 64]
    - [0, 10.389]
  - - [1856, 4032, 1, 64, 1856, 1856, 1856, 64]
    - [0, 10.582]
  - - [1984, 4032, 1, 64, 1984, 1984, 1984, 64]
    - [0, 9.835]
  - - [2112, 4032, 1, 64, 2112, 2112, 2112, 64]
    - [0, 9.726]
  - - [2240, 4032, 1, 64, 2240, 2240, 2240, 64]
    - [0, 9.706]
  - - [2368, 4032, 1, 64, 2368, 2368, 2368, 64]
    - [0, 10.84]
  - - [2496, 4032, 1, 64, 2496, 2496, 2496, 64]
    - [0, 9.712]
  - - [2624, 4032, 1, 64, 2624, 2624, 2624, 64]
    - [0, 11.31]
  - - [2752, 4032, 1, 64, 2752, 2752, 2752, 64]
    - [0, 10.016]
  - - [2880, 4032, 1, 64, 2880, 2880, 2880, 64]
    - [0, 10.378]
  - - [3008, 4032, 1, 64, 3008, 3008, 3008, 64]
    - [2, 9.391]
  - - [3136, 4032, 1, 64, 3136, 3136, 3136, 64]
    - [0, 10.499]
  - - [3264, 4032, 1, 64, 3264, 3264, 3264, 64]
    - [0, 10.465]
  - - [3392, 4032, 1, 64, 3392, 3392, 3392, 64]
    - [0, 10.516]
  - - [3520, 4032, 1, 64, 3520, 3520, 3520, 64]
    - [0, 9.875]
  - - [3648, 4032, 1, 64, 3648, 3648, 3648, 64]
    - [2, 8.132]
  - - [3776, 4032, 1, 64, 3776, 3776, 3776, 64]
    - [0, 7.478]
  - - [3904, 4032, 1, 64, 3904, 3904, 3904, 64]
    - [2, 8.031]
  - - [4032, 4032, 1, 64, 4032, 4032, 4032, 64]
    - [2, 8.115]
  - - [64, 64, 1, 256, 64, 64, 64, 256]
    - [1, 0.303]
  - - [192, 64, 1, 256, 192, 192, 192, 256]
    - [1, 0.9]
  - - [320, 64, 1, 256, 320, 320, 320, 256]
    - [0, 0.532]
  - - [448, 64, 1, 256, 448, 448, 448, 256]
    - [0, 0.474]
  - - [576, 64, 1, 256, 576, 576, 576, 256]
    - [2, 1.187]
  - - [704, 64, 1, 256, 704, 704, 704, 256]
    - [3, 0.744]
  - - [832, 64, 1, 256, 832, 832, 832, 256]
    - [0, 0.881]
  - - [960, 64, 1, 256, 960, 960, 960, 256]
    - [2, 1.013]
  - - [1088, 64, 1, 256, 1088, 1088, 1088, 256]
    - [0, 1.151]
  - - [1216, 64, 1, 256, 1216, 1216, 1216, 256]
    - [2, 1.284]
  - - [1344, 64, 1, 256, 1344, 1344, 1344, 256]
    - [3, 2.745]
  - - [1472, 64, 1, 256, 1472, 1472, 1472, 256]
    - [3, 3.003]
  - - [1600, 64, 1, 256, 1600, 1600, 1600, 256]
    - [0, 3.281]
  - - [1728, 64, 1, 256, 1728, 1728, 1728, 256]
    - [1, 3.506]
  - - [1856, 64, 1, 256, 1856, 1856, 1856, 256]
    - [0, 3.791]
  - - [1984, 64, 1, 256, 1984, 1984, 1984, 256]
    - [1, 4.041]
  - - [2112, 64, 1, 256, 2112, 2112, 2112, 256]
    - [2, 4.306]
  - - [2240, 64, 1, 256, 2240, 2240, 2240, 256]
    - [0, 4.592]
  - - [2368, 64, 1, 256, 2368, 2368, 2368, 256]
    - [0, 4.848]
  - - [2496, 64, 1, 256, 2496, 2496, 2496, 256]
    - [1, 5.077]
  - - [2624, 64, 1, 256, 2624, 2624, 2624, 256]
    - [0, 5.355]
  - - [2752, 64, 1, 256, 2752, 2752, 2752, 256]
    - [0, 5.652]
  - - [2880, 64, 1, 256, 2880, 2880, 2880, 256]
    - [0, 5.858]
  - - [3008, 64, 1, 256, 3008, 3008, 3008, 256]
    - [2, 6.919]
  - - [3136, 64, 1, 256, 3136, 3136, 3136, 256]
    - [2, 6.354]
  - - [3264, 64, 1, 256, 3264, 3264, 3264, 256]
    - [0, 6.654]
  - - [3392, 64, 1, 256, 3392, 3392, 3392, 256]
    - [0, 6.903]
  - - [3520, 64, 1, 256, 3520, 3520, 3520, 256]
    - [2, 7.181]
  - - [3648, 64, 1, 256, 3648, 3648, 3648, 256]
    - [0, 7.437]
  - - [3776, 64, 1, 256, 3776, 3776, 3776, 256]
    - [0, 7.678]
  - - [3904, 64, 1, 256, 3904, 3904, 3904, 256]
    - [2, 7.388]
  - - [4032, 64, 1, 256, 4032, 4032, 4032, 256]
    - [2, 7.584]
  - - [64, 192, 1, 256, 64, 64, 64, 256]
    - [2, 0.203]
  - - [192, 192, 1, 256, 192, 192, 192, 256]
    - [2, 0.611]
  - - [320, 192, 1, 256, 320, 320, 320, 256]
    - [2, 1.013]
  - - [448, 192, 1, 256, 448, 448, 448, 256]
    - [3, 2.774]
  - - [576, 192, 1, 256, 576, 576, 576, 256]
    - [3, 3.514]
  - - [704, 192, 1, 256, 704, 704, 704, 256]
    - [0, 4.303]
  - - [832, 192, 1, 256, 832, 832, 832, 256]
    - [1, 5.067]
  - - [960, 192, 1, 256, 960, 960, 960, 256]
    - [2, 5.864]
  - - [1088, 192, 1, 256, 1088, 1088, 1088, 256]
    - [0, 6.654]
  - - [1216, 192, 1, 256, 1216, 1216, 1216, 256]
    - [0, 7.446]
  - - [1344, 192, 1, 256, 1344, 1344, 1344, 256]
    - [2, 7.723]
  - - [1472, 192, 1, 256, 1472, 1472, 1472, 256]
    - [0, 8.337]
  - - [1600, 192, 1, 256, 1600, 1600, 1600, 256]
    - [2, 8.272]
  - - [1728, 192, 1, 256, 1728, 1728, 1728, 256]
    - [0, 8.781]
  - - [1856, 192, 1, 256, 1856, 1856, 1856, 256]
    - [2, 8.846]
  - - [1984, 192, 1, 256, 1984, 1984, 1984, 256]
    - [0, 9.155]
  - - [2112, 192, 1, 256, 2112, 2112, 2112, 256]
    - [2, 9.137]
  - - [2240, 192, 1, 256, 2240, 2240, 2240, 256]
    - [0, 9.432]
  - - [2368, 192, 1, 256, 2368, 2368, 2368, 256]
    - [2, 9.386]
  - - [2496, 192, 1, 256, 2496, 2496, 2496, 256]
    - [0, 9.715]
  - - [2624, 192, 1, 256, 2624, 2624, 2624, 256]
    - [2, 9.704]
  - - [2752, 192, 1, 256, 2752, 2752, 2752, 256]
    - [2, 9.949]
  - - [2880, 192, 1, 256, 2880, 2880, 2880, 256]
    - [2, 9.985]
  - - [3008, 192, 1, 256, 3008, 3008, 3008, 256]
    - [2, 10.107]
  - - [3136, 192, 1, 256, 3136, 3136, 3136, 256]
    - [2, 10.157]
  - - [3264, 192, 1, 256, 3264, 3264, 3264, 256]
    - [2, 10.317]
  - - [3392, 192, 1, 256, 3392, 3392, 3392, 256]
    - [2, 10.462]
  - - [3520, 192, 1, 256, 3520, 3520, 3520, 256]
    - [0, 10.504]
  - - [3648, 192, 1, 256, 3648, 3648, 3648, 256]
    - [2, 10.593]
  - - [3776, 192, 1, 256, 3776, 3776, 3776, 256]
    - [2, 10.676]
  - - [3904, 192, 1, 256, 3904, 3904, 3904, 256]
    - [2, 10.736]
  - - [4032, 192, 1, 256, 4032, 4032, 4032, 256]
    - [2, 10.812]
  - - [64, 320, 1, 256, 64, 64, 64, 256]
    - [3, 0.339]
  - - [192, 320, 1, 256, 192, 192, 192, 256]
    - [3, 1.016]
  - - [320, 320, 1, 256, 320, 320, 320, 256]
    - [3, 3.292]
  - - [448, 320, 1, 256, 448, 448, 448, 256]
    - [3, 4.567]
  - - [576, 320, 1, 256, 576, 576, 576, 256]
    - [0, 5.88]
  - - [704, 320, 1, 256, 704, 704, 704, 256]
    - [2, 7.175]
  - - [832, 320, 1, 256, 832, 832, 832, 256]
    - [2, 7.863]
  - - [960, 320, 1, 256, 960, 960, 960, 256]
    - [2, 8.267]
  - - [1088, 320, 1, 256, 1088, 1088, 1088, 256]
    - [2, 8.783]
  - - [1216, 320, 1, 256, 1216, 1216, 1216, 256]
    - [0, 9.217]
  - - [1344, 320, 1, 256, 1344, 1344, 1344, 256]
    - [0, 9.426]
  - - [1472, 320, 1, 256, 1472, 1472, 1472, 256]
    - [0, 9.557]
  - - [1600, 320, 1, 256, 1600, 1600, 1600, 256]
    - [2, 9.763]
  - - [1728, 320, 1, 256, 1728, 1728, 1728, 256]
    - [2, 9.98]
  - - [1856, 320, 1, 256, 1856, 1856, 1856, 256]
    - [2, 10.175]
  - - [1984, 320, 1, 256, 1984, 1984, 1984, 256]
    - [2, 10.401]
  - - [2112, 320, 1, 256, 2112, 2112, 2112, 256]
    - [2, 10.444]
  - - [2240, 320, 1, 256, 2240, 2240, 2240, 256]
    - [2, 10.606]
  - - [2368, 320, 1, 256, 2368, 2368, 2368, 256]
    - [2, 10.722]
  - - [2496, 320, 1, 256, 2496, 2496, 2496, 256]
    - [2, 10.895]
  - - [2624, 320, 1, 256, 2624, 2624, 2624, 256]
    - [0, 11.12]
  - - [2752, 320, 1, 256, 2752, 2752, 2752, 256]
    - [2, 11.166]
  - - [2880, 320, 1, 256, 2880, 2880, 2880, 256]
    - [2, 11.218]
  - - [3008, 320, 1, 256, 3008, 3008, 3008, 256]
    - [2, 11.38]
  - - [3136, 320, 1, 256, 3136, 3136, 3136, 256]
    - [2, 11.473]
  - - [3264, 320, 1, 256, 3264, 3264, 3264, 256]
    - [2, 11.504]
  - - [3392, 320, 1, 256, 3392, 3392, 3392, 256]
    - [2, 11.936]
  - - [3520, 320, 1, 256, 3520, 3520, 3520, 256]
    - [2, 11.773]
  - - [3648, 320, 1, 256, 3648, 3648, 3648, 256]
    - [2, 11.967]
  - - [3776, 320, 1, 256, 3776, 3776, 3776, 256]
    - [2, 12.092]
  - - [3904, 320, 1, 256, 3904, 3904, 3904, 256]
    - [2, 11.894]
  - - [4032, 320, 1, 256, 4032, 4032, 4032, 256]
    - [2, 12.033]
  - - [64, 448, 1, 256, 64, 64, 64, 256]
    - [3, 0.473]
  - - [192, 448, 1, 256, 192, 192, 192, 256]
    - [1, 2.735]
  - - [320, 448, 1, 256, 320, 320, 320, 256]
    - [0, 4.575]
  - - [448, 448, 1, 256, 448, 448, 448, 256]
    - [2, 6.696]
  - - [576, 448, 1, 256, 576, 576, 576, 256]
    - [2, 7.645]
  - - [704, 448, 1, 256, 704, 704, 704, 256]
    - [2, 8.327]
  - - [832, 448, 1, 256, 832, 832, 832, 256]
    - [2, 8.887]
  - - [960, 448, 1, 256, 960, 960, 960, 256]
    - [0, 9.417]
  - - [1088, 448, 1, 256, 1088, 1088, 1088, 256]
    - [0, 9.792]
  - - [1216, 448, 1, 256, 1216, 1216, 1216, 256]
    - [0, 9.934]
  - - [1344, 448, 1, 256, 1344, 1344, 1344, 256]
    - [2, 10.153]
  - - [1472, 448, 1, 256, 1472, 1472, 1472, 256]
    - [2, 10.343]
  - - [1600, 448, 1, 256, 1600, 1600, 1600, 256]
    - [2, 10.594]
  - - [1728, 448, 1, 256, 1728, 1728, 1728, 256]
    - [2, 10.791]
  - - [1856, 448, 1, 256, 1856, 1856, 1856, 256]
    - [2, 10.926]
  - - [1984, 448, 1, 256, 1984, 1984, 1984, 256]
    - [0, 11.034]
  - - [2112, 448, 1, 256, 2112, 2112, 2112, 256]
    - [2, 11.594]
  - - [2240, 448, 1, 256, 2240, 2240, 2240, 256]
    - [2, 11.298]
  - - [2368, 448, 1, 256, 2368, 2368, 2368, 256]
    - [2, 11.41]
  - - [2496, 448, 1, 256, 2496, 2496, 2496, 256]
    - [2, 11.563]
  - - [2624, 448, 1, 256, 2624, 2624, 2624, 256]
    - [2, 11.789]
  - - [2752, 448, 1, 256, 2752, 2752, 2752, 256]
    - [2, 11.661]
  - - [2880, 448, 1, 256, 2880, 2880, 2880, 256]
    - [2, 12.049]
  - - [3008, 448, 1, 256, 3008, 3008, 3008, 256]
    - [2, 12.045]
  - - [3136, 448, 1, 256, 3136, 3136, 3136, 256]
    - [2, 12.13]
  - - [3264, 448, 1, 256, 3264, 3264, 3264, 256]
    - [2, 12.216]
  - - [3392, 448, 1, 256, 3392, 3392, 3392, 256]
    - [2, 12.109]
  - - [3520, 448, 1, 256, 3520, 3520, 3520, 256]
    - [0, 12.18]
  - - [3648, 448, 1, 256, 3648, 3648, 3648, 256]
    - [2, 12.254]
  - - [3776, 448, 1, 256, 3776, 3776, 3776, 256]
    - [2, 12.165]
  - - [3904, 448, 1, 256, 3904, 3904, 3904, 256]
    - [2, 12.353]
  - - [4032, 448, 1, 256, 4032, 4032, 4032, 256]
    - [2, 12.243]
  - - [64, 576, 1, 256, 64, 64, 64, 256]
    - [2, 0.608]
  - - [192, 576, 1, 256, 192, 192, 192, 256]
    - [0, 3.522]
  - - [320, 576, 1, 256, 320, 320, 320, 256]
    - [0, 5.889]
  - - [448, 576, 1, 256, 448, 448, 448, 256]
    - [2, 7.725]
  - - [576, 576, 1, 256, 576, 576, 576, 256]
    - [0, 8.75]
  - - [704, 576, 1, 256, 704, 704, 704, 256]
    - [2, 9.315]
  - - [832, 576, 1, 256, 832, 832, 832, 256]
    - [0, 9.795]
  - - [960, 576, 1, 256, 960, 960, 960, 256]
    - [2, 10.049]
  - - [1088, 576, 1, 256, 1088, 1088, 1088, 256]
    - [2, 10.417]
  - - [1216, 576, 1, 256, 1216, 1216, 1216, 256]
    - [2, 10.58]
  - - [1344, 576, 1, 256, 1344, 1344, 1344, 256]
    - [2, 10.76]
  - - [1472, 576, 1, 256, 1472, 1472, 1472, 256]
    - [2, 10.98]
  - - [1600, 576, 1, 256, 1600, 1600, 1600, 256]
    - [2, 11.273]
  - - [1728, 576, 1, 256, 1728, 1728, 1728, 256]
    - [2, 11.405]
  - - [1856, 576, 1, 256, 1856, 1856, 1856, 256]
    - [2, 11.894]
  - - [1984, 576, 1, 256, 1984, 1984, 1984, 256]
    - [2, 11.831]
  - - [2112, 576, 1, 256, 2112, 2112, 2112, 256]
    - [2, 11.953]
  - - [2240, 576, 1, 256, 2240, 2240, 2240, 256]
    - [2, 12.228]
  - - [2368, 576, 1, 256, 2368, 2368, 2368, 256]
    - [2, 12.364]
  - - [2496, 576, 1, 256, 2496, 2496, 2496, 256]
    - [0, 12.08]
  - - [2624, 576, 1, 256, 2624, 2624, 2624, 256]
    - [0, 12.104]
  - - [2752, 576, 1, 256, 2752, 2752, 2752, 256]
    - [2, 12.203]
  - - [2880, 576, 1, 256, 2880, 2880, 2880, 256]
    - [2, 12.269]
  - - [3008, 576, 1, 256, 3008, 3008, 3008, 256]
    - [0, 12.153]
  - - [3136, 576, 1, 256, 3136, 3136, 3136, 256]
    - [2, 12.367]
  - - [3264, 576, 1, 256, 3264, 3264, 3264, 256]
    - [2, 12.276]
  - - [3392, 576, 1, 256, 3392, 3392, 3392, 256]
    - [2, 12.356]
  - - [3520, 576, 1, 256, 3520, 3520, 3520, 256]
    - [2, 12.085]
  - - [3648, 576, 1, 256, 3648, 3648, 3648, 256]
    - [0, 12.182]
  - - [3776, 576, 1, 256, 3776, 3776, 3776, 256]
    - [0, 12.177]
  - - [3904, 576, 1, 256, 3904, 3904, 3904, 256]
    - [2, 12.085]
  - - [4032, 576, 1, 256, 4032, 4032, 4032, 256]
    - [0, 12.153]
  - - [64, 704, 1, 256, 64, 64, 64, 256]
    - [0, 2.909]
  - - [192, 704, 1, 256, 192, 192, 192, 256]
    - [0, 5.803]
  - - [320, 704, 1, 256, 320, 320, 320, 256]
    - [2, 7.469]
  - - [448, 704, 1, 256, 448, 448, 448, 256]
    - [2, 8.331]
  - - [576, 704, 1, 256, 576, 576, 576, 256]
    - [2, 9.091]
  - - [704, 704, 1, 256, 704, 704, 704, 256]
    - [2, 9.79]
  - - [832, 704, 1, 256, 832, 832, 832, 256]
    - [0, 10.134]
  - - [960, 704, 1, 256, 960, 960, 960, 256]
    - [2, 10.472]
  - - [1088, 704, 1, 256, 1088, 1088, 1088, 256]
    - [2, 10.719]
  - - [1216, 704, 1, 256, 1216, 1216, 1216, 256]
    - [2, 10.957]
  - - [1344, 704, 1, 256, 1344, 1344, 1344, 256]
    - [2, 11.183]
  - - [1472, 704, 1, 256, 1472, 1472, 1472, 256]
    - [2, 11.354]
  - - [1600, 704, 1, 256, 1600, 1600, 1600, 256]
    - [2, 11.423]
  - - [1728, 704, 1, 256, 1728, 1728, 1728, 256]
    - [2, 12.021]
  - - [1856, 704, 1, 256, 1856, 1856, 1856, 256]
    - [2, 12.089]
  - - [1984, 704, 1, 256, 1984, 1984, 1984, 256]
    - [2, 12.017]
  - - [2112, 704, 1, 256, 2112, 2112, 2112, 256]
    - [0, 12.164]
  - - [2240, 704, 1, 256, 2240, 2240, 2240, 256]
    - [0, 12.083]
  - - [2368, 704, 1, 256, 2368, 2368, 2368, 256]
    - [0, 12.196]
  - - [2496, 704, 1, 256, 2496, 2496, 2496, 256]
    - [2, 12.153]
  - - [2624, 704, 1, 256, 2624, 2624, 2624, 256]
    - [2, 12.195]
  - - [2752, 704, 1, 256, 2752, 2752, 2752, 256]
    - [0, 12.224]
  - - [2880, 704, 1, 256, 2880, 2880, 2880, 256]
    - [2, 12.031]
  - - [3008, 704, 1, 256, 3008, 3008, 3008, 256]
    - [0, 12.203]
  - - [3136, 704, 1, 256, 3136, 3136, 3136, 256]
    - [0, 12.256]
  - - [3264, 704, 1, 256, 3264, 3264, 3264, 256]
    - [2, 12.124]
  - - [3392, 704, 1, 256, 3392, 3392, 3392, 256]
    - [2, 12.112]
  - - [3520, 704, 1, 256, 3520, 3520, 3520, 256]
    - [0, 12.068]
  - - [3648, 704, 1, 256, 3648, 3648, 3648, 256]
    - [2, 12.327]
  - - [3776, 704, 1, 256, 3776, 3776, 3776, 256]
    - [2, 12.148]
  - - [3904, 704, 1, 256, 3904, 3904, 3904, 256]
    - [2, 12.371]
  - - [4032, 704, 1, 256, 4032, 4032, 4032, 256]
    - [2, 12.25]
  - - [64, 832, 1, 256, 64, 64, 64, 256]
    - [1, 2.734]
  - - [192, 832, 1, 256, 192, 192, 192, 256]
    - [0, 5.079]
  - - [320, 832, 1, 256, 320, 320, 320, 256]
    - [2, 7.813]
  - - [448, 832, 1, 256, 448, 448, 448, 256]
    - [2, 8.887]
  - - [576, 832, 1, 256, 576, 576, 576, 256]
    - [0, 9.708]
  - - [704, 832, 1, 256, 704, 704, 704, 256]
    - [0, 10.228]
  - - [832, 832, 1, 256, 832, 832, 832, 256]
    - [0, 10.496]
  - - [960, 832, 1, 256, 960, 960, 960, 256]
    - [2, 10.903]
  - - [1088, 832, 1, 256, 1088, 1088, 1088, 256]
    - [2, 11.235]
  - - [1216, 832, 1, 256, 1216, 1216, 1216, 256]
    - [2, 11.4]
  - - [1344, 832, 1, 256, 1344, 1344, 1344, 256]
    - [2, 11.831]
  - - [1472, 832, 1, 256, 1472, 1472, 1472, 256]
    - [2, 11.988]
  - - [1600, 832, 1, 256, 1600, 1600, 1600, 256]
    - [2, 12.232]
  - - [1728, 832, 1, 256, 1728, 1728, 1728, 256]
    - [2, 12.205]
  - - [1856, 832, 1, 256, 1856, 1856, 1856, 256]
    - [0, 12.324]
  - - [1984, 832, 1, 256, 1984, 1984, 1984, 256]
    - [0, 12.651]
  - - [2112, 832, 1, 256, 2112, 2112, 2112, 256]
    - [2, 12.311]
  - - [2240, 832, 1, 256, 2240, 2240, 2240, 256]
    - [0, 12.474]
  - - [2368, 832, 1, 256, 2368, 2368, 2368, 256]
    - [2, 12.396]
  - - [2496, 832, 1, 256, 2496, 2496, 2496, 256]
    - [2, 12.326]
  - - [2624, 832, 1, 256, 2624, 2624, 2624, 256]
    - [0, 12.46]
  - - [2752, 832, 1, 256, 2752, 2752, 2752, 256]
    - [0, 12.26]
  - - [2880, 832, 1, 256, 2880, 2880, 2880, 256]
    - [2, 12.203]
  - - [3008, 832, 1, 256, 3008, 3008, 3008, 256]
    - [2, 12.172]
  - - [3136, 832, 1, 256, 3136, 3136, 3136, 256]
    - [0, 12.106]
  - - [3264, 832, 1, 256, 3264, 3264, 3264, 256]
    - [2, 12.279]
  - - [3392, 832, 1, 256, 3392, 3392, 3392, 256]
    - [0, 12.323]
  - - [3520, 832, 1, 256, 3520, 3520, 3520, 256]
    - [0, 12.457]
  - - [3648, 832, 1, 256, 3648, 3648, 3648, 256]
    - [2, 12.235]
  - - [3776, 832, 1, 256, 3776, 3776, 3776, 256]
    - [0, 12.15]
  - - [3904, 832, 1, 256, 3904, 3904, 3904, 256]
    - [2, 12.537]
  - - [4032, 832, 1, 256, 4032, 4032, 4032, 256]
    - [0, 12.28]
  - - [64, 960, 1, 256, 64, 64, 64, 256]
    - [0, 1.955]
  - - [192, 960, 1, 256, 192, 192, 192, 256]
    - [0, 5.875]
  - - [320, 960, 1, 256, 320, 320, 320, 256]
    - [2, 8.131]
  - - [448, 960, 1, 256, 448, 448, 448, 256]
    - [0, 9.36]
  - - [576, 960, 1, 256, 576, 576, 576, 256]
    - [2, 9.978]
  - - [704, 960, 1, 256, 704, 704, 704, 256]
    - [2, 10.511]
  - - [832, 960, 1, 256, 832, 832, 832, 256]
    - [2, 10.763]
  - - [960, 960, 1, 256, 960, 960, 960, 256]
    - [2, 11.165]
  - - [1088, 960, 1, 256, 1088, 1088, 1088, 256]
    - [2, 11.75]
  - - [1216, 960, 1, 256, 1216, 1216, 1216, 256]
    - [2, 11.841]
  - - [1344, 960, 1, 256, 1344, 1344, 1344, 256]
    - [2, 11.885]
  - - [1472, 960, 1, 256, 1472, 1472, 1472, 256]
    - [2, 12.001]
  - - [1600, 960, 1, 256, 1600, 1600, 1600, 256]
    - [2, 12.099]
  - - [1728, 960, 1, 256, 1728, 1728, 1728, 256]
    - [0, 12.218]
  - - [1856, 960, 1, 256, 1856, 1856, 1856, 256]
    - [0, 12.343]
  - - [1984, 960, 1, 256, 1984, 1984, 1984, 256]
    - [2, 12.384]
  - - [2112, 960, 1, 256, 2112, 2112, 2112, 256]
    - [2, 12.139]
  - - [2240, 960, 1, 256, 2240, 2240, 2240, 256]
    - [0, 12.14]
  - - [2368, 960, 1, 256, 2368, 2368, 2368, 256]
    - [0, 12.052]
  - - [2496, 960, 1, 256, 2496, 2496, 2496, 256]
    - [0, 12.209]
  - - [2624, 960, 1, 256, 2624, 2624, 2624, 256]
    - [2, 12.209]
  - - [2752, 960, 1, 256, 2752, 2752, 2752, 256]
    - [0, 12.277]
  - - [2880, 960, 1, 256, 2880, 2880, 2880, 256]
    - [2, 12.227]
  - - [3008, 960, 1, 256, 3008, 3008, 3008, 256]
    - [2, 12.258]
  - - [3136, 960, 1, 256, 3136, 3136, 3136, 256]
    - [0, 12.226]
  - - [3264, 960, 1, 256, 3264, 3264, 3264, 256]
    - [2, 12.234]
  - - [3392, 960, 1, 256, 3392, 3392, 3392, 256]
    - [0, 12.314]
  - - [3520, 960, 1, 256, 3520, 3520, 3520, 256]
    - [2, 12.526]
  - - [3648, 960, 1, 256, 3648, 3648, 3648, 256]
    - [2, 12.282]
  - - [3776, 960, 1, 256, 3776, 3776, 3776, 256]
    - [2, 12.388]
  - - [3904, 960, 1, 256, 3904, 3904, 3904, 256]
    - [2, 12.685]
  - - [4032, 960, 1, 256, 4032, 4032, 4032, 256]
    - [2, 12.634]
  - - [64, 1088, 1, 256, 64, 64, 64, 256]
    - [1, 2.213]
  - - [192, 1088, 1, 256, 192, 192, 192, 256]
    - [2, 6.647]
  - - [320, 1088, 1, 256, 320, 320, 320, 256]
    - [2, 8.681]
  - - [448, 1088, 1, 256, 448, 448, 448, 256]
    - [0, 9.86]
  - - [576, 1088, 1, 256, 576, 576, 576, 256]
    - [0, 10.313]
  - - [704, 1088, 1, 256, 704, 704, 704, 256]
    - [2, 10.695]
  - - [832, 1088, 1, 256, 832, 832, 832, 256]
    - [2, 11.113]
  - - [960, 1088, 1, 256, 960, 960, 960, 256]
    - [2, 11.75]
  - - [1088, 1088, 1, 256, 1088, 1088, 1088, 256]
    - [2, 11.991]
  - - [1216, 1088, 1, 256, 1216, 1216, 1216, 256]
    - [2, 11.938]
  - - [1344, 1088, 1, 256, 1344, 1344, 1344, 256]
    - [2, 11.979]
  - - [1472, 1088, 1, 256, 1472, 1472, 1472, 256]
    - [2, 12.261]
  - - [1600, 1088, 1, 256, 1600, 1600, 1600, 256]
    - [0, 12.163]
  - - [1728, 1088, 1, 256, 1728, 1728, 1728, 256]
    - [0, 12.21]
  - - [1856, 1088, 1, 256, 1856, 1856, 1856, 256]
    - [0, 12.217]
  - - [1984, 1088, 1, 256, 1984, 1984, 1984, 256]
    - [2, 12.2]
  - - [2112, 1088, 1, 256, 2112, 2112, 2112, 256]
    - [2, 12.178]
  - - [2240, 1088, 1, 256, 2240, 2240, 2240, 256]
    - [2, 12.255]
  - - [2368, 1088, 1, 256, 2368, 2368, 2368, 256]
    - [2, 12.275]
  - - [2496, 1088, 1, 256, 2496, 2496, 2496, 256]
    - [2, 12.483]
  - - [2624, 1088, 1, 256, 2624, 2624, 2624, 256]
    - [2, 12.261]
  - - [2752, 1088, 1, 256, 2752, 2752, 2752, 256]
    - [2, 12.436]
  - - [2880, 1088, 1, 256, 2880, 2880, 2880, 256]
    - [2, 12.224]
  - - [3008, 1088, 1, 256, 3008, 3008, 3008, 256]
    - [2, 12.45]
  - - [3136, 1088, 1, 256, 3136, 3136, 3136, 256]
    - [2, 12.52]
  - - [3264, 1088, 1, 256, 3264, 3264, 3264, 256]
    - [2, 12.389]
  - - [3392, 1088, 1, 256, 3392, 3392, 3392, 256]
    - [2, 12.355]
  - - [3520, 1088, 1, 256, 3520, 3520, 3520, 256]
    - [2, 12.378]
  - - [3648, 1088, 1, 256, 3648, 3648, 3648, 256]
    - [2, 12.342]
  - - [3776, 1088, 1, 256, 3776, 3776, 3776, 256]
    - [2, 12.323]
  - - [3904, 1088, 1, 256, 3904, 3904, 3904, 256]
    - [2, 12.453]
  - - [4032, 1088, 1, 256, 4032, 4032, 4032, 256]
    - [2, 12.613]
  - - [64, 1216, 1, 256, 64, 64, 64, 256]
    - [0, 2.487]
  - - [192, 1216, 1, 256, 192, 192, 192, 256]
    - [0, 7.435]
  - - [320, 1216, 1, 256, 320, 320, 320, 256]
    - [0, 9.207]
  - - [448, 1216, 1, 256, 448, 448, 448, 256]
    - [2, 10.032]
  - - [576, 1216, 1, 256, 576, 576, 576, 256]
    - [2, 10.499]
  - - [704, 1216, 1, 256, 704, 704, 704, 256]
    - [2, 11.054]
  - - [832, 1216, 1, 256, 832, 832, 832, 256]
    - [2, 11.27]
  - - [960, 1216, 1, 256, 960, 960, 960, 256]
    - [2, 11.729]
  - - [1088, 1216, 1, 256, 1088, 1088, 1088, 256]
    - [2, 12.192]
  - - [1216, 1216, 1, 256, 1216, 1216, 1216, 256]
    - [0, 12.251]
  - - [1344, 1216, 1, 256, 1344, 1344, 1344, 256]
    - [2, 12.481]
  - - [1472, 1216, 1, 256, 1472, 1472, 1472, 256]
    - [2, 12.402]
  - - [1600, 1216, 1, 256, 1600, 1600, 1600, 256]
    - [0, 12.489]
  - - [1728, 1216, 1, 256, 1728, 1728, 1728, 256]
    - [2, 12.421]
  - - [1856, 1216, 1, 256, 1856, 1856, 1856, 256]
    - [0, 12.098]
  - - [1984, 1216, 1, 256, 1984, 1984, 1984, 256]
    - [2, 12.339]
  - - [2112, 1216, 1, 256, 2112, 2112, 2112, 256]
    - [0, 12.283]
  - - [2240, 1216, 1, 256, 2240, 2240, 2240, 256]
    - [2, 12.222]
  - - [2368, 1216, 1, 256, 2368, 2368, 2368, 256]
    - [0, 12.382]
  - - [2496, 1216, 1, 256, 2496, 2496, 2496, 256]
    - [2, 12.373]
  - - [2624, 1216, 1, 256, 2624, 2624, 2624, 256]
    - [2, 12.349]
  - - [2752, 1216, 1, 256, 2752, 2752, 2752, 256]
    - [2, 12.216]
  - - [2880, 1216, 1, 256, 2880, 2880, 2880, 256]
    - [2, 12.243]
  - - [3008, 1216, 1, 256, 3008, 3008, 3008, 256]
    - [2, 12.706]
  - - [3136, 1216, 1, 256, 3136, 3136, 3136, 256]
    - [2, 12.451]
  - - [3264, 1216, 1, 256, 3264, 3264, 3264, 256]
    - [2, 12.422]
  - - [3392, 1216, 1, 256, 3392, 3392, 3392, 256]
    - [2, 12.762]
  - - [3520, 1216, 1, 256, 3520, 3520, 3520, 256]
    - [2, 12.657]
  - - [3648, 1216, 1, 256, 3648, 3648, 3648, 256]
    - [2, 12.474]
  - - [3776, 1216, 1, 256, 3776, 3776, 3776, 256]
    - [2, 12.501]
  - - [3904, 1216, 1, 256, 3904, 3904, 3904, 256]
    - [2, 12.456]
  - - [4032, 1216, 1, 256, 4032, 4032, 4032, 256]
    - [2, 12.72]
  - - [64, 1344, 1, 256, 64, 64, 64, 256]
    - [1, 2.725]
  - - [192, 1344, 1, 256, 192, 192, 192, 256]
    - [2, 7.644]
  - - [320, 1344, 1, 256, 320, 320, 320, 256]
    - [0, 9.424]
  - - [448, 1344, 1, 256, 448, 448, 448, 256]
    - [2, 10.196]
  - - [576, 1344, 1, 256, 576, 576, 576, 256]
    - [2, 10.72]
  - - [704, 1344, 1, 256, 704, 704, 704, 256]
    - [2, 11.472]
  - - [832, 1344, 1, 256, 832, 832, 832, 256]
    - [2, 11.853]
  - - [960, 1344, 1, 256, 960, 960, 960, 256]
    - [2, 12.033]
  - - [1088, 1344, 1, 256, 1088, 1088, 1088, 256]
    - [2, 12.205]
  - - [1216, 1344, 1, 256, 1216, 1216, 1216, 256]
    - [0, 12.25]
  - - [1344, 1344, 1, 256, 1344, 1344, 1344, 256]
    - [2, 12.239]
  - - [1472, 1344, 1, 256, 1472, 1472, 1472, 256]
    - [0, 12.452]
  - - [1600, 1344, 1, 256, 1600, 1600, 1600, 256]
    - [0, 12.39]
  - - [1728, 1344, 1, 256, 1728, 1728, 1728, 256]
    - [2, 12.223]
  - - [1856, 1344, 1, 256, 1856, 1856, 1856, 256]
    - [2, 12.191]
  - - [1984, 1344, 1, 256, 1984, 1984, 1984, 256]
    - [2, 12.222]
  - - [2112, 1344, 1, 256, 2112, 2112, 2112, 256]
    - [2, 12.278]
  - - [2240, 1344, 1, 256, 2240, 2240, 2240, 256]
    - [0, 12.23]
  - - [2368, 1344, 1, 256, 2368, 2368, 2368, 256]
    - [2, 12.212]
  - - [2496, 1344, 1, 256, 2496, 2496, 2496, 256]
    - [2, 12.221]
  - - [2624, 1344, 1, 256, 2624, 2624, 2624, 256]
    - [2, 12.296]
  - - [2752, 1344, 1, 256, 2752, 2752, 2752, 256]
    - [2, 12.274]
  - - [2880, 1344, 1, 256, 2880, 2880, 2880, 256]
    - [2, 12.335]
  - - [3008, 1344, 1, 256, 3008, 3008, 3008, 256]
    - [2, 12.326]
  - - [3136, 1344, 1, 256, 3136, 3136, 3136, 256]
    - [2, 12.534]
  - - [3264, 1344, 1, 256, 3264, 3264, 3264, 256]
    - [2, 12.486]
  - - [3392, 1344, 1, 256, 3392, 3392, 3392, 256]
    - [2, 12.772]
  - - [3520, 1344, 1, 256, 3520, 3520, 3520, 256]
    - [2, 12.731]
  - - [3648, 1344, 1, 256, 3648, 3648, 3648, 256]
    - [2, 12.706]
  - - [3776, 1344, 1, 256, 3776, 3776, 3776, 256]
    - [2, 12.845]
  - - [3904, 1344, 1, 256, 3904, 3904, 3904, 256]
    - [2, 12.779]
  - - [4032, 1344, 1, 256, 4032, 4032, 4032, 256]
    - [2, 12.793]
  - - [64, 1472, 1, 256, 64, 64, 64, 256]
    - [3, 2.988]
  - - [192, 1472, 1, 256, 192, 192, 192, 256]
    - [0, 8.311]
  - - [320, 1472, 1, 256, 320, 320, 320, 256]
    - [2, 9.686]
  - - [448, 1472, 1, 256, 448, 448, 448, 256]
    - [2, 10.483]
  - - [576, 1472, 1, 256, 576, 576, 576, 256]
    - [0, 11.074]
  - - [704, 1472, 1, 256, 704, 704, 704, 256]
    - [2, 11.747]
  - - [832, 1472, 1, 256, 832, 832, 832, 256]
    - [2, 12.083]
  - - [960, 1472, 1, 256, 960, 960, 960, 256]
    - [2, 12.234]
  - - [1088, 1472, 1, 256, 1088, 1088, 1088, 256]
    - [0, 12.353]
  - - [1216, 1472, 1, 256, 1216, 1216, 1216, 256]
    - [0, 12.201]
  - - [1344, 1472, 1, 256, 1344, 1344, 1344, 256]
    - [0, 12.178]
  - - [1472, 1472, 1, 256, 1472, 1472, 1472, 256]
    - [2, 12.182]
  - - [1600, 1472, 1, 256, 1600, 1600, 1600, 256]
    - [2, 12.199]
  - - [1728, 1472, 1, 256, 1728, 1728, 1728, 256]
    - [0, 12.107]
  - - [1856, 1472, 1, 256, 1856, 1856, 1856, 256]
    - [0, 12.175]
  - - [1984, 1472, 1, 256, 1984, 1984, 1984, 256]
    - [2, 12.235]
  - - [2112, 1472, 1, 256, 2112, 2112, 2112, 256]
    - [2, 12.145]
  - - [2240, 1472, 1, 256, 2240, 2240, 2240, 256]
    - [0, 12.235]
  - - [2368, 1472, 1, 256, 2368, 2368, 2368, 256]
    - [2, 12.209]
  - - [2496, 1472, 1, 256, 2496, 2496, 2496, 256]
    - [2, 12.293]
  - - [2624, 1472, 1, 256, 2624, 2624, 2624, 256]
    - [2, 12.555]
  - - [2752, 1472, 1, 256, 2752, 2752, 2752, 256]
    - [2, 12.431]
  - - [2880, 1472, 1, 256, 2880, 2880, 2880, 256]
    - [2, 12.786]
  - - [3008, 1472, 1, 256, 3008, 3008, 3008, 256]
    - [2, 12.912]
  - - [3136, 1472, 1, 256, 3136, 3136, 3136, 256]
    - [2, 12.685]
  - - [3264, 1472, 1, 256, 3264, 3264, 3264, 256]
    - [2, 12.731]
  - - [3392, 1472, 1, 256, 3392, 3392, 3392, 256]
    - [2, 12.767]
  - - [3520, 1472, 1, 256, 3520, 3520, 3520, 256]
    - [2, 12.814]
  - - [3648, 1472, 1, 256, 3648, 3648, 3648, 256]
    - [2, 12.74]
  - - [3776, 1472, 1, 256, 3776, 3776, 3776, 256]
    - [2, 12.63]
  - - [3904, 1472, 1, 256, 3904, 3904, 3904, 256]
    - [2, 12.86]
  - - [4032, 1472, 1, 256, 4032, 4032, 4032, 256]
    - [2, 12.9]
  - - [64, 1600, 1, 256, 64, 64, 64, 256]
    - [0, 3.282]
  - - [192, 1600, 1, 256, 192, 192, 192, 256]
    - [2, 8.364]
  - - [320, 1600, 1, 256, 320, 320, 320, 256]
    - [2, 9.85]
  - - [448, 1600, 1, 256, 448, 448, 448, 256]
    - [2, 10.734]
  - - [576, 1600, 1, 256, 576, 576, 576, 256]
    - [2, 11.276]
  - - [704, 1600, 1, 256, 704, 704, 704, 256]
    - [2, 11.868]
  - - [832, 1600, 1, 256, 832, 832, 832, 256]
    - [2, 12.132]
  - - [960, 1600, 1, 256, 960, 960, 960, 256]
    - [0, 12.138]
  - - [1088, 1600, 1, 256, 1088, 1088, 1088, 256]
    - [2, 12.13]
  - - [1216, 1600, 1, 256, 1216, 1216, 1216, 256]
    - [0, 12.316]
  - - [1344, 1600, 1, 256, 1344, 1344, 1344, 256]
    - [0, 12.277]
  - - [1472, 1600, 1, 256, 1472, 1472, 1472, 256]
    - [2, 12.225]
  - - [1600, 1600, 1, 256, 1600, 1600, 1600, 256]
    - [2, 12.142]
  - - [1728, 1600, 1, 256, 1728, 1728, 1728, 256]
    - [2, 12.373]
  - - [1856, 1600, 1, 256, 1856, 1856, 1856, 256]
    - [2, 12.239]
  - - [1984, 1600, 1, 256, 1984, 1984, 1984, 256]
    - [2, 12.269]
  - - [2112, 1600, 1, 256, 2112, 2112, 2112, 256]
    - [2, 12.511]
  - - [2240, 1600, 1, 256, 2240, 2240, 2240, 256]
    - [2, 12.541]
  - - [2368, 1600, 1, 256, 2368, 2368, 2368, 256]
    - [2, 12.477]
  - - [2496, 1600, 1, 256, 2496, 2496, 2496, 256]
    - [2, 12.314]
  - - [2624, 1600, 1, 256, 2624, 2624, 2624, 256]
    - [2, 12.599]
  - - [2752, 1600, 1, 256, 2752, 2752, 2752, 256]
    - [2, 12.489]
  - - [2880, 1600, 1, 256, 2880, 2880, 2880, 256]
    - [2, 12.408]
  - - [3008, 1600, 1, 256, 3008, 3008, 3008, 256]
    - [2, 12.78]
  - - [3136, 1600, 1, 256, 3136, 3136, 3136, 256]
    - [2, 12.524]
  - - [3264, 1600, 1, 256, 3264, 3264, 3264, 256]
    - [2, 12.745]
  - - [3392, 1600, 1, 256, 3392, 3392, 3392, 256]
    - [2, 12.686]
  - - [3520, 1600, 1, 256, 3520, 3520, 3520, 256]
    - [2, 12.73]
  - - [3648, 1600, 1, 256, 3648, 3648, 3648, 256]
    - [2, 12.818]
  - - [3776, 1600, 1, 256, 3776, 3776, 3776, 256]
    - [2, 12.688]
  - - [3904, 1600, 1, 256, 3904, 3904, 3904, 256]
    - [2, 12.859]
  - - [4032, 1600, 1, 256, 4032, 4032, 4032, 256]
    - [2, 12.771]
  - - [64, 1728, 1, 256, 64, 64, 64, 256]
    - [2, 5.107]
  - - [192, 1728, 1, 256, 192, 192, 192, 256]
    - [0, 8.737]
  - - [320, 1728, 1, 256, 320, 320, 320, 256]
    - [2, 10.102]
  - - [448, 1728, 1, 256, 448, 448, 448, 256]
    - [2, 10.784]
  - - [576, 1728, 1, 256, 576, 576, 576, 256]
    - [2, 11.319]
  - - [704, 1728, 1, 256, 704, 704, 704, 256]
    - [2, 12.067]
  - - [832, 1728, 1, 256, 832, 832, 832, 256]
    - [2, 12.338]
  - - [960, 1728, 1, 256, 960, 960, 960, 256]
    - [0, 12.108]
  - - [1088, 1728, 1, 256, 1088, 1088, 1088, 256]
    - [0, 12.286]
  - - [1216, 1728, 1, 256, 1216, 1216, 1216, 256]
    - [0, 12.113]
  - - [1344, 1728, 1, 256, 1344, 1344, 1344, 256]
    - [0, 12.214]
  - - [1472, 1728, 1, 256, 1472, 1472, 1472, 256]
    - [2, 12.081]
  - - [1600, 1728, 1, 256, 1600, 1600, 1600, 256]
    - [2, 12.138]
  - - [1728, 1728, 1, 256, 1728, 1728, 1728, 256]
    - [2, 12.076]
  - - [1856, 1728, 1, 256, 1856, 1856, 1856, 256]
    - [2, 12.271]
  - - [1984, 1728, 1, 256, 1984, 1984, 1984, 256]
    - [2, 12.318]
  - - [2112, 1728, 1, 256, 2112, 2112, 2112, 256]
    - [2, 12.253]
  - - [2240, 1728, 1, 256, 2240, 2240, 2240, 256]
    - [2, 12.31]
  - - [2368, 1728, 1, 256, 2368, 2368, 2368, 256]
    - [2, 12.478]
  - - [2496, 1728, 1, 256, 2496, 2496, 2496, 256]
    - [2, 12.736]
  - - [2624, 1728, 1, 256, 2624, 2624, 2624, 256]
    - [2, 12.719]
  - - [2752, 1728, 1, 256, 2752, 2752, 2752, 256]
    - [2, 12.563]
  - - [2880, 1728, 1, 256, 2880, 2880, 2880, 256]
    - [2, 12.843]
  - - [3008, 1728, 1, 256, 3008, 3008, 3008, 256]
    - [2, 12.75]
  - - [3136, 1728, 1, 256, 3136, 3136, 3136, 256]
    - [2, 12.518]
  - - [3264, 1728, 1, 256, 3264, 3264, 3264, 256]
    - [2, 12.565]
  - - [3392, 1728, 1, 256, 3392, 3392, 3392, 256]
    - [2, 12.635]
  - - [3520, 1728, 1, 256, 3520, 3520, 3520, 256]
    - [2, 12.761]
  - - [3648, 1728, 1, 256, 3648, 3648, 3648, 256]
    - [2, 12.594]
  - - [3776, 1728, 1, 256, 3776, 3776, 3776, 256]
    - [2, 12.599]
  - - [3904, 1728, 1, 256, 3904, 3904, 3904, 256]
    - [2, 12.668]
  - - [4032, 1728, 1, 256, 4032, 4032, 4032, 256]
    - [2, 12.658]
  - - [64, 1856, 1, 256, 64, 64, 64, 256]
    - [2, 5.51]
  - - [192, 1856, 1, 256, 192, 192, 192, 256]
    - [2, 8.905]
  - - [320, 1856, 1, 256, 320, 320, 320, 256]
    - [2, 10.273]
  - - [448, 1856, 1, 256, 448, 448, 448, 256]
    - [2, 10.992]
  - - [576, 1856, 1, 256, 576, 576, 576, 256]
    - [2, 11.94]
  - - [704, 1856, 1, 256, 704, 704, 704, 256]
    - [2, 12.164]
  - - [832, 1856, 1, 256, 832, 832, 832, 256]
    - [2, 11.898]
  - - [960, 1856, 1, 256, 960, 960, 960, 256]
    - [2, 12.126]
  - - [1088, 1856, 1, 256, 1088, 1088, 1088, 256]
    - [0, 12.091]
  - - [1216, 1856, 1, 256, 1216, 1216, 1216, 256]
    - [2, 11.92]
  - - [1344, 1856, 1, 256, 1344, 1344, 1344, 256]
    - [2, 12.514]
  - - [1472, 1856, 1, 256, 1472, 1472, 1472, 256]
    - [2, 12.385]
  - - [1600, 1856, 1, 256, 1600, 1600, 1600, 256]
    - [2, 12.158]
  - - [1728, 1856, 1, 256, 1728, 1728, 1728, 256]
    - [2, 12.26]
  - - [1856, 1856, 1, 256, 1856, 1856, 1856, 256]
    - [2, 12.403]
  - - [1984, 1856, 1, 256, 1984, 1984, 1984, 256]
    - [2, 12.488]
  - - [2112, 1856, 1, 256, 2112, 2112, 2112, 256]
    - [2, 12.707]
  - - [2240, 1856, 1, 256, 2240, 2240, 2240, 256]
    - [2, 12.637]
  - - [2368, 1856, 1, 256, 2368, 2368, 2368, 256]
    - [2, 12.529]
  - - [2496, 1856, 1, 256, 2496, 2496, 2496, 256]
    - [2, 12.816]
  - - [2624, 1856, 1, 256, 2624, 2624, 2624, 256]
    - [2, 12.707]
  - - [2752, 1856, 1, 256, 2752, 2752, 2752, 256]
    - [2, 12.669]
  - - [2880, 1856, 1, 256, 2880, 2880, 2880, 256]
    - [2, 12.779]
  - - [3008, 1856, 1, 256, 3008, 3008, 3008, 256]
    - [2, 12.676]
  - - [3136, 1856, 1, 256, 3136, 3136, 3136, 256]
    - [2, 12.886]
  - - [3264, 1856, 1, 256, 3264, 3264, 3264, 256]
    - [2, 12.828]
  - - [3392, 1856, 1, 256, 3392, 3392, 3392, 256]
    - [2, 12.742]
  - - [3520, 1856, 1, 256, 3520, 3520, 3520, 256]
    - [2, 12.702]
  - - [3648, 1856, 1, 256, 3648, 3648, 3648, 256]
    - [2, 12.859]
  - - [3776, 1856, 1, 256, 3776, 3776, 3776, 256]
    - [2, 12.775]
  - - [3904, 1856, 1, 256, 3904, 3904, 3904, 256]
    - [2, 12.659]
  - - [4032, 1856, 1, 256, 4032, 4032, 4032, 256]
    - [2, 12.801]
  - - [64, 1984, 1, 256, 64, 64, 64, 256]
    - [0, 5.697]
  - - [192, 1984, 1, 256, 192, 192, 192, 256]
    - [0, 9.235]
  - - [320, 1984, 1, 256, 320, 320, 320, 256]
    - [2, 10.538]
  - - [448, 1984, 1, 256, 448, 448, 448, 256]
    - [2, 11.525]
  - - [576, 1984, 1, 256, 576, 576, 576, 256]
    - [2, 11.965]
  - - [704, 1984, 1, 256, 704, 704, 704, 256]
    - [2, 12.227]
  - - [832, 1984, 1, 256, 832, 832, 832, 256]
    - [2, 12.327]
  - - [960, 1984, 1, 256, 960, 960, 960, 256]
    - [2, 12.121]
  - - [1088, 1984, 1, 256, 1088, 1088, 1088, 256]
    - [2, 12.517]
  - - [1216, 1984, 1, 256, 1216, 1216, 1216, 256]
    - [2, 12.339]
  - - [1344, 1984, 1, 256, 1344, 1344, 1344, 256]
    - [2, 12.065]
  - - [1472, 1984, 1, 256, 1472, 1472, 1472, 256]
    - [2, 12.234]
  - - [1600, 1984, 1, 256, 1600, 1600, 1600, 256]
    - [2, 12.296]
  - - [1728, 1984, 1, 256, 1728, 1728, 1728, 256]
    - [2, 12.302]
  - - [1856, 1984, 1, 256, 1856, 1856, 1856, 256]
    - [2, 12.614]
  - - [1984, 1984, 1, 256, 1984, 1984, 1984, 256]
    - [2, 12.569]
  - - [2112, 1984, 1, 256, 2112, 2112, 2112, 256]
    - [2, 12.395]
  - - [2240, 1984, 1, 256, 2240, 2240, 2240, 256]
    - [2, 12.438]
  - - [2368, 1984, 1, 256, 2368, 2368, 2368, 256]
    - [2, 12.52]
  - - [2496, 1984, 1, 256, 2496, 2496, 2496, 256]
    - [2, 12.556]
  - - [2624, 1984, 1, 256, 2624, 2624, 2624, 256]
    - [2, 12.463]
  - - [2752, 1984, 1, 256, 2752, 2752, 2752, 256]
    - [2, 12.573]
  - - [2880, 1984, 1, 256, 2880, 2880, 2880, 256]
    - [2, 12.76]
  - - [3008, 1984, 1, 256, 3008, 3008, 3008, 256]
    - [2, 12.722]
  - - [3136, 1984, 1, 256, 3136, 3136, 3136, 256]
    - [2, 12.695]
  - - [3264, 1984, 1, 256, 3264, 3264, 3264, 256]
    - [2, 12.727]
  - - [3392, 1984, 1, 256, 3392, 3392, 3392, 256]
    - [2, 12.627]
  - - [3520, 1984, 1, 256, 3520, 3520, 3520, 256]
    - [2, 12.676]
  - - [3648, 1984, 1, 256, 3648, 3648, 3648, 256]
    - [2, 12.676]
  - - [3776, 1984, 1, 256, 3776, 3776, 3776, 256]
    - [2, 12.684]
  - - [3904, 1984, 1, 256, 3904, 3904, 3904, 256]
    - [2, 12.672]
  - - [4032, 1984, 1, 256, 4032, 4032, 4032, 256]
    - [2, 12.711]
  - - [64, 2112, 1, 256, 64, 64, 64, 256]
    - [0, 6.045]
  - - [192, 2112, 1, 256, 192, 192, 192, 256]
    - [2, 9.352]
  - - [320, 2112, 1, 256, 320, 320, 320, 256]
    - [2, 10.708]
  - - [448, 2112, 1, 256, 448, 448, 448, 256]
    - [2, 11.543]
  - - [576, 2112, 1, 256, 576, 576, 576, 256]
    - [0, 12.016]
  - - [704, 2112, 1, 256, 704, 704, 704, 256]
    - [2, 12.418]
  - - [832, 2112, 1, 256, 832, 832, 832, 256]
    - [2, 12.193]
  - - [960, 2112, 1, 256, 960, 960, 960, 256]
    - [0, 12.395]
  - - [1088, 2112, 1, 256, 1088, 1088, 1088, 256]
    - [2, 12.151]
  - - [1216, 2112, 1, 256, 1216, 1216, 1216, 256]
    - [0, 12.169]
  - - [1344, 2112, 1, 256, 1344, 1344, 1344, 256]
    - [2, 12.094]
  - - [1472, 2112, 1, 256, 1472, 1472, 1472, 256]
    - [2, 12.197]
  - - [1600, 2112, 1, 256, 1600, 1600, 1600, 256]
    - [2, 12.338]
  - - [1728, 2112, 1, 256, 1728, 1728, 1728, 256]
    - [2, 12.303]
  - - [1856, 2112, 1, 256, 1856, 1856, 1856, 256]
    - [2, 12.65]
  - - [1984, 2112, 1, 256, 1984, 1984, 1984, 256]
    - [2, 12.45]
  - - [2112, 2112, 1, 256, 2112, 2112, 2112, 256]
    - [2, 12.353]
  - - [2240, 2112, 1, 256, 2240, 2240, 2240, 256]
    - [2, 12.454]
  - - [2368, 2112, 1, 256, 2368, 2368, 2368, 256]
    - [2, 12.419]
  - - [2496, 2112, 1, 256, 2496, 2496, 2496, 256]
    - [2, 12.697]
  - - [2624, 2112, 1, 256, 2624, 2624, 2624, 256]
    - [2, 12.638]
  - - [2752, 2112, 1, 256, 2752, 2752, 2752, 256]
    - [2, 12.575]
  - - [2880, 2112, 1, 256, 2880, 2880, 2880, 256]
    - [2, 12.725]
  - - [3008, 2112, 1, 256, 3008, 3008, 3008, 256]
    - [2, 12.599]
  - - [3136, 2112, 1, 256, 3136, 3136, 3136, 256]
    - [2, 12.658]
  - - [3264, 2112, 1, 256, 3264, 3264, 3264, 256]
    - [2, 12.679]
  - - [3392, 2112, 1, 256, 3392, 3392, 3392, 256]
    - [2, 12.635]
  - - [3520, 2112, 1, 256, 3520, 3520, 3520, 256]
    - [2, 12.78]
  - - [3648, 2112, 1, 256, 3648, 3648, 3648, 256]
    - [2, 12.685]
  - - [3776, 2112, 1, 256, 3776, 3776, 3776, 256]
    - [2, 12.683]
  - - [3904, 2112, 1, 256, 3904, 3904, 3904, 256]
    - [2, 12.759]
  - - [4032, 2112, 1, 256, 4032, 4032, 4032, 256]
    - [2, 12.747]
  - - [64, 2240, 1, 256, 64, 64, 64, 256]
    - [0, 6.427]
  - - [192, 2240, 1, 256, 192, 192, 192, 256]
    - [0, 9.619]
  - - [320, 2240, 1, 256, 320, 320, 320, 256]
    - [2, 10.75]
  - - [448, 2240, 1, 256, 448, 448, 448, 256]
    - [2, 11.45]
  - - [576, 2240, 1, 256, 576, 576, 576, 256]
    - [2, 12.15]
  - - [704, 2240, 1, 256, 704, 704, 704, 256]
    - [2, 12.183]
  - - [832, 2240, 1, 256, 832, 832, 832, 256]
    - [2, 12.394]
  - - [960, 2240, 1, 256, 960, 960, 960, 256]
    - [2, 12.295]
  - - [1088, 2240, 1, 256, 1088, 1088, 1088, 256]
    - [2, 12.102]
  - - [1216, 2240, 1, 256, 1216, 1216, 1216, 256]
    - [0, 12.108]
  - - [1344, 2240, 1, 256, 1344, 1344, 1344, 256]
    - [2, 12.197]
  - - [1472, 2240, 1, 256, 1472, 1472, 1472, 256]
    - [2, 12.196]
  - - [1600, 2240, 1, 256, 1600, 1600, 1600, 256]
    - [2, 12.303]
  - - [1728, 2240, 1, 256, 1728, 1728, 1728, 256]
    - [2, 12.339]
  - - [1856, 2240, 1, 256, 1856, 1856, 1856, 256]
    - [2, 12.418]
  - - [1984, 2240, 1, 256, 1984, 1984, 1984, 256]
    - [2, 12.62]
  - - [2112, 2240, 1, 256, 2112, 2112, 2112, 256]
    - [2, 12.466]
  - - [2240, 2240, 1, 256, 2240, 2240, 2240, 256]
    - [2, 12.722]
  - - [2368, 2240, 1, 256, 2368, 2368, 2368, 256]
    - [2, 12.715]
  - - [2496, 2240, 1, 256, 2496, 2496, 2496, 256]
    - [2, 12.519]
  - - [2624, 2240, 1, 256, 2624, 2624, 2624, 256]
    - [2, 12.797]
  - - [2752, 2240, 1, 256, 2752, 2752, 2752, 256]
    - [2, 12.578]
  - - [2880, 2240, 1, 256, 2880, 2880, 2880, 256]
    - [2, 12.629]
  - - [3008, 2240, 1, 256, 3008, 3008, 3008, 256]
    - [2, 12.684]
  - - [3136, 2240, 1, 256, 3136, 3136, 3136, 256]
    - [2, 12.696]
  - - [3264, 2240, 1, 256, 3264, 3264, 3264, 256]
    - [2, 12.704]
  - - [3392, 2240, 1, 256, 3392, 3392, 3392, 256]
    - [2, 12.707]
  - - [3520, 2240, 1, 256, 3520, 3520, 3520, 256]
    - [2, 12.749]
  - - [3648, 2240, 1, 256, 3648, 3648, 3648, 256]
    - [2, 12.699]
  - - [3776, 2240, 1, 256, 3776, 3776, 3776, 256]
    - [2, 12.698]
  - - [3904, 2240, 1, 256, 3904, 3904, 3904, 256]
    - [2, 12.852]
  - - [4032, 2240, 1, 256, 4032, 4032, 4032, 256]
    - [2, 12.749]
  - - [64, 2368, 1, 256, 64, 64, 64, 256]
    - [2, 6.069]
  - - [192, 2368, 1, 256, 192, 192, 192, 256]
    - [2, 9.496]
  - - [320, 2368, 1, 256, 320, 320, 320, 256]
    - [2, 10.807]
  - - [448, 2368, 1, 256, 448, 448, 448, 256]
    - [2, 11.641]
  - - [576, 2368, 1, 256, 576, 576, 576, 256]
    - [2, 12.139]
  - - [704, 2368, 1, 256, 704, 704, 704, 256]
    - [0, 11.923]
  - - [832, 2368, 1, 256, 832, 832, 832, 256]
    - [2, 12.048]
  - - [960, 2368, 1, 256, 960, 960, 960, 256]
    - [2, 12.119]
  - - [1088, 2368, 1, 256, 1088, 1088, 1088, 256]
    - [2, 12.078]
  - - [1216, 2368, 1, 256, 1216, 1216, 1216, 256]
    - [2, 12.09]
  - - [1344, 2368, 1, 256, 1344, 1344, 1344, 256]
    - [2, 12.183]
  - - [1472, 2368, 1, 256, 1472, 1472, 1472, 256]
    - [2, 12.389]
  - - [1600, 2368, 1, 256, 1600, 1600, 1600, 256]
    - [2, 12.324]
  - - [1728, 2368, 1, 256, 1728, 1728, 1728, 256]
    - [2, 12.39]
  - - [1856, 2368, 1, 256, 1856, 1856, 1856, 256]
    - [2, 12.491]
  - - [1984, 2368, 1, 256, 1984, 1984, 1984, 256]
    - [2, 12.465]
  - - [2112, 2368, 1, 256, 2112, 2112, 2112, 256]
    - [2, 12.521]
  - - [2240, 2368, 1, 256, 2240, 2240, 2240, 256]
    - [2, 12.535]
  - - [2368, 2368, 1, 256, 2368, 2368, 2368, 256]
    - [2, 12.57]
  - - [2496, 2368, 1, 256, 2496, 2496, 2496, 256]
    - [2, 12.608]
  - - [2624, 2368, 1, 256, 2624, 2624, 2624, 256]
    - [2, 12.612]
  - - [2752, 2368, 1, 256, 2752, 2752, 2752, 256]
    - [2, 12.527]
  - - [2880, 2368, 1, 256, 2880, 2880, 2880, 256]
    - [2, 12.665]
  - - [3008, 2368, 1, 256, 3008, 3008, 3008, 256]
    - [2, 12.745]
  - - [3136, 2368, 1, 256, 3136, 3136, 3136, 256]
    - [2, 12.661]
  - - [3264, 2368, 1, 256, 3264, 3264, 3264, 256]
    - [2, 12.713]
  - - [3392, 2368, 1, 256, 3392, 3392, 3392, 256]
    - [2, 12.671]
  - - [3520, 2368, 1, 256, 3520, 3520, 3520, 256]
    - [2, 12.661]
  - - [3648, 2368, 1, 256, 3648, 3648, 3648, 256]
    - [2, 12.716]
  - - [3776, 2368, 1, 256, 3776, 3776, 3776, 256]
    - [2, 12.622]
  - - [3904, 2368, 1, 256, 3904, 3904, 3904, 256]
    - [2, 12.71]
  - - [4032, 2368, 1, 256, 4032, 4032, 4032, 256]
    - [2, 12.793]
  - - [64, 2496, 1, 256, 64, 64, 64, 256]
    - [2, 6.374]
  - - [192, 2496, 1, 256, 192, 192, 192, 256]
    - [2, 9.899]
  - - [320, 2496, 1, 256, 320, 320, 320, 256]
    - [2, 11.037]
  - - [448, 2496, 1, 256, 448, 448, 448, 256]
    - [2, 11.705]
  - - [576, 2496, 1, 256, 576, 576, 576, 256]
    - [2, 12.192]
  - - [704, 2496, 1, 256, 704, 704, 704, 256]
    - [2, 12.513]
  - - [832, 2496, 1, 256, 832, 832, 832, 256]
    - [2, 12.184]
  - - [960, 2496, 1, 256, 960, 960, 960, 256]
    - [2, 12.45]
  - - [1088, 2496, 1, 256, 1088, 1088, 1088, 256]
    - [0, 12.086]
  - - [1216, 2496, 1, 256, 1216, 1216, 1216, 256]
    - [2, 11.939]
  - - [1344, 2496, 1, 256, 1344, 1344, 1344, 256]
    - [2, 12.257]
  - - [1472, 2496, 1, 256, 1472, 1472, 1472, 256]
    - [2, 12.284]
  - - [1600, 2496, 1, 256, 1600, 1600, 1600, 256]
    - [2, 12.326]
  - - [1728, 2496, 1, 256, 1728, 1728, 1728, 256]
    - [2, 12.421]
  - - [1856, 2496, 1, 256, 1856, 1856, 1856, 256]
    - [2, 12.422]
  - - [1984, 2496, 1, 256, 1984, 1984, 1984, 256]
    - [2, 12.52]
  - - [2112, 2496, 1, 256, 2112, 2112, 2112, 256]
    - [2, 12.561]
  - - [2240, 2496, 1, 256, 2240, 2240, 2240, 256]
    - [2, 12.71]
  - - [2368, 2496, 1, 256, 2368, 2368, 2368, 256]
    - [2, 12.616]
  - - [2496, 2496, 1, 256, 2496, 2496, 2496, 256]
    - [2, 12.639]
  - - [2624, 2496, 1, 256, 2624, 2624, 2624, 256]
    - [2, 12.674]
  - - [2752, 2496, 1, 256, 2752, 2752, 2752, 256]
    - [2, 12.559]
  - - [2880, 2496, 1, 256, 2880, 2880, 2880, 256]
    - [2, 12.644]
  - - [3008, 2496, 1, 256, 3008, 3008, 3008, 256]
    - [2, 12.696]
  - - [3136, 2496, 1, 256, 3136, 3136, 3136, 256]
    - [2, 12.667]
  - - [3264, 2496, 1, 256, 3264, 3264, 3264, 256]
    - [2, 12.676]
  - - [3392, 2496, 1, 256, 3392, 3392, 3392, 256]
    - [2, 12.701]
  - - [3520, 2496, 1, 256, 3520, 3520, 3520, 256]
    - [2, 12.669]
  - - [3648, 2496, 1, 256, 3648, 3648, 3648, 256]
    - [2, 12.643]
  - - [3776, 2496, 1, 256, 3776, 3776, 3776, 256]
    - [2, 12.787]
  - - [3904, 2496, 1, 256, 3904, 3904, 3904, 256]
    - [2, 12.761]
  - - [4032, 2496, 1, 256, 4032, 4032, 4032, 256]
    - [2, 12.783]
  - - [64, 2624, 1, 256, 64, 64, 64, 256]
    - [2, 6.674]
  - - [192, 2624, 1, 256, 192, 192, 192, 256]
    - [2, 9.949]
  - - [320, 2624, 1, 256, 320, 320, 320, 256]
    - [2, 11.147]
  - - [448, 2624, 1, 256, 448, 448, 448, 256]
    - [2, 12.3]
  - - [576, 2624, 1, 256, 576, 576, 576, 256]
    - [2, 12.177]
  - - [704, 2624, 1, 256, 704, 704, 704, 256]
    - [2, 12.333]
  - - [832, 2624, 1, 256, 832, 832, 832, 256]
    - [2, 12.625]
  - - [960, 2624, 1, 256, 960, 960, 960, 256]
    - [2, 12.187]
  - - [1088, 2624, 1, 256, 1088, 1088, 1088, 256]
    - [2, 12.104]
  - - [1216, 2624, 1, 256, 1216, 1216, 1216, 256]
    - [2, 12.127]
  - - [1344, 2624, 1, 256, 1344, 1344, 1344, 256]
    - [2, 12.477]
  - - [1472, 2624, 1, 256, 1472, 1472, 1472, 256]
    - [2, 12.324]
  - - [1600, 2624, 1, 256, 1600, 1600, 1600, 256]
    - [2, 12.41]
  - - [1728, 2624, 1, 256, 1728, 1728, 1728, 256]
    - [2, 12.458]
  - - [1856, 2624, 1, 256, 1856, 1856, 1856, 256]
    - [2, 12.472]
  - - [1984, 2624, 1, 256, 1984, 1984, 1984, 256]
    - [2, 12.528]
  - - [2112, 2624, 1, 256, 2112, 2112, 2112, 256]
    - [2, 12.591]
  - - [2240, 2624, 1, 256, 2240, 2240, 2240, 256]
    - [2, 12.558]
  - - [2368, 2624, 1, 256, 2368, 2368, 2368, 256]
    - [2, 12.568]
  - - [2496, 2624, 1, 256, 2496, 2496, 2496, 256]
    - [2, 12.614]
  - - [2624, 2624, 1, 256, 2624, 2624, 2624, 256]
    - [2, 12.614]
  - - [2752, 2624, 1, 256, 2752, 2752, 2752, 256]
    - [2, 12.583]
  - - [2880, 2624, 1, 256, 2880, 2880, 2880, 256]
    - [2, 12.692]
  - - [3008, 2624, 1, 256, 3008, 3008, 3008, 256]
    - [2, 12.66]
  - - [3136, 2624, 1, 256, 3136, 3136, 3136, 256]
    - [2, 12.668]
  - - [3264, 2624, 1, 256, 3264, 3264, 3264, 256]
    - [2, 12.64]
  - - [3392, 2624, 1, 256, 3392, 3392, 3392, 256]
    - [2, 12.642]
  - - [3520, 2624, 1, 256, 3520, 3520, 3520, 256]
    - [2, 12.623]
  - - [3648, 2624, 1, 256, 3648, 3648, 3648, 256]
    - [2, 12.695]
  - - [3776, 2624, 1, 256, 3776, 3776, 3776, 256]
    - [2, 12.757]
  - - [3904, 2624, 1, 256, 3904, 3904, 3904, 256]
    - [2, 12.73]
  - - [4032, 2624, 1, 256, 4032, 4032, 4032, 256]
    - [2, 12.643]
  - - [64, 2752, 1, 256, 64, 64, 64, 256]
    - [0, 6.591]
  - - [192, 2752, 1, 256, 192, 192, 192, 256]
    - [2, 9.994]
  - - [320, 2752, 1, 256, 320, 320, 320, 256]
    - [2, 11.179]
  - - [448, 2752, 1, 256, 448, 448, 448, 256]
    - [2, 12.014]
  - - [576, 2752, 1, 256, 576, 576, 576, 256]
    - [2, 12.287]
  - - [704, 2752, 1, 256, 704, 704, 704, 256]
    - [2, 12.454]
  - - [832, 2752, 1, 256, 832, 832, 832, 256]
    - [2, 12.278]
  - - [960, 2752, 1, 256, 960, 960, 960, 256]
    - [2, 12.406]
  - - [1088, 2752, 1, 256, 1088, 1088, 1088, 256]
    - [2, 12.248]
  - - [1216, 2752, 1, 256, 1216, 1216, 1216, 256]
    - [2, 12.355]
  - - [1344, 2752, 1, 256, 1344, 1344, 1344, 256]
    - [2, 12.338]
  - - [1472, 2752, 1, 256, 1472, 1472, 1472, 256]
    - [2, 12.375]
  - - [1600, 2752, 1, 256, 1600, 1600, 1600, 256]
    - [2, 12.407]
  - - [1728, 2752, 1, 256, 1728, 1728, 1728, 256]
    - [2, 12.468]
  - - [1856, 2752, 1, 256, 1856, 1856, 1856, 256]
    - [2, 12.549]
  - - [1984, 2752, 1, 256, 1984, 1984, 1984, 256]
    - [2, 12.577]
  - - [2112, 2752, 1, 256, 2112, 2112, 2112, 256]
    - [2, 12.63]
  - - [2240, 2752, 1, 256, 2240, 2240, 2240, 256]
    - [2, 12.533]
  - - [2368, 2752, 1, 256, 2368, 2368, 2368, 256]
    - [2, 12.588]
  - - [2496, 2752, 1, 256, 2496, 2496, 2496, 256]
    - [2, 12.666]
  - - [2624, 2752, 1, 256, 2624, 2624, 2624, 256]
    - [2, 12.557]
  - - [2752, 2752, 1, 256, 2752, 2752, 2752, 256]
    - [2, 12.636]
  - - [2880, 2752, 1, 256, 2880, 2880, 2880, 256]
    - [2, 12.676]
  - - [3008, 2752, 1, 256, 3008, 3008, 3008, 256]
    - [2, 12.705]
  - - [3136, 2752, 1, 256, 3136, 3136, 3136, 256]
    - [2, 12.659]
  - - [3264, 2752, 1, 256, 3264, 3264, 3264, 256]
    - [2, 12.733]
  - - [3392, 2752, 1, 256, 3392, 3392, 3392, 256]
    - [2, 12.719]
  - - [3520, 2752, 1, 256, 3520, 3520, 3520, 256]
    - [2, 12.732]
  - - [3648, 2752, 1, 256, 3648, 3648, 3648, 256]
    - [2, 12.703]
  - - [3776, 2752, 1, 256, 3776, 3776, 3776, 256]
    - [2, 12.727]
  - - [3904, 2752, 1, 256, 3904, 3904, 3904, 256]
    - [2, 12.699]
  - - [4032, 2752, 1, 256, 4032, 4032, 4032, 256]
    - [2, 12.796]
  - - [64, 2880, 1, 256, 64, 64, 64, 256]
    - [0, 6.894]
  - - [192, 2880, 1, 256, 192, 192, 192, 256]
    - [2, 10.132]
  - - [320, 2880, 1, 256, 320, 320, 320, 256]
    - [2, 11.267]
  - - [448, 2880, 1, 256, 448, 448, 448, 256]
    - [2, 11.956]
  - - [576, 2880, 1, 256, 576, 576, 576, 256]
    - [2, 12.557]
  - - [704, 2880, 1, 256, 704, 704, 704, 256]
    - [2, 12.401]
  - - [832, 2880, 1, 256, 832, 832, 832, 256]
    - [2, 12.531]
  - - [960, 2880, 1, 256, 960, 960, 960, 256]
    - [2, 12.426]
  - - [1088, 2880, 1, 256, 1088, 1088, 1088, 256]
    - [2, 12.367]
  - - [1216, 2880, 1, 256, 1216, 1216, 1216, 256]
    - [2, 12.421]
  - - [1344, 2880, 1, 256, 1344, 1344, 1344, 256]
    - [2, 12.411]
  - - [1472, 2880, 1, 256, 1472, 1472, 1472, 256]
    - [2, 12.499]
  - - [1600, 2880, 1, 256, 1600, 1600, 1600, 256]
    - [2, 12.455]
  - - [1728, 2880, 1, 256, 1728, 1728, 1728, 256]
    - [2, 12.448]
  - - [1856, 2880, 1, 256, 1856, 1856, 1856, 256]
    - [2, 12.483]
  - - [1984, 2880, 1, 256, 1984, 1984, 1984, 256]
    - [2, 12.542]
  - - [2112, 2880, 1, 256, 2112, 2112, 2112, 256]
    - [2, 12.577]
  - - [2240, 2880, 1, 256, 2240, 2240, 2240, 256]
    - [2, 12.666]
  - - [2368, 2880, 1, 256, 2368, 2368, 2368, 256]
    - [2, 12.619]
  - - [2496, 2880, 1, 256, 2496, 2496, 2496, 256]
    - [2, 12.616]
  - - [2624, 2880, 1, 256, 2624, 2624, 2624, 256]
    - [2, 12.692]
  - - [2752, 2880, 1, 256, 2752, 2752, 2752, 256]
    - [2, 12.666]
  - - [2880, 2880, 1, 256, 2880, 2880, 2880, 256]
    - [2, 12.713]
  - - [3008, 2880, 1, 256, 3008, 3008, 3008, 256]
    - [2, 12.661]
  - - [3136, 2880, 1, 256, 3136, 3136, 3136, 256]
    - [2, 12.742]
  - - [3264, 2880, 1, 256, 3264, 3264, 3264, 256]
    - [2, 12.725]
  - - [3392, 2880, 1, 256, 3392, 3392, 3392, 256]
    - [2, 12.751]
  - - [3520, 2880, 1, 256, 3520, 3520, 3520, 256]
    - [2, 12.749]
  - - [3648, 2880, 1, 256, 3648, 3648, 3648, 256]
    - [2, 12.729]
  - - [3776, 2880, 1, 256, 3776, 3776, 3776, 256]
    - [2, 12.771]
  - - [3904, 2880, 1, 256, 3904, 3904, 3904, 256]
    - [2, 12.746]
  - - [4032, 2880, 1, 256, 4032, 4032, 4032, 256]
    - [2, 12.768]
  - - [64, 3008, 1, 256, 64, 64, 64, 256]
    - [0, 7.195]
  - - [192, 3008, 1, 256, 192, 192, 192, 256]
    - [2, 10.236]
  - - [320, 3008, 1, 256, 320, 320, 320, 256]
    - [2, 11.302]
  - - [448, 3008, 1, 256, 448, 448, 448, 256]
    - [2, 11.978]
  - - [576, 3008, 1, 256, 576, 576, 576, 256]
    - [0, 12.277]
  - - [704, 3008, 1, 256, 704, 704, 704, 256]
    - [2, 12.478]
  - - [832, 3008, 1, 256, 832, 832, 832, 256]
    - [2, 12.261]
  - - [960, 3008, 1, 256, 960, 960, 960, 256]
    - [2, 12.362]
  - - [1088, 3008, 1, 256, 1088, 1088, 1088, 256]
    - [2, 12.124]
  - - [1216, 3008, 1, 256, 1216, 1216, 1216, 256]
    - [2, 12.255]
  - - [1344, 3008, 1, 256, 1344, 1344, 1344, 256]
    - [2, 12.131]
  - - [1472, 3008, 1, 256, 1472, 1472, 1472, 256]
    - [2, 12.51]
  - - [1600, 3008, 1, 256, 1600, 1600, 1600, 256]
    - [2, 12.579]
  - - [1728, 3008, 1, 256, 1728, 1728, 1728, 256]
    - [2, 12.463]
  - - [1856, 3008, 1, 256, 1856, 1856, 1856, 256]
    - [2, 12.533]
  - - [1984, 3008, 1, 256, 1984, 1984, 1984, 256]
    - [2, 12.617]
  - - [2112, 3008, 1, 256, 2112, 2112, 2112, 256]
    - [2, 12.686]
  - - [2240, 3008, 1, 256, 2240, 2240, 2240, 256]
    - [2, 12.641]
  - - [2368, 3008, 1, 256, 2368, 2368, 2368, 256]
    - [2, 12.636]
  - - [2496, 3008, 1, 256, 2496, 2496, 2496, 256]
    - [2, 12.635]
  - - [2624, 3008, 1, 256, 2624, 2624, 2624, 256]
    - [2, 12.65]
  - - [2752, 3008, 1, 256, 2752, 2752, 2752, 256]
    - [2, 12.593]
  - - [2880, 3008, 1, 256, 2880, 2880, 2880, 256]
    - [2, 12.713]
  - - [3008, 3008, 1, 256, 3008, 3008, 3008, 256]
    - [2, 12.721]
  - - [3136, 3008, 1, 256, 3136, 3136, 3136, 256]
    - [2, 12.703]
  - - [3264, 3008, 1, 256, 3264, 3264, 3264, 256]
    - [2, 12.736]
  - - [3392, 3008, 1, 256, 3392, 3392, 3392, 256]
    - [2, 12.791]
  - - [3520, 3008, 1, 256, 3520, 3520, 3520, 256]
    - [2, 12.754]
  - - [3648, 3008, 1, 256, 3648, 3648, 3648, 256]
    - [2, 12.723]
  - - [3776, 3008, 1, 256, 3776, 3776, 3776, 256]
    - [2, 12.67]
  - - [3904, 3008, 1, 256, 3904, 3904, 3904, 256]
    - [2, 12.742]
  - - [4032, 3008, 1, 256, 4032, 4032, 4032, 256]
    - [2, 12.777]
  - - [64, 3136, 1, 256, 64, 64, 64, 256]
    - [2, 6.833]
  - - [192, 3136, 1, 256, 192, 192, 192, 256]
    - [2, 10.312]
  - - [320, 3136, 1, 256, 320, 320, 320, 256]
    - [2, 11.437]
  - - [448, 3136, 1, 256, 448, 448, 448, 256]
    - [2, 12.193]
  - - [576, 3136, 1, 256, 576, 576, 576, 256]
    - [2, 12.443]
  - - [704, 3136, 1, 256, 704, 704, 704, 256]
    - [2, 12.72]
  - - [832, 3136, 1, 256, 832, 832, 832, 256]
    - [2, 12.387]
  - - [960, 3136, 1, 256, 960, 960, 960, 256]
    - [2, 12.246]
  - - [1088, 3136, 1, 256, 1088, 1088, 1088, 256]
    - [2, 12.258]
  - - [1216, 3136, 1, 256, 1216, 1216, 1216, 256]
    - [2, 12.431]
  - - [1344, 3136, 1, 256, 1344, 1344, 1344, 256]
    - [2, 12.528]
  - - [1472, 3136, 1, 256, 1472, 1472, 1472, 256]
    - [2, 12.405]
  - - [1600, 3136, 1, 256, 1600, 1600, 1600, 256]
    - [2, 12.527]
  - - [1728, 3136, 1, 256, 1728, 1728, 1728, 256]
    - [2, 12.46]
  - - [1856, 3136, 1, 256, 1856, 1856, 1856, 256]
    - [2, 12.575]
  - - [1984, 3136, 1, 256, 1984, 1984, 1984, 256]
    - [2, 12.614]
  - - [2112, 3136, 1, 256, 2112, 2112, 2112, 256]
    - [2, 12.577]
  - - [2240, 3136, 1, 256, 2240, 2240, 2240, 256]
    - [2, 12.598]
  - - [2368, 3136, 1, 256, 2368, 2368, 2368, 256]
    - [2, 12.63]
  - - [2496, 3136, 1, 256, 2496, 2496, 2496, 256]
    - [2, 12.706]
  - - [2624, 3136, 1, 256, 2624, 2624, 2624, 256]
    - [2, 12.616]
  - - [2752, 3136, 1, 256, 2752, 2752, 2752, 256]
    - [2, 12.646]
  - - [2880, 3136, 1, 256, 2880, 2880, 2880, 256]
    - [2, 12.761]
  - - [3008, 3136, 1, 256, 3008, 3008, 3008, 256]
    - [2, 12.713]
  - - [3136, 3136, 1, 256, 3136, 3136, 3136, 256]
    - [2, 12.684]
  - - [3264, 3136, 1, 256, 3264, 3264, 3264, 256]
    - [2, 12.683]
  - - [3392, 3136, 1, 256, 3392, 3392, 3392, 256]
    - [2, 12.684]
  - - [3520, 3136, 1, 256, 3520, 3520, 3520, 256]
    - [2, 12.775]
  - - [3648, 3136, 1, 256, 3648, 3648, 3648, 256]
    - [2, 12.755]
  - - [3776, 3136, 1, 256, 3776, 3776, 3776, 256]
    - [2, 12.706]
  - - [3904, 3136, 1, 256, 3904, 3904, 3904, 256]
    - [2, 12.771]
  - - [4032, 3136, 1, 256, 4032, 4032, 4032, 256]
    - [2, 12.75]
  - - [64, 3264, 1, 256, 64, 64, 64, 256]
    - [2, 7.065]
  - - [192, 3264, 1, 256, 192, 192, 192, 256]
    - [2, 10.396]
  - - [320, 3264, 1, 256, 320, 320, 320, 256]
    - [2, 11.481]
  - - [448, 3264, 1, 256, 448, 448, 448, 256]
    - [2, 12.203]
  - - [576, 3264, 1, 256, 576, 576, 576, 256]
    - [2, 12.417]
  - - [704, 3264, 1, 256, 704, 704, 704, 256]
    - [2, 12.028]
  - - [832, 3264, 1, 256, 832, 832, 832, 256]
    - [2, 11.853]
  - - [960, 3264, 1, 256, 960, 960, 960, 256]
    - [2, 11.983]
  - - [1088, 3264, 1, 256, 1088, 1088, 1088, 256]
    - [2, 12.003]
  - - [1216, 3264, 1, 256, 1216, 1216, 1216, 256]
    - [2, 12.408]
  - - [1344, 3264, 1, 256, 1344, 1344, 1344, 256]
    - [2, 12.38]
  - - [1472, 3264, 1, 256, 1472, 1472, 1472, 256]
    - [2, 12.488]
  - - [1600, 3264, 1, 256, 1600, 1600, 1600, 256]
    - [2, 12.477]
  - - [1728, 3264, 1, 256, 1728, 1728, 1728, 256]
    - [2, 12.551]
  - - [1856, 3264, 1, 256, 1856, 1856, 1856, 256]
    - [2, 12.599]
  - - [1984, 3264, 1, 256, 1984, 1984, 1984, 256]
    - [2, 12.602]
  - - [2112, 3264, 1, 256, 2112, 2112, 2112, 256]
    - [2, 12.682]
  - - [2240, 3264, 1, 256, 2240, 2240, 2240, 256]
    - [2, 12.651]
  - - [2368, 3264, 1, 256, 2368, 2368, 2368, 256]
    - [2, 12.614]
  - - [2496, 3264, 1, 256, 2496, 2496, 2496, 256]
    - [2, 12.632]
  - - [2624, 3264, 1, 256, 2624, 2624, 2624, 256]
    - [2, 12.694]
  - - [2752, 3264, 1, 256, 2752, 2752, 2752, 256]
    - [2, 12.641]
  - - [2880, 3264, 1, 256, 2880, 2880, 2880, 256]
    - [2, 12.647]
  - - [3008, 3264, 1, 256, 3008, 3008, 3008, 256]
    - [2, 12.763]
  - - [3136, 3264, 1, 256, 3136, 3136, 3136, 256]
    - [0, 12.841]
  - - [3264, 3264, 1, 256, 3264, 3264, 3264, 256]
    - [2, 12.758]
  - - [3392, 3264, 1, 256, 3392, 3392, 3392, 256]
    - [2, 12.675]
  - - [3520, 3264, 1, 256, 3520, 3520, 3520, 256]
    - [2, 12.723]
  - - [3648, 3264, 1, 256, 3648, 3648, 3648, 256]
    - [2, 12.752]
  - - [3776, 3264, 1, 256, 3776, 3776, 3776, 256]
    - [2, 12.741]
  - - [3904, 3264, 1, 256, 3904, 3904, 3904, 256]
    - [2, 12.766]
  - - [4032, 3264, 1, 256, 4032, 4032, 4032, 256]
    - [2, 12.77]
  - - [64, 3392, 1, 256, 64, 64, 64, 256]
    - [2, 7.452]
  - - [192, 3392, 1, 256, 192, 192, 192, 256]
    - [2, 10.562]
  - - [320, 3392, 1, 256, 320, 320, 320, 256]
    - [2, 11.79]
  - - [448, 3392, 1, 256, 448, 448, 448, 256]
    - [2, 12.222]
  - - [576, 3392, 1, 256, 576, 576, 576, 256]
    - [2, 12.147]
  - - [704, 3392, 1, 256, 704, 704, 704, 256]
    - [2, 11.996]
  - - [832, 3392, 1, 256, 832, 832, 832, 256]
    - [2, 11.997]
  - - [960, 3392, 1, 256, 960, 960, 960, 256]
    - [2, 12.135]
  - - [1088, 3392, 1, 256, 1088, 1088, 1088, 256]
    - [2, 12.24]
  - - [1216, 3392, 1, 256, 1216, 1216, 1216, 256]
    - [2, 12.359]
  - - [1344, 3392, 1, 256, 1344, 1344, 1344, 256]
    - [2, 12.498]
  - - [1472, 3392, 1, 256, 1472, 1472, 1472, 256]
    - [2, 12.489]
  - - [1600, 3392, 1, 256, 1600, 1600, 1600, 256]
    - [2, 12.524]
  - - [1728, 3392, 1, 256, 1728, 1728, 1728, 256]
    - [2, 12.514]
  - - [1856, 3392, 1, 256, 1856, 1856, 1856, 256]
    - [2, 12.594]
  - - [1984, 3392, 1, 256, 1984, 1984, 1984, 256]
    - [2, 12.571]
  - - [2112, 3392, 1, 256, 2112, 2112, 2112, 256]
    - [2, 12.639]
  - - [2240, 3392, 1, 256, 2240, 2240, 2240, 256]
    - [2, 12.622]
  - - [2368, 3392, 1, 256, 2368, 2368, 2368, 256]
    - [2, 12.718]
  - - [2496, 3392, 1, 256, 2496, 2496, 2496, 256]
    - [2, 12.638]
  - - [2624, 3392, 1, 256, 2624, 2624, 2624, 256]
    - [2, 12.763]
  - - [2752, 3392, 1, 256, 2752, 2752, 2752, 256]
    - [2, 12.769]
  - - [2880, 3392, 1, 256, 2880, 2880, 2880, 256]
    - [2, 12.715]
  - - [3008, 3392, 1, 256, 3008, 3008, 3008, 256]
    - [2, 12.725]
  - - [3136, 3392, 1, 256, 3136, 3136, 3136, 256]
    - [2, 12.76]
  - - [3264, 3392, 1, 256, 3264, 3264, 3264, 256]
    - [2, 12.81]
  - - [3392, 3392, 1, 256, 3392, 3392, 3392, 256]
    - [2, 12.909]
  - - [3520, 3392, 1, 256, 3520, 3520, 3520, 256]
    - [2, 12.778]
  - - [3648, 3392, 1, 256, 3648, 3648, 3648, 256]
    - [2, 12.74]
  - - [3776, 3392, 1, 256, 3776, 3776, 3776, 256]
    - [2, 12.808]
  - - [3904, 3392, 1, 256, 3904, 3904, 3904, 256]
    - [2, 12.827]
  - - [4032, 3392, 1, 256, 4032, 4032, 4032, 256]
    - [2, 12.782]
  - - [64, 3520, 1, 256, 64, 64, 64, 256]
    - [2, 7.588]
  - - [192, 3520, 1, 256, 192, 192, 192, 256]
    - [2, 10.621]
  - - [320, 3520, 1, 256, 320, 320, 320, 256]
    - [0, 11.855]
  - - [448, 3520, 1, 256, 448, 448, 448, 256]
    - [2, 12.511]
  - - [576, 3520, 1, 256, 576, 576, 576, 256]
    - [2, 12.247]
  - - [704, 3520, 1, 256, 704, 704, 704, 256]
    - [2, 12.558]
  - - [832, 3520, 1, 256, 832, 832, 832, 256]
    - [2, 12.413]
  - - [960, 3520, 1, 256, 960, 960, 960, 256]
    - [2, 12.28]
  - - [1088, 3520, 1, 256, 1088, 1088, 1088, 256]
    - [2, 12.272]
  - - [1216, 3520, 1, 256, 1216, 1216, 1216, 256]
    - [2, 12.369]
  - - [1344, 3520, 1, 256, 1344, 1344, 1344, 256]
    - [2, 12.502]
  - - [1472, 3520, 1, 256, 1472, 1472, 1472, 256]
    - [2, 12.653]
  - - [1600, 3520, 1, 256, 1600, 1600, 1600, 256]
    - [2, 12.753]
  - - [1728, 3520, 1, 256, 1728, 1728, 1728, 256]
    - [2, 12.578]
  - - [1856, 3520, 1, 256, 1856, 1856, 1856, 256]
    - [2, 12.602]
  - - [1984, 3520, 1, 256, 1984, 1984, 1984, 256]
    - [2, 12.604]
  - - [2112, 3520, 1, 256, 2112, 2112, 2112, 256]
    - [2, 12.65]
  - - [2240, 3520, 1, 256, 2240, 2240, 2240, 256]
    - [2, 12.689]
  - - [2368, 3520, 1, 256, 2368, 2368, 2368, 256]
    - [2, 12.683]
  - - [2496, 3520, 1, 256, 2496, 2496, 2496, 256]
    - [2, 12.715]
  - - [2624, 3520, 1, 256, 2624, 2624, 2624, 256]
    - [2, 12.657]
  - - [2752, 3520, 1, 256, 2752, 2752, 2752, 256]
    - [2, 12.73]
  - - [2880, 3520, 1, 256, 2880, 2880, 2880, 256]
    - [2, 12.702]
  - - [3008, 3520, 1, 256, 3008, 3008, 3008, 256]
    - [2, 12.779]
  - - [3136, 3520, 1, 256, 3136, 3136, 3136, 256]
    - [2, 12.686]
  - - [3264, 3520, 1, 256, 3264, 3264, 3264, 256]
    - [2, 12.783]
  - - [3392, 3520, 1, 256, 3392, 3392, 3392, 256]
    - [2, 12.771]
  - - [3520, 3520, 1, 256, 3520, 3520, 3520, 256]
    - [2, 12.761]
  - - [3648, 3520, 1, 256, 3648, 3648, 3648, 256]
    - [2, 12.818]
  - - [3776, 3520, 1, 256, 3776, 3776, 3776, 256]
    - [2, 12.779]
  - - [3904, 3520, 1, 256, 3904, 3904, 3904, 256]
    - [2, 12.768]
  - - [4032, 3520, 1, 256, 4032, 4032, 4032, 256]
    - [2, 12.792]
  - - [64, 3648, 1, 256, 64, 64, 64, 256]
    - [0, 7.722]
  - - [192, 3648, 1, 256, 192, 192, 192, 256]
    - [2, 10.601]
  - - [320, 3648, 1, 256, 320, 320, 320, 256]
    - [2, 12.051]
  - - [448, 3648, 1, 256, 448, 448, 448, 256]
    - [2, 12.38]
  - - [576, 3648, 1, 256, 576, 576, 576, 256]
    - [2, 12.155]
  - - [704, 3648, 1, 256, 704, 704, 704, 256]
    - [2, 12.271]
  - - [832, 3648, 1, 256, 832, 832, 832, 256]
    - [2, 12.06]
  - - [960, 3648, 1, 256, 960, 960, 960, 256]
    - [2, 12.199]
  - - [1088, 3648, 1, 256, 1088, 1088, 1088, 256]
    - [2, 12.256]
  - - [1216, 3648, 1, 256, 1216, 1216, 1216, 256]
    - [2, 12.535]
  - - [1344, 3648, 1, 256, 1344, 1344, 1344, 256]
    - [2, 12.35]
  - - [1472, 3648, 1, 256, 1472, 1472, 1472, 256]
    - [2, 12.519]
  - - [1600, 3648, 1, 256, 1600, 1600, 1600, 256]
    - [2, 12.645]
  - - [1728, 3648, 1, 256, 1728, 1728, 1728, 256]
    - [2, 12.612]
  - - [1856, 3648, 1, 256, 1856, 1856, 1856, 256]
    - [2, 12.648]
  - - [1984, 3648, 1, 256, 1984, 1984, 1984, 256]
    - [2, 12.665]
  - - [2112, 3648, 1, 256, 2112, 2112, 2112, 256]
    - [2, 12.638]
  - - [2240, 3648, 1, 256, 2240, 2240, 2240, 256]
    - [2, 12.681]
  - - [2368, 3648, 1, 256, 2368, 2368, 2368, 256]
    - [2, 12.678]
  - - [2496, 3648, 1, 256, 2496, 2496, 2496, 256]
    - [2, 12.635]
  - - [2624, 3648, 1, 256, 2624, 2624, 2624, 256]
    - [2, 12.776]
  - - [2752, 3648, 1, 256, 2752, 2752, 2752, 256]
    - [2, 12.759]
  - - [2880, 3648, 1, 256, 2880, 2880, 2880, 256]
    - [2, 12.735]
  - - [3008, 3648, 1, 256, 3008, 3008, 3008, 256]
    - [2, 12.784]
  - - [3136, 3648, 1, 256, 3136, 3136, 3136, 256]
    - [2, 12.794]
  - - [3264, 3648, 1, 256, 3264, 3264, 3264, 256]
    - [2, 12.775]
  - - [3392, 3648, 1, 256, 3392, 3392, 3392, 256]
    - [2, 12.804]
  - - [3520, 3648, 1, 256, 3520, 3520, 3520, 256]
    - [2, 12.414]
  - - [3648, 3648, 1, 256, 3648, 3648, 3648, 256]
    - [2, 12.783]
  - - [3776, 3648, 1, 256, 3776, 3776, 3776, 256]
    - [2, 12.804]
  - - [3904, 3648, 1, 256, 3904, 3904, 3904, 256]
    - [2, 12.818]
  - - [4032, 3648, 1, 256, 4032, 4032, 4032, 256]
    - [2, 12.79]
  - - [64, 3776, 1, 256, 64, 64, 64, 256]
    - [2, 7.519]
  - - [192, 3776, 1, 256, 192, 192, 192, 256]
    - [2, 10.754]
  - - [320, 3776, 1, 256, 320, 320, 320, 256]
    - [2, 12.069]
  - - [448, 3776, 1, 256, 448, 448, 448, 256]
    - [0, 12.313]
  - - [576, 3776, 1, 256, 576, 576, 576, 256]
    - [2, 12.173]
  - - [704, 3776, 1, 256, 704, 704, 704, 256]
    - [2, 12.002]
  - - [832, 3776, 1, 256, 832, 832, 832, 256]
    - [2, 12.06]
  - - [960, 3776, 1, 256, 960, 960, 960, 256]
    - [2, 12.278]
  - - [1088, 3776, 1, 256, 1088, 1088, 1088, 256]
    - [2, 12.399]
  - - [1216, 3776, 1, 256, 1216, 1216, 1216, 256]
    - [2, 12.691]
  - - [1344, 3776, 1, 256, 1344, 1344, 1344, 256]
    - [2, 12.557]
  - - [1472, 3776, 1, 256, 1472, 1472, 1472, 256]
    - [2, 12.527]
  - - [1600, 3776, 1, 256, 1600, 1600, 1600, 256]
    - [2, 12.573]
  - - [1728, 3776, 1, 256, 1728, 1728, 1728, 256]
    - [2, 12.583]
  - - [1856, 3776, 1, 256, 1856, 1856, 1856, 256]
    - [2, 12.627]
  - - [1984, 3776, 1, 256, 1984, 1984, 1984, 256]
    - [2, 12.632]
  - - [2112, 3776, 1, 256, 2112, 2112, 2112, 256]
    - [2, 12.698]
  - - [2240, 3776, 1, 256, 2240, 2240, 2240, 256]
    - [2, 12.686]
  - - [2368, 3776, 1, 256, 2368, 2368, 2368, 256]
    - [2, 12.71]
  - - [2496, 3776, 1, 256, 2496, 2496, 2496, 256]
    - [2, 12.713]
  - - [2624, 3776, 1, 256, 2624, 2624, 2624, 256]
    - [2, 12.799]
  - - [2752, 3776, 1, 256, 2752, 2752, 2752, 256]
    - [2, 12.777]
  - - [2880, 3776, 1, 256, 2880, 2880, 2880, 256]
    - [2, 12.723]
  - - [3008, 3776, 1, 256, 3008, 3008, 3008, 256]
    - [2, 12.806]
  - - [3136, 3776, 1, 256, 3136, 3136, 3136, 256]
    - [2, 12.802]
  - - [3264, 3776, 1, 256, 3264, 3264, 3264, 256]
    - [2, 12.783]
  - - [3392, 3776, 1, 256, 3392, 3392, 3392, 256]
    - [2, 12.838]
  - - [3520, 3776, 1, 256, 3520, 3520, 3520, 256]
    - [2, 12.826]
  - - [3648, 3776, 1, 256, 3648, 3648, 3648, 256]
    - [2, 12.828]
  - - [3776, 3776, 1, 256, 3776, 3776, 3776, 256]
    - [2, 12.721]
  - - [3904, 3776, 1, 256, 3904, 3904, 3904, 256]
    - [2, 12.901]
  - - [4032, 3776, 1, 256, 4032, 4032, 4032, 256]
    - [2, 12.88]
  - - [64, 3904, 1, 256, 64, 64, 64, 256]
    - [2, 7.619]
  - - [192, 3904, 1, 256, 192, 192, 192, 256]
    - [2, 10.793]
  - - [320, 3904, 1, 256, 320, 320, 320, 256]
    - [2, 12.12]
  - - [448, 3904, 1, 256, 448, 448, 448, 256]
    - [2, 12.316]
  - - [576, 3904, 1, 256, 576, 576, 576, 256]
    - [2, 12.384]
  - - [704, 3904, 1, 256, 704, 704, 704, 256]
    - [2, 12.213]
  - - [832, 3904, 1, 256, 832, 832, 832, 256]
    - [2, 12.169]
  - - [960, 3904, 1, 256, 960, 960, 960, 256]
    - [2, 12.304]
  - - [1088, 3904, 1, 256, 1088, 1088, 1088, 256]
    - [2, 12.398]
  - - [1216, 3904, 1, 256, 1216, 1216, 1216, 256]
    - [2, 12.394]
  - - [1344, 3904, 1, 256, 1344, 1344, 1344, 256]
    - [2, 12.464]
  - - [1472, 3904, 1, 256, 1472, 1472, 1472, 256]
    - [2, 12.578]
  - - [1600, 3904, 1, 256, 1600, 1600, 1600, 256]
    - [2, 12.671]
  - - [1728, 3904, 1, 256, 1728, 1728, 1728, 256]
    - [2, 12.678]
  - - [1856, 3904, 1, 256, 1856, 1856, 1856, 256]
    - [2, 12.66]
  - - [1984, 3904, 1, 256, 1984, 1984, 1984, 256]
    - [2, 12.579]
  - - [2112, 3904, 1, 256, 2112, 2112, 2112, 256]
    - [2, 12.703]
  - - [2240, 3904, 1, 256, 2240, 2240, 2240, 256]
    - [2, 12.751]
  - - [2368, 3904, 1, 256, 2368, 2368, 2368, 256]
    - [2, 12.784]
  - - [2496, 3904, 1, 256, 2496, 2496, 2496, 256]
    - [2, 12.731]
  - - [2624, 3904, 1, 256, 2624, 2624, 2624, 256]
    - [2, 12.808]
  - - [2752, 3904, 1, 256, 2752, 2752, 2752, 256]
    - [2, 12.804]
  - - [2880, 3904, 1, 256, 2880, 2880, 2880, 256]
    - [2, 12.785]
  - - [3008, 3904, 1, 256, 3008, 3008, 3008, 256]
    - [2, 12.837]
  - - [3136, 3904, 1, 256, 3136, 3136, 3136, 256]
    - [2, 12.815]
  - - [3264, 3904, 1, 256, 3264, 3264, 3264, 256]
    - [2, 12.772]
  - - [3392, 3904, 1, 256, 3392, 3392, 3392, 256]
    - [2, 12.873]
  - - [3520, 3904, 1, 256, 3520, 3520, 3520, 256]
    - [2, 12.871]
  - - [3648, 3904, 1, 256, 3648, 3648, 3648, 256]
    - [2, 12.822]
  - - [3776, 3904, 1, 256, 3776, 3776, 3776, 256]
    - [2, 12.901]
  - - [3904, 3904, 1, 256, 3904, 3904, 3904, 256]
    - [2, 12.874]
  - - [4032, 3904, 1, 256, 4032, 4032, 4032, 256]
    - [2, 12.862]
  - - [64, 4032, 1, 256, 64, 64, 64, 256]
    - [2, 7.734]
  - - [192, 4032, 1, 256, 192, 192, 192, 256]
    - [2, 10.867]
  - - [320, 4032, 1, 256, 320, 320, 320, 256]
    - [2, 11.933]
  - - [448, 4032, 1, 256, 448, 448, 448, 256]
    - [2, 12.363]
  - - [576, 4032, 1, 256, 576, 576, 576, 256]
    - [2, 12.049]
  - - [704, 4032, 1, 256, 704, 704, 704, 256]
    - [2, 12.145]
  - - [832, 4032, 1, 256, 832, 832, 832, 256]
    - [2, 12.079]
  - - [960, 4032, 1, 256, 960, 960, 960, 256]
    - [2, 12.332]
  - - [1088, 4032, 1, 256, 1088, 1088, 1088, 256]
    - [2, 12.469]
  - - [1216, 4032, 1, 256, 1216, 1216, 1216, 256]
    - [2, 12.727]
  - - [1344, 4032, 1, 256, 1344, 1344, 1344, 256]
    - [2, 12.56]
  - - [1472, 4032, 1, 256, 1472, 1472, 1472, 256]
    - [2, 12.603]
  - - [1600, 4032, 1, 256, 1600, 1600, 1600, 256]
    - [2, 12.58]
  - - [1728, 4032, 1, 256, 1728, 1728, 1728, 256]
    - [2, 12.64]
  - - [1856, 4032, 1, 256, 1856, 1856, 1856, 256]
    - [2, 12.656]
  - - [1984, 4032, 1, 256, 1984, 1984, 1984, 256]
    - [2, 12.673]
  - - [2112, 4032, 1, 256, 2112, 2112, 2112, 256]
    - [2, 12.687]
  - - [2240, 4032, 1, 256, 2240, 2240, 2240, 256]
    - [2, 12.741]
  - - [2368, 4032, 1, 256, 2368, 2368, 2368, 256]
    - [2, 12.805]
  - - [2496, 4032, 1, 256, 2496, 2496, 2496, 256]
    - [2, 12.796]
  - - [2624, 4032, 1, 256, 2624, 2624, 2624, 256]
    - [2, 12.827]
  - - [2752, 4032, 1, 256, 2752, 2752, 2752, 256]
    - [2, 12.777]
  - - [2880, 4032, 1, 256, 2880, 2880, 2880, 256]
    - [2, 12.766]
  - - [3008, 4032, 1, 256, 3008, 3008, 3008, 256]
    - [2, 12.843]
  - - [3136, 4032, 1, 256, 3136, 3136, 3136, 256]
    - [2, 12.757]
  - - [3264, 4032, 1, 256, 3264, 3264, 3264, 256]
    - [2, 12.858]
  - - [3392, 4032, 1, 256, 3392, 3392, 3392, 256]
    - [2, 12.806]
  - - [3520, 4032, 1, 256, 3520, 3520, 3520, 256]
    - [2, 12.797]
  - - [3648, 4032, 1, 256, 3648, 3648, 3648, 256]
    - [2, 12.867]
  - - [3776, 4032, 1, 256, 3776, 3776, 3776, 256]
    - [2, 12.827]
  - - [3904, 4032, 1, 256, 3904, 3904, 3904, 256]
    - [2, 12.897]
  - - [4032, 4032, 1, 256, 4032, 4032, 4032, 256]
    - [2, 12.862]
  - - [64, 64, 1, 512, 64, 64, 64, 512]
    - [1, 0.508]
  - - [192, 64, 1, 512, 192, 192, 192, 512]
    - [1, 1.505]
  - - [320, 64, 1, 512, 320, 320, 320, 512]
    - [3, 2.268]
  - - [448, 64, 1, 512, 448, 448, 448, 512]
    - [2, 2.965]
  - - [576, 64, 1, 512, 576, 576, 576, 512]
    - [1, 3.474]
  - - [704, 64, 1, 512, 704, 704, 704, 512]
    - [0, 4.679]
  - - [832, 64, 1, 512, 832, 832, 832, 512]
    - [2, 4.406]
  - - [960, 64, 1, 512, 960, 960, 960, 512]
    - [2, 5.07]
  - - [1088, 64, 1, 512, 1088, 1088, 1088, 512]
    - [0, 5.171]
  - - [1216, 64, 1, 512, 1216, 1216, 1216, 512]
    - [2, 4.946]
  - - [1344, 64, 1, 512, 1344, 1344, 1344, 512]
    - [0, 5.496]
  - - [1472, 64, 1, 512, 1472, 1472, 1472, 512]
    - [2, 5.993]
  - - [1600, 64, 1, 512, 1600, 1600, 1600, 512]
    - [2, 6.33]
  - - [1728, 64, 1, 512, 1728, 1728, 1728, 512]
    - [2, 6.792]
  - - [1856, 64, 1, 512, 1856, 1856, 1856, 512]
    - [2, 7.291]
  - - [1984, 64, 1, 512, 1984, 1984, 1984, 512]
    - [0, 7.296]
  - - [2112, 64, 1, 512, 2112, 2112, 2112, 512]
    - [0, 7.751]
  - - [2240, 64, 1, 512, 2240, 2240, 2240, 512]
    - [0, 8.243]
  - - [2368, 64, 1, 512, 2368, 2368, 2368, 512]
    - [2, 7.59]
  - - [2496, 64, 1, 512, 2496, 2496, 2496, 512]
    - [2, 7.829]
  - - [2624, 64, 1, 512, 2624, 2624, 2624, 512]
    - [2, 8.214]
  - - [2752, 64, 1, 512, 2752, 2752, 2752, 512]
    - [0, 8.201]
  - - [2880, 64, 1, 512, 2880, 2880, 2880, 512]
    - [0, 8.565]
  - - [3008, 64, 1, 512, 3008, 3008, 3008, 512]
    - [0, 8.927]
  - - [3136, 64, 1, 512, 3136, 3136, 3136, 512]
    - [2, 8.32]
  - - [3264, 64, 1, 512, 3264, 3264, 3264, 512]
    - [2, 8.575]
  - - [3392, 64, 1, 512, 3392, 3392, 3392, 512]
    - [2, 8.911]
  - - [3520, 64, 1, 512, 3520, 3520, 3520, 512]
    - [2, 9.238]
  - - [3648, 64, 1, 512, 3648, 3648, 3648, 512]
    - [0, 9.362]
  - - [3776, 64, 1, 512, 3776, 3776, 3776, 512]
    - [0, 9.625]
  - - [3904, 64, 1, 512, 3904, 3904, 3904, 512]
    - [2, 9.268]
  - - [4032, 64, 1, 512, 4032, 4032, 4032, 512]
    - [2, 9.412]
  - - [64, 192, 1, 512, 64, 64, 64, 512]
    - [1, 0.786]
  - - [192, 192, 1, 512, 192, 192, 192, 512]
    - [1, 2.328]
  - - [320, 192, 1, 512, 320, 320, 320, 512]
    - [0, 3.898]
  - - [448, 192, 1, 512, 448, 448, 448, 512]
    - [0, 5.475]
  - - [576, 192, 1, 512, 576, 576, 576, 512]
    - [2, 6.775]
  - - [704, 192, 1, 512, 704, 704, 704, 512]
    - [0, 7.696]
  - - [832, 192, 1, 512, 832, 832, 832, 512]
    - [2, 7.885]
  - - [960, 192, 1, 512, 960, 960, 960, 512]
    - [0, 8.587]
  - - [1088, 192, 1, 512, 1088, 1088, 1088, 512]
    - [2, 8.691]
  - - [1216, 192, 1, 512, 1216, 1216, 1216, 512]
    - [0, 9.442]
  - - [1344, 192, 1, 512, 1344, 1344, 1344, 512]
    - [2, 9.597]
  - - [1472, 192, 1, 512, 1472, 1472, 1472, 512]
    - [0, 9.957]
  - - [1600, 192, 1, 512, 1600, 1600, 1600, 512]
    - [2, 10.071]
  - - [1728, 192, 1, 512, 1728, 1728, 1728, 512]
    - [0, 10.28]
  - - [1856, 192, 1, 512, 1856, 1856, 1856, 512]
    - [2, 10.34]
  - - [1984, 192, 1, 512, 1984, 1984, 1984, 512]
    - [2, 10.588]
  - - [2112, 192, 1, 512, 2112, 2112, 2112, 512]
    - [2, 10.88]
  - - [2240, 192, 1, 512, 2240, 2240, 2240, 512]
    - [0, 10.867]
  - - [2368, 192, 1, 512, 2368, 2368, 2368, 512]
    - [2, 11.033]
  - - [2496, 192, 1, 512, 2496, 2496, 2496, 512]
    - [0, 11.013]
  - - [2624, 192, 1, 512, 2624, 2624, 2624, 512]
    - [2, 11.439]
  - - [2752, 192, 1, 512, 2752, 2752, 2752, 512]
    - [2, 11.266]
  - - [2880, 192, 1, 512, 2880, 2880, 2880, 512]
    - [2, 11.484]
  - - [3008, 192, 1, 512, 3008, 3008, 3008, 512]
    - [2, 11.503]
  - - [3136, 192, 1, 512, 3136, 3136, 3136, 512]
    - [2, 11.651]
  - - [3264, 192, 1, 512, 3264, 3264, 3264, 512]
    - [2, 11.675]
  - - [3392, 192, 1, 512, 3392, 3392, 3392, 512]
    - [2, 11.831]
  - - [3520, 192, 1, 512, 3520, 3520, 3520, 512]
    - [0, 11.837]
  - - [3648, 192, 1, 512, 3648, 3648, 3648, 512]
    - [2, 11.762]
  - - [3776, 192, 1, 512, 3776, 3776, 3776, 512]
    - [2, 11.819]
  - - [3904, 192, 1, 512, 3904, 3904, 3904, 512]
    - [2, 11.862]
  - - [4032, 192, 1, 512, 4032, 4032, 4032, 512]
    - [0, 11.902]
  - - [64, 320, 1, 512, 64, 64, 64, 512]
    - [1, 1.309]
  - - [192, 320, 1, 512, 192, 192, 192, 512]
    - [3, 3.891]
  - - [320, 320, 1, 512, 320, 320, 320, 512]
    - [2, 6.284]
  - - [448, 320, 1, 512, 448, 448, 448, 512]
    - [0, 8.144]
  - - [576, 320, 1, 512, 576, 576, 576, 512]
    - [0, 8.59]
  - - [704, 320, 1, 512, 704, 704, 704, 512]
    - [2, 9.274]
  - - [832, 320, 1, 512, 832, 832, 832, 512]
    - [2, 9.596]
  - - [960, 320, 1, 512, 960, 960, 960, 512]
    - [2, 9.911]
  - - [1088, 320, 1, 512, 1088, 1088, 1088, 512]
    - [2, 10.149]
  - - [1216, 320, 1, 512, 1216, 1216, 1216, 512]
    - [0, 10.696]
  - - [1344, 320, 1, 512, 1344, 1344, 1344, 512]
    - [0, 10.815]
  - - [1472, 320, 1, 512, 1472, 1472, 1472, 512]
    - [2, 11.305]
  - - [1600, 320, 1, 512, 1600, 1600, 1600, 512]
    - [2, 11.116]
  - - [1728, 320, 1, 512, 1728, 1728, 1728, 512]
    - [2, 11.322]
  - - [1856, 320, 1, 512, 1856, 1856, 1856, 512]
    - [2, 11.676]
  - - [1984, 320, 1, 512, 1984, 1984, 1984, 512]
    - [2, 11.573]
  - - [2112, 320, 1, 512, 2112, 2112, 2112, 512]
    - [2, 11.749]
  - - [2240, 320, 1, 512, 2240, 2240, 2240, 512]
    - [2, 11.952]
  - - [2368, 320, 1, 512, 2368, 2368, 2368, 512]
    - [2, 11.953]
  - - [2496, 320, 1, 512, 2496, 2496, 2496, 512]
    - [2, 12.041]
  - - [2624, 320, 1, 512, 2624, 2624, 2624, 512]
    - [2, 12.215]
  - - [2752, 320, 1, 512, 2752, 2752, 2752, 512]
    - [0, 12.152]
  - - [2880, 320, 1, 512, 2880, 2880, 2880, 512]
    - [0, 11.884]
  - - [3008, 320, 1, 512, 3008, 3008, 3008, 512]
    - [0, 11.905]
  - - [3136, 320, 1, 512, 3136, 3136, 3136, 512]
    - [2, 11.899]
  - - [3264, 320, 1, 512, 3264, 3264, 3264, 512]
    - [0, 12.117]
  - - [3392, 320, 1, 512, 3392, 3392, 3392, 512]
    - [0, 12.02]
  - - [3520, 320, 1, 512, 3520, 3520, 3520, 512]
    - [2, 12.026]
  - - [3648, 320, 1, 512, 3648, 3648, 3648, 512]
    - [0, 11.816]
  - - [3776, 320, 1, 512, 3776, 3776, 3776, 512]
    - [2, 11.813]
  - - [3904, 320, 1, 512, 3904, 3904, 3904, 512]
    - [2, 12.042]
  - - [4032, 320, 1, 512, 4032, 4032, 4032, 512]
    - [0, 12.041]
  - - [64, 448, 1, 512, 64, 64, 64, 512]
    - [2, 1.835]
  - - [192, 448, 1, 512, 192, 192, 192, 512]
    - [0, 5.489]
  - - [320, 448, 1, 512, 320, 320, 320, 512]
    - [0, 8.161]
  - - [448, 448, 1, 512, 448, 448, 448, 512]
    - [2, 8.375]
  - - [576, 448, 1, 512, 576, 576, 576, 512]
    - [2, 9.526]
  - - [704, 448, 1, 512, 704, 704, 704, 512]
    - [2, 9.963]
  - - [832, 448, 1, 512, 832, 832, 832, 512]
    - [2, 10.359]
  - - [960, 448, 1, 512, 960, 960, 960, 512]
    - [0, 10.823]
  - - [1088, 448, 1, 512, 1088, 1088, 1088, 512]
    - [0, 11.134]
  - - [1216, 448, 1, 512, 1216, 1216, 1216, 512]
    - [2, 11.487]
  - - [1344, 448, 1, 512, 1344, 1344, 1344, 512]
    - [2, 11.62]
  - - [1472, 448, 1, 512, 1472, 1472, 1472, 512]
    - [2, 11.693]
  - - [1600, 448, 1, 512, 1600, 1600, 1600, 512]
    - [0, 11.78]
  - - [1728, 448, 1, 512, 1728, 1728, 1728, 512]
    - [0, 11.94]
  - - [1856, 448, 1, 512, 1856, 1856, 1856, 512]
    - [0, 11.953]
  - - [1984, 448, 1, 512, 1984, 1984, 1984, 512]
    - [0, 12.103]
  - - [2112, 448, 1, 512, 2112, 2112, 2112, 512]
    - [2, 11.889]
  - - [2240, 448, 1, 512, 2240, 2240, 2240, 512]
    - [2, 11.826]
  - - [2368, 448, 1, 512, 2368, 2368, 2368, 512]
    - [0, 11.88]
  - - [2496, 448, 1, 512, 2496, 2496, 2496, 512]
    - [2, 12.005]
  - - [2624, 448, 1, 512, 2624, 2624, 2624, 512]
    - [0, 12.016]
  - - [2752, 448, 1, 512, 2752, 2752, 2752, 512]
    - [0, 12.117]
  - - [2880, 448, 1, 512, 2880, 2880, 2880, 512]
    - [2, 12.065]
  - - [3008, 448, 1, 512, 3008, 3008, 3008, 512]
    - [2, 12.068]
  - - [3136, 448, 1, 512, 3136, 3136, 3136, 512]
    - [2, 12.047]
  - - [3264, 448, 1, 512, 3264, 3264, 3264, 512]
    - [2, 12.2]
  - - [3392, 448, 1, 512, 3392, 3392, 3392, 512]
    - [2, 12.066]
  - - [3520, 448, 1, 512, 3520, 3520, 3520, 512]
    - [2, 12.23]
  - - [3648, 448, 1, 512, 3648, 3648, 3648, 512]
    - [2, 12.237]
  - - [3776, 448, 1, 512, 3776, 3776, 3776, 512]
    - [2, 12.295]
  - - [3904, 448, 1, 512, 3904, 3904, 3904, 512]
    - [2, 12.379]
  - - [4032, 448, 1, 512, 4032, 4032, 4032, 512]
    - [2, 12.43]
  - - [64, 576, 1, 512, 64, 64, 64, 512]
    - [0, 2.354]
  - - [192, 576, 1, 512, 192, 192, 192, 512]
    - [2, 6.802]
  - - [320, 576, 1, 512, 320, 320, 320, 512]
    - [0, 8.59]
  - - [448, 576, 1, 512, 448, 448, 448, 512]
    - [2, 9.527]
  - - [576, 576, 1, 512, 576, 576, 576, 512]
    - [0, 10.193]
  - - [704, 576, 1, 512, 704, 704, 704, 512]
    - [2, 10.648]
  - - [832, 576, 1, 512, 832, 832, 832, 512]
    - [0, 10.993]
  - - [960, 576, 1, 512, 960, 960, 960, 512]
    - [2, 11.346]
  - - [1088, 576, 1, 512, 1088, 1088, 1088, 512]
    - [2, 11.82]
  - - [1216, 576, 1, 512, 1216, 1216, 1216, 512]
    - [2, 11.891]
  - - [1344, 576, 1, 512, 1344, 1344, 1344, 512]
    - [0, 11.898]
  - - [1472, 576, 1, 512, 1472, 1472, 1472, 512]
    - [2, 12.046]
  - - [1600, 576, 1, 512, 1600, 1600, 1600, 512]
    - [0, 12.14]
  - - [1728, 576, 1, 512, 1728, 1728, 1728, 512]
    - [0, 12.174]
  - - [1856, 576, 1, 512, 1856, 1856, 1856, 512]
    - [0, 12.012]
  - - [1984, 576, 1, 512, 1984, 1984, 1984, 512]
    - [2, 12.158]
  - - [2112, 576, 1, 512, 2112, 2112, 2112, 512]
    - [2, 12.159]
  - - [2240, 576, 1, 512, 2240, 2240, 2240, 512]
    - [2, 12.14]
  - - [2368, 576, 1, 512, 2368, 2368, 2368, 512]
    - [2, 12.227]
  - - [2496, 576, 1, 512, 2496, 2496, 2496, 512]
    - [2, 12.152]
  - - [2624, 576, 1, 512, 2624, 2624, 2624, 512]
    - [2, 12.154]
  - - [2752, 576, 1, 512, 2752, 2752, 2752, 512]
    - [2, 12.278]
  - - [2880, 576, 1, 512, 2880, 2880, 2880, 512]
    - [2, 12.088]
  - - [3008, 576, 1, 512, 3008, 3008, 3008, 512]
    - [2, 12.112]
  - - [3136, 576, 1, 512, 3136, 3136, 3136, 512]
    - [2, 12.086]
  - - [3264, 576, 1, 512, 3264, 3264, 3264, 512]
    - [2, 12.347]
  - - [3392, 576, 1, 512, 3392, 3392, 3392, 512]
    - [2, 12.392]
  - - [3520, 576, 1, 512, 3520, 3520, 3520, 512]
    - [2, 12.474]
  - - [3648, 576, 1, 512, 3648, 3648, 3648, 512]
    - [2, 12.524]
  - - [3776, 576, 1, 512, 3776, 3776, 3776, 512]
    - [2, 12.372]
  - - [3904, 576, 1, 512, 3904, 3904, 3904, 512]
    - [2, 12.445]
  - - [4032, 576, 1, 512, 4032, 4032, 4032, 512]
    - [2, 12.541]
  - - [64, 704, 1, 512, 64, 64, 64, 512]
    - [3, 2.881]
  - - [192, 704, 1, 512, 192, 192, 192, 512]
    - [0, 7.685]
  - - [320, 704, 1, 512, 320, 320, 320, 512]
    - [2, 9.255]
  - - [448, 704, 1, 512, 448, 448, 448, 512]
    - [2, 10.104]
  - - [576, 704, 1, 512, 576, 576, 576, 512]
    - [2, 10.63]
  - - [704, 704, 1, 512, 704, 704, 704, 512]
    - [2, 11.342]
  - - [832, 704, 1, 512, 832, 832, 832, 512]
    - [2, 11.664]
  - - [960, 704, 1, 512, 960, 960, 960, 512]
    - [0, 11.973]
  - - [1088, 704, 1, 512, 1088, 1088, 1088, 512]
    - [2, 12.021]
  - - [1216, 704, 1, 512, 1216, 1216, 1216, 512]
    - [0, 11.96]
  - - [1344, 704, 1, 512, 1344, 1344, 1344, 512]
    - [0, 11.887]
  - - [1472, 704, 1, 512, 1472, 1472, 1472, 512]
    - [0, 11.892]
  - - [1600, 704, 1, 512, 1600, 1600, 1600, 512]
    - [2, 11.951]
  - - [1728, 704, 1, 512, 1728, 1728, 1728, 512]
    - [2, 12.205]
  - - [1856, 704, 1, 512, 1856, 1856, 1856, 512]
    - [2, 12.017]
  - - [1984, 704, 1, 512, 1984, 1984, 1984, 512]
    - [2, 12.141]
  - - [2112, 704, 1, 512, 2112, 2112, 2112, 512]
    - [2, 12.177]
  - - [2240, 704, 1, 512, 2240, 2240, 2240, 512]
    - [2, 12.107]
  - - [2368, 704, 1, 512, 2368, 2368, 2368, 512]
    - [2, 12.026]
  - - [2496, 704, 1, 512, 2496, 2496, 2496, 512]
    - [2, 12.259]
  - - [2624, 704, 1, 512, 2624, 2624, 2624, 512]
    - [2, 12.12]
  - - [2752, 704, 1, 512, 2752, 2752, 2752, 512]
    - [2, 12.118]
  - - [2880, 704, 1, 512, 2880, 2880, 2880, 512]
    - [2, 12.34]
  - - [3008, 704, 1, 512, 3008, 3008, 3008, 512]
    - [2, 12.297]
  - - [3136, 704, 1, 512, 3136, 3136, 3136, 512]
    - [2, 12.486]
  - - [3264, 704, 1, 512, 3264, 3264, 3264, 512]
    - [2, 12.465]
  - - [3392, 704, 1, 512, 3392, 3392, 3392, 512]
    - [2, 12.34]
  - - [3520, 704, 1, 512, 3520, 3520, 3520, 512]
    - [2, 12.537]
  - - [3648, 704, 1, 512, 3648, 3648, 3648, 512]
    - [2, 12.503]
  - - [3776, 704, 1, 512, 3776, 3776, 3776, 512]
    - [2, 12.529]
  - - [3904, 704, 1, 512, 3904, 3904, 3904, 512]
    - [2, 12.657]
  - - [4032, 704, 1, 512, 4032, 4032, 4032, 512]
    - [2, 12.694]
  - - [64, 832, 1, 512, 64, 64, 64, 512]
    - [0, 3.956]
  - - [192, 832, 1, 512, 192, 192, 192, 512]
    - [2, 7.922]
  - - [320, 832, 1, 512, 320, 320, 320, 512]
    - [2, 9.602]
  - - [448, 832, 1, 512, 448, 448, 448, 512]
    - [2, 10.354]
  - - [576, 832, 1, 512, 576, 576, 576, 512]
    - [2, 11.037]
  - - [704, 832, 1, 512, 704, 704, 704, 512]
    - [2, 11.683]
  - - [832, 832, 1, 512, 832, 832, 832, 512]
    - [2, 11.704]
  - - [960, 832, 1, 512, 960, 960, 960, 512]
    - [2, 12.057]
  - - [1088, 832, 1, 512, 1088, 1088, 1088, 512]
    - [0, 12.072]
  - - [1216, 832, 1, 512, 1216, 1216, 1216, 512]
    - [0, 11.919]
  - - [1344, 832, 1, 512, 1344, 1344, 1344, 512]
    - [0, 11.885]
  - - [1472, 832, 1, 512, 1472, 1472, 1472, 512]
    - [2, 12.037]
  - - [1600, 832, 1, 512, 1600, 1600, 1600, 512]
    - [0, 12.023]
  - - [1728, 832, 1, 512, 1728, 1728, 1728, 512]
    - [2, 12.24]
  - - [1856, 832, 1, 512, 1856, 1856, 1856, 512]
    - [2, 11.999]
  - - [1984, 832, 1, 512, 1984, 1984, 1984, 512]
    - [2, 12.141]
  - - [2112, 832, 1, 512, 2112, 2112, 2112, 512]
    - [2, 12.371]
  - - [2240, 832, 1, 512, 2240, 2240, 2240, 512]
    - [2, 12.474]
  - - [2368, 832, 1, 512, 2368, 2368, 2368, 512]
    - [0, 12.286]
  - - [2496, 832, 1, 512, 2496, 2496, 2496, 512]
    - [2, 12.593]
  - - [2624, 832, 1, 512, 2624, 2624, 2624, 512]
    - [2, 12.452]
  - - [2752, 832, 1, 512, 2752, 2752, 2752, 512]
    - [2, 12.632]
  - - [2880, 832, 1, 512, 2880, 2880, 2880, 512]
    - [2, 12.372]
  - - [3008, 832, 1, 512, 3008, 3008, 3008, 512]
    - [2, 12.423]
  - - [3136, 832, 1, 512, 3136, 3136, 3136, 512]
    - [2, 12.671]
  - - [3264, 832, 1, 512, 3264, 3264, 3264, 512]
    - [2, 12.473]
  - - [3392, 832, 1, 512, 3392, 3392, 3392, 512]
    - [2, 12.664]
  - - [3520, 832, 1, 512, 3520, 3520, 3520, 512]
    - [2, 12.748]
  - - [3648, 832, 1, 512, 3648, 3648, 3648, 512]
    - [2, 12.746]
  - - [3776, 832, 1, 512, 3776, 3776, 3776, 512]
    - [2, 12.784]
  - - [3904, 832, 1, 512, 3904, 3904, 3904, 512]
    - [2, 12.8]
  - - [4032, 832, 1, 512, 4032, 4032, 4032, 512]
    - [2, 12.628]
  - - [64, 960, 1, 512, 64, 64, 64, 512]
    - [2, 5.155]
  - - [192, 960, 1, 512, 192, 192, 192, 512]
    - [0, 8.703]
  - - [320, 960, 1, 512, 320, 320, 320, 512]
    - [2, 9.975]
  - - [448, 960, 1, 512, 448, 448, 448, 512]
    - [0, 10.832]
  - - [576, 960, 1, 512, 576, 576, 576, 512]
    - [2, 11.411]
  - - [704, 960, 1, 512, 704, 704, 704, 512]
    - [2, 11.75]
  - - [832, 960, 1, 512, 832, 832, 832, 512]
    - [2, 12.157]
  - - [960, 960, 1, 512, 960, 960, 960, 512]
    - [2, 12.181]
  - - [1088, 960, 1, 512, 1088, 1088, 1088, 512]
    - [0, 12.01]
  - - [1216, 960, 1, 512, 1216, 1216, 1216, 512]
    - [2, 12.346]
  - - [1344, 960, 1, 512, 1344, 1344, 1344, 512]
    - [0, 11.977]
  - - [1472, 960, 1, 512, 1472, 1472, 1472, 512]
    - [2, 12.023]
  - - [1600, 960, 1, 512, 1600, 1600, 1600, 512]
    - [0, 12.055]
  - - [1728, 960, 1, 512, 1728, 1728, 1728, 512]
    - [2, 12.223]
  - - [1856, 960, 1, 512, 1856, 1856, 1856, 512]
    - [2, 12.232]
  - - [1984, 960, 1, 512, 1984, 1984, 1984, 512]
    - [2, 12.219]
  - - [2112, 960, 1, 512, 2112, 2112, 2112, 512]
    - [2, 12.322]
  - - [2240, 960, 1, 512, 2240, 2240, 2240, 512]
    - [2, 12.352]
  - - [2368, 960, 1, 512, 2368, 2368, 2368, 512]
    - [2, 12.551]
  - - [2496, 960, 1, 512, 2496, 2496, 2496, 512]
    - [2, 12.616]
  - - [2624, 960, 1, 512, 2624, 2624, 2624, 512]
    - [2, 12.618]
  - - [2752, 960, 1, 512, 2752, 2752, 2752, 512]
    - [2, 12.673]
  - - [2880, 960, 1, 512, 2880, 2880, 2880, 512]
    - [2, 12.621]
  - - [3008, 960, 1, 512, 3008, 3008, 3008, 512]
    - [2, 12.656]
  - - [3136, 960, 1, 512, 3136, 3136, 3136, 512]
    - [2, 12.733]
  - - [3264, 960, 1, 512, 3264, 3264, 3264, 512]
    - [2, 12.781]
  - - [3392, 960, 1, 512, 3392, 3392, 3392, 512]
    - [2, 12.919]
  - - [3520, 960, 1, 512, 3520, 3520, 3520, 512]
    - [2, 12.815]
  - - [3648, 960, 1, 512, 3648, 3648, 3648, 512]
    - [2, 12.769]
  - - [3776, 960, 1, 512, 3776, 3776, 3776, 512]
    - [2, 12.834]
  - - [3904, 960, 1, 512, 3904, 3904, 3904, 512]
    - [2, 12.774]
  - - [4032, 960, 1, 512, 4032, 4032, 4032, 512]
    - [2, 12.79]
  - - [64, 1088, 1, 512, 64, 64, 64, 512]
    - [2, 4.442]
  - - [192, 1088, 1, 512, 192, 192, 192, 512]
    - [2, 8.721]
  - - [320, 1088, 1, 512, 320, 320, 320, 512]
    - [2, 10.228]
  - - [448, 1088, 1, 512, 448, 448, 448, 512]
    - [0, 11.203]
  - - [576, 1088, 1, 512, 576, 576, 576, 512]
    - [2, 11.751]
  - - [704, 1088, 1, 512, 704, 704, 704, 512]
    - [2, 11.921]
  - - [832, 1088, 1, 512, 832, 832, 832, 512]
    - [2, 12.237]
  - - [960, 1088, 1, 512, 960, 960, 960, 512]
    - [0, 12.049]
  - - [1088, 1088, 1, 512, 1088, 1088, 1088, 512]
    - [0, 12.103]
  - - [1216, 1088, 1, 512, 1216, 1216, 1216, 512]
    - [0, 12.118]
  - - [1344, 1088, 1, 512, 1344, 1344, 1344, 512]
    - [2, 12.203]
  - - [1472, 1088, 1, 512, 1472, 1472, 1472, 512]
    - [2, 12.158]
  - - [1600, 1088, 1, 512, 1600, 1600, 1600, 512]
    - [2, 12.306]
  - - [1728, 1088, 1, 512, 1728, 1728, 1728, 512]
    - [2, 12.487]
  - - [1856, 1088, 1, 512, 1856, 1856, 1856, 512]
    - [2, 12.63]
  - - [1984, 1088, 1, 512, 1984, 1984, 1984, 512]
    - [2, 12.564]
  - - [2112, 1088, 1, 512, 2112, 2112, 2112, 512]
    - [2, 12.499]
  - - [2240, 1088, 1, 512, 2240, 2240, 2240, 512]
    - [2, 12.643]
  - - [2368, 1088, 1, 512, 2368, 2368, 2368, 512]
    - [2, 12.686]
  - - [2496, 1088, 1, 512, 2496, 2496, 2496, 512]
    - [2, 12.74]
  - - [2624, 1088, 1, 512, 2624, 2624, 2624, 512]
    - [2, 12.767]
  - - [2752, 1088, 1, 512, 2752, 2752, 2752, 512]
    - [2, 12.799]
  - - [2880, 1088, 1, 512, 2880, 2880, 2880, 512]
    - [2, 12.714]
  - - [3008, 1088, 1, 512, 3008, 3008, 3008, 512]
    - [2, 12.881]
  - - [3136, 1088, 1, 512, 3136, 3136, 3136, 512]
    - [2, 12.947]
  - - [3264, 1088, 1, 512, 3264, 3264, 3264, 512]
    - [2, 12.818]
  - - [3392, 1088, 1, 512, 3392, 3392, 3392, 512]
    - [2, 12.937]
  - - [3520, 1088, 1, 512, 3520, 3520, 3520, 512]
    - [2, 12.902]
  - - [3648, 1088, 1, 512, 3648, 3648, 3648, 512]
    - [2, 12.957]
  - - [3776, 1088, 1, 512, 3776, 3776, 3776, 512]
    - [2, 12.93]
  - - [3904, 1088, 1, 512, 3904, 3904, 3904, 512]
    - [2, 13.019]
  - - [4032, 1088, 1, 512, 4032, 4032, 4032, 512]
    - [2, 13.059]
  - - [64, 1216, 1, 512, 64, 64, 64, 512]
    - [0, 5.825]
  - - [192, 1216, 1, 512, 192, 192, 192, 512]
    - [0, 9.472]
  - - [320, 1216, 1, 512, 320, 320, 320, 512]
    - [0, 10.766]
  - - [448, 1216, 1, 512, 448, 448, 448, 512]
    - [2, 11.408]
  - - [576, 1216, 1, 512, 576, 576, 576, 512]
    - [2, 12.057]
  - - [704, 1216, 1, 512, 704, 704, 704, 512]
    - [2, 12.009]
  - - [832, 1216, 1, 512, 832, 832, 832, 512]
    - [2, 12.235]
  - - [960, 1216, 1, 512, 960, 960, 960, 512]
    - [2, 12.139]
  - - [1088, 1216, 1, 512, 1088, 1088, 1088, 512]
    - [2, 12.253]
  - - [1216, 1216, 1, 512, 1216, 1216, 1216, 512]
    - [0, 12.064]
  - - [1344, 1216, 1, 512, 1344, 1344, 1344, 512]
    - [0, 12.12]
  - - [1472, 1216, 1, 512, 1472, 1472, 1472, 512]
    - [2, 12.128]
  - - [1600, 1216, 1, 512, 1600, 1600, 1600, 512]
    - [2, 12.496]
  - - [1728, 1216, 1, 512, 1728, 1728, 1728, 512]
    - [2, 12.407]
  - - [1856, 1216, 1, 512, 1856, 1856, 1856, 512]
    - [2, 12.531]
  - - [1984, 1216, 1, 512, 1984, 1984, 1984, 512]
    - [2, 12.374]
  - - [2112, 1216, 1, 512, 2112, 2112, 2112, 512]
    - [2, 12.659]
  - - [2240, 1216, 1, 512, 2240, 2240, 2240, 512]
    - [2, 12.628]
  - - [2368, 1216, 1, 512, 2368, 2368, 2368, 512]
    - [2, 12.634]
  - - [2496, 1216, 1, 512, 2496, 2496, 2496, 512]
    - [2, 12.731]
  - - [2624, 1216, 1, 512, 2624, 2624, 2624, 512]
    - [2, 12.831]
  - - [2752, 1216, 1, 512, 2752, 2752, 2752, 512]
    - [2, 12.766]
  - - [2880, 1216, 1, 512, 2880, 2880, 2880, 512]
    - [2, 12.794]
  - - [3008, 1216, 1, 512, 3008, 3008, 3008, 512]
    - [2, 12.855]
  - - [3136, 1216, 1, 512, 3136, 3136, 3136, 512]
    - [2, 12.944]
  - - [3264, 1216, 1, 512, 3264, 3264, 3264, 512]
    - [2, 12.984]
  - - [3392, 1216, 1, 512, 3392, 3392, 3392, 512]
    - [2, 12.934]
  - - [3520, 1216, 1, 512, 3520, 3520, 3520, 512]
    - [2, 13.062]
  - - [3648, 1216, 1, 512, 3648, 3648, 3648, 512]
    - [2, 13.014]
  - - [3776, 1216, 1, 512, 3776, 3776, 3776, 512]
    - [2, 12.96]
  - - [3904, 1216, 1, 512, 3904, 3904, 3904, 512]
    - [2, 13.056]
  - - [4032, 1216, 1, 512, 4032, 4032, 4032, 512]
    - [2, 13.134]
  - - [64, 1344, 1, 512, 64, 64, 64, 512]
    - [2, 5.505]
  - - [192, 1344, 1, 512, 192, 192, 192, 512]
    - [2, 9.575]
  - - [320, 1344, 1, 512, 320, 320, 320, 512]
    - [0, 10.875]
  - - [448, 1344, 1, 512, 448, 448, 448, 512]
    - [2, 11.472]
  - - [576, 1344, 1, 512, 576, 576, 576, 512]
    - [0, 12.005]
  - - [704, 1344, 1, 512, 704, 704, 704, 512]
    - [2, 11.951]
  - - [832, 1344, 1, 512, 832, 832, 832, 512]
    - [0, 12.2]
  - - [960, 1344, 1, 512, 960, 960, 960, 512]
    - [2, 12.488]
  - - [1088, 1344, 1, 512, 1088, 1088, 1088, 512]
    - [2, 12.15]
  - - [1216, 1344, 1, 512, 1216, 1216, 1216, 512]
    - [2, 12.108]
  - - [1344, 1344, 1, 512, 1344, 1344, 1344, 512]
    - [2, 12.122]
  - - [1472, 1344, 1, 512, 1472, 1472, 1472, 512]
    - [2, 12.232]
  - - [1600, 1344, 1, 512, 1600, 1600, 1600, 512]
    - [2, 12.531]
  - - [1728, 1344, 1, 512, 1728, 1728, 1728, 512]
    - [2, 12.307]
  - - [1856, 1344, 1, 512, 1856, 1856, 1856, 512]
    - [2, 12.623]
  - - [1984, 1344, 1, 512, 1984, 1984, 1984, 512]
    - [2, 12.596]
  - - [2112, 1344, 1, 512, 2112, 2112, 2112, 512]
    - [2, 12.732]
  - - [2240, 1344, 1, 512, 2240, 2240, 2240, 512]
    - [2, 12.742]
  - - [2368, 1344, 1, 512, 2368, 2368, 2368, 512]
    - [2, 12.797]
  - - [2496, 1344, 1, 512, 2496, 2496, 2496, 512]
    - [2, 12.839]
  - - [2624, 1344, 1, 512, 2624, 2624, 2624, 512]
    - [2, 12.876]
  - - [2752, 1344, 1, 512, 2752, 2752, 2752, 512]
    - [2, 12.863]
  - - [2880, 1344, 1, 512, 2880, 2880, 2880, 512]
    - [2, 13.003]
  - - [3008, 1344, 1, 512, 3008, 3008, 3008, 512]
    - [2, 12.948]
  - - [3136, 1344, 1, 512, 3136, 3136, 3136, 512]
    - [2, 12.999]
  - - [3264, 1344, 1, 512, 3264, 3264, 3264, 512]
    - [2, 13.084]
  - - [3392, 1344, 1, 512, 3392, 3392, 3392, 512]
    - [2, 13.069]
  - - [3520, 1344, 1, 512, 3520, 3520, 3520, 512]
    - [2, 12.77]
  - - [3648, 1344, 1, 512, 3648, 3648, 3648, 512]
    - [2, 12.963]
  - - [3776, 1344, 1, 512, 3776, 3776, 3776, 512]
    - [2, 12.82]
  - - [3904, 1344, 1, 512, 3904, 3904, 3904, 512]
    - [2, 12.995]
  - - [4032, 1344, 1, 512, 4032, 4032, 4032, 512]
    - [2, 12.986]
  - - [64, 1472, 1, 512, 64, 64, 64, 512]
    - [0, 7.039]
  - - [192, 1472, 1, 512, 192, 192, 192, 512]
    - [0, 9.93]
  - - [320, 1472, 1, 512, 320, 320, 320, 512]
    - [2, 10.915]
  - - [448, 1472, 1, 512, 448, 448, 448, 512]
    - [2, 11.903]
  - - [576, 1472, 1, 512, 576, 576, 576, 512]
    - [2, 12.166]
  - - [704, 1472, 1, 512, 704, 704, 704, 512]
    - [2, 12.155]
  - - [832, 1472, 1, 512, 832, 832, 832, 512]
    - [2, 12.105]
  - - [960, 1472, 1, 512, 960, 960, 960, 512]
    - [2, 12.214]
  - - [1088, 1472, 1, 512, 1088, 1088, 1088, 512]
    - [2, 12.201]
  - - [1216, 1472, 1, 512, 1216, 1216, 1216, 512]
    - [2, 12.433]
  - - [1344, 1472, 1, 512, 1344, 1344, 1344, 512]
    - [2, 12.607]
  - - [1472, 1472, 1, 512, 1472, 1472, 1472, 512]
    - [2, 12.552]
  - - [1600, 1472, 1, 512, 1600, 1600, 1600, 512]
    - [2, 12.414]
  - - [1728, 1472, 1, 512, 1728, 1728, 1728, 512]
    - [2, 12.569]
  - - [1856, 1472, 1, 512, 1856, 1856, 1856, 512]
    - [2, 12.735]
  - - [1984, 1472, 1, 512, 1984, 1984, 1984, 512]
    - [2, 12.773]
  - - [2112, 1472, 1, 512, 2112, 2112, 2112, 512]
    - [2, 12.748]
  - - [2240, 1472, 1, 512, 2240, 2240, 2240, 512]
    - [2, 12.924]
  - - [2368, 1472, 1, 512, 2368, 2368, 2368, 512]
    - [2, 12.856]
  - - [2496, 1472, 1, 512, 2496, 2496, 2496, 512]
    - [2, 12.839]
  - - [2624, 1472, 1, 512, 2624, 2624, 2624, 512]
    - [2, 12.884]
  - - [2752, 1472, 1, 512, 2752, 2752, 2752, 512]
    - [2, 12.958]
  - - [2880, 1472, 1, 512, 2880, 2880, 2880, 512]
    - [2, 12.893]
  - - [3008, 1472, 1, 512, 3008, 3008, 3008, 512]
    - [2, 12.936]
  - - [3136, 1472, 1, 512, 3136, 3136, 3136, 512]
    - [0, 12.661]
  - - [3264, 1472, 1, 512, 3264, 3264, 3264, 512]
    - [2, 13.034]
  - - [3392, 1472, 1, 512, 3392, 3392, 3392, 512]
    - [2, 12.861]
  - - [3520, 1472, 1, 512, 3520, 3520, 3520, 512]
    - [2, 13.023]
  - - [3648, 1472, 1, 512, 3648, 3648, 3648, 512]
    - [2, 12.937]
  - - [3776, 1472, 1, 512, 3776, 3776, 3776, 512]
    - [2, 12.962]
  - - [3904, 1472, 1, 512, 3904, 3904, 3904, 512]
    - [2, 12.879]
  - - [4032, 1472, 1, 512, 4032, 4032, 4032, 512]
    - [2, 12.868]
  - - [64, 1600, 1, 512, 64, 64, 64, 512]
    - [2, 6.406]
  - - [192, 1600, 1, 512, 192, 192, 192, 512]
    - [2, 10.026]
  - - [320, 1600, 1, 512, 320, 320, 320, 512]
    - [2, 11.123]
  - - [448, 1600, 1, 512, 448, 448, 448, 512]
    - [2, 12.149]
  - - [576, 1600, 1, 512, 576, 576, 576, 512]
    - [0, 12.07]
  - - [704, 1600, 1, 512, 704, 704, 704, 512]
    - [2, 11.924]
  - - [832, 1600, 1, 512, 832, 832, 832, 512]
    - [2, 11.959]
  - - [960, 1600, 1, 512, 960, 960, 960, 512]
    - [2, 11.954]
  - - [1088, 1600, 1, 512, 1088, 1088, 1088, 512]
    - [2, 12.079]
  - - [1216, 1600, 1, 512, 1216, 1216, 1216, 512]
    - [2, 12.495]
  - - [1344, 1600, 1, 512, 1344, 1344, 1344, 512]
    - [2, 12.272]
  - - [1472, 1600, 1, 512, 1472, 1472, 1472, 512]
    - [2, 12.631]
  - - [1600, 1600, 1, 512, 1600, 1600, 1600, 512]
    - [2, 12.552]
  - - [1728, 1600, 1, 512, 1728, 1728, 1728, 512]
    - [2, 12.703]
  - - [1856, 1600, 1, 512, 1856, 1856, 1856, 512]
    - [2, 12.831]
  - - [1984, 1600, 1, 512, 1984, 1984, 1984, 512]
    - [2, 12.712]
  - - [2112, 1600, 1, 512, 2112, 2112, 2112, 512]
    - [2, 12.896]
  - - [2240, 1600, 1, 512, 2240, 2240, 2240, 512]
    - [2, 12.833]
  - - [2368, 1600, 1, 512, 2368, 2368, 2368, 512]
    - [2, 12.912]
  - - [2496, 1600, 1, 512, 2496, 2496, 2496, 512]
    - [2, 12.885]
  - - [2624, 1600, 1, 512, 2624, 2624, 2624, 512]
    - [2, 12.891]
  - - [2752, 1600, 1, 512, 2752, 2752, 2752, 512]
    - [2, 13.032]
  - - [2880, 1600, 1, 512, 2880, 2880, 2880, 512]
    - [2, 12.873]
  - - [3008, 1600, 1, 512, 3008, 3008, 3008, 512]
    - [2, 12.881]
  - - [3136, 1600, 1, 512, 3136, 3136, 3136, 512]
    - [2, 13.009]
  - - [3264, 1600, 1, 512, 3264, 3264, 3264, 512]
    - [2, 13.046]
  - - [3392, 1600, 1, 512, 3392, 3392, 3392, 512]
    - [2, 13.114]
  - - [3520, 1600, 1, 512, 3520, 3520, 3520, 512]
    - [2, 12.987]
  - - [3648, 1600, 1, 512, 3648, 3648, 3648, 512]
    - [2, 13.11]
  - - [3776, 1600, 1, 512, 3776, 3776, 3776, 512]
    - [2, 13.004]
  - - [3904, 1600, 1, 512, 3904, 3904, 3904, 512]
    - [2, 13.152]
  - - [4032, 1600, 1, 512, 4032, 4032, 4032, 512]
    - [2, 13.049]
  - - [64, 1728, 1, 512, 64, 64, 64, 512]
    - [2, 6.809]
  - - [192, 1728, 1, 512, 192, 192, 192, 512]
    - [0, 10.224]
  - - [320, 1728, 1, 512, 320, 320, 320, 512]
    - [2, 11.22]
  - - [448, 1728, 1, 512, 448, 448, 448, 512]
    - [0, 11.926]
  - - [576, 1728, 1, 512, 576, 576, 576, 512]
    - [2, 11.937]
  - - [704, 1728, 1, 512, 704, 704, 704, 512]
    - [2, 12.17]
  - - [832, 1728, 1, 512, 832, 832, 832, 512]
    - [2, 11.984]
  - - [960, 1728, 1, 512, 960, 960, 960, 512]
    - [2, 12.158]
  - - [1088, 1728, 1, 512, 1088, 1088, 1088, 512]
    - [2, 12.439]
  - - [1216, 1728, 1, 512, 1216, 1216, 1216, 512]
    - [2, 12.414]
  - - [1344, 1728, 1, 512, 1344, 1344, 1344, 512]
    - [2, 12.532]
  - - [1472, 1728, 1, 512, 1472, 1472, 1472, 512]
    - [2, 12.591]
  - - [1600, 1728, 1, 512, 1600, 1600, 1600, 512]
    - [2, 12.703]
  - - [1728, 1728, 1, 512, 1728, 1728, 1728, 512]
    - [2, 12.745]
  - - [1856, 1728, 1, 512, 1856, 1856, 1856, 512]
    - [0, 12.337]
  - - [1984, 1728, 1, 512, 1984, 1984, 1984, 512]
    - [2, 12.876]
  - - [2112, 1728, 1, 512, 2112, 2112, 2112, 512]
    - [2, 12.832]
  - - [2240, 1728, 1, 512, 2240, 2240, 2240, 512]
    - [2, 12.742]
  - - [2368, 1728, 1, 512, 2368, 2368, 2368, 512]
    - [2, 12.88]
  - - [2496, 1728, 1, 512, 2496, 2496, 2496, 512]
    - [2, 12.863]
  - - [2624, 1728, 1, 512, 2624, 2624, 2624, 512]
    - [2, 12.764]
  - - [2752, 1728, 1, 512, 2752, 2752, 2752, 512]
    - [2, 12.938]
  - - [2880, 1728, 1, 512, 2880, 2880, 2880, 512]
    - [2, 13.087]
  - - [3008, 1728, 1, 512, 3008, 3008, 3008, 512]
    - [2, 12.822]
  - - [3136, 1728, 1, 512, 3136, 3136, 3136, 512]
    - [2, 13.009]
  - - [3264, 1728, 1, 512, 3264, 3264, 3264, 512]
    - [2, 12.852]
  - - [3392, 1728, 1, 512, 3392, 3392, 3392, 512]
    - [2, 12.972]
  - - [3520, 1728, 1, 512, 3520, 3520, 3520, 512]
    - [2, 12.953]
  - - [3648, 1728, 1, 512, 3648, 3648, 3648, 512]
    - [2, 13.014]
  - - [3776, 1728, 1, 512, 3776, 3776, 3776, 512]
    - [2, 13.055]
  - - [3904, 1728, 1, 512, 3904, 3904, 3904, 512]
    - [2, 13.037]
  - - [4032, 1728, 1, 512, 4032, 4032, 4032, 512]
    - [2, 13.116]
  - - [64, 1856, 1, 512, 64, 64, 64, 512]
    - [2, 7.313]
  - - [192, 1856, 1, 512, 192, 192, 192, 512]
    - [2, 10.295]
  - - [320, 1856, 1, 512, 320, 320, 320, 512]
    - [2, 11.317]
  - - [448, 1856, 1, 512, 448, 448, 448, 512]
    - [0, 12.046]
  - - [576, 1856, 1, 512, 576, 576, 576, 512]
    - [2, 12.164]
  - - [704, 1856, 1, 512, 704, 704, 704, 512]
    - [2, 11.824]
  - - [832, 1856, 1, 512, 832, 832, 832, 512]
    - [2, 12.297]
  - - [960, 1856, 1, 512, 960, 960, 960, 512]
    - [2, 12.241]
  - - [1088, 1856, 1, 512, 1088, 1088, 1088, 512]
    - [2, 12.376]
  - - [1216, 1856, 1, 512, 1216, 1216, 1216, 512]
    - [2, 12.305]
  - - [1344, 1856, 1, 512, 1344, 1344, 1344, 512]
    - [2, 12.571]
  - - [1472, 1856, 1, 512, 1472, 1472, 1472, 512]
    - [2, 12.767]
  - - [1600, 1856, 1, 512, 1600, 1600, 1600, 512]
    - [2, 12.496]
  - - [1728, 1856, 1, 512, 1728, 1728, 1728, 512]
    - [2, 12.796]
  - - [1856, 1856, 1, 512, 1856, 1856, 1856, 512]
    - [2, 12.906]
  - - [1984, 1856, 1, 512, 1984, 1984, 1984, 512]
    - [0, 12.462]
  - - [2112, 1856, 1, 512, 2112, 2112, 2112, 512]
    - [2, 12.749]
  - - [2240, 1856, 1, 512, 2240, 2240, 2240, 512]
    - [2, 12.773]
  - - [2368, 1856, 1, 512, 2368, 2368, 2368, 512]
    - [2, 12.966]
  - - [2496, 1856, 1, 512, 2496, 2496, 2496, 512]
    - [2, 12.982]
  - - [2624, 1856, 1, 512, 2624, 2624, 2624, 512]
    - [2, 13.032]
  - - [2752, 1856, 1, 512, 2752, 2752, 2752, 512]
    - [2, 13.103]
  - - [2880, 1856, 1, 512, 2880, 2880, 2880, 512]
    - [2, 12.992]
  - - [3008, 1856, 1, 512, 3008, 3008, 3008, 512]
    - [2, 13.108]
  - - [3136, 1856, 1, 512, 3136, 3136, 3136, 512]
    - [2, 13.051]
  - - [3264, 1856, 1, 512, 3264, 3264, 3264, 512]
    - [2, 13.162]
  - - [3392, 1856, 1, 512, 3392, 3392, 3392, 512]
    - [2, 13.004]
  - - [3520, 1856, 1, 512, 3520, 3520, 3520, 512]
    - [2, 12.972]
  - - [3648, 1856, 1, 512, 3648, 3648, 3648, 512]
    - [2, 13.125]
  - - [3776, 1856, 1, 512, 3776, 3776, 3776, 512]
    - [2, 13.108]
  - - [3904, 1856, 1, 512, 3904, 3904, 3904, 512]
    - [2, 13.116]
  - - [4032, 1856, 1, 512, 4032, 4032, 4032, 512]
    - [2, 13.103]
  - - [64, 1984, 1, 512, 64, 64, 64, 512]
    - [0, 7.269]
  - - [192, 1984, 1, 512, 192, 192, 192, 512]
    - [2, 10.508]
  - - [320, 1984, 1, 512, 320, 320, 320, 512]
    - [0, 11.574]
  - - [448, 1984, 1, 512, 448, 448, 448, 512]
    - [0, 12.132]
  - - [576, 1984, 1, 512, 576, 576, 576, 512]
    - [0, 12.088]
  - - [704, 1984, 1, 512, 704, 704, 704, 512]
    - [0, 11.937]
  - - [832, 1984, 1, 512, 832, 832, 832, 512]
    - [2, 12.226]
  - - [960, 1984, 1, 512, 960, 960, 960, 512]
    - [2, 12.135]
  - - [1088, 1984, 1, 512, 1088, 1088, 1088, 512]
    - [2, 12.546]
  - - [1216, 1984, 1, 512, 1216, 1216, 1216, 512]
    - [2, 12.398]
  - - [1344, 1984, 1, 512, 1344, 1344, 1344, 512]
    - [2, 12.44]
  - - [1472, 1984, 1, 512, 1472, 1472, 1472, 512]
    - [2, 12.717]
  - - [1600, 1984, 1, 512, 1600, 1600, 1600, 512]
    - [2, 12.63]
  - - [1728, 1984, 1, 512, 1728, 1728, 1728, 512]
    - [2, 12.784]
  - - [1856, 1984, 1, 512, 1856, 1856, 1856, 512]
    - [2, 12.915]
  - - [1984, 1984, 1, 512, 1984, 1984, 1984, 512]
    - [0, 12.931]
  - - [2112, 1984, 1, 512, 2112, 2112, 2112, 512]
    - [2, 12.95]
  - - [2240, 1984, 1, 512, 2240, 2240, 2240, 512]
    - [2, 12.972]
  - - [2368, 1984, 1, 512, 2368, 2368, 2368, 512]
    - [2, 13.102]
  - - [2496, 1984, 1, 512, 2496, 2496, 2496, 512]
    - [2, 13.078]
  - - [2624, 1984, 1, 512, 2624, 2624, 2624, 512]
    - [2, 13.063]
  - - [2752, 1984, 1, 512, 2752, 2752, 2752, 512]
    - [2, 13.122]
  - - [2880, 1984, 1, 512, 2880, 2880, 2880, 512]
    - [2, 13.136]
  - - [3008, 1984, 1, 512, 3008, 3008, 3008, 512]
    - [2, 13.171]
  - - [3136, 1984, 1, 512, 3136, 3136, 3136, 512]
    - [2, 13.202]
  - - [3264, 1984, 1, 512, 3264, 3264, 3264, 512]
    - [2, 13.154]
  - - [3392, 1984, 1, 512, 3392, 3392, 3392, 512]
    - [2, 13.203]
  - - [3520, 1984, 1, 512, 3520, 3520, 3520, 512]
    - [2, 13.185]
  - - [3648, 1984, 1, 512, 3648, 3648, 3648, 512]
    - [2, 12.958]
  - - [3776, 1984, 1, 512, 3776, 3776, 3776, 512]
    - [2, 13.046]
  - - [3904, 1984, 1, 512, 3904, 3904, 3904, 512]
    - [2, 13.13]
  - - [4032, 1984, 1, 512, 4032, 4032, 4032, 512]
    - [2, 13.108]
  - - [64, 2112, 1, 512, 64, 64, 64, 512]
    - [0, 7.696]
  - - [192, 2112, 1, 512, 192, 192, 192, 512]
    - [2, 10.588]
  - - [320, 2112, 1, 512, 320, 320, 320, 512]
    - [2, 11.916]
  - - [448, 2112, 1, 512, 448, 448, 448, 512]
    - [2, 11.968]
  - - [576, 2112, 1, 512, 576, 576, 576, 512]
    - [2, 11.941]
  - - [704, 2112, 1, 512, 704, 704, 704, 512]
    - [2, 12.088]
  - - [832, 2112, 1, 512, 832, 832, 832, 512]
    - [2, 12.139]
  - - [960, 2112, 1, 512, 960, 960, 960, 512]
    - [2, 12.345]
  - - [1088, 2112, 1, 512, 1088, 1088, 1088, 512]
    - [2, 12.507]
  - - [1216, 2112, 1, 512, 1216, 1216, 1216, 512]
    - [2, 12.641]
  - - [1344, 2112, 1, 512, 1344, 1344, 1344, 512]
    - [2, 12.592]
  - - [1472, 2112, 1, 512, 1472, 1472, 1472, 512]
    - [2, 12.751]
  - - [1600, 2112, 1, 512, 1600, 1600, 1600, 512]
    - [2, 12.681]
  - - [1728, 2112, 1, 512, 1728, 1728, 1728, 512]
    - [2, 12.789]
  - - [1856, 2112, 1, 512, 1856, 1856, 1856, 512]
    - [2, 12.814]
  - - [1984, 2112, 1, 512, 1984, 1984, 1984, 512]
    - [2, 12.919]
  - - [2112, 2112, 1, 512, 2112, 2112, 2112, 512]
    - [2, 12.986]
  - - [2240, 2112, 1, 512, 2240, 2240, 2240, 512]
    - [2, 13.041]
  - - [2368, 2112, 1, 512, 2368, 2368, 2368, 512]
    - [2, 13.134]
  - - [2496, 2112, 1, 512, 2496, 2496, 2496, 512]
    - [2, 13.1]
  - - [2624, 2112, 1, 512, 2624, 2624, 2624, 512]
    - [2, 13.128]
  - - [2752, 2112, 1, 512, 2752, 2752, 2752, 512]
    - [2, 13.162]
  - - [2880, 2112, 1, 512, 2880, 2880, 2880, 512]
    - [2, 13.074]
  - - [3008, 2112, 1, 512, 3008, 3008, 3008, 512]
    - [2, 13.202]
  - - [3136, 2112, 1, 512, 3136, 3136, 3136, 512]
    - [2, 13.166]
  - - [3264, 2112, 1, 512, 3264, 3264, 3264, 512]
    - [2, 13.221]
  - - [3392, 2112, 1, 512, 3392, 3392, 3392, 512]
    - [2, 13.202]
  - - [3520, 2112, 1, 512, 3520, 3520, 3520, 512]
    - [2, 13.252]
  - - [3648, 2112, 1, 512, 3648, 3648, 3648, 512]
    - [2, 13.159]
  - - [3776, 2112, 1, 512, 3776, 3776, 3776, 512]
    - [2, 13.15]
  - - [3904, 2112, 1, 512, 3904, 3904, 3904, 512]
    - [2, 13.139]
  - - [4032, 2112, 1, 512, 4032, 4032, 4032, 512]
    - [2, 13.152]
  - - [64, 2240, 1, 512, 64, 64, 64, 512]
    - [0, 8.26]
  - - [192, 2240, 1, 512, 192, 192, 192, 512]
    - [0, 10.845]
  - - [320, 2240, 1, 512, 320, 320, 320, 512]
    - [2, 11.775]
  - - [448, 2240, 1, 512, 448, 448, 448, 512]
    - [2, 12.21]
  - - [576, 2240, 1, 512, 576, 576, 576, 512]
    - [2, 12.346]
  - - [704, 2240, 1, 512, 704, 704, 704, 512]
    - [2, 12.319]
  - - [832, 2240, 1, 512, 832, 832, 832, 512]
    - [2, 12.457]
  - - [960, 2240, 1, 512, 960, 960, 960, 512]
    - [2, 12.58]
  - - [1088, 2240, 1, 512, 1088, 1088, 1088, 512]
    - [2, 12.715]
  - - [1216, 2240, 1, 512, 1216, 1216, 1216, 512]
    - [2, 12.648]
  - - [1344, 2240, 1, 512, 1344, 1344, 1344, 512]
    - [2, 12.667]
  - - [1472, 2240, 1, 512, 1472, 1472, 1472, 512]
    - [2, 12.848]
  - - [1600, 2240, 1, 512, 1600, 1600, 1600, 512]
    - [2, 12.706]
  - - [1728, 2240, 1, 512, 1728, 1728, 1728, 512]
    - [2, 12.921]
  - - [1856, 2240, 1, 512, 1856, 1856, 1856, 512]
    - [2, 12.98]
  - - [1984, 2240, 1, 512, 1984, 1984, 1984, 512]
    - [2, 12.999]
  - - [2112, 2240, 1, 512, 2112, 2112, 2112, 512]
    - [2, 13.029]
  - - [2240, 2240, 1, 512, 2240, 2240, 2240, 512]
    - [2, 13.034]
  - - [2368, 2240, 1, 512, 2368, 2368, 2368, 512]
    - [2, 13.105]
  - - [2496, 2240, 1, 512, 2496, 2496, 2496, 512]
    - [2, 13.106]
  - - [2624, 2240, 1, 512, 2624, 2624, 2624, 512]
    - [2, 13.177]
  - - [2752, 2240, 1, 512, 2752, 2752, 2752, 512]
    - [2, 13.151]
  - - [2880, 2240, 1, 512, 2880, 2880, 2880, 512]
    - [2, 13.176]
  - - [3008, 2240, 1, 512, 3008, 3008, 3008, 512]
    - [2, 13.178]
  - - [3136, 2240, 1, 512, 3136, 3136, 3136, 512]
    - [2, 13.27]
  - - [3264, 2240, 1, 512, 3264, 3264, 3264, 512]
    - [2, 13.29]
  - - [3392, 2240, 1, 512, 3392, 3392, 3392, 512]
    - [2, 13.275]
  - - [3520, 2240, 1, 512, 3520, 3520, 3520, 512]
    - [2, 13.265]
  - - [3648, 2240, 1, 512, 3648, 3648, 3648, 512]
    - [2, 13.312]
  - - [3776, 2240, 1, 512, 3776, 3776, 3776, 512]
    - [2, 13.28]
  - - [3904, 2240, 1, 512, 3904, 3904, 3904, 512]
    - [2, 13.321]
  - - [4032, 2240, 1, 512, 4032, 4032, 4032, 512]
    - [2, 13.371]
  - - [64, 2368, 1, 512, 64, 64, 64, 512]
    - [2, 7.677]
  - - [192, 2368, 1, 512, 192, 192, 192, 512]
    - [2, 10.9]
  - - [320, 2368, 1, 512, 320, 320, 320, 512]
    - [0, 11.937]
  - - [448, 2368, 1, 512, 448, 448, 448, 512]
    - [2, 11.953]
  - - [576, 2368, 1, 512, 576, 576, 576, 512]
    - [0, 11.999]
  - - [704, 2368, 1, 512, 704, 704, 704, 512]
    - [2, 12.104]
  - - [832, 2368, 1, 512, 832, 832, 832, 512]
    - [2, 12.551]
  - - [960, 2368, 1, 512, 960, 960, 960, 512]
    - [2, 12.432]
  - - [1088, 2368, 1, 512, 1088, 1088, 1088, 512]
    - [2, 12.764]
  - - [1216, 2368, 1, 512, 1216, 1216, 1216, 512]
    - [2, 12.725]
  - - [1344, 2368, 1, 512, 1344, 1344, 1344, 512]
    - [2, 12.693]
  - - [1472, 2368, 1, 512, 1472, 1472, 1472, 512]
    - [2, 12.804]
  - - [1600, 2368, 1, 512, 1600, 1600, 1600, 512]
    - [2, 12.899]
  - - [1728, 2368, 1, 512, 1728, 1728, 1728, 512]
    - [2, 12.947]
  - - [1856, 2368, 1, 512, 1856, 1856, 1856, 512]
    - [2, 12.98]
  - - [1984, 2368, 1, 512, 1984, 1984, 1984, 512]
    - [2, 13.034]
  - - [2112, 2368, 1, 512, 2112, 2112, 2112, 512]
    - [2, 12.956]
  - - [2240, 2368, 1, 512, 2240, 2240, 2240, 512]
    - [2, 13.012]
  - - [2368, 2368, 1, 512, 2368, 2368, 2368, 512]
    - [2, 13.15]
  - - [2496, 2368, 1, 512, 2496, 2496, 2496, 512]
    - [2, 13.163]
  - - [2624, 2368, 1, 512, 2624, 2624, 2624, 512]
    - [2, 13.119]
  - - [2752, 2368, 1, 512, 2752, 2752, 2752, 512]
    - [2, 13.107]
  - - [2880, 2368, 1, 512, 2880, 2880, 2880, 512]
    - [2, 13.163]
  - - [3008, 2368, 1, 512, 3008, 3008, 3008, 512]
    - [2, 13.223]
  - - [3136, 2368, 1, 512, 3136, 3136, 3136, 512]
    - [2, 13.034]
  - - [3264, 2368, 1, 512, 3264, 3264, 3264, 512]
    - [2, 13.115]
  - - [3392, 2368, 1, 512, 3392, 3392, 3392, 512]
    - [2, 13.256]
  - - [3520, 2368, 1, 512, 3520, 3520, 3520, 512]
    - [2, 13.11]
  - - [3648, 2368, 1, 512, 3648, 3648, 3648, 512]
    - [2, 13.145]
  - - [3776, 2368, 1, 512, 3776, 3776, 3776, 512]
    - [2, 13.291]
  - - [3904, 2368, 1, 512, 3904, 3904, 3904, 512]
    - [2, 13.295]
  - - [4032, 2368, 1, 512, 4032, 4032, 4032, 512]
    - [2, 13.365]
  - - [64, 2496, 1, 512, 64, 64, 64, 512]
    - [2, 7.904]
  - - [192, 2496, 1, 512, 192, 192, 192, 512]
    - [0, 10.938]
  - - [320, 2496, 1, 512, 320, 320, 320, 512]
    - [2, 11.704]
  - - [448, 2496, 1, 512, 448, 448, 448, 512]
    - [2, 11.914]
  - - [576, 2496, 1, 512, 576, 576, 576, 512]
    - [2, 11.979]
  - - [704, 2496, 1, 512, 704, 704, 704, 512]
    - [2, 12.243]
  - - [832, 2496, 1, 512, 832, 832, 832, 512]
    - [2, 12.435]
  - - [960, 2496, 1, 512, 960, 960, 960, 512]
    - [2, 12.618]
  - - [1088, 2496, 1, 512, 1088, 1088, 1088, 512]
    - [2, 12.589]
  - - [1216, 2496, 1, 512, 1216, 1216, 1216, 512]
    - [2, 13.01]
  - - [1344, 2496, 1, 512, 1344, 1344, 1344, 512]
    - [2, 12.884]
  - - [1472, 2496, 1, 512, 1472, 1472, 1472, 512]
    - [2, 12.815]
  - - [1600, 2496, 1, 512, 1600, 1600, 1600, 512]
    - [2, 12.743]
  - - [1728, 2496, 1, 512, 1728, 1728, 1728, 512]
    - [2, 12.916]
  - - [1856, 2496, 1, 512, 1856, 1856, 1856, 512]
    - [2, 12.861]
  - - [1984, 2496, 1, 512, 1984, 1984, 1984, 512]
    - [2, 12.829]
  - - [2112, 2496, 1, 512, 2112, 2112, 2112, 512]
    - [2, 12.974]
  - - [2240, 2496, 1, 512, 2240, 2240, 2240, 512]
    - [2, 13.01]
  - - [2368, 2496, 1, 512, 2368, 2368, 2368, 512]
    - [2, 12.937]
  - - [2496, 2496, 1, 512, 2496, 2496, 2496, 512]
    - [2, 13.199]
  - - [2624, 2496, 1, 512, 2624, 2624, 2624, 512]
    - [2, 13.159]
  - - [2752, 2496, 1, 512, 2752, 2752, 2752, 512]
    - [2, 13.182]
  - - [2880, 2496, 1, 512, 2880, 2880, 2880, 512]
    - [2, 13.211]
  - - [3008, 2496, 1, 512, 3008, 3008, 3008, 512]
    - [2, 13.254]
  - - [3136, 2496, 1, 512, 3136, 3136, 3136, 512]
    - [2, 13.229]
  - - [3264, 2496, 1, 512, 3264, 3264, 3264, 512]
    - [2, 13.262]
  - - [3392, 2496, 1, 512, 3392, 3392, 3392, 512]
    - [2, 13.319]
  - - [3520, 2496, 1, 512, 3520, 3520, 3520, 512]
    - [2, 13.325]
  - - [3648, 2496, 1, 512, 3648, 3648, 3648, 512]
    - [2, 13.291]
  - - [3776, 2496, 1, 512, 3776, 3776, 3776, 512]
    - [2, 13.357]
  - - [3904, 2496, 1, 512, 3904, 3904, 3904, 512]
    - [2, 13.329]
  - - [4032, 2496, 1, 512, 4032, 4032, 4032, 512]
    - [2, 13.439]
  - - [64, 2624, 1, 512, 64, 64, 64, 512]
    - [2, 8.388]
  - - [192, 2624, 1, 512, 192, 192, 192, 512]
    - [2, 11.163]
  - - [320, 2624, 1, 512, 320, 320, 320, 512]
    - [2, 11.838]
  - - [448, 2624, 1, 512, 448, 448, 448, 512]
    - [0, 12.032]
  - - [576, 2624, 1, 512, 576, 576, 576, 512]
    - [2, 12.208]
  - - [704, 2624, 1, 512, 704, 704, 704, 512]
    - [2, 12.442]
  - - [832, 2624, 1, 512, 832, 832, 832, 512]
    - [2, 12.594]
  - - [960, 2624, 1, 512, 960, 960, 960, 512]
    - [2, 12.653]
  - - [1088, 2624, 1, 512, 1088, 1088, 1088, 512]
    - [2, 12.776]
  - - [1216, 2624, 1, 512, 1216, 1216, 1216, 512]
    - [2, 12.789]
  - - [1344, 2624, 1, 512, 1344, 1344, 1344, 512]
    - [2, 12.881]
  - - [1472, 2624, 1, 512, 1472, 1472, 1472, 512]
    - [2, 12.892]
  - - [1600, 2624, 1, 512, 1600, 1600, 1600, 512]
    - [2, 12.797]
  - - [1728, 2624, 1, 512, 1728, 1728, 1728, 512]
    - [2, 12.768]
  - - [1856, 2624, 1, 512, 1856, 1856, 1856, 512]
    - [2, 12.756]
  - - [1984, 2624, 1, 512, 1984, 1984, 1984, 512]
    - [2, 12.873]
  - - [2112, 2624, 1, 512, 2112, 2112, 2112, 512]
    - [2, 13.021]
  - - [2240, 2624, 1, 512, 2240, 2240, 2240, 512]
    - [2, 12.966]
  - - [2368, 2624, 1, 512, 2368, 2368, 2368, 512]
    - [2, 12.992]
  - - [2496, 2624, 1, 512, 2496, 2496, 2496, 512]
    - [2, 13.096]
  - - [2624, 2624, 1, 512, 2624, 2624, 2624, 512]
    - [2, 13.038]
  - - [2752, 2624, 1, 512, 2752, 2752, 2752, 512]
    - [2, 12.988]
  - - [2880, 2624, 1, 512, 2880, 2880, 2880, 512]
    - [2, 13.128]
  - - [3008, 2624, 1, 512, 3008, 3008, 3008, 512]
    - [2, 13.042]
  - - [3136, 2624, 1, 512, 3136, 3136, 3136, 512]
    - [2, 13.135]
  - - [3264, 2624, 1, 512, 3264, 3264, 3264, 512]
    - [2, 13.068]
  - - [3392, 2624, 1, 512, 3392, 3392, 3392, 512]
    - [2, 13.169]
  - - [3520, 2624, 1, 512, 3520, 3520, 3520, 512]
    - [2, 13.136]
  - - [3648, 2624, 1, 512, 3648, 3648, 3648, 512]
    - [2, 13.211]
  - - [3776, 2624, 1, 512, 3776, 3776, 3776, 512]
    - [2, 13.205]
  - - [3904, 2624, 1, 512, 3904, 3904, 3904, 512]
    - [2, 13.222]
  - - [4032, 2624, 1, 512, 4032, 4032, 4032, 512]
    - [2, 13.238]
  - - [64, 2752, 1, 512, 64, 64, 64, 512]
    - [0, 8.312]
  - - [192, 2752, 1, 512, 192, 192, 192, 512]
    - [2, 11.346]
  - - [320, 2752, 1, 512, 320, 320, 320, 512]
    - [2, 11.961]
  - - [448, 2752, 1, 512, 448, 448, 448, 512]
    - [2, 11.977]
  - - [576, 2752, 1, 512, 576, 576, 576, 512]
    - [2, 12.085]
  - - [704, 2752, 1, 512, 704, 704, 704, 512]
    - [2, 12.141]
  - - [832, 2752, 1, 512, 832, 832, 832, 512]
    - [2, 12.609]
  - - [960, 2752, 1, 512, 960, 960, 960, 512]
    - [2, 12.781]
  - - [1088, 2752, 1, 512, 1088, 1088, 1088, 512]
    - [2, 12.683]
  - - [1216, 2752, 1, 512, 1216, 1216, 1216, 512]
    - [2, 12.763]
  - - [1344, 2752, 1, 512, 1344, 1344, 1344, 512]
    - [2, 12.842]
  - - [1472, 2752, 1, 512, 1472, 1472, 1472, 512]
    - [2, 12.714]
  - - [1600, 2752, 1, 512, 1600, 1600, 1600, 512]
    - [0, 12.84]
  - - [1728, 2752, 1, 512, 1728, 1728, 1728, 512]
    - [2, 12.981]
  - - [1856, 2752, 1, 512, 1856, 1856, 1856, 512]
    - [2, 12.416]
  - - [1984, 2752, 1, 512, 1984, 1984, 1984, 512]
    - [2, 13.052]
  - - [2112, 2752, 1, 512, 2112, 2112, 2112, 512]
    - [2, 13.056]
  - - [2240, 2752, 1, 512, 2240, 2240, 2240, 512]
    - [2, 12.989]
  - - [2368, 2752, 1, 512, 2368, 2368, 2368, 512]
    - [2, 12.978]
  - - [2496, 2752, 1, 512, 2496, 2496, 2496, 512]
    - [2, 12.999]
  - - [2624, 2752, 1, 512, 2624, 2624, 2624, 512]
    - [2, 13.141]
  - - [2752, 2752, 1, 512, 2752, 2752, 2752, 512]
    - [2, 13.216]
  - - [2880, 2752, 1, 512, 2880, 2880, 2880, 512]
    - [2, 13.09]
  - - [3008, 2752, 1, 512, 3008, 3008, 3008, 512]
    - [2, 13.081]
  - - [3136, 2752, 1, 512, 3136, 3136, 3136, 512]
    - [2, 13.29]
  - - [3264, 2752, 1, 512, 3264, 3264, 3264, 512]
    - [2, 13.357]
  - - [3392, 2752, 1, 512, 3392, 3392, 3392, 512]
    - [2, 13.206]
  - - [3520, 2752, 1, 512, 3520, 3520, 3520, 512]
    - [2, 13.208]
  - - [3648, 2752, 1, 512, 3648, 3648, 3648, 512]
    - [2, 13.446]
  - - [3776, 2752, 1, 512, 3776, 3776, 3776, 512]
    - [2, 13.206]
  - - [3904, 2752, 1, 512, 3904, 3904, 3904, 512]
    - [2, 13.256]
  - - [4032, 2752, 1, 512, 4032, 4032, 4032, 512]
    - [2, 13.229]
  - - [64, 2880, 1, 512, 64, 64, 64, 512]
    - [0, 8.695]
  - - [192, 2880, 1, 512, 192, 192, 192, 512]
    - [2, 11.307]
  - - [320, 2880, 1, 512, 320, 320, 320, 512]
    - [2, 12.115]
  - - [448, 2880, 1, 512, 448, 448, 448, 512]
    - [2, 11.897]
  - - [576, 2880, 1, 512, 576, 576, 576, 512]
    - [2, 12.019]
  - - [704, 2880, 1, 512, 704, 704, 704, 512]
    - [2, 12.252]
  - - [832, 2880, 1, 512, 832, 832, 832, 512]
    - [2, 12.446]
  - - [960, 2880, 1, 512, 960, 960, 960, 512]
    - [2, 12.591]
  - - [1088, 2880, 1, 512, 1088, 1088, 1088, 512]
    - [2, 12.558]
  - - [1216, 2880, 1, 512, 1216, 1216, 1216, 512]
    - [2, 12.688]
  - - [1344, 2880, 1, 512, 1344, 1344, 1344, 512]
    - [2, 12.684]
  - - [1472, 2880, 1, 512, 1472, 1472, 1472, 512]
    - [2, 12.877]
  - - [1600, 2880, 1, 512, 1600, 1600, 1600, 512]
    - [2, 12.846]
  - - [1728, 2880, 1, 512, 1728, 1728, 1728, 512]
    - [2, 12.796]
  - - [1856, 2880, 1, 512, 1856, 1856, 1856, 512]
    - [2, 12.823]
  - - [1984, 2880, 1, 512, 1984, 1984, 1984, 512]
    - [2, 12.925]
  - - [2112, 2880, 1, 512, 2112, 2112, 2112, 512]
    - [2, 12.968]
  - - [2240, 2880, 1, 512, 2240, 2240, 2240, 512]
    - [2, 13.033]
  - - [2368, 2880, 1, 512, 2368, 2368, 2368, 512]
    - [2, 13.16]
  - - [2496, 2880, 1, 512, 2496, 2496, 2496, 512]
    - [2, 13.151]
  - - [2624, 2880, 1, 512, 2624, 2624, 2624, 512]
    - [2, 13.167]
  - - [2752, 2880, 1, 512, 2752, 2752, 2752, 512]
    - [2, 13.316]
  - - [2880, 2880, 1, 512, 2880, 2880, 2880, 512]
    - [2, 13.246]
  - - [3008, 2880, 1, 512, 3008, 3008, 3008, 512]
    - [2, 13.052]
  - - [3136, 2880, 1, 512, 3136, 3136, 3136, 512]
    - [2, 13.141]
  - - [3264, 2880, 1, 512, 3264, 3264, 3264, 512]
    - [2, 13.133]
  - - [3392, 2880, 1, 512, 3392, 3392, 3392, 512]
    - [2, 13.211]
  - - [3520, 2880, 1, 512, 3520, 3520, 3520, 512]
    - [2, 13.215]
  - - [3648, 2880, 1, 512, 3648, 3648, 3648, 512]
    - [2, 13.423]
  - - [3776, 2880, 1, 512, 3776, 3776, 3776, 512]
    - [2, 13.452]
  - - [3904, 2880, 1, 512, 3904, 3904, 3904, 512]
    - [2, 13.199]
  - - [4032, 2880, 1, 512, 4032, 4032, 4032, 512]
    - [2, 13.312]
  - - [64, 3008, 1, 512, 64, 64, 64, 512]
    - [0, 9.047]
  - - [192, 3008, 1, 512, 192, 192, 192, 512]
    - [2, 11.399]
  - - [320, 3008, 1, 512, 320, 320, 320, 512]
    - [2, 12.105]
  - - [448, 3008, 1, 512, 448, 448, 448, 512]
    - [2, 12.179]
  - - [576, 3008, 1, 512, 576, 576, 576, 512]
    - [2, 12.401]
  - - [704, 3008, 1, 512, 704, 704, 704, 512]
    - [2, 12.378]
  - - [832, 3008, 1, 512, 832, 832, 832, 512]
    - [2, 12.484]
  - - [960, 3008, 1, 512, 960, 960, 960, 512]
    - [2, 12.539]
  - - [1088, 3008, 1, 512, 1088, 1088, 1088, 512]
    - [2, 12.845]
  - - [1216, 3008, 1, 512, 1216, 1216, 1216, 512]
    - [2, 12.814]
  - - [1344, 3008, 1, 512, 1344, 1344, 1344, 512]
    - [2, 12.764]
  - - [1472, 3008, 1, 512, 1472, 1472, 1472, 512]
    - [2, 12.742]
  - - [1600, 3008, 1, 512, 1600, 1600, 1600, 512]
    - [2, 12.957]
  - - [1728, 3008, 1, 512, 1728, 1728, 1728, 512]
    - [2, 13.001]
  - - [1856, 3008, 1, 512, 1856, 1856, 1856, 512]
    - [2, 13.051]
  - - [1984, 3008, 1, 512, 1984, 1984, 1984, 512]
    - [2, 12.994]
  - - [2112, 3008, 1, 512, 2112, 2112, 2112, 512]
    - [2, 13.053]
  - - [2240, 3008, 1, 512, 2240, 2240, 2240, 512]
    - [2, 12.984]
  - - [2368, 3008, 1, 512, 2368, 2368, 2368, 512]
    - [2, 13.065]
  - - [2496, 3008, 1, 512, 2496, 2496, 2496, 512]
    - [2, 12.973]
  - - [2624, 3008, 1, 512, 2624, 2624, 2624, 512]
    - [2, 13.03]
  - - [2752, 3008, 1, 512, 2752, 2752, 2752, 512]
    - [2, 13.248]
  - - [2880, 3008, 1, 512, 2880, 2880, 2880, 512]
    - [2, 13.204]
  - - [3008, 3008, 1, 512, 3008, 3008, 3008, 512]
    - [2, 13.364]
  - - [3136, 3008, 1, 512, 3136, 3136, 3136, 512]
    - [2, 13.342]
  - - [3264, 3008, 1, 512, 3264, 3264, 3264, 512]
    - [2, 13.407]
  - - [3392, 3008, 1, 512, 3392, 3392, 3392, 512]
    - [2, 13.216]
  - - [3520, 3008, 1, 512, 3520, 3520, 3520, 512]
    - [2, 13.253]
  - - [3648, 3008, 1, 512, 3648, 3648, 3648, 512]
    - [2, 13.25]
  - - [3776, 3008, 1, 512, 3776, 3776, 3776, 512]
    - [2, 13.25]
  - - [3904, 3008, 1, 512, 3904, 3904, 3904, 512]
    - [2, 13.318]
  - - [4032, 3008, 1, 512, 4032, 4032, 4032, 512]
    - [2, 13.292]
  - - [64, 3136, 1, 512, 64, 64, 64, 512]
    - [2, 8.502]
  - - [192, 3136, 1, 512, 192, 192, 192, 512]
    - [2, 11.535]
  - - [320, 3136, 1, 512, 320, 320, 320, 512]
    - [2, 12.328]
  - - [448, 3136, 1, 512, 448, 448, 448, 512]
    - [2, 12.247]
  - - [576, 3136, 1, 512, 576, 576, 576, 512]
    - [2, 12.061]
  - - [704, 3136, 1, 512, 704, 704, 704, 512]
    - [2, 12.518]
  - - [832, 3136, 1, 512, 832, 832, 832, 512]
    - [2, 12.591]
  - - [960, 3136, 1, 512, 960, 960, 960, 512]
    - [2, 12.613]
  - - [1088, 3136, 1, 512, 1088, 1088, 1088, 512]
    - [2, 12.84]
  - - [1216, 3136, 1, 512, 1216, 1216, 1216, 512]
    - [2, 12.802]
  - - [1344, 3136, 1, 512, 1344, 1344, 1344, 512]
    - [2, 12.787]
  - - [1472, 3136, 1, 512, 1472, 1472, 1472, 512]
    - [2, 12.862]
  - - [1600, 3136, 1, 512, 1600, 1600, 1600, 512]
    - [2, 12.83]
  - - [1728, 3136, 1, 512, 1728, 1728, 1728, 512]
    - [2, 13.015]
  - - [1856, 3136, 1, 512, 1856, 1856, 1856, 512]
    - [2, 13.049]
  - - [1984, 3136, 1, 512, 1984, 1984, 1984, 512]
    - [2, 13.115]
  - - [2112, 3136, 1, 512, 2112, 2112, 2112, 512]
    - [2, 13.007]
  - - [2240, 3136, 1, 512, 2240, 2240, 2240, 512]
    - [2, 12.929]
  - - [2368, 3136, 1, 512, 2368, 2368, 2368, 512]
    - [2, 13.042]
  - - [2496, 3136, 1, 512, 2496, 2496, 2496, 512]
    - [2, 13.266]
  - - [2624, 3136, 1, 512, 2624, 2624, 2624, 512]
    - [2, 13.088]
  - - [2752, 3136, 1, 512, 2752, 2752, 2752, 512]
    - [2, 13.06]
  - - [2880, 3136, 1, 512, 2880, 2880, 2880, 512]
    - [2, 13.307]
  - - [3008, 3136, 1, 512, 3008, 3008, 3008, 512]
    - [2, 13.153]
  - - [3136, 3136, 1, 512, 3136, 3136, 3136, 512]
    - [2, 13.235]
  - - [3264, 3136, 1, 512, 3264, 3264, 3264, 512]
    - [2, 13.264]
  - - [3392, 3136, 1, 512, 3392, 3392, 3392, 512]
    - [2, 13.431]
  - - [3520, 3136, 1, 512, 3520, 3520, 3520, 512]
    - [2, 13.272]
  - - [3648, 3136, 1, 512, 3648, 3648, 3648, 512]
    - [2, 13.227]
  - - [3776, 3136, 1, 512, 3776, 3776, 3776, 512]
    - [2, 13.288]
  - - [3904, 3136, 1, 512, 3904, 3904, 3904, 512]
    - [2, 13.303]
  - - [4032, 3136, 1, 512, 4032, 4032, 4032, 512]
    - [2, 13.263]
  - - [64, 3264, 1, 512, 64, 64, 64, 512]
    - [2, 8.677]
  - - [192, 3264, 1, 512, 192, 192, 192, 512]
    - [2, 11.521]
  - - [320, 3264, 1, 512, 320, 320, 320, 512]
    - [2, 11.894]
  - - [448, 3264, 1, 512, 448, 448, 448, 512]
    - [2, 12.026]
  - - [576, 3264, 1, 512, 576, 576, 576, 512]
    - [2, 12.297]
  - - [704, 3264, 1, 512, 704, 704, 704, 512]
    - [2, 12.343]
  - - [832, 3264, 1, 512, 832, 832, 832, 512]
    - [2, 12.677]
  - - [960, 3264, 1, 512, 960, 960, 960, 512]
    - [2, 12.766]
  - - [1088, 3264, 1, 512, 1088, 1088, 1088, 512]
    - [2, 12.644]
  - - [1216, 3264, 1, 512, 1216, 1216, 1216, 512]
    - [2, 12.879]
  - - [1344, 3264, 1, 512, 1344, 1344, 1344, 512]
    - [2, 12.826]
  - - [1472, 3264, 1, 512, 1472, 1472, 1472, 512]
    - [2, 12.929]
  - - [1600, 3264, 1, 512, 1600, 1600, 1600, 512]
    - [2, 12.833]
  - - [1728, 3264, 1, 512, 1728, 1728, 1728, 512]
    - [2, 13.136]
  - - [1856, 3264, 1, 512, 1856, 1856, 1856, 512]
    - [2, 12.996]
  - - [1984, 3264, 1, 512, 1984, 1984, 1984, 512]
    - [2, 12.938]
  - - [2112, 3264, 1, 512, 2112, 2112, 2112, 512]
    - [2, 13.031]
  - - [2240, 3264, 1, 512, 2240, 2240, 2240, 512]
    - [2, 13.148]
  - - [2368, 3264, 1, 512, 2368, 2368, 2368, 512]
    - [2, 13.168]
  - - [2496, 3264, 1, 512, 2496, 2496, 2496, 512]
    - [2, 13.16]
  - - [2624, 3264, 1, 512, 2624, 2624, 2624, 512]
    - [2, 13.121]
  - - [2752, 3264, 1, 512, 2752, 2752, 2752, 512]
    - [2, 13.115]
  - - [2880, 3264, 1, 512, 2880, 2880, 2880, 512]
    - [2, 13.164]
  - - [3008, 3264, 1, 512, 3008, 3008, 3008, 512]
    - [2, 13.199]
  - - [3136, 3264, 1, 512, 3136, 3136, 3136, 512]
    - [2, 13.168]
  - - [3264, 3264, 1, 512, 3264, 3264, 3264, 512]
    - [2, 13.242]
  - - [3392, 3264, 1, 512, 3392, 3392, 3392, 512]
    - [2, 13.249]
  - - [3520, 3264, 1, 512, 3520, 3520, 3520, 512]
    - [2, 13.479]
  - - [3648, 3264, 1, 512, 3648, 3648, 3648, 512]
    - [2, 13.258]
  - - [3776, 3264, 1, 512, 3776, 3776, 3776, 512]
    - [2, 13.287]
  - - [3904, 3264, 1, 512, 3904, 3904, 3904, 512]
    - [2, 13.343]
  - - [4032, 3264, 1, 512, 4032, 4032, 4032, 512]
    - [2, 13.329]
  - - [64, 3392, 1, 512, 64, 64, 64, 512]
    - [2, 8.881]
  - - [192, 3392, 1, 512, 192, 192, 192, 512]
    - [2, 11.559]
  - - [320, 3392, 1, 512, 320, 320, 320, 512]
    - [2, 12.068]
  - - [448, 3392, 1, 512, 448, 448, 448, 512]
    - [2, 12.272]
  - - [576, 3392, 1, 512, 576, 576, 576, 512]
    - [2, 12.425]
  - - [704, 3392, 1, 512, 704, 704, 704, 512]
    - [2, 12.539]
  - - [832, 3392, 1, 512, 832, 832, 832, 512]
    - [2, 12.693]
  - - [960, 3392, 1, 512, 960, 960, 960, 512]
    - [2, 12.777]
  - - [1088, 3392, 1, 512, 1088, 1088, 1088, 512]
    - [2, 12.99]
  - - [1216, 3392, 1, 512, 1216, 1216, 1216, 512]
    - [2, 12.703]
  - - [1344, 3392, 1, 512, 1344, 1344, 1344, 512]
    - [2, 12.97]
  - - [1472, 3392, 1, 512, 1472, 1472, 1472, 512]
    - [2, 12.903]
  - - [1600, 3392, 1, 512, 1600, 1600, 1600, 512]
    - [2, 12.986]
  - - [1728, 3392, 1, 512, 1728, 1728, 1728, 512]
    - [2, 13.057]
  - - [1856, 3392, 1, 512, 1856, 1856, 1856, 512]
    - [2, 12.955]
  - - [1984, 3392, 1, 512, 1984, 1984, 1984, 512]
    - [2, 13.047]
  - - [2112, 3392, 1, 512, 2112, 2112, 2112, 512]
    - [2, 13.118]
  - - [2240, 3392, 1, 512, 2240, 2240, 2240, 512]
    - [2, 12.991]
  - - [2368, 3392, 1, 512, 2368, 2368, 2368, 512]
    - [2, 13.1]
  - - [2496, 3392, 1, 512, 2496, 2496, 2496, 512]
    - [2, 13.259]
  - - [2624, 3392, 1, 512, 2624, 2624, 2624, 512]
    - [2, 13.173]
  - - [2752, 3392, 1, 512, 2752, 2752, 2752, 512]
    - [2, 13.186]
  - - [2880, 3392, 1, 512, 2880, 2880, 2880, 512]
    - [2, 13.106]
  - - [3008, 3392, 1, 512, 3008, 3008, 3008, 512]
    - [2, 13.286]
  - - [3136, 3392, 1, 512, 3136, 3136, 3136, 512]
    - [2, 13.22]
  - - [3264, 3392, 1, 512, 3264, 3264, 3264, 512]
    - [2, 13.271]
  - - [3392, 3392, 1, 512, 3392, 3392, 3392, 512]
    - [2, 13.482]
  - - [3520, 3392, 1, 512, 3520, 3520, 3520, 512]
    - [2, 13.528]
  - - [3648, 3392, 1, 512, 3648, 3648, 3648, 512]
    - [2, 13.329]
  - - [3776, 3392, 1, 512, 3776, 3776, 3776, 512]
    - [2, 13.311]
  - - [3904, 3392, 1, 512, 3904, 3904, 3904, 512]
    - [2, 13.342]
  - - [4032, 3392, 1, 512, 4032, 4032, 4032, 512]
    - [2, 13.359]
  - - [64, 3520, 1, 512, 64, 64, 64, 512]
    - [2, 9.298]
  - - [192, 3520, 1, 512, 192, 192, 192, 512]
    - [2, 12.021]
  - - [320, 3520, 1, 512, 320, 320, 320, 512]
    - [2, 12.114]
  - - [448, 3520, 1, 512, 448, 448, 448, 512]
    - [2, 11.938]
  - - [576, 3520, 1, 512, 576, 576, 576, 512]
    - [2, 12.27]
  - - [704, 3520, 1, 512, 704, 704, 704, 512]
    - [2, 12.335]
  - - [832, 3520, 1, 512, 832, 832, 832, 512]
    - [2, 12.606]
  - - [960, 3520, 1, 512, 960, 960, 960, 512]
    - [2, 12.548]
  - - [1088, 3520, 1, 512, 1088, 1088, 1088, 512]
    - [2, 12.749]
  - - [1216, 3520, 1, 512, 1216, 1216, 1216, 512]
    - [2, 12.81]
  - - [1344, 3520, 1, 512, 1344, 1344, 1344, 512]
    - [2, 12.996]
  - - [1472, 3520, 1, 512, 1472, 1472, 1472, 512]
    - [2, 12.924]
  - - [1600, 3520, 1, 512, 1600, 1600, 1600, 512]
    - [2, 12.972]
  - - [1728, 3520, 1, 512, 1728, 1728, 1728, 512]
    - [2, 12.969]
  - - [1856, 3520, 1, 512, 1856, 1856, 1856, 512]
    - [2, 13.117]
  - - [1984, 3520, 1, 512, 1984, 1984, 1984, 512]
    - [2, 13.081]
  - - [2112, 3520, 1, 512, 2112, 2112, 2112, 512]
    - [2, 13.057]
  - - [2240, 3520, 1, 512, 2240, 2240, 2240, 512]
    - [2, 13.1]
  - - [2368, 3520, 1, 512, 2368, 2368, 2368, 512]
    - [2, 13.153]
  - - [2496, 3520, 1, 512, 2496, 2496, 2496, 512]
    - [2, 13.143]
  - - [2624, 3520, 1, 512, 2624, 2624, 2624, 512]
    - [2, 13.142]
  - - [2752, 3520, 1, 512, 2752, 2752, 2752, 512]
    - [2, 13.092]
  - - [2880, 3520, 1, 512, 2880, 2880, 2880, 512]
    - [2, 13.187]
  - - [3008, 3520, 1, 512, 3008, 3008, 3008, 512]
    - [2, 13.117]
  - - [3136, 3520, 1, 512, 3136, 3136, 3136, 512]
    - [2, 13.246]
  - - [3264, 3520, 1, 512, 3264, 3264, 3264, 512]
    - [2, 13.341]
  - - [3392, 3520, 1, 512, 3392, 3392, 3392, 512]
    - [2, 13.248]
  - - [3520, 3520, 1, 512, 3520, 3520, 3520, 512]
    - [2, 13.338]
  - - [3648, 3520, 1, 512, 3648, 3648, 3648, 512]
    - [2, 13.358]
  - - [3776, 3520, 1, 512, 3776, 3776, 3776, 512]
    - [0, 12.821]
  - - [3904, 3520, 1, 512, 3904, 3904, 3904, 512]
    - [2, 13.358]
  - - [4032, 3520, 1, 512, 4032, 4032, 4032, 512]
    - [2, 13.429]
  - - [64, 3648, 1, 512, 64, 64, 64, 512]
    - [0, 9.388]
  - - [192, 3648, 1, 512, 192, 192, 192, 512]
    - [2, 12.019]
  - - [320, 3648, 1, 512, 320, 320, 320, 512]
    - [2, 12.402]
  - - [448, 3648, 1, 512, 448, 448, 448, 512]
    - [2, 12.156]
  - - [576, 3648, 1, 512, 576, 576, 576, 512]
    - [2, 12.353]
  - - [704, 3648, 1, 512, 704, 704, 704, 512]
    - [2, 12.544]
  - - [832, 3648, 1, 512, 832, 832, 832, 512]
    - [0, 12.404]
  - - [960, 3648, 1, 512, 960, 960, 960, 512]
    - [2, 12.782]
  - - [1088, 3648, 1, 512, 1088, 1088, 1088, 512]
    - [2, 12.906]
  - - [1216, 3648, 1, 512, 1216, 1216, 1216, 512]
    - [2, 12.897]
  - - [1344, 3648, 1, 512, 1344, 1344, 1344, 512]
    - [2, 12.893]
  - - [1472, 3648, 1, 512, 1472, 1472, 1472, 512]
    - [2, 13.016]
  - - [1600, 3648, 1, 512, 1600, 1600, 1600, 512]
    - [2, 12.849]
  - - [1728, 3648, 1, 512, 1728, 1728, 1728, 512]
    - [2, 13.165]
  - - [1856, 3648, 1, 512, 1856, 1856, 1856, 512]
    - [2, 13.074]
  - - [1984, 3648, 1, 512, 1984, 1984, 1984, 512]
    - [2, 13.07]
  - - [2112, 3648, 1, 512, 2112, 2112, 2112, 512]
    - [2, 12.939]
  - - [2240, 3648, 1, 512, 2240, 2240, 2240, 512]
    - [2, 13.164]
  - - [2368, 3648, 1, 512, 2368, 2368, 2368, 512]
    - [2, 13.194]
  - - [2496, 3648, 1, 512, 2496, 2496, 2496, 512]
    - [2, 13.102]
  - - [2624, 3648, 1, 512, 2624, 2624, 2624, 512]
    - [2, 13.187]
  - - [2752, 3648, 1, 512, 2752, 2752, 2752, 512]
    - [2, 13.385]
  - - [2880, 3648, 1, 512, 2880, 2880, 2880, 512]
    - [2, 13.402]
  - - [3008, 3648, 1, 512, 3008, 3008, 3008, 512]
    - [2, 13.295]
  - - [3136, 3648, 1, 512, 3136, 3136, 3136, 512]
    - [2, 13.249]
  - - [3264, 3648, 1, 512, 3264, 3264, 3264, 512]
    - [2, 13.288]
  - - [3392, 3648, 1, 512, 3392, 3392, 3392, 512]
    - [2, 13.351]
  - - [3520, 3648, 1, 512, 3520, 3520, 3520, 512]
    - [2, 13.36]
  - - [3648, 3648, 1, 512, 3648, 3648, 3648, 512]
    - [2, 13.387]
  - - [3776, 3648, 1, 512, 3776, 3776, 3776, 512]
    - [2, 13.384]
  - - [3904, 3648, 1, 512, 3904, 3904, 3904, 512]
    - [2, 13.338]
  - - [4032, 3648, 1, 512, 4032, 4032, 4032, 512]
    - [2, 13.371]
  - - [64, 3776, 1, 512, 64, 64, 64, 512]
    - [0, 9.718]
  - - [192, 3776, 1, 512, 192, 192, 192, 512]
    - [2, 11.944]
  - - [320, 3776, 1, 512, 320, 320, 320, 512]
    - [2, 12.28]
  - - [448, 3776, 1, 512, 448, 448, 448, 512]
    - [2, 12.345]
  - - [576, 3776, 1, 512, 576, 576, 576, 512]
    - [2, 12.37]
  - - [704, 3776, 1, 512, 704, 704, 704, 512]
    - [2, 12.447]
  - - [832, 3776, 1, 512, 832, 832, 832, 512]
    - [2, 12.703]
  - - [960, 3776, 1, 512, 960, 960, 960, 512]
    - [2, 12.566]
  - - [1088, 3776, 1, 512, 1088, 1088, 1088, 512]
    - [2, 12.807]
  - - [1216, 3776, 1, 512, 1216, 1216, 1216, 512]
    - [2, 12.83]
  - - [1344, 3776, 1, 512, 1344, 1344, 1344, 512]
    - [2, 12.995]
  - - [1472, 3776, 1, 512, 1472, 1472, 1472, 512]
    - [2, 13.189]
  - - [1600, 3776, 1, 512, 1600, 1600, 1600, 512]
    - [2, 13.121]
  - - [1728, 3776, 1, 512, 1728, 1728, 1728, 512]
    - [2, 13.061]
  - - [1856, 3776, 1, 512, 1856, 1856, 1856, 512]
    - [2, 13.102]
  - - [1984, 3776, 1, 512, 1984, 1984, 1984, 512]
    - [2, 13.077]
  - - [2112, 3776, 1, 512, 2112, 2112, 2112, 512]
    - [2, 13.144]
  - - [2240, 3776, 1, 512, 2240, 2240, 2240, 512]
    - [2, 13.157]
  - - [2368, 3776, 1, 512, 2368, 2368, 2368, 512]
    - [2, 13.148]
  - - [2496, 3776, 1, 512, 2496, 2496, 2496, 512]
    - [2, 13.215]
  - - [2624, 3776, 1, 512, 2624, 2624, 2624, 512]
    - [2, 13.258]
  - - [2752, 3776, 1, 512, 2752, 2752, 2752, 512]
    - [2, 13.268]
  - - [2880, 3776, 1, 512, 2880, 2880, 2880, 512]
    - [2, 13.196]
  - - [3008, 3776, 1, 512, 3008, 3008, 3008, 512]
    - [2, 13.249]
  - - [3136, 3776, 1, 512, 3136, 3136, 3136, 512]
    - [2, 13.31]
  - - [3264, 3776, 1, 512, 3264, 3264, 3264, 512]
    - [2, 13.307]
  - - [3392, 3776, 1, 512, 3392, 3392, 3392, 512]
    - [2, 13.374]
  - - [3520, 3776, 1, 512, 3520, 3520, 3520, 512]
    - [2, 13.376]
  - - [3648, 3776, 1, 512, 3648, 3648, 3648, 512]
    - [2, 13.405]
  - - [3776, 3776, 1, 512, 3776, 3776, 3776, 512]
    - [2, 13.425]
  - - [3904, 3776, 1, 512, 3904, 3904, 3904, 512]
    - [2, 13.395]
  - - [4032, 3776, 1, 512, 4032, 4032, 4032, 512]
    - [2, 13.385]
  - - [64, 3904, 1, 512, 64, 64, 64, 512]
    - [2, 9.253]
  - - [192, 3904, 1, 512, 192, 192, 192, 512]
    - [2, 11.716]
  - - [320, 3904, 1, 512, 320, 320, 320, 512]
    - [2, 11.93]
  - - [448, 3904, 1, 512, 448, 448, 448, 512]
    - [2, 12.275]
  - - [576, 3904, 1, 512, 576, 576, 576, 512]
    - [2, 12.569]
  - - [704, 3904, 1, 512, 704, 704, 704, 512]
    - [2, 12.779]
  - - [832, 3904, 1, 512, 832, 832, 832, 512]
    - [2, 12.802]
  - - [960, 3904, 1, 512, 960, 960, 960, 512]
    - [2, 12.896]
  - - [1088, 3904, 1, 512, 1088, 1088, 1088, 512]
    - [2, 12.761]
  - - [1216, 3904, 1, 512, 1216, 1216, 1216, 512]
    - [2, 12.962]
  - - [1344, 3904, 1, 512, 1344, 1344, 1344, 512]
    - [2, 12.978]
  - - [1472, 3904, 1, 512, 1472, 1472, 1472, 512]
    - [2, 13.05]
  - - [1600, 3904, 1, 512, 1600, 1600, 1600, 512]
    - [2, 13.119]
  - - [1728, 3904, 1, 512, 1728, 1728, 1728, 512]
    - [2, 12.969]
  - - [1856, 3904, 1, 512, 1856, 1856, 1856, 512]
    - [2, 13.011]
  - - [1984, 3904, 1, 512, 1984, 1984, 1984, 512]
    - [2, 13.031]
  - - [2112, 3904, 1, 512, 2112, 2112, 2112, 512]
    - [2, 13.115]
  - - [2240, 3904, 1, 512, 2240, 2240, 2240, 512]
    - [2, 13.222]
  - - [2368, 3904, 1, 512, 2368, 2368, 2368, 512]
    - [2, 13.368]
  - - [2496, 3904, 1, 512, 2496, 2496, 2496, 512]
    - [2, 13.236]
  - - [2624, 3904, 1, 512, 2624, 2624, 2624, 512]
    - [2, 13.243]
  - - [2752, 3904, 1, 512, 2752, 2752, 2752, 512]
    - [2, 13.266]
  - - [2880, 3904, 1, 512, 2880, 2880, 2880, 512]
    - [2, 13.328]
  - - [3008, 3904, 1, 512, 3008, 3008, 3008, 512]
    - [2, 13.306]
  - - [3136, 3904, 1, 512, 3136, 3136, 3136, 512]
    - [2, 13.293]
  - - [3264, 3904, 1, 512, 3264, 3264, 3264, 512]
    - [2, 13.338]
  - - [3392, 3904, 1, 512, 3392, 3392, 3392, 512]
    - [2, 13.36]
  - - [3520, 3904, 1, 512, 3520, 3520, 3520, 512]
    - [2, 13.438]
  - - [3648, 3904, 1, 512, 3648, 3648, 3648, 512]
    - [2, 13.389]
  - - [3776, 3904, 1, 512, 3776, 3776, 3776, 512]
    - [2, 13.407]
  - - [3904, 3904, 1, 512, 3904, 3904, 3904, 512]
    - [2, 13.455]
  - - [4032, 3904, 1, 512, 4032, 4032, 4032, 512]
    - [2, 13.558]
  - - [64, 4032, 1, 512, 64, 64, 64, 512]
    - [2, 9.583]
  - - [192, 4032, 1, 512, 192, 192, 192, 512]
    - [0, 12.107]
  - - [320, 4032, 1, 512, 320, 320, 320, 512]
    - [2, 12.048]
  - - [448, 4032, 1, 512, 448, 448, 448, 512]
    - [2, 12.184]
  - - [576, 4032, 1, 512, 576, 576, 576, 512]
    - [2, 12.429]
  - - [704, 4032, 1, 512, 704, 704, 704, 512]
    - [2, 12.679]
  - - [832, 4032, 1, 512, 832, 832, 832, 512]
    - [2, 12.784]
  - - [960, 4032, 1, 512, 960, 960, 960, 512]
    - [2, 12.667]
  - - [1088, 4032, 1, 512, 1088, 1088, 1088, 512]
    - [2, 12.886]
  - - [1216, 4032, 1, 512, 1216, 1216, 1216, 512]
    - [2, 12.988]
  - - [1344, 4032, 1, 512, 1344, 1344, 1344, 512]
    - [2, 12.997]
  - - [1472, 4032, 1, 512, 1472, 1472, 1472, 512]
    - [2, 13.148]
  - - [1600, 4032, 1, 512, 1600, 1600, 1600, 512]
    - [2, 12.915]
  - - [1728, 4032, 1, 512, 1728, 1728, 1728, 512]
    - [2, 13.097]
  - - [1856, 4032, 1, 512, 1856, 1856, 1856, 512]
    - [2, 13.101]
  - - [1984, 4032, 1, 512, 1984, 1984, 1984, 512]
    - [2, 13.093]
  - - [2112, 4032, 1, 512, 2112, 2112, 2112, 512]
    - [2, 13.341]
  - - [2240, 4032, 1, 512, 2240, 2240, 2240, 512]
    - [2, 13.173]
  - - [2368, 4032, 1, 512, 2368, 2368, 2368, 512]
    - [2, 13.182]
  - - [2496, 4032, 1, 512, 2496, 2496, 2496, 512]
    - [2, 13.524]
  - - [2624, 4032, 1, 512, 2624, 2624, 2624, 512]
    - [2, 13.519]
  - - [2752, 4032, 1, 512, 2752, 2752, 2752, 512]
    - [2, 13.326]
  - - [2880, 4032, 1, 512, 2880, 2880, 2880, 512]
    - [2, 13.295]
  - - [3008, 4032, 1, 512, 3008, 3008, 3008, 512]
    - [2, 13.323]
  - - [3136, 4032, 1, 512, 3136, 3136, 3136, 512]
    - [2, 13.389]
  - - [3264, 4032, 1, 512, 3264, 3264, 3264, 512]
    - [2, 13.42]
  - - [3392, 4032, 1, 512, 3392, 3392, 3392, 512]
    - [2, 13.377]
  - - [3520, 4032, 1, 512, 3520, 3520, 3520, 512]
    - [2, 13.47]
  - - [3648, 4032, 1, 512, 3648, 3648, 3648, 512]
    - [2, 13.416]
  - - [3776, 4032, 1, 512, 3776, 3776, 3776, 512]
    - [2, 13.428]
  - - [3904, 4032, 1, 512, 3904, 3904, 3904, 512]
    - [2, 13.459]
  - - [4032, 4032, 1, 512, 4032, 4032, 4032, 512]
    - [2, 13.474]
  - - [64, 64, 1, 1024, 64, 64, 64, 1024]
    - [1, 0.756]
  - - [192, 64, 1, 1024, 192, 192, 192, 1024]
    - [2, 2.249]
  - - [320, 64, 1, 1024, 320, 320, 320, 1024]
    - [2, 3.668]
  - - [448, 64, 1, 1024, 448, 448, 448, 1024]
    - [0, 4.2]
  - - [576, 64, 1, 1024, 576, 576, 576, 1024]
    - [0, 5.388]
  - - [704, 64, 1, 1024, 704, 704, 704, 1024]
    - [0, 6.557]
  - - [832, 64, 1, 1024, 832, 832, 832, 1024]
    - [2, 5.787]
  - - [960, 64, 1, 1024, 960, 960, 960, 1024]
    - [2, 6.664]
  - - [1088, 64, 1, 1024, 1088, 1088, 1088, 1024]
    - [2, 7.519]
  - - [1216, 64, 1, 1024, 1216, 1216, 1216, 1024]
    - [0, 7.307]
  - - [1344, 64, 1, 1024, 1344, 1344, 1344, 1024]
    - [0, 8.067]
  - - [1472, 64, 1, 1024, 1472, 1472, 1472, 1024]
    - [0, 8.819]
  - - [1600, 64, 1, 1024, 1600, 1600, 1600, 1024]
    - [2, 7.725]
  - - [1728, 64, 1, 1024, 1728, 1728, 1728, 1024]
    - [2, 8.299]
  - - [1856, 64, 1, 1024, 1856, 1856, 1856, 1024]
    - [2, 8.902]
  - - [1984, 64, 1, 1024, 1984, 1984, 1984, 1024]
    - [0, 8.679]
  - - [2112, 64, 1, 1024, 2112, 2112, 2112, 1024]
    - [0, 9.238]
  - - [2240, 64, 1, 1024, 2240, 2240, 2240, 1024]
    - [0, 9.771]
  - - [2368, 64, 1, 1024, 2368, 2368, 2368, 1024]
    - [2, 8.815]
  - - [2496, 64, 1, 1024, 2496, 2496, 2496, 1024]
    - [2, 9.183]
  - - [2624, 64, 1, 1024, 2624, 2624, 2624, 1024]
    - [2, 9.642]
  - - [2752, 64, 1, 1024, 2752, 2752, 2752, 1024]
    - [0, 9.472]
  - - [2880, 64, 1, 1024, 2880, 2880, 2880, 1024]
    - [0, 9.917]
  - - [3008, 64, 1, 1024, 3008, 3008, 3008, 1024]
    - [0, 10.349]
  - - [3136, 64, 1, 1024, 3136, 3136, 3136, 1024]
    - [2, 9.48]
  - - [3264, 64, 1, 1024, 3264, 3264, 3264, 1024]
    - [2, 9.658]
  - - [3392, 64, 1, 1024, 3392, 3392, 3392, 1024]
    - [2, 10.078]
  - - [3520, 64, 1, 1024, 3520, 3520, 3520, 1024]
    - [2, 10.434]
  - - [3648, 64, 1, 1024, 3648, 3648, 3648, 1024]
    - [0, 10.528]
  - - [3776, 64, 1, 1024, 3776, 3776, 3776, 1024]
    - [0, 10.88]
  - - [3904, 64, 1, 1024, 3904, 3904, 3904, 1024]
    - [2, 10.268]
  - - [4032, 64, 1, 1024, 4032, 4032, 4032, 1024]
    - [2, 10.826]
  - - [64, 192, 1, 1024, 64, 64, 64, 1024]
    - [3, 1.574]
  - - [192, 192, 1, 1024, 192, 192, 192, 1024]
    - [2, 4.705]
  - - [320, 192, 1, 1024, 320, 320, 320, 1024]
    - [2, 6.596]
  - - [448, 192, 1, 1024, 448, 448, 448, 1024]
    - [0, 8.005]
  - - [576, 192, 1, 1024, 576, 576, 576, 1024]
    - [2, 8.27]
  - - [704, 192, 1, 1024, 704, 704, 704, 1024]
    - [0, 9.206]
  - - [832, 192, 1, 1024, 832, 832, 832, 1024]
    - [2, 9.21]
  - - [960, 192, 1, 1024, 960, 960, 960, 1024]
    - [0, 9.939]
  - - [1088, 192, 1, 1024, 1088, 1088, 1088, 1024]
    - [2, 9.776]
  - - [1216, 192, 1, 1024, 1216, 1216, 1216, 1024]
    - [0, 10.613]
  - - [1344, 192, 1, 1024, 1344, 1344, 1344, 1024]
    - [2, 10.8]
  - - [1472, 192, 1, 1024, 1472, 1472, 1472, 1024]
    - [0, 10.945]
  - - [1600, 192, 1, 1024, 1600, 1600, 1600, 1024]
    - [2, 11.437]
  - - [1728, 192, 1, 1024, 1728, 1728, 1728, 1024]
    - [0, 11.36]
  - - [1856, 192, 1, 1024, 1856, 1856, 1856, 1024]
    - [2, 11.474]
  - - [1984, 192, 1, 1024, 1984, 1984, 1984, 1024]
    - [0, 11.65]
  - - [2112, 192, 1, 1024, 2112, 2112, 2112, 1024]
    - [0, 11.401]
  - - [2240, 192, 1, 1024, 2240, 2240, 2240, 1024]
    - [0, 11.789]
  - - [2368, 192, 1, 1024, 2368, 2368, 2368, 1024]
    - [2, 11.581]
  - - [2496, 192, 1, 1024, 2496, 2496, 2496, 1024]
    - [0, 11.867]
  - - [2624, 192, 1, 1024, 2624, 2624, 2624, 1024]
    - [0, 11.493]
  - - [2752, 192, 1, 1024, 2752, 2752, 2752, 1024]
    - [0, 11.975]
  - - [2880, 192, 1, 1024, 2880, 2880, 2880, 1024]
    - [0, 11.555]
  - - [3008, 192, 1, 1024, 3008, 3008, 3008, 1024]
    - [2, 11.827]
  - - [3136, 192, 1, 1024, 3136, 3136, 3136, 1024]
    - [2, 11.737]
  - - [3264, 192, 1, 1024, 3264, 3264, 3264, 1024]
    - [2, 11.729]
  - - [3392, 192, 1, 1024, 3392, 3392, 3392, 1024]
    - [2, 11.933]
  - - [3520, 192, 1, 1024, 3520, 3520, 3520, 1024]
    - [2, 11.834]
  - - [3648, 192, 1, 1024, 3648, 3648, 3648, 1024]
    - [2, 11.806]
  - - [3776, 192, 1, 1024, 3776, 3776, 3776, 1024]
    - [0, 11.893]
  - - [3904, 192, 1, 1024, 3904, 3904, 3904, 1024]
    - [2, 12.103]
  - - [4032, 192, 1, 1024, 4032, 4032, 4032, 1024]
    - [2, 12.229]
  - - [64, 320, 1, 1024, 64, 64, 64, 1024]
    - [2, 3.693]
  - - [192, 320, 1, 1024, 192, 192, 192, 1024]
    - [2, 6.606]
  - - [320, 320, 1, 1024, 320, 320, 320, 1024]
    - [2, 7.689]
  - - [448, 320, 1, 1024, 448, 448, 448, 1024]
    - [0, 9.769]
  - - [576, 320, 1, 1024, 576, 576, 576, 1024]
    - [0, 9.938]
  - - [704, 320, 1, 1024, 704, 704, 704, 1024]
    - [2, 10.544]
  - - [832, 320, 1, 1024, 832, 832, 832, 1024]
    - [2, 10.702]
  - - [960, 320, 1, 1024, 960, 960, 960, 1024]
    - [2, 11.193]
  - - [1088, 320, 1, 1024, 1088, 1088, 1088, 1024]
    - [2, 11.271]
  - - [1216, 320, 1, 1024, 1216, 1216, 1216, 1024]
    - [0, 11.95]
  - - [1344, 320, 1, 1024, 1344, 1344, 1344, 1024]
    - [0, 11.754]
  - - [1472, 320, 1, 1024, 1472, 1472, 1472, 1024]
    - [0, 11.637]
  - - [1600, 320, 1, 1024, 1600, 1600, 1600, 1024]
    - [2, 11.946]
  - - [1728, 320, 1, 1024, 1728, 1728, 1728, 1024]
    - [2, 12.07]
  - - [1856, 320, 1, 1024, 1856, 1856, 1856, 1024]
    - [2, 12.003]
  - - [1984, 320, 1, 1024, 1984, 1984, 1984, 1024]
    - [2, 11.968]
  - - [2112, 320, 1, 1024, 2112, 2112, 2112, 1024]
    - [2, 11.909]
  - - [2240, 320, 1, 1024, 2240, 2240, 2240, 1024]
    - [2, 11.837]
  - - [2368, 320, 1, 1024, 2368, 2368, 2368, 1024]
    - [2, 12.074]
  - - [2496, 320, 1, 1024, 2496, 2496, 2496, 1024]
    - [2, 11.939]
  - - [2624, 320, 1, 1024, 2624, 2624, 2624, 1024]
    - [2, 12.043]
  - - [2752, 320, 1, 1024, 2752, 2752, 2752, 1024]
    - [0, 12.19]
  - - [2880, 320, 1, 1024, 2880, 2880, 2880, 1024]
    - [2, 12.348]
  - - [3008, 320, 1, 1024, 3008, 3008, 3008, 1024]
    - [2, 12.298]
  - - [3136, 320, 1, 1024, 3136, 3136, 3136, 1024]
    - [2, 12.272]
  - - [3264, 320, 1, 1024, 3264, 3264, 3264, 1024]
    - [0, 12.272]
  - - [3392, 320, 1, 1024, 3392, 3392, 3392, 1024]
    - [2, 12.37]
  - - [3520, 320, 1, 1024, 3520, 3520, 3520, 1024]
    - [2, 12.344]
  - - [3648, 320, 1, 1024, 3648, 3648, 3648, 1024]
    - [2, 12.568]
  - - [3776, 320, 1, 1024, 3776, 3776, 3776, 1024]
    - [2, 12.555]
  - - [3904, 320, 1, 1024, 3904, 3904, 3904, 1024]
    - [2, 12.429]
  - - [4032, 320, 1, 1024, 4032, 4032, 4032, 1024]
    - [2, 12.499]
  - - [64, 448, 1, 1024, 64, 64, 64, 1024]
    - [0, 3.647]
  - - [192, 448, 1, 1024, 192, 192, 192, 1024]
    - [0, 8.015]
  - - [320, 448, 1, 1024, 320, 320, 320, 1024]
    - [0, 9.786]
  - - [448, 448, 1, 1024, 448, 448, 448, 1024]
    - [2, 9.498]
  - - [576, 448, 1, 1024, 576, 576, 576, 1024]
    - [2, 10.79]
  - - [704, 448, 1, 1024, 704, 704, 704, 1024]
    - [2, 11.283]
  - - [832, 448, 1, 1024, 832, 832, 832, 1024]
    - [0, 11.38]
  - - [960, 448, 1, 1024, 960, 960, 960, 1024]
    - [0, 11.663]
  - - [1088, 448, 1, 1024, 1088, 1088, 1088, 1024]
    - [0, 12.063]
  - - [1216, 448, 1, 1024, 1216, 1216, 1216, 1024]
    - [2, 11.772]
  - - [1344, 448, 1, 1024, 1344, 1344, 1344, 1024]
    - [2, 11.688]
  - - [1472, 448, 1, 1024, 1472, 1472, 1472, 1024]
    - [2, 12.057]
  - - [1600, 448, 1, 1024, 1600, 1600, 1600, 1024]
    - [2, 11.972]
  - - [1728, 448, 1, 1024, 1728, 1728, 1728, 1024]
    - [2, 11.963]
  - - [1856, 448, 1, 1024, 1856, 1856, 1856, 1024]
    - [2, 12.147]
  - - [1984, 448, 1, 1024, 1984, 1984, 1984, 1024]
    - [2, 12.173]
  - - [2112, 448, 1, 1024, 2112, 2112, 2112, 1024]
    - [2, 12.17]
  - - [2240, 448, 1, 1024, 2240, 2240, 2240, 1024]
    - [2, 12.369]
  - - [2368, 448, 1, 1024, 2368, 2368, 2368, 1024]
    - [0, 12.302]
  - - [2496, 448, 1, 1024, 2496, 2496, 2496, 1024]
    - [2, 12.406]
  - - [2624, 448, 1, 1024, 2624, 2624, 2624, 1024]
    - [2, 12.454]
  - - [2752, 448, 1, 1024, 2752, 2752, 2752, 1024]
    - [0, 12.477]
  - - [2880, 448, 1, 1024, 2880, 2880, 2880, 1024]
    - [2, 12.469]
  - - [3008, 448, 1, 1024, 3008, 3008, 3008, 1024]
    - [2, 12.487]
  - - [3136, 448, 1, 1024, 3136, 3136, 3136, 1024]
    - [2, 12.665]
  - - [3264, 448, 1, 1024, 3264, 3264, 3264, 1024]
    - [2, 12.758]
  - - [3392, 448, 1, 1024, 3392, 3392, 3392, 1024]
    - [2, 12.651]
  - - [3520, 448, 1, 1024, 3520, 3520, 3520, 1024]
    - [2, 12.759]
  - - [3648, 448, 1, 1024, 3648, 3648, 3648, 1024]
    - [2, 12.716]
  - - [3776, 448, 1, 1024, 3776, 3776, 3776, 1024]
    - [2, 12.673]
  - - [3904, 448, 1, 1024, 3904, 3904, 3904, 1024]
    - [2, 12.743]
  - - [4032, 448, 1, 1024, 4032, 4032, 4032, 1024]
    - [2, 12.764]
  - - [64, 576, 1, 1024, 64, 64, 64, 1024]
    - [0, 5.317]
  - - [192, 576, 1, 1024, 192, 192, 192, 1024]
    - [2, 8.302]
  - - [320, 576, 1, 1024, 320, 320, 320, 1024]
    - [0, 9.943]
  - - [448, 576, 1, 1024, 448, 448, 448, 1024]
    - [2, 10.647]
  - - [576, 576, 1, 1024, 576, 576, 576, 1024]
    - [0, 11.233]
  - - [704, 576, 1, 1024, 704, 704, 704, 1024]
    - [2, 11.749]
  - - [832, 576, 1, 1024, 832, 832, 832, 1024]
    - [0, 11.912]
  - - [960, 576, 1, 1024, 960, 960, 960, 1024]
    - [2, 11.953]
  - - [1088, 576, 1, 1024, 1088, 1088, 1088, 1024]
    - [0, 11.907]
  - - [1216, 576, 1, 1024, 1216, 1216, 1216, 1024]
    - [2, 11.86]
  - - [1344, 576, 1, 1024, 1344, 1344, 1344, 1024]
    - [2, 12.311]
  - - [1472, 576, 1, 1024, 1472, 1472, 1472, 1024]
    - [2, 12.176]
  - - [1600, 576, 1, 1024, 1600, 1600, 1600, 1024]
    - [2, 12.102]
  - - [1728, 576, 1, 1024, 1728, 1728, 1728, 1024]
    - [2, 12.341]
  - - [1856, 576, 1, 1024, 1856, 1856, 1856, 1024]
    - [2, 12.403]
  - - [1984, 576, 1, 1024, 1984, 1984, 1984, 1024]
    - [0, 12.193]
  - - [2112, 576, 1, 1024, 2112, 2112, 2112, 1024]
    - [2, 12.516]
  - - [2240, 576, 1, 1024, 2240, 2240, 2240, 1024]
    - [0, 12.504]
  - - [2368, 576, 1, 1024, 2368, 2368, 2368, 1024]
    - [2, 12.56]
  - - [2496, 576, 1, 1024, 2496, 2496, 2496, 1024]
    - [0, 12.541]
  - - [2624, 576, 1, 1024, 2624, 2624, 2624, 1024]
    - [2, 12.62]
  - - [2752, 576, 1, 1024, 2752, 2752, 2752, 1024]
    - [2, 12.808]
  - - [2880, 576, 1, 1024, 2880, 2880, 2880, 1024]
    - [2, 12.817]
  - - [3008, 576, 1, 1024, 3008, 3008, 3008, 1024]
    - [2, 12.763]
  - - [3136, 576, 1, 1024, 3136, 3136, 3136, 1024]
    - [2, 12.803]
  - - [3264, 576, 1, 1024, 3264, 3264, 3264, 1024]
    - [2, 12.765]
  - - [3392, 576, 1, 1024, 3392, 3392, 3392, 1024]
    - [2, 12.804]
  - - [3520, 576, 1, 1024, 3520, 3520, 3520, 1024]
    - [2, 12.833]
  - - [3648, 576, 1, 1024, 3648, 3648, 3648, 1024]
    - [2, 12.919]
  - - [3776, 576, 1, 1024, 3776, 3776, 3776, 1024]
    - [2, 12.965]
  - - [3904, 576, 1, 1024, 3904, 3904, 3904, 1024]
    - [2, 12.894]
  - - [4032, 576, 1, 1024, 4032, 4032, 4032, 1024]
    - [2, 12.941]
  - - [64, 704, 1, 1024, 64, 64, 64, 1024]
    - [0, 6.499]
  - - [192, 704, 1, 1024, 192, 192, 192, 1024]
    - [0, 9.236]
  - - [320, 704, 1, 1024, 320, 320, 320, 1024]
    - [2, 10.443]
  - - [448, 704, 1, 1024, 448, 448, 448, 1024]
    - [2, 11.078]
  - - [576, 704, 1, 1024, 576, 576, 576, 1024]
    - [2, 11.306]
  - - [704, 704, 1, 1024, 704, 704, 704, 1024]
    - [0, 11.658]
  - - [832, 704, 1, 1024, 832, 832, 832, 1024]
    - [0, 11.984]
  - - [960, 704, 1, 1024, 960, 960, 960, 1024]
    - [0, 12.006]
  - - [1088, 704, 1, 1024, 1088, 1088, 1088, 1024]
    - [2, 12.16]
  - - [1216, 704, 1, 1024, 1216, 1216, 1216, 1024]
    - [2, 12.036]
  - - [1344, 704, 1, 1024, 1344, 1344, 1344, 1024]
    - [2, 12.405]
  - - [1472, 704, 1, 1024, 1472, 1472, 1472, 1024]
    - [2, 12.287]
  - - [1600, 704, 1, 1024, 1600, 1600, 1600, 1024]
    - [2, 12.442]
  - - [1728, 704, 1, 1024, 1728, 1728, 1728, 1024]
    - [2, 12.555]
  - - [1856, 704, 1, 1024, 1856, 1856, 1856, 1024]
    - [2, 12.494]
  - - [1984, 704, 1, 1024, 1984, 1984, 1984, 1024]
    - [2, 12.619]
  - - [2112, 704, 1, 1024, 2112, 2112, 2112, 1024]
    - [2, 12.865]
  - - [2240, 704, 1, 1024, 2240, 2240, 2240, 1024]
    - [2, 12.773]
  - - [2368, 704, 1, 1024, 2368, 2368, 2368, 1024]
    - [2, 12.788]
  - - [2496, 704, 1, 1024, 2496, 2496, 2496, 1024]
    - [2, 12.607]
  - - [2624, 704, 1, 1024, 2624, 2624, 2624, 1024]
    - [2, 12.863]
  - - [2752, 704, 1, 1024, 2752, 2752, 2752, 1024]
    - [2, 12.902]
  - - [2880, 704, 1, 1024, 2880, 2880, 2880, 1024]
    - [2, 13.026]
  - - [3008, 704, 1, 1024, 3008, 3008, 3008, 1024]
    - [2, 12.961]
  - - [3136, 704, 1, 1024, 3136, 3136, 3136, 1024]
    - [2, 12.969]
  - - [3264, 704, 1, 1024, 3264, 3264, 3264, 1024]
    - [2, 13.01]
  - - [3392, 704, 1, 1024, 3392, 3392, 3392, 1024]
    - [2, 13.086]
  - - [3520, 704, 1, 1024, 3520, 3520, 3520, 1024]
    - [2, 12.991]
  - - [3648, 704, 1, 1024, 3648, 3648, 3648, 1024]
    - [2, 13.085]
  - - [3776, 704, 1, 1024, 3776, 3776, 3776, 1024]
    - [2, 13.04]
  - - [3904, 704, 1, 1024, 3904, 3904, 3904, 1024]
    - [2, 13.106]
  - - [4032, 704, 1, 1024, 4032, 4032, 4032, 1024]
    - [2, 13.072]
  - - [64, 832, 1, 1024, 64, 64, 64, 1024]
    - [2, 5.736]
  - - [192, 832, 1, 1024, 192, 192, 192, 1024]
    - [2, 9.207]
  - - [320, 832, 1, 1024, 320, 320, 320, 1024]
    - [2, 10.713]
  - - [448, 832, 1, 1024, 448, 448, 448, 1024]
    - [0, 11.548]
  - - [576, 832, 1, 1024, 576, 576, 576, 1024]
    - [0, 11.878]
  - - [704, 832, 1, 1024, 704, 704, 704, 1024]
    - [0, 11.721]
  - - [832, 832, 1, 1024, 832, 832, 832, 1024]
    - [0, 11.958]
  - - [960, 832, 1, 1024, 960, 960, 960, 1024]
    - [0, 11.854]
  - - [1088, 832, 1, 1024, 1088, 1088, 1088, 1024]
    - [2, 12.065]
  - - [1216, 832, 1, 1024, 1216, 1216, 1216, 1024]
    - [2, 12.42]
  - - [1344, 832, 1, 1024, 1344, 1344, 1344, 1024]
    - [2, 12.4]
  - - [1472, 832, 1, 1024, 1472, 1472, 1472, 1024]
    - [0, 12.436]
  - - [1600, 832, 1, 1024, 1600, 1600, 1600, 1024]
    - [2, 12.578]
  - - [1728, 832, 1, 1024, 1728, 1728, 1728, 1024]
    - [2, 12.755]
  - - [1856, 832, 1, 1024, 1856, 1856, 1856, 1024]
    - [2, 12.579]
  - - [1984, 832, 1, 1024, 1984, 1984, 1984, 1024]
    - [2, 12.654]
  - - [2112, 832, 1, 1024, 2112, 2112, 2112, 1024]
    - [2, 12.715]
  - - [2240, 832, 1, 1024, 2240, 2240, 2240, 1024]
    - [2, 12.871]
  - - [2368, 832, 1, 1024, 2368, 2368, 2368, 1024]
    - [2, 12.887]
  - - [2496, 832, 1, 1024, 2496, 2496, 2496, 1024]
    - [2, 13.012]
  - - [2624, 832, 1, 1024, 2624, 2624, 2624, 1024]
    - [2, 12.944]
  - - [2752, 832, 1, 1024, 2752, 2752, 2752, 1024]
    - [2, 12.912]
  - - [2880, 832, 1, 1024, 2880, 2880, 2880, 1024]
    - [2, 13.014]
  - - [3008, 832, 1, 1024, 3008, 3008, 3008, 1024]
    - [2, 13.138]
  - - [3136, 832, 1, 1024, 3136, 3136, 3136, 1024]
    - [2, 13.143]
  - - [3264, 832, 1, 1024, 3264, 3264, 3264, 1024]
    - [2, 13.008]
  - - [3392, 832, 1, 1024, 3392, 3392, 3392, 1024]
    - [2, 13.14]
  - - [3520, 832, 1, 1024, 3520, 3520, 3520, 1024]
    - [2, 13.071]
  - - [3648, 832, 1, 1024, 3648, 3648, 3648, 1024]
    - [2, 13.069]
  - - [3776, 832, 1, 1024, 3776, 3776, 3776, 1024]
    - [2, 13.24]
  - - [3904, 832, 1, 1024, 3904, 3904, 3904, 1024]
    - [2, 13.129]
  - - [4032, 832, 1, 1024, 4032, 4032, 4032, 1024]
    - [2, 13.102]
  - - [64, 960, 1, 1024, 64, 64, 64, 1024]
    - [0, 5.787]
  - - [192, 960, 1, 1024, 192, 192, 192, 1024]
    - [0, 9.985]
  - - [320, 960, 1, 1024, 320, 320, 320, 1024]
    - [2, 11.353]
  - - [448, 960, 1, 1024, 448, 448, 448, 1024]
    - [0, 11.858]
  - - [576, 960, 1, 1024, 576, 576, 576, 1024]
    - [2, 11.595]
  - - [704, 960, 1, 1024, 704, 704, 704, 1024]
    - [0, 11.979]
  - - [832, 960, 1, 1024, 832, 832, 832, 1024]
    - [2, 12.126]
  - - [960, 960, 1, 1024, 960, 960, 960, 1024]
    - [2, 12.216]
  - - [1088, 960, 1, 1024, 1088, 1088, 1088, 1024]
    - [2, 12.372]
  - - [1216, 960, 1, 1024, 1216, 1216, 1216, 1024]
    - [2, 12.334]
  - - [1344, 960, 1, 1024, 1344, 1344, 1344, 1024]
    - [2, 12.541]
  - - [1472, 960, 1, 1024, 1472, 1472, 1472, 1024]
    - [2, 12.475]
  - - [1600, 960, 1, 1024, 1600, 1600, 1600, 1024]
    - [2, 12.653]
  - - [1728, 960, 1, 1024, 1728, 1728, 1728, 1024]
    - [2, 12.743]
  - - [1856, 960, 1, 1024, 1856, 1856, 1856, 1024]
    - [2, 12.784]
  - - [1984, 960, 1, 1024, 1984, 1984, 1984, 1024]
    - [2, 12.822]
  - - [2112, 960, 1, 1024, 2112, 2112, 2112, 1024]
    - [2, 12.799]
  - - [2240, 960, 1, 1024, 2240, 2240, 2240, 1024]
    - [2, 12.935]
  - - [2368, 960, 1, 1024, 2368, 2368, 2368, 1024]
    - [2, 12.825]
  - - [2496, 960, 1, 1024, 2496, 2496, 2496, 1024]
    - [2, 12.946]
  - - [2624, 960, 1, 1024, 2624, 2624, 2624, 1024]
    - [2, 13.009]
  - - [2752, 960, 1, 1024, 2752, 2752, 2752, 1024]
    - [2, 12.965]
  - - [2880, 960, 1, 1024, 2880, 2880, 2880, 1024]
    - [2, 13.05]
  - - [3008, 960, 1, 1024, 3008, 3008, 3008, 1024]
    - [2, 13.089]
  - - [3136, 960, 1, 1024, 3136, 3136, 3136, 1024]
    - [2, 13.144]
  - - [3264, 960, 1, 1024, 3264, 3264, 3264, 1024]
    - [2, 13.273]
  - - [3392, 960, 1, 1024, 3392, 3392, 3392, 1024]
    - [2, 13.146]
  - - [3520, 960, 1, 1024, 3520, 3520, 3520, 1024]
    - [2, 13.129]
  - - [3648, 960, 1, 1024, 3648, 3648, 3648, 1024]
    - [2, 13.188]
  - - [3776, 960, 1, 1024, 3776, 3776, 3776, 1024]
    - [2, 13.249]
  - - [3904, 960, 1, 1024, 3904, 3904, 3904, 1024]
    - [2, 13.221]
  - - [4032, 960, 1, 1024, 4032, 4032, 4032, 1024]
    - [2, 13.344]
  - - [64, 1088, 1, 1024, 64, 64, 64, 1024]
    - [2, 7.549]
  - - [192, 1088, 1, 1024, 192, 192, 192, 1024]
    - [2, 9.846]
  - - [320, 1088, 1, 1024, 320, 320, 320, 1024]
    - [2, 11.265]
  - - [448, 1088, 1, 1024, 448, 448, 448, 1024]
    - [0, 12.137]
  - - [576, 1088, 1, 1024, 576, 576, 576, 1024]
    - [2, 11.953]
  - - [704, 1088, 1, 1024, 704, 704, 704, 1024]
    - [2, 12.033]
  - - [832, 1088, 1, 1024, 832, 832, 832, 1024]
    - [2, 12.291]
  - - [960, 1088, 1, 1024, 960, 960, 960, 1024]
    - [2, 12.405]
  - - [1088, 1088, 1, 1024, 1088, 1088, 1088, 1024]
    - [2, 12.53]
  - - [1216, 1088, 1, 1024, 1216, 1216, 1216, 1024]
    - [2, 12.608]
  - - [1344, 1088, 1, 1024, 1344, 1344, 1344, 1024]
    - [2, 12.668]
  - - [1472, 1088, 1, 1024, 1472, 1472, 1472, 1024]
    - [2, 12.819]
  - - [1600, 1088, 1, 1024, 1600, 1600, 1600, 1024]
    - [2, 12.732]
  - - [1728, 1088, 1, 1024, 1728, 1728, 1728, 1024]
    - [2, 12.775]
  - - [1856, 1088, 1, 1024, 1856, 1856, 1856, 1024]
    - [2, 12.676]
  - - [1984, 1088, 1, 1024, 1984, 1984, 1984, 1024]
    - [2, 12.934]
  - - [2112, 1088, 1, 1024, 2112, 2112, 2112, 1024]
    - [2, 12.915]
  - - [2240, 1088, 1, 1024, 2240, 2240, 2240, 1024]
    - [2, 12.953]
  - - [2368, 1088, 1, 1024, 2368, 2368, 2368, 1024]
    - [2, 13.107]
  - - [2496, 1088, 1, 1024, 2496, 2496, 2496, 1024]
    - [2, 13.078]
  - - [2624, 1088, 1, 1024, 2624, 2624, 2624, 1024]
    - [2, 13.135]
  - - [2752, 1088, 1, 1024, 2752, 2752, 2752, 1024]
    - [2, 13.229]
  - - [2880, 1088, 1, 1024, 2880, 2880, 2880, 1024]
    - [2, 13.008]
  - - [3008, 1088, 1, 1024, 3008, 3008, 3008, 1024]
    - [2, 13.262]
  - - [3136, 1088, 1, 1024, 3136, 3136, 3136, 1024]
    - [2, 13.169]
  - - [3264, 1088, 1, 1024, 3264, 3264, 3264, 1024]
    - [2, 13.26]
  - - [3392, 1088, 1, 1024, 3392, 3392, 3392, 1024]
    - [2, 13.263]
  - - [3520, 1088, 1, 1024, 3520, 3520, 3520, 1024]
    - [2, 13.279]
  - - [3648, 1088, 1, 1024, 3648, 3648, 3648, 1024]
    - [2, 13.202]
  - - [3776, 1088, 1, 1024, 3776, 3776, 3776, 1024]
    - [2, 13.165]
  - - [3904, 1088, 1, 1024, 3904, 3904, 3904, 1024]
    - [2, 13.061]
  - - [4032, 1088, 1, 1024, 4032, 4032, 4032, 1024]
    - [2, 13.183]
  - - [64, 1216, 1, 1024, 64, 64, 64, 1024]
    - [0, 7.233]
  - - [192, 1216, 1, 1024, 192, 192, 192, 1024]
    - [0, 10.625]
  - - [320, 1216, 1, 1024, 320, 320, 320, 1024]
    - [0, 11.992]
  - - [448, 1216, 1, 1024, 448, 448, 448, 1024]
    - [0, 11.785]
  - - [576, 1216, 1, 1024, 576, 576, 576, 1024]
    - [2, 11.956]
  - - [704, 1216, 1, 1024, 704, 704, 704, 1024]
    - [2, 12.017]
  - - [832, 1216, 1, 1024, 832, 832, 832, 1024]
    - [2, 12.37]
  - - [960, 1216, 1, 1024, 960, 960, 960, 1024]
    - [2, 12.439]
  - - [1088, 1216, 1, 1024, 1088, 1088, 1088, 1024]
    - [2, 12.494]
  - - [1216, 1216, 1, 1024, 1216, 1216, 1216, 1024]
    - [2, 12.802]
  - - [1344, 1216, 1, 1024, 1344, 1344, 1344, 1024]
    - [2, 12.815]
  - - [1472, 1216, 1, 1024, 1472, 1472, 1472, 1024]
    - [2, 12.666]
  - - [1600, 1216, 1, 1024, 1600, 1600, 1600, 1024]
    - [2, 12.777]
  - - [1728, 1216, 1, 1024, 1728, 1728, 1728, 1024]
    - [2, 12.877]
  - - [1856, 1216, 1, 1024, 1856, 1856, 1856, 1024]
    - [2, 12.872]
  - - [1984, 1216, 1, 1024, 1984, 1984, 1984, 1024]
    - [2, 12.897]
  - - [2112, 1216, 1, 1024, 2112, 2112, 2112, 1024]
    - [2, 12.951]
  - - [2240, 1216, 1, 1024, 2240, 2240, 2240, 1024]
    - [2, 12.937]
  - - [2368, 1216, 1, 1024, 2368, 2368, 2368, 1024]
    - [2, 12.966]
  - - [2496, 1216, 1, 1024, 2496, 2496, 2496, 1024]
    - [2, 13.102]
  - - [2624, 1216, 1, 1024, 2624, 2624, 2624, 1024]
    - [2, 13.165]
  - - [2752, 1216, 1, 1024, 2752, 2752, 2752, 1024]
    - [2, 13.024]
  - - [2880, 1216, 1, 1024, 2880, 2880, 2880, 1024]
    - [2, 13.108]
  - - [3008, 1216, 1, 1024, 3008, 3008, 3008, 1024]
    - [2, 13.086]
  - - [3136, 1216, 1, 1024, 3136, 3136, 3136, 1024]
    - [2, 13.266]
  - - [3264, 1216, 1, 1024, 3264, 3264, 3264, 1024]
    - [2, 13.072]
  - - [3392, 1216, 1, 1024, 3392, 3392, 3392, 1024]
    - [2, 13.106]
  - - [3520, 1216, 1, 1024, 3520, 3520, 3520, 1024]
    - [2, 13.172]
  - - [3648, 1216, 1, 1024, 3648, 3648, 3648, 1024]
    - [2, 13.343]
  - - [3776, 1216, 1, 1024, 3776, 3776, 3776, 1024]
    - [2, 13.379]
  - - [3904, 1216, 1, 1024, 3904, 3904, 3904, 1024]
    - [2, 13.195]
  - - [4032, 1216, 1, 1024, 4032, 4032, 4032, 1024]
    - [2, 13.223]
  - - [64, 1344, 1, 1024, 64, 64, 64, 1024]
    - [0, 8.04]
  - - [192, 1344, 1, 1024, 192, 192, 192, 1024]
    - [2, 10.758]
  - - [320, 1344, 1, 1024, 320, 320, 320, 1024]
    - [0, 11.721]
  - - [448, 1344, 1, 1024, 448, 448, 448, 1024]
    - [2, 11.963]
  - - [576, 1344, 1, 1024, 576, 576, 576, 1024]
    - [2, 11.982]
  - - [704, 1344, 1, 1024, 704, 704, 704, 1024]
    - [2, 12.15]
  - - [832, 1344, 1, 1024, 832, 832, 832, 1024]
    - [2, 12.368]
  - - [960, 1344, 1, 1024, 960, 960, 960, 1024]
    - [2, 12.501]
  - - [1088, 1344, 1, 1024, 1088, 1088, 1088, 1024]
    - [2, 12.748]
  - - [1216, 1344, 1, 1024, 1216, 1216, 1216, 1024]
    - [2, 12.715]
  - - [1344, 1344, 1, 1024, 1344, 1344, 1344, 1024]
    - [2, 12.803]
  - - [1472, 1344, 1, 1024, 1472, 1472, 1472, 1024]
    - [2, 12.781]
  - - [1600, 1344, 1, 1024, 1600, 1600, 1600, 1024]
    - [2, 13.023]
  - - [1728, 1344, 1, 1024, 1728, 1728, 1728, 1024]
    - [2, 12.879]
  - - [1856, 1344, 1, 1024, 1856, 1856, 1856, 1024]
    - [2, 13.142]
  - - [1984, 1344, 1, 1024, 1984, 1984, 1984, 1024]
    - [2, 13.174]
  - - [2112, 1344, 1, 1024, 2112, 2112, 2112, 1024]
    - [2, 12.983]
  - - [2240, 1344, 1, 1024, 2240, 2240, 2240, 1024]
    - [2, 12.928]
  - - [2368, 1344, 1, 1024, 2368, 2368, 2368, 1024]
    - [2, 13.26]
  - - [2496, 1344, 1, 1024, 2496, 2496, 2496, 1024]
    - [2, 13.161]
  - - [2624, 1344, 1, 1024, 2624, 2624, 2624, 1024]
    - [2, 13.221]
  - - [2752, 1344, 1, 1024, 2752, 2752, 2752, 1024]
    - [2, 13.285]
  - - [2880, 1344, 1, 1024, 2880, 2880, 2880, 1024]
    - [2, 13.246]
  - - [3008, 1344, 1, 1024, 3008, 3008, 3008, 1024]
    - [2, 13.299]
  - - [3136, 1344, 1, 1024, 3136, 3136, 3136, 1024]
    - [2, 13.134]
  - - [3264, 1344, 1, 1024, 3264, 3264, 3264, 1024]
    - [2, 13.158]
  - - [3392, 1344, 1, 1024, 3392, 3392, 3392, 1024]
    - [2, 13.168]
  - - [3520, 1344, 1, 1024, 3520, 3520, 3520, 1024]
    - [2, 13.459]
  - - [3648, 1344, 1, 1024, 3648, 3648, 3648, 1024]
    - [2, 13.21]
  - - [3776, 1344, 1, 1024, 3776, 3776, 3776, 1024]
    - [2, 13.176]
  - - [3904, 1344, 1, 1024, 3904, 3904, 3904, 1024]
    - [2, 13.515]
  - - [4032, 1344, 1, 1024, 4032, 4032, 4032, 1024]
    - [2, 13.511]
  - - [64, 1472, 1, 1024, 64, 64, 64, 1024]
    - [0, 8.699]
  - - [192, 1472, 1, 1024, 192, 192, 192, 1024]
    - [0, 11.007]
  - - [320, 1472, 1, 1024, 320, 320, 320, 1024]
    - [0, 11.645]
  - - [448, 1472, 1, 1024, 448, 448, 448, 1024]
    - [2, 11.841]
  - - [576, 1472, 1, 1024, 576, 576, 576, 1024]
    - [2, 12.11]
  - - [704, 1472, 1, 1024, 704, 704, 704, 1024]
    - [2, 12.348]
  - - [832, 1472, 1, 1024, 832, 832, 832, 1024]
    - [2, 12.531]
  - - [960, 1472, 1, 1024, 960, 960, 960, 1024]
    - [2, 12.504]
  - - [1088, 1472, 1, 1024, 1088, 1088, 1088, 1024]
    - [2, 12.58]
  - - [1216, 1472, 1, 1024, 1216, 1216, 1216, 1024]
    - [2, 12.708]
  - - [1344, 1472, 1, 1024, 1344, 1344, 1344, 1024]
    - [2, 12.738]
  - - [1472, 1472, 1, 1024, 1472, 1472, 1472, 1024]
    - [2, 12.868]
  - - [1600, 1472, 1, 1024, 1600, 1600, 1600, 1024]
    - [2, 12.999]
  - - [1728, 1472, 1, 1024, 1728, 1728, 1728, 1024]
    - [2, 12.955]
  - - [1856, 1472, 1, 1024, 1856, 1856, 1856, 1024]
    - [2, 13.032]
  - - [1984, 1472, 1, 1024, 1984, 1984, 1984, 1024]
    - [2, 13.077]
  - - [2112, 1472, 1, 1024, 2112, 2112, 2112, 1024]
    - [2, 13.124]
  - - [2240, 1472, 1, 1024, 2240, 2240, 2240, 1024]
    - [2, 13.197]
  - - [2368, 1472, 1, 1024, 2368, 2368, 2368, 1024]
    - [2, 13.142]
  - - [2496, 1472, 1, 1024, 2496, 2496, 2496, 1024]
    - [2, 13.248]
  - - [2624, 1472, 1, 1024, 2624, 2624, 2624, 1024]
    - [2, 13.246]
  - - [2752, 1472, 1, 1024, 2752, 2752, 2752, 1024]
    - [2, 13.065]
  - - [2880, 1472, 1, 1024, 2880, 2880, 2880, 1024]
    - [2, 13.131]
  - - [3008, 1472, 1, 1024, 3008, 3008, 3008, 1024]
    - [2, 13.112]
  - - [3136, 1472, 1, 1024, 3136, 3136, 3136, 1024]
    - [2, 13.193]
  - - [3264, 1472, 1, 1024, 3264, 3264, 3264, 1024]
    - [2, 13.171]
  - - [3392, 1472, 1, 1024, 3392, 3392, 3392, 1024]
    - [2, 13.467]
  - - [3520, 1472, 1, 1024, 3520, 3520, 3520, 1024]
    - [2, 13.437]
  - - [3648, 1472, 1, 1024, 3648, 3648, 3648, 1024]
    - [2, 13.437]
  - - [3776, 1472, 1, 1024, 3776, 3776, 3776, 1024]
    - [2, 13.53]
  - - [3904, 1472, 1, 1024, 3904, 3904, 3904, 1024]
    - [2, 13.508]
  - - [4032, 1472, 1, 1024, 4032, 4032, 4032, 1024]
    - [2, 13.546]
  - - [64, 1600, 1, 1024, 64, 64, 64, 1024]
    - [2, 7.755]
  - - [192, 1600, 1, 1024, 192, 192, 192, 1024]
    - [2, 11.562]
  - - [320, 1600, 1, 1024, 320, 320, 320, 1024]
    - [0, 11.722]
  - - [448, 1600, 1, 1024, 448, 448, 448, 1024]
    - [2, 11.897]
  - - [576, 1600, 1, 1024, 576, 576, 576, 1024]
    - [2, 12.011]
  - - [704, 1600, 1, 1024, 704, 704, 704, 1024]
    - [0, 12.276]
  - - [832, 1600, 1, 1024, 832, 832, 832, 1024]
    - [2, 12.344]
  - - [960, 1600, 1, 1024, 960, 960, 960, 1024]
    - [2, 12.572]
  - - [1088, 1600, 1, 1024, 1088, 1088, 1088, 1024]
    - [2, 12.825]
  - - [1216, 1600, 1, 1024, 1216, 1216, 1216, 1024]
    - [2, 12.728]
  - - [1344, 1600, 1, 1024, 1344, 1344, 1344, 1024]
    - [2, 12.9]
  - - [1472, 1600, 1, 1024, 1472, 1472, 1472, 1024]
    - [2, 12.903]
  - - [1600, 1600, 1, 1024, 1600, 1600, 1600, 1024]
    - [2, 13.058]
  - - [1728, 1600, 1, 1024, 1728, 1728, 1728, 1024]
    - [2, 12.999]
  - - [1856, 1600, 1, 1024, 1856, 1856, 1856, 1024]
    - [2, 13.062]
  - - [1984, 1600, 1, 1024, 1984, 1984, 1984, 1024]
    - [2, 13.041]
  - - [2112, 1600, 1, 1024, 2112, 2112, 2112, 1024]
    - [2, 13.075]
  - - [2240, 1600, 1, 1024, 2240, 2240, 2240, 1024]
    - [2, 13.187]
  - - [2368, 1600, 1, 1024, 2368, 2368, 2368, 1024]
    - [2, 13.245]
  - - [2496, 1600, 1, 1024, 2496, 2496, 2496, 1024]
    - [2, 13.054]
  - - [2624, 1600, 1, 1024, 2624, 2624, 2624, 1024]
    - [2, 13.113]
  - - [2752, 1600, 1, 1024, 2752, 2752, 2752, 1024]
    - [2, 13.156]
  - - [2880, 1600, 1, 1024, 2880, 2880, 2880, 1024]
    - [2, 13.369]
  - - [3008, 1600, 1, 1024, 3008, 3008, 3008, 1024]
    - [2, 13.399]
  - - [3136, 1600, 1, 1024, 3136, 3136, 3136, 1024]
    - [2, 13.445]
  - - [3264, 1600, 1, 1024, 3264, 3264, 3264, 1024]
    - [2, 13.43]
  - - [3392, 1600, 1, 1024, 3392, 3392, 3392, 1024]
    - [2, 13.224]
  - - [3520, 1600, 1, 1024, 3520, 3520, 3520, 1024]
    - [2, 13.245]
  - - [3648, 1600, 1, 1024, 3648, 3648, 3648, 1024]
    - [2, 13.51]
  - - [3776, 1600, 1, 1024, 3776, 3776, 3776, 1024]
    - [2, 13.571]
  - - [3904, 1600, 1, 1024, 3904, 3904, 3904, 1024]
    - [2, 13.369]
  - - [4032, 1600, 1, 1024, 4032, 4032, 4032, 1024]
    - [2, 13.402]
  - - [64, 1728, 1, 1024, 64, 64, 64, 1024]
    - [2, 8.235]
  - - [192, 1728, 1, 1024, 192, 192, 192, 1024]
    - [0, 11.277]
  - - [320, 1728, 1, 1024, 320, 320, 320, 1024]
    - [2, 11.478]
  - - [448, 1728, 1, 1024, 448, 448, 448, 1024]
    - [2, 12.002]
  - - [576, 1728, 1, 1024, 576, 576, 576, 1024]
    - [2, 12.104]
  - - [704, 1728, 1, 1024, 704, 704, 704, 1024]
    - [2, 12.583]
  - - [832, 1728, 1, 1024, 832, 832, 832, 1024]
    - [2, 12.582]
  - - [960, 1728, 1, 1024, 960, 960, 960, 1024]
    - [2, 12.704]
  - - [1088, 1728, 1, 1024, 1088, 1088, 1088, 1024]
    - [2, 12.715]
  - - [1216, 1728, 1, 1024, 1216, 1216, 1216, 1024]
    - [2, 12.987]
  - - [1344, 1728, 1, 1024, 1344, 1344, 1344, 1024]
    - [2, 12.832]
  - - [1472, 1728, 1, 1024, 1472, 1472, 1472, 1024]
    - [2, 12.979]
  - - [1600, 1728, 1, 1024, 1600, 1600, 1600, 1024]
    - [2, 13.031]
  - - [1728, 1728, 1, 1024, 1728, 1728, 1728, 1024]
    - [2, 13.072]
  - - [1856, 1728, 1, 1024, 1856, 1856, 1856, 1024]
    - [2, 13.133]
  - - [1984, 1728, 1, 1024, 1984, 1984, 1984, 1024]
    - [2, 13.073]
  - - [2112, 1728, 1, 1024, 2112, 2112, 2112, 1024]
    - [2, 13.122]
  - - [2240, 1728, 1, 1024, 2240, 2240, 2240, 1024]
    - [2, 13.144]
  - - [2368, 1728, 1, 1024, 2368, 2368, 2368, 1024]
    - [2, 13.033]
  - - [2496, 1728, 1, 1024, 2496, 2496, 2496, 1024]
    - [2, 13.203]
  - - [2624, 1728, 1, 1024, 2624, 2624, 2624, 1024]
    - [2, 13.428]
  - - [2752, 1728, 1, 1024, 2752, 2752, 2752, 1024]
    - [2, 13.366]
  - - [2880, 1728, 1, 1024, 2880, 2880, 2880, 1024]
    - [2, 13.434]
  - - [3008, 1728, 1, 1024, 3008, 3008, 3008, 1024]
    - [2, 13.494]
  - - [3136, 1728, 1, 1024, 3136, 3136, 3136, 1024]
    - [2, 13.444]
  - - [3264, 1728, 1, 1024, 3264, 3264, 3264, 1024]
    - [2, 13.532]
  - - [3392, 1728, 1, 1024, 3392, 3392, 3392, 1024]
    - [2, 13.559]
  - - [3520, 1728, 1, 1024, 3520, 3520, 3520, 1024]
    - [2, 13.494]
  - - [3648, 1728, 1, 1024, 3648, 3648, 3648, 1024]
    - [2, 13.58]
  - - [3776, 1728, 1, 1024, 3776, 3776, 3776, 1024]
    - [2, 13.579]
  - - [3904, 1728, 1, 1024, 3904, 3904, 3904, 1024]
    - [2, 13.635]
  - - [4032, 1728, 1, 1024, 4032, 4032, 4032, 1024]
    - [2, 13.694]
  - - [64, 1856, 1, 1024, 64, 64, 64, 1024]
    - [2, 8.852]
  - - [192, 1856, 1, 1024, 192, 192, 192, 1024]
    - [2, 11.223]
  - - [320, 1856, 1, 1024, 320, 320, 320, 1024]
    - [2, 11.563]
  - - [448, 1856, 1, 1024, 448, 448, 448, 1024]
    - [0, 12.054]
  - - [576, 1856, 1, 1024, 576, 576, 576, 1024]
    - [2, 12.257]
  - - [704, 1856, 1, 1024, 704, 704, 704, 1024]
    - [2, 12.439]
  - - [832, 1856, 1, 1024, 832, 832, 832, 1024]
    - [2, 12.647]
  - - [960, 1856, 1, 1024, 960, 960, 960, 1024]
    - [2, 12.584]
  - - [1088, 1856, 1, 1024, 1088, 1088, 1088, 1024]
    - [2, 12.578]
  - - [1216, 1856, 1, 1024, 1216, 1216, 1216, 1024]
    - [2, 12.915]
  - - [1344, 1856, 1, 1024, 1344, 1344, 1344, 1024]
    - [2, 12.824]
  - - [1472, 1856, 1, 1024, 1472, 1472, 1472, 1024]
    - [2, 12.957]
  - - [1600, 1856, 1, 1024, 1600, 1600, 1600, 1024]
    - [2, 13.072]
  - - [1728, 1856, 1, 1024, 1728, 1728, 1728, 1024]
    - [2, 13.168]
  - - [1856, 1856, 1, 1024, 1856, 1856, 1856, 1024]
    - [2, 13.224]
  - - [1984, 1856, 1, 1024, 1984, 1984, 1984, 1024]
    - [2, 13.324]
  - - [2112, 1856, 1, 1024, 2112, 2112, 2112, 1024]
    - [2, 13.269]
  - - [2240, 1856, 1, 1024, 2240, 2240, 2240, 1024]
    - [2, 13.258]
  - - [2368, 1856, 1, 1024, 2368, 2368, 2368, 1024]
    - [2, 12.987]
  - - [2496, 1856, 1, 1024, 2496, 2496, 2496, 1024]
    - [2, 13.124]
  - - [2624, 1856, 1, 1024, 2624, 2624, 2624, 1024]
    - [2, 13.165]
  - - [2752, 1856, 1, 1024, 2752, 2752, 2752, 1024]
    - [2, 13.276]
  - - [2880, 1856, 1, 1024, 2880, 2880, 2880, 1024]
    - [2, 13.446]
  - - [3008, 1856, 1, 1024, 3008, 3008, 3008, 1024]
    - [2, 13.52]
  - - [3136, 1856, 1, 1024, 3136, 3136, 3136, 1024]
    - [2, 13.499]
  - - [3264, 1856, 1, 1024, 3264, 3264, 3264, 1024]
    - [2, 13.493]
  - - [3392, 1856, 1, 1024, 3392, 3392, 3392, 1024]
    - [2, 13.594]
  - - [3520, 1856, 1, 1024, 3520, 3520, 3520, 1024]
    - [2, 13.612]
  - - [3648, 1856, 1, 1024, 3648, 3648, 3648, 1024]
    - [2, 13.631]
  - - [3776, 1856, 1, 1024, 3776, 3776, 3776, 1024]
    - [2, 13.704]
  - - [3904, 1856, 1, 1024, 3904, 3904, 3904, 1024]
    - [2, 13.693]
  - - [4032, 1856, 1, 1024, 4032, 4032, 4032, 1024]
    - [2, 13.737]
  - - [64, 1984, 1, 1024, 64, 64, 64, 1024]
    - [2, 8.627]
  - - [192, 1984, 1, 1024, 192, 192, 192, 1024]
    - [2, 11.543]
  - - [320, 1984, 1, 1024, 320, 320, 320, 1024]
    - [0, 11.9]
  - - [448, 1984, 1, 1024, 448, 448, 448, 1024]
    - [2, 12.152]
  - - [576, 1984, 1, 1024, 576, 576, 576, 1024]
    - [2, 12.398]
  - - [704, 1984, 1, 1024, 704, 704, 704, 1024]
    - [0, 12.501]
  - - [832, 1984, 1, 1024, 832, 832, 832, 1024]
    - [2, 12.714]
  - - [960, 1984, 1, 1024, 960, 960, 960, 1024]
    - [2, 12.676]
  - - [1088, 1984, 1, 1024, 1088, 1088, 1088, 1024]
    - [2, 12.847]
  - - [1216, 1984, 1, 1024, 1216, 1216, 1216, 1024]
    - [2, 12.722]
  - - [1344, 1984, 1, 1024, 1344, 1344, 1344, 1024]
    - [2, 12.99]
  - - [1472, 1984, 1, 1024, 1472, 1472, 1472, 1024]
    - [2, 13.012]
  - - [1600, 1984, 1, 1024, 1600, 1600, 1600, 1024]
    - [2, 13.162]
  - - [1728, 1984, 1, 1024, 1728, 1728, 1728, 1024]
    - [2, 13.021]
  - - [1856, 1984, 1, 1024, 1856, 1856, 1856, 1024]
    - [2, 13.093]
  - - [1984, 1984, 1, 1024, 1984, 1984, 1984, 1024]
    - [2, 13.094]
  - - [2112, 1984, 1, 1024, 2112, 2112, 2112, 1024]
    - [2, 13.282]
  - - [2240, 1984, 1, 1024, 2240, 2240, 2240, 1024]
    - [2, 13.12]
  - - [2368, 1984, 1, 1024, 2368, 2368, 2368, 1024]
    - [2, 13.174]
  - - [2496, 1984, 1, 1024, 2496, 2496, 2496, 1024]
    - [2, 13.365]
  - - [2624, 1984, 1, 1024, 2624, 2624, 2624, 1024]
    - [2, 13.233]
  - - [2752, 1984, 1, 1024, 2752, 2752, 2752, 1024]
    - [2, 13.306]
  - - [2880, 1984, 1, 1024, 2880, 2880, 2880, 1024]
    - [2, 13.503]
  - - [3008, 1984, 1, 1024, 3008, 3008, 3008, 1024]
    - [2, 13.499]
  - - [3136, 1984, 1, 1024, 3136, 3136, 3136, 1024]
    - [2, 13.571]
  - - [3264, 1984, 1, 1024, 3264, 3264, 3264, 1024]
    - [2, 13.636]
  - - [3392, 1984, 1, 1024, 3392, 3392, 3392, 1024]
    - [2, 13.661]
  - - [3520, 1984, 1, 1024, 3520, 3520, 3520, 1024]
    - [2, 13.632]
  - - [3648, 1984, 1, 1024, 3648, 3648, 3648, 1024]
    - [2, 13.699]
  - - [3776, 1984, 1, 1024, 3776, 3776, 3776, 1024]
    - [2, 13.715]
  - - [3904, 1984, 1, 1024, 3904, 3904, 3904, 1024]
    - [2, 13.729]
  - - [4032, 1984, 1, 1024, 4032, 4032, 4032, 1024]
    - [2, 13.77]
  - - [64, 2112, 1, 1024, 64, 64, 64, 1024]
    - [0, 9.051]
  - - [192, 2112, 1, 1024, 192, 192, 192, 1024]
    - [2, 11.3]
  - - [320, 2112, 1, 1024, 320, 320, 320, 1024]
    - [2, 12.344]
  - - [448, 2112, 1, 1024, 448, 448, 448, 1024]
    - [2, 12.2]
  - - [576, 2112, 1, 1024, 576, 576, 576, 1024]
    - [2, 12.543]
  - - [704, 2112, 1, 1024, 704, 704, 704, 1024]
    - [2, 12.625]
  - - [832, 2112, 1, 1024, 832, 832, 832, 1024]
    - [2, 12.677]
  - - [960, 2112, 1, 1024, 960, 960, 960, 1024]
    - [2, 13.188]
  - - [1088, 2112, 1, 1024, 1088, 1088, 1088, 1024]
    - [2, 12.845]
  - - [1216, 2112, 1, 1024, 1216, 1216, 1216, 1024]
    - [2, 12.888]
  - - [1344, 2112, 1, 1024, 1344, 1344, 1344, 1024]
    - [2, 12.988]
  - - [1472, 2112, 1, 1024, 1472, 1472, 1472, 1024]
    - [2, 13.176]
  - - [1600, 2112, 1, 1024, 1600, 1600, 1600, 1024]
    - [2, 13.171]
  - - [1728, 2112, 1, 1024, 1728, 1728, 1728, 1024]
    - [2, 13.021]
  - - [1856, 2112, 1, 1024, 1856, 1856, 1856, 1024]
    - [2, 13.121]
  - - [1984, 2112, 1, 1024, 1984, 1984, 1984, 1024]
    - [2, 13.185]
  - - [2112, 2112, 1, 1024, 2112, 2112, 2112, 1024]
    - [2, 13.321]
  - - [2240, 2112, 1, 1024, 2240, 2240, 2240, 1024]
    - [2, 13.369]
  - - [2368, 2112, 1, 1024, 2368, 2368, 2368, 1024]
    - [2, 13.437]
  - - [2496, 2112, 1, 1024, 2496, 2496, 2496, 1024]
    - [2, 13.395]
  - - [2624, 2112, 1, 1024, 2624, 2624, 2624, 1024]
    - [2, 13.48]
  - - [2752, 2112, 1, 1024, 2752, 2752, 2752, 1024]
    - [2, 13.527]
  - - [2880, 2112, 1, 1024, 2880, 2880, 2880, 1024]
    - [2, 13.55]
  - - [3008, 2112, 1, 1024, 3008, 3008, 3008, 1024]
    - [2, 13.539]
  - - [3136, 2112, 1, 1024, 3136, 3136, 3136, 1024]
    - [2, 13.603]
  - - [3264, 2112, 1, 1024, 3264, 3264, 3264, 1024]
    - [2, 13.635]
  - - [3392, 2112, 1, 1024, 3392, 3392, 3392, 1024]
    - [2, 13.601]
  - - [3520, 2112, 1, 1024, 3520, 3520, 3520, 1024]
    - [2, 13.721]
  - - [3648, 2112, 1, 1024, 3648, 3648, 3648, 1024]
    - [2, 13.721]
  - - [3776, 2112, 1, 1024, 3776, 3776, 3776, 1024]
    - [2, 13.75]
  - - [3904, 2112, 1, 1024, 3904, 3904, 3904, 1024]
    - [2, 13.746]
  - - [4032, 2112, 1, 1024, 4032, 4032, 4032, 1024]
    - [2, 13.777]
  - - [64, 2240, 1, 1024, 64, 64, 64, 1024]
    - [0, 9.731]
  - - [192, 2240, 1, 1024, 192, 192, 192, 1024]
    - [0, 11.586]
  - - [320, 2240, 1, 1024, 320, 320, 320, 1024]
    - [0, 11.684]
  - - [448, 2240, 1, 1024, 448, 448, 448, 1024]
    - [2, 12.152]
  - - [576, 2240, 1, 1024, 576, 576, 576, 1024]
    - [2, 12.465]
  - - [704, 2240, 1, 1024, 704, 704, 704, 1024]
    - [2, 12.652]
  - - [832, 2240, 1, 1024, 832, 832, 832, 1024]
    - [2, 12.662]
  - - [960, 2240, 1, 1024, 960, 960, 960, 1024]
    - [2, 12.825]
  - - [1088, 2240, 1, 1024, 1088, 1088, 1088, 1024]
    - [2, 12.999]
  - - [1216, 2240, 1, 1024, 1216, 1216, 1216, 1024]
    - [2, 12.97]
  - - [1344, 2240, 1, 1024, 1344, 1344, 1344, 1024]
    - [2, 12.849]
  - - [1472, 2240, 1, 1024, 1472, 1472, 1472, 1024]
    - [2, 12.916]
  - - [1600, 2240, 1, 1024, 1600, 1600, 1600, 1024]
    - [2, 13.012]
  - - [1728, 2240, 1, 1024, 1728, 1728, 1728, 1024]
    - [2, 13.12]
  - - [1856, 2240, 1, 1024, 1856, 1856, 1856, 1024]
    - [2, 13.354]
  - - [1984, 2240, 1, 1024, 1984, 1984, 1984, 1024]
    - [2, 13.455]
  - - [2112, 2240, 1, 1024, 2112, 2112, 2112, 1024]
    - [2, 13.185]
  - - [2240, 2240, 1, 1024, 2240, 2240, 2240, 1024]
    - [2, 13.198]
  - - [2368, 2240, 1, 1024, 2368, 2368, 2368, 1024]
    - [2, 13.395]
  - - [2496, 2240, 1, 1024, 2496, 2496, 2496, 1024]
    - [2, 13.423]
  - - [2624, 2240, 1, 1024, 2624, 2624, 2624, 1024]
    - [2, 13.468]
  - - [2752, 2240, 1, 1024, 2752, 2752, 2752, 1024]
    - [2, 13.626]
  - - [2880, 2240, 1, 1024, 2880, 2880, 2880, 1024]
    - [2, 13.613]
  - - [3008, 2240, 1, 1024, 3008, 3008, 3008, 1024]
    - [2, 13.351]
  - - [3136, 2240, 1, 1024, 3136, 3136, 3136, 1024]
    - [2, 13.41]
  - - [3264, 2240, 1, 1024, 3264, 3264, 3264, 1024]
    - [2, 13.677]
  - - [3392, 2240, 1, 1024, 3392, 3392, 3392, 1024]
    - [2, 13.635]
  - - [3520, 2240, 1, 1024, 3520, 3520, 3520, 1024]
    - [2, 13.765]
  - - [3648, 2240, 1, 1024, 3648, 3648, 3648, 1024]
    - [2, 13.825]
  - - [3776, 2240, 1, 1024, 3776, 3776, 3776, 1024]
    - [2, 13.609]
  - - [3904, 2240, 1, 1024, 3904, 3904, 3904, 1024]
    - [2, 13.554]
  - - [4032, 2240, 1, 1024, 4032, 4032, 4032, 1024]
    - [2, 13.805]
  - - [64, 2368, 1, 1024, 64, 64, 64, 1024]
    - [2, 8.835]
  - - [192, 2368, 1, 1024, 192, 192, 192, 1024]
    - [2, 11.351]
  - - [320, 2368, 1, 1024, 320, 320, 320, 1024]
    - [2, 11.827]
  - - [448, 2368, 1, 1024, 448, 448, 448, 1024]
    - [2, 12.409]
  - - [576, 2368, 1, 1024, 576, 576, 576, 1024]
    - [2, 12.522]
  - - [704, 2368, 1, 1024, 704, 704, 704, 1024]
    - [2, 12.62]
  - - [832, 2368, 1, 1024, 832, 832, 832, 1024]
    - [2, 12.804]
  - - [960, 2368, 1, 1024, 960, 960, 960, 1024]
    - [2, 12.879]
  - - [1088, 2368, 1, 1024, 1088, 1088, 1088, 1024]
    - [2, 12.89]
  - - [1216, 2368, 1, 1024, 1216, 1216, 1216, 1024]
    - [2, 13.117]
  - - [1344, 2368, 1, 1024, 1344, 1344, 1344, 1024]
    - [2, 13.051]
  - - [1472, 2368, 1, 1024, 1472, 1472, 1472, 1024]
    - [2, 13.165]
  - - [1600, 2368, 1, 1024, 1600, 1600, 1600, 1024]
    - [2, 13.058]
  - - [1728, 2368, 1, 1024, 1728, 1728, 1728, 1024]
    - [2, 13.102]
  - - [1856, 2368, 1, 1024, 1856, 1856, 1856, 1024]
    - [2, 13.344]
  - - [1984, 2368, 1, 1024, 1984, 1984, 1984, 1024]
    - [2, 13.155]
  - - [2112, 2368, 1, 1024, 2112, 2112, 2112, 1024]
    - [2, 13.236]
  - - [2240, 2368, 1, 1024, 2240, 2240, 2240, 1024]
    - [2, 13.49]
  - - [2368, 2368, 1, 1024, 2368, 2368, 2368, 1024]
    - [2, 13.456]
  - - [2496, 2368, 1, 1024, 2496, 2496, 2496, 1024]
    - [2, 13.314]
  - - [2624, 2368, 1, 1024, 2624, 2624, 2624, 1024]
    - [2, 13.292]
  - - [2752, 2368, 1, 1024, 2752, 2752, 2752, 1024]
    - [2, 13.334]
  - - [2880, 2368, 1, 1024, 2880, 2880, 2880, 1024]
    - [2, 13.499]
  - - [3008, 2368, 1, 1024, 3008, 3008, 3008, 1024]
    - [2, 13.658]
  - - [3136, 2368, 1, 1024, 3136, 3136, 3136, 1024]
    - [2, 13.713]
  - - [3264, 2368, 1, 1024, 3264, 3264, 3264, 1024]
    - [2, 13.752]
  - - [3392, 2368, 1, 1024, 3392, 3392, 3392, 1024]
    - [2, 13.737]
  - - [3520, 2368, 1, 1024, 3520, 3520, 3520, 1024]
    - [2, 13.836]
  - - [3648, 2368, 1, 1024, 3648, 3648, 3648, 1024]
    - [2, 13.587]
  - - [3776, 2368, 1, 1024, 3776, 3776, 3776, 1024]
    - [2, 13.663]
  - - [3904, 2368, 1, 1024, 3904, 3904, 3904, 1024]
    - [2, 13.837]
  - - [4032, 2368, 1, 1024, 4032, 4032, 4032, 1024]
    - [2, 13.87]
  - - [64, 2496, 1, 1024, 64, 64, 64, 1024]
    - [2, 9.068]
  - - [192, 2496, 1, 1024, 192, 192, 192, 1024]
    - [0, 11.948]
  - - [320, 2496, 1, 1024, 320, 320, 320, 1024]
    - [2, 12.059]
  - - [448, 2496, 1, 1024, 448, 448, 448, 1024]
    - [2, 12.305]
  - - [576, 2496, 1, 1024, 576, 576, 576, 1024]
    - [2, 12.618]
  - - [704, 2496, 1, 1024, 704, 704, 704, 1024]
    - [2, 12.695]
  - - [832, 2496, 1, 1024, 832, 832, 832, 1024]
    - [2, 12.656]
  - - [960, 2496, 1, 1024, 960, 960, 960, 1024]
    - [2, 12.887]
  - - [1088, 2496, 1, 1024, 1088, 1088, 1088, 1024]
    - [2, 12.858]
  - - [1216, 2496, 1, 1024, 1216, 1216, 1216, 1024]
    - [2, 13.061]
  - - [1344, 2496, 1, 1024, 1344, 1344, 1344, 1024]
    - [2, 12.931]
  - - [1472, 2496, 1, 1024, 1472, 1472, 1472, 1024]
    - [2, 13.008]
  - - [1600, 2496, 1, 1024, 1600, 1600, 1600, 1024]
    - [2, 13.12]
  - - [1728, 2496, 1, 1024, 1728, 1728, 1728, 1024]
    - [2, 13.09]
  - - [1856, 2496, 1, 1024, 1856, 1856, 1856, 1024]
    - [2, 13.163]
  - - [1984, 2496, 1, 1024, 1984, 1984, 1984, 1024]
    - [2, 13.223]
  - - [2112, 2496, 1, 1024, 2112, 2112, 2112, 1024]
    - [2, 13.362]
  - - [2240, 2496, 1, 1024, 2240, 2240, 2240, 1024]
    - [2, 13.29]
  - - [2368, 2496, 1, 1024, 2368, 2368, 2368, 1024]
    - [2, 13.339]
  - - [2496, 2496, 1, 1024, 2496, 2496, 2496, 1024]
    - [2, 13.369]
  - - [2624, 2496, 1, 1024, 2624, 2624, 2624, 1024]
    - [2, 13.315]
  - - [2752, 2496, 1, 1024, 2752, 2752, 2752, 1024]
    - [2, 13.661]
  - - [2880, 2496, 1, 1024, 2880, 2880, 2880, 1024]
    - [2, 13.676]
  - - [3008, 2496, 1, 1024, 3008, 3008, 3008, 1024]
    - [2, 13.675]
  - - [3136, 2496, 1, 1024, 3136, 3136, 3136, 1024]
    - [2, 13.455]
  - - [3264, 2496, 1, 1024, 3264, 3264, 3264, 1024]
    - [2, 13.56]
  - - [3392, 2496, 1, 1024, 3392, 3392, 3392, 1024]
    - [2, 13.493]
  - - [3520, 2496, 1, 1024, 3520, 3520, 3520, 1024]
    - [2, 13.603]
  - - [3648, 2496, 1, 1024, 3648, 3648, 3648, 1024]
    - [2, 13.821]
  - - [3776, 2496, 1, 1024, 3776, 3776, 3776, 1024]
    - [2, 13.877]
  - - [3904, 2496, 1, 1024, 3904, 3904, 3904, 1024]
    - [2, 13.826]
  - - [4032, 2496, 1, 1024, 4032, 4032, 4032, 1024]
    - [2, 13.924]
  - - [64, 2624, 1, 1024, 64, 64, 64, 1024]
    - [2, 9.329]
  - - [192, 2624, 1, 1024, 192, 192, 192, 1024]
    - [2, 11.523]
  - - [320, 2624, 1, 1024, 320, 320, 320, 1024]
    - [0, 12.173]
  - - [448, 2624, 1, 1024, 448, 448, 448, 1024]
    - [0, 12.456]
  - - [576, 2624, 1, 1024, 576, 576, 576, 1024]
    - [2, 12.603]
  - - [704, 2624, 1, 1024, 704, 704, 704, 1024]
    - [2, 12.804]
  - - [832, 2624, 1, 1024, 832, 832, 832, 1024]
    - [2, 12.923]
  - - [960, 2624, 1, 1024, 960, 960, 960, 1024]
    - [2, 13.009]
  - - [1088, 2624, 1, 1024, 1088, 1088, 1088, 1024]
    - [2, 13.124]
  - - [1216, 2624, 1, 1024, 1216, 1216, 1216, 1024]
    - [2, 13.098]
  - - [1344, 2624, 1, 1024, 1344, 1344, 1344, 1024]
    - [2, 13.186]
  - - [1472, 2624, 1, 1024, 1472, 1472, 1472, 1024]
    - [2, 13.211]
  - - [1600, 2624, 1, 1024, 1600, 1600, 1600, 1024]
    - [2, 13.049]
  - - [1728, 2624, 1, 1024, 1728, 1728, 1728, 1024]
    - [2, 13.14]
  - - [1856, 2624, 1, 1024, 1856, 1856, 1856, 1024]
    - [2, 13.397]
  - - [1984, 2624, 1, 1024, 1984, 1984, 1984, 1024]
    - [2, 13.386]
  - - [2112, 2624, 1, 1024, 2112, 2112, 2112, 1024]
    - [2, 13.521]
  - - [2240, 2624, 1, 1024, 2240, 2240, 2240, 1024]
    - [2, 13.274]
  - - [2368, 2624, 1, 1024, 2368, 2368, 2368, 1024]
    - [2, 13.346]
  - - [2496, 2624, 1, 1024, 2496, 2496, 2496, 1024]
    - [2, 13.582]
  - - [2624, 2624, 1, 1024, 2624, 2624, 2624, 1024]
    - [2, 13.648]
  - - [2752, 2624, 1, 1024, 2752, 2752, 2752, 1024]
    - [2, 13.701]
  - - [2880, 2624, 1, 1024, 2880, 2880, 2880, 1024]
    - [2, 13.672]
  - - [3008, 2624, 1, 1024, 3008, 3008, 3008, 1024]
    - [2, 13.744]
  - - [3136, 2624, 1, 1024, 3136, 3136, 3136, 1024]
    - [2, 13.784]
  - - [3264, 2624, 1, 1024, 3264, 3264, 3264, 1024]
    - [2, 13.729]
  - - [3392, 2624, 1, 1024, 3392, 3392, 3392, 1024]
    - [2, 13.804]
  - - [3520, 2624, 1, 1024, 3520, 3520, 3520, 1024]
    - [2, 13.601]
  - - [3648, 2624, 1, 1024, 3648, 3648, 3648, 1024]
    - [2, 13.646]
  - - [3776, 2624, 1, 1024, 3776, 3776, 3776, 1024]
    - [2, 13.918]
  - - [3904, 2624, 1, 1024, 3904, 3904, 3904, 1024]
    - [2, 13.89]
  - - [4032, 2624, 1, 1024, 4032, 4032, 4032, 1024]
    - [2, 13.978]
  - - [64, 2752, 1, 1024, 64, 64, 64, 1024]
    - [2, 9.304]
  - - [192, 2752, 1, 1024, 192, 192, 192, 1024]
    - [0, 11.753]
  - - [320, 2752, 1, 1024, 320, 320, 320, 1024]
    - [0, 12.051]
  - - [448, 2752, 1, 1024, 448, 448, 448, 1024]
    - [2, 12.352]
  - - [576, 2752, 1, 1024, 576, 576, 576, 1024]
    - [2, 12.648]
  - - [704, 2752, 1, 1024, 704, 704, 704, 1024]
    - [2, 12.818]
  - - [832, 2752, 1, 1024, 832, 832, 832, 1024]
    - [2, 13.049]
  - - [960, 2752, 1, 1024, 960, 960, 960, 1024]
    - [2, 12.96]
  - - [1088, 2752, 1, 1024, 1088, 1088, 1088, 1024]
    - [2, 13.05]
  - - [1216, 2752, 1, 1024, 1216, 1216, 1216, 1024]
    - [2, 13.007]
  - - [1344, 2752, 1, 1024, 1344, 1344, 1344, 1024]
    - [2, 13.047]
  - - [1472, 2752, 1, 1024, 1472, 1472, 1472, 1024]
    - [2, 13.107]
  - - [1600, 2752, 1, 1024, 1600, 1600, 1600, 1024]
    - [2, 13.283]
  - - [1728, 2752, 1, 1024, 1728, 1728, 1728, 1024]
    - [2, 13.156]
  - - [1856, 2752, 1, 1024, 1856, 1856, 1856, 1024]
    - [2, 13.204]
  - - [1984, 2752, 1, 1024, 1984, 1984, 1984, 1024]
    - [2, 13.241]
  - - [2112, 2752, 1, 1024, 2112, 2112, 2112, 1024]
    - [2, 13.234]
  - - [2240, 2752, 1, 1024, 2240, 2240, 2240, 1024]
    - [2, 13.482]
  - - [2368, 2752, 1, 1024, 2368, 2368, 2368, 1024]
    - [2, 13.587]
  - - [2496, 2752, 1, 1024, 2496, 2496, 2496, 1024]
    - [2, 13.111]
  - - [2624, 2752, 1, 1024, 2624, 2624, 2624, 1024]
    - [2, 13.654]
  - - [2752, 2752, 1, 1024, 2752, 2752, 2752, 1024]
    - [2, 13.72]
  - - [2880, 2752, 1, 1024, 2880, 2880, 2880, 1024]
    - [2, 13.687]
  - - [3008, 2752, 1, 1024, 3008, 3008, 3008, 1024]
    - [2, 13.795]
  - - [3136, 2752, 1, 1024, 3136, 3136, 3136, 1024]
    - [2, 13.825]
  - - [3264, 2752, 1, 1024, 3264, 3264, 3264, 1024]
    - [2, 13.824]
  - - [3392, 2752, 1, 1024, 3392, 3392, 3392, 1024]
    - [2, 13.895]
  - - [3520, 2752, 1, 1024, 3520, 3520, 3520, 1024]
    - [2, 13.893]
  - - [3648, 2752, 1, 1024, 3648, 3648, 3648, 1024]
    - [2, 13.931]
  - - [3776, 2752, 1, 1024, 3776, 3776, 3776, 1024]
    - [2, 13.967]
  - - [3904, 2752, 1, 1024, 3904, 3904, 3904, 1024]
    - [2, 13.968]
  - - [4032, 2752, 1, 1024, 4032, 4032, 4032, 1024]
    - [2, 14.004]
  - - [64, 2880, 1, 1024, 64, 64, 64, 1024]
    - [0, 9.622]
  - - [192, 2880, 1, 1024, 192, 192, 192, 1024]
    - [2, 11.655]
  - - [320, 2880, 1, 1024, 320, 320, 320, 1024]
    - [2, 12.092]
  - - [448, 2880, 1, 1024, 448, 448, 448, 1024]
    - [2, 12.56]
  - - [576, 2880, 1, 1024, 576, 576, 576, 1024]
    - [2, 12.608]
  - - [704, 2880, 1, 1024, 704, 704, 704, 1024]
    - [2, 12.829]
  - - [832, 2880, 1, 1024, 832, 832, 832, 1024]
    - [2, 12.643]
  - - [960, 2880, 1, 1024, 960, 960, 960, 1024]
    - [2, 12.879]
  - - [1088, 2880, 1, 1024, 1088, 1088, 1088, 1024]
    - [2, 12.865]
  - - [1216, 2880, 1, 1024, 1216, 1216, 1216, 1024]
    - [2, 13.222]
  - - [1344, 2880, 1, 1024, 1344, 1344, 1344, 1024]
    - [2, 13.108]
  - - [1472, 2880, 1, 1024, 1472, 1472, 1472, 1024]
    - [2, 13.147]
  - - [1600, 2880, 1, 1024, 1600, 1600, 1600, 1024]
    - [2, 13.398]
  - - [1728, 2880, 1, 1024, 1728, 1728, 1728, 1024]
    - [2, 13.168]
  - - [1856, 2880, 1, 1024, 1856, 1856, 1856, 1024]
    - [2, 13.265]
  - - [1984, 2880, 1, 1024, 1984, 1984, 1984, 1024]
    - [2, 13.526]
  - - [2112, 2880, 1, 1024, 2112, 2112, 2112, 1024]
    - [2, 13.562]
  - - [2240, 2880, 1, 1024, 2240, 2240, 2240, 1024]
    - [2, 13.564]
  - - [2368, 2880, 1, 1024, 2368, 2368, 2368, 1024]
    - [2, 13.678]
  - - [2496, 2880, 1, 1024, 2496, 2496, 2496, 1024]
    - [2, 13.712]
  - - [2624, 2880, 1, 1024, 2624, 2624, 2624, 1024]
    - [2, 13.723]
  - - [2752, 2880, 1, 1024, 2752, 2752, 2752, 1024]
    - [2, 13.764]
  - - [2880, 2880, 1, 1024, 2880, 2880, 2880, 1024]
    - [2, 13.785]
  - - [3008, 2880, 1, 1024, 3008, 3008, 3008, 1024]
    - [2, 13.833]
  - - [3136, 2880, 1, 1024, 3136, 3136, 3136, 1024]
    - [2, 13.821]
  - - [3264, 2880, 1, 1024, 3264, 3264, 3264, 1024]
    - [2, 13.552]
  - - [3392, 2880, 1, 1024, 3392, 3392, 3392, 1024]
    - [2, 13.562]
  - - [3520, 2880, 1, 1024, 3520, 3520, 3520, 1024]
    - [2, 13.918]
  - - [3648, 2880, 1, 1024, 3648, 3648, 3648, 1024]
    - [2, 13.988]
  - - [3776, 2880, 1, 1024, 3776, 3776, 3776, 1024]
    - [2, 13.949]
  - - [3904, 2880, 1, 1024, 3904, 3904, 3904, 1024]
    - [2, 13.979]
  - - [4032, 2880, 1, 1024, 4032, 4032, 4032, 1024]
    - [2, 13.799]
  - - [64, 3008, 1, 1024, 64, 64, 64, 1024]
    - [0, 10.245]
  - - [192, 3008, 1, 1024, 192, 192, 192, 1024]
    - [2, 11.753]
  - - [320, 3008, 1, 1024, 320, 320, 320, 1024]
    - [2, 11.97]
  - - [448, 3008, 1, 1024, 448, 448, 448, 1024]
    - [2, 12.203]
  - - [576, 3008, 1, 1024, 576, 576, 576, 1024]
    - [2, 12.624]
  - - [704, 3008, 1, 1024, 704, 704, 704, 1024]
    - [2, 12.839]
  - - [832, 3008, 1, 1024, 832, 832, 832, 1024]
    - [2, 12.944]
  - - [960, 3008, 1, 1024, 960, 960, 960, 1024]
    - [2, 13.1]
  - - [1088, 3008, 1, 1024, 1088, 1088, 1088, 1024]
    - [2, 13.104]
  - - [1216, 3008, 1, 1024, 1216, 1216, 1216, 1024]
    - [2, 12.987]
  - - [1344, 3008, 1, 1024, 1344, 1344, 1344, 1024]
    - [2, 13.102]
  - - [1472, 3008, 1, 1024, 1472, 1472, 1472, 1024]
    - [2, 13.113]
  - - [1600, 3008, 1, 1024, 1600, 1600, 1600, 1024]
    - [2, 13.159]
  - - [1728, 3008, 1, 1024, 1728, 1728, 1728, 1024]
    - [2, 13.199]
  - - [1856, 3008, 1, 1024, 1856, 1856, 1856, 1024]
    - [2, 13.243]
  - - [1984, 3008, 1, 1024, 1984, 1984, 1984, 1024]
    - [2, 13.297]
  - - [2112, 3008, 1, 1024, 2112, 2112, 2112, 1024]
    - [2, 13.562]
  - - [2240, 3008, 1, 1024, 2240, 2240, 2240, 1024]
    - [2, 13.535]
  - - [2368, 3008, 1, 1024, 2368, 2368, 2368, 1024]
    - [2, 13.628]
  - - [2496, 3008, 1, 1024, 2496, 2496, 2496, 1024]
    - [2, 13.74]
  - - [2624, 3008, 1, 1024, 2624, 2624, 2624, 1024]
    - [2, 13.757]
  - - [2752, 3008, 1, 1024, 2752, 2752, 2752, 1024]
    - [2, 13.785]
  - - [2880, 3008, 1, 1024, 2880, 2880, 2880, 1024]
    - [2, 13.822]
  - - [3008, 3008, 1, 1024, 3008, 3008, 3008, 1024]
    - [2, 13.798]
  - - [3136, 3008, 1, 1024, 3136, 3136, 3136, 1024]
    - [2, 13.657]
  - - [3264, 3008, 1, 1024, 3264, 3264, 3264, 1024]
    - [2, 13.723]
  - - [3392, 3008, 1, 1024, 3392, 3392, 3392, 1024]
    - [2, 13.923]
  - - [3520, 3008, 1, 1024, 3520, 3520, 3520, 1024]
    - [2, 13.945]
  - - [3648, 3008, 1, 1024, 3648, 3648, 3648, 1024]
    - [2, 14.003]
  - - [3776, 3008, 1, 1024, 3776, 3776, 3776, 1024]
    - [2, 13.979]
  - - [3904, 3008, 1, 1024, 3904, 3904, 3904, 1024]
    - [2, 14.021]
  - - [4032, 3008, 1, 1024, 4032, 4032, 4032, 1024]
    - [2, 14.047]
  - - [64, 3136, 1, 1024, 64, 64, 64, 1024]
    - [2, 9.316]
  - - [192, 3136, 1, 1024, 192, 192, 192, 1024]
    - [2, 11.655]
  - - [320, 3136, 1, 1024, 320, 320, 320, 1024]
    - [2, 12.3]
  - - [448, 3136, 1, 1024, 448, 448, 448, 1024]
    - [2, 12.601]
  - - [576, 3136, 1, 1024, 576, 576, 576, 1024]
    - [2, 12.66]
  - - [704, 3136, 1, 1024, 704, 704, 704, 1024]
    - [2, 12.753]
  - - [832, 3136, 1, 1024, 832, 832, 832, 1024]
    - [2, 12.939]
  - - [960, 3136, 1, 1024, 960, 960, 960, 1024]
    - [2, 13.079]
  - - [1088, 3136, 1, 1024, 1088, 1088, 1088, 1024]
    - [2, 13.165]
  - - [1216, 3136, 1, 1024, 1216, 1216, 1216, 1024]
    - [2, 13.12]
  - - [1344, 3136, 1, 1024, 1344, 1344, 1344, 1024]
    - [2, 13.048]
  - - [1472, 3136, 1, 1024, 1472, 1472, 1472, 1024]
    - [2, 13.11]
  - - [1600, 3136, 1, 1024, 1600, 1600, 1600, 1024]
    - [2, 13.159]
  - - [1728, 3136, 1, 1024, 1728, 1728, 1728, 1024]
    - [2, 13.484]
  - - [1856, 3136, 1, 1024, 1856, 1856, 1856, 1024]
    - [2, 13.504]
  - - [1984, 3136, 1, 1024, 1984, 1984, 1984, 1024]
    - [2, 13.523]
  - - [2112, 3136, 1, 1024, 2112, 2112, 2112, 1024]
    - [2, 13.636]
  - - [2240, 3136, 1, 1024, 2240, 2240, 2240, 1024]
    - [2, 13.675]
  - - [2368, 3136, 1, 1024, 2368, 2368, 2368, 1024]
    - [2, 13.693]
  - - [2496, 3136, 1, 1024, 2496, 2496, 2496, 1024]
    - [2, 13.718]
  - - [2624, 3136, 1, 1024, 2624, 2624, 2624, 1024]
    - [2, 13.761]
  - - [2752, 3136, 1, 1024, 2752, 2752, 2752, 1024]
    - [2, 13.82]
