library/src/amd_detail/rocblaslt/src/Tensile/Logic/asm_full/navi33/GridBased/navi33_Cijk_Alik_Bljk_BSS_BH_Bias_HAH.yaml
- {MinimumRequiredVersion: 4.33.0}
- navi33
- gfx1102
- [Device 73f0]
    SolutionIndex: 0
    SolutionNameMin: Cijk_Alik_Bljk_BSS_BH_Bias_HAH_MT32x32x64_MI16x16x16x1_SN_MIWT1_1_WG32_4_1
    SolutionIndex: 1
    SolutionNameMin: Cijk_Alik_Bljk_BSS_BH_Bias_HAH_MT16x16x64_MI16x16x16x1_SN_MIWT1_1_WG16_2_1
    SolutionIndex: 2
    SolutionNameMin: Cijk_Alik_Bljk_BSS_BH_Bias_HAH_MT32x16x64_MI16x16x16x1_SN_MIWT1_1_WG32_2_1
    SolutionIndex: 3
    SolutionNameMin: Cijk_Alik_Bljk_BSS_BH_Bias_HAH_MT16x32x64_MI16x16x16x1_SN_MIWT1_1_WG16_4_1
- - - [64, 64, 1, 64, 64, 64, 64, 64]
    - [1, 0.094]
  - - [192, 64, 1, 64, 192, 192, 64, 64]
    - [2, 0.273]
  - - [320, 64, 1, 64, 320, 320, 64, 64]
    - [3, 0.159]
  - - [448, 64, 1, 64, 448, 448, 64, 64]
    - [2, 0.226]
  - - [576, 64, 1, 64, 576, 576, 64, 64]
    - [2, 0.291]
  - - [704, 64, 1, 64, 704, 704, 64, 64]
    - [2, 0.354]
  - - [832, 64, 1, 64, 832, 832, 64, 64]
    - [2, 0.294]
  - - [960, 64, 1, 64, 960, 960, 64, 64]
    - [3, 0.49]
  - - [1088, 64, 1, 64, 1088, 1088, 64, 64]
    - [3, 0.554]
  - - [1216, 64, 1, 64, 1216, 1216, 64, 64]
    - [3, 0.322]
  - - [1344, 64, 1, 64, 1344, 1344, 64, 64]
    - [3, 0.685]
  - - [1472, 64, 1, 64, 1472, 1472, 64, 64]
    - [2, 0.752]
  - - [1600, 64, 1, 64, 1600, 1600, 64, 64]
    - [2, 0.813]
  - - [1728, 64, 1, 64, 1728, 1728, 64, 64]
    - [2, 0.457]
  - - [1856, 64, 1, 64, 1856, 1856, 64, 64]
    - [3, 0.49]
  - - [1984, 64, 1, 64, 1984, 1984, 64, 64]
    - [3, 0.521]
  - - [2112, 64, 1, 64, 2112, 2112, 64, 64]
    - [0, 0.557]
  - - [2240, 64, 1, 64, 2240, 2240, 64, 64]
    - [2, 0.589]
  - - [2368, 64, 1, 64, 2368, 2368, 64, 64]
    - [3, 0.625]
  - - [2496, 64, 1, 64, 2496, 2496, 64, 64]
    - [3, 1.271]
  - - [2624, 64, 1, 64, 2624, 2624, 64, 64]
    - [3, 0.691]
  - - [2752, 64, 1, 64, 2752, 2752, 64, 64]
    - [3, 0.728]
  - - [2880, 64, 1, 64, 2880, 2880, 64, 64]
    - [3, 1.474]
  - - [3008, 64, 1, 64, 3008, 3008, 64, 64]
    - [3, 0.793]
  - - [3136, 64, 1, 64, 3136, 3136, 64, 64]
    - [2, 0.826]
  - - [3264, 64, 1, 64, 3264, 3264, 64, 64]
    - [3, 2.756]
  - - [3392, 64, 1, 64, 3392, 3392, 64, 64]
    - [0, 3.128]
  - - [3520, 64, 1, 64, 3520, 3520, 64, 64]
    - [0, 3.249]
  - - [3648, 64, 1, 64, 3648, 3648, 64, 64]
    - [0, 3.363]
  - - [3776, 64, 1, 64, 3776, 3776, 64, 64]
    - [0, 3.478]
  - - [3904, 64, 1, 64, 3904, 3904, 64, 64]
    - [0, 3.389]
  - - [4032, 64, 1, 64, 4032, 4032, 64, 64]
    - [0, 3.479]
  - - [64, 192, 1, 64, 64, 64, 64, 64]
    - [1, 0.28]
  - - [192, 192, 1, 64, 192, 192, 64, 64]
    - [0, 0.788]
  - - [320, 192, 1, 64, 320, 320, 64, 64]
    - [0, 1.17]
  - - [448, 192, 1, 64, 448, 448, 64, 64]
    - [0, 1.639]
  - - [576, 192, 1, 64, 576, 576, 64, 64]
    - [0, 1.844]
  - - [704, 192, 1, 64, 704, 704, 64, 64]
    - [0, 2.246]
  - - [832, 192, 1, 64, 832, 832, 64, 64]
    - [0, 2.457]
  - - [960, 192, 1, 64, 960, 960, 64, 64]
    - [0, 2.814]
  - - [1088, 192, 1, 64, 1088, 1088, 64, 64]
    - [0, 2.953]
  - - [1216, 192, 1, 64, 1216, 1216, 64, 64]
    - [0, 3.283]
  - - [1344, 192, 1, 64, 1344, 1344, 64, 64]
    - [0, 3.474]
  - - [1472, 192, 1, 64, 1472, 1472, 64, 64]
    - [0, 3.769]
  - - [1600, 192, 1, 64, 1600, 1600, 64, 64]
    - [0, 3.852]
  - - [1728, 192, 1, 64, 1728, 1728, 64, 64]
    - [0, 4.131]
  - - [1856, 192, 1, 64, 1856, 1856, 64, 64]
    - [0, 4.179]
  - - [1984, 192, 1, 64, 1984, 1984, 64, 64]
    - [0, 4.441]
  - - [2112, 192, 1, 64, 2112, 2112, 64, 64]
    - [0, 4.5]
  - - [2240, 192, 1, 64, 2240, 2240, 64, 64]
    - [0, 4.549]
  - - [2368, 192, 1, 64, 2368, 2368, 64, 64]
    - [2, 3.62]
  - - [2496, 192, 1, 64, 2496, 2496, 64, 64]
    - [3, 3.797]
  - - [2624, 192, 1, 64, 2624, 2624, 64, 64]
    - [0, 4.011]
  - - [2752, 192, 1, 64, 2752, 2752, 64, 64]
    - [0, 4.209]
  - - [2880, 192, 1, 64, 2880, 2880, 64, 64]
    - [3, 4.328]
  - - [3008, 192, 1, 64, 3008, 3008, 64, 64]
    - [0, 5.314]
  - - [3136, 192, 1, 64, 3136, 3136, 64, 64]
    - [0, 4.791]
  - - [3264, 192, 1, 64, 3264, 3264, 64, 64]
    - [0, 5.008]
  - - [3392, 192, 1, 64, 3392, 3392, 64, 64]
    - [0, 5.198]
  - - [3520, 192, 1, 64, 3520, 3520, 64, 64]
    - [0, 5.507]
  - - [3648, 192, 1, 64, 3648, 3648, 64, 64]
    - [0, 5.555]
  - - [3776, 192, 1, 64, 3776, 3776, 64, 64]
    - [0, 5.781]
  - - [3904, 192, 1, 64, 3904, 3904, 64, 64]
    - [0, 5.809]
  - - [4032, 192, 1, 64, 4032, 4032, 64, 64]
    - [0, 5.878]
  - - [64, 320, 1, 64, 64, 64, 64, 64]
    - [2, 0.085]
  - - [192, 320, 1, 64, 192, 192, 64, 64]
    - [1, 0.253]
  - - [320, 320, 1, 64, 320, 320, 64, 64]
    - [1, 0.421]
  - - [448, 320, 1, 64, 448, 448, 64, 64]
    - [2, 0.594]
  - - [576, 320, 1, 64, 576, 576, 64, 64]
    - [0, 0.762]
  - - [704, 320, 1, 64, 704, 704, 64, 64]
    - [1, 1.791]
  - - [832, 320, 1, 64, 832, 832, 64, 64]
    - [3, 2.111]
  - - [960, 320, 1, 64, 960, 960, 64, 64]
    - [1, 2.438]
  - - [1088, 320, 1, 64, 1088, 1088, 64, 64]
    - [3, 2.782]
  - - [1216, 320, 1, 64, 1216, 1216, 64, 64]
    - [0, 3.1]
  - - [1344, 320, 1, 64, 1344, 1344, 64, 64]
    - [3, 3.407]
  - - [1472, 320, 1, 64, 1472, 1472, 64, 64]
    - [0, 3.759]
  - - [1600, 320, 1, 64, 1600, 1600, 64, 64]
    - [0, 4.065]
  - - [1728, 320, 1, 64, 1728, 1728, 64, 64]
    - [0, 4.393]
  - - [1856, 320, 1, 64, 1856, 1856, 64, 64]
    - [0, 4.724]
  - - [1984, 320, 1, 64, 1984, 1984, 64, 64]
    - [0, 5.014]
  - - [2112, 320, 1, 64, 2112, 2112, 64, 64]
    - [0, 5.68]
  - - [2240, 320, 1, 64, 2240, 2240, 64, 64]
    - [0, 5.727]
  - - [2368, 320, 1, 64, 2368, 2368, 64, 64]
    - [0, 5.778]
  - - [2496, 320, 1, 64, 2496, 2496, 64, 64]
    - [0, 5.906]
  - - [2624, 320, 1, 64, 2624, 2624, 64, 64]
    - [0, 6.033]
  - - [2752, 320, 1, 64, 2752, 2752, 64, 64]
    - [0, 6.151]
  - - [2880, 320, 1, 64, 2880, 2880, 64, 64]
    - [0, 6.259]
  - - [3008, 320, 1, 64, 3008, 3008, 64, 64]
    - [0, 6.329]
  - - [3136, 320, 1, 64, 3136, 3136, 64, 64]
    - [0, 6.407]
  - - [3264, 320, 1, 64, 3264, 3264, 64, 64]
    - [0, 6.44]
  - - [3392, 320, 1, 64, 3392, 3392, 64, 64]
    - [0, 6.554]
  - - [3520, 320, 1, 64, 3520, 3520, 64, 64]
    - [0, 6.694]
  - - [3648, 320, 1, 64, 3648, 3648, 64, 64]
    - [0, 6.668]
  - - [3776, 320, 1, 64, 3776, 3776, 64, 64]
    - [0, 6.745]
  - - [3904, 320, 1, 64, 3904, 3904, 64, 64]
    - [0, 6.846]
  - - [4032, 320, 1, 64, 4032, 4032, 64, 64]
    - [0, 6.278]
  - - [64, 448, 1, 64, 64, 64, 64, 64]
    - [2, 0.119]
  - - [192, 448, 1, 64, 192, 192, 64, 64]
    - [2, 0.355]
  - - [320, 448, 1, 64, 320, 320, 64, 64]
    - [0, 0.594]
  - - [448, 448, 1, 64, 448, 448, 64, 64]
    - [1, 0.845]
  - - [576, 448, 1, 64, 576, 576, 64, 64]
    - [0, 1.059]
  - - [704, 448, 1, 64, 704, 704, 64, 64]
    - [3, 2.518]
  - - [832, 448, 1, 64, 832, 832, 64, 64]
    - [2, 2.977]
  - - [960, 448, 1, 64, 960, 960, 64, 64]
    - [0, 3.448]
  - - [1088, 448, 1, 64, 1088, 1088, 64, 64]
    - [0, 3.917]
  - - [1216, 448, 1, 64, 1216, 1216, 64, 64]
    - [3, 4.287]
  - - [1344, 448, 1, 64, 1344, 1344, 64, 64]
    - [0, 4.799]
  - - [1472, 448, 1, 64, 1472, 1472, 64, 64]
    - [0, 5.279]
  - - [1600, 448, 1, 64, 1600, 1600, 64, 64]
    - [3, 4.708]
  - - [1728, 448, 1, 64, 1728, 1728, 64, 64]
    - [0, 5.848]
  - - [1856, 448, 1, 64, 1856, 1856, 64, 64]
    - [0, 6.057]
  - - [1984, 448, 1, 64, 1984, 1984, 64, 64]
    - [0, 6.219]
  - - [2112, 448, 1, 64, 2112, 2112, 64, 64]
    - [0, 6.249]
  - - [2240, 448, 1, 64, 2240, 2240, 64, 64]
    - [0, 6.473]
  - - [2368, 448, 1, 64, 2368, 2368, 64, 64]
    - [0, 6.497]
  - - [2496, 448, 1, 64, 2496, 2496, 64, 64]
    - [0, 6.662]
  - - [2624, 448, 1, 64, 2624, 2624, 64, 64]
    - [0, 6.718]
  - - [2752, 448, 1, 64, 2752, 2752, 64, 64]
    - [0, 6.854]
  - - [2880, 448, 1, 64, 2880, 2880, 64, 64]
    - [0, 6.887]
  - - [3008, 448, 1, 64, 3008, 3008, 64, 64]
    - [0, 7.028]
  - - [3136, 448, 1, 64, 3136, 3136, 64, 64]
    - [0, 7.069]
  - - [3264, 448, 1, 64, 3264, 3264, 64, 64]
    - [0, 7.102]
  - - [3392, 448, 1, 64, 3392, 3392, 64, 64]
    - [0, 7.212]
  - - [3520, 448, 1, 64, 3520, 3520, 64, 64]
    - [0, 7.275]
  - - [3648, 448, 1, 64, 3648, 3648, 64, 64]
    - [0, 7.324]
  - - [3776, 448, 1, 64, 3776, 3776, 64, 64]
    - [0, 7.33]
  - - [3904, 448, 1, 64, 3904, 3904, 64, 64]
    - [0, 7.419]
  - - [4032, 448, 1, 64, 4032, 4032, 64, 64]
    - [0, 7.446]
  - - [64, 576, 1, 64, 64, 64, 64, 64]
    - [2, 0.763]
  - - [192, 576, 1, 64, 192, 192, 64, 64]
    - [0, 1.9]
  - - [320, 576, 1, 64, 320, 320, 64, 64]
    - [0, 2.875]
  - - [448, 576, 1, 64, 448, 448, 64, 64]
    - [0, 3.491]
  - - [576, 576, 1, 64, 576, 576, 64, 64]
    - [0, 4.115]
  - - [704, 576, 1, 64, 704, 704, 64, 64]
    - [2, 3.225]
  - - [832, 576, 1, 64, 832, 832, 64, 64]
    - [2, 3.803]
  - - [960, 576, 1, 64, 960, 960, 64, 64]
    - [0, 4.437]
  - - [1088, 576, 1, 64, 1088, 1088, 64, 64]
    - [0, 5.0]
  - - [1216, 576, 1, 64, 1216, 1216, 64, 64]
    - [0, 5.555]
  - - [1344, 576, 1, 64, 1344, 1344, 64, 64]
    - [0, 5.89]
  - - [1472, 576, 1, 64, 1472, 1472, 64, 64]
    - [0, 5.953]
  - - [1600, 576, 1, 64, 1600, 1600, 64, 64]
    - [0, 6.296]
  - - [1728, 576, 1, 64, 1728, 1728, 64, 64]
    - [0, 6.372]
  - - [1856, 576, 1, 64, 1856, 1856, 64, 64]
    - [0, 6.529]
  - - [1984, 576, 1, 64, 1984, 1984, 64, 64]
    - [0, 6.735]
  - - [2112, 576, 1, 64, 2112, 2112, 64, 64]
    - [0, 6.766]
  - - [2240, 576, 1, 64, 2240, 2240, 64, 64]
    - [0, 6.89]
  - - [2368, 576, 1, 64, 2368, 2368, 64, 64]
    - [0, 6.974]
  - - [2496, 576, 1, 64, 2496, 2496, 64, 64]
    - [0, 7.115]
  - - [2624, 576, 1, 64, 2624, 2624, 64, 64]
    - [0, 7.194]
  - - [2752, 576, 1, 64, 2752, 2752, 64, 64]
    - [0, 7.229]
  - - [2880, 576, 1, 64, 2880, 2880, 64, 64]
    - [0, 7.281]
  - - [3008, 576, 1, 64, 3008, 3008, 64, 64]
    - [0, 7.419]
  - - [3136, 576, 1, 64, 3136, 3136, 64, 64]
    - [0, 7.438]
  - - [3264, 576, 1, 64, 3264, 3264, 64, 64]
    - [0, 7.527]
  - - [3392, 576, 1, 64, 3392, 3392, 64, 64]
    - [0, 7.555]
  - - [3520, 576, 1, 64, 3520, 3520, 64, 64]
    - [0, 7.669]
  - - [3648, 576, 1, 64, 3648, 3648, 64, 64]
    - [0, 7.655]
  - - [3776, 576, 1, 64, 3776, 3776, 64, 64]
    - [0, 7.632]
  - - [3904, 576, 1, 64, 3904, 3904, 64, 64]
    - [0, 7.745]
  - - [4032, 576, 1, 64, 4032, 4032, 64, 64]
    - [0, 7.761]
  - - [64, 704, 1, 64, 64, 64, 64, 64]
    - [0, 0.958]
  - - [192, 704, 1, 64, 192, 192, 64, 64]
    - [0, 2.314]
  - - [320, 704, 1, 64, 320, 320, 64, 64]
    - [3, 0.93]
  - - [448, 704, 1, 64, 448, 448, 64, 64]
    - [2, 2.518]
  - - [576, 704, 1, 64, 576, 576, 64, 64]
    - [3, 3.227]
  - - [704, 704, 1, 64, 704, 704, 64, 64]
    - [0, 3.959]
  - - [832, 704, 1, 64, 832, 832, 64, 64]
    - [0, 4.681]
  - - [960, 704, 1, 64, 960, 960, 64, 64]
    - [0, 5.397]
  - - [1088, 704, 1, 64, 1088, 1088, 64, 64]
    - [0, 5.848]
  - - [1216, 704, 1, 64, 1216, 1216, 64, 64]
    - [0, 6.04]
  - - [1344, 704, 1, 64, 1344, 1344, 64, 64]
    - [0, 6.356]
  - - [1472, 704, 1, 64, 1472, 1472, 64, 64]
    - [0, 6.474]
  - - [1600, 704, 1, 64, 1600, 1600, 64, 64]
    - [0, 6.646]
  - - [1728, 704, 1, 64, 1728, 1728, 64, 64]
    - [0, 6.797]
  - - [1856, 704, 1, 64, 1856, 1856, 64, 64]
    - [0, 6.904]
  - - [1984, 704, 1, 64, 1984, 1984, 64, 64]
    - [0, 7.08]
  - - [2112, 704, 1, 64, 2112, 2112, 64, 64]
    - [0, 7.161]
  - - [2240, 704, 1, 64, 2240, 2240, 64, 64]
    - [0, 7.251]
  - - [2368, 704, 1, 64, 2368, 2368, 64, 64]
    - [0, 7.326]
  - - [2496, 704, 1, 64, 2496, 2496, 64, 64]
    - [0, 7.383]
  - - [2624, 704, 1, 64, 2624, 2624, 64, 64]
    - [0, 7.474]
  - - [2752, 704, 1, 64, 2752, 2752, 64, 64]
    - [0, 7.573]
  - - [2880, 704, 1, 64, 2880, 2880, 64, 64]
    - [0, 7.728]
  - - [3008, 704, 1, 64, 3008, 3008, 64, 64]
    - [0, 7.741]
  - - [3136, 704, 1, 64, 3136, 3136, 64, 64]
    - [0, 7.761]
  - - [3264, 704, 1, 64, 3264, 3264, 64, 64]
    - [0, 7.8]
  - - [3392, 704, 1, 64, 3392, 3392, 64, 64]
    - [0, 7.854]
  - - [3520, 704, 1, 64, 3520, 3520, 64, 64]
    - [0, 7.851]
  - - [3648, 704, 1, 64, 3648, 3648, 64, 64]
    - [0, 7.944]
  - - [3776, 704, 1, 64, 3776, 3776, 64, 64]
    - [0, 7.961]
  - - [3904, 704, 1, 64, 3904, 3904, 64, 64]
    - [0, 8.037]
  - - [4032, 704, 1, 64, 4032, 4032, 64, 64]
    - [0, 7.442]
  - - [64, 832, 1, 64, 64, 64, 64, 64]
    - [2, 0.22]
  - - [192, 832, 1, 64, 192, 192, 64, 64]
    - [0, 0.663]
  - - [320, 832, 1, 64, 320, 320, 64, 64]
    - [1, 2.127]
  - - [448, 832, 1, 64, 448, 448, 64, 64]
    - [3, 2.97]
  - - [576, 832, 1, 64, 576, 576, 64, 64]
    - [0, 3.817]
  - - [704, 832, 1, 64, 704, 704, 64, 64]
    - [3, 4.48]
  - - [832, 832, 1, 64, 832, 832, 64, 64]
    - [0, 5.515]
  - - [960, 832, 1, 64, 960, 960, 64, 64]
    - [0, 5.891]
  - - [1088, 832, 1, 64, 1088, 1088, 64, 64]
    - [0, 6.188]
  - - [1216, 832, 1, 64, 1216, 1216, 64, 64]
    - [0, 6.373]
  - - [1344, 832, 1, 64, 1344, 1344, 64, 64]
    - [0, 6.614]
  - - [1472, 832, 1, 64, 1472, 1472, 64, 64]
    - [0, 6.795]
  - - [1600, 832, 1, 64, 1600, 1600, 64, 64]
    - [0, 6.981]
  - - [1728, 832, 1, 64, 1728, 1728, 64, 64]
    - [0, 7.098]
  - - [1856, 832, 1, 64, 1856, 1856, 64, 64]
    - [0, 7.137]
  - - [1984, 832, 1, 64, 1984, 1984, 64, 64]
    - [0, 7.295]
  - - [2112, 832, 1, 64, 2112, 2112, 64, 64]
    - [0, 7.434]
  - - [2240, 832, 1, 64, 2240, 2240, 64, 64]
    - [0, 7.495]
  - - [2368, 832, 1, 64, 2368, 2368, 64, 64]
    - [0, 7.581]
  - - [2496, 832, 1, 64, 2496, 2496, 64, 64]
    - [0, 7.612]
  - - [2624, 832, 1, 64, 2624, 2624, 64, 64]
    - [0, 7.679]
  - - [2752, 832, 1, 64, 2752, 2752, 64, 64]
    - [0, 7.804]
  - - [2880, 832, 1, 64, 2880, 2880, 64, 64]
    - [0, 7.823]
  - - [3008, 832, 1, 64, 3008, 3008, 64, 64]
    - [0, 7.913]
  - - [3136, 832, 1, 64, 3136, 3136, 64, 64]
    - [0, 7.979]
  - - [3264, 832, 1, 64, 3264, 3264, 64, 64]
    - [0, 8.011]
  - - [3392, 832, 1, 64, 3392, 3392, 64, 64]
    - [0, 8.075]
  - - [3520, 832, 1, 64, 3520, 3520, 64, 64]
    - [0, 8.085]
  - - [3648, 832, 1, 64, 3648, 3648, 64, 64]
    - [0, 8.245]
  - - [3776, 832, 1, 64, 3776, 3776, 64, 64]
    - [0, 8.151]
  - - [3904, 832, 1, 64, 3904, 3904, 64, 64]
    - [0, 8.246]
  - - [4032, 832, 1, 64, 4032, 4032, 64, 64]
    - [0, 8.281]
  - - [64, 960, 1, 64, 64, 64, 64, 64]
    - [1, 0.253]
  - - [192, 960, 1, 64, 192, 192, 64, 64]
    - [2, 0.761]
  - - [320, 960, 1, 64, 320, 320, 64, 64]
    - [3, 2.459]
  - - [448, 960, 1, 64, 448, 448, 64, 64]
    - [3, 3.434]
  - - [576, 960, 1, 64, 576, 576, 64, 64]
    - [0, 4.418]
  - - [704, 960, 1, 64, 704, 704, 64, 64]
    - [0, 5.402]
  - - [832, 960, 1, 64, 832, 832, 64, 64]
    - [0, 5.942]
  - - [960, 960, 1, 64, 960, 960, 64, 64]
    - [0, 6.238]
  - - [1088, 960, 1, 64, 1088, 1088, 64, 64]
    - [0, 6.465]
  - - [1216, 960, 1, 64, 1216, 1216, 64, 64]
    - [0, 6.63]
  - - [1344, 960, 1, 64, 1344, 1344, 64, 64]
    - [0, 6.894]
  - - [1472, 960, 1, 64, 1472, 1472, 64, 64]
    - [0, 7.063]
  - - [1600, 960, 1, 64, 1600, 1600, 64, 64]
    - [0, 7.228]
  - - [1728, 960, 1, 64, 1728, 1728, 64, 64]
    - [0, 7.344]
  - - [1856, 960, 1, 64, 1856, 1856, 64, 64]
    - [0, 7.391]
  - - [1984, 960, 1, 64, 1984, 1984, 64, 64]
    - [0, 7.5]
  - - [2112, 960, 1, 64, 2112, 2112, 64, 64]
    - [0, 7.711]
  - - [2240, 960, 1, 64, 2240, 2240, 64, 64]
    - [0, 7.702]
  - - [2368, 960, 1, 64, 2368, 2368, 64, 64]
    - [0, 7.777]
  - - [2496, 960, 1, 64, 2496, 2496, 64, 64]
    - [0, 7.843]
  - - [2624, 960, 1, 64, 2624, 2624, 64, 64]
    - [0, 7.931]
  - - [2752, 960, 1, 64, 2752, 2752, 64, 64]
    - [0, 7.935]
  - - [2880, 960, 1, 64, 2880, 2880, 64, 64]
    - [0, 8.051]
  - - [3008, 960, 1, 64, 3008, 3008, 64, 64]
    - [0, 8.075]
  - - [3136, 960, 1, 64, 3136, 3136, 64, 64]
    - [0, 8.191]
  - - [3264, 960, 1, 64, 3264, 3264, 64, 64]
    - [0, 8.181]
  - - [3392, 960, 1, 64, 3392, 3392, 64, 64]
    - [0, 8.291]
  - - [3520, 960, 1, 64, 3520, 3520, 64, 64]
    - [0, 8.352]
  - - [3648, 960, 1, 64, 3648, 3648, 64, 64]
    - [0, 8.403]
  - - [3776, 960, 1, 64, 3776, 3776, 64, 64]
    - [0, 8.423]
  - - [3904, 960, 1, 64, 3904, 3904, 64, 64]
    - [0, 8.474]
  - - [4032, 960, 1, 64, 4032, 4032, 64, 64]
    - [0, 8.372]
  - - [64, 1088, 1, 64, 64, 64, 64, 64]
    - [3, 0.289]
  - - [192, 1088, 1, 64, 192, 192, 64, 64]
    - [3, 1.667]
  - - [320, 1088, 1, 64, 320, 320, 64, 64]
    - [2, 2.784]
  - - [448, 1088, 1, 64, 448, 448, 64, 64]
    - [3, 3.884]
  - - [576, 1088, 1, 64, 576, 576, 64, 64]
    - [0, 5.015]
  - - [704, 1088, 1, 64, 704, 704, 64, 64]
    - [0, 5.829]
  - - [832, 1088, 1, 64, 832, 832, 64, 64]
    - [0, 6.184]
  - - [960, 1088, 1, 64, 960, 960, 64, 64]
    - [0, 6.449]
  - - [1088, 1088, 1, 64, 1088, 1088, 64, 64]
    - [0, 6.719]
  - - [1216, 1088, 1, 64, 1216, 1216, 64, 64]
    - [0, 6.948]
  - - [1344, 1088, 1, 64, 1344, 1344, 64, 64]
    - [0, 7.094]
  - - [1472, 1088, 1, 64, 1472, 1472, 64, 64]
    - [0, 7.283]
  - - [1600, 1088, 1, 64, 1600, 1600, 64, 64]
    - [0, 7.45]
  - - [1728, 1088, 1, 64, 1728, 1728, 64, 64]
    - [0, 7.479]
  - - [1856, 1088, 1, 64, 1856, 1856, 64, 64]
    - [0, 7.676]
  - - [1984, 1088, 1, 64, 1984, 1984, 64, 64]
    - [0, 7.76]
  - - [2112, 1088, 1, 64, 2112, 2112, 64, 64]
    - [0, 7.805]
  - - [2240, 1088, 1, 64, 2240, 2240, 64, 64]
    - [0, 7.825]
  - - [2368, 1088, 1, 64, 2368, 2368, 64, 64]
    - [0, 7.884]
  - - [2496, 1088, 1, 64, 2496, 2496, 64, 64]
    - [0, 8.008]
  - - [2624, 1088, 1, 64, 2624, 2624, 64, 64]
    - [0, 8.063]
  - - [2752, 1088, 1, 64, 2752, 2752, 64, 64]
    - [0, 8.168]
  - - [2880, 1088, 1, 64, 2880, 2880, 64, 64]
    - [0, 8.146]
  - - [3008, 1088, 1, 64, 3008, 3008, 64, 64]
    - [0, 8.426]
  - - [3136, 1088, 1, 64, 3136, 3136, 64, 64]
    - [0, 8.336]
  - - [3264, 1088, 1, 64, 3264, 3264, 64, 64]
    - [0, 8.447]
  - - [3392, 1088, 1, 64, 3392, 3392, 64, 64]
    - [0, 8.607]
  - - [3520, 1088, 1, 64, 3520, 3520, 64, 64]
    - [0, 8.352]
  - - [3648, 1088, 1, 64, 3648, 3648, 64, 64]
    - [0, 8.661]
  - - [3776, 1088, 1, 64, 3776, 3776, 64, 64]
    - [0, 8.419]
  - - [3904, 1088, 1, 64, 3904, 3904, 64, 64]
    - [0, 8.687]
  - - [4032, 1088, 1, 64, 4032, 4032, 64, 64]
    - [0, 8.71]
  - - [64, 1216, 1, 64, 64, 64, 64, 64]
    - [3, 0.322]
  - - [192, 1216, 1, 64, 192, 192, 64, 64]
    - [1, 1.873]
  - - [320, 1216, 1, 64, 320, 320, 64, 64]
    - [3, 3.122]
  - - [448, 1216, 1, 64, 448, 448, 64, 64]
    - [3, 4.331]
  - - [576, 1216, 1, 64, 576, 576, 64, 64]
    - [0, 5.669]
  - - [704, 1216, 1, 64, 704, 704, 64, 64]
    - [0, 6.038]
  - - [832, 1216, 1, 64, 832, 832, 64, 64]
    - [0, 6.399]
  - - [960, 1216, 1, 64, 960, 960, 64, 64]
    - [0, 6.673]
  - - [1088, 1216, 1, 64, 1088, 1088, 64, 64]
    - [0, 6.931]
  - - [1216, 1216, 1, 64, 1216, 1216, 64, 64]
    - [0, 7.07]
  - - [1344, 1216, 1, 64, 1344, 1344, 64, 64]
    - [0, 7.312]
  - - [1472, 1216, 1, 64, 1472, 1472, 64, 64]
    - [0, 7.421]
  - - [1600, 1216, 1, 64, 1600, 1600, 64, 64]
    - [0, 7.568]
  - - [1728, 1216, 1, 64, 1728, 1728, 64, 64]
    - [0, 7.666]
  - - [1856, 1216, 1, 64, 1856, 1856, 64, 64]
    - [0, 7.776]
  - - [1984, 1216, 1, 64, 1984, 1984, 64, 64]
    - [0, 7.896]
  - - [2112, 1216, 1, 64, 2112, 2112, 64, 64]
    - [0, 7.917]
  - - [2240, 1216, 1, 64, 2240, 2240, 64, 64]
    - [0, 8.028]
  - - [2368, 1216, 1, 64, 2368, 2368, 64, 64]
    - [0, 8.3]
  - - [2496, 1216, 1, 64, 2496, 2496, 64, 64]
    - [0, 8.125]
  - - [2624, 1216, 1, 64, 2624, 2624, 64, 64]
    - [0, 8.277]
  - - [2752, 1216, 1, 64, 2752, 2752, 64, 64]
    - [0, 8.373]
  - - [2880, 1216, 1, 64, 2880, 2880, 64, 64]
    - [0, 8.531]
  - - [3008, 1216, 1, 64, 3008, 3008, 64, 64]
    - [0, 8.364]
  - - [3136, 1216, 1, 64, 3136, 3136, 64, 64]
    - [0, 8.441]
  - - [3264, 1216, 1, 64, 3264, 3264, 64, 64]
    - [0, 8.706]
  - - [3392, 1216, 1, 64, 3392, 3392, 64, 64]
    - [0, 8.583]
  - - [3520, 1216, 1, 64, 3520, 3520, 64, 64]
    - [0, 8.591]
  - - [3648, 1216, 1, 64, 3648, 3648, 64, 64]
    - [0, 8.871]
  - - [3776, 1216, 1, 64, 3776, 3776, 64, 64]
    - [0, 8.513]
  - - [3904, 1216, 1, 64, 3904, 3904, 64, 64]
    - [0, 8.517]
  - - [4032, 1216, 1, 64, 4032, 4032, 64, 64]
    - [0, 8.559]
  - - [64, 1344, 1, 64, 64, 64, 64, 64]
    - [2, 0.357]
  - - [192, 1344, 1, 64, 192, 192, 64, 64]
    - [2, 3.077]
  - - [320, 1344, 1, 64, 320, 320, 64, 64]
    - [3, 3.936]
  - - [448, 1344, 1, 64, 448, 448, 64, 64]
    - [0, 5.369]
  - - [576, 1344, 1, 64, 576, 576, 64, 64]
    - [0, 5.884]
  - - [704, 1344, 1, 64, 704, 704, 64, 64]
    - [0, 6.293]
  - - [832, 1344, 1, 64, 832, 832, 64, 64]
    - [0, 6.644]
  - - [960, 1344, 1, 64, 960, 960, 64, 64]
    - [0, 6.847]
  - - [1088, 1344, 1, 64, 1088, 1088, 64, 64]
    - [0, 7.109]
  - - [1216, 1344, 1, 64, 1216, 1216, 64, 64]
    - [0, 7.313]
  - - [1344, 1344, 1, 64, 1344, 1344, 64, 64]
    - [0, 7.46]
  - - [1472, 1344, 1, 64, 1472, 1472, 64, 64]
    - [0, 7.572]
  - - [1600, 1344, 1, 64, 1600, 1600, 64, 64]
    - [0, 7.748]
  - - [1728, 1344, 1, 64, 1728, 1728, 64, 64]
    - [0, 7.823]
  - - [1856, 1344, 1, 64, 1856, 1856, 64, 64]
    - [0, 7.916]
  - - [1984, 1344, 1, 64, 1984, 1984, 64, 64]
    - [0, 8.139]
  - - [2112, 1344, 1, 64, 2112, 2112, 64, 64]
    - [0, 8.031]
  - - [2240, 1344, 1, 64, 2240, 2240, 64, 64]
    - [0, 8.096]
  - - [2368, 1344, 1, 64, 2368, 2368, 64, 64]
    - [0, 8.209]
  - - [2496, 1344, 1, 64, 2496, 2496, 64, 64]
    - [0, 8.336]
  - - [2624, 1344, 1, 64, 2624, 2624, 64, 64]
    - [0, 8.34]
  - - [2752, 1344, 1, 64, 2752, 2752, 64, 64]
    - [0, 8.521]
  - - [2880, 1344, 1, 64, 2880, 2880, 64, 64]
    - [0, 8.498]
  - - [3008, 1344, 1, 64, 3008, 3008, 64, 64]
    - [0, 8.669]
  - - [3136, 1344, 1, 64, 3136, 3136, 64, 64]
    - [0, 8.503]
  - - [3264, 1344, 1, 64, 3264, 3264, 64, 64]
    - [0, 8.678]
  - - [3392, 1344, 1, 64, 3392, 3392, 64, 64]
    - [0, 8.288]
  - - [3520, 1344, 1, 64, 3520, 3520, 64, 64]
    - [0, 8.53]
  - - [3648, 1344, 1, 64, 3648, 3648, 64, 64]
    - [0, 8.479]
  - - [3776, 1344, 1, 64, 3776, 3776, 64, 64]
    - [0, 8.385]
  - - [3904, 1344, 1, 64, 3904, 3904, 64, 64]
    - [0, 8.358]
  - - [4032, 1344, 1, 64, 4032, 4032, 64, 64]
    - [0, 8.555]
  - - [64, 1472, 1, 64, 64, 64, 64, 64]
    - [0, 1.774]
  - - [192, 1472, 1, 64, 192, 192, 64, 64]
    - [0, 3.767]
  - - [320, 1472, 1, 64, 320, 320, 64, 64]
    - [0, 4.646]
  - - [448, 1472, 1, 64, 448, 448, 64, 64]
    - [0, 5.527]
  - - [576, 1472, 1, 64, 576, 576, 64, 64]
    - [0, 5.97]
  - - [704, 1472, 1, 64, 704, 704, 64, 64]
    - [0, 6.367]
  - - [832, 1472, 1, 64, 832, 832, 64, 64]
    - [0, 6.74]
  - - [960, 1472, 1, 64, 960, 960, 64, 64]
    - [0, 6.972]
  - - [1088, 1472, 1, 64, 1088, 1088, 64, 64]
    - [0, 7.225]
  - - [1216, 1472, 1, 64, 1216, 1216, 64, 64]
    - [0, 7.374]
  - - [1344, 1472, 1, 64, 1344, 1344, 64, 64]
    - [0, 7.548]
  - - [1472, 1472, 1, 64, 1472, 1472, 64, 64]
    - [0, 7.649]
  - - [1600, 1472, 1, 64, 1600, 1600, 64, 64]
    - [0, 7.752]
  - - [1728, 1472, 1, 64, 1728, 1728, 64, 64]
    - [0, 7.805]
  - - [1856, 1472, 1, 64, 1856, 1856, 64, 64]
    - [0, 7.976]
  - - [1984, 1472, 1, 64, 1984, 1984, 64, 64]
    - [0, 8.302]
  - - [2112, 1472, 1, 64, 2112, 2112, 64, 64]
    - [0, 8.269]
  - - [2240, 1472, 1, 64, 2240, 2240, 64, 64]
    - [0, 8.166]
  - - [2368, 1472, 1, 64, 2368, 2368, 64, 64]
    - [0, 8.367]
  - - [2496, 1472, 1, 64, 2496, 2496, 64, 64]
    - [0, 8.498]
  - - [2624, 1472, 1, 64, 2624, 2624, 64, 64]
    - [0, 8.323]
  - - [2752, 1472, 1, 64, 2752, 2752, 64, 64]
    - [0, 8.618]
  - - [2880, 1472, 1, 64, 2880, 2880, 64, 64]
    - [0, 8.495]
  - - [3008, 1472, 1, 64, 3008, 3008, 64, 64]
    - [0, 8.364]
  - - [3136, 1472, 1, 64, 3136, 3136, 64, 64]
    - [0, 8.482]
  - - [3264, 1472, 1, 64, 3264, 3264, 64, 64]
    - [0, 8.443]
  - - [3392, 1472, 1, 64, 3392, 3392, 64, 64]
    - [0, 8.534]
  - - [3520, 1472, 1, 64, 3520, 3520, 64, 64]
    - [0, 8.47]
  - - [3648, 1472, 1, 64, 3648, 3648, 64, 64]
    - [0, 8.349]
  - - [3776, 1472, 1, 64, 3776, 3776, 64, 64]
    - [0, 8.414]
  - - [3904, 1472, 1, 64, 3904, 3904, 64, 64]
    - [0, 8.609]
  - - [4032, 1472, 1, 64, 4032, 4032, 64, 64]
    - [0, 8.344]
  - - [64, 1600, 1, 64, 64, 64, 64, 64]
    - [2, 1.685]
  - - [192, 1600, 1, 64, 192, 192, 64, 64]
    - [0, 3.804]
  - - [320, 1600, 1, 64, 320, 320, 64, 64]
    - [0, 4.989]
  - - [448, 1600, 1, 64, 448, 448, 64, 64]
    - [0, 5.682]
  - - [576, 1600, 1, 64, 576, 576, 64, 64]
    - [0, 6.206]
  - - [704, 1600, 1, 64, 704, 704, 64, 64]
    - [0, 6.538]
  - - [832, 1600, 1, 64, 832, 832, 64, 64]
    - [0, 6.839]
  - - [960, 1600, 1, 64, 960, 960, 64, 64]
    - [0, 7.052]
  - - [1088, 1600, 1, 64, 1088, 1088, 64, 64]
    - [0, 7.275]
  - - [1216, 1600, 1, 64, 1216, 1216, 64, 64]
    - [0, 7.501]
  - - [1344, 1600, 1, 64, 1344, 1344, 64, 64]
    - [0, 7.625]
  - - [1472, 1600, 1, 64, 1472, 1472, 64, 64]
    - [0, 7.712]
  - - [1600, 1600, 1, 64, 1600, 1600, 64, 64]
    - [0, 7.859]
  - - [1728, 1600, 1, 64, 1728, 1728, 64, 64]
    - [0, 8.084]
  - - [1856, 1600, 1, 64, 1856, 1856, 64, 64]
    - [0, 8.179]
  - - [1984, 1600, 1, 64, 1984, 1984, 64, 64]
    - [0, 8.286]
  - - [2112, 1600, 1, 64, 2112, 2112, 64, 64]
    - [0, 8.31]
  - - [2240, 1600, 1, 64, 2240, 2240, 64, 64]
    - [0, 8.314]
  - - [2368, 1600, 1, 64, 2368, 2368, 64, 64]
    - [0, 8.301]
  - - [2496, 1600, 1, 64, 2496, 2496, 64, 64]
    - [0, 8.314]
  - - [2624, 1600, 1, 64, 2624, 2624, 64, 64]
    - [0, 8.253]
  - - [2752, 1600, 1, 64, 2752, 2752, 64, 64]
    - [0, 8.582]
  - - [2880, 1600, 1, 64, 2880, 2880, 64, 64]
    - [0, 8.32]
  - - [3008, 1600, 1, 64, 3008, 3008, 64, 64]
    - [0, 8.398]
  - - [3136, 1600, 1, 64, 3136, 3136, 64, 64]
    - [0, 8.657]
  - - [3264, 1600, 1, 64, 3264, 3264, 64, 64]
    - [0, 8.63]
  - - [3392, 1600, 1, 64, 3392, 3392, 64, 64]
    - [0, 8.277]
  - - [3520, 1600, 1, 64, 3520, 3520, 64, 64]
    - [0, 8.303]
  - - [3648, 1600, 1, 64, 3648, 3648, 64, 64]
    - [0, 8.549]
  - - [3776, 1600, 1, 64, 3776, 3776, 64, 64]
    - [0, 8.594]
  - - [3904, 1600, 1, 64, 3904, 3904, 64, 64]
    - [0, 8.45]
  - - [4032, 1600, 1, 64, 4032, 4032, 64, 64]
    - [0, 8.573]
  - - [64, 1728, 1, 64, 64, 64, 64, 64]
    - [0, 1.879]
  - - [192, 1728, 1, 64, 192, 192, 64, 64]
    - [0, 4.123]
  - - [320, 1728, 1, 64, 320, 320, 64, 64]
    - [0, 5.096]
  - - [448, 1728, 1, 64, 448, 448, 64, 64]
    - [0, 5.862]
  - - [576, 1728, 1, 64, 576, 576, 64, 64]
    - [0, 6.345]
  - - [704, 1728, 1, 64, 704, 704, 64, 64]
    - [0, 6.749]
  - - [832, 1728, 1, 64, 832, 832, 64, 64]
    - [0, 7.009]
  - - [960, 1728, 1, 64, 960, 960, 64, 64]
    - [0, 7.263]
  - - [1088, 1728, 1, 64, 1088, 1088, 64, 64]
    - [0, 7.416]
  - - [1216, 1728, 1, 64, 1216, 1216, 64, 64]
    - [0, 7.622]
  - - [1344, 1728, 1, 64, 1344, 1344, 64, 64]
    - [0, 7.688]
  - - [1472, 1728, 1, 64, 1472, 1472, 64, 64]
    - [0, 7.811]
  - - [1600, 1728, 1, 64, 1600, 1600, 64, 64]
    - [0, 7.902]
  - - [1728, 1728, 1, 64, 1728, 1728, 64, 64]
    - [0, 8.075]
  - - [1856, 1728, 1, 64, 1856, 1856, 64, 64]
    - [0, 8.23]
  - - [1984, 1728, 1, 64, 1984, 1984, 64, 64]
    - [0, 8.34]
  - - [2112, 1728, 1, 64, 2112, 2112, 64, 64]
    - [0, 8.465]
  - - [2240, 1728, 1, 64, 2240, 2240, 64, 64]
    - [0, 8.371]
  - - [2368, 1728, 1, 64, 2368, 2368, 64, 64]
    - [0, 8.402]
  - - [2496, 1728, 1, 64, 2496, 2496, 64, 64]
    - [0, 8.318]
  - - [2624, 1728, 1, 64, 2624, 2624, 64, 64]
    - [0, 8.353]
  - - [2752, 1728, 1, 64, 2752, 2752, 64, 64]
    - [0, 8.602]
  - - [2880, 1728, 1, 64, 2880, 2880, 64, 64]
    - [0, 8.48]
  - - [3008, 1728, 1, 64, 3008, 3008, 64, 64]
    - [0, 8.617]
  - - [3136, 1728, 1, 64, 3136, 3136, 64, 64]
    - [0, 8.391]
  - - [3264, 1728, 1, 64, 3264, 3264, 64, 64]
    - [0, 8.408]
  - - [3392, 1728, 1, 64, 3392, 3392, 64, 64]
    - [0, 8.495]
  - - [3520, 1728, 1, 64, 3520, 3520, 64, 64]
    - [0, 8.233]
  - - [3648, 1728, 1, 64, 3648, 3648, 64, 64]
    - [0, 8.479]
  - - [3776, 1728, 1, 64, 3776, 3776, 64, 64]
    - [0, 8.514]
  - - [3904, 1728, 1, 64, 3904, 3904, 64, 64]
    - [0, 8.617]
  - - [4032, 1728, 1, 64, 4032, 4032, 64, 64]
    - [0, 8.573]
  - - [64, 1856, 1, 64, 64, 64, 64, 64]
    - [2, 0.491]
  - - [192, 1856, 1, 64, 192, 192, 64, 64]
    - [1, 2.844]
  - - [320, 1856, 1, 64, 320, 320, 64, 64]
    - [0, 4.756]
  - - [448, 1856, 1, 64, 448, 448, 64, 64]
    - [0, 5.916]
  - - [576, 1856, 1, 64, 576, 576, 64, 64]
    - [0, 6.489]
  - - [704, 1856, 1, 64, 704, 704, 64, 64]
    - [0, 6.808]
  - - [832, 1856, 1, 64, 832, 832, 64, 64]
    - [0, 7.057]
  - - [960, 1856, 1, 64, 960, 960, 64, 64]
    - [0, 7.312]
  - - [1088, 1856, 1, 64, 1088, 1088, 64, 64]
    - [0, 7.53]
  - - [1216, 1856, 1, 64, 1216, 1216, 64, 64]
    - [0, 7.684]
  - - [1344, 1856, 1, 64, 1344, 1344, 64, 64]
    - [0, 7.844]
  - - [1472, 1856, 1, 64, 1472, 1472, 64, 64]
    - [0, 7.916]
  - - [1600, 1856, 1, 64, 1600, 1600, 64, 64]
    - [0, 7.984]
  - - [1728, 1856, 1, 64, 1728, 1728, 64, 64]
    - [0, 8.158]
  - - [1856, 1856, 1, 64, 1856, 1856, 64, 64]
    - [0, 8.306]
  - - [1984, 1856, 1, 64, 1984, 1984, 64, 64]
    - [0, 8.301]
  - - [2112, 1856, 1, 64, 2112, 2112, 64, 64]
    - [0, 8.283]
  - - [2240, 1856, 1, 64, 2240, 2240, 64, 64]
    - [0, 8.245]
  - - [2368, 1856, 1, 64, 2368, 2368, 64, 64]
    - [0, 8.386]
  - - [2496, 1856, 1, 64, 2496, 2496, 64, 64]
    - [0, 8.651]
  - - [2624, 1856, 1, 64, 2624, 2624, 64, 64]
    - [0, 8.209]
  - - [2752, 1856, 1, 64, 2752, 2752, 64, 64]
    - [0, 8.448]
  - - [2880, 1856, 1, 64, 2880, 2880, 64, 64]
    - [0, 8.413]
  - - [3008, 1856, 1, 64, 3008, 3008, 64, 64]
    - [0, 8.443]
  - - [3136, 1856, 1, 64, 3136, 3136, 64, 64]
    - [0, 8.511]
  - - [3264, 1856, 1, 64, 3264, 3264, 64, 64]
    - [0, 8.339]
  - - [3392, 1856, 1, 64, 3392, 3392, 64, 64]
    - [0, 8.57]
  - - [3520, 1856, 1, 64, 3520, 3520, 64, 64]
    - [0, 8.599]
  - - [3648, 1856, 1, 64, 3648, 3648, 64, 64]
    - [0, 8.424]
  - - [3776, 1856, 1, 64, 3776, 3776, 64, 64]
    - [0, 8.576]
  - - [3904, 1856, 1, 64, 3904, 3904, 64, 64]
    - [0, 8.573]
  - - [4032, 1856, 1, 64, 4032, 4032, 64, 64]
    - [0, 8.479]
  - - [64, 1984, 1, 64, 64, 64, 64, 64]
    - [2, 0.525]
  - - [192, 1984, 1, 64, 192, 192, 64, 64]
    - [2, 3.079]
  - - [320, 1984, 1, 64, 320, 320, 64, 64]
    - [0, 5.381]
  - - [448, 1984, 1, 64, 448, 448, 64, 64]
    - [0, 6.096]
  - - [576, 1984, 1, 64, 576, 576, 64, 64]
    - [0, 6.536]
  - - [704, 1984, 1, 64, 704, 704, 64, 64]
    - [0, 6.98]
  - - [832, 1984, 1, 64, 832, 832, 64, 64]
    - [0, 7.225]
  - - [960, 1984, 1, 64, 960, 960, 64, 64]
    - [0, 7.488]
  - - [1088, 1984, 1, 64, 1088, 1088, 64, 64]
    - [0, 7.594]
  - - [1216, 1984, 1, 64, 1216, 1216, 64, 64]
    - [0, 7.781]
  - - [1344, 1984, 1, 64, 1344, 1344, 64, 64]
    - [0, 7.874]
  - - [1472, 1984, 1, 64, 1472, 1472, 64, 64]
    - [0, 8.038]
  - - [1600, 1984, 1, 64, 1600, 1600, 64, 64]
    - [0, 8.247]
  - - [1728, 1984, 1, 64, 1728, 1728, 64, 64]
    - [0, 8.408]
  - - [1856, 1984, 1, 64, 1856, 1856, 64, 64]
    - [0, 8.512]
  - - [1984, 1984, 1, 64, 1984, 1984, 64, 64]
    - [0, 8.406]
  - - [2112, 1984, 1, 64, 2112, 2112, 64, 64]
    - [0, 8.465]
  - - [2240, 1984, 1, 64, 2240, 2240, 64, 64]
    - [0, 8.309]
  - - [2368, 1984, 1, 64, 2368, 2368, 64, 64]
    - [0, 8.659]
  - - [2496, 1984, 1, 64, 2496, 2496, 64, 64]
    - [0, 8.356]
  - - [2624, 1984, 1, 64, 2624, 2624, 64, 64]
    - [0, 8.472]
  - - [2752, 1984, 1, 64, 2752, 2752, 64, 64]
    - [0, 8.69]
  - - [2880, 1984, 1, 64, 2880, 2880, 64, 64]
    - [0, 8.217]
  - - [3008, 1984, 1, 64, 3008, 3008, 64, 64]
    - [0, 8.49]
  - - [3136, 1984, 1, 64, 3136, 3136, 64, 64]
    - [0, 8.481]
  - - [3264, 1984, 1, 64, 3264, 3264, 64, 64]
    - [0, 8.377]
  - - [3392, 1984, 1, 64, 3392, 3392, 64, 64]
    - [0, 8.325]
  - - [3520, 1984, 1, 64, 3520, 3520, 64, 64]
    - [0, 8.382]
  - - [3648, 1984, 1, 64, 3648, 3648, 64, 64]
    - [0, 8.549]
  - - [3776, 1984, 1, 64, 3776, 3776, 64, 64]
    - [0, 8.91]
  - - [3904, 1984, 1, 64, 3904, 3904, 64, 64]
    - [0, 8.347]
  - - [4032, 1984, 1, 64, 4032, 4032, 64, 64]
    - [0, 8.705]
  - - [64, 2112, 1, 64, 64, 64, 64, 64]
    - [0, 2.294]
  - - [192, 2112, 1, 64, 192, 192, 64, 64]
    - [0, 4.456]
  - - [320, 2112, 1, 64, 320, 320, 64, 64]
    - [0, 5.597]
  - - [448, 2112, 1, 64, 448, 448, 64, 64]
    - [0, 6.167]
  - - [576, 2112, 1, 64, 576, 576, 64, 64]
    - [0, 6.722]
  - - [704, 2112, 1, 64, 704, 704, 64, 64]
    - [0, 7.102]
  - - [832, 2112, 1, 64, 832, 832, 64, 64]
    - [0, 7.308]
  - - [960, 2112, 1, 64, 960, 960, 64, 64]
    - [0, 7.5]
  - - [1088, 2112, 1, 64, 1088, 1088, 64, 64]
    - [0, 7.753]
  - - [1216, 2112, 1, 64, 1216, 1216, 64, 64]
    - [0, 7.832]
  - - [1344, 2112, 1, 64, 1344, 1344, 64, 64]
    - [0, 7.958]
  - - [1472, 2112, 1, 64, 1472, 1472, 64, 64]
    - [0, 8.266]
  - - [1600, 2112, 1, 64, 1600, 1600, 64, 64]
    - [0, 8.443]
  - - [1728, 2112, 1, 64, 1728, 1728, 64, 64]
    - [0, 8.273]
  - - [1856, 2112, 1, 64, 1856, 1856, 64, 64]
    - [0, 8.488]
  - - [1984, 2112, 1, 64, 1984, 1984, 64, 64]
    - [0, 8.584]
  - - [2112, 2112, 1, 64, 2112, 2112, 64, 64]
    - [0, 8.345]
  - - [2240, 2112, 1, 64, 2240, 2240, 64, 64]
    - [0, 8.337]
  - - [2368, 2112, 1, 64, 2368, 2368, 64, 64]
    - [0, 8.385]
  - - [2496, 2112, 1, 64, 2496, 2496, 64, 64]
    - [0, 8.476]
  - - [2624, 2112, 1, 64, 2624, 2624, 64, 64]
    - [0, 8.554]
  - - [2752, 2112, 1, 64, 2752, 2752, 64, 64]
    - [0, 8.426]
  - - [2880, 2112, 1, 64, 2880, 2880, 64, 64]
    - [0, 8.533]
  - - [3008, 2112, 1, 64, 3008, 3008, 64, 64]
    - [0, 8.602]
  - - [3136, 2112, 1, 64, 3136, 3136, 64, 64]
    - [0, 8.637]
  - - [3264, 2112, 1, 64, 3264, 3264, 64, 64]
    - [0, 8.624]
  - - [3392, 2112, 1, 64, 3392, 3392, 64, 64]
    - [0, 8.614]
  - - [3520, 2112, 1, 64, 3520, 3520, 64, 64]
    - [0, 8.655]
  - - [3648, 2112, 1, 64, 3648, 3648, 64, 64]
    - [0, 8.512]
  - - [3776, 2112, 1, 64, 3776, 3776, 64, 64]
    - [0, 8.754]
  - - [3904, 2112, 1, 64, 3904, 3904, 64, 64]
    - [0, 8.858]
  - - [4032, 2112, 1, 64, 4032, 4032, 64, 64]
    - [0, 8.72]
  - - [64, 2240, 1, 64, 64, 64, 64, 64]
    - [2, 0.592]
  - - [192, 2240, 1, 64, 192, 192, 64, 64]
    - [3, 3.957]
  - - [320, 2240, 1, 64, 320, 320, 64, 64]
    - [0, 5.61]
  - - [448, 2240, 1, 64, 448, 448, 64, 64]
    - [0, 6.368]
  - - [576, 2240, 1, 64, 576, 576, 64, 64]
    - [0, 6.821]
  - - [704, 2240, 1, 64, 704, 704, 64, 64]
    - [0, 7.179]
  - - [832, 2240, 1, 64, 832, 832, 64, 64]
    - [0, 7.445]
  - - [960, 2240, 1, 64, 960, 960, 64, 64]
    - [0, 7.628]
  - - [1088, 2240, 1, 64, 1088, 1088, 64, 64]
    - [0, 7.79]
  - - [1216, 2240, 1, 64, 1216, 1216, 64, 64]
    - [0, 7.877]
  - - [1344, 2240, 1, 64, 1344, 1344, 64, 64]
    - [0, 8.273]
  - - [1472, 2240, 1, 64, 1472, 1472, 64, 64]
    - [0, 8.316]
  - - [1600, 2240, 1, 64, 1600, 1600, 64, 64]
    - [0, 8.177]
  - - [1728, 2240, 1, 64, 1728, 1728, 64, 64]
    - [0, 8.172]
  - - [1856, 2240, 1, 64, 1856, 1856, 64, 64]
    - [0, 8.293]
  - - [1984, 2240, 1, 64, 1984, 1984, 64, 64]
    - [0, 8.243]
  - - [2112, 2240, 1, 64, 2112, 2112, 64, 64]
    - [0, 8.378]
  - - [2240, 2240, 1, 64, 2240, 2240, 64, 64]
    - [0, 8.713]
  - - [2368, 2240, 1, 64, 2368, 2368, 64, 64]
    - [0, 8.4]
  - - [2496, 2240, 1, 64, 2496, 2496, 64, 64]
    - [0, 8.402]
  - - [2624, 2240, 1, 64, 2624, 2624, 64, 64]
    - [0, 8.595]
  - - [2752, 2240, 1, 64, 2752, 2752, 64, 64]
    - [0, 8.573]
  - - [2880, 2240, 1, 64, 2880, 2880, 64, 64]
    - [0, 8.404]
  - - [3008, 2240, 1, 64, 3008, 3008, 64, 64]
    - [0, 8.535]
  - - [3136, 2240, 1, 64, 3136, 3136, 64, 64]
    - [0, 8.639]
  - - [3264, 2240, 1, 64, 3264, 3264, 64, 64]
    - [0, 8.605]
  - - [3392, 2240, 1, 64, 3392, 3392, 64, 64]
    - [0, 8.539]
  - - [3520, 2240, 1, 64, 3520, 3520, 64, 64]
    - [0, 8.432]
  - - [3648, 2240, 1, 64, 3648, 3648, 64, 64]
    - [0, 8.748]
  - - [3776, 2240, 1, 64, 3776, 3776, 64, 64]
    - [0, 8.49]
  - - [3904, 2240, 1, 64, 3904, 3904, 64, 64]
    - [0, 8.855]
  - - [4032, 2240, 1, 64, 4032, 4032, 64, 64]
    - [0, 8.408]
  - - [64, 2368, 1, 64, 64, 64, 64, 64]
    - [3, 1.229]
  - - [192, 2368, 1, 64, 192, 192, 64, 64]
    - [3, 3.636]
  - - [320, 2368, 1, 64, 320, 320, 64, 64]
    - [0, 5.718]
  - - [448, 2368, 1, 64, 448, 448, 64, 64]
    - [0, 6.402]
  - - [576, 2368, 1, 64, 576, 576, 64, 64]
    - [0, 6.82]
  - - [704, 2368, 1, 64, 704, 704, 64, 64]
    - [0, 7.264]
  - - [832, 2368, 1, 64, 832, 832, 64, 64]
    - [0, 7.499]
  - - [960, 2368, 1, 64, 960, 960, 64, 64]
    - [0, 7.651]
  - - [1088, 2368, 1, 64, 1088, 1088, 64, 64]
    - [0, 7.821]
  - - [1216, 2368, 1, 64, 1216, 1216, 64, 64]
    - [0, 7.976]
  - - [1344, 2368, 1, 64, 1344, 1344, 64, 64]
    - [0, 8.053]
  - - [1472, 2368, 1, 64, 1472, 1472, 64, 64]
    - [0, 8.163]
  - - [1600, 2368, 1, 64, 1600, 1600, 64, 64]
    - [0, 8.496]
  - - [1728, 2368, 1, 64, 1728, 1728, 64, 64]
    - [0, 8.406]
  - - [1856, 2368, 1, 64, 1856, 1856, 64, 64]
    - [0, 8.316]
  - - [1984, 2368, 1, 64, 1984, 1984, 64, 64]
    - [0, 8.613]
  - - [2112, 2368, 1, 64, 2112, 2112, 64, 64]
    - [0, 8.39]
  - - [2240, 2368, 1, 64, 2240, 2240, 64, 64]
    - [0, 8.265]
  - - [2368, 2368, 1, 64, 2368, 2368, 64, 64]
    - [0, 8.474]
  - - [2496, 2368, 1, 64, 2496, 2496, 64, 64]
    - [0, 8.501]
  - - [2624, 2368, 1, 64, 2624, 2624, 64, 64]
    - [0, 8.348]
  - - [2752, 2368, 1, 64, 2752, 2752, 64, 64]
    - [0, 8.451]
  - - [2880, 2368, 1, 64, 2880, 2880, 64, 64]
    - [0, 8.374]
  - - [3008, 2368, 1, 64, 3008, 3008, 64, 64]
    - [0, 8.083]
  - - [3136, 2368, 1, 64, 3136, 3136, 64, 64]
    - [0, 8.689]
  - - [3264, 2368, 1, 64, 3264, 3264, 64, 64]
    - [0, 8.216]
  - - [3392, 2368, 1, 64, 3392, 3392, 64, 64]
    - [0, 8.607]
  - - [3520, 2368, 1, 64, 3520, 3520, 64, 64]
    - [0, 8.789]
  - - [3648, 2368, 1, 64, 3648, 3648, 64, 64]
    - [0, 8.612]
  - - [3776, 2368, 1, 64, 3776, 3776, 64, 64]
    - [0, 8.675]
  - - [3904, 2368, 1, 64, 3904, 3904, 64, 64]
    - [0, 8.451]
  - - [4032, 2368, 1, 64, 4032, 4032, 64, 64]
    - [0, 8.544]
  - - [64, 2496, 1, 64, 64, 64, 64, 64]
    - [0, 2.482]
  - - [192, 2496, 1, 64, 192, 192, 64, 64]
    - [0, 4.726]
  - - [320, 2496, 1, 64, 320, 320, 64, 64]
    - [0, 5.874]
  - - [448, 2496, 1, 64, 448, 448, 64, 64]
    - [0, 6.528]
  - - [576, 2496, 1, 64, 576, 576, 64, 64]
    - [0, 7.005]
  - - [704, 2496, 1, 64, 704, 704, 64, 64]
    - [0, 7.285]
  - - [832, 2496, 1, 64, 832, 832, 64, 64]
    - [0, 7.605]
  - - [960, 2496, 1, 64, 960, 960, 64, 64]
    - [0, 7.756]
  - - [1088, 2496, 1, 64, 1088, 1088, 64, 64]
    - [0, 7.962]
  - - [1216, 2496, 1, 64, 1216, 1216, 64, 64]
    - [0, 8.267]
  - - [1344, 2496, 1, 64, 1344, 1344, 64, 64]
    - [0, 8.382]
  - - [1472, 2496, 1, 64, 1472, 1472, 64, 64]
    - [0, 8.303]
  - - [1600, 2496, 1, 64, 1600, 1600, 64, 64]
    - [0, 8.429]
  - - [1728, 2496, 1, 64, 1728, 1728, 64, 64]
    - [0, 8.567]
  - - [1856, 2496, 1, 64, 1856, 1856, 64, 64]
    - [0, 8.294]
  - - [1984, 2496, 1, 64, 1984, 1984, 64, 64]
    - [0, 8.387]
  - - [2112, 2496, 1, 64, 2112, 2112, 64, 64]
    - [0, 8.1]
  - - [2240, 2496, 1, 64, 2240, 2240, 64, 64]
    - [0, 8.339]
  - - [2368, 2496, 1, 64, 2368, 2368, 64, 64]
    - [0, 7.984]
  - - [2496, 2496, 1, 64, 2496, 2496, 64, 64]
    - [0, 8.44]
  - - [2624, 2496, 1, 64, 2624, 2624, 64, 64]
    - [0, 8.059]
  - - [2752, 2496, 1, 64, 2752, 2752, 64, 64]
    - [0, 8.51]
  - - [2880, 2496, 1, 64, 2880, 2880, 64, 64]
    - [0, 8.556]
  - - [3008, 2496, 1, 64, 3008, 3008, 64, 64]
    - [0, 8.451]
  - - [3136, 2496, 1, 64, 3136, 3136, 64, 64]
    - [0, 8.696]
  - - [3264, 2496, 1, 64, 3264, 3264, 64, 64]
    - [0, 8.36]
  - - [3392, 2496, 1, 64, 3392, 3392, 64, 64]
    - [0, 8.662]
  - - [3520, 2496, 1, 64, 3520, 3520, 64, 64]
    - [0, 8.301]
  - - [3648, 2496, 1, 64, 3648, 3648, 64, 64]
    - [0, 8.85]
  - - [3776, 2496, 1, 64, 3776, 3776, 64, 64]
    - [0, 8.514]
  - - [3904, 2496, 1, 64, 3904, 3904, 64, 64]
    - [0, 8.641]
  - - [4032, 2496, 1, 64, 4032, 4032, 64, 64]
    - [0, 8.775]
  - - [64, 2624, 1, 64, 64, 64, 64, 64]
    - [2, 2.459]
  - - [192, 2624, 1, 64, 192, 192, 64, 64]
    - [0, 4.931]
  - - [320, 2624, 1, 64, 320, 320, 64, 64]
    - [0, 5.92]
  - - [448, 2624, 1, 64, 448, 448, 64, 64]
    - [0, 6.677]
  - - [576, 2624, 1, 64, 576, 576, 64, 64]
    - [0, 7.093]
  - - [704, 2624, 1, 64, 704, 704, 64, 64]
    - [0, 7.423]
  - - [832, 2624, 1, 64, 832, 832, 64, 64]
    - [0, 7.674]
  - - [960, 2624, 1, 64, 960, 960, 64, 64]
    - [0, 7.836]
  - - [1088, 2624, 1, 64, 1088, 1088, 64, 64]
    - [0, 7.95]
  - - [1216, 2624, 1, 64, 1216, 1216, 64, 64]
    - [0, 8.241]
  - - [1344, 2624, 1, 64, 1344, 1344, 64, 64]
    - [0, 8.352]
  - - [1472, 2624, 1, 64, 1472, 1472, 64, 64]
    - [0, 8.293]
  - - [1600, 2624, 1, 64, 1600, 1600, 64, 64]
    - [0, 8.441]
  - - [1728, 2624, 1, 64, 1728, 1728, 64, 64]
    - [0, 8.363]
  - - [1856, 2624, 1, 64, 1856, 1856, 64, 64]
    - [0, 8.522]
  - - [1984, 2624, 1, 64, 1984, 1984, 64, 64]
    - [0, 8.391]
  - - [2112, 2624, 1, 64, 2112, 2112, 64, 64]
    - [0, 8.426]
  - - [2240, 2624, 1, 64, 2240, 2240, 64, 64]
    - [0, 8.426]
  - - [2368, 2624, 1, 64, 2368, 2368, 64, 64]
    - [0, 8.281]
  - - [2496, 2624, 1, 64, 2496, 2496, 64, 64]
    - [0, 8.74]
  - - [2624, 2624, 1, 64, 2624, 2624, 64, 64]
    - [0, 8.48]
  - - [2752, 2624, 1, 64, 2752, 2752, 64, 64]
    - [0, 8.435]
  - - [2880, 2624, 1, 64, 2880, 2880, 64, 64]
    - [0, 8.42]
  - - [3008, 2624, 1, 64, 3008, 3008, 64, 64]
    - [0, 8.533]
  - - [3136, 2624, 1, 64, 3136, 3136, 64, 64]
    - [0, 8.799]
  - - [3264, 2624, 1, 64, 3264, 3264, 64, 64]
    - [0, 8.714]
  - - [3392, 2624, 1, 64, 3392, 3392, 64, 64]
    - [0, 8.481]
  - - [3520, 2624, 1, 64, 3520, 3520, 64, 64]
    - [0, 8.521]
  - - [3648, 2624, 1, 64, 3648, 3648, 64, 64]
    - [0, 8.746]
  - - [3776, 2624, 1, 64, 3776, 3776, 64, 64]
    - [0, 8.746]
  - - [3904, 2624, 1, 64, 3904, 3904, 64, 64]
    - [0, 8.599]
  - - [4032, 2624, 1, 64, 4032, 4032, 64, 64]
    - [0, 8.505]
  - - [64, 2752, 1, 64, 64, 64, 64, 64]
    - [0, 2.728]
  - - [192, 2752, 1, 64, 192, 192, 64, 64]
    - [0, 4.938]
  - - [320, 2752, 1, 64, 320, 320, 64, 64]
    - [0, 6.077]
  - - [448, 2752, 1, 64, 448, 448, 64, 64]
    - [0, 6.717]
  - - [576, 2752, 1, 64, 576, 576, 64, 64]
    - [0, 7.134]
  - - [704, 2752, 1, 64, 704, 704, 64, 64]
    - [0, 7.423]
  - - [832, 2752, 1, 64, 832, 832, 64, 64]
    - [0, 7.69]
  - - [960, 2752, 1, 64, 960, 960, 64, 64]
    - [0, 7.903]
  - - [1088, 2752, 1, 64, 1088, 1088, 64, 64]
    - [0, 8.065]
  - - [1216, 2752, 1, 64, 1216, 1216, 64, 64]
    - [0, 8.304]
  - - [1344, 2752, 1, 64, 1344, 1344, 64, 64]
    - [0, 8.42]
  - - [1472, 2752, 1, 64, 1472, 1472, 64, 64]
    - [0, 8.208]
  - - [1600, 2752, 1, 64, 1600, 1600, 64, 64]
    - [0, 7.881]
  - - [1728, 2752, 1, 64, 1728, 1728, 64, 64]
    - [0, 8.344]
  - - [1856, 2752, 1, 64, 1856, 1856, 64, 64]
    - [0, 8.42]
  - - [1984, 2752, 1, 64, 1984, 1984, 64, 64]
    - [0, 8.441]
  - - [2112, 2752, 1, 64, 2112, 2112, 64, 64]
    - [0, 8.131]
  - - [2240, 2752, 1, 64, 2240, 2240, 64, 64]
    - [0, 8.433]
  - - [2368, 2752, 1, 64, 2368, 2368, 64, 64]
    - [0, 8.578]
  - - [2496, 2752, 1, 64, 2496, 2496, 64, 64]
    - [0, 8.569]
  - - [2624, 2752, 1, 64, 2624, 2624, 64, 64]
    - [0, 8.657]
  - - [2752, 2752, 1, 64, 2752, 2752, 64, 64]
    - [0, 8.419]
  - - [2880, 2752, 1, 64, 2880, 2880, 64, 64]
    - [0, 8.493]
  - - [3008, 2752, 1, 64, 3008, 3008, 64, 64]
    - [0, 8.738]
  - - [3136, 2752, 1, 64, 3136, 3136, 64, 64]
    - [0, 8.76]
  - - [3264, 2752, 1, 64, 3264, 3264, 64, 64]
    - [0, 8.473]
  - - [3392, 2752, 1, 64, 3392, 3392, 64, 64]
    - [0, 8.75]
  - - [3520, 2752, 1, 64, 3520, 3520, 64, 64]
    - [0, 8.653]
  - - [3648, 2752, 1, 64, 3648, 3648, 64, 64]
    - [0, 8.544]
  - - [3776, 2752, 1, 64, 3776, 3776, 64, 64]
    - [0, 8.566]
  - - [3904, 2752, 1, 64, 3904, 3904, 64, 64]
    - [0, 8.628]
  - - [4032, 2752, 1, 64, 4032, 4032, 64, 64]
    - [0, 8.611]
  - - [64, 2880, 1, 64, 64, 64, 64, 64]
    - [0, 2.843]
  - - [192, 2880, 1, 64, 192, 192, 64, 64]
    - [0, 5.111]
  - - [320, 2880, 1, 64, 320, 320, 64, 64]
    - [0, 6.171]
  - - [448, 2880, 1, 64, 448, 448, 64, 64]
    - [0, 6.851]
  - - [576, 2880, 1, 64, 576, 576, 64, 64]
    - [0, 7.235]
  - - [704, 2880, 1, 64, 704, 704, 64, 64]
    - [0, 7.497]
  - - [832, 2880, 1, 64, 832, 832, 64, 64]
    - [0, 7.77]
  - - [960, 2880, 1, 64, 960, 960, 64, 64]
    - [0, 7.862]
  - - [1088, 2880, 1, 64, 1088, 1088, 64, 64]
    - [0, 8.222]
  - - [1216, 2880, 1, 64, 1216, 1216, 64, 64]
    - [0, 8.22]
  - - [1344, 2880, 1, 64, 1344, 1344, 64, 64]
    - [0, 8.277]
  - - [1472, 2880, 1, 64, 1472, 1472, 64, 64]
    - [0, 8.277]
  - - [1600, 2880, 1, 64, 1600, 1600, 64, 64]
    - [0, 8.289]
  - - [1728, 2880, 1, 64, 1728, 1728, 64, 64]
    - [0, 8.523]
  - - [1856, 2880, 1, 64, 1856, 1856, 64, 64]
    - [0, 8.396]
  - - [1984, 2880, 1, 64, 1984, 1984, 64, 64]
    - [0, 8.071]
  - - [2112, 2880, 1, 64, 2112, 2112, 64, 64]
    - [0, 8.208]
  - - [2240, 2880, 1, 64, 2240, 2240, 64, 64]
    - [0, 8.368]
  - - [2368, 2880, 1, 64, 2368, 2368, 64, 64]
    - [0, 8.332]
  - - [2496, 2880, 1, 64, 2496, 2496, 64, 64]
    - [0, 8.467]
  - - [2624, 2880, 1, 64, 2624, 2624, 64, 64]
    - [0, 8.582]
  - - [2752, 2880, 1, 64, 2752, 2752, 64, 64]
    - [0, 8.552]
  - - [2880, 2880, 1, 64, 2880, 2880, 64, 64]
    - [0, 8.484]
  - - [3008, 2880, 1, 64, 3008, 3008, 64, 64]
    - [0, 8.633]
  - - [3136, 2880, 1, 64, 3136, 3136, 64, 64]
    - [0, 8.567]
  - - [3264, 2880, 1, 64, 3264, 3264, 64, 64]
    - [0, 8.708]
  - - [3392, 2880, 1, 64, 3392, 3392, 64, 64]
    - [0, 8.558]
  - - [3520, 2880, 1, 64, 3520, 3520, 64, 64]
    - [0, 8.425]
  - - [3648, 2880, 1, 64, 3648, 3648, 64, 64]
    - [0, 8.637]
  - - [3776, 2880, 1, 64, 3776, 3776, 64, 64]
    - [0, 8.654]
  - - [3904, 2880, 1, 64, 3904, 3904, 64, 64]
    - [0, 8.751]
  - - [4032, 2880, 1, 64, 4032, 4032, 64, 64]
    - [0, 8.65]
  - - [64, 3008, 1, 64, 64, 64, 64, 64]
    - [0, 2.976]
  - - [192, 3008, 1, 64, 192, 192, 64, 64]
    - [0, 5.312]
  - - [320, 3008, 1, 64, 320, 320, 64, 64]
    - [0, 6.195]
  - - [448, 3008, 1, 64, 448, 448, 64, 64]
    - [0, 6.851]
  - - [576, 3008, 1, 64, 576, 576, 64, 64]
    - [0, 7.311]
  - - [704, 3008, 1, 64, 704, 704, 64, 64]
    - [0, 7.61]
  - - [832, 3008, 1, 64, 832, 832, 64, 64]
    - [0, 7.805]
  - - [960, 3008, 1, 64, 960, 960, 64, 64]
    - [0, 7.965]
  - - [1088, 3008, 1, 64, 1088, 1088, 64, 64]
    - [0, 8.264]
  - - [1216, 3008, 1, 64, 1216, 1216, 64, 64]
    - [0, 8.484]
  - - [1344, 3008, 1, 64, 1344, 1344, 64, 64]
    - [0, 8.351]
  - - [1472, 3008, 1, 64, 1472, 1472, 64, 64]
    - [0, 8.288]
  - - [1600, 3008, 1, 64, 1600, 1600, 64, 64]
    - [0, 8.331]
  - - [1728, 3008, 1, 64, 1728, 1728, 64, 64]
    - [0, 8.158]
  - - [1856, 3008, 1, 64, 1856, 1856, 64, 64]
    - [0, 8.597]
  - - [1984, 3008, 1, 64, 1984, 1984, 64, 64]
    - [0, 8.501]
  - - [2112, 3008, 1, 64, 2112, 2112, 64, 64]
    - [0, 8.479]
  - - [2240, 3008, 1, 64, 2240, 2240, 64, 64]
    - [0, 8.548]
  - - [2368, 3008, 1, 64, 2368, 2368, 64, 64]
    - [0, 8.599]
  - - [2496, 3008, 1, 64, 2496, 2496, 64, 64]
    - [0, 8.523]
  - - [2624, 3008, 1, 64, 2624, 2624, 64, 64]
    - [0, 8.385]
  - - [2752, 3008, 1, 64, 2752, 2752, 64, 64]
    - [0, 8.512]
  - - [2880, 3008, 1, 64, 2880, 2880, 64, 64]
    - [0, 8.478]
  - - [3008, 3008, 1, 64, 3008, 3008, 64, 64]
    - [0, 8.446]
  - - [3136, 3008, 1, 64, 3136, 3136, 64, 64]
    - [0, 8.634]
  - - [3264, 3008, 1, 64, 3264, 3264, 64, 64]
    - [0, 8.641]
  - - [3392, 3008, 1, 64, 3392, 3392, 64, 64]
    - [0, 8.69]
  - - [3520, 3008, 1, 64, 3520, 3520, 64, 64]
    - [0, 8.458]
  - - [3648, 3008, 1, 64, 3648, 3648, 64, 64]
    - [0, 8.55]
  - - [3776, 3008, 1, 64, 3776, 3776, 64, 64]
    - [0, 8.829]
  - - [3904, 3008, 1, 64, 3904, 3904, 64, 64]
    - [0, 8.659]
  - - [4032, 3008, 1, 64, 4032, 4032, 64, 64]
    - [0, 8.69]
  - - [64, 3136, 1, 64, 64, 64, 64, 64]
    - [2, 1.634]
  - - [192, 3136, 1, 64, 192, 192, 64, 64]
    - [0, 4.841]
  - - [320, 3136, 1, 64, 320, 320, 64, 64]
    - [0, 6.318]
  - - [448, 3136, 1, 64, 448, 448, 64, 64]
    - [0, 6.857]
  - - [576, 3136, 1, 64, 576, 576, 64, 64]
    - [0, 7.34]
  - - [704, 3136, 1, 64, 704, 704, 64, 64]
    - [0, 7.645]
  - - [832, 3136, 1, 64, 832, 832, 64, 64]
    - [0, 7.844]
  - - [960, 3136, 1, 64, 960, 960, 64, 64]
    - [0, 8.298]
  - - [1088, 3136, 1, 64, 1088, 1088, 64, 64]
    - [0, 8.158]
  - - [1216, 3136, 1, 64, 1216, 1216, 64, 64]
    - [0, 8.135]
  - - [1344, 3136, 1, 64, 1344, 1344, 64, 64]
    - [0, 8.106]
  - - [1472, 3136, 1, 64, 1472, 1472, 64, 64]
    - [0, 8.433]
  - - [1600, 3136, 1, 64, 1600, 1600, 64, 64]
    - [0, 8.382]
  - - [1728, 3136, 1, 64, 1728, 1728, 64, 64]
    - [0, 8.371]
  - - [1856, 3136, 1, 64, 1856, 1856, 64, 64]
    - [0, 8.481]
  - - [1984, 3136, 1, 64, 1984, 1984, 64, 64]
    - [0, 8.362]
  - - [2112, 3136, 1, 64, 2112, 2112, 64, 64]
    - [0, 8.622]
  - - [2240, 3136, 1, 64, 2240, 2240, 64, 64]
    - [0, 8.386]
  - - [2368, 3136, 1, 64, 2368, 2368, 64, 64]
    - [0, 8.656]
  - - [2496, 3136, 1, 64, 2496, 2496, 64, 64]
    - [0, 8.673]
  - - [2624, 3136, 1, 64, 2624, 2624, 64, 64]
    - [0, 8.62]
  - - [2752, 3136, 1, 64, 2752, 2752, 64, 64]
    - [0, 8.722]
  - - [2880, 3136, 1, 64, 2880, 2880, 64, 64]
    - [0, 8.553]
  - - [3008, 3136, 1, 64, 3008, 3008, 64, 64]
    - [0, 8.775]
  - - [3136, 3136, 1, 64, 3136, 3136, 64, 64]
    - [0, 8.673]
  - - [3264, 3136, 1, 64, 3264, 3264, 64, 64]
    - [0, 8.772]
  - - [3392, 3136, 1, 64, 3392, 3392, 64, 64]
    - [0, 8.584]
  - - [3520, 3136, 1, 64, 3520, 3520, 64, 64]
    - [0, 8.479]
  - - [3648, 3136, 1, 64, 3648, 3648, 64, 64]
    - [0, 8.57]
  - - [3776, 3136, 1, 64, 3776, 3776, 64, 64]
    - [0, 8.658]
  - - [3904, 3136, 1, 64, 3904, 3904, 64, 64]
    - [0, 8.543]
  - - [4032, 3136, 1, 64, 4032, 4032, 64, 64]
    - [0, 8.523]
  - - [64, 3264, 1, 64, 64, 64, 64, 64]
    - [2, 0.862]
  - - [192, 3264, 1, 64, 192, 192, 64, 64]
    - [0, 5.048]
  - - [320, 3264, 1, 64, 320, 320, 64, 64]
    - [0, 6.372]
  - - [448, 3264, 1, 64, 448, 448, 64, 64]
    - [0, 7.034]
  - - [576, 3264, 1, 64, 576, 576, 64, 64]
    - [0, 7.442]
  - - [704, 3264, 1, 64, 704, 704, 64, 64]
    - [0, 7.768]
  - - [832, 3264, 1, 64, 832, 832, 64, 64]
    - [0, 7.93]
  - - [960, 3264, 1, 64, 960, 960, 64, 64]
    - [0, 8.237]
  - - [1088, 3264, 1, 64, 1088, 1088, 64, 64]
    - [0, 8.248]
  - - [1216, 3264, 1, 64, 1216, 1216, 64, 64]
    - [0, 8.361]
  - - [1344, 3264, 1, 64, 1344, 1344, 64, 64]
    - [0, 8.457]
  - - [1472, 3264, 1, 64, 1472, 1472, 64, 64]
    - [0, 8.386]
  - - [1600, 3264, 1, 64, 1600, 1600, 64, 64]
    - [0, 8.286]
  - - [1728, 3264, 1, 64, 1728, 1728, 64, 64]
    - [0, 8.39]
  - - [1856, 3264, 1, 64, 1856, 1856, 64, 64]
    - [0, 8.373]
  - - [1984, 3264, 1, 64, 1984, 1984, 64, 64]
    - [0, 8.431]
  - - [2112, 3264, 1, 64, 2112, 2112, 64, 64]
    - [0, 8.382]
  - - [2240, 3264, 1, 64, 2240, 2240, 64, 64]
    - [0, 8.645]
  - - [2368, 3264, 1, 64, 2368, 2368, 64, 64]
    - [0, 8.434]
  - - [2496, 3264, 1, 64, 2496, 2496, 64, 64]
    - [0, 8.612]
  - - [2624, 3264, 1, 64, 2624, 2624, 64, 64]
    - [0, 8.386]
  - - [2752, 3264, 1, 64, 2752, 2752, 64, 64]
    - [0, 8.478]
  - - [2880, 3264, 1, 64, 2880, 2880, 64, 64]
    - [0, 8.681]
  - - [3008, 3264, 1, 64, 3008, 3008, 64, 64]
    - [0, 8.686]
  - - [3136, 3264, 1, 64, 3136, 3136, 64, 64]
    - [0, 8.507]
  - - [3264, 3264, 1, 64, 3264, 3264, 64, 64]
    - [0, 8.47]
  - - [3392, 3264, 1, 64, 3392, 3392, 64, 64]
    - [0, 8.591]
  - - [3520, 3264, 1, 64, 3520, 3520, 64, 64]
    - [0, 8.472]
  - - [3648, 3264, 1, 64, 3648, 3648, 64, 64]
    - [0, 8.664]
  - - [3776, 3264, 1, 64, 3776, 3776, 64, 64]
    - [0, 8.645]
  - - [3904, 3264, 1, 64, 3904, 3904, 64, 64]
    - [0, 8.544]
  - - [4032, 3264, 1, 64, 4032, 4032, 64, 64]
    - [0, 8.581]
  - - [64, 3392, 1, 64, 64, 64, 64, 64]
    - [0, 3.133]
  - - [192, 3392, 1, 64, 192, 192, 64, 64]
    - [0, 5.192]
  - - [320, 3392, 1, 64, 320, 320, 64, 64]
    - [0, 6.569]
  - - [448, 3392, 1, 64, 448, 448, 64, 64]
    - [0, 7.06]
  - - [576, 3392, 1, 64, 576, 576, 64, 64]
    - [0, 7.505]
  - - [704, 3392, 1, 64, 704, 704, 64, 64]
    - [0, 7.741]
  - - [832, 3392, 1, 64, 832, 832, 64, 64]
    - [0, 7.991]
  - - [960, 3392, 1, 64, 960, 960, 64, 64]
    - [0, 8.324]
  - - [1088, 3392, 1, 64, 1088, 1088, 64, 64]
    - [0, 8.198]
  - - [1216, 3392, 1, 64, 1216, 1216, 64, 64]
    - [0, 8.218]
  - - [1344, 3392, 1, 64, 1344, 1344, 64, 64]
    - [0, 8.302]
  - - [1472, 3392, 1, 64, 1472, 1472, 64, 64]
    - [0, 7.795]
  - - [1600, 3392, 1, 64, 1600, 1600, 64, 64]
    - [0, 8.305]
  - - [1728, 3392, 1, 64, 1728, 1728, 64, 64]
    - [0, 8.386]
  - - [1856, 3392, 1, 64, 1856, 1856, 64, 64]
    - [0, 8.369]
  - - [1984, 3392, 1, 64, 1984, 1984, 64, 64]
    - [0, 8.418]
  - - [2112, 3392, 1, 64, 2112, 2112, 64, 64]
    - [0, 8.192]
  - - [2240, 3392, 1, 64, 2240, 2240, 64, 64]
    - [0, 8.458]
  - - [2368, 3392, 1, 64, 2368, 2368, 64, 64]
    - [0, 8.393]
  - - [2496, 3392, 1, 64, 2496, 2496, 64, 64]
    - [0, 8.459]
  - - [2624, 3392, 1, 64, 2624, 2624, 64, 64]
    - [0, 8.505]
  - - [2752, 3392, 1, 64, 2752, 2752, 64, 64]
    - [0, 8.431]
  - - [2880, 3392, 1, 64, 2880, 2880, 64, 64]
    - [0, 8.541]
  - - [3008, 3392, 1, 64, 3008, 3008, 64, 64]
    - [0, 8.509]
  - - [3136, 3392, 1, 64, 3136, 3136, 64, 64]
    - [0, 8.582]
  - - [3264, 3392, 1, 64, 3264, 3264, 64, 64]
    - [0, 8.594]
  - - [3392, 3392, 1, 64, 3392, 3392, 64, 64]
    - [0, 8.653]
  - - [3520, 3392, 1, 64, 3520, 3520, 64, 64]
    - [0, 8.426]
  - - [3648, 3392, 1, 64, 3648, 3648, 64, 64]
    - [0, 8.551]
  - - [3776, 3392, 1, 64, 3776, 3776, 64, 64]
    - [0, 8.555]
  - - [3904, 3392, 1, 64, 3904, 3904, 64, 64]
    - [0, 8.405]
  - - [4032, 3392, 1, 64, 4032, 4032, 64, 64]
    - [0, 8.554]
  - - [64, 3520, 1, 64, 64, 64, 64, 64]
    - [0, 3.242]
  - - [192, 3520, 1, 64, 192, 192, 64, 64]
    - [0, 5.527]
  - - [320, 3520, 1, 64, 320, 320, 64, 64]
    - [0, 6.573]
  - - [448, 3520, 1, 64, 448, 448, 64, 64]
    - [0, 7.185]
  - - [576, 3520, 1, 64, 576, 576, 64, 64]
    - [0, 7.49]
  - - [704, 3520, 1, 64, 704, 704, 64, 64]
    - [0, 7.807]
  - - [832, 3520, 1, 64, 832, 832, 64, 64]
    - [0, 8.249]
  - - [960, 3520, 1, 64, 960, 960, 64, 64]
    - [0, 8.349]
  - - [1088, 3520, 1, 64, 1088, 1088, 64, 64]
    - [0, 8.395]
  - - [1216, 3520, 1, 64, 1216, 1216, 64, 64]
    - [0, 8.322]
  - - [1344, 3520, 1, 64, 1344, 1344, 64, 64]
    - [0, 8.208]
  - - [1472, 3520, 1, 64, 1472, 1472, 64, 64]
    - [0, 8.331]
  - - [1600, 3520, 1, 64, 1600, 1600, 64, 64]
    - [0, 8.395]
  - - [1728, 3520, 1, 64, 1728, 1728, 64, 64]
    - [0, 8.469]
  - - [1856, 3520, 1, 64, 1856, 1856, 64, 64]
    - [0, 8.423]
  - - [1984, 3520, 1, 64, 1984, 1984, 64, 64]
    - [0, 8.431]
  - - [2112, 3520, 1, 64, 2112, 2112, 64, 64]
    - [0, 8.394]
  - - [2240, 3520, 1, 64, 2240, 2240, 64, 64]
    - [0, 8.592]
  - - [2368, 3520, 1, 64, 2368, 2368, 64, 64]
    - [0, 8.525]
  - - [2496, 3520, 1, 64, 2496, 2496, 64, 64]
    - [0, 8.563]
  - - [2624, 3520, 1, 64, 2624, 2624, 64, 64]
    - [0, 8.464]
  - - [2752, 3520, 1, 64, 2752, 2752, 64, 64]
    - [0, 8.535]
  - - [2880, 3520, 1, 64, 2880, 2880, 64, 64]
    - [0, 8.56]
  - - [3008, 3520, 1, 64, 3008, 3008, 64, 64]
    - [0, 8.482]
  - - [3136, 3520, 1, 64, 3136, 3136, 64, 64]
    - [0, 8.579]
  - - [3264, 3520, 1, 64, 3264, 3264, 64, 64]
    - [0, 8.53]
  - - [3392, 3520, 1, 64, 3392, 3392, 64, 64]
    - [0, 8.539]
  - - [3520, 3520, 1, 64, 3520, 3520, 64, 64]
    - [0, 8.616]
  - - [3648, 3520, 1, 64, 3648, 3648, 64, 64]
    - [0, 8.671]
  - - [3776, 3520, 1, 64, 3776, 3776, 64, 64]
    - [0, 8.477]
  - - [3904, 3520, 1, 64, 3904, 3904, 64, 64]
    - [0, 8.45]
  - - [4032, 3520, 1, 64, 4032, 4032, 64, 64]
    - [0, 8.523]
  - - [64, 3648, 1, 64, 64, 64, 64, 64]
    - [0, 3.366]
  - - [192, 3648, 1, 64, 192, 192, 64, 64]
    - [0, 5.542]
  - - [320, 3648, 1, 64, 320, 320, 64, 64]
    - [0, 6.601]
  - - [448, 3648, 1, 64, 448, 448, 64, 64]
    - [0, 7.255]
  - - [576, 3648, 1, 64, 576, 576, 64, 64]
    - [0, 7.607]
  - - [704, 3648, 1, 64, 704, 704, 64, 64]
    - [0, 7.869]
  - - [832, 3648, 1, 64, 832, 832, 64, 64]
    - [0, 8.355]
  - - [960, 3648, 1, 64, 960, 960, 64, 64]
    - [0, 8.265]
  - - [1088, 3648, 1, 64, 1088, 1088, 64, 64]
    - [0, 8.254]
  - - [1216, 3648, 1, 64, 1216, 1216, 64, 64]
    - [0, 8.292]
  - - [1344, 3648, 1, 64, 1344, 1344, 64, 64]
    - [0, 8.439]
  - - [1472, 3648, 1, 64, 1472, 1472, 64, 64]
    - [0, 8.379]
  - - [1600, 3648, 1, 64, 1600, 1600, 64, 64]
    - [0, 8.383]
  - - [1728, 3648, 1, 64, 1728, 1728, 64, 64]
    - [0, 8.466]
  - - [1856, 3648, 1, 64, 1856, 1856, 64, 64]
    - [0, 8.37]
  - - [1984, 3648, 1, 64, 1984, 1984, 64, 64]
    - [0, 8.518]
  - - [2112, 3648, 1, 64, 2112, 2112, 64, 64]
    - [0, 8.51]
  - - [2240, 3648, 1, 64, 2240, 2240, 64, 64]
    - [0, 8.522]
  - - [2368, 3648, 1, 64, 2368, 2368, 64, 64]
    - [0, 8.453]
  - - [2496, 3648, 1, 64, 2496, 2496, 64, 64]
    - [0, 8.676]
  - - [2624, 3648, 1, 64, 2624, 2624, 64, 64]
    - [0, 8.42]
  - - [2752, 3648, 1, 64, 2752, 2752, 64, 64]
    - [0, 8.435]
  - - [2880, 3648, 1, 64, 2880, 2880, 64, 64]
    - [0, 8.377]
  - - [3008, 3648, 1, 64, 3008, 3008, 64, 64]
    - [0, 8.597]
  - - [3136, 3648, 1, 64, 3136, 3136, 64, 64]
    - [0, 8.586]
  - - [3264, 3648, 1, 64, 3264, 3264, 64, 64]
    - [0, 8.487]
  - - [3392, 3648, 1, 64, 3392, 3392, 64, 64]
    - [0, 8.528]
  - - [3520, 3648, 1, 64, 3520, 3520, 64, 64]
    - [0, 8.604]
  - - [3648, 3648, 1, 64, 3648, 3648, 64, 64]
    - [0, 8.548]
  - - [3776, 3648, 1, 64, 3776, 3776, 64, 64]
    - [0, 8.371]
  - - [3904, 3648, 1, 64, 3904, 3904, 64, 64]
    - [0, 8.402]
  - - [4032, 3648, 1, 64, 4032, 4032, 64, 64]
    - [0, 7.777]
  - - [64, 3776, 1, 64, 64, 64, 64, 64]
    - [0, 3.47]
  - - [192, 3776, 1, 64, 192, 192, 64, 64]
    - [0, 5.59]
  - - [320, 3776, 1, 64, 320, 320, 64, 64]
    - [0, 6.662]
  - - [448, 3776, 1, 64, 448, 448, 64, 64]
    - [0, 7.319]
  - - [576, 3776, 1, 64, 576, 576, 64, 64]
    - [0, 7.662]
  - - [704, 3776, 1, 64, 704, 704, 64, 64]
    - [0, 7.859]
  - - [832, 3776, 1, 64, 832, 832, 64, 64]
    - [0, 8.312]
  - - [960, 3776, 1, 64, 960, 960, 64, 64]
    - [0, 8.277]
  - - [1088, 3776, 1, 64, 1088, 1088, 64, 64]
    - [0, 8.22]
  - - [1216, 3776, 1, 64, 1216, 1216, 64, 64]
    - [0, 8.394]
  - - [1344, 3776, 1, 64, 1344, 1344, 64, 64]
    - [0, 8.334]
  - - [1472, 3776, 1, 64, 1472, 1472, 64, 64]
    - [0, 8.156]
  - - [1600, 3776, 1, 64, 1600, 1600, 64, 64]
    - [0, 8.378]
  - - [1728, 3776, 1, 64, 1728, 1728, 64, 64]
    - [0, 8.328]
  - - [1856, 3776, 1, 64, 1856, 1856, 64, 64]
    - [0, 8.426]
  - - [1984, 3776, 1, 64, 1984, 1984, 64, 64]
    - [0, 8.408]
  - - [2112, 3776, 1, 64, 2112, 2112, 64, 64]
    - [0, 8.457]
  - - [2240, 3776, 1, 64, 2240, 2240, 64, 64]
    - [0, 8.458]
  - - [2368, 3776, 1, 64, 2368, 2368, 64, 64]
    - [0, 8.513]
  - - [2496, 3776, 1, 64, 2496, 2496, 64, 64]
    - [0, 8.557]
  - - [2624, 3776, 1, 64, 2624, 2624, 64, 64]
    - [0, 8.517]
  - - [2752, 3776, 1, 64, 2752, 2752, 64, 64]
    - [0, 8.627]
  - - [2880, 3776, 1, 64, 2880, 2880, 64, 64]
    - [0, 8.605]
  - - [3008, 3776, 1, 64, 3008, 3008, 64, 64]
    - [0, 8.485]
  - - [3136, 3776, 1, 64, 3136, 3136, 64, 64]
    - [0, 8.622]
  - - [3264, 3776, 1, 64, 3264, 3264, 64, 64]
    - [0, 8.454]
  - - [3392, 3776, 1, 64, 3392, 3392, 64, 64]
    - [0, 8.552]
  - - [3520, 3776, 1, 64, 3520, 3520, 64, 64]
    - [0, 8.502]
  - - [3648, 3776, 1, 64, 3648, 3648, 64, 64]
    - [0, 8.496]
  - - [3776, 3776, 1, 64, 3776, 3776, 64, 64]
    - [0, 8.28]
  - - [3904, 3776, 1, 64, 3904, 3904, 64, 64]
    - [0, 7.702]
  - - [4032, 3776, 1, 64, 4032, 4032, 64, 64]
    - [0, 7.837]
  - - [64, 3904, 1, 64, 64, 64, 64, 64]
    - [0, 3.378]
  - - [192, 3904, 1, 64, 192, 192, 64, 64]
    - [0, 5.671]
  - - [320, 3904, 1, 64, 320, 320, 64, 64]
    - [0, 6.679]
  - - [448, 3904, 1, 64, 448, 448, 64, 64]
    - [0, 7.319]
  - - [576, 3904, 1, 64, 576, 576, 64, 64]
    - [0, 7.978]
  - - [704, 3904, 1, 64, 704, 704, 64, 64]
    - [0, 7.997]
  - - [832, 3904, 1, 64, 832, 832, 64, 64]
    - [0, 8.351]
  - - [960, 3904, 1, 64, 960, 960, 64, 64]
    - [0, 8.269]
  - - [1088, 3904, 1, 64, 1088, 1088, 64, 64]
    - [0, 8.378]
  - - [1216, 3904, 1, 64, 1216, 1216, 64, 64]
    - [0, 8.258]
  - - [1344, 3904, 1, 64, 1344, 1344, 64, 64]
    - [0, 8.271]
  - - [1472, 3904, 1, 64, 1472, 1472, 64, 64]
    - [0, 8.354]
  - - [1600, 3904, 1, 64, 1600, 1600, 64, 64]
    - [0, 8.437]
  - - [1728, 3904, 1, 64, 1728, 1728, 64, 64]
    - [0, 8.373]
  - - [1856, 3904, 1, 64, 1856, 1856, 64, 64]
    - [0, 8.58]
  - - [1984, 3904, 1, 64, 1984, 1984, 64, 64]
    - [0, 8.381]
  - - [2112, 3904, 1, 64, 2112, 2112, 64, 64]
    - [0, 8.403]
  - - [2240, 3904, 1, 64, 2240, 2240, 64, 64]
    - [0, 8.381]
  - - [2368, 3904, 1, 64, 2368, 2368, 64, 64]
    - [0, 8.369]
  - - [2496, 3904, 1, 64, 2496, 2496, 64, 64]
    - [0, 8.623]
  - - [2624, 3904, 1, 64, 2624, 2624, 64, 64]
    - [0, 8.556]
  - - [2752, 3904, 1, 64, 2752, 2752, 64, 64]
    - [0, 8.536]
  - - [2880, 3904, 1, 64, 2880, 2880, 64, 64]
    - [0, 8.543]
  - - [3008, 3904, 1, 64, 3008, 3008, 64, 64]
    - [0, 8.655]
  - - [3136, 3904, 1, 64, 3136, 3136, 64, 64]
    - [0, 8.621]
  - - [3264, 3904, 1, 64, 3264, 3264, 64, 64]
    - [0, 8.558]
  - - [3392, 3904, 1, 64, 3392, 3392, 64, 64]
    - [0, 8.559]
  - - [3520, 3904, 1, 64, 3520, 3520, 64, 64]
    - [0, 8.52]
  - - [3648, 3904, 1, 64, 3648, 3648, 64, 64]
    - [0, 8.502]
  - - [3776, 3904, 1, 64, 3776, 3776, 64, 64]
    - [0, 7.334]
  - - [3904, 3904, 1, 64, 3904, 3904, 64, 64]
    - [0, 7.814]
  - - [4032, 3904, 1, 64, 4032, 4032, 64, 64]
    - [0, 7.737]
  - - [64, 4032, 1, 64, 64, 64, 64, 64]
    - [0, 3.467]
  - - [192, 4032, 1, 64, 192, 192, 64, 64]
    - [0, 5.837]
  - - [320, 4032, 1, 64, 320, 320, 64, 64]
    - [0, 6.825]
  - - [448, 4032, 1, 64, 448, 448, 64, 64]
    - [0, 7.405]
  - - [576, 4032, 1, 64, 576, 576, 64, 64]
    - [0, 7.799]
  - - [704, 4032, 1, 64, 704, 704, 64, 64]
    - [0, 7.985]
  - - [832, 4032, 1, 64, 832, 832, 64, 64]
    - [0, 8.305]
  - - [960, 4032, 1, 64, 960, 960, 64, 64]
    - [0, 8.398]
  - - [1088, 4032, 1, 64, 1088, 1088, 64, 64]
    - [0, 8.283]
  - - [1216, 4032, 1, 64, 1216, 1216, 64, 64]
    - [0, 8.339]
  - - [1344, 4032, 1, 64, 1344, 1344, 64, 64]
    - [0, 8.285]
  - - [1472, 4032, 1, 64, 1472, 1472, 64, 64]
    - [0, 8.167]
  - - [1600, 4032, 1, 64, 1600, 1600, 64, 64]
    - [0, 8.215]
  - - [1728, 4032, 1, 64, 1728, 1728, 64, 64]
    - [0, 8.327]
  - - [1856, 4032, 1, 64, 1856, 1856, 64, 64]
    - [0, 8.428]
  - - [1984, 4032, 1, 64, 1984, 1984, 64, 64]
    - [0, 8.475]
  - - [2112, 4032, 1, 64, 2112, 2112, 64, 64]
    - [0, 8.487]
  - - [2240, 4032, 1, 64, 2240, 2240, 64, 64]
    - [0, 8.618]
  - - [2368, 4032, 1, 64, 2368, 2368, 64, 64]
    - [0, 8.486]
  - - [2496, 4032, 1, 64, 2496, 2496, 64, 64]
    - [0, 8.535]
  - - [2624, 4032, 1, 64, 2624, 2624, 64, 64]
    - [0, 8.563]
  - - [2752, 4032, 1, 64, 2752, 2752, 64, 64]
    - [0, 8.716]
  - - [2880, 4032, 1, 64, 2880, 2880, 64, 64]
    - [0, 8.528]
  - - [3008, 4032, 1, 64, 3008, 3008, 64, 64]
    - [0, 8.519]
  - - [3136, 4032, 1, 64, 3136, 3136, 64, 64]
    - [0, 8.59]
  - - [3264, 4032, 1, 64, 3264, 3264, 64, 64]
    - [0, 8.448]
  - - [3392, 4032, 1, 64, 3392, 3392, 64, 64]
    - [0, 8.489]
  - - [3520, 4032, 1, 64, 3520, 3520, 64, 64]
    - [0, 8.41]
  - - [3648, 4032, 1, 64, 3648, 3648, 64, 64]
    - [0, 7.644]
  - - [3776, 4032, 1, 64, 3776, 3776, 64, 64]
    - [0, 7.38]
  - - [3904, 4032, 1, 64, 3904, 3904, 64, 64]
    - [0, 7.765]
  - - [4032, 4032, 1, 64, 4032, 4032, 64, 64]
    - [0, 7.848]
  - - [64, 64, 1, 256, 64, 64, 256, 256]
    - [1, 0.306]
  - - [192, 64, 1, 256, 192, 192, 256, 256]
    - [1, 0.913]
  - - [320, 64, 1, 256, 320, 320, 256, 256]
    - [3, 1.406]
  - - [448, 64, 1, 256, 448, 448, 256, 256]
    - [0, 1.775]
  - - [576, 64, 1, 256, 576, 576, 256, 256]
    - [0, 2.287]
  - - [704, 64, 1, 256, 704, 704, 256, 256]
    - [0, 2.782]
  - - [832, 64, 1, 256, 832, 832, 256, 256]
    - [0, 2.478]
  - - [960, 64, 1, 256, 960, 960, 256, 256]
    - [0, 2.835]
  - - [1088, 64, 1, 256, 1088, 1088, 256, 256]
    - [0, 3.202]
  - - [1216, 64, 1, 256, 1216, 1216, 256, 256]
    - [0, 3.587]
  - - [1344, 64, 1, 256, 1344, 1344, 256, 256]
    - [0, 3.956]
  - - [1472, 64, 1, 256, 1472, 1472, 256, 256]
    - [0, 4.327]
  - - [1600, 64, 1, 256, 1600, 1600, 256, 256]
    - [0, 3.771]
  - - [1728, 64, 1, 256, 1728, 1728, 256, 256]
    - [0, 4.042]
  - - [1856, 64, 1, 256, 1856, 1856, 256, 256]
    - [0, 4.339]
  - - [1984, 64, 1, 256, 1984, 1984, 256, 256]
    - [0, 4.641]
  - - [2112, 64, 1, 256, 2112, 2112, 256, 256]
    - [0, 4.347]
  - - [2240, 64, 1, 256, 2240, 2240, 256, 256]
    - [0, 4.624]
  - - [2368, 64, 1, 256, 2368, 2368, 256, 256]
    - [3, 4.128]
  - - [2496, 64, 1, 256, 2496, 2496, 256, 256]
    - [0, 4.846]
  - - [2624, 64, 1, 256, 2624, 2624, 256, 256]
    - [0, 5.087]
  - - [2752, 64, 1, 256, 2752, 2752, 256, 256]
    - [0, 5.338]
  - - [2880, 64, 1, 256, 2880, 2880, 256, 256]
    - [0, 5.576]
  - - [3008, 64, 1, 256, 3008, 3008, 256, 256]
    - [0, 5.822]
  - - [3136, 64, 1, 256, 3136, 3136, 256, 256]
    - [0, 5.337]
  - - [3264, 64, 1, 256, 3264, 3264, 256, 256]
    - [0, 5.483]
  - - [3392, 64, 1, 256, 3392, 3392, 256, 256]
    - [0, 5.693]
  - - [3520, 64, 1, 256, 3520, 3520, 256, 256]
    - [0, 5.909]
  - - [3648, 64, 1, 256, 3648, 3648, 256, 256]
    - [0, 6.119]
  - - [3776, 64, 1, 256, 3776, 3776, 256, 256]
    - [0, 6.329]
  - - [3904, 64, 1, 256, 3904, 3904, 256, 256]
    - [0, 5.797]
  - - [4032, 64, 1, 256, 4032, 4032, 256, 256]
    - [0, 5.932]
  - - [64, 192, 1, 256, 64, 64, 256, 256]
    - [2, 0.203]
  - - [192, 192, 1, 256, 192, 192, 256, 256]
    - [3, 0.611]
  - - [320, 192, 1, 256, 320, 320, 256, 256]
    - [0, 1.976]
  - - [448, 192, 1, 256, 448, 448, 256, 256]
    - [3, 2.748]
  - - [576, 192, 1, 256, 576, 576, 256, 256]
    - [0, 3.549]
  - - [704, 192, 1, 256, 704, 704, 256, 256]
    - [0, 4.347]
  - - [832, 192, 1, 256, 832, 832, 256, 256]
    - [0, 4.798]
  - - [960, 192, 1, 256, 960, 960, 256, 256]
    - [0, 5.514]
  - - [1088, 192, 1, 256, 1088, 1088, 256, 256]
    - [0, 5.431]
  - - [1216, 192, 1, 256, 1216, 1216, 256, 256]
    - [0, 6.052]
  - - [1344, 192, 1, 256, 1344, 1344, 256, 256]
    - [0, 5.863]
  - - [1472, 192, 1, 256, 1472, 1472, 256, 256]
    - [0, 6.396]
  - - [1600, 192, 1, 256, 1600, 1600, 256, 256]
    - [0, 6.189]
  - - [1728, 192, 1, 256, 1728, 1728, 256, 256]
    - [0, 6.658]
  - - [1856, 192, 1, 256, 1856, 1856, 256, 256]
    - [0, 6.462]
  - - [1984, 192, 1, 256, 1984, 1984, 256, 256]
    - [0, 6.865]
  - - [2112, 192, 1, 256, 2112, 2112, 256, 256]
    - [0, 6.708]
  - - [2240, 192, 1, 256, 2240, 2240, 256, 256]
    - [0, 7.104]
  - - [2368, 192, 1, 256, 2368, 2368, 256, 256]
    - [0, 6.912]
  - - [2496, 192, 1, 256, 2496, 2496, 256, 256]
    - [0, 7.239]
  - - [2624, 192, 1, 256, 2624, 2624, 256, 256]
    - [0, 7.022]
  - - [2752, 192, 1, 256, 2752, 2752, 256, 256]
    - [0, 7.277]
  - - [2880, 192, 1, 256, 2880, 2880, 256, 256]
    - [0, 7.17]
  - - [3008, 192, 1, 256, 3008, 3008, 256, 256]
    - [0, 7.432]
  - - [3136, 192, 1, 256, 3136, 3136, 256, 256]
    - [0, 7.315]
  - - [3264, 192, 1, 256, 3264, 3264, 256, 256]
    - [0, 7.531]
  - - [3392, 192, 1, 256, 3392, 3392, 256, 256]
    - [0, 7.409]
  - - [3520, 192, 1, 256, 3520, 3520, 256, 256]
    - [0, 7.603]
  - - [3648, 192, 1, 256, 3648, 3648, 256, 256]
    - [0, 7.568]
  - - [3776, 192, 1, 256, 3776, 3776, 256, 256]
    - [0, 7.684]
  - - [3904, 192, 1, 256, 3904, 3904, 256, 256]
    - [0, 7.542]
  - - [4032, 192, 1, 256, 4032, 4032, 256, 256]
    - [0, 7.881]
  - - [64, 320, 1, 256, 64, 64, 256, 256]
    - [3, 0.655]
  - - [192, 320, 1, 256, 192, 192, 256, 256]
    - [0, 1.974]
  - - [320, 320, 1, 256, 320, 320, 256, 256]
    - [2, 3.282]
  - - [448, 320, 1, 256, 448, 448, 256, 256]
    - [0, 4.609]
  - - [576, 320, 1, 256, 576, 576, 256, 256]
    - [0, 5.514]
  - - [704, 320, 1, 256, 704, 704, 256, 256]
    - [0, 5.844]
  - - [832, 320, 1, 256, 832, 832, 256, 256]
    - [0, 6.047]
  - - [960, 320, 1, 256, 960, 960, 256, 256]
    - [0, 6.184]
  - - [1088, 320, 1, 256, 1088, 1088, 256, 256]
    - [0, 6.305]
  - - [1216, 320, 1, 256, 1216, 1216, 256, 256]
    - [0, 7.015]
  - - [1344, 320, 1, 256, 1344, 1344, 256, 256]
    - [0, 7.094]
  - - [1472, 320, 1, 256, 1472, 1472, 256, 256]
    - [0, 7.153]
  - - [1600, 320, 1, 256, 1600, 1600, 256, 256]
    - [0, 7.125]
  - - [1728, 320, 1, 256, 1728, 1728, 256, 256]
    - [0, 7.164]
  - - [1856, 320, 1, 256, 1856, 1856, 256, 256]
    - [0, 7.263]
  - - [1984, 320, 1, 256, 1984, 1984, 256, 256]
    - [0, 7.492]
  - - [2112, 320, 1, 256, 2112, 2112, 256, 256]
    - [0, 7.62]
  - - [2240, 320, 1, 256, 2240, 2240, 256, 256]
    - [0, 7.633]
  - - [2368, 320, 1, 256, 2368, 2368, 256, 256]
    - [0, 7.69]
  - - [2496, 320, 1, 256, 2496, 2496, 256, 256]
    - [0, 7.679]
  - - [2624, 320, 1, 256, 2624, 2624, 256, 256]
    - [0, 7.998]
  - - [2752, 320, 1, 256, 2752, 2752, 256, 256]
    - [0, 8.223]
  - - [2880, 320, 1, 256, 2880, 2880, 256, 256]
    - [0, 8.206]
  - - [3008, 320, 1, 256, 3008, 3008, 256, 256]
    - [0, 8.035]
  - - [3136, 320, 1, 256, 3136, 3136, 256, 256]
    - [0, 8.228]
  - - [3264, 320, 1, 256, 3264, 3264, 256, 256]
    - [0, 8.198]
  - - [3392, 320, 1, 256, 3392, 3392, 256, 256]
    - [0, 8.271]
  - - [3520, 320, 1, 256, 3520, 3520, 256, 256]
    - [0, 8.23]
  - - [3648, 320, 1, 256, 3648, 3648, 256, 256]
    - [0, 8.183]
  - - [3776, 320, 1, 256, 3776, 3776, 256, 256]
    - [0, 8.222]
  - - [3904, 320, 1, 256, 3904, 3904, 256, 256]
    - [0, 8.325]
  - - [4032, 320, 1, 256, 4032, 4032, 256, 256]
    - [0, 8.221]
  - - [64, 448, 1, 256, 64, 64, 256, 256]
    - [2, 0.918]
  - - [192, 448, 1, 256, 192, 192, 256, 256]
    - [2, 2.735]
  - - [320, 448, 1, 256, 320, 320, 256, 256]
    - [0, 4.597]
  - - [448, 448, 1, 256, 448, 448, 256, 256]
    - [0, 5.27]
  - - [576, 448, 1, 256, 576, 576, 256, 256]
    - [0, 5.884]
  - - [704, 448, 1, 256, 704, 704, 256, 256]
    - [0, 6.345]
  - - [832, 448, 1, 256, 832, 832, 256, 256]
    - [0, 6.735]
  - - [960, 448, 1, 256, 960, 960, 256, 256]
    - [0, 7.099]
  - - [1088, 448, 1, 256, 1088, 1088, 256, 256]
    - [0, 7.34]
  - - [1216, 448, 1, 256, 1216, 1216, 256, 256]
    - [0, 7.18]
  - - [1344, 448, 1, 256, 1344, 1344, 256, 256]
    - [0, 7.352]
  - - [1472, 448, 1, 256, 1472, 1472, 256, 256]
    - [0, 7.57]
  - - [1600, 448, 1, 256, 1600, 1600, 256, 256]
    - [0, 7.69]
  - - [1728, 448, 1, 256, 1728, 1728, 256, 256]
    - [0, 7.908]
  - - [1856, 448, 1, 256, 1856, 1856, 256, 256]
    - [0, 8.171]
  - - [1984, 448, 1, 256, 1984, 1984, 256, 256]
    - [0, 8.037]
  - - [2112, 448, 1, 256, 2112, 2112, 256, 256]
    - [0, 8.102]
  - - [2240, 448, 1, 256, 2240, 2240, 256, 256]
    - [0, 8.204]
  - - [2368, 448, 1, 256, 2368, 2368, 256, 256]
    - [0, 8.174]
  - - [2496, 448, 1, 256, 2496, 2496, 256, 256]
    - [0, 8.304]
  - - [2624, 448, 1, 256, 2624, 2624, 256, 256]
    - [0, 8.254]
  - - [2752, 448, 1, 256, 2752, 2752, 256, 256]
    - [0, 8.283]
  - - [2880, 448, 1, 256, 2880, 2880, 256, 256]
    - [0, 8.302]
  - - [3008, 448, 1, 256, 3008, 3008, 256, 256]
    - [0, 8.188]
  - - [3136, 448, 1, 256, 3136, 3136, 256, 256]
    - [0, 8.218]
  - - [3264, 448, 1, 256, 3264, 3264, 256, 256]
    - [0, 8.277]
  - - [3392, 448, 1, 256, 3392, 3392, 256, 256]
    - [0, 8.309]
  - - [3520, 448, 1, 256, 3520, 3520, 256, 256]
    - [0, 8.421]
  - - [3648, 448, 1, 256, 3648, 3648, 256, 256]
    - [0, 8.23]
  - - [3776, 448, 1, 256, 3776, 3776, 256, 256]
    - [0, 8.297]
  - - [3904, 448, 1, 256, 3904, 3904, 256, 256]
    - [0, 8.343]
  - - [4032, 448, 1, 256, 4032, 4032, 256, 256]
    - [0, 8.397]
  - - [64, 576, 1, 256, 64, 64, 256, 256]
    - [0, 2.296]
  - - [192, 576, 1, 256, 192, 192, 256, 256]
    - [0, 4.053]
  - - [320, 576, 1, 256, 320, 320, 256, 256]
    - [0, 5.588]
  - - [448, 576, 1, 256, 448, 448, 256, 256]
    - [0, 5.94]
  - - [576, 576, 1, 256, 576, 576, 256, 256]
    - [0, 6.729]
  - - [704, 576, 1, 256, 704, 704, 256, 256]
    - [0, 6.834]
  - - [832, 576, 1, 256, 832, 832, 256, 256]
    - [0, 7.309]
  - - [960, 576, 1, 256, 960, 960, 256, 256]
    - [0, 7.279]
  - - [1088, 576, 1, 256, 1088, 1088, 256, 256]
    - [0, 7.614]
  - - [1216, 576, 1, 256, 1216, 1216, 256, 256]
    - [0, 7.471]
  - - [1344, 576, 1, 256, 1344, 1344, 256, 256]
    - [0, 7.765]
  - - [1472, 576, 1, 256, 1472, 1472, 256, 256]
    - [0, 7.74]
  - - [1600, 576, 1, 256, 1600, 1600, 256, 256]
    - [0, 8.002]
  - - [1728, 576, 1, 256, 1728, 1728, 256, 256]
    - [0, 7.99]
  - - [1856, 576, 1, 256, 1856, 1856, 256, 256]
    - [0, 8.172]
  - - [1984, 576, 1, 256, 1984, 1984, 256, 256]
    - [0, 8.19]
  - - [2112, 576, 1, 256, 2112, 2112, 256, 256]
    - [0, 8.167]
  - - [2240, 576, 1, 256, 2240, 2240, 256, 256]
    - [0, 8.235]
  - - [2368, 576, 1, 256, 2368, 2368, 256, 256]
    - [0, 8.224]
  - - [2496, 576, 1, 256, 2496, 2496, 256, 256]
    - [0, 8.193]
  - - [2624, 576, 1, 256, 2624, 2624, 256, 256]
    - [0, 8.256]
  - - [2752, 576, 1, 256, 2752, 2752, 256, 256]
    - [0, 8.311]
  - - [2880, 576, 1, 256, 2880, 2880, 256, 256]
    - [0, 8.361]
  - - [3008, 576, 1, 256, 3008, 3008, 256, 256]
    - [0, 8.161]
  - - [3136, 576, 1, 256, 3136, 3136, 256, 256]
    - [0, 8.425]
  - - [3264, 576, 1, 256, 3264, 3264, 256, 256]
    - [0, 8.218]
  - - [3392, 576, 1, 256, 3392, 3392, 256, 256]
    - [0, 8.345]
  - - [3520, 576, 1, 256, 3520, 3520, 256, 256]
    - [0, 8.356]
  - - [3648, 576, 1, 256, 3648, 3648, 256, 256]
    - [0, 8.303]
  - - [3776, 576, 1, 256, 3776, 3776, 256, 256]
    - [0, 8.521]
  - - [3904, 576, 1, 256, 3904, 3904, 256, 256]
    - [0, 8.416]
  - - [4032, 576, 1, 256, 4032, 4032, 256, 256]
    - [0, 8.393]
  - - [64, 704, 1, 256, 64, 64, 256, 256]
    - [2, 0.745]
  - - [192, 704, 1, 256, 192, 192, 256, 256]
    - [0, 4.36]
  - - [320, 704, 1, 256, 320, 320, 256, 256]
    - [0, 5.912]
  - - [448, 704, 1, 256, 448, 448, 256, 256]
    - [0, 6.412]
  - - [576, 704, 1, 256, 576, 576, 256, 256]
    - [0, 6.794]
  - - [704, 704, 1, 256, 704, 704, 256, 256]
    - [0, 7.011]
  - - [832, 704, 1, 256, 832, 832, 256, 256]
    - [0, 7.491]
  - - [960, 704, 1, 256, 960, 960, 256, 256]
    - [0, 7.607]
  - - [1088, 704, 1, 256, 1088, 1088, 256, 256]
    - [0, 7.684]
  - - [1216, 704, 1, 256, 1216, 1216, 256, 256]
    - [0, 7.843]
  - - [1344, 704, 1, 256, 1344, 1344, 256, 256]
    - [0, 8.099]
  - - [1472, 704, 1, 256, 1472, 1472, 256, 256]
    - [0, 8.136]
  - - [1600, 704, 1, 256, 1600, 1600, 256, 256]
    - [0, 8.279]
  - - [1728, 704, 1, 256, 1728, 1728, 256, 256]
    - [0, 8.304]
  - - [1856, 704, 1, 256, 1856, 1856, 256, 256]
    - [0, 8.319]
  - - [1984, 704, 1, 256, 1984, 1984, 256, 256]
    - [0, 8.221]
  - - [2112, 704, 1, 256, 2112, 2112, 256, 256]
    - [0, 8.291]
  - - [2240, 704, 1, 256, 2240, 2240, 256, 256]
    - [0, 8.314]
  - - [2368, 704, 1, 256, 2368, 2368, 256, 256]
    - [0, 8.41]
  - - [2496, 704, 1, 256, 2496, 2496, 256, 256]
    - [0, 8.289]
  - - [2624, 704, 1, 256, 2624, 2624, 256, 256]
    - [0, 8.295]
  - - [2752, 704, 1, 256, 2752, 2752, 256, 256]
    - [0, 8.326]
  - - [2880, 704, 1, 256, 2880, 2880, 256, 256]
    - [0, 8.378]
  - - [3008, 704, 1, 256, 3008, 3008, 256, 256]
    - [0, 8.302]
  - - [3136, 704, 1, 256, 3136, 3136, 256, 256]
    - [0, 8.367]
  - - [3264, 704, 1, 256, 3264, 3264, 256, 256]
    - [0, 8.437]
  - - [3392, 704, 1, 256, 3392, 3392, 256, 256]
    - [0, 8.456]
  - - [3520, 704, 1, 256, 3520, 3520, 256, 256]
    - [0, 8.507]
  - - [3648, 704, 1, 256, 3648, 3648, 256, 256]
    - [0, 8.493]
  - - [3776, 704, 1, 256, 3776, 3776, 256, 256]
    - [0, 8.497]
  - - [3904, 704, 1, 256, 3904, 3904, 256, 256]
    - [0, 8.486]
  - - [4032, 704, 1, 256, 4032, 4032, 256, 256]
    - [0, 8.53]
  - - [64, 832, 1, 256, 64, 64, 256, 256]
    - [1, 1.709]
  - - [192, 832, 1, 256, 192, 192, 256, 256]
    - [0, 4.849]
  - - [320, 832, 1, 256, 320, 320, 256, 256]
    - [0, 6.115]
  - - [448, 832, 1, 256, 448, 448, 256, 256]
    - [0, 6.789]
  - - [576, 832, 1, 256, 576, 576, 256, 256]
    - [0, 7.309]
  - - [704, 832, 1, 256, 704, 704, 256, 256]
    - [0, 7.566]
  - - [832, 832, 1, 256, 832, 832, 256, 256]
    - [0, 7.476]
  - - [960, 832, 1, 256, 960, 960, 256, 256]
    - [0, 7.982]
  - - [1088, 832, 1, 256, 1088, 1088, 256, 256]
    - [0, 8.165]
  - - [1216, 832, 1, 256, 1216, 1216, 256, 256]
    - [0, 8.233]
  - - [1344, 832, 1, 256, 1344, 1344, 256, 256]
    - [0, 8.34]
  - - [1472, 832, 1, 256, 1472, 1472, 256, 256]
    - [0, 8.385]
  - - [1600, 832, 1, 256, 1600, 1600, 256, 256]
    - [0, 8.318]
  - - [1728, 832, 1, 256, 1728, 1728, 256, 256]
    - [0, 8.241]
  - - [1856, 832, 1, 256, 1856, 1856, 256, 256]
    - [0, 8.329]
  - - [1984, 832, 1, 256, 1984, 1984, 256, 256]
    - [0, 8.357]
  - - [2112, 832, 1, 256, 2112, 2112, 256, 256]
    - [0, 8.283]
  - - [2240, 832, 1, 256, 2240, 2240, 256, 256]
    - [0, 8.41]
  - - [2368, 832, 1, 256, 2368, 2368, 256, 256]
    - [0, 8.249]
  - - [2496, 832, 1, 256, 2496, 2496, 256, 256]
    - [0, 8.323]
  - - [2624, 832, 1, 256, 2624, 2624, 256, 256]
    - [0, 8.333]
  - - [2752, 832, 1, 256, 2752, 2752, 256, 256]
    - [0, 8.351]
  - - [2880, 832, 1, 256, 2880, 2880, 256, 256]
    - [0, 8.356]
  - - [3008, 832, 1, 256, 3008, 3008, 256, 256]
    - [0, 8.554]
  - - [3136, 832, 1, 256, 3136, 3136, 256, 256]
    - [0, 8.35]
  - - [3264, 832, 1, 256, 3264, 3264, 256, 256]
    - [0, 8.493]
  - - [3392, 832, 1, 256, 3392, 3392, 256, 256]
    - [0, 8.496]
  - - [3520, 832, 1, 256, 3520, 3520, 256, 256]
    - [0, 8.544]
  - - [3648, 832, 1, 256, 3648, 3648, 256, 256]
    - [0, 8.448]
  - - [3776, 832, 1, 256, 3776, 3776, 256, 256]
    - [0, 8.54]
  - - [3904, 832, 1, 256, 3904, 3904, 256, 256]
    - [0, 8.56]
  - - [4032, 832, 1, 256, 4032, 4032, 256, 256]
    - [0, 8.597]
  - - [64, 960, 1, 256, 64, 64, 256, 256]
    - [2, 2.813]
  - - [192, 960, 1, 256, 192, 192, 256, 256]
    - [0, 5.59]
  - - [320, 960, 1, 256, 320, 320, 256, 256]
    - [0, 6.254]
  - - [448, 960, 1, 256, 448, 448, 256, 256]
    - [0, 7.159]
  - - [576, 960, 1, 256, 576, 576, 256, 256]
    - [0, 7.25]
  - - [704, 960, 1, 256, 704, 704, 256, 256]
    - [0, 7.681]
  - - [832, 960, 1, 256, 832, 832, 256, 256]
    - [0, 8.012]
  - - [960, 960, 1, 256, 960, 960, 256, 256]
    - [0, 8.122]
  - - [1088, 960, 1, 256, 1088, 1088, 256, 256]
    - [0, 8.161]
  - - [1216, 960, 1, 256, 1216, 1216, 256, 256]
    - [0, 8.289]
  - - [1344, 960, 1, 256, 1344, 1344, 256, 256]
    - [0, 8.245]
  - - [1472, 960, 1, 256, 1472, 1472, 256, 256]
    - [0, 8.266]
  - - [1600, 960, 1, 256, 1600, 1600, 256, 256]
    - [0, 8.406]
  - - [1728, 960, 1, 256, 1728, 1728, 256, 256]
    - [0, 8.311]
  - - [1856, 960, 1, 256, 1856, 1856, 256, 256]
    - [0, 8.312]
  - - [1984, 960, 1, 256, 1984, 1984, 256, 256]
    - [0, 8.372]
  - - [2112, 960, 1, 256, 2112, 2112, 256, 256]
    - [0, 8.455]
  - - [2240, 960, 1, 256, 2240, 2240, 256, 256]
    - [0, 8.361]
  - - [2368, 960, 1, 256, 2368, 2368, 256, 256]
    - [0, 8.43]
  - - [2496, 960, 1, 256, 2496, 2496, 256, 256]
    - [0, 8.522]
  - - [2624, 960, 1, 256, 2624, 2624, 256, 256]
    - [0, 8.434]
  - - [2752, 960, 1, 256, 2752, 2752, 256, 256]
    - [0, 8.486]
  - - [2880, 960, 1, 256, 2880, 2880, 256, 256]
    - [0, 8.526]
  - - [3008, 960, 1, 256, 3008, 3008, 256, 256]
    - [0, 8.433]
  - - [3136, 960, 1, 256, 3136, 3136, 256, 256]
    - [0, 8.435]
  - - [3264, 960, 1, 256, 3264, 3264, 256, 256]
    - [0, 8.582]
  - - [3392, 960, 1, 256, 3392, 3392, 256, 256]
    - [0, 8.443]
  - - [3520, 960, 1, 256, 3520, 3520, 256, 256]
    - [0, 8.608]
  - - [3648, 960, 1, 256, 3648, 3648, 256, 256]
    - [0, 8.728]
  - - [3776, 960, 1, 256, 3776, 3776, 256, 256]
    - [0, 8.789]
  - - [3904, 960, 1, 256, 3904, 3904, 256, 256]
    - [0, 8.548]
  - - [4032, 960, 1, 256, 4032, 4032, 256, 256]
    - [0, 8.607]
  - - [64, 1088, 1, 256, 64, 64, 256, 256]
    - [2, 2.252]
  - - [192, 1088, 1, 256, 192, 192, 256, 256]
    - [0, 5.491]
  - - [320, 1088, 1, 256, 320, 320, 256, 256]
    - [0, 6.376]
  - - [448, 1088, 1, 256, 448, 448, 256, 256]
    - [0, 7.414]
  - - [576, 1088, 1, 256, 576, 576, 256, 256]
    - [0, 7.612]
  - - [704, 1088, 1, 256, 704, 704, 256, 256]
    - [0, 7.91]
  - - [832, 1088, 1, 256, 832, 832, 256, 256]
    - [0, 8.071]
  - - [960, 1088, 1, 256, 960, 960, 256, 256]
    - [0, 8.208]
  - - [1088, 1088, 1, 256, 1088, 1088, 256, 256]
    - [0, 8.301]
  - - [1216, 1088, 1, 256, 1216, 1216, 256, 256]
    - [0, 8.35]
  - - [1344, 1088, 1, 256, 1344, 1344, 256, 256]
    - [0, 8.327]
  - - [1472, 1088, 1, 256, 1472, 1472, 256, 256]
    - [0, 8.295]
  - - [1600, 1088, 1, 256, 1600, 1600, 256, 256]
    - [0, 8.368]
  - - [1728, 1088, 1, 256, 1728, 1728, 256, 256]
    - [0, 8.403]
  - - [1856, 1088, 1, 256, 1856, 1856, 256, 256]
    - [0, 8.347]
  - - [1984, 1088, 1, 256, 1984, 1984, 256, 256]
    - [0, 8.389]
  - - [2112, 1088, 1, 256, 2112, 2112, 256, 256]
    - [0, 8.462]
  - - [2240, 1088, 1, 256, 2240, 2240, 256, 256]
    - [0, 8.374]
  - - [2368, 1088, 1, 256, 2368, 2368, 256, 256]
    - [0, 8.502]
  - - [2496, 1088, 1, 256, 2496, 2496, 256, 256]
    - [0, 8.46]
  - - [2624, 1088, 1, 256, 2624, 2624, 256, 256]
    - [0, 8.557]
  - - [2752, 1088, 1, 256, 2752, 2752, 256, 256]
    - [0, 8.609]
  - - [2880, 1088, 1, 256, 2880, 2880, 256, 256]
    - [0, 8.565]
  - - [3008, 1088, 1, 256, 3008, 3008, 256, 256]
    - [0, 8.58]
  - - [3136, 1088, 1, 256, 3136, 3136, 256, 256]
    - [0, 8.482]
  - - [3264, 1088, 1, 256, 3264, 3264, 256, 256]
    - [0, 8.586]
  - - [3392, 1088, 1, 256, 3392, 3392, 256, 256]
    - [0, 8.552]
  - - [3520, 1088, 1, 256, 3520, 3520, 256, 256]
    - [0, 8.566]
  - - [3648, 1088, 1, 256, 3648, 3648, 256, 256]
    - [0, 8.618]
  - - [3776, 1088, 1, 256, 3776, 3776, 256, 256]
    - [0, 8.604]
  - - [3904, 1088, 1, 256, 3904, 3904, 256, 256]
    - [0, 8.593]
  - - [4032, 1088, 1, 256, 4032, 4032, 256, 256]
    - [0, 8.624]
  - - [64, 1216, 1, 256, 64, 64, 256, 256]
    - [0, 3.599]
  - - [192, 1216, 1, 256, 192, 192, 256, 256]
    - [0, 6.134]
  - - [320, 1216, 1, 256, 320, 320, 256, 256]
    - [0, 7.075]
  - - [448, 1216, 1, 256, 448, 448, 256, 256]
    - [0, 7.153]
  - - [576, 1216, 1, 256, 576, 576, 256, 256]
    - [0, 7.524]
  - - [704, 1216, 1, 256, 704, 704, 256, 256]
    - [0, 7.927]
  - - [832, 1216, 1, 256, 832, 832, 256, 256]
    - [0, 8.195]
  - - [960, 1216, 1, 256, 960, 960, 256, 256]
    - [0, 8.271]
  - - [1088, 1216, 1, 256, 1088, 1088, 256, 256]
    - [0, 8.293]
  - - [1216, 1216, 1, 256, 1216, 1216, 256, 256]
    - [0, 8.278]
  - - [1344, 1216, 1, 256, 1344, 1344, 256, 256]
    - [0, 8.239]
  - - [1472, 1216, 1, 256, 1472, 1472, 256, 256]
    - [0, 8.263]
  - - [1600, 1216, 1, 256, 1600, 1600, 256, 256]
    - [0, 8.388]
  - - [1728, 1216, 1, 256, 1728, 1728, 256, 256]
    - [0, 8.464]
  - - [1856, 1216, 1, 256, 1856, 1856, 256, 256]
    - [0, 8.523]
  - - [1984, 1216, 1, 256, 1984, 1984, 256, 256]
    - [0, 8.467]
  - - [2112, 1216, 1, 256, 2112, 2112, 256, 256]
    - [0, 8.352]
  - - [2240, 1216, 1, 256, 2240, 2240, 256, 256]
    - [0, 8.519]
  - - [2368, 1216, 1, 256, 2368, 2368, 256, 256]
    - [0, 8.481]
  - - [2496, 1216, 1, 256, 2496, 2496, 256, 256]
    - [0, 8.556]
  - - [2624, 1216, 1, 256, 2624, 2624, 256, 256]
    - [0, 8.494]
  - - [2752, 1216, 1, 256, 2752, 2752, 256, 256]
    - [0, 8.617]
  - - [2880, 1216, 1, 256, 2880, 2880, 256, 256]
    - [0, 8.592]
  - - [3008, 1216, 1, 256, 3008, 3008, 256, 256]
    - [0, 8.758]
  - - [3136, 1216, 1, 256, 3136, 3136, 256, 256]
    - [0, 8.607]
  - - [3264, 1216, 1, 256, 3264, 3264, 256, 256]
    - [0, 8.754]
  - - [3392, 1216, 1, 256, 3392, 3392, 256, 256]
    - [0, 8.652]
  - - [3520, 1216, 1, 256, 3520, 3520, 256, 256]
    - [0, 8.704]
  - - [3648, 1216, 1, 256, 3648, 3648, 256, 256]
    - [0, 8.639]
  - - [3776, 1216, 1, 256, 3776, 3776, 256, 256]
    - [0, 8.628]
  - - [3904, 1216, 1, 256, 3904, 3904, 256, 256]
    - [0, 8.514]
  - - [4032, 1216, 1, 256, 4032, 4032, 256, 256]
    - [0, 8.574]
  - - [64, 1344, 1, 256, 64, 64, 256, 256]
    - [0, 3.985]
  - - [192, 1344, 1, 256, 192, 192, 256, 256]
    - [0, 5.87]
  - - [320, 1344, 1, 256, 320, 320, 256, 256]
    - [0, 7.105]
  - - [448, 1344, 1, 256, 448, 448, 256, 256]
    - [0, 7.301]
  - - [576, 1344, 1, 256, 576, 576, 256, 256]
    - [0, 8.013]
  - - [704, 1344, 1, 256, 704, 704, 256, 256]
    - [0, 7.903]
  - - [832, 1344, 1, 256, 832, 832, 256, 256]
    - [0, 8.17]
  - - [960, 1344, 1, 256, 960, 960, 256, 256]
    - [0, 8.285]
  - - [1088, 1344, 1, 256, 1088, 1088, 256, 256]
    - [0, 8.276]
  - - [1216, 1344, 1, 256, 1216, 1216, 256, 256]
    - [0, 8.405]
  - - [1344, 1344, 1, 256, 1344, 1344, 256, 256]
    - [0, 8.419]
  - - [1472, 1344, 1, 256, 1472, 1472, 256, 256]
    - [0, 8.238]
  - - [1600, 1344, 1, 256, 1600, 1600, 256, 256]
    - [0, 8.438]
  - - [1728, 1344, 1, 256, 1728, 1728, 256, 256]
    - [0, 8.447]
  - - [1856, 1344, 1, 256, 1856, 1856, 256, 256]
    - [0, 8.471]
  - - [1984, 1344, 1, 256, 1984, 1984, 256, 256]
    - [0, 8.526]
  - - [2112, 1344, 1, 256, 2112, 2112, 256, 256]
    - [0, 8.578]
  - - [2240, 1344, 1, 256, 2240, 2240, 256, 256]
    - [0, 8.407]
  - - [2368, 1344, 1, 256, 2368, 2368, 256, 256]
    - [0, 8.588]
  - - [2496, 1344, 1, 256, 2496, 2496, 256, 256]
    - [0, 8.444]
  - - [2624, 1344, 1, 256, 2624, 2624, 256, 256]
    - [0, 8.566]
  - - [2752, 1344, 1, 256, 2752, 2752, 256, 256]
    - [0, 8.543]
  - - [2880, 1344, 1, 256, 2880, 2880, 256, 256]
    - [0, 8.669]
  - - [3008, 1344, 1, 256, 3008, 3008, 256, 256]
    - [0, 8.747]
  - - [3136, 1344, 1, 256, 3136, 3136, 256, 256]
    - [0, 8.649]
  - - [3264, 1344, 1, 256, 3264, 3264, 256, 256]
    - [0, 8.743]
  - - [3392, 1344, 1, 256, 3392, 3392, 256, 256]
    - [0, 8.761]
  - - [3520, 1344, 1, 256, 3520, 3520, 256, 256]
    - [0, 8.654]
  - - [3648, 1344, 1, 256, 3648, 3648, 256, 256]
    - [0, 8.646]
  - - [3776, 1344, 1, 256, 3776, 3776, 256, 256]
    - [0, 8.654]
  - - [3904, 1344, 1, 256, 3904, 3904, 256, 256]
    - [0, 8.623]
  - - [4032, 1344, 1, 256, 4032, 4032, 256, 256]
    - [0, 8.65]
  - - [64, 1472, 1, 256, 64, 64, 256, 256]
    - [0, 4.279]
  - - [192, 1472, 1, 256, 192, 192, 256, 256]
    - [0, 6.422]
  - - [320, 1472, 1, 256, 320, 320, 256, 256]
    - [0, 7.18]
  - - [448, 1472, 1, 256, 448, 448, 256, 256]
    - [0, 7.486]
  - - [576, 1472, 1, 256, 576, 576, 256, 256]
    - [0, 8.007]
  - - [704, 1472, 1, 256, 704, 704, 256, 256]
    - [0, 8.181]
  - - [832, 1472, 1, 256, 832, 832, 256, 256]
    - [0, 8.134]
  - - [960, 1472, 1, 256, 960, 960, 256, 256]
    - [0, 8.454]
  - - [1088, 1472, 1, 256, 1088, 1088, 256, 256]
    - [0, 8.431]
  - - [1216, 1472, 1, 256, 1216, 1216, 256, 256]
    - [0, 8.344]
  - - [1344, 1472, 1, 256, 1344, 1344, 256, 256]
    - [0, 8.472]
  - - [1472, 1472, 1, 256, 1472, 1472, 256, 256]
    - [0, 8.447]
  - - [1600, 1472, 1, 256, 1600, 1600, 256, 256]
    - [0, 8.563]
  - - [1728, 1472, 1, 256, 1728, 1728, 256, 256]
    - [0, 8.676]
  - - [1856, 1472, 1, 256, 1856, 1856, 256, 256]
    - [0, 8.556]
  - - [1984, 1472, 1, 256, 1984, 1984, 256, 256]
    - [0, 8.68]
  - - [2112, 1472, 1, 256, 2112, 2112, 256, 256]
    - [0, 8.594]
  - - [2240, 1472, 1, 256, 2240, 2240, 256, 256]
    - [0, 8.7]
  - - [2368, 1472, 1, 256, 2368, 2368, 256, 256]
    - [0, 8.583]
  - - [2496, 1472, 1, 256, 2496, 2496, 256, 256]
    - [0, 8.526]
  - - [2624, 1472, 1, 256, 2624, 2624, 256, 256]
    - [0, 8.697]
  - - [2752, 1472, 1, 256, 2752, 2752, 256, 256]
    - [0, 8.74]
  - - [2880, 1472, 1, 256, 2880, 2880, 256, 256]
    - [0, 8.792]
  - - [3008, 1472, 1, 256, 3008, 3008, 256, 256]
    - [0, 8.879]
  - - [3136, 1472, 1, 256, 3136, 3136, 256, 256]
    - [0, 8.884]
  - - [3264, 1472, 1, 256, 3264, 3264, 256, 256]
    - [0, 8.81]
  - - [3392, 1472, 1, 256, 3392, 3392, 256, 256]
    - [0, 8.806]
  - - [3520, 1472, 1, 256, 3520, 3520, 256, 256]
    - [0, 8.753]
  - - [3648, 1472, 1, 256, 3648, 3648, 256, 256]
    - [0, 8.804]
  - - [3776, 1472, 1, 256, 3776, 3776, 256, 256]
    - [0, 8.685]
  - - [3904, 1472, 1, 256, 3904, 3904, 256, 256]
    - [0, 8.755]
  - - [4032, 1472, 1, 256, 4032, 4032, 256, 256]
    - [0, 8.757]
  - - [64, 1600, 1, 256, 64, 64, 256, 256]
    - [0, 3.755]
  - - [192, 1600, 1, 256, 192, 192, 256, 256]
    - [0, 6.27]
  - - [320, 1600, 1, 256, 320, 320, 256, 256]
    - [0, 7.219]
  - - [448, 1600, 1, 256, 448, 448, 256, 256]
    - [0, 7.665]
  - - [576, 1600, 1, 256, 576, 576, 256, 256]
    - [0, 8.326]
  - - [704, 1600, 1, 256, 704, 704, 256, 256]
    - [0, 8.255]
  - - [832, 1600, 1, 256, 832, 832, 256, 256]
    - [0, 8.261]
  - - [960, 1600, 1, 256, 960, 960, 256, 256]
    - [0, 8.392]
  - - [1088, 1600, 1, 256, 1088, 1088, 256, 256]
    - [0, 8.441]
  - - [1216, 1600, 1, 256, 1216, 1216, 256, 256]
    - [0, 8.462]
  - - [1344, 1600, 1, 256, 1344, 1344, 256, 256]
    - [0, 8.393]
  - - [1472, 1600, 1, 256, 1472, 1472, 256, 256]
    - [0, 8.502]
  - - [1600, 1600, 1, 256, 1600, 1600, 256, 256]
    - [0, 8.504]
  - - [1728, 1600, 1, 256, 1728, 1728, 256, 256]
    - [0, 8.491]
  - - [1856, 1600, 1, 256, 1856, 1856, 256, 256]
    - [0, 8.593]
  - - [1984, 1600, 1, 256, 1984, 1984, 256, 256]
    - [0, 8.602]
  - - [2112, 1600, 1, 256, 2112, 2112, 256, 256]
    - [0, 8.619]
  - - [2240, 1600, 1, 256, 2240, 2240, 256, 256]
    - [0, 8.738]
  - - [2368, 1600, 1, 256, 2368, 2368, 256, 256]
    - [0, 8.599]
  - - [2496, 1600, 1, 256, 2496, 2496, 256, 256]
    - [0, 8.701]
  - - [2624, 1600, 1, 256, 2624, 2624, 256, 256]
    - [0, 8.687]
  - - [2752, 1600, 1, 256, 2752, 2752, 256, 256]
    - [0, 8.798]
  - - [2880, 1600, 1, 256, 2880, 2880, 256, 256]
    - [0, 8.859]
  - - [3008, 1600, 1, 256, 3008, 3008, 256, 256]
    - [0, 8.681]
  - - [3136, 1600, 1, 256, 3136, 3136, 256, 256]
    - [0, 8.696]
  - - [3264, 1600, 1, 256, 3264, 3264, 256, 256]
    - [0, 8.759]
  - - [3392, 1600, 1, 256, 3392, 3392, 256, 256]
    - [0, 8.735]
  - - [3520, 1600, 1, 256, 3520, 3520, 256, 256]
    - [0, 8.73]
  - - [3648, 1600, 1, 256, 3648, 3648, 256, 256]
    - [0, 8.698]
  - - [3776, 1600, 1, 256, 3776, 3776, 256, 256]
    - [0, 8.744]
  - - [3904, 1600, 1, 256, 3904, 3904, 256, 256]
    - [0, 8.707]
  - - [4032, 1600, 1, 256, 4032, 4032, 256, 256]
    - [0, 8.742]
  - - [64, 1728, 1, 256, 64, 64, 256, 256]
    - [0, 4.059]
  - - [192, 1728, 1, 256, 192, 192, 256, 256]
    - [0, 6.649]
  - - [320, 1728, 1, 256, 320, 320, 256, 256]
    - [0, 7.179]
  - - [448, 1728, 1, 256, 448, 448, 256, 256]
    - [0, 7.872]
  - - [576, 1728, 1, 256, 576, 576, 256, 256]
    - [0, 8.186]
  - - [704, 1728, 1, 256, 704, 704, 256, 256]
    - [0, 8.263]
  - - [832, 1728, 1, 256, 832, 832, 256, 256]
    - [0, 8.208]
  - - [960, 1728, 1, 256, 960, 960, 256, 256]
    - [0, 8.346]
  - - [1088, 1728, 1, 256, 1088, 1088, 256, 256]
    - [0, 8.291]
  - - [1216, 1728, 1, 256, 1216, 1216, 256, 256]
    - [0, 8.275]
  - - [1344, 1728, 1, 256, 1344, 1344, 256, 256]
    - [0, 8.453]
  - - [1472, 1728, 1, 256, 1472, 1472, 256, 256]
    - [0, 8.457]
  - - [1600, 1728, 1, 256, 1600, 1600, 256, 256]
    - [0, 8.362]
  - - [1728, 1728, 1, 256, 1728, 1728, 256, 256]
    - [0, 8.599]
  - - [1856, 1728, 1, 256, 1856, 1856, 256, 256]
    - [0, 8.581]
  - - [1984, 1728, 1, 256, 1984, 1984, 256, 256]
    - [0, 8.732]
  - - [2112, 1728, 1, 256, 2112, 2112, 256, 256]
    - [0, 8.731]
  - - [2240, 1728, 1, 256, 2240, 2240, 256, 256]
    - [0, 8.644]
  - - [2368, 1728, 1, 256, 2368, 2368, 256, 256]
    - [0, 8.719]
  - - [2496, 1728, 1, 256, 2496, 2496, 256, 256]
    - [0, 8.738]
  - - [2624, 1728, 1, 256, 2624, 2624, 256, 256]
    - [0, 8.646]
  - - [2752, 1728, 1, 256, 2752, 2752, 256, 256]
    - [0, 8.58]
  - - [2880, 1728, 1, 256, 2880, 2880, 256, 256]
    - [0, 8.638]
  - - [3008, 1728, 1, 256, 3008, 3008, 256, 256]
    - [0, 8.724]
  - - [3136, 1728, 1, 256, 3136, 3136, 256, 256]
    - [0, 8.727]
  - - [3264, 1728, 1, 256, 3264, 3264, 256, 256]
    - [0, 8.587]
  - - [3392, 1728, 1, 256, 3392, 3392, 256, 256]
    - [0, 8.612]
  - - [3520, 1728, 1, 256, 3520, 3520, 256, 256]
    - [0, 8.701]
  - - [3648, 1728, 1, 256, 3648, 3648, 256, 256]
    - [0, 8.612]
  - - [3776, 1728, 1, 256, 3776, 3776, 256, 256]
    - [0, 8.733]
  - - [3904, 1728, 1, 256, 3904, 3904, 256, 256]
    - [0, 8.659]
  - - [4032, 1728, 1, 256, 4032, 4032, 256, 256]
    - [0, 8.744]
  - - [64, 1856, 1, 256, 64, 64, 256, 256]
    - [0, 4.345]
  - - [192, 1856, 1, 256, 192, 192, 256, 256]
    - [0, 6.484]
  - - [320, 1856, 1, 256, 320, 320, 256, 256]
    - [0, 7.291]
  - - [448, 1856, 1, 256, 448, 448, 256, 256]
    - [0, 8.162]
  - - [576, 1856, 1, 256, 576, 576, 256, 256]
    - [0, 8.21]
  - - [704, 1856, 1, 256, 704, 704, 256, 256]
    - [0, 8.155]
  - - [832, 1856, 1, 256, 832, 832, 256, 256]
    - [0, 8.287]
  - - [960, 1856, 1, 256, 960, 960, 256, 256]
    - [0, 8.263]
  - - [1088, 1856, 1, 256, 1088, 1088, 256, 256]
    - [0, 8.273]
  - - [1216, 1856, 1, 256, 1216, 1216, 256, 256]
    - [0, 8.492]
  - - [1344, 1856, 1, 256, 1344, 1344, 256, 256]
    - [0, 8.37]
  - - [1472, 1856, 1, 256, 1472, 1472, 256, 256]
    - [0, 8.618]
  - - [1600, 1856, 1, 256, 1600, 1600, 256, 256]
    - [0, 8.568]
  - - [1728, 1856, 1, 256, 1728, 1728, 256, 256]
    - [0, 8.6]
  - - [1856, 1856, 1, 256, 1856, 1856, 256, 256]
    - [0, 8.64]
  - - [1984, 1856, 1, 256, 1984, 1984, 256, 256]
    - [0, 8.571]
  - - [2112, 1856, 1, 256, 2112, 2112, 256, 256]
    - [0, 8.715]
  - - [2240, 1856, 1, 256, 2240, 2240, 256, 256]
    - [0, 8.637]
  - - [2368, 1856, 1, 256, 2368, 2368, 256, 256]
    - [0, 8.653]
  - - [2496, 1856, 1, 256, 2496, 2496, 256, 256]
    - [0, 8.665]
  - - [2624, 1856, 1, 256, 2624, 2624, 256, 256]
    - [0, 8.477]
  - - [2752, 1856, 1, 256, 2752, 2752, 256, 256]
    - [0, 8.621]
  - - [2880, 1856, 1, 256, 2880, 2880, 256, 256]
    - [0, 8.645]
  - - [3008, 1856, 1, 256, 3008, 3008, 256, 256]
    - [0, 8.612]
  - - [3136, 1856, 1, 256, 3136, 3136, 256, 256]
    - [0, 8.659]
  - - [3264, 1856, 1, 256, 3264, 3264, 256, 256]
    - [0, 8.688]
  - - [3392, 1856, 1, 256, 3392, 3392, 256, 256]
    - [0, 8.728]
  - - [3520, 1856, 1, 256, 3520, 3520, 256, 256]
    - [0, 8.724]
  - - [3648, 1856, 1, 256, 3648, 3648, 256, 256]
    - [0, 8.718]
  - - [3776, 1856, 1, 256, 3776, 3776, 256, 256]
    - [0, 8.714]
  - - [3904, 1856, 1, 256, 3904, 3904, 256, 256]
    - [0, 8.771]
  - - [4032, 1856, 1, 256, 4032, 4032, 256, 256]
    - [0, 8.673]
  - - [64, 1984, 1, 256, 64, 64, 256, 256]
    - [0, 4.646]
  - - [192, 1984, 1, 256, 192, 192, 256, 256]
    - [0, 6.912]
  - - [320, 1984, 1, 256, 320, 320, 256, 256]
    - [0, 7.495]
  - - [448, 1984, 1, 256, 448, 448, 256, 256]
    - [0, 8.025]
  - - [576, 1984, 1, 256, 576, 576, 256, 256]
    - [0, 8.005]
  - - [704, 1984, 1, 256, 704, 704, 256, 256]
    - [0, 8.135]
  - - [832, 1984, 1, 256, 832, 832, 256, 256]
    - [0, 8.157]
  - - [960, 1984, 1, 256, 960, 960, 256, 256]
    - [0, 8.316]
  - - [1088, 1984, 1, 256, 1088, 1088, 256, 256]
    - [0, 8.275]
  - - [1216, 1984, 1, 256, 1216, 1216, 256, 256]
    - [0, 8.406]
  - - [1344, 1984, 1, 256, 1344, 1344, 256, 256]
    - [0, 8.521]
  - - [1472, 1984, 1, 256, 1472, 1472, 256, 256]
    - [0, 8.586]
  - - [1600, 1984, 1, 256, 1600, 1600, 256, 256]
    - [0, 8.585]
  - - [1728, 1984, 1, 256, 1728, 1728, 256, 256]
    - [0, 8.711]
  - - [1856, 1984, 1, 256, 1856, 1856, 256, 256]
    - [0, 8.689]
  - - [1984, 1984, 1, 256, 1984, 1984, 256, 256]
    - [0, 8.515]
  - - [2112, 1984, 1, 256, 2112, 2112, 256, 256]
    - [0, 8.737]
  - - [2240, 1984, 1, 256, 2240, 2240, 256, 256]
    - [0, 8.523]
  - - [2368, 1984, 1, 256, 2368, 2368, 256, 256]
    - [0, 8.667]
  - - [2496, 1984, 1, 256, 2496, 2496, 256, 256]
    - [0, 8.641]
  - - [2624, 1984, 1, 256, 2624, 2624, 256, 256]
    - [0, 8.654]
  - - [2752, 1984, 1, 256, 2752, 2752, 256, 256]
    - [0, 8.553]
  - - [2880, 1984, 1, 256, 2880, 2880, 256, 256]
    - [0, 8.656]
  - - [3008, 1984, 1, 256, 3008, 3008, 256, 256]
    - [0, 8.681]
  - - [3136, 1984, 1, 256, 3136, 3136, 256, 256]
    - [0, 8.662]
  - - [3264, 1984, 1, 256, 3264, 3264, 256, 256]
    - [0, 8.631]
  - - [3392, 1984, 1, 256, 3392, 3392, 256, 256]
    - [0, 8.733]
  - - [3520, 1984, 1, 256, 3520, 3520, 256, 256]
    - [0, 8.641]
  - - [3648, 1984, 1, 256, 3648, 3648, 256, 256]
    - [0, 8.682]
  - - [3776, 1984, 1, 256, 3776, 3776, 256, 256]
    - [0, 8.626]
  - - [3904, 1984, 1, 256, 3904, 3904, 256, 256]
    - [0, 8.717]
  - - [4032, 1984, 1, 256, 4032, 4032, 256, 256]
    - [0, 8.722]
  - - [64, 2112, 1, 256, 64, 64, 256, 256]
    - [0, 4.949]
  - - [192, 2112, 1, 256, 192, 192, 256, 256]
    - [0, 6.816]
  - - [320, 2112, 1, 256, 320, 320, 256, 256]
    - [0, 7.861]
  - - [448, 2112, 1, 256, 448, 448, 256, 256]
    - [0, 8.013]
  - - [576, 2112, 1, 256, 576, 576, 256, 256]
    - [0, 8.308]
  - - [704, 2112, 1, 256, 704, 704, 256, 256]
    - [0, 8.252]
  - - [832, 2112, 1, 256, 832, 832, 256, 256]
    - [0, 8.2]
  - - [960, 2112, 1, 256, 960, 960, 256, 256]
    - [0, 8.386]
  - - [1088, 2112, 1, 256, 1088, 1088, 256, 256]
    - [0, 8.39]
  - - [1216, 2112, 1, 256, 1216, 1216, 256, 256]
    - [0, 8.467]
  - - [1344, 2112, 1, 256, 1344, 1344, 256, 256]
    - [0, 8.437]
  - - [1472, 2112, 1, 256, 1472, 1472, 256, 256]
    - [0, 8.467]
  - - [1600, 2112, 1, 256, 1600, 1600, 256, 256]
    - [0, 8.62]
  - - [1728, 2112, 1, 256, 1728, 1728, 256, 256]
    - [0, 8.614]
  - - [1856, 2112, 1, 256, 1856, 1856, 256, 256]
    - [0, 8.672]
  - - [1984, 2112, 1, 256, 1984, 1984, 256, 256]
    - [0, 8.615]
  - - [2112, 2112, 1, 256, 2112, 2112, 256, 256]
    - [0, 8.539]
  - - [2240, 2112, 1, 256, 2240, 2240, 256, 256]
    - [0, 8.646]
  - - [2368, 2112, 1, 256, 2368, 2368, 256, 256]
    - [0, 8.537]
  - - [2496, 2112, 1, 256, 2496, 2496, 256, 256]
    - [0, 8.644]
  - - [2624, 2112, 1, 256, 2624, 2624, 256, 256]
    - [0, 8.661]
  - - [2752, 2112, 1, 256, 2752, 2752, 256, 256]
    - [0, 8.755]
  - - [2880, 2112, 1, 256, 2880, 2880, 256, 256]
    - [0, 8.72]
  - - [3008, 2112, 1, 256, 3008, 3008, 256, 256]
    - [0, 8.636]
  - - [3136, 2112, 1, 256, 3136, 3136, 256, 256]
    - [0, 8.693]
  - - [3264, 2112, 1, 256, 3264, 3264, 256, 256]
    - [0, 8.619]
  - - [3392, 2112, 1, 256, 3392, 3392, 256, 256]
    - [0, 8.64]
  - - [3520, 2112, 1, 256, 3520, 3520, 256, 256]
    - [0, 8.713]
  - - [3648, 2112, 1, 256, 3648, 3648, 256, 256]
    - [0, 8.701]
  - - [3776, 2112, 1, 256, 3776, 3776, 256, 256]
    - [0, 8.66]
  - - [3904, 2112, 1, 256, 3904, 3904, 256, 256]
    - [0, 8.78]
  - - [4032, 2112, 1, 256, 4032, 4032, 256, 256]
    - [0, 8.703]
  - - [64, 2240, 1, 256, 64, 64, 256, 256]
    - [0, 5.237]
  - - [192, 2240, 1, 256, 192, 192, 256, 256]
    - [0, 7.175]
  - - [320, 2240, 1, 256, 320, 320, 256, 256]
    - [0, 7.941]
  - - [448, 2240, 1, 256, 448, 448, 256, 256]
    - [0, 7.98]
  - - [576, 2240, 1, 256, 576, 576, 256, 256]
    - [0, 8.236]
  - - [704, 2240, 1, 256, 704, 704, 256, 256]
    - [0, 8.256]
  - - [832, 2240, 1, 256, 832, 832, 256, 256]
    - [0, 8.368]
  - - [960, 2240, 1, 256, 960, 960, 256, 256]
    - [0, 8.339]
  - - [1088, 2240, 1, 256, 1088, 1088, 256, 256]
    - [0, 8.521]
  - - [1216, 2240, 1, 256, 1216, 1216, 256, 256]
    - [0, 8.439]
  - - [1344, 2240, 1, 256, 1344, 1344, 256, 256]
    - [0, 8.501]
  - - [1472, 2240, 1, 256, 1472, 1472, 256, 256]
    - [0, 8.719]
  - - [1600, 2240, 1, 256, 1600, 1600, 256, 256]
    - [0, 8.761]
  - - [1728, 2240, 1, 256, 1728, 1728, 256, 256]
    - [0, 8.479]
  - - [1856, 2240, 1, 256, 1856, 1856, 256, 256]
    - [0, 8.668]
  - - [1984, 2240, 1, 256, 1984, 1984, 256, 256]
    - [0, 8.684]
  - - [2112, 2240, 1, 256, 2112, 2112, 256, 256]
    - [0, 8.713]
  - - [2240, 2240, 1, 256, 2240, 2240, 256, 256]
    - [0, 8.752]
  - - [2368, 2240, 1, 256, 2368, 2368, 256, 256]
    - [0, 8.688]
  - - [2496, 2240, 1, 256, 2496, 2496, 256, 256]
    - [0, 8.703]
  - - [2624, 2240, 1, 256, 2624, 2624, 256, 256]
    - [0, 8.626]
  - - [2752, 2240, 1, 256, 2752, 2752, 256, 256]
    - [0, 8.694]
  - - [2880, 2240, 1, 256, 2880, 2880, 256, 256]
    - [0, 8.701]
  - - [3008, 2240, 1, 256, 3008, 3008, 256, 256]
    - [0, 8.735]
  - - [3136, 2240, 1, 256, 3136, 3136, 256, 256]
    - [0, 8.637]
  - - [3264, 2240, 1, 256, 3264, 3264, 256, 256]
    - [0, 8.62]
  - - [3392, 2240, 1, 256, 3392, 3392, 256, 256]
    - [0, 8.705]
  - - [3520, 2240, 1, 256, 3520, 3520, 256, 256]
    - [0, 8.876]
  - - [3648, 2240, 1, 256, 3648, 3648, 256, 256]
    - [0, 8.734]
  - - [3776, 2240, 1, 256, 3776, 3776, 256, 256]
    - [0, 8.792]
  - - [3904, 2240, 1, 256, 3904, 3904, 256, 256]
    - [0, 8.733]
  - - [4032, 2240, 1, 256, 4032, 4032, 256, 256]
    - [0, 8.761]
  - - [64, 2368, 1, 256, 64, 64, 256, 256]
    - [0, 4.614]
  - - [192, 2368, 1, 256, 192, 192, 256, 256]
    - [0, 6.985]
  - - [320, 2368, 1, 256, 320, 320, 256, 256]
    - [0, 7.647]
  - - [448, 2368, 1, 256, 448, 448, 256, 256]
    - [0, 8.165]
  - - [576, 2368, 1, 256, 576, 576, 256, 256]
    - [0, 8.267]
  - - [704, 2368, 1, 256, 704, 704, 256, 256]
    - [0, 8.282]
  - - [832, 2368, 1, 256, 832, 832, 256, 256]
    - [0, 8.326]
  - - [960, 2368, 1, 256, 960, 960, 256, 256]
    - [0, 8.306]
  - - [1088, 2368, 1, 256, 1088, 1088, 256, 256]
    - [0, 8.435]
  - - [1216, 2368, 1, 256, 1216, 1216, 256, 256]
    - [0, 8.422]
  - - [1344, 2368, 1, 256, 1344, 1344, 256, 256]
    - [0, 8.518]
  - - [1472, 2368, 1, 256, 1472, 1472, 256, 256]
    - [0, 8.622]
  - - [1600, 2368, 1, 256, 1600, 1600, 256, 256]
    - [0, 8.449]
  - - [1728, 2368, 1, 256, 1728, 1728, 256, 256]
    - [0, 8.627]
  - - [1856, 2368, 1, 256, 1856, 1856, 256, 256]
    - [0, 8.74]
  - - [1984, 2368, 1, 256, 1984, 1984, 256, 256]
    - [0, 8.652]
  - - [2112, 2368, 1, 256, 2112, 2112, 256, 256]
    - [0, 8.561]
  - - [2240, 2368, 1, 256, 2240, 2240, 256, 256]
    - [0, 8.587]
  - - [2368, 2368, 1, 256, 2368, 2368, 256, 256]
    - [0, 8.554]
  - - [2496, 2368, 1, 256, 2496, 2496, 256, 256]
    - [0, 8.625]
  - - [2624, 2368, 1, 256, 2624, 2624, 256, 256]
    - [0, 8.681]
  - - [2752, 2368, 1, 256, 2752, 2752, 256, 256]
    - [0, 8.715]
  - - [2880, 2368, 1, 256, 2880, 2880, 256, 256]
    - [0, 8.694]
  - - [3008, 2368, 1, 256, 3008, 3008, 256, 256]
    - [0, 8.746]
  - - [3136, 2368, 1, 256, 3136, 3136, 256, 256]
    - [0, 8.637]
  - - [3264, 2368, 1, 256, 3264, 3264, 256, 256]
    - [0, 8.679]
  - - [3392, 2368, 1, 256, 3392, 3392, 256, 256]
    - [0, 8.703]
  - - [3520, 2368, 1, 256, 3520, 3520, 256, 256]
    - [0, 8.712]
  - - [3648, 2368, 1, 256, 3648, 3648, 256, 256]
    - [0, 8.753]
  - - [3776, 2368, 1, 256, 3776, 3776, 256, 256]
    - [0, 8.718]
  - - [3904, 2368, 1, 256, 3904, 3904, 256, 256]
    - [0, 8.688]
  - - [4032, 2368, 1, 256, 4032, 4032, 256, 256]
    - [0, 8.8]
  - - [64, 2496, 1, 256, 64, 64, 256, 256]
    - [0, 4.857]
  - - [192, 2496, 1, 256, 192, 192, 256, 256]
    - [0, 7.274]
  - - [320, 2496, 1, 256, 320, 320, 256, 256]
    - [0, 7.977]
  - - [448, 2496, 1, 256, 448, 448, 256, 256]
    - [0, 8.362]
  - - [576, 2496, 1, 256, 576, 576, 256, 256]
    - [0, 8.206]
  - - [704, 2496, 1, 256, 704, 704, 256, 256]
    - [0, 8.265]
  - - [832, 2496, 1, 256, 832, 832, 256, 256]
    - [0, 8.381]
  - - [960, 2496, 1, 256, 960, 960, 256, 256]
    - [0, 8.474]
  - - [1088, 2496, 1, 256, 1088, 1088, 256, 256]
    - [0, 8.553]
  - - [1216, 2496, 1, 256, 1216, 1216, 256, 256]
    - [0, 8.486]
  - - [1344, 2496, 1, 256, 1344, 1344, 256, 256]
    - [0, 8.396]
  - - [1472, 2496, 1, 256, 1472, 1472, 256, 256]
    - [0, 8.58]
  - - [1600, 2496, 1, 256, 1600, 1600, 256, 256]
    - [0, 8.601]
  - - [1728, 2496, 1, 256, 1728, 1728, 256, 256]
    - [0, 8.611]
  - - [1856, 2496, 1, 256, 1856, 1856, 256, 256]
    - [0, 8.54]
  - - [1984, 2496, 1, 256, 1984, 1984, 256, 256]
    - [0, 8.698]
  - - [2112, 2496, 1, 256, 2112, 2112, 256, 256]
    - [0, 8.612]
  - - [2240, 2496, 1, 256, 2240, 2240, 256, 256]
    - [0, 8.65]
  - - [2368, 2496, 1, 256, 2368, 2368, 256, 256]
    - [0, 8.639]
  - - [2496, 2496, 1, 256, 2496, 2496, 256, 256]
    - [0, 8.671]
  - - [2624, 2496, 1, 256, 2624, 2624, 256, 256]
    - [0, 8.804]
  - - [2752, 2496, 1, 256, 2752, 2752, 256, 256]
    - [0, 8.722]
  - - [2880, 2496, 1, 256, 2880, 2880, 256, 256]
    - [0, 8.623]
  - - [3008, 2496, 1, 256, 3008, 3008, 256, 256]
    - [0, 8.632]
  - - [3136, 2496, 1, 256, 3136, 3136, 256, 256]
    - [0, 8.706]
  - - [3264, 2496, 1, 256, 3264, 3264, 256, 256]
    - [0, 8.815]
  - - [3392, 2496, 1, 256, 3392, 3392, 256, 256]
    - [0, 8.768]
  - - [3520, 2496, 1, 256, 3520, 3520, 256, 256]
    - [0, 8.732]
  - - [3648, 2496, 1, 256, 3648, 3648, 256, 256]
    - [0, 8.714]
  - - [3776, 2496, 1, 256, 3776, 3776, 256, 256]
    - [0, 8.819]
  - - [3904, 2496, 1, 256, 3904, 3904, 256, 256]
    - [0, 8.78]
  - - [4032, 2496, 1, 256, 4032, 4032, 256, 256]
    - [0, 8.8]
  - - [64, 2624, 1, 256, 64, 64, 256, 256]
    - [0, 5.04]
  - - [192, 2624, 1, 256, 192, 192, 256, 256]
    - [0, 7.025]
  - - [320, 2624, 1, 256, 320, 320, 256, 256]
    - [0, 7.676]
  - - [448, 2624, 1, 256, 448, 448, 256, 256]
    - [0, 8.274]
  - - [576, 2624, 1, 256, 576, 576, 256, 256]
    - [0, 8.306]
  - - [704, 2624, 1, 256, 704, 704, 256, 256]
    - [0, 8.314]
  - - [832, 2624, 1, 256, 832, 832, 256, 256]
    - [0, 8.431]
  - - [960, 2624, 1, 256, 960, 960, 256, 256]
    - [0, 8.388]
  - - [1088, 2624, 1, 256, 1088, 1088, 256, 256]
    - [0, 8.43]
  - - [1216, 2624, 1, 256, 1216, 1216, 256, 256]
    - [0, 8.641]
  - - [1344, 2624, 1, 256, 1344, 1344, 256, 256]
    - [0, 8.571]
  - - [1472, 2624, 1, 256, 1472, 1472, 256, 256]
    - [0, 8.693]
  - - [1600, 2624, 1, 256, 1600, 1600, 256, 256]
    - [0, 8.752]
  - - [1728, 2624, 1, 256, 1728, 1728, 256, 256]
    - [0, 8.589]
  - - [1856, 2624, 1, 256, 1856, 1856, 256, 256]
    - [0, 8.592]
  - - [1984, 2624, 1, 256, 1984, 1984, 256, 256]
    - [0, 8.629]
  - - [2112, 2624, 1, 256, 2112, 2112, 256, 256]
    - [0, 8.587]
  - - [2240, 2624, 1, 256, 2240, 2240, 256, 256]
    - [0, 8.688]
  - - [2368, 2624, 1, 256, 2368, 2368, 256, 256]
    - [0, 8.599]
  - - [2496, 2624, 1, 256, 2496, 2496, 256, 256]
    - [0, 8.558]
  - - [2624, 2624, 1, 256, 2624, 2624, 256, 256]
    - [0, 8.698]
  - - [2752, 2624, 1, 256, 2752, 2752, 256, 256]
    - [0, 8.671]
  - - [2880, 2624, 1, 256, 2880, 2880, 256, 256]
    - [0, 8.84]
  - - [3008, 2624, 1, 256, 3008, 3008, 256, 256]
    - [0, 8.726]
  - - [3136, 2624, 1, 256, 3136, 3136, 256, 256]
    - [0, 8.786]
  - - [3264, 2624, 1, 256, 3264, 3264, 256, 256]
    - [0, 8.692]
  - - [3392, 2624, 1, 256, 3392, 3392, 256, 256]
    - [0, 8.754]
  - - [3520, 2624, 1, 256, 3520, 3520, 256, 256]
    - [0, 8.731]
  - - [3648, 2624, 1, 256, 3648, 3648, 256, 256]
    - [0, 8.76]
  - - [3776, 2624, 1, 256, 3776, 3776, 256, 256]
    - [0, 8.853]
  - - [3904, 2624, 1, 256, 3904, 3904, 256, 256]
    - [0, 8.788]
  - - [4032, 2624, 1, 256, 4032, 4032, 256, 256]
    - [0, 8.796]
  - - [64, 2752, 1, 256, 64, 64, 256, 256]
    - [0, 5.352]
  - - [192, 2752, 1, 256, 192, 192, 256, 256]
    - [0, 7.407]
  - - [320, 2752, 1, 256, 320, 320, 256, 256]
    - [0, 8.141]
  - - [448, 2752, 1, 256, 448, 448, 256, 256]
    - [0, 8.177]
  - - [576, 2752, 1, 256, 576, 576, 256, 256]
    - [0, 8.363]
  - - [704, 2752, 1, 256, 704, 704, 256, 256]
    - [0, 8.249]
  - - [832, 2752, 1, 256, 832, 832, 256, 256]
    - [0, 8.285]
  - - [960, 2752, 1, 256, 960, 960, 256, 256]
    - [0, 8.423]
  - - [1088, 2752, 1, 256, 1088, 1088, 256, 256]
    - [0, 8.324]
  - - [1216, 2752, 1, 256, 1216, 1216, 256, 256]
    - [0, 8.503]
  - - [1344, 2752, 1, 256, 1344, 1344, 256, 256]
    - [0, 8.562]
  - - [1472, 2752, 1, 256, 1472, 1472, 256, 256]
    - [0, 8.702]
  - - [1600, 2752, 1, 256, 1600, 1600, 256, 256]
    - [0, 8.683]
  - - [1728, 2752, 1, 256, 1728, 1728, 256, 256]
    - [0, 8.616]
  - - [1856, 2752, 1, 256, 1856, 1856, 256, 256]
    - [0, 8.626]
  - - [1984, 2752, 1, 256, 1984, 1984, 256, 256]
    - [0, 8.573]
  - - [2112, 2752, 1, 256, 2112, 2112, 256, 256]
    - [0, 8.585]
  - - [2240, 2752, 1, 256, 2240, 2240, 256, 256]
    - [0, 8.638]
  - - [2368, 2752, 1, 256, 2368, 2368, 256, 256]
    - [0, 8.691]
  - - [2496, 2752, 1, 256, 2496, 2496, 256, 256]
    - [0, 8.495]
  - - [2624, 2752, 1, 256, 2624, 2624, 256, 256]
    - [0, 8.603]
  - - [2752, 2752, 1, 256, 2752, 2752, 256, 256]
    - [0, 8.675]
  - - [2880, 2752, 1, 256, 2880, 2880, 256, 256]
    - [0, 8.888]
  - - [3008, 2752, 1, 256, 3008, 3008, 256, 256]
    - [0, 8.898]
  - - [3136, 2752, 1, 256, 3136, 3136, 256, 256]
    - [0, 8.813]
  - - [3264, 2752, 1, 256, 3264, 3264, 256, 256]
    - [0, 8.745]
  - - [3392, 2752, 1, 256, 3392, 3392, 256, 256]
    - [0, 8.787]
  - - [3520, 2752, 1, 256, 3520, 3520, 256, 256]
    - [0, 8.862]
  - - [3648, 2752, 1, 256, 3648, 3648, 256, 256]
    - [0, 8.845]
  - - [3776, 2752, 1, 256, 3776, 3776, 256, 256]
    - [0, 8.815]
  - - [3904, 2752, 1, 256, 3904, 3904, 256, 256]
    - [0, 8.925]
  - - [4032, 2752, 1, 256, 4032, 4032, 256, 256]
    - [0, 8.854]
  - - [64, 2880, 1, 256, 64, 64, 256, 256]
    - [0, 5.59]
  - - [192, 2880, 1, 256, 192, 192, 256, 256]
    - [0, 7.218]
  - - [320, 2880, 1, 256, 320, 320, 256, 256]
    - [0, 8.046]
  - - [448, 2880, 1, 256, 448, 448, 256, 256]
    - [0, 8.141]
  - - [576, 2880, 1, 256, 576, 576, 256, 256]
    - [0, 8.262]
  - - [704, 2880, 1, 256, 704, 704, 256, 256]
    - [0, 8.355]
  - - [832, 2880, 1, 256, 832, 832, 256, 256]
    - [0, 8.375]
  - - [960, 2880, 1, 256, 960, 960, 256, 256]
    - [0, 8.592]
  - - [1088, 2880, 1, 256, 1088, 1088, 256, 256]
    - [0, 8.564]
  - - [1216, 2880, 1, 256, 1216, 1216, 256, 256]
    - [0, 8.576]
  - - [1344, 2880, 1, 256, 1344, 1344, 256, 256]
    - [0, 8.738]
  - - [1472, 2880, 1, 256, 1472, 1472, 256, 256]
    - [0, 8.721]
  - - [1600, 2880, 1, 256, 1600, 1600, 256, 256]
    - [0, 8.568]
  - - [1728, 2880, 1, 256, 1728, 1728, 256, 256]
    - [0, 8.614]
  - - [1856, 2880, 1, 256, 1856, 1856, 256, 256]
    - [0, 8.579]
  - - [1984, 2880, 1, 256, 1984, 1984, 256, 256]
    - [0, 8.585]
  - - [2112, 2880, 1, 256, 2112, 2112, 256, 256]
    - [0, 8.781]
  - - [2240, 2880, 1, 256, 2240, 2240, 256, 256]
    - [0, 8.693]
  - - [2368, 2880, 1, 256, 2368, 2368, 256, 256]
    - [0, 8.625]
  - - [2496, 2880, 1, 256, 2496, 2496, 256, 256]
    - [0, 8.67]
  - - [2624, 2880, 1, 256, 2624, 2624, 256, 256]
    - [0, 8.76]
  - - [2752, 2880, 1, 256, 2752, 2752, 256, 256]
    - [0, 8.709]
  - - [2880, 2880, 1, 256, 2880, 2880, 256, 256]
    - [0, 8.778]
  - - [3008, 2880, 1, 256, 3008, 3008, 256, 256]
    - [0, 8.819]
  - - [3136, 2880, 1, 256, 3136, 3136, 256, 256]
    - [0, 8.858]
  - - [3264, 2880, 1, 256, 3264, 3264, 256, 256]
    - [0, 8.746]
  - - [3392, 2880, 1, 256, 3392, 3392, 256, 256]
    - [0, 8.757]
  - - [3520, 2880, 1, 256, 3520, 3520, 256, 256]
    - [0, 8.839]
  - - [3648, 2880, 1, 256, 3648, 3648, 256, 256]
    - [0, 8.871]
  - - [3776, 2880, 1, 256, 3776, 3776, 256, 256]
    - [0, 8.765]
  - - [3904, 2880, 1, 256, 3904, 3904, 256, 256]
    - [0, 8.819]
  - - [4032, 2880, 1, 256, 4032, 4032, 256, 256]
    - [0, 8.844]
  - - [64, 3008, 1, 256, 64, 64, 256, 256]
    - [0, 5.828]
  - - [192, 3008, 1, 256, 192, 192, 256, 256]
    - [0, 7.545]
  - - [320, 3008, 1, 256, 320, 320, 256, 256]
    - [0, 8.028]
  - - [448, 3008, 1, 256, 448, 448, 256, 256]
    - [0, 8.157]
  - - [576, 3008, 1, 256, 576, 576, 256, 256]
    - [0, 8.168]
  - - [704, 3008, 1, 256, 704, 704, 256, 256]
    - [0, 8.343]
  - - [832, 3008, 1, 256, 832, 832, 256, 256]
    - [0, 8.245]
  - - [960, 3008, 1, 256, 960, 960, 256, 256]
    - [0, 8.435]
  - - [1088, 3008, 1, 256, 1088, 1088, 256, 256]
    - [0, 8.359]
  - - [1216, 3008, 1, 256, 1216, 1216, 256, 256]
    - [0, 8.464]
  - - [1344, 3008, 1, 256, 1344, 1344, 256, 256]
    - [0, 8.421]
  - - [1472, 3008, 1, 256, 1472, 1472, 256, 256]
    - [0, 8.517]
  - - [1600, 3008, 1, 256, 1600, 1600, 256, 256]
    - [0, 8.525]
  - - [1728, 3008, 1, 256, 1728, 1728, 256, 256]
    - [0, 8.541]
  - - [1856, 3008, 1, 256, 1856, 1856, 256, 256]
    - [0, 8.597]
  - - [1984, 3008, 1, 256, 1984, 1984, 256, 256]
    - [0, 8.635]
  - - [2112, 3008, 1, 256, 2112, 2112, 256, 256]
    - [0, 8.741]
  - - [2240, 3008, 1, 256, 2240, 2240, 256, 256]
    - [0, 8.687]
  - - [2368, 3008, 1, 256, 2368, 2368, 256, 256]
    - [0, 8.644]
  - - [2496, 3008, 1, 256, 2496, 2496, 256, 256]
    - [0, 8.736]
  - - [2624, 3008, 1, 256, 2624, 2624, 256, 256]
    - [0, 8.691]
  - - [2752, 3008, 1, 256, 2752, 2752, 256, 256]
    - [0, 8.71]
  - - [2880, 3008, 1, 256, 2880, 2880, 256, 256]
    - [0, 8.718]
  - - [3008, 3008, 1, 256, 3008, 3008, 256, 256]
    - [0, 8.752]
  - - [3136, 3008, 1, 256, 3136, 3136, 256, 256]
    - [0, 8.706]
  - - [3264, 3008, 1, 256, 3264, 3264, 256, 256]
    - [0, 8.889]
  - - [3392, 3008, 1, 256, 3392, 3392, 256, 256]
    - [0, 8.735]
  - - [3520, 3008, 1, 256, 3520, 3520, 256, 256]
    - [0, 8.884]
  - - [3648, 3008, 1, 256, 3648, 3648, 256, 256]
    - [0, 8.781]
  - - [3776, 3008, 1, 256, 3776, 3776, 256, 256]
    - [0, 8.817]
  - - [3904, 3008, 1, 256, 3904, 3904, 256, 256]
    - [0, 8.777]
  - - [4032, 3008, 1, 256, 4032, 4032, 256, 256]
    - [0, 8.843]
  - - [64, 3136, 1, 256, 64, 64, 256, 256]
    - [0, 5.316]
  - - [192, 3136, 1, 256, 192, 192, 256, 256]
    - [0, 7.394]
  - - [320, 3136, 1, 256, 320, 320, 256, 256]
    - [0, 8.194]
  - - [448, 3136, 1, 256, 448, 448, 256, 256]
    - [0, 8.289]
  - - [576, 3136, 1, 256, 576, 576, 256, 256]
    - [0, 8.259]
  - - [704, 3136, 1, 256, 704, 704, 256, 256]
    - [0, 8.255]
  - - [832, 3136, 1, 256, 832, 832, 256, 256]
    - [0, 8.359]
  - - [960, 3136, 1, 256, 960, 960, 256, 256]
    - [0, 8.454]
  - - [1088, 3136, 1, 256, 1088, 1088, 256, 256]
    - [0, 8.535]
  - - [1216, 3136, 1, 256, 1216, 1216, 256, 256]
    - [0, 8.611]
  - - [1344, 3136, 1, 256, 1344, 1344, 256, 256]
    - [0, 8.608]
  - - [1472, 3136, 1, 256, 1472, 1472, 256, 256]
    - [0, 8.595]
  - - [1600, 3136, 1, 256, 1600, 1600, 256, 256]
    - [0, 8.665]
  - - [1728, 3136, 1, 256, 1728, 1728, 256, 256]
    - [0, 8.641]
  - - [1856, 3136, 1, 256, 1856, 1856, 256, 256]
    - [0, 8.546]
  - - [1984, 3136, 1, 256, 1984, 1984, 256, 256]
    - [0, 8.709]
  - - [2112, 3136, 1, 256, 2112, 2112, 256, 256]
    - [0, 8.648]
  - - [2240, 3136, 1, 256, 2240, 2240, 256, 256]
    - [0, 8.707]
  - - [2368, 3136, 1, 256, 2368, 2368, 256, 256]
    - [0, 8.731]
  - - [2496, 3136, 1, 256, 2496, 2496, 256, 256]
    - [0, 8.747]
  - - [2624, 3136, 1, 256, 2624, 2624, 256, 256]
    - [0, 8.774]
  - - [2752, 3136, 1, 256, 2752, 2752, 256, 256]
    - [0, 8.725]
  - - [2880, 3136, 1, 256, 2880, 2880, 256, 256]
    - [0, 8.67]
  - - [3008, 3136, 1, 256, 3008, 3008, 256, 256]
    - [0, 8.749]
  - - [3136, 3136, 1, 256, 3136, 3136, 256, 256]
    - [0, 8.725]
  - - [3264, 3136, 1, 256, 3264, 3264, 256, 256]
    - [0, 8.892]
  - - [3392, 3136, 1, 256, 3392, 3392, 256, 256]
    - [0, 8.8]
  - - [3520, 3136, 1, 256, 3520, 3520, 256, 256]
    - [0, 8.84]
  - - [3648, 3136, 1, 256, 3648, 3648, 256, 256]
    - [0, 8.793]
  - - [3776, 3136, 1, 256, 3776, 3776, 256, 256]
    - [0, 8.875]
  - - [3904, 3136, 1, 256, 3904, 3904, 256, 256]
    - [0, 8.852]
  - - [4032, 3136, 1, 256, 4032, 4032, 256, 256]
    - [0, 8.875]
  - - [64, 3264, 1, 256, 64, 64, 256, 256]
    - [0, 5.517]
  - - [192, 3264, 1, 256, 192, 192, 256, 256]
    - [0, 7.889]
  - - [320, 3264, 1, 256, 320, 320, 256, 256]
    - [0, 8.181]
  - - [448, 3264, 1, 256, 448, 448, 256, 256]
    - [0, 8.281]
  - - [576, 3264, 1, 256, 576, 576, 256, 256]
    - [0, 8.37]
  - - [704, 3264, 1, 256, 704, 704, 256, 256]
    - [0, 8.421]
  - - [832, 3264, 1, 256, 832, 832, 256, 256]
    - [0, 8.404]
  - - [960, 3264, 1, 256, 960, 960, 256, 256]
    - [0, 8.662]
  - - [1088, 3264, 1, 256, 1088, 1088, 256, 256]
    - [0, 8.545]
  - - [1216, 3264, 1, 256, 1216, 1216, 256, 256]
    - [0, 8.732]
  - - [1344, 3264, 1, 256, 1344, 1344, 256, 256]
    - [0, 8.664]
  - - [1472, 3264, 1, 256, 1472, 1472, 256, 256]
    - [0, 8.763]
  - - [1600, 3264, 1, 256, 1600, 1600, 256, 256]
    - [0, 8.716]
  - - [1728, 3264, 1, 256, 1728, 1728, 256, 256]
    - [0, 8.798]
  - - [1856, 3264, 1, 256, 1856, 1856, 256, 256]
    - [0, 8.639]
  - - [1984, 3264, 1, 256, 1984, 1984, 256, 256]
    - [0, 8.75]
  - - [2112, 3264, 1, 256, 2112, 2112, 256, 256]
    - [0, 8.772]
  - - [2240, 3264, 1, 256, 2240, 2240, 256, 256]
    - [0, 8.687]
  - - [2368, 3264, 1, 256, 2368, 2368, 256, 256]
    - [0, 8.841]
  - - [2496, 3264, 1, 256, 2496, 2496, 256, 256]
    - [0, 8.702]
  - - [2624, 3264, 1, 256, 2624, 2624, 256, 256]
    - [0, 8.708]
  - - [2752, 3264, 1, 256, 2752, 2752, 256, 256]
    - [0, 8.761]
  - - [2880, 3264, 1, 256, 2880, 2880, 256, 256]
    - [0, 8.691]
  - - [3008, 3264, 1, 256, 3008, 3008, 256, 256]
    - [0, 8.728]
  - - [3136, 3264, 1, 256, 3136, 3136, 256, 256]
    - [0, 8.895]
  - - [3264, 3264, 1, 256, 3264, 3264, 256, 256]
    - [0, 8.825]
  - - [3392, 3264, 1, 256, 3392, 3392, 256, 256]
    - [0, 8.732]
  - - [3520, 3264, 1, 256, 3520, 3520, 256, 256]
    - [0, 8.823]
  - - [3648, 3264, 1, 256, 3648, 3648, 256, 256]
    - [0, 8.95]
  - - [3776, 3264, 1, 256, 3776, 3776, 256, 256]
    - [0, 8.766]
  - - [3904, 3264, 1, 256, 3904, 3904, 256, 256]
    - [0, 8.914]
  - - [4032, 3264, 1, 256, 4032, 4032, 256, 256]
    - [0, 8.97]
  - - [64, 3392, 1, 256, 64, 64, 256, 256]
    - [0, 5.709]
  - - [192, 3392, 1, 256, 192, 192, 256, 256]
    - [0, 7.72]
  - - [320, 3392, 1, 256, 320, 320, 256, 256]
    - [0, 8.183]
  - - [448, 3392, 1, 256, 448, 448, 256, 256]
    - [0, 8.064]
  - - [576, 3392, 1, 256, 576, 576, 256, 256]
    - [0, 8.284]
  - - [704, 3392, 1, 256, 704, 704, 256, 256]
    - [0, 8.379]
  - - [832, 3392, 1, 256, 832, 832, 256, 256]
    - [0, 8.497]
  - - [960, 3392, 1, 256, 960, 960, 256, 256]
    - [0, 8.629]
  - - [1088, 3392, 1, 256, 1088, 1088, 256, 256]
    - [0, 8.708]
  - - [1216, 3392, 1, 256, 1216, 1216, 256, 256]
    - [0, 8.74]
  - - [1344, 3392, 1, 256, 1344, 1344, 256, 256]
    - [0, 8.829]
  - - [1472, 3392, 1, 256, 1472, 1472, 256, 256]
    - [0, 8.643]
  - - [1600, 3392, 1, 256, 1600, 1600, 256, 256]
    - [0, 8.63]
  - - [1728, 3392, 1, 256, 1728, 1728, 256, 256]
    - [0, 8.67]
  - - [1856, 3392, 1, 256, 1856, 1856, 256, 256]
    - [0, 8.716]
  - - [1984, 3392, 1, 256, 1984, 1984, 256, 256]
    - [0, 8.762]
  - - [2112, 3392, 1, 256, 2112, 2112, 256, 256]
    - [0, 8.771]
  - - [2240, 3392, 1, 256, 2240, 2240, 256, 256]
    - [0, 8.734]
  - - [2368, 3392, 1, 256, 2368, 2368, 256, 256]
    - [0, 8.896]
  - - [2496, 3392, 1, 256, 2496, 2496, 256, 256]
    - [0, 8.874]
  - - [2624, 3392, 1, 256, 2624, 2624, 256, 256]
    - [0, 8.936]
  - - [2752, 3392, 1, 256, 2752, 2752, 256, 256]
    - [0, 8.886]
  - - [2880, 3392, 1, 256, 2880, 2880, 256, 256]
    - [0, 8.866]
  - - [3008, 3392, 1, 256, 3008, 3008, 256, 256]
    - [0, 8.94]
  - - [3136, 3392, 1, 256, 3136, 3136, 256, 256]
    - [0, 9.024]
  - - [3264, 3392, 1, 256, 3264, 3264, 256, 256]
    - [0, 8.936]
  - - [3392, 3392, 1, 256, 3392, 3392, 256, 256]
    - [0, 8.933]
  - - [3520, 3392, 1, 256, 3520, 3520, 256, 256]
    - [0, 8.902]
  - - [3648, 3392, 1, 256, 3648, 3648, 256, 256]
    - [0, 9.005]
  - - [3776, 3392, 1, 256, 3776, 3776, 256, 256]
    - [0, 8.976]
  - - [3904, 3392, 1, 256, 3904, 3904, 256, 256]
    - [0, 8.986]
  - - [4032, 3392, 1, 256, 4032, 4032, 256, 256]
    - [0, 9.026]
  - - [64, 3520, 1, 256, 64, 64, 256, 256]
    - [0, 5.912]
  - - [192, 3520, 1, 256, 192, 192, 256, 256]
    - [0, 7.654]
  - - [320, 3520, 1, 256, 320, 320, 256, 256]
    - [0, 8.254]
  - - [448, 3520, 1, 256, 448, 448, 256, 256]
    - [0, 8.343]
  - - [576, 3520, 1, 256, 576, 576, 256, 256]
    - [0, 8.344]
  - - [704, 3520, 1, 256, 704, 704, 256, 256]
    - [0, 8.421]
  - - [832, 3520, 1, 256, 832, 832, 256, 256]
    - [0, 8.605]
  - - [960, 3520, 1, 256, 960, 960, 256, 256]
    - [0, 8.693]
  - - [1088, 3520, 1, 256, 1088, 1088, 256, 256]
    - [0, 8.727]
  - - [1216, 3520, 1, 256, 1216, 1216, 256, 256]
    - [0, 8.632]
  - - [1344, 3520, 1, 256, 1344, 1344, 256, 256]
    - [0, 8.774]
  - - [1472, 3520, 1, 256, 1472, 1472, 256, 256]
    - [0, 8.749]
  - - [1600, 3520, 1, 256, 1600, 1600, 256, 256]
    - [0, 8.766]
  - - [1728, 3520, 1, 256, 1728, 1728, 256, 256]
    - [0, 8.857]
  - - [1856, 3520, 1, 256, 1856, 1856, 256, 256]
    - [0, 8.625]
  - - [1984, 3520, 1, 256, 1984, 1984, 256, 256]
    - [0, 8.712]
  - - [2112, 3520, 1, 256, 2112, 2112, 256, 256]
    - [0, 8.687]
  - - [2240, 3520, 1, 256, 2240, 2240, 256, 256]
    - [0, 8.68]
  - - [2368, 3520, 1, 256, 2368, 2368, 256, 256]
    - [0, 8.742]
  - - [2496, 3520, 1, 256, 2496, 2496, 256, 256]
    - [0, 8.715]
  - - [2624, 3520, 1, 256, 2624, 2624, 256, 256]
    - [0, 8.784]
  - - [2752, 3520, 1, 256, 2752, 2752, 256, 256]
    - [0, 8.763]
  - - [2880, 3520, 1, 256, 2880, 2880, 256, 256]
    - [0, 8.811]
  - - [3008, 3520, 1, 256, 3008, 3008, 256, 256]
    - [0, 8.848]
  - - [3136, 3520, 1, 256, 3136, 3136, 256, 256]
    - [0, 8.804]
  - - [3264, 3520, 1, 256, 3264, 3264, 256, 256]
    - [0, 8.855]
  - - [3392, 3520, 1, 256, 3392, 3392, 256, 256]
    - [0, 8.874]
  - - [3520, 3520, 1, 256, 3520, 3520, 256, 256]
    - [0, 8.806]
  - - [3648, 3520, 1, 256, 3648, 3648, 256, 256]
    - [0, 8.92]
  - - [3776, 3520, 1, 256, 3776, 3776, 256, 256]
    - [0, 8.904]
  - - [3904, 3520, 1, 256, 3904, 3904, 256, 256]
    - [0, 8.859]
  - - [4032, 3520, 1, 256, 4032, 4032, 256, 256]
    - [0, 8.915]
  - - [64, 3648, 1, 256, 64, 64, 256, 256]
    - [0, 6.138]
  - - [192, 3648, 1, 256, 192, 192, 256, 256]
    - [0, 7.799]
  - - [320, 3648, 1, 256, 320, 320, 256, 256]
    - [0, 8.138]
  - - [448, 3648, 1, 256, 448, 448, 256, 256]
    - [0, 8.412]
  - - [576, 3648, 1, 256, 576, 576, 256, 256]
    - [0, 8.472]
  - - [704, 3648, 1, 256, 704, 704, 256, 256]
    - [0, 8.367]
  - - [832, 3648, 1, 256, 832, 832, 256, 256]
    - [0, 8.313]
  - - [960, 3648, 1, 256, 960, 960, 256, 256]
    - [0, 7.703]
  - - [1088, 3648, 1, 256, 1088, 1088, 256, 256]
    - [0, 8.574]
  - - [1216, 3648, 1, 256, 1216, 1216, 256, 256]
    - [0, 8.624]
  - - [1344, 3648, 1, 256, 1344, 1344, 256, 256]
    - [0, 8.686]
  - - [1472, 3648, 1, 256, 1472, 1472, 256, 256]
    - [0, 8.575]
  - - [1600, 3648, 1, 256, 1600, 1600, 256, 256]
    - [0, 8.697]
  - - [1728, 3648, 1, 256, 1728, 1728, 256, 256]
    - [0, 8.624]
  - - [1856, 3648, 1, 256, 1856, 1856, 256, 256]
    - [0, 8.692]
  - - [1984, 3648, 1, 256, 1984, 1984, 256, 256]
    - [0, 8.711]
  - - [2112, 3648, 1, 256, 2112, 2112, 256, 256]
    - [0, 8.758]
  - - [2240, 3648, 1, 256, 2240, 2240, 256, 256]
    - [0, 8.747]
  - - [2368, 3648, 1, 256, 2368, 2368, 256, 256]
    - [0, 8.759]
  - - [2496, 3648, 1, 256, 2496, 2496, 256, 256]
    - [0, 8.744]
  - - [2624, 3648, 1, 256, 2624, 2624, 256, 256]
    - [0, 8.664]
  - - [2752, 3648, 1, 256, 2752, 2752, 256, 256]
    - [0, 8.495]
  - - [2880, 3648, 1, 256, 2880, 2880, 256, 256]
    - [0, 8.744]
  - - [3008, 3648, 1, 256, 3008, 3008, 256, 256]
    - [0, 8.927]
  - - [3136, 3648, 1, 256, 3136, 3136, 256, 256]
    - [0, 8.871]
  - - [3264, 3648, 1, 256, 3264, 3264, 256, 256]
    - [0, 8.824]
  - - [3392, 3648, 1, 256, 3392, 3392, 256, 256]
    - [0, 8.945]
  - - [3520, 3648, 1, 256, 3520, 3520, 256, 256]
    - [0, 8.935]
  - - [3648, 3648, 1, 256, 3648, 3648, 256, 256]
    - [0, 8.907]
  - - [3776, 3648, 1, 256, 3776, 3776, 256, 256]
    - [0, 8.915]
  - - [3904, 3648, 1, 256, 3904, 3904, 256, 256]
    - [0, 8.922]
  - - [4032, 3648, 1, 256, 4032, 4032, 256, 256]
    - [0, 8.939]
  - - [64, 3776, 1, 256, 64, 64, 256, 256]
    - [0, 6.346]
  - - [192, 3776, 1, 256, 192, 192, 256, 256]
    - [0, 7.889]
  - - [320, 3776, 1, 256, 320, 320, 256, 256]
    - [0, 8.28]
  - - [448, 3776, 1, 256, 448, 448, 256, 256]
    - [0, 8.303]
  - - [576, 3776, 1, 256, 576, 576, 256, 256]
    - [0, 8.454]
  - - [704, 3776, 1, 256, 704, 704, 256, 256]
    - [0, 8.446]
  - - [832, 3776, 1, 256, 832, 832, 256, 256]
    - [0, 8.635]
  - - [960, 3776, 1, 256, 960, 960, 256, 256]
    - [0, 8.558]
  - - [1088, 3776, 1, 256, 1088, 1088, 256, 256]
    - [0, 8.618]
  - - [1216, 3776, 1, 256, 1216, 1216, 256, 256]
    - [0, 8.623]
  - - [1344, 3776, 1, 256, 1344, 1344, 256, 256]
    - [0, 8.751]
  - - [1472, 3776, 1, 256, 1472, 1472, 256, 256]
    - [0, 8.652]
  - - [1600, 3776, 1, 256, 1600, 1600, 256, 256]
    - [0, 8.81]
  - - [1728, 3776, 1, 256, 1728, 1728, 256, 256]
    - [0, 8.666]
  - - [1856, 3776, 1, 256, 1856, 1856, 256, 256]
    - [0, 8.738]
  - - [1984, 3776, 1, 256, 1984, 1984, 256, 256]
    - [0, 8.79]
  - - [2112, 3776, 1, 256, 2112, 2112, 256, 256]
    - [0, 8.869]
  - - [2240, 3776, 1, 256, 2240, 2240, 256, 256]
    - [0, 8.78]
  - - [2368, 3776, 1, 256, 2368, 2368, 256, 256]
    - [0, 8.892]
  - - [2496, 3776, 1, 256, 2496, 2496, 256, 256]
    - [0, 8.945]
  - - [2624, 3776, 1, 256, 2624, 2624, 256, 256]
    - [0, 8.92]
  - - [2752, 3776, 1, 256, 2752, 2752, 256, 256]
    - [0, 8.866]
  - - [2880, 3776, 1, 256, 2880, 2880, 256, 256]
    - [0, 8.996]
  - - [3008, 3776, 1, 256, 3008, 3008, 256, 256]
    - [0, 9.074]
  - - [3136, 3776, 1, 256, 3136, 3136, 256, 256]
    - [0, 9.012]
  - - [3264, 3776, 1, 256, 3264, 3264, 256, 256]
    - [0, 8.942]
  - - [3392, 3776, 1, 256, 3392, 3392, 256, 256]
    - [0, 8.851]
  - - [3520, 3776, 1, 256, 3520, 3520, 256, 256]
    - [0, 8.915]
  - - [3648, 3776, 1, 256, 3648, 3648, 256, 256]
    - [0, 8.932]
  - - [3776, 3776, 1, 256, 3776, 3776, 256, 256]
    - [0, 8.895]
  - - [3904, 3776, 1, 256, 3904, 3904, 256, 256]
    - [0, 8.889]
  - - [4032, 3776, 1, 256, 4032, 4032, 256, 256]
    - [0, 9.072]
  - - [64, 3904, 1, 256, 64, 64, 256, 256]
    - [0, 5.768]
  - - [192, 3904, 1, 256, 192, 192, 256, 256]
    - [0, 7.767]
  - - [320, 3904, 1, 256, 320, 320, 256, 256]
    - [0, 8.101]
  - - [448, 3904, 1, 256, 448, 448, 256, 256]
    - [0, 8.332]
  - - [576, 3904, 1, 256, 576, 576, 256, 256]
    - [0, 8.393]
  - - [704, 3904, 1, 256, 704, 704, 256, 256]
    - [0, 8.436]
  - - [832, 3904, 1, 256, 832, 832, 256, 256]
    - [0, 8.454]
  - - [960, 3904, 1, 256, 960, 960, 256, 256]
    - [0, 8.546]
  - - [1088, 3904, 1, 256, 1088, 1088, 256, 256]
    - [0, 8.474]
  - - [1216, 3904, 1, 256, 1216, 1216, 256, 256]
    - [0, 8.767]
  - - [1344, 3904, 1, 256, 1344, 1344, 256, 256]
    - [0, 8.723]
  - - [1472, 3904, 1, 256, 1472, 1472, 256, 256]
    - [0, 8.747]
  - - [1600, 3904, 1, 256, 1600, 1600, 256, 256]
    - [0, 8.772]
  - - [1728, 3904, 1, 256, 1728, 1728, 256, 256]
    - [0, 8.711]
  - - [1856, 3904, 1, 256, 1856, 1856, 256, 256]
    - [0, 8.757]
  - - [1984, 3904, 1, 256, 1984, 1984, 256, 256]
    - [0, 8.927]
  - - [2112, 3904, 1, 256, 2112, 2112, 256, 256]
    - [0, 8.78]
  - - [2240, 3904, 1, 256, 2240, 2240, 256, 256]
    - [0, 8.887]
  - - [2368, 3904, 1, 256, 2368, 2368, 256, 256]
    - [0, 8.91]
  - - [2496, 3904, 1, 256, 2496, 2496, 256, 256]
    - [0, 8.985]
  - - [2624, 3904, 1, 256, 2624, 2624, 256, 256]
    - [0, 8.928]
  - - [2752, 3904, 1, 256, 2752, 2752, 256, 256]
    - [0, 8.83]
  - - [2880, 3904, 1, 256, 2880, 2880, 256, 256]
    - [0, 8.967]
  - - [3008, 3904, 1, 256, 3008, 3008, 256, 256]
    - [0, 8.935]
  - - [3136, 3904, 1, 256, 3136, 3136, 256, 256]
    - [0, 8.954]
  - - [3264, 3904, 1, 256, 3264, 3264, 256, 256]
    - [0, 8.958]
  - - [3392, 3904, 1, 256, 3392, 3392, 256, 256]
    - [0, 8.995]
  - - [3520, 3904, 1, 256, 3520, 3520, 256, 256]
    - [0, 9.03]
  - - [3648, 3904, 1, 256, 3648, 3648, 256, 256]
    - [0, 9.025]
  - - [3776, 3904, 1, 256, 3776, 3776, 256, 256]
    - [0, 9.154]
  - - [3904, 3904, 1, 256, 3904, 3904, 256, 256]
    - [0, 8.761]
  - - [4032, 3904, 1, 256, 4032, 4032, 256, 256]
    - [0, 9.137]
  - - [64, 4032, 1, 256, 64, 64, 256, 256]
    - [0, 5.944]
  - - [192, 4032, 1, 256, 192, 192, 256, 256]
    - [0, 7.939]
  - - [320, 4032, 1, 256, 320, 320, 256, 256]
    - [0, 8.137]
  - - [448, 4032, 1, 256, 448, 448, 256, 256]
    - [0, 8.38]
  - - [576, 4032, 1, 256, 576, 576, 256, 256]
    - [0, 8.585]
  - - [704, 4032, 1, 256, 704, 704, 256, 256]
    - [0, 8.679]
  - - [832, 4032, 1, 256, 832, 832, 256, 256]
    - [0, 8.733]
  - - [960, 4032, 1, 256, 960, 960, 256, 256]
    - [0, 8.691]
  - - [1088, 4032, 1, 256, 1088, 1088, 256, 256]
    - [0, 8.725]
  - - [1216, 4032, 1, 256, 1216, 1216, 256, 256]
    - [0, 8.637]
  - - [1344, 4032, 1, 256, 1344, 1344, 256, 256]
    - [0, 8.651]
  - - [1472, 4032, 1, 256, 1472, 1472, 256, 256]
    - [0, 8.642]
  - - [1600, 4032, 1, 256, 1600, 1600, 256, 256]
    - [0, 8.638]
  - - [1728, 4032, 1, 256, 1728, 1728, 256, 256]
    - [0, 8.768]
  - - [1856, 4032, 1, 256, 1856, 1856, 256, 256]
    - [0, 8.741]
  - - [1984, 4032, 1, 256, 1984, 1984, 256, 256]
    - [0, 8.691]
  - - [2112, 4032, 1, 256, 2112, 2112, 256, 256]
    - [0, 8.813]
  - - [2240, 4032, 1, 256, 2240, 2240, 256, 256]
    - [0, 8.683]
  - - [2368, 4032, 1, 256, 2368, 2368, 256, 256]
    - [0, 8.764]
  - - [2496, 4032, 1, 256, 2496, 2496, 256, 256]
    - [0, 8.84]
  - - [2624, 4032, 1, 256, 2624, 2624, 256, 256]
    - [0, 8.799]
  - - [2752, 4032, 1, 256, 2752, 2752, 256, 256]
    - [0, 8.803]
  - - [2880, 4032, 1, 256, 2880, 2880, 256, 256]
    - [0, 8.828]
  - - [3008, 4032, 1, 256, 3008, 3008, 256, 256]
    - [0, 8.969]
  - - [3136, 4032, 1, 256, 3136, 3136, 256, 256]
    - [0, 8.912]
  - - [3264, 4032, 1, 256, 3264, 3264, 256, 256]
    - [0, 8.994]
  - - [3392, 4032, 1, 256, 3392, 3392, 256, 256]
    - [0, 8.919]
  - - [3520, 4032, 1, 256, 3520, 3520, 256, 256]
    - [0, 8.93]
  - - [3648, 4032, 1, 256, 3648, 3648, 256, 256]
    - [0, 8.942]
  - - [3776, 4032, 1, 256, 3776, 3776, 256, 256]
    - [0, 8.801]
  - - [3904, 4032, 1, 256, 3904, 3904, 256, 256]
    - [0, 8.757]
  - - [4032, 4032, 1, 256, 4032, 4032, 256, 256]
    - [0, 9.034]
  - - [64, 64, 1, 512, 64, 64, 512, 512]
    - [1, 0.487]
  - - [192, 64, 1, 512, 192, 192, 512, 512]
    - [1, 1.46]
  - - [320, 64, 1, 512, 320, 320, 512, 512]
    - [3, 2.164]
  - - [448, 64, 1, 512, 448, 448, 512, 512]
    - [0, 2.559]
  - - [576, 64, 1, 512, 576, 576, 512, 512]
    - [0, 3.286]
  - - [704, 64, 1, 512, 704, 704, 512, 512]
    - [0, 4.007]
  - - [832, 64, 1, 512, 832, 832, 512, 512]
    - [0, 3.199]
  - - [960, 64, 1, 512, 960, 960, 512, 512]
    - [0, 3.674]
  - - [1088, 64, 1, 512, 1088, 1088, 512, 512]
    - [0, 4.142]
  - - [1216, 64, 1, 512, 1216, 1216, 512, 512]
    - [0, 4.625]
  - - [1344, 64, 1, 512, 1344, 1344, 512, 512]
    - [0, 5.118]
  - - [1472, 64, 1, 512, 1472, 1472, 512, 512]
    - [0, 5.589]
  - - [1600, 64, 1, 512, 1600, 1600, 512, 512]
    - [0, 4.586]
  - - [1728, 64, 1, 512, 1728, 1728, 512, 512]
    - [0, 4.934]
  - - [1856, 64, 1, 512, 1856, 1856, 512, 512]
    - [0, 5.293]
  - - [1984, 64, 1, 512, 1984, 1984, 512, 512]
    - [0, 5.652]
  - - [2112, 64, 1, 512, 2112, 2112, 512, 512]
    - [0, 6.011]
  - - [2240, 64, 1, 512, 2240, 2240, 512, 512]
    - [0, 6.38]
  - - [2368, 64, 1, 512, 2368, 2368, 512, 512]
    - [0, 5.419]
  - - [2496, 64, 1, 512, 2496, 2496, 512, 512]
    - [0, 5.655]
  - - [2624, 64, 1, 512, 2624, 2624, 512, 512]
    - [0, 5.938]
  - - [2752, 64, 1, 512, 2752, 2752, 512, 512]
    - [0, 6.224]
  - - [2880, 64, 1, 512, 2880, 2880, 512, 512]
    - [0, 6.511]
  - - [3008, 64, 1, 512, 3008, 3008, 512, 512]
    - [0, 6.795]
  - - [3136, 64, 1, 512, 3136, 3136, 512, 512]
    - [0, 6.068]
  - - [3264, 64, 1, 512, 3264, 3264, 512, 512]
    - [0, 6.266]
  - - [3392, 64, 1, 512, 3392, 3392, 512, 512]
    - [0, 6.492]
  - - [3520, 64, 1, 512, 3520, 3520, 512, 512]
    - [0, 6.756]
  - - [3648, 64, 1, 512, 3648, 3648, 512, 512]
    - [0, 6.98]
  - - [3776, 64, 1, 512, 3776, 3776, 512, 512]
    - [0, 7.205]
  - - [3904, 64, 1, 512, 3904, 3904, 512, 512]
    - [0, 6.446]
  - - [4032, 64, 1, 512, 4032, 4032, 512, 512]
    - [0, 6.62]
  - - [64, 192, 1, 512, 64, 64, 512, 512]
    - [1, 1.398]
  - - [192, 192, 1, 512, 192, 192, 512, 512]
    - [0, 3.244]
  - - [320, 192, 1, 512, 320, 320, 512, 512]
    - [0, 3.632]
  - - [448, 192, 1, 512, 448, 448, 512, 512]
    - [0, 5.072]
  - - [576, 192, 1, 512, 576, 576, 512, 512]
    - [0, 4.898]
  - - [704, 192, 1, 512, 704, 704, 512, 512]
    - [0, 5.963]
  - - [832, 192, 1, 512, 832, 832, 512, 512]
    - [0, 5.66]
  - - [960, 192, 1, 512, 960, 960, 512, 512]
    - [0, 6.515]
  - - [1088, 192, 1, 512, 1088, 1088, 512, 512]
    - [0, 6.283]
  - - [1216, 192, 1, 512, 1216, 1216, 512, 512]
    - [0, 6.999]
  - - [1344, 192, 1, 512, 1344, 1344, 512, 512]
    - [0, 6.659]
  - - [1472, 192, 1, 512, 1472, 1472, 512, 512]
    - [0, 7.29]
  - - [1600, 192, 1, 512, 1600, 1600, 512, 512]
    - [0, 6.922]
  - - [1728, 192, 1, 512, 1728, 1728, 512, 512]
    - [0, 7.469]
  - - [1856, 192, 1, 512, 1856, 1856, 512, 512]
    - [0, 7.124]
  - - [1984, 192, 1, 512, 1984, 1984, 512, 512]
    - [0, 7.884]
  - - [2112, 192, 1, 512, 2112, 2112, 512, 512]
    - [0, 7.384]
  - - [2240, 192, 1, 512, 2240, 2240, 512, 512]
    - [0, 8.003]
  - - [2368, 192, 1, 512, 2368, 2368, 512, 512]
    - [0, 7.782]
  - - [2496, 192, 1, 512, 2496, 2496, 512, 512]
    - [0, 8.048]
  - - [2624, 192, 1, 512, 2624, 2624, 512, 512]
    - [0, 7.858]
  - - [2752, 192, 1, 512, 2752, 2752, 512, 512]
    - [0, 8.121]
  - - [2880, 192, 1, 512, 2880, 2880, 512, 512]
    - [0, 7.815]
  - - [3008, 192, 1, 512, 3008, 3008, 512, 512]
    - [0, 8.051]
  - - [3136, 192, 1, 512, 3136, 3136, 512, 512]
    - [0, 7.932]
  - - [3264, 192, 1, 512, 3264, 3264, 512, 512]
    - [0, 8.051]
  - - [3392, 192, 1, 512, 3392, 3392, 512, 512]
    - [0, 8.1]
  - - [3520, 192, 1, 512, 3520, 3520, 512, 512]
    - [0, 8.152]
  - - [3648, 192, 1, 512, 3648, 3648, 512, 512]
    - [0, 8.18]
  - - [3776, 192, 1, 512, 3776, 3776, 512, 512]
    - [0, 8.263]
  - - [3904, 192, 1, 512, 3904, 3904, 512, 512]
    - [0, 8.069]
  - - [4032, 192, 1, 512, 4032, 4032, 512, 512]
    - [0, 8.187]
  - - [64, 320, 1, 512, 64, 64, 512, 512]
    - [1, 1.311]
  - - [192, 320, 1, 512, 192, 192, 512, 512]
    - [0, 3.632]
  - - [320, 320, 1, 512, 320, 320, 512, 512]
    - [0, 4.535]
  - - [448, 320, 1, 512, 448, 448, 512, 512]
    - [0, 6.324]
  - - [576, 320, 1, 512, 576, 576, 512, 512]
    - [0, 6.517]
  - - [704, 320, 1, 512, 704, 704, 512, 512]
    - [0, 6.755]
  - - [832, 320, 1, 512, 832, 832, 512, 512]
    - [0, 6.867]
  - - [960, 320, 1, 512, 960, 960, 512, 512]
    - [0, 6.978]
  - - [1088, 320, 1, 512, 1088, 1088, 512, 512]
    - [0, 6.972]
  - - [1216, 320, 1, 512, 1216, 1216, 512, 512]
    - [0, 7.916]
  - - [1344, 320, 1, 512, 1344, 1344, 512, 512]
    - [0, 8.029]
  - - [1472, 320, 1, 512, 1472, 1472, 512, 512]
    - [0, 7.927]
  - - [1600, 320, 1, 512, 1600, 1600, 512, 512]
    - [0, 7.93]
  - - [1728, 320, 1, 512, 1728, 1728, 512, 512]
    - [0, 7.923]
  - - [1856, 320, 1, 512, 1856, 1856, 512, 512]
    - [0, 7.989]
  - - [1984, 320, 1, 512, 1984, 1984, 512, 512]
    - [0, 8.223]
  - - [2112, 320, 1, 512, 2112, 2112, 512, 512]
    - [0, 8.194]
  - - [2240, 320, 1, 512, 2240, 2240, 512, 512]
    - [0, 8.146]
  - - [2368, 320, 1, 512, 2368, 2368, 512, 512]
    - [0, 8.168]
  - - [2496, 320, 1, 512, 2496, 2496, 512, 512]
    - [0, 8.201]
  - - [2624, 320, 1, 512, 2624, 2624, 512, 512]
    - [0, 8.226]
  - - [2752, 320, 1, 512, 2752, 2752, 512, 512]
    - [0, 8.327]
  - - [2880, 320, 1, 512, 2880, 2880, 512, 512]
    - [0, 8.34]
  - - [3008, 320, 1, 512, 3008, 3008, 512, 512]
    - [0, 8.321]
  - - [3136, 320, 1, 512, 3136, 3136, 512, 512]
    - [0, 8.201]
  - - [3264, 320, 1, 512, 3264, 3264, 512, 512]
    - [0, 8.219]
  - - [3392, 320, 1, 512, 3392, 3392, 512, 512]
    - [0, 8.459]
  - - [3520, 320, 1, 512, 3520, 3520, 512, 512]
    - [0, 8.395]
  - - [3648, 320, 1, 512, 3648, 3648, 512, 512]
    - [0, 8.261]
  - - [3776, 320, 1, 512, 3776, 3776, 512, 512]
    - [0, 8.397]
  - - [3904, 320, 1, 512, 3904, 3904, 512, 512]
    - [0, 8.458]
  - - [4032, 320, 1, 512, 4032, 4032, 512, 512]
    - [0, 8.503]
  - - [64, 448, 1, 512, 64, 64, 512, 512]
    - [3, 1.822]
  - - [192, 448, 1, 512, 192, 192, 512, 512]
    - [0, 5.129]
  - - [320, 448, 1, 512, 320, 320, 512, 512]
    - [0, 6.378]
  - - [448, 448, 1, 512, 448, 448, 512, 512]
    - [0, 6.093]
  - - [576, 448, 1, 512, 576, 576, 512, 512]
    - [0, 6.669]
  - - [704, 448, 1, 512, 704, 704, 512, 512]
    - [0, 7.096]
  - - [832, 448, 1, 512, 832, 832, 512, 512]
    - [0, 7.607]
  - - [960, 448, 1, 512, 960, 960, 512, 512]
    - [0, 7.934]
  - - [1088, 448, 1, 512, 1088, 1088, 512, 512]
    - [0, 8.2]
  - - [1216, 448, 1, 512, 1216, 1216, 512, 512]
    - [0, 8.027]
  - - [1344, 448, 1, 512, 1344, 1344, 512, 512]
    - [0, 8.057]
  - - [1472, 448, 1, 512, 1472, 1472, 512, 512]
    - [0, 8.159]
  - - [1600, 448, 1, 512, 1600, 1600, 512, 512]
    - [0, 8.196]
  - - [1728, 448, 1, 512, 1728, 1728, 512, 512]
    - [0, 8.238]
  - - [1856, 448, 1, 512, 1856, 1856, 512, 512]
    - [0, 8.44]
  - - [1984, 448, 1, 512, 1984, 1984, 512, 512]
    - [0, 8.347]
  - - [2112, 448, 1, 512, 2112, 2112, 512, 512]
    - [0, 8.221]
  - - [2240, 448, 1, 512, 2240, 2240, 512, 512]
    - [0, 8.359]
  - - [2368, 448, 1, 512, 2368, 2368, 512, 512]
    - [0, 8.356]
  - - [2496, 448, 1, 512, 2496, 2496, 512, 512]
    - [0, 8.411]
  - - [2624, 448, 1, 512, 2624, 2624, 512, 512]
    - [0, 8.405]
  - - [2752, 448, 1, 512, 2752, 2752, 512, 512]
    - [0, 8.542]
  - - [2880, 448, 1, 512, 2880, 2880, 512, 512]
    - [0, 8.431]
  - - [3008, 448, 1, 512, 3008, 3008, 512, 512]
    - [0, 8.374]
  - - [3136, 448, 1, 512, 3136, 3136, 512, 512]
    - [0, 8.488]
  - - [3264, 448, 1, 512, 3264, 3264, 512, 512]
    - [0, 8.574]
  - - [3392, 448, 1, 512, 3392, 3392, 512, 512]
    - [0, 8.538]
  - - [3520, 448, 1, 512, 3520, 3520, 512, 512]
    - [0, 8.648]
  - - [3648, 448, 1, 512, 3648, 3648, 512, 512]
    - [0, 8.584]
  - - [3776, 448, 1, 512, 3776, 3776, 512, 512]
    - [0, 8.561]
  - - [3904, 448, 1, 512, 3904, 3904, 512, 512]
    - [0, 8.641]
  - - [4032, 448, 1, 512, 4032, 4032, 512, 512]
    - [0, 8.662]
  - - [64, 576, 1, 512, 64, 64, 512, 512]
    - [1, 2.351]
  - - [192, 576, 1, 512, 192, 192, 512, 512]
    - [0, 4.928]
  - - [320, 576, 1, 512, 320, 320, 512, 512]
    - [0, 6.553]
  - - [448, 576, 1, 512, 448, 448, 512, 512]
    - [0, 6.71]
  - - [576, 576, 1, 512, 576, 576, 512, 512]
    - [0, 7.496]
  - - [704, 576, 1, 512, 704, 704, 512, 512]
    - [0, 7.43]
  - - [832, 576, 1, 512, 832, 832, 512, 512]
    - [0, 8.217]
  - - [960, 576, 1, 512, 960, 960, 512, 512]
    - [0, 8.041]
  - - [1088, 576, 1, 512, 1088, 1088, 512, 512]
    - [0, 8.2]
  - - [1216, 576, 1, 512, 1216, 1216, 512, 512]
    - [0, 8.173]
  - - [1344, 576, 1, 512, 1344, 1344, 512, 512]
    - [0, 8.243]
  - - [1472, 576, 1, 512, 1472, 1472, 512, 512]
    - [0, 8.261]
  - - [1600, 576, 1, 512, 1600, 1600, 512, 512]
    - [0, 8.302]
  - - [1728, 576, 1, 512, 1728, 1728, 512, 512]
    - [0, 8.365]
  - - [1856, 576, 1, 512, 1856, 1856, 512, 512]
    - [0, 8.43]
  - - [1984, 576, 1, 512, 1984, 1984, 512, 512]
    - [0, 8.356]
  - - [2112, 576, 1, 512, 2112, 2112, 512, 512]
    - [0, 8.49]
  - - [2240, 576, 1, 512, 2240, 2240, 512, 512]
    - [0, 8.506]
  - - [2368, 576, 1, 512, 2368, 2368, 512, 512]
    - [0, 8.522]
  - - [2496, 576, 1, 512, 2496, 2496, 512, 512]
    - [0, 8.608]
  - - [2624, 576, 1, 512, 2624, 2624, 512, 512]
    - [0, 8.569]
  - - [2752, 576, 1, 512, 2752, 2752, 512, 512]
    - [0, 8.644]
  - - [2880, 576, 1, 512, 2880, 2880, 512, 512]
    - [0, 8.572]
  - - [3008, 576, 1, 512, 3008, 3008, 512, 512]
    - [0, 8.675]
  - - [3136, 576, 1, 512, 3136, 3136, 512, 512]
    - [0, 8.617]
  - - [3264, 576, 1, 512, 3264, 3264, 512, 512]
    - [0, 8.718]
  - - [3392, 576, 1, 512, 3392, 3392, 512, 512]
    - [0, 8.619]
  - - [3520, 576, 1, 512, 3520, 3520, 512, 512]
    - [0, 8.771]
  - - [3648, 576, 1, 512, 3648, 3648, 512, 512]
    - [0, 8.69]
  - - [3776, 576, 1, 512, 3776, 3776, 512, 512]
    - [0, 8.755]
  - - [3904, 576, 1, 512, 3904, 3904, 512, 512]
    - [0, 8.683]
  - - [4032, 576, 1, 512, 4032, 4032, 512, 512]
    - [0, 8.782]
  - - [64, 704, 1, 512, 64, 64, 512, 512]
    - [1, 2.848]
  - - [192, 704, 1, 512, 192, 192, 512, 512]
    - [0, 5.959]
  - - [320, 704, 1, 512, 320, 320, 512, 512]
    - [0, 6.762]
  - - [448, 704, 1, 512, 448, 448, 512, 512]
    - [0, 7.099]
  - - [576, 704, 1, 512, 576, 576, 512, 512]
    - [0, 7.435]
  - - [704, 704, 1, 512, 704, 704, 512, 512]
    - [0, 7.978]
  - - [832, 704, 1, 512, 832, 832, 512, 512]
    - [0, 8.332]
  - - [960, 704, 1, 512, 960, 960, 512, 512]
    - [0, 8.187]
  - - [1088, 704, 1, 512, 1088, 1088, 512, 512]
    - [0, 8.153]
  - - [1216, 704, 1, 512, 1216, 1216, 512, 512]
    - [0, 8.206]
  - - [1344, 704, 1, 512, 1344, 1344, 512, 512]
    - [0, 8.239]
  - - [1472, 704, 1, 512, 1472, 1472, 512, 512]
    - [0, 8.327]
  - - [1600, 704, 1, 512, 1600, 1600, 512, 512]
    - [0, 8.464]
  - - [1728, 704, 1, 512, 1728, 1728, 512, 512]
    - [0, 8.406]
  - - [1856, 704, 1, 512, 1856, 1856, 512, 512]
    - [0, 8.463]
  - - [1984, 704, 1, 512, 1984, 1984, 512, 512]
    - [0, 8.493]
  - - [2112, 704, 1, 512, 2112, 2112, 512, 512]
    - [0, 8.577]
  - - [2240, 704, 1, 512, 2240, 2240, 512, 512]
    - [0, 8.672]
  - - [2368, 704, 1, 512, 2368, 2368, 512, 512]
    - [0, 8.668]
  - - [2496, 704, 1, 512, 2496, 2496, 512, 512]
    - [0, 8.576]
  - - [2624, 704, 1, 512, 2624, 2624, 512, 512]
    - [0, 8.64]
  - - [2752, 704, 1, 512, 2752, 2752, 512, 512]
    - [0, 8.571]
  - - [2880, 704, 1, 512, 2880, 2880, 512, 512]
    - [0, 8.721]
  - - [3008, 704, 1, 512, 3008, 3008, 512, 512]
    - [0, 8.714]
  - - [3136, 704, 1, 512, 3136, 3136, 512, 512]
    - [0, 8.773]
  - - [3264, 704, 1, 512, 3264, 3264, 512, 512]
    - [0, 8.675]
  - - [3392, 704, 1, 512, 3392, 3392, 512, 512]
    - [0, 8.728]
  - - [3520, 704, 1, 512, 3520, 3520, 512, 512]
    - [0, 8.782]
  - - [3648, 704, 1, 512, 3648, 3648, 512, 512]
    - [0, 8.757]
  - - [3776, 704, 1, 512, 3776, 3776, 512, 512]
    - [0, 8.724]
  - - [3904, 704, 1, 512, 3904, 3904, 512, 512]
    - [0, 8.765]
  - - [4032, 704, 1, 512, 4032, 4032, 512, 512]
    - [0, 8.758]
  - - [64, 832, 1, 512, 64, 64, 512, 512]
    - [0, 3.146]
  - - [192, 832, 1, 512, 192, 192, 512, 512]
    - [0, 5.655]
  - - [320, 832, 1, 512, 320, 320, 512, 512]
    - [0, 6.854]
  - - [448, 832, 1, 512, 448, 448, 512, 512]
    - [0, 7.439]
  - - [576, 832, 1, 512, 576, 576, 512, 512]
    - [0, 8.083]
  - - [704, 832, 1, 512, 704, 704, 512, 512]
    - [0, 8.138]
  - - [832, 832, 1, 512, 832, 832, 512, 512]
    - [0, 8.152]
  - - [960, 832, 1, 512, 960, 960, 512, 512]
    - [0, 8.205]
  - - [1088, 832, 1, 512, 1088, 1088, 512, 512]
    - [0, 8.206]
  - - [1216, 832, 1, 512, 1216, 1216, 512, 512]
    - [0, 8.359]
  - - [1344, 832, 1, 512, 1344, 1344, 512, 512]
    - [0, 8.378]
  - - [1472, 832, 1, 512, 1472, 1472, 512, 512]
    - [0, 8.426]
  - - [1600, 832, 1, 512, 1600, 1600, 512, 512]
    - [0, 8.563]
  - - [1728, 832, 1, 512, 1728, 1728, 512, 512]
    - [0, 8.614]
  - - [1856, 832, 1, 512, 1856, 1856, 512, 512]
    - [0, 8.485]
  - - [1984, 832, 1, 512, 1984, 1984, 512, 512]
    - [0, 8.607]
  - - [2112, 832, 1, 512, 2112, 2112, 512, 512]
    - [0, 8.637]
  - - [2240, 832, 1, 512, 2240, 2240, 512, 512]
    - [0, 8.565]
  - - [2368, 832, 1, 512, 2368, 2368, 512, 512]
    - [0, 8.692]
  - - [2496, 832, 1, 512, 2496, 2496, 512, 512]
    - [0, 8.698]
  - - [2624, 832, 1, 512, 2624, 2624, 512, 512]
    - [0, 8.727]
  - - [2752, 832, 1, 512, 2752, 2752, 512, 512]
    - [0, 8.711]
  - - [2880, 832, 1, 512, 2880, 2880, 512, 512]
    - [0, 8.755]
  - - [3008, 832, 1, 512, 3008, 3008, 512, 512]
    - [0, 8.774]
  - - [3136, 832, 1, 512, 3136, 3136, 512, 512]
    - [0, 8.818]
  - - [3264, 832, 1, 512, 3264, 3264, 512, 512]
    - [0, 8.777]
  - - [3392, 832, 1, 512, 3392, 3392, 512, 512]
    - [0, 8.745]
  - - [3520, 832, 1, 512, 3520, 3520, 512, 512]
    - [0, 8.825]
  - - [3648, 832, 1, 512, 3648, 3648, 512, 512]
    - [0, 8.669]
  - - [3776, 832, 1, 512, 3776, 3776, 512, 512]
    - [0, 8.771]
  - - [3904, 832, 1, 512, 3904, 3904, 512, 512]
    - [0, 8.783]
  - - [4032, 832, 1, 512, 4032, 4032, 512, 512]
    - [0, 8.823]
  - - [64, 960, 1, 512, 64, 64, 512, 512]
    - [0, 3.63]
  - - [192, 960, 1, 512, 192, 192, 512, 512]
    - [0, 6.499]
  - - [320, 960, 1, 512, 320, 320, 512, 512]
    - [0, 6.926]
  - - [448, 960, 1, 512, 448, 448, 512, 512]
    - [0, 8.034]
  - - [576, 960, 1, 512, 576, 576, 512, 512]
    - [0, 8.008]
  - - [704, 960, 1, 512, 704, 704, 512, 512]
    - [0, 8.316]
  - - [832, 960, 1, 512, 832, 832, 512, 512]
    - [0, 8.325]
  - - [960, 960, 1, 512, 960, 960, 512, 512]
    - [0, 8.367]
  - - [1088, 960, 1, 512, 1088, 1088, 512, 512]
    - [0, 8.392]
  - - [1216, 960, 1, 512, 1216, 1216, 512, 512]
    - [0, 8.37]
  - - [1344, 960, 1, 512, 1344, 1344, 512, 512]
    - [0, 8.541]
  - - [1472, 960, 1, 512, 1472, 1472, 512, 512]
    - [0, 8.526]
  - - [1600, 960, 1, 512, 1600, 1600, 512, 512]
    - [0, 8.557]
  - - [1728, 960, 1, 512, 1728, 1728, 512, 512]
    - [0, 8.586]
  - - [1856, 960, 1, 512, 1856, 1856, 512, 512]
    - [0, 8.725]
  - - [1984, 960, 1, 512, 1984, 1984, 512, 512]
    - [0, 8.668]
  - - [2112, 960, 1, 512, 2112, 2112, 512, 512]
    - [0, 8.757]
  - - [2240, 960, 1, 512, 2240, 2240, 512, 512]
    - [0, 8.684]
  - - [2368, 960, 1, 512, 2368, 2368, 512, 512]
    - [0, 8.766]
  - - [2496, 960, 1, 512, 2496, 2496, 512, 512]
    - [0, 8.682]
  - - [2624, 960, 1, 512, 2624, 2624, 512, 512]
    - [0, 8.762]
  - - [2752, 960, 1, 512, 2752, 2752, 512, 512]
    - [0, 8.72]
  - - [2880, 960, 1, 512, 2880, 2880, 512, 512]
    - [0, 8.766]
  - - [3008, 960, 1, 512, 3008, 3008, 512, 512]
    - [0, 8.747]
  - - [3136, 960, 1, 512, 3136, 3136, 512, 512]
    - [0, 8.794]
  - - [3264, 960, 1, 512, 3264, 3264, 512, 512]
    - [0, 8.816]
  - - [3392, 960, 1, 512, 3392, 3392, 512, 512]
    - [0, 8.837]
  - - [3520, 960, 1, 512, 3520, 3520, 512, 512]
    - [0, 8.749]
  - - [3648, 960, 1, 512, 3648, 3648, 512, 512]
    - [0, 8.869]
  - - [3776, 960, 1, 512, 3776, 3776, 512, 512]
    - [0, 8.868]
  - - [3904, 960, 1, 512, 3904, 3904, 512, 512]
    - [0, 8.769]
  - - [4032, 960, 1, 512, 4032, 4032, 512, 512]
    - [0, 8.826]
  - - [64, 1088, 1, 512, 64, 64, 512, 512]
    - [0, 4.155]
  - - [192, 1088, 1, 512, 192, 192, 512, 512]
    - [0, 6.295]
  - - [320, 1088, 1, 512, 320, 320, 512, 512]
    - [0, 7.101]
  - - [448, 1088, 1, 512, 448, 448, 512, 512]
    - [0, 8.264]
  - - [576, 1088, 1, 512, 576, 576, 512, 512]
    - [0, 8.278]
  - - [704, 1088, 1, 512, 704, 704, 512, 512]
    - [0, 8.126]
  - - [832, 1088, 1, 512, 832, 832, 512, 512]
    - [0, 8.308]
  - - [960, 1088, 1, 512, 960, 960, 512, 512]
    - [0, 8.218]
  - - [1088, 1088, 1, 512, 1088, 1088, 512, 512]
    - [0, 8.442]
  - - [1216, 1088, 1, 512, 1216, 1216, 512, 512]
    - [0, 8.383]
  - - [1344, 1088, 1, 512, 1344, 1344, 512, 512]
    - [0, 8.44]
  - - [1472, 1088, 1, 512, 1472, 1472, 512, 512]
    - [0, 8.568]
  - - [1600, 1088, 1, 512, 1600, 1600, 512, 512]
    - [0, 8.607]
  - - [1728, 1088, 1, 512, 1728, 1728, 512, 512]
    - [0, 8.517]
  - - [1856, 1088, 1, 512, 1856, 1856, 512, 512]
    - [0, 8.673]
  - - [1984, 1088, 1, 512, 1984, 1984, 512, 512]
    - [0, 8.723]
  - - [2112, 1088, 1, 512, 2112, 2112, 512, 512]
    - [0, 8.707]
  - - [2240, 1088, 1, 512, 2240, 2240, 512, 512]
    - [0, 8.664]
  - - [2368, 1088, 1, 512, 2368, 2368, 512, 512]
    - [0, 8.693]
  - - [2496, 1088, 1, 512, 2496, 2496, 512, 512]
    - [0, 8.74]
  - - [2624, 1088, 1, 512, 2624, 2624, 512, 512]
    - [0, 8.705]
  - - [2752, 1088, 1, 512, 2752, 2752, 512, 512]
    - [0, 8.766]
  - - [2880, 1088, 1, 512, 2880, 2880, 512, 512]
    - [0, 8.756]
  - - [3008, 1088, 1, 512, 3008, 3008, 512, 512]
    - [0, 8.667]
  - - [3136, 1088, 1, 512, 3136, 3136, 512, 512]
    - [0, 8.687]
  - - [3264, 1088, 1, 512, 3264, 3264, 512, 512]
    - [0, 8.833]
  - - [3392, 1088, 1, 512, 3392, 3392, 512, 512]
    - [0, 8.841]
  - - [3520, 1088, 1, 512, 3520, 3520, 512, 512]
    - [0, 8.776]
  - - [3648, 1088, 1, 512, 3648, 3648, 512, 512]
    - [0, 8.76]
  - - [3776, 1088, 1, 512, 3776, 3776, 512, 512]
    - [0, 8.844]
  - - [3904, 1088, 1, 512, 3904, 3904, 512, 512]
    - [0, 8.834]
  - - [4032, 1088, 1, 512, 4032, 4032, 512, 512]
    - [0, 8.81]
  - - [64, 1216, 1, 512, 64, 64, 512, 512]
    - [0, 4.656]
  - - [192, 1216, 1, 512, 192, 192, 512, 512]
    - [0, 7.037]
  - - [320, 1216, 1, 512, 320, 320, 512, 512]
    - [0, 7.793]
  - - [448, 1216, 1, 512, 448, 448, 512, 512]
    - [0, 7.891]
  - - [576, 1216, 1, 512, 576, 576, 512, 512]
    - [0, 8.172]
  - - [704, 1216, 1, 512, 704, 704, 512, 512]
    - [0, 8.193]
  - - [832, 1216, 1, 512, 832, 832, 512, 512]
    - [0, 8.254]
  - - [960, 1216, 1, 512, 960, 960, 512, 512]
    - [0, 8.4]
  - - [1088, 1216, 1, 512, 1088, 1088, 512, 512]
    - [0, 8.543]
  - - [1216, 1216, 1, 512, 1216, 1216, 512, 512]
    - [0, 8.43]
  - - [1344, 1216, 1, 512, 1344, 1344, 512, 512]
    - [0, 8.479]
  - - [1472, 1216, 1, 512, 1472, 1472, 512, 512]
    - [0, 8.586]
  - - [1600, 1216, 1, 512, 1600, 1600, 512, 512]
    - [0, 8.605]
  - - [1728, 1216, 1, 512, 1728, 1728, 512, 512]
    - [0, 8.642]
  - - [1856, 1216, 1, 512, 1856, 1856, 512, 512]
    - [0, 8.713]
  - - [1984, 1216, 1, 512, 1984, 1984, 512, 512]
    - [0, 8.667]
  - - [2112, 1216, 1, 512, 2112, 2112, 512, 512]
    - [0, 8.717]
  - - [2240, 1216, 1, 512, 2240, 2240, 512, 512]
    - [0, 8.668]
  - - [2368, 1216, 1, 512, 2368, 2368, 512, 512]
    - [0, 8.708]
  - - [2496, 1216, 1, 512, 2496, 2496, 512, 512]
    - [0, 8.769]
  - - [2624, 1216, 1, 512, 2624, 2624, 512, 512]
    - [0, 8.69]
  - - [2752, 1216, 1, 512, 2752, 2752, 512, 512]
    - [0, 8.81]
  - - [2880, 1216, 1, 512, 2880, 2880, 512, 512]
    - [0, 8.83]
  - - [3008, 1216, 1, 512, 3008, 3008, 512, 512]
    - [0, 8.764]
  - - [3136, 1216, 1, 512, 3136, 3136, 512, 512]
    - [0, 8.822]
  - - [3264, 1216, 1, 512, 3264, 3264, 512, 512]
    - [0, 8.687]
  - - [3392, 1216, 1, 512, 3392, 3392, 512, 512]
    - [0, 8.727]
  - - [3520, 1216, 1, 512, 3520, 3520, 512, 512]
    - [0, 8.662]
  - - [3648, 1216, 1, 512, 3648, 3648, 512, 512]
    - [0, 8.843]
  - - [3776, 1216, 1, 512, 3776, 3776, 512, 512]
    - [0, 8.776]
  - - [3904, 1216, 1, 512, 3904, 3904, 512, 512]
    - [0, 8.742]
  - - [4032, 1216, 1, 512, 4032, 4032, 512, 512]
    - [0, 8.87]
  - - [64, 1344, 1, 512, 64, 64, 512, 512]
    - [0, 5.062]
  - - [192, 1344, 1, 512, 192, 192, 512, 512]
    - [0, 6.66]
  - - [320, 1344, 1, 512, 320, 320, 512, 512]
    - [0, 7.991]
  - - [448, 1344, 1, 512, 448, 448, 512, 512]
    - [0, 8.036]
  - - [576, 1344, 1, 512, 576, 576, 512, 512]
    - [0, 8.194]
  - - [704, 1344, 1, 512, 704, 704, 512, 512]
    - [0, 8.084]
  - - [832, 1344, 1, 512, 832, 832, 512, 512]
    - [0, 8.349]
  - - [960, 1344, 1, 512, 960, 960, 512, 512]
    - [0, 8.332]
  - - [1088, 1344, 1, 512, 1088, 1088, 512, 512]
    - [0, 8.571]
  - - [1216, 1344, 1, 512, 1216, 1216, 512, 512]
    - [0, 8.529]
  - - [1344, 1344, 1, 512, 1344, 1344, 512, 512]
    - [0, 8.643]
  - - [1472, 1344, 1, 512, 1472, 1472, 512, 512]
    - [0, 8.605]
  - - [1600, 1344, 1, 512, 1600, 1600, 512, 512]
    - [0, 8.682]
  - - [1728, 1344, 1, 512, 1728, 1728, 512, 512]
    - [0, 8.644]
  - - [1856, 1344, 1, 512, 1856, 1856, 512, 512]
    - [0, 8.726]
  - - [1984, 1344, 1, 512, 1984, 1984, 512, 512]
    - [0, 8.639]
  - - [2112, 1344, 1, 512, 2112, 2112, 512, 512]
    - [0, 8.681]
  - - [2240, 1344, 1, 512, 2240, 2240, 512, 512]
    - [0, 8.618]
  - - [2368, 1344, 1, 512, 2368, 2368, 512, 512]
    - [0, 8.651]
  - - [2496, 1344, 1, 512, 2496, 2496, 512, 512]
    - [0, 8.608]
  - - [2624, 1344, 1, 512, 2624, 2624, 512, 512]
    - [0, 8.699]
  - - [2752, 1344, 1, 512, 2752, 2752, 512, 512]
    - [0, 8.672]
  - - [2880, 1344, 1, 512, 2880, 2880, 512, 512]
    - [0, 8.741]
  - - [3008, 1344, 1, 512, 3008, 3008, 512, 512]
    - [0, 8.702]
  - - [3136, 1344, 1, 512, 3136, 3136, 512, 512]
    - [0, 8.84]
  - - [3264, 1344, 1, 512, 3264, 3264, 512, 512]
    - [0, 8.866]
  - - [3392, 1344, 1, 512, 3392, 3392, 512, 512]
    - [0, 8.896]
  - - [3520, 1344, 1, 512, 3520, 3520, 512, 512]
    - [0, 8.765]
  - - [3648, 1344, 1, 512, 3648, 3648, 512, 512]
    - [0, 8.757]
  - - [3776, 1344, 1, 512, 3776, 3776, 512, 512]
    - [0, 8.755]
  - - [3904, 1344, 1, 512, 3904, 3904, 512, 512]
    - [0, 8.897]
  - - [4032, 1344, 1, 512, 4032, 4032, 512, 512]
    - [0, 8.835]
  - - [64, 1472, 1, 512, 64, 64, 512, 512]
    - [0, 5.591]
  - - [192, 1472, 1, 512, 192, 192, 512, 512]
    - [0, 7.313]
  - - [320, 1472, 1, 512, 320, 320, 512, 512]
    - [0, 8.088]
  - - [448, 1472, 1, 512, 448, 448, 512, 512]
    - [0, 8.095]
  - - [576, 1472, 1, 512, 576, 576, 512, 512]
    - [0, 8.103]
  - - [704, 1472, 1, 512, 704, 704, 512, 512]
    - [0, 8.242]
  - - [832, 1472, 1, 512, 832, 832, 512, 512]
    - [0, 8.529]
  - - [960, 1472, 1, 512, 960, 960, 512, 512]
    - [0, 8.558]
  - - [1088, 1472, 1, 512, 1088, 1088, 512, 512]
    - [0, 8.434]
  - - [1216, 1472, 1, 512, 1216, 1216, 512, 512]
    - [0, 8.602]
  - - [1344, 1472, 1, 512, 1344, 1344, 512, 512]
    - [0, 8.541]
  - - [1472, 1472, 1, 512, 1472, 1472, 512, 512]
    - [0, 8.624]
  - - [1600, 1472, 1, 512, 1600, 1600, 512, 512]
    - [0, 8.721]
  - - [1728, 1472, 1, 512, 1728, 1728, 512, 512]
    - [0, 8.756]
  - - [1856, 1472, 1, 512, 1856, 1856, 512, 512]
    - [0, 8.725]
  - - [1984, 1472, 1, 512, 1984, 1984, 512, 512]
    - [0, 8.696]
  - - [2112, 1472, 1, 512, 2112, 2112, 512, 512]
    - [0, 8.775]
  - - [2240, 1472, 1, 512, 2240, 2240, 512, 512]
    - [0, 8.709]
  - - [2368, 1472, 1, 512, 2368, 2368, 512, 512]
    - [0, 8.774]
  - - [2496, 1472, 1, 512, 2496, 2496, 512, 512]
    - [0, 8.805]
  - - [2624, 1472, 1, 512, 2624, 2624, 512, 512]
    - [0, 8.82]
  - - [2752, 1472, 1, 512, 2752, 2752, 512, 512]
    - [0, 8.891]
  - - [2880, 1472, 1, 512, 2880, 2880, 512, 512]
    - [0, 8.797]
  - - [3008, 1472, 1, 512, 3008, 3008, 512, 512]
    - [0, 8.704]
  - - [3136, 1472, 1, 512, 3136, 3136, 512, 512]
    - [0, 8.764]
  - - [3264, 1472, 1, 512, 3264, 3264, 512, 512]
    - [0, 8.808]
  - - [3392, 1472, 1, 512, 3392, 3392, 512, 512]
    - [0, 8.774]
  - - [3520, 1472, 1, 512, 3520, 3520, 512, 512]
    - [0, 8.859]
  - - [3648, 1472, 1, 512, 3648, 3648, 512, 512]
    - [0, 8.923]
  - - [3776, 1472, 1, 512, 3776, 3776, 512, 512]
    - [0, 8.951]
  - - [3904, 1472, 1, 512, 3904, 3904, 512, 512]
    - [0, 8.955]
  - - [4032, 1472, 1, 512, 4032, 4032, 512, 512]
    - [0, 8.951]
  - - [64, 1600, 1, 512, 64, 64, 512, 512]
    - [0, 4.534]
  - - [192, 1600, 1, 512, 192, 192, 512, 512]
    - [0, 6.923]
  - - [320, 1600, 1, 512, 320, 320, 512, 512]
    - [0, 7.975]
  - - [448, 1600, 1, 512, 448, 448, 512, 512]
    - [0, 8.173]
  - - [576, 1600, 1, 512, 576, 576, 512, 512]
    - [0, 8.329]
  - - [704, 1600, 1, 512, 704, 704, 512, 512]
    - [0, 8.373]
  - - [832, 1600, 1, 512, 832, 832, 512, 512]
    - [0, 8.486]
  - - [960, 1600, 1, 512, 960, 960, 512, 512]
    - [0, 8.402]
  - - [1088, 1600, 1, 512, 1088, 1088, 512, 512]
    - [0, 8.571]
  - - [1216, 1600, 1, 512, 1216, 1216, 512, 512]
    - [0, 8.578]
  - - [1344, 1600, 1, 512, 1344, 1344, 512, 512]
    - [0, 8.668]
  - - [1472, 1600, 1, 512, 1472, 1472, 512, 512]
    - [0, 8.673]
  - - [1600, 1600, 1, 512, 1600, 1600, 512, 512]
    - [0, 8.729]
  - - [1728, 1600, 1, 512, 1728, 1728, 512, 512]
    - [0, 8.712]
  - - [1856, 1600, 1, 512, 1856, 1856, 512, 512]
    - [0, 8.726]
  - - [1984, 1600, 1, 512, 1984, 1984, 512, 512]
    - [0, 8.706]
  - - [2112, 1600, 1, 512, 2112, 2112, 512, 512]
    - [0, 8.833]
  - - [2240, 1600, 1, 512, 2240, 2240, 512, 512]
    - [0, 8.804]
  - - [2368, 1600, 1, 512, 2368, 2368, 512, 512]
    - [0, 8.807]
  - - [2496, 1600, 1, 512, 2496, 2496, 512, 512]
    - [0, 8.752]
  - - [2624, 1600, 1, 512, 2624, 2624, 512, 512]
    - [0, 8.794]
  - - [2752, 1600, 1, 512, 2752, 2752, 512, 512]
    - [0, 8.811]
  - - [2880, 1600, 1, 512, 2880, 2880, 512, 512]
    - [0, 8.797]
  - - [3008, 1600, 1, 512, 3008, 3008, 512, 512]
    - [0, 8.838]
  - - [3136, 1600, 1, 512, 3136, 3136, 512, 512]
    - [0, 8.907]
  - - [3264, 1600, 1, 512, 3264, 3264, 512, 512]
    - [0, 8.946]
  - - [3392, 1600, 1, 512, 3392, 3392, 512, 512]
    - [0, 8.952]
  - - [3520, 1600, 1, 512, 3520, 3520, 512, 512]
    - [0, 9.01]
  - - [3648, 1600, 1, 512, 3648, 3648, 512, 512]
    - [0, 8.905]
  - - [3776, 1600, 1, 512, 3776, 3776, 512, 512]
    - [0, 9.022]
  - - [3904, 1600, 1, 512, 3904, 3904, 512, 512]
    - [0, 8.945]
  - - [4032, 1600, 1, 512, 4032, 4032, 512, 512]
    - [0, 8.954]
  - - [64, 1728, 1, 512, 64, 64, 512, 512]
    - [0, 4.984]
  - - [192, 1728, 1, 512, 192, 192, 512, 512]
    - [0, 7.806]
  - - [320, 1728, 1, 512, 320, 320, 512, 512]
    - [0, 7.945]
  - - [448, 1728, 1, 512, 448, 448, 512, 512]
    - [0, 8.362]
  - - [576, 1728, 1, 512, 576, 576, 512, 512]
    - [0, 8.21]
  - - [704, 1728, 1, 512, 704, 704, 512, 512]
    - [0, 8.47]
  - - [832, 1728, 1, 512, 832, 832, 512, 512]
    - [0, 8.384]
  - - [960, 1728, 1, 512, 960, 960, 512, 512]
    - [0, 8.586]
  - - [1088, 1728, 1, 512, 1088, 1088, 512, 512]
    - [0, 8.543]
  - - [1216, 1728, 1, 512, 1216, 1216, 512, 512]
    - [0, 8.629]
  - - [1344, 1728, 1, 512, 1344, 1344, 512, 512]
    - [0, 8.634]
  - - [1472, 1728, 1, 512, 1472, 1472, 512, 512]
    - [0, 8.591]
  - - [1600, 1728, 1, 512, 1600, 1600, 512, 512]
    - [0, 8.661]
  - - [1728, 1728, 1, 512, 1728, 1728, 512, 512]
    - [0, 8.712]
  - - [1856, 1728, 1, 512, 1856, 1856, 512, 512]
    - [0, 8.821]
  - - [1984, 1728, 1, 512, 1984, 1984, 512, 512]
    - [0, 8.798]
  - - [2112, 1728, 1, 512, 2112, 2112, 512, 512]
    - [0, 8.734]
  - - [2240, 1728, 1, 512, 2240, 2240, 512, 512]
    - [0, 8.762]
  - - [2368, 1728, 1, 512, 2368, 2368, 512, 512]
    - [0, 8.642]
  - - [2496, 1728, 1, 512, 2496, 2496, 512, 512]
    - [0, 8.708]
  - - [2624, 1728, 1, 512, 2624, 2624, 512, 512]
    - [0, 8.701]
  - - [2752, 1728, 1, 512, 2752, 2752, 512, 512]
    - [0, 8.827]
  - - [2880, 1728, 1, 512, 2880, 2880, 512, 512]
    - [0, 8.91]
  - - [3008, 1728, 1, 512, 3008, 3008, 512, 512]
    - [0, 8.909]
  - - [3136, 1728, 1, 512, 3136, 3136, 512, 512]
    - [0, 8.845]
  - - [3264, 1728, 1, 512, 3264, 3264, 512, 512]
    - [0, 8.896]
  - - [3392, 1728, 1, 512, 3392, 3392, 512, 512]
    - [0, 8.952]
  - - [3520, 1728, 1, 512, 3520, 3520, 512, 512]
    - [0, 8.919]
  - - [3648, 1728, 1, 512, 3648, 3648, 512, 512]
    - [0, 8.926]
  - - [3776, 1728, 1, 512, 3776, 3776, 512, 512]
    - [0, 9.053]
  - - [3904, 1728, 1, 512, 3904, 3904, 512, 512]
    - [0, 8.974]
  - - [4032, 1728, 1, 512, 4032, 4032, 512, 512]
    - [0, 9.024]
  - - [64, 1856, 1, 512, 64, 64, 512, 512]
    - [0, 5.296]
  - - [192, 1856, 1, 512, 192, 192, 512, 512]
    - [0, 7.156]
  - - [320, 1856, 1, 512, 320, 320, 512, 512]
    - [0, 8.135]
  - - [448, 1856, 1, 512, 448, 448, 512, 512]
    - [0, 8.35]
  - - [576, 1856, 1, 512, 576, 576, 512, 512]
    - [0, 8.406]
  - - [704, 1856, 1, 512, 704, 704, 512, 512]
    - [0, 8.446]
  - - [832, 1856, 1, 512, 832, 832, 512, 512]
    - [0, 8.512]
  - - [960, 1856, 1, 512, 960, 960, 512, 512]
    - [0, 8.622]
  - - [1088, 1856, 1, 512, 1088, 1088, 512, 512]
    - [0, 8.706]
  - - [1216, 1856, 1, 512, 1216, 1216, 512, 512]
    - [0, 8.753]
  - - [1344, 1856, 1, 512, 1344, 1344, 512, 512]
    - [0, 8.707]
  - - [1472, 1856, 1, 512, 1472, 1472, 512, 512]
    - [0, 8.691]
  - - [1600, 1856, 1, 512, 1600, 1600, 512, 512]
    - [0, 8.676]
  - - [1728, 1856, 1, 512, 1728, 1728, 512, 512]
    - [0, 8.689]
  - - [1856, 1856, 1, 512, 1856, 1856, 512, 512]
    - [0, 8.752]
  - - [1984, 1856, 1, 512, 1984, 1984, 512, 512]
    - [0, 8.68]
  - - [2112, 1856, 1, 512, 2112, 2112, 512, 512]
    - [0, 8.705]
  - - [2240, 1856, 1, 512, 2240, 2240, 512, 512]
    - [0, 8.72]
  - - [2368, 1856, 1, 512, 2368, 2368, 512, 512]
    - [0, 8.956]
  - - [2496, 1856, 1, 512, 2496, 2496, 512, 512]
    - [0, 8.821]
  - - [2624, 1856, 1, 512, 2624, 2624, 512, 512]
    - [0, 8.8]
  - - [2752, 1856, 1, 512, 2752, 2752, 512, 512]
    - [0, 8.778]
  - - [2880, 1856, 1, 512, 2880, 2880, 512, 512]
    - [0, 8.915]
  - - [3008, 1856, 1, 512, 3008, 3008, 512, 512]
    - [0, 8.951]
  - - [3136, 1856, 1, 512, 3136, 3136, 512, 512]
    - [0, 8.974]
  - - [3264, 1856, 1, 512, 3264, 3264, 512, 512]
    - [0, 8.924]
  - - [3392, 1856, 1, 512, 3392, 3392, 512, 512]
    - [0, 8.817]
  - - [3520, 1856, 1, 512, 3520, 3520, 512, 512]
    - [0, 8.958]
  - - [3648, 1856, 1, 512, 3648, 3648, 512, 512]
    - [0, 8.902]
  - - [3776, 1856, 1, 512, 3776, 3776, 512, 512]
    - [0, 8.931]
  - - [3904, 1856, 1, 512, 3904, 3904, 512, 512]
    - [0, 8.989]
  - - [4032, 1856, 1, 512, 4032, 4032, 512, 512]
    - [0, 9.014]
  - - [64, 1984, 1, 512, 64, 64, 512, 512]
    - [0, 5.663]
  - - [192, 1984, 1, 512, 192, 192, 512, 512]
    - [0, 7.657]
  - - [320, 1984, 1, 512, 320, 320, 512, 512]
    - [0, 8.38]
  - - [448, 1984, 1, 512, 448, 448, 512, 512]
    - [0, 8.329]
  - - [576, 1984, 1, 512, 576, 576, 512, 512]
    - [0, 8.308]
  - - [704, 1984, 1, 512, 704, 704, 512, 512]
    - [0, 8.479]
  - - [832, 1984, 1, 512, 832, 832, 512, 512]
    - [0, 8.556]
  - - [960, 1984, 1, 512, 960, 960, 512, 512]
    - [0, 8.601]
  - - [1088, 1984, 1, 512, 1088, 1088, 512, 512]
    - [0, 8.656]
  - - [1216, 1984, 1, 512, 1216, 1216, 512, 512]
    - [0, 8.748]
  - - [1344, 1984, 1, 512, 1344, 1344, 512, 512]
    - [0, 8.58]
  - - [1472, 1984, 1, 512, 1472, 1472, 512, 512]
    - [0, 8.765]
  - - [1600, 1984, 1, 512, 1600, 1600, 512, 512]
    - [0, 8.725]
  - - [1728, 1984, 1, 512, 1728, 1728, 512, 512]
    - [0, 8.61]
  - - [1856, 1984, 1, 512, 1856, 1856, 512, 512]
    - [0, 8.798]
  - - [1984, 1984, 1, 512, 1984, 1984, 512, 512]
    - [0, 8.765]
  - - [2112, 1984, 1, 512, 2112, 2112, 512, 512]
    - [0, 8.814]
  - - [2240, 1984, 1, 512, 2240, 2240, 512, 512]
    - [0, 8.72]
  - - [2368, 1984, 1, 512, 2368, 2368, 512, 512]
    - [0, 8.811]
  - - [2496, 1984, 1, 512, 2496, 2496, 512, 512]
    - [0, 8.796]
  - - [2624, 1984, 1, 512, 2624, 2624, 512, 512]
    - [0, 8.823]
  - - [2752, 1984, 1, 512, 2752, 2752, 512, 512]
    - [0, 8.939]
  - - [2880, 1984, 1, 512, 2880, 2880, 512, 512]
    - [0, 8.965]
  - - [3008, 1984, 1, 512, 3008, 3008, 512, 512]
    - [0, 8.834]
  - - [3136, 1984, 1, 512, 3136, 3136, 512, 512]
    - [0, 8.877]
  - - [3264, 1984, 1, 512, 3264, 3264, 512, 512]
    - [0, 8.934]
  - - [3392, 1984, 1, 512, 3392, 3392, 512, 512]
    - [0, 8.998]
  - - [3520, 1984, 1, 512, 3520, 3520, 512, 512]
    - [0, 8.954]
  - - [3648, 1984, 1, 512, 3648, 3648, 512, 512]
    - [0, 9.019]
  - - [3776, 1984, 1, 512, 3776, 3776, 512, 512]
    - [0, 9.008]
  - - [3904, 1984, 1, 512, 3904, 3904, 512, 512]
    - [0, 9.01]
  - - [4032, 1984, 1, 512, 4032, 4032, 512, 512]
    - [0, 9.094]
  - - [64, 2112, 1, 512, 64, 64, 512, 512]
    - [0, 6.013]
  - - [192, 2112, 1, 512, 192, 192, 512, 512]
    - [0, 7.608]
  - - [320, 2112, 1, 512, 320, 320, 512, 512]
    - [0, 8.17]
  - - [448, 2112, 1, 512, 448, 448, 512, 512]
    - [0, 8.292]
  - - [576, 2112, 1, 512, 576, 576, 512, 512]
    - [0, 8.453]
  - - [704, 2112, 1, 512, 704, 704, 512, 512]
    - [0, 8.616]
  - - [832, 2112, 1, 512, 832, 832, 512, 512]
    - [0, 8.641]
  - - [960, 2112, 1, 512, 960, 960, 512, 512]
    - [0, 8.761]
  - - [1088, 2112, 1, 512, 1088, 1088, 512, 512]
    - [0, 8.572]
  - - [1216, 2112, 1, 512, 1216, 1216, 512, 512]
    - [0, 8.626]
  - - [1344, 2112, 1, 512, 1344, 1344, 512, 512]
    - [0, 8.593]
  - - [1472, 2112, 1, 512, 1472, 1472, 512, 512]
    - [0, 8.645]
  - - [1600, 2112, 1, 512, 1600, 1600, 512, 512]
    - [0, 8.843]
  - - [1728, 2112, 1, 512, 1728, 1728, 512, 512]
    - [0, 8.664]
  - - [1856, 2112, 1, 512, 1856, 1856, 512, 512]
    - [0, 8.682]
  - - [1984, 2112, 1, 512, 1984, 1984, 512, 512]
    - [0, 8.798]
  - - [2112, 2112, 1, 512, 2112, 2112, 512, 512]
    - [0, 8.913]
  - - [2240, 2112, 1, 512, 2240, 2240, 512, 512]
    - [0, 8.746]
  - - [2368, 2112, 1, 512, 2368, 2368, 512, 512]
    - [0, 8.808]
  - - [2496, 2112, 1, 512, 2496, 2496, 512, 512]
    - [0, 8.765]
  - - [2624, 2112, 1, 512, 2624, 2624, 512, 512]
    - [0, 8.953]
  - - [2752, 2112, 1, 512, 2752, 2752, 512, 512]
    - [0, 8.98]
  - - [2880, 2112, 1, 512, 2880, 2880, 512, 512]
    - [0, 8.965]
  - - [3008, 2112, 1, 512, 3008, 3008, 512, 512]
    - [0, 8.908]
  - - [3136, 2112, 1, 512, 3136, 3136, 512, 512]
    - [0, 8.987]
  - - [3264, 2112, 1, 512, 3264, 3264, 512, 512]
    - [0, 8.949]
  - - [3392, 2112, 1, 512, 3392, 3392, 512, 512]
    - [0, 8.923]
  - - [3520, 2112, 1, 512, 3520, 3520, 512, 512]
    - [0, 8.999]
  - - [3648, 2112, 1, 512, 3648, 3648, 512, 512]
    - [0, 9.105]
  - - [3776, 2112, 1, 512, 3776, 3776, 512, 512]
    - [0, 9.074]
  - - [3904, 2112, 1, 512, 3904, 3904, 512, 512]
    - [0, 9.139]
  - - [4032, 2112, 1, 512, 4032, 4032, 512, 512]
    - [0, 9.116]
  - - [64, 2240, 1, 512, 64, 64, 512, 512]
    - [0, 6.369]
  - - [192, 2240, 1, 512, 192, 192, 512, 512]
    - [0, 7.798]
  - - [320, 2240, 1, 512, 320, 320, 512, 512]
    - [0, 8.209]
  - - [448, 2240, 1, 512, 448, 448, 512, 512]
    - [0, 8.099]
  - - [576, 2240, 1, 512, 576, 576, 512, 512]
    - [0, 8.378]
  - - [704, 2240, 1, 512, 704, 704, 512, 512]
    - [0, 8.514]
  - - [832, 2240, 1, 512, 832, 832, 512, 512]
    - [0, 8.635]
  - - [960, 2240, 1, 512, 960, 960, 512, 512]
    - [0, 8.712]
  - - [1088, 2240, 1, 512, 1088, 1088, 512, 512]
    - [0, 8.618]
  - - [1216, 2240, 1, 512, 1216, 1216, 512, 512]
    - [0, 8.561]
  - - [1344, 2240, 1, 512, 1344, 1344, 512, 512]
    - [0, 8.656]
  - - [1472, 2240, 1, 512, 1472, 1472, 512, 512]
    - [0, 8.748]
  - - [1600, 2240, 1, 512, 1600, 1600, 512, 512]
    - [0, 8.804]
  - - [1728, 2240, 1, 512, 1728, 1728, 512, 512]
    - [0, 8.744]
  - - [1856, 2240, 1, 512, 1856, 1856, 512, 512]
    - [0, 8.686]
  - - [1984, 2240, 1, 512, 1984, 1984, 512, 512]
    - [0, 8.683]
  - - [2112, 2240, 1, 512, 2112, 2112, 512, 512]
    - [0, 8.885]
  - - [2240, 2240, 1, 512, 2240, 2240, 512, 512]
    - [0, 8.868]
  - - [2368, 2240, 1, 512, 2368, 2368, 512, 512]
    - [0, 8.906]
  - - [2496, 2240, 1, 512, 2496, 2496, 512, 512]
    - [0, 8.858]
  - - [2624, 2240, 1, 512, 2624, 2624, 512, 512]
    - [0, 8.892]
  - - [2752, 2240, 1, 512, 2752, 2752, 512, 512]
    - [0, 8.932]
  - - [2880, 2240, 1, 512, 2880, 2880, 512, 512]
    - [0, 8.906]
  - - [3008, 2240, 1, 512, 3008, 3008, 512, 512]
    - [0, 8.927]
  - - [3136, 2240, 1, 512, 3136, 3136, 512, 512]
    - [0, 9.02]
  - - [3264, 2240, 1, 512, 3264, 3264, 512, 512]
    - [0, 9.063]
  - - [3392, 2240, 1, 512, 3392, 3392, 512, 512]
    - [0, 9.011]
  - - [3520, 2240, 1, 512, 3520, 3520, 512, 512]
    - [0, 9.12]
  - - [3648, 2240, 1, 512, 3648, 3648, 512, 512]
    - [0, 9.097]
  - - [3776, 2240, 1, 512, 3776, 3776, 512, 512]
    - [0, 9.063]
  - - [3904, 2240, 1, 512, 3904, 3904, 512, 512]
    - [0, 9.152]
  - - [4032, 2240, 1, 512, 4032, 4032, 512, 512]
    - [0, 9.085]
  - - [64, 2368, 1, 512, 64, 64, 512, 512]
    - [0, 5.446]
  - - [192, 2368, 1, 512, 192, 192, 512, 512]
    - [0, 7.841]
  - - [320, 2368, 1, 512, 320, 320, 512, 512]
    - [0, 8.11]
  - - [448, 2368, 1, 512, 448, 448, 512, 512]
    - [0, 8.214]
  - - [576, 2368, 1, 512, 576, 576, 512, 512]
    - [0, 8.43]
  - - [704, 2368, 1, 512, 704, 704, 512, 512]
    - [0, 8.518]
  - - [832, 2368, 1, 512, 832, 832, 512, 512]
    - [0, 8.701]
  - - [960, 2368, 1, 512, 960, 960, 512, 512]
    - [0, 8.673]
  - - [1088, 2368, 1, 512, 1088, 1088, 512, 512]
    - [0, 8.706]
  - - [1216, 2368, 1, 512, 1216, 1216, 512, 512]
    - [0, 8.715]
  - - [1344, 2368, 1, 512, 1344, 1344, 512, 512]
    - [0, 8.766]
  - - [1472, 2368, 1, 512, 1472, 1472, 512, 512]
    - [0, 8.766]
  - - [1600, 2368, 1, 512, 1600, 1600, 512, 512]
    - [0, 8.81]
  - - [1728, 2368, 1, 512, 1728, 1728, 512, 512]
    - [0, 8.762]
  - - [1856, 2368, 1, 512, 1856, 1856, 512, 512]
    - [0, 8.828]
  - - [1984, 2368, 1, 512, 1984, 1984, 512, 512]
    - [0, 8.766]
  - - [2112, 2368, 1, 512, 2112, 2112, 512, 512]
    - [0, 8.826]
  - - [2240, 2368, 1, 512, 2240, 2240, 512, 512]
    - [0, 8.839]
  - - [2368, 2368, 1, 512, 2368, 2368, 512, 512]
    - [0, 8.819]
  - - [2496, 2368, 1, 512, 2496, 2496, 512, 512]
    - [0, 8.889]
  - - [2624, 2368, 1, 512, 2624, 2624, 512, 512]
    - [0, 8.952]
  - - [2752, 2368, 1, 512, 2752, 2752, 512, 512]
    - [0, 9.001]
  - - [2880, 2368, 1, 512, 2880, 2880, 512, 512]
    - [0, 9.008]
  - - [3008, 2368, 1, 512, 3008, 3008, 512, 512]
    - [0, 9.017]
  - - [3136, 2368, 1, 512, 3136, 3136, 512, 512]
    - [0, 9.014]
  - - [3264, 2368, 1, 512, 3264, 3264, 512, 512]
    - [0, 9.031]
  - - [3392, 2368, 1, 512, 3392, 3392, 512, 512]
    - [0, 9.035]
  - - [3520, 2368, 1, 512, 3520, 3520, 512, 512]
    - [0, 9.136]
  - - [3648, 2368, 1, 512, 3648, 3648, 512, 512]
    - [0, 9.082]
  - - [3776, 2368, 1, 512, 3776, 3776, 512, 512]
    - [0, 9.15]
  - - [3904, 2368, 1, 512, 3904, 3904, 512, 512]
    - [0, 9.149]
  - - [4032, 2368, 1, 512, 4032, 4032, 512, 512]
    - [0, 9.134]
  - - [64, 2496, 1, 512, 64, 64, 512, 512]
    - [0, 5.729]
  - - [192, 2496, 1, 512, 192, 192, 512, 512]
    - [0, 7.941]
  - - [320, 2496, 1, 512, 320, 320, 512, 512]
    - [0, 8.095]
  - - [448, 2496, 1, 512, 448, 448, 512, 512]
    - [0, 8.441]
  - - [576, 2496, 1, 512, 576, 576, 512, 512]
    - [0, 8.439]
  - - [704, 2496, 1, 512, 704, 704, 512, 512]
    - [0, 8.606]
  - - [832, 2496, 1, 512, 832, 832, 512, 512]
    - [0, 8.526]
  - - [960, 2496, 1, 512, 960, 960, 512, 512]
    - [0, 8.629]
  - - [1088, 2496, 1, 512, 1088, 1088, 512, 512]
    - [0, 8.657]
  - - [1216, 2496, 1, 512, 1216, 1216, 512, 512]
    - [0, 8.617]
  - - [1344, 2496, 1, 512, 1344, 1344, 512, 512]
    - [0, 8.755]
  - - [1472, 2496, 1, 512, 1472, 1472, 512, 512]
    - [0, 8.752]
  - - [1600, 2496, 1, 512, 1600, 1600, 512, 512]
    - [0, 8.612]
  - - [1728, 2496, 1, 512, 1728, 1728, 512, 512]
    - [0, 8.638]
  - - [1856, 2496, 1, 512, 1856, 1856, 512, 512]
    - [0, 8.705]
  - - [1984, 2496, 1, 512, 1984, 1984, 512, 512]
    - [0, 8.86]
  - - [2112, 2496, 1, 512, 2112, 2112, 512, 512]
    - [0, 8.935]
  - - [2240, 2496, 1, 512, 2240, 2240, 512, 512]
    - [0, 8.864]
  - - [2368, 2496, 1, 512, 2368, 2368, 512, 512]
    - [0, 8.929]
  - - [2496, 2496, 1, 512, 2496, 2496, 512, 512]
    - [0, 8.921]
  - - [2624, 2496, 1, 512, 2624, 2624, 512, 512]
    - [0, 8.863]
  - - [2752, 2496, 1, 512, 2752, 2752, 512, 512]
    - [0, 8.88]
  - - [2880, 2496, 1, 512, 2880, 2880, 512, 512]
    - [0, 9.027]
  - - [3008, 2496, 1, 512, 3008, 3008, 512, 512]
    - [0, 8.995]
  - - [3136, 2496, 1, 512, 3136, 3136, 512, 512]
    - [0, 8.915]
  - - [3264, 2496, 1, 512, 3264, 3264, 512, 512]
    - [0, 8.818]
  - - [3392, 2496, 1, 512, 3392, 3392, 512, 512]
    - [0, 9.108]
  - - [3520, 2496, 1, 512, 3520, 3520, 512, 512]
    - [0, 9.104]
  - - [3648, 2496, 1, 512, 3648, 3648, 512, 512]
    - [0, 9.208]
  - - [3776, 2496, 1, 512, 3776, 3776, 512, 512]
    - [0, 9.066]
  - - [3904, 2496, 1, 512, 3904, 3904, 512, 512]
    - [0, 9.076]
  - - [4032, 2496, 1, 512, 4032, 4032, 512, 512]
    - [0, 9.077]
  - - [64, 2624, 1, 512, 64, 64, 512, 512]
    - [0, 5.987]
  - - [192, 2624, 1, 512, 192, 192, 512, 512]
    - [0, 7.77]
  - - [320, 2624, 1, 512, 320, 320, 512, 512]
    - [0, 8.213]
  - - [448, 2624, 1, 512, 448, 448, 512, 512]
    - [0, 8.47]
  - - [576, 2624, 1, 512, 576, 576, 512, 512]
    - [0, 8.511]
  - - [704, 2624, 1, 512, 704, 704, 512, 512]
    - [0, 8.512]
  - - [832, 2624, 1, 512, 832, 832, 512, 512]
    - [0, 8.685]
  - - [960, 2624, 1, 512, 960, 960, 512, 512]
    - [0, 8.738]
  - - [1088, 2624, 1, 512, 1088, 1088, 512, 512]
    - [0, 8.708]
  - - [1216, 2624, 1, 512, 1216, 1216, 512, 512]
    - [0, 8.744]
  - - [1344, 2624, 1, 512, 1344, 1344, 512, 512]
    - [0, 8.702]
  - - [1472, 2624, 1, 512, 1472, 1472, 512, 512]
    - [0, 8.816]
  - - [1600, 2624, 1, 512, 1600, 1600, 512, 512]
    - [0, 8.764]
  - - [1728, 2624, 1, 512, 1728, 1728, 512, 512]
    - [0, 8.774]
  - - [1856, 2624, 1, 512, 1856, 1856, 512, 512]
    - [0, 8.739]
  - - [1984, 2624, 1, 512, 1984, 1984, 512, 512]
    - [0, 8.92]
  - - [2112, 2624, 1, 512, 2112, 2112, 512, 512]
    - [0, 8.924]
  - - [2240, 2624, 1, 512, 2240, 2240, 512, 512]
    - [0, 8.904]
  - - [2368, 2624, 1, 512, 2368, 2368, 512, 512]
    - [0, 8.918]
  - - [2496, 2624, 1, 512, 2496, 2496, 512, 512]
    - [0, 9.003]
  - - [2624, 2624, 1, 512, 2624, 2624, 512, 512]
    - [0, 8.924]
  - - [2752, 2624, 1, 512, 2752, 2752, 512, 512]
    - [0, 8.984]
  - - [2880, 2624, 1, 512, 2880, 2880, 512, 512]
    - [0, 9.015]
  - - [3008, 2624, 1, 512, 3008, 3008, 512, 512]
    - [0, 9.062]
  - - [3136, 2624, 1, 512, 3136, 3136, 512, 512]
    - [0, 9.073]
  - - [3264, 2624, 1, 512, 3264, 3264, 512, 512]
    - [0, 9.157]
  - - [3392, 2624, 1, 512, 3392, 3392, 512, 512]
    - [0, 9.143]
  - - [3520, 2624, 1, 512, 3520, 3520, 512, 512]
    - [0, 9.141]
  - - [3648, 2624, 1, 512, 3648, 3648, 512, 512]
    - [0, 9.149]
  - - [3776, 2624, 1, 512, 3776, 3776, 512, 512]
    - [0, 9.036]
  - - [3904, 2624, 1, 512, 3904, 3904, 512, 512]
    - [0, 9.072]
  - - [4032, 2624, 1, 512, 4032, 4032, 512, 512]
    - [0, 9.096]
  - - [64, 2752, 1, 512, 64, 64, 512, 512]
    - [0, 6.321]
  - - [192, 2752, 1, 512, 192, 192, 512, 512]
    - [0, 8.072]
  - - [320, 2752, 1, 512, 320, 320, 512, 512]
    - [0, 8.325]
  - - [448, 2752, 1, 512, 448, 448, 512, 512]
    - [0, 8.392]
  - - [576, 2752, 1, 512, 576, 576, 512, 512]
    - [0, 8.503]
  - - [704, 2752, 1, 512, 704, 704, 512, 512]
    - [0, 8.494]
  - - [832, 2752, 1, 512, 832, 832, 512, 512]
    - [0, 8.522]
  - - [960, 2752, 1, 512, 960, 960, 512, 512]
    - [0, 8.684]
  - - [1088, 2752, 1, 512, 1088, 1088, 512, 512]
    - [0, 8.737]
  - - [1216, 2752, 1, 512, 1216, 1216, 512, 512]
    - [0, 8.764]
  - - [1344, 2752, 1, 512, 1344, 1344, 512, 512]
    - [0, 8.836]
  - - [1472, 2752, 1, 512, 1472, 1472, 512, 512]
    - [0, 8.603]
  - - [1600, 2752, 1, 512, 1600, 1600, 512, 512]
    - [0, 8.686]
  - - [1728, 2752, 1, 512, 1728, 1728, 512, 512]
    - [0, 8.791]
  - - [1856, 2752, 1, 512, 1856, 1856, 512, 512]
    - [0, 8.869]
  - - [1984, 2752, 1, 512, 1984, 1984, 512, 512]
    - [0, 8.793]
  - - [2112, 2752, 1, 512, 2112, 2112, 512, 512]
    - [0, 8.904]
  - - [2240, 2752, 1, 512, 2240, 2240, 512, 512]
    - [0, 8.923]
  - - [2368, 2752, 1, 512, 2368, 2368, 512, 512]
    - [0, 8.952]
  - - [2496, 2752, 1, 512, 2496, 2496, 512, 512]
    - [0, 8.993]
  - - [2624, 2752, 1, 512, 2624, 2624, 512, 512]
    - [0, 8.92]
  - - [2752, 2752, 1, 512, 2752, 2752, 512, 512]
    - [0, 9.075]
  - - [2880, 2752, 1, 512, 2880, 2880, 512, 512]
    - [0, 9.108]
  - - [3008, 2752, 1, 512, 3008, 3008, 512, 512]
    - [0, 9.048]
  - - [3136, 2752, 1, 512, 3136, 3136, 512, 512]
    - [0, 9.151]
  - - [3264, 2752, 1, 512, 3264, 3264, 512, 512]
    - [0, 9.086]
  - - [3392, 2752, 1, 512, 3392, 3392, 512, 512]
    - [0, 9.054]
  - - [3520, 2752, 1, 512, 3520, 3520, 512, 512]
    - [0, 8.999]
  - - [3648, 2752, 1, 512, 3648, 3648, 512, 512]
    - [0, 9.04]
  - - [3776, 2752, 1, 512, 3776, 3776, 512, 512]
    - [0, 9.047]
  - - [3904, 2752, 1, 512, 3904, 3904, 512, 512]
    - [0, 9.179]
  - - [4032, 2752, 1, 512, 4032, 4032, 512, 512]
    - [0, 9.243]
  - - [64, 2880, 1, 512, 64, 64, 512, 512]
    - [0, 6.599]
  - - [192, 2880, 1, 512, 192, 192, 512, 512]
    - [0, 7.833]
  - - [320, 2880, 1, 512, 320, 320, 512, 512]
    - [0, 8.268]
  - - [448, 2880, 1, 512, 448, 448, 512, 512]
    - [0, 8.265]
  - - [576, 2880, 1, 512, 576, 576, 512, 512]
    - [0, 8.574]
  - - [704, 2880, 1, 512, 704, 704, 512, 512]
    - [0, 8.542]
  - - [832, 2880, 1, 512, 832, 832, 512, 512]
    - [0, 8.693]
  - - [960, 2880, 1, 512, 960, 960, 512, 512]
    - [0, 8.587]
  - - [1088, 2880, 1, 512, 1088, 1088, 512, 512]
    - [0, 8.743]
  - - [1216, 2880, 1, 512, 1216, 1216, 512, 512]
    - [0, 8.687]
  - - [1344, 2880, 1, 512, 1344, 1344, 512, 512]
    - [0, 8.754]
  - - [1472, 2880, 1, 512, 1472, 1472, 512, 512]
    - [0, 8.761]
  - - [1600, 2880, 1, 512, 1600, 1600, 512, 512]
    - [0, 8.788]
  - - [1728, 2880, 1, 512, 1728, 1728, 512, 512]
    - [0, 8.741]
  - - [1856, 2880, 1, 512, 1856, 1856, 512, 512]
    - [0, 8.789]
  - - [1984, 2880, 1, 512, 1984, 1984, 512, 512]
    - [0, 8.818]
  - - [2112, 2880, 1, 512, 2112, 2112, 512, 512]
    - [0, 8.947]
  - - [2240, 2880, 1, 512, 2240, 2240, 512, 512]
    - [0, 8.99]
  - - [2368, 2880, 1, 512, 2368, 2368, 512, 512]
    - [0, 8.888]
  - - [2496, 2880, 1, 512, 2496, 2496, 512, 512]
    - [0, 9.036]
  - - [2624, 2880, 1, 512, 2624, 2624, 512, 512]
    - [0, 9.063]
  - - [2752, 2880, 1, 512, 2752, 2752, 512, 512]
    - [0, 8.947]
  - - [2880, 2880, 1, 512, 2880, 2880, 512, 512]
    - [0, 8.983]
  - - [3008, 2880, 1, 512, 3008, 3008, 512, 512]
    - [0, 9.135]
  - - [3136, 2880, 1, 512, 3136, 3136, 512, 512]
    - [0, 9.201]
  - - [3264, 2880, 1, 512, 3264, 3264, 512, 512]
    - [0, 9.188]
  - - [3392, 2880, 1, 512, 3392, 3392, 512, 512]
    - [0, 9.133]
  - - [3520, 2880, 1, 512, 3520, 3520, 512, 512]
    - [0, 9.127]
  - - [3648, 2880, 1, 512, 3648, 3648, 512, 512]
    - [0, 9.013]
  - - [3776, 2880, 1, 512, 3776, 3776, 512, 512]
    - [0, 9.001]
  - - [3904, 2880, 1, 512, 3904, 3904, 512, 512]
    - [0, 9.26]
  - - [4032, 2880, 1, 512, 4032, 4032, 512, 512]
    - [0, 9.177]
  - - [64, 3008, 1, 512, 64, 64, 512, 512]
    - [0, 6.891]
  - - [192, 3008, 1, 512, 192, 192, 512, 512]
    - [0, 8.136]
  - - [320, 3008, 1, 512, 320, 320, 512, 512]
    - [0, 8.267]
  - - [448, 3008, 1, 512, 448, 448, 512, 512]
    - [0, 8.384]
  - - [576, 3008, 1, 512, 576, 576, 512, 512]
    - [0, 8.49]
  - - [704, 3008, 1, 512, 704, 704, 512, 512]
    - [0, 8.675]
  - - [832, 3008, 1, 512, 832, 832, 512, 512]
    - [0, 8.676]
  - - [960, 3008, 1, 512, 960, 960, 512, 512]
    - [0, 8.721]
  - - [1088, 3008, 1, 512, 1088, 1088, 512, 512]
    - [0, 8.695]
  - - [1216, 3008, 1, 512, 1216, 1216, 512, 512]
    - [0, 8.777]
  - - [1344, 3008, 1, 512, 1344, 1344, 512, 512]
    - [0, 8.917]
  - - [1472, 3008, 1, 512, 1472, 1472, 512, 512]
    - [0, 8.859]
  - - [1600, 3008, 1, 512, 1600, 1600, 512, 512]
    - [0, 8.836]
  - - [1728, 3008, 1, 512, 1728, 1728, 512, 512]
    - [0, 8.908]
  - - [1856, 3008, 1, 512, 1856, 1856, 512, 512]
    - [0, 8.959]
  - - [1984, 3008, 1, 512, 1984, 1984, 512, 512]
    - [0, 8.904]
  - - [2112, 3008, 1, 512, 2112, 2112, 512, 512]
    - [0, 8.807]
  - - [2240, 3008, 1, 512, 2240, 2240, 512, 512]
    - [0, 8.864]
  - - [2368, 3008, 1, 512, 2368, 2368, 512, 512]
    - [0, 9.04]
  - - [2496, 3008, 1, 512, 2496, 2496, 512, 512]
    - [0, 9.02]
  - - [2624, 3008, 1, 512, 2624, 2624, 512, 512]
    - [0, 9.031]
  - - [2752, 3008, 1, 512, 2752, 2752, 512, 512]
    - [0, 9.057]
  - - [2880, 3008, 1, 512, 2880, 2880, 512, 512]
    - [0, 9.077]
  - - [3008, 3008, 1, 512, 3008, 3008, 512, 512]
    - [0, 9.042]
  - - [3136, 3008, 1, 512, 3136, 3136, 512, 512]
    - [0, 9.096]
  - - [3264, 3008, 1, 512, 3264, 3264, 512, 512]
    - [0, 9.156]
  - - [3392, 3008, 1, 512, 3392, 3392, 512, 512]
    - [0, 9.204]
  - - [3520, 3008, 1, 512, 3520, 3520, 512, 512]
    - [0, 9.105]
  - - [3648, 3008, 1, 512, 3648, 3648, 512, 512]
    - [0, 9.095]
  - - [3776, 3008, 1, 512, 3776, 3776, 512, 512]
    - [0, 9.145]
  - - [3904, 3008, 1, 512, 3904, 3904, 512, 512]
    - [0, 9.235]
  - - [4032, 3008, 1, 512, 4032, 4032, 512, 512]
    - [0, 9.164]
  - - [64, 3136, 1, 512, 64, 64, 512, 512]
    - [0, 6.093]
  - - [192, 3136, 1, 512, 192, 192, 512, 512]
    - [0, 7.97]
  - - [320, 3136, 1, 512, 320, 320, 512, 512]
    - [0, 8.224]
  - - [448, 3136, 1, 512, 448, 448, 512, 512]
    - [0, 8.482]
  - - [576, 3136, 1, 512, 576, 576, 512, 512]
    - [0, 8.547]
  - - [704, 3136, 1, 512, 704, 704, 512, 512]
    - [0, 8.676]
  - - [832, 3136, 1, 512, 832, 832, 512, 512]
    - [0, 8.563]
  - - [960, 3136, 1, 512, 960, 960, 512, 512]
    - [0, 8.579]
  - - [1088, 3136, 1, 512, 1088, 1088, 512, 512]
    - [0, 8.631]
  - - [1216, 3136, 1, 512, 1216, 1216, 512, 512]
    - [0, 8.791]
  - - [1344, 3136, 1, 512, 1344, 1344, 512, 512]
    - [0, 8.76]
  - - [1472, 3136, 1, 512, 1472, 1472, 512, 512]
    - [0, 8.747]
  - - [1600, 3136, 1, 512, 1600, 1600, 512, 512]
    - [0, 8.812]
  - - [1728, 3136, 1, 512, 1728, 1728, 512, 512]
    - [0, 8.932]
  - - [1856, 3136, 1, 512, 1856, 1856, 512, 512]
    - [0, 8.877]
  - - [1984, 3136, 1, 512, 1984, 1984, 512, 512]
    - [0, 8.936]
  - - [2112, 3136, 1, 512, 2112, 2112, 512, 512]
    - [0, 8.977]
  - - [2240, 3136, 1, 512, 2240, 2240, 512, 512]
    - [0, 8.959]
  - - [2368, 3136, 1, 512, 2368, 2368, 512, 512]
    - [0, 9.052]
  - - [2496, 3136, 1, 512, 2496, 2496, 512, 512]
    - [0, 9.026]
  - - [2624, 3136, 1, 512, 2624, 2624, 512, 512]
    - [0, 9.083]
  - - [2752, 3136, 1, 512, 2752, 2752, 512, 512]
    - [0, 9.111]
  - - [2880, 3136, 1, 512, 2880, 2880, 512, 512]
    - [0, 9.051]
  - - [3008, 3136, 1, 512, 3008, 3008, 512, 512]
    - [0, 9.079]
  - - [3136, 3136, 1, 512, 3136, 3136, 512, 512]
    - [0, 9.212]
  - - [3264, 3136, 1, 512, 3264, 3264, 512, 512]
    - [0, 9.101]
  - - [3392, 3136, 1, 512, 3392, 3392, 512, 512]
    - [0, 9.273]
  - - [3520, 3136, 1, 512, 3520, 3520, 512, 512]
    - [0, 9.191]
  - - [3648, 3136, 1, 512, 3648, 3648, 512, 512]
    - [0, 9.26]
  - - [3776, 3136, 1, 512, 3776, 3776, 512, 512]
    - [0, 9.169]
  - - [3904, 3136, 1, 512, 3904, 3904, 512, 512]
    - [0, 9.277]
  - - [4032, 3136, 1, 512, 4032, 4032, 512, 512]
    - [0, 9.155]
  - - [64, 3264, 1, 512, 64, 64, 512, 512]
    - [0, 6.285]
  - - [192, 3264, 1, 512, 192, 192, 512, 512]
    - [0, 8.08]
  - - [320, 3264, 1, 512, 320, 320, 512, 512]
    - [0, 8.392]
  - - [448, 3264, 1, 512, 448, 448, 512, 512]
    - [0, 8.451]
  - - [576, 3264, 1, 512, 576, 576, 512, 512]
    - [0, 8.672]
  - - [704, 3264, 1, 512, 704, 704, 512, 512]
    - [0, 8.658]
  - - [832, 3264, 1, 512, 832, 832, 512, 512]
    - [0, 8.812]
  - - [960, 3264, 1, 512, 960, 960, 512, 512]
    - [0, 8.632]
  - - [1088, 3264, 1, 512, 1088, 1088, 512, 512]
    - [0, 8.714]
  - - [1216, 3264, 1, 512, 1216, 1216, 512, 512]
    - [0, 8.706]
  - - [1344, 3264, 1, 512, 1344, 1344, 512, 512]
    - [0, 8.74]
  - - [1472, 3264, 1, 512, 1472, 1472, 512, 512]
    - [0, 8.907]
  - - [1600, 3264, 1, 512, 1600, 1600, 512, 512]
    - [0, 8.793]
  - - [1728, 3264, 1, 512, 1728, 1728, 512, 512]
    - [0, 8.616]
  - - [1856, 3264, 1, 512, 1856, 1856, 512, 512]
    - [0, 8.925]
  - - [1984, 3264, 1, 512, 1984, 1984, 512, 512]
    - [0, 8.941]
  - - [2112, 3264, 1, 512, 2112, 2112, 512, 512]
    - [0, 9.019]
  - - [2240, 3264, 1, 512, 2240, 2240, 512, 512]
    - [0, 9.02]
  - - [2368, 3264, 1, 512, 2368, 2368, 512, 512]
    - [0, 9.04]
  - - [2496, 3264, 1, 512, 2496, 2496, 512, 512]
    - [0, 9.119]
  - - [2624, 3264, 1, 512, 2624, 2624, 512, 512]
    - [0, 9.154]
  - - [2752, 3264, 1, 512, 2752, 2752, 512, 512]
    - [0, 9.163]
  - - [2880, 3264, 1, 512, 2880, 2880, 512, 512]
    - [0, 9.131]
  - - [3008, 3264, 1, 512, 3008, 3008, 512, 512]
    - [0, 9.194]
  - - [3136, 3264, 1, 512, 3136, 3136, 512, 512]
    - [0, 9.258]
  - - [3264, 3264, 1, 512, 3264, 3264, 512, 512]
    - [0, 9.264]
  - - [3392, 3264, 1, 512, 3392, 3392, 512, 512]
    - [0, 9.118]
  - - [3520, 3264, 1, 512, 3520, 3520, 512, 512]
    - [0, 9.264]
  - - [3648, 3264, 1, 512, 3648, 3648, 512, 512]
    - [0, 9.253]
  - - [3776, 3264, 1, 512, 3776, 3776, 512, 512]
    - [0, 9.163]
  - - [3904, 3264, 1, 512, 3904, 3904, 512, 512]
    - [0, 9.25]
  - - [4032, 3264, 1, 512, 4032, 4032, 512, 512]
    - [0, 9.344]
  - - [64, 3392, 1, 512, 64, 64, 512, 512]
    - [0, 6.585]
  - - [192, 3392, 1, 512, 192, 192, 512, 512]
    - [0, 8.018]
  - - [320, 3392, 1, 512, 320, 320, 512, 512]
    - [0, 8.239]
  - - [448, 3392, 1, 512, 448, 448, 512, 512]
    - [0, 8.48]
  - - [576, 3392, 1, 512, 576, 576, 512, 512]
    - [0, 8.501]
  - - [704, 3392, 1, 512, 704, 704, 512, 512]
    - [0, 8.532]
  - - [832, 3392, 1, 512, 832, 832, 512, 512]
    - [0, 8.714]
  - - [960, 3392, 1, 512, 960, 960, 512, 512]
    - [0, 8.694]
  - - [1088, 3392, 1, 512, 1088, 1088, 512, 512]
    - [0, 8.78]
  - - [1216, 3392, 1, 512, 1216, 1216, 512, 512]
    - [0, 8.754]
  - - [1344, 3392, 1, 512, 1344, 1344, 512, 512]
    - [0, 8.8]
  - - [1472, 3392, 1, 512, 1472, 1472, 512, 512]
    - [0, 8.743]
  - - [1600, 3392, 1, 512, 1600, 1600, 512, 512]
    - [0, 8.891]
  - - [1728, 3392, 1, 512, 1728, 1728, 512, 512]
    - [0, 8.871]
  - - [1856, 3392, 1, 512, 1856, 1856, 512, 512]
    - [0, 8.91]
  - - [1984, 3392, 1, 512, 1984, 1984, 512, 512]
    - [0, 9.063]
  - - [2112, 3392, 1, 512, 2112, 2112, 512, 512]
    - [0, 9.058]
  - - [2240, 3392, 1, 512, 2240, 2240, 512, 512]
    - [0, 9.074]
  - - [2368, 3392, 1, 512, 2368, 2368, 512, 512]
    - [0, 9.039]
  - - [2496, 3392, 1, 512, 2496, 2496, 512, 512]
    - [0, 9.124]
  - - [2624, 3392, 1, 512, 2624, 2624, 512, 512]
    - [0, 9.122]
  - - [2752, 3392, 1, 512, 2752, 2752, 512, 512]
    - [0, 9.149]
  - - [2880, 3392, 1, 512, 2880, 2880, 512, 512]
    - [0, 9.122]
  - - [3008, 3392, 1, 512, 3008, 3008, 512, 512]
    - [0, 9.08]
  - - [3136, 3392, 1, 512, 3136, 3136, 512, 512]
    - [0, 9.151]
  - - [3264, 3392, 1, 512, 3264, 3264, 512, 512]
    - [0, 9.264]
  - - [3392, 3392, 1, 512, 3392, 3392, 512, 512]
    - [0, 9.151]
  - - [3520, 3392, 1, 512, 3520, 3520, 512, 512]
    - [0, 9.169]
  - - [3648, 3392, 1, 512, 3648, 3648, 512, 512]
    - [0, 9.354]
  - - [3776, 3392, 1, 512, 3776, 3776, 512, 512]
    - [0, 9.311]
  - - [3904, 3392, 1, 512, 3904, 3904, 512, 512]
    - [0, 9.196]
  - - [4032, 3392, 1, 512, 4032, 4032, 512, 512]
    - [0, 9.234]
  - - [64, 3520, 1, 512, 64, 64, 512, 512]
    - [0, 6.754]
  - - [192, 3520, 1, 512, 192, 192, 512, 512]
    - [0, 8.272]
  - - [320, 3520, 1, 512, 320, 320, 512, 512]
    - [0, 8.375]
  - - [448, 3520, 1, 512, 448, 448, 512, 512]
    - [0, 8.528]
  - - [576, 3520, 1, 512, 576, 576, 512, 512]
    - [0, 8.467]
  - - [704, 3520, 1, 512, 704, 704, 512, 512]
    - [0, 8.613]
  - - [832, 3520, 1, 512, 832, 832, 512, 512]
    - [0, 8.55]
  - - [960, 3520, 1, 512, 960, 960, 512, 512]
    - [0, 8.652]
  - - [1088, 3520, 1, 512, 1088, 1088, 512, 512]
    - [0, 8.661]
  - - [1216, 3520, 1, 512, 1216, 1216, 512, 512]
    - [0, 8.866]
  - - [1344, 3520, 1, 512, 1344, 1344, 512, 512]
    - [0, 8.835]
  - - [1472, 3520, 1, 512, 1472, 1472, 512, 512]
    - [0, 8.891]
  - - [1600, 3520, 1, 512, 1600, 1600, 512, 512]
    - [0, 8.952]
  - - [1728, 3520, 1, 512, 1728, 1728, 512, 512]
    - [0, 8.953]
  - - [1856, 3520, 1, 512, 1856, 1856, 512, 512]
    - [0, 8.984]
  - - [1984, 3520, 1, 512, 1984, 1984, 512, 512]
    - [0, 8.98]
  - - [2112, 3520, 1, 512, 2112, 2112, 512, 512]
    - [0, 9.051]
  - - [2240, 3520, 1, 512, 2240, 2240, 512, 512]
    - [0, 9.097]
  - - [2368, 3520, 1, 512, 2368, 2368, 512, 512]
    - [0, 9.039]
  - - [2496, 3520, 1, 512, 2496, 2496, 512, 512]
    - [0, 9.15]
  - - [2624, 3520, 1, 512, 2624, 2624, 512, 512]
    - [0, 9.133]
  - - [2752, 3520, 1, 512, 2752, 2752, 512, 512]
    - [0, 9.152]
  - - [2880, 3520, 1, 512, 2880, 2880, 512, 512]
    - [0, 9.186]
  - - [3008, 3520, 1, 512, 3008, 3008, 512, 512]
    - [0, 9.181]
  - - [3136, 3520, 1, 512, 3136, 3136, 512, 512]
    - [0, 9.267]
  - - [3264, 3520, 1, 512, 3264, 3264, 512, 512]
    - [0, 9.13]
  - - [3392, 3520, 1, 512, 3392, 3392, 512, 512]
    - [0, 9.211]
  - - [3520, 3520, 1, 512, 3520, 3520, 512, 512]
    - [0, 9.208]
  - - [3648, 3520, 1, 512, 3648, 3648, 512, 512]
    - [0, 9.193]
  - - [3776, 3520, 1, 512, 3776, 3776, 512, 512]
    - [0, 9.153]
  - - [3904, 3520, 1, 512, 3904, 3904, 512, 512]
    - [0, 9.245]
  - - [4032, 3520, 1, 512, 4032, 4032, 512, 512]
    - [0, 9.46]
  - - [64, 3648, 1, 512, 64, 64, 512, 512]
    - [0, 6.992]
  - - [192, 3648, 1, 512, 192, 192, 512, 512]
    - [0, 8.046]
  - - [320, 3648, 1, 512, 320, 320, 512, 512]
    - [0, 8.448]
  - - [448, 3648, 1, 512, 448, 448, 512, 512]
    - [0, 8.409]
  - - [576, 3648, 1, 512, 576, 576, 512, 512]
    - [0, 8.638]
  - - [704, 3648, 1, 512, 704, 704, 512, 512]
    - [0, 8.612]
  - - [832, 3648, 1, 512, 832, 832, 512, 512]
    - [0, 8.601]
  - - [960, 3648, 1, 512, 960, 960, 512, 512]
    - [0, 8.665]
  - - [1088, 3648, 1, 512, 1088, 1088, 512, 512]
    - [0, 8.726]
  - - [1216, 3648, 1, 512, 1216, 1216, 512, 512]
    - [0, 8.784]
  - - [1344, 3648, 1, 512, 1344, 1344, 512, 512]
    - [0, 8.692]
  - - [1472, 3648, 1, 512, 1472, 1472, 512, 512]
    - [0, 8.831]
  - - [1600, 3648, 1, 512, 1600, 1600, 512, 512]
    - [0, 8.941]
  - - [1728, 3648, 1, 512, 1728, 1728, 512, 512]
    - [0, 8.889]
  - - [1856, 3648, 1, 512, 1856, 1856, 512, 512]
    - [0, 8.958]
  - - [1984, 3648, 1, 512, 1984, 1984, 512, 512]
    - [0, 9.056]
  - - [2112, 3648, 1, 512, 2112, 2112, 512, 512]
    - [0, 9.042]
  - - [2240, 3648, 1, 512, 2240, 2240, 512, 512]
    - [0, 9.165]
  - - [2368, 3648, 1, 512, 2368, 2368, 512, 512]
    - [0, 9.074]
  - - [2496, 3648, 1, 512, 2496, 2496, 512, 512]
    - [0, 9.091]
  - - [2624, 3648, 1, 512, 2624, 2624, 512, 512]
    - [0, 9.186]
  - - [2752, 3648, 1, 512, 2752, 2752, 512, 512]
    - [0, 9.177]
  - - [2880, 3648, 1, 512, 2880, 2880, 512, 512]
    - [0, 9.094]
  - - [3008, 3648, 1, 512, 3008, 3008, 512, 512]
    - [0, 9.128]
  - - [3136, 3648, 1, 512, 3136, 3136, 512, 512]
    - [0, 9.215]
  - - [3264, 3648, 1, 512, 3264, 3264, 512, 512]
    - [0, 9.265]
  - - [3392, 3648, 1, 512, 3392, 3392, 512, 512]
    - [0, 9.32]
  - - [3520, 3648, 1, 512, 3520, 3520, 512, 512]
    - [0, 9.354]
  - - [3648, 3648, 1, 512, 3648, 3648, 512, 512]
    - [0, 9.376]
  - - [3776, 3648, 1, 512, 3776, 3776, 512, 512]
    - [0, 9.268]
  - - [3904, 3648, 1, 512, 3904, 3904, 512, 512]
    - [0, 9.345]
  - - [4032, 3648, 1, 512, 4032, 4032, 512, 512]
    - [0, 9.435]
  - - [64, 3776, 1, 512, 64, 64, 512, 512]
    - [0, 7.211]
  - - [192, 3776, 1, 512, 192, 192, 512, 512]
    - [0, 8.266]
  - - [320, 3776, 1, 512, 320, 320, 512, 512]
    - [0, 8.355]
  - - [448, 3776, 1, 512, 448, 448, 512, 512]
    - [0, 8.414]
  - - [576, 3776, 1, 512, 576, 576, 512, 512]
    - [0, 8.701]
  - - [704, 3776, 1, 512, 704, 704, 512, 512]
    - [0, 8.608]
  - - [832, 3776, 1, 512, 832, 832, 512, 512]
    - [0, 8.639]
  - - [960, 3776, 1, 512, 960, 960, 512, 512]
    - [0, 8.775]
  - - [1088, 3776, 1, 512, 1088, 1088, 512, 512]
    - [0, 8.676]
  - - [1216, 3776, 1, 512, 1216, 1216, 512, 512]
    - [0, 8.748]
  - - [1344, 3776, 1, 512, 1344, 1344, 512, 512]
    - [0, 8.761]
  - - [1472, 3776, 1, 512, 1472, 1472, 512, 512]
    - [0, 8.967]
  - - [1600, 3776, 1, 512, 1600, 1600, 512, 512]
    - [0, 8.873]
  - - [1728, 3776, 1, 512, 1728, 1728, 512, 512]
    - [0, 8.907]
  - - [1856, 3776, 1, 512, 1856, 1856, 512, 512]
    - [0, 9.02]
  - - [1984, 3776, 1, 512, 1984, 1984, 512, 512]
    - [0, 9.015]
  - - [2112, 3776, 1, 512, 2112, 2112, 512, 512]
    - [0, 8.938]
  - - [2240, 3776, 1, 512, 2240, 2240, 512, 512]
    - [0, 9.02]
  - - [2368, 3776, 1, 512, 2368, 2368, 512, 512]
    - [0, 9.062]
  - - [2496, 3776, 1, 512, 2496, 2496, 512, 512]
    - [0, 9.056]
  - - [2624, 3776, 1, 512, 2624, 2624, 512, 512]
    - [0, 9.07]
  - - [2752, 3776, 1, 512, 2752, 2752, 512, 512]
    - [0, 9.041]
  - - [2880, 3776, 1, 512, 2880, 2880, 512, 512]
    - [0, 9.109]
  - - [3008, 3776, 1, 512, 3008, 3008, 512, 512]
    - [0, 9.105]
  - - [3136, 3776, 1, 512, 3136, 3136, 512, 512]
    - [0, 9.102]
  - - [3264, 3776, 1, 512, 3264, 3264, 512, 512]
    - [0, 9.296]
  - - [3392, 3776, 1, 512, 3392, 3392, 512, 512]
    - [0, 9.353]
  - - [3520, 3776, 1, 512, 3520, 3520, 512, 512]
    - [0, 9.341]
  - - [3648, 3776, 1, 512, 3648, 3648, 512, 512]
    - [0, 9.125]
  - - [3776, 3776, 1, 512, 3776, 3776, 512, 512]
    - [0, 9.253]
  - - [3904, 3776, 1, 512, 3904, 3904, 512, 512]
    - [0, 9.426]
  - - [4032, 3776, 1, 512, 4032, 4032, 512, 512]
    - [0, 9.213]
  - - [64, 3904, 1, 512, 64, 64, 512, 512]
    - [0, 6.496]
  - - [192, 3904, 1, 512, 192, 192, 512, 512]
    - [0, 8.167]
  - - [320, 3904, 1, 512, 320, 320, 512, 512]
    - [0, 8.417]
  - - [448, 3904, 1, 512, 448, 448, 512, 512]
    - [0, 8.592]
  - - [576, 3904, 1, 512, 576, 576, 512, 512]
    - [0, 8.739]
  - - [704, 3904, 1, 512, 704, 704, 512, 512]
    - [0, 8.766]
  - - [832, 3904, 1, 512, 832, 832, 512, 512]
    - [0, 8.821]
  - - [960, 3904, 1, 512, 960, 960, 512, 512]
    - [0, 8.8]
  - - [1088, 3904, 1, 512, 1088, 1088, 512, 512]
    - [0, 8.857]
  - - [1216, 3904, 1, 512, 1216, 1216, 512, 512]
    - [0, 8.846]
  - - [1344, 3904, 1, 512, 1344, 1344, 512, 512]
    - [0, 8.8]
  - - [1472, 3904, 1, 512, 1472, 1472, 512, 512]
    - [0, 8.859]
  - - [1600, 3904, 1, 512, 1600, 1600, 512, 512]
    - [0, 8.99]
  - - [1728, 3904, 1, 512, 1728, 1728, 512, 512]
    - [0, 8.95]
  - - [1856, 3904, 1, 512, 1856, 1856, 512, 512]
    - [0, 9.015]
  - - [1984, 3904, 1, 512, 1984, 1984, 512, 512]
    - [0, 9.112]
  - - [2112, 3904, 1, 512, 2112, 2112, 512, 512]
    - [0, 9.178]
  - - [2240, 3904, 1, 512, 2240, 2240, 512, 512]
    - [0, 9.095]
  - - [2368, 3904, 1, 512, 2368, 2368, 512, 512]
    - [0, 9.154]
  - - [2496, 3904, 1, 512, 2496, 2496, 512, 512]
    - [0, 9.174]
  - - [2624, 3904, 1, 512, 2624, 2624, 512, 512]
    - [0, 9.045]
  - - [2752, 3904, 1, 512, 2752, 2752, 512, 512]
    - [0, 9.08]
  - - [2880, 3904, 1, 512, 2880, 2880, 512, 512]
    - [0, 9.138]
  - - [3008, 3904, 1, 512, 3008, 3008, 512, 512]
    - [0, 9.295]
  - - [3136, 3904, 1, 512, 3136, 3136, 512, 512]
    - [0, 9.183]
  - - [3264, 3904, 1, 512, 3264, 3264, 512, 512]
    - [0, 9.201]
  - - [3392, 3904, 1, 512, 3392, 3392, 512, 512]
    - [0, 9.39]
  - - [3520, 3904, 1, 512, 3520, 3520, 512, 512]
    - [0, 9.261]
  - - [3648, 3904, 1, 512, 3648, 3648, 512, 512]
    - [0, 9.379]
  - - [3776, 3904, 1, 512, 3776, 3776, 512, 512]
    - [0, 9.444]
  - - [3904, 3904, 1, 512, 3904, 3904, 512, 512]
    - [0, 9.325]
  - - [4032, 3904, 1, 512, 4032, 4032, 512, 512]
    - [0, 9.194]
  - - [64, 4032, 1, 512, 64, 64, 512, 512]
    - [0, 6.641]
  - - [192, 4032, 1, 512, 192, 192, 512, 512]
    - [0, 8.241]
  - - [320, 4032, 1, 512, 320, 320, 512, 512]
    - [0, 8.411]
  - - [448, 4032, 1, 512, 448, 448, 512, 512]
    - [0, 8.564]
  - - [576, 4032, 1, 512, 576, 576, 512, 512]
    - [0, 8.797]
  - - [704, 4032, 1, 512, 704, 704, 512, 512]
    - [0, 8.756]
  - - [832, 4032, 1, 512, 832, 832, 512, 512]
    - [0, 8.821]
  - - [960, 4032, 1, 512, 960, 960, 512, 512]
    - [0, 8.821]
  - - [1088, 4032, 1, 512, 1088, 1088, 512, 512]
    - [0, 8.702]
  - - [1216, 4032, 1, 512, 1216, 1216, 512, 512]
    - [0, 8.757]
  - - [1344, 4032, 1, 512, 1344, 1344, 512, 512]
    - [0, 8.848]
  - - [1472, 4032, 1, 512, 1472, 1472, 512, 512]
    - [0, 8.857]
  - - [1600, 4032, 1, 512, 1600, 1600, 512, 512]
    - [0, 8.923]
  - - [1728, 4032, 1, 512, 1728, 1728, 512, 512]
    - [0, 9.052]
  - - [1856, 4032, 1, 512, 1856, 1856, 512, 512]
    - [0, 9.074]
  - - [1984, 4032, 1, 512, 1984, 1984, 512, 512]
    - [0, 9.032]
  - - [2112, 4032, 1, 512, 2112, 2112, 512, 512]
    - [0, 9.036]
  - - [2240, 4032, 1, 512, 2240, 2240, 512, 512]
    - [0, 9.032]
  - - [2368, 4032, 1, 512, 2368, 2368, 512, 512]
    - [0, 9.142]
  - - [2496, 4032, 1, 512, 2496, 2496, 512, 512]
    - [0, 9.031]
  - - [2624, 4032, 1, 512, 2624, 2624, 512, 512]
    - [0, 9.015]
  - - [2752, 4032, 1, 512, 2752, 2752, 512, 512]
    - [0, 9.161]
  - - [2880, 4032, 1, 512, 2880, 2880, 512, 512]
    - [0, 9.136]
  - - [3008, 4032, 1, 512, 3008, 3008, 512, 512]
    - [0, 9.191]
  - - [3136, 4032, 1, 512, 3136, 3136, 512, 512]
    - [0, 9.212]
  - - [3264, 4032, 1, 512, 3264, 3264, 512, 512]
    - [0, 9.373]
  - - [3392, 4032, 1, 512, 3392, 3392, 512, 512]
    - [0, 9.24]
  - - [3520, 4032, 1, 512, 3520, 3520, 512, 512]
    - [0, 9.461]
  - - [3648, 4032, 1, 512, 3648, 3648, 512, 512]
    - [0, 9.372]
  - - [3776, 4032, 1, 512, 3776, 3776, 512, 512]
    - [0, 9.252]
  - - [3904, 4032, 1, 512, 3904, 3904, 512, 512]
    - [0, 9.274]
  - - [4032, 4032, 1, 512, 4032, 4032, 512, 512]
    - [0, 9.294]
  - - [64, 64, 1, 1024, 64, 64, 1024, 1024]
    - [1, 0.689]
  - - [192, 64, 1, 1024, 192, 192, 1024, 1024]
    - [1, 2.066]
  - - [320, 64, 1, 1024, 320, 320, 1024, 1024]
    - [3, 2.926]
  - - [448, 64, 1, 1024, 448, 448, 1024, 1024]
    - [0, 3.374]
  - - [576, 64, 1, 1024, 576, 576, 1024, 1024]
    - [0, 4.324]
  - - [704, 64, 1, 1024, 704, 704, 1024, 1024]
    - [0, 5.28]
  - - [832, 64, 1, 1024, 832, 832, 1024, 1024]
    - [0, 3.804]
  - - [960, 64, 1, 1024, 960, 960, 1024, 1024]
    - [0, 4.371]
  - - [1088, 64, 1, 1024, 1088, 1088, 1024, 1024]
    - [0, 4.98]
  - - [1216, 64, 1, 1024, 1216, 1216, 1024, 1024]
    - [0, 5.565]
  - - [1344, 64, 1, 1024, 1344, 1344, 1024, 1024]
    - [0, 6.14]
  - - [1472, 64, 1, 1024, 1472, 1472, 1024, 1024]
    - [0, 6.723]
  - - [1600, 64, 1, 1024, 1600, 1600, 1024, 1024]
    - [0, 5.236]
  - - [1728, 64, 1, 1024, 1728, 1728, 1024, 1024]
    - [0, 5.651]
  - - [1856, 64, 1, 1024, 1856, 1856, 1024, 1024]
    - [0, 6.047]
  - - [1984, 64, 1, 1024, 1984, 1984, 1024, 1024]
    - [0, 6.462]
  - - [2112, 64, 1, 1024, 2112, 2112, 1024, 1024]
    - [0, 6.85]
  - - [2240, 64, 1, 1024, 2240, 2240, 1024, 1024]
    - [0, 7.264]
  - - [2368, 64, 1, 1024, 2368, 2368, 1024, 1024]
    - [0, 5.996]
  - - [2496, 64, 1, 1024, 2496, 2496, 1024, 1024]
    - [0, 6.292]
  - - [2624, 64, 1, 1024, 2624, 2624, 1024, 1024]
    - [0, 6.607]
  - - [2752, 64, 1, 1024, 2752, 2752, 1024, 1024]
    - [0, 6.92]
  - - [2880, 64, 1, 1024, 2880, 2880, 1024, 1024]
    - [0, 7.248]
  - - [3008, 64, 1, 1024, 3008, 3008, 1024, 1024]
    - [0, 7.787]
  - - [3136, 64, 1, 1024, 3136, 3136, 1024, 1024]
    - [0, 6.568]
  - - [3264, 64, 1, 1024, 3264, 3264, 1024, 1024]
    - [0, 7.059]
  - - [3392, 64, 1, 1024, 3392, 3392, 1024, 1024]
    - [0, 7.162]
  - - [3520, 64, 1, 1024, 3520, 3520, 1024, 1024]
    - [0, 7.597]
  - - [3648, 64, 1, 1024, 3648, 3648, 1024, 1024]
    - [0, 7.863]
  - - [3776, 64, 1, 1024, 3776, 3776, 1024, 1024]
    - [0, 8.001]
  - - [3904, 64, 1, 1024, 3904, 3904, 1024, 1024]
    - [0, 6.981]
  - - [4032, 64, 1, 1024, 4032, 4032, 1024, 1024]
    - [0, 7.398]
  - - [64, 192, 1, 1024, 64, 64, 1024, 1024]
    - [1, 2.073]
  - - [192, 192, 1, 1024, 192, 192, 1024, 1024]
    - [0, 4.33]
  - - [320, 192, 1, 1024, 320, 320, 1024, 1024]
    - [0, 4.375]
  - - [448, 192, 1, 1024, 448, 448, 1024, 1024]
    - [0, 6.101]
  - - [576, 192, 1, 1024, 576, 576, 1024, 1024]
    - [0, 5.603]
  - - [704, 192, 1, 1024, 704, 704, 1024, 1024]
    - [0, 6.839]
  - - [832, 192, 1, 1024, 832, 832, 1024, 1024]
    - [0, 6.309]
  - - [960, 192, 1, 1024, 960, 960, 1024, 1024]
    - [0, 7.255]
  - - [1088, 192, 1, 1024, 1088, 1088, 1024, 1024]
    - [0, 6.885]
  - - [1216, 192, 1, 1024, 1216, 1216, 1024, 1024]
    - [0, 7.786]
  - - [1344, 192, 1, 1024, 1344, 1344, 1024, 1024]
    - [0, 7.42]
  - - [1472, 192, 1, 1024, 1472, 1472, 1024, 1024]
    - [0, 7.945]
  - - [1600, 192, 1, 1024, 1600, 1600, 1024, 1024]
    - [0, 7.557]
  - - [1728, 192, 1, 1024, 1728, 1728, 1024, 1024]
    - [0, 8.089]
  - - [1856, 192, 1, 1024, 1856, 1856, 1024, 1024]
    - [0, 7.54]
  - - [1984, 192, 1, 1024, 1984, 1984, 1024, 1024]
    - [0, 7.974]
  - - [2112, 192, 1, 1024, 2112, 2112, 1024, 1024]
    - [0, 7.713]
  - - [2240, 192, 1, 1024, 2240, 2240, 1024, 1024]
    - [0, 8.186]
  - - [2368, 192, 1, 1024, 2368, 2368, 1024, 1024]
    - [0, 7.84]
  - - [2496, 192, 1, 1024, 2496, 2496, 1024, 1024]
    - [0, 8.238]
  - - [2624, 192, 1, 1024, 2624, 2624, 1024, 1024]
    - [0, 7.958]
  - - [2752, 192, 1, 1024, 2752, 2752, 1024, 1024]
    - [0, 8.194]
  - - [2880, 192, 1, 1024, 2880, 2880, 1024, 1024]
    - [0, 7.984]
  - - [3008, 192, 1, 1024, 3008, 3008, 1024, 1024]
    - [0, 8.332]
  - - [3136, 192, 1, 1024, 3136, 3136, 1024, 1024]
    - [0, 8.133]
  - - [3264, 192, 1, 1024, 3264, 3264, 1024, 1024]
    - [0, 8.399]
  - - [3392, 192, 1, 1024, 3392, 3392, 1024, 1024]
    - [0, 8.192]
  - - [3520, 192, 1, 1024, 3520, 3520, 1024, 1024]
    - [0, 8.453]
  - - [3648, 192, 1, 1024, 3648, 3648, 1024, 1024]
    - [0, 8.265]
  - - [3776, 192, 1, 1024, 3776, 3776, 1024, 1024]
    - [0, 8.441]
  - - [3904, 192, 1, 1024, 3904, 3904, 1024, 1024]
    - [0, 8.244]
  - - [4032, 192, 1, 1024, 4032, 4032, 1024, 1024]
    - [0, 8.438]
  - - [64, 320, 1, 1024, 64, 64, 1024, 1024]
    - [2, 2.614]
  - - [192, 320, 1, 1024, 192, 192, 1024, 1024]
    - [0, 4.367]
  - - [320, 320, 1, 1024, 320, 320, 1024, 1024]
    - [0, 5.225]
  - - [448, 320, 1, 1024, 448, 448, 1024, 1024]
    - [0, 7.273]
  - - [576, 320, 1, 1024, 576, 576, 1024, 1024]
    - [0, 7.27]
  - - [704, 320, 1, 1024, 704, 704, 1024, 1024]
    - [0, 7.557]
  - - [832, 320, 1, 1024, 832, 832, 1024, 1024]
    - [0, 7.684]
  - - [960, 320, 1, 1024, 960, 960, 1024, 1024]
    - [0, 7.42]
  - - [1088, 320, 1, 1024, 1088, 1088, 1024, 1024]
    - [0, 7.409]
  - - [1216, 320, 1, 1024, 1216, 1216, 1024, 1024]
    - [0, 8.152]
  - - [1344, 320, 1, 1024, 1344, 1344, 1024, 1024]
    - [0, 8.185]
  - - [1472, 320, 1, 1024, 1472, 1472, 1024, 1024]
    - [0, 8.112]
  - - [1600, 320, 1, 1024, 1600, 1600, 1024, 1024]
    - [0, 8.039]
  - - [1728, 320, 1, 1024, 1728, 1728, 1024, 1024]
    - [0, 7.965]
  - - [1856, 320, 1, 1024, 1856, 1856, 1024, 1024]
    - [0, 8.165]
  - - [1984, 320, 1, 1024, 1984, 1984, 1024, 1024]
    - [0, 8.481]
  - - [2112, 320, 1, 1024, 2112, 2112, 1024, 1024]
    - [0, 8.444]
  - - [2240, 320, 1, 1024, 2240, 2240, 1024, 1024]
    - [0, 8.374]
  - - [2368, 320, 1, 1024, 2368, 2368, 1024, 1024]
    - [0, 8.299]
  - - [2496, 320, 1, 1024, 2496, 2496, 1024, 1024]
    - [0, 8.323]
  - - [2624, 320, 1, 1024, 2624, 2624, 1024, 1024]
    - [0, 8.339]
  - - [2752, 320, 1, 1024, 2752, 2752, 1024, 1024]
    - [0, 8.544]
  - - [2880, 320, 1, 1024, 2880, 2880, 1024, 1024]
    - [0, 8.494]
  - - [3008, 320, 1, 1024, 3008, 3008, 1024, 1024]
    - [0, 8.477]
  - - [3136, 320, 1, 1024, 3136, 3136, 1024, 1024]
    - [0, 8.499]
  - - [3264, 320, 1, 1024, 3264, 3264, 1024, 1024]
    - [0, 8.495]
  - - [3392, 320, 1, 1024, 3392, 3392, 1024, 1024]
    - [0, 8.568]
  - - [3520, 320, 1, 1024, 3520, 3520, 1024, 1024]
    - [0, 8.67]
  - - [3648, 320, 1, 1024, 3648, 3648, 1024, 1024]
    - [0, 8.581]
  - - [3776, 320, 1, 1024, 3776, 3776, 1024, 1024]
    - [0, 8.57]
  - - [3904, 320, 1, 1024, 3904, 3904, 1024, 1024]
    - [0, 8.517]
  - - [4032, 320, 1, 1024, 4032, 4032, 1024, 1024]
    - [0, 8.627]
  - - [64, 448, 1, 1024, 64, 64, 1024, 1024]
    - [0, 3.367]
  - - [192, 448, 1, 1024, 192, 192, 1024, 1024]
    - [0, 6.091]
  - - [320, 448, 1, 1024, 320, 320, 1024, 1024]
    - [0, 7.221]
  - - [448, 448, 1, 1024, 448, 448, 1024, 1024]
    - [0, 6.628]
  - - [576, 448, 1, 1024, 576, 576, 1024, 1024]
    - [0, 7.311]
  - - [704, 448, 1, 1024, 704, 704, 1024, 1024]
    - [0, 7.79]
  - - [832, 448, 1, 1024, 832, 832, 1024, 1024]
    - [0, 7.868]
  - - [960, 448, 1, 1024, 960, 960, 1024, 1024]
    - [0, 8.17]
  - - [1088, 448, 1, 1024, 1088, 1088, 1024, 1024]
    - [0, 8.345]
  - - [1216, 448, 1, 1024, 1216, 1216, 1024, 1024]
    - [0, 7.918]
  - - [1344, 448, 1, 1024, 1344, 1344, 1024, 1024]
    - [0, 8.094]
  - - [1472, 448, 1, 1024, 1472, 1472, 1024, 1024]
    - [0, 8.211]
  - - [1600, 448, 1, 1024, 1600, 1600, 1024, 1024]
    - [0, 8.179]
  - - [1728, 448, 1, 1024, 1728, 1728, 1024, 1024]
    - [0, 8.439]
  - - [1856, 448, 1, 1024, 1856, 1856, 1024, 1024]
    - [0, 8.529]
  - - [1984, 448, 1, 1024, 1984, 1984, 1024, 1024]
    - [0, 8.335]
  - - [2112, 448, 1, 1024, 2112, 2112, 1024, 1024]
    - [0, 8.376]
  - - [2240, 448, 1, 1024, 2240, 2240, 1024, 1024]
    - [0, 8.528]
  - - [2368, 448, 1, 1024, 2368, 2368, 1024, 1024]
    - [0, 8.589]
  - - [2496, 448, 1, 1024, 2496, 2496, 1024, 1024]
    - [0, 8.585]
  - - [2624, 448, 1, 1024, 2624, 2624, 1024, 1024]
    - [0, 8.579]
  - - [2752, 448, 1, 1024, 2752, 2752, 1024, 1024]
    - [0, 8.485]
  - - [2880, 448, 1, 1024, 2880, 2880, 1024, 1024]
    - [0, 8.513]
  - - [3008, 448, 1, 1024, 3008, 3008, 1024, 1024]
    - [0, 8.494]
  - - [3136, 448, 1, 1024, 3136, 3136, 1024, 1024]
    - [0, 8.639]
  - - [3264, 448, 1, 1024, 3264, 3264, 1024, 1024]
    - [0, 8.729]
  - - [3392, 448, 1, 1024, 3392, 3392, 1024, 1024]
    - [0, 8.712]
  - - [3520, 448, 1, 1024, 3520, 3520, 1024, 1024]
    - [0, 8.771]
  - - [3648, 448, 1, 1024, 3648, 3648, 1024, 1024]
    - [0, 8.668]
  - - [3776, 448, 1, 1024, 3776, 3776, 1024, 1024]
    - [0, 8.682]
  - - [3904, 448, 1, 1024, 3904, 3904, 1024, 1024]
    - [0, 8.752]
  - - [4032, 448, 1, 1024, 4032, 4032, 1024, 1024]
    - [0, 8.774]
  - - [64, 576, 1, 1024, 64, 64, 1024, 1024]
    - [0, 4.32]
  - - [192, 576, 1, 1024, 192, 192, 1024, 1024]
    - [0, 5.596]
  - - [320, 576, 1, 1024, 320, 320, 1024, 1024]
    - [0, 7.229]
  - - [448, 576, 1, 1024, 448, 448, 1024, 1024]
    - [0, 7.331]
  - - [576, 576, 1, 1024, 576, 576, 1024, 1024]
    - [0, 8.071]
  - - [704, 576, 1, 1024, 704, 704, 1024, 1024]
    - [0, 7.734]
  - - [832, 576, 1, 1024, 832, 832, 1024, 1024]
    - [0, 8.268]
  - - [960, 576, 1, 1024, 960, 960, 1024, 1024]
    - [0, 7.995]
  - - [1088, 576, 1, 1024, 1088, 1088, 1024, 1024]
    - [0, 8.387]
  - - [1216, 576, 1, 1024, 1216, 1216, 1024, 1024]
    - [0, 8.223]
  - - [1344, 576, 1, 1024, 1344, 1344, 1024, 1024]
    - [0, 8.455]
  - - [1472, 576, 1, 1024, 1472, 1472, 1024, 1024]
    - [0, 8.295]
  - - [1600, 576, 1, 1024, 1600, 1600, 1024, 1024]
    - [0, 8.532]
  - - [1728, 576, 1, 1024, 1728, 1728, 1024, 1024]
    - [0, 8.523]
  - - [1856, 576, 1, 1024, 1856, 1856, 1024, 1024]
    - [0, 8.654]
  - - [1984, 576, 1, 1024, 1984, 1984, 1024, 1024]
    - [0, 8.44]
  - - [2112, 576, 1, 1024, 2112, 2112, 1024, 1024]
    - [0, 8.665]
  - - [2240, 576, 1, 1024, 2240, 2240, 1024, 1024]
    - [0, 8.607]
  - - [2368, 576, 1, 1024, 2368, 2368, 1024, 1024]
    - [0, 8.624]
  - - [2496, 576, 1, 1024, 2496, 2496, 1024, 1024]
    - [0, 8.638]
  - - [2624, 576, 1, 1024, 2624, 2624, 1024, 1024]
    - [0, 8.649]
  - - [2752, 576, 1, 1024, 2752, 2752, 1024, 1024]
    - [0, 8.641]
  - - [2880, 576, 1, 1024, 2880, 2880, 1024, 1024]
    - [0, 8.752]
  - - [3008, 576, 1, 1024, 3008, 3008, 1024, 1024]
    - [0, 8.791]
  - - [3136, 576, 1, 1024, 3136, 3136, 1024, 1024]
    - [0, 8.795]
  - - [3264, 576, 1, 1024, 3264, 3264, 1024, 1024]
    - [0, 8.667]
  - - [3392, 576, 1, 1024, 3392, 3392, 1024, 1024]
    - [0, 8.785]
  - - [3520, 576, 1, 1024, 3520, 3520, 1024, 1024]
    - [0, 8.732]
  - - [3648, 576, 1, 1024, 3648, 3648, 1024, 1024]
    - [0, 8.82]
  - - [3776, 576, 1, 1024, 3776, 3776, 1024, 1024]
    - [0, 8.636]
  - - [3904, 576, 1, 1024, 3904, 3904, 1024, 1024]
    - [0, 8.78]
  - - [4032, 576, 1, 1024, 4032, 4032, 1024, 1024]
    - [0, 8.748]
  - - [64, 704, 1, 1024, 64, 64, 1024, 1024]
    - [0, 5.249]
  - - [192, 704, 1, 1024, 192, 192, 1024, 1024]
    - [0, 6.832]
  - - [320, 704, 1, 1024, 320, 320, 1024, 1024]
    - [0, 7.643]
  - - [448, 704, 1, 1024, 448, 448, 1024, 1024]
    - [0, 7.681]
  - - [576, 704, 1, 1024, 576, 576, 1024, 1024]
    - [0, 7.781]
  - - [704, 704, 1, 1024, 704, 704, 1024, 1024]
    - [0, 7.87]
  - - [832, 704, 1, 1024, 832, 832, 1024, 1024]
    - [0, 8.335]
  - - [960, 704, 1, 1024, 960, 960, 1024, 1024]
    - [0, 8.49]
  - - [1088, 704, 1, 1024, 1088, 1088, 1024, 1024]
    - [0, 8.429]
  - - [1216, 704, 1, 1024, 1216, 1216, 1024, 1024]
    - [0, 8.423]
  - - [1344, 704, 1, 1024, 1344, 1344, 1024, 1024]
    - [0, 8.367]
  - - [1472, 704, 1, 1024, 1472, 1472, 1024, 1024]
    - [0, 8.338]
  - - [1600, 704, 1, 1024, 1600, 1600, 1024, 1024]
    - [0, 8.557]
  - - [1728, 704, 1, 1024, 1728, 1728, 1024, 1024]
    - [0, 8.584]
  - - [1856, 704, 1, 1024, 1856, 1856, 1024, 1024]
    - [0, 8.462]
  - - [1984, 704, 1, 1024, 1984, 1984, 1024, 1024]
    - [0, 8.546]
  - - [2112, 704, 1, 1024, 2112, 2112, 1024, 1024]
    - [0, 8.617]
  - - [2240, 704, 1, 1024, 2240, 2240, 1024, 1024]
    - [0, 8.742]
  - - [2368, 704, 1, 1024, 2368, 2368, 1024, 1024]
    - [0, 8.75]
  - - [2496, 704, 1, 1024, 2496, 2496, 1024, 1024]
    - [0, 8.735]
  - - [2624, 704, 1, 1024, 2624, 2624, 1024, 1024]
    - [0, 8.713]
  - - [2752, 704, 1, 1024, 2752, 2752, 1024, 1024]
    - [0, 8.721]
  - - [2880, 704, 1, 1024, 2880, 2880, 1024, 1024]
    - [0, 8.782]
  - - [3008, 704, 1, 1024, 3008, 3008, 1024, 1024]
    - [0, 8.827]
  - - [3136, 704, 1, 1024, 3136, 3136, 1024, 1024]
    - [0, 8.8]
  - - [3264, 704, 1, 1024, 3264, 3264, 1024, 1024]
    - [0, 8.8]
  - - [3392, 704, 1, 1024, 3392, 3392, 1024, 1024]
    - [0, 8.817]
  - - [3520, 704, 1, 1024, 3520, 3520, 1024, 1024]
    - [0, 8.837]
  - - [3648, 704, 1, 1024, 3648, 3648, 1024, 1024]
    - [0, 8.961]
  - - [3776, 704, 1, 1024, 3776, 3776, 1024, 1024]
    - [0, 8.931]
  - - [3904, 704, 1, 1024, 3904, 3904, 1024, 1024]
    - [0, 8.906]
  - - [4032, 704, 1, 1024, 4032, 4032, 1024, 1024]
    - [0, 8.899]
  - - [64, 832, 1, 1024, 64, 64, 1024, 1024]
    - [0, 3.791]
  - - [192, 832, 1, 1024, 192, 192, 1024, 1024]
    - [0, 6.279]
  - - [320, 832, 1, 1024, 320, 320, 1024, 1024]
    - [0, 7.56]
  - - [448, 832, 1, 1024, 448, 448, 1024, 1024]
    - [0, 7.961]
  - - [576, 832, 1, 1024, 576, 576, 1024, 1024]
    - [0, 8.346]
  - - [704, 832, 1, 1024, 704, 704, 1024, 1024]
    - [0, 8.411]
  - - [832, 832, 1, 1024, 832, 832, 1024, 1024]
    - [0, 8.207]
  - - [960, 832, 1, 1024, 960, 960, 1024, 1024]
    - [0, 8.303]
  - - [1088, 832, 1, 1024, 1088, 1088, 1024, 1024]
    - [0, 8.383]
  - - [1216, 832, 1, 1024, 1216, 1216, 1024, 1024]
    - [0, 8.503]
  - - [1344, 832, 1, 1024, 1344, 1344, 1024, 1024]
    - [0, 8.503]
  - - [1472, 832, 1, 1024, 1472, 1472, 1024, 1024]
    - [0, 8.642]
  - - [1600, 832, 1, 1024, 1600, 1600, 1024, 1024]
    - [0, 8.46]
  - - [1728, 832, 1, 1024, 1728, 1728, 1024, 1024]
    - [0, 8.613]
  - - [1856, 832, 1, 1024, 1856, 1856, 1024, 1024]
    - [0, 8.599]
  - - [1984, 832, 1, 1024, 1984, 1984, 1024, 1024]
    - [0, 8.606]
  - - [2112, 832, 1, 1024, 2112, 2112, 1024, 1024]
    - [0, 8.601]
  - - [2240, 832, 1, 1024, 2240, 2240, 1024, 1024]
    - [0, 8.725]
  - - [2368, 832, 1, 1024, 2368, 2368, 1024, 1024]
    - [0, 8.824]
  - - [2496, 832, 1, 1024, 2496, 2496, 1024, 1024]
    - [0, 8.694]
  - - [2624, 832, 1, 1024, 2624, 2624, 1024, 1024]
    - [0, 8.645]
  - - [2752, 832, 1, 1024, 2752, 2752, 1024, 1024]
    - [0, 8.725]
  - - [2880, 832, 1, 1024, 2880, 2880, 1024, 1024]
    - [0, 8.884]
  - - [3008, 832, 1, 1024, 3008, 3008, 1024, 1024]
    - [0, 8.874]
  - - [3136, 832, 1, 1024, 3136, 3136, 1024, 1024]
    - [0, 8.914]
  - - [3264, 832, 1, 1024, 3264, 3264, 1024, 1024]
    - [0, 8.827]
  - - [3392, 832, 1, 1024, 3392, 3392, 1024, 1024]
    - [0, 8.867]
  - - [3520, 832, 1, 1024, 3520, 3520, 1024, 1024]
    - [0, 8.91]
  - - [3648, 832, 1, 1024, 3648, 3648, 1024, 1024]
    - [0, 8.92]
  - - [3776, 832, 1, 1024, 3776, 3776, 1024, 1024]
    - [0, 8.929]
  - - [3904, 832, 1, 1024, 3904, 3904, 1024, 1024]
    - [0, 8.92]
  - - [4032, 832, 1, 1024, 4032, 4032, 1024, 1024]
    - [0, 8.929]
  - - [64, 960, 1, 1024, 64, 64, 1024, 1024]
    - [0, 4.359]
  - - [192, 960, 1, 1024, 192, 192, 1024, 1024]
    - [0, 7.244]
  - - [320, 960, 1, 1024, 320, 320, 1024, 1024]
    - [0, 7.623]
  - - [448, 960, 1, 1024, 448, 448, 1024, 1024]
    - [0, 8.305]
  - - [576, 960, 1, 1024, 576, 576, 1024, 1024]
    - [0, 7.962]
  - - [704, 960, 1, 1024, 704, 704, 1024, 1024]
    - [0, 8.449]
  - - [832, 960, 1, 1024, 832, 832, 1024, 1024]
    - [0, 8.29]
  - - [960, 960, 1, 1024, 960, 960, 1024, 1024]
    - [0, 8.503]
  - - [1088, 960, 1, 1024, 1088, 1088, 1024, 1024]
    - [0, 8.471]
  - - [1216, 960, 1, 1024, 1216, 1216, 1024, 1024]
    - [0, 8.664]
  - - [1344, 960, 1, 1024, 1344, 1344, 1024, 1024]
    - [0, 8.496]
  - - [1472, 960, 1, 1024, 1472, 1472, 1024, 1024]
    - [0, 8.704]
  - - [1600, 960, 1, 1024, 1600, 1600, 1024, 1024]
    - [0, 8.637]
  - - [1728, 960, 1, 1024, 1728, 1728, 1024, 1024]
    - [0, 8.737]
  - - [1856, 960, 1, 1024, 1856, 1856, 1024, 1024]
    - [0, 8.704]
  - - [1984, 960, 1, 1024, 1984, 1984, 1024, 1024]
    - [0, 8.789]
  - - [2112, 960, 1, 1024, 2112, 2112, 1024, 1024]
    - [0, 8.7]
  - - [2240, 960, 1, 1024, 2240, 2240, 1024, 1024]
    - [0, 8.805]
  - - [2368, 960, 1, 1024, 2368, 2368, 1024, 1024]
    - [0, 8.901]
  - - [2496, 960, 1, 1024, 2496, 2496, 1024, 1024]
    - [0, 8.867]
  - - [2624, 960, 1, 1024, 2624, 2624, 1024, 1024]
    - [0, 8.852]
  - - [2752, 960, 1, 1024, 2752, 2752, 1024, 1024]
    - [0, 8.888]
  - - [2880, 960, 1, 1024, 2880, 2880, 1024, 1024]
    - [0, 8.896]
  - - [3008, 960, 1, 1024, 3008, 3008, 1024, 1024]
    - [0, 8.931]
  - - [3136, 960, 1, 1024, 3136, 3136, 1024, 1024]
    - [0, 8.89]
  - - [3264, 960, 1, 1024, 3264, 3264, 1024, 1024]
    - [0, 8.929]
  - - [3392, 960, 1, 1024, 3392, 3392, 1024, 1024]
    - [0, 8.935]
  - - [3520, 960, 1, 1024, 3520, 3520, 1024, 1024]
    - [0, 8.967]
  - - [3648, 960, 1, 1024, 3648, 3648, 1024, 1024]
    - [0, 8.932]
  - - [3776, 960, 1, 1024, 3776, 3776, 1024, 1024]
    - [0, 8.99]
  - - [3904, 960, 1, 1024, 3904, 3904, 1024, 1024]
    - [0, 9.062]
  - - [4032, 960, 1, 1024, 4032, 4032, 1024, 1024]
    - [0, 8.992]
  - - [64, 1088, 1, 1024, 64, 64, 1024, 1024]
    - [0, 4.925]
  - - [192, 1088, 1, 1024, 192, 192, 1024, 1024]
    - [0, 6.91]
  - - [320, 1088, 1, 1024, 320, 320, 1024, 1024]
    - [0, 7.5]
  - - [448, 1088, 1, 1024, 448, 448, 1024, 1024]
    - [0, 8.275]
  - - [576, 1088, 1, 1024, 576, 576, 1024, 1024]
    - [0, 8.343]
  - - [704, 1088, 1, 1024, 704, 704, 1024, 1024]
    - [0, 8.362]
  - - [832, 1088, 1, 1024, 832, 832, 1024, 1024]
    - [0, 8.322]
  - - [960, 1088, 1, 1024, 960, 960, 1024, 1024]
    - [0, 8.457]
  - - [1088, 1088, 1, 1024, 1088, 1088, 1024, 1024]
    - [0, 8.45]
  - - [1216, 1088, 1, 1024, 1216, 1216, 1024, 1024]
    - [0, 8.547]
  - - [1344, 1088, 1, 1024, 1344, 1344, 1024, 1024]
    - [0, 8.684]
  - - [1472, 1088, 1, 1024, 1472, 1472, 1024, 1024]
    - [0, 8.672]
  - - [1600, 1088, 1, 1024, 1600, 1600, 1024, 1024]
    - [0, 8.696]
  - - [1728, 1088, 1, 1024, 1728, 1728, 1024, 1024]
    - [0, 8.692]
  - - [1856, 1088, 1, 1024, 1856, 1856, 1024, 1024]
    - [0, 8.85]
  - - [1984, 1088, 1, 1024, 1984, 1984, 1024, 1024]
    - [0, 8.828]
  - - [2112, 1088, 1, 1024, 2112, 2112, 1024, 1024]
    - [0, 8.846]
  - - [2240, 1088, 1, 1024, 2240, 2240, 1024, 1024]
    - [0, 8.871]
  - - [2368, 1088, 1, 1024, 2368, 2368, 1024, 1024]
    - [0, 8.571]
  - - [2496, 1088, 1, 1024, 2496, 2496, 1024, 1024]
    - [0, 8.863]
  - - [2624, 1088, 1, 1024, 2624, 2624, 1024, 1024]
    - [0, 8.958]
  - - [2752, 1088, 1, 1024, 2752, 2752, 1024, 1024]
    - [0, 8.964]
  - - [2880, 1088, 1, 1024, 2880, 2880, 1024, 1024]
    - [0, 8.943]
  - - [3008, 1088, 1, 1024, 3008, 3008, 1024, 1024]
    - [0, 8.938]
  - - [3136, 1088, 1, 1024, 3136, 3136, 1024, 1024]
    - [0, 9.015]
  - - [3264, 1088, 1, 1024, 3264, 3264, 1024, 1024]
    - [0, 9.04]
  - - [3392, 1088, 1, 1024, 3392, 3392, 1024, 1024]
    - [0, 9.016]
  - - [3520, 1088, 1, 1024, 3520, 3520, 1024, 1024]
    - [0, 9.049]
  - - [3648, 1088, 1, 1024, 3648, 3648, 1024, 1024]
    - [0, 9.024]
  - - [3776, 1088, 1, 1024, 3776, 3776, 1024, 1024]
    - [0, 9.018]
  - - [3904, 1088, 1, 1024, 3904, 3904, 1024, 1024]
    - [0, 9.075]
  - - [4032, 1088, 1, 1024, 4032, 4032, 1024, 1024]
    - [0, 9.101]
  - - [64, 1216, 1, 1024, 64, 64, 1024, 1024]
    - [0, 5.478]
  - - [192, 1216, 1, 1024, 192, 192, 1024, 1024]
    - [0, 7.936]
  - - [320, 1216, 1, 1024, 320, 320, 1024, 1024]
    - [0, 8.135]
  - - [448, 1216, 1, 1024, 448, 448, 1024, 1024]
    - [0, 7.968]
  - - [576, 1216, 1, 1024, 576, 576, 1024, 1024]
    - [0, 8.266]
  - - [704, 1216, 1, 1024, 704, 704, 1024, 1024]
    - [0, 8.288]
  - - [832, 1216, 1, 1024, 832, 832, 1024, 1024]
    - [0, 8.545]
  - - [960, 1216, 1, 1024, 960, 960, 1024, 1024]
    - [0, 8.603]
  - - [1088, 1216, 1, 1024, 1088, 1088, 1024, 1024]
    - [0, 8.69]
  - - [1216, 1216, 1, 1024, 1216, 1216, 1024, 1024]
    - [0, 8.661]
  - - [1344, 1216, 1, 1024, 1344, 1344, 1024, 1024]
    - [0, 8.75]
  - - [1472, 1216, 1, 1024, 1472, 1472, 1024, 1024]
    - [0, 8.746]
  - - [1600, 1216, 1, 1024, 1600, 1600, 1024, 1024]
    - [0, 8.725]
  - - [1728, 1216, 1, 1024, 1728, 1728, 1024, 1024]
    - [0, 8.803]
  - - [1856, 1216, 1, 1024, 1856, 1856, 1024, 1024]
    - [0, 8.858]
  - - [1984, 1216, 1, 1024, 1984, 1984, 1024, 1024]
    - [0, 8.857]
  - - [2112, 1216, 1, 1024, 2112, 2112, 1024, 1024]
    - [0, 8.864]
  - - [2240, 1216, 1, 1024, 2240, 2240, 1024, 1024]
    - [0, 8.82]
  - - [2368, 1216, 1, 1024, 2368, 2368, 1024, 1024]
    - [0, 8.896]
  - - [2496, 1216, 1, 1024, 2496, 2496, 1024, 1024]
    - [0, 8.924]
  - - [2624, 1216, 1, 1024, 2624, 2624, 1024, 1024]
    - [0, 8.933]
  - - [2752, 1216, 1, 1024, 2752, 2752, 1024, 1024]
    - [0, 8.912]
  - - [2880, 1216, 1, 1024, 2880, 2880, 1024, 1024]
    - [0, 8.954]
  - - [3008, 1216, 1, 1024, 3008, 3008, 1024, 1024]
    - [0, 8.94]
  - - [3136, 1216, 1, 1024, 3136, 3136, 1024, 1024]
    - [0, 8.975]
  - - [3264, 1216, 1, 1024, 3264, 3264, 1024, 1024]
    - [0, 9.031]
  - - [3392, 1216, 1, 1024, 3392, 3392, 1024, 1024]
    - [0, 9.03]
  - - [3520, 1216, 1, 1024, 3520, 3520, 1024, 1024]
    - [0, 9.072]
  - - [3648, 1216, 1, 1024, 3648, 3648, 1024, 1024]
    - [0, 9.116]
  - - [3776, 1216, 1, 1024, 3776, 3776, 1024, 1024]
    - [0, 9.12]
  - - [3904, 1216, 1, 1024, 3904, 3904, 1024, 1024]
    - [0, 9.148]
  - - [4032, 1216, 1, 1024, 4032, 4032, 1024, 1024]
    - [0, 9.126]
  - - [64, 1344, 1, 1024, 64, 64, 1024, 1024]
    - [0, 6.06]
  - - [192, 1344, 1, 1024, 192, 192, 1024, 1024]
    - [0, 7.405]
  - - [320, 1344, 1, 1024, 320, 320, 1024, 1024]
    - [0, 8.103]
  - - [448, 1344, 1, 1024, 448, 448, 1024, 1024]
    - [0, 8.072]
  - - [576, 1344, 1, 1024, 576, 576, 1024, 1024]
    - [0, 8.453]
  - - [704, 1344, 1, 1024, 704, 704, 1024, 1024]
    - [0, 8.273]
  - - [832, 1344, 1, 1024, 832, 832, 1024, 1024]
    - [0, 8.538]
  - - [960, 1344, 1, 1024, 960, 960, 1024, 1024]
    - [0, 8.538]
  - - [1088, 1344, 1, 1024, 1088, 1088, 1024, 1024]
    - [0, 8.56]
  - - [1216, 1344, 1, 1024, 1216, 1216, 1024, 1024]
    - [0, 8.533]
  - - [1344, 1344, 1, 1024, 1344, 1344, 1024, 1024]
    - [0, 8.771]
  - - [1472, 1344, 1, 1024, 1472, 1472, 1024, 1024]
    - [0, 8.656]
  - - [1600, 1344, 1, 1024, 1600, 1600, 1024, 1024]
    - [0, 8.7]
  - - [1728, 1344, 1, 1024, 1728, 1728, 1024, 1024]
    - [0, 8.656]
  - - [1856, 1344, 1, 1024, 1856, 1856, 1024, 1024]
    - [0, 8.83]
  - - [1984, 1344, 1, 1024, 1984, 1984, 1024, 1024]
    - [0, 8.796]
  - - [2112, 1344, 1, 1024, 2112, 2112, 1024, 1024]
    - [0, 8.86]
  - - [2240, 1344, 1, 1024, 2240, 2240, 1024, 1024]
    - [0, 8.855]
  - - [2368, 1344, 1, 1024, 2368, 2368, 1024, 1024]
    - [0, 8.918]
  - - [2496, 1344, 1, 1024, 2496, 2496, 1024, 1024]
    - [0, 8.909]
  - - [2624, 1344, 1, 1024, 2624, 2624, 1024, 1024]
    - [0, 8.965]
  - - [2752, 1344, 1, 1024, 2752, 2752, 1024, 1024]
    - [0, 8.911]
  - - [2880, 1344, 1, 1024, 2880, 2880, 1024, 1024]
    - [0, 8.988]
  - - [3008, 1344, 1, 1024, 3008, 3008, 1024, 1024]
    - [0, 8.978]
  - - [3136, 1344, 1, 1024, 3136, 3136, 1024, 1024]
    - [0, 9.005]
  - - [3264, 1344, 1, 1024, 3264, 3264, 1024, 1024]
    - [0, 8.989]
  - - [3392, 1344, 1, 1024, 3392, 3392, 1024, 1024]
    - [0, 9.046]
  - - [3520, 1344, 1, 1024, 3520, 3520, 1024, 1024]
    - [0, 9.056]
  - - [3648, 1344, 1, 1024, 3648, 3648, 1024, 1024]
    - [0, 9.142]
  - - [3776, 1344, 1, 1024, 3776, 3776, 1024, 1024]
    - [0, 9.186]
  - - [3904, 1344, 1, 1024, 3904, 3904, 1024, 1024]
    - [0, 9.207]
  - - [4032, 1344, 1, 1024, 4032, 4032, 1024, 1024]
    - [0, 9.172]
  - - [64, 1472, 1, 1024, 64, 64, 1024, 1024]
    - [0, 6.623]
  - - [192, 1472, 1, 1024, 192, 192, 1024, 1024]
    - [0, 8.09]
  - - [320, 1472, 1, 1024, 320, 320, 1024, 1024]
    - [0, 8.258]
  - - [448, 1472, 1, 1024, 448, 448, 1024, 1024]
    - [0, 8.217]
  - - [576, 1472, 1, 1024, 576, 576, 1024, 1024]
    - [0, 8.324]
  - - [704, 1472, 1, 1024, 704, 704, 1024, 1024]
    - [0, 8.464]
  - - [832, 1472, 1, 1024, 832, 832, 1024, 1024]
    - [0, 8.659]
  - - [960, 1472, 1, 1024, 960, 960, 1024, 1024]
    - [0, 8.668]
  - - [1088, 1472, 1, 1024, 1088, 1088, 1024, 1024]
    - [0, 8.699]
  - - [1216, 1472, 1, 1024, 1216, 1216, 1024, 1024]
    - [0, 8.691]
  - - [1344, 1472, 1, 1024, 1344, 1344, 1024, 1024]
    - [0, 8.72]
  - - [1472, 1472, 1, 1024, 1472, 1472, 1024, 1024]
    - [0, 8.814]
  - - [1600, 1472, 1, 1024, 1600, 1600, 1024, 1024]
    - [0, 8.843]
  - - [1728, 1472, 1, 1024, 1728, 1728, 1024, 1024]
    - [0, 8.835]
  - - [1856, 1472, 1, 1024, 1856, 1856, 1024, 1024]
    - [0, 8.818]
  - - [1984, 1472, 1, 1024, 1984, 1984, 1024, 1024]
    - [0, 8.848]
  - - [2112, 1472, 1, 1024, 2112, 2112, 1024, 1024]
    - [0, 8.864]
  - - [2240, 1472, 1, 1024, 2240, 2240, 1024, 1024]
    - [0, 8.8]
  - - [2368, 1472, 1, 1024, 2368, 2368, 1024, 1024]
    - [0, 8.869]
  - - [2496, 1472, 1, 1024, 2496, 2496, 1024, 1024]
    - [0, 8.979]
  - - [2624, 1472, 1, 1024, 2624, 2624, 1024, 1024]
    - [0, 8.982]
  - - [2752, 1472, 1, 1024, 2752, 2752, 1024, 1024]
    - [0, 8.979]
  - - [2880, 1472, 1, 1024, 2880, 2880, 1024, 1024]
    - [0, 8.997]
  - - [3008, 1472, 1, 1024, 3008, 3008, 1024, 1024]
    - [0, 9.061]
  - - [3136, 1472, 1, 1024, 3136, 3136, 1024, 1024]
    - [0, 9.176]
  - - [3264, 1472, 1, 1024, 3264, 3264, 1024, 1024]
    - [0, 9.083]
  - - [3392, 1472, 1, 1024, 3392, 3392, 1024, 1024]
    - [0, 9.118]
  - - [3520, 1472, 1, 1024, 3520, 3520, 1024, 1024]
    - [0, 9.157]
  - - [3648, 1472, 1, 1024, 3648, 3648, 1024, 1024]
    - [0, 9.151]
  - - [3776, 1472, 1, 1024, 3776, 3776, 1024, 1024]
    - [0, 9.16]
  - - [3904, 1472, 1, 1024, 3904, 3904, 1024, 1024]
    - [0, 9.171]
  - - [4032, 1472, 1, 1024, 4032, 4032, 1024, 1024]
    - [0, 9.22]
  - - [64, 1600, 1, 1024, 64, 64, 1024, 1024]
    - [0, 5.171]
  - - [192, 1600, 1, 1024, 192, 192, 1024, 1024]
    - [0, 7.594]
  - - [320, 1600, 1, 1024, 320, 320, 1024, 1024]
    - [0, 8.023]
  - - [448, 1600, 1, 1024, 448, 448, 1024, 1024]
    - [0, 8.347]
  - - [576, 1600, 1, 1024, 576, 576, 1024, 1024]
    - [0, 8.554]
  - - [704, 1600, 1, 1024, 704, 704, 1024, 1024]
    - [0, 8.62]
  - - [832, 1600, 1, 1024, 832, 832, 1024, 1024]
    - [0, 8.738]
  - - [960, 1600, 1, 1024, 960, 960, 1024, 1024]
    - [0, 8.592]
  - - [1088, 1600, 1, 1024, 1088, 1088, 1024, 1024]
    - [0, 8.686]
  - - [1216, 1600, 1, 1024, 1216, 1216, 1024, 1024]
    - [0, 8.738]
  - - [1344, 1600, 1, 1024, 1344, 1344, 1024, 1024]
    - [0, 8.788]
  - - [1472, 1600, 1, 1024, 1472, 1472, 1024, 1024]
    - [0, 8.703]
  - - [1600, 1600, 1, 1024, 1600, 1600, 1024, 1024]
    - [0, 8.806]
  - - [1728, 1600, 1, 1024, 1728, 1728, 1024, 1024]
    - [0, 8.607]
  - - [1856, 1600, 1, 1024, 1856, 1856, 1024, 1024]
    - [0, 8.751]
  - - [1984, 1600, 1, 1024, 1984, 1984, 1024, 1024]
    - [0, 8.928]
  - - [2112, 1600, 1, 1024, 2112, 2112, 1024, 1024]
    - [0, 8.962]
  - - [2240, 1600, 1, 1024, 2240, 2240, 1024, 1024]
    - [0, 8.966]
  - - [2368, 1600, 1, 1024, 2368, 2368, 1024, 1024]
    - [0, 8.952]
  - - [2496, 1600, 1, 1024, 2496, 2496, 1024, 1024]
    - [0, 8.974]
  - - [2624, 1600, 1, 1024, 2624, 2624, 1024, 1024]
    - [0, 9.026]
  - - [2752, 1600, 1, 1024, 2752, 2752, 1024, 1024]
    - [0, 9.05]
  - - [2880, 1600, 1, 1024, 2880, 2880, 1024, 1024]
    - [0, 9.085]
  - - [3008, 1600, 1, 1024, 3008, 3008, 1024, 1024]
    - [0, 9.039]
  - - [3136, 1600, 1, 1024, 3136, 3136, 1024, 1024]
    - [0, 9.134]
  - - [3264, 1600, 1, 1024, 3264, 3264, 1024, 1024]
    - [0, 9.147]
  - - [3392, 1600, 1, 1024, 3392, 3392, 1024, 1024]
    - [0, 9.121]
  - - [3520, 1600, 1, 1024, 3520, 3520, 1024, 1024]
    - [0, 9.203]
  - - [3648, 1600, 1, 1024, 3648, 3648, 1024, 1024]
    - [0, 9.171]
  - - [3776, 1600, 1, 1024, 3776, 3776, 1024, 1024]
    - [0, 9.213]
  - - [3904, 1600, 1, 1024, 3904, 3904, 1024, 1024]
    - [0, 9.258]
  - - [4032, 1600, 1, 1024, 4032, 4032, 1024, 1024]
    - [0, 9.296]
  - - [64, 1728, 1, 1024, 64, 64, 1024, 1024]
    - [0, 5.569]
  - - [192, 1728, 1, 1024, 192, 192, 1024, 1024]
    - [0, 8.067]
  - - [320, 1728, 1, 1024, 320, 320, 1024, 1024]
    - [0, 7.944]
  - - [448, 1728, 1, 1024, 448, 448, 1024, 1024]
    - [0, 8.461]
  - - [576, 1728, 1, 1024, 576, 576, 1024, 1024]
    - [0, 8.44]
  - - [704, 1728, 1, 1024, 704, 704, 1024, 1024]
    - [0, 8.668]
  - - [832, 1728, 1, 1024, 832, 832, 1024, 1024]
    - [0, 8.548]
  - - [960, 1728, 1, 1024, 960, 960, 1024, 1024]
    - [0, 8.726]
  - - [1088, 1728, 1, 1024, 1088, 1088, 1024, 1024]
    - [0, 8.549]
  - - [1216, 1728, 1, 1024, 1216, 1216, 1024, 1024]
    - [0, 8.792]
  - - [1344, 1728, 1, 1024, 1344, 1344, 1024, 1024]
    - [0, 8.729]
  - - [1472, 1728, 1, 1024, 1472, 1472, 1024, 1024]
    - [0, 8.83]
  - - [1600, 1728, 1, 1024, 1600, 1600, 1024, 1024]
    - [0, 8.823]
  - - [1728, 1728, 1, 1024, 1728, 1728, 1024, 1024]
    - [0, 8.904]
  - - [1856, 1728, 1, 1024, 1856, 1856, 1024, 1024]
    - [0, 8.887]
  - - [1984, 1728, 1, 1024, 1984, 1984, 1024, 1024]
    - [0, 8.96]
  - - [2112, 1728, 1, 1024, 2112, 2112, 1024, 1024]
    - [0, 8.793]
  - - [2240, 1728, 1, 1024, 2240, 2240, 1024, 1024]
    - [0, 8.991]
  - - [2368, 1728, 1, 1024, 2368, 2368, 1024, 1024]
    - [0, 9.039]
  - - [2496, 1728, 1, 1024, 2496, 2496, 1024, 1024]
    - [0, 9.122]
  - - [2624, 1728, 1, 1024, 2624, 2624, 1024, 1024]
    - [0, 9.08]
  - - [2752, 1728, 1, 1024, 2752, 2752, 1024, 1024]
    - [0, 9.137]
  - - [2880, 1728, 1, 1024, 2880, 2880, 1024, 1024]
    - [0, 9.144]
  - - [3008, 1728, 1, 1024, 3008, 3008, 1024, 1024]
    - [0, 9.114]
  - - [3136, 1728, 1, 1024, 3136, 3136, 1024, 1024]
    - [0, 9.131]
  - - [3264, 1728, 1, 1024, 3264, 3264, 1024, 1024]
    - [0, 9.228]
  - - [3392, 1728, 1, 1024, 3392, 3392, 1024, 1024]
    - [0, 9.235]
  - - [3520, 1728, 1, 1024, 3520, 3520, 1024, 1024]
    - [0, 9.204]
  - - [3648, 1728, 1, 1024, 3648, 3648, 1024, 1024]
    - [0, 9.277]
  - - [3776, 1728, 1, 1024, 3776, 3776, 1024, 1024]
    - [0, 9.268]
  - - [3904, 1728, 1, 1024, 3904, 3904, 1024, 1024]
    - [0, 9.318]
  - - [4032, 1728, 1, 1024, 4032, 4032, 1024, 1024]
    - [0, 9.301]
  - - [64, 1856, 1, 1024, 64, 64, 1024, 1024]
    - [0, 5.989]
  - - [192, 1856, 1, 1024, 192, 192, 1024, 1024]
    - [0, 7.623]
  - - [320, 1856, 1, 1024, 320, 320, 1024, 1024]
    - [0, 8.228]
  - - [448, 1856, 1, 1024, 448, 448, 1024, 1024]
    - [0, 8.577]
  - - [576, 1856, 1, 1024, 576, 576, 1024, 1024]
    - [0, 8.634]
  - - [704, 1856, 1, 1024, 704, 704, 1024, 1024]
    - [0, 8.538]
  - - [832, 1856, 1, 1024, 832, 832, 1024, 1024]
    - [0, 8.586]
  - - [960, 1856, 1, 1024, 960, 960, 1024, 1024]
    - [0, 8.635]
  - - [1088, 1856, 1, 1024, 1088, 1088, 1024, 1024]
    - [0, 8.813]
  - - [1216, 1856, 1, 1024, 1216, 1216, 1024, 1024]
    - [0, 8.813]
  - - [1344, 1856, 1, 1024, 1344, 1344, 1024, 1024]
    - [0, 8.822]
  - - [1472, 1856, 1, 1024, 1472, 1472, 1024, 1024]
    - [0, 8.838]
  - - [1600, 1856, 1, 1024, 1600, 1600, 1024, 1024]
    - [0, 8.928]
  - - [1728, 1856, 1, 1024, 1728, 1728, 1024, 1024]
    - [0, 8.883]
  - - [1856, 1856, 1, 1024, 1856, 1856, 1024, 1024]
    - [0, 8.99]
  - - [1984, 1856, 1, 1024, 1984, 1984, 1024, 1024]
    - [0, 8.958]
  - - [2112, 1856, 1, 1024, 2112, 2112, 1024, 1024]
    - [3, 7.457]
  - - [2240, 1856, 1, 1024, 2240, 2240, 1024, 1024]
    - [0, 8.991]
  - - [2368, 1856, 1, 1024, 2368, 2368, 1024, 1024]
    - [0, 9.017]
  - - [2496, 1856, 1, 1024, 2496, 2496, 1024, 1024]
    - [0, 9.06]
  - - [2624, 1856, 1, 1024, 2624, 2624, 1024, 1024]
    - [0, 9.076]
  - - [2752, 1856, 1, 1024, 2752, 2752, 1024, 1024]
    - [0, 9.103]
  - - [2880, 1856, 1, 1024, 2880, 2880, 1024, 1024]
    - [0, 9.188]
  - - [3008, 1856, 1, 1024, 3008, 3008, 1024, 1024]
    - [0, 9.185]
  - - [3136, 1856, 1, 1024, 3136, 3136, 1024, 1024]
    - [0, 9.268]
  - - [3264, 1856, 1, 1024, 3264, 3264, 1024, 1024]
    - [0, 9.228]
  - - [3392, 1856, 1, 1024, 3392, 3392, 1024, 1024]
    - [0, 9.258]
  - - [3520, 1856, 1, 1024, 3520, 3520, 1024, 1024]
    - [0, 9.324]
  - - [3648, 1856, 1, 1024, 3648, 3648, 1024, 1024]
    - [0, 9.295]
  - - [3776, 1856, 1, 1024, 3776, 3776, 1024, 1024]
    - [0, 9.301]
  - - [3904, 1856, 1, 1024, 3904, 3904, 1024, 1024]
    - [0, 9.373]
  - - [4032, 1856, 1, 1024, 4032, 4032, 1024, 1024]
    - [0, 9.387]
  - - [64, 1984, 1, 1024, 64, 64, 1024, 1024]
    - [0, 6.369]
  - - [192, 1984, 1, 1024, 192, 192, 1024, 1024]
    - [0, 8.128]
  - - [320, 1984, 1, 1024, 320, 320, 1024, 1024]
    - [0, 8.493]
  - - [448, 1984, 1, 1024, 448, 448, 1024, 1024]
    - [0, 8.393]
  - - [576, 1984, 1, 1024, 576, 576, 1024, 1024]
    - [0, 8.451]
  - - [704, 1984, 1, 1024, 704, 704, 1024, 1024]
    - [0, 8.619]
  - - [832, 1984, 1, 1024, 832, 832, 1024, 1024]
    - [0, 8.652]
  - - [960, 1984, 1, 1024, 960, 960, 1024, 1024]
    - [0, 8.744]
  - - [1088, 1984, 1, 1024, 1088, 1088, 1024, 1024]
    - [0, 8.845]
  - - [1216, 1984, 1, 1024, 1216, 1216, 1024, 1024]
    - [0, 8.818]
  - - [1344, 1984, 1, 1024, 1344, 1344, 1024, 1024]
    - [0, 8.912]
  - - [1472, 1984, 1, 1024, 1472, 1472, 1024, 1024]
    - [0, 8.875]
  - - [1600, 1984, 1, 1024, 1600, 1600, 1024, 1024]
    - [0, 8.91]
  - - [1728, 1984, 1, 1024, 1728, 1728, 1024, 1024]
    - [0, 8.987]
  - - [1856, 1984, 1, 1024, 1856, 1856, 1024, 1024]
    - [0, 8.995]
  - - [1984, 1984, 1, 1024, 1984, 1984, 1024, 1024]
    - [0, 9.074]
  - - [2112, 1984, 1, 1024, 2112, 2112, 1024, 1024]
    - [0, 9.096]
  - - [2240, 1984, 1, 1024, 2240, 2240, 1024, 1024]
    - [0, 8.974]
  - - [2368, 1984, 1, 1024, 2368, 2368, 1024, 1024]
    - [0, 9.057]
  - - [2496, 1984, 1, 1024, 2496, 2496, 1024, 1024]
    - [0, 9.141]
  - - [2624, 1984, 1, 1024, 2624, 2624, 1024, 1024]
    - [0, 9.152]
  - - [2752, 1984, 1, 1024, 2752, 2752, 1024, 1024]
    - [0, 9.21]
  - - [2880, 1984, 1, 1024, 2880, 2880, 1024, 1024]
    - [0, 9.187]
  - - [3008, 1984, 1, 1024, 3008, 3008, 1024, 1024]
    - [0, 9.231]
  - - [3136, 1984, 1, 1024, 3136, 3136, 1024, 1024]
    - [0, 9.285]
  - - [3264, 1984, 1, 1024, 3264, 3264, 1024, 1024]
    - [0, 9.24]
  - - [3392, 1984, 1, 1024, 3392, 3392, 1024, 1024]
    - [0, 9.299]
  - - [3520, 1984, 1, 1024, 3520, 3520, 1024, 1024]
    - [0, 9.297]
  - - [3648, 1984, 1, 1024, 3648, 3648, 1024, 1024]
    - [0, 9.3]
  - - [3776, 1984, 1, 1024, 3776, 3776, 1024, 1024]
    - [0, 9.306]
  - - [3904, 1984, 1, 1024, 3904, 3904, 1024, 1024]
    - [0, 9.287]
  - - [4032, 1984, 1, 1024, 4032, 4032, 1024, 1024]
    - [0, 9.366]
  - - [64, 2112, 1, 1024, 64, 64, 1024, 1024]
    - [0, 6.757]
  - - [192, 2112, 1, 1024, 192, 192, 1024, 1024]
    - [0, 7.836]
  - - [320, 2112, 1, 1024, 320, 320, 1024, 1024]
    - [0, 8.424]
  - - [448, 2112, 1, 1024, 448, 448, 1024, 1024]
    - [0, 8.394]
  - - [576, 2112, 1, 1024, 576, 576, 1024, 1024]
    - [0, 8.637]
  - - [704, 2112, 1, 1024, 704, 704, 1024, 1024]
    - [0, 8.584]
  - - [832, 2112, 1, 1024, 832, 832, 1024, 1024]
    - [0, 8.763]
  - - [960, 2112, 1, 1024, 960, 960, 1024, 1024]
    - [0, 8.872]
  - - [1088, 2112, 1, 1024, 1088, 1088, 1024, 1024]
    - [0, 8.824]
  - - [1216, 2112, 1, 1024, 1216, 1216, 1024, 1024]
    - [0, 8.924]
  - - [1344, 2112, 1, 1024, 1344, 1344, 1024, 1024]
    - [0, 8.896]
  - - [1472, 2112, 1, 1024, 1472, 1472, 1024, 1024]
    - [0, 8.87]
  - - [1600, 2112, 1, 1024, 1600, 1600, 1024, 1024]
    - [0, 8.966]
  - - [1728, 2112, 1, 1024, 1728, 1728, 1024, 1024]
    - [0, 9.039]
  - - [1856, 2112, 1, 1024, 1856, 1856, 1024, 1024]
    - [0, 9.003]
  - - [1984, 2112, 1, 1024, 1984, 1984, 1024, 1024]
    - [0, 9.009]
  - - [2112, 2112, 1, 1024, 2112, 2112, 1024, 1024]
    - [0, 9.043]
  - - [2240, 2112, 1, 1024, 2240, 2240, 1024, 1024]
    - [0, 9.062]
  - - [2368, 2112, 1, 1024, 2368, 2368, 1024, 1024]
    - [0, 9.115]
  - - [2496, 2112, 1, 1024, 2496, 2496, 1024, 1024]
    - [0, 9.125]
  - - [2624, 2112, 1, 1024, 2624, 2624, 1024, 1024]
    - [0, 9.217]
  - - [2752, 2112, 1, 1024, 2752, 2752, 1024, 1024]
    - [0, 9.207]
  - - [2880, 2112, 1, 1024, 2880, 2880, 1024, 1024]
    - [0, 9.255]
  - - [3008, 2112, 1, 1024, 3008, 3008, 1024, 1024]
    - [0, 9.3]
  - - [3136, 2112, 1, 1024, 3136, 3136, 1024, 1024]
    - [0, 9.26]
  - - [3264, 2112, 1, 1024, 3264, 3264, 1024, 1024]
    - [0, 9.295]
  - - [3392, 2112, 1, 1024, 3392, 3392, 1024, 1024]
    - [0, 9.28]
  - - [3520, 2112, 1, 1024, 3520, 3520, 1024, 1024]
    - [0, 9.411]
  - - [3648, 2112, 1, 1024, 3648, 3648, 1024, 1024]
    - [0, 9.376]
  - - [3776, 2112, 1, 1024, 3776, 3776, 1024, 1024]
    - [0, 9.252]
  - - [3904, 2112, 1, 1024, 3904, 3904, 1024, 1024]
    - [0, 9.211]
  - - [4032, 2112, 1, 1024, 4032, 4032, 1024, 1024]
    - [0, 9.178]
  - - [64, 2240, 1, 1024, 64, 64, 1024, 1024]
    - [0, 7.184]
  - - [192, 2240, 1, 1024, 192, 192, 1024, 1024]
    - [0, 8.147]
  - - [320, 2240, 1, 1024, 320, 320, 1024, 1024]
    - [0, 8.38]
  - - [448, 2240, 1, 1024, 448, 448, 1024, 1024]
    - [0, 8.502]
  - - [576, 2240, 1, 1024, 576, 576, 1024, 1024]
    - [0, 8.844]
  - - [704, 2240, 1, 1024, 704, 704, 1024, 1024]
    - [0, 8.774]
  - - [832, 2240, 1, 1024, 832, 832, 1024, 1024]
    - [0, 8.8]
  - - [960, 2240, 1, 1024, 960, 960, 1024, 1024]
    - [0, 8.783]
  - - [1088, 2240, 1, 1024, 1088, 1088, 1024, 1024]
    - [0, 8.822]
  - - [1216, 2240, 1, 1024, 1216, 1216, 1024, 1024]
    - [0, 8.833]
  - - [1344, 2240, 1, 1024, 1344, 1344, 1024, 1024]
    - [0, 8.935]
  - - [1472, 2240, 1, 1024, 1472, 1472, 1024, 1024]
    - [0, 8.961]
  - - [1600, 2240, 1, 1024, 1600, 1600, 1024, 1024]
    - [0, 8.985]
  - - [1728, 2240, 1, 1024, 1728, 1728, 1024, 1024]
    - [0, 8.976]
  - - [1856, 2240, 1, 1024, 1856, 1856, 1024, 1024]
    - [0, 9.009]
  - - [1984, 2240, 1, 1024, 1984, 1984, 1024, 1024]
    - [0, 9.008]
  - - [2112, 2240, 1, 1024, 2112, 2112, 1024, 1024]
    - [0, 9.046]
  - - [2240, 2240, 1, 1024, 2240, 2240, 1024, 1024]
    - [0, 9.106]
  - - [2368, 2240, 1, 1024, 2368, 2368, 1024, 1024]
    - [0, 9.106]
  - - [2496, 2240, 1, 1024, 2496, 2496, 1024, 1024]
    - [0, 9.135]
  - - [2624, 2240, 1, 1024, 2624, 2624, 1024, 1024]
    - [0, 9.239]
  - - [2752, 2240, 1, 1024, 2752, 2752, 1024, 1024]
    - [0, 9.284]
  - - [2880, 2240, 1, 1024, 2880, 2880, 1024, 1024]
    - [0, 9.286]
  - - [3008, 2240, 1, 1024, 3008, 3008, 1024, 1024]
    - [0, 9.258]
  - - [3136, 2240, 1, 1024, 3136, 3136, 1024, 1024]
    - [0, 9.278]
  - - [3264, 2240, 1, 1024, 3264, 3264, 1024, 1024]
    - [0, 9.341]
  - - [3392, 2240, 1, 1024, 3392, 3392, 1024, 1024]
    - [0, 9.367]
  - - [3520, 2240, 1, 1024, 3520, 3520, 1024, 1024]
    - [0, 9.302]
  - - [3648, 2240, 1, 1024, 3648, 3648, 1024, 1024]
    - [0, 9.274]
  - - [3776, 2240, 1, 1024, 3776, 3776, 1024, 1024]
    - [0, 9.232]
  - - [3904, 2240, 1, 1024, 3904, 3904, 1024, 1024]
    - [0, 9.348]
  - - [4032, 2240, 1, 1024, 4032, 4032, 1024, 1024]
    - [0, 9.146]
  - - [64, 2368, 1, 1024, 64, 64, 1024, 1024]
    - [0, 5.947]
  - - [192, 2368, 1, 1024, 192, 192, 1024, 1024]
    - [0, 7.815]
  - - [320, 2368, 1, 1024, 320, 320, 1024, 1024]
    - [0, 8.192]
  - - [448, 2368, 1, 1024, 448, 448, 1024, 1024]
    - [0, 8.46]
  - - [576, 2368, 1, 1024, 576, 576, 1024, 1024]
    - [0, 8.644]
  - - [704, 2368, 1, 1024, 704, 704, 1024, 1024]
    - [0, 8.742]
  - - [832, 2368, 1, 1024, 832, 832, 1024, 1024]
    - [0, 8.838]
  - - [960, 2368, 1, 1024, 960, 960, 1024, 1024]
    - [0, 8.855]
  - - [1088, 2368, 1, 1024, 1088, 1088, 1024, 1024]
    - [0, 8.804]
  - - [1216, 2368, 1, 1024, 1216, 1216, 1024, 1024]
    - [0, 8.86]
  - - [1344, 2368, 1, 1024, 1344, 1344, 1024, 1024]
    - [0, 8.862]
  - - [1472, 2368, 1, 1024, 1472, 1472, 1024, 1024]
    - [0, 8.875]
  - - [1600, 2368, 1, 1024, 1600, 1600, 1024, 1024]
    - [0, 9.017]
  - - [1728, 2368, 1, 1024, 1728, 1728, 1024, 1024]
    - [0, 9.072]
  - - [1856, 2368, 1, 1024, 1856, 1856, 1024, 1024]
    - [0, 9.051]
  - - [1984, 2368, 1, 1024, 1984, 1984, 1024, 1024]
    - [0, 9.032]
  - - [2112, 2368, 1, 1024, 2112, 2112, 1024, 1024]
    - [0, 9.124]
  - - [2240, 2368, 1, 1024, 2240, 2240, 1024, 1024]
    - [0, 9.107]
  - - [2368, 2368, 1, 1024, 2368, 2368, 1024, 1024]
    - [0, 9.186]
  - - [2496, 2368, 1, 1024, 2496, 2496, 1024, 1024]
    - [0, 9.217]
  - - [2624, 2368, 1, 1024, 2624, 2624, 1024, 1024]
    - [0, 9.236]
  - - [2752, 2368, 1, 1024, 2752, 2752, 1024, 1024]
    - [0, 9.288]
  - - [2880, 2368, 1, 1024, 2880, 2880, 1024, 1024]
    - [0, 9.318]
  - - [3008, 2368, 1, 1024, 3008, 3008, 1024, 1024]
    - [0, 9.266]
  - - [3136, 2368, 1, 1024, 3136, 3136, 1024, 1024]
    - [0, 9.332]
  - - [3264, 2368, 1, 1024, 3264, 3264, 1024, 1024]
    - [0, 9.38]
  - - [3392, 2368, 1, 1024, 3392, 3392, 1024, 1024]
    - [0, 9.329]
  - - [3520, 2368, 1, 1024, 3520, 3520, 1024, 1024]
    - [0, 9.429]
  - - [3648, 2368, 1, 1024, 3648, 3648, 1024, 1024]
    - [0, 9.137]
  - - [3776, 2368, 1, 1024, 3776, 3776, 1024, 1024]
    - [0, 9.122]
  - - [3904, 2368, 1, 1024, 3904, 3904, 1024, 1024]
    - [0, 9.143]
  - - [4032, 2368, 1, 1024, 4032, 4032, 1024, 1024]
    - [0, 9.338]
  - - [64, 2496, 1, 1024, 64, 64, 1024, 1024]
    - [0, 6.221]
  - - [192, 2496, 1, 1024, 192, 192, 1024, 1024]
    - [0, 8.201]
  - - [320, 2496, 1, 1024, 320, 320, 1024, 1024]
    - [0, 8.252]
  - - [448, 2496, 1, 1024, 448, 448, 1024, 1024]
    - [0, 8.532]
  - - [576, 2496, 1, 1024, 576, 576, 1024, 1024]
    - [0, 8.466]
  - - [704, 2496, 1, 1024, 704, 704, 1024, 1024]
    - [0, 8.616]
  - - [832, 2496, 1, 1024, 832, 832, 1024, 1024]
    - [0, 8.647]
  - - [960, 2496, 1, 1024, 960, 960, 1024, 1024]
    - [0, 8.707]
  - - [1088, 2496, 1, 1024, 1088, 1088, 1024, 1024]
    - [0, 8.711]
  - - [1216, 2496, 1, 1024, 1216, 1216, 1024, 1024]
    - [0, 8.809]
  - - [1344, 2496, 1, 1024, 1344, 1344, 1024, 1024]
    - [0, 8.84]
  - - [1472, 2496, 1, 1024, 1472, 1472, 1024, 1024]
    - [0, 8.979]
  - - [1600, 2496, 1, 1024, 1600, 1600, 1024, 1024]
    - [0, 9.044]
  - - [1728, 2496, 1, 1024, 1728, 1728, 1024, 1024]
    - [0, 9.025]
  - - [1856, 2496, 1, 1024, 1856, 1856, 1024, 1024]
    - [0, 9.069]
  - - [1984, 2496, 1, 1024, 1984, 1984, 1024, 1024]
    - [0, 9.016]
  - - [2112, 2496, 1, 1024, 2112, 2112, 1024, 1024]
    - [0, 9.066]
  - - [2240, 2496, 1, 1024, 2240, 2240, 1024, 1024]
    - [0, 9.186]
  - - [2368, 2496, 1, 1024, 2368, 2368, 1024, 1024]
    - [0, 9.194]
  - - [2496, 2496, 1, 1024, 2496, 2496, 1024, 1024]
    - [0, 9.25]
  - - [2624, 2496, 1, 1024, 2624, 2624, 1024, 1024]
    - [0, 9.327]
  - - [2752, 2496, 1, 1024, 2752, 2752, 1024, 1024]
    - [0, 9.341]
  - - [2880, 2496, 1, 1024, 2880, 2880, 1024, 1024]
    - [0, 9.312]
  - - [3008, 2496, 1, 1024, 3008, 3008, 1024, 1024]
    - [0, 9.323]
  - - [3136, 2496, 1, 1024, 3136, 3136, 1024, 1024]
    - [0, 9.371]
  - - [3264, 2496, 1, 1024, 3264, 3264, 1024, 1024]
    - [0, 9.293]
  - - [3392, 2496, 1, 1024, 3392, 3392, 1024, 1024]
    - [0, 9.134]
  - - [3520, 2496, 1, 1024, 3520, 3520, 1024, 1024]
    - [0, 9.128]
  - - [3648, 2496, 1, 1024, 3648, 3648, 1024, 1024]
    - [0, 9.169]
  - - [3776, 2496, 1, 1024, 3776, 3776, 1024, 1024]
    - [0, 9.071]
  - - [3904, 2496, 1, 1024, 3904, 3904, 1024, 1024]
    - [0, 9.116]
  - - [4032, 2496, 1, 1024, 4032, 4032, 1024, 1024]
    - [0, 9.415]
  - - [64, 2624, 1, 1024, 64, 64, 1024, 1024]
    - [0, 6.518]
  - - [192, 2624, 1, 1024, 192, 192, 1024, 1024]
    - [0, 7.869]
  - - [320, 2624, 1, 1024, 320, 320, 1024, 1024]
    - [0, 8.322]
  - - [448, 2624, 1, 1024, 448, 448, 1024, 1024]
    - [0, 8.697]
  - - [576, 2624, 1, 1024, 576, 576, 1024, 1024]
    - [0, 8.67]
  - - [704, 2624, 1, 1024, 704, 704, 1024, 1024]
    - [0, 8.756]
  - - [832, 2624, 1, 1024, 832, 832, 1024, 1024]
    - [0, 8.641]
  - - [960, 2624, 1, 1024, 960, 960, 1024, 1024]
    - [0, 8.909]
  - - [1088, 2624, 1, 1024, 1088, 1088, 1024, 1024]
    - [0, 8.873]
  - - [1216, 2624, 1, 1024, 1216, 1216, 1024, 1024]
    - [0, 8.954]
  - - [1344, 2624, 1, 1024, 1344, 1344, 1024, 1024]
    - [0, 8.983]
  - - [1472, 2624, 1, 1024, 1472, 1472, 1024, 1024]
    - [0, 8.996]
  - - [1600, 2624, 1, 1024, 1600, 1600, 1024, 1024]
    - [0, 9.109]
  - - [1728, 2624, 1, 1024, 1728, 1728, 1024, 1024]
    - [0, 9.126]
  - - [1856, 2624, 1, 1024, 1856, 1856, 1024, 1024]
    - [0, 9.111]
  - - [1984, 2624, 1, 1024, 1984, 1984, 1024, 1024]
    - [0, 9.117]
  - - [2112, 2624, 1, 1024, 2112, 2112, 1024, 1024]
    - [0, 9.198]
  - - [2240, 2624, 1, 1024, 2240, 2240, 1024, 1024]
    - [0, 9.198]
  - - [2368, 2624, 1, 1024, 2368, 2368, 1024, 1024]
    - [0, 9.26]
  - - [2496, 2624, 1, 1024, 2496, 2496, 1024, 1024]
    - [0, 9.304]
  - - [2624, 2624, 1, 1024, 2624, 2624, 1024, 1024]
    - [0, 9.294]
  - - [2752, 2624, 1, 1024, 2752, 2752, 1024, 1024]
    - [0, 9.319]
  - - [2880, 2624, 1, 1024, 2880, 2880, 1024, 1024]
    - [0, 9.347]
  - - [3008, 2624, 1, 1024, 3008, 3008, 1024, 1024]
    - [0, 9.316]
  - - [3136, 2624, 1, 1024, 3136, 3136, 1024, 1024]
    - [0, 9.314]
  - - [3264, 2624, 1, 1024, 3264, 3264, 1024, 1024]
    - [0, 9.127]
  - - [3392, 2624, 1, 1024, 3392, 3392, 1024, 1024]
    - [0, 9.171]
  - - [3520, 2624, 1, 1024, 3520, 3520, 1024, 1024]
    - [0, 9.077]
  - - [3648, 2624, 1, 1024, 3648, 3648, 1024, 1024]
    - [0, 9.088]
  - - [3776, 2624, 1, 1024, 3776, 3776, 1024, 1024]
    - [0, 9.1]
  - - [3904, 2624, 1, 1024, 3904, 3904, 1024, 1024]
    - [0, 9.07]
  - - [4032, 2624, 1, 1024, 4032, 4032, 1024, 1024]
    - [0, 9.073]
  - - [64, 2752, 1, 1024, 64, 64, 1024, 1024]
    - [0, 6.817]
  - - [192, 2752, 1, 1024, 192, 192, 1024, 1024]
    - [0, 8.221]
  - - [320, 2752, 1, 1024, 320, 320, 1024, 1024]
    - [0, 8.683]
  - - [448, 2752, 1, 1024, 448, 448, 1024, 1024]
    - [0, 8.73]
  - - [576, 2752, 1, 1024, 576, 576, 1024, 1024]
    - [0, 8.623]
  - - [704, 2752, 1, 1024, 704, 704, 1024, 1024]
    - [0, 8.755]
  - - [832, 2752, 1, 1024, 832, 832, 1024, 1024]
    - [0, 8.827]
  - - [960, 2752, 1, 1024, 960, 960, 1024, 1024]
    - [0, 8.867]
  - - [1088, 2752, 1, 1024, 1088, 1088, 1024, 1024]
    - [0, 8.952]
  - - [1216, 2752, 1, 1024, 1216, 1216, 1024, 1024]
    - [0, 8.958]
  - - [1344, 2752, 1, 1024, 1344, 1344, 1024, 1024]
    - [0, 9.044]
  - - [1472, 2752, 1, 1024, 1472, 1472, 1024, 1024]
    - [0, 9.012]
  - - [1600, 2752, 1, 1024, 1600, 1600, 1024, 1024]
    - [0, 9.048]
  - - [1728, 2752, 1, 1024, 1728, 1728, 1024, 1024]
    - [0, 9.124]
  - - [1856, 2752, 1, 1024, 1856, 1856, 1024, 1024]
    - [0, 9.154]
  - - [1984, 2752, 1, 1024, 1984, 1984, 1024, 1024]
    - [0, 9.166]
  - - [2112, 2752, 1, 1024, 2112, 2112, 1024, 1024]
    - [0, 9.208]
  - - [2240, 2752, 1, 1024, 2240, 2240, 1024, 1024]
    - [0, 9.333]
  - - [2368, 2752, 1, 1024, 2368, 2368, 1024, 1024]
    - [0, 9.287]
  - - [2496, 2752, 1, 1024, 2496, 2496, 1024, 1024]
    - [0, 9.333]
  - - [2624, 2752, 1, 1024, 2624, 2624, 1024, 1024]
    - [0, 9.356]
  - - [2752, 2752, 1, 1024, 2752, 2752, 1024, 1024]
    - [0, 9.363]
  - - [2880, 2752, 1, 1024, 2880, 2880, 1024, 1024]
    - [0, 9.335]
  - - [3008, 2752, 1, 1024, 3008, 3008, 1024, 1024]
    - [0, 9.355]
  - - [3136, 2752, 1, 1024, 3136, 3136, 1024, 1024]
    - [0, 9.228]
  - - [3264, 2752, 1, 1024, 3264, 3264, 1024, 1024]
    - [0, 9.07]
  - - [3392, 2752, 1, 1024, 3392, 3392, 1024, 1024]
    - [0, 9.342]
  - - [3520, 2752, 1, 1024, 3520, 3520, 1024, 1024]
    - [0, 9.387]
  - - [3648, 2752, 1, 1024, 3648, 3648, 1024, 1024]
    - [0, 9.154]
  - - [3776, 2752, 1, 1024, 3776, 3776, 1024, 1024]
    - [0, 9.063]
  - - [3904, 2752, 1, 1024, 3904, 3904, 1024, 1024]
    - [0, 9.128]
  - - [4032, 2752, 1, 1024, 4032, 4032, 1024, 1024]
    - [0, 9.36]
  - - [64, 2880, 1, 1024, 64, 64, 1024, 1024]
    - [0, 7.109]
  - - [192, 2880, 1, 1024, 192, 192, 1024, 1024]
    - [0, 7.946]
  - - [320, 2880, 1, 1024, 320, 320, 1024, 1024]
    - [0, 8.644]
  - - [448, 2880, 1, 1024, 448, 448, 1024, 1024]
    - [0, 8.629]
  - - [576, 2880, 1, 1024, 576, 576, 1024, 1024]
    - [0, 8.739]
  - - [704, 2880, 1, 1024, 704, 704, 1024, 1024]
    - [0, 8.828]
  - - [832, 2880, 1, 1024, 832, 832, 1024, 1024]
    - [0, 8.742]
  - - [960, 2880, 1, 1024, 960, 960, 1024, 1024]
    - [0, 8.931]
  - - [1088, 2880, 1, 1024, 1088, 1088, 1024, 1024]
    - [0, 8.845]
  - - [1216, 2880, 1, 1024, 1216, 1216, 1024, 1024]
    - [0, 8.859]
  - - [1344, 2880, 1, 1024, 1344, 1344, 1024, 1024]
    - [0, 9.0]
  - - [1472, 2880, 1, 1024, 1472, 1472, 1024, 1024]
    - [0, 9.047]
  - - [1600, 2880, 1, 1024, 1600, 1600, 1024, 1024]
    - [0, 9.061]
  - - [1728, 2880, 1, 1024, 1728, 1728, 1024, 1024]
    - [0, 9.074]
  - - [1856, 2880, 1, 1024, 1856, 1856, 1024, 1024]
    - [0, 9.181]
  - - [1984, 2880, 1, 1024, 1984, 1984, 1024, 1024]
    - [0, 9.149]
  - - [2112, 2880, 1, 1024, 2112, 2112, 1024, 1024]
    - [0, 9.17]
  - - [2240, 2880, 1, 1024, 2240, 2240, 1024, 1024]
    - [0, 9.266]
  - - [2368, 2880, 1, 1024, 2368, 2368, 1024, 1024]
    - [0, 9.263]
  - - [2496, 2880, 1, 1024, 2496, 2496, 1024, 1024]
    - [0, 9.349]
  - - [2624, 2880, 1, 1024, 2624, 2624, 1024, 1024]
    - [0, 9.325]
  - - [2752, 2880, 1, 1024, 2752, 2752, 1024, 1024]
    - [0, 9.298]
  - - [2880, 2880, 1, 1024, 2880, 2880, 1024, 1024]
    - [0, 9.223]
  - - [3008, 2880, 1, 1024, 3008, 3008, 1024, 1024]
    - [0, 9.091]
  - - [3136, 2880, 1, 1024, 3136, 3136, 1024, 1024]
    - [0, 9.193]
  - - [3264, 2880, 1, 1024, 3264, 3264, 1024, 1024]
    - [0, 9.121]
  - - [3392, 2880, 1, 1024, 3392, 3392, 1024, 1024]
    - [0, 9.139]
  - - [3520, 2880, 1, 1024, 3520, 3520, 1024, 1024]
    - [0, 9.139]
  - - [3648, 2880, 1, 1024, 3648, 3648, 1024, 1024]
    - [0, 9.13]
  - - [3776, 2880, 1, 1024, 3776, 3776, 1024, 1024]
    - [0, 9.11]
  - - [3904, 2880, 1, 1024, 3904, 3904, 1024, 1024]
    - [0, 9.132]
  - - [4032, 2880, 1, 1024, 4032, 4032, 1024, 1024]
    - [0, 9.111]
  - - [64, 3008, 1, 1024, 64, 64, 1024, 1024]
    - [0, 7.407]
  - - [192, 3008, 1, 1024, 192, 192, 1024, 1024]
    - [0, 8.249]
  - - [320, 3008, 1, 1024, 320, 320, 1024, 1024]
    - [0, 8.433]
  - - [448, 3008, 1, 1024, 448, 448, 1024, 1024]
    - [0, 8.574]
  - - [576, 3008, 1, 1024, 576, 576, 1024, 1024]
    - [0, 8.778]
  - - [704, 3008, 1, 1024, 704, 704, 1024, 1024]
    - [0, 8.869]
  - - [832, 3008, 1, 1024, 832, 832, 1024, 1024]
    - [0, 8.875]
  - - [960, 3008, 1, 1024, 960, 960, 1024, 1024]
    - [0, 8.911]
  - - [1088, 3008, 1, 1024, 1088, 1088, 1024, 1024]
    - [0, 8.937]
  - - [1216, 3008, 1, 1024, 1216, 1216, 1024, 1024]
    - [0, 8.984]
  - - [1344, 3008, 1, 1024, 1344, 1344, 1024, 1024]
    - [0, 9.07]
  - - [1472, 3008, 1, 1024, 1472, 1472, 1024, 1024]
    - [0, 9.096]
  - - [1600, 3008, 1, 1024, 1600, 1600, 1024, 1024]
    - [0, 9.13]
  - - [1728, 3008, 1, 1024, 1728, 1728, 1024, 1024]
    - [0, 9.135]
  - - [1856, 3008, 1, 1024, 1856, 1856, 1024, 1024]
    - [0, 9.181]
  - - [1984, 3008, 1, 1024, 1984, 1984, 1024, 1024]
    - [0, 9.222]
  - - [2112, 3008, 1, 1024, 2112, 2112, 1024, 1024]
    - [0, 9.277]
  - - [2240, 3008, 1, 1024, 2240, 2240, 1024, 1024]
    - [0, 9.302]
  - - [2368, 3008, 1, 1024, 2368, 2368, 1024, 1024]
    - [0, 9.199]
  - - [2496, 3008, 1, 1024, 2496, 2496, 1024, 1024]
    - [0, 9.358]
  - - [2624, 3008, 1, 1024, 2624, 2624, 1024, 1024]
    - [0, 9.356]
  - - [2752, 3008, 1, 1024, 2752, 2752, 1024, 1024]
    - [0, 9.182]
  - - [2880, 3008, 1, 1024, 2880, 2880, 1024, 1024]
    - [0, 9.282]
  - - [3008, 3008, 1, 1024, 3008, 3008, 1024, 1024]
    - [0, 9.134]
  - - [3136, 3008, 1, 1024, 3136, 3136, 1024, 1024]
    - [0, 9.096]
  - - [3264, 3008, 1, 1024, 3264, 3264, 1024, 1024]
    - [0, 9.122]
  - - [3392, 3008, 1, 1024, 3392, 3392, 1024, 1024]
    - [0, 9.153]
  - - [3520, 3008, 1, 1024, 3520, 3520, 1024, 1024]
    - [0, 9.103]
  - - [3648, 3008, 1, 1024, 3648, 3648, 1024, 1024]
    - [0, 9.089]
  - - [3776, 3008, 1, 1024, 3776, 3776, 1024, 1024]
    - [0, 9.088]
  - - [3904, 3008, 1, 1024, 3904, 3904, 1024, 1024]
    - [0, 9.076]
  - - [4032, 3008, 1, 1024, 4032, 4032, 1024, 1024]
    - [0, 9.171]
  - - [64, 3136, 1, 1024, 64, 64, 1024, 1024]
    - [0, 6.55]
  - - [192, 3136, 1, 1024, 192, 192, 1024, 1024]
    - [0, 8.117]
  - - [320, 3136, 1, 1024, 320, 320, 1024, 1024]
    - [0, 8.492]
  - - [448, 3136, 1, 1024, 448, 448, 1024, 1024]
    - [0, 8.676]
  - - [576, 3136, 1, 1024, 576, 576, 1024, 1024]
    - [0, 8.723]
  - - [704, 3136, 1, 1024, 704, 704, 1024, 1024]
    - [0, 8.844]
  - - [832, 3136, 1, 1024, 832, 832, 1024, 1024]
    - [0, 8.834]
  - - [960, 3136, 1, 1024, 960, 960, 1024, 1024]
    - [0, 8.917]
  - - [1088, 3136, 1, 1024, 1088, 1088, 1024, 1024]
    - [0, 8.929]
  - - [1216, 3136, 1, 1024, 1216, 1216, 1024, 1024]
    - [0, 9.012]
  - - [1344, 3136, 1, 1024, 1344, 1344, 1024, 1024]
    - [0, 9.028]
  - - [1472, 3136, 1, 1024, 1472, 1472, 1024, 1024]
    - [0, 9.059]
  - - [1600, 3136, 1, 1024, 1600, 1600, 1024, 1024]
    - [0, 9.119]
  - - [1728, 3136, 1, 1024, 1728, 1728, 1024, 1024]
    - [0, 9.139]
  - - [1856, 3136, 1, 1024, 1856, 1856, 1024, 1024]
    - [0, 9.256]
  - - [1984, 3136, 1, 1024, 1984, 1984, 1024, 1024]
    - [0, 9.285]
  - - [2112, 3136, 1, 1024, 2112, 2112, 1024, 1024]
    - [0, 9.253]
  - - [2240, 3136, 1, 1024, 2240, 2240, 1024, 1024]
    - [0, 9.363]
  - - [2368, 3136, 1, 1024, 2368, 2368, 1024, 1024]
    - [0, 9.362]
  - - [2496, 3136, 1, 1024, 2496, 2496, 1024, 1024]
    - [0, 9.328]
  - - [2624, 3136, 1, 1024, 2624, 2624, 1024, 1024]
    - [0, 9.274]
  - - [2752, 3136, 1, 1024, 2752, 2752, 1024, 1024]
    - [0, 9.199]
  - - [2880, 3136, 1, 1024, 2880, 2880, 1024, 1024]
    - [0, 9.161]
  - - [3008, 3136, 1, 1024, 3008, 3008, 1024, 1024]
    - [0, 9.079]
  - - [3136, 3136, 1, 1024, 3136, 3136, 1024, 1024]
    - [0, 9.218]
  - - [3264, 3136, 1, 1024, 3264, 3264, 1024, 1024]
    - [0, 9.176]
  - - [3392, 3136, 1, 1024, 3392, 3392, 1024, 1024]
    - [0, 9.12]
  - - [3520, 3136, 1, 1024, 3520, 3520, 1024, 1024]
    - [0, 9.1]
  - - [3648, 3136, 1, 1024, 3648, 3648, 1024, 1024]
    - [0, 9.329]
  - - [3776, 3136, 1, 1024, 3776, 3776, 1024, 1024]
    - [0, 9.09]
  - - [3904, 3136, 1, 1024, 3904, 3904, 1024, 1024]
    - [0, 9.124]
  - - [4032, 3136, 1, 1024, 4032, 4032, 1024, 1024]
    - [0, 9.088]
  - - [64, 3264, 1, 1024, 64, 64, 1024, 1024]
    - [0, 6.938]
  - - [192, 3264, 1, 1024, 192, 192, 1024, 1024]
    - [0, 8.35]
  - - [320, 3264, 1, 1024, 320, 320, 1024, 1024]
    - [0, 8.424]
  - - [448, 3264, 1, 1024, 448, 448, 1024, 1024]
    - [0, 8.666]
  - - [576, 3264, 1, 1024, 576, 576, 1024, 1024]
    - [0, 8.69]
  - - [704, 3264, 1, 1024, 704, 704, 1024, 1024]
    - [0, 8.806]
  - - [832, 3264, 1, 1024, 832, 832, 1024, 1024]
    - [0, 8.828]
  - - [960, 3264, 1, 1024, 960, 960, 1024, 1024]
    - [0, 8.9]
  - - [1088, 3264, 1, 1024, 1088, 1088, 1024, 1024]
    - [0, 8.953]
  - - [1216, 3264, 1, 1024, 1216, 1216, 1024, 1024]
    - [0, 9.015]
  - - [1344, 3264, 1, 1024, 1344, 1344, 1024, 1024]
    - [0, 9.079]
  - - [1472, 3264, 1, 1024, 1472, 1472, 1024, 1024]
    - [0, 9.094]
  - - [1600, 3264, 1, 1024, 1600, 1600, 1024, 1024]
    - [0, 9.137]
  - - [1728, 3264, 1, 1024, 1728, 1728, 1024, 1024]
    - [0, 9.198]
  - - [1856, 3264, 1, 1024, 1856, 1856, 1024, 1024]
    - [0, 9.257]
  - - [1984, 3264, 1, 1024, 1984, 1984, 1024, 1024]
    - [0, 9.269]
  - - [2112, 3264, 1, 1024, 2112, 2112, 1024, 1024]
    - [0, 9.297]
  - - [2240, 3264, 1, 1024, 2240, 2240, 1024, 1024]
    - [0, 9.303]
  - - [2368, 3264, 1, 1024, 2368, 2368, 1024, 1024]
    - [0, 9.367]
  - - [2496, 3264, 1, 1024, 2496, 2496, 1024, 1024]
    - [0, 9.171]
  - - [2624, 3264, 1, 1024, 2624, 2624, 1024, 1024]
    - [0, 9.157]
  - - [2752, 3264, 1, 1024, 2752, 2752, 1024, 1024]
    - [0, 9.254]
  - - [2880, 3264, 1, 1024, 2880, 2880, 1024, 1024]
    - [0, 9.034]
  - - [3008, 3264, 1, 1024, 3008, 3008, 1024, 1024]
    - [0, 9.127]
  - - [3136, 3264, 1, 1024, 3136, 3136, 1024, 1024]
    - [0, 9.075]
  - - [3264, 3264, 1, 1024, 3264, 3264, 1024, 1024]
    - [0, 9.096]
  - - [3392, 3264, 1, 1024, 3392, 3392, 1024, 1024]
    - [0, 9.092]
  - - [3520, 3264, 1, 1024, 3520, 3520, 1024, 1024]
    - [0, 9.117]
  - - [3648, 3264, 1, 1024, 3648, 3648, 1024, 1024]
    - [0, 9.108]
  - - [3776, 3264, 1, 1024, 3776, 3776, 1024, 1024]
    - [0, 9.101]
  - - [3904, 3264, 1, 1024, 3904, 3904, 1024, 1024]
    - [0, 9.042]
  - - [4032, 3264, 1, 1024, 4032, 4032, 1024, 1024]
    - [0, 9.154]
  - - [64, 3392, 1, 1024, 64, 64, 1024, 1024]
    - [0, 7.013]
  - - [192, 3392, 1, 1024, 192, 192, 1024, 1024]
    - [0, 8.159]
  - - [320, 3392, 1, 1024, 320, 320, 1024, 1024]
    - [0, 8.541]
  - - [448, 3392, 1, 1024, 448, 448, 1024, 1024]
    - [0, 8.731]
  - - [576, 3392, 1, 1024, 576, 576, 1024, 1024]
    - [0, 8.75]
  - - [704, 3392, 1, 1024, 704, 704, 1024, 1024]
    - [0, 8.807]
  - - [832, 3392, 1, 1024, 832, 832, 1024, 1024]
    - [0, 8.844]
  - - [960, 3392, 1, 1024, 960, 960, 1024, 1024]
    - [0, 8.876]
  - - [1088, 3392, 1, 1024, 1088, 1088, 1024, 1024]
    - [0, 8.95]
  - - [1216, 3392, 1, 1024, 1216, 1216, 1024, 1024]
    - [0, 9.019]
  - - [1344, 3392, 1, 1024, 1344, 1344, 1024, 1024]
    - [0, 9.072]
  - - [1472, 3392, 1, 1024, 1472, 1472, 1024, 1024]
    - [0, 9.097]
  - - [1600, 3392, 1, 1024, 1600, 1600, 1024, 1024]
    - [0, 9.168]
  - - [1728, 3392, 1, 1024, 1728, 1728, 1024, 1024]
    - [0, 9.244]
  - - [1856, 3392, 1, 1024, 1856, 1856, 1024, 1024]
    - [0, 9.086]
  - - [1984, 3392, 1, 1024, 1984, 1984, 1024, 1024]
    - [0, 9.282]
  - - [2112, 3392, 1, 1024, 2112, 2112, 1024, 1024]
    - [0, 9.296]
  - - [2240, 3392, 1, 1024, 2240, 2240, 1024, 1024]
    - [0, 9.368]
  - - [2368, 3392, 1, 1024, 2368, 2368, 1024, 1024]
    - [0, 9.398]
  - - [2496, 3392, 1, 1024, 2496, 2496, 1024, 1024]
    - [0, 9.131]
  - - [2624, 3392, 1, 1024, 2624, 2624, 1024, 1024]
    - [0, 9.202]
  - - [2752, 3392, 1, 1024, 2752, 2752, 1024, 1024]
    - [0, 9.147]
  - - [2880, 3392, 1, 1024, 2880, 2880, 1024, 1024]
    - [0, 9.323]
  - - [3008, 3392, 1, 1024, 3008, 3008, 1024, 1024]
    - [0, 9.112]
  - - [3136, 3392, 1, 1024, 3136, 3136, 1024, 1024]
    - [0, 9.388]
  - - [3264, 3392, 1, 1024, 3264, 3264, 1024, 1024]
    - [0, 9.076]
  - - [3392, 3392, 1, 1024, 3392, 3392, 1024, 1024]
    - [0, 9.139]
  - - [3520, 3392, 1, 1024, 3520, 3520, 1024, 1024]
    - [0, 9.054]
  - - [3648, 3392, 1, 1024, 3648, 3648, 1024, 1024]
    - [0, 9.069]
  - - [3776, 3392, 1, 1024, 3776, 3776, 1024, 1024]
    - [0, 9.084]
  - - [3904, 3392, 1, 1024, 3904, 3904, 1024, 1024]
    - [0, 9.078]
  - - [4032, 3392, 1, 1024, 4032, 4032, 1024, 1024]
    - [0, 9.095]
  - - [64, 3520, 1, 1024, 64, 64, 1024, 1024]
    - [0, 7.244]
  - - [192, 3520, 1, 1024, 192, 192, 1024, 1024]
    - [0, 8.39]
  - - [320, 3520, 1, 1024, 320, 320, 1024, 1024]
    - [0, 8.668]
  - - [448, 3520, 1, 1024, 448, 448, 1024, 1024]
    - [0, 8.755]
  - - [576, 3520, 1, 1024, 576, 576, 1024, 1024]
    - [0, 8.842]
  - - [704, 3520, 1, 1024, 704, 704, 1024, 1024]
    - [0, 8.809]
  - - [832, 3520, 1, 1024, 832, 832, 1024, 1024]
    - [0, 8.883]
  - - [960, 3520, 1, 1024, 960, 960, 1024, 1024]
    - [0, 8.967]
  - - [1088, 3520, 1, 1024, 1088, 1088, 1024, 1024]
    - [0, 9.033]
  - - [1216, 3520, 1, 1024, 1216, 1216, 1024, 1024]
    - [0, 8.997]
  - - [1344, 3520, 1, 1024, 1344, 1344, 1024, 1024]
    - [0, 9.134]
  - - [1472, 3520, 1, 1024, 1472, 1472, 1024, 1024]
    - [0, 9.159]
  - - [1600, 3520, 1, 1024, 1600, 1600, 1024, 1024]
    - [0, 9.083]
  - - [1728, 3520, 1, 1024, 1728, 1728, 1024, 1024]
    - [0, 9.096]
  - - [1856, 3520, 1, 1024, 1856, 1856, 1024, 1024]
    - [0, 9.326]
