library/src/amd_detail/rocblaslt/src/Tensile/Logic/asm_full/navi33/GridBased/navi33_Cijk_Ailk_Bjlk_BSS_BH_Bias_HAH.yaml
- {MinimumRequiredVersion: 4.33.0}
- navi33
- gfx1102
- [Device 73f0]
    SolutionIndex: 0
    SolutionNameMin: Cijk_Ailk_Bjlk_BSS_BH_Bias_HAH_MT32x32x64_MI16x16x16x1_SN_MIWT1_1_WG32_4_1
    SolutionIndex: 1
    SolutionNameMin: Cijk_Ailk_Bjlk_BSS_BH_Bias_HAH_MT16x16x64_MI16x16x16x1_SN_MIWT1_1_WG16_2_1
    SolutionIndex: 2
    SolutionNameMin: Cijk_Ailk_Bjlk_BSS_BH_Bias_HAH_MT32x16x64_MI16x16x16x1_SN_MIWT1_1_WG32_2_1
    SolutionIndex: 3
    SolutionNameMin: Cijk_Ailk_Bjlk_BSS_BH_Bias_HAH_MT16x32x64_MI16x16x16x1_SN_MIWT1_1_WG16_4_1
- - - [64, 64, 1, 64, 64, 64, 64, 64]
    - [2, 0.093]
  - - [192, 64, 1, 64, 192, 192, 192, 64]
    - [1, 0.276]
  - - [320, 64, 1, 64, 320, 320, 320, 64]
    - [2, 0.083]
  - - [448, 64, 1, 64, 448, 448, 448, 64]
    - [3, 0.117]
  - - [576, 64, 1, 64, 576, 576, 576, 64]
    - [0, 0.802]
  - - [704, 64, 1, 64, 704, 704, 704, 64]
    - [1, 0.225]
  - - [832, 64, 1, 64, 832, 832, 832, 64]
    - [3, 0.218]
  - - [960, 64, 1, 64, 960, 960, 960, 64]
    - [1, 0.253]
  - - [1088, 64, 1, 64, 1088, 1088, 1088, 64]
    - [2, 1.401]
  - - [1216, 64, 1, 64, 1216, 1216, 1216, 64]
    - [0, 1.564]
  - - [1344, 64, 1, 64, 1344, 1344, 1344, 64]
    - [0, 1.726]
  - - [1472, 64, 1, 64, 1472, 1472, 1472, 64]
    - [2, 0.388]
  - - [1600, 64, 1, 64, 1600, 1600, 1600, 64]
    - [2, 0.42]
  - - [1728, 64, 1, 64, 1728, 1728, 1728, 64]
    - [3, 0.456]
  - - [1856, 64, 1, 64, 1856, 1856, 1856, 64]
    - [1, 0.488]
  - - [1984, 64, 1, 64, 1984, 1984, 1984, 64]
    - [3, 0.524]
  - - [2112, 64, 1, 64, 2112, 2112, 2112, 64]
    - [1, 0.557]
  - - [2240, 64, 1, 64, 2240, 2240, 2240, 64]
    - [3, 0.592]
  - - [2368, 64, 1, 64, 2368, 2368, 2368, 64]
    - [0, 0.624]
  - - [2496, 64, 1, 64, 2496, 2496, 2496, 64]
    - [0, 0.657]
  - - [2624, 64, 1, 64, 2624, 2624, 2624, 64]
    - [3, 1.342]
  - - [2752, 64, 1, 64, 2752, 2752, 2752, 64]
    - [3, 0.726]
  - - [2880, 64, 1, 64, 2880, 2880, 2880, 64]
    - [3, 0.763]
  - - [3008, 64, 1, 64, 3008, 3008, 3008, 64]
    - [3, 0.799]
  - - [3136, 64, 1, 64, 3136, 3136, 3136, 64]
    - [3, 0.831]
  - - [3264, 64, 1, 64, 3264, 3264, 3264, 64]
    - [2, 0.862]
  - - [3392, 64, 1, 64, 3392, 3392, 3392, 64]
    - [3, 0.898]
  - - [3520, 64, 1, 64, 3520, 3520, 3520, 64]
    - [3, 3.516]
  - - [3648, 64, 1, 64, 3648, 3648, 3648, 64]
    - [0, 4.212]
  - - [3776, 64, 1, 64, 3776, 3776, 3776, 64]
    - [0, 4.265]
  - - [3904, 64, 1, 64, 3904, 3904, 3904, 64]
    - [0, 3.887]
  - - [4032, 64, 1, 64, 4032, 4032, 4032, 64]
    - [0, 3.931]
  - - [64, 192, 1, 64, 64, 64, 64, 192]
    - [2, 0.276]
  - - [192, 192, 1, 64, 192, 192, 192, 192]
    - [0, 0.82]
  - - [320, 192, 1, 64, 320, 320, 320, 192]
    - [2, 1.285]
  - - [448, 192, 1, 64, 448, 448, 448, 192]
    - [0, 1.793]
  - - [576, 192, 1, 64, 576, 576, 576, 192]
    - [0, 2.188]
  - - [704, 192, 1, 64, 704, 704, 704, 192]
    - [0, 2.669]
  - - [832, 192, 1, 64, 832, 832, 832, 192]
    - [3, 0.661]
  - - [960, 192, 1, 64, 960, 960, 960, 192]
    - [3, 0.764]
  - - [1088, 192, 1, 64, 1088, 1088, 1088, 192]
    - [3, 0.864]
  - - [1216, 192, 1, 64, 1216, 1216, 1216, 192]
    - [3, 0.961]
  - - [1344, 192, 1, 64, 1344, 1344, 1344, 192]
    - [1, 1.062]
  - - [1472, 192, 1, 64, 1472, 1472, 1472, 192]
    - [3, 1.161]
  - - [1600, 192, 1, 64, 1600, 1600, 1600, 192]
    - [0, 1.266]
  - - [1728, 192, 1, 64, 1728, 1728, 1728, 192]
    - [1, 2.634]
  - - [1856, 192, 1, 64, 1856, 1856, 1856, 192]
    - [0, 2.836]
  - - [1984, 192, 1, 64, 1984, 1984, 1984, 192]
    - [3, 3.04]
  - - [2112, 192, 1, 64, 2112, 2112, 2112, 192]
    - [0, 3.232]
  - - [2240, 192, 1, 64, 2240, 2240, 2240, 192]
    - [3, 3.421]
  - - [2368, 192, 1, 64, 2368, 2368, 2368, 192]
    - [0, 3.616]
  - - [2496, 192, 1, 64, 2496, 2496, 2496, 192]
    - [2, 5.401]
  - - [2624, 192, 1, 64, 2624, 2624, 2624, 192]
    - [0, 3.987]
  - - [2752, 192, 1, 64, 2752, 2752, 2752, 192]
    - [0, 4.194]
  - - [2880, 192, 1, 64, 2880, 2880, 2880, 192]
    - [2, 4.374]
  - - [3008, 192, 1, 64, 3008, 3008, 3008, 192]
    - [0, 4.586]
  - - [3136, 192, 1, 64, 3136, 3136, 3136, 192]
    - [0, 4.762]
  - - [3264, 192, 1, 64, 3264, 3264, 3264, 192]
    - [0, 4.943]
  - - [3392, 192, 1, 64, 3392, 3392, 3392, 192]
    - [3, 5.165]
  - - [3520, 192, 1, 64, 3520, 3520, 3520, 192]
    - [0, 5.344]
  - - [3648, 192, 1, 64, 3648, 3648, 3648, 192]
    - [0, 5.523]
  - - [3776, 192, 1, 64, 3776, 3776, 3776, 192]
    - [3, 5.796]
  - - [3904, 192, 1, 64, 3904, 3904, 3904, 192]
    - [3, 6.101]
  - - [4032, 192, 1, 64, 4032, 4032, 4032, 192]
    - [2, 6.576]
  - - [64, 320, 1, 64, 64, 64, 64, 320]
    - [2, 0.461]
  - - [192, 320, 1, 64, 192, 192, 192, 320]
    - [2, 1.282]
  - - [320, 320, 1, 64, 320, 320, 320, 320]
    - [2, 2.037]
  - - [448, 320, 1, 64, 448, 448, 448, 320]
    - [0, 2.8]
  - - [576, 320, 1, 64, 576, 576, 576, 320]
    - [0, 3.437]
  - - [704, 320, 1, 64, 704, 704, 704, 320]
    - [0, 4.061]
  - - [832, 320, 1, 64, 832, 832, 832, 320]
    - [2, 1.101]
  - - [960, 320, 1, 64, 960, 960, 960, 320]
    - [3, 1.263]
  - - [1088, 320, 1, 64, 1088, 1088, 1088, 320]
    - [2, 1.437]
  - - [1216, 320, 1, 64, 1216, 1216, 1216, 320]
    - [0, 1.605]
  - - [1344, 320, 1, 64, 1344, 1344, 1344, 320]
    - [3, 1.768]
  - - [1472, 320, 1, 64, 1472, 1472, 1472, 320]
    - [3, 3.741]
  - - [1600, 320, 1, 64, 1600, 1600, 1600, 320]
    - [0, 4.063]
  - - [1728, 320, 1, 64, 1728, 1728, 1728, 320]
    - [1, 4.401]
  - - [1856, 320, 1, 64, 1856, 1856, 1856, 320]
    - [0, 4.714]
  - - [1984, 320, 1, 64, 1984, 1984, 1984, 320]
    - [0, 5.047]
  - - [2112, 320, 1, 64, 2112, 2112, 2112, 320]
    - [1, 5.384]
  - - [2240, 320, 1, 64, 2240, 2240, 2240, 320]
    - [0, 5.727]
  - - [2368, 320, 1, 64, 2368, 2368, 2368, 320]
    - [1, 6.082]
  - - [2496, 320, 1, 64, 2496, 2496, 2496, 320]
    - [2, 6.405]
  - - [2624, 320, 1, 64, 2624, 2624, 2624, 320]
    - [2, 6.76]
  - - [2752, 320, 1, 64, 2752, 2752, 2752, 320]
    - [0, 7.037]
  - - [2880, 320, 1, 64, 2880, 2880, 2880, 320]
    - [0, 7.436]
  - - [3008, 320, 1, 64, 3008, 3008, 3008, 320]
    - [0, 7.554]
  - - [3136, 320, 1, 64, 3136, 3136, 3136, 320]
    - [0, 7.605]
  - - [3264, 320, 1, 64, 3264, 3264, 3264, 320]
    - [0, 7.721]
  - - [3392, 320, 1, 64, 3392, 3392, 3392, 320]
    - [0, 7.793]
  - - [3520, 320, 1, 64, 3520, 3520, 3520, 320]
    - [0, 7.906]
  - - [3648, 320, 1, 64, 3648, 3648, 3648, 320]
    - [0, 8.014]
  - - [3776, 320, 1, 64, 3776, 3776, 3776, 320]
    - [0, 8.017]
  - - [3904, 320, 1, 64, 3904, 3904, 3904, 320]
    - [0, 8.123]
  - - [4032, 320, 1, 64, 4032, 4032, 4032, 320]
    - [0, 8.231]
  - - [64, 448, 1, 64, 64, 64, 64, 448]
    - [3, 0.119]
  - - [192, 448, 1, 64, 192, 192, 192, 448]
    - [2, 0.356]
  - - [320, 448, 1, 64, 320, 320, 320, 448]
    - [2, 0.595]
  - - [448, 448, 1, 64, 448, 448, 448, 448]
    - [1, 1.595]
  - - [576, 448, 1, 64, 576, 576, 576, 448]
    - [3, 1.069]
  - - [704, 448, 1, 64, 704, 704, 704, 448]
    - [2, 1.306]
  - - [832, 448, 1, 64, 832, 832, 832, 448]
    - [3, 1.537]
  - - [960, 448, 1, 64, 960, 960, 960, 448]
    - [2, 1.777]
  - - [1088, 448, 1, 64, 1088, 1088, 1088, 448]
    - [1, 5.153]
  - - [1216, 448, 1, 64, 1216, 1216, 1216, 448]
    - [3, 4.346]
  - - [1344, 448, 1, 64, 1344, 1344, 1344, 448]
    - [0, 4.796]
  - - [1472, 448, 1, 64, 1472, 1472, 1472, 448]
    - [1, 5.244]
  - - [1600, 448, 1, 64, 1600, 1600, 1600, 448]
    - [0, 5.712]
  - - [1728, 448, 1, 64, 1728, 1728, 1728, 448]
    - [0, 6.181]
  - - [1856, 448, 1, 64, 1856, 1856, 1856, 448]
    - [2, 6.642]
  - - [1984, 448, 1, 64, 1984, 1984, 1984, 448]
    - [0, 7.109]
  - - [2112, 448, 1, 64, 2112, 2112, 2112, 448]
    - [0, 7.5]
  - - [2240, 448, 1, 64, 2240, 2240, 2240, 448]
    - [0, 7.592]
  - - [2368, 448, 1, 64, 2368, 2368, 2368, 448]
    - [0, 7.763]
  - - [2496, 448, 1, 64, 2496, 2496, 2496, 448]
    - [0, 7.902]
  - - [2624, 448, 1, 64, 2624, 2624, 2624, 448]
    - [0, 8.003]
  - - [2752, 448, 1, 64, 2752, 2752, 2752, 448]
    - [0, 8.142]
  - - [2880, 448, 1, 64, 2880, 2880, 2880, 448]
    - [0, 8.207]
  - - [3008, 448, 1, 64, 3008, 3008, 3008, 448]
    - [0, 8.283]
  - - [3136, 448, 1, 64, 3136, 3136, 3136, 448]
    - [0, 8.412]
  - - [3264, 448, 1, 64, 3264, 3264, 3264, 448]
    - [0, 8.522]
  - - [3392, 448, 1, 64, 3392, 3392, 3392, 448]
    - [0, 8.53]
  - - [3520, 448, 1, 64, 3520, 3520, 3520, 448]
    - [0, 8.625]
  - - [3648, 448, 1, 64, 3648, 3648, 3648, 448]
    - [0, 8.742]
  - - [3776, 448, 1, 64, 3776, 3776, 3776, 448]
    - [0, 8.649]
  - - [3904, 448, 1, 64, 3904, 3904, 3904, 448]
    - [0, 8.833]
  - - [4032, 448, 1, 64, 4032, 4032, 4032, 448]
    - [0, 8.919]
  - - [64, 576, 1, 64, 64, 64, 64, 576]
    - [2, 0.153]
  - - [192, 576, 1, 64, 192, 192, 192, 576]
    - [2, 0.46]
  - - [320, 576, 1, 64, 320, 320, 320, 576]
    - [2, 0.765]
  - - [448, 576, 1, 64, 448, 448, 448, 576]
    - [3, 1.07]
  - - [576, 576, 1, 64, 576, 576, 576, 576]
    - [3, 1.376]
  - - [704, 576, 1, 64, 704, 704, 704, 576]
    - [2, 3.256]
  - - [832, 576, 1, 64, 832, 832, 832, 576]
    - [2, 3.834]
  - - [960, 576, 1, 64, 960, 960, 960, 576]
    - [0, 4.422]
  - - [1088, 576, 1, 64, 1088, 1088, 1088, 576]
    - [0, 5.003]
  - - [1216, 576, 1, 64, 1216, 1216, 1216, 576]
    - [0, 5.626]
  - - [1344, 576, 1, 64, 1344, 1344, 1344, 576]
    - [0, 6.195]
  - - [1472, 576, 1, 64, 1472, 1472, 1472, 576]
    - [0, 6.78]
  - - [1600, 576, 1, 64, 1600, 1600, 1600, 576]
    - [0, 7.454]
  - - [1728, 576, 1, 64, 1728, 1728, 1728, 576]
    - [0, 7.586]
  - - [1856, 576, 1, 64, 1856, 1856, 1856, 576]
    - [0, 7.792]
  - - [1984, 576, 1, 64, 1984, 1984, 1984, 576]
    - [0, 7.939]
  - - [2112, 576, 1, 64, 2112, 2112, 2112, 576]
    - [0, 8.149]
  - - [2240, 576, 1, 64, 2240, 2240, 2240, 576]
    - [0, 8.253]
  - - [2368, 576, 1, 64, 2368, 2368, 2368, 576]
    - [0, 8.365]
  - - [2496, 576, 1, 64, 2496, 2496, 2496, 576]
    - [0, 8.545]
  - - [2624, 576, 1, 64, 2624, 2624, 2624, 576]
    - [0, 8.603]
  - - [2752, 576, 1, 64, 2752, 2752, 2752, 576]
    - [0, 8.716]
  - - [2880, 576, 1, 64, 2880, 2880, 2880, 576]
    - [0, 8.801]
  - - [3008, 576, 1, 64, 3008, 3008, 3008, 576]
    - [0, 8.867]
  - - [3136, 576, 1, 64, 3136, 3136, 3136, 576]
    - [0, 8.948]
  - - [3264, 576, 1, 64, 3264, 3264, 3264, 576]
    - [0, 9.047]
  - - [3392, 576, 1, 64, 3392, 3392, 3392, 576]
    - [0, 9.098]
  - - [3520, 576, 1, 64, 3520, 3520, 3520, 576]
    - [0, 9.192]
  - - [3648, 576, 1, 64, 3648, 3648, 3648, 576]
    - [0, 9.235]
  - - [3776, 576, 1, 64, 3776, 3776, 3776, 576]
    - [0, 9.227]
  - - [3904, 576, 1, 64, 3904, 3904, 3904, 576]
    - [0, 9.336]
  - - [4032, 576, 1, 64, 4032, 4032, 4032, 576]
    - [0, 9.441]
  - - [64, 704, 1, 64, 64, 64, 64, 704]
    - [2, 0.187]
  - - [192, 704, 1, 64, 192, 192, 192, 704]
    - [0, 0.562]
  - - [320, 704, 1, 64, 320, 320, 320, 704]
    - [2, 0.931]
  - - [448, 704, 1, 64, 448, 448, 448, 704]
    - [3, 1.31]
  - - [576, 704, 1, 64, 576, 576, 576, 704]
    - [3, 1.675]
  - - [704, 704, 1, 64, 704, 704, 704, 704]
    - [0, 2.048]
  - - [832, 704, 1, 64, 832, 832, 832, 704]
    - [0, 4.705]
  - - [960, 704, 1, 64, 960, 960, 960, 704]
    - [0, 5.427]
  - - [1088, 704, 1, 64, 1088, 1088, 1088, 704]
    - [0, 6.115]
  - - [1216, 704, 1, 64, 1216, 1216, 1216, 704]
    - [0, 6.871]
  - - [1344, 704, 1, 64, 1344, 1344, 1344, 704]
    - [0, 7.487]
  - - [1472, 704, 1, 64, 1472, 1472, 1472, 704]
    - [0, 7.697]
  - - [1600, 704, 1, 64, 1600, 1600, 1600, 704]
    - [0, 7.91]
  - - [1728, 704, 1, 64, 1728, 1728, 1728, 704]
    - [0, 8.155]
  - - [1856, 704, 1, 64, 1856, 1856, 1856, 704]
    - [0, 8.264]
  - - [1984, 704, 1, 64, 1984, 1984, 1984, 704]
    - [0, 8.406]
  - - [2112, 704, 1, 64, 2112, 2112, 2112, 704]
    - [0, 8.597]
  - - [2240, 704, 1, 64, 2240, 2240, 2240, 704]
    - [0, 8.687]
  - - [2368, 704, 1, 64, 2368, 2368, 2368, 704]
    - [0, 8.818]
  - - [2496, 704, 1, 64, 2496, 2496, 2496, 704]
    - [0, 8.935]
  - - [2624, 704, 1, 64, 2624, 2624, 2624, 704]
    - [0, 9.014]
  - - [2752, 704, 1, 64, 2752, 2752, 2752, 704]
    - [0, 9.103]
  - - [2880, 704, 1, 64, 2880, 2880, 2880, 704]
    - [0, 9.166]
  - - [3008, 704, 1, 64, 3008, 3008, 3008, 704]
    - [0, 9.247]
  - - [3136, 704, 1, 64, 3136, 3136, 3136, 704]
    - [0, 9.299]
  - - [3264, 704, 1, 64, 3264, 3264, 3264, 704]
    - [0, 9.404]
  - - [3392, 704, 1, 64, 3392, 3392, 3392, 704]
    - [0, 9.437]
  - - [3520, 704, 1, 64, 3520, 3520, 3520, 704]
    - [0, 9.515]
  - - [3648, 704, 1, 64, 3648, 3648, 3648, 704]
    - [0, 9.572]
  - - [3776, 704, 1, 64, 3776, 3776, 3776, 704]
    - [0, 9.502]
  - - [3904, 704, 1, 64, 3904, 3904, 3904, 704]
    - [0, 9.663]
  - - [4032, 704, 1, 64, 4032, 4032, 4032, 704]
    - [0, 9.716]
  - - [64, 832, 1, 64, 64, 64, 64, 832]
    - [3, 0.221]
  - - [192, 832, 1, 64, 192, 192, 192, 832]
    - [1, 1.283]
  - - [320, 832, 1, 64, 320, 320, 320, 832]
    - [2, 1.101]
  - - [448, 832, 1, 64, 448, 448, 448, 832]
    - [0, 1.544]
  - - [576, 832, 1, 64, 576, 576, 576, 832]
    - [2, 1.981]
  - - [704, 832, 1, 64, 704, 704, 704, 832]
    - [0, 4.678]
  - - [832, 832, 1, 64, 832, 832, 832, 832]
    - [0, 5.553]
  - - [960, 832, 1, 64, 960, 960, 960, 832]
    - [0, 6.391]
  - - [1088, 832, 1, 64, 1088, 1088, 1088, 832]
    - [0, 7.161]
  - - [1216, 832, 1, 64, 1216, 1216, 1216, 832]
    - [0, 7.68]
  - - [1344, 832, 1, 64, 1344, 1344, 1344, 832]
    - [0, 7.929]
  - - [1472, 832, 1, 64, 1472, 1472, 1472, 832]
    - [0, 8.127]
  - - [1600, 832, 1, 64, 1600, 1600, 1600, 832]
    - [0, 8.311]
  - - [1728, 832, 1, 64, 1728, 1728, 1728, 832]
    - [0, 8.546]
  - - [1856, 832, 1, 64, 1856, 1856, 1856, 832]
    - [0, 8.661]
  - - [1984, 832, 1, 64, 1984, 1984, 1984, 832]
    - [0, 8.793]
  - - [2112, 832, 1, 64, 2112, 2112, 2112, 832]
    - [0, 8.933]
  - - [2240, 832, 1, 64, 2240, 2240, 2240, 832]
    - [0, 9.057]
  - - [2368, 832, 1, 64, 2368, 2368, 2368, 832]
    - [0, 9.157]
  - - [2496, 832, 1, 64, 2496, 2496, 2496, 832]
    - [0, 9.27]
  - - [2624, 832, 1, 64, 2624, 2624, 2624, 832]
    - [0, 9.355]
  - - [2752, 832, 1, 64, 2752, 2752, 2752, 832]
    - [0, 9.438]
  - - [2880, 832, 1, 64, 2880, 2880, 2880, 832]
    - [0, 9.492]
  - - [3008, 832, 1, 64, 3008, 3008, 3008, 832]
    - [0, 9.543]
  - - [3136, 832, 1, 64, 3136, 3136, 3136, 832]
    - [0, 9.613]
  - - [3264, 832, 1, 64, 3264, 3264, 3264, 832]
    - [0, 9.698]
  - - [3392, 832, 1, 64, 3392, 3392, 3392, 832]
    - [0, 9.741]
  - - [3520, 832, 1, 64, 3520, 3520, 3520, 832]
    - [0, 9.813]
  - - [3648, 832, 1, 64, 3648, 3648, 3648, 832]
    - [0, 9.878]
  - - [3776, 832, 1, 64, 3776, 3776, 3776, 832]
    - [0, 9.913]
  - - [3904, 832, 1, 64, 3904, 3904, 3904, 832]
    - [0, 10.016]
  - - [4032, 832, 1, 64, 4032, 4032, 4032, 832]
    - [0, 9.991]
  - - [64, 960, 1, 64, 64, 64, 64, 960]
    - [1, 0.254]
  - - [192, 960, 1, 64, 192, 192, 192, 960]
    - [2, 0.766]
  - - [320, 960, 1, 64, 320, 320, 320, 960]
    - [3, 1.274]
  - - [448, 960, 1, 64, 448, 448, 448, 960]
    - [0, 1.782]
  - - [576, 960, 1, 64, 576, 576, 576, 960]
    - [3, 4.43]
  - - [704, 960, 1, 64, 704, 704, 704, 960]
    - [1, 5.867]
  - - [832, 960, 1, 64, 832, 832, 832, 960]
    - [2, 6.358]
  - - [960, 960, 1, 64, 960, 960, 960, 960]
    - [0, 7.448]
  - - [1088, 960, 1, 64, 1088, 1088, 1088, 960]
    - [0, 7.737]
  - - [1216, 960, 1, 64, 1216, 1216, 1216, 960]
    - [0, 8.031]
  - - [1344, 960, 1, 64, 1344, 1344, 1344, 960]
    - [0, 8.297]
  - - [1472, 960, 1, 64, 1472, 1472, 1472, 960]
    - [0, 8.451]
  - - [1600, 960, 1, 64, 1600, 1600, 1600, 960]
    - [0, 8.663]
  - - [1728, 960, 1, 64, 1728, 1728, 1728, 960]
    - [0, 8.831]
  - - [1856, 960, 1, 64, 1856, 1856, 1856, 960]
    - [0, 8.952]
  - - [1984, 960, 1, 64, 1984, 1984, 1984, 960]
    - [0, 9.077]
  - - [2112, 960, 1, 64, 2112, 2112, 2112, 960]
    - [0, 9.222]
  - - [2240, 960, 1, 64, 2240, 2240, 2240, 960]
    - [0, 9.328]
  - - [2368, 960, 1, 64, 2368, 2368, 2368, 960]
    - [0, 9.418]
  - - [2496, 960, 1, 64, 2496, 2496, 2496, 960]
    - [0, 9.499]
  - - [2624, 960, 1, 64, 2624, 2624, 2624, 960]
    - [0, 9.582]
  - - [2752, 960, 1, 64, 2752, 2752, 2752, 960]
    - [0, 9.663]
  - - [2880, 960, 1, 64, 2880, 2880, 2880, 960]
    - [0, 9.713]
  - - [3008, 960, 1, 64, 3008, 3008, 3008, 960]
    - [0, 9.772]
  - - [3136, 960, 1, 64, 3136, 3136, 3136, 960]
    - [0, 9.903]
  - - [3264, 960, 1, 64, 3264, 3264, 3264, 960]
    - [0, 9.824]
  - - [3392, 960, 1, 64, 3392, 3392, 3392, 960]
    - [0, 9.988]
  - - [3520, 960, 1, 64, 3520, 3520, 3520, 960]
    - [0, 9.758]
  - - [3648, 960, 1, 64, 3648, 3648, 3648, 960]
    - [0, 10.074]
  - - [3776, 960, 1, 64, 3776, 3776, 3776, 960]
    - [0, 9.923]
  - - [3904, 960, 1, 64, 3904, 3904, 3904, 960]
    - [0, 10.104]
  - - [4032, 960, 1, 64, 4032, 4032, 4032, 960]
    - [0, 10.047]
  - - [64, 1088, 1, 64, 64, 64, 64, 1088]
    - [3, 1.421]
  - - [192, 1088, 1, 64, 192, 192, 192, 1088]
    - [0, 3.765]
  - - [320, 1088, 1, 64, 320, 320, 320, 1088]
    - [0, 4.846]
  - - [448, 1088, 1, 64, 448, 448, 448, 1088]
    - [0, 6.123]
  - - [576, 1088, 1, 64, 576, 576, 576, 1088]
    - [0, 6.624]
  - - [704, 1088, 1, 64, 704, 704, 704, 1088]
    - [0, 7.02]
  - - [832, 1088, 1, 64, 832, 832, 832, 1088]
    - [0, 7.391]
  - - [960, 1088, 1, 64, 960, 960, 960, 1088]
    - [0, 7.685]
  - - [1088, 1088, 1, 64, 1088, 1088, 1088, 1088]
    - [0, 8.064]
  - - [1216, 1088, 1, 64, 1216, 1216, 1216, 1088]
    - [0, 8.344]
  - - [1344, 1088, 1, 64, 1344, 1344, 1344, 1088]
    - [0, 8.594]
  - - [1472, 1088, 1, 64, 1472, 1472, 1472, 1088]
    - [0, 8.726]
  - - [1600, 1088, 1, 64, 1600, 1600, 1600, 1088]
    - [0, 8.916]
  - - [1728, 1088, 1, 64, 1728, 1728, 1728, 1088]
    - [0, 9.099]
  - - [1856, 1088, 1, 64, 1856, 1856, 1856, 1088]
    - [0, 9.203]
  - - [1984, 1088, 1, 64, 1984, 1984, 1984, 1088]
    - [0, 9.327]
  - - [2112, 1088, 1, 64, 2112, 2112, 2112, 1088]
    - [0, 9.47]
  - - [2240, 1088, 1, 64, 2240, 2240, 2240, 1088]
    - [0, 9.665]
  - - [2368, 1088, 1, 64, 2368, 2368, 2368, 1088]
    - [0, 9.644]
  - - [2496, 1088, 1, 64, 2496, 2496, 2496, 1088]
    - [0, 9.769]
  - - [2624, 1088, 1, 64, 2624, 2624, 2624, 1088]
    - [0, 9.789]
  - - [2752, 1088, 1, 64, 2752, 2752, 2752, 1088]
    - [0, 9.863]
  - - [2880, 1088, 1, 64, 2880, 2880, 2880, 1088]
    - [0, 9.912]
  - - [3008, 1088, 1, 64, 3008, 3008, 3008, 1088]
    - [0, 9.86]
  - - [3136, 1088, 1, 64, 3136, 3136, 3136, 1088]
    - [0, 9.95]
  - - [3264, 1088, 1, 64, 3264, 3264, 3264, 1088]
    - [0, 10.064]
  - - [3392, 1088, 1, 64, 3392, 3392, 3392, 1088]
    - [0, 9.752]
  - - [3520, 1088, 1, 64, 3520, 3520, 3520, 1088]
    - [0, 9.433]
  - - [3648, 1088, 1, 64, 3648, 3648, 3648, 1088]
    - [0, 10.338]
  - - [3776, 1088, 1, 64, 3776, 3776, 3776, 1088]
    - [0, 10.0]
  - - [3904, 1088, 1, 64, 3904, 3904, 3904, 1088]
    - [0, 10.281]
  - - [4032, 1088, 1, 64, 4032, 4032, 4032, 1088]
    - [0, 10.09]
  - - [64, 1216, 1, 64, 64, 64, 64, 1216]
    - [3, 0.324]
  - - [192, 1216, 1, 64, 192, 192, 192, 1216]
    - [0, 0.967]
  - - [320, 1216, 1, 64, 320, 320, 320, 1216]
    - [3, 3.116]
  - - [448, 1216, 1, 64, 448, 448, 448, 1216]
    - [3, 4.345]
  - - [576, 1216, 1, 64, 576, 576, 576, 1216]
    - [0, 6.785]
  - - [704, 1216, 1, 64, 704, 704, 704, 1216]
    - [0, 7.244]
  - - [832, 1216, 1, 64, 832, 832, 832, 1216]
    - [0, 7.681]
  - - [960, 1216, 1, 64, 960, 960, 960, 1216]
    - [0, 8.046]
  - - [1088, 1216, 1, 64, 1088, 1088, 1088, 1216]
    - [0, 8.302]
  - - [1216, 1216, 1, 64, 1216, 1216, 1216, 1216]
    - [0, 8.601]
  - - [1344, 1216, 1, 64, 1344, 1344, 1344, 1216]
    - [0, 8.808]
  - - [1472, 1216, 1, 64, 1472, 1472, 1472, 1216]
    - [0, 8.964]
  - - [1600, 1216, 1, 64, 1600, 1600, 1600, 1216]
    - [0, 9.16]
  - - [1728, 1216, 1, 64, 1728, 1728, 1728, 1216]
    - [0, 9.316]
  - - [1856, 1216, 1, 64, 1856, 1856, 1856, 1216]
    - [0, 9.41]
  - - [1984, 1216, 1, 64, 1984, 1984, 1984, 1216]
    - [0, 9.501]
  - - [2112, 1216, 1, 64, 2112, 2112, 2112, 1216]
    - [0, 9.785]
  - - [2240, 1216, 1, 64, 2240, 2240, 2240, 1216]
    - [0, 9.74]
  - - [2368, 1216, 1, 64, 2368, 2368, 2368, 1216]
    - [0, 9.838]
  - - [2496, 1216, 1, 64, 2496, 2496, 2496, 1216]
    - [0, 9.913]
  - - [2624, 1216, 1, 64, 2624, 2624, 2624, 1216]
    - [0, 9.891]
  - - [2752, 1216, 1, 64, 2752, 2752, 2752, 1216]
    - [0, 9.932]
  - - [2880, 1216, 1, 64, 2880, 2880, 2880, 1216]
    - [0, 9.833]
  - - [3008, 1216, 1, 64, 3008, 3008, 3008, 1216]
    - [0, 10.139]
  - - [3136, 1216, 1, 64, 3136, 3136, 3136, 1216]
    - [0, 9.797]
  - - [3264, 1216, 1, 64, 3264, 3264, 3264, 1216]
    - [0, 9.68]
  - - [3392, 1216, 1, 64, 3392, 3392, 3392, 1216]
    - [0, 9.497]
  - - [3520, 1216, 1, 64, 3520, 3520, 3520, 1216]
    - [0, 9.462]
  - - [3648, 1216, 1, 64, 3648, 3648, 3648, 1216]
    - [0, 9.556]
  - - [3776, 1216, 1, 64, 3776, 3776, 3776, 1216]
    - [0, 9.326]
  - - [3904, 1216, 1, 64, 3904, 3904, 3904, 1216]
    - [0, 10.014]
  - - [4032, 1216, 1, 64, 4032, 4032, 4032, 1216]
    - [0, 9.526]
  - - [64, 1344, 1, 64, 64, 64, 64, 1344]
    - [2, 1.766]
  - - [192, 1344, 1, 64, 192, 192, 192, 1344]
    - [0, 4.005]
  - - [320, 1344, 1, 64, 320, 320, 320, 1344]
    - [0, 5.5]
  - - [448, 1344, 1, 64, 448, 448, 448, 1344]
    - [0, 6.356]
  - - [576, 1344, 1, 64, 576, 576, 576, 1344]
    - [0, 7.052]
  - - [704, 1344, 1, 64, 704, 704, 704, 1344]
    - [0, 7.485]
  - - [832, 1344, 1, 64, 832, 832, 832, 1344]
    - [0, 7.94]
  - - [960, 1344, 1, 64, 960, 960, 960, 1344]
    - [0, 8.202]
  - - [1088, 1344, 1, 64, 1088, 1088, 1088, 1344]
    - [0, 8.538]
  - - [1216, 1344, 1, 64, 1216, 1216, 1216, 1344]
    - [0, 8.822]
  - - [1344, 1344, 1, 64, 1344, 1344, 1344, 1344]
    - [0, 9.013]
  - - [1472, 1344, 1, 64, 1472, 1472, 1472, 1344]
    - [0, 9.148]
  - - [1600, 1344, 1, 64, 1600, 1600, 1600, 1344]
    - [0, 9.333]
  - - [1728, 1344, 1, 64, 1728, 1728, 1728, 1344]
    - [0, 9.488]
  - - [1856, 1344, 1, 64, 1856, 1856, 1856, 1344]
    - [0, 9.579]
  - - [1984, 1344, 1, 64, 1984, 1984, 1984, 1344]
    - [0, 9.684]
  - - [2112, 1344, 1, 64, 2112, 2112, 2112, 1344]
    - [0, 9.826]
  - - [2240, 1344, 1, 64, 2240, 2240, 2240, 1344]
    - [0, 9.908]
  - - [2368, 1344, 1, 64, 2368, 2368, 2368, 1344]
    - [0, 9.892]
  - - [2496, 1344, 1, 64, 2496, 2496, 2496, 1344]
    - [0, 9.757]
  - - [2624, 1344, 1, 64, 2624, 2624, 2624, 1344]
    - [0, 9.939]
  - - [2752, 1344, 1, 64, 2752, 2752, 2752, 1344]
    - [0, 9.991]
  - - [2880, 1344, 1, 64, 2880, 2880, 2880, 1344]
    - [0, 9.598]
  - - [3008, 1344, 1, 64, 3008, 3008, 3008, 1344]
    - [0, 9.463]
  - - [3136, 1344, 1, 64, 3136, 3136, 3136, 1344]
    - [0, 9.676]
  - - [3264, 1344, 1, 64, 3264, 3264, 3264, 1344]
    - [0, 10.136]
  - - [3392, 1344, 1, 64, 3392, 3392, 3392, 1344]
    - [0, 9.552]
  - - [3520, 1344, 1, 64, 3520, 3520, 3520, 1344]
    - [0, 9.602]
  - - [3648, 1344, 1, 64, 3648, 3648, 3648, 1344]
    - [0, 9.442]
  - - [3776, 1344, 1, 64, 3776, 3776, 3776, 1344]
    - [0, 9.891]
  - - [3904, 1344, 1, 64, 3904, 3904, 3904, 1344]
    - [0, 10.232]
  - - [4032, 1344, 1, 64, 4032, 4032, 4032, 1344]
    - [0, 9.601]
  - - [64, 1472, 1, 64, 64, 64, 64, 1472]
    - [0, 1.957]
  - - [192, 1472, 1, 64, 192, 192, 192, 1472]
    - [0, 4.23]
  - - [320, 1472, 1, 64, 320, 320, 320, 1472]
    - [0, 5.932]
  - - [448, 1472, 1, 64, 448, 448, 448, 1472]
    - [0, 6.634]
  - - [576, 1472, 1, 64, 576, 576, 576, 1472]
    - [0, 7.196]
  - - [704, 1472, 1, 64, 704, 704, 704, 1472]
    - [0, 7.706]
  - - [832, 1472, 1, 64, 832, 832, 832, 1472]
    - [0, 8.189]
  - - [960, 1472, 1, 64, 960, 960, 960, 1472]
    - [0, 8.47]
  - - [1088, 1472, 1, 64, 1088, 1088, 1088, 1472]
    - [0, 8.736]
  - - [1216, 1472, 1, 64, 1216, 1216, 1216, 1472]
    - [0, 9.025]
  - - [1344, 1472, 1, 64, 1344, 1344, 1344, 1472]
    - [0, 9.196]
  - - [1472, 1472, 1, 64, 1472, 1472, 1472, 1472]
    - [0, 9.345]
  - - [1600, 1472, 1, 64, 1600, 1600, 1600, 1472]
    - [0, 9.485]
  - - [1728, 1472, 1, 64, 1728, 1728, 1728, 1472]
    - [0, 9.716]
  - - [1856, 1472, 1, 64, 1856, 1856, 1856, 1472]
    - [0, 9.762]
  - - [1984, 1472, 1, 64, 1984, 1984, 1984, 1472]
    - [0, 9.796]
  - - [2112, 1472, 1, 64, 2112, 2112, 2112, 1472]
    - [0, 10.101]
  - - [2240, 1472, 1, 64, 2240, 2240, 2240, 1472]
    - [0, 9.887]
  - - [2368, 1472, 1, 64, 2368, 2368, 2368, 1472]
    - [0, 9.776]
  - - [2496, 1472, 1, 64, 2496, 2496, 2496, 1472]
    - [0, 10.07]
  - - [2624, 1472, 1, 64, 2624, 2624, 2624, 1472]
    - [0, 9.835]
  - - [2752, 1472, 1, 64, 2752, 2752, 2752, 1472]
    - [0, 9.713]
  - - [2880, 1472, 1, 64, 2880, 2880, 2880, 1472]
    - [0, 9.492]
  - - [3008, 1472, 1, 64, 3008, 3008, 3008, 1472]
    - [0, 10.054]
  - - [3136, 1472, 1, 64, 3136, 3136, 3136, 1472]
    - [0, 9.386]
  - - [3264, 1472, 1, 64, 3264, 3264, 3264, 1472]
    - [0, 9.962]
  - - [3392, 1472, 1, 64, 3392, 3392, 3392, 1472]
    - [0, 9.086]
  - - [3520, 1472, 1, 64, 3520, 3520, 3520, 1472]
    - [0, 9.455]
  - - [3648, 1472, 1, 64, 3648, 3648, 3648, 1472]
    - [0, 9.857]
  - - [3776, 1472, 1, 64, 3776, 3776, 3776, 1472]
    - [0, 9.733]
  - - [3904, 1472, 1, 64, 3904, 3904, 3904, 1472]
    - [0, 9.533]
  - - [4032, 1472, 1, 64, 4032, 4032, 4032, 1472]
    - [0, 9.98]
  - - [64, 1600, 1, 64, 64, 64, 64, 1600]
    - [0, 2.03]
  - - [192, 1600, 1, 64, 192, 192, 192, 1600]
    - [0, 4.422]
  - - [320, 1600, 1, 64, 320, 320, 320, 1600]
    - [0, 5.979]
  - - [448, 1600, 1, 64, 448, 448, 448, 1600]
    - [0, 6.906]
  - - [576, 1600, 1, 64, 576, 576, 576, 1600]
    - [0, 7.406]
  - - [704, 1600, 1, 64, 704, 704, 704, 1600]
    - [0, 7.936]
  - - [832, 1600, 1, 64, 832, 832, 832, 1600]
    - [0, 8.361]
  - - [960, 1600, 1, 64, 960, 960, 960, 1600]
    - [0, 8.647]
  - - [1088, 1600, 1, 64, 1088, 1088, 1088, 1600]
    - [0, 8.922]
  - - [1216, 1600, 1, 64, 1216, 1216, 1216, 1600]
    - [0, 9.167]
  - - [1344, 1600, 1, 64, 1344, 1344, 1344, 1600]
    - [0, 9.345]
  - - [1472, 1600, 1, 64, 1472, 1472, 1472, 1600]
    - [0, 9.478]
  - - [1600, 1600, 1, 64, 1600, 1600, 1600, 1600]
    - [0, 9.647]
  - - [1728, 1600, 1, 64, 1728, 1728, 1728, 1600]
    - [0, 9.79]
  - - [1856, 1600, 1, 64, 1856, 1856, 1856, 1600]
    - [0, 9.895]
  - - [1984, 1600, 1, 64, 1984, 1984, 1984, 1600]
    - [0, 9.923]
  - - [2112, 1600, 1, 64, 2112, 2112, 2112, 1600]
    - [0, 10.179]
  - - [2240, 1600, 1, 64, 2240, 2240, 2240, 1600]
    - [0, 10.119]
  - - [2368, 1600, 1, 64, 2368, 2368, 2368, 1600]
    - [0, 9.67]
  - - [2496, 1600, 1, 64, 2496, 2496, 2496, 1600]
    - [0, 9.488]
  - - [2624, 1600, 1, 64, 2624, 2624, 2624, 1600]
    - [0, 9.604]
  - - [2752, 1600, 1, 64, 2752, 2752, 2752, 1600]
    - [0, 10.308]
  - - [2880, 1600, 1, 64, 2880, 2880, 2880, 1600]
    - [0, 9.552]
  - - [3008, 1600, 1, 64, 3008, 3008, 3008, 1600]
    - [0, 9.646]
  - - [3136, 1600, 1, 64, 3136, 3136, 3136, 1600]
    - [0, 9.452]
  - - [3264, 1600, 1, 64, 3264, 3264, 3264, 1600]
    - [0, 9.38]
  - - [3392, 1600, 1, 64, 3392, 3392, 3392, 1600]
    - [0, 9.271]
  - - [3520, 1600, 1, 64, 3520, 3520, 3520, 1600]
    - [0, 9.619]
  - - [3648, 1600, 1, 64, 3648, 3648, 3648, 1600]
    - [0, 9.705]
  - - [3776, 1600, 1, 64, 3776, 3776, 3776, 1600]
    - [0, 9.492]
  - - [3904, 1600, 1, 64, 3904, 3904, 3904, 1600]
    - [0, 9.802]
  - - [4032, 1600, 1, 64, 4032, 4032, 4032, 1600]
    - [0, 9.44]
  - - [64, 1728, 1, 64, 64, 64, 64, 1728]
    - [2, 2.175]
  - - [192, 1728, 1, 64, 192, 192, 192, 1728]
    - [0, 4.679]
  - - [320, 1728, 1, 64, 320, 320, 320, 1728]
    - [0, 6.219]
  - - [448, 1728, 1, 64, 448, 448, 448, 1728]
    - [0, 7.029]
  - - [576, 1728, 1, 64, 576, 576, 576, 1728]
    - [0, 7.603]
  - - [704, 1728, 1, 64, 704, 704, 704, 1728]
    - [0, 8.141]
  - - [832, 1728, 1, 64, 832, 832, 832, 1728]
    - [0, 8.541]
  - - [960, 1728, 1, 64, 960, 960, 960, 1728]
    - [0, 8.835]
  - - [1088, 1728, 1, 64, 1088, 1088, 1088, 1728]
    - [0, 9.066]
  - - [1216, 1728, 1, 64, 1216, 1216, 1216, 1728]
    - [0, 9.324]
  - - [1344, 1728, 1, 64, 1344, 1344, 1344, 1728]
    - [0, 9.499]
  - - [1472, 1728, 1, 64, 1472, 1472, 1472, 1728]
    - [0, 9.6]
  - - [1600, 1728, 1, 64, 1600, 1600, 1600, 1728]
    - [0, 9.731]
  - - [1728, 1728, 1, 64, 1728, 1728, 1728, 1728]
    - [0, 10.022]
  - - [1856, 1728, 1, 64, 1856, 1856, 1856, 1728]
    - [0, 10.022]
  - - [1984, 1728, 1, 64, 1984, 1984, 1984, 1728]
    - [0, 10.086]
  - - [2112, 1728, 1, 64, 2112, 2112, 2112, 1728]
    - [0, 10.024]
  - - [2240, 1728, 1, 64, 2240, 2240, 2240, 1728]
    - [0, 10.111]
  - - [2368, 1728, 1, 64, 2368, 2368, 2368, 1728]
    - [0, 9.818]
  - - [2496, 1728, 1, 64, 2496, 2496, 2496, 1728]
    - [0, 9.895]
  - - [2624, 1728, 1, 64, 2624, 2624, 2624, 1728]
    - [0, 9.858]
  - - [2752, 1728, 1, 64, 2752, 2752, 2752, 1728]
    - [0, 10.308]
  - - [2880, 1728, 1, 64, 2880, 2880, 2880, 1728]
    - [0, 9.875]
  - - [3008, 1728, 1, 64, 3008, 3008, 3008, 1728]
    - [0, 9.397]
  - - [3136, 1728, 1, 64, 3136, 3136, 3136, 1728]
    - [0, 9.519]
  - - [3264, 1728, 1, 64, 3264, 3264, 3264, 1728]
    - [0, 10.263]
  - - [3392, 1728, 1, 64, 3392, 3392, 3392, 1728]
    - [0, 9.631]
  - - [3520, 1728, 1, 64, 3520, 3520, 3520, 1728]
    - [0, 9.756]
  - - [3648, 1728, 1, 64, 3648, 3648, 3648, 1728]
    - [0, 10.33]
  - - [3776, 1728, 1, 64, 3776, 3776, 3776, 1728]
    - [0, 9.797]
  - - [3904, 1728, 1, 64, 3904, 3904, 3904, 1728]
    - [0, 10.459]
  - - [4032, 1728, 1, 64, 4032, 4032, 4032, 1728]
    - [0, 9.925]
  - - [64, 1856, 1, 64, 64, 64, 64, 1856]
    - [3, 0.493]
  - - [192, 1856, 1, 64, 192, 192, 192, 1856]
    - [3, 1.479]
  - - [320, 1856, 1, 64, 320, 320, 320, 1856]
    - [1, 4.714]
  - - [448, 1856, 1, 64, 448, 448, 448, 1856]
    - [0, 6.615]
  - - [576, 1856, 1, 64, 576, 576, 576, 1856]
    - [0, 7.837]
  - - [704, 1856, 1, 64, 704, 704, 704, 1856]
    - [0, 8.297]
  - - [832, 1856, 1, 64, 832, 832, 832, 1856]
    - [0, 8.704]
  - - [960, 1856, 1, 64, 960, 960, 960, 1856]
    - [0, 8.947]
  - - [1088, 1856, 1, 64, 1088, 1088, 1088, 1856]
    - [0, 9.222]
  - - [1216, 1856, 1, 64, 1216, 1216, 1216, 1856]
    - [0, 9.418]
  - - [1344, 1856, 1, 64, 1344, 1344, 1344, 1856]
    - [0, 9.639]
  - - [1472, 1856, 1, 64, 1472, 1472, 1472, 1856]
    - [0, 9.829]
  - - [1600, 1856, 1, 64, 1600, 1600, 1600, 1856]
    - [0, 9.868]
  - - [1728, 1856, 1, 64, 1728, 1728, 1728, 1856]
    - [0, 10.148]
  - - [1856, 1856, 1, 64, 1856, 1856, 1856, 1856]
    - [0, 10.059]
  - - [1984, 1856, 1, 64, 1984, 1984, 1984, 1856]
    - [0, 10.092]
  - - [2112, 1856, 1, 64, 2112, 2112, 2112, 1856]
    - [0, 10.185]
  - - [2240, 1856, 1, 64, 2240, 2240, 2240, 1856]
    - [0, 9.869]
  - - [2368, 1856, 1, 64, 2368, 2368, 2368, 1856]
    - [0, 9.745]
  - - [2496, 1856, 1, 64, 2496, 2496, 2496, 1856]
    - [0, 9.985]
  - - [2624, 1856, 1, 64, 2624, 2624, 2624, 1856]
    - [0, 9.698]
  - - [2752, 1856, 1, 64, 2752, 2752, 2752, 1856]
    - [0, 9.421]
  - - [2880, 1856, 1, 64, 2880, 2880, 2880, 1856]
    - [0, 9.704]
  - - [3008, 1856, 1, 64, 3008, 3008, 3008, 1856]
    - [0, 9.654]
  - - [3136, 1856, 1, 64, 3136, 3136, 3136, 1856]
    - [0, 9.439]
  - - [3264, 1856, 1, 64, 3264, 3264, 3264, 1856]
    - [0, 9.541]
  - - [3392, 1856, 1, 64, 3392, 3392, 3392, 1856]
    - [0, 9.621]
  - - [3520, 1856, 1, 64, 3520, 3520, 3520, 1856]
    - [0, 9.464]
  - - [3648, 1856, 1, 64, 3648, 3648, 3648, 1856]
    - [0, 9.797]
  - - [3776, 1856, 1, 64, 3776, 3776, 3776, 1856]
    - [0, 9.863]
  - - [3904, 1856, 1, 64, 3904, 3904, 3904, 1856]
    - [0, 9.784]
  - - [4032, 1856, 1, 64, 4032, 4032, 4032, 1856]
    - [0, 9.827]
  - - [64, 1984, 1, 64, 64, 64, 64, 1984]
    - [3, 2.428]
  - - [192, 1984, 1, 64, 192, 192, 192, 1984]
    - [0, 5.136]
  - - [320, 1984, 1, 64, 320, 320, 320, 1984]
    - [0, 6.631]
  - - [448, 1984, 1, 64, 448, 448, 448, 1984]
    - [0, 7.306]
  - - [576, 1984, 1, 64, 576, 576, 576, 1984]
    - [0, 7.97]
  - - [704, 1984, 1, 64, 704, 704, 704, 1984]
    - [0, 8.458]
  - - [832, 1984, 1, 64, 832, 832, 832, 1984]
    - [0, 8.836]
  - - [960, 1984, 1, 64, 960, 960, 960, 1984]
    - [0, 9.086]
  - - [1088, 1984, 1, 64, 1088, 1088, 1088, 1984]
    - [0, 9.327]
  - - [1216, 1984, 1, 64, 1216, 1216, 1216, 1984]
    - [0, 9.708]
  - - [1344, 1984, 1, 64, 1344, 1344, 1344, 1984]
    - [0, 9.749]
  - - [1472, 1984, 1, 64, 1472, 1472, 1472, 1984]
    - [0, 9.825]
  - - [1600, 1984, 1, 64, 1600, 1600, 1600, 1984]
    - [0, 9.947]
  - - [1728, 1984, 1, 64, 1728, 1728, 1728, 1984]
    - [0, 9.844]
  - - [1856, 1984, 1, 64, 1856, 1856, 1856, 1984]
    - [0, 9.785]
  - - [1984, 1984, 1, 64, 1984, 1984, 1984, 1984]
    - [0, 9.97]
  - - [2112, 1984, 1, 64, 2112, 2112, 2112, 1984]
    - [0, 10.379]
  - - [2240, 1984, 1, 64, 2240, 2240, 2240, 1984]
    - [0, 10.352]
  - - [2368, 1984, 1, 64, 2368, 2368, 2368, 1984]
    - [0, 10.045]
  - - [2496, 1984, 1, 64, 2496, 2496, 2496, 1984]
    - [0, 9.83]
  - - [2624, 1984, 1, 64, 2624, 2624, 2624, 1984]
    - [0, 9.588]
  - - [2752, 1984, 1, 64, 2752, 2752, 2752, 1984]
    - [0, 9.517]
  - - [2880, 1984, 1, 64, 2880, 2880, 2880, 1984]
    - [0, 9.59]
  - - [3008, 1984, 1, 64, 3008, 3008, 3008, 1984]
    - [0, 9.264]
  - - [3136, 1984, 1, 64, 3136, 3136, 3136, 1984]
    - [0, 9.496]
  - - [3264, 1984, 1, 64, 3264, 3264, 3264, 1984]
    - [0, 9.583]
  - - [3392, 1984, 1, 64, 3392, 3392, 3392, 1984]
    - [0, 9.473]
  - - [3520, 1984, 1, 64, 3520, 3520, 3520, 1984]
    - [0, 9.455]
  - - [3648, 1984, 1, 64, 3648, 3648, 3648, 1984]
    - [0, 9.577]
  - - [3776, 1984, 1, 64, 3776, 3776, 3776, 1984]
    - [0, 9.707]
  - - [3904, 1984, 1, 64, 3904, 3904, 3904, 1984]
    - [0, 9.587]
  - - [4032, 1984, 1, 64, 4032, 4032, 4032, 1984]
    - [0, 9.964]
  - - [64, 2112, 1, 64, 64, 64, 64, 2112]
    - [2, 2.606]
  - - [192, 2112, 1, 64, 192, 192, 192, 2112]
    - [0, 5.342]
  - - [320, 2112, 1, 64, 320, 320, 320, 2112]
    - [0, 6.715]
  - - [448, 2112, 1, 64, 448, 448, 448, 2112]
    - [0, 7.449]
  - - [576, 2112, 1, 64, 576, 576, 576, 2112]
    - [0, 8.143]
  - - [704, 2112, 1, 64, 704, 704, 704, 2112]
    - [0, 8.591]
  - - [832, 2112, 1, 64, 832, 832, 832, 2112]
    - [0, 8.963]
  - - [960, 2112, 1, 64, 960, 960, 960, 2112]
    - [0, 9.225]
  - - [1088, 2112, 1, 64, 1088, 1088, 1088, 2112]
    - [0, 9.477]
  - - [1216, 2112, 1, 64, 1216, 1216, 1216, 2112]
    - [0, 9.752]
  - - [1344, 2112, 1, 64, 1344, 1344, 1344, 2112]
    - [0, 9.951]
  - - [1472, 2112, 1, 64, 1472, 1472, 1472, 2112]
    - [0, 9.946]
  - - [1600, 2112, 1, 64, 1600, 1600, 1600, 2112]
    - [0, 9.931]
  - - [1728, 2112, 1, 64, 1728, 1728, 1728, 2112]
    - [0, 9.761]
  - - [1856, 2112, 1, 64, 1856, 1856, 1856, 2112]
    - [0, 10.14]
  - - [1984, 2112, 1, 64, 1984, 1984, 1984, 2112]
    - [0, 9.83]
  - - [2112, 2112, 1, 64, 2112, 2112, 2112, 2112]
    - [0, 10.128]
  - - [2240, 2112, 1, 64, 2240, 2240, 2240, 2112]
    - [0, 10.538]
  - - [2368, 2112, 1, 64, 2368, 2368, 2368, 2112]
    - [0, 9.844]
  - - [2496, 2112, 1, 64, 2496, 2496, 2496, 2112]
    - [0, 10.441]
  - - [2624, 2112, 1, 64, 2624, 2624, 2624, 2112]
    - [0, 9.424]
  - - [2752, 2112, 1, 64, 2752, 2752, 2752, 2112]
    - [0, 10.555]
  - - [2880, 2112, 1, 64, 2880, 2880, 2880, 2112]
    - [0, 9.826]
  - - [3008, 2112, 1, 64, 3008, 3008, 3008, 2112]
    - [0, 9.453]
  - - [3136, 2112, 1, 64, 3136, 3136, 3136, 2112]
    - [0, 9.756]
  - - [3264, 2112, 1, 64, 3264, 3264, 3264, 2112]
    - [0, 9.765]
  - - [3392, 2112, 1, 64, 3392, 3392, 3392, 2112]
    - [0, 9.585]
  - - [3520, 2112, 1, 64, 3520, 3520, 3520, 2112]
    - [2, 9.382]
  - - [3648, 2112, 1, 64, 3648, 3648, 3648, 2112]
    - [0, 9.881]
  - - [3776, 2112, 1, 64, 3776, 3776, 3776, 2112]
    - [0, 10.312]
  - - [3904, 2112, 1, 64, 3904, 3904, 3904, 2112]
    - [0, 10.149]
  - - [4032, 2112, 1, 64, 4032, 4032, 4032, 2112]
    - [0, 10.224]
  - - [64, 2240, 1, 64, 64, 64, 64, 2240]
    - [0, 2.806]
  - - [192, 2240, 1, 64, 192, 192, 192, 2240]
    - [0, 5.495]
  - - [320, 2240, 1, 64, 320, 320, 320, 2240]
    - [0, 6.858]
  - - [448, 2240, 1, 64, 448, 448, 448, 2240]
    - [0, 7.632]
  - - [576, 2240, 1, 64, 576, 576, 576, 2240]
    - [0, 8.232]
  - - [704, 2240, 1, 64, 704, 704, 704, 2240]
    - [0, 8.709]
  - - [832, 2240, 1, 64, 832, 832, 832, 2240]
    - [0, 9.079]
  - - [960, 2240, 1, 64, 960, 960, 960, 2240]
    - [0, 9.341]
  - - [1088, 2240, 1, 64, 1088, 1088, 1088, 2240]
    - [0, 9.695]
  - - [1216, 2240, 1, 64, 1216, 1216, 1216, 2240]
    - [0, 9.892]
  - - [1344, 2240, 1, 64, 1344, 1344, 1344, 2240]
    - [0, 9.909]
  - - [1472, 2240, 1, 64, 1472, 1472, 1472, 2240]
    - [0, 9.764]
  - - [1600, 2240, 1, 64, 1600, 1600, 1600, 2240]
    - [0, 9.646]
  - - [1728, 2240, 1, 64, 1728, 1728, 1728, 2240]
    - [0, 9.439]
  - - [1856, 2240, 1, 64, 1856, 1856, 1856, 2240]
    - [0, 9.666]
  - - [1984, 2240, 1, 64, 1984, 1984, 1984, 2240]
    - [0, 9.473]
  - - [2112, 2240, 1, 64, 2112, 2112, 2112, 2240]
    - [0, 10.045]
  - - [2240, 2240, 1, 64, 2240, 2240, 2240, 2240]
    - [0, 9.286]
  - - [2368, 2240, 1, 64, 2368, 2368, 2368, 2240]
    - [0, 9.411]
  - - [2496, 2240, 1, 64, 2496, 2496, 2496, 2240]
    - [0, 9.581]
  - - [2624, 2240, 1, 64, 2624, 2624, 2624, 2240]
    - [0, 9.832]
  - - [2752, 2240, 1, 64, 2752, 2752, 2752, 2240]
    - [0, 9.526]
  - - [2880, 2240, 1, 64, 2880, 2880, 2880, 2240]
    - [0, 9.63]
  - - [3008, 2240, 1, 64, 3008, 3008, 3008, 2240]
    - [2, 9.081]
  - - [3136, 2240, 1, 64, 3136, 3136, 3136, 2240]
    - [0, 9.765]
  - - [3264, 2240, 1, 64, 3264, 3264, 3264, 2240]
    - [0, 9.743]
  - - [3392, 2240, 1, 64, 3392, 3392, 3392, 2240]
    - [0, 9.592]
  - - [3520, 2240, 1, 64, 3520, 3520, 3520, 2240]
    - [0, 9.689]
  - - [3648, 2240, 1, 64, 3648, 3648, 3648, 2240]
    - [0, 9.322]
  - - [3776, 2240, 1, 64, 3776, 3776, 3776, 2240]
    - [0, 9.756]
  - - [3904, 2240, 1, 64, 3904, 3904, 3904, 2240]
    - [0, 9.726]
  - - [4032, 2240, 1, 64, 4032, 4032, 4032, 2240]
    - [0, 9.685]
  - - [64, 2368, 1, 64, 64, 64, 64, 2368]
    - [3, 1.223]
  - - [192, 2368, 1, 64, 192, 192, 192, 2368]
    - [0, 1.884]
  - - [320, 2368, 1, 64, 320, 320, 320, 2368]
    - [0, 6.099]
  - - [448, 2368, 1, 64, 448, 448, 448, 2368]
    - [0, 7.755]
  - - [576, 2368, 1, 64, 576, 576, 576, 2368]
    - [0, 8.348]
  - - [704, 2368, 1, 64, 704, 704, 704, 2368]
    - [0, 8.841]
  - - [832, 2368, 1, 64, 832, 832, 832, 2368]
    - [0, 9.177]
  - - [960, 2368, 1, 64, 960, 960, 960, 2368]
    - [0, 9.397]
  - - [1088, 2368, 1, 64, 1088, 1088, 1088, 2368]
    - [0, 9.642]
  - - [1216, 2368, 1, 64, 1216, 1216, 1216, 2368]
    - [0, 9.87]
  - - [1344, 2368, 1, 64, 1344, 1344, 1344, 2368]
    - [0, 9.991]
  - - [1472, 2368, 1, 64, 1472, 1472, 1472, 2368]
    - [0, 10.08]
  - - [1600, 2368, 1, 64, 1600, 1600, 1600, 2368]
    - [0, 10.166]
  - - [1728, 2368, 1, 64, 1728, 1728, 1728, 2368]
    - [0, 10.023]
  - - [1856, 2368, 1, 64, 1856, 1856, 1856, 2368]
    - [0, 9.729]
  - - [1984, 2368, 1, 64, 1984, 1984, 1984, 2368]
    - [0, 9.685]
  - - [2112, 2368, 1, 64, 2112, 2112, 2112, 2368]
    - [0, 10.533]
  - - [2240, 2368, 1, 64, 2240, 2240, 2240, 2368]
    - [0, 9.608]
  - - [2368, 2368, 1, 64, 2368, 2368, 2368, 2368]
    - [0, 9.664]
  - - [2496, 2368, 1, 64, 2496, 2496, 2496, 2368]
    - [0, 10.322]
  - - [2624, 2368, 1, 64, 2624, 2624, 2624, 2368]
    - [0, 9.583]
  - - [2752, 2368, 1, 64, 2752, 2752, 2752, 2368]
    - [0, 9.787]
  - - [2880, 2368, 1, 64, 2880, 2880, 2880, 2368]
    - [0, 9.607]
  - - [3008, 2368, 1, 64, 3008, 3008, 3008, 2368]
    - [0, 9.523]
  - - [3136, 2368, 1, 64, 3136, 3136, 3136, 2368]
    - [0, 9.684]
  - - [3264, 2368, 1, 64, 3264, 3264, 3264, 2368]
    - [0, 9.648]
  - - [3392, 2368, 1, 64, 3392, 3392, 3392, 2368]
    - [0, 9.962]
  - - [3520, 2368, 1, 64, 3520, 3520, 3520, 2368]
    - [2, 9.436]
  - - [3648, 2368, 1, 64, 3648, 3648, 3648, 2368]
    - [0, 9.853]
  - - [3776, 2368, 1, 64, 3776, 3776, 3776, 2368]
    - [0, 10.169]
  - - [3904, 2368, 1, 64, 3904, 3904, 3904, 2368]
    - [0, 9.72]
  - - [4032, 2368, 1, 64, 4032, 4032, 4032, 2368]
    - [0, 9.844]
  - - [64, 2496, 1, 64, 64, 64, 64, 2496]
    - [3, 0.664]
  - - [192, 2496, 1, 64, 192, 192, 192, 2496]
    - [0, 1.976]
  - - [320, 2496, 1, 64, 320, 320, 320, 2496]
    - [3, 6.338]
  - - [448, 2496, 1, 64, 448, 448, 448, 2496]
    - [0, 7.874]
  - - [576, 2496, 1, 64, 576, 576, 576, 2496]
    - [0, 8.537]
  - - [704, 2496, 1, 64, 704, 704, 704, 2496]
    - [0, 8.945]
  - - [832, 2496, 1, 64, 832, 832, 832, 2496]
    - [0, 9.292]
  - - [960, 2496, 1, 64, 960, 960, 960, 2496]
    - [0, 9.503]
  - - [1088, 2496, 1, 64, 1088, 1088, 1088, 2496]
    - [0, 9.695]
  - - [1216, 2496, 1, 64, 1216, 1216, 1216, 2496]
    - [0, 9.587]
  - - [1344, 2496, 1, 64, 1344, 1344, 1344, 2496]
    - [0, 9.964]
  - - [1472, 2496, 1, 64, 1472, 1472, 1472, 2496]
    - [0, 10.177]
  - - [1600, 2496, 1, 64, 1600, 1600, 1600, 2496]
    - [0, 9.665]
  - - [1728, 2496, 1, 64, 1728, 1728, 1728, 2496]
    - [0, 9.596]
  - - [1856, 2496, 1, 64, 1856, 1856, 1856, 2496]
    - [2, 9.584]
  - - [1984, 2496, 1, 64, 1984, 1984, 1984, 2496]
    - [0, 9.742]
  - - [2112, 2496, 1, 64, 2112, 2112, 2112, 2496]
    - [0, 9.819]
  - - [2240, 2496, 1, 64, 2240, 2240, 2240, 2496]
    - [0, 9.744]
  - - [2368, 2496, 1, 64, 2368, 2368, 2368, 2496]
    - [0, 9.662]
  - - [2496, 2496, 1, 64, 2496, 2496, 2496, 2496]
    - [0, 9.643]
  - - [2624, 2496, 1, 64, 2624, 2624, 2624, 2496]
    - [0, 9.919]
  - - [2752, 2496, 1, 64, 2752, 2752, 2752, 2496]
    - [0, 9.405]
  - - [2880, 2496, 1, 64, 2880, 2880, 2880, 2496]
    - [0, 9.744]
  - - [3008, 2496, 1, 64, 3008, 3008, 3008, 2496]
    - [2, 9.347]
  - - [3136, 2496, 1, 64, 3136, 3136, 3136, 2496]
    - [2, 9.372]
  - - [3264, 2496, 1, 64, 3264, 3264, 3264, 2496]
    - [2, 9.504]
  - - [3392, 2496, 1, 64, 3392, 3392, 3392, 2496]
    - [0, 9.655]
  - - [3520, 2496, 1, 64, 3520, 3520, 3520, 2496]
    - [0, 9.763]
  - - [3648, 2496, 1, 64, 3648, 3648, 3648, 2496]
    - [0, 10.066]
  - - [3776, 2496, 1, 64, 3776, 3776, 3776, 2496]
    - [0, 9.76]
  - - [3904, 2496, 1, 64, 3904, 3904, 3904, 2496]
    - [0, 9.896]
  - - [4032, 2496, 1, 64, 4032, 4032, 4032, 2496]
    - [0, 9.971]
  - - [64, 2624, 1, 64, 64, 64, 64, 2624]
    - [3, 0.694]
  - - [192, 2624, 1, 64, 192, 192, 192, 2624]
    - [0, 5.901]
  - - [320, 2624, 1, 64, 320, 320, 320, 2624]
    - [2, 6.802]
  - - [448, 2624, 1, 64, 448, 448, 448, 2624]
    - [0, 8.035]
  - - [576, 2624, 1, 64, 576, 576, 576, 2624]
    - [0, 8.631]
  - - [704, 2624, 1, 64, 704, 704, 704, 2624]
    - [0, 9.018]
  - - [832, 2624, 1, 64, 832, 832, 832, 2624]
    - [0, 9.37]
  - - [960, 2624, 1, 64, 960, 960, 960, 2624]
    - [0, 9.713]
  - - [1088, 2624, 1, 64, 1088, 1088, 1088, 2624]
    - [0, 9.788]
  - - [1216, 2624, 1, 64, 1216, 1216, 1216, 2624]
    - [0, 9.999]
  - - [1344, 2624, 1, 64, 1344, 1344, 1344, 2624]
    - [0, 10.152]
  - - [1472, 2624, 1, 64, 1472, 1472, 1472, 2624]
    - [0, 10.212]
  - - [1600, 2624, 1, 64, 1600, 1600, 1600, 2624]
    - [0, 10.08]
  - - [1728, 2624, 1, 64, 1728, 1728, 1728, 2624]
    - [0, 10.087]
  - - [1856, 2624, 1, 64, 1856, 1856, 1856, 2624]
    - [0, 9.722]
  - - [1984, 2624, 1, 64, 1984, 1984, 1984, 2624]
    - [0, 9.707]
  - - [2112, 2624, 1, 64, 2112, 2112, 2112, 2624]
    - [0, 10.025]
  - - [2240, 2624, 1, 64, 2240, 2240, 2240, 2624]
    - [0, 9.599]
  - - [2368, 2624, 1, 64, 2368, 2368, 2368, 2624]
    - [0, 10.2]
  - - [2496, 2624, 1, 64, 2496, 2496, 2496, 2624]
    - [0, 9.383]
  - - [2624, 2624, 1, 64, 2624, 2624, 2624, 2624]
    - [0, 10.119]
  - - [2752, 2624, 1, 64, 2752, 2752, 2752, 2624]
    - [0, 9.533]
  - - [2880, 2624, 1, 64, 2880, 2880, 2880, 2624]
    - [0, 9.738]
  - - [3008, 2624, 1, 64, 3008, 3008, 3008, 2624]
    - [0, 9.506]
  - - [3136, 2624, 1, 64, 3136, 3136, 3136, 2624]
    - [0, 9.705]
  - - [3264, 2624, 1, 64, 3264, 3264, 3264, 2624]
    - [0, 9.989]
  - - [3392, 2624, 1, 64, 3392, 3392, 3392, 2624]
    - [0, 9.642]
  - - [3520, 2624, 1, 64, 3520, 3520, 3520, 2624]
    - [0, 10.089]
  - - [3648, 2624, 1, 64, 3648, 3648, 3648, 2624]
    - [0, 9.763]
  - - [3776, 2624, 1, 64, 3776, 3776, 3776, 2624]
    - [0, 9.982]
  - - [3904, 2624, 1, 64, 3904, 3904, 3904, 2624]
    - [0, 10.123]
  - - [4032, 2624, 1, 64, 4032, 4032, 4032, 2624]
    - [0, 9.946]
  - - [64, 2752, 1, 64, 64, 64, 64, 2752]
    - [2, 0.725]
  - - [192, 2752, 1, 64, 192, 192, 192, 2752]
    - [1, 4.192]
  - - [320, 2752, 1, 64, 320, 320, 320, 2752]
    - [0, 7.306]
  - - [448, 2752, 1, 64, 448, 448, 448, 2752]
    - [0, 8.12]
  - - [576, 2752, 1, 64, 576, 576, 576, 2752]
    - [0, 8.724]
  - - [704, 2752, 1, 64, 704, 704, 704, 2752]
    - [0, 9.126]
  - - [832, 2752, 1, 64, 832, 832, 832, 2752]
    - [0, 9.471]
  - - [960, 2752, 1, 64, 960, 960, 960, 2752]
    - [0, 9.663]
  - - [1088, 2752, 1, 64, 1088, 1088, 1088, 2752]
    - [0, 9.9]
  - - [1216, 2752, 1, 64, 1216, 1216, 1216, 2752]
    - [0, 9.884]
  - - [1344, 2752, 1, 64, 1344, 1344, 1344, 2752]
    - [0, 10.085]
  - - [1472, 2752, 1, 64, 1472, 1472, 1472, 2752]
    - [0, 10.422]
  - - [1600, 2752, 1, 64, 1600, 1600, 1600, 2752]
    - [0, 10.275]
  - - [1728, 2752, 1, 64, 1728, 1728, 1728, 2752]
    - [0, 10.41]
  - - [1856, 2752, 1, 64, 1856, 1856, 1856, 2752]
    - [0, 9.836]
  - - [1984, 2752, 1, 64, 1984, 1984, 1984, 2752]
    - [0, 9.863]
  - - [2112, 2752, 1, 64, 2112, 2112, 2112, 2752]
    - [0, 9.64]
  - - [2240, 2752, 1, 64, 2240, 2240, 2240, 2752]
    - [0, 9.473]
  - - [2368, 2752, 1, 64, 2368, 2368, 2368, 2752]
    - [0, 9.723]
  - - [2496, 2752, 1, 64, 2496, 2496, 2496, 2752]
    - [0, 9.344]
  - - [2624, 2752, 1, 64, 2624, 2624, 2624, 2752]
    - [0, 9.638]
  - - [2752, 2752, 1, 64, 2752, 2752, 2752, 2752]
    - [0, 9.685]
  - - [2880, 2752, 1, 64, 2880, 2880, 2880, 2752]
    - [0, 9.645]
  - - [3008, 2752, 1, 64, 3008, 3008, 3008, 2752]
    - [2, 9.564]
  - - [3136, 2752, 1, 64, 3136, 3136, 3136, 2752]
    - [0, 9.933]
  - - [3264, 2752, 1, 64, 3264, 3264, 3264, 2752]
    - [0, 9.894]
  - - [3392, 2752, 1, 64, 3392, 3392, 3392, 2752]
    - [0, 9.984]
  - - [3520, 2752, 1, 64, 3520, 3520, 3520, 2752]
    - [0, 9.889]
  - - [3648, 2752, 1, 64, 3648, 3648, 3648, 2752]
    - [0, 9.878]
  - - [3776, 2752, 1, 64, 3776, 3776, 3776, 2752]
    - [0, 10.204]
  - - [3904, 2752, 1, 64, 3904, 3904, 3904, 2752]
    - [0, 9.7]
  - - [4032, 2752, 1, 64, 4032, 4032, 4032, 2752]
    - [0, 9.829]
  - - [64, 2880, 1, 64, 64, 64, 64, 2880]
    - [1, 0.762]
  - - [192, 2880, 1, 64, 192, 192, 192, 2880]
    - [0, 4.442]
  - - [320, 2880, 1, 64, 320, 320, 320, 2880]
    - [0, 7.442]
  - - [448, 2880, 1, 64, 448, 448, 448, 2880]
    - [0, 8.221]
  - - [576, 2880, 1, 64, 576, 576, 576, 2880]
    - [0, 8.823]
  - - [704, 2880, 1, 64, 704, 704, 704, 2880]
    - [0, 9.221]
  - - [832, 2880, 1, 64, 832, 832, 832, 2880]
    - [0, 9.554]
  - - [960, 2880, 1, 64, 960, 960, 960, 2880]
    - [0, 9.764]
  - - [1088, 2880, 1, 64, 1088, 1088, 1088, 2880]
    - [0, 9.876]
  - - [1216, 2880, 1, 64, 1216, 1216, 1216, 2880]
    - [0, 9.906]
  - - [1344, 2880, 1, 64, 1344, 1344, 1344, 2880]
    - [0, 10.246]
  - - [1472, 2880, 1, 64, 1472, 1472, 1472, 2880]
    - [0, 9.897]
  - - [1600, 2880, 1, 64, 1600, 1600, 1600, 2880]
    - [0, 9.605]
  - - [1728, 2880, 1, 64, 1728, 1728, 1728, 2880]
    - [0, 10.204]
  - - [1856, 2880, 1, 64, 1856, 1856, 1856, 2880]
    - [0, 9.777]
  - - [1984, 2880, 1, 64, 1984, 1984, 1984, 2880]
    - [0, 9.777]
  - - [2112, 2880, 1, 64, 2112, 2112, 2112, 2880]
    - [0, 9.836]
  - - [2240, 2880, 1, 64, 2240, 2240, 2240, 2880]
    - [0, 9.723]
  - - [2368, 2880, 1, 64, 2368, 2368, 2368, 2880]
    - [0, 9.438]
  - - [2496, 2880, 1, 64, 2496, 2496, 2496, 2880]
    - [0, 9.574]
  - - [2624, 2880, 1, 64, 2624, 2624, 2624, 2880]
    - [0, 10.054]
  - - [2752, 2880, 1, 64, 2752, 2752, 2752, 2880]
    - [0, 9.906]
  - - [2880, 2880, 1, 64, 2880, 2880, 2880, 2880]
    - [0, 9.695]
  - - [3008, 2880, 1, 64, 3008, 3008, 3008, 2880]
    - [0, 10.408]
  - - [3136, 2880, 1, 64, 3136, 3136, 3136, 2880]
    - [0, 9.911]
  - - [3264, 2880, 1, 64, 3264, 3264, 3264, 2880]
    - [0, 9.974]
  - - [3392, 2880, 1, 64, 3392, 3392, 3392, 2880]
    - [0, 9.995]
  - - [3520, 2880, 1, 64, 3520, 3520, 3520, 2880]
    - [0, 9.961]
  - - [3648, 2880, 1, 64, 3648, 3648, 3648, 2880]
    - [0, 10.064]
  - - [3776, 2880, 1, 64, 3776, 3776, 3776, 2880]
    - [0, 9.825]
  - - [3904, 2880, 1, 64, 3904, 3904, 3904, 2880]
    - [0, 9.788]
  - - [4032, 2880, 1, 64, 4032, 4032, 4032, 2880]
    - [0, 9.822]
  - - [64, 3008, 1, 64, 64, 64, 64, 3008]
    - [0, 3.626]
  - - [192, 3008, 1, 64, 192, 192, 192, 3008]
    - [0, 6.412]
  - - [320, 3008, 1, 64, 320, 320, 320, 3008]
    - [0, 7.532]
  - - [448, 3008, 1, 64, 448, 448, 448, 3008]
    - [0, 8.363]
  - - [576, 3008, 1, 64, 576, 576, 576, 3008]
    - [0, 8.942]
  - - [704, 3008, 1, 64, 704, 704, 704, 3008]
    - [0, 9.324]
  - - [832, 3008, 1, 64, 832, 832, 832, 3008]
    - [0, 9.623]
  - - [960, 3008, 1, 64, 960, 960, 960, 3008]
    - [0, 9.963]
  - - [1088, 3008, 1, 64, 1088, 1088, 1088, 3008]
    - [0, 10.062]
  - - [1216, 3008, 1, 64, 1216, 1216, 1216, 3008]
    - [0, 10.074]
  - - [1344, 3008, 1, 64, 1344, 1344, 1344, 3008]
    - [0, 10.288]
  - - [1472, 3008, 1, 64, 1472, 1472, 1472, 3008]
    - [0, 9.947]
  - - [1600, 3008, 1, 64, 1600, 1600, 1600, 3008]
    - [0, 10.336]
  - - [1728, 3008, 1, 64, 1728, 1728, 1728, 3008]
    - [0, 9.713]
  - - [1856, 3008, 1, 64, 1856, 1856, 1856, 3008]
    - [0, 9.679]
  - - [1984, 3008, 1, 64, 1984, 1984, 1984, 3008]
    - [0, 9.608]
  - - [2112, 3008, 1, 64, 2112, 2112, 2112, 3008]
    - [0, 10.096]
  - - [2240, 3008, 1, 64, 2240, 2240, 2240, 3008]
    - [0, 10.17]
  - - [2368, 3008, 1, 64, 2368, 2368, 2368, 3008]
    - [0, 9.753]
  - - [2496, 3008, 1, 64, 2496, 2496, 2496, 3008]
    - [0, 9.969]
  - - [2624, 3008, 1, 64, 2624, 2624, 2624, 3008]
    - [0, 9.855]
  - - [2752, 3008, 1, 64, 2752, 2752, 2752, 3008]
    - [0, 9.951]
  - - [2880, 3008, 1, 64, 2880, 2880, 2880, 3008]
    - [0, 10.208]
  - - [3008, 3008, 1, 64, 3008, 3008, 3008, 3008]
    - [0, 10.257]
  - - [3136, 3008, 1, 64, 3136, 3136, 3136, 3008]
    - [0, 10.256]
  - - [3264, 3008, 1, 64, 3264, 3264, 3264, 3008]
    - [0, 9.788]
  - - [3392, 3008, 1, 64, 3392, 3392, 3392, 3008]
    - [2, 9.473]
  - - [3520, 3008, 1, 64, 3520, 3520, 3520, 3008]
    - [0, 10.067]
  - - [3648, 3008, 1, 64, 3648, 3648, 3648, 3008]
    - [0, 9.712]
  - - [3776, 3008, 1, 64, 3776, 3776, 3776, 3008]
    - [0, 9.587]
  - - [3904, 3008, 1, 64, 3904, 3904, 3904, 3008]
    - [0, 9.672]
  - - [4032, 3008, 1, 64, 4032, 4032, 4032, 3008]
    - [0, 9.922]
  - - [64, 3136, 1, 64, 64, 64, 64, 3136]
    - [3, 0.831]
  - - [192, 3136, 1, 64, 192, 192, 192, 3136]
    - [0, 4.839]
  - - [320, 3136, 1, 64, 320, 320, 320, 3136]
    - [0, 7.579]
  - - [448, 3136, 1, 64, 448, 448, 448, 3136]
    - [0, 8.441]
  - - [576, 3136, 1, 64, 576, 576, 576, 3136]
    - [0, 9.033]
  - - [704, 3136, 1, 64, 704, 704, 704, 3136]
    - [0, 9.398]
  - - [832, 3136, 1, 64, 832, 832, 832, 3136]
    - [0, 9.672]
  - - [960, 3136, 1, 64, 960, 960, 960, 3136]
    - [0, 9.882]
  - - [1088, 3136, 1, 64, 1088, 1088, 1088, 3136]
    - [0, 10.051]
  - - [1216, 3136, 1, 64, 1216, 1216, 1216, 3136]
    - [0, 10.267]
  - - [1344, 3136, 1, 64, 1344, 1344, 1344, 3136]
    - [0, 10.216]
  - - [1472, 3136, 1, 64, 1472, 1472, 1472, 3136]
    - [0, 9.896]
  - - [1600, 3136, 1, 64, 1600, 1600, 1600, 3136]
    - [0, 10.16]
  - - [1728, 3136, 1, 64, 1728, 1728, 1728, 3136]
    - [0, 9.881]
  - - [1856, 3136, 1, 64, 1856, 1856, 1856, 3136]
    - [0, 9.49]
  - - [1984, 3136, 1, 64, 1984, 1984, 1984, 3136]
    - [0, 9.683]
  - - [2112, 3136, 1, 64, 2112, 2112, 2112, 3136]
    - [0, 10.199]
  - - [2240, 3136, 1, 64, 2240, 2240, 2240, 3136]
    - [0, 9.822]
  - - [2368, 3136, 1, 64, 2368, 2368, 2368, 3136]
    - [0, 9.915]
  - - [2496, 3136, 1, 64, 2496, 2496, 2496, 3136]
    - [0, 9.94]
  - - [2624, 3136, 1, 64, 2624, 2624, 2624, 3136]
    - [0, 9.71]
  - - [2752, 3136, 1, 64, 2752, 2752, 2752, 3136]
    - [0, 9.921]
  - - [2880, 3136, 1, 64, 2880, 2880, 2880, 3136]
    - [0, 9.924]
  - - [3008, 3136, 1, 64, 3008, 3008, 3008, 3136]
    - [0, 10.18]
  - - [3136, 3136, 1, 64, 3136, 3136, 3136, 3136]
    - [0, 10.324]
  - - [3264, 3136, 1, 64, 3264, 3264, 3264, 3136]
    - [0, 9.99]
  - - [3392, 3136, 1, 64, 3392, 3392, 3392, 3136]
    - [0, 10.027]
  - - [3520, 3136, 1, 64, 3520, 3520, 3520, 3136]
    - [0, 9.743]
  - - [3648, 3136, 1, 64, 3648, 3648, 3648, 3136]
    - [0, 9.875]
  - - [3776, 3136, 1, 64, 3776, 3776, 3776, 3136]
    - [0, 9.71]
  - - [3904, 3136, 1, 64, 3904, 3904, 3904, 3136]
    - [0, 9.876]
  - - [4032, 3136, 1, 64, 4032, 4032, 4032, 3136]
    - [0, 9.649]
  - - [64, 3264, 1, 64, 64, 64, 64, 3264]
    - [3, 0.865]
  - - [192, 3264, 1, 64, 192, 192, 192, 3264]
    - [3, 5.033]
  - - [320, 3264, 1, 64, 320, 320, 320, 3264]
    - [0, 7.645]
  - - [448, 3264, 1, 64, 448, 448, 448, 3264]
    - [0, 8.548]
  - - [576, 3264, 1, 64, 576, 576, 576, 3264]
    - [0, 9.091]
  - - [704, 3264, 1, 64, 704, 704, 704, 3264]
    - [0, 9.443]
  - - [832, 3264, 1, 64, 832, 832, 832, 3264]
    - [0, 9.769]
  - - [960, 3264, 1, 64, 960, 960, 960, 3264]
    - [0, 9.874]
  - - [1088, 3264, 1, 64, 1088, 1088, 1088, 3264]
    - [0, 10.117]
  - - [1216, 3264, 1, 64, 1216, 1216, 1216, 3264]
    - [0, 9.898]
  - - [1344, 3264, 1, 64, 1344, 1344, 1344, 3264]
    - [0, 9.764]
  - - [1472, 3264, 1, 64, 1472, 1472, 1472, 3264]
    - [0, 9.668]
  - - [1600, 3264, 1, 64, 1600, 1600, 1600, 3264]
    - [0, 9.729]
  - - [1728, 3264, 1, 64, 1728, 1728, 1728, 3264]
    - [0, 9.672]
  - - [1856, 3264, 1, 64, 1856, 1856, 1856, 3264]
    - [0, 10.264]
  - - [1984, 3264, 1, 64, 1984, 1984, 1984, 3264]
    - [0, 9.518]
  - - [2112, 3264, 1, 64, 2112, 2112, 2112, 3264]
    - [0, 9.572]
  - - [2240, 3264, 1, 64, 2240, 2240, 2240, 3264]
    - [2, 9.263]
  - - [2368, 3264, 1, 64, 2368, 2368, 2368, 3264]
    - [0, 9.652]
  - - [2496, 3264, 1, 64, 2496, 2496, 2496, 3264]
    - [0, 9.52]
  - - [2624, 3264, 1, 64, 2624, 2624, 2624, 3264]
    - [0, 9.918]
  - - [2752, 3264, 1, 64, 2752, 2752, 2752, 3264]
    - [0, 10.11]
  - - [2880, 3264, 1, 64, 2880, 2880, 2880, 3264]
    - [0, 9.477]
  - - [3008, 3264, 1, 64, 3008, 3008, 3008, 3264]
    - [0, 10.099]
  - - [3136, 3264, 1, 64, 3136, 3136, 3136, 3264]
    - [0, 10.102]
  - - [3264, 3264, 1, 64, 3264, 3264, 3264, 3264]
    - [0, 9.857]
  - - [3392, 3264, 1, 64, 3392, 3392, 3392, 3264]
    - [0, 9.649]
  - - [3520, 3264, 1, 64, 3520, 3520, 3520, 3264]
    - [0, 9.608]
  - - [3648, 3264, 1, 64, 3648, 3648, 3648, 3264]
    - [0, 9.705]
  - - [3776, 3264, 1, 64, 3776, 3776, 3776, 3264]
    - [0, 9.835]
  - - [3904, 3264, 1, 64, 3904, 3904, 3904, 3264]
    - [0, 9.519]
  - - [4032, 3264, 1, 64, 4032, 4032, 4032, 3264]
    - [0, 9.031]
  - - [64, 3392, 1, 64, 64, 64, 64, 3392]
    - [1, 0.898]
  - - [192, 3392, 1, 64, 192, 192, 192, 3392]
    - [2, 5.21]
  - - [320, 3392, 1, 64, 320, 320, 320, 3392]
    - [0, 7.788]
  - - [448, 3392, 1, 64, 448, 448, 448, 3392]
    - [0, 8.606]
  - - [576, 3392, 1, 64, 576, 576, 576, 3392]
    - [0, 9.175]
  - - [704, 3392, 1, 64, 704, 704, 704, 3392]
    - [0, 9.606]
  - - [832, 3392, 1, 64, 832, 832, 832, 3392]
    - [0, 9.798]
  - - [960, 3392, 1, 64, 960, 960, 960, 3392]
    - [0, 9.952]
  - - [1088, 3392, 1, 64, 1088, 1088, 1088, 3392]
    - [0, 10.201]
  - - [1216, 3392, 1, 64, 1216, 1216, 1216, 3392]
    - [0, 9.608]
  - - [1344, 3392, 1, 64, 1344, 1344, 1344, 3392]
    - [0, 9.921]
  - - [1472, 3392, 1, 64, 1472, 1472, 1472, 3392]
    - [0, 9.824]
  - - [1600, 3392, 1, 64, 1600, 1600, 1600, 3392]
    - [0, 9.541]
  - - [1728, 3392, 1, 64, 1728, 1728, 1728, 3392]
    - [0, 9.433]
  - - [1856, 3392, 1, 64, 1856, 1856, 1856, 3392]
    - [0, 10.385]
  - - [1984, 3392, 1, 64, 1984, 1984, 1984, 3392]
    - [0, 9.587]
  - - [2112, 3392, 1, 64, 2112, 2112, 2112, 3392]
    - [0, 9.929]
  - - [2240, 3392, 1, 64, 2240, 2240, 2240, 3392]
    - [0, 9.562]
  - - [2368, 3392, 1, 64, 2368, 2368, 2368, 3392]
    - [0, 9.822]
  - - [2496, 3392, 1, 64, 2496, 2496, 2496, 3392]
    - [2, 9.466]
  - - [2624, 3392, 1, 64, 2624, 2624, 2624, 3392]
    - [0, 9.962]
  - - [2752, 3392, 1, 64, 2752, 2752, 2752, 3392]
    - [0, 10.206]
  - - [2880, 3392, 1, 64, 2880, 2880, 2880, 3392]
    - [0, 10.107]
  - - [3008, 3392, 1, 64, 3008, 3008, 3008, 3392]
    - [0, 10.208]
  - - [3136, 3392, 1, 64, 3136, 3136, 3136, 3392]
    - [0, 9.917]
  - - [3264, 3392, 1, 64, 3264, 3264, 3264, 3392]
    - [0, 9.646]
  - - [3392, 3392, 1, 64, 3392, 3392, 3392, 3392]
    - [0, 9.802]
  - - [3520, 3392, 1, 64, 3520, 3520, 3520, 3392]
    - [0, 9.683]
  - - [3648, 3392, 1, 64, 3648, 3648, 3648, 3392]
    - [0, 9.909]
  - - [3776, 3392, 1, 64, 3776, 3776, 3776, 3392]
    - [0, 9.256]
  - - [3904, 3392, 1, 64, 3904, 3904, 3904, 3392]
    - [0, 9.038]
  - - [4032, 3392, 1, 64, 4032, 4032, 4032, 3392]
    - [0, 8.883]
  - - [64, 3520, 1, 64, 64, 64, 64, 3520]
    - [2, 0.938]
  - - [192, 3520, 1, 64, 192, 192, 192, 3520]
    - [0, 5.424]
  - - [320, 3520, 1, 64, 320, 320, 320, 3520]
    - [0, 7.902]
  - - [448, 3520, 1, 64, 448, 448, 448, 3520]
    - [0, 8.702]
  - - [576, 3520, 1, 64, 576, 576, 576, 3520]
    - [0, 9.219]
  - - [704, 3520, 1, 64, 704, 704, 704, 3520]
    - [0, 9.603]
  - - [832, 3520, 1, 64, 832, 832, 832, 3520]
    - [0, 9.878]
  - - [960, 3520, 1, 64, 960, 960, 960, 3520]
    - [0, 10.046]
  - - [1088, 3520, 1, 64, 1088, 1088, 1088, 3520]
    - [0, 10.35]
  - - [1216, 3520, 1, 64, 1216, 1216, 1216, 3520]
    - [0, 9.981]
  - - [1344, 3520, 1, 64, 1344, 1344, 1344, 3520]
    - [0, 9.905]
  - - [1472, 3520, 1, 64, 1472, 1472, 1472, 3520]
    - [0, 9.786]
  - - [1600, 3520, 1, 64, 1600, 1600, 1600, 3520]
    - [0, 10.258]
  - - [1728, 3520, 1, 64, 1728, 1728, 1728, 3520]
    - [0, 9.764]
  - - [1856, 3520, 1, 64, 1856, 1856, 1856, 3520]
    - [0, 9.889]
  - - [1984, 3520, 1, 64, 1984, 1984, 1984, 3520]
    - [0, 9.753]
  - - [2112, 3520, 1, 64, 2112, 2112, 2112, 3520]
    - [0, 9.968]
  - - [2240, 3520, 1, 64, 2240, 2240, 2240, 3520]
    - [0, 10.057]
  - - [2368, 3520, 1, 64, 2368, 2368, 2368, 3520]
    - [0, 9.95]
  - - [2496, 3520, 1, 64, 2496, 2496, 2496, 3520]
    - [0, 9.759]
  - - [2624, 3520, 1, 64, 2624, 2624, 2624, 3520]
    - [0, 10.261]
  - - [2752, 3520, 1, 64, 2752, 2752, 2752, 3520]
    - [0, 10.103]
  - - [2880, 3520, 1, 64, 2880, 2880, 2880, 3520]
    - [0, 9.652]
  - - [3008, 3520, 1, 64, 3008, 3008, 3008, 3520]
    - [0, 9.686]
  - - [3136, 3520, 1, 64, 3136, 3136, 3136, 3520]
    - [0, 9.595]
  - - [3264, 3520, 1, 64, 3264, 3264, 3264, 3520]
    - [0, 9.871]
  - - [3392, 3520, 1, 64, 3392, 3392, 3392, 3520]
    - [0, 9.77]
  - - [3520, 3520, 1, 64, 3520, 3520, 3520, 3520]
    - [0, 9.84]
  - - [3648, 3520, 1, 64, 3648, 3648, 3648, 3520]
    - [0, 9.347]
  - - [3776, 3520, 1, 64, 3776, 3776, 3776, 3520]
    - [0, 8.632]
  - - [3904, 3520, 1, 64, 3904, 3904, 3904, 3520]
    - [0, 8.844]
  - - [4032, 3520, 1, 64, 4032, 4032, 4032, 3520]
    - [0, 8.532]
  - - [64, 3648, 1, 64, 64, 64, 64, 3648]
    - [0, 4.191]
  - - [192, 3648, 1, 64, 192, 192, 192, 3648]
    - [0, 5.623]
  - - [320, 3648, 1, 64, 320, 320, 320, 3648]
    - [0, 8.027]
  - - [448, 3648, 1, 64, 448, 448, 448, 3648]
    - [0, 8.764]
  - - [576, 3648, 1, 64, 576, 576, 576, 3648]
    - [0, 9.294]
  - - [704, 3648, 1, 64, 704, 704, 704, 3648]
    - [0, 9.637]
  - - [832, 3648, 1, 64, 832, 832, 832, 3648]
    - [0, 9.947]
  - - [960, 3648, 1, 64, 960, 960, 960, 3648]
    - [0, 9.893]
  - - [1088, 3648, 1, 64, 1088, 1088, 1088, 3648]
    - [0, 9.705]
  - - [1216, 3648, 1, 64, 1216, 1216, 1216, 3648]
    - [0, 9.526]
  - - [1344, 3648, 1, 64, 1344, 1344, 1344, 3648]
    - [0, 9.792]
  - - [1472, 3648, 1, 64, 1472, 1472, 1472, 3648]
    - [0, 9.74]
  - - [1600, 3648, 1, 64, 1600, 1600, 1600, 3648]
    - [0, 10.223]
  - - [1728, 3648, 1, 64, 1728, 1728, 1728, 3648]
    - [0, 9.52]
  - - [1856, 3648, 1, 64, 1856, 1856, 1856, 3648]
    - [0, 9.843]
  - - [1984, 3648, 1, 64, 1984, 1984, 1984, 3648]
    - [0, 9.413]
  - - [2112, 3648, 1, 64, 2112, 2112, 2112, 3648]
    - [0, 9.952]
  - - [2240, 3648, 1, 64, 2240, 2240, 2240, 3648]
    - [0, 10.135]
  - - [2368, 3648, 1, 64, 2368, 2368, 2368, 3648]
    - [0, 10.304]
  - - [2496, 3648, 1, 64, 2496, 2496, 2496, 3648]
    - [0, 10.224]
  - - [2624, 3648, 1, 64, 2624, 2624, 2624, 3648]
    - [0, 10.073]
  - - [2752, 3648, 1, 64, 2752, 2752, 2752, 3648]
    - [0, 10.089]
  - - [2880, 3648, 1, 64, 2880, 2880, 2880, 3648]
    - [0, 9.683]
  - - [3008, 3648, 1, 64, 3008, 3008, 3008, 3648]
    - [0, 9.762]
  - - [3136, 3648, 1, 64, 3136, 3136, 3136, 3648]
    - [0, 9.671]
  - - [3264, 3648, 1, 64, 3264, 3264, 3264, 3648]
    - [0, 9.747]
  - - [3392, 3648, 1, 64, 3392, 3392, 3392, 3648]
    - [0, 9.906]
  - - [3520, 3648, 1, 64, 3520, 3520, 3520, 3648]
    - [0, 9.174]
  - - [3648, 3648, 1, 64, 3648, 3648, 3648, 3648]
    - [0, 8.893]
  - - [3776, 3648, 1, 64, 3776, 3776, 3776, 3648]
    - [0, 8.582]
  - - [3904, 3648, 1, 64, 3904, 3904, 3904, 3648]
    - [0, 8.453]
  - - [4032, 3648, 1, 64, 4032, 4032, 4032, 3648]
    - [2, 8.026]
  - - [64, 3776, 1, 64, 64, 64, 64, 3776]
    - [3, 1.002]
  - - [192, 3776, 1, 64, 192, 192, 192, 3776]
    - [3, 5.803]
  - - [320, 3776, 1, 64, 320, 320, 320, 3776]
    - [0, 8.042]
  - - [448, 3776, 1, 64, 448, 448, 448, 3776]
    - [0, 8.839]
  - - [576, 3776, 1, 64, 576, 576, 576, 3776]
    - [0, 9.346]
  - - [704, 3776, 1, 64, 704, 704, 704, 3776]
    - [0, 9.682]
  - - [832, 3776, 1, 64, 832, 832, 832, 3776]
    - [0, 9.793]
  - - [960, 3776, 1, 64, 960, 960, 960, 3776]
    - [0, 10.13]
  - - [1088, 3776, 1, 64, 1088, 1088, 1088, 3776]
    - [0, 10.051]
  - - [1216, 3776, 1, 64, 1216, 1216, 1216, 3776]
    - [0, 9.968]
  - - [1344, 3776, 1, 64, 1344, 1344, 1344, 3776]
    - [0, 9.591]
  - - [1472, 3776, 1, 64, 1472, 1472, 1472, 3776]
    - [0, 10.125]
  - - [1600, 3776, 1, 64, 1600, 1600, 1600, 3776]
    - [0, 10.219]
  - - [1728, 3776, 1, 64, 1728, 1728, 1728, 3776]
    - [0, 9.508]
  - - [1856, 3776, 1, 64, 1856, 1856, 1856, 3776]
    - [0, 9.552]
  - - [1984, 3776, 1, 64, 1984, 1984, 1984, 3776]
    - [0, 10.119]
  - - [2112, 3776, 1, 64, 2112, 2112, 2112, 3776]
    - [0, 9.402]
  - - [2240, 3776, 1, 64, 2240, 2240, 2240, 3776]
    - [0, 9.789]
  - - [2368, 3776, 1, 64, 2368, 2368, 2368, 3776]
    - [0, 10.016]
  - - [2496, 3776, 1, 64, 2496, 2496, 2496, 3776]
    - [0, 10.1]
  - - [2624, 3776, 1, 64, 2624, 2624, 2624, 3776]
    - [0, 10.273]
  - - [2752, 3776, 1, 64, 2752, 2752, 2752, 3776]
    - [0, 10.124]
  - - [2880, 3776, 1, 64, 2880, 2880, 2880, 3776]
    - [0, 9.768]
  - - [3008, 3776, 1, 64, 3008, 3008, 3008, 3776]
    - [0, 9.774]
  - - [3136, 3776, 1, 64, 3136, 3136, 3136, 3776]
    - [0, 9.807]
  - - [3264, 3776, 1, 64, 3264, 3264, 3264, 3776]
    - [0, 9.733]
  - - [3392, 3776, 1, 64, 3392, 3392, 3392, 3776]
    - [0, 9.177]
  - - [3520, 3776, 1, 64, 3520, 3520, 3520, 3776]
    - [0, 8.841]
  - - [3648, 3776, 1, 64, 3648, 3648, 3648, 3776]
    - [0, 8.841]
  - - [3776, 3776, 1, 64, 3776, 3776, 3776, 3776]
    - [0, 7.939]
  - - [3904, 3776, 1, 64, 3904, 3904, 3904, 3776]
    - [2, 7.947]
  - - [4032, 3776, 1, 64, 4032, 4032, 4032, 3776]
    - [2, 8.021]
  - - [64, 3904, 1, 64, 64, 64, 64, 3904]
    - [0, 3.938]
  - - [192, 3904, 1, 64, 192, 192, 192, 3904]
    - [0, 6.888]
  - - [320, 3904, 1, 64, 320, 320, 320, 3904]
    - [0, 8.13]
  - - [448, 3904, 1, 64, 448, 448, 448, 3904]
    - [0, 8.926]
  - - [576, 3904, 1, 64, 576, 576, 576, 3904]
    - [0, 9.427]
  - - [704, 3904, 1, 64, 704, 704, 704, 3904]
    - [0, 9.79]
  - - [832, 3904, 1, 64, 832, 832, 832, 3904]
    - [0, 9.918]
  - - [960, 3904, 1, 64, 960, 960, 960, 3904]
    - [0, 10.176]
  - - [1088, 3904, 1, 64, 1088, 1088, 1088, 3904]
    - [0, 9.556]
  - - [1216, 3904, 1, 64, 1216, 1216, 1216, 3904]
    - [0, 9.918]
  - - [1344, 3904, 1, 64, 1344, 1344, 1344, 3904]
    - [0, 10.095]
  - - [1472, 3904, 1, 64, 1472, 1472, 1472, 3904]
    - [0, 10.199]
  - - [1600, 3904, 1, 64, 1600, 1600, 1600, 3904]
    - [0, 9.564]
  - - [1728, 3904, 1, 64, 1728, 1728, 1728, 3904]
    - [0, 9.644]
  - - [1856, 3904, 1, 64, 1856, 1856, 1856, 3904]
    - [0, 9.571]
  - - [1984, 3904, 1, 64, 1984, 1984, 1984, 3904]
    - [0, 9.528]
  - - [2112, 3904, 1, 64, 2112, 2112, 2112, 3904]
    - [2, 9.242]
  - - [2240, 3904, 1, 64, 2240, 2240, 2240, 3904]
    - [0, 10.08]
  - - [2368, 3904, 1, 64, 2368, 2368, 2368, 3904]
    - [0, 9.946]
  - - [2496, 3904, 1, 64, 2496, 2496, 2496, 3904]
    - [0, 10.037]
  - - [2624, 3904, 1, 64, 2624, 2624, 2624, 3904]
    - [0, 10.036]
  - - [2752, 3904, 1, 64, 2752, 2752, 2752, 3904]
    - [0, 9.864]
  - - [2880, 3904, 1, 64, 2880, 2880, 2880, 3904]
    - [0, 9.627]
  - - [3008, 3904, 1, 64, 3008, 3008, 3008, 3904]
    - [0, 9.607]
  - - [3136, 3904, 1, 64, 3136, 3136, 3136, 3904]
    - [0, 9.968]
  - - [3264, 3904, 1, 64, 3264, 3264, 3264, 3904]
    - [0, 9.399]
  - - [3392, 3904, 1, 64, 3392, 3392, 3392, 3904]
    - [0, 9.014]
  - - [3520, 3904, 1, 64, 3520, 3520, 3520, 3904]
    - [0, 8.836]
  - - [3648, 3904, 1, 64, 3648, 3648, 3648, 3904]
    - [0, 8.507]
  - - [3776, 3904, 1, 64, 3776, 3776, 3776, 3904]
    - [0, 6.999]
  - - [3904, 3904, 1, 64, 3904, 3904, 3904, 3904]
    - [2, 8.025]
  - - [4032, 3904, 1, 64, 4032, 4032, 4032, 3904]
    - [2, 8.024]
  - - [64, 4032, 1, 64, 64, 64, 64, 4032]
    - [0, 4.038]
  - - [192, 4032, 1, 64, 192, 192, 192, 4032]
    - [0, 6.22]
  - - [320, 4032, 1, 64, 320, 320, 320, 4032]
    - [0, 8.129]
  - - [448, 4032, 1, 64, 448, 448, 448, 4032]
    - [0, 8.964]
  - - [576, 4032, 1, 64, 576, 576, 576, 4032]
    - [0, 9.53]
  - - [704, 4032, 1, 64, 704, 704, 704, 4032]
    - [0, 9.765]
  - - [832, 4032, 1, 64, 832, 832, 832, 4032]
    - [0, 10.07]
  - - [960, 4032, 1, 64, 960, 960, 960, 4032]
    - [0, 10.101]
  - - [1088, 4032, 1, 64, 1088, 1088, 1088, 4032]
    - [0, 9.88]
  - - [1216, 4032, 1, 64, 1216, 1216, 1216, 4032]
    - [0, 9.604]
  - - [1344, 4032, 1, 64, 1344, 1344, 1344, 4032]
    - [0, 9.539]
  - - [1472, 4032, 1, 64, 1472, 1472, 1472, 4032]
    - [0, 9.483]
  - - [1600, 4032, 1, 64, 1600, 1600, 1600, 4032]
    - [0, 10.279]
  - - [1728, 4032, 1, 64, 1728, 1728, 1728, 4032]
    - [0, 10.014]
  - - [1856, 4032, 1, 64, 1856, 1856, 1856, 4032]
    - [0, 9.888]
  - - [1984, 4032, 1, 64, 1984, 1984, 1984, 4032]
    - [0, 9.978]
  - - [2112, 4032, 1, 64, 2112, 2112, 2112, 4032]
    - [0, 9.887]
  - - [2240, 4032, 1, 64, 2240, 2240, 2240, 4032]
    - [0, 9.972]
  - - [2368, 4032, 1, 64, 2368, 2368, 2368, 4032]
    - [0, 9.453]
  - - [2496, 4032, 1, 64, 2496, 2496, 2496, 4032]
    - [0, 10.031]
  - - [2624, 4032, 1, 64, 2624, 2624, 2624, 4032]
    - [0, 10.187]
  - - [2752, 4032, 1, 64, 2752, 2752, 2752, 4032]
    - [0, 9.896]
  - - [2880, 4032, 1, 64, 2880, 2880, 2880, 4032]
    - [0, 10.007]
  - - [3008, 4032, 1, 64, 3008, 3008, 3008, 4032]
    - [0, 9.808]
  - - [3136, 4032, 1, 64, 3136, 3136, 3136, 4032]
    - [0, 9.371]
  - - [3264, 4032, 1, 64, 3264, 3264, 3264, 4032]
    - [0, 9.071]
  - - [3392, 4032, 1, 64, 3392, 3392, 3392, 4032]
    - [0, 8.789]
  - - [3520, 4032, 1, 64, 3520, 3520, 3520, 4032]
    - [0, 8.413]
  - - [3648, 4032, 1, 64, 3648, 3648, 3648, 4032]
    - [2, 8.08]
  - - [3776, 4032, 1, 64, 3776, 3776, 3776, 4032]
    - [0, 6.988]
  - - [3904, 4032, 1, 64, 3904, 3904, 3904, 4032]
    - [2, 7.958]
  - - [4032, 4032, 1, 64, 4032, 4032, 4032, 4032]
    - [2, 8.004]
  - - [64, 64, 1, 256, 64, 64, 64, 64]
    - [2, 0.325]
  - - [192, 64, 1, 256, 192, 192, 192, 64]
    - [2, 0.954]
  - - [320, 64, 1, 256, 320, 320, 320, 64]
    - [2, 1.597]
  - - [448, 64, 1, 256, 448, 448, 448, 64]
    - [2, 2.131]
  - - [576, 64, 1, 256, 576, 576, 576, 64]
    - [0, 2.775]
  - - [704, 64, 1, 256, 704, 704, 704, 64]
    - [3, 3.241]
  - - [832, 64, 1, 256, 832, 832, 832, 64]
    - [3, 0.886]
  - - [960, 64, 1, 256, 960, 960, 960, 64]
    - [1, 1.019]
  - - [1088, 64, 1, 256, 1088, 1088, 1088, 64]
    - [3, 1.159]
  - - [1216, 64, 1, 256, 1216, 1216, 1216, 64]
    - [3, 1.29]
  - - [1344, 64, 1, 256, 1344, 1344, 1344, 64]
    - [0, 1.424]
  - - [1472, 64, 1, 256, 1472, 1472, 1472, 64]
    - [0, 1.56]
  - - [1600, 64, 1, 256, 1600, 1600, 1600, 64]
    - [2, 3.295]
  - - [1728, 64, 1, 256, 1728, 1728, 1728, 64]
    - [0, 1.828]
  - - [1856, 64, 1, 256, 1856, 1856, 1856, 64]
    - [0, 1.972]
  - - [1984, 64, 1, 256, 1984, 1984, 1984, 64]
    - [3, 4.082]
  - - [2112, 64, 1, 256, 2112, 2112, 2112, 64]
    - [3, 2.24]
  - - [2240, 64, 1, 256, 2240, 2240, 2240, 64]
    - [1, 4.605]
  - - [2368, 64, 1, 256, 2368, 2368, 2368, 64]
    - [0, 7.857]
  - - [2496, 64, 1, 256, 2496, 2496, 2496, 64]
    - [0, 2.656]
  - - [2624, 64, 1, 256, 2624, 2624, 2624, 64]
    - [0, 2.787]
  - - [2752, 64, 1, 256, 2752, 2752, 2752, 64]
    - [0, 8.958]
  - - [2880, 64, 1, 256, 2880, 2880, 2880, 64]
    - [2, 8.849]
  - - [3008, 64, 1, 256, 3008, 3008, 3008, 64]
    - [0, 9.596]
  - - [3136, 64, 1, 256, 3136, 3136, 3136, 64]
    - [0, 9.269]
  - - [3264, 64, 1, 256, 3264, 3264, 3264, 64]
    - [0, 9.554]
  - - [3392, 64, 1, 256, 3392, 3392, 3392, 64]
    - [0, 9.979]
  - - [3520, 64, 1, 256, 3520, 3520, 3520, 64]
    - [0, 10.282]
  - - [3648, 64, 1, 256, 3648, 3648, 3648, 64]
    - [0, 10.602]
  - - [3776, 64, 1, 256, 3776, 3776, 3776, 64]
    - [0, 10.949]
  - - [3904, 64, 1, 256, 3904, 3904, 3904, 64]
    - [0, 10.231]
  - - [4032, 64, 1, 256, 4032, 4032, 4032, 64]
    - [0, 10.533]
  - - [64, 192, 1, 256, 64, 64, 64, 192]
    - [0, 0.908]
  - - [192, 192, 1, 256, 192, 192, 192, 192]
    - [0, 2.771]
  - - [320, 192, 1, 256, 320, 320, 320, 192]
    - [2, 4.064]
  - - [448, 192, 1, 256, 448, 448, 448, 192]
    - [0, 5.579]
  - - [576, 192, 1, 256, 576, 576, 576, 192]
    - [3, 6.331]
  - - [704, 192, 1, 256, 704, 704, 704, 192]
    - [0, 7.729]
  - - [832, 192, 1, 256, 832, 832, 832, 192]
    - [0, 8.209]
  - - [960, 192, 1, 256, 960, 960, 960, 192]
    - [0, 9.386]
  - - [1088, 192, 1, 256, 1088, 1088, 1088, 192]
    - [0, 9.755]
  - - [1216, 192, 1, 256, 1216, 1216, 1216, 192]
    - [0, 10.902]
  - - [1344, 192, 1, 256, 1344, 1344, 1344, 192]
    - [0, 10.803]
  - - [1472, 192, 1, 256, 1472, 1472, 1472, 192]
    - [0, 11.774]
  - - [1600, 192, 1, 256, 1600, 1600, 1600, 192]
    - [0, 11.924]
  - - [1728, 192, 1, 256, 1728, 1728, 1728, 192]
    - [0, 12.8]
  - - [1856, 192, 1, 256, 1856, 1856, 1856, 192]
    - [0, 12.661]
  - - [1984, 192, 1, 256, 1984, 1984, 1984, 192]
    - [0, 13.563]
  - - [2112, 192, 1, 256, 2112, 2112, 2112, 192]
    - [0, 13.491]
  - - [2240, 192, 1, 256, 2240, 2240, 2240, 192]
    - [0, 14.144]
  - - [2368, 192, 1, 256, 2368, 2368, 2368, 192]
    - [0, 14.258]
  - - [2496, 192, 1, 256, 2496, 2496, 2496, 192]
    - [0, 14.778]
  - - [2624, 192, 1, 256, 2624, 2624, 2624, 192]
    - [0, 14.62]
  - - [2752, 192, 1, 256, 2752, 2752, 2752, 192]
    - [0, 15.276]
  - - [2880, 192, 1, 256, 2880, 2880, 2880, 192]
    - [0, 15.224]
  - - [3008, 192, 1, 256, 3008, 3008, 3008, 192]
    - [0, 15.739]
  - - [3136, 192, 1, 256, 3136, 3136, 3136, 192]
    - [0, 15.708]
  - - [3264, 192, 1, 256, 3264, 3264, 3264, 192]
    - [0, 16.157]
  - - [3392, 192, 1, 256, 3392, 3392, 3392, 192]
    - [0, 16.012]
  - - [3520, 192, 1, 256, 3520, 3520, 3520, 192]
    - [0, 16.356]
  - - [3648, 192, 1, 256, 3648, 3648, 3648, 192]
    - [0, 16.296]
  - - [3776, 192, 1, 256, 3776, 3776, 3776, 192]
    - [0, 16.672]
  - - [3904, 192, 1, 256, 3904, 3904, 3904, 192]
    - [0, 16.671]
  - - [4032, 192, 1, 256, 4032, 4032, 4032, 192]
    - [0, 17.097]
  - - [64, 320, 1, 256, 64, 64, 64, 320]
    - [1, 0.338]
  - - [192, 320, 1, 256, 192, 192, 192, 320]
    - [3, 1.024]
  - - [320, 320, 1, 256, 320, 320, 320, 320]
    - [2, 1.694]
  - - [448, 320, 1, 256, 448, 448, 448, 320]
    - [0, 2.383]
  - - [576, 320, 1, 256, 576, 576, 576, 320]
    - [2, 5.956]
  - - [704, 320, 1, 256, 704, 704, 704, 320]
    - [0, 7.261]
  - - [832, 320, 1, 256, 832, 832, 832, 320]
    - [1, 8.535]
  - - [960, 320, 1, 256, 960, 960, 960, 320]
    - [0, 9.902]
  - - [1088, 320, 1, 256, 1088, 1088, 1088, 320]
    - [2, 11.152]
  - - [1216, 320, 1, 256, 1216, 1216, 1216, 320]
    - [0, 12.538]
  - - [1344, 320, 1, 256, 1344, 1344, 1344, 320]
    - [0, 13.89]
  - - [1472, 320, 1, 256, 1472, 1472, 1472, 320]
    - [0, 14.417]
  - - [1600, 320, 1, 256, 1600, 1600, 1600, 320]
    - [0, 14.673]
  - - [1728, 320, 1, 256, 1728, 1728, 1728, 320]
    - [0, 15.074]
  - - [1856, 320, 1, 256, 1856, 1856, 1856, 320]
    - [0, 15.319]
  - - [1984, 320, 1, 256, 1984, 1984, 1984, 320]
    - [0, 15.896]
  - - [2112, 320, 1, 256, 2112, 2112, 2112, 320]
    - [0, 16.586]
  - - [2240, 320, 1, 256, 2240, 2240, 2240, 320]
    - [0, 16.641]
  - - [2368, 320, 1, 256, 2368, 2368, 2368, 320]
    - [0, 16.807]
  - - [2496, 320, 1, 256, 2496, 2496, 2496, 320]
    - [0, 17.161]
  - - [2624, 320, 1, 256, 2624, 2624, 2624, 320]
    - [0, 17.338]
  - - [2752, 320, 1, 256, 2752, 2752, 2752, 320]
    - [0, 17.745]
  - - [2880, 320, 1, 256, 2880, 2880, 2880, 320]
    - [0, 17.983]
  - - [3008, 320, 1, 256, 3008, 3008, 3008, 320]
    - [0, 18.264]
  - - [3136, 320, 1, 256, 3136, 3136, 3136, 320]
    - [0, 18.201]
  - - [3264, 320, 1, 256, 3264, 3264, 3264, 320]
    - [0, 18.382]
  - - [3392, 320, 1, 256, 3392, 3392, 3392, 320]
    - [0, 18.813]
  - - [3520, 320, 1, 256, 3520, 3520, 3520, 320]
    - [0, 19.092]
  - - [3648, 320, 1, 256, 3648, 3648, 3648, 320]
    - [0, 18.947]
  - - [3776, 320, 1, 256, 3776, 3776, 3776, 320]
    - [0, 18.959]
  - - [3904, 320, 1, 256, 3904, 3904, 3904, 320]
    - [0, 18.99]
  - - [4032, 320, 1, 256, 4032, 4032, 4032, 320]
    - [0, 19.109]
  - - [64, 448, 1, 256, 64, 64, 64, 448]
    - [2, 2.166]
  - - [192, 448, 1, 256, 192, 192, 192, 448]
    - [2, 5.501]
  - - [320, 448, 1, 256, 320, 320, 320, 448]
    - [0, 8.15]
  - - [448, 448, 1, 256, 448, 448, 448, 448]
    - [0, 9.448]
  - - [576, 448, 1, 256, 576, 576, 576, 448]
    - [2, 10.693]
  - - [704, 448, 1, 256, 704, 704, 704, 448]
    - [0, 12.33]
  - - [832, 448, 1, 256, 832, 832, 832, 448]
    - [0, 13.404]
  - - [960, 448, 1, 256, 960, 960, 960, 448]
    - [0, 14.251]
  - - [1088, 448, 1, 256, 1088, 1088, 1088, 448]
    - [0, 14.954]
  - - [1216, 448, 1, 256, 1216, 1216, 1216, 448]
    - [0, 15.176]
  - - [1344, 448, 1, 256, 1344, 1344, 1344, 448]
    - [0, 15.809]
  - - [1472, 448, 1, 256, 1472, 1472, 1472, 448]
    - [0, 16.211]
  - - [1600, 448, 1, 256, 1600, 1600, 1600, 448]
    - [0, 16.706]
  - - [1728, 448, 1, 256, 1728, 1728, 1728, 448]
    - [0, 17.124]
  - - [1856, 448, 1, 256, 1856, 1856, 1856, 448]
    - [0, 17.466]
  - - [1984, 448, 1, 256, 1984, 1984, 1984, 448]
    - [0, 17.647]
  - - [2112, 448, 1, 256, 2112, 2112, 2112, 448]
    - [0, 17.933]
  - - [2240, 448, 1, 256, 2240, 2240, 2240, 448]
    - [0, 18.172]
  - - [2368, 448, 1, 256, 2368, 2368, 2368, 448]
    - [0, 18.462]
  - - [2496, 448, 1, 256, 2496, 2496, 2496, 448]
    - [0, 18.816]
  - - [2624, 448, 1, 256, 2624, 2624, 2624, 448]
    - [0, 18.952]
  - - [2752, 448, 1, 256, 2752, 2752, 2752, 448]
    - [0, 19.019]
  - - [2880, 448, 1, 256, 2880, 2880, 2880, 448]
    - [0, 19.469]
  - - [3008, 448, 1, 256, 3008, 3008, 3008, 448]
    - [0, 19.402]
  - - [3136, 448, 1, 256, 3136, 3136, 3136, 448]
    - [0, 19.418]
  - - [3264, 448, 1, 256, 3264, 3264, 3264, 448]
    - [0, 19.544]
  - - [3392, 448, 1, 256, 3392, 3392, 3392, 448]
    - [0, 19.718]
  - - [3520, 448, 1, 256, 3520, 3520, 3520, 448]
    - [0, 19.668]
  - - [3648, 448, 1, 256, 3648, 3648, 3648, 448]
    - [0, 19.021]
  - - [3776, 448, 1, 256, 3776, 3776, 3776, 448]
    - [0, 18.948]
  - - [3904, 448, 1, 256, 3904, 3904, 3904, 448]
    - [0, 19.047]
  - - [4032, 448, 1, 256, 4032, 4032, 4032, 448]
    - [0, 19.982]
  - - [64, 576, 1, 256, 64, 64, 64, 576]
    - [3, 2.695]
  - - [192, 576, 1, 256, 192, 192, 192, 576]
    - [2, 6.348]
  - - [320, 576, 1, 256, 320, 320, 320, 576]
    - [0, 9.346]
  - - [448, 576, 1, 256, 448, 448, 448, 576]
    - [0, 10.933]
  - - [576, 576, 1, 256, 576, 576, 576, 576]
    - [0, 12.847]
  - - [704, 576, 1, 256, 704, 704, 704, 576]
    - [0, 13.511]
  - - [832, 576, 1, 256, 832, 832, 832, 576]
    - [0, 14.86]
  - - [960, 576, 1, 256, 960, 960, 960, 576]
    - [0, 15.423]
  - - [1088, 576, 1, 256, 1088, 1088, 1088, 576]
    - [0, 16.18]
  - - [1216, 576, 1, 256, 1216, 1216, 1216, 576]
    - [0, 16.443]
  - - [1344, 576, 1, 256, 1344, 1344, 1344, 576]
    - [0, 17.141]
  - - [1472, 576, 1, 256, 1472, 1472, 1472, 576]
    - [0, 17.383]
  - - [1600, 576, 1, 256, 1600, 1600, 1600, 576]
    - [0, 17.896]
  - - [1728, 576, 1, 256, 1728, 1728, 1728, 576]
    - [0, 18.239]
  - - [1856, 576, 1, 256, 1856, 1856, 1856, 576]
    - [0, 18.524]
  - - [1984, 576, 1, 256, 1984, 1984, 1984, 576]
    - [0, 19.039]
  - - [2112, 576, 1, 256, 2112, 2112, 2112, 576]
    - [0, 19.173]
  - - [2240, 576, 1, 256, 2240, 2240, 2240, 576]
    - [0, 19.198]
  - - [2368, 576, 1, 256, 2368, 2368, 2368, 576]
    - [0, 19.205]
  - - [2496, 576, 1, 256, 2496, 2496, 2496, 576]
    - [0, 19.586]
  - - [2624, 576, 1, 256, 2624, 2624, 2624, 576]
    - [0, 20.095]
  - - [2752, 576, 1, 256, 2752, 2752, 2752, 576]
    - [0, 19.921]
  - - [2880, 576, 1, 256, 2880, 2880, 2880, 576]
    - [0, 19.864]
  - - [3008, 576, 1, 256, 3008, 3008, 3008, 576]
    - [0, 19.647]
  - - [3136, 576, 1, 256, 3136, 3136, 3136, 576]
    - [0, 19.947]
  - - [3264, 576, 1, 256, 3264, 3264, 3264, 576]
    - [0, 20.386]
  - - [3392, 576, 1, 256, 3392, 3392, 3392, 576]
    - [0, 20.159]
  - - [3520, 576, 1, 256, 3520, 3520, 3520, 576]
    - [2, 19.273]
  - - [3648, 576, 1, 256, 3648, 3648, 3648, 576]
    - [3, 18.713]
  - - [3776, 576, 1, 256, 3776, 3776, 3776, 576]
    - [2, 18.987]
  - - [3904, 576, 1, 256, 3904, 3904, 3904, 576]
    - [2, 19.758]
  - - [4032, 576, 1, 256, 4032, 4032, 4032, 576]
    - [0, 20.534]
  - - [64, 704, 1, 256, 64, 64, 64, 704]
    - [0, 3.389]
  - - [192, 704, 1, 256, 192, 192, 192, 704]
    - [0, 7.685]
  - - [320, 704, 1, 256, 320, 320, 320, 704]
    - [0, 10.43]
  - - [448, 704, 1, 256, 448, 448, 448, 704]
    - [0, 12.247]
  - - [576, 704, 1, 256, 576, 576, 576, 704]
    - [0, 13.554]
  - - [704, 704, 1, 256, 704, 704, 704, 704]
    - [0, 14.674]
  - - [832, 704, 1, 256, 832, 832, 832, 704]
    - [0, 16.08]
  - - [960, 704, 1, 256, 960, 960, 960, 704]
    - [0, 16.611]
  - - [1088, 704, 1, 256, 1088, 1088, 1088, 704]
    - [0, 17.054]
  - - [1216, 704, 1, 256, 1216, 1216, 1216, 704]
    - [0, 17.487]
  - - [1344, 704, 1, 256, 1344, 1344, 1344, 704]
    - [0, 17.902]
  - - [1472, 704, 1, 256, 1472, 1472, 1472, 704]
    - [0, 18.271]
  - - [1600, 704, 1, 256, 1600, 1600, 1600, 704]
    - [0, 18.974]
  - - [1728, 704, 1, 256, 1728, 1728, 1728, 704]
    - [0, 18.666]
  - - [1856, 704, 1, 256, 1856, 1856, 1856, 704]
    - [0, 19.347]
  - - [1984, 704, 1, 256, 1984, 1984, 1984, 704]
    - [0, 18.938]
  - - [2112, 704, 1, 256, 2112, 2112, 2112, 704]
    - [0, 19.603]
  - - [2240, 704, 1, 256, 2240, 2240, 2240, 704]
    - [0, 19.645]
  - - [2368, 704, 1, 256, 2368, 2368, 2368, 704]
    - [0, 19.647]
  - - [2496, 704, 1, 256, 2496, 2496, 2496, 704]
    - [0, 19.758]
  - - [2624, 704, 1, 256, 2624, 2624, 2624, 704]
    - [0, 19.222]
  - - [2752, 704, 1, 256, 2752, 2752, 2752, 704]
    - [0, 19.924]
  - - [2880, 704, 1, 256, 2880, 2880, 2880, 704]
    - [0, 19.711]
  - - [3008, 704, 1, 256, 3008, 3008, 3008, 704]
    - [2, 18.882]
  - - [3136, 704, 1, 256, 3136, 3136, 3136, 704]
    - [0, 18.784]
  - - [3264, 704, 1, 256, 3264, 3264, 3264, 704]
    - [2, 18.916]
  - - [3392, 704, 1, 256, 3392, 3392, 3392, 704]
    - [0, 18.832]
  - - [3520, 704, 1, 256, 3520, 3520, 3520, 704]
    - [0, 19.149]
  - - [3648, 704, 1, 256, 3648, 3648, 3648, 704]
    - [0, 19.568]
  - - [3776, 704, 1, 256, 3776, 3776, 3776, 704]
    - [0, 20.367]
  - - [3904, 704, 1, 256, 3904, 3904, 3904, 704]
    - [0, 18.708]
  - - [4032, 704, 1, 256, 4032, 4032, 4032, 704]
    - [0, 18.91]
  - - [64, 832, 1, 256, 64, 64, 64, 832]
    - [1, 0.965]
  - - [192, 832, 1, 256, 192, 192, 192, 832]
    - [0, 2.645]
  - - [320, 832, 1, 256, 320, 320, 320, 832]
    - [3, 4.428]
  - - [448, 832, 1, 256, 448, 448, 448, 832]
    - [0, 6.157]
  - - [576, 832, 1, 256, 576, 576, 576, 832]
    - [2, 14.091]
  - - [704, 832, 1, 256, 704, 704, 704, 832]
    - [0, 16.041]
  - - [832, 832, 1, 256, 832, 832, 832, 832]
    - [0, 16.38]
  - - [960, 832, 1, 256, 960, 960, 960, 832]
    - [0, 17.136]
  - - [1088, 832, 1, 256, 1088, 1088, 1088, 832]
    - [0, 17.77]
  - - [1216, 832, 1, 256, 1216, 1216, 1216, 832]
    - [0, 18.21]
  - - [1344, 832, 1, 256, 1344, 1344, 1344, 832]
    - [0, 18.983]
  - - [1472, 832, 1, 256, 1472, 1472, 1472, 832]
    - [0, 19.138]
  - - [1600, 832, 1, 256, 1600, 1600, 1600, 832]
    - [0, 19.163]
  - - [1728, 832, 1, 256, 1728, 1728, 1728, 832]
    - [0, 19.481]
  - - [1856, 832, 1, 256, 1856, 1856, 1856, 832]
    - [0, 19.919]
  - - [1984, 832, 1, 256, 1984, 1984, 1984, 832]
    - [0, 19.593]
  - - [2112, 832, 1, 256, 2112, 2112, 2112, 832]
    - [0, 20.133]
  - - [2240, 832, 1, 256, 2240, 2240, 2240, 832]
    - [0, 18.783]
  - - [2368, 832, 1, 256, 2368, 2368, 2368, 832]
    - [2, 19.098]
  - - [2496, 832, 1, 256, 2496, 2496, 2496, 832]
    - [0, 18.632]
  - - [2624, 832, 1, 256, 2624, 2624, 2624, 832]
    - [0, 18.678]
  - - [2752, 832, 1, 256, 2752, 2752, 2752, 832]
    - [2, 19.197]
  - - [2880, 832, 1, 256, 2880, 2880, 2880, 832]
    - [2, 18.898]
  - - [3008, 832, 1, 256, 3008, 3008, 3008, 832]
    - [3, 18.453]
  - - [3136, 832, 1, 256, 3136, 3136, 3136, 832]
    - [0, 18.622]
  - - [3264, 832, 1, 256, 3264, 3264, 3264, 832]
    - [0, 19.033]
  - - [3392, 832, 1, 256, 3392, 3392, 3392, 832]
    - [0, 20.71]
  - - [3520, 832, 1, 256, 3520, 3520, 3520, 832]
    - [0, 18.711]
  - - [3648, 832, 1, 256, 3648, 3648, 3648, 832]
    - [0, 19.296]
  - - [3776, 832, 1, 256, 3776, 3776, 3776, 832]
    - [0, 18.939]
  - - [3904, 832, 1, 256, 3904, 3904, 3904, 832]
    - [0, 18.878]
  - - [4032, 832, 1, 256, 4032, 4032, 4032, 832]
    - [0, 18.64]
  - - [64, 960, 1, 256, 64, 64, 64, 960]
    - [0, 4.036]
  - - [192, 960, 1, 256, 192, 192, 192, 960]
    - [0, 3.071]
  - - [320, 960, 1, 256, 320, 320, 320, 960]
    - [3, 9.919]
  - - [448, 960, 1, 256, 448, 448, 448, 960]
    - [0, 13.781]
  - - [576, 960, 1, 256, 576, 576, 576, 960]
    - [0, 15.363]
  - - [704, 960, 1, 256, 704, 704, 704, 960]
    - [0, 16.543]
  - - [832, 960, 1, 256, 832, 832, 832, 960]
    - [0, 17.04]
  - - [960, 960, 1, 256, 960, 960, 960, 960]
    - [0, 17.938]
  - - [1088, 960, 1, 256, 1088, 1088, 1088, 960]
    - [0, 18.313]
  - - [1216, 960, 1, 256, 1216, 1216, 1216, 960]
    - [0, 18.783]
  - - [1344, 960, 1, 256, 1344, 1344, 1344, 960]
    - [0, 19.336]
  - - [1472, 960, 1, 256, 1472, 1472, 1472, 960]
    - [0, 19.492]
  - - [1600, 960, 1, 256, 1600, 1600, 1600, 960]
    - [0, 19.678]
  - - [1728, 960, 1, 256, 1728, 1728, 1728, 960]
    - [0, 20.088]
  - - [1856, 960, 1, 256, 1856, 1856, 1856, 960]
    - [0, 20.429]
  - - [1984, 960, 1, 256, 1984, 1984, 1984, 960]
    - [0, 20.245]
  - - [2112, 960, 1, 256, 2112, 2112, 2112, 960]
    - [0, 19.533]
  - - [2240, 960, 1, 256, 2240, 2240, 2240, 960]
    - [0, 19.371]
  - - [2368, 960, 1, 256, 2368, 2368, 2368, 960]
    - [0, 19.185]
  - - [2496, 960, 1, 256, 2496, 2496, 2496, 960]
    - [0, 19.203]
  - - [2624, 960, 1, 256, 2624, 2624, 2624, 960]
    - [0, 18.994]
  - - [2752, 960, 1, 256, 2752, 2752, 2752, 960]
    - [2, 18.397]
  - - [2880, 960, 1, 256, 2880, 2880, 2880, 960]
    - [2, 18.509]
  - - [3008, 960, 1, 256, 3008, 3008, 3008, 960]
    - [0, 18.721]
  - - [3136, 960, 1, 256, 3136, 3136, 3136, 960]
    - [0, 19.126]
  - - [3264, 960, 1, 256, 3264, 3264, 3264, 960]
    - [0, 18.872]
  - - [3392, 960, 1, 256, 3392, 3392, 3392, 960]
    - [0, 19.276]
  - - [3520, 960, 1, 256, 3520, 3520, 3520, 960]
    - [2, 18.786]
  - - [3648, 960, 1, 256, 3648, 3648, 3648, 960]
    - [0, 19.845]
  - - [3776, 960, 1, 256, 3776, 3776, 3776, 960]
    - [0, 19.098]
  - - [3904, 960, 1, 256, 3904, 3904, 3904, 960]
    - [0, 19.477]
  - - [4032, 960, 1, 256, 4032, 4032, 4032, 960]
    - [2, 19.534]
  - - [64, 1088, 1, 256, 64, 64, 64, 1088]
    - [2, 1.156]
  - - [192, 1088, 1, 256, 192, 192, 192, 1088]
    - [3, 6.778]
  - - [320, 1088, 1, 256, 320, 320, 320, 1088]
    - [0, 11.216]
  - - [448, 1088, 1, 256, 448, 448, 448, 1088]
    - [0, 15.041]
  - - [576, 1088, 1, 256, 576, 576, 576, 1088]
    - [0, 16.234]
  - - [704, 1088, 1, 256, 704, 704, 704, 1088]
    - [0, 17.04]
  - - [832, 1088, 1, 256, 832, 832, 832, 1088]
    - [0, 17.74]
  - - [960, 1088, 1, 256, 960, 960, 960, 1088]
    - [0, 18.383]
  - - [1088, 1088, 1, 256, 1088, 1088, 1088, 1088]
    - [0, 18.866]
  - - [1216, 1088, 1, 256, 1216, 1216, 1216, 1088]
    - [0, 19.34]
  - - [1344, 1088, 1, 256, 1344, 1344, 1344, 1088]
    - [0, 19.847]
  - - [1472, 1088, 1, 256, 1472, 1472, 1472, 1088]
    - [0, 19.66]
  - - [1600, 1088, 1, 256, 1600, 1600, 1600, 1088]
    - [0, 20.221]
  - - [1728, 1088, 1, 256, 1728, 1728, 1728, 1088]
    - [0, 19.932]
  - - [1856, 1088, 1, 256, 1856, 1856, 1856, 1088]
    - [0, 19.725]
  - - [1984, 1088, 1, 256, 1984, 1984, 1984, 1088]
    - [0, 20.08]
  - - [2112, 1088, 1, 256, 2112, 2112, 2112, 1088]
    - [0, 19.744]
  - - [2240, 1088, 1, 256, 2240, 2240, 2240, 1088]
    - [2, 19.218]
  - - [2368, 1088, 1, 256, 2368, 2368, 2368, 1088]
    - [0, 19.303]
  - - [2496, 1088, 1, 256, 2496, 2496, 2496, 1088]
    - [0, 19.482]
  - - [2624, 1088, 1, 256, 2624, 2624, 2624, 1088]
    - [0, 19.095]
  - - [2752, 1088, 1, 256, 2752, 2752, 2752, 1088]
    - [3, 18.531]
  - - [2880, 1088, 1, 256, 2880, 2880, 2880, 1088]
    - [0, 19.2]
  - - [3008, 1088, 1, 256, 3008, 3008, 3008, 1088]
    - [0, 19.06]
  - - [3136, 1088, 1, 256, 3136, 3136, 3136, 1088]
    - [0, 19.234]
  - - [3264, 1088, 1, 256, 3264, 3264, 3264, 1088]
    - [2, 18.946]
  - - [3392, 1088, 1, 256, 3392, 3392, 3392, 1088]
    - [0, 19.83]
  - - [3520, 1088, 1, 256, 3520, 3520, 3520, 1088]
    - [0, 19.582]
  - - [3648, 1088, 1, 256, 3648, 3648, 3648, 1088]
    - [0, 19.653]
  - - [3776, 1088, 1, 256, 3776, 3776, 3776, 1088]
    - [0, 19.748]
  - - [3904, 1088, 1, 256, 3904, 3904, 3904, 1088]
    - [0, 19.056]
  - - [4032, 1088, 1, 256, 4032, 4032, 4032, 1088]
    - [2, 19.428]
  - - [64, 1216, 1, 256, 64, 64, 64, 1216]
    - [3, 1.294]
  - - [192, 1216, 1, 256, 192, 192, 192, 1216]
    - [3, 7.505]
  - - [320, 1216, 1, 256, 320, 320, 320, 1216]
    - [2, 12.424]
  - - [448, 1216, 1, 256, 448, 448, 448, 1216]
    - [0, 15.271]
  - - [576, 1216, 1, 256, 576, 576, 576, 1216]
    - [0, 16.482]
  - - [704, 1216, 1, 256, 704, 704, 704, 1216]
    - [0, 17.428]
  - - [832, 1216, 1, 256, 832, 832, 832, 1216]
    - [0, 18.206]
  - - [960, 1216, 1, 256, 960, 960, 960, 1216]
    - [0, 18.939]
  - - [1088, 1216, 1, 256, 1088, 1088, 1088, 1216]
    - [0, 19.403]
  - - [1216, 1216, 1, 256, 1216, 1216, 1216, 1216]
    - [0, 19.642]
  - - [1344, 1216, 1, 256, 1344, 1344, 1344, 1216]
    - [0, 19.543]
  - - [1472, 1216, 1, 256, 1472, 1472, 1472, 1216]
    - [0, 19.879]
  - - [1600, 1216, 1, 256, 1600, 1600, 1600, 1216]
    - [0, 19.324]
  - - [1728, 1216, 1, 256, 1728, 1728, 1728, 1216]
    - [0, 20.37]
  - - [1856, 1216, 1, 256, 1856, 1856, 1856, 1216]
    - [2, 19.013]
  - - [1984, 1216, 1, 256, 1984, 1984, 1984, 1216]
    - [0, 19.767]
  - - [2112, 1216, 1, 256, 2112, 2112, 2112, 1216]
    - [0, 19.01]
  - - [2240, 1216, 1, 256, 2240, 2240, 2240, 1216]
    - [0, 19.691]
  - - [2368, 1216, 1, 256, 2368, 2368, 2368, 1216]
    - [3, 18.676]
  - - [2496, 1216, 1, 256, 2496, 2496, 2496, 1216]
    - [0, 20.293]
  - - [2624, 1216, 1, 256, 2624, 2624, 2624, 1216]
    - [0, 19.234]
  - - [2752, 1216, 1, 256, 2752, 2752, 2752, 1216]
    - [0, 18.888]
  - - [2880, 1216, 1, 256, 2880, 2880, 2880, 1216]
    - [2, 19.089]
  - - [3008, 1216, 1, 256, 3008, 3008, 3008, 1216]
    - [0, 19.652]
  - - [3136, 1216, 1, 256, 3136, 3136, 3136, 1216]
    - [2, 19.115]
  - - [3264, 1216, 1, 256, 3264, 3264, 3264, 1216]
    - [0, 19.289]
  - - [3392, 1216, 1, 256, 3392, 3392, 3392, 1216]
    - [3, 19.404]
  - - [3520, 1216, 1, 256, 3520, 3520, 3520, 1216]
    - [0, 19.459]
  - - [3648, 1216, 1, 256, 3648, 3648, 3648, 1216]
    - [2, 19.857]
  - - [3776, 1216, 1, 256, 3776, 3776, 3776, 1216]
    - [0, 19.916]
  - - [3904, 1216, 1, 256, 3904, 3904, 3904, 1216]
    - [2, 19.995]
  - - [4032, 1216, 1, 256, 4032, 4032, 4032, 1216]
    - [2, 19.998]
  - - [64, 1344, 1, 256, 64, 64, 64, 1344]
    - [3, 1.745]
  - - [192, 1344, 1, 256, 192, 192, 192, 1344]
    - [0, 4.272]
  - - [320, 1344, 1, 256, 320, 320, 320, 1344]
    - [0, 14.193]
  - - [448, 1344, 1, 256, 448, 448, 448, 1344]
    - [0, 15.851]
  - - [576, 1344, 1, 256, 576, 576, 576, 1344]
    - [0, 17.256]
  - - [704, 1344, 1, 256, 704, 704, 704, 1344]
    - [0, 17.978]
  - - [832, 1344, 1, 256, 832, 832, 832, 1344]
    - [0, 18.709]
  - - [960, 1344, 1, 256, 960, 960, 960, 1344]
    - [0, 19.233]
  - - [1088, 1344, 1, 256, 1088, 1088, 1088, 1344]
    - [0, 19.486]
  - - [1216, 1344, 1, 256, 1216, 1216, 1216, 1344]
    - [0, 19.836]
  - - [1344, 1344, 1, 256, 1344, 1344, 1344, 1344]
    - [0, 19.865]
  - - [1472, 1344, 1, 256, 1472, 1472, 1472, 1344]
    - [2, 19.32]
  - - [1600, 1344, 1, 256, 1600, 1600, 1600, 1344]
    - [0, 19.39]
  - - [1728, 1344, 1, 256, 1728, 1728, 1728, 1344]
    - [0, 19.347]
  - - [1856, 1344, 1, 256, 1856, 1856, 1856, 1344]
    - [0, 19.584]
  - - [1984, 1344, 1, 256, 1984, 1984, 1984, 1344]
    - [0, 20.198]
  - - [2112, 1344, 1, 256, 2112, 2112, 2112, 1344]
    - [0, 18.573]
  - - [2240, 1344, 1, 256, 2240, 2240, 2240, 1344]
    - [0, 18.448]
  - - [2368, 1344, 1, 256, 2368, 2368, 2368, 1344]
    - [0, 19.326]
  - - [2496, 1344, 1, 256, 2496, 2496, 2496, 1344]
    - [2, 18.91]
  - - [2624, 1344, 1, 256, 2624, 2624, 2624, 1344]
    - [0, 18.893]
  - - [2752, 1344, 1, 256, 2752, 2752, 2752, 1344]
    - [0, 18.852]
  - - [2880, 1344, 1, 256, 2880, 2880, 2880, 1344]
    - [0, 20.126]
  - - [3008, 1344, 1, 256, 3008, 3008, 3008, 1344]
    - [0, 19.733]
  - - [3136, 1344, 1, 256, 3136, 3136, 3136, 1344]
    - [0, 20.01]
  - - [3264, 1344, 1, 256, 3264, 3264, 3264, 1344]
    - [2, 19.442]
  - - [3392, 1344, 1, 256, 3392, 3392, 3392, 1344]
    - [2, 19.502]
  - - [3520, 1344, 1, 256, 3520, 3520, 3520, 1344]
    - [0, 19.956]
  - - [3648, 1344, 1, 256, 3648, 3648, 3648, 1344]
    - [2, 19.787]
  - - [3776, 1344, 1, 256, 3776, 3776, 3776, 1344]
    - [0, 20.083]
  - - [3904, 1344, 1, 256, 3904, 3904, 3904, 1344]
    - [0, 19.709]
  - - [4032, 1344, 1, 256, 4032, 4032, 4032, 1344]
    - [2, 19.998]
  - - [64, 1472, 1, 256, 64, 64, 64, 1472]
    - [2, 5.883]
  - - [192, 1472, 1, 256, 192, 192, 192, 1472]
    - [3, 9.057]
  - - [320, 1472, 1, 256, 320, 320, 320, 1472]
    - [0, 14.471]
  - - [448, 1472, 1, 256, 448, 448, 448, 1472]
    - [0, 16.031]
  - - [576, 1472, 1, 256, 576, 576, 576, 1472]
    - [0, 17.276]
  - - [704, 1472, 1, 256, 704, 704, 704, 1472]
    - [0, 18.143]
  - - [832, 1472, 1, 256, 832, 832, 832, 1472]
    - [0, 19.057]
  - - [960, 1472, 1, 256, 960, 960, 960, 1472]
    - [0, 19.333]
  - - [1088, 1472, 1, 256, 1088, 1088, 1088, 1472]
    - [0, 19.392]
  - - [1216, 1472, 1, 256, 1216, 1216, 1216, 1472]
    - [0, 19.591]
  - - [1344, 1472, 1, 256, 1344, 1344, 1344, 1472]
    - [0, 19.043]
  - - [1472, 1472, 1, 256, 1472, 1472, 1472, 1472]
    - [0, 19.906]
  - - [1600, 1472, 1, 256, 1600, 1600, 1600, 1472]
    - [0, 19.791]
  - - [1728, 1472, 1, 256, 1728, 1728, 1728, 1472]
    - [0, 18.674]
  - - [1856, 1472, 1, 256, 1856, 1856, 1856, 1472]
    - [0, 18.907]
  - - [1984, 1472, 1, 256, 1984, 1984, 1984, 1472]
    - [0, 19.907]
  - - [2112, 1472, 1, 256, 2112, 2112, 2112, 1472]
    - [0, 19.408]
  - - [2240, 1472, 1, 256, 2240, 2240, 2240, 1472]
    - [0, 18.854]
  - - [2368, 1472, 1, 256, 2368, 2368, 2368, 1472]
    - [2, 19.198]
  - - [2496, 1472, 1, 256, 2496, 2496, 2496, 1472]
    - [0, 19.355]
  - - [2624, 1472, 1, 256, 2624, 2624, 2624, 1472]
    - [0, 19.466]
  - - [2752, 1472, 1, 256, 2752, 2752, 2752, 1472]
    - [0, 19.27]
  - - [2880, 1472, 1, 256, 2880, 2880, 2880, 1472]
    - [2, 19.913]
  - - [3008, 1472, 1, 256, 3008, 3008, 3008, 1472]
    - [0, 19.479]
  - - [3136, 1472, 1, 256, 3136, 3136, 3136, 1472]
    - [2, 19.438]
  - - [3264, 1472, 1, 256, 3264, 3264, 3264, 1472]
    - [2, 19.981]
  - - [3392, 1472, 1, 256, 3392, 3392, 3392, 1472]
    - [2, 20.552]
  - - [3520, 1472, 1, 256, 3520, 3520, 3520, 1472]
    - [2, 19.626]
  - - [3648, 1472, 1, 256, 3648, 3648, 3648, 1472]
    - [2, 19.965]
  - - [3776, 1472, 1, 256, 3776, 3776, 3776, 1472]
    - [0, 19.808]
  - - [3904, 1472, 1, 256, 3904, 3904, 3904, 1472]
    - [3, 19.656]
  - - [4032, 1472, 1, 256, 4032, 4032, 4032, 1472]
    - [0, 20.078]
  - - [64, 1600, 1, 256, 64, 64, 64, 1600]
    - [2, 1.703]
  - - [192, 1600, 1, 256, 192, 192, 192, 1600]
    - [0, 9.854]
  - - [320, 1600, 1, 256, 320, 320, 320, 1600]
    - [0, 14.879]
  - - [448, 1600, 1, 256, 448, 448, 448, 1600]
    - [0, 16.523]
  - - [576, 1600, 1, 256, 576, 576, 576, 1600]
    - [0, 17.74]
  - - [704, 1600, 1, 256, 704, 704, 704, 1600]
    - [0, 18.48]
  - - [832, 1600, 1, 256, 832, 832, 832, 1600]
    - [0, 19.026]
  - - [960, 1600, 1, 256, 960, 960, 960, 1600]
    - [0, 19.473]
  - - [1088, 1600, 1, 256, 1088, 1088, 1088, 1600]
    - [0, 20.358]
  - - [1216, 1600, 1, 256, 1216, 1216, 1216, 1600]
    - [0, 19.128]
  - - [1344, 1600, 1, 256, 1344, 1344, 1344, 1600]
    - [0, 19.604]
  - - [1472, 1600, 1, 256, 1472, 1472, 1472, 1600]
    - [2, 18.691]
  - - [1600, 1600, 1, 256, 1600, 1600, 1600, 1600]
    - [0, 19.212]
  - - [1728, 1600, 1, 256, 1728, 1728, 1728, 1600]
    - [0, 18.589]
  - - [1856, 1600, 1, 256, 1856, 1856, 1856, 1600]
    - [0, 19.41]
  - - [1984, 1600, 1, 256, 1984, 1984, 1984, 1600]
    - [2, 18.691]
  - - [2112, 1600, 1, 256, 2112, 2112, 2112, 1600]
    - [0, 19.205]
  - - [2240, 1600, 1, 256, 2240, 2240, 2240, 1600]
    - [0, 18.957]
  - - [2368, 1600, 1, 256, 2368, 2368, 2368, 1600]
    - [2, 19.019]
  - - [2496, 1600, 1, 256, 2496, 2496, 2496, 1600]
    - [0, 19.49]
  - - [2624, 1600, 1, 256, 2624, 2624, 2624, 1600]
    - [0, 19.92]
  - - [2752, 1600, 1, 256, 2752, 2752, 2752, 1600]
    - [2, 19.679]
  - - [2880, 1600, 1, 256, 2880, 2880, 2880, 1600]
    - [2, 19.973]
  - - [3008, 1600, 1, 256, 3008, 3008, 3008, 1600]
    - [2, 19.786]
  - - [3136, 1600, 1, 256, 3136, 3136, 3136, 1600]
    - [2, 20.431]
  - - [3264, 1600, 1, 256, 3264, 3264, 3264, 1600]
    - [0, 19.989]
  - - [3392, 1600, 1, 256, 3392, 3392, 3392, 1600]
    - [0, 20.07]
  - - [3520, 1600, 1, 256, 3520, 3520, 3520, 1600]
    - [2, 20.042]
  - - [3648, 1600, 1, 256, 3648, 3648, 3648, 1600]
    - [2, 19.852]
  - - [3776, 1600, 1, 256, 3776, 3776, 3776, 1600]
    - [2, 19.789]
  - - [3904, 1600, 1, 256, 3904, 3904, 3904, 1600]
    - [0, 20.22]
  - - [4032, 1600, 1, 256, 4032, 4032, 4032, 1600]
    - [2, 19.796]
  - - [64, 1728, 1, 256, 64, 64, 64, 1728]
    - [2, 6.291]
  - - [192, 1728, 1, 256, 192, 192, 192, 1728]
    - [0, 12.659]
  - - [320, 1728, 1, 256, 320, 320, 320, 1728]
    - [0, 15.204]
  - - [448, 1728, 1, 256, 448, 448, 448, 1728]
    - [0, 16.982]
  - - [576, 1728, 1, 256, 576, 576, 576, 1728]
    - [0, 18.009]
  - - [704, 1728, 1, 256, 704, 704, 704, 1728]
    - [0, 18.835]
  - - [832, 1728, 1, 256, 832, 832, 832, 1728]
    - [0, 19.179]
  - - [960, 1728, 1, 256, 960, 960, 960, 1728]
    - [0, 19.66]
  - - [1088, 1728, 1, 256, 1088, 1088, 1088, 1728]
    - [0, 20.355]
  - - [1216, 1728, 1, 256, 1216, 1216, 1216, 1728]
    - [0, 19.272]
  - - [1344, 1728, 1, 256, 1344, 1344, 1344, 1728]
    - [0, 19.336]
  - - [1472, 1728, 1, 256, 1472, 1472, 1472, 1728]
    - [0, 19.86]
  - - [1600, 1728, 1, 256, 1600, 1600, 1600, 1728]
    - [0, 19.755]
  - - [1728, 1728, 1, 256, 1728, 1728, 1728, 1728]
    - [0, 18.864]
  - - [1856, 1728, 1, 256, 1856, 1856, 1856, 1728]
    - [0, 18.527]
  - - [1984, 1728, 1, 256, 1984, 1984, 1984, 1728]
    - [0, 19.134]
  - - [2112, 1728, 1, 256, 2112, 2112, 2112, 1728]
    - [3, 18.117]
  - - [2240, 1728, 1, 256, 2240, 2240, 2240, 1728]
    - [0, 18.857]
  - - [2368, 1728, 1, 256, 2368, 2368, 2368, 1728]
    - [0, 19.288]
  - - [2496, 1728, 1, 256, 2496, 2496, 2496, 1728]
    - [2, 19.415]
  - - [2624, 1728, 1, 256, 2624, 2624, 2624, 1728]
    - [2, 19.942]
  - - [2752, 1728, 1, 256, 2752, 2752, 2752, 1728]
    - [2, 19.812]
  - - [2880, 1728, 1, 256, 2880, 2880, 2880, 1728]
    - [2, 19.252]
  - - [3008, 1728, 1, 256, 3008, 3008, 3008, 1728]
    - [3, 19.471]
  - - [3136, 1728, 1, 256, 3136, 3136, 3136, 1728]
    - [2, 20.108]
  - - [3264, 1728, 1, 256, 3264, 3264, 3264, 1728]
    - [2, 20.016]
  - - [3392, 1728, 1, 256, 3392, 3392, 3392, 1728]
    - [0, 20.011]
  - - [3520, 1728, 1, 256, 3520, 3520, 3520, 1728]
    - [2, 20.397]
  - - [3648, 1728, 1, 256, 3648, 3648, 3648, 1728]
    - [2, 19.676]
  - - [3776, 1728, 1, 256, 3776, 3776, 3776, 1728]
    - [2, 20.122]
  - - [3904, 1728, 1, 256, 3904, 3904, 3904, 1728]
    - [0, 20.175]
  - - [4032, 1728, 1, 256, 4032, 4032, 4032, 1728]
    - [3, 19.721]
  - - [64, 1856, 1, 256, 64, 64, 64, 1856]
    - [2, 1.97]
  - - [192, 1856, 1, 256, 192, 192, 192, 1856]
    - [0, 11.5]
  - - [320, 1856, 1, 256, 320, 320, 320, 1856]
    - [0, 15.499]
  - - [448, 1856, 1, 256, 448, 448, 448, 1856]
    - [0, 17.24]
  - - [576, 1856, 1, 256, 576, 576, 576, 1856]
    - [0, 18.313]
  - - [704, 1856, 1, 256, 704, 704, 704, 1856]
    - [0, 19.128]
  - - [832, 1856, 1, 256, 832, 832, 832, 1856]
    - [0, 19.04]
  - - [960, 1856, 1, 256, 960, 960, 960, 1856]
    - [2, 19.075]
  - - [1088, 1856, 1, 256, 1088, 1088, 1088, 1856]
    - [0, 19.787]
  - - [1216, 1856, 1, 256, 1216, 1216, 1216, 1856]
    - [2, 18.887]
  - - [1344, 1856, 1, 256, 1344, 1344, 1344, 1856]
    - [2, 18.998]
  - - [1472, 1856, 1, 256, 1472, 1472, 1472, 1856]
    - [0, 18.632]
  - - [1600, 1856, 1, 256, 1600, 1600, 1600, 1856]
    - [2, 18.542]
  - - [1728, 1856, 1, 256, 1728, 1728, 1728, 1856]
    - [0, 18.975]
  - - [1856, 1856, 1, 256, 1856, 1856, 1856, 1856]
    - [2, 19.094]
  - - [1984, 1856, 1, 256, 1984, 1984, 1984, 1856]
    - [0, 19.359]
  - - [2112, 1856, 1, 256, 2112, 2112, 2112, 1856]
    - [0, 19.689]
  - - [2240, 1856, 1, 256, 2240, 2240, 2240, 1856]
    - [2, 19.533]
  - - [2368, 1856, 1, 256, 2368, 2368, 2368, 1856]
    - [2, 19.232]
  - - [2496, 1856, 1, 256, 2496, 2496, 2496, 1856]
    - [2, 19.698]
  - - [2624, 1856, 1, 256, 2624, 2624, 2624, 1856]
    - [2, 19.87]
  - - [2752, 1856, 1, 256, 2752, 2752, 2752, 1856]
    - [0, 20.279]
  - - [2880, 1856, 1, 256, 2880, 2880, 2880, 1856]
    - [0, 19.663]
  - - [3008, 1856, 1, 256, 3008, 3008, 3008, 1856]
    - [0, 20.203]
  - - [3136, 1856, 1, 256, 3136, 3136, 3136, 1856]
    - [2, 19.989]
  - - [3264, 1856, 1, 256, 3264, 3264, 3264, 1856]
    - [2, 20.155]
  - - [3392, 1856, 1, 256, 3392, 3392, 3392, 1856]
    - [2, 19.781]
  - - [3520, 1856, 1, 256, 3520, 3520, 3520, 1856]
    - [0, 19.442]
  - - [3648, 1856, 1, 256, 3648, 3648, 3648, 1856]
    - [2, 19.733]
  - - [3776, 1856, 1, 256, 3776, 3776, 3776, 1856]
    - [0, 20.114]
  - - [3904, 1856, 1, 256, 3904, 3904, 3904, 1856]
    - [0, 19.923]
  - - [4032, 1856, 1, 256, 4032, 4032, 4032, 1856]
    - [0, 20.013]
  - - [64, 1984, 1, 256, 64, 64, 64, 1984]
    - [0, 7.249]
  - - [192, 1984, 1, 256, 192, 192, 192, 1984]
    - [0, 13.488]
  - - [320, 1984, 1, 256, 320, 320, 320, 1984]
    - [0, 16.096]
  - - [448, 1984, 1, 256, 448, 448, 448, 1984]
    - [0, 17.509]
  - - [576, 1984, 1, 256, 576, 576, 576, 1984]
    - [0, 18.574]
  - - [704, 1984, 1, 256, 704, 704, 704, 1984]
    - [0, 19.318]
  - - [832, 1984, 1, 256, 832, 832, 832, 1984]
    - [0, 19.643]
  - - [960, 1984, 1, 256, 960, 960, 960, 1984]
    - [0, 19.904]
  - - [1088, 1984, 1, 256, 1088, 1088, 1088, 1984]
    - [0, 18.818]
  - - [1216, 1984, 1, 256, 1216, 1216, 1216, 1984]
    - [0, 19.72]
  - - [1344, 1984, 1, 256, 1344, 1344, 1344, 1984]
    - [0, 18.691]
  - - [1472, 1984, 1, 256, 1472, 1472, 1472, 1984]
    - [0, 20.193]
  - - [1600, 1984, 1, 256, 1600, 1600, 1600, 1984]
    - [2, 18.217]
  - - [1728, 1984, 1, 256, 1728, 1728, 1728, 1984]
    - [0, 19.001]
  - - [1856, 1984, 1, 256, 1856, 1856, 1856, 1984]
    - [0, 19.451]
  - - [1984, 1984, 1, 256, 1984, 1984, 1984, 1984]
    - [2, 19.542]
  - - [2112, 1984, 1, 256, 2112, 2112, 2112, 1984]
    - [2, 19.816]
  - - [2240, 1984, 1, 256, 2240, 2240, 2240, 1984]
    - [2, 19.883]
  - - [2368, 1984, 1, 256, 2368, 2368, 2368, 1984]
    - [2, 19.866]
  - - [2496, 1984, 1, 256, 2496, 2496, 2496, 1984]
    - [3, 19.513]
  - - [2624, 1984, 1, 256, 2624, 2624, 2624, 1984]
    - [3, 19.849]
  - - [2752, 1984, 1, 256, 2752, 2752, 2752, 1984]
    - [2, 19.801]
  - - [2880, 1984, 1, 256, 2880, 2880, 2880, 1984]
    - [3, 19.691]
  - - [3008, 1984, 1, 256, 3008, 3008, 3008, 1984]
    - [2, 19.898]
  - - [3136, 1984, 1, 256, 3136, 3136, 3136, 1984]
    - [0, 19.751]
  - - [3264, 1984, 1, 256, 3264, 3264, 3264, 1984]
    - [2, 19.906]
  - - [3392, 1984, 1, 256, 3392, 3392, 3392, 1984]
    - [0, 19.885]
  - - [3520, 1984, 1, 256, 3520, 3520, 3520, 1984]
    - [2, 19.564]
  - - [3648, 1984, 1, 256, 3648, 3648, 3648, 1984]
    - [2, 19.583]
  - - [3776, 1984, 1, 256, 3776, 3776, 3776, 1984]
    - [0, 19.578]
  - - [3904, 1984, 1, 256, 3904, 3904, 3904, 1984]
    - [0, 19.987]
  - - [4032, 1984, 1, 256, 4032, 4032, 4032, 1984]
    - [0, 19.967]
  - - [64, 2112, 1, 256, 64, 64, 64, 2112]
    - [2, 2.232]
  - - [192, 2112, 1, 256, 192, 192, 192, 2112]
    - [0, 13.028]
  - - [320, 2112, 1, 256, 320, 320, 320, 2112]
    - [0, 16.286]
  - - [448, 2112, 1, 256, 448, 448, 448, 2112]
    - [0, 17.797]
  - - [576, 2112, 1, 256, 576, 576, 576, 2112]
    - [0, 18.801]
  - - [704, 2112, 1, 256, 704, 704, 704, 2112]
    - [0, 18.738]
  - - [832, 2112, 1, 256, 832, 832, 832, 2112]
    - [3, 18.477]
  - - [960, 2112, 1, 256, 960, 960, 960, 2112]
    - [0, 19.659]
  - - [1088, 2112, 1, 256, 1088, 1088, 1088, 2112]
    - [2, 19.233]
  - - [1216, 2112, 1, 256, 1216, 1216, 1216, 2112]
    - [0, 19.233]
  - - [1344, 2112, 1, 256, 1344, 1344, 1344, 2112]
    - [3, 18.181]
  - - [1472, 2112, 1, 256, 1472, 1472, 1472, 2112]
    - [0, 19.233]
  - - [1600, 2112, 1, 256, 1600, 1600, 1600, 2112]
    - [2, 18.355]
  - - [1728, 2112, 1, 256, 1728, 1728, 1728, 2112]
    - [2, 18.529]
  - - [1856, 2112, 1, 256, 1856, 1856, 1856, 2112]
    - [3, 19.458]
  - - [1984, 2112, 1, 256, 1984, 1984, 1984, 2112]
    - [0, 19.682]
  - - [2112, 2112, 1, 256, 2112, 2112, 2112, 2112]
    - [2, 19.833]
  - - [2240, 2112, 1, 256, 2240, 2240, 2240, 2112]
    - [0, 20.095]
  - - [2368, 2112, 1, 256, 2368, 2368, 2368, 2112]
    - [2, 19.969]
  - - [2496, 2112, 1, 256, 2496, 2496, 2496, 2112]
    - [2, 19.538]
  - - [2624, 2112, 1, 256, 2624, 2624, 2624, 2112]
    - [2, 19.8]
  - - [2752, 2112, 1, 256, 2752, 2752, 2752, 2112]
    - [0, 19.78]
  - - [2880, 2112, 1, 256, 2880, 2880, 2880, 2112]
    - [0, 20.32]
  - - [3008, 2112, 1, 256, 3008, 3008, 3008, 2112]
    - [0, 19.546]
  - - [3136, 2112, 1, 256, 3136, 3136, 3136, 2112]
    - [0, 19.467]
  - - [3264, 2112, 1, 256, 3264, 3264, 3264, 2112]
    - [0, 20.62]
  - - [3392, 2112, 1, 256, 3392, 3392, 3392, 2112]
    - [0, 19.616]
  - - [3520, 2112, 1, 256, 3520, 3520, 3520, 2112]
    - [0, 19.894]
  - - [3648, 2112, 1, 256, 3648, 3648, 3648, 2112]
    - [0, 19.561]
  - - [3776, 2112, 1, 256, 3776, 3776, 3776, 2112]
    - [0, 19.5]
  - - [3904, 2112, 1, 256, 3904, 3904, 3904, 2112]
    - [0, 19.448]
  - - [4032, 2112, 1, 256, 4032, 4032, 4032, 2112]
    - [0, 19.761]
  - - [64, 2240, 1, 256, 64, 64, 64, 2240]
    - [1, 4.593]
  - - [192, 2240, 1, 256, 192, 192, 192, 2240]
    - [0, 13.82]
  - - [320, 2240, 1, 256, 320, 320, 320, 2240]
    - [0, 16.46]
  - - [448, 2240, 1, 256, 448, 448, 448, 2240]
    - [0, 17.94]
  - - [576, 2240, 1, 256, 576, 576, 576, 2240]
    - [0, 18.922]
  - - [704, 2240, 1, 256, 704, 704, 704, 2240]
    - [0, 19.41]
  - - [832, 2240, 1, 256, 832, 832, 832, 2240]
    - [0, 19.681]
  - - [960, 2240, 1, 256, 960, 960, 960, 2240]
    - [0, 19.23]
  - - [1088, 2240, 1, 256, 1088, 1088, 1088, 2240]
    - [2, 18.812]
  - - [1216, 2240, 1, 256, 1216, 1216, 1216, 2240]
    - [0, 18.896]
  - - [1344, 2240, 1, 256, 1344, 1344, 1344, 2240]
    - [0, 18.772]
  - - [1472, 2240, 1, 256, 1472, 1472, 1472, 2240]
    - [0, 19.443]
  - - [1600, 2240, 1, 256, 1600, 1600, 1600, 2240]
    - [2, 19.573]
  - - [1728, 2240, 1, 256, 1728, 1728, 1728, 2240]
    - [0, 19.42]
  - - [1856, 2240, 1, 256, 1856, 1856, 1856, 2240]
    - [2, 19.787]
  - - [1984, 2240, 1, 256, 1984, 1984, 1984, 2240]
    - [3, 19.632]
  - - [2112, 2240, 1, 256, 2112, 2112, 2112, 2240]
    - [2, 19.865]
  - - [2240, 2240, 1, 256, 2240, 2240, 2240, 2240]
    - [2, 20.551]
  - - [2368, 2240, 1, 256, 2368, 2368, 2368, 2240]
    - [2, 20.063]
  - - [2496, 2240, 1, 256, 2496, 2496, 2496, 2240]
    - [2, 19.979]
  - - [2624, 2240, 1, 256, 2624, 2624, 2624, 2240]
    - [2, 19.859]
  - - [2752, 2240, 1, 256, 2752, 2752, 2752, 2240]
    - [0, 19.757]
  - - [2880, 2240, 1, 256, 2880, 2880, 2880, 2240]
    - [2, 20.064]
  - - [3008, 2240, 1, 256, 3008, 3008, 3008, 2240]
    - [2, 19.714]
  - - [3136, 2240, 1, 256, 3136, 3136, 3136, 2240]
    - [0, 19.533]
  - - [3264, 2240, 1, 256, 3264, 3264, 3264, 2240]
    - [2, 19.684]
  - - [3392, 2240, 1, 256, 3392, 3392, 3392, 2240]
    - [0, 20.111]
  - - [3520, 2240, 1, 256, 3520, 3520, 3520, 2240]
    - [0, 19.531]
  - - [3648, 2240, 1, 256, 3648, 3648, 3648, 2240]
    - [0, 19.807]
  - - [3776, 2240, 1, 256, 3776, 3776, 3776, 2240]
    - [2, 19.711]
  - - [3904, 2240, 1, 256, 3904, 3904, 3904, 2240]
    - [0, 19.535]
  - - [4032, 2240, 1, 256, 4032, 4032, 4032, 2240]
    - [2, 19.499]
  - - [64, 2368, 1, 256, 64, 64, 64, 2368]
    - [2, 4.887]
  - - [192, 2368, 1, 256, 192, 192, 192, 2368]
    - [0, 14.088]
  - - [320, 2368, 1, 256, 320, 320, 320, 2368]
    - [0, 16.67]
  - - [448, 2368, 1, 256, 448, 448, 448, 2368]
    - [0, 18.217]
  - - [576, 2368, 1, 256, 576, 576, 576, 2368]
    - [0, 19.088]
  - - [704, 2368, 1, 256, 704, 704, 704, 2368]
    - [0, 19.596]
  - - [832, 2368, 1, 256, 832, 832, 832, 2368]
    - [0, 20.038]
  - - [960, 2368, 1, 256, 960, 960, 960, 2368]
    - [0, 18.603]
  - - [1088, 2368, 1, 256, 1088, 1088, 1088, 2368]
    - [0, 18.606]
  - - [1216, 2368, 1, 256, 1216, 1216, 1216, 2368]
    - [0, 19.304]
  - - [1344, 2368, 1, 256, 1344, 1344, 1344, 2368]
    - [0, 18.977]
  - - [1472, 2368, 1, 256, 1472, 1472, 1472, 2368]
    - [2, 18.784]
  - - [1600, 2368, 1, 256, 1600, 1600, 1600, 2368]
    - [3, 18.935]
  - - [1728, 2368, 1, 256, 1728, 1728, 1728, 2368]
    - [2, 19.581]
  - - [1856, 2368, 1, 256, 1856, 1856, 1856, 2368]
    - [0, 19.71]
  - - [1984, 2368, 1, 256, 1984, 1984, 1984, 2368]
    - [2, 20.104]
  - - [2112, 2368, 1, 256, 2112, 2112, 2112, 2368]
    - [2, 19.758]
  - - [2240, 2368, 1, 256, 2240, 2240, 2240, 2368]
    - [2, 20.07]
  - - [2368, 2368, 1, 256, 2368, 2368, 2368, 2368]
    - [0, 20.056]
  - - [2496, 2368, 1, 256, 2496, 2496, 2496, 2368]
    - [2, 19.721]
  - - [2624, 2368, 1, 256, 2624, 2624, 2624, 2368]
    - [2, 19.955]
  - - [2752, 2368, 1, 256, 2752, 2752, 2752, 2368]
    - [2, 19.647]
  - - [2880, 2368, 1, 256, 2880, 2880, 2880, 2368]
    - [0, 19.533]
  - - [3008, 2368, 1, 256, 3008, 3008, 3008, 2368]
    - [3, 19.632]
  - - [3136, 2368, 1, 256, 3136, 3136, 3136, 2368]
    - [2, 20.084]
  - - [3264, 2368, 1, 256, 3264, 3264, 3264, 2368]
    - [0, 19.823]
  - - [3392, 2368, 1, 256, 3392, 3392, 3392, 2368]
    - [2, 19.804]
  - - [3520, 2368, 1, 256, 3520, 3520, 3520, 2368]
    - [0, 19.646]
  - - [3648, 2368, 1, 256, 3648, 3648, 3648, 2368]
    - [0, 19.614]
  - - [3776, 2368, 1, 256, 3776, 3776, 3776, 2368]
    - [0, 19.6]
  - - [3904, 2368, 1, 256, 3904, 3904, 3904, 2368]
    - [0, 19.506]
  - - [4032, 2368, 1, 256, 4032, 4032, 4032, 2368]
    - [2, 19.542]
  - - [64, 2496, 1, 256, 64, 64, 64, 2496]
    - [1, 5.135]
  - - [192, 2496, 1, 256, 192, 192, 192, 2496]
    - [0, 14.637]
  - - [320, 2496, 1, 256, 320, 320, 320, 2496]
    - [0, 16.793]
  - - [448, 2496, 1, 256, 448, 448, 448, 2496]
    - [0, 18.441]
  - - [576, 2496, 1, 256, 576, 576, 576, 2496]
    - [0, 19.434]
  - - [704, 2496, 1, 256, 704, 704, 704, 2496]
    - [0, 19.914]
  - - [832, 2496, 1, 256, 832, 832, 832, 2496]
    - [0, 20.438]
  - - [960, 2496, 1, 256, 960, 960, 960, 2496]
    - [0, 20.469]
  - - [1088, 2496, 1, 256, 1088, 1088, 1088, 2496]
    - [0, 18.939]
  - - [1216, 2496, 1, 256, 1216, 1216, 1216, 2496]
    - [0, 18.993]
  - - [1344, 2496, 1, 256, 1344, 1344, 1344, 2496]
    - [0, 18.612]
  - - [1472, 2496, 1, 256, 1472, 1472, 1472, 2496]
    - [2, 19.198]
  - - [1600, 2496, 1, 256, 1600, 1600, 1600, 2496]
    - [0, 19.227]
  - - [1728, 2496, 1, 256, 1728, 1728, 1728, 2496]
    - [2, 19.186]
  - - [1856, 2496, 1, 256, 1856, 1856, 1856, 2496]
    - [2, 20.186]
  - - [1984, 2496, 1, 256, 1984, 1984, 1984, 2496]
    - [0, 19.716]
  - - [2112, 2496, 1, 256, 2112, 2112, 2112, 2496]
    - [0, 19.813]
  - - [2240, 2496, 1, 256, 2240, 2240, 2240, 2496]
    - [0, 19.956]
  - - [2368, 2496, 1, 256, 2368, 2368, 2368, 2496]
    - [2, 20.137]
  - - [2496, 2496, 1, 256, 2496, 2496, 2496, 2496]
    - [2, 19.935]
  - - [2624, 2496, 1, 256, 2624, 2624, 2624, 2496]
    - [2, 19.684]
  - - [2752, 2496, 1, 256, 2752, 2752, 2752, 2496]
    - [0, 19.387]
  - - [2880, 2496, 1, 256, 2880, 2880, 2880, 2496]
    - [0, 19.845]
  - - [3008, 2496, 1, 256, 3008, 3008, 3008, 2496]
    - [2, 19.585]
  - - [3136, 2496, 1, 256, 3136, 3136, 3136, 2496]
    - [0, 19.528]
  - - [3264, 2496, 1, 256, 3264, 3264, 3264, 2496]
    - [0, 19.495]
  - - [3392, 2496, 1, 256, 3392, 3392, 3392, 2496]
    - [0, 19.702]
  - - [3520, 2496, 1, 256, 3520, 3520, 3520, 2496]
    - [0, 20.089]
  - - [3648, 2496, 1, 256, 3648, 3648, 3648, 2496]
    - [2, 19.664]
  - - [3776, 2496, 1, 256, 3776, 3776, 3776, 2496]
    - [0, 19.75]
  - - [3904, 2496, 1, 256, 3904, 3904, 3904, 2496]
    - [2, 19.637]
  - - [4032, 2496, 1, 256, 4032, 4032, 4032, 2496]
    - [0, 19.45]
  - - [64, 2624, 1, 256, 64, 64, 64, 2624]
    - [3, 5.439]
  - - [192, 2624, 1, 256, 192, 192, 192, 2624]
    - [0, 14.727]
  - - [320, 2624, 1, 256, 320, 320, 320, 2624]
    - [0, 17.137]
  - - [448, 2624, 1, 256, 448, 448, 448, 2624]
    - [0, 18.518]
  - - [576, 2624, 1, 256, 576, 576, 576, 2624]
    - [0, 19.629]
  - - [704, 2624, 1, 256, 704, 704, 704, 2624]
    - [0, 19.39]
  - - [832, 2624, 1, 256, 832, 832, 832, 2624]
    - [0, 19.123]
  - - [960, 2624, 1, 256, 960, 960, 960, 2624]
    - [0, 18.884]
  - - [1088, 2624, 1, 256, 1088, 1088, 1088, 2624]
    - [0, 18.785]
  - - [1216, 2624, 1, 256, 1216, 1216, 1216, 2624]
    - [2, 18.918]
  - - [1344, 2624, 1, 256, 1344, 1344, 1344, 2624]
    - [0, 18.912]
  - - [1472, 2624, 1, 256, 1472, 1472, 1472, 2624]
    - [2, 19.667]
  - - [1600, 2624, 1, 256, 1600, 1600, 1600, 2624]
    - [0, 19.029]
  - - [1728, 2624, 1, 256, 1728, 1728, 1728, 2624]
    - [2, 19.796]
  - - [1856, 2624, 1, 256, 1856, 1856, 1856, 2624]
    - [2, 20.003]
  - - [1984, 2624, 1, 256, 1984, 1984, 1984, 2624]
    - [2, 19.911]
  - - [2112, 2624, 1, 256, 2112, 2112, 2112, 2624]
    - [2, 20.151]
  - - [2240, 2624, 1, 256, 2240, 2240, 2240, 2624]
    - [0, 19.507]
  - - [2368, 2624, 1, 256, 2368, 2368, 2368, 2624]
    - [0, 19.848]
  - - [2496, 2624, 1, 256, 2496, 2496, 2496, 2624]
    - [2, 19.799]
  - - [2624, 2624, 1, 256, 2624, 2624, 2624, 2624]
    - [0, 19.907]
  - - [2752, 2624, 1, 256, 2752, 2752, 2752, 2624]
    - [2, 19.642]
  - - [2880, 2624, 1, 256, 2880, 2880, 2880, 2624]
    - [0, 19.999]
  - - [3008, 2624, 1, 256, 3008, 3008, 3008, 2624]
    - [2, 19.844]
  - - [3136, 2624, 1, 256, 3136, 3136, 3136, 2624]
    - [0, 19.625]
  - - [3264, 2624, 1, 256, 3264, 3264, 3264, 2624]
    - [0, 19.782]
  - - [3392, 2624, 1, 256, 3392, 3392, 3392, 2624]
    - [0, 19.803]
  - - [3520, 2624, 1, 256, 3520, 3520, 3520, 2624]
    - [2, 19.54]
  - - [3648, 2624, 1, 256, 3648, 3648, 3648, 2624]
    - [2, 19.893]
  - - [3776, 2624, 1, 256, 3776, 3776, 3776, 2624]
    - [0, 19.626]
  - - [3904, 2624, 1, 256, 3904, 3904, 3904, 2624]
    - [0, 19.733]
  - - [4032, 2624, 1, 256, 4032, 4032, 4032, 2624]
    - [0, 19.705]
  - - [64, 2752, 1, 256, 64, 64, 64, 2752]
    - [0, 8.943]
  - - [192, 2752, 1, 256, 192, 192, 192, 2752]
    - [0, 15.166]
  - - [320, 2752, 1, 256, 320, 320, 320, 2752]
    - [0, 17.484]
  - - [448, 2752, 1, 256, 448, 448, 448, 2752]
    - [0, 19.016]
  - - [576, 2752, 1, 256, 576, 576, 576, 2752]
    - [0, 19.479]
  - - [704, 2752, 1, 256, 704, 704, 704, 2752]
    - [0, 20.21]
  - - [832, 2752, 1, 256, 832, 832, 832, 2752]
    - [0, 19.526]
  - - [960, 2752, 1, 256, 960, 960, 960, 2752]
    - [0, 18.831]
  - - [1088, 2752, 1, 256, 1088, 1088, 1088, 2752]
    - [0, 18.802]
  - - [1216, 2752, 1, 256, 1216, 1216, 1216, 2752]
    - [0, 20.057]
  - - [1344, 2752, 1, 256, 1344, 1344, 1344, 2752]
    - [0, 19.529]
  - - [1472, 2752, 1, 256, 1472, 1472, 1472, 2752]
    - [0, 19.811]
  - - [1600, 2752, 1, 256, 1600, 1600, 1600, 2752]
    - [2, 19.58]
  - - [1728, 2752, 1, 256, 1728, 1728, 1728, 2752]
    - [2, 19.516]
  - - [1856, 2752, 1, 256, 1856, 1856, 1856, 2752]
    - [0, 19.969]
  - - [1984, 2752, 1, 256, 1984, 1984, 1984, 2752]
    - [0, 19.655]
  - - [2112, 2752, 1, 256, 2112, 2112, 2112, 2752]
    - [2, 19.486]
  - - [2240, 2752, 1, 256, 2240, 2240, 2240, 2752]
    - [2, 19.808]
  - - [2368, 2752, 1, 256, 2368, 2368, 2368, 2752]
    - [2, 19.66]
  - - [2496, 2752, 1, 256, 2496, 2496, 2496, 2752]
    - [0, 20.011]
  - - [2624, 2752, 1, 256, 2624, 2624, 2624, 2752]
    - [0, 20.02]
  - - [2752, 2752, 1, 256, 2752, 2752, 2752, 2752]
    - [2, 19.543]
  - - [2880, 2752, 1, 256, 2880, 2880, 2880, 2752]
    - [2, 20.285]
  - - [3008, 2752, 1, 256, 3008, 3008, 3008, 2752]
    - [2, 19.561]
  - - [3136, 2752, 1, 256, 3136, 3136, 3136, 2752]
    - [0, 19.591]
  - - [3264, 2752, 1, 256, 3264, 3264, 3264, 2752]
    - [0, 19.493]
  - - [3392, 2752, 1, 256, 3392, 3392, 3392, 2752]
    - [0, 19.427]
  - - [3520, 2752, 1, 256, 3520, 3520, 3520, 2752]
    - [2, 19.412]
  - - [3648, 2752, 1, 256, 3648, 3648, 3648, 2752]
    - [2, 20.04]
  - - [3776, 2752, 1, 256, 3776, 3776, 3776, 2752]
    - [0, 19.474]
  - - [3904, 2752, 1, 256, 3904, 3904, 3904, 2752]
    - [0, 19.501]
  - - [4032, 2752, 1, 256, 4032, 4032, 4032, 2752]
    - [0, 19.457]
  - - [64, 2880, 1, 256, 64, 64, 64, 2880]
    - [1, 5.924]
  - - [192, 2880, 1, 256, 192, 192, 192, 2880]
    - [0, 15.169]
  - - [320, 2880, 1, 256, 320, 320, 320, 2880]
    - [0, 17.604]
  - - [448, 2880, 1, 256, 448, 448, 448, 2880]
    - [0, 19.128]
  - - [576, 2880, 1, 256, 576, 576, 576, 2880]
    - [0, 19.642]
  - - [704, 2880, 1, 256, 704, 704, 704, 2880]
    - [0, 20.214]
  - - [832, 2880, 1, 256, 832, 832, 832, 2880]
    - [0, 18.6]
  - - [960, 2880, 1, 256, 960, 960, 960, 2880]
    - [0, 18.348]
  - - [1088, 2880, 1, 256, 1088, 1088, 1088, 2880]
    - [2, 18.955]
  - - [1216, 2880, 1, 256, 1216, 1216, 1216, 2880]
    - [2, 18.455]
  - - [1344, 2880, 1, 256, 1344, 1344, 1344, 2880]
    - [2, 19.484]
  - - [1472, 2880, 1, 256, 1472, 1472, 1472, 2880]
    - [3, 19.686]
  - - [1600, 2880, 1, 256, 1600, 1600, 1600, 2880]
    - [2, 19.871]
  - - [1728, 2880, 1, 256, 1728, 1728, 1728, 2880]
    - [2, 20.315]
  - - [1856, 2880, 1, 256, 1856, 1856, 1856, 2880]
    - [0, 19.919]
  - - [1984, 2880, 1, 256, 1984, 1984, 1984, 2880]
    - [2, 20.262]
  - - [2112, 2880, 1, 256, 2112, 2112, 2112, 2880]
    - [2, 19.98]
  - - [2240, 2880, 1, 256, 2240, 2240, 2240, 2880]
    - [2, 19.91]
  - - [2368, 2880, 1, 256, 2368, 2368, 2368, 2880]
    - [2, 19.567]
  - - [2496, 2880, 1, 256, 2496, 2496, 2496, 2880]
    - [0, 19.907]
  - - [2624, 2880, 1, 256, 2624, 2624, 2624, 2880]
    - [2, 19.5]
  - - [2752, 2880, 1, 256, 2752, 2752, 2752, 2880]
    - [2, 19.517]
  - - [2880, 2880, 1, 256, 2880, 2880, 2880, 2880]
    - [2, 19.667]
  - - [3008, 2880, 1, 256, 3008, 3008, 3008, 2880]
    - [2, 19.625]
  - - [3136, 2880, 1, 256, 3136, 3136, 3136, 2880]
    - [0, 19.79]
  - - [3264, 2880, 1, 256, 3264, 3264, 3264, 2880]
    - [0, 19.624]
  - - [3392, 2880, 1, 256, 3392, 3392, 3392, 2880]
    - [2, 19.596]
  - - [3520, 2880, 1, 256, 3520, 3520, 3520, 2880]
    - [2, 19.805]
  - - [3648, 2880, 1, 256, 3648, 3648, 3648, 2880]
    - [2, 19.721]
  - - [3776, 2880, 1, 256, 3776, 3776, 3776, 2880]
    - [0, 19.695]
  - - [3904, 2880, 1, 256, 3904, 3904, 3904, 2880]
    - [0, 19.953]
  - - [4032, 2880, 1, 256, 4032, 4032, 4032, 2880]
    - [0, 19.692]
  - - [64, 3008, 1, 256, 64, 64, 64, 3008]
    - [0, 9.745]
  - - [192, 3008, 1, 256, 192, 192, 192, 3008]
    - [0, 15.668]
  - - [320, 3008, 1, 256, 320, 320, 320, 3008]
    - [0, 17.769]
  - - [448, 3008, 1, 256, 448, 448, 448, 3008]
    - [0, 19.15]
  - - [576, 3008, 1, 256, 576, 576, 576, 3008]
    - [0, 19.247]
  - - [704, 3008, 1, 256, 704, 704, 704, 3008]
    - [0, 18.72]
  - - [832, 3008, 1, 256, 832, 832, 832, 3008]
    - [0, 19.15]
  - - [960, 3008, 1, 256, 960, 960, 960, 3008]
    - [0, 18.838]
  - - [1088, 3008, 1, 256, 1088, 1088, 1088, 3008]
    - [3, 18.362]
  - - [1216, 3008, 1, 256, 1216, 1216, 1216, 3008]
    - [3, 18.955]
  - - [1344, 3008, 1, 256, 1344, 1344, 1344, 3008]
    - [2, 19.246]
  - - [1472, 3008, 1, 256, 1472, 1472, 1472, 3008]
    - [0, 19.404]
  - - [1600, 3008, 1, 256, 1600, 1600, 1600, 3008]
    - [0, 19.672]
  - - [1728, 3008, 1, 256, 1728, 1728, 1728, 3008]
    - [0, 20.122]
  - - [1856, 3008, 1, 256, 1856, 1856, 1856, 3008]
    - [2, 19.775]
  - - [1984, 3008, 1, 256, 1984, 1984, 1984, 3008]
    - [0, 19.232]
  - - [2112, 3008, 1, 256, 2112, 2112, 2112, 3008]
    - [2, 20.237]
  - - [2240, 3008, 1, 256, 2240, 2240, 2240, 3008]
    - [0, 19.39]
  - - [2368, 3008, 1, 256, 2368, 2368, 2368, 3008]
    - [0, 19.402]
  - - [2496, 3008, 1, 256, 2496, 2496, 2496, 3008]
    - [2, 19.785]
  - - [2624, 3008, 1, 256, 2624, 2624, 2624, 3008]
    - [2, 20.176]
  - - [2752, 3008, 1, 256, 2752, 2752, 2752, 3008]
    - [2, 19.842]
  - - [2880, 3008, 1, 256, 2880, 2880, 2880, 3008]
    - [0, 19.496]
  - - [3008, 3008, 1, 256, 3008, 3008, 3008, 3008]
    - [2, 19.889]
  - - [3136, 3008, 1, 256, 3136, 3136, 3136, 3008]
    - [2, 19.59]
  - - [3264, 3008, 1, 256, 3264, 3264, 3264, 3008]
    - [2, 19.604]
  - - [3392, 3008, 1, 256, 3392, 3392, 3392, 3008]
    - [0, 19.521]
  - - [3520, 3008, 1, 256, 3520, 3520, 3520, 3008]
    - [2, 19.65]
  - - [3648, 3008, 1, 256, 3648, 3648, 3648, 3008]
    - [0, 19.36]
  - - [3776, 3008, 1, 256, 3776, 3776, 3776, 3008]
    - [0, 19.432]
  - - [3904, 3008, 1, 256, 3904, 3904, 3904, 3008]
    - [0, 19.491]
  - - [4032, 3008, 1, 256, 4032, 4032, 4032, 3008]
    - [2, 19.57]
  - - [64, 3136, 1, 256, 64, 64, 64, 3136]
    - [0, 9.36]
  - - [192, 3136, 1, 256, 192, 192, 192, 3136]
    - [0, 15.593]
  - - [320, 3136, 1, 256, 320, 320, 320, 3136]
    - [0, 17.848]
  - - [448, 3136, 1, 256, 448, 448, 448, 3136]
    - [0, 19.166]
  - - [576, 3136, 1, 256, 576, 576, 576, 3136]
    - [0, 19.999]
  - - [704, 3136, 1, 256, 704, 704, 704, 3136]
    - [0, 19.993]
  - - [832, 3136, 1, 256, 832, 832, 832, 3136]
    - [0, 19.744]
  - - [960, 3136, 1, 256, 960, 960, 960, 3136]
    - [0, 18.969]
  - - [1088, 3136, 1, 256, 1088, 1088, 1088, 3136]
    - [0, 18.861]
  - - [1216, 3136, 1, 256, 1216, 1216, 1216, 3136]
    - [2, 19.234]
  - - [1344, 3136, 1, 256, 1344, 1344, 1344, 3136]
    - [3, 19.389]
  - - [1472, 3136, 1, 256, 1472, 1472, 1472, 3136]
    - [3, 19.594]
  - - [1600, 3136, 1, 256, 1600, 1600, 1600, 3136]
    - [2, 19.999]
  - - [1728, 3136, 1, 256, 1728, 1728, 1728, 3136]
    - [2, 20.265]
  - - [1856, 3136, 1, 256, 1856, 1856, 1856, 3136]
    - [0, 19.266]
  - - [1984, 3136, 1, 256, 1984, 1984, 1984, 3136]
    - [0, 19.687]
  - - [2112, 3136, 1, 256, 2112, 2112, 2112, 3136]
    - [0, 19.902]
  - - [2240, 3136, 1, 256, 2240, 2240, 2240, 3136]
    - [0, 19.465]
  - - [2368, 3136, 1, 256, 2368, 2368, 2368, 3136]
    - [0, 19.549]
  - - [2496, 3136, 1, 256, 2496, 2496, 2496, 3136]
    - [2, 19.651]
  - - [2624, 3136, 1, 256, 2624, 2624, 2624, 3136]
    - [2, 19.746]
  - - [2752, 3136, 1, 256, 2752, 2752, 2752, 3136]
    - [0, 19.694]
  - - [2880, 3136, 1, 256, 2880, 2880, 2880, 3136]
    - [2, 19.656]
  - - [3008, 3136, 1, 256, 3008, 3008, 3008, 3136]
    - [0, 19.631]
  - - [3136, 3136, 1, 256, 3136, 3136, 3136, 3136]
    - [2, 19.685]
  - - [3264, 3136, 1, 256, 3264, 3264, 3264, 3136]
    - [2, 19.685]
  - - [3392, 3136, 1, 256, 3392, 3392, 3392, 3136]
    - [0, 19.499]
  - - [3520, 3136, 1, 256, 3520, 3520, 3520, 3136]
    - [2, 19.479]
  - - [3648, 3136, 1, 256, 3648, 3648, 3648, 3136]
    - [2, 19.577]
  - - [3776, 3136, 1, 256, 3776, 3776, 3776, 3136]
    - [2, 19.302]
  - - [3904, 3136, 1, 256, 3904, 3904, 3904, 3136]
    - [2, 19.376]
  - - [4032, 3136, 1, 256, 4032, 4032, 4032, 3136]
    - [2, 19.349]
  - - [64, 3264, 1, 256, 64, 64, 64, 3264]
    - [0, 9.719]
  - - [192, 3264, 1, 256, 192, 192, 192, 3264]
    - [0, 15.922]
  - - [320, 3264, 1, 256, 320, 320, 320, 3264]
    - [0, 18.079]
  - - [448, 3264, 1, 256, 448, 448, 448, 3264]
    - [0, 19.324]
  - - [576, 3264, 1, 256, 576, 576, 576, 3264]
    - [2, 19.273]
  - - [704, 3264, 1, 256, 704, 704, 704, 3264]
    - [3, 18.363]
  - - [832, 3264, 1, 256, 832, 832, 832, 3264]
    - [0, 19.319]
  - - [960, 3264, 1, 256, 960, 960, 960, 3264]
    - [3, 17.825]
  - - [1088, 3264, 1, 256, 1088, 1088, 1088, 3264]
    - [0, 18.721]
  - - [1216, 3264, 1, 256, 1216, 1216, 1216, 3264]
    - [0, 19.364]
  - - [1344, 3264, 1, 256, 1344, 1344, 1344, 3264]
    - [0, 19.139]
  - - [1472, 3264, 1, 256, 1472, 1472, 1472, 3264]
    - [2, 19.518]
  - - [1600, 3264, 1, 256, 1600, 1600, 1600, 3264]
    - [2, 19.92]
  - - [1728, 3264, 1, 256, 1728, 1728, 1728, 3264]
    - [0, 20.131]
  - - [1856, 3264, 1, 256, 1856, 1856, 1856, 3264]
    - [2, 19.6]
  - - [1984, 3264, 1, 256, 1984, 1984, 1984, 3264]
    - [0, 19.714]
  - - [2112, 3264, 1, 256, 2112, 2112, 2112, 3264]
    - [2, 19.881]
  - - [2240, 3264, 1, 256, 2240, 2240, 2240, 3264]
    - [2, 19.705]
  - - [2368, 3264, 1, 256, 2368, 2368, 2368, 3264]
    - [2, 19.619]
  - - [2496, 3264, 1, 256, 2496, 2496, 2496, 3264]
    - [0, 19.476]
  - - [2624, 3264, 1, 256, 2624, 2624, 2624, 3264]
    - [0, 19.743]
  - - [2752, 3264, 1, 256, 2752, 2752, 2752, 3264]
    - [0, 19.711]
  - - [2880, 3264, 1, 256, 2880, 2880, 2880, 3264]
    - [2, 19.785]
  - - [3008, 3264, 1, 256, 3008, 3008, 3008, 3264]
    - [0, 21.439]
  - - [3136, 3264, 1, 256, 3136, 3136, 3136, 3264]
    - [0, 19.553]
  - - [3264, 3264, 1, 256, 3264, 3264, 3264, 3264]
    - [0, 19.566]
  - - [3392, 3264, 1, 256, 3392, 3392, 3392, 3264]
    - [2, 19.403]
  - - [3520, 3264, 1, 256, 3520, 3520, 3520, 3264]
    - [2, 19.516]
  - - [3648, 3264, 1, 256, 3648, 3648, 3648, 3264]
    - [0, 19.515]
  - - [3776, 3264, 1, 256, 3776, 3776, 3776, 3264]
    - [0, 19.469]
  - - [3904, 3264, 1, 256, 3904, 3904, 3904, 3264]
    - [0, 19.311]
  - - [4032, 3264, 1, 256, 4032, 4032, 4032, 3264]
    - [0, 19.253]
  - - [64, 3392, 1, 256, 64, 64, 64, 3392]
    - [0, 10.087]
  - - [192, 3392, 1, 256, 192, 192, 192, 3392]
    - [0, 15.898]
  - - [320, 3392, 1, 256, 320, 320, 320, 3392]
    - [0, 18.296]
  - - [448, 3392, 1, 256, 448, 448, 448, 3392]
    - [0, 19.392]
  - - [576, 3392, 1, 256, 576, 576, 576, 3392]
    - [2, 18.842]
  - - [704, 3392, 1, 256, 704, 704, 704, 3392]
    - [0, 19.782]
  - - [832, 3392, 1, 256, 832, 832, 832, 3392]
    - [0, 19.636]
  - - [960, 3392, 1, 256, 960, 960, 960, 3392]
    - [3, 18.052]
  - - [1088, 3392, 1, 256, 1088, 1088, 1088, 3392]
    - [2, 19.226]
  - - [1216, 3392, 1, 256, 1216, 1216, 1216, 3392]
    - [3, 19.364]
  - - [1344, 3392, 1, 256, 1344, 1344, 1344, 3392]
    - [2, 19.959]
  - - [1472, 3392, 1, 256, 1472, 1472, 1472, 3392]
    - [0, 19.604]
  - - [1600, 3392, 1, 256, 1600, 1600, 1600, 3392]
    - [0, 19.902]
  - - [1728, 3392, 1, 256, 1728, 1728, 1728, 3392]
    - [2, 20.667]
  - - [1856, 3392, 1, 256, 1856, 1856, 1856, 3392]
    - [0, 19.756]
  - - [1984, 3392, 1, 256, 1984, 1984, 1984, 3392]
    - [2, 19.51]
  - - [2112, 3392, 1, 256, 2112, 2112, 2112, 3392]
    - [0, 19.622]
  - - [2240, 3392, 1, 256, 2240, 2240, 2240, 3392]
    - [0, 19.725]
  - - [2368, 3392, 1, 256, 2368, 2368, 2368, 3392]
    - [0, 19.64]
  - - [2496, 3392, 1, 256, 2496, 2496, 2496, 3392]
    - [2, 19.489]
  - - [2624, 3392, 1, 256, 2624, 2624, 2624, 3392]
    - [2, 19.59]
  - - [2752, 3392, 1, 256, 2752, 2752, 2752, 3392]
    - [2, 19.536]
  - - [2880, 3392, 1, 256, 2880, 2880, 2880, 3392]
    - [0, 19.677]
  - - [3008, 3392, 1, 256, 3008, 3008, 3008, 3392]
    - [2, 19.626]
  - - [3136, 3392, 1, 256, 3136, 3136, 3136, 3392]
    - [0, 19.475]
  - - [3264, 3392, 1, 256, 3264, 3264, 3264, 3392]
    - [2, 19.884]
  - - [3392, 3392, 1, 256, 3392, 3392, 3392, 3392]
    - [0, 19.589]
  - - [3520, 3392, 1, 256, 3520, 3520, 3520, 3392]
    - [0, 19.366]
  - - [3648, 3392, 1, 256, 3648, 3648, 3648, 3392]
    - [2, 19.437]
  - - [3776, 3392, 1, 256, 3776, 3776, 3776, 3392]
    - [0, 19.459]
  - - [3904, 3392, 1, 256, 3904, 3904, 3904, 3392]
    - [0, 19.309]
  - - [4032, 3392, 1, 256, 4032, 4032, 4032, 3392]
    - [0, 19.276]
  - - [64, 3520, 1, 256, 64, 64, 64, 3520]
    - [0, 10.444]
  - - [192, 3520, 1, 256, 192, 192, 192, 3520]
    - [0, 16.234]
  - - [320, 3520, 1, 256, 320, 320, 320, 3520]
    - [0, 18.742]
  - - [448, 3520, 1, 256, 448, 448, 448, 3520]
    - [0, 19.593]
  - - [576, 3520, 1, 256, 576, 576, 576, 3520]
    - [0, 19.251]
  - - [704, 3520, 1, 256, 704, 704, 704, 3520]
    - [0, 19.257]
  - - [832, 3520, 1, 256, 832, 832, 832, 3520]
    - [0, 18.637]
  - - [960, 3520, 1, 256, 960, 960, 960, 3520]
    - [2, 19.132]
  - - [1088, 3520, 1, 256, 1088, 1088, 1088, 3520]
    - [2, 19.179]
  - - [1216, 3520, 1, 256, 1216, 1216, 1216, 3520]
    - [2, 19.172]
  - - [1344, 3520, 1, 256, 1344, 1344, 1344, 3520]
    - [2, 19.501]
  - - [1472, 3520, 1, 256, 1472, 1472, 1472, 3520]
    - [0, 20.094]
  - - [1600, 3520, 1, 256, 1600, 1600, 1600, 3520]
    - [2, 19.791]
  - - [1728, 3520, 1, 256, 1728, 1728, 1728, 3520]
    - [2, 19.86]
  - - [1856, 3520, 1, 256, 1856, 1856, 1856, 3520]
    - [2, 19.549]
  - - [1984, 3520, 1, 256, 1984, 1984, 1984, 3520]
    - [2, 19.508]
  - - [2112, 3520, 1, 256, 2112, 2112, 2112, 3520]
    - [2, 20.287]
  - - [2240, 3520, 1, 256, 2240, 2240, 2240, 3520]
    - [0, 19.656]
  - - [2368, 3520, 1, 256, 2368, 2368, 2368, 3520]
    - [2, 19.664]
  - - [2496, 3520, 1, 256, 2496, 2496, 2496, 3520]
    - [0, 19.738]
  - - [2624, 3520, 1, 256, 2624, 2624, 2624, 3520]
    - [2, 19.602]
  - - [2752, 3520, 1, 256, 2752, 2752, 2752, 3520]
    - [2, 19.551]
  - - [2880, 3520, 1, 256, 2880, 2880, 2880, 3520]
    - [2, 19.555]
  - - [3008, 3520, 1, 256, 3008, 3008, 3008, 3520]
    - [2, 19.813]
  - - [3136, 3520, 1, 256, 3136, 3136, 3136, 3520]
    - [0, 19.525]
  - - [3264, 3520, 1, 256, 3264, 3264, 3264, 3520]
    - [0, 19.462]
  - - [3392, 3520, 1, 256, 3392, 3392, 3392, 3520]
    - [0, 19.437]
  - - [3520, 3520, 1, 256, 3520, 3520, 3520, 3520]
    - [0, 19.349]
  - - [3648, 3520, 1, 256, 3648, 3648, 3648, 3520]
    - [0, 19.388]
  - - [3776, 3520, 1, 256, 3776, 3776, 3776, 3520]
    - [0, 19.183]
  - - [3904, 3520, 1, 256, 3904, 3904, 3904, 3520]
    - [0, 19.296]
  - - [4032, 3520, 1, 256, 4032, 4032, 4032, 3520]
    - [0, 19.219]
  - - [64, 3648, 1, 256, 64, 64, 64, 3648]
    - [0, 10.812]
  - - [192, 3648, 1, 256, 192, 192, 192, 3648]
    - [0, 16.206]
  - - [320, 3648, 1, 256, 320, 320, 320, 3648]
    - [0, 18.581]
  - - [448, 3648, 1, 256, 448, 448, 448, 3648]
    - [0, 19.357]
  - - [576, 3648, 1, 256, 576, 576, 576, 3648]
    - [0, 19.819]
  - - [704, 3648, 1, 256, 704, 704, 704, 3648]
    - [0, 18.976]
  - - [832, 3648, 1, 256, 832, 832, 832, 3648]
    - [0, 18.355]
  - - [960, 3648, 1, 256, 960, 960, 960, 3648]
    - [2, 19.344]
  - - [1088, 3648, 1, 256, 1088, 1088, 1088, 3648]
    - [0, 18.995]
  - - [1216, 3648, 1, 256, 1216, 1216, 1216, 3648]
    - [0, 19.596]
  - - [1344, 3648, 1, 256, 1344, 1344, 1344, 3648]
    - [2, 19.522]
  - - [1472, 3648, 1, 256, 1472, 1472, 1472, 3648]
    - [2, 20.098]
  - - [1600, 3648, 1, 256, 1600, 1600, 1600, 3648]
    - [0, 20.064]
  - - [1728, 3648, 1, 256, 1728, 1728, 1728, 3648]
    - [0, 19.762]
  - - [1856, 3648, 1, 256, 1856, 1856, 1856, 3648]
    - [2, 19.681]
  - - [1984, 3648, 1, 256, 1984, 1984, 1984, 3648]
    - [2, 19.586]
  - - [2112, 3648, 1, 256, 2112, 2112, 2112, 3648]
    - [0, 20.135]
  - - [2240, 3648, 1, 256, 2240, 2240, 2240, 3648]
    - [0, 19.667]
  - - [2368, 3648, 1, 256, 2368, 2368, 2368, 3648]
    - [0, 19.999]
  - - [2496, 3648, 1, 256, 2496, 2496, 2496, 3648]
    - [0, 19.594]
  - - [2624, 3648, 1, 256, 2624, 2624, 2624, 3648]
    - [2, 20.029]
  - - [2752, 3648, 1, 256, 2752, 2752, 2752, 3648]
    - [0, 19.463]
  - - [2880, 3648, 1, 256, 2880, 2880, 2880, 3648]
    - [0, 19.672]
  - - [3008, 3648, 1, 256, 3008, 3008, 3008, 3648]
    - [2, 19.484]
  - - [3136, 3648, 1, 256, 3136, 3136, 3136, 3648]
    - [0, 19.411]
  - - [3264, 3648, 1, 256, 3264, 3264, 3264, 3648]
    - [0, 19.614]
  - - [3392, 3648, 1, 256, 3392, 3392, 3392, 3648]
    - [2, 19.495]
  - - [3520, 3648, 1, 256, 3520, 3520, 3520, 3648]
    - [0, 19.299]
  - - [3648, 3648, 1, 256, 3648, 3648, 3648, 3648]
    - [2, 19.317]
  - - [3776, 3648, 1, 256, 3776, 3776, 3776, 3648]
    - [0, 19.206]
  - - [3904, 3648, 1, 256, 3904, 3904, 3904, 3648]
    - [0, 19.386]
  - - [4032, 3648, 1, 256, 4032, 4032, 4032, 3648]
    - [0, 19.266]
  - - [64, 3776, 1, 256, 64, 64, 64, 3776]
    - [0, 11.132]
  - - [192, 3776, 1, 256, 192, 192, 192, 3776]
    - [0, 16.536]
  - - [320, 3776, 1, 256, 320, 320, 320, 3776]
    - [0, 18.573]
  - - [448, 3776, 1, 256, 448, 448, 448, 3776]
    - [0, 19.571]
  - - [576, 3776, 1, 256, 576, 576, 576, 3776]
    - [0, 18.373]
  - - [704, 3776, 1, 256, 704, 704, 704, 3776]
    - [2, 18.343]
  - - [832, 3776, 1, 256, 832, 832, 832, 3776]
    - [0, 18.978]
  - - [960, 3776, 1, 256, 960, 960, 960, 3776]
    - [2, 19.034]
  - - [1088, 3776, 1, 256, 1088, 1088, 1088, 3776]
    - [2, 19.628]
  - - [1216, 3776, 1, 256, 1216, 1216, 1216, 3776]
    - [0, 19.947]
  - - [1344, 3776, 1, 256, 1344, 1344, 1344, 3776]
    - [2, 20.089]
  - - [1472, 3776, 1, 256, 1472, 1472, 1472, 3776]
    - [0, 19.657]
  - - [1600, 3776, 1, 256, 1600, 1600, 1600, 3776]
    - [0, 19.873]
  - - [1728, 3776, 1, 256, 1728, 1728, 1728, 3776]
    - [2, 19.572]
  - - [1856, 3776, 1, 256, 1856, 1856, 1856, 3776]
    - [2, 19.47]
  - - [1984, 3776, 1, 256, 1984, 1984, 1984, 3776]
    - [0, 19.564]
  - - [2112, 3776, 1, 256, 2112, 2112, 2112, 3776]
    - [0, 19.622]
  - - [2240, 3776, 1, 256, 2240, 2240, 2240, 3776]
    - [2, 19.648]
  - - [2368, 3776, 1, 256, 2368, 2368, 2368, 3776]
    - [2, 19.737]
  - - [2496, 3776, 1, 256, 2496, 2496, 2496, 3776]
    - [0, 19.648]
  - - [2624, 3776, 1, 256, 2624, 2624, 2624, 3776]
    - [0, 19.641]
  - - [2752, 3776, 1, 256, 2752, 2752, 2752, 3776]
    - [0, 19.574]
  - - [2880, 3776, 1, 256, 2880, 2880, 2880, 3776]
    - [0, 19.56]
  - - [3008, 3776, 1, 256, 3008, 3008, 3008, 3776]
    - [2, 19.538]
  - - [3136, 3776, 1, 256, 3136, 3136, 3136, 3776]
    - [2, 19.666]
  - - [3264, 3776, 1, 256, 3264, 3264, 3264, 3776]
    - [0, 19.404]
  - - [3392, 3776, 1, 256, 3392, 3392, 3392, 3776]
    - [0, 19.256]
  - - [3520, 3776, 1, 256, 3520, 3520, 3520, 3776]
    - [0, 19.183]
  - - [3648, 3776, 1, 256, 3648, 3648, 3648, 3776]
    - [0, 19.16]
  - - [3776, 3776, 1, 256, 3776, 3776, 3776, 3776]
    - [0, 19.084]
  - - [3904, 3776, 1, 256, 3904, 3904, 3904, 3776]
    - [0, 19.127]
  - - [4032, 3776, 1, 256, 4032, 4032, 4032, 3776]
    - [0, 19.271]
  - - [64, 3904, 1, 256, 64, 64, 64, 3904]
    - [0, 10.593]
  - - [192, 3904, 1, 256, 192, 192, 192, 3904]
    - [0, 16.575]
  - - [320, 3904, 1, 256, 320, 320, 320, 3904]
    - [0, 18.862]
  - - [448, 3904, 1, 256, 448, 448, 448, 3904]
    - [2, 19.429]
  - - [576, 3904, 1, 256, 576, 576, 576, 3904]
    - [0, 19.206]
  - - [704, 3904, 1, 256, 704, 704, 704, 3904]
    - [0, 18.67]
  - - [832, 3904, 1, 256, 832, 832, 832, 3904]
    - [0, 18.553]
  - - [960, 3904, 1, 256, 960, 960, 960, 3904]
    - [3, 18.778]
  - - [1088, 3904, 1, 256, 1088, 1088, 1088, 3904]
    - [2, 19.841]
  - - [1216, 3904, 1, 256, 1216, 1216, 1216, 3904]
    - [2, 19.893]
  - - [1344, 3904, 1, 256, 1344, 1344, 1344, 3904]
    - [0, 19.893]
  - - [1472, 3904, 1, 256, 1472, 1472, 1472, 3904]
    - [2, 20.063]
  - - [1600, 3904, 1, 256, 1600, 1600, 1600, 3904]
    - [2, 19.797]
  - - [1728, 3904, 1, 256, 1728, 1728, 1728, 3904]
    - [2, 19.458]
  - - [1856, 3904, 1, 256, 1856, 1856, 1856, 3904]
    - [2, 19.641]
  - - [1984, 3904, 1, 256, 1984, 1984, 1984, 3904]
    - [2, 19.864]
  - - [2112, 3904, 1, 256, 2112, 2112, 2112, 3904]
    - [0, 19.655]
  - - [2240, 3904, 1, 256, 2240, 2240, 2240, 3904]
    - [2, 19.645]
  - - [2368, 3904, 1, 256, 2368, 2368, 2368, 3904]
    - [2, 19.899]
  - - [2496, 3904, 1, 256, 2496, 2496, 2496, 3904]
    - [2, 19.934]
  - - [2624, 3904, 1, 256, 2624, 2624, 2624, 3904]
    - [2, 19.842]
  - - [2752, 3904, 1, 256, 2752, 2752, 2752, 3904]
    - [2, 19.462]
  - - [2880, 3904, 1, 256, 2880, 2880, 2880, 3904]
    - [2, 19.416]
  - - [3008, 3904, 1, 256, 3008, 3008, 3008, 3904]
    - [0, 19.591]
  - - [3136, 3904, 1, 256, 3136, 3136, 3136, 3904]
    - [0, 19.362]
  - - [3264, 3904, 1, 256, 3264, 3264, 3264, 3904]
    - [2, 19.729]
  - - [3392, 3904, 1, 256, 3392, 3392, 3392, 3904]
    - [0, 19.26]
  - - [3520, 3904, 1, 256, 3520, 3520, 3520, 3904]
    - [0, 19.273]
  - - [3648, 3904, 1, 256, 3648, 3648, 3648, 3904]
    - [0, 19.265]
  - - [3776, 3904, 1, 256, 3776, 3776, 3776, 3904]
    - [0, 19.119]
  - - [3904, 3904, 1, 256, 3904, 3904, 3904, 3904]
    - [0, 19.32]
  - - [4032, 3904, 1, 256, 4032, 4032, 4032, 3904]
    - [0, 19.375]
  - - [64, 4032, 1, 256, 64, 64, 64, 4032]
    - [0, 10.933]
  - - [192, 4032, 1, 256, 192, 192, 192, 4032]
    - [0, 16.939]
  - - [320, 4032, 1, 256, 320, 320, 320, 4032]
    - [0, 18.961]
  - - [448, 4032, 1, 256, 448, 448, 448, 4032]
    - [0, 19.762]
  - - [576, 4032, 1, 256, 576, 576, 576, 4032]
    - [0, 18.928]
  - - [704, 4032, 1, 256, 704, 704, 704, 4032]
    - [0, 18.523]
  - - [832, 4032, 1, 256, 832, 832, 832, 4032]
    - [2, 19.221]
  - - [960, 4032, 1, 256, 960, 960, 960, 4032]
    - [2, 19.032]
  - - [1088, 4032, 1, 256, 1088, 1088, 1088, 4032]
    - [0, 19.685]
  - - [1216, 4032, 1, 256, 1216, 1216, 1216, 4032]
    - [2, 20.071]
  - - [1344, 4032, 1, 256, 1344, 1344, 1344, 4032]
    - [2, 19.711]
  - - [1472, 4032, 1, 256, 1472, 1472, 1472, 4032]
    - [0, 20.198]
  - - [1600, 4032, 1, 256, 1600, 1600, 1600, 4032]
    - [2, 19.889]
  - - [1728, 4032, 1, 256, 1728, 1728, 1728, 4032]
    - [2, 19.789]
  - - [1856, 4032, 1, 256, 1856, 1856, 1856, 4032]
    - [2, 19.868]
  - - [1984, 4032, 1, 256, 1984, 1984, 1984, 4032]
    - [2, 19.459]
  - - [2112, 4032, 1, 256, 2112, 2112, 2112, 4032]
    - [0, 19.604]
  - - [2240, 4032, 1, 256, 2240, 2240, 2240, 4032]
    - [0, 19.78]
  - - [2368, 4032, 1, 256, 2368, 2368, 2368, 4032]
    - [2, 19.692]
  - - [2496, 4032, 1, 256, 2496, 2496, 2496, 4032]
    - [2, 19.419]
  - - [2624, 4032, 1, 256, 2624, 2624, 2624, 4032]
    - [2, 19.651]
  - - [2752, 4032, 1, 256, 2752, 2752, 2752, 4032]
    - [2, 19.538]
  - - [2880, 4032, 1, 256, 2880, 2880, 2880, 4032]
    - [0, 19.517]
  - - [3008, 4032, 1, 256, 3008, 3008, 3008, 4032]
    - [2, 19.534]
  - - [3136, 4032, 1, 256, 3136, 3136, 3136, 4032]
    - [0, 19.532]
  - - [3264, 4032, 1, 256, 3264, 3264, 3264, 4032]
    - [0, 19.395]
  - - [3392, 4032, 1, 256, 3392, 3392, 3392, 4032]
    - [0, 19.319]
  - - [3520, 4032, 1, 256, 3520, 3520, 3520, 4032]
    - [0, 19.374]
  - - [3648, 4032, 1, 256, 3648, 3648, 3648, 4032]
    - [0, 19.395]
  - - [3776, 4032, 1, 256, 3776, 3776, 3776, 4032]
    - [0, 19.333]
  - - [3904, 4032, 1, 256, 3904, 3904, 3904, 4032]
    - [0, 19.278]
  - - [4032, 4032, 1, 256, 4032, 4032, 4032, 4032]
    - [0, 19.263]
  - - [64, 64, 1, 512, 64, 64, 64, 64]
    - [2, 0.548]
  - - [192, 64, 1, 512, 192, 192, 192, 64]
    - [2, 1.628]
  - - [320, 64, 1, 512, 320, 320, 320, 64]
    - [2, 2.698]
  - - [448, 64, 1, 512, 448, 448, 448, 64]
    - [0, 3.605]
  - - [576, 64, 1, 512, 576, 576, 576, 64]
    - [0, 4.641]
  - - [704, 64, 1, 512, 704, 704, 704, 64]
    - [0, 5.643]
  - - [832, 64, 1, 512, 832, 832, 832, 64]
    - [2, 5.629]
  - - [960, 64, 1, 512, 960, 960, 960, 64]
    - [2, 6.41]
  - - [1088, 64, 1, 512, 1088, 1088, 1088, 64]
    - [2, 7.25]
  - - [1216, 64, 1, 512, 1216, 1216, 1216, 64]
    - [0, 7.756]
  - - [1344, 64, 1, 512, 1344, 1344, 1344, 64]
    - [0, 8.537]
  - - [1472, 64, 1, 512, 1472, 1472, 1472, 64]
    - [0, 9.35]
  - - [1600, 64, 1, 512, 1600, 1600, 1600, 64]
    - [2, 8.661]
  - - [1728, 64, 1, 512, 1728, 1728, 1728, 64]
    - [2, 9.281]
  - - [1856, 64, 1, 512, 1856, 1856, 1856, 64]
    - [2, 9.955]
  - - [1984, 64, 1, 512, 1984, 1984, 1984, 64]
    - [0, 10.477]
  - - [2112, 64, 1, 512, 2112, 2112, 2112, 64]
    - [0, 11.154]
  - - [2240, 64, 1, 512, 2240, 2240, 2240, 64]
    - [0, 11.821]
  - - [2368, 64, 1, 512, 2368, 2368, 2368, 64]
    - [0, 10.827]
  - - [2496, 64, 1, 512, 2496, 2496, 2496, 64]
    - [2, 11.313]
  - - [2624, 64, 1, 512, 2624, 2624, 2624, 64]
    - [2, 11.893]
  - - [2752, 64, 1, 512, 2752, 2752, 2752, 64]
    - [0, 12.39]
  - - [2880, 64, 1, 512, 2880, 2880, 2880, 64]
    - [0, 12.911]
  - - [3008, 64, 1, 512, 3008, 3008, 3008, 64]
    - [0, 13.503]
  - - [3136, 64, 1, 512, 3136, 3136, 3136, 64]
    - [0, 12.505]
  - - [3264, 64, 1, 512, 3264, 3264, 3264, 64]
    - [0, 12.939]
  - - [3392, 64, 1, 512, 3392, 3392, 3392, 64]
    - [0, 13.453]
  - - [3520, 64, 1, 512, 3520, 3520, 3520, 64]
    - [0, 13.904]
  - - [3648, 64, 1, 512, 3648, 3648, 3648, 64]
    - [0, 14.243]
  - - [3776, 64, 1, 512, 3776, 3776, 3776, 64]
    - [0, 14.508]
  - - [3904, 64, 1, 512, 3904, 3904, 3904, 64]
    - [0, 13.612]
  - - [4032, 64, 1, 512, 4032, 4032, 4032, 64]
    - [0, 13.936]
  - - [64, 192, 1, 512, 64, 64, 64, 192]
    - [2, 1.602]
  - - [192, 192, 1, 512, 192, 192, 192, 192]
    - [0, 4.522]
  - - [320, 192, 1, 512, 320, 320, 320, 192]
    - [2, 6.232]
  - - [448, 192, 1, 512, 448, 448, 448, 192]
    - [0, 8.405]
  - - [576, 192, 1, 512, 576, 576, 576, 192]
    - [2, 9.138]
  - - [704, 192, 1, 512, 704, 704, 704, 192]
    - [0, 10.952]
  - - [832, 192, 1, 512, 832, 832, 832, 192]
    - [2, 11.135]
  - - [960, 192, 1, 512, 960, 960, 960, 192]
    - [0, 12.761]
  - - [1088, 192, 1, 512, 1088, 1088, 1088, 192]
    - [0, 12.815]
  - - [1216, 192, 1, 512, 1216, 1216, 1216, 192]
    - [0, 14.228]
  - - [1344, 192, 1, 512, 1344, 1344, 1344, 192]
    - [0, 13.984]
  - - [1472, 192, 1, 512, 1472, 1472, 1472, 192]
    - [0, 15.24]
  - - [1600, 192, 1, 512, 1600, 1600, 1600, 192]
    - [0, 15.019]
  - - [1728, 192, 1, 512, 1728, 1728, 1728, 192]
    - [0, 16.096]
  - - [1856, 192, 1, 512, 1856, 1856, 1856, 192]
    - [0, 15.802]
  - - [1984, 192, 1, 512, 1984, 1984, 1984, 192]
    - [0, 16.817]
  - - [2112, 192, 1, 512, 2112, 2112, 2112, 192]
    - [2, 16.771]
  - - [2240, 192, 1, 512, 2240, 2240, 2240, 192]
    - [0, 17.234]
  - - [2368, 192, 1, 512, 2368, 2368, 2368, 192]
    - [2, 17.537]
  - - [2496, 192, 1, 512, 2496, 2496, 2496, 192]
    - [0, 17.944]
  - - [2624, 192, 1, 512, 2624, 2624, 2624, 192]
    - [2, 17.81]
  - - [2752, 192, 1, 512, 2752, 2752, 2752, 192]
    - [0, 18.33]
  - - [2880, 192, 1, 512, 2880, 2880, 2880, 192]
    - [2, 18.418]
  - - [3008, 192, 1, 512, 3008, 3008, 3008, 192]
    - [0, 18.716]
  - - [3136, 192, 1, 512, 3136, 3136, 3136, 192]
    - [2, 18.702]
  - - [3264, 192, 1, 512, 3264, 3264, 3264, 192]
    - [0, 19.177]
  - - [3392, 192, 1, 512, 3392, 3392, 3392, 192]
    - [2, 19.009]
  - - [3520, 192, 1, 512, 3520, 3520, 3520, 192]
    - [0, 19.308]
  - - [3648, 192, 1, 512, 3648, 3648, 3648, 192]
    - [2, 19.361]
  - - [3776, 192, 1, 512, 3776, 3776, 3776, 192]
    - [0, 19.587]
  - - [3904, 192, 1, 512, 3904, 3904, 3904, 192]
    - [0, 19.516]
  - - [4032, 192, 1, 512, 4032, 4032, 4032, 192]
    - [0, 19.731]
  - - [64, 320, 1, 512, 64, 64, 64, 320]
    - [2, 2.721]
  - - [192, 320, 1, 512, 192, 192, 192, 320]
    - [2, 6.421]
  - - [320, 320, 1, 512, 320, 320, 320, 320]
    - [2, 8.646]
  - - [448, 320, 1, 512, 448, 448, 448, 320]
    - [0, 11.8]
  - - [576, 320, 1, 512, 576, 576, 576, 320]
    - [0, 12.898]
  - - [704, 320, 1, 512, 704, 704, 704, 320]
    - [0, 13.887]
  - - [832, 320, 1, 512, 832, 832, 832, 320]
    - [0, 14.558]
  - - [960, 320, 1, 512, 960, 960, 960, 320]
    - [0, 15.182]
  - - [1088, 320, 1, 512, 1088, 1088, 1088, 320]
    - [0, 15.766]
  - - [1216, 320, 1, 512, 1216, 1216, 1216, 320]
    - [0, 17.258]
  - - [1344, 320, 1, 512, 1344, 1344, 1344, 320]
    - [0, 17.533]
  - - [1472, 320, 1, 512, 1472, 1472, 1472, 320]
    - [0, 17.67]
  - - [1600, 320, 1, 512, 1600, 1600, 1600, 320]
    - [0, 17.831]
  - - [1728, 320, 1, 512, 1728, 1728, 1728, 320]
    - [2, 17.979]
  - - [1856, 320, 1, 512, 1856, 1856, 1856, 320]
    - [2, 18.338]
  - - [1984, 320, 1, 512, 1984, 1984, 1984, 320]
    - [0, 18.898]
  - - [2112, 320, 1, 512, 2112, 2112, 2112, 320]
    - [0, 19.53]
  - - [2240, 320, 1, 512, 2240, 2240, 2240, 320]
    - [0, 19.41]
  - - [2368, 320, 1, 512, 2368, 2368, 2368, 320]
    - [0, 19.641]
  - - [2496, 320, 1, 512, 2496, 2496, 2496, 320]
    - [2, 19.768]
  - - [2624, 320, 1, 512, 2624, 2624, 2624, 320]
    - [2, 19.694]
  - - [2752, 320, 1, 512, 2752, 2752, 2752, 320]
    - [0, 20.049]
  - - [2880, 320, 1, 512, 2880, 2880, 2880, 320]
    - [2, 19.908]
  - - [3008, 320, 1, 512, 3008, 3008, 3008, 320]
    - [0, 19.952]
  - - [3136, 320, 1, 512, 3136, 3136, 3136, 320]
    - [2, 19.983]
  - - [3264, 320, 1, 512, 3264, 3264, 3264, 320]
    - [0, 20.374]
  - - [3392, 320, 1, 512, 3392, 3392, 3392, 320]
    - [2, 19.588]
  - - [3520, 320, 1, 512, 3520, 3520, 3520, 320]
    - [2, 20.161]
  - - [3648, 320, 1, 512, 3648, 3648, 3648, 320]
    - [2, 19.632]
  - - [3776, 320, 1, 512, 3776, 3776, 3776, 320]
    - [0, 19.894]
  - - [3904, 320, 1, 512, 3904, 3904, 3904, 320]
    - [2, 20.058]
  - - [4032, 320, 1, 512, 4032, 4032, 4032, 320]
    - [0, 20.089]
  - - [64, 448, 1, 512, 64, 64, 64, 448]
    - [0, 3.626]
  - - [192, 448, 1, 512, 192, 192, 192, 448]
    - [0, 8.566]
  - - [320, 448, 1, 512, 320, 320, 320, 448]
    - [0, 11.794]
  - - [448, 448, 1, 512, 448, 448, 448, 448]
    - [0, 12.559]
  - - [576, 448, 1, 512, 576, 576, 576, 448]
    - [0, 14.153]
  - - [704, 448, 1, 512, 704, 704, 704, 448]
    - [0, 15.555]
  - - [832, 448, 1, 512, 832, 832, 832, 448]
    - [0, 16.665]
  - - [960, 448, 1, 512, 960, 960, 960, 448]
    - [0, 17.591]
  - - [1088, 448, 1, 512, 1088, 1088, 1088, 448]
    - [0, 18.298]
  - - [1216, 448, 1, 512, 1216, 1216, 1216, 448]
    - [0, 18.337]
  - - [1344, 448, 1, 512, 1344, 1344, 1344, 448]
    - [2, 18.847]
  - - [1472, 448, 1, 512, 1472, 1472, 1472, 448]
    - [0, 19.225]
  - - [1600, 448, 1, 512, 1600, 1600, 1600, 448]
    - [2, 19.321]
  - - [1728, 448, 1, 512, 1728, 1728, 1728, 448]
    - [2, 19.773]
  - - [1856, 448, 1, 512, 1856, 1856, 1856, 448]
    - [0, 20.258]
  - - [1984, 448, 1, 512, 1984, 1984, 1984, 448]
    - [2, 19.572]
  - - [2112, 448, 1, 512, 2112, 2112, 2112, 448]
    - [0, 19.727]
  - - [2240, 448, 1, 512, 2240, 2240, 2240, 448]
    - [3, 19.516]
  - - [2368, 448, 1, 512, 2368, 2368, 2368, 448]
    - [2, 19.912]
  - - [2496, 448, 1, 512, 2496, 2496, 2496, 448]
    - [2, 19.964]
  - - [2624, 448, 1, 512, 2624, 2624, 2624, 448]
    - [2, 19.96]
  - - [2752, 448, 1, 512, 2752, 2752, 2752, 448]
    - [2, 19.522]
  - - [2880, 448, 1, 512, 2880, 2880, 2880, 448]
    - [2, 19.588]
  - - [3008, 448, 1, 512, 3008, 3008, 3008, 448]
    - [2, 20.575]
  - - [3136, 448, 1, 512, 3136, 3136, 3136, 448]
    - [3, 19.855]
  - - [3264, 448, 1, 512, 3264, 3264, 3264, 448]
    - [0, 19.748]
  - - [3392, 448, 1, 512, 3392, 3392, 3392, 448]
    - [2, 20.188]
  - - [3520, 448, 1, 512, 3520, 3520, 3520, 448]
    - [0, 19.536]
  - - [3648, 448, 1, 512, 3648, 3648, 3648, 448]
    - [0, 19.884]
  - - [3776, 448, 1, 512, 3776, 3776, 3776, 448]
    - [0, 19.912]
  - - [3904, 448, 1, 512, 3904, 3904, 3904, 448]
    - [2, 20.219]
  - - [4032, 448, 1, 512, 4032, 4032, 4032, 448]
    - [2, 20.322]
  - - [64, 576, 1, 512, 64, 64, 64, 576]
    - [0, 4.667]
  - - [192, 576, 1, 512, 192, 192, 192, 576]
    - [0, 9.2]
  - - [320, 576, 1, 512, 320, 320, 320, 576]
    - [0, 12.712]
  - - [448, 576, 1, 512, 448, 448, 448, 576]
    - [0, 13.982]
  - - [576, 576, 1, 512, 576, 576, 576, 576]
    - [0, 16.117]
  - - [704, 576, 1, 512, 704, 704, 704, 576]
    - [0, 16.48]
  - - [832, 576, 1, 512, 832, 832, 832, 576]
    - [0, 17.781]
  - - [960, 576, 1, 512, 960, 960, 960, 576]
    - [2, 18.102]
  - - [1088, 576, 1, 512, 1088, 1088, 1088, 576]
    - [0, 18.776]
  - - [1216, 576, 1, 512, 1216, 1216, 1216, 576]
    - [2, 19.03]
  - - [1344, 576, 1, 512, 1344, 1344, 1344, 576]
    - [0, 19.759]
  - - [1472, 576, 1, 512, 1472, 1472, 1472, 576]
    - [2, 19.699]
  - - [1600, 576, 1, 512, 1600, 1600, 1600, 576]
    - [0, 20.274]
  - - [1728, 576, 1, 512, 1728, 1728, 1728, 576]
    - [0, 19.689]
  - - [1856, 576, 1, 512, 1856, 1856, 1856, 576]
    - [0, 19.64]
  - - [1984, 576, 1, 512, 1984, 1984, 1984, 576]
    - [2, 19.777]
  - - [2112, 576, 1, 512, 2112, 2112, 2112, 576]
    - [2, 20.152]
  - - [2240, 576, 1, 512, 2240, 2240, 2240, 576]
    - [0, 19.885]
  - - [2368, 576, 1, 512, 2368, 2368, 2368, 576]
    - [2, 19.748]
  - - [2496, 576, 1, 512, 2496, 2496, 2496, 576]
    - [0, 19.651]
  - - [2624, 576, 1, 512, 2624, 2624, 2624, 576]
    - [0, 19.819]
  - - [2752, 576, 1, 512, 2752, 2752, 2752, 576]
    - [2, 20.119]
  - - [2880, 576, 1, 512, 2880, 2880, 2880, 576]
    - [0, 19.972]
  - - [3008, 576, 1, 512, 3008, 3008, 3008, 576]
    - [2, 19.885]
  - - [3136, 576, 1, 512, 3136, 3136, 3136, 576]
    - [2, 19.872]
  - - [3264, 576, 1, 512, 3264, 3264, 3264, 576]
    - [3, 20.083]
  - - [3392, 576, 1, 512, 3392, 3392, 3392, 576]
    - [3, 20.183]
  - - [3520, 576, 1, 512, 3520, 3520, 3520, 576]
    - [3, 20.214]
  - - [3648, 576, 1, 512, 3648, 3648, 3648, 576]
    - [3, 20.166]
  - - [3776, 576, 1, 512, 3776, 3776, 3776, 576]
    - [2, 20.649]
  - - [3904, 576, 1, 512, 3904, 3904, 3904, 576]
    - [3, 20.721]
  - - [4032, 576, 1, 512, 4032, 4032, 4032, 576]
    - [2, 20.277]
  - - [64, 704, 1, 512, 64, 64, 64, 704]
    - [0, 5.688]
  - - [192, 704, 1, 512, 192, 192, 192, 704]
    - [0, 11.143]
  - - [320, 704, 1, 512, 320, 320, 320, 704]
    - [0, 13.88]
  - - [448, 704, 1, 512, 448, 448, 448, 704]
    - [0, 15.553]
  - - [576, 704, 1, 512, 576, 576, 576, 704]
    - [0, 16.719]
  - - [704, 704, 1, 512, 704, 704, 704, 704]
    - [0, 17.649]
  - - [832, 704, 1, 512, 832, 832, 832, 704]
    - [0, 18.83]
  - - [960, 704, 1, 512, 960, 960, 960, 704]
    - [0, 19.411]
  - - [1088, 704, 1, 512, 1088, 1088, 1088, 704]
    - [2, 19.171]
  - - [1216, 704, 1, 512, 1216, 1216, 1216, 704]
    - [2, 19.758]
  - - [1344, 704, 1, 512, 1344, 1344, 1344, 704]
    - [2, 19.912]
  - - [1472, 704, 1, 512, 1472, 1472, 1472, 704]
    - [2, 19.886]
  - - [1600, 704, 1, 512, 1600, 1600, 1600, 704]
    - [0, 20.186]
  - - [1728, 704, 1, 512, 1728, 1728, 1728, 704]
    - [2, 19.853]
  - - [1856, 704, 1, 512, 1856, 1856, 1856, 704]
    - [2, 20.052]
  - - [1984, 704, 1, 512, 1984, 1984, 1984, 704]
    - [2, 19.683]
  - - [2112, 704, 1, 512, 2112, 2112, 2112, 704]
    - [2, 19.793]
  - - [2240, 704, 1, 512, 2240, 2240, 2240, 704]
    - [2, 19.848]
  - - [2368, 704, 1, 512, 2368, 2368, 2368, 704]
    - [0, 19.785]
  - - [2496, 704, 1, 512, 2496, 2496, 2496, 704]
    - [0, 19.964]
  - - [2624, 704, 1, 512, 2624, 2624, 2624, 704]
    - [2, 20.077]
  - - [2752, 704, 1, 512, 2752, 2752, 2752, 704]
    - [2, 20.156]
  - - [2880, 704, 1, 512, 2880, 2880, 2880, 704]
    - [2, 20.342]
  - - [3008, 704, 1, 512, 3008, 3008, 3008, 704]
    - [2, 20.64]
  - - [3136, 704, 1, 512, 3136, 3136, 3136, 704]
    - [2, 20.149]
  - - [3264, 704, 1, 512, 3264, 3264, 3264, 704]
    - [3, 20.668]
  - - [3392, 704, 1, 512, 3392, 3392, 3392, 704]
    - [3, 20.166]
  - - [3520, 704, 1, 512, 3520, 3520, 3520, 704]
    - [0, 20.174]
  - - [3648, 704, 1, 512, 3648, 3648, 3648, 704]
    - [2, 20.546]
  - - [3776, 704, 1, 512, 3776, 3776, 3776, 704]
    - [0, 20.364]
  - - [3904, 704, 1, 512, 3904, 3904, 3904, 704]
    - [2, 20.435]
  - - [4032, 704, 1, 512, 4032, 4032, 4032, 704]
    - [2, 20.491]
  - - [64, 832, 1, 512, 64, 64, 64, 832]
    - [3, 1.76]
  - - [192, 832, 1, 512, 192, 192, 192, 832]
    - [0, 10.272]
  - - [320, 832, 1, 512, 320, 320, 320, 832]
    - [0, 14.396]
  - - [448, 832, 1, 512, 448, 448, 448, 832]
    - [0, 16.369]
  - - [576, 832, 1, 512, 576, 576, 576, 832]
    - [0, 17.853]
  - - [704, 832, 1, 512, 704, 704, 704, 832]
    - [0, 18.786]
  - - [832, 832, 1, 512, 832, 832, 832, 832]
    - [2, 19.056]
  - - [960, 832, 1, 512, 960, 960, 960, 832]
    - [2, 19.629]
  - - [1088, 832, 1, 512, 1088, 1088, 1088, 832]
    - [0, 19.713]
  - - [1216, 832, 1, 512, 1216, 1216, 1216, 832]
    - [0, 20.159]
  - - [1344, 832, 1, 512, 1344, 1344, 1344, 832]
    - [2, 20.132]
  - - [1472, 832, 1, 512, 1472, 1472, 1472, 832]
    - [0, 20.236]
  - - [1600, 832, 1, 512, 1600, 1600, 1600, 832]
    - [0, 20.607]
  - - [1728, 832, 1, 512, 1728, 1728, 1728, 832]
    - [0, 19.979]
  - - [1856, 832, 1, 512, 1856, 1856, 1856, 832]
    - [0, 20.091]
  - - [1984, 832, 1, 512, 1984, 1984, 1984, 832]
    - [0, 19.897]
  - - [2112, 832, 1, 512, 2112, 2112, 2112, 832]
    - [0, 20.226]
  - - [2240, 832, 1, 512, 2240, 2240, 2240, 832]
    - [2, 20.346]
  - - [2368, 832, 1, 512, 2368, 2368, 2368, 832]
    - [0, 19.992]
  - - [2496, 832, 1, 512, 2496, 2496, 2496, 832]
    - [2, 20.39]
  - - [2624, 832, 1, 512, 2624, 2624, 2624, 832]
    - [0, 20.478]
  - - [2752, 832, 1, 512, 2752, 2752, 2752, 832]
    - [2, 20.191]
  - - [2880, 832, 1, 512, 2880, 2880, 2880, 832]
    - [2, 20.146]
  - - [3008, 832, 1, 512, 3008, 3008, 3008, 832]
    - [2, 20.456]
  - - [3136, 832, 1, 512, 3136, 3136, 3136, 832]
    - [2, 20.303]
  - - [3264, 832, 1, 512, 3264, 3264, 3264, 832]
    - [3, 20.93]
  - - [3392, 832, 1, 512, 3392, 3392, 3392, 832]
    - [2, 21.01]
  - - [3520, 832, 1, 512, 3520, 3520, 3520, 832]
    - [2, 20.607]
  - - [3648, 832, 1, 512, 3648, 3648, 3648, 832]
    - [0, 20.76]
  - - [3776, 832, 1, 512, 3776, 3776, 3776, 832]
    - [2, 20.478]
  - - [3904, 832, 1, 512, 3904, 3904, 3904, 832]
    - [2, 20.718]
  - - [4032, 832, 1, 512, 4032, 4032, 4032, 832]
    - [0, 20.923]
  - - [64, 960, 1, 512, 64, 64, 64, 960]
    - [2, 6.316]
  - - [192, 960, 1, 512, 192, 192, 192, 960]
    - [0, 12.774]
  - - [320, 960, 1, 512, 320, 320, 320, 960]
    - [0, 15.027]
  - - [448, 960, 1, 512, 448, 448, 448, 960]
    - [0, 17.579]
  - - [576, 960, 1, 512, 576, 576, 576, 960]
    - [2, 18.348]
  - - [704, 960, 1, 512, 704, 704, 704, 960]
    - [0, 19.414]
  - - [832, 960, 1, 512, 832, 832, 832, 960]
    - [0, 19.577]
  - - [960, 960, 1, 512, 960, 960, 960, 960]
    - [0, 20.369]
  - - [1088, 960, 1, 512, 1088, 1088, 1088, 960]
    - [0, 20.142]
  - - [1216, 960, 1, 512, 1216, 1216, 1216, 960]
    - [2, 19.885]
  - - [1344, 960, 1, 512, 1344, 1344, 1344, 960]
    - [0, 19.813]
  - - [1472, 960, 1, 512, 1472, 1472, 1472, 960]
    - [2, 19.689]
  - - [1600, 960, 1, 512, 1600, 1600, 1600, 960]
    - [3, 19.619]
  - - [1728, 960, 1, 512, 1728, 1728, 1728, 960]
    - [0, 19.668]
  - - [1856, 960, 1, 512, 1856, 1856, 1856, 960]
    - [2, 20.555]
  - - [1984, 960, 1, 512, 1984, 1984, 1984, 960]
    - [0, 20.194]
  - - [2112, 960, 1, 512, 2112, 2112, 2112, 960]
    - [2, 20.601]
  - - [2240, 960, 1, 512, 2240, 2240, 2240, 960]
    - [0, 20.4]
  - - [2368, 960, 1, 512, 2368, 2368, 2368, 960]
    - [0, 20.442]
  - - [2496, 960, 1, 512, 2496, 2496, 2496, 960]
    - [3, 20.149]
  - - [2624, 960, 1, 512, 2624, 2624, 2624, 960]
    - [2, 20.269]
  - - [2752, 960, 1, 512, 2752, 2752, 2752, 960]
    - [2, 20.427]
  - - [2880, 960, 1, 512, 2880, 2880, 2880, 960]
    - [2, 20.853]
  - - [3008, 960, 1, 512, 3008, 3008, 3008, 960]
    - [2, 20.518]
  - - [3136, 960, 1, 512, 3136, 3136, 3136, 960]
    - [2, 20.603]
  - - [3264, 960, 1, 512, 3264, 3264, 3264, 960]
    - [2, 20.715]
  - - [3392, 960, 1, 512, 3392, 3392, 3392, 960]
    - [2, 20.918]
  - - [3520, 960, 1, 512, 3520, 3520, 3520, 960]
    - [2, 20.674]
  - - [3648, 960, 1, 512, 3648, 3648, 3648, 960]
    - [0, 20.774]
  - - [3776, 960, 1, 512, 3776, 3776, 3776, 960]
    - [0, 20.864]
  - - [3904, 960, 1, 512, 3904, 3904, 3904, 960]
    - [0, 20.761]
  - - [4032, 960, 1, 512, 4032, 4032, 4032, 960]
    - [2, 20.959]
  - - [64, 1088, 1, 512, 64, 64, 64, 1088]
    - [2, 7.279]
  - - [192, 1088, 1, 512, 192, 192, 192, 1088]
    - [0, 12.935]
  - - [320, 1088, 1, 512, 320, 320, 320, 1088]
    - [0, 15.695]
  - - [448, 1088, 1, 512, 448, 448, 448, 1088]
    - [0, 18.254]
  - - [576, 1088, 1, 512, 576, 576, 576, 1088]
    - [0, 19.065]
  - - [704, 1088, 1, 512, 704, 704, 704, 1088]
    - [0, 19.733]
  - - [832, 1088, 1, 512, 832, 832, 832, 1088]
    - [0, 20.088]
  - - [960, 1088, 1, 512, 960, 960, 960, 1088]
    - [0, 20.474]
  - - [1088, 1088, 1, 512, 1088, 1088, 1088, 1088]
    - [0, 20.479]
  - - [1216, 1088, 1, 512, 1216, 1216, 1216, 1088]
    - [0, 19.836]
  - - [1344, 1088, 1, 512, 1344, 1344, 1344, 1088]
    - [2, 20.003]
  - - [1472, 1088, 1, 512, 1472, 1472, 1472, 1088]
    - [2, 20.036]
  - - [1600, 1088, 1, 512, 1600, 1600, 1600, 1088]
    - [2, 20.24]
  - - [1728, 1088, 1, 512, 1728, 1728, 1728, 1088]
    - [2, 20.289]
  - - [1856, 1088, 1, 512, 1856, 1856, 1856, 1088]
    - [0, 20.072]
  - - [1984, 1088, 1, 512, 1984, 1984, 1984, 1088]
    - [2, 20.834]
  - - [2112, 1088, 1, 512, 2112, 2112, 2112, 1088]
    - [3, 21.08]
  - - [2240, 1088, 1, 512, 2240, 2240, 2240, 1088]
    - [0, 20.558]
  - - [2368, 1088, 1, 512, 2368, 2368, 2368, 1088]
    - [0, 20.322]
  - - [2496, 1088, 1, 512, 2496, 2496, 2496, 1088]
    - [3, 20.683]
  - - [2624, 1088, 1, 512, 2624, 2624, 2624, 1088]
    - [3, 20.73]
  - - [2752, 1088, 1, 512, 2752, 2752, 2752, 1088]
    - [0, 20.591]
  - - [2880, 1088, 1, 512, 2880, 2880, 2880, 1088]
    - [2, 21.168]
  - - [3008, 1088, 1, 512, 3008, 3008, 3008, 1088]
    - [2, 20.588]
  - - [3136, 1088, 1, 512, 3136, 3136, 3136, 1088]
    - [0, 20.819]
  - - [3264, 1088, 1, 512, 3264, 3264, 3264, 1088]
    - [2, 20.79]
  - - [3392, 1088, 1, 512, 3392, 3392, 3392, 1088]
    - [0, 20.651]
  - - [3520, 1088, 1, 512, 3520, 3520, 3520, 1088]
    - [2, 20.75]
  - - [3648, 1088, 1, 512, 3648, 3648, 3648, 1088]
    - [2, 20.832]
  - - [3776, 1088, 1, 512, 3776, 3776, 3776, 1088]
    - [2, 20.722]
  - - [3904, 1088, 1, 512, 3904, 3904, 3904, 1088]
    - [2, 20.726]
  - - [4032, 1088, 1, 512, 4032, 4032, 4032, 1088]
    - [0, 20.819]
  - - [64, 1216, 1, 512, 64, 64, 64, 1216]
    - [2, 5.043]
  - - [192, 1216, 1, 512, 192, 192, 192, 1216]
    - [0, 14.429]
  - - [320, 1216, 1, 512, 320, 320, 320, 1216]
    - [0, 17.249]
  - - [448, 1216, 1, 512, 448, 448, 448, 1216]
    - [2, 18.169]
  - - [576, 1216, 1, 512, 576, 576, 576, 1216]
    - [0, 19.005]
  - - [704, 1216, 1, 512, 704, 704, 704, 1216]
    - [0, 19.77]
  - - [832, 1216, 1, 512, 832, 832, 832, 1216]
    - [0, 20.011]
  - - [960, 1216, 1, 512, 960, 960, 960, 1216]
    - [2, 20.105]
  - - [1088, 1216, 1, 512, 1088, 1088, 1088, 1216]
    - [0, 20.162]
  - - [1216, 1216, 1, 512, 1216, 1216, 1216, 1216]
    - [0, 20.118]
  - - [1344, 1216, 1, 512, 1344, 1344, 1344, 1216]
    - [0, 19.903]
  - - [1472, 1216, 1, 512, 1472, 1472, 1472, 1216]
    - [2, 20.15]
  - - [1600, 1216, 1, 512, 1600, 1600, 1600, 1216]
    - [2, 20.228]
  - - [1728, 1216, 1, 512, 1728, 1728, 1728, 1216]
    - [2, 20.111]
  - - [1856, 1216, 1, 512, 1856, 1856, 1856, 1216]
    - [2, 20.5]
  - - [1984, 1216, 1, 512, 1984, 1984, 1984, 1216]
    - [0, 20.443]
  - - [2112, 1216, 1, 512, 2112, 2112, 2112, 1216]
    - [3, 20.635]
  - - [2240, 1216, 1, 512, 2240, 2240, 2240, 1216]
    - [2, 20.668]
  - - [2368, 1216, 1, 512, 2368, 2368, 2368, 1216]
    - [2, 21.156]
  - - [2496, 1216, 1, 512, 2496, 2496, 2496, 1216]
    - [2, 20.688]
  - - [2624, 1216, 1, 512, 2624, 2624, 2624, 1216]
    - [2, 20.534]
  - - [2752, 1216, 1, 512, 2752, 2752, 2752, 1216]
    - [0, 20.759]
  - - [2880, 1216, 1, 512, 2880, 2880, 2880, 1216]
    - [2, 20.693]
  - - [3008, 1216, 1, 512, 3008, 3008, 3008, 1216]
    - [0, 20.761]
  - - [3136, 1216, 1, 512, 3136, 3136, 3136, 1216]
    - [0, 20.995]
  - - [3264, 1216, 1, 512, 3264, 3264, 3264, 1216]
    - [2, 20.934]
  - - [3392, 1216, 1, 512, 3392, 3392, 3392, 1216]
    - [2, 20.895]
  - - [3520, 1216, 1, 512, 3520, 3520, 3520, 1216]
    - [2, 20.78]
  - - [3648, 1216, 1, 512, 3648, 3648, 3648, 1216]
    - [2, 20.933]
  - - [3776, 1216, 1, 512, 3776, 3776, 3776, 1216]
    - [2, 20.757]
  - - [3904, 1216, 1, 512, 3904, 3904, 3904, 1216]
    - [2, 20.74]
  - - [4032, 1216, 1, 512, 4032, 4032, 4032, 1216]
    - [0, 20.784]
  - - [64, 1344, 1, 512, 64, 64, 64, 1344]
    - [3, 5.546]
  - - [192, 1344, 1, 512, 192, 192, 192, 1344]
    - [0, 14.186]
  - - [320, 1344, 1, 512, 320, 320, 320, 1344]
    - [0, 17.557]
  - - [448, 1344, 1, 512, 448, 448, 448, 1344]
    - [2, 18.525]
  - - [576, 1344, 1, 512, 576, 576, 576, 1344]
    - [0, 19.791]
  - - [704, 1344, 1, 512, 704, 704, 704, 1344]
    - [0, 19.926]
  - - [832, 1344, 1, 512, 832, 832, 832, 1344]
    - [0, 19.943]
  - - [960, 1344, 1, 512, 960, 960, 960, 1344]
    - [0, 20.552]
  - - [1088, 1344, 1, 512, 1088, 1088, 1088, 1344]
    - [0, 19.874]
  - - [1216, 1344, 1, 512, 1216, 1216, 1216, 1344]
    - [2, 20.114]
  - - [1344, 1344, 1, 512, 1344, 1344, 1344, 1344]
    - [3, 20.163]
  - - [1472, 1344, 1, 512, 1472, 1472, 1472, 1344]
    - [2, 20.653]
  - - [1600, 1344, 1, 512, 1600, 1600, 1600, 1344]
    - [3, 20.517]
  - - [1728, 1344, 1, 512, 1728, 1728, 1728, 1344]
    - [2, 20.682]
  - - [1856, 1344, 1, 512, 1856, 1856, 1856, 1344]
    - [3, 21.023]
  - - [1984, 1344, 1, 512, 1984, 1984, 1984, 1344]
    - [0, 20.931]
  - - [2112, 1344, 1, 512, 2112, 2112, 2112, 1344]
    - [3, 20.741]
  - - [2240, 1344, 1, 512, 2240, 2240, 2240, 1344]
    - [2, 20.525]
  - - [2368, 1344, 1, 512, 2368, 2368, 2368, 1344]
    - [2, 20.978]
  - - [2496, 1344, 1, 512, 2496, 2496, 2496, 1344]
    - [2, 20.672]
  - - [2624, 1344, 1, 512, 2624, 2624, 2624, 1344]
    - [0, 20.925]
  - - [2752, 1344, 1, 512, 2752, 2752, 2752, 1344]
    - [2, 20.674]
  - - [2880, 1344, 1, 512, 2880, 2880, 2880, 1344]
    - [2, 20.77]
  - - [3008, 1344, 1, 512, 3008, 3008, 3008, 1344]
    - [2, 20.777]
  - - [3136, 1344, 1, 512, 3136, 3136, 3136, 1344]
    - [2, 20.932]
  - - [3264, 1344, 1, 512, 3264, 3264, 3264, 1344]
    - [2, 20.932]
  - - [3392, 1344, 1, 512, 3392, 3392, 3392, 1344]
    - [2, 20.748]
  - - [3520, 1344, 1, 512, 3520, 3520, 3520, 1344]
    - [0, 20.685]
  - - [3648, 1344, 1, 512, 3648, 3648, 3648, 1344]
    - [2, 20.904]
  - - [3776, 1344, 1, 512, 3776, 3776, 3776, 1344]
    - [0, 20.665]
  - - [3904, 1344, 1, 512, 3904, 3904, 3904, 1344]
    - [0, 20.699]
  - - [4032, 1344, 1, 512, 4032, 4032, 4032, 1344]
    - [0, 20.827]
  - - [64, 1472, 1, 512, 64, 64, 64, 1472]
    - [0, 9.394]
  - - [192, 1472, 1, 512, 192, 192, 192, 1472]
    - [0, 15.456]
  - - [320, 1472, 1, 512, 320, 320, 320, 1472]
    - [0, 17.767]
  - - [448, 1472, 1, 512, 448, 448, 448, 1472]
    - [0, 18.922]
  - - [576, 1472, 1, 512, 576, 576, 576, 1472]
    - [0, 20.015]
  - - [704, 1472, 1, 512, 704, 704, 704, 1472]
    - [0, 20.258]
  - - [832, 1472, 1, 512, 832, 832, 832, 1472]
    - [0, 20.102]
  - - [960, 1472, 1, 512, 960, 960, 960, 1472]
    - [0, 20.386]
  - - [1088, 1472, 1, 512, 1088, 1088, 1088, 1472]
    - [0, 20.173]
  - - [1216, 1472, 1, 512, 1216, 1216, 1216, 1472]
    - [0, 20.256]
  - - [1344, 1472, 1, 512, 1344, 1344, 1344, 1472]
    - [2, 20.136]
  - - [1472, 1472, 1, 512, 1472, 1472, 1472, 1472]
    - [2, 20.699]
  - - [1600, 1472, 1, 512, 1600, 1600, 1600, 1472]
    - [3, 20.683]
  - - [1728, 1472, 1, 512, 1728, 1728, 1728, 1472]
    - [0, 20.746]
  - - [1856, 1472, 1, 512, 1856, 1856, 1856, 1472]
    - [0, 20.921]
  - - [1984, 1472, 1, 512, 1984, 1984, 1984, 1472]
    - [2, 21.001]
  - - [2112, 1472, 1, 512, 2112, 2112, 2112, 1472]
    - [2, 20.672]
  - - [2240, 1472, 1, 512, 2240, 2240, 2240, 1472]
    - [2, 21.158]
  - - [2368, 1472, 1, 512, 2368, 2368, 2368, 1472]
    - [2, 20.766]
  - - [2496, 1472, 1, 512, 2496, 2496, 2496, 1472]
    - [2, 21.027]
  - - [2624, 1472, 1, 512, 2624, 2624, 2624, 1472]
    - [0, 20.71]
  - - [2752, 1472, 1, 512, 2752, 2752, 2752, 1472]
    - [2, 21.0]
  - - [2880, 1472, 1, 512, 2880, 2880, 2880, 1472]
    - [0, 20.648]
  - - [3008, 1472, 1, 512, 3008, 3008, 3008, 1472]
    - [0, 20.877]
  - - [3136, 1472, 1, 512, 3136, 3136, 3136, 1472]
    - [2, 20.978]
  - - [3264, 1472, 1, 512, 3264, 3264, 3264, 1472]
    - [0, 20.917]
  - - [3392, 1472, 1, 512, 3392, 3392, 3392, 1472]
    - [2, 20.818]
  - - [3520, 1472, 1, 512, 3520, 3520, 3520, 1472]
    - [0, 20.972]
  - - [3648, 1472, 1, 512, 3648, 3648, 3648, 1472]
    - [0, 20.882]
  - - [3776, 1472, 1, 512, 3776, 3776, 3776, 1472]
    - [0, 20.764]
  - - [3904, 1472, 1, 512, 3904, 3904, 3904, 1472]
    - [2, 21.044]
  - - [4032, 1472, 1, 512, 4032, 4032, 4032, 1472]
    - [0, 20.763]
  - - [64, 1600, 1, 512, 64, 64, 64, 1600]
    - [3, 6.57]
  - - [192, 1600, 1, 512, 192, 192, 192, 1600]
    - [2, 15.095]
  - - [320, 1600, 1, 512, 320, 320, 320, 1600]
    - [0, 17.753]
  - - [448, 1600, 1, 512, 448, 448, 448, 1600]
    - [0, 19.353]
  - - [576, 1600, 1, 512, 576, 576, 576, 1600]
    - [0, 20.259]
  - - [704, 1600, 1, 512, 704, 704, 704, 1600]
    - [0, 20.398]
  - - [832, 1600, 1, 512, 832, 832, 832, 1600]
    - [0, 20.082]
  - - [960, 1600, 1, 512, 960, 960, 960, 1600]
    - [0, 20.176]
  - - [1088, 1600, 1, 512, 1088, 1088, 1088, 1600]
    - [0, 20.366]
  - - [1216, 1600, 1, 512, 1216, 1216, 1216, 1600]
    - [0, 20.62]
  - - [1344, 1600, 1, 512, 1344, 1344, 1344, 1600]
    - [0, 20.517]
  - - [1472, 1600, 1, 512, 1472, 1472, 1472, 1600]
    - [2, 20.658]
  - - [1600, 1600, 1, 512, 1600, 1600, 1600, 1600]
    - [2, 20.673]
  - - [1728, 1600, 1, 512, 1728, 1728, 1728, 1600]
    - [0, 20.836]
  - - [1856, 1600, 1, 512, 1856, 1856, 1856, 1600]
    - [2, 20.675]
  - - [1984, 1600, 1, 512, 1984, 1984, 1984, 1600]
    - [0, 20.677]
  - - [2112, 1600, 1, 512, 2112, 2112, 2112, 1600]
    - [2, 20.663]
  - - [2240, 1600, 1, 512, 2240, 2240, 2240, 1600]
    - [0, 20.924]
  - - [2368, 1600, 1, 512, 2368, 2368, 2368, 1600]
    - [2, 20.747]
  - - [2496, 1600, 1, 512, 2496, 2496, 2496, 1600]
    - [2, 20.772]
  - - [2624, 1600, 1, 512, 2624, 2624, 2624, 1600]
    - [2, 21.014]
  - - [2752, 1600, 1, 512, 2752, 2752, 2752, 1600]
    - [2, 20.877]
  - - [2880, 1600, 1, 512, 2880, 2880, 2880, 1600]
    - [2, 20.991]
  - - [3008, 1600, 1, 512, 3008, 3008, 3008, 1600]
    - [0, 21.041]
  - - [3136, 1600, 1, 512, 3136, 3136, 3136, 1600]
    - [0, 20.945]
  - - [3264, 1600, 1, 512, 3264, 3264, 3264, 1600]
    - [0, 20.904]
  - - [3392, 1600, 1, 512, 3392, 3392, 3392, 1600]
    - [0, 20.882]
  - - [3520, 1600, 1, 512, 3520, 3520, 3520, 1600]
    - [2, 21.054]
  - - [3648, 1600, 1, 512, 3648, 3648, 3648, 1600]
    - [2, 20.973]
  - - [3776, 1600, 1, 512, 3776, 3776, 3776, 1600]
    - [0, 21.06]
  - - [3904, 1600, 1, 512, 3904, 3904, 3904, 1600]
    - [2, 21.014]
  - - [4032, 1600, 1, 512, 4032, 4032, 4032, 1600]
    - [0, 21.114]
  - - [64, 1728, 1, 512, 64, 64, 64, 1728]
    - [2, 9.347]
  - - [192, 1728, 1, 512, 192, 192, 192, 1728]
    - [0, 16.294]
  - - [320, 1728, 1, 512, 320, 320, 320, 1728]
    - [0, 18.187]
  - - [448, 1728, 1, 512, 448, 448, 448, 1728]
    - [0, 19.819]
  - - [576, 1728, 1, 512, 576, 576, 576, 1728]
    - [0, 20.056]
  - - [704, 1728, 1, 512, 704, 704, 704, 1728]
    - [0, 20.188]
  - - [832, 1728, 1, 512, 832, 832, 832, 1728]
    - [0, 20.032]
  - - [960, 1728, 1, 512, 960, 960, 960, 1728]
    - [0, 20.048]
  - - [1088, 1728, 1, 512, 1088, 1088, 1088, 1728]
    - [2, 19.972]
  - - [1216, 1728, 1, 512, 1216, 1216, 1216, 1728]
    - [0, 20.176]
  - - [1344, 1728, 1, 512, 1344, 1344, 1344, 1728]
    - [2, 20.49]
  - - [1472, 1728, 1, 512, 1472, 1472, 1472, 1728]
    - [0, 20.825]
  - - [1600, 1728, 1, 512, 1600, 1600, 1600, 1728]
    - [2, 20.873]
  - - [1728, 1728, 1, 512, 1728, 1728, 1728, 1728]
    - [0, 20.807]
  - - [1856, 1728, 1, 512, 1856, 1856, 1856, 1728]
    - [0, 20.836]
  - - [1984, 1728, 1, 512, 1984, 1984, 1984, 1728]
    - [2, 20.933]
  - - [2112, 1728, 1, 512, 2112, 2112, 2112, 1728]
    - [0, 20.84]
  - - [2240, 1728, 1, 512, 2240, 2240, 2240, 1728]
    - [2, 20.703]
  - - [2368, 1728, 1, 512, 2368, 2368, 2368, 1728]
    - [0, 20.683]
  - - [2496, 1728, 1, 512, 2496, 2496, 2496, 1728]
    - [0, 20.774]
  - - [2624, 1728, 1, 512, 2624, 2624, 2624, 1728]
    - [2, 20.946]
  - - [2752, 1728, 1, 512, 2752, 2752, 2752, 1728]
    - [0, 20.91]
  - - [2880, 1728, 1, 512, 2880, 2880, 2880, 1728]
    - [0, 20.846]
  - - [3008, 1728, 1, 512, 3008, 3008, 3008, 1728]
    - [0, 20.895]
  - - [3136, 1728, 1, 512, 3136, 3136, 3136, 1728]
    - [0, 21.112]
  - - [3264, 1728, 1, 512, 3264, 3264, 3264, 1728]
    - [2, 20.922]
  - - [3392, 1728, 1, 512, 3392, 3392, 3392, 1728]
    - [0, 20.907]
  - - [3520, 1728, 1, 512, 3520, 3520, 3520, 1728]
    - [2, 20.945]
  - - [3648, 1728, 1, 512, 3648, 3648, 3648, 1728]
    - [2, 21.093]
  - - [3776, 1728, 1, 512, 3776, 3776, 3776, 1728]
    - [0, 20.935]
  - - [3904, 1728, 1, 512, 3904, 3904, 3904, 1728]
    - [0, 21.043]
  - - [4032, 1728, 1, 512, 4032, 4032, 4032, 1728]
    - [0, 20.953]
  - - [64, 1856, 1, 512, 64, 64, 64, 1856]
    - [2, 10.03]
  - - [192, 1856, 1, 512, 192, 192, 192, 1856]
    - [0, 16.113]
  - - [320, 1856, 1, 512, 320, 320, 320, 1856]
    - [0, 18.478]
  - - [448, 1856, 1, 512, 448, 448, 448, 1856]
    - [0, 20.165]
  - - [576, 1856, 1, 512, 576, 576, 576, 1856]
    - [0, 20.627]
  - - [704, 1856, 1, 512, 704, 704, 704, 1856]
    - [0, 20.228]
  - - [832, 1856, 1, 512, 832, 832, 832, 1856]
    - [0, 20.205]
  - - [960, 1856, 1, 512, 960, 960, 960, 1856]
    - [0, 20.325]
  - - [1088, 1856, 1, 512, 1088, 1088, 1088, 1856]
    - [2, 20.39]
  - - [1216, 1856, 1, 512, 1216, 1216, 1216, 1856]
    - [0, 20.506]
  - - [1344, 1856, 1, 512, 1344, 1344, 1344, 1856]
    - [2, 21.364]
  - - [1472, 1856, 1, 512, 1472, 1472, 1472, 1856]
    - [3, 21.012]
  - - [1600, 1856, 1, 512, 1600, 1600, 1600, 1856]
    - [2, 21.836]
  - - [1728, 1856, 1, 512, 1728, 1728, 1728, 1856]
    - [2, 20.809]
  - - [1856, 1856, 1, 512, 1856, 1856, 1856, 1856]
    - [0, 20.887]
  - - [1984, 1856, 1, 512, 1984, 1984, 1984, 1856]
    - [0, 20.94]
  - - [2112, 1856, 1, 512, 2112, 2112, 2112, 1856]
    - [2, 20.933]
  - - [2240, 1856, 1, 512, 2240, 2240, 2240, 1856]
    - [0, 20.945]
  - - [2368, 1856, 1, 512, 2368, 2368, 2368, 1856]
    - [2, 21.041]
  - - [2496, 1856, 1, 512, 2496, 2496, 2496, 1856]
    - [2, 21.193]
  - - [2624, 1856, 1, 512, 2624, 2624, 2624, 1856]
    - [2, 20.855]
  - - [2752, 1856, 1, 512, 2752, 2752, 2752, 1856]
    - [0, 20.974]
  - - [2880, 1856, 1, 512, 2880, 2880, 2880, 1856]
    - [2, 20.922]
  - - [3008, 1856, 1, 512, 3008, 3008, 3008, 1856]
    - [0, 21.069]
  - - [3136, 1856, 1, 512, 3136, 3136, 3136, 1856]
    - [0, 21.082]
  - - [3264, 1856, 1, 512, 3264, 3264, 3264, 1856]
    - [2, 21.065]
  - - [3392, 1856, 1, 512, 3392, 3392, 3392, 1856]
    - [2, 20.89]
  - - [3520, 1856, 1, 512, 3520, 3520, 3520, 1856]
    - [0, 20.748]
  - - [3648, 1856, 1, 512, 3648, 3648, 3648, 1856]
    - [0, 20.807]
  - - [3776, 1856, 1, 512, 3776, 3776, 3776, 1856]
    - [0, 21.019]
  - - [3904, 1856, 1, 512, 3904, 3904, 3904, 1856]
    - [0, 20.982]
  - - [4032, 1856, 1, 512, 4032, 4032, 4032, 1856]
    - [0, 21.042]
  - - [64, 1984, 1, 512, 64, 64, 64, 1984]
    - [0, 10.543]
  - - [192, 1984, 1, 512, 192, 192, 192, 1984]
    - [0, 16.957]
  - - [320, 1984, 1, 512, 320, 320, 320, 1984]
    - [0, 19.187]
  - - [448, 1984, 1, 512, 448, 448, 448, 1984]
    - [0, 20.318]
  - - [576, 1984, 1, 512, 576, 576, 576, 1984]
    - [0, 20.509]
  - - [704, 1984, 1, 512, 704, 704, 704, 1984]
    - [0, 20.32]
  - - [832, 1984, 1, 512, 832, 832, 832, 1984]
    - [3, 19.857]
  - - [960, 1984, 1, 512, 960, 960, 960, 1984]
    - [2, 20.227]
  - - [1088, 1984, 1, 512, 1088, 1088, 1088, 1984]
    - [2, 20.784]
  - - [1216, 1984, 1, 512, 1216, 1216, 1216, 1984]
    - [2, 20.58]
  - - [1344, 1984, 1, 512, 1344, 1344, 1344, 1984]
    - [0, 20.815]
  - - [1472, 1984, 1, 512, 1472, 1472, 1472, 1984]
    - [0, 20.708]
  - - [1600, 1984, 1, 512, 1600, 1600, 1600, 1984]
    - [2, 20.952]
  - - [1728, 1984, 1, 512, 1728, 1728, 1728, 1984]
    - [0, 20.743]
  - - [1856, 1984, 1, 512, 1856, 1856, 1856, 1984]
    - [0, 21.024]
  - - [1984, 1984, 1, 512, 1984, 1984, 1984, 1984]
    - [2, 20.923]
  - - [2112, 1984, 1, 512, 2112, 2112, 2112, 1984]
    - [0, 21.038]
  - - [2240, 1984, 1, 512, 2240, 2240, 2240, 1984]
    - [2, 20.847]
  - - [2368, 1984, 1, 512, 2368, 2368, 2368, 1984]
    - [0, 21.081]
  - - [2496, 1984, 1, 512, 2496, 2496, 2496, 1984]
    - [2, 21.0]
  - - [2624, 1984, 1, 512, 2624, 2624, 2624, 1984]
    - [0, 20.732]
  - - [2752, 1984, 1, 512, 2752, 2752, 2752, 1984]
    - [0, 20.917]
  - - [2880, 1984, 1, 512, 2880, 2880, 2880, 1984]
    - [0, 20.82]
  - - [3008, 1984, 1, 512, 3008, 3008, 3008, 1984]
    - [2, 20.787]
  - - [3136, 1984, 1, 512, 3136, 3136, 3136, 1984]
    - [2, 20.825]
  - - [3264, 1984, 1, 512, 3264, 3264, 3264, 1984]
    - [0, 20.865]
  - - [3392, 1984, 1, 512, 3392, 3392, 3392, 1984]
    - [2, 20.978]
  - - [3520, 1984, 1, 512, 3520, 3520, 3520, 1984]
    - [0, 20.789]
  - - [3648, 1984, 1, 512, 3648, 3648, 3648, 1984]
    - [2, 20.841]
  - - [3776, 1984, 1, 512, 3776, 3776, 3776, 1984]
    - [2, 20.836]
  - - [3904, 1984, 1, 512, 3904, 3904, 3904, 1984]
    - [0, 20.967]
  - - [4032, 1984, 1, 512, 4032, 4032, 4032, 1984]
    - [0, 20.836]
  - - [64, 2112, 1, 512, 64, 64, 64, 2112]
    - [0, 11.233]
  - - [192, 2112, 1, 512, 192, 192, 192, 2112]
    - [0, 16.771]
  - - [320, 2112, 1, 512, 320, 320, 320, 2112]
    - [2, 19.298]
  - - [448, 2112, 1, 512, 448, 448, 448, 2112]
    - [0, 20.172]
  - - [576, 2112, 1, 512, 576, 576, 576, 2112]
    - [2, 20.689]
  - - [704, 2112, 1, 512, 704, 704, 704, 2112]
    - [0, 20.253]
  - - [832, 2112, 1, 512, 832, 832, 832, 2112]
    - [0, 20.369]
  - - [960, 2112, 1, 512, 960, 960, 960, 2112]
    - [2, 20.201]
  - - [1088, 2112, 1, 512, 1088, 1088, 1088, 2112]
    - [3, 20.732]
  - - [1216, 2112, 1, 512, 1216, 1216, 1216, 2112]
    - [2, 20.859]
  - - [1344, 2112, 1, 512, 1344, 1344, 1344, 2112]
    - [0, 20.513]
  - - [1472, 2112, 1, 512, 1472, 1472, 1472, 2112]
    - [0, 20.79]
  - - [1600, 2112, 1, 512, 1600, 1600, 1600, 2112]
    - [0, 20.824]
  - - [1728, 2112, 1, 512, 1728, 1728, 1728, 2112]
    - [0, 20.666]
  - - [1856, 2112, 1, 512, 1856, 1856, 1856, 2112]
    - [0, 20.644]
  - - [1984, 2112, 1, 512, 1984, 1984, 1984, 2112]
    - [2, 20.887]
  - - [2112, 2112, 1, 512, 2112, 2112, 2112, 2112]
    - [0, 20.86]
  - - [2240, 2112, 1, 512, 2240, 2240, 2240, 2112]
    - [2, 20.957]
  - - [2368, 2112, 1, 512, 2368, 2368, 2368, 2112]
    - [2, 20.71]
  - - [2496, 2112, 1, 512, 2496, 2496, 2496, 2112]
    - [0, 20.898]
  - - [2624, 2112, 1, 512, 2624, 2624, 2624, 2112]
    - [2, 20.979]
  - - [2752, 2112, 1, 512, 2752, 2752, 2752, 2112]
    - [2, 20.954]
  - - [2880, 2112, 1, 512, 2880, 2880, 2880, 2112]
    - [2, 21.009]
  - - [3008, 2112, 1, 512, 3008, 3008, 3008, 2112]
    - [2, 20.838]
  - - [3136, 2112, 1, 512, 3136, 3136, 3136, 2112]
    - [2, 20.81]
  - - [3264, 2112, 1, 512, 3264, 3264, 3264, 2112]
    - [2, 21.088]
  - - [3392, 2112, 1, 512, 3392, 3392, 3392, 2112]
    - [0, 20.996]
  - - [3520, 2112, 1, 512, 3520, 3520, 3520, 2112]
    - [0, 20.888]
  - - [3648, 2112, 1, 512, 3648, 3648, 3648, 2112]
    - [2, 20.963]
  - - [3776, 2112, 1, 512, 3776, 3776, 3776, 2112]
    - [0, 20.944]
  - - [3904, 2112, 1, 512, 3904, 3904, 3904, 2112]
    - [2, 20.963]
  - - [4032, 2112, 1, 512, 4032, 4032, 4032, 2112]
    - [2, 20.908]
  - - [64, 2240, 1, 512, 64, 64, 64, 2240]
    - [0, 11.857]
  - - [192, 2240, 1, 512, 192, 192, 192, 2240]
    - [0, 17.442]
  - - [320, 2240, 1, 512, 320, 320, 320, 2240]
    - [0, 19.14]
  - - [448, 2240, 1, 512, 448, 448, 448, 2240]
    - [0, 20.175]
  - - [576, 2240, 1, 512, 576, 576, 576, 2240]
    - [0, 20.561]
  - - [704, 2240, 1, 512, 704, 704, 704, 2240]
    - [0, 20.489]
  - - [832, 2240, 1, 512, 832, 832, 832, 2240]
    - [2, 20.031]
  - - [960, 2240, 1, 512, 960, 960, 960, 2240]
    - [0, 20.5]
  - - [1088, 2240, 1, 512, 1088, 1088, 1088, 2240]
    - [2, 20.319]
  - - [1216, 2240, 1, 512, 1216, 1216, 1216, 2240]
    - [3, 20.577]
  - - [1344, 2240, 1, 512, 1344, 1344, 1344, 2240]
    - [2, 21.053]
  - - [1472, 2240, 1, 512, 1472, 1472, 1472, 2240]
    - [2, 20.555]
  - - [1600, 2240, 1, 512, 1600, 1600, 1600, 2240]
    - [2, 20.828]
  - - [1728, 2240, 1, 512, 1728, 1728, 1728, 2240]
    - [0, 20.752]
  - - [1856, 2240, 1, 512, 1856, 1856, 1856, 2240]
    - [0, 20.701]
  - - [1984, 2240, 1, 512, 1984, 1984, 1984, 2240]
    - [2, 20.818]
  - - [2112, 2240, 1, 512, 2112, 2112, 2112, 2240]
    - [2, 20.857]
  - - [2240, 2240, 1, 512, 2240, 2240, 2240, 2240]
    - [2, 21.0]
  - - [2368, 2240, 1, 512, 2368, 2368, 2368, 2240]
    - [2, 20.712]
  - - [2496, 2240, 1, 512, 2496, 2496, 2496, 2240]
    - [0, 20.71]
  - - [2624, 2240, 1, 512, 2624, 2624, 2624, 2240]
    - [2, 21.083]
  - - [2752, 2240, 1, 512, 2752, 2752, 2752, 2240]
    - [2, 21.302]
  - - [2880, 2240, 1, 512, 2880, 2880, 2880, 2240]
    - [0, 20.959]
  - - [3008, 2240, 1, 512, 3008, 3008, 3008, 2240]
    - [0, 20.762]
  - - [3136, 2240, 1, 512, 3136, 3136, 3136, 2240]
    - [2, 21.204]
  - - [3264, 2240, 1, 512, 3264, 3264, 3264, 2240]
    - [2, 21.0]
  - - [3392, 2240, 1, 512, 3392, 3392, 3392, 2240]
    - [2, 21.069]
  - - [3520, 2240, 1, 512, 3520, 3520, 3520, 2240]
    - [2, 20.985]
  - - [3648, 2240, 1, 512, 3648, 3648, 3648, 2240]
    - [2, 20.964]
  - - [3776, 2240, 1, 512, 3776, 3776, 3776, 2240]
    - [0, 20.946]
  - - [3904, 2240, 1, 512, 3904, 3904, 3904, 2240]
    - [2, 20.944]
  - - [4032, 2240, 1, 512, 4032, 4032, 4032, 2240]
    - [2, 21.02]
  - - [64, 2368, 1, 512, 64, 64, 64, 2368]
    - [2, 10.868]
  - - [192, 2368, 1, 512, 192, 192, 192, 2368]
    - [2, 17.475]
  - - [320, 2368, 1, 512, 320, 320, 320, 2368]
    - [2, 19.448]
  - - [448, 2368, 1, 512, 448, 448, 448, 2368]
    - [0, 19.961]
  - - [576, 2368, 1, 512, 576, 576, 576, 2368]
    - [2, 19.647]
  - - [704, 2368, 1, 512, 704, 704, 704, 2368]
    - [0, 20.118]
  - - [832, 2368, 1, 512, 832, 832, 832, 2368]
    - [2, 20.446]
  - - [960, 2368, 1, 512, 960, 960, 960, 2368]
    - [3, 20.432]
  - - [1088, 2368, 1, 512, 1088, 1088, 1088, 2368]
    - [0, 20.571]
  - - [1216, 2368, 1, 512, 1216, 1216, 1216, 2368]
    - [0, 20.708]
  - - [1344, 2368, 1, 512, 1344, 1344, 1344, 2368]
    - [0, 20.454]
  - - [1472, 2368, 1, 512, 1472, 1472, 1472, 2368]
    - [0, 20.867]
  - - [1600, 2368, 1, 512, 1600, 1600, 1600, 2368]
    - [2, 20.752]
  - - [1728, 2368, 1, 512, 1728, 1728, 1728, 2368]
    - [0, 20.783]
  - - [1856, 2368, 1, 512, 1856, 1856, 1856, 2368]
    - [2, 20.921]
  - - [1984, 2368, 1, 512, 1984, 1984, 1984, 2368]
    - [0, 20.895]
  - - [2112, 2368, 1, 512, 2112, 2112, 2112, 2368]
    - [0, 20.739]
  - - [2240, 2368, 1, 512, 2240, 2240, 2240, 2368]
    - [0, 20.783]
  - - [2368, 2368, 1, 512, 2368, 2368, 2368, 2368]
    - [2, 21.192]
  - - [2496, 2368, 1, 512, 2496, 2496, 2496, 2368]
    - [2, 20.953]
  - - [2624, 2368, 1, 512, 2624, 2624, 2624, 2368]
    - [0, 20.803]
  - - [2752, 2368, 1, 512, 2752, 2752, 2752, 2368]
    - [2, 20.73]
  - - [2880, 2368, 1, 512, 2880, 2880, 2880, 2368]
    - [2, 21.064]
  - - [3008, 2368, 1, 512, 3008, 3008, 3008, 2368]
    - [2, 20.762]
  - - [3136, 2368, 1, 512, 3136, 3136, 3136, 2368]
    - [2, 20.923]
  - - [3264, 2368, 1, 512, 3264, 3264, 3264, 2368]
    - [2, 20.964]
  - - [3392, 2368, 1, 512, 3392, 3392, 3392, 2368]
    - [2, 20.832]
  - - [3520, 2368, 1, 512, 3520, 3520, 3520, 2368]
    - [2, 20.984]
  - - [3648, 2368, 1, 512, 3648, 3648, 3648, 2368]
    - [2, 20.946]
  - - [3776, 2368, 1, 512, 3776, 3776, 3776, 2368]
    - [0, 20.805]
  - - [3904, 2368, 1, 512, 3904, 3904, 3904, 2368]
    - [2, 21.048]
  - - [4032, 2368, 1, 512, 4032, 4032, 4032, 2368]
    - [2, 21.017]
  - - [64, 2496, 1, 512, 64, 64, 64, 2496]
    - [2, 11.426]
  - - [192, 2496, 1, 512, 192, 192, 192, 2496]
    - [0, 17.914]
  - - [320, 2496, 1, 512, 320, 320, 320, 2496]
    - [2, 19.664]
  - - [448, 2496, 1, 512, 448, 448, 448, 2496]
    - [0, 20.097]
  - - [576, 2496, 1, 512, 576, 576, 576, 2496]
    - [0, 19.932]
  - - [704, 2496, 1, 512, 704, 704, 704, 2496]
    - [0, 20.175]
  - - [832, 2496, 1, 512, 832, 832, 832, 2496]
    - [2, 20.665]
  - - [960, 2496, 1, 512, 960, 960, 960, 2496]
    - [2, 20.949]
  - - [1088, 2496, 1, 512, 1088, 1088, 1088, 2496]
    - [2, 20.966]
  - - [1216, 2496, 1, 512, 1216, 1216, 1216, 2496]
    - [0, 20.807]
  - - [1344, 2496, 1, 512, 1344, 1344, 1344, 2496]
    - [2, 21.174]
  - - [1472, 2496, 1, 512, 1472, 1472, 1472, 2496]
    - [0, 20.89]
  - - [1600, 2496, 1, 512, 1600, 1600, 1600, 2496]
    - [0, 20.645]
  - - [1728, 2496, 1, 512, 1728, 1728, 1728, 2496]
    - [0, 20.947]
  - - [1856, 2496, 1, 512, 1856, 1856, 1856, 2496]
    - [2, 20.91]
  - - [1984, 2496, 1, 512, 1984, 1984, 1984, 2496]
    - [0, 20.777]
  - - [2112, 2496, 1, 512, 2112, 2112, 2112, 2496]
    - [2, 20.974]
  - - [2240, 2496, 1, 512, 2240, 2240, 2240, 2496]
    - [0, 20.896]
  - - [2368, 2496, 1, 512, 2368, 2368, 2368, 2496]
    - [2, 20.888]
  - - [2496, 2496, 1, 512, 2496, 2496, 2496, 2496]
    - [0, 20.852]
  - - [2624, 2496, 1, 512, 2624, 2624, 2624, 2496]
    - [2, 21.089]
  - - [2752, 2496, 1, 512, 2752, 2752, 2752, 2496]
    - [2, 21.112]
  - - [2880, 2496, 1, 512, 2880, 2880, 2880, 2496]
    - [0, 20.893]
  - - [3008, 2496, 1, 512, 3008, 3008, 3008, 2496]
    - [2, 20.992]
  - - [3136, 2496, 1, 512, 3136, 3136, 3136, 2496]
    - [2, 21.05]
  - - [3264, 2496, 1, 512, 3264, 3264, 3264, 2496]
    - [2, 21.066]
  - - [3392, 2496, 1, 512, 3392, 3392, 3392, 2496]
    - [2, 21.001]
  - - [3520, 2496, 1, 512, 3520, 3520, 3520, 2496]
    - [2, 20.84]
  - - [3648, 2496, 1, 512, 3648, 3648, 3648, 2496]
    - [2, 20.891]
  - - [3776, 2496, 1, 512, 3776, 3776, 3776, 2496]
    - [2, 20.763]
  - - [3904, 2496, 1, 512, 3904, 3904, 3904, 2496]
    - [2, 20.91]
  - - [4032, 2496, 1, 512, 4032, 4032, 4032, 2496]
    - [2, 20.939]
  - - [64, 2624, 1, 512, 64, 64, 64, 2624]
    - [2, 12.007]
  - - [192, 2624, 1, 512, 192, 192, 192, 2624]
    - [2, 17.818]
  - - [320, 2624, 1, 512, 320, 320, 320, 2624]
    - [0, 19.866]
  - - [448, 2624, 1, 512, 448, 448, 448, 2624]
    - [0, 19.988]
  - - [576, 2624, 1, 512, 576, 576, 576, 2624]
    - [0, 19.928]
  - - [704, 2624, 1, 512, 704, 704, 704, 2624]
    - [0, 19.845]
  - - [832, 2624, 1, 512, 832, 832, 832, 2624]
    - [2, 20.523]
  - - [960, 2624, 1, 512, 960, 960, 960, 2624]
    - [2, 20.981]
  - - [1088, 2624, 1, 512, 1088, 1088, 1088, 2624]
    - [2, 20.744]
  - - [1216, 2624, 1, 512, 1216, 1216, 1216, 2624]
    - [3, 21.186]
  - - [1344, 2624, 1, 512, 1344, 1344, 1344, 2624]
    - [0, 20.962]
  - - [1472, 2624, 1, 512, 1472, 1472, 1472, 2624]
    - [2, 20.813]
  - - [1600, 2624, 1, 512, 1600, 1600, 1600, 2624]
    - [2, 20.986]
  - - [1728, 2624, 1, 512, 1728, 1728, 1728, 2624]
    - [0, 20.867]
  - - [1856, 2624, 1, 512, 1856, 1856, 1856, 2624]
    - [0, 20.796]
  - - [1984, 2624, 1, 512, 1984, 1984, 1984, 2624]
    - [0, 20.779]
  - - [2112, 2624, 1, 512, 2112, 2112, 2112, 2624]
    - [0, 20.653]
  - - [2240, 2624, 1, 512, 2240, 2240, 2240, 2624]
    - [0, 20.823]
  - - [2368, 2624, 1, 512, 2368, 2368, 2368, 2624]
    - [2, 20.778]
  - - [2496, 2624, 1, 512, 2496, 2496, 2496, 2624]
    - [0, 20.782]
  - - [2624, 2624, 1, 512, 2624, 2624, 2624, 2624]
    - [0, 20.784]
  - - [2752, 2624, 1, 512, 2752, 2752, 2752, 2624]
    - [2, 20.854]
  - - [2880, 2624, 1, 512, 2880, 2880, 2880, 2624]
    - [2, 20.813]
  - - [3008, 2624, 1, 512, 3008, 3008, 3008, 2624]
    - [2, 20.867]
  - - [3136, 2624, 1, 512, 3136, 3136, 3136, 2624]
    - [2, 20.96]
  - - [3264, 2624, 1, 512, 3264, 3264, 3264, 2624]
    - [2, 20.795]
  - - [3392, 2624, 1, 512, 3392, 3392, 3392, 2624]
    - [2, 21.06]
  - - [3520, 2624, 1, 512, 3520, 3520, 3520, 2624]
    - [2, 20.948]
  - - [3648, 2624, 1, 512, 3648, 3648, 3648, 2624]
    - [2, 20.881]
  - - [3776, 2624, 1, 512, 3776, 3776, 3776, 2624]
    - [2, 20.985]
  - - [3904, 2624, 1, 512, 3904, 3904, 3904, 2624]
    - [2, 21.119]
  - - [4032, 2624, 1, 512, 4032, 4032, 4032, 2624]
    - [2, 20.872]
  - - [64, 2752, 1, 512, 64, 64, 64, 2752]
    - [0, 12.453]
  - - [192, 2752, 1, 512, 192, 192, 192, 2752]
    - [0, 18.265]
  - - [320, 2752, 1, 512, 320, 320, 320, 2752]
    - [0, 20.379]
  - - [448, 2752, 1, 512, 448, 448, 448, 2752]
    - [0, 19.776]
  - - [576, 2752, 1, 512, 576, 576, 576, 2752]
    - [0, 20.189]
  - - [704, 2752, 1, 512, 704, 704, 704, 2752]
    - [2, 20.235]
  - - [832, 2752, 1, 512, 832, 832, 832, 2752]
    - [2, 20.143]
  - - [960, 2752, 1, 512, 960, 960, 960, 2752]
    - [2, 20.627]
  - - [1088, 2752, 1, 512, 1088, 1088, 1088, 2752]
    - [2, 20.619]
  - - [1216, 2752, 1, 512, 1216, 1216, 1216, 2752]
    - [2, 20.716]
  - - [1344, 2752, 1, 512, 1344, 1344, 1344, 2752]
    - [0, 20.793]
  - - [1472, 2752, 1, 512, 1472, 1472, 1472, 2752]
    - [2, 20.706]
  - - [1600, 2752, 1, 512, 1600, 1600, 1600, 2752]
    - [2, 20.684]
  - - [1728, 2752, 1, 512, 1728, 1728, 1728, 2752]
    - [0, 20.508]
  - - [1856, 2752, 1, 512, 1856, 1856, 1856, 2752]
    - [2, 20.986]
  - - [1984, 2752, 1, 512, 1984, 1984, 1984, 2752]
    - [0, 20.778]
  - - [2112, 2752, 1, 512, 2112, 2112, 2112, 2752]
    - [2, 21.104]
  - - [2240, 2752, 1, 512, 2240, 2240, 2240, 2752]
    - [2, 20.87]
  - - [2368, 2752, 1, 512, 2368, 2368, 2368, 2752]
    - [2, 20.713]
  - - [2496, 2752, 1, 512, 2496, 2496, 2496, 2752]
    - [2, 20.82]
  - - [2624, 2752, 1, 512, 2624, 2624, 2624, 2752]
    - [2, 20.736]
  - - [2752, 2752, 1, 512, 2752, 2752, 2752, 2752]
    - [2, 20.789]
  - - [2880, 2752, 1, 512, 2880, 2880, 2880, 2752]
    - [2, 20.86]
  - - [3008, 2752, 1, 512, 3008, 3008, 3008, 2752]
    - [2, 20.884]
  - - [3136, 2752, 1, 512, 3136, 3136, 3136, 2752]
    - [2, 20.942]
  - - [3264, 2752, 1, 512, 3264, 3264, 3264, 2752]
    - [2, 21.008]
  - - [3392, 2752, 1, 512, 3392, 3392, 3392, 2752]
    - [2, 20.722]
  - - [3520, 2752, 1, 512, 3520, 3520, 3520, 2752]
    - [2, 20.932]
  - - [3648, 2752, 1, 512, 3648, 3648, 3648, 2752]
    - [2, 20.868]
  - - [3776, 2752, 1, 512, 3776, 3776, 3776, 2752]
    - [2, 20.797]
  - - [3904, 2752, 1, 512, 3904, 3904, 3904, 2752]
    - [2, 21.089]
  - - [4032, 2752, 1, 512, 4032, 4032, 4032, 2752]
    - [2, 21.08]
  - - [64, 2880, 1, 512, 64, 64, 64, 2880]
    - [0, 12.987]
  - - [192, 2880, 1, 512, 192, 192, 192, 2880]
    - [3, 18.154]
  - - [320, 2880, 1, 512, 320, 320, 320, 2880]
    - [0, 20.273]
  - - [448, 2880, 1, 512, 448, 448, 448, 2880]
    - [2, 19.804]
  - - [576, 2880, 1, 512, 576, 576, 576, 2880]
    - [0, 19.687]
  - - [704, 2880, 1, 512, 704, 704, 704, 2880]
    - [2, 19.916]
  - - [832, 2880, 1, 512, 832, 832, 832, 2880]
    - [2, 20.424]
  - - [960, 2880, 1, 512, 960, 960, 960, 2880]
    - [2, 20.558]
  - - [1088, 2880, 1, 512, 1088, 1088, 1088, 2880]
    - [2, 20.995]
  - - [1216, 2880, 1, 512, 1216, 1216, 1216, 2880]
    - [0, 20.942]
  - - [1344, 2880, 1, 512, 1344, 1344, 1344, 2880]
    - [2, 20.567]
  - - [1472, 2880, 1, 512, 1472, 1472, 1472, 2880]
    - [2, 20.541]
  - - [1600, 2880, 1, 512, 1600, 1600, 1600, 2880]
    - [0, 20.594]
  - - [1728, 2880, 1, 512, 1728, 1728, 1728, 2880]
    - [0, 20.59]
  - - [1856, 2880, 1, 512, 1856, 1856, 1856, 2880]
    - [0, 20.725]
  - - [1984, 2880, 1, 512, 1984, 1984, 1984, 2880]
    - [2, 20.931]
  - - [2112, 2880, 1, 512, 2112, 2112, 2112, 2880]
    - [2, 20.809]
  - - [2240, 2880, 1, 512, 2240, 2240, 2240, 2880]
    - [2, 20.778]
  - - [2368, 2880, 1, 512, 2368, 2368, 2368, 2880]
    - [2, 20.845]
  - - [2496, 2880, 1, 512, 2496, 2496, 2496, 2880]
    - [2, 20.762]
  - - [2624, 2880, 1, 512, 2624, 2624, 2624, 2880]
    - [0, 20.685]
  - - [2752, 2880, 1, 512, 2752, 2752, 2752, 2880]
    - [2, 20.715]
  - - [2880, 2880, 1, 512, 2880, 2880, 2880, 2880]
    - [2, 20.998]
  - - [3008, 2880, 1, 512, 3008, 3008, 3008, 2880]
    - [2, 21.013]
  - - [3136, 2880, 1, 512, 3136, 3136, 3136, 2880]
    - [2, 21.028]
  - - [3264, 2880, 1, 512, 3264, 3264, 3264, 2880]
    - [2, 20.908]
  - - [3392, 2880, 1, 512, 3392, 3392, 3392, 2880]
    - [2, 21.038]
  - - [3520, 2880, 1, 512, 3520, 3520, 3520, 2880]
    - [2, 20.886]
  - - [3648, 2880, 1, 512, 3648, 3648, 3648, 2880]
    - [2, 20.95]
  - - [3776, 2880, 1, 512, 3776, 3776, 3776, 2880]
    - [2, 20.952]
  - - [3904, 2880, 1, 512, 3904, 3904, 3904, 2880]
    - [2, 20.861]
  - - [4032, 2880, 1, 512, 4032, 4032, 4032, 2880]
    - [2, 20.902]
  - - [64, 3008, 1, 512, 64, 64, 64, 3008]
    - [0, 13.553]
  - - [192, 3008, 1, 512, 192, 192, 192, 3008]
    - [2, 18.729]
  - - [320, 3008, 1, 512, 320, 320, 320, 3008]
    - [2, 19.797]
  - - [448, 3008, 1, 512, 448, 448, 448, 3008]
    - [2, 20.485]
  - - [576, 3008, 1, 512, 576, 576, 576, 3008]
    - [0, 20.044]
  - - [704, 3008, 1, 512, 704, 704, 704, 3008]
    - [2, 20.308]
  - - [832, 3008, 1, 512, 832, 832, 832, 3008]
    - [2, 20.303]
  - - [960, 3008, 1, 512, 960, 960, 960, 3008]
    - [0, 20.793]
  - - [1088, 3008, 1, 512, 1088, 1088, 1088, 3008]
    - [2, 20.761]
  - - [1216, 3008, 1, 512, 1216, 1216, 1216, 3008]
    - [2, 20.96]
  - - [1344, 3008, 1, 512, 1344, 1344, 1344, 3008]
    - [2, 20.796]
  - - [1472, 3008, 1, 512, 1472, 1472, 1472, 3008]
    - [2, 20.806]
  - - [1600, 3008, 1, 512, 1600, 1600, 1600, 3008]
    - [0, 20.627]
  - - [1728, 3008, 1, 512, 1728, 1728, 1728, 3008]
    - [2, 20.601]
  - - [1856, 3008, 1, 512, 1856, 1856, 1856, 3008]
    - [2, 20.599]
  - - [1984, 3008, 1, 512, 1984, 1984, 1984, 3008]
    - [2, 20.668]
  - - [2112, 3008, 1, 512, 2112, 2112, 2112, 3008]
    - [2, 20.659]
  - - [2240, 3008, 1, 512, 2240, 2240, 2240, 3008]
    - [2, 20.771]
  - - [2368, 3008, 1, 512, 2368, 2368, 2368, 3008]
    - [2, 20.61]
  - - [2496, 3008, 1, 512, 2496, 2496, 2496, 3008]
    - [2, 20.829]
  - - [2624, 3008, 1, 512, 2624, 2624, 2624, 3008]
    - [2, 20.813]
  - - [2752, 3008, 1, 512, 2752, 2752, 2752, 3008]
    - [2, 20.776]
  - - [2880, 3008, 1, 512, 2880, 2880, 2880, 3008]
    - [2, 20.795]
  - - [3008, 3008, 1, 512, 3008, 3008, 3008, 3008]
    - [2, 20.912]
  - - [3136, 3008, 1, 512, 3136, 3136, 3136, 3008]
    - [2, 20.757]
  - - [3264, 3008, 1, 512, 3264, 3264, 3264, 3008]
    - [2, 20.833]
  - - [3392, 3008, 1, 512, 3392, 3392, 3392, 3008]
    - [2, 20.98]
  - - [3520, 3008, 1, 512, 3520, 3520, 3520, 3008]
    - [2, 21.083]
  - - [3648, 3008, 1, 512, 3648, 3648, 3648, 3008]
    - [2, 20.965]
  - - [3776, 3008, 1, 512, 3776, 3776, 3776, 3008]
    - [2, 20.797]
  - - [3904, 3008, 1, 512, 3904, 3904, 3904, 3008]
    - [2, 20.919]
  - - [4032, 3008, 1, 512, 4032, 4032, 4032, 3008]
    - [2, 20.81]
  - - [64, 3136, 1, 512, 64, 64, 64, 3136]
    - [2, 12.623]
  - - [192, 3136, 1, 512, 192, 192, 192, 3136]
    - [0, 18.643]
  - - [320, 3136, 1, 512, 320, 320, 320, 3136]
    - [0, 20.365]
  - - [448, 3136, 1, 512, 448, 448, 448, 3136]
    - [0, 19.911]
  - - [576, 3136, 1, 512, 576, 576, 576, 3136]
    - [2, 19.58]
  - - [704, 3136, 1, 512, 704, 704, 704, 3136]
    - [2, 20.451]
  - - [832, 3136, 1, 512, 832, 832, 832, 3136]
    - [2, 20.746]
  - - [960, 3136, 1, 512, 960, 960, 960, 3136]
    - [2, 20.754]
  - - [1088, 3136, 1, 512, 1088, 1088, 1088, 3136]
    - [2, 21.187]
  - - [1216, 3136, 1, 512, 1216, 1216, 1216, 3136]
    - [2, 20.937]
  - - [1344, 3136, 1, 512, 1344, 1344, 1344, 3136]
    - [0, 20.692]
  - - [1472, 3136, 1, 512, 1472, 1472, 1472, 3136]
    - [2, 20.949]
  - - [1600, 3136, 1, 512, 1600, 1600, 1600, 3136]
    - [2, 20.683]
  - - [1728, 3136, 1, 512, 1728, 1728, 1728, 3136]
    - [2, 20.749]
  - - [1856, 3136, 1, 512, 1856, 1856, 1856, 3136]
    - [0, 20.631]
  - - [1984, 3136, 1, 512, 1984, 1984, 1984, 3136]
    - [2, 20.937]
  - - [2112, 3136, 1, 512, 2112, 2112, 2112, 3136]
    - [2, 20.76]
  - - [2240, 3136, 1, 512, 2240, 2240, 2240, 3136]
    - [2, 20.754]
  - - [2368, 3136, 1, 512, 2368, 2368, 2368, 3136]
    - [2, 20.785]
  - - [2496, 3136, 1, 512, 2496, 2496, 2496, 3136]
    - [2, 20.828]
  - - [2624, 3136, 1, 512, 2624, 2624, 2624, 3136]
    - [2, 20.93]
  - - [2752, 3136, 1, 512, 2752, 2752, 2752, 3136]
    - [2, 20.799]
  - - [2880, 3136, 1, 512, 2880, 2880, 2880, 3136]
    - [2, 20.787]
  - - [3008, 3136, 1, 512, 3008, 3008, 3008, 3136]
    - [2, 20.907]
  - - [3136, 3136, 1, 512, 3136, 3136, 3136, 3136]
    - [2, 20.864]
  - - [3264, 3136, 1, 512, 3264, 3264, 3264, 3136]
    - [2, 20.847]
  - - [3392, 3136, 1, 512, 3392, 3392, 3392, 3136]
    - [2, 20.793]
  - - [3520, 3136, 1, 512, 3520, 3520, 3520, 3136]
    - [2, 20.81]
  - - [3648, 3136, 1, 512, 3648, 3648, 3648, 3136]
    - [2, 21.058]
  - - [3776, 3136, 1, 512, 3776, 3776, 3776, 3136]
    - [2, 20.844]
  - - [3904, 3136, 1, 512, 3904, 3904, 3904, 3136]
    - [2, 21.079]
  - - [4032, 3136, 1, 512, 4032, 4032, 4032, 3136]
    - [2, 20.864]
  - - [64, 3264, 1, 512, 64, 64, 64, 3264]
    - [2, 12.912]
  - - [192, 3264, 1, 512, 192, 192, 192, 3264]
    - [2, 19.036]
  - - [320, 3264, 1, 512, 320, 320, 320, 3264]
    - [2, 19.967]
  - - [448, 3264, 1, 512, 448, 448, 448, 3264]
    - [0, 19.832]
  - - [576, 3264, 1, 512, 576, 576, 576, 3264]
    - [2, 20.095]
  - - [704, 3264, 1, 512, 704, 704, 704, 3264]
    - [3, 20.278]
  - - [832, 3264, 1, 512, 832, 832, 832, 3264]
    - [3, 20.346]
  - - [960, 3264, 1, 512, 960, 960, 960, 3264]
    - [2, 20.504]
  - - [1088, 3264, 1, 512, 1088, 1088, 1088, 3264]
    - [2, 21.154]
  - - [1216, 3264, 1, 512, 1216, 1216, 1216, 3264]
    - [2, 20.718]
  - - [1344, 3264, 1, 512, 1344, 1344, 1344, 3264]
    - [2, 20.7]
  - - [1472, 3264, 1, 512, 1472, 1472, 1472, 3264]
    - [0, 20.466]
  - - [1600, 3264, 1, 512, 1600, 1600, 1600, 3264]
    - [0, 20.637]
  - - [1728, 3264, 1, 512, 1728, 1728, 1728, 3264]
    - [2, 20.936]
  - - [1856, 3264, 1, 512, 1856, 1856, 1856, 3264]
    - [2, 20.861]
  - - [1984, 3264, 1, 512, 1984, 1984, 1984, 3264]
    - [2, 20.751]
  - - [2112, 3264, 1, 512, 2112, 2112, 2112, 3264]
    - [2, 20.934]
  - - [2240, 3264, 1, 512, 2240, 2240, 2240, 3264]
    - [2, 20.846]
  - - [2368, 3264, 1, 512, 2368, 2368, 2368, 3264]
    - [0, 20.758]
  - - [2496, 3264, 1, 512, 2496, 2496, 2496, 3264]
    - [2, 20.915]
  - - [2624, 3264, 1, 512, 2624, 2624, 2624, 3264]
    - [2, 20.871]
  - - [2752, 3264, 1, 512, 2752, 2752, 2752, 3264]
    - [2, 20.904]
  - - [2880, 3264, 1, 512, 2880, 2880, 2880, 3264]
    - [2, 21.183]
  - - [3008, 3264, 1, 512, 3008, 3008, 3008, 3264]
    - [2, 20.938]
  - - [3136, 3264, 1, 512, 3136, 3136, 3136, 3264]
    - [2, 20.816]
  - - [3264, 3264, 1, 512, 3264, 3264, 3264, 3264]
    - [2, 20.958]
  - - [3392, 3264, 1, 512, 3392, 3392, 3392, 3264]
    - [2, 20.884]
  - - [3520, 3264, 1, 512, 3520, 3520, 3520, 3264]
    - [2, 20.842]
  - - [3648, 3264, 1, 512, 3648, 3648, 3648, 3264]
    - [2, 20.739]
  - - [3776, 3264, 1, 512, 3776, 3776, 3776, 3264]
    - [2, 20.982]
  - - [3904, 3264, 1, 512, 3904, 3904, 3904, 3264]
    - [2, 20.922]
  - - [4032, 3264, 1, 512, 4032, 4032, 4032, 3264]
    - [2, 20.914]
  - - [64, 3392, 1, 512, 64, 64, 64, 3392]
    - [0, 13.409]
  - - [192, 3392, 1, 512, 192, 192, 192, 3392]
    - [2, 18.768]
  - - [320, 3392, 1, 512, 320, 320, 320, 3392]
    - [2, 19.995]
  - - [448, 3392, 1, 512, 448, 448, 448, 3392]
    - [2, 20.191]
  - - [576, 3392, 1, 512, 576, 576, 576, 3392]
    - [0, 20.346]
  - - [704, 3392, 1, 512, 704, 704, 704, 3392]
    - [3, 20.283]
  - - [832, 3392, 1, 512, 832, 832, 832, 3392]
    - [2, 20.896]
  - - [960, 3392, 1, 512, 960, 960, 960, 3392]
    - [2, 20.621]
  - - [1088, 3392, 1, 512, 1088, 1088, 1088, 3392]
    - [2, 20.804]
  - - [1216, 3392, 1, 512, 1216, 1216, 1216, 3392]
    - [2, 20.432]
  - - [1344, 3392, 1, 512, 1344, 1344, 1344, 3392]
    - [2, 20.903]
  - - [1472, 3392, 1, 512, 1472, 1472, 1472, 3392]
    - [2, 20.947]
  - - [1600, 3392, 1, 512, 1600, 1600, 1600, 3392]
    - [0, 20.75]
  - - [1728, 3392, 1, 512, 1728, 1728, 1728, 3392]
    - [2, 20.699]
  - - [1856, 3392, 1, 512, 1856, 1856, 1856, 3392]
    - [2, 20.848]
  - - [1984, 3392, 1, 512, 1984, 1984, 1984, 3392]
    - [2, 20.791]
  - - [2112, 3392, 1, 512, 2112, 2112, 2112, 3392]
    - [2, 20.934]
  - - [2240, 3392, 1, 512, 2240, 2240, 2240, 3392]
    - [2, 20.806]
  - - [2368, 3392, 1, 512, 2368, 2368, 2368, 3392]
    - [2, 20.784]
  - - [2496, 3392, 1, 512, 2496, 2496, 2496, 3392]
    - [2, 20.908]
  - - [2624, 3392, 1, 512, 2624, 2624, 2624, 3392]
    - [2, 20.99]
  - - [2752, 3392, 1, 512, 2752, 2752, 2752, 3392]
    - [2, 20.889]
  - - [2880, 3392, 1, 512, 2880, 2880, 2880, 3392]
    - [2, 21.058]
  - - [3008, 3392, 1, 512, 3008, 3008, 3008, 3392]
    - [2, 20.947]
  - - [3136, 3392, 1, 512, 3136, 3136, 3136, 3392]
    - [2, 20.879]
  - - [3264, 3392, 1, 512, 3264, 3264, 3264, 3392]
    - [2, 20.875]
  - - [3392, 3392, 1, 512, 3392, 3392, 3392, 3392]
    - [2, 20.857]
  - - [3520, 3392, 1, 512, 3520, 3520, 3520, 3392]
    - [2, 20.978]
  - - [3648, 3392, 1, 512, 3648, 3648, 3648, 3392]
    - [2, 20.901]
  - - [3776, 3392, 1, 512, 3776, 3776, 3776, 3392]
    - [2, 20.923]
  - - [3904, 3392, 1, 512, 3904, 3904, 3904, 3392]
    - [2, 20.961]
  - - [4032, 3392, 1, 512, 4032, 4032, 4032, 3392]
    - [2, 21.045]
  - - [64, 3520, 1, 512, 64, 64, 64, 3520]
    - [0, 13.868]
  - - [192, 3520, 1, 512, 192, 192, 192, 3520]
    - [0, 19.164]
  - - [320, 3520, 1, 512, 320, 320, 320, 3520]
    - [0, 20.687]
  - - [448, 3520, 1, 512, 448, 448, 448, 3520]
    - [0, 19.775]
  - - [576, 3520, 1, 512, 576, 576, 576, 3520]
    - [3, 20.686]
  - - [704, 3520, 1, 512, 704, 704, 704, 3520]
    - [0, 20.226]
  - - [832, 3520, 1, 512, 832, 832, 832, 3520]
    - [2, 21.422]
  - - [960, 3520, 1, 512, 960, 960, 960, 3520]
    - [2, 21.807]
  - - [1088, 3520, 1, 512, 1088, 1088, 1088, 3520]
    - [0, 20.606]
  - - [1216, 3520, 1, 512, 1216, 1216, 1216, 3520]
    - [0, 20.515]
  - - [1344, 3520, 1, 512, 1344, 1344, 1344, 3520]
    - [0, 20.733]
  - - [1472, 3520, 1, 512, 1472, 1472, 1472, 3520]
    - [0, 20.666]
  - - [1600, 3520, 1, 512, 1600, 1600, 1600, 3520]
    - [2, 20.797]
  - - [1728, 3520, 1, 512, 1728, 1728, 1728, 3520]
    - [2, 20.607]
  - - [1856, 3520, 1, 512, 1856, 1856, 1856, 3520]
    - [2, 20.774]
  - - [1984, 3520, 1, 512, 1984, 1984, 1984, 3520]
    - [2, 20.824]
  - - [2112, 3520, 1, 512, 2112, 2112, 2112, 3520]
    - [0, 20.809]
  - - [2240, 3520, 1, 512, 2240, 2240, 2240, 3520]
    - [2, 20.797]
  - - [2368, 3520, 1, 512, 2368, 2368, 2368, 3520]
    - [2, 20.935]
  - - [2496, 3520, 1, 512, 2496, 2496, 2496, 3520]
    - [2, 20.852]
  - - [2624, 3520, 1, 512, 2624, 2624, 2624, 3520]
    - [2, 20.988]
  - - [2752, 3520, 1, 512, 2752, 2752, 2752, 3520]
    - [2, 21.012]
  - - [2880, 3520, 1, 512, 2880, 2880, 2880, 3520]
    - [2, 20.913]
  - - [3008, 3520, 1, 512, 3008, 3008, 3008, 3520]
    - [2, 20.957]
  - - [3136, 3520, 1, 512, 3136, 3136, 3136, 3520]
    - [2, 20.998]
  - - [3264, 3520, 1, 512, 3264, 3264, 3264, 3520]
    - [2, 21.029]
  - - [3392, 3520, 1, 512, 3392, 3392, 3392, 3520]
    - [2, 20.809]
  - - [3520, 3520, 1, 512, 3520, 3520, 3520, 3520]
    - [2, 21.145]
  - - [3648, 3520, 1, 512, 3648, 3648, 3648, 3520]
    - [2, 20.971]
  - - [3776, 3520, 1, 512, 3776, 3776, 3776, 3520]
    - [2, 20.833]
  - - [3904, 3520, 1, 512, 3904, 3904, 3904, 3520]
    - [2, 21.129]
  - - [4032, 3520, 1, 512, 4032, 4032, 4032, 3520]
    - [2, 20.938]
  - - [64, 3648, 1, 512, 64, 64, 64, 3648]
    - [0, 14.384]
  - - [192, 3648, 1, 512, 192, 192, 192, 3648]
    - [2, 19.501]
  - - [320, 3648, 1, 512, 320, 320, 320, 3648]
    - [0, 20.245]
  - - [448, 3648, 1, 512, 448, 448, 448, 3648]
    - [0, 20.39]
  - - [576, 3648, 1, 512, 576, 576, 576, 3648]
    - [2, 20.506]
  - - [704, 3648, 1, 512, 704, 704, 704, 3648]
    - [2, 20.412]
  - - [832, 3648, 1, 512, 832, 832, 832, 3648]
    - [2, 20.896]
  - - [960, 3648, 1, 512, 960, 960, 960, 3648]
    - [2, 20.704]
  - - [1088, 3648, 1, 512, 1088, 1088, 1088, 3648]
    - [2, 21.092]
  - - [1216, 3648, 1, 512, 1216, 1216, 1216, 3648]
    - [2, 20.764]
  - - [1344, 3648, 1, 512, 1344, 1344, 1344, 3648]
    - [2, 20.525]
  - - [1472, 3648, 1, 512, 1472, 1472, 1472, 3648]
    - [2, 20.61]
  - - [1600, 3648, 1, 512, 1600, 1600, 1600, 3648]
    - [2, 20.616]
  - - [1728, 3648, 1, 512, 1728, 1728, 1728, 3648]
    - [2, 20.867]
  - - [1856, 3648, 1, 512, 1856, 1856, 1856, 3648]
    - [2, 20.896]
  - - [1984, 3648, 1, 512, 1984, 1984, 1984, 3648]
    - [2, 20.915]
  - - [2112, 3648, 1, 512, 2112, 2112, 2112, 3648]
    - [2, 20.863]
  - - [2240, 3648, 1, 512, 2240, 2240, 2240, 3648]
    - [2, 20.833]
  - - [2368, 3648, 1, 512, 2368, 2368, 2368, 3648]
    - [2, 20.829]
  - - [2496, 3648, 1, 512, 2496, 2496, 2496, 3648]
    - [2, 20.872]
  - - [2624, 3648, 1, 512, 2624, 2624, 2624, 3648]
    - [2, 20.919]
  - - [2752, 3648, 1, 512, 2752, 2752, 2752, 3648]
    - [2, 20.924]
  - - [2880, 3648, 1, 512, 2880, 2880, 2880, 3648]
    - [0, 20.856]
  - - [3008, 3648, 1, 512, 3008, 3008, 3008, 3648]
    - [2, 20.949]
  - - [3136, 3648, 1, 512, 3136, 3136, 3136, 3648]
    - [2, 20.894]
  - - [3264, 3648, 1, 512, 3264, 3264, 3264, 3648]
    - [2, 20.934]
  - - [3392, 3648, 1, 512, 3392, 3392, 3392, 3648]
    - [2, 20.845]
  - - [3520, 3648, 1, 512, 3520, 3520, 3520, 3648]
    - [2, 20.867]
  - - [3648, 3648, 1, 512, 3648, 3648, 3648, 3648]
    - [2, 20.827]
  - - [3776, 3648, 1, 512, 3776, 3776, 3776, 3648]
    - [2, 20.966]
  - - [3904, 3648, 1, 512, 3904, 3904, 3904, 3648]
    - [2, 20.933]
  - - [4032, 3648, 1, 512, 4032, 4032, 4032, 3648]
    - [2, 20.969]
  - - [64, 3776, 1, 512, 64, 64, 64, 3776]
    - [0, 14.712]
  - - [192, 3776, 1, 512, 192, 192, 192, 3776]
    - [0, 19.421]
  - - [320, 3776, 1, 512, 320, 320, 320, 3776]
    - [0, 20.195]
  - - [448, 3776, 1, 512, 448, 448, 448, 3776]
    - [0, 19.904]
  - - [576, 3776, 1, 512, 576, 576, 576, 3776]
    - [0, 20.436]
  - - [704, 3776, 1, 512, 704, 704, 704, 3776]
    - [2, 20.951]
  - - [832, 3776, 1, 512, 832, 832, 832, 3776]
    - [0, 20.797]
  - - [960, 3776, 1, 512, 960, 960, 960, 3776]
    - [2, 21.042]
  - - [1088, 3776, 1, 512, 1088, 1088, 1088, 3776]
    - [2, 20.869]
  - - [1216, 3776, 1, 512, 1216, 1216, 1216, 3776]
    - [2, 20.863]
  - - [1344, 3776, 1, 512, 1344, 1344, 1344, 3776]
    - [2, 20.626]
  - - [1472, 3776, 1, 512, 1472, 1472, 1472, 3776]
    - [2, 20.82]
  - - [1600, 3776, 1, 512, 1600, 1600, 1600, 3776]
    - [2, 20.757]
  - - [1728, 3776, 1, 512, 1728, 1728, 1728, 3776]
    - [2, 20.726]
  - - [1856, 3776, 1, 512, 1856, 1856, 1856, 3776]
    - [2, 20.92]
  - - [1984, 3776, 1, 512, 1984, 1984, 1984, 3776]
    - [2, 20.905]
  - - [2112, 3776, 1, 512, 2112, 2112, 2112, 3776]
    - [2, 20.781]
  - - [2240, 3776, 1, 512, 2240, 2240, 2240, 3776]
    - [2, 20.944]
  - - [2368, 3776, 1, 512, 2368, 2368, 2368, 3776]
    - [2, 20.907]
  - - [2496, 3776, 1, 512, 2496, 2496, 2496, 3776]
    - [2, 20.761]
  - - [2624, 3776, 1, 512, 2624, 2624, 2624, 3776]
    - [2, 20.871]
  - - [2752, 3776, 1, 512, 2752, 2752, 2752, 3776]
    - [2, 20.882]
  - - [2880, 3776, 1, 512, 2880, 2880, 2880, 3776]
    - [2, 21.028]
  - - [3008, 3776, 1, 512, 3008, 3008, 3008, 3776]
    - [2, 20.991]
  - - [3136, 3776, 1, 512, 3136, 3136, 3136, 3776]
    - [2, 20.925]
  - - [3264, 3776, 1, 512, 3264, 3264, 3264, 3776]
    - [2, 20.917]
  - - [3392, 3776, 1, 512, 3392, 3392, 3392, 3776]
    - [2, 20.941]
  - - [3520, 3776, 1, 512, 3520, 3520, 3520, 3776]
    - [2, 20.992]
  - - [3648, 3776, 1, 512, 3648, 3648, 3648, 3776]
    - [2, 21.025]
  - - [3776, 3776, 1, 512, 3776, 3776, 3776, 3776]
    - [2, 20.894]
  - - [3904, 3776, 1, 512, 3904, 3904, 3904, 3776]
    - [2, 21.064]
  - - [4032, 3776, 1, 512, 4032, 4032, 4032, 3776]
    - [2, 20.929]
  - - [64, 3904, 1, 512, 64, 64, 64, 3904]
    - [2, 14.076]
  - - [192, 3904, 1, 512, 192, 192, 192, 3904]
    - [2, 19.732]
  - - [320, 3904, 1, 512, 320, 320, 320, 3904]
    - [0, 19.589]
  - - [448, 3904, 1, 512, 448, 448, 448, 3904]
    - [2, 20.037]
  - - [576, 3904, 1, 512, 576, 576, 576, 3904]
    - [0, 20.385]
  - - [704, 3904, 1, 512, 704, 704, 704, 3904]
    - [2, 21.053]
  - - [832, 3904, 1, 512, 832, 832, 832, 3904]
    - [2, 21.029]
  - - [960, 3904, 1, 512, 960, 960, 960, 3904]
    - [2, 20.807]
  - - [1088, 3904, 1, 512, 1088, 1088, 1088, 3904]
    - [2, 20.955]
  - - [1216, 3904, 1, 512, 1216, 1216, 1216, 3904]
    - [2, 20.842]
  - - [1344, 3904, 1, 512, 1344, 1344, 1344, 3904]
    - [2, 20.823]
  - - [1472, 3904, 1, 512, 1472, 1472, 1472, 3904]
    - [2, 20.976]
  - - [1600, 3904, 1, 512, 1600, 1600, 1600, 3904]
    - [2, 21.094]
  - - [1728, 3904, 1, 512, 1728, 1728, 1728, 3904]
    - [2, 21.043]
  - - [1856, 3904, 1, 512, 1856, 1856, 1856, 3904]
    - [2, 20.77]
  - - [1984, 3904, 1, 512, 1984, 1984, 1984, 3904]
    - [2, 21.096]
  - - [2112, 3904, 1, 512, 2112, 2112, 2112, 3904]
    - [2, 20.921]
  - - [2240, 3904, 1, 512, 2240, 2240, 2240, 3904]
    - [2, 20.967]
  - - [2368, 3904, 1, 512, 2368, 2368, 2368, 3904]
    - [2, 20.879]
  - - [2496, 3904, 1, 512, 2496, 2496, 2496, 3904]
    - [2, 20.786]
  - - [2624, 3904, 1, 512, 2624, 2624, 2624, 3904]
    - [2, 20.868]
  - - [2752, 3904, 1, 512, 2752, 2752, 2752, 3904]
    - [2, 21.1]
  - - [2880, 3904, 1, 512, 2880, 2880, 2880, 3904]
    - [2, 21.018]
  - - [3008, 3904, 1, 512, 3008, 3008, 3008, 3904]
    - [2, 20.986]
  - - [3136, 3904, 1, 512, 3136, 3136, 3136, 3904]
    - [2, 20.981]
  - - [3264, 3904, 1, 512, 3264, 3264, 3264, 3904]
    - [2, 21.029]
  - - [3392, 3904, 1, 512, 3392, 3392, 3392, 3904]
    - [2, 20.932]
  - - [3520, 3904, 1, 512, 3520, 3520, 3520, 3904]
    - [2, 21.075]
  - - [3648, 3904, 1, 512, 3648, 3648, 3648, 3904]
    - [2, 20.962]
  - - [3776, 3904, 1, 512, 3776, 3776, 3776, 3904]
    - [2, 20.945]
  - - [3904, 3904, 1, 512, 3904, 3904, 3904, 3904]
    - [2, 21.077]
  - - [4032, 3904, 1, 512, 4032, 4032, 4032, 3904]
    - [2, 21.003]
  - - [64, 4032, 1, 512, 64, 64, 64, 4032]
    - [2, 14.238]
  - - [192, 4032, 1, 512, 192, 192, 192, 4032]
    - [0, 19.739]
  - - [320, 4032, 1, 512, 320, 320, 320, 4032]
    - [0, 20.308]
  - - [448, 4032, 1, 512, 448, 448, 448, 4032]
    - [2, 20.118]
  - - [576, 4032, 1, 512, 576, 576, 576, 4032]
    - [2, 20.714]
  - - [704, 4032, 1, 512, 704, 704, 704, 4032]
    - [2, 20.887]
  - - [832, 4032, 1, 512, 832, 832, 832, 4032]
    - [2, 20.839]
  - - [960, 4032, 1, 512, 960, 960, 960, 4032]
    - [2, 20.981]
  - - [1088, 4032, 1, 512, 1088, 1088, 1088, 4032]
    - [2, 20.863]
  - - [1216, 4032, 1, 512, 1216, 1216, 1216, 4032]
    - [2, 20.962]
  - - [1344, 4032, 1, 512, 1344, 1344, 1344, 4032]
    - [2, 21.058]
  - - [1472, 4032, 1, 512, 1472, 1472, 1472, 4032]
    - [2, 20.826]
  - - [1600, 4032, 1, 512, 1600, 1600, 1600, 4032]
    - [2, 20.841]
  - - [1728, 4032, 1, 512, 1728, 1728, 1728, 4032]
    - [2, 20.862]
  - - [1856, 4032, 1, 512, 1856, 1856, 1856, 4032]
    - [2, 20.904]
  - - [1984, 4032, 1, 512, 1984, 1984, 1984, 4032]
    - [2, 20.971]
  - - [2112, 4032, 1, 512, 2112, 2112, 2112, 4032]
    - [2, 20.862]
  - - [2240, 4032, 1, 512, 2240, 2240, 2240, 4032]
    - [2, 20.872]
  - - [2368, 4032, 1, 512, 2368, 2368, 2368, 4032]
    - [2, 20.981]
  - - [2496, 4032, 1, 512, 2496, 2496, 2496, 4032]
    - [2, 20.986]
  - - [2624, 4032, 1, 512, 2624, 2624, 2624, 4032]
    - [2, 20.92]
  - - [2752, 4032, 1, 512, 2752, 2752, 2752, 4032]
    - [2, 20.847]
  - - [2880, 4032, 1, 512, 2880, 2880, 2880, 4032]
    - [2, 21.141]
  - - [3008, 4032, 1, 512, 3008, 3008, 3008, 4032]
    - [2, 20.905]
  - - [3136, 4032, 1, 512, 3136, 3136, 3136, 4032]
    - [2, 21.046]
  - - [3264, 4032, 1, 512, 3264, 3264, 3264, 4032]
    - [2, 20.792]
  - - [3392, 4032, 1, 512, 3392, 3392, 3392, 4032]
    - [2, 20.985]
  - - [3520, 4032, 1, 512, 3520, 3520, 3520, 4032]
    - [2, 20.907]
  - - [3648, 4032, 1, 512, 3648, 3648, 3648, 4032]
    - [2, 20.851]
  - - [3776, 4032, 1, 512, 3776, 3776, 3776, 4032]
    - [2, 20.894]
  - - [3904, 4032, 1, 512, 3904, 3904, 3904, 4032]
    - [2, 21.005]
  - - [4032, 4032, 1, 512, 4032, 4032, 4032, 4032]
    - [2, 20.957]
  - - [64, 64, 1, 1024, 64, 64, 64, 64]
    - [2, 0.842]
  - - [192, 64, 1, 1024, 192, 192, 192, 64]
    - [0, 2.36]
  - - [320, 64, 1, 1024, 320, 320, 320, 64]
    - [2, 2.649]
  - - [448, 64, 1, 1024, 448, 448, 448, 64]
    - [0, 3.714]
  - - [576, 64, 1, 1024, 576, 576, 576, 64]
    - [1, 4.731]
  - - [704, 64, 1, 1024, 704, 704, 704, 64]
    - [1, 5.794]
  - - [832, 64, 1, 1024, 832, 832, 832, 64]
    - [0, 6.856]
  - - [960, 64, 1, 1024, 960, 960, 960, 64]
    - [0, 7.943]
  - - [1088, 64, 1, 1024, 1088, 1088, 1088, 64]
    - [0, 8.977]
  - - [1216, 64, 1, 1024, 1216, 1216, 1216, 64]
    - [0, 10.026]
  - - [1344, 64, 1, 1024, 1344, 1344, 1344, 64]
    - [0, 11.07]
  - - [1472, 64, 1, 1024, 1472, 1472, 1472, 64]
    - [0, 12.12]
  - - [1600, 64, 1, 1024, 1600, 1600, 1600, 64]
    - [2, 11.417]
  - - [1728, 64, 1, 1024, 1728, 1728, 1728, 64]
    - [2, 12.257]
  - - [1856, 64, 1, 1024, 1856, 1856, 1856, 64]
    - [2, 13.11]
  - - [1984, 64, 1, 1024, 1984, 1984, 1984, 64]
    - [0, 13.478]
  - - [2112, 64, 1, 1024, 2112, 2112, 2112, 64]
    - [0, 14.334]
  - - [2240, 64, 1, 1024, 2240, 2240, 2240, 64]
    - [0, 15.09]
  - - [2368, 64, 1, 1024, 2368, 2368, 2368, 64]
    - [2, 13.703]
  - - [2496, 64, 1, 1024, 2496, 2496, 2496, 64]
    - [2, 14.183]
  - - [2624, 64, 1, 1024, 2624, 2624, 2624, 64]
    - [2, 14.739]
  - - [2752, 64, 1, 1024, 2752, 2752, 2752, 64]
    - [0, 14.896]
  - - [2880, 64, 1, 1024, 2880, 2880, 2880, 64]
    - [0, 15.624]
  - - [3008, 64, 1, 1024, 3008, 3008, 3008, 64]
    - [0, 16.282]
  - - [3136, 64, 1, 1024, 3136, 3136, 3136, 64]
    - [2, 14.954]
  - - [3264, 64, 1, 1024, 3264, 3264, 3264, 64]
    - [0, 15.268]
  - - [3392, 64, 1, 1024, 3392, 3392, 3392, 64]
    - [0, 15.862]
  - - [3520, 64, 1, 1024, 3520, 3520, 3520, 64]
    - [0, 16.413]
  - - [3648, 64, 1, 1024, 3648, 3648, 3648, 64]
    - [0, 17.035]
  - - [3776, 64, 1, 1024, 3776, 3776, 3776, 64]
    - [0, 17.559]
  - - [3904, 64, 1, 1024, 3904, 3904, 3904, 64]
    - [2, 16.408]
  - - [4032, 64, 1, 1024, 4032, 4032, 4032, 64]
    - [2, 16.928]
  - - [64, 192, 1, 1024, 64, 64, 64, 192]
    - [2, 2.465]
  - - [192, 192, 1, 1024, 192, 192, 192, 192]
    - [0, 6.855]
  - - [320, 192, 1, 1024, 320, 320, 320, 192]
    - [1, 8.836]
  - - [448, 192, 1, 1024, 448, 448, 448, 192]
    - [0, 11.526]
  - - [576, 192, 1, 1024, 576, 576, 576, 192]
    - [2, 12.105]
  - - [704, 192, 1, 1024, 704, 704, 704, 192]
    - [0, 14.211]
  - - [832, 192, 1, 1024, 832, 832, 832, 192]
    - [2, 14.129]
  - - [960, 192, 1, 1024, 960, 960, 960, 192]
    - [0, 15.902]
  - - [1088, 192, 1, 1024, 1088, 1088, 1088, 192]
    - [0, 15.482]
  - - [1216, 192, 1, 1024, 1216, 1216, 1216, 192]
    - [0, 17.289]
  - - [1344, 192, 1, 1024, 1344, 1344, 1344, 192]
    - [2, 17.063]
  - - [1472, 192, 1, 1024, 1472, 1472, 1472, 192]
    - [0, 17.936]
  - - [1600, 192, 1, 1024, 1600, 1600, 1600, 192]
    - [2, 18.006]
  - - [1728, 192, 1, 1024, 1728, 1728, 1728, 192]
    - [0, 18.66]
  - - [1856, 192, 1, 1024, 1856, 1856, 1856, 192]
    - [2, 18.473]
  - - [1984, 192, 1, 1024, 1984, 1984, 1984, 192]
    - [0, 19.298]
  - - [2112, 192, 1, 1024, 2112, 2112, 2112, 192]
    - [2, 18.74]
  - - [2240, 192, 1, 1024, 2240, 2240, 2240, 192]
    - [0, 19.564]
  - - [2368, 192, 1, 1024, 2368, 2368, 2368, 192]
    - [2, 19.513]
  - - [2496, 192, 1, 1024, 2496, 2496, 2496, 192]
    - [0, 20.517]
  - - [2624, 192, 1, 1024, 2624, 2624, 2624, 192]
    - [0, 19.454]
  - - [2752, 192, 1, 1024, 2752, 2752, 2752, 192]
    - [0, 20.477]
  - - [2880, 192, 1, 1024, 2880, 2880, 2880, 192]
    - [0, 19.793]
  - - [3008, 192, 1, 1024, 3008, 3008, 3008, 192]
    - [0, 20.202]
  - - [3136, 192, 1, 1024, 3136, 3136, 3136, 192]
    - [0, 20.181]
  - - [3264, 192, 1, 1024, 3264, 3264, 3264, 192]
    - [0, 20.155]
  - - [3392, 192, 1, 1024, 3392, 3392, 3392, 192]
    - [0, 19.928]
  - - [3520, 192, 1, 1024, 3520, 3520, 3520, 192]
    - [0, 20.22]
  - - [3648, 192, 1, 1024, 3648, 3648, 3648, 192]
    - [0, 19.872]
  - - [3776, 192, 1, 1024, 3776, 3776, 3776, 192]
    - [0, 20.489]
  - - [3904, 192, 1, 1024, 3904, 3904, 3904, 192]
    - [0, 20.266]
  - - [4032, 192, 1, 1024, 4032, 4032, 4032, 192]
    - [0, 20.548]
  - - [64, 320, 1, 1024, 64, 64, 64, 320]
    - [3, 2.648]
  - - [192, 320, 1, 1024, 192, 192, 192, 320]
    - [0, 7.93]
  - - [320, 320, 1, 1024, 320, 320, 320, 320]
    - [2, 11.283]
  - - [448, 320, 1, 1024, 448, 448, 448, 320]
    - [0, 15.032]
  - - [576, 320, 1, 1024, 576, 576, 576, 320]
    - [0, 15.86]
  - - [704, 320, 1, 1024, 704, 704, 704, 320]
    - [0, 16.655]
  - - [832, 320, 1, 1024, 832, 832, 832, 320]
    - [2, 17.114]
  - - [960, 320, 1, 1024, 960, 960, 960, 320]
    - [2, 17.812]
  - - [1088, 320, 1, 1024, 1088, 1088, 1088, 320]
    - [2, 18.171]
  - - [1216, 320, 1, 1024, 1216, 1216, 1216, 320]
    - [0, 19.664]
  - - [1344, 320, 1, 1024, 1344, 1344, 1344, 320]
    - [0, 19.603]
  - - [1472, 320, 1, 1024, 1472, 1472, 1472, 320]
    - [0, 19.663]
  - - [1600, 320, 1, 1024, 1600, 1600, 1600, 320]
    - [2, 19.466]
  - - [1728, 320, 1, 1024, 1728, 1728, 1728, 320]
    - [2, 19.851]
  - - [1856, 320, 1, 1024, 1856, 1856, 1856, 320]
    - [2, 19.945]
  - - [1984, 320, 1, 1024, 1984, 1984, 1984, 320]
    - [0, 20.47]
  - - [2112, 320, 1, 1024, 2112, 2112, 2112, 320]
    - [0, 20.296]
  - - [2240, 320, 1, 1024, 2240, 2240, 2240, 320]
    - [2, 20.156]
  - - [2368, 320, 1, 1024, 2368, 2368, 2368, 320]
    - [0, 19.843]
  - - [2496, 320, 1, 1024, 2496, 2496, 2496, 320]
    - [2, 20.002]
  - - [2624, 320, 1, 1024, 2624, 2624, 2624, 320]
    - [2, 20.027]
  - - [2752, 320, 1, 1024, 2752, 2752, 2752, 320]
    - [0, 20.23]
  - - [2880, 320, 1, 1024, 2880, 2880, 2880, 320]
    - [2, 20.214]
  - - [3008, 320, 1, 1024, 3008, 3008, 3008, 320]
    - [0, 20.152]
  - - [3136, 320, 1, 1024, 3136, 3136, 3136, 320]
    - [0, 20.143]
  - - [3264, 320, 1, 1024, 3264, 3264, 3264, 320]
    - [2, 20.096]
  - - [3392, 320, 1, 1024, 3392, 3392, 3392, 320]
    - [2, 20.502]
  - - [3520, 320, 1, 1024, 3520, 3520, 3520, 320]
    - [2, 20.628]
  - - [3648, 320, 1, 1024, 3648, 3648, 3648, 320]
    - [2, 20.714]
  - - [3776, 320, 1, 1024, 3776, 3776, 3776, 320]
    - [2, 20.459]
  - - [3904, 320, 1, 1024, 3904, 3904, 3904, 320]
    - [2, 20.679]
  - - [4032, 320, 1, 1024, 4032, 4032, 4032, 320]
    - [2, 21.145]
  - - [64, 448, 1, 1024, 64, 64, 64, 448]
    - [0, 5.381]
  - - [192, 448, 1, 1024, 192, 192, 192, 448]
    - [0, 11.552]
  - - [320, 448, 1, 1024, 320, 320, 320, 448]
    - [0, 15.076]
  - - [448, 448, 1, 1024, 448, 448, 448, 448]
    - [2, 15.314]
  - - [576, 448, 1, 1024, 576, 576, 576, 448]
    - [2, 17.434]
  - - [704, 448, 1, 1024, 704, 704, 704, 448]
    - [0, 17.943]
  - - [832, 448, 1, 1024, 832, 832, 832, 448]
    - [0, 19.008]
  - - [960, 448, 1, 1024, 960, 960, 960, 448]
    - [0, 19.886]
  - - [1088, 448, 1, 1024, 1088, 1088, 1088, 448]
    - [0, 20.593]
  - - [1216, 448, 1, 1024, 1216, 1216, 1216, 448]
    - [3, 19.912]
  - - [1344, 448, 1, 1024, 1344, 1344, 1344, 448]
    - [0, 19.796]
  - - [1472, 448, 1, 1024, 1472, 1472, 1472, 448]
    - [0, 19.927]
  - - [1600, 448, 1, 1024, 1600, 1600, 1600, 448]
    - [0, 19.964]
  - - [1728, 448, 1, 1024, 1728, 1728, 1728, 448]
    - [0, 19.781]
  - - [1856, 448, 1, 1024, 1856, 1856, 1856, 448]
    - [0, 20.351]
  - - [1984, 448, 1, 1024, 1984, 1984, 1984, 448]
    - [2, 20.026]
  - - [2112, 448, 1, 1024, 2112, 2112, 2112, 448]
    - [2, 20.222]
  - - [2240, 448, 1, 1024, 2240, 2240, 2240, 448]
    - [2, 20.01]
  - - [2368, 448, 1, 1024, 2368, 2368, 2368, 448]
    - [2, 20.235]
  - - [2496, 448, 1, 1024, 2496, 2496, 2496, 448]
    - [2, 20.514]
  - - [2624, 448, 1, 1024, 2624, 2624, 2624, 448]
    - [2, 20.826]
  - - [2752, 448, 1, 1024, 2752, 2752, 2752, 448]
    - [2, 20.762]
  - - [2880, 448, 1, 1024, 2880, 2880, 2880, 448]
    - [3, 20.526]
  - - [3008, 448, 1, 1024, 3008, 3008, 3008, 448]
    - [2, 20.7]
  - - [3136, 448, 1, 1024, 3136, 3136, 3136, 448]
    - [2, 20.928]
  - - [3264, 448, 1, 1024, 3264, 3264, 3264, 448]
    - [2, 20.448]
  - - [3392, 448, 1, 1024, 3392, 3392, 3392, 448]
    - [2, 21.271]
  - - [3520, 448, 1, 1024, 3520, 3520, 3520, 448]
    - [2, 21.262]
  - - [3648, 448, 1, 1024, 3648, 3648, 3648, 448]
    - [2, 20.697]
  - - [3776, 448, 1, 1024, 3776, 3776, 3776, 448]
    - [2, 21.047]
  - - [3904, 448, 1, 1024, 3904, 3904, 3904, 448]
    - [2, 20.663]
  - - [4032, 448, 1, 1024, 4032, 4032, 4032, 448]
    - [0, 20.926]
  - - [64, 576, 1, 1024, 64, 64, 64, 576]
    - [0, 6.9]
  - - [192, 576, 1, 1024, 192, 192, 192, 576]
    - [2, 12.17]
  - - [320, 576, 1, 1024, 320, 320, 320, 576]
    - [0, 15.85]
  - - [448, 576, 1, 1024, 448, 448, 448, 576]
    - [2, 17.131]
  - - [576, 576, 1, 1024, 576, 576, 576, 576]
    - [0, 18.782]
  - - [704, 576, 1, 1024, 704, 704, 704, 576]
    - [2, 19.237]
  - - [832, 576, 1, 1024, 832, 832, 832, 576]
    - [0, 20.337]
  - - [960, 576, 1, 1024, 960, 960, 960, 576]
    - [0, 19.593]
  - - [1088, 576, 1, 1024, 1088, 1088, 1088, 576]
    - [0, 20.248]
  - - [1216, 576, 1, 1024, 1216, 1216, 1216, 576]
    - [0, 19.708]
  - - [1344, 576, 1, 1024, 1344, 1344, 1344, 576]
    - [0, 20.204]
  - - [1472, 576, 1, 1024, 1472, 1472, 1472, 576]
    - [0, 20.155]
  - - [1600, 576, 1, 1024, 1600, 1600, 1600, 576]
    - [0, 19.901]
  - - [1728, 576, 1, 1024, 1728, 1728, 1728, 576]
    - [2, 20.105]
  - - [1856, 576, 1, 1024, 1856, 1856, 1856, 576]
    - [2, 19.84]
  - - [1984, 576, 1, 1024, 1984, 1984, 1984, 576]
    - [2, 20.338]
  - - [2112, 576, 1, 1024, 2112, 2112, 2112, 576]
    - [0, 20.123]
  - - [2240, 576, 1, 1024, 2240, 2240, 2240, 576]
    - [2, 21.093]
  - - [2368, 576, 1, 1024, 2368, 2368, 2368, 576]
    - [2, 20.697]
  - - [2496, 576, 1, 1024, 2496, 2496, 2496, 576]
    - [2, 20.625]
  - - [2624, 576, 1, 1024, 2624, 2624, 2624, 576]
    - [0, 20.702]
  - - [2752, 576, 1, 1024, 2752, 2752, 2752, 576]
    - [3, 20.726]
  - - [2880, 576, 1, 1024, 2880, 2880, 2880, 576]
    - [0, 20.751]
  - - [3008, 576, 1, 1024, 3008, 3008, 3008, 576]
    - [2, 20.797]
  - - [3136, 576, 1, 1024, 3136, 3136, 3136, 576]
    - [2, 21.015]
  - - [3264, 576, 1, 1024, 3264, 3264, 3264, 576]
    - [2, 20.72]
  - - [3392, 576, 1, 1024, 3392, 3392, 3392, 576]
    - [2, 20.854]
  - - [3520, 576, 1, 1024, 3520, 3520, 3520, 576]
    - [2, 21.184]
  - - [3648, 576, 1, 1024, 3648, 3648, 3648, 576]
    - [2, 21.061]
  - - [3776, 576, 1, 1024, 3776, 3776, 3776, 576]
    - [2, 20.857]
  - - [3904, 576, 1, 1024, 3904, 3904, 3904, 576]
    - [2, 21.064]
  - - [4032, 576, 1, 1024, 4032, 4032, 4032, 576]
    - [2, 21.083]
  - - [64, 704, 1, 1024, 64, 64, 64, 704]
    - [3, 5.815]
  - - [192, 704, 1, 1024, 192, 192, 192, 704]
    - [0, 14.405]
  - - [320, 704, 1, 1024, 320, 320, 320, 704]
    - [0, 16.771]
  - - [448, 704, 1, 1024, 448, 448, 448, 704]
    - [2, 18.285]
  - - [576, 704, 1, 1024, 576, 576, 576, 704]
    - [2, 19.207]
  - - [704, 704, 1, 1024, 704, 704, 704, 704]
    - [2, 19.567]
  - - [832, 704, 1, 1024, 832, 832, 832, 704]
    - [0, 20.485]
  - - [960, 704, 1, 1024, 960, 960, 960, 704]
    - [0, 19.949]
  - - [1088, 704, 1, 1024, 1088, 1088, 1088, 704]
    - [0, 20.052]
  - - [1216, 704, 1, 1024, 1216, 1216, 1216, 704]
    - [2, 20.0]
  - - [1344, 704, 1, 1024, 1344, 1344, 1344, 704]
    - [3, 20.275]
  - - [1472, 704, 1, 1024, 1472, 1472, 1472, 704]
    - [2, 20.209]
  - - [1600, 704, 1, 1024, 1600, 1600, 1600, 704]
    - [0, 20.51]
  - - [1728, 704, 1, 1024, 1728, 1728, 1728, 704]
    - [0, 20.773]
  - - [1856, 704, 1, 1024, 1856, 1856, 1856, 704]
    - [2, 20.231]
  - - [1984, 704, 1, 1024, 1984, 1984, 1984, 704]
    - [2, 20.812]
  - - [2112, 704, 1, 1024, 2112, 2112, 2112, 704]
    - [2, 20.52]
  - - [2240, 704, 1, 1024, 2240, 2240, 2240, 704]
    - [0, 20.795]
  - - [2368, 704, 1, 1024, 2368, 2368, 2368, 704]
    - [2, 20.992]
  - - [2496, 704, 1, 1024, 2496, 2496, 2496, 704]
    - [2, 20.792]
  - - [2624, 704, 1, 1024, 2624, 2624, 2624, 704]
    - [2, 21.207]
  - - [2752, 704, 1, 1024, 2752, 2752, 2752, 704]
    - [2, 20.929]
  - - [2880, 704, 1, 1024, 2880, 2880, 2880, 704]
    - [2, 20.925]
  - - [3008, 704, 1, 1024, 3008, 3008, 3008, 704]
    - [0, 21.123]
  - - [3136, 704, 1, 1024, 3136, 3136, 3136, 704]
    - [2, 21.094]
  - - [3264, 704, 1, 1024, 3264, 3264, 3264, 704]
    - [2, 21.034]
  - - [3392, 704, 1, 1024, 3392, 3392, 3392, 704]
    - [2, 21.132]
  - - [3520, 704, 1, 1024, 3520, 3520, 3520, 704]
    - [2, 20.847]
  - - [3648, 704, 1, 1024, 3648, 3648, 3648, 704]
    - [2, 21.081]
  - - [3776, 704, 1, 1024, 3776, 3776, 3776, 704]
    - [2, 21.038]
  - - [3904, 704, 1, 1024, 3904, 3904, 3904, 704]
    - [2, 21.214]
  - - [4032, 704, 1, 1024, 4032, 4032, 4032, 704]
    - [2, 21.438]
  - - [64, 832, 1, 1024, 64, 64, 64, 832]
    - [1, 7.864]
  - - [192, 832, 1, 1024, 192, 192, 192, 832]
    - [2, 14.121]
  - - [320, 832, 1, 1024, 320, 320, 320, 832]
    - [2, 17.208]
  - - [448, 832, 1, 1024, 448, 448, 448, 832]
    - [0, 18.805]
  - - [576, 832, 1, 1024, 576, 576, 576, 832]
    - [0, 19.881]
  - - [704, 832, 1, 1024, 704, 704, 704, 832]
    - [0, 20.402]
  - - [832, 832, 1, 1024, 832, 832, 832, 832]
    - [0, 19.761]
  - - [960, 832, 1, 1024, 960, 960, 960, 832]
    - [2, 19.595]
  - - [1088, 832, 1, 1024, 1088, 1088, 1088, 832]
    - [2, 20.092]
  - - [1216, 832, 1, 1024, 1216, 1216, 1216, 832]
    - [0, 19.981]
  - - [1344, 832, 1, 1024, 1344, 1344, 1344, 832]
    - [0, 20.239]
  - - [1472, 832, 1, 1024, 1472, 1472, 1472, 832]
    - [2, 20.419]
  - - [1600, 832, 1, 1024, 1600, 1600, 1600, 832]
    - [2, 20.56]
  - - [1728, 832, 1, 1024, 1728, 1728, 1728, 832]
    - [0, 20.491]
  - - [1856, 832, 1, 1024, 1856, 1856, 1856, 832]
    - [3, 20.79]
  - - [1984, 832, 1, 1024, 1984, 1984, 1984, 832]
    - [0, 20.724]
  - - [2112, 832, 1, 1024, 2112, 2112, 2112, 832]
    - [0, 20.923]
  - - [2240, 832, 1, 1024, 2240, 2240, 2240, 832]
    - [2, 20.733]
  - - [2368, 832, 1, 1024, 2368, 2368, 2368, 832]
    - [2, 21.341]
  - - [2496, 832, 1, 1024, 2496, 2496, 2496, 832]
    - [2, 20.786]
  - - [2624, 832, 1, 1024, 2624, 2624, 2624, 832]
    - [2, 21.104]
  - - [2752, 832, 1, 1024, 2752, 2752, 2752, 832]
    - [2, 21.06]
  - - [2880, 832, 1, 1024, 2880, 2880, 2880, 832]
    - [0, 20.842]
  - - [3008, 832, 1, 1024, 3008, 3008, 3008, 832]
    - [2, 21.196]
  - - [3136, 832, 1, 1024, 3136, 3136, 3136, 832]
    - [2, 21.109]
  - - [3264, 832, 1, 1024, 3264, 3264, 3264, 832]
    - [2, 21.069]
  - - [3392, 832, 1, 1024, 3392, 3392, 3392, 832]
    - [2, 21.049]
  - - [3520, 832, 1, 1024, 3520, 3520, 3520, 832]
    - [2, 21.118]
  - - [3648, 832, 1, 1024, 3648, 3648, 3648, 832]
    - [2, 21.168]
  - - [3776, 832, 1, 1024, 3776, 3776, 3776, 832]
    - [2, 21.012]
  - - [3904, 832, 1, 1024, 3904, 3904, 3904, 832]
    - [2, 21.107]
  - - [4032, 832, 1, 1024, 4032, 4032, 4032, 832]
    - [2, 21.213]
  - - [64, 960, 1, 1024, 64, 64, 64, 960]
    - [0, 8.439]
  - - [192, 960, 1, 1024, 192, 192, 192, 960]
    - [0, 16.023]
  - - [320, 960, 1, 1024, 320, 320, 320, 960]
    - [2, 17.945]
  - - [448, 960, 1, 1024, 448, 448, 448, 960]
    - [0, 19.683]
  - - [576, 960, 1, 1024, 576, 576, 576, 960]
    - [0, 19.65]
  - - [704, 960, 1, 1024, 704, 704, 704, 960]
    - [0, 20.538]
  - - [832, 960, 1, 1024, 832, 832, 832, 960]
    - [0, 19.695]
  - - [960, 960, 1, 1024, 960, 960, 960, 960]
    - [2, 20.014]
  - - [1088, 960, 1, 1024, 1088, 1088, 1088, 960]
    - [2, 20.136]
  - - [1216, 960, 1, 1024, 1216, 1216, 1216, 960]
    - [3, 19.995]
  - - [1344, 960, 1, 1024, 1344, 1344, 1344, 960]
    - [2, 20.685]
  - - [1472, 960, 1, 1024, 1472, 1472, 1472, 960]
    - [2, 20.605]
  - - [1600, 960, 1, 1024, 1600, 1600, 1600, 960]
    - [2, 20.654]
  - - [1728, 960, 1, 1024, 1728, 1728, 1728, 960]
    - [0, 20.589]
  - - [1856, 960, 1, 1024, 1856, 1856, 1856, 960]
    - [2, 20.663]
  - - [1984, 960, 1, 1024, 1984, 1984, 1984, 960]
    - [0, 20.89]
  - - [2112, 960, 1, 1024, 2112, 2112, 2112, 960]
    - [2, 20.888]
  - - [2240, 960, 1, 1024, 2240, 2240, 2240, 960]
    - [0, 21.026]
  - - [2368, 960, 1, 1024, 2368, 2368, 2368, 960]
    - [2, 20.994]
  - - [2496, 960, 1, 1024, 2496, 2496, 2496, 960]
    - [2, 21.276]
  - - [2624, 960, 1, 1024, 2624, 2624, 2624, 960]
    - [2, 20.953]
  - - [2752, 960, 1, 1024, 2752, 2752, 2752, 960]
    - [2, 21.213]
  - - [2880, 960, 1, 1024, 2880, 2880, 2880, 960]
    - [2, 21.738]
  - - [3008, 960, 1, 1024, 3008, 3008, 3008, 960]
    - [2, 21.203]
  - - [3136, 960, 1, 1024, 3136, 3136, 3136, 960]
    - [2, 21.18]
  - - [3264, 960, 1, 1024, 3264, 3264, 3264, 960]
    - [2, 21.399]
  - - [3392, 960, 1, 1024, 3392, 3392, 3392, 960]
    - [2, 21.365]
  - - [3520, 960, 1, 1024, 3520, 3520, 3520, 960]
    - [2, 21.257]
  - - [3648, 960, 1, 1024, 3648, 3648, 3648, 960]
    - [2, 21.411]
  - - [3776, 960, 1, 1024, 3776, 3776, 3776, 960]
    - [2, 21.191]
  - - [3904, 960, 1, 1024, 3904, 3904, 3904, 960]
    - [2, 21.356]
  - - [4032, 960, 1, 1024, 4032, 4032, 4032, 960]
    - [2, 21.388]
  - - [64, 1088, 1, 1024, 64, 64, 64, 1088]
    - [2, 10.259]
  - - [192, 1088, 1, 1024, 192, 192, 192, 1088]
    - [2, 15.735]
  - - [320, 1088, 1, 1024, 320, 320, 320, 1088]
    - [2, 18.232]
  - - [448, 1088, 1, 1024, 448, 448, 448, 1088]
    - [0, 20.042]
  - - [576, 1088, 1, 1024, 576, 576, 576, 1088]
    - [0, 20.47]
  - - [704, 1088, 1, 1024, 704, 704, 704, 1088]
    - [0, 20.52]
  - - [832, 1088, 1, 1024, 832, 832, 832, 1088]
    - [2, 19.949]
  - - [960, 1088, 1, 1024, 960, 960, 960, 1088]
    - [2, 20.157]
  - - [1088, 1088, 1, 1024, 1088, 1088, 1088, 1088]
    - [2, 20.209]
  - - [1216, 1088, 1, 1024, 1216, 1216, 1216, 1088]
    - [3, 20.524]
  - - [1344, 1088, 1, 1024, 1344, 1344, 1344, 1088]
    - [2, 21.002]
  - - [1472, 1088, 1, 1024, 1472, 1472, 1472, 1088]
    - [2, 20.871]
  - - [1600, 1088, 1, 1024, 1600, 1600, 1600, 1088]
    - [2, 20.911]
  - - [1728, 1088, 1, 1024, 1728, 1728, 1728, 1088]
    - [0, 20.823]
  - - [1856, 1088, 1, 1024, 1856, 1856, 1856, 1088]
    - [2, 20.897]
  - - [1984, 1088, 1, 1024, 1984, 1984, 1984, 1088]
    - [0, 21.177]
  - - [2112, 1088, 1, 1024, 2112, 2112, 2112, 1088]
    - [2, 21.025]
  - - [2240, 1088, 1, 1024, 2240, 2240, 2240, 1088]
    - [2, 21.15]
  - - [2368, 1088, 1, 1024, 2368, 2368, 2368, 1088]
    - [2, 21.416]
  - - [2496, 1088, 1, 1024, 2496, 2496, 2496, 1088]
    - [0, 21.233]
  - - [2624, 1088, 1, 1024, 2624, 2624, 2624, 1088]
    - [2, 21.282]
  - - [2752, 1088, 1, 1024, 2752, 2752, 2752, 1088]
    - [2, 21.24]
  - - [2880, 1088, 1, 1024, 2880, 2880, 2880, 1088]
    - [2, 21.305]
  - - [3008, 1088, 1, 1024, 3008, 3008, 3008, 1088]
    - [2, 21.367]
  - - [3136, 1088, 1, 1024, 3136, 3136, 3136, 1088]
    - [2, 21.32]
  - - [3264, 1088, 1, 1024, 3264, 3264, 3264, 1088]
    - [2, 21.299]
  - - [3392, 1088, 1, 1024, 3392, 3392, 3392, 1088]
    - [2, 21.349]
  - - [3520, 1088, 1, 1024, 3520, 3520, 3520, 1088]
    - [2, 21.348]
  - - [3648, 1088, 1, 1024, 3648, 3648, 3648, 1088]
    - [2, 21.356]
  - - [3776, 1088, 1, 1024, 3776, 3776, 3776, 1088]
    - [2, 21.272]
  - - [3904, 1088, 1, 1024, 3904, 3904, 3904, 1088]
    - [2, 21.385]
  - - [4032, 1088, 1, 1024, 4032, 4032, 4032, 1088]
    - [2, 21.382]
  - - [64, 1216, 1, 1024, 64, 64, 64, 1216]
    - [0, 10.673]
  - - [192, 1216, 1, 1024, 192, 192, 192, 1216]
    - [0, 17.422]
  - - [320, 1216, 1, 1024, 320, 320, 320, 1216]
    - [0, 20.027]
  - - [448, 1216, 1, 1024, 448, 448, 448, 1216]
    - [2, 19.614]
  - - [576, 1216, 1, 1024, 576, 576, 576, 1216]
    - [0, 19.927]
  - - [704, 1216, 1, 1024, 704, 704, 704, 1216]
    - [0, 19.904]
  - - [832, 1216, 1, 1024, 832, 832, 832, 1216]
    - [2, 20.344]
  - - [960, 1216, 1, 1024, 960, 960, 960, 1216]
    - [2, 20.571]
  - - [1088, 1216, 1, 1024, 1088, 1088, 1088, 1216]
    - [2, 20.818]
  - - [1216, 1216, 1, 1024, 1216, 1216, 1216, 1216]
    - [2, 20.44]
  - - [1344, 1216, 1, 1024, 1344, 1344, 1344, 1216]
    - [2, 21.049]
  - - [1472, 1216, 1, 1024, 1472, 1472, 1472, 1216]
    - [2, 20.764]
  - - [1600, 1216, 1, 1024, 1600, 1600, 1600, 1216]
    - [2, 20.927]
  - - [1728, 1216, 1, 1024, 1728, 1728, 1728, 1216]
    - [2, 21.037]
  - - [1856, 1216, 1, 1024, 1856, 1856, 1856, 1216]
    - [2, 21.213]
  - - [1984, 1216, 1, 1024, 1984, 1984, 1984, 1216]
    - [0, 21.013]
  - - [2112, 1216, 1, 1024, 2112, 2112, 2112, 1216]
    - [2, 20.964]
  - - [2240, 1216, 1, 1024, 2240, 2240, 2240, 1216]
    - [2, 21.199]
  - - [2368, 1216, 1, 1024, 2368, 2368, 2368, 1216]
    - [2, 21.323]
  - - [2496, 1216, 1, 1024, 2496, 2496, 2496, 1216]
    - [2, 21.359]
  - - [2624, 1216, 1, 1024, 2624, 2624, 2624, 1216]
    - [2, 21.171]
  - - [2752, 1216, 1, 1024, 2752, 2752, 2752, 1216]
    - [2, 21.295]
  - - [2880, 1216, 1, 1024, 2880, 2880, 2880, 1216]
    - [2, 21.282]
  - - [3008, 1216, 1, 1024, 3008, 3008, 3008, 1216]
    - [2, 21.392]
  - - [3136, 1216, 1, 1024, 3136, 3136, 3136, 1216]
    - [2, 21.217]
  - - [3264, 1216, 1, 1024, 3264, 3264, 3264, 1216]
    - [2, 21.469]
  - - [3392, 1216, 1, 1024, 3392, 3392, 3392, 1216]
    - [2, 21.373]
  - - [3520, 1216, 1, 1024, 3520, 3520, 3520, 1216]
    - [2, 21.428]
  - - [3648, 1216, 1, 1024, 3648, 3648, 3648, 1216]
    - [2, 21.282]
  - - [3776, 1216, 1, 1024, 3776, 3776, 3776, 1216]
    - [2, 21.202]
  - - [3904, 1216, 1, 1024, 3904, 3904, 3904, 1216]
    - [2, 21.106]
  - - [4032, 1216, 1, 1024, 4032, 4032, 4032, 1216]
    - [2, 21.612]
  - - [64, 1344, 1, 1024, 64, 64, 64, 1344]
    - [0, 11.781]
  - - [192, 1344, 1, 1024, 192, 192, 192, 1344]
    - [2, 17.291]
  - - [320, 1344, 1, 1024, 320, 320, 320, 1344]
    - [0, 19.719]
  - - [448, 1344, 1, 1024, 448, 448, 448, 1344]
    - [2, 19.62]
  - - [576, 1344, 1, 1024, 576, 576, 576, 1344]
    - [0, 20.662]
  - - [704, 1344, 1, 1024, 704, 704, 704, 1344]
    - [2, 19.979]
  - - [832, 1344, 1, 1024, 832, 832, 832, 1344]
    - [2, 20.232]
  - - [960, 1344, 1, 1024, 960, 960, 960, 1344]
    - [2, 20.487]
  - - [1088, 1344, 1, 1024, 1088, 1088, 1088, 1344]
    - [2, 20.613]
  - - [1216, 1344, 1, 1024, 1216, 1216, 1216, 1344]
    - [0, 20.581]
  - - [1344, 1344, 1, 1024, 1344, 1344, 1344, 1344]
    - [2, 20.985]
  - - [1472, 1344, 1, 1024, 1472, 1472, 1472, 1344]
    - [2, 21.194]
  - - [1600, 1344, 1, 1024, 1600, 1600, 1600, 1344]
    - [2, 21.207]
  - - [1728, 1344, 1, 1024, 1728, 1728, 1728, 1344]
    - [2, 21.222]
  - - [1856, 1344, 1, 1024, 1856, 1856, 1856, 1344]
    - [2, 21.172]
  - - [1984, 1344, 1, 1024, 1984, 1984, 1984, 1344]
    - [2, 21.145]
  - - [2112, 1344, 1, 1024, 2112, 2112, 2112, 1344]
    - [2, 21.243]
  - - [2240, 1344, 1, 1024, 2240, 2240, 2240, 1344]
    - [2, 21.205]
  - - [2368, 1344, 1, 1024, 2368, 2368, 2368, 1344]
    - [0, 21.034]
  - - [2496, 1344, 1, 1024, 2496, 2496, 2496, 1344]
    - [2, 21.09]
  - - [2624, 1344, 1, 1024, 2624, 2624, 2624, 1344]
    - [2, 21.008]
  - - [2752, 1344, 1, 1024, 2752, 2752, 2752, 1344]
    - [2, 21.354]
  - - [2880, 1344, 1, 1024, 2880, 2880, 2880, 1344]
    - [2, 21.217]
  - - [3008, 1344, 1, 1024, 3008, 3008, 3008, 1344]
    - [2, 21.255]
  - - [3136, 1344, 1, 1024, 3136, 3136, 3136, 1344]
    - [2, 21.282]
  - - [3264, 1344, 1, 1024, 3264, 3264, 3264, 1344]
    - [2, 21.42]
  - - [3392, 1344, 1, 1024, 3392, 3392, 3392, 1344]
    - [2, 21.275]
  - - [3520, 1344, 1, 1024, 3520, 3520, 3520, 1344]
    - [2, 21.241]
  - - [3648, 1344, 1, 1024, 3648, 3648, 3648, 1344]
    - [2, 21.422]
  - - [3776, 1344, 1, 1024, 3776, 3776, 3776, 1344]
    - [2, 21.259]
  - - [3904, 1344, 1, 1024, 3904, 3904, 3904, 1344]
    - [2, 21.467]
  - - [4032, 1344, 1, 1024, 4032, 4032, 4032, 1344]
    - [2, 21.575]
  - - [64, 1472, 1, 1024, 64, 64, 64, 1472]
    - [0, 12.896]
  - - [192, 1472, 1, 1024, 192, 192, 192, 1472]
    - [0, 18.234]
  - - [320, 1472, 1, 1024, 320, 320, 320, 1472]
    - [0, 19.858]
  - - [448, 1472, 1, 1024, 448, 448, 448, 1472]
    - [0, 19.583]
  - - [576, 1472, 1, 1024, 576, 576, 576, 1472]
    - [2, 20.28]
  - - [704, 1472, 1, 1024, 704, 704, 704, 1472]
    - [2, 20.426]
  - - [832, 1472, 1, 1024, 832, 832, 832, 1472]
    - [2, 20.638]
  - - [960, 1472, 1, 1024, 960, 960, 960, 1472]
    - [2, 20.79]
  - - [1088, 1472, 1, 1024, 1088, 1088, 1088, 1472]
    - [2, 20.703]
  - - [1216, 1472, 1, 1024, 1216, 1216, 1216, 1472]
    - [2, 20.799]
  - - [1344, 1472, 1, 1024, 1344, 1344, 1344, 1472]
    - [2, 20.937]
  - - [1472, 1472, 1, 1024, 1472, 1472, 1472, 1472]
    - [0, 20.792]
  - - [1600, 1472, 1, 1024, 1600, 1600, 1600, 1472]
    - [2, 21.099]
  - - [1728, 1472, 1, 1024, 1728, 1728, 1728, 1472]
    - [2, 21.227]
  - - [1856, 1472, 1, 1024, 1856, 1856, 1856, 1472]
    - [0, 21.131]
  - - [1984, 1472, 1, 1024, 1984, 1984, 1984, 1472]
    - [2, 21.241]
  - - [2112, 1472, 1, 1024, 2112, 2112, 2112, 1472]
    - [2, 21.276]
  - - [2240, 1472, 1, 1024, 2240, 2240, 2240, 1472]
    - [2, 21.337]
  - - [2368, 1472, 1, 1024, 2368, 2368, 2368, 1472]
    - [2, 21.341]
  - - [2496, 1472, 1, 1024, 2496, 2496, 2496, 1472]
    - [2, 21.38]
  - - [2624, 1472, 1, 1024, 2624, 2624, 2624, 1472]
    - [2, 21.235]
  - - [2752, 1472, 1, 1024, 2752, 2752, 2752, 1472]
    - [2, 21.453]
  - - [2880, 1472, 1, 1024, 2880, 2880, 2880, 1472]
    - [2, 21.512]
  - - [3008, 1472, 1, 1024, 3008, 3008, 3008, 1472]
    - [2, 21.308]
  - - [3136, 1472, 1, 1024, 3136, 3136, 3136, 1472]
    - [2, 21.452]
  - - [3264, 1472, 1, 1024, 3264, 3264, 3264, 1472]
    - [2, 21.236]
  - - [3392, 1472, 1, 1024, 3392, 3392, 3392, 1472]
    - [2, 21.306]
  - - [3520, 1472, 1, 1024, 3520, 3520, 3520, 1472]
    - [2, 21.218]
  - - [3648, 1472, 1, 1024, 3648, 3648, 3648, 1472]
    - [2, 21.291]
  - - [3776, 1472, 1, 1024, 3776, 3776, 3776, 1472]
    - [2, 21.216]
  - - [3904, 1472, 1, 1024, 3904, 3904, 3904, 1472]
    - [2, 21.356]
  - - [4032, 1472, 1, 1024, 4032, 4032, 4032, 1472]
    - [2, 21.327]
  - - [64, 1600, 1, 1024, 64, 64, 64, 1600]
    - [2, 11.439]
  - - [192, 1600, 1, 1024, 192, 192, 192, 1600]
    - [2, 18.042]
  - - [320, 1600, 1, 1024, 320, 320, 320, 1600]
    - [2, 19.821]
  - - [448, 1600, 1, 1024, 448, 448, 448, 1600]
    - [0, 20.296]
  - - [576, 1600, 1, 1024, 576, 576, 576, 1600]
    - [0, 20.26]
  - - [704, 1600, 1, 1024, 704, 704, 704, 1600]
    - [2, 20.554]
  - - [832, 1600, 1, 1024, 832, 832, 832, 1600]
    - [3, 20.488]
  - - [960, 1600, 1, 1024, 960, 960, 960, 1600]
    - [2, 20.565]
  - - [1088, 1600, 1, 1024, 1088, 1088, 1088, 1600]
    - [2, 20.738]
  - - [1216, 1600, 1, 1024, 1216, 1216, 1216, 1600]
    - [2, 21.163]
  - - [1344, 1600, 1, 1024, 1344, 1344, 1344, 1600]
    - [2, 21.39]
  - - [1472, 1600, 1, 1024, 1472, 1472, 1472, 1600]
    - [2, 20.958]
  - - [1600, 1600, 1, 1024, 1600, 1600, 1600, 1600]
    - [2, 21.14]
  - - [1728, 1600, 1, 1024, 1728, 1728, 1728, 1600]
    - [2, 21.145]
  - - [1856, 1600, 1, 1024, 1856, 1856, 1856, 1600]
    - [2, 21.179]
  - - [1984, 1600, 1, 1024, 1984, 1984, 1984, 1600]
    - [2, 21.364]
  - - [2112, 1600, 1, 1024, 2112, 2112, 2112, 1600]
    - [2, 21.036]
  - - [2240, 1600, 1, 1024, 2240, 2240, 2240, 1600]
    - [2, 21.314]
  - - [2368, 1600, 1, 1024, 2368, 2368, 2368, 1600]
    - [2, 21.371]
  - - [2496, 1600, 1, 1024, 2496, 2496, 2496, 1600]
    - [2, 21.284]
  - - [2624, 1600, 1, 1024, 2624, 2624, 2624, 1600]
    - [2, 21.384]
  - - [2752, 1600, 1, 1024, 2752, 2752, 2752, 1600]
    - [2, 21.289]
  - - [2880, 1600, 1, 1024, 2880, 2880, 2880, 1600]
    - [2, 21.385]
  - - [3008, 1600, 1, 1024, 3008, 3008, 3008, 1600]
    - [2, 21.306]
  - - [3136, 1600, 1, 1024, 3136, 3136, 3136, 1600]
    - [2, 21.417]
  - - [3264, 1600, 1, 1024, 3264, 3264, 3264, 1600]
    - [2, 21.249]
  - - [3392, 1600, 1, 1024, 3392, 3392, 3392, 1600]
    - [2, 21.285]
  - - [3520, 1600, 1, 1024, 3520, 3520, 3520, 1600]
    - [2, 21.383]
  - - [3648, 1600, 1, 1024, 3648, 3648, 3648, 1600]
    - [2, 21.489]
  - - [3776, 1600, 1, 1024, 3776, 3776, 3776, 1600]
    - [2, 21.533]
  - - [3904, 1600, 1, 1024, 3904, 3904, 3904, 1600]
    - [2, 21.517]
  - - [4032, 1600, 1, 1024, 4032, 4032, 4032, 1600]
    - [2, 21.372]
  - - [64, 1728, 1, 1024, 64, 64, 64, 1728]
    - [2, 12.298]
  - - [192, 1728, 1, 1024, 192, 192, 192, 1728]
    - [0, 18.794]
  - - [320, 1728, 1, 1024, 320, 320, 320, 1728]
    - [0, 19.685]
  - - [448, 1728, 1, 1024, 448, 448, 448, 1728]
    - [3, 19.683]
  - - [576, 1728, 1, 1024, 576, 576, 576, 1728]
    - [0, 19.668]
  - - [704, 1728, 1, 1024, 704, 704, 704, 1728]
    - [0, 20.472]
  - - [832, 1728, 1, 1024, 832, 832, 832, 1728]
    - [2, 20.691]
  - - [960, 1728, 1, 1024, 960, 960, 960, 1728]
    - [2, 20.891]
  - - [1088, 1728, 1, 1024, 1088, 1088, 1088, 1728]
    - [2, 21.113]
  - - [1216, 1728, 1, 1024, 1216, 1216, 1216, 1728]
    - [2, 20.943]
  - - [1344, 1728, 1, 1024, 1344, 1344, 1344, 1728]
    - [0, 21.081]
  - - [1472, 1728, 1, 1024, 1472, 1472, 1472, 1728]
    - [0, 21.32]
  - - [1600, 1728, 1, 1024, 1600, 1600, 1600, 1728]
    - [2, 21.216]
  - - [1728, 1728, 1, 1024, 1728, 1728, 1728, 1728]
    - [2, 21.322]
  - - [1856, 1728, 1, 1024, 1856, 1856, 1856, 1728]
    - [2, 21.292]
  - - [1984, 1728, 1, 1024, 1984, 1984, 1984, 1728]
    - [2, 21.408]
  - - [2112, 1728, 1, 1024, 2112, 2112, 2112, 1728]
    - [2, 21.396]
  - - [2240, 1728, 1, 1024, 2240, 2240, 2240, 1728]
    - [2, 21.197]
  - - [2368, 1728, 1, 1024, 2368, 2368, 2368, 1728]
    - [2, 21.416]
  - - [2496, 1728, 1, 1024, 2496, 2496, 2496, 1728]
    - [2, 21.098]
  - - [2624, 1728, 1, 1024, 2624, 2624, 2624, 1728]
    - [2, 21.274]
  - - [2752, 1728, 1, 1024, 2752, 2752, 2752, 1728]
    - [2, 21.162]
  - - [2880, 1728, 1, 1024, 2880, 2880, 2880, 1728]
    - [2, 21.286]
  - - [3008, 1728, 1, 1024, 3008, 3008, 3008, 1728]
    - [2, 21.247]
  - - [3136, 1728, 1, 1024, 3136, 3136, 3136, 1728]
    - [2, 21.386]
  - - [3264, 1728, 1, 1024, 3264, 3264, 3264, 1728]
    - [2, 21.381]
  - - [3392, 1728, 1, 1024, 3392, 3392, 3392, 1728]
    - [2, 21.441]
  - - [3520, 1728, 1, 1024, 3520, 3520, 3520, 1728]
    - [2, 21.313]
  - - [3648, 1728, 1, 1024, 3648, 3648, 3648, 1728]
    - [2, 21.308]
  - - [3776, 1728, 1, 1024, 3776, 3776, 3776, 1728]
    - [2, 21.421]
  - - [3904, 1728, 1, 1024, 3904, 3904, 3904, 1728]
    - [2, 21.463]
  - - [4032, 1728, 1, 1024, 4032, 4032, 4032, 1728]
    - [2, 21.296]
  - - [64, 1856, 1, 1024, 64, 64, 64, 1856]
    - [2, 13.23]
  - - [192, 1856, 1, 1024, 192, 192, 192, 1856]
    - [2, 18.563]
  - - [320, 1856, 1, 1024, 320, 320, 320, 1856]
    - [0, 20.122]
  - - [448, 1856, 1, 1024, 448, 448, 448, 1856]
    - [0, 20.196]
  - - [576, 1856, 1, 1024, 576, 576, 576, 1856]
    - [3, 20.361]
  - - [704, 1856, 1, 1024, 704, 704, 704, 1856]
    - [2, 20.688]
  - - [832, 1856, 1, 1024, 832, 832, 832, 1856]
    - [2, 20.514]
  - - [960, 1856, 1, 1024, 960, 960, 960, 1856]
    - [2, 21.149]
  - - [1088, 1856, 1, 1024, 1088, 1088, 1088, 1856]
    - [2, 20.924]
  - - [1216, 1856, 1, 1024, 1216, 1216, 1216, 1856]
    - [0, 21.182]
  - - [1344, 1856, 1, 1024, 1344, 1344, 1344, 1856]
    - [2, 21.037]
  - - [1472, 1856, 1, 1024, 1472, 1472, 1472, 1856]
    - [2, 21.117]
  - - [1600, 1856, 1, 1024, 1600, 1600, 1600, 1856]
    - [2, 21.331]
  - - [1728, 1856, 1, 1024, 1728, 1728, 1728, 1856]
    - [2, 21.317]
  - - [1856, 1856, 1, 1024, 1856, 1856, 1856, 1856]
    - [2, 21.36]
  - - [1984, 1856, 1, 1024, 1984, 1984, 1984, 1856]
    - [2, 21.07]
  - - [2112, 1856, 1, 1024, 2112, 2112, 2112, 1856]
    - [2, 21.245]
  - - [2240, 1856, 1, 1024, 2240, 2240, 2240, 1856]
    - [2, 21.137]
  - - [2368, 1856, 1, 1024, 2368, 2368, 2368, 1856]
    - [2, 21.48]
  - - [2496, 1856, 1, 1024, 2496, 2496, 2496, 1856]
    - [2, 21.343]
  - - [2624, 1856, 1, 1024, 2624, 2624, 2624, 1856]
    - [2, 21.165]
  - - [2752, 1856, 1, 1024, 2752, 2752, 2752, 1856]
    - [2, 21.21]
  - - [2880, 1856, 1, 1024, 2880, 2880, 2880, 1856]
    - [2, 21.224]
  - - [3008, 1856, 1, 1024, 3008, 3008, 3008, 1856]
    - [2, 21.338]
  - - [3136, 1856, 1, 1024, 3136, 3136, 3136, 1856]
    - [2, 21.327]
  - - [3264, 1856, 1, 1024, 3264, 3264, 3264, 1856]
    - [2, 21.583]
  - - [3392, 1856, 1, 1024, 3392, 3392, 3392, 1856]
    - [2, 21.56]
  - - [3520, 1856, 1, 1024, 3520, 3520, 3520, 1856]
    - [2, 21.47]
  - - [3648, 1856, 1, 1024, 3648, 3648, 3648, 1856]
    - [2, 21.418]
  - - [3776, 1856, 1, 1024, 3776, 3776, 3776, 1856]
    - [2, 21.536]
  - - [3904, 1856, 1, 1024, 3904, 3904, 3904, 1856]
    - [2, 21.476]
  - - [4032, 1856, 1, 1024, 4032, 4032, 4032, 1856]
    - [2, 21.49]
  - - [64, 1984, 1, 1024, 64, 64, 64, 1984]
    - [0, 13.546]
  - - [192, 1984, 1, 1024, 192, 192, 192, 1984]
    - [0, 19.334]
  - - [320, 1984, 1, 1024, 320, 320, 320, 1984]
    - [0, 20.544]
  - - [448, 1984, 1, 1024, 448, 448, 448, 1984]
    - [0, 19.759]
  - - [576, 1984, 1, 1024, 576, 576, 576, 1984]
    - [0, 20.331]
  - - [704, 1984, 1, 1024, 704, 704, 704, 1984]
    - [2, 21.011]
  - - [832, 1984, 1, 1024, 832, 832, 832, 1984]
    - [2, 20.945]
  - - [960, 1984, 1, 1024, 960, 960, 960, 1984]
    - [0, 20.683]
  - - [1088, 1984, 1, 1024, 1088, 1088, 1088, 1984]
    - [2, 21.32]
  - - [1216, 1984, 1, 1024, 1216, 1216, 1216, 1984]
    - [2, 21.117]
  - - [1344, 1984, 1, 1024, 1344, 1344, 1344, 1984]
    - [2, 21.215]
  - - [1472, 1984, 1, 1024, 1472, 1472, 1472, 1984]
    - [2, 21.306]
  - - [1600, 1984, 1, 1024, 1600, 1600, 1600, 1984]
    - [2, 21.06]
  - - [1728, 1984, 1, 1024, 1728, 1728, 1728, 1984]
    - [2, 21.172]
  - - [1856, 1984, 1, 1024, 1856, 1856, 1856, 1984]
    - [2, 21.138]
  - - [1984, 1984, 1, 1024, 1984, 1984, 1984, 1984]
    - [2, 21.391]
  - - [2112, 1984, 1, 1024, 2112, 2112, 2112, 1984]
    - [2, 21.411]
  - - [2240, 1984, 1, 1024, 2240, 2240, 2240, 1984]
    - [2, 21.261]
  - - [2368, 1984, 1, 1024, 2368, 2368, 2368, 1984]
    - [2, 21.27]
  - - [2496, 1984, 1, 1024, 2496, 2496, 2496, 1984]
    - [2, 21.35]
  - - [2624, 1984, 1, 1024, 2624, 2624, 2624, 1984]
    - [2, 21.363]
  - - [2752, 1984, 1, 1024, 2752, 2752, 2752, 1984]
    - [2, 21.246]
  - - [2880, 1984, 1, 1024, 2880, 2880, 2880, 1984]
    - [2, 21.537]
  - - [3008, 1984, 1, 1024, 3008, 3008, 3008, 1984]
    - [2, 21.432]
  - - [3136, 1984, 1, 1024, 3136, 3136, 3136, 1984]
    - [2, 21.364]
  - - [3264, 1984, 1, 1024, 3264, 3264, 3264, 1984]
    - [2, 21.365]
  - - [3392, 1984, 1, 1024, 3392, 3392, 3392, 1984]
    - [2, 21.511]
  - - [3520, 1984, 1, 1024, 3520, 3520, 3520, 1984]
    - [2, 21.646]
  - - [3648, 1984, 1, 1024, 3648, 3648, 3648, 1984]
    - [2, 21.552]
  - - [3776, 1984, 1, 1024, 3776, 3776, 3776, 1984]
    - [2, 21.247]
  - - [3904, 1984, 1, 1024, 3904, 3904, 3904, 1984]
    - [2, 21.565]
  - - [4032, 1984, 1, 1024, 4032, 4032, 4032, 1984]
    - [0, 21.482]
  - - [64, 2112, 1, 1024, 64, 64, 64, 2112]
    - [0, 14.354]
  - - [192, 2112, 1, 1024, 192, 192, 192, 2112]
    - [3, 18.802]
  - - [320, 2112, 1, 1024, 320, 320, 320, 2112]
    - [0, 19.918]
  - - [448, 2112, 1, 1024, 448, 448, 448, 2112]
    - [2, 20.073]
  - - [576, 2112, 1, 1024, 576, 576, 576, 2112]
    - [2, 20.587]
  - - [704, 2112, 1, 1024, 704, 704, 704, 2112]
    - [2, 20.642]
  - - [832, 2112, 1, 1024, 832, 832, 832, 2112]
    - [0, 20.677]
  - - [960, 2112, 1, 1024, 960, 960, 960, 2112]
    - [2, 20.881]
  - - [1088, 2112, 1, 1024, 1088, 1088, 1088, 2112]
    - [2, 20.964]
  - - [1216, 2112, 1, 1024, 1216, 1216, 1216, 2112]
    - [2, 21.094]
  - - [1344, 2112, 1, 1024, 1344, 1344, 1344, 2112]
    - [2, 21.152]
  - - [1472, 2112, 1, 1024, 1472, 1472, 1472, 2112]
    - [2, 20.826]
  - - [1600, 2112, 1, 1024, 1600, 1600, 1600, 2112]
    - [2, 21.188]
  - - [1728, 2112, 1, 1024, 1728, 1728, 1728, 2112]
    - [2, 21.031]
  - - [1856, 2112, 1, 1024, 1856, 1856, 1856, 2112]
    - [2, 21.139]
  - - [1984, 2112, 1, 1024, 1984, 1984, 1984, 2112]
    - [2, 21.206]
  - - [2112, 2112, 1, 1024, 2112, 2112, 2112, 2112]
    - [2, 21.371]
  - - [2240, 2112, 1, 1024, 2240, 2240, 2240, 2112]
    - [2, 21.375]
  - - [2368, 2112, 1, 1024, 2368, 2368, 2368, 2112]
    - [2, 21.202]
  - - [2496, 2112, 1, 1024, 2496, 2496, 2496, 2112]
    - [2, 21.222]
  - - [2624, 2112, 1, 1024, 2624, 2624, 2624, 2112]
    - [2, 21.477]
  - - [2752, 2112, 1, 1024, 2752, 2752, 2752, 2112]
    - [2, 21.37]
  - - [2880, 2112, 1, 1024, 2880, 2880, 2880, 2112]
    - [2, 21.369]
  - - [3008, 2112, 1, 1024, 3008, 3008, 3008, 2112]
    - [2, 21.37]
  - - [3136, 2112, 1, 1024, 3136, 3136, 3136, 2112]
    - [2, 21.472]
  - - [3264, 2112, 1, 1024, 3264, 3264, 3264, 2112]
    - [2, 21.294]
  - - [3392, 2112, 1, 1024, 3392, 3392, 3392, 2112]
    - [2, 21.529]
  - - [3520, 2112, 1, 1024, 3520, 3520, 3520, 2112]
    - [2, 21.474]
  - - [3648, 2112, 1, 1024, 3648, 3648, 3648, 2112]
    - [2, 21.315]
  - - [3776, 2112, 1, 1024, 3776, 3776, 3776, 2112]
    - [2, 21.185]
  - - [3904, 2112, 1, 1024, 3904, 3904, 3904, 2112]
    - [2, 21.347]
  - - [4032, 2112, 1, 1024, 4032, 4032, 4032, 2112]
    - [2, 21.427]
  - - [64, 2240, 1, 1024, 64, 64, 64, 2240]
    - [0, 15.235]
  - - [192, 2240, 1, 1024, 192, 192, 192, 2240]
    - [0, 19.59]
  - - [320, 2240, 1, 1024, 320, 320, 320, 2240]
    - [0, 19.666]
  - - [448, 2240, 1, 1024, 448, 448, 448, 2240]
    - [2, 19.828]
  - - [576, 2240, 1, 1024, 576, 576, 576, 2240]
    - [2, 20.245]
  - - [704, 2240, 1, 1024, 704, 704, 704, 2240]
    - [2, 20.948]
  - - [832, 2240, 1, 1024, 832, 832, 832, 2240]
    - [2, 20.926]
  - - [960, 2240, 1, 1024, 960, 960, 960, 2240]
    - [2, 21.062]
  - - [1088, 2240, 1, 1024, 1088, 1088, 1088, 2240]
    - [2, 21.001]
  - - [1216, 2240, 1, 1024, 1216, 1216, 1216, 2240]
    - [2, 21.122]
  - - [1344, 2240, 1, 1024, 1344, 1344, 1344, 2240]
    - [2, 20.991]
  - - [1472, 2240, 1, 1024, 1472, 1472, 1472, 2240]
    - [2, 20.984]
  - - [1600, 2240, 1, 1024, 1600, 1600, 1600, 2240]
    - [2, 21.236]
  - - [1728, 2240, 1, 1024, 1728, 1728, 1728, 2240]
    - [2, 21.117]
  - - [1856, 2240, 1, 1024, 1856, 1856, 1856, 2240]
    - [2, 21.166]
  - - [1984, 2240, 1, 1024, 1984, 1984, 1984, 2240]
    - [2, 21.322]
  - - [2112, 2240, 1, 1024, 2112, 2112, 2112, 2240]
    - [2, 21.437]
  - - [2240, 2240, 1, 1024, 2240, 2240, 2240, 2240]
    - [2, 21.31]
  - - [2368, 2240, 1, 1024, 2368, 2368, 2368, 2240]
    - [2, 21.156]
  - - [2496, 2240, 1, 1024, 2496, 2496, 2496, 2240]
    - [2, 21.143]
  - - [2624, 2240, 1, 1024, 2624, 2624, 2624, 2240]
    - [2, 21.421]
  - - [2752, 2240, 1, 1024, 2752, 2752, 2752, 2240]
    - [2, 21.557]
  - - [2880, 2240, 1, 1024, 2880, 2880, 2880, 2240]
    - [2, 21.23]
  - - [3008, 2240, 1, 1024, 3008, 3008, 3008, 2240]
    - [2, 21.499]
  - - [3136, 2240, 1, 1024, 3136, 3136, 3136, 2240]
    - [2, 21.266]
  - - [3264, 2240, 1, 1024, 3264, 3264, 3264, 2240]
    - [2, 21.313]
  - - [3392, 2240, 1, 1024, 3392, 3392, 3392, 2240]
    - [2, 21.577]
  - - [3520, 2240, 1, 1024, 3520, 3520, 3520, 2240]
    - [0, 21.375]
  - - [3648, 2240, 1, 1024, 3648, 3648, 3648, 2240]
    - [2, 21.468]
  - - [3776, 2240, 1, 1024, 3776, 3776, 3776, 2240]
    - [2, 21.291]
  - - [3904, 2240, 1, 1024, 3904, 3904, 3904, 2240]
    - [2, 21.528]
  - - [4032, 2240, 1, 1024, 4032, 4032, 4032, 2240]
    - [2, 21.463]
  - - [64, 2368, 1, 1024, 64, 64, 64, 2368]
    - [2, 13.846]
  - - [192, 2368, 1, 1024, 192, 192, 192, 2368]
    - [0, 19.081]
  - - [320, 2368, 1, 1024, 320, 320, 320, 2368]
    - [0, 19.827]
  - - [448, 2368, 1, 1024, 448, 448, 448, 2368]
    - [2, 19.967]
  - - [576, 2368, 1, 1024, 576, 576, 576, 2368]
    - [2, 20.638]
  - - [704, 2368, 1, 1024, 704, 704, 704, 2368]
    - [0, 20.512]
  - - [832, 2368, 1, 1024, 832, 832, 832, 2368]
    - [2, 20.804]
  - - [960, 2368, 1, 1024, 960, 960, 960, 2368]
    - [2, 20.862]
  - - [1088, 2368, 1, 1024, 1088, 1088, 1088, 2368]
    - [2, 21.042]
  - - [1216, 2368, 1, 1024, 1216, 1216, 1216, 2368]
    - [2, 21.16]
  - - [1344, 2368, 1, 1024, 1344, 1344, 1344, 2368]
    - [2, 21.052]
  - - [1472, 2368, 1, 1024, 1472, 1472, 1472, 2368]
    - [2, 21.314]
  - - [1600, 2368, 1, 1024, 1600, 1600, 1600, 2368]
    - [2, 21.465]
  - - [1728, 2368, 1, 1024, 1728, 1728, 1728, 2368]
    - [2, 21.064]
  - - [1856, 2368, 1, 1024, 1856, 1856, 1856, 2368]
    - [2, 21.24]
  - - [1984, 2368, 1, 1024, 1984, 1984, 1984, 2368]
    - [2, 21.154]
  - - [2112, 2368, 1, 1024, 2112, 2112, 2112, 2368]
    - [2, 21.04]
  - - [2240, 2368, 1, 1024, 2240, 2240, 2240, 2368]
    - [2, 21.124]
  - - [2368, 2368, 1, 1024, 2368, 2368, 2368, 2368]
    - [2, 21.301]
  - - [2496, 2368, 1, 1024, 2496, 2496, 2496, 2368]
    - [2, 21.178]
  - - [2624, 2368, 1, 1024, 2624, 2624, 2624, 2368]
    - [2, 21.413]
  - - [2752, 2368, 1, 1024, 2752, 2752, 2752, 2368]
    - [2, 21.255]
  - - [2880, 2368, 1, 1024, 2880, 2880, 2880, 2368]
    - [2, 21.247]
  - - [3008, 2368, 1, 1024, 3008, 3008, 3008, 2368]
    - [2, 21.442]
  - - [3136, 2368, 1, 1024, 3136, 3136, 3136, 2368]
    - [2, 21.508]
  - - [3264, 2368, 1, 1024, 3264, 3264, 3264, 2368]
    - [2, 21.43]
  - - [3392, 2368, 1, 1024, 3392, 3392, 3392, 2368]
    - [2, 21.371]
  - - [3520, 2368, 1, 1024, 3520, 3520, 3520, 2368]
    - [2, 21.363]
  - - [3648, 2368, 1, 1024, 3648, 3648, 3648, 2368]
    - [2, 21.442]
  - - [3776, 2368, 1, 1024, 3776, 3776, 3776, 2368]
    - [0, 21.514]
  - - [3904, 2368, 1, 1024, 3904, 3904, 3904, 2368]
    - [2, 21.555]
  - - [4032, 2368, 1, 1024, 4032, 4032, 4032, 2368]
    - [0, 21.454]
  - - [64, 2496, 1, 1024, 64, 64, 64, 2496]
    - [2, 14.309]
  - - [192, 2496, 1, 1024, 192, 192, 192, 2496]
    - [0, 19.983]
  - - [320, 2496, 1, 1024, 320, 320, 320, 2496]
    - [0, 19.937]
  - - [448, 2496, 1, 1024, 448, 448, 448, 2496]
    - [3, 20.673]
  - - [576, 2496, 1, 1024, 576, 576, 576, 2496]
    - [2, 21.446]
  - - [704, 2496, 1, 1024, 704, 704, 704, 2496]
    - [2, 20.789]
  - - [832, 2496, 1, 1024, 832, 832, 832, 2496]
    - [2, 20.805]
  - - [960, 2496, 1, 1024, 960, 960, 960, 2496]
    - [2, 20.905]
  - - [1088, 2496, 1, 1024, 1088, 1088, 1088, 2496]
    - [2, 21.183]
  - - [1216, 2496, 1, 1024, 1216, 1216, 1216, 2496]
    - [2, 21.332]
  - - [1344, 2496, 1, 1024, 1344, 1344, 1344, 2496]
    - [0, 20.923]
  - - [1472, 2496, 1, 1024, 1472, 1472, 1472, 2496]
    - [2, 21.227]
  - - [1600, 2496, 1, 1024, 1600, 1600, 1600, 2496]
    - [2, 20.919]
  - - [1728, 2496, 1, 1024, 1728, 1728, 1728, 2496]
    - [2, 21.304]
  - - [1856, 2496, 1, 1024, 1856, 1856, 1856, 2496]
    - [0, 21.034]
  - - [1984, 2496, 1, 1024, 1984, 1984, 1984, 2496]
    - [2, 21.241]
  - - [2112, 2496, 1, 1024, 2112, 2112, 2112, 2496]
    - [0, 21.131]
  - - [2240, 2496, 1, 1024, 2240, 2240, 2240, 2496]
    - [2, 21.358]
  - - [2368, 2496, 1, 1024, 2368, 2368, 2368, 2496]
    - [2, 21.31]
  - - [2496, 2496, 1, 1024, 2496, 2496, 2496, 2496]
    - [2, 21.5]
  - - [2624, 2496, 1, 1024, 2624, 2624, 2624, 2496]
    - [2, 21.417]
  - - [2752, 2496, 1, 1024, 2752, 2752, 2752, 2496]
    - [2, 21.207]
  - - [2880, 2496, 1, 1024, 2880, 2880, 2880, 2496]
    - [2, 21.404]
  - - [3008, 2496, 1, 1024, 3008, 3008, 3008, 2496]
    - [2, 21.229]
  - - [3136, 2496, 1, 1024, 3136, 3136, 3136, 2496]
    - [2, 21.36]
  - - [3264, 2496, 1, 1024, 3264, 3264, 3264, 2496]
    - [2, 21.471]
  - - [3392, 2496, 1, 1024, 3392, 3392, 3392, 2496]
    - [2, 21.496]
  - - [3520, 2496, 1, 1024, 3520, 3520, 3520, 2496]
    - [2, 21.482]
  - - [3648, 2496, 1, 1024, 3648, 3648, 3648, 2496]
    - [2, 21.467]
  - - [3776, 2496, 1, 1024, 3776, 3776, 3776, 2496]
    - [2, 21.472]
  - - [3904, 2496, 1, 1024, 3904, 3904, 3904, 2496]
    - [2, 21.504]
  - - [4032, 2496, 1, 1024, 4032, 4032, 4032, 2496]
    - [2, 21.496]
  - - [64, 2624, 1, 1024, 64, 64, 64, 2624]
    - [2, 14.845]
  - - [192, 2624, 1, 1024, 192, 192, 192, 2624]
    - [3, 19.752]
  - - [320, 2624, 1, 1024, 320, 320, 320, 2624]
    - [0, 19.856]
  - - [448, 2624, 1, 1024, 448, 448, 448, 2624]
    - [0, 20.452]
  - - [576, 2624, 1, 1024, 576, 576, 576, 2624]
    - [2, 21.043]
  - - [704, 2624, 1, 1024, 704, 704, 704, 2624]
    - [2, 20.734]
  - - [832, 2624, 1, 1024, 832, 832, 832, 2624]
    - [2, 21.096]
  - - [960, 2624, 1, 1024, 960, 960, 960, 2624]
    - [2, 21.024]
  - - [1088, 2624, 1, 1024, 1088, 1088, 1088, 2624]
    - [2, 21.248]
  - - [1216, 2624, 1, 1024, 1216, 1216, 1216, 2624]
    - [2, 21.045]
  - - [1344, 2624, 1, 1024, 1344, 1344, 1344, 2624]
    - [2, 21.25]
  - - [1472, 2624, 1, 1024, 1472, 1472, 1472, 2624]
    - [2, 20.856]
  - - [1600, 2624, 1, 1024, 1600, 1600, 1600, 2624]
    - [2, 21.42]
  - - [1728, 2624, 1, 1024, 1728, 1728, 1728, 2624]
    - [2, 21.243]
  - - [1856, 2624, 1, 1024, 1856, 1856, 1856, 2624]
    - [2, 21.194]
  - - [1984, 2624, 1, 1024, 1984, 1984, 1984, 2624]
    - [2, 21.228]
  - - [2112, 2624, 1, 1024, 2112, 2112, 2112, 2624]
    - [2, 21.215]
  - - [2240, 2624, 1, 1024, 2240, 2240, 2240, 2624]
    - [2, 21.318]
  - - [2368, 2624, 1, 1024, 2368, 2368, 2368, 2624]
    - [2, 21.339]
  - - [2496, 2624, 1, 1024, 2496, 2496, 2496, 2624]
    - [2, 21.384]
  - - [2624, 2624, 1, 1024, 2624, 2624, 2624, 2624]
    - [2, 21.244]
  - - [2752, 2624, 1, 1024, 2752, 2752, 2752, 2624]
    - [2, 21.624]
  - - [2880, 2624, 1, 1024, 2880, 2880, 2880, 2624]
    - [2, 21.484]
  - - [3008, 2624, 1, 1024, 3008, 3008, 3008, 2624]
    - [2, 21.311]
  - - [3136, 2624, 1, 1024, 3136, 3136, 3136, 2624]
    - [2, 21.499]
  - - [3264, 2624, 1, 1024, 3264, 3264, 3264, 2624]
    - [2, 21.409]
  - - [3392, 2624, 1, 1024, 3392, 3392, 3392, 2624]
    - [2, 21.519]
  - - [3520, 2624, 1, 1024, 3520, 3520, 3520, 2624]
    - [2, 21.477]
  - - [3648, 2624, 1, 1024, 3648, 3648, 3648, 2624]
    - [2, 21.492]
  - - [3776, 2624, 1, 1024, 3776, 3776, 3776, 2624]
    - [2, 21.538]
  - - [3904, 2624, 1, 1024, 3904, 3904, 3904, 2624]
    - [2, 21.641]
  - - [4032, 2624, 1, 1024, 4032, 4032, 4032, 2624]
    - [2, 21.469]
  - - [64, 2752, 1, 1024, 64, 64, 64, 2752]
    - [0, 15.198]
  - - [192, 2752, 1, 1024, 192, 192, 192, 2752]
    - [0, 19.862]
  - - [320, 2752, 1, 1024, 320, 320, 320, 2752]
    - [0, 20.504]
  - - [448, 2752, 1, 1024, 448, 448, 448, 2752]
    - [2, 20.419]
  - - [576, 2752, 1, 1024, 576, 576, 576, 2752]
    - [2, 20.471]
  - - [704, 2752, 1, 1024, 704, 704, 704, 2752]
    - [2, 20.902]
  - - [832, 2752, 1, 1024, 832, 832, 832, 2752]
    - [2, 20.962]
  - - [960, 2752, 1, 1024, 960, 960, 960, 2752]
    - [2, 21.027]
  - - [1088, 2752, 1, 1024, 1088, 1088, 1088, 2752]
    - [2, 21.19]
  - - [1216, 2752, 1, 1024, 1216, 1216, 1216, 2752]
    - [2, 21.297]
  - - [1344, 2752, 1, 1024, 1344, 1344, 1344, 2752]
    - [2, 21.113]
  - - [1472, 2752, 1, 1024, 1472, 1472, 1472, 2752]
    - [2, 21.329]
  - - [1600, 2752, 1, 1024, 1600, 1600, 1600, 2752]
    - [2, 21.093]
  - - [1728, 2752, 1, 1024, 1728, 1728, 1728, 2752]
    - [2, 21.108]
  - - [1856, 2752, 1, 1024, 1856, 1856, 1856, 2752]
    - [2, 21.154]
  - - [1984, 2752, 1, 1024, 1984, 1984, 1984, 2752]
    - [2, 21.273]
  - - [2112, 2752, 1, 1024, 2112, 2112, 2112, 2752]
    - [2, 21.291]
  - - [2240, 2752, 1, 1024, 2240, 2240, 2240, 2752]
    - [2, 21.307]
  - - [2368, 2752, 1, 1024, 2368, 2368, 2368, 2752]
    - [2, 21.385]
  - - [2496, 2752, 1, 1024, 2496, 2496, 2496, 2752]
    - [2, 21.597]
  - - [2624, 2752, 1, 1024, 2624, 2624, 2624, 2752]
    - [2, 21.557]
  - - [2752, 2752, 1, 1024, 2752, 2752, 2752, 2752]
    - [2, 21.433]
  - - [2880, 2752, 1, 1024, 2880, 2880, 2880, 2752]
    - [2, 21.472]
  - - [3008, 2752, 1, 1024, 3008, 3008, 3008, 2752]
    - [2, 21.804]
  - - [3136, 2752, 1, 1024, 3136, 3136, 3136, 2752]
    - [2, 21.411]
  - - [3264, 2752, 1, 1024, 3264, 3264, 3264, 2752]
    - [2, 21.632]
  - - [3392, 2752, 1, 1024, 3392, 3392, 3392, 2752]
    - [2, 21.597]
  - - [3520, 2752, 1, 1024, 3520, 3520, 3520, 2752]
    - [2, 21.611]
  - - [3648, 2752, 1, 1024, 3648, 3648, 3648, 2752]
    - [2, 21.532]
  - - [3776, 2752, 1, 1024, 3776, 3776, 3776, 2752]
    - [2, 21.519]
  - - [3904, 2752, 1, 1024, 3904, 3904, 3904, 2752]
    - [2, 21.733]
  - - [4032, 2752, 1, 1024, 4032, 4032, 4032, 2752]
    - [2, 21.642]
  - - [64, 2880, 1, 1024, 64, 64, 64, 2880]
    - [3, 15.503]
  - - [192, 2880, 1, 1024, 192, 192, 192, 2880]
    - [0, 19.744]
  - - [320, 2880, 1, 1024, 320, 320, 320, 2880]
    - [0, 20.122]
  - - [448, 2880, 1, 1024, 448, 448, 448, 2880]
    - [2, 20.515]
  - - [576, 2880, 1, 1024, 576, 576, 576, 2880]
    - [2, 20.767]
  - - [704, 2880, 1, 1024, 704, 704, 704, 2880]
    - [2, 20.907]
  - - [832, 2880, 1, 1024, 832, 832, 832, 2880]
    - [2, 21.004]
  - - [960, 2880, 1, 1024, 960, 960, 960, 2880]
    - [2, 21.18]
  - - [1088, 2880, 1, 1024, 1088, 1088, 1088, 2880]
    - [2, 20.919]
  - - [1216, 2880, 1, 1024, 1216, 1216, 1216, 2880]
    - [2, 21.307]
  - - [1344, 2880, 1, 1024, 1344, 1344, 1344, 2880]
    - [2, 21.164]
  - - [1472, 2880, 1, 1024, 1472, 1472, 1472, 2880]
    - [2, 21.485]
  - - [1600, 2880, 1, 1024, 1600, 1600, 1600, 2880]
    - [2, 21.192]
  - - [1728, 2880, 1, 1024, 1728, 1728, 1728, 2880]
    - [2, 21.249]
  - - [1856, 2880, 1, 1024, 1856, 1856, 1856, 2880]
    - [2, 21.349]
  - - [1984, 2880, 1, 1024, 1984, 1984, 1984, 2880]
    - [2, 21.145]
  - - [2112, 2880, 1, 1024, 2112, 2112, 2112, 2880]
    - [2, 21.255]
  - - [2240, 2880, 1, 1024, 2240, 2240, 2240, 2880]
    - [2, 21.273]
  - - [2368, 2880, 1, 1024, 2368, 2368, 2368, 2880]
    - [2, 21.354]
  - - [2496, 2880, 1, 1024, 2496, 2496, 2496, 2880]
    - [2, 21.382]
  - - [2624, 2880, 1, 1024, 2624, 2624, 2624, 2880]
    - [2, 21.483]
  - - [2752, 2880, 1, 1024, 2752, 2752, 2752, 2880]
    - [0, 21.502]
  - - [2880, 2880, 1, 1024, 2880, 2880, 2880, 2880]
    - [2, 21.451]
  - - [3008, 2880, 1, 1024, 3008, 3008, 3008, 2880]
    - [2, 21.333]
  - - [3136, 2880, 1, 1024, 3136, 3136, 3136, 2880]
    - [2, 21.505]
  - - [3264, 2880, 1, 1024, 3264, 3264, 3264, 2880]
    - [2, 21.44]
  - - [3392, 2880, 1, 1024, 3392, 3392, 3392, 2880]
    - [2, 21.595]
  - - [3520, 2880, 1, 1024, 3520, 3520, 3520, 2880]
    - [2, 21.574]
  - - [3648, 2880, 1, 1024, 3648, 3648, 3648, 2880]
    - [2, 21.52]
  - - [3776, 2880, 1, 1024, 3776, 3776, 3776, 2880]
    - [2, 21.53]
  - - [3904, 2880, 1, 1024, 3904, 3904, 3904, 2880]
    - [2, 21.66]
  - - [4032, 2880, 1, 1024, 4032, 4032, 4032, 2880]
    - [2, 21.772]
  - - [64, 3008, 1, 1024, 64, 64, 64, 3008]
    - [0, 16.553]
  - - [192, 3008, 1, 1024, 192, 192, 192, 3008]
    - [0, 19.972]
  - - [320, 3008, 1, 1024, 320, 320, 320, 3008]
    - [2, 20.195]
  - - [448, 3008, 1, 1024, 448, 448, 448, 3008]
    - [3, 21.098]
  - - [576, 3008, 1, 1024, 576, 576, 576, 3008]
    - [2, 21.067]
  - - [704, 3008, 1, 1024, 704, 704, 704, 3008]
    - [2, 21.354]
  - - [832, 3008, 1, 1024, 832, 832, 832, 3008]
    - [2, 21.14]
  - - [960, 3008, 1, 1024, 960, 960, 960, 3008]
    - [2, 21.228]
  - - [1088, 3008, 1, 1024, 1088, 1088, 1088, 3008]
    - [2, 21.407]
  - - [1216, 3008, 1, 1024, 1216, 1216, 1216, 3008]
    - [2, 21.183]
  - - [1344, 3008, 1, 1024, 1344, 1344, 1344, 3008]
    - [2, 21.21]
  - - [1472, 3008, 1, 1024, 1472, 1472, 1472, 3008]
    - [2, 21.183]
  - - [1600, 3008, 1, 1024, 1600, 1600, 1600, 3008]
    - [2, 21.237]
  - - [1728, 3008, 1, 1024, 1728, 1728, 1728, 3008]
    - [2, 21.159]
