library/src/amd_detail/rocblaslt/src/Tensile/Logic/asm_full/navi33/GridBased/navi33_Cijk_Alik_Bljk_BBS_BH_Bias_HAS_SAV_UserArgs.yaml
- {MinimumRequiredVersion: 4.33.0}
- navi33
- gfx1102
- [Device 73f0]
    SolutionIndex: 0
    SolutionNameMin: Cijk_Alik_Bljk_BBS_BH_Bias_AuxB_HAS_SAV_UserArgs_MT32x32x32_MI16x16x1_SN_LDSB0_GRVWA8_GRVWB8_GSU1_LBSPPA128_LBSPPB128_MIWT1_1_SS0_SU32_SUM0_SUS256_TLDS1_WG32_4_1_WGM8
    SolutionIndex: 1
    SolutionNameMin: Cijk_Alik_Bljk_BBS_BH_Bias_AuxB_HAS_SAV_UserArgs_MT32x32x32_MI16x16x1_SN_LDSB0_GRVWA1_GRVWB8_GSU1_LBSPPA128_LBSPPB128_MIWT1_1_SS0_SU32_SUM0_SUS256_TLDS1_WG32_4_1_WGM8
    SolutionIndex: 2
    SolutionNameMin: Cijk_Alik_Bljk_BBS_BH_Bias_AuxB_HAS_SAV_UserArgs_MT32x32x32_MI16x16x1_SN_LDSB0_GRVWA8_GRVWB1_GSU1_LBSPPA128_LBSPPB128_MIWT1_1_SS0_SU32_SUM0_SUS256_TLDS1_WG32_4_1_WGM8
    SolutionIndex: 3
    SolutionNameMin: Cijk_Alik_Bljk_BBS_BH_Bias_AuxB_HAS_SAV_UserArgs_MT32x32x32_MI16x16x1_SN_LDSB0_GRVWA8_GRVWB8_GSU4_LBSPPA128_LBSPPB128_MIWT1_1_SS0_SU32_SUM0_SUS256_TLDS1_WG32_4_1_WGM8
    SolutionIndex: 4
    SolutionNameMin: Cijk_Alik_Bljk_BBS_BH_Bias_AuxB_HAS_SAV_UserArgs_MT16x64x64_MI16x16x1_SN_LDSB0_GRVWA8_GRVWB8_GSU1_LBSPPA512_LBSPPB2048_MIWT1_1_SS0_SU32_SUM0_SUS256_TLDS0_WG16_8_1_WGM8
    SolutionIndex: 5
    SolutionNameMin: Cijk_Alik_Bljk_BBS_BH_Bias_AuxB_HAS_SAV_UserArgs_MT64x16x32_MI16x16x1_SN_LDSB0_GRVWA8_GRVWB4_GSU1_LBSPPA2048_LBSPPB512_MIWT1_1_SS1_SU32_SUM0_SUS256_TLDS0_WG64_2_1_WGM8
    SolutionIndex: 6
    SolutionNameMin: Cijk_Alik_Bljk_BBS_BH_Bias_AuxB_HAS_SAV_UserArgs_MT64x16x32_MI16x16x1_SN_LDSB0_GRVWA1_GRVWB4_GSU1_LBSPPA128_LBSPPB128_MIWT1_1_SS1_SU32_SUM0_SUS256_TLDS1_WG64_2_1_WGM8
    SolutionIndex: 7
    SolutionNameMin: Cijk_Alik_Bljk_BBS_BH_Bias_AuxB_HAS_SAV_UserArgs_MT64x16x32_MI16x16x1_SN_LDSB0_GRVWA8_GRVWB1_GSU1_LBSPPA2048_LBSPPB512_MIWT1_1_SS1_SU32_SUM0_SUS256_TLDS0_WG64_2_1_WGM8
    SolutionIndex: 8
    SolutionNameMin: Cijk_Alik_Bljk_BBS_BH_Bias_AuxB_HAS_SAV_UserArgs_MT64x16x32_MI16x16x1_SN_LDSB0_GRVWA1_GRVWB1_GSU1_LBSPPA128_LBSPPB128_MIWT1_1_SS1_SU32_SUM0_SUS256_TLDS1_WG64_2_1_WGM8
    SolutionIndex: 9
    SolutionNameMin: Cijk_Alik_Bljk_BBS_BH_Bias_AuxB_HAS_SAV_UserArgs_MT256x16x32_MI16x16x1_SN_LDSB1_GRVWA8_GRVWB4_GSU1_LBSPPA8192_LBSPPB512_MIWT4_1_SS1_SU32_SUM0_SUS256_TLDS0_WG64_2_1_WGM8
    SolutionIndex: 10
    SolutionNameMin: Cijk_Alik_Bljk_BBS_BH_Bias_AuxB_HAS_SAV_UserArgs_MT256x16x32_MI16x16x1_SN_LDSB1_GRVWA8_GRVWB1_GSU1_LBSPPA8192_LBSPPB512_MIWT4_1_SS1_SU32_SUM0_SUS256_TLDS0_WG64_2_1_WGM8
    SolutionIndex: 11
    SolutionNameMin: Cijk_Alik_Bljk_BBS_BH_Bias_AuxB_HAS_SAV_UserArgs_MT32x32x32_MI16x16x1_SN_LDSB0_GRVWA8_GRVWB8_GSU1_LBSPPA128_LBSPPB128_MIWT1_1_SS1_SU32_SUM0_SUS256_TLDS1_WG32_4_1_WGM8
    SolutionIndex: 12
    SolutionNameMin: Cijk_Alik_Bljk_BBS_BH_Bias_AuxB_HAS_SAV_UserArgs_MT32x32x32_MI16x16x1_SN_LDSB0_GRVWA1_GRVWB8_GSU1_LBSPPA128_LBSPPB128_MIWT1_1_SS1_SU32_SUM0_SUS256_TLDS1_WG32_4_1_WGM8
    SolutionIndex: 13
    SolutionNameMin: Cijk_Alik_Bljk_BBS_BH_Bias_AuxB_HAS_SAV_UserArgs_MT32x32x32_MI16x16x1_SN_LDSB0_GRVWA8_GRVWB1_GSU1_LBSPPA1024_LBSPPB1024_MIWT1_1_SS1_SU32_SUM0_SUS256_TLDS0_WG32_4_1_WGM8
    SolutionIndex: 14
    SolutionNameMin: Cijk_Alik_Bljk_BBS_BH_Bias_AuxB_HAS_SAV_UserArgs_MT32x32x32_MI16x16x1_SN_LDSB0_GRVWA8_GRVWB1_GSU1_LBSPPA128_LBSPPB128_MIWT1_1_SS1_SU32_SUM0_SUS256_TLDS1_WG32_4_1_WGM8
    SolutionIndex: 15
    SolutionNameMin: Cijk_Alik_Bljk_BBS_BH_Bias_AuxB_HAS_SAV_UserArgs_MT32x32x32_MI16x16x1_SN_LDSB0_GRVWA1_GRVWB1_GSU1_LBSPPA128_LBSPPB128_MIWT1_1_SS1_SU32_SUM0_SUS256_TLDS1_WG32_4_1_WGM8
    SolutionIndex: 16
    SolutionNameMin: Cijk_Alik_Bljk_BBS_BH_Bias_AuxB_HAS_SAV_UserArgs_MT32x32x32_MI16x16x1_SN_LDSB0_GRVWA8_GRVWB8_GSU4_LBSPPA128_LBSPPB128_MIWT1_1_SS1_SU32_SUM0_SUS256_TLDS1_WG32_4_1_WGM8
    SolutionIndex: 17
    SolutionNameMin: Cijk_Alik_Bljk_BBS_BH_Bias_AuxB_HAS_SAV_UserArgs_MT64x32x32_MI16x16x1_SN_LDSB0_GRVWA8_GRVWB8_GSU1_LBSPPA2048_LBSPPB1024_MIWT2_1_SS1_SU32_SUM0_SUS256_TLDS0_WG32_4_1_WGM8
    SolutionIndex: 18
    SolutionNameMin: Cijk_Alik_Bljk_BBS_BH_Bias_AuxB_HAS_SAV_UserArgs_MT64x32x32_MI16x16x1_SN_LDSB0_GRVWA1_GRVWB8_GSU1_LBSPPA128_LBSPPB128_MIWT2_1_SS1_SU32_SUM0_SUS256_TLDS1_WG32_4_1_WGM8
    SolutionIndex: 19
    SolutionNameMin: Cijk_Alik_Bljk_BBS_BH_Bias_AuxB_HAS_SAV_UserArgs_MT64x32x32_MI16x16x1_SN_LDSB0_GRVWA8_GRVWB1_GSU1_LBSPPA2048_LBSPPB1024_MIWT2_1_SS1_SU32_SUM0_SUS256_TLDS0_WG32_4_1_WGM8
    SolutionIndex: 20
    SolutionNameMin: Cijk_Alik_Bljk_BBS_BH_Bias_AuxB_HAS_SAV_UserArgs_MT64x32x32_MI16x16x1_SN_LDSB0_GRVWA1_GRVWB1_GSU1_LBSPPA128_LBSPPB128_MIWT2_1_SS1_SU32_SUM0_SUS256_TLDS1_WG32_4_1_WGM8
    SolutionIndex: 21
    SolutionNameMin: Cijk_Alik_Bljk_BBS_BH_Bias_AuxB_HAS_SAV_UserArgs_MT96x32x32_MI16x16x1_SN_LDSB0_GRVWA8_GRVWB8_GSU1_LBSPPA128_LBSPPB128_MIWT3_1_SS1_SU32_SUM0_SUS256_TLDS1_WG32_4_1_WGM8
    SolutionIndex: 22
    SolutionNameMin: Cijk_Alik_Bljk_BBS_BH_Bias_AuxB_HAS_SAV_UserArgs_MT96x32x32_MI16x16x1_SN_LDSB0_GRVWA8_GRVWB1_GSU1_LBSPPA128_LBSPPB128_MIWT3_1_SS1_SU32_SUM0_SUS256_TLDS1_WG32_4_1_WGM8
    SolutionIndex: 23
    SolutionNameMin: Cijk_Alik_Bljk_BBS_BH_Bias_AuxB_HAS_SAV_UserArgs_MT96x32x32_MI16x16x1_SN_LDSB0_GRVWA8_GRVWB8_GSU4_LBSPPA128_LBSPPB128_MIWT3_1_SS1_SU32_SUM0_SUS256_TLDS1_WG32_4_1_WGM8
    SolutionIndex: 24
    SolutionNameMin: Cijk_Alik_Bljk_BBS_BH_Bias_AuxB_HAS_SAV_UserArgs_MT160x32x32_MI16x16x1_SN_LDSB0_GRVWA8_GRVWB8_GSU1_LBSPPA128_LBSPPB128_MIWT5_1_SS1_SU32_SUM0_SUS256_TLDS1_WG32_4_1_WGM8
    SolutionIndex: 25
    SolutionNameMin: Cijk_Alik_Bljk_BBS_BH_Bias_AuxB_HAS_SAV_UserArgs_MT224x32x32_MI16x16x1_SN_LDSB1_GRVWA8_GRVWB8_GSU1_LBSPPA128_LBSPPB128_MIWT7_1_SS1_SU32_SUM0_SUS256_TLDS1_WG32_4_1_WGM8
    SolutionIndex: 26
    SolutionNameMin: Cijk_Alik_Bljk_BBS_BH_Bias_AuxB_HAS_SAV_UserArgs_MT224x32x32_MI16x16x1_SN_LDSB1_GRVWA8_GRVWB1_GSU1_LBSPPA128_LBSPPB128_MIWT7_1_SS1_SU32_SUM0_SUS256_TLDS1_WG32_4_1_WGM8
    SolutionIndex: 27
    SolutionNameMin: Cijk_Alik_Bljk_BBS_BH_Bias_AuxB_HAS_SAV_UserArgs_MT64x48x32_MI16x16x1_SN_LDSB0_GRVWA1_GRVWB1_GSU1_LBSPPA128_LBSPPB128_MIWT1_3_SS1_SU32_SUM0_SUS256_TLDS1_WG64_2_1_WGM8
    SolutionIndex: 28
    SolutionNameMin: Cijk_Alik_Bljk_BBS_BH_Bias_AuxB_HAS_SAV_UserArgs_MT128x48x32_MI16x16x1_SN_LDSB0_GRVWA1_GRVWB1_GSU1_LBSPPA128_LBSPPB128_MIWT2_3_SS1_SU32_SUM0_SUS256_TLDS1_WG64_2_1_WGM8
    SolutionIndex: 29
    SolutionNameMin: Cijk_Alik_Bljk_BBS_BH_Bias_AuxB_HAS_SAV_UserArgs_MT16x64x32_MI16x16x1_SN_LDSB0_GRVWA4_GRVWB8_GSU1_LBSPPA512_LBSPPB2048_MIWT1_1_SS1_SU32_SUM0_SUS256_TLDS0_WG16_8_1_WGM8
    SolutionIndex: 30
    SolutionNameMin: Cijk_Alik_Bljk_BBS_BH_Bias_AuxB_HAS_SAV_UserArgs_MT16x64x32_MI16x16x1_SN_LDSB0_GRVWA4_GRVWB1_GSU1_LBSPPA128_LBSPPB128_MIWT1_1_SS1_SU32_SUM0_SUS256_TLDS1_WG16_8_1_WGM8
    SolutionIndex: 31
    SolutionNameMin: Cijk_Alik_Bljk_BBS_BH_Bias_AuxB_HAS_SAV_UserArgs_MT16x64x32_MI16x16x1_SN_LDSB0_GRVWA1_GRVWB1_GSU1_LBSPPA128_LBSPPB128_MIWT1_1_SS1_SU32_SUM0_SUS256_TLDS1_WG16_8_1_WGM8
    SolutionIndex: 32
    SolutionNameMin: Cijk_Alik_Bljk_BBS_BH_Bias_AuxB_HAS_SAV_UserArgs_MT32x64x32_MI16x16x1_SN_LDSB0_GRVWA8_GRVWB8_GSU1_LBSPPA1024_LBSPPB2048_MIWT2_1_SS1_SU32_SUM0_SUS256_TLDS0_WG16_8_1_WGM8
    SolutionIndex: 33
    SolutionNameMin: Cijk_Alik_Bljk_BBS_BH_Bias_AuxB_HAS_SAV_UserArgs_MT32x64x32_MI16x16x1_SN_LDSB0_GRVWA8_GRVWB1_GSU1_LBSPPA128_LBSPPB128_MIWT2_1_SS1_SU32_SUM0_SUS256_TLDS1_WG16_8_1_WGM8
    SolutionIndex: 34
    SolutionNameMin: Cijk_Alik_Bljk_BBS_BH_Bias_AuxB_HAS_SAV_UserArgs_MT32x64x32_MI16x16x1_SN_LDSB0_GRVWA1_GRVWB1_GSU1_LBSPPA128_LBSPPB128_MIWT2_1_SS1_SU32_SUM0_SUS256_TLDS1_WG16_8_1_WGM8
    SolutionIndex: 35
    SolutionNameMin: Cijk_Alik_Bljk_BBS_BH_Bias_AuxB_HAS_SAV_UserArgs_MT48x64x32_MI16x16x1_SN_LDSB0_GRVWA4_GRVWB1_GSU1_LBSPPA128_LBSPPB128_MIWT3_1_SS1_SU32_SUM0_SUS256_TLDS1_WG16_8_1_WGM8
    SolutionIndex: 36
    SolutionNameMin: Cijk_Alik_Bljk_BBS_BH_Bias_AuxB_HAS_SAV_UserArgs_MT48x64x32_MI16x16x1_SN_LDSB0_GRVWA4_GRVWB1_GSU4_LBSPPA128_LBSPPB128_MIWT3_1_SS1_SU32_SUM0_SUS256_TLDS1_WG16_8_1_WGM8
    SolutionIndex: 37
    SolutionNameMin: Cijk_Alik_Bljk_BBS_BH_Bias_AuxB_HAS_SAV_UserArgs_MT80x64x32_MI16x16x1_SN_LDSB0_GRVWA4_GRVWB1_GSU1_LBSPPA128_LBSPPB128_MIWT5_1_SS1_SU32_SUM0_SUS256_TLDS1_WG16_8_1_WGM8
    SolutionIndex: 38
    SolutionNameMin: Cijk_Alik_Bljk_BBS_BH_Bias_AuxB_HAS_SAV_UserArgs_MT64x80x32_MI16x16x1_SN_LDSB0_GRVWA1_GRVWB4_GSU1_LBSPPA128_LBSPPB128_MIWT1_5_SS1_SU32_SUM0_SUS256_TLDS1_WG64_2_1_WGM8
    SolutionIndex: 39
    SolutionNameMin: Cijk_Alik_Bljk_BBS_BH_Bias_AuxB_HAS_SAV_UserArgs_MT32x96x32_MI16x16x1_SN_LDSB0_GRVWA8_GRVWB8_GSU1_LBSPPA128_LBSPPB128_MIWT1_3_SS1_SU32_SUM0_SUS256_TLDS1_WG32_4_1_WGM8
    SolutionIndex: 40
    SolutionNameMin: Cijk_Alik_Bljk_BBS_BH_Bias_AuxB_HAS_SAV_UserArgs_MT32x96x32_MI16x16x1_SN_LDSB0_GRVWA1_GRVWB8_GSU1_LBSPPA128_LBSPPB128_MIWT1_3_SS1_SU32_SUM0_SUS256_TLDS1_WG32_4_1_WGM8
    SolutionIndex: 41
    SolutionNameMin: Cijk_Alik_Bljk_BBS_BH_Bias_AuxB_HAS_SAV_UserArgs_MT64x96x32_MI16x16x1_SN_LDSB0_GRVWA8_GRVWB8_GSU1_LBSPPA2048_LBSPPB3072_MIWT2_3_SS1_SU32_SUM0_SUS256_TLDS0_WG32_4_1_WGM8
    SolutionIndex: 42
    SolutionNameMin: Cijk_Alik_Bljk_BBS_BH_Bias_AuxB_HAS_SAV_UserArgs_MT64x96x32_MI16x16x1_SN_LDSB0_GRVWA1_GRVWB8_GSU1_LBSPPA128_LBSPPB128_MIWT2_3_SS1_SU32_SUM0_SUS256_TLDS1_WG32_4_1_WGM8
    SolutionIndex: 43
    SolutionNameMin: Cijk_Alik_Bljk_BBS_BH_Bias_AuxB_HAS_SAV_UserArgs_MT64x96x32_MI16x16x1_SN_LDSB0_GRVWA1_GRVWB8_GSU4_LBSPPA128_LBSPPB128_MIWT2_3_SS1_SU32_SUM0_SUS256_TLDS1_WG32_4_1_WGM8
    SolutionIndex: 44
    SolutionNameMin: Cijk_Alik_Bljk_BBS_BH_Bias_AuxB_HAS_SAV_UserArgs_MT96x96x32_MI16x16x1_SN_LDSB0_GRVWA8_GRVWB8_GSU1_LBSPPA128_LBSPPB128_MIWT3_3_SS1_SU32_SUM0_SUS256_TLDS1_WG32_4_1_WGM8
    SolutionIndex: 45
    SolutionNameMin: Cijk_Alik_Bljk_BBS_BH_Bias_AuxB_HAS_SAV_UserArgs_MT96x96x32_MI16x16x1_SN_LDSB0_GRVWA1_GRVWB8_GSU1_LBSPPA128_LBSPPB128_MIWT3_3_SS1_SU32_SUM0_SUS256_TLDS1_WG32_4_1_WGM8
    SolutionIndex: 46
    SolutionNameMin: Cijk_Alik_Bljk_BBS_BH_Bias_AuxB_HAS_SAV_UserArgs_MT96x96x32_MI16x16x1_SN_LDSB0_GRVWA8_GRVWB1_GSU1_LBSPPA128_LBSPPB128_MIWT3_3_SS1_SU32_SUM0_SUS256_TLDS1_WG32_4_1_WGM8
    SolutionIndex: 47
    SolutionNameMin: Cijk_Alik_Bljk_BBS_BH_Bias_AuxB_HAS_SAV_UserArgs_MT96x96x32_MI16x16x1_SN_LDSB0_GRVWA8_GRVWB8_GSU2_LBSPPA128_LBSPPB128_MIWT3_3_SS1_SU32_SUM0_SUS256_TLDS1_WG32_4_1_WGM8
    SolutionIndex: 48
    SolutionNameMin: Cijk_Alik_Bljk_BBS_BH_Bias_AuxB_HAS_SAV_UserArgs_MT96x96x32_MI16x16x1_SN_LDSB0_GRVWA8_GRVWB8_GSU4_LBSPPA128_LBSPPB128_MIWT3_3_SS1_SU32_SUM0_SUS256_TLDS1_WG32_4_1_WGM8
    SolutionIndex: 49
    SolutionNameMin: Cijk_Alik_Bljk_BBS_BH_Bias_AuxB_HAS_SAV_UserArgs_MT48x128x32_MI16x16x1_SN_LDSB0_GRVWA1_GRVWB1_GSU1_LBSPPA128_LBSPPB128_MIWT3_2_SS1_SU32_SUM0_SUS256_TLDS1_WG16_8_1_WGM8
    SolutionIndex: 50
    SolutionNameMin: Cijk_Alik_Bljk_BBS_BH_Bias_AuxB_HAS_SAV_UserArgs_MT32x160x32_MI16x16x1_SN_LDSB0_GRVWA8_GRVWB8_GSU1_LBSPPA128_LBSPPB128_MIWT1_5_SS1_SU32_SUM0_SUS256_TLDS1_WG32_4_1_WGM8
    SolutionIndex: 51
    SolutionNameMin: Cijk_Alik_Bljk_BBS_BH_Bias_AuxB_HAS_SAV_UserArgs_MT32x160x32_MI16x16x1_SN_LDSB0_GRVWA1_GRVWB8_GSU1_LBSPPA128_LBSPPB128_MIWT1_5_SS1_SU32_SUM0_SUS256_TLDS1_WG32_4_1_WGM8
    SolutionIndex: 52
    SolutionNameMin: Cijk_Alik_Bljk_BBS_BH_Bias_AuxB_HAS_SAV_UserArgs_MT64x160x32_MI16x16x1_SN_LDSB1_GRVWA1_GRVWB8_GSU1_LBSPPA128_LBSPPB128_MIWT2_5_SS1_SU32_SUM0_SUS256_TLDS1_WG32_4_1_WGM8
    SolutionIndex: 53
    SolutionNameMin: Cijk_Alik_Bljk_BBS_BH_Bias_AuxB_HAS_SAV_UserArgs_MT64x160x32_MI16x16x1_SN_LDSB1_GRVWA1_GRVWB8_GSU2_LBSPPA128_LBSPPB128_MIWT2_5_SS1_SU32_SUM0_SUS256_TLDS1_WG32_4_1_WGM8
    SolutionIndex: 54
    SolutionNameMin: Cijk_Alik_Bljk_BBS_BH_Bias_AuxB_HAS_SAV_UserArgs_MT64x160x32_MI16x16x1_SN_LDSB1_GRVWA1_GRVWB8_GSU4_LBSPPA128_LBSPPB128_MIWT2_5_SS1_SU32_SUM0_SUS256_TLDS1_WG32_4_1_WGM8
    SolutionIndex: 55
    SolutionNameMin: Cijk_Alik_Bljk_BBS_BH_Bias_AuxB_HAS_SAV_UserArgs_MT32x224x32_MI16x16x1_SN_LDSB1_GRVWA8_GRVWB8_GSU1_LBSPPA128_LBSPPB128_MIWT1_7_SS1_SU32_SUM0_SUS256_TLDS1_WG32_4_1_WGM8
    SolutionIndex: 56
    SolutionNameMin: Cijk_Alik_Bljk_BBS_BH_Bias_AuxB_HAS_SAV_UserArgs_MT32x224x32_MI16x16x1_SN_LDSB1_GRVWA1_GRVWB8_GSU1_LBSPPA128_LBSPPB128_MIWT1_7_SS1_SU32_SUM0_SUS256_TLDS1_WG32_4_1_WGM8
    SolutionIndex: 57
    SolutionNameMin: Cijk_Alik_Bljk_BBS_BH_Bias_AuxB_HAS_SAV_UserArgs_MT64x16x64_MI16x16x1_SN_LDSB0_GRVWA8_GRVWB8_GSU1_LBSPPA2048_LBSPPB512_MIWT1_1_SS1_SU32_SUM0_SUS256_TLDS0_WG64_2_1_WGM8
    SolutionIndex: 58
    SolutionNameMin: Cijk_Alik_Bljk_BBS_BH_Bias_AuxB_HAS_SAV_UserArgs_MT64x16x64_MI16x16x1_SN_LDSB0_GRVWA1_GRVWB8_GSU1_LBSPPA128_LBSPPB128_MIWT1_1_SS1_SU32_SUM0_SUS256_TLDS1_WG64_2_1_WGM8
    SolutionIndex: 59
    SolutionNameMin: Cijk_Alik_Bljk_BBS_BH_Bias_AuxB_HAS_SAV_UserArgs_MT32x32x64_MI16x16x1_SN_LDSB0_GRVWA8_GRVWB8_GSU1_LBSPPA1024_LBSPPB1024_MIWT1_1_SS1_SU32_SUM0_SUS256_TLDS0_WG32_4_1_WGM8
    SolutionIndex: 60
    SolutionNameMin: Cijk_Alik_Bljk_BBS_BH_Bias_AuxB_HAS_SAV_UserArgs_MT32x32x64_MI16x16x1_SN_LDSB0_GRVWA8_GRVWB1_GSU1_LBSPPA1024_LBSPPB1024_MIWT1_1_SS1_SU32_SUM0_SUS256_TLDS0_WG32_4_1_WGM8
    SolutionIndex: 61
    SolutionNameMin: Cijk_Alik_Bljk_BBS_BH_Bias_AuxB_HAS_SAV_UserArgs_MT64x32x64_MI16x16x1_SN_LDSB0_GRVWA8_GRVWB8_GSU1_LBSPPA2048_LBSPPB1024_MIWT2_1_SS1_SU32_SUM0_SUS256_TLDS0_WG32_4_1_WGM8
    SolutionIndex: 62
    SolutionNameMin: Cijk_Alik_Bljk_BBS_BH_Bias_AuxB_HAS_SAV_UserArgs_MT16x64x64_MI16x16x1_SN_LDSB0_GRVWA8_GRVWB8_GSU1_LBSPPA512_LBSPPB2048_MIWT1_1_SS1_SU32_SUM0_SUS256_TLDS0_WG16_8_1_WGM8
    SolutionIndex: 63
    SolutionNameMin: Cijk_Alik_Bljk_BBS_BH_Bias_AuxB_HAS_SAV_UserArgs_MT16x64x64_MI16x16x1_SN_LDSB0_GRVWA8_GRVWB1_GSU1_LBSPPA128_LBSPPB128_MIWT1_1_SS1_SU32_SUM0_SUS256_TLDS1_WG16_8_1_WGM8
- - - [64, 64, 1, 64, 64, 64, 64, 64]
    - [4, 17.045]
  - - [192, 64, 1, 64, 192, 192, 64, 64]
    - [58, 53.775]
  - - [320, 64, 1, 64, 320, 320, 64, 64]
    - [11, 91.9836]
  - - [448, 64, 1, 64, 448, 448, 64, 64]
    - [11, 126.513]
  - - [576, 64, 1, 64, 576, 576, 64, 64]
    - [6, 170.846]
  - - [704, 64, 1, 64, 704, 704, 64, 64]
    - [14, 217.227]
  - - [832, 64, 1, 64, 832, 832, 64, 64]
    - [57, 244.126]
  - - [960, 64, 1, 64, 960, 960, 64, 64]
    - [62, 285.778]
  - - [64, 192, 1, 64, 64, 64, 64, 64]
    - [2, 53.7382]
  - - [192, 192, 1, 64, 192, 192, 64, 64]
    - [58, 171.716]
  - - [320, 192, 1, 64, 320, 320, 64, 64]
    - [61, 290.733]
  - - [448, 192, 1, 64, 448, 448, 64, 64]
    - [62, 396.773]
  - - [576, 192, 1, 64, 576, 576, 64, 64]
    - [30, 505.943]
  - - [704, 192, 1, 64, 704, 704, 64, 64]
    - [8, 605.371]
  - - [832, 192, 1, 64, 832, 832, 64, 64]
    - [61, 684.564]
  - - [960, 192, 1, 64, 960, 960, 64, 64]
    - [14, 812.458]
  - - [64, 320, 1, 64, 64, 64, 64, 64]
    - [12, 88.8624]
  - - [192, 320, 1, 64, 192, 192, 64, 64]
    - [62, 279.879]
  - - [320, 320, 1, 64, 320, 320, 64, 64]
    - [60, 460.888]
  - - [448, 320, 1, 64, 448, 448, 64, 64]
    - [15, 645.244]
  - - [576, 320, 1, 64, 576, 576, 64, 64]
    - [61, 800.874]
  - - [704, 320, 1, 64, 704, 704, 64, 64]
    - [34, 972.246]
  - - [832, 320, 1, 64, 832, 832, 64, 64]
    - [13, 1104.69]
  - - [960, 320, 1, 64, 960, 960, 64, 64]
    - [34, 1240.47]
  - - [64, 448, 1, 64, 64, 64, 64, 64]
    - [11, 126.64]
  - - [192, 448, 1, 64, 192, 192, 64, 64]
    - [62, 398.64]
  - - [320, 448, 1, 64, 320, 320, 64, 64]
    - [12, 642.083]
  - - [448, 448, 1, 64, 448, 448, 64, 64]
    - [11, 875.929]
  - - [576, 448, 1, 64, 576, 576, 64, 64]
    - [29, 1065.52]
  - - [704, 448, 1, 64, 704, 704, 64, 64]
    - [33, 1286.94]
  - - [832, 448, 1, 64, 832, 832, 64, 64]
    - [33, 1416.62]
  - - [960, 448, 1, 64, 960, 960, 64, 64]
    - [33, 1698.09]
  - - [64, 576, 1, 64, 64, 64, 64, 64]
    - [62, 169.496]
  - - [192, 576, 1, 64, 192, 192, 64, 64]
    - [31, 496.711]
  - - [320, 576, 1, 64, 320, 320, 64, 64]
    - [31, 801.691]
  - - [448, 576, 1, 64, 448, 448, 64, 64]
    - [27, 1080.16]
  - - [576, 576, 1, 64, 576, 576, 64, 64]
    - [22, 1360.7]
  - - [704, 576, 1, 64, 704, 704, 64, 64]
    - [32, 1574.82]
  - - [832, 576, 1, 64, 832, 832, 64, 64]
    - [18, 1832.79]
  - - [960, 576, 1, 64, 960, 960, 64, 64]
    - [42, 2069.01]
  - - [64, 704, 1, 64, 64, 64, 64, 64]
    - [63, 210.411]
  - - [192, 704, 1, 64, 192, 192, 64, 64]
    - [31, 609.015]
  - - [320, 704, 1, 64, 320, 320, 64, 64]
    - [18, 968.653]
  - - [448, 704, 1, 64, 448, 448, 64, 64]
    - [33, 1289.0]
  - - [576, 704, 1, 64, 576, 576, 64, 64]
    - [17, 1605.51]
  - - [704, 704, 1, 64, 704, 704, 64, 64]
    - [33, 1834.61]
  - - [832, 704, 1, 64, 832, 832, 64, 64]
    - [19, 2137.27]
  - - [960, 704, 1, 64, 960, 960, 64, 64]
    - [17, 2308.16]
  - - [64, 832, 1, 64, 64, 64, 64, 64]
    - [8, 246.777]
  - - [192, 832, 1, 64, 192, 192, 64, 64]
    - [18, 718.733]
  - - [320, 832, 1, 64, 320, 320, 64, 64]
    - [14, 1123.63]
  - - [448, 832, 1, 64, 448, 448, 64, 64]
    - [32, 1442.75]
  - - [576, 832, 1, 64, 576, 576, 64, 64]
    - [20, 1851.04]
  - - [704, 832, 1, 64, 704, 704, 64, 64]
    - [18, 2058.06]
  - - [832, 832, 1, 64, 832, 832, 64, 64]
    - [33, 2375.52]
  - - [960, 832, 1, 64, 960, 960, 64, 64]
    - [33, 2696.17]
  - - [64, 960, 1, 64, 64, 64, 64, 64]
    - [58, 283.001]
  - - [192, 960, 1, 64, 192, 192, 64, 64]
    - [35, 818.66]
  - - [320, 960, 1, 64, 320, 320, 64, 64]
    - [33, 1273.37]
  - - [448, 960, 1, 64, 448, 448, 64, 64]
    - [17, 1686.12]
  - - [576, 960, 1, 64, 576, 576, 64, 64]
    - [42, 2081.79]
  - - [704, 960, 1, 64, 704, 704, 64, 64]
    - [42, 2450.71]
  - - [832, 960, 1, 64, 832, 832, 64, 64]
    - [18, 2698.31]
  - - [960, 960, 1, 64, 960, 960, 64, 64]
    - [52, 3038.06]
  - - [64, 64, 1, 256, 64, 64, 256, 256]
    - [11, 68.5142]
  - - [192, 64, 1, 256, 192, 192, 256, 256]
    - [11, 205.207]
  - - [320, 64, 1, 256, 320, 320, 256, 256]
    - [11, 354.62]
  - - [448, 64, 1, 256, 448, 448, 256, 256]
    - [11, 487.564]
  - - [576, 64, 1, 256, 576, 576, 256, 256]
    - [12, 650.616]
  - - [704, 64, 1, 256, 704, 704, 256, 256]
    - [12, 793.556]
  - - [832, 64, 1, 256, 832, 832, 256, 256]
    - [14, 934.015]
  - - [960, 64, 1, 256, 960, 960, 256, 256]
    - [6, 1061.35]
  - - [64, 192, 1, 256, 64, 64, 256, 256]
    - [1, 200.755]
  - - [192, 192, 1, 256, 192, 192, 256, 256]
    - [6, 685.618]
  - - [320, 192, 1, 256, 320, 320, 256, 256]
    - [11, 1023.03]
  - - [448, 192, 1, 256, 448, 448, 256, 256]
    - [12, 1449.69]
  - - [576, 192, 1, 256, 576, 576, 256, 256]
    - [61, 1789.66]
  - - [704, 192, 1, 256, 704, 704, 256, 256]
    - [11, 2161.4]
  - - [832, 192, 1, 256, 832, 832, 256, 256]
    - [40, 2501.27]
  - - [960, 192, 1, 256, 960, 960, 256, 256]
    - [39, 2898.49]
  - - [64, 320, 1, 256, 64, 64, 256, 256]
    - [11, 357.644]
  - - [192, 320, 1, 256, 192, 192, 256, 256]
    - [62, 1032.77]
  - - [320, 320, 1, 256, 320, 320, 256, 256]
    - [59, 1696.23]
  - - [448, 320, 1, 256, 448, 448, 256, 256]
    - [11, 2281.71]
  - - [576, 320, 1, 256, 576, 576, 256, 256]
    - [21, 2849.48]
  - - [704, 320, 1, 256, 704, 704, 256, 256]
    - [18, 3132.71]
  - - [832, 320, 1, 256, 832, 832, 256, 256]
    - [38, 3707.33]
  - - [960, 320, 1, 256, 960, 960, 256, 256]
    - [50, 4249.95]
  - - [64, 448, 1, 256, 64, 64, 256, 256]
    - [11, 485.468]
  - - [192, 448, 1, 256, 192, 192, 256, 256]
    - [14, 1464.15]
  - - [320, 448, 1, 256, 320, 320, 256, 256]
    - [39, 2217.6]
  - - [448, 448, 1, 256, 448, 448, 256, 256]
    - [11, 2978.65]
  - - [576, 448, 1, 256, 576, 576, 256, 256]
    - [21, 3761.01]
  - - [704, 448, 1, 256, 704, 704, 256, 256]
    - [42, 4245.14]
  - - [832, 448, 1, 256, 832, 832, 256, 256]
    - [18, 4787.9]
  - - [960, 448, 1, 256, 960, 960, 256, 256]
    - [37, 5417.13]
  - - [64, 576, 1, 256, 64, 64, 256, 256]
    - [11, 660.405]
  - - [192, 576, 1, 256, 192, 192, 256, 256]
    - [11, 1822.5]
  - - [320, 576, 1, 256, 320, 320, 256, 256]
    - [39, 2906.52]
  - - [448, 576, 1, 256, 448, 448, 256, 256]
    - [39, 3766.37]
  - - [576, 576, 1, 256, 576, 576, 256, 256]
    - [42, 4619.91]
  - - [704, 576, 1, 256, 704, 704, 256, 256]
    - [42, 5117.78]
  - - [832, 576, 1, 256, 832, 832, 256, 256]
    - [42, 6112.93]
  - - [960, 576, 1, 256, 960, 960, 256, 256]
    - [44, 6880.42]
  - - [64, 704, 1, 256, 64, 64, 256, 256]
    - [5, 773.364]
  - - [192, 704, 1, 256, 192, 192, 256, 256]
    - [21, 2154.0]
  - - [320, 704, 1, 256, 320, 320, 256, 256]
    - [34, 3291.86]
  - - [448, 704, 1, 256, 448, 448, 256, 256]
    - [11, 4181.38]
  - - [576, 704, 1, 256, 576, 576, 256, 256]
    - [35, 5101.43]
  - - [704, 704, 1, 256, 704, 704, 256, 256]
    - [33, 5652.95]
  - - [832, 704, 1, 256, 832, 832, 256, 256]
    - [33, 6428.84]
  - - [960, 704, 1, 256, 960, 960, 256, 256]
    - [42, 7456.1]
  - - [64, 832, 1, 256, 64, 64, 256, 256]
    - [14, 951.92]
  - - [192, 832, 1, 256, 192, 192, 256, 256]
    - [21, 2488.33]
  - - [320, 832, 1, 256, 320, 320, 256, 256]
    - [39, 3796.12]
  - - [448, 832, 1, 256, 448, 448, 256, 256]
    - [25, 4613.14]
  - - [576, 832, 1, 256, 576, 576, 256, 256]
    - [18, 5577.91]
  - - [704, 832, 1, 256, 704, 704, 256, 256]
    - [18, 6432.84]
  - - [832, 832, 1, 256, 832, 832, 256, 256]
    - [33, 6917.11]
  - - [960, 832, 1, 256, 960, 960, 256, 256]
    - [44, 8067.88]
  - - [64, 960, 1, 256, 64, 64, 256, 256]
    - [18, 1079.93]
  - - [192, 960, 1, 256, 192, 192, 256, 256]
    - [39, 2902.95]
  - - [320, 960, 1, 256, 320, 320, 256, 256]
    - [50, 4358.29]
  - - [448, 960, 1, 256, 448, 448, 256, 256]
    - [50, 5373.51]
  - - [576, 960, 1, 256, 576, 576, 256, 256]
    - [44, 6985.68]
  - - [704, 960, 1, 256, 704, 704, 256, 256]
    - [42, 7909.44]
  - - [832, 960, 1, 256, 832, 832, 256, 256]
    - [52, 8570.03]
  - - [960, 960, 1, 256, 960, 960, 256, 256]
    - [52, 9953.16]
  - - [64, 64, 1, 512, 64, 64, 512, 512]
    - [14, 133.322]
  - - [192, 64, 1, 512, 192, 192, 512, 512]
    - [11, 390.059]
  - - [320, 64, 1, 512, 320, 320, 512, 512]
    - [12, 676.086]
  - - [448, 64, 1, 512, 448, 448, 512, 512]
    - [11, 923.885]
  - - [576, 64, 1, 512, 576, 576, 512, 512]
    - [11, 1165.12]
  - - [704, 64, 1, 512, 704, 704, 512, 512]
    - [14, 1458.24]
  - - [832, 64, 1, 512, 832, 832, 512, 512]
    - [11, 1726.65]
  - - [960, 64, 1, 512, 960, 960, 512, 512]
    - [11, 1960.02]
  - - [64, 192, 1, 512, 64, 64, 512, 512]
    - [11, 396.574]
  - - [192, 192, 1, 512, 192, 192, 512, 512]
    - [11, 1211.88]
  - - [320, 192, 1, 512, 320, 320, 512, 512]
    - [11, 1992.92]
  - - [448, 192, 1, 512, 448, 448, 512, 512]
    - [11, 2636.43]
  - - [576, 192, 1, 512, 576, 576, 512, 512]
    - [11, 3200.04]
  - - [704, 192, 1, 512, 704, 704, 512, 512]
    - [39, 3764.37]
  - - [832, 192, 1, 512, 832, 832, 512, 512]
    - [39, 4417.56]
  - - [960, 192, 1, 512, 960, 960, 512, 512]
    - [39, 5099.94]
  - - [64, 320, 1, 512, 64, 64, 512, 512]
    - [0, 687.613]
  - - [192, 320, 1, 512, 192, 192, 512, 512]
    - [12, 1975.4]
  - - [320, 320, 1, 512, 320, 320, 512, 512]
    - [18, 2915.22]
  - - [448, 320, 1, 512, 448, 448, 512, 512]
    - [11, 3803.32]
  - - [576, 320, 1, 512, 576, 576, 512, 512]
    - [22, 4827.33]
  - - [704, 320, 1, 512, 704, 704, 512, 512]
    - [39, 5286.37]
  - - [832, 320, 1, 512, 832, 832, 512, 512]
    - [51, 6407.43]
  - - [960, 320, 1, 512, 960, 960, 512, 512]
    - [50, 7230.23]
  - - [64, 448, 1, 512, 64, 64, 512, 512]
    - [11, 941.06]
  - - [192, 448, 1, 512, 192, 192, 512, 512]
    - [11, 2584.59]
  - - [320, 448, 1, 512, 320, 320, 512, 512]
    - [11, 3885.77]
  - - [448, 448, 1, 512, 448, 448, 512, 512]
    - [11, 4911.01]
  - - [576, 448, 1, 512, 576, 576, 512, 512]
    - [21, 6290.11]
  - - [704, 448, 1, 512, 704, 704, 512, 512]
    - [42, 7274.07]
  - - [832, 448, 1, 512, 832, 832, 512, 512]
    - [55, 7675.39]
  - - [960, 448, 1, 512, 960, 960, 512, 512]
    - [44, 8891.8]
  - - [64, 576, 1, 512, 64, 64, 512, 512]
    - [14, 1213.43]
  - - [192, 576, 1, 512, 192, 192, 512, 512]
    - [11, 3210.93]
  - - [320, 576, 1, 512, 320, 320, 512, 512]
    - [39, 5112.37]
  - - [448, 576, 1, 512, 448, 448, 512, 512]
    - [39, 6407.55]
  - - [576, 576, 1, 512, 576, 576, 512, 512]
    - [42, 7808.47]
  - - [704, 576, 1, 512, 704, 704, 512, 512]
    - [42, 8306.72]
  - - [832, 576, 1, 512, 832, 832, 512, 512]
    - [42, 9864.19]
  - - [960, 576, 1, 512, 960, 960, 512, 512]
    - [44, 11953.6]
  - - [64, 704, 1, 512, 64, 64, 512, 512]
    - [11, 1482.61]
  - - [192, 704, 1, 512, 192, 192, 512, 512]
    - [21, 3739.96]
  - - [320, 704, 1, 512, 320, 320, 512, 512]
    - [33, 5443.42]
  - - [448, 704, 1, 512, 448, 448, 512, 512]
    - [49, 6543.11]
  - - [576, 704, 1, 512, 576, 576, 512, 512]
    - [51, 7854.06]
  - - [704, 704, 1, 512, 704, 704, 512, 512]
    - [28, 9204.21]
  - - [832, 704, 1, 512, 832, 832, 512, 512]
    - [42, 10328.8]
  - - [960, 704, 1, 512, 960, 960, 512, 512]
    - [42, 11777.9]
  - - [64, 832, 1, 512, 64, 64, 512, 512]
    - [58, 1751.61]
  - - [192, 832, 1, 512, 192, 192, 512, 512]
    - [21, 4246.68]
  - - [320, 832, 1, 512, 320, 320, 512, 512]
    - [39, 6471.31]
  - - [448, 832, 1, 512, 448, 448, 512, 512]
    - [25, 7618.55]
  - - [576, 832, 1, 512, 576, 576, 512, 512]
    - [52, 8882.22]
  - - [704, 832, 1, 512, 704, 704, 512, 512]
    - [42, 9572.37]
  - - [832, 832, 1, 512, 832, 832, 512, 512]
    - [42, 11479.5]
  - - [960, 832, 1, 512, 960, 960, 512, 512]
    - [44, 13716.5]
  - - [64, 960, 1, 512, 64, 64, 512, 512]
    - [14, 1938.88]
  - - [192, 960, 1, 512, 192, 192, 512, 512]
    - [39, 5048.11]
  - - [320, 960, 1, 512, 320, 320, 512, 512]
    - [42, 7447.45]
  - - [448, 960, 1, 512, 448, 448, 512, 512]
    - [42, 9139.05]
  - - [576, 960, 1, 512, 576, 576, 512, 512]
    - [44, 11799.4]
  - - [704, 960, 1, 512, 704, 704, 512, 512]
    - [42, 12260.1]
  - - [832, 960, 1, 512, 832, 832, 512, 512]
    - [44, 13638.8]
  - - [960, 960, 1, 512, 960, 960, 512, 512]
    - [52, 15847.8]
  - - [64, 64, 1, 1024, 64, 64, 1024, 1024]
    - [3, 242.874]
  - - [192, 64, 1, 1024, 192, 192, 1024, 1024]
    - [11, 729.656]
  - - [320, 64, 1, 1024, 320, 320, 1024, 1024]
    - [11, 1250.2]
  - - [448, 64, 1, 1024, 448, 448, 1024, 1024]
    - [0, 1698.15]
  - - [576, 64, 1, 1024, 576, 576, 1024, 1024]
    - [11, 2079.88]
  - - [704, 64, 1, 1024, 704, 704, 1024, 1024]
    - [11, 2547.62]
  - - [832, 64, 1, 1024, 832, 832, 1024, 1024]
    - [11, 2952.94]
  - - [960, 64, 1, 1024, 960, 960, 1024, 1024]
    - [11, 3447.47]
  - - [64, 192, 1, 1024, 64, 64, 1024, 1024]
    - [0, 719.044]
  - - [192, 192, 1, 1024, 192, 192, 1024, 1024]
    - [11, 2173.84]
  - - [320, 192, 1, 1024, 320, 320, 1024, 1024]
    - [11, 3388.88]
  - - [448, 192, 1, 1024, 448, 448, 1024, 1024]
    - [21, 4208.33]
  - - [576, 192, 1, 1024, 576, 576, 1024, 1024]
    - [18, 5021.0]
  - - [704, 192, 1, 1024, 704, 704, 1024, 1024]
    - [39, 5948.22]
  - - [832, 192, 1, 1024, 832, 832, 1024, 1024]
    - [39, 7096.81]
  - - [960, 192, 1, 1024, 960, 960, 1024, 1024]
    - [39, 8206.43]
  - - [64, 320, 1, 1024, 64, 64, 1024, 1024]
    - [11, 1265.67]
  - - [192, 320, 1, 1024, 192, 192, 1024, 1024]
    - [11, 3450.21]
  - - [320, 320, 1, 1024, 320, 320, 1024, 1024]
    - [18, 4671.86]
  - - [448, 320, 1, 1024, 448, 448, 1024, 1024]
    - [24, 6050.02]
  - - [576, 320, 1, 1024, 576, 576, 1024, 1024]
    - [21, 7967.4]
  - - [704, 320, 1, 1024, 704, 704, 1024, 1024]
    - [54, 8728.55]
  - - [832, 320, 1, 1024, 832, 832, 1024, 1024]
    - [51, 9547.7]
  - - [960, 320, 1, 1024, 960, 960, 1024, 1024]
    - [51, 11212.9]
  - - [64, 448, 1, 1024, 64, 64, 1024, 1024]
    - [0, 1739.86]
  - - [192, 448, 1, 1024, 192, 192, 1024, 1024]
    - [39, 4360.52]
  - - [320, 448, 1, 1024, 320, 320, 1024, 1024]
    - [39, 6421.73]
  - - [448, 448, 1, 1024, 448, 448, 1024, 1024]
    - [48, 7790.78]
  - - [576, 448, 1, 1024, 576, 576, 1024, 1024]
    - [44, 9799.59]
  - - [704, 448, 1, 1024, 704, 704, 1024, 1024]
    - [42, 11194.7]
  - - [832, 448, 1, 1024, 832, 832, 1024, 1024]
    - [47, 12147.9]
  - - [960, 448, 1, 1024, 960, 960, 1024, 1024]
    - [44, 13799.6]
  - - [64, 576, 1, 1024, 64, 64, 1024, 1024]
    - [11, 2034.48]
  - - [192, 576, 1, 1024, 192, 192, 1024, 1024]
    - [18, 5104.74]
  - - [320, 576, 1, 1024, 320, 320, 1024, 1024]
    - [39, 7987.63]
  - - [448, 576, 1, 1024, 448, 448, 1024, 1024]
    - [44, 10001.7]
  - - [576, 576, 1, 1024, 576, 576, 1024, 1024]
    - [42, 12372.4]
  - - [704, 576, 1, 1024, 704, 704, 1024, 1024]
    - [42, 12673.4]
  - - [832, 576, 1, 1024, 832, 832, 1024, 1024]
    - [42, 14920.9]
  - - [960, 576, 1, 1024, 960, 960, 1024, 1024]
    - [44, 18295.3]
  - - [64, 704, 1, 1024, 64, 64, 1024, 1024]
    - [11, 2573.98]
  - - [192, 704, 1, 1024, 192, 192, 1024, 1024]
    - [21, 5829.1]
  - - [320, 704, 1, 1024, 320, 320, 1024, 1024]
    - [24, 8224.27]
  - - [448, 704, 1, 1024, 448, 448, 1024, 1024]
    - [47, 10616.9]
  - - [576, 704, 1, 1024, 576, 576, 1024, 1024]
    - [44, 12430.5]
  - - [704, 704, 1, 1024, 704, 704, 1024, 1024]
    - [42, 13793.1]
  - - [832, 704, 1, 1024, 832, 832, 1024, 1024]
    - [44, 15142.8]
  - - [960, 704, 1, 1024, 960, 960, 1024, 1024]
    - [44, 17614.6]
  - - [64, 832, 1, 1024, 64, 64, 1024, 1024]
    - [11, 2987.81]
  - - [192, 832, 1, 1024, 192, 192, 1024, 1024]
    - [21, 6987.67]
  - - [320, 832, 1, 1024, 320, 320, 1024, 1024]
    - [39, 9736.95]
  - - [448, 832, 1, 1024, 448, 448, 1024, 1024]
    - [47, 11997.1]
  - - [576, 832, 1, 1024, 576, 576, 1024, 1024]
    - [47, 13841.4]
  - - [704, 832, 1, 1024, 704, 704, 1024, 1024]
    - [44, 14855.7]
  - - [832, 832, 1, 1024, 832, 832, 1024, 1024]
    - [44, 17064.4]
  - - [960, 832, 1, 1024, 960, 960, 1024, 1024]
    - [44, 20849.1]
  - - [64, 960, 1, 1024, 64, 64, 1024, 1024]
    - [12, 3446.52]
  - - [192, 960, 1, 1024, 192, 192, 1024, 1024]
    - [39, 8245.86]
  - - [320, 960, 1, 1024, 320, 320, 1024, 1024]
    - [42, 11279.5]
  - - [448, 960, 1, 1024, 448, 448, 1024, 1024]
    - [42, 13378.1]
  - - [576, 960, 1, 1024, 576, 576, 1024, 1024]
    - [44, 18125.5]
  - - [704, 960, 1, 1024, 704, 704, 1024, 1024]
    - [42, 17969.1]
  - - [832, 960, 1, 1024, 832, 832, 1024, 1024]
    - [44, 20519.3]
  - - [960, 960, 1, 1024, 960, 960, 1024, 1024]
    - [52, 22234.4]
  - - [64, 64, 1, 2048, 64, 64, 2048, 2048]
    - [3, 481.702]
  - - [192, 64, 1, 2048, 192, 192, 2048, 2048]
    - [16, 1338.25]
  - - [320, 64, 1, 2048, 320, 320, 2048, 2048]
    - [11, 2089.32]
  - - [448, 64, 1, 2048, 448, 448, 2048, 2048]
    - [11, 2946.4]
  - - [576, 64, 1, 2048, 576, 576, 2048, 2048]
    - [23, 3387.89]
  - - [704, 64, 1, 2048, 704, 704, 2048, 2048]
    - [11, 3923.33]
  - - [832, 64, 1, 2048, 832, 832, 2048, 2048]
    - [11, 4624.86]
  - - [960, 64, 1, 2048, 960, 960, 2048, 2048]
    - [11, 5168.69]
  - - [64, 64, 1, 4096, 64, 64, 4096, 4096]
    - [16, 866.838]
  - - [192, 64, 1, 4096, 192, 192, 4096, 4096]
    - [3, 2271.85]
  - - [320, 64, 1, 4096, 320, 320, 4096, 4096]
    - [16, 3533.61]
  - - [448, 64, 1, 4096, 448, 448, 4096, 4096]
    - [11, 4524.08]
  - - [576, 64, 1, 4096, 576, 576, 4096, 4096]
    - [23, 5641.61]
  - - [704, 64, 1, 4096, 704, 704, 4096, 4096]
    - [36, 6263.45]
  - - [832, 64, 1, 4096, 832, 832, 4096, 4096]
    - [43, 6883.61]
  - - [960, 64, 1, 4096, 960, 960, 4096, 4096]
    - [43, 7780.68]
  - - [1280, 1280, 1, 64, 1280, 1280, 64, 64]
    - [33, 4105.7]
  - - [1536, 1280, 1, 64, 1536, 1536, 64, 64]
    - [33, 4684.72]
  - - [1792, 1280, 1, 64, 1792, 1792, 64, 64]
    - [33, 5049.12]
  - - [2048, 1280, 1, 64, 2048, 2048, 64, 64]
    - [10, 5177.51]
  - - [1280, 1536, 1, 64, 1280, 1280, 64, 64]
    - [33, 4710.23]
  - - [1536, 1536, 1, 64, 1536, 1536, 64, 64]
    - [33, 5119.43]
  - - [1792, 1536, 1, 64, 1792, 1792, 64, 64]
    - [33, 5516.32]
  - - [2048, 1536, 1, 64, 2048, 2048, 64, 64]
    - [46, 5553.22]
  - - [1280, 1792, 1, 64, 1280, 1280, 64, 64]
    - [17, 5095.56]
  - - [1536, 1792, 1, 64, 1536, 1536, 64, 64]
    - [55, 5573.03]
  - - [1792, 1792, 1, 64, 1792, 1792, 64, 64]
    - [55, 6150.74]
  - - [2048, 1792, 1, 64, 2048, 2048, 64, 64]
    - [9, 5953.29]
  - - [1280, 2048, 1, 64, 1280, 1280, 64, 64]
    - [18, 5276.77]
  - - [1536, 2048, 1, 64, 1536, 1536, 64, 64]
    - [17, 5693.79]
  - - [1792, 2048, 1, 64, 1792, 1792, 64, 64]
    - [25, 6236.97]
  - - [2048, 2048, 1, 64, 2048, 2048, 64, 64]
    - [9, 6300.71]
  - - [1280, 1280, 1, 256, 1280, 1280, 256, 256]
    - [52, 11909.0]
  - - [1536, 1280, 1, 256, 1536, 1536, 256, 256]
    - [44, 12828.6]
  - - [1792, 1280, 1, 256, 1792, 1792, 256, 256]
    - [52, 13178.1]
  - - [2048, 1280, 1, 256, 2048, 2048, 256, 256]
    - [52, 14224.3]
  - - [1280, 1536, 1, 256, 1280, 1280, 256, 256]
    - [44, 13356.1]
  - - [1536, 1536, 1, 256, 1536, 1536, 256, 256]
    - [41, 14404.8]
  - - [1792, 1536, 1, 256, 1792, 1792, 256, 256]
    - [41, 14938.7]
  - - [2048, 1536, 1, 256, 2048, 2048, 256, 256]
    - [46, 14794.3]
  - - [1280, 1792, 1, 256, 1280, 1280, 256, 256]
    - [41, 13250.9]
  - - [1536, 1792, 1, 256, 1536, 1536, 256, 256]
    - [44, 14698.9]
  - - [1792, 1792, 1, 256, 1792, 1792, 256, 256]
    - [44, 14844.8]
  - - [2048, 1792, 1, 256, 2048, 2048, 256, 256]
    - [44, 15274.6]
  - - [1280, 2048, 1, 256, 1280, 1280, 256, 256]
    - [52, 13703.0]
  - - [1536, 2048, 1, 256, 1536, 1536, 256, 256]
    - [44, 15209.1]
  - - [1792, 2048, 1, 256, 1792, 1792, 256, 256]
    - [44, 15816.0]
  - - [2048, 2048, 1, 256, 2048, 2048, 256, 256]
    - [44, 16120.2]
  - - [1280, 1280, 1, 512, 1280, 1280, 512, 512]
    - [52, 17511.3]
  - - [1536, 1280, 1, 512, 1536, 1536, 512, 512]
    - [44, 19424.1]
  - - [1792, 1280, 1, 512, 1792, 1792, 512, 512]
    - [52, 17495.0]
  - - [2048, 1280, 1, 512, 2048, 2048, 512, 512]
    - [52, 19361.2]
  - - [1280, 1536, 1, 512, 1280, 1280, 512, 512]
    - [44, 19079.8]
  - - [1536, 1536, 1, 512, 1536, 1536, 512, 512]
    - [41, 18898.4]
  - - [1792, 1536, 1, 512, 1792, 1792, 512, 512]
    - [52, 19725.9]
  - - [2048, 1536, 1, 512, 2048, 2048, 512, 512]
    - [45, 21128.9]
  - - [1280, 1792, 1, 512, 1280, 1280, 512, 512]
    - [44, 18323.2]
  - - [1536, 1792, 1, 512, 1536, 1536, 512, 512]
    - [52, 19616.2]
  - - [1792, 1792, 1, 512, 1792, 1792, 512, 512]
    - [45, 20470.6]
  - - [2048, 1792, 1, 512, 2048, 2048, 512, 512]
    - [44, 20711.9]
  - - [1280, 2048, 1, 512, 1280, 1280, 512, 512]
    - [44, 19378.0]
  - - [1536, 2048, 1, 512, 1536, 1536, 512, 512]
    - [44, 21492.5]
  - - [1792, 2048, 1, 512, 1792, 1792, 512, 512]
    - [52, 21080.3]
  - - [2048, 2048, 1, 512, 2048, 2048, 512, 512]
    - [52, 22268.1]
  - - [1280, 1280, 1, 1024, 1280, 1280, 1024, 1024]
    - [44, 21245.7]
  - - [1536, 1280, 1, 1024, 1536, 1536, 1024, 1024]
    - [44, 25541.4]
  - - [1792, 1280, 1, 1024, 1792, 1792, 1024, 1024]
    - [44, 23377.8]
  - - [2048, 1280, 1, 1024, 2048, 2048, 1024, 1024]
    - [52, 24916.9]
  - - [1280, 1536, 1, 1024, 1280, 1280, 1024, 1024]
    - [44, 25703.0]
  - - [1536, 1536, 1, 1024, 1536, 1536, 1024, 1024]
    - [44, 23220.5]
  - - [1792, 1536, 1, 1024, 1792, 1792, 1024, 1024]
    - [44, 26001.1]
  - - [2048, 1536, 1, 1024, 2048, 2048, 1024, 1024]
    - [44, 29246.1]
  - - [1280, 1792, 1, 1024, 1280, 1280, 1024, 1024]
    - [44, 23829.5]
  - - [1536, 1792, 1, 1024, 1536, 1536, 1024, 1024]
    - [44, 26800.7]
  - - [1792, 1792, 1, 1024, 1792, 1792, 1024, 1024]
    - [44, 27990.0]
  - - [2048, 1792, 1, 1024, 2048, 2048, 1024, 1024]
    - [44, 27413.2]
  - - [1280, 2048, 1, 1024, 1280, 1280, 1024, 1024]
    - [44, 25311.6]
  - - [1536, 2048, 1, 1024, 1536, 1536, 1024, 1024]
    - [44, 29759.3]
  - - [1792, 2048, 1, 1024, 1792, 1792, 1024, 1024]
    - [44, 27655.2]
  - - [2048, 2048, 1, 1024, 2048, 2048, 1024, 1024]
    - [44, 29157.9]
  - - [1280, 1280, 1, 2048, 1280, 1280, 2048, 2048]
    - [44, 26151.7]
  - - [1536, 1280, 1, 2048, 1536, 1536, 2048, 2048]
    - [44, 31127.4]
  - - [1792, 1280, 1, 2048, 1792, 1792, 2048, 2048]
    - [53, 28368.9]
  - - [2048, 1280, 1, 2048, 2048, 2048, 2048, 2048]
    - [44, 29349.2]
  - - [1280, 1536, 1, 2048, 1280, 1280, 2048, 2048]
    - [44, 30805.9]
  - - [1536, 1536, 1, 2048, 1536, 1536, 2048, 2048]
    - [47, 28805.3]
  - - [1792, 1536, 1, 2048, 1792, 1792, 2048, 2048]
    - [44, 31011.7]
  - - [2048, 1536, 1, 2048, 2048, 2048, 2048, 2048]
    - [44, 34814.6]
  - - [1280, 1792, 1, 2048, 1280, 1280, 2048, 2048]
    - [47, 27932.8]
  - - [1536, 1792, 1, 2048, 1536, 1536, 2048, 2048]
    - [44, 30732.5]
  - - [1792, 1792, 1, 2048, 1792, 1792, 2048, 2048]
    - [44, 32148.7]
  - - [2048, 1792, 1, 2048, 2048, 2048, 2048, 2048]
    - [44, 31558.8]
  - - [1280, 2048, 1, 2048, 1280, 1280, 2048, 2048]
    - [44, 29387.9]
  - - [1536, 2048, 1, 2048, 1536, 1536, 2048, 2048]
    - [44, 35049.5]
  - - [1792, 2048, 1, 2048, 1792, 1792, 2048, 2048]
    - [47, 31521.1]
  - - [2048, 2048, 1, 2048, 2048, 2048, 2048, 2048]
    - [44, 32446.4]
  - - [1280, 1280, 1, 4096, 1280, 1280, 4096, 4096]
    - [48, 30400.4]
  - - [1536, 1280, 1, 4096, 1536, 1536, 4096, 4096]
    - [44, 35185.0]
  - - [1792, 1280, 1, 4096, 1792, 1792, 4096, 4096]
    - [53, 33268.3]
  - - [2048, 1280, 1, 4096, 2048, 2048, 4096, 4096]
    - [44, 32293.4]
  - - [1280, 1536, 1, 4096, 1280, 1280, 4096, 4096]
    - [44, 35144.0]
  - - [1536, 1536, 1, 4096, 1536, 1536, 4096, 4096]
    - [47, 32839.3]
  - - [1792, 1536, 1, 4096, 1792, 1792, 4096, 4096]
    - [44, 33893.2]
  - - [2048, 1536, 1, 4096, 2048, 2048, 4096, 4096]
    - [44, 38158.8]
  - - [1280, 1792, 1, 4096, 1280, 1280, 4096, 4096]
    - [47, 31928.2]
  - - [1536, 1792, 1, 4096, 1536, 1536, 4096, 4096]
    - [47, 34348.5]
  - - [1792, 1792, 1, 4096, 1792, 1792, 4096, 4096]
    - [44, 35504.9]
  - - [2048, 1792, 1, 4096, 2048, 2048, 4096, 4096]
    - [47, 35309.4]
  - - [1280, 2048, 1, 4096, 1280, 1280, 4096, 4096]
    - [44, 32271.6]
  - - [1536, 2048, 1, 4096, 1536, 1536, 4096, 4096]
    - [44, 38469.7]
  - - [1792, 2048, 1, 4096, 1792, 1792, 4096, 4096]
    - [47, 35227.0]
  - - [2048, 2048, 1, 4096, 2048, 2048, 4096, 4096]
    - [44, 34653.8]
  - - [2560, 2560, 1, 64, 2560, 2560, 64, 64]
    - [52, 7852.52]
  - - [3072, 2560, 1, 64, 3072, 3072, 64, 64]
    - [52, 8181.61]
  - - [3584, 2560, 1, 64, 3584, 3584, 64, 64]
    - [52, 8589.48]
  - - [4096, 2560, 1, 64, 4096, 4096, 64, 64]
    - [52, 8275.08]
  - - [2560, 3072, 1, 64, 2560, 2560, 64, 64]
    - [42, 7700.27]
  - - [3072, 3072, 1, 64, 3072, 3072, 64, 64]
    - [46, 8406.35]
  - - [3584, 3072, 1, 64, 3584, 3584, 64, 64]
    - [25, 8713.5]
  - - [4096, 3072, 1, 64, 4096, 4096, 64, 64]
    - [46, 8538.75]
  - - [2560, 3584, 1, 64, 2560, 2560, 64, 64]
    - [55, 8487.0]
  - - [3072, 3584, 1, 64, 3072, 3072, 64, 64]
    - [52, 8547.6]
  - - [3584, 3584, 1, 64, 3584, 3584, 64, 64]
    - [56, 9129.95]
  - - [4096, 3584, 1, 64, 4096, 4096, 64, 64]
    - [52, 8749.81]
  - - [2560, 4096, 1, 64, 2560, 2560, 64, 64]
    - [52, 8488.56]
  - - [3072, 4096, 1, 64, 3072, 3072, 64, 64]
    - [52, 8978.53]
  - - [3584, 4096, 1, 64, 3584, 3584, 64, 64]
    - [26, 9327.43]
  - - [4096, 4096, 1, 64, 4096, 4096, 64, 64]
    - [44, 8873.39]
  - - [2560, 2560, 1, 256, 2560, 2560, 256, 256]
    - [52, 18893.8]
  - - [3072, 2560, 1, 256, 3072, 3072, 256, 256]
    - [52, 20157.4]
  - - [3584, 2560, 1, 256, 3584, 3584, 256, 256]
    - [52, 21120.2]
  - - [4096, 2560, 1, 256, 4096, 4096, 256, 256]
    - [44, 21135.6]
  - - [2560, 3072, 1, 256, 2560, 2560, 256, 256]
    - [44, 19910.2]
  - - [3072, 3072, 1, 256, 3072, 3072, 256, 256]
    - [44, 21233.8]
  - - [3584, 3072, 1, 256, 3584, 3584, 256, 256]
    - [52, 20941.8]
  - - [4096, 3072, 1, 256, 4096, 4096, 256, 256]
    - [44, 22598.6]
  - - [2560, 3584, 1, 256, 2560, 2560, 256, 256]
    - [44, 20674.9]
  - - [3072, 3584, 1, 256, 3072, 3072, 256, 256]
    - [52, 21514.8]
  - - [3584, 3584, 1, 256, 3584, 3584, 256, 256]
    - [52, 22098.2]
  - - [4096, 3584, 1, 256, 4096, 4096, 256, 256]
    - [44, 22453.2]
  - - [2560, 4096, 1, 256, 2560, 2560, 256, 256]
    - [52, 21587.8]
  - - [3072, 4096, 1, 256, 3072, 3072, 256, 256]
    - [52, 22039.6]
  - - [3584, 4096, 1, 256, 3584, 3584, 256, 256]
    - [52, 22951.5]
  - - [4096, 4096, 1, 256, 4096, 4096, 256, 256]
    - [44, 23383.5]
  - - [2560, 2560, 1, 512, 2560, 2560, 512, 512]
    - [44, 24918.4]
  - - [3072, 2560, 1, 512, 3072, 3072, 512, 512]
    - [52, 26562.8]
  - - [3584, 2560, 1, 512, 3584, 3584, 512, 512]
    - [52, 27751.2]
  - - [4096, 2560, 1, 512, 4096, 4096, 512, 512]
    - [44, 28008.8]
  - - [2560, 3072, 1, 512, 2560, 2560, 512, 512]
    - [44, 25930.7]
  - - [3072, 3072, 1, 512, 3072, 3072, 512, 512]
    - [44, 26922.0]
  - - [3584, 3072, 1, 512, 3584, 3584, 512, 512]
    - [44, 27094.0]
  - - [4096, 3072, 1, 512, 4096, 4096, 512, 512]
    - [44, 28530.0]
  - - [2560, 3584, 1, 512, 2560, 2560, 512, 512]
    - [52, 26856.6]
  - - [3072, 3584, 1, 512, 3072, 3072, 512, 512]
    - [44, 28234.4]
  - - [3584, 3584, 1, 512, 3584, 3584, 512, 512]
    - [44, 28076.9]
  - - [4096, 3584, 1, 512, 4096, 4096, 512, 512]
    - [44, 29040.5]
  - - [2560, 4096, 1, 512, 2560, 2560, 512, 512]
    - [52, 27643.2]
  - - [3072, 4096, 1, 512, 3072, 3072, 512, 512]
    - [52, 28532.4]
  - - [3584, 4096, 1, 512, 3584, 3584, 512, 512]
    - [52, 29098.5]
  - - [4096, 4096, 1, 512, 4096, 4096, 512, 512]
    - [44, 29906.8]
  - - [2560, 2560, 1, 1024, 2560, 2560, 1024, 1024]
    - [44, 31032.5]
  - - [3072, 2560, 1, 1024, 3072, 3072, 1024, 1024]
    - [44, 33030.9]
  - - [3584, 2560, 1, 1024, 3584, 3584, 1024, 1024]
    - [44, 33104.9]
  - - [4096, 2560, 1, 1024, 4096, 4096, 1024, 1024]
    - [44, 34157.3]
  - - [2560, 3072, 1, 1024, 2560, 2560, 1024, 1024]
    - [44, 33150.0]
  - - [3072, 3072, 1, 1024, 3072, 3072, 1024, 1024]
    - [44, 34245.5]
  - - [3584, 3072, 1, 1024, 3584, 3584, 1024, 1024]
    - [44, 34508.9]
  - - [4096, 3072, 1, 1024, 4096, 4096, 1024, 1024]
    - [44, 35481.3]
  - - [2560, 3584, 1, 1024, 2560, 2560, 1024, 1024]
    - [44, 33165.7]
  - - [3072, 3584, 1, 1024, 3072, 3072, 1024, 1024]
    - [44, 34589.5]
  - - [3584, 3584, 1, 1024, 3584, 3584, 1024, 1024]
    - [44, 34514.3]
  - - [4096, 3584, 1, 1024, 4096, 4096, 1024, 1024]
    - [44, 35029.7]
  - - [2560, 4096, 1, 1024, 2560, 2560, 1024, 1024]
    - [44, 34167.1]
  - - [3072, 4096, 1, 1024, 3072, 3072, 1024, 1024]
    - [44, 34335.0]
  - - [3584, 4096, 1, 1024, 3584, 3584, 1024, 1024]
    - [44, 34488.4]
  - - [4096, 4096, 1, 1024, 4096, 4096, 1024, 1024]
    - [44, 36049.5]
  - - [2560, 2560, 1, 2048, 2560, 2560, 2048, 2048]
    - [44, 35490.0]
  - - [3072, 2560, 1, 2048, 3072, 3072, 2048, 2048]
    - [44, 34512.1]
  - - [3584, 2560, 1, 2048, 3584, 3584, 2048, 2048]
    - [44, 36131.1]
  - - [4096, 2560, 1, 2048, 4096, 4096, 2048, 2048]
    - [44, 37022.9]
  - - [2560, 3072, 1, 2048, 2560, 2560, 2048, 2048]
    - [44, 36055.9]
  - - [3072, 3072, 1, 2048, 3072, 3072, 2048, 2048]
    - [44, 37472.0]
  - - [3584, 3072, 1, 2048, 3584, 3584, 2048, 2048]
    - [44, 37326.2]
  - - [4096, 3072, 1, 2048, 4096, 4096, 2048, 2048]
    - [44, 37649.1]
  - - [2560, 3584, 1, 2048, 2560, 2560, 2048, 2048]
    - [44, 36332.1]
  - - [3072, 3584, 1, 2048, 3072, 3072, 2048, 2048]
    - [44, 36962.5]
  - - [3584, 3584, 1, 2048, 3584, 3584, 2048, 2048]
    - [44, 37039.8]
  - - [4096, 3584, 1, 2048, 4096, 4096, 2048, 2048]
    - [44, 38082.0]
  - - [2560, 4096, 1, 2048, 2560, 2560, 2048, 2048]
    - [44, 37247.9]
  - - [3072, 4096, 1, 2048, 3072, 3072, 2048, 2048]
    - [44, 37579.6]
  - - [3584, 4096, 1, 2048, 3584, 3584, 2048, 2048]
    - [44, 37690.3]
  - - [4096, 4096, 1, 2048, 4096, 4096, 2048, 2048]
    - [44, 38146.4]
  - - [2560, 2560, 1, 4096, 2560, 2560, 4096, 4096]
    - [44, 37892.7]
  - - [3072, 2560, 1, 4096, 3072, 3072, 4096, 4096]
    - [44, 37354.5]
  - - [3584, 2560, 1, 4096, 3584, 3584, 4096, 4096]
    - [44, 38426.2]
  - - [4096, 2560, 1, 4096, 4096, 4096, 4096, 4096]
    - [44, 39130.6]
  - - [2560, 3072, 1, 4096, 2560, 2560, 4096, 4096]
    - [44, 37487.1]
  - - [3072, 3072, 1, 4096, 3072, 3072, 4096, 4096]
    - [44, 39745.3]
  - - [3584, 3072, 1, 4096, 3584, 3584, 4096, 4096]
    - [44, 39422.2]
  - - [4096, 3072, 1, 4096, 4096, 4096, 4096, 4096]
    - [44, 39678.9]
  - - [2560, 3584, 1, 4096, 2560, 2560, 4096, 4096]
    - [44, 38543.7]
  - - [3072, 3584, 1, 4096, 3072, 3072, 4096, 4096]
    - [44, 38770.7]
  - - [3584, 3584, 1, 4096, 3584, 3584, 4096, 4096]
    - [44, 39002.0]
  - - [4096, 3584, 1, 4096, 4096, 4096, 4096, 4096]
    - [44, 39726.7]
  - - [2560, 4096, 1, 4096, 2560, 2560, 4096, 4096]
    - [44, 39649.0]
  - - [3072, 4096, 1, 4096, 3072, 3072, 4096, 4096]
    - [44, 39749.5]
  - - [3584, 4096, 1, 4096, 3584, 3584, 4096, 4096]
    - [44, 39369.0]
  - - [4096, 4096, 1, 4096, 4096, 4096, 4096, 4096]
    - [44, 40142.4]
  - - [1, 1, 1, 1, 1, 1, 1, 1]
    - [7, 6.76155e-05]
  - - [1, 1, 1, 64, 1, 1, 64, 64]
    - [11, 0.00442004]
  - - [1, 64, 1, 1, 1, 1, 1, 1]
    - [30, 0.0044231]
  - - [64, 1, 1, 1, 64, 64, 1, 1]
    - [30, 0.0044774]
  - - [64, 64, 1, 1, 64, 64, 1, 1]
    - [15, 0.283274]
  - - [64, 1, 1, 64, 64, 64, 64, 64]
    - [62, 0.269226]
  - - [1, 64, 1, 64, 1, 1, 64, 64]
    - [62, 0.261233]
- null
- null
- DeviceEfficiency
- GridBased
