library/src/amd_detail/rocblaslt/src/Tensile/Logic/asm_full/aldebaran/110CU/Equality/aldebaran_Cijk_Ailk_Bljk_HHS_BH_Bias_AH_SDV.yaml
- {MinimumRequiredVersion: 4.33.0}
- aldebaran
- gfx90a
- [Device 0050, Device 0051, Device 0052, Device 0054, Device 0062, Device 7400, Device
    SolutionIndex: 0
    SolutionNameMin: Cijk_Ailk_Bljk_HHS_BH_Bias_AH_SDV_MT128x128x32_MI32x32x8x1_SN_1LDSB0_GRVW8_GSU1_LPB8_LRVW8_MIWT2_2_NEPBS0_NLCA1_PLR5_SS0_SU4_SUS128_SVW4_VW1_WG64_4_1_WGM1
    SolutionIndex: 1
    SolutionNameMin: Cijk_Ailk_Bljk_HHS_BH_Bias_AH_SDV_MT128x16x64_MI16x16x16x1_SN_1LDSB0_GRVW4_GSU1_LPB16_LRVW8_MIWT2_1_NEPBS0_NLCA1_PLR5_SS0_SU0_SUS0_SVW4_VW1_WG64_4_1_WGM4
    SolutionIndex: 2
    SolutionNameMin: Cijk_Ailk_Bljk_HHS_BH_Bias_AH_SDV_MT32x32x64_MI16x16x16x1_SN_1LDSB0_GRVW8_GSU1_LPB16_LRVW8_MIWT1_1_NEPBS2_NLCA1_PLR5_SS0_SU4_SUS128_SVW4_VW1_WG32_8_1_WGM1
    SolutionIndex: 3
    SolutionNameMin: Cijk_Ailk_Bljk_HHS_BH_Bias_AH_SDV_MT32x32x64_MI16x16x16x1_SN_1LDSB0_GRVW8_GSU1_LPB16_LRVW8_MIWT1_1_NEPBS2_NLCA1_PLR5_SS0_SU32_SUS128_SVW4_VW1_WG32_8_1_WGM1
    SolutionIndex: 4
    SolutionNameMin: Cijk_Ailk_Bljk_HHS_BH_Bias_AH_SDV_MT32x32x64_MI16x16x16x1_SN_1LDSB0_GRVW8_GSU7_LPB16_LRVW8_MIWT1_1_NEPBS2_NLCA1_PLR5_SS0_SU0_SUS0_SVW4_VW1_WG32_8_1_WGM1
    SolutionIndex: 5
    SolutionNameMin: Cijk_Ailk_Bljk_HHS_BH_Bias_AH_SDV_MT32x32x64_MI16x16x16x1_SN_1LDSB0_GRVW8_GSU7_LPB16_LRVW8_MIWT1_1_NEPBS2_NLCA1_PLR5_SS0_SU4_SUS128_SVW4_VW1_WG32_8_1_WGM2
    SolutionIndex: 6
    SolutionNameMin: Cijk_Ailk_Bljk_HHS_BH_Bias_AH_SDV_MT128x96x64_MI32x32x8x1_SN_1LDSB0_GRVW8_GSU1_LPB8_LRVW8_MIWT1_3_NEPBS0_NLCA1_PLR9_SS0_SU4_SUS128_SVW4_VW1_WG128_2_1_WGM8
    SolutionIndex: 7
    SolutionNameMin: Cijk_Ailk_Bljk_HHS_BH_Bias_AH_SDV_MT128x64x32_MI32x32x8x1_SN_1LDSB0_GRVW8_GSU1_LPB8_LRVW8_MIWT2_1_NEPBS2_NLCA1_PLR5_SS1_SU0_SUS0_SVW2_VW2_WG64_4_1_WGM8
    SolutionIndex: 8
    SolutionNameMin: Cijk_Ailk_Bljk_HHS_BH_Bias_AH_SDV_MT128x128x32_MI32x32x8x1_SN_1LDSB1_GRVW8_GSU1_LPB8_LRVW8_MIWT2_2_NEPBS2_NLCA1_PLR5_SS1_SU0_SUS0_SVW2_VW2_WG64_4_1_WGM1
    SolutionIndex: 9
    SolutionNameMin: Cijk_Ailk_Bljk_HHS_BH_Bias_AH_SDV_MT128x128x32_MI32x32x8x1_SN_1LDSB1_GRVW8_GSU1_LPB8_LRVW8_MIWT2_2_NEPBS2_NLCA1_PLR5_SS1_SU4_SUS256_SVW2_VW2_WG64_4_1_WGM4
    SolutionIndex: 10
    SolutionNameMin: Cijk_Ailk_Bljk_HHS_BH_Bias_AH_SDV_MT128x128x32_MI32x32x8x1_SN_1LDSB1_GRVW8_GSU1_LPB8_LRVW8_MIWT2_2_NEPBS2_NLCA1_PLR5_SS1_SU32_SUS128_SVW2_VW2_WG64_4_1_WGM8
    SolutionIndex: 11
    SolutionNameMin: Cijk_Ailk_Bljk_HHS_BH_Bias_AH_SDV_MT128x16x64_MI16x16x16x1_SN_1LDSB0_GRVW4_GSU1_LPB16_LRVW8_MIWT2_1_NEPBS0_NLCA1_PLR5_SS1_SU0_SUS0_SVW2_VW2_WG64_4_1_WGM1
    SolutionIndex: 12
    SolutionNameMin: Cijk_Ailk_Bljk_HHS_BH_Bias_AH_SDV_MT128x16x64_MI16x16x16x1_SN_1LDSB0_GRVW4_GSU7_LPB16_LRVW8_MIWT2_1_NEPBS0_NLCA1_PLR5_SS1_SU4_SUS128_SVW1_VW1_WG64_4_1_WGM1
    SolutionIndex: 13
    SolutionNameMin: Cijk_Ailk_Bljk_HHS_BH_Bias_AH_SDV_MT128x16x64_MI16x16x16x1_SN_1LDSB0_GRVW4_GSU1_LPB16_LRVW8_MIWT2_1_NEPBS0_NLCA1_PLR5_SS1_SU0_SUS0_SVW1_VW1_WG64_4_1_WGM2
    SolutionIndex: 14
    SolutionNameMin: Cijk_Ailk_Bljk_HHS_BH_Bias_AH_SDV_MT128x16x64_MI16x16x16x1_SN_1LDSB0_GRVW4_GSU8_LPB16_LRVW8_MIWT2_1_NEPBS0_NLCA1_PLR5_SS1_SU0_SUS0_SVW2_VW2_WG64_4_1_WGM2
- - - [1104, 1, 1, 4608, 1104, 1104, 1104, 4608]
    - [2, 225.657]
  - - [1104, 16, 1, 4608, 1104, 1104, 1104, 4608]
    - [2, 3590.13]
  - - [1104, 1335, 1, 4608, 1104, 1104, 1104, 4608]
    - [0, 102975.0]
  - - [1104, 1408, 1, 4608, 1104, 1104, 1104, 4608]
    - [0, 107796.0]
  - - [4608, 1, 1, 320, 4608, 4608, 4608, 320]
    - [1, 146.518]
  - - [4608, 16, 1, 320, 4608, 4608, 4608, 320]
    - [11, 2391.82]
  - - [4608, 1335, 1, 320, 4608, 4608, 4608, 320]
    - [7, 65705.4]
  - - [4608, 1408, 1, 320, 4608, 4608, 4608, 320]
    - [10, 75750.8]
  - - [16, 1, 1, 4608, 16, 16, 16, 4608]
    - [4, 3.67757]
  - - [16, 16, 1, 4608, 16, 16, 16, 4608]
    - [5, 55.8544]
  - - [16, 1335, 1, 4608, 16, 16, 16, 4608]
    - [3, 4338.28]
  - - [16, 1408, 1, 4608, 16, 16, 16, 4608]
    - [2, 4511.86]
  - - [768, 1, 1, 4608, 768, 768, 768, 4608]
    - [14, 161.154]
  - - [768, 16, 1, 4608, 768, 768, 768, 4608]
    - [12, 2382.32]
  - - [768, 1335, 1, 4608, 768, 768, 768, 4608]
    - [6, 90493.4]
  - - [768, 1408, 1, 4608, 768, 768, 768, 4608]
    - [6, 95735.1]
  - - [4608, 1, 1, 768, 4608, 4608, 4608, 768]
    - [1, 281.046]
  - - [4608, 16, 1, 768, 4608, 4608, 4608, 768]
    - [13, 4587.1]
  - - [4608, 1335, 1, 768, 4608, 4608, 4608, 768]
    - [9, 93398.6]
  - - [4608, 1408, 1, 768, 4608, 4608, 4608, 768]
    - [8, 102208.0]
- null
- null
- DeviceEfficiency
- null
- Equality
