library/src/amd_detail/rocblaslt/src/Tensile/Logic/asm_full/aldebaran/110CU/Equality/aldebaran_Cijk_Ailk_Bljk_HHS_BH.yaml
- {MinimumRequiredVersion: 4.33.0}
- aldebaran
- gfx90a
- [Device 0050, Device 0051, Device 0052, Device 0054, Device 0062, Device 7400, Device
    SolutionIndex: 0
    SolutionNameMin: Cijk_Ailk_Bljk_HHS_BH_MT64x16x64_MI16x16x16x1_SN_GRVW2_GSU6_MIWT1_1_SU0_SUS0_SRVW0_SVW4_VW2_WG64_4_1_WGM1
    SolutionIndex: 1
    SolutionNameMin: Cijk_Ailk_Bljk_HHS_BH_MT128x128x32_MI32x32x8x1_SN_1LDSB0_GRVW8_LPB8_LRVW8_MIWT2_2_NEPBS0_NLCA1_PLR5_SS0_SU4_SUS128_SRVW4_SVW4_VW1_WG64_4_1_WGM21
    SolutionIndex: 2
    SolutionNameMin: Cijk_Ailk_Bljk_HHS_BH_MT128x128x32_MI32x32x8x1_SN_1LDSB0_GRVW8_LPB8_LRVW8_MIWT2_2_NEPBS2_NLCA1_PLR5_SS0_SU4_SUS256_SRVW4_SVW4_VW2_WG64_4_1_WGM15
    SolutionIndex: 3
    SolutionNameMin: Cijk_Ailk_Bljk_HHS_BH_MT64x16x64_MI16x16x16x1_SN_GRVW8_GSU1_LPB16_LRVW8_MIWT1_1_PLR5_SU0_SUS0_SVW4_VW2_WG64_4_1_WGM1
    SolutionIndex: 4
    SolutionNameMin: Cijk_Ailk_Bljk_HHS_BH_MT64x16x64_MI16x16x16x1_SN_GRVW4_GSU1_LPB16_LRVW8_MIWT1_1_PLR5_SU0_SUS0_SVW4_VW8_WG64_4_1_WGM1
    SolutionIndex: 5
    SolutionNameMin: Cijk_Ailk_Bljk_HHS_BH_MT256x128x32_MI32x32x8x1_SN_1LDSB1_GRVW8_LPB8_LRVW8_MIWT4_2_NEPBS2_NLCA1_PLR5_SS1_SU0_SUS0_SRVW0_SVW4_VW4_WG64_4_1_WGM1
    SolutionIndex: 6
    SolutionNameMin: Cijk_Ailk_Bljk_HHS_BH_MT256x128x32_MI32x32x8x1_SN_1LDSB1_GRVW8_LPB8_LRVW8_MIWT4_2_NEPBS2_NLCA1_PLR5_SS1_SU0_SUS0_SRVW0_SVW2_VW2_WG64_4_1_WGM1
    SolutionIndex: 7
    SolutionNameMin: Cijk_Ailk_Bljk_HHS_BH_MT32x16x64_MI16x16x16x1_SN_GRVW8_GSU25_LPB16_LRVW8_MIWT1_1_PLR5_SU0_SUS0_SVW2_VW8_WG32_4_1_WGM8
    SolutionIndex: 8
    SolutionNameMin: Cijk_Ailk_Bljk_HHS_BH_MT16x16x64_MI16x16x16x1_SN_GRVW8_GSU25_LPB16_LRVW8_MIWT1_1_PLR5_SU0_SUS0_SVW4_VW8_WG16_4_1_WGM1
    SolutionIndex: 9
    SolutionNameMin: Cijk_Ailk_Bljk_HHS_BH_MT128x96x64_MI32x32x8x1_SN_1LDSB0_GRVW8_LPB8_LRVW8_MIWT1_3_NEPBS0_NLCA1_PLR9_SS0_SU4_SUS128_SRVW4_SVW4_VW1_WG128_2_1_WGM21
    SolutionIndex: 10
    SolutionNameMin: Cijk_Ailk_Bljk_HHS_BH_MT128x96x64_MI32x32x8x1_SE_1LDSB0_AF0EM8_EPS0_GRVW8_GSU1_GSUAMB_LBSPP128_LPB8_LRVW8_NLCA1_PGR2_PLR9_SU0_SUS0_SRVW4_TT1_96_TLDS1_VAW2_WSGRA1_WSGRB1_WG128_2_1_WGM15
    SolutionIndex: 11
    SolutionNameMin: Cijk_Ailk_Bljk_HHS_BH_MT64x16x64_MI16x16x16x1_SN_GRVW2_GSU1_LPB16_LRVW8_MIWT1_1_PLR5_SU0_SUS0_SVW4_VW2_WG64_4_1_WGM1
    SolutionIndex: 12
    SolutionNameMin: Cijk_Ailk_Bljk_HHS_BH_MT256x128x32_MI32x32x8x1_SN_1LDSB1_GRVW8_LPB8_LRVW8_MIWT4_2_NEPBS2_NLCA1_PLR5_SS1_SU0_SUS0_SRVW0_SVW2_VW2_WG64_4_1_WGM15
    SolutionIndex: 13
    SolutionNameMin: Cijk_Ailk_Bljk_HHS_BH_MT256x128x32_MI32x32x8x1_SN_1LDSB1_GRVW8_LPB8_LRVW8_MIWT4_2_NEPBS2_NLCA1_PLR5_SS1_SU0_SUS0_SRVW0_SVW1_VW1_WG64_4_1_WGM1
    SolutionIndex: 14
    SolutionNameMin: Cijk_Ailk_Bljk_HHS_BH_MT64x128x64_MI16x16x16x1_SN_MIWT2_4_SU0_SUS0_WSGRA1_WSGRB1_WGM16
    SolutionIndex: 15
    SolutionNameMin: Cijk_Ailk_Bljk_HHS_BH_MT128x96x64_MI32x32x8x1_SN_MIWT1_3_SU0_SUS0_WSGRA1_WSGRB1_WGM110
    SolutionIndex: 16
    SolutionNameMin: Cijk_Ailk_Bljk_HHS_BH_MT64x128x64_MI32x32x8x1_SN_MIWT1_2_SU0_SUS0_WSGRA0_WSGRB0_WGM1
    SolutionIndex: 17
    SolutionNameMin: Cijk_Ailk_Bljk_HHS_BH_MT128x64x64_MI32x32x8x1_SN_MIWT1_2_SU0_SUS0_WSGRA0_WSGRB1_WGM1
    SolutionIndex: 18
    SolutionNameMin: Cijk_Ailk_Bljk_HHS_BH_MT128x128x32_MI32x32x8x1_SN_MIWT2_2_SU4_SUS128_WSGRA1_WSGRB0_WGM8
    SolutionIndex: 19
    SolutionNameMin: Cijk_Ailk_Bljk_HHS_BH_MT256x128x32_MI32x32x8x1_SN_MIWT2_4_SU4_SUS128_WSGRA0_WSGRB1_WGM4
    SolutionIndex: 20
    SolutionNameMin: Cijk_Ailk_Bljk_HHS_BH_MT256x128x32_MI32x32x8x1_SN_MIWT2_4_SU0_SUS0_WSGRA0_WSGRB0_WGM1
    SolutionIndex: 21
    SolutionNameMin: Cijk_Ailk_Bljk_HHS_BH_MT128x48x64_MI16x16x16x1_SN_MIWT2_3_SU0_SUS0_WSGRA0_WSGRB1_WGM8
    SolutionIndex: 22
    SolutionNameMin: Cijk_Ailk_Bljk_HHS_BH_MT128x96x64_MI32x32x8x1_SN_MIWT1_3_SU0_SUS0_WSGRA1_WSGRB1_WGM110
    SolutionIndex: 23
    SolutionNameMin: Cijk_Ailk_Bljk_HHS_BH_MT32x16x64_MI16x16x16x1_SN_MIWT1_1_SU0_SUS0_WSGRA0_WSGRB1_WGM110
    SolutionIndex: 24
    SolutionNameMin: Cijk_Ailk_Bljk_HHS_BH_MT64x32x64_MI16x16x16x1_SN_MIWT1_2_SU4_SUS256_WSGRA1_WSGRB0_WGM32
    SolutionIndex: 25
    SolutionNameMin: Cijk_Ailk_Bljk_HHS_BH_MT64x128x64_MI32x32x8x1_SN_MIWT2_1_SU32_SUS128_WSGRA1_WSGRB1_WGM1
    SolutionIndex: 26
    SolutionNameMin: Cijk_Ailk_Bljk_HHS_BH_MT128x192x64_MI32x32x8x1_SN_MIWT2_3_SU0_SUS0_WSGRA0_WSGRB1_WGM1
    SolutionIndex: 27
    SolutionNameMin: Cijk_Ailk_Bljk_HHS_BH_MT64x64x16_MI16x16x16x1_SN_MIWT1_4_SU0_SUS0_WSGRA1_WSGRB0_WGM64
    SolutionIndex: 28
    SolutionNameMin: Cijk_Ailk_Bljk_HHS_BH_MT96x64x16_MI16x16x16x1_SN_MIWT3_2_SU0_SUS0_WSGRA0_WSGRB0_WGM1
    SolutionIndex: 29
    SolutionNameMin: Cijk_Ailk_Bljk_HHS_BH_MT64x128x64_MI32x32x8x1_SN_MIWT1_2_SU0_SUS0_WSGRA1_WSGRB0_WGM16
    SolutionIndex: 30
    SolutionNameMin: Cijk_Ailk_Bljk_HHS_BH_MT128x32x64_MI32x32x8x1_SN_GRVW8_GSU12_LPB8_MIWT1_1_NTA3_PGR2_PLR1_SS0_SVW4_WSGRA1_WG128_2_1
    SolutionIndex: 31
    SolutionNameMin: Cijk_Ailk_Bljk_HHS_BH_MT128x32x64_MI32x32x8x1_SN_GRVW8_GSU18_LPB8_MIWT1_1_NTA2_PGR2_PLR9_SS0_SVW4_WSGRA0_WG128_2_1
    SolutionIndex: 32
    SolutionNameMin: Cijk_Ailk_Bljk_HHS_BH_MT128x32x64_MI32x32x8x1_SN_GRVW8_GSU18_LPB8_MIWT1_1_NTA2_PGR2_PLR9_SS0_SVW4_WSGRA1_WG128_2_1
    SolutionIndex: 33
    SolutionNameMin: Cijk_Ailk_Bljk_HHS_BH_MT16x32x64_MI16x16x16x1_SN_GRVW8_LPB8_MIWT1_1_NTB3_NEPBS0_PGR2_PLR5_SPO1
    SolutionIndex: 34
    SolutionNameMin: Cijk_Ailk_Bljk_HHS_BH_MT16x32x64_MI16x16x16x1_SN_GRVW8_LPB8_MIWT1_1_NTB3_NEPBS1_PGR2_PLR5_SPO1
- - - [1104, 1, 1, 4608]
    - [30, 905.255]
  - - [1104, 16, 1, 4608]
    - [0, 7016.87]
  - - [1104, 1335, 1, 4608]
    - [1, 110165.0]
  - - [1104, 1408, 1, 4608]
    - [2, 112807.0]
  - - [4608, 1, 1, 320]
    - [3, 526.629]
  - - [4608, 16, 1, 320]
    - [4, 8307.38]
  - - [4608, 1335, 1, 320]
    - [5, 100109.0]
  - - [4608, 1408, 1, 320]
    - [6, 108315.0]
  - - [16, 1, 1, 4608]
    - [7, 15.3855]
  - - [16, 16, 1, 4608]
    - [8, 240.548]
  - - [16, 1335, 1, 4608]
    - [33, 11550.5]
  - - [16, 1408, 1, 4608]
    - [34, 11883.4]
  - - [768, 1, 1, 4608]
    - [31, 758.423]
  - - [768, 16, 1, 4608]
    - [32, 9967.58]
  - - [768, 1335, 1, 4608]
    - [9, 110261.0]
  - - [768, 1408, 1, 4608]
    - [10, 97011.9]
  - - [4608, 1, 1, 768]
    - [3, 739.746]
  - - [4608, 16, 1, 768]
    - [11, 11452.9]
  - - [4608, 1335, 1, 768]
    - [12, 118018.0]
  - - [4608, 1408, 1, 768]
    - [13, 125931.0]
  - - [320, 8192, 1, 320]
    - [14, 72716.5]
  - - [640, 2048, 1, 640]
    - [15, 90161.3]
  - - [320, 8192, 1, 1280]
    - [16, 86784.6]
  - - [1280, 512, 1, 1280]
    - [17, 77328.6]
  - - [10240, 512, 1, 1280]
    - [18, 131298.0]
  - - [2560, 8192, 1, 320]
    - [19, 122856.0]
  - - [5120, 2048, 1, 640]
    - [20, 130990.0]
  - - [1280, 512, 1, 5120]
    - [21, 96509.4]
  - - [640, 2048, 1, 2560]
    - [22, 125691.0]
  - - [320, 154, 1, 768]
    - [23, 8809.83]
  - - [1280, 154, 1, 768]
    - [24, 27734.6]
  - - [40, 4096, 16, 4096]
    - [25, 36289.7]
  - - [80, 1024, 16, 1024]
    - [26, 46837.5]
  - - [40, 4096, 16, 77]
    - [27, 14584.6]
  - - [80, 1024, 16, 77]
    - [28, 16050.5]
  - - [160, 256, 16, 256]
    - [29, 32115.7]
- null
- null
- DeviceEfficiency
- null
- Equality
