library/src/amd_detail/rocblaslt/src/Tensile/Logic/asm_full/aldebaran/110CU/Equality/aldebaran_Cijk_Ailk_Bljk_HHS_BH_Bias_AH.yaml
- {MinimumRequiredVersion: 4.33.0}
- aldebaran
- gfx90a
- [Device 0050, Device 0051, Device 0052, Device 0054, Device 0062, Device 7400, Device
    SolutionIndex: 0
    SolutionNameMin: Cijk_Ailk_Bljk_HHS_BH_BiasS_AH_MT128x128x32_MI32x32x8x1_SN_1LDSB0_AFC1_GRVW8_GSU1_LPB8_LRVW8_MIWT2_2_NEPBS0_PLR5_SU4_SUS128_SPO0_SVW2_VW2_WG64_4_1_WGM4
    SolutionIndex: 1
    SolutionNameMin: Cijk_Ailk_Bljk_HHS_BH_BiasS_AH_MT128x128x32_MI32x32x8x1_SN_1LDSB0_AFC1_GRVW8_GSU1_LPB8_LRVW8_MIWT2_2_NEPBS0_PLR5_SU4_SUS256_SPO0_SVW2_VW2_WG64_4_1_WGM4
    SolutionIndex: 2
    SolutionNameMin: Cijk_Ailk_Bljk_HHS_BH_BiasS_AH_MT128x128x32_MI32x32x8x1_SN_1LDSB1_AFC1_GRVW8_GSU1_LPB8_LRVW8_MIWT2_2_NEPBS2_PLR5_SU0_SUS0_SPO1_SVW2_VW2_WG64_4_1_WGM4
    SolutionIndex: 3
    SolutionNameMin: Cijk_Ailk_Bljk_HHS_BH_BiasS_AH_MT128x128x32_MI32x32x8x1_SN_1LDSB1_AFC1_GRVW8_GSU1_LPB8_LRVW8_MIWT2_2_NEPBS2_PLR5_SU4_SUS128_SPO1_SVW2_VW2_WG64_4_1_WGM8
    SolutionIndex: 4
    SolutionNameMin: Cijk_Ailk_Bljk_HHS_BH_BiasS_AH_MT128x128x32_MI32x32x8x1_SN_1LDSB1_AFC1_GRVW8_GSU1_LPB8_LRVW8_MIWT2_2_NEPBS2_PLR5_SU4_SUS256_SPO1_SVW2_VW2_WG64_4_1_WGM8
    SolutionIndex: 5
    SolutionNameMin: Cijk_Ailk_Bljk_HHS_BH_BiasS_AH_MT64x16x64_MI16x16x16x1_SN_1LDSB0_AFC0_GRVW4_GSU5_LPB16_LRVW8_MIWT1_1_NEPBS2_PLR5_SU4_SUS256_SPO1_SVW1_VW1_WG64_4_1_WGM4
    SolutionIndex: 6
    SolutionNameMin: Cijk_Ailk_Bljk_HHS_BH_BiasS_AH_MT64x16x64_MI16x16x16x1_SN_1LDSB0_AFC1_GRVW4_GSU1_LPB16_LRVW8_MIWT1_1_NEPBS2_PLR5_SU0_SUS0_SPO1_SVW1_VW1_WG64_4_1_WGM8
    SolutionIndex: 7
    SolutionNameMin: Cijk_Ailk_Bljk_HHS_BH_BiasS_AH_MT128x16x64_MI16x16x16x1_SN_1LDSB0_AFC1_GRVW4_GSU1_LPB16_LRVW8_MIWT2_1_NEPBS0_PLR5_SU0_SUS0_SPO0_SVW2_VW2_WG64_4_1_WGM2
    SolutionIndex: 8
    SolutionNameMin: Cijk_Ailk_Bljk_HHS_BH_BiasS_AH_MT32x32x64_MI16x16x16x1_SN_1LDSB0_AFC1_GRVW8_GSU1_LPB16_LRVW8_MIWT1_1_NEPBS2_PLR5_SU0_SUS0_SPO1_SVW1_VW1_WG32_8_1_WGM2
    SolutionIndex: 9
    SolutionNameMin: Cijk_Ailk_Bljk_HHS_BH_BiasS_AH_MT32x32x64_MI16x16x16x1_SN_1LDSB0_AFC1_GRVW8_GSU1_LPB16_LRVW8_MIWT1_1_NEPBS2_PLR5_SU0_SUS0_SPO1_SVW1_VW1_WG32_8_1_WGM4
    SolutionIndex: 10
    SolutionNameMin: Cijk_Ailk_Bljk_HHS_BH_BiasS_AH_MT32x32x64_MI16x16x16x1_SN_1LDSB0_AFC0_GRVW8_GSU8_LPB16_LRVW8_MIWT1_1_NEPBS2_PLR5_SU4_SUS128_SPO1_SVW1_VW1_WG32_8_1_WGM4
    SolutionIndex: 11
    SolutionNameMin: Cijk_Ailk_Bljk_HHS_BH_BiasS_AH_MT32x32x64_MI16x16x16x1_SN_1LDSB0_AFC0_GRVW8_GSU5_LPB16_LRVW8_MIWT1_1_NEPBS2_PLR5_SU0_SUS0_SPO1_SVW1_VW1_WG32_8_1_WGM8
    SolutionIndex: 12
    SolutionNameMin: Cijk_Ailk_Bljk_HHS_BH_BiasS_AH_MT128x96x64_MI32x32x8x1_SN_1LDSB0_AFC1_GRVW8_GSU1_LPB8_LRVW8_MIWT1_3_NEPBS0_PLR9_SU4_SUS256_SPO0_SVW1_VW1_WG128_2_1_WGM4
    SolutionIndex: 13
    SolutionNameMin: Cijk_Ailk_Bljk_HHS_BH_BiasS_AH_MT128x96x64_MI32x32x8x1_SN_1LDSB0_AFC1_GRVW8_GSU1_LPB8_LRVW8_MIWT1_3_NEPBS0_PLR9_SU4_SUS256_SPO0_SVW1_VW1_WG128_2_1_WGM8
- - - [1104, 1, 1, 4608, 1104, 1104, 1104, 4608]
    - [9, 218.148]
  - - [1104, 16, 1, 4608, 1104, 1104, 1104, 4608]
    - [8, 3459.52]
  - - [1104, 1335, 1, 4608, 1104, 1104, 1104, 4608]
    - [0, 98666.9]
  - - [1104, 1408, 1, 4608, 1104, 1104, 1104, 4608]
    - [1, 104426.0]
  - - [4608, 1, 1, 320, 4608, 4608, 4608, 320]
    - [7, 136.837]
  - - [4608, 16, 1, 320, 4608, 4608, 4608, 320]
    - [7, 2214.05]
  - - [4608, 1335, 1, 320, 4608, 4608, 4608, 320]
    - [2, 61686.3]
  - - [4608, 1408, 1, 320, 4608, 4608, 4608, 320]
    - [4, 65206.6]
  - - [16, 1, 1, 4608, 16, 16, 16, 4608]
    - [10, 3.52832]
  - - [16, 16, 1, 4608, 16, 16, 16, 4608]
    - [11, 54.0922]
  - - [16, 1335, 1, 4608, 16, 16, 16, 4608]
    - [8, 4101.1]
  - - [16, 1408, 1, 4608, 16, 16, 16, 4608]
    - [8, 4342.74]
  - - [768, 1, 1, 4608, 768, 768, 768, 4608]
    - [5, 148.945]
  - - [768, 16, 1, 4608, 768, 768, 768, 4608]
    - [8, 2238.42]
  - - [768, 1335, 1, 4608, 768, 768, 768, 4608]
    - [12, 84619.7]
  - - [768, 1408, 1, 4608, 768, 768, 768, 4608]
    - [13, 86543.4]
  - - [4608, 1, 1, 768, 4608, 4608, 4608, 768]
    - [6, 266.807]
  - - [4608, 16, 1, 768, 4608, 4608, 4608, 768]
    - [7, 4276.67]
  - - [4608, 1335, 1, 768, 4608, 4608, 4608, 768]
    - [3, 90148.0]
  - - [4608, 1408, 1, 768, 4608, 4608, 4608, 768]
    - [3, 94357.4]
- null
- null
- DeviceEfficiency
- null
- Equality