library/src/amd_detail/rocblaslt/src/Tensile/Logic/asm_full/aldebaran/110CU/Equality/aldebaran_Cijk_Ailk_Bljk_HHS_BH.yaml
- {MinimumRequiredVersion: 4.33.0}
- aldebaran
- gfx90a
- [Device 0050, Device 0051, Device 0052, Device 0054, Device 0062, Device 7400, Device
    SolutionIndex: 0
    SolutionNameMin: Cijk_Ailk_Bljk_HHS_BH_MT32x16x64_MI16x16x16x1_SN_GRVW8_GSU6_MIWT1_1_SU0_SUS0_SRVW0_SVW4_VW8_WG32_4_1_WGM1
    SolutionIndex: 1
    SolutionNameMin: Cijk_Ailk_Bljk_HHS_BH_MT64x16x64_MI16x16x16x1_SN_GRVW2_GSU6_MIWT1_1_SU0_SUS0_SRVW0_SVW4_VW2_WG64_4_1_WGM1
    SolutionIndex: 2
    SolutionNameMin: Cijk_Ailk_Bljk_HHS_BH_MT128x128x32_MI32x32x8x1_SN_1LDSB0_GRVW8_LPB8_LRVW8_MIWT2_2_NEPBS0_NLCA1_PLR5_SS0_SU4_SUS128_SRVW4_SVW4_VW1_WG64_4_1_WGM21
    SolutionIndex: 3
    SolutionNameMin: Cijk_Ailk_Bljk_HHS_BH_MT128x128x32_MI32x32x8x1_SN_1LDSB0_GRVW8_LPB8_LRVW8_MIWT2_2_NEPBS2_NLCA1_PLR5_SS0_SU4_SUS256_SRVW4_SVW4_VW2_WG64_4_1_WGM15
    SolutionIndex: 4
    SolutionNameMin: Cijk_Ailk_Bljk_HHS_BH_MT64x16x64_MI16x16x16x1_SN_GRVW8_GSU1_LPB16_LRVW8_MIWT1_1_PLR5_SU0_SUS0_SVW4_VW2_WG64_4_1_WGM1
    SolutionIndex: 5
    SolutionNameMin: Cijk_Ailk_Bljk_HHS_BH_MT64x16x64_MI16x16x16x1_SN_GRVW4_GSU1_LPB16_LRVW8_MIWT1_1_PLR5_SU0_SUS0_SVW4_VW8_WG64_4_1_WGM1
    SolutionIndex: 6
    SolutionNameMin: Cijk_Ailk_Bljk_HHS_BH_MT256x128x32_MI32x32x8x1_SN_1LDSB1_GRVW8_LPB8_LRVW8_MIWT4_2_NEPBS2_NLCA1_PLR5_SS1_SU0_SUS0_SRVW0_SVW4_VW4_WG64_4_1_WGM1
    SolutionIndex: 7
    SolutionNameMin: Cijk_Ailk_Bljk_HHS_BH_MT256x128x32_MI32x32x8x1_SN_1LDSB1_GRVW8_LPB8_LRVW8_MIWT4_2_NEPBS2_NLCA1_PLR5_SS1_SU0_SUS0_SRVW0_SVW2_VW2_WG64_4_1_WGM1
    SolutionIndex: 8
    SolutionNameMin: Cijk_Ailk_Bljk_HHS_BH_MT32x16x64_MI16x16x16x1_SN_GRVW8_GSU12_LPB16_LRVW8_MIWT1_1_PLR5_SU0_SUS0_SVW2_VW8_WG32_4_1_WGM8
    SolutionIndex: 9
    SolutionNameMin: Cijk_Ailk_Bljk_HHS_BH_MT16x16x64_MI16x16x16x1_SN_GRVW8_GSU12_LPB16_LRVW8_MIWT1_1_PLR5_SU0_SUS0_SVW4_VW8_WG16_4_1_WGM1
    SolutionIndex: 10
    SolutionNameMin: Cijk_Ailk_Bljk_HHS_BH_MT16x32x64_MI16x16x16x1_SN_GRVW2_GSU7_LPB4_LRVW4_MIWT1_1_PLR5_SU32_SUS128_SVW4_VW2_WG16_8_1_WGM1
    SolutionIndex: 11
    SolutionNameMin: Cijk_Ailk_Bljk_HHS_BH_MT16x32x64_MI16x16x16x1_SN_GRVW2_GSU7_LPB4_LRVW4_MIWT1_1_PLR5_SU0_SUS0_SVW2_VW2_WG16_8_1_WGM1
    SolutionIndex: 12
    SolutionNameMin: Cijk_Ailk_Bljk_HHS_BH_MT64x16x64_MI16x16x16x1_SN_GRVW8_GSU9_LPB16_LRVW8_MIWT1_1_PLR5_SU0_SUS0_SVW4_VW4_WG64_4_1_WGM8
    SolutionIndex: 13
    SolutionNameMin: Cijk_Ailk_Bljk_HHS_BH_MT64x16x64_MI16x16x16x1_SN_GRVW2_GSU9_MIWT1_1_SU0_SUS0_SRVW0_SVW4_VW4_WG64_4_1_WGM15
    SolutionIndex: 14
    SolutionNameMin: Cijk_Ailk_Bljk_HHS_BH_MT128x96x64_MI32x32x8x1_SN_1LDSB0_GRVW8_LPB8_LRVW8_MIWT1_3_NEPBS0_NLCA1_PLR9_SS0_SU4_SUS128_SRVW4_SVW4_VW1_WG128_2_1_WGM21
    SolutionIndex: 15
    SolutionNameMin: Cijk_Ailk_Bljk_HHS_BH_MT128x96x64_MI32x32x8x1_SE_1LDSB0_AF0EM8_EPS0_GRVW8_GSU1_GSUAMB_LBSPP128_LPB8_LRVW8_NLCA1_PGR2_PLR9_SU0_SUS0_SRVW4_TT1_96_TLDS1_VAW2_WSGRA1_WSGRB1_WG128_2_1_WGM15
    SolutionIndex: 16
    SolutionNameMin: Cijk_Ailk_Bljk_HHS_BH_MT64x16x64_MI16x16x16x1_SN_GRVW2_GSU1_LPB16_LRVW8_MIWT1_1_PLR5_SU0_SUS0_SVW4_VW2_WG64_4_1_WGM1
    SolutionIndex: 17
    SolutionNameMin: Cijk_Ailk_Bljk_HHS_BH_MT256x128x32_MI32x32x8x1_SN_1LDSB1_GRVW8_LPB8_LRVW8_MIWT4_2_NEPBS2_NLCA1_PLR5_SS1_SU0_SUS0_SRVW0_SVW2_VW2_WG64_4_1_WGM15
    SolutionIndex: 18
    SolutionNameMin: Cijk_Ailk_Bljk_HHS_BH_MT256x128x32_MI32x32x8x1_SN_1LDSB1_GRVW8_LPB8_LRVW8_MIWT4_2_NEPBS2_NLCA1_PLR5_SS1_SU0_SUS0_SRVW0_SVW1_VW1_WG64_4_1_WGM1
    SolutionIndex: 19
    SolutionNameMin: Cijk_Ailk_Bljk_HHS_BH_MT128x64x16_MI32x32x8x1_SN_1LDSB0_GRVW4_LPB4_LRVW4_MIWT1_2_PLR3_SS0_SU0_SUS0_SRVW4_SVW4_VW4_WG128_2_1_WGM8
    SolutionIndex: 20
    SolutionNameMin: Cijk_Ailk_Bljk_HHS_BH_MT128x128x32_MI32x32x8x1_SN_1LDSB0_GRVW8_LPB8_LRVW8_MIWT2_2_PLR5_SS1_SU32_SUS128_SRVW0_SVW2_VW2_WG64_4_1_WGM15
    SolutionIndex: 21
    SolutionNameMin: Cijk_Ailk_Bljk_HHS_BH_MT128x64x64_MI32x32x8x1_SN_1LDSB0_GRVW8_LPB8_LRVW8_MIWT1_2_PLR9_SS0_SU0_SUS0_SRVW4_SVW4_VW4_WG128_2_1_WGM15
    SolutionIndex: 22
    SolutionNameMin: Cijk_Ailk_Bljk_HHS_BH_MT384x64x32_MI32x32x8x1_SN_1LDSB0_GRVW8_LPB8_LRVW8_MIWT3_2_NLCA3_PLR5_SS0_SU0_SUS0_SRVW0_SVW4_VW4_WGM2
    SolutionIndex: 23
    SolutionNameMin: Cijk_Ailk_Bljk_HHS_BH_MT256x64x32_MI32x32x8x1_SN_1LDSB1_GRVW8_LPB8_LRVW4_MIWT2_2_PLR5_SS1_SU0_SUS0_SRVW0_SVW2_VW2_WGM2
    SolutionIndex: 24
    SolutionNameMin: Cijk_Ailk_Bljk_HHS_BH_MT256x128x32_MI32x32x8x1_SN_1LDSB1_GRVW8_LPB8_LRVW4_MIWT4_2_PLR5_SS1_SU0_SUS0_SRVW0_SVW2_VW2_WG64_4_1_WGM2
    SolutionIndex: 25
    SolutionNameMin: Cijk_Ailk_Bljk_HHS_BH_MT256x128x32_MI32x32x8x1_SN_1LDSB1_GRVW8_LPB8_LRVW8_MIWT2_4_PLR5_SS0_SU32_SUS128_SRVW4_SVW2_VW8_WG128_2_1_WGM2
    SolutionIndex: 26
    SolutionNameMin: Cijk_Ailk_Bljk_HHS_BH_MT128x64x64_MI32x32x8x1_SN_1LDSB0_GRVW8_LPB8_LRVW8_MIWT1_2_PLR9_SS0_SU0_SUS0_SRVW4_SVW4_VW8_WG128_2_1_WGM1
    SolutionIndex: 27
    SolutionNameMin: Cijk_Ailk_Bljk_HHS_BH_MT128x64x64_MI32x32x8x1_SN_1LDSB0_GRVW4_LPB8_LRVW8_MIWT2_1_NLCA1_PLR9_SS0_SU0_SUS0_SRVW4_SVW4_VW4_WG64_4_1_WGM1
    SolutionIndex: 28
    SolutionNameMin: Cijk_Ailk_Bljk_HHS_BH_MT256x96x32_MI32x32x8x1_SN_1LDSB0_GRVW2_LPB4_LRVW4_MIWT2_3_PLR5_SS0_SU32_SUS128_SRVW4_SVW4_VW2_WG128_2_1_WGM8
    SolutionIndex: 29
    SolutionNameMin: Cijk_Ailk_Bljk_HHS_BH_MT128x32x16_MI32x32x8x1_SN_GRVW2_LPB4_LRVW4_MIWT1_1_PLR3_SS0_SU0_SUS0_SRVW4_SVW2_VW4_WG128_2_1_WGM2
    SolutionIndex: 30
    SolutionNameMin: Cijk_Ailk_Bljk_HHS_BH_MT32x32x64_MI16x16x16x1_SN_AF0EM2_GRVW8_LPB16_LRVW8_MIWT1_1_PLR5_SU0_SUS0_SRVW0_SVW4_VW2_WG32_8_1_WGM1
    SolutionIndex: 31
    SolutionNameMin: Cijk_Ailk_Bljk_HHS_BH_MT32x64x64_MI16x16x16x1_SN_AF0EM2_GRVW8_LPB16_LRVW8_MIWT1_2_PLR5_SS0_SU32_SUS256_SRVW0_SVW4_VW4_WG32_8_1_WGM1
    SolutionIndex: 32
    SolutionNameMin: Cijk_Ailk_Bljk_HHS_BH_MT96x128x64_MI32x32x8x1_SN_1LDSB0_GRVW8_LPB8_LRVW8_MIWT3_1_PLR9_SVW4_VW8_WG32_8_1_WGM15
- - - [1104, 1, 1, 4608, 1104, 1104, 1104, 4608]
    - [0, 675.057]
  - - [1104, 16, 1, 4608, 1104, 1104, 1104, 4608]
    - [1, 7016.87]
  - - [1104, 1335, 1, 4608, 1104, 1104, 1104, 4608]
    - [2, 110165.0]
  - - [1104, 1408, 1, 4608, 1104, 1104, 1104, 4608]
    - [3, 112807.0]
  - - [4608, 1, 1, 320, 4608, 4608, 4608, 320]
    - [4, 526.629]
  - - [4608, 16, 1, 320, 4608, 4608, 4608, 320]
    - [5, 8307.38]
  - - [4608, 1335, 1, 320, 4608, 4608, 4608, 320]
    - [6, 100109.0]
  - - [4608, 1408, 1, 320, 4608, 4608, 4608, 320]
    - [7, 108315.0]
  - - [16, 1, 1, 4608, 16, 16, 16, 4608]
    - [8, 15.3855]
  - - [16, 16, 1, 4608, 16, 16, 16, 4608]
    - [9, 240.548]
  - - [16, 1335, 1, 4608, 16, 16, 16, 4608]
    - [10, 7694.41]
  - - [16, 1408, 1, 4608, 16, 16, 16, 4608]
    - [11, 7774.79]
  - - [768, 1, 1, 4608, 768, 768, 768, 4608]
    - [12, 564.966]
  - - [768, 16, 1, 4608, 768, 768, 768, 4608]
    - [13, 6325.19]
  - - [768, 1335, 1, 4608, 768, 768, 768, 4608]
    - [14, 110261.0]
  - - [768, 1408, 1, 4608, 768, 768, 768, 4608]
    - [15, 97011.9]
  - - [4608, 1, 1, 768, 4608, 4608, 4608, 768]
    - [4, 739.746]
  - - [4608, 16, 1, 768, 4608, 4608, 4608, 768]
    - [16, 11452.9]
  - - [4608, 1335, 1, 768, 4608, 4608, 4608, 768]
    - [17, 118018.0]
  - - [4608, 1408, 1, 768, 4608, 4608, 4608, 768]
    - [18, 125931.0]
  - - [8192, 320, 1, 320, 8192, 8192, 8192, 320]
    - [19, 79078.1]
  - - [2048, 640, 1, 640, 2048, 2048, 2048, 640]
    - [20, 76426.8]
  - - [512, 1280, 1,   1280, 512, 512, 512, 1280]
    - [21, 76204.3]
  - - [8192, 320, 1, 1280, 8192, 8192, 8192, 1280]
    - [22, 109113.0]
  - - [512, 10240, 1, 1280, 512, 512, 512, 1280]
    - [23, 126031.0]
  - - [2048, 5120, 1, 640, 2048, 2048, 2048, 640]
    - [24, 127544.0]
  - - [8192, 2560, 1, 320, 8192, 8192, 8192, 320]
    - [25, 124239.0]
  - - [512, 1280, 1, 5120, 512, 512, 512, 5120]
    - [26, 95607.3]
  - - [2048, 640, 1, 2560, 2048, 2048, 2048, 2560]
    - [32, 107079.0]
  - - [4096, 40, 16, 4096, 4096, 4096, 4096, 4096]
    - [27, 52673.5]
    # - [99, 52830.9]
  - - [1024, 80, 16, 1024, 1024, 1024, 1024, 1024]
    - [28, 54418.4]
  - - [1024, 80, 16, 77, 1024, 1024, 1024, 77]
    - [29, 16320.4]
  - - [154, 320, 1, 768, 154, 154, 154, 768]
    - [30, 8227.62]
  - - [154, 1280, 1, 768, 154, 154, 154, 768]
    - [31, 26065.5]
- null
- null
- DeviceEfficiency
- null
- Equality
