library/src/amd_detail/rocblaslt/src/Tensile/Logic/asm_full/aldebaran/110CU/Equality/aldebaran_Cijk_Ailk_Bljk_HHS_BH_Bias_HAH_SAV.yaml
- {MinimumRequiredVersion: 4.33.0}
- aldebaran
- gfx90a
- [Device 0050, Device 0051, Device 0052, Device 0054, Device 0062, Device 7400, Device
    SolutionIndex: 0
    SolutionNameMin: Cijk_Ailk_Bljk_HHS_BH_Bias_HAH_SAV_MT128x128x32_MI32x32x8x1_SN_1LDSB0_GRVW8_GSU1_LPB8_LRVW8_MIWT2_2_NEPBS0_NLCA1_PLR5_SS0_SU4_SUS128_SVW4_VW1_WG64_4_1_WGM1
    SolutionIndex: 1
    SolutionNameMin: Cijk_Ailk_Bljk_HHS_BH_Bias_HAH_SAV_MT128x16x64_MI16x16x16x1_SN_1LDSB0_GRVW4_GSU1_LPB16_LRVW8_MIWT2_1_NEPBS0_NLCA1_PLR5_SS0_SU0_SUS0_SVW4_VW1_WG64_4_1_WGM4
    SolutionIndex: 2
    SolutionNameMin: Cijk_Ailk_Bljk_HHS_BH_Bias_HAH_SAV_MT32x32x64_MI16x16x16x1_SN_1LDSB0_GRVW8_GSU1_LPB16_LRVW8_MIWT1_1_NEPBS2_NLCA1_PLR5_SS0_SU4_SUS128_SVW4_VW1_WG32_8_1_WGM1
    SolutionIndex: 3
    SolutionNameMin: Cijk_Ailk_Bljk_HHS_BH_Bias_HAH_SAV_MT32x32x64_MI16x16x16x1_SN_1LDSB0_GRVW8_GSU1_LPB16_LRVW8_MIWT1_1_NEPBS2_NLCA1_PLR5_SS0_SU32_SUS128_SVW4_VW1_WG32_8_1_WGM1
    SolutionIndex: 4
    SolutionNameMin: Cijk_Ailk_Bljk_HHS_BH_Bias_HAH_SAV_MT32x32x64_MI16x16x16x1_SN_1LDSB0_GRVW8_GSU7_LPB16_LRVW8_MIWT1_1_NEPBS2_NLCA1_PLR5_SS0_SU0_SUS0_SVW4_VW1_WG32_8_1_WGM1
    SolutionIndex: 5
    SolutionNameMin: Cijk_Ailk_Bljk_HHS_BH_Bias_HAH_SAV_MT32x32x64_MI16x16x16x1_SN_1LDSB0_GRVW8_GSU7_LPB16_LRVW8_MIWT1_1_NEPBS2_NLCA1_PLR5_SS0_SU4_SUS128_SVW4_VW1_WG32_8_1_WGM2
    SolutionIndex: 6
    SolutionNameMin: Cijk_Ailk_Bljk_HHS_BH_Bias_HAH_SAV_MT128x96x64_MI32x32x8x1_SN_1LDSB0_GRVW8_GSU1_LPB8_LRVW8_MIWT1_3_NEPBS0_NLCA1_PLR9_SS0_SU4_SUS128_SVW4_VW1_WG128_2_1_WGM8
    SolutionIndex: 7
    SolutionNameMin: Cijk_Ailk_Bljk_HHS_BH_Bias_HAH_SAV_MT128x64x32_MI32x32x8x1_SN_1LDSB0_GRVW8_GSU1_LPB8_LRVW8_MIWT2_1_NEPBS2_NLCA1_PLR5_SS1_SU0_SUS0_SVW2_VW2_WG64_4_1_WGM8
    SolutionIndex: 8
    SolutionNameMin: Cijk_Ailk_Bljk_HHS_BH_Bias_HAH_SAV_MT128x128x32_MI32x32x8x1_SN_1LDSB1_GRVW8_GSU1_LPB8_LRVW8_MIWT2_2_NEPBS2_NLCA1_PLR5_SS1_SU0_SUS0_SVW2_VW2_WG64_4_1_WGM1
    SolutionIndex: 9
    SolutionNameMin: Cijk_Ailk_Bljk_HHS_BH_Bias_HAH_SAV_MT128x128x32_MI32x32x8x1_SN_1LDSB1_GRVW8_GSU1_LPB8_LRVW8_MIWT2_2_NEPBS2_NLCA1_PLR5_SS1_SU4_SUS256_SVW2_VW2_WG64_4_1_WGM4
    SolutionIndex: 10
    SolutionNameMin: Cijk_Ailk_Bljk_HHS_BH_Bias_HAH_SAV_MT128x128x32_MI32x32x8x1_SN_1LDSB1_GRVW8_GSU1_LPB8_LRVW8_MIWT2_2_NEPBS2_NLCA1_PLR5_SS1_SU32_SUS128_SVW2_VW2_WG64_4_1_WGM8
    SolutionIndex: 11
    SolutionNameMin: Cijk_Ailk_Bljk_HHS_BH_Bias_HAH_SAV_MT128x16x64_MI16x16x16x1_SN_1LDSB0_GRVW4_GSU1_LPB16_LRVW8_MIWT2_1_NEPBS0_NLCA1_PLR5_SS1_SU0_SUS0_SVW2_VW2_WG64_4_1_WGM1
    SolutionIndex: 12
    SolutionNameMin: Cijk_Ailk_Bljk_HHS_BH_Bias_HAH_SAV_MT128x16x64_MI16x16x16x1_SN_1LDSB0_GRVW4_GSU7_LPB16_LRVW8_MIWT2_1_NEPBS0_NLCA1_PLR5_SS1_SU4_SUS128_SVW1_VW1_WG64_4_1_WGM1
    SolutionIndex: 13
    SolutionNameMin: Cijk_Ailk_Bljk_HHS_BH_Bias_HAH_SAV_MT128x16x64_MI16x16x16x1_SN_1LDSB0_GRVW4_GSU1_LPB16_LRVW8_MIWT2_1_NEPBS0_NLCA1_PLR5_SS1_SU0_SUS0_SVW1_VW1_WG64_4_1_WGM2
    SolutionIndex: 14
    SolutionNameMin: Cijk_Ailk_Bljk_HHS_BH_Bias_HAH_SAV_MT128x16x64_MI16x16x16x1_SN_1LDSB0_GRVW4_GSU8_LPB16_LRVW8_MIWT2_1_NEPBS0_NLCA1_PLR5_SS1_SU0_SUS0_SVW2_VW2_WG64_4_1_WGM2
    SolutionIndex: 15
    SolutionNameMin: Cijk_Ailk_Bljk_HHS_BH_Bias_HAH_SAV_MT64x16x64_MI16x16x16x1_SN_GRVW8_GSU9_LPB16_LRVW8_MIWT1_1_PLR5_SU0_SUS0_SVW4_VW4_WG64_4_1_WGM8
    SolutionIndex: 16
    SolutionNameMin: Cijk_Ailk_Bljk_HHS_BH_Bias_HAH_SAV_MT64x16x64_MI16x16x16x1_SN_GRVW2_GSU9_MIWT1_1_SU0_SUS0_SRVW0_SVW4_VW4_WG64_4_1_WGM15
    SolutionIndex: 17
    SolutionNameMin: Cijk_Ailk_Bljk_HHS_BH_Bias_HAH_SAV_MT16x32x64_MI16x16x16x1_SN_GRVW8_LPB8_MIWT1_1_NTB3_NEPBS0_PGR2_PLR5_SPO1
    SolutionIndex: 18
    SolutionNameMin: Cijk_Ailk_Bljk_HHS_BH_Bias_HAH_SAV_MT16x32x64_MI16x16x16x1_SN_GRVW8_LPB8_MIWT1_1_NTB3_NEPBS1_PGR2_PLR5_SPO1
    SolutionIndex: 19
    SolutionNameMin: Cijk_Ailk_Bljk_HHS_BH_Bias_HAH_SAV_MT64x16x64_MI16x16x16x1_SN_GRVW2_GSU6_MIWT1_1_SU0_SUS0_SRVW0_SVW4_VW2_WG64_4_1_WGM1
    SolutionIndex: 20
    SolutionNameMin: Cijk_Ailk_Bljk_HHS_BH_Bias_HAH_SAV_MT32x16x64_MI16x16x16x1_SN_GRVW8_GSU25_LPB16_LRVW8_MIWT1_1_PLR5_SU0_SUS0_SVW2_VW8_WG32_4_1_WGM8
    SolutionIndex: 21
    SolutionNameMin: Cijk_Ailk_Bljk_HHS_BH_Bias_HAH_SAV_MT16x16x64_MI16x16x16x1_SN_GRVW8_GSU25_LPB16_LRVW8_MIWT1_1_PLR5_SU0_SUS0_SVW4_VW8_WG16_4_1_WGM1
    SolutionIndex: 22
    SolutionNameMin: Cijk_Ailk_Bljk_HHS_BH_Bias_HAH_SAV_MT128x128x32_MI32x32x8x1_SN_1LDSB0_GRVW8_LPB8_LRVW8_MIWT2_2_NEPBS0_NLCA1_PLR5_SS0_SU4_SUS128_SRVW4_SVW4_VW1_WG64_4_1_WGM21
    SolutionIndex: 23
    SolutionNameMin: Cijk_Ailk_Bljk_HHS_BH_Bias_HAH_SAV_MT128x128x32_MI32x32x8x1_SN_1LDSB0_GRVW8_LPB8_LRVW8_MIWT2_2_NEPBS2_NLCA1_PLR5_SS0_SU4_SUS256_SRVW4_SVW4_VW2_WG64_4_1_WGM15
    SolutionIndex: 24
    SolutionNameMin: Cijk_Ailk_Bljk_HHS_BH_Bias_HAH_SAV_MT64x16x64_MI16x16x16x1_SN_GRVW8_GSU1_LPB16_LRVW8_MIWT1_1_PLR5_SU0_SUS0_SVW4_VW2_WG64_4_1_WGM1
    SolutionIndex: 25
    SolutionNameMin: Cijk_Ailk_Bljk_HHS_BH_Bias_HAH_SAV_MT64x16x64_MI16x16x16x1_SN_GRVW4_GSU1_LPB16_LRVW8_MIWT1_1_PLR5_SU0_SUS0_SVW4_VW8_WG64_4_1_WGM1
    SolutionIndex: 26
    SolutionNameMin: Cijk_Ailk_Bljk_HHS_BH_Bias_HAH_SAV_MT256x128x32_MI32x32x8x1_SN_1LDSB1_GRVW8_LPB8_LRVW8_MIWT4_2_NEPBS2_NLCA1_PLR5_SS1_SU0_SUS0_SRVW0_SVW4_VW4_WG64_4_1_WGM1
- - - [1104, 1, 1, 4608, 1104, 1104, 1104, 4608]
    - [19, 225.657]
  - - [1104, 16, 1, 4608, 1104, 1104, 1104, 4608]
    - [19, 3590.13]
  - - [1104, 1335, 1, 4608, 1104, 1104, 1104, 4608]
    - [22, 102975.0]
  - - [1104, 1408, 1, 4608, 1104, 1104, 1104, 4608]
    - [23, 107796.0]
  - - [4608, 1, 1, 320, 4608, 4608, 4608, 320]
    - [24, 146.518]
  - - [4608, 16, 1, 320, 4608, 4608, 4608, 320]
    - [25, 2391.82]
  - - [4608, 1335, 1, 320, 4608, 4608, 4608, 320]
    - [26, 65705.4]
  - - [4608, 1408, 1, 320, 4608, 4608, 4608, 320]
    - [8, 102208.0]
  - - [16, 1, 1, 4608, 16, 16, 16, 4608]
    - [20, 3.67757]
  - - [16, 16, 1, 4608, 16, 16, 16, 4608]
    - [21, 55.8544]
  - - [16, 1335, 1, 4608, 16, 16, 16, 4608]
    - [17, 4338.28]
  - - [16, 1408, 1, 4608, 16, 16, 16, 4608]
    - [18, 4511.86]
  - - [768, 1, 1, 4608, 768, 768, 768, 4608]
    - [15, 161.154]
  - - [768, 16, 1, 4608, 768, 768, 768, 4608]
    - [16, 2382.32]
  - - [768, 1335, 1, 4608, 768, 768, 768, 4608]
    - [6, 90493.4]
  - - [768, 1408, 1, 4608, 768, 768, 768, 4608]
    - [6, 90493.4]
  - - [4608, 1, 1, 768, 4608, 4608, 4608, 768]
    - [24, 281.046]
  - - [4608, 16, 1, 768, 4608, 4608, 4608, 768]
    - [25, 4587.1]
  - - [4608, 1335, 1, 768, 4608, 4608, 4608, 768]
    - [9, 93398.6]
  - - [4608, 1408, 1, 768, 4608, 4608, 4608, 768]
    - [10, 75750.8]
- null
- null
- DeviceEfficiency
- Equality
