tensilelite/try/yamlGen/tunning_BFVF_Round1/tunning_BFVF_Round1_13/3_LibraryLogic/aldebaran_Cijk_Ailk_Bljk_HHS_BH.yaml
- {MinimumRequiredVersion: 4.33.0}
- aldebaran
- gfx90a
- [Device 0050, Device 0051, Device 0052, Device 0054, Device 0062, Device 7400, Device
    SolutionIndex: 0
    SolutionNameMin: Cijk_Ailk_Bljk_HHS_BH_MT64x32x32_MI16x16x16x1_SN_1LDSB0_GRVW8_LPB8_LRVW4_MIWT2_2_PLR3_SS0_SRVW0_SVW4_VW1_WG32_4_1
    SolutionIndex: 1
    SolutionNameMin: Cijk_Ailk_Bljk_HHS_BH_MT64x32x64_MI16x16x16x1_SN_1LDSB0_GRVW8_LPB16_LRVW8_MIWT2_1_PLR5_SS0_SRVW0_SVW4_VW1_WG32_8_1
    SolutionIndex: 2
    SolutionNameMin: Cijk_Ailk_Bljk_HHS_BH_MT64x32x64_MI16x16x16x1_SN_1LDSB0_GRVW8_LPB16_LRVW8_MIWT2_2_PLR5_SS0_SRVW0_SVW4_VW1_WG32_4_1
    SolutionIndex: 3
    SolutionNameMin: Cijk_Ailk_Bljk_HHS_BH_MT64x32x64_MI16x16x16x1_SN_1LDSB0_GRVW8_LPB16_LRVW8_MIWT2_2_PLR5_SS0_SRVW4_SVW4_VW1_WG32_4_1
    SolutionIndex: 4
    SolutionNameMin: Cijk_Ailk_Bljk_HHS_BH_MT64x32x32_MI16x16x16x1_SN_1LDSB0_GRVW8_LPB8_LRVW4_MIWT2_2_PLR1_SS1_SRVW0_SVW2_VW2_WG32_4_1
    SolutionIndex: 5
    SolutionNameMin: Cijk_Ailk_Bljk_HHS_BH_MT64x32x32_MI16x16x16x1_SN_1LDSB0_GRVW8_LPB8_LRVW4_MIWT2_2_PLR3_SS1_SRVW0_SVW2_VW2_WG32_4_1
    SolutionIndex: 6
    SolutionNameMin: Cijk_Ailk_Bljk_HHS_BH_MT64x32x64_MI16x16x16x1_SN_1LDSB0_GRVW8_LPB16_LRVW8_MIWT2_1_PLR5_SS1_SRVW0_SVW2_VW2_WG32_8_1
    SolutionIndex: 7
    SolutionNameMin: Cijk_Ailk_Bljk_HHS_BH_MT64x32x64_MI16x16x16x1_SN_1LDSB0_GRVW8_LPB8_LRVW4_MIWT2_2_PLR5_SS1_SRVW0_SVW2_VW2_WG32_4_1
    SolutionIndex: 8
    SolutionNameMin: Cijk_Ailk_Bljk_HHS_BH_MT64x32x64_MI16x16x16x1_SN_1LDSB0_GRVW8_LPB16_LRVW8_MIWT2_2_PLR5_SS1_SRVW0_SVW2_VW2_WG32_4_1
- - - [1104, 1335, 1, 4608, 1104, 1104, 1104, 4608]
    - [3, 61422.7]
  - - [1104, 1408, 1, 4608, 1104, 1104, 1104, 4608]
    - [2, 62289.1]
  - - [4608, 1, 1, 320, 4608, 4608, 4608, 320]
    - [1, 427.65]
  - - [4608, 16, 1, 320, 4608, 4608, 4608, 320]
    - [6, 6687.25]
  - - [4608, 1335, 1, 320, 4608, 4608, 4608, 320]
    - [4, 58811.0]
  - - [4608, 1408, 1, 320, 4608, 4608, 4608, 320]
    - [5, 59454.9]
  - - [768, 1335, 1, 4608, 768, 768, 768, 4608]
    - [2, 63181.4]
  - - [768, 1408, 1, 4608, 768, 768, 768, 4608]
    - [8, 64778.9]
  - - [4608, 1, 1, 768, 4608, 4608, 4608, 768]
    - [2, 642.038]
  - - [4608, 16, 1, 768, 4608, 4608, 4608, 768]
    - [2, 10111.2]
  - - [4608, 1335, 1, 768, 4608, 4608, 4608, 768]
    - [5, 66782.4]
  - - [4608, 1408, 1, 768, 4608, 4608, 4608, 768]
    - [5, 65542.3]
  - - [320, 8192, 1, 320, 320, 320, 320, 320]
    - [4, 54161.5]
  - - [640, 2048, 1, 640, 640, 640, 640, 640]
    - [8, 56073.2]
  - - [320, 8192, 1, 1280, 320, 320, 320, 1280]
    - [8, 66082.7]
  - - [1280, 512, 1, 1280, 1280, 1280, 1280, 1280]
    - [4, 63242.9]
  - - [10240, 512, 1, 1280, 10240, 10240, 10240, 1280]
    - [4, 66475.5]
  - - [2560, 8192, 1, 320, 2560, 2560, 2560, 320]
    - [4, 65699.7]
  - - [5120, 2048, 1, 640, 5120, 5120, 5120, 640]
    - [5, 68249.4]
  - - [1280, 512, 1, 5120, 1280, 1280, 1280, 5120]
    - [0, 68601.1]
  - - [640, 2048, 1, 2560, 640, 640, 640, 2560]
    - [8, 67033.3]
  - - [320, 154, 1, 768, 320, 320, 320, 768]
    - [2, 7167.93]
  - - [1280, 154, 1, 768, 1280, 1280, 1280, 768]
    - [7, 29384.1]
- null
- null
- DeviceEfficiency
