tensilelite/try/yamlGen/tunning_BFVF_Round1/tunning_BFVF_Round1_7/3_LibraryLogic/aldebaran_Cijk_Ailk_Bljk_HHS_BH.yaml
- {MinimumRequiredVersion: 4.33.0}
- aldebaran
- gfx90a
- [Device 0050, Device 0051, Device 0052, Device 0054, Device 0062, Device 7400, Device
    SolutionIndex: 0
    SolutionNameMin: Cijk_Ailk_Bljk_HHS_BH_MT32x32x64_MI16x16x16x1_SN_1LDSB0_GRVW8_LPB16_LRVW8_MIWT1_2_PLR5_SS0_SRVW0_SVW4
    SolutionIndex: 1
    SolutionNameMin: Cijk_Ailk_Bljk_HHS_BH_MT32x48x64_MI16x16x16x1_SN_1LDSB0_GRVW8_LPB8_LRVW4_MIWT1_3_PLR1_SS0_SRVW0_SVW4
    SolutionIndex: 2
    SolutionNameMin: Cijk_Ailk_Bljk_HHS_BH_MT32x48x64_MI16x16x16x1_SN_1LDSB0_GRVW8_LPB16_LRVW8_MIWT1_3_PLR5_SS0_SRVW0_SVW4
    SolutionIndex: 3
    SolutionNameMin: Cijk_Ailk_Bljk_HHS_BH_MT32x48x32_MI16x16x16x1_SN_1LDSB0_GRVW2_LPB4_LRVW4_MIWT1_3_PLR1_SS0_SRVW4_SVW4
    SolutionIndex: 4
    SolutionNameMin: Cijk_Ailk_Bljk_HHS_BH_MT32x48x32_MI16x16x16x1_SN_1LDSB0_GRVW2_LPB4_LRVW4_MIWT1_3_PLR3_SS0_SRVW4_SVW4
    SolutionIndex: 5
    SolutionNameMin: Cijk_Ailk_Bljk_HHS_BH_MT32x48x64_MI16x16x16x1_SN_1LDSB0_GRVW8_LPB8_LRVW4_MIWT1_3_PLR5_SS1_SRVW0_SVW1
    SolutionIndex: 6
    SolutionNameMin: Cijk_Ailk_Bljk_HHS_BH_MT32x48x64_MI16x16x16x1_SN_1LDSB0_GRVW8_LPB16_LRVW8_MIWT1_3_PLR5_SS1_SRVW0_SVW1
- - - [1104, 1335, 1, 4608, 1104, 1104, 1104, 4608]
    - [2, 53011.3]
  - - [1104, 1408, 1, 4608, 1104, 1104, 1104, 4608]
    - [6, 55217.0]
  - - [4608, 1, 1, 320, 4608, 4608, 4608, 320]
    - [0, 432.676]
  - - [4608, 16, 1, 320, 4608, 4608, 4608, 320]
    - [0, 6657.16]
  - - [4608, 1335, 1, 320, 4608, 4608, 4608, 320]
    - [4, 43214.7]
  - - [4608, 1408, 1, 320, 4608, 4608, 4608, 320]
    - [3, 43202.9]
  - - [768, 1335, 1, 4608, 768, 768, 768, 4608]
    - [2, 49348.6]
  - - [768, 1408, 1, 4608, 768, 768, 768, 4608]
    - [2, 51284.3]
  - - [4608, 1, 1, 768, 4608, 4608, 4608, 768]
    - [0, 632.847]
  - - [4608, 16, 1, 768, 4608, 4608, 4608, 768]
    - [0, 9264.18]
  - - [4608, 1335, 1, 768, 4608, 4608, 4608, 768]
    - [6, 52017.5]
  - - [4608, 1408, 1, 768, 4608, 4608, 4608, 768]
    - [6, 52516.6]
  - - [320, 8192, 1, 320, 320, 320, 320, 320]
    - [2, 40752.7]
  - - [640, 2048, 1, 640, 640, 640, 640, 640]
    - [6, 50484.5]
  - - [320, 8192, 1, 1280, 320, 320, 320, 1280]
    - [2, 58579.1]
  - - [1280, 512, 1, 1280, 1280, 1280, 1280, 1280]
    - [6, 55715.5]
  - - [10240, 512, 1, 1280, 10240, 10240, 10240, 1280]
    - [6, 54284.1]
  - - [2560, 8192, 1, 320, 2560, 2560, 2560, 320]
    - [6, 50585.1]
  - - [5120, 2048, 1, 640, 5120, 5120, 5120, 640]
    - [6, 51412.8]
  - - [1280, 512, 1, 5120, 1280, 1280, 1280, 5120]
    - [1, 56427.6]
  - - [640, 2048, 1, 2560, 640, 640, 640, 2560]
    - [5, 57275.1]
  - - [320, 154, 1, 768, 320, 320, 320, 768]
    - [0, 9011.09]
  - - [1280, 154, 1, 768, 1280, 1280, 1280, 768]
    - [0, 28758.6]
- null
- null
- DeviceEfficiency
