tensilelite/try/yamlGen/tunning_BFVF_Round1/tunning_BFVF_Round1_14/3_LibraryLogic/aldebaran_Cijk_Ailk_Bljk_HHS_BH.yaml
- {MinimumRequiredVersion: 4.33.0}
- aldebaran
- gfx90a
- [Device 0050, Device 0051, Device 0052, Device 0054, Device 0062, Device 7400, Device
    SolutionIndex: 0
    SolutionNameMin: Cijk_Ailk_Bljk_HHS_BH_MT64x48x32_MI16x16x16x1_SN_1LDSB0_GRVW2_LPB4_LRVW4_MIWT1_3_PLR1_SS0_SRVW0_SVW4
    SolutionIndex: 1
    SolutionNameMin: Cijk_Ailk_Bljk_HHS_BH_MT64x48x32_MI16x16x16x1_SN_1LDSB0_GRVW2_LPB4_LRVW4_MIWT1_3_PLR3_SS0_SRVW0_SVW4
    SolutionIndex: 2
    SolutionNameMin: Cijk_Ailk_Bljk_HHS_BH_MT64x32x64_MI16x16x16x1_SN_1LDSB0_GRVW8_LPB16_LRVW8_MIWT1_2_PLR5_SS0_SRVW0_SVW4
    SolutionIndex: 3
    SolutionNameMin: Cijk_Ailk_Bljk_HHS_BH_MT64x32x64_MI16x16x16x1_SN_1LDSB0_GRVW4_LPB16_LRVW8_MIWT1_2_PLR5_SS0_SRVW0_SVW4
    SolutionIndex: 4
    SolutionNameMin: Cijk_Ailk_Bljk_HHS_BH_MT64x48x32_MI16x16x16x1_SN_1LDSB0_GRVW2_LPB4_LRVW4_MIWT1_3_PLR1_SS0_SRVW4_SVW4
    SolutionIndex: 5
    SolutionNameMin: Cijk_Ailk_Bljk_HHS_BH_MT64x48x32_MI16x16x16x1_SN_1LDSB0_GRVW2_LPB4_LRVW4_MIWT1_3_PLR3_SS0_SRVW4_SVW4
    SolutionIndex: 6
    SolutionNameMin: Cijk_Ailk_Bljk_HHS_BH_MT64x48x32_MI16x16x16x1_SN_1LDSB0_GRVW2_LPB4_LRVW4_MIWT1_3_PLR1_SS1_SRVW0_SVW1
    SolutionIndex: 7
    SolutionNameMin: Cijk_Ailk_Bljk_HHS_BH_MT64x48x32_MI16x16x16x1_SN_1LDSB0_GRVW2_LPB4_LRVW4_MIWT1_3_PLR3_SS1_SRVW0_SVW1
    SolutionIndex: 8
    SolutionNameMin: Cijk_Ailk_Bljk_HHS_BH_MT64x32x64_MI16x16x16x1_SN_1LDSB0_GRVW8_LPB16_LRVW8_MIWT1_2_PLR5_SS1_SRVW0_SVW1
- - - [1104, 1335, 1, 4608, 1104, 1104, 1104, 4608]
    - [1, 63381.0]
  - - [1104, 1408, 1, 4608, 1104, 1104, 1104, 4608]
    - [6, 64645.9]
  - - [4608, 1, 1, 320, 4608, 4608, 4608, 320]
    - [2, 448.467]
  - - [4608, 16, 1, 320, 4608, 4608, 4608, 320]
    - [2, 7004.93]
  - - [4608, 1335, 1, 320, 4608, 4608, 4608, 320]
    - [4, 60473.2]
  - - [4608, 1408, 1, 320, 4608, 4608, 4608, 320]
    - [5, 61063.7]
  - - [768, 1335, 1, 4608, 768, 768, 768, 4608]
    - [8, 65486.4]
  - - [768, 1408, 1, 4608, 768, 768, 768, 4608]
    - [8, 68309.8]
  - - [4608, 1, 1, 768, 4608, 4608, 4608, 768]
    - [8, 656.326]
  - - [4608, 16, 1, 768, 4608, 4608, 4608, 768]
    - [3, 10125.6]
  - - [4608, 1335, 1, 768, 4608, 4608, 4608, 768]
    - [7, 70396.4]
  - - [4608, 1408, 1, 768, 4608, 4608, 4608, 768]
    - [4, 71542.5]
  - - [320, 8192, 1, 320, 320, 320, 320, 320]
    - [0, 55568.0]
  - - [640, 2048, 1, 640, 640, 640, 640, 640]
    - [4, 61355.7]
  - - [320, 8192, 1, 1280, 320, 320, 320, 1280]
    - [5, 70444.6]
  - - [1280, 512, 1, 1280, 1280, 1280, 1280, 1280]
    - [6, 65250.0]
  - - [10240, 512, 1, 1280, 10240, 10240, 10240, 1280]
    - [5, 69081.3]
  - - [2560, 8192, 1, 320, 2560, 2560, 2560, 320]
    - [4, 70539.3]
  - - [5120, 2048, 1, 640, 5120, 5120, 5120, 640]
    - [5, 71416.1]
  - - [1280, 512, 1, 5120, 1280, 1280, 1280, 5120]
    - [7, 71113.3]
  - - [640, 2048, 1, 2560, 640, 640, 640, 2560]
    - [8, 72477.4]
  - - [320, 154, 1, 768, 320, 320, 320, 768]
    - [2, 7897.88]
  - - [1280, 154, 1, 768, 1280, 1280, 1280, 768]
    - [2, 31803.9]
- null
- null
- DeviceEfficiency
