library/src/amd_detail/rocblaslt/src/Tensile/Logic/asm_full/gfx1201/GridBased/gfx1201_Cijk_Ailk_Bjlk_I8II_BH_HAI_SAV_UserArgs.yaml
- {MinimumRequiredVersion: 4.33.0}
- gfx1201
- gfx1201
- [Device 73f0]
    SolutionIndex: 0
    SolutionNameMin: Cijk_Ailk_Bjlk_I8II_BH_HAI_SAV_UserArgs_MT128x16x32_MI16x16x1_SN_LDSB0_CLR1_GRVWA16_GRVWB4_GSU1_LBSPPA1024_LBSPPB128_MIWT2_1_PGR2_PLR1_SS0_SU32_SUM0_SUS256_SVW8_WG64_2_1_WGM8
    SolutionIndex: 1
    SolutionNameMin: Cijk_Ailk_Bjlk_I8II_BH_HAI_SAV_UserArgs_MT256x16x32_MI16x16x1_SN_LDSB0_CLR1_GRVWA16_GRVWB4_GSU1_LBSPPA2048_LBSPPB128_MIWT4_1_PGR1_PLR1_SS0_SU32_SUM0_SUS256_SVW8_WG64_2_1_WGM8
    SolutionIndex: 2
    SolutionNameMin: Cijk_Ailk_Bjlk_I8II_BH_HAI_SAV_UserArgs_MT256x16x32_MI16x16x1_SN_LDSB0_CLR1_GRVWA16_GRVWB4_GSU1_LBSPPA2048_LBSPPB128_MIWT4_1_PGR2_PLR1_SS0_SU32_SUM0_SUS256_SVW8_WG64_2_1_WGM8
    SolutionIndex: 3
    SolutionNameMin: Cijk_Ailk_Bjlk_I8II_BH_HAI_SAV_UserArgs_MT256x16x32_MI16x16x1_SN_LDSB0_CLR0_GRVWA16_GRVWB4_GSU1_LBSPPA2048_LBSPPB128_MIWT4_1_PGR2_PLR0_SS0_SU32_SUM0_SUS256_SVW8_WG64_2_1_WGM8
    SolutionIndex: 4
    SolutionNameMin: Cijk_Ailk_Bjlk_I8II_BH_HAI_SAV_UserArgs_MT64x32x32_MI16x16x1_SN_LDSB0_CLR1_GRVWA16_GRVWB8_GSU1_LBSPPA512_LBSPPB256_MIWT2_1_PGR1_PLR1_SS0_SU32_SUM0_SUS256_SVW8_WG32_4_1_WGM8
    SolutionIndex: 5
    SolutionNameMin: Cijk_Ailk_Bjlk_I8II_BH_HAI_SAV_UserArgs_MT64x32x32_MI16x16x1_SN_LDSB0_CLR0_GRVWA16_GRVWB8_GSU1_LBSPPA512_LBSPPB256_MIWT2_1_PGR1_PLR0_SS0_SU32_SUM0_SUS256_SVW8_WG32_4_1_WGM8
    SolutionIndex: 6
    SolutionNameMin: Cijk_Ailk_Bjlk_I8II_BH_HAI_SAV_UserArgs_MT32x64x32_MI16x16x1_SN_LDSB0_CLR1_GRVWA8_GRVWB16_GSU1_LBSPPA256_LBSPPB512_MIWT2_1_PGR1_PLR1_SS0_SU32_SUM0_SUS256_SVW8_WG16_8_1_WGM8
    SolutionIndex: 7
    SolutionNameMin: Cijk_Ailk_Bjlk_I8II_BH_HAI_SAV_UserArgs_MT32x64x32_MI16x16x1_SN_LDSB0_CLR0_GRVWA8_GRVWB16_GSU1_LBSPPA256_LBSPPB512_MIWT2_1_PGR1_PLR0_SS0_SU32_SUM0_SUS256_SVW8_WG16_8_1_WGM8
    SolutionIndex: 8
    SolutionNameMin: Cijk_Ailk_Bjlk_I8II_BH_HAI_SAV_UserArgs_MT64x16x64_MI16x16x1_SN_LDSB0_CLR1_GRVWA16_GRVWB8_GSU1_LBSPPA512_LBSPPB128_MIWT1_1_PGR1_PLR1_SS0_SU32_SUM0_SUS256_SVW8_WG64_2_1_WGM8
    SolutionIndex: 9
    SolutionNameMin: Cijk_Ailk_Bjlk_I8II_BH_HAI_SAV_UserArgs_MT128x16x64_MI16x16x1_SN_LDSB0_CLR1_GRVWA16_GRVWB8_GSU1_LBSPPA1024_LBSPPB128_MIWT2_1_PGR1_PLR1_SS0_SU32_SUM0_SUS256_SVW8_WG64_2_1_WGM8
    SolutionIndex: 10
    SolutionNameMin: Cijk_Ailk_Bjlk_I8II_BH_HAI_SAV_UserArgs_MT256x16x64_MI16x16x1_SN_LDSB1_CLR1_GRVWA16_GRVWB8_GSU1_LBSPPA2048_LBSPPB128_MIWT4_1_PGR1_PLR1_SS0_SU32_SUM0_SUS256_SVW8_WG64_2_1_WGM8
    SolutionIndex: 11
    SolutionNameMin: Cijk_Ailk_Bjlk_I8II_BH_HAI_SAV_UserArgs_MT256x16x64_MI16x16x1_SN_LDSB1_CLR1_GRVWA16_GRVWB8_GSU1_LBSPPA2048_LBSPPB128_MIWT4_1_PGR2_PLR1_SS0_SU32_SUM0_SUS256_SVW8_WG64_2_1_WGM8
    SolutionIndex: 12
    SolutionNameMin: Cijk_Ailk_Bjlk_I8II_BH_HAI_SAV_UserArgs_MT256x16x64_MI16x16x1_SN_LDSB1_CLR1_GRVWA16_GRVWB8_GSU1_LBSPPA2048_LBSPPB128_MIWT4_1_PGR1_PLR3_SS0_SU32_SUM0_SUS256_SVW8_WG64_2_1_WGM8
    SolutionIndex: 13
    SolutionNameMin: Cijk_Ailk_Bjlk_I8II_BH_HAI_SAV_UserArgs_MT256x16x64_MI16x16x1_SN_LDSB1_CLR1_GRVWA16_GRVWB8_GSU1_LBSPPA2048_LBSPPB128_MIWT4_1_PGR2_PLR3_SS0_SU32_SUM0_SUS256_SVW8_WG64_2_1_WGM8
    SolutionIndex: 14
    SolutionNameMin: Cijk_Ailk_Bjlk_I8II_BH_HAI_SAV_UserArgs_MT32x32x64_MI16x16x1_SN_LDSB0_CLR1_GRVWA16_GRVWB16_GSU1_LBSPPA256_LBSPPB256_MIWT1_1_PGR2_PLR1_SS0_SU32_SUM0_SUS256_SVW8_WG32_4_1_WGM8
    SolutionIndex: 15
    SolutionNameMin: Cijk_Ailk_Bjlk_I8II_BH_HAI_SAV_UserArgs_MT64x32x64_MI16x16x1_SN_LDSB0_CLR1_GRVWA16_GRVWB16_GSU1_LBSPPA512_LBSPPB256_MIWT2_1_PGR1_PLR1_SS0_SU32_SUM0_SUS256_SVW8_WG32_4_1_WGM8
    SolutionIndex: 16
    SolutionNameMin: Cijk_Ailk_Bjlk_I8II_BH_HAI_SAV_UserArgs_MT64x32x64_MI16x16x1_SN_LDSB0_CLR1_GRVWA16_GRVWB16_GSU1_LBSPPA512_LBSPPB256_MIWT2_1_PGR2_PLR1_SS0_SU32_SUM0_SUS256_SVW8_WG32_4_1_WGM8
    SolutionIndex: 17
    SolutionNameMin: Cijk_Ailk_Bjlk_I8II_BH_HAI_SAV_UserArgs_MT64x32x64_MI16x16x1_SN_LDSB0_CLR1_GRVWA16_GRVWB16_GSU1_LBSPPA512_LBSPPB256_MIWT2_1_PGR1_PLR3_SS0_SU32_SUM0_SUS256_SVW8_WG32_4_1_WGM8
    SolutionIndex: 18
    SolutionNameMin: Cijk_Ailk_Bjlk_I8II_BH_HAI_SAV_UserArgs_MT64x32x64_MI16x16x1_SN_LDSB0_CLR0_GRVWA16_GRVWB16_GSU1_LBSPPA512_LBSPPB256_MIWT2_1_PGR1_PLR0_SS0_SU32_SUM0_SUS256_SVW8_WG32_4_1_WGM8
    SolutionIndex: 19
    SolutionNameMin: Cijk_Ailk_Bjlk_I8II_BH_HAI_SAV_UserArgs_MT16x64x64_MI16x16x1_SN_LDSB0_CLR1_GRVWA8_GRVWB16_GSU1_LBSPPA128_LBSPPB512_MIWT1_1_PGR1_PLR3_SS0_SU32_SUM0_SUS256_SVW8_WG16_8_1_WGM8
    SolutionIndex: 20
    SolutionNameMin: Cijk_Ailk_Bjlk_I8II_BH_HAI_SAV_UserArgs_MT32x64x64_MI16x16x1_SN_LDSB0_CLR1_GRVWA16_GRVWB16_GSU1_LBSPPA256_LBSPPB512_MIWT2_1_PGR1_PLR1_SS0_SU32_SUM0_SUS256_SVW8_WG16_8_1_WGM8
    SolutionIndex: 21
    SolutionNameMin: Cijk_Ailk_Bjlk_I8II_BH_HAI_SAV_UserArgs_MT32x64x64_MI16x16x1_SN_LDSB0_CLR1_GRVWA16_GRVWB16_GSU1_LBSPPA256_LBSPPB512_MIWT2_1_PGR1_PLR3_SS0_SU32_SUM0_SUS256_SVW8_WG16_8_1_WGM8
    SolutionIndex: 22
    SolutionNameMin: Cijk_Ailk_Bjlk_I8II_BH_HAI_SAV_UserArgs_MT64x16x32_MI16x16x1_SN_LDSB0_CLR1_GRVWA16_GRVWB4_GSU1_LBSPPA512_LBSPPB128_MIWT1_1_PGR2_PLR1_SS1_SU32_SUM0_SUS256_SVW1_WG64_2_1_WGM8
    SolutionIndex: 23
    SolutionNameMin: Cijk_Ailk_Bjlk_I8II_BH_HAI_SAV_UserArgs_MT256x16x32_MI16x16x1_SN_LDSB0_CLR1_GRVWA16_GRVWB4_GSU1_LBSPPA2048_LBSPPB128_MIWT4_1_PGR1_PLR1_SS1_SU32_SUM0_SUS256_SVW1_WG64_2_1_WGM8
    SolutionIndex: 24
    SolutionNameMin: Cijk_Ailk_Bjlk_I8II_BH_HAI_SAV_UserArgs_MT256x16x32_MI16x16x1_SN_LDSB0_CLR0_GRVWA16_GRVWB4_GSU1_LBSPPA2048_LBSPPB128_MIWT4_1_PGR2_PLR0_SS1_SU32_SUM0_SUS256_SVW1_WG64_2_1_WGM8
    SolutionIndex: 25
    SolutionNameMin: Cijk_Ailk_Bjlk_I8II_BH_HAI_SAV_UserArgs_MT64x32x32_MI16x16x1_SN_LDSB0_CLR1_GRVWA16_GRVWB8_GSU1_LBSPPA512_LBSPPB256_MIWT2_1_PGR1_PLR1_SS1_SU32_SUM0_SUS256_SVW1_WG32_4_1_WGM8
    SolutionIndex: 26
    SolutionNameMin: Cijk_Ailk_Bjlk_I8II_BH_HAI_SAV_UserArgs_MT64x32x32_MI16x16x1_SN_LDSB0_CLR1_GRVWA16_GRVWB8_GSU1_LBSPPA512_LBSPPB256_MIWT2_1_PGR2_PLR1_SS1_SU32_SUM0_SUS256_SVW1_WG32_4_1_WGM8
    SolutionIndex: 27
    SolutionNameMin: Cijk_Ailk_Bjlk_I8II_BH_HAI_SAV_UserArgs_MT64x32x32_MI16x16x1_SN_LDSB0_CLR0_GRVWA16_GRVWB8_GSU1_LBSPPA512_LBSPPB256_MIWT2_1_PGR2_PLR0_SS1_SU32_SUM0_SUS256_SVW1_WG32_4_1_WGM8
    SolutionIndex: 28
    SolutionNameMin: Cijk_Ailk_Bjlk_I8II_BH_HAI_SAV_UserArgs_MT32x64x32_MI16x16x1_SN_LDSB0_CLR1_GRVWA8_GRVWB16_GSU1_LBSPPA256_LBSPPB512_MIWT2_1_PGR1_PLR1_SS1_SU32_SUM0_SUS256_SVW1_WG16_8_1_WGM8
    SolutionIndex: 29
    SolutionNameMin: Cijk_Ailk_Bjlk_I8II_BH_HAI_SAV_UserArgs_MT32x64x32_MI16x16x1_SN_LDSB0_CLR1_GRVWA8_GRVWB16_GSU1_LBSPPA256_LBSPPB512_MIWT2_1_PGR2_PLR1_SS1_SU32_SUM0_SUS256_SVW1_WG16_8_1_WGM8
    SolutionIndex: 30
    SolutionNameMin: Cijk_Ailk_Bjlk_I8II_BH_HAI_SAV_UserArgs_MT32x64x32_MI16x16x1_SN_LDSB0_CLR0_GRVWA8_GRVWB16_GSU1_LBSPPA256_LBSPPB512_MIWT2_1_PGR1_PLR0_SS1_SU32_SUM0_SUS256_SVW1_WG16_8_1_WGM8
    SolutionIndex: 31
    SolutionNameMin: Cijk_Ailk_Bjlk_I8II_BH_HAI_SAV_UserArgs_MT32x64x32_MI16x16x1_SN_LDSB0_CLR0_GRVWA8_GRVWB16_GSU1_LBSPPA256_LBSPPB512_MIWT2_1_PGR2_PLR0_SS1_SU32_SUM0_SUS256_SVW1_WG16_8_1_WGM8
    SolutionIndex: 32
    SolutionNameMin: Cijk_Ailk_Bjlk_I8II_BH_HAI_SAV_UserArgs_MT64x16x64_MI16x16x1_SN_LDSB0_CLR1_GRVWA16_GRVWB8_GSU1_LBSPPA512_LBSPPB128_MIWT1_1_PGR1_PLR3_SS1_SU32_SUM0_SUS256_SVW1_WG64_2_1_WGM8
    SolutionIndex: 33
    SolutionNameMin: Cijk_Ailk_Bjlk_I8II_BH_HAI_SAV_UserArgs_MT256x16x64_MI16x16x1_SN_LDSB1_CLR1_GRVWA16_GRVWB8_GSU1_LBSPPA2048_LBSPPB128_MIWT4_1_PGR1_PLR1_SS1_SU32_SUM0_SUS256_SVW1_WG64_2_1_WGM8
    SolutionIndex: 34
    SolutionNameMin: Cijk_Ailk_Bjlk_I8II_BH_HAI_SAV_UserArgs_MT256x16x64_MI16x16x1_SN_LDSB1_CLR1_GRVWA16_GRVWB8_GSU1_LBSPPA2048_LBSPPB128_MIWT4_1_PGR2_PLR1_SS1_SU32_SUM0_SUS256_SVW1_WG64_2_1_WGM8
    SolutionIndex: 35
    SolutionNameMin: Cijk_Ailk_Bjlk_I8II_BH_HAI_SAV_UserArgs_MT256x16x64_MI16x16x1_SN_LDSB1_CLR1_GRVWA16_GRVWB8_GSU1_LBSPPA2048_LBSPPB128_MIWT4_1_PGR1_PLR3_SS1_SU32_SUM0_SUS256_SVW1_WG64_2_1_WGM8
    SolutionIndex: 36
    SolutionNameMin: Cijk_Ailk_Bjlk_I8II_BH_HAI_SAV_UserArgs_MT256x16x64_MI16x16x1_SN_LDSB1_CLR1_GRVWA16_GRVWB8_GSU1_LBSPPA2048_LBSPPB128_MIWT4_1_PGR2_PLR3_SS1_SU32_SUM0_SUS256_SVW1_WG64_2_1_WGM8
    SolutionIndex: 37
    SolutionNameMin: Cijk_Ailk_Bjlk_I8II_BH_HAI_SAV_UserArgs_MT32x32x64_MI16x16x1_SN_LDSB0_CLR0_GRVWA16_GRVWB16_GSU1_LBSPPA256_LBSPPB256_MIWT1_1_PGR1_PLR0_SS1_SU32_SUM0_SUS256_SVW1_WG32_4_1_WGM8
    SolutionIndex: 38
    SolutionNameMin: Cijk_Ailk_Bjlk_I8II_BH_HAI_SAV_UserArgs_MT64x32x64_MI16x16x1_SN_LDSB0_CLR1_GRVWA16_GRVWB16_GSU1_LBSPPA512_LBSPPB256_MIWT2_1_PGR1_PLR1_SS1_SU32_SUM0_SUS256_SVW1_WG32_4_1_WGM8
    SolutionIndex: 39
    SolutionNameMin: Cijk_Ailk_Bjlk_I8II_BH_HAI_SAV_UserArgs_MT64x32x64_MI16x16x1_SN_LDSB0_CLR1_GRVWA16_GRVWB16_GSU1_LBSPPA512_LBSPPB256_MIWT2_1_PGR1_PLR3_SS1_SU32_SUM0_SUS256_SVW1_WG32_4_1_WGM8
    SolutionIndex: 40
    SolutionNameMin: Cijk_Ailk_Bjlk_I8II_BH_HAI_SAV_UserArgs_MT64x32x64_MI16x16x1_SN_LDSB0_CLR0_GRVWA16_GRVWB16_GSU1_LBSPPA512_LBSPPB256_MIWT2_1_PGR1_PLR0_SS1_SU32_SUM0_SUS256_SVW1_WG32_4_1_WGM8
    SolutionIndex: 41
    SolutionNameMin: Cijk_Ailk_Bjlk_I8II_BH_HAI_SAV_UserArgs_MT16x64x64_MI16x16x1_SN_LDSB0_CLR0_GRVWA8_GRVWB16_GSU1_LBSPPA128_LBSPPB512_MIWT1_1_PGR1_PLR0_SS1_SU32_SUM0_SUS256_SVW1_WG16_8_1_WGM8
    SolutionIndex: 42
    SolutionNameMin: Cijk_Ailk_Bjlk_I8II_BH_HAI_SAV_UserArgs_MT32x64x64_MI16x16x1_SN_LDSB0_CLR1_GRVWA16_GRVWB16_GSU1_LBSPPA256_LBSPPB512_MIWT2_1_PGR1_PLR1_SS1_SU32_SUM0_SUS256_SVW1_WG16_8_1_WGM8
    SolutionIndex: 43
    SolutionNameMin: Cijk_Ailk_Bjlk_I8II_BH_HAI_SAV_UserArgs_MT32x64x64_MI16x16x1_SN_LDSB0_CLR1_GRVWA16_GRVWB16_GSU1_LBSPPA256_LBSPPB512_MIWT2_1_PGR2_PLR1_SS1_SU32_SUM0_SUS256_SVW1_WG16_8_1_WGM8
    SolutionIndex: 44
    SolutionNameMin: Cijk_Ailk_Bjlk_I8II_BH_HAI_SAV_UserArgs_MT32x64x64_MI16x16x1_SN_LDSB0_CLR1_GRVWA16_GRVWB16_GSU1_LBSPPA256_LBSPPB512_MIWT2_1_PGR1_PLR3_SS1_SU32_SUM0_SUS256_SVW1_WG16_8_1_WGM8
    SolutionIndex: 45
    SolutionNameMin: Cijk_Ailk_Bjlk_I8II_BH_HAI_SAV_UserArgs_MT32x64x64_MI16x16x1_SN_LDSB0_CLR0_GRVWA16_GRVWB16_GSU1_LBSPPA256_LBSPPB512_MIWT2_1_PGR1_PLR0_SS1_SU32_SUM0_SUS256_SVW1_WG16_8_1_WGM8
    SolutionIndex: 46
    SolutionNameMin: Cijk_Ailk_Bjlk_I8II_BH_HAI_SAV_UserArgs_MT32x64x64_MI16x16x1_SN_LDSB0_CLR0_GRVWA16_GRVWB16_GSU1_LBSPPA256_LBSPPB512_MIWT2_1_PGR2_PLR0_SS1_SU32_SUM0_SUS256_SVW1_WG16_8_1_WGM8
- - - [512, 512, 1, 64, 512, 512, 512, 512]
    - [0, 1048.25]
  - - [1024, 512, 1, 64, 1024, 1024, 1024, 512]
    - [28, 1958.58]
  - - [1536, 512, 1, 64, 1536, 1536, 1536, 512]
    - [3, 2769.36]
  - - [2048, 512, 1, 64, 2048, 2048, 2048, 512]
    - [10, 3583.92]
  - - [2560, 512, 1, 64, 2560, 2560, 2560, 512]
    - [1, 4333.74]
  - - [3072, 512, 1, 64, 3072, 3072, 3072, 512]
    - [12, 5310.51]
  - - [512, 1024, 1, 64, 512, 512, 512, 1024]
    - [0, 2037.8]
  - - [1024, 1024, 1, 64, 1024, 1024, 1024, 1024]
    - [36, 3899.98]
  - - [1536, 1024, 1, 64, 1536, 1536, 1536, 1024]
    - [10, 4955.49]
  - - [2048, 1024, 1, 64, 2048, 2048, 2048, 1024]
    - [36, 6522.07]
  - - [2560, 1024, 1, 64, 2560, 2560, 2560, 1024]
    - [10, 7309.22]
  - - [3072, 1024, 1, 64, 3072, 3072, 3072, 1024]
    - [36, 8516.53]
  - - [512, 1536, 1, 64, 512, 512, 512, 1536]
    - [7, 2840.63]
  - - [1024, 1536, 1, 64, 1024, 1024, 1024, 1536]
    - [13, 4950.61]
  - - [1536, 1536, 1, 64, 1536, 1536, 1536, 1536]
    - [12, 6899.16]
  - - [2048, 1536, 1, 64, 2048, 2048, 2048, 1536]
    - [10, 8320.83]
  - - [2560, 1536, 1, 64, 2560, 2560, 2560, 1536]
    - [10, 9720.85]
  - - [3072, 1536, 1, 64, 3072, 3072, 3072, 1536]
    - [34, 10978.7]
  - - [512, 2048, 1, 64, 512, 512, 512, 2048]
    - [13, 3510.61]
  - - [1024, 2048, 1, 64, 1024, 1024, 1024, 2048]
    - [10, 6022.24]
  - - [1536, 2048, 1, 64, 1536, 1536, 1536, 2048]
    - [36, 8381.62]
  - - [2048, 2048, 1, 64, 2048, 2048, 2048, 2048]
    - [24, 10145.0]
  - - [2560, 2048, 1, 64, 2560, 2560, 2560, 2048]
    - [12, 11487.3]
  - - [3072, 2048, 1, 64, 3072, 3072, 3072, 2048]
    - [11, 12736.3]
  - - [512, 2560, 1, 64, 512, 512, 512, 2560]
    - [3, 4193.67]
  - - [1024, 2560, 1, 64, 1024, 1024, 1024, 2560]
    - [3, 7160.72]
  - - [1536, 2560, 1, 64, 1536, 1536, 1536, 2560]
    - [33, 9817.55]
  - - [2048, 2560, 1, 64, 2048, 2048, 2048, 2560]
    - [13, 11446.0]
  - - [2560, 2560, 1, 64, 2560, 2560, 2560, 2560]
    - [2, 13023.6]
  - - [3072, 2560, 1, 64, 3072, 3072, 3072, 2560]
    - [13, 14284.2]
  - - [512, 3072, 1, 64, 512, 512, 512, 3072]
    - [2, 4691.72]
  - - [1024, 3072, 1, 64, 1024, 1024, 1024, 3072]
    - [33, 7933.11]
  - - [1536, 3072, 1, 64, 1536, 1536, 1536, 3072]
    - [24, 10899.2]
  - - [2048, 3072, 1, 64, 2048, 2048, 2048, 3072]
    - [2, 12985.3]
  - - [2560, 3072, 1, 64, 2560, 2560, 2560, 3072]
    - [13, 14373.9]
  - - [3072, 3072, 1, 64, 3072, 3072, 3072, 3072]
    - [13, 15921.0]
  - - [512, 512, 1, 256, 512, 512, 512, 512]
    - [17, 3947.12]
  - - [1024, 512, 1, 256, 1024, 1024, 1024, 512]
    - [12, 6975.61]
  - - [1536, 512, 1, 256, 1536, 1536, 1536, 512]
    - [28, 9698.28]
  - - [2048, 512, 1, 256, 2048, 2048, 2048, 512]
    - [10, 11787.4]
  - - [2560, 512, 1, 256, 2560, 2560, 2560, 512]
    - [40, 13779.5]
  - - [3072, 512, 1, 256, 3072, 3072, 3072, 512]
    - [43, 16159.8]
  - - [512, 1024, 1, 256, 512, 512, 512, 1024]
    - [12, 6950.15]
  - - [1024, 1024, 1, 256, 1024, 1024, 1024, 1024]
    - [46, 12033.7]
  - - [1536, 1024, 1, 256, 1536, 1536, 1536, 1024]
    - [28, 15635.2]
  - - [2048, 1024, 1, 256, 2048, 2048, 2048, 1024]
    - [5, 19079.9]
  - - [2560, 1024, 1, 256, 2560, 2560, 2560, 1024]
    - [6, 21843.6]
  - - [3072, 1024, 1, 256, 3072, 3072, 3072, 1024]
    - [26, 24163.1]
  - - [512, 1536, 1, 256, 512, 512, 512, 1536]
    - [4, 9695.94]
  - - [1024, 1536, 1, 256, 1024, 1024, 1024, 1536]
    - [44, 16018.0]
  - - [1536, 1536, 1, 256, 1536, 1536, 1536, 1536]
    - [4, 20442.4]
  - - [2048, 1536, 1, 256, 2048, 2048, 2048, 1536]
    - [5, 23925.8]
  - - [2560, 1536, 1, 256, 2560, 2560, 2560, 1536]
    - [31, 27766.5]
  - - [3072, 1536, 1, 256, 3072, 3072, 3072, 1536]
    - [6, 28806.2]
  - - [512, 2048, 1, 256, 512, 512, 512, 2048]
    - [16, 11667.0]
  - - [1024, 2048, 1, 256, 1024, 1024, 1024, 2048]
    - [28, 18995.2]
  - - [1536, 2048, 1, 256, 1536, 1536, 1536, 2048]
    - [30, 24873.6]
  - - [2048, 2048, 1, 256, 2048, 2048, 2048, 2048]
    - [4, 27437.9]
  - - [2560, 2048, 1, 256, 2560, 2560, 2560, 2048]
    - [25, 30996.1]
  - - [3072, 2048, 1, 256, 3072, 3072, 3072, 2048]
    - [25, 34375.9]
  - - [512, 2560, 1, 256, 512, 512, 512, 2560]
    - [45, 14324.8]
  - - [1024, 2560, 1, 256, 1024, 1024, 1024, 2560]
    - [31, 22335.0]
  - - [1536, 2560, 1, 256, 1536, 1536, 1536, 2560]
    - [46, 27599.0]
  - - [2048, 2560, 1, 256, 2048, 2048, 2048, 2560]
    - [25, 30659.1]
  - - [2560, 2560, 1, 256, 2560, 2560, 2560, 2560]
    - [7, 33956.5]
  - - [3072, 2560, 1, 256, 3072, 3072, 3072, 2560]
    - [7, 35213.9]
  - - [512, 3072, 1, 256, 512, 512, 512, 3072]
    - [29, 16826.3]
  - - [1024, 3072, 1, 256, 1024, 1024, 1024, 3072]
    - [31, 25063.6]
  - - [1536, 3072, 1, 256, 1536, 1536, 1536, 3072]
    - [27, 30655.8]
  - - [2048, 3072, 1, 256, 2048, 2048, 2048, 3072]
    - [30, 33801.3]
  - - [2560, 3072, 1, 256, 2560, 2560, 2560, 3072]
    - [4, 35999.4]
  - - [3072, 3072, 1, 256, 3072, 3072, 3072, 3072]
    - [27, 36627.6]
  - - [512, 512, 1, 512, 512, 512, 512, 512]
    - [9, 7137.15]
  - - [1024, 512, 1, 512, 1024, 1024, 1024, 512]
    - [10, 12608.5]
  - - [1536, 512, 1, 512, 1536, 1536, 1536, 512]
    - [42, 17073.2]
  - - [2048, 512, 1, 512, 2048, 2048, 2048, 512]
    - [44, 19979.6]
  - - [2560, 512, 1, 512, 2560, 2560, 2560, 512]
    - [33, 23486.4]
  - - [3072, 512, 1, 512, 3072, 3072, 3072, 512]
    - [38, 26846.7]
  - - [512, 1024, 1, 512, 512, 512, 512, 1024]
    - [12, 12755.6]
  - - [1024, 1024, 1, 512, 1024, 1024, 1024, 1024]
    - [44, 19920.6]
  - - [1536, 1024, 1, 512, 1536, 1536, 1536, 1024]
    - [18, 25692.5]
  - - [2048, 1024, 1, 512, 2048, 2048, 2048, 1024]
    - [42, 30206.3]
  - - [2560, 1024, 1, 512, 2560, 2560, 2560, 1024]
    - [42, 33312.1]
  - - [3072, 1024, 1, 512, 3072, 3072, 3072, 1024]
    - [28, 34977.6]
  - - [512, 1536, 1, 512, 512, 512, 512, 1536]
    - [38, 16749.0]
  - - [1024, 1536, 1, 512, 1024, 1024, 1024, 1536]
    - [44, 26233.2]
  - - [1536, 1536, 1, 512, 1536, 1536, 1536, 1536]
    - [39, 31118.5]
  - - [2048, 1536, 1, 512, 2048, 2048, 2048, 1536]
    - [38, 36260.0]
  - - [2560, 1536, 1, 512, 2560, 2560, 2560, 1536]
    - [25, 39087.2]
  - - [3072, 1536, 1, 512, 3072, 3072, 3072, 1536]
    - [39, 41425.2]
  - - [512, 2048, 1, 512, 512, 512, 512, 2048]
    - [40, 20282.2]
  - - [1024, 2048, 1, 512, 1024, 1024, 1024, 2048]
    - [25, 29454.7]
  - - [1536, 2048, 1, 512, 1536, 1536, 1536, 2048]
    - [4, 35080.8]
  - - [2048, 2048, 1, 512, 2048, 2048, 2048, 2048]
    - [39, 38735.6]
  - - [2560, 2048, 1, 512, 2560, 2560, 2560, 2048]
    - [38, 42160.4]
  - - [3072, 2048, 1, 512, 3072, 3072, 3072, 2048]
    - [42, 43147.9]
  - - [512, 2560, 1, 512, 512, 512, 512, 2560]
    - [39, 23294.4]
  - - [1024, 2560, 1, 512, 1024, 1024, 1024, 2560]
    - [26, 32579.1]
  - - [1536, 2560, 1, 512, 1536, 1536, 1536, 2560]
    - [38, 37563.7]
  - - [2048, 2560, 1, 512, 2048, 2048, 2048, 2560]
    - [44, 42296.9]
  - - [2560, 2560, 1, 512, 2560, 2560, 2560, 2560]
    - [26, 45063.7]
  - - [3072, 2560, 1, 512, 3072, 3072, 3072, 2560]
    - [25, 46229.4]
  - - [512, 3072, 1, 512, 512, 512, 512, 3072]
    - [38, 25284.3]
  - - [1024, 3072, 1, 512, 1024, 1024, 1024, 3072]
    - [44, 36149.7]
  - - [1536, 3072, 1, 512, 1536, 1536, 1536, 3072]
    - [25, 40767.1]
  - - [2048, 3072, 1, 512, 2048, 2048, 2048, 3072]
    - [44, 43654.5]
  - - [2560, 3072, 1, 512, 2560, 2560, 2560, 3072]
    - [39, 45965.0]
  - - [3072, 3072, 1, 512, 3072, 3072, 3072, 3072]
    - [4, 47384.0]
  - - [512, 512, 1, 1024, 512, 512, 512, 512]
    - [17, 12770.8]
  - - [1024, 512, 1, 1024, 1024, 1024, 1024, 512]
    - [12, 20582.4]
  - - [1536, 512, 1, 1024, 1536, 1536, 1536, 512]
    - [39, 26909.5]
  - - [2048, 512, 1, 1024, 2048, 2048, 2048, 512]
    - [44, 30270.6]
  - - [2560, 512, 1, 1024, 2560, 2560, 2560, 512]
    - [10, 32786.4]
  - - [3072, 512, 1, 1024, 3072, 3072, 3072, 512]
    - [38, 35444.0]
  - - [512, 1024, 1, 1024, 512, 512, 512, 1024]
    - [35, 20777.5]
  - - [1024, 1024, 1, 1024, 1024, 1024, 1024, 1024]
    - [17, 29326.0]
  - - [1536, 1024, 1, 1024, 1536, 1536, 1536, 1024]
    - [44, 36648.6]
  - - [2048, 1024, 1, 1024, 2048, 2048, 2048, 1024]
    - [15, 38690.3]
  - - [2560, 1024, 1, 1024, 2560, 2560, 2560, 1024]
    - [38, 43428.1]
  - - [3072, 1024, 1, 1024, 3072, 3072, 3072, 1024]
    - [39, 45014.6]
  - - [512, 1536, 1, 1024, 512, 512, 512, 1536]
    - [15, 25659.4]
  - - [1024, 1536, 1, 1024, 1024, 1024, 1024, 1536]
    - [12, 35581.9]
  - - [1536, 1536, 1, 1024, 1536, 1536, 1536, 1536]
    - [38, 41776.9]
  - - [2048, 1536, 1, 1024, 2048, 2048, 2048, 1536]
    - [21, 44670.4]
  - - [2560, 1536, 1, 1024, 2560, 2560, 2560, 1536]
    - [35, 48070.8]
  - - [3072, 1536, 1, 1024, 3072, 3072, 3072, 1536]
    - [42, 48462.3]
  - - [512, 2048, 1, 1024, 512, 512, 512, 2048]
    - [42, 30168.1]
  - - [1024, 2048, 1, 1024, 1024, 1024, 1024, 2048]
    - [44, 40777.1]
  - - [1536, 2048, 1, 1024, 1536, 1536, 1536, 2048]
    - [33, 45052.1]
  - - [2048, 2048, 1, 1024, 2048, 2048, 2048, 2048]
    - [33, 48316.4]
  - - [2560, 2048, 1, 1024, 2560, 2560, 2560, 2048]
    - [15, 50167.1]
  - - [3072, 2048, 1, 1024, 3072, 3072, 3072, 2048]
    - [42, 51922.4]
  - - [512, 2560, 1, 1024, 512, 512, 512, 2560]
    - [39, 34283.8]
  - - [1024, 2560, 1, 1024, 1024, 1024, 1024, 2560]
    - [42, 43256.3]
  - - [1536, 2560, 1, 1024, 1536, 1536, 1536, 2560]
    - [38, 46989.0]
  - - [2048, 2560, 1, 1024, 2048, 2048, 2048, 2560]
    - [42, 50951.7]
  - - [2560, 2560, 1, 1024, 2560, 2560, 2560, 2560]
    - [35, 52428.4]
  - - [3072, 2560, 1, 1024, 3072, 3072, 3072, 2560]
    - [23, 52290.9]
  - - [512, 3072, 1, 1024, 512, 512, 512, 3072]
    - [38, 35613.3]
  - - [1024, 3072, 1, 1024, 1024, 1024, 1024, 3072]
    - [42, 44948.4]
  - - [1536, 3072, 1, 1024, 1536, 1536, 1536, 3072]
    - [42, 49246.9]
  - - [2048, 3072, 1, 1024, 2048, 2048, 2048, 3072]
    - [35, 50449.7]
  - - [2560, 3072, 1, 1024, 2560, 2560, 2560, 3072]
    - [42, 52619.6]
  - - [3072, 3072, 1, 1024, 3072, 3072, 3072, 3072]
    - [33, 55438.6]
  - - [512, 512, 1, 2048, 512, 512, 512, 512]
    - [17, 19766.2]
  - - [1024, 512, 1, 2048, 1024, 1024, 1024, 512]
    - [44, 29238.2]
  - - [1536, 512, 1, 2048, 1536, 1536, 1536, 512]
    - [17, 35432.7]
  - - [2048, 512, 1, 2048, 2048, 2048, 2048, 512]
    - [15, 39135.2]
  - - [2560, 512, 1, 2048, 2560, 2560, 2560, 512]
    - [39, 41717.2]
  - - [3072, 512, 1, 2048, 3072, 3072, 3072, 512]
    - [39, 44633.2]
  - - [512, 1024, 1, 2048, 512, 512, 512, 1024]
    - [39, 28782.8]
  - - [1024, 1024, 1, 2048, 1024, 1024, 1024, 1024]
    - [38, 40335.9]
  - - [1536, 1024, 1, 2048, 1536, 1536, 1536, 1024]
    - [17, 44757.6]
  - - [2048, 1024, 1, 2048, 2048, 2048, 2048, 1024]
    - [44, 48021.5]
  - - [2560, 1024, 1, 2048, 2560, 2560, 2560, 1024]
    - [38, 49577.8]
  - - [3072, 1024, 1, 2048, 3072, 3072, 3072, 1024]
    - [21, 51678.3]
  - - [512, 1536, 1, 2048, 512, 512, 512, 1536]
    - [17, 34612.6]
  - - [1024, 1536, 1, 2048, 1024, 1024, 1024, 1536]
    - [44, 44200.9]
  - - [1536, 1536, 1, 2048, 1536, 1536, 1536, 1536]
    - [38, 49803.5]
  - - [2048, 1536, 1, 2048, 2048, 2048, 2048, 1536]
    - [20, 52196.2]
  - - [2560, 1536, 1, 2048, 2560, 2560, 2560, 1536]
    - [42, 53210.0]
  - - [3072, 1536, 1, 2048, 3072, 3072, 3072, 1536]
    - [38, 54540.5]
  - - [512, 2048, 1, 2048, 512, 512, 512, 2048]
    - [42, 39631.0]
  - - [1024, 2048, 1, 2048, 1024, 1024, 1024, 2048]
    - [42, 46462.7]
  - - [1536, 2048, 1, 2048, 1536, 1536, 1536, 2048]
    - [44, 51044.5]
  - - [2048, 2048, 1, 2048, 2048, 2048, 2048, 2048]
    - [45, 52901.5]
  - - [2560, 2048, 1, 2048, 2560, 2560, 2560, 2048]
    - [42, 55529.6]
  - - [3072, 2048, 1, 2048, 3072, 3072, 3072, 2048]
    - [15, 56490.7]
  - - [512, 2560, 1, 2048, 512, 512, 512, 2560]
    - [39, 43421.1]
  - - [1024, 2560, 1, 2048, 1024, 1024, 1024, 2560]
    - [21, 49561.6]
  - - [1536, 2560, 1, 2048, 1536, 1536, 1536, 2560]
    - [38, 52516.3]
  - - [2048, 2560, 1, 2048, 2048, 2048, 2048, 2560]
    - [38, 55871.2]
  - - [2560, 2560, 1, 2048, 2560, 2560, 2560, 2560]
    - [38, 55659.9]
  - - [3072, 2560, 1, 2048, 3072, 3072, 3072, 2560]
    - [35, 57771.5]
  - - [512, 3072, 1, 2048, 512, 512, 512, 3072]
    - [42, 44636.6]
  - - [1024, 3072, 1, 2048, 1024, 1024, 1024, 3072]
    - [42, 51686.6]
  - - [1536, 3072, 1, 2048, 1536, 1536, 1536, 3072]
    - [42, 53801.3]
  - - [2048, 3072, 1, 2048, 2048, 2048, 2048, 3072]
    - [10, 56925.7]
  - - [2560, 3072, 1, 2048, 2560, 2560, 2560, 3072]
    - [44, 57279.6]
  - - [3072, 3072, 1, 2048, 3072, 3072, 3072, 3072]
    - [35, 58225.4]
  - - [512, 512, 1, 3072, 512, 512, 512, 512]
    - [39, 24709.1]
  - - [1024, 512, 1, 3072, 1024, 1024, 1024, 512]
    - [39, 33936.6]
  - - [1536, 512, 1, 3072, 1536, 1536, 1536, 512]
    - [39, 40988.8]
  - - [2048, 512, 1, 3072, 2048, 2048, 2048, 512]
    - [21, 45309.4]
  - - [2560, 512, 1, 3072, 2560, 2560, 2560, 512]
    - [44, 46759.2]
  - - [3072, 512, 1, 3072, 3072, 3072, 3072, 512]
    - [17, 48362.9]
  - - [512, 1024, 1, 3072, 512, 512, 512, 1024]
    - [21, 34497.7]
  - - [1024, 1024, 1, 3072, 1024, 1024, 1024, 1024]
    - [39, 44346.9]
  - - [1536, 1024, 1, 3072, 1536, 1536, 1536, 1024]
    - [38, 48840.2]
  - - [2048, 1024, 1, 3072, 2048, 2048, 2048, 1024]
    - [38, 50590.7]
  - - [2560, 1024, 1, 3072, 2560, 2560, 2560, 1024]
    - [42, 53324.7]
  - - [3072, 1024, 1, 3072, 3072, 3072, 3072, 1024]
    - [35, 54154.8]
  - - [512, 1536, 1, 3072, 512, 512, 512, 1536]
    - [42, 40585.3]
  - - [1024, 1536, 1, 3072, 1024, 1024, 1024, 1536]
    - [42, 49161.5]
  - - [1536, 1536, 1, 3072, 1536, 1536, 1536, 1536]
    - [42, 52894.5]
  - - [2048, 1536, 1, 3072, 2048, 2048, 2048, 1536]
    - [33, 55623.9]
  - - [2560, 1536, 1, 3072, 2560, 2560, 2560, 1536]
    - [42, 56363.0]
  - - [3072, 1536, 1, 3072, 3072, 3072, 3072, 1536]
    - [10, 57803.6]
  - - [512, 2048, 1, 3072, 512, 512, 512, 2048]
    - [21, 44472.7]
  - - [1024, 2048, 1, 3072, 1024, 1024, 1024, 2048]
    - [38, 51761.6]
  - - [1536, 2048, 1, 3072, 1536, 1536, 1536, 2048]
    - [15, 54724.6]
  - - [2048, 2048, 1, 3072, 2048, 2048, 2048, 2048]
    - [15, 56521.7]
  - - [2560, 2048, 1, 3072, 2560, 2560, 2560, 2048]
    - [42, 57527.6]
  - - [3072, 2048, 1, 3072, 3072, 3072, 3072, 2048]
    - [38, 57965.7]
  - - [512, 2560, 1, 3072, 512, 512, 512, 2560]
    - [35, 46661.4]
  - - [1024, 2560, 1, 3072, 1024, 1024, 1024, 2560]
    - [10, 53604.0]
  - - [1536, 2560, 1, 3072, 1536, 1536, 1536, 2560]
    - [33, 57682.8]
  - - [2048, 2560, 1, 3072, 2048, 2048, 2048, 2560]
    - [33, 57581.1]
  - - [2560, 2560, 1, 3072, 2560, 2560, 2560, 2560]
    - [33, 57467.0]
  - - [3072, 2560, 1, 3072, 3072, 3072, 3072, 2560]
    - [10, 59021.2]
  - - [512, 3072, 1, 3072, 512, 512, 512, 3072]
    - [35, 49151.3]
  - - [1024, 3072, 1, 3072, 1024, 1024, 1024, 3072]
    - [12, 54939.6]
  - - [1536, 3072, 1, 3072, 1536, 1536, 1536, 3072]
    - [35, 58485.9]
  - - [2048, 3072, 1, 3072, 2048, 2048, 2048, 3072]
    - [38, 58531.1]
  - - [2560, 3072, 1, 3072, 2560, 2560, 2560, 3072]
    - [35, 59173.3]
  - - [3072, 3072, 1, 3072, 3072, 3072, 3072, 3072]
    - [10, 60284.3]
  - - [64, 64, 1, 1, 64, 64, 64, 64]
    - [22, 0.23769]
  - - [64, 64, 1, 64, 64, 64, 64, 64]
    - [14, 15.8285]
  - - [64, 64, 1, 256, 64, 64, 64, 64]
    - [19, 60.6552]
  - - [64, 64, 1, 512, 64, 64, 64, 64]
    - [8, 112.626]
  - - [64, 64, 1, 1024, 64, 64, 64, 64]
    - [37, 220.457]
  - - [64, 64, 1, 2048, 64, 64, 64, 64]
    - [32, 372.868]
  - - [64, 64, 1, 4096, 64, 64, 64, 64]
    - [41, 603.237]
- null
- null
- DeviceEfficiency
- GridBased
