library/src/amd_detail/rocblaslt/src/Tensile/Logic/asm_full/gfx1201/GridBased/gfx1201_Cijk_Alik_Bjlk_HSS_BH_Bias_HAS_SAV_UserArgs.yaml
- {MinimumRequiredVersion: 4.33.0}
- gfx1201
- gfx1201
- [Device 73f0]
    SolutionIndex: 0
    SolutionNameMin: Cijk_Alik_Bjlk_HSS_BH_Bias_HAS_SAV_UserArgs_MT64x32x32_MI16x16x1_SN_LDSB0_CLR1_GSU1_LBSPPA128_LBSPPB512_MIWT2_1_PGR1_PLR1_SS0_SU32_SUM0_SUS256_SVW8_TLDS1_WG32_4_1_WGM8
    SolutionIndex: 1
    SolutionNameMin: Cijk_Alik_Bjlk_HSS_BH_Bias_HAS_SAV_UserArgs_MT64x32x32_MI16x16x1_SN_LDSB0_CLR1_GSU1_LBSPPA128_LBSPPB512_MIWT2_1_PGR2_PLR1_SS0_SU32_SUM0_SUS256_SVW8_TLDS1_WG32_4_1_WGM8
    SolutionIndex: 2
    SolutionNameMin: Cijk_Alik_Bjlk_HSS_BH_Bias_HAS_SAV_UserArgs_MT64x32x32_MI16x16x1_SN_LDSB0_CLR0_GSU1_LBSPPA128_LBSPPB512_MIWT2_1_PGR1_PLR0_SS0_SU32_SUM0_SUS256_SVW8_TLDS1_WG32_4_1_WGM8
    SolutionIndex: 3
    SolutionNameMin: Cijk_Alik_Bjlk_HSS_BH_Bias_HAS_SAV_UserArgs_MT32x64x32_MI16x16x1_SN_LDSB0_CLR1_GSU1_LBSPPA128_LBSPPB1024_MIWT2_1_PGR1_PLR1_SS0_SU32_SUM0_SUS256_SVW8_TLDS1_WG16_8_1_WGM8
    SolutionIndex: 4
    SolutionNameMin: Cijk_Alik_Bjlk_HSS_BH_Bias_HAS_SAV_UserArgs_MT32x64x32_MI16x16x1_SN_LDSB0_CLR1_GSU1_LBSPPA128_LBSPPB1024_MIWT2_1_PGR2_PLR1_SS0_SU32_SUM0_SUS256_SVW8_TLDS1_WG16_8_1_WGM8
    SolutionIndex: 5
    SolutionNameMin: Cijk_Alik_Bjlk_HSS_BH_Bias_HAS_SAV_UserArgs_MT32x64x32_MI16x16x1_SN_LDSB0_CLR0_GSU1_LBSPPA128_LBSPPB1024_MIWT2_1_PGR1_PLR0_SS0_SU32_SUM0_SUS256_SVW8_TLDS1_WG16_8_1_WGM8
    SolutionIndex: 6
    SolutionNameMin: Cijk_Alik_Bjlk_HSS_BH_Bias_HAS_SAV_UserArgs_MT32x64x32_MI16x16x1_SN_LDSB0_CLR0_GSU1_LBSPPA128_LBSPPB1024_MIWT2_1_PGR2_PLR0_SS0_SU32_SUM0_SUS256_SVW8_TLDS1_WG16_8_1_WGM8
    SolutionIndex: 7
    SolutionNameMin: Cijk_Alik_Bjlk_HSS_BH_Bias_HAS_SAV_UserArgs_MT32x32x64_MI16x16x1_SN_LDSB0_CLR1_GSU1_LBSPPA128_LBSPPB512_MIWT1_1_PGR1_PLR1_SS0_SU32_SUM0_SUS256_SVW8_TLDS1_WG32_4_1_WGM8
    SolutionIndex: 8
    SolutionNameMin: Cijk_Alik_Bjlk_HSS_BH_Bias_HAS_SAV_UserArgs_MT32x32x64_MI16x16x1_SN_LDSB0_CLR1_GSU1_LBSPPA128_LBSPPB512_MIWT1_1_PGR1_PLR3_SS0_SU32_SUM0_SUS256_SVW8_TLDS1_WG32_4_1_WGM8
    SolutionIndex: 9
    SolutionNameMin: Cijk_Alik_Bjlk_HSS_BH_Bias_HAS_SAV_UserArgs_MT64x32x64_MI16x16x1_SN_LDSB0_CLR1_GSU1_LBSPPA128_LBSPPB512_MIWT2_1_PGR1_PLR1_SS0_SU32_SUM0_SUS256_SVW8_TLDS1_WG32_4_1_WGM8
    SolutionIndex: 10
    SolutionNameMin: Cijk_Alik_Bjlk_HSS_BH_Bias_HAS_SAV_UserArgs_MT32x64x64_MI16x16x1_SN_LDSB0_CLR1_GSU1_LBSPPA128_LBSPPB1024_MIWT2_1_PGR1_PLR3_SS0_SU32_SUM0_SUS256_SVW8_TLDS1_WG16_8_1_WGM8
    SolutionIndex: 11
    SolutionNameMin: Cijk_Alik_Bjlk_HSS_BH_Bias_HAS_SAV_UserArgs_MT32x32x32_MI16x16x1_SN_LDSB0_CLR1_GSU1_LBSPPA128_LBSPPB512_MIWT1_1_PGR1_PLR1_SS1_SU32_SUM0_SUS256_SVW1_TLDS1_WG32_4_1_WGM8
    SolutionIndex: 12
    SolutionNameMin: Cijk_Alik_Bjlk_HSS_BH_Bias_HAS_SAV_UserArgs_MT32x32x32_MI16x16x1_SN_LDSB0_CLR0_GSU1_LBSPPA128_LBSPPB512_MIWT1_1_PGR1_PLR0_SS1_SU32_SUM0_SUS256_SVW1_TLDS1_WG32_4_1_WGM8
    SolutionIndex: 13
    SolutionNameMin: Cijk_Alik_Bjlk_HSS_BH_Bias_HAS_SAV_UserArgs_MT32x32x32_MI16x16x1_SN_LDSB0_CLR0_GSU1_LBSPPA128_LBSPPB512_MIWT1_1_PGR2_PLR0_SS1_SU32_SUM0_SUS256_SVW1_TLDS1_WG32_4_1_WGM8
    SolutionIndex: 14
    SolutionNameMin: Cijk_Alik_Bjlk_HSS_BH_Bias_HAS_SAV_UserArgs_MT64x32x32_MI16x16x1_SN_LDSB0_CLR1_GSU1_LBSPPA128_LBSPPB512_MIWT2_1_PGR1_PLR1_SS1_SU32_SUM0_SUS256_SVW1_TLDS1_WG32_4_1_WGM8
    SolutionIndex: 15
    SolutionNameMin: Cijk_Alik_Bjlk_HSS_BH_Bias_HAS_SAV_UserArgs_MT64x32x32_MI16x16x1_SN_LDSB0_CLR1_GSU1_LBSPPA128_LBSPPB512_MIWT2_1_PGR2_PLR1_SS1_SU32_SUM0_SUS256_SVW1_TLDS1_WG32_4_1_WGM8
    SolutionIndex: 16
    SolutionNameMin: Cijk_Alik_Bjlk_HSS_BH_Bias_HAS_SAV_UserArgs_MT64x32x32_MI16x16x1_SN_LDSB0_CLR0_GSU1_LBSPPA128_LBSPPB512_MIWT2_1_PGR1_PLR0_SS1_SU32_SUM0_SUS256_SVW1_TLDS1_WG32_4_1_WGM8
    SolutionIndex: 17
    SolutionNameMin: Cijk_Alik_Bjlk_HSS_BH_Bias_HAS_SAV_UserArgs_MT16x64x32_MI16x16x1_SN_LDSB0_CLR1_GSU1_LBSPPA128_LBSPPB1024_MIWT1_1_PGR1_PLR1_SS1_SU32_SUM0_SUS256_SVW1_TLDS1_WG16_8_1_WGM8
    SolutionIndex: 18
    SolutionNameMin: Cijk_Alik_Bjlk_HSS_BH_Bias_HAS_SAV_UserArgs_MT16x64x32_MI16x16x1_SN_LDSB0_CLR1_GSU1_LBSPPA256_LBSPPB1024_MIWT1_1_PGR2_PLR1_SS1_SU32_SUM0_SUS256_SVW1_TLDS0_WG16_8_1_WGM8
    SolutionIndex: 19
    SolutionNameMin: Cijk_Alik_Bjlk_HSS_BH_Bias_HAS_SAV_UserArgs_MT32x64x32_MI16x16x1_SN_LDSB0_CLR1_GSU1_LBSPPA128_LBSPPB1024_MIWT2_1_PGR1_PLR1_SS1_SU32_SUM0_SUS256_SVW1_TLDS1_WG16_8_1_WGM8
    SolutionIndex: 20
    SolutionNameMin: Cijk_Alik_Bjlk_HSS_BH_Bias_HAS_SAV_UserArgs_MT32x64x32_MI16x16x1_SN_LDSB0_CLR1_GSU1_LBSPPA128_LBSPPB1024_MIWT2_1_PGR2_PLR1_SS1_SU32_SUM0_SUS256_SVW1_TLDS1_WG16_8_1_WGM8
    SolutionIndex: 21
    SolutionNameMin: Cijk_Alik_Bjlk_HSS_BH_Bias_HAS_SAV_UserArgs_MT32x64x32_MI16x16x1_SN_LDSB0_CLR0_GSU1_LBSPPA128_LBSPPB1024_MIWT2_1_PGR1_PLR0_SS1_SU32_SUM0_SUS256_SVW1_TLDS1_WG16_8_1_WGM8
    SolutionIndex: 22
    SolutionNameMin: Cijk_Alik_Bjlk_HSS_BH_Bias_HAS_SAV_UserArgs_MT32x64x32_MI16x16x1_SN_LDSB0_CLR0_GSU1_LBSPPA128_LBSPPB1024_MIWT2_1_PGR2_PLR0_SS1_SU32_SUM0_SUS256_SVW1_TLDS1_WG16_8_1_WGM8
    SolutionIndex: 23
    SolutionNameMin: Cijk_Alik_Bjlk_HSS_BH_Bias_HAS_SAV_UserArgs_MT32x32x64_MI16x16x1_SN_LDSB0_CLR1_GSU1_LBSPPA128_LBSPPB512_MIWT1_1_PGR1_PLR3_SS1_SU32_SUM0_SUS256_SVW1_TLDS1_WG32_4_1_WGM8
    SolutionIndex: 24
    SolutionNameMin: Cijk_Alik_Bjlk_HSS_BH_Bias_HAS_SAV_UserArgs_MT32x32x64_MI16x16x1_SN_LDSB0_CLR1_GSU1_LBSPPA128_LBSPPB512_MIWT1_1_PGR2_PLR3_SS1_SU32_SUM0_SUS256_SVW1_TLDS1_WG32_4_1_WGM8
    SolutionIndex: 25
    SolutionNameMin: Cijk_Alik_Bjlk_HSS_BH_Bias_HAS_SAV_UserArgs_MT32x32x64_MI16x16x1_SN_LDSB0_CLR0_GSU1_LBSPPA128_LBSPPB512_MIWT1_1_PGR1_PLR0_SS1_SU32_SUM0_SUS256_SVW1_TLDS1_WG32_4_1_WGM8
    SolutionIndex: 26
    SolutionNameMin: Cijk_Alik_Bjlk_HSS_BH_Bias_HAS_SAV_UserArgs_MT64x32x64_MI16x16x1_SN_LDSB0_CLR1_GSU1_LBSPPA128_LBSPPB512_MIWT2_1_PGR1_PLR3_SS1_SU32_SUM0_SUS256_SVW1_TLDS1_WG32_4_1_WGM8
- - - [512, 512, 1, 64, 512, 512, 64, 512]
    - [16, 1098.78]
  - - [1024, 512, 1, 64, 1024, 1024, 64, 512]
    - [14, 2116.4]
  - - [1536, 512, 1, 64, 1536, 1536, 64, 512]
    - [19, 2834.23]
  - - [2048, 512, 1, 64, 2048, 2048, 64, 512]
    - [14, 3516.13]
  - - [2560, 512, 1, 64, 2560, 2560, 64, 512]
    - [5, 4318.13]
  - - [3072, 512, 1, 64, 3072, 3072, 64, 512]
    - [14, 5008.75]
  - - [512, 1024, 1, 64, 512, 512, 64, 1024]
    - [19, 2153.06]
  - - [1024, 1024, 1, 64, 1024, 1024, 64, 1024]
    - [21, 3725.48]
  - - [1536, 1024, 1, 64, 1536, 1536, 64, 1024]
    - [0, 5003.64]
  - - [2048, 1024, 1, 64, 2048, 2048, 64, 1024]
    - [19, 6136.79]
  - - [2560, 1024, 1, 64, 2560, 2560, 64, 1024]
    - [1, 6801.76]
  - - [3072, 1024, 1, 64, 3072, 3072, 64, 1024]
    - [20, 7649.33]
  - - [512, 1536, 1, 64, 512, 512, 64, 1536]
    - [0, 2974.33]
  - - [1024, 1536, 1, 64, 1024, 1024, 64, 1536]
    - [20, 4988.76]
  - - [1536, 1536, 1, 64, 1536, 1536, 64, 1536]
    - [4, 6685.04]
  - - [2048, 1536, 1, 64, 2048, 2048, 64, 1536]
    - [22, 7548.8]
  - - [2560, 1536, 1, 64, 2560, 2560, 64, 1536]
    - [0, 9377.81]
  - - [3072, 1536, 1, 64, 3072, 3072, 64, 1536]
    - [0, 10245.5]
  - - [512, 2048, 1, 64, 512, 512, 64, 2048]
    - [19, 3708.9]
  - - [1024, 2048, 1, 64, 1024, 1024, 64, 2048]
    - [19, 6153.67]
  - - [1536, 2048, 1, 64, 1536, 1536, 64, 2048]
    - [1, 8145.6]
  - - [2048, 2048, 1, 64, 2048, 2048, 64, 2048]
    - [20, 9131.86]
  - - [2560, 2048, 1, 64, 2560, 2560, 64, 2048]
    - [3, 11040.5]
  - - [3072, 2048, 1, 64, 3072, 3072, 64, 2048]
    - [19, 11703.5]
  - - [512, 2560, 1, 64, 512, 512, 64, 2560]
    - [6, 4134.66]
  - - [1024, 2560, 1, 64, 1024, 1024, 64, 2560]
    - [1, 7224.09]
  - - [1536, 2560, 1, 64, 1536, 1536, 64, 2560]
    - [4, 9308.44]
  - - [2048, 2560, 1, 64, 2048, 2048, 64, 2560]
    - [19, 10251.4]
  - - [2560, 2560, 1, 64, 2560, 2560, 64, 2560]
    - [4, 12146.8]
  - - [3072, 2560, 1, 64, 3072, 3072, 64, 2560]
    - [0, 13009.8]
  - - [512, 3072, 1, 64, 512, 512, 64, 3072]
    - [5, 5019.86]
  - - [1024, 3072, 1, 64, 1024, 1024, 64, 3072]
    - [2, 7614.47]
  - - [1536, 3072, 1, 64, 1536, 1536, 64, 3072]
    - [4, 9994.2]
  - - [2048, 3072, 1, 64, 2048, 2048, 64, 3072]
    - [15, 11267.1]
  - - [2560, 3072, 1, 64, 2560, 2560, 64, 3072]
    - [3, 13419.8]
  - - [3072, 3072, 1, 64, 3072, 3072, 64, 3072]
    - [0, 13946.6]
  - - [512, 512, 1, 256, 512, 512, 256, 512]
    - [11, 4036.38]
  - - [1024, 512, 1, 256, 1024, 1024, 256, 512]
    - [21, 7284.74]
  - - [1536, 512, 1, 256, 1536, 1536, 256, 512]
    - [14, 9109.18]
  - - [2048, 512, 1, 256, 2048, 2048, 256, 512]
    - [21, 10949.4]
  - - [2560, 512, 1, 256, 2560, 2560, 256, 512]
    - [14, 12263.6]
  - - [3072, 512, 1, 256, 3072, 3072, 256, 512]
    - [14, 14708.0]
  - - [512, 1024, 1, 256, 512, 512, 256, 1024]
    - [19, 6932.2]
  - - [1024, 1024, 1, 256, 1024, 1024, 256, 1024]
    - [14, 11504.3]
  - - [1536, 1024, 1, 256, 1536, 1536, 256, 1024]
    - [19, 13789.5]
  - - [2048, 1024, 1, 256, 2048, 2048, 256, 1024]
    - [19, 16877.4]
  - - [2560, 1024, 1, 256, 2560, 2560, 256, 1024]
    - [3, 18671.2]
  - - [3072, 1024, 1, 256, 3072, 3072, 256, 1024]
    - [19, 19925.4]
  - - [512, 1536, 1, 256, 512, 512, 256, 1536]
    - [14, 8871.94]
  - - [1024, 1536, 1, 256, 1024, 1024, 256, 1536]
    - [3, 14534.9]
  - - [1536, 1536, 1, 256, 1536, 1536, 256, 1536]
    - [3, 17735.9]
  - - [2048, 1536, 1, 256, 2048, 2048, 256, 1536]
    - [21, 19359.3]
  - - [2560, 1536, 1, 256, 2560, 2560, 256, 1536]
    - [3, 21818.6]
  - - [3072, 1536, 1, 256, 3072, 3072, 256, 1536]
    - [19, 23199.7]
  - - [512, 2048, 1, 256, 512, 512, 256, 2048]
    - [14, 10871.6]
  - - [1024, 2048, 1, 256, 1024, 1024, 256, 2048]
    - [14, 16909.3]
  - - [1536, 2048, 1, 256, 1536, 1536, 256, 2048]
    - [19, 20259.5]
  - - [2048, 2048, 1, 256, 2048, 2048, 256, 2048]
    - [19, 22468.2]
  - - [2560, 2048, 1, 256, 2560, 2560, 256, 2048]
    - [19, 23763.3]
  - - [3072, 2048, 1, 256, 3072, 3072, 256, 2048]
    - [19, 25893.5]
  - - [512, 2560, 1, 256, 512, 512, 256, 2560]
    - [14, 12693.4]
  - - [1024, 2560, 1, 256, 1024, 1024, 256, 2560]
    - [19, 18679.0]
  - - [1536, 2560, 1, 256, 1536, 1536, 256, 2560]
    - [19, 21004.3]
  - - [2048, 2560, 1, 256, 2048, 2048, 256, 2560]
    - [19, 23818.2]
  - - [2560, 2560, 1, 256, 2560, 2560, 256, 2560]
    - [14, 25601.0]
  - - [3072, 2560, 1, 256, 3072, 3072, 256, 2560]
    - [14, 26391.9]
  - - [512, 3072, 1, 256, 512, 512, 256, 3072]
    - [16, 14415.2]
  - - [1024, 3072, 1, 256, 1024, 1024, 256, 3072]
    - [19, 20162.7]
  - - [1536, 3072, 1, 256, 1536, 1536, 256, 3072]
    - [3, 22830.7]
  - - [2048, 3072, 1, 256, 2048, 2048, 256, 3072]
    - [19, 25266.5]
  - - [2560, 3072, 1, 256, 2560, 2560, 256, 3072]
    - [14, 26807.4]
  - - [3072, 3072, 1, 256, 3072, 3072, 256, 3072]
    - [19, 27241.0]
  - - [512, 512, 1, 512, 512, 512, 512, 512]
    - [26, 6988.14]
  - - [1024, 512, 1, 512, 1024, 1024, 512, 512]
    - [19, 12090.6]
  - - [1536, 512, 1, 512, 1536, 1536, 512, 512]
    - [14, 13962.1]
  - - [2048, 512, 1, 512, 2048, 2048, 512, 512]
    - [19, 17601.2]
  - - [2560, 512, 1, 512, 2560, 2560, 512, 512]
    - [3, 18847.4]
  - - [3072, 512, 1, 512, 3072, 3072, 512, 512]
    - [19, 21086.0]
  - - [512, 1024, 1, 512, 512, 512, 512, 1024]
    - [19, 12214.7]
  - - [1024, 1024, 1, 512, 1024, 1024, 512, 1024]
    - [3, 17543.4]
  - - [1536, 1024, 1, 512, 1536, 1536, 512, 1024]
    - [19, 20333.7]
  - - [2048, 1024, 1, 512, 2048, 2048, 512, 1024]
    - [19, 23531.2]
  - - [2560, 1024, 1, 512, 2560, 2560, 512, 1024]
    - [3, 25219.4]
  - - [3072, 1024, 1, 512, 3072, 3072, 512, 1024]
    - [19, 26418.6]
  - - [512, 1536, 1, 512, 512, 512, 512, 1536]
    - [21, 13937.9]
  - - [1024, 1536, 1, 512, 1024, 1024, 512, 1536]
    - [19, 20596.9]
  - - [1536, 1536, 1, 512, 1536, 1536, 512, 1536]
    - [3, 23837.4]
  - - [2048, 1536, 1, 512, 2048, 2048, 512, 1536]
    - [19, 26436.2]
  - - [2560, 1536, 1, 512, 2560, 2560, 512, 1536]
    - [3, 27597.1]
  - - [3072, 1536, 1, 512, 3072, 3072, 512, 1536]
    - [19, 29005.6]
  - - [512, 2048, 1, 512, 512, 512, 512, 2048]
    - [21, 17531.9]
  - - [1024, 2048, 1, 512, 1024, 1024, 512, 2048]
    - [3, 22636.3]
  - - [1536, 2048, 1, 512, 1536, 1536, 512, 2048]
    - [14, 26407.8]
  - - [2048, 2048, 1, 512, 2048, 2048, 512, 2048]
    - [3, 28083.1]
  - - [2560, 2048, 1, 512, 2560, 2560, 512, 2048]
    - [14, 29773.4]
  - - [3072, 2048, 1, 512, 3072, 3072, 512, 2048]
    - [14, 30752.4]
  - - [512, 2560, 1, 512, 512, 512, 512, 2560]
    - [19, 18747.1]
  - - [1024, 2560, 1, 512, 1024, 1024, 512, 2560]
    - [3, 25216.8]
  - - [1536, 2560, 1, 512, 1536, 1536, 512, 2560]
    - [0, 27045.5]
  - - [2048, 2560, 1, 512, 2048, 2048, 512, 2560]
    - [19, 29156.2]
  - - [2560, 2560, 1, 512, 2560, 2560, 512, 2560]
    - [3, 30467.5]
  - - [3072, 2560, 1, 512, 3072, 3072, 512, 2560]
    - [19, 31503.9]
  - - [512, 3072, 1, 512, 512, 512, 512, 3072]
    - [3, 21105.4]
  - - [1024, 3072, 1, 512, 1024, 1024, 512, 3072]
    - [19, 26414.5]
  - - [1536, 3072, 1, 512, 1536, 1536, 512, 3072]
    - [3, 29133.4]
  - - [2048, 3072, 1, 512, 2048, 2048, 512, 3072]
    - [19, 30903.2]
  - - [2560, 3072, 1, 512, 2560, 2560, 512, 3072]
    - [3, 31569.6]
  - - [3072, 3072, 1, 512, 3072, 3072, 512, 3072]
    - [19, 32157.1]
  - - [512, 512, 1, 1024, 512, 512, 1024, 512]
    - [9, 10730.1]
  - - [1024, 512, 1, 1024, 1024, 1024, 1024, 512]
    - [19, 18439.7]
  - - [1536, 512, 1, 1024, 1536, 1536, 1024, 512]
    - [0, 19761.4]
  - - [2048, 512, 1, 1024, 2048, 2048, 1024, 512]
    - [19, 24145.9]
  - - [2560, 512, 1, 1024, 2560, 2560, 1024, 512]
    - [3, 24300.1]
  - - [3072, 512, 1, 1024, 3072, 3072, 1024, 512]
    - [3, 27125.4]
  - - [512, 1024, 1, 1024, 512, 512, 1024, 1024]
    - [3, 18211.4]
  - - [1024, 1024, 1, 1024, 1024, 1024, 1024, 1024]
    - [19, 23781.7]
  - - [1536, 1024, 1, 1024, 1536, 1536, 1024, 1024]
    - [19, 27221.9]
  - - [2048, 1024, 1, 1024, 2048, 2048, 1024, 1024]
    - [0, 28862.3]
  - - [2560, 1024, 1, 1024, 2560, 2560, 1024, 1024]
    - [21, 30030.4]
  - - [3072, 1024, 1, 1024, 3072, 3072, 1024, 1024]
    - [3, 31236.6]
  - - [512, 1536, 1, 1024, 512, 512, 1024, 1536]
    - [19, 20072.2]
  - - [1024, 1536, 1, 1024, 1024, 1024, 1024, 1536]
    - [3, 27574.5]
  - - [1536, 1536, 1, 1024, 1536, 1536, 1024, 1536]
    - [19, 28495.0]
  - - [2048, 1536, 1, 1024, 2048, 2048, 1024, 1536]
    - [19, 30907.8]
  - - [2560, 1536, 1, 1024, 2560, 2560, 1024, 1536]
    - [19, 31876.3]
  - - [3072, 1536, 1, 1024, 3072, 3072, 1024, 1536]
    - [14, 32871.5]
  - - [512, 2048, 1, 1024, 512, 512, 1024, 2048]
    - [5, 24288.1]
  - - [1024, 2048, 1, 1024, 1024, 1024, 1024, 2048]
    - [19, 28509.0]
  - - [1536, 2048, 1, 1024, 1536, 1536, 1024, 2048]
    - [19, 31617.4]
  - - [2048, 2048, 1, 1024, 2048, 2048, 1024, 2048]
    - [14, 32848.6]
  - - [2560, 2048, 1, 1024, 2560, 2560, 1024, 2048]
    - [3, 34071.6]
  - - [3072, 2048, 1, 1024, 3072, 3072, 1024, 2048]
    - [14, 33660.5]
  - - [512, 2560, 1, 1024, 512, 512, 1024, 2560]
    - [19, 24079.2]
  - - [1024, 2560, 1, 1024, 1024, 1024, 1024, 2560]
    - [3, 30476.2]
  - - [1536, 2560, 1, 1024, 1536, 1536, 1024, 2560]
    - [3, 31557.3]
  - - [2048, 2560, 1, 1024, 2048, 2048, 1024, 2560]
    - [14, 33257.5]
  - - [2560, 2560, 1, 1024, 2560, 2560, 1024, 2560]
    - [0, 33767.4]
  - - [3072, 2560, 1, 1024, 3072, 3072, 1024, 2560]
    - [14, 34981.8]
  - - [512, 3072, 1, 1024, 512, 512, 1024, 3072]
    - [3, 27335.4]
  - - [1024, 3072, 1, 1024, 1024, 1024, 1024, 3072]
    - [3, 31432.0]
  - - [1536, 3072, 1, 1024, 1536, 1536, 1024, 3072]
    - [3, 33906.9]
  - - [2048, 3072, 1, 1024, 2048, 2048, 1024, 3072]
    - [0, 34033.7]
  - - [2560, 3072, 1, 1024, 2560, 2560, 1024, 3072]
    - [0, 34295.9]
  - - [3072, 3072, 1, 1024, 3072, 3072, 1024, 3072]
    - [3, 34970.3]
  - - [512, 512, 1, 2048, 512, 512, 2048, 512]
    - [10, 16128.3]
  - - [1024, 512, 1, 2048, 1024, 1024, 2048, 512]
    - [3, 24952.8]
  - - [1536, 512, 1, 2048, 1536, 1536, 2048, 512]
    - [3, 24779.8]
  - - [2048, 512, 1, 2048, 2048, 2048, 2048, 512]
    - [19, 29593.3]
  - - [2560, 512, 1, 2048, 2560, 2560, 2048, 512]
    - [19, 29149.9]
  - - [3072, 512, 1, 2048, 3072, 3072, 2048, 512]
    - [19, 31765.8]
  - - [512, 1024, 1, 2048, 512, 512, 2048, 1024]
    - [19, 24126.9]
  - - [1024, 1024, 1, 2048, 1024, 1024, 2048, 1024]
    - [0, 29459.1]
  - - [1536, 1024, 1, 2048, 1536, 1536, 2048, 1024]
    - [3, 32394.6]
  - - [2048, 1024, 1, 2048, 2048, 2048, 2048, 1024]
    - [19, 32904.1]
  - - [2560, 1024, 1, 2048, 2560, 2560, 2048, 1024]
    - [3, 33565.9]
  - - [3072, 1024, 1, 2048, 3072, 3072, 2048, 1024]
    - [19, 34543.9]
  - - [512, 1536, 1, 2048, 512, 512, 2048, 1536]
    - [3, 24449.9]
  - - [1024, 1536, 1, 2048, 1024, 1024, 2048, 1536]
    - [3, 31535.2]
  - - [1536, 1536, 1, 2048, 1536, 1536, 2048, 1536]
    - [14, 32055.6]
  - - [2048, 1536, 1, 2048, 2048, 2048, 2048, 1536]
    - [19, 35021.7]
  - - [2560, 1536, 1, 2048, 2560, 2560, 2048, 1536]
    - [3, 34006.4]
  - - [3072, 1536, 1, 2048, 3072, 3072, 2048, 1536]
    - [19, 35159.6]
  - - [512, 2048, 1, 2048, 512, 512, 2048, 2048]
    - [19, 29242.1]
  - - [1024, 2048, 1, 2048, 1024, 1024, 2048, 2048]
    - [19, 33180.4]
  - - [1536, 2048, 1, 2048, 1536, 1536, 2048, 2048]
    - [3, 34721.1]
  - - [2048, 2048, 1, 2048, 2048, 2048, 2048, 2048]
    - [3, 35194.7]
  - - [2560, 2048, 1, 2048, 2560, 2560, 2048, 2048]
    - [3, 35871.8]
  - - [3072, 2048, 1, 2048, 3072, 3072, 2048, 2048]
    - [3, 35716.9]
  - - [512, 2560, 1, 2048, 512, 512, 2048, 2560]
    - [3, 28507.8]
  - - [1024, 2560, 1, 2048, 1024, 1024, 2048, 2560]
    - [3, 34703.9]
  - - [1536, 2560, 1, 2048, 1536, 1536, 2048, 2560]
    - [3, 34522.7]
  - - [2048, 2560, 1, 2048, 2048, 2048, 2048, 2560]
    - [3, 35836.2]
  - - [2560, 2560, 1, 2048, 2560, 2560, 2048, 2560]
    - [0, 35908.2]
  - - [3072, 2560, 1, 2048, 3072, 3072, 2048, 2560]
    - [3, 36013.2]
  - - [512, 3072, 1, 2048, 512, 512, 2048, 3072]
    - [14, 31909.3]
  - - [1024, 3072, 1, 2048, 1024, 1024, 2048, 3072]
    - [3, 35383.8]
  - - [1536, 3072, 1, 2048, 1536, 1536, 2048, 3072]
    - [0, 35686.9]
  - - [2048, 3072, 1, 2048, 2048, 2048, 2048, 3072]
    - [19, 35265.7]
  - - [2560, 3072, 1, 2048, 2560, 2560, 2048, 3072]
    - [3, 35958.8]
  - - [3072, 3072, 1, 2048, 3072, 3072, 2048, 3072]
    - [3, 35970.2]
  - - [512, 512, 1, 3072, 512, 512, 3072, 512]
    - [10, 18101.5]
  - - [1024, 512, 1, 3072, 1024, 1024, 3072, 512]
    - [19, 27997.0]
  - - [1536, 512, 1, 3072, 1536, 1536, 3072, 512]
    - [14, 26694.9]
  - - [2048, 512, 1, 3072, 2048, 2048, 3072, 512]
    - [19, 31759.2]
  - - [2560, 512, 1, 3072, 2560, 2560, 3072, 512]
    - [3, 29992.1]
  - - [3072, 512, 1, 3072, 3072, 3072, 3072, 512]
    - [3, 33167.6]
  - - [512, 1024, 1, 3072, 512, 512, 3072, 1024]
    - [19, 27868.2]
  - - [1024, 1024, 1, 3072, 1024, 1024, 3072, 1024]
    - [19, 31382.7]
  - - [1536, 1024, 1, 3072, 1536, 1536, 3072, 1024]
    - [14, 33881.7]
  - - [2048, 1024, 1, 3072, 2048, 2048, 3072, 1024]
    - [0, 34494.5]
  - - [2560, 1024, 1, 3072, 2560, 2560, 3072, 1024]
    - [3, 34640.0]
  - - [3072, 1024, 1, 3072, 3072, 3072, 3072, 1024]
    - [19, 35504.3]
  - - [512, 1536, 1, 3072, 512, 512, 3072, 1536]
    - [19, 27155.2]
  - - [1024, 1536, 1, 3072, 1024, 1024, 3072, 1536]
    - [14, 33352.3]
  - - [1536, 1536, 1, 3072, 1536, 1536, 3072, 1536]
    - [3, 33373.2]
  - - [2048, 1536, 1, 3072, 2048, 2048, 3072, 1536]
    - [3, 35206.2]
  - - [2560, 1536, 1, 3072, 2560, 2560, 3072, 1536]
    - [0, 34823.2]
  - - [3072, 1536, 1, 3072, 3072, 3072, 3072, 1536]
    - [0, 35598.9]
  - - [512, 2048, 1, 3072, 512, 512, 3072, 2048]
    - [3, 32214.3]
  - - [1024, 2048, 1, 3072, 1024, 1024, 3072, 2048]
    - [14, 34504.9]
  - - [1536, 2048, 1, 3072, 1536, 1536, 3072, 2048]
    - [3, 35923.0]
  - - [2048, 2048, 1, 3072, 2048, 2048, 3072, 2048]
    - [3, 36594.8]
  - - [2560, 2048, 1, 3072, 2560, 2560, 3072, 2048]
    - [3, 36296.2]
  - - [3072, 2048, 1, 3072, 3072, 3072, 3072, 2048]
    - [3, 37014.5]
  - - [512, 2560, 1, 3072, 512, 512, 3072, 2560]
    - [3, 30128.1]
  - - [1024, 2560, 1, 3072, 1024, 1024, 3072, 2560]
    - [19, 34650.8]
  - - [1536, 2560, 1, 3072, 1536, 1536, 3072, 2560]
    - [3, 34816.8]
  - - [2048, 2560, 1, 3072, 2048, 2048, 3072, 2560]
    - [3, 36194.5]
  - - [2560, 2560, 1, 3072, 2560, 2560, 3072, 2560]
    - [19, 36498.3]
  - - [3072, 2560, 1, 3072, 3072, 3072, 3072, 2560]
    - [3, 36975.9]
  - - [512, 3072, 1, 3072, 512, 512, 3072, 3072]
    - [19, 33689.1]
  - - [1024, 3072, 1, 3072, 1024, 1024, 3072, 3072]
    - [19, 35008.2]
  - - [1536, 3072, 1, 3072, 1536, 1536, 3072, 3072]
    - [0, 36225.0]
  - - [2048, 3072, 1, 3072, 2048, 2048, 3072, 3072]
    - [3, 37239.9]
  - - [2560, 3072, 1, 3072, 2560, 2560, 3072, 3072]
    - [19, 37114.1]
  - - [3072, 3072, 1, 3072, 3072, 3072, 3072, 3072]
    - [19, 37311.8]
  - - [1, 1, 1, 1, 1, 1, 1, 1]
    - [7, 6.63196e-05]
  - - [1, 1, 1, 64, 1, 1, 64, 1]
    - [12, 0.00409351]
  - - [1, 64, 1, 1, 1, 1, 1, 64]
    - [13, 0.00403404]
  - - [64, 1, 1, 1, 64, 64, 1, 1]
    - [17, 0.004293]
  - - [64, 64, 1, 1, 64, 64, 1, 64]
    - [18, 0.276794]
  - - [64, 1, 1, 64, 64, 64, 64, 1]
    - [12, 0.271654]
  - - [1, 64, 1, 64, 1, 1, 64, 64]
    - [24, 0.272549]
  - - [64, 64, 1, 64, 64, 64, 64, 64]
    - [13, 17.2816]
  - - [64, 64, 1, 256, 64, 64, 256, 64]
    - [23, 65.3318]
  - - [64, 64, 1, 512, 64, 64, 512, 64]
    - [8, 121.342]
  - - [64, 64, 1, 1024, 64, 64, 1024, 64]
    - [25, 206.428]
  - - [64, 64, 1, 2048, 64, 64, 2048, 64]
    - [8, 322.713]
  - - [64, 64, 1, 4096, 64, 64, 4096, 64]
    - [7, 446.904]
- null
- null
- DeviceEfficiency
- GridBased
