library/src/amd_detail/rocblaslt/src/Tensile/Logic/asm_full/gfx1201/GridBased/gfx1201_Cijk_Alik_Bjlk_I8BH_HAI_SAV_UserArgs.yaml
- {MinimumRequiredVersion: 4.33.0}
- gfx1201
- gfx1201
- [Device 73f0]
    SolutionIndex: 0
    SolutionNameMin: Cijk_Alik_Bjlk_I8BH_HAI_SAV_UserArgs_MT256x16x32_MI16x16x1_SN_LDSB0_CLR0_GRVWA8_GRVWB4_GSU1_LBSPPA128_LBSPPB128_LPA8_MIWT4_1_PGR1_PLR0_SS0_SU32_SUM0_SUS256_SVW8_TLDS1_WG64_2_1_WGM8
    SolutionIndex: 1
    SolutionNameMin: Cijk_Alik_Bjlk_I8BH_HAI_SAV_UserArgs_MT32x64x32_MI16x16x1_SN_LDSB0_CLR1_GRVWA8_GRVWB16_GSU1_LBSPPA128_LBSPPB512_LPA8_MIWT2_1_PGR1_PLR1_SS0_SU32_SUM0_SUS256_SVW8_TLDS1_WG16_8_1_WGM8
    SolutionIndex: 2
    SolutionNameMin: Cijk_Alik_Bjlk_I8BH_HAI_SAV_UserArgs_MT32x64x32_MI16x16x1_SN_LDSB0_CLR1_GRVWA8_GRVWB16_GSU1_LBSPPA128_LBSPPB512_LPA8_MIWT2_1_PGR2_PLR1_SS0_SU32_SUM0_SUS256_SVW8_TLDS1_WG16_8_1_WGM8
    SolutionIndex: 3
    SolutionNameMin: Cijk_Alik_Bjlk_I8BH_HAI_SAV_UserArgs_MT32x64x32_MI16x16x1_SN_LDSB0_CLR0_GRVWA8_GRVWB16_GSU1_LBSPPA128_LBSPPB512_LPA8_MIWT2_1_PGR1_PLR0_SS0_SU32_SUM0_SUS256_SVW8_TLDS1_WG16_8_1_WGM8
    SolutionIndex: 4
    SolutionNameMin: Cijk_Alik_Bjlk_I8BH_HAI_SAV_UserArgs_MT32x64x32_MI16x16x1_SN_LDSB0_CLR0_GRVWA8_GRVWB16_GSU1_LBSPPA128_LBSPPB512_LPA8_MIWT2_1_PGR2_PLR0_SS0_SU32_SUM0_SUS256_SVW8_TLDS1_WG16_8_1_WGM8
    SolutionIndex: 5
    SolutionNameMin: Cijk_Alik_Bjlk_I8BH_HAI_SAV_UserArgs_MT64x16x64_MI16x16x1_SN_LDSB0_CLR0_GRVWA8_GRVWB8_GSU1_LBSPPA128_LBSPPB128_LPA8_MIWT1_1_PGR1_PLR0_SS0_SU32_SUM0_SUS256_SVW8_TLDS1_WG64_2_1_WGM8
    SolutionIndex: 6
    SolutionNameMin: Cijk_Alik_Bjlk_I8BH_HAI_SAV_UserArgs_MT128x16x64_MI16x16x1_SN_LDSB0_CLR1_GRVWA8_GRVWB8_GSU1_LBSPPA128_LBSPPB128_LPA8_MIWT2_1_PGR1_PLR1_SS0_SU32_SUM0_SUS256_SVW8_TLDS1_WG64_2_1_WGM8
    SolutionIndex: 7
    SolutionNameMin: Cijk_Alik_Bjlk_I8BH_HAI_SAV_UserArgs_MT256x16x64_MI16x16x1_SN_LDSB1_CLR1_GRVWA8_GRVWB8_GSU1_LBSPPA128_LBSPPB128_LPA8_MIWT4_1_PGR1_PLR1_SS0_SU32_SUM0_SUS256_SVW8_TLDS1_WG64_2_1_WGM8
    SolutionIndex: 8
    SolutionNameMin: Cijk_Alik_Bjlk_I8BH_HAI_SAV_UserArgs_MT256x16x64_MI16x16x1_SN_LDSB1_CLR1_GRVWA8_GRVWB8_GSU1_LBSPPA128_LBSPPB128_LPA8_MIWT4_1_PGR2_PLR1_SS0_SU32_SUM0_SUS256_SVW8_TLDS1_WG64_2_1_WGM8
    SolutionIndex: 9
    SolutionNameMin: Cijk_Alik_Bjlk_I8BH_HAI_SAV_UserArgs_MT256x16x64_MI16x16x1_SN_LDSB1_CLR1_GRVWA8_GRVWB8_GSU1_LBSPPA128_LBSPPB128_LPA8_MIWT4_1_PGR1_PLR3_SS0_SU32_SUM0_SUS256_SVW8_TLDS1_WG64_2_1_WGM8
    SolutionIndex: 10
    SolutionNameMin: Cijk_Alik_Bjlk_I8BH_HAI_SAV_UserArgs_MT256x16x64_MI16x16x1_SN_LDSB1_CLR1_GRVWA8_GRVWB8_GSU1_LBSPPA128_LBSPPB128_LPA8_MIWT4_1_PGR2_PLR3_SS0_SU32_SUM0_SUS256_SVW8_TLDS1_WG64_2_1_WGM8
    SolutionIndex: 11
    SolutionNameMin: Cijk_Alik_Bjlk_I8BH_HAI_SAV_UserArgs_MT32x32x64_MI16x16x1_SN_LDSB0_CLR1_GRVWA8_GRVWB16_GSU1_LBSPPA128_LBSPPB256_LPA8_MIWT1_1_PGR1_PLR3_SS0_SU32_SUM0_SUS256_SVW8_TLDS1_WG32_4_1_WGM8
    SolutionIndex: 12
    SolutionNameMin: Cijk_Alik_Bjlk_I8BH_HAI_SAV_UserArgs_MT64x32x64_MI16x16x1_SN_LDSB0_CLR1_GRVWA8_GRVWB16_GSU1_LBSPPA128_LBSPPB256_LPA8_MIWT2_1_PGR1_PLR3_SS0_SU32_SUM0_SUS256_SVW8_TLDS1_WG32_4_1_WGM8
    SolutionIndex: 13
    SolutionNameMin: Cijk_Alik_Bjlk_I8BH_HAI_SAV_UserArgs_MT64x32x64_MI16x16x1_SN_LDSB0_CLR0_GRVWA8_GRVWB16_GSU1_LBSPPA128_LBSPPB256_LPA8_MIWT2_1_PGR1_PLR0_SS0_SU32_SUM0_SUS256_SVW8_TLDS1_WG32_4_1_WGM8
    SolutionIndex: 14
    SolutionNameMin: Cijk_Alik_Bjlk_I8BH_HAI_SAV_UserArgs_MT16x64x64_MI16x16x1_SN_LDSB0_CLR1_GRVWA8_GRVWB16_GSU1_LBSPPA128_LBSPPB512_LPA8_MIWT1_1_PGR1_PLR3_SS0_SU32_SUM0_SUS256_SVW8_TLDS1_WG16_8_1_WGM8
    SolutionIndex: 15
    SolutionNameMin: Cijk_Alik_Bjlk_I8BH_HAI_SAV_UserArgs_MT32x64x64_MI16x16x1_SN_LDSB0_CLR1_GRVWA8_GRVWB16_GSU1_LBSPPA128_LBSPPB512_LPA8_MIWT2_1_PGR1_PLR1_SS0_SU32_SUM0_SUS256_SVW8_TLDS1_WG16_8_1_WGM8
    SolutionIndex: 16
    SolutionNameMin: Cijk_Alik_Bjlk_I8BH_HAI_SAV_UserArgs_MT32x64x64_MI16x16x1_SN_LDSB0_CLR1_GRVWA8_GRVWB16_GSU1_LBSPPA128_LBSPPB512_LPA8_MIWT2_1_PGR1_PLR3_SS0_SU32_SUM0_SUS256_SVW8_TLDS1_WG16_8_1_WGM8
    SolutionIndex: 17
    SolutionNameMin: Cijk_Alik_Bjlk_I8BH_HAI_SAV_UserArgs_MT32x64x64_MI16x16x1_SN_LDSB0_CLR0_GRVWA8_GRVWB16_GSU1_LBSPPA128_LBSPPB512_LPA8_MIWT2_1_PGR1_PLR0_SS0_SU32_SUM0_SUS256_SVW8_TLDS1_WG16_8_1_WGM8
    SolutionIndex: 18
    SolutionNameMin: Cijk_Alik_Bjlk_I8BH_HAI_SAV_UserArgs_MT32x32x32_MI16x16x1_SN_LDSB0_CLR0_GRVWA8_GRVWB8_GSU1_LBSPPA128_LBSPPB256_LPA8_MIWT1_1_PGR1_PLR0_SS1_SU32_SUM0_SUS256_SVW1_TLDS1_WG32_4_1_WGM8
    SolutionIndex: 19
    SolutionNameMin: Cijk_Alik_Bjlk_I8BH_HAI_SAV_UserArgs_MT32x64x32_MI16x16x1_SN_LDSB0_CLR1_GRVWA8_GRVWB16_GSU1_LBSPPA128_LBSPPB512_LPA8_MIWT2_1_PGR1_PLR1_SS1_SU32_SUM0_SUS256_SVW1_TLDS1_WG16_8_1_WGM8
    SolutionIndex: 20
    SolutionNameMin: Cijk_Alik_Bjlk_I8BH_HAI_SAV_UserArgs_MT32x64x32_MI16x16x1_SN_LDSB0_CLR1_GRVWA8_GRVWB16_GSU1_LBSPPA128_LBSPPB512_LPA8_MIWT2_1_PGR2_PLR1_SS1_SU32_SUM0_SUS256_SVW1_TLDS1_WG16_8_1_WGM8
    SolutionIndex: 21
    SolutionNameMin: Cijk_Alik_Bjlk_I8BH_HAI_SAV_UserArgs_MT32x64x32_MI16x16x1_SN_LDSB0_CLR0_GRVWA8_GRVWB16_GSU1_LBSPPA128_LBSPPB512_LPA8_MIWT2_1_PGR1_PLR0_SS1_SU32_SUM0_SUS256_SVW1_TLDS1_WG16_8_1_WGM8
    SolutionIndex: 22
    SolutionNameMin: Cijk_Alik_Bjlk_I8BH_HAI_SAV_UserArgs_MT32x64x32_MI16x16x1_SN_LDSB0_CLR0_GRVWA8_GRVWB16_GSU1_LBSPPA128_LBSPPB512_LPA8_MIWT2_1_PGR2_PLR0_SS1_SU32_SUM0_SUS256_SVW1_TLDS1_WG16_8_1_WGM8
    SolutionIndex: 23
    SolutionNameMin: Cijk_Alik_Bjlk_I8BH_HAI_SAV_UserArgs_MT64x16x64_MI16x16x1_SN_LDSB0_CLR1_GRVWA8_GRVWB8_GSU1_LBSPPA128_LBSPPB128_LPA8_MIWT1_1_PGR1_PLR1_SS1_SU32_SUM0_SUS256_SVW1_TLDS1_WG64_2_1_WGM8
    SolutionIndex: 24
    SolutionNameMin: Cijk_Alik_Bjlk_I8BH_HAI_SAV_UserArgs_MT256x16x64_MI16x16x1_SN_LDSB1_CLR1_GRVWA8_GRVWB8_GSU1_LBSPPA128_LBSPPB128_LPA8_MIWT4_1_PGR1_PLR1_SS1_SU32_SUM0_SUS256_SVW1_TLDS1_WG64_2_1_WGM8
    SolutionIndex: 25
    SolutionNameMin: Cijk_Alik_Bjlk_I8BH_HAI_SAV_UserArgs_MT256x16x64_MI16x16x1_SN_LDSB1_CLR1_GRVWA8_GRVWB8_GSU1_LBSPPA128_LBSPPB128_LPA8_MIWT4_1_PGR2_PLR1_SS1_SU32_SUM0_SUS256_SVW1_TLDS1_WG64_2_1_WGM8
    SolutionIndex: 26
    SolutionNameMin: Cijk_Alik_Bjlk_I8BH_HAI_SAV_UserArgs_MT256x16x64_MI16x16x1_SN_LDSB1_CLR1_GRVWA8_GRVWB8_GSU1_LBSPPA128_LBSPPB128_LPA8_MIWT4_1_PGR1_PLR3_SS1_SU32_SUM0_SUS256_SVW1_TLDS1_WG64_2_1_WGM8
    SolutionIndex: 27
    SolutionNameMin: Cijk_Alik_Bjlk_I8BH_HAI_SAV_UserArgs_MT256x16x64_MI16x16x1_SN_LDSB1_CLR1_GRVWA8_GRVWB8_GSU1_LBSPPA128_LBSPPB128_LPA8_MIWT4_1_PGR2_PLR3_SS1_SU32_SUM0_SUS256_SVW1_TLDS1_WG64_2_1_WGM8
    SolutionIndex: 28
    SolutionNameMin: Cijk_Alik_Bjlk_I8BH_HAI_SAV_UserArgs_MT32x32x64_MI16x16x1_SN_LDSB0_CLR1_GRVWA8_GRVWB16_GSU1_LBSPPA128_LBSPPB256_LPA8_MIWT1_1_PGR2_PLR1_SS1_SU32_SUM0_SUS256_SVW1_TLDS1_WG32_4_1_WGM8
    SolutionIndex: 29
    SolutionNameMin: Cijk_Alik_Bjlk_I8BH_HAI_SAV_UserArgs_MT32x32x64_MI16x16x1_SN_LDSB0_CLR0_GRVWA8_GRVWB16_GSU1_LBSPPA128_LBSPPB256_LPA8_MIWT1_1_PGR1_PLR0_SS1_SU32_SUM0_SUS256_SVW1_TLDS1_WG32_4_1_WGM8
    SolutionIndex: 30
    SolutionNameMin: Cijk_Alik_Bjlk_I8BH_HAI_SAV_UserArgs_MT64x32x64_MI16x16x1_SN_LDSB0_CLR1_GRVWA8_GRVWB16_GSU1_LBSPPA128_LBSPPB256_LPA8_MIWT2_1_PGR1_PLR1_SS1_SU32_SUM0_SUS256_SVW1_TLDS1_WG32_4_1_WGM8
    SolutionIndex: 31
    SolutionNameMin: Cijk_Alik_Bjlk_I8BH_HAI_SAV_UserArgs_MT64x32x64_MI16x16x1_SN_LDSB0_CLR1_GRVWA8_GRVWB16_GSU1_LBSPPA128_LBSPPB256_LPA8_MIWT2_1_PGR1_PLR3_SS1_SU32_SUM0_SUS256_SVW1_TLDS1_WG32_4_1_WGM8
    SolutionIndex: 32
    SolutionNameMin: Cijk_Alik_Bjlk_I8BH_HAI_SAV_UserArgs_MT64x32x64_MI16x16x1_SN_LDSB0_CLR0_GRVWA8_GRVWB16_GSU1_LBSPPA128_LBSPPB256_LPA8_MIWT2_1_PGR1_PLR0_SS1_SU32_SUM0_SUS256_SVW1_TLDS1_WG32_4_1_WGM8
    SolutionIndex: 33
    SolutionNameMin: Cijk_Alik_Bjlk_I8BH_HAI_SAV_UserArgs_MT64x32x64_MI16x16x1_SN_LDSB0_CLR0_GRVWA8_GRVWB16_GSU1_LBSPPA128_LBSPPB256_LPA8_MIWT2_1_PGR2_PLR0_SS1_SU32_SUM0_SUS256_SVW1_TLDS1_WG32_4_1_WGM8
    SolutionIndex: 34
    SolutionNameMin: Cijk_Alik_Bjlk_I8BH_HAI_SAV_UserArgs_MT16x64x64_MI16x16x1_SN_LDSB0_CLR1_GRVWA8_GRVWB16_GSU1_LBSPPA128_LBSPPB512_LPA8_MIWT1_1_PGR2_PLR1_SS1_SU32_SUM0_SUS256_SVW1_TLDS1_WG16_8_1_WGM8
    SolutionIndex: 35
    SolutionNameMin: Cijk_Alik_Bjlk_I8BH_HAI_SAV_UserArgs_MT16x64x64_MI16x16x1_SN_LDSB0_CLR1_GRVWA8_GRVWB16_GSU1_LBSPPA128_LBSPPB512_LPA8_MIWT1_1_PGR1_PLR3_SS1_SU32_SUM0_SUS256_SVW1_TLDS1_WG16_8_1_WGM8
    SolutionIndex: 36
    SolutionNameMin: Cijk_Alik_Bjlk_I8BH_HAI_SAV_UserArgs_MT32x64x64_MI16x16x1_SN_LDSB0_CLR1_GRVWA8_GRVWB16_GSU1_LBSPPA128_LBSPPB512_LPA8_MIWT2_1_PGR1_PLR1_SS1_SU32_SUM0_SUS256_SVW1_TLDS1_WG16_8_1_WGM8
    SolutionIndex: 37
    SolutionNameMin: Cijk_Alik_Bjlk_I8BH_HAI_SAV_UserArgs_MT32x64x64_MI16x16x1_SN_LDSB0_CLR1_GRVWA8_GRVWB16_GSU1_LBSPPA128_LBSPPB512_LPA8_MIWT2_1_PGR1_PLR3_SS1_SU32_SUM0_SUS256_SVW1_TLDS1_WG16_8_1_WGM8
    SolutionIndex: 38
    SolutionNameMin: Cijk_Alik_Bjlk_I8BH_HAI_SAV_UserArgs_MT32x64x64_MI16x16x1_SN_LDSB0_CLR1_GRVWA8_GRVWB16_GSU1_LBSPPA128_LBSPPB512_LPA8_MIWT2_1_PGR2_PLR3_SS1_SU32_SUM0_SUS256_SVW1_TLDS1_WG16_8_1_WGM8
    SolutionIndex: 39
    SolutionNameMin: Cijk_Alik_Bjlk_I8BH_HAI_SAV_UserArgs_MT32x64x64_MI16x16x1_SN_LDSB0_CLR0_GRVWA8_GRVWB16_GSU1_LBSPPA128_LBSPPB512_LPA8_MIWT2_1_PGR1_PLR0_SS1_SU32_SUM0_SUS256_SVW1_TLDS1_WG16_8_1_WGM8
    SolutionIndex: 40
    SolutionNameMin: Cijk_Alik_Bjlk_I8BH_HAI_SAV_UserArgs_MT32x64x64_MI16x16x1_SN_LDSB0_CLR0_GRVWA8_GRVWB16_GSU1_LBSPPA128_LBSPPB512_LPA8_MIWT2_1_PGR2_PLR0_SS1_SU32_SUM0_SUS256_SVW1_TLDS1_WG16_8_1_WGM8
- - - [512, 512, 1, 64, 512, 512, 64, 512]
    - [6, 1078.3]
  - - [1024, 512, 1, 64, 1024, 1024, 64, 512]
    - [0, 2123.77]
  - - [1536, 512, 1, 64, 1536, 1536, 64, 512]
    - [7, 2983.23]
  - - [2048, 512, 1, 64, 2048, 2048, 64, 512]
    - [33, 3894.32]
  - - [2560, 512, 1, 64, 2560, 2560, 64, 512]
    - [10, 4628.45]
  - - [3072, 512, 1, 64, 3072, 3072, 64, 512]
    - [10, 5307.71]
  - - [512, 1024, 1, 64, 512, 512, 64, 1024]
    - [26, 2221.71]
  - - [1024, 1024, 1, 64, 1024, 1024, 64, 1024]
    - [7, 3783.23]
  - - [1536, 1024, 1, 64, 1536, 1536, 64, 1024]
    - [27, 5606.73]
  - - [2048, 1024, 1, 64, 2048, 2048, 64, 1024]
    - [24, 6633.6]
  - - [2560, 1024, 1, 64, 2560, 2560, 64, 1024]
    - [27, 7955.25]
  - - [3072, 1024, 1, 64, 3072, 3072, 64, 1024]
    - [27, 8767.43]
  - - [512, 1536, 1, 64, 512, 512, 64, 1536]
    - [38, 2876.51]
  - - [1024, 1536, 1, 64, 1024, 1024, 64, 1536]
    - [24, 5410.55]
  - - [1536, 1536, 1, 64, 1536, 1536, 64, 1536]
    - [7, 7045.8]
  - - [2048, 1536, 1, 64, 2048, 2048, 64, 1536]
    - [9, 8598.56]
  - - [2560, 1536, 1, 64, 2560, 2560, 64, 1536]
    - [27, 10305.0]
  - - [3072, 1536, 1, 64, 3072, 3072, 64, 1536]
    - [24, 11002.9]
  - - [512, 2048, 1, 64, 512, 512, 64, 2048]
    - [39, 3836.33]
  - - [1024, 2048, 1, 64, 1024, 1024, 64, 2048]
    - [25, 6939.54]
  - - [1536, 2048, 1, 64, 1536, 1536, 64, 2048]
    - [26, 8885.65]
  - - [2048, 2048, 1, 64, 2048, 2048, 64, 2048]
    - [27, 10609.0]
  - - [2560, 2048, 1, 64, 2560, 2560, 64, 2048]
    - [25, 11730.7]
  - - [3072, 2048, 1, 64, 3072, 3072, 64, 2048]
    - [8, 12744.6]
  - - [512, 2560, 1, 64, 512, 512, 64, 2560]
    - [39, 4725.18]
  - - [1024, 2560, 1, 64, 1024, 1024, 64, 2560]
    - [27, 7597.86]
  - - [1536, 2560, 1, 64, 1536, 1536, 64, 2560]
    - [24, 10208.8]
  - - [2048, 2560, 1, 64, 2048, 2048, 64, 2560]
    - [27, 11993.4]
  - - [2560, 2560, 1, 64, 2560, 2560, 64, 2560]
    - [26, 13347.2]
  - - [3072, 2560, 1, 64, 3072, 3072, 64, 2560]
    - [7, 14199.3]
  - - [512, 3072, 1, 64, 512, 512, 64, 3072]
    - [25, 5306.17]
  - - [1024, 3072, 1, 64, 1024, 1024, 64, 3072]
    - [24, 8923.26]
  - - [1536, 3072, 1, 64, 1536, 1536, 64, 3072]
    - [26, 11316.6]
  - - [2048, 3072, 1, 64, 2048, 2048, 64, 3072]
    - [26, 13033.8]
  - - [2560, 3072, 1, 64, 2560, 2560, 64, 3072]
    - [26, 14540.4]
  - - [3072, 3072, 1, 64, 3072, 3072, 64, 3072]
    - [27, 15437.8]
  - - [512, 512, 1, 256, 512, 512, 256, 512]
    - [17, 3968.24]
  - - [1024, 512, 1, 256, 1024, 1024, 256, 512]
    - [39, 7473.77]
  - - [1536, 512, 1, 256, 1536, 1536, 256, 512]
    - [4, 10342.2]
  - - [2048, 512, 1, 256, 2048, 2048, 256, 512]
    - [39, 13922.3]
  - - [2560, 512, 1, 256, 2560, 2560, 256, 512]
    - [39, 16183.3]
  - - [3072, 512, 1, 256, 3072, 3072, 256, 512]
    - [3, 17970.0]
  - - [512, 1024, 1, 256, 512, 512, 256, 1024]
    - [12, 7519.83]
  - - [1024, 1024, 1, 256, 1024, 1024, 256, 1024]
    - [40, 13559.4]
  - - [1536, 1024, 1, 256, 1536, 1536, 256, 1024]
    - [1, 17810.6]
  - - [2048, 1024, 1, 256, 2048, 2048, 256, 1024]
    - [36, 21844.9]
  - - [2560, 1024, 1, 256, 2560, 2560, 256, 1024]
    - [37, 24125.1]
  - - [3072, 1024, 1, 256, 3072, 3072, 256, 1024]
    - [22, 26699.8]
  - - [512, 1536, 1, 256, 512, 512, 256, 1536]
    - [9, 10559.7]
  - - [1024, 1536, 1, 256, 1024, 1024, 256, 1536]
    - [19, 17642.4]
  - - [1536, 1536, 1, 256, 1536, 1536, 256, 1536]
    - [37, 23865.6]
  - - [2048, 1536, 1, 256, 2048, 2048, 256, 1536]
    - [40, 26726.4]
  - - [2560, 1536, 1, 256, 2560, 2560, 256, 1536]
    - [20, 30118.4]
  - - [3072, 1536, 1, 256, 3072, 3072, 256, 1536]
    - [21, 32537.6]
  - - [512, 2048, 1, 256, 512, 512, 256, 2048]
    - [37, 14060.8]
  - - [1024, 2048, 1, 256, 1024, 1024, 256, 2048]
    - [37, 20786.0]
  - - [1536, 2048, 1, 256, 1536, 1536, 256, 2048]
    - [22, 28001.9]
  - - [2048, 2048, 1, 256, 2048, 2048, 256, 2048]
    - [21, 31191.2]
  - - [2560, 2048, 1, 256, 2560, 2560, 256, 2048]
    - [22, 35525.2]
  - - [3072, 2048, 1, 256, 3072, 3072, 256, 2048]
    - [21, 37776.8]
  - - [512, 2560, 1, 256, 512, 512, 256, 2560]
    - [39, 15508.6]
  - - [1024, 2560, 1, 256, 1024, 1024, 256, 2560]
    - [39, 24988.9]
  - - [1536, 2560, 1, 256, 1536, 1536, 256, 2560]
    - [22, 31280.8]
  - - [2048, 2560, 1, 256, 2048, 2048, 256, 2560]
    - [37, 34598.4]
  - - [2560, 2560, 1, 256, 2560, 2560, 256, 2560]
    - [19, 38638.0]
  - - [3072, 2560, 1, 256, 3072, 3072, 256, 2560]
    - [21, 40711.1]
  - - [512, 3072, 1, 256, 512, 512, 256, 3072]
    - [37, 18405.7]
  - - [1024, 3072, 1, 256, 1024, 1024, 256, 3072]
    - [26, 27489.6]
  - - [1536, 3072, 1, 256, 1536, 1536, 256, 3072]
    - [37, 32763.6]
  - - [2048, 3072, 1, 256, 2048, 2048, 256, 3072]
    - [21, 37941.9]
  - - [2560, 3072, 1, 256, 2560, 2560, 256, 3072]
    - [20, 41729.6]
  - - [3072, 3072, 1, 256, 3072, 3072, 256, 3072]
    - [19, 44379.7]
  - - [512, 512, 1, 512, 512, 512, 512, 512]
    - [37, 7585.92]
  - - [1024, 512, 1, 512, 1024, 1024, 512, 512]
    - [36, 14042.8]
  - - [1536, 512, 1, 512, 1536, 1536, 512, 512]
    - [37, 18584.6]
  - - [2048, 512, 1, 512, 2048, 2048, 512, 512]
    - [37, 23395.1]
  - - [2560, 512, 1, 512, 2560, 2560, 512, 512]
    - [37, 27805.0]
  - - [3072, 512, 1, 512, 3072, 3072, 512, 512]
    - [36, 31306.3]
  - - [512, 1024, 1, 512, 512, 512, 512, 1024]
    - [19, 13764.5]
  - - [1024, 1024, 1, 512, 1024, 1024, 512, 1024]
    - [19, 23679.4]
  - - [1536, 1024, 1, 512, 1536, 1536, 512, 1024]
    - [19, 30223.5]
  - - [2048, 1024, 1, 512, 2048, 2048, 512, 1024]
    - [37, 35789.6]
  - - [2560, 1024, 1, 512, 2560, 2560, 512, 1024]
    - [36, 40055.4]
  - - [3072, 1024, 1, 512, 3072, 3072, 512, 1024]
    - [20, 41825.9]
  - - [512, 1536, 1, 512, 512, 512, 512, 1536]
    - [39, 19514.5]
  - - [1024, 1536, 1, 512, 1024, 1024, 512, 1536]
    - [1, 29676.7]
  - - [1536, 1536, 1, 512, 1536, 1536, 512, 1536]
    - [19, 37968.8]
  - - [2048, 1536, 1, 512, 2048, 2048, 512, 1536]
    - [22, 44948.4]
  - - [2560, 1536, 1, 512, 2560, 2560, 512, 1536]
    - [21, 51439.5]
  - - [3072, 1536, 1, 512, 3072, 3072, 512, 1536]
    - [1, 54298.2]
  - - [512, 2048, 1, 512, 512, 512, 512, 2048]
    - [19, 24181.7]
  - - [1024, 2048, 1, 512, 1024, 1024, 512, 2048]
    - [39, 36546.7]
  - - [1536, 2048, 1, 512, 1536, 1536, 512, 2048]
    - [19, 44998.6]
  - - [2048, 2048, 1, 512, 2048, 2048, 512, 2048]
    - [19, 50357.2]
  - - [2560, 2048, 1, 512, 2560, 2560, 512, 2048]
    - [19, 54993.7]
  - - [3072, 2048, 1, 512, 3072, 3072, 512, 2048]
    - [19, 56885.5]
  - - [512, 2560, 1, 512, 512, 512, 512, 2560]
    - [36, 28274.8]
  - - [1024, 2560, 1, 512, 1024, 1024, 512, 2560]
    - [1, 41258.4]
  - - [1536, 2560, 1, 512, 1536, 1536, 512, 2560]
    - [20, 49745.9]
  - - [2048, 2560, 1, 512, 2048, 2048, 512, 2560]
    - [21, 56164.5]
  - - [2560, 2560, 1, 512, 2560, 2560, 512, 2560]
    - [22, 60096.2]
  - - [3072, 2560, 1, 512, 3072, 3072, 512, 2560]
    - [19, 62469.0]
  - - [512, 3072, 1, 512, 512, 512, 512, 3072]
    - [37, 31355.0]
  - - [1024, 3072, 1, 512, 1024, 1024, 512, 3072]
    - [1, 43755.4]
  - - [1536, 3072, 1, 512, 1536, 1536, 512, 3072]
    - [2, 51104.6]
  - - [2048, 3072, 1, 512, 2048, 2048, 512, 3072]
    - [17, 55857.6]
  - - [2560, 3072, 1, 512, 2560, 2560, 512, 3072]
    - [16, 58228.9]
  - - [3072, 3072, 1, 512, 3072, 3072, 512, 3072]
    - [20, 59058.8]
  - - [512, 512, 1, 1024, 512, 512, 1024, 512]
    - [37, 13450.4]
  - - [1024, 512, 1, 1024, 1024, 1024, 1024, 512]
    - [36, 24008.2]
  - - [1536, 512, 1, 1024, 1536, 1536, 1024, 512]
    - [37, 32754.7]
  - - [2048, 512, 1, 1024, 2048, 2048, 1024, 512]
    - [36, 39293.1]
  - - [2560, 512, 1, 1024, 2560, 2560, 1024, 512]
    - [37, 41870.4]
  - - [3072, 512, 1, 1024, 3072, 3072, 1024, 512]
    - [37, 47773.5]
  - - [512, 1024, 1, 1024, 512, 512, 1024, 1024]
    - [37, 25505.2]
  - - [1024, 1024, 1, 1024, 1024, 1024, 1024, 1024]
    - [32, 37663.3]
  - - [1536, 1024, 1, 1024, 1536, 1536, 1024, 1024]
    - [37, 47576.0]
  - - [2048, 1024, 1, 1024, 2048, 2048, 1024, 1024]
    - [37, 52612.5]
  - - [2560, 1024, 1, 1024, 2560, 2560, 1024, 1024]
    - [37, 55628.0]
  - - [3072, 1024, 1, 1024, 3072, 3072, 1024, 1024]
    - [36, 58924.0]
  - - [512, 1536, 1, 1024, 512, 512, 1024, 1536]
    - [9, 31991.5]
  - - [1024, 1536, 1, 1024, 1024, 1024, 1024, 1536]
    - [19, 47026.6]
  - - [1536, 1536, 1, 1024, 1536, 1536, 1024, 1536]
    - [37, 56671.8]
  - - [2048, 1536, 1, 1024, 2048, 2048, 1024, 1536]
    - [4, 62291.6]
  - - [2560, 1536, 1, 1024, 2560, 2560, 1024, 1536]
    - [19, 69013.0]
  - - [3072, 1536, 1, 1024, 3072, 3072, 1024, 1536]
    - [37, 73116.1]
  - - [512, 2048, 1, 1024, 512, 512, 1024, 2048]
    - [36, 39401.2]
  - - [1024, 2048, 1, 1024, 1024, 1024, 1024, 2048]
    - [20, 56229.4]
  - - [1536, 2048, 1, 1024, 1536, 1536, 1024, 2048]
    - [19, 63939.2]
  - - [2048, 2048, 1, 1024, 2048, 2048, 1024, 2048]
    - [22, 65921.8]
  - - [2560, 2048, 1, 1024, 2560, 2560, 1024, 2048]
    - [15, 71749.7]
  - - [3072, 2048, 1, 1024, 3072, 3072, 1024, 2048]
    - [37, 74780.1]
  - - [512, 2560, 1, 1024, 512, 512, 1024, 2560]
    - [39, 43187.4]
  - - [1024, 2560, 1, 1024, 1024, 1024, 1024, 2560]
    - [19, 60155.6]
  - - [1536, 2560, 1, 1024, 1536, 1536, 1024, 2560]
    - [20, 68900.9]
  - - [2048, 2560, 1, 1024, 2048, 2048, 1024, 2560]
    - [21, 73962.9]
  - - [2560, 2560, 1, 1024, 2560, 2560, 1024, 2560]
    - [19, 79945.8]
  - - [3072, 2560, 1, 1024, 3072, 3072, 1024, 2560]
    - [19, 81285.8]
  - - [512, 3072, 1, 1024, 512, 512, 1024, 3072]
    - [37, 48847.9]
  - - [1024, 3072, 1, 1024, 1024, 1024, 1024, 3072]
    - [3, 61264.5]
  - - [1536, 3072, 1, 1024, 1536, 1536, 1024, 3072]
    - [37, 67089.8]
  - - [2048, 3072, 1, 1024, 2048, 2048, 1024, 3072]
    - [36, 69374.7]
  - - [2560, 3072, 1, 1024, 2560, 2560, 1024, 3072]
    - [37, 73604.1]
  - - [3072, 3072, 1, 1024, 3072, 3072, 1024, 3072]
    - [37, 76472.8]
  - - [512, 512, 1, 2048, 512, 512, 2048, 512]
    - [39, 23642.9]
  - - [1024, 512, 1, 2048, 1024, 1024, 2048, 512]
    - [39, 40457.5]
  - - [1536, 512, 1, 2048, 1536, 1536, 2048, 512]
    - [21, 46820.8]
  - - [2048, 512, 1, 2048, 2048, 2048, 2048, 512]
    - [36, 57007.0]
  - - [2560, 512, 1, 2048, 2560, 2560, 2048, 512]
    - [37, 60618.2]
  - - [3072, 512, 1, 2048, 3072, 3072, 2048, 512]
    - [39, 65595.4]
  - - [512, 1024, 1, 2048, 512, 512, 2048, 1024]
    - [16, 38085.4]
  - - [1024, 1024, 1, 2048, 1024, 1024, 2048, 1024]
    - [1, 52400.7]
  - - [1536, 1024, 1, 2048, 1536, 1536, 2048, 1024]
    - [1, 62188.8]
  - - [2048, 1024, 1, 2048, 2048, 2048, 2048, 1024]
    - [19, 66314.1]
  - - [2560, 1024, 1, 2048, 2560, 2560, 2048, 1024]
    - [36, 71553.2]
  - - [3072, 1024, 1, 2048, 3072, 3072, 2048, 1024]
    - [36, 73624.2]
  - - [512, 1536, 1, 2048, 512, 512, 2048, 1536]
    - [37, 47845.2]
  - - [1024, 1536, 1, 2048, 1024, 1024, 2048, 1536]
    - [19, 65038.5]
  - - [1536, 1536, 1, 2048, 1536, 1536, 2048, 1536]
    - [16, 74667.4]
  - - [2048, 1536, 1, 2048, 2048, 2048, 2048, 1536]
    - [19, 80379.4]
  - - [2560, 1536, 1, 2048, 2560, 2560, 2048, 1536]
    - [1, 84618.6]
  - - [3072, 1536, 1, 2048, 3072, 3072, 2048, 1536]
    - [19, 86837.6]
  - - [512, 2048, 1, 2048, 512, 512, 2048, 2048]
    - [37, 56765.2]
  - - [1024, 2048, 1, 2048, 1024, 1024, 2048, 2048]
    - [19, 72757.8]
  - - [1536, 2048, 1, 2048, 1536, 1536, 2048, 2048]
    - [19, 80389.5]
  - - [2048, 2048, 1, 2048, 2048, 2048, 2048, 2048]
    - [36, 82842.9]
  - - [2560, 2048, 1, 2048, 2560, 2560, 2048, 2048]
    - [19, 86134.0]
  - - [3072, 2048, 1, 2048, 3072, 3072, 2048, 2048]
    - [20, 87660.7]
  - - [512, 2560, 1, 2048, 512, 512, 2048, 2560]
    - [21, 61892.1]
  - - [1024, 2560, 1, 2048, 1024, 1024, 2048, 2560]
    - [19, 75874.2]
  - - [1536, 2560, 1, 2048, 1536, 1536, 2048, 2560]
    - [19, 83876.9]
  - - [2048, 2560, 1, 2048, 2048, 2048, 2048, 2560]
    - [19, 89102.4]
  - - [2560, 2560, 1, 2048, 2560, 2560, 2048, 2560]
    - [36, 91297.7]
  - - [3072, 2560, 1, 2048, 3072, 3072, 2048, 2560]
    - [21, 93515.8]
  - - [512, 3072, 1, 2048, 512, 512, 2048, 3072]
    - [37, 67488.5]
  - - [1024, 3072, 1, 2048, 1024, 1024, 2048, 3072]
    - [19, 81634.7]
  - - [1536, 3072, 1, 2048, 1536, 1536, 2048, 3072]
    - [20, 84628.4]
  - - [2048, 3072, 1, 2048, 2048, 2048, 2048, 3072]
    - [21, 83116.9]
  - - [2560, 3072, 1, 2048, 2560, 2560, 2048, 3072]
    - [20, 85026.0]
  - - [3072, 3072, 1, 2048, 3072, 3072, 2048, 3072]
    - [2, 86105.4]
  - - [512, 512, 1, 3072, 512, 512, 3072, 512]
    - [30, 29803.5]
  - - [1024, 512, 1, 3072, 1024, 1024, 3072, 512]
    - [36, 50913.2]
  - - [1536, 512, 1, 3072, 1536, 1536, 3072, 512]
    - [37, 56953.0]
  - - [2048, 512, 1, 3072, 2048, 2048, 3072, 512]
    - [36, 65097.6]
  - - [2560, 512, 1, 3072, 2560, 2560, 3072, 512]
    - [17, 69671.0]
  - - [3072, 512, 1, 3072, 3072, 3072, 3072, 512]
    - [37, 74133.5]
  - - [512, 1024, 1, 3072, 512, 512, 3072, 1024]
    - [37, 49048.7]
  - - [1024, 1024, 1, 3072, 1024, 1024, 3072, 1024]
    - [19, 63774.0]
  - - [1536, 1024, 1, 3072, 1536, 1536, 3072, 1024]
    - [31, 72774.7]
  - - [2048, 1024, 1, 3072, 2048, 2048, 3072, 1024]
    - [37, 74477.0]
  - - [2560, 1024, 1, 3072, 2560, 2560, 3072, 1024]
    - [32, 77898.4]
  - - [3072, 1024, 1, 3072, 3072, 3072, 3072, 1024]
    - [13, 80574.3]
  - - [512, 1536, 1, 3072, 512, 512, 3072, 1536]
    - [37, 58450.1]
  - - [1024, 1536, 1, 3072, 1024, 1024, 3072, 1536]
    - [37, 75379.1]
  - - [1536, 1536, 1, 3072, 1536, 1536, 3072, 1536]
    - [37, 82510.9]
  - - [2048, 1536, 1, 3072, 2048, 2048, 3072, 1536]
    - [37, 86043.9]
  - - [2560, 1536, 1, 3072, 2560, 2560, 3072, 1536]
    - [19, 88643.9]
  - - [3072, 1536, 1, 3072, 3072, 3072, 3072, 1536]
    - [37, 91533.8]
  - - [512, 2048, 1, 3072, 512, 512, 3072, 2048]
    - [16, 65993.2]
  - - [1024, 2048, 1, 3072, 1024, 1024, 3072, 2048]
    - [16, 81737.8]
  - - [1536, 2048, 1, 3072, 1536, 1536, 3072, 2048]
    - [15, 86584.7]
  - - [2048, 2048, 1, 3072, 2048, 2048, 3072, 2048]
    - [36, 88909.2]
  - - [2560, 2048, 1, 3072, 2560, 2560, 3072, 2048]
    - [37, 93575.8]
  - - [3072, 2048, 1, 3072, 3072, 3072, 3072, 2048]
    - [37, 93475.7]
  - - [512, 2560, 1, 3072, 512, 512, 3072, 2560]
    - [37, 70280.3]
  - - [1024, 2560, 1, 3072, 1024, 1024, 3072, 2560]
    - [17, 83411.2]
  - - [1536, 2560, 1, 3072, 1536, 1536, 3072, 2560]
    - [36, 89373.2]
  - - [2048, 2560, 1, 3072, 2048, 2048, 3072, 2560]
    - [19, 92183.3]
  - - [2560, 2560, 1, 3072, 2560, 2560, 3072, 2560]
    - [21, 95532.7]
  - - [3072, 2560, 1, 3072, 3072, 3072, 3072, 2560]
    - [37, 98863.4]
  - - [512, 3072, 1, 3072, 512, 512, 3072, 3072]
    - [37, 75021.6]
  - - [1024, 3072, 1, 3072, 1024, 1024, 3072, 3072]
    - [21, 84340.0]
  - - [1536, 3072, 1, 3072, 1536, 1536, 3072, 3072]
    - [37, 83725.9]
  - - [2048, 3072, 1, 3072, 2048, 2048, 3072, 3072]
    - [15, 84040.2]
  - - [2560, 3072, 1, 3072, 2560, 2560, 3072, 3072]
    - [37, 83551.6]
  - - [3072, 3072, 1, 3072, 3072, 3072, 3072, 3072]
    - [36, 85764.7]
  - - [1, 64, 1, 1, 1, 1, 1, 64]
    - [18, 0.00365026]
  - - [64, 64, 1, 1, 64, 64, 1, 64]
    - [28, 0.240842]
  - - [1, 64, 1, 64, 1, 1, 64, 64]
    - [34, 0.234493]
  - - [64, 64, 1, 64, 64, 64, 64, 64]
    - [11, 15.743]
  - - [64, 64, 1, 256, 64, 64, 256, 64]
    - [35, 58.1283]
  - - [64, 64, 1, 512, 64, 64, 512, 64]
    - [14, 111.521]
  - - [64, 64, 1, 1024, 64, 64, 1024, 64]
    - [5, 207.917]
  - - [64, 64, 1, 2048, 64, 64, 2048, 64]
    - [23, 361.991]
  - - [64, 64, 1, 4096, 64, 64, 4096, 64]
    - [29, 614.64]
- null
- null
- DeviceEfficiency
- GridBased
