library/src/amd_detail/rocblaslt/src/Tensile/Logic/asm_full/gfx1201/GridBased/gfx1201_Cijk_Ailk_Bjlk_HSS_BH_Bias_HAS_SAV_UserArgs.yaml
- {MinimumRequiredVersion: 4.33.0}
- gfx1201
- gfx1201
- [Device 73f0]
    SolutionIndex: 0
    SolutionNameMin: Cijk_Ailk_Bjlk_HSS_BH_Bias_HAS_SAV_UserArgs_MT64x32x32_MI16x16x1_SN_CLR1_GSU1_LBSPPA1024_LBSPPB512_MIWT2_1_PGR1_PLR1_SS0_SU32_SUM0_SUS256_SVW8_WG32_4_1_WGM8
    SolutionIndex: 1
    SolutionNameMin: Cijk_Ailk_Bjlk_HSS_BH_Bias_HAS_SAV_UserArgs_MT64x32x32_MI16x16x1_SN_CLR1_GSU1_LBSPPA1024_LBSPPB512_MIWT2_1_PGR2_PLR1_SS0_SU32_SUM0_SUS256_SVW8_WG32_4_1_WGM8
    SolutionIndex: 2
    SolutionNameMin: Cijk_Ailk_Bjlk_HSS_BH_Bias_HAS_SAV_UserArgs_MT64x32x32_MI16x16x1_SN_CLR0_GSU1_LBSPPA1024_LBSPPB512_MIWT2_1_PGR1_PLR0_SS0_SU32_SUM0_SUS256_SVW8_WG32_4_1_WGM8
    SolutionIndex: 3
    SolutionNameMin: Cijk_Ailk_Bjlk_HSS_BH_Bias_HAS_SAV_UserArgs_MT64x32x32_MI16x16x1_SN_CLR0_GSU1_LBSPPA1024_LBSPPB512_MIWT2_1_PGR2_PLR0_SS0_SU32_SUM0_SUS256_SVW8_WG32_4_1_WGM8
    SolutionIndex: 4
    SolutionNameMin: Cijk_Ailk_Bjlk_HSS_BH_Bias_HAS_SAV_UserArgs_MT32x64x32_MI16x16x1_SN_CLR1_GSU1_LBSPPA512_LBSPPB1024_MIWT2_1_PGR1_PLR1_SS0_SU32_SUM0_SUS256_SVW8_WG16_8_1_WGM8
    SolutionIndex: 5
    SolutionNameMin: Cijk_Ailk_Bjlk_HSS_BH_Bias_HAS_SAV_UserArgs_MT32x64x32_MI16x16x1_SN_CLR1_GSU1_LBSPPA512_LBSPPB1024_MIWT2_1_PGR2_PLR1_SS0_SU32_SUM0_SUS256_SVW8_WG16_8_1_WGM8
    SolutionIndex: 6
    SolutionNameMin: Cijk_Ailk_Bjlk_HSS_BH_Bias_HAS_SAV_UserArgs_MT32x64x32_MI16x16x1_SN_CLR0_GSU1_LBSPPA512_LBSPPB1024_MIWT2_1_PGR2_PLR0_SS0_SU32_SUM0_SUS256_SVW8_WG16_8_1_WGM8
    SolutionIndex: 7
    SolutionNameMin: Cijk_Ailk_Bjlk_HSS_BH_Bias_HAS_SAV_UserArgs_MT32x32x64_MI16x16x1_SN_CLR1_GSU1_LBSPPA512_LBSPPB512_MIWT1_1_PGR1_PLR1_SS0_SU32_SUM0_SUS256_SVW8_WG32_4_1_WGM8
    SolutionIndex: 8
    SolutionNameMin: Cijk_Ailk_Bjlk_HSS_BH_Bias_HAS_SAV_UserArgs_MT32x32x64_MI16x16x1_SN_CLR1_GSU1_LBSPPA512_LBSPPB512_MIWT1_1_PGR2_PLR3_SS0_SU32_SUM0_SUS256_SVW8_WG32_4_1_WGM8
    SolutionIndex: 9
    SolutionNameMin: Cijk_Ailk_Bjlk_HSS_BH_Bias_HAS_SAV_UserArgs_MT32x32x64_MI16x16x1_SN_CLR0_GSU1_LBSPPA512_LBSPPB512_MIWT1_1_PGR1_PLR0_SS0_SU32_SUM0_SUS256_SVW8_WG32_4_1_WGM8
    SolutionIndex: 10
    SolutionNameMin: Cijk_Ailk_Bjlk_HSS_BH_Bias_HAS_SAV_UserArgs_MT32x64x64_MI16x16x1_SN_CLR1_GSU1_LBSPPA512_LBSPPB1024_MIWT2_1_PGR1_PLR3_SS0_SU32_SUM0_SUS256_SVW8_WG16_8_1_WGM8
    SolutionIndex: 11
    SolutionNameMin: Cijk_Ailk_Bjlk_HSS_BH_Bias_HAS_SAV_UserArgs_MT32x32x32_MI16x16x1_SN_CLR0_GSU1_LBSPPA512_LBSPPB512_MIWT1_1_PGR1_PLR0_SS1_SU32_SUM0_SUS256_SVW1_WG32_4_1_WGM8
    SolutionIndex: 12
    SolutionNameMin: Cijk_Ailk_Bjlk_HSS_BH_Bias_HAS_SAV_UserArgs_MT64x32x32_MI16x16x1_SN_CLR1_GSU1_LBSPPA1024_LBSPPB512_MIWT2_1_PGR1_PLR1_SS1_SU32_SUM0_SUS256_SVW1_WG32_4_1_WGM8
    SolutionIndex: 13
    SolutionNameMin: Cijk_Ailk_Bjlk_HSS_BH_Bias_HAS_SAV_UserArgs_MT64x32x32_MI16x16x1_SN_CLR1_GSU1_LBSPPA1024_LBSPPB512_MIWT2_1_PGR2_PLR1_SS1_SU32_SUM0_SUS256_SVW1_WG32_4_1_WGM8
    SolutionIndex: 14
    SolutionNameMin: Cijk_Ailk_Bjlk_HSS_BH_Bias_HAS_SAV_UserArgs_MT64x32x32_MI16x16x1_SN_CLR0_GSU1_LBSPPA1024_LBSPPB512_MIWT2_1_PGR2_PLR0_SS1_SU32_SUM0_SUS256_SVW1_WG32_4_1_WGM8
    SolutionIndex: 15
    SolutionNameMin: Cijk_Ailk_Bjlk_HSS_BH_Bias_HAS_SAV_UserArgs_MT32x64x32_MI16x16x1_SN_CLR1_GSU1_LBSPPA512_LBSPPB1024_MIWT2_1_PGR1_PLR1_SS1_SU32_SUM0_SUS256_SVW1_WG16_8_1_WGM8
    SolutionIndex: 16
    SolutionNameMin: Cijk_Ailk_Bjlk_HSS_BH_Bias_HAS_SAV_UserArgs_MT32x64x32_MI16x16x1_SN_CLR1_GSU1_LBSPPA512_LBSPPB1024_MIWT2_1_PGR2_PLR1_SS1_SU32_SUM0_SUS256_SVW1_WG16_8_1_WGM8
    SolutionIndex: 17
    SolutionNameMin: Cijk_Ailk_Bjlk_HSS_BH_Bias_HAS_SAV_UserArgs_MT32x64x32_MI16x16x1_SN_CLR0_GSU1_LBSPPA512_LBSPPB1024_MIWT2_1_PGR1_PLR0_SS1_SU32_SUM0_SUS256_SVW1_WG16_8_1_WGM8
    SolutionIndex: 18
    SolutionNameMin: Cijk_Ailk_Bjlk_HSS_BH_Bias_HAS_SAV_UserArgs_MT32x64x32_MI16x16x1_SN_CLR0_GSU1_LBSPPA512_LBSPPB1024_MIWT2_1_PGR2_PLR0_SS1_SU32_SUM0_SUS256_SVW1_WG16_8_1_WGM8
    SolutionIndex: 19
    SolutionNameMin: Cijk_Ailk_Bjlk_HSS_BH_Bias_HAS_SAV_UserArgs_MT32x32x64_MI16x16x1_SN_CLR1_GSU1_LBSPPA512_LBSPPB512_MIWT1_1_PGR1_PLR1_SS1_SU32_SUM0_SUS256_SVW1_WG32_4_1_WGM8
    SolutionIndex: 20
    SolutionNameMin: Cijk_Ailk_Bjlk_HSS_BH_Bias_HAS_SAV_UserArgs_MT32x32x64_MI16x16x1_SN_CLR1_GSU1_LBSPPA512_LBSPPB512_MIWT1_1_PGR1_PLR3_SS1_SU32_SUM0_SUS256_SVW1_WG32_4_1_WGM8
    SolutionIndex: 21
    SolutionNameMin: Cijk_Ailk_Bjlk_HSS_BH_Bias_HAS_SAV_UserArgs_MT32x32x64_MI16x16x1_SN_CLR0_GSU1_LBSPPA512_LBSPPB512_MIWT1_1_PGR1_PLR0_SS1_SU32_SUM0_SUS256_SVW1_WG32_4_1_WGM8
    SolutionIndex: 22
    SolutionNameMin: Cijk_Ailk_Bjlk_HSS_BH_Bias_HAS_SAV_UserArgs_MT32x32x64_MI16x16x1_SN_CLR0_GSU1_LBSPPA512_LBSPPB512_MIWT1_1_PGR2_PLR0_SS1_SU32_SUM0_SUS256_SVW1_WG32_4_1_WGM8
    SolutionIndex: 23
    SolutionNameMin: Cijk_Ailk_Bjlk_HSS_BH_Bias_HAS_SAV_UserArgs_MT64x32x64_MI16x16x1_SN_CLR1_GSU1_LBSPPA1024_LBSPPB512_MIWT2_1_PGR1_PLR1_SS1_SU32_SUM0_SUS256_SVW1_WG32_4_1_WGM8
    SolutionIndex: 24
    SolutionNameMin: Cijk_Ailk_Bjlk_HSS_BH_Bias_HAS_SAV_UserArgs_MT64x32x64_MI16x16x1_SN_CLR1_GSU1_LBSPPA1024_LBSPPB512_MIWT2_1_PGR1_PLR3_SS1_SU32_SUM0_SUS256_SVW1_WG32_4_1_WGM8
    SolutionIndex: 25
    SolutionNameMin: Cijk_Ailk_Bjlk_HSS_BH_Bias_HAS_SAV_UserArgs_MT32x64x64_MI16x16x1_SN_CLR1_GSU1_LBSPPA512_LBSPPB1024_MIWT2_1_PGR1_PLR3_SS1_SU32_SUM0_SUS256_SVW1_WG16_8_1_WGM8
- - - [512, 512, 1, 64, 512, 512, 512, 512]
    - [11, 1126.9]
  - - [1024, 512, 1, 64, 1024, 1024, 1024, 512]
    - [15, 2079.54]
  - - [1536, 512, 1, 64, 1536, 1536, 1536, 512]
    - [18, 2913.13]
  - - [2048, 512, 1, 64, 2048, 2048, 2048, 512]
    - [12, 3502.37]
  - - [2560, 512, 1, 64, 2560, 2560, 2560, 512]
    - [2, 4084.33]
  - - [3072, 512, 1, 64, 3072, 3072, 3072, 512]
    - [13, 4846.81]
  - - [512, 1024, 1, 64, 512, 512, 512, 1024]
    - [17, 2098.46]
  - - [1024, 1024, 1, 64, 1024, 1024, 1024, 1024]
    - [4, 3637.44]
  - - [1536, 1024, 1, 64, 1536, 1536, 1536, 1024]
    - [5, 4933.75]
  - - [2048, 1024, 1, 64, 2048, 2048, 2048, 1024]
    - [13, 6092.08]
  - - [2560, 1024, 1, 64, 2560, 2560, 2560, 1024]
    - [4, 6857.36]
  - - [3072, 1024, 1, 64, 3072, 3072, 3072, 1024]
    - [12, 7971.12]
  - - [512, 1536, 1, 64, 512, 512, 512, 1536]
    - [5, 2748.19]
  - - [1024, 1536, 1, 64, 1024, 1024, 1024, 1536]
    - [12, 4828.21]
  - - [1536, 1536, 1, 64, 1536, 1536, 1536, 1536]
    - [15, 6420.13]
  - - [2048, 1536, 1, 64, 2048, 2048, 2048, 1536]
    - [16, 7668.42]
  - - [2560, 1536, 1, 64, 2560, 2560, 2560, 1536]
    - [5, 8904.16]
  - - [3072, 1536, 1, 64, 3072, 3072, 3072, 1536]
    - [15, 10086.2]
  - - [512, 2048, 1, 64, 512, 512, 512, 2048]
    - [14, 3523.61]
  - - [1024, 2048, 1, 64, 1024, 1024, 1024, 2048]
    - [4, 5900.2]
  - - [1536, 2048, 1, 64, 1536, 1536, 1536, 2048]
    - [12, 7945.8]
  - - [2048, 2048, 1, 64, 2048, 2048, 2048, 2048]
    - [15, 9060.96]
  - - [2560, 2048, 1, 64, 2560, 2560, 2560, 2048]
    - [4, 10415.6]
  - - [3072, 2048, 1, 64, 3072, 3072, 3072, 2048]
    - [4, 11305.1]
  - - [512, 2560, 1, 64, 512, 512, 512, 2560]
    - [16, 4085.33]
  - - [1024, 2560, 1, 64, 1024, 1024, 1024, 2560]
    - [6, 6803.14]
  - - [1536, 2560, 1, 64, 1536, 1536, 1536, 2560]
    - [3, 8790.33]
  - - [2048, 2560, 1, 64, 2048, 2048, 2048, 2560]
    - [3, 10328.9]
  - - [2560, 2560, 1, 64, 2560, 2560, 2560, 2560]
    - [5, 11816.1]
  - - [3072, 2560, 1, 64, 3072, 3072, 3072, 2560]
    - [5, 12651.1]
  - - [512, 3072, 1, 64, 512, 512, 512, 3072]
    - [1, 4704.88]
  - - [1024, 3072, 1, 64, 1024, 1024, 1024, 3072]
    - [16, 7986.77]
  - - [1536, 3072, 1, 64, 1536, 1536, 1536, 3072]
    - [5, 9892.39]
  - - [2048, 3072, 1, 64, 2048, 2048, 2048, 3072]
    - [15, 11433.8]
  - - [2560, 3072, 1, 64, 2560, 2560, 2560, 3072]
    - [4, 12937.6]
  - - [3072, 3072, 1, 64, 3072, 3072, 3072, 3072]
    - [15, 13618.9]
  - - [512, 512, 1, 256, 512, 512, 512, 512]
    - [24, 3697.56]
  - - [1024, 512, 1, 256, 1024, 1024, 1024, 512]
    - [12, 7181.26]
  - - [1536, 512, 1, 256, 1536, 1536, 1536, 512]
    - [12, 9186.28]
  - - [2048, 512, 1, 256, 2048, 2048, 2048, 512]
    - [12, 11250.7]
  - - [2560, 512, 1, 256, 2560, 2560, 2560, 512]
    - [12, 12765.9]
  - - [3072, 512, 1, 256, 3072, 3072, 3072, 512]
    - [12, 13660.6]
  - - [512, 1024, 1, 256, 512, 512, 512, 1024]
    - [15, 7214.07]
  - - [1024, 1024, 1, 256, 1024, 1024, 1024, 1024]
    - [15, 11246.0]
  - - [1536, 1024, 1, 256, 1536, 1536, 1536, 1024]
    - [15, 14166.2]
  - - [2048, 1024, 1, 256, 2048, 2048, 2048, 1024]
    - [15, 15976.9]
  - - [2560, 1024, 1, 256, 2560, 2560, 2560, 1024]
    - [15, 18531.7]
  - - [3072, 1024, 1, 256, 3072, 3072, 3072, 1024]
    - [12, 19972.4]
  - - [512, 1536, 1, 256, 512, 512, 512, 1536]
    - [0, 9222.05]
  - - [1024, 1536, 1, 256, 1024, 1024, 1024, 1536]
    - [0, 14289.6]
  - - [1536, 1536, 1, 256, 1536, 1536, 1536, 1536]
    - [0, 17616.7]
  - - [2048, 1536, 1, 256, 2048, 2048, 2048, 1536]
    - [12, 19903.3]
  - - [2560, 1536, 1, 256, 2560, 2560, 2560, 1536]
    - [15, 21572.4]
  - - [3072, 1536, 1, 256, 3072, 3072, 3072, 1536]
    - [15, 23070.9]
  - - [512, 2048, 1, 256, 512, 512, 512, 2048]
    - [4, 11288.3]
  - - [1024, 2048, 1, 256, 1024, 1024, 1024, 2048]
    - [15, 16790.3]
  - - [1536, 2048, 1, 256, 1536, 1536, 1536, 2048]
    - [15, 19370.9]
  - - [2048, 2048, 1, 256, 2048, 2048, 2048, 2048]
    - [12, 22253.5]
  - - [2560, 2048, 1, 256, 2560, 2560, 2560, 2048]
    - [12, 23935.2]
  - - [3072, 2048, 1, 256, 3072, 3072, 3072, 2048]
    - [15, 25659.8]
  - - [512, 2560, 1, 256, 512, 512, 512, 2560]
    - [0, 12746.5]
  - - [1024, 2560, 1, 256, 1024, 1024, 1024, 2560]
    - [12, 18470.5]
  - - [1536, 2560, 1, 256, 1536, 1536, 1536, 2560]
    - [12, 21723.9]
  - - [2048, 2560, 1, 256, 2048, 2048, 2048, 2560]
    - [15, 23935.2]
  - - [2560, 2560, 1, 256, 2560, 2560, 2560, 2560]
    - [0, 25143.6]
  - - [3072, 2560, 1, 256, 3072, 3072, 3072, 2560]
    - [15, 27034.6]
  - - [512, 3072, 1, 256, 512, 512, 512, 3072]
    - [12, 14277.0]
  - - [1024, 3072, 1, 256, 1024, 1024, 1024, 3072]
    - [15, 19947.6]
  - - [1536, 3072, 1, 256, 1536, 1536, 1536, 3072]
    - [15, 23053.3]
  - - [2048, 3072, 1, 256, 2048, 2048, 2048, 3072]
    - [12, 25300.4]
  - - [2560, 3072, 1, 256, 2560, 2560, 2560, 3072]
    - [12, 26400.5]
  - - [3072, 3072, 1, 256, 3072, 3072, 3072, 3072]
    - [15, 27262.6]
  - - [512, 512, 1, 512, 512, 512, 512, 512]
    - [24, 6933.99]
  - - [1024, 512, 1, 512, 1024, 1024, 1024, 512]
    - [12, 11844.9]
  - - [1536, 512, 1, 512, 1536, 1536, 1536, 512]
    - [15, 14475.1]
  - - [2048, 512, 1, 512, 2048, 2048, 2048, 512]
    - [12, 17319.3]
  - - [2560, 512, 1, 512, 2560, 2560, 2560, 512]
    - [12, 18831.2]
  - - [3072, 512, 1, 512, 3072, 3072, 3072, 512]
    - [12, 19990.0]
  - - [512, 1024, 1, 512, 512, 512, 512, 1024]
    - [15, 11348.2]
  - - [1024, 1024, 1, 512, 1024, 1024, 1024, 1024]
    - [12, 17098.1]
  - - [1536, 1024, 1, 512, 1536, 1536, 1536, 1024]
    - [15, 20014.8]
  - - [2048, 1024, 1, 512, 2048, 2048, 2048, 1024]
    - [15, 22470.5]
  - - [2560, 1024, 1, 512, 2560, 2560, 2560, 1024]
    - [12, 24863.7]
  - - [3072, 1024, 1, 512, 3072, 3072, 3072, 1024]
    - [12, 25426.4]
  - - [512, 1536, 1, 512, 512, 512, 512, 1536]
    - [15, 13813.1]
  - - [1024, 1536, 1, 512, 1024, 1024, 1024, 1536]
    - [0, 20160.4]
  - - [1536, 1536, 1, 512, 1536, 1536, 1536, 1536]
    - [15, 24171.8]
  - - [2048, 1536, 1, 512, 2048, 2048, 2048, 1536]
    - [15, 26197.1]
  - - [2560, 1536, 1, 512, 2560, 2560, 2560, 1536]
    - [0, 27197.3]
  - - [3072, 1536, 1, 512, 3072, 3072, 3072, 1536]
    - [12, 28185.2]
  - - [512, 2048, 1, 512, 512, 512, 512, 2048]
    - [0, 16579.8]
  - - [1024, 2048, 1, 512, 1024, 1024, 1024, 2048]
    - [12, 22949.1]
  - - [1536, 2048, 1, 512, 1536, 1536, 1536, 2048]
    - [12, 26000.1]
  - - [2048, 2048, 1, 512, 2048, 2048, 2048, 2048]
    - [15, 28216.3]
  - - [2560, 2048, 1, 512, 2560, 2560, 2560, 2048]
    - [0, 29264.4]
  - - [3072, 2048, 1, 512, 3072, 3072, 3072, 2048]
    - [0, 30394.9]
  - - [512, 2560, 1, 512, 512, 512, 512, 2560]
    - [12, 18676.4]
  - - [1024, 2560, 1, 512, 1024, 1024, 1024, 2560]
    - [4, 24815.4]
  - - [1536, 2560, 1, 512, 1536, 1536, 1536, 2560]
    - [12, 27527.1]
  - - [2048, 2560, 1, 512, 2048, 2048, 2048, 2560]
    - [15, 29126.0]
  - - [2560, 2560, 1, 512, 2560, 2560, 2560, 2560]
    - [15, 30332.4]
  - - [3072, 2560, 1, 512, 3072, 3072, 3072, 2560]
    - [12, 31024.9]
  - - [512, 3072, 1, 512, 512, 512, 512, 3072]
    - [15, 20599.5]
  - - [1024, 3072, 1, 512, 1024, 1024, 1024, 3072]
    - [15, 26510.4]
  - - [1536, 3072, 1, 512, 1536, 1536, 1536, 3072]
    - [15, 28279.4]
  - - [2048, 3072, 1, 512, 2048, 2048, 2048, 3072]
    - [12, 30031.4]
  - - [2560, 3072, 1, 512, 2560, 2560, 2560, 3072]
    - [4, 31035.8]
  - - [3072, 3072, 1, 512, 3072, 3072, 3072, 3072]
    - [15, 31623.6]
  - - [512, 512, 1, 1024, 512, 512, 512, 512]
    - [23, 11080.7]
  - - [1024, 512, 1, 1024, 1024, 1024, 1024, 512]
    - [12, 17030.5]
  - - [1536, 512, 1, 1024, 1536, 1536, 1536, 512]
    - [12, 20452.7]
  - - [2048, 512, 1, 1024, 2048, 2048, 2048, 512]
    - [4, 23245.2]
  - - [2560, 512, 1, 1024, 2560, 2560, 2560, 512]
    - [12, 24490.9]
  - - [3072, 512, 1, 1024, 3072, 3072, 3072, 512]
    - [15, 26708.4]
  - - [512, 1024, 1, 1024, 512, 512, 512, 1024]
    - [15, 17761.3]
  - - [1024, 1024, 1, 1024, 1024, 1024, 1024, 1024]
    - [12, 22758.9]
  - - [1536, 1024, 1, 1024, 1536, 1536, 1536, 1024]
    - [15, 26137.4]
  - - [2048, 1024, 1, 1024, 2048, 2048, 2048, 1024]
    - [4, 28259.2]
  - - [2560, 1024, 1, 1024, 2560, 2560, 2560, 1024]
    - [15, 29546.8]
  - - [3072, 1024, 1, 1024, 3072, 3072, 3072, 1024]
    - [15, 30359.0]
  - - [512, 1536, 1, 1024, 512, 512, 512, 1536]
    - [12, 19427.0]
  - - [1024, 1536, 1, 1024, 1024, 1024, 1024, 1536]
    - [4, 26207.8]
  - - [1536, 1536, 1, 1024, 1536, 1536, 1536, 1536]
    - [4, 28782.2]
  - - [2048, 1536, 1, 1024, 2048, 2048, 2048, 1536]
    - [12, 30508.8]
  - - [2560, 1536, 1, 1024, 2560, 2560, 2560, 1536]
    - [15, 31563.4]
  - - [3072, 1536, 1, 1024, 3072, 3072, 3072, 1536]
    - [15, 32289.5]
  - - [512, 2048, 1, 1024, 512, 512, 512, 2048]
    - [15, 23382.4]
  - - [1024, 2048, 1, 1024, 1024, 1024, 1024, 2048]
    - [12, 28182.8]
  - - [1536, 2048, 1, 1024, 1536, 1536, 1536, 2048]
    - [0, 30826.2]
  - - [2048, 2048, 1, 1024, 2048, 2048, 2048, 2048]
    - [12, 31827.9]
  - - [2560, 2048, 1, 1024, 2560, 2560, 2560, 2048]
    - [15, 32694.4]
  - - [3072, 2048, 1, 1024, 3072, 3072, 3072, 2048]
    - [15, 33614.8]
  - - [512, 2560, 1, 1024, 512, 512, 512, 2560]
    - [15, 24062.0]
  - - [1024, 2560, 1, 1024, 1024, 1024, 1024, 2560]
    - [0, 29636.7]
  - - [1536, 2560, 1, 1024, 1536, 1536, 1536, 2560]
    - [4, 31573.3]
  - - [2048, 2560, 1, 1024, 2048, 2048, 2048, 2560]
    - [12, 33226.5]
  - - [2560, 2560, 1, 1024, 2560, 2560, 2560, 2560]
    - [15, 33409.5]
  - - [3072, 2560, 1, 1024, 3072, 3072, 3072, 2560]
    - [12, 34613.4]
  - - [512, 3072, 1, 1024, 512, 512, 512, 3072]
    - [12, 26146.1]
  - - [1024, 3072, 1, 1024, 1024, 1024, 1024, 3072]
    - [4, 30438.0]
  - - [1536, 3072, 1, 1024, 1536, 1536, 1536, 3072]
    - [15, 33154.1]
  - - [2048, 3072, 1, 1024, 2048, 2048, 2048, 3072]
    - [12, 33666.7]
  - - [2560, 3072, 1, 1024, 2560, 2560, 2560, 3072]
    - [0, 34560.6]
  - - [3072, 3072, 1, 1024, 3072, 3072, 3072, 3072]
    - [4, 34672.4]
  - - [512, 512, 1, 2048, 512, 512, 512, 512]
    - [25, 15516.5]
  - - [1024, 512, 1, 2048, 1024, 1024, 1024, 512]
    - [12, 23425.5]
  - - [1536, 512, 1, 2048, 1536, 1536, 1536, 512]
    - [4, 24511.5]
  - - [2048, 512, 1, 2048, 2048, 2048, 2048, 512]
    - [15, 27494.1]
  - - [2560, 512, 1, 2048, 2560, 2560, 2560, 512]
    - [15, 28553.5]
  - - [3072, 512, 1, 2048, 3072, 3072, 3072, 512]
    - [15, 30452.4]
  - - [512, 1024, 1, 2048, 512, 512, 512, 1024]
    - [15, 22814.7]
  - - [1024, 1024, 1, 2048, 1024, 1024, 1024, 1024]
    - [15, 28221.8]
  - - [1536, 1024, 1, 2048, 1536, 1536, 1536, 1024]
    - [15, 30018.8]
  - - [2048, 1024, 1, 2048, 2048, 2048, 2048, 1024]
    - [12, 31948.8]
  - - [2560, 1024, 1, 2048, 2560, 2560, 2560, 1024]
    - [15, 32764.4]
  - - [3072, 1024, 1, 2048, 3072, 3072, 3072, 1024]
    - [4, 32981.2]
  - - [512, 1536, 1, 2048, 512, 512, 512, 1536]
    - [15, 24948.9]
  - - [1024, 1536, 1, 2048, 1024, 1024, 1024, 1536]
    - [4, 29961.5]
  - - [1536, 1536, 1, 2048, 1536, 1536, 1536, 1536]
    - [15, 31783.1]
  - - [2048, 1536, 1, 2048, 2048, 2048, 2048, 1536]
    - [4, 32814.6]
  - - [2560, 1536, 1, 2048, 2560, 2560, 2560, 1536]
    - [4, 33651.9]
  - - [3072, 1536, 1, 2048, 3072, 3072, 3072, 1536]
    - [4, 34872.3]
  - - [512, 2048, 1, 2048, 512, 512, 512, 2048]
    - [12, 28118.0]
  - - [1024, 2048, 1, 2048, 1024, 1024, 1024, 2048]
    - [4, 31982.3]
  - - [1536, 2048, 1, 2048, 1536, 1536, 1536, 2048]
    - [12, 33308.3]
  - - [2048, 2048, 1, 2048, 2048, 2048, 2048, 2048]
    - [0, 34400.4]
  - - [2560, 2048, 1, 2048, 2560, 2560, 2560, 2048]
    - [4, 34472.2]
  - - [3072, 2048, 1, 2048, 3072, 3072, 3072, 2048]
    - [4, 34744.1]
  - - [512, 2560, 1, 2048, 512, 512, 512, 2560]
    - [15, 29793.4]
  - - [1024, 2560, 1, 2048, 1024, 1024, 1024, 2560]
    - [12, 32548.5]
  - - [1536, 2560, 1, 2048, 1536, 1536, 1536, 2560]
    - [15, 33780.6]
  - - [2048, 2560, 1, 2048, 2048, 2048, 2048, 2560]
    - [15, 34653.3]
  - - [2560, 2560, 1, 2048, 2560, 2560, 2560, 2560]
    - [4, 35325.7]
  - - [3072, 2560, 1, 2048, 3072, 3072, 3072, 2560]
    - [4, 35148.8]
  - - [512, 3072, 1, 2048, 512, 512, 512, 3072]
    - [12, 30513.1]
  - - [1024, 3072, 1, 2048, 1024, 1024, 1024, 3072]
    - [15, 33142.7]
  - - [1536, 3072, 1, 2048, 1536, 1536, 1536, 3072]
    - [4, 34326.8]
  - - [2048, 3072, 1, 2048, 2048, 2048, 2048, 3072]
    - [15, 35261.8]
  - - [2560, 3072, 1, 2048, 2560, 2560, 2560, 3072]
    - [0, 35387.9]
  - - [3072, 3072, 1, 2048, 3072, 3072, 3072, 3072]
    - [4, 35927.7]
  - - [512, 512, 1, 3072, 512, 512, 512, 512]
    - [10, 17964.0]
  - - [1024, 512, 1, 3072, 1024, 1024, 1024, 512]
    - [15, 25692.5]
  - - [1536, 512, 1, 3072, 1536, 1536, 1536, 512]
    - [15, 26346.6]
  - - [2048, 512, 1, 3072, 2048, 2048, 2048, 512]
    - [12, 30058.1]
  - - [2560, 512, 1, 3072, 2560, 2560, 2560, 512]
    - [4, 29972.1]
  - - [3072, 512, 1, 3072, 3072, 3072, 3072, 512]
    - [4, 31384.8]
  - - [512, 1024, 1, 3072, 512, 512, 512, 1024]
    - [0, 25841.3]
  - - [1024, 1024, 1, 3072, 1024, 1024, 1024, 1024]
    - [4, 29806.0]
  - - [1536, 1024, 1, 3072, 1536, 1536, 1536, 1024]
    - [12, 31978.0]
  - - [2048, 1024, 1, 3072, 2048, 2048, 2048, 1024]
    - [12, 32907.8]
  - - [2560, 1024, 1, 3072, 2560, 2560, 2560, 1024]
    - [12, 33491.4]
  - - [3072, 1024, 1, 3072, 3072, 3072, 3072, 1024]
    - [15, 33811.3]
  - - [512, 1536, 1, 3072, 512, 512, 512, 1536]
    - [15, 27369.3]
  - - [1024, 1536, 1, 3072, 1024, 1024, 1024, 1536]
    - [15, 31550.1]
  - - [1536, 1536, 1, 3072, 1536, 1536, 1536, 1536]
    - [15, 32786.3]
  - - [2048, 1536, 1, 3072, 2048, 2048, 2048, 1536]
    - [15, 33788.8]
  - - [2560, 1536, 1, 3072, 2560, 2560, 2560, 1536]
    - [0, 34421.7]
  - - [3072, 1536, 1, 3072, 3072, 3072, 3072, 1536]
    - [15, 34734.0]
  - - [512, 2048, 1, 3072, 512, 512, 512, 2048]
    - [12, 30166.7]
  - - [1024, 2048, 1, 3072, 1024, 1024, 1024, 2048]
    - [4, 32745.2]
  - - [1536, 2048, 1, 3072, 1536, 1536, 1536, 2048]
    - [4, 33836.8]
  - - [2048, 2048, 1, 3072, 2048, 2048, 2048, 2048]
    - [4, 35134.1]
  - - [2560, 2048, 1, 3072, 2560, 2560, 2560, 2048]
    - [15, 35019.1]
  - - [3072, 2048, 1, 3072, 3072, 3072, 3072, 2048]
    - [15, 35359.4]
  - - [512, 2560, 1, 3072, 512, 512, 512, 2560]
    - [12, 30662.7]
  - - [1024, 2560, 1, 3072, 1024, 1024, 1024, 2560]
    - [0, 33795.5]
  - - [1536, 2560, 1, 3072, 1536, 1536, 1536, 2560]
    - [15, 34849.0]
  - - [2048, 2560, 1, 3072, 2048, 2048, 2048, 2560]
    - [4, 35044.3]
  - - [2560, 2560, 1, 3072, 2560, 2560, 2560, 2560]
    - [4, 35456.5]
  - - [3072, 2560, 1, 3072, 3072, 3072, 3072, 2560]
    - [15, 35963.6]
  - - [512, 3072, 1, 3072, 512, 512, 512, 3072]
    - [0, 31870.2]
  - - [1024, 3072, 1, 3072, 1024, 1024, 1024, 3072]
    - [12, 33996.0]
  - - [1536, 3072, 1, 3072, 1536, 1536, 1536, 3072]
    - [15, 34763.2]
  - - [2048, 3072, 1, 3072, 2048, 2048, 2048, 3072]
    - [15, 35305.7]
  - - [2560, 3072, 1, 3072, 2560, 2560, 2560, 3072]
    - [15, 35982.4]
  - - [3072, 3072, 1, 3072, 3072, 3072, 3072, 3072]
    - [15, 36035.8]
  - - [1, 1, 1, 1, 1, 1, 1, 1]
    - [11, 6.63196e-05]
  - - [1, 1, 1, 64, 1, 1, 1, 1]
    - [20, 0.00418328]
  - - [1, 64, 1, 1, 1, 1, 1, 64]
    - [11, 0.0042871]
  - - [64, 1, 1, 1, 64, 64, 64, 1]
    - [11, 0.00424586]
  - - [64, 64, 1, 1, 64, 64, 64, 64]
    - [11, 0.275121]
  - - [64, 1, 1, 64, 64, 64, 64, 1]
    - [22, 0.271025]
  - - [1, 64, 1, 64, 1, 1, 1, 64]
    - [21, 0.266953]
  - - [64, 64, 1, 64, 64, 64, 64, 64]
    - [8, 17.5423]
  - - [64, 64, 1, 256, 64, 64, 64, 64]
    - [9, 65.5155]
  - - [64, 64, 1, 512, 64, 64, 64, 64]
    - [20, 119.68]
  - - [64, 64, 1, 1024, 64, 64, 64, 64]
    - [19, 204.416]
  - - [64, 64, 1, 2048, 64, 64, 64, 64]
    - [19, 319.329]
  - - [64, 64, 1, 4096, 64, 64, 64, 64]
    - [7, 447.386]
- null
- null
- DeviceEfficiency
- GridBased
