library/src/amd_detail/rocblaslt/src/Tensile/Logic/asm_full/gfx1201/GridBased/gfx1201_Cijk_Alik_Bljk_I8BH_HAI_SAV_UserArgs.yaml
- {MinimumRequiredVersion: 4.33.0}
- gfx1201
- gfx1201
- [Device 73f0]
    SolutionIndex: 0
    SolutionNameMin: Cijk_Alik_Bljk_I8BH_HAI_SAV_UserArgs_MT64x16x32_MI16x16x1_SN_LDSB0_CLR0_GRVWA8_GRVWB4_GSU1_LBSPPA128_LBSPPB128_LPA8_LPB8_MIWT1_1_PGR1_PLR0_SS0_SU32_SUM0_SUS256_SVW8_TLDS1_WG64_2_1_WGM8
    SolutionIndex: 1
    SolutionNameMin: Cijk_Alik_Bljk_I8BH_HAI_SAV_UserArgs_MT32x32x32_MI16x16x1_SN_LDSB0_CLR0_GRVWA8_GRVWB8_GSU1_LBSPPA128_LBSPPB128_LPA8_LPB8_MIWT1_1_PGR1_PLR0_SS0_SU32_SUM0_SUS256_SVW8_TLDS1_WG32_4_1_WGM8
    SolutionIndex: 2
    SolutionNameMin: Cijk_Alik_Bljk_I8BH_HAI_SAV_UserArgs_MT16x64x32_MI16x16x1_SN_LDSB0_CLR1_GRVWA4_GRVWB8_GSU1_LBSPPA128_LBSPPB128_LPA8_LPB8_MIWT1_1_PGR2_PLR1_SS0_SU32_SUM0_SUS256_SVW8_TLDS1_WG16_8_1_WGM8
    SolutionIndex: 3
    SolutionNameMin: Cijk_Alik_Bljk_I8BH_HAI_SAV_UserArgs_MT32x64x32_MI16x16x1_SN_LDSB0_CLR1_GRVWA8_GRVWB8_GSU1_LBSPPA128_LBSPPB128_LPA8_LPB8_MIWT2_1_PGR1_PLR1_SS0_SU32_SUM0_SUS256_SVW8_TLDS1_WG16_8_1_WGM8
    SolutionIndex: 4
    SolutionNameMin: Cijk_Alik_Bljk_I8BH_HAI_SAV_UserArgs_MT32x64x32_MI16x16x1_SN_LDSB0_CLR0_GRVWA8_GRVWB8_GSU1_LBSPPA128_LBSPPB128_LPA8_LPB8_MIWT2_1_PGR2_PLR0_SS0_SU32_SUM0_SUS256_SVW8_TLDS1_WG16_8_1_WGM8
    SolutionIndex: 5
    SolutionNameMin: Cijk_Alik_Bljk_I8BH_HAI_SAV_UserArgs_MT64x16x64_MI16x16x1_SN_LDSB0_CLR1_GRVWA8_GRVWB8_GSU1_LBSPPA128_LBSPPB128_LPA8_LPB8_MIWT1_1_PGR1_PLR1_SS0_SU32_SUM0_SUS256_SVW8_TLDS1_WG64_2_1_WGM8
    SolutionIndex: 6
    SolutionNameMin: Cijk_Alik_Bljk_I8BH_HAI_SAV_UserArgs_MT256x16x64_MI16x16x1_SN_LDSB1_CLR1_GRVWA8_GRVWB8_GSU1_LBSPPA128_LBSPPB128_LPA8_LPB8_MIWT4_1_PGR1_PLR1_SS0_SU32_SUM0_SUS256_SVW8_TLDS1_WG64_2_1_WGM8
    SolutionIndex: 7
    SolutionNameMin: Cijk_Alik_Bljk_I8BH_HAI_SAV_UserArgs_MT256x16x64_MI16x16x1_SN_LDSB1_CLR1_GRVWA8_GRVWB8_GSU1_LBSPPA128_LBSPPB128_LPA8_LPB8_MIWT4_1_PGR2_PLR1_SS0_SU32_SUM0_SUS256_SVW8_TLDS1_WG64_2_1_WGM8
    SolutionIndex: 8
    SolutionNameMin: Cijk_Alik_Bljk_I8BH_HAI_SAV_UserArgs_MT256x16x64_MI16x16x1_SN_LDSB1_CLR1_GRVWA8_GRVWB8_GSU1_LBSPPA128_LBSPPB128_LPA8_LPB8_MIWT4_1_PGR1_PLR3_SS0_SU32_SUM0_SUS256_SVW8_TLDS1_WG64_2_1_WGM8
    SolutionIndex: 9
    SolutionNameMin: Cijk_Alik_Bljk_I8BH_HAI_SAV_UserArgs_MT256x16x64_MI16x16x1_SN_LDSB1_CLR1_GRVWA8_GRVWB8_GSU1_LBSPPA128_LBSPPB128_LPA8_LPB8_MIWT4_1_PGR2_PLR3_SS0_SU32_SUM0_SUS256_SVW8_TLDS1_WG64_2_1_WGM8
    SolutionIndex: 10
    SolutionNameMin: Cijk_Alik_Bljk_I8BH_HAI_SAV_UserArgs_MT64x32x64_MI16x16x1_SN_LDSB0_CLR1_GRVWA8_GRVWB8_GSU1_LBSPPA128_LBSPPB128_LPA8_LPB8_MIWT2_1_PGR1_PLR3_SS0_SU32_SUM0_SUS256_SVW8_TLDS1_WG32_4_1_WGM8
    SolutionIndex: 11
    SolutionNameMin: Cijk_Alik_Bljk_I8BH_HAI_SAV_UserArgs_MT64x32x64_MI16x16x1_SN_LDSB0_CLR0_GRVWA8_GRVWB8_GSU1_LBSPPA128_LBSPPB128_LPA8_LPB8_MIWT2_1_PGR1_PLR0_SS0_SU32_SUM0_SUS256_SVW8_TLDS1_WG32_4_1_WGM8
    SolutionIndex: 12
    SolutionNameMin: Cijk_Alik_Bljk_I8BH_HAI_SAV_UserArgs_MT16x64x64_MI16x16x1_SN_LDSB0_CLR0_GRVWA8_GRVWB8_GSU1_LBSPPA128_LBSPPB128_LPA8_LPB8_MIWT1_1_PGR1_PLR0_SS0_SU32_SUM0_SUS256_SVW8_TLDS1_WG16_8_1_WGM8
    SolutionIndex: 13
    SolutionNameMin: Cijk_Alik_Bljk_I8BH_HAI_SAV_UserArgs_MT32x64x64_MI16x16x1_SN_LDSB0_CLR1_GRVWA8_GRVWB8_GSU1_LBSPPA128_LBSPPB128_LPA8_LPB8_MIWT2_1_PGR1_PLR1_SS0_SU32_SUM0_SUS256_SVW8_TLDS1_WG16_8_1_WGM8
    SolutionIndex: 14
    SolutionNameMin: Cijk_Alik_Bljk_I8BH_HAI_SAV_UserArgs_MT32x64x64_MI16x16x1_SN_LDSB0_CLR1_GRVWA8_GRVWB8_GSU1_LBSPPA128_LBSPPB128_LPA8_LPB8_MIWT2_1_PGR1_PLR3_SS0_SU32_SUM0_SUS256_SVW8_TLDS1_WG16_8_1_WGM8
    SolutionIndex: 15
    SolutionNameMin: Cijk_Alik_Bljk_I8BH_HAI_SAV_UserArgs_MT32x64x64_MI16x16x1_SN_LDSB0_CLR0_GRVWA8_GRVWB8_GSU1_LBSPPA128_LBSPPB128_LPA8_LPB8_MIWT2_1_PGR1_PLR0_SS0_SU32_SUM0_SUS256_SVW8_TLDS1_WG16_8_1_WGM8
    SolutionIndex: 16
    SolutionNameMin: Cijk_Alik_Bljk_I8BH_HAI_SAV_UserArgs_MT64x32x32_MI16x16x1_SN_LDSB0_CLR1_GRVWA8_GRVWB8_GSU1_LBSPPA128_LBSPPB128_LPA8_LPB8_MIWT2_1_PGR1_PLR1_SS1_SU32_SUM0_SUS256_SVW1_TLDS1_WG32_4_1_WGM8
    SolutionIndex: 17
    SolutionNameMin: Cijk_Alik_Bljk_I8BH_HAI_SAV_UserArgs_MT32x64x32_MI16x16x1_SN_LDSB0_CLR1_GRVWA8_GRVWB8_GSU1_LBSPPA128_LBSPPB128_LPA8_LPB8_MIWT2_1_PGR1_PLR1_SS1_SU32_SUM0_SUS256_SVW1_TLDS1_WG16_8_1_WGM8
    SolutionIndex: 18
    SolutionNameMin: Cijk_Alik_Bljk_I8BH_HAI_SAV_UserArgs_MT128x16x64_MI16x16x1_SN_LDSB0_CLR1_GRVWA8_GRVWB8_GSU1_LBSPPA128_LBSPPB128_LPA8_LPB8_MIWT2_1_PGR1_PLR1_SS1_SU32_SUM0_SUS256_SVW1_TLDS1_WG64_2_1_WGM8
    SolutionIndex: 19
    SolutionNameMin: Cijk_Alik_Bljk_I8BH_HAI_SAV_UserArgs_MT256x16x64_MI16x16x1_SN_LDSB1_CLR1_GRVWA8_GRVWB8_GSU1_LBSPPA128_LBSPPB128_LPA8_LPB8_MIWT4_1_PGR1_PLR1_SS1_SU32_SUM0_SUS256_SVW1_TLDS1_WG64_2_1_WGM8
    SolutionIndex: 20
    SolutionNameMin: Cijk_Alik_Bljk_I8BH_HAI_SAV_UserArgs_MT256x16x64_MI16x16x1_SN_LDSB1_CLR1_GRVWA8_GRVWB8_GSU1_LBSPPA128_LBSPPB128_LPA8_LPB8_MIWT4_1_PGR2_PLR1_SS1_SU32_SUM0_SUS256_SVW1_TLDS1_WG64_2_1_WGM8
    SolutionIndex: 21
    SolutionNameMin: Cijk_Alik_Bljk_I8BH_HAI_SAV_UserArgs_MT256x16x64_MI16x16x1_SN_LDSB1_CLR1_GRVWA8_GRVWB8_GSU1_LBSPPA128_LBSPPB128_LPA8_LPB8_MIWT4_1_PGR1_PLR3_SS1_SU32_SUM0_SUS256_SVW1_TLDS1_WG64_2_1_WGM8
    SolutionIndex: 22
    SolutionNameMin: Cijk_Alik_Bljk_I8BH_HAI_SAV_UserArgs_MT256x16x64_MI16x16x1_SN_LDSB1_CLR1_GRVWA8_GRVWB8_GSU1_LBSPPA128_LBSPPB128_LPA8_LPB8_MIWT4_1_PGR2_PLR3_SS1_SU32_SUM0_SUS256_SVW1_TLDS1_WG64_2_1_WGM8
    SolutionIndex: 23
    SolutionNameMin: Cijk_Alik_Bljk_I8BH_HAI_SAV_UserArgs_MT32x32x64_MI16x16x1_SN_LDSB0_CLR1_GRVWA8_GRVWB8_GSU1_LBSPPA128_LBSPPB128_LPA8_LPB8_MIWT1_1_PGR1_PLR1_SS1_SU32_SUM0_SUS256_SVW1_TLDS1_WG32_4_1_WGM8
    SolutionIndex: 24
    SolutionNameMin: Cijk_Alik_Bljk_I8BH_HAI_SAV_UserArgs_MT32x32x64_MI16x16x1_SN_LDSB0_CLR1_GRVWA8_GRVWB8_GSU1_LBSPPA128_LBSPPB128_LPA8_LPB8_MIWT1_1_PGR1_PLR3_SS1_SU32_SUM0_SUS256_SVW1_TLDS1_WG32_4_1_WGM8
    SolutionIndex: 25
    SolutionNameMin: Cijk_Alik_Bljk_I8BH_HAI_SAV_UserArgs_MT32x32x64_MI16x16x1_SN_LDSB0_CLR1_GRVWA8_GRVWB8_GSU1_LBSPPA128_LBSPPB128_LPA8_LPB8_MIWT1_1_PGR2_PLR3_SS1_SU32_SUM0_SUS256_SVW1_TLDS1_WG32_4_1_WGM8
    SolutionIndex: 26
    SolutionNameMin: Cijk_Alik_Bljk_I8BH_HAI_SAV_UserArgs_MT32x32x64_MI16x16x1_SN_LDSB0_CLR0_GRVWA8_GRVWB8_GSU1_LBSPPA128_LBSPPB128_LPA8_LPB8_MIWT1_1_PGR1_PLR0_SS1_SU32_SUM0_SUS256_SVW1_TLDS1_WG32_4_1_WGM8
    SolutionIndex: 27
    SolutionNameMin: Cijk_Alik_Bljk_I8BH_HAI_SAV_UserArgs_MT64x32x64_MI16x16x1_SN_LDSB0_CLR1_GRVWA8_GRVWB8_GSU1_LBSPPA128_LBSPPB128_LPA8_LPB8_MIWT2_1_PGR1_PLR3_SS1_SU32_SUM0_SUS256_SVW1_TLDS1_WG32_4_1_WGM8
    SolutionIndex: 28
    SolutionNameMin: Cijk_Alik_Bljk_I8BH_HAI_SAV_UserArgs_MT64x32x64_MI16x16x1_SN_LDSB0_CLR0_GRVWA8_GRVWB8_GSU1_LBSPPA128_LBSPPB128_LPA8_LPB8_MIWT2_1_PGR1_PLR0_SS1_SU32_SUM0_SUS256_SVW1_TLDS1_WG32_4_1_WGM8
    SolutionIndex: 29
    SolutionNameMin: Cijk_Alik_Bljk_I8BH_HAI_SAV_UserArgs_MT16x64x64_MI16x16x1_SN_LDSB0_CLR1_GRVWA8_GRVWB8_GSU1_LBSPPA128_LBSPPB128_LPA8_LPB8_MIWT1_1_PGR1_PLR3_SS1_SU32_SUM0_SUS256_SVW1_TLDS1_WG16_8_1_WGM8
    SolutionIndex: 30
    SolutionNameMin: Cijk_Alik_Bljk_I8BH_HAI_SAV_UserArgs_MT16x64x64_MI16x16x1_SN_LDSB0_CLR0_GRVWA8_GRVWB8_GSU1_LBSPPA128_LBSPPB128_LPA8_LPB8_MIWT1_1_PGR1_PLR0_SS1_SU32_SUM0_SUS256_SVW1_TLDS1_WG16_8_1_WGM8
    SolutionIndex: 31
    SolutionNameMin: Cijk_Alik_Bljk_I8BH_HAI_SAV_UserArgs_MT32x64x64_MI16x16x1_SN_LDSB0_CLR1_GRVWA8_GRVWB8_GSU1_LBSPPA128_LBSPPB128_LPA8_LPB8_MIWT2_1_PGR1_PLR1_SS1_SU32_SUM0_SUS256_SVW1_TLDS1_WG16_8_1_WGM8
    SolutionIndex: 32
    SolutionNameMin: Cijk_Alik_Bljk_I8BH_HAI_SAV_UserArgs_MT32x64x64_MI16x16x1_SN_LDSB0_CLR1_GRVWA8_GRVWB8_GSU1_LBSPPA128_LBSPPB128_LPA8_LPB8_MIWT2_1_PGR1_PLR3_SS1_SU32_SUM0_SUS256_SVW1_TLDS1_WG16_8_1_WGM8
    SolutionIndex: 33
    SolutionNameMin: Cijk_Alik_Bljk_I8BH_HAI_SAV_UserArgs_MT32x64x64_MI16x16x1_SN_LDSB0_CLR0_GRVWA8_GRVWB8_GSU1_LBSPPA128_LBSPPB128_LPA8_LPB8_MIWT2_1_PGR1_PLR0_SS1_SU32_SUM0_SUS256_SVW1_TLDS1_WG16_8_1_WGM8
- - - [512, 512, 1, 64, 512, 512, 64, 64]
    - [7, 1052.19]
  - - [1024, 512, 1, 64, 1024, 1024, 64, 64]
    - [8, 2028.56]
  - - [1536, 512, 1, 64, 1536, 1536, 64, 64]
    - [19, 3057.63]
  - - [2048, 512, 1, 64, 2048, 2048, 64, 64]
    - [7, 3870.73]
  - - [2560, 512, 1, 64, 2560, 2560, 64, 64]
    - [21, 4637.41]
  - - [3072, 512, 1, 64, 3072, 3072, 64, 64]
    - [21, 5448.62]
  - - [512, 1024, 1, 64, 512, 512, 64, 64]
    - [21, 2135.25]
  - - [1024, 1024, 1, 64, 1024, 1024, 64, 64]
    - [19, 4050.88]
  - - [1536, 1024, 1, 64, 1536, 1536, 64, 64]
    - [8, 5380.19]
  - - [2048, 1024, 1, 64, 2048, 2048, 64, 64]
    - [22, 7012.05]
  - - [2560, 1024, 1, 64, 2560, 2560, 64, 64]
    - [22, 8478.91]
  - - [3072, 1024, 1, 64, 3072, 3072, 64, 64]
    - [21, 9449.51]
  - - [512, 1536, 1, 64, 512, 512, 64, 64]
    - [21, 3239.99]
  - - [1024, 1536, 1, 64, 1024, 1024, 64, 64]
    - [22, 5772.81]
  - - [1536, 1536, 1, 64, 1536, 1536, 64, 64]
    - [9, 7404.07]
  - - [2048, 1536, 1, 64, 2048, 2048, 64, 64]
    - [9, 9039.45]
  - - [2560, 1536, 1, 64, 2560, 2560, 64, 64]
    - [6, 10487.9]
  - - [3072, 1536, 1, 64, 3072, 3072, 64, 64]
    - [8, 11862.5]
  - - [512, 2048, 1, 64, 512, 512, 64, 64]
    - [22, 3822.12]
  - - [1024, 2048, 1, 64, 1024, 1024, 64, 64]
    - [6, 6896.58]
  - - [1536, 2048, 1, 64, 1536, 1536, 64, 64]
    - [20, 9180.0]
  - - [2048, 2048, 1, 64, 2048, 2048, 64, 64]
    - [21, 10947.2]
  - - [2560, 2048, 1, 64, 2560, 2560, 64, 64]
    - [7, 12459.4]
  - - [3072, 2048, 1, 64, 3072, 3072, 64, 64]
    - [8, 13777.7]
  - - [512, 2560, 1, 64, 512, 512, 64, 64]
    - [33, 4751.81]
  - - [1024, 2560, 1, 64, 1024, 1024, 64, 64]
    - [9, 7974.15]
  - - [1536, 2560, 1, 64, 1536, 1536, 64, 64]
    - [22, 10871.5]
  - - [2048, 2560, 1, 64, 2048, 2048, 64, 64]
    - [21, 12503.7]
  - - [2560, 2560, 1, 64, 2560, 2560, 64, 64]
    - [21, 14251.8]
  - - [3072, 2560, 1, 64, 3072, 3072, 64, 64]
    - [7, 15450.3]
  - - [512, 3072, 1, 64, 512, 512, 64, 64]
    - [22, 5578.92]
  - - [1024, 3072, 1, 64, 1024, 1024, 64, 64]
    - [19, 9217.83]
  - - [1536, 3072, 1, 64, 1536, 1536, 64, 64]
    - [9, 11441.2]
  - - [2048, 3072, 1, 64, 2048, 2048, 64, 64]
    - [9, 13658.3]
  - - [2560, 3072, 1, 64, 2560, 2560, 64, 64]
    - [20, 15827.8]
  - - [3072, 3072, 1, 64, 3072, 3072, 64, 64]
    - [19, 17241.3]
  - - [512, 512, 1, 256, 512, 512, 256, 256]
    - [32, 4195.62]
  - - [1024, 512, 1, 256, 1024, 1024, 256, 256]
    - [33, 7894.23]
  - - [1536, 512, 1, 256, 1536, 1536, 256, 256]
    - [16, 11219.7]
  - - [2048, 512, 1, 256, 2048, 2048, 256, 256]
    - [27, 14408.8]
  - - [2560, 512, 1, 256, 2560, 2560, 256, 256]
    - [17, 16851.4]
  - - [3072, 512, 1, 256, 3072, 3072, 256, 256]
    - [14, 18939.5]
  - - [512, 1024, 1, 256, 512, 512, 256, 256]
    - [33, 7952.94]
  - - [1024, 1024, 1, 256, 1024, 1024, 256, 256]
    - [27, 14549.7]
  - - [1536, 1024, 1, 256, 1536, 1536, 256, 256]
    - [32, 19851.8]
  - - [2048, 1024, 1, 256, 2048, 2048, 256, 256]
    - [27, 23991.6]
  - - [2560, 1024, 1, 256, 2560, 2560, 256, 256]
    - [17, 27536.4]
  - - [3072, 1024, 1, 256, 3072, 3072, 256, 256]
    - [32, 30579.9]
  - - [512, 1536, 1, 256, 512, 512, 256, 256]
    - [8, 11145.2]
  - - [1024, 1536, 1, 256, 1024, 1024, 256, 256]
    - [32, 19965.0]
  - - [1536, 1536, 1, 256, 1536, 1536, 256, 256]
    - [4, 24696.6]
  - - [2048, 1536, 1, 256, 2048, 2048, 256, 256]
    - [27, 29737.0]
  - - [2560, 1536, 1, 256, 2560, 2560, 256, 256]
    - [27, 33519.2]
  - - [3072, 1536, 1, 256, 3072, 3072, 256, 256]
    - [27, 37298.8]
  - - [512, 2048, 1, 256, 512, 512, 256, 256]
    - [32, 14262.9]
  - - [1024, 2048, 1, 256, 1024, 1024, 256, 256]
    - [32, 24132.8]
  - - [1536, 2048, 1, 256, 1536, 1536, 256, 256]
    - [17, 30620.6]
  - - [2048, 2048, 1, 256, 2048, 2048, 256, 256]
    - [17, 34943.4]
  - - [2560, 2048, 1, 256, 2560, 2560, 256, 256]
    - [15, 38335.9]
  - - [3072, 2048, 1, 256, 3072, 3072, 256, 256]
    - [17, 42472.8]
  - - [512, 2560, 1, 256, 512, 512, 256, 256]
    - [3, 16674.7]
  - - [1024, 2560, 1, 256, 1024, 1024, 256, 256]
    - [32, 26569.9]
  - - [1536, 2560, 1, 256, 1536, 1536, 256, 256]
    - [17, 34227.0]
  - - [2048, 2560, 1, 256, 2048, 2048, 256, 256]
    - [17, 38112.7]
  - - [2560, 2560, 1, 256, 2560, 2560, 256, 256]
    - [32, 42577.4]
  - - [3072, 2560, 1, 256, 3072, 3072, 256, 256]
    - [32, 45628.5]
  - - [512, 3072, 1, 256, 512, 512, 256, 256]
    - [32, 19729.7]
  - - [1024, 3072, 1, 256, 1024, 1024, 256, 256]
    - [27, 30388.9]
  - - [1536, 3072, 1, 256, 1536, 1536, 256, 256]
    - [17, 36674.9]
  - - [2048, 3072, 1, 256, 2048, 2048, 256, 256]
    - [27, 42165.9]
  - - [2560, 3072, 1, 256, 2560, 2560, 256, 256]
    - [32, 45795.1]
  - - [3072, 3072, 1, 256, 3072, 3072, 256, 256]
    - [17, 49141.5]
  - - [512, 512, 1, 512, 512, 512, 512, 512]
    - [18, 7926.87]
  - - [1024, 512, 1, 512, 1024, 1024, 512, 512]
    - [13, 15018.6]
  - - [1536, 512, 1, 512, 1536, 1536, 512, 512]
    - [17, 20411.3]
  - - [2048, 512, 1, 512, 2048, 2048, 512, 512]
    - [13, 24958.6]
  - - [2560, 512, 1, 512, 2560, 2560, 512, 512]
    - [32, 29704.0]
  - - [3072, 512, 1, 512, 3072, 3072, 512, 512]
    - [32, 33146.3]
  - - [512, 1024, 1, 512, 512, 512, 512, 512]
    - [15, 15554.7]
  - - [1024, 1024, 1, 512, 1024, 1024, 512, 512]
    - [11, 25868.3]
  - - [1536, 1024, 1, 512, 1536, 1536, 512, 512]
    - [32, 34015.8]
  - - [2048, 1024, 1, 512, 2048, 2048, 512, 512]
    - [32, 40275.4]
  - - [2560, 1024, 1, 512, 2560, 2560, 512, 512]
    - [33, 44344.6]
  - - [3072, 1024, 1, 512, 3072, 3072, 512, 512]
    - [32, 49840.3]
  - - [512, 1536, 1, 512, 512, 512, 512, 512]
    - [8, 19989.7]
  - - [1024, 1536, 1, 512, 1024, 1024, 512, 512]
    - [13, 32177.5]
  - - [1536, 1536, 1, 512, 1536, 1536, 512, 512]
    - [32, 42431.4]
  - - [2048, 1536, 1, 512, 2048, 2048, 512, 512]
    - [14, 50712.8]
  - - [2560, 1536, 1, 512, 2560, 2560, 512, 512]
    - [32, 53794.0]
  - - [3072, 1536, 1, 512, 3072, 3072, 512, 512]
    - [32, 58993.9]
  - - [512, 2048, 1, 512, 512, 512, 512, 512]
    - [33, 25578.1]
  - - [1024, 2048, 1, 512, 1024, 1024, 512, 512]
    - [14, 39285.9]
  - - [1536, 2048, 1, 512, 1536, 1536, 512, 512]
    - [32, 49632.1]
  - - [2048, 2048, 1, 512, 2048, 2048, 512, 512]
    - [33, 56023.3]
  - - [2560, 2048, 1, 512, 2560, 2560, 512, 512]
    - [32, 61942.1]
  - - [3072, 2048, 1, 512, 3072, 3072, 512, 512]
    - [32, 67277.1]
  - - [512, 2560, 1, 512, 512, 512, 512, 512]
    - [32, 29249.6]
  - - [1024, 2560, 1, 512, 1024, 1024, 512, 512]
    - [32, 44887.4]
  - - [1536, 2560, 1, 512, 1536, 1536, 512, 512]
    - [32, 54163.7]
  - - [2048, 2560, 1, 512, 2048, 2048, 512, 512]
    - [14, 62946.5]
  - - [2560, 2560, 1, 512, 2560, 2560, 512, 512]
    - [14, 67658.9]
  - - [3072, 2560, 1, 512, 3072, 3072, 512, 512]
    - [14, 72329.2]
  - - [512, 3072, 1, 512, 512, 512, 512, 512]
    - [32, 33540.5]
  - - [1024, 3072, 1, 512, 1024, 1024, 512, 512]
    - [10, 49063.7]
  - - [1536, 3072, 1, 512, 1536, 1536, 512, 512]
    - [14, 59525.9]
  - - [2048, 3072, 1, 512, 2048, 2048, 512, 512]
    - [27, 66670.6]
  - - [2560, 3072, 1, 512, 2560, 2560, 512, 512]
    - [32, 71163.4]
  - - [3072, 3072, 1, 512, 3072, 3072, 512, 512]
    - [32, 73428.3]
  - - [512, 512, 1, 1024, 512, 512, 1024, 1024]
    - [28, 15065.0]
  - - [1024, 512, 1, 1024, 1024, 1024, 1024, 1024]
    - [33, 27339.8]
  - - [1536, 512, 1, 1024, 1536, 1536, 1024, 1024]
    - [3, 33901.2]
  - - [2048, 512, 1, 1024, 2048, 2048, 1024, 1024]
    - [14, 42160.4]
  - - [2560, 512, 1, 1024, 2560, 2560, 1024, 1024]
    - [32, 49224.4]
  - - [3072, 512, 1, 1024, 3072, 3072, 1024, 1024]
    - [32, 55558.5]
  - - [512, 1024, 1, 1024, 512, 512, 1024, 1024]
    - [27, 26351.4]
  - - [1024, 1024, 1, 1024, 1024, 1024, 1024, 1024]
    - [33, 43214.1]
  - - [1536, 1024, 1, 1024, 1536, 1536, 1024, 1024]
    - [32, 56072.0]
  - - [2048, 1024, 1, 1024, 2048, 2048, 1024, 1024]
    - [32, 62858.1]
  - - [2560, 1024, 1, 1024, 2560, 2560, 1024, 1024]
    - [32, 69746.1]
  - - [3072, 1024, 1, 1024, 3072, 3072, 1024, 1024]
    - [32, 75963.3]
  - - [512, 1536, 1, 1024, 512, 512, 1024, 1024]
    - [27, 35613.3]
  - - [1024, 1536, 1, 1024, 1024, 1024, 1024, 1024]
    - [32, 55548.9]
  - - [1536, 1536, 1, 1024, 1536, 1536, 1024, 1024]
    - [32, 64848.2]
  - - [2048, 1536, 1, 1024, 2048, 2048, 1024, 1024]
    - [32, 75129.7]
  - - [2560, 1536, 1, 1024, 2560, 2560, 1024, 1024]
    - [14, 79519.9]
  - - [3072, 1536, 1, 1024, 3072, 3072, 1024, 1024]
    - [32, 87178.7]
  - - [512, 2048, 1, 1024, 512, 512, 1024, 1024]
    - [32, 45001.8]
  - - [1024, 2048, 1, 1024, 1024, 1024, 1024, 1024]
    - [32, 60660.0]
  - - [1536, 2048, 1, 1024, 1536, 1536, 1024, 1024]
    - [32, 75226.2]
  - - [2048, 2048, 1, 1024, 2048, 2048, 1024, 1024]
    - [14, 82179.1]
  - - [2560, 2048, 1, 1024, 2560, 2560, 1024, 1024]
    - [27, 86610.9]
  - - [3072, 2048, 1, 1024, 3072, 3072, 1024, 1024]
    - [32, 92616.5]
  - - [512, 2560, 1, 1024, 512, 512, 1024, 1024]
    - [32, 46660.9]
  - - [1024, 2560, 1, 1024, 1024, 1024, 1024, 1024]
    - [32, 71477.0]
  - - [1536, 2560, 1, 1024, 1536, 1536, 1024, 1024]
    - [32, 79947.0]
  - - [2048, 2560, 1, 1024, 2048, 2048, 1024, 1024]
    - [32, 86401.2]
  - - [2560, 2560, 1, 1024, 2560, 2560, 1024, 1024]
    - [14, 91015.4]
  - - [3072, 2560, 1, 1024, 3072, 3072, 1024, 1024]
    - [14, 98089.1]
  - - [512, 3072, 1, 1024, 512, 512, 1024, 1024]
    - [27, 55358.0]
  - - [1024, 3072, 1, 1024, 1024, 1024, 1024, 1024]
    - [32, 74719.3]
  - - [1536, 3072, 1, 1024, 1536, 1536, 1024, 1024]
    - [32, 84439.5]
  - - [2048, 3072, 1, 1024, 2048, 2048, 1024, 1024]
    - [14, 92917.7]
  - - [2560, 3072, 1, 1024, 2560, 2560, 1024, 1024]
    - [32, 96037.9]
  - - [3072, 3072, 1, 1024, 3072, 3072, 1024, 1024]
    - [10, 99865.4]
  - - [512, 512, 1, 2048, 512, 512, 2048, 2048]
    - [33, 25620.8]
  - - [1024, 512, 1, 2048, 1024, 1024, 2048, 2048]
    - [28, 45440.7]
  - - [1536, 512, 1, 2048, 1536, 1536, 2048, 2048]
    - [17, 58885.7]
  - - [2048, 512, 1, 2048, 2048, 2048, 2048, 2048]
    - [17, 68273.8]
  - - [2560, 512, 1, 2048, 2560, 2560, 2048, 2048]
    - [17, 69728.0]
  - - [3072, 512, 1, 2048, 3072, 3072, 2048, 2048]
    - [14, 82009.9]
  - - [512, 1024, 1, 2048, 512, 512, 2048, 2048]
    - [14, 45868.8]
  - - [1024, 1024, 1, 2048, 1024, 1024, 2048, 2048]
    - [32, 69648.9]
  - - [1536, 1024, 1, 2048, 1536, 1536, 2048, 2048]
    - [13, 78938.1]
  - - [2048, 1024, 1, 2048, 2048, 2048, 2048, 2048]
    - [32, 86665.5]
  - - [2560, 1024, 1, 2048, 2560, 2560, 2048, 2048]
    - [14, 95028.1]
  - - [3072, 1024, 1, 2048, 3072, 3072, 2048, 2048]
    - [14, 96263.0]
  - - [512, 1536, 1, 2048, 512, 512, 2048, 2048]
    - [16, 59694.3]
  - - [1024, 1536, 1, 2048, 1024, 1024, 2048, 2048]
    - [32, 79327.8]
  - - [1536, 1536, 1, 2048, 1536, 1536, 2048, 2048]
    - [32, 90466.1]
  - - [2048, 1536, 1, 2048, 2048, 2048, 2048, 2048]
    - [32, 98241.0]
  - - [2560, 1536, 1, 2048, 2560, 2560, 2048, 2048]
    - [14, 99362.3]
  - - [3072, 1536, 1, 2048, 3072, 3072, 2048, 2048]
    - [32, 105496.0]
  - - [512, 2048, 1, 2048, 512, 512, 2048, 2048]
    - [32, 69603.7]
  - - [1024, 2048, 1, 2048, 1024, 1024, 2048, 2048]
    - [32, 86964.7]
  - - [1536, 2048, 1, 2048, 1536, 1536, 2048, 2048]
    - [14, 98549.9]
  - - [2048, 2048, 1, 2048, 2048, 2048, 2048, 2048]
    - [32, 104706.0]
  - - [2560, 2048, 1, 2048, 2560, 2560, 2048, 2048]
    - [32, 108342.0]
  - - [3072, 2048, 1, 2048, 3072, 3072, 2048, 2048]
    - [32, 109420.0]
  - - [512, 2560, 1, 2048, 512, 512, 2048, 2048]
    - [33, 71314.6]
  - - [1024, 2560, 1, 2048, 1024, 1024, 2048, 2048]
    - [14, 94036.1]
  - - [1536, 2560, 1, 2048, 1536, 1536, 2048, 2048]
    - [32, 99726.5]
  - - [2048, 2560, 1, 2048, 2048, 2048, 2048, 2048]
    - [14, 108782.0]
  - - [2560, 2560, 1, 2048, 2560, 2560, 2048, 2048]
    - [14, 112861.0]
  - - [3072, 2560, 1, 2048, 3072, 3072, 2048, 2048]
    - [32, 113151.0]
  - - [512, 3072, 1, 2048, 512, 512, 2048, 2048]
    - [32, 81998.4]
  - - [1024, 3072, 1, 2048, 1024, 1024, 2048, 2048]
    - [14, 97098.7]
  - - [1536, 3072, 1, 2048, 1536, 1536, 2048, 2048]
    - [32, 105329.0]
  - - [2048, 3072, 1, 2048, 2048, 2048, 2048, 2048]
    - [32, 111822.0]
  - - [2560, 3072, 1, 2048, 2560, 2560, 2048, 2048]
    - [14, 115202.0]
  - - [3072, 3072, 1, 2048, 3072, 3072, 2048, 2048]
    - [32, 116633.0]
  - - [512, 512, 1, 3072, 512, 512, 3072, 3072]
    - [32, 33680.7]
  - - [1024, 512, 1, 3072, 1024, 1024, 3072, 3072]
    - [27, 60629.1]
  - - [1536, 512, 1, 3072, 1536, 1536, 3072, 3072]
    - [17, 74517.1]
  - - [2048, 512, 1, 3072, 2048, 2048, 3072, 3072]
    - [14, 81365.7]
  - - [2560, 512, 1, 3072, 2560, 2560, 3072, 3072]
    - [14, 85793.2]
  - - [3072, 512, 1, 3072, 3072, 3072, 3072, 3072]
    - [32, 94139.2]
  - - [512, 1024, 1, 3072, 512, 512, 3072, 3072]
    - [31, 59617.0]
  - - [1024, 1024, 1, 3072, 1024, 1024, 3072, 3072]
    - [14, 81634.7]
  - - [1536, 1024, 1, 3072, 1536, 1536, 3072, 3072]
    - [32, 94434.6]
  - - [2048, 1024, 1, 3072, 2048, 2048, 3072, 3072]
    - [14, 101586.0]
  - - [2560, 1024, 1, 3072, 2560, 2560, 3072, 3072]
    - [14, 102958.0]
  - - [3072, 1024, 1, 3072, 3072, 3072, 3072, 3072]
    - [27, 104825.0]
  - - [512, 1536, 1, 3072, 512, 512, 3072, 3072]
    - [32, 67754.4]
  - - [1024, 1536, 1, 3072, 1024, 1024, 3072, 3072]
    - [32, 95067.2]
  - - [1536, 1536, 1, 3072, 1536, 1536, 3072, 3072]
    - [32, 99499.7]
  - - [2048, 1536, 1, 3072, 2048, 2048, 3072, 3072]
    - [14, 107843.0]
  - - [2560, 1536, 1, 3072, 2560, 2560, 3072, 3072]
    - [14, 111185.0]
  - - [3072, 1536, 1, 3072, 3072, 3072, 3072, 3072]
    - [14, 115918.0]
  - - [512, 2048, 1, 3072, 512, 512, 3072, 3072]
    - [32, 81759.1]
  - - [1024, 2048, 1, 3072, 1024, 1024, 3072, 3072]
    - [32, 102746.0]
  - - [1536, 2048, 1, 3072, 1536, 1536, 3072, 3072]
    - [32, 112360.0]
  - - [2048, 2048, 1, 3072, 2048, 2048, 3072, 3072]
    - [14, 114720.0]
  - - [2560, 2048, 1, 3072, 2560, 2560, 3072, 3072]
    - [14, 118027.0]
  - - [3072, 2048, 1, 3072, 3072, 3072, 3072, 3072]
    - [14, 121660.0]
  - - [512, 2560, 1, 3072, 512, 512, 3072, 3072]
    - [27, 83018.7]
  - - [1024, 2560, 1, 3072, 1024, 1024, 3072, 3072]
    - [32, 106682.0]
  - - [1536, 2560, 1, 3072, 1536, 1536, 3072, 3072]
    - [14, 113296.0]
  - - [2048, 2560, 1, 3072, 2048, 2048, 3072, 3072]
    - [32, 118843.0]
  - - [2560, 2560, 1, 3072, 2560, 2560, 3072, 3072]
    - [32, 120686.0]
  - - [3072, 2560, 1, 3072, 3072, 3072, 3072, 3072]
    - [14, 122911.0]
  - - [512, 3072, 1, 3072, 512, 512, 3072, 3072]
    - [32, 91479.2]
  - - [1024, 3072, 1, 3072, 1024, 1024, 3072, 3072]
    - [14, 109292.0]
  - - [1536, 3072, 1, 3072, 1536, 1536, 3072, 3072]
    - [14, 116544.0]
  - - [2048, 3072, 1, 3072, 2048, 2048, 3072, 3072]
    - [32, 123344.0]
  - - [2560, 3072, 1, 3072, 2560, 2560, 3072, 3072]
    - [32, 124276.0]
  - - [3072, 3072, 1, 3072, 3072, 3072, 3072, 3072]
    - [14, 128165.0]
  - - [1, 1, 1, 1, 1, 1, 1, 1]
    - [0, 5.67279e-05]
  - - [1, 1, 1, 64, 1, 1, 64, 64]
    - [29, 0.00385623]
  - - [1, 64, 1, 1, 1, 1, 1, 1]
    - [25, 0.00363368]
  - - [64, 1, 1, 1, 64, 64, 1, 1]
    - [1, 0.00372039]
  - - [64, 64, 1, 1, 64, 64, 1, 1]
    - [2, 0.235024]
  - - [64, 1, 1, 64, 64, 64, 64, 64]
    - [30, 0.229166]
  - - [1, 64, 1, 64, 1, 1, 64, 64]
    - [24, 0.249217]
  - - [64, 64, 1, 64, 64, 64, 64, 64]
    - [12, 15.4184]
  - - [64, 64, 1, 256, 64, 64, 256, 256]
    - [26, 63.604]
  - - [64, 64, 1, 512, 64, 64, 512, 512]
    - [24, 118.664]
  - - [64, 64, 1, 1024, 64, 64, 1024, 1024]
    - [24, 225.567]
  - - [64, 64, 1, 2048, 64, 64, 2048, 2048]
    - [5, 397.762]
  - - [64, 64, 1, 4096, 64, 64, 4096, 4096]
    - [23, 691.402]
- null
- null
- DeviceEfficiency
- GridBased
