library/src/amd_detail/rocblaslt/src/Tensile/Logic/asm_full/gfx1201/GridBased/gfx1201_Cijk_Alik_Bljk_SB_Bias_HAS_SAV_UserArgs.yaml
- {MinimumRequiredVersion: 4.33.0}
- gfx1201
- gfx1201
- [Device 73f0]
    SolutionIndex: 0
    SolutionNameMin: Cijk_Alik_Bljk_SB_Bias_HAS_SAV_UserArgs_MT8x8x8_SN_GSU1_SU32_SUM0_SUS256_TT1_1_WGM1
    SolutionIndex: 1
    SolutionNameMin: Cijk_Alik_Bljk_SB_Bias_HAS_SAV_UserArgs_MT16x16x8_SN_GSU1_SU32_SUM0_SUS256_TT2_2_WGM1
    SolutionIndex: 2
    SolutionNameMin: Cijk_Alik_Bljk_SB_Bias_HAS_SAV_UserArgs_MT8x8x16_SN_GSU1_SU32_SUM0_SUS256_TT1_1_WGM1
    SolutionIndex: 3
    SolutionNameMin: Cijk_Alik_Bljk_SB_Bias_HAS_SAV_UserArgs_MT16x16x16_SN_GSU1_SU32_SUM0_SUS256_TT2_2_WGM1
- - - [64, 64, 1, 32, 64, 64, 32, 32]
    - [3, 0.961182]
  - - [128, 64, 1, 32, 128, 128, 32, 32]
    - [1, 0.930242]
  - - [192, 64, 1, 32, 192, 192, 32, 32]
    - [2, 1.01129]
  - - [256, 64, 1, 32, 256, 256, 32, 32]
    - [1, 1.27236]
  - - [320, 64, 1, 32, 320, 320, 32, 32]
    - [3, 1.71223]
  - - [384, 64, 1, 32, 384, 384, 32, 32]
    - [3, 2.4983]
  - - [448, 64, 1, 32, 448, 448, 32, 32]
    - [2, 2.2778]
  - - [512, 64, 1, 32, 512, 512, 32, 32]
    - [1, 6.11391]
  - - [576, 64, 1, 32, 576, 576, 32, 32]
    - [2, 3.66923]
  - - [640, 64, 1, 32, 640, 640, 32, 32]
    - [0, 3.50561]
  - - [704, 64, 1, 32, 704, 704, 32, 32]
    - [3, 4.7064]
  - - [768, 64, 1, 32, 768, 768, 32, 32]
    - [0, 3.30602]
  - - [832, 64, 1, 32, 832, 832, 32, 32]
    - [2, 3.28918]
  - - [896, 64, 1, 32, 896, 896, 32, 32]
    - [2, 3.91901]
  - - [960, 64, 1, 32, 960, 960, 32, 32]
    - [3, 4.9682]
  - - [1024, 64, 1, 32, 1024, 1024, 32, 32]
    - [1, 7.12561]
  - - [64, 128, 1, 32, 64, 64, 32, 32]
    - [1, 0.870962]
  - - [128, 128, 1, 32, 128, 128, 32, 32]
    - [2, 1.87482]
  - - [192, 128, 1, 32, 192, 192, 32, 32]
    - [0, 1.97129]
  - - [256, 128, 1, 32, 256, 256, 32, 32]
    - [2, 4.53543]
  - - [320, 128, 1, 32, 320, 320, 32, 32]
    - [3, 3.27044]
  - - [384, 128, 1, 32, 384, 384, 32, 32]
    - [3, 4.15297]
  - - [448, 128, 1, 32, 448, 448, 32, 32]
    - [0, 3.52382]
  - - [512, 128, 1, 32, 512, 512, 32, 32]
    - [2, 4.91444]
  - - [576, 128, 1, 32, 576, 576, 32, 32]
    - [2, 6.40787]
  - - [640, 128, 1, 32, 640, 640, 32, 32]
    - [0, 6.76313]
  - - [704, 128, 1, 32, 704, 704, 32, 32]
    - [0, 6.22605]
  - - [768, 128, 1, 32, 768, 768, 32, 32]
    - [0, 7.1929]
  - - [832, 128, 1, 32, 832, 832, 32, 32]
    - [3, 5.28644]
  - - [896, 128, 1, 32, 896, 896, 32, 32]
    - [2, 6.4897]
  - - [960, 128, 1, 32, 960, 960, 32, 32]
    - [0, 6.64762]
  - - [1024, 128, 1, 32, 1024, 1024, 32, 32]
    - [2, 6.49329]
  - - [64, 192, 1, 32, 64, 64, 32, 32]
    - [0, 0.704077]
  - - [128, 192, 1, 32, 128, 128, 32, 32]
    - [2, 1.41888]
  - - [192, 192, 1, 32, 192, 192, 32, 32]
    - [3, 2.12561]
  - - [256, 192, 1, 32, 256, 256, 32, 32]
    - [3, 2.4321]
  - - [320, 192, 1, 32, 320, 320, 32, 32]
    - [0, 3.78764]
  - - [384, 192, 1, 32, 384, 384, 32, 32]
    - [1, 3.66146]
  - - [448, 192, 1, 32, 448, 448, 32, 32]
    - [1, 5.06737]
  - - [512, 192, 1, 32, 512, 512, 32, 32]
    - [3, 5.7003]
  - - [576, 192, 1, 32, 576, 576, 32, 32]
    - [0, 5.52533]
  - - [640, 192, 1, 32, 640, 640, 32, 32]
    - [0, 6.74535]
  - - [704, 192, 1, 32, 704, 704, 32, 32]
    - [2, 9.27548]
  - - [768, 192, 1, 32, 768, 768, 32, 32]
    - [0, 7.72288]
  - - [832, 192, 1, 32, 832, 832, 32, 32]
    - [0, 7.34218]
  - - [896, 192, 1, 32, 896, 896, 32, 32]
    - [1, 8.4376]
  - - [960, 192, 1, 32, 960, 960, 32, 32]
    - [3, 9.85136]
  - - [1024, 192, 1, 32, 1024, 1024, 32, 32]
    - [3, 13.072]
  - - [64, 256, 1, 32, 64, 64, 32, 32]
    - [0, 1.21743]
  - - [128, 256, 1, 32, 128, 128, 32, 32]
    - [0, 2.45437]
  - - [192, 256, 1, 32, 192, 192, 32, 32]
    - [0, 3.33437]
  - - [256, 256, 1, 32, 256, 256, 32, 32]
    - [1, 5.20562]
  - - [320, 256, 1, 32, 320, 320, 32, 32]
    - [1, 5.31561]
  - - [384, 256, 1, 32, 384, 384, 32, 32]
    - [3, 8.67279]
  - - [448, 256, 1, 32, 448, 448, 32, 32]
    - [1, 8.50353]
  - - [512, 256, 1, 32, 512, 512, 32, 32]
    - [3, 9.90701]
  - - [576, 256, 1, 32, 576, 576, 32, 32]
    - [2, 16.3995]
  - - [640, 256, 1, 32, 640, 640, 32, 32]
    - [3, 16.3491]
  - - [704, 256, 1, 32, 704, 704, 32, 32]
    - [0, 14.7644]
  - - [768, 256, 1, 32, 768, 768, 32, 32]
    - [0, 13.5922]
  - - [832, 256, 1, 32, 832, 832, 32, 32]
    - [2, 15.4306]
  - - [896, 256, 1, 32, 896, 896, 32, 32]
    - [2, 16.956]
  - - [960, 256, 1, 32, 960, 960, 32, 32]
    - [3, 26.2462]
  - - [1024, 256, 1, 32, 1024, 1024, 32, 32]
    - [3, 28.1486]
  - - [64, 320, 1, 32, 64, 64, 32, 32]
    - [1, 1.65835]
  - - [128, 320, 1, 32, 128, 128, 32, 32]
    - [1, 4.67952]
  - - [192, 320, 1, 32, 192, 192, 32, 32]
    - [0, 6.79371]
  - - [256, 320, 1, 32, 256, 256, 32, 32]
    - [0, 5.66023]
  - - [320, 320, 1, 32, 320, 320, 32, 32]
    - [3, 6.79393]
  - - [384, 320, 1, 32, 384, 384, 32, 32]
    - [3, 6.81994]
  - - [448, 320, 1, 32, 448, 448, 32, 32]
    - [0, 9.14434]
  - - [512, 320, 1, 32, 512, 512, 32, 32]
    - [3, 9.98894]
  - - [576, 320, 1, 32, 576, 576, 32, 32]
    - [2, 11.7623]
  - - [640, 320, 1, 32, 640, 640, 32, 32]
    - [3, 12.5572]
  - - [704, 320, 1, 32, 704, 704, 32, 32]
    - [1, 11.0382]
  - - [768, 320, 1, 32, 768, 768, 32, 32]
    - [0, 13.6371]
  - - [832, 320, 1, 32, 832, 832, 32, 32]
    - [3, 18.6981]
  - - [896, 320, 1, 32, 896, 896, 32, 32]
    - [3, 17.3833]
  - - [960, 320, 1, 32, 960, 960, 32, 32]
    - [3, 19.8547]
  - - [1024, 320, 1, 32, 1024, 1024, 32, 32]
    - [1, 23.7944]
  - - [64, 384, 1, 32, 64, 64, 32, 32]
    - [1, 2.73345]
  - - [128, 384, 1, 32, 128, 128, 32, 32]
    - [3, 4.53644]
  - - [192, 384, 1, 32, 192, 192, 32, 32]
    - [3, 15.0835]
  - - [256, 384, 1, 32, 256, 256, 32, 32]
    - [0, 33.0484]
  - - [320, 384, 1, 32, 320, 320, 32, 32]
    - [3, 13.9881]
  - - [384, 384, 1, 32, 384, 384, 32, 32]
    - [3, 16.584]
  - - [448, 384, 1, 32, 448, 448, 32, 32]
    - [3, 19.3974]
  - - [512, 384, 1, 32, 512, 512, 32, 32]
    - [1, 22.267]
  - - [576, 384, 1, 32, 576, 576, 32, 32]
    - [2, 24.876]
  - - [640, 384, 1, 32, 640, 640, 32, 32]
    - [2, 17.8454]
  - - [704, 384, 1, 32, 704, 704, 32, 32]
    - [0, 17.4062]
  - - [768, 384, 1, 32, 768, 768, 32, 32]
    - [0, 15.2347]
  - - [832, 384, 1, 32, 832, 832, 32, 32]
    - [1, 20.1144]
  - - [896, 384, 1, 32, 896, 896, 32, 32]
    - [0, 34.5032]
  - - [960, 384, 1, 32, 960, 960, 32, 32]
    - [3, 41.3278]
  - - [1024, 384, 1, 32, 1024, 1024, 32, 32]
    - [0, 466.898]
  - - [64, 448, 1, 32, 64, 64, 32, 32]
    - [3, 2.60258]
  - - [128, 448, 1, 32, 128, 128, 32, 32]
    - [1, 12.5974]
  - - [192, 448, 1, 32, 192, 192, 32, 32]
    - [2, 7.22506]
  - - [256, 448, 1, 32, 256, 256, 32, 32]
    - [1, 11.8021]
  - - [320, 448, 1, 32, 320, 320, 32, 32]
    - [1, 10.7899]
  - - [384, 448, 1, 32, 384, 384, 32, 32]
    - [2, 9.84607]
  - - [448, 448, 1, 32, 448, 448, 32, 32]
    - [1, 11.8323]
  - - [512, 448, 1, 32, 512, 512, 32, 32]
    - [1, 9.08453]
  - - [576, 448, 1, 32, 576, 576, 32, 32]
    - [2, 10.7907]
  - - [640, 448, 1, 32, 640, 640, 32, 32]
    - [3, 14.0017]
  - - [704, 448, 1, 32, 704, 704, 32, 32]
    - [3, 22.7134]
  - - [768, 448, 1, 32, 768, 768, 32, 32]
    - [1, 24.9589]
  - - [832, 448, 1, 32, 832, 832, 32, 32]
    - [0, 25.6728]
  - - [896, 448, 1, 32, 896, 896, 32, 32]
    - [1, 28.3313]
  - - [960, 448, 1, 32, 960, 960, 32, 32]
    - [1, 22.2027]
  - - [1024, 448, 1, 32, 1024, 1024, 32, 32]
    - [1, 35.9473]
  - - [64, 512, 1, 32, 64, 64, 32, 32]
    - [2, 2.54729]
  - - [128, 512, 1, 32, 128, 128, 32, 32]
    - [3, 4.41461]
  - - [192, 512, 1, 32, 192, 192, 32, 32]
    - [0, 5.58076]
  - - [256, 512, 1, 32, 256, 256, 32, 32]
    - [2, 7.43936]
  - - [320, 512, 1, 32, 320, 320, 32, 32]
    - [1, 13.7701]
  - - [384, 512, 1, 32, 384, 384, 32, 32]
    - [1, 22.3183]
  - - [448, 512, 1, 32, 448, 448, 32, 32]
    - [2, 12.7797]
  - - [512, 512, 1, 32, 512, 512, 32, 32]
    - [3, 17.1664]
  - - [576, 512, 1, 32, 576, 576, 32, 32]
    - [0, 22.2301]
  - - [640, 512, 1, 32, 640, 640, 32, 32]
    - [2, 20.3802]
  - - [704, 512, 1, 32, 704, 704, 32, 32]
    - [3, 20.3989]
  - - [768, 512, 1, 32, 768, 768, 32, 32]
    - [1, 25.877]
  - - [832, 512, 1, 32, 832, 832, 32, 32]
    - [2, 35.6638]
  - - [896, 512, 1, 32, 896, 896, 32, 32]
    - [2, 27.7182]
  - - [960, 512, 1, 32, 960, 960, 32, 32]
    - [3, 35.7207]
  - - [1024, 512, 1, 32, 1024, 1024, 32, 32]
    - [3, 29.9974]
  - - [64, 576, 1, 32, 64, 64, 32, 32]
    - [0, 2.10859]
  - - [128, 576, 1, 32, 128, 128, 32, 32]
    - [2, 5.60107]
  - - [192, 576, 1, 32, 192, 192, 32, 32]
    - [2, 5.92298]
  - - [256, 576, 1, 32, 256, 256, 32, 32]
    - [3, 9.48493]
  - - [320, 576, 1, 32, 320, 320, 32, 32]
    - [2, 13.0982]
  - - [384, 576, 1, 32, 384, 384, 32, 32]
    - [2, 14.3088]
  - - [448, 576, 1, 32, 448, 448, 32, 32]
    - [2, 22.8091]
  - - [512, 576, 1, 32, 512, 512, 32, 32]
    - [0, 25.975]
  - - [576, 576, 1, 32, 576, 576, 32, 32]
    - [3, 16.854]
  - - [640, 576, 1, 32, 640, 640, 32, 32]
    - [2, 26.8094]
  - - [704, 576, 1, 32, 704, 704, 32, 32]
    - [3, 27.862]
  - - [768, 576, 1, 32, 768, 768, 32, 32]
    - [2, 25.0725]
  - - [832, 576, 1, 32, 832, 832, 32, 32]
    - [0, 27.4046]
  - - [896, 576, 1, 32, 896, 896, 32, 32]
    - [2, 28.7878]
  - - [960, 576, 1, 32, 960, 960, 32, 32]
    - [3, 36.726]
  - - [1024, 576, 1, 32, 1024, 1024, 32, 32]
    - [3, 35.8489]
  - - [64, 640, 1, 32, 64, 64, 32, 32]
    - [1, 2.11717]
  - - [128, 640, 1, 32, 128, 128, 32, 32]
    - [3, 4.18337]
  - - [192, 640, 1, 32, 192, 192, 32, 32]
    - [3, 5.97793]
  - - [256, 640, 1, 32, 256, 256, 32, 32]
    - [1, 9.66744]
  - - [320, 640, 1, 32, 320, 320, 32, 32]
    - [3, 11.5274]
  - - [384, 640, 1, 32, 384, 384, 32, 32]
    - [1, 14.0799]
  - - [448, 640, 1, 32, 448, 448, 32, 32]
    - [3, 15.9136]
  - - [512, 640, 1, 32, 512, 512, 32, 32]
    - [2, 23.2059]
  - - [576, 640, 1, 32, 576, 576, 32, 32]
    - [3, 18.1275]
  - - [640, 640, 1, 32, 640, 640, 32, 32]
    - [3, 19.9563]
  - - [704, 640, 1, 32, 704, 704, 32, 32]
    - [2, 25.326]
  - - [768, 640, 1, 32, 768, 768, 32, 32]
    - [0, 27.8771]
  - - [832, 640, 1, 32, 832, 832, 32, 32]
    - [0, 29.7092]
  - - [896, 640, 1, 32, 896, 896, 32, 32]
    - [0, 39.7263]
  - - [960, 640, 1, 32, 960, 960, 32, 32]
    - [0, 42.4788]
  - - [1024, 640, 1, 32, 1024, 1024, 32, 32]
    - [0, 44.0353]
  - - [64, 704, 1, 32, 64, 64, 32, 32]
    - [0, 2.28905]
  - - [128, 704, 1, 32, 128, 128, 32, 32]
    - [2, 4.60027]
  - - [192, 704, 1, 32, 192, 192, 32, 32]
    - [1, 6.66217]
  - - [256, 704, 1, 32, 256, 256, 32, 32]
    - [0, 8.63821]
  - - [320, 704, 1, 32, 320, 320, 32, 32]
    - [0, 10.8724]
  - - [384, 704, 1, 32, 384, 384, 32, 32]
    - [3, 13.4775]
  - - [448, 704, 1, 32, 448, 448, 32, 32]
    - [3, 15.8012]
  - - [512, 704, 1, 32, 512, 512, 32, 32]
    - [0, 16.2156]
  - - [576, 704, 1, 32, 576, 576, 32, 32]
    - [1, 20.8512]
  - - [640, 704, 1, 32, 640, 640, 32, 32]
    - [2, 23.4963]
  - - [704, 704, 1, 32, 704, 704, 32, 32]
    - [1, 40.2293]
  - - [768, 704, 1, 32, 768, 768, 32, 32]
    - [2, 32.7461]
  - - [832, 704, 1, 32, 832, 832, 32, 32]
    - [3, 41.173]
  - - [896, 704, 1, 32, 896, 896, 32, 32]
    - [0, 35.3165]
  - - [960, 704, 1, 32, 960, 960, 32, 32]
    - [1, 42.9699]
  - - [1024, 704, 1, 32, 1024, 1024, 32, 32]
    - [2, 41.0669]
  - - [64, 768, 1, 32, 64, 64, 32, 32]
    - [2, 3.43253]
  - - [128, 768, 1, 32, 128, 128, 32, 32]
    - [0, 5.32382]
  - - [192, 768, 1, 32, 192, 192, 32, 32]
    - [1, 7.11532]
  - - [256, 768, 1, 32, 256, 256, 32, 32]
    - [3, 10.2045]
  - - [320, 768, 1, 32, 320, 320, 32, 32]
    - [3, 13.3594]
  - - [384, 768, 1, 32, 384, 384, 32, 32]
    - [0, 16.6931]
  - - [448, 768, 1, 32, 448, 448, 32, 32]
    - [1, 18.8232]
  - - [512, 768, 1, 32, 512, 512, 32, 32]
    - [1, 21.7617]
  - - [576, 768, 1, 32, 576, 576, 32, 32]
    - [2, 24.3271]
  - - [640, 768, 1, 32, 640, 640, 32, 32]
    - [2, 27.7336]
  - - [704, 768, 1, 32, 704, 704, 32, 32]
    - [2, 55.8434]
  - - [768, 768, 1, 32, 768, 768, 32, 32]
    - [1, 63.2261]
  - - [832, 768, 1, 32, 832, 832, 32, 32]
    - [0, 41.5621]
  - - [896, 768, 1, 32, 896, 896, 32, 32]
    - [1, 50.8162]
  - - [960, 768, 1, 32, 960, 960, 32, 32]
    - [1, 54.1231]
  - - [1024, 768, 1, 32, 1024, 1024, 32, 32]
    - [2, 55.0858]
  - - [64, 832, 1, 32, 64, 64, 32, 32]
    - [3, 2.83072]
  - - [128, 832, 1, 32, 128, 128, 32, 32]
    - [2, 4.74096]
  - - [192, 832, 1, 32, 192, 192, 32, 32]
    - [3, 13.1381]
  - - [256, 832, 1, 32, 256, 256, 32, 32]
    - [1, 14.0136]
  - - [320, 832, 1, 32, 320, 320, 32, 32]
    - [2, 15.8437]
  - - [384, 832, 1, 32, 384, 384, 32, 32]
    - [0, 19.8462]
  - - [448, 832, 1, 32, 448, 448, 32, 32]
    - [1, 25.6405]
  - - [512, 832, 1, 32, 512, 512, 32, 32]
    - [1, 36.8133]
  - - [576, 832, 1, 32, 576, 576, 32, 32]
    - [0, 42.0463]
  - - [640, 832, 1, 32, 640, 640, 32, 32]
    - [2, 31.2816]
  - - [704, 832, 1, 32, 704, 704, 32, 32]
    - [3, 41.26]
  - - [768, 832, 1, 32, 768, 768, 32, 32]
    - [0, 38.7693]
  - - [832, 832, 1, 32, 832, 832, 32, 32]
    - [0, 46.2269]
  - - [896, 832, 1, 32, 896, 896, 32, 32]
    - [3, 42.1057]
  - - [960, 832, 1, 32, 960, 960, 32, 32]
    - [3, 48.4671]
  - - [1024, 832, 1, 32, 1024, 1024, 32, 32]
    - [3, 48.8073]
  - - [64, 896, 1, 32, 64, 64, 32, 32]
    - [1, 3.15224]
  - - [128, 896, 1, 32, 128, 128, 32, 32]
    - [1, 6.26236]
  - - [192, 896, 1, 32, 192, 192, 32, 32]
    - [2, 9.42514]
  - - [256, 896, 1, 32, 256, 256, 32, 32]
    - [3, 12.7238]
  - - [320, 896, 1, 32, 320, 320, 32, 32]
    - [2, 15.8232]
  - - [384, 896, 1, 32, 384, 384, 32, 32]
    - [3, 19.5568]
  - - [448, 896, 1, 32, 448, 448, 32, 32]
    - [3, 29.7851]
  - - [512, 896, 1, 32, 512, 512, 32, 32]
    - [2, 26.0304]
  - - [576, 896, 1, 32, 576, 576, 32, 32]
    - [2, 34.1454]
  - - [640, 896, 1, 32, 640, 640, 32, 32]
    - [2, 35.3526]
  - - [704, 896, 1, 32, 704, 704, 32, 32]
    - [2, 36.8584]
  - - [768, 896, 1, 32, 768, 768, 32, 32]
    - [3, 38.6963]
  - - [832, 896, 1, 32, 832, 832, 32, 32]
    - [1, 45.7983]
  - - [896, 896, 1, 32, 896, 896, 32, 32]
    - [0, 47.0628]
  - - [960, 896, 1, 32, 960, 960, 32, 32]
    - [1, 40.9829]
  - - [1024, 896, 1, 32, 1024, 1024, 32, 32]
    - [2, 60.3015]
  - - [64, 960, 1, 32, 64, 64, 32, 32]
    - [2, 3.01898]
  - - [128, 960, 1, 32, 128, 128, 32, 32]
    - [1, 14.2605]
  - - [192, 960, 1, 32, 192, 192, 32, 32]
    - [2, 10.8076]
  - - [256, 960, 1, 32, 256, 256, 32, 32]
    - [2, 12.7989]
  - - [320, 960, 1, 32, 320, 320, 32, 32]
    - [1, 24.2115]
  - - [384, 960, 1, 32, 384, 384, 32, 32]
    - [1, 26.2055]
  - - [448, 960, 1, 32, 448, 448, 32, 32]
    - [1, 23.5449]
  - - [512, 960, 1, 32, 512, 512, 32, 32]
    - [2, 24.0687]
  - - [576, 960, 1, 32, 576, 576, 32, 32]
    - [3, 28.9023]
  - - [640, 960, 1, 32, 640, 640, 32, 32]
    - [0, 29.4652]
  - - [704, 960, 1, 32, 704, 704, 32, 32]
    - [0, 38.8649]
  - - [768, 960, 1, 32, 768, 768, 32, 32]
    - [0, 37.4801]
  - - [832, 960, 1, 32, 832, 832, 32, 32]
    - [0, 59.1531]
  - - [896, 960, 1, 32, 896, 896, 32, 32]
    - [2, 45.0553]
  - - [960, 960, 1, 32, 960, 960, 32, 32]
    - [2, 61.1548]
  - - [1024, 960, 1, 32, 1024, 1024, 32, 32]
    - [1, 52.635]
  - - [64, 1024, 1, 32, 64, 64, 32, 32]
    - [2, 3.3412]
  - - [128, 1024, 1, 32, 128, 128, 32, 32]
    - [3, 6.32249]
  - - [192, 1024, 1, 32, 192, 192, 32, 32]
    - [1, 8.63861]
  - - [256, 1024, 1, 32, 256, 256, 32, 32]
    - [3, 11.468]
  - - [320, 1024, 1, 32, 320, 320, 32, 32]
    - [2, 14.5816]
  - - [384, 1024, 1, 32, 384, 384, 32, 32]
    - [2, 21.0739]
  - - [448, 1024, 1, 32, 448, 448, 32, 32]
    - [1, 24.0122]
  - - [512, 1024, 1, 32, 512, 512, 32, 32]
    - [0, 26.0632]
  - - [576, 1024, 1, 32, 576, 576, 32, 32]
    - [3, 29.3911]
  - - [640, 1024, 1, 32, 640, 640, 32, 32]
    - [0, 33.2044]
  - - [704, 1024, 1, 32, 704, 704, 32, 32]
    - [2, 37.4024]
  - - [768, 1024, 1, 32, 768, 768, 32, 32]
    - [3, 44.6932]
  - - [832, 1024, 1, 32, 832, 832, 32, 32]
    - [0, 59.5056]
  - - [896, 1024, 1, 32, 896, 896, 32, 32]
    - [2, 48.6873]
  - - [960, 1024, 1, 32, 960, 960, 32, 32]
    - [3, 50.9443]
  - - [1024, 1024, 1, 32, 1024, 1024, 32, 32]
    - [0, 50.734]
- null
- null
- DeviceEfficiency
- GridBased
