library/src/amd_detail/rocblaslt/src/Tensile/Logic/asm_full/gfx1201/GridBased/gfx1201_Cijk_Alik_Bljk_HHS_BH_Bias_HAS_SAV_UserArgs.yaml
- {MinimumRequiredVersion: 4.33.0}
- gfx1201
- gfx1201
- [Device 73f0]
    SolutionIndex: 0
    SolutionNameMin: Cijk_Alik_Bljk_HHS_BH_Bias_HAS_SAV_UserArgs_MT32x32x32_MI16x16x1_SN_CLR1_GSU1_LBSPPA128_LBSPPB128_MIWT1_1_PGR1_PLR1_SS0_SU32_SUM0_SUS256_SVW8_TLDS1_WG32_4_1_WGM8
    SolutionIndex: 1
    SolutionNameMin: Cijk_Alik_Bljk_HHS_BH_Bias_HAS_SAV_UserArgs_MT32x32x32_MI16x16x1_SN_CLR0_GSU1_LBSPPA128_LBSPPB128_MIWT1_1_PGR1_PLR0_SS0_SU32_SUM0_SUS256_SVW8_TLDS1_WG32_4_1_WGM8
    SolutionIndex: 2
    SolutionNameMin: Cijk_Alik_Bljk_HHS_BH_Bias_HAS_SAV_UserArgs_MT32x32x32_MI16x16x1_SN_CLR0_GSU1_LBSPPA128_LBSPPB128_MIWT1_1_PGR2_PLR0_SS0_SU32_SUM0_SUS256_SVW8_TLDS1_WG32_4_1_WGM8
    SolutionIndex: 3
    SolutionNameMin: Cijk_Alik_Bljk_HHS_BH_Bias_HAS_SAV_UserArgs_MT64x32x32_MI16x16x1_SN_CLR1_GSU1_LBSPPA128_LBSPPB128_MIWT2_1_PGR1_PLR1_SS0_SU32_SUM0_SUS256_SVW8_TLDS1_WG32_4_1_WGM8
    SolutionIndex: 4
    SolutionNameMin: Cijk_Alik_Bljk_HHS_BH_Bias_HAS_SAV_UserArgs_MT64x32x32_MI16x16x1_SN_CLR1_GSU1_LBSPPA128_LBSPPB128_MIWT2_1_PGR2_PLR1_SS0_SU32_SUM0_SUS256_SVW8_TLDS1_WG32_4_1_WGM8
    SolutionIndex: 5
    SolutionNameMin: Cijk_Alik_Bljk_HHS_BH_Bias_HAS_SAV_UserArgs_MT64x32x32_MI16x16x1_SN_CLR0_GSU1_LBSPPA128_LBSPPB128_MIWT2_1_PGR1_PLR0_SS0_SU32_SUM0_SUS256_SVW8_TLDS1_WG32_4_1_WGM8
    SolutionIndex: 6
    SolutionNameMin: Cijk_Alik_Bljk_HHS_BH_Bias_HAS_SAV_UserArgs_MT64x32x32_MI16x16x1_SN_CLR0_GSU1_LBSPPA128_LBSPPB128_MIWT2_1_PGR2_PLR0_SS0_SU32_SUM0_SUS256_SVW8_TLDS1_WG32_4_1_WGM8
    SolutionIndex: 7
    SolutionNameMin: Cijk_Alik_Bljk_HHS_BH_Bias_HAS_SAV_UserArgs_MT32x64x32_MI16x16x1_SN_CLR1_GSU1_LBSPPA128_LBSPPB128_MIWT2_1_PGR1_PLR1_SS0_SU32_SUM0_SUS256_SVW8_TLDS1_WG16_8_1_WGM8
    SolutionIndex: 8
    SolutionNameMin: Cijk_Alik_Bljk_HHS_BH_Bias_HAS_SAV_UserArgs_MT32x64x32_MI16x16x1_SN_CLR1_GSU1_LBSPPA128_LBSPPB128_MIWT2_1_PGR2_PLR1_SS0_SU32_SUM0_SUS256_SVW8_TLDS1_WG16_8_1_WGM8
    SolutionIndex: 9
    SolutionNameMin: Cijk_Alik_Bljk_HHS_BH_Bias_HAS_SAV_UserArgs_MT32x64x32_MI16x16x1_SN_CLR0_GSU1_LBSPPA128_LBSPPB128_MIWT2_1_PGR1_PLR0_SS0_SU32_SUM0_SUS256_SVW8_TLDS1_WG16_8_1_WGM8
    SolutionIndex: 10
    SolutionNameMin: Cijk_Alik_Bljk_HHS_BH_Bias_HAS_SAV_UserArgs_MT32x32x64_MI16x16x1_SN_CLR1_GSU1_LBSPPA128_LBSPPB128_MIWT1_1_PGR2_PLR1_SS0_SU32_SUM0_SUS256_SVW8_TLDS1_WG32_4_1_WGM8
    SolutionIndex: 11
    SolutionNameMin: Cijk_Alik_Bljk_HHS_BH_Bias_HAS_SAV_UserArgs_MT32x32x64_MI16x16x1_SN_CLR1_GSU1_LBSPPA128_LBSPPB128_MIWT1_1_PGR1_PLR3_SS0_SU32_SUM0_SUS256_SVW8_TLDS1_WG32_4_1_WGM8
    SolutionIndex: 12
    SolutionNameMin: Cijk_Alik_Bljk_HHS_BH_Bias_HAS_SAV_UserArgs_MT32x32x64_MI16x16x1_SN_CLR0_GSU1_LBSPPA128_LBSPPB128_MIWT1_1_PGR1_PLR0_SS0_SU32_SUM0_SUS256_SVW8_TLDS1_WG32_4_1_WGM8
    SolutionIndex: 13
    SolutionNameMin: Cijk_Alik_Bljk_HHS_BH_Bias_HAS_SAV_UserArgs_MT64x16x32_MI16x16x1_SN_CLR0_GSU1_LBSPPA128_LBSPPB128_MIWT1_1_PGR1_PLR0_SS1_SU32_SUM0_SUS256_SVW1_TLDS1_WG64_2_1_WGM8
    SolutionIndex: 14
    SolutionNameMin: Cijk_Alik_Bljk_HHS_BH_Bias_HAS_SAV_UserArgs_MT32x32x32_MI16x16x1_SN_CLR1_GSU1_LBSPPA128_LBSPPB128_MIWT1_1_PGR1_PLR1_SS1_SU32_SUM0_SUS256_SVW1_TLDS1_WG32_4_1_WGM8
    SolutionIndex: 15
    SolutionNameMin: Cijk_Alik_Bljk_HHS_BH_Bias_HAS_SAV_UserArgs_MT32x32x32_MI16x16x1_SN_CLR1_GSU1_LBSPPA128_LBSPPB128_MIWT1_1_PGR2_PLR1_SS1_SU32_SUM0_SUS256_SVW1_TLDS1_WG32_4_1_WGM8
    SolutionIndex: 16
    SolutionNameMin: Cijk_Alik_Bljk_HHS_BH_Bias_HAS_SAV_UserArgs_MT32x32x32_MI16x16x1_SN_CLR0_GSU1_LBSPPA128_LBSPPB128_MIWT1_1_PGR1_PLR0_SS1_SU32_SUM0_SUS256_SVW1_TLDS1_WG32_4_1_WGM8
    SolutionIndex: 17
    SolutionNameMin: Cijk_Alik_Bljk_HHS_BH_Bias_HAS_SAV_UserArgs_MT32x32x32_MI16x16x1_SN_CLR0_GSU1_LBSPPA128_LBSPPB128_MIWT1_1_PGR2_PLR0_SS1_SU32_SUM0_SUS256_SVW1_TLDS1_WG32_4_1_WGM8
    SolutionIndex: 18
    SolutionNameMin: Cijk_Alik_Bljk_HHS_BH_Bias_HAS_SAV_UserArgs_MT64x32x32_MI16x16x1_SN_CLR1_GSU1_LBSPPA128_LBSPPB128_MIWT2_1_PGR1_PLR1_SS1_SU32_SUM0_SUS256_SVW1_TLDS1_WG32_4_1_WGM8
    SolutionIndex: 19
    SolutionNameMin: Cijk_Alik_Bljk_HHS_BH_Bias_HAS_SAV_UserArgs_MT64x32x32_MI16x16x1_SN_CLR0_GSU1_LBSPPA128_LBSPPB128_MIWT2_1_PGR1_PLR0_SS1_SU32_SUM0_SUS256_SVW1_TLDS1_WG32_4_1_WGM8
    SolutionIndex: 20
    SolutionNameMin: Cijk_Alik_Bljk_HHS_BH_Bias_HAS_SAV_UserArgs_MT64x32x32_MI16x16x1_SN_CLR0_GSU1_LBSPPA128_LBSPPB128_MIWT2_1_PGR2_PLR0_SS1_SU32_SUM0_SUS256_SVW1_TLDS1_WG32_4_1_WGM8
    SolutionIndex: 21
    SolutionNameMin: Cijk_Alik_Bljk_HHS_BH_Bias_HAS_SAV_UserArgs_MT16x64x32_MI16x16x1_SN_CLR1_GSU1_LBSPPA128_LBSPPB128_MIWT1_1_PGR1_PLR1_SS1_SU32_SUM0_SUS256_SVW1_TLDS1_WG16_8_1_WGM8
    SolutionIndex: 22
    SolutionNameMin: Cijk_Alik_Bljk_HHS_BH_Bias_HAS_SAV_UserArgs_MT16x64x32_MI16x16x1_SN_CLR0_GSU1_LBSPPA128_LBSPPB128_MIWT1_1_PGR1_PLR0_SS1_SU32_SUM0_SUS256_SVW1_TLDS1_WG16_8_1_WGM8
    SolutionIndex: 23
    SolutionNameMin: Cijk_Alik_Bljk_HHS_BH_Bias_HAS_SAV_UserArgs_MT32x64x32_MI16x16x1_SN_CLR1_GSU1_LBSPPA128_LBSPPB128_MIWT2_1_PGR1_PLR1_SS1_SU32_SUM0_SUS256_SVW1_TLDS1_WG16_8_1_WGM8
    SolutionIndex: 24
    SolutionNameMin: Cijk_Alik_Bljk_HHS_BH_Bias_HAS_SAV_UserArgs_MT32x64x32_MI16x16x1_SN_CLR1_GSU1_LBSPPA128_LBSPPB128_MIWT2_1_PGR2_PLR1_SS1_SU32_SUM0_SUS256_SVW1_TLDS1_WG16_8_1_WGM8
    SolutionIndex: 25
    SolutionNameMin: Cijk_Alik_Bljk_HHS_BH_Bias_HAS_SAV_UserArgs_MT32x64x32_MI16x16x1_SN_CLR0_GSU1_LBSPPA128_LBSPPB128_MIWT2_1_PGR1_PLR0_SS1_SU32_SUM0_SUS256_SVW1_TLDS1_WG16_8_1_WGM8
    SolutionIndex: 26
    SolutionNameMin: Cijk_Alik_Bljk_HHS_BH_Bias_HAS_SAV_UserArgs_MT32x64x32_MI16x16x1_SN_CLR0_GSU1_LBSPPA128_LBSPPB128_MIWT2_1_PGR2_PLR0_SS1_SU32_SUM0_SUS256_SVW1_TLDS1_WG16_8_1_WGM8
    SolutionIndex: 27
    SolutionNameMin: Cijk_Alik_Bljk_HHS_BH_Bias_HAS_SAV_UserArgs_MT32x32x64_MI16x16x1_SN_CLR1_GSU1_LBSPPA128_LBSPPB128_MIWT1_1_PGR1_PLR3_SS1_SU32_SUM0_SUS256_SVW1_TLDS1_WG32_4_1_WGM8
    SolutionIndex: 28
    SolutionNameMin: Cijk_Alik_Bljk_HHS_BH_Bias_HAS_SAV_UserArgs_MT32x32x64_MI16x16x1_SN_CLR0_GSU1_LBSPPA128_LBSPPB128_MIWT1_1_PGR1_PLR0_SS1_SU32_SUM0_SUS256_SVW1_TLDS1_WG32_4_1_WGM8
    SolutionIndex: 29
    SolutionNameMin: Cijk_Alik_Bljk_HHS_BH_Bias_HAS_SAV_UserArgs_MT64x32x64_MI16x16x1_SN_CLR1_GSU1_LBSPPA128_LBSPPB128_MIWT2_1_PGR1_PLR1_SS1_SU32_SUM0_SUS256_SVW1_TLDS1_WG32_4_1_WGM8
    SolutionIndex: 30
    SolutionNameMin: Cijk_Alik_Bljk_HHS_BH_Bias_HAS_SAV_UserArgs_MT64x32x64_MI16x16x1_SN_CLR1_GSU1_LBSPPA128_LBSPPB128_MIWT2_1_PGR1_PLR3_SS1_SU32_SUM0_SUS256_SVW1_TLDS1_WG32_4_1_WGM8
    SolutionIndex: 31
    SolutionNameMin: Cijk_Alik_Bljk_HHS_BH_Bias_HAS_SAV_UserArgs_MT32x64x64_MI16x16x1_SN_CLR1_GSU1_LBSPPA128_LBSPPB128_MIWT2_1_PGR1_PLR3_SS1_SU32_SUM0_SUS256_SVW1_TLDS1_WG16_8_1_WGM8
    SolutionIndex: 32
    SolutionNameMin: Cijk_Alik_Bljk_HHS_BH_Bias_HAS_SAV_UserArgs_MT32x64x64_MI16x16x1_SN_CLR0_GSU1_LBSPPA128_LBSPPB128_MIWT2_1_PGR1_PLR0_SS1_SU32_SUM0_SUS256_SVW1_TLDS1_WG16_8_1_WGM8
- - - [512, 512, 1, 64, 512, 512, 64, 64]
    - [26, 1116.36]
  - - [1024, 512, 1, 64, 1024, 1024, 64, 64]
    - [24, 2109.68]
  - - [1536, 512, 1, 64, 1536, 1536, 64, 64]
    - [6, 2920.74]
  - - [2048, 512, 1, 64, 2048, 2048, 64, 64]
    - [24, 3812.35]
  - - [2560, 512, 1, 64, 2560, 2560, 64, 64]
    - [9, 4280.56]
  - - [3072, 512, 1, 64, 3072, 3072, 64, 64]
    - [7, 4977.66]
  - - [512, 1024, 1, 64, 512, 512, 64, 64]
    - [20, 2015.7]
  - - [1024, 1024, 1, 64, 1024, 1024, 64, 64]
    - [5, 3695.63]
  - - [1536, 1024, 1, 64, 1536, 1536, 64, 64]
    - [6, 5176.29]
  - - [2048, 1024, 1, 64, 2048, 2048, 64, 64]
    - [26, 5979.18]
  - - [2560, 1024, 1, 64, 2560, 2560, 64, 64]
    - [7, 7139.54]
  - - [3072, 1024, 1, 64, 3072, 3072, 64, 64]
    - [7, 8016.99]
  - - [512, 1536, 1, 64, 512, 512, 64, 64]
    - [4, 2992.1]
  - - [1024, 1536, 1, 64, 1024, 1024, 64, 64]
    - [8, 4945.87]
  - - [1536, 1536, 1, 64, 1536, 1536, 64, 64]
    - [23, 6493.29]
  - - [2048, 1536, 1, 64, 2048, 2048, 64, 64]
    - [3, 8039.4]
  - - [2560, 1536, 1, 64, 2560, 2560, 64, 64]
    - [3, 9563.3]
  - - [3072, 1536, 1, 64, 3072, 3072, 64, 64]
    - [7, 10179.8]
  - - [512, 2048, 1, 64, 512, 512, 64, 64]
    - [9, 3660.25]
  - - [1024, 2048, 1, 64, 1024, 1024, 64, 64]
    - [3, 6320.59]
  - - [1536, 2048, 1, 64, 1536, 1536, 64, 64]
    - [3, 8217.08]
  - - [2048, 2048, 1, 64, 2048, 2048, 64, 64]
    - [3, 9524.73]
  - - [2560, 2048, 1, 64, 2560, 2560, 64, 64]
    - [3, 11184.3]
  - - [3072, 2048, 1, 64, 3072, 3072, 64, 64]
    - [3, 11892.1]
  - - [512, 2560, 1, 64, 512, 512, 64, 64]
    - [4, 4524.6]
  - - [1024, 2560, 1, 64, 1024, 1024, 64, 64]
    - [3, 7363.92]
  - - [1536, 2560, 1, 64, 1536, 1536, 64, 64]
    - [7, 9451.78]
  - - [2048, 2560, 1, 64, 2048, 2048, 64, 64]
    - [3, 11067.7]
  - - [2560, 2560, 1, 64, 2560, 2560, 64, 64]
    - [4, 12345.4]
  - - [3072, 2560, 1, 64, 3072, 3072, 64, 64]
    - [3, 13638.3]
  - - [512, 3072, 1, 64, 512, 512, 64, 64]
    - [5, 5016.11]
  - - [1024, 3072, 1, 64, 1024, 1024, 64, 64]
    - [6, 7863.24]
  - - [1536, 3072, 1, 64, 1536, 1536, 64, 64]
    - [8, 10419.2]
  - - [2048, 3072, 1, 64, 2048, 2048, 64, 64]
    - [7, 12251.0]
  - - [2560, 3072, 1, 64, 2560, 2560, 64, 64]
    - [8, 13673.5]
  - - [3072, 3072, 1, 64, 3072, 3072, 64, 64]
    - [3, 14721.3]
  - - [512, 512, 1, 256, 512, 512, 256, 256]
    - [23, 3824.3]
  - - [1024, 512, 1, 256, 1024, 1024, 256, 256]
    - [21, 6310.04]
  - - [1536, 512, 1, 256, 1536, 1536, 256, 256]
    - [3, 9379.08]
  - - [2048, 512, 1, 256, 2048, 2048, 256, 256]
    - [7, 11175.5]
  - - [2560, 512, 1, 256, 2560, 2560, 256, 256]
    - [3, 12621.6]
  - - [3072, 512, 1, 256, 3072, 3072, 256, 256]
    - [7, 14480.3]
  - - [512, 1024, 1, 256, 512, 512, 256, 256]
    - [7, 7320.5]
  - - [1024, 1024, 1, 256, 1024, 1024, 256, 256]
    - [7, 11689.9]
  - - [1536, 1024, 1, 256, 1536, 1536, 256, 256]
    - [32, 11671.1]
  - - [2048, 1024, 1, 256, 2048, 2048, 256, 256]
    - [7, 16930.9]
  - - [2560, 1024, 1, 256, 2560, 2560, 256, 256]
    - [3, 18384.2]
  - - [3072, 1024, 1, 256, 3072, 3072, 256, 256]
    - [3, 20444.7]
  - - [512, 1536, 1, 256, 512, 512, 256, 256]
    - [3, 9420.77]
  - - [1024, 1536, 1, 256, 1024, 1024, 256, 256]
    - [7, 14561.4]
  - - [1536, 1536, 1, 256, 1536, 1536, 256, 256]
    - [7, 17782.7]
  - - [2048, 1536, 1, 256, 2048, 2048, 256, 256]
    - [7, 20398.1]
  - - [2560, 1536, 1, 256, 2560, 2560, 256, 256]
    - [7, 22130.6]
  - - [3072, 1536, 1, 256, 3072, 3072, 256, 256]
    - [7, 23282.6]
  - - [512, 2048, 1, 256, 512, 512, 256, 256]
    - [23, 11511.4]
  - - [1024, 2048, 1, 256, 1024, 1024, 256, 256]
    - [7, 17019.7]
  - - [1536, 2048, 1, 256, 1536, 1536, 256, 256]
    - [7, 20531.0]
  - - [2048, 2048, 1, 256, 2048, 2048, 256, 256]
    - [7, 22318.2]
  - - [2560, 2048, 1, 256, 2560, 2560, 256, 256]
    - [3, 24464.2]
  - - [3072, 2048, 1, 256, 3072, 3072, 256, 256]
    - [7, 26127.0]
  - - [512, 2560, 1, 256, 512, 512, 256, 256]
    - [23, 12787.8]
  - - [1024, 2560, 1, 256, 1024, 1024, 256, 256]
    - [23, 17516.4]
  - - [1536, 2560, 1, 256, 1536, 1536, 256, 256]
    - [7, 22099.0]
  - - [2048, 2560, 1, 256, 2048, 2048, 256, 256]
    - [3, 24493.2]
  - - [2560, 2560, 1, 256, 2560, 2560, 256, 256]
    - [23, 26039.0]
  - - [3072, 2560, 1, 256, 3072, 3072, 256, 256]
    - [7, 27133.3]
  - - [512, 3072, 1, 256, 512, 512, 256, 256]
    - [31, 11673.0]
  - - [1024, 3072, 1, 256, 1024, 1024, 256, 256]
    - [7, 20336.3]
  - - [1536, 3072, 1, 256, 1536, 1536, 256, 256]
    - [7, 23677.8]
  - - [2048, 3072, 1, 256, 2048, 2048, 256, 256]
    - [23, 25872.3]
  - - [2560, 3072, 1, 256, 2560, 2560, 256, 256]
    - [3, 27085.7]
  - - [3072, 3072, 1, 256, 3072, 3072, 256, 256]
    - [3, 28148.9]
  - - [512, 512, 1, 512, 512, 512, 512, 512]
    - [29, 6901.9]
  - - [1024, 512, 1, 512, 1024, 1024, 512, 512]
    - [22, 10023.5]
  - - [1536, 512, 1, 512, 1536, 1536, 512, 512]
    - [3, 14241.6]
  - - [2048, 512, 1, 512, 2048, 2048, 512, 512]
    - [7, 17210.7]
  - - [2560, 512, 1, 512, 2560, 2560, 512, 512]
    - [7, 18333.8]
  - - [3072, 512, 1, 512, 3072, 3072, 512, 512]
    - [18, 20924.1]
  - - [512, 1024, 1, 512, 512, 512, 512, 512]
    - [18, 11163.9]
  - - [1024, 1024, 1, 512, 1024, 1024, 512, 512]
    - [3, 17257.7]
  - - [1536, 1024, 1, 512, 1536, 1536, 512, 512]
    - [3, 21191.4]
  - - [2048, 1024, 1, 512, 2048, 2048, 512, 512]
    - [3, 23518.1]
  - - [2560, 1024, 1, 512, 2560, 2560, 512, 512]
    - [7, 24712.4]
  - - [3072, 1024, 1, 512, 3072, 3072, 512, 512]
    - [3, 26455.7]
  - - [512, 1536, 1, 512, 512, 512, 512, 512]
    - [7, 14173.7]
  - - [1024, 1536, 1, 512, 1024, 1024, 512, 512]
    - [3, 21272.9]
  - - [1536, 1536, 1, 512, 1536, 1536, 512, 512]
    - [7, 23413.7]
  - - [2048, 1536, 1, 512, 2048, 2048, 512, 512]
    - [7, 26629.0]
  - - [2560, 1536, 1, 512, 2560, 2560, 512, 512]
    - [3, 27606.6]
  - - [3072, 1536, 1, 512, 3072, 3072, 512, 512]
    - [3, 29315.8]
  - - [512, 2048, 1, 512, 512, 512, 512, 512]
    - [3, 17921.7]
  - - [1024, 2048, 1, 512, 1024, 1024, 512, 512]
    - [7, 23634.6]
  - - [1536, 2048, 1, 512, 1536, 1536, 512, 512]
    - [3, 26315.1]
  - - [2048, 2048, 1, 512, 2048, 2048, 512, 512]
    - [3, 28469.1]
  - - [2560, 2048, 1, 512, 2560, 2560, 512, 512]
    - [18, 30072.4]
  - - [3072, 2048, 1, 512, 3072, 3072, 512, 512]
    - [23, 31016.6]
  - - [512, 2560, 1, 512, 512, 512, 512, 512]
    - [3, 18699.8]
  - - [1024, 2560, 1, 512, 1024, 1024, 512, 512]
    - [3, 24838.3]
  - - [1536, 2560, 1, 512, 1536, 1536, 512, 512]
    - [3, 27568.4]
  - - [2048, 2560, 1, 512, 2048, 2048, 512, 512]
    - [3, 30484.8]
  - - [2560, 2560, 1, 512, 2560, 2560, 512, 512]
    - [7, 31541.9]
  - - [3072, 2560, 1, 512, 3072, 3072, 512, 512]
    - [23, 31976.4]
  - - [512, 3072, 1, 512, 512, 512, 512, 512]
    - [25, 20206.2]
  - - [1024, 3072, 1, 512, 1024, 1024, 512, 512]
    - [3, 26139.5]
  - - [1536, 3072, 1, 512, 1536, 1536, 512, 512]
    - [7, 29248.4]
  - - [2048, 3072, 1, 512, 2048, 2048, 512, 512]
    - [3, 30635.2]
  - - [2560, 3072, 1, 512, 2560, 2560, 512, 512]
    - [7, 31928.0]
  - - [3072, 3072, 1, 512, 3072, 3072, 512, 512]
    - [3, 32401.2]
  - - [512, 512, 1, 1024, 512, 512, 1024, 1024]
    - [16, 11191.8]
  - - [1024, 512, 1, 1024, 1024, 1024, 1024, 1024]
    - [30, 15094.6]
  - - [1536, 512, 1, 1024, 1536, 1536, 1024, 1024]
    - [7, 20115.1]
  - - [2048, 512, 1, 1024, 2048, 2048, 1024, 1024]
    - [1, 18401.7]
  - - [2560, 512, 1, 1024, 2560, 2560, 1024, 1024]
    - [3, 24437.0]
  - - [3072, 512, 1, 1024, 3072, 3072, 1024, 1024]
    - [3, 27036.4]
  - - [512, 1024, 1, 1024, 512, 512, 1024, 1024]
    - [23, 18759.2]
  - - [1024, 1024, 1, 1024, 1024, 1024, 1024, 1024]
    - [7, 23930.3]
  - - [1536, 1024, 1, 1024, 1536, 1536, 1024, 1024]
    - [3, 27311.9]
  - - [2048, 1024, 1, 1024, 2048, 2048, 1024, 1024]
    - [3, 29234.0]
  - - [2560, 1024, 1, 1024, 2560, 2560, 1024, 1024]
    - [18, 30887.0]
  - - [3072, 1024, 1, 1024, 3072, 3072, 1024, 1024]
    - [3, 31271.5]
  - - [512, 1536, 1, 1024, 512, 512, 1024, 1024]
    - [3, 15196.0]
  - - [1024, 1536, 1, 1024, 1024, 1024, 1024, 1024]
    - [7, 27468.2]
  - - [1536, 1536, 1, 1024, 1536, 1536, 1024, 1024]
    - [9, 28538.7]
  - - [2048, 1536, 1, 1024, 2048, 2048, 1024, 1024]
    - [3, 31260.8]
  - - [2560, 1536, 1, 1024, 2560, 2560, 1024, 1024]
    - [18, 31617.8]
  - - [3072, 1536, 1, 1024, 3072, 3072, 1024, 1024]
    - [3, 33265.9]
  - - [512, 2048, 1, 1024, 512, 512, 1024, 1024]
    - [7, 24437.9]
  - - [1024, 2048, 1, 1024, 1024, 1024, 1024, 1024]
    - [23, 29042.0]
  - - [1536, 2048, 1, 1024, 1536, 1536, 1024, 1024]
    - [3, 31309.3]
  - - [2048, 2048, 1, 1024, 2048, 2048, 1024, 1024]
    - [3, 32573.8]
  - - [2560, 2048, 1, 1024, 2560, 2560, 1024, 1024]
    - [7, 33352.6]
  - - [3072, 2048, 1, 1024, 3072, 3072, 1024, 1024]
    - [18, 33978.9]
  - - [512, 2560, 1, 1024, 512, 512, 1024, 1024]
    - [3, 24450.6]
  - - [1024, 2560, 1, 1024, 1024, 1024, 1024, 1024]
    - [7, 30538.4]
  - - [1536, 2560, 1, 1024, 1536, 1536, 1024, 1024]
    - [18, 31676.3]
  - - [2048, 2560, 1, 1024, 2048, 2048, 1024, 1024]
    - [18, 33474.4]
  - - [2560, 2560, 1, 1024, 2560, 2560, 1024, 1024]
    - [25, 34230.7]
  - - [3072, 2560, 1, 1024, 3072, 3072, 1024, 1024]
    - [18, 34591.6]
  - - [512, 3072, 1, 1024, 512, 512, 1024, 1024]
    - [7, 27123.1]
  - - [1024, 3072, 1, 1024, 1024, 1024, 1024, 1024]
    - [25, 30137.2]
  - - [1536, 3072, 1, 1024, 1536, 1536, 1024, 1024]
    - [18, 33263.7]
  - - [2048, 3072, 1, 1024, 2048, 2048, 1024, 1024]
    - [3, 33801.1]
  - - [2560, 3072, 1, 1024, 2560, 2560, 1024, 1024]
    - [3, 35197.0]
  - - [3072, 3072, 1, 1024, 3072, 3072, 1024, 1024]
    - [3, 35739.8]
  - - [512, 512, 1, 2048, 512, 512, 2048, 2048]
    - [0, 16070.1]
  - - [1024, 512, 1, 2048, 1024, 1024, 2048, 2048]
    - [7, 24839.9]
  - - [1536, 512, 1, 2048, 1536, 1536, 2048, 2048]
    - [7, 24644.6]
  - - [2048, 512, 1, 2048, 2048, 2048, 2048, 2048]
    - [23, 29724.8]
  - - [2560, 512, 1, 2048, 2560, 2560, 2048, 2048]
    - [7, 28576.3]
  - - [3072, 512, 1, 2048, 3072, 3072, 2048, 2048]
    - [7, 31765.6]
  - - [512, 1024, 1, 2048, 512, 512, 2048, 2048]
    - [30, 19501.7]
  - - [1024, 1024, 1, 2048, 1024, 1024, 2048, 2048]
    - [3, 29849.0]
  - - [1536, 1024, 1, 2048, 1536, 1536, 2048, 2048]
    - [7, 31696.9]
  - - [2048, 1024, 1, 2048, 2048, 2048, 2048, 2048]
    - [7, 33441.7]
  - - [2560, 1024, 1, 2048, 2560, 2560, 2048, 2048]
    - [18, 33752.7]
  - - [3072, 1024, 1, 2048, 3072, 3072, 2048, 2048]
    - [7, 34739.8]
  - - [512, 1536, 1, 2048, 512, 512, 2048, 2048]
    - [7, 25223.0]
  - - [1024, 1536, 1, 2048, 1024, 1024, 2048, 2048]
    - [3, 32174.0]
  - - [1536, 1536, 1, 2048, 1536, 1536, 2048, 2048]
    - [23, 31646.4]
  - - [2048, 1536, 1, 2048, 2048, 2048, 2048, 2048]
    - [3, 34694.8]
  - - [2560, 1536, 1, 2048, 2560, 2560, 2048, 2048]
    - [3, 34553.2]
  - - [3072, 1536, 1, 2048, 3072, 3072, 2048, 2048]
    - [23, 35759.2]
  - - [512, 2048, 1, 2048, 512, 512, 2048, 2048]
    - [3, 29652.8]
  - - [1024, 2048, 1, 2048, 1024, 1024, 2048, 2048]
    - [7, 33297.5]
  - - [1536, 2048, 1, 2048, 1536, 1536, 2048, 2048]
    - [7, 34608.8]
  - - [2048, 2048, 1, 2048, 2048, 2048, 2048, 2048]
    - [23, 35139.7]
  - - [2560, 2048, 1, 2048, 2560, 2560, 2048, 2048]
    - [23, 35341.3]
  - - [3072, 2048, 1, 2048, 3072, 3072, 2048, 2048]
    - [23, 35956.2]
  - - [512, 2560, 1, 2048, 512, 512, 2048, 2048]
    - [3, 28258.1]
  - - [1024, 2560, 1, 2048, 1024, 1024, 2048, 2048]
    - [7, 33681.7]
  - - [1536, 2560, 1, 2048, 1536, 1536, 2048, 2048]
    - [3, 34214.0]
  - - [2048, 2560, 1, 2048, 2048, 2048, 2048, 2048]
    - [3, 35566.9]
  - - [2560, 2560, 1, 2048, 2560, 2560, 2048, 2048]
    - [3, 34975.4]
  - - [3072, 2560, 1, 2048, 3072, 3072, 2048, 2048]
    - [7, 36457.3]
  - - [512, 3072, 1, 2048, 512, 512, 2048, 2048]
    - [23, 32028.3]
  - - [1024, 3072, 1, 2048, 1024, 1024, 2048, 2048]
    - [3, 35102.8]
  - - [1536, 3072, 1, 2048, 1536, 1536, 2048, 2048]
    - [23, 35622.4]
  - - [2048, 3072, 1, 2048, 2048, 2048, 2048, 2048]
    - [23, 36506.3]
  - - [2560, 3072, 1, 2048, 2560, 2560, 2048, 2048]
    - [23, 36578.4]
  - - [3072, 3072, 1, 2048, 3072, 3072, 2048, 2048]
    - [7, 36227.1]
  - - [512, 512, 1, 3072, 512, 512, 3072, 3072]
    - [16, 19097.1]
  - - [1024, 512, 1, 3072, 1024, 1024, 3072, 3072]
    - [7, 22485.2]
  - - [1536, 512, 1, 3072, 1536, 1536, 3072, 3072]
    - [18, 27063.8]
  - - [2048, 512, 1, 3072, 2048, 2048, 3072, 3072]
    - [23, 31945.5]
  - - [2560, 512, 1, 3072, 2560, 2560, 3072, 3072]
    - [25, 30201.7]
  - - [3072, 512, 1, 3072, 3072, 3072, 3072, 3072]
    - [7, 33670.1]
  - - [512, 1024, 1, 3072, 512, 512, 3072, 3072]
    - [23, 27764.6]
  - - [1024, 1024, 1, 3072, 1024, 1024, 3072, 3072]
    - [18, 31934.4]
  - - [1536, 1024, 1, 3072, 1536, 1536, 3072, 3072]
    - [18, 33879.6]
  - - [2048, 1024, 1, 3072, 2048, 2048, 3072, 3072]
    - [7, 34652.8]
  - - [2560, 1024, 1, 3072, 2560, 2560, 3072, 3072]
    - [7, 35678.7]
  - - [3072, 1024, 1, 3072, 3072, 3072, 3072, 3072]
    - [7, 36476.6]
  - - [512, 1536, 1, 3072, 512, 512, 3072, 3072]
    - [19, 26411.6]
  - - [1024, 1536, 1, 3072, 1024, 1024, 3072, 3072]
    - [18, 33941.6]
  - - [1536, 1536, 1, 3072, 1536, 1536, 3072, 3072]
    - [9, 33518.4]
  - - [2048, 1536, 1, 3072, 2048, 2048, 3072, 3072]
    - [7, 35550.4]
  - - [2560, 1536, 1, 3072, 2560, 2560, 3072, 3072]
    - [19, 35037.3]
  - - [3072, 1536, 1, 3072, 3072, 3072, 3072, 3072]
    - [7, 36761.4]
  - - [512, 2048, 1, 3072, 512, 512, 3072, 3072]
    - [23, 32025.2]
  - - [1024, 2048, 1, 3072, 1024, 1024, 3072, 3072]
    - [23, 34942.8]
  - - [1536, 2048, 1, 3072, 1536, 1536, 3072, 3072]
    - [7, 36511.0]
  - - [2048, 2048, 1, 3072, 2048, 2048, 3072, 3072]
    - [7, 36512.1]
  - - [2560, 2048, 1, 3072, 2560, 2560, 3072, 3072]
    - [3, 36582.2]
  - - [3072, 2048, 1, 3072, 3072, 3072, 3072, 3072]
    - [3, 36507.9]
  - - [512, 2560, 1, 3072, 512, 512, 3072, 3072]
    - [9, 30497.2]
  - - [1024, 2560, 1, 3072, 1024, 1024, 3072, 3072]
    - [23, 35525.0]
  - - [1536, 2560, 1, 3072, 1536, 1536, 3072, 3072]
    - [9, 35295.7]
  - - [2048, 2560, 1, 3072, 2048, 2048, 3072, 3072]
    - [23, 36415.3]
  - - [2560, 2560, 1, 3072, 2560, 2560, 3072, 3072]
    - [3, 36079.3]
  - - [3072, 2560, 1, 3072, 3072, 3072, 3072, 3072]
    - [7, 36791.5]
  - - [512, 3072, 1, 3072, 512, 512, 3072, 3072]
    - [23, 33847.3]
  - - [1024, 3072, 1, 3072, 1024, 1024, 3072, 3072]
    - [3, 35738.6]
  - - [1536, 3072, 1, 3072, 1536, 1536, 3072, 3072]
    - [23, 36281.0]
  - - [2048, 3072, 1, 3072, 2048, 2048, 3072, 3072]
    - [3, 36700.7]
  - - [2560, 3072, 1, 3072, 2560, 2560, 3072, 3072]
    - [3, 36778.3]
  - - [3072, 3072, 1, 3072, 3072, 3072, 3072, 3072]
    - [3, 37457.0]
  - - [1, 1, 1, 1, 1, 1, 1, 1]
    - [17, 6.65624e-05]
  - - [1, 1, 1, 64, 1, 1, 64, 64]
    - [21, 0.00424868]
  - - [1, 64, 1, 1, 1, 1, 1, 1]
    - [13, 0.00424305]
  - - [64, 1, 1, 1, 64, 64, 1, 1]
    - [15, 0.00427565]
  - - [64, 64, 1, 1, 64, 64, 1, 1]
    - [2, 0.269944]
  - - [64, 1, 1, 64, 64, 64, 64, 64]
    - [10, 0.250505]
  - - [1, 64, 1, 64, 1, 1, 64, 64]
    - [28, 0.271195]
  - - [64, 64, 1, 64, 64, 64, 64, 64]
    - [12, 17.4611]
  - - [64, 64, 1, 256, 64, 64, 256, 256]
    - [11, 64.9052]
  - - [64, 64, 1, 512, 64, 64, 512, 512]
    - [14, 118.493]
  - - [64, 64, 1, 1024, 64, 64, 1024, 1024]
    - [11, 203.869]
  - - [64, 64, 1, 2048, 64, 64, 2048, 2048]
    - [11, 322.713]
  - - [64, 64, 1, 4096, 64, 64, 4096, 4096]
    - [27, 447.864]
- null
- null
- DeviceEfficiency
- GridBased
