library/src/amd_detail/rocblaslt/src/Tensile/Logic/asm_full/gfx1201/GridBased/gfx1201_Cijk_Alik_Bjlk_BSS_BH_Bias_HAS_SAV_UserArgs.yaml
- {MinimumRequiredVersion: 4.33.0}
- gfx1201
- gfx1201
- [Device 73f0]
    SolutionIndex: 0
    SolutionNameMin: Cijk_Alik_Bjlk_BSS_BH_Bias_HAS_SAV_UserArgs_MT64x32x32_MI16x16x1_SN_LDSB0_CLR1_GSU1_LBSPPA128_LBSPPB512_MIWT2_1_PGR1_PLR1_SS0_SU32_SUM0_SUS256_SVW8_TLDS1_WG32_4_1_WGM8
    SolutionIndex: 1
    SolutionNameMin: Cijk_Alik_Bjlk_BSS_BH_Bias_HAS_SAV_UserArgs_MT64x32x32_MI16x16x1_SN_LDSB0_CLR1_GSU1_LBSPPA128_LBSPPB512_MIWT2_1_PGR2_PLR1_SS0_SU32_SUM0_SUS256_SVW8_TLDS1_WG32_4_1_WGM8
    SolutionIndex: 2
    SolutionNameMin: Cijk_Alik_Bjlk_BSS_BH_Bias_HAS_SAV_UserArgs_MT32x64x32_MI16x16x1_SN_LDSB0_CLR1_GSU1_LBSPPA128_LBSPPB1024_MIWT2_1_PGR1_PLR1_SS0_SU32_SUM0_SUS256_SVW8_TLDS1_WG16_8_1_WGM8
    SolutionIndex: 3
    SolutionNameMin: Cijk_Alik_Bjlk_BSS_BH_Bias_HAS_SAV_UserArgs_MT32x64x32_MI16x16x1_SN_LDSB0_CLR1_GSU1_LBSPPA128_LBSPPB1024_MIWT2_1_PGR2_PLR1_SS0_SU32_SUM0_SUS256_SVW8_TLDS1_WG16_8_1_WGM8
    SolutionIndex: 4
    SolutionNameMin: Cijk_Alik_Bjlk_BSS_BH_Bias_HAS_SAV_UserArgs_MT32x64x32_MI16x16x1_SN_LDSB0_CLR0_GSU1_LBSPPA128_LBSPPB1024_MIWT2_1_PGR1_PLR0_SS0_SU32_SUM0_SUS256_SVW8_TLDS1_WG16_8_1_WGM8
    SolutionIndex: 5
    SolutionNameMin: Cijk_Alik_Bjlk_BSS_BH_Bias_HAS_SAV_UserArgs_MT32x64x32_MI16x16x1_SN_LDSB0_CLR0_GSU1_LBSPPA128_LBSPPB1024_MIWT2_1_PGR2_PLR0_SS0_SU32_SUM0_SUS256_SVW8_TLDS1_WG16_8_1_WGM8
    SolutionIndex: 6
    SolutionNameMin: Cijk_Alik_Bjlk_BSS_BH_Bias_HAS_SAV_UserArgs_MT32x32x64_MI16x16x1_SN_LDSB0_CLR1_GSU1_LBSPPA128_LBSPPB512_MIWT1_1_PGR1_PLR1_SS0_SU32_SUM0_SUS256_SVW8_TLDS1_WG32_4_1_WGM8
    SolutionIndex: 7
    SolutionNameMin: Cijk_Alik_Bjlk_BSS_BH_Bias_HAS_SAV_UserArgs_MT32x32x64_MI16x16x1_SN_LDSB0_CLR0_GSU1_LBSPPA128_LBSPPB512_MIWT1_1_PGR1_PLR0_SS0_SU32_SUM0_SUS256_SVW8_TLDS1_WG32_4_1_WGM8
    SolutionIndex: 8
    SolutionNameMin: Cijk_Alik_Bjlk_BSS_BH_Bias_HAS_SAV_UserArgs_MT32x32x64_MI16x16x1_SN_LDSB0_CLR0_GSU1_LBSPPA128_LBSPPB512_MIWT1_1_PGR2_PLR0_SS0_SU32_SUM0_SUS256_SVW8_TLDS1_WG32_4_1_WGM8
    SolutionIndex: 9
    SolutionNameMin: Cijk_Alik_Bjlk_BSS_BH_Bias_HAS_SAV_UserArgs_MT64x32x64_MI16x16x1_SN_LDSB0_CLR1_GSU1_LBSPPA128_LBSPPB512_MIWT2_1_PGR1_PLR1_SS0_SU32_SUM0_SUS256_SVW8_TLDS1_WG32_4_1_WGM8
    SolutionIndex: 10
    SolutionNameMin: Cijk_Alik_Bjlk_BSS_BH_Bias_HAS_SAV_UserArgs_MT64x16x32_MI16x16x1_SN_LDSB0_CLR0_GSU1_LBSPPA128_LBSPPB256_MIWT1_1_PGR1_PLR0_SS1_SU32_SUM0_SUS256_SVW1_TLDS1_WG64_2_1_WGM8
    SolutionIndex: 11
    SolutionNameMin: Cijk_Alik_Bjlk_BSS_BH_Bias_HAS_SAV_UserArgs_MT32x32x32_MI16x16x1_SN_LDSB0_CLR1_GSU1_LBSPPA512_LBSPPB512_MIWT1_1_PGR1_PLR1_SS1_SU32_SUM0_SUS256_SVW1_TLDS0_WG32_4_1_WGM8
    SolutionIndex: 12
    SolutionNameMin: Cijk_Alik_Bjlk_BSS_BH_Bias_HAS_SAV_UserArgs_MT32x32x32_MI16x16x1_SN_LDSB0_CLR1_GSU1_LBSPPA128_LBSPPB512_MIWT1_1_PGR1_PLR1_SS1_SU32_SUM0_SUS256_SVW1_TLDS1_WG32_4_1_WGM8
    SolutionIndex: 13
    SolutionNameMin: Cijk_Alik_Bjlk_BSS_BH_Bias_HAS_SAV_UserArgs_MT64x32x32_MI16x16x1_SN_LDSB0_CLR1_GSU1_LBSPPA128_LBSPPB512_MIWT2_1_PGR1_PLR1_SS1_SU32_SUM0_SUS256_SVW1_TLDS1_WG32_4_1_WGM8
    SolutionIndex: 14
    SolutionNameMin: Cijk_Alik_Bjlk_BSS_BH_Bias_HAS_SAV_UserArgs_MT64x32x32_MI16x16x1_SN_LDSB0_CLR1_GSU1_LBSPPA128_LBSPPB512_MIWT2_1_PGR2_PLR1_SS1_SU32_SUM0_SUS256_SVW1_TLDS1_WG32_4_1_WGM8
    SolutionIndex: 15
    SolutionNameMin: Cijk_Alik_Bjlk_BSS_BH_Bias_HAS_SAV_UserArgs_MT64x32x32_MI16x16x1_SN_LDSB0_CLR0_GSU1_LBSPPA128_LBSPPB512_MIWT2_1_PGR1_PLR0_SS1_SU32_SUM0_SUS256_SVW1_TLDS1_WG32_4_1_WGM8
    SolutionIndex: 16
    SolutionNameMin: Cijk_Alik_Bjlk_BSS_BH_Bias_HAS_SAV_UserArgs_MT16x64x32_MI16x16x1_SN_LDSB0_CLR1_GSU1_LBSPPA128_LBSPPB1024_MIWT1_1_PGR1_PLR1_SS1_SU32_SUM0_SUS256_SVW1_TLDS1_WG16_8_1_WGM8
    SolutionIndex: 17
    SolutionNameMin: Cijk_Alik_Bjlk_BSS_BH_Bias_HAS_SAV_UserArgs_MT32x64x32_MI16x16x1_SN_LDSB0_CLR1_GSU1_LBSPPA128_LBSPPB1024_MIWT2_1_PGR1_PLR1_SS1_SU32_SUM0_SUS256_SVW1_TLDS1_WG16_8_1_WGM8
    SolutionIndex: 18
    SolutionNameMin: Cijk_Alik_Bjlk_BSS_BH_Bias_HAS_SAV_UserArgs_MT32x64x32_MI16x16x1_SN_LDSB0_CLR1_GSU1_LBSPPA128_LBSPPB1024_MIWT2_1_PGR2_PLR1_SS1_SU32_SUM0_SUS256_SVW1_TLDS1_WG16_8_1_WGM8
    SolutionIndex: 19
    SolutionNameMin: Cijk_Alik_Bjlk_BSS_BH_Bias_HAS_SAV_UserArgs_MT32x64x32_MI16x16x1_SN_LDSB0_CLR0_GSU1_LBSPPA128_LBSPPB1024_MIWT2_1_PGR1_PLR0_SS1_SU32_SUM0_SUS256_SVW1_TLDS1_WG16_8_1_WGM8
    SolutionIndex: 20
    SolutionNameMin: Cijk_Alik_Bjlk_BSS_BH_Bias_HAS_SAV_UserArgs_MT32x32x64_MI16x16x1_SN_LDSB0_CLR1_GSU1_LBSPPA128_LBSPPB512_MIWT1_1_PGR2_PLR1_SS1_SU32_SUM0_SUS256_SVW1_TLDS1_WG32_4_1_WGM8
    SolutionIndex: 21
    SolutionNameMin: Cijk_Alik_Bjlk_BSS_BH_Bias_HAS_SAV_UserArgs_MT32x32x64_MI16x16x1_SN_LDSB0_CLR1_GSU1_LBSPPA128_LBSPPB512_MIWT1_1_PGR1_PLR3_SS1_SU32_SUM0_SUS256_SVW1_TLDS1_WG32_4_1_WGM8
    SolutionIndex: 22
    SolutionNameMin: Cijk_Alik_Bjlk_BSS_BH_Bias_HAS_SAV_UserArgs_MT32x32x64_MI16x16x1_SN_LDSB0_CLR1_GSU1_LBSPPA128_LBSPPB512_MIWT1_1_PGR2_PLR3_SS1_SU32_SUM0_SUS256_SVW1_TLDS1_WG32_4_1_WGM8
    SolutionIndex: 23
    SolutionNameMin: Cijk_Alik_Bjlk_BSS_BH_Bias_HAS_SAV_UserArgs_MT32x32x64_MI16x16x1_SN_LDSB0_CLR0_GSU1_LBSPPA128_LBSPPB512_MIWT1_1_PGR1_PLR0_SS1_SU32_SUM0_SUS256_SVW1_TLDS1_WG32_4_1_WGM8
    SolutionIndex: 24
    SolutionNameMin: Cijk_Alik_Bjlk_BSS_BH_Bias_HAS_SAV_UserArgs_MT64x32x64_MI16x16x1_SN_LDSB0_CLR1_GSU1_LBSPPA128_LBSPPB512_MIWT2_1_PGR1_PLR1_SS1_SU32_SUM0_SUS256_SVW1_TLDS1_WG32_4_1_WGM8
    SolutionIndex: 25
    SolutionNameMin: Cijk_Alik_Bjlk_BSS_BH_Bias_HAS_SAV_UserArgs_MT32x64x64_MI16x16x1_SN_LDSB0_CLR1_GSU1_LBSPPA128_LBSPPB1024_MIWT2_1_PGR1_PLR3_SS1_SU32_SUM0_SUS256_SVW1_TLDS1_WG16_8_1_WGM8
- - - [512, 512, 1, 64, 512, 512, 64, 512]
    - [15, 1066.95]
  - - [1024, 512, 1, 64, 1024, 1024, 64, 512]
    - [3, 2048.38]
  - - [1536, 512, 1, 64, 1536, 1536, 64, 512]
    - [13, 2864.15]
  - - [2048, 512, 1, 64, 2048, 2048, 64, 512]
    - [19, 3524.53]
  - - [2560, 512, 1, 64, 2560, 2560, 64, 512]
    - [19, 4346.2]
  - - [3072, 512, 1, 64, 3072, 3072, 64, 512]
    - [13, 4950.61]
  - - [512, 1024, 1, 64, 512, 512, 64, 1024]
    - [17, 2149.0]
  - - [1024, 1024, 1, 64, 1024, 1024, 64, 1024]
    - [14, 3711.98]
  - - [1536, 1024, 1, 64, 1536, 1536, 64, 1024]
    - [5, 4940.89]
  - - [2048, 1024, 1, 64, 2048, 2048, 64, 1024]
    - [18, 5887.26]
  - - [2560, 1024, 1, 64, 2560, 2560, 64, 1024]
    - [1, 6752.35]
  - - [3072, 1024, 1, 64, 3072, 3072, 64, 1024]
    - [17, 8066.94]
  - - [512, 1536, 1, 64, 512, 512, 64, 1536]
    - [15, 2943.03]
  - - [1024, 1536, 1, 64, 1024, 1024, 64, 1536]
    - [17, 4993.71]
  - - [1536, 1536, 1, 64, 1536, 1536, 64, 1536]
    - [0, 6687.85]
  - - [2048, 1536, 1, 64, 2048, 2048, 64, 1536]
    - [18, 8073.41]
  - - [2560, 1536, 1, 64, 2560, 2560, 64, 1536]
    - [2, 9327.24]
  - - [3072, 1536, 1, 64, 3072, 3072, 64, 1536]
    - [17, 10215.8]
  - - [512, 2048, 1, 64, 512, 512, 64, 2048]
    - [13, 3550.64]
  - - [1024, 2048, 1, 64, 1024, 1024, 64, 2048]
    - [19, 6075.54]
  - - [1536, 2048, 1, 64, 1536, 1536, 64, 2048]
    - [3, 7754.07]
  - - [2048, 2048, 1, 64, 2048, 2048, 64, 2048]
    - [17, 9484.35]
  - - [2560, 2048, 1, 64, 2560, 2560, 64, 2048]
    - [0, 10746.5]
  - - [3072, 2048, 1, 64, 3072, 3072, 64, 2048]
    - [17, 11673.0]
  - - [512, 2560, 1, 64, 512, 512, 64, 2560]
    - [13, 4152.16]
  - - [1024, 2560, 1, 64, 1024, 1024, 64, 2560]
    - [4, 7208.57]
  - - [1536, 2560, 1, 64, 1536, 1536, 64, 2560]
    - [1, 9020.82]
  - - [2048, 2560, 1, 64, 2048, 2048, 64, 2560]
    - [18, 10822.8]
  - - [2560, 2560, 1, 64, 2560, 2560, 64, 2560]
    - [2, 11898.4]
  - - [3072, 2560, 1, 64, 3072, 3072, 64, 2560]
    - [18, 12932.7]
  - - [512, 3072, 1, 64, 512, 512, 64, 3072]
    - [1, 5006.13]
  - - [1024, 3072, 1, 64, 1024, 1024, 64, 3072]
    - [2, 8018.58]
  - - [1536, 3072, 1, 64, 1536, 1536, 64, 3072]
    - [2, 10433.4]
  - - [2048, 3072, 1, 64, 2048, 2048, 64, 3072]
    - [1, 11705.2]
  - - [2560, 3072, 1, 64, 2560, 2560, 64, 3072]
    - [2, 13376.8]
  - - [3072, 3072, 1, 64, 3072, 3072, 64, 3072]
    - [18, 13829.9]
  - - [512, 512, 1, 256, 512, 512, 256, 512]
    - [12, 4015.73]
  - - [1024, 512, 1, 256, 1024, 1024, 256, 512]
    - [13, 7278.62]
  - - [1536, 512, 1, 256, 1536, 1536, 256, 512]
    - [19, 9173.52]
  - - [2048, 512, 1, 256, 2048, 2048, 256, 512]
    - [17, 11450.1]
  - - [2560, 512, 1, 256, 2560, 2560, 256, 512]
    - [2, 12209.6]
  - - [3072, 512, 1, 256, 3072, 3072, 256, 512]
    - [13, 14469.6]
  - - [512, 1024, 1, 256, 512, 512, 256, 1024]
    - [15, 6966.56]
  - - [1024, 1024, 1, 256, 1024, 1024, 256, 1024]
    - [17, 11087.6]
  - - [1536, 1024, 1, 256, 1536, 1536, 256, 1024]
    - [13, 14363.5]
  - - [2048, 1024, 1, 256, 2048, 2048, 256, 1024]
    - [17, 16798.2]
  - - [2560, 1024, 1, 256, 2560, 2560, 256, 1024]
    - [2, 18409.4]
  - - [3072, 1024, 1, 256, 3072, 3072, 256, 1024]
    - [17, 20115.1]
  - - [512, 1536, 1, 256, 512, 512, 256, 1536]
    - [13, 9255.97]
  - - [1024, 1536, 1, 256, 1024, 1024, 256, 1536]
    - [2, 13911.2]
  - - [1536, 1536, 1, 256, 1536, 1536, 256, 1536]
    - [17, 17121.3]
  - - [2048, 1536, 1, 256, 2048, 2048, 256, 1536]
    - [17, 20077.2]
  - - [2560, 1536, 1, 256, 2560, 2560, 256, 1536]
    - [13, 22000.0]
  - - [3072, 1536, 1, 256, 3072, 3072, 256, 1536]
    - [17, 23257.9]
  - - [512, 2048, 1, 256, 512, 512, 256, 2048]
    - [2, 10949.4]
  - - [1024, 2048, 1, 256, 1024, 1024, 256, 2048]
    - [17, 17014.1]
  - - [1536, 2048, 1, 256, 1536, 1536, 256, 2048]
    - [2, 19626.3]
  - - [2048, 2048, 1, 256, 2048, 2048, 256, 2048]
    - [17, 22285.8]
  - - [2560, 2048, 1, 256, 2560, 2560, 256, 2048]
    - [17, 24519.8]
  - - [3072, 2048, 1, 256, 3072, 3072, 256, 2048]
    - [17, 25142.1]
  - - [512, 2560, 1, 256, 512, 512, 256, 2560]
    - [13, 12062.6]
  - - [1024, 2560, 1, 256, 1024, 1024, 256, 2560]
    - [13, 18083.8]
  - - [1536, 2560, 1, 256, 1536, 1536, 256, 2560]
    - [2, 21061.5]
  - - [2048, 2560, 1, 256, 2048, 2048, 256, 2560]
    - [17, 23674.9]
  - - [2560, 2560, 1, 256, 2560, 2560, 256, 2560]
    - [2, 25032.6]
  - - [3072, 2560, 1, 256, 3072, 3072, 256, 2560]
    - [19, 26240.2]
  - - [512, 3072, 1, 256, 512, 512, 256, 3072]
    - [2, 14611.6]
  - - [1024, 3072, 1, 256, 1024, 1024, 256, 3072]
    - [2, 19915.6]
  - - [1536, 3072, 1, 256, 1536, 1536, 256, 3072]
    - [2, 22850.1]
  - - [2048, 3072, 1, 256, 2048, 2048, 256, 3072]
    - [17, 25191.2]
  - - [2560, 3072, 1, 256, 2560, 2560, 256, 3072]
    - [17, 26812.6]
  - - [3072, 3072, 1, 256, 3072, 3072, 256, 3072]
    - [17, 27356.8]
  - - [512, 512, 1, 512, 512, 512, 512, 512]
    - [24, 6921.47]
  - - [1024, 512, 1, 512, 1024, 1024, 512, 512]
    - [13, 11666.8]
  - - [1536, 512, 1, 512, 1536, 1536, 512, 512]
    - [13, 14415.0]
  - - [2048, 512, 1, 512, 2048, 2048, 512, 512]
    - [17, 17163.9]
  - - [2560, 512, 1, 512, 2560, 2560, 512, 512]
    - [17, 18258.9]
  - - [3072, 512, 1, 512, 3072, 3072, 512, 512]
    - [17, 20989.3]
  - - [512, 1024, 1, 512, 512, 512, 512, 1024]
    - [17, 11707.8]
  - - [1024, 1024, 1, 512, 1024, 1024, 512, 1024]
    - [17, 17491.9]
  - - [1536, 1024, 1, 512, 1536, 1536, 512, 1024]
    - [2, 20462.9]
  - - [2048, 1024, 1, 512, 2048, 2048, 512, 1024]
    - [17, 23074.8]
  - - [2560, 1024, 1, 512, 2560, 2560, 512, 1024]
    - [17, 25446.8]
  - - [3072, 1024, 1, 512, 3072, 3072, 512, 1024]
    - [17, 26332.0]
  - - [512, 1536, 1, 512, 512, 512, 512, 1536]
    - [13, 14340.8]
  - - [1024, 1536, 1, 512, 1024, 1024, 512, 1536]
    - [17, 20875.0]
  - - [1536, 1536, 1, 512, 1536, 1536, 512, 1536]
    - [2, 23809.0]
  - - [2048, 1536, 1, 512, 2048, 2048, 512, 1536]
    - [17, 26184.4]
  - - [2560, 1536, 1, 512, 2560, 2560, 512, 1536]
    - [0, 27540.3]
  - - [3072, 1536, 1, 512, 3072, 3072, 512, 1536]
    - [13, 29385.4]
  - - [512, 2048, 1, 512, 512, 512, 512, 2048]
    - [2, 16984.5]
  - - [1024, 2048, 1, 512, 1024, 1024, 512, 2048]
    - [17, 23371.9]
  - - [1536, 2048, 1, 512, 1536, 1536, 512, 2048]
    - [2, 26615.5]
  - - [2048, 2048, 1, 512, 2048, 2048, 512, 2048]
    - [13, 27718.1]
  - - [2560, 2048, 1, 512, 2560, 2560, 512, 2048]
    - [2, 29927.9]
  - - [3072, 2048, 1, 512, 3072, 3072, 512, 2048]
    - [17, 30270.4]
  - - [512, 2560, 1, 512, 512, 512, 512, 2560]
    - [17, 18702.4]
  - - [1024, 2560, 1, 512, 1024, 1024, 512, 2560]
    - [2, 24372.9]
  - - [1536, 2560, 1, 512, 1536, 1536, 512, 2560]
    - [2, 27480.0]
  - - [2048, 2560, 1, 512, 2048, 2048, 512, 2560]
    - [4, 29571.2]
  - - [2560, 2560, 1, 512, 2560, 2560, 512, 2560]
    - [13, 30571.6]
  - - [3072, 2560, 1, 512, 3072, 3072, 512, 2560]
    - [17, 31374.7]
  - - [512, 3072, 1, 512, 512, 512, 512, 3072]
    - [2, 21069.2]
  - - [1024, 3072, 1, 512, 1024, 1024, 512, 3072]
    - [2, 26356.0]
  - - [1536, 3072, 1, 512, 1536, 1536, 512, 3072]
    - [2, 29084.2]
  - - [2048, 3072, 1, 512, 2048, 2048, 512, 3072]
    - [17, 31097.4]
  - - [2560, 3072, 1, 512, 2560, 2560, 512, 3072]
    - [17, 31395.6]
  - - [3072, 3072, 1, 512, 3072, 3072, 512, 3072]
    - [17, 32045.7]
  - - [512, 512, 1, 1024, 512, 512, 1024, 512]
    - [9, 10749.5]
  - - [1024, 512, 1, 1024, 1024, 1024, 1024, 512]
    - [17, 18097.2]
  - - [1536, 512, 1, 1024, 1536, 1536, 1024, 512]
    - [2, 19817.1]
  - - [2048, 512, 1, 1024, 2048, 2048, 1024, 512]
    - [13, 24008.2]
  - - [2560, 512, 1, 1024, 2560, 2560, 1024, 512]
    - [13, 23969.4]
  - - [3072, 512, 1, 1024, 3072, 3072, 1024, 512]
    - [17, 27194.1]
  - - [512, 1024, 1, 1024, 512, 512, 1024, 1024]
    - [17, 17888.8]
  - - [1024, 1024, 1, 1024, 1024, 1024, 1024, 1024]
    - [17, 24399.1]
  - - [1536, 1024, 1, 1024, 1536, 1536, 1024, 1024]
    - [13, 27293.4]
  - - [2048, 1024, 1, 1024, 2048, 2048, 1024, 1024]
    - [13, 28825.3]
  - - [2560, 1024, 1, 1024, 2560, 2560, 1024, 1024]
    - [0, 30260.9]
  - - [3072, 1024, 1, 1024, 3072, 3072, 1024, 1024]
    - [17, 30840.8]
  - - [512, 1536, 1, 1024, 512, 512, 1024, 1536]
    - [17, 19359.0]
  - - [1024, 1536, 1, 1024, 1024, 1024, 1024, 1536]
    - [2, 27705.2]
  - - [1536, 1536, 1, 1024, 1536, 1536, 1024, 1536]
    - [2, 29330.1]
  - - [2048, 1536, 1, 1024, 2048, 2048, 1024, 1536]
    - [17, 31095.8]
  - - [2560, 1536, 1, 1024, 2560, 2560, 1024, 1536]
    - [17, 31425.1]
  - - [3072, 1536, 1, 1024, 3072, 3072, 1024, 1536]
    - [17, 33172.1]
  - - [512, 2048, 1, 1024, 512, 512, 1024, 2048]
    - [13, 24157.0]
  - - [1024, 2048, 1, 1024, 1024, 1024, 1024, 2048]
    - [2, 28955.7]
  - - [1536, 2048, 1, 1024, 1536, 1536, 1024, 2048]
    - [17, 31169.8]
  - - [2048, 2048, 1, 1024, 2048, 2048, 1024, 2048]
    - [2, 32397.9]
  - - [2560, 2048, 1, 1024, 2560, 2560, 1024, 2048]
    - [17, 33925.8]
  - - [3072, 2048, 1, 1024, 3072, 3072, 1024, 2048]
    - [0, 33969.8]
  - - [512, 2560, 1, 1024, 512, 512, 1024, 2560]
    - [17, 24499.7]
  - - [1024, 2560, 1, 1024, 1024, 1024, 1024, 2560]
    - [2, 30559.4]
  - - [1536, 2560, 1, 1024, 1536, 1536, 1024, 2560]
    - [2, 31804.4]
  - - [2048, 2560, 1, 1024, 2048, 2048, 1024, 2560]
    - [13, 32905.1]
  - - [2560, 2560, 1, 1024, 2560, 2560, 1024, 2560]
    - [2, 33734.2]
  - - [3072, 2560, 1, 1024, 3072, 3072, 1024, 2560]
    - [17, 34400.0]
  - - [512, 3072, 1, 1024, 512, 512, 1024, 3072]
    - [2, 27866.0]
  - - [1024, 3072, 1, 1024, 1024, 1024, 1024, 3072]
    - [17, 30767.1]
  - - [1536, 3072, 1, 1024, 1536, 1536, 1024, 3072]
    - [13, 33047.1]
  - - [2048, 3072, 1, 1024, 2048, 2048, 1024, 3072]
    - [13, 33781.6]
  - - [2560, 3072, 1, 1024, 2560, 2560, 1024, 3072]
    - [17, 34664.0]
  - - [3072, 3072, 1, 1024, 3072, 3072, 1024, 3072]
    - [17, 35196.1]
  - - [512, 512, 1, 2048, 512, 512, 2048, 512]
    - [25, 15835.3]
  - - [1024, 512, 1, 2048, 1024, 1024, 2048, 512]
    - [17, 24776.8]
  - - [1536, 512, 1, 2048, 1536, 1536, 2048, 512]
    - [13, 24214.3]
  - - [2048, 512, 1, 2048, 2048, 2048, 2048, 512]
    - [17, 29182.3]
  - - [2560, 512, 1, 2048, 2560, 2560, 2048, 512]
    - [2, 28571.6]
  - - [3072, 512, 1, 2048, 3072, 3072, 2048, 512]
    - [17, 31617.2]
  - - [512, 1024, 1, 2048, 512, 512, 2048, 1024]
    - [17, 24129.8]
  - - [1024, 1024, 1, 2048, 1024, 1024, 2048, 1024]
    - [17, 29677.4]
  - - [1536, 1024, 1, 2048, 1536, 1536, 2048, 1024]
    - [17, 31330.8]
  - - [2048, 1024, 1, 2048, 2048, 2048, 2048, 1024]
    - [2, 32764.3]
  - - [2560, 1024, 1, 2048, 2560, 2560, 2048, 1024]
    - [2, 33601.5]
  - - [3072, 1024, 1, 2048, 3072, 3072, 2048, 1024]
    - [17, 35286.8]
  - - [512, 1536, 1, 2048, 512, 512, 2048, 1536]
    - [17, 24854.6]
  - - [1024, 1536, 1, 2048, 1024, 1024, 2048, 1536]
    - [17, 31566.1]
  - - [1536, 1536, 1, 2048, 1536, 1536, 2048, 1536]
    - [13, 32252.6]
  - - [2048, 1536, 1, 2048, 2048, 2048, 2048, 1536]
    - [2, 34579.0]
  - - [2560, 1536, 1, 2048, 2560, 2560, 2048, 1536]
    - [2, 34288.5]
  - - [3072, 1536, 1, 2048, 3072, 3072, 2048, 1536]
    - [17, 34956.3]
  - - [512, 2048, 1, 2048, 512, 512, 2048, 2048]
    - [2, 29930.1]
  - - [1024, 2048, 1, 2048, 1024, 1024, 2048, 2048]
    - [17, 33006.5]
  - - [1536, 2048, 1, 2048, 1536, 1536, 2048, 2048]
    - [2, 35072.3]
  - - [2048, 2048, 1, 2048, 2048, 2048, 2048, 2048]
    - [17, 35395.2]
  - - [2560, 2048, 1, 2048, 2560, 2560, 2048, 2048]
    - [17, 35317.9]
  - - [3072, 2048, 1, 2048, 3072, 3072, 2048, 2048]
    - [2, 36310.1]
  - - [512, 2560, 1, 2048, 512, 512, 2048, 2560]
    - [2, 28781.9]
  - - [1024, 2560, 1, 2048, 1024, 1024, 2048, 2560]
    - [17, 34219.5]
  - - [1536, 2560, 1, 2048, 1536, 1536, 2048, 2560]
    - [17, 33626.5]
  - - [2048, 2560, 1, 2048, 2048, 2048, 2048, 2560]
    - [0, 35274.3]
  - - [2560, 2560, 1, 2048, 2560, 2560, 2048, 2560]
    - [0, 35392.3]
  - - [3072, 2560, 1, 2048, 3072, 3072, 2048, 2560]
    - [13, 36196.6]
  - - [512, 3072, 1, 2048, 512, 512, 2048, 3072]
    - [2, 32525.6]
  - - [1024, 3072, 1, 2048, 1024, 1024, 2048, 3072]
    - [17, 34810.3]
  - - [1536, 3072, 1, 2048, 1536, 1536, 2048, 3072]
    - [2, 35115.4]
  - - [2048, 3072, 1, 2048, 2048, 2048, 2048, 3072]
    - [17, 35705.7]
  - - [2560, 3072, 1, 2048, 2560, 2560, 2048, 3072]
    - [17, 36105.2]
  - - [3072, 3072, 1, 2048, 3072, 3072, 2048, 3072]
    - [2, 36794.1]
  - - [512, 512, 1, 3072, 512, 512, 3072, 512]
    - [12, 18101.2]
  - - [1024, 512, 1, 3072, 1024, 1024, 3072, 512]
    - [17, 27407.5]
  - - [1536, 512, 1, 3072, 1536, 1536, 3072, 512]
    - [17, 26558.5]
  - - [2048, 512, 1, 3072, 2048, 2048, 3072, 512]
    - [17, 31656.4]
  - - [2560, 512, 1, 3072, 2560, 2560, 3072, 512]
    - [2, 29794.3]
  - - [3072, 512, 1, 3072, 3072, 3072, 3072, 512]
    - [17, 33958.2]
  - - [512, 1024, 1, 3072, 512, 512, 3072, 1024]
    - [17, 27605.0]
  - - [1024, 1024, 1, 3072, 1024, 1024, 3072, 1024]
    - [0, 31643.8]
  - - [1536, 1024, 1, 3072, 1536, 1536, 3072, 1024]
    - [17, 33254.4]
  - - [2048, 1024, 1, 3072, 2048, 2048, 3072, 1024]
    - [13, 34139.3]
  - - [2560, 1024, 1, 3072, 2560, 2560, 3072, 1024]
    - [2, 35012.1]
  - - [3072, 1024, 1, 3072, 3072, 3072, 3072, 1024]
    - [17, 35445.0]
  - - [512, 1536, 1, 3072, 512, 512, 3072, 1536]
    - [17, 27221.0]
  - - [1024, 1536, 1, 3072, 1024, 1024, 3072, 1536]
    - [17, 33581.0]
  - - [1536, 1536, 1, 3072, 1536, 1536, 3072, 1536]
    - [17, 33789.2]
  - - [2048, 1536, 1, 3072, 2048, 2048, 3072, 1536]
    - [17, 35114.7]
  - - [2560, 1536, 1, 3072, 2560, 2560, 3072, 1536]
    - [13, 35238.0]
  - - [3072, 1536, 1, 3072, 3072, 3072, 3072, 1536]
    - [13, 35861.7]
  - - [512, 2048, 1, 3072, 512, 512, 3072, 2048]
    - [17, 32182.2]
  - - [1024, 2048, 1, 3072, 1024, 1024, 3072, 2048]
    - [17, 34070.6]
  - - [1536, 2048, 1, 3072, 1536, 1536, 3072, 2048]
    - [17, 35333.4]
  - - [2048, 2048, 1, 3072, 2048, 2048, 3072, 2048]
    - [17, 35785.7]
  - - [2560, 2048, 1, 3072, 2560, 2560, 3072, 2048]
    - [2, 36387.1]
  - - [3072, 2048, 1, 3072, 3072, 3072, 3072, 2048]
    - [2, 37185.3]
  - - [512, 2560, 1, 3072, 512, 512, 3072, 2560]
    - [19, 30673.2]
  - - [1024, 2560, 1, 3072, 1024, 1024, 3072, 2560]
    - [17, 34868.5]
  - - [1536, 2560, 1, 3072, 1536, 1536, 3072, 2560]
    - [17, 34535.1]
  - - [2048, 2560, 1, 3072, 2048, 2048, 3072, 2560]
    - [17, 36026.7]
  - - [2560, 2560, 1, 3072, 2560, 2560, 3072, 2560]
    - [2, 36226.7]
  - - [3072, 2560, 1, 3072, 3072, 3072, 3072, 2560]
    - [17, 36351.1]
  - - [512, 3072, 1, 3072, 512, 512, 3072, 3072]
    - [13, 34107.1]
  - - [1024, 3072, 1, 3072, 1024, 1024, 3072, 3072]
    - [17, 35181.3]
  - - [1536, 3072, 1, 3072, 1536, 1536, 3072, 3072]
    - [0, 35908.0]
  - - [2048, 3072, 1, 3072, 2048, 2048, 3072, 3072]
    - [2, 36244.9]
  - - [2560, 3072, 1, 3072, 2560, 2560, 3072, 3072]
    - [17, 36438.8]
  - - [3072, 3072, 1, 3072, 3072, 3072, 3072, 3072]
    - [17, 36374.3]
  - - [1, 1, 1, 1, 1, 1, 1, 1]
    - [16, 6.42715e-05]
  - - [1, 1, 1, 64, 1, 1, 64, 1]
    - [7, 0.0042151]
  - - [1, 64, 1, 1, 1, 1, 1, 64]
    - [16, 0.00430165]
  - - [64, 1, 1, 1, 64, 64, 1, 1]
    - [10, 0.004144]
  - - [64, 64, 1, 1, 64, 64, 1, 64]
    - [20, 0.268344]
  - - [64, 1, 1, 64, 64, 64, 64, 1]
    - [11, 0.263087]
  - - [1, 64, 1, 64, 1, 1, 64, 64]
    - [22, 0.273468]
  - - [64, 64, 1, 64, 64, 64, 64, 64]
    - [8, 17.7454]
  - - [64, 64, 1, 256, 64, 64, 256, 64]
    - [23, 65.5565]
  - - [64, 64, 1, 512, 64, 64, 512, 64]
    - [23, 121.91]
  - - [64, 64, 1, 1024, 64, 64, 1024, 64]
    - [23, 208.123]
  - - [64, 64, 1, 2048, 64, 64, 2048, 64]
    - [21, 324.907]
  - - [64, 64, 1, 4096, 64, 64, 4096, 64]
    - [6, 446.375]
- null
- null
- DeviceEfficiency
- GridBased
