library/src/amd_detail/rocblaslt/src/Tensile/Logic/asm_full/gfx1201/GridBased/gfx1201_Cijk_Alik_Bjlk_HHS_BH_Bias_HAS_SAV_UserArgs.yaml
- {MinimumRequiredVersion: 4.33.0}
- gfx1201
- gfx1201
- [Device 73f0]
    SolutionIndex: 0
    SolutionNameMin: Cijk_Alik_Bjlk_HHS_BH_Bias_HAS_SAV_UserArgs_MT32x32x32_MI16x16x1_SN_LDSB0_CLR0_GSU1_LBSPPA128_LBSPPB512_MIWT1_1_PGR1_PLR0_SS0_SU32_SUM0_SUS256_SVW8_TLDS1_WG32_4_1_WGM8
    SolutionIndex: 1
    SolutionNameMin: Cijk_Alik_Bjlk_HHS_BH_Bias_HAS_SAV_UserArgs_MT64x32x32_MI16x16x1_SN_LDSB0_CLR1_GSU1_LBSPPA128_LBSPPB512_MIWT2_1_PGR1_PLR1_SS0_SU32_SUM0_SUS256_SVW8_TLDS1_WG32_4_1_WGM8
    SolutionIndex: 2
    SolutionNameMin: Cijk_Alik_Bjlk_HHS_BH_Bias_HAS_SAV_UserArgs_MT64x32x32_MI16x16x1_SN_LDSB0_CLR1_GSU1_LBSPPA128_LBSPPB512_MIWT2_1_PGR2_PLR1_SS0_SU32_SUM0_SUS256_SVW8_TLDS1_WG32_4_1_WGM8
    SolutionIndex: 3
    SolutionNameMin: Cijk_Alik_Bjlk_HHS_BH_Bias_HAS_SAV_UserArgs_MT64x32x32_MI16x16x1_SN_LDSB0_CLR0_GSU1_LBSPPA128_LBSPPB512_MIWT2_1_PGR1_PLR0_SS0_SU32_SUM0_SUS256_SVW8_TLDS1_WG32_4_1_WGM8
    SolutionIndex: 4
    SolutionNameMin: Cijk_Alik_Bjlk_HHS_BH_Bias_HAS_SAV_UserArgs_MT64x32x32_MI16x16x1_SN_LDSB0_CLR0_GSU1_LBSPPA128_LBSPPB512_MIWT2_1_PGR2_PLR0_SS0_SU32_SUM0_SUS256_SVW8_TLDS1_WG32_4_1_WGM8
    SolutionIndex: 5
    SolutionNameMin: Cijk_Alik_Bjlk_HHS_BH_Bias_HAS_SAV_UserArgs_MT32x64x32_MI16x16x1_SN_LDSB0_CLR1_GSU1_LBSPPA512_LBSPPB1024_MIWT2_1_PGR1_PLR1_SS0_SU32_SUM0_SUS256_SVW8_TLDS0_WG16_8_1_WGM8
    SolutionIndex: 6
    SolutionNameMin: Cijk_Alik_Bjlk_HHS_BH_Bias_HAS_SAV_UserArgs_MT32x64x32_MI16x16x1_SN_LDSB0_CLR1_GSU1_LBSPPA128_LBSPPB1024_MIWT2_1_PGR1_PLR1_SS0_SU32_SUM0_SUS256_SVW8_TLDS1_WG16_8_1_WGM8
    SolutionIndex: 7
    SolutionNameMin: Cijk_Alik_Bjlk_HHS_BH_Bias_HAS_SAV_UserArgs_MT32x64x32_MI16x16x1_SN_LDSB0_CLR1_GSU1_LBSPPA128_LBSPPB1024_MIWT2_1_PGR2_PLR1_SS0_SU32_SUM0_SUS256_SVW8_TLDS1_WG16_8_1_WGM8
    SolutionIndex: 8
    SolutionNameMin: Cijk_Alik_Bjlk_HHS_BH_Bias_HAS_SAV_UserArgs_MT32x64x32_MI16x16x1_SN_LDSB0_CLR0_GSU1_LBSPPA128_LBSPPB1024_MIWT2_1_PGR1_PLR0_SS0_SU32_SUM0_SUS256_SVW8_TLDS1_WG16_8_1_WGM8
    SolutionIndex: 9
    SolutionNameMin: Cijk_Alik_Bjlk_HHS_BH_Bias_HAS_SAV_UserArgs_MT32x64x32_MI16x16x1_SN_LDSB0_CLR0_GSU1_LBSPPA128_LBSPPB1024_MIWT2_1_PGR2_PLR0_SS0_SU32_SUM0_SUS256_SVW8_TLDS1_WG16_8_1_WGM8
    SolutionIndex: 10
    SolutionNameMin: Cijk_Alik_Bjlk_HHS_BH_Bias_HAS_SAV_UserArgs_MT32x32x64_MI16x16x1_SN_LDSB0_CLR1_GSU1_LBSPPA128_LBSPPB512_MIWT1_1_PGR1_PLR1_SS0_SU32_SUM0_SUS256_SVW8_TLDS1_WG32_4_1_WGM8
    SolutionIndex: 11
    SolutionNameMin: Cijk_Alik_Bjlk_HHS_BH_Bias_HAS_SAV_UserArgs_MT32x32x64_MI16x16x1_SN_LDSB0_CLR1_GSU1_LBSPPA128_LBSPPB512_MIWT1_1_PGR1_PLR3_SS0_SU32_SUM0_SUS256_SVW8_TLDS1_WG32_4_1_WGM8
    SolutionIndex: 12
    SolutionNameMin: Cijk_Alik_Bjlk_HHS_BH_Bias_HAS_SAV_UserArgs_MT64x32x64_MI16x16x1_SN_LDSB0_CLR1_GSU1_LBSPPA128_LBSPPB512_MIWT2_1_PGR1_PLR1_SS0_SU32_SUM0_SUS256_SVW8_TLDS1_WG32_4_1_WGM8
    SolutionIndex: 13
    SolutionNameMin: Cijk_Alik_Bjlk_HHS_BH_Bias_HAS_SAV_UserArgs_MT64x32x64_MI16x16x1_SN_LDSB0_CLR1_GSU1_LBSPPA128_LBSPPB512_MIWT2_1_PGR1_PLR3_SS0_SU32_SUM0_SUS256_SVW8_TLDS1_WG32_4_1_WGM8
    SolutionIndex: 14
    SolutionNameMin: Cijk_Alik_Bjlk_HHS_BH_Bias_HAS_SAV_UserArgs_MT16x64x64_MI16x16x1_SN_LDSB0_CLR1_GSU1_LBSPPA128_LBSPPB1024_MIWT1_1_PGR1_PLR1_SS0_SU32_SUM0_SUS256_SVW8_TLDS1_WG16_8_1_WGM8
    SolutionIndex: 15
    SolutionNameMin: Cijk_Alik_Bjlk_HHS_BH_Bias_HAS_SAV_UserArgs_MT64x16x32_MI16x16x1_SN_LDSB0_CLR0_GSU1_LBSPPA128_LBSPPB256_MIWT1_1_PGR1_PLR0_SS1_SU32_SUM0_SUS256_SVW1_TLDS1_WG64_2_1_WGM8
    SolutionIndex: 16
    SolutionNameMin: Cijk_Alik_Bjlk_HHS_BH_Bias_HAS_SAV_UserArgs_MT32x32x32_MI16x16x1_SN_LDSB0_CLR1_GSU1_LBSPPA128_LBSPPB512_MIWT1_1_PGR1_PLR1_SS1_SU32_SUM0_SUS256_SVW1_TLDS1_WG32_4_1_WGM8
    SolutionIndex: 17
    SolutionNameMin: Cijk_Alik_Bjlk_HHS_BH_Bias_HAS_SAV_UserArgs_MT32x32x32_MI16x16x1_SN_LDSB0_CLR1_GSU1_LBSPPA128_LBSPPB512_MIWT1_1_PGR2_PLR1_SS1_SU32_SUM0_SUS256_SVW1_TLDS1_WG32_4_1_WGM8
    SolutionIndex: 18
    SolutionNameMin: Cijk_Alik_Bjlk_HHS_BH_Bias_HAS_SAV_UserArgs_MT32x32x32_MI16x16x1_SN_LDSB0_CLR0_GSU1_LBSPPA128_LBSPPB512_MIWT1_1_PGR2_PLR0_SS1_SU32_SUM0_SUS256_SVW1_TLDS1_WG32_4_1_WGM8
    SolutionIndex: 19
    SolutionNameMin: Cijk_Alik_Bjlk_HHS_BH_Bias_HAS_SAV_UserArgs_MT64x32x32_MI16x16x1_SN_LDSB0_CLR1_GSU1_LBSPPA128_LBSPPB512_MIWT2_1_PGR1_PLR1_SS1_SU32_SUM0_SUS256_SVW1_TLDS1_WG32_4_1_WGM8
    SolutionIndex: 20
    SolutionNameMin: Cijk_Alik_Bjlk_HHS_BH_Bias_HAS_SAV_UserArgs_MT64x32x32_MI16x16x1_SN_LDSB0_CLR0_GSU1_LBSPPA128_LBSPPB512_MIWT2_1_PGR1_PLR0_SS1_SU32_SUM0_SUS256_SVW1_TLDS1_WG32_4_1_WGM8
    SolutionIndex: 21
    SolutionNameMin: Cijk_Alik_Bjlk_HHS_BH_Bias_HAS_SAV_UserArgs_MT32x64x32_MI16x16x1_SN_LDSB0_CLR1_GSU1_LBSPPA128_LBSPPB1024_MIWT2_1_PGR1_PLR1_SS1_SU32_SUM0_SUS256_SVW1_TLDS1_WG16_8_1_WGM8
    SolutionIndex: 22
    SolutionNameMin: Cijk_Alik_Bjlk_HHS_BH_Bias_HAS_SAV_UserArgs_MT32x64x32_MI16x16x1_SN_LDSB0_CLR0_GSU1_LBSPPA128_LBSPPB1024_MIWT2_1_PGR1_PLR0_SS1_SU32_SUM0_SUS256_SVW1_TLDS1_WG16_8_1_WGM8
    SolutionIndex: 23
    SolutionNameMin: Cijk_Alik_Bjlk_HHS_BH_Bias_HAS_SAV_UserArgs_MT32x64x32_MI16x16x1_SN_LDSB0_CLR0_GSU1_LBSPPA512_LBSPPB1024_MIWT2_1_PGR2_PLR0_SS1_SU32_SUM0_SUS256_SVW1_TLDS0_WG16_8_1_WGM8
    SolutionIndex: 24
    SolutionNameMin: Cijk_Alik_Bjlk_HHS_BH_Bias_HAS_SAV_UserArgs_MT32x32x64_MI16x16x1_SN_LDSB0_CLR1_GSU1_LBSPPA128_LBSPPB512_MIWT1_1_PGR1_PLR1_SS1_SU32_SUM0_SUS256_SVW1_TLDS1_WG32_4_1_WGM8
    SolutionIndex: 25
    SolutionNameMin: Cijk_Alik_Bjlk_HHS_BH_Bias_HAS_SAV_UserArgs_MT32x32x64_MI16x16x1_SN_LDSB0_CLR0_GSU1_LBSPPA128_LBSPPB512_MIWT1_1_PGR1_PLR0_SS1_SU32_SUM0_SUS256_SVW1_TLDS1_WG32_4_1_WGM8
    SolutionIndex: 26
    SolutionNameMin: Cijk_Alik_Bjlk_HHS_BH_Bias_HAS_SAV_UserArgs_MT64x32x64_MI16x16x1_SN_LDSB0_CLR1_GSU1_LBSPPA128_LBSPPB512_MIWT2_1_PGR1_PLR1_SS1_SU32_SUM0_SUS256_SVW1_TLDS1_WG32_4_1_WGM8
    SolutionIndex: 27
    SolutionNameMin: Cijk_Alik_Bjlk_HHS_BH_Bias_HAS_SAV_UserArgs_MT16x64x64_MI16x16x1_SN_LDSB0_CLR1_GSU1_LBSPPA128_LBSPPB1024_MIWT1_1_PGR1_PLR3_SS1_SU32_SUM0_SUS256_SVW1_TLDS1_WG16_8_1_WGM8
    SolutionIndex: 28
    SolutionNameMin: Cijk_Alik_Bjlk_HHS_BH_Bias_HAS_SAV_UserArgs_MT32x64x64_MI16x16x1_SN_LDSB0_CLR1_GSU1_LBSPPA128_LBSPPB1024_MIWT2_1_PGR1_PLR3_SS1_SU32_SUM0_SUS256_SVW1_TLDS1_WG16_8_1_WGM8
- - - [512, 512, 1, 64, 512, 512, 64, 512]
    - [4, 1083.17]
  - - [1024, 512, 1, 64, 1024, 1024, 64, 512]
    - [6, 2149.62]
  - - [1536, 512, 1, 64, 1536, 1536, 64, 512]
    - [3, 2862.44]
  - - [2048, 512, 1, 64, 2048, 2048, 64, 512]
    - [1, 3757.71]
  - - [2560, 512, 1, 64, 2560, 2560, 64, 512]
    - [9, 4330.39]
  - - [3072, 512, 1, 64, 3072, 3072, 64, 512]
    - [1, 5161.69]
  - - [512, 1024, 1, 64, 512, 512, 64, 1024]
    - [19, 2075.04]
  - - [1024, 1024, 1, 64, 1024, 1024, 64, 1024]
    - [20, 3608.97]
  - - [1536, 1024, 1, 64, 1536, 1536, 64, 1024]
    - [23, 4639.72]
  - - [2048, 1024, 1, 64, 2048, 2048, 64, 1024]
    - [1, 6143.81]
  - - [2560, 1024, 1, 64, 2560, 2560, 64, 1024]
    - [1, 7283.99]
  - - [3072, 1024, 1, 64, 3072, 3072, 64, 1024]
    - [6, 7999.47]
  - - [512, 1536, 1, 64, 512, 512, 64, 1536]
    - [6, 2970.91]
  - - [1024, 1536, 1, 64, 1024, 1024, 64, 1536]
    - [8, 5152.58]
  - - [1536, 1536, 1, 64, 1536, 1536, 64, 1536]
    - [6, 6800.96]
  - - [2048, 1536, 1, 64, 2048, 2048, 64, 1536]
    - [8, 8088.0]
  - - [2560, 1536, 1, 64, 2560, 2560, 64, 1536]
    - [2, 9133.94]
  - - [3072, 1536, 1, 64, 3072, 3072, 64, 1536]
    - [6, 10264.6]
  - - [512, 2048, 1, 64, 512, 512, 64, 2048]
    - [19, 3696.54]
  - - [1024, 2048, 1, 64, 1024, 1024, 64, 2048]
    - [1, 6298.34]
  - - [1536, 2048, 1, 64, 1536, 1536, 64, 2048]
    - [19, 7790.22]
  - - [2048, 2048, 1, 64, 2048, 2048, 64, 2048]
    - [7, 9700.44]
  - - [2560, 2048, 1, 64, 2560, 2560, 64, 2048]
    - [9, 10984.3]
  - - [3072, 2048, 1, 64, 3072, 3072, 64, 2048]
    - [9, 12022.0]
  - - [512, 2560, 1, 64, 512, 512, 64, 2560]
    - [20, 4391.71]
  - - [1024, 2560, 1, 64, 1024, 1024, 64, 2560]
    - [6, 7101.62]
  - - [1536, 2560, 1, 64, 1536, 1536, 64, 2560]
    - [1, 9360.37]
  - - [2048, 2560, 1, 64, 2048, 2048, 64, 2560]
    - [1, 11006.0]
  - - [2560, 2560, 1, 64, 2560, 2560, 64, 2560]
    - [8, 12365.6]
  - - [3072, 2560, 1, 64, 3072, 3072, 64, 2560]
    - [7, 13479.1]
  - - [512, 3072, 1, 64, 512, 512, 64, 3072]
    - [0, 4434.99]
  - - [1024, 3072, 1, 64, 1024, 1024, 64, 3072]
    - [6, 8175.2]
  - - [1536, 3072, 1, 64, 1536, 1536, 64, 3072]
    - [6, 10493.2]
  - - [2048, 3072, 1, 64, 2048, 2048, 64, 3072]
    - [7, 11785.7]
  - - [2560, 3072, 1, 64, 2560, 2560, 64, 3072]
    - [7, 13452.3]
  - - [3072, 3072, 1, 64, 3072, 3072, 64, 3072]
    - [6, 14621.4]
  - - [512, 512, 1, 256, 512, 512, 256, 512]
    - [13, 3950.6]
  - - [1024, 512, 1, 256, 1024, 1024, 256, 512]
    - [21, 7257.17]
  - - [1536, 512, 1, 256, 1536, 1536, 256, 512]
    - [5, 7936.24]
  - - [2048, 512, 1, 256, 2048, 2048, 256, 512]
    - [1, 11596.0]
  - - [2560, 512, 1, 256, 2560, 2560, 256, 512]
    - [21, 12681.2]
  - - [3072, 512, 1, 256, 3072, 3072, 256, 512]
    - [22, 13454.7]
  - - [512, 1024, 1, 256, 512, 512, 256, 1024]
    - [27, 5362.92]
  - - [1024, 1024, 1, 256, 1024, 1024, 256, 1024]
    - [21, 11518.9]
  - - [1536, 1024, 1, 256, 1536, 1536, 256, 1024]
    - [6, 14363.5]
  - - [2048, 1024, 1, 256, 2048, 2048, 256, 1024]
    - [6, 16690.9]
  - - [2560, 1024, 1, 256, 2560, 2560, 256, 1024]
    - [1, 18860.1]
  - - [3072, 1024, 1, 256, 3072, 3072, 256, 1024]
    - [6, 19744.2]
  - - [512, 1536, 1, 256, 512, 512, 256, 1536]
    - [19, 9025.27]
  - - [1024, 1536, 1, 256, 1024, 1024, 256, 1536]
    - [1, 14474.8]
  - - [1536, 1536, 1, 256, 1536, 1536, 256, 1536]
    - [6, 17097.1]
  - - [2048, 1536, 1, 256, 2048, 2048, 256, 1536]
    - [6, 20107.5]
  - - [2560, 1536, 1, 256, 2560, 2560, 256, 1536]
    - [6, 21992.8]
  - - [3072, 1536, 1, 256, 3072, 3072, 256, 1536]
    - [6, 23393.3]
  - - [512, 2048, 1, 256, 512, 512, 256, 2048]
    - [19, 11514.2]
  - - [1024, 2048, 1, 256, 1024, 1024, 256, 2048]
    - [6, 16835.1]
  - - [1536, 2048, 1, 256, 1536, 1536, 256, 2048]
    - [6, 20200.8]
  - - [2048, 2048, 1, 256, 2048, 2048, 256, 2048]
    - [6, 21977.2]
  - - [2560, 2048, 1, 256, 2560, 2560, 256, 2048]
    - [6, 24251.5]
  - - [3072, 2048, 1, 256, 3072, 3072, 256, 2048]
    - [6, 25706.9]
  - - [512, 2560, 1, 256, 512, 512, 256, 2560]
    - [6, 8237.86]
  - - [1024, 2560, 1, 256, 1024, 1024, 256, 2560]
    - [6, 18794.3]
  - - [1536, 2560, 1, 256, 1536, 1536, 256, 2560]
    - [6, 21764.1]
  - - [2048, 2560, 1, 256, 2048, 2048, 256, 2560]
    - [6, 23881.9]
  - - [2560, 2560, 1, 256, 2560, 2560, 256, 2560]
    - [21, 25509.3]
  - - [3072, 2560, 1, 256, 3072, 3072, 256, 2560]
    - [6, 27707.3]
  - - [512, 3072, 1, 256, 512, 512, 256, 3072]
    - [8, 14498.3]
  - - [1024, 3072, 1, 256, 1024, 1024, 256, 3072]
    - [6, 19817.3]
  - - [1536, 3072, 1, 256, 1536, 1536, 256, 3072]
    - [6, 22961.1]
  - - [2048, 3072, 1, 256, 2048, 2048, 256, 3072]
    - [6, 25392.4]
  - - [2560, 3072, 1, 256, 2560, 2560, 256, 3072]
    - [8, 27016.5]
  - - [3072, 3072, 1, 256, 3072, 3072, 256, 3072]
    - [8, 28086.5]
  - - [512, 512, 1, 512, 512, 512, 512, 512]
    - [26, 6889.5]
  - - [1024, 512, 1, 512, 1024, 1024, 512, 512]
    - [1, 12085.4]
  - - [1536, 512, 1, 512, 1536, 1536, 512, 512]
    - [14, 9874.52]
  - - [2048, 512, 1, 512, 2048, 2048, 512, 512]
    - [6, 17180.4]
  - - [2560, 512, 1, 512, 2560, 2560, 512, 512]
    - [6, 18934.8]
  - - [3072, 512, 1, 512, 3072, 3072, 512, 512]
    - [1, 21194.2]
  - - [512, 1024, 1, 512, 512, 512, 512, 1024]
    - [6, 12156.6]
  - - [1024, 1024, 1, 512, 1024, 1024, 512, 1024]
    - [21, 17796.6]
  - - [1536, 1024, 1, 512, 1536, 1536, 512, 1024]
    - [1, 21025.2]
  - - [2048, 1024, 1, 512, 2048, 2048, 512, 1024]
    - [6, 23354.1]
  - - [2560, 1024, 1, 512, 2560, 2560, 512, 1024]
    - [21, 24928.3]
  - - [3072, 1024, 1, 512, 3072, 3072, 512, 1024]
    - [1, 26813.2]
  - - [512, 1536, 1, 512, 512, 512, 512, 1536]
    - [21, 14516.6]
  - - [1024, 1536, 1, 512, 1024, 1024, 512, 1536]
    - [6, 21185.9]
  - - [1536, 1536, 1, 512, 1536, 1536, 512, 1536]
    - [6, 24108.8]
  - - [2048, 1536, 1, 512, 2048, 2048, 512, 1536]
    - [6, 26635.3]
  - - [2560, 1536, 1, 512, 2560, 2560, 512, 1536]
    - [21, 27782.2]
  - - [3072, 1536, 1, 512, 3072, 3072, 512, 1536]
    - [6, 29862.3]
  - - [512, 2048, 1, 512, 512, 512, 512, 2048]
    - [19, 12205.1]
  - - [1024, 2048, 1, 512, 1024, 1024, 512, 2048]
    - [6, 23129.8]
  - - [1536, 2048, 1, 512, 1536, 1536, 512, 2048]
    - [6, 26490.8]
  - - [2048, 2048, 1, 512, 2048, 2048, 512, 2048]
    - [6, 28155.0]
  - - [2560, 2048, 1, 512, 2560, 2560, 512, 2048]
    - [1, 30072.6]
  - - [3072, 2048, 1, 512, 3072, 3072, 512, 2048]
    - [1, 30680.4]
  - - [512, 2560, 1, 512, 512, 512, 512, 2560]
    - [6, 18757.3]
  - - [1024, 2560, 1, 512, 1024, 1024, 512, 2560]
    - [6, 19614.2]
  - - [1536, 2560, 1, 512, 1536, 1536, 512, 2560]
    - [6, 27576.2]
  - - [2048, 2560, 1, 512, 2048, 2048, 512, 2560]
    - [1, 30077.5]
  - - [2560, 2560, 1, 512, 2560, 2560, 512, 2560]
    - [6, 31499.1]
  - - [3072, 2560, 1, 512, 3072, 3072, 512, 2560]
    - [6, 32458.2]
  - - [512, 3072, 1, 512, 512, 512, 512, 3072]
    - [21, 21039.2]
  - - [1024, 3072, 1, 512, 1024, 1024, 512, 3072]
    - [1, 26199.0]
  - - [1536, 3072, 1, 512, 1536, 1536, 512, 3072]
    - [6, 29460.8]
  - - [2048, 3072, 1, 512, 2048, 2048, 512, 3072]
    - [1, 30827.6]
  - - [2560, 3072, 1, 512, 2560, 2560, 512, 3072]
    - [1, 31993.0]
  - - [3072, 3072, 1, 512, 3072, 3072, 512, 3072]
    - [6, 33276.4]
  - - [512, 512, 1, 1024, 512, 512, 1024, 512]
    - [12, 10971.8]
  - - [1024, 512, 1, 1024, 1024, 1024, 1024, 512]
    - [21, 18310.7]
  - - [1536, 512, 1, 1024, 1536, 1536, 1024, 512]
    - [1, 19266.4]
  - - [2048, 512, 1, 1024, 2048, 2048, 1024, 512]
    - [19, 18428.7]
  - - [2560, 512, 1, 1024, 2560, 2560, 1024, 512]
    - [1, 24497.7]
  - - [3072, 512, 1, 1024, 3072, 3072, 1024, 512]
    - [1, 26869.1]
  - - [512, 1024, 1, 1024, 512, 512, 1024, 1024]
    - [21, 18273.3]
  - - [1024, 1024, 1, 1024, 1024, 1024, 1024, 1024]
    - [6, 24337.7]
  - - [1536, 1024, 1, 1024, 1536, 1536, 1024, 1024]
    - [19, 26873.8]
  - - [2048, 1024, 1, 1024, 2048, 2048, 1024, 1024]
    - [19, 29022.4]
  - - [2560, 1024, 1, 1024, 2560, 2560, 1024, 1024]
    - [19, 30283.1]
  - - [3072, 1024, 1, 1024, 3072, 3072, 1024, 1024]
    - [1, 31153.2]
  - - [512, 1536, 1, 1024, 512, 512, 1024, 1536]
    - [6, 20246.8]
  - - [1024, 1536, 1, 1024, 1024, 1024, 1024, 1536]
    - [1, 27449.5]
  - - [1536, 1536, 1, 1024, 1536, 1536, 1024, 1536]
    - [21, 28920.3]
  - - [2048, 1536, 1, 1024, 2048, 2048, 1024, 1536]
    - [6, 31424.3]
  - - [2560, 1536, 1, 1024, 2560, 2560, 1024, 1536]
    - [1, 31814.4]
  - - [3072, 1536, 1, 1024, 3072, 3072, 1024, 1536]
    - [1, 33218.0]
  - - [512, 2048, 1, 1024, 512, 512, 1024, 2048]
    - [21, 24365.6]
  - - [1024, 2048, 1, 1024, 1024, 1024, 1024, 2048]
    - [21, 29038.1]
  - - [1536, 2048, 1, 1024, 1536, 1536, 1024, 2048]
    - [1, 31145.5]
  - - [2048, 2048, 1, 1024, 2048, 2048, 1024, 2048]
    - [19, 32352.7]
  - - [2560, 2048, 1, 1024, 2560, 2560, 1024, 2048]
    - [19, 33927.1]
  - - [3072, 2048, 1, 1024, 3072, 3072, 1024, 2048]
    - [1, 33613.0]
  - - [512, 2560, 1, 1024, 512, 512, 1024, 2560]
    - [6, 24540.4]
  - - [1024, 2560, 1, 1024, 1024, 1024, 1024, 2560]
    - [22, 29472.2]
  - - [1536, 2560, 1, 1024, 1536, 1536, 1024, 2560]
    - [19, 32023.7]
  - - [2048, 2560, 1, 1024, 2048, 2048, 1024, 2560]
    - [6, 33480.9]
  - - [2560, 2560, 1, 1024, 2560, 2560, 1024, 2560]
    - [1, 33714.7]
  - - [3072, 2560, 1, 1024, 3072, 3072, 1024, 2560]
    - [21, 34741.4]
  - - [512, 3072, 1, 1024, 512, 512, 1024, 3072]
    - [1, 27182.6]
  - - [1024, 3072, 1, 1024, 1024, 1024, 1024, 3072]
    - [6, 31539.8]
  - - [1536, 3072, 1, 1024, 1536, 1536, 1024, 3072]
    - [21, 33705.5]
  - - [2048, 3072, 1, 1024, 2048, 2048, 1024, 3072]
    - [19, 34361.0]
  - - [2560, 3072, 1, 1024, 2560, 2560, 1024, 3072]
    - [19, 35487.5]
  - - [3072, 3072, 1, 1024, 3072, 3072, 1024, 3072]
    - [8, 35326.3]
  - - [512, 512, 1, 2048, 512, 512, 2048, 512]
    - [28, 15679.9]
  - - [1024, 512, 1, 2048, 1024, 1024, 2048, 512]
    - [21, 24296.6]
  - - [1536, 512, 1, 2048, 1536, 1536, 2048, 512]
    - [21, 24278.2]
  - - [2048, 512, 1, 2048, 2048, 2048, 2048, 512]
    - [6, 29739.2]
  - - [2560, 512, 1, 2048, 2560, 2560, 2048, 512]
    - [6, 28423.0]
  - - [3072, 512, 1, 2048, 3072, 3072, 2048, 512]
    - [21, 31795.6]
  - - [512, 1024, 1, 2048, 512, 512, 2048, 1024]
    - [21, 24437.9]
  - - [1024, 1024, 1, 2048, 1024, 1024, 2048, 1024]
    - [6, 29380.4]
  - - [1536, 1024, 1, 2048, 1536, 1536, 2048, 1024]
    - [21, 31789.3]
  - - [2048, 1024, 1, 2048, 2048, 2048, 2048, 1024]
    - [20, 31191.0]
  - - [2560, 1024, 1, 2048, 2560, 2560, 2048, 1024]
    - [21, 33912.0]
  - - [3072, 1024, 1, 2048, 3072, 3072, 2048, 1024]
    - [6, 35255.0]
  - - [512, 1536, 1, 2048, 512, 512, 2048, 1536]
    - [6, 24873.6]
  - - [1024, 1536, 1, 2048, 1024, 1024, 2048, 1536]
    - [6, 31882.3]
  - - [1536, 1536, 1, 2048, 1536, 1536, 2048, 1536]
    - [21, 31570.7]
  - - [2048, 1536, 1, 2048, 2048, 2048, 2048, 1536]
    - [21, 34462.4]
  - - [2560, 1536, 1, 2048, 2560, 2560, 2048, 1536]
    - [21, 34598.5]
  - - [3072, 1536, 1, 2048, 3072, 3072, 2048, 1536]
    - [6, 35573.9]
  - - [512, 2048, 1, 2048, 512, 512, 2048, 2048]
    - [6, 29667.1]
  - - [1024, 2048, 1, 2048, 1024, 1024, 2048, 2048]
    - [6, 33209.9]
  - - [1536, 2048, 1, 2048, 1536, 1536, 2048, 2048]
    - [6, 34438.3]
  - - [2048, 2048, 1, 2048, 2048, 2048, 2048, 2048]
    - [6, 35818.1]
  - - [2560, 2048, 1, 2048, 2560, 2560, 2048, 2048]
    - [6, 36040.1]
  - - [3072, 2048, 1, 2048, 3072, 3072, 2048, 2048]
    - [6, 36782.1]
  - - [512, 2560, 1, 2048, 512, 512, 2048, 2560]
    - [22, 27572.0]
  - - [1024, 2560, 1, 2048, 1024, 1024, 2048, 2560]
    - [1, 33165.8]
  - - [1536, 2560, 1, 2048, 1536, 1536, 2048, 2560]
    - [6, 34165.4]
  - - [2048, 2560, 1, 2048, 2048, 2048, 2048, 2560]
    - [6, 35669.4]
  - - [2560, 2560, 1, 2048, 2560, 2560, 2048, 2560]
    - [21, 35789.5]
  - - [3072, 2560, 1, 2048, 3072, 3072, 2048, 2560]
    - [6, 36272.2]
  - - [512, 3072, 1, 2048, 512, 512, 2048, 3072]
    - [19, 31784.6]
  - - [1024, 3072, 1, 2048, 1024, 1024, 2048, 3072]
    - [6, 35267.6]
  - - [1536, 3072, 1, 2048, 1536, 1536, 2048, 3072]
    - [6, 35707.6]
  - - [2048, 3072, 1, 2048, 2048, 2048, 2048, 3072]
    - [21, 35920.7]
  - - [2560, 3072, 1, 2048, 2560, 2560, 2048, 3072]
    - [21, 36186.1]
  - - [3072, 3072, 1, 2048, 3072, 3072, 2048, 3072]
    - [6, 36613.0]
  - - [512, 512, 1, 3072, 512, 512, 3072, 512]
    - [28, 18056.6]
  - - [1024, 512, 1, 3072, 1024, 1024, 3072, 512]
    - [6, 27553.0]
  - - [1536, 512, 1, 3072, 1536, 1536, 3072, 512]
    - [19, 26363.9]
  - - [2048, 512, 1, 3072, 2048, 2048, 3072, 512]
    - [6, 32272.8]
  - - [2560, 512, 1, 3072, 2560, 2560, 3072, 512]
    - [19, 30756.5]
  - - [3072, 512, 1, 3072, 3072, 3072, 3072, 512]
    - [21, 33875.9]
  - - [512, 1024, 1, 3072, 512, 512, 3072, 1024]
    - [21, 27610.0]
  - - [1024, 1024, 1, 3072, 1024, 1024, 3072, 1024]
    - [21, 31679.6]
  - - [1536, 1024, 1, 3072, 1536, 1536, 3072, 1024]
    - [1, 33794.0]
  - - [2048, 1024, 1, 3072, 2048, 2048, 3072, 1024]
    - [6, 34582.0]
  - - [2560, 1024, 1, 3072, 2560, 2560, 3072, 1024]
    - [6, 34984.0]
  - - [3072, 1024, 1, 3072, 3072, 3072, 3072, 1024]
    - [6, 36031.0]
  - - [512, 1536, 1, 3072, 512, 512, 3072, 1536]
    - [6, 23558.9]
  - - [1024, 1536, 1, 3072, 1024, 1024, 3072, 1536]
    - [1, 33291.3]
  - - [1536, 1536, 1, 3072, 1536, 1536, 3072, 1536]
    - [8, 33039.3]
  - - [2048, 1536, 1, 3072, 2048, 2048, 3072, 1536]
    - [21, 35348.4]
  - - [2560, 1536, 1, 3072, 2560, 2560, 3072, 1536]
    - [1, 35120.0]
  - - [3072, 1536, 1, 3072, 3072, 3072, 3072, 1536]
    - [21, 35699.4]
  - - [512, 2048, 1, 3072, 512, 512, 3072, 2048]
    - [1, 32285.7]
  - - [1024, 2048, 1, 3072, 1024, 1024, 3072, 2048]
    - [6, 34666.7]
  - - [1536, 2048, 1, 3072, 1536, 1536, 3072, 2048]
    - [6, 35985.3]
  - - [2048, 2048, 1, 3072, 2048, 2048, 3072, 2048]
    - [21, 35977.0]
  - - [2560, 2048, 1, 3072, 2560, 2560, 3072, 2048]
    - [6, 37045.4]
  - - [3072, 2048, 1, 3072, 3072, 3072, 3072, 2048]
    - [1, 36987.5]
  - - [512, 2560, 1, 3072, 512, 512, 3072, 2560]
    - [19, 29945.3]
  - - [1024, 2560, 1, 3072, 1024, 1024, 3072, 2560]
    - [19, 35250.2]
  - - [1536, 2560, 1, 3072, 1536, 1536, 3072, 2560]
    - [6, 35889.4]
  - - [2048, 2560, 1, 3072, 2048, 2048, 3072, 2560]
    - [21, 36970.0]
  - - [2560, 2560, 1, 3072, 2560, 2560, 3072, 2560]
    - [8, 36851.2]
  - - [3072, 2560, 1, 3072, 3072, 3072, 3072, 2560]
    - [21, 36784.3]
  - - [512, 3072, 1, 3072, 512, 512, 3072, 3072]
    - [6, 33508.8]
  - - [1024, 3072, 1, 3072, 1024, 1024, 3072, 3072]
    - [19, 36071.5]
  - - [1536, 3072, 1, 3072, 1536, 1536, 3072, 3072]
    - [6, 36754.1]
  - - [2048, 3072, 1, 3072, 2048, 2048, 3072, 3072]
    - [6, 37061.7]
  - - [2560, 3072, 1, 3072, 2560, 2560, 3072, 3072]
    - [6, 36768.6]
  - - [3072, 3072, 1, 3072, 3072, 3072, 3072, 3072]
    - [6, 37017.4]
  - - [1, 1, 1, 1, 1, 1, 1, 1]
    - [15, 6.66533e-05]
  - - [1, 1, 1, 64, 1, 1, 64, 1]
    - [15, 0.00412252]
  - - [1, 64, 1, 1, 1, 1, 1, 64]
    - [16, 0.00426852]
  - - [64, 1, 1, 1, 64, 64, 1, 1]
    - [25, 0.00407916]
  - - [64, 64, 1, 1, 64, 64, 1, 64]
    - [17, 0.266164]
  - - [64, 1, 1, 64, 64, 64, 64, 1]
    - [24, 0.271564]
  - - [1, 64, 1, 64, 1, 1, 64, 64]
    - [18, 0.270658]
  - - [64, 64, 1, 64, 64, 64, 64, 64]
    - [11, 17.2707]
  - - [64, 64, 1, 256, 64, 64, 256, 64]
    - [11, 63.0286]
  - - [64, 64, 1, 512, 64, 64, 512, 64]
    - [10, 115.644]
  - - [64, 64, 1, 1024, 64, 64, 1024, 64]
    - [24, 203.124]
  - - [64, 64, 1, 2048, 64, 64, 2048, 64]
    - [10, 317.817]
  - - [64, 64, 1, 4096, 64, 64, 4096, 64]
    - [10, 442.484]
- null
- null
- DeviceEfficiency
- GridBased
