library/src/amd_detail/rocblaslt/src/Tensile/Logic/asm_full/gfx1201/GridBased/gfx1201_Cijk_Ailk_Bljk_I8II_BH_HAI_SAV_UserArgs.yaml
- {MinimumRequiredVersion: 4.33.0}
- gfx1201
- gfx1201
- [Device 73f0]
    SolutionIndex: 0
    SolutionNameMin: Cijk_Ailk_Bljk_I8II_BH_HAI_SAV_UserArgs_MT128x16x32_MI16x16x1_SN_LDSB0_CLR1_GRVWA16_GRVWB4_GSU1_LBSPPA1024_LBSPPB128_LPB8_MIWT2_1_PGR1_PLR1_SS0_SU32_SUM0_SUS256_SVW8_TLDS1_WG64_2_1_WGM8
    SolutionIndex: 1
    SolutionNameMin: Cijk_Ailk_Bljk_I8II_BH_HAI_SAV_UserArgs_MT256x16x32_MI16x16x1_SN_LDSB0_CLR1_GRVWA16_GRVWB4_GSU1_LBSPPA2048_LBSPPB128_LPB8_MIWT4_1_PGR2_PLR1_SS0_SU32_SUM0_SUS256_SVW8_TLDS1_WG64_2_1_WGM8
    SolutionIndex: 2
    SolutionNameMin: Cijk_Ailk_Bljk_I8II_BH_HAI_SAV_UserArgs_MT256x16x32_MI16x16x1_SN_LDSB0_CLR0_GRVWA16_GRVWB4_GSU1_LBSPPA2048_LBSPPB128_LPB16_MIWT4_1_PGR1_PLR0_SS0_SU32_SUM0_SUS256_SVW8_TLDS0_WG64_2_1_WGM8
    SolutionIndex: 3
    SolutionNameMin: Cijk_Ailk_Bljk_I8II_BH_HAI_SAV_UserArgs_MT256x16x32_MI16x16x1_SN_LDSB0_CLR0_GRVWA16_GRVWB4_GSU1_LBSPPA2048_LBSPPB128_LPB8_MIWT4_1_PGR2_PLR0_SS0_SU32_SUM0_SUS256_SVW8_TLDS1_WG64_2_1_WGM8
    SolutionIndex: 4
    SolutionNameMin: Cijk_Ailk_Bljk_I8II_BH_HAI_SAV_UserArgs_MT64x32x32_MI16x16x1_SN_LDSB0_CLR1_GRVWA16_GRVWB8_GSU1_LBSPPA512_LBSPPB128_LPB8_MIWT2_1_PGR1_PLR1_SS0_SU32_SUM0_SUS256_SVW8_TLDS1_WG32_4_1_WGM8
    SolutionIndex: 5
    SolutionNameMin: Cijk_Ailk_Bljk_I8II_BH_HAI_SAV_UserArgs_MT64x32x32_MI16x16x1_SN_LDSB0_CLR1_GRVWA16_GRVWB8_GSU1_LBSPPA512_LBSPPB128_LPB8_MIWT2_1_PGR2_PLR1_SS0_SU32_SUM0_SUS256_SVW8_TLDS1_WG32_4_1_WGM8
    SolutionIndex: 6
    SolutionNameMin: Cijk_Ailk_Bljk_I8II_BH_HAI_SAV_UserArgs_MT256x16x64_MI16x16x1_SN_LDSB1_CLR1_GRVWA16_GRVWB8_GSU1_LBSPPA2048_LBSPPB128_LPB8_MIWT4_1_PGR1_PLR1_SS0_SU32_SUM0_SUS256_SVW8_TLDS1_WG64_2_1_WGM8
    SolutionIndex: 7
    SolutionNameMin: Cijk_Ailk_Bljk_I8II_BH_HAI_SAV_UserArgs_MT256x16x64_MI16x16x1_SN_LDSB1_CLR1_GRVWA16_GRVWB8_GSU1_LBSPPA2048_LBSPPB128_LPB8_MIWT4_1_PGR2_PLR1_SS0_SU32_SUM0_SUS256_SVW8_TLDS1_WG64_2_1_WGM8
    SolutionIndex: 8
    SolutionNameMin: Cijk_Ailk_Bljk_I8II_BH_HAI_SAV_UserArgs_MT256x16x64_MI16x16x1_SN_LDSB1_CLR1_GRVWA16_GRVWB8_GSU1_LBSPPA2048_LBSPPB128_LPB8_MIWT4_1_PGR1_PLR3_SS0_SU32_SUM0_SUS256_SVW8_TLDS1_WG64_2_1_WGM8
    SolutionIndex: 9
    SolutionNameMin: Cijk_Ailk_Bljk_I8II_BH_HAI_SAV_UserArgs_MT64x32x64_MI16x16x1_SN_LDSB0_CLR1_GRVWA16_GRVWB8_GSU1_LBSPPA512_LBSPPB128_LPB8_MIWT2_1_PGR1_PLR1_SS0_SU32_SUM0_SUS256_SVW8_TLDS1_WG32_4_1_WGM8
    SolutionIndex: 10
    SolutionNameMin: Cijk_Ailk_Bljk_I8II_BH_HAI_SAV_UserArgs_MT64x32x64_MI16x16x1_SN_LDSB0_CLR1_GRVWA16_GRVWB8_GSU1_LBSPPA512_LBSPPB128_LPB8_MIWT2_1_PGR1_PLR3_SS0_SU32_SUM0_SUS256_SVW8_TLDS1_WG32_4_1_WGM8
    SolutionIndex: 11
    SolutionNameMin: Cijk_Ailk_Bljk_I8II_BH_HAI_SAV_UserArgs_MT256x16x32_MI16x16x1_SN_LDSB0_CLR1_GRVWA16_GRVWB4_GSU1_LBSPPA2048_LBSPPB128_LPB8_MIWT4_1_PGR2_PLR1_SS1_SU32_SUM0_SUS256_SVW1_TLDS1_WG64_2_1_WGM8
    SolutionIndex: 12
    SolutionNameMin: Cijk_Ailk_Bljk_I8II_BH_HAI_SAV_UserArgs_MT256x16x32_MI16x16x1_SN_LDSB0_CLR0_GRVWA16_GRVWB4_GSU1_LBSPPA2048_LBSPPB128_LPB8_MIWT4_1_PGR2_PLR0_SS1_SU32_SUM0_SUS256_SVW1_TLDS1_WG64_2_1_WGM8
    SolutionIndex: 13
    SolutionNameMin: Cijk_Ailk_Bljk_I8II_BH_HAI_SAV_UserArgs_MT32x32x32_MI16x16x1_SN_LDSB0_CLR0_GRVWA8_GRVWB8_GSU1_LBSPPA256_LBSPPB128_LPB8_MIWT1_1_PGR2_PLR0_SS1_SU32_SUM0_SUS256_SVW1_TLDS1_WG32_4_1_WGM8
    SolutionIndex: 14
    SolutionNameMin: Cijk_Ailk_Bljk_I8II_BH_HAI_SAV_UserArgs_MT64x32x32_MI16x16x1_SN_LDSB0_CLR1_GRVWA16_GRVWB8_GSU1_LBSPPA512_LBSPPB128_LPB8_MIWT2_1_PGR1_PLR1_SS1_SU32_SUM0_SUS256_SVW1_TLDS1_WG32_4_1_WGM8
    SolutionIndex: 15
    SolutionNameMin: Cijk_Ailk_Bljk_I8II_BH_HAI_SAV_UserArgs_MT64x32x32_MI16x16x1_SN_LDSB0_CLR1_GRVWA16_GRVWB8_GSU1_LBSPPA512_LBSPPB128_LPB8_MIWT2_1_PGR2_PLR1_SS1_SU32_SUM0_SUS256_SVW1_TLDS1_WG32_4_1_WGM8
    SolutionIndex: 16
    SolutionNameMin: Cijk_Ailk_Bljk_I8II_BH_HAI_SAV_UserArgs_MT64x32x32_MI16x16x1_SN_LDSB0_CLR0_GRVWA16_GRVWB8_GSU1_LBSPPA512_LBSPPB128_LPB8_MIWT2_1_PGR1_PLR0_SS1_SU32_SUM0_SUS256_SVW1_TLDS1_WG32_4_1_WGM8
    SolutionIndex: 17
    SolutionNameMin: Cijk_Ailk_Bljk_I8II_BH_HAI_SAV_UserArgs_MT64x32x32_MI16x16x1_SN_LDSB0_CLR0_GRVWA16_GRVWB8_GSU1_LBSPPA512_LBSPPB128_LPB8_MIWT2_1_PGR2_PLR0_SS1_SU32_SUM0_SUS256_SVW1_TLDS1_WG32_4_1_WGM8
    SolutionIndex: 18
    SolutionNameMin: Cijk_Ailk_Bljk_I8II_BH_HAI_SAV_UserArgs_MT32x64x32_MI16x16x1_SN_LDSB0_CLR1_GRVWA8_GRVWB8_GSU1_LBSPPA256_LBSPPB128_LPB8_MIWT2_1_PGR1_PLR1_SS1_SU32_SUM0_SUS256_SVW1_TLDS1_WG16_8_1_WGM8
    SolutionIndex: 19
    SolutionNameMin: Cijk_Ailk_Bljk_I8II_BH_HAI_SAV_UserArgs_MT32x64x32_MI16x16x1_SN_LDSB0_CLR1_GRVWA8_GRVWB8_GSU1_LBSPPA256_LBSPPB128_LPB8_MIWT2_1_PGR2_PLR1_SS1_SU32_SUM0_SUS256_SVW1_TLDS1_WG16_8_1_WGM8
    SolutionIndex: 20
    SolutionNameMin: Cijk_Ailk_Bljk_I8II_BH_HAI_SAV_UserArgs_MT32x64x32_MI16x16x1_SN_LDSB0_CLR0_GRVWA8_GRVWB8_GSU1_LBSPPA256_LBSPPB128_LPB8_MIWT2_1_PGR1_PLR0_SS1_SU32_SUM0_SUS256_SVW1_TLDS1_WG16_8_1_WGM8
    SolutionIndex: 21
    SolutionNameMin: Cijk_Ailk_Bljk_I8II_BH_HAI_SAV_UserArgs_MT64x16x64_MI16x16x1_SN_LDSB0_CLR1_GRVWA16_GRVWB8_GSU1_LBSPPA512_LBSPPB128_LPB8_MIWT1_1_PGR1_PLR1_SS1_SU32_SUM0_SUS256_SVW1_TLDS1_WG64_2_1_WGM8
    SolutionIndex: 22
    SolutionNameMin: Cijk_Ailk_Bljk_I8II_BH_HAI_SAV_UserArgs_MT64x16x64_MI16x16x1_SN_LDSB0_CLR1_GRVWA16_GRVWB8_GSU1_LBSPPA512_LBSPPB128_LPB8_MIWT1_1_PGR1_PLR3_SS1_SU32_SUM0_SUS256_SVW1_TLDS1_WG64_2_1_WGM8
    SolutionIndex: 23
    SolutionNameMin: Cijk_Ailk_Bljk_I8II_BH_HAI_SAV_UserArgs_MT256x16x64_MI16x16x1_SN_LDSB1_CLR1_GRVWA16_GRVWB8_GSU1_LBSPPA2048_LBSPPB128_LPB16_MIWT4_1_PGR1_PLR1_SS1_SU32_SUM0_SUS256_SVW1_TLDS0_WG64_2_1_WGM8
    SolutionIndex: 24
    SolutionNameMin: Cijk_Ailk_Bljk_I8II_BH_HAI_SAV_UserArgs_MT256x16x64_MI16x16x1_SN_LDSB1_CLR1_GRVWA16_GRVWB8_GSU1_LBSPPA2048_LBSPPB128_LPB8_MIWT4_1_PGR2_PLR1_SS1_SU32_SUM0_SUS256_SVW1_TLDS1_WG64_2_1_WGM8
    SolutionIndex: 25
    SolutionNameMin: Cijk_Ailk_Bljk_I8II_BH_HAI_SAV_UserArgs_MT256x16x64_MI16x16x1_SN_LDSB1_CLR1_GRVWA16_GRVWB8_GSU1_LBSPPA2048_LBSPPB128_LPB16_MIWT4_1_PGR1_PLR3_SS1_SU32_SUM0_SUS256_SVW1_TLDS0_WG64_2_1_WGM8
    SolutionIndex: 26
    SolutionNameMin: Cijk_Ailk_Bljk_I8II_BH_HAI_SAV_UserArgs_MT256x16x64_MI16x16x1_SN_LDSB1_CLR1_GRVWA16_GRVWB8_GSU1_LBSPPA2048_LBSPPB128_LPB8_MIWT4_1_PGR1_PLR3_SS1_SU32_SUM0_SUS256_SVW1_TLDS1_WG64_2_1_WGM8
    SolutionIndex: 27
    SolutionNameMin: Cijk_Ailk_Bljk_I8II_BH_HAI_SAV_UserArgs_MT256x16x64_MI16x16x1_SN_LDSB1_CLR1_GRVWA16_GRVWB8_GSU1_LBSPPA2048_LBSPPB128_LPB8_MIWT4_1_PGR2_PLR3_SS1_SU32_SUM0_SUS256_SVW1_TLDS1_WG64_2_1_WGM8
    SolutionIndex: 28
    SolutionNameMin: Cijk_Ailk_Bljk_I8II_BH_HAI_SAV_UserArgs_MT32x32x64_MI16x16x1_SN_LDSB0_CLR1_GRVWA16_GRVWB8_GSU1_LBSPPA256_LBSPPB128_LPB8_MIWT1_1_PGR1_PLR1_SS1_SU32_SUM0_SUS256_SVW1_TLDS1_WG32_4_1_WGM8
    SolutionIndex: 29
    SolutionNameMin: Cijk_Ailk_Bljk_I8II_BH_HAI_SAV_UserArgs_MT32x32x64_MI16x16x1_SN_LDSB0_CLR0_GRVWA16_GRVWB8_GSU1_LBSPPA256_LBSPPB128_LPB8_MIWT1_1_PGR1_PLR0_SS1_SU32_SUM0_SUS256_SVW1_TLDS1_WG32_4_1_WGM8
    SolutionIndex: 30
    SolutionNameMin: Cijk_Ailk_Bljk_I8II_BH_HAI_SAV_UserArgs_MT32x32x64_MI16x16x1_SN_LDSB0_CLR0_GRVWA16_GRVWB8_GSU1_LBSPPA256_LBSPPB128_LPB8_MIWT1_1_PGR2_PLR0_SS1_SU32_SUM0_SUS256_SVW1_TLDS1_WG32_4_1_WGM8
    SolutionIndex: 31
    SolutionNameMin: Cijk_Ailk_Bljk_I8II_BH_HAI_SAV_UserArgs_MT64x32x64_MI16x16x1_SN_LDSB0_CLR1_GRVWA16_GRVWB8_GSU1_LBSPPA512_LBSPPB128_LPB8_MIWT2_1_PGR1_PLR1_SS1_SU32_SUM0_SUS256_SVW1_TLDS1_WG32_4_1_WGM8
    SolutionIndex: 32
    SolutionNameMin: Cijk_Ailk_Bljk_I8II_BH_HAI_SAV_UserArgs_MT64x32x64_MI16x16x1_SN_LDSB0_CLR1_GRVWA16_GRVWB8_GSU1_LBSPPA512_LBSPPB128_LPB8_MIWT2_1_PGR2_PLR1_SS1_SU32_SUM0_SUS256_SVW1_TLDS1_WG32_4_1_WGM8
    SolutionIndex: 33
    SolutionNameMin: Cijk_Ailk_Bljk_I8II_BH_HAI_SAV_UserArgs_MT64x32x64_MI16x16x1_SN_LDSB0_CLR1_GRVWA16_GRVWB8_GSU1_LBSPPA512_LBSPPB128_LPB8_MIWT2_1_PGR1_PLR3_SS1_SU32_SUM0_SUS256_SVW1_TLDS1_WG32_4_1_WGM8
    SolutionIndex: 34
    SolutionNameMin: Cijk_Ailk_Bljk_I8II_BH_HAI_SAV_UserArgs_MT64x32x64_MI16x16x1_SN_LDSB0_CLR0_GRVWA16_GRVWB8_GSU1_LBSPPA512_LBSPPB128_LPB8_MIWT2_1_PGR1_PLR0_SS1_SU32_SUM0_SUS256_SVW1_TLDS1_WG32_4_1_WGM8
    SolutionIndex: 35
    SolutionNameMin: Cijk_Ailk_Bljk_I8II_BH_HAI_SAV_UserArgs_MT16x64x64_MI16x16x1_SN_LDSB0_CLR1_GRVWA8_GRVWB16_GSU1_LBSPPA128_LBSPPB512_LPB16_MIWT1_1_PGR1_PLR1_SS1_SU32_SUM0_SUS256_SVW1_TLDS0_WG16_8_1_WGM8
    SolutionIndex: 36
    SolutionNameMin: Cijk_Ailk_Bljk_I8II_BH_HAI_SAV_UserArgs_MT16x64x64_MI16x16x1_SN_LDSB0_CLR1_GRVWA8_GRVWB8_GSU1_LBSPPA128_LBSPPB128_LPB8_MIWT1_1_PGR1_PLR3_SS1_SU32_SUM0_SUS256_SVW1_TLDS1_WG16_8_1_WGM8
    SolutionIndex: 37
    SolutionNameMin: Cijk_Ailk_Bljk_I8II_BH_HAI_SAV_UserArgs_MT32x64x64_MI16x16x1_SN_LDSB0_CLR1_GRVWA16_GRVWB8_GSU1_LBSPPA256_LBSPPB128_LPB8_MIWT2_1_PGR1_PLR1_SS1_SU32_SUM0_SUS256_SVW1_TLDS1_WG16_8_1_WGM8
    SolutionIndex: 38
    SolutionNameMin: Cijk_Ailk_Bljk_I8II_BH_HAI_SAV_UserArgs_MT32x64x64_MI16x16x1_SN_LDSB0_CLR1_GRVWA16_GRVWB8_GSU1_LBSPPA256_LBSPPB128_LPB8_MIWT2_1_PGR1_PLR3_SS1_SU32_SUM0_SUS256_SVW1_TLDS1_WG16_8_1_WGM8
    SolutionIndex: 39
    SolutionNameMin: Cijk_Ailk_Bljk_I8II_BH_HAI_SAV_UserArgs_MT32x64x64_MI16x16x1_SN_LDSB0_CLR1_GRVWA16_GRVWB8_GSU1_LBSPPA256_LBSPPB128_LPB8_MIWT2_1_PGR2_PLR3_SS1_SU32_SUM0_SUS256_SVW1_TLDS1_WG16_8_1_WGM8
    SolutionIndex: 40
    SolutionNameMin: Cijk_Ailk_Bljk_I8II_BH_HAI_SAV_UserArgs_MT32x64x64_MI16x16x1_SN_LDSB0_CLR0_GRVWA16_GRVWB8_GSU1_LBSPPA256_LBSPPB128_LPB8_MIWT2_1_PGR1_PLR0_SS1_SU32_SUM0_SUS256_SVW1_TLDS1_WG16_8_1_WGM8
- - - [512, 512, 1, 64, 512, 512, 512, 64]
    - [32, 1052.19]
  - - [1024, 512, 1, 64, 1024, 1024, 1024, 64]
    - [12, 2180.42]
  - - [1536, 512, 1, 64, 1536, 1536, 1536, 64]
    - [19, 3080.18]
  - - [2048, 512, 1, 64, 2048, 2048, 2048, 64]
    - [27, 3553.37]
  - - [2560, 512, 1, 64, 2560, 2560, 2560, 64]
    - [25, 4493.09]
  - - [3072, 512, 1, 64, 3072, 3072, 3072, 64]
    - [27, 5367.28]
  - - [512, 1024, 1, 64, 512, 512, 512, 64]
    - [38, 2219.43]
  - - [1024, 1024, 1, 64, 1024, 1024, 1024, 64]
    - [0, 3614.81]
  - - [1536, 1024, 1, 64, 1536, 1536, 1536, 64]
    - [19, 5173.76]
  - - [2048, 1024, 1, 64, 2048, 2048, 2048, 64]
    - [2, 6566.91]
  - - [2560, 1024, 1, 64, 2560, 2560, 2560, 64]
    - [11, 7846.97]
  - - [3072, 1024, 1, 64, 3072, 3072, 3072, 64]
    - [3, 8788.29]
  - - [512, 1536, 1, 64, 512, 512, 512, 64]
    - [37, 2944.66]
  - - [1024, 1536, 1, 64, 1024, 1024, 1024, 64]
    - [27, 5358.56]
  - - [1536, 1536, 1, 64, 1536, 1536, 1536, 64]
    - [24, 7240.4]
  - - [2048, 1536, 1, 64, 2048, 2048, 2048, 64]
    - [8, 8509.33]
  - - [2560, 1536, 1, 64, 2560, 2560, 2560, 64]
    - [6, 10713.9]
  - - [3072, 1536, 1, 64, 3072, 3072, 3072, 64]
    - [6, 11890.5]
  - - [512, 2048, 1, 64, 512, 512, 512, 64]
    - [26, 3965.78]
  - - [1024, 2048, 1, 64, 1024, 1024, 1024, 64]
    - [23, 6432.98]
  - - [1536, 2048, 1, 64, 1536, 1536, 1536, 64]
    - [27, 8667.22]
  - - [2048, 2048, 1, 64, 2048, 2048, 2048, 64]
    - [24, 10556.7]
  - - [2560, 2048, 1, 64, 2560, 2560, 2560, 64]
    - [7, 12310.8]
  - - [3072, 2048, 1, 64, 3072, 3072, 3072, 64]
    - [7, 14071.9]
  - - [512, 2560, 1, 64, 512, 512, 512, 64]
    - [26, 4729.04]
  - - [1024, 2560, 1, 64, 1024, 1024, 1024, 64]
    - [27, 7863.71]
  - - [1536, 2560, 1, 64, 1536, 1536, 1536, 64]
    - [24, 10200.4]
  - - [2048, 2560, 1, 64, 2048, 2048, 2048, 64]
    - [11, 12116.8]
  - - [2560, 2560, 1, 64, 2560, 2560, 2560, 64]
    - [8, 14396.1]
  - - [3072, 2560, 1, 64, 3072, 3072, 3072, 64]
    - [6, 15802.7]
  - - [512, 3072, 1, 64, 512, 512, 512, 64]
    - [26, 4933.63]
  - - [1024, 3072, 1, 64, 1024, 1024, 1024, 64]
    - [1, 8482.45]
  - - [1536, 3072, 1, 64, 1536, 1536, 1536, 64]
    - [7, 11656.0]
  - - [2048, 3072, 1, 64, 2048, 2048, 2048, 64]
    - [7, 12937.3]
  - - [2560, 3072, 1, 64, 2560, 2560, 2560, 64]
    - [6, 15379.2]
  - - [3072, 3072, 1, 64, 3072, 3072, 3072, 64]
    - [7, 16595.8]
  - - [512, 512, 1, 256, 512, 512, 512, 256]
    - [34, 3903.38]
  - - [1024, 512, 1, 256, 1024, 1024, 1024, 256]
    - [37, 7292.66]
  - - [1536, 512, 1, 256, 1536, 1536, 1536, 256]
    - [15, 11254.2]
  - - [2048, 512, 1, 256, 2048, 2048, 2048, 256]
    - [33, 13683.8]
  - - [2560, 512, 1, 256, 2560, 2560, 2560, 256]
    - [17, 15868.7]
  - - [3072, 512, 1, 256, 3072, 3072, 3072, 256]
    - [14, 18176.8]
  - - [512, 1024, 1, 256, 512, 512, 512, 256]
    - [34, 7568.6]
  - - [1024, 1024, 1, 256, 1024, 1024, 1024, 256]
    - [38, 13440.3]
  - - [1536, 1024, 1, 256, 1536, 1536, 1536, 256]
    - [4, 17197.1]
  - - [2048, 1024, 1, 256, 2048, 2048, 2048, 256]
    - [15, 21677.3]
  - - [2560, 1024, 1, 256, 2560, 2560, 2560, 256]
    - [14, 23917.9]
  - - [3072, 1024, 1, 256, 3072, 3072, 3072, 256]
    - [20, 26514.8]
  - - [512, 1536, 1, 256, 512, 512, 512, 256]
    - [18, 11264.0]
  - - [1024, 1536, 1, 256, 1024, 1024, 1024, 256]
    - [18, 18078.9]
  - - [1536, 1536, 1, 256, 1536, 1536, 1536, 256]
    - [14, 23343.6]
  - - [2048, 1536, 1, 256, 2048, 2048, 2048, 256]
    - [15, 27400.2]
  - - [2560, 1536, 1, 256, 2560, 2560, 2560, 256]
    - [15, 30534.6]
  - - [3072, 1536, 1, 256, 3072, 3072, 3072, 256]
    - [16, 33241.9]
  - - [512, 2048, 1, 256, 512, 512, 512, 256]
    - [37, 13535.1]
  - - [1024, 2048, 1, 256, 1024, 1024, 1024, 256]
    - [9, 20887.1]
  - - [1536, 2048, 1, 256, 1536, 1536, 1536, 256]
    - [14, 27550.7]
  - - [2048, 2048, 1, 256, 2048, 2048, 2048, 256]
    - [4, 30642.4]
  - - [2560, 2048, 1, 256, 2560, 2560, 2560, 256]
    - [16, 35042.0]
  - - [3072, 2048, 1, 256, 3072, 3072, 3072, 256]
    - [15, 37874.5]
  - - [512, 2560, 1, 256, 512, 512, 512, 256]
    - [18, 14951.6]
  - - [1024, 2560, 1, 256, 1024, 1024, 1024, 256]
    - [14, 25243.1]
  - - [1536, 2560, 1, 256, 1536, 1536, 1536, 256]
    - [14, 30896.3]
  - - [2048, 2560, 1, 256, 2048, 2048, 2048, 256]
    - [17, 34918.4]
  - - [2560, 2560, 1, 256, 2560, 2560, 2560, 256]
    - [18, 38015.1]
  - - [3072, 2560, 1, 256, 3072, 3072, 3072, 256]
    - [4, 40727.2]
  - - [512, 3072, 1, 256, 512, 512, 512, 256]
    - [31, 17054.7]
  - - [1024, 3072, 1, 256, 1024, 1024, 1024, 256]
    - [15, 27050.0]
  - - [1536, 3072, 1, 256, 1536, 1536, 1536, 256]
    - [14, 33123.4]
  - - [2048, 3072, 1, 256, 2048, 2048, 2048, 256]
    - [14, 37398.3]
  - - [2560, 3072, 1, 256, 2560, 2560, 2560, 256]
    - [14, 40542.2]
  - - [3072, 3072, 1, 256, 3072, 3072, 3072, 256]
    - [15, 42382.7]
  - - [512, 512, 1, 512, 512, 512, 512, 512]
    - [34, 8328.75]
  - - [1024, 512, 1, 512, 1024, 1024, 1024, 512]
    - [39, 13638.6]
  - - [1536, 512, 1, 512, 1536, 1536, 1536, 512]
    - [37, 18326.6]
  - - [2048, 512, 1, 512, 2048, 2048, 2048, 512]
    - [40, 21520.5]
  - - [2560, 512, 1, 512, 2560, 2560, 2560, 512]
    - [10, 24326.3]
  - - [3072, 512, 1, 512, 3072, 3072, 3072, 512]
    - [37, 28604.6]
  - - [512, 1024, 1, 512, 512, 512, 512, 512]
    - [37, 13487.5]
  - - [1024, 1024, 1, 512, 1024, 1024, 1024, 512]
    - [37, 21559.3]
  - - [1536, 1024, 1, 512, 1536, 1536, 1536, 512]
    - [34, 28934.0]
  - - [2048, 1024, 1, 512, 2048, 2048, 2048, 512]
    - [33, 34405.4]
  - - [2560, 1024, 1, 512, 2560, 2560, 2560, 512]
    - [4, 38518.0]
  - - [3072, 1024, 1, 512, 3072, 3072, 3072, 512]
    - [15, 41454.0]
  - - [512, 1536, 1, 512, 512, 512, 512, 512]
    - [31, 19252.3]
  - - [1024, 1536, 1, 512, 1024, 1024, 1024, 512]
    - [37, 28153.6]
  - - [1536, 1536, 1, 512, 1536, 1536, 1536, 512]
    - [14, 36109.2]
  - - [2048, 1536, 1, 512, 2048, 2048, 2048, 512]
    - [15, 41523.5]
  - - [2560, 1536, 1, 512, 2560, 2560, 2560, 512]
    - [10, 44521.6]
  - - [3072, 1536, 1, 512, 3072, 3072, 3072, 512]
    - [33, 47500.4]
  - - [512, 2048, 1, 512, 512, 512, 512, 512]
    - [33, 22934.4]
  - - [1024, 2048, 1, 512, 1024, 1024, 1024, 512]
    - [33, 34006.6]
  - - [1536, 2048, 1, 512, 1536, 1536, 1536, 512]
    - [16, 39673.7]
  - - [2048, 2048, 1, 512, 2048, 2048, 2048, 512]
    - [34, 44874.8]
  - - [2560, 2048, 1, 512, 2560, 2560, 2560, 512]
    - [31, 48661.8]
  - - [3072, 2048, 1, 512, 3072, 3072, 3072, 512]
    - [14, 53810.4]
  - - [512, 2560, 1, 512, 512, 512, 512, 512]
    - [15, 25922.3]
  - - [1024, 2560, 1, 512, 1024, 1024, 1024, 512]
    - [15, 38490.3]
  - - [1536, 2560, 1, 512, 1536, 1536, 1536, 512]
    - [4, 43941.9]
  - - [2048, 2560, 1, 512, 2048, 2048, 2048, 512]
    - [4, 48719.2]
  - - [2560, 2560, 1, 512, 2560, 2560, 2560, 512]
    - [15, 51956.7]
  - - [3072, 2560, 1, 512, 3072, 3072, 3072, 512]
    - [5, 54620.0]
  - - [512, 3072, 1, 512, 512, 512, 512, 512]
    - [33, 27750.5]
  - - [1024, 3072, 1, 512, 1024, 1024, 1024, 512]
    - [31, 39396.6]
  - - [1536, 3072, 1, 512, 1536, 1536, 1536, 512]
    - [14, 46891.0]
  - - [2048, 3072, 1, 512, 2048, 2048, 2048, 512]
    - [4, 50889.0]
  - - [2560, 3072, 1, 512, 2560, 2560, 2560, 512]
    - [17, 53736.5]
  - - [3072, 3072, 1, 512, 3072, 3072, 3072, 512]
    - [15, 56721.7]
  - - [512, 512, 1, 1024, 512, 512, 512, 1024]
    - [40, 13504.5]
  - - [1024, 512, 1, 1024, 1024, 1024, 1024, 1024]
    - [18, 22676.7]
  - - [1536, 512, 1, 1024, 1536, 1536, 1536, 1024]
    - [33, 29239.2]
  - - [2048, 512, 1, 1024, 2048, 2048, 2048, 1024]
    - [33, 33877.9]
  - - [2560, 512, 1, 1024, 2560, 2560, 2560, 1024]
    - [33, 39005.4]
  - - [3072, 512, 1, 1024, 3072, 3072, 3072, 1024]
    - [34, 41577.1]
  - - [512, 1024, 1, 1024, 512, 512, 512, 1024]
    - [33, 23062.5]
  - - [1024, 1024, 1, 1024, 1024, 1024, 1024, 1024]
    - [40, 32759.0]
  - - [1536, 1024, 1, 1024, 1536, 1536, 1536, 1024]
    - [10, 43243.7]
  - - [2048, 1024, 1, 1024, 2048, 2048, 2048, 1024]
    - [33, 47254.0]
  - - [2560, 1024, 1, 1024, 2560, 2560, 2560, 1024]
    - [31, 51639.6]
  - - [3072, 1024, 1, 1024, 3072, 3072, 3072, 1024]
    - [31, 52402.8]
  - - [512, 1536, 1, 1024, 512, 512, 512, 1024]
    - [33, 30059.4]
  - - [1024, 1536, 1, 1024, 1024, 1024, 1024, 1024]
    - [34, 41945.8]
  - - [1536, 1536, 1, 1024, 1536, 1536, 1536, 1024]
    - [33, 49888.9]
  - - [2048, 1536, 1, 1024, 2048, 2048, 2048, 1024]
    - [33, 54063.7]
  - - [2560, 1536, 1, 1024, 2560, 2560, 2560, 1024]
    - [14, 56232.9]
  - - [3072, 1536, 1, 1024, 3072, 3072, 3072, 1024]
    - [15, 58217.7]
  - - [512, 2048, 1, 1024, 512, 512, 512, 1024]
    - [33, 34521.0]
  - - [1024, 2048, 1, 1024, 1024, 1024, 1024, 1024]
    - [31, 47114.1]
  - - [1536, 2048, 1, 1024, 1536, 1536, 1536, 1024]
    - [14, 52755.5]
  - - [2048, 2048, 1, 1024, 2048, 2048, 2048, 1024]
    - [14, 57634.7]
  - - [2560, 2048, 1, 1024, 2560, 2560, 2560, 1024]
    - [31, 61220.2]
  - - [3072, 2048, 1, 1024, 3072, 3072, 3072, 1024]
    - [31, 62137.8]
  - - [512, 2560, 1, 1024, 512, 512, 512, 1024]
    - [10, 38451.2]
  - - [1024, 2560, 1, 1024, 1024, 1024, 1024, 1024]
    - [15, 49602.8]
  - - [1536, 2560, 1, 1024, 1536, 1536, 1536, 1024]
    - [9, 55502.8]
  - - [2048, 2560, 1, 1024, 2048, 2048, 2048, 1024]
    - [14, 59929.3]
  - - [2560, 2560, 1, 1024, 2560, 2560, 2560, 1024]
    - [9, 63233.0]
  - - [3072, 2560, 1, 1024, 3072, 3072, 3072, 1024]
    - [31, 66112.2]
  - - [512, 3072, 1, 1024, 512, 512, 512, 1024]
    - [10, 42805.8]
  - - [1024, 3072, 1, 1024, 1024, 1024, 1024, 1024]
    - [31, 54081.4]
  - - [1536, 3072, 1, 1024, 1536, 1536, 1536, 1024]
    - [33, 59353.0]
  - - [2048, 3072, 1, 1024, 2048, 2048, 2048, 1024]
    - [31, 63054.6]
  - - [2560, 3072, 1, 1024, 2560, 2560, 2560, 1024]
    - [10, 64782.6]
  - - [3072, 3072, 1, 1024, 3072, 3072, 3072, 1024]
    - [10, 66042.3]
  - - [512, 512, 1, 2048, 512, 512, 512, 2048]
    - [33, 24035.1]
  - - [1024, 512, 1, 2048, 1024, 1024, 1024, 2048]
    - [31, 34722.5]
  - - [1536, 512, 1, 2048, 1536, 1536, 1536, 2048]
    - [33, 42652.8]
  - - [2048, 512, 1, 2048, 2048, 2048, 2048, 2048]
    - [33, 46989.9]
  - - [2560, 512, 1, 2048, 2560, 2560, 2560, 2048]
    - [10, 50859.8]
  - - [3072, 512, 1, 2048, 3072, 3072, 3072, 2048]
    - [15, 54310.3]
  - - [512, 1024, 1, 2048, 512, 512, 512, 2048]
    - [37, 35052.4]
  - - [1024, 1024, 1, 2048, 1024, 1024, 1024, 2048]
    - [33, 47552.8]
  - - [1536, 1024, 1, 2048, 1536, 1536, 1536, 2048]
    - [10, 52716.2]
  - - [2048, 1024, 1, 2048, 2048, 2048, 2048, 2048]
    - [31, 58604.0]
  - - [2560, 1024, 1, 2048, 2560, 2560, 2560, 2048]
    - [33, 62494.8]
  - - [3072, 1024, 1, 2048, 3072, 3072, 3072, 2048]
    - [37, 63484.3]
  - - [512, 1536, 1, 2048, 512, 512, 512, 2048]
    - [33, 42326.6]
  - - [1024, 1536, 1, 2048, 1024, 1024, 1024, 2048]
    - [33, 53792.4]
  - - [1536, 1536, 1, 2048, 1536, 1536, 1536, 2048]
    - [15, 60352.0]
  - - [2048, 1536, 1, 2048, 2048, 2048, 2048, 2048]
    - [33, 63742.1]
  - - [2560, 1536, 1, 2048, 2560, 2560, 2560, 2048]
    - [31, 66363.1]
  - - [3072, 1536, 1, 2048, 3072, 3072, 3072, 2048]
    - [33, 67678.3]
  - - [512, 2048, 1, 2048, 512, 512, 512, 2048]
    - [10, 46279.5]
  - - [1024, 2048, 1, 2048, 1024, 1024, 1024, 2048]
    - [9, 56915.6]
  - - [1536, 2048, 1, 2048, 1536, 1536, 1536, 2048]
    - [14, 62164.8]
  - - [2048, 2048, 1, 2048, 2048, 2048, 2048, 2048]
    - [31, 65619.1]
  - - [2560, 2048, 1, 2048, 2560, 2560, 2560, 2048]
    - [9, 67535.4]
  - - [3072, 2048, 1, 2048, 3072, 3072, 3072, 2048]
    - [33, 69193.5]
  - - [512, 2560, 1, 2048, 512, 512, 512, 2048]
    - [33, 51156.4]
  - - [1024, 2560, 1, 2048, 1024, 1024, 1024, 2048]
    - [10, 61167.6]
  - - [1536, 2560, 1, 2048, 1536, 1536, 1536, 2048]
    - [9, 65658.4]
  - - [2048, 2560, 1, 2048, 2048, 2048, 2048, 2048]
    - [10, 68463.2]
  - - [2560, 2560, 1, 2048, 2560, 2560, 2560, 2048]
    - [37, 68664.8]
  - - [3072, 2560, 1, 2048, 3072, 3072, 3072, 2048]
    - [4, 71075.3]
  - - [512, 3072, 1, 2048, 512, 512, 512, 2048]
    - [31, 52846.4]
  - - [1024, 3072, 1, 2048, 1024, 1024, 1024, 2048]
    - [9, 62116.6]
  - - [1536, 3072, 1, 2048, 1536, 1536, 1536, 2048]
    - [33, 66110.3]
  - - [2048, 3072, 1, 2048, 2048, 2048, 2048, 2048]
    - [33, 68808.5]
  - - [2560, 3072, 1, 2048, 2560, 2560, 2560, 2048]
    - [33, 70845.1]
  - - [3072, 3072, 1, 2048, 3072, 3072, 3072, 2048]
    - [33, 72024.3]
  - - [512, 512, 1, 3072, 512, 512, 512, 3072]
    - [33, 28820.1]
  - - [1024, 512, 1, 3072, 1024, 1024, 1024, 3072]
    - [37, 41241.2]
  - - [1536, 512, 1, 3072, 1536, 1536, 1536, 3072]
    - [33, 50190.0]
  - - [2048, 512, 1, 3072, 2048, 2048, 2048, 3072]
    - [33, 53751.6]
  - - [2560, 512, 1, 3072, 2560, 2560, 2560, 3072]
    - [33, 57635.9]
  - - [3072, 512, 1, 3072, 3072, 3072, 3072, 3072]
    - [10, 59657.8]
  - - [512, 1024, 1, 3072, 512, 512, 512, 3072]
    - [37, 41246.5]
  - - [1024, 1024, 1, 3072, 1024, 1024, 1024, 3072]
    - [9, 54136.4]
  - - [1536, 1024, 1, 3072, 1536, 1536, 1536, 3072]
    - [33, 60160.3]
  - - [2048, 1024, 1, 3072, 2048, 2048, 2048, 3072]
    - [9, 63268.9]
  - - [2560, 1024, 1, 3072, 2560, 2560, 2560, 3072]
    - [33, 65586.2]
  - - [3072, 1024, 1, 3072, 3072, 3072, 3072, 3072]
    - [33, 66360.5]
  - - [512, 1536, 1, 3072, 512, 512, 512, 3072]
    - [10, 49237.1]
  - - [1024, 1536, 1, 3072, 1024, 1024, 1024, 3072]
    - [14, 58889.3]
  - - [1536, 1536, 1, 3072, 1536, 1536, 1536, 3072]
    - [37, 64961.5]
  - - [2048, 1536, 1, 3072, 2048, 2048, 2048, 3072]
    - [33, 67675.6]
  - - [2560, 1536, 1, 3072, 2560, 2560, 2560, 3072]
    - [10, 68890.6]
  - - [3072, 1536, 1, 3072, 3072, 3072, 3072, 3072]
    - [33, 70860.2]
  - - [512, 2048, 1, 3072, 512, 512, 512, 3072]
    - [10, 53653.1]
  - - [1024, 2048, 1, 3072, 1024, 1024, 1024, 3072]
    - [10, 63811.9]
  - - [1536, 2048, 1, 3072, 1536, 1536, 1536, 3072]
    - [33, 67305.2]
  - - [2048, 2048, 1, 3072, 2048, 2048, 2048, 3072]
    - [33, 70104.4]
  - - [2560, 2048, 1, 3072, 2560, 2560, 2560, 3072]
    - [33, 70857.7]
  - - [3072, 2048, 1, 3072, 3072, 3072, 3072, 3072]
    - [33, 72276.5]
  - - [512, 2560, 1, 3072, 512, 512, 512, 3072]
    - [9, 57364.5]
  - - [1024, 2560, 1, 3072, 1024, 1024, 1024, 3072]
    - [9, 65658.4]
  - - [1536, 2560, 1, 3072, 1536, 1536, 1536, 3072]
    - [33, 69626.4]
  - - [2048, 2560, 1, 3072, 2048, 2048, 2048, 3072]
    - [38, 69634.4]
  - - [2560, 2560, 1, 3072, 2560, 2560, 2560, 3072]
    - [37, 72596.8]
  - - [3072, 2560, 1, 3072, 3072, 3072, 3072, 3072]
    - [33, 72901.8]
  - - [512, 3072, 1, 3072, 512, 512, 512, 3072]
    - [33, 60280.4]
  - - [1024, 3072, 1, 3072, 1024, 1024, 1024, 3072]
    - [33, 67173.7]
  - - [1536, 3072, 1, 3072, 1536, 1536, 1536, 3072]
    - [33, 70317.8]
  - - [2048, 3072, 1, 3072, 2048, 2048, 2048, 3072]
    - [31, 72131.9]
  - - [2560, 3072, 1, 3072, 2560, 2560, 2560, 3072]
    - [37, 72896.3]
  - - [3072, 3072, 1, 3072, 3072, 3072, 3072, 3072]
    - [33, 73185.6]
  - - [64, 1, 1, 1, 64, 64, 64, 1]
    - [13, 0.00412119]
  - - [64, 64, 1, 1, 64, 64, 64, 1]
    - [35, 0.26165]
  - - [64, 1, 1, 64, 64, 64, 64, 64]
    - [28, 0.249361]
  - - [64, 64, 1, 64, 64, 64, 64, 64]
    - [30, 17.0234]
  - - [64, 64, 1, 256, 64, 64, 64, 256]
    - [28, 67.0681]
  - - [64, 64, 1, 512, 64, 64, 64, 512]
    - [36, 127.169]
  - - [64, 64, 1, 1024, 64, 64, 64, 1024]
    - [22, 241.225]
  - - [64, 64, 1, 2048, 64, 64, 64, 2048]
    - [29, 411.337]
  - - [64, 64, 1, 4096, 64, 64, 64, 4096]
    - [21, 661.758]
- null
- null
- DeviceEfficiency
- GridBased
