library/src/amd_detail/rocblaslt/src/Tensile/Logic/asm_full/navi3.5/Equality/navi3.5_Cijk_Alik_Bljk_I8II_BH_UserArgs.yaml
- {MinimumRequiredVersion: 4.33.0}
- navi3.5
- gfx1150
- [Device 73f0]
    SolutionIndex: 0
    SolutionNameMin: Cijk_Alik_Bljk_I8II_BH_UserArgs_MT128x16x64_MI16x16x1_SN_GRVWA16_GRVWB8_GSU1_LBSPPA128_LBSPPB128_LPA32_LPB32_MIWT2_1_SS0_SU0_SUM0_SUS0_TLDS1_WG64_2_1_WGM18
    SolutionIndex: 1
    SolutionNameMin: Cijk_Alik_Bljk_I8II_BH_UserArgs_MT16x64x64_MI16x16x1_SN_GRVWA8_GRVWB16_GSU4_LBSPPA128_LBSPPB128_LPA32_LPB32_MIWT1_1_SS0_SU0_SUM0_SUS0_TLDS1_WG16_8_1_WGM18
    SolutionIndex: 2
    SolutionNameMin: Cijk_Alik_Bljk_I8II_BH_UserArgs_MT64x16x32_MI16x16x1_SN_GRVWA16_GRVWB4_GSU1_LBSPPA1024_LBSPPB256_LPA16_LPB16_MIWT1_1_SS1_SU0_SUM0_SUS0_TLDS0_WG64_2_1_WGM18
    SolutionIndex: 3
    SolutionNameMin: Cijk_Alik_Bljk_I8II_BH_UserArgs_MT128x16x32_MI16x16x1_SN_GRVWA16_GRVWB4_GSU1_LBSPPA128_LBSPPB128_LPA32_LPB32_MIWT2_1_SS1_SU0_SUM0_SUS0_TLDS1_WG64_2_1_WGM18
    SolutionIndex: 4
    SolutionNameMin: Cijk_Alik_Bljk_I8II_BH_UserArgs_MT192x16x32_MI16x16x1_SN_GRVWA16_GRVWB4_GSU1_LBSPPA3072_LBSPPB256_LPA16_LPB16_MIWT3_1_SS1_SU0_SUM0_SUS0_TLDS0_WG64_2_1_WGM18
    SolutionIndex: 5
    SolutionNameMin: Cijk_Alik_Bljk_I8II_BH_UserArgs_MT192x16x32_MI16x16x1_SN_GRVWA16_GRVWB4_GSU1_LBSPPA128_LBSPPB128_LPA32_LPB32_MIWT3_1_SS1_SU0_SUM0_SUS0_TLDS1_WG64_2_1_WGM18
    SolutionIndex: 6
    SolutionNameMin: Cijk_Alik_Bljk_I8II_BH_UserArgs_MT256x16x32_MI16x16x1_SN_GRVWA16_GRVWB4_GSU1_LBSPPA128_LBSPPB128_LPA32_LPB32_MIWT4_1_SS1_SU0_SUM0_SUS0_TLDS1_WG64_2_1_WGM18
    SolutionIndex: 7
    SolutionNameMin: Cijk_Alik_Bljk_I8II_BH_UserArgs_MT32x32x32_MI16x16x1_SN_GRVWA8_GRVWB8_GSU1_LBSPPA128_LBSPPB128_LPA32_LPB32_MIWT1_1_SS1_SU0_SUM0_SUS0_TLDS1_WG32_4_1_WGM18
    SolutionIndex: 8
    SolutionNameMin: Cijk_Alik_Bljk_I8II_BH_UserArgs_MT64x32x32_MI16x16x1_SN_GRVWA16_GRVWB8_GSU1_LBSPPA128_LBSPPB128_LPA32_LPB32_MIWT2_1_SS1_SU0_SUM0_SUS0_TLDS1_WG32_4_1_WGM18
    SolutionIndex: 9
    SolutionNameMin: Cijk_Alik_Bljk_I8II_BH_UserArgs_MT96x32x32_MI16x16x1_SN_GRVWA8_GRVWB8_GSU1_LBSPPA128_LBSPPB128_LPA32_LPB32_MIWT3_1_SS1_SU0_SUM0_SUS0_TLDS1_WG32_4_1_WGM18
    SolutionIndex: 10
    SolutionNameMin: Cijk_Alik_Bljk_I8II_BH_UserArgs_MT64x48x32_MI16x16x1_SN_GRVWA16_GRVWB4_GSU1_LBSPPA128_LBSPPB128_LPA32_LPB32_MIWT1_3_SS1_SU0_SUM0_SUS0_TLDS1_WG64_2_1_WGM18
    SolutionIndex: 11
    SolutionNameMin: Cijk_Alik_Bljk_I8II_BH_UserArgs_MT16x64x32_MI16x16x1_SN_GRVWA4_GRVWB16_GSU1_LBSPPA128_LBSPPB128_LPA32_LPB32_MIWT1_1_SS1_SU0_SUM0_SUS0_TLDS1_WG16_8_1_WGM18
    SolutionIndex: 12
    SolutionNameMin: Cijk_Alik_Bljk_I8II_BH_UserArgs_MT48x64x32_MI16x16x1_SN_GRVWA4_GRVWB16_GSU1_LBSPPA128_LBSPPB128_LPA32_LPB32_MIWT3_1_SS1_SU0_SUM0_SUS0_TLDS1_WG16_8_1_WGM18
    SolutionIndex: 13
    SolutionNameMin: Cijk_Alik_Bljk_I8II_BH_UserArgs_MT48x128x32_MI16x16x1_SN_GRVWA4_GRVWB16_GSU4_LBSPPA128_LBSPPB128_LPA32_LPB32_MIWT3_2_SS1_SU0_SUM0_SUS0_TLDS1_WG16_8_1_WGM18
    SolutionIndex: 14
    SolutionNameMin: Cijk_Alik_Bljk_I8II_BH_UserArgs_MT64x16x64_MI16x16x1_SN_GRVWA16_GRVWB8_GSU1_LBSPPA128_LBSPPB128_LPA32_LPB32_MIWT1_1_SS1_SU0_SUM0_SUS0_TLDS1_WG64_2_1_WGM18
    SolutionIndex: 15
    SolutionNameMin: Cijk_Alik_Bljk_I8II_BH_UserArgs_MT64x16x64_MI16x16x1_SN_GRVWA16_GRVWB8_GSU4_LBSPPA128_LBSPPB128_LPA32_LPB32_MIWT1_1_SS1_SU0_SUM0_SUS0_TLDS1_WG64_2_1_WGM18
    SolutionIndex: 16
    SolutionNameMin: Cijk_Alik_Bljk_I8II_BH_UserArgs_MT128x16x64_MI16x16x1_SN_GRVWA16_GRVWB8_GSU1_LBSPPA128_LBSPPB128_LPA32_LPB32_MIWT2_1_SS1_SU0_SUM0_SUS0_TLDS1_WG64_2_1_WGM18
    SolutionIndex: 17
    SolutionNameMin: Cijk_Alik_Bljk_I8II_BH_UserArgs_MT192x16x64_MI16x16x1_SN_GRVWA16_GRVWB8_GSU4_LBSPPA128_LBSPPB128_LPA32_LPB32_MIWT3_1_SS1_SU0_SUM0_SUS0_TLDS1_WG64_2_1_WGM18
    SolutionIndex: 18
    SolutionNameMin: Cijk_Alik_Bljk_I8II_BH_UserArgs_MT256x16x64_MI16x16x1_SN_GRVWA16_GRVWB8_GSU1_LBSPPA128_LBSPPB128_LPA32_LPB32_MIWT4_1_SS1_SU0_SUM0_SUS0_TLDS1_WG64_2_1_WGM18
    SolutionIndex: 19
    SolutionNameMin: Cijk_Alik_Bljk_I8II_BH_UserArgs_MT32x32x64_MI16x16x1_SN_GRVWA16_GRVWB16_GSU1_LBSPPA128_LBSPPB128_LPA32_LPB32_MIWT1_1_SS1_SU0_SUM0_SUS0_TLDS1_WG32_4_1_WGM18
    SolutionIndex: 20
    SolutionNameMin: Cijk_Alik_Bljk_I8II_BH_UserArgs_MT32x32x64_MI16x16x1_SN_GRVWA16_GRVWB16_GSU4_LBSPPA128_LBSPPB128_LPA32_LPB32_MIWT1_1_SS1_SU0_SUM0_SUS0_TLDS1_WG32_4_1_WGM18
    SolutionIndex: 21
    SolutionNameMin: Cijk_Alik_Bljk_I8II_BH_UserArgs_MT64x32x64_MI16x16x1_SN_GRVWA16_GRVWB16_GSU1_LBSPPA128_LBSPPB128_LPA32_LPB32_MIWT2_1_SS1_SU0_SUM0_SUS0_TLDS1_WG32_4_1_WGM18
    SolutionIndex: 22
    SolutionNameMin: Cijk_Alik_Bljk_I8II_BH_UserArgs_MT64x32x64_MI16x16x1_SN_GRVWA16_GRVWB16_GSU4_LBSPPA128_LBSPPB128_LPA32_LPB32_MIWT2_1_SS1_SU0_SUM0_SUS0_TLDS1_WG32_4_1_WGM18
    SolutionIndex: 23
    SolutionNameMin: Cijk_Alik_Bljk_I8II_BH_UserArgs_MT64x48x64_MI16x16x1_SN_GRVWA16_GRVWB8_GSU4_LBSPPA128_LBSPPB128_LPA32_LPB32_MIWT1_3_SS1_SU0_SUM0_SUS0_TLDS1_WG64_2_1_WGM18
    SolutionIndex: 24
    SolutionNameMin: Cijk_Alik_Bljk_I8II_BH_UserArgs_MT128x48x64_MI16x16x1_SN_GRVWA16_GRVWB8_GSU1_LBSPPA128_LBSPPB128_LPA32_LPB32_MIWT2_3_SS1_SU0_SUM0_SUS0_TLDS1_WG64_2_1_WGM18
    SolutionIndex: 25
    SolutionNameMin: Cijk_Alik_Bljk_I8II_BH_UserArgs_MT128x48x64_MI16x16x1_SN_GRVWA16_GRVWB8_GSU2_LBSPPA128_LBSPPB128_LPA32_LPB32_MIWT2_3_SS1_SU0_SUM0_SUS0_TLDS1_WG64_2_1_WGM18
    SolutionIndex: 26
    SolutionNameMin: Cijk_Alik_Bljk_I8II_BH_UserArgs_MT128x48x64_MI16x16x1_SN_GRVWA16_GRVWB8_GSU4_LBSPPA128_LBSPPB128_LPA32_LPB32_MIWT2_3_SS1_SU0_SUM0_SUS0_TLDS1_WG64_2_1_WGM18
    SolutionIndex: 27
    SolutionNameMin: Cijk_Alik_Bljk_I8II_BH_UserArgs_MT16x64x64_MI16x16x1_SN_GRVWA8_GRVWB16_GSU1_LBSPPA128_LBSPPB128_LPA32_LPB32_MIWT1_1_SS1_SU0_SUM0_SUS0_TLDS1_WG16_8_1_WGM18
    SolutionIndex: 28
    SolutionNameMin: Cijk_Alik_Bljk_I8II_BH_UserArgs_MT32x64x64_MI16x16x1_SN_GRVWA16_GRVWB16_GSU1_LBSPPA128_LBSPPB128_LPA32_LPB32_MIWT2_1_SS1_SU0_SUM0_SUS0_TLDS1_WG16_8_1_WGM18
    SolutionIndex: 29
    SolutionNameMin: Cijk_Alik_Bljk_I8II_BH_UserArgs_MT32x64x64_MI16x16x1_SN_GRVWA16_GRVWB16_GSU4_LBSPPA128_LBSPPB128_LPA32_LPB32_MIWT2_1_SS1_SU0_SUM0_SUS0_TLDS1_WG16_8_1_WGM18
    SolutionIndex: 30
    SolutionNameMin: Cijk_Alik_Bljk_I8II_BH_UserArgs_MT48x64x64_MI16x16x1_SN_GRVWA8_GRVWB16_GSU1_LBSPPA128_LBSPPB128_LPA32_LPB32_MIWT3_1_SS1_SU0_SUM0_SUS0_TLDS1_WG16_8_1_WGM18
    SolutionIndex: 31
    SolutionNameMin: Cijk_Alik_Bljk_I8II_BH_UserArgs_MT32x96x64_MI16x16x1_SN_GRVWA16_GRVWB16_GSU1_LBSPPA128_LBSPPB128_LPA32_LPB32_MIWT1_3_SS1_SU0_SUM0_SUS0_TLDS1_WG32_4_1_WGM18
    SolutionIndex: 32
    SolutionNameMin: Cijk_Alik_Bljk_I8II_BH_UserArgs_MT64x96x64_MI16x16x1_SN_GRVWA16_GRVWB16_GSU1_LBSPPA128_LBSPPB128_LPA32_LPB32_MIWT2_3_SS1_SU0_SUM0_SUS0_TLDS1_WG32_4_1_WGM18
    SolutionIndex: 33
    SolutionNameMin: Cijk_Alik_Bljk_I8II_BH_UserArgs_MT64x96x64_MI16x16x1_SN_GRVWA16_GRVWB16_GSU2_LBSPPA128_LBSPPB128_LPA32_LPB32_MIWT2_3_SS1_SU0_SUM0_SUS0_TLDS1_WG32_4_1_WGM18
    SolutionIndex: 34
    SolutionNameMin: Cijk_Alik_Bljk_I8II_BH_UserArgs_MT64x96x64_MI16x16x1_SN_GRVWA16_GRVWB16_GSU4_LBSPPA128_LBSPPB128_LPA32_LPB32_MIWT2_3_SS1_SU0_SUM0_SUS0_TLDS1_WG32_4_1_WGM18
    SolutionIndex: 35
    SolutionNameMin: Cijk_Alik_Bljk_I8II_BH_UserArgs_MT16x128x64_MI16x16x1_SN_GRVWA8_GRVWB16_GSU1_LBSPPA128_LBSPPB128_LPA32_LPB32_MIWT1_2_SS1_SU0_SUM0_SUS0_TLDS1_WG16_8_1_WGM18
    SolutionIndex: 36
    SolutionNameMin: Cijk_Alik_Bljk_I8II_BH_UserArgs_MT48x128x64_MI16x16x1_SN_GRVWA8_GRVWB16_GSU1_LBSPPA128_LBSPPB128_LPA32_LPB32_MIWT3_2_SS1_SU0_SUM0_SUS0_TLDS1_WG16_8_1_WGM18
    SolutionIndex: 37
    SolutionNameMin: Cijk_Alik_Bljk_I8II_BH_UserArgs_MT48x128x64_MI16x16x1_SN_GRVWA8_GRVWB16_GSU2_LBSPPA128_LBSPPB128_LPA32_LPB32_MIWT3_2_SS1_SU0_SUM0_SUS0_TLDS1_WG16_8_1_WGM18
    SolutionIndex: 38
    SolutionNameMin: Cijk_Alik_Bljk_I8II_BH_UserArgs_MT32x192x64_MI16x16x1_SN_GRVWA16_GRVWB16_GSU2_LBSPPA128_LBSPPB128_LPA32_LPB32_MIWT2_3_SS1_SU0_SUM0_SUS0_TLDS1_WG16_8_1_WGM18
- - - [1, 1000, 1, 2688, 1, 1, 2688, 2688]
    - [1, 376.032]
  - - [1024, 1280, 1, 11520, 1024, 1024, 11520, 11520]
    - [25, 51420.5]
  - - [1024, 320, 1, 2880, 1024, 1024, 2880, 2880]
    - [25, 36892.6]
  - - [1024, 640, 1, 11520, 1024, 1024, 11520, 11520]
    - [32, 50823.1]
  - - [1024, 640, 1, 17280, 1024, 1024, 17280, 17280]
    - [32, 51469.3]
  - - [1024, 640, 1, 2880, 1024, 1024, 2880, 2880]
    - [24, 45209.0]
  - - [1024, 640, 1, 5760, 1024, 1024, 5760, 5760]
    - [32, 48760.8]
  - - [1024, 640, 1, 8640, 1024, 1024, 8640, 8640]
    - [32, 50104.4]
  - - [121, 336, 1, 2016, 121, 121, 2016, 2016]
    - [22, 9852.24]
  - - [121, 672, 1, 1344, 121, 121, 1344, 1344]
    - [19, 14880.1]
  - - [1225, 192, 1, 1728, 1225, 1225, 1728, 1728]
    - [21, 28601.7]
  - - [1225, 224, 1, 1728, 1225, 1225, 1728, 1728]
    - [21, 28141.4]
  - - [1225, 32, 1, 192, 1225, 1225, 192, 192]
    - [19, 2537.39]
  - - [1225, 64, 1, 1200, 1225, 1225, 1200, 1200]
    - [19, 13281.5]
  - - [1225, 64, 1, 256, 1225, 1225, 256, 256]
    - [27, 5851.92]
  - - [1225, 64, 1, 288, 1225, 1225, 288, 288]
    - [7, 5952.78]
  - - [1225, 96, 1, 384, 1225, 1225, 384, 384]
    - [21, 10565.3]
  - - [1225, 96, 1, 576, 1225, 1225, 576, 576]
    - [19, 13025.2]
  - - [1225, 96, 1, 864, 1225, 1225, 864, 864]
    - [19, 14841.3]
  - - [12544, 128, 1, 1152, 12544, 12544, 1152, 1152]
    - [36, 43686.3]
  - - [12544, 128, 1, 576, 12544, 12544, 576, 576]
    - [36, 40548.5]
  - - [12544, 32, 1, 27, 12544, 12544, 27, 27]
    - [8, 2813.65]
  - - [129600, 16, 1, 144, 129600, 129600, 144, 144]
    - [16, 16648.3]
  - - [129600, 16, 1, 16, 129600, 129600, 16, 16]
    - [6, 4014.61]
  - - [1764, 168, 1, 336, 1764, 1764, 336, 336]
    - [10, 15176.9]
  - - [1764, 84, 1, 168, 1764, 1764, 168, 168]
    - [8, 6024.35]
  - - [196, 1024, 1, 256, 196, 196, 256, 256]
    - [28, 11652.8]
  - - [196, 128, 1, 1152, 196, 196, 1152, 1152]
    - [19, 5610.08]
  - - [196, 256, 1, 2304, 196, 196, 2304, 2304]
    - [29, 13030.6]
  - - [196, 32, 1, 1152, 196, 196, 1152, 1152]
    - [19, 1416.66]
  - - [196, 512, 1, 4608, 196, 196, 4608, 4608]
    - [26, 25119.3]
  - - [2073600, 16, 1, 144, 2073600, 2073600, 144, 144]
    - [16, 9076.85]
  - - [2073600, 16, 1, 16, 2073600, 2073600, 16, 16]
    - [2, 2663.19]
  - - [2073600, 16, 1, 72, 2073600, 2073600, 72, 72]
    - [4, 7397.82]
  - - [2073600, 4, 1, 144, 2073600, 2073600, 144, 144]
    - [0, 2844.53]
  - - [21609, 32, 1, 288, 21609, 21609, 288, 288]
    - [8, 21078.3]
  - - [21609, 64, 1, 288, 21609, 21609, 288, 288]
    - [12, 28520.5]
  - - [22201, 32, 1, 27, 22201, 22201, 27, 27]
    - [8, 3646.79]
  - - [256, 1280, 1, 11520, 256, 256, 11520, 11520]
    - [33, 46383.1]
  - - [256, 1280, 1, 17280, 256, 256, 17280, 17280]
    - [33, 48344.7]
  - - [256, 1280, 1, 23040, 256, 256, 23040, 23040]
    - [33, 49221.8]
  - - [256, 1280, 1, 5760, 256, 256, 5760, 5760]
    - [25, 41328.6]
  - - [256, 640, 1, 5760, 256, 256, 5760, 5760]
    - [26, 38205.0]
  - - [27225, 96, 1, 27, 27225, 27225, 27, 27]
    - [9, 5847.81]
  - - [289, 128, 1, 1024, 289, 289, 1024, 1024]
    - [14, 6794.16]
  - - [289, 192, 1, 1120, 289, 289, 1120, 1120]
    - [14, 10012.0]
  - - [289, 192, 1, 1344, 289, 289, 1344, 1344]
    - [14, 11453.7]
  - - [289, 192, 1, 768, 289, 289, 768, 768]
    - [27, 9399.3]
  - - [289, 192, 1, 896, 289, 289, 896, 896]
    - [27, 10132.6]
  - - [289, 256, 1, 1568, 289, 289, 1568, 1568]
    - [19, 13690.9]
  - - [289, 256, 1, 2016, 289, 289, 2016, 2016]
    - [19, 14631.1]
  - - [289, 384, 1, 2592, 289, 289, 2592, 2592]
    - [13, 19347.3]
  - - [289, 384, 1, 3456, 289, 289, 3456, 3456]
    - [34, 23802.3]
  - - [289, 96, 1, 864, 289, 289, 864, 864]
    - [19, 4783.51]
  - - [3136, 256, 1, 1152, 3136, 3136, 1152, 1152]
    - [36, 42778.3]
  - - [3136, 256, 1, 2304, 3136, 3136, 2304, 2304]
    - [36, 44251.3]
  - - [3136, 32, 1, 1152, 3136, 3136, 1152, 1152]
    - [19, 14681.3]
  - - [3136, 64, 1, 576, 3136, 3136, 576, 576]
    - [28, 17873.8]
  - - [32400, 16, 1, 144, 32400, 32400, 144, 144]
    - [14, 10393.0]
  - - [4096, 320, 1, 2880, 4096, 4096, 2880, 2880]
    - [26, 41210.2]
  - - [4096, 320, 1, 36, 4096, 4096, 36, 36]
    - [6, 6538.23]
  - - [4096, 320, 1, 5760, 4096, 4096, 5760, 5760]
    - [26, 46337.6]
  - - [4096, 320, 1, 8640, 4096, 4096, 8640, 8640]
    - [26, 48250.7]
  - - [4096, 4, 1, 2880, 4096, 4096, 2880, 2880]
    - [17, 3817.41]
  - - [4096, 640, 1, 5760, 4096, 4096, 5760, 5760]
    - [32, 53385.2]
  - - [441, 168, 1, 1008, 441, 441, 1008, 1008]
    - [19, 11563.6]
  - - [441, 336, 1, 672, 441, 441, 672, 672]
    - [28, 14896.9]
  - - [49, 2048, 1, 2048, 49, 49, 2048, 2048]
    - [28, 14220.6]
  - - [49, 2048, 1, 512, 49, 49, 512, 512]
    - [21, 9457.49]
  - - [49, 256, 1, 2304, 49, 49, 2304, 2304]
    - [15, 4260.03]
  - - [49, 32, 1, 1152, 49, 49, 1152, 1152]
    - [19, 352.948]
  - - [49, 512, 1, 4608, 49, 49, 4608, 4608]
    - [22, 10564.5]
  - - [50176, 64, 1, 27, 50176, 50176, 27, 27]
    - [12, 7156.52]
  - - [50176, 64, 1, 576, 50176, 50176, 576, 576]
    - [30, 37703.0]
  - - [5041, 192, 1, 720, 5041, 5041, 720, 720]
    - [31, 29791.0]
  - - [5041, 96, 1, 576, 5041, 5041, 576, 576]
    - [32, 28651.1]
  - - [518400, 16, 1, 144, 518400, 518400, 144, 144]
    - [2, 8587.43]
  - - [518400, 16, 1, 16, 518400, 518400, 16, 16]
    - [5, 3738.57]
  - - [5329, 96, 1, 576, 5329, 5329, 576, 576]
    - [32, 30162.5]
  - - [64, 1280, 1, 11520, 64, 64, 11520, 11520]
    - [34, 30169.4]
  - - [64, 1280, 1, 23040, 64, 64, 23040, 23040]
    - [34, 31598.6]
  - - [64, 1280, 1, 2560, 64, 64, 2560, 2560]
    - [23, 18727.5]
  - - [64, 192, 1, 1280, 64, 64, 1280, 1280]
    - [19, 2911.75]
  - - [64, 192, 1, 1728, 64, 64, 1728, 1728]
    - [15, 3641.0]
  - - [64, 192, 1, 2048, 64, 64, 2048, 2048]
    - [15, 3859.52]
  - - [64, 256, 1, 1152, 64, 64, 1152, 1152]
    - [19, 3722.8]
  - - [64, 256, 1, 1536, 64, 64, 1536, 1536]
    - [20, 4142.82]
  - - [64, 320, 1, 1280, 64, 64, 1280, 1280]
    - [19, 4832.38]
  - - [64, 320, 1, 1728, 64, 64, 1728, 1728]
    - [20, 5621.53]
  - - [64, 320, 1, 2048, 64, 64, 2048, 2048]
    - [15, 6118.43]
  - - [64, 320, 1, 2880, 64, 64, 2880, 2880]
    - [15, 7979.22]
  - - [64, 384, 1, 1152, 64, 64, 1152, 1152]
    - [19, 5550.36]
  - - [64, 384, 1, 4032, 64, 64, 4032, 4032]
    - [22, 10638.0]
  - - [6889, 42, 1, 96, 6889, 6889, 96, 96]
    - [3, 6639.76]
  - - [784, 128, 1, 1152, 784, 784, 1152, 1152]
    - [28, 15322.5]
  - - [784, 32, 1, 1152, 784, 784, 1152, 1152]
    - [19, 5636.21]
  - - [784, 512, 1, 128, 784, 784, 128, 128]
    - [35, 12293.2]
  - - [784, 512, 1, 2304, 784, 784, 2304, 2304]
    - [37, 36280.6]
  - - [784, 512, 1, 4608, 784, 784, 4608, 4608]
    - [38, 39659.5]
  - - [784, 64, 1, 576, 784, 784, 576, 576]
    - [11, 6442.26]
  - - [1024, 1024, 1, 64, 1024, 1024, 64, 64]
    - [6, 12641.3]
  - - [128, 128, 1, 64, 128, 128, 64, 64]
    - [19, 435.183]
  - - [256, 256, 1, 64, 256, 256, 64, 64]
    - [16, 1579.57]
  - - [384, 384, 1, 64, 384, 384, 64, 64]
    - [16, 3342.5]
  - - [4096, 4096, 1, 64, 4096, 4096, 64, 64]
    - [18, 21936.4]
  - - [64, 1024, 1, 64, 64, 64, 64, 64]
    - [28, 1595.35]
  - - [64, 256, 1, 64, 64, 64, 64, 64]
    - [19, 435.891]
  - - [64, 4096, 1, 64, 64, 64, 64, 64]
    - [21, 5332.5]
  - - [64, 64, 1, 64, 64, 64, 64, 64]
    - [27, 109.141]
- null
- null
- DeviceEfficiency
- Equality
