library/src/amd_detail/rocblaslt/src/Tensile/Logic/asm_full/aquavanjaram/gfx942_20cu/GridBased/aquavanjaram_Cijk_Ailk_Bljk_S_MX_B_Bias_HAS_SAV_UserArgs.yaml
- {MinimumRequiredVersion: 4.33.0}
- aquavanjaram
- {Architecture: gfx942, CUCount: 20}
- [Device 0049, Device 0050]
    SolutionIndex: 0
    SolutionNameMin: Cijk_Ailk_Bljk_S_MX_B_Bias_HAS_SAV_UserArgs_MT16x16x64_MI16x16x1_SN_LDSB0_GRVWB4_GSU16_LBSPPB256_MIWT1_1_NLCB1_SU0_SUM0_SUS0_WG16_4_2_WGM1
    SolutionIndex: 1
    SolutionNameMin: Cijk_Ailk_Bljk_S_MX_B_Bias_HAS_SAV_UserArgs_MT16x16x128_MI16x16x1_SN_LDSB0_GRVWB4_GSU16_LBSPPB512_MIWT1_1_NLCB1_SU0_SUM0_SUS0_WG16_4_2_WGM1
    SolutionIndex: 2
    SolutionNameMin: Cijk_Ailk_Bljk_S_MX_B_Bias_HAS_SAV_UserArgs_MT16x16x128_MI16x16x1_SN_LDSB0_GRVWB4_GSU19_LBSPPB512_MIWT1_1_NLCB1_SU0_SUM0_SUS0_WG16_4_2_WGM1
    SolutionIndex: 3
    SolutionNameMin: Cijk_Ailk_Bljk_S_MX_B_Bias_HAS_SAV_UserArgs_MT16x16x64_MI16x16x1_SN_LDSB1_GRVWB4_GSU16_GSUC0_GSUWGMRR0_K1_LBSPPA256_LBSPPB256_LPA16_MIWT1_1_NLCB1_SU0_SUM0_SUS0_SVW1_VWA1_WG16_4_1_WGM1_WGMXCC1_WGMXCCGn1
    SolutionIndex: 4
    SolutionNameMin: Cijk_Ailk_Bljk_S_MX_B_Bias_HAS_SAV_UserArgs_MT32x16x128_MI16x16x1_SN_LDSB0_GRVWB4_GSU20_GSUC0_GSUWGMRR0_K1_LBSPPA512_LBSPPB512_LPA16_MIWT1_1_NLCB1_SU0_SUM0_SUS0_SVW1_VWA1_WG32_4_1_WGM1_WGMXCC1_WGMXCCGn1
    SolutionIndex: 5
    SolutionNameMin: Cijk_Ailk_Bljk_S_MX_B_Bias_HAS_SAV_UserArgs_MT32x16x64_MI16x16x1_SN_LDSB1_GRVWB4_GSU16_GSUC0_GSUWGMRR0_K1_LBSPPA512_LBSPPB256_LPA16_MIWT1_1_NLCB1_SU0_SUM0_SUS0_SVW1_VWA1_WG32_4_1_WGM1_WGMXCC1_WGMXCCGn1
    SolutionIndex: 6
    SolutionNameMin: Cijk_Ailk_Bljk_S_MX_B_Bias_HAS_SAV_UserArgs_MT32x16x64_MI16x16x1_SN_LDSB0_GRVWB4_GSU16_GSUC0_GSUWGMRR0_K1_LBSPPA512_LBSPPB256_LPA16_MIWT1_1_NLCB1_SU0_SUM0_SUS0_SVW1_VWA1_WG32_4_1_WGM1_WGMXCC1_WGMXCCGn1
    SolutionIndex: 7
    SolutionNameMin: Cijk_Ailk_Bljk_S_MX_B_Bias_HAS_SAV_UserArgs_MT32x16x32_MI16x16x1_SN_LDSB1_GRVWB4_GSU13_GSUC0_GSUWGMRR0_K1_LBSPPA512_LBSPPB128_LPA16_MIWT1_1_NLCB1_SU0_SUM0_SUS0_SVW1_VWA1_WG32_4_1_WGM1_WGMXCC1_WGMXCCGn1
    SolutionIndex: 8
    SolutionNameMin: Cijk_Ailk_Bljk_S_MX_B_Bias_HAS_SAV_UserArgs_MT64x16x64_MI16x16x1_SN_LDSB0_GRVWB4_GSU16_GSUC0_GSUWGMRR0_K1_LBSPPA1024_LBSPPB256_LPA16_MIWT1_1_NLCB1_SU0_SUM0_SUS0_SVW1_VWA1_WG64_4_1_WGM1_WGMXCC1_WGMXCCGn1
    SolutionIndex: 9
    SolutionNameMin: Cijk_Ailk_Bljk_S_MX_B_Bias_HAS_SAV_UserArgs_MT64x16x128_MI16x16x1_SN_LDSB1_GRVWB4_GSU20_GSUC0_GSUWGMRR0_K1_LBSPPA1024_LBSPPB512_LPA16_MIWT1_1_NLCB1_SU0_SUM0_SUS0_SVW1_VWA1_WG64_4_1_WGM1_WGMXCC1_WGMXCCGn1
    SolutionIndex: 10
    SolutionNameMin: Cijk_Ailk_Bljk_S_MX_B_Bias_HAS_SAV_UserArgs_MT16x16x128_MI16x16x1_SN_LDSB0_GRVWB4_GSU1_GSUC0_GSUWGMRR0_K1_LBSPPA256_LBSPPB512_LPA16_MIWT1_1_NLCB1_SU0_SUM0_SUS0_SVW1_VWA1_WG16_4_4_WGM1_WGMXCC1_WGMXCCGn1
    SolutionIndex: 11
    SolutionNameMin: Cijk_Ailk_Bljk_S_MX_B_Bias_HAS_SAV_UserArgs_MT32x16x128_MI16x16x1_SN_LDSB1_GRVWB4_GSU13_GSUC0_GSUWGMRR0_K1_LBSPPA512_LBSPPB512_LPA16_MIWT1_1_NLCB1_SU0_SUM0_SUS0_SVW1_VWA1_WG32_4_1_WGM1_WGMXCC1_WGMXCCGn1
    SolutionIndex: 12
    SolutionNameMin: Cijk_Ailk_Bljk_S_MX_B_Bias_HAS_SAV_UserArgs_MT64x16x64_MI16x16x1_SN_LDSB1_GRVWB4_GSU10_GSUC0_GSUWGMRR0_K1_LBSPPA1024_LBSPPB256_LPA16_MIWT1_1_NLCA1_NLCB1_SU0_SUM0_SUS0_SVW1_VWA1_WG64_4_1_WGM1_WGMXCC1_WGMXCCGn1
    SolutionIndex: 13
    SolutionNameMin: Cijk_Ailk_Bljk_S_MX_B_Bias_HAS_SAV_UserArgs_MT64x16x64_MI16x16x1_SN_LDSB1_GRVWB4_GSU20_GSUC0_GSUWGMRR0_K1_LBSPPA1024_LBSPPB256_LPA16_MIWT1_1_NLCA1_NLCB1_SU0_SUM0_SUS0_SVW1_VWA1_WG64_4_1_WGM1_WGMXCC1_WGMXCCGn1
    SolutionIndex: 14
    SolutionNameMin: Cijk_Ailk_Bljk_S_MX_B_Bias_HAS_SAV_UserArgs_MT128x16x64_MI16x16x1_SN_LDSB1_GRVWB4_GSU20_GSUC0_GSUWGMRR0_K1_LBSPPA2048_LBSPPB256_LPA0_MIWT2_1_NLCA1_NLCB1_SU0_SUM0_SUS0_SVW2_VWA2_WG64_4_1_WGM1_WGMXCC1_WGMXCCGn1
    SolutionIndex: 15
    SolutionNameMin: Cijk_Ailk_Bljk_S_MX_B_Bias_HAS_SAV_UserArgs_MT16x16x256_MI16x16x1_SN_LDSB1_GRVWB4_GSU1_GSUC0_GSUWGMRR0_K1_LBSPPA256_LBSPPB1024_LPA16_MIWT1_1_NLCA1_NLCB1_SU0_SUM0_SUS0_SVW1_VWA1_WG16_4_4_WGM1_WGMXCC1_WGMXCCGn1
    SolutionIndex: 16
    SolutionNameMin: Cijk_Ailk_Bljk_S_MX_B_Bias_HAS_SAV_UserArgs_MT64x16x64_MI16x16x1_SN_LDSB1_GRVWB4_GSU13_GSUC0_GSUWGMRR0_K1_LBSPPA1024_LBSPPB256_LPA16_MIWT1_1_NLCA1_NLCB1_SU0_SUM0_SUS0_SVW1_VWA1_WG64_4_1_WGM1_WGMXCC1_WGMXCCGn1
    SolutionIndex: 17
    SolutionNameMin: Cijk_Ailk_Bljk_S_MX_B_Bias_HAS_SAV_UserArgs_MT192x16x64_MI16x16x1_SN_LDSB1_GRVWB4_GSU20_GSUC0_GSUWGMRR0_K1_LBSPPA3072_LBSPPB256_LPA16_MIWT3_1_NLCA3_NLCB1_SU0_SUM0_SUS0_SVW1_VWA1_WG64_4_1_WGM1_WGMXCC1_WGMXCCGn1
    SolutionIndex: 18
    SolutionNameMin: Cijk_Ailk_Bljk_S_MX_B_Bias_HAS_SAV_UserArgs_MT64x16x64_MI16x16x1_SN_LDSB0_GRVWB4_GSU4_GSUC0_GSUWGMRR0_K1_LBSPPA1024_LBSPPB256_LPA16_MIWT1_1_NLCA1_NLCB1_SU0_SUM0_SUS0_SVW1_VWA1_WG64_4_1_WGM1_WGMXCC1_WGMXCCGn1
    SolutionIndex: 19
    SolutionNameMin: Cijk_Ailk_Bljk_S_MX_B_Bias_HAS_SAV_UserArgs_MT128x16x32_MI16x16x1_SN_LDSB1_GRVWB1_GSU20_GSUC0_GSUWGMRR0_K1_LBSPPA2048_LBSPPB128_LPA0_MIWT2_1_NLCA1_NLCB1_SU0_SUM0_SUS0_SVW2_VWA2_WG64_4_1_WGM1_WGMXCC1_WGMXCCGn1
    SolutionIndex: 20
    SolutionNameMin: Cijk_Ailk_Bljk_S_MX_B_Bias_HAS_SAV_UserArgs_MT128x16x32_MI16x16x1_SN_LDSB1_GRVWB1_GSU13_GSUC0_GSUWGMRR0_K1_LBSPPA2048_LBSPPB128_LPA0_MIWT2_1_NLCA1_NLCB1_SU0_SUM0_SUS0_SVW2_VWA2_WG64_4_1_WGM1_WGMXCC1_WGMXCCGn1
    SolutionIndex: 21
    SolutionNameMin: Cijk_Ailk_Bljk_S_MX_B_Bias_HAS_SAV_UserArgs_MT192x16x32_MI16x16x1_SN_LDSB0_GRVWB1_GSU10_GSUC0_GSUWGMRR0_K1_LBSPPA3072_LBSPPB128_LPA16_MIWT3_1_NLCA3_NLCB1_SU0_SUM0_SUS0_SVW1_VWA1_WG64_4_1_WGM1_WGMXCC1_WGMXCCGn1
    SolutionIndex: 22
    SolutionNameMin: Cijk_Ailk_Bljk_S_MX_B_Bias_HAS_SAV_UserArgs_MT192x16x32_MI16x16x1_SN_LDSB1_GRVWB1_GSU20_GSUC0_GSUWGMRR0_K1_LBSPPA3072_LBSPPB128_LPA16_MIWT3_1_NLCA3_NLCB1_SU0_SUM0_SUS0_SVW1_VWA1_WG64_4_1_WGM1_WGMXCC1_WGMXCCGn1
    SolutionIndex: 23
    SolutionNameMin: Cijk_Ailk_Bljk_S_MX_B_Bias_HAS_SAV_UserArgs_MT64x16x64_MI16x16x1_SN_GRVWB4_GSU5_GSUC0_GSUWGMRR0_K1_LBSPPA1024_LBSPPB256_LPA16_MIWT1_1_NLCA1_NLCB1_SU0_SUM0_SUS0_SVW1_VWA1_WG64_4_1_WGM1_WGMXCC1_WGMXCCGn1
    SolutionIndex: 24
    SolutionNameMin: Cijk_Ailk_Bljk_S_MX_B_Bias_HAS_SAV_UserArgs_MT192x16x32_MI16x16x1_SN_GRVWB1_GSU13_GSUC0_GSUWGMRR0_K1_LBSPPA3072_LBSPPB128_LPA16_MIWT3_1_NLCA3_NLCB1_SU0_SUM0_SUS0_SVW1_VWA1_WG64_4_1_WGM1_WGMXCC1_WGMXCCGn1
    SolutionIndex: 25
    SolutionNameMin: Cijk_Ailk_Bljk_S_MX_B_Bias_HAS_SAV_UserArgs_MT128x16x64_MI16x16x1_SN_GRVWB4_GSU4_GSUC0_GSUWGMRR0_K1_LBSPPA2048_LBSPPB256_LPA0_MIWT2_1_NLCA1_NLCB1_SU0_SUM0_SUS0_SVW2_VWA2_WG64_4_1_WGM1_WGMXCC1_WGMXCCGn1
    SolutionIndex: 26
    SolutionNameMin: Cijk_Ailk_Bljk_S_MX_B_Bias_HAS_SAV_UserArgs_MT320x16x32_MI16x16x1_SN_GRVWB1_GSU10_GSUC0_GSUWGMRR0_K1_LBSPPA5120_LBSPPB128_LPA16_MIWT5_1_NLCA5_NLCB1_SU0_SUM0_SUS0_SVW1_VWA1_WG64_4_1_WGM1_WGMXCC1_WGMXCCGn1
    SolutionIndex: 27
    SolutionNameMin: Cijk_Ailk_Bljk_S_MX_B_Bias_HAS_SAV_UserArgs_MT192x16x32_MI16x16x1_SN_GRVWB1_GSU10_GSUC0_GSUWGMRR0_K1_LBSPPA3072_LBSPPB128_LPA16_MIWT3_1_NLCA3_NLCB1_SU0_SUM0_SUS0_SVW1_VWA1_WG64_4_1_WGM1_WGMXCC1_WGMXCCGn1
    SolutionIndex: 28
    SolutionNameMin: Cijk_Ailk_Bljk_S_MX_B_Bias_HAS_SAV_UserArgs_MT128x16x32_MI16x16x1_SN_GRVWB1_GSU5_GSUC0_GSUWGMRR0_K1_LBSPPA2048_LBSPPB128_LPA0_MIWT2_1_NLCA1_SU0_SUM0_SUS0_SVW2_VWA2_WG64_4_1_WGM1_WGMXCC1_WGMXCCGn1
    SolutionIndex: 29
    SolutionNameMin: Cijk_Ailk_Bljk_S_MX_B_Bias_HAS_SAV_UserArgs_MT192x16x32_MI16x16x1_SN_GRVWB1_GSU10_GSUC0_GSUWGMRR0_K1_LBSPPA3072_LBSPPB128_LPA16_MIWT3_1_NLCA3_SU0_SUM0_SUS0_SVW1_VWA1_WG64_4_1_WGM1_WGMXCC1_WGMXCCGn1
    SolutionIndex: 30
    SolutionNameMin: Cijk_Ailk_Bljk_S_MX_B_Bias_HAS_SAV_UserArgs_MT320x16x32_MI16x16x1_SN_GRVWB1_GSU4_GSUC0_GSUWGMRR0_K1_LBSPPA5120_LBSPPB128_LPA16_MIWT5_1_NLCA5_SU0_SUM0_SUS0_SVW1_VWA1_WG64_4_1_WGM1_WGMXCC1_WGMXCCGn1
    SolutionIndex: 31
    SolutionNameMin: Cijk_Ailk_Bljk_S_MX_B_Bias_HAS_SAV_UserArgs_MT192x16x32_MI16x16x1_SN_GRVWB1_GSU5_GSUC0_GSUWGMRR0_K1_LBSPPA3072_LBSPPB128_LPA16_MIWT3_1_NLCA3_SU0_SUM0_SUS0_SVW1_VWA1_WG64_4_1_WGM1_WGMXCC1_WGMXCCGn1
    SolutionIndex: 32
    SolutionNameMin: Cijk_Ailk_Bljk_S_MX_B_Bias_HAS_SAV_UserArgs_MT64x16x64_MI16x16x1_SN_CLR1_GRVWB4_GSU1_GSUC0_GSUWGMRR0_K1_LBSPPA1024_LBSPPB256_LPA16_LPB8_LRVW4_MIWT1_1_NLCA1_PLR1_SU0_SUM0_SUS0_SVW1_VWA1_WG64_4_1_WGM1_WGMXCC1_WGMXCCGn1
    SolutionIndex: 33
    SolutionNameMin: Cijk_Ailk_Bljk_S_MX_B_Bias_HAS_SAV_UserArgs_MT448x16x16_MI16x16x1_SN_CLR1_GRVWB1_GSU8_GSUC0_GSUWGMRR0_K1_LBSPPA3584_LBSPPB128_LPA16_LPB2_LRVW2_MIWT7_1_NLCA7_PLR1_SU0_SUM0_SUS0_SVW1_VWA1_WG64_4_1_WGM1_WGMXCC1_WGMXCCGn1
    SolutionIndex: 34
    SolutionNameMin: Cijk_Ailk_Bljk_S_MX_B_Bias_HAS_SAV_UserArgs_MT448x16x16_MI16x16x1_SN_CLR1_GRVWB1_GSU12_GSUC0_GSUWGMRR0_K1_LBSPPA3584_LBSPPB128_LPA16_LPB2_LRVW2_MIWT7_1_NLCA7_PLR1_SU0_SUM0_SUS0_SVW1_VWA1_WG64_4_1_WGM1_WGMXCC1_WGMXCCGn1
    SolutionIndex: 35
    SolutionNameMin: Cijk_Ailk_Bljk_S_MX_B_Bias_HAS_SAV_UserArgs_MT320x16x16_MI16x16x1_SN_CLR1_GRVWB1_GSU4_GSUC0_GSUWGMRR0_K1_LBSPPA2560_LBSPPB128_LPA16_LPB2_LRVW2_MIWT5_1_NLCA5_PLR1_SU0_SUM0_SUS0_SVW1_VWA1_WG64_4_1_WGM1_WGMXCC1_WGMXCCGn1
    SolutionIndex: 36
    SolutionNameMin: Cijk_Ailk_Bljk_S_MX_B_Bias_HAS_SAV_UserArgs_MT448x16x16_MI16x16x1_SN_CLR1_GRVWB1_GSU17_GSUC0_GSUWGMRR0_K1_LBSPPA3584_LBSPPB128_LPA16_LPB2_LRVW2_MIWT7_1_NLCA7_PLR1_SU0_SUM0_SUS0_SVW1_VWA1_WG64_4_1_WGM1_WGMXCC1_WGMXCCGn1
    SolutionIndex: 37
    SolutionNameMin: Cijk_Ailk_Bljk_S_MX_B_Bias_HAS_SAV_UserArgs_MT448x16x32_MI16x16x1_SN_GRVWB1_GSU1_GSUC0_GSUWGMRR0_K1_LBSPPA7168_LBSPPB128_LPA16_LPB8_LRVW4_MIWT7_1_NTA0_NLCA7_SU0_SUM0_SUS0_SVW1_VWA1_WGM1_WGMXCC1_WGMXCCGn1
    SolutionIndex: 38
    SolutionNameMin: Cijk_Ailk_Bljk_S_MX_B_Bias_HAS_SAV_UserArgs_MT448x16x16_MI16x16x1_SN_GRVWB1_GSU2_GSUC0_GSUWGMRR0_K1_LBSPPA3584_LBSPPB128_LPA16_LPB2_LRVW2_MIWT7_1_NTA0_NLCA7_SU0_SUM0_SUS0_SVW1_VWA1_WGM1_WGMXCC1_WGMXCCGn1
    SolutionIndex: 39
    SolutionNameMin: Cijk_Ailk_Bljk_S_MX_B_Bias_HAS_SAV_UserArgs_MT320x16x16_MI16x16x1_SN_GRVWB1_GSU1_GSUC0_GSUWGMRR0_K1_LBSPPA2560_LBSPPB128_LPA16_LPB2_LRVW2_MIWT5_1_NTA4_NLCA5_SU0_SUM0_SUS0_SVW1_VWA1_WGM1_WGMXCC1_WGMXCCGn1
    SolutionIndex: 40
    SolutionNameMin: Cijk_Ailk_Bljk_S_MX_B_Bias_HAS_SAV_UserArgs_MT320x16x16_MI16x16x1_SN_GRVWB1_GSU1_GSUC0_GSUWGMRR0_K1_LBSPPA2560_LBSPPB128_LPA16_LPB2_LRVW2_MIWT5_1_NTA0_NLCA5_SU0_SUM0_SUS0_SVW1_VWA1_WGM1_WGMXCC1_WGMXCCGn1
    SolutionIndex: 41
    SolutionNameMin: Cijk_Ailk_Bljk_S_MX_B_Bias_HAS_SAV_UserArgs_MT448x16x16_MI16x16x1_SN_GRVWB1_GSU5_GSUC0_GSUWGMRR0_K1_LBSPPA3584_LBSPPB128_LPA16_LPB2_LRVW2_MIWT7_1_NTA0_NLCA7_SU0_SUM0_SUS0_SVW1_VWA1_WGM1_WGMXCC1_WGMXCCGn1
    SolutionIndex: 42
    SolutionNameMin: Cijk_Ailk_Bljk_S_MX_B_Bias_HAS_SAV_UserArgs_MT448x16x16_MI16x16x1_SN_GRVWB1_GSU1_GSUC0_GSUWGMRR0_K1_LBSPPA3584_LBSPPB128_LPA16_LPB2_LRVW2_MIWT7_1_NTA0_NLCA7_SU0_SUM0_SUS0_SVW1_VWA1_WGM1_WGMXCC1_WGMXCCGn1
    SolutionIndex: 43
    SolutionNameMin: Cijk_Ailk_Bljk_S_MX_B_Bias_HAS_SAV_UserArgs_MT448x16x16_MI16x16x1_SN_GRVWB1_GSU7_GSUC0_GSUWGMRR0_K1_LBSPPA3584_LBSPPB128_LPA16_LPB2_LRVW2_MIWT7_1_NTA0_NLCA7_SU0_SUM0_SUS0_SVW1_VWA1_WGM1_WGMXCC1_WGMXCCGn1
    SolutionIndex: 44
    SolutionNameMin: Cijk_Ailk_Bljk_S_MX_B_Bias_HAS_SAV_UserArgs_MT128x16x16_MI16x16x1_SN_GRVWB1_GSU1_GSUC0_GSUWGMRR0_K1_LBSPPA1024_LBSPPB128_LPA0_LPB2_LRVW2_MIWT2_1_NTA4_NLCA1_SU0_SUM0_SUS0_SVW2_VWA2_WGM1_WGMXCC1_WGMXCCGn1
    SolutionIndex: 45
    SolutionNameMin: Cijk_Ailk_Bljk_S_MX_B_Bias_HAS_SAV_UserArgs_MT448x16x16_MI16x16x1_SN_GRVWB1_GSU3_GSUC0_GSUWGMRR0_K1_LBSPPA3584_LBSPPB128_LPA16_LPB2_LRVW2_MIWT7_1_NTA0_NLCA7_SU0_SUM0_SUS0_SVW1_VWA1_WGM1_WGMXCC1_WGMXCCGn1
    SolutionIndex: 46
    SolutionNameMin: Cijk_Ailk_Bljk_S_MX_B_Bias_HAS_SAV_UserArgs_MT448x16x16_MI16x16x1_SN_GRVWB1_GSU1_GSUC0_GSUWGMRR0_K1_LBSPPA3584_LBSPPB128_LPA16_LPB2_LRVW2_MIWT7_1_NTA4_NLCA7_SU0_SUM0_SUS0_SVW1_VWA1_WGM1_WGMXCC1_WGMXCCGn1
    SolutionIndex: 47
    SolutionNameMin: Cijk_Ailk_Bljk_S_MX_B_Bias_HAS_SAV_UserArgs_MT448x16x16_MI16x16x1_SN_GRVWB1_GSU4_GSUC0_GSUWGMRR0_K1_LBSPPA3584_LBSPPB128_LPA16_LPB2_LRVW2_MIWT7_1_NTA0_NLCA7_SU0_SUM0_SUS0_SVW1_VWA1_WGM1_WGMXCC1_WGMXCCGn1
    SolutionIndex: 48
    SolutionNameMin: Cijk_Ailk_Bljk_S_MX_B_Bias_HAS_SAV_UserArgs_MT16x32x64_MI16x16x1_SN_LDSB0_GRVWB4_GSU16_GSUC0_GSUWGMRR0_K1_LBSPPB256_MIWT1_1_NLCB1_SU0_SUM0_SUS0_VWB1_WG16_8_1_WGM1_WGMXCC1_WGMXCCGn1
    SolutionIndex: 49
    SolutionNameMin: Cijk_Ailk_Bljk_S_MX_B_Bias_HAS_SAV_UserArgs_MT16x32x128_MI16x16x1_SN_LDSB0_GRVWB4_GSU16_GSUC0_GSUWGMRR0_K1_LBSPPB512_MIWT1_1_NLCB1_SU0_SUM0_SUS0_VWB1_WG16_8_2_WGM1_WGMXCC1_WGMXCCGn1
    SolutionIndex: 50
    SolutionNameMin: Cijk_Ailk_Bljk_S_MX_B_Bias_HAS_SAV_UserArgs_MT16x32x128_MI16x16x1_SN_LDSB0_GRVWB4_GSU19_GSUC0_GSUWGMRR0_K1_LBSPPB512_MIWT1_1_NLCB1_SU0_SUM0_SUS0_VWB1_WG16_8_2_WGM1_WGMXCC1_WGMXCCGn1
    SolutionIndex: 51
    SolutionNameMin: Cijk_Ailk_Bljk_S_MX_B_Bias_HAS_SAV_UserArgs_MT16x32x64_MI16x16x1_SN_LDSB0_GRVWB4_GSU16_GSUC0_GSUWGMRR0_K1_LBSPPA256_LBSPPB256_LPA16_LPB8_MIWT1_1_NLCB1_SU0_SUM0_SUS0_SVW1_VWA1_VWB1_WG16_8_1_WGM1_WGMXCC1_WGMXCCGn1
    SolutionIndex: 52
    SolutionNameMin: Cijk_Ailk_Bljk_S_MX_B_Bias_HAS_SAV_UserArgs_MT16x32x128_MI16x16x1_SN_LDSB0_GRVWB4_GSU20_GSUC0_GSUWGMRR0_K1_LBSPPA256_LBSPPB512_LPA16_LPB8_MIWT1_1_NLCB1_SU0_SUM0_SUS0_SVW1_VWA1_VWB1_WG16_8_1_WGM1_WGMXCC1_WGMXCCGn1
    SolutionIndex: 53
    SolutionNameMin: Cijk_Ailk_Bljk_S_MX_B_Bias_HAS_SAV_UserArgs_MT32x32x32_MI16x16x1_SN_LDSB0_GRVWB4_GSU16_GSUC0_GSUWGMRR0_K1_LBSPPA512_LBSPPB128_LPA16_LPB8_MIWT1_1_NLCB1_SU0_SUM0_SUS0_SVW1_VWA1_VWB1_WG32_8_1_WGM1_WGMXCC1_WGMXCCGn1
    SolutionIndex: 54
    SolutionNameMin: Cijk_Ailk_Bljk_S_MX_B_Bias_HAS_SAV_UserArgs_MT32x32x64_MI16x16x1_SN_LDSB0_GRVWB4_GSU16_GSUC0_GSUWGMRR0_K1_LBSPPA512_LBSPPB256_LPA16_LPB8_MIWT1_1_NLCB1_SU0_SUM0_SUS0_SVW1_VWA1_VWB1_WG32_8_1_WGM1_WGMXCC1_WGMXCCGn1
    SolutionIndex: 55
    SolutionNameMin: Cijk_Ailk_Bljk_S_MX_B_Bias_HAS_SAV_UserArgs_MT32x32x128_MI16x16x1_SN_LDSB1_GRVWB4_GSU20_GSUC0_GSUWGMRR0_K1_LBSPPA512_LBSPPB512_LPA16_LPB8_MIWT1_1_NLCB1_SU0_SUM0_SUS0_SVW1_VWA1_VWB1_WG32_8_1_WGM1_WGMXCC1_WGMXCCGn1
    SolutionIndex: 56
    SolutionNameMin: Cijk_Ailk_Bljk_S_MX_B_Bias_HAS_SAV_UserArgs_MT16x16x128_MI16x16x1_SN_LDSB0_GRVWB4_GSU1_GSUC0_GSUWGMRR0_K1_LBSPPA256_LBSPPB512_LPA16_LPB8_MIWT1_1_NLCA1_NLCB1_SU0_SUM0_SUS0_SVW1_VWA1_VWB1_WG16_4_4_WGM1_WGMXCC1_WGMXCCGn1
    SolutionIndex: 57
    SolutionNameMin: Cijk_Ailk_Bljk_S_MX_B_Bias_HAS_SAV_UserArgs_MT64x32x64_MI16x16x1_SN_LDSB1_GRVWB4_GSU16_GSUC0_GSUWGMRR0_K1_LBSPPA1024_LBSPPB512_LPA16_LPB8_MIWT1_2_NLCA1_NLCB1_SU0_SUM0_SUS0_SVW1_VWA1_VWB2_WG64_4_1_WGM1_WGMXCC1_WGMXCCGn1
    SolutionIndex: 58
    SolutionNameMin: Cijk_Ailk_Bljk_S_MX_B_Bias_HAS_SAV_UserArgs_MT64x32x64_MI16x16x1_SN_LDSB0_GRVWB4_GSU20_GSUC0_GSUWGMRR0_K1_LBSPPA1024_LBSPPB512_LPA16_LPB8_MIWT1_2_NLCA1_NLCB1_SU0_SUM0_SUS0_SVW1_VWA1_VWB2_WG64_4_1_WGM1_WGMXCC1_WGMXCCGn1
    SolutionIndex: 59
    SolutionNameMin: Cijk_Ailk_Bljk_S_MX_B_Bias_HAS_SAV_UserArgs_MT96x32x64_MI16x16x1_SN_LDSB1_GRVWB4_GSU16_GSUC0_GSUWGMRR0_K1_LBSPPA1536_LBSPPB256_LPA16_LPB8_MIWT3_1_NLCA3_NLCB1_SU0_SUM0_SUS0_SVW1_VWA1_VWB1_WG32_8_1_WGM1_WGMXCC1_WGMXCCGn1
    SolutionIndex: 60
    SolutionNameMin: Cijk_Ailk_Bljk_S_MX_B_Bias_HAS_SAV_UserArgs_MT96x32x64_MI16x16x1_SN_LDSB1_GRVWB4_GSU20_GSUC0_GSUWGMRR0_K1_LBSPPA1536_LBSPPB256_LPA16_LPB8_MIWT3_1_NLCA3_NLCB1_SU0_SUM0_SUS0_SVW1_VWA1_VWB1_WG32_8_1_WGM1_WGMXCC1_WGMXCCGn1
    SolutionIndex: 61
    SolutionNameMin: Cijk_Ailk_Bljk_S_MX_B_Bias_HAS_SAV_UserArgs_MT32x32x64_MI16x16x1_SN_LDSB0_GRVWB4_GSU4_GSUC0_GSUWGMRR0_K1_LBSPPA512_LBSPPB256_LPA16_LPB8_MIWT1_1_NLCA1_NLCB1_SU0_SUM0_SUS0_SVW1_VWA1_VWB1_WG32_8_1_WGM1_WGMXCC1_WGMXCCGn1
    SolutionIndex: 62
    SolutionNameMin: Cijk_Ailk_Bljk_S_MX_B_Bias_HAS_SAV_UserArgs_MT128x32x32_MI32x32x1_SN_LDSB1_GRVWB4_GSU20_GSUC0_GSUWGMRR0_K1_LBSPPA0_LBSPPB128_LPA0_LPB4_MIWT1_1_NLCA1_NLCB1_SU0_SUM0_SUS0_SVW1_VWA1_VWB1_WG128_2_1_WGM1_WGMXCC1_WGMXCCGn1
    SolutionIndex: 63
    SolutionNameMin: Cijk_Ailk_Bljk_S_MX_B_Bias_HAS_SAV_UserArgs_MT128x32x64_MI32x32x1_SN_LDSB1_GRVWB4_GSU20_GSUC0_GSUWGMRR0_K1_LBSPPA0_LBSPPB256_LPA0_LPB4_MIWT1_1_NLCA1_NLCB1_SU0_SUM0_SUS0_SVW1_VWA1_VWB1_WG128_2_1_WGM1_WGMXCC1_WGMXCCGn1
    SolutionIndex: 64
    SolutionNameMin: Cijk_Ailk_Bljk_S_MX_B_Bias_HAS_SAV_UserArgs_MT16x32x128_MI16x16x1_SN_LDSB0_GRVWB4_GSU1_GSUC0_GSUWGMRR0_K1_LBSPPA256_LBSPPB1024_LPA16_LPB8_MIWT1_2_NLCA1_NLCB1_SU0_SUM0_SUS0_SVW1_VWA1_VWB2_WG16_4_4_WGM1_WGMXCC1_WGMXCCGn1
    SolutionIndex: 65
    SolutionNameMin: Cijk_Ailk_Bljk_S_MX_B_Bias_HAS_SAV_UserArgs_MT192x32x32_MI16x16x1_SN_LDSB0_GRVWB4_GSU20_GSUC0_GSUWGMRR0_K1_LBSPPA3072_LBSPPB256_LPA16_LPB8_MIWT3_2_NLCA3_NLCB1_SU0_SUM0_SUS0_SVW1_VWA1_VWB2_WG64_4_1_WGM1_WGMXCC1_WGMXCCGn1
    SolutionIndex: 66
    SolutionNameMin: Cijk_Ailk_Bljk_S_MX_B_Bias_HAS_SAV_UserArgs_MT32x16x128_MI16x16x1_SN_LDSB0_GRVWB4_GSU1_GSUC0_GSUWGMRR0_K1_LBSPPA512_LBSPPB512_LPA16_LPB8_MIWT1_1_NLCA1_NLCB1_SU0_SUM0_SUS0_SVW1_VWA1_VWB1_WG32_4_2_WGM1_WGMXCC1_WGMXCCGn1
    SolutionIndex: 67
    SolutionNameMin: Cijk_Ailk_Bljk_S_MX_B_Bias_HAS_SAV_UserArgs_MT128x32x64_MI32x32x1_SN_LDSB1_GRVWB4_GSU10_GSUC0_GSUWGMRR0_K1_LBSPPA0_LBSPPB256_LPA0_LPB4_MIWT1_1_NLCA1_NLCB1_SU0_SUM0_SUS0_SVW1_VWA1_VWB1_WG128_2_1_WGM1_WGMXCC1_WGMXCCGn1
    SolutionIndex: 68
    SolutionNameMin: Cijk_Ailk_Bljk_S_MX_B_Bias_HAS_SAV_UserArgs_MT128x32x32_MI32x32x1_SN_LDSB0_GRVWB4_GSU6_GSUC0_GSUWGMRR0_K1_LBSPPA0_LBSPPB128_LPA0_LPB4_MIWT1_1_NLCA1_NLCB1_SU0_SUM0_SUS0_SVW1_VWA1_VWB1_WG128_2_1_WGM1_WGMXCC1_WGMXCCGn1
    SolutionIndex: 69
    SolutionNameMin: Cijk_Ailk_Bljk_S_MX_B_Bias_HAS_SAV_UserArgs_MT192x32x32_MI16x16x1_SN_LDSB0_GRVWB4_GSU10_GSUC0_GSUWGMRR0_K1_LBSPPA3072_LBSPPB256_LPA16_LPB8_MIWT3_2_NLCA3_NLCB1_SU0_SUM0_SUS0_SVW1_VWA1_VWB2_WG64_4_1_WGM1_WGMXCC1_WGMXCCGn1
    SolutionIndex: 70
    SolutionNameMin: Cijk_Ailk_Bljk_S_MX_B_Bias_HAS_SAV_UserArgs_MT384x32x32_MI32x32x1_SN_LDSB1_GRVWB4_GSU20_GSUC0_GSUWGMRR0_K1_LBSPPA0_LBSPPB128_LPA0_LPB4_MIWT3_1_NLCA3_NLCB1_SU0_SUM0_SUS0_SVW1_VWA1_VWB1_WG128_2_1_WGM1_WGMXCC1_WGMXCCGn1
    SolutionIndex: 71
    SolutionNameMin: Cijk_Ailk_Bljk_S_MX_B_Bias_HAS_SAV_UserArgs_MT128x32x64_MI32x32x1_SN_GRVWB4_GSU4_GSUC0_GSUWGMRR0_K1_LBSPPA0_LBSPPB256_LPA0_LPB4_MIWT1_1_NLCA1_SU0_SUM0_SUS0_SVW1_VWA1_VWB1_WG128_2_1_WGM1_WGMXCC1_WGMXCCGn1
    SolutionIndex: 72
    SolutionNameMin: Cijk_Ailk_Bljk_S_MX_B_Bias_HAS_SAV_UserArgs_MT128x32x64_MI32x32x1_SN_GRVWB4_GSU5_GSUC0_GSUWGMRR0_K1_LBSPPA0_LBSPPB256_LPA0_LPB4_MIWT1_1_NLCA1_SU0_SUM0_SUS0_SVW1_VWA1_VWB1_WG128_2_1_WGM1_WGMXCC1_WGMXCCGn1
    SolutionIndex: 73
    SolutionNameMin: Cijk_Ailk_Bljk_S_MX_B_Bias_HAS_SAV_UserArgs_MT320x32x32_MI16x16x1_SN_GRVWB4_GSU10_GSUC0_GSUWGMRR0_K1_LBSPPA5120_LBSPPB256_LPA16_LPB8_MIWT5_2_NLCA5_SU0_SUM0_SUS0_SVW1_VWA1_VWB2_WG64_4_1_WGM1_WGMXCC1_WGMXCCGn1
    SolutionIndex: 74
    SolutionNameMin: Cijk_Ailk_Bljk_S_MX_B_Bias_HAS_SAV_UserArgs_MT128x32x32_MI32x32x1_SN_GRVWB4_GSU6_GSUC0_GSUWGMRR0_K1_LBSPPA0_LBSPPB128_LPA0_LPB4_MIWT1_1_NLCA1_SU0_SUM0_SUS0_SVW1_VWA1_VWB1_WG128_2_1_WGM1_WGMXCC1_WGMXCCGn1
    SolutionIndex: 75
    SolutionNameMin: Cijk_Ailk_Bljk_S_MX_B_Bias_HAS_SAV_UserArgs_MT384x32x32_MI32x32x1_SN_GRVWB4_GSU10_GSUC0_GSUWGMRR0_K1_LBSPPA0_LBSPPB128_LPA0_LPB4_MIWT3_1_NLCA3_SU0_SUM0_SUS0_SVW1_VWA1_VWB1_WG128_2_1_WGM1_WGMXCC1_WGMXCCGn1
    SolutionIndex: 76
    SolutionNameMin: Cijk_Ailk_Bljk_S_MX_B_Bias_HAS_SAV_UserArgs_MT128x32x64_MI32x32x1_SN_CLR1_GRVWB4_GSU1_GSUC0_GSUWGMRR0_K1_LBSPPA0_LBSPPB256_LPA0_LPB4_LRVW4_MIWT1_1_NLCA1_PLR1_SU0_SUM0_SUS0_SVW1_VWA1_VWB1_WG128_2_1_WGM1_WGMXCC1_WGMXCCGn1
    SolutionIndex: 77
    SolutionNameMin: Cijk_Ailk_Bljk_S_MX_B_Bias_HAS_SAV_UserArgs_MT128x32x32_MI32x32x1_SN_CLR1_GRVWB4_GSU5_GSUC0_GSUWGMRR0_K1_LBSPPA0_LBSPPB128_LPA0_LPB4_LRVW4_MIWT1_1_NLCA1_PLR1_SU0_SUM0_SUS0_SVW1_VWA1_VWB1_WG128_2_1_WGM1_WGMXCC1_WGMXCCGn1
    SolutionIndex: 78
    SolutionNameMin: Cijk_Ailk_Bljk_S_MX_B_Bias_HAS_SAV_UserArgs_MT320x32x32_MI16x16x1_SN_CLR1_GRVWB4_GSU2_GSUC0_GSUWGMRR0_K1_LBSPPA5120_LBSPPB256_LPA16_LPB8_LRVW4_MIWT5_2_NLCA5_PLR1_SU0_SUM0_SUS0_SVW1_VWA1_VWB2_WG64_4_1_WGM1_WGMXCC1_WGMXCCGn1
    SolutionIndex: 79
    SolutionNameMin: Cijk_Ailk_Bljk_S_MX_B_Bias_HAS_SAV_UserArgs_MT384x32x16_MI32x32x1_SN_CLR1_GRVWB1_GSU5_GSUC0_GSUWGMRR0_K1_LBSPPA0_LBSPPB128_LPA0_LPB4_LRVW4_MIWT3_1_NLCA3_PLR1_SU0_SUM0_SUS0_SVW1_VWA1_VWB1_WG128_2_1_WGM1_WGMXCC1_WGMXCCGn1
    SolutionIndex: 80
    SolutionNameMin: Cijk_Ailk_Bljk_S_MX_B_Bias_HAS_SAV_UserArgs_MT128x32x32_MI32x32x1_SN_CLR1_GRVWB4_GSU1_GSUC0_GSUWGMRR0_K1_LBSPPA0_LBSPPB128_LPA0_LPB4_LRVW4_MIWT1_1_NTA4_NLCA1_PLR1_SU0_SUM0_SUS0_SVW1_VWA1_VWB1_WG128_2_1_WGM1_WGMXCC1_WGMXCCGn1
    SolutionIndex: 81
    SolutionNameMin: Cijk_Ailk_Bljk_S_MX_B_Bias_HAS_SAV_UserArgs_MT448x32x16_MI16x16x1_SN_CLR1_GRVWB1_GSU4_GSUC0_GSUWGMRR0_K1_LBSPPA3584_LBSPPB128_LPA16_LPB2_LRVW2_MIWT7_2_NTA0_NLCA7_PLR1_SU0_SUM0_SUS0_SVW1_VWA1_VWB2_WG64_4_1_WGM1_WGMXCC1_WGMXCCGn1
    SolutionIndex: 82
    SolutionNameMin: Cijk_Ailk_Bljk_S_MX_B_Bias_HAS_SAV_UserArgs_MT384x32x16_MI32x32x1_SN_CLR1_GRVWB1_GSU9_GSUC0_GSUWGMRR0_K1_LBSPPA0_LBSPPB128_LPA0_LPB4_LRVW4_MIWT3_1_NTA4_NLCA3_PLR1_SU0_SUM0_SUS0_SVW1_VWA1_VWB1_WG128_2_1_WGM1_WGMXCC1_WGMXCCGn1
    SolutionIndex: 83
    SolutionNameMin: Cijk_Ailk_Bljk_S_MX_B_Bias_HAS_SAV_UserArgs_MT320x32x32_MI16x16x1_SN_CLR1_GRVWB4_GSU1_GSUC0_GSUWGMRR0_K1_LBSPPA5120_LBSPPB256_LPA16_LPB8_LRVW4_MIWT5_2_NTA0_NLCA5_PLR1_SU0_SUM0_SUS0_SVW1_VWA1_VWB2_WG64_4_1_WGM1_WGMXCC1_WGMXCCGn1
    SolutionIndex: 84
    SolutionNameMin: Cijk_Ailk_Bljk_S_MX_B_Bias_HAS_SAV_UserArgs_MT384x32x16_MI32x32x1_SN_CLR1_GRVWB1_GSU5_GSUC0_GSUWGMRR0_K1_LBSPPA0_LBSPPB128_LPA0_LPB4_LRVW4_MIWT3_1_NTA0_NLCA3_PLR1_SU0_SUM0_SUS0_SVW1_VWA1_VWB1_WG128_2_1_WGM1_WGMXCC1_WGMXCCGn1
    SolutionIndex: 85
    SolutionNameMin: Cijk_Ailk_Bljk_S_MX_B_Bias_HAS_SAV_UserArgs_MT448x32x32_MI16x16x1_SN_GRVWB4_GSU1_GSUC0_GSUWGMRR0_K1_LBSPPA7168_LBSPPB256_LPA16_LPB8_LRVW4_MIWT7_2_NTA0_NLCA7_SU0_SUM0_SUS0_SVW1_VWA1_VWB2_WG64_4_1_WGM1_WGMXCC1_WGMXCCGn1
    SolutionIndex: 86
    SolutionNameMin: Cijk_Ailk_Bljk_S_MX_B_Bias_HAS_SAV_UserArgs_MT448x32x16_MI16x16x1_SN_GRVWB1_GSU2_GSUC0_GSUWGMRR0_K1_LBSPPA3584_LBSPPB128_LPA16_LPB2_LRVW2_MIWT7_2_NTA4_NLCA7_SU0_SUM0_SUS0_SVW1_VWA1_VWB2_WG64_4_1_WGM1_WGMXCC1_WGMXCCGn1
    SolutionIndex: 87
    SolutionNameMin: Cijk_Ailk_Bljk_S_MX_B_Bias_HAS_SAV_UserArgs_MT384x32x16_MI32x32x1_SN_GRVWB1_GSU7_GSUC0_GSUWGMRR0_K1_LBSPPA0_LBSPPB128_LPA0_LPB4_LRVW4_MIWT3_1_NTA4_NLCA3_SU0_SUM0_SUS0_SVW1_VWA1_VWB1_WG128_2_1_WGM1_WGMXCC1_WGMXCCGn1
    SolutionIndex: 88
    SolutionNameMin: Cijk_Ailk_Bljk_S_MX_B_Bias_HAS_SAV_UserArgs_MT320x32x16_MI16x16x1_SN_GRVWB1_GSU1_GSUC0_GSUWGMRR0_K1_LBSPPA2560_LBSPPB128_LPA16_LPB2_LRVW2_MIWT5_2_NTA4_NLCA5_SU0_SUM0_SUS0_SVW1_VWA1_VWB2_WG64_4_1_WGM1_WGMXCC1_WGMXCCGn1
    SolutionIndex: 89
    SolutionNameMin: Cijk_Ailk_Bljk_S_MX_B_Bias_HAS_SAV_UserArgs_MT128x32x32_MI32x32x1_SN_GRVWB4_GSU1_GSUC0_GSUWGMRR0_K1_LBSPPA0_LBSPPB128_LPA0_LPB4_LRVW4_MIWT1_1_NTA0_NLCA1_SU0_SUM0_SUS0_SVW1_VWA1_VWB1_WG128_2_1_WGM1_WGMXCC1_WGMXCCGn1
    SolutionIndex: 90
    SolutionNameMin: Cijk_Ailk_Bljk_S_MX_B_Bias_HAS_SAV_UserArgs_MT384x32x16_MI32x32x1_SN_GRVWB1_GSU5_GSUC0_GSUWGMRR0_K1_LBSPPA0_LBSPPB128_LPA0_LPB4_LRVW4_MIWT3_1_NTA0_NLCA3_SU0_SUM0_SUS0_SVW1_VWA1_VWB1_WG128_2_1_WGM1_WGMXCC1_WGMXCCGn1
    SolutionIndex: 91
    SolutionNameMin: Cijk_Ailk_Bljk_S_MX_B_Bias_HAS_SAV_UserArgs_MT448x32x16_MI16x16x1_SN_GRVWB1_GSU1_GSUC0_GSUWGMRR0_K1_LBSPPA3584_LBSPPB128_LPA16_LPB2_LRVW2_MIWT7_2_NTA4_NLCA7_SU0_SUM0_SUS0_SVW1_VWA1_VWB2_WG64_4_1_WGM1_WGMXCC1_WGMXCCGn1
    SolutionIndex: 92
    SolutionNameMin: Cijk_Ailk_Bljk_S_MX_B_Bias_HAS_SAV_UserArgs_MT448x32x16_MI16x16x1_SN_GRVWB1_GSU1_GSUC0_GSUWGMRR0_K1_LBSPPA3584_LBSPPB128_LPA16_LPB2_LRVW2_MIWT7_2_NTA0_NLCA7_SU0_SUM0_SUS0_SVW1_VWA1_VWB2_WG64_4_1_WGM1_WGMXCC1_WGMXCCGn1
    SolutionIndex: 93
    SolutionNameMin: Cijk_Ailk_Bljk_S_MX_B_Bias_HAS_SAV_UserArgs_MT384x32x16_MI32x32x1_SN_GRVWB1_GSU6_GSUC0_GSUWGMRR0_K1_LBSPPA0_LBSPPB128_LPA0_LPB4_LRVW4_MIWT3_1_NTA0_NLCA3_SU0_SUM0_SUS0_SVW1_VWA1_VWB1_WG128_2_1_WGM1_WGMXCC1_WGMXCCGn1
    SolutionIndex: 94
    SolutionNameMin: Cijk_Ailk_Bljk_S_MX_B_Bias_HAS_SAV_UserArgs_MT128x32x32_MI32x32x1_SN_GRVWB4_GSU1_GSUC0_GSUWGMRR0_K1_LBSPPA0_LBSPPB128_LPA0_LPB4_LRVW4_MIWT1_1_NTA4_NLCA1_SU0_SUM0_SUS0_SVW1_VWA1_VWB1_WG128_2_1_WGM1_WGMXCC1_WGMXCCGn1
    SolutionIndex: 95
    SolutionNameMin: Cijk_Ailk_Bljk_S_MX_B_Bias_HAS_SAV_UserArgs_MT448x32x16_MI16x16x1_SN_GRVWB1_GSU3_GSUC0_GSUWGMRR0_K1_LBSPPA3584_LBSPPB128_LPA16_LPB2_LRVW2_MIWT7_2_NTA0_NLCA7_SU0_SUM0_SUS0_SVW1_VWA1_VWB2_WG64_4_1_WGM1_WGMXCC1_WGMXCCGn1
    SolutionIndex: 96
    SolutionNameMin: Cijk_Ailk_Bljk_S_MX_B_Bias_HAS_SAV_UserArgs_MT16x64x64_MI16x16x1_SN_LDSB0_GRVWB4_GSU16_GSUC0_GSUWGMRR0_K1_LBSPPB256_MIWT1_1_NLCB1_SU0_SUM0_SUS0_VWB1_WG16_16_1_WGM1_WGMXCC1_WGMXCCGn1
    SolutionIndex: 97
    SolutionNameMin: Cijk_Ailk_Bljk_S_MX_B_Bias_HAS_SAV_UserArgs_MT16x64x128_MI16x16x1_SN_LDSB1_GRVWB4_GSU19_GSUC0_GSUWGMRR0_K1_LBSPPB512_MIWT1_1_NLCB1_SU0_SUM0_SUS0_VWB1_WG16_16_1_WGM1_WGMXCC1_WGMXCCGn1
    SolutionIndex: 98
    SolutionNameMin: Cijk_Ailk_Bljk_S_MX_B_Bias_HAS_SAV_UserArgs_MT16x64x64_MI16x16x1_SN_LDSB0_GRVWB4_GSU16_GSUC0_GSUWGMRR0_K1_LBSPPA256_LBSPPB256_LPA16_LPB8_MIWT1_1_NLCB1_SU0_SUM0_SUS0_SVW1_VWA1_VWB1_WG16_16_1_WGM1_WGMXCC1_WGMXCCGn1
    SolutionIndex: 99
    SolutionNameMin: Cijk_Ailk_Bljk_S_MX_B_Bias_HAS_SAV_UserArgs_MT16x64x128_MI16x16x1_SN_LDSB1_GRVWB4_GSU19_GSUC0_GSUWGMRR0_K1_LBSPPA256_LBSPPB512_LPA16_LPB8_MIWT1_1_NLCB1_SU0_SUM0_SUS0_SVW1_VWA1_VWB1_WG16_16_1_WGM1_WGMXCC1_WGMXCCGn1
    SolutionIndex: 100
    SolutionNameMin: Cijk_Ailk_Bljk_S_MX_B_Bias_HAS_SAV_UserArgs_MT16x16x128_MI16x16x1_SN_LDSB0_GRVWB4_GSU1_GSUC0_GSUWGMRR0_K1_LBSPPA256_LBSPPB512_LPA16_LPB8_MIWT1_1_NLCB1_SU0_SUM0_SUS0_SVW1_VWA1_VWB1_WG16_4_4_WGM1_WGMXCC1_WGMXCCGn1
    SolutionIndex: 101
    SolutionNameMin: Cijk_Ailk_Bljk_S_MX_B_Bias_HAS_SAV_UserArgs_MT32x64x64_MI16x16x1_SN_LDSB1_GRVWB4_GSU20_GSUC0_GSUWGMRR0_K1_LBSPPA512_LBSPPB512_LPA16_LPB8_MIWT1_2_NLCB1_SU0_SUM0_SUS0_SVW1_VWA1_VWB2_WG32_8_1_WGM1_WGMXCC1_WGMXCCGn1
    SolutionIndex: 102
    SolutionNameMin: Cijk_Ailk_Bljk_S_MX_B_Bias_HAS_SAV_UserArgs_MT32x64x64_MI32x32x1_SN_LDSB0_GRVWB4_GSU20_GSUC0_GSUWGMRR0_K1_LBSPPA0_LBSPPB256_LPA0_LPB4_MIWT1_1_NLCB1_SU0_SUM0_SUS0_SVW1_VWA1_VWB1_WG32_4_1_WGM1_WGMXCC1_WGMXCCGn1
    SolutionIndex: 103
    SolutionNameMin: Cijk_Ailk_Bljk_S_MX_B_Bias_HAS_SAV_UserArgs_MT16x16x128_MI16x16x1_SN_LDSB0_GRVWB4_GSU1_GSUC0_GSUWGMRR0_K1_LBSPPA256_LBSPPB512_LPA16_LPB8_MIWT1_1_NLCA1_NLCB1_SU0_SUM0_SUS0_SVW1_VWA1_VWB1_WG16_4_2_WGM1_WGMXCC1_WGMXCCGn1
    SolutionIndex: 104
    SolutionNameMin: Cijk_Ailk_Bljk_S_MX_B_Bias_HAS_SAV_UserArgs_MT64x64x64_MI32x32x1_SN_LDSB1_GRVWB4_GSU17_GSUC0_GSUWGMRR0_K1_LBSPPA0_LBSPPB256_LPA0_LPB4_MIWT1_1_NLCA1_NLCB1_SU0_SUM0_SUS0_SVW1_VWA1_VWB1_WG64_4_1_WGM1_WGMXCC1_WGMXCCGn1
    SolutionIndex: 105
    SolutionNameMin: Cijk_Ailk_Bljk_S_MX_B_Bias_HAS_SAV_UserArgs_MT64x64x64_MI32x32x1_SN_LDSB1_GRVWB4_GSU20_GSUC0_GSUWGMRR0_K1_LBSPPA0_LBSPPB256_LPA0_LPB4_MIWT1_1_NLCA1_NLCB1_SU0_SUM0_SUS0_SVW1_VWA1_VWB1_WG64_4_1_WGM1_WGMXCC1_WGMXCCGn1
    SolutionIndex: 106
    SolutionNameMin: Cijk_Ailk_Bljk_S_MX_B_Bias_HAS_SAV_UserArgs_MT96x64x64_MI16x16x1_SN_LDSB1_GRVWB4_GSU18_GSUC0_GSUWGMRR0_K1_LBSPPA1536_LBSPPB512_LPA16_LPB8_MIWT3_2_NLCA3_NLCB1_SU0_SUM0_SUS0_SVW1_VWA1_VWB2_WG32_8_1_WGM1_WGMXCC1_WGMXCCGn1
    SolutionIndex: 107
    SolutionNameMin: Cijk_Ailk_Bljk_S_MX_B_Bias_HAS_SAV_UserArgs_MT96x64x64_MI16x16x1_SN_LDSB1_GRVWB4_GSU20_GSUC0_GSUWGMRR0_K1_LBSPPA1536_LBSPPB512_LPA16_LPB8_MIWT3_2_NLCA3_NLCB1_SU0_SUM0_SUS0_SVW1_VWA1_VWB2_WG32_8_1_WGM1_WGMXCC1_WGMXCCGn1
    SolutionIndex: 108
    SolutionNameMin: Cijk_Ailk_Bljk_S_MX_B_Bias_HAS_SAV_UserArgs_MT128x64x32_MI32x32x1_SN_LDSB0_GRVWB4_GSU19_GSUC0_GSUWGMRR0_K1_LBSPPA0_LBSPPB256_LPA0_LPB4_MIWT1_2_NLCA1_NLCB1_SU0_SUM0_SUS0_SVW1_VWA1_VWB2_WG128_2_1_WGM1_WGMXCC1_WGMXCCGn1
    SolutionIndex: 109
    SolutionNameMin: Cijk_Ailk_Bljk_S_MX_B_Bias_HAS_SAV_UserArgs_MT128x64x64_MI32x32x1_SN_LDSB1_GRVWB4_GSU20_GSUC0_GSUWGMRR0_K1_LBSPPA0_LBSPPB512_LPA0_LPB4_MIWT1_2_NLCA1_NLCB1_SU0_SUM0_SUS0_SVW1_VWA1_VWB2_WG128_2_1_WGM1_WGMXCC1_WGMXCCGn1
    SolutionIndex: 110
    SolutionNameMin: Cijk_Ailk_Bljk_S_MX_B_Bias_HAS_SAV_UserArgs_MT64x64x32_MI32x32x1_SN_LDSB0_GRVWB4_GSU6_GSUC0_GSUWGMRR0_K1_LBSPPA0_LBSPPB128_LPA0_LPB4_MIWT1_1_NLCA1_NLCB1_SU0_SUM0_SUS0_SVW1_VWA1_VWB1_WG64_4_1_WGM1_WGMXCC1_WGMXCCGn1
    SolutionIndex: 111
    SolutionNameMin: Cijk_Ailk_Bljk_S_MX_B_Bias_HAS_SAV_UserArgs_MT192x64x32_MI16x16x1_SN_LDSB1_GRVWB4_GSU20_GSUC0_GSUWGMRR0_K1_LBSPPA3072_LBSPPB512_LPA16_LPB8_MIWT3_4_NLCA3_NLCB1_SU0_SUM0_SUS0_SVW1_VWA1_VWB4_WG64_4_1_WGM1_WGMXCC1_WGMXCCGn1
    SolutionIndex: 112
    SolutionNameMin: Cijk_Ailk_Bljk_S_MX_B_Bias_HAS_SAV_UserArgs_MT128x64x32_MI32x32x1_SN_CLR1_GRVWB4_GSU5_GSUC0_GSUWGMRR0_K1_LBSPPA0_LBSPPB256_LPA0_LPB4_LRVW4_MIAV1_MIWT1_2_NLCA1_PLR1_SU0_SUM0_SUS0_SVW1_VWA1_VWB2_WG128_2_1_WGM1_WGMXCC1_WGMXCCGn1
    SolutionIndex: 113
    SolutionNameMin: Cijk_Ailk_Bljk_S_MX_B_Bias_HAS_SAV_UserArgs_MT256x64x32_MI32x32x1_SN_CLR1_GRVWB4_GSU10_GSUC0_GSUWGMRR0_K1_LBSPPA0_LBSPPB256_LPA0_LPB4_LRVW4_MIAV1_MIWT2_2_NLCA1_PLR1_SU0_SUM0_SUS0_SVW2_VWA2_VWB2_WG128_2_1_WGM1_WGMXCC1_WGMXCCGn1
    SolutionIndex: 114
    SolutionNameMin: Cijk_Ailk_Bljk_S_MX_B_Bias_HAS_SAV_UserArgs_MT64x32x128_MI32x32x1_SN_CLR1_GRVWB4_GSU1_GSUC0_GSUWGMRR0_K1_LBSPPA0_LBSPPB512_LPA0_LPB4_LRVW4_MIAV1_MIWT1_1_NLCA1_PLR1_SU0_SUM0_SUS0_SVW1_VWA1_VWB1_WG64_2_2_WGM1_WGMXCC1_WGMXCCGn1
    SolutionIndex: 115
    SolutionNameMin: Cijk_Ailk_Bljk_S_MX_B_Bias_HAS_SAV_UserArgs_MT128x64x64_MI32x32x1_SN_CLR1_GRVWB4_GSU4_GSUC0_GSUWGMRR0_K1_LBSPPA0_LBSPPB512_LPA0_LPB4_LRVW4_MIAV1_MIWT2_2_NLCA1_PLR1_SU0_SUM0_SUS0_SVW2_VWA2_VWB2_WG64_2_2_WGM1_WGMXCC1_WGMXCCGn1
    SolutionIndex: 116
    SolutionNameMin: Cijk_Ailk_Bljk_S_MX_B_Bias_HAS_SAV_UserArgs_MT320x64x32_MI16x16x1_SN_CLR1_GRVWB4_GSU10_GSUC0_GSUWGMRR0_K1_LBSPPA5120_LBSPPB512_LPA16_LPB8_LRVW4_MIAV1_MIWT5_4_NLCA5_PLR1_SU0_SUM0_SUS0_SVW1_VWA1_VWB4_WG64_4_1_WGM1_WGMXCC1_WGMXCCGn1
    SolutionIndex: 117
    SolutionNameMin: Cijk_Ailk_Bljk_S_MX_B_Bias_HAS_SAV_UserArgs_MT128x64x32_MI32x32x1_SN_CLR1_GRVWB4_GSU3_GSUC0_GSUWGMRR0_K1_LBSPPA0_LBSPPB256_LPA0_LPB4_LRVW4_MIAV1_MIWT1_2_NLCA1_PLR1_SU0_SUM0_SUS0_SVW1_VWA1_VWB2_WG128_2_1_WGM1_WGMXCC1_WGMXCCGn1
    SolutionIndex: 118
    SolutionNameMin: Cijk_Ailk_Bljk_S_MX_B_Bias_HAS_SAV_UserArgs_MT384x64x32_MI32x32x1_SN_CLR1_GRVWB4_GSU10_GSUC0_GSUWGMRR0_K1_LBSPPA0_LBSPPB256_LPA0_LPB4_LRVW4_MIAV0_MIWT3_2_NLCA3_PLR1_SU0_SUM0_SUS0_SVW1_VWA1_VWB2_WG128_2_1_WGM1_WGMXCC1_WGMXCCGn1
    SolutionIndex: 119
    SolutionNameMin: Cijk_Ailk_Bljk_S_MX_B_Bias_HAS_SAV_UserArgs_MT64x64x64_MI32x32x1_SN_CLR1_GRVWB4_GSU1_GSUC0_GSUWGMRR0_K1_LBSPPA0_LBSPPB512_LPA0_LPB4_LRVW4_MIAV1_MIWT1_2_NLCA1_PLR1_SU0_SUM0_SUS0_SVW1_VWA1_VWB2_WG64_2_2_WGM1_WGMXCC1_WGMXCCGn1
    SolutionIndex: 120
    SolutionNameMin: Cijk_Ailk_Bljk_S_MX_B_Bias_HAS_SAV_UserArgs_MT256x64x32_MI32x32x1_SN_CLR1_GRVWB4_GSU5_GSUC0_GSUWGMRR0_K1_LBSPPA0_LBSPPB256_LPA0_LPB4_LRVW4_MIAV1_MIWT2_2_NLCA1_PLR1_SU0_SUM0_SUS0_SVW2_VWA2_VWB2_WG128_2_1_WGM1_WGMXCC1_WGMXCCGn1
    SolutionIndex: 121
    SolutionNameMin: Cijk_Ailk_Bljk_S_MX_B_Bias_HAS_SAV_UserArgs_MT256x64x32_MI32x32x1_SN_CLR1_GRVWB4_GSU3_GSUC0_GSUWGMRR0_K1_LBSPPA0_LBSPPB256_LPA0_LPB4_LRVW4_MIAV1_MIWT2_2_NLCA1_PLR1_SU0_SUM0_SUS0_SVW2_VWA2_VWB2_WG128_2_1_WGM1_WGMXCC1_WGMXCCGn1
    SolutionIndex: 122
    SolutionNameMin: Cijk_Ailk_Bljk_S_MX_B_Bias_HAS_SAV_UserArgs_MT384x64x32_MI32x32x1_SN_CLR1_GRVWB4_GSU5_GSUC0_GSUWGMRR0_K1_LBSPPA0_LBSPPB256_LPA0_LPB4_LRVW4_MIAV0_MIWT3_2_NLCA3_PLR1_SU0_SUM0_SUS0_SVW1_VWA1_VWB2_WG128_2_1_WGM1_WGMXCC1_WGMXCCGn1
    SolutionIndex: 123
    SolutionNameMin: Cijk_Ailk_Bljk_S_MX_B_Bias_HAS_SAV_UserArgs_MT128x64x64_MI32x32x1_SN_CLR1_GRVWB4_GSU1_GSUC0_GSUWGMRR0_K1_LBSPPA0_LBSPPB512_LPA0_LPB4_LRVW4_MIAV1_MIWT2_2_NLCA1_PLR1_SU0_SUM0_SUS0_SVW2_VWA2_VWB2_WG64_2_2_WGM1_WGMXCC1_WGMXCCGn1
    SolutionIndex: 124
    SolutionNameMin: Cijk_Ailk_Bljk_S_MX_B_Bias_HAS_SAV_UserArgs_MT256x64x16_MI32x32x1_SN_CLR1_GRVWB4_GSU5_GSUC0_GSUWGMRR0_K1_LBSPPA0_LBSPPB128_LPA0_LPB4_LRVW4_MIAV1_MIWT2_2_NLCA1_PLR1_SU0_SUM0_SUS0_SVW2_VWA2_VWB2_WG128_2_1_WGM1_WGMXCC1_WGMXCCGn1
    SolutionIndex: 125
    SolutionNameMin: Cijk_Ailk_Bljk_S_MX_B_Bias_HAS_SAV_UserArgs_MT160x64x32_MI16x16x1_SN_CLR1_GRVWB4_GSU1_GSUC0_GSUWGMRR0_K1_LBSPPA2560_LBSPPB256_LPA16_LPB8_LRVW4_MIAV1_MIWT5_2_NLCA5_PLR1_SU0_SUM0_SUS0_SVW1_VWA1_VWB2_WG32_8_1_WGM1_WGMXCC1_WGMXCCGn1
    SolutionIndex: 126
    SolutionNameMin: Cijk_Ailk_Bljk_S_MX_B_Bias_HAS_SAV_UserArgs_MT384x64x16_MI32x32x1_SN_CLR1_GRVWB4_GSU5_GSUC0_GSUWGMRR0_K1_LBSPPA0_LBSPPB128_LPA0_LPB4_LRVW4_MIAV0_MIWT3_2_NLCA3_PLR1_SU0_SUM0_SUS0_SVW1_VWA1_VWB2_WG128_2_1_WGM1_WGMXCC1_WGMXCCGn1
    SolutionIndex: 127
    SolutionNameMin: Cijk_Ailk_Bljk_S_MX_B_Bias_HAS_SAV_UserArgs_MT256x64x32_MI32x32x1_SN_GRVWB4_GSU1_GSUC0_GSUWGMRR0_K1_LBSPPA0_LBSPPB256_LPA0_LPB4_LRVW4_MIAV1_MIWT2_2_NTA4_NLCA1_SU0_SUM0_SUS0_SVW2_VWA2_VWB2_WG128_2_1_WGM1_WGMXCC1_WGMXCCGn1
    SolutionIndex: 128
    SolutionNameMin: Cijk_Ailk_Bljk_S_MX_B_Bias_HAS_SAV_UserArgs_MT448x64x16_MI16x16x1_SN_GRVWB4_GSU2_GSUC0_GSUWGMRR0_K1_LBSPPA3584_LBSPPB256_LPA16_LPB4_LRVW2_MIAV0_MIWT7_4_NTA4_NLCA7_SU0_SUM0_SUS0_SVW1_VWA1_VWB4_WG64_4_1_WGM1_WGMXCC1_WGMXCCGn1
    SolutionIndex: 129
    SolutionNameMin: Cijk_Ailk_Bljk_S_MX_B_Bias_HAS_SAV_UserArgs_MT384x64x16_MI32x32x1_SN_GRVWB4_GSU7_GSUC0_GSUWGMRR0_K1_LBSPPA0_LBSPPB128_LPA0_LPB4_LRVW4_MIAV0_MIWT3_2_NTA4_NLCA3_SU0_SUM0_SUS0_SVW1_VWA1_VWB2_WG128_2_1_WGM1_WGMXCC1_WGMXCCGn1
    SolutionIndex: 130
    SolutionNameMin: Cijk_Ailk_Bljk_S_MX_B_Bias_HAS_SAV_UserArgs_MT320x64x32_MI16x16x1_SN_GRVWB4_GSU1_GSUC0_GSUWGMRR0_K1_LBSPPA5120_LBSPPB512_LPA16_LPB8_LRVW4_MIAV1_MIWT5_4_NTA0_NLCA5_SU0_SUM0_SUS0_SVW1_VWA1_VWB4_WG64_4_1_WGM1_WGMXCC1_WGMXCCGn1
    SolutionIndex: 131
    SolutionNameMin: Cijk_Ailk_Bljk_S_MX_B_Bias_HAS_SAV_UserArgs_MT384x64x16_MI32x32x1_SN_GRVWB4_GSU5_GSUC0_GSUWGMRR0_K1_LBSPPA0_LBSPPB128_LPA0_LPB4_LRVW4_MIAV0_MIWT3_2_NTA4_NLCA3_SU0_SUM0_SUS0_SVW1_VWA1_VWB2_WG128_2_1_WGM1_WGMXCC1_WGMXCCGn1
    SolutionIndex: 132
    SolutionNameMin: Cijk_Ailk_Bljk_S_MX_B_Bias_HAS_SAV_UserArgs_MT448x64x16_MI16x16x1_SN_GRVWB4_GSU1_GSUC0_GSUWGMRR0_K1_LBSPPA3584_LBSPPB256_LPA16_LPB4_LRVW2_MIAV0_MIWT7_4_NTA4_NLCA7_SU0_SUM0_SUS0_SVW1_VWA1_VWB4_WG64_4_1_WGM1_WGMXCC1_WGMXCCGn1
    SolutionIndex: 133
    SolutionNameMin: Cijk_Ailk_Bljk_S_MX_B_Bias_HAS_SAV_UserArgs_MT320x64x16_MI32x32x1_SN_GRVWB4_GSU1_GSUC0_GSUWGMRR0_K1_LBSPPA0_LBSPPB128_LPA0_LPB4_LRVW4_MIAV1_MIWT5_1_NTA4_NLCA5_SU0_SUM0_SUS0_SVW1_VWA1_VWB1_WG64_4_1_WGM1_WGMXCC1_WGMXCCGn1
    SolutionIndex: 134
    SolutionNameMin: Cijk_Ailk_Bljk_S_MX_B_Bias_HAS_SAV_UserArgs_MT384x64x16_MI32x32x1_SN_GRVWB4_GSU3_GSUC0_GSUWGMRR0_K1_LBSPPA0_LBSPPB128_LPA0_LPB4_LRVW4_MIAV0_MIWT3_2_NTA4_NLCA3_SU0_SUM0_SUS0_SVW1_VWA1_VWB2_WG128_2_1_WGM1_WGMXCC1_WGMXCCGn1
    SolutionIndex: 135
    SolutionNameMin: Cijk_Ailk_Bljk_S_MX_B_Bias_HAS_SAV_UserArgs_MT256x64x16_MI32x32x1_SN_GRVWB4_GSU1_GSUC0_GSUWGMRR0_K1_LBSPPA0_LBSPPB128_LPA0_LPB4_LRVW4_MIAV1_MIWT2_2_NTA4_NLCA1_SU0_SUM0_SUS0_SVW2_VWA2_VWB2_WG128_2_1_WGM1_WGMXCC1_WGMXCCGn1
    SolutionIndex: 136
    SolutionNameMin: Cijk_Ailk_Bljk_S_MX_B_Bias_HAS_SAV_UserArgs_MT384x64x16_MI32x32x1_SN_GRVWB4_GSU1_GSUC0_GSUWGMRR0_K1_LBSPPA0_LBSPPB128_LPA0_LPB4_LRVW4_MIAV0_MIWT3_2_NTA4_NLCA3_SU0_SUM0_SUS0_SVW1_VWA1_VWB2_WG128_2_1_WGM1_WGMXCC1_WGMXCCGn1
    SolutionIndex: 137
    SolutionNameMin: Cijk_Ailk_Bljk_S_MX_B_Bias_HAS_SAV_UserArgs_MT384x64x16_MI32x32x1_SN_GRVWB4_GSU2_GSUC0_GSUWGMRR0_K1_LBSPPA0_LBSPPB128_LPA0_LPB4_LRVW4_MIAV0_MIWT3_2_NTA4_NLCA3_SU0_SUM0_SUS0_SVW1_VWA1_VWB2_WG128_2_1_WGM1_WGMXCC1_WGMXCCGn1
    SolutionIndex: 138
    SolutionNameMin: Cijk_Ailk_Bljk_S_MX_B_Bias_HAS_SAV_UserArgs_MT16x16x128_MI16x16x1_SN_LDSB0_GRVWB4_GSU1_GSUC0_GSUWGMRR0_K1_LBSPPB512_MIWT1_1_NLCB1_SU0_SUM0_SUS0_VWB1_WG16_4_4_WGM1_WGMXCC1_WGMXCCGn1
    SolutionIndex: 139
    SolutionNameMin: Cijk_Ailk_Bljk_S_MX_B_Bias_HAS_SAV_UserArgs_MT16x32x64_MI16x16x1_SN_LDSB0_GRVWB4_GSU13_GSUC0_GSUWGMRR0_K1_LBSPPB256_MIWT1_1_NLCB1_SU0_SUM0_SUS0_VWB1_WG16_8_1_WGM1_WGMXCC1_WGMXCCGn1
    SolutionIndex: 140
    SolutionNameMin: Cijk_Ailk_Bljk_S_MX_B_Bias_HAS_SAV_UserArgs_MT16x96x128_MI16x16x1_SN_LDSB1_GRVWB4_GSU19_GSUC0_GSUWGMRR0_K1_LBSPPB512_MIWT1_3_NLCB1_SU0_SUM0_SUS0_VWB1_WG16_8_2_WGM1_WGMXCC1_WGMXCCGn1
    SolutionIndex: 141
    SolutionNameMin: Cijk_Ailk_Bljk_S_MX_B_Bias_HAS_SAV_UserArgs_MT16x32x128_MI16x16x1_SN_LDSB1_GRVWB4_GSU13_GSUC0_GSUWGMRR0_K1_LBSPPA256_LBSPPB512_LPA16_LPB8_MIWT1_1_NLCB1_SU0_SUM0_SUS0_SVW1_VWA1_VWB1_WG16_8_1_WGM1_WGMXCC1_WGMXCCGn1
    SolutionIndex: 142
    SolutionNameMin: Cijk_Ailk_Bljk_S_MX_B_Bias_HAS_SAV_UserArgs_MT32x96x64_MI16x16x1_SN_LDSB1_GRVWB4_GSU16_GSUC0_GSUWGMRR0_K1_LBSPPA512_LBSPPB256_LPA16_LPB8_MIWT1_3_NLCB1_SU0_SUM0_SUS0_SVW1_VWA1_VWB1_WG32_8_1_WGM1_WGMXCC1_WGMXCCGn1
    SolutionIndex: 143
    SolutionNameMin: Cijk_Ailk_Bljk_S_MX_B_Bias_HAS_SAV_UserArgs_MT32x96x64_MI16x16x1_SN_LDSB1_GRVWB4_GSU20_GSUC0_GSUWGMRR0_K1_LBSPPA512_LBSPPB256_LPA16_LPB8_MIWT1_3_NLCB1_SU0_SUM0_SUS0_SVW1_VWA1_VWB1_WG32_8_1_WGM1_WGMXCC1_WGMXCCGn1
    SolutionIndex: 144
    SolutionNameMin: Cijk_Ailk_Bljk_S_MX_B_Bias_HAS_SAV_UserArgs_MT128x32x32_MI32x32x1_SN_LDSB0_GRVWB4_GSU6_GSUC0_GSUWGMRR0_K1_LBSPPA0_LBSPPB128_LPA0_LPB4_MIWT1_1_NLCA1_SU0_SUM0_SUS0_SVW1_VWA1_VWB1_WG128_2_1_WGM1_WGMXCC1_WGMXCCGn1
    SolutionIndex: 145
    SolutionNameMin: Cijk_Ailk_Bljk_S_MX_B_Bias_HAS_SAV_UserArgs_MT128x96x32_MI32x32x1_SN_LDSB0_GRVWB4_GSU19_GSUC0_GSUWGMRR0_K1_LBSPPA0_LBSPPB128_LPA0_LPB4_MIWT1_3_NLCA1_SU0_SUM0_SUS0_SVW1_VWA1_VWB1_WG128_2_1_WGM1_WGMXCC1_WGMXCCGn1
    SolutionIndex: 146
    SolutionNameMin: Cijk_Ailk_Bljk_S_MX_B_Bias_HAS_SAV_UserArgs_MT128x96x32_MI32x32x1_SN_LDSB0_GRVWB4_GSU20_GSUC0_GSUWGMRR0_K1_LBSPPA0_LBSPPB128_LPA0_LPB4_MIWT1_3_NLCA1_SU0_SUM0_SUS0_SVW1_VWA1_VWB1_WG128_2_1_WGM1_WGMXCC1_WGMXCCGn1
    SolutionIndex: 147
    SolutionNameMin: Cijk_Ailk_Bljk_S_MX_B_Bias_HAS_SAV_UserArgs_MT32x32x128_MI16x16x1_SN_LDSB1_GRVWB4_GSU1_GSUC0_GSUWGMRR0_K1_LBSPPA512_LBSPPB1024_LPA16_LPB8_MIWT1_2_NLCA1_SU0_SUM0_SUS0_SVW1_VWA1_VWB2_WG32_4_2_WGM1_WGMXCC1_WGMXCCGn1
    SolutionIndex: 148
    SolutionNameMin: Cijk_Ailk_Bljk_S_MX_B_Bias_HAS_SAV_UserArgs_MT192x96x32_MI16x16x1_SN_LDSB1_GRVWB4_GSU20_GSUC0_GSUWGMRR0_K1_LBSPPA3072_LBSPPB256_LPA16_LPB8_MIWT3_6_NLCA3_SU0_SUM0_SUS0_SVW1_VWA1_VWB2_WG64_4_1_WGM1_WGMXCC1_WGMXCCGn1
    SolutionIndex: 149
    SolutionNameMin: Cijk_Ailk_Bljk_S_MX_B_Bias_HAS_SAV_UserArgs_MT128x96x32_MI32x32x1_SN_LDSB0_CLR1_GRVWB4_GSU8_GSUC0_GSUWGMRR0_K1_LBSPPA0_LBSPPB128_LPA0_LPB4_LRVW4_MIAV1_MIWT1_3_NLCA1_PLR1_SU0_SUM0_SUS0_SVW1_VWA1_VWB1_WG128_2_1_WGM1_WGMXCC1_WGMXCCGn1
    SolutionIndex: 150
    SolutionNameMin: Cijk_Ailk_Bljk_S_MX_B_Bias_HAS_SAV_UserArgs_MT128x96x32_MI32x32x1_SN_LDSB0_CLR1_GRVWB4_GSU10_GSUC0_GSUWGMRR0_K1_LBSPPA0_LBSPPB128_LPA0_LPB4_LRVW4_MIAV1_MIWT1_3_NLCA1_PLR1_SU0_SUM0_SUS0_SVW1_VWA1_VWB1_WG128_2_1_WGM1_WGMXCC1_WGMXCCGn1
    SolutionIndex: 151
    SolutionNameMin: Cijk_Ailk_Bljk_S_MX_B_Bias_HAS_SAV_UserArgs_MT256x96x32_MI32x32x1_SN_LDSB1_CLR1_GRVWB4_GSU20_GSUC0_GSUWGMRR0_K1_LBSPPA0_LBSPPB128_LPA0_LPB4_LRVW4_MIAV0_MIWT2_3_NLCA1_PLR1_SU0_SUM0_SUS0_SVW2_VWA2_VWB1_WG128_2_1_WGM1_WGMXCC1_WGMXCCGn1
    SolutionIndex: 152
    SolutionNameMin: Cijk_Ailk_Bljk_S_MX_B_Bias_HAS_SAV_UserArgs_MT64x32x64_MI32x32x1_SN_LDSB0_CLR1_GRVWB4_GSU1_GSUC0_GSUWGMRR0_K1_LBSPPA0_LBSPPB256_LPA0_LPB4_LRVW4_MIAV1_MIWT1_1_NLCA1_PLR1_SU0_SUM0_SUS0_SVW1_VWA1_VWB1_WG64_2_2_WGM1_WGMXCC1_WGMXCCGn1
    SolutionIndex: 153
    SolutionNameMin: Cijk_Ailk_Bljk_S_MX_B_Bias_HAS_SAV_UserArgs_MT192x96x32_MI16x16x1_SN_LDSB1_CLR1_GRVWB4_GSU10_GSUC0_GSUWGMRR0_K1_LBSPPA3072_LBSPPB256_LPA16_LPB8_LRVW4_MIAV1_MIWT3_6_NLCA3_PLR1_SU0_SUM0_SUS0_SVW1_VWA1_VWB2_WG64_4_1_WGM1_WGMXCC1_WGMXCCGn1
    SolutionIndex: 154
    SolutionNameMin: Cijk_Ailk_Bljk_S_MX_B_Bias_HAS_SAV_UserArgs_MT384x96x32_MI32x32x1_SN_LDSB1_CLR1_GRVWB4_GSU20_GSUC0_GSUWGMRR0_K1_LBSPPA0_LBSPPB128_LPA0_LPB4_LRVW4_MIAV0_MIWT3_3_NLCA3_PLR1_SU0_SUM0_SUS0_SVW1_VWA1_VWB1_WG128_2_1_WGM1_WGMXCC1_WGMXCCGn1
    SolutionIndex: 155
    SolutionNameMin: Cijk_Ailk_Bljk_S_MX_B_Bias_HAS_SAV_UserArgs_MT128x96x32_MI32x32x1_SN_CLR1_GRVWB4_GSU5_GSUC0_GSUWGMRR0_K1_LBSPPA0_LBSPPB128_LPA0_LPB4_LRVW4_MIAV1_MIWT1_3_NLCA1_PLR1_SU0_SUM0_SUS0_SVW1_VWA1_VWB1_WG128_2_1_WGM1_WGMXCC1_WGMXCCGn1
    SolutionIndex: 156
    SolutionNameMin: Cijk_Ailk_Bljk_S_MX_B_Bias_HAS_SAV_UserArgs_MT256x96x32_MI32x32x1_SN_CLR1_GRVWB4_GSU10_GSUC0_GSUWGMRR0_K1_LBSPPA0_LBSPPB128_LPA0_LPB4_LRVW4_MIAV0_MIWT2_3_NLCA1_PLR1_SU0_SUM0_SUS0_SVW2_VWA2_VWB1_WG128_2_1_WGM1_WGMXCC1_WGMXCCGn1
    SolutionIndex: 157
    SolutionNameMin: Cijk_Ailk_Bljk_S_MX_B_Bias_HAS_SAV_UserArgs_MT128x96x32_MI32x32x1_SN_CLR1_GRVWB4_GSU4_GSUC0_GSUWGMRR0_K1_LBSPPA0_LBSPPB128_LPA0_LPB4_LRVW4_MIAV1_MIWT1_3_NLCA1_PLR1_SU0_SUM0_SUS0_SVW1_VWA1_VWB1_WG128_2_1_WGM1_WGMXCC1_WGMXCCGn1
    SolutionIndex: 158
    SolutionNameMin: Cijk_Ailk_Bljk_S_MX_B_Bias_HAS_SAV_UserArgs_MT320x96x32_MI16x16x1_SN_CLR1_GRVWB4_GSU10_GSUC0_GSUWGMRR0_K1_LBSPPA5120_LBSPPB256_LPA16_LPB8_LRVW4_MIAV0_MIWT5_6_NLCA5_PLR1_SU0_SUM0_SUS0_SVW1_VWA1_VWB2_WG64_4_1_WGM1_WGMXCC1_WGMXCCGn1
    SolutionIndex: 159
    SolutionNameMin: Cijk_Ailk_Bljk_S_MX_B_Bias_HAS_SAV_UserArgs_MT192x96x32_MI16x16x1_SN_CLR1_GRVWB4_GSU5_GSUC0_GSUWGMRR0_K1_LBSPPA3072_LBSPPB256_LPA16_LPB8_LRVW4_MIAV1_MIWT3_6_NLCA3_PLR1_SU0_SUM0_SUS0_SVW1_VWA1_VWB2_WG64_4_1_WGM1_WGMXCC1_WGMXCCGn1
    SolutionIndex: 160
    SolutionNameMin: Cijk_Ailk_Bljk_S_MX_B_Bias_HAS_SAV_UserArgs_MT384x96x32_MI32x32x1_SN_CLR1_GRVWB4_GSU10_GSUC0_GSUWGMRR0_K1_LBSPPA0_LBSPPB128_LPA0_LPB4_LRVW4_MIAV0_MIWT3_3_NLCA3_PLR1_SU0_SUM0_SUS0_SVW1_VWA1_VWB1_WG128_2_1_WGM1_WGMXCC1_WGMXCCGn1
    SolutionIndex: 161
    SolutionNameMin: Cijk_Ailk_Bljk_S_MX_B_Bias_HAS_SAV_UserArgs_MT256x96x32_MI32x32x1_SN_CLR1_GRVWB4_GSU4_GSUC0_GSUWGMRR0_K1_LBSPPA0_LBSPPB128_LPA0_LPB4_LRVW4_MIAV0_MIWT2_3_NLCA1_PLR1_SU0_SUM0_SUS0_SVW2_VWA2_VWB1_WG128_2_1_WGM1_WGMXCC1_WGMXCCGn1
    SolutionIndex: 162
    SolutionNameMin: Cijk_Ailk_Bljk_S_MX_B_Bias_HAS_SAV_UserArgs_MT256x96x32_MI32x32x1_SN_CLR1_GRVWB4_GSU5_GSUC0_GSUWGMRR0_K1_LBSPPA0_LBSPPB128_LPA0_LPB4_LRVW4_MIAV0_MIWT2_3_NLCA1_PLR1_SU0_SUM0_SUS0_SVW2_VWA2_VWB1_WG128_2_1_WGM1_WGMXCC1_WGMXCCGn1
    SolutionIndex: 163
    SolutionNameMin: Cijk_Ailk_Bljk_S_MX_B_Bias_HAS_SAV_UserArgs_MT256x96x32_MI32x32x1_SN_CLR1_GRVWB4_GSU3_GSUC0_GSUWGMRR0_K1_LBSPPA0_LBSPPB128_LPA0_LPB4_LRVW4_MIAV0_MIWT2_3_NLCA1_PLR1_SU0_SUM0_SUS0_SVW2_VWA2_VWB1_WG128_2_1_WGM1_WGMXCC1_WGMXCCGn1
    SolutionIndex: 164
    SolutionNameMin: Cijk_Ailk_Bljk_S_MX_B_Bias_HAS_SAV_UserArgs_MT384x96x32_MI32x32x1_SN_CLR1_GRVWB4_GSU5_GSUC0_GSUWGMRR0_K1_LBSPPA0_LBSPPB128_LPA0_LPB4_LRVW4_MIAV0_MIWT3_3_NLCA3_PLR1_SU0_SUM0_SUS0_SVW1_VWA1_VWB1_WG128_2_1_WGM1_WGMXCC1_WGMXCCGn1
    SolutionIndex: 165
    SolutionNameMin: Cijk_Ailk_Bljk_S_MX_B_Bias_HAS_SAV_UserArgs_MT256x96x32_MI32x32x1_SN_GRVWB4_GSU2_GSUC0_GSUWGMRR0_K1_LBSPPA0_LBSPPB128_LPA0_LPB4_LRVW4_MIAV0_MIWT2_3_NLCA1_SU0_SUM0_SUS0_SVW2_VWA2_VWB1_WG128_2_1_WGM1_WGMXCC1_WGMXCCGn1
    SolutionIndex: 166
    SolutionNameMin: Cijk_Ailk_Bljk_S_MX_B_Bias_HAS_SAV_UserArgs_MT256x96x32_MI32x32x1_SN_GRVWB4_GSU5_GSUC0_GSUWGMRR0_K1_LBSPPA0_LBSPPB128_LPA0_LPB4_LRVW4_MIAV0_MIWT2_3_NLCA1_SU0_SUM0_SUS0_SVW2_VWA2_VWB1_WG128_2_1_WGM1_WGMXCC1_WGMXCCGn1
    SolutionIndex: 167
    SolutionNameMin: Cijk_Ailk_Bljk_S_MX_B_Bias_HAS_SAV_UserArgs_MT160x96x32_MI16x16x1_SN_GRVWB4_GSU1_GSUC0_GSUWGMRR0_K1_LBSPPA2560_LBSPPB128_LPA16_LPB8_LRVW4_MIAV1_MIWT5_3_NLCA5_SU0_SUM0_SUS0_SVW1_VWA1_VWB1_WG32_8_1_WGM1_WGMXCC1_WGMXCCGn1
    SolutionIndex: 168
    SolutionNameMin: Cijk_Ailk_Bljk_S_MX_B_Bias_HAS_SAV_UserArgs_MT384x96x32_MI32x32x1_SN_GRVWB4_GSU5_GSUC0_GSUWGMRR0_K1_LBSPPA0_LBSPPB128_LPA0_LPB4_LRVW4_MIAV0_MIWT3_3_NLCA3_SU0_SUM0_SUS0_SVW1_VWA1_VWB1_WG128_2_1_WGM1_WGMXCC1_WGMXCCGn1
    SolutionIndex: 169
    SolutionNameMin: Cijk_Ailk_Bljk_S_MX_B_Bias_HAS_SAV_UserArgs_MT256x96x32_MI32x32x1_SN_GRVWB4_GSU1_GSUC0_GSUWGMRR0_K1_LBSPPA0_LBSPPB128_LPA0_LPB4_LRVW4_MIAV0_MIWT2_3_NTA4_NLCA1_SU0_SUM0_SUS0_SVW2_VWA2_VWB1_WG128_2_1_WGM1_WGMXCC1_WGMXCCGn1
    SolutionIndex: 170
    SolutionNameMin: Cijk_Ailk_Bljk_S_MX_B_Bias_HAS_SAV_UserArgs_MT256x96x32_MI32x32x1_SN_GRVWB4_GSU5_GSUC0_GSUWGMRR0_K1_LBSPPA0_LBSPPB128_LPA0_LPB4_LRVW4_MIAV0_MIWT2_3_NTA4_NLCA1_SU0_SUM0_SUS0_SVW2_VWA2_VWB1_WG128_2_1_WGM1_WGMXCC1_WGMXCCGn1
    SolutionIndex: 171
    SolutionNameMin: Cijk_Ailk_Bljk_S_MX_B_Bias_HAS_SAV_UserArgs_MT320x96x32_MI16x16x1_SN_GRVWB4_GSU1_GSUC0_GSUWGMRR0_K1_LBSPPA5120_LBSPPB256_LPA16_LPB8_LRVW4_MIAV0_MIWT5_6_NTA4_NLCA5_SU0_SUM0_SUS0_SVW1_VWA1_VWB2_WG64_4_1_WGM1_WGMXCC1_WGMXCCGn1
    SolutionIndex: 172
    SolutionNameMin: Cijk_Ailk_Bljk_S_MX_B_Bias_HAS_SAV_UserArgs_MT320x96x32_MI16x16x1_SN_GRVWB4_GSU1_GSUC0_GSUWGMRR0_K1_LBSPPA5120_LBSPPB256_LPA16_LPB8_LRVW4_MIAV0_MIWT5_6_NTA0_NLCA5_SU0_SUM0_SUS0_SVW1_VWA1_VWB2_WG64_4_1_WGM1_WGMXCC1_WGMXCCGn1
    SolutionIndex: 173
    SolutionNameMin: Cijk_Ailk_Bljk_S_MX_B_Bias_HAS_SAV_UserArgs_MT384x96x32_MI32x32x1_SN_GRVWB4_GSU5_GSUC0_GSUWGMRR0_K1_LBSPPA0_LBSPPB128_LPA0_LPB4_LRVW4_MIAV0_MIWT3_3_NTA4_NLCA3_SU0_SUM0_SUS0_SVW1_VWA1_VWB1_WG128_2_1_WGM1_WGMXCC1_WGMXCCGn1
    SolutionIndex: 174
    SolutionNameMin: Cijk_Ailk_Bljk_S_MX_B_Bias_HAS_SAV_UserArgs_MT448x96x16_MI16x16x1_SN_GRVWB1_GSU1_GSUC0_GSUWGMRR0_K1_LBSPPA3584_LBSPPB128_LPA16_LPB2_LRVW2_MIAV0_MIWT7_6_NTA0_NLCA7_SU0_SUM0_SUS0_SVW1_VWA1_VWB2_WG64_4_1_WGM1_WGMXCC1_WGMXCCGn1
    SolutionIndex: 175
    SolutionNameMin: Cijk_Ailk_Bljk_S_MX_B_Bias_HAS_SAV_UserArgs_MT256x96x32_MI32x32x1_SN_GRVWB4_GSU3_GSUC0_GSUWGMRR0_K1_LBSPPA0_LBSPPB128_LPA0_LPB4_LRVW4_MIAV0_MIWT2_3_NTA4_NLCA1_SU0_SUM0_SUS0_SVW2_VWA2_VWB1_WG128_2_1_WGM1_WGMXCC1_WGMXCCGn1
    SolutionIndex: 176
    SolutionNameMin: Cijk_Ailk_Bljk_S_MX_B_Bias_HAS_SAV_UserArgs_MT320x96x16_MI16x16x1_SN_GRVWB1_GSU1_GSUC0_GSUWGMRR0_K1_LBSPPA2560_LBSPPB128_LPA16_LPB2_LRVW2_MIAV0_MIWT5_6_NTA4_NLCA5_SU0_SUM0_SUS0_SVW1_VWA1_VWB2_WG64_4_1_WGM1_WGMXCC1_WGMXCCGn1
    SolutionIndex: 177
    SolutionNameMin: Cijk_Ailk_Bljk_S_MX_B_Bias_HAS_SAV_UserArgs_MT384x96x32_MI32x32x1_SN_GRVWB4_GSU3_GSUC0_GSUWGMRR0_K1_LBSPPA0_LBSPPB128_LPA0_LPB4_LRVW4_MIAV0_MIWT3_3_NTA4_NLCA3_SU0_SUM0_SUS0_SVW1_VWA1_VWB1_WG128_2_1_WGM1_WGMXCC1_WGMXCCGn1
    SolutionIndex: 178
    SolutionNameMin: Cijk_Ailk_Bljk_S_MX_B_Bias_HAS_SAV_UserArgs_MT448x96x16_MI16x16x1_SN_GRVWB1_GSU1_GSUC0_GSUWGMRR0_K1_LBSPPA3584_LBSPPB128_LPA16_LPB2_LRVW2_MIAV0_MIWT7_6_NTA4_NLCA7_SU0_SUM0_SUS0_SVW1_VWA1_VWB2_WG64_4_1_WGM1_WGMXCC1_WGMXCCGn1
    SolutionIndex: 179
    SolutionNameMin: Cijk_Ailk_Bljk_S_MX_B_Bias_HAS_SAV_UserArgs_MT512x96x16_MI32x32x1_SN_GRVWB1_GSU1_GSUC0_GSUWGMRR0_K1_LBSPPA0_LBSPPB128_LPA0_LPB4_LRVW4_MIAV0_MIWT4_3_NTA0_NLCA1_SU0_SUM0_SUS0_SVW4_VWA4_VWB1_WG128_2_1_WGM1_WGMXCC1_WGMXCCGn1
    SolutionIndex: 180
    SolutionNameMin: Cijk_Ailk_Bljk_S_MX_B_Bias_HAS_SAV_UserArgs_MT256x96x32_MI32x32x1_SN_GRVWB4_GSU1_GSUC0_GSUWGMRR0_K1_LBSPPA0_LBSPPB128_LPA0_LPB4_LRVW4_MIAV0_MIWT2_3_NTA0_NLCA1_SU0_SUM0_SUS0_SVW2_VWA2_VWB1_WG128_2_1_WGM1_WGMXCC1_WGMXCCGn1
    SolutionIndex: 181
    SolutionNameMin: Cijk_Ailk_Bljk_S_MX_B_Bias_HAS_SAV_UserArgs_MT256x96x16_MI32x32x1_SN_GRVWB1_GSU1_GSUC0_GSUWGMRR0_K1_LBSPPA0_LBSPPB128_LPA0_LPB4_LRVW4_MIAV0_MIWT2_3_NTA0_NLCA1_SU0_SUM0_SUS0_SVW2_VWA2_VWB1_WG128_2_1_WGM1_WGMXCC1_WGMXCCGn1
    SolutionIndex: 182
    SolutionNameMin: Cijk_Ailk_Bljk_S_MX_B_Bias_HAS_SAV_UserArgs_MT384x96x16_MI32x32x1_SN_GRVWB1_GSU1_GSUC0_GSUWGMRR0_K1_LBSPPA0_LBSPPB128_LPA0_LPB4_LRVW4_MIAV0_MIWT3_3_NTA0_NLCA3_SU0_SUM0_SUS0_SVW1_VWA1_VWB1_WG128_2_1_WGM1_WGMXCC1_WGMXCCGn1
    SolutionIndex: 183
    SolutionNameMin: Cijk_Ailk_Bljk_S_MX_B_Bias_HAS_SAV_UserArgs_MT384x96x32_MI32x32x1_SN_GRVWB4_GSU2_GSUC0_GSUWGMRR0_K1_LBSPPA0_LBSPPB128_LPA0_LPB4_LRVW4_MIAV0_MIWT3_3_NTA4_NLCA3_SU0_SUM0_SUS0_SVW1_VWA1_VWB1_WG128_2_1_WGM1_WGMXCC1_WGMXCCGn1
    SolutionIndex: 184
    SolutionNameMin: Cijk_Ailk_Bljk_S_MX_B_Bias_HAS_SAV_UserArgs_MT16x64x128_MI16x16x1_SN_LDSB1_GRVWB4_GSU10_GSUC0_GSUWGMRR0_K1_LBSPPA256_LBSPPB512_LPA16_LPB8_MIWT1_1_NLCB1_SU0_SUM0_SUS0_SVW1_VWA1_VWB1_WG16_16_1_WGM1_WGMXCC1_WGMXCCGn1
    SolutionIndex: 185
    SolutionNameMin: Cijk_Ailk_Bljk_S_MX_B_Bias_HAS_SAV_UserArgs_MT32x128x64_MI32x32x1_SN_LDSB1_GRVWB4_GSU16_GSUC0_GSUWGMRR0_K1_LBSPPA0_LBSPPB256_LPA0_LPB4_MIWT1_1_NLCB1_SU0_SUM0_SUS0_SVW1_VWA1_VWB1_WG32_8_1_WGM1_WGMXCC1_WGMXCCGn1
    SolutionIndex: 186
    SolutionNameMin: Cijk_Ailk_Bljk_S_MX_B_Bias_HAS_SAV_UserArgs_MT32x128x64_MI32x32x1_SN_LDSB1_GRVWB4_GSU20_GSUC0_GSUWGMRR0_K1_LBSPPA0_LBSPPB256_LPA0_LPB4_MIWT1_1_NLCB1_SU0_SUM0_SUS0_SVW1_VWA1_VWB1_WG32_8_1_WGM1_WGMXCC1_WGMXCCGn1
    SolutionIndex: 187
    SolutionNameMin: Cijk_Ailk_Bljk_S_MX_B_Bias_HAS_SAV_UserArgs_MT64x64x64_MI32x32x1_SN_LDSB1_GRVWB4_GSU10_GSUC0_GSUWGMRR0_K1_LBSPPA0_LBSPPB256_LPA0_LPB4_MIWT1_1_NLCA1_NLCB1_SU0_SUM0_SUS0_SVW1_VWA1_VWB1_WG64_4_1_WGM1_WGMXCC1_WGMXCCGn1
    SolutionIndex: 188
    SolutionNameMin: Cijk_Ailk_Bljk_S_MX_B_Bias_HAS_SAV_UserArgs_MT64x128x64_MI32x32x1_SN_LDSB1_GRVWB4_GSU20_GSUC0_GSUWGMRR0_K1_LBSPPA0_LBSPPB512_LPA0_LPB4_MIWT1_2_NLCA1_NLCB1_SU0_SUM0_SUS0_SVW1_VWA1_VWB2_WG64_4_1_WGM1_WGMXCC1_WGMXCCGn1
    SolutionIndex: 189
    SolutionNameMin: Cijk_Ailk_Bljk_S_MX_B_Bias_HAS_SAV_UserArgs_MT96x64x32_MI16x16x1_SN_LDSB1_GRVWB4_GSU10_GSUC0_GSUWGMRR0_K1_LBSPPA1536_LBSPPB256_LPA16_LPB8_MIWT3_2_NLCA3_NLCB1_SU0_SUM0_SUS0_SVW1_VWA1_VWB2_WG32_8_1_WGM1_WGMXCC1_WGMXCCGn1
    SolutionIndex: 190
    SolutionNameMin: Cijk_Ailk_Bljk_S_MX_B_Bias_HAS_SAV_UserArgs_MT96x64x64_MI16x16x1_SN_LDSB1_GRVWB4_GSU10_GSUC0_GSUWGMRR0_K1_LBSPPA1536_LBSPPB512_LPA16_LPB8_MIWT3_2_NLCA3_NLCB1_SU0_SUM0_SUS0_SVW1_VWA1_VWB2_WG32_8_1_WGM1_WGMXCC1_WGMXCCGn1
    SolutionIndex: 191
    SolutionNameMin: Cijk_Ailk_Bljk_S_MX_B_Bias_HAS_SAV_UserArgs_MT96x128x64_MI16x16x1_SN_LDSB1_GRVWB4_GSU20_GSUC0_GSUWGMRR0_K1_LBSPPA1536_LBSPPB1024_LPA16_LPB8_MIWT3_4_NLCA3_NLCB1_SU0_SUM0_SUS0_SVW1_VWA1_VWB4_WG32_8_1_WGM1_WGMXCC1_WGMXCCGn1
    SolutionIndex: 192
    SolutionNameMin: Cijk_Ailk_Bljk_S_MX_B_Bias_HAS_SAV_UserArgs_MT64x64x32_MI32x32x1_SN_LDSB0_GRVWB4_GSU5_GSUC0_GSUWGMRR0_K1_LBSPPA0_LBSPPB128_LPA0_LPB4_MIAV1_MIWT1_1_NLCA1_SU0_SUM0_SUS0_SVW1_VWA1_VWB1_WG64_4_1_WGM1_WGMXCC1_WGMXCCGn1
    SolutionIndex: 193
    SolutionNameMin: Cijk_Ailk_Bljk_S_MX_B_Bias_HAS_SAV_UserArgs_MT128x64x32_MI32x32x1_SN_LDSB0_GRVWB4_GSU10_GSUC0_GSUWGMRR0_K1_LBSPPA0_LBSPPB256_LPA0_LPB4_MIAV1_MIWT1_2_NLCA1_SU0_SUM0_SUS0_SVW1_VWA1_VWB2_WG128_2_1_WGM1_WGMXCC1_WGMXCCGn1
    SolutionIndex: 194
    SolutionNameMin: Cijk_Ailk_Bljk_S_MX_B_Bias_HAS_SAV_UserArgs_MT128x128x32_MI32x32x1_SN_LDSB1_GRVWB4_GSU20_GSUC0_GSUWGMRR0_K1_LBSPPA0_LBSPPB256_LPA0_LPB4_MIAV1_MIWT2_2_NLCA1_SU0_SUM0_SUS0_SVW2_VWA2_VWB2_WG64_4_1_WGM1_WGMXCC1_WGMXCCGn1
    SolutionIndex: 195
    SolutionNameMin: Cijk_Ailk_Bljk_S_MX_B_Bias_HAS_SAV_UserArgs_MT64x64x64_MI32x32x1_SN_LDSB1_GRVWB4_GSU3_GSUC0_GSUWGMRR0_K1_LBSPPA0_LBSPPB256_LPA0_LPB4_MIAV1_MIWT1_1_NLCA1_SU0_SUM0_SUS0_SVW1_VWA1_VWB1_WG64_4_1_WGM1_WGMXCC1_WGMXCCGn1
    SolutionIndex: 196
    SolutionNameMin: Cijk_Ailk_Bljk_S_MX_B_Bias_HAS_SAV_UserArgs_MT96x128x32_MI32x32x1_SN_LDSB0_GRVWB4_GSU10_GSUC0_GSUWGMRR0_K1_LBSPPA0_LBSPPB128_LPA0_LPB4_MIAV1_MIWT3_1_NLCA3_SU0_SUM0_SUS0_SVW1_VWA1_VWB1_WG32_8_1_WGM1_WGMXCC1_WGMXCCGn1
    SolutionIndex: 197
    SolutionNameMin: Cijk_Ailk_Bljk_S_MX_B_Bias_HAS_SAV_UserArgs_MT192x128x32_MI32x32x1_SN_LDSB1_GRVWB4_GSU20_GSUC0_GSUWGMRR0_K1_LBSPPA0_LBSPPB256_LPA0_LPB4_MIAV0_MIWT3_2_NLCA3_SU0_SUM0_SUS0_SVW1_VWA1_VWB2_WG64_4_1_WGM1_WGMXCC1_WGMXCCGn1
    SolutionIndex: 198
    SolutionNameMin: Cijk_Ailk_Bljk_S_MX_B_Bias_HAS_SAV_UserArgs_MT128x64x32_MI32x32x1_SN_LDSB0_CLR1_GRVWB4_GSU5_GSUC0_GSUWGMRR0_K1_LBSPPA0_LBSPPB256_LPA0_LPB4_LRVW4_MIAV1_MIWT1_2_NLCA1_PLR1_SU0_SUM0_SUS0_SVW1_VWA1_VWB2_WG128_2_1_WGM1_WGMXCC1_WGMXCCGn1
    SolutionIndex: 199
    SolutionNameMin: Cijk_Ailk_Bljk_S_MX_B_Bias_HAS_SAV_UserArgs_MT128x128x32_MI32x32x1_SN_LDSB1_CLR1_GRVWB4_GSU10_GSUC0_GSUWGMRR0_K1_LBSPPA0_LBSPPB256_LPA0_LPB4_LRVW4_MIAV1_MIWT2_2_NLCA1_PLR1_SU0_SUM0_SUS0_SVW2_VWA2_VWB2_WG64_4_1_WGM1_WGMXCC1_WGMXCCGn1
    SolutionIndex: 200
    SolutionNameMin: Cijk_Ailk_Bljk_S_MX_B_Bias_HAS_SAV_UserArgs_MT256x128x32_MI32x32x1_SN_LDSB1_CLR1_GRVWB4_GSU20_GSUC0_GSUWGMRR0_K1_LBSPPA0_LBSPPB512_LPA0_LPB4_LRVW4_MIAV0_MIWT2_4_NLCA1_PLR1_SU0_SUM0_SUS0_SVW2_VWA2_VWB4_WG128_2_1_WGM1_WGMXCC1_WGMXCCGn1
    SolutionIndex: 201
    SolutionNameMin: Cijk_Ailk_Bljk_S_MX_B_Bias_HAS_SAV_UserArgs_MT128x64x32_MI32x32x1_SN_LDSB0_CLR1_GRVWB4_GSU3_GSUC0_GSUWGMRR0_K1_LBSPPA0_LBSPPB256_LPA0_LPB4_LRVW4_MIAV1_MIWT1_2_NLCA1_PLR1_SU0_SUM0_SUS0_SVW1_VWA1_VWB2_WG128_2_1_WGM1_WGMXCC1_WGMXCCGn1
    SolutionIndex: 202
    SolutionNameMin: Cijk_Ailk_Bljk_S_MX_B_Bias_HAS_SAV_UserArgs_MT192x128x32_MI16x16x1_SN_LDSB1_CLR1_GRVWB4_GSU10_GSUC0_GSUWGMRR0_K1_LBSPPA3072_LBSPPB512_LPA16_LPB8_LRVW4_MIAV0_MIWT3_8_NLCA3_PLR1_SU0_SUM0_SUS0_SVW1_VWA1_VWB4_WG64_4_1_WGM1_WGMXCC1_WGMXCCGn1
    SolutionIndex: 203
    SolutionNameMin: Cijk_Ailk_Bljk_S_MX_B_Bias_HAS_SAV_UserArgs_MT128x128x32_MI32x32x1_SN_CLR1_GRVWB4_GSU5_GSUC0_GSUWGMRR0_K1_LBSPPA0_LBSPPB256_LPA0_LPB4_LRVW4_MIAV1_MIWT2_2_NLCA1_PLR1_SU0_SUM0_SUS0_SVW2_VWA2_VWB2_WG64_4_1_WGM1_WGMXCC1_WGMXCCGn1
    SolutionIndex: 204
    SolutionNameMin: Cijk_Ailk_Bljk_S_MX_B_Bias_HAS_SAV_UserArgs_MT256x128x32_MI32x32x1_SN_CLR1_GRVWB4_GSU9_GSUC0_GSUWGMRR0_K1_LBSPPA0_LBSPPB512_LPA0_LPB4_LRVW4_MIAV0_MIWT2_4_NLCA1_PLR1_SU0_SUM0_SUS0_SVW2_VWA2_VWB4_WG128_2_1_WGM1_WGMXCC1_WGMXCCGn1
    SolutionIndex: 205
    SolutionNameMin: Cijk_Ailk_Bljk_S_MX_B_Bias_HAS_SAV_UserArgs_MT320x128x32_MI32x32x1_SN_CLR1_GRVWB4_GSU10_GSUC0_GSUWGMRR0_K1_LBSPPA0_LBSPPB256_LPA0_LPB4_LRVW4_MIAV0_MIWT5_2_NLCA5_PLR1_SU0_SUM0_SUS0_SVW1_VWA1_VWB2_WG64_4_1_WGM1_WGMXCC1_WGMXCCGn1
    SolutionIndex: 206
    SolutionNameMin: Cijk_Ailk_Bljk_S_MX_B_Bias_HAS_SAV_UserArgs_MT128x128x32_MI32x32x1_SN_CLR1_GRVWB4_GSU3_GSUC0_GSUWGMRR0_K1_LBSPPA0_LBSPPB256_LPA0_LPB4_LRVW4_MIAV1_MIWT2_2_NLCA1_PLR1_SU0_SUM0_SUS0_SVW2_VWA2_VWB2_WG64_4_1_WGM1_WGMXCC1_WGMXCCGn1
    SolutionIndex: 207
    SolutionNameMin: Cijk_Ailk_Bljk_S_MX_B_Bias_HAS_SAV_UserArgs_MT192x128x32_MI32x32x1_SN_CLR1_GRVWB4_GSU5_GSUC0_GSUWGMRR0_K1_LBSPPA0_LBSPPB256_LPA0_LPB4_LRVW4_MIAV0_MIWT3_2_NLCA3_PLR1_SU0_SUM0_SUS0_SVW1_VWA1_VWB2_WG64_4_1_WGM1_WGMXCC1_WGMXCCGn1
    SolutionIndex: 208
    SolutionNameMin: Cijk_Ailk_Bljk_S_MX_B_Bias_HAS_SAV_UserArgs_MT384x128x16_MI32x32x1_SN_CLR1_GRVWB4_GSU10_GSUC0_GSUWGMRR0_K1_LBSPPA0_LBSPPB256_LPA0_LPB4_LRVW4_MIAV0_MIWT3_4_NLCA3_PLR1_SU0_SUM0_SUS0_SVW1_VWA1_VWB4_WG128_2_1_WGM1_WGMXCC1_WGMXCCGn1
    SolutionIndex: 209
    SolutionNameMin: Cijk_Ailk_Bljk_S_MX_B_Bias_HAS_SAV_UserArgs_MT256x128x32_MI32x32x1_SN_CLR1_GRVWB4_GSU5_GSUC0_GSUWGMRR0_K1_LBSPPA0_LBSPPB512_LPA0_LPB4_LRVW4_MIAV0_MIWT2_4_NLCA1_PLR1_SU0_SUM0_SUS0_SVW2_VWA2_VWB4_WG128_2_1_WGM1_WGMXCC1_WGMXCCGn1
    SolutionIndex: 210
    SolutionNameMin: Cijk_Ailk_Bljk_S_MX_B_Bias_HAS_SAV_UserArgs_MT256x128x32_MI32x32x1_SN_CLR1_GRVWB4_GSU3_GSUC0_GSUWGMRR0_K1_LBSPPA0_LBSPPB512_LPA0_LPB4_LRVW4_MIAV0_MIWT2_4_NLCA1_PLR1_SU0_SUM0_SUS0_SVW2_VWA2_VWB4_WG128_2_1_WGM1_WGMXCC1_WGMXCCGn1
    SolutionIndex: 211
    SolutionNameMin: Cijk_Ailk_Bljk_S_MX_B_Bias_HAS_SAV_UserArgs_MT384x128x16_MI32x32x1_SN_CLR1_GRVWB4_GSU5_GSUC0_GSUWGMRR0_K1_LBSPPA0_LBSPPB256_LPA0_LPB4_LRVW4_MIAV0_MIWT3_4_NLCA3_PLR1_SU0_SUM0_SUS0_SVW1_VWA1_VWB4_WG128_2_1_WGM1_WGMXCC1_WGMXCCGn1
    SolutionIndex: 212
    SolutionNameMin: Cijk_Ailk_Bljk_S_MX_B_Bias_HAS_SAV_UserArgs_MT128x128x32_MI32x32x1_SN_GRVWB4_GSU1_GSUC0_GSUWGMRR0_K1_LBSPPA0_LBSPPB256_LPA0_LPB4_LRVW4_MIAV1_MIWT2_2_NLCA1_SU0_SUM0_SUS0_SVW2_VWA2_VWB2_WG64_4_1_WGM1_WGMXCC1_WGMXCCGn1
    SolutionIndex: 213
    SolutionNameMin: Cijk_Ailk_Bljk_S_MX_B_Bias_HAS_SAV_UserArgs_MT256x128x16_MI32x32x1_SN_GRVWB4_GSU5_GSUC0_GSUWGMRR0_K1_LBSPPA0_LBSPPB256_LPA0_LPB4_LRVW4_MIAV0_MIWT2_4_NLCA1_SU0_SUM0_SUS0_SVW2_VWA2_VWB4_WG128_2_1_WGM1_WGMXCC1_WGMXCCGn1
    SolutionIndex: 214
    SolutionNameMin: Cijk_Ailk_Bljk_S_MX_B_Bias_HAS_SAV_UserArgs_MT256x128x32_MI32x32x1_SN_GRVWB4_GSU5_GSUC0_GSUWGMRR0_K1_LBSPPA0_LBSPPB512_LPA0_LPB4_LRVW4_MIAV0_MIWT2_4_NLCA1_SU0_SUM0_SUS0_SVW2_VWA2_VWB4_WG128_2_1_WGM1_WGMXCC1_WGMXCCGn1
    SolutionIndex: 215
    SolutionNameMin: Cijk_Ailk_Bljk_S_MX_B_Bias_HAS_SAV_UserArgs_MT160x128x32_MI16x16x1_SN_GRVWB4_GSU1_GSUC0_GSUWGMRR0_K1_LBSPPA2560_LBSPPB512_LPA16_LPB8_LRVW4_MIAV1_MIWT5_4_NLCA5_SU0_SUM0_SUS0_SVW1_VWA1_VWB4_WG32_8_1_WGM1_WGMXCC1_WGMXCCGn1
    SolutionIndex: 216
    SolutionNameMin: Cijk_Ailk_Bljk_S_MX_B_Bias_HAS_SAV_UserArgs_MT320x128x32_MI32x32x1_SN_GRVWB4_GSU2_GSUC0_GSUWGMRR0_K1_LBSPPA0_LBSPPB256_LPA0_LPB4_LRVW4_MIAV0_MIWT5_2_NLCA5_SU0_SUM0_SUS0_SVW1_VWA1_VWB2_WG64_4_1_WGM1_WGMXCC1_WGMXCCGn1
    SolutionIndex: 217
    SolutionNameMin: Cijk_Ailk_Bljk_S_MX_B_Bias_HAS_SAV_UserArgs_MT384x128x16_MI32x32x1_SN_GRVWB4_GSU5_GSUC0_GSUWGMRR0_K1_LBSPPA0_LBSPPB256_LPA0_LPB4_LRVW4_MIAV0_MIWT3_4_NLCA3_SU0_SUM0_SUS0_SVW1_VWA1_VWB4_WG128_2_1_WGM1_WGMXCC1_WGMXCCGn1
    SolutionIndex: 218
    SolutionNameMin: Cijk_Ailk_Bljk_S_MX_B_Bias_HAS_SAV_UserArgs_MT512x128x16_MI32x32x1_SN_GRVWB4_GSU1_GSUC0_GSUWGMRR0_K1_LBSPPA0_LBSPPB256_LPA0_LPB4_LRVW4_MIAV0_MIWT4_4_NTA4_NTC0_NTD0_NLCA1_SU0_SUM0_SUS0_SVW4_VWA4_VWB4_WG128_2_1_WGM1_WGMXCC1_WGMXCCGn1
    SolutionIndex: 219
    SolutionNameMin: Cijk_Ailk_Bljk_S_MX_B_Bias_HAS_SAV_UserArgs_MT448x128x16_MI32x32x1_SN_GRVWB4_GSU1_GSUC0_GSUWGMRR0_K1_LBSPPA0_LBSPPB128_LPA0_LPB4_LRVW4_MIAV0_MIWT7_2_NTA0_NTC0_NTD0_NLCA7_SU0_SUM0_SUS0_SVW1_VWA1_VWB2_WG64_4_1_WGM1_WGMXCC1_WGMXCCGn1
    SolutionIndex: 220
    SolutionNameMin: Cijk_Ailk_Bljk_S_MX_B_Bias_HAS_SAV_UserArgs_MT448x128x16_MI32x32x1_SN_GRVWB4_GSU1_GSUC0_GSUWGMRR0_K1_LBSPPA0_LBSPPB128_LPA0_LPB4_LRVW4_MIAV0_MIWT7_2_NTA4_NTC0_NTD0_NLCA7_SU0_SUM0_SUS0_SVW1_VWA1_VWB2_WG64_4_1_WGM1_WGMXCC1_WGMXCCGn1
    SolutionIndex: 221
    SolutionNameMin: Cijk_Ailk_Bljk_S_MX_B_Bias_HAS_SAV_UserArgs_MT320x128x16_MI16x16x1_SN_GRVWB4_GSU1_GSUC0_GSUWGMRR0_K1_LBSPPA2560_LBSPPB256_LPA16_LPB4_LRVW2_MIAV0_MIWT5_8_NTA0_NTC0_NTD0_NLCA5_SU0_SUM0_SUS0_SVW1_VWA1_VWB4_WG64_4_1_WGM1_WGMXCC1_WGMXCCGn1
    SolutionIndex: 222
    SolutionNameMin: Cijk_Ailk_Bljk_S_MX_B_Bias_HAS_SAV_UserArgs_MT320x128x32_MI32x32x1_SN_GRVWB4_GSU1_GSUC0_GSUWGMRR0_K1_LBSPPA0_LBSPPB256_LPA0_LPB4_LRVW4_MIAV0_MIWT5_2_NTA0_NTC0_NTD0_NLCA5_SU0_SUM0_SUS0_SVW1_VWA1_VWB2_WG64_4_1_WGM1_WGMXCC1_WGMXCCGn1
    SolutionIndex: 223
    SolutionNameMin: Cijk_Ailk_Bljk_S_MX_B_Bias_HAS_SAV_UserArgs_MT512x128x16_MI32x32x1_SN_GRVWB4_GSU1_GSUC0_GSUWGMRR0_K1_LBSPPA0_LBSPPB256_LPA0_LPB4_LRVW4_MIAV0_MIWT4_4_NTA0_NTC0_NTD0_NLCA1_SU0_SUM0_SUS0_SVW4_VWA4_VWB4_WG128_2_1_WGM1_WGMXCC1_WGMXCCGn1
    SolutionIndex: 224
    SolutionNameMin: Cijk_Ailk_Bljk_S_MX_B_Bias_HAS_SAV_UserArgs_MT256x128x16_MI32x32x1_SN_GRVWB4_GSU1_GSUC0_GSUWGMRR0_K1_LBSPPA0_LBSPPB256_LPA0_LPB4_LRVW4_MIAV0_MIWT2_4_NTA0_NTC3_NTD3_NLCA1_SU0_SUM0_SUS0_SVW2_VWA2_VWB4_WG128_2_1_WGM1_WGMXCC1_WGMXCCGn1
    SolutionIndex: 225
    SolutionNameMin: Cijk_Ailk_Bljk_S_MX_B_Bias_HAS_SAV_UserArgs_MT256x128x32_MI32x32x1_SN_GRVWB4_GSU1_GSUC0_GSUWGMRR0_K1_LBSPPA0_LBSPPB512_LPA0_LPB4_LRVW4_MIAV0_MIWT2_4_NTA4_NTC0_NTD0_NLCA1_SU0_SUM0_SUS0_SVW2_VWA2_VWB4_WG128_2_1_WGM1_WGMXCC1_WGMXCCGn1
    SolutionIndex: 226
    SolutionNameMin: Cijk_Ailk_Bljk_S_MX_B_Bias_HAS_SAV_UserArgs_MT256x128x16_MI32x32x1_SN_GRVWB4_GSU1_GSUC0_GSUWGMRR0_K1_LBSPPA0_LBSPPB256_LPA0_LPB4_LRVW4_MIAV0_MIWT2_4_NTA4_NTC0_NTD0_NLCA1_SU0_SUM0_SUS0_SVW2_VWA2_VWB4_WG128_2_1_WGM1_WGMXCC1_WGMXCCGn1
    SolutionIndex: 227
    SolutionNameMin: Cijk_Ailk_Bljk_S_MX_B_Bias_HAS_SAV_UserArgs_MT256x128x16_MI16x16x1_SN_GRVWB4_GSU1_GSUC0_GSUWGMRR0_K1_LBSPPA2048_LBSPPB256_LPA0_LPB4_LRVW2_MIAV0_MIWT4_8_NTA0_NTC0_NTD0_NLCA1_SU0_SUM0_SUS0_SVW4_VWA4_VWB4_WG64_4_1_WGM1_WGMXCC1_WGMXCCGn1
    SolutionIndex: 228
    SolutionNameMin: Cijk_Ailk_Bljk_S_MX_B_Bias_HAS_SAV_UserArgs_MT16x64x32_MI16x16x1_SN_LDSB1_GRVWB4_GSU13_GSUC0_GSUWGMRR0_K1_LBSPPB128_MIWT1_1_NLCB1_SU0_SUM0_SUS0_VWB1_WG16_16_1_WGM1_WGMXCC1_WGMXCCGn1
    SolutionIndex: 229
    SolutionNameMin: Cijk_Ailk_Bljk_S_MX_B_Bias_HAS_SAV_UserArgs_MT16x64x64_MI16x16x1_SN_LDSB1_GRVWB4_GSU13_GSUC0_GSUWGMRR0_K1_LBSPPB256_MIWT1_1_NLCB1_SU0_SUM0_SUS0_VWB1_WG16_16_1_WGM1_WGMXCC1_WGMXCCGn1
    SolutionIndex: 230
    SolutionNameMin: Cijk_Ailk_Bljk_S_MX_B_Bias_HAS_SAV_UserArgs_MT16x96x128_MI16x16x1_SN_LDSB1_GRVWB4_GSU9_GSUC0_GSUWGMRR0_K1_LBSPPB512_MIWT1_3_NLCB1_SU0_SUM0_SUS0_VWB1_WG16_8_2_WGM1_WGMXCC1_WGMXCCGn1
    SolutionIndex: 231
    SolutionNameMin: Cijk_Ailk_Bljk_S_MX_B_Bias_HAS_SAV_UserArgs_MT16x16x128_MI16x16x1_SN_LDSB0_GRVWB4_GSU1_GSUC0_GSUWGMRR0_K1_LBSPPA256_LBSPPB512_LPA16_LPB8_MIWT1_1_NLCB1_SU0_SUM0_SUS0_SVW1_VWA1_VWB1_WG16_4_2_WGM1_WGMXCC1_WGMXCCGn1
    SolutionIndex: 232
    SolutionNameMin: Cijk_Ailk_Bljk_S_MX_B_Bias_HAS_SAV_UserArgs_MT16x64x64_MI16x16x1_SN_LDSB1_GRVWB4_GSU13_GSUC0_GSUWGMRR0_K1_LBSPPA256_LBSPPB256_LPA16_LPB8_MIWT1_1_NLCB1_SU0_SUM0_SUS0_SVW1_VWA1_VWB1_WG16_16_1_WGM1_WGMXCC1_WGMXCCGn1
    SolutionIndex: 233
    SolutionNameMin: Cijk_Ailk_Bljk_S_MX_B_Bias_HAS_SAV_UserArgs_MT16x32x128_MI16x16x1_SN_LDSB0_GRVWB4_GSU1_GSUC0_GSUWGMRR0_K1_LBSPPA256_LBSPPB1024_LPA16_LPB8_MIWT1_2_NLCB1_SU0_SUM0_SUS0_SVW1_VWA1_VWB2_WG16_4_4_WGM1_WGMXCC1_WGMXCCGn1
    SolutionIndex: 234
    SolutionNameMin: Cijk_Ailk_Bljk_S_MX_B_Bias_HAS_SAV_UserArgs_MT32x64x64_MI16x16x1_SN_LDSB1_GRVWB4_GSU13_GSUC0_GSUWGMRR0_K1_LBSPPA512_LBSPPB512_LPA16_LPB8_MIWT1_2_NLCB1_SU0_SUM0_SUS0_SVW1_VWA1_VWB2_WG32_8_1_WGM1_WGMXCC1_WGMXCCGn1
    SolutionIndex: 235
    SolutionNameMin: Cijk_Ailk_Bljk_S_MX_B_Bias_HAS_SAV_UserArgs_MT32x64x128_MI32x32x1_SN_LDSB1_GRVWB4_GSU6_GSUC0_GSUWGMRR0_K1_LBSPPA0_LBSPPB512_LPA0_LPB4_MIWT1_1_NLCB1_SU0_SUM0_SUS0_SVW1_VWA1_VWB1_WG32_4_2_WGM1_WGMXCC1_WGMXCCGn1
    SolutionIndex: 236
    SolutionNameMin: Cijk_Ailk_Bljk_S_MX_B_Bias_HAS_SAV_UserArgs_MT64x64x32_MI32x32x1_SN_LDSB0_GRVWB4_GSU6_GSUC0_GSUWGMRR0_K1_LBSPPA0_LBSPPB128_LPA0_LPB4_LRVW4_MIWT1_1_NLCA1_SU0_SUM0_SUS0_SVW1_VWA1_VWB1_WG64_4_1_WGM1_WGMXCC1_WGMXCCGn1
    SolutionIndex: 237
    SolutionNameMin: Cijk_Ailk_Bljk_S_MX_B_Bias_HAS_SAV_UserArgs_MT64x96x64_MI16x16x1_SN_LDSB1_GRVWB4_GSU10_GSUC0_GSUWGMRR0_K1_LBSPPA1024_LBSPPB256_LPA0_LPB8_LRVW4_MIWT2_3_NLCA1_SU0_SUM0_SUS0_SVW2_VWA2_VWB1_WG32_8_1_WGM1_WGMXCC1_WGMXCCGn1
    SolutionIndex: 238
    SolutionNameMin: Cijk_Ailk_Bljk_S_MX_B_Bias_HAS_SAV_UserArgs_MT96x96x32_MI16x16x1_SN_LDSB0_GRVWB4_GSU10_GSUC0_GSUWGMRR0_K1_LBSPPA1536_LBSPPB128_LPA16_LPB8_LRVW4_MIWT3_3_NLCA3_SU0_SUM0_SUS0_SVW1_VWA1_VWB1_WG32_8_1_WGM1_WGMXCC1_WGMXCCGn1
    SolutionIndex: 239
    SolutionNameMin: Cijk_Ailk_Bljk_S_MX_B_Bias_HAS_SAV_UserArgs_MT96x96x64_MI16x16x1_SN_LDSB1_GRVWB4_GSU10_GSUC0_GSUWGMRR0_K1_LBSPPA1536_LBSPPB256_LPA16_LPB8_LRVW4_MIWT3_3_NLCA3_SU0_SUM0_SUS0_SVW1_VWA1_VWB1_WG32_8_1_WGM1_WGMXCC1_WGMXCCGn1
    SolutionIndex: 240
    SolutionNameMin: Cijk_Ailk_Bljk_S_MX_B_Bias_HAS_SAV_UserArgs_MT96x192x32_MI16x16x1_SN_LDSB1_GRVWB4_GSU20_GSUC0_GSUWGMRR0_K1_LBSPPA1536_LBSPPB256_LPA16_LPB8_LRVW4_MIWT3_6_NLCA3_SU0_SUM0_SUS0_SVW1_VWA1_VWB2_WG32_8_1_WGM1_WGMXCC1_WGMXCCGn1
    SolutionIndex: 241
    SolutionNameMin: Cijk_Ailk_Bljk_S_MX_B_Bias_HAS_SAV_UserArgs_MT128x192x32_MI32x32x1_SN_LDSB1_CLR1_GRVWB4_GSU20_GSUC0_GSUWGMRR0_K1_LBSPPA0_LBSPPB128_LPA0_LPB4_LRVW4_MIAV0_MIWT2_3_NLCA1_PLR1_SU0_SUM0_SUS0_SVW2_VWA2_VWB1_WG64_4_1_WGM1_WGMXCC1_WGMXCCGn1
    SolutionIndex: 242
    SolutionNameMin: Cijk_Ailk_Bljk_S_MX_B_Bias_HAS_SAV_UserArgs_MT64x32x128_MI32x32x1_SN_LDSB1_CLR1_GRVWB4_GSU1_GSUC0_GSUWGMRR0_K1_LBSPPA0_LBSPPB512_LPA0_LPB4_LRVW4_MIAV1_MIWT1_1_NLCA1_PLR1_SU0_SUM0_SUS0_SVW1_VWA1_VWB1_WG64_2_2_WGM1_WGMXCC1_WGMXCCGn1
    SolutionIndex: 243
    SolutionNameMin: Cijk_Ailk_Bljk_S_MX_B_Bias_HAS_SAV_UserArgs_MT192x192x32_MI32x32x1_SN_LDSB1_CLR1_GRVWB4_GSU20_GSUC0_GSUWGMRR0_K1_LBSPPA0_LBSPPB128_LPA0_LPB4_LRVW4_MIAV0_MIWT3_3_NLCA3_PLR1_SU0_SUM0_SUS0_SVW1_VWA1_VWB1_WG64_4_1_WGM1_WGMXCC1_WGMXCCGn1
    SolutionIndex: 244
    SolutionNameMin: Cijk_Ailk_Bljk_S_MX_B_Bias_HAS_SAV_UserArgs_MT256x96x32_MI32x32x1_SN_LDSB1_CLR1_GRVWB4_GSU10_GSUC0_GSUWGMRR0_K1_LBSPPA0_LBSPPB128_LPA0_LPB4_LRVW4_MIAV0_MIWT2_3_NLCA1_PLR1_SU0_SUM0_SUS0_SVW2_VWA2_VWB1_WG128_2_1_WGM1_WGMXCC1_WGMXCCGn1
    SolutionIndex: 245
    SolutionNameMin: Cijk_Ailk_Bljk_S_MX_B_Bias_HAS_SAV_UserArgs_MT128x96x32_MI32x32x1_SN_LDSB0_CLR1_GRVWB4_GSU3_GSUC0_GSUWGMRR0_K1_LBSPPA0_LBSPPB128_LPA0_LPB4_LRVW4_MIAV1_MIWT1_3_NLCA1_PLR1_SU0_SUM0_SUS0_SVW1_VWA1_VWB1_WG128_2_1_WGM1_WGMXCC1_WGMXCCGn1
    SolutionIndex: 246
    SolutionNameMin: Cijk_Ailk_Bljk_S_MX_B_Bias_HAS_SAV_UserArgs_MT384x96x32_MI32x32x1_SN_LDSB1_CLR1_GRVWB4_GSU9_GSUC0_GSUWGMRR0_K1_LBSPPA0_LBSPPB128_LPA0_LPB4_LRVW4_MIAV0_MIWT3_3_NLCA3_PLR1_SU0_SUM0_SUS0_SVW1_VWA1_VWB1_WG128_2_1_WGM1_WGMXCC1_WGMXCCGn1
    SolutionIndex: 247
    SolutionNameMin: Cijk_Ailk_Bljk_S_MX_B_Bias_HAS_SAV_UserArgs_MT128x192x16_MI32x32x1_SN_CLR1_GRVWB4_GSU5_GSUC0_GSUWGMRR0_K1_LBSPPA0_LBSPPB128_LPA0_LPB4_LRVW4_MIAV0_MIWT2_3_NLCA1_PLR1_SU0_SUM0_SUS0_SVW2_VWA2_VWB1_WG64_4_1_WGM1_WGMXCC1_WGMXCCGn1
    SolutionIndex: 248
    SolutionNameMin: Cijk_Ailk_Bljk_S_MX_B_Bias_HAS_SAV_UserArgs_MT256x192x32_MI32x32x1_SN_CLR1_GRVWB4_GSU10_GSUC0_GSUWGMRR0_K1_LBSPPA0_LBSPPB256_LPA0_LPB4_LRVW4_MIAV0_MIWT2_6_NLCA1_PLR1_SU0_SUM0_SUS0_SVW2_VWA2_VWB2_WG128_2_1_WGM1_WGMXCC1_WGMXCCGn1
    SolutionIndex: 249
    SolutionNameMin: Cijk_Ailk_Bljk_S_MX_B_Bias_HAS_SAV_UserArgs_MT128x192x32_MI32x32x1_SN_CLR1_GRVWB4_GSU4_GSUC0_GSUWGMRR0_K1_LBSPPA0_LBSPPB128_LPA0_LPB4_LRVW4_MIAV0_MIWT2_3_NLCA1_PLR1_SU0_SUM0_SUS0_SVW2_VWA2_VWB1_WG64_4_1_WGM1_WGMXCC1_WGMXCCGn1
    SolutionIndex: 250
    SolutionNameMin: Cijk_Ailk_Bljk_S_MX_B_Bias_HAS_SAV_UserArgs_MT320x192x16_MI32x32x1_SN_CLR1_GRVWB4_GSU10_GSUC0_GSUWGMRR0_K1_LBSPPA0_LBSPPB128_LPA0_LPB4_LRVW4_MIAV0_MIWT5_3_NLCA5_PLR1_SU0_SUM0_SUS0_SVW1_VWA1_VWB1_WG64_4_1_WGM1_WGMXCC1_WGMXCCGn1
    SolutionIndex: 251
    SolutionNameMin: Cijk_Ailk_Bljk_S_MX_B_Bias_HAS_SAV_UserArgs_MT192x192x32_MI32x32x1_SN_CLR1_GRVWB4_GSU5_GSUC0_GSUWGMRR0_K1_LBSPPA0_LBSPPB128_LPA0_LPB4_LRVW4_MIAV0_MIWT3_3_NLCA3_PLR1_SU0_SUM0_SUS0_SVW1_VWA1_VWB1_WG64_4_1_WGM1_WGMXCC1_WGMXCCGn1
    SolutionIndex: 252
    SolutionNameMin: Cijk_Ailk_Bljk_S_MX_B_Bias_HAS_SAV_UserArgs_MT256x192x32_MI32x32x1_SN_GRVWB4_GSU1_GSUC0_GSUWGMRR0_K1_LBSPPA0_LBSPPB256_LPA0_LPB4_LRVW4_MIAV0_MIWT2_6_NTA4_NLCA1_SU0_SUM0_SUS0_SVW2_VWA2_VWB2_WG128_2_1_WGM1_WGMXCC1_WGMXCCGn1
    SolutionIndex: 253
    SolutionNameMin: Cijk_Ailk_Bljk_S_MX_B_Bias_HAS_SAV_UserArgs_MT320x192x16_MI32x32x1_SN_GRVWB4_GSU3_GSUC0_GSUWGMRR0_K1_LBSPPA0_LBSPPB128_LPA0_LPB4_LRVW4_MIAV0_MIWT5_3_NTA4_NLCA5_SU0_SUM0_SUS0_SVW1_VWA1_VWB1_WG64_4_1_WGM1_WGMXCC1_WGMXCCGn1
    SolutionIndex: 254
    SolutionNameMin: Cijk_Ailk_Bljk_S_MX_B_Bias_HAS_SAV_UserArgs_MT256x192x32_MI32x32x1_SN_GRVWB4_GSU5_GSUC0_GSUWGMRR0_K1_LBSPPA0_LBSPPB256_LPA0_LPB4_LRVW4_MIAV0_MIWT2_6_NTA4_NLCA1_SU0_SUM0_SUS0_SVW2_VWA2_VWB2_WG128_2_1_WGM1_WGMXCC1_WGMXCCGn1
    SolutionIndex: 255
    SolutionNameMin: Cijk_Ailk_Bljk_S_MX_B_Bias_HAS_SAV_UserArgs_MT192x192x16_MI32x32x1_SN_GRVWB4_GSU1_GSUC0_GSUWGMRR0_K1_LBSPPA0_LBSPPB128_LPA0_LPB4_LRVW4_MIAV0_MIWT3_3_NTA4_NLCA3_SU0_SUM0_SUS0_SVW1_VWA1_VWB1_WG64_4_1_WGM1_WGMXCC1_WGMXCCGn1
    SolutionIndex: 256
    SolutionNameMin: Cijk_Ailk_Bljk_S_MX_B_Bias_HAS_SAV_UserArgs_MT320x192x16_MI32x32x1_SN_GRVWB4_GSU1_GSUC0_GSUWGMRR0_K1_LBSPPA0_LBSPPB128_LPA0_LPB4_LRVW4_MIAV0_MIWT5_3_NTA4_NLCA5_SU0_SUM0_SUS0_SVW1_VWA1_VWB1_WG64_4_1_WGM1_WGMXCC1_WGMXCCGn1
    SolutionIndex: 257
    SolutionNameMin: Cijk_Ailk_Bljk_S_MX_B_Bias_HAS_SAV_UserArgs_MT16x64x64_MI16x16x1_SN_LDSB0_GRVWB4_GSU4_GSUC0_GSUWGMRR0_K1_LBSPPA256_LBSPPB256_LPB8_LRVW4_MIWT1_1_NLCB1_SU0_SUM0_SUS0_VWB1_WG16_16_1_WGM1_WGMXCC1_WGMXCCGn1
    SolutionIndex: 258
    SolutionNameMin: Cijk_Ailk_Bljk_S_MX_B_Bias_HAS_SAV_UserArgs_MT16x128x64_MI16x16x1_SN_LDSB1_GRVWB4_GSU10_GSUC0_GSUWGMRR0_K1_LBSPPA256_LBSPPB512_LPB8_LRVW4_MIWT1_2_NLCB1_SU0_SUM0_SUS0_VWB2_WG16_16_1_WGM1_WGMXCC1_WGMXCCGn1
    SolutionIndex: 259
    SolutionNameMin: Cijk_Ailk_Bljk_S_MX_B_Bias_HAS_SAV_UserArgs_MT16x32x256_MI16x16x1_SN_LDSB1_GRVWB4_GSU1_GSUC0_GSUWGMRR0_K1_LBSPPA256_LBSPPB2048_LPB8_LRVW4_MIWT1_2_NLCB1_SU0_SUM0_SUS0_VWB2_WG16_4_4_WGM1_WGMXCC1_WGMXCCGn1
    SolutionIndex: 260
    SolutionNameMin: Cijk_Ailk_Bljk_S_MX_B_Bias_HAS_SAV_UserArgs_MT16x96x128_MI16x16x1_SN_LDSB1_GRVWB4_GSU5_GSUC0_GSUWGMRR0_K1_LBSPPA256_LBSPPB512_LPB8_LRVW4_MIWT1_3_NLCB1_SU0_SUM0_SUS0_VWB1_WG16_8_2_WGM1_WGMXCC1_WGMXCCGn1
    SolutionIndex: 261
    SolutionNameMin: Cijk_Ailk_Bljk_S_MX_B_Bias_HAS_SAV_UserArgs_MT256x128x16_MI32x32x1_SN_CLR1_GRVWB4_GSU5_GSUC0_GSUWGMRR0_K1_LBSPPA0_LBSPPB256_LPA0_LPB4_LRVW4_MIAV0_MIWT2_4_NLCA1_PLR1_SU0_SUM0_SUS0_SVW2_VWA2_VWB4_WG128_2_1_WGM1_WGMXCC1_WGMXCCGn1
    SolutionIndex: 262
    SolutionNameMin: Cijk_Ailk_Bljk_S_MX_B_Bias_HAS_SAV_UserArgs_MT320x128x32_MI32x32x1_SN_CLR1_GRVWB4_GSU5_GSUC0_GSUWGMRR0_K1_LBSPPA0_LBSPPB256_LPA0_LPB4_LRVW4_MIAV0_MIWT5_2_NLCA5_PLR1_SU0_SUM0_SUS0_SVW1_VWA1_VWB2_WG64_4_1_WGM1_WGMXCC1_WGMXCCGn1
    SolutionIndex: 263
    SolutionNameMin: Cijk_Ailk_Bljk_S_MX_B_Bias_HAS_SAV_UserArgs_MT192x256x32_MI32x32x1_SN_CLR1_GRVWB4_GSU5_GSUC0_GSUWGMRR0_K1_LBSPPA0_LBSPPB512_LPA0_LPB4_LRVW4_MIAV0_MIWT3_4_NLCA3_PLR1_SU0_SUM0_SUS0_SVW1_VWA1_VWB4_WG64_4_1_WGM1_WGMXCC1_WGMXCCGn1
    SolutionIndex: 264
    SolutionNameMin: Cijk_Ailk_Bljk_S_MX_B_Bias_HAS_SAV_UserArgs_MT128x80x64_MI16x16x1_SN_CLR1_GRVWB4_GSU1_GSUC0_GSUWGMRR0_K1_LBSPPA2048_LBSPPB256_LPA0_LPB8_LRVW4_MIAV1_MIWT2_5_NLCA1_PLR1_SU0_SUM0_SUS0_SVW2_VWA2_VWB1_WG64_4_1_WGM1_WGMXCC1_WGMXCCGn1
    SolutionIndex: 265
    SolutionNameMin: Cijk_Ailk_Bljk_S_MX_B_Bias_HAS_SAV_UserArgs_MT256x192x32_MI32x32x1_SN_CLR1_GRVWB4_GSU5_GSUC0_GSUWGMRR0_K1_LBSPPA0_LBSPPB256_LPA0_LPB4_LRVW4_MIAV0_MIWT2_6_NLCA1_PLR1_SU0_SUM0_SUS0_SVW2_VWA2_VWB2_WG128_2_1_WGM1_WGMXCC1_WGMXCCGn1
    SolutionIndex: 266
    SolutionNameMin: Cijk_Ailk_Bljk_S_MX_B_Bias_HAS_SAV_UserArgs_MT128x96x64_MI32x32x1_SN_CLR1_GRVWB4_GSU1_GSUC0_GSUWGMRR0_K1_LBSPPA0_LBSPPB256_LPA0_LPB4_LRVW4_MIAV1_MIWT1_3_NLCA1_PLR1_SU0_SUM0_SUS0_SVW1_VWA1_VWB1_WG128_2_1_WGM1_WGMXCC1_WGMXCCGn1
    SolutionIndex: 267
    SolutionNameMin: Cijk_Ailk_Bljk_S_MX_B_Bias_HAS_SAV_UserArgs_MT320x192x16_MI32x32x1_SN_CLR1_GRVWB4_GSU5_GSUC0_GSUWGMRR0_K1_LBSPPA0_LBSPPB128_LPA0_LPB4_LRVW4_MIAV0_MIWT5_3_NLCA5_PLR1_SU0_SUM0_SUS0_SVW1_VWA1_VWB1_WG64_4_1_WGM1_WGMXCC1_WGMXCCGn1
    SolutionIndex: 268
    SolutionNameMin: Cijk_Ailk_Bljk_S_MX_B_Bias_HAS_SAV_UserArgs_MT128x128x32_MI32x32x1_SN_CLR1_GRVWB4_GSU1_GSUC0_GSUWGMRR0_K1_LBSPPA0_LBSPPB256_LPA0_LPB4_LRVW4_MIAV1_MIWT2_2_NLCA1_PLR1_SU0_SUM0_SUS0_SVW2_VWA2_VWB2_WG64_4_1_WGM1_WGMXCC1_WGMXCCGn1
    SolutionIndex: 269
    SolutionNameMin: Cijk_Ailk_Bljk_S_MX_B_Bias_HAS_SAV_UserArgs_MT256x128x32_MI32x32x1_SN_CLR1_GRVWB4_GSU2_GSUC0_GSUWGMRR0_K1_LBSPPA0_LBSPPB512_LPA0_LPB4_LRVW4_MIAV0_MIWT2_4_NLCA1_PLR1_SU0_SUM0_SUS0_SVW2_VWA2_VWB4_WG128_2_1_WGM1_WGMXCC1_WGMXCCGn1
    SolutionIndex: 270
    SolutionNameMin: Cijk_Ailk_Bljk_S_MX_B_Bias_HAS_SAV_UserArgs_MT256x128x32_MI32x32x1_SN_GRVWB4_GSU1_GSUC0_GSUWGMRR0_K1_LBSPPA0_LBSPPB512_LPA0_LPB4_LRVW4_MIAV0_MIWT2_4_NLCA1_SU0_SUM0_SUS0_SVW2_VWA2_VWB4_WG128_2_1_WGM1_WGMXCC1_WGMXCCGn1
    SolutionIndex: 271
    SolutionNameMin: Cijk_Ailk_Bljk_S_MX_B_Bias_HAS_SAV_UserArgs_MT224x256x32_MI32x32x1_SN_GRVWB4_GSU2_GSUC0_GSUWGMRR0_K1_LBSPPA0_LBSPPB256_LPA0_LPB4_LRVW4_MIAV0_MIWT7_2_NLCA7_SU0_SUM0_SUS0_SVW1_VWA1_VWB2_WG32_8_1_WGM1_WGMXCC1_WGMXCCGn1
    SolutionIndex: 272
    SolutionNameMin: Cijk_Ailk_Bljk_S_MX_B_Bias_HAS_SAV_UserArgs_MT256x256x16_MI32x32x1_SN_GRVWB4_GSU5_GSUC0_GSUWGMRR0_K1_LBSPPA0_LBSPPB256_LPA0_LPB4_LRVW4_MIAV0_MIWT2_8_NLCA1_SU0_SUM0_SUS0_SVW2_VWA2_VWB4_WG128_2_1_WGM1_WGMXCC1_WGMXCCGn1
    SolutionIndex: 273
    SolutionNameMin: Cijk_Ailk_Bljk_S_MX_B_Bias_HAS_SAV_UserArgs_MT320x128x32_MI32x32x1_SN_GRVWB4_GSU1_GSUC0_GSUWGMRR0_K1_LBSPPA0_LBSPPB256_LPA0_LPB4_LRVW4_MIAV0_MIWT5_2_NLCA5_SU0_SUM0_SUS0_SVW1_VWA1_VWB2_WG64_4_1_WGM1_WGMXCC1_WGMXCCGn1
    SolutionIndex: 274
    SolutionNameMin: Cijk_Ailk_Bljk_S_MX_B_Bias_HAS_SAV_UserArgs_MT256x192x16_MI32x32x1_SN_GRVWB4_GSU1_GSUC0_GSUWGMRR0_K1_LBSPPA0_LBSPPB128_LPA0_LPB4_LRVW4_MIAV0_MIWT2_6_NLCA1_SU0_SUM0_SUS0_SVW2_VWA2_VWB2_WG128_2_1_WGM1_WGMXCC1_WGMXCCGn1
    SolutionIndex: 275
    SolutionNameMin: Cijk_Ailk_Bljk_S_MX_B_Bias_HAS_SAV_UserArgs_MT256x192x32_MI32x32x1_SN_GRVWB4_GSU1_GSUC0_GSUWGMRR0_K1_LBSPPA0_LBSPPB256_LPA0_LPB4_LRVW4_MIAV0_MIWT2_6_NLCA1_SU0_SUM0_SUS0_SVW2_VWA2_VWB2_WG128_2_1_WGM1_WGMXCC1_WGMXCCGn1
    SolutionIndex: 276
    SolutionNameMin: Cijk_Ailk_Bljk_S_MX_B_Bias_HAS_SAV_UserArgs_MT448x128x16_MI32x32x1_SN_GRVWB4_GSU4_GSUC0_GSUWGMRR0_K1_LBSPPA0_LBSPPB128_LPA0_LPB4_LRVW4_MIAV0_MIWT7_2_NLCA7_SU0_SUM0_SUS0_SVW1_VWA1_VWB2_WG64_4_1_WGM1_WGMXCC1_WGMXCCGn1
    SolutionIndex: 277
    SolutionNameMin: Cijk_Ailk_Bljk_S_MX_B_Bias_HAS_SAV_UserArgs_MT256x128x16_MI32x32x1_SN_GRVWB4_GSU1_GSUC0_GSUWGMRR0_K1_LBSPPA0_LBSPPB256_LPA0_LPB4_LRVW4_MIAV0_MIWT2_4_NLCA1_SU0_SUM0_SUS0_SVW2_VWA2_VWB4_WG128_2_1_WGM1_WGMXCC1_WGMXCCGn1
    SolutionIndex: 278
    SolutionNameMin: Cijk_Ailk_Bljk_S_MX_B_Bias_HAS_SAV_UserArgs_MT320x192x16_MI32x32x1_SN_GRVWB4_GSU1_GSUC0_GSUWGMRR0_K1_LBSPPA0_LBSPPB128_LPA0_LPB4_LRVW4_MIAV0_MIWT5_3_NLCA5_SU0_SUM0_SUS0_SVW1_VWA1_VWB1_WG64_4_1_WGM1_WGMXCC1_WGMXCCGn1
    SolutionIndex: 279
    SolutionNameMin: Cijk_Ailk_Bljk_S_MX_B_Bias_HAS_SAV_UserArgs_MT256x128x16_MI32x32x1_SN_GRVWB4_GSU1_GSUC0_GSUWGMRR0_K1_LBSPPA0_LBSPPB256_LPA0_LPB4_LRVW4_MIWT2_4_NTA0_NTC3_NTD3_NLCA1_SU0_SUM0_SUS0_SVW2_VWA2_VWB4_WG128_2_1_WGM1_WGMXCC1_WGMXCCGn1
    SolutionIndex: 280
    SolutionNameMin: Cijk_Ailk_Bljk_S_MX_B_Bias_HAS_SAV_UserArgs_MT448x128x16_MI32x32x1_SN_GRVWB4_GSU1_GSUC0_GSUWGMRR0_K1_LBSPPA0_LBSPPB128_LPA0_LPB4_LRVW4_MIWT7_2_NTA0_NTC0_NTD0_NLCA7_SU0_SUM0_SUS0_SVW1_VWA1_VWB2_WG64_4_1_WGM1_WGMXCC1_WGMXCCGn1
    SolutionIndex: 281
    SolutionNameMin: Cijk_Ailk_Bljk_S_MX_B_Bias_HAS_SAV_UserArgs_MT320x128x16_MI16x16x1_SN_GRVWB4_GSU1_GSUC0_GSUWGMRR0_K1_LBSPPA2560_LBSPPB256_LPA16_LPB4_LRVW2_MIWT5_8_NTA0_NTC0_NTD0_NLCA5_SU0_SUM0_SUS0_SVW1_VWA1_VWB4_WG64_4_1_WGM1_WGMXCC1_WGMXCCGn1
    SolutionIndex: 282
    SolutionNameMin: Cijk_Ailk_Bljk_S_MX_B_Bias_HAS_SAV_UserArgs_MT320x128x32_MI32x32x1_SN_GRVWB4_GSU1_GSUC0_GSUWGMRR0_K1_LBSPPA0_LBSPPB256_LPA0_LPB4_LRVW4_MIWT5_2_NTA0_NTC0_NTD0_NLCA5_SU0_SUM0_SUS0_SVW1_VWA1_VWB2_WG64_4_1_WGM1_WGMXCC1_WGMXCCGn1
    SolutionIndex: 283
    SolutionNameMin: Cijk_Ailk_Bljk_S_MX_B_Bias_HAS_SAV_UserArgs_MT192x128x16_MI32x32x1_SN_GRVWB4_GSU1_GSUC0_GSUWGMRR0_K1_LBSPPA0_LBSPPB128_LPA0_LPB4_LRVW4_MIWT3_2_NTA0_NTC3_NTD3_NLCA3_SU0_SUM0_SUS0_SVW1_VWA1_VWB2_WG64_4_1_WGM1_WGMXCC1_WGMXCCGn1
    SolutionIndex: 284
    SolutionNameMin: Cijk_Ailk_Bljk_S_MX_B_Bias_HAS_SAV_UserArgs_MT320x192x16_MI32x32x1_SN_GRVWB4_GSU1_GSUC0_GSUWGMRR0_K1_LBSPPA0_LBSPPB128_LPA0_LPB4_LRVW4_MIWT5_3_NTA0_NTC3_NTD3_NLCA5_SU0_SUM0_SUS0_SVW1_VWA1_VWB1_WG64_4_1_WGM1_WGMXCC1_WGMXCCGn1
    SolutionIndex: 285
    SolutionNameMin: Cijk_Ailk_Bljk_S_MX_B_Bias_HAS_SAV_UserArgs_MT512x128x16_MI32x32x1_SN_GRVWB4_GSU1_GSUC0_GSUWGMRR0_K1_LBSPPA0_LBSPPB256_LPA0_LPB4_LRVW4_MIWT4_4_NTA0_NTC0_NTD0_NLCA1_SU0_SUM0_SUS0_SVW4_VWA4_VWB4_WG128_2_1_WGM1_WGMXCC1_WGMXCCGn1
    SolutionIndex: 286
    SolutionNameMin: Cijk_Ailk_Bljk_S_MX_B_Bias_HAS_SAV_UserArgs_MT448x128x16_MI32x32x1_SN_GRVWB4_GSU1_GSUC0_GSUWGMRR0_K1_LBSPPA0_LBSPPB128_LPA0_LPB4_LRVW4_MIWT7_2_NTA4_NTC0_NTD0_NLCA7_SU0_SUM0_SUS0_SVW1_VWA1_VWB2_WG64_4_1_WGM1_WGMXCC1_WGMXCCGn1
    SolutionIndex: 287
    SolutionNameMin: Cijk_Ailk_Bljk_S_MX_B_Bias_HAS_SAV_UserArgs_MT256x256x16_MI32x32x1_SN_GRVWB4_GSU1_GSUC0_GSUWGMRR0_K1_LBSPPA0_LBSPPB256_LPA0_LPB4_LRVW4_MIWT2_8_NTA0_NTC3_NTD3_NLCA1_SU0_SUM0_SUS0_SVW2_VWA2_VWB4_WG128_2_1_WGM1_WGMXCC1_WGMXCCGn1
    SolutionIndex: 288
    SolutionNameMin: Cijk_Ailk_Bljk_S_MX_B_Bias_HAS_SAV_UserArgs_MT256x256x16_MI32x32x1_SN_GRVWB4_GSU1_GSUC0_GSUWGMRR0_K1_LBSPPA0_LBSPPB256_LPA0_LPB4_LRVW4_MIWT2_8_NTA0_NTC0_NTD0_NLCA1_SU0_SUM0_SUS0_SVW2_VWA2_VWB4_WG128_2_1_WGM1_WGMXCC1_WGMXCCGn1
    SolutionIndex: 289
    SolutionNameMin: Cijk_Ailk_Bljk_S_MX_B_Bias_HAS_SAV_UserArgs_MT384x128x16_MI32x32x1_SN_GRVWB4_GSU1_GSUC0_GSUWGMRR0_K1_LBSPPA0_LBSPPB128_LPA0_LPB4_LRVW4_MIWT6_2_NTA0_NTC0_NTD0_NLCA3_SU0_SUM0_SUS0_SVW2_VWA2_VWB2_WG64_4_1_WGM1_WGMXCC1_WGMXCCGn1
    SolutionIndex: 290
    SolutionNameMin: Cijk_Ailk_Bljk_S_MX_B_Bias_HAS_SAV_UserArgs_MT384x128x16_MI32x32x1_SN_GRVWB4_GSU1_GSUC0_GSUWGMRR0_K1_LBSPPA0_LBSPPB128_LPA0_LPB4_LRVW4_MIWT6_2_NTA4_NTC0_NTD0_NLCA3_SU0_SUM0_SUS0_SVW2_VWA2_VWB2_WG64_4_1_WGM1_WGMXCC1_WGMXCCGn1
    SolutionIndex: 291
    SolutionNameMin: Cijk_Ailk_Bljk_S_MX_B_Bias_HAS_SAV_UserArgs_MT256x192x32_MI32x32x1_SN_GRVWB4_GSU1_GSUC0_GSUWGMRR0_K1_LBSPPA0_LBSPPB256_LPA0_LPB4_LRVW4_MIWT2_6_NTA0_NTC3_NTD3_NLCA1_SU0_SUM0_SUS0_SVW2_VWA2_VWB2_WG128_2_1_WGM1_WGMXCC1_WGMXCCGn1
    SolutionIndex: 292
    SolutionNameMin: Cijk_Ailk_Bljk_S_MX_B_Bias_HAS_SAV_UserArgs_MT256x192x16_MI32x32x1_SN_GRVWB4_GSU1_GSUC0_GSUWGMRR0_K1_LBSPPA0_LBSPPB128_LPA0_LPB4_LRVW4_MIWT2_6_NTA0_NTC0_NTD0_NLCA1_SU0_SUM0_SUS0_SVW2_VWA2_VWB2_WG128_2_1_WGM1_WGMXCC1_WGMXCCGn1
    SolutionIndex: 293
    SolutionNameMin: Cijk_Ailk_Bljk_S_MX_B_Bias_HAS_SAV_UserArgs_MT256x192x32_MI32x32x1_SN_GRVWB4_GSU1_GSUC0_GSUWGMRR0_K1_LBSPPA0_LBSPPB256_LPA0_LPB4_LRVW4_MIWT2_6_NTA4_NTC0_NTD0_NLCA1_SU0_SUM0_SUS0_SVW2_VWA2_VWB2_WG128_2_1_WGM1_WGMXCC1_WGMXCCGn1
    SolutionIndex: 294
    SolutionNameMin: Cijk_Ailk_Bljk_S_MX_B_Bias_HAS_SAV_UserArgs_MT256x192x32_MI32x32x1_SN_GRVWB4_GSU1_GSUC0_GSUWGMRR0_K1_LBSPPA0_LBSPPB256_LPA0_LPB4_LRVW4_MIWT2_6_NTA0_NTC0_NTD0_NLCA1_SU0_SUM0_SUS0_SVW2_VWA2_VWB2_WG128_2_1_WGM1_WGMXCC1_WGMXCCGn1
    SolutionIndex: 295
    SolutionNameMin: Cijk_Ailk_Bljk_S_MX_B_Bias_HAS_SAV_UserArgs_MT16x32x256_MI16x16x1_SN_GRVWB4_GSU1_GSUC0_GSUWGMRR0_K1_LBSPPA256_LBSPPB1024_LPB8_LRVW4_MIWT1_1_NLCB1_SU0_SUM0_SUS0_VWB1_WG16_8_2_WGM1_WGMXCC1_WGMXCCGn1
    SolutionIndex: 296
    SolutionNameMin: Cijk_Ailk_Bljk_S_MX_B_Bias_HAS_SAV_UserArgs_MT16x64x64_MI16x16x1_SN_GRVWB4_GSU5_GSUC0_GSUWGMRR0_K1_LBSPPA256_LBSPPB256_LPB8_LRVW4_MIWT1_1_NLCB1_SU0_SUM0_SUS0_VWB1_WG16_16_1_WGM1_WGMXCC1_WGMXCCGn1
    SolutionIndex: 297
    SolutionNameMin: Cijk_Ailk_Bljk_S_MX_B_Bias_HAS_SAV_UserArgs_MT16x128x64_MI16x16x1_SN_GRVWB4_GSU5_GSUC0_GSUWGMRR0_K1_LBSPPA256_LBSPPB512_LPB8_LRVW4_MIWT1_2_NLCB1_SU0_SUM0_SUS0_VWB2_WG16_16_1_WGM1_WGMXCC1_WGMXCCGn1
    SolutionIndex: 298
    SolutionNameMin: Cijk_Ailk_Bljk_S_MX_B_Bias_HAS_SAV_UserArgs_MT16x64x128_MI16x16x1_SN_GRVWB4_GSU2_GSUC0_GSUWGMRR0_K1_LBSPPA256_LBSPPB1024_LPB8_LRVW4_MIWT1_2_NLCB1_SU0_SUM0_SUS0_VWB2_WG16_8_2_WGM1_WGMXCC1_WGMXCCGn1
    SolutionIndex: 299
    SolutionNameMin: Cijk_Ailk_Bljk_S_MX_B_Bias_HAS_SAV_UserArgs_MT16x128x64_MI16x16x1_SN_GRVWB4_GSU4_GSUC0_GSUWGMRR0_K1_LBSPPA256_LBSPPB1024_LPB8_LRVW4_MIWT1_4_NLCB1_SU0_SUM0_SUS0_VWB4_WG16_8_2_WGM1_WGMXCC1_WGMXCCGn1
    SolutionIndex: 300
    SolutionNameMin: Cijk_Ailk_Bljk_S_MX_B_Bias_HAS_SAV_UserArgs_MT16x96x128_MI16x16x1_SN_GRVWB4_GSU2_GSUC0_GSUWGMRR0_K1_LBSPPA256_LBSPPB512_LPB8_LRVW4_MIWT1_3_NLCB1_SU0_SUM0_SUS0_VWB1_WG16_8_2_WGM1_WGMXCC1_WGMXCCGn1
    SolutionIndex: 301
    SolutionNameMin: Cijk_Ailk_Bljk_S_MX_B_Bias_HAS_SAV_UserArgs_MT16x192x64_MI16x16x1_SN_GRVWB4_GSU5_GSUC0_GSUWGMRR0_K1_LBSPPA256_LBSPPB256_LPB8_LRVW4_MIWT1_3_NLCB1_SU0_SUM0_SUS0_VWB1_WG16_16_1_WGM1_WGMXCC1_WGMXCCGn1
    SolutionIndex: 302
    SolutionNameMin: Cijk_Ailk_Bljk_S_MX_B_Bias_HAS_SAV_UserArgs_MT16x192x64_MI16x16x1_SN_GRVWB4_GSU5_GSUC0_GSUWGMRR0_K1_LBSPPA256_LBSPPB512_LPB8_LRVW4_MIWT1_6_NLCB1_SU0_SUM0_SUS0_VWB2_WG16_8_2_WGM1_WGMXCC1_WGMXCCGn1
    SolutionIndex: 303
    SolutionNameMin: Cijk_Ailk_Bljk_S_MX_B_Bias_HAS_SAV_UserArgs_MT16x32x256_MI16x16x1_SN_GRVWB4_GSU1_GSUC0_GSUWGMRR0_K1_LBSPPA256_LBSPPB1024_LPA16_LPB8_LRVW4_MIWT1_1_NLCB1_SU0_SUM0_SUS0_SVW1_VWA1_VWB1_WG16_8_2_WGM1_WGMXCC1_WGMXCCGn1
    SolutionIndex: 304
    SolutionNameMin: Cijk_Ailk_Bljk_S_MX_B_Bias_HAS_SAV_UserArgs_MT16x64x64_MI16x16x1_SN_GRVWB4_GSU5_GSUC0_GSUWGMRR0_K1_LBSPPA256_LBSPPB256_LPA16_LPB8_LRVW4_MIWT1_1_NLCB1_SU0_SUM0_SUS0_SVW1_VWA1_VWB1_WG16_16_1_WGM1_WGMXCC1_WGMXCCGn1
    SolutionIndex: 305
    SolutionNameMin: Cijk_Ailk_Bljk_S_MX_B_Bias_HAS_SAV_UserArgs_MT32x32x128_MI16x16x1_SN_GRVWB4_GSU1_GSUC0_GSUWGMRR0_K1_LBSPPA512_LBSPPB1024_LPA16_LPB8_LRVW4_MIWT1_2_NLCB1_SU0_SUM0_SUS0_SVW1_VWA1_VWB2_WG32_4_2_WGM1_WGMXCC1_WGMXCCGn1
    SolutionIndex: 306
    SolutionNameMin: Cijk_Ailk_Bljk_S_MX_B_Bias_HAS_SAV_UserArgs_MT32x128x64_MI32x32x1_SN_GRVWB4_GSU5_GSUC0_GSUWGMRR0_K1_LBSPPA0_LBSPPB256_LPA0_LPB4_LRVW4_MIWT1_1_NLCB1_SU0_SUM0_SUS0_SVW1_VWA1_VWB1_WG32_8_1_WGM1_WGMXCC1_WGMXCCGn1
    SolutionIndex: 307
    SolutionNameMin: Cijk_Ailk_Bljk_S_MX_B_Bias_HAS_SAV_UserArgs_MT16x64x128_MI16x16x1_SN_GRVWB4_GSU2_GSUC0_GSUWGMRR0_K1_LBSPPA256_LBSPPB1024_LPA16_LPB8_LRVW4_MIWT1_2_NLCB1_SU0_SUM0_SUS0_SVW1_VWA1_VWB2_WG16_8_2_WGM1_WGMXCC1_WGMXCCGn1
    SolutionIndex: 308
    SolutionNameMin: Cijk_Ailk_Bljk_S_MX_B_Bias_HAS_SAV_UserArgs_MT32x64x128_MI32x32x1_SN_GRVWB4_GSU2_GSUC0_GSUWGMRR0_K1_LBSPPA0_LBSPPB512_LPA0_LPB4_LRVW4_MIWT1_1_NLCB1_SU0_SUM0_SUS0_SVW1_VWA1_VWB1_WG32_4_2_WGM1_WGMXCC1_WGMXCCGn1
    SolutionIndex: 309
    SolutionNameMin: Cijk_Ailk_Bljk_S_MX_B_Bias_HAS_SAV_UserArgs_MT32x128x64_MI32x32x1_SN_GRVWB4_GSU4_GSUC0_GSUWGMRR0_K1_LBSPPA0_LBSPPB512_LPA0_LPB4_LRVW4_MIWT1_2_NLCB1_SU0_SUM0_SUS0_SVW1_VWA1_VWB2_WG32_4_2_WGM1_WGMXCC1_WGMXCCGn1
    SolutionIndex: 310
    SolutionNameMin: Cijk_Ailk_Bljk_S_MX_B_Bias_HAS_SAV_UserArgs_MT16x64x128_MI16x16x1_SN_GRVWB4_GSU1_GSUC0_GSUWGMRR0_K1_LBSPPA256_LBSPPB2048_LPA16_LPB8_LRVW4_MIWT1_4_NLCB1_SU0_SUM0_SUS0_SVW1_VWA1_VWB4_WG16_4_4_WGM1_WGMXCC1_WGMXCCGn1
    SolutionIndex: 311
    SolutionNameMin: Cijk_Ailk_Bljk_S_MX_B_Bias_HAS_SAV_UserArgs_MT16x96x128_MI16x16x1_SN_GRVWB4_GSU2_GSUC0_GSUWGMRR0_K1_LBSPPA256_LBSPPB512_LPA16_LPB8_LRVW4_MIWT1_3_NLCB1_SU0_SUM0_SUS0_SVW1_VWA1_VWB1_WG16_8_2_WGM1_WGMXCC1_WGMXCCGn1
    SolutionIndex: 312
    SolutionNameMin: Cijk_Ailk_Bljk_S_MX_B_Bias_HAS_SAV_UserArgs_MT16x192x64_MI16x16x1_SN_GRVWB4_GSU5_GSUC0_GSUWGMRR0_K1_LBSPPA256_LBSPPB512_LPA16_LPB8_LRVW4_MIWT1_6_NLCB1_SU0_SUM0_SUS0_SVW1_VWA1_VWB2_WG16_8_2_WGM1_WGMXCC1_WGMXCCGn1
    SolutionIndex: 313
    SolutionNameMin: Cijk_Ailk_Bljk_S_MX_B_Bias_HAS_SAV_UserArgs_MT32x48x128_MI16x16x1_SN_GRVWB4_GSU1_GSUC0_GSUWGMRR0_K1_LBSPPA512_LBSPPB512_LPA16_LPB8_LRVW4_MIWT1_3_NLCB1_SU0_SUM0_SUS0_SVW1_VWA1_VWB1_WG32_4_2_WGM1_WGMXCC1_WGMXCCGn1
    SolutionIndex: 314
    SolutionNameMin: Cijk_Ailk_Bljk_S_MX_B_Bias_HAS_SAV_UserArgs_MT32x160x64_MI16x16x1_SN_GRVWB4_GSU4_GSUC0_GSUWGMRR0_K1_LBSPPA512_LBSPPB256_LPA0_LPB8_LRVW4_MIWT2_5_NLCB1_SU0_SUM0_SUS0_SVW2_VWA2_VWB1_WG16_8_2_WGM1_WGMXCC1_WGMXCCGn1
    SolutionIndex: 315
    SolutionNameMin: Cijk_Ailk_Bljk_S_MX_B_Bias_HAS_SAV_UserArgs_MT128x128x32_MI32x32x1_SN_CLR1_GRVWB4_GSU4_GSUC0_GSUWGMRR0_K1_LBSPPA0_LBSPPB256_LPA0_LPB4_LRVW4_MIAV1_MIWT2_2_NLCA1_PLR1_SU0_SUM0_SUS0_SVW2_VWA2_VWB2_WG64_4_1_WGM1_WGMXCC1_WGMXCCGn1
    SolutionIndex: 316
    SolutionNameMin: Cijk_Ailk_Bljk_S_MX_B_Bias_HAS_SAV_UserArgs_MT128x256x32_MI32x32x1_SN_CLR1_GRVWB4_GSU8_GSUC0_GSUWGMRR0_K1_LBSPPA0_LBSPPB512_LPA0_LPB4_LRVW4_MIAV0_MIWT2_4_NLCA1_PLR1_SU0_SUM0_SUS0_SVW2_VWA2_VWB4_WG64_4_1_WGM1_WGMXCC1_WGMXCCGn1
    SolutionIndex: 317
    SolutionNameMin: Cijk_Ailk_Bljk_S_MX_B_Bias_HAS_SAV_UserArgs_MT192x128x32_MI32x32x1_SN_CLR1_GRVWB4_GSU4_GSUC0_GSUWGMRR0_K1_LBSPPA0_LBSPPB256_LPA0_LPB4_LRVW4_MIAV0_MIWT3_2_NLCA3_PLR1_SU0_SUM0_SUS0_SVW1_VWA1_VWB2_WG64_4_1_WGM1_WGMXCC1_WGMXCCGn1
    SolutionIndex: 318
    SolutionNameMin: Cijk_Ailk_Bljk_S_MX_B_Bias_HAS_SAV_UserArgs_MT192x256x32_MI32x32x1_SN_CLR1_GRVWB4_GSU8_GSUC0_GSUWGMRR0_K1_LBSPPA0_LBSPPB512_LPA0_LPB4_LRVW4_MIAV0_MIWT3_4_NLCA3_PLR1_SU0_SUM0_SUS0_SVW1_VWA1_VWB4_WG64_4_1_WGM1_WGMXCC1_WGMXCCGn1
    SolutionIndex: 319
    SolutionNameMin: Cijk_Ailk_Bljk_S_MX_B_Bias_HAS_SAV_UserArgs_MT128x192x32_MI32x32x1_SN_CLR1_GRVWB4_GSU5_GSUC0_GSUWGMRR0_K1_LBSPPA0_LBSPPB128_LPA0_LPB4_LRVW4_MIAV0_MIWT2_3_NLCA1_PLR1_SU0_SUM0_SUS0_SVW2_VWA2_VWB1_WG64_4_1_WGM1_WGMXCC1_WGMXCCGn1
    SolutionIndex: 320
    SolutionNameMin: Cijk_Ailk_Bljk_S_MX_B_Bias_HAS_SAV_UserArgs_MT64x128x64_MI32x32x1_SN_CLR1_GRVWB4_GSU1_GSUC0_GSUWGMRR0_K1_LBSPPA0_LBSPPB512_LPA0_LPB4_LRVW4_MIAV1_MIWT2_2_NLCA1_PLR1_SU0_SUM0_SUS0_SVW2_VWA2_VWB2_WG32_4_2_WGM1_WGMXCC1_WGMXCCGn1
    SolutionIndex: 321
    SolutionNameMin: Cijk_Ailk_Bljk_S_MX_B_Bias_HAS_SAV_UserArgs_MT96x128x64_MI16x16x1_SN_CLR1_GRVWB4_GSU1_GSUC0_GSUWGMRR0_K1_LBSPPA1536_LBSPPB1024_LPA16_LPB8_LRVW4_MIAV1_MIWT3_4_NLCA3_PLR1_SU0_SUM0_SUS0_SVW1_VWA1_VWB4_WG32_8_1_WGM1_WGMXCC1_WGMXCCGn1
    SolutionIndex: 322
    SolutionNameMin: Cijk_Ailk_Bljk_S_MX_B_Bias_HAS_SAV_UserArgs_MT256x128x32_MI32x32x1_SN_CLR1_GRVWB4_GSU4_GSUC0_GSUWGMRR0_K1_LBSPPA0_LBSPPB512_LPA0_LPB4_LRVW4_MIAV0_MIWT2_4_NLCA1_PLR1_SU0_SUM0_SUS0_SVW2_VWA2_VWB4_WG128_2_1_WGM1_WGMXCC1_WGMXCCGn1
    SolutionIndex: 323
    SolutionNameMin: Cijk_Ailk_Bljk_S_MX_B_Bias_HAS_SAV_UserArgs_MT384x128x16_MI32x32x1_SN_CLR1_GRVWB4_GSU4_GSUC0_GSUWGMRR0_K1_LBSPPA0_LBSPPB256_LPA0_LPB4_LRVW4_MIAV0_MIWT3_4_NLCA3_PLR1_SU0_SUM0_SUS0_SVW1_VWA1_VWB4_WG128_2_1_WGM1_WGMXCC1_WGMXCCGn1
    SolutionIndex: 324
    SolutionNameMin: Cijk_Ailk_Bljk_S_MX_B_Bias_HAS_SAV_UserArgs_MT256x160x32_MI32x32x1_SN_CLR1_GRVWB4_GSU4_GSUC0_GSUWGMRR0_K1_LBSPPA0_LBSPPB128_LPA0_LPB4_LRVW4_MIAV0_MIWT2_5_NLCA1_PLR1_SU0_SUM0_SUS0_SVW2_VWA2_VWB1_WG128_2_1_WGM1_WGMXCC1_WGMXCCGn1
    SolutionIndex: 325
    SolutionNameMin: Cijk_Ailk_Bljk_S_MX_B_Bias_HAS_SAV_UserArgs_MT384x160x16_MI32x32x1_SN_CLR1_GRVWB1_GSU4_GSUC0_GSUWGMRR0_K1_LBSPPA0_LBSPPB128_LPA0_LPB4_LRVW4_MIAV0_MIWT3_5_NLCA3_PLR1_SU0_SUM0_SUS0_SVW1_VWA1_VWB1_WG128_2_1_WGM1_WGMXCC1_WGMXCCGn1
    SolutionIndex: 326
    SolutionNameMin: Cijk_Ailk_Bljk_S_MX_B_Bias_HAS_SAV_UserArgs_MT256x128x32_MI32x32x1_SN_GRVWB4_GSU2_GSUC0_GSUWGMRR0_K1_LBSPPA0_LBSPPB512_LPA0_LPB4_LRVW4_MIAV0_MIWT2_4_NLCA1_SU0_SUM0_SUS0_SVW2_VWA2_VWB4_WG128_2_1_WGM1_WGMXCC1_WGMXCCGn1
    SolutionIndex: 327
    SolutionNameMin: Cijk_Ailk_Bljk_S_MX_B_Bias_HAS_SAV_UserArgs_MT128x256x32_MI32x32x1_SN_GRVWB4_GSU2_GSUC0_GSUWGMRR0_K1_LBSPPA0_LBSPPB512_LPA0_LPB4_LRVW4_MIAV0_MIWT2_4_NLCA1_SU0_SUM0_SUS0_SVW2_VWA2_VWB4_WG64_4_1_WGM1_WGMXCC1_WGMXCCGn1
    SolutionIndex: 328
    SolutionNameMin: Cijk_Ailk_Bljk_S_MX_B_Bias_HAS_SAV_UserArgs_MT256x96x32_MI32x32x1_SN_GRVWB4_GSU1_GSUC0_GSUWGMRR0_K1_LBSPPA0_LBSPPB128_LPA0_LPB4_LRVW4_MIAV0_MIWT2_3_NLCA1_SU0_SUM0_SUS0_SVW2_VWA2_VWB1_WG128_2_1_WGM1_WGMXCC1_WGMXCCGn1
    SolutionIndex: 329
    SolutionNameMin: Cijk_Ailk_Bljk_S_MX_B_Bias_HAS_SAV_UserArgs_MT160x256x32_MI32x32x1_SN_GRVWB4_GSU2_GSUC0_GSUWGMRR0_K1_LBSPPA0_LBSPPB256_LPA0_LPB4_LRVW4_MIAV0_MIWT5_2_NLCA5_SU0_SUM0_SUS0_SVW1_VWA1_VWB2_WG32_8_1_WGM1_WGMXCC1_WGMXCCGn1
    SolutionIndex: 330
    SolutionNameMin: Cijk_Ailk_Bljk_S_MX_B_Bias_HAS_SAV_UserArgs_MT256x256x16_MI32x32x1_SN_GRVWB4_GSU3_GSUC0_GSUWGMRR0_K1_LBSPPA0_LBSPPB256_LPA0_LPB4_LRVW4_MIAV0_MIWT2_8_NLCA1_SU0_SUM0_SUS0_SVW2_VWA2_VWB4_WG128_2_1_WGM1_WGMXCC1_WGMXCCGn1
    SolutionIndex: 331
    SolutionNameMin: Cijk_Ailk_Bljk_S_MX_B_Bias_HAS_SAV_UserArgs_MT256x128x32_MI32x32x1_SN_GRVWB4_GSU2_GSUC0_GSUWGMRR0_K1_LBSPPA0_LBSPPB512_LPA0_LPB4_LRVW4_MIAV0_MIWT2_4_NLCA1_SU0_SUM0_SUS0_SVW2_VWA2_VWB4_WG128_2_1_WGM2_WGMXCC1_WGMXCCGn1
    SolutionIndex: 332
    SolutionNameMin: Cijk_Ailk_Bljk_S_MX_B_Bias_HAS_SAV_UserArgs_MT320x128x32_MI32x32x1_SN_GRVWB4_GSU2_GSUC0_GSUWGMRR0_K1_LBSPPA0_LBSPPB256_LPA0_LPB4_LRVW4_MIAV0_MIWT5_2_NLCA5_SU0_SUM0_SUS0_SVW1_VWA1_VWB2_WG64_4_1_WGM2_WGMXCC1_WGMXCCGn1
    SolutionIndex: 333
    SolutionNameMin: Cijk_Ailk_Bljk_S_MX_B_Bias_HAS_SAV_UserArgs_MT192x128x32_MI32x32x1_SN_GRVWB4_GSU1_GSUC0_GSUWGMRR0_K1_LBSPPA0_LBSPPB256_LPA0_LPB4_LRVW4_MIAV0_MIWT3_2_NLCA3_SU0_SUM0_SUS0_SVW1_VWA1_VWB2_WG64_4_1_WGM1_WGMXCC1_WGMXCCGn1
    SolutionIndex: 334
    SolutionNameMin: Cijk_Ailk_Bljk_S_MX_B_Bias_HAS_SAV_UserArgs_MT384x128x16_MI32x32x1_SN_GRVWB4_GSU2_GSUC0_GSUWGMRR0_K1_LBSPPA0_LBSPPB256_LPA0_LPB4_LRVW4_MIAV0_MIWT3_4_NLCA3_SU0_SUM0_SUS0_SVW1_VWA1_VWB4_WG128_2_1_WGM2_WGMXCC1_WGMXCCGn1
    SolutionIndex: 335
    SolutionNameMin: Cijk_Ailk_Bljk_S_MX_B_Bias_HAS_SAV_UserArgs_MT384x128x16_MI32x32x1_SN_GRVWB4_GSU2_GSUC0_GSUWGMRR0_K1_LBSPPA0_LBSPPB256_LPA0_LPB4_LRVW4_MIAV0_MIWT3_4_NLCA3_SU0_SUM0_SUS0_SVW1_VWA1_VWB4_WG128_2_1_WGM1_WGMXCC1_WGMXCCGn1
    SolutionIndex: 336
    SolutionNameMin: Cijk_Ailk_Bljk_S_MX_B_Bias_HAS_SAV_UserArgs_MT256x160x32_MI32x32x1_SN_GRVWB4_GSU2_GSUC0_GSUWGMRR0_K1_LBSPPA0_LBSPPB128_LPA0_LPB4_LRVW4_MIAV0_MIWT2_5_NLCA1_SU0_SUM0_SUS0_SVW2_VWA2_VWB1_WG128_2_1_WGM2_WGMXCC1_WGMXCCGn1
    SolutionIndex: 337
    SolutionNameMin: Cijk_Ailk_Bljk_S_MX_B_Bias_HAS_SAV_UserArgs_MT128x192x32_MI32x32x1_SN_GRVWB4_GSU1_GSUC0_GSUWGMRR0_K1_LBSPPA0_LBSPPB128_LPA0_LPB4_LRVW4_MIAV0_MIWT2_3_NLCA1_SU0_SUM0_SUS0_SVW2_VWA2_VWB1_WG64_4_1_WGM1_WGMXCC1_WGMXCCGn1
    SolutionIndex: 338
    SolutionNameMin: Cijk_Ailk_Bljk_S_MX_B_Bias_HAS_SAV_UserArgs_MT256x128x32_MI32x32x1_SN_GRVWB4_GSU1_GSUC0_GSUWGMRR0_K1_LBSPPA0_LBSPPB512_LPA0_LPB4_LRVW4_MIAV0_MIWT2_4_NLCA1_SU0_SUM0_SUS0_SVW2_VWA2_VWB4_WG128_2_1_WGM2_WGMXCC1_WGMXCCGn1
    SolutionIndex: 339
    SolutionNameMin: Cijk_Ailk_Bljk_S_MX_B_Bias_HAS_SAV_UserArgs_MT256x128x16_MI32x32x1_SN_GRVWB4_GSU1_GSUC0_GSUWGMRR0_K1_LBSPPA0_LBSPPB256_LPA0_LPB4_LRVW4_MIWT2_4_NTC0_NTD0_NLCA1_SU0_SUM0_SUS0_SVW2_VWA2_VWB4_WG128_2_1_WGMn4_WGMXCC1_WGMXCCGn1
    SolutionIndex: 340
    SolutionNameMin: Cijk_Ailk_Bljk_S_MX_B_Bias_HAS_SAV_UserArgs_MT224x256x32_MI32x32x1_SN_GRVWB4_GSU1_GSUC0_GSUWGMRR0_K1_LBSPPA0_LBSPPB256_LPA0_LPB4_LRVW4_MIWT7_2_NTC0_NTD0_NLCA7_SU0_SUM0_SUS0_SVW1_VWA1_VWB2_WG32_8_1_WGMn4_WGMXCC1_WGMXCCGn1
    SolutionIndex: 341
    SolutionNameMin: Cijk_Ailk_Bljk_S_MX_B_Bias_HAS_SAV_UserArgs_MT448x128x16_MI32x32x1_SN_GRVWB4_GSU1_GSUC0_GSUWGMRR0_K1_LBSPPA0_LBSPPB128_LPA0_LPB4_LRVW4_MIWT7_2_NTC0_NTD0_NLCA7_SU0_SUM0_SUS0_SVW1_VWA1_VWB2_WG64_4_1_WGMn4_WGMXCC1_WGMXCCGn1
    SolutionIndex: 342
    SolutionNameMin: Cijk_Ailk_Bljk_S_MX_B_Bias_HAS_SAV_UserArgs_MT320x128x16_MI16x16x1_SN_GRVWB4_GSU1_GSUC0_GSUWGMRR0_K1_LBSPPA2560_LBSPPB256_LPA16_LPB4_LRVW2_MIWT5_8_NTC0_NTD0_NLCA5_SU0_SUM0_SUS0_SVW1_VWA1_VWB4_WG64_4_1_WGMn4_WGMXCC1_WGMXCCGn1
    SolutionIndex: 343
    SolutionNameMin: Cijk_Ailk_Bljk_S_MX_B_Bias_HAS_SAV_UserArgs_MT320x128x32_MI32x32x1_SN_GRVWB4_GSU1_GSUC0_GSUWGMRR0_K1_LBSPPA0_LBSPPB256_LPA0_LPB4_LRVW4_MIWT5_2_NTC0_NTD0_NLCA5_SU0_SUM0_SUS0_SVW1_VWA1_VWB2_WG64_4_1_WGMn4_WGMXCC1_WGMXCCGn1
    SolutionIndex: 344
    SolutionNameMin: Cijk_Ailk_Bljk_S_MX_B_Bias_HAS_SAV_UserArgs_MT256x128x32_MI32x32x1_SN_GRVWB4_GSU1_GSUC0_GSUWGMRR0_K1_LBSPPA0_LBSPPB512_LPA0_LPB4_LRVW4_MIWT2_4_NTC0_NTD0_NLCA1_SU0_SUM0_SUS0_SVW2_VWA2_VWB4_WG128_2_1_WGMn4_WGMXCC1_WGMXCCGn1
    SolutionIndex: 345
    SolutionNameMin: Cijk_Ailk_Bljk_S_MX_B_Bias_HAS_SAV_UserArgs_MT256x160x16_MI16x16x1_SN_GRVWB1_GSU1_GSUC0_GSUWGMRR0_K1_LBSPPA2048_LBSPPB128_LPA0_LPB2_LRVW2_MIWT4_10_NTC0_NTD0_NLCA1_SU0_SUM0_SUS0_SVW4_VWA4_VWB2_WG64_4_1_WGMn4_WGMXCC1_WGMXCCGn1
    SolutionIndex: 346
    SolutionNameMin: Cijk_Ailk_Bljk_S_MX_B_Bias_HAS_SAV_UserArgs_MT256x160x32_MI32x32x1_SN_GRVWB4_GSU1_GSUC0_GSUWGMRR0_K1_LBSPPA0_LBSPPB128_LPA0_LPB4_LRVW4_MIWT2_5_NTC0_NTD0_NLCA1_SU0_SUM0_SUS0_SVW2_VWA2_VWB1_WG128_2_1_WGMn4_WGMXCC1_WGMXCCGn1
    SolutionIndex: 347
    SolutionNameMin: Cijk_Ailk_Bljk_S_MX_B_Bias_HAS_SAV_UserArgs_MT256x128x16_MI32x32x1_SN_GRVWB4_GSU1_GSUC0_GSUWGMRR0_K1_LBSPPA0_LBSPPB256_LPA0_LPB4_LRVW4_MIWT2_4_NTC3_NTD3_NLCA1_SU0_SUM0_SUS0_SVW2_VWA2_VWB4_WG128_2_1_WGMn4_WGMXCC1_WGMXCCGn1
    SolutionIndex: 348
    SolutionNameMin: Cijk_Ailk_Bljk_S_MX_B_Bias_HAS_SAV_UserArgs_MT384x128x16_MI32x32x1_SN_GRVWB4_GSU1_GSUC0_GSUWGMRR0_K1_LBSPPA0_LBSPPB128_LPA0_LPB4_LRVW4_MIWT6_2_NTC0_NTD0_NLCA3_SU0_SUM0_SUS0_SVW2_VWA2_VWB2_WG64_4_1_WGMn4_WGMXCC1_WGMXCCGn1
    SolutionIndex: 349
    SolutionNameMin: Cijk_Ailk_Bljk_S_MX_B_Bias_HAS_SAV_UserArgs_MT256x192x32_MI32x32x1_SN_GRVWB4_GSU1_GSUC0_GSUWGMRR0_K1_LBSPPA0_LBSPPB256_LPA0_LPB4_LRVW4_MIWT2_6_NTC0_NTD0_NLCA1_SU0_SUM0_SUS0_SVW2_VWA2_VWB2_WG128_2_1_WGMn4_WGMXCC1_WGMXCCGn1
    SolutionIndex: 350
    SolutionNameMin: Cijk_Ailk_Bljk_S_MX_B_Bias_HAS_SAV_UserArgs_MT192x128x16_MI32x32x1_SN_GRVWB4_GSU1_GSUC0_GSUWGMRR0_K1_LBSPPA0_LBSPPB128_LPA0_LPB4_LRVW4_MIWT3_2_NLCA3_SU8_SUM0_SUS256_SVW1_VWA1_VWB2_WG64_4_1_WGMn4_WGMXCC1_WGMXCCGn1
    SolutionIndex: 351
    SolutionNameMin: Cijk_Ailk_Bljk_S_MX_B_Bias_HAS_SAV_UserArgs_MT256x128x16_MI32x32x1_SN_GRVWB4_GSU1_GSUC0_GSUWGMRR0_K1_LBSPPA0_LBSPPB256_LPA0_LPB4_LRVW4_MIWT2_4_NLCA1_SU8_SUM0_SUS256_SVW2_VWA2_VWB4_WG128_2_1_WGMn4_WGMXCC1_WGMXCCGn1
    SolutionIndex: 352
    SolutionNameMin: Cijk_Ailk_Bljk_S_MX_B_Bias_HAS_SAV_UserArgs_MT256x128x16_MI16x16x1_SN_GRVWB4_GSU1_GSUC0_GSUWGMRR0_K1_LBSPPA2048_LBSPPB256_LPA0_LPB4_LRVW2_MIWT4_8_NLCA1_SU8_SUM0_SUS256_SVW4_VWA4_VWB4_WG64_4_1_WGMn4_WGMXCC1_WGMXCCGn1
    SolutionIndex: 353
    SolutionNameMin: Cijk_Ailk_Bljk_S_MX_B_Bias_HAS_SAV_UserArgs_MT320x128x16_MI16x16x1_SN_GRVWB4_GSU1_GSUC0_GSUWGMRR0_K1_LBSPPA2560_LBSPPB256_LPA16_LPB4_LRVW2_MIWT5_8_NLCA5_SU8_SUM0_SUS256_SVW1_VWA1_VWB4_WG64_4_1_WGMn4_WGMXCC1_WGMXCCGn1
    SolutionIndex: 354
    SolutionNameMin: Cijk_Ailk_Bljk_S_MX_B_Bias_HAS_SAV_UserArgs_MT192x192x16_MI32x32x1_SN_GRVWB4_GSU1_GSUC0_GSUWGMRR0_K1_LBSPPA0_LBSPPB128_LPA0_LPB4_LRVW4_MIWT3_3_NLCA3_SU8_SUM0_SUS256_SVW1_VWA1_VWB1_WG64_4_1_WGMn4_WGMXCC1_WGMXCCGn1
    SolutionIndex: 355
    SolutionNameMin: Cijk_Ailk_Bljk_S_MX_B_Bias_HAS_SAV_UserArgs_MT16x64x128_MI16x16x1_SN_GRVWB4_GSU1_GSUC0_GSUWGMRR0_K1_LBSPPA256_LBSPPB1024_LPA16_LPB8_LRVW4_MIWT1_2_SU0_SUM0_SUS0_SVW1_VWA1_VWB2_WG16_8_2_WGM1_WGMXCC1_WGMXCCGn1
    SolutionIndex: 356
    SolutionNameMin: Cijk_Ailk_Bljk_S_MX_B_Bias_HAS_SAV_UserArgs_MT16x64x64_MI16x16x1_SN_GRVWB4_GSU5_GSUC0_GSUWGMRR0_K1_LBSPPA256_LBSPPB256_LPA16_LPB8_LRVW4_MIWT1_1_SU0_SUM0_SUS0_SVW1_VWA1_VWB1_WG16_16_1_WGM1_WGMXCC1_WGMXCCGn1
    SolutionIndex: 357
    SolutionNameMin: Cijk_Ailk_Bljk_S_MX_B_Bias_HAS_SAV_UserArgs_MT32x64x128_MI32x32x1_SN_GRVWB4_GSU1_GSUC0_GSUWGMRR0_K1_LBSPPA0_LBSPPB512_LPA0_LPB4_LRVW4_MIWT1_1_SU0_SUM0_SUS0_SVW1_VWA1_VWB1_WG32_4_2_WGM1_WGMXCC1_WGMXCCGn1
    SolutionIndex: 358
    SolutionNameMin: Cijk_Ailk_Bljk_S_MX_B_Bias_HAS_SAV_UserArgs_MT32x128x64_MI32x32x1_SN_GRVWB4_GSU5_GSUC0_GSUWGMRR0_K1_LBSPPA0_LBSPPB256_LPA0_LPB4_LRVW4_MIWT1_1_SU0_SUM0_SUS0_SVW1_VWA1_VWB1_WG32_8_1_WGM1_WGMXCC1_WGMXCCGn1
    SolutionIndex: 359
    SolutionNameMin: Cijk_Ailk_Bljk_S_MX_B_Bias_HAS_SAV_UserArgs_MT16x32x64_MI16x16x1_SN_GRVWB4_GSU1_GSUC0_GSUWGMRR0_K1_LBSPPA256_LBSPPB256_LPA16_LPB8_LRVW4_MIWT1_1_SU0_SUM0_SUS0_SVW1_VWA1_VWB1_WG16_8_1_WGM1_WGMXCC1_WGMXCCGn1
    SolutionIndex: 360
    SolutionNameMin: Cijk_Ailk_Bljk_S_MX_B_Bias_HAS_SAV_UserArgs_MT16x96x128_MI16x16x1_SN_GRVWB4_GSU1_GSUC0_GSUWGMRR0_K1_LBSPPA256_LBSPPB512_LPA16_LPB8_LRVW4_MIWT1_3_SU0_SUM0_SUS0_SVW1_VWA1_VWB1_WG16_8_2_WGM1_WGMXCC1_WGMXCCGn1
    SolutionIndex: 361
    SolutionNameMin: Cijk_Ailk_Bljk_S_MX_B_Bias_HAS_SAV_UserArgs_MT32x80x128_MI16x16x1_SN_GRVWB4_GSU1_GSUC0_GSUWGMRR0_K1_LBSPPA512_LBSPPB512_LPA16_LPB8_LRVW4_MIWT1_5_SU0_SUM0_SUS0_SVW1_VWA1_VWB1_WG32_4_2_WGM1_WGMXCC1_WGMXCCGn1
    SolutionIndex: 362
    SolutionNameMin: Cijk_Ailk_Bljk_S_MX_B_Bias_HAS_SAV_UserArgs_MT32x160x64_MI16x16x1_SN_GRVWB4_GSU2_GSUC0_GSUWGMRR0_K1_LBSPPA512_LBSPPB256_LPA0_LPB8_LRVW4_MIWT2_5_SU0_SUM0_SUS0_SVW2_VWA2_VWB1_WG16_8_2_WGM1_WGMXCC1_WGMXCCGn1
    SolutionIndex: 363
    SolutionNameMin: Cijk_Ailk_Bljk_S_MX_B_Bias_HAS_SAV_UserArgs_MT64x128x64_MI32x32x1_SN_CLR1_GRVWB4_GSU2_GSUC0_GSUWGMRR0_K1_LBSPPA0_LBSPPB512_LPA0_LPB4_LRVW4_MIAV1_MIWT2_2_NLCA1_PLR1_SU0_SUM0_SUS0_SVW2_VWA2_VWB2_WG32_4_2_WGM1_WGMXCC1_WGMXCCGn1
    SolutionIndex: 364
    SolutionNameMin: Cijk_Ailk_Bljk_S_MX_B_Bias_HAS_SAV_UserArgs_MT64x256x32_MI32x32x1_SN_CLR1_GRVWB4_GSU5_GSUC0_GSUWGMRR0_K1_LBSPPA0_LBSPPB256_LPA0_LPB4_LRVW4_MIAV1_MIWT2_2_NLCA1_PLR1_SU0_SUM0_SUS0_SVW2_VWA2_VWB2_WG32_8_1_WGM1_WGMXCC1_WGMXCCGn1
    SolutionIndex: 365
    SolutionNameMin: Cijk_Ailk_Bljk_S_MX_B_Bias_HAS_SAV_UserArgs_MT96x224x32_MI16x16x1_SN_CLR1_GRVWB4_GSU4_GSUC0_GSUWGMRR0_K1_LBSPPA1536_LBSPPB128_LPA16_LPB8_LRVW4_MIAV1_MIWT3_7_NLCA3_PLR1_SU0_SUM0_SUS0_SVW1_VWA1_VWB1_WG32_8_1_WGM1_WGMXCC1_WGMXCCGn1
    SolutionIndex: 366
    SolutionNameMin: Cijk_Ailk_Bljk_S_MX_B_Bias_HAS_SAV_UserArgs_MT96x256x32_MI16x16x1_SN_CLR1_GRVWB4_GSU5_GSUC0_GSUWGMRR0_K1_LBSPPA1536_LBSPPB512_LPA16_LPB8_LRVW4_MIAV0_MIWT3_8_NLCA3_PLR1_SU0_SUM0_SUS0_SVW1_VWA1_VWB4_WG32_8_1_WGM1_WGMXCC1_WGMXCCGn1
    SolutionIndex: 367
    SolutionNameMin: Cijk_Ailk_Bljk_S_MX_B_Bias_HAS_SAV_UserArgs_MT64x80x64_MI16x16x1_SN_CLR1_GRVWB4_GSU1_GSUC0_GSUWGMRR0_K1_LBSPPA1024_LBSPPB256_LPA0_LPB8_LRVW4_MIAV1_MIWT2_5_NLCA1_PLR1_SU0_SUM0_SUS0_SVW2_VWA2_VWB1_WG32_4_2_WGM1_WGMXCC1_WGMXCCGn1
    SolutionIndex: 368
    SolutionNameMin: Cijk_Ailk_Bljk_S_MX_B_Bias_HAS_SAV_UserArgs_MT64x160x64_MI16x16x1_SN_CLR1_GRVWB4_GSU2_GSUC0_GSUWGMRR0_K1_LBSPPA1024_LBSPPB256_LPA0_LPB8_LRVW4_MIAV1_MIWT2_5_NLCA1_PLR1_SU0_SUM0_SUS0_SVW2_VWA2_VWB1_WG32_8_1_WGM1_WGMXCC1_WGMXCCGn1
    SolutionIndex: 369
    SolutionNameMin: Cijk_Ailk_Bljk_S_MX_B_Bias_HAS_SAV_UserArgs_MT96x160x32_MI16x16x1_SN_CLR1_GRVWB4_GSU2_GSUC0_GSUWGMRR0_K1_LBSPPA1536_LBSPPB128_LPA16_LPB8_LRVW4_MIAV1_MIWT3_5_NLCA3_PLR1_SU0_SUM0_SUS0_SVW1_VWA1_VWB1_WG32_8_1_WGM1_WGMXCC1_WGMXCCGn1
    SolutionIndex: 370
    SolutionNameMin: Cijk_Ailk_Bljk_S_MX_B_Bias_HAS_SAV_UserArgs_MT96x192x32_MI16x16x1_SN_CLR1_GRVWB4_GSU5_GSUC0_GSUWGMRR0_K1_LBSPPA1536_LBSPPB256_LPA16_LPB8_LRVW4_MIAV1_MIWT3_6_NLCA3_PLR1_SU0_SUM0_SUS0_SVW1_VWA1_VWB2_WG32_8_1_WGM1_WGMXCC1_WGMXCCGn1
    SolutionIndex: 371
    SolutionNameMin: Cijk_Ailk_Bljk_S_MX_B_Bias_HAS_SAV_UserArgs_MT128x256x32_MI32x32x1_SN_CLR1_GRVWB4_GSU5_GSUC0_GSUWGMRR0_K1_LBSPPA0_LBSPPB512_LPA0_LPB4_LRVW4_MIAV0_MIWT2_4_NLCA1_PLR1_SU0_SUM0_SUS0_SVW2_VWA2_VWB4_WG64_4_1_WGM1_WGMXCC1_WGMXCCGn1
    SolutionIndex: 372
    SolutionNameMin: Cijk_Ailk_Bljk_S_MX_B_Bias_HAS_SAV_UserArgs_MT128x320x32_MI32x32x1_SN_CLR1_GRVWB4_GSU4_GSUC0_GSUWGMRR0_K1_LBSPPA0_LBSPPB128_LPA0_LPB4_LRVW4_MIAV0_MIWT2_5_NLCA1_PLR1_SU0_SUM0_SUS0_SVW2_VWA2_VWB1_WG64_4_1_WGM1_WGMXCC1_WGMXCCGn1
    SolutionIndex: 373
    SolutionNameMin: Cijk_Ailk_Bljk_S_MX_B_Bias_HAS_SAV_UserArgs_MT96x160x32_MI16x16x1_SN_CLR1_GRVWB4_GSU1_GSUC0_GSUWGMRR0_K1_LBSPPA1536_LBSPPB128_LPA16_LPB8_LRVW4_MIAV1_MIWT3_5_NLCA3_PLR1_SU0_SUM0_SUS0_SVW1_VWA1_VWB1_WG32_8_1_WGM1_WGMXCC1_WGMXCCGn1
    SolutionIndex: 374
    SolutionNameMin: Cijk_Ailk_Bljk_S_MX_B_Bias_HAS_SAV_UserArgs_MT192x256x32_MI32x32x1_SN_CLR1_GRVWB4_GSU3_GSUC0_GSUWGMRR0_K1_LBSPPA0_LBSPPB512_LPA0_LPB4_LRVW4_MIAV0_MIWT3_4_NLCA3_PLR1_SU0_SUM0_SUS0_SVW1_VWA1_VWB4_WG64_4_1_WGM1_WGMXCC1_WGMXCCGn1
    SolutionIndex: 375
    SolutionNameMin: Cijk_Ailk_Bljk_S_MX_B_Bias_HAS_SAV_UserArgs_MT192x208x32_MI16x16x1_SN_GRVWB1_GSU2_GSUC0_GSUWGMRR0_K1_LBSPPA3072_LBSPPB128_LPA16_LPB8_LRVW4_MIAV0_MIWT3_13_NLCA3_SU0_SUM0_SUS0_SVW1_VWA1_VWB1_WG64_4_1_WGM1_WGMXCC1_WGMXCCGn1
    SolutionIndex: 376
    SolutionNameMin: Cijk_Ailk_Bljk_S_MX_B_Bias_HAS_SAV_UserArgs_MT256x160x32_MI32x32x1_SN_GRVWB4_GSU2_GSUC0_GSUWGMRR0_K1_LBSPPA0_LBSPPB128_LPA0_LPB4_LRVW4_MIAV0_MIWT2_5_NLCA1_SU0_SUM0_SUS0_SVW2_VWA2_VWB1_WG128_2_1_WGM1_WGMXCC1_WGMXCCGn1
    SolutionIndex: 377
    SolutionNameMin: Cijk_Ailk_Bljk_S_MX_B_Bias_HAS_SAV_UserArgs_MT128x256x32_MI32x32x1_SN_GRVWB4_GSU1_GSUC0_GSUWGMRR0_K1_LBSPPA0_LBSPPB512_LPA0_LPB4_LRVW4_MIAV0_MIWT2_4_NLCA1_SU0_SUM0_SUS0_SVW2_VWA2_VWB4_WG64_4_1_WGM1_WGMXCC1_WGMXCCGn1
    SolutionIndex: 378
    SolutionNameMin: Cijk_Ailk_Bljk_S_MX_B_Bias_HAS_SAV_UserArgs_MT384x160x16_MI32x32x1_SN_GRVWB1_GSU2_GSUC0_GSUWGMRR0_K1_LBSPPA0_LBSPPB128_LPA0_LPB4_LRVW4_MIAV0_MIWT3_5_NLCA3_SU0_SUM0_SUS0_SVW1_VWA1_VWB1_WG128_2_1_WGM1_WGMXCC1_WGMXCCGn1
    SolutionIndex: 379
    SolutionNameMin: Cijk_Ailk_Bljk_S_MX_B_Bias_HAS_SAV_UserArgs_MT256x128x32_MI32x32x1_SN_GRVWB4_GSU1_GSUC0_GSUWGMRR0_K1_LBSPPA0_LBSPPB512_LPA0_LPB4_LRVW4_MIWT2_4_NLCA1_SU0_SUM0_SUS0_SVW2_VWA2_VWB4_WG128_2_1_WGM2_WGMXCC1_WGMXCCGn1
    SolutionIndex: 380
    SolutionNameMin: Cijk_Ailk_Bljk_S_MX_B_Bias_HAS_SAV_UserArgs_MT256x224x32_MI32x32x1_SN_GRVWB4_GSU2_GSUC0_GSUWGMRR0_K1_LBSPPA0_LBSPPB128_LPA0_LPB4_LRVW4_MIWT2_7_NLCA1_SU0_SUM0_SUS0_SVW2_VWA2_VWB1_WG128_2_1_WGM2_WGMXCC1_WGMXCCGn1
    SolutionIndex: 381
    SolutionNameMin: Cijk_Ailk_Bljk_S_MX_B_Bias_HAS_SAV_UserArgs_MT128x256x32_MI32x32x1_SN_GRVWB4_GSU1_GSUC0_GSUWGMRR0_K1_LBSPPA0_LBSPPB512_LPA0_LPB4_LRVW4_MIWT2_4_NLCA1_SU0_SUM0_SUS0_SVW2_VWA2_VWB4_WG64_4_1_WGM4_WGMXCC1_WGMXCCGn1
    SolutionIndex: 382
    SolutionNameMin: Cijk_Ailk_Bljk_S_MX_B_Bias_HAS_SAV_UserArgs_MT128x256x32_MI32x32x1_SN_GRVWB4_GSU1_GSUC0_GSUWGMRR0_K1_LBSPPA0_LBSPPB512_LPA0_LPB4_LRVW4_MIWT2_4_NLCA1_SU0_SUM0_SUS0_SVW2_VWA2_VWB4_WG64_4_1_WGM2_WGMXCC1_WGMXCCGn1
    SolutionIndex: 383
    SolutionNameMin: Cijk_Ailk_Bljk_S_MX_B_Bias_HAS_SAV_UserArgs_MT384x112x16_MI16x16x1_SN_GRVWB1_GSU1_GSUC0_GSUWGMRR0_K1_LBSPPA3072_LBSPPB128_LPA0_LPB2_LRVW2_MIWT6_7_NLCA3_SU0_SUM0_SUS0_SVW2_VWA2_VWB1_WG64_4_1_WGM4_WGMXCC1_WGMXCCGn1
    SolutionIndex: 384
    SolutionNameMin: Cijk_Ailk_Bljk_S_MX_B_Bias_HAS_SAV_UserArgs_MT160x256x32_MI32x32x1_SN_GRVWB4_GSU1_GSUC0_GSUWGMRR0_K1_LBSPPA0_LBSPPB256_LPA0_LPB4_LRVW4_MIWT5_2_NLCA5_SU0_SUM0_SUS0_SVW1_VWA1_VWB2_WG32_8_1_WGM4_WGMXCC1_WGMXCCGn1
    SolutionIndex: 385
    SolutionNameMin: Cijk_Ailk_Bljk_S_MX_B_Bias_HAS_SAV_UserArgs_MT256x160x32_MI32x32x1_SN_GRVWB4_GSU1_GSUC0_GSUWGMRR0_K1_LBSPPA0_LBSPPB128_LPA0_LPB4_LRVW4_MIWT2_5_NLCA1_SU0_SUM0_SUS0_SVW2_VWA2_VWB1_WG128_2_1_WGM2_WGMXCC1_WGMXCCGn1
    SolutionIndex: 386
    SolutionNameMin: Cijk_Ailk_Bljk_S_MX_B_Bias_HAS_SAV_UserArgs_MT256x160x32_MI32x32x1_SN_GRVWB4_GSU1_GSUC0_GSUWGMRR0_K1_LBSPPA0_LBSPPB128_LPA0_LPB4_LRVW4_MIWT2_5_NLCA1_SU0_SUM0_SUS0_SVW2_VWA2_VWB1_WG128_2_1_WGM4_WGMXCC1_WGMXCCGn1
    SolutionIndex: 387
    SolutionNameMin: Cijk_Ailk_Bljk_S_MX_B_Bias_HAS_SAV_UserArgs_MT128x192x16_MI32x32x1_SN_GRVWB4_GSU1_GSUC0_GSUWGMRR0_K1_LBSPPA0_LBSPPB128_LPA0_LPB4_LRVW4_MIWT1_6_NLCA1_SU0_SUM0_SUS0_SVW1_VWA1_VWB2_WG128_2_1_WGM2_WGMXCC1_WGMXCCGn1
    SolutionIndex: 388
    SolutionNameMin: Cijk_Ailk_Bljk_S_MX_B_Bias_HAS_SAV_UserArgs_MT320x160x16_MI16x16x1_SN_GRVWB1_GSU1_GSUC0_GSUWGMRR0_K1_LBSPPA2560_LBSPPB128_LPA0_LPB2_LRVW2_MIWT10_5_NLCA5_SU0_SUM0_SUS0_SVW2_VWA2_VWB1_WG32_8_1_WGM4_WGMXCC1_WGMXCCGn1
    SolutionIndex: 389
    SolutionNameMin: Cijk_Ailk_Bljk_S_MX_B_Bias_HAS_SAV_UserArgs_MT128x192x32_MI32x32x1_SN_GRVWB4_GSU1_GSUC0_GSUWGMRR0_K1_LBSPPA0_LBSPPB128_LPA0_LPB4_LRVW4_MIWT2_3_NLCA1_SU0_SUM0_SUS0_SVW2_VWA2_VWB1_WG64_4_1_WGM2_WGMXCC1_WGMXCCGn1
    SolutionIndex: 390
    SolutionNameMin: Cijk_Ailk_Bljk_S_MX_B_Bias_HAS_SAV_UserArgs_MT128x256x16_MI32x32x1_SN_GRVWB4_GSU1_GSUC0_GSUWGMRR0_K1_LBSPPA0_LBSPPB256_LPA0_LPB4_LRVW4_MIWT1_8_NLCA1_SU0_SUM0_SUS0_SVW1_VWA1_VWB4_WG128_2_1_WGM2_WGMXCC1_WGMXCCGn1
    SolutionIndex: 391
    SolutionNameMin: Cijk_Ailk_Bljk_S_MX_B_Bias_HAS_SAV_UserArgs_MT384x160x16_MI16x16x1_SN_GRVWB1_GSU1_GSUC0_GSUWGMRR0_K1_LBSPPA3072_LBSPPB128_LPA0_LPB2_LRVW2_MIWT6_10_NLCA3_SU0_SUM0_SUS0_SVW2_VWA2_VWB2_WG64_4_1_WGM4_WGMXCC1_WGMXCCGn1
    SolutionIndex: 392
    SolutionNameMin: Cijk_Ailk_Bljk_S_MX_B_Bias_HAS_SAV_UserArgs_MT384x160x16_MI32x32x1_SN_GRVWB1_GSU1_GSUC0_GSUWGMRR0_K1_LBSPPA0_LBSPPB128_LPA0_LPB4_LRVW4_MIWT3_5_NLCA3_SU0_SUM0_SUS0_SVW1_VWA1_VWB1_WG128_2_1_WGM4_WGMXCC1_WGMXCCGn1
    SolutionIndex: 393
    SolutionNameMin: Cijk_Ailk_Bljk_S_MX_B_Bias_HAS_SAV_UserArgs_MT256x224x32_MI32x32x1_SN_GRVWB4_GSU1_GSUC0_GSUWGMRR0_K1_LBSPPA0_LBSPPB128_LPA0_LPB4_LRVW4_MIWT2_7_NTC0_NTD0_NLCA1_SU0_SUM0_SUS0_SVW2_VWA2_VWB1_WG128_2_1_WGM4_WGMXCC1_WGMXCCGn1
    SolutionIndex: 394
    SolutionNameMin: Cijk_Ailk_Bljk_S_MX_B_Bias_HAS_SAV_UserArgs_MT256x224x32_MI32x32x1_SN_GRVWB4_GSU1_GSUC0_GSUWGMRR0_K1_LBSPPA0_LBSPPB128_LPA0_LPB4_LRVW4_MIWT2_7_NTC0_NTD0_NLCA1_SU0_SUM0_SUS0_SVW2_VWA2_VWB1_WG128_2_1_WGM2_WGMXCC1_WGMXCCGn1
    SolutionIndex: 395
    SolutionNameMin: Cijk_Ailk_Bljk_S_MX_B_Bias_HAS_SAV_UserArgs_MT320x128x16_MI16x16x1_SN_GRVWB4_GSU1_GSUC0_GSUWGMRR0_K1_LBSPPA2560_LBSPPB256_LPA16_LPB4_LRVW2_MIWT5_8_NTC0_NTD0_NLCA5_SU0_SUM0_SUS0_SVW1_VWA1_VWB4_WG64_4_1_WGM4_WGMXCC1_WGMXCCGn1
    SolutionIndex: 396
    SolutionNameMin: Cijk_Ailk_Bljk_S_MX_B_Bias_HAS_SAV_UserArgs_MT320x128x16_MI16x16x1_SN_GRVWB4_GSU1_GSUC0_GSUWGMRR0_K1_LBSPPA2560_LBSPPB256_LPA16_LPB4_LRVW2_MIWT5_8_NTC0_NTD0_NLCA5_SU0_SUM0_SUS0_SVW1_VWA1_VWB4_WG64_4_1_WGM2_WGMXCC1_WGMXCCGn1
    SolutionIndex: 397
    SolutionNameMin: Cijk_Ailk_Bljk_S_MX_B_Bias_HAS_SAV_UserArgs_MT256x160x32_MI32x32x1_SN_GRVWB4_GSU1_GSUC0_GSUWGMRR0_K1_LBSPPA0_LBSPPB128_LPA0_LPB4_LRVW4_MIWT2_5_NTC0_NTD0_NLCA1_SU0_SUM0_SUS0_SVW2_VWA2_VWB1_WG128_2_1_WGM2_WGMXCC1_WGMXCCGn1
    SolutionIndex: 398
    SolutionNameMin: Cijk_Ailk_Bljk_S_MX_B_Bias_HAS_SAV_UserArgs_MT512x128x16_MI32x32x1_SN_GRVWB4_GSU1_GSUC0_GSUWGMRR0_K1_LBSPPA0_LBSPPB256_LPA0_LPB4_LRVW4_MIWT4_4_NTC0_NTD0_NLCA1_SU0_SUM0_SUS0_SVW4_VWA4_VWB4_WG128_2_1_WGM2_WGMXCC1_WGMXCCGn1
    SolutionIndex: 399
    SolutionNameMin: Cijk_Ailk_Bljk_S_MX_B_Bias_HAS_SAV_UserArgs_MT256x160x32_MI32x32x1_SN_GRVWB4_GSU1_GSUC0_GSUWGMRR0_K1_LBSPPA0_LBSPPB128_LPA0_LPB4_LRVW4_MIWT2_5_NTC0_NTD0_NLCA1_SU0_SUM0_SUS0_SVW2_VWA2_VWB1_WG128_2_1_WGM4_WGMXCC1_WGMXCCGn1
    SolutionIndex: 400
    SolutionNameMin: Cijk_Ailk_Bljk_S_MX_B_Bias_HAS_SAV_UserArgs_MT256x208x16_MI16x16x1_SN_GRVWB1_GSU1_GSUC0_GSUWGMRR0_K1_LBSPPA2048_LBSPPB128_LPA0_LPB2_LRVW2_MIAV0_MIWT4_13_NTC0_NTD0_NLCA1_SU0_SUM0_SUS0_SVW4_VWA4_VWB1_WG64_4_1_WGMn4_WGMXCC1_WGMXCCGn1
    SolutionIndex: 401
    SolutionNameMin: Cijk_Ailk_Bljk_S_MX_B_Bias_HAS_SAV_UserArgs_MT256x224x32_MI32x32x1_SN_GRVWB4_GSU1_GSUC0_GSUWGMRR0_K1_LBSPPA0_LBSPPB128_LPA0_LPB4_LRVW4_MIAV0_MIWT2_7_NTC0_NTD0_NLCA1_SU0_SUM0_SUS0_SVW2_VWA2_VWB1_WG128_2_1_WGMn4_WGMXCC1_WGMXCCGn1
    SolutionIndex: 402
    SolutionNameMin: Cijk_Ailk_Bljk_S_MX_B_Bias_HAS_SAV_UserArgs_MT256x224x32_MI32x32x1_SN_GRVWB4_GSU1_GSUC0_GSUWGMRR0_K1_LBSPPA0_LBSPPB128_LPA0_LPB4_LRVW4_MIAV0_MIWT2_7_NTC3_NTD3_NLCA1_SU0_SUM0_SUS0_SVW2_VWA2_VWB1_WG128_2_1_WGMn4_WGMXCC1_WGMXCCGn1
    SolutionIndex: 403
    SolutionNameMin: Cijk_Ailk_Bljk_S_MX_B_Bias_HAS_SAV_UserArgs_MT256x128x16_MI32x32x1_SN_GRVWB4_GSU1_GSUC0_GSUWGMRR0_K1_LBSPPA0_LBSPPB256_LPA0_LPB4_LRVW4_MIAV0_MIWT2_4_NTC0_NTD0_NLCA1_SU0_SUM0_SUS0_SVW2_VWA2_VWB4_WG128_2_1_WGMn4_WGMXCC1_WGMXCCGn1
    SolutionIndex: 404
    SolutionNameMin: Cijk_Ailk_Bljk_S_MX_B_Bias_HAS_SAV_UserArgs_MT192x128x16_MI32x32x1_SN_GRVWB4_GSU1_GSUC0_GSUWGMRR0_K1_LBSPPA0_LBSPPB128_LPA0_LPB4_LRVW4_MIAV0_MIWT3_2_NTC3_NTD3_NLCA3_SU0_SUM0_SUS0_SVW1_VWA1_VWB2_WG64_4_1_WGMn4_WGMXCC1_WGMXCCGn1
    SolutionIndex: 405
    SolutionNameMin: Cijk_Ailk_Bljk_S_MX_B_Bias_HAS_SAV_UserArgs_MT320x128x16_MI16x16x1_SN_GRVWB4_GSU1_GSUC0_GSUWGMRR0_K1_LBSPPA2560_LBSPPB256_LPA16_LPB4_LRVW2_MIAV0_MIWT5_8_NTC0_NTD0_NLCA5_SU0_SUM0_SUS0_SVW1_VWA1_VWB4_WG64_4_1_WGMn4_WGMXCC1_WGMXCCGn1
    SolutionIndex: 406
    SolutionNameMin: Cijk_Ailk_Bljk_S_MX_B_Bias_HAS_SAV_UserArgs_MT256x192x32_MI32x32x1_SN_GRVWB4_GSU1_GSUC0_GSUWGMRR0_K1_LBSPPA0_LBSPPB256_LPA0_LPB4_LRVW4_MIAV0_MIWT2_6_NTC0_NTD0_NLCA1_SU0_SUM0_SUS0_SVW2_VWA2_VWB2_WG128_2_1_WGMn4_WGMXCC1_WGMXCCGn1
    SolutionIndex: 407
    SolutionNameMin: Cijk_Ailk_Bljk_S_MX_B_Bias_HAS_SAV_UserArgs_MT16x64x64_MI16x16x1_SN_GRVWB4_GSU1_GSUC0_GSUWGMRR0_K1_LBSPPA256_LBSPPB256_LPB8_LRVW4_MIWT1_1_SU0_SUM0_SUS0_VWB1_WG16_16_1_WGM1_WGMXCC1_WGMXCCGn1
    SolutionIndex: 408
    SolutionNameMin: Cijk_Ailk_Bljk_S_MX_B_Bias_HAS_SAV_UserArgs_MT16x64x64_MI16x16x1_SN_GRVWB4_GSU3_GSUC0_GSUWGMRR0_K1_LBSPPA256_LBSPPB256_LPB8_LRVW4_MIWT1_1_SU0_SUM0_SUS0_VWB1_WG16_16_1_WGM1_WGMXCC1_WGMXCCGn1
    SolutionIndex: 409
    SolutionNameMin: Cijk_Ailk_Bljk_S_MX_B_Bias_HAS_SAV_UserArgs_MT16x64x64_MI16x16x1_SN_GRVWB4_GSU5_GSUC0_GSUWGMRR0_K1_LBSPPA256_LBSPPB256_LPB8_LRVW4_MIWT1_1_SU0_SUM0_SUS0_VWB1_WG16_16_1_WGM1_WGMXCC1_WGMXCCGn1
    SolutionIndex: 410
    SolutionNameMin: Cijk_Ailk_Bljk_S_MX_B_Bias_HAS_SAV_UserArgs_MT16x160x64_MI16x16x1_SN_GRVWB4_GSU1_GSUC0_GSUWGMRR0_K1_LBSPPA256_LBSPPB256_LPB8_LRVW4_MIWT1_5_SU0_SUM0_SUS0_VWB1_WG16_8_2_WGM1_WGMXCC1_WGMXCCGn1
    SolutionIndex: 411
    SolutionNameMin: Cijk_Ailk_Bljk_S_MX_B_Bias_HAS_SAV_UserArgs_MT16x64x64_MI16x16x1_SN_GRVWB4_GSU1_GSUC0_GSUWGMRR0_K1_LBSPPA256_LBSPPB256_LPA16_LPB8_LRVW4_MIWT1_1_SU0_SUM0_SUS0_SVW1_VWA1_VWB1_WG16_16_1_WGM1_WGMXCC1_WGMXCCGn1
    SolutionIndex: 412
    SolutionNameMin: Cijk_Ailk_Bljk_S_MX_B_Bias_HAS_SAV_UserArgs_MT16x64x64_MI16x16x1_SN_GRVWB4_GSU3_GSUC0_GSUWGMRR0_K1_LBSPPA256_LBSPPB256_LPA16_LPB8_LRVW4_MIWT1_1_SU0_SUM0_SUS0_SVW1_VWA1_VWB1_WG16_16_1_WGM1_WGMXCC1_WGMXCCGn1
    SolutionIndex: 413
    SolutionNameMin: Cijk_Ailk_Bljk_S_MX_B_Bias_HAS_SAV_UserArgs_MT32x64x64_MI32x32x1_SN_GRVWB4_GSU1_GSUC0_GSUWGMRR0_K1_LBSPPA0_LBSPPB256_LPA0_LPB4_LRVW4_MIWT1_1_SU0_SUM0_SUS0_SVW1_VWA1_VWB1_WG32_4_1_WGM1_WGMXCC1_WGMXCCGn1
    SolutionIndex: 414
    SolutionNameMin: Cijk_Ailk_Bljk_S_MX_B_Bias_HAS_SAV_UserArgs_MT32x112x64_MI16x16x1_SN_GRVWB4_GSU1_GSUC0_GSUWGMRR0_K1_LBSPPA512_LBSPPB256_LPA16_LPB8_LRVW4_MIWT1_7_SU0_SUM0_SUS0_SVW1_VWA1_VWB1_WG32_4_2_WGM1_WGMXCC1_WGMXCCGn1
    SolutionIndex: 415
    SolutionNameMin: Cijk_Ailk_Bljk_S_MX_B_Bias_HAS_SAV_UserArgs_MT16x160x64_MI16x16x1_SN_GRVWB4_GSU1_GSUC0_GSUWGMRR0_K1_LBSPPA256_LBSPPB256_LPA16_LPB8_LRVW4_MIWT1_5_SU0_SUM0_SUS0_SVW1_VWA1_VWB1_WG16_8_2_WGM1_WGMXCC1_WGMXCCGn1
    SolutionIndex: 416
    SolutionNameMin: Cijk_Ailk_Bljk_S_MX_B_Bias_HAS_SAV_UserArgs_MT32x160x64_MI16x16x1_SN_GRVWB4_GSU1_GSUC0_GSUWGMRR0_K1_LBSPPA512_LBSPPB256_LPA0_LPB8_LRVW4_MIWT2_5_SU0_SUM0_SUS0_SVW2_VWA2_VWB1_WG16_8_2_WGM1_WGMXCC1_WGMXCCGn1
    SolutionIndex: 417
    SolutionNameMin: Cijk_Ailk_Bljk_S_MX_B_Bias_HAS_SAV_UserArgs_MT32x160x64_MI16x16x1_SN_GRVWB4_GSU1_GSUC0_GSUWGMRR0_K1_LBSPPA512_LBSPPB512_LPA16_LPB8_LRVW4_MIWT1_10_SU0_SUM0_SUS0_SVW1_VWA1_VWB2_WG32_4_2_WGM1_WGMXCC1_WGMXCCGn1
    SolutionIndex: 418
    SolutionNameMin: Cijk_Ailk_Bljk_S_MX_B_Bias_HAS_SAV_UserArgs_MT64x112x64_MI16x16x1_SN_CLR1_GRVWB4_GSU1_GSUC0_GSUWGMRR0_K1_LBSPPA1024_LBSPPB256_LPA0_LPB8_LRVW4_MIAV1_MIWT2_7_NLCA1_PLR1_SU0_SUM0_SUS0_SVW2_VWA2_VWB1_WG32_4_2_WGM1_WGMXCC1_WGMXCCGn1
    SolutionIndex: 419
    SolutionNameMin: Cijk_Ailk_Bljk_S_MX_B_Bias_HAS_SAV_UserArgs_MT96x224x32_MI16x16x1_SN_CLR1_GRVWB4_GSU2_GSUC0_GSUWGMRR0_K1_LBSPPA1536_LBSPPB128_LPA16_LPB8_LRVW4_MIAV1_MIWT3_7_NLCA3_PLR1_SU0_SUM0_SUS0_SVW1_VWA1_VWB1_WG32_8_1_WGM1_WGMXCC1_WGMXCCGn1
    SolutionIndex: 420
    SolutionNameMin: Cijk_Ailk_Bljk_S_MX_B_Bias_HAS_SAV_UserArgs_MT64x160x64_MI16x16x1_SN_CLR1_GRVWB4_GSU1_GSUC0_GSUWGMRR0_K1_LBSPPA1024_LBSPPB256_LPA0_LPB8_LRVW4_MIAV1_MIWT2_5_NLCA1_PLR1_SU0_SUM0_SUS0_SVW2_VWA2_VWB1_WG32_8_1_WGM1_WGMXCC1_WGMXCCGn1
    SolutionIndex: 421
    SolutionNameMin: Cijk_Ailk_Bljk_S_MX_B_Bias_HAS_SAV_UserArgs_MT96x320x32_MI16x16x1_SN_CLR1_GRVWB4_GSU2_GSUC0_GSUWGMRR0_K1_LBSPPA1536_LBSPPB256_LPA16_LPB8_LRVW4_MIAV0_MIWT3_10_NLCA3_PLR1_SU0_SUM0_SUS0_SVW1_VWA1_VWB2_WG32_8_1_WGM1_WGMXCC1_WGMXCCGn1
    SolutionIndex: 422
    SolutionNameMin: Cijk_Ailk_Bljk_S_MX_B_Bias_HAS_SAV_UserArgs_MT128x224x32_MI32x32x1_SN_GRVWB4_GSU2_GSUC0_GSUWGMRR0_K1_LBSPPA0_LBSPPB128_LPA0_LPB4_LRVW4_MIAV0_MIWT1_7_NLCA1_SU0_SUM0_SUS0_SVW1_VWA1_VWB1_WG128_2_1_WGM1_WGMXCC1_WGMXCCGn1
    SolutionIndex: 423
    SolutionNameMin: Cijk_Ailk_Bljk_S_MX_B_Bias_HAS_SAV_UserArgs_MT192x112x32_MI16x16x1_SN_GRVWB1_GSU1_GSUC0_GSUWGMRR0_K1_LBSPPA3072_LBSPPB128_LPA16_LPB8_LRVW4_MIAV1_MIWT3_7_NLCA3_SU0_SUM0_SUS0_SVW1_VWA1_VWB1_WG64_4_1_WGM1_WGMXCC1_WGMXCCGn1
    SolutionIndex: 424
    SolutionNameMin: Cijk_Ailk_Bljk_S_MX_B_Bias_HAS_SAV_UserArgs_MT128x160x32_MI16x16x1_SN_GRVWB4_GSU1_GSUC0_GSUWGMRR0_K1_LBSPPA2048_LBSPPB256_LPA0_LPB8_LRVW4_MIAV1_MIWT2_10_NLCA1_SU0_SUM0_SUS0_SVW2_VWA2_VWB2_WG64_4_1_WGM1_WGMXCC1_WGMXCCGn1
    SolutionIndex: 425
    SolutionNameMin: Cijk_Ailk_Bljk_S_MX_B_Bias_HAS_SAV_UserArgs_MT128x320x32_MI32x32x1_SN_GRVWB4_GSU2_GSUC0_GSUWGMRR0_K1_LBSPPA0_LBSPPB128_LPA0_LPB4_LRVW4_MIAV0_MIWT2_5_NLCA1_SU0_SUM0_SUS0_SVW2_VWA2_VWB1_WG64_4_1_WGM1_WGMXCC1_WGMXCCGn1
    SolutionIndex: 426
    SolutionNameMin: Cijk_Ailk_Bljk_S_MX_B_Bias_HAS_SAV_UserArgs_MT192x160x32_MI16x16x1_SN_GRVWB4_GSU1_GSUC0_GSUWGMRR0_K1_LBSPPA3072_LBSPPB256_LPA16_LPB8_LRVW4_MIAV0_MIWT3_10_NLCA3_SU0_SUM0_SUS0_SVW1_VWA1_VWB2_WG64_4_1_WGM1_WGMXCC1_WGMXCCGn1
    SolutionIndex: 427
    SolutionNameMin: Cijk_Ailk_Bljk_S_MX_B_Bias_HAS_SAV_UserArgs_MT192x256x32_MI32x32x1_SN_GRVWB4_GSU3_GSUC0_GSUWGMRR0_K1_LBSPPA0_LBSPPB512_LPA0_LPB4_LRVW4_MIAV0_MIWT3_4_NLCA3_SU0_SUM0_SUS0_SVW1_VWA1_VWB4_WG64_4_1_WGM1_WGMXCC1_WGMXCCGn1
    SolutionIndex: 428
    SolutionNameMin: Cijk_Ailk_Bljk_S_MX_B_Bias_HAS_SAV_UserArgs_MT256x224x32_MI32x32x1_SN_GRVWB4_GSU2_GSUC0_GSUWGMRR0_K1_LBSPPA0_LBSPPB128_LPA0_LPB4_LRVW4_MIAV0_MIWT2_7_NLCA1_SU0_SUM0_SUS0_SVW2_VWA2_VWB1_WG128_2_1_WGM1_WGMXCC1_WGMXCCGn1
    SolutionIndex: 429
    SolutionNameMin: Cijk_Ailk_Bljk_S_MX_B_Bias_HAS_SAV_UserArgs_MT384x112x16_MI16x16x1_SN_GRVWB1_GSU1_GSUC0_GSUWGMRR0_K1_LBSPPA3072_LBSPPB128_LPA0_LPB2_LRVW2_MIAV0_MIWT6_7_NLCA3_SU0_SUM0_SUS0_SVW2_VWA2_VWB1_WG64_4_1_WGM1_WGMXCC1_WGMXCCGn1
    SolutionIndex: 430
    SolutionNameMin: Cijk_Ailk_Bljk_S_MX_B_Bias_HAS_SAV_UserArgs_MT192x208x32_MI16x16x1_SN_GRVWB1_GSU1_GSUC0_GSUWGMRR0_K1_LBSPPA3072_LBSPPB128_LPA16_LPB8_LRVW4_MIAV0_MIWT3_13_NLCA3_SU0_SUM0_SUS0_SVW1_VWA1_VWB1_WG64_4_1_WGM1_WGMXCC1_WGMXCCGn1
    SolutionIndex: 431
    SolutionNameMin: Cijk_Ailk_Bljk_S_MX_B_Bias_HAS_SAV_UserArgs_MT384x160x16_MI32x32x1_SN_GRVWB1_GSU3_GSUC0_GSUWGMRR0_K1_LBSPPA0_LBSPPB128_LPA0_LPB4_LRVW4_MIAV0_MIWT3_5_NLCA3_SU0_SUM0_SUS0_SVW1_VWA1_VWB1_WG128_2_1_WGM1_WGMXCC1_WGMXCCGn1
    SolutionIndex: 432
    SolutionNameMin: Cijk_Ailk_Bljk_S_MX_B_Bias_HAS_SAV_UserArgs_MT256x160x32_MI32x32x1_SN_GRVWB4_GSU1_GSUC0_GSUWGMRR0_K1_LBSPPA0_LBSPPB128_LPA0_LPB4_LRVW4_MIAV0_MIWT2_5_NLCA1_SU0_SUM0_SUS0_SVW2_VWA2_VWB1_WG128_2_1_WGM1_WGMXCC1_WGMXCCGn1
    SolutionIndex: 433
    SolutionNameMin: Cijk_Ailk_Bljk_S_MX_B_Bias_HAS_SAV_UserArgs_MT128x256x16_MI32x32x1_SN_GRVWB4_GSU1_GSUC0_GSUWGMRR0_K1_LBSPPA0_LBSPPB256_LPA0_LPB4_LRVW4_MIAV0_MIWT1_8_NLCA1_SU0_SUM0_SUS0_SVW1_VWA1_VWB4_WG128_2_1_WGM1_WGMXCC1_WGMXCCGn1
    SolutionIndex: 434
    SolutionNameMin: Cijk_Ailk_Bljk_S_MX_B_Bias_HAS_SAV_UserArgs_MT384x160x16_MI32x32x1_SN_GRVWB1_GSU1_GSUC0_GSUWGMRR0_K1_LBSPPA0_LBSPPB128_LPA0_LPB4_LRVW4_MIAV0_MIWT3_5_NLCA3_SU0_SUM0_SUS0_SVW1_VWA1_VWB1_WG128_2_1_WGM1_WGMXCC1_WGMXCCGn1
    SolutionIndex: 435
    SolutionNameMin: Cijk_Ailk_Bljk_S_MX_B_Bias_HAS_SAV_UserArgs_MT256x208x16_MI16x16x1_SN_GRVWB1_GSU1_GSUC0_GSUWGMRR0_K1_LBSPPA2048_LBSPPB128_LPA0_LPB2_LRVW2_MIWT4_13_NTC3_NTD3_NLCA1_SU0_SUM0_SUS0_SVW4_VWA4_VWB1_WG64_4_1_WGM4_WGMXCC1_WGMXCCGn1
    SolutionIndex: 436
    SolutionNameMin: Cijk_Ailk_Bljk_S_MX_B_Bias_HAS_SAV_UserArgs_MT128x256x16_MI32x32x1_SN_GRVWB4_GSU1_GSUC0_GSUWGMRR0_K1_LBSPPA0_LBSPPB256_LPA0_LPB4_LRVW4_MIWT2_4_NTC3_NTD3_NLCA1_SU0_SUM0_SUS0_SVW2_VWA2_VWB4_WG64_4_1_WGM4_WGMXCC1_WGMXCCGn1
    SolutionIndex: 437
    SolutionNameMin: Cijk_Ailk_Bljk_S_MX_B_Bias_HAS_SAV_UserArgs_MT128x256x32_MI32x32x1_SN_GRVWB4_GSU1_GSUC0_GSUWGMRR0_K1_LBSPPA0_LBSPPB512_LPA0_LPB4_LRVW4_MIWT2_4_NTC3_NTD3_NLCA1_SU0_SUM0_SUS0_SVW2_VWA2_VWB4_WG64_4_1_WGM4_WGMXCC1_WGMXCCGn1
    SolutionIndex: 438
    SolutionNameMin: Cijk_Ailk_Bljk_S_MX_B_Bias_HAS_SAV_UserArgs_MT128x256x32_MI32x32x1_SN_GRVWB4_GSU1_GSUC0_GSUWGMRR0_K1_LBSPPA0_LBSPPB512_LPA0_LPB4_LRVW4_MIWT2_4_NTC0_NTD0_NLCA1_SU0_SUM0_SUS0_SVW2_VWA2_VWB4_WG64_4_1_WGM4_WGMXCC1_WGMXCCGn1
    SolutionIndex: 439
    SolutionNameMin: Cijk_Ailk_Bljk_S_MX_B_Bias_HAS_SAV_UserArgs_MT256x128x16_MI32x32x1_SN_GRVWB4_GSU1_GSUC0_GSUWGMRR0_K1_LBSPPA0_LBSPPB256_LPA0_LPB4_LRVW4_MIWT2_4_NTC0_NTD0_NLCA1_SU0_SUM0_SUS0_SVW2_VWA2_VWB4_WG128_2_1_WGM4_WGMXCC1_WGMXCCGn1
    SolutionIndex: 440
    SolutionNameMin: Cijk_Ailk_Bljk_S_MX_B_Bias_HAS_SAV_UserArgs_MT256x208x16_MI16x16x1_SN_GRVWB1_GSU1_GSUC0_GSUWGMRR0_K1_LBSPPA2048_LBSPPB128_LPA0_LPB2_LRVW2_MIWT4_13_NLCA1_SU8_SUM0_SUS256_SVW4_VWA4_VWB1_WG64_4_1_WGM4_WGMXCC1_WGMXCCGn1
    SolutionIndex: 441
    SolutionNameMin: Cijk_Ailk_Bljk_S_MX_B_Bias_HAS_SAV_UserArgs_MT256x224x32_MI32x32x1_SN_GRVWB4_GSU1_GSUC0_GSUWGMRR0_K1_LBSPPA0_LBSPPB128_LPA0_LPB4_LRVW4_MIWT2_7_NLCA1_SU8_SUM0_SUS256_SVW2_VWA2_VWB1_WG128_2_1_WGM4_WGMXCC1_WGMXCCGn1
    SolutionIndex: 442
    SolutionNameMin: Cijk_Ailk_Bljk_S_MX_B_Bias_HAS_SAV_UserArgs_MT192x192x16_MI16x16x1_SN_GRVWB4_GSU1_GSUC0_GSUWGMRR0_K1_LBSPPA1536_LBSPPB128_LPA0_LPB4_LRVW2_MIWT6_6_NLCA3_SU8_SUM0_SUS256_SVW2_VWA2_VWB2_WG32_8_1_WGM4_WGMXCC1_WGMXCCGn1
    SolutionIndex: 443
    SolutionNameMin: Cijk_Ailk_Bljk_S_MX_B_Bias_HAS_SAV_UserArgs_MT192x192x16_MI32x32x1_SN_GRVWB4_GSU1_GSUC0_GSUWGMRR0_K1_LBSPPA0_LBSPPB128_LPA0_LPB4_LRVW4_MIWT3_3_NLCA3_SU8_SUM0_SUS256_SVW1_VWA1_VWB1_WG64_4_1_WGM4_WGMXCC1_WGMXCCGn1
    SolutionIndex: 444
    SolutionNameMin: Cijk_Ailk_Bljk_S_MX_B_Bias_HAS_SAV_UserArgs_MT256x256x16_MI16x16x1_SN_GRVWB1_GSU1_GSUC0_GSUWGMRR0_K1_LBSPPA2048_LBSPPB256_LPA0_LPB2_LRVW2_MIWT4_16_NLCA1_SU8_SUM0_SUS256_SVW4_VWA4_VWB4_WG64_4_1_WGM4_WGMXCC1_WGMXCCGn1
    SolutionIndex: 445
    SolutionNameMin: Cijk_Ailk_Bljk_S_MX_B_Bias_HAS_SAV_UserArgs_MT192x192x16_MI16x16x1_SN_GRVWB4_GSU1_GSUC0_GSUWGMRR0_K1_LBSPPA1536_LBSPPB128_LPA0_LPB4_LRVW2_MIWT6_6_NLCA3_SU8_SUM0_SUS256_SVW2_VWA2_VWB2_WG32_8_1_WGMn4_WGMXCC1_WGMXCCGn1
    SolutionIndex: 446
    SolutionNameMin: Cijk_Ailk_Bljk_S_MX_B_Bias_HAS_SAV_UserArgs_MT256x192x32_MI32x32x1_SN_GRVWB4_GSU1_GSUC0_GSUWGMRR0_K1_LBSPPA0_LBSPPB256_LPA0_LPB4_LRVW4_MIWT2_6_NLCA1_SU8_SUM0_SUS256_SVW2_VWA2_VWB2_WG128_2_1_WGMn4_WGMXCC1_WGMXCCGn1
    SolutionIndex: 447
    SolutionNameMin: Cijk_Ailk_Bljk_S_MX_B_Bias_HAS_SAV_UserArgs_MT192x256x32_MI32x32x1_SN_GRVWB4_GSU1_GSUC0_GSUWGMRR0_K1_LBSPPA0_LBSPPB256_LPA0_LPB4_LRVW4_MIWT6_2_NLCA3_SU8_SUM0_SUS256_SVW2_VWA2_VWB2_WG32_8_1_WGMn4_WGMXCC1_WGMXCCGn1
    SolutionIndex: 448
    SolutionNameMin: Cijk_Ailk_Bljk_S_MX_B_Bias_HAS_SAV_UserArgs_MT16x64x64_MI16x16x1_SN_GRVWB4_GSU1_GSUC0_GSUWGMRR0_K1_LBSPPA256_LBSPPB256_LPB8_LRVW4_MIWT1_1_NTB4_SU0_SUM0_SUS0_VWB1_WG16_16_1_WGM1_WGMXCC1_WGMXCCGn1
    SolutionIndex: 449
    SolutionNameMin: Cijk_Ailk_Bljk_S_MX_B_Bias_HAS_SAV_UserArgs_MT16x64x64_MI16x16x1_SN_GRVWB4_GSU3_GSUC0_GSUWGMRR0_K1_LBSPPA256_LBSPPB256_LPB8_LRVW4_MIWT1_1_NTB4_SU0_SUM0_SUS0_VWB1_WG16_16_1_WGM1_WGMXCC1_WGMXCCGn1
    SolutionIndex: 450
    SolutionNameMin: Cijk_Ailk_Bljk_S_MX_B_Bias_HAS_SAV_UserArgs_MT16x64x64_MI16x16x1_SN_GRVWB4_GSU5_GSUC0_GSUWGMRR0_K1_LBSPPA256_LBSPPB256_LPB8_LRVW4_MIWT1_1_NTB4_SU0_SUM0_SUS0_VWB1_WG16_16_1_WGM1_WGMXCC1_WGMXCCGn1
    SolutionIndex: 451
    SolutionNameMin: Cijk_Ailk_Bljk_S_MX_B_Bias_HAS_SAV_UserArgs_MT16x192x64_MI16x16x1_SN_GRVWB4_GSU5_GSUC0_GSUWGMRR0_K1_LBSPPA256_LBSPPB256_LPB8_LRVW4_MIWT1_3_NTB4_SU0_SUM0_SUS0_VWB1_WG16_16_1_WGM1_WGMXCC1_WGMXCCGn1
    SolutionIndex: 452
    SolutionNameMin: Cijk_Ailk_Bljk_S_MX_B_Bias_HAS_SAV_UserArgs_MT16x64x64_MI16x16x1_SN_GRVWB4_GSU1_GSUC0_GSUWGMRR0_K1_LBSPPA256_LBSPPB256_LPA16_LPB8_LRVW4_MIWT1_1_NTB4_SU0_SUM0_SUS0_SVW1_VWA1_VWB1_WG16_16_1_WGM1_WGMXCC1_WGMXCCGn1
    SolutionIndex: 453
    SolutionNameMin: Cijk_Ailk_Bljk_S_MX_B_Bias_HAS_SAV_UserArgs_MT16x64x64_MI16x16x1_SN_GRVWB4_GSU3_GSUC0_GSUWGMRR0_K1_LBSPPA256_LBSPPB256_LPA16_LPB8_LRVW4_MIWT1_1_NTB4_SU0_SUM0_SUS0_SVW1_VWA1_VWB1_WG16_16_1_WGM1_WGMXCC1_WGMXCCGn1
    SolutionIndex: 454
    SolutionNameMin: Cijk_Ailk_Bljk_S_MX_B_Bias_HAS_SAV_UserArgs_MT16x64x64_MI16x16x1_SN_GRVWB4_GSU5_GSUC0_GSUWGMRR0_K1_LBSPPA256_LBSPPB256_LPA16_LPB8_LRVW4_MIWT1_1_NTB0_SU0_SUM0_SUS0_SVW1_VWA1_VWB1_WG16_16_1_WGM1_WGMXCC1_WGMXCCGn1
    SolutionIndex: 455
    SolutionNameMin: Cijk_Ailk_Bljk_S_MX_B_Bias_HAS_SAV_UserArgs_MT32x128x64_MI32x32x1_SN_GRVWB4_GSU1_GSUC0_GSUWGMRR0_K1_LBSPPA0_LBSPPB256_LPA0_LPB4_LRVW4_MIWT1_1_NTB4_SU0_SUM0_SUS0_SVW1_VWA1_VWB1_WG32_8_1_WGM1_WGMXCC1_WGMXCCGn1
    SolutionIndex: 456
    SolutionNameMin: Cijk_Ailk_Bljk_S_MX_B_Bias_HAS_SAV_UserArgs_MT32x128x64_MI32x32x1_SN_GRVWB4_GSU3_GSUC0_GSUWGMRR0_K1_LBSPPA0_LBSPPB256_LPA0_LPB4_LRVW4_MIWT1_1_NTB4_SU0_SUM0_SUS0_SVW1_VWA1_VWB1_WG32_8_1_WGM1_WGMXCC1_WGMXCCGn1
    SolutionIndex: 457
    SolutionNameMin: Cijk_Ailk_Bljk_S_MX_B_Bias_HAS_SAV_UserArgs_MT16x128x64_MI16x16x1_SN_GRVWB4_GSU2_GSUC0_GSUWGMRR0_K1_LBSPPA256_LBSPPB512_LPA16_LPB8_LRVW4_MIWT1_2_NTB4_SU0_SUM0_SUS0_SVW1_VWA1_VWB2_WG16_16_1_WGM1_WGMXCC1_WGMXCCGn1
    SolutionIndex: 458
    SolutionNameMin: Cijk_Ailk_Bljk_S_MX_B_Bias_HAS_SAV_UserArgs_MT32x64x64_MI16x16x1_SN_GRVWB4_GSU1_GSUC0_GSUWGMRR0_K1_LBSPPA512_LBSPPB512_LPA16_LPB8_LRVW4_MIWT1_2_NTB4_SU0_SUM0_SUS0_SVW1_VWA1_VWB2_WG32_8_1_WGM1_WGMXCC1_WGMXCCGn1
    SolutionIndex: 459
    SolutionNameMin: Cijk_Ailk_Bljk_S_MX_B_Bias_HAS_SAV_UserArgs_MT32x128x64_MI32x32x1_SN_GRVWB4_GSU2_GSUC0_GSUWGMRR0_K1_LBSPPA0_LBSPPB256_LPA0_LPB4_LRVW4_MIWT1_1_NTB4_SU0_SUM0_SUS0_SVW1_VWA1_VWB1_WG32_8_1_WGM1_WGMXCC1_WGMXCCGn1
    SolutionIndex: 460
    SolutionNameMin: Cijk_Ailk_Bljk_S_MX_B_Bias_HAS_SAV_UserArgs_MT64x224x32_MI16x16x1_SN_GRVWB4_GSU1_GSUC0_GSUWGMRR0_K1_LBSPPA1024_LBSPPB128_LPA0_LPB8_LRVW4_MIAV1_MIWT2_7_NTB4_NLCA1_SU0_SUM0_SUS0_SVW2_VWA2_VWB1_WG32_8_1_WGM1_WGMXCC1_WGMXCCGn1
    SolutionIndex: 461
    SolutionNameMin: Cijk_Ailk_Bljk_S_MX_B_Bias_HAS_SAV_UserArgs_MT64x320x32_MI32x32x1_SN_GRVWB4_GSU3_GSUC0_GSUWGMRR0_K1_LBSPPA0_LBSPPB128_LPA0_LPB4_LRVW4_MIAV1_MIWT1_5_NTB4_NLCA1_SU0_SUM0_SUS0_SVW1_VWA1_VWB1_WG64_4_1_WGM1_WGMXCC1_WGMXCCGn1
    SolutionIndex: 462
    SolutionNameMin: Cijk_Ailk_Bljk_S_MX_B_Bias_HAS_SAV_UserArgs_MT96x224x32_MI16x16x1_SN_GRVWB4_GSU1_GSUC0_GSUWGMRR0_K1_LBSPPA1536_LBSPPB128_LPA16_LPB8_LRVW4_MIAV1_MIWT3_7_NTB4_NLCA3_SU0_SUM0_SUS0_SVW1_VWA1_VWB1_WG32_8_1_WGM1_WGMXCC1_WGMXCCGn1
    SolutionIndex: 463
    SolutionNameMin: Cijk_Ailk_Bljk_S_MX_B_Bias_HAS_SAV_UserArgs_MT64x160x64_MI16x16x1_SN_GRVWB4_GSU1_GSUC0_GSUWGMRR0_K1_LBSPPA1024_LBSPPB256_LPA0_LPB8_LRVW4_MIAV1_MIWT2_5_NTB4_NLCA1_SU0_SUM0_SUS0_SVW2_VWA2_VWB1_WG32_8_1_WGM1_WGMXCC1_WGMXCCGn1
    SolutionIndex: 464
    SolutionNameMin: Cijk_Ailk_Bljk_S_MX_B_Bias_HAS_SAV_UserArgs_MT96x320x32_MI16x16x1_SN_GRVWB4_GSU1_GSUC0_GSUWGMRR0_K1_LBSPPA1536_LBSPPB256_LPA16_LPB8_LRVW4_MIAV0_MIWT3_10_NTB4_NLCA3_SU0_SUM0_SUS0_SVW1_VWA1_VWB2_WG32_8_1_WGM1_WGMXCC1_WGMXCCGn1
    SolutionIndex: 465
    SolutionNameMin: Cijk_Ailk_Bljk_S_MX_B_Bias_HAS_SAV_UserArgs_MT128x224x32_MI32x32x1_SN_GRVWB4_GSU1_GSUC0_GSUWGMRR0_K1_LBSPPA0_LBSPPB128_LPA0_LPB4_LRVW4_MIAV0_MIWT1_7_NTB4_NLCA1_SU0_SUM0_SUS0_SVW1_VWA1_VWB1_WG128_2_1_WGM1_WGMXCC1_WGMXCCGn1
    SolutionIndex: 466
    SolutionNameMin: Cijk_Ailk_Bljk_S_MX_B_Bias_HAS_SAV_UserArgs_MT128x320x32_MI32x32x1_SN_GRVWB4_GSU3_GSUC0_GSUWGMRR0_K1_LBSPPA0_LBSPPB128_LPA0_LPB4_LRVW4_MIAV0_MIWT2_5_NTB4_NLCA1_SU0_SUM0_SUS0_SVW2_VWA2_VWB1_WG64_4_1_WGM1_WGMXCC1_WGMXCCGn1
    SolutionIndex: 467
    SolutionNameMin: Cijk_Ailk_Bljk_S_MX_B_Bias_HAS_SAV_UserArgs_MT192x208x32_MI16x16x1_SN_GRVWB1_GSU1_GSUC0_GSUWGMRR0_K1_LBSPPA3072_LBSPPB128_LPA16_LPB8_LRVW4_MIAV0_MIWT3_13_NTB4_NLCA3_SU0_SUM0_SUS0_SVW1_VWA1_VWB1_WG64_4_1_WGM1_WGMXCC1_WGMXCCGn1
    SolutionIndex: 468
    SolutionNameMin: Cijk_Ailk_Bljk_S_MX_B_Bias_HAS_SAV_UserArgs_MT128x320x32_MI32x32x1_SN_GRVWB4_GSU1_GSUC0_GSUWGMRR0_K1_LBSPPA0_LBSPPB128_LPA0_LPB4_LRVW4_MIAV0_MIWT2_5_NTB4_NLCA1_SU0_SUM0_SUS0_SVW2_VWA2_VWB1_WG64_4_1_WGM1_WGMXCC1_WGMXCCGn1
    SolutionIndex: 469
    SolutionNameMin: Cijk_Ailk_Bljk_S_MX_B_Bias_HAS_SAV_UserArgs_MT192x320x16_MI16x16x1_SN_GRVWB4_GSU1_GSUC0_GSUWGMRR0_K1_LBSPPA1536_LBSPPB128_LPA0_LPB4_LRVW2_MIAV0_MIWT12_5_NTB4_NLCA3_SU0_SUM0_SUS0_SVW4_VWA4_VWB1_WG16_16_1_WGM1_WGMXCC1_WGMXCCGn1
    SolutionIndex: 470
    SolutionNameMin: Cijk_Ailk_Bljk_S_MX_B_Bias_HAS_SAV_UserArgs_MT192x320x16_MI32x32x1_SN_GRVWB4_GSU1_GSUC0_GSUWGMRR0_K1_LBSPPA0_LBSPPB128_LPA0_LPB4_LRVW4_MIAV0_MIWT3_5_NTB0_NLCA3_SU0_SUM0_SUS0_SVW1_VWA1_VWB1_WG64_4_1_WGM1_WGMXCC1_WGMXCCGn1
    SolutionIndex: 471
    SolutionNameMin: Cijk_Ailk_Bljk_S_MX_B_Bias_HAS_SAV_UserArgs_MT256x144x16_MI16x16x1_SN_GRVWB1_GSU1_GSUC0_GSUWGMRR0_K1_LBSPPA2048_LBSPPB128_LPA0_LPB2_LRVW2_MIWT4_9_NTC0_NTD0_NLCA1_SU0_SUM0_SUS0_SVW4_VWA4_VWB1_WG64_4_1_WGM4_WGMXCC1_WGMXCCGn1
    SolutionIndex: 472
    SolutionNameMin: Cijk_Ailk_Bljk_S_MX_B_Bias_HAS_SAV_UserArgs_MT256x128x16_MI32x32x1_SN_GRVWB4_GSU1_GSUC0_GSUWGMRR0_K1_LBSPPA0_LBSPPB256_LPA0_LPB4_LRVW4_MIWT2_4_NTC3_NTD3_NLCA1_SU0_SUM0_SUS0_SVW2_VWA2_VWB4_WG128_2_1_WGM4_WGMXCC1_WGMXCCGn1
    SolutionIndex: 473
    SolutionNameMin: Cijk_Ailk_Bljk_S_MX_B_Bias_HAS_SAV_UserArgs_MT384x128x16_MI32x32x1_SN_GRVWB4_GSU1_GSUC0_GSUWGMRR0_K1_LBSPPA0_LBSPPB128_LPA0_LPB4_LRVW4_MIWT6_2_NTC0_NTD0_NLCA3_SU0_SUM0_SUS0_SVW2_VWA2_VWB2_WG64_4_1_WGM4_WGMXCC1_WGMXCCGn1
    SolutionIndex: 474
    SolutionNameMin: Cijk_Ailk_Bljk_S_MX_B_Bias_HAS_SAV_UserArgs_MT256x192x32_MI32x32x1_SN_GRVWB4_GSU1_GSUC0_GSUWGMRR0_K1_LBSPPA0_LBSPPB256_LPA0_LPB4_LRVW4_MIWT2_6_NTC0_NTD0_NLCA1_SU0_SUM0_SUS0_SVW2_VWA2_VWB2_WG128_2_1_WGM4_WGMXCC1_WGMXCCGn1
    SolutionIndex: 475
    SolutionNameMin: Cijk_Ailk_Bljk_S_MX_B_Bias_HAS_SAV_UserArgs_MT128x256x16_MI32x32x1_SN_GRVWB4_GSU1_GSUC0_GSUWGMRR0_K1_LBSPPA0_LBSPPB256_LPA0_LPB4_LRVW4_MIWT2_4_NLCA1_SU8_SUM0_SUS256_SVW2_VWA2_VWB4_WG64_4_1_WGM4_WGMXCC1_WGMXCCGn1
    SolutionIndex: 476
    SolutionNameMin: Cijk_Ailk_Bljk_S_MX_B_Bias_HAS_SAV_UserArgs_MT128x256x16_MI32x32x1_SN_GRVWB4_GSU1_GSUC0_GSUWGMRR0_K1_LBSPPA0_LBSPPB128_LPA0_LPB4_LRVW4_MIWT4_2_NLCA1_SU8_SUM0_SUS256_SVW4_VWA4_VWB2_WG32_8_1_WGM4_WGMXCC1_WGMXCCGn1
    SolutionIndex: 477
    SolutionNameMin: Cijk_Ailk_Bljk_S_MX_B_Bias_HAS_SAV_UserArgs_MT256x256x16_MI32x32x1_SN_GRVWB4_GSU1_GSUC0_GSUWGMRR0_K1_LBSPPA0_LBSPPB256_LPA0_LPB4_LRVW4_MIWT2_8_NLCA1_SU8_SUM0_SUS256_SVW2_VWA2_VWB4_WG128_2_1_WGM4_WGMXCC1_WGMXCCGn1
    SolutionIndex: 478
    SolutionNameMin: Cijk_Ailk_Bljk_S_MX_B_Bias_HAS_SAV_UserArgs_MT256x192x32_MI32x32x1_SN_GRVWB4_GSU1_GSUC0_GSUWGMRR0_K1_LBSPPA0_LBSPPB256_LPA0_LPB4_LRVW4_MIWT2_6_NLCA1_SU8_SUM0_SUS256_SVW2_VWA2_VWB2_WG128_2_1_WGM4_WGMXCC1_WGMXCCGn1
    SolutionIndex: 479
    SolutionNameMin: Cijk_Ailk_Bljk_S_MX_B_Bias_HAS_SAV_UserArgs_MT16x64x64_MI16x16x1_SN_CLR1_GRVWB4_GSU1_GSUC0_GSUWGMRR0_K1_LBSPPA256_LBSPPB256_LPB8_LRVW4_MIWT1_1_NTB4_PLR1_SU0_SUM0_SUS0_VWB1_WG16_16_1_WGM1_WGMXCC1_WGMXCCGn1
    SolutionIndex: 480
    SolutionNameMin: Cijk_Ailk_Bljk_S_MX_B_Bias_HAS_SAV_UserArgs_MT16x64x64_MI16x16x1_SN_CLR1_GRVWB4_GSU2_GSUC0_GSUWGMRR0_K1_LBSPPA256_LBSPPB256_LPB8_LRVW4_MIWT1_1_NTB4_PLR1_SU0_SUM0_SUS0_VWB1_WG16_16_1_WGM1_WGMXCC1_WGMXCCGn1
    SolutionIndex: 481
    SolutionNameMin: Cijk_Ailk_Bljk_S_MX_B_Bias_HAS_SAV_UserArgs_MT16x64x64_MI16x16x1_SN_CLR1_GRVWB4_GSU3_GSUC0_GSUWGMRR0_K1_LBSPPA256_LBSPPB256_LPB8_LRVW4_MIWT1_1_NTB4_PLR1_SU0_SUM0_SUS0_VWB1_WG16_16_1_WGM1_WGMXCC1_WGMXCCGn1
    SolutionIndex: 482
    SolutionNameMin: Cijk_Ailk_Bljk_S_MX_B_Bias_HAS_SAV_UserArgs_MT16x64x64_MI16x16x1_SN_GRVWB1_GSU2_GSUC0_GSUWGMRR0_K1_LBSPPA256_LBSPPB256_LPA16_LPB8_LRVW4_MIWT1_1_NTB4_SU0_SUM0_SUS0_SVW1_VWA1_VWB1_WG16_16_1_WGM1_WGMXCC1_WGMXCCGn1
    SolutionIndex: 483
    SolutionNameMin: Cijk_Ailk_Bljk_S_MX_B_Bias_HAS_SAV_UserArgs_MT16x128x64_MI16x16x1_SN_GRVWB4_GSU1_GSUC0_GSUWGMRR0_K1_LBSPPA256_LBSPPB512_LPA16_LPB8_LRVW4_MIWT1_2_NTB4_SU0_SUM0_SUS0_SVW1_VWA1_VWB2_WG16_16_1_WGM1_WGMXCC1_WGMXCCGn1
    SolutionIndex: 484
    SolutionNameMin: Cijk_Ailk_Bljk_S_MX_B_Bias_HAS_SAV_UserArgs_MT16x64x64_MI16x16x1_SN_GRVWB4_GSU1_GSUC0_GSUWGMRR0_K1_LBSPPA256_LBSPPB256_LPA16_LPB8_LRVW4_MIWT1_1_NTB0_SU0_SUM0_SUS0_SVW1_VWA1_VWB1_WG16_16_1_WGM1_WGMXCC1_WGMXCCGn1
    SolutionIndex: 485
    SolutionNameMin: Cijk_Ailk_Bljk_S_MX_B_Bias_HAS_SAV_UserArgs_MT32x128x64_MI32x32x1_SN_GRVWB4_GSU1_GSUC0_GSUWGMRR0_K1_LBSPPA0_LBSPPB256_LPA0_LPB4_LRVW4_MIWT1_1_NTB0_SU0_SUM0_SUS0_SVW1_VWA1_VWB1_WG32_8_1_WGM1_WGMXCC1_WGMXCCGn1
    SolutionIndex: 486
    SolutionNameMin: Cijk_Ailk_Bljk_S_MX_B_Bias_HAS_SAV_UserArgs_MT32x64x32_MI16x16x1_SN_GRVWB4_GSU1_GSUC0_GSUWGMRR0_K1_LBSPPA512_LBSPPB256_LPA16_LPB8_LRVW4_MIWT1_2_NTB4_SU0_SUM0_SUS0_SVW1_VWA1_VWB2_WG32_8_1_WGM1_WGMXCC1_WGMXCCGn1
    SolutionIndex: 487
    SolutionNameMin: Cijk_Ailk_Bljk_S_MX_B_Bias_HAS_SAV_UserArgs_MT128x416x16_MI16x16x1_SN_GRVWB1_GSU1_GSUC0_GSUWGMRR0_K1_LBSPPA1024_LBSPPB128_LPA0_LPB2_LRVW2_MIWT4_13_NTB0_NTC3_NTD3_NLCA1_SU0_SUM0_SUS0_SVW4_VWA4_VWB1_WG32_8_1_WGM1_WGMXCC1_WGMXCCGn1
    SolutionIndex: 488
    SolutionNameMin: Cijk_Ailk_Bljk_S_MX_B_Bias_HAS_SAV_UserArgs_MT128x256x32_MI32x32x1_SN_GRVWB4_GSU1_GSUC0_GSUWGMRR0_K1_LBSPPA0_LBSPPB512_LPA0_LPB4_LRVW4_MIWT2_4_NTB4_NTC3_NTD3_NLCA1_SU0_SUM0_SUS0_SVW2_VWA2_VWB4_WG64_4_1_WGM1_WGMXCC1_WGMXCCGn1
    SolutionIndex: 489
    SolutionNameMin: Cijk_Ailk_Bljk_S_MX_B_Bias_HAS_SAV_UserArgs_MT192x224x32_MI16x16x1_SN_GRVWB4_GSU1_GSUC0_GSUWGMRR0_K1_LBSPPA3072_LBSPPB128_LPA0_LPB8_LRVW4_MIWT6_7_NTB0_NTC0_NTD0_NLCA3_SU0_SUM0_SUS0_SVW2_VWA2_VWB1_WG32_8_1_WGM1_WGMXCC1_WGMXCCGn1
    SolutionIndex: 490
    SolutionNameMin: Cijk_Ailk_Bljk_S_MX_B_Bias_HAS_SAV_UserArgs_MT192x208x32_MI16x16x1_SN_GRVWB1_GSU1_GSUC0_GSUWGMRR0_K1_LBSPPA3072_LBSPPB128_LPA16_LPB8_LRVW4_MIWT3_13_NTB0_NTC0_NTD0_NLCA3_SU0_SUM0_SUS0_SVW1_VWA1_VWB1_WG64_4_1_WGM1_WGMXCC1_WGMXCCGn1
    SolutionIndex: 491
    SolutionNameMin: Cijk_Ailk_Bljk_S_MX_B_Bias_HAS_SAV_UserArgs_MT192x208x32_MI16x16x1_SN_GRVWB1_GSU1_GSUC0_GSUWGMRR0_K1_LBSPPA3072_LBSPPB128_LPA16_LPB8_LRVW4_MIWT3_13_NTB4_NTC0_NTD0_NLCA3_SU0_SUM0_SUS0_SVW1_VWA1_VWB1_WG64_4_1_WGM1_WGMXCC1_WGMXCCGn1
    SolutionIndex: 492
    SolutionNameMin: Cijk_Ailk_Bljk_S_MX_B_Bias_HAS_SAV_UserArgs_MT128x320x32_MI32x32x1_SN_GRVWB4_GSU1_GSUC0_GSUWGMRR0_K1_LBSPPA0_LBSPPB128_LPA0_LPB4_LRVW4_MIWT2_5_NTB4_NTC3_NTD3_NLCA1_SU0_SUM0_SUS0_SVW2_VWA2_VWB1_WG64_4_1_WGM1_WGMXCC1_WGMXCCGn1
    SolutionIndex: 493
    SolutionNameMin: Cijk_Ailk_Bljk_S_MX_B_Bias_HAS_SAV_UserArgs_MT128x320x32_MI32x32x1_SN_GRVWB4_GSU1_GSUC0_GSUWGMRR0_K1_LBSPPA0_LBSPPB128_LPA0_LPB4_LRVW4_MIWT2_5_NTB0_NTC3_NTD3_NLCA1_SU0_SUM0_SUS0_SVW2_VWA2_VWB1_WG64_4_1_WGM1_WGMXCC1_WGMXCCGn1
    SolutionIndex: 494
    SolutionNameMin: Cijk_Ailk_Bljk_S_MX_B_Bias_HAS_SAV_UserArgs_MT192x320x16_MI16x16x1_SN_GRVWB4_GSU1_GSUC0_GSUWGMRR0_K1_LBSPPA1536_LBSPPB128_LPA0_LPB4_LRVW2_MIWT6_10_NTB0_NTC3_NTD3_NLCA3_SU0_SUM0_SUS0_SVW2_VWA2_VWB2_WG32_8_1_WGM1_WGMXCC1_WGMXCCGn1
    SolutionIndex: 495
    SolutionNameMin: Cijk_Ailk_Bljk_S_MX_B_Bias_HAS_SAV_UserArgs_MT192x320x16_MI32x32x1_SN_GRVWB4_GSU1_GSUC0_GSUWGMRR0_K1_LBSPPA0_LBSPPB128_LPA0_LPB4_LRVW4_MIWT3_5_NTB0_NTC3_NTD3_NLCA3_SU0_SUM0_SUS0_SVW1_VWA1_VWB1_WG64_4_1_WGM1_WGMXCC1_WGMXCCGn1
    SolutionIndex: 496
    SolutionNameMin: Cijk_Ailk_Bljk_S_MX_B_Bias_HAS_SAV_UserArgs_MT128x288x16_MI16x16x1_SN_GRVWB1_GSU1_GSUC0_GSUWGMRR0_K1_LBSPPA1024_LBSPPB128_LPA0_LPB2_LRVW2_MIWT4_9_NTB0_NTC3_NTD3_NLCA1_SU0_SUM0_SUS0_SVW4_VWA4_VWB1_WG32_8_1_WGM1_WGMXCC1_WGMXCCGn1
    SolutionIndex: 497
    SolutionNameMin: Cijk_Ailk_Bljk_S_MX_B_Bias_HAS_SAV_UserArgs_MT192x192x16_MI32x32x1_SN_GRVWB4_GSU1_GSUC0_GSUWGMRR0_K1_LBSPPA0_LBSPPB128_LPA0_LPB4_LRVW4_MIWT3_3_NTB0_NTC3_NTD3_NLCA3_SU0_SUM0_SUS0_SVW1_VWA1_VWB1_WG64_4_1_WGM1_WGMXCC1_WGMXCCGn1
    SolutionIndex: 498
    SolutionNameMin: Cijk_Ailk_Bljk_S_MX_B_Bias_HAS_SAV_UserArgs_MT192x288x16_MI16x16x1_SN_GRVWB1_GSU1_GSUC0_GSUWGMRR0_K1_LBSPPA1536_LBSPPB128_LPA0_LPB2_LRVW2_MIWT6_9_NTB0_NTC3_NTD3_NLCA3_SU0_SUM0_SUS0_SVW2_VWA2_VWB1_WG32_8_1_WGM1_WGMXCC1_WGMXCCGn1
    SolutionIndex: 499
    SolutionNameMin: Cijk_Ailk_Bljk_S_MX_B_Bias_HAS_SAV_UserArgs_MT192x256x32_MI32x32x1_SN_GRVWB4_GSU1_GSUC0_GSUWGMRR0_K1_LBSPPA0_LBSPPB256_LPA0_LPB4_LRVW4_MIWT6_2_NTB0_NTC3_NTD3_NLCA3_SU0_SUM0_SUS0_SVW2_VWA2_VWB2_WG32_8_1_WGM1_WGMXCC1_WGMXCCGn1
    SolutionIndex: 500
    SolutionNameMin: Cijk_Ailk_Bljk_S_MX_B_Bias_HAS_SAV_UserArgs_MT192x256x32_MI32x32x1_SN_GRVWB4_GSU1_GSUC0_GSUWGMRR0_K1_LBSPPA0_LBSPPB256_LPA0_LPB4_LRVW4_MIWT6_2_NTB0_NTC0_NTD0_NLCA3_SU0_SUM0_SUS0_SVW2_VWA2_VWB2_WG32_8_1_WGM1_WGMXCC1_WGMXCCGn1
    SolutionIndex: 501
    SolutionNameMin: Cijk_Ailk_Bljk_S_MX_B_Bias_HAS_SAV_UserArgs_MT192x256x32_MI32x32x1_SN_GRVWB4_GSU1_GSUC0_GSUWGMRR0_K1_LBSPPA0_LBSPPB512_LPA0_LPB4_LRVW4_MIWT3_4_NTB4_NTC0_NTD0_NLCA3_SU0_SUM0_SUS0_SVW1_VWA1_VWB4_WG64_4_1_WGM1_WGMXCC1_WGMXCCGn1
    SolutionIndex: 502
    SolutionNameMin: Cijk_Ailk_Bljk_S_MX_B_Bias_HAS_SAV_UserArgs_MT192x192x16_MI16x16x1_SN_GRVWB4_GSU1_GSUC0_GSUWGMRR0_K1_LBSPPA1536_LBSPPB128_LPA0_LPB4_LRVW2_MIWT6_6_NTB0_NTC3_NTD3_NLCA3_SU0_SUM0_SUS0_SVW2_VWA2_VWB2_WG32_8_1_WGM1_WGMXCC1_WGMXCCGn1
    SolutionIndex: 503
    SolutionNameMin: Cijk_Ailk_Bljk_S_MX_B_Bias_HAS_SAV_UserArgs_MT192x192x32_MI32x32x1_SN_GRVWB4_GSU1_GSUC0_GSUWGMRR0_K1_LBSPPA0_LBSPPB128_LPA0_LPB4_LRVW4_MIWT3_3_NTB4_NTC0_NTD0_NLCA3_SU0_SUM0_SUS0_SVW1_VWA1_VWB1_WG64_4_1_WGM1_WGMXCC1_WGMXCCGn1
    SolutionIndex: 504
    SolutionNameMin: Cijk_Ailk_Bljk_S_MX_B_Bias_HAS_SAV_UserArgs_MT256x208x16_MI16x16x1_SN_GRVWB1_GSU1_GSUC0_GSUWGMRR0_K1_LBSPPA2048_LBSPPB128_LPA0_LPB2_LRVW2_MIWT4_13_NTB0_NTC3_NTD3_NLCA1_SU0_SUM0_SUS0_SVW4_VWA4_VWB1_WG64_4_1_WGM1_WGMXCC1_WGMXCCGn1
    SolutionIndex: 505
    SolutionNameMin: Cijk_Ailk_Bljk_S_MX_B_Bias_HAS_SAV_UserArgs_MT256x224x32_MI32x32x1_SN_GRVWB4_GSU1_GSUC0_GSUWGMRR0_K1_LBSPPA0_LBSPPB128_LPA0_LPB4_LRVW4_MIWT2_7_NTB0_NTC0_NTD0_NLCA1_SU0_SUM0_SUS0_SVW2_VWA2_VWB1_WG128_2_1_WGM1_WGMXCC1_WGMXCCGn1
    SolutionIndex: 506
    SolutionNameMin: Cijk_Ailk_Bljk_S_MX_B_Bias_HAS_SAV_UserArgs_MT256x224x32_MI32x32x1_SN_GRVWB4_GSU1_GSUC0_GSUWGMRR0_K1_LBSPPA0_LBSPPB128_LPA0_LPB4_LRVW4_MIWT2_7_NTB0_NTC3_NTD3_NLCA1_SU0_SUM0_SUS0_SVW2_VWA2_VWB1_WG128_2_1_WGM1_WGMXCC1_WGMXCCGn1
    SolutionIndex: 507
    SolutionNameMin: Cijk_Ailk_Bljk_S_MX_B_Bias_HAS_SAV_UserArgs_MT384x144x16_MI16x16x1_SN_GRVWB1_GSU1_GSUC0_GSUWGMRR0_K1_LBSPPA3072_LBSPPB128_LPA0_LPB2_LRVW2_MIWT6_9_NTB0_NTC0_NTD0_NLCA3_SU0_SUM0_SUS0_SVW2_VWA2_VWB1_WG64_4_1_WGM1_WGMXCC1_WGMXCCGn1
    SolutionIndex: 508
    SolutionNameMin: Cijk_Ailk_Bljk_S_MX_B_Bias_HAS_SAV_UserArgs_MT384x128x16_MI32x32x1_SN_GRVWB4_GSU1_GSUC0_GSUWGMRR0_K1_LBSPPA0_LBSPPB128_LPA0_LPB4_LRVW4_MIWT6_2_NTB0_NTC3_NTD3_NLCA3_SU0_SUM0_SUS0_SVW2_VWA2_VWB2_WG64_4_1_WGM1_WGMXCC1_WGMXCCGn1
    SolutionIndex: 509
    SolutionNameMin: Cijk_Ailk_Bljk_S_MX_B_Bias_HAS_SAV_UserArgs_MT384x128x16_MI32x32x1_SN_GRVWB4_GSU1_GSUC0_GSUWGMRR0_K1_LBSPPA0_LBSPPB128_LPA0_LPB4_LRVW4_MIWT6_2_NTB0_NTC0_NTD0_NLCA3_SU0_SUM0_SUS0_SVW2_VWA2_VWB2_WG64_4_1_WGM1_WGMXCC1_WGMXCCGn1
    SolutionIndex: 510
    SolutionNameMin: Cijk_Ailk_Bljk_S_MX_B_Bias_HAS_SAV_UserArgs_MT384x128x16_MI32x32x1_SN_GRVWB4_GSU1_GSUC0_GSUWGMRR0_K1_LBSPPA0_LBSPPB128_LPA0_LPB4_LRVW4_MIWT6_2_NTB4_NTC0_NTD0_NLCA3_SU0_SUM0_SUS0_SVW2_VWA2_VWB2_WG64_4_1_WGM1_WGMXCC1_WGMXCCGn1
    SolutionIndex: 511
    SolutionNameMin: Cijk_Ailk_Bljk_S_MX_B_Bias_HAS_SAV_UserArgs_MT256x256x16_MI32x32x1_SN_GRVWB4_GSU1_GSUC0_GSUWGMRR0_K1_LBSPPA0_LBSPPB256_LPA0_LPB4_LRVW4_MIWT2_8_NTB0_NTC0_NTD0_NLCA1_SU0_SUM0_SUS0_SVW2_VWA2_VWB4_WG128_2_1_WGM1_WGMXCC1_WGMXCCGn1
    SolutionIndex: 512
    SolutionNameMin: Cijk_Ailk_Bljk_S_MX_B_Bias_HAS_SAV_UserArgs_MT256x240x16_MI16x16x1_SN_GRVWB1_GSU1_GSUC0_GSUWGMRR0_K1_LBSPPA2048_LBSPPB128_LPA0_LPB2_LRVW2_MIWT4_15_NTB0_NTC0_NTD0_NLCA1_SU0_SUM0_SUS0_SVW4_VWA4_VWB1_WG64_4_1_WGM1_WGMXCC1_WGMXCCGn1
    SolutionIndex: 513
    SolutionNameMin: Cijk_Ailk_Bljk_S_MX_B_Bias_HAS_SAV_UserArgs_MT256x192x32_MI32x32x1_SN_GRVWB4_GSU1_GSUC0_GSUWGMRR0_K1_LBSPPA0_LBSPPB256_LPA0_LPB4_LRVW4_MIWT2_6_NTB0_NTC0_NTD0_NLCA1_SU0_SUM0_SUS0_SVW2_VWA2_VWB2_WG128_2_1_WGM1_WGMXCC1_WGMXCCGn1
    SolutionIndex: 514
    SolutionNameMin: Cijk_Ailk_Bljk_S_MX_B_Bias_HAS_SAV_UserArgs_MT256x208x32_MI16x16x1_SN_GRVWB1_GSU1_GSUC0_GSUWGMRR0_K1_LBSPPA2048_LBSPPB128_LPA0_LPB2_LRVW2_MIWT4_13_NLCA1_SU8_SUM0_SUS256_SVW4_VWA4_VWB1_WG64_4_1_WGM4_WGMXCC1_WGMXCCGn1
    SolutionIndex: 515
    SolutionNameMin: Cijk_Ailk_Bljk_S_MX_B_Bias_HAS_SAV_UserArgs_MT128x256x16_MI16x16x1_SN_GRVWB1_GSU1_GSUC0_GSUWGMRR0_K1_LBSPPA1024_LBSPPB256_LPA0_LPB2_LRVW2_MIWT4_8_NLCA1_SU8_SUM0_SUS256_SVW4_VWA4_VWB4_WG32_8_1_WGM4_WGMXCC1_WGMXCCGn1
    SolutionIndex: 516
    SolutionNameMin: Cijk_Ailk_Bljk_S_MX_B_Bias_HAS_SAV_UserArgs_MT128x256x16_MI32x32x1_SN_GRVWB4_GSU1_GSUC0_GSUWGMRR0_K1_LBSPPA0_LBSPPB256_LPA0_LPB4_LRVW4_MIWT1_8_NLCA1_SU8_SUM0_SUS256_SVW1_VWA1_VWB4_WG128_2_1_WGM4_WGMXCC1_WGMXCCGn1
    SolutionIndex: 517
    SolutionNameMin: Cijk_Ailk_Bljk_S_MX_B_Bias_HAS_SAV_UserArgs_MT128x256x32_MI32x32x1_SN_GRVWB4_GSU1_GSUC0_GSUWGMRR0_K1_LBSPPA0_LBSPPB512_LPA0_LPB4_LRVW4_MIWT2_4_NLCA1_SU8_SUM0_SUS256_SVW2_VWA2_VWB4_WG64_4_1_WGM4_WGMXCC1_WGMXCCGn1
    SolutionIndex: 518
    SolutionNameMin: Cijk_Ailk_Bljk_S_MX_B_Bias_HAS_SAV_UserArgs_MT128x192x16_MI16x16x1_SN_GRVWB4_GSU1_GSUC0_GSUWGMRR0_K1_LBSPPA1024_LBSPPB128_LPA0_LPB4_LRVW2_MIWT4_6_NLCA1_SU8_SUM0_SUS256_SVW4_VWA4_VWB2_WG32_8_1_WGM4_WGMXCC1_WGMXCCGn1
    SolutionIndex: 519
    SolutionNameMin: Cijk_Ailk_Bljk_S_MX_B_Bias_HAS_SAV_UserArgs_MT128x256x16_MI16x16x1_SN_GRVWB4_GSU1_GSUC0_GSUWGMRR0_K1_LBSPPA1024_LBSPPB256_LPA0_LPB4_LRVW2_MIWT4_8_NLCA1_SU8_SUM0_SUS256_SVW4_VWA4_VWB4_WG32_8_1_WGM4_WGMXCC1_WGMXCCGn1
    SolutionIndex: 520
    SolutionNameMin: Cijk_Ailk_Bljk_S_MX_B_Bias_HAS_SAV_UserArgs_MT160x256x32_MI32x32x1_SN_GRVWB4_GSU1_GSUC0_GSUWGMRR0_K1_LBSPPA0_LBSPPB256_LPA0_LPB4_LRVW4_MIWT5_2_NLCA5_SU8_SUM0_SUS256_SVW1_VWA1_VWB2_WG32_8_1_WGM4_WGMXCC1_WGMXCCGn1
    SolutionIndex: 521
    SolutionNameMin: Cijk_Ailk_Bljk_S_MX_B_Bias_HAS_SAV_UserArgs_MT320x192x16_MI16x16x1_SN_GRVWB1_GSU1_GSUC0_GSUWGMRR0_K1_LBSPPA2560_LBSPPB128_LPA0_LPB2_LRVW2_MIWT10_6_NLCA5_SU8_SUM0_SUS256_SVW2_VWA2_VWB2_WG32_8_1_WGM4_WGMXCC1_WGMXCCGn1
    SolutionIndex: 522
    SolutionNameMin: Cijk_Ailk_Bljk_S_MX_B_Bias_HAS_SAV_UserArgs_MT192x192x16_MI32x32x1_SN_GRVWB1_GSU1_GSUC0_GSUWGMRR0_K1_LBSPPA0_LBSPPB128_LPA0_LPB4_LRVW4_MIWT3_3_NLCA3_SU8_SUM0_SUS256_SVW1_VWA1_VWB1_WG64_4_1_WGM4_WGMXCC1_WGMXCCGn1
- - - [3, 16, 1, 1024]
    - [0, 0.0]
  - - [3, 16, 1, 4096]
    - [1, 0.0]
  - - [3, 16, 1, 16384]
    - [2, 0.0]
  - - [16, 16, 1, 1024]
    - [3, 0.0]
  - - [16, 16, 1, 4096]
    - [3, 0.0]
  - - [16, 16, 1, 16384]
    - [4, 0.0]
  - - [32, 16, 1, 1024]
    - [5, 0.0]
  - - [32, 16, 1, 4096]
    - [6, 0.0]
  - - [32, 16, 1, 16384]
    - [4, 0.0]
  - - [64, 16, 1, 1024]
    - [7, 0.0]
  - - [64, 16, 1, 4096]
    - [8, 0.0]
  - - [64, 16, 1, 16384]
    - [9, 0.0]
  - - [96, 16, 1, 1024]
    - [10, 0.0]
  - - [96, 16, 1, 4096]
    - [11, 0.0]
  - - [96, 16, 1, 16384]
    - [11, 0.0]
  - - [128, 16, 1, 1024]
    - [12, 0.0]
  - - [128, 16, 1, 4096]
    - [13, 0.0]
  - - [128, 16, 1, 16384]
    - [14, 0.0]
  - - [192, 16, 1, 1024]
    - [15, 0.0]
  - - [192, 16, 1, 4096]
    - [16, 0.0]
  - - [192, 16, 1, 16384]
    - [17, 0.0]
  - - [256, 16, 1, 1024]
    - [18, 0.0]
  - - [256, 16, 1, 4096]
    - [19, 0.0]
  - - [256, 16, 1, 16384]
    - [12, 0.0]
  - - [384, 16, 1, 1024]
    - [20, 0.0]
  - - [384, 16, 1, 4096]
    - [21, 0.0]
  - - [384, 16, 1, 16384]
    - [22, 0.0]
  - - [512, 16, 1, 1024]
    - [23, 0.0]
  - - [512, 16, 1, 4096]
    - [23, 0.0]
  - - [512, 16, 1, 16384]
    - [24, 0.0]
  - - [640, 16, 1, 1024]
    - [25, 0.0]
  - - [640, 16, 1, 4096]
    - [26, 0.0]
  - - [640, 16, 1, 16384]
    - [26, 0.0]
  - - [768, 16, 1, 1024]
    - [27, 0.0]
  - - [768, 16, 1, 4096]
    - [27, 0.0]
  - - [768, 16, 1, 16384]
    - [27, 0.0]
  - - [1024, 16, 1, 1024]
    - [28, 0.0]
  - - [1024, 16, 1, 4096]
    - [28, 0.0]
  - - [1024, 16, 1, 16384]
    - [29, 0.0]
  - - [1536, 16, 1, 1024]
    - [30, 0.0]
  - - [1536, 16, 1, 4096]
    - [31, 0.0]
  - - [1536, 16, 1, 16384]
    - [31, 0.0]
  - - [2048, 16, 1, 1024]
    - [32, 0.0]
  - - [2048, 16, 1, 4096]
    - [33, 0.0]
  - - [2048, 16, 1, 16384]
    - [34, 0.0]
  - - [3072, 16, 1, 1024]
    - [35, 0.0]
  - - [3072, 16, 1, 4096]
    - [35, 0.0]
  - - [3072, 16, 1, 16384]
    - [36, 0.0]
  - - [8192, 16, 1, 1024]
    - [37, 0.0]
  - - [8192, 16, 1, 4096]
    - [38, 0.0]
  - - [8192, 16, 1, 16384]
    - [38, 0.0]
  - - [12288, 16, 1, 1024]
    - [39, 0.0]
  - - [12288, 16, 1, 4096]
    - [40, 0.0]
  - - [12288, 16, 1, 16384]
    - [41, 0.0]
  - - [16384, 16, 1, 1024]
    - [42, 0.0]
  - - [16384, 16, 1, 4096]
    - [42, 0.0]
  - - [16384, 16, 1, 16384]
    - [43, 0.0]
  - - [20480, 16, 1, 1024]
    - [44, 0.0]
  - - [20480, 16, 1, 4096]
    - [45, 0.0]
  - - [20480, 16, 1, 16384]
    - [45, 0.0]
  - - [24576, 16, 1, 1024]
    - [46, 0.0]
  - - [24576, 16, 1, 4096]
    - [42, 0.0]
  - - [24576, 16, 1, 16384]
    - [47, 0.0]
  - - [32768, 16, 1, 1024]
    - [42, 0.0]
  - - [32768, 16, 1, 4096]
    - [42, 0.0]
  - - [32768, 16, 1, 16384]
    - [47, 0.0]
  - - [3, 32, 1, 1024]
    - [48, 0.0]
  - - [3, 32, 1, 4096]
    - [49, 0.0]
  - - [3, 32, 1, 16384]
    - [50, 0.0]
  - - [16, 32, 1, 1024]
    - [51, 0.0]
  - - [16, 32, 1, 4096]
    - [51, 0.0]
  - - [16, 32, 1, 16384]
    - [52, 0.0]
  - - [32, 32, 1, 1024]
    - [53, 0.0]
  - - [32, 32, 1, 4096]
    - [54, 0.0]
  - - [32, 32, 1, 16384]
    - [55, 0.0]
  - - [64, 32, 1, 1024]
    - [56, 0.0]
  - - [64, 32, 1, 4096]
    - [57, 0.0]
  - - [64, 32, 1, 16384]
    - [58, 0.0]
  - - [96, 32, 1, 1024]
    - [56, 0.0]
  - - [96, 32, 1, 4096]
    - [59, 0.0]
  - - [96, 32, 1, 16384]
    - [60, 0.0]
  - - [128, 32, 1, 1024]
    - [61, 0.0]
  - - [128, 32, 1, 4096]
    - [62, 0.0]
  - - [128, 32, 1, 16384]
    - [63, 0.0]
  - - [192, 32, 1, 1024]
    - [64, 0.0]
  - - [192, 32, 1, 4096]
    - [65, 0.0]
  - - [192, 32, 1, 16384]
    - [65, 0.0]
  - - [256, 32, 1, 1024]
    - [66, 0.0]
  - - [256, 32, 1, 4096]
    - [67, 0.0]
  - - [256, 32, 1, 16384]
    - [67, 0.0]
  - - [384, 32, 1, 1024]
    - [68, 0.0]
  - - [384, 32, 1, 4096]
    - [69, 0.0]
  - - [384, 32, 1, 16384]
    - [70, 0.0]
  - - [512, 32, 1, 1024]
    - [71, 0.0]
  - - [512, 32, 1, 4096]
    - [72, 0.0]
  - - [512, 32, 1, 16384]
    - [72, 0.0]
  - - [640, 32, 1, 1024]
    - [71, 0.0]
  - - [640, 32, 1, 4096]
    - [71, 0.0]
  - - [640, 32, 1, 16384]
    - [73, 0.0]
  - - [768, 32, 1, 1024]
    - [74, 0.0]
  - - [768, 32, 1, 4096]
    - [75, 0.0]
  - - [768, 32, 1, 16384]
    - [75, 0.0]
  - - [2048, 32, 1, 1024]
    - [76, 0.0]
  - - [2048, 32, 1, 4096]
    - [77, 0.0]
  - - [2048, 32, 1, 16384]
    - [77, 0.0]
  - - [3072, 32, 1, 1024]
    - [78, 0.0]
  - - [3072, 32, 1, 4096]
    - [79, 0.0]
  - - [3072, 32, 1, 16384]
    - [79, 0.0]
  - - [4096, 32, 1, 1024]
    - [80, 0.0]
  - - [4096, 32, 1, 4096]
    - [81, 0.0]
  - - [4096, 32, 1, 16384]
    - [82, 0.0]
  - - [6144, 32, 1, 1024]
    - [83, 0.0]
  - - [6144, 32, 1, 4096]
    - [83, 0.0]
  - - [6144, 32, 1, 16384]
    - [84, 0.0]
  - - [8192, 32, 1, 1024]
    - [85, 0.0]
  - - [8192, 32, 1, 4096]
    - [86, 0.0]
  - - [8192, 32, 1, 16384]
    - [87, 0.0]
  - - [12288, 32, 1, 1024]
    - [88, 0.0]
  - - [12288, 32, 1, 4096]
    - [89, 0.0]
  - - [12288, 32, 1, 16384]
    - [90, 0.0]
  - - [16384, 32, 1, 1024]
    - [91, 0.0]
  - - [16384, 32, 1, 4096]
    - [92, 0.0]
  - - [16384, 32, 1, 16384]
    - [93, 0.0]
  - - [20480, 32, 1, 1024]
    - [94, 0.0]
  - - [20480, 32, 1, 4096]
    - [89, 0.0]
  - - [20480, 32, 1, 16384]
    - [95, 0.0]
  - - [24576, 32, 1, 1024]
    - [91, 0.0]
  - - [24576, 32, 1, 4096]
    - [92, 0.0]
  - - [24576, 32, 1, 16384]
    - [90, 0.0]
  - - [32768, 32, 1, 256]
    - [94, 0.0]
  - - [32768, 32, 1, 1024]
    - [94, 0.0]
  - - [32768, 32, 1, 4096]
    - [92, 0.0]
  - - [3, 64, 1, 1024]
    - [48, 0.0]
  - - [3, 64, 1, 4096]
    - [96, 0.0]
  - - [3, 64, 1, 16384]
    - [97, 0.0]
  - - [16, 64, 1, 1024]
    - [98, 0.0]
  - - [16, 64, 1, 4096]
    - [98, 0.0]
  - - [16, 64, 1, 16384]
    - [99, 0.0]
  - - [32, 64, 1, 1024]
    - [100, 0.0]
  - - [32, 64, 1, 4096]
    - [101, 0.0]
  - - [32, 64, 1, 16384]
    - [102, 0.0]
  - - [64, 64, 1, 1024]
    - [103, 0.0]
  - - [64, 64, 1, 4096]
    - [104, 0.0]
  - - [64, 64, 1, 16384]
    - [105, 0.0]
  - - [96, 64, 1, 1024]
    - [64, 0.0]
  - - [96, 64, 1, 4096]
    - [106, 0.0]
  - - [96, 64, 1, 16384]
    - [107, 0.0]
  - - [128, 64, 1, 1024]
    - [66, 0.0]
  - - [128, 64, 1, 4096]
    - [108, 0.0]
  - - [128, 64, 1, 16384]
    - [109, 0.0]
  - - [192, 64, 1, 1024]
    - [110, 0.0]
  - - [192, 64, 1, 4096]
    - [111, 0.0]
  - - [192, 64, 1, 16384]
    - [111, 0.0]
  - - [512, 64, 1, 1024]
    - [112, 0.0]
  - - [512, 64, 1, 4096]
    - [113, 0.0]
  - - [512, 64, 1, 16384]
    - [113, 0.0]
  - - [640, 64, 1, 1024]
    - [114, 0.0]
  - - [640, 64, 1, 4096]
    - [115, 0.0]
  - - [640, 64, 1, 16384]
    - [116, 0.0]
  - - [768, 64, 1, 1024]
    - [117, 0.0]
  - - [768, 64, 1, 4096]
    - [118, 0.0]
  - - [768, 64, 1, 16384]
    - [118, 0.0]
  - - [1024, 64, 1, 1024]
    - [119, 0.0]
  - - [1024, 64, 1, 4096]
    - [120, 0.0]
  - - [1024, 64, 1, 16384]
    - [120, 0.0]
  - - [1536, 64, 1, 1024]
    - [121, 0.0]
  - - [1536, 64, 1, 4096]
    - [122, 0.0]
  - - [1536, 64, 1, 16384]
    - [122, 0.0]
  - - [2048, 64, 1, 1024]
    - [123, 0.0]
  - - [2048, 64, 1, 4096]
    - [124, 0.0]
  - - [2048, 64, 1, 16384]
    - [120, 0.0]
  - - [3072, 64, 1, 1024]
    - [125, 0.0]
  - - [3072, 64, 1, 4096]
    - [126, 0.0]
  - - [3072, 64, 1, 16384]
    - [122, 0.0]
  - - [4096, 64, 1, 1024]
    - [127, 0.0]
  - - [4096, 64, 1, 4096]
    - [128, 0.0]
  - - [4096, 64, 1, 16384]
    - [129, 0.0]
  - - [6144, 64, 1, 1024]
    - [130, 0.0]
  - - [6144, 64, 1, 4096]
    - [130, 0.0]
  - - [6144, 64, 1, 16384]
    - [131, 0.0]
  - - [8192, 64, 1, 1024]
    - [132, 0.0]
  - - [8192, 64, 1, 4096]
    - [132, 0.0]
  - - [8192, 64, 1, 16384]
    - [132, 0.0]
  - - [12288, 64, 1, 1024]
    - [133, 0.0]
  - - [12288, 64, 1, 4096]
    - [130, 0.0]
  - - [12288, 64, 1, 16384]
    - [134, 0.0]
  - - [16384, 64, 1, 256]
    - [133, 0.0]
  - - [16384, 64, 1, 1024]
    - [132, 0.0]
  - - [16384, 64, 1, 4096]
    - [132, 0.0]
  - - [20480, 64, 1, 256]
    - [135, 0.0]
  - - [20480, 64, 1, 1024]
    - [135, 0.0]
  - - [20480, 64, 1, 4096]
    - [127, 0.0]
  - - [24576, 64, 1, 256]
    - [133, 0.0]
  - - [24576, 64, 1, 1024]
    - [133, 0.0]
  - - [24576, 64, 1, 4096]
    - [133, 0.0]
  - - [32768, 64, 1, 256]
    - [135, 0.0]
  - - [32768, 64, 1, 1024]
    - [136, 0.0]
  - - [32768, 64, 1, 4096]
    - [137, 0.0]
  - - [3, 96, 1, 1024]
    - [138, 0.0]
  - - [3, 96, 1, 4096]
    - [139, 0.0]
  - - [3, 96, 1, 16384]
    - [140, 0.0]
  - - [16, 96, 1, 1024]
    - [100, 0.0]
  - - [16, 96, 1, 4096]
    - [141, 0.0]
  - - [16, 96, 1, 16384]
    - [141, 0.0]
  - - [32, 96, 1, 1024]
    - [100, 0.0]
  - - [32, 96, 1, 4096]
    - [142, 0.0]
  - - [32, 96, 1, 16384]
    - [143, 0.0]
  - - [128, 96, 1, 1024]
    - [144, 0.0]
  - - [128, 96, 1, 4096]
    - [145, 0.0]
  - - [128, 96, 1, 16384]
    - [146, 0.0]
  - - [192, 96, 1, 1024]
    - [147, 0.0]
  - - [192, 96, 1, 4096]
    - [148, 0.0]
  - - [192, 96, 1, 16384]
    - [148, 0.0]
  - - [256, 96, 1, 1024]
    - [149, 0.0]
  - - [256, 96, 1, 4096]
    - [150, 0.0]
  - - [256, 96, 1, 16384]
    - [151, 0.0]
  - - [384, 96, 1, 1024]
    - [152, 0.0]
  - - [384, 96, 1, 4096]
    - [153, 0.0]
  - - [384, 96, 1, 16384]
    - [154, 0.0]
  - - [512, 96, 1, 1024]
    - [155, 0.0]
  - - [512, 96, 1, 4096]
    - [156, 0.0]
  - - [512, 96, 1, 16384]
    - [156, 0.0]
  - - [640, 96, 1, 1024]
    - [157, 0.0]
  - - [640, 96, 1, 4096]
    - [158, 0.0]
  - - [640, 96, 1, 16384]
    - [158, 0.0]
  - - [768, 96, 1, 1024]
    - [159, 0.0]
  - - [768, 96, 1, 4096]
    - [160, 0.0]
  - - [768, 96, 1, 16384]
    - [160, 0.0]
  - - [1024, 96, 1, 1024]
    - [161, 0.0]
  - - [1024, 96, 1, 4096]
    - [162, 0.0]
  - - [1024, 96, 1, 16384]
    - [162, 0.0]
  - - [1536, 96, 1, 1024]
    - [163, 0.0]
  - - [1536, 96, 1, 4096]
    - [164, 0.0]
  - - [1536, 96, 1, 16384]
    - [164, 0.0]
  - - [2048, 96, 1, 1024]
    - [165, 0.0]
  - - [2048, 96, 1, 4096]
    - [166, 0.0]
  - - [2048, 96, 1, 16384]
    - [166, 0.0]
  - - [3072, 96, 1, 1024]
    - [167, 0.0]
  - - [3072, 96, 1, 4096]
    - [168, 0.0]
  - - [3072, 96, 1, 16384]
    - [168, 0.0]
  - - [4096, 96, 1, 1024]
    - [169, 0.0]
  - - [4096, 96, 1, 4096]
    - [169, 0.0]
  - - [4096, 96, 1, 16384]
    - [170, 0.0]
  - - [6144, 96, 1, 1024]
    - [171, 0.0]
  - - [6144, 96, 1, 4096]
    - [172, 0.0]
  - - [6144, 96, 1, 16384]
    - [173, 0.0]
  - - [8192, 96, 1, 1024]
    - [174, 0.0]
  - - [8192, 96, 1, 4096]
    - [174, 0.0]
  - - [8192, 96, 1, 16384]
    - [175, 0.0]
  - - [12288, 96, 1, 256]
    - [176, 0.0]
  - - [12288, 96, 1, 1024]
    - [176, 0.0]
  - - [12288, 96, 1, 4096]
    - [177, 0.0]
  - - [16384, 96, 1, 256]
    - [176, 0.0]
  - - [16384, 96, 1, 1024]
    - [178, 0.0]
  - - [16384, 96, 1, 4096]
    - [174, 0.0]
  - - [20480, 96, 1, 256]
    - [179, 0.0]
  - - [20480, 96, 1, 1024]
    - [180, 0.0]
  - - [20480, 96, 1, 4096]
    - [169, 0.0]
  - - [24576, 96, 1, 256]
    - [181, 0.0]
  - - [24576, 96, 1, 1024]
    - [180, 0.0]
  - - [24576, 96, 1, 4096]
    - [169, 0.0]
  - - [32768, 96, 1, 256]
    - [182, 0.0]
  - - [32768, 96, 1, 1024]
    - [182, 0.0]
  - - [32768, 96, 1, 4096]
    - [183, 0.0]
  - - [16, 128, 1, 1024]
    - [100, 0.0]
  - - [16, 128, 1, 4096]
    - [184, 0.0]
  - - [16, 128, 1, 16384]
    - [184, 0.0]
  - - [32, 128, 1, 1024]
    - [100, 0.0]
  - - [32, 128, 1, 4096]
    - [185, 0.0]
  - - [32, 128, 1, 16384]
    - [186, 0.0]
  - - [64, 128, 1, 1024]
    - [66, 0.0]
  - - [64, 128, 1, 4096]
    - [187, 0.0]
  - - [64, 128, 1, 16384]
    - [188, 0.0]
  - - [96, 128, 1, 1024]
    - [189, 0.0]
  - - [96, 128, 1, 4096]
    - [190, 0.0]
  - - [96, 128, 1, 16384]
    - [191, 0.0]
  - - [128, 128, 1, 1024]
    - [192, 0.0]
  - - [128, 128, 1, 4096]
    - [193, 0.0]
  - - [128, 128, 1, 16384]
    - [194, 0.0]
  - - [192, 128, 1, 1024]
    - [195, 0.0]
  - - [192, 128, 1, 4096]
    - [196, 0.0]
  - - [192, 128, 1, 16384]
    - [197, 0.0]
  - - [256, 128, 1, 1024]
    - [198, 0.0]
  - - [256, 128, 1, 4096]
    - [199, 0.0]
  - - [256, 128, 1, 16384]
    - [200, 0.0]
  - - [384, 128, 1, 1024]
    - [201, 0.0]
  - - [384, 128, 1, 4096]
    - [202, 0.0]
  - - [384, 128, 1, 16384]
    - [202, 0.0]
  - - [512, 128, 1, 1024]
    - [203, 0.0]
  - - [512, 128, 1, 4096]
    - [203, 0.0]
  - - [512, 128, 1, 16384]
    - [204, 0.0]
  - - [640, 128, 1, 1024]
    - [119, 0.0]
  - - [640, 128, 1, 4096]
    - [205, 0.0]
  - - [640, 128, 1, 16384]
    - [205, 0.0]
  - - [768, 128, 1, 1024]
    - [206, 0.0]
  - - [768, 128, 1, 4096]
    - [207, 0.0]
  - - [768, 128, 1, 16384]
    - [208, 0.0]
  - - [1024, 128, 1, 1024]
    - [123, 0.0]
  - - [1024, 128, 1, 4096]
    - [209, 0.0]
  - - [1024, 128, 1, 16384]
    - [209, 0.0]
  - - [1536, 128, 1, 1024]
    - [210, 0.0]
  - - [1536, 128, 1, 4096]
    - [211, 0.0]
  - - [1536, 128, 1, 16384]
    - [211, 0.0]
  - - [2048, 128, 1, 1024]
    - [212, 0.0]
  - - [2048, 128, 1, 4096]
    - [213, 0.0]
  - - [2048, 128, 1, 16384]
    - [214, 0.0]
  - - [3072, 128, 1, 1024]
    - [215, 0.0]
  - - [3072, 128, 1, 4096]
    - [216, 0.0]
  - - [3072, 128, 1, 16384]
    - [217, 0.0]
  - - [8192, 128, 1, 256]
    - [218, 0.0]
  - - [8192, 128, 1, 1024]
    - [219, 0.0]
  - - [8192, 128, 1, 4096]
    - [220, 0.0]
  - - [12288, 128, 1, 256]
    - [221, 0.0]
  - - [12288, 128, 1, 1024]
    - [221, 0.0]
  - - [12288, 128, 1, 4096]
    - [222, 0.0]
  - - [16384, 128, 1, 256]
    - [223, 0.0]
  - - [16384, 128, 1, 1024]
    - [219, 0.0]
  - - [16384, 128, 1, 4096]
    - [220, 0.0]
  - - [20480, 128, 1, 256]
    - [223, 0.0]
  - - [20480, 128, 1, 1024]
    - [224, 0.0]
  - - [20480, 128, 1, 4096]
    - [225, 0.0]
  - - [24576, 128, 1, 256]
    - [224, 0.0]
  - - [24576, 128, 1, 1024]
    - [226, 0.0]
  - - [24576, 128, 1, 4096]
    - [226, 0.0]
  - - [32768, 128, 1, 256]
    - [227, 0.0]
  - - [32768, 128, 1, 1024]
    - [224, 0.0]
  - - [32768, 128, 1, 4096]
    - [226, 0.0]
  - - [3, 192, 1, 1024]
    - [228, 0.0]
  - - [3, 192, 1, 4096]
    - [229, 0.0]
  - - [3, 192, 1, 16384]
    - [230, 0.0]
  - - [16, 192, 1, 1024]
    - [231, 0.0]
  - - [16, 192, 1, 4096]
    - [232, 0.0]
  - - [16, 192, 1, 16384]
    - [232, 0.0]
  - - [32, 192, 1, 1024]
    - [233, 0.0]
  - - [32, 192, 1, 4096]
    - [234, 0.0]
  - - [32, 192, 1, 16384]
    - [235, 0.0]
  - - [64, 192, 1, 1024]
    - [236, 0.0]
  - - [64, 192, 1, 4096]
    - [237, 0.0]
  - - [64, 192, 1, 16384]
    - [237, 0.0]
  - - [96, 192, 1, 1024]
    - [238, 0.0]
  - - [96, 192, 1, 4096]
    - [239, 0.0]
  - - [96, 192, 1, 16384]
    - [240, 0.0]
  - - [128, 192, 1, 1024]
    - [149, 0.0]
  - - [128, 192, 1, 4096]
    - [150, 0.0]
  - - [128, 192, 1, 16384]
    - [241, 0.0]
  - - [192, 192, 1, 1024]
    - [242, 0.0]
  - - [192, 192, 1, 4096]
    - [153, 0.0]
  - - [192, 192, 1, 16384]
    - [243, 0.0]
  - - [256, 192, 1, 1024]
    - [201, 0.0]
  - - [256, 192, 1, 4096]
    - [244, 0.0]
  - - [256, 192, 1, 16384]
    - [244, 0.0]
  - - [384, 192, 1, 1024]
    - [245, 0.0]
  - - [384, 192, 1, 4096]
    - [246, 0.0]
  - - [384, 192, 1, 16384]
    - [246, 0.0]
  - - [512, 192, 1, 1024]
    - [247, 0.0]
  - - [512, 192, 1, 4096]
    - [162, 0.0]
  - - [512, 192, 1, 16384]
    - [248, 0.0]
  - - [640, 192, 1, 1024]
    - [249, 0.0]
  - - [640, 192, 1, 4096]
    - [249, 0.0]
  - - [640, 192, 1, 16384]
    - [250, 0.0]
  - - [768, 192, 1, 1024]
    - [123, 0.0]
  - - [768, 192, 1, 4096]
    - [164, 0.0]
  - - [768, 192, 1, 16384]
    - [251, 0.0]
  - - [4096, 192, 1, 1024]
    - [252, 0.0]
  - - [4096, 192, 1, 4096]
    - [253, 0.0]
  - - [4096, 192, 1, 16384]
    - [254, 0.0]
  - - [6144, 192, 1, 256]
    - [255, 0.0]
  - - [6144, 192, 1, 1024]
    - [256, 0.0]
  - - [6144, 192, 1, 4096]
    - [256, 0.0]
  - - [3, 256, 1, 1024]
    - [257, 0.0]
  - - [3, 256, 1, 4096]
    - [258, 0.0]
  - - [3, 256, 1, 16384]
    - [258, 0.0]
  - - [3, 384, 1, 1024]
    - [259, 0.0]
  - - [3, 384, 1, 4096]
    - [260, 0.0]
  - - [3, 384, 1, 16384]
    - [260, 0.0]
  - - [512, 256, 1, 1024]
    - [261, 0.0]
  - - [512, 256, 1, 4096]
    - [209, 0.0]
  - - [512, 256, 1, 16384]
    - [209, 0.0]
  - - [640, 256, 1, 1024]
    - [123, 0.0]
  - - [640, 256, 1, 4096]
    - [262, 0.0]
  - - [640, 256, 1, 16384]
    - [262, 0.0]
  - - [768, 256, 1, 1024]
    - [210, 0.0]
  - - [768, 256, 1, 4096]
    - [211, 0.0]
  - - [768, 256, 1, 16384]
    - [263, 0.0]
  - - [512, 384, 1, 1024]
    - [264, 0.0]
  - - [512, 384, 1, 4096]
    - [265, 0.0]
  - - [512, 384, 1, 16384]
    - [265, 0.0]
  - - [640, 384, 1, 1024]
    - [266, 0.0]
  - - [640, 384, 1, 4096]
    - [267, 0.0]
  - - [640, 384, 1, 16384]
    - [267, 0.0]
  - - [768, 384, 1, 1024]
    - [268, 0.0]
  - - [768, 384, 1, 4096]
    - [269, 0.0]
  - - [768, 384, 1, 16384]
    - [269, 0.0]
  - - [2048, 256, 1, 1024]
    - [270, 0.0]
  - - [2048, 256, 1, 4096]
    - [271, 0.0]
  - - [2048, 256, 1, 16384]
    - [272, 0.0]
  - - [3072, 256, 1, 1024]
    - [273, 0.0]
  - - [3072, 256, 1, 4096]
    - [273, 0.0]
  - - [3072, 256, 1, 16384]
    - [273, 0.0]
  - - [2048, 384, 1, 1024]
    - [274, 0.0]
  - - [2048, 384, 1, 4096]
    - [275, 0.0]
  - - [2048, 384, 1, 16384]
    - [276, 0.0]
  - - [3072, 384, 1, 256]
    - [277, 0.0]
  - - [3072, 384, 1, 1024]
    - [277, 0.0]
  - - [3072, 384, 1, 4096]
    - [278, 0.0]
  - - [4096, 256, 1, 256]
    - [279, 0.0]
  - - [4096, 256, 1, 1024]
    - [280, 0.0]
  - - [4096, 256, 1, 4096]
    - [280, 0.0]
  - - [6144, 256, 1, 256]
    - [281, 0.0]
  - - [6144, 256, 1, 1024]
    - [281, 0.0]
  - - [6144, 256, 1, 4096]
    - [282, 0.0]
  - - [4096, 384, 1, 256]
    - [281, 0.0]
  - - [4096, 384, 1, 1024]
    - [281, 0.0]
  - - [4096, 384, 1, 4096]
    - [282, 0.0]
  - - [6144, 384, 1, 256]
    - [283, 0.0]
  - - [6144, 384, 1, 1024]
    - [281, 0.0]
  - - [6144, 384, 1, 4096]
    - [284, 0.0]
  - - [8192, 256, 1, 256]
    - [285, 0.0]
  - - [8192, 256, 1, 1024]
    - [280, 0.0]
  - - [8192, 256, 1, 4096]
    - [280, 0.0]
  - - [12288, 256, 1, 256]
    - [285, 0.0]
  - - [12288, 256, 1, 1024]
    - [280, 0.0]
  - - [12288, 256, 1, 4096]
    - [280, 0.0]
  - - [16384, 256, 1, 256]
    - [285, 0.0]
  - - [16384, 256, 1, 1024]
    - [280, 0.0]
  - - [16384, 256, 1, 4096]
    - [286, 0.0]
  - - [20480, 256, 1, 256]
    - [285, 0.0]
  - - [20480, 256, 1, 1024]
    - [287, 0.0]
  - - [20480, 256, 1, 4096]
    - [288, 0.0]
  - - [24576, 256, 1, 256]
    - [285, 0.0]
  - - [24576, 256, 1, 1024]
    - [287, 0.0]
  - - [24576, 256, 1, 4096]
    - [287, 0.0]
  - - [32768, 256, 1, 256]
    - [285, 0.0]
  - - [32768, 256, 1, 1024]
    - [289, 0.0]
  - - [32768, 256, 1, 4096]
    - [290, 0.0]
  - - [8192, 384, 1, 256]
    - [285, 0.0]
  - - [8192, 384, 1, 1024]
    - [280, 0.0]
  - - [8192, 384, 1, 4096]
    - [280, 0.0]
  - - [12288, 384, 1, 256]
    - [289, 0.0]
  - - [12288, 384, 1, 1024]
    - [289, 0.0]
  - - [12288, 384, 1, 4096]
    - [291, 0.0]
  - - [16384, 384, 1, 256]
    - [285, 0.0]
  - - [16384, 384, 1, 1024]
    - [292, 0.0]
  - - [16384, 384, 1, 4096]
    - [293, 0.0]
  - - [20480, 384, 1, 256]
    - [285, 0.0]
  - - [20480, 384, 1, 1024]
    - [292, 0.0]
  - - [20480, 384, 1, 4096]
    - [291, 0.0]
  - - [24576, 384, 1, 256]
    - [289, 0.0]
  - - [24576, 384, 1, 1024]
    - [289, 0.0]
  - - [24576, 384, 1, 4096]
    - [291, 0.0]
  - - [32768, 384, 1, 256]
    - [285, 0.0]
  - - [32768, 384, 1, 1024]
    - [294, 0.0]
  - - [32768, 384, 1, 4096]
    - [291, 0.0]
  - - [3, 512, 1, 1024]
    - [295, 0.0]
  - - [3, 512, 1, 4096]
    - [296, 0.0]
  - - [3, 512, 1, 16384]
    - [297, 0.0]
  - - [3, 640, 1, 1024]
    - [295, 0.0]
  - - [3, 640, 1, 4096]
    - [298, 0.0]
  - - [3, 640, 1, 16384]
    - [299, 0.0]
  - - [3, 768, 1, 1024]
    - [300, 0.0]
  - - [3, 768, 1, 4096]
    - [301, 0.0]
  - - [3, 768, 1, 16384]
    - [302, 0.0]
  - - [16, 512, 1, 1024]
    - [303, 0.0]
  - - [16, 512, 1, 4096]
    - [304, 0.0]
  - - [16, 512, 1, 16384]
    - [304, 0.0]
  - - [32, 512, 1, 1024]
    - [305, 0.0]
  - - [32, 512, 1, 4096]
    - [306, 0.0]
  - - [32, 512, 1, 16384]
    - [306, 0.0]
  - - [16, 640, 1, 1024]
    - [303, 0.0]
  - - [16, 640, 1, 4096]
    - [307, 0.0]
  - - [16, 640, 1, 16384]
    - [307, 0.0]
  - - [32, 640, 1, 1024]
    - [305, 0.0]
  - - [32, 640, 1, 4096]
    - [308, 0.0]
  - - [32, 640, 1, 16384]
    - [309, 0.0]
  - - [16, 768, 1, 1024]
    - [310, 0.0]
  - - [16, 768, 1, 4096]
    - [311, 0.0]
  - - [16, 768, 1, 16384]
    - [312, 0.0]
  - - [32, 768, 1, 1024]
    - [313, 0.0]
  - - [32, 768, 1, 4096]
    - [314, 0.0]
  - - [32, 768, 1, 16384]
    - [314, 0.0]
  - - [128, 512, 1, 1024]
    - [315, 0.0]
  - - [128, 512, 1, 4096]
    - [316, 0.0]
  - - [128, 512, 1, 16384]
    - [316, 0.0]
  - - [192, 512, 1, 1024]
    - [317, 0.0]
  - - [192, 512, 1, 4096]
    - [317, 0.0]
  - - [192, 512, 1, 16384]
    - [318, 0.0]
  - - [128, 640, 1, 1024]
    - [119, 0.0]
  - - [128, 640, 1, 4096]
    - [315, 0.0]
  - - [128, 640, 1, 16384]
    - [319, 0.0]
  - - [192, 640, 1, 1024]
    - [317, 0.0]
  - - [192, 640, 1, 4096]
    - [317, 0.0]
  - - [192, 640, 1, 16384]
    - [317, 0.0]
  - - [128, 768, 1, 1024]
    - [249, 0.0]
  - - [128, 768, 1, 4096]
    - [319, 0.0]
  - - [128, 768, 1, 16384]
    - [319, 0.0]
  - - [192, 768, 1, 1024]
    - [320, 0.0]
  - - [192, 768, 1, 4096]
    - [251, 0.0]
  - - [192, 768, 1, 16384]
    - [251, 0.0]
  - - [256, 512, 1, 1024]
    - [320, 0.0]
  - - [256, 512, 1, 4096]
    - [209, 0.0]
  - - [256, 512, 1, 16384]
    - [209, 0.0]
  - - [384, 512, 1, 1024]
    - [321, 0.0]
  - - [384, 512, 1, 4096]
    - [211, 0.0]
  - - [384, 512, 1, 16384]
    - [263, 0.0]
  - - [256, 640, 1, 1024]
    - [123, 0.0]
  - - [256, 640, 1, 4096]
    - [322, 0.0]
  - - [256, 640, 1, 16384]
    - [322, 0.0]
  - - [384, 640, 1, 1024]
    - [321, 0.0]
  - - [384, 640, 1, 4096]
    - [323, 0.0]
  - - [384, 640, 1, 16384]
    - [323, 0.0]
  - - [256, 768, 1, 1024]
    - [264, 0.0]
  - - [256, 768, 1, 4096]
    - [324, 0.0]
  - - [256, 768, 1, 16384]
    - [265, 0.0]
  - - [384, 768, 1, 1024]
    - [268, 0.0]
  - - [384, 768, 1, 4096]
    - [325, 0.0]
  - - [384, 768, 1, 16384]
    - [325, 0.0]
  - - [512, 512, 1, 1024]
    - [212, 0.0]
  - - [512, 512, 1, 4096]
    - [326, 0.0]
  - - [512, 512, 1, 16384]
    - [326, 0.0]
  - - [640, 512, 1, 1024]
    - [212, 0.0]
  - - [640, 512, 1, 4096]
    - [327, 0.0]
  - - [640, 512, 1, 16384]
    - [327, 0.0]
  - - [768, 512, 1, 1024]
    - [328, 0.0]
  - - [768, 512, 1, 4096]
    - [329, 0.0]
  - - [768, 512, 1, 16384]
    - [330, 0.0]
  - - [512, 640, 1, 1024]
    - [212, 0.0]
  - - [512, 640, 1, 4096]
    - [326, 0.0]
  - - [512, 640, 1, 16384]
    - [331, 0.0]
  - - [640, 640, 1, 1024]
    - [215, 0.0]
  - - [640, 640, 1, 4096]
    - [216, 0.0]
  - - [640, 640, 1, 16384]
    - [332, 0.0]
  - - [768, 640, 1, 1024]
    - [333, 0.0]
  - - [768, 640, 1, 4096]
    - [334, 0.0]
  - - [768, 640, 1, 16384]
    - [335, 0.0]
  - - [512, 768, 1, 1024]
    - [328, 0.0]
  - - [512, 768, 1, 4096]
    - [336, 0.0]
  - - [512, 768, 1, 16384]
    - [336, 0.0]
  - - [640, 768, 1, 1024]
    - [337, 0.0]
  - - [640, 768, 1, 4096]
    - [337, 0.0]
  - - [640, 768, 1, 16384]
    - [337, 0.0]
  - - [768, 768, 1, 1024]
    - [338, 0.0]
  - - [768, 768, 1, 4096]
    - [338, 0.0]
  - - [768, 768, 1, 16384]
    - [338, 0.0]
  - - [2048, 512, 1, 256]
    - [339, 0.0]
  - - [2048, 512, 1, 1024]
    - [340, 0.0]
  - - [2048, 512, 1, 4096]
    - [341, 0.0]
  - - [3072, 512, 1, 256]
    - [342, 0.0]
  - - [3072, 512, 1, 1024]
    - [342, 0.0]
  - - [3072, 512, 1, 4096]
    - [343, 0.0]
  - - [2048, 640, 1, 256]
    - [339, 0.0]
  - - [2048, 640, 1, 1024]
    - [339, 0.0]
  - - [2048, 640, 1, 4096]
    - [344, 0.0]
  - - [3072, 640, 1, 256]
    - [339, 0.0]
  - - [3072, 640, 1, 1024]
    - [339, 0.0]
  - - [3072, 640, 1, 4096]
    - [339, 0.0]
  - - [2048, 768, 1, 256]
    - [345, 0.0]
  - - [2048, 768, 1, 1024]
    - [346, 0.0]
  - - [2048, 768, 1, 4096]
    - [346, 0.0]
  - - [3072, 768, 1, 256]
    - [347, 0.0]
  - - [3072, 768, 1, 1024]
    - [342, 0.0]
  - - [3072, 768, 1, 4096]
    - [346, 0.0]
  - - [4096, 512, 1, 256]
    - [339, 0.0]
  - - [4096, 512, 1, 1024]
    - [342, 0.0]
  - - [4096, 512, 1, 4096]
    - [341, 0.0]
  - - [6144, 512, 1, 256]
    - [342, 0.0]
  - - [6144, 512, 1, 1024]
    - [339, 0.0]
  - - [6144, 512, 1, 4096]
    - [339, 0.0]
  - - [4096, 640, 1, 256]
    - [339, 0.0]
  - - [4096, 640, 1, 1024]
    - [339, 0.0]
  - - [4096, 640, 1, 4096]
    - [344, 0.0]
  - - [6144, 640, 1, 256]
    - [339, 0.0]
  - - [6144, 640, 1, 1024]
    - [339, 0.0]
  - - [6144, 640, 1, 4096]
    - [348, 0.0]
  - - [4096, 768, 1, 256]
    - [339, 0.0]
  - - [4096, 768, 1, 1024]
    - [339, 0.0]
  - - [4096, 768, 1, 4096]
    - [339, 0.0]
  - - [6144, 768, 1, 256]
    - [342, 0.0]
  - - [6144, 768, 1, 1024]
    - [342, 0.0]
  - - [6144, 768, 1, 4096]
    - [349, 0.0]
  - - [8192, 512, 1, 256]
    - [350, 0.0]
  - - [8192, 512, 1, 1024]
    - [351, 0.0]
  - - [8192, 512, 1, 4096]
    - [351, 0.0]
  - - [12288, 512, 1, 256]
    - [352, 0.0]
  - - [12288, 512, 1, 1024]
    - [351, 0.0]
  - - [12288, 512, 1, 4096]
    - [351, 0.0]
  - - [16384, 512, 1, 256]
    - [352, 0.0]
  - - [16384, 512, 1, 1024]
    - [351, 0.0]
  - - [16384, 512, 1, 4096]
    - [351, 0.0]
  - - [20480, 512, 1, 256]
    - [352, 0.0]
  - - [20480, 512, 1, 1024]
    - [351, 0.0]
  - - [20480, 512, 1, 4096]
    - [351, 0.0]
  - - [24576, 512, 1, 256]
    - [352, 0.0]
  - - [24576, 512, 1, 1024]
    - [351, 0.0]
  - - [24576, 512, 1, 4096]
    - [351, 0.0]
  - - [32768, 512, 1, 1024]
    - [351, 0.0]
  - - [8192, 640, 1, 256]
    - [351, 0.0]
  - - [8192, 640, 1, 1024]
    - [351, 0.0]
  - - [8192, 640, 1, 4096]
    - [351, 0.0]
  - - [12288, 640, 1, 256]
    - [352, 0.0]
  - - [12288, 640, 1, 1024]
    - [351, 0.0]
  - - [12288, 640, 1, 4096]
    - [351, 0.0]
  - - [16384, 640, 1, 256]
    - [352, 0.0]
  - - [16384, 640, 1, 1024]
    - [351, 0.0]
  - - [16384, 640, 1, 4096]
    - [351, 0.0]
  - - [20480, 640, 1, 256]
    - [352, 0.0]
  - - [20480, 640, 1, 1024]
    - [353, 0.0]
  - - [20480, 640, 1, 4096]
    - [353, 0.0]
  - - [24576, 640, 1, 1024]
    - [351, 0.0]
  - - [32768, 640, 1, 1024]
    - [353, 0.0]
  - - [8192, 768, 1, 256]
    - [352, 0.0]
  - - [8192, 768, 1, 1024]
    - [351, 0.0]
  - - [8192, 768, 1, 4096]
    - [354, 0.0]
  - - [12288, 768, 1, 256]
    - [352, 0.0]
  - - [12288, 768, 1, 1024]
    - [351, 0.0]
  - - [12288, 768, 1, 4096]
    - [354, 0.0]
  - - [16384, 768, 1, 256]
    - [352, 0.0]
  - - [16384, 768, 1, 1024]
    - [351, 0.0]
  - - [16384, 768, 1, 4096]
    - [354, 0.0]
  - - [20480, 768, 1, 1024]
    - [351, 0.0]
  - - [24576, 768, 1, 1024]
    - [351, 0.0]
  - - [32768, 768, 1, 1024]
    - [353, 0.0]
  - - [16, 1024, 1, 1024]
    - [355, 0.0]
  - - [16, 1024, 1, 4096]
    - [355, 0.0]
  - - [16, 1024, 1, 16384]
    - [356, 0.0]
  - - [32, 1024, 1, 1024]
    - [357, 0.0]
  - - [32, 1024, 1, 4096]
    - [357, 0.0]
  - - [32, 1024, 1, 16384]
    - [358, 0.0]
  - - [16, 1536, 1, 1024]
    - [359, 0.0]
  - - [16, 1536, 1, 4096]
    - [360, 0.0]
  - - [16, 1536, 1, 16384]
    - [360, 0.0]
  - - [32, 1536, 1, 1024]
    - [361, 0.0]
  - - [32, 1536, 1, 4096]
    - [362, 0.0]
  - - [32, 1536, 1, 16384]
    - [362, 0.0]
  - - [64, 1024, 1, 1024]
    - [119, 0.0]
  - - [64, 1024, 1, 4096]
    - [363, 0.0]
  - - [64, 1024, 1, 16384]
    - [364, 0.0]
  - - [96, 1024, 1, 1024]
    - [365, 0.0]
  - - [96, 1024, 1, 4096]
    - [366, 0.0]
  - - [96, 1024, 1, 16384]
    - [366, 0.0]
  - - [64, 1536, 1, 1024]
    - [367, 0.0]
  - - [64, 1536, 1, 4096]
    - [368, 0.0]
  - - [64, 1536, 1, 16384]
    - [368, 0.0]
  - - [96, 1536, 1, 1024]
    - [369, 0.0]
  - - [96, 1536, 1, 4096]
    - [369, 0.0]
  - - [96, 1536, 1, 16384]
    - [370, 0.0]
  - - [128, 1024, 1, 1024]
    - [123, 0.0]
  - - [128, 1024, 1, 4096]
    - [371, 0.0]
  - - [128, 1024, 1, 16384]
    - [371, 0.0]
  - - [192, 1024, 1, 1024]
    - [321, 0.0]
  - - [192, 1024, 1, 4096]
    - [263, 0.0]
  - - [192, 1024, 1, 16384]
    - [263, 0.0]
  - - [128, 1536, 1, 1024]
    - [264, 0.0]
  - - [128, 1536, 1, 4096]
    - [372, 0.0]
  - - [128, 1536, 1, 16384]
    - [372, 0.0]
  - - [192, 1536, 1, 1024]
    - [373, 0.0]
  - - [192, 1536, 1, 4096]
    - [374, 0.0]
  - - [192, 1536, 1, 16384]
    - [374, 0.0]
  - - [256, 1024, 1, 1024]
    - [212, 0.0]
  - - [256, 1024, 1, 4096]
    - [272, 0.0]
  - - [256, 1024, 1, 16384]
    - [272, 0.0]
  - - [384, 1024, 1, 1024]
    - [337, 0.0]
  - - [384, 1024, 1, 4096]
    - [375, 0.0]
  - - [384, 1024, 1, 16384]
    - [375, 0.0]
  - - [256, 1536, 1, 1024]
    - [328, 0.0]
  - - [256, 1536, 1, 4096]
    - [376, 0.0]
  - - [256, 1536, 1, 16384]
    - [376, 0.0]
  - - [384, 1536, 1, 1024]
    - [377, 0.0]
  - - [384, 1536, 1, 4096]
    - [378, 0.0]
  - - [384, 1536, 1, 16384]
    - [378, 0.0]
  - - [512, 1024, 1, 1024]
    - [379, 0.0]
  - - [512, 1024, 1, 4096]
    - [380, 0.0]
  - - [512, 1024, 1, 16384]
    - [380, 0.0]
  - - [640, 1024, 1, 1024]
    - [381, 0.0]
  - - [640, 1024, 1, 4096]
    - [382, 0.0]
  - - [640, 1024, 1, 16384]
    - [382, 0.0]
  - - [768, 1024, 1, 1024]
    - [383, 0.0]
  - - [768, 1024, 1, 4096]
    - [384, 0.0]
  - - [768, 1024, 1, 16384]
    - [384, 0.0]
  - - [512, 1536, 1, 1024]
    - [385, 0.0]
  - - [512, 1536, 1, 4096]
    - [385, 0.0]
  - - [512, 1536, 1, 16384]
    - [386, 0.0]
  - - [640, 1536, 1, 256]
    - [387, 0.0]
  - - [640, 1536, 1, 1024]
    - [388, 0.0]
  - - [640, 1536, 1, 4096]
    - [389, 0.0]
  - - [768, 1536, 1, 256]
    - [390, 0.0]
  - - [768, 1536, 1, 1024]
    - [391, 0.0]
  - - [768, 1536, 1, 4096]
    - [392, 0.0]
  - - [1024, 1024, 1, 256]
    - [393, 0.0]
  - - [1024, 1024, 1, 1024]
    - [394, 0.0]
  - - [1024, 1024, 1, 4096]
    - [393, 0.0]
  - - [1536, 1024, 1, 256]
    - [395, 0.0]
  - - [1536, 1024, 1, 1024]
    - [396, 0.0]
  - - [1536, 1024, 1, 4096]
    - [396, 0.0]
  - - [1024, 1536, 1, 256]
    - [397, 0.0]
  - - [1024, 1536, 1, 1024]
    - [397, 0.0]
  - - [1024, 1536, 1, 4096]
    - [397, 0.0]
  - - [1536, 1536, 1, 256]
    - [398, 0.0]
  - - [1536, 1536, 1, 1024]
    - [399, 0.0]
  - - [1536, 1536, 1, 4096]
    - [399, 0.0]
  - - [2048, 1024, 1, 256]
    - [400, 0.0]
  - - [2048, 1024, 1, 1024]
    - [401, 0.0]
  - - [2048, 1024, 1, 4096]
    - [402, 0.0]
  - - [3072, 1024, 1, 256]
    - [403, 0.0]
  - - [3072, 1024, 1, 1024]
    - [403, 0.0]
  - - [3072, 1024, 1, 4096]
    - [403, 0.0]
  - - [2048, 1536, 1, 256]
    - [403, 0.0]
  - - [2048, 1536, 1, 1024]
    - [403, 0.0]
  - - [2048, 1536, 1, 4096]
    - [403, 0.0]
  - - [3072, 1536, 1, 256]
    - [404, 0.0]
  - - [3072, 1536, 1, 1024]
    - [405, 0.0]
  - - [3072, 1536, 1, 4096]
    - [406, 0.0]
  - - [8192, 1024, 1, 256]
    - [352, 0.0]
  - - [8192, 1024, 1, 1024]
    - [351, 0.0]
  - - [8192, 1024, 1, 4096]
    - [351, 0.0]
  - - [12288, 1024, 1, 256]
    - [350, 0.0]
  - - [12288, 1024, 1, 1024]
    - [351, 0.0]
  - - [12288, 1024, 1, 4096]
    - [351, 0.0]
  - - [16384, 1024, 1, 1024]
    - [351, 0.0]
  - - [20480, 1024, 1, 1024]
    - [351, 0.0]
  - - [24576, 1024, 1, 1024]
    - [353, 0.0]
  - - [32768, 1024, 1, 1024]
    - [353, 0.0]
  - - [8192, 1536, 1, 256]
    - [350, 0.0]
  - - [8192, 1536, 1, 1024]
    - [351, 0.0]
  - - [8192, 1536, 1, 4096]
    - [351, 0.0]
  - - [12288, 1536, 1, 1024]
    - [351, 0.0]
  - - [16384, 1536, 1, 1024]
    - [351, 0.0]
  - - [20480, 1536, 1, 1024]
    - [351, 0.0]
  - - [24576, 1536, 1, 1024]
    - [351, 0.0]
  - - [32768, 1536, 1, 1024]
    - [351, 0.0]
  - - [3, 2048, 1, 1024]
    - [407, 0.0]
  - - [3, 2048, 1, 4096]
    - [408, 0.0]
  - - [3, 2048, 1, 16384]
    - [409, 0.0]
  - - [3, 3072, 1, 1024]
    - [410, 0.0]
  - - [3, 3072, 1, 4096]
    - [410, 0.0]
  - - [3, 3072, 1, 16384]
    - [410, 0.0]
  - - [16, 2048, 1, 1024]
    - [411, 0.0]
  - - [16, 2048, 1, 4096]
    - [412, 0.0]
  - - [16, 2048, 1, 16384]
    - [356, 0.0]
  - - [32, 2048, 1, 1024]
    - [413, 0.0]
  - - [32, 2048, 1, 4096]
    - [414, 0.0]
  - - [32, 2048, 1, 16384]
    - [358, 0.0]
  - - [16, 3072, 1, 1024]
    - [415, 0.0]
  - - [16, 3072, 1, 4096]
    - [415, 0.0]
  - - [16, 3072, 1, 16384]
    - [415, 0.0]
  - - [32, 3072, 1, 1024]
    - [416, 0.0]
  - - [32, 3072, 1, 4096]
    - [417, 0.0]
  - - [32, 3072, 1, 16384]
    - [416, 0.0]
  - - [64, 2048, 1, 1024]
    - [418, 0.0]
  - - [64, 2048, 1, 4096]
    - [418, 0.0]
  - - [64, 2048, 1, 16384]
    - [418, 0.0]
  - - [96, 2048, 1, 1024]
    - [321, 0.0]
  - - [96, 2048, 1, 4096]
    - [419, 0.0]
  - - [96, 2048, 1, 16384]
    - [366, 0.0]
  - - [64, 3072, 1, 1024]
    - [420, 0.0]
  - - [64, 3072, 1, 4096]
    - [368, 0.0]
  - - [64, 3072, 1, 16384]
    - [420, 0.0]
  - - [96, 3072, 1, 1024]
    - [373, 0.0]
  - - [96, 3072, 1, 4096]
    - [373, 0.0]
  - - [96, 3072, 1, 16384]
    - [421, 0.0]
  - - [128, 2048, 1, 1024]
    - [212, 0.0]
  - - [128, 2048, 1, 4096]
    - [422, 0.0]
  - - [128, 2048, 1, 16384]
    - [422, 0.0]
  - - [192, 2048, 1, 1024]
    - [423, 0.0]
  - - [192, 2048, 1, 4096]
    - [375, 0.0]
  - - [192, 2048, 1, 16384]
    - [375, 0.0]
  - - [128, 3072, 1, 1024]
    - [424, 0.0]
  - - [128, 3072, 1, 4096]
    - [425, 0.0]
  - - [128, 3072, 1, 16384]
    - [425, 0.0]
  - - [192, 3072, 1, 1024]
    - [426, 0.0]
  - - [192, 3072, 1, 4096]
    - [426, 0.0]
  - - [192, 3072, 1, 16384]
    - [427, 0.0]
  - - [256, 2048, 1, 1024]
    - [270, 0.0]
  - - [256, 2048, 1, 4096]
    - [428, 0.0]
  - - [256, 2048, 1, 16384]
    - [272, 0.0]
  - - [384, 2048, 1, 1024]
    - [429, 0.0]
  - - [384, 2048, 1, 4096]
    - [430, 0.0]
  - - [384, 2048, 1, 16384]
    - [431, 0.0]
  - - [256, 3072, 1, 1024]
    - [432, 0.0]
  - - [256, 3072, 1, 4096]
    - [432, 0.0]
  - - [256, 3072, 1, 16384]
    - [432, 0.0]
  - - [384, 3072, 1, 256]
    - [433, 0.0]
  - - [384, 3072, 1, 1024]
    - [434, 0.0]
  - - [384, 3072, 1, 4096]
    - [434, 0.0]
  - - [512, 2048, 1, 256]
    - [435, 0.0]
  - - [512, 2048, 1, 1024]
    - [393, 0.0]
  - - [512, 2048, 1, 4096]
    - [393, 0.0]
  - - [640, 2048, 1, 256]
    - [436, 0.0]
  - - [640, 2048, 1, 1024]
    - [437, 0.0]
  - - [640, 2048, 1, 4096]
    - [438, 0.0]
  - - [768, 2048, 1, 256]
    - [399, 0.0]
  - - [768, 2048, 1, 1024]
    - [399, 0.0]
  - - [768, 2048, 1, 4096]
    - [399, 0.0]
  - - [512, 3072, 1, 256]
    - [399, 0.0]
  - - [512, 3072, 1, 1024]
    - [399, 0.0]
  - - [512, 3072, 1, 4096]
    - [399, 0.0]
  - - [640, 3072, 1, 256]
    - [436, 0.0]
  - - [640, 3072, 1, 1024]
    - [437, 0.0]
  - - [640, 3072, 1, 4096]
    - [437, 0.0]
  - - [768, 3072, 1, 256]
    - [439, 0.0]
  - - [768, 3072, 1, 1024]
    - [399, 0.0]
  - - [768, 3072, 1, 4096]
    - [399, 0.0]
  - - [2048, 2048, 1, 256]
    - [440, 0.0]
  - - [2048, 2048, 1, 1024]
    - [440, 0.0]
  - - [2048, 2048, 1, 4096]
    - [441, 0.0]
  - - [3072, 2048, 1, 256]
    - [442, 0.0]
  - - [3072, 2048, 1, 1024]
    - [443, 0.0]
  - - [3072, 2048, 1, 4096]
    - [443, 0.0]
  - - [2048, 3072, 1, 256]
    - [444, 0.0]
  - - [2048, 3072, 1, 1024]
    - [443, 0.0]
  - - [2048, 3072, 1, 4096]
    - [443, 0.0]
  - - [3072, 3072, 1, 256]
    - [442, 0.0]
  - - [3072, 3072, 1, 1024]
    - [443, 0.0]
  - - [3072, 3072, 1, 4096]
    - [443, 0.0]
  - - [4096, 2048, 1, 256]
    - [445, 0.0]
  - - [4096, 2048, 1, 1024]
    - [354, 0.0]
  - - [4096, 2048, 1, 4096]
    - [446, 0.0]
  - - [6144, 2048, 1, 256]
    - [445, 0.0]
  - - [6144, 2048, 1, 1024]
    - [354, 0.0]
  - - [6144, 2048, 1, 4096]
    - [447, 0.0]
  - - [4096, 3072, 1, 256]
    - [445, 0.0]
  - - [4096, 3072, 1, 1024]
    - [354, 0.0]
  - - [4096, 3072, 1, 4096]
    - [354, 0.0]
  - - [6144, 3072, 1, 1024]
    - [354, 0.0]
  - - [8192, 2048, 1, 1024]
    - [354, 0.0]
  - - [12288, 2048, 1, 1024]
    - [354, 0.0]
  - - [16384, 2048, 1, 1024]
    - [354, 0.0]
  - - [20480, 2048, 1, 1024]
    - [354, 0.0]
  - - [24576, 2048, 1, 1024]
    - [354, 0.0]
  - - [32768, 2048, 1, 1024]
    - [354, 0.0]
  - - [8192, 3072, 1, 1024]
    - [354, 0.0]
  - - [12288, 3072, 1, 1024]
    - [354, 0.0]
  - - [16384, 3072, 1, 1024]
    - [354, 0.0]
  - - [20480, 3072, 1, 1024]
    - [354, 0.0]
  - - [24576, 3072, 1, 1024]
    - [354, 0.0]
  - - [32768, 3072, 1, 1024]
    - [354, 0.0]
  - - [3, 4096, 1, 1024]
    - [448, 0.0]
  - - [3, 4096, 1, 4096]
    - [449, 0.0]
  - - [3, 4096, 1, 16384]
    - [450, 0.0]
  - - [3, 6144, 1, 1024]
    - [448, 0.0]
  - - [3, 6144, 1, 4096]
    - [448, 0.0]
  - - [3, 6144, 1, 16384]
    - [451, 0.0]
  - - [16, 4096, 1, 1024]
    - [452, 0.0]
  - - [16, 4096, 1, 4096]
    - [453, 0.0]
  - - [16, 4096, 1, 16384]
    - [454, 0.0]
  - - [32, 4096, 1, 1024]
    - [455, 0.0]
  - - [32, 4096, 1, 4096]
    - [456, 0.0]
  - - [32, 4096, 1, 16384]
    - [456, 0.0]
  - - [16, 6144, 1, 1024]
    - [452, 0.0]
  - - [16, 6144, 1, 4096]
    - [452, 0.0]
  - - [16, 6144, 1, 16384]
    - [457, 0.0]
  - - [32, 6144, 1, 1024]
    - [458, 0.0]
  - - [32, 6144, 1, 4096]
    - [459, 0.0]
  - - [32, 6144, 1, 16384]
    - [459, 0.0]
  - - [64, 4096, 1, 1024]
    - [460, 0.0]
  - - [64, 4096, 1, 4096]
    - [460, 0.0]
  - - [64, 4096, 1, 16384]
    - [461, 0.0]
  - - [96, 4096, 1, 1024]
    - [462, 0.0]
  - - [96, 4096, 1, 4096]
    - [462, 0.0]
  - - [96, 4096, 1, 16384]
    - [462, 0.0]
  - - [64, 6144, 1, 1024]
    - [463, 0.0]
  - - [64, 6144, 1, 4096]
    - [463, 0.0]
  - - [64, 6144, 1, 16384]
    - [463, 0.0]
  - - [96, 6144, 1, 1024]
    - [464, 0.0]
  - - [96, 6144, 1, 4096]
    - [464, 0.0]
  - - [96, 6144, 1, 16384]
    - [464, 0.0]
  - - [128, 4096, 1, 1024]
    - [465, 0.0]
  - - [128, 4096, 1, 4096]
    - [466, 0.0]
  - - [128, 4096, 1, 16384]
    - [466, 0.0]
  - - [192, 4096, 1, 1024]
    - [467, 0.0]
  - - [192, 4096, 1, 4096]
    - [467, 0.0]
  - - [192, 4096, 1, 16384]
    - [467, 0.0]
  - - [128, 6144, 1, 1024]
    - [468, 0.0]
  - - [128, 6144, 1, 4096]
    - [468, 0.0]
  - - [128, 6144, 1, 16384]
    - [468, 0.0]
  - - [192, 6144, 1, 256]
    - [469, 0.0]
  - - [192, 6144, 1, 1024]
    - [470, 0.0]
  - - [192, 6144, 1, 4096]
    - [470, 0.0]
  - - [512, 4096, 1, 256]
    - [471, 0.0]
  - - [512, 4096, 1, 1024]
    - [393, 0.0]
  - - [512, 4096, 1, 4096]
    - [393, 0.0]
  - - [640, 4096, 1, 256]
    - [436, 0.0]
  - - [640, 4096, 1, 1024]
    - [437, 0.0]
  - - [640, 4096, 1, 4096]
    - [437, 0.0]
  - - [768, 4096, 1, 256]
    - [439, 0.0]
  - - [768, 4096, 1, 1024]
    - [439, 0.0]
  - - [768, 4096, 1, 4096]
    - [439, 0.0]
  - - [512, 6144, 1, 256]
    - [472, 0.0]
  - - [512, 6144, 1, 1024]
    - [439, 0.0]
  - - [512, 6144, 1, 4096]
    - [399, 0.0]
  - - [640, 6144, 1, 256]
    - [395, 0.0]
  - - [640, 6144, 1, 1024]
    - [395, 0.0]
  - - [640, 6144, 1, 4096]
    - [395, 0.0]
  - - [768, 6144, 1, 256]
    - [471, 0.0]
  - - [768, 6144, 1, 1024]
    - [473, 0.0]
  - - [768, 6144, 1, 4096]
    - [474, 0.0]
  - - [1024, 4096, 1, 256]
    - [475, 0.0]
  - - [1024, 4096, 1, 1024]
    - [475, 0.0]
  - - [1024, 4096, 1, 4096]
    - [441, 0.0]
  - - [1536, 4096, 1, 256]
    - [476, 0.0]
  - - [1536, 4096, 1, 1024]
    - [443, 0.0]
  - - [1536, 4096, 1, 4096]
    - [443, 0.0]
  - - [1024, 6144, 1, 256]
    - [475, 0.0]
  - - [1024, 6144, 1, 1024]
    - [475, 0.0]
  - - [1024, 6144, 1, 4096]
    - [477, 0.0]
  - - [1536, 6144, 1, 256]
    - [442, 0.0]
  - - [1536, 6144, 1, 1024]
    - [443, 0.0]
  - - [1536, 6144, 1, 4096]
    - [443, 0.0]
  - - [2048, 4096, 1, 256]
    - [442, 0.0]
  - - [2048, 4096, 1, 1024]
    - [443, 0.0]
  - - [2048, 4096, 1, 4096]
    - [478, 0.0]
  - - [3072, 4096, 1, 256]
    - [442, 0.0]
  - - [3072, 4096, 1, 1024]
    - [443, 0.0]
  - - [3072, 4096, 1, 4096]
    - [443, 0.0]
  - - [2048, 6144, 1, 256]
    - [442, 0.0]
  - - [2048, 6144, 1, 1024]
    - [443, 0.0]
  - - [2048, 6144, 1, 4096]
    - [478, 0.0]
  - - [3072, 6144, 1, 1024]
    - [443, 0.0]
  - - [4096, 4096, 1, 1024]
    - [443, 0.0]
  - - [6144, 4096, 1, 1024]
    - [443, 0.0]
  - - [4096, 6144, 1, 1024]
    - [443, 0.0]
  - - [6144, 6144, 1, 1024]
    - [443, 0.0]
  - - [8192, 4096, 1, 1024]
    - [354, 0.0]
  - - [12288, 4096, 1, 1024]
    - [354, 0.0]
  - - [16384, 4096, 1, 1024]
    - [354, 0.0]
  - - [20480, 4096, 1, 1024]
    - [354, 0.0]
  - - [24576, 4096, 1, 1024]
    - [354, 0.0]
  - - [32768, 4096, 1, 1024]
    - [354, 0.0]
  - - [8192, 6144, 1, 1024]
    - [354, 0.0]
  - - [12288, 6144, 1, 1024]
    - [354, 0.0]
  - - [16384, 6144, 1, 1024]
    - [354, 0.0]
  - - [20480, 6144, 1, 1024]
    - [354, 0.0]
  - - [24576, 6144, 1, 1024]
    - [354, 0.0]
  - - [32768, 6144, 1, 1024]
    - [354, 0.0]
  - - [3, 8192, 1, 1024]
    - [479, 0.0]
  - - [3, 8192, 1, 4096]
    - [480, 0.0]
  - - [3, 8192, 1, 16384]
    - [480, 0.0]
  - - [3, 12288, 1, 1024]
    - [479, 0.0]
  - - [3, 12288, 1, 4096]
    - [479, 0.0]
  - - [3, 12288, 1, 16384]
    - [481, 0.0]
  - - [3, 16384, 1, 1024]
    - [479, 0.0]
  - - [3, 16384, 1, 4096]
    - [479, 0.0]
  - - [3, 16384, 1, 16384]
    - [479, 0.0]
  - - [3, 20480, 1, 1024]
    - [479, 0.0]
  - - [3, 20480, 1, 4096]
    - [479, 0.0]
  - - [3, 20480, 1, 16384]
    - [479, 0.0]
  - - [3, 24576, 1, 1024]
    - [479, 0.0]
  - - [3, 24576, 1, 4096]
    - [479, 0.0]
  - - [3, 24576, 1, 16384]
    - [481, 0.0]
  - - [3, 32768, 1, 1024]
    - [479, 0.0]
  - - [3, 32768, 1, 4096]
    - [479, 0.0]
  - - [3, 32768, 1, 16384]
    - [479, 0.0]
  - - [16, 8192, 1, 1024]
    - [482, 0.0]
  - - [16, 8192, 1, 4096]
    - [452, 0.0]
  - - [16, 8192, 1, 16384]
    - [454, 0.0]
  - - [32, 8192, 1, 1024]
    - [458, 0.0]
  - - [32, 8192, 1, 4096]
    - [458, 0.0]
  - - [32, 8192, 1, 16384]
    - [455, 0.0]
  - - [16, 12288, 1, 1024]
    - [452, 0.0]
  - - [16, 12288, 1, 4096]
    - [452, 0.0]
  - - [16, 12288, 1, 16384]
    - [483, 0.0]
  - - [32, 12288, 1, 1024]
    - [458, 0.0]
  - - [32, 12288, 1, 4096]
    - [455, 0.0]
  - - [32, 12288, 1, 16384]
    - [455, 0.0]
  - - [16, 16384, 1, 1024]
    - [452, 0.0]
  - - [16, 16384, 1, 4096]
    - [484, 0.0]
  - - [16, 16384, 1, 16384]
    - [452, 0.0]
  - - [32, 16384, 1, 1024]
    - [455, 0.0]
  - - [32, 16384, 1, 4096]
    - [455, 0.0]
  - - [32, 16384, 1, 16384]
    - [455, 0.0]
  - - [16, 20480, 1, 1024]
    - [452, 0.0]
  - - [16, 20480, 1, 4096]
    - [484, 0.0]
  - - [16, 20480, 1, 16384]
    - [483, 0.0]
  - - [32, 20480, 1, 1024]
    - [455, 0.0]
  - - [32, 20480, 1, 4096]
    - [485, 0.0]
  - - [32, 20480, 1, 16384]
    - [455, 0.0]
  - - [16, 24576, 1, 1024]
    - [452, 0.0]
  - - [16, 24576, 1, 4096]
    - [484, 0.0]
  - - [16, 24576, 1, 16384]
    - [483, 0.0]
  - - [32, 24576, 1, 1024]
    - [455, 0.0]
  - - [32, 24576, 1, 4096]
    - [455, 0.0]
  - - [32, 24576, 1, 16384]
    - [455, 0.0]
  - - [16, 32768, 1, 1024]
    - [452, 0.0]
  - - [16, 32768, 1, 4096]
    - [452, 0.0]
  - - [16, 32768, 1, 16384]
    - [483, 0.0]
  - - [32, 32768, 1, 256]
    - [486, 0.0]
  - - [32, 32768, 1, 1024]
    - [455, 0.0]
  - - [32, 32768, 1, 4096]
    - [485, 0.0]
  - - [128, 8192, 1, 256]
    - [487, 0.0]
  - - [128, 8192, 1, 1024]
    - [488, 0.0]
  - - [128, 8192, 1, 4096]
    - [488, 0.0]
  - - [192, 8192, 1, 256]
    - [489, 0.0]
  - - [192, 8192, 1, 1024]
    - [490, 0.0]
  - - [192, 8192, 1, 4096]
    - [491, 0.0]
  - - [128, 12288, 1, 256]
    - [492, 0.0]
  - - [128, 12288, 1, 1024]
    - [493, 0.0]
  - - [128, 12288, 1, 4096]
    - [492, 0.0]
  - - [192, 12288, 1, 256]
    - [494, 0.0]
  - - [192, 12288, 1, 1024]
    - [495, 0.0]
  - - [192, 12288, 1, 4096]
    - [495, 0.0]
  - - [128, 16384, 1, 256]
    - [496, 0.0]
  - - [128, 16384, 1, 1024]
    - [493, 0.0]
  - - [128, 16384, 1, 4096]
    - [492, 0.0]
  - - [192, 16384, 1, 256]
    - [497, 0.0]
  - - [192, 16384, 1, 1024]
    - [498, 0.0]
  - - [192, 16384, 1, 4096]
    - [491, 0.0]
  - - [128, 20480, 1, 256]
    - [488, 0.0]
  - - [128, 20480, 1, 1024]
    - [488, 0.0]
  - - [128, 20480, 1, 4096]
    - [488, 0.0]
  - - [192, 20480, 1, 256]
    - [499, 0.0]
  - - [192, 20480, 1, 1024]
    - [500, 0.0]
  - - [192, 20480, 1, 4096]
    - [501, 0.0]
  - - [128, 24576, 1, 256]
    - [488, 0.0]
  - - [128, 24576, 1, 1024]
    - [488, 0.0]
  - - [128, 24576, 1, 4096]
    - [488, 0.0]
  - - [192, 24576, 1, 256]
    - [499, 0.0]
  - - [192, 24576, 1, 1024]
    - [500, 0.0]
  - - [192, 24576, 1, 4096]
    - [501, 0.0]
  - - [128, 32768, 1, 256]
    - [488, 0.0]
  - - [128, 32768, 1, 1024]
    - [488, 0.0]
  - - [128, 32768, 1, 4096]
    - [488, 0.0]
  - - [192, 32768, 1, 256]
    - [497, 0.0]
  - - [192, 32768, 1, 1024]
    - [502, 0.0]
  - - [192, 32768, 1, 4096]
    - [503, 0.0]
  - - [256, 8192, 1, 256]
    - [504, 0.0]
  - - [256, 8192, 1, 1024]
    - [505, 0.0]
  - - [256, 8192, 1, 4096]
    - [506, 0.0]
  - - [384, 8192, 1, 256]
    - [507, 0.0]
  - - [384, 8192, 1, 1024]
    - [507, 0.0]
  - - [384, 8192, 1, 4096]
    - [507, 0.0]
  - - [256, 12288, 1, 256]
    - [504, 0.0]
  - - [256, 12288, 1, 1024]
    - [505, 0.0]
  - - [256, 12288, 1, 4096]
    - [506, 0.0]
  - - [384, 12288, 1, 256]
    - [508, 0.0]
  - - [384, 12288, 1, 1024]
    - [509, 0.0]
  - - [384, 12288, 1, 4096]
    - [510, 0.0]
  - - [256, 16384, 1, 256]
    - [504, 0.0]
  - - [256, 16384, 1, 1024]
    - [505, 0.0]
  - - [256, 16384, 1, 4096]
    - [506, 0.0]
  - - [384, 16384, 1, 256]
    - [509, 0.0]
  - - [384, 16384, 1, 1024]
    - [509, 0.0]
  - - [384, 16384, 1, 4096]
    - [510, 0.0]
  - - [256, 20480, 1, 256]
    - [511, 0.0]
  - - [256, 20480, 1, 1024]
    - [511, 0.0]
  - - [256, 20480, 1, 4096]
    - [511, 0.0]
  - - [384, 20480, 1, 256]
    - [509, 0.0]
  - - [384, 20480, 1, 1024]
    - [509, 0.0]
  - - [384, 20480, 1, 4096]
    - [510, 0.0]
  - - [256, 24576, 1, 256]
    - [511, 0.0]
  - - [256, 24576, 1, 1024]
    - [511, 0.0]
  - - [256, 24576, 1, 4096]
    - [511, 0.0]
  - - [384, 24576, 1, 256]
    - [509, 0.0]
  - - [384, 24576, 1, 1024]
    - [509, 0.0]
  - - [384, 24576, 1, 4096]
    - [510, 0.0]
  - - [256, 32768, 1, 256]
    - [512, 0.0]
  - - [256, 32768, 1, 1024]
    - [513, 0.0]
  - - [256, 32768, 1, 4096]
    - [513, 0.0]
  - - [384, 32768, 1, 256]
    - [509, 0.0]
  - - [384, 32768, 1, 1024]
    - [509, 0.0]
  - - [384, 32768, 1, 4096]
    - [510, 0.0]
  - - [512, 8192, 1, 256]
    - [514, 0.0]
  - - [512, 8192, 1, 1024]
    - [475, 0.0]
  - - [512, 8192, 1, 4096]
    - [441, 0.0]
  - - [640, 8192, 1, 256]
    - [515, 0.0]
  - - [640, 8192, 1, 1024]
    - [516, 0.0]
  - - [640, 8192, 1, 4096]
    - [517, 0.0]
  - - [768, 8192, 1, 256]
    - [442, 0.0]
  - - [768, 8192, 1, 1024]
    - [443, 0.0]
  - - [768, 8192, 1, 4096]
    - [443, 0.0]
  - - [512, 12288, 1, 256]
    - [518, 0.0]
  - - [512, 12288, 1, 1024]
    - [475, 0.0]
  - - [512, 12288, 1, 4096]
    - [477, 0.0]
  - - [640, 12288, 1, 256]
    - [519, 0.0]
  - - [640, 12288, 1, 1024]
    - [516, 0.0]
  - - [640, 12288, 1, 4096]
    - [517, 0.0]
  - - [768, 12288, 1, 256]
    - [442, 0.0]
  - - [768, 12288, 1, 1024]
    - [443, 0.0]
  - - [768, 12288, 1, 4096]
    - [443, 0.0]
  - - [512, 16384, 1, 256]
    - [519, 0.0]
  - - [512, 16384, 1, 1024]
    - [475, 0.0]
  - - [512, 16384, 1, 4096]
    - [517, 0.0]
  - - [640, 16384, 1, 256]
    - [519, 0.0]
  - - [640, 16384, 1, 1024]
    - [516, 0.0]
  - - [640, 16384, 1, 4096]
    - [520, 0.0]
  - - [768, 16384, 1, 256]
    - [519, 0.0]
  - - [768, 16384, 1, 1024]
    - [443, 0.0]
  - - [768, 16384, 1, 4096]
    - [478, 0.0]
  - - [512, 20480, 1, 256]
    - [476, 0.0]
  - - [512, 20480, 1, 1024]
    - [477, 0.0]
  - - [512, 20480, 1, 4096]
    - [477, 0.0]
  - - [640, 20480, 1, 256]
    - [519, 0.0]
  - - [640, 20480, 1, 1024]
    - [521, 0.0]
  - - [640, 20480, 1, 4096]
    - [520, 0.0]
  - - [768, 20480, 1, 1024]
    - [443, 0.0]
  - - [512, 24576, 1, 256]
    - [519, 0.0]
  - - [512, 24576, 1, 1024]
    - [441, 0.0]
  - - [512, 24576, 1, 4096]
    - [441, 0.0]
  - - [640, 24576, 1, 1024]
    - [521, 0.0]
  - - [768, 24576, 1, 1024]
    - [443, 0.0]
  - - [512, 32768, 1, 1024]
    - [475, 0.0]
  - - [640, 32768, 1, 1024]
    - [516, 0.0]
  - - [768, 32768, 1, 1024]
    - [443, 0.0]
  - - [1024, 8192, 1, 256]
    - [476, 0.0]
  - - [1024, 8192, 1, 1024]
    - [475, 0.0]
  - - [1024, 8192, 1, 4096]
    - [475, 0.0]
  - - [1536, 8192, 1, 256]
    - [519, 0.0]
  - - [1536, 8192, 1, 1024]
    - [443, 0.0]
  - - [1536, 8192, 1, 4096]
    - [443, 0.0]
  - - [1024, 12288, 1, 256]
    - [519, 0.0]
  - - [1024, 12288, 1, 1024]
    - [475, 0.0]
  - - [1024, 12288, 1, 4096]
    - [441, 0.0]
  - - [1536, 12288, 1, 1024]
    - [443, 0.0]
  - - [1024, 16384, 1, 1024]
    - [475, 0.0]
  - - [1536, 16384, 1, 1024]
    - [443, 0.0]
  - - [1024, 20480, 1, 1024]
    - [475, 0.0]
  - - [1536, 20480, 1, 1024]
    - [443, 0.0]
  - - [1024, 24576, 1, 1024]
    - [475, 0.0]
  - - [1536, 24576, 1, 1024]
    - [443, 0.0]
  - - [1024, 32768, 1, 1024]
    - [475, 0.0]
  - - [1536, 32768, 1, 1024]
    - [443, 0.0]
  - - [2048, 8192, 1, 1024]
    - [443, 0.0]
  - - [3072, 8192, 1, 1024]
    - [443, 0.0]
  - - [2048, 12288, 1, 1024]
    - [443, 0.0]
  - - [3072, 12288, 1, 1024]
    - [443, 0.0]
  - - [2048, 16384, 1, 1024]
    - [443, 0.0]
  - - [3072, 16384, 1, 1024]
    - [522, 0.0]
  - - [2048, 20480, 1, 1024]
    - [443, 0.0]
  - - [3072, 20480, 1, 1024]
    - [443, 0.0]
  - - [2048, 24576, 1, 1024]
    - [443, 0.0]
  - - [3072, 24576, 1, 1024]
    - [443, 0.0]
  - - [2048, 32768, 1, 1024]
    - [443, 0.0]
  - - [3072, 32768, 1, 1024]
    - [443, 0.0]
  - - [4096, 8192, 1, 1024]
    - [443, 0.0]
  - - [6144, 8192, 1, 1024]
    - [443, 0.0]
  - - [4096, 12288, 1, 1024]
    - [443, 0.0]
  - - [6144, 12288, 1, 1024]
    - [443, 0.0]
  - - [4096, 16384, 1, 1024]
    - [443, 0.0]
  - - [6144, 16384, 1, 1024]
    - [443, 0.0]
  - - [4096, 20480, 1, 1024]
    - [443, 0.0]
  - - [6144, 20480, 1, 1024]
    - [443, 0.0]
  - - [4096, 24576, 1, 1024]
    - [443, 0.0]
  - - [6144, 24576, 1, 1024]
    - [443, 0.0]
  - - [4096, 32768, 1, 1024]
    - [443, 0.0]
  - - [6144, 32768, 1, 1024]
    - [443, 0.0]
  - - [8192, 8192, 1, 1024]
    - [443, 0.0]
  - - [12288, 8192, 1, 1024]
    - [443, 0.0]
  - - [16384, 8192, 1, 1024]
    - [443, 0.0]
  - - [20480, 8192, 1, 1024]
    - [443, 0.0]
  - - [24576, 8192, 1, 1024]
    - [443, 0.0]
  - - [32768, 8192, 1, 1024]
    - [443, 0.0]
  - - [8192, 12288, 1, 1024]
    - [443, 0.0]
  - - [12288, 12288, 1, 1024]
    - [443, 0.0]
  - - [16384, 12288, 1, 1024]
    - [443, 0.0]
  - - [20480, 12288, 1, 1024]
    - [443, 0.0]
  - - [8192, 16384, 1, 1024]
    - [443, 0.0]
  - - [12288, 16384, 1, 1024]
    - [443, 0.0]
  - - [16384, 16384, 1, 1024]
    - [443, 0.0]
  - - [8192, 20480, 1, 1024]
    - [443, 0.0]
  - - [12288, 20480, 1, 1024]
    - [443, 0.0]
  - - [8192, 24576, 1, 1024]
    - [443, 0.0]
  - - [8192, 32768, 1, 1024]
    - [443, 0.0]
- null
- null
- DeviceEfficiency
- GridBased
