tensilelite/try/yamlGen/tunning_BFVF_Round1/tunning_BFVF_Round1_20/3_LibraryLogic/aldebaran_Cijk_Ailk_Bljk_HHS_BH.yaml
- {MinimumRequiredVersion: 4.33.0}
- aldebaran
- gfx90a
- [Device 0050, Device 0051, Device 0052, Device 0054, Device 0062, Device 7400, Device
    SolutionIndex: 0
    SolutionNameMin: Cijk_Ailk_Bljk_HHS_BH_MT128x32x64_MI16x16x16x1_SN_1LDSB0_GRVW8_LPB16_LRVW8_MIWT2_2_PLR5_SS0_SRVW0_SVW4_VW1_WG64_4_1
    SolutionIndex: 1
    SolutionNameMin: Cijk_Ailk_Bljk_HHS_BH_MT128x32x16_MI16x16x16x1_SN_1LDSB0_GRVW2_LPB4_LRVW4_MIWT2_2_PLR1_SS0_SRVW4_SVW4_VW1_WG64_4_1
    SolutionIndex: 2
    SolutionNameMin: Cijk_Ailk_Bljk_HHS_BH_MT128x32x16_MI16x16x16x1_SN_1LDSB0_GRVW8_LPB8_LRVW4_MIWT2_2_PLR1_SS0_SRVW4_SVW4_VW1_WG64_4_1
    SolutionIndex: 3
    SolutionNameMin: Cijk_Ailk_Bljk_HHS_BH_MT128x32x32_MI16x16x16x1_SN_1LDSB0_GRVW8_LPB8_LRVW4_MIWT2_2_PLR3_SS0_SRVW4_SVW4_VW1_WG64_4_1
    SolutionIndex: 4
    SolutionNameMin: Cijk_Ailk_Bljk_HHS_BH_MT128x32x32_MI16x16x16x1_SN_1LDSB0_GRVW4_LPB4_LRVW4_MIWT2_2_PLR1_SS1_SRVW0_SVW2_VW2_WG64_4_1
    SolutionIndex: 5
    SolutionNameMin: Cijk_Ailk_Bljk_HHS_BH_MT128x32x32_MI16x16x16x1_SN_1LDSB0_GRVW8_LPB8_LRVW4_MIWT2_2_PLR1_SS1_SRVW0_SVW2_VW2_WG64_4_1
    SolutionIndex: 6
    SolutionNameMin: Cijk_Ailk_Bljk_HHS_BH_MT128x32x32_MI16x16x16x1_SN_1LDSB0_GRVW4_LPB4_LRVW4_MIWT2_2_PLR3_SS1_SRVW0_SVW2_VW2_WG64_4_1
    SolutionIndex: 7
    SolutionNameMin: Cijk_Ailk_Bljk_HHS_BH_MT128x32x32_MI16x16x16x1_SN_1LDSB0_GRVW8_LPB8_LRVW4_MIWT2_2_PLR3_SS1_SRVW0_SVW2_VW2_WG64_4_1
    SolutionIndex: 8
    SolutionNameMin: Cijk_Ailk_Bljk_HHS_BH_MT128x32x64_MI16x16x16x1_SN_1LDSB0_GRVW8_LPB16_LRVW8_MIWT2_2_PLR5_SS1_SRVW0_SVW2_VW2_WG64_4_1
- - - [1104, 1335, 1, 4608, 1104, 1104, 1104, 4608]
    - [3, 66613.8]
  - - [1104, 1408, 1, 4608, 1104, 1104, 1104, 4608]
    - [5, 69818.1]
  - - [4608, 1, 1, 320, 4608, 4608, 4608, 320]
    - [0, 385.602]
  - - [4608, 16, 1, 320, 4608, 4608, 4608, 320]
    - [8, 6030.84]
  - - [4608, 1335, 1, 320, 4608, 4608, 4608, 320]
    - [4, 64482.6]
  - - [4608, 1408, 1, 320, 4608, 4608, 4608, 320]
    - [1, 65337.6]
  - - [768, 1335, 1, 4608, 768, 768, 768, 4608]
    - [8, 62249.1]
  - - [768, 1408, 1, 4608, 768, 768, 768, 4608]
    - [8, 65924.0]
  - - [4608, 1, 1, 768, 4608, 4608, 4608, 768]
    - [0, 563.522]
  - - [4608, 16, 1, 768, 4608, 4608, 4608, 768]
    - [8, 8631.51]
  - - [4608, 1335, 1, 768, 4608, 4608, 4608, 768]
    - [4, 75975.5]
  - - [4608, 1408, 1, 768, 4608, 4608, 4608, 768]
    - [5, 74933.8]
  - - [320, 8192, 1, 320, 320, 320, 320, 320]
    - [5, 48544.9]
  - - [640, 2048, 1, 640, 640, 640, 640, 640]
    - [4, 62601.1]
  - - [320, 8192, 1, 1280, 320, 320, 320, 1280]
    - [5, 63138.3]
  - - [1280, 512, 1, 1280, 1280, 1280, 1280, 1280]
    - [4, 57868.0]
  - - [10240, 512, 1, 1280, 10240, 10240, 10240, 1280]
    - [6, 80342.4]
  - - [2560, 8192, 1, 320, 2560, 2560, 2560, 320]
    - [2, 71943.0]
  - - [5120, 2048, 1, 640, 5120, 5120, 5120, 640]
    - [7, 75593.0]
  - - [1280, 512, 1, 5120, 1280, 1280, 1280, 5120]
    - [4, 62498.5]
  - - [640, 2048, 1, 2560, 640, 640, 640, 2560]
    - [8, 76482.0]
  - - [320, 154, 1, 768, 320, 320, 320, 768]
    - [8, 6104.36]
  - - [1280, 154, 1, 768, 1280, 1280, 1280, 768]
    - [8, 25298.6]
- null
- null
- DeviceEfficiency
