library/src/amd_detail/rocblaslt/src/Tensile/Logic/asm_full/navi31/GridBased/navi31_Cijk_Alik_Bljk_HSS_BH_Bias_AH.yaml
- {MinimumRequiredVersion: 4.33.0}
- navi31
- gfx1100
- [Device 73f0]
    SolutionIndex: 0
    SolutionNameMin: Cijk_Alik_Bljk_HSS_BH_Bias_AH_MT64x64x32_MI16x16x16x1_SN_MIWT2_2_PLR3_WG32_4_1
    SolutionIndex: 1
    SolutionNameMin: Cijk_Alik_Bljk_HSS_BH_Bias_AH_MT64x32x32_MI16x16x16x1_SN_MIWT2_2_PLR3_WG32_2_1
    SolutionIndex: 2
    SolutionNameMin: Cijk_Alik_Bljk_HSS_BH_Bias_AH_MT32x32x32_MI16x16x16x1_SN_MIWT2_2_PLR3_WG16_2_1
    SolutionIndex: 3
    SolutionNameMin: Cijk_Alik_Bljk_HSS_BH_Bias_AH_MT32x64x32_MI16x16x16x1_SN_MIWT2_2_PLR3_WG16_4_1
    SolutionIndex: 4
    SolutionNameMin: Cijk_Alik_Bljk_HSS_BH_Bias_AH_MT32x32x32_MI16x16x16x1_SN_MIWT1_1_PLR3_WG32_4_1
    SolutionIndex: 5
    SolutionNameMin: Cijk_Alik_Bljk_HSS_BH_Bias_AH_MT16x16x32_MI16x16x16x1_SN_MIWT1_1_PLR3_WG16_2_1
    SolutionIndex: 6
    SolutionNameMin: Cijk_Alik_Bljk_HSS_BH_Bias_AH_MT32x16x32_MI16x16x16x1_SN_MIWT1_1_PLR3_WG32_2_1
    SolutionIndex: 7
    SolutionNameMin: Cijk_Alik_Bljk_HSS_BH_Bias_AH_MT16x32x32_MI16x16x16x1_SN_MIWT1_1_PLR3_WG16_4_1
    SolutionIndex: 8
    SolutionNameMin: Cijk_Alik_Bljk_HSS_BH_Bias_AH_MT64x16x32_MI16x16x16x1_SN_MIWT4_1_PLR3_WG16_2_1
    SolutionIndex: 9
    SolutionNameMin: Cijk_Alik_Bljk_HSS_BH_Bias_AH_MT64x64x32_MI16x16x16x1_SN_MIWT4_1_PLR3_WG16_8_1
    SolutionIndex: 10
    SolutionNameMin: Cijk_Alik_Bljk_HSS_BH_Bias_AH_MT16x64x32_MI16x16x16x1_SN_MIWT1_4_PLR3_WG16_2_1
    SolutionIndex: 11
    SolutionNameMin: Cijk_Alik_Bljk_HSS_BH_Bias_AH_MT64x64x32_MI16x16x16x1_SN_MIWT1_4_PLR3_WG64_2_1
    SolutionIndex: 12
    SolutionNameMin: Cijk_Alik_Bljk_HSS_BH_Bias_AH_MT64x32x64_MI16x16x16x1_SN_MIWT2_2_PLR5_WG32_2_1
    SolutionIndex: 13
    SolutionNameMin: Cijk_Alik_Bljk_HSS_BH_Bias_AH_MT32x32x64_MI16x16x16x1_SN_MIWT2_2_PLR5_WG16_2_1
    SolutionIndex: 14
    SolutionNameMin: Cijk_Alik_Bljk_HSS_BH_Bias_AH_MT32x64x64_MI16x16x16x1_SN_MIWT2_2_PLR5_WG16_4_1
    SolutionIndex: 15
    SolutionNameMin: Cijk_Alik_Bljk_HSS_BH_Bias_AH_MT32x32x64_MI16x16x16x1_SN_MIWT1_1_PLR5_WG32_4_1
    SolutionIndex: 16
    SolutionNameMin: Cijk_Alik_Bljk_HSS_BH_Bias_AH_MT16x16x64_MI16x16x16x1_SN_MIWT1_1_PLR5_WG16_2_1
    SolutionIndex: 17
    SolutionNameMin: Cijk_Alik_Bljk_HSS_BH_Bias_AH_MT32x16x64_MI16x16x16x1_SN_MIWT1_1_PLR5_WG32_2_1
    SolutionIndex: 18
    SolutionNameMin: Cijk_Alik_Bljk_HSS_BH_Bias_AH_MT16x32x64_MI16x16x16x1_SN_MIWT1_1_PLR5_WG16_4_1
- - - [64, 64, 1, 64, 64, 64, 64, 64]
    - [5, 64.3452]
  - - [128, 64, 1, 64, 128, 128, 64, 64]
    - [5, 129.325]
  - - [192, 64, 1, 64, 192, 192, 64, 64]
    - [7, 192.469]
  - - [256, 64, 1, 64, 256, 256, 64, 64]
    - [5, 255.998]
  - - [320, 64, 1, 64, 320, 320, 64, 64]
    - [5, 314.171]
  - - [384, 64, 1, 64, 384, 384, 64, 64]
    - [7, 373.509]
  - - [448, 64, 1, 64, 448, 448, 64, 64]
    - [16, 431.965]
  - - [512, 64, 1, 64, 512, 512, 64, 64]
    - [6, 454.813]
  - - [576, 64, 1, 64, 576, 576, 64, 64]
    - [18, 518.065]
  - - [640, 64, 1, 64, 640, 640, 64, 64]
    - [5, 561.571]
  - - [704, 64, 1, 64, 704, 704, 64, 64]
    - [17, 673.727]
  - - [768, 64, 1, 64, 768, 768, 64, 64]
    - [7, 725.821]
  - - [832, 64, 1, 64, 832, 832, 64, 64]
    - [7, 727.082]
  - - [896, 64, 1, 64, 896, 896, 64, 64]
    - [5, 785.026]
  - - [960, 64, 1, 64, 960, 960, 64, 64]
    - [3, 816.644]
  - - [1024, 64, 1, 64, 1024, 1024, 64, 64]
    - [1, 880.592]
  - - [1088, 64, 1, 64, 1088, 1088, 64, 64]
    - [18, 979.644]
  - - [1152, 64, 1, 64, 1152, 1152, 64, 64]
    - [17, 1004.38]
  - - [1216, 64, 1, 64, 1216, 1216, 64, 64]
    - [18, 1041.55]
  - - [1280, 64, 1, 64, 1280, 1280, 64, 64]
    - [15, 1149.75]
  - - [1344, 64, 1, 64, 1344, 1344, 64, 64]
    - [17, 1163.61]
  - - [1408, 64, 1, 64, 1408, 1408, 64, 64]
    - [7, 1201.74]
  - - [1472, 64, 1, 64, 1472, 1472, 64, 64]
    - [3, 1247.52]
  - - [1536, 64, 1, 64, 1536, 1536, 64, 64]
    - [4, 1381.51]
  - - [1600, 64, 1, 64, 1600, 1600, 64, 64]
    - [16, 1397.05]
  - - [1664, 64, 1, 64, 1664, 1664, 64, 64]
    - [4, 1451.38]
  - - [1728, 64, 1, 64, 1728, 1728, 64, 64]
    - [4, 1528.69]
  - - [1792, 64, 1, 64, 1792, 1792, 64, 64]
    - [18, 1568.04]
  - - [1856, 64, 1, 64, 1856, 1856, 64, 64]
    - [18, 1568.1]
  - - [1920, 64, 1, 64, 1920, 1920, 64, 64]
    - [4, 1745.3]
  - - [1984, 64, 1, 64, 1984, 1984, 64, 64]
    - [2, 1674.86]
  - - [2048, 64, 1, 64, 2048, 2048, 64, 64]
    - [0, 1727.1]
  - - [2112, 64, 1, 64, 2112, 2112, 64, 64]
    - [2, 1779.61]
  - - [2176, 64, 1, 64, 2176, 2176, 64, 64]
    - [7, 1822.29]
  - - [2240, 64, 1, 64, 2240, 2240, 64, 64]
    - [18, 1890.58]
  - - [2304, 64, 1, 64, 2304, 2304, 64, 64]
    - [6, 2030.8]
  - - [2368, 64, 1, 64, 2368, 2368, 64, 64]
    - [18, 2060.16]
  - - [2432, 64, 1, 64, 2432, 2432, 64, 64]
    - [5, 2104.22]
  - - [2496, 64, 1, 64, 2496, 2496, 64, 64]
    - [5, 2040.63]
  - - [2560, 64, 1, 64, 2560, 2560, 64, 64]
    - [12, 2092.95]
  - - [2624, 64, 1, 64, 2624, 2624, 64, 64]
    - [2, 2106.18]
  - - [2688, 64, 1, 64, 2688, 2688, 64, 64]
    - [17, 2175.89]
  - - [2752, 64, 1, 64, 2752, 2752, 64, 64]
    - [17, 2239.65]
  - - [2816, 64, 1, 64, 2816, 2816, 64, 64]
    - [18, 2247.93]
  - - [2880, 64, 1, 64, 2880, 2880, 64, 64]
    - [9, 2283.92]
  - - [2944, 64, 1, 64, 2944, 2944, 64, 64]
    - [7, 2412.21]
  - - [3008, 64, 1, 64, 3008, 3008, 64, 64]
    - [10, 2402.17]
  - - [3072, 64, 1, 64, 3072, 3072, 64, 64]
    - [7, 2453.74]
  - - [3136, 64, 1, 64, 3136, 3136, 64, 64]
    - [18, 2533.52]
  - - [3200, 64, 1, 64, 3200, 3200, 64, 64]
    - [8, 2481.45]
  - - [3264, 64, 1, 64, 3264, 3264, 64, 64]
    - [17, 2551.37]
  - - [3328, 64, 1, 64, 3328, 3328, 64, 64]
    - [7, 2591.51]
  - - [3392, 64, 1, 64, 3392, 3392, 64, 64]
    - [17, 2617.46]
  - - [3456, 64, 1, 64, 3456, 3456, 64, 64]
    - [18, 2670.37]
  - - [3520, 64, 1, 64, 3520, 3520, 64, 64]
    - [1, 2713.2]
  - - [3584, 64, 1, 64, 3584, 3584, 64, 64]
    - [18, 2788.74]
  - - [3648, 64, 1, 64, 3648, 3648, 64, 64]
    - [17, 2793.95]
  - - [3712, 64, 1, 64, 3712, 3712, 64, 64]
    - [6, 2898.8]
  - - [3776, 64, 1, 64, 3776, 3776, 64, 64]
    - [5, 2916.54]
  - - [3840, 64, 1, 64, 3840, 3840, 64, 64]
    - [4, 3046.4]
  - - [3904, 64, 1, 64, 3904, 3904, 64, 64]
    - [14, 3029.68]
  - - [3968, 64, 1, 64, 3968, 3968, 64, 64]
    - [7, 3161.4]
  - - [4032, 64, 1, 64, 4032, 4032, 64, 64]
    - [18, 3054.37]
  - - [4096, 64, 1, 64, 4096, 4096, 64, 64]
    - [5, 3095.98]
  - - [64, 128, 1, 64, 64, 64, 64, 64]
    - [4, 106.409]
  - - [128, 128, 1, 64, 128, 128, 64, 64]
    - [0, 214.696]
  - - [192, 128, 1, 64, 192, 192, 64, 64]
    - [7, 323.763]
  - - [256, 128, 1, 64, 256, 256, 64, 64]
    - [15, 424.783]
  - - [320, 128, 1, 64, 320, 320, 64, 64]
    - [5, 597.408]
  - - [384, 128, 1, 64, 384, 384, 64, 64]
    - [5, 647.799]
  - - [448, 128, 1, 64, 448, 448, 64, 64]
    - [6, 762.359]
  - - [512, 128, 1, 64, 512, 512, 64, 64]
    - [2, 863.194]
  - - [576, 128, 1, 64, 576, 576, 64, 64]
    - [15, 1007.15]
  - - [640, 128, 1, 64, 640, 640, 64, 64]
    - [9, 1059.16]
  - - [704, 128, 1, 64, 704, 704, 64, 64]
    - [7, 1139.52]
  - - [768, 128, 1, 64, 768, 768, 64, 64]
    - [12, 1265.37]
  - - [832, 128, 1, 64, 832, 832, 64, 64]
    - [4, 1393.23]
  - - [896, 128, 1, 64, 896, 896, 64, 64]
    - [5, 1565.03]
  - - [960, 128, 1, 64, 960, 960, 64, 64]
    - [17, 1657.72]
  - - [1024, 128, 1, 64, 1024, 1024, 64, 64]
    - [5, 1708.81]
  - - [1088, 128, 1, 64, 1088, 1088, 64, 64]
    - [5, 1782.57]
  - - [1152, 128, 1, 64, 1152, 1152, 64, 64]
    - [4, 1908.03]
  - - [1216, 128, 1, 64, 1216, 1216, 64, 64]
    - [5, 2020.99]
  - - [1280, 128, 1, 64, 1280, 1280, 64, 64]
    - [15, 2124.75]
  - - [1344, 128, 1, 64, 1344, 1344, 64, 64]
    - [18, 2317.89]
  - - [1408, 128, 1, 64, 1408, 1408, 64, 64]
    - [15, 2385.58]
  - - [1472, 128, 1, 64, 1472, 1472, 64, 64]
    - [13, 2388.3]
  - - [1536, 128, 1, 64, 1536, 1536, 64, 64]
    - [18, 2532.78]
  - - [1600, 128, 1, 64, 1600, 1600, 64, 64]
    - [18, 2643.62]
  - - [1664, 128, 1, 64, 1664, 1664, 64, 64]
    - [7, 2875.22]
  - - [1728, 128, 1, 64, 1728, 1728, 64, 64]
    - [6, 2975.76]
  - - [1792, 128, 1, 64, 1792, 1792, 64, 64]
    - [7, 3070.47]
  - - [1856, 128, 1, 64, 1856, 1856, 64, 64]
    - [7, 3134.92]
  - - [1920, 128, 1, 64, 1920, 1920, 64, 64]
    - [6, 3233.0]
  - - [1984, 128, 1, 64, 1984, 1984, 64, 64]
    - [7, 3292.7]
  - - [2048, 128, 1, 64, 2048, 2048, 64, 64]
    - [7, 3361.48]
  - - [2112, 128, 1, 64, 2112, 2112, 64, 64]
    - [7, 3470.68]
  - - [2176, 128, 1, 64, 2176, 2176, 64, 64]
    - [7, 3536.85]
  - - [2240, 128, 1, 64, 2240, 2240, 64, 64]
    - [7, 3620.74]
  - - [2304, 128, 1, 64, 2304, 2304, 64, 64]
    - [6, 3710.28]
  - - [2368, 128, 1, 64, 2368, 2368, 64, 64]
    - [7, 3776.22]
  - - [2432, 128, 1, 64, 2432, 2432, 64, 64]
    - [4, 3775.39]
  - - [2496, 128, 1, 64, 2496, 2496, 64, 64]
    - [6, 3908.82]
  - - [2560, 128, 1, 64, 2560, 2560, 64, 64]
    - [4, 3961.34]
  - - [2624, 128, 1, 64, 2624, 2624, 64, 64]
    - [4, 4076.54]
  - - [2688, 128, 1, 64, 2688, 2688, 64, 64]
    - [7, 4152.35]
  - - [2752, 128, 1, 64, 2752, 2752, 64, 64]
    - [7, 4191.15]
  - - [2816, 128, 1, 64, 2816, 2816, 64, 64]
    - [4, 4259.36]
  - - [2880, 128, 1, 64, 2880, 2880, 64, 64]
    - [4, 4354.51]
  - - [2944, 128, 1, 64, 2944, 2944, 64, 64]
    - [4, 4405.74]
  - - [3008, 128, 1, 64, 3008, 3008, 64, 64]
    - [4, 4494.15]
  - - [3072, 128, 1, 64, 3072, 3072, 64, 64]
    - [7, 4535.2]
  - - [3136, 128, 1, 64, 3136, 3136, 64, 64]
    - [4, 4589.12]
  - - [3200, 128, 1, 64, 3200, 3200, 64, 64]
    - [4, 4661.15]
  - - [3264, 128, 1, 64, 3264, 3264, 64, 64]
    - [4, 4707.49]
  - - [3328, 128, 1, 64, 3328, 3328, 64, 64]
    - [4, 4777.07]
  - - [3392, 128, 1, 64, 3392, 3392, 64, 64]
    - [4, 4879.2]
  - - [3456, 128, 1, 64, 3456, 3456, 64, 64]
    - [4, 4951.26]
  - - [3520, 128, 1, 64, 3520, 3520, 64, 64]
    - [7, 4855.32]
  - - [3584, 128, 1, 64, 3584, 3584, 64, 64]
    - [3, 4925.31]
  - - [3648, 128, 1, 64, 3648, 3648, 64, 64]
    - [3, 5009.1]
  - - [3712, 128, 1, 64, 3712, 3712, 64, 64]
    - [3, 5053.78]
  - - [3776, 128, 1, 64, 3776, 3776, 64, 64]
    - [3, 5083.44]
  - - [3840, 128, 1, 64, 3840, 3840, 64, 64]
    - [3, 5185.79]
  - - [3904, 128, 1, 64, 3904, 3904, 64, 64]
    - [1, 5220.59]
  - - [3968, 128, 1, 64, 3968, 3968, 64, 64]
    - [3, 5304.44]
  - - [4032, 128, 1, 64, 4032, 4032, 64, 64]
    - [1, 5323.13]
  - - [4096, 128, 1, 64, 4096, 4096, 64, 64]
    - [0, 5376.39]
  - - [64, 192, 1, 64, 64, 64, 64, 64]
    - [16, 168.725]
  - - [128, 192, 1, 64, 128, 128, 64, 64]
    - [15, 320.208]
  - - [192, 192, 1, 64, 192, 192, 64, 64]
    - [4, 504.981]
  - - [256, 192, 1, 64, 256, 256, 64, 64]
    - [6, 646.996]
  - - [320, 192, 1, 64, 320, 320, 64, 64]
    - [7, 807.251]
  - - [384, 192, 1, 64, 384, 384, 64, 64]
    - [5, 1009.76]
  - - [448, 192, 1, 64, 448, 448, 64, 64]
    - [18, 1115.26]
  - - [512, 192, 1, 64, 512, 512, 64, 64]
    - [17, 1258.02]
  - - [576, 192, 1, 64, 576, 576, 64, 64]
    - [18, 1465.39]
  - - [640, 192, 1, 64, 640, 640, 64, 64]
    - [0, 1535.09]
  - - [704, 192, 1, 64, 704, 704, 64, 64]
    - [18, 1842.53]
  - - [768, 192, 1, 64, 768, 768, 64, 64]
    - [7, 1848.61]
  - - [832, 192, 1, 64, 832, 832, 64, 64]
    - [7, 2001.45]
  - - [896, 192, 1, 64, 896, 896, 64, 64]
    - [4, 2154.59]
  - - [960, 192, 1, 64, 960, 960, 64, 64]
    - [17, 2296.79]
  - - [1024, 192, 1, 64, 1024, 1024, 64, 64]
    - [15, 2432.41]
  - - [1088, 192, 1, 64, 1088, 1088, 64, 64]
    - [12, 2644.76]
  - - [1152, 192, 1, 64, 1152, 1152, 64, 64]
    - [6, 2893.04]
  - - [1216, 192, 1, 64, 1216, 1216, 64, 64]
    - [6, 3025.96]
  - - [1280, 192, 1, 64, 1280, 1280, 64, 64]
    - [6, 3157.7]
  - - [1344, 192, 1, 64, 1344, 1344, 64, 64]
    - [2, 3175.33]
  - - [1408, 192, 1, 64, 1408, 1408, 64, 64]
    - [4, 3341.96]
  - - [1472, 192, 1, 64, 1472, 1472, 64, 64]
    - [0, 3434.82]
  - - [1536, 192, 1, 64, 1536, 1536, 64, 64]
    - [6, 3656.37]
  - - [1600, 192, 1, 64, 1600, 1600, 64, 64]
    - [4, 3796.97]
  - - [1664, 192, 1, 64, 1664, 1664, 64, 64]
    - [7, 3925.35]
  - - [1728, 192, 1, 64, 1728, 1728, 64, 64]
    - [7, 4034.48]
  - - [1792, 192, 1, 64, 1792, 1792, 64, 64]
    - [6, 4120.49]
  - - [1856, 192, 1, 64, 1856, 1856, 64, 64]
    - [7, 4225.74]
  - - [1920, 192, 1, 64, 1920, 1920, 64, 64]
    - [7, 4348.91]
  - - [1984, 192, 1, 64, 1984, 1984, 64, 64]
    - [4, 4456.89]
  - - [2048, 192, 1, 64, 2048, 2048, 64, 64]
    - [7, 4563.14]
  - - [2112, 192, 1, 64, 2112, 2112, 64, 64]
    - [4, 4610.41]
  - - [2176, 192, 1, 64, 2176, 2176, 64, 64]
    - [4, 4725.8]
  - - [2240, 192, 1, 64, 2240, 2240, 64, 64]
    - [4, 4844.22]
  - - [2304, 192, 1, 64, 2304, 2304, 64, 64]
    - [4, 4921.16]
  - - [2368, 192, 1, 64, 2368, 2368, 64, 64]
    - [4, 4858.53]
  - - [2432, 192, 1, 64, 2432, 2432, 64, 64]
    - [4, 4916.82]
  - - [2496, 192, 1, 64, 2496, 2496, 64, 64]
    - [3, 5113.49]
  - - [2560, 192, 1, 64, 2560, 2560, 64, 64]
    - [1, 5193.5]
  - - [2624, 192, 1, 64, 2624, 2624, 64, 64]
    - [3, 5238.62]
  - - [2688, 192, 1, 64, 2688, 2688, 64, 64]
    - [1, 5285.63]
  - - [2752, 192, 1, 64, 2752, 2752, 64, 64]
    - [3, 5419.28]
  - - [2816, 192, 1, 64, 2816, 2816, 64, 64]
    - [1, 5494.26]
  - - [2880, 192, 1, 64, 2880, 2880, 64, 64]
    - [3, 5590.7]
  - - [2944, 192, 1, 64, 2944, 2944, 64, 64]
    - [3, 5658.6]
  - - [3008, 192, 1, 64, 3008, 3008, 64, 64]
    - [1, 5737.66]
  - - [3072, 192, 1, 64, 3072, 3072, 64, 64]
    - [3, 5829.9]
  - - [3136, 192, 1, 64, 3136, 3136, 64, 64]
    - [3, 5867.93]
  - - [3200, 192, 1, 64, 3200, 3200, 64, 64]
    - [3, 5943.39]
  - - [3264, 192, 1, 64, 3264, 3264, 64, 64]
    - [3, 5981.79]
  - - [3328, 192, 1, 64, 3328, 3328, 64, 64]
    - [3, 6076.42]
  - - [3392, 192, 1, 64, 3392, 3392, 64, 64]
    - [3, 6124.99]
  - - [3456, 192, 1, 64, 3456, 3456, 64, 64]
    - [3, 6236.92]
  - - [3520, 192, 1, 64, 3520, 3520, 64, 64]
    - [3, 6348.66]
  - - [3584, 192, 1, 64, 3584, 3584, 64, 64]
    - [3, 6455.59]
  - - [3648, 192, 1, 64, 3648, 3648, 64, 64]
    - [3, 6545.92]
  - - [3712, 192, 1, 64, 3712, 3712, 64, 64]
    - [3, 6616.27]
  - - [3776, 192, 1, 64, 3776, 3776, 64, 64]
    - [1, 6673.3]
  - - [3840, 192, 1, 64, 3840, 3840, 64, 64]
    - [3, 6786.39]
  - - [3904, 192, 1, 64, 3904, 3904, 64, 64]
    - [3, 6838.47]
  - - [3968, 192, 1, 64, 3968, 3968, 64, 64]
    - [3, 6881.9]
  - - [4032, 192, 1, 64, 4032, 4032, 64, 64]
    - [3, 6984.1]
  - - [4096, 192, 1, 64, 4096, 4096, 64, 64]
    - [1, 6990.46]
  - - [64, 256, 1, 64, 64, 64, 64, 64]
    - [16, 217.545]
  - - [128, 256, 1, 64, 128, 128, 64, 64]
    - [5, 442.804]
  - - [192, 256, 1, 64, 192, 192, 64, 64]
    - [7, 618.863]
  - - [256, 256, 1, 64, 256, 256, 64, 64]
    - [17, 881.707]
  - - [320, 256, 1, 64, 320, 320, 64, 64]
    - [4, 1072.59]
  - - [384, 256, 1, 64, 384, 384, 64, 64]
    - [4, 1265.35]
  - - [448, 256, 1, 64, 448, 448, 64, 64]
    - [16, 1430.24]
  - - [512, 256, 1, 64, 512, 512, 64, 64]
    - [4, 1625.7]
  - - [576, 256, 1, 64, 576, 576, 64, 64]
    - [18, 1859.53]
  - - [640, 256, 1, 64, 640, 640, 64, 64]
    - [15, 2053.19]
  - - [704, 256, 1, 64, 704, 704, 64, 64]
    - [4, 2239.22]
  - - [768, 256, 1, 64, 768, 768, 64, 64]
    - [18, 2471.09]
  - - [832, 256, 1, 64, 832, 832, 64, 64]
    - [4, 2744.41]
  - - [896, 256, 1, 64, 896, 896, 64, 64]
    - [4, 2822.52]
  - - [960, 256, 1, 64, 960, 960, 64, 64]
    - [7, 2907.84]
  - - [1024, 256, 1, 64, 1024, 1024, 64, 64]
    - [1, 3233.2]
  - - [1088, 256, 1, 64, 1088, 1088, 64, 64]
    - [7, 3355.08]
  - - [1152, 256, 1, 64, 1152, 1152, 64, 64]
    - [4, 3516.71]
  - - [1216, 256, 1, 64, 1216, 1216, 64, 64]
    - [6, 3574.89]
  - - [1280, 256, 1, 64, 1280, 1280, 64, 64]
    - [2, 3719.0]
  - - [1344, 256, 1, 64, 1344, 1344, 64, 64]
    - [6, 3956.14]
  - - [1408, 256, 1, 64, 1408, 1408, 64, 64]
    - [8, 4000.81]
  - - [1472, 256, 1, 64, 1472, 1472, 64, 64]
    - [4, 4234.05]
  - - [1536, 256, 1, 64, 1536, 1536, 64, 64]
    - [6, 4375.87]
  - - [1600, 256, 1, 64, 1600, 1600, 64, 64]
    - [1, 4517.35]
  - - [1664, 256, 1, 64, 1664, 1664, 64, 64]
    - [7, 4629.44]
  - - [1728, 256, 1, 64, 1728, 1728, 64, 64]
    - [2, 4777.45]
  - - [1792, 256, 1, 64, 1792, 1792, 64, 64]
    - [1, 4922.03]
  - - [1856, 256, 1, 64, 1856, 1856, 64, 64]
    - [1, 5057.14]
  - - [1920, 256, 1, 64, 1920, 1920, 64, 64]
    - [3, 5173.83]
  - - [1984, 256, 1, 64, 1984, 1984, 64, 64]
    - [1, 5255.55]
  - - [2048, 256, 1, 64, 2048, 2048, 64, 64]
    - [1, 5381.6]
  - - [2112, 256, 1, 64, 2112, 2112, 64, 64]
    - [1, 5514.38]
  - - [2176, 256, 1, 64, 2176, 2176, 64, 64]
    - [1, 5609.98]
  - - [2240, 256, 1, 64, 2240, 2240, 64, 64]
    - [3, 5720.08]
  - - [2304, 256, 1, 64, 2304, 2304, 64, 64]
    - [1, 5831.68]
  - - [2368, 256, 1, 64, 2368, 2368, 64, 64]
    - [3, 5882.77]
  - - [2432, 256, 1, 64, 2432, 2432, 64, 64]
    - [1, 5989.12]
  - - [2496, 256, 1, 64, 2496, 2496, 64, 64]
    - [3, 6084.54]
  - - [2560, 256, 1, 64, 2560, 2560, 64, 64]
    - [3, 6179.89]
  - - [2624, 256, 1, 64, 2624, 2624, 64, 64]
    - [3, 6301.86]
  - - [2688, 256, 1, 64, 2688, 2688, 64, 64]
    - [7, 6456.49]
  - - [2752, 256, 1, 64, 2752, 2752, 64, 64]
    - [3, 6568.83]
  - - [2816, 256, 1, 64, 2816, 2816, 64, 64]
    - [7, 6601.38]
  - - [2880, 256, 1, 64, 2880, 2880, 64, 64]
    - [3, 6774.7]
  - - [2944, 256, 1, 64, 2944, 2944, 64, 64]
    - [7, 6841.72]
  - - [3008, 256, 1, 64, 3008, 3008, 64, 64]
    - [3, 6963.79]
  - - [3072, 256, 1, 64, 3072, 3072, 64, 64]
    - [3, 6980.76]
  - - [3136, 256, 1, 64, 3136, 3136, 64, 64]
    - [7, 7095.61]
  - - [3200, 256, 1, 64, 3200, 3200, 64, 64]
    - [7, 7273.65]
  - - [3264, 256, 1, 64, 3264, 3264, 64, 64]
    - [7, 7345.79]
  - - [3328, 256, 1, 64, 3328, 3328, 64, 64]
    - [7, 7379.32]
  - - [3392, 256, 1, 64, 3392, 3392, 64, 64]
    - [4, 7501.91]
  - - [3456, 256, 1, 64, 3456, 3456, 64, 64]
    - [7, 7591.2]
  - - [3520, 256, 1, 64, 3520, 3520, 64, 64]
    - [4, 7655.74]
  - - [3584, 256, 1, 64, 3584, 3584, 64, 64]
    - [6, 7649.78]
  - - [3648, 256, 1, 64, 3648, 3648, 64, 64]
    - [7, 7867.35]
  - - [3712, 256, 1, 64, 3712, 3712, 64, 64]
    - [7, 7923.01]
  - - [3776, 256, 1, 64, 3776, 3776, 64, 64]
    - [6, 7649.06]
  - - [3840, 256, 1, 64, 3840, 3840, 64, 64]
    - [6, 7973.91]
  - - [3904, 256, 1, 64, 3904, 3904, 64, 64]
    - [7, 9588.2]
  - - [3968, 256, 1, 64, 3968, 3968, 64, 64]
    - [4, 9776.12]
  - - [4032, 256, 1, 64, 4032, 4032, 64, 64]
    - [4, 9869.95]
  - - [4096, 256, 1, 64, 4096, 4096, 64, 64]
    - [4, 9845.71]
  - - [64, 320, 1, 64, 64, 64, 64, 64]
    - [15, 284.815]
  - - [128, 320, 1, 64, 128, 128, 64, 64]
    - [18, 566.18]
  - - [192, 320, 1, 64, 192, 192, 64, 64]
    - [16, 856.111]
  - - [256, 320, 1, 64, 256, 256, 64, 64]
    - [18, 1075.68]
  - - [320, 320, 1, 64, 320, 320, 64, 64]
    - [7, 1393.2]
  - - [384, 320, 1, 64, 384, 384, 64, 64]
    - [18, 1763.28]
  - - [448, 320, 1, 64, 448, 448, 64, 64]
    - [15, 1998.9]
  - - [512, 320, 1, 64, 512, 512, 64, 64]
    - [6, 2230.51]
  - - [576, 320, 1, 64, 576, 576, 64, 64]
    - [7, 2539.59]
  - - [640, 320, 1, 64, 640, 640, 64, 64]
    - [18, 2769.31]
  - - [704, 320, 1, 64, 704, 704, 64, 64]
    - [5, 3049.44]
  - - [768, 320, 1, 64, 768, 768, 64, 64]
    - [6, 3243.67]
  - - [832, 320, 1, 64, 832, 832, 64, 64]
    - [9, 3514.68]
  - - [896, 320, 1, 64, 896, 896, 64, 64]
    - [15, 3635.8]
  - - [960, 320, 1, 64, 960, 960, 64, 64]
    - [12, 3940.0]
  - - [1024, 320, 1, 64, 1024, 1024, 64, 64]
    - [0, 3940.52]
  - - [1088, 320, 1, 64, 1088, 1088, 64, 64]
    - [7, 4012.63]
  - - [1152, 320, 1, 64, 1152, 1152, 64, 64]
    - [3, 4182.37]
  - - [1216, 320, 1, 64, 1216, 1216, 64, 64]
    - [6, 4387.54]
  - - [1280, 320, 1, 64, 1280, 1280, 64, 64]
    - [7, 4518.13]
  - - [1344, 320, 1, 64, 1344, 1344, 64, 64]
    - [4, 4729.38]
  - - [1408, 320, 1, 64, 1408, 1408, 64, 64]
    - [7, 4869.23]
  - - [1472, 320, 1, 64, 1472, 1472, 64, 64]
    - [1, 5005.24]
  - - [1536, 320, 1, 64, 1536, 1536, 64, 64]
    - [1, 5176.41]
  - - [1600, 320, 1, 64, 1600, 1600, 64, 64]
    - [3, 5294.51]
  - - [1664, 320, 1, 64, 1664, 1664, 64, 64]
    - [3, 5508.94]
  - - [1728, 320, 1, 64, 1728, 1728, 64, 64]
    - [3, 5644.23]
  - - [1792, 320, 1, 64, 1792, 1792, 64, 64]
    - [3, 5786.8]
  - - [1856, 320, 1, 64, 1856, 1856, 64, 64]
    - [3, 5878.53]
  - - [1920, 320, 1, 64, 1920, 1920, 64, 64]
    - [3, 6005.09]
  - - [1984, 320, 1, 64, 1984, 1984, 64, 64]
    - [1, 6105.51]
  - - [2048, 320, 1, 64, 2048, 2048, 64, 64]
    - [1, 6230.35]
  - - [2112, 320, 1, 64, 2112, 2112, 64, 64]
    - [1, 6398.46]
  - - [2176, 320, 1, 64, 2176, 2176, 64, 64]
    - [7, 6542.97]
  - - [2240, 320, 1, 64, 2240, 2240, 64, 64]
    - [1, 6648.51]
  - - [2304, 320, 1, 64, 2304, 2304, 64, 64]
    - [7, 6764.96]
  - - [2368, 320, 1, 64, 2368, 2368, 64, 64]
    - [7, 6876.96]
  - - [2432, 320, 1, 64, 2432, 2432, 64, 64]
    - [7, 6965.02]
  - - [2496, 320, 1, 64, 2496, 2496, 64, 64]
    - [7, 7179.48]
  - - [2560, 320, 1, 64, 2560, 2560, 64, 64]
    - [7, 7187.89]
  - - [2624, 320, 1, 64, 2624, 2624, 64, 64]
    - [7, 7412.3]
  - - [2688, 320, 1, 64, 2688, 2688, 64, 64]
    - [4, 7485.68]
  - - [2752, 320, 1, 64, 2752, 2752, 64, 64]
    - [4, 7668.08]
  - - [2816, 320, 1, 64, 2816, 2816, 64, 64]
    - [7, 7639.62]
  - - [2880, 320, 1, 64, 2880, 2880, 64, 64]
    - [7, 7799.79]
  - - [2944, 320, 1, 64, 2944, 2944, 64, 64]
    - [7, 7948.94]
  - - [3008, 320, 1, 64, 3008, 3008, 64, 64]
    - [7, 8007.73]
  - - [3072, 320, 1, 64, 3072, 3072, 64, 64]
    - [6, 7904.73]
  - - [3136, 320, 1, 64, 3136, 3136, 64, 64]
    - [9, 8498.72]
  - - [3200, 320, 1, 64, 3200, 3200, 64, 64]
    - [4, 9887.67]
  - - [3264, 320, 1, 64, 3264, 3264, 64, 64]
    - [4, 10020.5]
  - - [3328, 320, 1, 64, 3328, 3328, 64, 64]
    - [4, 10040.8]
  - - [3392, 320, 1, 64, 3392, 3392, 64, 64]
    - [4, 10097.0]
  - - [3456, 320, 1, 64, 3456, 3456, 64, 64]
    - [4, 10375.0]
  - - [3520, 320, 1, 64, 3520, 3520, 64, 64]
    - [4, 10413.1]
  - - [3584, 320, 1, 64, 3584, 3584, 64, 64]
    - [4, 10496.1]
  - - [3648, 320, 1, 64, 3648, 3648, 64, 64]
    - [4, 10749.7]
  - - [3712, 320, 1, 64, 3712, 3712, 64, 64]
    - [4, 10866.3]
  - - [3776, 320, 1, 64, 3776, 3776, 64, 64]
    - [3, 10676.8]
  - - [3840, 320, 1, 64, 3840, 3840, 64, 64]
    - [4, 11008.3]
  - - [3904, 320, 1, 64, 3904, 3904, 64, 64]
    - [4, 11149.5]
  - - [3968, 320, 1, 64, 3968, 3968, 64, 64]
    - [4, 11280.4]
  - - [4032, 320, 1, 64, 4032, 4032, 64, 64]
    - [4, 11402.2]
  - - [4096, 320, 1, 64, 4096, 4096, 64, 64]
    - [4, 11237.1]
  - - [64, 384, 1, 64, 64, 64, 64, 64]
    - [15, 334.222]
  - - [128, 384, 1, 64, 128, 128, 64, 64]
    - [3, 662.953]
  - - [192, 384, 1, 64, 192, 192, 64, 64]
    - [7, 981.19]
  - - [256, 384, 1, 64, 256, 256, 64, 64]
    - [9, 1358.25]
  - - [320, 384, 1, 64, 320, 320, 64, 64]
    - [6, 1726.13]
  - - [384, 384, 1, 64, 384, 384, 64, 64]
    - [5, 1961.57]
  - - [448, 384, 1, 64, 448, 448, 64, 64]
    - [5, 2294.23]
  - - [512, 384, 1, 64, 512, 512, 64, 64]
    - [18, 2607.29]
  - - [576, 384, 1, 64, 576, 576, 64, 64]
    - [4, 2863.18]
  - - [640, 384, 1, 64, 640, 640, 64, 64]
    - [7, 3284.29]
  - - [704, 384, 1, 64, 704, 704, 64, 64]
    - [5, 3518.69]
  - - [768, 384, 1, 64, 768, 768, 64, 64]
    - [5, 3808.39]
  - - [832, 384, 1, 64, 832, 832, 64, 64]
    - [14, 4002.18]
  - - [896, 384, 1, 64, 896, 896, 64, 64]
    - [9, 4306.65]
  - - [960, 384, 1, 64, 960, 960, 64, 64]
    - [4, 4773.92]
  - - [1024, 384, 1, 64, 1024, 1024, 64, 64]
    - [7, 4441.49]
  - - [1088, 384, 1, 64, 1088, 1088, 64, 64]
    - [7, 4591.87]
  - - [1152, 384, 1, 64, 1152, 1152, 64, 64]
    - [4, 4777.45]
  - - [1216, 384, 1, 64, 1216, 1216, 64, 64]
    - [7, 4929.75]
  - - [1280, 384, 1, 64, 1280, 1280, 64, 64]
    - [4, 5129.96]
  - - [1344, 384, 1, 64, 1344, 1344, 64, 64]
    - [0, 5256.21]
  - - [1408, 384, 1, 64, 1408, 1408, 64, 64]
    - [1, 5461.29]
  - - [1472, 384, 1, 64, 1472, 1472, 64, 64]
    - [3, 5671.93]
  - - [1536, 384, 1, 64, 1536, 1536, 64, 64]
    - [3, 5819.11]
  - - [1600, 384, 1, 64, 1600, 1600, 64, 64]
    - [3, 5967.7]
  - - [1664, 384, 1, 64, 1664, 1664, 64, 64]
    - [3, 6123.74]
  - - [1728, 384, 1, 64, 1728, 1728, 64, 64]
    - [1, 6321.38]
  - - [1792, 384, 1, 64, 1792, 1792, 64, 64]
    - [1, 6449.87]
  - - [1856, 384, 1, 64, 1856, 1856, 64, 64]
    - [1, 6623.98]
  - - [1920, 384, 1, 64, 1920, 1920, 64, 64]
    - [3, 6765.98]
  - - [1984, 384, 1, 64, 1984, 1984, 64, 64]
    - [3, 6923.95]
  - - [2048, 384, 1, 64, 2048, 2048, 64, 64]
    - [3, 7042.3]
  - - [2112, 384, 1, 64, 2112, 2112, 64, 64]
    - [7, 7157.22]
  - - [2176, 384, 1, 64, 2176, 2176, 64, 64]
    - [7, 7362.91]
  - - [2240, 384, 1, 64, 2240, 2240, 64, 64]
    - [4, 7462.39]
  - - [2304, 384, 1, 64, 2304, 2304, 64, 64]
    - [7, 7526.59]
  - - [2368, 384, 1, 64, 2368, 2368, 64, 64]
    - [7, 7685.63]
  - - [2432, 384, 1, 64, 2432, 2432, 64, 64]
    - [7, 7848.78]
  - - [2496, 384, 1, 64, 2496, 2496, 64, 64]
    - [7, 8015.3]
  - - [2560, 384, 1, 64, 2560, 2560, 64, 64]
    - [7, 8014.52]
  - - [2624, 384, 1, 64, 2624, 2624, 64, 64]
    - [9, 8621.23]
  - - [2688, 384, 1, 64, 2688, 2688, 64, 64]
    - [4, 9842.04]
  - - [2752, 384, 1, 64, 2752, 2752, 64, 64]
    - [4, 10003.3]
  - - [2816, 384, 1, 64, 2816, 2816, 64, 64]
    - [4, 10041.4]
  - - [2880, 384, 1, 64, 2880, 2880, 64, 64]
    - [4, 10173.7]
  - - [2944, 384, 1, 64, 2944, 2944, 64, 64]
    - [4, 10349.2]
  - - [3008, 384, 1, 64, 3008, 3008, 64, 64]
    - [4, 10442.7]
  - - [3072, 384, 1, 64, 3072, 3072, 64, 64]
    - [4, 10360.5]
  - - [3136, 384, 1, 64, 3136, 3136, 64, 64]
    - [4, 10711.6]
  - - [3200, 384, 1, 64, 3200, 3200, 64, 64]
    - [4, 10899.8]
  - - [3264, 384, 1, 64, 3264, 3264, 64, 64]
    - [4, 11138.0]
  - - [3328, 384, 1, 64, 3328, 3328, 64, 64]
    - [0, 11202.4]
  - - [3392, 384, 1, 64, 3392, 3392, 64, 64]
    - [3, 11378.9]
  - - [3456, 384, 1, 64, 3456, 3456, 64, 64]
    - [4, 11628.4]
  - - [3520, 384, 1, 64, 3520, 3520, 64, 64]
    - [4, 11723.4]
  - - [3584, 384, 1, 64, 3584, 3584, 64, 64]
    - [4, 11819.6]
  - - [3648, 384, 1, 64, 3648, 3648, 64, 64]
    - [3, 12063.0]
  - - [3712, 384, 1, 64, 3712, 3712, 64, 64]
    - [3, 12191.0]
  - - [3776, 384, 1, 64, 3776, 3776, 64, 64]
    - [3, 12237.7]
  - - [3840, 384, 1, 64, 3840, 3840, 64, 64]
    - [0, 12240.1]
  - - [3904, 384, 1, 64, 3904, 3904, 64, 64]
    - [3, 12515.6]
  - - [3968, 384, 1, 64, 3968, 3968, 64, 64]
    - [0, 12615.3]
  - - [4032, 384, 1, 64, 4032, 4032, 64, 64]
    - [0, 12681.0]
  - - [4096, 384, 1, 64, 4096, 4096, 64, 64]
    - [4, 12428.9]
  - - [64, 448, 1, 64, 64, 64, 64, 64]
    - [4, 408.956]
  - - [128, 448, 1, 64, 128, 128, 64, 64]
    - [16, 806.592]
  - - [192, 448, 1, 64, 192, 192, 64, 64]
    - [18, 1215.5]
  - - [256, 448, 1, 64, 256, 256, 64, 64]
    - [16, 1602.97]
  - - [320, 448, 1, 64, 320, 320, 64, 64]
    - [18, 1964.67]
  - - [384, 448, 1, 64, 384, 384, 64, 64]
    - [7, 2377.45]
  - - [448, 448, 1, 64, 448, 448, 64, 64]
    - [17, 2615.56]
  - - [512, 448, 1, 64, 512, 512, 64, 64]
    - [18, 2927.2]
  - - [576, 448, 1, 64, 576, 576, 64, 64]
    - [8, 3274.85]
  - - [640, 448, 1, 64, 640, 640, 64, 64]
    - [5, 3679.53]
  - - [704, 448, 1, 64, 704, 704, 64, 64]
    - [7, 3996.22]
  - - [768, 448, 1, 64, 768, 768, 64, 64]
    - [17, 4179.95]
  - - [832, 448, 1, 64, 832, 832, 64, 64]
    - [4, 4658.2]
  - - [896, 448, 1, 64, 896, 896, 64, 64]
    - [7, 5055.12]
  - - [960, 448, 1, 64, 960, 960, 64, 64]
    - [6, 5221.0]
  - - [1024, 448, 1, 64, 1024, 1024, 64, 64]
    - [1, 5456.21]
  - - [1088, 448, 1, 64, 1088, 1088, 64, 64]
    - [1, 5150.22]
  - - [1152, 448, 1, 64, 1152, 1152, 64, 64]
    - [3, 5397.04]
  - - [1216, 448, 1, 64, 1216, 1216, 64, 64]
    - [3, 5608.89]
  - - [1280, 448, 1, 64, 1280, 1280, 64, 64]
    - [3, 5777.69]
  - - [1344, 448, 1, 64, 1344, 1344, 64, 64]
    - [3, 5909.35]
  - - [1408, 448, 1, 64, 1408, 1408, 64, 64]
    - [1, 6128.72]
  - - [1472, 448, 1, 64, 1472, 1472, 64, 64]
    - [3, 6294.54]
  - - [1536, 448, 1, 64, 1536, 1536, 64, 64]
    - [1, 6422.59]
  - - [1600, 448, 1, 64, 1600, 1600, 64, 64]
    - [7, 6661.08]
  - - [1664, 448, 1, 64, 1664, 1664, 64, 64]
    - [7, 6846.04]
  - - [1728, 448, 1, 64, 1728, 1728, 64, 64]
    - [7, 7012.74]
  - - [1792, 448, 1, 64, 1792, 1792, 64, 64]
    - [7, 7156.97]
  - - [1856, 448, 1, 64, 1856, 1856, 64, 64]
    - [7, 7260.84]
  - - [1920, 448, 1, 64, 1920, 1920, 64, 64]
    - [4, 7477.57]
  - - [1984, 448, 1, 64, 1984, 1984, 64, 64]
    - [7, 7597.79]
  - - [2048, 448, 1, 64, 2048, 2048, 64, 64]
    - [7, 7664.75]
  - - [2112, 448, 1, 64, 2112, 2112, 64, 64]
    - [7, 7890.89]
  - - [2176, 448, 1, 64, 2176, 2176, 64, 64]
    - [7, 8073.22]
  - - [2240, 448, 1, 64, 2240, 2240, 64, 64]
    - [7, 8149.3]
  - - [2304, 448, 1, 64, 2304, 2304, 64, 64]
    - [7, 9608.77]
  - - [2368, 448, 1, 64, 2368, 2368, 64, 64]
    - [4, 9842.68]
  - - [2432, 448, 1, 64, 2432, 2432, 64, 64]
    - [7, 10036.0]
  - - [2496, 448, 1, 64, 2496, 2496, 64, 64]
    - [4, 10276.4]
  - - [2560, 448, 1, 64, 2560, 2560, 64, 64]
    - [4, 10365.7]
  - - [2624, 448, 1, 64, 2624, 2624, 64, 64]
    - [4, 10645.9]
  - - [2688, 448, 1, 64, 2688, 2688, 64, 64]
    - [4, 10826.0]
  - - [2752, 448, 1, 64, 2752, 2752, 64, 64]
    - [4, 10910.5]
  - - [2816, 448, 1, 64, 2816, 2816, 64, 64]
    - [3, 11087.6]
  - - [2880, 448, 1, 64, 2880, 2880, 64, 64]
    - [0, 11205.6]
  - - [2944, 448, 1, 64, 2944, 2944, 64, 64]
    - [0, 11417.5]
  - - [3008, 448, 1, 64, 3008, 3008, 64, 64]
    - [3, 11576.5]
  - - [3072, 448, 1, 64, 3072, 3072, 64, 64]
    - [3, 11600.1]
  - - [3136, 448, 1, 64, 3136, 3136, 64, 64]
    - [3, 11993.5]
  - - [3200, 448, 1, 64, 3200, 3200, 64, 64]
    - [3, 12165.2]
  - - [3264, 448, 1, 64, 3264, 3264, 64, 64]
    - [3, 12352.8]
  - - [3328, 448, 1, 64, 3328, 3328, 64, 64]
    - [3, 12443.9]
  - - [3392, 448, 1, 64, 3392, 3392, 64, 64]
    - [3, 12670.0]
  - - [3456, 448, 1, 64, 3456, 3456, 64, 64]
    - [0, 12766.1]
  - - [3520, 448, 1, 64, 3520, 3520, 64, 64]
    - [3, 12625.0]
  - - [3584, 448, 1, 64, 3584, 3584, 64, 64]
    - [4, 12593.1]
  - - [3648, 448, 1, 64, 3648, 3648, 64, 64]
    - [4, 12925.7]
  - - [3712, 448, 1, 64, 3712, 3712, 64, 64]
    - [4, 13020.5]
  - - [3776, 448, 1, 64, 3776, 3776, 64, 64]
    - [3, 13065.9]
  - - [3840, 448, 1, 64, 3840, 3840, 64, 64]
    - [4, 13222.0]
  - - [3904, 448, 1, 64, 3904, 3904, 64, 64]
    - [3, 13376.4]
  - - [3968, 448, 1, 64, 3968, 3968, 64, 64]
    - [4, 13481.4]
  - - [4032, 448, 1, 64, 4032, 4032, 64, 64]
    - [4, 13677.8]
  - - [4096, 448, 1, 64, 4096, 4096, 64, 64]
    - [4, 13458.6]
  - - [64, 512, 1, 64, 64, 64, 64, 64]
    - [5, 450.223]
  - - [128, 512, 1, 64, 128, 128, 64, 64]
    - [5, 879.309]
  - - [192, 512, 1, 64, 192, 192, 64, 64]
    - [5, 1286.58]
  - - [256, 512, 1, 64, 256, 256, 64, 64]
    - [17, 1745.06]
  - - [320, 512, 1, 64, 320, 320, 64, 64]
    - [4, 2212.15]
  - - [384, 512, 1, 64, 384, 384, 64, 64]
    - [1, 2470.59]
  - - [448, 512, 1, 64, 448, 448, 64, 64]
    - [4, 2787.68]
  - - [512, 512, 1, 64, 512, 512, 64, 64]
    - [3, 3178.69]
  - - [576, 512, 1, 64, 576, 576, 64, 64]
    - [3, 3578.69]
  - - [640, 512, 1, 64, 640, 640, 64, 64]
    - [4, 4325.79]
  - - [704, 512, 1, 64, 704, 704, 64, 64]
    - [4, 4226.56]
  - - [768, 512, 1, 64, 768, 768, 64, 64]
    - [14, 4594.74]
  - - [832, 512, 1, 64, 832, 832, 64, 64]
    - [5, 4997.75]
  - - [896, 512, 1, 64, 896, 896, 64, 64]
    - [6, 5351.75]
  - - [960, 512, 1, 64, 960, 960, 64, 64]
    - [7, 5043.59]
  - - [1024, 512, 1, 64, 1024, 1024, 64, 64]
    - [7, 5246.94]
  - - [1088, 512, 1, 64, 1088, 1088, 64, 64]
    - [1, 5542.78]
  - - [1152, 512, 1, 64, 1152, 1152, 64, 64]
    - [3, 5735.1]
  - - [1216, 512, 1, 64, 1216, 1216, 64, 64]
    - [1, 5958.64]
  - - [1280, 512, 1, 64, 1280, 1280, 64, 64]
    - [3, 6121.22]
  - - [1344, 512, 1, 64, 1344, 1344, 64, 64]
    - [3, 6397.4]
  - - [1408, 512, 1, 64, 1408, 1408, 64, 64]
    - [3, 6617.47]
  - - [1472, 512, 1, 64, 1472, 1472, 64, 64]
    - [3, 6836.85]
  - - [1536, 512, 1, 64, 1536, 1536, 64, 64]
    - [1, 6960.47]
  - - [1600, 512, 1, 64, 1600, 1600, 64, 64]
    - [4, 7215.58]
  - - [1664, 512, 1, 64, 1664, 1664, 64, 64]
    - [7, 7420.49]
  - - [1728, 512, 1, 64, 1728, 1728, 64, 64]
    - [4, 7642.42]
  - - [1792, 512, 1, 64, 1792, 1792, 64, 64]
    - [7, 7827.2]
  - - [1856, 512, 1, 64, 1856, 1856, 64, 64]
    - [7, 7916.79]
  - - [1920, 512, 1, 64, 1920, 1920, 64, 64]
    - [7, 8010.46]
  - - [1984, 512, 1, 64, 1984, 1984, 64, 64]
    - [11, 8979.46]
  - - [2048, 512, 1, 64, 2048, 2048, 64, 64]
    - [7, 9610.22]
  - - [2112, 512, 1, 64, 2112, 2112, 64, 64]
    - [4, 9886.47]
  - - [2176, 512, 1, 64, 2176, 2176, 64, 64]
    - [4, 10119.6]
  - - [2240, 512, 1, 64, 2240, 2240, 64, 64]
    - [4, 10365.7]
  - - [2304, 512, 1, 64, 2304, 2304, 64, 64]
    - [0, 10435.0]
  - - [2368, 512, 1, 64, 2368, 2368, 64, 64]
    - [4, 10732.2]
  - - [2432, 512, 1, 64, 2432, 2432, 64, 64]
    - [4, 11013.2]
  - - [2496, 512, 1, 64, 2496, 2496, 64, 64]
    - [3, 11203.9]
  - - [2560, 512, 1, 64, 2560, 2560, 64, 64]
    - [3, 11322.1]
  - - [2624, 512, 1, 64, 2624, 2624, 64, 64]
    - [3, 11672.9]
  - - [2688, 512, 1, 64, 2688, 2688, 64, 64]
    - [3, 11873.8]
  - - [2752, 512, 1, 64, 2752, 2752, 64, 64]
    - [3, 12057.4]
  - - [2816, 512, 1, 64, 2816, 2816, 64, 64]
    - [3, 12157.3]
  - - [2880, 512, 1, 64, 2880, 2880, 64, 64]
    - [0, 12423.8]
  - - [2944, 512, 1, 64, 2944, 2944, 64, 64]
    - [3, 12590.5]
  - - [3008, 512, 1, 64, 3008, 3008, 64, 64]
    - [3, 12736.1]
  - - [3072, 512, 1, 64, 3072, 3072, 64, 64]
    - [3, 12587.5]
  - - [3136, 512, 1, 64, 3136, 3136, 64, 64]
    - [3, 12771.5]
  - - [3200, 512, 1, 64, 3200, 3200, 64, 64]
    - [3, 12913.4]
  - - [3264, 512, 1, 64, 3264, 3264, 64, 64]
    - [4, 13149.0]
  - - [3328, 512, 1, 64, 3328, 3328, 64, 64]
    - [4, 13276.2]
  - - [3392, 512, 1, 64, 3392, 3392, 64, 64]
    - [4, 13431.7]
  - - [3456, 512, 1, 64, 3456, 3456, 64, 64]
    - [4, 13601.3]
  - - [3520, 512, 1, 64, 3520, 3520, 64, 64]
    - [4, 13737.9]
  - - [3584, 512, 1, 64, 3584, 3584, 64, 64]
    - [4, 13767.8]
  - - [3648, 512, 1, 64, 3648, 3648, 64, 64]
    - [4, 14073.1]
  - - [3712, 512, 1, 64, 3712, 3712, 64, 64]
    - [4, 14160.0]
  - - [3776, 512, 1, 64, 3776, 3776, 64, 64]
    - [3, 13900.8]
  - - [3840, 512, 1, 64, 3840, 3840, 64, 64]
    - [4, 14216.3]
  - - [3904, 512, 1, 64, 3904, 3904, 64, 64]
    - [4, 14432.0]
  - - [3968, 512, 1, 64, 3968, 3968, 64, 64]
    - [3, 14700.1]
  - - [4032, 512, 1, 64, 4032, 4032, 64, 64]
    - [4, 14693.0]
  - - [4096, 512, 1, 64, 4096, 4096, 64, 64]
    - [4, 14380.8]
  - - [64, 576, 1, 64, 64, 64, 64, 64]
    - [7, 496.166]
  - - [128, 576, 1, 64, 128, 128, 64, 64]
    - [6, 984.861]
  - - [192, 576, 1, 64, 192, 192, 64, 64]
    - [7, 1371.68]
  - - [256, 576, 1, 64, 256, 256, 64, 64]
    - [13, 1847.5]
  - - [320, 576, 1, 64, 320, 320, 64, 64]
    - [16, 2275.07]
  - - [384, 576, 1, 64, 384, 384, 64, 64]
    - [4, 2712.86]
  - - [448, 576, 1, 64, 448, 448, 64, 64]
    - [0, 3239.49]
  - - [512, 576, 1, 64, 512, 512, 64, 64]
    - [1, 3766.55]
  - - [576, 576, 1, 64, 576, 576, 64, 64]
    - [4, 4088.04]
  - - [640, 576, 1, 64, 640, 640, 64, 64]
    - [0, 4317.81]
  - - [704, 576, 1, 64, 704, 704, 64, 64]
    - [3, 4691.23]
  - - [768, 576, 1, 64, 768, 768, 64, 64]
    - [7, 5046.58]
  - - [832, 576, 1, 64, 832, 832, 64, 64]
    - [11, 5341.47]
  - - [896, 576, 1, 64, 896, 896, 64, 64]
    - [3, 5674.26]
  - - [960, 576, 1, 64, 960, 960, 64, 64]
    - [1, 6032.87]
  - - [1024, 576, 1, 64, 1024, 1024, 64, 64]
    - [7, 5645.07]
  - - [1088, 576, 1, 64, 1088, 1088, 64, 64]
    - [1, 6027.63]
  - - [1152, 576, 1, 64, 1152, 1152, 64, 64]
    - [1, 6245.17]
  - - [1216, 576, 1, 64, 1216, 1216, 64, 64]
    - [3, 6475.92]
  - - [1280, 576, 1, 64, 1280, 1280, 64, 64]
    - [1, 6694.91]
  - - [1344, 576, 1, 64, 1344, 1344, 64, 64]
    - [7, 6986.98]
  - - [1408, 576, 1, 64, 1408, 1408, 64, 64]
    - [7, 7192.93]
  - - [1472, 576, 1, 64, 1472, 1472, 64, 64]
    - [4, 7416.08]
  - - [1536, 576, 1, 64, 1536, 1536, 64, 64]
    - [6, 7363.14]
  - - [1600, 576, 1, 64, 1600, 1600, 64, 64]
    - [7, 7831.87]
  - - [1664, 576, 1, 64, 1664, 1664, 64, 64]
    - [7, 7992.35]
  - - [1728, 576, 1, 64, 1728, 1728, 64, 64]
    - [7, 8184.61]
  - - [1792, 576, 1, 64, 1792, 1792, 64, 64]
    - [7, 9524.19]
  - - [1856, 576, 1, 64, 1856, 1856, 64, 64]
    - [4, 9911.5]
  - - [1920, 576, 1, 64, 1920, 1920, 64, 64]
    - [4, 10056.6]
  - - [1984, 576, 1, 64, 1984, 1984, 64, 64]
    - [4, 10330.2]
  - - [2048, 576, 1, 64, 2048, 2048, 64, 64]
    - [4, 10501.8]
  - - [2112, 576, 1, 64, 2112, 2112, 64, 64]
    - [4, 10769.9]
  - - [2176, 576, 1, 64, 2176, 2176, 64, 64]
    - [4, 11018.6]
  - - [2240, 576, 1, 64, 2240, 2240, 64, 64]
    - [4, 11205.7]
  - - [2304, 576, 1, 64, 2304, 2304, 64, 64]
    - [3, 11382.3]
  - - [2368, 576, 1, 64, 2368, 2368, 64, 64]
    - [0, 11657.8]
  - - [2432, 576, 1, 64, 2432, 2432, 64, 64]
    - [3, 11923.4]
  - - [2496, 576, 1, 64, 2496, 2496, 64, 64]
    - [0, 12170.9]
  - - [2560, 576, 1, 64, 2560, 2560, 64, 64]
    - [3, 12254.4]
  - - [2624, 576, 1, 64, 2624, 2624, 64, 64]
    - [3, 12531.4]
  - - [2688, 576, 1, 64, 2688, 2688, 64, 64]
    - [3, 12787.3]
  - - [2752, 576, 1, 64, 2752, 2752, 64, 64]
    - [4, 12759.2]
  - - [2816, 576, 1, 64, 2816, 2816, 64, 64]
    - [4, 12860.2]
  - - [2880, 576, 1, 64, 2880, 2880, 64, 64]
    - [4, 13126.6]
  - - [2944, 576, 1, 64, 2944, 2944, 64, 64]
    - [4, 13230.1]
  - - [3008, 576, 1, 64, 3008, 3008, 64, 64]
    - [4, 13249.6]
  - - [3072, 576, 1, 64, 3072, 3072, 64, 64]
    - [6, 12998.8]
  - - [3136, 576, 1, 64, 3136, 3136, 64, 64]
    - [4, 13716.7]
  - - [3200, 576, 1, 64, 3200, 3200, 64, 64]
    - [4, 13879.7]
  - - [3264, 576, 1, 64, 3264, 3264, 64, 64]
    - [4, 14063.0]
  - - [3328, 576, 1, 64, 3328, 3328, 64, 64]
    - [4, 14096.6]
  - - [3392, 576, 1, 64, 3392, 3392, 64, 64]
    - [4, 14230.3]
  - - [3456, 576, 1, 64, 3456, 3456, 64, 64]
    - [4, 14492.2]
  - - [3520, 576, 1, 64, 3520, 3520, 64, 64]
    - [4, 14552.1]
  - - [3584, 576, 1, 64, 3584, 3584, 64, 64]
    - [4, 14568.3]
  - - [3648, 576, 1, 64, 3648, 3648, 64, 64]
    - [3, 14940.3]
  - - [3712, 576, 1, 64, 3712, 3712, 64, 64]
    - [3, 15048.7]
  - - [3776, 576, 1, 64, 3776, 3776, 64, 64]
    - [3, 14956.2]
  - - [3840, 576, 1, 64, 3840, 3840, 64, 64]
    - [3, 15224.4]
  - - [3904, 576, 1, 64, 3904, 3904, 64, 64]
    - [3, 15446.5]
  - - [3968, 576, 1, 64, 3968, 3968, 64, 64]
    - [3, 15667.9]
  - - [4032, 576, 1, 64, 4032, 4032, 64, 64]
    - [3, 15768.5]
  - - [4096, 576, 1, 64, 4096, 4096, 64, 64]
    - [4, 15198.1]
  - - [64, 640, 1, 64, 64, 64, 64, 64]
    - [17, 530.216]
  - - [128, 640, 1, 64, 128, 128, 64, 64]
    - [15, 1086.15]
  - - [192, 640, 1, 64, 192, 192, 64, 64]
    - [5, 1518.79]
  - - [256, 640, 1, 64, 256, 256, 64, 64]
    - [5, 2054.8]
  - - [320, 640, 1, 64, 320, 320, 64, 64]
    - [18, 2628.23]
  - - [384, 640, 1, 64, 384, 384, 64, 64]
    - [15, 3076.19]
  - - [448, 640, 1, 64, 448, 448, 64, 64]
    - [18, 3595.2]
  - - [512, 640, 1, 64, 512, 512, 64, 64]
    - [7, 4029.09]
  - - [576, 640, 1, 64, 576, 576, 64, 64]
    - [14, 4552.82]
  - - [640, 640, 1, 64, 640, 640, 64, 64]
    - [7, 4748.08]
  - - [704, 640, 1, 64, 704, 704, 64, 64]
    - [4, 5014.01]
  - - [768, 640, 1, 64, 768, 768, 64, 64]
    - [6, 5535.31]
  - - [832, 640, 1, 64, 832, 832, 64, 64]
    - [7, 5935.9]
  - - [896, 640, 1, 64, 896, 896, 64, 64]
    - [4, 6251.07]
  - - [960, 640, 1, 64, 960, 960, 64, 64]
    - [4, 5840.07]
  - - [1024, 640, 1, 64, 1024, 1024, 64, 64]
    - [3, 6167.14]
  - - [1088, 640, 1, 64, 1088, 1088, 64, 64]
    - [1, 6423.18]
  - - [1152, 640, 1, 64, 1152, 1152, 64, 64]
    - [3, 6717.77]
  - - [1216, 640, 1, 64, 1216, 1216, 64, 64]
    - [3, 6991.41]
  - - [1280, 640, 1, 64, 1280, 1280, 64, 64]
    - [7, 7216.58]
  - - [1344, 640, 1, 64, 1344, 1344, 64, 64]
    - [4, 7480.67]
  - - [1408, 640, 1, 64, 1408, 1408, 64, 64]
    - [7, 7576.37]
  - - [1472, 640, 1, 64, 1472, 1472, 64, 64]
    - [7, 7900.02]
  - - [1536, 640, 1, 64, 1536, 1536, 64, 64]
    - [7, 7928.67]
  - - [1600, 640, 1, 64, 1600, 1600, 64, 64]
    - [7, 9578.42]
  - - [1664, 640, 1, 64, 1664, 1664, 64, 64]
    - [4, 9843.62]
  - - [1728, 640, 1, 64, 1728, 1728, 64, 64]
    - [4, 10066.6]
  - - [1792, 640, 1, 64, 1792, 1792, 64, 64]
    - [4, 10365.7]
  - - [1856, 640, 1, 64, 1856, 1856, 64, 64]
    - [4, 10557.0]
  - - [1920, 640, 1, 64, 1920, 1920, 64, 64]
    - [4, 10836.8]
  - - [1984, 640, 1, 64, 1984, 1984, 64, 64]
    - [4, 11060.9]
  - - [2048, 640, 1, 64, 2048, 2048, 64, 64]
    - [4, 11160.9]
  - - [2112, 640, 1, 64, 2112, 2112, 64, 64]
    - [3, 11543.4]
  - - [2176, 640, 1, 64, 2176, 2176, 64, 64]
    - [3, 11869.4]
  - - [2240, 640, 1, 64, 2240, 2240, 64, 64]
    - [3, 11996.5]
  - - [2304, 640, 1, 64, 2304, 2304, 64, 64]
    - [3, 12273.5]
  - - [2368, 640, 1, 64, 2368, 2368, 64, 64]
    - [3, 12462.0]
  - - [2432, 640, 1, 64, 2432, 2432, 64, 64]
    - [3, 12769.3]
  - - [2496, 640, 1, 64, 2496, 2496, 64, 64]
    - [4, 12806.7]
  - - [2560, 640, 1, 64, 2560, 2560, 64, 64]
    - [4, 12942.1]
  - - [2624, 640, 1, 64, 2624, 2624, 64, 64]
    - [4, 13237.8]
  - - [2688, 640, 1, 64, 2688, 2688, 64, 64]
    - [4, 13453.1]
  - - [2752, 640, 1, 64, 2752, 2752, 64, 64]
    - [4, 13620.3]
  - - [2816, 640, 1, 64, 2816, 2816, 64, 64]
    - [4, 13606.5]
  - - [2880, 640, 1, 64, 2880, 2880, 64, 64]
    - [4, 13892.8]
  - - [2944, 640, 1, 64, 2944, 2944, 64, 64]
    - [4, 13979.3]
  - - [3008, 640, 1, 64, 3008, 3008, 64, 64]
    - [4, 14032.7]
  - - [3072, 640, 1, 64, 3072, 3072, 64, 64]
    - [3, 13706.7]
  - - [3136, 640, 1, 64, 3136, 3136, 64, 64]
    - [4, 14392.1]
  - - [3200, 640, 1, 64, 3200, 3200, 64, 64]
    - [4, 14610.5]
  - - [3264, 640, 1, 64, 3264, 3264, 64, 64]
    - [4, 14862.9]
  - - [3328, 640, 1, 64, 3328, 3328, 64, 64]
    - [3, 14941.7]
  - - [3392, 640, 1, 64, 3392, 3392, 64, 64]
    - [4, 15147.8]
  - - [3456, 640, 1, 64, 3456, 3456, 64, 64]
    - [4, 15285.2]
  - - [3520, 640, 1, 64, 3520, 3520, 64, 64]
    - [3, 15448.1]
  - - [3584, 640, 1, 64, 3584, 3584, 64, 64]
    - [3, 15428.3]
  - - [3648, 640, 1, 64, 3648, 3648, 64, 64]
    - [3, 15745.0]
  - - [3712, 640, 1, 64, 3712, 3712, 64, 64]
    - [3, 15638.9]
  - - [3776, 640, 1, 64, 3776, 3776, 64, 64]
    - [3, 15443.1]
  - - [3840, 640, 1, 64, 3840, 3840, 64, 64]
    - [3, 15919.5]
  - - [3904, 640, 1, 64, 3904, 3904, 64, 64]
    - [3, 16148.8]
  - - [3968, 640, 1, 64, 3968, 3968, 64, 64]
    - [3, 16331.1]
  - - [4032, 640, 1, 64, 4032, 4032, 64, 64]
    - [3, 16235.7]
  - - [4096, 640, 1, 64, 4096, 4096, 64, 64]
    - [4, 15873.7]
  - - [64, 704, 1, 64, 64, 64, 64, 64]
    - [7, 593.565]
  - - [128, 704, 1, 64, 128, 128, 64, 64]
    - [3, 1211.83]
  - - [192, 704, 1, 64, 192, 192, 64, 64]
    - [17, 1755.05]
  - - [256, 704, 1, 64, 256, 256, 64, 64]
    - [14, 2439.58]
  - - [320, 704, 1, 64, 320, 320, 64, 64]
    - [7, 2998.07]
  - - [384, 704, 1, 64, 384, 384, 64, 64]
    - [7, 3448.52]
  - - [448, 704, 1, 64, 448, 448, 64, 64]
    - [4, 4060.53]
  - - [512, 704, 1, 64, 512, 512, 64, 64]
    - [6, 4477.57]
  - - [576, 704, 1, 64, 576, 576, 64, 64]
    - [7, 4976.42]
  - - [640, 704, 1, 64, 640, 640, 64, 64]
    - [6, 5340.91]
  - - [704, 704, 1, 64, 704, 704, 64, 64]
    - [1, 5698.73]
  - - [768, 704, 1, 64, 768, 768, 64, 64]
    - [4, 6038.89]
  - - [832, 704, 1, 64, 832, 832, 64, 64]
    - [0, 6389.29]
  - - [896, 704, 1, 64, 896, 896, 64, 64]
    - [0, 6838.81]
  - - [960, 704, 1, 64, 960, 960, 64, 64]
    - [1, 7359.77]
  - - [1024, 704, 1, 64, 1024, 1024, 64, 64]
    - [7, 6564.72]
  - - [1088, 704, 1, 64, 1088, 1088, 64, 64]
    - [7, 6907.23]
  - - [1152, 704, 1, 64, 1152, 1152, 64, 64]
    - [7, 7171.09]
  - - [1216, 704, 1, 64, 1216, 1216, 64, 64]
    - [4, 7410.68]
  - - [1280, 704, 1, 64, 1280, 1280, 64, 64]
    - [7, 7644.66]
  - - [1344, 704, 1, 64, 1344, 1344, 64, 64]
    - [7, 7880.64]
  - - [1408, 704, 1, 64, 1408, 1408, 64, 64]
    - [7, 8057.7]
  - - [1472, 704, 1, 64, 1472, 1472, 64, 64]
    - [7, 9542.66]
  - - [1536, 704, 1, 64, 1536, 1536, 64, 64]
    - [6, 9693.98]
  - - [1600, 704, 1, 64, 1600, 1600, 64, 64]
    - [4, 10261.8]
  - - [1664, 704, 1, 64, 1664, 1664, 64, 64]
    - [4, 10504.7]
  - - [1728, 704, 1, 64, 1728, 1728, 64, 64]
    - [4, 10753.6]
  - - [1792, 704, 1, 64, 1792, 1792, 64, 64]
    - [4, 11004.4]
  - - [1856, 704, 1, 64, 1856, 1856, 64, 64]
    - [0, 11273.0]
  - - [1920, 704, 1, 64, 1920, 1920, 64, 64]
    - [3, 11555.8]
  - - [1984, 704, 1, 64, 1984, 1984, 64, 64]
    - [3, 11868.0]
  - - [2048, 704, 1, 64, 2048, 2048, 64, 64]
    - [4, 11783.2]
  - - [2112, 704, 1, 64, 2112, 2112, 64, 64]
    - [3, 12207.5]
  - - [2176, 704, 1, 64, 2176, 2176, 64, 64]
    - [3, 12551.6]
  - - [2240, 704, 1, 64, 2240, 2240, 64, 64]
    - [4, 12571.5]
  - - [2304, 704, 1, 64, 2304, 2304, 64, 64]
    - [4, 12823.7]
  - - [2368, 704, 1, 64, 2368, 2368, 64, 64]
    - [4, 13084.6]
  - - [2432, 704, 1, 64, 2432, 2432, 64, 64]
    - [4, 13341.7]
  - - [2496, 704, 1, 64, 2496, 2496, 64, 64]
    - [4, 13479.5]
  - - [2560, 704, 1, 64, 2560, 2560, 64, 64]
    - [4, 13561.7]
  - - [2624, 704, 1, 64, 2624, 2624, 64, 64]
    - [4, 13900.8]
  - - [2688, 704, 1, 64, 2688, 2688, 64, 64]
    - [4, 14017.3]
  - - [2752, 704, 1, 64, 2752, 2752, 64, 64]
    - [4, 14118.9]
  - - [2816, 704, 1, 64, 2816, 2816, 64, 64]
    - [4, 14133.5]
  - - [2880, 704, 1, 64, 2880, 2880, 64, 64]
    - [4, 14357.1]
  - - [2944, 704, 1, 64, 2944, 2944, 64, 64]
    - [4, 14541.1]
  - - [3008, 704, 1, 64, 3008, 3008, 64, 64]
    - [3, 14577.5]
  - - [3072, 704, 1, 64, 3072, 3072, 64, 64]
    - [6, 14386.3]
  - - [3136, 704, 1, 64, 3136, 3136, 64, 64]
    - [3, 14964.3]
  - - [3200, 704, 1, 64, 3200, 3200, 64, 64]
    - [3, 15175.0]
  - - [3264, 704, 1, 64, 3264, 3264, 64, 64]
    - [3, 15350.8]
  - - [3328, 704, 1, 64, 3328, 3328, 64, 64]
    - [3, 15585.1]
  - - [3392, 704, 1, 64, 3392, 3392, 64, 64]
    - [3, 15553.5]
  - - [3456, 704, 1, 64, 3456, 3456, 64, 64]
    - [3, 15797.0]
  - - [3520, 704, 1, 64, 3520, 3520, 64, 64]
    - [3, 15968.1]
  - - [3584, 704, 1, 64, 3584, 3584, 64, 64]
    - [3, 15853.0]
  - - [3648, 704, 1, 64, 3648, 3648, 64, 64]
    - [3, 16330.1]
  - - [3712, 704, 1, 64, 3712, 3712, 64, 64]
    - [3, 16393.4]
  - - [3776, 704, 1, 64, 3776, 3776, 64, 64]
    - [3, 16193.5]
  - - [3840, 704, 1, 64, 3840, 3840, 64, 64]
    - [3, 16443.0]
  - - [3904, 704, 1, 64, 3904, 3904, 64, 64]
    - [3, 16701.3]
  - - [3968, 704, 1, 64, 3968, 3968, 64, 64]
    - [3, 16808.9]
  - - [4032, 704, 1, 64, 4032, 4032, 64, 64]
    - [3, 17152.6]
  - - [4096, 704, 1, 64, 4096, 4096, 64, 64]
    - [3, 16480.3]
  - - [64, 768, 1, 64, 64, 64, 64, 64]
    - [17, 624.769]
  - - [128, 768, 1, 64, 128, 128, 64, 64]
    - [17, 1218.8]
  - - [192, 768, 1, 64, 192, 192, 64, 64]
    - [2, 1865.76]
  - - [256, 768, 1, 64, 256, 256, 64, 64]
    - [7, 2442.29]
  - - [320, 768, 1, 64, 320, 320, 64, 64]
    - [4, 2945.4]
  - - [384, 768, 1, 64, 384, 384, 64, 64]
    - [6, 3654.97]
  - - [448, 768, 1, 64, 448, 448, 64, 64]
    - [5, 4235.41]
  - - [512, 768, 1, 64, 512, 512, 64, 64]
    - [8, 4697.7]
  - - [576, 768, 1, 64, 576, 576, 64, 64]
    - [3, 5287.88]
  - - [640, 768, 1, 64, 640, 640, 64, 64]
    - [1, 5559.71]
  - - [704, 768, 1, 64, 704, 704, 64, 64]
    - [6, 5935.23]
  - - [768, 768, 1, 64, 768, 768, 64, 64]
    - [7, 6313.45]
  - - [832, 768, 1, 64, 832, 832, 64, 64]
    - [1, 6686.39]
  - - [896, 768, 1, 64, 896, 896, 64, 64]
    - [4, 7131.9]
  - - [960, 768, 1, 64, 960, 960, 64, 64]
    - [7, 6716.86]
  - - [1024, 768, 1, 64, 1024, 1024, 64, 64]
    - [1, 6970.1]
  - - [1088, 768, 1, 64, 1088, 1088, 64, 64]
    - [4, 7304.58]
  - - [1152, 768, 1, 64, 1152, 1152, 64, 64]
    - [4, 7550.7]
  - - [1216, 768, 1, 64, 1216, 1216, 64, 64]
    - [4, 7797.5]
  - - [1280, 768, 1, 64, 1280, 1280, 64, 64]
    - [7, 7989.1]
  - - [1344, 768, 1, 64, 1344, 1344, 64, 64]
    - [9, 8657.91]
  - - [1408, 768, 1, 64, 1408, 1408, 64, 64]
    - [4, 9814.99]
  - - [1472, 768, 1, 64, 1472, 1472, 64, 64]
    - [4, 10198.9]
  - - [1536, 768, 1, 64, 1536, 1536, 64, 64]
    - [6, 10241.0]
  - - [1600, 768, 1, 64, 1600, 1600, 64, 64]
    - [4, 10801.0]
  - - [1664, 768, 1, 64, 1664, 1664, 64, 64]
    - [4, 11108.0]
  - - [1728, 768, 1, 64, 1728, 1728, 64, 64]
    - [3, 11441.9]
  - - [1792, 768, 1, 64, 1792, 1792, 64, 64]
    - [4, 11684.7]
  - - [1856, 768, 1, 64, 1856, 1856, 64, 64]
    - [4, 11929.6]
  - - [1920, 768, 1, 64, 1920, 1920, 64, 64]
    - [3, 12225.7]
  - - [1984, 768, 1, 64, 1984, 1984, 64, 64]
    - [3, 12417.7]
  - - [2048, 768, 1, 64, 2048, 2048, 64, 64]
    - [4, 12363.4]
  - - [2112, 768, 1, 64, 2112, 2112, 64, 64]
    - [4, 12812.6]
  - - [2176, 768, 1, 64, 2176, 2176, 64, 64]
    - [4, 13036.7]
  - - [2240, 768, 1, 64, 2240, 2240, 64, 64]
    - [4, 13198.1]
  - - [2304, 768, 1, 64, 2304, 2304, 64, 64]
    - [4, 13183.3]
  - - [2368, 768, 1, 64, 2368, 2368, 64, 64]
    - [4, 13593.9]
  - - [2432, 768, 1, 64, 2432, 2432, 64, 64]
    - [4, 13824.0]
  - - [2496, 768, 1, 64, 2496, 2496, 64, 64]
    - [4, 13961.8]
  - - [2560, 768, 1, 64, 2560, 2560, 64, 64]
    - [4, 13902.1]
  - - [2624, 768, 1, 64, 2624, 2624, 64, 64]
    - [4, 14373.5]
  - - [2688, 768, 1, 64, 2688, 2688, 64, 64]
    - [4, 14650.6]
  - - [2752, 768, 1, 64, 2752, 2752, 64, 64]
    - [4, 14870.8]
  - - [2816, 768, 1, 64, 2816, 2816, 64, 64]
    - [3, 14870.0]
  - - [2880, 768, 1, 64, 2880, 2880, 64, 64]
    - [3, 15092.8]
  - - [2944, 768, 1, 64, 2944, 2944, 64, 64]
    - [4, 15133.1]
  - - [3008, 768, 1, 64, 3008, 3008, 64, 64]
    - [3, 15267.3]
  - - [3072, 768, 1, 64, 3072, 3072, 64, 64]
    - [6, 14949.8]
  - - [3136, 768, 1, 64, 3136, 3136, 64, 64]
    - [4, 15502.2]
  - - [3200, 768, 1, 64, 3200, 3200, 64, 64]
    - [4, 15764.7]
  - - [3264, 768, 1, 64, 3264, 3264, 64, 64]
    - [4, 16025.3]
  - - [3328, 768, 1, 64, 3328, 3328, 64, 64]
    - [4, 16123.8]
  - - [3392, 768, 1, 64, 3392, 3392, 64, 64]
    - [3, 16343.6]
  - - [3456, 768, 1, 64, 3456, 3456, 64, 64]
    - [4, 16549.8]
  - - [3520, 768, 1, 64, 3520, 3520, 64, 64]
    - [3, 16738.8]
  - - [3584, 768, 1, 64, 3584, 3584, 64, 64]
    - [3, 16615.6]
  - - [3648, 768, 1, 64, 3648, 3648, 64, 64]
    - [3, 17163.2]
  - - [3712, 768, 1, 64, 3712, 3712, 64, 64]
    - [3, 17200.9]
  - - [3776, 768, 1, 64, 3776, 3776, 64, 64]
    - [3, 16971.1]
  - - [3840, 768, 1, 64, 3840, 3840, 64, 64]
    - [3, 17405.3]
  - - [3904, 768, 1, 64, 3904, 3904, 64, 64]
    - [3, 17683.7]
  - - [3968, 768, 1, 64, 3968, 3968, 64, 64]
    - [3, 17809.5]
  - - [4032, 768, 1, 64, 4032, 4032, 64, 64]
    - [3, 17857.1]
  - - [4096, 768, 1, 64, 4096, 4096, 64, 64]
    - [3, 17141.3]
  - - [64, 832, 1, 64, 64, 64, 64, 64]
    - [4, 706.287]
  - - [128, 832, 1, 64, 128, 128, 64, 64]
    - [16, 1323.44]
  - - [192, 832, 1, 64, 192, 192, 64, 64]
    - [15, 1998.34]
  - - [256, 832, 1, 64, 256, 256, 64, 64]
    - [6, 2621.39]
  - - [320, 832, 1, 64, 320, 320, 64, 64]
    - [14, 3292.57]
  - - [384, 832, 1, 64, 384, 384, 64, 64]
    - [1, 3839.8]
  - - [448, 832, 1, 64, 448, 448, 64, 64]
    - [7, 4583.03]
  - - [512, 832, 1, 64, 512, 512, 64, 64]
    - [2, 5074.02]
  - - [576, 832, 1, 64, 576, 576, 64, 64]
    - [7, 5617.32]
  - - [640, 832, 1, 64, 640, 640, 64, 64]
    - [4, 5903.07]
  - - [704, 832, 1, 64, 704, 704, 64, 64]
    - [4, 6334.33]
  - - [768, 832, 1, 64, 768, 768, 64, 64]
    - [4, 6813.42]
  - - [832, 832, 1, 64, 832, 832, 64, 64]
    - [1, 7228.23]
  - - [896, 832, 1, 64, 896, 896, 64, 64]
    - [4, 7639.68]
  - - [960, 832, 1, 64, 960, 960, 64, 64]
    - [7, 7101.63]
  - - [1024, 832, 1, 64, 1024, 1024, 64, 64]
    - [7, 7357.39]
  - - [1088, 832, 1, 64, 1088, 1088, 64, 64]
    - [4, 7670.23]
  - - [1152, 832, 1, 64, 1152, 1152, 64, 64]
    - [7, 7871.31]
  - - [1216, 832, 1, 64, 1216, 1216, 64, 64]
    - [9, 8589.67]
  - - [1280, 832, 1, 64, 1280, 1280, 64, 64]
    - [7, 9736.64]
  - - [1344, 832, 1, 64, 1344, 1344, 64, 64]
    - [4, 10122.3]
  - - [1408, 832, 1, 64, 1408, 1408, 64, 64]
    - [4, 10379.7]
  - - [1472, 832, 1, 64, 1472, 1472, 64, 64]
    - [4, 10794.7]
  - - [1536, 832, 1, 64, 1536, 1536, 64, 64]
    - [6, 10717.8]
  - - [1600, 832, 1, 64, 1600, 1600, 64, 64]
    - [4, 11478.9]
  - - [1664, 832, 1, 64, 1664, 1664, 64, 64]
    - [4, 11693.8]
  - - [1728, 832, 1, 64, 1728, 1728, 64, 64]
    - [3, 11961.9]
  - - [1792, 832, 1, 64, 1792, 1792, 64, 64]
    - [3, 12223.9]
  - - [1856, 832, 1, 64, 1856, 1856, 64, 64]
    - [4, 12479.7]
  - - [1920, 832, 1, 64, 1920, 1920, 64, 64]
    - [4, 12755.5]
  - - [1984, 832, 1, 64, 1984, 1984, 64, 64]
    - [4, 12905.3]
  - - [2048, 832, 1, 64, 2048, 2048, 64, 64]
    - [4, 12884.2]
  - - [2112, 832, 1, 64, 2112, 2112, 64, 64]
    - [4, 13353.0]
  - - [2176, 832, 1, 64, 2176, 2176, 64, 64]
    - [4, 13570.7]
  - - [2240, 832, 1, 64, 2240, 2240, 64, 64]
    - [4, 13736.6]
  - - [2304, 832, 1, 64, 2304, 2304, 64, 64]
    - [4, 13848.3]
  - - [2368, 832, 1, 64, 2368, 2368, 64, 64]
    - [4, 14127.8]
  - - [2432, 832, 1, 64, 2432, 2432, 64, 64]
    - [4, 14372.7]
  - - [2496, 832, 1, 64, 2496, 2496, 64, 64]
    - [4, 14609.9]
  - - [2560, 832, 1, 64, 2560, 2560, 64, 64]
    - [4, 14597.7]
  - - [2624, 832, 1, 64, 2624, 2624, 64, 64]
    - [4, 15077.4]
  - - [2688, 832, 1, 64, 2688, 2688, 64, 64]
    - [4, 15252.4]
  - - [2752, 832, 1, 64, 2752, 2752, 64, 64]
    - [4, 15467.3]
  - - [2816, 832, 1, 64, 2816, 2816, 64, 64]
    - [4, 15394.8]
  - - [2880, 832, 1, 64, 2880, 2880, 64, 64]
    - [4, 15672.2]
  - - [2944, 832, 1, 64, 2944, 2944, 64, 64]
    - [4, 15871.3]
  - - [3008, 832, 1, 64, 3008, 3008, 64, 64]
    - [3, 15934.0]
  - - [3072, 832, 1, 64, 3072, 3072, 64, 64]
    - [6, 15501.9]
  - - [3136, 832, 1, 64, 3136, 3136, 64, 64]
    - [3, 16299.0]
  - - [3200, 832, 1, 64, 3200, 3200, 64, 64]
    - [4, 16437.5]
  - - [3264, 832, 1, 64, 3264, 3264, 64, 64]
    - [3, 16697.0]
  - - [3328, 832, 1, 64, 3328, 3328, 64, 64]
    - [3, 16886.5]
  - - [3392, 832, 1, 64, 3392, 3392, 64, 64]
    - [3, 17176.8]
  - - [3456, 832, 1, 64, 3456, 3456, 64, 64]
    - [3, 17424.7]
  - - [3520, 832, 1, 64, 3520, 3520, 64, 64]
    - [3, 17551.3]
  - - [3584, 832, 1, 64, 3584, 3584, 64, 64]
    - [3, 17447.4]
  - - [3648, 832, 1, 64, 3648, 3648, 64, 64]
    - [3, 17960.8]
  - - [3712, 832, 1, 64, 3712, 3712, 64, 64]
    - [3, 18044.0]
  - - [3776, 832, 1, 64, 3776, 3776, 64, 64]
    - [3, 17716.3]
  - - [3840, 832, 1, 64, 3840, 3840, 64, 64]
    - [3, 18139.6]
  - - [3904, 832, 1, 64, 3904, 3904, 64, 64]
    - [3, 18389.7]
  - - [3968, 832, 1, 64, 3968, 3968, 64, 64]
    - [3, 18546.8]
  - - [4032, 832, 1, 64, 4032, 4032, 64, 64]
    - [3, 18675.4]
  - - [4096, 832, 1, 64, 4096, 4096, 64, 64]
    - [3, 17773.7]
  - - [64, 896, 1, 64, 64, 64, 64, 64]
    - [16, 736.356]
  - - [128, 896, 1, 64, 128, 128, 64, 64]
    - [17, 1460.69]
  - - [192, 896, 1, 64, 192, 192, 64, 64]
    - [16, 2155.44]
  - - [256, 896, 1, 64, 256, 256, 64, 64]
    - [7, 2765.08]
  - - [320, 896, 1, 64, 320, 320, 64, 64]
    - [6, 3493.91]
  - - [384, 896, 1, 64, 384, 384, 64, 64]
    - [15, 4129.76]
  - - [448, 896, 1, 64, 448, 448, 64, 64]
    - [7, 4593.2]
  - - [512, 896, 1, 64, 512, 512, 64, 64]
    - [4, 5302.49]
  - - [576, 896, 1, 64, 576, 576, 64, 64]
    - [7, 5746.35]
  - - [640, 896, 1, 64, 640, 640, 64, 64]
    - [1, 6136.02]
  - - [704, 896, 1, 64, 704, 704, 64, 64]
    - [4, 6704.84]
  - - [768, 896, 1, 64, 768, 768, 64, 64]
    - [7, 7156.29]
  - - [832, 896, 1, 64, 832, 832, 64, 64]
    - [3, 7679.03]
  - - [896, 896, 1, 64, 896, 896, 64, 64]
    - [4, 7990.64]
  - - [960, 896, 1, 64, 960, 960, 64, 64]
    - [0, 7872.08]
  - - [1024, 896, 1, 64, 1024, 1024, 64, 64]
    - [7, 7769.23]
  - - [1088, 896, 1, 64, 1088, 1088, 64, 64]
    - [7, 7956.83]
  - - [1152, 896, 1, 64, 1152, 1152, 64, 64]
    - [7, 9524.16]
  - - [1216, 896, 1, 64, 1216, 1216, 64, 64]
    - [4, 9964.14]
  - - [1280, 896, 1, 64, 1280, 1280, 64, 64]
    - [4, 10316.2]
  - - [1344, 896, 1, 64, 1344, 1344, 64, 64]
    - [4, 10719.0]
  - - [1408, 896, 1, 64, 1408, 1408, 64, 64]
    - [4, 10946.3]
  - - [1472, 896, 1, 64, 1472, 1472, 64, 64]
    - [4, 11353.0]
  - - [1536, 896, 1, 64, 1536, 1536, 64, 64]
    - [3, 11283.6]
  - - [1600, 896, 1, 64, 1600, 1600, 64, 64]
    - [4, 11952.8]
  - - [1664, 896, 1, 64, 1664, 1664, 64, 64]
    - [4, 12188.0]
  - - [1728, 896, 1, 64, 1728, 1728, 64, 64]
    - [4, 12453.2]
  - - [1792, 896, 1, 64, 1792, 1792, 64, 64]
    - [4, 12765.2]
  - - [1856, 896, 1, 64, 1856, 1856, 64, 64]
    - [4, 13068.4]
  - - [1920, 896, 1, 64, 1920, 1920, 64, 64]
    - [4, 13300.3]
  - - [1984, 896, 1, 64, 1984, 1984, 64, 64]
    - [4, 13408.3]
  - - [2048, 896, 1, 64, 2048, 2048, 64, 64]
    - [4, 13366.7]
  - - [2112, 896, 1, 64, 2112, 2112, 64, 64]
    - [4, 13930.3]
  - - [2176, 896, 1, 64, 2176, 2176, 64, 64]
    - [4, 14124.9]
  - - [2240, 896, 1, 64, 2240, 2240, 64, 64]
    - [4, 14193.4]
  - - [2304, 896, 1, 64, 2304, 2304, 64, 64]
    - [4, 14246.3]
  - - [2368, 896, 1, 64, 2368, 2368, 64, 64]
    - [4, 14842.0]
  - - [2432, 896, 1, 64, 2432, 2432, 64, 64]
    - [4, 15044.2]
  - - [2496, 896, 1, 64, 2496, 2496, 64, 64]
    - [3, 15220.1]
  - - [2560, 896, 1, 64, 2560, 2560, 64, 64]
    - [4, 15162.1]
  - - [2624, 896, 1, 64, 2624, 2624, 64, 64]
    - [3, 15566.8]
  - - [2688, 896, 1, 64, 2688, 2688, 64, 64]
    - [4, 15788.1]
  - - [2752, 896, 1, 64, 2752, 2752, 64, 64]
    - [4, 16057.2]
  - - [2816, 896, 1, 64, 2816, 2816, 64, 64]
    - [4, 16029.3]
  - - [2880, 896, 1, 64, 2880, 2880, 64, 64]
    - [3, 16338.4]
  - - [2944, 896, 1, 64, 2944, 2944, 64, 64]
    - [4, 16383.8]
  - - [3008, 896, 1, 64, 3008, 3008, 64, 64]
    - [3, 16725.3]
  - - [3072, 896, 1, 64, 3072, 3072, 64, 64]
    - [3, 16100.8]
  - - [3136, 896, 1, 64, 3136, 3136, 64, 64]
    - [3, 17061.5]
  - - [3200, 896, 1, 64, 3200, 3200, 64, 64]
    - [3, 17141.3]
  - - [3264, 896, 1, 64, 3264, 3264, 64, 64]
    - [3, 17446.7]
  - - [3328, 896, 1, 64, 3328, 3328, 64, 64]
    - [3, 17603.5]
  - - [3392, 896, 1, 64, 3392, 3392, 64, 64]
    - [3, 17879.2]
  - - [3456, 896, 1, 64, 3456, 3456, 64, 64]
    - [3, 18065.4]
  - - [3520, 896, 1, 64, 3520, 3520, 64, 64]
    - [3, 18247.0]
  - - [3584, 896, 1, 64, 3584, 3584, 64, 64]
    - [3, 17781.5]
  - - [3648, 896, 1, 64, 3648, 3648, 64, 64]
    - [3, 18507.4]
  - - [3712, 896, 1, 64, 3712, 3712, 64, 64]
    - [3, 18556.2]
  - - [3776, 896, 1, 64, 3776, 3776, 64, 64]
    - [3, 18524.2]
  - - [3840, 896, 1, 64, 3840, 3840, 64, 64]
    - [3, 18691.0]
  - - [3904, 896, 1, 64, 3904, 3904, 64, 64]
    - [3, 19117.7]
  - - [3968, 896, 1, 64, 3968, 3968, 64, 64]
    - [3, 19170.8]
  - - [4032, 896, 1, 64, 4032, 4032, 64, 64]
    - [3, 19267.3]
  - - [4096, 896, 1, 64, 4096, 4096, 64, 64]
    - [6, 18332.7]
  - - [64, 960, 1, 64, 64, 64, 64, 64]
    - [6, 808.916]
  - - [128, 960, 1, 64, 128, 128, 64, 64]
    - [16, 1604.28]
  - - [192, 960, 1, 64, 192, 192, 64, 64]
    - [0, 2335.45]
  - - [256, 960, 1, 64, 256, 256, 64, 64]
    - [8, 3034.07]
  - - [320, 960, 1, 64, 320, 320, 64, 64]
    - [15, 3703.94]
  - - [384, 960, 1, 64, 384, 384, 64, 64]
    - [8, 4296.66]
  - - [448, 960, 1, 64, 448, 448, 64, 64]
    - [6, 4989.96]
  - - [512, 960, 1, 64, 512, 512, 64, 64]
    - [7, 5618.3]
  - - [576, 960, 1, 64, 576, 576, 64, 64]
    - [1, 6234.84]
  - - [640, 960, 1, 64, 640, 640, 64, 64]
    - [4, 6480.13]
  - - [704, 960, 1, 64, 704, 704, 64, 64]
    - [7, 7045.65]
  - - [768, 960, 1, 64, 768, 768, 64, 64]
    - [1, 7514.82]
  - - [832, 960, 1, 64, 832, 832, 64, 64]
    - [7, 7994.6]
  - - [896, 960, 1, 64, 896, 896, 64, 64]
    - [4, 8447.11]
  - - [960, 960, 1, 64, 960, 960, 64, 64]
    - [7, 7773.04]
  - - [1024, 960, 1, 64, 1024, 1024, 64, 64]
    - [7, 8010.41]
  - - [1088, 960, 1, 64, 1088, 1088, 64, 64]
    - [7, 9593.28]
  - - [1152, 960, 1, 64, 1152, 1152, 64, 64]
    - [4, 10116.9]
  - - [1216, 960, 1, 64, 1216, 1216, 64, 64]
    - [4, 10451.9]
  - - [1280, 960, 1, 64, 1280, 1280, 64, 64]
    - [4, 10792.1]
  - - [1344, 960, 1, 64, 1344, 1344, 64, 64]
    - [4, 11157.2]
  - - [1408, 960, 1, 64, 1408, 1408, 64, 64]
    - [4, 11408.0]
  - - [1472, 960, 1, 64, 1472, 1472, 64, 64]
    - [4, 11806.6]
  - - [1536, 960, 1, 64, 1536, 1536, 64, 64]
    - [6, 11731.8]
  - - [1600, 960, 1, 64, 1600, 1600, 64, 64]
    - [4, 12374.5]
  - - [1664, 960, 1, 64, 1664, 1664, 64, 64]
    - [4, 12629.4]
  - - [1728, 960, 1, 64, 1728, 1728, 64, 64]
    - [4, 13045.9]
  - - [1792, 960, 1, 64, 1792, 1792, 64, 64]
    - [4, 13277.8]
  - - [1856, 960, 1, 64, 1856, 1856, 64, 64]
    - [4, 13525.3]
  - - [1920, 960, 1, 64, 1920, 1920, 64, 64]
    - [4, 13756.7]
  - - [1984, 960, 1, 64, 1984, 1984, 64, 64]
    - [4, 13850.1]
  - - [2048, 960, 1, 64, 2048, 2048, 64, 64]
    - [4, 13876.0]
  - - [2112, 960, 1, 64, 2112, 2112, 64, 64]
    - [4, 14350.9]
  - - [2176, 960, 1, 64, 2176, 2176, 64, 64]
    - [4, 14659.2]
  - - [2240, 960, 1, 64, 2240, 2240, 64, 64]
    - [4, 14825.4]
  - - [2304, 960, 1, 64, 2304, 2304, 64, 64]
    - [4, 14932.1]
  - - [2368, 960, 1, 64, 2368, 2368, 64, 64]
    - [3, 15258.4]
  - - [2432, 960, 1, 64, 2432, 2432, 64, 64]
    - [3, 15501.7]
  - - [2496, 960, 1, 64, 2496, 2496, 64, 64]
    - [3, 15689.8]
  - - [2560, 960, 1, 64, 2560, 2560, 64, 64]
    - [4, 15595.9]
  - - [2624, 960, 1, 64, 2624, 2624, 64, 64]
    - [3, 16099.2]
  - - [2688, 960, 1, 64, 2688, 2688, 64, 64]
    - [3, 16331.9]
  - - [2752, 960, 1, 64, 2752, 2752, 64, 64]
    - [3, 16526.3]
  - - [2816, 960, 1, 64, 2816, 2816, 64, 64]
    - [3, 16602.3]
  - - [2880, 960, 1, 64, 2880, 2880, 64, 64]
    - [3, 16956.9]
  - - [2944, 960, 1, 64, 2944, 2944, 64, 64]
    - [3, 16977.4]
  - - [3008, 960, 1, 64, 3008, 3008, 64, 64]
    - [3, 17410.4]
  - - [3072, 960, 1, 64, 3072, 3072, 64, 64]
    - [3, 16671.9]
  - - [3136, 960, 1, 64, 3136, 3136, 64, 64]
    - [3, 17731.7]
  - - [3200, 960, 1, 64, 3200, 3200, 64, 64]
    - [3, 17884.6]
  - - [3264, 960, 1, 64, 3264, 3264, 64, 64]
    - [3, 18186.0]
  - - [3328, 960, 1, 64, 3328, 3328, 64, 64]
    - [3, 18238.3]
  - - [3392, 960, 1, 64, 3392, 3392, 64, 64]
    - [3, 18406.8]
  - - [3456, 960, 1, 64, 3456, 3456, 64, 64]
    - [3, 18552.5]
  - - [3520, 960, 1, 64, 3520, 3520, 64, 64]
    - [3, 18784.5]
  - - [3584, 960, 1, 64, 3584, 3584, 64, 64]
    - [3, 18383.6]
  - - [3648, 960, 1, 64, 3648, 3648, 64, 64]
    - [3, 19182.6]
  - - [3712, 960, 1, 64, 3712, 3712, 64, 64]
    - [3, 19124.7]
  - - [3776, 960, 1, 64, 3776, 3776, 64, 64]
    - [3, 18906.0]
  - - [3840, 960, 1, 64, 3840, 3840, 64, 64]
    - [3, 19281.4]
  - - [3904, 960, 1, 64, 3904, 3904, 64, 64]
    - [3, 19751.2]
  - - [3968, 960, 1, 64, 3968, 3968, 64, 64]
    - [3, 19876.9]
  - - [4032, 960, 1, 64, 4032, 4032, 64, 64]
    - [3, 20042.3]
  - - [4096, 960, 1, 64, 4096, 4096, 64, 64]
    - [3, 18617.7]
  - - [64, 1024, 1, 64, 64, 64, 64, 64]
    - [7, 919.793]
  - - [128, 1024, 1, 64, 128, 128, 64, 64]
    - [16, 1681.41]
  - - [192, 1024, 1, 64, 192, 192, 64, 64]
    - [4, 2466.25]
  - - [256, 1024, 1, 64, 256, 256, 64, 64]
    - [14, 3217.11]
  - - [320, 1024, 1, 64, 320, 320, 64, 64]
    - [5, 3917.64]
  - - [384, 1024, 1, 64, 384, 384, 64, 64]
    - [12, 4657.66]
  - - [448, 1024, 1, 64, 448, 448, 64, 64]
    - [6, 5162.58]
  - - [512, 1024, 1, 64, 512, 512, 64, 64]
    - [3, 5757.38]
  - - [576, 1024, 1, 64, 576, 576, 64, 64]
    - [4, 6404.5]
  - - [640, 1024, 1, 64, 640, 640, 64, 64]
    - [7, 6834.43]
  - - [704, 1024, 1, 64, 704, 704, 64, 64]
    - [1, 7495.82]
  - - [768, 1024, 1, 64, 768, 768, 64, 64]
    - [3, 7978.96]
  - - [832, 1024, 1, 64, 832, 832, 64, 64]
    - [4, 8419.57]
  - - [896, 1024, 1, 64, 896, 896, 64, 64]
    - [4, 8876.77]
  - - [960, 1024, 1, 64, 960, 960, 64, 64]
    - [7, 8062.74]
  - - [1024, 1024, 1, 64, 1024, 1024, 64, 64]
    - [9, 8866.22]
  - - [1088, 1024, 1, 64, 1088, 1088, 64, 64]
    - [4, 10115.3]
  - - [1152, 1024, 1, 64, 1152, 1152, 64, 64]
    - [4, 10532.4]
  - - [1216, 1024, 1, 64, 1216, 1216, 64, 64]
    - [4, 10824.7]
  - - [1280, 1024, 1, 64, 1280, 1280, 64, 64]
    - [4, 11219.0]
  - - [1344, 1024, 1, 64, 1344, 1344, 64, 64]
    - [4, 11633.8]
  - - [1408, 1024, 1, 64, 1408, 1408, 64, 64]
    - [4, 11889.3]
  - - [1472, 1024, 1, 64, 1472, 1472, 64, 64]
    - [4, 12160.3]
  - - [1536, 1024, 1, 64, 1536, 1536, 64, 64]
    - [6, 12201.5]
  - - [1600, 1024, 1, 64, 1600, 1600, 64, 64]
    - [4, 12880.0]
  - - [1664, 1024, 1, 64, 1664, 1664, 64, 64]
    - [4, 13256.9]
  - - [1728, 1024, 1, 64, 1728, 1728, 64, 64]
    - [4, 13549.3]
  - - [1792, 1024, 1, 64, 1792, 1792, 64, 64]
    - [4, 13792.1]
  - - [1856, 1024, 1, 64, 1856, 1856, 64, 64]
    - [4, 13929.7]
  - - [1920, 1024, 1, 64, 1920, 1920, 64, 64]
    - [4, 14179.4]
  - - [1984, 1024, 1, 64, 1984, 1984, 64, 64]
    - [4, 14303.8]
  - - [2048, 1024, 1, 64, 2048, 2048, 64, 64]
    - [4, 14222.4]
  - - [2112, 1024, 1, 64, 2112, 2112, 64, 64]
    - [4, 14851.0]
  - - [2176, 1024, 1, 64, 2176, 2176, 64, 64]
    - [3, 15136.9]
  - - [2240, 1024, 1, 64, 2240, 2240, 64, 64]
    - [3, 15263.0]
  - - [2304, 1024, 1, 64, 2304, 2304, 64, 64]
    - [3, 15502.4]
  - - [2368, 1024, 1, 64, 2368, 2368, 64, 64]
    - [3, 15692.9]
  - - [2432, 1024, 1, 64, 2432, 2432, 64, 64]
    - [3, 15888.9]
  - - [2496, 1024, 1, 64, 2496, 2496, 64, 64]
    - [3, 16216.5]
  - - [2560, 1024, 1, 64, 2560, 2560, 64, 64]
    - [3, 16091.5]
  - - [2624, 1024, 1, 64, 2624, 2624, 64, 64]
    - [3, 16755.8]
  - - [2688, 1024, 1, 64, 2688, 2688, 64, 64]
    - [3, 16920.4]
  - - [2752, 1024, 1, 64, 2752, 2752, 64, 64]
    - [3, 17142.1]
  - - [2816, 1024, 1, 64, 2816, 2816, 64, 64]
    - [3, 17191.1]
  - - [2880, 1024, 1, 64, 2880, 2880, 64, 64]
    - [3, 17588.6]
  - - [2944, 1024, 1, 64, 2944, 2944, 64, 64]
    - [3, 17666.4]
  - - [3008, 1024, 1, 64, 3008, 3008, 64, 64]
    - [3, 18152.0]
  - - [3072, 1024, 1, 64, 3072, 3072, 64, 64]
    - [6, 16876.9]
  - - [3136, 1024, 1, 64, 3136, 3136, 64, 64]
    - [3, 18184.2]
  - - [3200, 1024, 1, 64, 3200, 3200, 64, 64]
    - [3, 18384.5]
  - - [3264, 1024, 1, 64, 3264, 3264, 64, 64]
    - [3, 18639.5]
  - - [3328, 1024, 1, 64, 3328, 3328, 64, 64]
    - [3, 18701.9]
  - - [3392, 1024, 1, 64, 3392, 3392, 64, 64]
    - [3, 19006.1]
  - - [3456, 1024, 1, 64, 3456, 3456, 64, 64]
    - [3, 19155.0]
  - - [3520, 1024, 1, 64, 3520, 3520, 64, 64]
    - [3, 19352.7]
  - - [3584, 1024, 1, 64, 3584, 3584, 64, 64]
    - [3, 18980.1]
  - - [3648, 1024, 1, 64, 3648, 3648, 64, 64]
    - [3, 19738.5]
  - - [3712, 1024, 1, 64, 3712, 3712, 64, 64]
    - [3, 19792.2]
  - - [3776, 1024, 1, 64, 3776, 3776, 64, 64]
    - [3, 19266.6]
  - - [3840, 1024, 1, 64, 3840, 3840, 64, 64]
    - [3, 19709.8]
  - - [3904, 1024, 1, 64, 3904, 3904, 64, 64]
    - [3, 20360.4]
  - - [3968, 1024, 1, 64, 3968, 3968, 64, 64]
    - [3, 20422.8]
  - - [4032, 1024, 1, 64, 4032, 4032, 64, 64]
    - [3, 20439.2]
  - - [4096, 1024, 1, 64, 4096, 4096, 64, 64]
    - [6, 19041.9]
  - - [64, 1088, 1, 64, 64, 64, 64, 64]
    - [4, 888.974]
  - - [128, 1088, 1, 64, 128, 128, 64, 64]
    - [5, 1885.92]
  - - [192, 1088, 1, 64, 192, 192, 64, 64]
    - [6, 2615.24]
  - - [256, 1088, 1, 64, 256, 256, 64, 64]
    - [5, 3461.96]
  - - [320, 1088, 1, 64, 320, 320, 64, 64]
    - [5, 4194.62]
  - - [384, 1088, 1, 64, 384, 384, 64, 64]
    - [2, 4932.4]
  - - [448, 1088, 1, 64, 448, 448, 64, 64]
    - [6, 5476.63]
  - - [512, 1088, 1, 64, 512, 512, 64, 64]
    - [3, 6149.93]
  - - [576, 1088, 1, 64, 576, 576, 64, 64]
    - [7, 6540.67]
  - - [640, 1088, 1, 64, 640, 640, 64, 64]
    - [4, 7169.23]
  - - [704, 1088, 1, 64, 704, 704, 64, 64]
    - [7, 7792.23]
  - - [768, 1088, 1, 64, 768, 768, 64, 64]
    - [7, 8253.89]
  - - [832, 1088, 1, 64, 832, 832, 64, 64]
    - [4, 8816.52]
  - - [896, 1088, 1, 64, 896, 896, 64, 64]
    - [4, 9233.33]
  - - [960, 1088, 1, 64, 960, 960, 64, 64]
    - [7, 9618.16]
  - - [1024, 1088, 1, 64, 1024, 1024, 64, 64]
    - [4, 10028.4]
  - - [1088, 1088, 1, 64, 1088, 1088, 64, 64]
    - [4, 10631.3]
  - - [1152, 1088, 1, 64, 1152, 1152, 64, 64]
    - [4, 10907.7]
  - - [1216, 1088, 1, 64, 1216, 1216, 64, 64]
    - [4, 11307.6]
  - - [1280, 1088, 1, 64, 1280, 1280, 64, 64]
    - [3, 11718.1]
  - - [1344, 1088, 1, 64, 1344, 1344, 64, 64]
    - [4, 12086.3]
  - - [1408, 1088, 1, 64, 1408, 1408, 64, 64]
    - [4, 12275.0]
  - - [1472, 1088, 1, 64, 1472, 1472, 64, 64]
    - [4, 12655.6]
  - - [1536, 1088, 1, 64, 1536, 1536, 64, 64]
    - [6, 12610.9]
  - - [1600, 1088, 1, 64, 1600, 1600, 64, 64]
    - [4, 13400.3]
  - - [1664, 1088, 1, 64, 1664, 1664, 64, 64]
    - [4, 13657.0]
  - - [1728, 1088, 1, 64, 1728, 1728, 64, 64]
    - [4, 13921.4]
  - - [1792, 1088, 1, 64, 1792, 1792, 64, 64]
    - [4, 14048.5]
  - - [1856, 1088, 1, 64, 1856, 1856, 64, 64]
    - [4, 14338.8]
  - - [1920, 1088, 1, 64, 1920, 1920, 64, 64]
    - [4, 14612.8]
  - - [1984, 1088, 1, 64, 1984, 1984, 64, 64]
    - [4, 14770.5]
  - - [2048, 1088, 1, 64, 2048, 2048, 64, 64]
    - [4, 14632.1]
  - - [2112, 1088, 1, 64, 2112, 2112, 64, 64]
    - [3, 15241.0]
  - - [2176, 1088, 1, 64, 2176, 2176, 64, 64]
    - [3, 15554.6]
  - - [2240, 1088, 1, 64, 2240, 2240, 64, 64]
    - [4, 15614.6]
  - - [2304, 1088, 1, 64, 2304, 2304, 64, 64]
    - [4, 15748.6]
  - - [2368, 1088, 1, 64, 2368, 2368, 64, 64]
    - [3, 16192.3]
  - - [2432, 1088, 1, 64, 2432, 2432, 64, 64]
    - [3, 16503.6]
  - - [2496, 1088, 1, 64, 2496, 2496, 64, 64]
    - [3, 16895.1]
  - - [2560, 1088, 1, 64, 2560, 2560, 64, 64]
    - [3, 16667.1]
  - - [2624, 1088, 1, 64, 2624, 2624, 64, 64]
    - [3, 17294.0]
  - - [2688, 1088, 1, 64, 2688, 2688, 64, 64]
    - [3, 17402.9]
  - - [2752, 1088, 1, 64, 2752, 2752, 64, 64]
    - [3, 17694.0]
  - - [2816, 1088, 1, 64, 2816, 2816, 64, 64]
    - [3, 17748.1]
  - - [2880, 1088, 1, 64, 2880, 2880, 64, 64]
    - [3, 18195.9]
  - - [2944, 1088, 1, 64, 2944, 2944, 64, 64]
    - [3, 18195.8]
  - - [3008, 1088, 1, 64, 3008, 3008, 64, 64]
    - [3, 18581.5]
  - - [3072, 1088, 1, 64, 3072, 3072, 64, 64]
    - [6, 17242.2]
  - - [3136, 1088, 1, 64, 3136, 3136, 64, 64]
    - [3, 18740.4]
  - - [3200, 1088, 1, 64, 3200, 3200, 64, 64]
    - [3, 18844.7]
  - - [3264, 1088, 1, 64, 3264, 3264, 64, 64]
    - [3, 19177.8]
  - - [3328, 1088, 1, 64, 3328, 3328, 64, 64]
    - [3, 19303.0]
  - - [3392, 1088, 1, 64, 3392, 3392, 64, 64]
    - [3, 19540.7]
  - - [3456, 1088, 1, 64, 3456, 3456, 64, 64]
    - [3, 19681.5]
  - - [3520, 1088, 1, 64, 3520, 3520, 64, 64]
    - [3, 19855.9]
  - - [3584, 1088, 1, 64, 3584, 3584, 64, 64]
    - [3, 19362.1]
  - - [3648, 1088, 1, 64, 3648, 3648, 64, 64]
    - [3, 20190.3]
  - - [3712, 1088, 1, 64, 3712, 3712, 64, 64]
    - [3, 20251.5]
  - - [3776, 1088, 1, 64, 3776, 3776, 64, 64]
    - [3, 19672.8]
  - - [3840, 1088, 1, 64, 3840, 3840, 64, 64]
    - [3, 20222.6]
  - - [3904, 1088, 1, 64, 3904, 3904, 64, 64]
    - [3, 20790.8]
  - - [3968, 1088, 1, 64, 3968, 3968, 64, 64]
    - [3, 20948.9]
  - - [4032, 1088, 1, 64, 4032, 4032, 64, 64]
    - [3, 21144.3]
  - - [4096, 1088, 1, 64, 4096, 4096, 64, 64]
    - [3, 19427.1]
  - - [64, 1152, 1, 64, 64, 64, 64, 64]
    - [8, 943.893]
  - - [128, 1152, 1, 64, 128, 128, 64, 64]
    - [15, 1939.0]
  - - [192, 1152, 1, 64, 192, 192, 64, 64]
    - [7, 2823.77]
  - - [256, 1152, 1, 64, 256, 256, 64, 64]
    - [6, 3806.05]
  - - [320, 1152, 1, 64, 320, 320, 64, 64]
    - [1, 4612.46]
  - - [384, 1152, 1, 64, 384, 384, 64, 64]
    - [5, 5147.46]
  - - [448, 1152, 1, 64, 448, 448, 64, 64]
    - [1, 5623.04]
  - - [512, 1152, 1, 64, 512, 512, 64, 64]
    - [4, 6339.98]
  - - [576, 1152, 1, 64, 576, 576, 64, 64]
    - [4, 7004.26]
  - - [640, 1152, 1, 64, 640, 640, 64, 64]
    - [7, 7489.74]
  - - [704, 1152, 1, 64, 704, 704, 64, 64]
    - [7, 8092.31]
  - - [768, 1152, 1, 64, 768, 768, 64, 64]
    - [4, 8648.61]
  - - [832, 1152, 1, 64, 832, 832, 64, 64]
    - [4, 9151.28]
  - - [896, 1152, 1, 64, 896, 896, 64, 64]
    - [7, 9558.61]
  - - [960, 1152, 1, 64, 960, 960, 64, 64]
    - [4, 10146.0]
  - - [1024, 1152, 1, 64, 1024, 1024, 64, 64]
    - [4, 10336.3]
  - - [1088, 1152, 1, 64, 1088, 1088, 64, 64]
    - [4, 10976.4]
  - - [1152, 1152, 1, 64, 1152, 1152, 64, 64]
    - [4, 11350.3]
  - - [1216, 1152, 1, 64, 1216, 1216, 64, 64]
    - [3, 11797.8]
  - - [1280, 1152, 1, 64, 1280, 1280, 64, 64]
    - [3, 12130.0]
  - - [1344, 1152, 1, 64, 1344, 1344, 64, 64]
    - [4, 12467.2]
  - - [1408, 1152, 1, 64, 1408, 1408, 64, 64]
    - [4, 12737.1]
  - - [1472, 1152, 1, 64, 1472, 1472, 64, 64]
    - [4, 13118.3]
  - - [1536, 1152, 1, 64, 1536, 1536, 64, 64]
    - [6, 13003.2]
  - - [1600, 1152, 1, 64, 1600, 1600, 64, 64]
    - [4, 13726.3]
  - - [1664, 1152, 1, 64, 1664, 1664, 64, 64]
    - [4, 13958.6]
  - - [1728, 1152, 1, 64, 1728, 1728, 64, 64]
    - [4, 14268.2]
  - - [1792, 1152, 1, 64, 1792, 1792, 64, 64]
    - [4, 14556.9]
  - - [1856, 1152, 1, 64, 1856, 1856, 64, 64]
    - [4, 14786.9]
  - - [1920, 1152, 1, 64, 1920, 1920, 64, 64]
    - [4, 15036.9]
  - - [1984, 1152, 1, 64, 1984, 1984, 64, 64]
    - [3, 15189.5]
  - - [2048, 1152, 1, 64, 2048, 2048, 64, 64]
    - [4, 15061.6]
  - - [2112, 1152, 1, 64, 2112, 2112, 64, 64]
    - [4, 15658.8]
  - - [2176, 1152, 1, 64, 2176, 2176, 64, 64]
    - [3, 15915.6]
  - - [2240, 1152, 1, 64, 2240, 2240, 64, 64]
    - [4, 16094.9]
  - - [2304, 1152, 1, 64, 2304, 2304, 64, 64]
    - [3, 16317.7]
  - - [2368, 1152, 1, 64, 2368, 2368, 64, 64]
    - [3, 16576.7]
  - - [2432, 1152, 1, 64, 2432, 2432, 64, 64]
    - [3, 17036.0]
  - - [2496, 1152, 1, 64, 2496, 2496, 64, 64]
    - [3, 17331.1]
  - - [2560, 1152, 1, 64, 2560, 2560, 64, 64]
    - [3, 17200.6]
  - - [2624, 1152, 1, 64, 2624, 2624, 64, 64]
    - [3, 17771.4]
  - - [2688, 1152, 1, 64, 2688, 2688, 64, 64]
    - [3, 17990.1]
  - - [2752, 1152, 1, 64, 2752, 2752, 64, 64]
    - [3, 18112.5]
  - - [2816, 1152, 1, 64, 2816, 2816, 64, 64]
    - [3, 18229.5]
  - - [2880, 1152, 1, 64, 2880, 2880, 64, 64]
    - [3, 18552.5]
  - - [2944, 1152, 1, 64, 2944, 2944, 64, 64]
    - [3, 18645.5]
  - - [3008, 1152, 1, 64, 3008, 3008, 64, 64]
    - [3, 18940.2]
  - - [3072, 1152, 1, 64, 3072, 3072, 64, 64]
    - [3, 17713.9]
  - - [3136, 1152, 1, 64, 3136, 3136, 64, 64]
    - [3, 19082.9]
  - - [3200, 1152, 1, 64, 3200, 3200, 64, 64]
    - [3, 19271.9]
  - - [3264, 1152, 1, 64, 3264, 3264, 64, 64]
    - [3, 19609.2]
  - - [3328, 1152, 1, 64, 3328, 3328, 64, 64]
    - [3, 19704.7]
  - - [3392, 1152, 1, 64, 3392, 3392, 64, 64]
    - [3, 19928.5]
  - - [3456, 1152, 1, 64, 3456, 3456, 64, 64]
    - [3, 20000.1]
  - - [3520, 1152, 1, 64, 3520, 3520, 64, 64]
    - [3, 20116.2]
  - - [3584, 1152, 1, 64, 3584, 3584, 64, 64]
    - [3, 19672.3]
  - - [3648, 1152, 1, 64, 3648, 3648, 64, 64]
    - [3, 20698.6]
  - - [3712, 1152, 1, 64, 3712, 3712, 64, 64]
    - [3, 20703.1]
  - - [3776, 1152, 1, 64, 3776, 3776, 64, 64]
    - [3, 20050.0]
  - - [3840, 1152, 1, 64, 3840, 3840, 64, 64]
    - [3, 20627.5]
  - - [3904, 1152, 1, 64, 3904, 3904, 64, 64]
    - [3, 21150.0]
  - - [3968, 1152, 1, 64, 3968, 3968, 64, 64]
    - [3, 21282.4]
  - - [4032, 1152, 1, 64, 4032, 4032, 64, 64]
    - [3, 21283.6]
  - - [4096, 1152, 1, 64, 4096, 4096, 64, 64]
    - [6, 19771.2]
  - - [64, 1216, 1, 64, 64, 64, 64, 64]
    - [17, 983.359]
  - - [128, 1216, 1, 64, 128, 128, 64, 64]
    - [9, 2037.91]
  - - [192, 1216, 1, 64, 192, 192, 64, 64]
    - [5, 2843.95]
  - - [256, 1216, 1, 64, 256, 256, 64, 64]
    - [1, 3743.47]
  - - [320, 1216, 1, 64, 320, 320, 64, 64]
    - [5, 4654.85]
  - - [384, 1216, 1, 64, 384, 384, 64, 64]
    - [7, 5140.87]
  - - [448, 1216, 1, 64, 448, 448, 64, 64]
    - [4, 6090.99]
  - - [512, 1216, 1, 64, 512, 512, 64, 64]
    - [4, 6652.01]
  - - [576, 1216, 1, 64, 576, 576, 64, 64]
    - [1, 7258.11]
  - - [640, 1216, 1, 64, 640, 640, 64, 64]
    - [1, 7912.08]
  - - [704, 1216, 1, 64, 704, 704, 64, 64]
    - [7, 8408.18]
  - - [768, 1216, 1, 64, 768, 768, 64, 64]
    - [4, 8944.65]
  - - [832, 1216, 1, 64, 832, 832, 64, 64]
    - [4, 9492.61]
  - - [896, 1216, 1, 64, 896, 896, 64, 64]
    - [4, 9984.19]
  - - [960, 1216, 1, 64, 960, 960, 64, 64]
    - [4, 10437.3]
  - - [1024, 1216, 1, 64, 1024, 1024, 64, 64]
    - [4, 10750.2]
  - - [1088, 1216, 1, 64, 1088, 1088, 64, 64]
    - [4, 11328.8]
  - - [1152, 1216, 1, 64, 1152, 1152, 64, 64]
    - [3, 11807.3]
  - - [1216, 1216, 1, 64, 1216, 1216, 64, 64]
    - [3, 12199.7]
  - - [1280, 1216, 1, 64, 1280, 1280, 64, 64]
    - [3, 12511.1]
  - - [1344, 1216, 1, 64, 1344, 1344, 64, 64]
    - [4, 12925.6]
  - - [1408, 1216, 1, 64, 1408, 1408, 64, 64]
    - [4, 13159.0]
  - - [1472, 1216, 1, 64, 1472, 1472, 64, 64]
    - [4, 13507.3]
  - - [1536, 1216, 1, 64, 1536, 1536, 64, 64]
    - [6, 13312.8]
  - - [1600, 1216, 1, 64, 1600, 1600, 64, 64]
    - [4, 14087.2]
  - - [1664, 1216, 1, 64, 1664, 1664, 64, 64]
    - [4, 14353.5]
  - - [1728, 1216, 1, 64, 1728, 1728, 64, 64]
    - [4, 14833.2]
  - - [1792, 1216, 1, 64, 1792, 1792, 64, 64]
    - [4, 14984.4]
  - - [1856, 1216, 1, 64, 1856, 1856, 64, 64]
    - [4, 15170.6]
  - - [1920, 1216, 1, 64, 1920, 1920, 64, 64]
    - [4, 15421.6]
  - - [1984, 1216, 1, 64, 1984, 1984, 64, 64]
    - [3, 15514.6]
  - - [2048, 1216, 1, 64, 2048, 2048, 64, 64]
    - [4, 15442.5]
  - - [2112, 1216, 1, 64, 2112, 2112, 64, 64]
    - [3, 16126.5]
  - - [2176, 1216, 1, 64, 2176, 2176, 64, 64]
    - [3, 16331.7]
  - - [2240, 1216, 1, 64, 2240, 2240, 64, 64]
    - [3, 16356.1]
  - - [2304, 1216, 1, 64, 2304, 2304, 64, 64]
    - [3, 16554.7]
  - - [2368, 1216, 1, 64, 2368, 2368, 64, 64]
    - [3, 17049.2]
  - - [2432, 1216, 1, 64, 2432, 2432, 64, 64]
    - [3, 17424.7]
  - - [2496, 1216, 1, 64, 2496, 2496, 64, 64]
    - [3, 17792.9]
  - - [2560, 1216, 1, 64, 2560, 2560, 64, 64]
    - [3, 17636.9]
  - - [2624, 1216, 1, 64, 2624, 2624, 64, 64]
    - [3, 18126.0]
  - - [2688, 1216, 1, 64, 2688, 2688, 64, 64]
    - [3, 18274.5]
  - - [2752, 1216, 1, 64, 2752, 2752, 64, 64]
    - [3, 18510.7]
  - - [2816, 1216, 1, 64, 2816, 2816, 64, 64]
    - [3, 18520.2]
  - - [2880, 1216, 1, 64, 2880, 2880, 64, 64]
    - [3, 18840.8]
  - - [2944, 1216, 1, 64, 2944, 2944, 64, 64]
    - [3, 18923.8]
  - - [3008, 1216, 1, 64, 3008, 3008, 64, 64]
    - [3, 19198.9]
  - - [3072, 1216, 1, 64, 3072, 3072, 64, 64]
    - [3, 18107.4]
  - - [3136, 1216, 1, 64, 3136, 3136, 64, 64]
    - [3, 19367.7]
  - - [3200, 1216, 1, 64, 3200, 3200, 64, 64]
    - [3, 19552.0]
  - - [3264, 1216, 1, 64, 3264, 3264, 64, 64]
    - [3, 19925.8]
  - - [3328, 1216, 1, 64, 3328, 3328, 64, 64]
    - [3, 19941.1]
  - - [3392, 1216, 1, 64, 3392, 3392, 64, 64]
    - [3, 20245.1]
  - - [3456, 1216, 1, 64, 3456, 3456, 64, 64]
    - [3, 20316.9]
  - - [3520, 1216, 1, 64, 3520, 3520, 64, 64]
    - [3, 20444.6]
  - - [3584, 1216, 1, 64, 3584, 3584, 64, 64]
    - [3, 20030.0]
  - - [3648, 1216, 1, 64, 3648, 3648, 64, 64]
    - [3, 20958.1]
  - - [3712, 1216, 1, 64, 3712, 3712, 64, 64]
    - [3, 20968.1]
  - - [3776, 1216, 1, 64, 3776, 3776, 64, 64]
    - [3, 20112.2]
  - - [3840, 1216, 1, 64, 3840, 3840, 64, 64]
    - [3, 20784.6]
  - - [3904, 1216, 1, 64, 3904, 3904, 64, 64]
    - [3, 21407.9]
  - - [3968, 1216, 1, 64, 3968, 3968, 64, 64]
    - [3, 21555.4]
  - - [4032, 1216, 1, 64, 4032, 4032, 64, 64]
    - [3, 21727.1]
  - - [4096, 1216, 1, 64, 4096, 4096, 64, 64]
    - [3, 20141.7]
  - - [64, 1280, 1, 64, 64, 64, 64, 64]
    - [4, 1057.66]
  - - [128, 1280, 1, 64, 128, 128, 64, 64]
    - [17, 2093.36]
  - - [192, 1280, 1, 64, 192, 192, 64, 64]
    - [6, 3138.78]
  - - [256, 1280, 1, 64, 256, 256, 64, 64]
    - [7, 3885.0]
  - - [320, 1280, 1, 64, 320, 320, 64, 64]
    - [7, 4566.13]
  - - [384, 1280, 1, 64, 384, 384, 64, 64]
    - [7, 5475.52]
  - - [448, 1280, 1, 64, 448, 448, 64, 64]
    - [1, 6455.56]
  - - [512, 1280, 1, 64, 512, 512, 64, 64]
    - [7, 6872.44]
  - - [576, 1280, 1, 64, 576, 576, 64, 64]
    - [11, 7635.23]
  - - [640, 1280, 1, 64, 640, 640, 64, 64]
    - [7, 8093.27]
  - - [704, 1280, 1, 64, 704, 704, 64, 64]
    - [4, 8799.4]
  - - [768, 1280, 1, 64, 768, 768, 64, 64]
    - [4, 9257.48]
  - - [832, 1280, 1, 64, 832, 832, 64, 64]
    - [4, 9813.74]
  - - [896, 1280, 1, 64, 896, 896, 64, 64]
    - [4, 10349.6]
  - - [960, 1280, 1, 64, 960, 960, 64, 64]
    - [4, 10847.2]
  - - [1024, 1280, 1, 64, 1024, 1024, 64, 64]
    - [4, 11079.8]
  - - [1088, 1280, 1, 64, 1088, 1088, 64, 64]
    - [3, 11772.2]
  - - [1152, 1280, 1, 64, 1152, 1152, 64, 64]
    - [3, 12154.9]
  - - [1216, 1280, 1, 64, 1216, 1216, 64, 64]
    - [3, 12580.6]
  - - [1280, 1280, 1, 64, 1280, 1280, 64, 64]
    - [4, 12850.0]
  - - [1344, 1280, 1, 64, 1344, 1344, 64, 64]
    - [4, 13266.6]
  - - [1408, 1280, 1, 64, 1408, 1408, 64, 64]
    - [4, 13509.3]
  - - [1472, 1280, 1, 64, 1472, 1472, 64, 64]
    - [4, 13798.5]
  - - [1536, 1280, 1, 64, 1536, 1536, 64, 64]
    - [6, 13677.0]
  - - [1600, 1280, 1, 64, 1600, 1600, 64, 64]
    - [4, 14459.1]
  - - [1664, 1280, 1, 64, 1664, 1664, 64, 64]
    - [4, 14821.5]
  - - [1728, 1280, 1, 64, 1728, 1728, 64, 64]
    - [4, 15126.8]
  - - [1792, 1280, 1, 64, 1792, 1792, 64, 64]
    - [3, 15269.3]
  - - [1856, 1280, 1, 64, 1856, 1856, 64, 64]
    - [4, 15490.8]
  - - [1920, 1280, 1, 64, 1920, 1920, 64, 64]
    - [4, 15772.6]
  - - [1984, 1280, 1, 64, 1984, 1984, 64, 64]
    - [3, 15909.1]
  - - [2048, 1280, 1, 64, 2048, 2048, 64, 64]
    - [4, 15767.9]
  - - [2112, 1280, 1, 64, 2112, 2112, 64, 64]
    - [4, 16394.7]
  - - [2176, 1280, 1, 64, 2176, 2176, 64, 64]
    - [3, 16699.9]
  - - [2240, 1280, 1, 64, 2240, 2240, 64, 64]
    - [3, 16721.2]
  - - [2304, 1280, 1, 64, 2304, 2304, 64, 64]
    - [3, 16994.6]
  - - [2368, 1280, 1, 64, 2368, 2368, 64, 64]
    - [3, 17316.9]
  - - [2432, 1280, 1, 64, 2432, 2432, 64, 64]
    - [3, 17732.7]
  - - [2496, 1280, 1, 64, 2496, 2496, 64, 64]
    - [3, 18046.7]
  - - [2560, 1280, 1, 64, 2560, 2560, 64, 64]
    - [3, 17918.0]
  - - [2624, 1280, 1, 64, 2624, 2624, 64, 64]
    - [3, 18444.8]
  - - [2688, 1280, 1, 64, 2688, 2688, 64, 64]
    - [3, 18445.2]
  - - [2752, 1280, 1, 64, 2752, 2752, 64, 64]
    - [3, 18600.8]
  - - [2816, 1280, 1, 64, 2816, 2816, 64, 64]
    - [3, 18782.2]
  - - [2880, 1280, 1, 64, 2880, 2880, 64, 64]
    - [3, 19286.0]
  - - [2944, 1280, 1, 64, 2944, 2944, 64, 64]
    - [3, 19341.6]
  - - [3008, 1280, 1, 64, 3008, 3008, 64, 64]
    - [3, 19578.3]
  - - [3072, 1280, 1, 64, 3072, 3072, 64, 64]
    - [6, 18247.8]
  - - [3136, 1280, 1, 64, 3136, 3136, 64, 64]
    - [3, 19703.8]
  - - [3200, 1280, 1, 64, 3200, 3200, 64, 64]
    - [3, 20019.9]
  - - [3264, 1280, 1, 64, 3264, 3264, 64, 64]
    - [3, 20414.0]
  - - [3328, 1280, 1, 64, 3328, 3328, 64, 64]
    - [3, 20389.4]
  - - [3392, 1280, 1, 64, 3392, 3392, 64, 64]
    - [3, 20622.6]
  - - [3456, 1280, 1, 64, 3456, 3456, 64, 64]
    - [3, 20690.8]
  - - [3520, 1280, 1, 64, 3520, 3520, 64, 64]
    - [3, 21026.3]
  - - [3584, 1280, 1, 64, 3584, 3584, 64, 64]
    - [3, 20535.7]
  - - [3648, 1280, 1, 64, 3648, 3648, 64, 64]
    - [3, 21454.6]
  - - [3712, 1280, 1, 64, 3712, 3712, 64, 64]
    - [3, 21390.2]
  - - [3776, 1280, 1, 64, 3776, 3776, 64, 64]
    - [3, 20707.3]
  - - [3840, 1280, 1, 64, 3840, 3840, 64, 64]
    - [3, 21396.3]
  - - [3904, 1280, 1, 64, 3904, 3904, 64, 64]
    - [3, 22156.8]
  - - [3968, 1280, 1, 64, 3968, 3968, 64, 64]
    - [3, 22031.6]
  - - [4032, 1280, 1, 64, 4032, 4032, 64, 64]
    - [3, 22438.8]
  - - [4096, 1280, 1, 64, 4096, 4096, 64, 64]
    - [3, 20543.7]
  - - [64, 1344, 1, 64, 64, 64, 64, 64]
    - [16, 1094.86]
  - - [128, 1344, 1, 64, 128, 128, 64, 64]
    - [18, 2220.63]
  - - [192, 1344, 1, 64, 192, 192, 64, 64]
    - [15, 3095.58]
  - - [256, 1344, 1, 64, 256, 256, 64, 64]
    - [1, 4142.99]
  - - [320, 1344, 1, 64, 320, 320, 64, 64]
    - [5, 4859.62]
  - - [384, 1344, 1, 64, 384, 384, 64, 64]
    - [4, 5553.08]
  - - [448, 1344, 1, 64, 448, 448, 64, 64]
    - [6, 6385.23]
  - - [512, 1344, 1, 64, 512, 512, 64, 64]
    - [7, 7071.27]
  - - [576, 1344, 1, 64, 576, 576, 64, 64]
    - [7, 7793.68]
  - - [640, 1344, 1, 64, 640, 640, 64, 64]
    - [7, 8425.13]
  - - [704, 1344, 1, 64, 704, 704, 64, 64]
    - [4, 8999.05]
  - - [768, 1344, 1, 64, 768, 768, 64, 64]
    - [4, 9578.02]
  - - [832, 1344, 1, 64, 832, 832, 64, 64]
    - [4, 10149.5]
  - - [896, 1344, 1, 64, 896, 896, 64, 64]
    - [4, 10648.0]
  - - [960, 1344, 1, 64, 960, 960, 64, 64]
    - [4, 11131.7]
  - - [1024, 1344, 1, 64, 1024, 1024, 64, 64]
    - [4, 11521.1]
  - - [1088, 1344, 1, 64, 1088, 1088, 64, 64]
    - [3, 12075.4]
  - - [1152, 1344, 1, 64, 1152, 1152, 64, 64]
    - [3, 12457.8]
  - - [1216, 1344, 1, 64, 1216, 1216, 64, 64]
    - [4, 12839.9]
  - - [1280, 1344, 1, 64, 1280, 1280, 64, 64]
    - [4, 13209.3]
  - - [1344, 1344, 1, 64, 1344, 1344, 64, 64]
    - [4, 13627.7]
  - - [1408, 1344, 1, 64, 1408, 1408, 64, 64]
    - [4, 13806.3]
  - - [1472, 1344, 1, 64, 1472, 1472, 64, 64]
    - [4, 14178.6]
  - - [1536, 1344, 1, 64, 1536, 1536, 64, 64]
    - [6, 13982.3]
  - - [1600, 1344, 1, 64, 1600, 1600, 64, 64]
    - [4, 14827.0]
  - - [1664, 1344, 1, 64, 1664, 1664, 64, 64]
    - [4, 15098.0]
  - - [1728, 1344, 1, 64, 1728, 1728, 64, 64]
    - [4, 15421.7]
  - - [1792, 1344, 1, 64, 1792, 1792, 64, 64]
    - [4, 15613.7]
  - - [1856, 1344, 1, 64, 1856, 1856, 64, 64]
    - [4, 15881.7]
  - - [1920, 1344, 1, 64, 1920, 1920, 64, 64]
    - [4, 16124.6]
  - - [1984, 1344, 1, 64, 1984, 1984, 64, 64]
    - [3, 16272.8]
  - - [2048, 1344, 1, 64, 2048, 2048, 64, 64]
    - [4, 16134.8]
  - - [2112, 1344, 1, 64, 2112, 2112, 64, 64]
    - [3, 16757.0]
  - - [2176, 1344, 1, 64, 2176, 2176, 64, 64]
    - [3, 17055.7]
  - - [2240, 1344, 1, 64, 2240, 2240, 64, 64]
    - [4, 17275.5]
  - - [2304, 1344, 1, 64, 2304, 2304, 64, 64]
    - [3, 17228.4]
  - - [2368, 1344, 1, 64, 2368, 2368, 64, 64]
    - [4, 17950.4]
  - - [2432, 1344, 1, 64, 2432, 2432, 64, 64]
    - [3, 18077.1]
  - - [2496, 1344, 1, 64, 2496, 2496, 64, 64]
    - [3, 18441.3]
  - - [2560, 1344, 1, 64, 2560, 2560, 64, 64]
    - [3, 18284.3]
  - - [2624, 1344, 1, 64, 2624, 2624, 64, 64]
    - [3, 18735.2]
  - - [2688, 1344, 1, 64, 2688, 2688, 64, 64]
    - [3, 18884.9]
  - - [2752, 1344, 1, 64, 2752, 2752, 64, 64]
    - [3, 19306.2]
  - - [2816, 1344, 1, 64, 2816, 2816, 64, 64]
    - [3, 19366.6]
  - - [2880, 1344, 1, 64, 2880, 2880, 64, 64]
    - [3, 19748.3]
  - - [2944, 1344, 1, 64, 2944, 2944, 64, 64]
    - [3, 19772.6]
  - - [3008, 1344, 1, 64, 3008, 3008, 64, 64]
    - [3, 20130.1]
  - - [3072, 1344, 1, 64, 3072, 3072, 64, 64]
    - [6, 18857.9]
  - - [3136, 1344, 1, 64, 3136, 3136, 64, 64]
    - [3, 20387.2]
  - - [3200, 1344, 1, 64, 3200, 3200, 64, 64]
    - [3, 20459.9]
  - - [3264, 1344, 1, 64, 3264, 3264, 64, 64]
    - [3, 20794.9]
  - - [3328, 1344, 1, 64, 3328, 3328, 64, 64]
    - [3, 20884.0]
  - - [3392, 1344, 1, 64, 3392, 3392, 64, 64]
    - [3, 21148.3]
  - - [3456, 1344, 1, 64, 3456, 3456, 64, 64]
    - [3, 21346.3]
  - - [3520, 1344, 1, 64, 3520, 3520, 64, 64]
    - [3, 21388.2]
  - - [3584, 1344, 1, 64, 3584, 3584, 64, 64]
    - [3, 20954.2]
  - - [3648, 1344, 1, 64, 3648, 3648, 64, 64]
    - [3, 21956.6]
  - - [3712, 1344, 1, 64, 3712, 3712, 64, 64]
    - [3, 22070.2]
  - - [3776, 1344, 1, 64, 3776, 3776, 64, 64]
    - [3, 21349.6]
  - - [3840, 1344, 1, 64, 3840, 3840, 64, 64]
    - [3, 21980.2]
  - - [3904, 1344, 1, 64, 3904, 3904, 64, 64]
    - [3, 22720.1]
  - - [3968, 1344, 1, 64, 3968, 3968, 64, 64]
    - [3, 22451.5]
  - - [4032, 1344, 1, 64, 4032, 4032, 64, 64]
    - [3, 22768.6]
  - - [4096, 1344, 1, 64, 4096, 4096, 64, 64]
    - [3, 21060.3]
  - - [64, 1408, 1, 64, 64, 64, 64, 64]
    - [0, 1140.21]
  - - [128, 1408, 1, 64, 128, 128, 64, 64]
    - [17, 2237.48]
  - - [192, 1408, 1, 64, 192, 192, 64, 64]
    - [5, 3383.81]
  - - [256, 1408, 1, 64, 256, 256, 64, 64]
    - [6, 4355.04]
  - - [320, 1408, 1, 64, 320, 320, 64, 64]
    - [4, 5040.31]
  - - [384, 1408, 1, 64, 384, 384, 64, 64]
    - [4, 5858.91]
  - - [448, 1408, 1, 64, 448, 448, 64, 64]
    - [6, 6552.43]
  - - [512, 1408, 1, 64, 512, 512, 64, 64]
    - [1, 7315.2]
  - - [576, 1408, 1, 64, 576, 576, 64, 64]
    - [7, 8058.33]
  - - [640, 1408, 1, 64, 640, 640, 64, 64]
    - [4, 8707.69]
  - - [704, 1408, 1, 64, 704, 704, 64, 64]
    - [4, 9288.16]
  - - [768, 1408, 1, 64, 768, 768, 64, 64]
    - [4, 9787.16]
  - - [832, 1408, 1, 64, 832, 832, 64, 64]
    - [4, 10437.4]
  - - [896, 1408, 1, 64, 896, 896, 64, 64]
    - [4, 10992.4]
  - - [960, 1408, 1, 64, 960, 960, 64, 64]
    - [4, 11479.2]
  - - [1024, 1408, 1, 64, 1024, 1024, 64, 64]
    - [4, 11760.6]
  - - [1088, 1408, 1, 64, 1088, 1088, 64, 64]
    - [3, 12422.9]
  - - [1152, 1408, 1, 64, 1152, 1152, 64, 64]
    - [4, 12749.6]
  - - [1216, 1408, 1, 64, 1216, 1216, 64, 64]
    - [4, 13184.3]
  - - [1280, 1408, 1, 64, 1280, 1280, 64, 64]
    - [4, 13569.6]
  - - [1344, 1408, 1, 64, 1344, 1344, 64, 64]
    - [4, 13888.6]
  - - [1408, 1408, 1, 64, 1408, 1408, 64, 64]
    - [4, 14109.9]
  - - [1472, 1408, 1, 64, 1472, 1472, 64, 64]
    - [4, 14525.1]
  - - [1536, 1408, 1, 64, 1536, 1536, 64, 64]
    - [6, 14286.7]
  - - [1600, 1408, 1, 64, 1600, 1600, 64, 64]
    - [4, 15175.0]
  - - [1664, 1408, 1, 64, 1664, 1664, 64, 64]
    - [4, 15410.6]
  - - [1728, 1408, 1, 64, 1728, 1728, 64, 64]
    - [4, 15790.7]
  - - [1792, 1408, 1, 64, 1792, 1792, 64, 64]
    - [4, 15950.1]
  - - [1856, 1408, 1, 64, 1856, 1856, 64, 64]
    - [4, 16187.1]
  - - [1920, 1408, 1, 64, 1920, 1920, 64, 64]
    - [4, 16439.8]
  - - [1984, 1408, 1, 64, 1984, 1984, 64, 64]
    - [4, 16532.2]
  - - [2048, 1408, 1, 64, 2048, 2048, 64, 64]
    - [4, 16455.4]
  - - [2112, 1408, 1, 64, 2112, 2112, 64, 64]
    - [3, 17226.1]
  - - [2176, 1408, 1, 64, 2176, 2176, 64, 64]
    - [3, 17533.9]
  - - [2240, 1408, 1, 64, 2240, 2240, 64, 64]
    - [4, 17417.3]
  - - [2304, 1408, 1, 64, 2304, 2304, 64, 64]
    - [3, 17602.0]
  - - [2368, 1408, 1, 64, 2368, 2368, 64, 64]
    - [4, 18292.5]
  - - [2432, 1408, 1, 64, 2432, 2432, 64, 64]
    - [3, 18583.0]
  - - [2496, 1408, 1, 64, 2496, 2496, 64, 64]
    - [3, 18848.3]
  - - [2560, 1408, 1, 64, 2560, 2560, 64, 64]
    - [3, 18665.2]
  - - [2624, 1408, 1, 64, 2624, 2624, 64, 64]
    - [3, 19374.8]
  - - [2688, 1408, 1, 64, 2688, 2688, 64, 64]
    - [3, 19458.4]
  - - [2752, 1408, 1, 64, 2752, 2752, 64, 64]
    - [3, 19733.0]
  - - [2816, 1408, 1, 64, 2816, 2816, 64, 64]
    - [3, 19764.2]
  - - [2880, 1408, 1, 64, 2880, 2880, 64, 64]
    - [3, 20169.4]
  - - [2944, 1408, 1, 64, 2944, 2944, 64, 64]
    - [3, 20207.7]
  - - [3008, 1408, 1, 64, 3008, 3008, 64, 64]
    - [3, 20601.4]
  - - [3072, 1408, 1, 64, 3072, 3072, 64, 64]
    - [6, 19249.1]
  - - [3136, 1408, 1, 64, 3136, 3136, 64, 64]
    - [3, 20787.7]
  - - [3200, 1408, 1, 64, 3200, 3200, 64, 64]
    - [3, 20933.2]
  - - [3264, 1408, 1, 64, 3264, 3264, 64, 64]
    - [3, 21347.2]
  - - [3328, 1408, 1, 64, 3328, 3328, 64, 64]
    - [3, 21365.7]
  - - [3392, 1408, 1, 64, 3392, 3392, 64, 64]
    - [3, 21570.6]
  - - [3456, 1408, 1, 64, 3456, 3456, 64, 64]
    - [3, 21906.5]
  - - [3520, 1408, 1, 64, 3520, 3520, 64, 64]
    - [3, 21970.7]
  - - [3584, 1408, 1, 64, 3584, 3584, 64, 64]
    - [3, 21292.0]
  - - [3648, 1408, 1, 64, 3648, 3648, 64, 64]
    - [3, 22371.4]
  - - [3712, 1408, 1, 64, 3712, 3712, 64, 64]
    - [3, 22351.6]
  - - [3776, 1408, 1, 64, 3776, 3776, 64, 64]
    - [3, 21797.4]
  - - [3840, 1408, 1, 64, 3840, 3840, 64, 64]
    - [3, 22172.6]
  - - [3904, 1408, 1, 64, 3904, 3904, 64, 64]
    - [3, 22827.3]
  - - [3968, 1408, 1, 64, 3968, 3968, 64, 64]
    - [3, 23031.3]
  - - [4032, 1408, 1, 64, 4032, 4032, 64, 64]
    - [3, 23428.4]
  - - [4096, 1408, 1, 64, 4096, 4096, 64, 64]
    - [3, 21266.0]
  - - [64, 1472, 1, 64, 64, 64, 64, 64]
    - [17, 1205.12]
  - - [128, 1472, 1, 64, 128, 128, 64, 64]
    - [7, 2465.94]
  - - [192, 1472, 1, 64, 192, 192, 64, 64]
    - [7, 3573.23]
  - - [256, 1472, 1, 64, 256, 256, 64, 64]
    - [3, 4436.54]
  - - [320, 1472, 1, 64, 320, 320, 64, 64]
    - [0, 5476.16]
  - - [384, 1472, 1, 64, 384, 384, 64, 64]
    - [1, 6137.67]
  - - [448, 1472, 1, 64, 448, 448, 64, 64]
    - [0, 6927.88]
  - - [512, 1472, 1, 64, 512, 512, 64, 64]
    - [1, 7633.19]
  - - [576, 1472, 1, 64, 576, 576, 64, 64]
    - [4, 8353.35]
  - - [640, 1472, 1, 64, 640, 640, 64, 64]
    - [4, 9019.03]
  - - [704, 1472, 1, 64, 704, 704, 64, 64]
    - [7, 9494.88]
  - - [768, 1472, 1, 64, 768, 768, 64, 64]
    - [7, 10086.6]
  - - [832, 1472, 1, 64, 832, 832, 64, 64]
    - [4, 10778.4]
  - - [896, 1472, 1, 64, 896, 896, 64, 64]
    - [4, 11330.1]
  - - [960, 1472, 1, 64, 960, 960, 64, 64]
    - [4, 11829.8]
  - - [1024, 1472, 1, 64, 1024, 1024, 64, 64]
    - [4, 12081.2]
  - - [1088, 1472, 1, 64, 1088, 1088, 64, 64]
    - [4, 12704.1]
  - - [1152, 1472, 1, 64, 1152, 1152, 64, 64]
    - [4, 13067.6]
  - - [1216, 1472, 1, 64, 1216, 1216, 64, 64]
    - [4, 13497.7]
  - - [1280, 1472, 1, 64, 1280, 1280, 64, 64]
    - [4, 13839.6]
  - - [1344, 1472, 1, 64, 1344, 1344, 64, 64]
    - [4, 14178.5]
  - - [1408, 1472, 1, 64, 1408, 1408, 64, 64]
    - [4, 14447.6]
  - - [1472, 1472, 1, 64, 1472, 1472, 64, 64]
    - [4, 14802.9]
  - - [1536, 1472, 1, 64, 1536, 1536, 64, 64]
    - [6, 14614.9]
  - - [1600, 1472, 1, 64, 1600, 1600, 64, 64]
    - [4, 15454.8]
  - - [1664, 1472, 1, 64, 1664, 1664, 64, 64]
    - [4, 15740.6]
  - - [1728, 1472, 1, 64, 1728, 1728, 64, 64]
    - [4, 16209.2]
  - - [1792, 1472, 1, 64, 1792, 1792, 64, 64]
    - [4, 16241.9]
  - - [1856, 1472, 1, 64, 1856, 1856, 64, 64]
    - [4, 16456.2]
  - - [1920, 1472, 1, 64, 1920, 1920, 64, 64]
    - [4, 16815.0]
  - - [1984, 1472, 1, 64, 1984, 1984, 64, 64]
    - [3, 17030.1]
  - - [2048, 1472, 1, 64, 2048, 2048, 64, 64]
    - [4, 16668.3]
  - - [2112, 1472, 1, 64, 2112, 2112, 64, 64]
    - [3, 17620.0]
  - - [2176, 1472, 1, 64, 2176, 2176, 64, 64]
    - [3, 17906.5]
  - - [2240, 1472, 1, 64, 2240, 2240, 64, 64]
    - [3, 17887.9]
  - - [2304, 1472, 1, 64, 2304, 2304, 64, 64]
    - [4, 18189.3]
  - - [2368, 1472, 1, 64, 2368, 2368, 64, 64]
    - [3, 18508.4]
  - - [2432, 1472, 1, 64, 2432, 2432, 64, 64]
    - [3, 18895.8]
  - - [2496, 1472, 1, 64, 2496, 2496, 64, 64]
    - [3, 19322.9]
  - - [2560, 1472, 1, 64, 2560, 2560, 64, 64]
    - [3, 19033.2]
  - - [2624, 1472, 1, 64, 2624, 2624, 64, 64]
    - [3, 19791.7]
  - - [2688, 1472, 1, 64, 2688, 2688, 64, 64]
    - [3, 19811.3]
  - - [2752, 1472, 1, 64, 2752, 2752, 64, 64]
    - [3, 20122.4]
  - - [2816, 1472, 1, 64, 2816, 2816, 64, 64]
    - [3, 20227.7]
  - - [2880, 1472, 1, 64, 2880, 2880, 64, 64]
    - [3, 20682.6]
  - - [2944, 1472, 1, 64, 2944, 2944, 64, 64]
    - [3, 20674.2]
  - - [3008, 1472, 1, 64, 3008, 3008, 64, 64]
    - [3, 20992.2]
  - - [3072, 1472, 1, 64, 3072, 3072, 64, 64]
    - [3, 19404.9]
  - - [3136, 1472, 1, 64, 3136, 3136, 64, 64]
    - [3, 21238.8]
  - - [3200, 1472, 1, 64, 3200, 3200, 64, 64]
    - [3, 21400.0]
  - - [3264, 1472, 1, 64, 3264, 3264, 64, 64]
    - [3, 21690.9]
  - - [3328, 1472, 1, 64, 3328, 3328, 64, 64]
    - [3, 21742.0]
  - - [3392, 1472, 1, 64, 3392, 3392, 64, 64]
    - [3, 22071.4]
  - - [3456, 1472, 1, 64, 3456, 3456, 64, 64]
    - [3, 22100.1]
  - - [3520, 1472, 1, 64, 3520, 3520, 64, 64]
    - [3, 22412.0]
  - - [3584, 1472, 1, 64, 3584, 3584, 64, 64]
    - [3, 21879.1]
  - - [3648, 1472, 1, 64, 3648, 3648, 64, 64]
    - [3, 22718.8]
  - - [3712, 1472, 1, 64, 3712, 3712, 64, 64]
    - [3, 23112.7]
  - - [3776, 1472, 1, 64, 3776, 3776, 64, 64]
    - [3, 21948.9]
  - - [3840, 1472, 1, 64, 3840, 3840, 64, 64]
    - [3, 22606.9]
  - - [3904, 1472, 1, 64, 3904, 3904, 64, 64]
    - [3, 23455.6]
  - - [3968, 1472, 1, 64, 3968, 3968, 64, 64]
    - [3, 23313.8]
  - - [4032, 1472, 1, 64, 4032, 4032, 64, 64]
    - [3, 23529.8]
  - - [4096, 1472, 1, 64, 4096, 4096, 64, 64]
    - [3, 21432.5]
  - - [64, 1536, 1, 64, 64, 64, 64, 64]
    - [6, 1334.61]
  - - [128, 1536, 1, 64, 128, 128, 64, 64]
    - [6, 2496.09]
  - - [192, 1536, 1, 64, 192, 192, 64, 64]
    - [7, 3724.92]
  - - [256, 1536, 1, 64, 256, 256, 64, 64]
    - [11, 4530.28]
  - - [320, 1536, 1, 64, 320, 320, 64, 64]
    - [6, 5394.77]
  - - [384, 1536, 1, 64, 384, 384, 64, 64]
    - [4, 6388.26]
  - - [448, 1536, 1, 64, 448, 448, 64, 64]
    - [4, 7186.63]
  - - [512, 1536, 1, 64, 512, 512, 64, 64]
    - [3, 7913.66]
  - - [576, 1536, 1, 64, 576, 576, 64, 64]
    - [4, 8651.35]
  - - [640, 1536, 1, 64, 640, 640, 64, 64]
    - [7, 9269.79]
  - - [704, 1536, 1, 64, 704, 704, 64, 64]
    - [4, 9854.13]
  - - [768, 1536, 1, 64, 768, 768, 64, 64]
    - [4, 10491.5]
  - - [832, 1536, 1, 64, 832, 832, 64, 64]
    - [4, 11067.4]
  - - [896, 1536, 1, 64, 896, 896, 64, 64]
    - [3, 11644.6]
  - - [960, 1536, 1, 64, 960, 960, 64, 64]
    - [3, 12142.5]
  - - [1024, 1536, 1, 64, 1024, 1024, 64, 64]
    - [4, 12380.0]
  - - [1088, 1536, 1, 64, 1088, 1088, 64, 64]
    - [4, 12978.2]
  - - [1152, 1536, 1, 64, 1152, 1152, 64, 64]
    - [4, 13468.7]
  - - [1216, 1536, 1, 64, 1216, 1216, 64, 64]
    - [4, 13801.7]
  - - [1280, 1536, 1, 64, 1280, 1280, 64, 64]
    - [4, 14084.2]
  - - [1344, 1536, 1, 64, 1344, 1344, 64, 64]
    - [4, 14485.1]
  - - [1408, 1536, 1, 64, 1408, 1408, 64, 64]
    - [4, 14708.9]
  - - [1472, 1536, 1, 64, 1472, 1472, 64, 64]
    - [4, 15114.1]
  - - [1536, 1536, 1, 64, 1536, 1536, 64, 64]
    - [6, 14898.2]
  - - [1600, 1536, 1, 64, 1600, 1600, 64, 64]
    - [4, 15774.2]
  - - [1664, 1536, 1, 64, 1664, 1664, 64, 64]
    - [4, 16173.2]
  - - [1728, 1536, 1, 64, 1728, 1728, 64, 64]
    - [4, 16431.3]
  - - [1792, 1536, 1, 64, 1792, 1792, 64, 64]
    - [4, 16511.2]
  - - [1856, 1536, 1, 64, 1856, 1856, 64, 64]
    - [3, 16823.4]
  - - [1920, 1536, 1, 64, 1920, 1920, 64, 64]
    - [3, 17133.4]
  - - [1984, 1536, 1, 64, 1984, 1984, 64, 64]
    - [3, 17404.3]
  - - [2048, 1536, 1, 64, 2048, 2048, 64, 64]
    - [4, 16985.1]
  - - [2112, 1536, 1, 64, 2112, 2112, 64, 64]
    - [3, 17980.0]
  - - [2176, 1536, 1, 64, 2176, 2176, 64, 64]
    - [3, 18292.0]
  - - [2240, 1536, 1, 64, 2240, 2240, 64, 64]
    - [3, 18420.5]
  - - [2304, 1536, 1, 64, 2304, 2304, 64, 64]
    - [3, 18427.3]
  - - [2368, 1536, 1, 64, 2368, 2368, 64, 64]
    - [3, 18982.4]
  - - [2432, 1536, 1, 64, 2432, 2432, 64, 64]
    - [3, 19447.8]
  - - [2496, 1536, 1, 64, 2496, 2496, 64, 64]
    - [3, 19715.8]
  - - [2560, 1536, 1, 64, 2560, 2560, 64, 64]
    - [3, 19257.3]
  - - [2624, 1536, 1, 64, 2624, 2624, 64, 64]
    - [3, 20128.5]
  - - [2688, 1536, 1, 64, 2688, 2688, 64, 64]
    - [3, 20280.7]
  - - [2752, 1536, 1, 64, 2752, 2752, 64, 64]
    - [3, 20574.1]
  - - [2816, 1536, 1, 64, 2816, 2816, 64, 64]
    - [3, 20572.3]
  - - [2880, 1536, 1, 64, 2880, 2880, 64, 64]
    - [3, 20986.8]
  - - [2944, 1536, 1, 64, 2944, 2944, 64, 64]
    - [3, 21098.1]
  - - [3008, 1536, 1, 64, 3008, 3008, 64, 64]
    - [3, 21425.6]
  - - [3072, 1536, 1, 64, 3072, 3072, 64, 64]
    - [6, 19541.0]
  - - [3136, 1536, 1, 64, 3136, 3136, 64, 64]
    - [3, 21613.7]
  - - [3200, 1536, 1, 64, 3200, 3200, 64, 64]
    - [3, 21763.4]
  - - [3264, 1536, 1, 64, 3264, 3264, 64, 64]
    - [3, 22154.2]
  - - [3328, 1536, 1, 64, 3328, 3328, 64, 64]
    - [3, 22066.1]
  - - [3392, 1536, 1, 64, 3392, 3392, 64, 64]
    - [3, 22396.7]
  - - [3456, 1536, 1, 64, 3456, 3456, 64, 64]
    - [3, 22633.9]
  - - [3520, 1536, 1, 64, 3520, 3520, 64, 64]
    - [3, 22685.8]
  - - [3584, 1536, 1, 64, 3584, 3584, 64, 64]
    - [3, 21714.5]
  - - [3648, 1536, 1, 64, 3648, 3648, 64, 64]
    - [3, 23378.9]
  - - [3712, 1536, 1, 64, 3712, 3712, 64, 64]
    - [3, 23270.1]
  - - [3776, 1536, 1, 64, 3776, 3776, 64, 64]
    - [3, 22241.8]
  - - [3840, 1536, 1, 64, 3840, 3840, 64, 64]
    - [3, 22774.2]
  - - [3904, 1536, 1, 64, 3904, 3904, 64, 64]
    - [3, 23551.6]
  - - [3968, 1536, 1, 64, 3968, 3968, 64, 64]
    - [3, 23083.5]
  - - [4032, 1536, 1, 64, 4032, 4032, 64, 64]
    - [3, 23412.8]
  - - [4096, 1536, 1, 64, 4096, 4096, 64, 64]
    - [3, 21593.2]
  - - [64, 1600, 1, 64, 64, 64, 64, 64]
    - [17, 1286.51]
  - - [128, 1600, 1, 64, 128, 128, 64, 64]
    - [7, 2507.56]
  - - [192, 1600, 1, 64, 192, 192, 64, 64]
    - [1, 3679.68]
  - - [256, 1600, 1, 64, 256, 256, 64, 64]
    - [5, 4823.19]
  - - [320, 1600, 1, 64, 320, 320, 64, 64]
    - [6, 5517.38]
  - - [384, 1600, 1, 64, 384, 384, 64, 64]
    - [1, 6408.24]
  - - [448, 1600, 1, 64, 448, 448, 64, 64]
    - [4, 7372.94]
  - - [512, 1600, 1, 64, 512, 512, 64, 64]
    - [6, 8128.5]
  - - [576, 1600, 1, 64, 576, 576, 64, 64]
    - [4, 8842.84]
  - - [640, 1600, 1, 64, 640, 640, 64, 64]
    - [4, 9575.58]
  - - [704, 1600, 1, 64, 704, 704, 64, 64]
    - [4, 10143.4]
  - - [768, 1600, 1, 64, 768, 768, 64, 64]
    - [4, 10725.8]
  - - [832, 1600, 1, 64, 832, 832, 64, 64]
    - [4, 11330.8]
  - - [896, 1600, 1, 64, 896, 896, 64, 64]
    - [3, 11867.8]
  - - [960, 1600, 1, 64, 960, 960, 64, 64]
    - [3, 12388.5]
  - - [1024, 1600, 1, 64, 1024, 1024, 64, 64]
    - [4, 12716.0]
  - - [1088, 1600, 1, 64, 1088, 1088, 64, 64]
    - [4, 13315.4]
  - - [1152, 1600, 1, 64, 1152, 1152, 64, 64]
    - [4, 13618.5]
  - - [1216, 1600, 1, 64, 1216, 1216, 64, 64]
    - [4, 14057.0]
  - - [1280, 1600, 1, 64, 1280, 1280, 64, 64]
    - [4, 14381.2]
  - - [1344, 1600, 1, 64, 1344, 1344, 64, 64]
    - [3, 14731.8]
  - - [1408, 1600, 1, 64, 1408, 1408, 64, 64]
    - [4, 14999.7]
  - - [1472, 1600, 1, 64, 1472, 1472, 64, 64]
    - [4, 15412.2]
  - - [1536, 1600, 1, 64, 1536, 1536, 64, 64]
    - [6, 15218.7]
  - - [1600, 1600, 1, 64, 1600, 1600, 64, 64]
    - [4, 16116.3]
  - - [1664, 1600, 1, 64, 1664, 1664, 64, 64]
    - [4, 16407.5]
  - - [1728, 1600, 1, 64, 1728, 1728, 64, 64]
    - [3, 16672.4]
  - - [1792, 1600, 1, 64, 1792, 1792, 64, 64]
    - [3, 16929.4]
  - - [1856, 1600, 1, 64, 1856, 1856, 64, 64]
    - [3, 17155.8]
  - - [1920, 1600, 1, 64, 1920, 1920, 64, 64]
    - [3, 17515.0]
  - - [1984, 1600, 1, 64, 1984, 1984, 64, 64]
    - [3, 17769.5]
  - - [2048, 1600, 1, 64, 2048, 2048, 64, 64]
    - [4, 17305.9]
  - - [2112, 1600, 1, 64, 2112, 2112, 64, 64]
    - [3, 18396.2]
  - - [2176, 1600, 1, 64, 2176, 2176, 64, 64]
    - [3, 18639.7]
  - - [2240, 1600, 1, 64, 2240, 2240, 64, 64]
    - [3, 18684.7]
  - - [2304, 1600, 1, 64, 2304, 2304, 64, 64]
    - [3, 18828.9]
  - - [2368, 1600, 1, 64, 2368, 2368, 64, 64]
    - [3, 19341.2]
  - - [2432, 1600, 1, 64, 2432, 2432, 64, 64]
    - [3, 19764.6]
  - - [2496, 1600, 1, 64, 2496, 2496, 64, 64]
    - [3, 20030.4]
  - - [2560, 1600, 1, 64, 2560, 2560, 64, 64]
    - [3, 19438.0]
  - - [2624, 1600, 1, 64, 2624, 2624, 64, 64]
    - [3, 20479.8]
  - - [2688, 1600, 1, 64, 2688, 2688, 64, 64]
    - [3, 20644.0]
  - - [2752, 1600, 1, 64, 2752, 2752, 64, 64]
    - [3, 20928.5]
  - - [2816, 1600, 1, 64, 2816, 2816, 64, 64]
    - [3, 20773.4]
  - - [2880, 1600, 1, 64, 2880, 2880, 64, 64]
    - [3, 21319.2]
  - - [2944, 1600, 1, 64, 2944, 2944, 64, 64]
    - [3, 21394.0]
  - - [3008, 1600, 1, 64, 3008, 3008, 64, 64]
    - [3, 21715.7]
  - - [3072, 1600, 1, 64, 3072, 3072, 64, 64]
    - [1, 19792.9]
  - - [3136, 1600, 1, 64, 3136, 3136, 64, 64]
    - [3, 21831.7]
  - - [3200, 1600, 1, 64, 3200, 3200, 64, 64]
    - [3, 22209.3]
  - - [3264, 1600, 1, 64, 3264, 3264, 64, 64]
    - [3, 22412.0]
  - - [3328, 1600, 1, 64, 3328, 3328, 64, 64]
    - [3, 22362.6]
  - - [3392, 1600, 1, 64, 3392, 3392, 64, 64]
    - [3, 22657.3]
  - - [3456, 1600, 1, 64, 3456, 3456, 64, 64]
    - [3, 22775.8]
  - - [3520, 1600, 1, 64, 3520, 3520, 64, 64]
    - [3, 23135.0]
  - - [3584, 1600, 1, 64, 3584, 3584, 64, 64]
    - [3, 22043.3]
  - - [3648, 1600, 1, 64, 3648, 3648, 64, 64]
    - [3, 23310.5]
  - - [3712, 1600, 1, 64, 3712, 3712, 64, 64]
    - [3, 23547.5]
  - - [3776, 1600, 1, 64, 3776, 3776, 64, 64]
    - [3, 22508.8]
  - - [3840, 1600, 1, 64, 3840, 3840, 64, 64]
    - [3, 23388.7]
  - - [3904, 1600, 1, 64, 3904, 3904, 64, 64]
    - [3, 23312.6]
  - - [3968, 1600, 1, 64, 3968, 3968, 64, 64]
    - [3, 23801.7]
  - - [4032, 1600, 1, 64, 4032, 4032, 64, 64]
    - [3, 23438.7]
  - - [4096, 1600, 1, 64, 4096, 4096, 64, 64]
    - [3, 22208.2]
  - - [64, 1664, 1, 64, 64, 64, 64, 64]
    - [16, 1371.92]
  - - [128, 1664, 1, 64, 128, 128, 64, 64]
    - [16, 2640.21]
  - - [192, 1664, 1, 64, 192, 192, 64, 64]
    - [18, 3805.52]
  - - [256, 1664, 1, 64, 256, 256, 64, 64]
    - [7, 4916.63]
  - - [320, 1664, 1, 64, 320, 320, 64, 64]
    - [1, 6207.36]
  - - [384, 1664, 1, 64, 384, 384, 64, 64]
    - [0, 6717.11]
  - - [448, 1664, 1, 64, 448, 448, 64, 64]
    - [1, 7685.22]
  - - [512, 1664, 1, 64, 512, 512, 64, 64]
    - [4, 8387.16]
  - - [576, 1664, 1, 64, 576, 576, 64, 64]
    - [4, 9147.18]
  - - [640, 1664, 1, 64, 640, 640, 64, 64]
    - [7, 9764.57]
  - - [704, 1664, 1, 64, 704, 704, 64, 64]
    - [4, 10456.4]
  - - [768, 1664, 1, 64, 768, 768, 64, 64]
    - [4, 10971.0]
  - - [832, 1664, 1, 64, 832, 832, 64, 64]
    - [4, 11608.0]
  - - [896, 1664, 1, 64, 896, 896, 64, 64]
    - [3, 12156.9]
  - - [960, 1664, 1, 64, 960, 960, 64, 64]
    - [4, 12701.5]
  - - [1024, 1664, 1, 64, 1024, 1024, 64, 64]
    - [4, 12980.7]
  - - [1088, 1664, 1, 64, 1088, 1088, 64, 64]
    - [4, 13573.8]
  - - [1152, 1664, 1, 64, 1152, 1152, 64, 64]
    - [4, 13923.8]
  - - [1216, 1664, 1, 64, 1216, 1216, 64, 64]
    - [4, 14304.4]
  - - [1280, 1664, 1, 64, 1280, 1280, 64, 64]
    - [4, 14662.1]
  - - [1344, 1664, 1, 64, 1344, 1344, 64, 64]
    - [4, 15074.1]
  - - [1408, 1664, 1, 64, 1408, 1408, 64, 64]
    - [4, 15317.6]
  - - [1472, 1664, 1, 64, 1472, 1472, 64, 64]
    - [4, 15759.5]
  - - [1536, 1664, 1, 64, 1536, 1536, 64, 64]
    - [6, 15443.4]
  - - [1600, 1664, 1, 64, 1600, 1600, 64, 64]
    - [4, 16371.1]
  - - [1664, 1664, 1, 64, 1664, 1664, 64, 64]
    - [4, 16592.4]
  - - [1728, 1664, 1, 64, 1728, 1728, 64, 64]
    - [3, 17026.5]
  - - [1792, 1664, 1, 64, 1792, 1792, 64, 64]
    - [3, 17347.4]
  - - [1856, 1664, 1, 64, 1856, 1856, 64, 64]
    - [3, 17588.0]
  - - [1920, 1664, 1, 64, 1920, 1920, 64, 64]
    - [3, 17747.5]
  - - [1984, 1664, 1, 64, 1984, 1984, 64, 64]
    - [3, 18153.3]
  - - [2048, 1664, 1, 64, 2048, 2048, 64, 64]
    - [4, 17540.7]
  - - [2112, 1664, 1, 64, 2112, 2112, 64, 64]
    - [3, 18662.2]
  - - [2176, 1664, 1, 64, 2176, 2176, 64, 64]
    - [3, 18988.2]
  - - [2240, 1664, 1, 64, 2240, 2240, 64, 64]
    - [3, 19032.1]
  - - [2304, 1664, 1, 64, 2304, 2304, 64, 64]
    - [3, 19238.2]
  - - [2368, 1664, 1, 64, 2368, 2368, 64, 64]
    - [3, 19675.4]
  - - [2432, 1664, 1, 64, 2432, 2432, 64, 64]
    - [3, 20077.1]
  - - [2496, 1664, 1, 64, 2496, 2496, 64, 64]
    - [3, 20417.2]
  - - [2560, 1664, 1, 64, 2560, 2560, 64, 64]
    - [3, 19902.6]
  - - [2624, 1664, 1, 64, 2624, 2624, 64, 64]
    - [3, 20713.2]
  - - [2688, 1664, 1, 64, 2688, 2688, 64, 64]
    - [3, 20939.0]
  - - [2752, 1664, 1, 64, 2752, 2752, 64, 64]
    - [3, 21168.2]
  - - [2816, 1664, 1, 64, 2816, 2816, 64, 64]
    - [3, 21178.5]
  - - [2880, 1664, 1, 64, 2880, 2880, 64, 64]
    - [3, 21684.4]
  - - [2944, 1664, 1, 64, 2944, 2944, 64, 64]
    - [3, 21705.9]
  - - [3008, 1664, 1, 64, 3008, 3008, 64, 64]
    - [3, 22028.3]
  - - [3072, 1664, 1, 64, 3072, 3072, 64, 64]
    - [6, 20110.2]
  - - [3136, 1664, 1, 64, 3136, 3136, 64, 64]
    - [3, 22573.0]
  - - [3200, 1664, 1, 64, 3200, 3200, 64, 64]
    - [3, 22424.3]
  - - [3264, 1664, 1, 64, 3264, 3264, 64, 64]
    - [3, 22842.8]
  - - [3328, 1664, 1, 64, 3328, 3328, 64, 64]
    - [3, 22536.8]
  - - [3392, 1664, 1, 64, 3392, 3392, 64, 64]
    - [3, 23074.4]
  - - [3456, 1664, 1, 64, 3456, 3456, 64, 64]
    - [3, 23579.1]
  - - [3520, 1664, 1, 64, 3520, 3520, 64, 64]
    - [3, 23467.0]
  - - [3584, 1664, 1, 64, 3584, 3584, 64, 64]
    - [3, 22170.0]
  - - [3648, 1664, 1, 64, 3648, 3648, 64, 64]
    - [3, 23462.6]
  - - [3712, 1664, 1, 64, 3712, 3712, 64, 64]
    - [3, 23613.2]
  - - [3776, 1664, 1, 64, 3776, 3776, 64, 64]
    - [3, 22674.1]
  - - [3840, 1664, 1, 64, 3840, 3840, 64, 64]
    - [3, 23228.7]
  - - [3904, 1664, 1, 64, 3904, 3904, 64, 64]
    - [3, 23772.5]
  - - [3968, 1664, 1, 64, 3968, 3968, 64, 64]
    - [3, 24598.1]
  - - [4032, 1664, 1, 64, 4032, 4032, 64, 64]
    - [3, 24158.1]
  - - [4096, 1664, 1, 64, 4096, 4096, 64, 64]
    - [3, 22247.3]
  - - [64, 1728, 1, 64, 64, 64, 64, 64]
    - [14, 1495.09]
  - - [128, 1728, 1, 64, 128, 128, 64, 64]
    - [7, 2739.09]
  - - [192, 1728, 1, 64, 192, 192, 64, 64]
    - [7, 3909.66]
  - - [256, 1728, 1, 64, 256, 256, 64, 64]
    - [5, 4984.36]
  - - [320, 1728, 1, 64, 320, 320, 64, 64]
    - [1, 5950.76]
  - - [384, 1728, 1, 64, 384, 384, 64, 64]
    - [3, 7003.1]
  - - [448, 1728, 1, 64, 448, 448, 64, 64]
    - [1, 7813.35]
  - - [512, 1728, 1, 64, 512, 512, 64, 64]
    - [4, 8617.06]
  - - [576, 1728, 1, 64, 576, 576, 64, 64]
    - [4, 9369.07]
  - - [640, 1728, 1, 64, 640, 640, 64, 64]
    - [4, 10095.3]
  - - [704, 1728, 1, 64, 704, 704, 64, 64]
    - [4, 10679.8]
  - - [768, 1728, 1, 64, 768, 768, 64, 64]
    - [4, 11258.4]
  - - [832, 1728, 1, 64, 832, 832, 64, 64]
    - [4, 11889.3]
  - - [896, 1728, 1, 64, 896, 896, 64, 64]
    - [4, 12372.2]
  - - [960, 1728, 1, 64, 960, 960, 64, 64]
    - [4, 12969.3]
  - - [1024, 1728, 1, 64, 1024, 1024, 64, 64]
    - [4, 13287.0]
  - - [1088, 1728, 1, 64, 1088, 1088, 64, 64]
    - [4, 13830.2]
  - - [1152, 1728, 1, 64, 1152, 1152, 64, 64]
    - [4, 14247.5]
  - - [1216, 1728, 1, 64, 1216, 1216, 64, 64]
    - [4, 14604.4]
  - - [1280, 1728, 1, 64, 1280, 1280, 64, 64]
    - [4, 14966.8]
  - - [1344, 1728, 1, 64, 1344, 1344, 64, 64]
    - [3, 15367.4]
  - - [1408, 1728, 1, 64, 1408, 1408, 64, 64]
    - [4, 15535.4]
  - - [1472, 1728, 1, 64, 1472, 1472, 64, 64]
    - [4, 16035.2]
  - - [1536, 1728, 1, 64, 1536, 1536, 64, 64]
    - [6, 15677.7]
  - - [1600, 1728, 1, 64, 1600, 1600, 64, 64]
    - [4, 16605.2]
  - - [1664, 1728, 1, 64, 1664, 1664, 64, 64]
    - [4, 16985.8]
  - - [1728, 1728, 1, 64, 1728, 1728, 64, 64]
    - [3, 17399.7]
  - - [1792, 1728, 1, 64, 1792, 1792, 64, 64]
    - [3, 17689.7]
  - - [1856, 1728, 1, 64, 1856, 1856, 64, 64]
    - [3, 17842.1]
  - - [1920, 1728, 1, 64, 1920, 1920, 64, 64]
    - [3, 18054.1]
  - - [1984, 1728, 1, 64, 1984, 1984, 64, 64]
    - [3, 18467.4]
  - - [2048, 1728, 1, 64, 2048, 2048, 64, 64]
    - [6, 18075.8]
  - - [2112, 1728, 1, 64, 2112, 2112, 64, 64]
    - [3, 18986.2]
  - - [2176, 1728, 1, 64, 2176, 2176, 64, 64]
    - [3, 19327.4]
  - - [2240, 1728, 1, 64, 2240, 2240, 64, 64]
    - [3, 19336.7]
  - - [2304, 1728, 1, 64, 2304, 2304, 64, 64]
    - [3, 19468.2]
  - - [2368, 1728, 1, 64, 2368, 2368, 64, 64]
    - [3, 19977.0]
  - - [2432, 1728, 1, 64, 2432, 2432, 64, 64]
    - [3, 20375.5]
  - - [2496, 1728, 1, 64, 2496, 2496, 64, 64]
    - [3, 20547.4]
  - - [2560, 1728, 1, 64, 2560, 2560, 64, 64]
    - [3, 20056.1]
  - - [2624, 1728, 1, 64, 2624, 2624, 64, 64]
    - [3, 21009.9]
  - - [2688, 1728, 1, 64, 2688, 2688, 64, 64]
    - [3, 21222.7]
  - - [2752, 1728, 1, 64, 2752, 2752, 64, 64]
    - [3, 21539.0]
  - - [2816, 1728, 1, 64, 2816, 2816, 64, 64]
    - [3, 21431.6]
  - - [2880, 1728, 1, 64, 2880, 2880, 64, 64]
    - [3, 21899.1]
  - - [2944, 1728, 1, 64, 2944, 2944, 64, 64]
    - [3, 21849.4]
  - - [3008, 1728, 1, 64, 3008, 3008, 64, 64]
    - [3, 22115.2]
  - - [3072, 1728, 1, 64, 3072, 3072, 64, 64]
    - [6, 20271.7]
  - - [3136, 1728, 1, 64, 3136, 3136, 64, 64]
    - [3, 22402.4]
  - - [3200, 1728, 1, 64, 3200, 3200, 64, 64]
    - [3, 22560.9]
  - - [3264, 1728, 1, 64, 3264, 3264, 64, 64]
    - [3, 22940.5]
  - - [3328, 1728, 1, 64, 3328, 3328, 64, 64]
    - [3, 23255.8]
  - - [3392, 1728, 1, 64, 3392, 3392, 64, 64]
    - [3, 22851.1]
  - - [3456, 1728, 1, 64, 3456, 3456, 64, 64]
    - [3, 23479.6]
  - - [3520, 1728, 1, 64, 3520, 3520, 64, 64]
    - [3, 23539.9]
  - - [3584, 1728, 1, 64, 3584, 3584, 64, 64]
    - [3, 22363.9]
  - - [3648, 1728, 1, 64, 3648, 3648, 64, 64]
    - [3, 24117.3]
  - - [3712, 1728, 1, 64, 3712, 3712, 64, 64]
    - [3, 23885.2]
  - - [3776, 1728, 1, 64, 3776, 3776, 64, 64]
    - [3, 22759.5]
  - - [3840, 1728, 1, 64, 3840, 3840, 64, 64]
    - [3, 23533.8]
  - - [3904, 1728, 1, 64, 3904, 3904, 64, 64]
    - [3, 24146.9]
  - - [3968, 1728, 1, 64, 3968, 3968, 64, 64]
    - [3, 24321.1]
  - - [4032, 1728, 1, 64, 4032, 4032, 64, 64]
    - [3, 24889.8]
  - - [4096, 1728, 1, 64, 4096, 4096, 64, 64]
    - [3, 22565.5]
  - - [64, 1792, 1, 64, 64, 64, 64, 64]
    - [14, 1482.52]
  - - [128, 1792, 1, 64, 128, 128, 64, 64]
    - [15, 2783.46]
  - - [192, 1792, 1, 64, 192, 192, 64, 64]
    - [7, 4083.81]
  - - [256, 1792, 1, 64, 256, 256, 64, 64]
    - [7, 5171.75]
  - - [320, 1792, 1, 64, 320, 320, 64, 64]
    - [4, 6390.36]
  - - [384, 1792, 1, 64, 384, 384, 64, 64]
    - [1, 7096.27]
  - - [448, 1792, 1, 64, 448, 448, 64, 64]
    - [4, 8041.89]
  - - [512, 1792, 1, 64, 512, 512, 64, 64]
    - [6, 8691.51]
  - - [576, 1792, 1, 64, 576, 576, 64, 64]
    - [4, 9619.86]
  - - [640, 1792, 1, 64, 640, 640, 64, 64]
    - [4, 10321.9]
  - - [704, 1792, 1, 64, 704, 704, 64, 64]
    - [4, 10891.7]
  - - [768, 1792, 1, 64, 768, 768, 64, 64]
    - [4, 11501.6]
  - - [832, 1792, 1, 64, 832, 832, 64, 64]
    - [4, 12161.5]
  - - [896, 1792, 1, 64, 896, 896, 64, 64]
    - [4, 12645.8]
  - - [960, 1792, 1, 64, 960, 960, 64, 64]
    - [4, 13231.4]
  - - [1024, 1792, 1, 64, 1024, 1024, 64, 64]
    - [4, 13483.2]
  - - [1088, 1792, 1, 64, 1088, 1088, 64, 64]
    - [4, 14069.2]
  - - [1152, 1792, 1, 64, 1152, 1152, 64, 64]
    - [4, 14547.3]
  - - [1216, 1792, 1, 64, 1216, 1216, 64, 64]
    - [4, 14867.7]
  - - [1280, 1792, 1, 64, 1280, 1280, 64, 64]
    - [3, 15237.6]
  - - [1344, 1792, 1, 64, 1344, 1344, 64, 64]
    - [4, 15574.3]
  - - [1408, 1792, 1, 64, 1408, 1408, 64, 64]
    - [4, 15791.0]
  - - [1472, 1792, 1, 64, 1472, 1472, 64, 64]
    - [4, 16237.2]
  - - [1536, 1792, 1, 64, 1536, 1536, 64, 64]
    - [6, 15916.0]
  - - [1600, 1792, 1, 64, 1600, 1600, 64, 64]
    - [4, 16903.1]
  - - [1664, 1792, 1, 64, 1664, 1664, 64, 64]
    - [3, 17261.1]
  - - [1728, 1792, 1, 64, 1728, 1728, 64, 64]
    - [3, 17702.3]
  - - [1792, 1792, 1, 64, 1792, 1792, 64, 64]
    - [3, 17824.7]
  - - [1856, 1792, 1, 64, 1856, 1856, 64, 64]
    - [3, 18100.2]
  - - [1920, 1792, 1, 64, 1920, 1920, 64, 64]
    - [3, 18187.7]
  - - [1984, 1792, 1, 64, 1984, 1984, 64, 64]
    - [4, 18554.9]
  - - [2048, 1792, 1, 64, 2048, 2048, 64, 64]
    - [7, 18081.4]
  - - [2112, 1792, 1, 64, 2112, 2112, 64, 64]
    - [3, 19097.9]
  - - [2176, 1792, 1, 64, 2176, 2176, 64, 64]
    - [3, 19553.3]
  - - [2240, 1792, 1, 64, 2240, 2240, 64, 64]
    - [3, 19472.3]
  - - [2304, 1792, 1, 64, 2304, 2304, 64, 64]
    - [3, 19641.5]
  - - [2368, 1792, 1, 64, 2368, 2368, 64, 64]
    - [3, 20136.2]
  - - [2432, 1792, 1, 64, 2432, 2432, 64, 64]
    - [3, 20421.6]
  - - [2496, 1792, 1, 64, 2496, 2496, 64, 64]
    - [3, 20888.7]
  - - [2560, 1792, 1, 64, 2560, 2560, 64, 64]
    - [3, 20186.8]
  - - [2624, 1792, 1, 64, 2624, 2624, 64, 64]
    - [3, 21111.1]
  - - [2688, 1792, 1, 64, 2688, 2688, 64, 64]
    - [3, 21360.7]
  - - [2752, 1792, 1, 64, 2752, 2752, 64, 64]
    - [3, 21626.5]
  - - [2816, 1792, 1, 64, 2816, 2816, 64, 64]
    - [3, 21521.9]
  - - [2880, 1792, 1, 64, 2880, 2880, 64, 64]
    - [3, 21965.6]
  - - [2944, 1792, 1, 64, 2944, 2944, 64, 64]
    - [3, 22191.1]
  - - [3008, 1792, 1, 64, 3008, 3008, 64, 64]
    - [3, 22534.3]
  - - [3072, 1792, 1, 64, 3072, 3072, 64, 64]
    - [1, 20256.2]
  - - [3136, 1792, 1, 64, 3136, 3136, 64, 64]
    - [3, 22734.3]
  - - [3200, 1792, 1, 64, 3200, 3200, 64, 64]
    - [3, 22948.8]
  - - [3264, 1792, 1, 64, 3264, 3264, 64, 64]
    - [3, 23107.2]
  - - [3328, 1792, 1, 64, 3328, 3328, 64, 64]
    - [3, 22956.7]
  - - [3392, 1792, 1, 64, 3392, 3392, 64, 64]
    - [3, 22730.9]
  - - [3456, 1792, 1, 64, 3456, 3456, 64, 64]
    - [3, 23681.6]
  - - [3520, 1792, 1, 64, 3520, 3520, 64, 64]
    - [3, 23857.8]
  - - [3584, 1792, 1, 64, 3584, 3584, 64, 64]
    - [3, 22799.9]
  - - [3648, 1792, 1, 64, 3648, 3648, 64, 64]
    - [3, 24282.0]
  - - [3712, 1792, 1, 64, 3712, 3712, 64, 64]
    - [3, 23973.3]
  - - [3776, 1792, 1, 64, 3776, 3776, 64, 64]
    - [3, 23361.7]
  - - [3840, 1792, 1, 64, 3840, 3840, 64, 64]
    - [3, 23690.0]
  - - [3904, 1792, 1, 64, 3904, 3904, 64, 64]
    - [3, 24192.8]
  - - [3968, 1792, 1, 64, 3968, 3968, 64, 64]
    - [3, 24112.5]
  - - [4032, 1792, 1, 64, 4032, 4032, 64, 64]
    - [3, 24484.6]
  - - [4096, 1792, 1, 64, 4096, 4096, 64, 64]
    - [3, 22857.0]
  - - [64, 1856, 1, 64, 64, 64, 64, 64]
    - [4, 1527.74]
  - - [128, 1856, 1, 64, 128, 128, 64, 64]
    - [9, 2870.89]
  - - [192, 1856, 1, 64, 192, 192, 64, 64]
    - [4, 4323.45]
  - - [256, 1856, 1, 64, 256, 256, 64, 64]
    - [6, 5290.24]
  - - [320, 1856, 1, 64, 320, 320, 64, 64]
    - [7, 6346.7]
  - - [384, 1856, 1, 64, 384, 384, 64, 64]
    - [7, 7339.1]
  - - [448, 1856, 1, 64, 448, 448, 64, 64]
    - [4, 8195.72]
  - - [512, 1856, 1, 64, 512, 512, 64, 64]
    - [4, 8988.58]
  - - [576, 1856, 1, 64, 576, 576, 64, 64]
    - [4, 9781.07]
  - - [640, 1856, 1, 64, 640, 640, 64, 64]
    - [4, 10617.4]
  - - [704, 1856, 1, 64, 704, 704, 64, 64]
    - [4, 11136.5]
  - - [768, 1856, 1, 64, 768, 768, 64, 64]
    - [4, 11701.5]
  - - [832, 1856, 1, 64, 832, 832, 64, 64]
    - [4, 12373.4]
  - - [896, 1856, 1, 64, 896, 896, 64, 64]
    - [4, 12894.2]
  - - [960, 1856, 1, 64, 960, 960, 64, 64]
    - [4, 13439.1]
  - - [1024, 1856, 1, 64, 1024, 1024, 64, 64]
    - [4, 13686.6]
  - - [1088, 1856, 1, 64, 1088, 1088, 64, 64]
    - [4, 14303.8]
  - - [1152, 1856, 1, 64, 1152, 1152, 64, 64]
    - [4, 14693.2]
  - - [1216, 1856, 1, 64, 1216, 1216, 64, 64]
    - [3, 15123.0]
  - - [1280, 1856, 1, 64, 1280, 1280, 64, 64]
    - [4, 15434.2]
  - - [1344, 1856, 1, 64, 1344, 1344, 64, 64]
    - [3, 15820.4]
  - - [1408, 1856, 1, 64, 1408, 1408, 64, 64]
    - [3, 16089.1]
  - - [1472, 1856, 1, 64, 1472, 1472, 64, 64]
    - [4, 16468.6]
  - - [1536, 1856, 1, 64, 1536, 1536, 64, 64]
    - [6, 16153.2]
  - - [1600, 1856, 1, 64, 1600, 1600, 64, 64]
    - [4, 17151.2]
  - - [1664, 1856, 1, 64, 1664, 1664, 64, 64]
    - [3, 17631.9]
  - - [1728, 1856, 1, 64, 1728, 1728, 64, 64]
    - [3, 17924.8]
  - - [1792, 1856, 1, 64, 1792, 1792, 64, 64]
    - [3, 18072.5]
  - - [1856, 1856, 1, 64, 1856, 1856, 64, 64]
    - [3, 18287.9]
  - - [1920, 1856, 1, 64, 1920, 1920, 64, 64]
    - [4, 18432.2]
  - - [1984, 1856, 1, 64, 1984, 1984, 64, 64]
    - [4, 18827.5]
  - - [2048, 1856, 1, 64, 2048, 2048, 64, 64]
    - [6, 18469.9]
  - - [2112, 1856, 1, 64, 2112, 2112, 64, 64]
    - [3, 19309.5]
  - - [2176, 1856, 1, 64, 2176, 2176, 64, 64]
    - [3, 19786.5]
  - - [2240, 1856, 1, 64, 2240, 2240, 64, 64]
    - [3, 19845.9]
  - - [2304, 1856, 1, 64, 2304, 2304, 64, 64]
    - [3, 19795.6]
  - - [2368, 1856, 1, 64, 2368, 2368, 64, 64]
    - [3, 20347.0]
  - - [2432, 1856, 1, 64, 2432, 2432, 64, 64]
    - [3, 20811.1]
  - - [2496, 1856, 1, 64, 2496, 2496, 64, 64]
    - [3, 21073.4]
  - - [2560, 1856, 1, 64, 2560, 2560, 64, 64]
    - [3, 20329.2]
  - - [2624, 1856, 1, 64, 2624, 2624, 64, 64]
    - [3, 21544.5]
  - - [2688, 1856, 1, 64, 2688, 2688, 64, 64]
    - [3, 21692.2]
  - - [2752, 1856, 1, 64, 2752, 2752, 64, 64]
    - [3, 21855.3]
  - - [2816, 1856, 1, 64, 2816, 2816, 64, 64]
    - [3, 22198.8]
  - - [2880, 1856, 1, 64, 2880, 2880, 64, 64]
    - [3, 22334.2]
  - - [2944, 1856, 1, 64, 2944, 2944, 64, 64]
    - [3, 22376.2]
  - - [3008, 1856, 1, 64, 3008, 3008, 64, 64]
    - [3, 22818.8]
  - - [3072, 1856, 1, 64, 3072, 3072, 64, 64]
    - [3, 20767.2]
  - - [3136, 1856, 1, 64, 3136, 3136, 64, 64]
    - [3, 23351.5]
  - - [3200, 1856, 1, 64, 3200, 3200, 64, 64]
    - [3, 23343.6]
  - - [3264, 1856, 1, 64, 3264, 3264, 64, 64]
    - [3, 22876.2]
  - - [3328, 1856, 1, 64, 3328, 3328, 64, 64]
    - [3, 23241.2]
  - - [3392, 1856, 1, 64, 3392, 3392, 64, 64]
    - [3, 24037.2]
  - - [3456, 1856, 1, 64, 3456, 3456, 64, 64]
    - [3, 23876.7]
  - - [3520, 1856, 1, 64, 3520, 3520, 64, 64]
    - [3, 23649.1]
  - - [3584, 1856, 1, 64, 3584, 3584, 64, 64]
    - [3, 23281.0]
  - - [3648, 1856, 1, 64, 3648, 3648, 64, 64]
    - [3, 24361.6]
  - - [3712, 1856, 1, 64, 3712, 3712, 64, 64]
    - [3, 23719.5]
  - - [3776, 1856, 1, 64, 3776, 3776, 64, 64]
    - [3, 23903.4]
  - - [3840, 1856, 1, 64, 3840, 3840, 64, 64]
    - [3, 23739.2]
  - - [3904, 1856, 1, 64, 3904, 3904, 64, 64]
    - [3, 24765.2]
  - - [3968, 1856, 1, 64, 3968, 3968, 64, 64]
    - [3, 23701.5]
  - - [4032, 1856, 1, 64, 4032, 4032, 64, 64]
    - [3, 25046.1]
  - - [4096, 1856, 1, 64, 4096, 4096, 64, 64]
    - [3, 22707.6]
  - - [64, 1920, 1, 64, 64, 64, 64, 64]
    - [7, 1545.64]
  - - [128, 1920, 1, 64, 128, 128, 64, 64]
    - [5, 3186.47]
  - - [192, 1920, 1, 64, 192, 192, 64, 64]
    - [7, 4300.54]
  - - [256, 1920, 1, 64, 256, 256, 64, 64]
    - [6, 5577.46]
  - - [320, 1920, 1, 64, 320, 320, 64, 64]
    - [4, 6536.09]
  - - [384, 1920, 1, 64, 384, 384, 64, 64]
    - [4, 7565.36]
  - - [448, 1920, 1, 64, 448, 448, 64, 64]
    - [4, 8453.5]
  - - [512, 1920, 1, 64, 512, 512, 64, 64]
    - [4, 9129.86]
  - - [576, 1920, 1, 64, 576, 576, 64, 64]
    - [4, 10040.9]
  - - [640, 1920, 1, 64, 640, 640, 64, 64]
    - [4, 10802.5]
  - - [704, 1920, 1, 64, 704, 704, 64, 64]
    - [4, 11361.5]
  - - [768, 1920, 1, 64, 768, 768, 64, 64]
    - [4, 11936.6]
  - - [832, 1920, 1, 64, 832, 832, 64, 64]
    - [4, 12682.7]
  - - [896, 1920, 1, 64, 896, 896, 64, 64]
    - [4, 13215.5]
  - - [960, 1920, 1, 64, 960, 960, 64, 64]
    - [4, 13678.5]
  - - [1024, 1920, 1, 64, 1024, 1024, 64, 64]
    - [4, 13854.6]
  - - [1088, 1920, 1, 64, 1088, 1088, 64, 64]
    - [4, 14619.1]
  - - [1152, 1920, 1, 64, 1152, 1152, 64, 64]
    - [4, 14982.6]
  - - [1216, 1920, 1, 64, 1216, 1216, 64, 64]
    - [3, 15461.5]
  - - [1280, 1920, 1, 64, 1280, 1280, 64, 64]
    - [4, 15684.5]
  - - [1344, 1920, 1, 64, 1344, 1344, 64, 64]
    - [3, 16135.7]
  - - [1408, 1920, 1, 64, 1408, 1408, 64, 64]
    - [3, 16363.6]
  - - [1472, 1920, 1, 64, 1472, 1472, 64, 64]
    - [4, 16720.1]
  - - [1536, 1920, 1, 64, 1536, 1536, 64, 64]
    - [6, 16410.9]
  - - [1600, 1920, 1, 64, 1600, 1600, 64, 64]
    - [4, 17375.6]
  - - [1664, 1920, 1, 64, 1664, 1664, 64, 64]
    - [3, 17750.7]
  - - [1728, 1920, 1, 64, 1728, 1728, 64, 64]
    - [3, 18135.8]
  - - [1792, 1920, 1, 64, 1792, 1792, 64, 64]
    - [4, 18314.7]
  - - [1856, 1920, 1, 64, 1856, 1856, 64, 64]
    - [3, 18415.9]
  - - [1920, 1920, 1, 64, 1920, 1920, 64, 64]
    - [3, 18776.5]
  - - [1984, 1920, 1, 64, 1984, 1984, 64, 64]
    - [3, 19104.3]
  - - [2048, 1920, 1, 64, 2048, 2048, 64, 64]
    - [6, 18738.2]
  - - [2112, 1920, 1, 64, 2112, 2112, 64, 64]
    - [3, 19556.8]
  - - [2176, 1920, 1, 64, 2176, 2176, 64, 64]
    - [3, 20028.7]
  - - [2240, 1920, 1, 64, 2240, 2240, 64, 64]
    - [3, 20000.5]
  - - [2304, 1920, 1, 64, 2304, 2304, 64, 64]
    - [3, 20064.6]
  - - [2368, 1920, 1, 64, 2368, 2368, 64, 64]
    - [3, 20766.2]
  - - [2432, 1920, 1, 64, 2432, 2432, 64, 64]
    - [3, 21076.3]
  - - [2496, 1920, 1, 64, 2496, 2496, 64, 64]
    - [3, 21413.4]
  - - [2560, 1920, 1, 64, 2560, 2560, 64, 64]
    - [3, 20804.8]
  - - [2624, 1920, 1, 64, 2624, 2624, 64, 64]
    - [3, 21944.6]
  - - [2688, 1920, 1, 64, 2688, 2688, 64, 64]
    - [3, 21986.1]
  - - [2752, 1920, 1, 64, 2752, 2752, 64, 64]
    - [3, 22322.4]
  - - [2816, 1920, 1, 64, 2816, 2816, 64, 64]
    - [3, 22185.4]
  - - [2880, 1920, 1, 64, 2880, 2880, 64, 64]
    - [3, 22617.1]
  - - [2944, 1920, 1, 64, 2944, 2944, 64, 64]
    - [3, 22855.3]
  - - [3008, 1920, 1, 64, 3008, 3008, 64, 64]
    - [3, 23173.6]
  - - [3072, 1920, 1, 64, 3072, 3072, 64, 64]
    - [1, 20950.3]
  - - [3136, 1920, 1, 64, 3136, 3136, 64, 64]
    - [3, 23280.9]
  - - [3200, 1920, 1, 64, 3200, 3200, 64, 64]
    - [3, 23521.7]
  - - [3264, 1920, 1, 64, 3264, 3264, 64, 64]
    - [3, 24117.5]
  - - [3328, 1920, 1, 64, 3328, 3328, 64, 64]
    - [3, 23132.7]
  - - [3392, 1920, 1, 64, 3392, 3392, 64, 64]
    - [3, 24115.0]
  - - [3456, 1920, 1, 64, 3456, 3456, 64, 64]
    - [3, 24756.3]
  - - [3520, 1920, 1, 64, 3520, 3520, 64, 64]
    - [3, 23870.5]
  - - [3584, 1920, 1, 64, 3584, 3584, 64, 64]
    - [3, 23945.0]
  - - [3648, 1920, 1, 64, 3648, 3648, 64, 64]
    - [3, 23738.8]
  - - [3712, 1920, 1, 64, 3712, 3712, 64, 64]
    - [3, 25013.8]
  - - [3776, 1920, 1, 64, 3776, 3776, 64, 64]
    - [3, 24028.4]
  - - [3840, 1920, 1, 64, 3840, 3840, 64, 64]
    - [3, 24665.6]
  - - [3904, 1920, 1, 64, 3904, 3904, 64, 64]
    - [3, 25105.6]
  - - [3968, 1920, 1, 64, 3968, 3968, 64, 64]
    - [3, 25417.4]
  - - [4032, 1920, 1, 64, 4032, 4032, 64, 64]
    - [3, 25781.6]
  - - [4096, 1920, 1, 64, 4096, 4096, 64, 64]
    - [3, 22773.2]
  - - [64, 1984, 1, 64, 64, 64, 64, 64]
    - [16, 1648.0]
  - - [128, 1984, 1, 64, 128, 128, 64, 64]
    - [0, 3130.94]
  - - [192, 1984, 1, 64, 192, 192, 64, 64]
    - [6, 4626.93]
  - - [256, 1984, 1, 64, 256, 256, 64, 64]
    - [4, 5816.04]
  - - [320, 1984, 1, 64, 320, 320, 64, 64]
    - [7, 6651.14]
  - - [384, 1984, 1, 64, 384, 384, 64, 64]
    - [3, 7768.99]
  - - [448, 1984, 1, 64, 448, 448, 64, 64]
    - [4, 8655.57]
  - - [512, 1984, 1, 64, 512, 512, 64, 64]
    - [4, 9348.72]
  - - [576, 1984, 1, 64, 576, 576, 64, 64]
    - [4, 10317.0]
  - - [640, 1984, 1, 64, 640, 640, 64, 64]
    - [4, 10989.1]
  - - [704, 1984, 1, 64, 704, 704, 64, 64]
    - [4, 11648.4]
  - - [768, 1984, 1, 64, 768, 768, 64, 64]
    - [4, 12201.7]
  - - [832, 1984, 1, 64, 832, 832, 64, 64]
    - [4, 12930.6]
  - - [896, 1984, 1, 64, 896, 896, 64, 64]
    - [4, 13392.5]
  - - [960, 1984, 1, 64, 960, 960, 64, 64]
    - [4, 13889.6]
  - - [1024, 1984, 1, 64, 1024, 1024, 64, 64]
    - [4, 14029.2]
  - - [1088, 1984, 1, 64, 1088, 1088, 64, 64]
    - [4, 14818.0]
  - - [1152, 1984, 1, 64, 1152, 1152, 64, 64]
    - [4, 15241.7]
  - - [1216, 1984, 1, 64, 1216, 1216, 64, 64]
    - [4, 15672.0]
  - - [1280, 1984, 1, 64, 1280, 1280, 64, 64]
    - [3, 15981.1]
  - - [1344, 1984, 1, 64, 1344, 1344, 64, 64]
    - [3, 16352.3]
  - - [1408, 1984, 1, 64, 1408, 1408, 64, 64]
    - [4, 16506.3]
  - - [1472, 1984, 1, 64, 1472, 1472, 64, 64]
    - [4, 16953.0]
  - - [1536, 1984, 1, 64, 1536, 1536, 64, 64]
    - [6, 16612.7]
  - - [1600, 1984, 1, 64, 1600, 1600, 64, 64]
    - [4, 17597.2]
  - - [1664, 1984, 1, 64, 1664, 1664, 64, 64]
    - [4, 17948.2]
  - - [1728, 1984, 1, 64, 1728, 1728, 64, 64]
    - [4, 18545.5]
  - - [1792, 1984, 1, 64, 1792, 1792, 64, 64]
    - [4, 18650.7]
  - - [1856, 1984, 1, 64, 1856, 1856, 64, 64]
    - [4, 18982.2]
  - - [1920, 1984, 1, 64, 1920, 1920, 64, 64]
    - [3, 19107.3]
  - - [1984, 1984, 1, 64, 1984, 1984, 64, 64]
    - [3, 19348.5]
  - - [2048, 1984, 1, 64, 2048, 2048, 64, 64]
    - [4, 18657.2]
  - - [2112, 1984, 1, 64, 2112, 2112, 64, 64]
    - [3, 20005.2]
  - - [2176, 1984, 1, 64, 2176, 2176, 64, 64]
    - [3, 20378.8]
  - - [2240, 1984, 1, 64, 2240, 2240, 64, 64]
    - [3, 20494.5]
  - - [2304, 1984, 1, 64, 2304, 2304, 64, 64]
    - [3, 20409.5]
  - - [2368, 1984, 1, 64, 2368, 2368, 64, 64]
    - [3, 21001.2]
  - - [2432, 1984, 1, 64, 2432, 2432, 64, 64]
    - [3, 21394.0]
  - - [2496, 1984, 1, 64, 2496, 2496, 64, 64]
    - [3, 21658.4]
  - - [2560, 1984, 1, 64, 2560, 2560, 64, 64]
    - [3, 21016.0]
  - - [2624, 1984, 1, 64, 2624, 2624, 64, 64]
    - [3, 22421.3]
  - - [2688, 1984, 1, 64, 2688, 2688, 64, 64]
    - [3, 22522.5]
  - - [2752, 1984, 1, 64, 2752, 2752, 64, 64]
    - [3, 22608.3]
  - - [2816, 1984, 1, 64, 2816, 2816, 64, 64]
    - [3, 22458.3]
  - - [2880, 1984, 1, 64, 2880, 2880, 64, 64]
    - [3, 22937.1]
  - - [2944, 1984, 1, 64, 2944, 2944, 64, 64]
    - [3, 23440.9]
  - - [3008, 1984, 1, 64, 3008, 3008, 64, 64]
    - [3, 23394.5]
  - - [3072, 1984, 1, 64, 3072, 3072, 64, 64]
    - [3, 21436.8]
  - - [3136, 1984, 1, 64, 3136, 3136, 64, 64]
    - [3, 23592.3]
  - - [3200, 1984, 1, 64, 3200, 3200, 64, 64]
    - [3, 23927.8]
  - - [3264, 1984, 1, 64, 3264, 3264, 64, 64]
    - [3, 24347.5]
  - - [3328, 1984, 1, 64, 3328, 3328, 64, 64]
    - [3, 23599.4]
  - - [3392, 1984, 1, 64, 3392, 3392, 64, 64]
    - [3, 24525.9]
  - - [3456, 1984, 1, 64, 3456, 3456, 64, 64]
    - [3, 24658.6]
  - - [3520, 1984, 1, 64, 3520, 3520, 64, 64]
    - [3, 24196.1]
  - - [3584, 1984, 1, 64, 3584, 3584, 64, 64]
    - [3, 23416.5]
  - - [3648, 1984, 1, 64, 3648, 3648, 64, 64]
    - [3, 24802.0]
  - - [3712, 1984, 1, 64, 3712, 3712, 64, 64]
    - [3, 24679.5]
  - - [3776, 1984, 1, 64, 3776, 3776, 64, 64]
    - [3, 23217.0]
  - - [3840, 1984, 1, 64, 3840, 3840, 64, 64]
    - [3, 24409.6]
  - - [3904, 1984, 1, 64, 3904, 3904, 64, 64]
    - [3, 25461.5]
  - - [3968, 1984, 1, 64, 3968, 3968, 64, 64]
    - [3, 24694.1]
  - - [4032, 1984, 1, 64, 4032, 4032, 64, 64]
    - [3, 25407.5]
  - - [4096, 1984, 1, 64, 4096, 4096, 64, 64]
    - [3, 22891.1]
  - - [64, 2048, 1, 64, 64, 64, 64, 64]
    - [16, 1747.62]
  - - [128, 2048, 1, 64, 128, 128, 64, 64]
    - [6, 3362.15]
  - - [192, 2048, 1, 64, 192, 192, 64, 64]
    - [3, 4797.1]
  - - [256, 2048, 1, 64, 256, 256, 64, 64]
    - [9, 5900.12]
  - - [320, 2048, 1, 64, 320, 320, 64, 64]
    - [1, 7133.11]
  - - [384, 2048, 1, 64, 384, 384, 64, 64]
    - [3, 8274.05]
  - - [448, 2048, 1, 64, 448, 448, 64, 64]
    - [4, 8938.89]
  - - [512, 2048, 1, 64, 512, 512, 64, 64]
    - [4, 9618.48]
  - - [576, 2048, 1, 64, 576, 576, 64, 64]
    - [4, 10591.5]
  - - [640, 2048, 1, 64, 640, 640, 64, 64]
    - [4, 11240.1]
  - - [704, 2048, 1, 64, 704, 704, 64, 64]
    - [4, 11839.1]
  - - [768, 2048, 1, 64, 768, 768, 64, 64]
    - [4, 12438.2]
  - - [832, 2048, 1, 64, 832, 832, 64, 64]
    - [4, 13067.8]
  - - [896, 2048, 1, 64, 896, 896, 64, 64]
    - [4, 13603.5]
  - - [960, 2048, 1, 64, 960, 960, 64, 64]
    - [4, 14120.5]
  - - [1024, 2048, 1, 64, 1024, 1024, 64, 64]
    - [4, 14357.7]
  - - [1088, 2048, 1, 64, 1088, 1088, 64, 64]
    - [4, 15053.7]
  - - [1152, 2048, 1, 64, 1152, 1152, 64, 64]
    - [4, 15448.4]
  - - [1216, 2048, 1, 64, 1216, 1216, 64, 64]
    - [4, 15852.6]
  - - [1280, 2048, 1, 64, 1280, 1280, 64, 64]
    - [4, 16120.8]
  - - [1344, 2048, 1, 64, 1344, 1344, 64, 64]
    - [4, 16537.5]
  - - [1408, 2048, 1, 64, 1408, 1408, 64, 64]
    - [3, 16761.7]
  - - [1472, 2048, 1, 64, 1472, 1472, 64, 64]
    - [4, 17166.6]
  - - [1536, 2048, 1, 64, 1536, 1536, 64, 64]
    - [6, 16851.4]
  - - [1600, 2048, 1, 64, 1600, 1600, 64, 64]
    - [4, 18035.2]
  - - [1664, 2048, 1, 64, 1664, 1664, 64, 64]
    - [3, 18190.2]
  - - [1728, 2048, 1, 64, 1728, 1728, 64, 64]
    - [4, 18589.1]
  - - [1792, 2048, 1, 64, 1792, 1792, 64, 64]
    - [4, 18961.7]
  - - [1856, 2048, 1, 64, 1856, 1856, 64, 64]
    - [3, 19185.1]
  - - [1920, 2048, 1, 64, 1920, 1920, 64, 64]
    - [3, 19382.0]
  - - [1984, 2048, 1, 64, 1984, 1984, 64, 64]
    - [3, 19817.4]
  - - [2048, 2048, 1, 64, 2048, 2048, 64, 64]
    - [6, 19036.4]
  - - [2112, 2048, 1, 64, 2112, 2112, 64, 64]
    - [3, 20239.9]
  - - [2176, 2048, 1, 64, 2176, 2176, 64, 64]
    - [3, 20686.8]
  - - [2240, 2048, 1, 64, 2240, 2240, 64, 64]
    - [3, 20768.0]
  - - [2304, 2048, 1, 64, 2304, 2304, 64, 64]
    - [3, 20631.7]
  - - [2368, 2048, 1, 64, 2368, 2368, 64, 64]
    - [3, 21308.1]
  - - [2432, 2048, 1, 64, 2432, 2432, 64, 64]
    - [3, 21755.6]
  - - [2496, 2048, 1, 64, 2496, 2496, 64, 64]
    - [3, 22033.4]
  - - [2560, 2048, 1, 64, 2560, 2560, 64, 64]
    - [3, 21313.6]
  - - [2624, 2048, 1, 64, 2624, 2624, 64, 64]
    - [3, 22443.7]
  - - [2688, 2048, 1, 64, 2688, 2688, 64, 64]
    - [3, 22520.9]
  - - [2752, 2048, 1, 64, 2752, 2752, 64, 64]
    - [3, 23280.3]
  - - [2816, 2048, 1, 64, 2816, 2816, 64, 64]
    - [3, 22999.4]
  - - [2880, 2048, 1, 64, 2880, 2880, 64, 64]
    - [3, 23282.8]
  - - [2944, 2048, 1, 64, 2944, 2944, 64, 64]
    - [3, 23425.9]
  - - [3008, 2048, 1, 64, 3008, 3008, 64, 64]
    - [3, 23665.0]
  - - [3072, 2048, 1, 64, 3072, 3072, 64, 64]
    - [1, 21366.3]
  - - [3136, 2048, 1, 64, 3136, 3136, 64, 64]
    - [3, 24192.8]
  - - [3200, 2048, 1, 64, 3200, 3200, 64, 64]
    - [3, 24103.5]
  - - [3264, 2048, 1, 64, 3264, 3264, 64, 64]
    - [3, 24271.8]
  - - [3328, 2048, 1, 64, 3328, 3328, 64, 64]
    - [3, 24018.6]
  - - [3392, 2048, 1, 64, 3392, 3392, 64, 64]
    - [3, 24472.4]
  - - [3456, 2048, 1, 64, 3456, 3456, 64, 64]
    - [3, 24349.8]
  - - [3520, 2048, 1, 64, 3520, 3520, 64, 64]
    - [3, 24905.1]
  - - [3584, 2048, 1, 64, 3584, 3584, 64, 64]
    - [3, 24300.6]
  - - [3648, 2048, 1, 64, 3648, 3648, 64, 64]
    - [3, 25584.3]
  - - [3712, 2048, 1, 64, 3712, 3712, 64, 64]
    - [3, 24668.3]
  - - [3776, 2048, 1, 64, 3776, 3776, 64, 64]
    - [3, 23336.6]
  - - [3840, 2048, 1, 64, 3840, 3840, 64, 64]
    - [3, 24555.3]
  - - [3904, 2048, 1, 64, 3904, 3904, 64, 64]
    - [3, 25917.9]
  - - [3968, 2048, 1, 64, 3968, 3968, 64, 64]
    - [3, 25016.2]
  - - [4032, 2048, 1, 64, 4032, 4032, 64, 64]
    - [3, 25120.1]
  - - [4096, 2048, 1, 64, 4096, 4096, 64, 64]
    - [1, 23103.8]
  - - [64, 2112, 1, 64, 64, 64, 64, 64]
    - [16, 1740.23]
  - - [128, 2112, 1, 64, 128, 128, 64, 64]
    - [6, 3400.42]
  - - [192, 2112, 1, 64, 192, 192, 64, 64]
    - [6, 4954.56]
  - - [256, 2112, 1, 64, 256, 256, 64, 64]
    - [7, 5982.49]
  - - [320, 2112, 1, 64, 320, 320, 64, 64]
    - [7, 7053.69]
  - - [384, 2112, 1, 64, 384, 384, 64, 64]
    - [7, 8073.43]
  - - [448, 2112, 1, 64, 448, 448, 64, 64]
    - [4, 9063.67]
  - - [512, 2112, 1, 64, 512, 512, 64, 64]
    - [4, 9814.92]
  - - [576, 2112, 1, 64, 576, 576, 64, 64]
    - [4, 10787.8]
  - - [640, 2112, 1, 64, 640, 640, 64, 64]
    - [4, 11473.0]
  - - [704, 2112, 1, 64, 704, 704, 64, 64]
    - [4, 12072.7]
  - - [768, 2112, 1, 64, 768, 768, 64, 64]
    - [4, 12640.9]
  - - [832, 2112, 1, 64, 832, 832, 64, 64]
    - [4, 13321.3]
  - - [896, 2112, 1, 64, 896, 896, 64, 64]
    - [4, 13796.9]
  - - [960, 2112, 1, 64, 960, 960, 64, 64]
    - [4, 14360.3]
  - - [1024, 2112, 1, 64, 1024, 1024, 64, 64]
    - [4, 14557.3]
  - - [1088, 2112, 1, 64, 1088, 1088, 64, 64]
    - [4, 15242.6]
  - - [1152, 2112, 1, 64, 1152, 1152, 64, 64]
    - [4, 15690.4]
  - - [1216, 2112, 1, 64, 1216, 1216, 64, 64]
    - [3, 16131.3]
  - - [1280, 2112, 1, 64, 1280, 1280, 64, 64]
    - [3, 16348.1]
  - - [1344, 2112, 1, 64, 1344, 1344, 64, 64]
    - [3, 16839.6]
  - - [1408, 2112, 1, 64, 1408, 1408, 64, 64]
    - [3, 17119.2]
  - - [1472, 2112, 1, 64, 1472, 1472, 64, 64]
    - [3, 17463.8]
  - - [1536, 2112, 1, 64, 1536, 1536, 64, 64]
    - [6, 17024.7]
  - - [1600, 2112, 1, 64, 1600, 1600, 64, 64]
    - [3, 18105.2]
  - - [1664, 2112, 1, 64, 1664, 1664, 64, 64]
    - [3, 18440.3]
  - - [1728, 2112, 1, 64, 1728, 1728, 64, 64]
    - [4, 18976.9]
  - - [1792, 2112, 1, 64, 1792, 1792, 64, 64]
    - [3, 19132.5]
  - - [1856, 2112, 1, 64, 1856, 1856, 64, 64]
    - [3, 19436.6]
  - - [1920, 2112, 1, 64, 1920, 1920, 64, 64]
    - [3, 19729.3]
  - - [1984, 2112, 1, 64, 1984, 1984, 64, 64]
    - [3, 20036.6]
  - - [2048, 2112, 1, 64, 2048, 2048, 64, 64]
    - [6, 19247.7]
  - - [2112, 2112, 1, 64, 2112, 2112, 64, 64]
    - [3, 20589.3]
  - - [2176, 2112, 1, 64, 2176, 2176, 64, 64]
    - [3, 20965.3]
  - - [2240, 2112, 1, 64, 2240, 2240, 64, 64]
    - [3, 21002.5]
  - - [2304, 2112, 1, 64, 2304, 2304, 64, 64]
    - [3, 20979.7]
  - - [2368, 2112, 1, 64, 2368, 2368, 64, 64]
    - [3, 21638.3]
  - - [2432, 2112, 1, 64, 2432, 2432, 64, 64]
    - [3, 22019.1]
  - - [2496, 2112, 1, 64, 2496, 2496, 64, 64]
    - [3, 22625.9]
  - - [2560, 2112, 1, 64, 2560, 2560, 64, 64]
    - [3, 21512.3]
  - - [2624, 2112, 1, 64, 2624, 2624, 64, 64]
    - [3, 22683.3]
  - - [2688, 2112, 1, 64, 2688, 2688, 64, 64]
    - [3, 22829.3]
  - - [2752, 2112, 1, 64, 2752, 2752, 64, 64]
    - [3, 23199.3]
  - - [2816, 2112, 1, 64, 2816, 2816, 64, 64]
    - [3, 23009.9]
  - - [2880, 2112, 1, 64, 2880, 2880, 64, 64]
    - [3, 23729.3]
  - - [2944, 2112, 1, 64, 2944, 2944, 64, 64]
    - [3, 23865.3]
  - - [3008, 2112, 1, 64, 3008, 3008, 64, 64]
    - [3, 23269.2]
  - - [3072, 2112, 1, 64, 3072, 3072, 64, 64]
    - [1, 21747.8]
  - - [3136, 2112, 1, 64, 3136, 3136, 64, 64]
    - [3, 23575.2]
  - - [3200, 2112, 1, 64, 3200, 3200, 64, 64]
    - [3, 23891.6]
  - - [3264, 2112, 1, 64, 3264, 3264, 64, 64]
    - [3, 24993.3]
  - - [3328, 2112, 1, 64, 3328, 3328, 64, 64]
    - [3, 24072.0]
  - - [3392, 2112, 1, 64, 3392, 3392, 64, 64]
    - [3, 24259.7]
  - - [3456, 2112, 1, 64, 3456, 3456, 64, 64]
    - [3, 24535.7]
  - - [3520, 2112, 1, 64, 3520, 3520, 64, 64]
    - [3, 24243.9]
  - - [3584, 2112, 1, 64, 3584, 3584, 64, 64]
    - [3, 24391.3]
  - - [3648, 2112, 1, 64, 3648, 3648, 64, 64]
    - [3, 25657.5]
  - - [3712, 2112, 1, 64, 3712, 3712, 64, 64]
    - [3, 26060.2]
  - - [3776, 2112, 1, 64, 3776, 3776, 64, 64]
    - [3, 24370.3]
  - - [3840, 2112, 1, 64, 3840, 3840, 64, 64]
    - [3, 25113.2]
  - - [3904, 2112, 1, 64, 3904, 3904, 64, 64]
    - [3, 26092.2]
  - - [3968, 2112, 1, 64, 3968, 3968, 64, 64]
    - [3, 26678.3]
  - - [4032, 2112, 1, 64, 4032, 4032, 64, 64]
    - [3, 25080.2]
  - - [4096, 2112, 1, 64, 4096, 4096, 64, 64]
    - [3, 23482.3]
  - - [64, 2176, 1, 64, 64, 64, 64, 64]
    - [4, 1803.84]
  - - [128, 2176, 1, 64, 128, 128, 64, 64]
    - [2, 3437.24]
  - - [192, 2176, 1, 64, 192, 192, 64, 64]
    - [6, 4940.58]
  - - [256, 2176, 1, 64, 256, 256, 64, 64]
    - [1, 6110.92]
  - - [320, 2176, 1, 64, 320, 320, 64, 64]
    - [0, 7257.97]
  - - [384, 2176, 1, 64, 384, 384, 64, 64]
    - [7, 8188.11]
  - - [448, 2176, 1, 64, 448, 448, 64, 64]
    - [4, 9225.1]
  - - [512, 2176, 1, 64, 512, 512, 64, 64]
    - [4, 10024.2]
  - - [576, 2176, 1, 64, 576, 576, 64, 64]
    - [4, 10921.1]
  - - [640, 2176, 1, 64, 640, 640, 64, 64]
    - [4, 11637.0]
  - - [704, 2176, 1, 64, 704, 704, 64, 64]
    - [4, 12232.1]
  - - [768, 2176, 1, 64, 768, 768, 64, 64]
    - [4, 12861.1]
  - - [832, 2176, 1, 64, 832, 832, 64, 64]
    - [4, 13501.1]
  - - [896, 2176, 1, 64, 896, 896, 64, 64]
    - [4, 14045.4]
  - - [960, 2176, 1, 64, 960, 960, 64, 64]
    - [4, 14561.8]
  - - [1024, 2176, 1, 64, 1024, 1024, 64, 64]
    - [4, 14753.2]
  - - [1088, 2176, 1, 64, 1088, 1088, 64, 64]
    - [4, 15459.4]
  - - [1152, 2176, 1, 64, 1152, 1152, 64, 64]
    - [4, 15860.7]
  - - [1216, 2176, 1, 64, 1216, 1216, 64, 64]
    - [4, 16298.6]
  - - [1280, 2176, 1, 64, 1280, 1280, 64, 64]
    - [3, 16633.1]
  - - [1344, 2176, 1, 64, 1344, 1344, 64, 64]
    - [3, 17139.9]
  - - [1408, 2176, 1, 64, 1408, 1408, 64, 64]
    - [3, 17358.5]
  - - [1472, 2176, 1, 64, 1472, 1472, 64, 64]
    - [3, 17702.4]
  - - [1536, 2176, 1, 64, 1536, 1536, 64, 64]
    - [6, 17249.1]
  - - [1600, 2176, 1, 64, 1600, 1600, 64, 64]
    - [4, 18535.9]
  - - [1664, 2176, 1, 64, 1664, 1664, 64, 64]
    - [3, 18824.7]
  - - [1728, 2176, 1, 64, 1728, 1728, 64, 64]
    - [3, 19202.4]
  - - [1792, 2176, 1, 64, 1792, 1792, 64, 64]
    - [3, 19483.0]
  - - [1856, 2176, 1, 64, 1856, 1856, 64, 64]
    - [3, 19705.0]
  - - [1920, 2176, 1, 64, 1920, 1920, 64, 64]
    - [3, 19942.2]
  - - [1984, 2176, 1, 64, 1984, 1984, 64, 64]
    - [3, 20277.1]
  - - [2048, 2176, 1, 64, 2048, 2048, 64, 64]
    - [4, 19417.8]
  - - [2112, 2176, 1, 64, 2112, 2112, 64, 64]
    - [3, 20876.0]
  - - [2176, 2176, 1, 64, 2176, 2176, 64, 64]
    - [3, 21158.6]
  - - [2240, 2176, 1, 64, 2240, 2240, 64, 64]
    - [3, 21153.3]
  - - [2304, 2176, 1, 64, 2304, 2304, 64, 64]
    - [3, 21212.5]
  - - [2368, 2176, 1, 64, 2368, 2368, 64, 64]
    - [3, 21846.6]
  - - [2432, 2176, 1, 64, 2432, 2432, 64, 64]
    - [3, 22428.1]
  - - [2496, 2176, 1, 64, 2496, 2496, 64, 64]
    - [3, 22521.6]
  - - [2560, 2176, 1, 64, 2560, 2560, 64, 64]
    - [3, 21779.7]
  - - [2624, 2176, 1, 64, 2624, 2624, 64, 64]
    - [3, 22978.4]
  - - [2688, 2176, 1, 64, 2688, 2688, 64, 64]
    - [3, 22789.3]
  - - [2752, 2176, 1, 64, 2752, 2752, 64, 64]
    - [3, 23307.8]
  - - [2816, 2176, 1, 64, 2816, 2816, 64, 64]
    - [3, 23268.2]
  - - [2880, 2176, 1, 64, 2880, 2880, 64, 64]
    - [3, 23818.4]
  - - [2944, 2176, 1, 64, 2944, 2944, 64, 64]
    - [3, 23938.1]
  - - [3008, 2176, 1, 64, 3008, 3008, 64, 64]
    - [3, 23935.9]
  - - [3072, 2176, 1, 64, 3072, 3072, 64, 64]
    - [3, 21776.1]
  - - [3136, 2176, 1, 64, 3136, 3136, 64, 64]
    - [3, 23762.2]
  - - [3200, 2176, 1, 64, 3200, 3200, 64, 64]
    - [3, 24146.1]
  - - [3264, 2176, 1, 64, 3264, 3264, 64, 64]
    - [3, 25473.6]
  - - [3328, 2176, 1, 64, 3328, 3328, 64, 64]
    - [3, 24488.2]
  - - [3392, 2176, 1, 64, 3392, 3392, 64, 64]
    - [3, 25091.7]
  - - [3456, 2176, 1, 64, 3456, 3456, 64, 64]
    - [3, 23745.1]
  - - [3520, 2176, 1, 64, 3520, 3520, 64, 64]
    - [3, 24676.7]
  - - [3584, 2176, 1, 64, 3584, 3584, 64, 64]
    - [3, 24178.4]
  - - [3648, 2176, 1, 64, 3648, 3648, 64, 64]
    - [3, 25798.8]
  - - [3712, 2176, 1, 64, 3712, 3712, 64, 64]
    - [3, 26063.4]
  - - [3776, 2176, 1, 64, 3776, 3776, 64, 64]
    - [3, 24118.4]
  - - [3840, 2176, 1, 64, 3840, 3840, 64, 64]
    - [3, 25279.7]
  - - [3904, 2176, 1, 64, 3904, 3904, 64, 64]
    - [3, 26059.6]
  - - [3968, 2176, 1, 64, 3968, 3968, 64, 64]
    - [3, 25512.1]
  - - [4032, 2176, 1, 64, 4032, 4032, 64, 64]
    - [3, 26181.1]
  - - [4096, 2176, 1, 64, 4096, 4096, 64, 64]
    - [3, 23410.5]
  - - [64, 2240, 1, 64, 64, 64, 64, 64]
    - [10, 1772.25]
  - - [128, 2240, 1, 64, 128, 128, 64, 64]
    - [15, 3389.97]
  - - [192, 2240, 1, 64, 192, 192, 64, 64]
    - [7, 5105.68]
  - - [256, 2240, 1, 64, 256, 256, 64, 64]
    - [4, 6130.97]
  - - [320, 2240, 1, 64, 320, 320, 64, 64]
    - [3, 7397.91]
  - - [384, 2240, 1, 64, 384, 384, 64, 64]
    - [4, 8476.99]
  - - [448, 2240, 1, 64, 448, 448, 64, 64]
    - [4, 9408.82]
  - - [512, 2240, 1, 64, 512, 512, 64, 64]
    - [4, 10217.1]
  - - [576, 2240, 1, 64, 576, 576, 64, 64]
    - [4, 11118.1]
  - - [640, 2240, 1, 64, 640, 640, 64, 64]
    - [3, 11892.3]
  - - [704, 2240, 1, 64, 704, 704, 64, 64]
    - [4, 12418.4]
  - - [768, 2240, 1, 64, 768, 768, 64, 64]
    - [4, 13079.0]
  - - [832, 2240, 1, 64, 832, 832, 64, 64]
    - [4, 13809.6]
  - - [896, 2240, 1, 64, 896, 896, 64, 64]
    - [4, 14262.7]
  - - [960, 2240, 1, 64, 960, 960, 64, 64]
    - [4, 14803.0]
  - - [1024, 2240, 1, 64, 1024, 1024, 64, 64]
    - [4, 14933.7]
  - - [1088, 2240, 1, 64, 1088, 1088, 64, 64]
    - [4, 15683.6]
  - - [1152, 2240, 1, 64, 1152, 1152, 64, 64]
    - [4, 16102.7]
  - - [1216, 2240, 1, 64, 1216, 1216, 64, 64]
    - [4, 16528.2]
  - - [1280, 2240, 1, 64, 1280, 1280, 64, 64]
    - [3, 16964.0]
  - - [1344, 2240, 1, 64, 1344, 1344, 64, 64]
    - [3, 17472.8]
  - - [1408, 2240, 1, 64, 1408, 1408, 64, 64]
    - [3, 17604.1]
  - - [1472, 2240, 1, 64, 1472, 1472, 64, 64]
    - [3, 18016.2]
  - - [1536, 2240, 1, 64, 1536, 1536, 64, 64]
    - [6, 17455.2]
  - - [1600, 2240, 1, 64, 1600, 1600, 64, 64]
    - [3, 18646.7]
  - - [1664, 2240, 1, 64, 1664, 1664, 64, 64]
    - [3, 19140.5]
  - - [1728, 2240, 1, 64, 1728, 1728, 64, 64]
    - [3, 19535.0]
  - - [1792, 2240, 1, 64, 1792, 1792, 64, 64]
    - [3, 19627.0]
  - - [1856, 2240, 1, 64, 1856, 1856, 64, 64]
    - [3, 19973.9]
  - - [1920, 2240, 1, 64, 1920, 1920, 64, 64]
    - [3, 19951.3]
  - - [1984, 2240, 1, 64, 1984, 1984, 64, 64]
    - [3, 20488.6]
  - - [2048, 2240, 1, 64, 2048, 2048, 64, 64]
    - [4, 19521.1]
  - - [2112, 2240, 1, 64, 2112, 2112, 64, 64]
    - [3, 20950.3]
  - - [2176, 2240, 1, 64, 2176, 2176, 64, 64]
    - [3, 21410.2]
  - - [2240, 2240, 1, 64, 2240, 2240, 64, 64]
    - [3, 21255.1]
  - - [2304, 2240, 1, 64, 2304, 2304, 64, 64]
    - [3, 21377.1]
  - - [2368, 2240, 1, 64, 2368, 2368, 64, 64]
    - [3, 22416.3]
  - - [2432, 2240, 1, 64, 2432, 2432, 64, 64]
    - [3, 22441.2]
  - - [2496, 2240, 1, 64, 2496, 2496, 64, 64]
    - [3, 22700.2]
  - - [2560, 2240, 1, 64, 2560, 2560, 64, 64]
    - [3, 21927.3]
  - - [2624, 2240, 1, 64, 2624, 2624, 64, 64]
    - [3, 23025.8]
  - - [2688, 2240, 1, 64, 2688, 2688, 64, 64]
    - [3, 23102.3]
  - - [2752, 2240, 1, 64, 2752, 2752, 64, 64]
    - [3, 23525.5]
  - - [2816, 2240, 1, 64, 2816, 2816, 64, 64]
    - [3, 23511.7]
  - - [2880, 2240, 1, 64, 2880, 2880, 64, 64]
    - [3, 24282.2]
  - - [2944, 2240, 1, 64, 2944, 2944, 64, 64]
    - [3, 23699.9]
  - - [3008, 2240, 1, 64, 3008, 3008, 64, 64]
    - [3, 24179.7]
  - - [3072, 2240, 1, 64, 3072, 3072, 64, 64]
    - [1, 22118.2]
  - - [3136, 2240, 1, 64, 3136, 3136, 64, 64]
    - [3, 23924.8]
  - - [3200, 2240, 1, 64, 3200, 3200, 64, 64]
    - [3, 24173.8]
  - - [3264, 2240, 1, 64, 3264, 3264, 64, 64]
    - [3, 23603.7]
  - - [3328, 2240, 1, 64, 3328, 3328, 64, 64]
    - [3, 25170.0]
  - - [3392, 2240, 1, 64, 3392, 3392, 64, 64]
    - [3, 24994.7]
  - - [3456, 2240, 1, 64, 3456, 3456, 64, 64]
    - [3, 25172.5]
  - - [3520, 2240, 1, 64, 3520, 3520, 64, 64]
    - [3, 24752.1]
  - - [3584, 2240, 1, 64, 3584, 3584, 64, 64]
    - [3, 24597.7]
  - - [3648, 2240, 1, 64, 3648, 3648, 64, 64]
    - [3, 25246.0]
  - - [3712, 2240, 1, 64, 3712, 3712, 64, 64]
    - [3, 25414.1]
  - - [3776, 2240, 1, 64, 3776, 3776, 64, 64]
    - [3, 24883.7]
  - - [3840, 2240, 1, 64, 3840, 3840, 64, 64]
    - [3, 25480.1]
  - - [3904, 2240, 1, 64, 3904, 3904, 64, 64]
    - [3, 25724.8]
  - - [3968, 2240, 1, 64, 3968, 3968, 64, 64]
    - [3, 25085.8]
  - - [4032, 2240, 1, 64, 4032, 4032, 64, 64]
    - [3, 26617.2]
  - - [4096, 2240, 1, 64, 4096, 4096, 64, 64]
    - [1, 24172.4]
  - - [64, 2304, 1, 64, 64, 64, 64, 64]
    - [5, 1855.87]
  - - [128, 2304, 1, 64, 128, 128, 64, 64]
    - [6, 3541.09]
  - - [192, 2304, 1, 64, 192, 192, 64, 64]
    - [4, 5141.88]
  - - [256, 2304, 1, 64, 256, 256, 64, 64]
    - [3, 6374.3]
  - - [320, 2304, 1, 64, 320, 320, 64, 64]
    - [6, 7488.52]
  - - [384, 2304, 1, 64, 384, 384, 64, 64]
    - [4, 8639.41]
  - - [448, 2304, 1, 64, 448, 448, 64, 64]
    - [4, 9603.04]
  - - [512, 2304, 1, 64, 512, 512, 64, 64]
    - [4, 10406.1]
  - - [576, 2304, 1, 64, 576, 576, 64, 64]
    - [4, 11362.5]
  - - [640, 2304, 1, 64, 640, 640, 64, 64]
    - [4, 12075.6]
  - - [704, 2304, 1, 64, 704, 704, 64, 64]
    - [4, 12653.3]
  - - [768, 2304, 1, 64, 768, 768, 64, 64]
    - [4, 13223.3]
  - - [832, 2304, 1, 64, 832, 832, 64, 64]
    - [4, 13907.9]
  - - [896, 2304, 1, 64, 896, 896, 64, 64]
    - [4, 14443.9]
  - - [960, 2304, 1, 64, 960, 960, 64, 64]
    - [4, 14981.1]
  - - [1024, 2304, 1, 64, 1024, 1024, 64, 64]
    - [4, 15122.0]
  - - [1088, 2304, 1, 64, 1088, 1088, 64, 64]
    - [4, 15912.6]
  - - [1152, 2304, 1, 64, 1152, 1152, 64, 64]
    - [4, 16328.7]
  - - [1216, 2304, 1, 64, 1216, 1216, 64, 64]
    - [4, 16704.3]
  - - [1280, 2304, 1, 64, 1280, 1280, 64, 64]
    - [3, 17198.9]
  - - [1344, 2304, 1, 64, 1344, 1344, 64, 64]
    - [3, 17718.2]
  - - [1408, 2304, 1, 64, 1408, 1408, 64, 64]
    - [3, 17936.5]
  - - [1472, 2304, 1, 64, 1472, 1472, 64, 64]
    - [3, 18210.6]
  - - [1536, 2304, 1, 64, 1536, 1536, 64, 64]
    - [6, 17588.7]
  - - [1600, 2304, 1, 64, 1600, 1600, 64, 64]
    - [3, 18943.8]
  - - [1664, 2304, 1, 64, 1664, 1664, 64, 64]
    - [3, 19344.3]
  - - [1728, 2304, 1, 64, 1728, 1728, 64, 64]
    - [3, 19624.2]
  - - [1792, 2304, 1, 64, 1792, 1792, 64, 64]
    - [3, 19881.0]
  - - [1856, 2304, 1, 64, 1856, 1856, 64, 64]
    - [3, 19999.6]
  - - [1920, 2304, 1, 64, 1920, 1920, 64, 64]
    - [3, 20218.0]
  - - [1984, 2304, 1, 64, 1984, 1984, 64, 64]
    - [3, 20666.1]
  - - [2048, 2304, 1, 64, 2048, 2048, 64, 64]
    - [6, 19690.1]
  - - [2112, 2304, 1, 64, 2112, 2112, 64, 64]
    - [3, 21124.9]
  - - [2176, 2304, 1, 64, 2176, 2176, 64, 64]
    - [3, 21493.9]
  - - [2240, 2304, 1, 64, 2240, 2240, 64, 64]
    - [3, 21418.7]
  - - [2304, 2304, 1, 64, 2304, 2304, 64, 64]
    - [3, 21613.0]
  - - [2368, 2304, 1, 64, 2368, 2368, 64, 64]
    - [3, 22127.5]
  - - [2432, 2304, 1, 64, 2432, 2432, 64, 64]
    - [3, 22441.0]
  - - [2496, 2304, 1, 64, 2496, 2496, 64, 64]
    - [3, 23034.6]
  - - [2560, 2304, 1, 64, 2560, 2560, 64, 64]
    - [3, 21993.9]
  - - [2624, 2304, 1, 64, 2624, 2624, 64, 64]
    - [3, 23393.0]
  - - [2688, 2304, 1, 64, 2688, 2688, 64, 64]
    - [3, 22732.1]
  - - [2752, 2304, 1, 64, 2752, 2752, 64, 64]
    - [3, 23832.5]
  - - [2816, 2304, 1, 64, 2816, 2816, 64, 64]
    - [3, 23691.0]
  - - [2880, 2304, 1, 64, 2880, 2880, 64, 64]
    - [3, 23960.0]
  - - [2944, 2304, 1, 64, 2944, 2944, 64, 64]
    - [3, 23815.3]
  - - [3008, 2304, 1, 64, 3008, 3008, 64, 64]
    - [3, 24578.4]
  - - [3072, 2304, 1, 64, 3072, 3072, 64, 64]
    - [1, 22209.2]
  - - [3136, 2304, 1, 64, 3136, 3136, 64, 64]
    - [3, 24663.5]
  - - [3200, 2304, 1, 64, 3200, 3200, 64, 64]
    - [3, 23901.0]
  - - [3264, 2304, 1, 64, 3264, 3264, 64, 64]
    - [3, 24675.2]
  - - [3328, 2304, 1, 64, 3328, 3328, 64, 64]
    - [3, 24503.4]
  - - [3392, 2304, 1, 64, 3392, 3392, 64, 64]
    - [3, 24635.0]
  - - [3456, 2304, 1, 64, 3456, 3456, 64, 64]
    - [3, 24703.1]
  - - [3520, 2304, 1, 64, 3520, 3520, 64, 64]
    - [3, 25486.7]
  - - [3584, 2304, 1, 64, 3584, 3584, 64, 64]
    - [3, 24744.9]
  - - [3648, 2304, 1, 64, 3648, 3648, 64, 64]
    - [3, 25592.9]
  - - [3712, 2304, 1, 64, 3712, 3712, 64, 64]
    - [3, 26448.4]
  - - [3776, 2304, 1, 64, 3776, 3776, 64, 64]
    - [3, 24673.7]
  - - [3840, 2304, 1, 64, 3840, 3840, 64, 64]
    - [3, 26242.0]
  - - [3904, 2304, 1, 64, 3904, 3904, 64, 64]
    - [1, 25546.3]
  - - [3968, 2304, 1, 64, 3968, 3968, 64, 64]
    - [3, 26481.0]
  - - [4032, 2304, 1, 64, 4032, 4032, 64, 64]
    - [3, 27288.6]
  - - [4096, 2304, 1, 64, 4096, 4096, 64, 64]
    - [1, 23789.6]
  - - [64, 2368, 1, 64, 64, 64, 64, 64]
    - [1, 1875.7]
  - - [128, 2368, 1, 64, 128, 128, 64, 64]
    - [1, 3627.9]
  - - [192, 2368, 1, 64, 192, 192, 64, 64]
    - [7, 5289.51]
  - - [256, 2368, 1, 64, 256, 256, 64, 64]
    - [4, 6518.28]
  - - [320, 2368, 1, 64, 320, 320, 64, 64]
    - [7, 7703.87]
  - - [384, 2368, 1, 64, 384, 384, 64, 64]
    - [4, 8784.2]
  - - [448, 2368, 1, 64, 448, 448, 64, 64]
    - [4, 9824.13]
  - - [512, 2368, 1, 64, 512, 512, 64, 64]
    - [4, 10623.5]
  - - [576, 2368, 1, 64, 576, 576, 64, 64]
    - [3, 11492.1]
  - - [640, 2368, 1, 64, 640, 640, 64, 64]
    - [3, 12248.0]
  - - [704, 2368, 1, 64, 704, 704, 64, 64]
    - [4, 12832.7]
  - - [768, 2368, 1, 64, 768, 768, 64, 64]
    - [4, 13404.4]
  - - [832, 2368, 1, 64, 832, 832, 64, 64]
    - [4, 14108.7]
  - - [896, 2368, 1, 64, 896, 896, 64, 64]
    - [3, 14579.0]
  - - [960, 2368, 1, 64, 960, 960, 64, 64]
    - [4, 15136.1]
  - - [1024, 2368, 1, 64, 1024, 1024, 64, 64]
    - [4, 15321.2]
  - - [1088, 2368, 1, 64, 1088, 1088, 64, 64]
    - [4, 16108.5]
  - - [1152, 2368, 1, 64, 1152, 1152, 64, 64]
    - [4, 16428.6]
  - - [1216, 2368, 1, 64, 1216, 1216, 64, 64]
    - [3, 17077.6]
  - - [1280, 2368, 1, 64, 1280, 1280, 64, 64]
    - [3, 17469.7]
  - - [1344, 2368, 1, 64, 1344, 1344, 64, 64]
    - [3, 17950.4]
  - - [1408, 2368, 1, 64, 1408, 1408, 64, 64]
    - [3, 18121.6]
  - - [1472, 2368, 1, 64, 1472, 1472, 64, 64]
    - [3, 18336.5]
  - - [1536, 2368, 1, 64, 1536, 1536, 64, 64]
    - [6, 17707.3]
  - - [1600, 2368, 1, 64, 1600, 1600, 64, 64]
    - [4, 19086.9]
  - - [1664, 2368, 1, 64, 1664, 1664, 64, 64]
    - [3, 19509.4]
  - - [1728, 2368, 1, 64, 1728, 1728, 64, 64]
    - [3, 19849.9]
  - - [1792, 2368, 1, 64, 1792, 1792, 64, 64]
    - [3, 19992.5]
  - - [1856, 2368, 1, 64, 1856, 1856, 64, 64]
    - [3, 20179.1]
  - - [1920, 2368, 1, 64, 1920, 1920, 64, 64]
    - [3, 20417.9]
  - - [1984, 2368, 1, 64, 1984, 1984, 64, 64]
    - [3, 20736.3]
  - - [2048, 2368, 1, 64, 2048, 2048, 64, 64]
    - [4, 19828.4]
  - - [2112, 2368, 1, 64, 2112, 2112, 64, 64]
    - [3, 21237.7]
  - - [2176, 2368, 1, 64, 2176, 2176, 64, 64]
    - [3, 21658.5]
  - - [2240, 2368, 1, 64, 2240, 2240, 64, 64]
    - [3, 21610.0]
  - - [2304, 2368, 1, 64, 2304, 2304, 64, 64]
    - [3, 22022.8]
  - - [2368, 2368, 1, 64, 2368, 2368, 64, 64]
    - [3, 22401.4]
  - - [2432, 2368, 1, 64, 2432, 2432, 64, 64]
    - [3, 22688.1]
  - - [2496, 2368, 1, 64, 2496, 2496, 64, 64]
    - [3, 22867.2]
  - - [2560, 2368, 1, 64, 2560, 2560, 64, 64]
    - [3, 22279.1]
  - - [2624, 2368, 1, 64, 2624, 2624, 64, 64]
    - [3, 22954.7]
  - - [2688, 2368, 1, 64, 2688, 2688, 64, 64]
    - [3, 23465.8]
  - - [2752, 2368, 1, 64, 2752, 2752, 64, 64]
    - [3, 24198.8]
  - - [2816, 2368, 1, 64, 2816, 2816, 64, 64]
    - [3, 23527.5]
  - - [2880, 2368, 1, 64, 2880, 2880, 64, 64]
    - [3, 24198.3]
  - - [2944, 2368, 1, 64, 2944, 2944, 64, 64]
    - [3, 23775.1]
  - - [3008, 2368, 1, 64, 3008, 3008, 64, 64]
    - [3, 24197.8]
  - - [3072, 2368, 1, 64, 3072, 3072, 64, 64]
    - [3, 22520.2]
  - - [3136, 2368, 1, 64, 3136, 3136, 64, 64]
    - [3, 24888.0]
  - - [3200, 2368, 1, 64, 3200, 3200, 64, 64]
    - [3, 24251.7]
  - - [3264, 2368, 1, 64, 3264, 3264, 64, 64]
    - [3, 25137.8]
  - - [3328, 2368, 1, 64, 3328, 3328, 64, 64]
    - [3, 25019.0]
  - - [3392, 2368, 1, 64, 3392, 3392, 64, 64]
    - [3, 25145.9]
  - - [3456, 2368, 1, 64, 3456, 3456, 64, 64]
    - [3, 25529.2]
  - - [3520, 2368, 1, 64, 3520, 3520, 64, 64]
    - [3, 26203.8]
  - - [3584, 2368, 1, 64, 3584, 3584, 64, 64]
    - [3, 25053.3]
  - - [3648, 2368, 1, 64, 3648, 3648, 64, 64]
    - [3, 26557.9]
  - - [3712, 2368, 1, 64, 3712, 3712, 64, 64]
    - [3, 25259.5]
  - - [3776, 2368, 1, 64, 3776, 3776, 64, 64]
    - [3, 24907.7]
  - - [3840, 2368, 1, 64, 3840, 3840, 64, 64]
    - [3, 25316.6]
  - - [3904, 2368, 1, 64, 3904, 3904, 64, 64]
    - [3, 25380.8]
  - - [3968, 2368, 1, 64, 3968, 3968, 64, 64]
    - [3, 26107.1]
  - - [4032, 2368, 1, 64, 4032, 4032, 64, 64]
    - [3, 26413.5]
  - - [4096, 2368, 1, 64, 4096, 4096, 64, 64]
    - [1, 24113.3]
  - - [64, 2432, 1, 64, 64, 64, 64, 64]
    - [6, 2040.83]
  - - [128, 2432, 1, 64, 128, 128, 64, 64]
    - [6, 3860.98]
  - - [192, 2432, 1, 64, 192, 192, 64, 64]
    - [4, 5354.6]
  - - [256, 2432, 1, 64, 256, 256, 64, 64]
    - [7, 6585.99]
  - - [320, 2432, 1, 64, 320, 320, 64, 64]
    - [0, 7828.76]
  - - [384, 2432, 1, 64, 384, 384, 64, 64]
    - [4, 8921.95]
  - - [448, 2432, 1, 64, 448, 448, 64, 64]
    - [4, 9957.06]
  - - [512, 2432, 1, 64, 512, 512, 64, 64]
    - [4, 10810.0]
  - - [576, 2432, 1, 64, 576, 576, 64, 64]
    - [4, 11675.0]
  - - [640, 2432, 1, 64, 640, 640, 64, 64]
    - [4, 12450.1]
  - - [704, 2432, 1, 64, 704, 704, 64, 64]
    - [4, 12996.7]
  - - [768, 2432, 1, 64, 768, 768, 64, 64]
    - [4, 13623.9]
  - - [832, 2432, 1, 64, 832, 832, 64, 64]
    - [4, 14304.4]
  - - [896, 2432, 1, 64, 896, 896, 64, 64]
    - [4, 14839.2]
  - - [960, 2432, 1, 64, 960, 960, 64, 64]
    - [4, 15369.3]
  - - [1024, 2432, 1, 64, 1024, 1024, 64, 64]
    - [4, 15567.6]
  - - [1088, 2432, 1, 64, 1088, 1088, 64, 64]
    - [3, 16254.8]
  - - [1152, 2432, 1, 64, 1152, 1152, 64, 64]
    - [4, 16688.8]
  - - [1216, 2432, 1, 64, 1216, 1216, 64, 64]
    - [3, 17221.6]
  - - [1280, 2432, 1, 64, 1280, 1280, 64, 64]
    - [3, 17709.1]
  - - [1344, 2432, 1, 64, 1344, 1344, 64, 64]
    - [3, 18210.9]
  - - [1408, 2432, 1, 64, 1408, 1408, 64, 64]
    - [3, 18226.0]
  - - [1472, 2432, 1, 64, 1472, 1472, 64, 64]
    - [3, 18479.7]
  - - [1536, 2432, 1, 64, 1536, 1536, 64, 64]
    - [6, 17896.0]
  - - [1600, 2432, 1, 64, 1600, 1600, 64, 64]
    - [3, 19258.7]
  - - [1664, 2432, 1, 64, 1664, 1664, 64, 64]
    - [3, 19682.1]
  - - [1728, 2432, 1, 64, 1728, 1728, 64, 64]
    - [3, 19881.4]
  - - [1792, 2432, 1, 64, 1792, 1792, 64, 64]
    - [3, 20073.2]
  - - [1856, 2432, 1, 64, 1856, 1856, 64, 64]
    - [3, 20486.4]
  - - [1920, 2432, 1, 64, 1920, 1920, 64, 64]
    - [3, 20474.1]
  - - [1984, 2432, 1, 64, 1984, 1984, 64, 64]
    - [3, 20964.1]
  - - [2048, 2432, 1, 64, 2048, 2048, 64, 64]
    - [6, 20088.5]
  - - [2112, 2432, 1, 64, 2112, 2112, 64, 64]
    - [3, 21457.2]
  - - [2176, 2432, 1, 64, 2176, 2176, 64, 64]
    - [3, 21914.3]
  - - [2240, 2432, 1, 64, 2240, 2240, 64, 64]
    - [3, 22025.8]
  - - [2304, 2432, 1, 64, 2304, 2304, 64, 64]
    - [3, 21869.0]
  - - [2368, 2432, 1, 64, 2368, 2368, 64, 64]
    - [3, 22804.7]
  - - [2432, 2432, 1, 64, 2432, 2432, 64, 64]
    - [3, 23259.9]
  - - [2496, 2432, 1, 64, 2496, 2496, 64, 64]
    - [3, 23488.0]
  - - [2560, 2432, 1, 64, 2560, 2560, 64, 64]
    - [3, 22882.5]
  - - [2624, 2432, 1, 64, 2624, 2624, 64, 64]
    - [3, 23729.8]
  - - [2688, 2432, 1, 64, 2688, 2688, 64, 64]
    - [3, 23732.3]
  - - [2752, 2432, 1, 64, 2752, 2752, 64, 64]
    - [3, 23594.7]
  - - [2816, 2432, 1, 64, 2816, 2816, 64, 64]
    - [3, 23801.2]
  - - [2880, 2432, 1, 64, 2880, 2880, 64, 64]
    - [3, 24072.8]
  - - [2944, 2432, 1, 64, 2944, 2944, 64, 64]
    - [3, 24261.2]
  - - [3008, 2432, 1, 64, 3008, 3008, 64, 64]
    - [3, 23834.7]
  - - [3072, 2432, 1, 64, 3072, 3072, 64, 64]
    - [1, 22669.5]
  - - [3136, 2432, 1, 64, 3136, 3136, 64, 64]
    - [3, 24847.6]
  - - [3200, 2432, 1, 64, 3200, 3200, 64, 64]
    - [3, 25023.4]
  - - [3264, 2432, 1, 64, 3264, 3264, 64, 64]
    - [3, 24831.6]
  - - [3328, 2432, 1, 64, 3328, 3328, 64, 64]
    - [3, 25746.3]
  - - [3392, 2432, 1, 64, 3392, 3392, 64, 64]
    - [3, 25947.4]
  - - [3456, 2432, 1, 64, 3456, 3456, 64, 64]
    - [3, 25896.2]
  - - [3520, 2432, 1, 64, 3520, 3520, 64, 64]
    - [3, 26021.2]
  - - [3584, 2432, 1, 64, 3584, 3584, 64, 64]
    - [3, 25156.1]
  - - [3648, 2432, 1, 64, 3648, 3648, 64, 64]
    - [3, 26728.7]
  - - [3712, 2432, 1, 64, 3712, 3712, 64, 64]
    - [3, 26731.9]
  - - [3776, 2432, 1, 64, 3776, 3776, 64, 64]
    - [3, 25657.9]
  - - [3840, 2432, 1, 64, 3840, 3840, 64, 64]
    - [3, 25414.8]
  - - [3904, 2432, 1, 64, 3904, 3904, 64, 64]
    - [3, 26510.3]
  - - [3968, 2432, 1, 64, 3968, 3968, 64, 64]
    - [3, 26420.4]
  - - [4032, 2432, 1, 64, 4032, 4032, 64, 64]
    - [3, 27333.0]
  - - [4096, 2432, 1, 64, 4096, 4096, 64, 64]
    - [3, 24913.1]
  - - [64, 2496, 1, 64, 64, 64, 64, 64]
    - [16, 2016.87]
  - - [128, 2496, 1, 64, 128, 128, 64, 64]
    - [17, 4000.57]
  - - [192, 2496, 1, 64, 192, 192, 64, 64]
    - [4, 5620.38]
  - - [256, 2496, 1, 64, 256, 256, 64, 64]
    - [1, 6953.57]
  - - [320, 2496, 1, 64, 320, 320, 64, 64]
    - [7, 8094.64]
  - - [384, 2496, 1, 64, 384, 384, 64, 64]
    - [4, 9250.71]
  - - [448, 2496, 1, 64, 448, 448, 64, 64]
    - [4, 10213.3]
  - - [512, 2496, 1, 64, 512, 512, 64, 64]
    - [4, 10963.5]
  - - [576, 2496, 1, 64, 576, 576, 64, 64]
    - [4, 11897.0]
  - - [640, 2496, 1, 64, 640, 640, 64, 64]
    - [4, 12627.8]
  - - [704, 2496, 1, 64, 704, 704, 64, 64]
    - [4, 13200.9]
  - - [768, 2496, 1, 64, 768, 768, 64, 64]
    - [4, 13762.8]
  - - [832, 2496, 1, 64, 832, 832, 64, 64]
    - [4, 14512.5]
  - - [896, 2496, 1, 64, 896, 896, 64, 64]
    - [4, 15048.8]
  - - [960, 2496, 1, 64, 960, 960, 64, 64]
    - [4, 15530.9]
  - - [1024, 2496, 1, 64, 1024, 1024, 64, 64]
    - [4, 15748.1]
  - - [1088, 2496, 1, 64, 1088, 1088, 64, 64]
    - [4, 16467.8]
  - - [1152, 2496, 1, 64, 1152, 1152, 64, 64]
    - [4, 16869.0]
  - - [1216, 2496, 1, 64, 1216, 1216, 64, 64]
    - [3, 17457.2]
  - - [1280, 2496, 1, 64, 1280, 1280, 64, 64]
    - [3, 17976.9]
  - - [1344, 2496, 1, 64, 1344, 1344, 64, 64]
    - [3, 18343.6]
  - - [1408, 2496, 1, 64, 1408, 1408, 64, 64]
    - [3, 18300.8]
  - - [1472, 2496, 1, 64, 1472, 1472, 64, 64]
    - [4, 18923.2]
  - - [1536, 2496, 1, 64, 1536, 1536, 64, 64]
    - [6, 18404.1]
  - - [1600, 2496, 1, 64, 1600, 1600, 64, 64]
    - [3, 19349.4]
  - - [1664, 2496, 1, 64, 1664, 1664, 64, 64]
    - [3, 19796.7]
  - - [1728, 2496, 1, 64, 1728, 1728, 64, 64]
    - [3, 20092.7]
  - - [1792, 2496, 1, 64, 1792, 1792, 64, 64]
    - [3, 20393.0]
  - - [1856, 2496, 1, 64, 1856, 1856, 64, 64]
    - [3, 20621.9]
  - - [1920, 2496, 1, 64, 1920, 1920, 64, 64]
    - [3, 20807.6]
  - - [1984, 2496, 1, 64, 1984, 1984, 64, 64]
    - [3, 21202.1]
  - - [2048, 2496, 1, 64, 2048, 2048, 64, 64]
    - [4, 20035.0]
  - - [2112, 2496, 1, 64, 2112, 2112, 64, 64]
    - [3, 21894.7]
  - - [2176, 2496, 1, 64, 2176, 2176, 64, 64]
    - [3, 22294.9]
  - - [2240, 2496, 1, 64, 2240, 2240, 64, 64]
    - [3, 22124.7]
  - - [2304, 2496, 1, 64, 2304, 2304, 64, 64]
    - [3, 22180.8]
  - - [2368, 2496, 1, 64, 2368, 2368, 64, 64]
    - [3, 23124.4]
  - - [2432, 2496, 1, 64, 2432, 2432, 64, 64]
    - [3, 23397.5]
  - - [2496, 2496, 1, 64, 2496, 2496, 64, 64]
    - [3, 23674.0]
  - - [2560, 2496, 1, 64, 2560, 2560, 64, 64]
    - [3, 23036.2]
  - - [2624, 2496, 1, 64, 2624, 2624, 64, 64]
    - [3, 23695.0]
  - - [2688, 2496, 1, 64, 2688, 2688, 64, 64]
    - [3, 24290.7]
  - - [2752, 2496, 1, 64, 2752, 2752, 64, 64]
    - [3, 24208.9]
  - - [2816, 2496, 1, 64, 2816, 2816, 64, 64]
    - [3, 23719.2]
  - - [2880, 2496, 1, 64, 2880, 2880, 64, 64]
    - [3, 25493.6]
  - - [2944, 2496, 1, 64, 2944, 2944, 64, 64]
    - [3, 24377.0]
  - - [3008, 2496, 1, 64, 3008, 3008, 64, 64]
    - [3, 25519.3]
  - - [3072, 2496, 1, 64, 3072, 3072, 64, 64]
    - [1, 22782.2]
  - - [3136, 2496, 1, 64, 3136, 3136, 64, 64]
    - [3, 24293.2]
  - - [3200, 2496, 1, 64, 3200, 3200, 64, 64]
    - [3, 25443.0]
  - - [3264, 2496, 1, 64, 3264, 3264, 64, 64]
    - [3, 25776.1]
  - - [3328, 2496, 1, 64, 3328, 3328, 64, 64]
    - [3, 25603.1]
  - - [3392, 2496, 1, 64, 3392, 3392, 64, 64]
    - [3, 26257.2]
  - - [3456, 2496, 1, 64, 3456, 3456, 64, 64]
    - [0, 24981.6]
  - - [3520, 2496, 1, 64, 3520, 3520, 64, 64]
    - [3, 26335.7]
  - - [3584, 2496, 1, 64, 3584, 3584, 64, 64]
    - [3, 25645.7]
  - - [3648, 2496, 1, 64, 3648, 3648, 64, 64]
    - [3, 27443.6]
  - - [3712, 2496, 1, 64, 3712, 3712, 64, 64]
    - [3, 26259.4]
  - - [3776, 2496, 1, 64, 3776, 3776, 64, 64]
    - [3, 25735.4]
  - - [3840, 2496, 1, 64, 3840, 3840, 64, 64]
    - [3, 26408.1]
  - - [3904, 2496, 1, 64, 3904, 3904, 64, 64]
    - [3, 27820.9]
  - - [3968, 2496, 1, 64, 3968, 3968, 64, 64]
    - [3, 25797.0]
  - - [4032, 2496, 1, 64, 4032, 4032, 64, 64]
    - [3, 27214.2]
  - - [4096, 2496, 1, 64, 4096, 4096, 64, 64]
    - [3, 23811.9]
  - - [64, 2560, 1, 64, 64, 64, 64, 64]
    - [5, 2060.46]
  - - [128, 2560, 1, 64, 128, 128, 64, 64]
    - [1, 4020.59]
  - - [192, 2560, 1, 64, 192, 192, 64, 64]
    - [0, 5554.81]
  - - [256, 2560, 1, 64, 256, 256, 64, 64]
    - [4, 6907.5]
  - - [320, 2560, 1, 64, 320, 320, 64, 64]
    - [7, 8151.12]
  - - [384, 2560, 1, 64, 384, 384, 64, 64]
    - [4, 9284.81]
  - - [448, 2560, 1, 64, 448, 448, 64, 64]
    - [4, 10359.8]
  - - [512, 2560, 1, 64, 512, 512, 64, 64]
    - [4, 11146.0]
  - - [576, 2560, 1, 64, 576, 576, 64, 64]
    - [4, 12119.0]
  - - [640, 2560, 1, 64, 640, 640, 64, 64]
    - [4, 12826.5]
  - - [704, 2560, 1, 64, 704, 704, 64, 64]
    - [4, 13335.8]
  - - [768, 2560, 1, 64, 768, 768, 64, 64]
    - [4, 13982.4]
  - - [832, 2560, 1, 64, 832, 832, 64, 64]
    - [4, 14665.2]
  - - [896, 2560, 1, 64, 896, 896, 64, 64]
    - [4, 15202.9]
  - - [960, 2560, 1, 64, 960, 960, 64, 64]
    - [4, 15750.5]
  - - [1024, 2560, 1, 64, 1024, 1024, 64, 64]
    - [4, 15918.9]
  - - [1088, 2560, 1, 64, 1088, 1088, 64, 64]
    - [4, 16628.3]
  - - [1152, 2560, 1, 64, 1152, 1152, 64, 64]
    - [4, 17080.6]
  - - [1216, 2560, 1, 64, 1216, 1216, 64, 64]
    - [3, 17609.0]
  - - [1280, 2560, 1, 64, 1280, 1280, 64, 64]
    - [3, 18125.5]
  - - [1344, 2560, 1, 64, 1344, 1344, 64, 64]
    - [3, 18449.7]
  - - [1408, 2560, 1, 64, 1408, 1408, 64, 64]
    - [3, 18503.6]
  - - [1472, 2560, 1, 64, 1472, 1472, 64, 64]
    - [4, 19028.7]
  - - [1536, 2560, 1, 64, 1536, 1536, 64, 64]
    - [6, 18439.0]
  - - [1600, 2560, 1, 64, 1600, 1600, 64, 64]
    - [4, 19678.8]
  - - [1664, 2560, 1, 64, 1664, 1664, 64, 64]
    - [3, 20091.8]
  - - [1728, 2560, 1, 64, 1728, 1728, 64, 64]
    - [3, 20348.7]
  - - [1792, 2560, 1, 64, 1792, 1792, 64, 64]
    - [3, 20712.3]
  - - [1856, 2560, 1, 64, 1856, 1856, 64, 64]
    - [3, 20904.9]
  - - [1920, 2560, 1, 64, 1920, 1920, 64, 64]
    - [3, 21123.3]
  - - [1984, 2560, 1, 64, 1984, 1984, 64, 64]
    - [3, 21485.5]
  - - [2048, 2560, 1, 64, 2048, 2048, 64, 64]
    - [3, 20136.8]
  - - [2112, 2560, 1, 64, 2112, 2112, 64, 64]
    - [3, 21976.8]
  - - [2176, 2560, 1, 64, 2176, 2176, 64, 64]
    - [3, 22388.3]
  - - [2240, 2560, 1, 64, 2240, 2240, 64, 64]
    - [3, 22650.0]
  - - [2304, 2560, 1, 64, 2304, 2304, 64, 64]
    - [3, 22372.0]
  - - [2368, 2560, 1, 64, 2368, 2368, 64, 64]
    - [3, 22996.2]
  - - [2432, 2560, 1, 64, 2432, 2432, 64, 64]
    - [3, 23806.7]
  - - [2496, 2560, 1, 64, 2496, 2496, 64, 64]
    - [3, 23767.5]
  - - [2560, 2560, 1, 64, 2560, 2560, 64, 64]
    - [1, 22517.1]
  - - [2624, 2560, 1, 64, 2624, 2624, 64, 64]
    - [3, 23889.3]
  - - [2688, 2560, 1, 64, 2688, 2688, 64, 64]
    - [3, 23893.1]
  - - [2752, 2560, 1, 64, 2752, 2752, 64, 64]
    - [3, 24654.5]
  - - [2816, 2560, 1, 64, 2816, 2816, 64, 64]
    - [3, 24349.2]
  - - [2880, 2560, 1, 64, 2880, 2880, 64, 64]
    - [3, 24732.8]
  - - [2944, 2560, 1, 64, 2944, 2944, 64, 64]
    - [3, 25281.3]
  - - [3008, 2560, 1, 64, 3008, 3008, 64, 64]
    - [3, 25005.0]
  - - [3072, 2560, 1, 64, 3072, 3072, 64, 64]
    - [1, 22586.1]
  - - [3136, 2560, 1, 64, 3136, 3136, 64, 64]
    - [3, 25219.4]
  - - [3200, 2560, 1, 64, 3200, 3200, 64, 64]
    - [3, 26351.1]
  - - [3264, 2560, 1, 64, 3264, 3264, 64, 64]
    - [3, 24953.0]
  - - [3328, 2560, 1, 64, 3328, 3328, 64, 64]
    - [3, 25966.9]
  - - [3392, 2560, 1, 64, 3392, 3392, 64, 64]
    - [3, 26294.7]
  - - [3456, 2560, 1, 64, 3456, 3456, 64, 64]
    - [3, 26929.7]
  - - [3520, 2560, 1, 64, 3520, 3520, 64, 64]
    - [3, 27138.0]
  - - [3584, 2560, 1, 64, 3584, 3584, 64, 64]
    - [3, 25290.5]
  - - [3648, 2560, 1, 64, 3648, 3648, 64, 64]
    - [1, 25518.0]
  - - [3712, 2560, 1, 64, 3712, 3712, 64, 64]
    - [3, 27530.0]
  - - [3776, 2560, 1, 64, 3776, 3776, 64, 64]
    - [3, 26008.0]
  - - [3840, 2560, 1, 64, 3840, 3840, 64, 64]
    - [1, 25068.3]
  - - [3904, 2560, 1, 64, 3904, 3904, 64, 64]
    - [3, 26333.8]
  - - [3968, 2560, 1, 64, 3968, 3968, 64, 64]
    - [3, 25896.6]
  - - [4032, 2560, 1, 64, 4032, 4032, 64, 64]
    - [1, 26289.2]
  - - [4096, 2560, 1, 64, 4096, 4096, 64, 64]
    - [1, 24250.3]
  - - [64, 2624, 1, 64, 64, 64, 64, 64]
    - [5, 2213.29]
  - - [128, 2624, 1, 64, 128, 128, 64, 64]
    - [18, 3991.02]
  - - [192, 2624, 1, 64, 192, 192, 64, 64]
    - [3, 5710.79]
  - - [256, 2624, 1, 64, 256, 256, 64, 64]
    - [0, 7031.61]
  - - [320, 2624, 1, 64, 320, 320, 64, 64]
    - [7, 8287.89]
  - - [384, 2624, 1, 64, 384, 384, 64, 64]
    - [4, 9472.16]
  - - [448, 2624, 1, 64, 448, 448, 64, 64]
    - [4, 10556.2]
  - - [512, 2624, 1, 64, 512, 512, 64, 64]
    - [4, 11338.9]
  - - [576, 2624, 1, 64, 576, 576, 64, 64]
    - [4, 12252.0]
  - - [640, 2624, 1, 64, 640, 640, 64, 64]
    - [4, 12949.1]
  - - [704, 2624, 1, 64, 704, 704, 64, 64]
    - [4, 13537.8]
  - - [768, 2624, 1, 64, 768, 768, 64, 64]
    - [4, 14168.2]
  - - [832, 2624, 1, 64, 832, 832, 64, 64]
    - [4, 14879.8]
  - - [896, 2624, 1, 64, 896, 896, 64, 64]
    - [4, 15349.3]
  - - [960, 2624, 1, 64, 960, 960, 64, 64]
    - [4, 15889.7]
  - - [1024, 2624, 1, 64, 1024, 1024, 64, 64]
    - [4, 16048.9]
  - - [1088, 2624, 1, 64, 1088, 1088, 64, 64]
    - [4, 16808.8]
  - - [1152, 2624, 1, 64, 1152, 1152, 64, 64]
    - [4, 17474.5]
  - - [1216, 2624, 1, 64, 1216, 1216, 64, 64]
    - [4, 17977.6]
  - - [1280, 2624, 1, 64, 1280, 1280, 64, 64]
    - [3, 18205.8]
  - - [1344, 2624, 1, 64, 1344, 1344, 64, 64]
    - [4, 18570.4]
  - - [1408, 2624, 1, 64, 1408, 1408, 64, 64]
    - [3, 18722.9]
  - - [1472, 2624, 1, 64, 1472, 1472, 64, 64]
    - [4, 19300.4]
  - - [1536, 2624, 1, 64, 1536, 1536, 64, 64]
    - [6, 18810.4]
  - - [1600, 2624, 1, 64, 1600, 1600, 64, 64]
    - [3, 19884.1]
  - - [1664, 2624, 1, 64, 1664, 1664, 64, 64]
    - [3, 20320.1]
  - - [1728, 2624, 1, 64, 1728, 1728, 64, 64]
    - [3, 20699.7]
  - - [1792, 2624, 1, 64, 1792, 1792, 64, 64]
    - [3, 20834.8]
  - - [1856, 2624, 1, 64, 1856, 1856, 64, 64]
    - [3, 21135.5]
  - - [1920, 2624, 1, 64, 1920, 1920, 64, 64]
    - [3, 21361.7]
  - - [1984, 2624, 1, 64, 1984, 1984, 64, 64]
    - [3, 21728.2]
  - - [2048, 2624, 1, 64, 2048, 2048, 64, 64]
    - [6, 20501.2]
  - - [2112, 2624, 1, 64, 2112, 2112, 64, 64]
    - [3, 22437.9]
  - - [2176, 2624, 1, 64, 2176, 2176, 64, 64]
    - [3, 23058.1]
  - - [2240, 2624, 1, 64, 2240, 2240, 64, 64]
    - [3, 22495.6]
  - - [2304, 2624, 1, 64, 2304, 2304, 64, 64]
    - [3, 22587.2]
  - - [2368, 2624, 1, 64, 2368, 2368, 64, 64]
    - [3, 23397.7]
  - - [2432, 2624, 1, 64, 2432, 2432, 64, 64]
    - [3, 24062.6]
  - - [2496, 2624, 1, 64, 2496, 2496, 64, 64]
    - [3, 23945.3]
  - - [2560, 2624, 1, 64, 2560, 2560, 64, 64]
    - [3, 23339.3]
  - - [2624, 2624, 1, 64, 2624, 2624, 64, 64]
    - [3, 23820.6]
  - - [2688, 2624, 1, 64, 2688, 2688, 64, 64]
    - [3, 23831.0]
  - - [2752, 2624, 1, 64, 2752, 2752, 64, 64]
    - [3, 23706.3]
  - - [2816, 2624, 1, 64, 2816, 2816, 64, 64]
    - [3, 24345.0]
  - - [2880, 2624, 1, 64, 2880, 2880, 64, 64]
    - [3, 25435.1]
  - - [2944, 2624, 1, 64, 2944, 2944, 64, 64]
    - [3, 24865.3]
  - - [3008, 2624, 1, 64, 3008, 3008, 64, 64]
    - [3, 25290.2]
  - - [3072, 2624, 1, 64, 3072, 3072, 64, 64]
    - [1, 23195.6]
  - - [3136, 2624, 1, 64, 3136, 3136, 64, 64]
    - [3, 25499.5]
  - - [3200, 2624, 1, 64, 3200, 3200, 64, 64]
    - [3, 25930.7]
  - - [3264, 2624, 1, 64, 3264, 3264, 64, 64]
    - [3, 26214.1]
  - - [3328, 2624, 1, 64, 3328, 3328, 64, 64]
    - [3, 25765.7]
  - - [3392, 2624, 1, 64, 3392, 3392, 64, 64]
    - [3, 26509.3]
  - - [3456, 2624, 1, 64, 3456, 3456, 64, 64]
    - [3, 26743.2]
  - - [3520, 2624, 1, 64, 3520, 3520, 64, 64]
    - [3, 26360.2]
  - - [3584, 2624, 1, 64, 3584, 3584, 64, 64]
    - [3, 26014.7]
  - - [3648, 2624, 1, 64, 3648, 3648, 64, 64]
    - [3, 27103.6]
  - - [3712, 2624, 1, 64, 3712, 3712, 64, 64]
    - [3, 27039.6]
  - - [3776, 2624, 1, 64, 3776, 3776, 64, 64]
    - [3, 25336.3]
  - - [3840, 2624, 1, 64, 3840, 3840, 64, 64]
    - [3, 26668.3]
  - - [3904, 2624, 1, 64, 3904, 3904, 64, 64]
    - [3, 26178.5]
  - - [3968, 2624, 1, 64, 3968, 3968, 64, 64]
    - [3, 26829.4]
  - - [4032, 2624, 1, 64, 4032, 4032, 64, 64]
    - [1, 25759.3]
  - - [4096, 2624, 1, 64, 4096, 4096, 64, 64]
    - [1, 23899.7]
  - - [64, 2688, 1, 64, 64, 64, 64, 64]
    - [4, 2119.32]
  - - [128, 2688, 1, 64, 128, 128, 64, 64]
    - [18, 4058.2]
  - - [192, 2688, 1, 64, 192, 192, 64, 64]
    - [6, 5835.61]
  - - [256, 2688, 1, 64, 256, 256, 64, 64]
    - [4, 7147.0]
  - - [320, 2688, 1, 64, 320, 320, 64, 64]
    - [4, 8478.3]
  - - [384, 2688, 1, 64, 384, 384, 64, 64]
    - [4, 9638.07]
  - - [448, 2688, 1, 64, 448, 448, 64, 64]
    - [4, 10757.9]
  - - [512, 2688, 1, 64, 512, 512, 64, 64]
    - [4, 11563.5]
  - - [576, 2688, 1, 64, 576, 576, 64, 64]
    - [4, 12420.3]
  - - [640, 2688, 1, 64, 640, 640, 64, 64]
    - [4, 13149.3]
  - - [704, 2688, 1, 64, 704, 704, 64, 64]
    - [4, 13686.2]
  - - [768, 2688, 1, 64, 768, 768, 64, 64]
    - [4, 14244.6]
  - - [832, 2688, 1, 64, 832, 832, 64, 64]
    - [4, 14990.4]
  - - [896, 2688, 1, 64, 896, 896, 64, 64]
    - [4, 15519.4]
  - - [960, 2688, 1, 64, 960, 960, 64, 64]
    - [4, 16102.6]
  - - [1024, 2688, 1, 64, 1024, 1024, 64, 64]
    - [4, 16139.1]
  - - [1088, 2688, 1, 64, 1088, 1088, 64, 64]
    - [4, 16942.9]
  - - [1152, 2688, 1, 64, 1152, 1152, 64, 64]
    - [4, 17361.3]
  - - [1216, 2688, 1, 64, 1216, 1216, 64, 64]
    - [3, 17999.3]
  - - [1280, 2688, 1, 64, 1280, 1280, 64, 64]
    - [3, 18437.4]
  - - [1344, 2688, 1, 64, 1344, 1344, 64, 64]
    - [3, 18780.5]
  - - [1408, 2688, 1, 64, 1408, 1408, 64, 64]
    - [3, 19019.9]
  - - [1472, 2688, 1, 64, 1472, 1472, 64, 64]
    - [3, 19373.3]
  - - [1536, 2688, 1, 64, 1536, 1536, 64, 64]
    - [6, 18825.7]
  - - [1600, 2688, 1, 64, 1600, 1600, 64, 64]
    - [3, 20126.3]
  - - [1664, 2688, 1, 64, 1664, 1664, 64, 64]
    - [3, 20603.0]
  - - [1728, 2688, 1, 64, 1728, 1728, 64, 64]
    - [3, 20941.7]
  - - [1792, 2688, 1, 64, 1792, 1792, 64, 64]
    - [3, 21122.1]
  - - [1856, 2688, 1, 64, 1856, 1856, 64, 64]
    - [3, 21404.2]
  - - [1920, 2688, 1, 64, 1920, 1920, 64, 64]
    - [3, 21492.6]
  - - [1984, 2688, 1, 64, 1984, 1984, 64, 64]
    - [3, 22211.9]
  - - [2048, 2688, 1, 64, 2048, 2048, 64, 64]
    - [3, 20570.9]
  - - [2112, 2688, 1, 64, 2112, 2112, 64, 64]
    - [3, 22413.7]
  - - [2176, 2688, 1, 64, 2176, 2176, 64, 64]
    - [3, 22786.5]
  - - [2240, 2688, 1, 64, 2240, 2240, 64, 64]
    - [3, 22966.1]
  - - [2304, 2688, 1, 64, 2304, 2304, 64, 64]
    - [3, 22973.2]
  - - [2368, 2688, 1, 64, 2368, 2368, 64, 64]
    - [3, 23547.2]
  - - [2432, 2688, 1, 64, 2432, 2432, 64, 64]
    - [3, 23821.5]
  - - [2496, 2688, 1, 64, 2496, 2496, 64, 64]
    - [3, 24319.6]
  - - [2560, 2688, 1, 64, 2560, 2560, 64, 64]
    - [1, 22808.0]
  - - [2624, 2688, 1, 64, 2624, 2624, 64, 64]
    - [3, 24176.8]
  - - [2688, 2688, 1, 64, 2688, 2688, 64, 64]
    - [3, 24289.1]
  - - [2752, 2688, 1, 64, 2752, 2752, 64, 64]
    - [3, 24706.5]
  - - [2816, 2688, 1, 64, 2816, 2816, 64, 64]
    - [3, 25139.4]
  - - [2880, 2688, 1, 64, 2880, 2880, 64, 64]
    - [3, 25231.5]
  - - [2944, 2688, 1, 64, 2944, 2944, 64, 64]
    - [3, 25424.5]
  - - [3008, 2688, 1, 64, 3008, 3008, 64, 64]
    - [3, 25086.8]
  - - [3072, 2688, 1, 64, 3072, 3072, 64, 64]
    - [3, 22122.1]
  - - [3136, 2688, 1, 64, 3136, 3136, 64, 64]
    - [3, 25541.4]
  - - [3200, 2688, 1, 64, 3200, 3200, 64, 64]
    - [3, 26019.6]
  - - [3264, 2688, 1, 64, 3264, 3264, 64, 64]
    - [3, 26007.7]
  - - [3328, 2688, 1, 64, 3328, 3328, 64, 64]
    - [3, 26424.6]
  - - [3392, 2688, 1, 64, 3392, 3392, 64, 64]
    - [3, 26810.3]
  - - [3456, 2688, 1, 64, 3456, 3456, 64, 64]
    - [3, 26788.1]
  - - [3520, 2688, 1, 64, 3520, 3520, 64, 64]
    - [3, 27322.3]
  - - [3584, 2688, 1, 64, 3584, 3584, 64, 64]
    - [3, 25488.0]
  - - [3648, 2688, 1, 64, 3648, 3648, 64, 64]
    - [3, 25392.0]
  - - [3712, 2688, 1, 64, 3712, 3712, 64, 64]
    - [3, 26454.1]
  - - [3776, 2688, 1, 64, 3776, 3776, 64, 64]
    - [3, 25855.1]
  - - [3840, 2688, 1, 64, 3840, 3840, 64, 64]
    - [3, 26833.8]
  - - [3904, 2688, 1, 64, 3904, 3904, 64, 64]
    - [3, 26646.8]
  - - [3968, 2688, 1, 64, 3968, 3968, 64, 64]
    - [3, 26945.6]
  - - [4032, 2688, 1, 64, 4032, 4032, 64, 64]
    - [3, 26303.5]
  - - [4096, 2688, 1, 64, 4096, 4096, 64, 64]
    - [3, 24681.6]
  - - [64, 2752, 1, 64, 64, 64, 64, 64]
    - [0, 2211.96]
  - - [128, 2752, 1, 64, 128, 128, 64, 64]
    - [6, 4179.47]
  - - [192, 2752, 1, 64, 192, 192, 64, 64]
    - [4, 5929.59]
  - - [256, 2752, 1, 64, 256, 256, 64, 64]
    - [0, 7320.7]
  - - [320, 2752, 1, 64, 320, 320, 64, 64]
    - [4, 8665.52]
  - - [384, 2752, 1, 64, 384, 384, 64, 64]
    - [4, 9817.41]
  - - [448, 2752, 1, 64, 448, 448, 64, 64]
    - [4, 10860.9]
  - - [512, 2752, 1, 64, 512, 512, 64, 64]
    - [4, 11631.1]
  - - [576, 2752, 1, 64, 576, 576, 64, 64]
    - [4, 12582.0]
  - - [640, 2752, 1, 64, 640, 640, 64, 64]
    - [4, 13286.3]
  - - [704, 2752, 1, 64, 704, 704, 64, 64]
    - [4, 13849.3]
  - - [768, 2752, 1, 64, 768, 768, 64, 64]
    - [4, 14434.4]
  - - [832, 2752, 1, 64, 832, 832, 64, 64]
    - [4, 15237.2]
  - - [896, 2752, 1, 64, 896, 896, 64, 64]
    - [4, 15716.4]
  - - [960, 2752, 1, 64, 960, 960, 64, 64]
    - [4, 16214.1]
  - - [1024, 2752, 1, 64, 1024, 1024, 64, 64]
    - [4, 16306.8]
  - - [1088, 2752, 1, 64, 1088, 1088, 64, 64]
    - [3, 17155.3]
  - - [1152, 2752, 1, 64, 1152, 1152, 64, 64]
    - [4, 17550.1]
  - - [1216, 2752, 1, 64, 1216, 1216, 64, 64]
    - [3, 18165.3]
  - - [1280, 2752, 1, 64, 1280, 1280, 64, 64]
    - [3, 18576.2]
  - - [1344, 2752, 1, 64, 1344, 1344, 64, 64]
    - [3, 19100.5]
  - - [1408, 2752, 1, 64, 1408, 1408, 64, 64]
    - [3, 19249.0]
  - - [1472, 2752, 1, 64, 1472, 1472, 64, 64]
    - [3, 19588.9]
  - - [1536, 2752, 1, 64, 1536, 1536, 64, 64]
    - [6, 18701.0]
  - - [1600, 2752, 1, 64, 1600, 1600, 64, 64]
    - [3, 20340.7]
  - - [1664, 2752, 1, 64, 1664, 1664, 64, 64]
    - [3, 20794.2]
  - - [1728, 2752, 1, 64, 1728, 1728, 64, 64]
    - [3, 21105.8]
  - - [1792, 2752, 1, 64, 1792, 1792, 64, 64]
    - [3, 21279.5]
  - - [1856, 2752, 1, 64, 1856, 1856, 64, 64]
    - [3, 21352.8]
  - - [1920, 2752, 1, 64, 1920, 1920, 64, 64]
    - [3, 21624.4]
  - - [1984, 2752, 1, 64, 1984, 1984, 64, 64]
    - [3, 22086.7]
  - - [2048, 2752, 1, 64, 2048, 2048, 64, 64]
    - [3, 20692.1]
  - - [2112, 2752, 1, 64, 2112, 2112, 64, 64]
    - [3, 22420.4]
  - - [2176, 2752, 1, 64, 2176, 2176, 64, 64]
    - [3, 22935.4]
  - - [2240, 2752, 1, 64, 2240, 2240, 64, 64]
    - [3, 22924.0]
  - - [2304, 2752, 1, 64, 2304, 2304, 64, 64]
    - [3, 23274.7]
  - - [2368, 2752, 1, 64, 2368, 2368, 64, 64]
    - [3, 23995.5]
  - - [2432, 2752, 1, 64, 2432, 2432, 64, 64]
    - [3, 23975.1]
  - - [2496, 2752, 1, 64, 2496, 2496, 64, 64]
    - [3, 24283.8]
  - - [2560, 2752, 1, 64, 2560, 2560, 64, 64]
    - [1, 22896.7]
  - - [2624, 2752, 1, 64, 2624, 2624, 64, 64]
    - [3, 25286.2]
  - - [2688, 2752, 1, 64, 2688, 2688, 64, 64]
    - [3, 24707.8]
  - - [2752, 2752, 1, 64, 2752, 2752, 64, 64]
    - [3, 24461.2]
  - - [2816, 2752, 1, 64, 2816, 2816, 64, 64]
    - [3, 24171.2]
  - - [2880, 2752, 1, 64, 2880, 2880, 64, 64]
    - [3, 25453.7]
  - - [2944, 2752, 1, 64, 2944, 2944, 64, 64]
    - [3, 25819.8]
  - - [3008, 2752, 1, 64, 3008, 3008, 64, 64]
    - [3, 25598.5]
  - - [3072, 2752, 1, 64, 3072, 3072, 64, 64]
    - [1, 22939.8]
  - - [3136, 2752, 1, 64, 3136, 3136, 64, 64]
    - [3, 25184.9]
  - - [3200, 2752, 1, 64, 3200, 3200, 64, 64]
    - [3, 26868.9]
  - - [3264, 2752, 1, 64, 3264, 3264, 64, 64]
    - [3, 26181.8]
  - - [3328, 2752, 1, 64, 3328, 3328, 64, 64]
    - [3, 25123.1]
  - - [3392, 2752, 1, 64, 3392, 3392, 64, 64]
    - [3, 25925.1]
  - - [3456, 2752, 1, 64, 3456, 3456, 64, 64]
    - [3, 26951.1]
  - - [3520, 2752, 1, 64, 3520, 3520, 64, 64]
    - [3, 26255.2]
  - - [3584, 2752, 1, 64, 3584, 3584, 64, 64]
    - [3, 25400.8]
  - - [3648, 2752, 1, 64, 3648, 3648, 64, 64]
    - [0, 25386.5]
  - - [3712, 2752, 1, 64, 3712, 3712, 64, 64]
    - [3, 25846.2]
  - - [3776, 2752, 1, 64, 3776, 3776, 64, 64]
    - [3, 25167.5]
  - - [3840, 2752, 1, 64, 3840, 3840, 64, 64]
    - [3, 26331.5]
  - - [3904, 2752, 1, 64, 3904, 3904, 64, 64]
    - [3, 26166.2]
  - - [3968, 2752, 1, 64, 3968, 3968, 64, 64]
    - [1, 25347.9]
  - - [4032, 2752, 1, 64, 4032, 4032, 64, 64]
    - [3, 27415.4]
  - - [4096, 2752, 1, 64, 4096, 4096, 64, 64]
    - [3, 25645.6]
  - - [64, 2816, 1, 64, 64, 64, 64, 64]
    - [16, 2228.39]
  - - [128, 2816, 1, 64, 128, 128, 64, 64]
    - [7, 4198.08]
  - - [192, 2816, 1, 64, 192, 192, 64, 64]
    - [4, 6040.95]
  - - [256, 2816, 1, 64, 256, 256, 64, 64]
    - [1, 7484.88]
  - - [320, 2816, 1, 64, 320, 320, 64, 64]
    - [4, 8730.06]
  - - [384, 2816, 1, 64, 384, 384, 64, 64]
    - [4, 9916.15]
  - - [448, 2816, 1, 64, 448, 448, 64, 64]
    - [4, 10970.0]
  - - [512, 2816, 1, 64, 512, 512, 64, 64]
    - [4, 11823.9]
  - - [576, 2816, 1, 64, 576, 576, 64, 64]
    - [4, 12749.7]
  - - [640, 2816, 1, 64, 640, 640, 64, 64]
    - [4, 13518.8]
  - - [704, 2816, 1, 64, 704, 704, 64, 64]
    - [4, 14031.8]
  - - [768, 2816, 1, 64, 768, 768, 64, 64]
    - [4, 14561.9]
  - - [832, 2816, 1, 64, 832, 832, 64, 64]
    - [4, 15378.9]
  - - [896, 2816, 1, 64, 896, 896, 64, 64]
    - [3, 15848.3]
  - - [960, 2816, 1, 64, 960, 960, 64, 64]
    - [4, 16417.9]
  - - [1024, 2816, 1, 64, 1024, 1024, 64, 64]
    - [4, 16465.6]
  - - [1088, 2816, 1, 64, 1088, 1088, 64, 64]
    - [4, 17349.2]
  - - [1152, 2816, 1, 64, 1152, 1152, 64, 64]
    - [4, 17760.0]
  - - [1216, 2816, 1, 64, 1216, 1216, 64, 64]
    - [3, 18447.0]
  - - [1280, 2816, 1, 64, 1280, 1280, 64, 64]
    - [3, 18843.6]
  - - [1344, 2816, 1, 64, 1344, 1344, 64, 64]
    - [3, 19304.9]
  - - [1408, 2816, 1, 64, 1408, 1408, 64, 64]
    - [3, 19453.6]
  - - [1472, 2816, 1, 64, 1472, 1472, 64, 64]
    - [3, 19859.7]
  - - [1536, 2816, 1, 64, 1536, 1536, 64, 64]
    - [6, 19149.2]
  - - [1600, 2816, 1, 64, 1600, 1600, 64, 64]
    - [3, 20526.4]
  - - [1664, 2816, 1, 64, 1664, 1664, 64, 64]
    - [3, 21030.1]
  - - [1728, 2816, 1, 64, 1728, 1728, 64, 64]
    - [3, 21331.8]
  - - [1792, 2816, 1, 64, 1792, 1792, 64, 64]
    - [3, 21278.1]
  - - [1856, 2816, 1, 64, 1856, 1856, 64, 64]
    - [3, 21616.3]
  - - [1920, 2816, 1, 64, 1920, 1920, 64, 64]
    - [3, 22259.6]
  - - [1984, 2816, 1, 64, 1984, 1984, 64, 64]
    - [3, 22316.8]
  - - [2048, 2816, 1, 64, 2048, 2048, 64, 64]
    - [3, 20866.9]
  - - [2112, 2816, 1, 64, 2112, 2112, 64, 64]
    - [3, 22934.9]
  - - [2176, 2816, 1, 64, 2176, 2176, 64, 64]
    - [3, 23383.4]
  - - [2240, 2816, 1, 64, 2240, 2240, 64, 64]
    - [3, 22992.1]
  - - [2304, 2816, 1, 64, 2304, 2304, 64, 64]
    - [3, 23384.1]
  - - [2368, 2816, 1, 64, 2368, 2368, 64, 64]
    - [3, 23583.4]
  - - [2432, 2816, 1, 64, 2432, 2432, 64, 64]
    - [3, 23842.7]
  - - [2496, 2816, 1, 64, 2496, 2496, 64, 64]
    - [3, 23995.0]
  - - [2560, 2816, 1, 64, 2560, 2560, 64, 64]
    - [3, 23530.8]
  - - [2624, 2816, 1, 64, 2624, 2624, 64, 64]
    - [3, 24381.4]
  - - [2688, 2816, 1, 64, 2688, 2688, 64, 64]
    - [3, 25304.8]
  - - [2752, 2816, 1, 64, 2752, 2752, 64, 64]
    - [3, 25300.7]
  - - [2816, 2816, 1, 64, 2816, 2816, 64, 64]
    - [3, 25181.3]
  - - [2880, 2816, 1, 64, 2880, 2880, 64, 64]
    - [3, 25071.9]
  - - [2944, 2816, 1, 64, 2944, 2944, 64, 64]
    - [3, 25427.6]
  - - [3008, 2816, 1, 64, 3008, 3008, 64, 64]
    - [3, 26216.6]
  - - [3072, 2816, 1, 64, 3072, 3072, 64, 64]
    - [1, 23736.9]
  - - [3136, 2816, 1, 64, 3136, 3136, 64, 64]
    - [3, 26363.3]
  - - [3200, 2816, 1, 64, 3200, 3200, 64, 64]
    - [3, 26242.8]
  - - [3264, 2816, 1, 64, 3264, 3264, 64, 64]
    - [3, 26258.5]
  - - [3328, 2816, 1, 64, 3328, 3328, 64, 64]
    - [3, 26350.0]
  - - [3392, 2816, 1, 64, 3392, 3392, 64, 64]
    - [3, 27075.5]
  - - [3456, 2816, 1, 64, 3456, 3456, 64, 64]
    - [3, 26559.5]
  - - [3520, 2816, 1, 64, 3520, 3520, 64, 64]
    - [3, 26428.2]
  - - [3584, 2816, 1, 64, 3584, 3584, 64, 64]
    - [3, 26097.6]
  - - [3648, 2816, 1, 64, 3648, 3648, 64, 64]
    - [3, 26673.5]
  - - [3712, 2816, 1, 64, 3712, 3712, 64, 64]
    - [3, 26220.3]
  - - [3776, 2816, 1, 64, 3776, 3776, 64, 64]
    - [3, 26508.1]
  - - [3840, 2816, 1, 64, 3840, 3840, 64, 64]
    - [3, 25294.3]
  - - [3904, 2816, 1, 64, 3904, 3904, 64, 64]
    - [3, 26848.3]
  - - [3968, 2816, 1, 64, 3968, 3968, 64, 64]
    - [3, 27130.0]
  - - [4032, 2816, 1, 64, 4032, 4032, 64, 64]
    - [3, 27169.8]
  - - [4096, 2816, 1, 64, 4096, 4096, 64, 64]
    - [3, 25446.0]
  - - [64, 2880, 1, 64, 64, 64, 64, 64]
    - [18, 2415.79]
  - - [128, 2880, 1, 64, 128, 128, 64, 64]
    - [6, 4280.23]
  - - [192, 2880, 1, 64, 192, 192, 64, 64]
    - [4, 5918.88]
  - - [256, 2880, 1, 64, 256, 256, 64, 64]
    - [4, 7561.76]
  - - [320, 2880, 1, 64, 320, 320, 64, 64]
    - [7, 8795.37]
  - - [384, 2880, 1, 64, 384, 384, 64, 64]
    - [4, 10045.1]
  - - [448, 2880, 1, 64, 448, 448, 64, 64]
    - [4, 11187.4]
  - - [512, 2880, 1, 64, 512, 512, 64, 64]
    - [4, 12003.4]
  - - [576, 2880, 1, 64, 576, 576, 64, 64]
    - [4, 12937.8]
  - - [640, 2880, 1, 64, 640, 640, 64, 64]
    - [4, 13640.5]
  - - [704, 2880, 1, 64, 704, 704, 64, 64]
    - [4, 14224.9]
  - - [768, 2880, 1, 64, 768, 768, 64, 64]
    - [4, 14750.0]
  - - [832, 2880, 1, 64, 832, 832, 64, 64]
    - [4, 15532.5]
  - - [896, 2880, 1, 64, 896, 896, 64, 64]
    - [3, 16072.8]
  - - [960, 2880, 1, 64, 960, 960, 64, 64]
    - [4, 16567.9]
  - - [1024, 2880, 1, 64, 1024, 1024, 64, 64]
    - [4, 16750.2]
  - - [1088, 2880, 1, 64, 1088, 1088, 64, 64]
    - [3, 17477.6]
  - - [1152, 2880, 1, 64, 1152, 1152, 64, 64]
    - [4, 17868.8]
  - - [1216, 2880, 1, 64, 1216, 1216, 64, 64]
    - [3, 18514.0]
  - - [1280, 2880, 1, 64, 1280, 1280, 64, 64]
    - [3, 19057.1]
  - - [1344, 2880, 1, 64, 1344, 1344, 64, 64]
    - [3, 19629.4]
  - - [1408, 2880, 1, 64, 1408, 1408, 64, 64]
    - [3, 19629.3]
  - - [1472, 2880, 1, 64, 1472, 1472, 64, 64]
    - [3, 20011.5]
  - - [1536, 2880, 1, 64, 1536, 1536, 64, 64]
    - [6, 19227.9]
  - - [1600, 2880, 1, 64, 1600, 1600, 64, 64]
    - [3, 20637.4]
  - - [1664, 2880, 1, 64, 1664, 1664, 64, 64]
    - [3, 21085.2]
  - - [1728, 2880, 1, 64, 1728, 1728, 64, 64]
    - [3, 21314.4]
  - - [1792, 2880, 1, 64, 1792, 1792, 64, 64]
    - [3, 21514.9]
  - - [1856, 2880, 1, 64, 1856, 1856, 64, 64]
    - [3, 21647.3]
  - - [1920, 2880, 1, 64, 1920, 1920, 64, 64]
    - [3, 21931.7]
  - - [1984, 2880, 1, 64, 1984, 1984, 64, 64]
    - [3, 22306.1]
  - - [2048, 2880, 1, 64, 2048, 2048, 64, 64]
    - [1, 20945.7]
  - - [2112, 2880, 1, 64, 2112, 2112, 64, 64]
    - [3, 22788.8]
  - - [2176, 2880, 1, 64, 2176, 2176, 64, 64]
    - [3, 23346.8]
  - - [2240, 2880, 1, 64, 2240, 2240, 64, 64]
    - [3, 23332.6]
  - - [2304, 2880, 1, 64, 2304, 2304, 64, 64]
    - [3, 23365.5]
  - - [2368, 2880, 1, 64, 2368, 2368, 64, 64]
    - [3, 23660.5]
  - - [2432, 2880, 1, 64, 2432, 2432, 64, 64]
    - [3, 24235.6]
  - - [2496, 2880, 1, 64, 2496, 2496, 64, 64]
    - [3, 23689.8]
  - - [2560, 2880, 1, 64, 2560, 2560, 64, 64]
    - [3, 23151.6]
  - - [2624, 2880, 1, 64, 2624, 2624, 64, 64]
    - [3, 25128.5]
  - - [2688, 2880, 1, 64, 2688, 2688, 64, 64]
    - [3, 25012.4]
  - - [2752, 2880, 1, 64, 2752, 2752, 64, 64]
    - [3, 24253.8]
  - - [2816, 2880, 1, 64, 2816, 2816, 64, 64]
    - [3, 25681.0]
  - - [2880, 2880, 1, 64, 2880, 2880, 64, 64]
    - [3, 24889.0]
  - - [2944, 2880, 1, 64, 2944, 2944, 64, 64]
    - [3, 25187.1]
  - - [3008, 2880, 1, 64, 3008, 3008, 64, 64]
    - [3, 24898.0]
  - - [3072, 2880, 1, 64, 3072, 3072, 64, 64]
    - [1, 24131.6]
  - - [3136, 2880, 1, 64, 3136, 3136, 64, 64]
    - [3, 26051.0]
  - - [3200, 2880, 1, 64, 3200, 3200, 64, 64]
    - [3, 26735.7]
  - - [3264, 2880, 1, 64, 3264, 3264, 64, 64]
    - [3, 26271.3]
  - - [3328, 2880, 1, 64, 3328, 3328, 64, 64]
    - [3, 26170.5]
  - - [3392, 2880, 1, 64, 3392, 3392, 64, 64]
    - [3, 25839.2]
  - - [3456, 2880, 1, 64, 3456, 3456, 64, 64]
    - [1, 26025.6]
  - - [3520, 2880, 1, 64, 3520, 3520, 64, 64]
    - [1, 26100.2]
  - - [3584, 2880, 1, 64, 3584, 3584, 64, 64]
    - [1, 25851.9]
  - - [3648, 2880, 1, 64, 3648, 3648, 64, 64]
    - [3, 26596.7]
  - - [3712, 2880, 1, 64, 3712, 3712, 64, 64]
    - [3, 26182.0]
  - - [3776, 2880, 1, 64, 3776, 3776, 64, 64]
    - [3, 25141.2]
  - - [3840, 2880, 1, 64, 3840, 3840, 64, 64]
    - [3, 26232.5]
  - - [3904, 2880, 1, 64, 3904, 3904, 64, 64]
    - [3, 27614.4]
  - - [3968, 2880, 1, 64, 3968, 3968, 64, 64]
    - [3, 25746.2]
  - - [4032, 2880, 1, 64, 4032, 4032, 64, 64]
    - [0, 26215.0]
  - - [4096, 2880, 1, 64, 4096, 4096, 64, 64]
    - [1, 24778.1]
  - - [64, 2944, 1, 64, 64, 64, 64, 64]
    - [9, 2350.55]
  - - [128, 2944, 1, 64, 128, 128, 64, 64]
    - [12, 4467.77]
  - - [192, 2944, 1, 64, 192, 192, 64, 64]
    - [4, 6242.52]
  - - [256, 2944, 1, 64, 256, 256, 64, 64]
    - [4, 7709.99]
  - - [320, 2944, 1, 64, 320, 320, 64, 64]
    - [4, 8989.45]
  - - [384, 2944, 1, 64, 384, 384, 64, 64]
    - [4, 10217.6]
  - - [448, 2944, 1, 64, 448, 448, 64, 64]
    - [4, 11316.4]
  - - [512, 2944, 1, 64, 512, 512, 64, 64]
    - [4, 12183.4]
  - - [576, 2944, 1, 64, 576, 576, 64, 64]
    - [4, 13059.7]
  - - [640, 2944, 1, 64, 640, 640, 64, 64]
    - [4, 13844.4]
  - - [704, 2944, 1, 64, 704, 704, 64, 64]
    - [4, 14363.1]
  - - [768, 2944, 1, 64, 768, 768, 64, 64]
    - [4, 14888.5]
  - - [832, 2944, 1, 64, 832, 832, 64, 64]
    - [4, 15676.0]
  - - [896, 2944, 1, 64, 896, 896, 64, 64]
    - [4, 16196.8]
  - - [960, 2944, 1, 64, 960, 960, 64, 64]
    - [4, 16729.4]
  - - [1024, 2944, 1, 64, 1024, 1024, 64, 64]
    - [4, 16785.8]
  - - [1088, 2944, 1, 64, 1088, 1088, 64, 64]
    - [4, 17635.4]
  - - [1152, 2944, 1, 64, 1152, 1152, 64, 64]
    - [3, 18062.1]
  - - [1216, 2944, 1, 64, 1216, 1216, 64, 64]
    - [4, 18778.0]
  - - [1280, 2944, 1, 64, 1280, 1280, 64, 64]
    - [3, 19288.9]
  - - [1344, 2944, 1, 64, 1344, 1344, 64, 64]
    - [3, 19633.1]
  - - [1408, 2944, 1, 64, 1408, 1408, 64, 64]
    - [3, 19794.5]
  - - [1472, 2944, 1, 64, 1472, 1472, 64, 64]
    - [3, 20040.8]
  - - [1536, 2944, 1, 64, 1536, 1536, 64, 64]
    - [6, 19162.0]
  - - [1600, 2944, 1, 64, 1600, 1600, 64, 64]
    - [3, 20706.2]
  - - [1664, 2944, 1, 64, 1664, 1664, 64, 64]
    - [3, 21198.1]
  - - [1728, 2944, 1, 64, 1728, 1728, 64, 64]
    - [3, 21385.9]
  - - [1792, 2944, 1, 64, 1792, 1792, 64, 64]
    - [3, 21687.9]
  - - [1856, 2944, 1, 64, 1856, 1856, 64, 64]
    - [3, 21758.0]
  - - [1920, 2944, 1, 64, 1920, 1920, 64, 64]
    - [3, 22024.5]
  - - [1984, 2944, 1, 64, 1984, 1984, 64, 64]
    - [3, 22622.5]
  - - [2048, 2944, 1, 64, 2048, 2048, 64, 64]
    - [3, 21013.5]
  - - [2112, 2944, 1, 64, 2112, 2112, 64, 64]
    - [3, 23140.8]
  - - [2176, 2944, 1, 64, 2176, 2176, 64, 64]
    - [3, 23347.8]
  - - [2240, 2944, 1, 64, 2240, 2240, 64, 64]
    - [3, 23228.9]
  - - [2304, 2944, 1, 64, 2304, 2304, 64, 64]
    - [3, 23628.6]
  - - [2368, 2944, 1, 64, 2368, 2368, 64, 64]
    - [3, 23495.9]
  - - [2432, 2944, 1, 64, 2432, 2432, 64, 64]
    - [3, 23391.8]
  - - [2496, 2944, 1, 64, 2496, 2496, 64, 64]
    - [3, 24663.3]
  - - [2560, 2944, 1, 64, 2560, 2560, 64, 64]
    - [1, 23305.9]
  - - [2624, 2944, 1, 64, 2624, 2624, 64, 64]
    - [3, 24755.8]
  - - [2688, 2944, 1, 64, 2688, 2688, 64, 64]
    - [3, 25046.1]
  - - [2752, 2944, 1, 64, 2752, 2752, 64, 64]
    - [3, 25556.4]
  - - [2816, 2944, 1, 64, 2816, 2816, 64, 64]
    - [3, 25823.6]
  - - [2880, 2944, 1, 64, 2880, 2880, 64, 64]
    - [3, 24940.5]
  - - [2944, 2944, 1, 64, 2944, 2944, 64, 64]
    - [3, 25940.6]
  - - [3008, 2944, 1, 64, 3008, 3008, 64, 64]
    - [3, 26307.8]
  - - [3072, 2944, 1, 64, 3072, 3072, 64, 64]
    - [1, 22867.8]
  - - [3136, 2944, 1, 64, 3136, 3136, 64, 64]
    - [3, 24992.2]
  - - [3200, 2944, 1, 64, 3200, 3200, 64, 64]
    - [3, 25646.5]
  - - [3264, 2944, 1, 64, 3264, 3264, 64, 64]
    - [3, 26862.1]
  - - [3328, 2944, 1, 64, 3328, 3328, 64, 64]
    - [3, 26949.9]
  - - [3392, 2944, 1, 64, 3392, 3392, 64, 64]
    - [3, 27770.0]
  - - [3456, 2944, 1, 64, 3456, 3456, 64, 64]
    - [3, 27666.5]
  - - [3520, 2944, 1, 64, 3520, 3520, 64, 64]
    - [3, 26016.6]
  - - [3584, 2944, 1, 64, 3584, 3584, 64, 64]
    - [3, 25416.8]
  - - [3648, 2944, 1, 64, 3648, 3648, 64, 64]
    - [3, 25568.5]
  - - [3712, 2944, 1, 64, 3712, 3712, 64, 64]
    - [0, 25803.1]
  - - [3776, 2944, 1, 64, 3776, 3776, 64, 64]
    - [3, 26333.4]
  - - [3840, 2944, 1, 64, 3840, 3840, 64, 64]
    - [3, 25386.2]
  - - [3904, 2944, 1, 64, 3904, 3904, 64, 64]
    - [3, 26621.0]
  - - [3968, 2944, 1, 64, 3968, 3968, 64, 64]
    - [1, 26075.1]
  - - [4032, 2944, 1, 64, 4032, 4032, 64, 64]
    - [3, 27524.7]
  - - [4096, 2944, 1, 64, 4096, 4096, 64, 64]
    - [1, 24628.0]
  - - [64, 3008, 1, 64, 64, 64, 64, 64]
    - [5, 2580.81]
  - - [128, 3008, 1, 64, 128, 128, 64, 64]
    - [6, 4607.57]
  - - [192, 3008, 1, 64, 192, 192, 64, 64]
    - [7, 6143.95]
  - - [256, 3008, 1, 64, 256, 256, 64, 64]
    - [1, 7803.97]
  - - [320, 3008, 1, 64, 320, 320, 64, 64]
    - [4, 9224.79]
  - - [384, 3008, 1, 64, 384, 384, 64, 64]
    - [4, 10392.8]
  - - [448, 3008, 1, 64, 448, 448, 64, 64]
    - [4, 11480.9]
  - - [512, 3008, 1, 64, 512, 512, 64, 64]
    - [4, 12276.1]
  - - [576, 3008, 1, 64, 576, 576, 64, 64]
    - [4, 13264.0]
  - - [640, 3008, 1, 64, 640, 640, 64, 64]
    - [4, 13962.6]
  - - [704, 3008, 1, 64, 704, 704, 64, 64]
    - [4, 14465.5]
  - - [768, 3008, 1, 64, 768, 768, 64, 64]
    - [4, 15052.6]
  - - [832, 3008, 1, 64, 832, 832, 64, 64]
    - [4, 15880.2]
  - - [896, 3008, 1, 64, 896, 896, 64, 64]
    - [4, 16335.7]
  - - [960, 3008, 1, 64, 960, 960, 64, 64]
    - [4, 16885.3]
  - - [1024, 3008, 1, 64, 1024, 1024, 64, 64]
    - [4, 16982.2]
  - - [1088, 3008, 1, 64, 1088, 1088, 64, 64]
    - [4, 18118.5]
  - - [1152, 3008, 1, 64, 1152, 1152, 64, 64]
    - [4, 18222.8]
  - - [1216, 3008, 1, 64, 1216, 1216, 64, 64]
    - [3, 18884.4]
  - - [1280, 3008, 1, 64, 1280, 1280, 64, 64]
    - [3, 19393.4]
  - - [1344, 3008, 1, 64, 1344, 1344, 64, 64]
    - [3, 19820.3]
  - - [1408, 3008, 1, 64, 1408, 1408, 64, 64]
    - [3, 19799.4]
  - - [1472, 3008, 1, 64, 1472, 1472, 64, 64]
    - [3, 20202.0]
  - - [1536, 3008, 1, 64, 1536, 1536, 64, 64]
    - [6, 19660.6]
  - - [1600, 3008, 1, 64, 1600, 1600, 64, 64]
    - [3, 20942.0]
  - - [1664, 3008, 1, 64, 1664, 1664, 64, 64]
    - [3, 21334.4]
  - - [1728, 3008, 1, 64, 1728, 1728, 64, 64]
    - [3, 21613.7]
  - - [1792, 3008, 1, 64, 1792, 1792, 64, 64]
    - [3, 21767.9]
  - - [1856, 3008, 1, 64, 1856, 1856, 64, 64]
    - [3, 22002.4]
  - - [1920, 3008, 1, 64, 1920, 1920, 64, 64]
    - [3, 22341.5]
  - - [1984, 3008, 1, 64, 1984, 1984, 64, 64]
    - [3, 22550.7]
  - - [2048, 3008, 1, 64, 2048, 2048, 64, 64]
    - [3, 21351.7]
  - - [2112, 3008, 1, 64, 2112, 2112, 64, 64]
    - [3, 23266.4]
  - - [2176, 3008, 1, 64, 2176, 2176, 64, 64]
    - [3, 23406.2]
  - - [2240, 3008, 1, 64, 2240, 2240, 64, 64]
    - [3, 23588.4]
  - - [2304, 3008, 1, 64, 2304, 2304, 64, 64]
    - [3, 23621.5]
  - - [2368, 3008, 1, 64, 2368, 2368, 64, 64]
    - [3, 23831.0]
  - - [2432, 3008, 1, 64, 2432, 2432, 64, 64]
    - [3, 24312.4]
  - - [2496, 3008, 1, 64, 2496, 2496, 64, 64]
    - [3, 24956.1]
  - - [2560, 3008, 1, 64, 2560, 2560, 64, 64]
    - [1, 23724.3]
  - - [2624, 3008, 1, 64, 2624, 2624, 64, 64]
    - [3, 25370.1]
  - - [2688, 3008, 1, 64, 2688, 2688, 64, 64]
    - [3, 25362.2]
  - - [2752, 3008, 1, 64, 2752, 2752, 64, 64]
    - [3, 25354.7]
  - - [2816, 3008, 1, 64, 2816, 2816, 64, 64]
    - [3, 25412.8]
  - - [2880, 3008, 1, 64, 2880, 2880, 64, 64]
    - [3, 25686.9]
  - - [2944, 3008, 1, 64, 2944, 2944, 64, 64]
    - [3, 26400.9]
  - - [3008, 3008, 1, 64, 3008, 3008, 64, 64]
    - [3, 26276.0]
  - - [3072, 3008, 1, 64, 3072, 3072, 64, 64]
    - [3, 23326.2]
  - - [3136, 3008, 1, 64, 3136, 3136, 64, 64]
    - [3, 25098.2]
  - - [3200, 3008, 1, 64, 3200, 3200, 64, 64]
    - [3, 27095.0]
  - - [3264, 3008, 1, 64, 3264, 3264, 64, 64]
    - [3, 27690.4]
  - - [3328, 3008, 1, 64, 3328, 3328, 64, 64]
    - [3, 26279.7]
  - - [3392, 3008, 1, 64, 3392, 3392, 64, 64]
    - [3, 27859.2]
  - - [3456, 3008, 1, 64, 3456, 3456, 64, 64]
    - [3, 26659.5]
  - - [3520, 3008, 1, 64, 3520, 3520, 64, 64]
    - [3, 26234.4]
  - - [3584, 3008, 1, 64, 3584, 3584, 64, 64]
    - [3, 25469.9]
  - - [3648, 3008, 1, 64, 3648, 3648, 64, 64]
    - [3, 26044.9]
  - - [3712, 3008, 1, 64, 3712, 3712, 64, 64]
    - [3, 27795.6]
  - - [3776, 3008, 1, 64, 3776, 3776, 64, 64]
    - [3, 25664.3]
  - - [3840, 3008, 1, 64, 3840, 3840, 64, 64]
    - [3, 26196.4]
  - - [3904, 3008, 1, 64, 3904, 3904, 64, 64]
    - [3, 27377.1]
  - - [3968, 3008, 1, 64, 3968, 3968, 64, 64]
    - [3, 26020.3]
  - - [4032, 3008, 1, 64, 4032, 4032, 64, 64]
    - [3, 26459.8]
  - - [4096, 3008, 1, 64, 4096, 4096, 64, 64]
    - [1, 25006.2]
  - - [64, 3072, 1, 64, 64, 64, 64, 64]
    - [17, 2444.21]
  - - [128, 3072, 1, 64, 128, 128, 64, 64]
    - [18, 4671.52]
  - - [192, 3072, 1, 64, 192, 192, 64, 64]
    - [1, 6200.46]
  - - [256, 3072, 1, 64, 256, 256, 64, 64]
    - [1, 7921.13]
  - - [320, 3072, 1, 64, 320, 320, 64, 64]
    - [4, 9313.64]
  - - [384, 3072, 1, 64, 384, 384, 64, 64]
    - [4, 10501.7]
  - - [448, 3072, 1, 64, 448, 448, 64, 64]
    - [4, 11664.6]
  - - [512, 3072, 1, 64, 512, 512, 64, 64]
    - [4, 12381.6]
  - - [576, 3072, 1, 64, 576, 576, 64, 64]
    - [4, 13433.5]
  - - [640, 3072, 1, 64, 640, 640, 64, 64]
    - [4, 14147.4]
  - - [704, 3072, 1, 64, 704, 704, 64, 64]
    - [4, 14640.3]
  - - [768, 3072, 1, 64, 768, 768, 64, 64]
    - [4, 15195.1]
  - - [832, 3072, 1, 64, 832, 832, 64, 64]
    - [4, 15999.2]
  - - [896, 3072, 1, 64, 896, 896, 64, 64]
    - [4, 16545.3]
  - - [960, 3072, 1, 64, 960, 960, 64, 64]
    - [4, 17034.4]
  - - [1024, 3072, 1, 64, 1024, 1024, 64, 64]
    - [4, 17103.4]
  - - [1088, 3072, 1, 64, 1088, 1088, 64, 64]
    - [3, 18023.8]
  - - [1152, 3072, 1, 64, 1152, 1152, 64, 64]
    - [4, 18346.6]
  - - [1216, 3072, 1, 64, 1216, 1216, 64, 64]
    - [3, 18948.4]
  - - [1280, 3072, 1, 64, 1280, 1280, 64, 64]
    - [3, 19349.1]
  - - [1344, 3072, 1, 64, 1344, 1344, 64, 64]
    - [3, 20046.8]
  - - [1408, 3072, 1, 64, 1408, 1408, 64, 64]
    - [3, 19898.0]
  - - [1472, 3072, 1, 64, 1472, 1472, 64, 64]
    - [3, 20439.6]
  - - [1536, 3072, 1, 64, 1536, 1536, 64, 64]
    - [6, 19523.2]
  - - [1600, 3072, 1, 64, 1600, 1600, 64, 64]
    - [3, 21055.5]
  - - [1664, 3072, 1, 64, 1664, 1664, 64, 64]
    - [3, 21374.1]
  - - [1728, 3072, 1, 64, 1728, 1728, 64, 64]
    - [3, 21926.9]
  - - [1792, 3072, 1, 64, 1792, 1792, 64, 64]
    - [3, 22260.5]
  - - [1856, 3072, 1, 64, 1856, 1856, 64, 64]
    - [3, 22221.5]
  - - [1920, 3072, 1, 64, 1920, 1920, 64, 64]
    - [3, 22510.7]
  - - [1984, 3072, 1, 64, 1984, 1984, 64, 64]
    - [3, 23163.0]
  - - [2048, 3072, 1, 64, 2048, 2048, 64, 64]
    - [1, 21226.6]
  - - [2112, 3072, 1, 64, 2112, 2112, 64, 64]
    - [3, 23608.7]
  - - [2176, 3072, 1, 64, 2176, 2176, 64, 64]
    - [3, 23986.0]
  - - [2240, 3072, 1, 64, 2240, 2240, 64, 64]
    - [3, 23607.4]
  - - [2304, 3072, 1, 64, 2304, 2304, 64, 64]
    - [3, 23061.8]
  - - [2368, 3072, 1, 64, 2368, 2368, 64, 64]
    - [3, 23792.0]
  - - [2432, 3072, 1, 64, 2432, 2432, 64, 64]
    - [3, 24428.8]
  - - [2496, 3072, 1, 64, 2496, 2496, 64, 64]
    - [3, 24667.1]
  - - [2560, 3072, 1, 64, 2560, 2560, 64, 64]
    - [3, 23158.8]
  - - [2624, 3072, 1, 64, 2624, 2624, 64, 64]
    - [1, 24227.1]
  - - [2688, 3072, 1, 64, 2688, 2688, 64, 64]
    - [3, 24544.9]
  - - [2752, 3072, 1, 64, 2752, 2752, 64, 64]
    - [3, 26135.5]
  - - [2816, 3072, 1, 64, 2816, 2816, 64, 64]
    - [3, 25217.1]
  - - [2880, 3072, 1, 64, 2880, 2880, 64, 64]
    - [3, 26684.8]
  - - [2944, 3072, 1, 64, 2944, 2944, 64, 64]
    - [3, 26247.4]
  - - [3008, 3072, 1, 64, 3008, 3008, 64, 64]
    - [3, 26173.5]
  - - [3072, 3072, 1, 64, 3072, 3072, 64, 64]
    - [1, 23049.7]
  - - [3136, 3072, 1, 64, 3136, 3136, 64, 64]
    - [3, 26515.1]
  - - [3200, 3072, 1, 64, 3200, 3200, 64, 64]
    - [3, 27161.4]
  - - [3264, 3072, 1, 64, 3264, 3264, 64, 64]
    - [3, 26033.3]
  - - [3328, 3072, 1, 64, 3328, 3328, 64, 64]
    - [3, 25563.7]
  - - [3392, 3072, 1, 64, 3392, 3392, 64, 64]
    - [3, 26324.8]
  - - [3456, 3072, 1, 64, 3456, 3456, 64, 64]
    - [3, 26885.2]
  - - [3520, 3072, 1, 64, 3520, 3520, 64, 64]
    - [3, 26609.2]
  - - [3584, 3072, 1, 64, 3584, 3584, 64, 64]
    - [1, 24949.9]
  - - [3648, 3072, 1, 64, 3648, 3648, 64, 64]
    - [3, 27514.3]
  - - [3712, 3072, 1, 64, 3712, 3712, 64, 64]
    - [0, 26104.4]
  - - [3776, 3072, 1, 64, 3776, 3776, 64, 64]
    - [3, 25434.5]
  - - [3840, 3072, 1, 64, 3840, 3840, 64, 64]
    - [3, 25432.5]
  - - [3904, 3072, 1, 64, 3904, 3904, 64, 64]
    - [3, 26222.1]
  - - [3968, 3072, 1, 64, 3968, 3968, 64, 64]
    - [1, 26035.6]
  - - [4032, 3072, 1, 64, 4032, 4032, 64, 64]
    - [3, 27078.1]
  - - [4096, 3072, 1, 64, 4096, 4096, 64, 64]
    - [3, 25055.1]
  - - [64, 3136, 1, 64, 64, 64, 64, 64]
    - [3, 2491.26]
  - - [128, 3136, 1, 64, 128, 128, 64, 64]
    - [5, 4767.98]
  - - [192, 3136, 1, 64, 192, 192, 64, 64]
    - [3, 6390.55]
  - - [256, 3136, 1, 64, 256, 256, 64, 64]
    - [7, 7938.69]
  - - [320, 3136, 1, 64, 320, 320, 64, 64]
    - [4, 9469.79]
  - - [384, 3136, 1, 64, 384, 384, 64, 64]
    - [4, 10667.0]
  - - [448, 3136, 1, 64, 448, 448, 64, 64]
    - [4, 11775.0]
  - - [512, 3136, 1, 64, 512, 512, 64, 64]
    - [4, 12551.5]
  - - [576, 3136, 1, 64, 576, 576, 64, 64]
    - [4, 13527.3]
  - - [640, 3136, 1, 64, 640, 640, 64, 64]
    - [4, 14326.2]
  - - [704, 3136, 1, 64, 704, 704, 64, 64]
    - [4, 14765.8]
  - - [768, 3136, 1, 64, 768, 768, 64, 64]
    - [4, 15323.4]
  - - [832, 3136, 1, 64, 832, 832, 64, 64]
    - [4, 16108.8]
  - - [896, 3136, 1, 64, 896, 896, 64, 64]
    - [4, 16667.7]
  - - [960, 3136, 1, 64, 960, 960, 64, 64]
    - [4, 17144.8]
  - - [1024, 3136, 1, 64, 1024, 1024, 64, 64]
    - [4, 17287.9]
  - - [1088, 3136, 1, 64, 1088, 1088, 64, 64]
    - [3, 18195.4]
  - - [1152, 3136, 1, 64, 1152, 1152, 64, 64]
    - [4, 18703.2]
  - - [1216, 3136, 1, 64, 1216, 1216, 64, 64]
    - [4, 19075.6]
  - - [1280, 3136, 1, 64, 1280, 1280, 64, 64]
    - [3, 19580.6]
  - - [1344, 3136, 1, 64, 1344, 1344, 64, 64]
    - [3, 20125.6]
  - - [1408, 3136, 1, 64, 1408, 1408, 64, 64]
    - [3, 20091.5]
  - - [1472, 3136, 1, 64, 1472, 1472, 64, 64]
    - [3, 20599.1]
  - - [1536, 3136, 1, 64, 1536, 1536, 64, 64]
    - [1, 19580.6]
  - - [1600, 3136, 1, 64, 1600, 1600, 64, 64]
    - [3, 21385.3]
  - - [1664, 3136, 1, 64, 1664, 1664, 64, 64]
    - [3, 21694.6]
  - - [1728, 3136, 1, 64, 1728, 1728, 64, 64]
    - [3, 22106.9]
  - - [1792, 3136, 1, 64, 1792, 1792, 64, 64]
    - [3, 22262.9]
  - - [1856, 3136, 1, 64, 1856, 1856, 64, 64]
    - [3, 22575.8]
  - - [1920, 3136, 1, 64, 1920, 1920, 64, 64]
    - [3, 22680.8]
  - - [1984, 3136, 1, 64, 1984, 1984, 64, 64]
    - [3, 23201.9]
  - - [2048, 3136, 1, 64, 2048, 2048, 64, 64]
    - [1, 21402.6]
  - - [2112, 3136, 1, 64, 2112, 2112, 64, 64]
    - [3, 23592.2]
  - - [2176, 3136, 1, 64, 2176, 2176, 64, 64]
    - [3, 23458.5]
  - - [2240, 3136, 1, 64, 2240, 2240, 64, 64]
    - [3, 23961.8]
  - - [2304, 3136, 1, 64, 2304, 2304, 64, 64]
    - [3, 23771.0]
  - - [2368, 3136, 1, 64, 2368, 2368, 64, 64]
    - [3, 24719.9]
  - - [2432, 3136, 1, 64, 2432, 2432, 64, 64]
    - [3, 23867.0]
  - - [2496, 3136, 1, 64, 2496, 2496, 64, 64]
    - [3, 25193.6]
  - - [2560, 3136, 1, 64, 2560, 2560, 64, 64]
    - [3, 24283.8]
  - - [2624, 3136, 1, 64, 2624, 2624, 64, 64]
    - [3, 25565.1]
  - - [2688, 3136, 1, 64, 2688, 2688, 64, 64]
    - [3, 25409.1]
  - - [2752, 3136, 1, 64, 2752, 2752, 64, 64]
    - [3, 25707.7]
  - - [2816, 3136, 1, 64, 2816, 2816, 64, 64]
    - [3, 25226.5]
  - - [2880, 3136, 1, 64, 2880, 2880, 64, 64]
    - [3, 26878.4]
  - - [2944, 3136, 1, 64, 2944, 2944, 64, 64]
    - [3, 25458.5]
  - - [3008, 3136, 1, 64, 3008, 3008, 64, 64]
    - [3, 26071.5]
  - - [3072, 3136, 1, 64, 3072, 3072, 64, 64]
    - [1, 24158.7]
  - - [3136, 3136, 1, 64, 3136, 3136, 64, 64]
    - [3, 26527.9]
  - - [3200, 3136, 1, 64, 3200, 3200, 64, 64]
    - [1, 25365.1]
  - - [3264, 3136, 1, 64, 3264, 3264, 64, 64]
    - [3, 26334.2]
  - - [3328, 3136, 1, 64, 3328, 3328, 64, 64]
    - [3, 27371.0]
  - - [3392, 3136, 1, 64, 3392, 3392, 64, 64]
    - [3, 27065.6]
  - - [3456, 3136, 1, 64, 3456, 3456, 64, 64]
    - [1, 25824.6]
  - - [3520, 3136, 1, 64, 3520, 3520, 64, 64]
    - [1, 26122.0]
  - - [3584, 3136, 1, 64, 3584, 3584, 64, 64]
    - [1, 25925.0]
  - - [3648, 3136, 1, 64, 3648, 3648, 64, 64]
    - [3, 27109.9]
  - - [3712, 3136, 1, 64, 3712, 3712, 64, 64]
    - [0, 26836.3]
  - - [3776, 3136, 1, 64, 3776, 3776, 64, 64]
    - [1, 25775.4]
  - - [3840, 3136, 1, 64, 3840, 3840, 64, 64]
    - [3, 27157.2]
  - - [3904, 3136, 1, 64, 3904, 3904, 64, 64]
    - [3, 25716.8]
  - - [3968, 3136, 1, 64, 3968, 3968, 64, 64]
    - [3, 25452.5]
  - - [4032, 3136, 1, 64, 4032, 4032, 64, 64]
    - [1, 25669.4]
  - - [4096, 3136, 1, 64, 4096, 4096, 64, 64]
    - [1, 22696.0]
  - - [64, 3200, 1, 64, 64, 64, 64, 64]
    - [10, 2588.78]
  - - [128, 3200, 1, 64, 128, 128, 64, 64]
    - [7, 4651.2]
  - - [192, 3200, 1, 64, 192, 192, 64, 64]
    - [6, 6433.43]
  - - [256, 3200, 1, 64, 256, 256, 64, 64]
    - [7, 8124.62]
  - - [320, 3200, 1, 64, 320, 320, 64, 64]
    - [4, 9593.8]
  - - [384, 3200, 1, 64, 384, 384, 64, 64]
    - [4, 10772.9]
  - - [448, 3200, 1, 64, 448, 448, 64, 64]
    - [4, 11889.2]
  - - [512, 3200, 1, 64, 512, 512, 64, 64]
    - [4, 12729.9]
  - - [576, 3200, 1, 64, 576, 576, 64, 64]
    - [4, 13640.5]
  - - [640, 3200, 1, 64, 640, 640, 64, 64]
    - [4, 14417.6]
  - - [704, 3200, 1, 64, 704, 704, 64, 64]
    - [4, 14914.4]
  - - [768, 3200, 1, 64, 768, 768, 64, 64]
    - [4, 15486.9]
  - - [832, 3200, 1, 64, 832, 832, 64, 64]
    - [4, 16227.7]
  - - [896, 3200, 1, 64, 896, 896, 64, 64]
    - [4, 16816.3]
  - - [960, 3200, 1, 64, 960, 960, 64, 64]
    - [4, 17325.1]
  - - [1024, 3200, 1, 64, 1024, 1024, 64, 64]
    - [4, 17454.2]
  - - [1088, 3200, 1, 64, 1088, 1088, 64, 64]
    - [4, 18548.2]
  - - [1152, 3200, 1, 64, 1152, 1152, 64, 64]
    - [3, 18613.5]
  - - [1216, 3200, 1, 64, 1216, 1216, 64, 64]
    - [4, 19234.9]
  - - [1280, 3200, 1, 64, 1280, 1280, 64, 64]
    - [3, 19751.5]
  - - [1344, 3200, 1, 64, 1344, 1344, 64, 64]
    - [3, 20250.7]
  - - [1408, 3200, 1, 64, 1408, 1408, 64, 64]
    - [3, 20339.6]
  - - [1472, 3200, 1, 64, 1472, 1472, 64, 64]
    - [3, 20791.8]
  - - [1536, 3200, 1, 64, 1536, 1536, 64, 64]
    - [1, 19800.4]
  - - [1600, 3200, 1, 64, 1600, 1600, 64, 64]
    - [3, 21422.3]
  - - [1664, 3200, 1, 64, 1664, 1664, 64, 64]
    - [3, 21888.5]
  - - [1728, 3200, 1, 64, 1728, 1728, 64, 64]
    - [3, 22222.3]
  - - [1792, 3200, 1, 64, 1792, 1792, 64, 64]
    - [3, 22422.9]
  - - [1856, 3200, 1, 64, 1856, 1856, 64, 64]
    - [3, 22842.8]
  - - [1920, 3200, 1, 64, 1920, 1920, 64, 64]
    - [3, 22992.2]
  - - [1984, 3200, 1, 64, 1984, 1984, 64, 64]
    - [3, 23454.0]
  - - [2048, 3200, 1, 64, 2048, 2048, 64, 64]
    - [1, 21559.9]
  - - [2112, 3200, 1, 64, 2112, 2112, 64, 64]
    - [3, 23756.4]
  - - [2176, 3200, 1, 64, 2176, 2176, 64, 64]
    - [3, 23517.9]
  - - [2240, 3200, 1, 64, 2240, 2240, 64, 64]
    - [3, 24204.4]
  - - [2304, 3200, 1, 64, 2304, 2304, 64, 64]
    - [3, 23711.2]
  - - [2368, 3200, 1, 64, 2368, 2368, 64, 64]
    - [3, 24639.8]
  - - [2432, 3200, 1, 64, 2432, 2432, 64, 64]
    - [3, 25217.3]
  - - [2496, 3200, 1, 64, 2496, 2496, 64, 64]
    - [3, 24677.8]
  - - [2560, 3200, 1, 64, 2560, 2560, 64, 64]
    - [3, 23267.3]
  - - [2624, 3200, 1, 64, 2624, 2624, 64, 64]
    - [3, 25090.4]
  - - [2688, 3200, 1, 64, 2688, 2688, 64, 64]
    - [3, 25688.1]
  - - [2752, 3200, 1, 64, 2752, 2752, 64, 64]
    - [3, 26856.2]
  - - [2816, 3200, 1, 64, 2816, 2816, 64, 64]
    - [3, 25897.4]
  - - [2880, 3200, 1, 64, 2880, 2880, 64, 64]
    - [3, 25288.0]
  - - [2944, 3200, 1, 64, 2944, 2944, 64, 64]
    - [1, 25553.0]
  - - [3008, 3200, 1, 64, 3008, 3008, 64, 64]
    - [3, 26968.0]
  - - [3072, 3200, 1, 64, 3072, 3072, 64, 64]
    - [1, 23689.2]
  - - [3136, 3200, 1, 64, 3136, 3136, 64, 64]
    - [3, 26845.2]
  - - [3200, 3200, 1, 64, 3200, 3200, 64, 64]
    - [3, 26113.8]
  - - [3264, 3200, 1, 64, 3264, 3264, 64, 64]
    - [3, 27194.1]
  - - [3328, 3200, 1, 64, 3328, 3328, 64, 64]
    - [3, 26585.3]
  - - [3392, 3200, 1, 64, 3392, 3392, 64, 64]
    - [3, 26447.6]
  - - [3456, 3200, 1, 64, 3456, 3456, 64, 64]
    - [1, 26348.8]
  - - [3520, 3200, 1, 64, 3520, 3520, 64, 64]
    - [3, 26537.4]
  - - [3584, 3200, 1, 64, 3584, 3584, 64, 64]
    - [3, 25360.8]
  - - [3648, 3200, 1, 64, 3648, 3648, 64, 64]
    - [1, 25301.5]
  - - [3712, 3200, 1, 64, 3712, 3712, 64, 64]
    - [3, 26044.3]
  - - [3776, 3200, 1, 64, 3776, 3776, 64, 64]
    - [3, 26402.1]
  - - [3840, 3200, 1, 64, 3840, 3840, 64, 64]
    - [3, 26057.7]
  - - [3904, 3200, 1, 64, 3904, 3904, 64, 64]
    - [3, 25609.6]
  - - [3968, 3200, 1, 64, 3968, 3968, 64, 64]
    - [1, 24310.1]
  - - [4032, 3200, 1, 64, 4032, 4032, 64, 64]
    - [1, 22670.9]
  - - [4096, 3200, 1, 64, 4096, 4096, 64, 64]
    - [1, 17687.2]
  - - [64, 3264, 1, 64, 64, 64, 64, 64]
    - [5, 2700.85]
  - - [128, 3264, 1, 64, 128, 128, 64, 64]
    - [6, 4802.16]
  - - [192, 3264, 1, 64, 192, 192, 64, 64]
    - [3, 6650.2]
  - - [256, 3264, 1, 64, 256, 256, 64, 64]
    - [7, 8290.97]
  - - [320, 3264, 1, 64, 320, 320, 64, 64]
    - [4, 9655.67]
  - - [384, 3264, 1, 64, 384, 384, 64, 64]
    - [4, 10894.3]
  - - [448, 3264, 1, 64, 448, 448, 64, 64]
    - [4, 12053.6]
  - - [512, 3264, 1, 64, 512, 512, 64, 64]
    - [4, 12833.4]
  - - [576, 3264, 1, 64, 576, 576, 64, 64]
    - [4, 13812.7]
  - - [640, 3264, 1, 64, 640, 640, 64, 64]
    - [4, 14579.2]
  - - [704, 3264, 1, 64, 704, 704, 64, 64]
    - [4, 15056.9]
  - - [768, 3264, 1, 64, 768, 768, 64, 64]
    - [4, 15610.6]
  - - [832, 3264, 1, 64, 832, 832, 64, 64]
    - [4, 16442.7]
  - - [896, 3264, 1, 64, 896, 896, 64, 64]
    - [4, 16979.8]
  - - [960, 3264, 1, 64, 960, 960, 64, 64]
    - [3, 17465.4]
  - - [1024, 3264, 1, 64, 1024, 1024, 64, 64]
    - [4, 17563.6]
  - - [1088, 3264, 1, 64, 1088, 1088, 64, 64]
    - [3, 18429.7]
  - - [1152, 3264, 1, 64, 1152, 1152, 64, 64]
    - [4, 19053.5]
  - - [1216, 3264, 1, 64, 1216, 1216, 64, 64]
    - [4, 19351.9]
  - - [1280, 3264, 1, 64, 1280, 1280, 64, 64]
    - [3, 20028.8]
  - - [1344, 3264, 1, 64, 1344, 1344, 64, 64]
    - [3, 20475.0]
  - - [1408, 3264, 1, 64, 1408, 1408, 64, 64]
    - [3, 20553.6]
  - - [1472, 3264, 1, 64, 1472, 1472, 64, 64]
    - [3, 21027.9]
  - - [1536, 3264, 1, 64, 1536, 1536, 64, 64]
    - [1, 19827.0]
  - - [1600, 3264, 1, 64, 1600, 1600, 64, 64]
    - [3, 21682.1]
  - - [1664, 3264, 1, 64, 1664, 1664, 64, 64]
    - [3, 22176.7]
  - - [1728, 3264, 1, 64, 1728, 1728, 64, 64]
    - [3, 22431.5]
  - - [1792, 3264, 1, 64, 1792, 1792, 64, 64]
    - [3, 22662.4]
  - - [1856, 3264, 1, 64, 1856, 1856, 64, 64]
    - [3, 22971.1]
  - - [1920, 3264, 1, 64, 1920, 1920, 64, 64]
    - [3, 22854.6]
  - - [1984, 3264, 1, 64, 1984, 1984, 64, 64]
    - [3, 23388.5]
  - - [2048, 3264, 1, 64, 2048, 2048, 64, 64]
    - [3, 21931.3]
  - - [2112, 3264, 1, 64, 2112, 2112, 64, 64]
    - [3, 24154.6]
  - - [2176, 3264, 1, 64, 2176, 2176, 64, 64]
    - [3, 23999.6]
  - - [2240, 3264, 1, 64, 2240, 2240, 64, 64]
    - [3, 23960.3]
  - - [2304, 3264, 1, 64, 2304, 2304, 64, 64]
    - [3, 23841.6]
  - - [2368, 3264, 1, 64, 2368, 2368, 64, 64]
    - [3, 25583.7]
  - - [2432, 3264, 1, 64, 2432, 2432, 64, 64]
    - [3, 25925.1]
  - - [2496, 3264, 1, 64, 2496, 2496, 64, 64]
    - [3, 26441.4]
  - - [2560, 3264, 1, 64, 2560, 2560, 64, 64]
    - [3, 23956.9]
  - - [2624, 3264, 1, 64, 2624, 2624, 64, 64]
    - [3, 25066.8]
  - - [2688, 3264, 1, 64, 2688, 2688, 64, 64]
    - [3, 26112.9]
  - - [2752, 3264, 1, 64, 2752, 2752, 64, 64]
    - [3, 26073.7]
  - - [2816, 3264, 1, 64, 2816, 2816, 64, 64]
    - [3, 26072.3]
  - - [2880, 3264, 1, 64, 2880, 2880, 64, 64]
    - [3, 26603.5]
  - - [2944, 3264, 1, 64, 2944, 2944, 64, 64]
    - [3, 26642.2]
  - - [3008, 3264, 1, 64, 3008, 3008, 64, 64]
    - [3, 26149.7]
  - - [3072, 3264, 1, 64, 3072, 3072, 64, 64]
    - [1, 24333.4]
  - - [3136, 3264, 1, 64, 3136, 3136, 64, 64]
    - [3, 25676.7]
  - - [3200, 3264, 1, 64, 3200, 3200, 64, 64]
    - [3, 26217.2]
  - - [3264, 3264, 1, 64, 3264, 3264, 64, 64]
    - [3, 26551.0]
  - - [3328, 3264, 1, 64, 3328, 3328, 64, 64]
    - [1, 25872.6]
  - - [3392, 3264, 1, 64, 3392, 3392, 64, 64]
    - [3, 27203.4]
  - - [3456, 3264, 1, 64, 3456, 3456, 64, 64]
    - [3, 26552.5]
  - - [3520, 3264, 1, 64, 3520, 3520, 64, 64]
    - [3, 25781.2]
  - - [3584, 3264, 1, 64, 3584, 3584, 64, 64]
    - [3, 26359.0]
  - - [3648, 3264, 1, 64, 3648, 3648, 64, 64]
    - [3, 26986.4]
  - - [3712, 3264, 1, 64, 3712, 3712, 64, 64]
    - [3, 26961.5]
  - - [3776, 3264, 1, 64, 3776, 3776, 64, 64]
    - [3, 25695.7]
  - - [3840, 3264, 1, 64, 3840, 3840, 64, 64]
    - [3, 25506.4]
  - - [3904, 3264, 1, 64, 3904, 3904, 64, 64]
    - [1, 25029.0]
  - - [3968, 3264, 1, 64, 3968, 3968, 64, 64]
    - [1, 21824.3]
  - - [4032, 3264, 1, 64, 4032, 4032, 64, 64]
    - [1, 16694.9]
  - - [4096, 3264, 1, 64, 4096, 4096, 64, 64]
    - [1, 13921.0]
  - - [64, 3328, 1, 64, 64, 64, 64, 64]
    - [4, 2839.88]
  - - [128, 3328, 1, 64, 128, 128, 64, 64]
    - [4, 5083.46]
  - - [192, 3328, 1, 64, 192, 192, 64, 64]
    - [0, 6935.85]
  - - [256, 3328, 1, 64, 256, 256, 64, 64]
    - [4, 8456.13]
  - - [320, 3328, 1, 64, 320, 320, 64, 64]
    - [4, 9952.79]
  - - [384, 3328, 1, 64, 384, 384, 64, 64]
    - [4, 11070.4]
  - - [448, 3328, 1, 64, 448, 448, 64, 64]
    - [4, 12155.4]
  - - [512, 3328, 1, 64, 512, 512, 64, 64]
    - [4, 12909.9]
  - - [576, 3328, 1, 64, 576, 576, 64, 64]
    - [4, 13941.1]
  - - [640, 3328, 1, 64, 640, 640, 64, 64]
    - [4, 14607.1]
  - - [704, 3328, 1, 64, 704, 704, 64, 64]
    - [4, 15201.2]
  - - [768, 3328, 1, 64, 768, 768, 64, 64]
    - [4, 15698.2]
  - - [832, 3328, 1, 64, 832, 832, 64, 64]
    - [4, 16618.8]
  - - [896, 3328, 1, 64, 896, 896, 64, 64]
    - [4, 17080.3]
  - - [960, 3328, 1, 64, 960, 960, 64, 64]
    - [4, 17643.5]
  - - [1024, 3328, 1, 64, 1024, 1024, 64, 64]
    - [4, 17906.5]
  - - [1088, 3328, 1, 64, 1088, 1088, 64, 64]
    - [4, 18765.3]
  - - [1152, 3328, 1, 64, 1152, 1152, 64, 64]
    - [3, 18907.5]
  - - [1216, 3328, 1, 64, 1216, 1216, 64, 64]
    - [3, 19620.9]
  - - [1280, 3328, 1, 64, 1280, 1280, 64, 64]
    - [3, 20128.9]
  - - [1344, 3328, 1, 64, 1344, 1344, 64, 64]
    - [3, 20726.8]
  - - [1408, 3328, 1, 64, 1408, 1408, 64, 64]
    - [3, 20773.7]
  - - [1472, 3328, 1, 64, 1472, 1472, 64, 64]
    - [3, 21224.0]
  - - [1536, 3328, 1, 64, 1536, 1536, 64, 64]
    - [1, 19949.4]
  - - [1600, 3328, 1, 64, 1600, 1600, 64, 64]
    - [3, 21758.6]
  - - [1664, 3328, 1, 64, 1664, 1664, 64, 64]
    - [3, 22149.5]
  - - [1728, 3328, 1, 64, 1728, 1728, 64, 64]
    - [3, 22825.9]
  - - [1792, 3328, 1, 64, 1792, 1792, 64, 64]
    - [3, 22587.1]
  - - [1856, 3328, 1, 64, 1856, 1856, 64, 64]
    - [3, 23118.8]
  - - [1920, 3328, 1, 64, 1920, 1920, 64, 64]
    - [3, 23337.4]
  - - [1984, 3328, 1, 64, 1984, 1984, 64, 64]
    - [3, 23469.6]
  - - [2048, 3328, 1, 64, 2048, 2048, 64, 64]
    - [1, 22118.7]
  - - [2112, 3328, 1, 64, 2112, 2112, 64, 64]
    - [3, 24099.1]
  - - [2176, 3328, 1, 64, 2176, 2176, 64, 64]
    - [3, 23532.2]
  - - [2240, 3328, 1, 64, 2240, 2240, 64, 64]
    - [3, 23942.2]
  - - [2304, 3328, 1, 64, 2304, 2304, 64, 64]
    - [3, 23957.8]
  - - [2368, 3328, 1, 64, 2368, 2368, 64, 64]
    - [3, 25337.0]
  - - [2432, 3328, 1, 64, 2432, 2432, 64, 64]
    - [3, 24831.7]
  - - [2496, 3328, 1, 64, 2496, 2496, 64, 64]
    - [3, 24481.8]
  - - [2560, 3328, 1, 64, 2560, 2560, 64, 64]
    - [3, 24563.1]
  - - [2624, 3328, 1, 64, 2624, 2624, 64, 64]
    - [3, 26521.4]
  - - [2688, 3328, 1, 64, 2688, 2688, 64, 64]
    - [3, 26718.1]
  - - [2752, 3328, 1, 64, 2752, 2752, 64, 64]
    - [3, 25425.0]
  - - [2816, 3328, 1, 64, 2816, 2816, 64, 64]
    - [3, 25775.8]
  - - [2880, 3328, 1, 64, 2880, 2880, 64, 64]
    - [3, 25958.9]
  - - [2944, 3328, 1, 64, 2944, 2944, 64, 64]
    - [3, 26221.7]
  - - [3008, 3328, 1, 64, 3008, 3008, 64, 64]
    - [3, 25928.6]
  - - [3072, 3328, 1, 64, 3072, 3072, 64, 64]
    - [1, 23461.0]
  - - [3136, 3328, 1, 64, 3136, 3136, 64, 64]
    - [3, 27391.2]
  - - [3200, 3328, 1, 64, 3200, 3200, 64, 64]
    - [3, 26216.1]
  - - [3264, 3328, 1, 64, 3264, 3264, 64, 64]
    - [1, 25309.3]
  - - [3328, 3328, 1, 64, 3328, 3328, 64, 64]
    - [3, 27146.7]
  - - [3392, 3328, 1, 64, 3392, 3392, 64, 64]
    - [3, 27264.7]
  - - [3456, 3328, 1, 64, 3456, 3456, 64, 64]
    - [3, 26642.9]
  - - [3520, 3328, 1, 64, 3520, 3520, 64, 64]
    - [3, 26237.9]
  - - [3584, 3328, 1, 64, 3584, 3584, 64, 64]
    - [1, 24839.9]
  - - [3648, 3328, 1, 64, 3648, 3648, 64, 64]
    - [1, 25253.0]
  - - [3712, 3328, 1, 64, 3712, 3712, 64, 64]
    - [0, 25484.0]
  - - [3776, 3328, 1, 64, 3776, 3776, 64, 64]
    - [1, 25577.1]
  - - [3840, 3328, 1, 64, 3840, 3840, 64, 64]
    - [3, 23984.7]
  - - [3904, 3328, 1, 64, 3904, 3904, 64, 64]
    - [1, 20881.7]
  - - [3968, 3328, 1, 64, 3968, 3968, 64, 64]
    - [1, 16348.9]
  - - [4032, 3328, 1, 64, 4032, 4032, 64, 64]
    - [1, 13339.7]
  - - [4096, 3328, 1, 64, 4096, 4096, 64, 64]
    - [1, 13379.8]
  - - [64, 3392, 1, 64, 64, 64, 64, 64]
    - [7, 2926.78]
  - - [128, 3392, 1, 64, 128, 128, 64, 64]
    - [4, 5241.84]
  - - [192, 3392, 1, 64, 192, 192, 64, 64]
    - [1, 7056.1]
  - - [256, 3392, 1, 64, 256, 256, 64, 64]
    - [4, 8559.08]
  - - [320, 3392, 1, 64, 320, 320, 64, 64]
    - [4, 10072.2]
  - - [384, 3392, 1, 64, 384, 384, 64, 64]
    - [4, 11201.5]
  - - [448, 3392, 1, 64, 448, 448, 64, 64]
    - [4, 12346.6]
  - - [512, 3392, 1, 64, 512, 512, 64, 64]
    - [4, 13096.2]
  - - [576, 3392, 1, 64, 576, 576, 64, 64]
    - [4, 14046.3]
  - - [640, 3392, 1, 64, 640, 640, 64, 64]
    - [4, 14840.3]
  - - [704, 3392, 1, 64, 704, 704, 64, 64]
    - [4, 15334.9]
  - - [768, 3392, 1, 64, 768, 768, 64, 64]
    - [4, 15864.6]
  - - [832, 3392, 1, 64, 832, 832, 64, 64]
    - [4, 16668.1]
  - - [896, 3392, 1, 64, 896, 896, 64, 64]
    - [4, 17184.2]
  - - [960, 3392, 1, 64, 960, 960, 64, 64]
    - [3, 17865.5]
  - - [1024, 3392, 1, 64, 1024, 1024, 64, 64]
    - [4, 17728.3]
  - - [1088, 3392, 1, 64, 1088, 1088, 64, 64]
    - [4, 18866.4]
  - - [1152, 3392, 1, 64, 1152, 1152, 64, 64]
    - [4, 19232.7]
  - - [1216, 3392, 1, 64, 1216, 1216, 64, 64]
    - [3, 19835.9]
  - - [1280, 3392, 1, 64, 1280, 1280, 64, 64]
    - [3, 20264.7]
  - - [1344, 3392, 1, 64, 1344, 1344, 64, 64]
    - [3, 20901.4]
  - - [1408, 3392, 1, 64, 1408, 1408, 64, 64]
    - [3, 20903.8]
  - - [1472, 3392, 1, 64, 1472, 1472, 64, 64]
    - [3, 21263.6]
  - - [1536, 3392, 1, 64, 1536, 1536, 64, 64]
    - [1, 20119.6]
  - - [1600, 3392, 1, 64, 1600, 1600, 64, 64]
    - [3, 21880.9]
  - - [1664, 3392, 1, 64, 1664, 1664, 64, 64]
    - [3, 22569.8]
  - - [1728, 3392, 1, 64, 1728, 1728, 64, 64]
    - [3, 22710.0]
  - - [1792, 3392, 1, 64, 1792, 1792, 64, 64]
    - [3, 22758.8]
  - - [1856, 3392, 1, 64, 1856, 1856, 64, 64]
    - [3, 22965.7]
  - - [1920, 3392, 1, 64, 1920, 1920, 64, 64]
    - [3, 23006.2]
  - - [1984, 3392, 1, 64, 1984, 1984, 64, 64]
    - [3, 23645.2]
  - - [2048, 3392, 1, 64, 2048, 2048, 64, 64]
    - [1, 22144.3]
  - - [2112, 3392, 1, 64, 2112, 2112, 64, 64]
    - [3, 24104.2]
  - - [2176, 3392, 1, 64, 2176, 2176, 64, 64]
    - [3, 24311.8]
  - - [2240, 3392, 1, 64, 2240, 2240, 64, 64]
    - [1, 23960.1]
  - - [2304, 3392, 1, 64, 2304, 2304, 64, 64]
    - [3, 24025.6]
  - - [2368, 3392, 1, 64, 2368, 2368, 64, 64]
    - [3, 24821.7]
  - - [2432, 3392, 1, 64, 2432, 2432, 64, 64]
    - [3, 25053.4]
  - - [2496, 3392, 1, 64, 2496, 2496, 64, 64]
    - [3, 25766.5]
  - - [2560, 3392, 1, 64, 2560, 2560, 64, 64]
    - [1, 23916.1]
  - - [2624, 3392, 1, 64, 2624, 2624, 64, 64]
    - [3, 25085.0]
  - - [2688, 3392, 1, 64, 2688, 2688, 64, 64]
    - [3, 26183.6]
  - - [2752, 3392, 1, 64, 2752, 2752, 64, 64]
    - [3, 25696.5]
  - - [2816, 3392, 1, 64, 2816, 2816, 64, 64]
    - [3, 26241.1]
  - - [2880, 3392, 1, 64, 2880, 2880, 64, 64]
    - [3, 27295.6]
  - - [2944, 3392, 1, 64, 2944, 2944, 64, 64]
    - [3, 25868.2]
  - - [3008, 3392, 1, 64, 3008, 3008, 64, 64]
    - [3, 26629.9]
  - - [3072, 3392, 1, 64, 3072, 3072, 64, 64]
    - [3, 23921.6]
  - - [3136, 3392, 1, 64, 3136, 3136, 64, 64]
    - [3, 25995.9]
  - - [3200, 3392, 1, 64, 3200, 3200, 64, 64]
    - [3, 26455.6]
  - - [3264, 3392, 1, 64, 3264, 3264, 64, 64]
    - [3, 25403.0]
  - - [3328, 3392, 1, 64, 3328, 3328, 64, 64]
    - [1, 25412.8]
  - - [3392, 3392, 1, 64, 3392, 3392, 64, 64]
    - [3, 25881.4]
  - - [3456, 3392, 1, 64, 3456, 3456, 64, 64]
    - [3, 26993.1]
  - - [3520, 3392, 1, 64, 3520, 3520, 64, 64]
    - [3, 27191.7]
  - - [3584, 3392, 1, 64, 3584, 3584, 64, 64]
    - [3, 25049.4]
  - - [3648, 3392, 1, 64, 3648, 3648, 64, 64]
    - [1, 25549.3]
  - - [3712, 3392, 1, 64, 3712, 3712, 64, 64]
    - [3, 26102.8]
  - - [3776, 3392, 1, 64, 3776, 3776, 64, 64]
    - [3, 23645.3]
  - - [3840, 3392, 1, 64, 3840, 3840, 64, 64]
    - [1, 19688.9]
  - - [3904, 3392, 1, 64, 3904, 3904, 64, 64]
    - [0, 15525.7]
  - - [3968, 3392, 1, 64, 3968, 3968, 64, 64]
    - [1, 13762.7]
  - - [4032, 3392, 1, 64, 4032, 4032, 64, 64]
    - [0, 12804.7]
  - - [4096, 3392, 1, 64, 4096, 4096, 64, 64]
    - [1, 13104.3]
  - - [64, 3456, 1, 64, 64, 64, 64, 64]
    - [5, 2912.67]
  - - [128, 3456, 1, 64, 128, 128, 64, 64]
    - [7, 5251.54]
  - - [192, 3456, 1, 64, 192, 192, 64, 64]
    - [3, 7131.28]
  - - [256, 3456, 1, 64, 256, 256, 64, 64]
    - [4, 8611.75]
  - - [320, 3456, 1, 64, 320, 320, 64, 64]
    - [4, 10180.9]
  - - [384, 3456, 1, 64, 384, 384, 64, 64]
    - [4, 11348.8]
  - - [448, 3456, 1, 64, 448, 448, 64, 64]
    - [4, 12428.1]
  - - [512, 3456, 1, 64, 512, 512, 64, 64]
    - [4, 13262.1]
  - - [576, 3456, 1, 64, 576, 576, 64, 64]
    - [4, 14196.6]
  - - [640, 3456, 1, 64, 640, 640, 64, 64]
    - [4, 14911.6]
  - - [704, 3456, 1, 64, 704, 704, 64, 64]
    - [4, 15461.4]
  - - [768, 3456, 1, 64, 768, 768, 64, 64]
    - [4, 15981.7]
  - - [832, 3456, 1, 64, 832, 832, 64, 64]
    - [4, 16878.2]
  - - [896, 3456, 1, 64, 896, 896, 64, 64]
    - [4, 17349.1]
  - - [960, 3456, 1, 64, 960, 960, 64, 64]
    - [3, 17892.8]
  - - [1024, 3456, 1, 64, 1024, 1024, 64, 64]
    - [4, 17794.6]
  - - [1088, 3456, 1, 64, 1088, 1088, 64, 64]
    - [3, 19003.7]
  - - [1152, 3456, 1, 64, 1152, 1152, 64, 64]
    - [4, 19520.5]
  - - [1216, 3456, 1, 64, 1216, 1216, 64, 64]
    - [3, 19998.2]
  - - [1280, 3456, 1, 64, 1280, 1280, 64, 64]
    - [3, 20500.5]
  - - [1344, 3456, 1, 64, 1344, 1344, 64, 64]
    - [3, 21005.3]
  - - [1408, 3456, 1, 64, 1408, 1408, 64, 64]
    - [3, 20957.2]
  - - [1472, 3456, 1, 64, 1472, 1472, 64, 64]
    - [3, 21256.0]
  - - [1536, 3456, 1, 64, 1536, 1536, 64, 64]
    - [6, 20283.8]
  - - [1600, 3456, 1, 64, 1600, 1600, 64, 64]
    - [3, 22386.7]
  - - [1664, 3456, 1, 64, 1664, 1664, 64, 64]
    - [3, 22299.1]
  - - [1728, 3456, 1, 64, 1728, 1728, 64, 64]
    - [3, 22887.6]
  - - [1792, 3456, 1, 64, 1792, 1792, 64, 64]
    - [3, 23147.9]
  - - [1856, 3456, 1, 64, 1856, 1856, 64, 64]
    - [3, 23160.1]
  - - [1920, 3456, 1, 64, 1920, 1920, 64, 64]
    - [3, 23360.4]
  - - [1984, 3456, 1, 64, 1984, 1984, 64, 64]
    - [3, 23349.1]
  - - [2048, 3456, 1, 64, 2048, 2048, 64, 64]
    - [1, 22188.6]
  - - [2112, 3456, 1, 64, 2112, 2112, 64, 64]
    - [3, 24095.2]
  - - [2176, 3456, 1, 64, 2176, 2176, 64, 64]
    - [3, 24075.3]
  - - [2240, 3456, 1, 64, 2240, 2240, 64, 64]
    - [3, 24057.7]
  - - [2304, 3456, 1, 64, 2304, 2304, 64, 64]
    - [1, 23831.0]
  - - [2368, 3456, 1, 64, 2368, 2368, 64, 64]
    - [3, 23711.2]
  - - [2432, 3456, 1, 64, 2432, 2432, 64, 64]
    - [3, 25961.1]
  - - [2496, 3456, 1, 64, 2496, 2496, 64, 64]
    - [3, 25689.5]
  - - [2560, 3456, 1, 64, 2560, 2560, 64, 64]
    - [3, 24538.4]
  - - [2624, 3456, 1, 64, 2624, 2624, 64, 64]
    - [3, 25127.9]
  - - [2688, 3456, 1, 64, 2688, 2688, 64, 64]
    - [3, 25915.8]
  - - [2752, 3456, 1, 64, 2752, 2752, 64, 64]
    - [3, 26399.4]
  - - [2816, 3456, 1, 64, 2816, 2816, 64, 64]
    - [3, 25705.6]
  - - [2880, 3456, 1, 64, 2880, 2880, 64, 64]
    - [3, 26696.4]
  - - [2944, 3456, 1, 64, 2944, 2944, 64, 64]
    - [3, 25983.9]
  - - [3008, 3456, 1, 64, 3008, 3008, 64, 64]
    - [3, 26336.5]
  - - [3072, 3456, 1, 64, 3072, 3072, 64, 64]
    - [1, 23995.9]
  - - [3136, 3456, 1, 64, 3136, 3136, 64, 64]
    - [3, 27160.4]
  - - [3200, 3456, 1, 64, 3200, 3200, 64, 64]
    - [3, 27533.6]
  - - [3264, 3456, 1, 64, 3264, 3264, 64, 64]
    - [3, 26536.9]
  - - [3328, 3456, 1, 64, 3328, 3328, 64, 64]
    - [3, 26332.2]
  - - [3392, 3456, 1, 64, 3392, 3392, 64, 64]
    - [1, 26514.2]
  - - [3456, 3456, 1, 64, 3456, 3456, 64, 64]
    - [3, 26508.6]
  - - [3520, 3456, 1, 64, 3520, 3520, 64, 64]
    - [0, 26090.2]
  - - [3584, 3456, 1, 64, 3584, 3584, 64, 64]
    - [1, 25484.3]
  - - [3648, 3456, 1, 64, 3648, 3648, 64, 64]
    - [1, 25301.6]
  - - [3712, 3456, 1, 64, 3712, 3712, 64, 64]
    - [3, 23859.4]
  - - [3776, 3456, 1, 64, 3776, 3776, 64, 64]
    - [1, 18351.6]
  - - [3840, 3456, 1, 64, 3840, 3840, 64, 64]
    - [1, 14927.4]
  - - [3904, 3456, 1, 64, 3904, 3904, 64, 64]
    - [0, 13344.6]
  - - [3968, 3456, 1, 64, 3968, 3968, 64, 64]
    - [1, 13069.2]
  - - [4032, 3456, 1, 64, 4032, 4032, 64, 64]
    - [0, 12364.9]
  - - [4096, 3456, 1, 64, 4096, 4096, 64, 64]
    - [1, 12881.0]
  - - [64, 3520, 1, 64, 64, 64, 64, 64]
    - [12, 2910.32]
  - - [128, 3520, 1, 64, 128, 128, 64, 64]
    - [6, 5302.61]
  - - [192, 3520, 1, 64, 192, 192, 64, 64]
    - [3, 7309.99]
  - - [256, 3520, 1, 64, 256, 256, 64, 64]
    - [4, 8804.74]
  - - [320, 3520, 1, 64, 320, 320, 64, 64]
    - [4, 10274.9]
  - - [384, 3520, 1, 64, 384, 384, 64, 64]
    - [4, 11512.7]
  - - [448, 3520, 1, 64, 448, 448, 64, 64]
    - [4, 12576.2]
  - - [512, 3520, 1, 64, 512, 512, 64, 64]
    - [4, 13422.7]
  - - [576, 3520, 1, 64, 576, 576, 64, 64]
    - [4, 14416.1]
  - - [640, 3520, 1, 64, 640, 640, 64, 64]
    - [4, 15090.7]
  - - [704, 3520, 1, 64, 704, 704, 64, 64]
    - [4, 15645.2]
  - - [768, 3520, 1, 64, 768, 768, 64, 64]
    - [4, 16163.4]
  - - [832, 3520, 1, 64, 832, 832, 64, 64]
    - [3, 16986.6]
  - - [896, 3520, 1, 64, 896, 896, 64, 64]
    - [3, 17529.2]
  - - [960, 3520, 1, 64, 960, 960, 64, 64]
    - [3, 18247.2]
  - - [1024, 3520, 1, 64, 1024, 1024, 64, 64]
    - [4, 18277.8]
  - - [1088, 3520, 1, 64, 1088, 1088, 64, 64]
    - [3, 19281.1]
  - - [1152, 3520, 1, 64, 1152, 1152, 64, 64]
    - [3, 19501.0]
  - - [1216, 3520, 1, 64, 1216, 1216, 64, 64]
    - [3, 20004.1]
  - - [1280, 3520, 1, 64, 1280, 1280, 64, 64]
    - [3, 20602.7]
  - - [1344, 3520, 1, 64, 1344, 1344, 64, 64]
    - [3, 21102.0]
  - - [1408, 3520, 1, 64, 1408, 1408, 64, 64]
    - [3, 21047.8]
  - - [1472, 3520, 1, 64, 1472, 1472, 64, 64]
    - [3, 21485.5]
  - - [1536, 3520, 1, 64, 1536, 1536, 64, 64]
    - [1, 20340.1]
  - - [1600, 3520, 1, 64, 1600, 1600, 64, 64]
    - [3, 22508.0]
  - - [1664, 3520, 1, 64, 1664, 1664, 64, 64]
    - [3, 22381.1]
  - - [1728, 3520, 1, 64, 1728, 1728, 64, 64]
    - [3, 23083.4]
  - - [1792, 3520, 1, 64, 1792, 1792, 64, 64]
    - [3, 23086.8]
  - - [1856, 3520, 1, 64, 1856, 1856, 64, 64]
    - [3, 23277.7]
  - - [1920, 3520, 1, 64, 1920, 1920, 64, 64]
    - [3, 23425.7]
  - - [1984, 3520, 1, 64, 1984, 1984, 64, 64]
    - [3, 23829.7]
  - - [2048, 3520, 1, 64, 2048, 2048, 64, 64]
    - [3, 22348.7]
  - - [2112, 3520, 1, 64, 2112, 2112, 64, 64]
    - [3, 24229.0]
  - - [2176, 3520, 1, 64, 2176, 2176, 64, 64]
    - [3, 24356.7]
  - - [2240, 3520, 1, 64, 2240, 2240, 64, 64]
    - [1, 23402.2]
  - - [2304, 3520, 1, 64, 2304, 2304, 64, 64]
    - [3, 24368.1]
  - - [2368, 3520, 1, 64, 2368, 2368, 64, 64]
    - [3, 25086.1]
  - - [2432, 3520, 1, 64, 2432, 2432, 64, 64]
    - [3, 24893.2]
  - - [2496, 3520, 1, 64, 2496, 2496, 64, 64]
    - [1, 24732.4]
  - - [2560, 3520, 1, 64, 2560, 2560, 64, 64]
    - [1, 24321.4]
  - - [2624, 3520, 1, 64, 2624, 2624, 64, 64]
    - [3, 26134.1]
  - - [2688, 3520, 1, 64, 2688, 2688, 64, 64]
    - [3, 26474.2]
  - - [2752, 3520, 1, 64, 2752, 2752, 64, 64]
    - [3, 25743.8]
  - - [2816, 3520, 1, 64, 2816, 2816, 64, 64]
    - [3, 26796.6]
  - - [2880, 3520, 1, 64, 2880, 2880, 64, 64]
    - [3, 26710.5]
  - - [2944, 3520, 1, 64, 2944, 2944, 64, 64]
    - [3, 26727.5]
  - - [3008, 3520, 1, 64, 3008, 3008, 64, 64]
    - [3, 26444.3]
  - - [3072, 3520, 1, 64, 3072, 3072, 64, 64]
    - [3, 23532.7]
  - - [3136, 3520, 1, 64, 3136, 3136, 64, 64]
    - [3, 27710.1]
  - - [3200, 3520, 1, 64, 3200, 3200, 64, 64]
    - [3, 27125.5]
  - - [3264, 3520, 1, 64, 3264, 3264, 64, 64]
    - [3, 26234.7]
  - - [3328, 3520, 1, 64, 3328, 3328, 64, 64]
    - [3, 26777.7]
  - - [3392, 3520, 1, 64, 3392, 3392, 64, 64]
    - [3, 26800.7]
  - - [3456, 3520, 1, 64, 3456, 3456, 64, 64]
    - [0, 25867.4]
  - - [3520, 3520, 1, 64, 3520, 3520, 64, 64]
    - [0, 25607.1]
  - - [3584, 3520, 1, 64, 3584, 3584, 64, 64]
    - [1, 24681.9]
  - - [3648, 3520, 1, 64, 3648, 3648, 64, 64]
    - [3, 24126.9]
  - - [3712, 3520, 1, 64, 3712, 3712, 64, 64]
    - [1, 18927.3]
  - - [3776, 3520, 1, 64, 3776, 3776, 64, 64]
    - [1, 13869.8]
  - - [3840, 3520, 1, 64, 3840, 3840, 64, 64]
    - [1, 13427.7]
  - - [3904, 3520, 1, 64, 3904, 3904, 64, 64]
    - [1, 12733.0]
  - - [3968, 3520, 1, 64, 3968, 3968, 64, 64]
    - [1, 12579.9]
  - - [4032, 3520, 1, 64, 4032, 4032, 64, 64]
    - [1, 12054.3]
  - - [4096, 3520, 1, 64, 4096, 4096, 64, 64]
    - [1, 12815.8]
  - - [64, 3584, 1, 64, 64, 64, 64, 64]
    - [3, 3105.58]
  - - [128, 3584, 1, 64, 128, 128, 64, 64]
    - [3, 5719.85]
  - - [192, 3584, 1, 64, 192, 192, 64, 64]
    - [1, 7607.5]
  - - [256, 3584, 1, 64, 256, 256, 64, 64]
    - [4, 8938.86]
  - - [320, 3584, 1, 64, 320, 320, 64, 64]
    - [4, 10392.1]
  - - [384, 3584, 1, 64, 384, 384, 64, 64]
    - [4, 11612.3]
  - - [448, 3584, 1, 64, 448, 448, 64, 64]
    - [4, 12724.1]
  - - [512, 3584, 1, 64, 512, 512, 64, 64]
    - [4, 13474.0]
  - - [576, 3584, 1, 64, 576, 576, 64, 64]
    - [4, 14528.1]
  - - [640, 3584, 1, 64, 640, 640, 64, 64]
    - [4, 15196.6]
  - - [704, 3584, 1, 64, 704, 704, 64, 64]
    - [3, 15750.9]
  - - [768, 3584, 1, 64, 768, 768, 64, 64]
    - [4, 16283.8]
  - - [832, 3584, 1, 64, 832, 832, 64, 64]
    - [3, 17195.7]
  - - [896, 3584, 1, 64, 896, 896, 64, 64]
    - [3, 17706.4]
  - - [960, 3584, 1, 64, 960, 960, 64, 64]
    - [4, 18426.7]
  - - [1024, 3584, 1, 64, 1024, 1024, 64, 64]
    - [7, 18158.4]
  - - [1088, 3584, 1, 64, 1088, 1088, 64, 64]
    - [3, 19336.6]
  - - [1152, 3584, 1, 64, 1152, 1152, 64, 64]
    - [3, 19644.5]
  - - [1216, 3584, 1, 64, 1216, 1216, 64, 64]
    - [3, 20148.6]
  - - [1280, 3584, 1, 64, 1280, 1280, 64, 64]
    - [3, 20633.7]
  - - [1344, 3584, 1, 64, 1344, 1344, 64, 64]
    - [3, 21221.0]
  - - [1408, 3584, 1, 64, 1408, 1408, 64, 64]
    - [3, 21089.0]
  - - [1472, 3584, 1, 64, 1472, 1472, 64, 64]
    - [3, 22044.7]
  - - [1536, 3584, 1, 64, 1536, 1536, 64, 64]
    - [1, 20368.6]
  - - [1600, 3584, 1, 64, 1600, 1600, 64, 64]
    - [3, 22356.1]
  - - [1664, 3584, 1, 64, 1664, 1664, 64, 64]
    - [3, 22675.7]
  - - [1728, 3584, 1, 64, 1728, 1728, 64, 64]
    - [3, 23126.0]
  - - [1792, 3584, 1, 64, 1792, 1792, 64, 64]
    - [3, 23402.3]
  - - [1856, 3584, 1, 64, 1856, 1856, 64, 64]
    - [3, 23631.2]
  - - [1920, 3584, 1, 64, 1920, 1920, 64, 64]
    - [3, 23678.5]
  - - [1984, 3584, 1, 64, 1984, 1984, 64, 64]
    - [3, 23901.1]
  - - [2048, 3584, 1, 64, 2048, 2048, 64, 64]
    - [1, 22519.4]
  - - [2112, 3584, 1, 64, 2112, 2112, 64, 64]
    - [3, 24097.7]
  - - [2176, 3584, 1, 64, 2176, 2176, 64, 64]
    - [3, 24612.4]
  - - [2240, 3584, 1, 64, 2240, 2240, 64, 64]
    - [3, 24362.0]
  - - [2304, 3584, 1, 64, 2304, 2304, 64, 64]
    - [3, 24718.2]
  - - [2368, 3584, 1, 64, 2368, 2368, 64, 64]
    - [3, 25377.5]
  - - [2432, 3584, 1, 64, 2432, 2432, 64, 64]
    - [3, 25872.5]
  - - [2496, 3584, 1, 64, 2496, 2496, 64, 64]
    - [3, 25828.5]
  - - [2560, 3584, 1, 64, 2560, 2560, 64, 64]
    - [3, 24555.5]
  - - [2624, 3584, 1, 64, 2624, 2624, 64, 64]
    - [3, 26608.1]
  - - [2688, 3584, 1, 64, 2688, 2688, 64, 64]
    - [1, 25218.0]
  - - [2752, 3584, 1, 64, 2752, 2752, 64, 64]
    - [1, 25423.3]
  - - [2816, 3584, 1, 64, 2816, 2816, 64, 64]
    - [3, 26074.3]
  - - [2880, 3584, 1, 64, 2880, 2880, 64, 64]
    - [3, 25737.1]
  - - [2944, 3584, 1, 64, 2944, 2944, 64, 64]
    - [3, 26104.6]
  - - [3008, 3584, 1, 64, 3008, 3008, 64, 64]
    - [3, 27390.0]
  - - [3072, 3584, 1, 64, 3072, 3072, 64, 64]
    - [1, 24480.9]
  - - [3136, 3584, 1, 64, 3136, 3136, 64, 64]
    - [3, 27270.5]
  - - [3200, 3584, 1, 64, 3200, 3200, 64, 64]
    - [3, 26621.0]
  - - [3264, 3584, 1, 64, 3264, 3264, 64, 64]
    - [3, 25628.2]
  - - [3328, 3584, 1, 64, 3328, 3328, 64, 64]
    - [3, 25618.5]
  - - [3392, 3584, 1, 64, 3392, 3392, 64, 64]
    - [1, 26302.6]
  - - [3456, 3584, 1, 64, 3456, 3456, 64, 64]
    - [1, 25866.8]
  - - [3520, 3584, 1, 64, 3520, 3520, 64, 64]
    - [1, 25419.3]
  - - [3584, 3584, 1, 64, 3584, 3584, 64, 64]
    - [1, 22900.3]
  - - [3648, 3584, 1, 64, 3648, 3648, 64, 64]
    - [0, 18814.4]
  - - [3712, 3584, 1, 64, 3712, 3712, 64, 64]
    - [1, 14162.0]
  - - [3776, 3584, 1, 64, 3776, 3776, 64, 64]
    - [1, 12681.6]
  - - [3840, 3584, 1, 64, 3840, 3840, 64, 64]
    - [1, 12900.1]
  - - [3904, 3584, 1, 64, 3904, 3904, 64, 64]
    - [1, 12374.7]
  - - [3968, 3584, 1, 64, 3968, 3968, 64, 64]
    - [1, 12361.0]
  - - [4032, 3584, 1, 64, 4032, 4032, 64, 64]
    - [12, 12115.8]
  - - [4096, 3584, 1, 64, 4096, 4096, 64, 64]
    - [8, 12669.9]
  - - [64, 3648, 1, 64, 64, 64, 64, 64]
    - [15, 3074.48]
  - - [128, 3648, 1, 64, 128, 128, 64, 64]
    - [4, 5484.31]
  - - [192, 3648, 1, 64, 192, 192, 64, 64]
    - [3, 7468.52]
  - - [256, 3648, 1, 64, 256, 256, 64, 64]
    - [4, 9061.27]
  - - [320, 3648, 1, 64, 320, 320, 64, 64]
    - [4, 10555.2]
  - - [384, 3648, 1, 64, 384, 384, 64, 64]
    - [4, 11728.5]
  - - [448, 3648, 1, 64, 448, 448, 64, 64]
    - [4, 12900.1]
  - - [512, 3648, 1, 64, 512, 512, 64, 64]
    - [4, 13627.1]
  - - [576, 3648, 1, 64, 576, 576, 64, 64]
    - [4, 14598.1]
  - - [640, 3648, 1, 64, 640, 640, 64, 64]
    - [4, 15361.4]
  - - [704, 3648, 1, 64, 704, 704, 64, 64]
    - [3, 15980.8]
  - - [768, 3648, 1, 64, 768, 768, 64, 64]
    - [4, 16397.3]
  - - [832, 3648, 1, 64, 832, 832, 64, 64]
    - [3, 17251.0]
  - - [896, 3648, 1, 64, 896, 896, 64, 64]
    - [3, 17956.1]
  - - [960, 3648, 1, 64, 960, 960, 64, 64]
    - [3, 18433.3]
  - - [1024, 3648, 1, 64, 1024, 1024, 64, 64]
    - [4, 18654.2]
  - - [1088, 3648, 1, 64, 1088, 1088, 64, 64]
    - [3, 19458.7]
  - - [1152, 3648, 1, 64, 1152, 1152, 64, 64]
    - [3, 19643.4]
  - - [1216, 3648, 1, 64, 1216, 1216, 64, 64]
    - [3, 20301.7]
  - - [1280, 3648, 1, 64, 1280, 1280, 64, 64]
    - [3, 20691.0]
  - - [1344, 3648, 1, 64, 1344, 1344, 64, 64]
    - [3, 21332.7]
  - - [1408, 3648, 1, 64, 1408, 1408, 64, 64]
    - [3, 21178.0]
  - - [1472, 3648, 1, 64, 1472, 1472, 64, 64]
    - [3, 21802.1]
  - - [1536, 3648, 1, 64, 1536, 1536, 64, 64]
    - [6, 20660.8]
  - - [1600, 3648, 1, 64, 1600, 1600, 64, 64]
    - [3, 22638.1]
  - - [1664, 3648, 1, 64, 1664, 1664, 64, 64]
    - [3, 22896.9]
  - - [1728, 3648, 1, 64, 1728, 1728, 64, 64]
    - [3, 23506.3]
  - - [1792, 3648, 1, 64, 1792, 1792, 64, 64]
    - [3, 23382.1]
  - - [1856, 3648, 1, 64, 1856, 1856, 64, 64]
    - [3, 23382.2]
  - - [1920, 3648, 1, 64, 1920, 1920, 64, 64]
    - [3, 23779.2]
  - - [1984, 3648, 1, 64, 1984, 1984, 64, 64]
    - [3, 24128.9]
  - - [2048, 3648, 1, 64, 2048, 2048, 64, 64]
    - [3, 22506.2]
  - - [2112, 3648, 1, 64, 2112, 2112, 64, 64]
    - [1, 24064.7]
  - - [2176, 3648, 1, 64, 2176, 2176, 64, 64]
    - [3, 24847.3]
  - - [2240, 3648, 1, 64, 2240, 2240, 64, 64]
    - [3, 24632.3]
  - - [2304, 3648, 1, 64, 2304, 2304, 64, 64]
    - [3, 24156.3]
  - - [2368, 3648, 1, 64, 2368, 2368, 64, 64]
    - [3, 24839.6]
  - - [2432, 3648, 1, 64, 2432, 2432, 64, 64]
    - [3, 25573.0]
  - - [2496, 3648, 1, 64, 2496, 2496, 64, 64]
    - [3, 26423.2]
  - - [2560, 3648, 1, 64, 2560, 2560, 64, 64]
    - [3, 24327.6]
  - - [2624, 3648, 1, 64, 2624, 2624, 64, 64]
    - [3, 25586.7]
  - - [2688, 3648, 1, 64, 2688, 2688, 64, 64]
    - [3, 25655.7]
  - - [2752, 3648, 1, 64, 2752, 2752, 64, 64]
    - [3, 27678.9]
  - - [2816, 3648, 1, 64, 2816, 2816, 64, 64]
    - [3, 27027.7]
  - - [2880, 3648, 1, 64, 2880, 2880, 64, 64]
    - [1, 25500.3]
  - - [2944, 3648, 1, 64, 2944, 2944, 64, 64]
    - [3, 26662.6]
  - - [3008, 3648, 1, 64, 3008, 3008, 64, 64]
    - [3, 25578.2]
  - - [3072, 3648, 1, 64, 3072, 3072, 64, 64]
    - [1, 23882.6]
  - - [3136, 3648, 1, 64, 3136, 3136, 64, 64]
    - [1, 26009.2]
  - - [3200, 3648, 1, 64, 3200, 3200, 64, 64]
    - [3, 26959.5]
  - - [3264, 3648, 1, 64, 3264, 3264, 64, 64]
    - [3, 26679.4]
  - - [3328, 3648, 1, 64, 3328, 3328, 64, 64]
    - [1, 25997.4]
  - - [3392, 3648, 1, 64, 3392, 3392, 64, 64]
    - [3, 25544.4]
  - - [3456, 3648, 1, 64, 3456, 3456, 64, 64]
    - [1, 25339.0]
  - - [3520, 3648, 1, 64, 3520, 3520, 64, 64]
    - [1, 23337.0]
  - - [3584, 3648, 1, 64, 3584, 3584, 64, 64]
    - [1, 18334.2]
  - - [3648, 3648, 1, 64, 3648, 3648, 64, 64]
    - [0, 14460.5]
  - - [3712, 3648, 1, 64, 3712, 3712, 64, 64]
    - [1, 13039.0]
  - - [3776, 3648, 1, 64, 3776, 3776, 64, 64]
    - [1, 12341.2]
  - - [3840, 3648, 1, 64, 3840, 3840, 64, 64]
    - [1, 12316.4]
  - - [3904, 3648, 1, 64, 3904, 3904, 64, 64]
    - [1, 12158.8]
  - - [3968, 3648, 1, 64, 3968, 3968, 64, 64]
    - [1, 12203.0]
  - - [4032, 3648, 1, 64, 4032, 4032, 64, 64]
    - [12, 11995.5]
  - - [4096, 3648, 1, 64, 4096, 4096, 64, 64]
    - [8, 12699.4]
  - - [64, 3712, 1, 64, 64, 64, 64, 64]
    - [7, 3233.56]
  - - [128, 3712, 1, 64, 128, 128, 64, 64]
    - [4, 5582.63]
  - - [192, 3712, 1, 64, 192, 192, 64, 64]
    - [1, 7814.37]
  - - [256, 3712, 1, 64, 256, 256, 64, 64]
    - [4, 9184.01]
  - - [320, 3712, 1, 64, 320, 320, 64, 64]
    - [4, 10678.6]
  - - [384, 3712, 1, 64, 384, 384, 64, 64]
    - [4, 11869.0]
  - - [448, 3712, 1, 64, 448, 448, 64, 64]
    - [4, 12966.5]
  - - [512, 3712, 1, 64, 512, 512, 64, 64]
    - [4, 13736.1]
  - - [576, 3712, 1, 64, 576, 576, 64, 64]
    - [4, 14732.7]
  - - [640, 3712, 1, 64, 640, 640, 64, 64]
    - [4, 15484.3]
  - - [704, 3712, 1, 64, 704, 704, 64, 64]
    - [3, 15999.8]
  - - [768, 3712, 1, 64, 768, 768, 64, 64]
    - [4, 16486.0]
  - - [832, 3712, 1, 64, 832, 832, 64, 64]
    - [3, 17377.8]
  - - [896, 3712, 1, 64, 896, 896, 64, 64]
    - [3, 18057.2]
  - - [960, 3712, 1, 64, 960, 960, 64, 64]
    - [3, 18478.5]
  - - [1024, 3712, 1, 64, 1024, 1024, 64, 64]
    - [4, 18748.9]
  - - [1088, 3712, 1, 64, 1088, 1088, 64, 64]
    - [3, 19639.2]
  - - [1152, 3712, 1, 64, 1152, 1152, 64, 64]
    - [3, 19661.9]
  - - [1216, 3712, 1, 64, 1216, 1216, 64, 64]
    - [3, 20418.4]
  - - [1280, 3712, 1, 64, 1280, 1280, 64, 64]
    - [3, 20859.0]
  - - [1344, 3712, 1, 64, 1344, 1344, 64, 64]
    - [3, 21532.7]
  - - [1408, 3712, 1, 64, 1408, 1408, 64, 64]
    - [3, 21525.9]
  - - [1472, 3712, 1, 64, 1472, 1472, 64, 64]
    - [3, 21914.9]
  - - [1536, 3712, 1, 64, 1536, 1536, 64, 64]
    - [1, 20771.9]
  - - [1600, 3712, 1, 64, 1600, 1600, 64, 64]
    - [3, 22954.5]
  - - [1664, 3712, 1, 64, 1664, 1664, 64, 64]
    - [3, 23130.9]
  - - [1728, 3712, 1, 64, 1728, 1728, 64, 64]
    - [3, 23480.7]
  - - [1792, 3712, 1, 64, 1792, 1792, 64, 64]
    - [3, 23454.1]
  - - [1856, 3712, 1, 64, 1856, 1856, 64, 64]
    - [3, 23682.5]
  - - [1920, 3712, 1, 64, 1920, 1920, 64, 64]
    - [3, 23393.5]
  - - [1984, 3712, 1, 64, 1984, 1984, 64, 64]
    - [3, 23507.7]
  - - [2048, 3712, 1, 64, 2048, 2048, 64, 64]
    - [1, 22444.7]
  - - [2112, 3712, 1, 64, 2112, 2112, 64, 64]
    - [3, 24885.3]
  - - [2176, 3712, 1, 64, 2176, 2176, 64, 64]
    - [3, 25183.5]
  - - [2240, 3712, 1, 64, 2240, 2240, 64, 64]
    - [3, 25224.9]
  - - [2304, 3712, 1, 64, 2304, 2304, 64, 64]
    - [3, 24155.9]
  - - [2368, 3712, 1, 64, 2368, 2368, 64, 64]
    - [3, 24542.1]
  - - [2432, 3712, 1, 64, 2432, 2432, 64, 64]
    - [3, 25213.1]
  - - [2496, 3712, 1, 64, 2496, 2496, 64, 64]
    - [3, 27125.5]
  - - [2560, 3712, 1, 64, 2560, 2560, 64, 64]
    - [3, 25784.0]
  - - [2624, 3712, 1, 64, 2624, 2624, 64, 64]
    - [3, 25423.0]
  - - [2688, 3712, 1, 64, 2688, 2688, 64, 64]
    - [3, 26829.8]
  - - [2752, 3712, 1, 64, 2752, 2752, 64, 64]
    - [3, 25921.0]
  - - [2816, 3712, 1, 64, 2816, 2816, 64, 64]
    - [3, 26169.9]
  - - [2880, 3712, 1, 64, 2880, 2880, 64, 64]
    - [3, 26270.4]
  - - [2944, 3712, 1, 64, 2944, 2944, 64, 64]
    - [3, 27460.5]
  - - [3008, 3712, 1, 64, 3008, 3008, 64, 64]
    - [1, 26467.5]
  - - [3072, 3712, 1, 64, 3072, 3072, 64, 64]
    - [1, 24738.9]
  - - [3136, 3712, 1, 64, 3136, 3136, 64, 64]
    - [3, 25383.4]
  - - [3200, 3712, 1, 64, 3200, 3200, 64, 64]
    - [1, 25426.7]
  - - [3264, 3712, 1, 64, 3264, 3264, 64, 64]
    - [3, 25450.9]
  - - [3328, 3712, 1, 64, 3328, 3328, 64, 64]
    - [3, 27342.8]
  - - [3392, 3712, 1, 64, 3392, 3392, 64, 64]
    - [0, 25498.2]
  - - [3456, 3712, 1, 64, 3456, 3456, 64, 64]
    - [1, 23539.9]
  - - [3520, 3712, 1, 64, 3520, 3520, 64, 64]
    - [0, 18910.2]
  - - [3584, 3712, 1, 64, 3584, 3584, 64, 64]
    - [1, 13977.6]
  - - [3648, 3712, 1, 64, 3648, 3648, 64, 64]
    - [0, 13206.3]
  - - [3712, 3712, 1, 64, 3712, 3712, 64, 64]
    - [1, 12587.7]
  - - [3776, 3712, 1, 64, 3776, 3776, 64, 64]
    - [1, 12024.2]
  - - [3840, 3712, 1, 64, 3840, 3840, 64, 64]
    - [1, 12002.4]
  - - [3904, 3712, 1, 64, 3904, 3904, 64, 64]
    - [12, 12087.2]
  - - [3968, 3712, 1, 64, 3968, 3968, 64, 64]
    - [12, 11912.3]
  - - [4032, 3712, 1, 64, 4032, 4032, 64, 64]
    - [12, 12076.5]
  - - [4096, 3712, 1, 64, 4096, 4096, 64, 64]
    - [8, 12714.8]
  - - [64, 3776, 1, 64, 64, 64, 64, 64]
    - [4, 3262.91]
  - - [128, 3776, 1, 64, 128, 128, 64, 64]
    - [9, 5651.87]
  - - [192, 3776, 1, 64, 192, 192, 64, 64]
    - [1, 7915.2]
  - - [256, 3776, 1, 64, 256, 256, 64, 64]
    - [4, 9222.61]
  - - [320, 3776, 1, 64, 320, 320, 64, 64]
    - [4, 10761.4]
  - - [384, 3776, 1, 64, 384, 384, 64, 64]
    - [4, 11980.1]
  - - [448, 3776, 1, 64, 448, 448, 64, 64]
    - [4, 13040.8]
  - - [512, 3776, 1, 64, 512, 512, 64, 64]
    - [4, 13798.5]
  - - [576, 3776, 1, 64, 576, 576, 64, 64]
    - [4, 14877.8]
  - - [640, 3776, 1, 64, 640, 640, 64, 64]
    - [4, 15575.3]
  - - [704, 3776, 1, 64, 704, 704, 64, 64]
    - [3, 16196.8]
  - - [768, 3776, 1, 64, 768, 768, 64, 64]
    - [4, 16602.2]
  - - [832, 3776, 1, 64, 832, 832, 64, 64]
    - [3, 17517.1]
  - - [896, 3776, 1, 64, 896, 896, 64, 64]
    - [3, 18192.6]
  - - [960, 3776, 1, 64, 960, 960, 64, 64]
    - [4, 18721.3]
  - - [1024, 3776, 1, 64, 1024, 1024, 64, 64]
    - [4, 18676.4]
  - - [1088, 3776, 1, 64, 1088, 1088, 64, 64]
    - [3, 19730.3]
  - - [1152, 3776, 1, 64, 1152, 1152, 64, 64]
    - [3, 19811.6]
  - - [1216, 3776, 1, 64, 1216, 1216, 64, 64]
    - [3, 20551.1]
  - - [1280, 3776, 1, 64, 1280, 1280, 64, 64]
    - [3, 21091.3]
  - - [1344, 3776, 1, 64, 1344, 1344, 64, 64]
    - [3, 21628.4]
  - - [1408, 3776, 1, 64, 1408, 1408, 64, 64]
    - [3, 21601.0]
  - - [1472, 3776, 1, 64, 1472, 1472, 64, 64]
    - [3, 22155.3]
  - - [1536, 3776, 1, 64, 1536, 1536, 64, 64]
    - [1, 20833.5]
  - - [1600, 3776, 1, 64, 1600, 1600, 64, 64]
    - [3, 23071.6]
  - - [1664, 3776, 1, 64, 1664, 1664, 64, 64]
    - [3, 23365.7]
  - - [1728, 3776, 1, 64, 1728, 1728, 64, 64]
    - [3, 23615.3]
  - - [1792, 3776, 1, 64, 1792, 1792, 64, 64]
    - [3, 23747.3]
  - - [1856, 3776, 1, 64, 1856, 1856, 64, 64]
    - [3, 23549.5]
  - - [1920, 3776, 1, 64, 1920, 1920, 64, 64]
    - [3, 23635.6]
  - - [1984, 3776, 1, 64, 1984, 1984, 64, 64]
    - [1, 23273.4]
  - - [2048, 3776, 1, 64, 2048, 2048, 64, 64]
    - [1, 22740.4]
  - - [2112, 3776, 1, 64, 2112, 2112, 64, 64]
    - [3, 24334.3]
  - - [2176, 3776, 1, 64, 2176, 2176, 64, 64]
    - [3, 24784.6]
  - - [2240, 3776, 1, 64, 2240, 2240, 64, 64]
    - [3, 24833.5]
  - - [2304, 3776, 1, 64, 2304, 2304, 64, 64]
    - [3, 24759.3]
  - - [2368, 3776, 1, 64, 2368, 2368, 64, 64]
    - [3, 26162.5]
  - - [2432, 3776, 1, 64, 2432, 2432, 64, 64]
    - [3, 25026.4]
  - - [2496, 3776, 1, 64, 2496, 2496, 64, 64]
    - [3, 25277.0]
  - - [2560, 3776, 1, 64, 2560, 2560, 64, 64]
    - [3, 25718.3]
  - - [2624, 3776, 1, 64, 2624, 2624, 64, 64]
    - [3, 26896.8]
  - - [2688, 3776, 1, 64, 2688, 2688, 64, 64]
    - [1, 25367.5]
  - - [2752, 3776, 1, 64, 2752, 2752, 64, 64]
    - [3, 26742.2]
  - - [2816, 3776, 1, 64, 2816, 2816, 64, 64]
    - [3, 26787.8]
  - - [2880, 3776, 1, 64, 2880, 2880, 64, 64]
    - [3, 26056.0]
  - - [2944, 3776, 1, 64, 2944, 2944, 64, 64]
    - [3, 26444.0]
  - - [3008, 3776, 1, 64, 3008, 3008, 64, 64]
    - [1, 26250.0]
  - - [3072, 3776, 1, 64, 3072, 3072, 64, 64]
    - [3, 24250.5]
  - - [3136, 3776, 1, 64, 3136, 3136, 64, 64]
    - [1, 25760.5]
  - - [3200, 3776, 1, 64, 3200, 3200, 64, 64]
    - [0, 25765.1]
  - - [3264, 3776, 1, 64, 3264, 3264, 64, 64]
    - [3, 25906.7]
  - - [3328, 3776, 1, 64, 3328, 3328, 64, 64]
    - [1, 26766.3]
  - - [3392, 3776, 1, 64, 3392, 3392, 64, 64]
    - [3, 23844.8]
  - - [3456, 3776, 1, 64, 3456, 3456, 64, 64]
    - [1, 19480.8]
  - - [3520, 3776, 1, 64, 3520, 3520, 64, 64]
    - [0, 14467.5]
  - - [3584, 3776, 1, 64, 3584, 3584, 64, 64]
    - [1, 12991.8]
  - - [3648, 3776, 1, 64, 3648, 3648, 64, 64]
    - [0, 12747.5]
  - - [3712, 3776, 1, 64, 3712, 3712, 64, 64]
    - [1, 12254.7]
  - - [3776, 3776, 1, 64, 3776, 3776, 64, 64]
    - [1, 11926.2]
  - - [3840, 3776, 1, 64, 3840, 3840, 64, 64]
    - [12, 11957.6]
  - - [3904, 3776, 1, 64, 3904, 3904, 64, 64]
    - [12, 11859.2]
  - - [3968, 3776, 1, 64, 3968, 3968, 64, 64]
    - [12, 11914.6]
  - - [4032, 3776, 1, 64, 4032, 4032, 64, 64]
    - [12, 12233.8]
  - - [4096, 3776, 1, 64, 4096, 4096, 64, 64]
    - [8, 12781.7]
  - - [64, 3840, 1, 64, 64, 64, 64, 64]
    - [7, 3304.96]
  - - [128, 3840, 1, 64, 128, 128, 64, 64]
    - [9, 5644.51]
  - - [192, 3840, 1, 64, 192, 192, 64, 64]
    - [0, 7792.79]
  - - [256, 3840, 1, 64, 256, 256, 64, 64]
    - [4, 9411.2]
  - - [320, 3840, 1, 64, 320, 320, 64, 64]
    - [4, 10820.3]
  - - [384, 3840, 1, 64, 384, 384, 64, 64]
    - [4, 12112.8]
  - - [448, 3840, 1, 64, 448, 448, 64, 64]
    - [4, 13218.8]
  - - [512, 3840, 1, 64, 512, 512, 64, 64]
    - [4, 13880.6]
  - - [576, 3840, 1, 64, 576, 576, 64, 64]
    - [4, 14977.9]
  - - [640, 3840, 1, 64, 640, 640, 64, 64]
    - [4, 15686.1]
  - - [704, 3840, 1, 64, 704, 704, 64, 64]
    - [3, 16246.8]
  - - [768, 3840, 1, 64, 768, 768, 64, 64]
    - [4, 16674.7]
  - - [832, 3840, 1, 64, 832, 832, 64, 64]
    - [3, 17667.8]
  - - [896, 3840, 1, 64, 896, 896, 64, 64]
    - [4, 18463.7]
  - - [960, 3840, 1, 64, 960, 960, 64, 64]
    - [4, 18943.8]
  - - [1024, 3840, 1, 64, 1024, 1024, 64, 64]
    - [4, 18735.5]
  - - [1088, 3840, 1, 64, 1088, 1088, 64, 64]
    - [3, 19832.6]
  - - [1152, 3840, 1, 64, 1152, 1152, 64, 64]
    - [3, 20071.7]
  - - [1216, 3840, 1, 64, 1216, 1216, 64, 64]
    - [3, 20728.3]
  - - [1280, 3840, 1, 64, 1280, 1280, 64, 64]
    - [3, 21248.9]
  - - [1344, 3840, 1, 64, 1344, 1344, 64, 64]
    - [3, 21878.4]
  - - [1408, 3840, 1, 64, 1408, 1408, 64, 64]
    - [3, 21790.0]
  - - [1472, 3840, 1, 64, 1472, 1472, 64, 64]
    - [3, 22504.2]
  - - [1536, 3840, 1, 64, 1536, 1536, 64, 64]
    - [1, 20810.6]
  - - [1600, 3840, 1, 64, 1600, 1600, 64, 64]
    - [3, 23043.3]
  - - [1664, 3840, 1, 64, 1664, 1664, 64, 64]
    - [3, 23300.1]
  - - [1728, 3840, 1, 64, 1728, 1728, 64, 64]
    - [3, 23708.5]
  - - [1792, 3840, 1, 64, 1792, 1792, 64, 64]
    - [3, 24011.6]
  - - [1856, 3840, 1, 64, 1856, 1856, 64, 64]
    - [3, 23776.3]
  - - [1920, 3840, 1, 64, 1920, 1920, 64, 64]
    - [3, 23626.9]
  - - [1984, 3840, 1, 64, 1984, 1984, 64, 64]
    - [1, 24022.4]
  - - [2048, 3840, 1, 64, 2048, 2048, 64, 64]
    - [1, 22763.9]
  - - [2112, 3840, 1, 64, 2112, 2112, 64, 64]
    - [3, 24759.7]
  - - [2176, 3840, 1, 64, 2176, 2176, 64, 64]
    - [3, 25489.4]
  - - [2240, 3840, 1, 64, 2240, 2240, 64, 64]
    - [3, 25116.1]
  - - [2304, 3840, 1, 64, 2304, 2304, 64, 64]
    - [3, 24640.9]
  - - [2368, 3840, 1, 64, 2368, 2368, 64, 64]
    - [3, 26625.4]
  - - [2432, 3840, 1, 64, 2432, 2432, 64, 64]
    - [3, 26880.2]
  - - [2496, 3840, 1, 64, 2496, 2496, 64, 64]
    - [3, 26646.8]
  - - [2560, 3840, 1, 64, 2560, 2560, 64, 64]
    - [1, 24740.0]
  - - [2624, 3840, 1, 64, 2624, 2624, 64, 64]
    - [3, 26158.8]
  - - [2688, 3840, 1, 64, 2688, 2688, 64, 64]
    - [3, 27023.7]
  - - [2752, 3840, 1, 64, 2752, 2752, 64, 64]
    - [3, 26115.9]
  - - [2816, 3840, 1, 64, 2816, 2816, 64, 64]
    - [3, 27332.2]
  - - [2880, 3840, 1, 64, 2880, 2880, 64, 64]
    - [3, 27301.1]
  - - [2944, 3840, 1, 64, 2944, 2944, 64, 64]
    - [3, 26659.4]
  - - [3008, 3840, 1, 64, 3008, 3008, 64, 64]
    - [1, 26780.0]
  - - [3072, 3840, 1, 64, 3072, 3072, 64, 64]
    - [3, 24389.1]
  - - [3136, 3840, 1, 64, 3136, 3136, 64, 64]
    - [3, 25727.6]
  - - [3200, 3840, 1, 64, 3200, 3200, 64, 64]
    - [3, 24880.5]
  - - [3264, 3840, 1, 64, 3264, 3264, 64, 64]
    - [3, 25598.3]
  - - [3328, 3840, 1, 64, 3328, 3328, 64, 64]
    - [1, 24317.0]
  - - [3392, 3840, 1, 64, 3392, 3392, 64, 64]
    - [1, 19705.6]
  - - [3456, 3840, 1, 64, 3456, 3456, 64, 64]
    - [0, 15140.5]
  - - [3520, 3840, 1, 64, 3520, 3520, 64, 64]
    - [0, 13103.3]
  - - [3584, 3840, 1, 64, 3584, 3584, 64, 64]
    - [1, 12572.9]
  - - [3648, 3840, 1, 64, 3648, 3648, 64, 64]
    - [0, 12223.8]
  - - [3712, 3840, 1, 64, 3712, 3712, 64, 64]
    - [12, 12101.0]
  - - [3776, 3840, 1, 64, 3776, 3776, 64, 64]
    - [1, 11811.9]
  - - [3840, 3840, 1, 64, 3840, 3840, 64, 64]
    - [8, 11735.2]
  - - [3904, 3840, 1, 64, 3904, 3904, 64, 64]
    - [12, 11862.3]
  - - [3968, 3840, 1, 64, 3968, 3968, 64, 64]
    - [12, 12011.6]
  - - [4032, 3840, 1, 64, 4032, 4032, 64, 64]
    - [8, 12297.6]
  - - [4096, 3840, 1, 64, 4096, 4096, 64, 64]
    - [8, 12737.5]
  - - [64, 3904, 1, 64, 64, 64, 64, 64]
    - [7, 3355.14]
  - - [128, 3904, 1, 64, 128, 128, 64, 64]
    - [1, 6164.41]
  - - [192, 3904, 1, 64, 192, 192, 64, 64]
    - [1, 8103.37]
  - - [256, 3904, 1, 64, 256, 256, 64, 64]
    - [4, 9502.66]
  - - [320, 3904, 1, 64, 320, 320, 64, 64]
    - [4, 10961.5]
  - - [384, 3904, 1, 64, 384, 384, 64, 64]
    - [4, 12184.8]
  - - [448, 3904, 1, 64, 448, 448, 64, 64]
    - [4, 13304.9]
  - - [512, 3904, 1, 64, 512, 512, 64, 64]
    - [4, 13994.6]
  - - [576, 3904, 1, 64, 576, 576, 64, 64]
    - [4, 15125.1]
  - - [640, 3904, 1, 64, 640, 640, 64, 64]
    - [4, 15827.6]
  - - [704, 3904, 1, 64, 704, 704, 64, 64]
    - [4, 16356.3]
  - - [768, 3904, 1, 64, 768, 768, 64, 64]
    - [4, 16821.9]
  - - [832, 3904, 1, 64, 832, 832, 64, 64]
    - [3, 17852.7]
  - - [896, 3904, 1, 64, 896, 896, 64, 64]
    - [3, 18354.3]
  - - [960, 3904, 1, 64, 960, 960, 64, 64]
    - [3, 18968.7]
  - - [1024, 3904, 1, 64, 1024, 1024, 64, 64]
    - [4, 18738.0]
  - - [1088, 3904, 1, 64, 1088, 1088, 64, 64]
    - [3, 20007.3]
  - - [1152, 3904, 1, 64, 1152, 1152, 64, 64]
    - [4, 20268.3]
  - - [1216, 3904, 1, 64, 1216, 1216, 64, 64]
    - [3, 20934.4]
  - - [1280, 3904, 1, 64, 1280, 1280, 64, 64]
    - [3, 21426.4]
  - - [1344, 3904, 1, 64, 1344, 1344, 64, 64]
    - [3, 22057.4]
  - - [1408, 3904, 1, 64, 1408, 1408, 64, 64]
    - [3, 21781.5]
  - - [1472, 3904, 1, 64, 1472, 1472, 64, 64]
    - [3, 22376.7]
  - - [1536, 3904, 1, 64, 1536, 1536, 64, 64]
    - [1, 20971.2]
  - - [1600, 3904, 1, 64, 1600, 1600, 64, 64]
    - [3, 23013.3]
  - - [1664, 3904, 1, 64, 1664, 1664, 64, 64]
    - [3, 23269.4]
  - - [1728, 3904, 1, 64, 1728, 1728, 64, 64]
    - [3, 23685.9]
  - - [1792, 3904, 1, 64, 1792, 1792, 64, 64]
    - [3, 23711.1]
  - - [1856, 3904, 1, 64, 1856, 1856, 64, 64]
    - [3, 23731.0]
  - - [1920, 3904, 1, 64, 1920, 1920, 64, 64]
    - [3, 23712.0]
  - - [1984, 3904, 1, 64, 1984, 1984, 64, 64]
    - [3, 24008.7]
  - - [2048, 3904, 1, 64, 2048, 2048, 64, 64]
    - [1, 22953.3]
  - - [2112, 3904, 1, 64, 2112, 2112, 64, 64]
    - [3, 24901.6]
  - - [2176, 3904, 1, 64, 2176, 2176, 64, 64]
    - [3, 26174.9]
  - - [2240, 3904, 1, 64, 2240, 2240, 64, 64]
    - [3, 25137.9]
  - - [2304, 3904, 1, 64, 2304, 2304, 64, 64]
    - [3, 24379.0]
  - - [2368, 3904, 1, 64, 2368, 2368, 64, 64]
    - [3, 25439.7]
  - - [2432, 3904, 1, 64, 2432, 2432, 64, 64]
    - [3, 26002.1]
  - - [2496, 3904, 1, 64, 2496, 2496, 64, 64]
    - [3, 26841.4]
  - - [2560, 3904, 1, 64, 2560, 2560, 64, 64]
    - [3, 24952.1]
  - - [2624, 3904, 1, 64, 2624, 2624, 64, 64]
    - [3, 27209.5]
  - - [2688, 3904, 1, 64, 2688, 2688, 64, 64]
    - [3, 25321.6]
  - - [2752, 3904, 1, 64, 2752, 2752, 64, 64]
    - [3, 26688.2]
  - - [2816, 3904, 1, 64, 2816, 2816, 64, 64]
    - [3, 25754.4]
  - - [2880, 3904, 1, 64, 2880, 2880, 64, 64]
    - [1, 26063.1]
  - - [2944, 3904, 1, 64, 2944, 2944, 64, 64]
    - [3, 26763.5]
  - - [3008, 3904, 1, 64, 3008, 3008, 64, 64]
    - [3, 27076.4]
  - - [3072, 3904, 1, 64, 3072, 3072, 64, 64]
    - [3, 24574.1]
  - - [3136, 3904, 1, 64, 3136, 3136, 64, 64]
    - [3, 25696.5]
  - - [3200, 3904, 1, 64, 3200, 3200, 64, 64]
    - [0, 25316.8]
  - - [3264, 3904, 1, 64, 3264, 3264, 64, 64]
    - [3, 24705.2]
  - - [3328, 3904, 1, 64, 3328, 3328, 64, 64]
    - [1, 20144.6]
  - - [3392, 3904, 1, 64, 3392, 3392, 64, 64]
    - [1, 14884.9]
  - - [3456, 3904, 1, 64, 3456, 3456, 64, 64]
    - [0, 13440.4]
  - - [3520, 3904, 1, 64, 3520, 3520, 64, 64]
    - [1, 12673.0]
  - - [3584, 3904, 1, 64, 3584, 3584, 64, 64]
    - [1, 12177.7]
  - - [3648, 3904, 1, 64, 3648, 3648, 64, 64]
    - [1, 11969.6]
  - - [3712, 3904, 1, 64, 3712, 3712, 64, 64]
    - [12, 12155.5]
  - - [3776, 3904, 1, 64, 3776, 3776, 64, 64]
    - [1, 11503.9]
  - - [3840, 3904, 1, 64, 3840, 3840, 64, 64]
    - [8, 11815.1]
  - - [3904, 3904, 1, 64, 3904, 3904, 64, 64]
    - [12, 12050.2]
  - - [3968, 3904, 1, 64, 3968, 3968, 64, 64]
    - [8, 12240.2]
  - - [4032, 3904, 1, 64, 4032, 4032, 64, 64]
    - [12, 12149.7]
  - - [4096, 3904, 1, 64, 4096, 4096, 64, 64]
    - [8, 12753.1]
  - - [64, 3968, 1, 64, 64, 64, 64, 64]
    - [6, 3425.96]
  - - [128, 3968, 1, 64, 128, 128, 64, 64]
    - [3, 6213.99]
  - - [192, 3968, 1, 64, 192, 192, 64, 64]
    - [1, 8167.16]
  - - [256, 3968, 1, 64, 256, 256, 64, 64]
    - [4, 9595.72]
  - - [320, 3968, 1, 64, 320, 320, 64, 64]
    - [4, 11047.2]
  - - [384, 3968, 1, 64, 384, 384, 64, 64]
    - [4, 12264.7]
  - - [448, 3968, 1, 64, 448, 448, 64, 64]
    - [4, 13397.2]
  - - [512, 3968, 1, 64, 512, 512, 64, 64]
    - [4, 14179.0]
  - - [576, 3968, 1, 64, 576, 576, 64, 64]
    - [4, 15203.7]
  - - [640, 3968, 1, 64, 640, 640, 64, 64]
    - [4, 15935.6]
  - - [704, 3968, 1, 64, 704, 704, 64, 64]
    - [3, 16462.3]
  - - [768, 3968, 1, 64, 768, 768, 64, 64]
    - [4, 16899.1]
  - - [832, 3968, 1, 64, 832, 832, 64, 64]
    - [3, 17935.9]
  - - [896, 3968, 1, 64, 896, 896, 64, 64]
    - [3, 18388.5]
  - - [960, 3968, 1, 64, 960, 960, 64, 64]
    - [3, 19126.8]
  - - [1024, 3968, 1, 64, 1024, 1024, 64, 64]
    - [6, 18946.7]
  - - [1088, 3968, 1, 64, 1088, 1088, 64, 64]
    - [3, 20036.0]
  - - [1152, 3968, 1, 64, 1152, 1152, 64, 64]
    - [3, 20348.4]
  - - [1216, 3968, 1, 64, 1216, 1216, 64, 64]
    - [3, 21084.4]
  - - [1280, 3968, 1, 64, 1280, 1280, 64, 64]
    - [3, 21421.8]
  - - [1344, 3968, 1, 64, 1344, 1344, 64, 64]
    - [3, 22126.9]
  - - [1408, 3968, 1, 64, 1408, 1408, 64, 64]
    - [3, 21890.5]
  - - [1472, 3968, 1, 64, 1472, 1472, 64, 64]
    - [3, 22814.3]
  - - [1536, 3968, 1, 64, 1536, 1536, 64, 64]
    - [1, 21562.5]
  - - [1600, 3968, 1, 64, 1600, 1600, 64, 64]
    - [3, 23199.6]
  - - [1664, 3968, 1, 64, 1664, 1664, 64, 64]
    - [3, 23733.2]
  - - [1728, 3968, 1, 64, 1728, 1728, 64, 64]
    - [3, 23646.0]
  - - [1792, 3968, 1, 64, 1792, 1792, 64, 64]
    - [3, 23863.5]
  - - [1856, 3968, 1, 64, 1856, 1856, 64, 64]
    - [3, 23884.1]
  - - [1920, 3968, 1, 64, 1920, 1920, 64, 64]
    - [3, 24067.4]
  - - [1984, 3968, 1, 64, 1984, 1984, 64, 64]
    - [3, 24378.7]
  - - [2048, 3968, 1, 64, 2048, 2048, 64, 64]
    - [3, 22944.7]
  - - [2112, 3968, 1, 64, 2112, 2112, 64, 64]
    - [3, 24458.0]
  - - [2176, 3968, 1, 64, 2176, 2176, 64, 64]
    - [3, 25889.9]
  - - [2240, 3968, 1, 64, 2240, 2240, 64, 64]
    - [3, 24383.6]
  - - [2304, 3968, 1, 64, 2304, 2304, 64, 64]
    - [3, 24975.4]
  - - [2368, 3968, 1, 64, 2368, 2368, 64, 64]
    - [3, 26395.9]
  - - [2432, 3968, 1, 64, 2432, 2432, 64, 64]
    - [3, 25017.4]
  - - [2496, 3968, 1, 64, 2496, 2496, 64, 64]
    - [3, 25806.4]
  - - [2560, 3968, 1, 64, 2560, 2560, 64, 64]
    - [1, 24863.6]
  - - [2624, 3968, 1, 64, 2624, 2624, 64, 64]
    - [3, 26062.4]
  - - [2688, 3968, 1, 64, 2688, 2688, 64, 64]
    - [3, 25852.7]
  - - [2752, 3968, 1, 64, 2752, 2752, 64, 64]
    - [3, 26193.5]
  - - [2816, 3968, 1, 64, 2816, 2816, 64, 64]
    - [3, 25755.2]
  - - [2880, 3968, 1, 64, 2880, 2880, 64, 64]
    - [3, 25876.5]
  - - [2944, 3968, 1, 64, 2944, 2944, 64, 64]
    - [3, 26559.5]
  - - [3008, 3968, 1, 64, 3008, 3008, 64, 64]
    - [3, 25517.9]
  - - [3072, 3968, 1, 64, 3072, 3072, 64, 64]
    - [1, 24571.8]
  - - [3136, 3968, 1, 64, 3136, 3136, 64, 64]
    - [1, 25359.3]
  - - [3200, 3968, 1, 64, 3200, 3200, 64, 64]
    - [1, 25117.0]
  - - [3264, 3968, 1, 64, 3264, 3264, 64, 64]
    - [1, 21582.9]
  - - [3328, 3968, 1, 64, 3328, 3328, 64, 64]
    - [0, 15639.8]
  - - [3392, 3968, 1, 64, 3392, 3392, 64, 64]
    - [0, 13130.8]
  - - [3456, 3968, 1, 64, 3456, 3456, 64, 64]
    - [0, 12887.3]
  - - [3520, 3968, 1, 64, 3520, 3520, 64, 64]
    - [1, 12288.5]
  - - [3584, 3968, 1, 64, 3584, 3584, 64, 64]
    - [12, 12107.4]
  - - [3648, 3968, 1, 64, 3648, 3648, 64, 64]
    - [12, 12010.2]
  - - [3712, 3968, 1, 64, 3712, 3712, 64, 64]
    - [12, 12020.9]
