library/src/amd_detail/rocblaslt/src/Tensile/Logic/asm_full/navi31/GridBased/navi31_Cijk_Alik_Bljk_BSS_BH_Bias_HAS_SAV_UserArgs.yaml
- {MinimumRequiredVersion: 4.33.0}
- navi31
- gfx1100
- [Device 73f0]
    SolutionIndex: 0
    SolutionNameMin: Cijk_Alik_Bljk_BSS_BH_Bias_HAS_SAV_UserArgs_MT32x32x32_MI16x16x1_SN_LDSB0_GRVWA8_GRVWB8_GSU1_LBSPPA128_LBSPPB128_MIWT1_1_SS0_SU32_SUM0_SUS256_TLDS1_WG32_4_1_WGM8
    SolutionIndex: 1
    SolutionNameMin: Cijk_Alik_Bljk_BSS_BH_Bias_HAS_SAV_UserArgs_MT32x32x32_MI16x16x1_SN_LDSB0_GRVWA8_GRVWB8_GSU1_LBSPPA128_LBSPPB128_MIWT1_1_SS1_SU32_SUM0_SUS256_TLDS1_WG32_4_1_WGM8
    SolutionIndex: 2
    SolutionNameMin: Cijk_Alik_Bljk_BSS_BH_Bias_HAS_SAV_UserArgs_MT32x96x32_MI16x16x1_SN_LDSB0_GRVWA8_GRVWB8_GSU1_LBSPPA128_LBSPPB128_MIWT1_3_SS1_SU32_SUM0_SUS256_TLDS1_WG32_4_1_WGM8
    SolutionIndex: 3
    SolutionNameMin: Cijk_Alik_Bljk_BSS_BH_Bias_HAS_SAV_UserArgs_MT96x96x32_MI16x16x1_SN_LDSB0_GRVWA8_GRVWB8_GSU1_LBSPPA128_LBSPPB128_MIWT3_3_SS1_SU32_SUM0_SUS256_TLDS1_WG32_4_1_WGM8
    SolutionIndex: 4
    SolutionNameMin: Cijk_Alik_Bljk_BSS_BH_Bias_HAS_SAV_UserArgs_MT64x16x64_MI16x16x1_SN_LDSB0_GRVWA8_GRVWB8_GSU1_LBSPPA2048_LBSPPB512_MIWT1_1_SS1_SU32_SUM0_SUS256_TLDS0_WG64_2_1_WGM8
- - - [64, 64, 1, 64, 64, 64, 64, 64]
    - [1, 92.381]
  - - [128, 128, 1, 128, 128, 128, 128, 128]
    - [0, 703.631]
  - - [256, 256, 1, 256, 256, 256, 256, 256]
    - [4, 4858.63]
  - - [512, 512, 1, 512, 512, 512, 512, 512]
    - [2, 20964.1]
  - - [1024, 1024, 1, 1024, 1024, 1024, 1024, 1024]
    - [3, 58387.0]
  - - [1536, 1536, 1, 1536, 1536, 1536, 1536, 1536]
    - [3, 56343.4]
  - - [2048, 2048, 1, 2048, 2048, 2048, 2048, 2048]
    - [3, 68911.1]
  - - [2560, 2560, 1, 2560, 2560, 2560, 2560, 2560]
    - [3, 77665.2]
  - - [3072, 3072, 1, 3072, 3072, 3072, 3072, 3072]
    - [3, 76517.7]
  - - [3584, 3584, 1, 3584, 3584, 3584, 3584, 3584]
    - [3, 77751.3]
  - - [4096, 4096, 1, 4096, 4096, 4096, 4096, 4096]
    - [3, 81307.7]
- null
- null
- DeviceEfficiency
- GridBased
