library/src/amd_detail/rocblaslt/src/Tensile/Logic/asm_full/navi31/GridBased/navi31_Cijk_Ailk_Bjlk_HSS_BH_Bias_HAS_SAV_UserArgs.yaml
- {MinimumRequiredVersion: 4.33.0}
- navi31
- gfx1100
- [Device 73f0]
    SolutionIndex: 0
    SolutionNameMin: Cijk_Ailk_Bjlk_HSS_BH_Bias_HAS_SAV_UserArgs_MT64x96x32_MI16x16x1_SN_LDSB0_GRVWA2_GRVWB8_GSU1_LBSPPA2048_LBSPPB3072_MIWT2_3_NLCA1_NLCB3_SS0_SU32_SUM0_SUS256_WG32_4_1_WGM8
    SolutionIndex: 1
    SolutionNameMin: Cijk_Ailk_Bjlk_HSS_BH_Bias_HAS_SAV_UserArgs_MT48x128x32_MI16x16x1_SN_LDSB0_GRVWA2_GRVWB8_GSU1_LBSPPA1536_LBSPPB4096_MIWT3_2_NLCA3_NLCB1_SS0_SU32_SUM0_SUS256_WG16_8_1_WGM8
    SolutionIndex: 2
    SolutionNameMin: Cijk_Ailk_Bjlk_HSS_BH_Bias_HAS_SAV_UserArgs_MT64x16x32_MI16x16x1_SN_LDSB0_GRVWA8_GRVWB2_GSU1_LBSPPA2048_LBSPPB512_MIWT1_1_NLCA1_NLCB1_SS1_SU32_SUM0_SUS256_WG64_2_1_WGM8
    SolutionIndex: 3
    SolutionNameMin: Cijk_Ailk_Bjlk_HSS_BH_Bias_HAS_SAV_UserArgs_MT128x48x32_MI16x16x1_SN_LDSB0_GRVWA8_GRVWB2_GSU1_LBSPPA4096_LBSPPB1536_MIWT2_3_NLCA1_NLCB3_SS1_SU32_SUM0_SUS256_WG64_2_1_WGM8
    SolutionIndex: 4
    SolutionNameMin: Cijk_Ailk_Bjlk_HSS_BH_Bias_HAS_SAV_UserArgs_MT64x96x32_MI16x16x1_SN_LDSB0_GRVWA8_GRVWB2_GSU1_LBSPPA2048_LBSPPB3072_MIWT2_3_NLCA1_NLCB3_SS1_SU32_SUM0_SUS256_WG32_4_1_WGM8
    SolutionIndex: 5
    SolutionNameMin: Cijk_Ailk_Bjlk_HSS_BH_Bias_HAS_SAV_UserArgs_MT32x32x64_MI16x16x1_SN_LDSB0_GRVWA8_GRVWB2_GSU1_LBSPPA1024_LBSPPB1024_MIWT1_1_NLCA1_NLCB1_SS1_SU32_SUM0_SUS256_WG32_4_1_WGM8
    SolutionIndex: 6
    SolutionNameMin: Cijk_Ailk_Bjlk_HSS_BH_Bias_HAS_SAV_UserArgs_MT64x32x64_MI16x16x1_SN_LDSB0_GRVWA8_GRVWB2_GSU1_LBSPPA2048_LBSPPB1024_MIWT2_1_NLCA1_NLCB1_SS1_SU32_SUM0_SUS256_WG32_4_1_WGM8
- - - [64, 64, 1, 64, 64, 64, 64, 64]
    - [2, 92.1418]
  - - [128, 128, 1, 128, 128, 128, 128, 128]
    - [2, 714.347]
  - - [256, 256, 1, 256, 256, 256, 256, 256]
    - [5, 5213.1]
  - - [512, 512, 1, 512, 512, 512, 512, 512]
    - [6, 20660.9]
  - - [1024, 1024, 1, 1024, 1024, 1024, 1024, 1024]
    - [3, 50357.5]
  - - [1536, 1536, 1, 1536, 1536, 1536, 1536, 1536]
    - [3, 64785.0]
  - - [2048, 2048, 1, 2048, 2048, 2048, 2048, 2048]
    - [4, 65642.9]
  - - [2560, 2560, 1, 2560, 2560, 2560, 2560, 2560]
    - [4, 67391.3]
  - - [3072, 3072, 1, 3072, 3072, 3072, 3072, 3072]
    - [0, 67260.7]
  - - [3584, 3584, 1, 3584, 3584, 3584, 3584, 3584]
    - [1, 68105.9]
  - - [4096, 4096, 1, 4096, 4096, 4096, 4096, 4096]
    - [0, 68535.4]
- null
- null
- DeviceEfficiency
- GridBased
