library/src/amd_detail/rocblaslt/src/Tensile/Logic/asm_full/navi31/GridBased/navi31_Cijk_Ailk_Bjlk_HSS_BH_Bias_HAH.yaml
- {MinimumRequiredVersion: 4.33.0}
- navi31
- gfx1100
- [Device 73f0]
    SolutionIndex: 0
    SolutionNameMin: Cijk_Ailk_Bjlk_HSS_BH_Bias_HAH_MT32x32x64_MI16x16x16x1_SN_MIWT1_1_WG32_4_1
    SolutionIndex: 1
    SolutionNameMin: Cijk_Ailk_Bjlk_HSS_BH_Bias_HAH_MT16x16x64_MI16x16x16x1_SN_MIWT1_1_WG16_2_1
    SolutionIndex: 2
    SolutionNameMin: Cijk_Ailk_Bjlk_HSS_BH_Bias_HAH_MT32x16x64_MI16x16x16x1_SN_MIWT1_1_WG32_2_1
    SolutionIndex: 3
    SolutionNameMin: Cijk_Ailk_Bjlk_HSS_BH_Bias_HAH_MT16x32x64_MI16x16x16x1_SN_MIWT1_1_WG16_4_1
- - - [64, 64, 1, 64, 64, 64, 64, 64]
    - [2, 0.091]
  - - [192, 64, 1, 64, 192, 192, 192, 64]
    - [2, 0.273]
  - - [320, 64, 1, 64, 320, 320, 320, 64]
    - [2, 0.447]
  - - [448, 64, 1, 64, 448, 448, 448, 64]
    - [0, 0.618]
  - - [576, 64, 1, 64, 576, 576, 576, 64]
    - [0, 0.779]
  - - [704, 64, 1, 64, 704, 704, 704, 64]
    - [0, 0.944]
  - - [832, 64, 1, 64, 832, 832, 832, 64]
    - [2, 1.075]
  - - [960, 64, 1, 64, 960, 960, 960, 64]
    - [2, 1.233]
  - - [1088, 64, 1, 64, 1088, 1088, 1088, 64]
    - [2, 1.393]
  - - [1216, 64, 1, 64, 1216, 1216, 1216, 64]
    - [0, 1.548]
  - - [1344, 64, 1, 64, 1344, 1344, 1344, 64]
    - [0, 1.707]
  - - [1472, 64, 1, 64, 1472, 1472, 1472, 64]
    - [0, 1.865]
  - - [1600, 64, 1, 64, 1600, 1600, 1600, 64]
    - [0, 1.967]
  - - [1728, 64, 1, 64, 1728, 1728, 1728, 64]
    - [0, 2.123]
  - - [1856, 64, 1, 64, 1856, 1856, 1856, 64]
    - [0, 2.265]
  - - [1984, 64, 1, 64, 1984, 1984, 1984, 64]
    - [0, 2.414]
  - - [2112, 64, 1, 64, 2112, 2112, 2112, 64]
    - [0, 2.565]
  - - [2240, 64, 1, 64, 2240, 2240, 2240, 64]
    - [0, 2.717]
  - - [2368, 64, 1, 64, 2368, 2368, 2368, 64]
    - [0, 2.781]
  - - [2496, 64, 1, 64, 2496, 2496, 2496, 64]
    - [0, 2.93]
  - - [2624, 64, 1, 64, 2624, 2624, 2624, 64]
    - [0, 3.055]
  - - [2752, 64, 1, 64, 2752, 2752, 2752, 64]
    - [0, 3.199]
  - - [2880, 64, 1, 64, 2880, 2880, 2880, 64]
    - [0, 3.351]
  - - [3008, 64, 1, 64, 3008, 3008, 3008, 64]
    - [0, 3.492]
  - - [3136, 64, 1, 64, 3136, 3136, 3136, 64]
    - [0, 3.549]
  - - [3264, 64, 1, 64, 3264, 3264, 3264, 64]
    - [0, 3.617]
  - - [3392, 64, 1, 64, 3392, 3392, 3392, 64]
    - [0, 3.75]
  - - [3520, 64, 1, 64, 3520, 3520, 3520, 64]
    - [0, 3.869]
  - - [3648, 64, 1, 64, 3648, 3648, 3648, 64]
    - [0, 4.021]
  - - [3776, 64, 1, 64, 3776, 3776, 3776, 64]
    - [0, 4.076]
  - - [3904, 64, 1, 64, 3904, 3904, 3904, 64]
    - [0, 3.711]
  - - [4032, 64, 1, 64, 4032, 4032, 4032, 64]
    - [0, 3.65]
  - - [64, 192, 1, 64, 64, 64, 64, 192]
    - [2, 0.256]
  - - [192, 192, 1, 64, 192, 192, 192, 192]
    - [0, 0.757]
  - - [320, 192, 1, 64, 320, 320, 320, 192]
    - [0, 1.188]
  - - [448, 192, 1, 64, 448, 448, 448, 192]
    - [0, 1.662]
  - - [576, 192, 1, 64, 576, 576, 576, 192]
    - [0, 2.029]
  - - [704, 192, 1, 64, 704, 704, 704, 192]
    - [0, 2.473]
  - - [832, 192, 1, 64, 832, 832, 832, 192]
    - [0, 2.81]
  - - [960, 192, 1, 64, 960, 960, 960, 192]
    - [0, 3.216]
  - - [1088, 192, 1, 64, 1088, 1088, 1088, 192]
    - [0, 3.505]
  - - [1216, 192, 1, 64, 1216, 1216, 1216, 192]
    - [0, 3.884]
  - - [1344, 192, 1, 64, 1344, 1344, 1344, 192]
    - [0, 3.673]
  - - [1472, 192, 1, 64, 1472, 1472, 1472, 192]
    - [0, 3.992]
  - - [1600, 192, 1, 64, 1600, 1600, 1600, 192]
    - [0, 4.198]
  - - [1728, 192, 1, 64, 1728, 1728, 1728, 192]
    - [0, 4.426]
  - - [1856, 192, 1, 64, 1856, 1856, 1856, 192]
    - [0, 4.651]
  - - [1984, 192, 1, 64, 1984, 1984, 1984, 192]
    - [0, 4.83]
  - - [2112, 192, 1, 64, 2112, 2112, 2112, 192]
    - [0, 5.076]
  - - [2240, 192, 1, 64, 2240, 2240, 2240, 192]
    - [0, 5.298]
  - - [2368, 192, 1, 64, 2368, 2368, 2368, 192]
    - [0, 5.471]
  - - [2496, 192, 1, 64, 2496, 2496, 2496, 192]
    - [0, 5.707]
  - - [2624, 192, 1, 64, 2624, 2624, 2624, 192]
    - [0, 5.567]
  - - [2752, 192, 1, 64, 2752, 2752, 2752, 192]
    - [0, 5.784]
  - - [2880, 192, 1, 64, 2880, 2880, 2880, 192]
    - [0, 5.904]
  - - [3008, 192, 1, 64, 3008, 3008, 3008, 192]
    - [0, 6.103]
  - - [3136, 192, 1, 64, 3136, 3136, 3136, 192]
    - [0, 6.059]
  - - [3264, 192, 1, 64, 3264, 3264, 3264, 192]
    - [0, 6.116]
  - - [3392, 192, 1, 64, 3392, 3392, 3392, 192]
    - [0, 6.19]
  - - [3520, 192, 1, 64, 3520, 3520, 3520, 192]
    - [0, 6.261]
  - - [3648, 192, 1, 64, 3648, 3648, 3648, 192]
    - [0, 6.213]
  - - [3776, 192, 1, 64, 3776, 3776, 3776, 192]
    - [0, 5.963]
  - - [3904, 192, 1, 64, 3904, 3904, 3904, 192]
    - [0, 6.211]
  - - [4032, 192, 1, 64, 4032, 4032, 4032, 192]
    - [0, 6.133]
  - - [64, 320, 1, 64, 64, 64, 64, 320]
    - [2, 0.424]
  - - [192, 320, 1, 64, 192, 192, 192, 320]
    - [2, 1.194]
  - - [320, 320, 1, 64, 320, 320, 320, 320]
    - [2, 1.891]
  - - [448, 320, 1, 64, 448, 448, 448, 320]
    - [0, 2.622]
  - - [576, 320, 1, 64, 576, 576, 576, 320]
    - [0, 3.211]
  - - [704, 320, 1, 64, 704, 704, 704, 320]
    - [0, 3.764]
  - - [832, 320, 1, 64, 832, 832, 832, 320]
    - [0, 3.732]
  - - [960, 320, 1, 64, 960, 960, 960, 320]
    - [0, 4.208]
  - - [1088, 320, 1, 64, 1088, 1088, 1088, 320]
    - [0, 4.535]
  - - [1216, 320, 1, 64, 1216, 1216, 1216, 320]
    - [0, 4.947]
  - - [1344, 320, 1, 64, 1344, 1344, 1344, 320]
    - [3, 3.384]
  - - [1472, 320, 1, 64, 1472, 1472, 1472, 320]
    - [0, 3.698]
  - - [1600, 320, 1, 64, 1600, 1600, 1600, 320]
    - [0, 4.025]
  - - [1728, 320, 1, 64, 1728, 1728, 1728, 320]
    - [0, 4.338]
  - - [1856, 320, 1, 64, 1856, 1856, 1856, 320]
    - [3, 4.659]
  - - [1984, 320, 1, 64, 1984, 1984, 1984, 320]
    - [0, 4.971]
  - - [2112, 320, 1, 64, 2112, 2112, 2112, 320]
    - [0, 5.307]
  - - [2240, 320, 1, 64, 2240, 2240, 2240, 320]
    - [1, 5.634]
  - - [2368, 320, 1, 64, 2368, 2368, 2368, 320]
    - [2, 6.003]
  - - [2496, 320, 1, 64, 2496, 2496, 2496, 320]
    - [3, 6.351]
  - - [2624, 320, 1, 64, 2624, 2624, 2624, 320]
    - [2, 6.64]
  - - [2752, 320, 1, 64, 2752, 2752, 2752, 320]
    - [0, 7.092]
  - - [2880, 320, 1, 64, 2880, 2880, 2880, 320]
    - [0, 7.275]
  - - [3008, 320, 1, 64, 3008, 3008, 3008, 320]
    - [0, 7.339]
  - - [3136, 320, 1, 64, 3136, 3136, 3136, 320]
    - [0, 7.425]
  - - [3264, 320, 1, 64, 3264, 3264, 3264, 320]
    - [0, 7.518]
  - - [3392, 320, 1, 64, 3392, 3392, 3392, 320]
    - [0, 7.6]
  - - [3520, 320, 1, 64, 3520, 3520, 3520, 320]
    - [0, 7.714]
  - - [3648, 320, 1, 64, 3648, 3648, 3648, 320]
    - [0, 7.831]
  - - [3776, 320, 1, 64, 3776, 3776, 3776, 320]
    - [0, 7.802]
  - - [3904, 320, 1, 64, 3904, 3904, 3904, 320]
    - [0, 7.912]
  - - [4032, 320, 1, 64, 4032, 4032, 4032, 320]
    - [0, 8.038]
  - - [64, 448, 1, 64, 64, 64, 64, 448]
    - [0, 0.609]
  - - [192, 448, 1, 64, 192, 192, 192, 448]
    - [0, 1.693]
  - - [320, 448, 1, 64, 320, 320, 320, 448]
    - [0, 2.679]
  - - [448, 448, 1, 64, 448, 448, 448, 448]
    - [0, 3.489]
  - - [576, 448, 1, 64, 576, 576, 576, 448]
    - [0, 3.744]
  - - [704, 448, 1, 64, 704, 704, 704, 448]
    - [0, 4.411]
  - - [832, 448, 1, 64, 832, 832, 832, 448]
    - [0, 4.963]
  - - [960, 448, 1, 64, 960, 960, 960, 448]
    - [0, 5.333]
  - - [1088, 448, 1, 64, 1088, 1088, 1088, 448]
    - [0, 5.918]
  - - [1216, 448, 1, 64, 1216, 1216, 1216, 448]
    - [0, 5.988]
  - - [1344, 448, 1, 64, 1344, 1344, 1344, 448]
    - [0, 6.208]
  - - [1472, 448, 1, 64, 1472, 1472, 1472, 448]
    - [0, 6.529]
  - - [1600, 448, 1, 64, 1600, 1600, 1600, 448]
    - [0, 6.702]
  - - [1728, 448, 1, 64, 1728, 1728, 1728, 448]
    - [0, 6.793]
  - - [1856, 448, 1, 64, 1856, 1856, 1856, 448]
    - [0, 6.961]
  - - [1984, 448, 1, 64, 1984, 1984, 1984, 448]
    - [0, 7.112]
  - - [2112, 448, 1, 64, 2112, 2112, 2112, 448]
    - [0, 7.312]
  - - [2240, 448, 1, 64, 2240, 2240, 2240, 448]
    - [0, 7.374]
  - - [2368, 448, 1, 64, 2368, 2368, 2368, 448]
    - [0, 7.571]
  - - [2496, 448, 1, 64, 2496, 2496, 2496, 448]
    - [0, 7.721]
  - - [2624, 448, 1, 64, 2624, 2624, 2624, 448]
    - [0, 7.819]
  - - [2752, 448, 1, 64, 2752, 2752, 2752, 448]
    - [0, 7.926]
  - - [2880, 448, 1, 64, 2880, 2880, 2880, 448]
    - [0, 8.015]
  - - [3008, 448, 1, 64, 3008, 3008, 3008, 448]
    - [0, 8.073]
  - - [3136, 448, 1, 64, 3136, 3136, 3136, 448]
    - [0, 8.245]
  - - [3264, 448, 1, 64, 3264, 3264, 3264, 448]
    - [0, 8.313]
  - - [3392, 448, 1, 64, 3392, 3392, 3392, 448]
    - [0, 8.347]
  - - [3520, 448, 1, 64, 3520, 3520, 3520, 448]
    - [0, 8.413]
  - - [3648, 448, 1, 64, 3648, 3648, 3648, 448]
    - [0, 8.541]
  - - [3776, 448, 1, 64, 3776, 3776, 3776, 448]
    - [0, 8.459]
  - - [3904, 448, 1, 64, 3904, 3904, 3904, 448]
    - [0, 8.632]
  - - [4032, 448, 1, 64, 4032, 4032, 4032, 448]
    - [0, 8.733]
  - - [64, 576, 1, 64, 64, 64, 64, 576]
    - [2, 0.151]
  - - [192, 576, 1, 64, 192, 192, 192, 576]
    - [0, 0.455]
  - - [320, 576, 1, 64, 320, 320, 320, 576]
    - [2, 0.76]
  - - [448, 576, 1, 64, 448, 448, 448, 576]
    - [2, 1.062]
  - - [576, 576, 1, 64, 576, 576, 576, 576]
    - [2, 2.618]
  - - [704, 576, 1, 64, 704, 704, 704, 576]
    - [2, 1.67]
  - - [832, 576, 1, 64, 832, 832, 832, 576]
    - [0, 1.965]
  - - [960, 576, 1, 64, 960, 960, 960, 576]
    - [0, 4.402]
  - - [1088, 576, 1, 64, 1088, 1088, 1088, 576]
    - [3, 4.956]
  - - [1216, 576, 1, 64, 1216, 1216, 1216, 576]
    - [0, 5.562]
  - - [1344, 576, 1, 64, 1344, 1344, 1344, 576]
    - [0, 6.164]
  - - [1472, 576, 1, 64, 1472, 1472, 1472, 576]
    - [0, 6.718]
  - - [1600, 576, 1, 64, 1600, 1600, 1600, 576]
    - [0, 7.211]
  - - [1728, 576, 1, 64, 1728, 1728, 1728, 576]
    - [0, 7.42]
  - - [1856, 576, 1, 64, 1856, 1856, 1856, 576]
    - [0, 7.605]
  - - [1984, 576, 1, 64, 1984, 1984, 1984, 576]
    - [0, 7.773]
  - - [2112, 576, 1, 64, 2112, 2112, 2112, 576]
    - [0, 7.976]
  - - [2240, 576, 1, 64, 2240, 2240, 2240, 576]
    - [0, 8.027]
  - - [2368, 576, 1, 64, 2368, 2368, 2368, 576]
    - [0, 8.14]
  - - [2496, 576, 1, 64, 2496, 2496, 2496, 576]
    - [0, 8.295]
  - - [2624, 576, 1, 64, 2624, 2624, 2624, 576]
    - [0, 8.402]
  - - [2752, 576, 1, 64, 2752, 2752, 2752, 576]
    - [0, 8.529]
  - - [2880, 576, 1, 64, 2880, 2880, 2880, 576]
    - [0, 8.607]
  - - [3008, 576, 1, 64, 3008, 3008, 3008, 576]
    - [0, 8.674]
  - - [3136, 576, 1, 64, 3136, 3136, 3136, 576]
    - [0, 8.782]
  - - [3264, 576, 1, 64, 3264, 3264, 3264, 576]
    - [0, 8.838]
  - - [3392, 576, 1, 64, 3392, 3392, 3392, 576]
    - [0, 8.906]
  - - [3520, 576, 1, 64, 3520, 3520, 3520, 576]
    - [0, 8.983]
  - - [3648, 576, 1, 64, 3648, 3648, 3648, 576]
    - [0, 9.081]
  - - [3776, 576, 1, 64, 3776, 3776, 3776, 576]
    - [0, 9.041]
  - - [3904, 576, 1, 64, 3904, 3904, 3904, 576]
    - [0, 9.16]
  - - [4032, 576, 1, 64, 4032, 4032, 4032, 576]
    - [0, 9.231]
  - - [64, 704, 1, 64, 64, 64, 64, 704]
    - [0, 0.951]
  - - [192, 704, 1, 64, 192, 192, 192, 704]
    - [0, 2.537]
  - - [320, 704, 1, 64, 320, 320, 320, 704]
    - [0, 3.878]
  - - [448, 704, 1, 64, 448, 448, 448, 704]
    - [0, 4.371]
  - - [576, 704, 1, 64, 576, 576, 576, 704]
    - [0, 5.195]
  - - [704, 704, 1, 64, 704, 704, 704, 704]
    - [0, 5.632]
  - - [832, 704, 1, 64, 832, 832, 832, 704]
    - [0, 6.232]
  - - [960, 704, 1, 64, 960, 960, 960, 704]
    - [0, 6.572]
  - - [1088, 704, 1, 64, 1088, 1088, 1088, 704]
    - [0, 6.779]
  - - [1216, 704, 1, 64, 1216, 1216, 1216, 704]
    - [0, 7.036]
  - - [1344, 704, 1, 64, 1344, 1344, 1344, 704]
    - [0, 7.304]
  - - [1472, 704, 1, 64, 1472, 1472, 1472, 704]
    - [0, 7.503]
  - - [1600, 704, 1, 64, 1600, 1600, 1600, 704]
    - [0, 7.725]
  - - [1728, 704, 1, 64, 1728, 1728, 1728, 704]
    - [0, 7.952]
  - - [1856, 704, 1, 64, 1856, 1856, 1856, 704]
    - [0, 8.056]
  - - [1984, 704, 1, 64, 1984, 1984, 1984, 704]
    - [0, 8.227]
  - - [2112, 704, 1, 64, 2112, 2112, 2112, 704]
    - [0, 8.418]
  - - [2240, 704, 1, 64, 2240, 2240, 2240, 704]
    - [0, 8.506]
  - - [2368, 704, 1, 64, 2368, 2368, 2368, 704]
    - [0, 8.613]
  - - [2496, 704, 1, 64, 2496, 2496, 2496, 704]
    - [0, 8.734]
  - - [2624, 704, 1, 64, 2624, 2624, 2624, 704]
    - [0, 8.823]
  - - [2752, 704, 1, 64, 2752, 2752, 2752, 704]
    - [0, 8.896]
  - - [2880, 704, 1, 64, 2880, 2880, 2880, 704]
    - [0, 8.979]
  - - [3008, 704, 1, 64, 3008, 3008, 3008, 704]
    - [0, 9.06]
  - - [3136, 704, 1, 64, 3136, 3136, 3136, 704]
    - [0, 9.114]
  - - [3264, 704, 1, 64, 3264, 3264, 3264, 704]
    - [0, 9.2]
  - - [3392, 704, 1, 64, 3392, 3392, 3392, 704]
    - [0, 9.234]
  - - [3520, 704, 1, 64, 3520, 3520, 3520, 704]
    - [0, 9.321]
  - - [3648, 704, 1, 64, 3648, 3648, 3648, 704]
    - [0, 9.395]
  - - [3776, 704, 1, 64, 3776, 3776, 3776, 704]
    - [0, 9.42]
  - - [3904, 704, 1, 64, 3904, 3904, 3904, 704]
    - [0, 9.703]
  - - [4032, 704, 1, 64, 4032, 4032, 4032, 704]
    - [0, 9.517]
  - - [64, 832, 1, 64, 64, 64, 64, 832]
    - [0, 0.22]
  - - [192, 832, 1, 64, 192, 192, 192, 832]
    - [3, 0.661]
  - - [320, 832, 1, 64, 320, 320, 320, 832]
    - [3, 1.097]
  - - [448, 832, 1, 64, 448, 448, 448, 832]
    - [0, 1.536]
  - - [576, 832, 1, 64, 576, 576, 576, 832]
    - [1, 3.802]
  - - [704, 832, 1, 64, 704, 704, 704, 832]
    - [1, 5.5]
  - - [832, 832, 1, 64, 832, 832, 832, 832]
    - [2, 5.493]
  - - [960, 832, 1, 64, 960, 960, 960, 832]
    - [3, 6.388]
  - - [1088, 832, 1, 64, 1088, 1088, 1088, 832]
    - [0, 7.168]
  - - [1216, 832, 1, 64, 1216, 1216, 1216, 832]
    - [0, 7.438]
  - - [1344, 832, 1, 64, 1344, 1344, 1344, 832]
    - [0, 7.711]
  - - [1472, 832, 1, 64, 1472, 1472, 1472, 832]
    - [0, 7.926]
  - - [1600, 832, 1, 64, 1600, 1600, 1600, 832]
    - [0, 8.093]
  - - [1728, 832, 1, 64, 1728, 1728, 1728, 832]
    - [0, 8.351]
  - - [1856, 832, 1, 64, 1856, 1856, 1856, 832]
    - [0, 8.466]
  - - [1984, 832, 1, 64, 1984, 1984, 1984, 832]
    - [2, 8.044]
  - - [2112, 832, 1, 64, 2112, 2112, 2112, 832]
    - [0, 8.744]
  - - [2240, 832, 1, 64, 2240, 2240, 2240, 832]
    - [0, 8.834]
  - - [2368, 832, 1, 64, 2368, 2368, 2368, 832]
    - [0, 8.938]
  - - [2496, 832, 1, 64, 2496, 2496, 2496, 832]
    - [0, 9.082]
  - - [2624, 832, 1, 64, 2624, 2624, 2624, 832]
    - [0, 9.171]
  - - [2752, 832, 1, 64, 2752, 2752, 2752, 832]
    - [0, 9.243]
  - - [2880, 832, 1, 64, 2880, 2880, 2880, 832]
    - [0, 9.329]
  - - [3008, 832, 1, 64, 3008, 3008, 3008, 832]
    - [0, 9.344]
  - - [3136, 832, 1, 64, 3136, 3136, 3136, 832]
    - [0, 9.5]
  - - [3264, 832, 1, 64, 3264, 3264, 3264, 832]
    - [0, 9.512]
  - - [3392, 832, 1, 64, 3392, 3392, 3392, 832]
    - [0, 9.542]
  - - [3520, 832, 1, 64, 3520, 3520, 3520, 832]
    - [0, 9.838]
  - - [3648, 832, 1, 64, 3648, 3648, 3648, 832]
    - [0, 9.889]
  - - [3776, 832, 1, 64, 3776, 3776, 3776, 832]
    - [0, 9.666]
  - - [3904, 832, 1, 64, 3904, 3904, 3904, 832]
    - [0, 9.767]
  - - [4032, 832, 1, 64, 4032, 4032, 4032, 832]
    - [0, 10.015]
  - - [64, 960, 1, 64, 64, 64, 64, 960]
    - [2, 1.229]
  - - [192, 960, 1, 64, 192, 192, 192, 960]
    - [0, 3.287]
  - - [320, 960, 1, 64, 320, 320, 320, 960]
    - [2, 1.267]
  - - [448, 960, 1, 64, 448, 448, 448, 960]
    - [0, 3.42]
  - - [576, 960, 1, 64, 576, 576, 576, 960]
    - [0, 4.393]
  - - [704, 960, 1, 64, 704, 704, 704, 960]
    - [0, 5.365]
  - - [832, 960, 1, 64, 832, 832, 832, 960]
    - [0, 6.343]
  - - [960, 960, 1, 64, 960, 960, 960, 960]
    - [0, 7.286]
  - - [1088, 960, 1, 64, 1088, 1088, 1088, 960]
    - [0, 7.529]
  - - [1216, 960, 1, 64, 1216, 1216, 1216, 960]
    - [0, 7.844]
  - - [1344, 960, 1, 64, 1344, 1344, 1344, 960]
    - [0, 8.097]
  - - [1472, 960, 1, 64, 1472, 1472, 1472, 960]
    - [0, 8.259]
  - - [1600, 960, 1, 64, 1600, 1600, 1600, 960]
    - [0, 8.47]
  - - [1728, 960, 1, 64, 1728, 1728, 1728, 960]
    - [0, 8.668]
  - - [1856, 960, 1, 64, 1856, 1856, 1856, 960]
    - [0, 8.761]
  - - [1984, 960, 1, 64, 1984, 1984, 1984, 960]
    - [0, 8.895]
  - - [2112, 960, 1, 64, 2112, 2112, 2112, 960]
    - [0, 9.053]
  - - [2240, 960, 1, 64, 2240, 2240, 2240, 960]
    - [0, 9.109]
  - - [2368, 960, 1, 64, 2368, 2368, 2368, 960]
    - [0, 9.192]
  - - [2496, 960, 1, 64, 2496, 2496, 2496, 960]
    - [0, 9.312]
  - - [2624, 960, 1, 64, 2624, 2624, 2624, 960]
    - [0, 9.399]
  - - [2752, 960, 1, 64, 2752, 2752, 2752, 960]
    - [0, 9.458]
  - - [2880, 960, 1, 64, 2880, 2880, 2880, 960]
    - [0, 9.659]
  - - [3008, 960, 1, 64, 3008, 3008, 3008, 960]
    - [0, 9.619]
  - - [3136, 960, 1, 64, 3136, 3136, 3136, 960]
    - [0, 9.683]
  - - [3264, 960, 1, 64, 3264, 3264, 3264, 960]
    - [0, 9.997]
  - - [3392, 960, 1, 64, 3392, 3392, 3392, 960]
    - [0, 10.048]
  - - [3520, 960, 1, 64, 3520, 3520, 3520, 960]
    - [0, 9.95]
  - - [3648, 960, 1, 64, 3648, 3648, 3648, 960]
    - [0, 10.141]
  - - [3776, 960, 1, 64, 3776, 3776, 3776, 960]
    - [0, 9.804]
  - - [3904, 960, 1, 64, 3904, 3904, 3904, 960]
    - [0, 9.978]
  - - [4032, 960, 1, 64, 4032, 4032, 4032, 960]
    - [0, 10.108]
  - - [64, 1088, 1, 64, 64, 64, 64, 1088]
    - [3, 0.287]
  - - [192, 1088, 1, 64, 192, 192, 192, 1088]
    - [3, 0.863]
  - - [320, 1088, 1, 64, 320, 320, 320, 1088]
    - [0, 1.431]
  - - [448, 1088, 1, 64, 448, 448, 448, 1088]
    - [2, 3.893]
  - - [576, 1088, 1, 64, 576, 576, 576, 1088]
    - [0, 5.0]
  - - [704, 1088, 1, 64, 704, 704, 704, 1088]
    - [0, 6.098]
  - - [832, 1088, 1, 64, 832, 832, 832, 1088]
    - [0, 7.187]
  - - [960, 1088, 1, 64, 960, 960, 960, 1088]
    - [0, 7.464]
  - - [1088, 1088, 1, 64, 1088, 1088, 1088, 1088]
    - [0, 7.853]
  - - [1216, 1088, 1, 64, 1216, 1216, 1216, 1088]
    - [0, 8.127]
  - - [1344, 1088, 1, 64, 1344, 1344, 1344, 1088]
    - [0, 8.386]
  - - [1472, 1088, 1, 64, 1472, 1472, 1472, 1088]
    - [0, 8.526]
  - - [1600, 1088, 1, 64, 1600, 1600, 1600, 1088]
    - [0, 8.716]
  - - [1728, 1088, 1, 64, 1728, 1728, 1728, 1088]
    - [0, 8.883]
  - - [1856, 1088, 1, 64, 1856, 1856, 1856, 1088]
    - [0, 9.008]
  - - [1984, 1088, 1, 64, 1984, 1984, 1984, 1088]
    - [0, 9.097]
  - - [2112, 1088, 1, 64, 2112, 2112, 2112, 1088]
    - [0, 9.281]
  - - [2240, 1088, 1, 64, 2240, 2240, 2240, 1088]
    - [0, 9.349]
  - - [2368, 1088, 1, 64, 2368, 2368, 2368, 1088]
    - [0, 9.506]
  - - [2496, 1088, 1, 64, 2496, 2496, 2496, 1088]
    - [0, 9.861]
  - - [2624, 1088, 1, 64, 2624, 2624, 2624, 1088]
    - [0, 9.614]
  - - [2752, 1088, 1, 64, 2752, 2752, 2752, 1088]
    - [0, 9.688]
  - - [2880, 1088, 1, 64, 2880, 2880, 2880, 1088]
    - [0, 9.916]
  - - [3008, 1088, 1, 64, 3008, 3008, 3008, 1088]
    - [0, 9.828]
  - - [3136, 1088, 1, 64, 3136, 3136, 3136, 1088]
    - [0, 9.799]
  - - [3264, 1088, 1, 64, 3264, 3264, 3264, 1088]
    - [0, 9.956]
  - - [3392, 1088, 1, 64, 3392, 3392, 3392, 1088]
    - [0, 9.975]
  - - [3520, 1088, 1, 64, 3520, 3520, 3520, 1088]
    - [0, 10.098]
  - - [3648, 1088, 1, 64, 3648, 3648, 3648, 1088]
    - [0, 9.971]
  - - [3776, 1088, 1, 64, 3776, 3776, 3776, 1088]
    - [0, 9.694]
  - - [3904, 1088, 1, 64, 3904, 3904, 3904, 1088]
    - [0, 9.581]
  - - [4032, 1088, 1, 64, 4032, 4032, 4032, 1088]
    - [0, 10.2]
  - - [64, 1216, 1, 64, 64, 64, 64, 1216]
    - [1, 0.69]
  - - [192, 1216, 1, 64, 192, 192, 192, 1216]
    - [3, 2.057]
  - - [320, 1216, 1, 64, 320, 320, 320, 1216]
    - [0, 5.183]
  - - [448, 1216, 1, 64, 448, 448, 448, 1216]
    - [0, 6.074]
  - - [576, 1216, 1, 64, 576, 576, 576, 1216]
    - [0, 6.704]
  - - [704, 1216, 1, 64, 704, 704, 704, 1216]
    - [0, 7.046]
  - - [832, 1216, 1, 64, 832, 832, 832, 1216]
    - [0, 7.477]
  - - [960, 1216, 1, 64, 960, 960, 960, 1216]
    - [0, 7.838]
  - - [1088, 1216, 1, 64, 1088, 1088, 1088, 1216]
    - [0, 8.118]
  - - [1216, 1216, 1, 64, 1216, 1216, 1216, 1216]
    - [0, 8.375]
  - - [1344, 1216, 1, 64, 1344, 1344, 1344, 1216]
    - [0, 8.614]
  - - [1472, 1216, 1, 64, 1472, 1472, 1472, 1216]
    - [0, 8.772]
  - - [1600, 1216, 1, 64, 1600, 1600, 1600, 1216]
    - [0, 8.944]
  - - [1728, 1216, 1, 64, 1728, 1728, 1728, 1216]
    - [0, 9.107]
  - - [1856, 1216, 1, 64, 1856, 1856, 1856, 1216]
    - [0, 9.21]
  - - [1984, 1216, 1, 64, 1984, 1984, 1984, 1216]
    - [0, 9.305]
  - - [2112, 1216, 1, 64, 2112, 2112, 2112, 1216]
    - [0, 9.471]
  - - [2240, 1216, 1, 64, 2240, 2240, 2240, 1216]
    - [0, 9.868]
  - - [2368, 1216, 1, 64, 2368, 2368, 2368, 1216]
    - [0, 9.858]
  - - [2496, 1216, 1, 64, 2496, 2496, 2496, 1216]
    - [0, 10.002]
  - - [2624, 1216, 1, 64, 2624, 2624, 2624, 1216]
    - [0, 10.025]
  - - [2752, 1216, 1, 64, 2752, 2752, 2752, 1216]
    - [0, 9.81]
  - - [2880, 1216, 1, 64, 2880, 2880, 2880, 1216]
    - [0, 9.685]
  - - [3008, 1216, 1, 64, 3008, 3008, 3008, 1216]
    - [0, 10.108]
  - - [3136, 1216, 1, 64, 3136, 3136, 3136, 1216]
    - [0, 9.903]
  - - [3264, 1216, 1, 64, 3264, 3264, 3264, 1216]
    - [0, 9.714]
  - - [3392, 1216, 1, 64, 3392, 3392, 3392, 1216]
    - [0, 9.611]
  - - [3520, 1216, 1, 64, 3520, 3520, 3520, 1216]
    - [0, 9.804]
  - - [3648, 1216, 1, 64, 3648, 3648, 3648, 1216]
    - [0, 10.142]
  - - [3776, 1216, 1, 64, 3776, 3776, 3776, 1216]
    - [2, 9.575]
  - - [3904, 1216, 1, 64, 3904, 3904, 3904, 1216]
    - [0, 9.545]
  - - [4032, 1216, 1, 64, 4032, 4032, 4032, 1216]
    - [0, 9.799]
  - - [64, 1344, 1, 64, 64, 64, 64, 1344]
    - [3, 1.641]
  - - [192, 1344, 1, 64, 192, 192, 192, 1344]
    - [2, 3.731]
  - - [320, 1344, 1, 64, 320, 320, 320, 1344]
    - [0, 5.292]
  - - [448, 1344, 1, 64, 448, 448, 448, 1344]
    - [0, 6.175]
  - - [576, 1344, 1, 64, 576, 576, 576, 1344]
    - [0, 6.871]
  - - [704, 1344, 1, 64, 704, 704, 704, 1344]
    - [0, 7.311]
  - - [832, 1344, 1, 64, 832, 832, 832, 1344]
    - [0, 7.721]
  - - [960, 1344, 1, 64, 960, 960, 960, 1344]
    - [0, 8.03]
  - - [1088, 1344, 1, 64, 1088, 1088, 1088, 1344]
    - [0, 8.352]
  - - [1216, 1344, 1, 64, 1216, 1216, 1216, 1344]
    - [0, 8.6]
  - - [1344, 1344, 1, 64, 1344, 1344, 1344, 1344]
    - [0, 8.833]
  - - [1472, 1344, 1, 64, 1472, 1472, 1472, 1344]
    - [0, 8.981]
  - - [1600, 1344, 1, 64, 1600, 1600, 1600, 1344]
    - [0, 9.137]
  - - [1728, 1344, 1, 64, 1728, 1728, 1728, 1344]
    - [0, 9.302]
  - - [1856, 1344, 1, 64, 1856, 1856, 1856, 1344]
    - [0, 9.647]
  - - [1984, 1344, 1, 64, 1984, 1984, 1984, 1344]
    - [0, 9.494]
  - - [2112, 1344, 1, 64, 2112, 2112, 2112, 1344]
    - [0, 9.614]
  - - [2240, 1344, 1, 64, 2240, 2240, 2240, 1344]
    - [0, 9.935]
  - - [2368, 1344, 1, 64, 2368, 2368, 2368, 1344]
    - [0, 9.844]
  - - [2496, 1344, 1, 64, 2496, 2496, 2496, 1344]
    - [0, 10.207]
  - - [2624, 1344, 1, 64, 2624, 2624, 2624, 1344]
    - [0, 9.914]
  - - [2752, 1344, 1, 64, 2752, 2752, 2752, 1344]
    - [2, 9.414]
  - - [2880, 1344, 1, 64, 2880, 2880, 2880, 1344]
    - [2, 9.433]
  - - [3008, 1344, 1, 64, 3008, 3008, 3008, 1344]
    - [2, 9.46]
  - - [3136, 1344, 1, 64, 3136, 3136, 3136, 1344]
    - [2, 9.515]
  - - [3264, 1344, 1, 64, 3264, 3264, 3264, 1344]
    - [0, 9.818]
  - - [3392, 1344, 1, 64, 3392, 3392, 3392, 1344]
    - [0, 9.634]
  - - [3520, 1344, 1, 64, 3520, 3520, 3520, 1344]
    - [0, 10.365]
  - - [3648, 1344, 1, 64, 3648, 3648, 3648, 1344]
    - [0, 9.573]
  - - [3776, 1344, 1, 64, 3776, 3776, 3776, 1344]
    - [0, 10.108]
  - - [3904, 1344, 1, 64, 3904, 3904, 3904, 1344]
    - [0, 9.644]
  - - [4032, 1344, 1, 64, 4032, 4032, 4032, 1344]
    - [0, 9.89]
  - - [64, 1472, 1, 64, 64, 64, 64, 1472]
    - [0, 1.862]
  - - [192, 1472, 1, 64, 192, 192, 192, 1472]
    - [3, 1.162]
  - - [320, 1472, 1, 64, 320, 320, 320, 1472]
    - [3, 1.936]
  - - [448, 1472, 1, 64, 448, 448, 448, 1472]
    - [2, 6.174]
  - - [576, 1472, 1, 64, 576, 576, 576, 1472]
    - [0, 6.715]
  - - [704, 1472, 1, 64, 704, 704, 704, 1472]
    - [0, 7.536]
  - - [832, 1472, 1, 64, 832, 832, 832, 1472]
    - [0, 7.986]
  - - [960, 1472, 1, 64, 960, 960, 960, 1472]
    - [0, 8.291]
  - - [1088, 1472, 1, 64, 1088, 1088, 1088, 1472]
    - [0, 8.559]
  - - [1216, 1472, 1, 64, 1216, 1216, 1216, 1472]
    - [2, 8.167]
  - - [1344, 1472, 1, 64, 1344, 1344, 1344, 1472]
    - [0, 9.015]
  - - [1472, 1472, 1, 64, 1472, 1472, 1472, 1472]
    - [0, 9.155]
  - - [1600, 1472, 1, 64, 1600, 1600, 1600, 1472]
    - [0, 9.288]
  - - [1728, 1472, 1, 64, 1728, 1728, 1728, 1472]
    - [0, 9.446]
  - - [1856, 1472, 1, 64, 1856, 1856, 1856, 1472]
    - [0, 9.785]
  - - [1984, 1472, 1, 64, 1984, 1984, 1984, 1472]
    - [0, 9.944]
  - - [2112, 1472, 1, 64, 2112, 2112, 2112, 1472]
    - [0, 9.79]
  - - [2240, 1472, 1, 64, 2240, 2240, 2240, 1472]
    - [0, 9.87]
  - - [2368, 1472, 1, 64, 2368, 2368, 2368, 1472]
    - [0, 9.938]
  - - [2496, 1472, 1, 64, 2496, 2496, 2496, 1472]
    - [0, 9.956]
  - - [2624, 1472, 1, 64, 2624, 2624, 2624, 1472]
    - [0, 9.868]
  - - [2752, 1472, 1, 64, 2752, 2752, 2752, 1472]
    - [0, 10.113]
  - - [2880, 1472, 1, 64, 2880, 2880, 2880, 1472]
    - [0, 10.14]
  - - [3008, 1472, 1, 64, 3008, 3008, 3008, 1472]
    - [0, 9.682]
  - - [3136, 1472, 1, 64, 3136, 3136, 3136, 1472]
    - [0, 10.131]
  - - [3264, 1472, 1, 64, 3264, 3264, 3264, 1472]
    - [0, 10.043]
  - - [3392, 1472, 1, 64, 3392, 3392, 3392, 1472]
    - [0, 10.129]
  - - [3520, 1472, 1, 64, 3520, 3520, 3520, 1472]
    - [0, 9.644]
  - - [3648, 1472, 1, 64, 3648, 3648, 3648, 1472]
    - [0, 9.791]
  - - [3776, 1472, 1, 64, 3776, 3776, 3776, 1472]
    - [0, 9.682]
  - - [3904, 1472, 1, 64, 3904, 3904, 3904, 1472]
    - [0, 9.758]
  - - [4032, 1472, 1, 64, 4032, 4032, 4032, 1472]
    - [0, 9.883]
  - - [64, 1600, 1, 64, 64, 64, 64, 1600]
    - [0, 1.95]
  - - [192, 1600, 1, 64, 192, 192, 192, 1600]
    - [0, 4.286]
  - - [320, 1600, 1, 64, 320, 320, 320, 1600]
    - [0, 5.791]
  - - [448, 1600, 1, 64, 448, 448, 448, 1600]
    - [2, 6.276]
  - - [576, 1600, 1, 64, 576, 576, 576, 1600]
    - [0, 7.267]
  - - [704, 1600, 1, 64, 704, 704, 704, 1600]
    - [0, 7.714]
  - - [832, 1600, 1, 64, 832, 832, 832, 1600]
    - [2, 7.572]
  - - [960, 1600, 1, 64, 960, 960, 960, 1600]
    - [0, 8.434]
  - - [1088, 1600, 1, 64, 1088, 1088, 1088, 1600]
    - [0, 8.72]
  - - [1216, 1600, 1, 64, 1216, 1216, 1216, 1600]
    - [0, 8.968]
  - - [1344, 1600, 1, 64, 1344, 1344, 1344, 1600]
    - [0, 9.163]
  - - [1472, 1600, 1, 64, 1472, 1472, 1472, 1600]
    - [0, 9.286]
  - - [1600, 1600, 1, 64, 1600, 1600, 1600, 1600]
    - [0, 9.431]
  - - [1728, 1600, 1, 64, 1728, 1728, 1728, 1600]
    - [0, 9.846]
  - - [1856, 1600, 1, 64, 1856, 1856, 1856, 1600]
    - [0, 9.67]
  - - [1984, 1600, 1, 64, 1984, 1984, 1984, 1600]
    - [0, 9.739]
  - - [2112, 1600, 1, 64, 2112, 2112, 2112, 1600]
    - [0, 10.157]
  - - [2240, 1600, 1, 64, 2240, 2240, 2240, 1600]
    - [0, 10.24]
  - - [2368, 1600, 1, 64, 2368, 2368, 2368, 1600]
    - [0, 9.416]
  - - [2496, 1600, 1, 64, 2496, 2496, 2496, 1600]
    - [0, 9.564]
  - - [2624, 1600, 1, 64, 2624, 2624, 2624, 1600]
    - [0, 9.696]
  - - [2752, 1600, 1, 64, 2752, 2752, 2752, 1600]
    - [0, 9.608]
  - - [2880, 1600, 1, 64, 2880, 2880, 2880, 1600]
    - [0, 10.361]
  - - [3008, 1600, 1, 64, 3008, 3008, 3008, 1600]
    - [0, 9.591]
  - - [3136, 1600, 1, 64, 3136, 3136, 3136, 1600]
    - [0, 10.157]
  - - [3264, 1600, 1, 64, 3264, 3264, 3264, 1600]
    - [0, 9.9]
  - - [3392, 1600, 1, 64, 3392, 3392, 3392, 1600]
    - [0, 9.62]
  - - [3520, 1600, 1, 64, 3520, 3520, 3520, 1600]
    - [0, 10.12]
  - - [3648, 1600, 1, 64, 3648, 3648, 3648, 1600]
    - [0, 9.663]
  - - [3776, 1600, 1, 64, 3776, 3776, 3776, 1600]
    - [0, 9.932]
  - - [3904, 1600, 1, 64, 3904, 3904, 3904, 1600]
    - [0, 9.74]
  - - [4032, 1600, 1, 64, 4032, 4032, 4032, 1600]
    - [0, 9.795]
  - - [64, 1728, 1, 64, 64, 64, 64, 1728]
    - [3, 0.972]
  - - [192, 1728, 1, 64, 192, 192, 192, 1728]
    - [1, 2.923]
  - - [320, 1728, 1, 64, 320, 320, 320, 1728]
    - [2, 5.768]
  - - [448, 1728, 1, 64, 448, 448, 448, 1728]
    - [0, 6.838]
  - - [576, 1728, 1, 64, 576, 576, 576, 1728]
    - [0, 7.403]
  - - [704, 1728, 1, 64, 704, 704, 704, 1728]
    - [0, 7.929]
  - - [832, 1728, 1, 64, 832, 832, 832, 1728]
    - [0, 8.346]
  - - [960, 1728, 1, 64, 960, 960, 960, 1728]
    - [0, 8.623]
  - - [1088, 1728, 1, 64, 1088, 1088, 1088, 1728]
    - [0, 8.884]
  - - [1216, 1728, 1, 64, 1216, 1216, 1216, 1728]
    - [0, 9.095]
  - - [1344, 1728, 1, 64, 1344, 1344, 1344, 1728]
    - [0, 9.3]
  - - [1472, 1728, 1, 64, 1472, 1472, 1472, 1728]
    - [0, 9.427]
  - - [1600, 1728, 1, 64, 1600, 1600, 1600, 1728]
    - [0, 9.822]
  - - [1728, 1728, 1, 64, 1728, 1728, 1728, 1728]
    - [0, 9.975]
  - - [1856, 1728, 1, 64, 1856, 1856, 1856, 1728]
    - [0, 9.784]
  - - [1984, 1728, 1, 64, 1984, 1984, 1984, 1728]
    - [0, 9.673]
  - - [2112, 1728, 1, 64, 2112, 2112, 2112, 1728]
    - [0, 10.17]
  - - [2240, 1728, 1, 64, 2240, 2240, 2240, 1728]
    - [0, 10.261]
  - - [2368, 1728, 1, 64, 2368, 2368, 2368, 1728]
    - [0, 9.993]
  - - [2496, 1728, 1, 64, 2496, 2496, 2496, 1728]
    - [0, 10.148]
  - - [2624, 1728, 1, 64, 2624, 2624, 2624, 1728]
    - [0, 10.034]
  - - [2752, 1728, 1, 64, 2752, 2752, 2752, 1728]
    - [0, 10.035]
  - - [2880, 1728, 1, 64, 2880, 2880, 2880, 1728]
    - [0, 10.09]
  - - [3008, 1728, 1, 64, 3008, 3008, 3008, 1728]
    - [0, 9.764]
  - - [3136, 1728, 1, 64, 3136, 3136, 3136, 1728]
    - [0, 9.622]
  - - [3264, 1728, 1, 64, 3264, 3264, 3264, 1728]
    - [0, 9.881]
  - - [3392, 1728, 1, 64, 3392, 3392, 3392, 1728]
    - [0, 9.763]
  - - [3520, 1728, 1, 64, 3520, 3520, 3520, 1728]
    - [0, 9.595]
  - - [3648, 1728, 1, 64, 3648, 3648, 3648, 1728]
    - [0, 9.471]
  - - [3776, 1728, 1, 64, 3776, 3776, 3776, 1728]
    - [0, 9.665]
  - - [3904, 1728, 1, 64, 3904, 3904, 3904, 1728]
    - [0, 10.37]
  - - [4032, 1728, 1, 64, 4032, 4032, 4032, 1728]
    - [0, 9.602]
  - - [64, 1856, 1, 64, 64, 64, 64, 1856]
    - [0, 2.253]
  - - [192, 1856, 1, 64, 192, 192, 192, 1856]
    - [0, 4.753]
  - - [320, 1856, 1, 64, 320, 320, 320, 1856]
    - [0, 6.196]
  - - [448, 1856, 1, 64, 448, 448, 448, 1856]
    - [0, 7.014]
  - - [576, 1856, 1, 64, 576, 576, 576, 1856]
    - [0, 7.638]
  - - [704, 1856, 1, 64, 704, 704, 704, 1856]
    - [0, 8.098]
  - - [832, 1856, 1, 64, 832, 832, 832, 1856]
    - [0, 8.501]
  - - [960, 1856, 1, 64, 960, 960, 960, 1856]
    - [0, 8.757]
  - - [1088, 1856, 1, 64, 1088, 1088, 1088, 1856]
    - [0, 9.034]
  - - [1216, 1856, 1, 64, 1216, 1216, 1216, 1856]
    - [0, 9.236]
  - - [1344, 1856, 1, 64, 1344, 1344, 1344, 1856]
    - [0, 9.436]
  - - [1472, 1856, 1, 64, 1472, 1472, 1472, 1856]
    - [0, 9.661]
  - - [1600, 1856, 1, 64, 1600, 1600, 1600, 1856]
    - [0, 9.873]
  - - [1728, 1856, 1, 64, 1728, 1728, 1728, 1856]
    - [0, 10.001]
  - - [1856, 1856, 1, 64, 1856, 1856, 1856, 1856]
    - [0, 9.938]
  - - [1984, 1856, 1, 64, 1984, 1984, 1984, 1856]
    - [0, 10.018]
  - - [2112, 1856, 1, 64, 2112, 2112, 2112, 1856]
    - [0, 9.709]
  - - [2240, 1856, 1, 64, 2240, 2240, 2240, 1856]
    - [0, 9.76]
  - - [2368, 1856, 1, 64, 2368, 2368, 2368, 1856]
    - [0, 9.616]
  - - [2496, 1856, 1, 64, 2496, 2496, 2496, 1856]
    - [0, 9.477]
  - - [2624, 1856, 1, 64, 2624, 2624, 2624, 1856]
    - [0, 10.428]
  - - [2752, 1856, 1, 64, 2752, 2752, 2752, 1856]
    - [0, 9.324]
  - - [2880, 1856, 1, 64, 2880, 2880, 2880, 1856]
    - [0, 9.608]
  - - [3008, 1856, 1, 64, 3008, 3008, 3008, 1856]
    - [0, 8.93]
  - - [3136, 1856, 1, 64, 3136, 3136, 3136, 1856]
    - [0, 9.775]
  - - [3264, 1856, 1, 64, 3264, 3264, 3264, 1856]
    - [0, 9.739]
  - - [3392, 1856, 1, 64, 3392, 3392, 3392, 1856]
    - [0, 9.662]
  - - [3520, 1856, 1, 64, 3520, 3520, 3520, 1856]
    - [0, 9.618]
  - - [3648, 1856, 1, 64, 3648, 3648, 3648, 1856]
    - [0, 9.758]
  - - [3776, 1856, 1, 64, 3776, 3776, 3776, 1856]
    - [0, 9.696]
  - - [3904, 1856, 1, 64, 3904, 3904, 3904, 1856]
    - [2, 9.445]
  - - [4032, 1856, 1, 64, 4032, 4032, 4032, 1856]
    - [0, 9.687]
  - - [64, 1984, 1, 64, 64, 64, 64, 1984]
    - [2, 0.526]
  - - [192, 1984, 1, 64, 192, 192, 192, 1984]
    - [2, 1.569]
  - - [320, 1984, 1, 64, 320, 320, 320, 1984]
    - [0, 5.061]
  - - [448, 1984, 1, 64, 448, 448, 448, 1984]
    - [0, 7.129]
  - - [576, 1984, 1, 64, 576, 576, 576, 1984]
    - [0, 7.772]
  - - [704, 1984, 1, 64, 704, 704, 704, 1984]
    - [0, 8.235]
  - - [832, 1984, 1, 64, 832, 832, 832, 1984]
    - [0, 8.618]
  - - [960, 1984, 1, 64, 960, 960, 960, 1984]
    - [0, 8.895]
  - - [1088, 1984, 1, 64, 1088, 1088, 1088, 1984]
    - [0, 9.146]
  - - [1216, 1984, 1, 64, 1216, 1216, 1216, 1984]
    - [0, 9.343]
  - - [1344, 1984, 1, 64, 1344, 1344, 1344, 1984]
    - [0, 9.533]
  - - [1472, 1984, 1, 64, 1472, 1472, 1472, 1984]
    - [0, 9.901]
  - - [1600, 1984, 1, 64, 1600, 1600, 1600, 1984]
    - [0, 9.964]
  - - [1728, 1984, 1, 64, 1728, 1728, 1728, 1984]
    - [0, 10.071]
  - - [1856, 1984, 1, 64, 1856, 1856, 1856, 1984]
    - [0, 9.94]
  - - [1984, 1984, 1, 64, 1984, 1984, 1984, 1984]
    - [0, 9.825]
  - - [2112, 1984, 1, 64, 2112, 2112, 2112, 1984]
    - [0, 10.238]
  - - [2240, 1984, 1, 64, 2240, 2240, 2240, 1984]
    - [0, 10.091]
  - - [2368, 1984, 1, 64, 2368, 2368, 2368, 1984]
    - [0, 9.684]
  - - [2496, 1984, 1, 64, 2496, 2496, 2496, 1984]
    - [0, 9.839]
  - - [2624, 1984, 1, 64, 2624, 2624, 2624, 1984]
    - [0, 9.695]
  - - [2752, 1984, 1, 64, 2752, 2752, 2752, 1984]
    - [0, 9.623]
  - - [2880, 1984, 1, 64, 2880, 2880, 2880, 1984]
    - [0, 9.916]
  - - [3008, 1984, 1, 64, 3008, 3008, 3008, 1984]
    - [0, 9.501]
  - - [3136, 1984, 1, 64, 3136, 3136, 3136, 1984]
    - [0, 9.457]
  - - [3264, 1984, 1, 64, 3264, 3264, 3264, 1984]
    - [0, 9.475]
  - - [3392, 1984, 1, 64, 3392, 3392, 3392, 1984]
    - [0, 9.663]
  - - [3520, 1984, 1, 64, 3520, 3520, 3520, 1984]
    - [0, 9.724]
  - - [3648, 1984, 1, 64, 3648, 3648, 3648, 1984]
    - [0, 9.873]
  - - [3776, 1984, 1, 64, 3776, 3776, 3776, 1984]
    - [0, 9.864]
  - - [3904, 1984, 1, 64, 3904, 3904, 3904, 1984]
    - [0, 9.771]
  - - [4032, 1984, 1, 64, 4032, 4032, 4032, 1984]
    - [0, 9.76]
  - - [64, 2112, 1, 64, 64, 64, 64, 2112]
    - [3, 0.561]
  - - [192, 2112, 1, 64, 192, 192, 192, 2112]
    - [3, 1.671]
  - - [320, 2112, 1, 64, 320, 320, 320, 2112]
    - [0, 5.372]
  - - [448, 2112, 1, 64, 448, 448, 448, 2112]
    - [0, 7.259]
  - - [576, 2112, 1, 64, 576, 576, 576, 2112]
    - [0, 7.937]
  - - [704, 2112, 1, 64, 704, 704, 704, 2112]
    - [0, 8.401]
  - - [832, 2112, 1, 64, 832, 832, 832, 2112]
    - [0, 8.765]
  - - [960, 2112, 1, 64, 960, 960, 960, 2112]
    - [0, 9.089]
  - - [1088, 2112, 1, 64, 1088, 1088, 1088, 2112]
    - [0, 9.246]
  - - [1216, 2112, 1, 64, 1216, 1216, 1216, 2112]
    - [0, 9.524]
  - - [1344, 2112, 1, 64, 1344, 1344, 1344, 2112]
    - [0, 9.812]
  - - [1472, 2112, 1, 64, 1472, 1472, 1472, 2112]
    - [0, 9.809]
  - - [1600, 2112, 1, 64, 1600, 1600, 1600, 2112]
    - [0, 9.933]
  - - [1728, 2112, 1, 64, 1728, 1728, 1728, 2112]
    - [0, 9.973]
  - - [1856, 2112, 1, 64, 1856, 1856, 1856, 2112]
    - [0, 9.751]
  - - [1984, 2112, 1, 64, 1984, 1984, 1984, 2112]
    - [0, 9.86]
  - - [2112, 2112, 1, 64, 2112, 2112, 2112, 2112]
    - [0, 9.632]
  - - [2240, 2112, 1, 64, 2240, 2240, 2240, 2112]
    - [0, 10.043]
  - - [2368, 2112, 1, 64, 2368, 2368, 2368, 2112]
    - [0, 10.222]
  - - [2496, 2112, 1, 64, 2496, 2496, 2496, 2112]
    - [0, 10.078]
  - - [2624, 2112, 1, 64, 2624, 2624, 2624, 2112]
    - [0, 9.515]
  - - [2752, 2112, 1, 64, 2752, 2752, 2752, 2112]
    - [0, 9.902]
  - - [2880, 2112, 1, 64, 2880, 2880, 2880, 2112]
    - [0, 9.78]
  - - [3008, 2112, 1, 64, 3008, 3008, 3008, 2112]
    - [0, 9.568]
  - - [3136, 2112, 1, 64, 3136, 3136, 3136, 2112]
    - [0, 9.71]
  - - [3264, 2112, 1, 64, 3264, 3264, 3264, 2112]
    - [0, 9.738]
  - - [3392, 2112, 1, 64, 3392, 3392, 3392, 2112]
    - [0, 9.575]
  - - [3520, 2112, 1, 64, 3520, 3520, 3520, 2112]
    - [0, 9.699]
  - - [3648, 2112, 1, 64, 3648, 3648, 3648, 2112]
    - [0, 9.72]
  - - [3776, 2112, 1, 64, 3776, 3776, 3776, 2112]
    - [0, 10.022]
  - - [3904, 2112, 1, 64, 3904, 3904, 3904, 2112]
    - [0, 9.976]
  - - [4032, 2112, 1, 64, 4032, 4032, 4032, 2112]
    - [0, 10.3]
  - - [64, 2240, 1, 64, 64, 64, 64, 2240]
    - [0, 2.79]
  - - [192, 2240, 1, 64, 192, 192, 192, 2240]
    - [0, 5.418]
  - - [320, 2240, 1, 64, 320, 320, 320, 2240]
    - [0, 6.658]
  - - [448, 2240, 1, 64, 448, 448, 448, 2240]
    - [0, 7.416]
  - - [576, 2240, 1, 64, 576, 576, 576, 2240]
    - [0, 8.074]
  - - [704, 2240, 1, 64, 704, 704, 704, 2240]
    - [0, 8.494]
  - - [832, 2240, 1, 64, 832, 832, 832, 2240]
    - [0, 8.885]
  - - [960, 2240, 1, 64, 960, 960, 960, 2240]
    - [0, 9.131]
  - - [1088, 2240, 1, 64, 1088, 1088, 1088, 2240]
    - [0, 9.354]
  - - [1216, 2240, 1, 64, 1216, 1216, 1216, 2240]
    - [0, 9.874]
  - - [1344, 2240, 1, 64, 1344, 1344, 1344, 2240]
    - [0, 9.755]
  - - [1472, 2240, 1, 64, 1472, 1472, 1472, 2240]
    - [0, 9.96]
  - - [1600, 2240, 1, 64, 1600, 1600, 1600, 2240]
    - [0, 9.922]
  - - [1728, 2240, 1, 64, 1728, 1728, 1728, 2240]
    - [0, 9.834]
  - - [1856, 2240, 1, 64, 1856, 1856, 1856, 2240]
    - [0, 9.774]
  - - [1984, 2240, 1, 64, 1984, 1984, 1984, 2240]
    - [0, 9.55]
  - - [2112, 2240, 1, 64, 2112, 2112, 2112, 2240]
    - [0, 9.567]
  - - [2240, 2240, 1, 64, 2240, 2240, 2240, 2240]
    - [2, 9.078]
  - - [2368, 2240, 1, 64, 2368, 2368, 2368, 2240]
    - [0, 9.805]
  - - [2496, 2240, 1, 64, 2496, 2496, 2496, 2240]
    - [0, 9.589]
  - - [2624, 2240, 1, 64, 2624, 2624, 2624, 2240]
    - [0, 9.688]
  - - [2752, 2240, 1, 64, 2752, 2752, 2752, 2240]
    - [0, 9.847]
  - - [2880, 2240, 1, 64, 2880, 2880, 2880, 2240]
    - [0, 9.654]
  - - [3008, 2240, 1, 64, 3008, 3008, 3008, 2240]
    - [0, 10.181]
  - - [3136, 2240, 1, 64, 3136, 3136, 3136, 2240]
    - [0, 9.992]
  - - [3264, 2240, 1, 64, 3264, 3264, 3264, 2240]
    - [0, 9.683]
  - - [3392, 2240, 1, 64, 3392, 3392, 3392, 2240]
    - [0, 9.986]
  - - [3520, 2240, 1, 64, 3520, 3520, 3520, 2240]
    - [0, 9.831]
  - - [3648, 2240, 1, 64, 3648, 3648, 3648, 2240]
    - [0, 9.975]
  - - [3776, 2240, 1, 64, 3776, 3776, 3776, 2240]
    - [0, 9.988]
  - - [3904, 2240, 1, 64, 3904, 3904, 3904, 2240]
    - [0, 9.83]
  - - [4032, 2240, 1, 64, 4032, 4032, 4032, 2240]
    - [0, 9.847]
  - - [64, 2368, 1, 64, 64, 64, 64, 2368]
    - [0, 2.766]
  - - [192, 2368, 1, 64, 192, 192, 192, 2368]
    - [0, 5.544]
  - - [320, 2368, 1, 64, 320, 320, 320, 2368]
    - [0, 6.749]
  - - [448, 2368, 1, 64, 448, 448, 448, 2368]
    - [0, 7.541]
  - - [576, 2368, 1, 64, 576, 576, 576, 2368]
    - [0, 8.204]
  - - [704, 2368, 1, 64, 704, 704, 704, 2368]
    - [0, 8.643]
  - - [832, 2368, 1, 64, 832, 832, 832, 2368]
    - [0, 8.978]
  - - [960, 2368, 1, 64, 960, 960, 960, 2368]
    - [0, 9.216]
  - - [1088, 2368, 1, 64, 1088, 1088, 1088, 2368]
    - [0, 9.428]
  - - [1216, 2368, 1, 64, 1216, 1216, 1216, 2368]
    - [0, 9.749]
  - - [1344, 2368, 1, 64, 1344, 1344, 1344, 2368]
    - [0, 10.091]
  - - [1472, 2368, 1, 64, 1472, 1472, 1472, 2368]
    - [0, 9.896]
  - - [1600, 2368, 1, 64, 1600, 1600, 1600, 2368]
    - [0, 10.08]
  - - [1728, 2368, 1, 64, 1728, 1728, 1728, 2368]
    - [0, 10.23]
  - - [1856, 2368, 1, 64, 1856, 1856, 1856, 2368]
    - [0, 10.186]
  - - [1984, 2368, 1, 64, 1984, 1984, 1984, 2368]
    - [0, 10.445]
  - - [2112, 2368, 1, 64, 2112, 2112, 2112, 2368]
    - [0, 9.814]
  - - [2240, 2368, 1, 64, 2240, 2240, 2240, 2368]
    - [0, 10.169]
  - - [2368, 2368, 1, 64, 2368, 2368, 2368, 2368]
    - [0, 10.326]
  - - [2496, 2368, 1, 64, 2496, 2496, 2496, 2368]
    - [0, 9.603]
  - - [2624, 2368, 1, 64, 2624, 2624, 2624, 2368]
    - [0, 10.467]
  - - [2752, 2368, 1, 64, 2752, 2752, 2752, 2368]
    - [0, 9.653]
  - - [2880, 2368, 1, 64, 2880, 2880, 2880, 2368]
    - [0, 9.879]
  - - [3008, 2368, 1, 64, 3008, 3008, 3008, 2368]
    - [0, 9.641]
  - - [3136, 2368, 1, 64, 3136, 3136, 3136, 2368]
    - [0, 9.797]
  - - [3264, 2368, 1, 64, 3264, 3264, 3264, 2368]
    - [0, 9.988]
  - - [3392, 2368, 1, 64, 3392, 3392, 3392, 2368]
    - [0, 9.776]
  - - [3520, 2368, 1, 64, 3520, 3520, 3520, 2368]
    - [0, 9.812]
  - - [3648, 2368, 1, 64, 3648, 3648, 3648, 2368]
    - [0, 9.805]
  - - [3776, 2368, 1, 64, 3776, 3776, 3776, 2368]
    - [0, 9.677]
  - - [3904, 2368, 1, 64, 3904, 3904, 3904, 2368]
    - [0, 10.147]
  - - [4032, 2368, 1, 64, 4032, 4032, 4032, 2368]
    - [0, 10.233]
  - - [64, 2496, 1, 64, 64, 64, 64, 2496]
    - [0, 2.905]
  - - [192, 2496, 1, 64, 192, 192, 192, 2496]
    - [0, 5.82]
  - - [320, 2496, 1, 64, 320, 320, 320, 2496]
    - [0, 6.875]
  - - [448, 2496, 1, 64, 448, 448, 448, 2496]
    - [0, 7.704]
  - - [576, 2496, 1, 64, 576, 576, 576, 2496]
    - [0, 8.326]
  - - [704, 2496, 1, 64, 704, 704, 704, 2496]
    - [0, 8.77]
  - - [832, 2496, 1, 64, 832, 832, 832, 2496]
    - [0, 9.099]
  - - [960, 2496, 1, 64, 960, 960, 960, 2496]
    - [0, 9.35]
  - - [1088, 2496, 1, 64, 1088, 1088, 1088, 2496]
    - [0, 9.521]
  - - [1216, 2496, 1, 64, 1216, 1216, 1216, 2496]
    - [0, 9.724]
  - - [1344, 2496, 1, 64, 1344, 1344, 1344, 2496]
    - [0, 9.867]
  - - [1472, 2496, 1, 64, 1472, 1472, 1472, 2496]
    - [0, 9.954]
  - - [1600, 2496, 1, 64, 1600, 1600, 1600, 2496]
    - [0, 9.943]
  - - [1728, 2496, 1, 64, 1728, 1728, 1728, 2496]
    - [0, 9.769]
  - - [1856, 2496, 1, 64, 1856, 1856, 1856, 2496]
    - [0, 9.735]
  - - [1984, 2496, 1, 64, 1984, 1984, 1984, 2496]
    - [0, 10.357]
  - - [2112, 2496, 1, 64, 2112, 2112, 2112, 2496]
    - [0, 9.674]
  - - [2240, 2496, 1, 64, 2240, 2240, 2240, 2496]
    - [0, 9.756]
  - - [2368, 2496, 1, 64, 2368, 2368, 2368, 2496]
    - [0, 9.866]
  - - [2496, 2496, 1, 64, 2496, 2496, 2496, 2496]
    - [0, 9.419]
  - - [2624, 2496, 1, 64, 2624, 2624, 2624, 2496]
    - [0, 9.965]
  - - [2752, 2496, 1, 64, 2752, 2752, 2752, 2496]
    - [0, 9.914]
  - - [2880, 2496, 1, 64, 2880, 2880, 2880, 2496]
    - [0, 9.867]
  - - [3008, 2496, 1, 64, 3008, 3008, 3008, 2496]
    - [2, 9.628]
  - - [3136, 2496, 1, 64, 3136, 3136, 3136, 2496]
    - [0, 9.891]
  - - [3264, 2496, 1, 64, 3264, 3264, 3264, 2496]
    - [0, 9.655]
  - - [3392, 2496, 1, 64, 3392, 3392, 3392, 2496]
    - [0, 9.797]
  - - [3520, 2496, 1, 64, 3520, 3520, 3520, 2496]
    - [0, 10.136]
  - - [3648, 2496, 1, 64, 3648, 3648, 3648, 2496]
    - [0, 10.188]
  - - [3776, 2496, 1, 64, 3776, 3776, 3776, 2496]
    - [0, 9.986]
  - - [3904, 2496, 1, 64, 3904, 3904, 3904, 2496]
    - [0, 10.404]
  - - [4032, 2496, 1, 64, 4032, 4032, 4032, 2496]
    - [0, 9.82]
  - - [64, 2624, 1, 64, 64, 64, 64, 2624]
    - [2, 0.693]
  - - [192, 2624, 1, 64, 192, 192, 192, 2624]
    - [0, 4.01]
  - - [320, 2624, 1, 64, 320, 320, 320, 2624]
    - [0, 6.693]
  - - [448, 2624, 1, 64, 448, 448, 448, 2624]
    - [0, 7.842]
  - - [576, 2624, 1, 64, 576, 576, 576, 2624]
    - [0, 8.465]
  - - [704, 2624, 1, 64, 704, 704, 704, 2624]
    - [0, 8.841]
  - - [832, 2624, 1, 64, 832, 832, 832, 2624]
    - [0, 9.2]
  - - [960, 2624, 1, 64, 960, 960, 960, 2624]
    - [0, 9.422]
  - - [1088, 2624, 1, 64, 1088, 1088, 1088, 2624]
    - [0, 9.619]
  - - [1216, 2624, 1, 64, 1216, 1216, 1216, 2624]
    - [0, 9.776]
  - - [1344, 2624, 1, 64, 1344, 1344, 1344, 2624]
    - [0, 9.748]
  - - [1472, 2624, 1, 64, 1472, 1472, 1472, 2624]
    - [0, 10.229]
  - - [1600, 2624, 1, 64, 1600, 1600, 1600, 2624]
    - [0, 9.775]
  - - [1728, 2624, 1, 64, 1728, 1728, 1728, 2624]
    - [0, 9.743]
  - - [1856, 2624, 1, 64, 1856, 1856, 1856, 2624]
    - [0, 10.02]
  - - [1984, 2624, 1, 64, 1984, 1984, 1984, 2624]
    - [0, 9.661]
  - - [2112, 2624, 1, 64, 2112, 2112, 2112, 2624]
    - [0, 9.62]
  - - [2240, 2624, 1, 64, 2240, 2240, 2240, 2624]
    - [0, 9.795]
  - - [2368, 2624, 1, 64, 2368, 2368, 2368, 2624]
    - [0, 10.299]
  - - [2496, 2624, 1, 64, 2496, 2496, 2496, 2624]
    - [0, 10.046]
  - - [2624, 2624, 1, 64, 2624, 2624, 2624, 2624]
    - [0, 9.909]
  - - [2752, 2624, 1, 64, 2752, 2752, 2752, 2624]
    - [0, 9.518]
  - - [2880, 2624, 1, 64, 2880, 2880, 2880, 2624]
    - [0, 9.8]
  - - [3008, 2624, 1, 64, 3008, 3008, 3008, 2624]
    - [0, 9.988]
  - - [3136, 2624, 1, 64, 3136, 3136, 3136, 2624]
    - [2, 9.647]
  - - [3264, 2624, 1, 64, 3264, 3264, 3264, 2624]
    - [0, 10.072]
  - - [3392, 2624, 1, 64, 3392, 3392, 3392, 2624]
    - [0, 9.865]
  - - [3520, 2624, 1, 64, 3520, 3520, 3520, 2624]
    - [0, 9.945]
  - - [3648, 2624, 1, 64, 3648, 3648, 3648, 2624]
    - [0, 10.389]
  - - [3776, 2624, 1, 64, 3776, 3776, 3776, 2624]
    - [0, 10.283]
  - - [3904, 2624, 1, 64, 3904, 3904, 3904, 2624]
    - [0, 10.367]
  - - [4032, 2624, 1, 64, 4032, 4032, 4032, 2624]
    - [0, 10.005]
  - - [64, 2752, 1, 64, 64, 64, 64, 2752]
    - [2, 0.727]
  - - [192, 2752, 1, 64, 192, 192, 192, 2752]
    - [2, 4.213]
  - - [320, 2752, 1, 64, 320, 320, 320, 2752]
    - [0, 6.987]
  - - [448, 2752, 1, 64, 448, 448, 448, 2752]
    - [0, 7.942]
  - - [576, 2752, 1, 64, 576, 576, 576, 2752]
    - [0, 8.532]
  - - [704, 2752, 1, 64, 704, 704, 704, 2752]
    - [0, 8.928]
  - - [832, 2752, 1, 64, 832, 832, 832, 2752]
    - [0, 9.259]
  - - [960, 2752, 1, 64, 960, 960, 960, 2752]
    - [0, 9.506]
  - - [1088, 2752, 1, 64, 1088, 1088, 1088, 2752]
    - [0, 9.646]
  - - [1216, 2752, 1, 64, 1216, 1216, 1216, 2752]
    - [0, 9.757]
  - - [1344, 2752, 1, 64, 1344, 1344, 1344, 2752]
    - [0, 9.798]
  - - [1472, 2752, 1, 64, 1472, 1472, 1472, 2752]
    - [0, 9.802]
  - - [1600, 2752, 1, 64, 1600, 1600, 1600, 2752]
    - [0, 10.333]
  - - [1728, 2752, 1, 64, 1728, 1728, 1728, 2752]
    - [0, 9.774]
  - - [1856, 2752, 1, 64, 1856, 1856, 1856, 2752]
    - [0, 10.293]
  - - [1984, 2752, 1, 64, 1984, 1984, 1984, 2752]
    - [0, 9.717]
  - - [2112, 2752, 1, 64, 2112, 2112, 2112, 2752]
    - [0, 10.486]
  - - [2240, 2752, 1, 64, 2240, 2240, 2240, 2752]
    - [0, 9.606]
  - - [2368, 2752, 1, 64, 2368, 2368, 2368, 2752]
    - [0, 9.691]
  - - [2496, 2752, 1, 64, 2496, 2496, 2496, 2752]
    - [0, 9.702]
  - - [2624, 2752, 1, 64, 2624, 2624, 2624, 2752]
    - [0, 9.66]
  - - [2752, 2752, 1, 64, 2752, 2752, 2752, 2752]
    - [0, 9.857]
  - - [2880, 2752, 1, 64, 2880, 2880, 2880, 2752]
    - [0, 9.754]
  - - [3008, 2752, 1, 64, 3008, 3008, 3008, 2752]
    - [0, 9.818]
  - - [3136, 2752, 1, 64, 3136, 3136, 3136, 2752]
    - [0, 10.079]
  - - [3264, 2752, 1, 64, 3264, 3264, 3264, 2752]
    - [0, 10.021]
  - - [3392, 2752, 1, 64, 3392, 3392, 3392, 2752]
    - [0, 9.814]
  - - [3520, 2752, 1, 64, 3520, 3520, 3520, 2752]
    - [0, 10.042]
  - - [3648, 2752, 1, 64, 3648, 3648, 3648, 2752]
    - [0, 10.453]
  - - [3776, 2752, 1, 64, 3776, 3776, 3776, 2752]
    - [0, 10.292]
  - - [3904, 2752, 1, 64, 3904, 3904, 3904, 2752]
    - [0, 9.729]
  - - [4032, 2752, 1, 64, 4032, 4032, 4032, 2752]
    - [0, 9.86]
  - - [64, 2880, 1, 64, 64, 64, 64, 2880]
    - [3, 1.607]
  - - [192, 2880, 1, 64, 192, 192, 192, 2880]
    - [2, 5.779]
  - - [320, 2880, 1, 64, 320, 320, 320, 2880]
    - [0, 7.279]
  - - [448, 2880, 1, 64, 448, 448, 448, 2880]
    - [0, 8.054]
  - - [576, 2880, 1, 64, 576, 576, 576, 2880]
    - [0, 8.72]
  - - [704, 2880, 1, 64, 704, 704, 704, 2880]
    - [0, 9.036]
  - - [832, 2880, 1, 64, 832, 832, 832, 2880]
    - [0, 9.418]
  - - [960, 2880, 1, 64, 960, 960, 960, 2880]
    - [0, 9.865]
  - - [1088, 2880, 1, 64, 1088, 1088, 1088, 2880]
    - [0, 10.154]
  - - [1216, 2880, 1, 64, 1216, 1216, 1216, 2880]
    - [0, 10.116]
  - - [1344, 2880, 1, 64, 1344, 1344, 1344, 2880]
    - [0, 9.829]
  - - [1472, 2880, 1, 64, 1472, 1472, 1472, 2880]
    - [0, 10.256]
  - - [1600, 2880, 1, 64, 1600, 1600, 1600, 2880]
    - [0, 9.714]
  - - [1728, 2880, 1, 64, 1728, 1728, 1728, 2880]
    - [0, 9.765]
  - - [1856, 2880, 1, 64, 1856, 1856, 1856, 2880]
    - [0, 9.935]
  - - [1984, 2880, 1, 64, 1984, 1984, 1984, 2880]
    - [0, 9.706]
  - - [2112, 2880, 1, 64, 2112, 2112, 2112, 2880]
    - [0, 10.453]
  - - [2240, 2880, 1, 64, 2240, 2240, 2240, 2880]
    - [2, 9.504]
  - - [2368, 2880, 1, 64, 2368, 2368, 2368, 2880]
    - [0, 9.717]
  - - [2496, 2880, 1, 64, 2496, 2496, 2496, 2880]
    - [0, 9.786]
  - - [2624, 2880, 1, 64, 2624, 2624, 2624, 2880]
    - [0, 9.727]
  - - [2752, 2880, 1, 64, 2752, 2752, 2752, 2880]
    - [0, 9.666]
  - - [2880, 2880, 1, 64, 2880, 2880, 2880, 2880]
    - [0, 9.89]
  - - [3008, 2880, 1, 64, 3008, 3008, 3008, 2880]
    - [0, 9.885]
  - - [3136, 2880, 1, 64, 3136, 3136, 3136, 2880]
    - [0, 10.023]
  - - [3264, 2880, 1, 64, 3264, 3264, 3264, 2880]
    - [0, 9.999]
  - - [3392, 2880, 1, 64, 3392, 3392, 3392, 2880]
    - [0, 10.08]
  - - [3520, 2880, 1, 64, 3520, 3520, 3520, 2880]
    - [0, 10.318]
  - - [3648, 2880, 1, 64, 3648, 3648, 3648, 2880]
    - [0, 10.328]
  - - [3776, 2880, 1, 64, 3776, 3776, 3776, 2880]
    - [0, 9.874]
  - - [3904, 2880, 1, 64, 3904, 3904, 3904, 2880]
    - [0, 9.901]
  - - [4032, 2880, 1, 64, 4032, 4032, 4032, 2880]
    - [0, 10.031]
  - - [64, 3008, 1, 64, 64, 64, 64, 3008]
    - [2, 0.797]
  - - [192, 3008, 1, 64, 192, 192, 192, 3008]
    - [0, 6.181]
  - - [320, 3008, 1, 64, 320, 320, 320, 3008]
    - [0, 7.38]
  - - [448, 3008, 1, 64, 448, 448, 448, 3008]
    - [0, 8.129]
  - - [576, 3008, 1, 64, 576, 576, 576, 3008]
    - [0, 8.745]
  - - [704, 3008, 1, 64, 704, 704, 704, 3008]
    - [0, 9.102]
  - - [832, 3008, 1, 64, 832, 832, 832, 3008]
    - [0, 9.409]
  - - [960, 3008, 1, 64, 960, 960, 960, 3008]
    - [0, 9.891]
  - - [1088, 3008, 1, 64, 1088, 1088, 1088, 3008]
    - [0, 9.996]
  - - [1216, 3008, 1, 64, 1216, 1216, 1216, 3008]
    - [0, 9.948]
  - - [1344, 3008, 1, 64, 1344, 1344, 1344, 3008]
    - [0, 9.988]
  - - [1472, 3008, 1, 64, 1472, 1472, 1472, 3008]
    - [0, 9.717]
  - - [1600, 3008, 1, 64, 1600, 1600, 1600, 3008]
    - [0, 9.828]
  - - [1728, 3008, 1, 64, 1728, 1728, 1728, 3008]
    - [0, 9.229]
  - - [1856, 3008, 1, 64, 1856, 1856, 1856, 3008]
    - [0, 9.967]
  - - [1984, 3008, 1, 64, 1984, 1984, 1984, 3008]
    - [0, 9.786]
  - - [2112, 3008, 1, 64, 2112, 2112, 2112, 3008]
    - [0, 9.734]
  - - [2240, 3008, 1, 64, 2240, 2240, 2240, 3008]
    - [0, 9.882]
  - - [2368, 3008, 1, 64, 2368, 2368, 2368, 3008]
    - [0, 9.361]
  - - [2496, 3008, 1, 64, 2496, 2496, 2496, 3008]
    - [0, 9.866]
  - - [2624, 3008, 1, 64, 2624, 2624, 2624, 3008]
    - [0, 9.81]
  - - [2752, 3008, 1, 64, 2752, 2752, 2752, 3008]
    - [0, 9.996]
  - - [2880, 3008, 1, 64, 2880, 2880, 2880, 3008]
    - [0, 10.056]
  - - [3008, 3008, 1, 64, 3008, 3008, 3008, 3008]
    - [0, 10.207]
  - - [3136, 3008, 1, 64, 3136, 3136, 3136, 3008]
    - [2, 9.451]
  - - [3264, 3008, 1, 64, 3264, 3264, 3264, 3008]
    - [0, 10.05]
  - - [3392, 3008, 1, 64, 3392, 3392, 3392, 3008]
    - [0, 10.209]
  - - [3520, 3008, 1, 64, 3520, 3520, 3520, 3008]
    - [0, 9.844]
  - - [3648, 3008, 1, 64, 3648, 3648, 3648, 3008]
    - [0, 9.883]
  - - [3776, 3008, 1, 64, 3776, 3776, 3776, 3008]
    - [0, 9.948]
  - - [3904, 3008, 1, 64, 3904, 3904, 3904, 3008]
    - [0, 9.897]
  - - [4032, 3008, 1, 64, 4032, 4032, 4032, 3008]
    - [0, 9.79]
  - - [64, 3136, 1, 64, 64, 64, 64, 3136]
    - [2, 0.826]
  - - [192, 3136, 1, 64, 192, 192, 192, 3136]
    - [1, 4.77]
  - - [320, 3136, 1, 64, 320, 320, 320, 3136]
    - [2, 6.927]
  - - [448, 3136, 1, 64, 448, 448, 448, 3136]
    - [0, 8.246]
  - - [576, 3136, 1, 64, 576, 576, 576, 3136]
    - [0, 8.839]
  - - [704, 3136, 1, 64, 704, 704, 704, 3136]
    - [0, 9.167]
  - - [832, 3136, 1, 64, 832, 832, 832, 3136]
    - [0, 9.5]
  - - [960, 3136, 1, 64, 960, 960, 960, 3136]
    - [0, 9.971]
  - - [1088, 3136, 1, 64, 1088, 1088, 1088, 3136]
    - [0, 10.024]
  - - [1216, 3136, 1, 64, 1216, 1216, 1216, 3136]
    - [0, 9.754]
  - - [1344, 3136, 1, 64, 1344, 1344, 1344, 3136]
    - [0, 9.831]
  - - [1472, 3136, 1, 64, 1472, 1472, 1472, 3136]
    - [0, 9.682]
  - - [1600, 3136, 1, 64, 1600, 1600, 1600, 3136]
    - [0, 9.76]
  - - [1728, 3136, 1, 64, 1728, 1728, 1728, 3136]
    - [0, 9.62]
  - - [1856, 3136, 1, 64, 1856, 1856, 1856, 3136]
    - [0, 9.756]
  - - [1984, 3136, 1, 64, 1984, 1984, 1984, 3136]
    - [0, 9.585]
  - - [2112, 3136, 1, 64, 2112, 2112, 2112, 3136]
    - [0, 9.833]
  - - [2240, 3136, 1, 64, 2240, 2240, 2240, 3136]
    - [2, 9.35]
  - - [2368, 3136, 1, 64, 2368, 2368, 2368, 3136]
    - [0, 10.232]
  - - [2496, 3136, 1, 64, 2496, 2496, 2496, 3136]
    - [0, 10.205]
  - - [2624, 3136, 1, 64, 2624, 2624, 2624, 3136]
    - [0, 9.872]
  - - [2752, 3136, 1, 64, 2752, 2752, 2752, 3136]
    - [0, 10.457]
  - - [2880, 3136, 1, 64, 2880, 2880, 2880, 3136]
    - [0, 10.112]
  - - [3008, 3136, 1, 64, 3008, 3008, 3008, 3136]
    - [0, 10.214]
  - - [3136, 3136, 1, 64, 3136, 3136, 3136, 3136]
    - [0, 10.141]
  - - [3264, 3136, 1, 64, 3264, 3264, 3264, 3136]
    - [0, 10.379]
  - - [3392, 3136, 1, 64, 3392, 3392, 3392, 3136]
    - [0, 9.958]
  - - [3520, 3136, 1, 64, 3520, 3520, 3520, 3136]
    - [0, 10.062]
  - - [3648, 3136, 1, 64, 3648, 3648, 3648, 3136]
    - [0, 9.953]
  - - [3776, 3136, 1, 64, 3776, 3776, 3776, 3136]
    - [0, 10.02]
  - - [3904, 3136, 1, 64, 3904, 3904, 3904, 3136]
    - [0, 9.958]
  - - [4032, 3136, 1, 64, 4032, 4032, 4032, 3136]
    - [0, 9.907]
  - - [64, 3264, 1, 64, 64, 64, 64, 3264]
    - [0, 3.62]
  - - [192, 3264, 1, 64, 192, 192, 192, 3264]
    - [0, 6.316]
  - - [320, 3264, 1, 64, 320, 320, 320, 3264]
    - [0, 7.47]
  - - [448, 3264, 1, 64, 448, 448, 448, 3264]
    - [0, 8.345]
  - - [576, 3264, 1, 64, 576, 576, 576, 3264]
    - [0, 8.89]
  - - [704, 3264, 1, 64, 704, 704, 704, 3264]
    - [0, 9.252]
  - - [832, 3264, 1, 64, 832, 832, 832, 3264]
    - [0, 9.553]
  - - [960, 3264, 1, 64, 960, 960, 960, 3264]
    - [0, 9.755]
  - - [1088, 3264, 1, 64, 1088, 1088, 1088, 3264]
    - [0, 9.914]
  - - [1216, 3264, 1, 64, 1216, 1216, 1216, 3264]
    - [0, 9.889]
  - - [1344, 3264, 1, 64, 1344, 1344, 1344, 3264]
    - [0, 10.223]
  - - [1472, 3264, 1, 64, 1472, 1472, 1472, 3264]
    - [0, 9.827]
  - - [1600, 3264, 1, 64, 1600, 1600, 1600, 3264]
    - [0, 10.336]
  - - [1728, 3264, 1, 64, 1728, 1728, 1728, 3264]
    - [0, 10.605]
  - - [1856, 3264, 1, 64, 1856, 1856, 1856, 3264]
    - [0, 9.784]
  - - [1984, 3264, 1, 64, 1984, 1984, 1984, 3264]
    - [0, 9.741]
  - - [2112, 3264, 1, 64, 2112, 2112, 2112, 3264]
    - [0, 9.89]
  - - [2240, 3264, 1, 64, 2240, 2240, 2240, 3264]
    - [0, 9.97]
  - - [2368, 3264, 1, 64, 2368, 2368, 2368, 3264]
    - [0, 10.052]
  - - [2496, 3264, 1, 64, 2496, 2496, 2496, 3264]
    - [0, 9.87]
  - - [2624, 3264, 1, 64, 2624, 2624, 2624, 3264]
    - [0, 9.67]
  - - [2752, 3264, 1, 64, 2752, 2752, 2752, 3264]
    - [0, 10.04]
  - - [2880, 3264, 1, 64, 2880, 2880, 2880, 3264]
    - [0, 10.39]
  - - [3008, 3264, 1, 64, 3008, 3008, 3008, 3264]
    - [0, 10.179]
  - - [3136, 3264, 1, 64, 3136, 3136, 3136, 3264]
    - [0, 10.626]
  - - [3264, 3264, 1, 64, 3264, 3264, 3264, 3264]
    - [0, 9.706]
  - - [3392, 3264, 1, 64, 3392, 3392, 3392, 3264]
    - [0, 10.072]
  - - [3520, 3264, 1, 64, 3520, 3520, 3520, 3264]
    - [0, 10.019]
  - - [3648, 3264, 1, 64, 3648, 3648, 3648, 3264]
    - [0, 9.909]
  - - [3776, 3264, 1, 64, 3776, 3776, 3776, 3264]
    - [0, 10.117]
  - - [3904, 3264, 1, 64, 3904, 3904, 3904, 3264]
    - [0, 9.467]
  - - [4032, 3264, 1, 64, 4032, 4032, 4032, 3264]
    - [0, 9.186]
  - - [64, 3392, 1, 64, 64, 64, 64, 3392]
    - [3, 3.636]
  - - [192, 3392, 1, 64, 192, 192, 192, 3392]
    - [0, 6.372]
  - - [320, 3392, 1, 64, 320, 320, 320, 3392]
    - [0, 7.575]
  - - [448, 3392, 1, 64, 448, 448, 448, 3392]
    - [0, 8.41]
  - - [576, 3392, 1, 64, 576, 576, 576, 3392]
    - [0, 8.967]
  - - [704, 3392, 1, 64, 704, 704, 704, 3392]
    - [0, 9.318]
  - - [832, 3392, 1, 64, 832, 832, 832, 3392]
    - [0, 9.611]
  - - [960, 3392, 1, 64, 960, 960, 960, 3392]
    - [0, 9.972]
  - - [1088, 3392, 1, 64, 1088, 1088, 1088, 3392]
    - [0, 10.155]
  - - [1216, 3392, 1, 64, 1216, 1216, 1216, 3392]
    - [0, 9.961]
  - - [1344, 3392, 1, 64, 1344, 1344, 1344, 3392]
    - [0, 10.049]
  - - [1472, 3392, 1, 64, 1472, 1472, 1472, 3392]
    - [0, 9.618]
  - - [1600, 3392, 1, 64, 1600, 1600, 1600, 3392]
    - [0, 9.59]
  - - [1728, 3392, 1, 64, 1728, 1728, 1728, 3392]
    - [0, 9.567]
  - - [1856, 3392, 1, 64, 1856, 1856, 1856, 3392]
    - [0, 9.592]
  - - [1984, 3392, 1, 64, 1984, 1984, 1984, 3392]
    - [0, 9.727]
  - - [2112, 3392, 1, 64, 2112, 2112, 2112, 3392]
    - [0, 9.839]
  - - [2240, 3392, 1, 64, 2240, 2240, 2240, 3392]
    - [0, 9.88]
  - - [2368, 3392, 1, 64, 2368, 2368, 2368, 3392]
    - [0, 9.84]
  - - [2496, 3392, 1, 64, 2496, 2496, 2496, 3392]
    - [0, 10.064]
  - - [2624, 3392, 1, 64, 2624, 2624, 2624, 3392]
    - [0, 10.031]
  - - [2752, 3392, 1, 64, 2752, 2752, 2752, 3392]
    - [0, 10.301]
  - - [2880, 3392, 1, 64, 2880, 2880, 2880, 3392]
    - [0, 10.247]
  - - [3008, 3392, 1, 64, 3008, 3008, 3008, 3392]
    - [0, 10.087]
  - - [3136, 3392, 1, 64, 3136, 3136, 3136, 3392]
    - [0, 10.002]
  - - [3264, 3392, 1, 64, 3264, 3264, 3264, 3392]
    - [0, 9.871]
  - - [3392, 3392, 1, 64, 3392, 3392, 3392, 3392]
    - [0, 9.921]
  - - [3520, 3392, 1, 64, 3520, 3520, 3520, 3392]
    - [0, 10.017]
  - - [3648, 3392, 1, 64, 3648, 3648, 3648, 3392]
    - [0, 9.87]
  - - [3776, 3392, 1, 64, 3776, 3776, 3776, 3392]
    - [0, 9.478]
  - - [3904, 3392, 1, 64, 3904, 3904, 3904, 3392]
    - [0, 8.992]
  - - [4032, 3392, 1, 64, 4032, 4032, 4032, 3392]
    - [0, 8.942]
  - - [64, 3520, 1, 64, 64, 64, 64, 3520]
    - [2, 1.869]
  - - [192, 3520, 1, 64, 192, 192, 192, 3520]
    - [0, 6.492]
  - - [320, 3520, 1, 64, 320, 320, 320, 3520]
    - [0, 7.71]
  - - [448, 3520, 1, 64, 448, 448, 448, 3520]
    - [0, 8.481]
  - - [576, 3520, 1, 64, 576, 576, 576, 3520]
    - [0, 9.008]
  - - [704, 3520, 1, 64, 704, 704, 704, 3520]
    - [0, 9.395]
  - - [832, 3520, 1, 64, 832, 832, 832, 3520]
    - [0, 9.902]
  - - [960, 3520, 1, 64, 960, 960, 960, 3520]
    - [0, 9.837]
  - - [1088, 3520, 1, 64, 1088, 1088, 1088, 3520]
    - [0, 9.971]
  - - [1216, 3520, 1, 64, 1216, 1216, 1216, 3520]
    - [0, 10.424]
  - - [1344, 3520, 1, 64, 1344, 1344, 1344, 3520]
    - [0, 9.521]
  - - [1472, 3520, 1, 64, 1472, 1472, 1472, 3520]
    - [0, 9.62]
  - - [1600, 3520, 1, 64, 1600, 1600, 1600, 3520]
    - [0, 9.289]
  - - [1728, 3520, 1, 64, 1728, 1728, 1728, 3520]
    - [0, 9.941]
  - - [1856, 3520, 1, 64, 1856, 1856, 1856, 3520]
    - [0, 9.901]
  - - [1984, 3520, 1, 64, 1984, 1984, 1984, 3520]
    - [0, 10.121]
  - - [2112, 3520, 1, 64, 2112, 2112, 2112, 3520]
    - [0, 9.998]
  - - [2240, 3520, 1, 64, 2240, 2240, 2240, 3520]
    - [0, 9.831]
  - - [2368, 3520, 1, 64, 2368, 2368, 2368, 3520]
    - [0, 9.989]
  - - [2496, 3520, 1, 64, 2496, 2496, 2496, 3520]
    - [0, 10.02]
  - - [2624, 3520, 1, 64, 2624, 2624, 2624, 3520]
    - [0, 9.96]
  - - [2752, 3520, 1, 64, 2752, 2752, 2752, 3520]
    - [0, 10.05]
  - - [2880, 3520, 1, 64, 2880, 2880, 2880, 3520]
    - [0, 9.843]
  - - [3008, 3520, 1, 64, 3008, 3008, 3008, 3520]
    - [0, 10.11]
  - - [3136, 3520, 1, 64, 3136, 3136, 3136, 3520]
    - [0, 9.702]
  - - [3264, 3520, 1, 64, 3264, 3264, 3264, 3520]
    - [0, 10.035]
  - - [3392, 3520, 1, 64, 3392, 3392, 3392, 3520]
    - [0, 10.131]
  - - [3520, 3520, 1, 64, 3520, 3520, 3520, 3520]
    - [0, 9.846]
  - - [3648, 3520, 1, 64, 3648, 3648, 3648, 3520]
    - [0, 9.4]
  - - [3776, 3520, 1, 64, 3776, 3776, 3776, 3520]
    - [0, 8.67]
  - - [3904, 3520, 1, 64, 3904, 3904, 3904, 3520]
    - [0, 9.023]
  - - [4032, 3520, 1, 64, 4032, 4032, 4032, 3520]
    - [0, 8.669]
  - - [64, 3648, 1, 64, 64, 64, 64, 3648]
    - [0, 4.006]
  - - [192, 3648, 1, 64, 192, 192, 192, 3648]
    - [0, 6.516]
  - - [320, 3648, 1, 64, 320, 320, 320, 3648]
    - [0, 7.808]
  - - [448, 3648, 1, 64, 448, 448, 448, 3648]
    - [0, 8.569]
  - - [576, 3648, 1, 64, 576, 576, 576, 3648]
    - [0, 9.088]
  - - [704, 3648, 1, 64, 704, 704, 704, 3648]
    - [0, 9.434]
  - - [832, 3648, 1, 64, 832, 832, 832, 3648]
    - [0, 9.983]
  - - [960, 3648, 1, 64, 960, 960, 960, 3648]
    - [0, 10.14]
  - - [1088, 3648, 1, 64, 1088, 1088, 1088, 3648]
    - [0, 10.136]
  - - [1216, 3648, 1, 64, 1216, 1216, 1216, 3648]
    - [0, 9.971]
  - - [1344, 3648, 1, 64, 1344, 1344, 1344, 3648]
    - [0, 9.783]
  - - [1472, 3648, 1, 64, 1472, 1472, 1472, 3648]
    - [0, 10.245]
  - - [1600, 3648, 1, 64, 1600, 1600, 1600, 3648]
    - [0, 9.628]
  - - [1728, 3648, 1, 64, 1728, 1728, 1728, 3648]
    - [0, 10.309]
  - - [1856, 3648, 1, 64, 1856, 1856, 1856, 3648]
    - [0, 10.187]
  - - [1984, 3648, 1, 64, 1984, 1984, 1984, 3648]
    - [0, 9.791]
  - - [2112, 3648, 1, 64, 2112, 2112, 2112, 3648]
    - [0, 9.78]
  - - [2240, 3648, 1, 64, 2240, 2240, 2240, 3648]
    - [0, 9.79]
  - - [2368, 3648, 1, 64, 2368, 2368, 2368, 3648]
    - [0, 9.65]
  - - [2496, 3648, 1, 64, 2496, 2496, 2496, 3648]
    - [0, 10.106]
  - - [2624, 3648, 1, 64, 2624, 2624, 2624, 3648]
    - [0, 10.615]
  - - [2752, 3648, 1, 64, 2752, 2752, 2752, 3648]
    - [0, 10.433]
  - - [2880, 3648, 1, 64, 2880, 2880, 2880, 3648]
    - [0, 10.439]
  - - [3008, 3648, 1, 64, 3008, 3008, 3008, 3648]
    - [0, 9.65]
  - - [3136, 3648, 1, 64, 3136, 3136, 3136, 3648]
    - [0, 9.883]
  - - [3264, 3648, 1, 64, 3264, 3264, 3264, 3648]
    - [0, 9.964]
  - - [3392, 3648, 1, 64, 3392, 3392, 3392, 3648]
    - [0, 10.0]
  - - [3520, 3648, 1, 64, 3520, 3520, 3520, 3648]
    - [0, 9.49]
  - - [3648, 3648, 1, 64, 3648, 3648, 3648, 3648]
    - [0, 9.011]
  - - [3776, 3648, 1, 64, 3776, 3776, 3776, 3648]
    - [0, 8.596]
  - - [3904, 3648, 1, 64, 3904, 3904, 3904, 3648]
    - [0, 8.59]
  - - [4032, 3648, 1, 64, 4032, 4032, 4032, 3648]
    - [2, 8.088]
  - - [64, 3776, 1, 64, 64, 64, 64, 3776]
    - [0, 4.102]
  - - [192, 3776, 1, 64, 192, 192, 192, 3776]
    - [0, 5.782]
  - - [320, 3776, 1, 64, 320, 320, 320, 3776]
    - [0, 7.848]
  - - [448, 3776, 1, 64, 448, 448, 448, 3776]
    - [0, 8.618]
  - - [576, 3776, 1, 64, 576, 576, 576, 3776]
    - [0, 9.132]
  - - [704, 3776, 1, 64, 704, 704, 704, 3776]
    - [0, 9.455]
  - - [832, 3776, 1, 64, 832, 832, 832, 3776]
    - [0, 9.727]
  - - [960, 3776, 1, 64, 960, 960, 960, 3776]
    - [0, 9.938]
  - - [1088, 3776, 1, 64, 1088, 1088, 1088, 3776]
    - [0, 9.803]
  - - [1216, 3776, 1, 64, 1216, 1216, 1216, 3776]
    - [0, 9.673]
  - - [1344, 3776, 1, 64, 1344, 1344, 1344, 3776]
    - [0, 10.162]
  - - [1472, 3776, 1, 64, 1472, 1472, 1472, 3776]
    - [0, 9.909]
  - - [1600, 3776, 1, 64, 1600, 1600, 1600, 3776]
    - [0, 10.03]
  - - [1728, 3776, 1, 64, 1728, 1728, 1728, 3776]
    - [2, 9.281]
  - - [1856, 3776, 1, 64, 1856, 1856, 1856, 3776]
    - [0, 9.878]
  - - [1984, 3776, 1, 64, 1984, 1984, 1984, 3776]
    - [0, 9.774]
  - - [2112, 3776, 1, 64, 2112, 2112, 2112, 3776]
    - [2, 9.616]
  - - [2240, 3776, 1, 64, 2240, 2240, 2240, 3776]
    - [0, 9.894]
  - - [2368, 3776, 1, 64, 2368, 2368, 2368, 3776]
    - [0, 9.992]
  - - [2496, 3776, 1, 64, 2496, 2496, 2496, 3776]
    - [0, 10.331]
  - - [2624, 3776, 1, 64, 2624, 2624, 2624, 3776]
    - [0, 9.911]
  - - [2752, 3776, 1, 64, 2752, 2752, 2752, 3776]
    - [0, 10.184]
  - - [2880, 3776, 1, 64, 2880, 2880, 2880, 3776]
    - [0, 9.69]
  - - [3008, 3776, 1, 64, 3008, 3008, 3008, 3776]
    - [0, 9.85]
  - - [3136, 3776, 1, 64, 3136, 3136, 3136, 3776]
    - [0, 9.92]
  - - [3264, 3776, 1, 64, 3264, 3264, 3264, 3776]
    - [0, 9.952]
  - - [3392, 3776, 1, 64, 3392, 3392, 3392, 3776]
    - [0, 9.43]
  - - [3520, 3776, 1, 64, 3520, 3520, 3520, 3776]
    - [0, 8.995]
  - - [3648, 3776, 1, 64, 3648, 3648, 3648, 3776]
    - [0, 8.92]
  - - [3776, 3776, 1, 64, 3776, 3776, 3776, 3776]
    - [0, 7.963]
  - - [3904, 3776, 1, 64, 3904, 3904, 3904, 3776]
    - [2, 7.994]
  - - [4032, 3776, 1, 64, 4032, 4032, 4032, 3776]
    - [2, 8.104]
  - - [64, 3904, 1, 64, 64, 64, 64, 3904]
    - [0, 3.767]
  - - [192, 3904, 1, 64, 192, 192, 192, 3904]
    - [0, 6.694]
  - - [320, 3904, 1, 64, 320, 320, 320, 3904]
    - [0, 7.937]
  - - [448, 3904, 1, 64, 448, 448, 448, 3904]
    - [0, 8.694]
  - - [576, 3904, 1, 64, 576, 576, 576, 3904]
    - [0, 9.201]
  - - [704, 3904, 1, 64, 704, 704, 704, 3904]
    - [0, 9.535]
  - - [832, 3904, 1, 64, 832, 832, 832, 3904]
    - [0, 10.13]
  - - [960, 3904, 1, 64, 960, 960, 960, 3904]
    - [0, 9.979]
  - - [1088, 3904, 1, 64, 1088, 1088, 1088, 3904]
    - [0, 10.136]
  - - [1216, 3904, 1, 64, 1216, 1216, 1216, 3904]
    - [0, 10.014]
  - - [1344, 3904, 1, 64, 1344, 1344, 1344, 3904]
    - [0, 9.993]
  - - [1472, 3904, 1, 64, 1472, 1472, 1472, 3904]
    - [0, 9.536]
  - - [1600, 3904, 1, 64, 1600, 1600, 1600, 3904]
    - [0, 10.536]
  - - [1728, 3904, 1, 64, 1728, 1728, 1728, 3904]
    - [0, 9.561]
  - - [1856, 3904, 1, 64, 1856, 1856, 1856, 3904]
    - [0, 9.859]
  - - [1984, 3904, 1, 64, 1984, 1984, 1984, 3904]
    - [0, 9.899]
  - - [2112, 3904, 1, 64, 2112, 2112, 2112, 3904]
    - [0, 9.748]
  - - [2240, 3904, 1, 64, 2240, 2240, 2240, 3904]
    - [0, 10.188]
  - - [2368, 3904, 1, 64, 2368, 2368, 2368, 3904]
    - [0, 9.922]
  - - [2496, 3904, 1, 64, 2496, 2496, 2496, 3904]
    - [0, 10.366]
  - - [2624, 3904, 1, 64, 2624, 2624, 2624, 3904]
    - [0, 10.163]
  - - [2752, 3904, 1, 64, 2752, 2752, 2752, 3904]
    - [0, 9.896]
  - - [2880, 3904, 1, 64, 2880, 2880, 2880, 3904]
    - [0, 9.878]
  - - [3008, 3904, 1, 64, 3008, 3008, 3008, 3904]
    - [0, 9.927]
  - - [3136, 3904, 1, 64, 3136, 3136, 3136, 3904]
    - [0, 10.041]
  - - [3264, 3904, 1, 64, 3264, 3264, 3264, 3904]
    - [0, 9.54]
  - - [3392, 3904, 1, 64, 3392, 3392, 3392, 3904]
    - [0, 9.17]
  - - [3520, 3904, 1, 64, 3520, 3520, 3520, 3904]
    - [0, 9.083]
  - - [3648, 3904, 1, 64, 3648, 3648, 3648, 3904]
    - [0, 8.582]
  - - [3776, 3904, 1, 64, 3776, 3776, 3776, 3904]
    - [0, 6.999]
  - - [3904, 3904, 1, 64, 3904, 3904, 3904, 3904]
    - [2, 8.057]
  - - [4032, 3904, 1, 64, 4032, 4032, 4032, 3904]
    - [2, 8.066]
  - - [64, 4032, 1, 64, 64, 64, 64, 4032]
    - [0, 3.823]
  - - [192, 4032, 1, 64, 192, 192, 192, 4032]
    - [0, 6.793]
  - - [320, 4032, 1, 64, 320, 320, 320, 4032]
    - [0, 7.968]
  - - [448, 4032, 1, 64, 448, 448, 448, 4032]
    - [0, 8.765]
  - - [576, 4032, 1, 64, 576, 576, 576, 4032]
    - [0, 9.398]
  - - [704, 4032, 1, 64, 704, 704, 704, 4032]
    - [0, 9.659]
  - - [832, 4032, 1, 64, 832, 832, 832, 4032]
    - [0, 10.044]
  - - [960, 4032, 1, 64, 960, 960, 960, 4032]
    - [0, 9.946]
  - - [1088, 4032, 1, 64, 1088, 1088, 1088, 4032]
    - [0, 9.733]
  - - [1216, 4032, 1, 64, 1216, 1216, 1216, 4032]
    - [0, 10.266]
  - - [1344, 4032, 1, 64, 1344, 1344, 1344, 4032]
    - [0, 9.667]
  - - [1472, 4032, 1, 64, 1472, 1472, 1472, 4032]
    - [0, 9.638]
  - - [1600, 4032, 1, 64, 1600, 1600, 1600, 4032]
    - [0, 10.305]
  - - [1728, 4032, 1, 64, 1728, 1728, 1728, 4032]
    - [0, 9.644]
  - - [1856, 4032, 1, 64, 1856, 1856, 1856, 4032]
    - [0, 9.791]
  - - [1984, 4032, 1, 64, 1984, 1984, 1984, 4032]
    - [0, 9.74]
  - - [2112, 4032, 1, 64, 2112, 2112, 2112, 4032]
    - [0, 9.575]
  - - [2240, 4032, 1, 64, 2240, 2240, 2240, 4032]
    - [0, 10.229]
  - - [2368, 4032, 1, 64, 2368, 2368, 2368, 4032]
    - [0, 10.291]
  - - [2496, 4032, 1, 64, 2496, 2496, 2496, 4032]
    - [0, 10.282]
  - - [2624, 4032, 1, 64, 2624, 2624, 2624, 4032]
    - [0, 10.203]
  - - [2752, 4032, 1, 64, 2752, 2752, 2752, 4032]
    - [0, 10.014]
  - - [2880, 4032, 1, 64, 2880, 2880, 2880, 4032]
    - [0, 10.127]
  - - [3008, 4032, 1, 64, 3008, 3008, 3008, 4032]
    - [0, 9.896]
  - - [3136, 4032, 1, 64, 3136, 3136, 3136, 4032]
    - [0, 9.758]
  - - [3264, 4032, 1, 64, 3264, 3264, 3264, 4032]
    - [0, 9.099]
  - - [3392, 4032, 1, 64, 3392, 3392, 3392, 4032]
    - [0, 9.042]
  - - [3520, 4032, 1, 64, 3520, 3520, 3520, 4032]
    - [0, 8.592]
  - - [3648, 4032, 1, 64, 3648, 3648, 3648, 4032]
    - [2, 8.152]
  - - [3776, 4032, 1, 64, 3776, 3776, 3776, 4032]
    - [0, 7.004]
  - - [3904, 4032, 1, 64, 3904, 3904, 3904, 4032]
    - [2, 8.004]
  - - [4032, 4032, 1, 64, 4032, 4032, 4032, 4032]
    - [2, 8.098]
  - - [64, 64, 1, 256, 64, 64, 64, 64]
    - [0, 0.298]
  - - [192, 64, 1, 256, 192, 192, 192, 64]
    - [3, 0.204]
  - - [320, 64, 1, 256, 320, 320, 320, 64]
    - [1, 0.338]
  - - [448, 64, 1, 256, 448, 448, 448, 64]
    - [3, 0.474]
  - - [576, 64, 1, 256, 576, 576, 576, 64]
    - [3, 0.61]
  - - [704, 64, 1, 256, 704, 704, 704, 64]
    - [3, 0.748]
  - - [832, 64, 1, 256, 832, 832, 832, 64]
    - [0, 0.879]
  - - [960, 64, 1, 256, 960, 960, 960, 64]
    - [1, 1.015]
  - - [1088, 64, 1, 256, 1088, 1088, 1088, 64]
    - [2, 1.153]
  - - [1216, 64, 1, 256, 1216, 1216, 1216, 64]
    - [1, 1.284]
  - - [1344, 64, 1, 256, 1344, 1344, 1344, 64]
    - [2, 1.417]
  - - [1472, 64, 1, 256, 1472, 1472, 1472, 64]
    - [2, 1.555]
  - - [1600, 64, 1, 256, 1600, 1600, 1600, 64]
    - [3, 1.689]
  - - [1728, 64, 1, 256, 1728, 1728, 1728, 64]
    - [0, 1.829]
  - - [1856, 64, 1, 256, 1856, 1856, 1856, 64]
    - [0, 1.97]
  - - [1984, 64, 1, 256, 1984, 1984, 1984, 64]
    - [0, 2.096]
  - - [2112, 64, 1, 256, 2112, 2112, 2112, 64]
    - [0, 2.243]
  - - [2240, 64, 1, 256, 2240, 2240, 2240, 64]
    - [2, 2.365]
  - - [2368, 64, 1, 256, 2368, 2368, 2368, 64]
    - [1, 4.832]
  - - [2496, 64, 1, 256, 2496, 2496, 2496, 64]
    - [0, 2.632]
  - - [2624, 64, 1, 256, 2624, 2624, 2624, 64]
    - [2, 5.327]
  - - [2752, 64, 1, 256, 2752, 2752, 2752, 64]
    - [2, 5.598]
  - - [2880, 64, 1, 256, 2880, 2880, 2880, 64]
    - [0, 3.037]
  - - [3008, 64, 1, 256, 3008, 3008, 3008, 64]
    - [2, 6.12]
  - - [3136, 64, 1, 256, 3136, 3136, 3136, 64]
    - [2, 6.39]
  - - [3264, 64, 1, 256, 3264, 3264, 3264, 64]
    - [1, 6.628]
  - - [3392, 64, 1, 256, 3392, 3392, 3392, 64]
    - [0, 6.909]
  - - [3520, 64, 1, 256, 3520, 3520, 3520, 64]
    - [1, 7.212]
  - - [3648, 64, 1, 256, 3648, 3648, 3648, 64]
    - [3, 7.384]
  - - [3776, 64, 1, 256, 3776, 3776, 3776, 64]
    - [0, 7.715]
  - - [3904, 64, 1, 256, 3904, 3904, 3904, 64]
    - [0, 7.949]
  - - [4032, 64, 1, 256, 4032, 4032, 4032, 64]
    - [0, 8.161]
  - - [64, 192, 1, 256, 64, 64, 64, 192]
    - [3, 0.202]
  - - [192, 192, 1, 256, 192, 192, 192, 192]
    - [2, 0.607]
  - - [320, 192, 1, 256, 320, 320, 320, 192]
    - [1, 1.009]
  - - [448, 192, 1, 256, 448, 448, 448, 192]
    - [3, 1.42]
  - - [576, 192, 1, 256, 576, 576, 576, 192]
    - [0, 1.816]
  - - [704, 192, 1, 256, 704, 704, 704, 192]
    - [2, 4.336]
  - - [832, 192, 1, 256, 832, 832, 832, 192]
    - [3, 5.091]
  - - [960, 192, 1, 256, 960, 960, 960, 192]
    - [0, 3.045]
  - - [1088, 192, 1, 256, 1088, 1088, 1088, 192]
    - [1, 6.383]
  - - [1216, 192, 1, 256, 1216, 1216, 1216, 192]
    - [3, 7.441]
  - - [1344, 192, 1, 256, 1344, 1344, 1344, 192]
    - [1, 8.203]
  - - [1472, 192, 1, 256, 1472, 1472, 1472, 192]
    - [3, 8.997]
  - - [1600, 192, 1, 256, 1600, 1600, 1600, 192]
    - [2, 10.801]
  - - [1728, 192, 1, 256, 1728, 1728, 1728, 192]
    - [0, 12.339]
  - - [1856, 192, 1, 256, 1856, 1856, 1856, 192]
    - [3, 11.741]
  - - [1984, 192, 1, 256, 1984, 1984, 1984, 192]
    - [0, 13.315]
  - - [2112, 192, 1, 256, 2112, 2112, 2112, 192]
    - [0, 13.11]
  - - [2240, 192, 1, 256, 2240, 2240, 2240, 192]
    - [0, 13.732]
  - - [2368, 192, 1, 256, 2368, 2368, 2368, 192]
    - [0, 13.788]
  - - [2496, 192, 1, 256, 2496, 2496, 2496, 192]
    - [0, 14.295]
  - - [2624, 192, 1, 256, 2624, 2624, 2624, 192]
    - [0, 14.238]
  - - [2752, 192, 1, 256, 2752, 2752, 2752, 192]
    - [0, 14.781]
  - - [2880, 192, 1, 256, 2880, 2880, 2880, 192]
    - [0, 14.827]
  - - [3008, 192, 1, 256, 3008, 3008, 3008, 192]
    - [0, 15.285]
  - - [3136, 192, 1, 256, 3136, 3136, 3136, 192]
    - [0, 14.913]
  - - [3264, 192, 1, 256, 3264, 3264, 3264, 192]
    - [0, 15.212]
  - - [3392, 192, 1, 256, 3392, 3392, 3392, 192]
    - [0, 15.11]
  - - [3520, 192, 1, 256, 3520, 3520, 3520, 192]
    - [0, 15.366]
  - - [3648, 192, 1, 256, 3648, 3648, 3648, 192]
    - [0, 15.953]
  - - [3776, 192, 1, 256, 3776, 3776, 3776, 192]
    - [0, 16.125]
  - - [3904, 192, 1, 256, 3904, 3904, 3904, 192]
    - [0, 16.161]
  - - [4032, 192, 1, 256, 4032, 4032, 4032, 192]
    - [0, 16.619]
  - - [64, 320, 1, 256, 64, 64, 64, 320]
    - [2, 0.338]
  - - [192, 320, 1, 256, 192, 192, 192, 320]
    - [3, 1.015]
  - - [320, 320, 1, 256, 320, 320, 320, 320]
    - [1, 1.685]
  - - [448, 320, 1, 256, 448, 448, 448, 320]
    - [3, 2.365]
  - - [576, 320, 1, 256, 576, 576, 576, 320]
    - [1, 5.905]
  - - [704, 320, 1, 256, 704, 704, 704, 320]
    - [3, 7.175]
  - - [832, 320, 1, 256, 832, 832, 832, 320]
    - [2, 8.453]
  - - [960, 320, 1, 256, 960, 960, 960, 320]
    - [3, 9.784]
  - - [1088, 320, 1, 256, 1088, 1088, 1088, 320]
    - [2, 11.116]
  - - [1216, 320, 1, 256, 1216, 1216, 1216, 320]
    - [0, 12.451]
  - - [1344, 320, 1, 256, 1344, 1344, 1344, 320]
    - [0, 13.741]
  - - [1472, 320, 1, 256, 1472, 1472, 1472, 320]
    - [0, 14.194]
  - - [1600, 320, 1, 256, 1600, 1600, 1600, 320]
    - [0, 14.497]
  - - [1728, 320, 1, 256, 1728, 1728, 1728, 320]
    - [0, 14.961]
  - - [1856, 320, 1, 256, 1856, 1856, 1856, 320]
    - [0, 15.177]
  - - [1984, 320, 1, 256, 1984, 1984, 1984, 320]
    - [0, 15.753]
  - - [2112, 320, 1, 256, 2112, 2112, 2112, 320]
    - [0, 15.996]
  - - [2240, 320, 1, 256, 2240, 2240, 2240, 320]
    - [0, 16.23]
  - - [2368, 320, 1, 256, 2368, 2368, 2368, 320]
    - [0, 16.022]
  - - [2496, 320, 1, 256, 2496, 2496, 2496, 320]
    - [0, 16.637]
  - - [2624, 320, 1, 256, 2624, 2624, 2624, 320]
    - [0, 16.823]
  - - [2752, 320, 1, 256, 2752, 2752, 2752, 320]
    - [0, 17.214]
  - - [2880, 320, 1, 256, 2880, 2880, 2880, 320]
    - [0, 17.478]
  - - [3008, 320, 1, 256, 3008, 3008, 3008, 320]
    - [0, 17.522]
  - - [3136, 320, 1, 256, 3136, 3136, 3136, 320]
    - [2, 17.746]
  - - [3264, 320, 1, 256, 3264, 3264, 3264, 320]
    - [0, 17.915]
  - - [3392, 320, 1, 256, 3392, 3392, 3392, 320]
    - [0, 18.045]
  - - [3520, 320, 1, 256, 3520, 3520, 3520, 320]
    - [0, 18.222]
  - - [3648, 320, 1, 256, 3648, 3648, 3648, 320]
    - [0, 18.338]
  - - [3776, 320, 1, 256, 3776, 3776, 3776, 320]
    - [0, 18.439]
  - - [3904, 320, 1, 256, 3904, 3904, 3904, 320]
    - [0, 18.447]
  - - [4032, 320, 1, 256, 4032, 4032, 4032, 320]
    - [0, 19.217]
  - - [64, 448, 1, 256, 64, 64, 64, 448]
    - [3, 0.474]
  - - [192, 448, 1, 256, 192, 192, 192, 448]
    - [3, 1.424]
  - - [320, 448, 1, 256, 320, 320, 320, 448]
    - [3, 2.354]
  - - [448, 448, 1, 256, 448, 448, 448, 448]
    - [1, 6.379]
  - - [576, 448, 1, 256, 576, 576, 576, 448]
    - [3, 8.236]
  - - [704, 448, 1, 256, 704, 704, 704, 448]
    - [3, 10.059]
  - - [832, 448, 1, 256, 832, 832, 832, 448]
    - [3, 11.958]
  - - [960, 448, 1, 256, 960, 960, 960, 448]
    - [0, 13.664]
  - - [1088, 448, 1, 256, 1088, 1088, 1088, 448]
    - [0, 14.438]
  - - [1216, 448, 1, 256, 1216, 1216, 1216, 448]
    - [0, 14.781]
  - - [1344, 448, 1, 256, 1344, 1344, 1344, 448]
    - [0, 15.352]
  - - [1472, 448, 1, 256, 1472, 1472, 1472, 448]
    - [0, 15.708]
  - - [1600, 448, 1, 256, 1600, 1600, 1600, 448]
    - [0, 16.265]
  - - [1728, 448, 1, 256, 1728, 1728, 1728, 448]
    - [0, 16.713]
  - - [1856, 448, 1, 256, 1856, 1856, 1856, 448]
    - [0, 16.96]
  - - [1984, 448, 1, 256, 1984, 1984, 1984, 448]
    - [0, 17.202]
  - - [2112, 448, 1, 256, 2112, 2112, 2112, 448]
    - [0, 17.495]
  - - [2240, 448, 1, 256, 2240, 2240, 2240, 448]
    - [0, 17.706]
  - - [2368, 448, 1, 256, 2368, 2368, 2368, 448]
    - [0, 17.978]
  - - [2496, 448, 1, 256, 2496, 2496, 2496, 448]
    - [0, 18.194]
  - - [2624, 448, 1, 256, 2624, 2624, 2624, 448]
    - [2, 18.274]
  - - [2752, 448, 1, 256, 2752, 2752, 2752, 448]
    - [0, 18.739]
  - - [2880, 448, 1, 256, 2880, 2880, 2880, 448]
    - [0, 18.755]
  - - [3008, 448, 1, 256, 3008, 3008, 3008, 448]
    - [0, 19.185]
  - - [3136, 448, 1, 256, 3136, 3136, 3136, 448]
    - [0, 19.393]
  - - [3264, 448, 1, 256, 3264, 3264, 3264, 448]
    - [2, 19.061]
  - - [3392, 448, 1, 256, 3392, 3392, 3392, 448]
    - [2, 19.205]
  - - [3520, 448, 1, 256, 3520, 3520, 3520, 448]
    - [0, 18.825]
  - - [3648, 448, 1, 256, 3648, 3648, 3648, 448]
    - [0, 18.994]
  - - [3776, 448, 1, 256, 3776, 3776, 3776, 448]
    - [0, 19.967]
  - - [3904, 448, 1, 256, 3904, 3904, 3904, 448]
    - [2, 18.974]
  - - [4032, 448, 1, 256, 4032, 4032, 4032, 448]
    - [0, 19.412]
  - - [64, 576, 1, 256, 64, 64, 64, 576]
    - [3, 1.301]
  - - [192, 576, 1, 256, 192, 192, 192, 576]
    - [3, 6.219]
  - - [320, 576, 1, 256, 320, 320, 320, 576]
    - [1, 5.895]
  - - [448, 576, 1, 256, 448, 448, 448, 576]
    - [3, 8.188]
  - - [576, 576, 1, 256, 576, 576, 576, 576]
    - [0, 10.582]
  - - [704, 576, 1, 256, 704, 704, 704, 576]
    - [0, 12.833]
  - - [832, 576, 1, 256, 832, 832, 832, 576]
    - [0, 14.352]
  - - [960, 576, 1, 256, 960, 960, 960, 576]
    - [0, 14.95]
  - - [1088, 576, 1, 256, 1088, 1088, 1088, 576]
    - [0, 15.658]
  - - [1216, 576, 1, 256, 1216, 1216, 1216, 576]
    - [0, 16.008]
  - - [1344, 576, 1, 256, 1344, 1344, 1344, 576]
    - [0, 16.611]
  - - [1472, 576, 1, 256, 1472, 1472, 1472, 576]
    - [0, 16.967]
  - - [1600, 576, 1, 256, 1600, 1600, 1600, 576]
    - [0, 17.364]
  - - [1728, 576, 1, 256, 1728, 1728, 1728, 576]
    - [0, 17.625]
  - - [1856, 576, 1, 256, 1856, 1856, 1856, 576]
    - [0, 17.971]
  - - [1984, 576, 1, 256, 1984, 1984, 1984, 576]
    - [0, 18.309]
  - - [2112, 576, 1, 256, 2112, 2112, 2112, 576]
    - [0, 19.177]
  - - [2240, 576, 1, 256, 2240, 2240, 2240, 576]
    - [0, 18.668]
  - - [2368, 576, 1, 256, 2368, 2368, 2368, 576]
    - [0, 18.874]
  - - [2496, 576, 1, 256, 2496, 2496, 2496, 576]
    - [0, 18.836]
  - - [2624, 576, 1, 256, 2624, 2624, 2624, 576]
    - [0, 19.109]
  - - [2752, 576, 1, 256, 2752, 2752, 2752, 576]
    - [0, 19.394]
  - - [2880, 576, 1, 256, 2880, 2880, 2880, 576]
    - [0, 19.737]
  - - [3008, 576, 1, 256, 3008, 3008, 3008, 576]
    - [0, 19.406]
  - - [3136, 576, 1, 256, 3136, 3136, 3136, 576]
    - [0, 19.108]
  - - [3264, 576, 1, 256, 3264, 3264, 3264, 576]
    - [0, 19.658]
  - - [3392, 576, 1, 256, 3392, 3392, 3392, 576]
    - [0, 20.394]
  - - [3520, 576, 1, 256, 3520, 3520, 3520, 576]
    - [0, 20.045]
  - - [3648, 576, 1, 256, 3648, 3648, 3648, 576]
    - [0, 20.334]
  - - [3776, 576, 1, 256, 3776, 3776, 3776, 576]
    - [2, 18.99]
  - - [3904, 576, 1, 256, 3904, 3904, 3904, 576]
    - [2, 19.209]
  - - [4032, 576, 1, 256, 4032, 4032, 4032, 576]
    - [2, 19.255]
  - - [64, 704, 1, 256, 64, 64, 64, 704]
    - [3, 1.593]
  - - [192, 704, 1, 256, 192, 192, 192, 704]
    - [0, 7.546]
  - - [320, 704, 1, 256, 320, 320, 320, 704]
    - [0, 10.092]
  - - [448, 704, 1, 256, 448, 448, 448, 704]
    - [0, 11.818]
  - - [576, 704, 1, 256, 576, 576, 576, 704]
    - [0, 13.073]
  - - [704, 704, 1, 256, 704, 704, 704, 704]
    - [0, 14.278]
  - - [832, 704, 1, 256, 832, 832, 832, 704]
    - [0, 15.47]
  - - [960, 704, 1, 256, 960, 960, 960, 704]
    - [0, 16.072]
  - - [1088, 704, 1, 256, 1088, 1088, 1088, 704]
    - [0, 16.57]
  - - [1216, 704, 1, 256, 1216, 1216, 1216, 704]
    - [0, 16.996]
  - - [1344, 704, 1, 256, 1344, 1344, 1344, 704]
    - [0, 17.47]
  - - [1472, 704, 1, 256, 1472, 1472, 1472, 704]
    - [0, 17.764]
  - - [1600, 704, 1, 256, 1600, 1600, 1600, 704]
    - [0, 18.135]
  - - [1728, 704, 1, 256, 1728, 1728, 1728, 704]
    - [0, 18.556]
  - - [1856, 704, 1, 256, 1856, 1856, 1856, 704]
    - [2, 18.772]
  - - [1984, 704, 1, 256, 1984, 1984, 1984, 704]
    - [0, 19.482]
  - - [2112, 704, 1, 256, 2112, 2112, 2112, 704]
    - [0, 19.699]
  - - [2240, 704, 1, 256, 2240, 2240, 2240, 704]
    - [0, 19.897]
  - - [2368, 704, 1, 256, 2368, 2368, 2368, 704]
    - [0, 19.739]
  - - [2496, 704, 1, 256, 2496, 2496, 2496, 704]
    - [0, 19.786]
  - - [2624, 704, 1, 256, 2624, 2624, 2624, 704]
    - [0, 19.635]
  - - [2752, 704, 1, 256, 2752, 2752, 2752, 704]
    - [0, 19.834]
  - - [2880, 704, 1, 256, 2880, 2880, 2880, 704]
    - [0, 19.304]
  - - [3008, 704, 1, 256, 3008, 3008, 3008, 704]
    - [0, 19.313]
  - - [3136, 704, 1, 256, 3136, 3136, 3136, 704]
    - [0, 20.535]
  - - [3264, 704, 1, 256, 3264, 3264, 3264, 704]
    - [0, 19.574]
  - - [3392, 704, 1, 256, 3392, 3392, 3392, 704]
    - [0, 18.82]
  - - [3520, 704, 1, 256, 3520, 3520, 3520, 704]
    - [0, 20.037]
  - - [3648, 704, 1, 256, 3648, 3648, 3648, 704]
    - [0, 19.926]
  - - [3776, 704, 1, 256, 3776, 3776, 3776, 704]
    - [0, 19.155]
  - - [3904, 704, 1, 256, 3904, 3904, 3904, 704]
    - [0, 18.878]
  - - [4032, 704, 1, 256, 4032, 4032, 4032, 704]
    - [0, 20.202]
  - - [64, 832, 1, 256, 64, 64, 64, 832]
    - [3, 3.4]
  - - [192, 832, 1, 256, 192, 192, 192, 832]
    - [0, 7.834]
  - - [320, 832, 1, 256, 320, 320, 320, 832]
    - [0, 10.865]
  - - [448, 832, 1, 256, 448, 448, 448, 832]
    - [0, 12.783]
  - - [576, 832, 1, 256, 576, 576, 576, 832]
    - [0, 14.352]
  - - [704, 832, 1, 256, 704, 704, 704, 832]
    - [0, 15.534]
  - - [832, 832, 1, 256, 832, 832, 832, 832]
    - [0, 15.93]
  - - [960, 832, 1, 256, 960, 960, 960, 832]
    - [0, 16.643]
  - - [1088, 832, 1, 256, 1088, 1088, 1088, 832]
    - [0, 17.293]
  - - [1216, 832, 1, 256, 1216, 1216, 1216, 832]
    - [0, 17.71]
  - - [1344, 832, 1, 256, 1344, 1344, 1344, 832]
    - [0, 18.161]
  - - [1472, 832, 1, 256, 1472, 1472, 1472, 832]
    - [0, 18.499]
  - - [1600, 832, 1, 256, 1600, 1600, 1600, 832]
    - [2, 18.855]
  - - [1728, 832, 1, 256, 1728, 1728, 1728, 832]
    - [0, 19.44]
  - - [1856, 832, 1, 256, 1856, 1856, 1856, 832]
    - [0, 19.659]
  - - [1984, 832, 1, 256, 1984, 1984, 1984, 832]
    - [0, 19.984]
  - - [2112, 832, 1, 256, 2112, 2112, 2112, 832]
    - [0, 20.06]
  - - [2240, 832, 1, 256, 2240, 2240, 2240, 832]
    - [0, 20.089]
  - - [2368, 832, 1, 256, 2368, 2368, 2368, 832]
    - [0, 20.347]
  - - [2496, 832, 1, 256, 2496, 2496, 2496, 832]
    - [0, 19.569]
  - - [2624, 832, 1, 256, 2624, 2624, 2624, 832]
    - [0, 20.289]
  - - [2752, 832, 1, 256, 2752, 2752, 2752, 832]
    - [0, 20.426]
  - - [2880, 832, 1, 256, 2880, 2880, 2880, 832]
    - [0, 20.377]
  - - [3008, 832, 1, 256, 3008, 3008, 3008, 832]
    - [0, 19.452]
  - - [3136, 832, 1, 256, 3136, 3136, 3136, 832]
    - [0, 18.845]
  - - [3264, 832, 1, 256, 3264, 3264, 3264, 832]
    - [0, 19.078]
  - - [3392, 832, 1, 256, 3392, 3392, 3392, 832]
    - [0, 19.146]
  - - [3520, 832, 1, 256, 3520, 3520, 3520, 832]
    - [2, 18.887]
  - - [3648, 832, 1, 256, 3648, 3648, 3648, 832]
    - [0, 19.725]
  - - [3776, 832, 1, 256, 3776, 3776, 3776, 832]
    - [0, 19.681]
  - - [3904, 832, 1, 256, 3904, 3904, 3904, 832]
    - [0, 19.655]
  - - [4032, 832, 1, 256, 4032, 4032, 4032, 832]
    - [0, 19.655]
  - - [64, 960, 1, 256, 64, 64, 64, 960]
    - [0, 1.728]
  - - [192, 960, 1, 256, 192, 192, 192, 960]
    - [1, 5.904]
  - - [320, 960, 1, 256, 320, 320, 320, 960]
    - [3, 9.756]
  - - [448, 960, 1, 256, 448, 448, 448, 960]
    - [0, 13.732]
  - - [576, 960, 1, 256, 576, 576, 576, 960]
    - [0, 14.938]
  - - [704, 960, 1, 256, 704, 704, 704, 960]
    - [0, 16.049]
  - - [832, 960, 1, 256, 832, 832, 832, 960]
    - [0, 16.668]
  - - [960, 960, 1, 256, 960, 960, 960, 960]
    - [0, 17.41]
  - - [1088, 960, 1, 256, 1088, 1088, 1088, 960]
    - [0, 17.903]
  - - [1216, 960, 1, 256, 1216, 1216, 1216, 960]
    - [2, 18.342]
  - - [1344, 960, 1, 256, 1344, 1344, 1344, 960]
    - [0, 18.746]
  - - [1472, 960, 1, 256, 1472, 1472, 1472, 960]
    - [0, 19.589]
  - - [1600, 960, 1, 256, 1600, 1600, 1600, 960]
    - [0, 19.873]
  - - [1728, 960, 1, 256, 1728, 1728, 1728, 960]
    - [0, 19.673]
  - - [1856, 960, 1, 256, 1856, 1856, 1856, 960]
    - [0, 19.348]
  - - [1984, 960, 1, 256, 1984, 1984, 1984, 960]
    - [0, 19.812]
  - - [2112, 960, 1, 256, 2112, 2112, 2112, 960]
    - [0, 19.976]
  - - [2240, 960, 1, 256, 2240, 2240, 2240, 960]
    - [0, 19.938]
  - - [2368, 960, 1, 256, 2368, 2368, 2368, 960]
    - [0, 20.239]
  - - [2496, 960, 1, 256, 2496, 2496, 2496, 960]
    - [0, 20.09]
  - - [2624, 960, 1, 256, 2624, 2624, 2624, 960]
    - [0, 19.253]
  - - [2752, 960, 1, 256, 2752, 2752, 2752, 960]
    - [0, 18.759]
  - - [2880, 960, 1, 256, 2880, 2880, 2880, 960]
    - [0, 19.215]
  - - [3008, 960, 1, 256, 3008, 3008, 3008, 960]
    - [0, 19.871]
  - - [3136, 960, 1, 256, 3136, 3136, 3136, 960]
    - [0, 19.905]
  - - [3264, 960, 1, 256, 3264, 3264, 3264, 960]
    - [0, 19.167]
  - - [3392, 960, 1, 256, 3392, 3392, 3392, 960]
    - [2, 19.342]
  - - [3520, 960, 1, 256, 3520, 3520, 3520, 960]
    - [0, 19.381]
  - - [3648, 960, 1, 256, 3648, 3648, 3648, 960]
    - [0, 19.51]
  - - [3776, 960, 1, 256, 3776, 3776, 3776, 960]
    - [0, 20.163]
  - - [3904, 960, 1, 256, 3904, 3904, 3904, 960]
    - [2, 20.074]
  - - [4032, 960, 1, 256, 4032, 4032, 4032, 960]
    - [2, 19.919]
  - - [64, 1088, 1, 256, 64, 64, 64, 1088]
    - [3, 1.15]
  - - [192, 1088, 1, 256, 192, 192, 192, 1088]
    - [2, 6.661]
  - - [320, 1088, 1, 256, 320, 320, 320, 1088]
    - [2, 11.069]
  - - [448, 1088, 1, 256, 448, 448, 448, 1088]
    - [0, 14.537]
  - - [576, 1088, 1, 256, 576, 576, 576, 1088]
    - [0, 15.755]
  - - [704, 1088, 1, 256, 704, 704, 704, 1088]
    - [0, 16.5]
  - - [832, 1088, 1, 256, 832, 832, 832, 1088]
    - [0, 17.304]
  - - [960, 1088, 1, 256, 960, 960, 960, 1088]
    - [0, 17.915]
  - - [1088, 1088, 1, 256, 1088, 1088, 1088, 1088]
    - [0, 18.372]
  - - [1216, 1088, 1, 256, 1216, 1216, 1216, 1088]
    - [0, 18.978]
  - - [1344, 1088, 1, 256, 1344, 1344, 1344, 1088]
    - [0, 19.111]
  - - [1472, 1088, 1, 256, 1472, 1472, 1472, 1088]
    - [0, 19.933]
  - - [1600, 1088, 1, 256, 1600, 1600, 1600, 1088]
    - [0, 19.566]
  - - [1728, 1088, 1, 256, 1728, 1728, 1728, 1088]
    - [0, 20.469]
  - - [1856, 1088, 1, 256, 1856, 1856, 1856, 1088]
    - [0, 19.745]
  - - [1984, 1088, 1, 256, 1984, 1984, 1984, 1088]
    - [0, 19.706]
  - - [2112, 1088, 1, 256, 2112, 2112, 2112, 1088]
    - [0, 19.33]
  - - [2240, 1088, 1, 256, 2240, 2240, 2240, 1088]
    - [0, 19.426]
  - - [2368, 1088, 1, 256, 2368, 2368, 2368, 1088]
    - [0, 20.058]
  - - [2496, 1088, 1, 256, 2496, 2496, 2496, 1088]
    - [0, 19.043]
  - - [2624, 1088, 1, 256, 2624, 2624, 2624, 1088]
    - [0, 19.127]
  - - [2752, 1088, 1, 256, 2752, 2752, 2752, 1088]
    - [0, 18.964]
  - - [2880, 1088, 1, 256, 2880, 2880, 2880, 1088]
    - [2, 19.111]
  - - [3008, 1088, 1, 256, 3008, 3008, 3008, 1088]
    - [0, 19.767]
  - - [3136, 1088, 1, 256, 3136, 3136, 3136, 1088]
    - [0, 19.347]
  - - [3264, 1088, 1, 256, 3264, 3264, 3264, 1088]
    - [0, 19.598]
  - - [3392, 1088, 1, 256, 3392, 3392, 3392, 1088]
    - [2, 19.026]
  - - [3520, 1088, 1, 256, 3520, 3520, 3520, 1088]
    - [2, 19.955]
  - - [3648, 1088, 1, 256, 3648, 3648, 3648, 1088]
    - [2, 19.502]
  - - [3776, 1088, 1, 256, 3776, 3776, 3776, 1088]
    - [2, 20.141]
  - - [3904, 1088, 1, 256, 3904, 3904, 3904, 1088]
    - [2, 20.214]
  - - [4032, 1088, 1, 256, 4032, 4032, 4032, 1088]
    - [2, 20.551]
  - - [64, 1216, 1, 256, 64, 64, 64, 1216]
    - [3, 1.285]
  - - [192, 1216, 1, 256, 192, 192, 192, 1216]
    - [2, 7.4]
  - - [320, 1216, 1, 256, 320, 320, 320, 1216]
    - [0, 12.426]
  - - [448, 1216, 1, 256, 448, 448, 448, 1216]
    - [0, 14.903]
  - - [576, 1216, 1, 256, 576, 576, 576, 1216]
    - [0, 16.065]
  - - [704, 1216, 1, 256, 704, 704, 704, 1216]
    - [0, 17.007]
  - - [832, 1216, 1, 256, 832, 832, 832, 1216]
    - [0, 17.72]
  - - [960, 1216, 1, 256, 960, 960, 960, 1216]
    - [0, 18.298]
  - - [1088, 1216, 1, 256, 1088, 1088, 1088, 1216]
    - [0, 19.366]
  - - [1216, 1216, 1, 256, 1216, 1216, 1216, 1216]
    - [0, 19.284]
  - - [1344, 1216, 1, 256, 1344, 1344, 1344, 1216]
    - [0, 19.948]
  - - [1472, 1216, 1, 256, 1472, 1472, 1472, 1216]
    - [0, 20.17]
  - - [1600, 1216, 1, 256, 1600, 1600, 1600, 1216]
    - [0, 19.615]
  - - [1728, 1216, 1, 256, 1728, 1728, 1728, 1216]
    - [0, 19.316]
  - - [1856, 1216, 1, 256, 1856, 1856, 1856, 1216]
    - [0, 20.209]
  - - [1984, 1216, 1, 256, 1984, 1984, 1984, 1216]
    - [0, 20.399]
  - - [2112, 1216, 1, 256, 2112, 2112, 2112, 1216]
    - [0, 19.149]
  - - [2240, 1216, 1, 256, 2240, 2240, 2240, 1216]
    - [0, 19.33]
  - - [2368, 1216, 1, 256, 2368, 2368, 2368, 1216]
    - [0, 18.949]
  - - [2496, 1216, 1, 256, 2496, 2496, 2496, 1216]
    - [0, 19.779]
  - - [2624, 1216, 1, 256, 2624, 2624, 2624, 1216]
    - [0, 19.349]
  - - [2752, 1216, 1, 256, 2752, 2752, 2752, 1216]
    - [0, 19.063]
  - - [2880, 1216, 1, 256, 2880, 2880, 2880, 1216]
    - [0, 19.352]
  - - [3008, 1216, 1, 256, 3008, 3008, 3008, 1216]
    - [0, 19.31]
  - - [3136, 1216, 1, 256, 3136, 3136, 3136, 1216]
    - [2, 19.776]
  - - [3264, 1216, 1, 256, 3264, 3264, 3264, 1216]
    - [2, 19.982]
  - - [3392, 1216, 1, 256, 3392, 3392, 3392, 1216]
    - [2, 20.177]
  - - [3520, 1216, 1, 256, 3520, 3520, 3520, 1216]
    - [0, 20.089]
  - - [3648, 1216, 1, 256, 3648, 3648, 3648, 1216]
    - [0, 20.246]
  - - [3776, 1216, 1, 256, 3776, 3776, 3776, 1216]
    - [0, 20.437]
  - - [3904, 1216, 1, 256, 3904, 3904, 3904, 1216]
    - [0, 20.546]
  - - [4032, 1216, 1, 256, 4032, 4032, 4032, 1216]
    - [2, 20.697]
  - - [64, 1344, 1, 256, 64, 64, 64, 1344]
    - [2, 1.422]
  - - [192, 1344, 1, 256, 192, 192, 192, 1344]
    - [0, 10.581]
  - - [320, 1344, 1, 256, 320, 320, 320, 1344]
    - [0, 13.751]
  - - [448, 1344, 1, 256, 448, 448, 448, 1344]
    - [0, 15.373]
  - - [576, 1344, 1, 256, 576, 576, 576, 1344]
    - [0, 16.585]
  - - [704, 1344, 1, 256, 704, 704, 704, 1344]
    - [0, 17.452]
  - - [832, 1344, 1, 256, 832, 832, 832, 1344]
    - [0, 18.12]
  - - [960, 1344, 1, 256, 960, 960, 960, 1344]
    - [0, 18.878]
  - - [1088, 1344, 1, 256, 1088, 1088, 1088, 1344]
    - [0, 19.582]
  - - [1216, 1344, 1, 256, 1216, 1216, 1216, 1344]
    - [0, 19.435]
  - - [1344, 1344, 1, 256, 1344, 1344, 1344, 1344]
    - [0, 19.46]
  - - [1472, 1344, 1, 256, 1472, 1472, 1472, 1344]
    - [0, 19.293]
  - - [1600, 1344, 1, 256, 1600, 1600, 1600, 1344]
    - [0, 20.627]
  - - [1728, 1344, 1, 256, 1728, 1728, 1728, 1344]
    - [0, 19.184]
  - - [1856, 1344, 1, 256, 1856, 1856, 1856, 1344]
    - [0, 19.316]
  - - [1984, 1344, 1, 256, 1984, 1984, 1984, 1344]
    - [0, 20.06]
  - - [2112, 1344, 1, 256, 2112, 2112, 2112, 1344]
    - [0, 19.227]
  - - [2240, 1344, 1, 256, 2240, 2240, 2240, 1344]
    - [2, 19.064]
  - - [2368, 1344, 1, 256, 2368, 2368, 2368, 1344]
    - [3, 18.389]
  - - [2496, 1344, 1, 256, 2496, 2496, 2496, 1344]
    - [2, 18.988]
  - - [2624, 1344, 1, 256, 2624, 2624, 2624, 1344]
    - [0, 19.017]
  - - [2752, 1344, 1, 256, 2752, 2752, 2752, 1344]
    - [0, 19.528]
  - - [2880, 1344, 1, 256, 2880, 2880, 2880, 1344]
    - [2, 20.065]
  - - [3008, 1344, 1, 256, 3008, 3008, 3008, 1344]
    - [0, 20.067]
  - - [3136, 1344, 1, 256, 3136, 3136, 3136, 1344]
    - [0, 19.836]
  - - [3264, 1344, 1, 256, 3264, 3264, 3264, 1344]
    - [2, 20.453]
  - - [3392, 1344, 1, 256, 3392, 3392, 3392, 1344]
    - [0, 20.083]
  - - [3520, 1344, 1, 256, 3520, 3520, 3520, 1344]
    - [0, 19.969]
  - - [3648, 1344, 1, 256, 3648, 3648, 3648, 1344]
    - [2, 20.252]
  - - [3776, 1344, 1, 256, 3776, 3776, 3776, 1344]
    - [0, 20.655]
  - - [3904, 1344, 1, 256, 3904, 3904, 3904, 1344]
    - [0, 20.612]
  - - [4032, 1344, 1, 256, 4032, 4032, 4032, 1344]
    - [0, 20.391]
  - - [64, 1472, 1, 256, 64, 64, 64, 1472]
    - [0, 5.893]
  - - [192, 1472, 1, 256, 192, 192, 192, 1472]
    - [0, 11.505]
  - - [320, 1472, 1, 256, 320, 320, 320, 1472]
    - [0, 14.149]
  - - [448, 1472, 1, 256, 448, 448, 448, 1472]
    - [0, 15.785]
  - - [576, 1472, 1, 256, 576, 576, 576, 1472]
    - [2, 16.841]
  - - [704, 1472, 1, 256, 704, 704, 704, 1472]
    - [0, 17.911]
  - - [832, 1472, 1, 256, 832, 832, 832, 1472]
    - [2, 18.363]
  - - [960, 1472, 1, 256, 960, 960, 960, 1472]
    - [0, 19.473]
  - - [1088, 1472, 1, 256, 1088, 1088, 1088, 1472]
    - [2, 18.736]
  - - [1216, 1472, 1, 256, 1216, 1216, 1216, 1472]
    - [2, 18.856]
  - - [1344, 1472, 1, 256, 1344, 1344, 1344, 1472]
    - [2, 18.502]
  - - [1472, 1472, 1, 256, 1472, 1472, 1472, 1472]
    - [0, 20.045]
  - - [1600, 1472, 1, 256, 1600, 1600, 1600, 1472]
    - [0, 19.628]
  - - [1728, 1472, 1, 256, 1728, 1728, 1728, 1472]
    - [0, 19.787]
  - - [1856, 1472, 1, 256, 1856, 1856, 1856, 1472]
    - [0, 19.076]
  - - [1984, 1472, 1, 256, 1984, 1984, 1984, 1472]
    - [0, 19.153]
  - - [2112, 1472, 1, 256, 2112, 2112, 2112, 1472]
    - [0, 19.196]
  - - [2240, 1472, 1, 256, 2240, 2240, 2240, 1472]
    - [0, 19.488]
  - - [2368, 1472, 1, 256, 2368, 2368, 2368, 1472]
    - [0, 20.075]
  - - [2496, 1472, 1, 256, 2496, 2496, 2496, 1472]
    - [0, 19.567]
  - - [2624, 1472, 1, 256, 2624, 2624, 2624, 1472]
    - [2, 20.0]
  - - [2752, 1472, 1, 256, 2752, 2752, 2752, 1472]
    - [2, 19.781]
  - - [2880, 1472, 1, 256, 2880, 2880, 2880, 1472]
    - [0, 19.812]
  - - [3008, 1472, 1, 256, 3008, 3008, 3008, 1472]
    - [0, 19.94]
  - - [3136, 1472, 1, 256, 3136, 3136, 3136, 1472]
    - [2, 20.459]
  - - [3264, 1472, 1, 256, 3264, 3264, 3264, 1472]
    - [2, 20.208]
  - - [3392, 1472, 1, 256, 3392, 3392, 3392, 1472]
    - [0, 20.444]
  - - [3520, 1472, 1, 256, 3520, 3520, 3520, 1472]
    - [0, 20.563]
  - - [3648, 1472, 1, 256, 3648, 3648, 3648, 1472]
    - [0, 20.061]
  - - [3776, 1472, 1, 256, 3776, 3776, 3776, 1472]
    - [0, 20.183]
  - - [3904, 1472, 1, 256, 3904, 3904, 3904, 1472]
    - [2, 20.428]
  - - [4032, 1472, 1, 256, 4032, 4032, 4032, 1472]
    - [0, 20.323]
  - - [64, 1600, 1, 256, 64, 64, 64, 1600]
    - [0, 5.643]
  - - [192, 1600, 1, 256, 192, 192, 192, 1600]
    - [0, 11.567]
  - - [320, 1600, 1, 256, 320, 320, 320, 1600]
    - [0, 14.649]
  - - [448, 1600, 1, 256, 448, 448, 448, 1600]
    - [0, 16.244]
  - - [576, 1600, 1, 256, 576, 576, 576, 1600]
    - [0, 17.415]
  - - [704, 1600, 1, 256, 704, 704, 704, 1600]
    - [0, 18.47]
  - - [832, 1600, 1, 256, 832, 832, 832, 1600]
    - [0, 18.95]
  - - [960, 1600, 1, 256, 960, 960, 960, 1600]
    - [0, 19.569]
  - - [1088, 1600, 1, 256, 1088, 1088, 1088, 1600]
    - [0, 19.596]
  - - [1216, 1600, 1, 256, 1216, 1216, 1216, 1600]
    - [0, 18.657]
  - - [1344, 1600, 1, 256, 1344, 1344, 1344, 1600]
    - [0, 19.005]
  - - [1472, 1600, 1, 256, 1472, 1472, 1472, 1600]
    - [0, 18.728]
  - - [1600, 1600, 1, 256, 1600, 1600, 1600, 1600]
    - [0, 18.896]
  - - [1728, 1600, 1, 256, 1728, 1728, 1728, 1600]
    - [0, 19.016]
  - - [1856, 1600, 1, 256, 1856, 1856, 1856, 1600]
    - [0, 19.049]
  - - [1984, 1600, 1, 256, 1984, 1984, 1984, 1600]
    - [0, 19.053]
  - - [2112, 1600, 1, 256, 2112, 2112, 2112, 1600]
    - [2, 19.266]
  - - [2240, 1600, 1, 256, 2240, 2240, 2240, 1600]
    - [0, 19.058]
  - - [2368, 1600, 1, 256, 2368, 2368, 2368, 1600]
    - [0, 19.546]
  - - [2496, 1600, 1, 256, 2496, 2496, 2496, 1600]
    - [0, 19.634]
  - - [2624, 1600, 1, 256, 2624, 2624, 2624, 1600]
    - [0, 19.63]
  - - [2752, 1600, 1, 256, 2752, 2752, 2752, 1600]
    - [0, 20.146]
  - - [2880, 1600, 1, 256, 2880, 2880, 2880, 1600]
    - [0, 20.097]
  - - [3008, 1600, 1, 256, 3008, 3008, 3008, 1600]
    - [2, 19.995]
  - - [3136, 1600, 1, 256, 3136, 3136, 3136, 1600]
    - [2, 20.787]
  - - [3264, 1600, 1, 256, 3264, 3264, 3264, 1600]
    - [0, 19.934]
  - - [3392, 1600, 1, 256, 3392, 3392, 3392, 1600]
    - [0, 20.58]
  - - [3520, 1600, 1, 256, 3520, 3520, 3520, 1600]
    - [0, 19.814]
  - - [3648, 1600, 1, 256, 3648, 3648, 3648, 1600]
    - [0, 20.451]
  - - [3776, 1600, 1, 256, 3776, 3776, 3776, 1600]
    - [0, 19.994]
  - - [3904, 1600, 1, 256, 3904, 3904, 3904, 1600]
    - [0, 20.518]
  - - [4032, 1600, 1, 256, 4032, 4032, 4032, 1600]
    - [2, 19.972]
  - - [64, 1728, 1, 256, 64, 64, 64, 1728]
    - [3, 1.827]
  - - [192, 1728, 1, 256, 192, 192, 192, 1728]
    - [1, 10.618]
  - - [320, 1728, 1, 256, 320, 320, 320, 1728]
    - [0, 14.934]
  - - [448, 1728, 1, 256, 448, 448, 448, 1728]
    - [0, 16.53]
  - - [576, 1728, 1, 256, 576, 576, 576, 1728]
    - [2, 17.634]
  - - [704, 1728, 1, 256, 704, 704, 704, 1728]
    - [0, 18.422]
  - - [832, 1728, 1, 256, 832, 832, 832, 1728]
    - [0, 19.335]
  - - [960, 1728, 1, 256, 960, 960, 960, 1728]
    - [0, 19.87]
  - - [1088, 1728, 1, 256, 1088, 1088, 1088, 1728]
    - [0, 20.272]
  - - [1216, 1728, 1, 256, 1216, 1216, 1216, 1728]
    - [0, 18.524]
  - - [1344, 1728, 1, 256, 1344, 1344, 1344, 1728]
    - [0, 19.174]
  - - [1472, 1728, 1, 256, 1472, 1472, 1472, 1728]
    - [0, 19.03]
  - - [1600, 1728, 1, 256, 1600, 1600, 1600, 1728]
    - [0, 19.551]
  - - [1728, 1728, 1, 256, 1728, 1728, 1728, 1728]
    - [0, 19.063]
  - - [1856, 1728, 1, 256, 1856, 1856, 1856, 1728]
    - [2, 19.351]
  - - [1984, 1728, 1, 256, 1984, 1984, 1984, 1728]
    - [0, 19.676]
  - - [2112, 1728, 1, 256, 2112, 2112, 2112, 1728]
    - [2, 19.989]
  - - [2240, 1728, 1, 256, 2240, 2240, 2240, 1728]
    - [0, 19.898]
  - - [2368, 1728, 1, 256, 2368, 2368, 2368, 1728]
    - [0, 19.749]
  - - [2496, 1728, 1, 256, 2496, 2496, 2496, 1728]
    - [0, 20.265]
  - - [2624, 1728, 1, 256, 2624, 2624, 2624, 1728]
    - [2, 20.671]
  - - [2752, 1728, 1, 256, 2752, 2752, 2752, 1728]
    - [0, 20.252]
  - - [2880, 1728, 1, 256, 2880, 2880, 2880, 1728]
    - [2, 20.295]
  - - [3008, 1728, 1, 256, 3008, 3008, 3008, 1728]
    - [2, 20.761]
  - - [3136, 1728, 1, 256, 3136, 3136, 3136, 1728]
    - [0, 21.255]
  - - [3264, 1728, 1, 256, 3264, 3264, 3264, 1728]
    - [0, 20.56]
  - - [3392, 1728, 1, 256, 3392, 3392, 3392, 1728]
    - [0, 20.626]
  - - [3520, 1728, 1, 256, 3520, 3520, 3520, 1728]
    - [0, 20.288]
  - - [3648, 1728, 1, 256, 3648, 3648, 3648, 1728]
    - [0, 20.185]
  - - [3776, 1728, 1, 256, 3776, 3776, 3776, 1728]
    - [0, 20.544]
  - - [3904, 1728, 1, 256, 3904, 3904, 3904, 1728]
    - [0, 19.953]
  - - [4032, 1728, 1, 256, 4032, 4032, 4032, 1728]
    - [2, 20.453]
  - - [64, 1856, 1, 256, 64, 64, 64, 1856]
    - [0, 6.74]
  - - [192, 1856, 1, 256, 192, 192, 192, 1856]
    - [0, 12.621]
  - - [320, 1856, 1, 256, 320, 320, 320, 1856]
    - [0, 15.376]
  - - [448, 1856, 1, 256, 448, 448, 448, 1856]
    - [0, 17.063]
  - - [576, 1856, 1, 256, 576, 576, 576, 1856]
    - [0, 18.038]
  - - [704, 1856, 1, 256, 704, 704, 704, 1856]
    - [0, 19.111]
  - - [832, 1856, 1, 256, 832, 832, 832, 1856]
    - [0, 19.831]
  - - [960, 1856, 1, 256, 960, 960, 960, 1856]
    - [0, 19.572]
  - - [1088, 1856, 1, 256, 1088, 1088, 1088, 1856]
    - [0, 19.277]
  - - [1216, 1856, 1, 256, 1216, 1216, 1216, 1856]
    - [0, 19.934]
  - - [1344, 1856, 1, 256, 1344, 1344, 1344, 1856]
    - [2, 19.226]
  - - [1472, 1856, 1, 256, 1472, 1472, 1472, 1856]
    - [0, 18.88]
  - - [1600, 1856, 1, 256, 1600, 1600, 1600, 1856]
    - [0, 19.064]
  - - [1728, 1856, 1, 256, 1728, 1728, 1728, 1856]
    - [0, 19.283]
  - - [1856, 1856, 1, 256, 1856, 1856, 1856, 1856]
    - [0, 19.842]
  - - [1984, 1856, 1, 256, 1984, 1984, 1984, 1856]
    - [0, 19.438]
  - - [2112, 1856, 1, 256, 2112, 2112, 2112, 1856]
    - [0, 20.012]
  - - [2240, 1856, 1, 256, 2240, 2240, 2240, 1856]
    - [0, 20.253]
  - - [2368, 1856, 1, 256, 2368, 2368, 2368, 1856]
    - [0, 20.022]
  - - [2496, 1856, 1, 256, 2496, 2496, 2496, 1856]
    - [0, 20.266]
  - - [2624, 1856, 1, 256, 2624, 2624, 2624, 1856]
    - [0, 20.39]
  - - [2752, 1856, 1, 256, 2752, 2752, 2752, 1856]
    - [0, 20.353]
  - - [2880, 1856, 1, 256, 2880, 2880, 2880, 1856]
    - [2, 20.035]
  - - [3008, 1856, 1, 256, 3008, 3008, 3008, 1856]
    - [0, 20.188]
  - - [3136, 1856, 1, 256, 3136, 3136, 3136, 1856]
    - [0, 20.298]
  - - [3264, 1856, 1, 256, 3264, 3264, 3264, 1856]
    - [2, 20.04]
  - - [3392, 1856, 1, 256, 3392, 3392, 3392, 1856]
    - [2, 20.412]
  - - [3520, 1856, 1, 256, 3520, 3520, 3520, 1856]
    - [0, 20.406]
  - - [3648, 1856, 1, 256, 3648, 3648, 3648, 1856]
    - [0, 20.408]
  - - [3776, 1856, 1, 256, 3776, 3776, 3776, 1856]
    - [0, 20.766]
  - - [3904, 1856, 1, 256, 3904, 3904, 3904, 1856]
    - [0, 20.151]
  - - [4032, 1856, 1, 256, 4032, 4032, 4032, 1856]
    - [0, 20.26]
  - - [64, 1984, 1, 256, 64, 64, 64, 1984]
    - [2, 2.092]
  - - [192, 1984, 1, 256, 192, 192, 192, 1984]
    - [3, 12.1]
  - - [320, 1984, 1, 256, 320, 320, 320, 1984]
    - [0, 15.686]
  - - [448, 1984, 1, 256, 448, 448, 448, 1984]
    - [0, 17.255]
  - - [576, 1984, 1, 256, 576, 576, 576, 1984]
    - [0, 18.193]
  - - [704, 1984, 1, 256, 704, 704, 704, 1984]
    - [0, 18.978]
  - - [832, 1984, 1, 256, 832, 832, 832, 1984]
    - [0, 19.751]
  - - [960, 1984, 1, 256, 960, 960, 960, 1984]
    - [0, 18.761]
  - - [1088, 1984, 1, 256, 1088, 1088, 1088, 1984]
    - [0, 18.969]
  - - [1216, 1984, 1, 256, 1216, 1216, 1216, 1984]
    - [0, 19.135]
  - - [1344, 1984, 1, 256, 1344, 1344, 1344, 1984]
    - [0, 18.896]
  - - [1472, 1984, 1, 256, 1472, 1472, 1472, 1984]
    - [0, 19.004]
  - - [1600, 1984, 1, 256, 1600, 1600, 1600, 1984]
    - [0, 19.291]
  - - [1728, 1984, 1, 256, 1728, 1728, 1728, 1984]
    - [2, 19.796]
  - - [1856, 1984, 1, 256, 1856, 1856, 1856, 1984]
    - [0, 19.936]
  - - [1984, 1984, 1, 256, 1984, 1984, 1984, 1984]
    - [0, 19.408]
  - - [2112, 1984, 1, 256, 2112, 2112, 2112, 1984]
    - [2, 19.778]
  - - [2240, 1984, 1, 256, 2240, 2240, 2240, 1984]
    - [0, 20.395]
  - - [2368, 1984, 1, 256, 2368, 2368, 2368, 1984]
    - [2, 20.244]
  - - [2496, 1984, 1, 256, 2496, 2496, 2496, 1984]
    - [0, 20.552]
  - - [2624, 1984, 1, 256, 2624, 2624, 2624, 1984]
    - [0, 20.521]
  - - [2752, 1984, 1, 256, 2752, 2752, 2752, 1984]
    - [0, 20.399]
  - - [2880, 1984, 1, 256, 2880, 2880, 2880, 1984]
    - [0, 20.491]
  - - [3008, 1984, 1, 256, 3008, 3008, 3008, 1984]
    - [0, 20.126]
  - - [3136, 1984, 1, 256, 3136, 3136, 3136, 1984]
    - [0, 20.296]
  - - [3264, 1984, 1, 256, 3264, 3264, 3264, 1984]
    - [0, 19.937]
  - - [3392, 1984, 1, 256, 3392, 3392, 3392, 1984]
    - [0, 20.443]
  - - [3520, 1984, 1, 256, 3520, 3520, 3520, 1984]
    - [0, 20.077]
  - - [3648, 1984, 1, 256, 3648, 3648, 3648, 1984]
    - [0, 20.143]
  - - [3776, 1984, 1, 256, 3776, 3776, 3776, 1984]
    - [0, 20.748]
  - - [3904, 1984, 1, 256, 3904, 3904, 3904, 1984]
    - [0, 19.957]
  - - [4032, 1984, 1, 256, 4032, 4032, 4032, 1984]
    - [0, 20.066]
  - - [64, 2112, 1, 256, 64, 64, 64, 2112]
    - [2, 2.23]
  - - [192, 2112, 1, 256, 192, 192, 192, 2112]
    - [3, 12.591]
  - - [320, 2112, 1, 256, 320, 320, 320, 2112]
    - [0, 15.969]
  - - [448, 2112, 1, 256, 448, 448, 448, 2112]
    - [0, 17.499]
  - - [576, 2112, 1, 256, 576, 576, 576, 2112]
    - [0, 18.547]
  - - [704, 2112, 1, 256, 704, 704, 704, 2112]
    - [0, 19.463]
  - - [832, 2112, 1, 256, 832, 832, 832, 2112]
    - [0, 19.749]
  - - [960, 2112, 1, 256, 960, 960, 960, 2112]
    - [0, 19.993]
  - - [1088, 2112, 1, 256, 1088, 1088, 1088, 2112]
    - [0, 19.181]
  - - [1216, 2112, 1, 256, 1216, 1216, 1216, 2112]
    - [0, 18.786]
  - - [1344, 2112, 1, 256, 1344, 1344, 1344, 2112]
    - [0, 18.961]
  - - [1472, 2112, 1, 256, 1472, 1472, 1472, 2112]
    - [0, 19.657]
  - - [1600, 2112, 1, 256, 1600, 1600, 1600, 2112]
    - [2, 19.531]
  - - [1728, 2112, 1, 256, 1728, 1728, 1728, 2112]
    - [0, 19.858]
  - - [1856, 2112, 1, 256, 1856, 1856, 1856, 2112]
    - [0, 19.77]
  - - [1984, 2112, 1, 256, 1984, 1984, 1984, 2112]
    - [0, 19.919]
  - - [2112, 2112, 1, 256, 2112, 2112, 2112, 2112]
    - [2, 20.524]
  - - [2240, 2112, 1, 256, 2240, 2240, 2240, 2112]
    - [2, 19.92]
  - - [2368, 2112, 1, 256, 2368, 2368, 2368, 2112]
    - [0, 20.289]
  - - [2496, 2112, 1, 256, 2496, 2496, 2496, 2112]
    - [0, 20.368]
  - - [2624, 2112, 1, 256, 2624, 2624, 2624, 2112]
    - [0, 20.582]
  - - [2752, 2112, 1, 256, 2752, 2752, 2752, 2112]
    - [0, 20.028]
  - - [2880, 2112, 1, 256, 2880, 2880, 2880, 2112]
    - [0, 20.215]
  - - [3008, 2112, 1, 256, 3008, 3008, 3008, 2112]
    - [0, 20.348]
  - - [3136, 2112, 1, 256, 3136, 3136, 3136, 2112]
    - [0, 21.167]
  - - [3264, 2112, 1, 256, 3264, 3264, 3264, 2112]
    - [0, 20.162]
  - - [3392, 2112, 1, 256, 3392, 3392, 3392, 2112]
    - [0, 20.016]
  - - [3520, 2112, 1, 256, 3520, 3520, 3520, 2112]
    - [0, 20.006]
  - - [3648, 2112, 1, 256, 3648, 3648, 3648, 2112]
    - [0, 19.926]
  - - [3776, 2112, 1, 256, 3776, 3776, 3776, 2112]
    - [0, 19.985]
  - - [3904, 2112, 1, 256, 3904, 3904, 3904, 2112]
    - [0, 20.112]
  - - [4032, 2112, 1, 256, 4032, 4032, 4032, 2112]
    - [2, 20.279]
  - - [64, 2240, 1, 256, 64, 64, 64, 2240]
    - [3, 2.36]
  - - [192, 2240, 1, 256, 192, 192, 192, 2240]
    - [0, 13.698]
  - - [320, 2240, 1, 256, 320, 320, 320, 2240]
    - [0, 16.152]
  - - [448, 2240, 1, 256, 448, 448, 448, 2240]
    - [0, 17.737]
  - - [576, 2240, 1, 256, 576, 576, 576, 2240]
    - [0, 18.705]
  - - [704, 2240, 1, 256, 704, 704, 704, 2240]
    - [0, 19.281]
  - - [832, 2240, 1, 256, 832, 832, 832, 2240]
    - [0, 19.4]
  - - [960, 2240, 1, 256, 960, 960, 960, 2240]
    - [0, 19.975]
  - - [1088, 2240, 1, 256, 1088, 1088, 1088, 2240]
    - [0, 19.207]
  - - [1216, 2240, 1, 256, 1216, 1216, 1216, 2240]
    - [0, 19.929]
  - - [1344, 2240, 1, 256, 1344, 1344, 1344, 2240]
    - [0, 19.095]
  - - [1472, 2240, 1, 256, 1472, 1472, 1472, 2240]
    - [0, 19.937]
  - - [1600, 2240, 1, 256, 1600, 1600, 1600, 2240]
    - [0, 19.408]
  - - [1728, 2240, 1, 256, 1728, 1728, 1728, 2240]
    - [2, 19.101]
  - - [1856, 2240, 1, 256, 1856, 1856, 1856, 2240]
    - [2, 19.789]
  - - [1984, 2240, 1, 256, 1984, 1984, 1984, 2240]
    - [2, 20.467]
  - - [2112, 2240, 1, 256, 2112, 2112, 2112, 2240]
    - [0, 20.226]
  - - [2240, 2240, 1, 256, 2240, 2240, 2240, 2240]
    - [0, 20.258]
  - - [2368, 2240, 1, 256, 2368, 2368, 2368, 2240]
    - [2, 20.341]
  - - [2496, 2240, 1, 256, 2496, 2496, 2496, 2240]
    - [0, 20.09]
  - - [2624, 2240, 1, 256, 2624, 2624, 2624, 2240]
    - [0, 20.5]
  - - [2752, 2240, 1, 256, 2752, 2752, 2752, 2240]
    - [0, 20.732]
  - - [2880, 2240, 1, 256, 2880, 2880, 2880, 2240]
    - [2, 19.659]
  - - [3008, 2240, 1, 256, 3008, 3008, 3008, 2240]
    - [0, 20.533]
  - - [3136, 2240, 1, 256, 3136, 3136, 3136, 2240]
    - [0, 20.12]
  - - [3264, 2240, 1, 256, 3264, 3264, 3264, 2240]
    - [0, 19.928]
  - - [3392, 2240, 1, 256, 3392, 3392, 3392, 2240]
    - [0, 20.098]
  - - [3520, 2240, 1, 256, 3520, 3520, 3520, 2240]
    - [0, 20.116]
  - - [3648, 2240, 1, 256, 3648, 3648, 3648, 2240]
    - [0, 20.101]
  - - [3776, 2240, 1, 256, 3776, 3776, 3776, 2240]
    - [0, 20.031]
  - - [3904, 2240, 1, 256, 3904, 3904, 3904, 2240]
    - [0, 20.062]
  - - [4032, 2240, 1, 256, 4032, 4032, 4032, 2240]
    - [0, 20.334]
  - - [64, 2368, 1, 256, 64, 64, 64, 2368]
    - [2, 7.49]
  - - [192, 2368, 1, 256, 192, 192, 192, 2368]
    - [0, 13.91]
  - - [320, 2368, 1, 256, 320, 320, 320, 2368]
    - [0, 16.371]
  - - [448, 2368, 1, 256, 448, 448, 448, 2368]
    - [0, 17.981]
  - - [576, 2368, 1, 256, 576, 576, 576, 2368]
    - [0, 19.198]
  - - [704, 2368, 1, 256, 704, 704, 704, 2368]
    - [0, 19.182]
  - - [832, 2368, 1, 256, 832, 832, 832, 2368]
    - [0, 19.726]
  - - [960, 2368, 1, 256, 960, 960, 960, 2368]
    - [0, 19.177]
  - - [1088, 2368, 1, 256, 1088, 1088, 1088, 2368]
    - [2, 18.975]
  - - [1216, 2368, 1, 256, 1216, 1216, 1216, 2368]
    - [0, 18.884]
  - - [1344, 2368, 1, 256, 1344, 1344, 1344, 2368]
    - [0, 19.62]
  - - [1472, 2368, 1, 256, 1472, 1472, 1472, 2368]
    - [0, 19.328]
  - - [1600, 2368, 1, 256, 1600, 1600, 1600, 2368]
    - [2, 20.058]
  - - [1728, 2368, 1, 256, 1728, 1728, 1728, 2368]
    - [2, 19.755]
  - - [1856, 2368, 1, 256, 1856, 1856, 1856, 2368]
    - [2, 20.038]
  - - [1984, 2368, 1, 256, 1984, 1984, 1984, 2368]
    - [2, 20.004]
  - - [2112, 2368, 1, 256, 2112, 2112, 2112, 2368]
    - [0, 20.411]
  - - [2240, 2368, 1, 256, 2240, 2240, 2240, 2368]
    - [0, 20.517]
  - - [2368, 2368, 1, 256, 2368, 2368, 2368, 2368]
    - [0, 20.955]
  - - [2496, 2368, 1, 256, 2496, 2496, 2496, 2368]
    - [2, 19.897]
  - - [2624, 2368, 1, 256, 2624, 2624, 2624, 2368]
    - [0, 20.155]
  - - [2752, 2368, 1, 256, 2752, 2752, 2752, 2368]
    - [0, 20.267]
  - - [2880, 2368, 1, 256, 2880, 2880, 2880, 2368]
    - [0, 20.376]
  - - [3008, 2368, 1, 256, 3008, 3008, 3008, 2368]
    - [0, 21.175]
  - - [3136, 2368, 1, 256, 3136, 3136, 3136, 2368]
    - [0, 20.377]
  - - [3264, 2368, 1, 256, 3264, 3264, 3264, 2368]
    - [0, 19.826]
  - - [3392, 2368, 1, 256, 3392, 3392, 3392, 2368]
    - [0, 20.083]
  - - [3520, 2368, 1, 256, 3520, 3520, 3520, 2368]
    - [2, 20.103]
  - - [3648, 2368, 1, 256, 3648, 3648, 3648, 2368]
    - [0, 20.267]
  - - [3776, 2368, 1, 256, 3776, 3776, 3776, 2368]
    - [0, 20.165]
  - - [3904, 2368, 1, 256, 3904, 3904, 3904, 2368]
    - [0, 19.939]
  - - [4032, 2368, 1, 256, 4032, 4032, 4032, 2368]
    - [0, 20.033]
  - - [64, 2496, 1, 256, 64, 64, 64, 2496]
    - [2, 2.639]
  - - [192, 2496, 1, 256, 192, 192, 192, 2496]
    - [0, 14.29]
  - - [320, 2496, 1, 256, 320, 320, 320, 2496]
    - [0, 16.587]
  - - [448, 2496, 1, 256, 448, 448, 448, 2496]
    - [0, 18.652]
  - - [576, 2496, 1, 256, 576, 576, 576, 2496]
    - [0, 19.625]
  - - [704, 2496, 1, 256, 704, 704, 704, 2496]
    - [0, 19.871]
  - - [832, 2496, 1, 256, 832, 832, 832, 2496]
    - [0, 19.41]
  - - [960, 2496, 1, 256, 960, 960, 960, 2496]
    - [0, 19.427]
  - - [1088, 2496, 1, 256, 1088, 1088, 1088, 2496]
    - [0, 19.823]
  - - [1216, 2496, 1, 256, 1216, 1216, 1216, 2496]
    - [0, 19.556]
  - - [1344, 2496, 1, 256, 1344, 1344, 1344, 2496]
    - [0, 19.27]
  - - [1472, 2496, 1, 256, 1472, 1472, 1472, 2496]
    - [0, 19.684]
  - - [1600, 2496, 1, 256, 1600, 1600, 1600, 2496]
    - [2, 20.105]
  - - [1728, 2496, 1, 256, 1728, 1728, 1728, 2496]
    - [2, 19.825]
  - - [1856, 2496, 1, 256, 1856, 1856, 1856, 2496]
    - [2, 19.55]
  - - [1984, 2496, 1, 256, 1984, 1984, 1984, 2496]
    - [0, 20.622]
  - - [2112, 2496, 1, 256, 2112, 2112, 2112, 2496]
    - [2, 19.901]
  - - [2240, 2496, 1, 256, 2240, 2240, 2240, 2496]
    - [2, 20.108]
  - - [2368, 2496, 1, 256, 2368, 2368, 2368, 2496]
    - [2, 20.184]
  - - [2496, 2496, 1, 256, 2496, 2496, 2496, 2496]
    - [0, 20.023]
  - - [2624, 2496, 1, 256, 2624, 2624, 2624, 2496]
    - [0, 19.771]
  - - [2752, 2496, 1, 256, 2752, 2752, 2752, 2496]
    - [0, 20.05]
  - - [2880, 2496, 1, 256, 2880, 2880, 2880, 2496]
    - [0, 20.073]
  - - [3008, 2496, 1, 256, 3008, 3008, 3008, 2496]
    - [0, 20.817]
  - - [3136, 2496, 1, 256, 3136, 3136, 3136, 2496]
    - [2, 20.05]
  - - [3264, 2496, 1, 256, 3264, 3264, 3264, 2496]
    - [0, 19.947]
  - - [3392, 2496, 1, 256, 3392, 3392, 3392, 2496]
    - [2, 19.964]
  - - [3520, 2496, 1, 256, 3520, 3520, 3520, 2496]
    - [0, 20.465]
  - - [3648, 2496, 1, 256, 3648, 3648, 3648, 2496]
    - [2, 20.039]
  - - [3776, 2496, 1, 256, 3776, 3776, 3776, 2496]
    - [0, 19.915]
  - - [3904, 2496, 1, 256, 3904, 3904, 3904, 2496]
    - [0, 20.063]
  - - [4032, 2496, 1, 256, 4032, 4032, 4032, 2496]
    - [0, 20.056]
  - - [64, 2624, 1, 256, 64, 64, 64, 2624]
    - [0, 8.281]
  - - [192, 2624, 1, 256, 192, 192, 192, 2624]
    - [0, 14.422]
  - - [320, 2624, 1, 256, 320, 320, 320, 2624]
    - [0, 16.923]
  - - [448, 2624, 1, 256, 448, 448, 448, 2624]
    - [0, 18.507]
  - - [576, 2624, 1, 256, 576, 576, 576, 2624]
    - [0, 19.643]
  - - [704, 2624, 1, 256, 704, 704, 704, 2624]
    - [0, 19.824]
  - - [832, 2624, 1, 256, 832, 832, 832, 2624]
    - [0, 18.931]
  - - [960, 2624, 1, 256, 960, 960, 960, 2624]
    - [0, 18.869]
  - - [1088, 2624, 1, 256, 1088, 1088, 1088, 2624]
    - [0, 19.278]
  - - [1216, 2624, 1, 256, 1216, 1216, 1216, 2624]
    - [0, 19.71]
  - - [1344, 2624, 1, 256, 1344, 1344, 1344, 2624]
    - [0, 19.338]
  - - [1472, 2624, 1, 256, 1472, 1472, 1472, 2624]
    - [0, 19.823]
  - - [1600, 2624, 1, 256, 1600, 1600, 1600, 2624]
    - [2, 19.941]
  - - [1728, 2624, 1, 256, 1728, 1728, 1728, 2624]
    - [2, 19.822]
  - - [1856, 2624, 1, 256, 1856, 1856, 1856, 2624]
    - [0, 20.381]
  - - [1984, 2624, 1, 256, 1984, 1984, 1984, 2624]
    - [2, 20.231]
  - - [2112, 2624, 1, 256, 2112, 2112, 2112, 2624]
    - [0, 19.946]
  - - [2240, 2624, 1, 256, 2240, 2240, 2240, 2624]
    - [2, 19.893]
  - - [2368, 2624, 1, 256, 2368, 2368, 2368, 2624]
    - [2, 19.839]
  - - [2496, 2624, 1, 256, 2496, 2496, 2496, 2624]
    - [0, 19.98]
  - - [2624, 2624, 1, 256, 2624, 2624, 2624, 2624]
    - [0, 20.084]
  - - [2752, 2624, 1, 256, 2752, 2752, 2752, 2624]
    - [0, 20.028]
  - - [2880, 2624, 1, 256, 2880, 2880, 2880, 2624]
    - [0, 19.812]
  - - [3008, 2624, 1, 256, 3008, 3008, 3008, 2624]
    - [2, 19.867]
  - - [3136, 2624, 1, 256, 3136, 3136, 3136, 2624]
    - [0, 19.675]
  - - [3264, 2624, 1, 256, 3264, 3264, 3264, 2624]
    - [2, 19.856]
  - - [3392, 2624, 1, 256, 3392, 3392, 3392, 2624]
    - [0, 19.986]
  - - [3520, 2624, 1, 256, 3520, 3520, 3520, 2624]
    - [2, 20.014]
  - - [3648, 2624, 1, 256, 3648, 3648, 3648, 2624]
    - [0, 19.881]
  - - [3776, 2624, 1, 256, 3776, 3776, 3776, 2624]
    - [0, 20.096]
  - - [3904, 2624, 1, 256, 3904, 3904, 3904, 2624]
    - [0, 20.04]
  - - [4032, 2624, 1, 256, 4032, 4032, 4032, 2624]
    - [0, 20.037]
  - - [64, 2752, 1, 256, 64, 64, 64, 2752]
    - [3, 6.841]
  - - [192, 2752, 1, 256, 192, 192, 192, 2752]
    - [0, 14.823]
  - - [320, 2752, 1, 256, 320, 320, 320, 2752]
    - [0, 17.135]
  - - [448, 2752, 1, 256, 448, 448, 448, 2752]
    - [0, 18.464]
  - - [576, 2752, 1, 256, 576, 576, 576, 2752]
    - [0, 19.571]
  - - [704, 2752, 1, 256, 704, 704, 704, 2752]
    - [0, 19.6]
  - - [832, 2752, 1, 256, 832, 832, 832, 2752]
    - [0, 19.401]
  - - [960, 2752, 1, 256, 960, 960, 960, 2752]
    - [2, 18.477]
  - - [1088, 2752, 1, 256, 1088, 1088, 1088, 2752]
    - [2, 18.971]
  - - [1216, 2752, 1, 256, 1216, 1216, 1216, 2752]
    - [0, 19.612]
  - - [1344, 2752, 1, 256, 1344, 1344, 1344, 2752]
    - [2, 18.687]
  - - [1472, 2752, 1, 256, 1472, 1472, 1472, 2752]
    - [2, 19.997]
  - - [1600, 2752, 1, 256, 1600, 1600, 1600, 2752]
    - [2, 20.62]
  - - [1728, 2752, 1, 256, 1728, 1728, 1728, 2752]
    - [2, 20.59]
  - - [1856, 2752, 1, 256, 1856, 1856, 1856, 2752]
    - [0, 20.326]
  - - [1984, 2752, 1, 256, 1984, 1984, 1984, 2752]
    - [2, 20.012]
  - - [2112, 2752, 1, 256, 2112, 2112, 2112, 2752]
    - [0, 19.909]
  - - [2240, 2752, 1, 256, 2240, 2240, 2240, 2752]
    - [0, 20.044]
  - - [2368, 2752, 1, 256, 2368, 2368, 2368, 2752]
    - [2, 19.716]
  - - [2496, 2752, 1, 256, 2496, 2496, 2496, 2752]
    - [0, 19.798]
  - - [2624, 2752, 1, 256, 2624, 2624, 2624, 2752]
    - [0, 19.981]
  - - [2752, 2752, 1, 256, 2752, 2752, 2752, 2752]
    - [2, 20.501]
  - - [2880, 2752, 1, 256, 2880, 2880, 2880, 2752]
    - [0, 20.016]
  - - [3008, 2752, 1, 256, 3008, 3008, 3008, 2752]
    - [0, 20.027]
  - - [3136, 2752, 1, 256, 3136, 3136, 3136, 2752]
    - [0, 19.996]
  - - [3264, 2752, 1, 256, 3264, 3264, 3264, 2752]
    - [2, 20.0]
  - - [3392, 2752, 1, 256, 3392, 3392, 3392, 2752]
    - [0, 20.006]
  - - [3520, 2752, 1, 256, 3520, 3520, 3520, 2752]
    - [0, 19.993]
  - - [3648, 2752, 1, 256, 3648, 3648, 3648, 2752]
    - [2, 19.863]
  - - [3776, 2752, 1, 256, 3776, 3776, 3776, 2752]
    - [0, 20.048]
  - - [3904, 2752, 1, 256, 3904, 3904, 3904, 2752]
    - [0, 20.013]
  - - [4032, 2752, 1, 256, 4032, 4032, 4032, 2752]
    - [0, 20.082]
  - - [64, 2880, 1, 256, 64, 64, 64, 2880]
    - [0, 9.01]
  - - [192, 2880, 1, 256, 192, 192, 192, 2880]
    - [0, 14.849]
  - - [320, 2880, 1, 256, 320, 320, 320, 2880]
    - [0, 17.266]
  - - [448, 2880, 1, 256, 448, 448, 448, 2880]
    - [0, 18.504]
  - - [576, 2880, 1, 256, 576, 576, 576, 2880]
    - [0, 19.766]
  - - [704, 2880, 1, 256, 704, 704, 704, 2880]
    - [0, 20.142]
  - - [832, 2880, 1, 256, 832, 832, 832, 2880]
    - [0, 18.922]
  - - [960, 2880, 1, 256, 960, 960, 960, 2880]
    - [0, 18.609]
  - - [1088, 2880, 1, 256, 1088, 1088, 1088, 2880]
    - [2, 19.257]
  - - [1216, 2880, 1, 256, 1216, 1216, 1216, 2880]
    - [0, 19.726]
  - - [1344, 2880, 1, 256, 1344, 1344, 1344, 2880]
    - [2, 19.576]
  - - [1472, 2880, 1, 256, 1472, 1472, 1472, 2880]
    - [3, 19.621]
  - - [1600, 2880, 1, 256, 1600, 1600, 1600, 2880]
    - [0, 20.021]
  - - [1728, 2880, 1, 256, 1728, 1728, 1728, 2880]
    - [2, 20.167]
  - - [1856, 2880, 1, 256, 1856, 1856, 1856, 2880]
    - [3, 20.37]
  - - [1984, 2880, 1, 256, 1984, 1984, 1984, 2880]
    - [0, 20.162]
  - - [2112, 2880, 1, 256, 2112, 2112, 2112, 2880]
    - [2, 19.868]
  - - [2240, 2880, 1, 256, 2240, 2240, 2240, 2880]
    - [2, 20.015]
  - - [2368, 2880, 1, 256, 2368, 2368, 2368, 2880]
    - [2, 19.766]
  - - [2496, 2880, 1, 256, 2496, 2496, 2496, 2880]
    - [0, 20.015]
  - - [2624, 2880, 1, 256, 2624, 2624, 2624, 2880]
    - [0, 19.862]
  - - [2752, 2880, 1, 256, 2752, 2752, 2752, 2880]
    - [2, 19.807]
  - - [2880, 2880, 1, 256, 2880, 2880, 2880, 2880]
    - [0, 19.767]
  - - [3008, 2880, 1, 256, 3008, 3008, 3008, 2880]
    - [2, 19.632]
  - - [3136, 2880, 1, 256, 3136, 3136, 3136, 2880]
    - [2, 19.874]
  - - [3264, 2880, 1, 256, 3264, 3264, 3264, 2880]
    - [2, 20.063]
  - - [3392, 2880, 1, 256, 3392, 3392, 3392, 2880]
    - [0, 19.941]
  - - [3520, 2880, 1, 256, 3520, 3520, 3520, 2880]
    - [2, 20.568]
  - - [3648, 2880, 1, 256, 3648, 3648, 3648, 2880]
    - [2, 19.752]
  - - [3776, 2880, 1, 256, 3776, 3776, 3776, 2880]
    - [0, 19.708]
  - - [3904, 2880, 1, 256, 3904, 3904, 3904, 2880]
    - [0, 19.803]
  - - [4032, 2880, 1, 256, 4032, 4032, 4032, 2880]
    - [2, 20.063]
  - - [64, 3008, 1, 256, 64, 64, 64, 3008]
    - [0, 9.421]
  - - [192, 3008, 1, 256, 192, 192, 192, 3008]
    - [0, 15.274]
  - - [320, 3008, 1, 256, 320, 320, 320, 3008]
    - [0, 17.423]
  - - [448, 3008, 1, 256, 448, 448, 448, 3008]
    - [0, 18.686]
  - - [576, 3008, 1, 256, 576, 576, 576, 3008]
    - [0, 19.786]
  - - [704, 3008, 1, 256, 704, 704, 704, 3008]
    - [0, 19.184]
  - - [832, 3008, 1, 256, 832, 832, 832, 3008]
    - [0, 19.455]
  - - [960, 3008, 1, 256, 960, 960, 960, 3008]
    - [0, 18.53]
  - - [1088, 3008, 1, 256, 1088, 1088, 1088, 3008]
    - [0, 18.667]
  - - [1216, 3008, 1, 256, 1216, 1216, 1216, 3008]
    - [0, 19.476]
  - - [1344, 3008, 1, 256, 1344, 1344, 1344, 3008]
    - [0, 19.662]
  - - [1472, 3008, 1, 256, 1472, 1472, 1472, 3008]
    - [2, 19.786]
  - - [1600, 3008, 1, 256, 1600, 1600, 1600, 3008]
    - [2, 20.037]
  - - [1728, 3008, 1, 256, 1728, 1728, 1728, 3008]
    - [2, 20.314]
  - - [1856, 3008, 1, 256, 1856, 1856, 1856, 3008]
    - [0, 19.877]
  - - [1984, 3008, 1, 256, 1984, 1984, 1984, 3008]
    - [0, 19.714]
  - - [2112, 3008, 1, 256, 2112, 2112, 2112, 3008]
    - [0, 19.8]
  - - [2240, 3008, 1, 256, 2240, 2240, 2240, 3008]
    - [2, 19.724]
  - - [2368, 3008, 1, 256, 2368, 2368, 2368, 3008]
    - [3, 20.424]
  - - [2496, 3008, 1, 256, 2496, 2496, 2496, 3008]
    - [0, 19.756]
  - - [2624, 3008, 1, 256, 2624, 2624, 2624, 3008]
    - [0, 19.94]
  - - [2752, 3008, 1, 256, 2752, 2752, 2752, 3008]
    - [2, 19.895]
  - - [2880, 3008, 1, 256, 2880, 2880, 2880, 3008]
    - [0, 20.073]
  - - [3008, 3008, 1, 256, 3008, 3008, 3008, 3008]
    - [0, 19.836]
  - - [3136, 3008, 1, 256, 3136, 3136, 3136, 3008]
    - [2, 19.818]
  - - [3264, 3008, 1, 256, 3264, 3264, 3264, 3008]
    - [2, 20.044]
  - - [3392, 3008, 1, 256, 3392, 3392, 3392, 3008]
    - [2, 20.081]
  - - [3520, 3008, 1, 256, 3520, 3520, 3520, 3008]
    - [2, 19.653]
  - - [3648, 3008, 1, 256, 3648, 3648, 3648, 3008]
    - [2, 19.812]
  - - [3776, 3008, 1, 256, 3776, 3776, 3776, 3008]
    - [0, 19.697]
  - - [3904, 3008, 1, 256, 3904, 3904, 3904, 3008]
    - [2, 19.86]
  - - [4032, 3008, 1, 256, 4032, 4032, 4032, 3008]
    - [2, 19.639]
  - - [64, 3136, 1, 256, 64, 64, 64, 3136]
    - [3, 8.998]
  - - [192, 3136, 1, 256, 192, 192, 192, 3136]
    - [0, 15.147]
  - - [320, 3136, 1, 256, 320, 320, 320, 3136]
    - [0, 17.869]
  - - [448, 3136, 1, 256, 448, 448, 448, 3136]
    - [0, 19.348]
  - - [576, 3136, 1, 256, 576, 576, 576, 3136]
    - [2, 18.642]
  - - [704, 3136, 1, 256, 704, 704, 704, 3136]
    - [0, 18.766]
  - - [832, 3136, 1, 256, 832, 832, 832, 3136]
    - [2, 18.336]
  - - [960, 3136, 1, 256, 960, 960, 960, 3136]
    - [0, 18.705]
  - - [1088, 3136, 1, 256, 1088, 1088, 1088, 3136]
    - [2, 19.464]
  - - [1216, 3136, 1, 256, 1216, 1216, 1216, 3136]
    - [0, 19.32]
  - - [1344, 3136, 1, 256, 1344, 1344, 1344, 3136]
    - [0, 19.507]
  - - [1472, 3136, 1, 256, 1472, 1472, 1472, 3136]
    - [0, 20.157]
  - - [1600, 3136, 1, 256, 1600, 1600, 1600, 3136]
    - [2, 20.12]
  - - [1728, 3136, 1, 256, 1728, 1728, 1728, 3136]
    - [2, 20.25]
  - - [1856, 3136, 1, 256, 1856, 1856, 1856, 3136]
    - [2, 19.709]
  - - [1984, 3136, 1, 256, 1984, 1984, 1984, 3136]
    - [2, 19.98]
  - - [2112, 3136, 1, 256, 2112, 2112, 2112, 3136]
    - [2, 19.637]
  - - [2240, 3136, 1, 256, 2240, 2240, 2240, 3136]
    - [0, 20.213]
  - - [2368, 3136, 1, 256, 2368, 2368, 2368, 3136]
    - [2, 19.811]
  - - [2496, 3136, 1, 256, 2496, 2496, 2496, 3136]
    - [0, 19.972]
  - - [2624, 3136, 1, 256, 2624, 2624, 2624, 3136]
    - [2, 20.213]
  - - [2752, 3136, 1, 256, 2752, 2752, 2752, 3136]
    - [0, 19.823]
  - - [2880, 3136, 1, 256, 2880, 2880, 2880, 3136]
    - [2, 19.84]
  - - [3008, 3136, 1, 256, 3008, 3008, 3008, 3136]
    - [2, 19.991]
  - - [3136, 3136, 1, 256, 3136, 3136, 3136, 3136]
    - [2, 19.916]
  - - [3264, 3136, 1, 256, 3264, 3264, 3264, 3136]
    - [0, 19.731]
  - - [3392, 3136, 1, 256, 3392, 3392, 3392, 3136]
    - [2, 19.824]
  - - [3520, 3136, 1, 256, 3520, 3520, 3520, 3136]
    - [0, 19.77]
  - - [3648, 3136, 1, 256, 3648, 3648, 3648, 3136]
    - [2, 19.729]
  - - [3776, 3136, 1, 256, 3776, 3776, 3776, 3136]
    - [0, 20.016]
  - - [3904, 3136, 1, 256, 3904, 3904, 3904, 3136]
    - [0, 19.737]
  - - [4032, 3136, 1, 256, 4032, 4032, 4032, 3136]
    - [0, 19.672]
  - - [64, 3264, 1, 256, 64, 64, 64, 3264]
    - [0, 9.342]
  - - [192, 3264, 1, 256, 192, 192, 192, 3264]
    - [0, 15.55]
  - - [320, 3264, 1, 256, 320, 320, 320, 3264]
    - [0, 17.642]
  - - [448, 3264, 1, 256, 448, 448, 448, 3264]
    - [0, 19.115]
  - - [576, 3264, 1, 256, 576, 576, 576, 3264]
    - [0, 19.836]
  - - [704, 3264, 1, 256, 704, 704, 704, 3264]
    - [2, 19.87]
  - - [832, 3264, 1, 256, 832, 832, 832, 3264]
    - [0, 19.177]
  - - [960, 3264, 1, 256, 960, 960, 960, 3264]
    - [0, 19.483]
  - - [1088, 3264, 1, 256, 1088, 1088, 1088, 3264]
    - [3, 19.355]
  - - [1216, 3264, 1, 256, 1216, 1216, 1216, 3264]
    - [0, 19.347]
  - - [1344, 3264, 1, 256, 1344, 1344, 1344, 3264]
    - [2, 19.746]
  - - [1472, 3264, 1, 256, 1472, 1472, 1472, 3264]
    - [2, 20.369]
  - - [1600, 3264, 1, 256, 1600, 1600, 1600, 3264]
    - [0, 20.488]
  - - [1728, 3264, 1, 256, 1728, 1728, 1728, 3264]
    - [0, 20.307]
  - - [1856, 3264, 1, 256, 1856, 1856, 1856, 3264]
    - [0, 20.089]
  - - [1984, 3264, 1, 256, 1984, 1984, 1984, 3264]
    - [0, 20.21]
  - - [2112, 3264, 1, 256, 2112, 2112, 2112, 3264]
    - [2, 19.892]
  - - [2240, 3264, 1, 256, 2240, 2240, 2240, 3264]
    - [0, 20.446]
  - - [2368, 3264, 1, 256, 2368, 2368, 2368, 3264]
    - [0, 19.836]
  - - [2496, 3264, 1, 256, 2496, 2496, 2496, 3264]
    - [0, 20.324]
  - - [2624, 3264, 1, 256, 2624, 2624, 2624, 3264]
    - [0, 19.667]
  - - [2752, 3264, 1, 256, 2752, 2752, 2752, 3264]
    - [2, 19.697]
  - - [2880, 3264, 1, 256, 2880, 2880, 2880, 3264]
    - [2, 20.013]
  - - [3008, 3264, 1, 256, 3008, 3008, 3008, 3264]
    - [0, 20.002]
  - - [3136, 3264, 1, 256, 3136, 3136, 3136, 3264]
    - [2, 20.09]
  - - [3264, 3264, 1, 256, 3264, 3264, 3264, 3264]
    - [2, 20.133]
  - - [3392, 3264, 1, 256, 3392, 3392, 3392, 3264]
    - [2, 19.694]
  - - [3520, 3264, 1, 256, 3520, 3520, 3520, 3264]
    - [2, 19.985]
  - - [3648, 3264, 1, 256, 3648, 3648, 3648, 3264]
    - [2, 19.698]
  - - [3776, 3264, 1, 256, 3776, 3776, 3776, 3264]
    - [2, 19.687]
  - - [3904, 3264, 1, 256, 3904, 3904, 3904, 3264]
    - [0, 19.738]
  - - [4032, 3264, 1, 256, 4032, 4032, 4032, 3264]
    - [0, 19.759]
  - - [64, 3392, 1, 256, 64, 64, 64, 3392]
    - [0, 9.762]
  - - [192, 3392, 1, 256, 192, 192, 192, 3392]
    - [2, 15.639]
  - - [320, 3392, 1, 256, 320, 320, 320, 3392]
    - [0, 17.811]
  - - [448, 3392, 1, 256, 448, 448, 448, 3392]
    - [2, 18.877]
  - - [576, 3392, 1, 256, 576, 576, 576, 3392]
    - [0, 18.719]
  - - [704, 3392, 1, 256, 704, 704, 704, 3392]
    - [0, 19.039]
  - - [832, 3392, 1, 256, 832, 832, 832, 3392]
    - [2, 18.373]
  - - [960, 3392, 1, 256, 960, 960, 960, 3392]
    - [3, 18.568]
  - - [1088, 3392, 1, 256, 1088, 1088, 1088, 3392]
    - [2, 19.031]
  - - [1216, 3392, 1, 256, 1216, 1216, 1216, 3392]
    - [0, 19.482]
  - - [1344, 3392, 1, 256, 1344, 1344, 1344, 3392]
    - [2, 20.078]
  - - [1472, 3392, 1, 256, 1472, 1472, 1472, 3392]
    - [2, 20.026]
  - - [1600, 3392, 1, 256, 1600, 1600, 1600, 3392]
    - [0, 19.847]
  - - [1728, 3392, 1, 256, 1728, 1728, 1728, 3392]
    - [0, 20.422]
  - - [1856, 3392, 1, 256, 1856, 1856, 1856, 3392]
    - [0, 19.858]
  - - [1984, 3392, 1, 256, 1984, 1984, 1984, 3392]
    - [2, 19.893]
  - - [2112, 3392, 1, 256, 2112, 2112, 2112, 3392]
    - [2, 19.768]
  - - [2240, 3392, 1, 256, 2240, 2240, 2240, 3392]
    - [2, 19.926]
  - - [2368, 3392, 1, 256, 2368, 2368, 2368, 3392]
    - [0, 19.748]
  - - [2496, 3392, 1, 256, 2496, 2496, 2496, 3392]
    - [2, 19.972]
  - - [2624, 3392, 1, 256, 2624, 2624, 2624, 3392]
    - [0, 19.906]
  - - [2752, 3392, 1, 256, 2752, 2752, 2752, 3392]
    - [2, 19.963]
  - - [2880, 3392, 1, 256, 2880, 2880, 2880, 3392]
    - [0, 19.948]
  - - [3008, 3392, 1, 256, 3008, 3008, 3008, 3392]
    - [0, 19.904]
  - - [3136, 3392, 1, 256, 3136, 3136, 3136, 3392]
    - [2, 19.892]
  - - [3264, 3392, 1, 256, 3264, 3264, 3264, 3392]
    - [2, 19.656]
  - - [3392, 3392, 1, 256, 3392, 3392, 3392, 3392]
    - [2, 19.772]
  - - [3520, 3392, 1, 256, 3520, 3520, 3520, 3392]
    - [2, 19.75]
  - - [3648, 3392, 1, 256, 3648, 3648, 3648, 3392]
    - [2, 19.627]
  - - [3776, 3392, 1, 256, 3776, 3776, 3776, 3392]
    - [0, 19.493]
  - - [3904, 3392, 1, 256, 3904, 3904, 3904, 3392]
    - [0, 19.788]
  - - [4032, 3392, 1, 256, 4032, 4032, 4032, 3392]
    - [0, 19.584]
  - - [64, 3520, 1, 256, 64, 64, 64, 3520]
    - [0, 10.112]
  - - [192, 3520, 1, 256, 192, 192, 192, 3520]
    - [0, 15.935]
  - - [320, 3520, 1, 256, 320, 320, 320, 3520]
    - [0, 18.046]
  - - [448, 3520, 1, 256, 448, 448, 448, 3520]
    - [0, 19.873]
  - - [576, 3520, 1, 256, 576, 576, 576, 3520]
    - [0, 19.686]
  - - [704, 3520, 1, 256, 704, 704, 704, 3520]
    - [2, 18.663]
  - - [832, 3520, 1, 256, 832, 832, 832, 3520]
    - [3, 18.806]
  - - [960, 3520, 1, 256, 960, 960, 960, 3520]
    - [0, 19.779]
  - - [1088, 3520, 1, 256, 1088, 1088, 1088, 3520]
    - [2, 19.818]
  - - [1216, 3520, 1, 256, 1216, 1216, 1216, 3520]
    - [2, 19.836]
  - - [1344, 3520, 1, 256, 1344, 1344, 1344, 3520]
    - [2, 20.442]
  - - [1472, 3520, 1, 256, 1472, 1472, 1472, 3520]
    - [2, 20.759]
  - - [1600, 3520, 1, 256, 1600, 1600, 1600, 3520]
    - [2, 20.295]
  - - [1728, 3520, 1, 256, 1728, 1728, 1728, 3520]
    - [2, 19.851]
  - - [1856, 3520, 1, 256, 1856, 1856, 1856, 3520]
    - [0, 19.956]
  - - [1984, 3520, 1, 256, 1984, 1984, 1984, 3520]
    - [0, 19.922]
  - - [2112, 3520, 1, 256, 2112, 2112, 2112, 3520]
    - [0, 19.821]
  - - [2240, 3520, 1, 256, 2240, 2240, 2240, 3520]
    - [0, 20.319]
  - - [2368, 3520, 1, 256, 2368, 2368, 2368, 3520]
    - [0, 19.755]
  - - [2496, 3520, 1, 256, 2496, 2496, 2496, 3520]
    - [2, 20.127]
  - - [2624, 3520, 1, 256, 2624, 2624, 2624, 3520]
    - [0, 19.971]
  - - [2752, 3520, 1, 256, 2752, 2752, 2752, 3520]
    - [0, 19.938]
  - - [2880, 3520, 1, 256, 2880, 2880, 2880, 3520]
    - [2, 20.204]
  - - [3008, 3520, 1, 256, 3008, 3008, 3008, 3520]
    - [2, 19.729]
  - - [3136, 3520, 1, 256, 3136, 3136, 3136, 3520]
    - [2, 19.862]
  - - [3264, 3520, 1, 256, 3264, 3264, 3264, 3520]
    - [0, 19.698]
  - - [3392, 3520, 1, 256, 3392, 3392, 3392, 3520]
    - [0, 19.853]
  - - [3520, 3520, 1, 256, 3520, 3520, 3520, 3520]
    - [0, 19.643]
  - - [3648, 3520, 1, 256, 3648, 3648, 3648, 3520]
    - [0, 19.654]
  - - [3776, 3520, 1, 256, 3776, 3776, 3776, 3520]
    - [0, 19.712]
  - - [3904, 3520, 1, 256, 3904, 3904, 3904, 3520]
    - [0, 19.531]
  - - [4032, 3520, 1, 256, 4032, 4032, 4032, 3520]
    - [0, 19.628]
  - - [64, 3648, 1, 256, 64, 64, 64, 3648]
    - [0, 10.467]
  - - [192, 3648, 1, 256, 192, 192, 192, 3648]
    - [2, 15.98]
  - - [320, 3648, 1, 256, 320, 320, 320, 3648]
    - [0, 18.133]
  - - [448, 3648, 1, 256, 448, 448, 448, 3648]
    - [0, 18.973]
  - - [576, 3648, 1, 256, 576, 576, 576, 3648]
    - [0, 19.046]
  - - [704, 3648, 1, 256, 704, 704, 704, 3648]
    - [0, 19.07]
  - - [832, 3648, 1, 256, 832, 832, 832, 3648]
    - [2, 19.204]
  - - [960, 3648, 1, 256, 960, 960, 960, 3648]
    - [0, 19.466]
  - - [1088, 3648, 1, 256, 1088, 1088, 1088, 3648]
    - [2, 19.951]
  - - [1216, 3648, 1, 256, 1216, 1216, 1216, 3648]
    - [2, 20.313]
  - - [1344, 3648, 1, 256, 1344, 1344, 1344, 3648]
    - [0, 19.88]
  - - [1472, 3648, 1, 256, 1472, 1472, 1472, 3648]
    - [2, 19.994]
  - - [1600, 3648, 1, 256, 1600, 1600, 1600, 3648]
    - [0, 20.329]
  - - [1728, 3648, 1, 256, 1728, 1728, 1728, 3648]
    - [0, 20.796]
  - - [1856, 3648, 1, 256, 1856, 1856, 1856, 3648]
    - [2, 20.024]
  - - [1984, 3648, 1, 256, 1984, 1984, 1984, 3648]
    - [2, 20.013]
  - - [2112, 3648, 1, 256, 2112, 2112, 2112, 3648]
    - [2, 20.115]
  - - [2240, 3648, 1, 256, 2240, 2240, 2240, 3648]
    - [2, 19.897]
  - - [2368, 3648, 1, 256, 2368, 2368, 2368, 3648]
    - [0, 19.883]
  - - [2496, 3648, 1, 256, 2496, 2496, 2496, 3648]
    - [2, 19.661]
  - - [2624, 3648, 1, 256, 2624, 2624, 2624, 3648]
    - [0, 20.079]
  - - [2752, 3648, 1, 256, 2752, 2752, 2752, 3648]
    - [0, 19.74]
  - - [2880, 3648, 1, 256, 2880, 2880, 2880, 3648]
    - [0, 20.152]
  - - [3008, 3648, 1, 256, 3008, 3008, 3008, 3648]
    - [0, 19.774]
  - - [3136, 3648, 1, 256, 3136, 3136, 3136, 3648]
    - [2, 20.101]
  - - [3264, 3648, 1, 256, 3264, 3264, 3264, 3648]
    - [2, 19.9]
  - - [3392, 3648, 1, 256, 3392, 3392, 3392, 3648]
    - [2, 19.739]
  - - [3520, 3648, 1, 256, 3520, 3520, 3520, 3648]
    - [0, 19.781]
  - - [3648, 3648, 1, 256, 3648, 3648, 3648, 3648]
    - [0, 19.696]
  - - [3776, 3648, 1, 256, 3776, 3776, 3776, 3648]
    - [0, 19.526]
  - - [3904, 3648, 1, 256, 3904, 3904, 3904, 3648]
    - [0, 19.683]
  - - [4032, 3648, 1, 256, 4032, 4032, 4032, 3648]
    - [0, 19.561]
  - - [64, 3776, 1, 256, 64, 64, 64, 3776]
    - [3, 9.736]
  - - [192, 3776, 1, 256, 192, 192, 192, 3776]
    - [3, 15.338]
  - - [320, 3776, 1, 256, 320, 320, 320, 3776]
    - [0, 18.768]
  - - [448, 3776, 1, 256, 448, 448, 448, 3776]
    - [0, 18.877]
  - - [576, 3776, 1, 256, 576, 576, 576, 3776]
    - [0, 19.96]
  - - [704, 3776, 1, 256, 704, 704, 704, 3776]
    - [0, 18.972]
  - - [832, 3776, 1, 256, 832, 832, 832, 3776]
    - [2, 19.17]
  - - [960, 3776, 1, 256, 960, 960, 960, 3776]
    - [2, 19.101]
  - - [1088, 3776, 1, 256, 1088, 1088, 1088, 3776]
    - [0, 20.275]
  - - [1216, 3776, 1, 256, 1216, 1216, 1216, 3776]
    - [0, 19.922]
  - - [1344, 3776, 1, 256, 1344, 1344, 1344, 3776]
    - [0, 20.105]
  - - [1472, 3776, 1, 256, 1472, 1472, 1472, 3776]
    - [2, 20.427]
  - - [1600, 3776, 1, 256, 1600, 1600, 1600, 3776]
    - [0, 20.076]
  - - [1728, 3776, 1, 256, 1728, 1728, 1728, 3776]
    - [0, 20.147]
  - - [1856, 3776, 1, 256, 1856, 1856, 1856, 3776]
    - [0, 19.88]
  - - [1984, 3776, 1, 256, 1984, 1984, 1984, 3776]
    - [2, 19.805]
  - - [2112, 3776, 1, 256, 2112, 2112, 2112, 3776]
    - [2, 19.913]
  - - [2240, 3776, 1, 256, 2240, 2240, 2240, 3776]
    - [0, 20.012]
  - - [2368, 3776, 1, 256, 2368, 2368, 2368, 3776]
    - [0, 20.051]
  - - [2496, 3776, 1, 256, 2496, 2496, 2496, 3776]
    - [2, 20.114]
  - - [2624, 3776, 1, 256, 2624, 2624, 2624, 3776]
    - [2, 20.038]
  - - [2752, 3776, 1, 256, 2752, 2752, 2752, 3776]
    - [2, 20.134]
  - - [2880, 3776, 1, 256, 2880, 2880, 2880, 3776]
    - [2, 19.831]
  - - [3008, 3776, 1, 256, 3008, 3008, 3008, 3776]
    - [2, 19.826]
  - - [3136, 3776, 1, 256, 3136, 3136, 3136, 3776]
    - [2, 19.764]
  - - [3264, 3776, 1, 256, 3264, 3264, 3264, 3776]
    - [0, 19.748]
  - - [3392, 3776, 1, 256, 3392, 3392, 3392, 3776]
    - [0, 19.65]
  - - [3520, 3776, 1, 256, 3520, 3520, 3520, 3776]
    - [0, 19.612]
  - - [3648, 3776, 1, 256, 3648, 3648, 3648, 3776]
    - [0, 19.493]
  - - [3776, 3776, 1, 256, 3776, 3776, 3776, 3776]
    - [0, 19.566]
  - - [3904, 3776, 1, 256, 3904, 3904, 3904, 3776]
    - [0, 19.61]
  - - [4032, 3776, 1, 256, 4032, 4032, 4032, 3776]
    - [0, 19.459]
  - - [64, 3904, 1, 256, 64, 64, 64, 3904]
    - [0, 10.339]
  - - [192, 3904, 1, 256, 192, 192, 192, 3904]
    - [0, 16.264]
  - - [320, 3904, 1, 256, 320, 320, 320, 3904]
    - [0, 18.436]
  - - [448, 3904, 1, 256, 448, 448, 448, 3904]
    - [0, 19.544]
  - - [576, 3904, 1, 256, 576, 576, 576, 3904]
    - [0, 18.969]
  - - [704, 3904, 1, 256, 704, 704, 704, 3904]
    - [0, 19.502]
  - - [832, 3904, 1, 256, 832, 832, 832, 3904]
    - [2, 18.77]
  - - [960, 3904, 1, 256, 960, 960, 960, 3904]
    - [0, 19.391]
  - - [1088, 3904, 1, 256, 1088, 1088, 1088, 3904]
    - [2, 19.569]
  - - [1216, 3904, 1, 256, 1216, 1216, 1216, 3904]
    - [0, 19.834]
  - - [1344, 3904, 1, 256, 1344, 1344, 1344, 3904]
    - [2, 19.745]
  - - [1472, 3904, 1, 256, 1472, 1472, 1472, 3904]
    - [2, 20.287]
  - - [1600, 3904, 1, 256, 1600, 1600, 1600, 3904]
    - [2, 20.257]
  - - [1728, 3904, 1, 256, 1728, 1728, 1728, 3904]
    - [2, 20.37]
  - - [1856, 3904, 1, 256, 1856, 1856, 1856, 3904]
    - [0, 20.026]
  - - [1984, 3904, 1, 256, 1984, 1984, 1984, 3904]
    - [2, 19.962]
  - - [2112, 3904, 1, 256, 2112, 2112, 2112, 3904]
    - [0, 20.062]
  - - [2240, 3904, 1, 256, 2240, 2240, 2240, 3904]
    - [0, 19.929]
  - - [2368, 3904, 1, 256, 2368, 2368, 2368, 3904]
    - [2, 19.778]
  - - [2496, 3904, 1, 256, 2496, 2496, 2496, 3904]
    - [2, 20.026]
  - - [2624, 3904, 1, 256, 2624, 2624, 2624, 3904]
    - [2, 19.955]
  - - [2752, 3904, 1, 256, 2752, 2752, 2752, 3904]
    - [2, 19.811]
  - - [2880, 3904, 1, 256, 2880, 2880, 2880, 3904]
    - [0, 19.862]
  - - [3008, 3904, 1, 256, 3008, 3008, 3008, 3904]
    - [0, 19.95]
  - - [3136, 3904, 1, 256, 3136, 3136, 3136, 3904]
    - [0, 19.774]
  - - [3264, 3904, 1, 256, 3264, 3264, 3264, 3904]
    - [0, 19.673]
  - - [3392, 3904, 1, 256, 3392, 3392, 3392, 3904]
    - [0, 19.662]
  - - [3520, 3904, 1, 256, 3520, 3520, 3520, 3904]
    - [0, 19.892]
  - - [3648, 3904, 1, 256, 3648, 3648, 3648, 3904]
    - [0, 19.557]
  - - [3776, 3904, 1, 256, 3776, 3776, 3776, 3904]
    - [0, 19.615]
  - - [3904, 3904, 1, 256, 3904, 3904, 3904, 3904]
    - [0, 19.571]
  - - [4032, 3904, 1, 256, 4032, 4032, 4032, 3904]
    - [0, 19.503]
  - - [64, 4032, 1, 256, 64, 64, 64, 4032]
    - [0, 10.605]
  - - [192, 4032, 1, 256, 192, 192, 192, 4032]
    - [2, 16.639]
  - - [320, 4032, 1, 256, 320, 320, 320, 4032]
    - [0, 18.496]
  - - [448, 4032, 1, 256, 448, 448, 448, 4032]
    - [0, 19.842]
  - - [576, 4032, 1, 256, 576, 576, 576, 4032]
    - [0, 19.22]
  - - [704, 4032, 1, 256, 704, 704, 704, 4032]
    - [0, 18.751]
  - - [832, 4032, 1, 256, 832, 832, 832, 4032]
    - [3, 18.891]
  - - [960, 4032, 1, 256, 960, 960, 960, 4032]
    - [0, 19.681]
  - - [1088, 4032, 1, 256, 1088, 1088, 1088, 4032]
    - [2, 19.968]
  - - [1216, 4032, 1, 256, 1216, 1216, 1216, 4032]
    - [2, 21.222]
  - - [1344, 4032, 1, 256, 1344, 1344, 1344, 4032]
    - [3, 19.601]
  - - [1472, 4032, 1, 256, 1472, 1472, 1472, 4032]
    - [2, 20.342]
  - - [1600, 4032, 1, 256, 1600, 1600, 1600, 4032]
    - [0, 19.918]
  - - [1728, 4032, 1, 256, 1728, 1728, 1728, 4032]
    - [0, 20.038]
  - - [1856, 4032, 1, 256, 1856, 1856, 1856, 4032]
    - [2, 20.069]
  - - [1984, 4032, 1, 256, 1984, 1984, 1984, 4032]
    - [2, 19.903]
  - - [2112, 4032, 1, 256, 2112, 2112, 2112, 4032]
    - [0, 19.889]
  - - [2240, 4032, 1, 256, 2240, 2240, 2240, 4032]
    - [0, 19.992]
  - - [2368, 4032, 1, 256, 2368, 2368, 2368, 4032]
    - [0, 20.033]
  - - [2496, 4032, 1, 256, 2496, 2496, 2496, 4032]
    - [0, 20.021]
  - - [2624, 4032, 1, 256, 2624, 2624, 2624, 4032]
    - [0, 19.848]
  - - [2752, 4032, 1, 256, 2752, 2752, 2752, 4032]
    - [2, 19.86]
  - - [2880, 4032, 1, 256, 2880, 2880, 2880, 4032]
    - [2, 19.799]
  - - [3008, 4032, 1, 256, 3008, 3008, 3008, 4032]
    - [0, 19.652]
  - - [3136, 4032, 1, 256, 3136, 3136, 3136, 4032]
    - [2, 19.714]
  - - [3264, 4032, 1, 256, 3264, 3264, 3264, 4032]
    - [0, 19.752]
  - - [3392, 4032, 1, 256, 3392, 3392, 3392, 4032]
    - [0, 19.612]
  - - [3520, 4032, 1, 256, 3520, 3520, 3520, 4032]
    - [0, 19.644]
  - - [3648, 4032, 1, 256, 3648, 3648, 3648, 4032]
    - [0, 19.378]
  - - [3776, 4032, 1, 256, 3776, 3776, 3776, 4032]
    - [0, 19.532]
  - - [3904, 4032, 1, 256, 3904, 3904, 3904, 4032]
    - [0, 19.551]
  - - [4032, 4032, 1, 256, 4032, 4032, 4032, 4032]
    - [0, 19.737]
  - - [64, 64, 1, 512, 64, 64, 64, 64]
    - [2, 0.528]
  - - [192, 64, 1, 512, 192, 192, 192, 64]
    - [2, 1.573]
  - - [320, 64, 1, 512, 320, 320, 320, 64]
    - [2, 2.592]
  - - [448, 64, 1, 512, 448, 448, 448, 64]
    - [0, 3.47]
  - - [576, 64, 1, 512, 576, 576, 576, 64]
    - [0, 4.455]
  - - [704, 64, 1, 512, 704, 704, 704, 64]
    - [0, 5.447]
  - - [832, 64, 1, 512, 832, 832, 832, 64]
    - [2, 5.415]
  - - [960, 64, 1, 512, 960, 960, 960, 64]
    - [2, 6.204]
  - - [1088, 64, 1, 512, 1088, 1088, 1088, 64]
    - [2, 6.951]
  - - [1216, 64, 1, 512, 1216, 1216, 1216, 64]
    - [0, 7.454]
  - - [1344, 64, 1, 512, 1344, 1344, 1344, 64]
    - [0, 8.281]
  - - [1472, 64, 1, 512, 1472, 1472, 1472, 64]
    - [0, 9.021]
  - - [1600, 64, 1, 512, 1600, 1600, 1600, 64]
    - [2, 8.38]
  - - [1728, 64, 1, 512, 1728, 1728, 1728, 64]
    - [2, 8.991]
  - - [1856, 64, 1, 512, 1856, 1856, 1856, 64]
    - [2, 9.662]
  - - [1984, 64, 1, 512, 1984, 1984, 1984, 64]
    - [0, 10.099]
  - - [2112, 64, 1, 512, 2112, 2112, 2112, 64]
    - [0, 10.78]
  - - [2240, 64, 1, 512, 2240, 2240, 2240, 64]
    - [0, 11.372]
  - - [2368, 64, 1, 512, 2368, 2368, 2368, 64]
    - [1, 9.559]
  - - [2496, 64, 1, 512, 2496, 2496, 2496, 64]
    - [2, 10.17]
  - - [2624, 64, 1, 512, 2624, 2624, 2624, 64]
    - [0, 10.714]
  - - [2752, 64, 1, 512, 2752, 2752, 2752, 64]
    - [0, 12.227]
  - - [2880, 64, 1, 512, 2880, 2880, 2880, 64]
    - [0, 12.539]
  - - [3008, 64, 1, 512, 3008, 3008, 3008, 64]
    - [0, 13.054]
  - - [3136, 64, 1, 512, 3136, 3136, 3136, 64]
    - [0, 12.186]
  - - [3264, 64, 1, 512, 3264, 3264, 3264, 64]
    - [0, 12.581]
  - - [3392, 64, 1, 512, 3392, 3392, 3392, 64]
    - [0, 13.057]
  - - [3520, 64, 1, 512, 3520, 3520, 3520, 64]
    - [0, 13.57]
  - - [3648, 64, 1, 512, 3648, 3648, 3648, 64]
    - [0, 13.843]
  - - [3776, 64, 1, 512, 3776, 3776, 3776, 64]
    - [0, 14.239]
  - - [3904, 64, 1, 512, 3904, 3904, 3904, 64]
    - [0, 13.247]
  - - [4032, 64, 1, 512, 4032, 4032, 4032, 64]
    - [0, 13.539]
  - - [64, 192, 1, 512, 64, 64, 64, 192]
    - [1, 0.864]
  - - [192, 192, 1, 512, 192, 192, 192, 192]
    - [2, 2.51]
  - - [320, 192, 1, 512, 320, 320, 320, 192]
    - [1, 4.449]
  - - [448, 192, 1, 512, 448, 448, 448, 192]
    - [3, 7.892]
  - - [576, 192, 1, 512, 576, 576, 576, 192]
    - [2, 8.975]
  - - [704, 192, 1, 512, 704, 704, 704, 192]
    - [0, 10.751]
  - - [832, 192, 1, 512, 832, 832, 832, 192]
    - [2, 11.0]
  - - [960, 192, 1, 512, 960, 960, 960, 192]
    - [0, 12.501]
  - - [1088, 192, 1, 512, 1088, 1088, 1088, 192]
    - [0, 12.594]
  - - [1216, 192, 1, 512, 1216, 1216, 1216, 192]
    - [0, 14.216]
  - - [1344, 192, 1, 512, 1344, 1344, 1344, 192]
    - [0, 13.787]
  - - [1472, 192, 1, 512, 1472, 1472, 1472, 192]
    - [0, 14.98]
  - - [1600, 192, 1, 512, 1600, 1600, 1600, 192]
    - [0, 14.789]
  - - [1728, 192, 1, 512, 1728, 1728, 1728, 192]
    - [0, 15.873]
  - - [1856, 192, 1, 512, 1856, 1856, 1856, 192]
    - [0, 15.61]
  - - [1984, 192, 1, 512, 1984, 1984, 1984, 192]
    - [2, 16.764]
  - - [2112, 192, 1, 512, 2112, 2112, 2112, 192]
    - [2, 16.382]
  - - [2240, 192, 1, 512, 2240, 2240, 2240, 192]
    - [0, 17.079]
  - - [2368, 192, 1, 512, 2368, 2368, 2368, 192]
    - [2, 17.008]
  - - [2496, 192, 1, 512, 2496, 2496, 2496, 192]
    - [0, 17.33]
  - - [2624, 192, 1, 512, 2624, 2624, 2624, 192]
    - [2, 17.296]
  - - [2752, 192, 1, 512, 2752, 2752, 2752, 192]
    - [2, 17.891]
  - - [2880, 192, 1, 512, 2880, 2880, 2880, 192]
    - [2, 17.605]
  - - [3008, 192, 1, 512, 3008, 3008, 3008, 192]
    - [0, 18.044]
  - - [3136, 192, 1, 512, 3136, 3136, 3136, 192]
    - [2, 18.413]
  - - [3264, 192, 1, 512, 3264, 3264, 3264, 192]
    - [0, 18.845]
  - - [3392, 192, 1, 512, 3392, 3392, 3392, 192]
    - [2, 18.896]
  - - [3520, 192, 1, 512, 3520, 3520, 3520, 192]
    - [0, 18.974]
  - - [3648, 192, 1, 512, 3648, 3648, 3648, 192]
    - [2, 19.597]
  - - [3776, 192, 1, 512, 3776, 3776, 3776, 192]
    - [0, 19.614]
  - - [3904, 192, 1, 512, 3904, 3904, 3904, 192]
    - [0, 19.6]
  - - [4032, 192, 1, 512, 4032, 4032, 4032, 192]
    - [0, 19.93]
  - - [64, 320, 1, 512, 64, 64, 64, 320]
    - [2, 2.695]
  - - [192, 320, 1, 512, 192, 192, 192, 320]
    - [2, 6.336]
  - - [320, 320, 1, 512, 320, 320, 320, 320]
    - [2, 8.542]
  - - [448, 320, 1, 512, 448, 448, 448, 320]
    - [0, 11.674]
  - - [576, 320, 1, 512, 576, 576, 576, 320]
    - [0, 12.549]
  - - [704, 320, 1, 512, 704, 704, 704, 320]
    - [0, 13.541]
  - - [832, 320, 1, 512, 832, 832, 832, 320]
    - [0, 14.151]
  - - [960, 320, 1, 512, 960, 960, 960, 320]
    - [0, 14.845]
  - - [1088, 320, 1, 512, 1088, 1088, 1088, 320]
    - [0, 15.356]
  - - [1216, 320, 1, 512, 1216, 1216, 1216, 320]
    - [0, 16.809]
  - - [1344, 320, 1, 512, 1344, 1344, 1344, 320]
    - [0, 17.096]
  - - [1472, 320, 1, 512, 1472, 1472, 1472, 320]
    - [0, 17.063]
  - - [1600, 320, 1, 512, 1600, 1600, 1600, 320]
    - [2, 17.273]
  - - [1728, 320, 1, 512, 1728, 1728, 1728, 320]
    - [3, 17.657]
  - - [1856, 320, 1, 512, 1856, 1856, 1856, 320]
    - [2, 17.974]
  - - [1984, 320, 1, 512, 1984, 1984, 1984, 320]
    - [0, 18.543]
  - - [2112, 320, 1, 512, 2112, 2112, 2112, 320]
    - [0, 19.145]
  - - [2240, 320, 1, 512, 2240, 2240, 2240, 320]
    - [2, 19.27]
  - - [2368, 320, 1, 512, 2368, 2368, 2368, 320]
    - [0, 19.356]
  - - [2496, 320, 1, 512, 2496, 2496, 2496, 320]
    - [0, 19.411]
  - - [2624, 320, 1, 512, 2624, 2624, 2624, 320]
    - [2, 19.786]
  - - [2752, 320, 1, 512, 2752, 2752, 2752, 320]
    - [0, 20.278]
  - - [2880, 320, 1, 512, 2880, 2880, 2880, 320]
    - [0, 19.954]
  - - [3008, 320, 1, 512, 3008, 3008, 3008, 320]
    - [0, 20.426]
  - - [3136, 320, 1, 512, 3136, 3136, 3136, 320]
    - [0, 20.024]
  - - [3264, 320, 1, 512, 3264, 3264, 3264, 320]
    - [0, 20.012]
  - - [3392, 320, 1, 512, 3392, 3392, 3392, 320]
    - [0, 19.859]
  - - [3520, 320, 1, 512, 3520, 3520, 3520, 320]
    - [0, 19.872]
  - - [3648, 320, 1, 512, 3648, 3648, 3648, 320]
    - [0, 19.699]
  - - [3776, 320, 1, 512, 3776, 3776, 3776, 320]
    - [2, 20.145]
  - - [3904, 320, 1, 512, 3904, 3904, 3904, 320]
    - [0, 20.165]
  - - [4032, 320, 1, 512, 4032, 4032, 4032, 320]
    - [0, 20.349]
  - - [64, 448, 1, 512, 64, 64, 64, 448]
    - [3, 0.944]
  - - [192, 448, 1, 512, 192, 192, 192, 448]
    - [1, 5.447]
  - - [320, 448, 1, 512, 320, 320, 320, 448]
    - [0, 11.192]
  - - [448, 448, 1, 512, 448, 448, 448, 448]
    - [0, 12.035]
  - - [576, 448, 1, 512, 576, 576, 576, 448]
    - [0, 13.597]
  - - [704, 448, 1, 512, 704, 704, 704, 448]
    - [0, 15.005]
  - - [832, 448, 1, 512, 832, 832, 832, 448]
    - [0, 16.278]
  - - [960, 448, 1, 512, 960, 960, 960, 448]
    - [0, 17.201]
  - - [1088, 448, 1, 512, 1088, 1088, 1088, 448]
    - [0, 17.84]
  - - [1216, 448, 1, 512, 1216, 1216, 1216, 448]
    - [2, 17.758]
  - - [1344, 448, 1, 512, 1344, 1344, 1344, 448]
    - [3, 18.596]
  - - [1472, 448, 1, 512, 1472, 1472, 1472, 448]
    - [2, 18.919]
  - - [1600, 448, 1, 512, 1600, 1600, 1600, 448]
    - [2, 19.608]
  - - [1728, 448, 1, 512, 1728, 1728, 1728, 448]
    - [0, 19.55]
  - - [1856, 448, 1, 512, 1856, 1856, 1856, 448]
    - [0, 20.24]
  - - [1984, 448, 1, 512, 1984, 1984, 1984, 448]
    - [0, 20.103]
  - - [2112, 448, 1, 512, 2112, 2112, 2112, 448]
    - [0, 20.029]
  - - [2240, 448, 1, 512, 2240, 2240, 2240, 448]
    - [0, 20.349]
  - - [2368, 448, 1, 512, 2368, 2368, 2368, 448]
    - [2, 20.414]
  - - [2496, 448, 1, 512, 2496, 2496, 2496, 448]
    - [0, 20.215]
  - - [2624, 448, 1, 512, 2624, 2624, 2624, 448]
    - [0, 20.559]
  - - [2752, 448, 1, 512, 2752, 2752, 2752, 448]
    - [0, 20.551]
  - - [2880, 448, 1, 512, 2880, 2880, 2880, 448]
    - [0, 20.592]
  - - [3008, 448, 1, 512, 3008, 3008, 3008, 448]
    - [0, 20.713]
  - - [3136, 448, 1, 512, 3136, 3136, 3136, 448]
    - [2, 20.263]
  - - [3264, 448, 1, 512, 3264, 3264, 3264, 448]
    - [0, 20.606]
  - - [3392, 448, 1, 512, 3392, 3392, 3392, 448]
    - [0, 20.413]
  - - [3520, 448, 1, 512, 3520, 3520, 3520, 448]
    - [0, 20.46]
  - - [3648, 448, 1, 512, 3648, 3648, 3648, 448]
    - [2, 20.073]
  - - [3776, 448, 1, 512, 3776, 3776, 3776, 448]
    - [2, 20.122]
  - - [3904, 448, 1, 512, 3904, 3904, 3904, 448]
    - [0, 20.808]
  - - [4032, 448, 1, 512, 4032, 4032, 4032, 448]
    - [2, 20.441]
  - - [64, 576, 1, 512, 64, 64, 64, 576]
    - [0, 4.382]
  - - [192, 576, 1, 512, 192, 192, 192, 576]
    - [2, 8.907]
  - - [320, 576, 1, 512, 320, 320, 320, 576]
    - [0, 12.352]
  - - [448, 576, 1, 512, 448, 448, 448, 576]
    - [0, 13.635]
  - - [576, 576, 1, 512, 576, 576, 576, 576]
    - [0, 15.693]
  - - [704, 576, 1, 512, 704, 704, 704, 576]
    - [0, 16.173]
  - - [832, 576, 1, 512, 832, 832, 832, 576]
    - [0, 17.386]
  - - [960, 576, 1, 512, 960, 960, 960, 576]
    - [3, 18.023]
  - - [1088, 576, 1, 512, 1088, 1088, 1088, 576]
    - [0, 18.783]
  - - [1216, 576, 1, 512, 1216, 1216, 1216, 576]
    - [2, 19.094]
  - - [1344, 576, 1, 512, 1344, 1344, 1344, 576]
    - [2, 19.505]
  - - [1472, 576, 1, 512, 1472, 1472, 1472, 576]
    - [0, 20.048]
  - - [1600, 576, 1, 512, 1600, 1600, 1600, 576]
    - [0, 20.657]
  - - [1728, 576, 1, 512, 1728, 1728, 1728, 576]
    - [2, 19.954]
  - - [1856, 576, 1, 512, 1856, 1856, 1856, 576]
    - [0, 19.962]
  - - [1984, 576, 1, 512, 1984, 1984, 1984, 576]
    - [2, 20.205]
  - - [2112, 576, 1, 512, 2112, 2112, 2112, 576]
    - [0, 20.06]
  - - [2240, 576, 1, 512, 2240, 2240, 2240, 576]
    - [2, 20.195]
  - - [2368, 576, 1, 512, 2368, 2368, 2368, 576]
    - [0, 20.023]
  - - [2496, 576, 1, 512, 2496, 2496, 2496, 576]
    - [2, 20.052]
  - - [2624, 576, 1, 512, 2624, 2624, 2624, 576]
    - [0, 20.433]
  - - [2752, 576, 1, 512, 2752, 2752, 2752, 576]
    - [0, 20.4]
  - - [2880, 576, 1, 512, 2880, 2880, 2880, 576]
    - [0, 20.667]
  - - [3008, 576, 1, 512, 3008, 3008, 3008, 576]
    - [0, 20.354]
  - - [3136, 576, 1, 512, 3136, 3136, 3136, 576]
    - [2, 19.82]
  - - [3264, 576, 1, 512, 3264, 3264, 3264, 576]
    - [0, 20.268]
  - - [3392, 576, 1, 512, 3392, 3392, 3392, 576]
    - [0, 21.055]
  - - [3520, 576, 1, 512, 3520, 3520, 3520, 576]
    - [0, 20.392]
  - - [3648, 576, 1, 512, 3648, 3648, 3648, 576]
    - [0, 20.443]
  - - [3776, 576, 1, 512, 3776, 3776, 3776, 576]
    - [0, 20.775]
  - - [3904, 576, 1, 512, 3904, 3904, 3904, 576]
    - [2, 20.864]
  - - [4032, 576, 1, 512, 4032, 4032, 4032, 576]
    - [3, 20.252]
  - - [64, 704, 1, 512, 64, 64, 64, 704]
    - [2, 5.224]
  - - [192, 704, 1, 512, 192, 192, 192, 704]
    - [2, 10.295]
  - - [320, 704, 1, 512, 320, 320, 320, 704]
    - [2, 13.049]
  - - [448, 704, 1, 512, 448, 448, 448, 704]
    - [2, 14.236]
  - - [576, 704, 1, 512, 576, 576, 576, 704]
    - [0, 16.222]
  - - [704, 704, 1, 512, 704, 704, 704, 704]
    - [0, 17.179]
  - - [832, 704, 1, 512, 832, 832, 832, 704]
    - [2, 18.514]
  - - [960, 704, 1, 512, 960, 960, 960, 704]
    - [2, 18.795]
  - - [1088, 704, 1, 512, 1088, 1088, 1088, 704]
    - [0, 19.629]
  - - [1216, 704, 1, 512, 1216, 1216, 1216, 704]
    - [0, 19.542]
  - - [1344, 704, 1, 512, 1344, 1344, 1344, 704]
    - [2, 19.817]
  - - [1472, 704, 1, 512, 1472, 1472, 1472, 704]
    - [0, 20.264]
  - - [1600, 704, 1, 512, 1600, 1600, 1600, 704]
    - [0, 20.563]
  - - [1728, 704, 1, 512, 1728, 1728, 1728, 704]
    - [0, 21.078]
  - - [1856, 704, 1, 512, 1856, 1856, 1856, 704]
    - [0, 20.351]
  - - [1984, 704, 1, 512, 1984, 1984, 1984, 704]
    - [0, 20.071]
  - - [2112, 704, 1, 512, 2112, 2112, 2112, 704]
    - [0, 20.604]
  - - [2240, 704, 1, 512, 2240, 2240, 2240, 704]
    - [0, 20.459]
  - - [2368, 704, 1, 512, 2368, 2368, 2368, 704]
    - [2, 20.389]
  - - [2496, 704, 1, 512, 2496, 2496, 2496, 704]
    - [2, 20.285]
  - - [2624, 704, 1, 512, 2624, 2624, 2624, 704]
    - [0, 20.986]
  - - [2752, 704, 1, 512, 2752, 2752, 2752, 704]
    - [0, 20.68]
  - - [2880, 704, 1, 512, 2880, 2880, 2880, 704]
    - [0, 20.87]
  - - [3008, 704, 1, 512, 3008, 3008, 3008, 704]
    - [2, 20.429]
  - - [3136, 704, 1, 512, 3136, 3136, 3136, 704]
    - [3, 20.197]
  - - [3264, 704, 1, 512, 3264, 3264, 3264, 704]
    - [0, 20.654]
  - - [3392, 704, 1, 512, 3392, 3392, 3392, 704]
    - [3, 20.431]
  - - [3520, 704, 1, 512, 3520, 3520, 3520, 704]
    - [0, 20.562]
  - - [3648, 704, 1, 512, 3648, 3648, 3648, 704]
    - [2, 20.632]
  - - [3776, 704, 1, 512, 3776, 3776, 3776, 704]
    - [2, 20.756]
  - - [3904, 704, 1, 512, 3904, 3904, 3904, 704]
    - [2, 20.79]
  - - [4032, 704, 1, 512, 4032, 4032, 4032, 704]
    - [0, 20.553]
  - - [64, 832, 1, 512, 64, 64, 64, 832]
    - [2, 5.334]
  - - [192, 832, 1, 512, 192, 192, 192, 832]
    - [2, 10.873]
  - - [320, 832, 1, 512, 320, 320, 320, 832]
    - [0, 14.051]
  - - [448, 832, 1, 512, 448, 448, 448, 832]
    - [0, 16.049]
  - - [576, 832, 1, 512, 576, 576, 576, 832]
    - [0, 17.402]
  - - [704, 832, 1, 512, 704, 704, 704, 832]
    - [0, 18.536]
  - - [832, 832, 1, 512, 832, 832, 832, 832]
    - [2, 19.075]
  - - [960, 832, 1, 512, 960, 960, 960, 832]
    - [0, 19.731]
  - - [1088, 832, 1, 512, 1088, 1088, 1088, 832]
    - [2, 19.785]
  - - [1216, 832, 1, 512, 1216, 1216, 1216, 832]
    - [2, 19.999]
  - - [1344, 832, 1, 512, 1344, 1344, 1344, 832]
    - [0, 20.149]
  - - [1472, 832, 1, 512, 1472, 1472, 1472, 832]
    - [2, 19.988]
  - - [1600, 832, 1, 512, 1600, 1600, 1600, 832]
    - [0, 20.378]
  - - [1728, 832, 1, 512, 1728, 1728, 1728, 832]
    - [0, 20.256]
  - - [1856, 832, 1, 512, 1856, 1856, 1856, 832]
    - [2, 20.092]
  - - [1984, 832, 1, 512, 1984, 1984, 1984, 832]
    - [0, 20.177]
  - - [2112, 832, 1, 512, 2112, 2112, 2112, 832]
    - [0, 19.909]
  - - [2240, 832, 1, 512, 2240, 2240, 2240, 832]
    - [2, 20.518]
  - - [2368, 832, 1, 512, 2368, 2368, 2368, 832]
    - [0, 20.451]
  - - [2496, 832, 1, 512, 2496, 2496, 2496, 832]
    - [2, 20.718]
  - - [2624, 832, 1, 512, 2624, 2624, 2624, 832]
    - [0, 20.688]
  - - [2752, 832, 1, 512, 2752, 2752, 2752, 832]
    - [2, 21.0]
  - - [2880, 832, 1, 512, 2880, 2880, 2880, 832]
    - [2, 20.922]
  - - [3008, 832, 1, 512, 3008, 3008, 3008, 832]
    - [2, 21.023]
  - - [3136, 832, 1, 512, 3136, 3136, 3136, 832]
    - [0, 20.851]
  - - [3264, 832, 1, 512, 3264, 3264, 3264, 832]
    - [2, 21.316]
  - - [3392, 832, 1, 512, 3392, 3392, 3392, 832]
    - [0, 20.691]
  - - [3520, 832, 1, 512, 3520, 3520, 3520, 832]
    - [0, 20.859]
  - - [3648, 832, 1, 512, 3648, 3648, 3648, 832]
    - [2, 20.683]
  - - [3776, 832, 1, 512, 3776, 3776, 3776, 832]
    - [2, 20.919]
  - - [3904, 832, 1, 512, 3904, 3904, 3904, 832]
    - [0, 21.107]
  - - [4032, 832, 1, 512, 4032, 4032, 4032, 832]
    - [0, 21.211]
  - - [64, 960, 1, 512, 64, 64, 64, 960]
    - [2, 6.241]
  - - [192, 960, 1, 512, 192, 192, 192, 960]
    - [0, 12.628]
  - - [320, 960, 1, 512, 320, 320, 320, 960]
    - [0, 14.849]
  - - [448, 960, 1, 512, 448, 448, 448, 960]
    - [0, 17.153]
  - - [576, 960, 1, 512, 576, 576, 576, 960]
    - [2, 18.34]
  - - [704, 960, 1, 512, 704, 704, 704, 960]
    - [0, 19.549]
  - - [832, 960, 1, 512, 832, 832, 832, 960]
    - [0, 19.649]
  - - [960, 960, 1, 512, 960, 960, 960, 960]
    - [0, 19.963]
  - - [1088, 960, 1, 512, 1088, 1088, 1088, 960]
    - [0, 20.302]
  - - [1216, 960, 1, 512, 1216, 1216, 1216, 960]
    - [0, 19.876]
  - - [1344, 960, 1, 512, 1344, 1344, 1344, 960]
    - [0, 20.29]
  - - [1472, 960, 1, 512, 1472, 1472, 1472, 960]
    - [0, 19.878]
  - - [1600, 960, 1, 512, 1600, 1600, 1600, 960]
    - [0, 20.407]
  - - [1728, 960, 1, 512, 1728, 1728, 1728, 960]
    - [3, 19.848]
  - - [1856, 960, 1, 512, 1856, 1856, 1856, 960]
    - [2, 20.16]
  - - [1984, 960, 1, 512, 1984, 1984, 1984, 960]
    - [0, 20.325]
  - - [2112, 960, 1, 512, 2112, 2112, 2112, 960]
    - [0, 20.453]
  - - [2240, 960, 1, 512, 2240, 2240, 2240, 960]
    - [0, 20.493]
  - - [2368, 960, 1, 512, 2368, 2368, 2368, 960]
    - [2, 20.473]
  - - [2496, 960, 1, 512, 2496, 2496, 2496, 960]
    - [0, 20.147]
  - - [2624, 960, 1, 512, 2624, 2624, 2624, 960]
    - [2, 20.583]
  - - [2752, 960, 1, 512, 2752, 2752, 2752, 960]
    - [2, 20.685]
  - - [2880, 960, 1, 512, 2880, 2880, 2880, 960]
    - [0, 20.836]
  - - [3008, 960, 1, 512, 3008, 3008, 3008, 960]
    - [0, 20.686]
  - - [3136, 960, 1, 512, 3136, 3136, 3136, 960]
    - [2, 20.605]
  - - [3264, 960, 1, 512, 3264, 3264, 3264, 960]
    - [2, 20.739]
  - - [3392, 960, 1, 512, 3392, 3392, 3392, 960]
    - [0, 20.587]
  - - [3520, 960, 1, 512, 3520, 3520, 3520, 960]
    - [0, 20.708]
  - - [3648, 960, 1, 512, 3648, 3648, 3648, 960]
    - [2, 21.043]
  - - [3776, 960, 1, 512, 3776, 3776, 3776, 960]
    - [0, 20.893]
  - - [3904, 960, 1, 512, 3904, 3904, 3904, 960]
    - [2, 20.975]
  - - [4032, 960, 1, 512, 4032, 4032, 4032, 960]
    - [2, 21.107]
  - - [64, 1088, 1, 512, 64, 64, 64, 1088]
    - [2, 4.469]
  - - [192, 1088, 1, 512, 192, 192, 192, 1088]
    - [0, 12.643]
  - - [320, 1088, 1, 512, 320, 320, 320, 1088]
    - [0, 15.297]
  - - [448, 1088, 1, 512, 448, 448, 448, 1088]
    - [0, 17.852]
  - - [576, 1088, 1, 512, 576, 576, 576, 1088]
    - [0, 18.829]
  - - [704, 1088, 1, 512, 704, 704, 704, 1088]
    - [2, 19.571]
  - - [832, 1088, 1, 512, 832, 832, 832, 1088]
    - [2, 19.89]
  - - [960, 1088, 1, 512, 960, 960, 960, 1088]
    - [0, 20.317]
  - - [1088, 1088, 1, 512, 1088, 1088, 1088, 1088]
    - [0, 19.899]
  - - [1216, 1088, 1, 512, 1216, 1216, 1216, 1088]
    - [0, 19.588]
  - - [1344, 1088, 1, 512, 1344, 1344, 1344, 1088]
    - [2, 19.94]
  - - [1472, 1088, 1, 512, 1472, 1472, 1472, 1088]
    - [2, 20.006]
  - - [1600, 1088, 1, 512, 1600, 1600, 1600, 1088]
    - [2, 20.234]
  - - [1728, 1088, 1, 512, 1728, 1728, 1728, 1088]
    - [2, 20.682]
  - - [1856, 1088, 1, 512, 1856, 1856, 1856, 1088]
    - [0, 20.563]
  - - [1984, 1088, 1, 512, 1984, 1984, 1984, 1088]
    - [2, 20.39]
  - - [2112, 1088, 1, 512, 2112, 2112, 2112, 1088]
    - [0, 20.401]
  - - [2240, 1088, 1, 512, 2240, 2240, 2240, 1088]
    - [0, 20.769]
  - - [2368, 1088, 1, 512, 2368, 2368, 2368, 1088]
    - [3, 20.702]
  - - [2496, 1088, 1, 512, 2496, 2496, 2496, 1088]
    - [2, 20.596]
  - - [2624, 1088, 1, 512, 2624, 2624, 2624, 1088]
    - [0, 20.778]
  - - [2752, 1088, 1, 512, 2752, 2752, 2752, 1088]
    - [2, 20.976]
  - - [2880, 1088, 1, 512, 2880, 2880, 2880, 1088]
    - [0, 21.592]
  - - [3008, 1088, 1, 512, 3008, 3008, 3008, 1088]
    - [2, 20.925]
  - - [3136, 1088, 1, 512, 3136, 3136, 3136, 1088]
    - [2, 21.341]
  - - [3264, 1088, 1, 512, 3264, 3264, 3264, 1088]
    - [3, 20.78]
  - - [3392, 1088, 1, 512, 3392, 3392, 3392, 1088]
    - [2, 21.497]
  - - [3520, 1088, 1, 512, 3520, 3520, 3520, 1088]
    - [0, 21.235]
  - - [3648, 1088, 1, 512, 3648, 3648, 3648, 1088]
    - [0, 21.111]
  - - [3776, 1088, 1, 512, 3776, 3776, 3776, 1088]
    - [0, 21.021]
  - - [3904, 1088, 1, 512, 3904, 3904, 3904, 1088]
    - [0, 21.085]
  - - [4032, 1088, 1, 512, 4032, 4032, 4032, 1088]
    - [0, 20.944]
  - - [64, 1216, 1, 512, 64, 64, 64, 1216]
    - [1, 6.742]
  - - [192, 1216, 1, 512, 192, 192, 192, 1216]
    - [0, 14.038]
  - - [320, 1216, 1, 512, 320, 320, 320, 1216]
    - [0, 16.815]
  - - [448, 1216, 1, 512, 448, 448, 448, 1216]
    - [3, 17.865]
  - - [576, 1216, 1, 512, 576, 576, 576, 1216]
    - [0, 19.264]
  - - [704, 1216, 1, 512, 704, 704, 704, 1216]
    - [0, 19.907]
  - - [832, 1216, 1, 512, 832, 832, 832, 1216]
    - [0, 20.245]
  - - [960, 1216, 1, 512, 960, 960, 960, 1216]
    - [0, 20.224]
  - - [1088, 1216, 1, 512, 1088, 1088, 1088, 1216]
    - [0, 20.246]
  - - [1216, 1216, 1, 512, 1216, 1216, 1216, 1216]
    - [0, 20.231]
  - - [1344, 1216, 1, 512, 1344, 1344, 1344, 1216]
    - [0, 20.441]
  - - [1472, 1216, 1, 512, 1472, 1472, 1472, 1216]
    - [2, 20.147]
  - - [1600, 1216, 1, 512, 1600, 1600, 1600, 1216]
    - [0, 20.093]
  - - [1728, 1216, 1, 512, 1728, 1728, 1728, 1216]
    - [0, 20.317]
  - - [1856, 1216, 1, 512, 1856, 1856, 1856, 1216]
    - [2, 20.438]
  - - [1984, 1216, 1, 512, 1984, 1984, 1984, 1216]
    - [0, 20.329]
  - - [2112, 1216, 1, 512, 2112, 2112, 2112, 1216]
    - [2, 21.122]
  - - [2240, 1216, 1, 512, 2240, 2240, 2240, 1216]
    - [2, 20.897]
  - - [2368, 1216, 1, 512, 2368, 2368, 2368, 1216]
    - [0, 20.619]
  - - [2496, 1216, 1, 512, 2496, 2496, 2496, 1216]
    - [0, 20.634]
  - - [2624, 1216, 1, 512, 2624, 2624, 2624, 1216]
    - [2, 20.861]
  - - [2752, 1216, 1, 512, 2752, 2752, 2752, 1216]
    - [2, 20.648]
  - - [2880, 1216, 1, 512, 2880, 2880, 2880, 1216]
    - [2, 20.811]
  - - [3008, 1216, 1, 512, 3008, 3008, 3008, 1216]
    - [2, 20.979]
  - - [3136, 1216, 1, 512, 3136, 3136, 3136, 1216]
    - [0, 21.011]
  - - [3264, 1216, 1, 512, 3264, 3264, 3264, 1216]
    - [2, 21.044]
  - - [3392, 1216, 1, 512, 3392, 3392, 3392, 1216]
    - [2, 20.935]
  - - [3520, 1216, 1, 512, 3520, 3520, 3520, 1216]
    - [0, 21.139]
  - - [3648, 1216, 1, 512, 3648, 3648, 3648, 1216]
    - [2, 20.909]
  - - [3776, 1216, 1, 512, 3776, 3776, 3776, 1216]
    - [2, 20.961]
  - - [3904, 1216, 1, 512, 3904, 3904, 3904, 1216]
    - [2, 21.203]
  - - [4032, 1216, 1, 512, 4032, 4032, 4032, 1216]
    - [0, 20.928]
  - - [64, 1344, 1, 512, 64, 64, 64, 1344]
    - [3, 5.471]
  - - [192, 1344, 1, 512, 192, 192, 192, 1344]
    - [0, 13.639]
  - - [320, 1344, 1, 512, 320, 320, 320, 1344]
    - [0, 16.913]
  - - [448, 1344, 1, 512, 448, 448, 448, 1344]
    - [3, 17.93]
  - - [576, 1344, 1, 512, 576, 576, 576, 1344]
    - [0, 19.805]
  - - [704, 1344, 1, 512, 704, 704, 704, 1344]
    - [2, 19.905]
  - - [832, 1344, 1, 512, 832, 832, 832, 1344]
    - [0, 20.084]
  - - [960, 1344, 1, 512, 960, 960, 960, 1344]
    - [0, 20.107]
  - - [1088, 1344, 1, 512, 1088, 1088, 1088, 1344]
    - [0, 20.395]
  - - [1216, 1344, 1, 512, 1216, 1216, 1216, 1344]
    - [0, 20.038]
  - - [1344, 1344, 1, 512, 1344, 1344, 1344, 1344]
    - [0, 20.545]
  - - [1472, 1344, 1, 512, 1472, 1472, 1472, 1344]
    - [0, 20.693]
  - - [1600, 1344, 1, 512, 1600, 1600, 1600, 1344]
    - [2, 20.915]
  - - [1728, 1344, 1, 512, 1728, 1728, 1728, 1344]
    - [2, 21.196]
  - - [1856, 1344, 1, 512, 1856, 1856, 1856, 1344]
    - [2, 20.805]
  - - [1984, 1344, 1, 512, 1984, 1984, 1984, 1344]
    - [0, 20.964]
  - - [2112, 1344, 1, 512, 2112, 2112, 2112, 1344]
    - [2, 20.909]
  - - [2240, 1344, 1, 512, 2240, 2240, 2240, 1344]
    - [2, 20.73]
  - - [2368, 1344, 1, 512, 2368, 2368, 2368, 1344]
    - [2, 21.149]
  - - [2496, 1344, 1, 512, 2496, 2496, 2496, 1344]
    - [2, 20.988]
  - - [2624, 1344, 1, 512, 2624, 2624, 2624, 1344]
    - [0, 21.156]
  - - [2752, 1344, 1, 512, 2752, 2752, 2752, 1344]
    - [2, 20.97]
  - - [2880, 1344, 1, 512, 2880, 2880, 2880, 1344]
    - [3, 20.811]
  - - [3008, 1344, 1, 512, 3008, 3008, 3008, 1344]
    - [0, 21.102]
  - - [3136, 1344, 1, 512, 3136, 3136, 3136, 1344]
    - [0, 20.925]
  - - [3264, 1344, 1, 512, 3264, 3264, 3264, 1344]
    - [0, 21.249]
  - - [3392, 1344, 1, 512, 3392, 3392, 3392, 1344]
    - [2, 21.159]
  - - [3520, 1344, 1, 512, 3520, 3520, 3520, 1344]
    - [2, 20.961]
  - - [3648, 1344, 1, 512, 3648, 3648, 3648, 1344]
    - [2, 21.129]
  - - [3776, 1344, 1, 512, 3776, 3776, 3776, 1344]
    - [2, 21.055]
  - - [3904, 1344, 1, 512, 3904, 3904, 3904, 1344]
    - [0, 21.06]
  - - [4032, 1344, 1, 512, 4032, 4032, 4032, 1344]
    - [2, 21.175]
  - - [64, 1472, 1, 512, 64, 64, 64, 1472]
    - [0, 9.036]
  - - [192, 1472, 1, 512, 192, 192, 192, 1472]
    - [0, 15.042]
  - - [320, 1472, 1, 512, 320, 320, 320, 1472]
    - [0, 17.403]
  - - [448, 1472, 1, 512, 448, 448, 448, 1472]
    - [2, 19.056]
  - - [576, 1472, 1, 512, 576, 576, 576, 1472]
    - [0, 19.951]
  - - [704, 1472, 1, 512, 704, 704, 704, 1472]
    - [2, 20.128]
  - - [832, 1472, 1, 512, 832, 832, 832, 1472]
    - [0, 20.113]
  - - [960, 1472, 1, 512, 960, 960, 960, 1472]
    - [0, 20.542]
  - - [1088, 1472, 1, 512, 1088, 1088, 1088, 1472]
    - [0, 20.344]
  - - [1216, 1472, 1, 512, 1216, 1216, 1216, 1472]
    - [0, 20.609]
  - - [1344, 1472, 1, 512, 1344, 1344, 1344, 1472]
    - [0, 20.751]
  - - [1472, 1472, 1, 512, 1472, 1472, 1472, 1472]
    - [0, 20.688]
  - - [1600, 1472, 1, 512, 1600, 1600, 1600, 1472]
    - [2, 20.861]
  - - [1728, 1472, 1, 512, 1728, 1728, 1728, 1472]
    - [0, 20.791]
  - - [1856, 1472, 1, 512, 1856, 1856, 1856, 1472]
    - [2, 21.071]
  - - [1984, 1472, 1, 512, 1984, 1984, 1984, 1472]
    - [3, 20.99]
  - - [2112, 1472, 1, 512, 2112, 2112, 2112, 1472]
    - [2, 21.114]
  - - [2240, 1472, 1, 512, 2240, 2240, 2240, 1472]
    - [2, 20.904]
  - - [2368, 1472, 1, 512, 2368, 2368, 2368, 1472]
    - [2, 21.084]
  - - [2496, 1472, 1, 512, 2496, 2496, 2496, 1472]
    - [2, 21.025]
  - - [2624, 1472, 1, 512, 2624, 2624, 2624, 1472]
    - [2, 20.828]
  - - [2752, 1472, 1, 512, 2752, 2752, 2752, 1472]
    - [2, 21.011]
  - - [2880, 1472, 1, 512, 2880, 2880, 2880, 1472]
    - [2, 20.905]
  - - [3008, 1472, 1, 512, 3008, 3008, 3008, 1472]
    - [2, 21.19]
  - - [3136, 1472, 1, 512, 3136, 3136, 3136, 1472]
    - [2, 20.976]
  - - [3264, 1472, 1, 512, 3264, 3264, 3264, 1472]
    - [0, 20.869]
  - - [3392, 1472, 1, 512, 3392, 3392, 3392, 1472]
    - [2, 20.954]
  - - [3520, 1472, 1, 512, 3520, 3520, 3520, 1472]
    - [2, 20.919]
  - - [3648, 1472, 1, 512, 3648, 3648, 3648, 1472]
    - [2, 21.03]
  - - [3776, 1472, 1, 512, 3776, 3776, 3776, 1472]
    - [0, 21.243]
  - - [3904, 1472, 1, 512, 3904, 3904, 3904, 1472]
    - [0, 21.028]
  - - [4032, 1472, 1, 512, 4032, 4032, 4032, 1472]
    - [2, 21.128]
  - - [64, 1600, 1, 512, 64, 64, 64, 1600]
    - [2, 8.426]
  - - [192, 1600, 1, 512, 192, 192, 192, 1600]
    - [0, 14.889]
  - - [320, 1600, 1, 512, 320, 320, 320, 1600]
    - [0, 17.562]
  - - [448, 1600, 1, 512, 448, 448, 448, 1600]
    - [2, 19.121]
  - - [576, 1600, 1, 512, 576, 576, 576, 1600]
    - [0, 20.121]
  - - [704, 1600, 1, 512, 704, 704, 704, 1600]
    - [0, 20.373]
  - - [832, 1600, 1, 512, 832, 832, 832, 1600]
    - [0, 20.306]
  - - [960, 1600, 1, 512, 960, 960, 960, 1600]
    - [0, 20.73]
  - - [1088, 1600, 1, 512, 1088, 1088, 1088, 1600]
    - [0, 20.394]
  - - [1216, 1600, 1, 512, 1216, 1216, 1216, 1600]
    - [2, 20.568]
  - - [1344, 1600, 1, 512, 1344, 1344, 1344, 1600]
    - [3, 20.354]
  - - [1472, 1600, 1, 512, 1472, 1472, 1472, 1600]
    - [2, 20.812]
  - - [1600, 1600, 1, 512, 1600, 1600, 1600, 1600]
    - [2, 20.971]
  - - [1728, 1600, 1, 512, 1728, 1728, 1728, 1600]
    - [0, 21.066]
  - - [1856, 1600, 1, 512, 1856, 1856, 1856, 1600]
    - [0, 20.959]
  - - [1984, 1600, 1, 512, 1984, 1984, 1984, 1600]
    - [0, 20.707]
  - - [2112, 1600, 1, 512, 2112, 2112, 2112, 1600]
    - [0, 20.894]
  - - [2240, 1600, 1, 512, 2240, 2240, 2240, 1600]
    - [2, 20.885]
  - - [2368, 1600, 1, 512, 2368, 2368, 2368, 1600]
    - [2, 21.355]
  - - [2496, 1600, 1, 512, 2496, 2496, 2496, 1600]
    - [2, 21.225]
  - - [2624, 1600, 1, 512, 2624, 2624, 2624, 1600]
    - [0, 21.197]
  - - [2752, 1600, 1, 512, 2752, 2752, 2752, 1600]
    - [2, 20.983]
  - - [2880, 1600, 1, 512, 2880, 2880, 2880, 1600]
    - [2, 21.018]
  - - [3008, 1600, 1, 512, 3008, 3008, 3008, 1600]
    - [0, 21.119]
  - - [3136, 1600, 1, 512, 3136, 3136, 3136, 1600]
    - [0, 21.171]
  - - [3264, 1600, 1, 512, 3264, 3264, 3264, 1600]
    - [0, 21.126]
  - - [3392, 1600, 1, 512, 3392, 3392, 3392, 1600]
    - [2, 21.227]
  - - [3520, 1600, 1, 512, 3520, 3520, 3520, 1600]
    - [2, 20.94]
  - - [3648, 1600, 1, 512, 3648, 3648, 3648, 1600]
    - [0, 21.07]
  - - [3776, 1600, 1, 512, 3776, 3776, 3776, 1600]
    - [2, 21.181]
  - - [3904, 1600, 1, 512, 3904, 3904, 3904, 1600]
    - [2, 21.103]
  - - [4032, 1600, 1, 512, 4032, 4032, 4032, 1600]
    - [2, 21.148]
  - - [64, 1728, 1, 512, 64, 64, 64, 1728]
    - [0, 8.927]
  - - [192, 1728, 1, 512, 192, 192, 192, 1728]
    - [0, 15.828]
  - - [320, 1728, 1, 512, 320, 320, 320, 1728]
    - [2, 17.95]
  - - [448, 1728, 1, 512, 448, 448, 448, 1728]
    - [0, 19.338]
  - - [576, 1728, 1, 512, 576, 576, 576, 1728]
    - [2, 19.912]
  - - [704, 1728, 1, 512, 704, 704, 704, 1728]
    - [0, 20.551]
  - - [832, 1728, 1, 512, 832, 832, 832, 1728]
    - [0, 20.276]
  - - [960, 1728, 1, 512, 960, 960, 960, 1728]
    - [0, 20.519]
  - - [1088, 1728, 1, 512, 1088, 1088, 1088, 1728]
    - [0, 20.487]
  - - [1216, 1728, 1, 512, 1216, 1216, 1216, 1728]
    - [2, 20.632]
  - - [1344, 1728, 1, 512, 1344, 1344, 1344, 1728]
    - [0, 20.771]
  - - [1472, 1728, 1, 512, 1472, 1472, 1472, 1728]
    - [0, 20.492]
  - - [1600, 1728, 1, 512, 1600, 1600, 1600, 1728]
    - [2, 20.73]
  - - [1728, 1728, 1, 512, 1728, 1728, 1728, 1728]
    - [0, 20.902]
  - - [1856, 1728, 1, 512, 1856, 1856, 1856, 1728]
    - [0, 20.851]
  - - [1984, 1728, 1, 512, 1984, 1984, 1984, 1728]
    - [0, 20.891]
  - - [2112, 1728, 1, 512, 2112, 2112, 2112, 1728]
    - [0, 20.802]
  - - [2240, 1728, 1, 512, 2240, 2240, 2240, 1728]
    - [2, 21.263]
  - - [2368, 1728, 1, 512, 2368, 2368, 2368, 1728]
    - [0, 21.057]
  - - [2496, 1728, 1, 512, 2496, 2496, 2496, 1728]
    - [0, 20.965]
  - - [2624, 1728, 1, 512, 2624, 2624, 2624, 1728]
    - [2, 21.03]
  - - [2752, 1728, 1, 512, 2752, 2752, 2752, 1728]
    - [2, 20.962]
  - - [2880, 1728, 1, 512, 2880, 2880, 2880, 1728]
    - [0, 21.23]
  - - [3008, 1728, 1, 512, 3008, 3008, 3008, 1728]
    - [0, 20.978]
  - - [3136, 1728, 1, 512, 3136, 3136, 3136, 1728]
    - [0, 21.168]
  - - [3264, 1728, 1, 512, 3264, 3264, 3264, 1728]
    - [2, 21.288]
  - - [3392, 1728, 1, 512, 3392, 3392, 3392, 1728]
    - [0, 21.157]
  - - [3520, 1728, 1, 512, 3520, 3520, 3520, 1728]
    - [0, 21.297]
  - - [3648, 1728, 1, 512, 3648, 3648, 3648, 1728]
    - [0, 21.186]
  - - [3776, 1728, 1, 512, 3776, 3776, 3776, 1728]
    - [0, 21.198]
  - - [3904, 1728, 1, 512, 3904, 3904, 3904, 1728]
    - [2, 21.341]
  - - [4032, 1728, 1, 512, 4032, 4032, 4032, 1728]
    - [0, 21.176]
  - - [64, 1856, 1, 512, 64, 64, 64, 1856]
    - [2, 9.706]
  - - [192, 1856, 1, 512, 192, 192, 192, 1856]
    - [0, 15.669]
  - - [320, 1856, 1, 512, 320, 320, 320, 1856]
    - [2, 18.241]
  - - [448, 1856, 1, 512, 448, 448, 448, 1856]
    - [0, 20.051]
  - - [576, 1856, 1, 512, 576, 576, 576, 1856]
    - [0, 20.573]
  - - [704, 1856, 1, 512, 704, 704, 704, 1856]
    - [0, 20.155]
  - - [832, 1856, 1, 512, 832, 832, 832, 1856]
    - [0, 20.749]
  - - [960, 1856, 1, 512, 960, 960, 960, 1856]
    - [0, 20.665]
  - - [1088, 1856, 1, 512, 1088, 1088, 1088, 1856]
    - [0, 20.567]
  - - [1216, 1856, 1, 512, 1216, 1216, 1216, 1856]
    - [2, 20.431]
  - - [1344, 1856, 1, 512, 1344, 1344, 1344, 1856]
    - [0, 20.591]
  - - [1472, 1856, 1, 512, 1472, 1472, 1472, 1856]
    - [0, 20.895]
  - - [1600, 1856, 1, 512, 1600, 1600, 1600, 1856]
    - [2, 21.05]
  - - [1728, 1856, 1, 512, 1728, 1728, 1728, 1856]
    - [2, 20.973]
  - - [1856, 1856, 1, 512, 1856, 1856, 1856, 1856]
    - [0, 21.008]
  - - [1984, 1856, 1, 512, 1984, 1984, 1984, 1856]
    - [0, 21.239]
  - - [2112, 1856, 1, 512, 2112, 2112, 2112, 1856]
    - [0, 21.181]
  - - [2240, 1856, 1, 512, 2240, 2240, 2240, 1856]
    - [0, 21.208]
  - - [2368, 1856, 1, 512, 2368, 2368, 2368, 1856]
    - [2, 21.133]
  - - [2496, 1856, 1, 512, 2496, 2496, 2496, 1856]
    - [0, 21.17]
  - - [2624, 1856, 1, 512, 2624, 2624, 2624, 1856]
    - [0, 21.12]
  - - [2752, 1856, 1, 512, 2752, 2752, 2752, 1856]
    - [0, 21.129]
  - - [2880, 1856, 1, 512, 2880, 2880, 2880, 1856]
    - [0, 21.17]
  - - [3008, 1856, 1, 512, 3008, 3008, 3008, 1856]
    - [0, 21.318]
  - - [3136, 1856, 1, 512, 3136, 3136, 3136, 1856]
    - [2, 21.24]
  - - [3264, 1856, 1, 512, 3264, 3264, 3264, 1856]
    - [2, 21.3]
  - - [3392, 1856, 1, 512, 3392, 3392, 3392, 1856]
    - [0, 21.191]
  - - [3520, 1856, 1, 512, 3520, 3520, 3520, 1856]
    - [0, 21.054]
  - - [3648, 1856, 1, 512, 3648, 3648, 3648, 1856]
    - [2, 21.241]
  - - [3776, 1856, 1, 512, 3776, 3776, 3776, 1856]
    - [0, 20.844]
  - - [3904, 1856, 1, 512, 3904, 3904, 3904, 1856]
    - [2, 21.322]
  - - [4032, 1856, 1, 512, 4032, 4032, 4032, 1856]
    - [0, 21.166]
  - - [64, 1984, 1, 512, 64, 64, 64, 1984]
    - [0, 10.224]
  - - [192, 1984, 1, 512, 192, 192, 192, 1984]
    - [0, 16.533]
  - - [320, 1984, 1, 512, 320, 320, 320, 1984]
    - [0, 18.788]
  - - [448, 1984, 1, 512, 448, 448, 448, 1984]
    - [0, 20.089]
  - - [576, 1984, 1, 512, 576, 576, 576, 1984]
    - [0, 20.879]
  - - [704, 1984, 1, 512, 704, 704, 704, 1984]
    - [0, 20.358]
  - - [832, 1984, 1, 512, 832, 832, 832, 1984]
    - [0, 20.533]
  - - [960, 1984, 1, 512, 960, 960, 960, 1984]
    - [0, 20.116]
  - - [1088, 1984, 1, 512, 1088, 1088, 1088, 1984]
    - [2, 20.658]
  - - [1216, 1984, 1, 512, 1216, 1216, 1216, 1984]
    - [0, 20.767]
  - - [1344, 1984, 1, 512, 1344, 1344, 1344, 1984]
    - [0, 21.009]
  - - [1472, 1984, 1, 512, 1472, 1472, 1472, 1984]
    - [0, 20.952]
  - - [1600, 1984, 1, 512, 1600, 1600, 1600, 1984]
    - [0, 21.231]
  - - [1728, 1984, 1, 512, 1728, 1728, 1728, 1984]
    - [0, 21.321]
  - - [1856, 1984, 1, 512, 1856, 1856, 1856, 1984]
    - [2, 20.931]
  - - [1984, 1984, 1, 512, 1984, 1984, 1984, 1984]
    - [0, 21.108]
  - - [2112, 1984, 1, 512, 2112, 2112, 2112, 1984]
    - [2, 20.811]
  - - [2240, 1984, 1, 512, 2240, 2240, 2240, 1984]
    - [2, 20.971]
  - - [2368, 1984, 1, 512, 2368, 2368, 2368, 1984]
    - [0, 21.051]
  - - [2496, 1984, 1, 512, 2496, 2496, 2496, 1984]
    - [2, 20.983]
  - - [2624, 1984, 1, 512, 2624, 2624, 2624, 1984]
    - [0, 21.156]
  - - [2752, 1984, 1, 512, 2752, 2752, 2752, 1984]
    - [0, 21.187]
  - - [2880, 1984, 1, 512, 2880, 2880, 2880, 1984]
    - [2, 21.114]
  - - [3008, 1984, 1, 512, 3008, 3008, 3008, 1984]
    - [2, 21.372]
  - - [3136, 1984, 1, 512, 3136, 3136, 3136, 1984]
    - [2, 21.446]
  - - [3264, 1984, 1, 512, 3264, 3264, 3264, 1984]
    - [0, 21.213]
  - - [3392, 1984, 1, 512, 3392, 3392, 3392, 1984]
    - [2, 21.28]
  - - [3520, 1984, 1, 512, 3520, 3520, 3520, 1984]
    - [2, 21.299]
  - - [3648, 1984, 1, 512, 3648, 3648, 3648, 1984]
    - [2, 21.304]
  - - [3776, 1984, 1, 512, 3776, 3776, 3776, 1984]
    - [2, 21.137]
  - - [3904, 1984, 1, 512, 3904, 3904, 3904, 1984]
    - [2, 21.085]
  - - [4032, 1984, 1, 512, 4032, 4032, 4032, 1984]
    - [0, 21.039]
  - - [64, 2112, 1, 512, 64, 64, 64, 2112]
    - [2, 10.552]
  - - [192, 2112, 1, 512, 192, 192, 192, 2112]
    - [2, 16.342]
  - - [320, 2112, 1, 512, 320, 320, 320, 2112]
    - [2, 19.24]
  - - [448, 2112, 1, 512, 448, 448, 448, 2112]
    - [0, 19.594]
  - - [576, 2112, 1, 512, 576, 576, 576, 2112]
    - [0, 20.672]
  - - [704, 2112, 1, 512, 704, 704, 704, 2112]
    - [0, 20.097]
  - - [832, 2112, 1, 512, 832, 832, 832, 2112]
    - [2, 20.161]
  - - [960, 2112, 1, 512, 960, 960, 960, 2112]
    - [2, 20.747]
  - - [1088, 2112, 1, 512, 1088, 1088, 1088, 2112]
    - [0, 20.793]
  - - [1216, 2112, 1, 512, 1216, 1216, 1216, 2112]
    - [0, 21.108]
  - - [1344, 2112, 1, 512, 1344, 1344, 1344, 2112]
    - [2, 20.735]
  - - [1472, 2112, 1, 512, 1472, 1472, 1472, 2112]
    - [2, 20.916]
  - - [1600, 2112, 1, 512, 1600, 1600, 1600, 2112]
    - [2, 20.962]
  - - [1728, 2112, 1, 512, 1728, 1728, 1728, 2112]
    - [2, 20.848]
  - - [1856, 2112, 1, 512, 1856, 1856, 1856, 2112]
    - [2, 21.046]
  - - [1984, 2112, 1, 512, 1984, 1984, 1984, 2112]
    - [0, 21.165]
  - - [2112, 2112, 1, 512, 2112, 2112, 2112, 2112]
    - [0, 21.017]
  - - [2240, 2112, 1, 512, 2240, 2240, 2240, 2112]
    - [0, 21.189]
  - - [2368, 2112, 1, 512, 2368, 2368, 2368, 2112]
    - [2, 21.181]
  - - [2496, 2112, 1, 512, 2496, 2496, 2496, 2112]
    - [2, 21.279]
  - - [2624, 2112, 1, 512, 2624, 2624, 2624, 2112]
    - [0, 21.06]
  - - [2752, 2112, 1, 512, 2752, 2752, 2752, 2112]
    - [2, 21.209]
  - - [2880, 2112, 1, 512, 2880, 2880, 2880, 2112]
    - [0, 21.249]
  - - [3008, 2112, 1, 512, 3008, 3008, 3008, 2112]
    - [2, 21.159]
  - - [3136, 2112, 1, 512, 3136, 3136, 3136, 2112]
    - [2, 21.235]
  - - [3264, 2112, 1, 512, 3264, 3264, 3264, 2112]
    - [0, 21.069]
  - - [3392, 2112, 1, 512, 3392, 3392, 3392, 2112]
    - [2, 21.222]
  - - [3520, 2112, 1, 512, 3520, 3520, 3520, 2112]
    - [2, 21.237]
  - - [3648, 2112, 1, 512, 3648, 3648, 3648, 2112]
    - [2, 21.333]
  - - [3776, 2112, 1, 512, 3776, 3776, 3776, 2112]
    - [2, 21.121]
  - - [3904, 2112, 1, 512, 3904, 3904, 3904, 2112]
    - [2, 21.288]
  - - [4032, 2112, 1, 512, 4032, 4032, 4032, 2112]
    - [2, 21.302]
  - - [64, 2240, 1, 512, 64, 64, 64, 2240]
    - [0, 11.433]
  - - [192, 2240, 1, 512, 192, 192, 192, 2240]
    - [0, 17.002]
  - - [320, 2240, 1, 512, 320, 320, 320, 2240]
    - [3, 19.031]
  - - [448, 2240, 1, 512, 448, 448, 448, 2240]
    - [0, 19.903]
  - - [576, 2240, 1, 512, 576, 576, 576, 2240]
    - [0, 19.581]
  - - [704, 2240, 1, 512, 704, 704, 704, 2240]
    - [0, 20.347]
  - - [832, 2240, 1, 512, 832, 832, 832, 2240]
    - [0, 20.435]
  - - [960, 2240, 1, 512, 960, 960, 960, 2240]
    - [2, 19.938]
  - - [1088, 2240, 1, 512, 1088, 1088, 1088, 2240]
    - [0, 20.759]
  - - [1216, 2240, 1, 512, 1216, 1216, 1216, 2240]
    - [0, 20.583]
  - - [1344, 2240, 1, 512, 1344, 1344, 1344, 2240]
    - [2, 20.769]
  - - [1472, 2240, 1, 512, 1472, 1472, 1472, 2240]
    - [0, 20.934]
  - - [1600, 2240, 1, 512, 1600, 1600, 1600, 2240]
    - [0, 20.99]
  - - [1728, 2240, 1, 512, 1728, 1728, 1728, 2240]
    - [0, 20.891]
  - - [1856, 2240, 1, 512, 1856, 1856, 1856, 2240]
    - [2, 21.152]
  - - [1984, 2240, 1, 512, 1984, 1984, 1984, 2240]
    - [2, 21.006]
  - - [2112, 2240, 1, 512, 2112, 2112, 2112, 2240]
    - [2, 20.978]
  - - [2240, 2240, 1, 512, 2240, 2240, 2240, 2240]
    - [2, 21.155]
  - - [2368, 2240, 1, 512, 2368, 2368, 2368, 2240]
    - [2, 21.112]
  - - [2496, 2240, 1, 512, 2496, 2496, 2496, 2240]
    - [2, 21.231]
  - - [2624, 2240, 1, 512, 2624, 2624, 2624, 2240]
    - [2, 21.153]
  - - [2752, 2240, 1, 512, 2752, 2752, 2752, 2240]
    - [0, 21.154]
  - - [2880, 2240, 1, 512, 2880, 2880, 2880, 2240]
    - [2, 21.351]
  - - [3008, 2240, 1, 512, 3008, 3008, 3008, 2240]
    - [2, 21.15]
  - - [3136, 2240, 1, 512, 3136, 3136, 3136, 2240]
    - [2, 21.027]
  - - [3264, 2240, 1, 512, 3264, 3264, 3264, 2240]
    - [2, 21.066]
  - - [3392, 2240, 1, 512, 3392, 3392, 3392, 2240]
    - [2, 21.186]
  - - [3520, 2240, 1, 512, 3520, 3520, 3520, 2240]
    - [2, 21.371]
  - - [3648, 2240, 1, 512, 3648, 3648, 3648, 2240]
    - [2, 21.128]
  - - [3776, 2240, 1, 512, 3776, 3776, 3776, 2240]
    - [2, 21.248]
  - - [3904, 2240, 1, 512, 3904, 3904, 3904, 2240]
    - [2, 21.005]
  - - [4032, 2240, 1, 512, 4032, 4032, 4032, 2240]
    - [2, 21.181]
  - - [64, 2368, 1, 512, 64, 64, 64, 2368]
    - [2, 10.597]
  - - [192, 2368, 1, 512, 192, 192, 192, 2368]
    - [2, 16.939]
  - - [320, 2368, 1, 512, 320, 320, 320, 2368]
    - [0, 19.203]
  - - [448, 2368, 1, 512, 448, 448, 448, 2368]
    - [2, 20.39]
  - - [576, 2368, 1, 512, 576, 576, 576, 2368]
    - [0, 19.94]
  - - [704, 2368, 1, 512, 704, 704, 704, 2368]
    - [0, 19.555]
  - - [832, 2368, 1, 512, 832, 832, 832, 2368]
    - [0, 20.461]
  - - [960, 2368, 1, 512, 960, 960, 960, 2368]
    - [2, 20.885]
  - - [1088, 2368, 1, 512, 1088, 1088, 1088, 2368]
    - [0, 20.819]
  - - [1216, 2368, 1, 512, 1216, 1216, 1216, 2368]
    - [2, 20.778]
  - - [1344, 2368, 1, 512, 1344, 1344, 1344, 2368]
    - [0, 20.79]
  - - [1472, 2368, 1, 512, 1472, 1472, 1472, 2368]
    - [0, 20.926]
  - - [1600, 2368, 1, 512, 1600, 1600, 1600, 2368]
    - [0, 20.88]
  - - [1728, 2368, 1, 512, 1728, 1728, 1728, 2368]
    - [0, 21.162]
  - - [1856, 2368, 1, 512, 1856, 1856, 1856, 2368]
    - [2, 21.203]
  - - [1984, 2368, 1, 512, 1984, 1984, 1984, 2368]
    - [2, 21.157]
  - - [2112, 2368, 1, 512, 2112, 2112, 2112, 2368]
    - [2, 21.057]
  - - [2240, 2368, 1, 512, 2240, 2240, 2240, 2368]
    - [2, 21.052]
  - - [2368, 2368, 1, 512, 2368, 2368, 2368, 2368]
    - [2, 21.205]
  - - [2496, 2368, 1, 512, 2496, 2496, 2496, 2368]
    - [2, 21.185]
  - - [2624, 2368, 1, 512, 2624, 2624, 2624, 2368]
    - [2, 21.088]
  - - [2752, 2368, 1, 512, 2752, 2752, 2752, 2368]
    - [2, 21.27]
  - - [2880, 2368, 1, 512, 2880, 2880, 2880, 2368]
    - [2, 21.137]
  - - [3008, 2368, 1, 512, 3008, 3008, 3008, 2368]
    - [2, 21.128]
  - - [3136, 2368, 1, 512, 3136, 3136, 3136, 2368]
    - [2, 21.172]
  - - [3264, 2368, 1, 512, 3264, 3264, 3264, 2368]
    - [2, 21.184]
  - - [3392, 2368, 1, 512, 3392, 3392, 3392, 2368]
    - [2, 21.302]
  - - [3520, 2368, 1, 512, 3520, 3520, 3520, 2368]
    - [2, 21.391]
  - - [3648, 2368, 1, 512, 3648, 3648, 3648, 2368]
    - [2, 21.266]
  - - [3776, 2368, 1, 512, 3776, 3776, 3776, 2368]
    - [2, 21.14]
  - - [3904, 2368, 1, 512, 3904, 3904, 3904, 2368]
    - [3, 21.33]
  - - [4032, 2368, 1, 512, 4032, 4032, 4032, 2368]
    - [2, 21.349]
  - - [64, 2496, 1, 512, 64, 64, 64, 2496]
    - [2, 11.081]
  - - [192, 2496, 1, 512, 192, 192, 192, 2496]
    - [0, 17.511]
  - - [320, 2496, 1, 512, 320, 320, 320, 2496]
    - [2, 19.668]
  - - [448, 2496, 1, 512, 448, 448, 448, 2496]
    - [0, 20.506]
  - - [576, 2496, 1, 512, 576, 576, 576, 2496]
    - [0, 20.607]
  - - [704, 2496, 1, 512, 704, 704, 704, 2496]
    - [0, 20.533]
  - - [832, 2496, 1, 512, 832, 832, 832, 2496]
    - [2, 20.791]
  - - [960, 2496, 1, 512, 960, 960, 960, 2496]
    - [2, 20.517]
  - - [1088, 2496, 1, 512, 1088, 1088, 1088, 2496]
    - [0, 21.024]
  - - [1216, 2496, 1, 512, 1216, 1216, 1216, 2496]
    - [2, 20.82]
  - - [1344, 2496, 1, 512, 1344, 1344, 1344, 2496]
    - [0, 20.955]
  - - [1472, 2496, 1, 512, 1472, 1472, 1472, 2496]
    - [0, 21.513]
  - - [1600, 2496, 1, 512, 1600, 1600, 1600, 2496]
    - [0, 20.84]
  - - [1728, 2496, 1, 512, 1728, 1728, 1728, 2496]
    - [0, 20.999]
  - - [1856, 2496, 1, 512, 1856, 1856, 1856, 2496]
    - [0, 20.877]
  - - [1984, 2496, 1, 512, 1984, 1984, 1984, 2496]
    - [2, 21.24]
  - - [2112, 2496, 1, 512, 2112, 2112, 2112, 2496]
    - [2, 20.988]
  - - [2240, 2496, 1, 512, 2240, 2240, 2240, 2496]
    - [2, 20.952]
  - - [2368, 2496, 1, 512, 2368, 2368, 2368, 2496]
    - [2, 21.132]
  - - [2496, 2496, 1, 512, 2496, 2496, 2496, 2496]
    - [2, 20.938]
  - - [2624, 2496, 1, 512, 2624, 2624, 2624, 2496]
    - [2, 21.198]
  - - [2752, 2496, 1, 512, 2752, 2752, 2752, 2496]
    - [2, 21.124]
  - - [2880, 2496, 1, 512, 2880, 2880, 2880, 2496]
    - [2, 21.203]
  - - [3008, 2496, 1, 512, 3008, 3008, 3008, 2496]
    - [2, 21.234]
  - - [3136, 2496, 1, 512, 3136, 3136, 3136, 2496]
    - [2, 21.129]
  - - [3264, 2496, 1, 512, 3264, 3264, 3264, 2496]
    - [2, 21.415]
  - - [3392, 2496, 1, 512, 3392, 3392, 3392, 2496]
    - [2, 21.28]
  - - [3520, 2496, 1, 512, 3520, 3520, 3520, 2496]
    - [2, 21.806]
  - - [3648, 2496, 1, 512, 3648, 3648, 3648, 2496]
    - [2, 21.124]
  - - [3776, 2496, 1, 512, 3776, 3776, 3776, 2496]
    - [2, 21.217]
  - - [3904, 2496, 1, 512, 3904, 3904, 3904, 2496]
    - [2, 21.094]
  - - [4032, 2496, 1, 512, 4032, 4032, 4032, 2496]
    - [2, 21.344]
  - - [64, 2624, 1, 512, 64, 64, 64, 2624]
    - [2, 11.65]
  - - [192, 2624, 1, 512, 192, 192, 192, 2624]
    - [3, 17.605]
  - - [320, 2624, 1, 512, 320, 320, 320, 2624]
    - [0, 19.34]
  - - [448, 2624, 1, 512, 448, 448, 448, 2624]
    - [0, 20.303]
  - - [576, 2624, 1, 512, 576, 576, 576, 2624]
    - [0, 19.615]
  - - [704, 2624, 1, 512, 704, 704, 704, 2624]
    - [3, 20.092]
  - - [832, 2624, 1, 512, 832, 832, 832, 2624]
    - [3, 20.882]
  - - [960, 2624, 1, 512, 960, 960, 960, 2624]
    - [2, 20.501]
  - - [1088, 2624, 1, 512, 1088, 1088, 1088, 2624]
    - [0, 21.012]
  - - [1216, 2624, 1, 512, 1216, 1216, 1216, 2624]
    - [2, 20.958]
  - - [1344, 2624, 1, 512, 1344, 1344, 1344, 2624]
    - [0, 21.139]
  - - [1472, 2624, 1, 512, 1472, 1472, 1472, 2624]
    - [2, 20.733]
  - - [1600, 2624, 1, 512, 1600, 1600, 1600, 2624]
    - [2, 21.032]
  - - [1728, 2624, 1, 512, 1728, 1728, 1728, 2624]
    - [2, 21.161]
  - - [1856, 2624, 1, 512, 1856, 1856, 1856, 2624]
    - [2, 20.961]
  - - [1984, 2624, 1, 512, 1984, 1984, 1984, 2624]
    - [0, 21.091]
  - - [2112, 2624, 1, 512, 2112, 2112, 2112, 2624]
    - [2, 21.062]
  - - [2240, 2624, 1, 512, 2240, 2240, 2240, 2624]
    - [2, 21.05]
  - - [2368, 2624, 1, 512, 2368, 2368, 2368, 2624]
    - [2, 21.019]
  - - [2496, 2624, 1, 512, 2496, 2496, 2496, 2624]
    - [2, 21.186]
  - - [2624, 2624, 1, 512, 2624, 2624, 2624, 2624]
    - [0, 21.651]
  - - [2752, 2624, 1, 512, 2752, 2752, 2752, 2624]
    - [2, 21.0]
  - - [2880, 2624, 1, 512, 2880, 2880, 2880, 2624]
    - [2, 21.12]
  - - [3008, 2624, 1, 512, 3008, 3008, 3008, 2624]
    - [2, 21.104]
  - - [3136, 2624, 1, 512, 3136, 3136, 3136, 2624]
    - [2, 21.208]
  - - [3264, 2624, 1, 512, 3264, 3264, 3264, 2624]
    - [2, 21.203]
  - - [3392, 2624, 1, 512, 3392, 3392, 3392, 2624]
    - [2, 21.418]
  - - [3520, 2624, 1, 512, 3520, 3520, 3520, 2624]
    - [2, 21.05]
  - - [3648, 2624, 1, 512, 3648, 3648, 3648, 2624]
    - [2, 21.232]
  - - [3776, 2624, 1, 512, 3776, 3776, 3776, 2624]
    - [2, 21.322]
  - - [3904, 2624, 1, 512, 3904, 3904, 3904, 2624]
    - [2, 21.238]
  - - [4032, 2624, 1, 512, 4032, 4032, 4032, 2624]
    - [2, 21.306]
  - - [64, 2752, 1, 512, 64, 64, 64, 2752]
    - [0, 12.064]
  - - [192, 2752, 1, 512, 192, 192, 192, 2752]
    - [0, 18.251]
  - - [320, 2752, 1, 512, 320, 320, 320, 2752]
    - [2, 19.766]
  - - [448, 2752, 1, 512, 448, 448, 448, 2752]
    - [2, 19.888]
  - - [576, 2752, 1, 512, 576, 576, 576, 2752]
    - [2, 20.242]
  - - [704, 2752, 1, 512, 704, 704, 704, 2752]
    - [0, 20.76]
  - - [832, 2752, 1, 512, 832, 832, 832, 2752]
    - [2, 20.551]
  - - [960, 2752, 1, 512, 960, 960, 960, 2752]
    - [0, 20.617]
  - - [1088, 2752, 1, 512, 1088, 1088, 1088, 2752]
    - [2, 20.633]
  - - [1216, 2752, 1, 512, 1216, 1216, 1216, 2752]
    - [2, 20.812]
  - - [1344, 2752, 1, 512, 1344, 1344, 1344, 2752]
    - [2, 20.918]
  - - [1472, 2752, 1, 512, 1472, 1472, 1472, 2752]
    - [2, 21.184]
  - - [1600, 2752, 1, 512, 1600, 1600, 1600, 2752]
    - [0, 21.187]
  - - [1728, 2752, 1, 512, 1728, 1728, 1728, 2752]
    - [0, 21.195]
  - - [1856, 2752, 1, 512, 1856, 1856, 1856, 2752]
    - [2, 21.129]
  - - [1984, 2752, 1, 512, 1984, 1984, 1984, 2752]
    - [2, 21.101]
  - - [2112, 2752, 1, 512, 2112, 2112, 2112, 2752]
    - [0, 21.099]
  - - [2240, 2752, 1, 512, 2240, 2240, 2240, 2752]
    - [2, 21.093]
  - - [2368, 2752, 1, 512, 2368, 2368, 2368, 2752]
    - [2, 21.197]
  - - [2496, 2752, 1, 512, 2496, 2496, 2496, 2752]
    - [2, 21.172]
  - - [2624, 2752, 1, 512, 2624, 2624, 2624, 2752]
    - [2, 21.267]
  - - [2752, 2752, 1, 512, 2752, 2752, 2752, 2752]
    - [0, 21.032]
  - - [2880, 2752, 1, 512, 2880, 2880, 2880, 2752]
    - [2, 21.121]
  - - [3008, 2752, 1, 512, 3008, 3008, 3008, 2752]
    - [2, 21.223]
  - - [3136, 2752, 1, 512, 3136, 3136, 3136, 2752]
    - [2, 21.342]
  - - [3264, 2752, 1, 512, 3264, 3264, 3264, 2752]
    - [2, 21.312]
  - - [3392, 2752, 1, 512, 3392, 3392, 3392, 2752]
    - [2, 21.37]
  - - [3520, 2752, 1, 512, 3520, 3520, 3520, 2752]
    - [2, 21.275]
  - - [3648, 2752, 1, 512, 3648, 3648, 3648, 2752]
    - [2, 21.237]
  - - [3776, 2752, 1, 512, 3776, 3776, 3776, 2752]
    - [2, 21.176]
  - - [3904, 2752, 1, 512, 3904, 3904, 3904, 2752]
    - [2, 21.445]
  - - [4032, 2752, 1, 512, 4032, 4032, 4032, 2752]
    - [2, 21.441]
  - - [64, 2880, 1, 512, 64, 64, 64, 2880]
    - [0, 12.606]
  - - [192, 2880, 1, 512, 192, 192, 192, 2880]
    - [2, 17.751]
  - - [320, 2880, 1, 512, 320, 320, 320, 2880]
    - [2, 20.028]
  - - [448, 2880, 1, 512, 448, 448, 448, 2880]
    - [0, 20.418]
  - - [576, 2880, 1, 512, 576, 576, 576, 2880]
    - [0, 20.322]
  - - [704, 2880, 1, 512, 704, 704, 704, 2880]
    - [0, 20.405]
  - - [832, 2880, 1, 512, 832, 832, 832, 2880]
    - [3, 21.049]
  - - [960, 2880, 1, 512, 960, 960, 960, 2880]
    - [3, 20.568]
  - - [1088, 2880, 1, 512, 1088, 1088, 1088, 2880]
    - [2, 20.892]
  - - [1216, 2880, 1, 512, 1216, 1216, 1216, 2880]
    - [0, 20.877]
  - - [1344, 2880, 1, 512, 1344, 1344, 1344, 2880]
    - [0, 20.828]
  - - [1472, 2880, 1, 512, 1472, 1472, 1472, 2880]
    - [2, 21.168]
  - - [1600, 2880, 1, 512, 1600, 1600, 1600, 2880]
    - [0, 21.06]
  - - [1728, 2880, 1, 512, 1728, 1728, 1728, 2880]
    - [0, 21.213]
  - - [1856, 2880, 1, 512, 1856, 1856, 1856, 2880]
    - [2, 21.072]
  - - [1984, 2880, 1, 512, 1984, 1984, 1984, 2880]
    - [0, 21.117]
  - - [2112, 2880, 1, 512, 2112, 2112, 2112, 2880]
    - [2, 21.113]
  - - [2240, 2880, 1, 512, 2240, 2240, 2240, 2880]
    - [0, 20.885]
  - - [2368, 2880, 1, 512, 2368, 2368, 2368, 2880]
    - [2, 21.376]
  - - [2496, 2880, 1, 512, 2496, 2496, 2496, 2880]
    - [2, 21.213]
  - - [2624, 2880, 1, 512, 2624, 2624, 2624, 2880]
    - [2, 21.369]
  - - [2752, 2880, 1, 512, 2752, 2752, 2752, 2880]
    - [2, 21.024]
  - - [2880, 2880, 1, 512, 2880, 2880, 2880, 2880]
    - [2, 21.279]
  - - [3008, 2880, 1, 512, 3008, 3008, 3008, 2880]
    - [2, 21.369]
  - - [3136, 2880, 1, 512, 3136, 3136, 3136, 2880]
    - [2, 21.269]
  - - [3264, 2880, 1, 512, 3264, 3264, 3264, 2880]
    - [2, 21.376]
  - - [3392, 2880, 1, 512, 3392, 3392, 3392, 2880]
    - [2, 21.204]
  - - [3520, 2880, 1, 512, 3520, 3520, 3520, 2880]
    - [2, 21.317]
  - - [3648, 2880, 1, 512, 3648, 3648, 3648, 2880]
    - [0, 21.089]
  - - [3776, 2880, 1, 512, 3776, 3776, 3776, 2880]
    - [2, 21.304]
  - - [3904, 2880, 1, 512, 3904, 3904, 3904, 2880]
    - [2, 21.341]
  - - [4032, 2880, 1, 512, 4032, 4032, 4032, 2880]
    - [2, 21.34]
  - - [64, 3008, 1, 512, 64, 64, 64, 3008]
    - [0, 13.149]
  - - [192, 3008, 1, 512, 192, 192, 192, 3008]
    - [2, 18.61]
  - - [320, 3008, 1, 512, 320, 320, 320, 3008]
    - [0, 20.243]
  - - [448, 3008, 1, 512, 448, 448, 448, 3008]
    - [0, 20.113]
  - - [576, 3008, 1, 512, 576, 576, 576, 3008]
    - [2, 20.466]
  - - [704, 3008, 1, 512, 704, 704, 704, 3008]
    - [2, 20.481]
  - - [832, 3008, 1, 512, 832, 832, 832, 3008]
    - [0, 20.673]
  - - [960, 3008, 1, 512, 960, 960, 960, 3008]
    - [2, 21.055]
  - - [1088, 3008, 1, 512, 1088, 1088, 1088, 3008]
    - [2, 20.772]
  - - [1216, 3008, 1, 512, 1216, 1216, 1216, 3008]
    - [2, 20.996]
  - - [1344, 3008, 1, 512, 1344, 1344, 1344, 3008]
    - [2, 21.634]
  - - [1472, 3008, 1, 512, 1472, 1472, 1472, 3008]
    - [2, 21.146]
  - - [1600, 3008, 1, 512, 1600, 1600, 1600, 3008]
    - [0, 20.932]
  - - [1728, 3008, 1, 512, 1728, 1728, 1728, 3008]
    - [2, 21.08]
  - - [1856, 3008, 1, 512, 1856, 1856, 1856, 3008]
    - [2, 21.069]
  - - [1984, 3008, 1, 512, 1984, 1984, 1984, 3008]
    - [0, 20.997]
  - - [2112, 3008, 1, 512, 2112, 2112, 2112, 3008]
    - [2, 21.141]
  - - [2240, 3008, 1, 512, 2240, 2240, 2240, 3008]
    - [2, 21.262]
  - - [2368, 3008, 1, 512, 2368, 2368, 2368, 3008]
    - [2, 21.202]
  - - [2496, 3008, 1, 512, 2496, 2496, 2496, 3008]
    - [2, 21.167]
  - - [2624, 3008, 1, 512, 2624, 2624, 2624, 3008]
    - [2, 21.143]
  - - [2752, 3008, 1, 512, 2752, 2752, 2752, 3008]
    - [2, 21.375]
  - - [2880, 3008, 1, 512, 2880, 2880, 2880, 3008]
    - [0, 21.12]
  - - [3008, 3008, 1, 512, 3008, 3008, 3008, 3008]
    - [2, 21.285]
  - - [3136, 3008, 1, 512, 3136, 3136, 3136, 3008]
    - [2, 21.248]
  - - [3264, 3008, 1, 512, 3264, 3264, 3264, 3008]
    - [2, 21.238]
  - - [3392, 3008, 1, 512, 3392, 3392, 3392, 3008]
    - [2, 21.262]
  - - [3520, 3008, 1, 512, 3520, 3520, 3520, 3008]
    - [2, 21.32]
  - - [3648, 3008, 1, 512, 3648, 3648, 3648, 3008]
    - [2, 21.128]
  - - [3776, 3008, 1, 512, 3776, 3776, 3776, 3008]
    - [2, 21.356]
  - - [3904, 3008, 1, 512, 3904, 3904, 3904, 3008]
    - [2, 21.258]
  - - [4032, 3008, 1, 512, 4032, 4032, 4032, 3008]
    - [2, 21.202]
  - - [64, 3136, 1, 512, 64, 64, 64, 3136]
    - [2, 12.453]
  - - [192, 3136, 1, 512, 192, 192, 192, 3136]
    - [2, 18.452]
  - - [320, 3136, 1, 512, 320, 320, 320, 3136]
    - [0, 20.2]
  - - [448, 3136, 1, 512, 448, 448, 448, 3136]
    - [0, 19.918]
  - - [576, 3136, 1, 512, 576, 576, 576, 3136]
    - [2, 20.587]
  - - [704, 3136, 1, 512, 704, 704, 704, 3136]
    - [0, 20.654]
  - - [832, 3136, 1, 512, 832, 832, 832, 3136]
    - [0, 20.999]
  - - [960, 3136, 1, 512, 960, 960, 960, 3136]
    - [0, 20.949]
  - - [1088, 3136, 1, 512, 1088, 1088, 1088, 3136]
    - [0, 20.915]
  - - [1216, 3136, 1, 512, 1216, 1216, 1216, 3136]
    - [0, 20.997]
  - - [1344, 3136, 1, 512, 1344, 1344, 1344, 3136]
    - [2, 21.081]
  - - [1472, 3136, 1, 512, 1472, 1472, 1472, 3136]
    - [2, 21.058]
  - - [1600, 3136, 1, 512, 1600, 1600, 1600, 3136]
    - [2, 21.054]
  - - [1728, 3136, 1, 512, 1728, 1728, 1728, 3136]
    - [2, 21.095]
  - - [1856, 3136, 1, 512, 1856, 1856, 1856, 3136]
    - [0, 21.03]
  - - [1984, 3136, 1, 512, 1984, 1984, 1984, 3136]
    - [0, 21.045]
  - - [2112, 3136, 1, 512, 2112, 2112, 2112, 3136]
    - [0, 20.963]
  - - [2240, 3136, 1, 512, 2240, 2240, 2240, 3136]
    - [2, 21.229]
  - - [2368, 3136, 1, 512, 2368, 2368, 2368, 3136]
    - [2, 21.178]
  - - [2496, 3136, 1, 512, 2496, 2496, 2496, 3136]
    - [2, 21.015]
  - - [2624, 3136, 1, 512, 2624, 2624, 2624, 3136]
    - [0, 20.969]
  - - [2752, 3136, 1, 512, 2752, 2752, 2752, 3136]
    - [2, 21.145]
  - - [2880, 3136, 1, 512, 2880, 2880, 2880, 3136]
    - [2, 21.165]
  - - [3008, 3136, 1, 512, 3008, 3008, 3008, 3136]
    - [2, 21.28]
  - - [3136, 3136, 1, 512, 3136, 3136, 3136, 3136]
    - [2, 21.171]
  - - [3264, 3136, 1, 512, 3264, 3264, 3264, 3136]
    - [2, 21.281]
  - - [3392, 3136, 1, 512, 3392, 3392, 3392, 3136]
    - [2, 21.338]
  - - [3520, 3136, 1, 512, 3520, 3520, 3520, 3136]
    - [2, 21.227]
  - - [3648, 3136, 1, 512, 3648, 3648, 3648, 3136]
    - [2, 21.242]
  - - [3776, 3136, 1, 512, 3776, 3776, 3776, 3136]
    - [2, 21.273]
  - - [3904, 3136, 1, 512, 3904, 3904, 3904, 3136]
    - [2, 21.409]
  - - [4032, 3136, 1, 512, 4032, 4032, 4032, 3136]
    - [2, 21.423]
  - - [64, 3264, 1, 512, 64, 64, 64, 3264]
    - [2, 12.615]
  - - [192, 3264, 1, 512, 192, 192, 192, 3264]
    - [0, 19.097]
  - - [320, 3264, 1, 512, 320, 320, 320, 3264]
    - [0, 20.025]
  - - [448, 3264, 1, 512, 448, 448, 448, 3264]
    - [0, 20.877]
  - - [576, 3264, 1, 512, 576, 576, 576, 3264]
    - [0, 20.43]
  - - [704, 3264, 1, 512, 704, 704, 704, 3264]
    - [2, 20.912]
  - - [832, 3264, 1, 512, 832, 832, 832, 3264]
    - [2, 21.759]
  - - [960, 3264, 1, 512, 960, 960, 960, 3264]
    - [0, 20.934]
  - - [1088, 3264, 1, 512, 1088, 1088, 1088, 3264]
    - [2, 20.88]
  - - [1216, 3264, 1, 512, 1216, 1216, 1216, 3264]
    - [0, 20.936]
  - - [1344, 3264, 1, 512, 1344, 1344, 1344, 3264]
    - [2, 21.037]
  - - [1472, 3264, 1, 512, 1472, 1472, 1472, 3264]
    - [2, 20.954]
  - - [1600, 3264, 1, 512, 1600, 1600, 1600, 3264]
    - [2, 21.009]
  - - [1728, 3264, 1, 512, 1728, 1728, 1728, 3264]
    - [2, 20.976]
  - - [1856, 3264, 1, 512, 1856, 1856, 1856, 3264]
    - [2, 21.046]
  - - [1984, 3264, 1, 512, 1984, 1984, 1984, 3264]
    - [2, 21.098]
  - - [2112, 3264, 1, 512, 2112, 2112, 2112, 3264]
    - [2, 21.072]
  - - [2240, 3264, 1, 512, 2240, 2240, 2240, 3264]
    - [2, 21.231]
  - - [2368, 3264, 1, 512, 2368, 2368, 2368, 3264]
    - [2, 21.29]
  - - [2496, 3264, 1, 512, 2496, 2496, 2496, 3264]
    - [2, 21.11]
  - - [2624, 3264, 1, 512, 2624, 2624, 2624, 3264]
    - [2, 21.107]
  - - [2752, 3264, 1, 512, 2752, 2752, 2752, 3264]
    - [2, 21.339]
  - - [2880, 3264, 1, 512, 2880, 2880, 2880, 3264]
    - [2, 21.231]
  - - [3008, 3264, 1, 512, 3008, 3008, 3008, 3264]
    - [2, 21.161]
  - - [3136, 3264, 1, 512, 3136, 3136, 3136, 3264]
    - [2, 21.364]
  - - [3264, 3264, 1, 512, 3264, 3264, 3264, 3264]
    - [2, 21.361]
  - - [3392, 3264, 1, 512, 3392, 3392, 3392, 3264]
    - [2, 21.347]
  - - [3520, 3264, 1, 512, 3520, 3520, 3520, 3264]
    - [2, 21.37]
  - - [3648, 3264, 1, 512, 3648, 3648, 3648, 3264]
    - [2, 21.279]
  - - [3776, 3264, 1, 512, 3776, 3776, 3776, 3264]
    - [2, 21.273]
  - - [3904, 3264, 1, 512, 3904, 3904, 3904, 3264]
    - [2, 21.163]
  - - [4032, 3264, 1, 512, 4032, 4032, 4032, 3264]
    - [2, 21.387]
  - - [64, 3392, 1, 512, 64, 64, 64, 3392]
    - [0, 13.079]
  - - [192, 3392, 1, 512, 192, 192, 192, 3392]
    - [2, 19.159]
  - - [320, 3392, 1, 512, 320, 320, 320, 3392]
    - [0, 19.848]
  - - [448, 3392, 1, 512, 448, 448, 448, 3392]
    - [2, 20.852]
  - - [576, 3392, 1, 512, 576, 576, 576, 3392]
    - [0, 20.564]
  - - [704, 3392, 1, 512, 704, 704, 704, 3392]
    - [2, 20.846]
  - - [832, 3392, 1, 512, 832, 832, 832, 3392]
    - [2, 20.774]
  - - [960, 3392, 1, 512, 960, 960, 960, 3392]
    - [2, 21.045]
  - - [1088, 3392, 1, 512, 1088, 1088, 1088, 3392]
    - [2, 21.191]
  - - [1216, 3392, 1, 512, 1216, 1216, 1216, 3392]
    - [2, 21.128]
  - - [1344, 3392, 1, 512, 1344, 1344, 1344, 3392]
    - [2, 20.975]
  - - [1472, 3392, 1, 512, 1472, 1472, 1472, 3392]
    - [2, 21.044]
  - - [1600, 3392, 1, 512, 1600, 1600, 1600, 3392]
    - [2, 20.965]
  - - [1728, 3392, 1, 512, 1728, 1728, 1728, 3392]
    - [2, 21.151]
  - - [1856, 3392, 1, 512, 1856, 1856, 1856, 3392]
    - [2, 21.141]
  - - [1984, 3392, 1, 512, 1984, 1984, 1984, 3392]
    - [2, 21.317]
  - - [2112, 3392, 1, 512, 2112, 2112, 2112, 3392]
    - [2, 21.158]
  - - [2240, 3392, 1, 512, 2240, 2240, 2240, 3392]
    - [0, 21.033]
  - - [2368, 3392, 1, 512, 2368, 2368, 2368, 3392]
    - [2, 21.201]
  - - [2496, 3392, 1, 512, 2496, 2496, 2496, 3392]
    - [2, 21.255]
  - - [2624, 3392, 1, 512, 2624, 2624, 2624, 3392]
    - [2, 21.154]
  - - [2752, 3392, 1, 512, 2752, 2752, 2752, 3392]
    - [2, 21.489]
  - - [2880, 3392, 1, 512, 2880, 2880, 2880, 3392]
    - [2, 21.331]
  - - [3008, 3392, 1, 512, 3008, 3008, 3008, 3392]
    - [2, 21.369]
  - - [3136, 3392, 1, 512, 3136, 3136, 3136, 3392]
    - [0, 21.174]
  - - [3264, 3392, 1, 512, 3264, 3264, 3264, 3392]
    - [2, 21.337]
  - - [3392, 3392, 1, 512, 3392, 3392, 3392, 3392]
    - [2, 21.466]
  - - [3520, 3392, 1, 512, 3520, 3520, 3520, 3392]
    - [2, 21.359]
  - - [3648, 3392, 1, 512, 3648, 3648, 3648, 3392]
    - [0, 21.349]
  - - [3776, 3392, 1, 512, 3776, 3776, 3776, 3392]
    - [2, 21.119]
  - - [3904, 3392, 1, 512, 3904, 3904, 3904, 3392]
    - [2, 21.27]
  - - [4032, 3392, 1, 512, 4032, 4032, 4032, 3392]
    - [2, 21.436]
  - - [64, 3520, 1, 512, 64, 64, 64, 3520]
    - [0, 13.706]
  - - [192, 3520, 1, 512, 192, 192, 192, 3520]
    - [0, 19.146]
  - - [320, 3520, 1, 512, 320, 320, 320, 3520]
    - [0, 20.296]
  - - [448, 3520, 1, 512, 448, 448, 448, 3520]
    - [2, 19.981]
  - - [576, 3520, 1, 512, 576, 576, 576, 3520]
    - [2, 20.835]
  - - [704, 3520, 1, 512, 704, 704, 704, 3520]
    - [2, 20.939]
  - - [832, 3520, 1, 512, 832, 832, 832, 3520]
    - [2, 20.965]
  - - [960, 3520, 1, 512, 960, 960, 960, 3520]
    - [0, 20.975]
  - - [1088, 3520, 1, 512, 1088, 1088, 1088, 3520]
    - [2, 21.183]
  - - [1216, 3520, 1, 512, 1216, 1216, 1216, 3520]
    - [2, 20.98]
  - - [1344, 3520, 1, 512, 1344, 1344, 1344, 3520]
    - [0, 21.177]
  - - [1472, 3520, 1, 512, 1472, 1472, 1472, 3520]
    - [2, 21.091]
  - - [1600, 3520, 1, 512, 1600, 1600, 1600, 3520]
    - [2, 21.077]
  - - [1728, 3520, 1, 512, 1728, 1728, 1728, 3520]
    - [2, 21.203]
  - - [1856, 3520, 1, 512, 1856, 1856, 1856, 3520]
    - [0, 21.123]
  - - [1984, 3520, 1, 512, 1984, 1984, 1984, 3520]
    - [2, 21.237]
  - - [2112, 3520, 1, 512, 2112, 2112, 2112, 3520]
    - [2, 21.128]
  - - [2240, 3520, 1, 512, 2240, 2240, 2240, 3520]
    - [2, 21.328]
  - - [2368, 3520, 1, 512, 2368, 2368, 2368, 3520]
    - [2, 21.373]
  - - [2496, 3520, 1, 512, 2496, 2496, 2496, 3520]
    - [2, 21.365]
  - - [2624, 3520, 1, 512, 2624, 2624, 2624, 3520]
    - [2, 21.341]
  - - [2752, 3520, 1, 512, 2752, 2752, 2752, 3520]
    - [2, 21.354]
  - - [2880, 3520, 1, 512, 2880, 2880, 2880, 3520]
    - [2, 21.296]
  - - [3008, 3520, 1, 512, 3008, 3008, 3008, 3520]
    - [2, 21.55]
  - - [3136, 3520, 1, 512, 3136, 3136, 3136, 3520]
    - [2, 21.383]
  - - [3264, 3520, 1, 512, 3264, 3264, 3264, 3520]
    - [2, 21.171]
  - - [3392, 3520, 1, 512, 3392, 3392, 3392, 3520]
    - [2, 21.28]
  - - [3520, 3520, 1, 512, 3520, 3520, 3520, 3520]
    - [2, 21.162]
  - - [3648, 3520, 1, 512, 3648, 3648, 3648, 3520]
    - [2, 21.301]
  - - [3776, 3520, 1, 512, 3776, 3776, 3776, 3520]
    - [0, 21.194]
  - - [3904, 3520, 1, 512, 3904, 3904, 3904, 3520]
    - [2, 21.267]
  - - [4032, 3520, 1, 512, 4032, 4032, 4032, 3520]
    - [2, 21.283]
  - - [64, 3648, 1, 512, 64, 64, 64, 3648]
    - [0, 14.163]
  - - [192, 3648, 1, 512, 192, 192, 192, 3648]
    - [2, 19.302]
  - - [320, 3648, 1, 512, 320, 320, 320, 3648]
    - [0, 20.145]
  - - [448, 3648, 1, 512, 448, 448, 448, 3648]
    - [0, 20.338]
  - - [576, 3648, 1, 512, 576, 576, 576, 3648]
    - [2, 20.82]
  - - [704, 3648, 1, 512, 704, 704, 704, 3648]
    - [3, 21.703]
  - - [832, 3648, 1, 512, 832, 832, 832, 3648]
    - [0, 20.946]
  - - [960, 3648, 1, 512, 960, 960, 960, 3648]
    - [0, 21.298]
  - - [1088, 3648, 1, 512, 1088, 1088, 1088, 3648]
    - [2, 20.925]
  - - [1216, 3648, 1, 512, 1216, 1216, 1216, 3648]
    - [2, 21.133]
  - - [1344, 3648, 1, 512, 1344, 1344, 1344, 3648]
    - [2, 21.001]
  - - [1472, 3648, 1, 512, 1472, 1472, 1472, 3648]
    - [2, 21.022]
  - - [1600, 3648, 1, 512, 1600, 1600, 1600, 3648]
    - [2, 20.983]
  - - [1728, 3648, 1, 512, 1728, 1728, 1728, 3648]
    - [2, 21.165]
  - - [1856, 3648, 1, 512, 1856, 1856, 1856, 3648]
    - [2, 21.325]
  - - [1984, 3648, 1, 512, 1984, 1984, 1984, 3648]
    - [2, 21.347]
  - - [2112, 3648, 1, 512, 2112, 2112, 2112, 3648]
    - [2, 21.303]
  - - [2240, 3648, 1, 512, 2240, 2240, 2240, 3648]
    - [2, 21.116]
  - - [2368, 3648, 1, 512, 2368, 2368, 2368, 3648]
    - [2, 21.222]
  - - [2496, 3648, 1, 512, 2496, 2496, 2496, 3648]
    - [2, 21.392]
  - - [2624, 3648, 1, 512, 2624, 2624, 2624, 3648]
    - [2, 21.421]
  - - [2752, 3648, 1, 512, 2752, 2752, 2752, 3648]
    - [2, 21.469]
  - - [2880, 3648, 1, 512, 2880, 2880, 2880, 3648]
    - [2, 21.286]
  - - [3008, 3648, 1, 512, 3008, 3008, 3008, 3648]
    - [2, 21.413]
  - - [3136, 3648, 1, 512, 3136, 3136, 3136, 3648]
    - [2, 21.28]
  - - [3264, 3648, 1, 512, 3264, 3264, 3264, 3648]
    - [2, 21.354]
  - - [3392, 3648, 1, 512, 3392, 3392, 3392, 3648]
    - [2, 21.453]
  - - [3520, 3648, 1, 512, 3520, 3520, 3520, 3648]
    - [2, 21.431]
  - - [3648, 3648, 1, 512, 3648, 3648, 3648, 3648]
    - [2, 21.35]
  - - [3776, 3648, 1, 512, 3776, 3776, 3776, 3648]
    - [2, 21.228]
  - - [3904, 3648, 1, 512, 3904, 3904, 3904, 3648]
    - [2, 21.512]
  - - [4032, 3648, 1, 512, 4032, 4032, 4032, 3648]
    - [2, 21.4]
  - - [64, 3776, 1, 512, 64, 64, 64, 3776]
    - [0, 14.628]
  - - [192, 3776, 1, 512, 192, 192, 192, 3776]
    - [2, 19.281]
  - - [320, 3776, 1, 512, 320, 320, 320, 3776]
    - [0, 20.447]
  - - [448, 3776, 1, 512, 448, 448, 448, 3776]
    - [2, 19.882]
  - - [576, 3776, 1, 512, 576, 576, 576, 3776]
    - [2, 20.495]
  - - [704, 3776, 1, 512, 704, 704, 704, 3776]
    - [2, 21.271]
  - - [832, 3776, 1, 512, 832, 832, 832, 3776]
    - [2, 20.965]
  - - [960, 3776, 1, 512, 960, 960, 960, 3776]
    - [0, 20.969]
  - - [1088, 3776, 1, 512, 1088, 1088, 1088, 3776]
    - [2, 21.018]
  - - [1216, 3776, 1, 512, 1216, 1216, 1216, 3776]
    - [2, 21.145]
  - - [1344, 3776, 1, 512, 1344, 1344, 1344, 3776]
    - [2, 21.134]
  - - [1472, 3776, 1, 512, 1472, 1472, 1472, 3776]
    - [2, 21.042]
  - - [1600, 3776, 1, 512, 1600, 1600, 1600, 3776]
    - [2, 21.162]
  - - [1728, 3776, 1, 512, 1728, 1728, 1728, 3776]
    - [2, 21.101]
  - - [1856, 3776, 1, 512, 1856, 1856, 1856, 3776]
    - [2, 21.15]
  - - [1984, 3776, 1, 512, 1984, 1984, 1984, 3776]
    - [2, 21.335]
  - - [2112, 3776, 1, 512, 2112, 2112, 2112, 3776]
    - [2, 21.354]
  - - [2240, 3776, 1, 512, 2240, 2240, 2240, 3776]
    - [2, 21.188]
  - - [2368, 3776, 1, 512, 2368, 2368, 2368, 3776]
    - [2, 21.253]
  - - [2496, 3776, 1, 512, 2496, 2496, 2496, 3776]
    - [2, 21.255]
  - - [2624, 3776, 1, 512, 2624, 2624, 2624, 3776]
    - [2, 21.353]
  - - [2752, 3776, 1, 512, 2752, 2752, 2752, 3776]
    - [2, 21.297]
  - - [2880, 3776, 1, 512, 2880, 2880, 2880, 3776]
    - [2, 21.447]
  - - [3008, 3776, 1, 512, 3008, 3008, 3008, 3776]
    - [2, 21.413]
  - - [3136, 3776, 1, 512, 3136, 3136, 3136, 3776]
    - [2, 21.298]
  - - [3264, 3776, 1, 512, 3264, 3264, 3264, 3776]
    - [2, 21.436]
  - - [3392, 3776, 1, 512, 3392, 3392, 3392, 3776]
    - [0, 21.219]
  - - [3520, 3776, 1, 512, 3520, 3520, 3520, 3776]
    - [2, 21.38]
  - - [3648, 3776, 1, 512, 3648, 3648, 3648, 3776]
    - [2, 21.323]
  - - [3776, 3776, 1, 512, 3776, 3776, 3776, 3776]
    - [0, 21.293]
  - - [3904, 3776, 1, 512, 3904, 3904, 3904, 3776]
    - [2, 21.409]
  - - [4032, 3776, 1, 512, 4032, 4032, 4032, 3776]
    - [2, 21.391]
  - - [64, 3904, 1, 512, 64, 64, 64, 3904]
    - [2, 13.794]
  - - [192, 3904, 1, 512, 192, 192, 192, 3904]
    - [2, 19.454]
  - - [320, 3904, 1, 512, 320, 320, 320, 3904]
    - [0, 19.779]
  - - [448, 3904, 1, 512, 448, 448, 448, 3904]
    - [0, 20.297]
  - - [576, 3904, 1, 512, 576, 576, 576, 3904]
    - [2, 20.875]
  - - [704, 3904, 1, 512, 704, 704, 704, 3904]
    - [3, 21.042]
  - - [832, 3904, 1, 512, 832, 832, 832, 3904]
    - [3, 21.481]
  - - [960, 3904, 1, 512, 960, 960, 960, 3904]
    - [0, 21.036]
  - - [1088, 3904, 1, 512, 1088, 1088, 1088, 3904]
    - [0, 21.35]
  - - [1216, 3904, 1, 512, 1216, 1216, 1216, 3904]
    - [2, 21.162]
  - - [1344, 3904, 1, 512, 1344, 1344, 1344, 3904]
    - [2, 21.062]
  - - [1472, 3904, 1, 512, 1472, 1472, 1472, 3904]
    - [2, 21.123]
  - - [1600, 3904, 1, 512, 1600, 1600, 1600, 3904]
    - [2, 21.379]
  - - [1728, 3904, 1, 512, 1728, 1728, 1728, 3904]
    - [0, 21.055]
  - - [1856, 3904, 1, 512, 1856, 1856, 1856, 3904]
    - [2, 21.129]
  - - [1984, 3904, 1, 512, 1984, 1984, 1984, 3904]
    - [2, 21.126]
  - - [2112, 3904, 1, 512, 2112, 2112, 2112, 3904]
    - [2, 21.212]
  - - [2240, 3904, 1, 512, 2240, 2240, 2240, 3904]
    - [2, 21.236]
  - - [2368, 3904, 1, 512, 2368, 2368, 2368, 3904]
    - [2, 21.142]
  - - [2496, 3904, 1, 512, 2496, 2496, 2496, 3904]
    - [2, 21.458]
  - - [2624, 3904, 1, 512, 2624, 2624, 2624, 3904]
    - [2, 21.312]
  - - [2752, 3904, 1, 512, 2752, 2752, 2752, 3904]
    - [2, 21.206]
  - - [2880, 3904, 1, 512, 2880, 2880, 2880, 3904]
    - [2, 21.389]
  - - [3008, 3904, 1, 512, 3008, 3008, 3008, 3904]
    - [2, 21.308]
  - - [3136, 3904, 1, 512, 3136, 3136, 3136, 3904]
    - [2, 21.328]
  - - [3264, 3904, 1, 512, 3264, 3264, 3264, 3904]
    - [2, 21.453]
  - - [3392, 3904, 1, 512, 3392, 3392, 3392, 3904]
    - [2, 21.397]
  - - [3520, 3904, 1, 512, 3520, 3520, 3520, 3904]
    - [2, 21.466]
  - - [3648, 3904, 1, 512, 3648, 3648, 3648, 3904]
    - [2, 21.301]
  - - [3776, 3904, 1, 512, 3776, 3776, 3776, 3904]
    - [2, 21.355]
  - - [3904, 3904, 1, 512, 3904, 3904, 3904, 3904]
    - [2, 21.394]
  - - [4032, 3904, 1, 512, 4032, 4032, 4032, 3904]
    - [2, 21.464]
  - - [64, 4032, 1, 512, 64, 64, 64, 4032]
    - [2, 13.915]
  - - [192, 4032, 1, 512, 192, 192, 192, 4032]
    - [2, 19.664]
  - - [320, 4032, 1, 512, 320, 320, 320, 4032]
    - [0, 20.176]
  - - [448, 4032, 1, 512, 448, 448, 448, 4032]
    - [2, 19.891]
  - - [576, 4032, 1, 512, 576, 576, 576, 4032]
    - [2, 20.818]
  - - [704, 4032, 1, 512, 704, 704, 704, 4032]
    - [2, 20.55]
  - - [832, 4032, 1, 512, 832, 832, 832, 4032]
    - [0, 20.742]
  - - [960, 4032, 1, 512, 960, 960, 960, 4032]
    - [2, 20.937]
  - - [1088, 4032, 1, 512, 1088, 1088, 1088, 4032]
    - [2, 21.026]
  - - [1216, 4032, 1, 512, 1216, 1216, 1216, 4032]
    - [2, 21.092]
  - - [1344, 4032, 1, 512, 1344, 1344, 1344, 4032]
    - [2, 20.901]
  - - [1472, 4032, 1, 512, 1472, 1472, 1472, 4032]
    - [2, 21.798]
  - - [1600, 4032, 1, 512, 1600, 1600, 1600, 4032]
    - [2, 21.211]
  - - [1728, 4032, 1, 512, 1728, 1728, 1728, 4032]
    - [2, 21.206]
  - - [1856, 4032, 1, 512, 1856, 1856, 1856, 4032]
    - [0, 21.098]
  - - [1984, 4032, 1, 512, 1984, 1984, 1984, 4032]
    - [2, 21.072]
  - - [2112, 4032, 1, 512, 2112, 2112, 2112, 4032]
    - [2, 21.353]
  - - [2240, 4032, 1, 512, 2240, 2240, 2240, 4032]
    - [2, 21.337]
  - - [2368, 4032, 1, 512, 2368, 2368, 2368, 4032]
    - [2, 21.339]
  - - [2496, 4032, 1, 512, 2496, 2496, 2496, 4032]
    - [2, 21.576]
  - - [2624, 4032, 1, 512, 2624, 2624, 2624, 4032]
    - [2, 21.22]
  - - [2752, 4032, 1, 512, 2752, 2752, 2752, 4032]
    - [2, 21.34]
  - - [2880, 4032, 1, 512, 2880, 2880, 2880, 4032]
    - [2, 21.231]
  - - [3008, 4032, 1, 512, 3008, 3008, 3008, 4032]
    - [2, 21.355]
  - - [3136, 4032, 1, 512, 3136, 3136, 3136, 4032]
    - [2, 21.322]
  - - [3264, 4032, 1, 512, 3264, 3264, 3264, 4032]
    - [2, 21.244]
  - - [3392, 4032, 1, 512, 3392, 3392, 3392, 4032]
    - [2, 21.437]
  - - [3520, 4032, 1, 512, 3520, 3520, 3520, 4032]
    - [2, 21.303]
  - - [3648, 4032, 1, 512, 3648, 3648, 3648, 4032]
    - [2, 21.436]
  - - [3776, 4032, 1, 512, 3776, 3776, 3776, 4032]
    - [2, 21.473]
  - - [3904, 4032, 1, 512, 3904, 3904, 3904, 4032]
    - [2, 21.404]
  - - [4032, 4032, 1, 512, 4032, 4032, 4032, 4032]
    - [2, 21.503]
  - - [64, 64, 1, 1024, 64, 64, 64, 64]
    - [2, 0.813]
  - - [192, 64, 1, 1024, 192, 192, 192, 64]
    - [2, 2.424]
  - - [320, 64, 1, 1024, 320, 320, 320, 64]
    - [2, 4.001]
  - - [448, 64, 1, 1024, 448, 448, 448, 64]
    - [0, 5.224]
  - - [576, 64, 1, 1024, 576, 576, 576, 64]
    - [2, 6.647]
  - - [704, 64, 1, 1024, 704, 704, 704, 64]
    - [0, 8.192]
  - - [832, 64, 1, 1024, 832, 832, 832, 64]
    - [2, 7.661]
  - - [960, 64, 1, 1024, 960, 960, 960, 64]
    - [2, 8.796]
  - - [1088, 64, 1, 1024, 1088, 1088, 1088, 64]
    - [2, 9.919]
  - - [1216, 64, 1, 1024, 1216, 1216, 1216, 64]
    - [0, 10.311]
  - - [1344, 64, 1, 1024, 1344, 1344, 1344, 64]
    - [0, 11.395]
  - - [1472, 64, 1, 1024, 1472, 1472, 1472, 64]
    - [0, 12.434]
  - - [1600, 64, 1, 1024, 1600, 1600, 1600, 64]
    - [2, 11.104]
  - - [1728, 64, 1, 1024, 1728, 1728, 1728, 64]
    - [2, 11.917]
  - - [1856, 64, 1, 1024, 1856, 1856, 1856, 64]
    - [2, 12.824]
  - - [1984, 64, 1, 1024, 1984, 1984, 1984, 64]
    - [0, 13.13]
  - - [2112, 64, 1, 1024, 2112, 2112, 2112, 64]
    - [0, 14.014]
  - - [2240, 64, 1, 1024, 2240, 2240, 2240, 64]
    - [0, 14.742]
  - - [2368, 64, 1, 1024, 2368, 2368, 2368, 64]
    - [2, 13.127]
  - - [2496, 64, 1, 1024, 2496, 2496, 2496, 64]
    - [2, 13.592]
  - - [2624, 64, 1, 1024, 2624, 2624, 2624, 64]
    - [2, 14.254]
  - - [2752, 64, 1, 1024, 2752, 2752, 2752, 64]
    - [0, 14.572]
  - - [2880, 64, 1, 1024, 2880, 2880, 2880, 64]
    - [0, 15.229]
  - - [3008, 64, 1, 1024, 3008, 3008, 3008, 64]
    - [0, 15.896]
  - - [3136, 64, 1, 1024, 3136, 3136, 3136, 64]
    - [2, 14.537]
  - - [3264, 64, 1, 1024, 3264, 3264, 3264, 64]
    - [2, 15.088]
  - - [3392, 64, 1, 1024, 3392, 3392, 3392, 64]
    - [0, 15.511]
  - - [3520, 64, 1, 1024, 3520, 3520, 3520, 64]
    - [0, 16.071]
  - - [3648, 64, 1, 1024, 3648, 3648, 3648, 64]
    - [0, 16.862]
  - - [3776, 64, 1, 1024, 3776, 3776, 3776, 64]
    - [0, 17.437]
  - - [3904, 64, 1, 1024, 3904, 3904, 3904, 64]
    - [3, 16.464]
  - - [4032, 64, 1, 1024, 4032, 4032, 4032, 64]
    - [2, 16.839]
  - - [64, 192, 1, 1024, 64, 64, 64, 192]
    - [3, 1.573]
  - - [192, 192, 1, 1024, 192, 192, 192, 192]
    - [1, 4.716]
  - - [320, 192, 1, 1024, 320, 320, 320, 192]
    - [0, 7.842]
  - - [448, 192, 1, 1024, 448, 448, 448, 192]
    - [0, 11.084]
  - - [576, 192, 1, 1024, 576, 576, 576, 192]
    - [2, 11.902]
  - - [704, 192, 1, 1024, 704, 704, 704, 192]
    - [0, 13.998]
  - - [832, 192, 1, 1024, 832, 832, 832, 192]
    - [2, 13.87]
  - - [960, 192, 1, 1024, 960, 960, 960, 192]
    - [0, 15.593]
  - - [1088, 192, 1, 1024, 1088, 1088, 1088, 192]
    - [0, 15.269]
  - - [1216, 192, 1, 1024, 1216, 1216, 1216, 192]
    - [0, 16.995]
  - - [1344, 192, 1, 1024, 1344, 1344, 1344, 192]
    - [2, 16.734]
  - - [1472, 192, 1, 1024, 1472, 1472, 1472, 192]
    - [0, 17.799]
  - - [1600, 192, 1, 1024, 1600, 1600, 1600, 192]
    - [3, 17.607]
  - - [1728, 192, 1, 1024, 1728, 1728, 1728, 192]
    - [0, 18.419]
  - - [1856, 192, 1, 1024, 1856, 1856, 1856, 192]
    - [3, 18.155]
  - - [1984, 192, 1, 1024, 1984, 1984, 1984, 192]
    - [2, 18.83]
  - - [2112, 192, 1, 1024, 2112, 2112, 2112, 192]
    - [2, 18.729]
  - - [2240, 192, 1, 1024, 2240, 2240, 2240, 192]
    - [0, 19.169]
  - - [2368, 192, 1, 1024, 2368, 2368, 2368, 192]
    - [2, 19.214]
  - - [2496, 192, 1, 1024, 2496, 2496, 2496, 192]
    - [0, 20.057]
  - - [2624, 192, 1, 1024, 2624, 2624, 2624, 192]
    - [2, 19.69]
  - - [2752, 192, 1, 1024, 2752, 2752, 2752, 192]
    - [0, 20.359]
  - - [2880, 192, 1, 1024, 2880, 2880, 2880, 192]
    - [0, 19.856]
  - - [3008, 192, 1, 1024, 3008, 3008, 3008, 192]
    - [0, 20.447]
  - - [3136, 192, 1, 1024, 3136, 3136, 3136, 192]
    - [2, 19.646]
  - - [3264, 192, 1, 1024, 3264, 3264, 3264, 192]
    - [0, 20.146]
  - - [3392, 192, 1, 1024, 3392, 3392, 3392, 192]
    - [2, 20.135]
  - - [3520, 192, 1, 1024, 3520, 3520, 3520, 192]
    - [0, 20.188]
  - - [3648, 192, 1, 1024, 3648, 3648, 3648, 192]
    - [0, 20.338]
  - - [3776, 192, 1, 1024, 3776, 3776, 3776, 192]
    - [0, 20.805]
  - - [3904, 192, 1, 1024, 3904, 3904, 3904, 192]
    - [2, 19.702]
  - - [4032, 192, 1, 1024, 4032, 4032, 4032, 192]
    - [0, 20.364]
  - - [64, 320, 1, 1024, 64, 64, 64, 320]
    - [3, 3.067]
  - - [192, 320, 1, 1024, 192, 192, 192, 320]
    - [3, 8.37]
  - - [320, 320, 1, 1024, 320, 320, 320, 320]
    - [2, 11.065]
  - - [448, 320, 1, 1024, 448, 448, 448, 320]
    - [0, 14.87]
  - - [576, 320, 1, 1024, 576, 576, 576, 320]
    - [0, 15.653]
  - - [704, 320, 1, 1024, 704, 704, 704, 320]
    - [0, 16.424]
  - - [832, 320, 1, 1024, 832, 832, 832, 320]
    - [2, 17.025]
  - - [960, 320, 1, 1024, 960, 960, 960, 320]
    - [2, 17.604]
  - - [1088, 320, 1, 1024, 1088, 1088, 1088, 320]
    - [3, 17.873]
  - - [1216, 320, 1, 1024, 1216, 1216, 1216, 320]
    - [0, 19.936]
  - - [1344, 320, 1, 1024, 1344, 1344, 1344, 320]
    - [0, 19.515]
  - - [1472, 320, 1, 1024, 1472, 1472, 1472, 320]
    - [0, 19.564]
  - - [1600, 320, 1, 1024, 1600, 1600, 1600, 320]
    - [2, 19.76]
  - - [1728, 320, 1, 1024, 1728, 1728, 1728, 320]
    - [2, 19.598]
  - - [1856, 320, 1, 1024, 1856, 1856, 1856, 320]
    - [0, 20.058]
  - - [1984, 320, 1, 1024, 1984, 1984, 1984, 320]
    - [0, 20.614]
  - - [2112, 320, 1, 1024, 2112, 2112, 2112, 320]
    - [0, 20.463]
  - - [2240, 320, 1, 1024, 2240, 2240, 2240, 320]
    - [0, 19.824]
  - - [2368, 320, 1, 1024, 2368, 2368, 2368, 320]
    - [2, 20.009]
  - - [2496, 320, 1, 1024, 2496, 2496, 2496, 320]
    - [0, 19.908]
  - - [2624, 320, 1, 1024, 2624, 2624, 2624, 320]
    - [2, 19.895]
  - - [2752, 320, 1, 1024, 2752, 2752, 2752, 320]
    - [0, 20.494]
  - - [2880, 320, 1, 1024, 2880, 2880, 2880, 320]
    - [0, 20.202]
  - - [3008, 320, 1, 1024, 3008, 3008, 3008, 320]
    - [0, 20.171]
  - - [3136, 320, 1, 1024, 3136, 3136, 3136, 320]
    - [0, 19.993]
  - - [3264, 320, 1, 1024, 3264, 3264, 3264, 320]
    - [2, 19.963]
  - - [3392, 320, 1, 1024, 3392, 3392, 3392, 320]
    - [3, 20.223]
  - - [3520, 320, 1, 1024, 3520, 3520, 3520, 320]
    - [0, 20.439]
  - - [3648, 320, 1, 1024, 3648, 3648, 3648, 320]
    - [0, 20.531]
  - - [3776, 320, 1, 1024, 3776, 3776, 3776, 320]
    - [2, 20.977]
  - - [3904, 320, 1, 1024, 3904, 3904, 3904, 320]
    - [0, 20.544]
  - - [4032, 320, 1, 1024, 4032, 4032, 4032, 320]
    - [0, 20.305]
  - - [64, 448, 1, 1024, 64, 64, 64, 448]
    - [3, 3.658]
  - - [192, 448, 1, 1024, 192, 192, 192, 448]
    - [0, 10.989]
  - - [320, 448, 1, 1024, 320, 320, 320, 448]
    - [0, 14.835]
  - - [448, 448, 1, 1024, 448, 448, 448, 448]
    - [2, 15.005]
  - - [576, 448, 1, 1024, 576, 576, 576, 448]
    - [3, 16.859]
  - - [704, 448, 1, 1024, 704, 704, 704, 448]
    - [2, 18.238]
  - - [832, 448, 1, 1024, 832, 832, 832, 448]
    - [2, 18.829]
  - - [960, 448, 1, 1024, 960, 960, 960, 448]
    - [0, 19.524]
  - - [1088, 448, 1, 1024, 1088, 1088, 1088, 448]
    - [0, 20.385]
  - - [1216, 448, 1, 1024, 1216, 1216, 1216, 448]
    - [2, 19.92]
  - - [1344, 448, 1, 1024, 1344, 1344, 1344, 448]
    - [2, 20.099]
  - - [1472, 448, 1, 1024, 1472, 1472, 1472, 448]
    - [2, 20.289]
  - - [1600, 448, 1, 1024, 1600, 1600, 1600, 448]
    - [0, 20.101]
  - - [1728, 448, 1, 1024, 1728, 1728, 1728, 448]
    - [0, 20.104]
  - - [1856, 448, 1, 1024, 1856, 1856, 1856, 448]
    - [0, 20.612]
  - - [1984, 448, 1, 1024, 1984, 1984, 1984, 448]
    - [2, 19.986]
  - - [2112, 448, 1, 1024, 2112, 2112, 2112, 448]
    - [0, 20.251]
  - - [2240, 448, 1, 1024, 2240, 2240, 2240, 448]
    - [0, 20.106]
  - - [2368, 448, 1, 1024, 2368, 2368, 2368, 448]
    - [2, 20.447]
  - - [2496, 448, 1, 1024, 2496, 2496, 2496, 448]
    - [0, 20.513]
  - - [2624, 448, 1, 1024, 2624, 2624, 2624, 448]
    - [0, 20.431]
  - - [2752, 448, 1, 1024, 2752, 2752, 2752, 448]
    - [2, 20.496]
  - - [2880, 448, 1, 1024, 2880, 2880, 2880, 448]
    - [2, 20.699]
  - - [3008, 448, 1, 1024, 3008, 3008, 3008, 448]
    - [2, 20.836]
  - - [3136, 448, 1, 1024, 3136, 3136, 3136, 448]
    - [2, 20.56]
  - - [3264, 448, 1, 1024, 3264, 3264, 3264, 448]
    - [2, 20.842]
  - - [3392, 448, 1, 1024, 3392, 3392, 3392, 448]
    - [0, 20.69]
  - - [3520, 448, 1, 1024, 3520, 3520, 3520, 448]
    - [2, 20.877]
  - - [3648, 448, 1, 1024, 3648, 3648, 3648, 448]
    - [2, 21.239]
  - - [3776, 448, 1, 1024, 3776, 3776, 3776, 448]
    - [2, 20.935]
  - - [3904, 448, 1, 1024, 3904, 3904, 3904, 448]
    - [0, 20.887]
  - - [4032, 448, 1, 1024, 4032, 4032, 4032, 448]
    - [2, 21.209]
  - - [64, 576, 1, 1024, 64, 64, 64, 576]
    - [0, 4.707]
  - - [192, 576, 1, 1024, 192, 192, 192, 576]
    - [2, 11.819]
  - - [320, 576, 1, 1024, 320, 320, 320, 576]
    - [0, 15.474]
  - - [448, 576, 1, 1024, 448, 448, 448, 576]
    - [2, 16.656]
  - - [576, 576, 1, 1024, 576, 576, 576, 576]
    - [0, 18.395]
  - - [704, 576, 1, 1024, 704, 704, 704, 576]
    - [2, 19.2]
  - - [832, 576, 1, 1024, 832, 832, 832, 576]
    - [0, 19.778]
  - - [960, 576, 1, 1024, 960, 960, 960, 576]
    - [2, 19.574]
  - - [1088, 576, 1, 1024, 1088, 1088, 1088, 576]
    - [0, 19.976]
  - - [1216, 576, 1, 1024, 1216, 1216, 1216, 576]
    - [2, 20.007]
  - - [1344, 576, 1, 1024, 1344, 1344, 1344, 576]
    - [0, 20.537]
  - - [1472, 576, 1, 1024, 1472, 1472, 1472, 576]
    - [2, 19.972]
  - - [1600, 576, 1, 1024, 1600, 1600, 1600, 576]
    - [0, 20.074]
  - - [1728, 576, 1, 1024, 1728, 1728, 1728, 576]
    - [2, 20.309]
  - - [1856, 576, 1, 1024, 1856, 1856, 1856, 576]
    - [0, 20.308]
  - - [1984, 576, 1, 1024, 1984, 1984, 1984, 576]
    - [2, 20.345]
  - - [2112, 576, 1, 1024, 2112, 2112, 2112, 576]
    - [0, 20.372]
  - - [2240, 576, 1, 1024, 2240, 2240, 2240, 576]
    - [2, 20.585]
  - - [2368, 576, 1, 1024, 2368, 2368, 2368, 576]
    - [0, 20.796]
  - - [2496, 576, 1, 1024, 2496, 2496, 2496, 576]
    - [2, 20.98]
  - - [2624, 576, 1, 1024, 2624, 2624, 2624, 576]
    - [2, 21.002]
  - - [2752, 576, 1, 1024, 2752, 2752, 2752, 576]
    - [0, 20.728]
  - - [2880, 576, 1, 1024, 2880, 2880, 2880, 576]
    - [2, 21.15]
  - - [3008, 576, 1, 1024, 3008, 3008, 3008, 576]
    - [2, 20.835]
  - - [3136, 576, 1, 1024, 3136, 3136, 3136, 576]
    - [2, 20.99]
  - - [3264, 576, 1, 1024, 3264, 3264, 3264, 576]
    - [2, 21.141]
  - - [3392, 576, 1, 1024, 3392, 3392, 3392, 576]
    - [2, 21.308]
  - - [3520, 576, 1, 1024, 3520, 3520, 3520, 576]
    - [0, 21.148]
  - - [3648, 576, 1, 1024, 3648, 3648, 3648, 576]
    - [2, 21.47]
  - - [3776, 576, 1, 1024, 3776, 3776, 3776, 576]
    - [2, 21.183]
  - - [3904, 576, 1, 1024, 3904, 3904, 3904, 576]
    - [2, 21.121]
  - - [4032, 576, 1, 1024, 4032, 4032, 4032, 576]
    - [2, 21.11]
  - - [64, 704, 1, 1024, 64, 64, 64, 704]
    - [3, 5.738]
  - - [192, 704, 1, 1024, 192, 192, 192, 704]
    - [0, 13.85]
  - - [320, 704, 1, 1024, 320, 320, 320, 704]
    - [0, 16.286]
  - - [448, 704, 1, 1024, 448, 448, 448, 704]
    - [2, 18.097]
  - - [576, 704, 1, 1024, 576, 576, 576, 704]
    - [2, 19.147]
  - - [704, 704, 1, 1024, 704, 704, 704, 704]
    - [0, 19.764]
  - - [832, 704, 1, 1024, 832, 832, 832, 704]
    - [0, 20.803]
  - - [960, 704, 1, 1024, 960, 960, 960, 704]
    - [0, 20.163]
  - - [1088, 704, 1, 1024, 1088, 1088, 1088, 704]
    - [0, 20.551]
  - - [1216, 704, 1, 1024, 1216, 1216, 1216, 704]
    - [2, 19.862]
  - - [1344, 704, 1, 1024, 1344, 1344, 1344, 704]
    - [2, 20.179]
  - - [1472, 704, 1, 1024, 1472, 1472, 1472, 704]
    - [2, 20.469]
  - - [1600, 704, 1, 1024, 1600, 1600, 1600, 704]
    - [0, 20.699]
  - - [1728, 704, 1, 1024, 1728, 1728, 1728, 704]
    - [2, 20.56]
  - - [1856, 704, 1, 1024, 1856, 1856, 1856, 704]
    - [3, 20.546]
  - - [1984, 704, 1, 1024, 1984, 1984, 1984, 704]
    - [2, 20.571]
  - - [2112, 704, 1, 1024, 2112, 2112, 2112, 704]
    - [2, 21.092]
  - - [2240, 704, 1, 1024, 2240, 2240, 2240, 704]
    - [2, 20.87]
  - - [2368, 704, 1, 1024, 2368, 2368, 2368, 704]
    - [0, 21.129]
  - - [2496, 704, 1, 1024, 2496, 2496, 2496, 704]
    - [2, 21.117]
  - - [2624, 704, 1, 1024, 2624, 2624, 2624, 704]
    - [2, 21.45]
  - - [2752, 704, 1, 1024, 2752, 2752, 2752, 704]
    - [2, 21.281]
  - - [2880, 704, 1, 1024, 2880, 2880, 2880, 704]
    - [2, 21.243]
  - - [3008, 704, 1, 1024, 3008, 3008, 3008, 704]
    - [2, 21.06]
  - - [3136, 704, 1, 1024, 3136, 3136, 3136, 704]
    - [2, 21.3]
  - - [3264, 704, 1, 1024, 3264, 3264, 3264, 704]
    - [2, 21.24]
  - - [3392, 704, 1, 1024, 3392, 3392, 3392, 704]
    - [2, 21.181]
  - - [3520, 704, 1, 1024, 3520, 3520, 3520, 704]
    - [2, 21.078]
  - - [3648, 704, 1, 1024, 3648, 3648, 3648, 704]
    - [2, 21.453]
  - - [3776, 704, 1, 1024, 3776, 3776, 3776, 704]
    - [2, 21.23]
  - - [3904, 704, 1, 1024, 3904, 3904, 3904, 704]
    - [2, 21.392]
  - - [4032, 704, 1, 1024, 4032, 4032, 4032, 704]
    - [0, 21.403]
  - - [64, 832, 1, 1024, 64, 64, 64, 832]
    - [2, 6.77]
  - - [192, 832, 1, 1024, 192, 192, 192, 832]
    - [2, 13.922]
  - - [320, 832, 1, 1024, 320, 320, 320, 832]
    - [2, 16.911]
  - - [448, 832, 1, 1024, 448, 448, 448, 832]
    - [2, 18.687]
  - - [576, 832, 1, 1024, 576, 576, 576, 832]
    - [0, 20.449]
  - - [704, 832, 1, 1024, 704, 704, 704, 832]
    - [0, 20.944]
  - - [832, 832, 1, 1024, 832, 832, 832, 832]
    - [0, 19.909]
  - - [960, 832, 1, 1024, 960, 960, 960, 832]
    - [2, 20.041]
  - - [1088, 832, 1, 1024, 1088, 1088, 1088, 832]
    - [2, 20.242]
  - - [1216, 832, 1, 1024, 1216, 1216, 1216, 832]
    - [2, 20.85]
  - - [1344, 832, 1, 1024, 1344, 1344, 1344, 832]
    - [3, 20.606]
  - - [1472, 832, 1, 1024, 1472, 1472, 1472, 832]
    - [0, 20.888]
  - - [1600, 832, 1, 1024, 1600, 1600, 1600, 832]
    - [2, 21.651]
  - - [1728, 832, 1, 1024, 1728, 1728, 1728, 832]
    - [0, 20.936]
  - - [1856, 832, 1, 1024, 1856, 1856, 1856, 832]
    - [2, 20.843]
  - - [1984, 832, 1, 1024, 1984, 1984, 1984, 832]
    - [0, 20.808]
  - - [2112, 832, 1, 1024, 2112, 2112, 2112, 832]
    - [2, 21.064]
  - - [2240, 832, 1, 1024, 2240, 2240, 2240, 832]
    - [2, 20.939]
  - - [2368, 832, 1, 1024, 2368, 2368, 2368, 832]
    - [2, 21.015]
  - - [2496, 832, 1, 1024, 2496, 2496, 2496, 832]
    - [2, 21.192]
  - - [2624, 832, 1, 1024, 2624, 2624, 2624, 832]
    - [2, 21.113]
  - - [2752, 832, 1, 1024, 2752, 2752, 2752, 832]
    - [2, 21.148]
  - - [2880, 832, 1, 1024, 2880, 2880, 2880, 832]
    - [2, 21.162]
  - - [3008, 832, 1, 1024, 3008, 3008, 3008, 832]
    - [2, 21.229]
  - - [3136, 832, 1, 1024, 3136, 3136, 3136, 832]
    - [2, 21.405]
  - - [3264, 832, 1, 1024, 3264, 3264, 3264, 832]
    - [2, 21.39]
  - - [3392, 832, 1, 1024, 3392, 3392, 3392, 832]
    - [2, 21.21]
  - - [3520, 832, 1, 1024, 3520, 3520, 3520, 832]
    - [2, 21.436]
  - - [3648, 832, 1, 1024, 3648, 3648, 3648, 832]
    - [2, 21.63]
  - - [3776, 832, 1, 1024, 3776, 3776, 3776, 832]
    - [2, 21.389]
  - - [3904, 832, 1, 1024, 3904, 3904, 3904, 832]
    - [2, 21.622]
  - - [4032, 832, 1, 1024, 4032, 4032, 4032, 832]
    - [2, 21.798]
  - - [64, 960, 1, 1024, 64, 64, 64, 960]
    - [2, 8.82]
  - - [192, 960, 1, 1024, 192, 192, 192, 960]
    - [0, 15.637]
  - - [320, 960, 1, 1024, 320, 320, 320, 960]
    - [3, 17.378]
  - - [448, 960, 1, 1024, 448, 448, 448, 960]
    - [0, 19.299]
  - - [576, 960, 1, 1024, 576, 576, 576, 960]
    - [0, 19.77]
  - - [704, 960, 1, 1024, 704, 704, 704, 960]
    - [0, 20.661]
  - - [832, 960, 1, 1024, 832, 832, 832, 960]
    - [0, 20.112]
  - - [960, 960, 1, 1024, 960, 960, 960, 960]
    - [0, 20.666]
  - - [1088, 960, 1, 1024, 1088, 1088, 1088, 960]
    - [0, 20.283]
  - - [1216, 960, 1, 1024, 1216, 1216, 1216, 960]
    - [2, 20.646]
  - - [1344, 960, 1, 1024, 1344, 1344, 1344, 960]
    - [0, 20.486]
  - - [1472, 960, 1, 1024, 1472, 1472, 1472, 960]
    - [0, 20.656]
  - - [1600, 960, 1, 1024, 1600, 1600, 1600, 960]
    - [2, 20.829]
  - - [1728, 960, 1, 1024, 1728, 1728, 1728, 960]
    - [0, 20.897]
  - - [1856, 960, 1, 1024, 1856, 1856, 1856, 960]
    - [2, 21.081]
  - - [1984, 960, 1, 1024, 1984, 1984, 1984, 960]
    - [2, 21.186]
  - - [2112, 960, 1, 1024, 2112, 2112, 2112, 960]
    - [2, 21.221]
  - - [2240, 960, 1, 1024, 2240, 2240, 2240, 960]
    - [2, 21.325]
  - - [2368, 960, 1, 1024, 2368, 2368, 2368, 960]
    - [2, 21.119]
  - - [2496, 960, 1, 1024, 2496, 2496, 2496, 960]
    - [2, 21.341]
  - - [2624, 960, 1, 1024, 2624, 2624, 2624, 960]
    - [2, 21.318]
  - - [2752, 960, 1, 1024, 2752, 2752, 2752, 960]
    - [0, 21.368]
  - - [2880, 960, 1, 1024, 2880, 2880, 2880, 960]
    - [2, 21.275]
  - - [3008, 960, 1, 1024, 3008, 3008, 3008, 960]
    - [2, 21.211]
  - - [3136, 960, 1, 1024, 3136, 3136, 3136, 960]
    - [2, 21.469]
  - - [3264, 960, 1, 1024, 3264, 3264, 3264, 960]
    - [2, 21.613]
  - - [3392, 960, 1, 1024, 3392, 3392, 3392, 960]
    - [2, 21.582]
  - - [3520, 960, 1, 1024, 3520, 3520, 3520, 960]
    - [2, 21.397]
  - - [3648, 960, 1, 1024, 3648, 3648, 3648, 960]
    - [2, 21.443]
  - - [3776, 960, 1, 1024, 3776, 3776, 3776, 960]
    - [2, 21.564]
  - - [3904, 960, 1, 1024, 3904, 3904, 3904, 960]
    - [2, 21.596]
  - - [4032, 960, 1, 1024, 4032, 4032, 4032, 960]
    - [2, 21.679]
  - - [64, 1088, 1, 1024, 64, 64, 64, 1088]
    - [0, 9.262]
  - - [192, 1088, 1, 1024, 192, 192, 192, 1088]
    - [2, 15.316]
  - - [320, 1088, 1, 1024, 320, 320, 320, 1088]
    - [3, 18.061]
  - - [448, 1088, 1, 1024, 448, 448, 448, 1088]
    - [0, 20.333]
  - - [576, 1088, 1, 1024, 576, 576, 576, 1088]
    - [0, 20.336]
  - - [704, 1088, 1, 1024, 704, 704, 704, 1088]
    - [0, 20.083]
  - - [832, 1088, 1, 1024, 832, 832, 832, 1088]
    - [0, 20.012]
  - - [960, 1088, 1, 1024, 960, 960, 960, 1088]
    - [2, 20.52]
  - - [1088, 1088, 1, 1024, 1088, 1088, 1088, 1088]
    - [2, 20.924]
  - - [1216, 1088, 1, 1024, 1216, 1216, 1216, 1088]
    - [0, 20.923]
  - - [1344, 1088, 1, 1024, 1344, 1344, 1344, 1088]
    - [2, 21.068]
  - - [1472, 1088, 1, 1024, 1472, 1472, 1472, 1088]
    - [2, 20.747]
  - - [1600, 1088, 1, 1024, 1600, 1600, 1600, 1088]
    - [2, 20.844]
  - - [1728, 1088, 1, 1024, 1728, 1728, 1728, 1088]
    - [2, 20.9]
  - - [1856, 1088, 1, 1024, 1856, 1856, 1856, 1088]
    - [2, 21.158]
  - - [1984, 1088, 1, 1024, 1984, 1984, 1984, 1088]
    - [2, 21.142]
  - - [2112, 1088, 1, 1024, 2112, 2112, 2112, 1088]
    - [2, 21.397]
  - - [2240, 1088, 1, 1024, 2240, 2240, 2240, 1088]
    - [2, 21.26]
  - - [2368, 1088, 1, 1024, 2368, 2368, 2368, 1088]
    - [2, 21.345]
  - - [2496, 1088, 1, 1024, 2496, 2496, 2496, 1088]
    - [2, 21.369]
  - - [2624, 1088, 1, 1024, 2624, 2624, 2624, 1088]
    - [2, 21.63]
  - - [2752, 1088, 1, 1024, 2752, 2752, 2752, 1088]
    - [2, 21.361]
  - - [2880, 1088, 1, 1024, 2880, 2880, 2880, 1088]
    - [2, 21.579]
  - - [3008, 1088, 1, 1024, 3008, 3008, 3008, 1088]
    - [2, 21.37]
  - - [3136, 1088, 1, 1024, 3136, 3136, 3136, 1088]
    - [2, 21.608]
  - - [3264, 1088, 1, 1024, 3264, 3264, 3264, 1088]
    - [2, 21.461]
  - - [3392, 1088, 1, 1024, 3392, 3392, 3392, 1088]
    - [2, 21.471]
  - - [3520, 1088, 1, 1024, 3520, 3520, 3520, 1088]
    - [2, 21.452]
  - - [3648, 1088, 1, 1024, 3648, 3648, 3648, 1088]
    - [2, 21.573]
  - - [3776, 1088, 1, 1024, 3776, 3776, 3776, 1088]
    - [2, 21.534]
  - - [3904, 1088, 1, 1024, 3904, 3904, 3904, 1088]
    - [2, 21.521]
  - - [4032, 1088, 1, 1024, 4032, 4032, 4032, 1088]
    - [2, 21.66]
  - - [64, 1216, 1, 1024, 64, 64, 64, 1216]
    - [0, 10.367]
  - - [192, 1216, 1, 1024, 192, 192, 192, 1216]
    - [0, 16.872]
  - - [320, 1216, 1, 1024, 320, 320, 320, 1216]
    - [0, 19.306]
  - - [448, 1216, 1, 1024, 448, 448, 448, 1216]
    - [2, 19.89]
  - - [576, 1216, 1, 1024, 576, 576, 576, 1216]
    - [2, 20.226]
  - - [704, 1216, 1, 1024, 704, 704, 704, 1216]
    - [0, 20.138]
  - - [832, 1216, 1, 1024, 832, 832, 832, 1216]
    - [0, 20.225]
  - - [960, 1216, 1, 1024, 960, 960, 960, 1216]
    - [2, 20.668]
  - - [1088, 1216, 1, 1024, 1088, 1088, 1088, 1216]
    - [0, 20.664]
  - - [1216, 1216, 1, 1024, 1216, 1216, 1216, 1216]
    - [2, 20.76]
  - - [1344, 1216, 1, 1024, 1344, 1344, 1344, 1216]
    - [2, 20.838]
  - - [1472, 1216, 1, 1024, 1472, 1472, 1472, 1216]
    - [2, 21.206]
  - - [1600, 1216, 1, 1024, 1600, 1600, 1600, 1216]
    - [0, 20.879]
  - - [1728, 1216, 1, 1024, 1728, 1728, 1728, 1216]
    - [2, 21.591]
  - - [1856, 1216, 1, 1024, 1856, 1856, 1856, 1216]
    - [0, 21.04]
  - - [1984, 1216, 1, 1024, 1984, 1984, 1984, 1216]
    - [0, 21.224]
  - - [2112, 1216, 1, 1024, 2112, 2112, 2112, 1216]
    - [2, 21.346]
  - - [2240, 1216, 1, 1024, 2240, 2240, 2240, 1216]
    - [2, 21.383]
  - - [2368, 1216, 1, 1024, 2368, 2368, 2368, 1216]
    - [2, 21.398]
  - - [2496, 1216, 1, 1024, 2496, 2496, 2496, 1216]
    - [2, 21.255]
  - - [2624, 1216, 1, 1024, 2624, 2624, 2624, 1216]
    - [2, 21.589]
  - - [2752, 1216, 1, 1024, 2752, 2752, 2752, 1216]
    - [2, 21.69]
  - - [2880, 1216, 1, 1024, 2880, 2880, 2880, 1216]
    - [2, 21.55]
  - - [3008, 1216, 1, 1024, 3008, 3008, 3008, 1216]
    - [2, 21.569]
  - - [3136, 1216, 1, 1024, 3136, 3136, 3136, 1216]
    - [2, 21.471]
  - - [3264, 1216, 1, 1024, 3264, 3264, 3264, 1216]
    - [2, 21.502]
  - - [3392, 1216, 1, 1024, 3392, 3392, 3392, 1216]
    - [2, 21.596]
  - - [3520, 1216, 1, 1024, 3520, 3520, 3520, 1216]
    - [2, 21.717]
  - - [3648, 1216, 1, 1024, 3648, 3648, 3648, 1216]
    - [2, 21.578]
  - - [3776, 1216, 1, 1024, 3776, 3776, 3776, 1216]
    - [2, 21.531]
  - - [3904, 1216, 1, 1024, 3904, 3904, 3904, 1216]
    - [2, 21.523]
  - - [4032, 1216, 1, 1024, 4032, 4032, 4032, 1216]
    - [2, 21.656]
  - - [64, 1344, 1, 1024, 64, 64, 64, 1344]
    - [0, 11.297]
  - - [192, 1344, 1, 1024, 192, 192, 192, 1344]
    - [2, 16.644]
  - - [320, 1344, 1, 1024, 320, 320, 320, 1344]
    - [0, 19.77]
  - - [448, 1344, 1, 1024, 448, 448, 448, 1344]
    - [2, 19.798]
  - - [576, 1344, 1, 1024, 576, 576, 576, 1344]
    - [0, 20.132]
  - - [704, 1344, 1, 1024, 704, 704, 704, 1344]
    - [2, 20.485]
  - - [832, 1344, 1, 1024, 832, 832, 832, 1344]
    - [0, 20.355]
  - - [960, 1344, 1, 1024, 960, 960, 960, 1344]
    - [2, 20.526]
  - - [1088, 1344, 1, 1024, 1088, 1088, 1088, 1344]
    - [2, 21.05]
  - - [1216, 1344, 1, 1024, 1216, 1216, 1216, 1344]
    - [0, 20.882]
  - - [1344, 1344, 1, 1024, 1344, 1344, 1344, 1344]
    - [2, 21.281]
  - - [1472, 1344, 1, 1024, 1472, 1472, 1472, 1344]
    - [2, 21.15]
  - - [1600, 1344, 1, 1024, 1600, 1600, 1600, 1344]
    - [0, 21.174]
  - - [1728, 1344, 1, 1024, 1728, 1728, 1728, 1344]
    - [2, 21.082]
  - - [1856, 1344, 1, 1024, 1856, 1856, 1856, 1344]
    - [2, 21.124]
  - - [1984, 1344, 1, 1024, 1984, 1984, 1984, 1344]
    - [2, 21.285]
  - - [2112, 1344, 1, 1024, 2112, 2112, 2112, 1344]
    - [2, 21.326]
  - - [2240, 1344, 1, 1024, 2240, 2240, 2240, 1344]
    - [0, 21.341]
  - - [2368, 1344, 1, 1024, 2368, 2368, 2368, 1344]
    - [2, 21.471]
  - - [2496, 1344, 1, 1024, 2496, 2496, 2496, 1344]
    - [2, 21.302]
  - - [2624, 1344, 1, 1024, 2624, 2624, 2624, 1344]
    - [2, 21.531]
  - - [2752, 1344, 1, 1024, 2752, 2752, 2752, 1344]
    - [2, 21.601]
  - - [2880, 1344, 1, 1024, 2880, 2880, 2880, 1344]
    - [2, 21.498]
  - - [3008, 1344, 1, 1024, 3008, 3008, 3008, 1344]
    - [2, 21.463]
  - - [3136, 1344, 1, 1024, 3136, 3136, 3136, 1344]
    - [2, 21.574]
  - - [3264, 1344, 1, 1024, 3264, 3264, 3264, 1344]
    - [2, 21.674]
  - - [3392, 1344, 1, 1024, 3392, 3392, 3392, 1344]
    - [2, 21.625]
  - - [3520, 1344, 1, 1024, 3520, 3520, 3520, 1344]
    - [0, 21.742]
  - - [3648, 1344, 1, 1024, 3648, 3648, 3648, 1344]
    - [2, 21.585]
  - - [3776, 1344, 1, 1024, 3776, 3776, 3776, 1344]
    - [2, 21.341]
  - - [3904, 1344, 1, 1024, 3904, 3904, 3904, 1344]
    - [2, 21.604]
  - - [4032, 1344, 1, 1024, 4032, 4032, 4032, 1344]
    - [2, 21.721]
  - - [64, 1472, 1, 1024, 64, 64, 64, 1472]
    - [0, 12.5]
  - - [192, 1472, 1, 1024, 192, 192, 192, 1472]
    - [0, 17.841]
  - - [320, 1472, 1, 1024, 320, 320, 320, 1472]
    - [0, 19.48]
  - - [448, 1472, 1, 1024, 448, 448, 448, 1472]
    - [0, 20.099]
  - - [576, 1472, 1, 1024, 576, 576, 576, 1472]
    - [3, 19.959]
  - - [704, 1472, 1, 1024, 704, 704, 704, 1472]
    - [2, 20.286]
  - - [832, 1472, 1, 1024, 832, 832, 832, 1472]
    - [2, 20.752]
  - - [960, 1472, 1, 1024, 960, 960, 960, 1472]
    - [2, 21.163]
  - - [1088, 1472, 1, 1024, 1088, 1088, 1088, 1472]
    - [2, 21.12]
  - - [1216, 1472, 1, 1024, 1216, 1216, 1216, 1472]
    - [2, 21.05]
  - - [1344, 1472, 1, 1024, 1344, 1344, 1344, 1472]
    - [2, 21.281]
  - - [1472, 1472, 1, 1024, 1472, 1472, 1472, 1472]
    - [2, 21.109]
  - - [1600, 1472, 1, 1024, 1600, 1600, 1600, 1472]
    - [2, 21.153]
  - - [1728, 1472, 1, 1024, 1728, 1728, 1728, 1472]
    - [2, 21.19]
  - - [1856, 1472, 1, 1024, 1856, 1856, 1856, 1472]
    - [2, 21.366]
  - - [1984, 1472, 1, 1024, 1984, 1984, 1984, 1472]
    - [2, 21.471]
  - - [2112, 1472, 1, 1024, 2112, 2112, 2112, 1472]
    - [2, 21.408]
  - - [2240, 1472, 1, 1024, 2240, 2240, 2240, 1472]
    - [2, 21.236]
  - - [2368, 1472, 1, 1024, 2368, 2368, 2368, 1472]
    - [2, 21.465]
  - - [2496, 1472, 1, 1024, 2496, 2496, 2496, 1472]
    - [2, 21.309]
  - - [2624, 1472, 1, 1024, 2624, 2624, 2624, 1472]
    - [2, 21.428]
  - - [2752, 1472, 1, 1024, 2752, 2752, 2752, 1472]
    - [2, 21.395]
  - - [2880, 1472, 1, 1024, 2880, 2880, 2880, 1472]
    - [2, 21.562]
  - - [3008, 1472, 1, 1024, 3008, 3008, 3008, 1472]
    - [2, 21.656]
  - - [3136, 1472, 1, 1024, 3136, 3136, 3136, 1472]
    - [0, 21.833]
  - - [3264, 1472, 1, 1024, 3264, 3264, 3264, 1472]
    - [2, 21.417]
  - - [3392, 1472, 1, 1024, 3392, 3392, 3392, 1472]
    - [2, 21.627]
  - - [3520, 1472, 1, 1024, 3520, 3520, 3520, 1472]
    - [2, 21.741]
  - - [3648, 1472, 1, 1024, 3648, 3648, 3648, 1472]
    - [2, 21.541]
  - - [3776, 1472, 1, 1024, 3776, 3776, 3776, 1472]
    - [2, 21.592]
  - - [3904, 1472, 1, 1024, 3904, 3904, 3904, 1472]
    - [2, 21.814]
  - - [4032, 1472, 1, 1024, 4032, 4032, 4032, 1472]
    - [2, 21.659]
  - - [64, 1600, 1, 1024, 64, 64, 64, 1600]
    - [2, 10.968]
  - - [192, 1600, 1, 1024, 192, 192, 192, 1600]
    - [2, 17.826]
  - - [320, 1600, 1, 1024, 320, 320, 320, 1600]
    - [2, 19.439]
  - - [448, 1600, 1, 1024, 448, 448, 448, 1600]
    - [3, 19.63]
  - - [576, 1600, 1, 1024, 576, 576, 576, 1600]
    - [0, 20.114]
  - - [704, 1600, 1, 1024, 704, 704, 704, 1600]
    - [2, 20.53]
  - - [832, 1600, 1, 1024, 832, 832, 832, 1600]
    - [0, 20.515]
  - - [960, 1600, 1, 1024, 960, 960, 960, 1600]
    - [2, 21.121]
  - - [1088, 1600, 1, 1024, 1088, 1088, 1088, 1600]
    - [2, 21.045]
  - - [1216, 1600, 1, 1024, 1216, 1216, 1216, 1600]
    - [2, 21.03]
  - - [1344, 1600, 1, 1024, 1344, 1344, 1344, 1600]
    - [2, 21.04]
  - - [1472, 1600, 1, 1024, 1472, 1472, 1472, 1600]
    - [2, 21.207]
  - - [1600, 1600, 1, 1024, 1600, 1600, 1600, 1600]
    - [2, 21.193]
  - - [1728, 1600, 1, 1024, 1728, 1728, 1728, 1600]
    - [2, 21.306]
  - - [1856, 1600, 1, 1024, 1856, 1856, 1856, 1600]
    - [2, 21.389]
  - - [1984, 1600, 1, 1024, 1984, 1984, 1984, 1600]
    - [2, 21.498]
  - - [2112, 1600, 1, 1024, 2112, 2112, 2112, 1600]
    - [2, 21.461]
  - - [2240, 1600, 1, 1024, 2240, 2240, 2240, 1600]
    - [2, 21.632]
  - - [2368, 1600, 1, 1024, 2368, 2368, 2368, 1600]
    - [2, 21.11]
  - - [2496, 1600, 1, 1024, 2496, 2496, 2496, 1600]
    - [2, 21.484]
  - - [2624, 1600, 1, 1024, 2624, 2624, 2624, 1600]
    - [2, 21.257]
  - - [2752, 1600, 1, 1024, 2752, 2752, 2752, 1600]
    - [2, 21.452]
  - - [2880, 1600, 1, 1024, 2880, 2880, 2880, 1600]
    - [2, 21.637]
  - - [3008, 1600, 1, 1024, 3008, 3008, 3008, 1600]
    - [2, 21.627]
  - - [3136, 1600, 1, 1024, 3136, 3136, 3136, 1600]
    - [2, 21.797]
  - - [3264, 1600, 1, 1024, 3264, 3264, 3264, 1600]
    - [2, 21.644]
  - - [3392, 1600, 1, 1024, 3392, 3392, 3392, 1600]
    - [2, 21.541]
  - - [3520, 1600, 1, 1024, 3520, 3520, 3520, 1600]
    - [2, 21.734]
  - - [3648, 1600, 1, 1024, 3648, 3648, 3648, 1600]
    - [2, 21.555]
  - - [3776, 1600, 1, 1024, 3776, 3776, 3776, 1600]
    - [2, 21.6]
  - - [3904, 1600, 1, 1024, 3904, 3904, 3904, 1600]
    - [2, 21.772]
  - - [4032, 1600, 1, 1024, 4032, 4032, 4032, 1600]
    - [2, 21.669]
  - - [64, 1728, 1, 1024, 64, 64, 64, 1728]
    - [2, 11.87]
  - - [192, 1728, 1, 1024, 192, 192, 192, 1728]
    - [0, 18.222]
  - - [320, 1728, 1, 1024, 320, 320, 320, 1728]
    - [2, 19.818]
  - - [448, 1728, 1, 1024, 448, 448, 448, 1728]
    - [0, 20.297]
  - - [576, 1728, 1, 1024, 576, 576, 576, 1728]
    - [2, 20.101]
  - - [704, 1728, 1, 1024, 704, 704, 704, 1728]
    - [2, 20.402]
  - - [832, 1728, 1, 1024, 832, 832, 832, 1728]
    - [2, 20.714]
  - - [960, 1728, 1, 1024, 960, 960, 960, 1728]
    - [0, 21.012]
  - - [1088, 1728, 1, 1024, 1088, 1088, 1088, 1728]
    - [2, 21.308]
  - - [1216, 1728, 1, 1024, 1216, 1216, 1216, 1728]
    - [2, 20.878]
  - - [1344, 1728, 1, 1024, 1344, 1344, 1344, 1728]
    - [2, 21.181]
  - - [1472, 1728, 1, 1024, 1472, 1472, 1472, 1728]
    - [2, 21.414]
  - - [1600, 1728, 1, 1024, 1600, 1600, 1600, 1728]
    - [2, 21.231]
  - - [1728, 1728, 1, 1024, 1728, 1728, 1728, 1728]
    - [2, 21.659]
  - - [1856, 1728, 1, 1024, 1856, 1856, 1856, 1728]
    - [2, 21.35]
  - - [1984, 1728, 1, 1024, 1984, 1984, 1984, 1728]
    - [2, 21.465]
  - - [2112, 1728, 1, 1024, 2112, 2112, 2112, 1728]
    - [2, 21.453]
  - - [2240, 1728, 1, 1024, 2240, 2240, 2240, 1728]
    - [2, 21.622]
  - - [2368, 1728, 1, 1024, 2368, 2368, 2368, 1728]
    - [2, 21.525]
  - - [2496, 1728, 1, 1024, 2496, 2496, 2496, 1728]
    - [2, 21.543]
  - - [2624, 1728, 1, 1024, 2624, 2624, 2624, 1728]
    - [2, 21.738]
  - - [2752, 1728, 1, 1024, 2752, 2752, 2752, 1728]
    - [2, 21.635]
  - - [2880, 1728, 1, 1024, 2880, 2880, 2880, 1728]
    - [2, 21.582]
  - - [3008, 1728, 1, 1024, 3008, 3008, 3008, 1728]
    - [2, 21.62]
  - - [3136, 1728, 1, 1024, 3136, 3136, 3136, 1728]
    - [2, 21.773]
  - - [3264, 1728, 1, 1024, 3264, 3264, 3264, 1728]
    - [2, 21.768]
  - - [3392, 1728, 1, 1024, 3392, 3392, 3392, 1728]
    - [2, 21.722]
  - - [3520, 1728, 1, 1024, 3520, 3520, 3520, 1728]
    - [2, 21.549]
  - - [3648, 1728, 1, 1024, 3648, 3648, 3648, 1728]
    - [2, 21.679]
  - - [3776, 1728, 1, 1024, 3776, 3776, 3776, 1728]
    - [2, 21.644]
  - - [3904, 1728, 1, 1024, 3904, 3904, 3904, 1728]
    - [2, 21.774]
  - - [4032, 1728, 1, 1024, 4032, 4032, 4032, 1728]
    - [2, 21.841]
  - - [64, 1856, 1, 1024, 64, 64, 64, 1856]
    - [2, 12.865]
  - - [192, 1856, 1, 1024, 192, 192, 192, 1856]
    - [2, 18.222]
  - - [320, 1856, 1, 1024, 320, 320, 320, 1856]
    - [2, 19.702]
  - - [448, 1856, 1, 1024, 448, 448, 448, 1856]
    - [0, 20.111]
  - - [576, 1856, 1, 1024, 576, 576, 576, 1856]
    - [0, 20.199]
  - - [704, 1856, 1, 1024, 704, 704, 704, 1856]
    - [2, 20.499]
  - - [832, 1856, 1, 1024, 832, 832, 832, 1856]
    - [0, 20.818]
  - - [960, 1856, 1, 1024, 960, 960, 960, 1856]
    - [2, 21.052]
  - - [1088, 1856, 1, 1024, 1088, 1088, 1088, 1856]
    - [0, 21.013]
  - - [1216, 1856, 1, 1024, 1216, 1216, 1216, 1856]
    - [2, 21.001]
  - - [1344, 1856, 1, 1024, 1344, 1344, 1344, 1856]
    - [2, 21.267]
  - - [1472, 1856, 1, 1024, 1472, 1472, 1472, 1856]
    - [2, 21.293]
  - - [1600, 1856, 1, 1024, 1600, 1600, 1600, 1856]
    - [2, 21.535]
  - - [1728, 1856, 1, 1024, 1728, 1728, 1728, 1856]
    - [2, 21.439]
  - - [1856, 1856, 1, 1024, 1856, 1856, 1856, 1856]
    - [2, 21.422]
  - - [1984, 1856, 1, 1024, 1984, 1984, 1984, 1856]
    - [2, 21.533]
  - - [2112, 1856, 1, 1024, 2112, 2112, 2112, 1856]
    - [0, 21.258]
  - - [2240, 1856, 1, 1024, 2240, 2240, 2240, 1856]
    - [2, 21.218]
  - - [2368, 1856, 1, 1024, 2368, 2368, 2368, 1856]
    - [2, 21.468]
  - - [2496, 1856, 1, 1024, 2496, 2496, 2496, 1856]
    - [2, 21.688]
  - - [2624, 1856, 1, 1024, 2624, 2624, 2624, 1856]
    - [2, 21.604]
  - - [2752, 1856, 1, 1024, 2752, 2752, 2752, 1856]
    - [2, 21.469]
  - - [2880, 1856, 1, 1024, 2880, 2880, 2880, 1856]
    - [0, 21.391]
  - - [3008, 1856, 1, 1024, 3008, 3008, 3008, 1856]
    - [2, 21.708]
  - - [3136, 1856, 1, 1024, 3136, 3136, 3136, 1856]
    - [2, 21.677]
  - - [3264, 1856, 1, 1024, 3264, 3264, 3264, 1856]
    - [2, 21.749]
  - - [3392, 1856, 1, 1024, 3392, 3392, 3392, 1856]
    - [2, 21.712]
  - - [3520, 1856, 1, 1024, 3520, 3520, 3520, 1856]
    - [2, 21.635]
  - - [3648, 1856, 1, 1024, 3648, 3648, 3648, 1856]
    - [2, 21.831]
  - - [3776, 1856, 1, 1024, 3776, 3776, 3776, 1856]
    - [2, 21.742]
  - - [3904, 1856, 1, 1024, 3904, 3904, 3904, 1856]
    - [2, 21.879]
  - - [4032, 1856, 1, 1024, 4032, 4032, 4032, 1856]
    - [2, 21.779]
  - - [64, 1984, 1, 1024, 64, 64, 64, 1984]
    - [0, 13.046]
  - - [192, 1984, 1, 1024, 192, 192, 192, 1984]
    - [0, 18.739]
  - - [320, 1984, 1, 1024, 320, 320, 320, 1984]
    - [0, 20.072]
  - - [448, 1984, 1, 1024, 448, 448, 448, 1984]
    - [3, 19.843]
  - - [576, 1984, 1, 1024, 576, 576, 576, 1984]
    - [2, 20.186]
  - - [704, 1984, 1, 1024, 704, 704, 704, 1984]
    - [2, 20.703]
  - - [832, 1984, 1, 1024, 832, 832, 832, 1984]
    - [2, 21.016]
  - - [960, 1984, 1, 1024, 960, 960, 960, 1984]
    - [0, 21.1]
  - - [1088, 1984, 1, 1024, 1088, 1088, 1088, 1984]
    - [2, 21.128]
  - - [1216, 1984, 1, 1024, 1216, 1216, 1216, 1984]
    - [0, 21.068]
  - - [1344, 1984, 1, 1024, 1344, 1344, 1344, 1984]
    - [2, 21.063]
  - - [1472, 1984, 1, 1024, 1472, 1472, 1472, 1984]
    - [2, 21.548]
  - - [1600, 1984, 1, 1024, 1600, 1600, 1600, 1984]
    - [2, 21.201]
  - - [1728, 1984, 1, 1024, 1728, 1728, 1728, 1984]
    - [2, 21.517]
  - - [1856, 1984, 1, 1024, 1856, 1856, 1856, 1984]
    - [2, 21.442]
  - - [1984, 1984, 1, 1024, 1984, 1984, 1984, 1984]
    - [2, 21.62]
  - - [2112, 1984, 1, 1024, 2112, 2112, 2112, 1984]
    - [0, 21.288]
  - - [2240, 1984, 1, 1024, 2240, 2240, 2240, 1984]
    - [0, 21.073]
  - - [2368, 1984, 1, 1024, 2368, 2368, 2368, 1984]
    - [2, 21.628]
  - - [2496, 1984, 1, 1024, 2496, 2496, 2496, 1984]
    - [2, 21.814]
  - - [2624, 1984, 1, 1024, 2624, 2624, 2624, 1984]
    - [2, 21.696]
  - - [2752, 1984, 1, 1024, 2752, 2752, 2752, 1984]
    - [2, 21.698]
  - - [2880, 1984, 1, 1024, 2880, 2880, 2880, 1984]
    - [2, 21.702]
  - - [3008, 1984, 1, 1024, 3008, 3008, 3008, 1984]
    - [2, 21.784]
  - - [3136, 1984, 1, 1024, 3136, 3136, 3136, 1984]
    - [2, 21.705]
  - - [3264, 1984, 1, 1024, 3264, 3264, 3264, 1984]
    - [2, 21.717]
  - - [3392, 1984, 1, 1024, 3392, 3392, 3392, 1984]
    - [2, 21.797]
  - - [3520, 1984, 1, 1024, 3520, 3520, 3520, 1984]
    - [2, 21.898]
  - - [3648, 1984, 1, 1024, 3648, 3648, 3648, 1984]
    - [2, 21.763]
  - - [3776, 1984, 1, 1024, 3776, 3776, 3776, 1984]
    - [0, 21.75]
  - - [3904, 1984, 1, 1024, 3904, 3904, 3904, 1984]
    - [2, 21.821]
  - - [4032, 1984, 1, 1024, 4032, 4032, 4032, 1984]
    - [2, 21.789]
  - - [64, 2112, 1, 1024, 64, 64, 64, 2112]
    - [0, 14.002]
  - - [192, 2112, 1, 1024, 192, 192, 192, 2112]
    - [2, 19.118]
  - - [320, 2112, 1, 1024, 320, 320, 320, 2112]
    - [0, 20.362]
  - - [448, 2112, 1, 1024, 448, 448, 448, 2112]
    - [2, 20.225]
  - - [576, 2112, 1, 1024, 576, 576, 576, 2112]
    - [3, 20.982]
  - - [704, 2112, 1, 1024, 704, 704, 704, 2112]
    - [2, 20.924]
  - - [832, 2112, 1, 1024, 832, 832, 832, 2112]
    - [2, 21.327]
  - - [960, 2112, 1, 1024, 960, 960, 960, 2112]
    - [2, 21.413]
  - - [1088, 2112, 1, 1024, 1088, 1088, 1088, 2112]
    - [2, 21.334]
  - - [1216, 2112, 1, 1024, 1216, 1216, 1216, 2112]
    - [0, 21.233]
  - - [1344, 2112, 1, 1024, 1344, 1344, 1344, 2112]
    - [2, 21.454]
  - - [1472, 2112, 1, 1024, 1472, 1472, 1472, 2112]
    - [0, 21.28]
  - - [1600, 2112, 1, 1024, 1600, 1600, 1600, 2112]
    - [2, 21.325]
  - - [1728, 2112, 1, 1024, 1728, 1728, 1728, 2112]
    - [2, 21.381]
  - - [1856, 2112, 1, 1024, 1856, 1856, 1856, 2112]
    - [2, 21.513]
  - - [1984, 2112, 1, 1024, 1984, 1984, 1984, 2112]
    - [2, 21.42]
  - - [2112, 2112, 1, 1024, 2112, 2112, 2112, 2112]
    - [2, 21.501]
  - - [2240, 2112, 1, 1024, 2240, 2240, 2240, 2112]
    - [2, 21.333]
  - - [2368, 2112, 1, 1024, 2368, 2368, 2368, 2112]
    - [2, 21.601]
  - - [2496, 2112, 1, 1024, 2496, 2496, 2496, 2112]
    - [2, 21.444]
  - - [2624, 2112, 1, 1024, 2624, 2624, 2624, 2112]
    - [2, 21.494]
  - - [2752, 2112, 1, 1024, 2752, 2752, 2752, 2112]
    - [2, 21.443]
  - - [2880, 2112, 1, 1024, 2880, 2880, 2880, 2112]
    - [2, 21.61]
  - - [3008, 2112, 1, 1024, 3008, 3008, 3008, 2112]
    - [2, 21.785]
  - - [3136, 2112, 1, 1024, 3136, 3136, 3136, 2112]
    - [2, 21.876]
  - - [3264, 2112, 1, 1024, 3264, 3264, 3264, 2112]
    - [2, 21.841]
  - - [3392, 2112, 1, 1024, 3392, 3392, 3392, 2112]
    - [2, 21.716]
  - - [3520, 2112, 1, 1024, 3520, 3520, 3520, 2112]
    - [2, 21.802]
  - - [3648, 2112, 1, 1024, 3648, 3648, 3648, 2112]
    - [2, 21.86]
  - - [3776, 2112, 1, 1024, 3776, 3776, 3776, 2112]
    - [0, 21.788]
  - - [3904, 2112, 1, 1024, 3904, 3904, 3904, 2112]
    - [2, 21.815]
  - - [4032, 2112, 1, 1024, 4032, 4032, 4032, 2112]
    - [2, 21.836]
  - - [64, 2240, 1, 1024, 64, 64, 64, 2240]
    - [0, 14.664]
  - - [192, 2240, 1, 1024, 192, 192, 192, 2240]
    - [0, 19.704]
  - - [320, 2240, 1, 1024, 320, 320, 320, 2240]
    - [0, 19.921]
  - - [448, 2240, 1, 1024, 448, 448, 448, 2240]
    - [2, 20.23]
  - - [576, 2240, 1, 1024, 576, 576, 576, 2240]
    - [2, 20.65]
  - - [704, 2240, 1, 1024, 704, 704, 704, 2240]
    - [0, 20.962]
  - - [832, 2240, 1, 1024, 832, 832, 832, 2240]
    - [2, 21.22]
  - - [960, 2240, 1, 1024, 960, 960, 960, 2240]
    - [2, 21.385]
  - - [1088, 2240, 1, 1024, 1088, 1088, 1088, 2240]
    - [2, 21.164]
  - - [1216, 2240, 1, 1024, 1216, 1216, 1216, 2240]
    - [2, 21.602]
  - - [1344, 2240, 1, 1024, 1344, 1344, 1344, 2240]
    - [2, 21.319]
  - - [1472, 2240, 1, 1024, 1472, 1472, 1472, 2240]
    - [2, 21.248]
  - - [1600, 2240, 1, 1024, 1600, 1600, 1600, 2240]
    - [2, 21.467]
  - - [1728, 2240, 1, 1024, 1728, 1728, 1728, 2240]
    - [2, 21.552]
  - - [1856, 2240, 1, 1024, 1856, 1856, 1856, 2240]
    - [2, 21.54]
  - - [1984, 2240, 1, 1024, 1984, 1984, 1984, 2240]
    - [2, 21.468]
  - - [2112, 2240, 1, 1024, 2112, 2112, 2112, 2240]
    - [2, 21.555]
  - - [2240, 2240, 1, 1024, 2240, 2240, 2240, 2240]
    - [0, 21.77]
  - - [2368, 2240, 1, 1024, 2368, 2368, 2368, 2240]
    - [2, 21.727]
  - - [2496, 2240, 1, 1024, 2496, 2496, 2496, 2240]
    - [2, 21.439]
  - - [2624, 2240, 1, 1024, 2624, 2624, 2624, 2240]
    - [2, 21.682]
  - - [2752, 2240, 1, 1024, 2752, 2752, 2752, 2240]
    - [2, 21.468]
  - - [2880, 2240, 1, 1024, 2880, 2880, 2880, 2240]
    - [2, 21.805]
  - - [3008, 2240, 1, 1024, 3008, 3008, 3008, 2240]
    - [2, 21.644]
  - - [3136, 2240, 1, 1024, 3136, 3136, 3136, 2240]
    - [2, 21.667]
  - - [3264, 2240, 1, 1024, 3264, 3264, 3264, 2240]
    - [2, 21.725]
  - - [3392, 2240, 1, 1024, 3392, 3392, 3392, 2240]
    - [2, 21.841]
  - - [3520, 2240, 1, 1024, 3520, 3520, 3520, 2240]
    - [2, 21.819]
  - - [3648, 2240, 1, 1024, 3648, 3648, 3648, 2240]
    - [2, 21.854]
  - - [3776, 2240, 1, 1024, 3776, 3776, 3776, 2240]
    - [2, 21.903]
  - - [3904, 2240, 1, 1024, 3904, 3904, 3904, 2240]
    - [0, 21.807]
  - - [4032, 2240, 1, 1024, 4032, 4032, 4032, 2240]
    - [2, 21.979]
  - - [64, 2368, 1, 1024, 64, 64, 64, 2368]
    - [2, 13.429]
  - - [192, 2368, 1, 1024, 192, 192, 192, 2368]
    - [2, 19.631]
  - - [320, 2368, 1, 1024, 320, 320, 320, 2368]
    - [0, 19.767]
  - - [448, 2368, 1, 1024, 448, 448, 448, 2368]
    - [2, 20.752]
  - - [576, 2368, 1, 1024, 576, 576, 576, 2368]
    - [2, 20.985]
  - - [704, 2368, 1, 1024, 704, 704, 704, 2368]
    - [2, 21.044]
  - - [832, 2368, 1, 1024, 832, 832, 832, 2368]
    - [2, 21.142]
  - - [960, 2368, 1, 1024, 960, 960, 960, 2368]
    - [2, 21.657]
  - - [1088, 2368, 1, 1024, 1088, 1088, 1088, 2368]
    - [2, 21.274]
  - - [1216, 2368, 1, 1024, 1216, 1216, 1216, 2368]
    - [2, 21.282]
  - - [1344, 2368, 1, 1024, 1344, 1344, 1344, 2368]
    - [2, 21.475]
  - - [1472, 2368, 1, 1024, 1472, 1472, 1472, 2368]
    - [2, 21.253]
  - - [1600, 2368, 1, 1024, 1600, 1600, 1600, 2368]
    - [2, 21.338]
  - - [1728, 2368, 1, 1024, 1728, 1728, 1728, 2368]
    - [2, 21.635]
  - - [1856, 2368, 1, 1024, 1856, 1856, 1856, 2368]
    - [2, 21.514]
  - - [1984, 2368, 1, 1024, 1984, 1984, 1984, 2368]
    - [2, 21.588]
  - - [2112, 2368, 1, 1024, 2112, 2112, 2112, 2368]
    - [2, 21.641]
  - - [2240, 2368, 1, 1024, 2240, 2240, 2240, 2368]
    - [2, 21.607]
  - - [2368, 2368, 1, 1024, 2368, 2368, 2368, 2368]
    - [2, 21.545]
  - - [2496, 2368, 1, 1024, 2496, 2496, 2496, 2368]
    - [2, 21.49]
  - - [2624, 2368, 1, 1024, 2624, 2624, 2624, 2368]
    - [2, 21.753]
  - - [2752, 2368, 1, 1024, 2752, 2752, 2752, 2368]
    - [2, 21.7]
  - - [2880, 2368, 1, 1024, 2880, 2880, 2880, 2368]
    - [2, 21.744]
  - - [3008, 2368, 1, 1024, 3008, 3008, 3008, 2368]
    - [2, 21.863]
  - - [3136, 2368, 1, 1024, 3136, 3136, 3136, 2368]
    - [2, 21.813]
  - - [3264, 2368, 1, 1024, 3264, 3264, 3264, 2368]
    - [2, 21.833]
  - - [3392, 2368, 1, 1024, 3392, 3392, 3392, 2368]
    - [2, 21.844]
  - - [3520, 2368, 1, 1024, 3520, 3520, 3520, 2368]
    - [2, 21.629]
  - - [3648, 2368, 1, 1024, 3648, 3648, 3648, 2368]
    - [2, 21.818]
  - - [3776, 2368, 1, 1024, 3776, 3776, 3776, 2368]
    - [0, 21.659]
  - - [3904, 2368, 1, 1024, 3904, 3904, 3904, 2368]
    - [2, 21.979]
  - - [4032, 2368, 1, 1024, 4032, 4032, 4032, 2368]
    - [2, 22.133]
  - - [64, 2496, 1, 1024, 64, 64, 64, 2496]
    - [2, 13.845]
  - - [192, 2496, 1, 1024, 192, 192, 192, 2496]
    - [0, 20.002]
  - - [320, 2496, 1, 1024, 320, 320, 320, 2496]
    - [2, 19.774]
  - - [448, 2496, 1, 1024, 448, 448, 448, 2496]
    - [2, 20.551]
  - - [576, 2496, 1, 1024, 576, 576, 576, 2496]
    - [2, 20.977]
  - - [704, 2496, 1, 1024, 704, 704, 704, 2496]
    - [2, 20.801]
  - - [832, 2496, 1, 1024, 832, 832, 832, 2496]
    - [2, 21.031]
  - - [960, 2496, 1, 1024, 960, 960, 960, 2496]
    - [2, 21.294]
  - - [1088, 2496, 1, 1024, 1088, 1088, 1088, 2496]
    - [2, 21.259]
  - - [1216, 2496, 1, 1024, 1216, 1216, 1216, 2496]
    - [2, 21.365]
  - - [1344, 2496, 1, 1024, 1344, 1344, 1344, 2496]
    - [2, 21.481]
  - - [1472, 2496, 1, 1024, 1472, 1472, 1472, 2496]
    - [2, 21.323]
  - - [1600, 2496, 1, 1024, 1600, 1600, 1600, 2496]
    - [2, 21.5]
  - - [1728, 2496, 1, 1024, 1728, 1728, 1728, 2496]
    - [2, 21.533]
  - - [1856, 2496, 1, 1024, 1856, 1856, 1856, 2496]
    - [2, 21.595]
  - - [1984, 2496, 1, 1024, 1984, 1984, 1984, 2496]
    - [2, 21.55]
  - - [2112, 2496, 1, 1024, 2112, 2112, 2112, 2496]
    - [2, 21.475]
  - - [2240, 2496, 1, 1024, 2240, 2240, 2240, 2496]
    - [2, 21.733]
  - - [2368, 2496, 1, 1024, 2368, 2368, 2368, 2496]
    - [2, 21.682]
  - - [2496, 2496, 1, 1024, 2496, 2496, 2496, 2496]
    - [2, 21.708]
  - - [2624, 2496, 1, 1024, 2624, 2624, 2624, 2496]
    - [2, 21.826]
  - - [2752, 2496, 1, 1024, 2752, 2752, 2752, 2496]
    - [2, 21.668]
  - - [2880, 2496, 1, 1024, 2880, 2880, 2880, 2496]
    - [2, 21.737]
  - - [3008, 2496, 1, 1024, 3008, 3008, 3008, 2496]
    - [2, 21.792]
  - - [3136, 2496, 1, 1024, 3136, 3136, 3136, 2496]
    - [2, 21.831]
  - - [3264, 2496, 1, 1024, 3264, 3264, 3264, 2496]
    - [2, 21.818]
  - - [3392, 2496, 1, 1024, 3392, 3392, 3392, 2496]
    - [2, 21.868]
  - - [3520, 2496, 1, 1024, 3520, 3520, 3520, 2496]
    - [2, 21.982]
  - - [3648, 2496, 1, 1024, 3648, 3648, 3648, 2496]
    - [2, 21.961]
  - - [3776, 2496, 1, 1024, 3776, 3776, 3776, 2496]
    - [0, 21.72]
  - - [3904, 2496, 1, 1024, 3904, 3904, 3904, 2496]
    - [2, 21.973]
  - - [4032, 2496, 1, 1024, 4032, 4032, 4032, 2496]
    - [2, 22.021]
  - - [64, 2624, 1, 1024, 64, 64, 64, 2624]
    - [2, 14.422]
  - - [192, 2624, 1, 1024, 192, 192, 192, 2624]
    - [2, 19.811]
  - - [320, 2624, 1, 1024, 320, 320, 320, 2624]
    - [0, 20.226]
  - - [448, 2624, 1, 1024, 448, 448, 448, 2624]
    - [0, 20.368]
  - - [576, 2624, 1, 1024, 576, 576, 576, 2624]
    - [0, 20.516]
  - - [704, 2624, 1, 1024, 704, 704, 704, 2624]
    - [2, 20.874]
  - - [832, 2624, 1, 1024, 832, 832, 832, 2624]
    - [2, 21.308]
  - - [960, 2624, 1, 1024, 960, 960, 960, 2624]
    - [2, 21.214]
  - - [1088, 2624, 1, 1024, 1088, 1088, 1088, 2624]
    - [0, 21.429]
  - - [1216, 2624, 1, 1024, 1216, 1216, 1216, 2624]
    - [2, 21.476]
  - - [1344, 2624, 1, 1024, 1344, 1344, 1344, 2624]
    - [2, 21.341]
  - - [1472, 2624, 1, 1024, 1472, 1472, 1472, 2624]
    - [2, 21.542]
  - - [1600, 2624, 1, 1024, 1600, 1600, 1600, 2624]
    - [2, 21.649]
  - - [1728, 2624, 1, 1024, 1728, 1728, 1728, 2624]
    - [2, 21.712]
  - - [1856, 2624, 1, 1024, 1856, 1856, 1856, 2624]
    - [2, 21.481]
  - - [1984, 2624, 1, 1024, 1984, 1984, 1984, 2624]
    - [2, 21.691]
  - - [2112, 2624, 1, 1024, 2112, 2112, 2112, 2624]
    - [2, 21.671]
  - - [2240, 2624, 1, 1024, 2240, 2240, 2240, 2624]
    - [2, 21.656]
  - - [2368, 2624, 1, 1024, 2368, 2368, 2368, 2624]
    - [2, 21.73]
  - - [2496, 2624, 1, 1024, 2496, 2496, 2496, 2624]
    - [2, 21.719]
  - - [2624, 2624, 1, 1024, 2624, 2624, 2624, 2624]
    - [2, 21.697]
  - - [2752, 2624, 1, 1024, 2752, 2752, 2752, 2624]
    - [2, 21.694]
  - - [2880, 2624, 1, 1024, 2880, 2880, 2880, 2624]
    - [2, 21.839]
  - - [3008, 2624, 1, 1024, 3008, 3008, 3008, 2624]
    - [2, 21.815]
  - - [3136, 2624, 1, 1024, 3136, 3136, 3136, 2624]
    - [2, 21.881]
  - - [3264, 2624, 1, 1024, 3264, 3264, 3264, 2624]
    - [2, 21.911]
  - - [3392, 2624, 1, 1024, 3392, 3392, 3392, 2624]
    - [2, 21.911]
  - - [3520, 2624, 1, 1024, 3520, 3520, 3520, 2624]
    - [2, 22.023]
  - - [3648, 2624, 1, 1024, 3648, 3648, 3648, 2624]
    - [2, 21.981]
  - - [3776, 2624, 1, 1024, 3776, 3776, 3776, 2624]
    - [2, 21.96]
  - - [3904, 2624, 1, 1024, 3904, 3904, 3904, 2624]
    - [2, 22.019]
  - - [4032, 2624, 1, 1024, 4032, 4032, 4032, 2624]
    - [2, 22.03]
  - - [64, 2752, 1, 1024, 64, 64, 64, 2752]
    - [2, 14.639]
  - - [192, 2752, 1, 1024, 192, 192, 192, 2752]
    - [0, 20.14]
  - - [320, 2752, 1, 1024, 320, 320, 320, 2752]
    - [2, 20.208]
  - - [448, 2752, 1, 1024, 448, 448, 448, 2752]
    - [2, 20.604]
  - - [576, 2752, 1, 1024, 576, 576, 576, 2752]
    - [2, 21.123]
  - - [704, 2752, 1, 1024, 704, 704, 704, 2752]
    - [2, 20.989]
  - - [832, 2752, 1, 1024, 832, 832, 832, 2752]
    - [2, 21.155]
  - - [960, 2752, 1, 1024, 960, 960, 960, 2752]
    - [2, 21.268]
  - - [1088, 2752, 1, 1024, 1088, 1088, 1088, 2752]
    - [2, 21.416]
  - - [1216, 2752, 1, 1024, 1216, 1216, 1216, 2752]
    - [2, 21.496]
  - - [1344, 2752, 1, 1024, 1344, 1344, 1344, 2752]
    - [2, 21.523]
  - - [1472, 2752, 1, 1024, 1472, 1472, 1472, 2752]
    - [2, 21.371]
  - - [1600, 2752, 1, 1024, 1600, 1600, 1600, 2752]
    - [2, 21.668]
  - - [1728, 2752, 1, 1024, 1728, 1728, 1728, 2752]
    - [2, 21.583]
  - - [1856, 2752, 1, 1024, 1856, 1856, 1856, 2752]
    - [2, 21.8]
  - - [1984, 2752, 1, 1024, 1984, 1984, 1984, 2752]
    - [2, 21.58]
  - - [2112, 2752, 1, 1024, 2112, 2112, 2112, 2752]
    - [2, 21.764]
  - - [2240, 2752, 1, 1024, 2240, 2240, 2240, 2752]
    - [2, 21.778]
  - - [2368, 2752, 1, 1024, 2368, 2368, 2368, 2752]
    - [2, 21.781]
  - - [2496, 2752, 1, 1024, 2496, 2496, 2496, 2752]
    - [2, 21.704]
  - - [2624, 2752, 1, 1024, 2624, 2624, 2624, 2752]
    - [2, 21.766]
  - - [2752, 2752, 1, 1024, 2752, 2752, 2752, 2752]
    - [2, 21.921]
  - - [2880, 2752, 1, 1024, 2880, 2880, 2880, 2752]
    - [2, 21.71]
  - - [3008, 2752, 1, 1024, 3008, 3008, 3008, 2752]
    - [2, 21.847]
  - - [3136, 2752, 1, 1024, 3136, 3136, 3136, 2752]
    - [2, 21.983]
  - - [3264, 2752, 1, 1024, 3264, 3264, 3264, 2752]
    - [2, 21.871]
  - - [3392, 2752, 1, 1024, 3392, 3392, 3392, 2752]
    - [2, 21.853]
  - - [3520, 2752, 1, 1024, 3520, 3520, 3520, 2752]
    - [2, 21.965]
  - - [3648, 2752, 1, 1024, 3648, 3648, 3648, 2752]
    - [2, 21.911]
  - - [3776, 2752, 1, 1024, 3776, 3776, 3776, 2752]
    - [2, 21.864]
  - - [3904, 2752, 1, 1024, 3904, 3904, 3904, 2752]
    - [2, 22.006]
  - - [4032, 2752, 1, 1024, 4032, 4032, 4032, 2752]
    - [2, 22.138]
  - - [64, 2880, 1, 1024, 64, 64, 64, 2880]
    - [0, 15.461]
  - - [192, 2880, 1, 1024, 192, 192, 192, 2880]
    - [2, 19.632]
  - - [320, 2880, 1, 1024, 320, 320, 320, 2880]
    - [2, 20.43]
  - - [448, 2880, 1, 1024, 448, 448, 448, 2880]
    - [2, 20.958]
  - - [576, 2880, 1, 1024, 576, 576, 576, 2880]
    - [2, 21.812]
  - - [704, 2880, 1, 1024, 704, 704, 704, 2880]
    - [0, 21.204]
  - - [832, 2880, 1, 1024, 832, 832, 832, 2880]
    - [2, 21.276]
  - - [960, 2880, 1, 1024, 960, 960, 960, 2880]
    - [2, 21.285]
  - - [1088, 2880, 1, 1024, 1088, 1088, 1088, 2880]
    - [2, 21.379]
  - - [1216, 2880, 1, 1024, 1216, 1216, 1216, 2880]
    - [2, 21.472]
  - - [1344, 2880, 1, 1024, 1344, 1344, 1344, 2880]
    - [2, 21.477]
  - - [1472, 2880, 1, 1024, 1472, 1472, 1472, 2880]
    - [2, 21.552]
  - - [1600, 2880, 1, 1024, 1600, 1600, 1600, 2880]
    - [2, 21.541]
  - - [1728, 2880, 1, 1024, 1728, 1728, 1728, 2880]
    - [2, 21.628]
  - - [1856, 2880, 1, 1024, 1856, 1856, 1856, 2880]
    - [2, 21.664]
  - - [1984, 2880, 1, 1024, 1984, 1984, 1984, 2880]
    - [2, 21.607]
  - - [2112, 2880, 1, 1024, 2112, 2112, 2112, 2880]
    - [2, 21.685]
  - - [2240, 2880, 1, 1024, 2240, 2240, 2240, 2880]
    - [2, 21.697]
  - - [2368, 2880, 1, 1024, 2368, 2368, 2368, 2880]
    - [2, 21.757]
  - - [2496, 2880, 1, 1024, 2496, 2496, 2496, 2880]
    - [2, 21.659]
  - - [2624, 2880, 1, 1024, 2624, 2624, 2624, 2880]
    - [2, 21.757]
  - - [2752, 2880, 1, 1024, 2752, 2752, 2752, 2880]
    - [0, 21.679]
  - - [2880, 2880, 1, 1024, 2880, 2880, 2880, 2880]
    - [2, 21.789]
  - - [3008, 2880, 1, 1024, 3008, 3008, 3008, 2880]
    - [2, 21.939]
  - - [3136, 2880, 1, 1024, 3136, 3136, 3136, 2880]
    - [2, 21.974]
  - - [3264, 2880, 1, 1024, 3264, 3264, 3264, 2880]
    - [2, 21.836]
  - - [3392, 2880, 1, 1024, 3392, 3392, 3392, 2880]
    - [2, 22.06]
  - - [3520, 2880, 1, 1024, 3520, 3520, 3520, 2880]
    - [2, 22.091]
  - - [3648, 2880, 1, 1024, 3648, 3648, 3648, 2880]
    - [2, 21.959]
  - - [3776, 2880, 1, 1024, 3776, 3776, 3776, 2880]
    - [0, 21.96]
  - - [3904, 2880, 1, 1024, 3904, 3904, 3904, 2880]
    - [2, 22.045]
  - - [4032, 2880, 1, 1024, 4032, 4032, 4032, 2880]
    - [0, 22.05]
  - - [64, 3008, 1, 1024, 64, 64, 64, 3008]
    - [0, 15.775]
  - - [192, 3008, 1, 1024, 192, 192, 192, 3008]
    - [0, 21.013]
  - - [320, 3008, 1, 1024, 320, 320, 320, 3008]
    - [2, 20.433]
  - - [448, 3008, 1, 1024, 448, 448, 448, 3008]
    - [2, 21.437]
  - - [576, 3008, 1, 1024, 576, 576, 576, 3008]
    - [2, 20.841]
  - - [704, 3008, 1, 1024, 704, 704, 704, 3008]
    - [2, 21.082]
  - - [832, 3008, 1, 1024, 832, 832, 832, 3008]
    - [2, 21.258]
  - - [960, 3008, 1, 1024, 960, 960, 960, 3008]
    - [2, 21.34]
  - - [1088, 3008, 1, 1024, 1088, 1088, 1088, 3008]
    - [2, 21.31]
  - - [1216, 3008, 1, 1024, 1216, 1216, 1216, 3008]
    - [2, 21.306]
  - - [1344, 3008, 1, 1024, 1344, 1344, 1344, 3008]
    - [2, 21.584]
  - - [1472, 3008, 1, 1024, 1472, 1472, 1472, 3008]
    - [2, 21.616]
  - - [1600, 3008, 1, 1024, 1600, 1600, 1600, 3008]
    - [2, 21.445]
  - - [1728, 3008, 1, 1024, 1728, 1728, 1728, 3008]
    - [2, 21.582]
  - - [1856, 3008, 1, 1024, 1856, 1856, 1856, 3008]
    - [2, 21.747]
