library/src/amd_detail/rocblaslt/src/Tensile/Logic/asm_full/navi31/GridBased/navi31_Cijk_Ailk_Bljk_I8II_BH_HAI_SAV_UserArgs.yaml
- {MinimumRequiredVersion: 4.33.0}
- navi31
- gfx1100
- [Device 73f0]
    SolutionIndex: 0
    SolutionNameMin: Cijk_Ailk_Bljk_I8II_BH_HAI_SAV_UserArgs_MT128x48x32_MI16x16x1_SN_GRVWB4_GSU1_LBSPPA2048_LBSPPB128_LPB32_MIWT2_3_NLCA1_SS1_SU32_SUM0_SUS256_TLDS1_WG64_2_1_WGM8
    SolutionIndex: 1
    SolutionNameMin: Cijk_Ailk_Bljk_I8II_BH_HAI_SAV_UserArgs_MT64x96x32_MI16x16x1_SN_GRVWB8_GSU1_LBSPPA1024_LBSPPB128_LPB32_MIWT2_3_NLCA1_SS1_SU32_SUM0_SUS256_TLDS1_WG32_4_1_WGM8
    SolutionIndex: 2
    SolutionNameMin: Cijk_Ailk_Bljk_I8II_BH_HAI_SAV_UserArgs_MT48x192x32_MI16x16x1_SN_GRVWB16_GSU1_LBSPPA768_LBSPPB128_LPB32_MIWT3_3_NLCA3_SS1_SU32_SUM0_SUS256_TLDS1_WG16_8_1_WGM8
    SolutionIndex: 3
    SolutionNameMin: Cijk_Ailk_Bljk_I8II_BH_HAI_SAV_UserArgs_MT32x32x64_MI16x16x1_SN_GRVWB16_GSU1_LBSPPA512_LBSPPB128_LPB32_MIWT1_1_NLCA1_SS1_SU32_SUM0_SUS256_TLDS1_WG32_4_1_WGM8
    SolutionIndex: 4
    SolutionNameMin: Cijk_Ailk_Bljk_I8II_BH_HAI_SAV_UserArgs_MT64x48x64_MI16x16x1_SN_GRVWB8_GSU1_LBSPPA1024_LBSPPB128_LPB32_MIWT1_3_NLCA1_SS1_SU32_SUM0_SUS256_TLDS1_WG64_2_1_WGM8
    SolutionIndex: 5
    SolutionNameMin: Cijk_Ailk_Bljk_I8II_BH_HAI_SAV_UserArgs_MT16x64x64_MI16x16x1_SN_GRVWB16_GSU1_LBSPPA256_LBSPPB128_LPB32_MIWT1_1_NLCA1_SS1_SU32_SUM0_SUS256_TLDS1_WG16_8_1_WGM8
- - - [64, 64, 1, 64, 64, 64, 64, 64]
    - [5, 117.729]
  - - [128, 128, 1, 128, 128, 128, 128, 128]
    - [3, 849.349]
  - - [256, 256, 1, 256, 256, 256, 256, 256]
    - [3, 6044.1]
  - - [512, 512, 1, 512, 512, 512, 512, 512]
    - [4, 27341.8]
  - - [1024, 1024, 1, 1024, 1024, 1024, 1024, 1024]
    - [0, 61039.4]
  - - [1536, 1536, 1, 1536, 1536, 1536, 1536, 1536]
    - [0, 71896.1]
  - - [2048, 2048, 1, 2048, 2048, 2048, 2048, 2048]
    - [2, 68227.1]
  - - [2560, 2560, 1, 2560, 2560, 2560, 2560, 2560]
    - [0, 69347.5]
  - - [3072, 3072, 1, 3072, 3072, 3072, 3072, 3072]
    - [1, 73449.4]
  - - [3584, 3584, 1, 3584, 3584, 3584, 3584, 3584]
    - [2, 76194.5]
  - - [4096, 4096, 1, 4096, 4096, 4096, 4096, 4096]
    - [1, 76540.3]
- null
- null
- DeviceEfficiency
- GridBased
