library/src/amd_detail/rocblaslt/src/Tensile/Logic/asm_full/navi31/GridBased/navi31_Cijk_Alik_Bjlk_BBS_BH_Bias_HAS_SAV_UserArgs.yaml
- {MinimumRequiredVersion: 4.33.0}
- navi31
- gfx1100
- [Device 73f0]
    SolutionIndex: 0
    SolutionNameMin: Cijk_Alik_Bjlk_BBS_BH_Bias_AuxB_HAS_SAV_UserArgs_MT32x32x32_MI16x16x1_SN_LDSB0_GRVWA8_GRVWB8_GSU1_LBSPPA1024_LBSPPB1024_MIWT1_1_NLCB1_SS0_SU32_SUM0_SUS256_TLDS0_WG32_4_1_WGM8
    SolutionIndex: 1
    SolutionNameMin: Cijk_Alik_Bjlk_BBS_BH_Bias_AuxB_HAS_SAV_UserArgs_MT32x32x32_MI16x16x1_SN_LDSB0_GRVWA8_GRVWB8_GSU1_LBSPPA128_LBSPPB1024_MIWT1_1_NLCB1_SS0_SU32_SUM0_SUS256_TLDS1_WG32_4_1_WGM8
    SolutionIndex: 2
    SolutionNameMin: Cijk_Alik_Bjlk_BBS_BH_Bias_AuxB_HAS_SAV_UserArgs_MT32x32x32_MI16x16x1_SN_LDSB0_GRVWA8_GRVWB1_GSU1_LBSPPA128_LBSPPB1024_MIWT1_1_NLCB1_SS0_SU32_SUM0_SUS256_TLDS1_WG32_4_1_WGM8
    SolutionIndex: 3
    SolutionNameMin: Cijk_Alik_Bjlk_BBS_BH_Bias_AuxB_HAS_SAV_UserArgs_MT32x32x32_MI16x16x1_SN_LDSB0_GRVWA8_GRVWB8_GSU4_LBSPPA128_LBSPPB1024_MIWT1_1_NLCB1_SS0_SU32_SUM0_SUS256_TLDS1_WG32_4_1_WGM8
    SolutionIndex: 4
    SolutionNameMin: Cijk_Alik_Bjlk_BBS_BH_Bias_AuxB_HAS_SAV_UserArgs_MT16x64x32_MI16x16x1_SN_LDSB0_GRVWA4_GRVWB8_GSU1_LBSPPA128_LBSPPB2048_MIWT1_1_NLCB1_SS0_SU32_SUM0_SUS256_TLDS1_WG16_8_1_WGM8
    SolutionIndex: 5
    SolutionNameMin: Cijk_Alik_Bjlk_BBS_BH_Bias_AuxB_HAS_SAV_UserArgs_MT96x96x32_MI16x16x1_SN_LDSB0_GRVWA8_GRVWB8_GSU1_LBSPPA128_LBSPPB3072_MIWT3_3_NLCB3_SS0_SU32_SUM0_SUS256_TLDS1_WG32_4_1_WGM8
    SolutionIndex: 6
    SolutionNameMin: Cijk_Alik_Bjlk_BBS_BH_Bias_AuxB_HAS_SAV_UserArgs_MT16x64x64_MI16x16x1_SN_LDSB0_GRVWA8_GRVWB8_GSU1_LBSPPA128_LBSPPB2048_MIWT1_1_NLCB1_SS0_SU32_SUM0_SUS256_TLDS1_WG16_8_1_WGM8
    SolutionIndex: 7
    SolutionNameMin: Cijk_Alik_Bjlk_BBS_BH_Bias_AuxB_HAS_SAV_UserArgs_MT16x64x64_MI16x16x1_SN_LDSB0_GRVWA8_GRVWB1_GSU1_LBSPPA128_LBSPPB2048_MIWT1_1_NLCB1_SS0_SU32_SUM0_SUS256_TLDS1_WG16_8_1_WGM8
    SolutionIndex: 8
    SolutionNameMin: Cijk_Alik_Bjlk_BBS_BH_Bias_AuxB_HAS_SAV_UserArgs_MT16x64x64_MI16x16x1_SN_LDSB0_GRVWA8_GRVWB8_GSU4_LBSPPA128_LBSPPB2048_MIWT1_1_NLCB1_SS0_SU32_SUM0_SUS256_TLDS1_WG16_8_1_WGM8
    SolutionIndex: 9
    SolutionNameMin: Cijk_Alik_Bjlk_BBS_BH_Bias_AuxB_HAS_SAV_UserArgs_MT64x16x32_MI16x16x1_SN_LDSB0_GRVWA1_GRVWB2_GSU1_LBSPPA128_LBSPPB512_MIWT1_1_NLCB1_SS1_SU32_SUM0_SUS256_TLDS1_WG64_2_1_WGM8
    SolutionIndex: 10
    SolutionNameMin: Cijk_Alik_Bjlk_BBS_BH_Bias_AuxB_HAS_SAV_UserArgs_MT64x16x32_MI16x16x1_SN_LDSB0_GRVWA8_GRVWB1_GSU1_LBSPPA2048_LBSPPB512_MIWT1_1_NLCB1_SS1_SU32_SUM0_SUS256_TLDS0_WG64_2_1_WGM8
    SolutionIndex: 11
    SolutionNameMin: Cijk_Alik_Bjlk_BBS_BH_Bias_AuxB_HAS_SAV_UserArgs_MT64x16x32_MI16x16x1_SN_LDSB0_GRVWA1_GRVWB1_GSU1_LBSPPA128_LBSPPB512_MIWT1_1_NLCB1_SS1_SU32_SUM0_SUS256_TLDS1_WG64_2_1_WGM8
    SolutionIndex: 12
    SolutionNameMin: Cijk_Alik_Bjlk_BBS_BH_Bias_AuxB_HAS_SAV_UserArgs_MT64x16x32_MI16x16x1_SN_LDSB0_GRVWA1_GRVWB1_GSU4_LBSPPA128_LBSPPB512_MIWT1_1_NLCB1_SS1_SU32_SUM0_SUS256_TLDS1_WG64_2_1_WGM8
    SolutionIndex: 13
    SolutionNameMin: Cijk_Alik_Bjlk_BBS_BH_Bias_AuxB_HAS_SAV_UserArgs_MT256x16x32_MI16x16x1_SN_LDSB1_GRVWA8_GRVWB1_GSU1_LBSPPA8192_LBSPPB512_MIWT4_1_NLCB1_SS1_SU32_SUM0_SUS256_TLDS0_WG64_2_1_WGM8
    SolutionIndex: 14
    SolutionNameMin: Cijk_Alik_Bjlk_BBS_BH_Bias_AuxB_HAS_SAV_UserArgs_MT32x32x32_MI16x16x1_SN_LDSB0_GRVWA8_GRVWB2_GSU1_LBSPPA1024_LBSPPB1024_MIWT1_1_NLCB1_SS1_SU32_SUM0_SUS256_TLDS0_WG32_4_1_WGM8
    SolutionIndex: 15
    SolutionNameMin: Cijk_Alik_Bjlk_BBS_BH_Bias_AuxB_HAS_SAV_UserArgs_MT32x32x32_MI16x16x1_SN_LDSB0_GRVWA8_GRVWB2_GSU1_LBSPPA128_LBSPPB1024_MIWT1_1_NLCB1_SS1_SU32_SUM0_SUS256_TLDS1_WG32_4_1_WGM8
    SolutionIndex: 16
    SolutionNameMin: Cijk_Alik_Bjlk_BBS_BH_Bias_AuxB_HAS_SAV_UserArgs_MT32x32x32_MI16x16x1_SN_LDSB0_GRVWA1_GRVWB2_GSU1_LBSPPA1024_LBSPPB1024_MIWT1_1_NLCB1_SS1_SU32_SUM0_SUS256_TLDS0_WG32_4_1_WGM8
    SolutionIndex: 17
    SolutionNameMin: Cijk_Alik_Bjlk_BBS_BH_Bias_AuxB_HAS_SAV_UserArgs_MT32x32x32_MI16x16x1_SN_LDSB0_GRVWA8_GRVWB1_GSU1_LBSPPA1024_LBSPPB1024_MIWT1_1_NLCB1_SS1_SU32_SUM0_SUS256_TLDS0_WG32_4_1_WGM8
    SolutionIndex: 18
    SolutionNameMin: Cijk_Alik_Bjlk_BBS_BH_Bias_AuxB_HAS_SAV_UserArgs_MT32x32x32_MI16x16x1_SN_LDSB0_GRVWA8_GRVWB1_GSU1_LBSPPA128_LBSPPB1024_MIWT1_1_NLCB1_SS1_SU32_SUM0_SUS256_TLDS1_WG32_4_1_WGM8
    SolutionIndex: 19
    SolutionNameMin: Cijk_Alik_Bjlk_BBS_BH_Bias_AuxB_HAS_SAV_UserArgs_MT32x32x32_MI16x16x1_SN_LDSB0_GRVWA1_GRVWB1_GSU1_LBSPPA128_LBSPPB1024_MIWT1_1_NLCB1_SS1_SU32_SUM0_SUS256_TLDS1_WG32_4_1_WGM8
    SolutionIndex: 20
    SolutionNameMin: Cijk_Alik_Bjlk_BBS_BH_Bias_AuxB_HAS_SAV_UserArgs_MT32x32x32_MI16x16x1_SN_LDSB0_GRVWA8_GRVWB2_GSU4_LBSPPA128_LBSPPB1024_MIWT1_1_NLCB1_SS1_SU32_SUM0_SUS256_TLDS1_WG32_4_1_WGM8
    SolutionIndex: 21
    SolutionNameMin: Cijk_Alik_Bjlk_BBS_BH_Bias_AuxB_HAS_SAV_UserArgs_MT64x32x32_MI16x16x1_SN_LDSB0_GRVWA8_GRVWB2_GSU1_LBSPPA2048_LBSPPB1024_MIWT2_1_NLCB1_SS1_SU32_SUM0_SUS256_TLDS0_WG32_4_1_WGM8
    SolutionIndex: 22
    SolutionNameMin: Cijk_Alik_Bjlk_BBS_BH_Bias_AuxB_HAS_SAV_UserArgs_MT64x32x32_MI16x16x1_SN_LDSB0_GRVWA8_GRVWB1_GSU1_LBSPPA2048_LBSPPB1024_MIWT2_1_NLCB1_SS1_SU32_SUM0_SUS256_TLDS0_WG32_4_1_WGM8
    SolutionIndex: 23
    SolutionNameMin: Cijk_Alik_Bjlk_BBS_BH_Bias_AuxB_HAS_SAV_UserArgs_MT96x32x32_MI16x16x1_SN_LDSB0_GRVWA8_GRVWB2_GSU1_LBSPPA128_LBSPPB1024_MIWT3_1_NLCB1_SS1_SU32_SUM0_SUS256_TLDS1_WG32_4_1_WGM8
    SolutionIndex: 24
    SolutionNameMin: Cijk_Alik_Bjlk_BBS_BH_Bias_AuxB_HAS_SAV_UserArgs_MT96x32x32_MI16x16x1_SN_LDSB0_GRVWA8_GRVWB1_GSU1_LBSPPA128_LBSPPB1024_MIWT3_1_NLCB1_SS1_SU32_SUM0_SUS256_TLDS1_WG32_4_1_WGM8
    SolutionIndex: 25
    SolutionNameMin: Cijk_Alik_Bjlk_BBS_BH_Bias_AuxB_HAS_SAV_UserArgs_MT160x32x32_MI16x16x1_SN_LDSB0_GRVWA8_GRVWB2_GSU1_LBSPPA128_LBSPPB1024_MIWT5_1_NLCB1_SS1_SU32_SUM0_SUS256_TLDS1_WG32_4_1_WGM8
    SolutionIndex: 26
    SolutionNameMin: Cijk_Alik_Bjlk_BBS_BH_Bias_AuxB_HAS_SAV_UserArgs_MT224x32x32_MI16x16x1_SN_LDSB1_GRVWA8_GRVWB1_GSU1_LBSPPA128_LBSPPB1024_MIWT7_1_NLCB1_SS1_SU32_SUM0_SUS256_TLDS1_WG32_4_1_WGM8
    SolutionIndex: 27
    SolutionNameMin: Cijk_Alik_Bjlk_BBS_BH_Bias_AuxB_HAS_SAV_UserArgs_MT64x48x32_MI16x16x1_SN_LDSB0_GRVWA8_GRVWB2_GSU1_LBSPPA2048_LBSPPB1536_MIWT1_3_NLCB3_SS1_SU32_SUM0_SUS256_TLDS0_WG64_2_1_WGM8
    SolutionIndex: 28
    SolutionNameMin: Cijk_Alik_Bjlk_BBS_BH_Bias_AuxB_HAS_SAV_UserArgs_MT64x48x32_MI16x16x1_SN_LDSB0_GRVWA8_GRVWB1_GSU1_LBSPPA2048_LBSPPB1536_MIWT1_3_NLCB3_SS1_SU32_SUM0_SUS256_TLDS0_WG64_2_1_WGM8
    SolutionIndex: 29
    SolutionNameMin: Cijk_Alik_Bjlk_BBS_BH_Bias_AuxB_HAS_SAV_UserArgs_MT128x48x32_MI16x16x1_SN_LDSB0_GRVWA8_GRVWB2_GSU1_LBSPPA4096_LBSPPB1536_MIWT2_3_NLCB3_SS1_SU32_SUM0_SUS256_TLDS0_WG64_2_1_WGM8
    SolutionIndex: 30
    SolutionNameMin: Cijk_Alik_Bjlk_BBS_BH_Bias_AuxB_HAS_SAV_UserArgs_MT128x48x32_MI16x16x1_SN_LDSB0_GRVWA8_GRVWB1_GSU1_LBSPPA4096_LBSPPB1536_MIWT2_3_NLCB3_SS1_SU32_SUM0_SUS256_TLDS0_WG64_2_1_WGM8
    SolutionIndex: 31
    SolutionNameMin: Cijk_Alik_Bjlk_BBS_BH_Bias_AuxB_HAS_SAV_UserArgs_MT16x64x32_MI16x16x1_SN_LDSB0_GRVWA4_GRVWB2_GSU1_LBSPPA128_LBSPPB2048_MIWT1_1_NLCB1_SS1_SU32_SUM0_SUS256_TLDS1_WG16_8_1_WGM8
    SolutionIndex: 32
    SolutionNameMin: Cijk_Alik_Bjlk_BBS_BH_Bias_AuxB_HAS_SAV_UserArgs_MT16x64x32_MI16x16x1_SN_LDSB0_GRVWA4_GRVWB1_GSU1_LBSPPA512_LBSPPB2048_MIWT1_1_NLCB1_SS1_SU32_SUM0_SUS256_TLDS0_WG16_8_1_WGM8
    SolutionIndex: 33
    SolutionNameMin: Cijk_Alik_Bjlk_BBS_BH_Bias_AuxB_HAS_SAV_UserArgs_MT16x64x32_MI16x16x1_SN_LDSB0_GRVWA4_GRVWB1_GSU1_LBSPPA128_LBSPPB2048_MIWT1_1_NLCB1_SS1_SU32_SUM0_SUS256_TLDS1_WG16_8_1_WGM8
    SolutionIndex: 34
    SolutionNameMin: Cijk_Alik_Bjlk_BBS_BH_Bias_AuxB_HAS_SAV_UserArgs_MT16x64x32_MI16x16x1_SN_LDSB0_GRVWA1_GRVWB1_GSU1_LBSPPA128_LBSPPB2048_MIWT1_1_NLCB1_SS1_SU32_SUM0_SUS256_TLDS1_WG16_8_1_WGM8
    SolutionIndex: 35
    SolutionNameMin: Cijk_Alik_Bjlk_BBS_BH_Bias_AuxB_HAS_SAV_UserArgs_MT32x64x32_MI16x16x1_SN_LDSB0_GRVWA8_GRVWB2_GSU1_LBSPPA1024_LBSPPB2048_MIWT2_1_NLCB1_SS1_SU32_SUM0_SUS256_TLDS0_WG16_8_1_WGM8
    SolutionIndex: 36
    SolutionNameMin: Cijk_Alik_Bjlk_BBS_BH_Bias_AuxB_HAS_SAV_UserArgs_MT32x64x32_MI16x16x1_SN_LDSB0_GRVWA8_GRVWB2_GSU1_LBSPPA128_LBSPPB2048_MIWT2_1_NLCB1_SS1_SU32_SUM0_SUS256_TLDS1_WG16_8_1_WGM8
    SolutionIndex: 37
    SolutionNameMin: Cijk_Alik_Bjlk_BBS_BH_Bias_AuxB_HAS_SAV_UserArgs_MT32x64x32_MI16x16x1_SN_LDSB0_GRVWA8_GRVWB1_GSU1_LBSPPA128_LBSPPB2048_MIWT2_1_NLCB1_SS1_SU32_SUM0_SUS256_TLDS1_WG16_8_1_WGM8
    SolutionIndex: 38
    SolutionNameMin: Cijk_Alik_Bjlk_BBS_BH_Bias_AuxB_HAS_SAV_UserArgs_MT32x64x32_MI16x16x1_SN_LDSB0_GRVWA1_GRVWB1_GSU1_LBSPPA128_LBSPPB2048_MIWT2_1_NLCB1_SS1_SU32_SUM0_SUS256_TLDS1_WG16_8_1_WGM8
    SolutionIndex: 39
    SolutionNameMin: Cijk_Alik_Bjlk_BBS_BH_Bias_AuxB_HAS_SAV_UserArgs_MT32x64x32_MI16x16x1_SN_LDSB0_GRVWA8_GRVWB2_GSU4_LBSPPA128_LBSPPB2048_MIWT2_1_NLCB1_SS1_SU32_SUM0_SUS256_TLDS1_WG16_8_1_WGM8
    SolutionIndex: 40
    SolutionNameMin: Cijk_Alik_Bjlk_BBS_BH_Bias_AuxB_HAS_SAV_UserArgs_MT48x64x32_MI16x16x1_SN_LDSB0_GRVWA4_GRVWB2_GSU1_LBSPPA128_LBSPPB2048_MIWT3_1_NLCB1_SS1_SU32_SUM0_SUS256_TLDS1_WG16_8_1_WGM8
    SolutionIndex: 41
    SolutionNameMin: Cijk_Alik_Bjlk_BBS_BH_Bias_AuxB_HAS_SAV_UserArgs_MT48x64x32_MI16x16x1_SN_LDSB0_GRVWA4_GRVWB1_GSU1_LBSPPA128_LBSPPB2048_MIWT3_1_NLCB1_SS1_SU32_SUM0_SUS256_TLDS1_WG16_8_1_WGM8
    SolutionIndex: 42
    SolutionNameMin: Cijk_Alik_Bjlk_BBS_BH_Bias_AuxB_HAS_SAV_UserArgs_MT48x64x32_MI16x16x1_SN_LDSB0_GRVWA1_GRVWB1_GSU1_LBSPPA128_LBSPPB2048_MIWT3_1_NLCB1_SS1_SU32_SUM0_SUS256_TLDS1_WG16_8_1_WGM8
    SolutionIndex: 43
    SolutionNameMin: Cijk_Alik_Bjlk_BBS_BH_Bias_AuxB_HAS_SAV_UserArgs_MT48x64x32_MI16x16x1_SN_LDSB0_GRVWA4_GRVWB2_GSU4_LBSPPA128_LBSPPB2048_MIWT3_1_NLCB1_SS1_SU32_SUM0_SUS256_TLDS1_WG16_8_1_WGM8
    SolutionIndex: 44
    SolutionNameMin: Cijk_Alik_Bjlk_BBS_BH_Bias_AuxB_HAS_SAV_UserArgs_MT80x64x32_MI16x16x1_SN_LDSB0_GRVWA4_GRVWB2_GSU1_LBSPPA128_LBSPPB2048_MIWT5_1_NLCB1_SS1_SU32_SUM0_SUS256_TLDS1_WG16_8_1_WGM8
    SolutionIndex: 45
    SolutionNameMin: Cijk_Alik_Bjlk_BBS_BH_Bias_AuxB_HAS_SAV_UserArgs_MT96x64x32_MI16x16x1_SN_LDSB0_GRVWA8_GRVWB2_GSU1_LBSPPA128_LBSPPB2048_MIWT6_1_NLCB1_SS1_SU32_SUM0_SUS256_TLDS1_WG16_8_1_WGM8
    SolutionIndex: 46
    SolutionNameMin: Cijk_Alik_Bjlk_BBS_BH_Bias_AuxB_HAS_SAV_UserArgs_MT112x64x32_MI16x16x1_SN_LDSB0_GRVWA4_GRVWB2_GSU1_LBSPPA128_LBSPPB2048_MIWT7_1_NLCB1_SS1_SU32_SUM0_SUS256_TLDS1_WG16_8_1_WGM8
    SolutionIndex: 47
    SolutionNameMin: Cijk_Alik_Bjlk_BBS_BH_Bias_AuxB_HAS_SAV_UserArgs_MT32x96x32_MI16x16x1_SN_LDSB0_GRVWA8_GRVWB2_GSU1_LBSPPA128_LBSPPB3072_MIWT1_3_NLCB3_SS1_SU32_SUM0_SUS256_TLDS1_WG32_4_1_WGM8
    SolutionIndex: 48
    SolutionNameMin: Cijk_Alik_Bjlk_BBS_BH_Bias_AuxB_HAS_SAV_UserArgs_MT32x96x32_MI16x16x1_SN_LDSB0_GRVWA1_GRVWB2_GSU1_LBSPPA128_LBSPPB3072_MIWT1_3_NLCB3_SS1_SU32_SUM0_SUS256_TLDS1_WG32_4_1_WGM8
    SolutionIndex: 49
    SolutionNameMin: Cijk_Alik_Bjlk_BBS_BH_Bias_AuxB_HAS_SAV_UserArgs_MT64x96x32_MI16x16x1_SN_LDSB0_GRVWA8_GRVWB2_GSU1_LBSPPA2048_LBSPPB3072_MIWT2_3_NLCB3_SS1_SU32_SUM0_SUS256_TLDS0_WG32_4_1_WGM8
    SolutionIndex: 50
    SolutionNameMin: Cijk_Alik_Bjlk_BBS_BH_Bias_AuxB_HAS_SAV_UserArgs_MT64x96x32_MI16x16x1_SN_LDSB0_GRVWA1_GRVWB2_GSU1_LBSPPA128_LBSPPB3072_MIWT2_3_NLCB3_SS1_SU32_SUM0_SUS256_TLDS1_WG32_4_1_WGM8
    SolutionIndex: 51
    SolutionNameMin: Cijk_Alik_Bjlk_BBS_BH_Bias_AuxB_HAS_SAV_UserArgs_MT96x96x32_MI16x16x1_SN_LDSB0_GRVWA8_GRVWB1_GSU1_LBSPPA128_LBSPPB3072_MIWT3_3_NLCB3_SS1_SU32_SUM0_SUS256_TLDS1_WG32_4_1_WGM8
    SolutionIndex: 52
    SolutionNameMin: Cijk_Alik_Bjlk_BBS_BH_Bias_AuxB_HAS_SAV_UserArgs_MT96x96x32_MI16x16x1_SN_LDSB0_GRVWA8_GRVWB1_GSU2_LBSPPA128_LBSPPB3072_MIWT3_3_NLCB3_SS1_SU32_SUM0_SUS256_TLDS1_WG32_4_1_WGM8
    SolutionIndex: 53
    SolutionNameMin: Cijk_Alik_Bjlk_BBS_BH_Bias_AuxB_HAS_SAV_UserArgs_MT96x96x32_MI16x16x1_SN_LDSB0_GRVWA8_GRVWB1_GSU4_LBSPPA128_LBSPPB3072_MIWT3_3_NLCB3_SS1_SU32_SUM0_SUS256_TLDS1_WG32_4_1_WGM8
    SolutionIndex: 54
    SolutionNameMin: Cijk_Alik_Bjlk_BBS_BH_Bias_AuxB_HAS_SAV_UserArgs_MT48x128x32_MI16x16x1_SN_LDSB0_GRVWA4_GRVWB2_GSU1_LBSPPA128_LBSPPB4096_MIWT3_2_NLCB1_SS1_SU32_SUM0_SUS256_TLDS1_WG16_8_1_WGM8
    SolutionIndex: 55
    SolutionNameMin: Cijk_Alik_Bjlk_BBS_BH_Bias_AuxB_HAS_SAV_UserArgs_MT32x192x32_MI16x16x1_SN_LDSB0_GRVWA8_GRVWB2_GSU1_LBSPPA128_LBSPPB6144_MIWT2_3_NLCB3_SS1_SU32_SUM0_SUS256_TLDS1_WG16_8_1_WGM8
    SolutionIndex: 56
    SolutionNameMin: Cijk_Alik_Bjlk_BBS_BH_Bias_AuxB_HAS_SAV_UserArgs_MT32x192x32_MI16x16x1_SN_LDSB0_GRVWA1_GRVWB2_GSU4_LBSPPA128_LBSPPB6144_MIWT2_3_NLCB3_SS1_SU32_SUM0_SUS256_TLDS1_WG16_8_1_WGM8
    SolutionIndex: 57
    SolutionNameMin: Cijk_Alik_Bjlk_BBS_BH_Bias_AuxB_HAS_SAV_UserArgs_MT64x16x64_MI16x16x1_SN_LDSB0_GRVWA8_GRVWB2_GSU1_LBSPPA2048_LBSPPB512_MIWT1_1_NLCB1_SS1_SU32_SUM0_SUS256_TLDS0_WG64_2_1_WGM8
    SolutionIndex: 58
    SolutionNameMin: Cijk_Alik_Bjlk_BBS_BH_Bias_AuxB_HAS_SAV_UserArgs_MT64x16x64_MI16x16x1_SN_LDSB0_GRVWA1_GRVWB2_GSU1_LBSPPA128_LBSPPB512_MIWT1_1_NLCB1_SS1_SU32_SUM0_SUS256_TLDS1_WG64_2_1_WGM8
    SolutionIndex: 59
    SolutionNameMin: Cijk_Alik_Bjlk_BBS_BH_Bias_AuxB_HAS_SAV_UserArgs_MT64x16x64_MI16x16x1_SN_LDSB0_GRVWA8_GRVWB1_GSU1_LBSPPA2048_LBSPPB512_MIWT1_1_NLCB1_SS1_SU32_SUM0_SUS256_TLDS0_WG64_2_1_WGM8
    SolutionIndex: 60
    SolutionNameMin: Cijk_Alik_Bjlk_BBS_BH_Bias_AuxB_HAS_SAV_UserArgs_MT32x32x64_MI16x16x1_SN_LDSB0_GRVWA8_GRVWB2_GSU1_LBSPPA1024_LBSPPB1024_MIWT1_1_NLCB1_SS1_SU32_SUM0_SUS256_TLDS0_WG32_4_1_WGM8
    SolutionIndex: 61
    SolutionNameMin: Cijk_Alik_Bjlk_BBS_BH_Bias_AuxB_HAS_SAV_UserArgs_MT32x32x64_MI16x16x1_SN_LDSB0_GRVWA8_GRVWB1_GSU1_LBSPPA1024_LBSPPB1024_MIWT1_1_NLCB1_SS1_SU32_SUM0_SUS256_TLDS0_WG32_4_1_WGM8
    SolutionIndex: 62
    SolutionNameMin: Cijk_Alik_Bjlk_BBS_BH_Bias_AuxB_HAS_SAV_UserArgs_MT32x32x64_MI16x16x1_SN_LDSB0_GRVWA1_GRVWB1_GSU1_LBSPPA128_LBSPPB1024_MIWT1_1_NLCB1_SS1_SU32_SUM0_SUS256_TLDS1_WG32_4_1_WGM8
    SolutionIndex: 63
    SolutionNameMin: Cijk_Alik_Bjlk_BBS_BH_Bias_AuxB_HAS_SAV_UserArgs_MT64x32x64_MI16x16x1_SN_LDSB0_GRVWA8_GRVWB2_GSU1_LBSPPA2048_LBSPPB1024_MIWT2_1_NLCB1_SS1_SU32_SUM0_SUS256_TLDS0_WG32_4_1_WGM8
    SolutionIndex: 64
    SolutionNameMin: Cijk_Alik_Bjlk_BBS_BH_Bias_AuxB_HAS_SAV_UserArgs_MT64x32x64_MI16x16x1_SN_LDSB0_GRVWA8_GRVWB1_GSU1_LBSPPA2048_LBSPPB1024_MIWT2_1_NLCB1_SS1_SU32_SUM0_SUS256_TLDS0_WG32_4_1_WGM8
    SolutionIndex: 65
    SolutionNameMin: Cijk_Alik_Bjlk_BBS_BH_Bias_AuxB_HAS_SAV_UserArgs_MT16x64x64_MI16x16x1_SN_LDSB0_GRVWA8_GRVWB2_GSU1_LBSPPA512_LBSPPB2048_MIWT1_1_NLCB1_SS1_SU32_SUM0_SUS256_TLDS0_WG16_8_1_WGM8
    SolutionIndex: 66
    SolutionNameMin: Cijk_Alik_Bjlk_BBS_BH_Bias_AuxB_HAS_SAV_UserArgs_MT16x64x64_MI16x16x1_SN_LDSB0_GRVWA8_GRVWB2_GSU1_LBSPPA128_LBSPPB2048_MIWT1_1_NLCB1_SS1_SU32_SUM0_SUS256_TLDS1_WG16_8_1_WGM8
    SolutionIndex: 67
    SolutionNameMin: Cijk_Alik_Bjlk_BBS_BH_Bias_AuxB_HAS_SAV_UserArgs_MT16x64x64_MI16x16x1_SN_LDSB0_GRVWA1_GRVWB2_GSU1_LBSPPA128_LBSPPB2048_MIWT1_1_NLCB1_SS1_SU32_SUM0_SUS256_TLDS1_WG16_8_1_WGM8
    SolutionIndex: 68
    SolutionNameMin: Cijk_Alik_Bjlk_BBS_BH_Bias_AuxB_HAS_SAV_UserArgs_MT16x64x64_MI16x16x1_SN_LDSB0_GRVWA8_GRVWB1_GSU1_LBSPPA512_LBSPPB2048_MIWT1_1_NLCB1_SS1_SU32_SUM0_SUS256_TLDS0_WG16_8_1_WGM8
    SolutionIndex: 69
    SolutionNameMin: Cijk_Alik_Bjlk_BBS_BH_Bias_AuxB_HAS_SAV_UserArgs_MT32x64x64_MI16x16x1_SN_LDSB0_GRVWA1_GRVWB2_GSU1_LBSPPA128_LBSPPB2048_MIWT2_1_NLCB1_SS1_SU32_SUM0_SUS256_TLDS1_WG16_8_1_WGM8
    SolutionIndex: 70
    SolutionNameMin: Cijk_Alik_Bjlk_BBS_BH_Bias_AuxB_HAS_SAV_UserArgs_MT32x64x64_MI16x16x1_SN_LDSB0_GRVWA8_GRVWB1_GSU1_LBSPPA1024_LBSPPB2048_MIWT2_1_NLCB1_SS1_SU32_SUM0_SUS256_TLDS0_WG16_8_1_WGM8
    SolutionIndex: 71
    SolutionNameMin: Cijk_Alik_Bjlk_BBS_BH_Bias_AuxB_HAS_SAV_UserArgs_MT48x64x64_MI16x16x1_SN_LDSB0_GRVWA8_GRVWB2_GSU1_LBSPPA128_LBSPPB2048_MIWT3_1_NLCB1_SS1_SU32_SUM0_SUS256_TLDS1_WG16_8_1_WGM8
    SolutionIndex: 72
    SolutionNameMin: Cijk_Alik_Bjlk_BBS_BH_Bias_AuxB_HAS_SAV_UserArgs_MT48x64x64_MI16x16x1_SN_LDSB0_GRVWA8_GRVWB2_GSU4_LBSPPA128_LBSPPB2048_MIWT3_1_NLCB1_SS1_SU32_SUM0_SUS256_TLDS1_WG16_8_1_WGM8
- - - [64, 64, 1, 64, 64, 64, 64, 64]
    - [60, 17.2639]
  - - [192, 64, 1, 64, 192, 192, 64, 64]
    - [66, 54.054]
  - - [320, 64, 1, 64, 320, 320, 64, 64]
    - [9, 89.35]
  - - [448, 64, 1, 64, 448, 448, 64, 64]
    - [18, 124.243]
  - - [576, 64, 1, 64, 576, 576, 64, 64]
    - [60, 173.102]
  - - [704, 64, 1, 64, 704, 704, 64, 64]
    - [18, 210.642]
  - - [832, 64, 1, 64, 832, 832, 64, 64]
    - [60, 249.762]
  - - [960, 64, 1, 64, 960, 960, 64, 64]
    - [15, 286.09]
  - - [64, 192, 1, 64, 64, 64, 64, 192]
    - [18, 51.5541]
  - - [192, 192, 1, 64, 192, 192, 64, 192]
    - [59, 168.768]
  - - [320, 192, 1, 64, 320, 320, 64, 192]
    - [60, 287.975]
  - - [448, 192, 1, 64, 448, 448, 64, 192]
    - [60, 401.988]
  - - [576, 192, 1, 64, 576, 576, 64, 192]
    - [34, 508.853]
  - - [704, 192, 1, 64, 704, 704, 64, 192]
    - [60, 597.263]
  - - [832, 192, 1, 64, 832, 832, 64, 192]
    - [70, 732.115]
  - - [960, 192, 1, 64, 960, 960, 64, 192]
    - [27, 785.411]
  - - [64, 320, 1, 64, 64, 64, 64, 320]
    - [0, 90.6477]
  - - [192, 320, 1, 64, 192, 192, 64, 320]
    - [60, 288.514]
  - - [320, 320, 1, 64, 320, 320, 64, 320]
    - [60, 455.602]
  - - [448, 320, 1, 64, 448, 448, 64, 320]
    - [34, 644.79]
  - - [576, 320, 1, 64, 576, 576, 64, 320]
    - [37, 814.421]
  - - [704, 320, 1, 64, 704, 704, 64, 320]
    - [18, 985.874]
  - - [832, 320, 1, 64, 832, 832, 64, 320]
    - [19, 1129.22]
  - - [960, 320, 1, 64, 960, 960, 64, 320]
    - [71, 1239.69]
  - - [64, 448, 1, 64, 64, 64, 64, 448]
    - [6, 123.824]
  - - [192, 448, 1, 64, 192, 192, 64, 448]
    - [15, 391.552]
  - - [320, 448, 1, 64, 320, 320, 64, 448]
    - [17, 639.844]
  - - [448, 448, 1, 64, 448, 448, 64, 448]
    - [16, 880.13]
  - - [576, 448, 1, 64, 576, 576, 64, 448]
    - [24, 1107.65]
  - - [704, 448, 1, 64, 704, 704, 64, 448]
    - [37, 1299.37]
  - - [832, 448, 1, 64, 832, 832, 64, 448]
    - [37, 1491.92]
  - - [960, 448, 1, 64, 960, 960, 64, 448]
    - [21, 1708.15]
  - - [64, 576, 1, 64, 64, 64, 64, 576]
    - [15, 168.227]
  - - [192, 576, 1, 64, 192, 192, 64, 576]
    - [68, 492.58]
  - - [320, 576, 1, 64, 320, 320, 64, 576]
    - [63, 792.002]
  - - [448, 576, 1, 64, 448, 448, 64, 576]
    - [18, 1142.56]
  - - [576, 576, 1, 64, 576, 576, 64, 576]
    - [28, 1385.6]
  - - [704, 576, 1, 64, 704, 704, 64, 576]
    - [38, 1656.23]
  - - [832, 576, 1, 64, 832, 832, 64, 576]
    - [37, 1862.85]
  - - [960, 576, 1, 64, 960, 960, 64, 576]
    - [50, 2020.58]
  - - [64, 704, 1, 64, 64, 64, 64, 704]
    - [11, 209.791]
  - - [192, 704, 1, 64, 192, 192, 64, 704]
    - [11, 604.969]
  - - [320, 704, 1, 64, 320, 320, 64, 704]
    - [35, 967.029]
  - - [448, 704, 1, 64, 448, 448, 64, 704]
    - [37, 1258.85]
  - - [576, 704, 1, 64, 576, 576, 64, 704]
    - [21, 1615.0]
  - - [704, 704, 1, 64, 704, 704, 64, 704]
    - [37, 1843.13]
  - - [832, 704, 1, 64, 832, 832, 64, 704]
    - [36, 2056.99]
  - - [960, 704, 1, 64, 960, 960, 64, 704]
    - [45, 2407.07]
  - - [64, 832, 1, 64, 64, 64, 64, 832]
    - [57, 241.787]
  - - [192, 832, 1, 64, 192, 192, 64, 832]
    - [32, 737.395]
  - - [320, 832, 1, 64, 320, 320, 64, 832]
    - [33, 1129.22]
  - - [448, 832, 1, 64, 448, 448, 64, 832]
    - [36, 1495.66]
  - - [576, 832, 1, 64, 576, 576, 64, 832]
    - [22, 1855.52]
  - - [704, 832, 1, 64, 704, 704, 64, 832]
    - [22, 2101.91]
  - - [832, 832, 1, 64, 832, 832, 64, 832]
    - [37, 2390.91]
  - - [960, 832, 1, 64, 960, 960, 64, 832]
    - [41, 2717.67]
  - - [64, 960, 1, 64, 64, 64, 64, 960]
    - [11, 282.493]
  - - [192, 960, 1, 64, 192, 192, 64, 960]
    - [36, 832.233]
  - - [320, 960, 1, 64, 320, 320, 64, 960]
    - [37, 1275.93]
  - - [448, 960, 1, 64, 448, 448, 64, 960]
    - [37, 1678.41]
  - - [576, 960, 1, 64, 576, 576, 64, 960]
    - [49, 2027.53]
  - - [704, 960, 1, 64, 704, 704, 64, 960]
    - [55, 2419.93]
  - - [832, 960, 1, 64, 832, 832, 64, 960]
    - [21, 2637.81]
  - - [960, 960, 1, 64, 960, 960, 64, 960]
    - [42, 3032.67]
  - - [64, 64, 1, 256, 64, 64, 256, 64]
    - [1, 71.0441]
  - - [192, 64, 1, 256, 192, 192, 256, 64]
    - [15, 204.74]
  - - [320, 64, 1, 256, 320, 320, 256, 64]
    - [4, 349.899]
  - - [448, 64, 1, 256, 448, 448, 256, 64]
    - [1, 484.187]
  - - [576, 64, 1, 256, 576, 576, 256, 64]
    - [15, 630.007]
  - - [704, 64, 1, 256, 704, 704, 256, 64]
    - [14, 764.648]
  - - [832, 64, 1, 256, 832, 832, 256, 64]
    - [18, 961.691]
  - - [960, 64, 1, 256, 960, 960, 256, 64]
    - [10, 1088.94]
  - - [64, 192, 1, 256, 64, 64, 256, 192]
    - [1, 205.812]
  - - [192, 192, 1, 256, 192, 192, 256, 192]
    - [15, 660.89]
  - - [320, 192, 1, 256, 320, 320, 256, 192]
    - [60, 1029.02]
  - - [448, 192, 1, 256, 448, 448, 256, 192]
    - [11, 1484.93]
  - - [576, 192, 1, 256, 576, 576, 256, 192]
    - [64, 1842.66]
  - - [704, 192, 1, 256, 704, 704, 256, 192]
    - [18, 2140.68]
  - - [832, 192, 1, 256, 832, 832, 256, 192]
    - [36, 2492.12]
  - - [960, 192, 1, 256, 960, 960, 256, 192]
    - [36, 2858.97]
  - - [64, 320, 1, 256, 64, 64, 256, 320]
    - [31, 357.644]
  - - [192, 320, 1, 256, 192, 192, 256, 320]
    - [62, 1117.92]
  - - [320, 320, 1, 256, 320, 320, 256, 320]
    - [70, 1738.41]
  - - [448, 320, 1, 256, 448, 448, 256, 320]
    - [15, 2343.64]
  - - [576, 320, 1, 256, 576, 576, 256, 320]
    - [40, 2935.45]
  - - [704, 320, 1, 256, 704, 704, 256, 320]
    - [15, 3366.9]
  - - [832, 320, 1, 256, 832, 832, 256, 320]
    - [23, 3925.1]
  - - [960, 320, 1, 256, 960, 960, 256, 320]
    - [36, 4194.42]
  - - [64, 448, 1, 256, 64, 64, 256, 448]
    - [4, 475.714]
  - - [192, 448, 1, 256, 192, 192, 256, 448]
    - [62, 1429.46]
  - - [320, 448, 1, 256, 320, 320, 256, 448]
    - [37, 2298.86]
  - - [448, 448, 1, 256, 448, 448, 256, 448]
    - [36, 3010.94]
  - - [576, 448, 1, 256, 576, 576, 256, 448]
    - [23, 3656.91]
  - - [704, 448, 1, 256, 704, 704, 256, 448]
    - [36, 4265.32]
  - - [832, 448, 1, 256, 832, 832, 256, 448]
    - [36, 4813.38]
  - - [960, 448, 1, 256, 960, 960, 256, 448]
    - [36, 5363.17]
  - - [64, 576, 1, 256, 64, 64, 256, 576]
    - [58, 657.437]
  - - [192, 576, 1, 256, 192, 192, 256, 576]
    - [37, 1806.27]
  - - [320, 576, 1, 256, 320, 320, 256, 576]
    - [35, 2857.24]
  - - [448, 576, 1, 256, 448, 448, 256, 576]
    - [47, 3720.76]
  - - [576, 576, 1, 256, 576, 576, 256, 576]
    - [71, 4566.5]
  - - [704, 576, 1, 256, 704, 704, 256, 576]
    - [36, 5191.88]
  - - [832, 576, 1, 256, 832, 832, 256, 576]
    - [49, 5926.88]
  - - [960, 576, 1, 256, 960, 960, 256, 576]
    - [55, 6876.91]
  - - [64, 704, 1, 256, 64, 64, 256, 704]
    - [17, 812.306]
  - - [192, 704, 1, 256, 192, 192, 256, 704]
    - [15, 2147.32]
  - - [320, 704, 1, 256, 320, 320, 256, 704]
    - [36, 3454.53]
  - - [448, 704, 1, 256, 448, 448, 256, 704]
    - [36, 4208.73]
  - - [576, 704, 1, 256, 576, 576, 256, 704]
    - [36, 5126.5]
  - - [704, 704, 1, 256, 704, 704, 256, 704]
    - [55, 5827.03]
  - - [832, 704, 1, 256, 832, 832, 256, 704]
    - [36, 6727.22]
  - - [960, 704, 1, 256, 960, 960, 256, 704]
    - [40, 7496.48]
  - - [64, 832, 1, 256, 64, 64, 256, 832]
    - [65, 938.84]
  - - [192, 832, 1, 256, 192, 192, 256, 832]
    - [71, 2545.64]
  - - [320, 832, 1, 256, 320, 320, 256, 832]
    - [44, 3776.14]
  - - [448, 832, 1, 256, 448, 448, 256, 832]
    - [36, 4626.56]
  - - [576, 832, 1, 256, 576, 576, 256, 832]
    - [36, 5825.7]
  - - [704, 832, 1, 256, 704, 704, 256, 832]
    - [36, 6504.14]
  - - [832, 832, 1, 256, 832, 832, 256, 832]
    - [36, 7195.0]
  - - [960, 832, 1, 256, 960, 960, 256, 832]
    - [40, 8258.5]
  - - [64, 960, 1, 256, 64, 64, 256, 960]
    - [15, 1072.57]
  - - [192, 960, 1, 256, 192, 192, 256, 960]
    - [24, 2862.44]
  - - [320, 960, 1, 256, 320, 320, 256, 960]
    - [36, 4359.62]
  - - [448, 960, 1, 256, 448, 448, 256, 960]
    - [36, 5387.97]
  - - [576, 960, 1, 256, 576, 576, 256, 960]
    - [55, 6712.4]
  - - [704, 960, 1, 256, 704, 704, 256, 960]
    - [55, 7779.63]
  - - [832, 960, 1, 256, 832, 832, 256, 960]
    - [36, 7934.82]
  - - [960, 960, 1, 256, 960, 960, 256, 960]
    - [40, 9272.32]
  - - [64, 64, 1, 512, 64, 64, 512, 64]
    - [1, 125.058]
  - - [192, 64, 1, 512, 192, 192, 512, 64]
    - [2, 385.766]
  - - [320, 64, 1, 512, 320, 320, 512, 64]
    - [1, 671.755]
  - - [448, 64, 1, 512, 448, 448, 512, 64]
    - [1, 926.216]
  - - [576, 64, 1, 512, 576, 576, 512, 64]
    - [1, 1189.35]
  - - [704, 64, 1, 512, 704, 704, 512, 64]
    - [15, 1473.1]
  - - [832, 64, 1, 512, 832, 832, 512, 64]
    - [15, 1747.12]
  - - [960, 64, 1, 512, 960, 960, 512, 64]
    - [15, 2000.53]
  - - [64, 192, 1, 512, 64, 64, 512, 192]
    - [1, 392.737]
  - - [192, 192, 1, 512, 192, 192, 512, 192]
    - [15, 1207.61]
  - - [320, 192, 1, 512, 320, 320, 512, 192]
    - [66, 1927.59]
  - - [448, 192, 1, 512, 448, 448, 512, 192]
    - [15, 2622.3]
  - - [576, 192, 1, 512, 576, 576, 512, 192]
    - [36, 3245.9]
  - - [704, 192, 1, 512, 704, 704, 512, 192]
    - [15, 3660.82]
  - - [832, 192, 1, 512, 832, 832, 512, 192]
    - [47, 4248.89]
  - - [960, 192, 1, 512, 960, 960, 512, 192]
    - [71, 5034.78]
  - - [64, 320, 1, 512, 64, 64, 512, 320]
    - [1, 683.134]
  - - [192, 320, 1, 512, 192, 192, 512, 320]
    - [15, 2001.16]
  - - [320, 320, 1, 512, 320, 320, 512, 320]
    - [36, 2942.21]
  - - [448, 320, 1, 512, 448, 448, 512, 320]
    - [69, 3840.03]
  - - [576, 320, 1, 512, 576, 576, 512, 320]
    - [71, 5052.16]
  - - [704, 320, 1, 512, 704, 704, 512, 320]
    - [69, 5474.55]
  - - [832, 320, 1, 512, 832, 832, 512, 320]
    - [23, 6411.95]
  - - [960, 320, 1, 512, 960, 960, 512, 320]
    - [44, 7086.89]
  - - [64, 448, 1, 512, 64, 64, 512, 448]
    - [1, 931.772]
  - - [192, 448, 1, 512, 192, 192, 512, 448]
    - [62, 2551.65]
  - - [320, 448, 1, 512, 320, 320, 512, 448]
    - [31, 3723.16]
  - - [448, 448, 1, 512, 448, 448, 512, 448]
    - [36, 4848.45]
  - - [576, 448, 1, 512, 576, 576, 512, 448]
    - [71, 6381.25]
  - - [704, 448, 1, 512, 704, 704, 512, 448]
    - [49, 7071.94]
  - - [832, 448, 1, 512, 832, 832, 512, 448]
    - [36, 7493.06]
  - - [960, 448, 1, 512, 960, 960, 512, 448]
    - [44, 8790.63]
  - - [64, 576, 1, 512, 64, 64, 512, 576]
    - [15, 1200.7]
  - - [192, 576, 1, 512, 192, 192, 512, 576]
    - [36, 3260.95]
  - - [320, 576, 1, 512, 320, 320, 512, 576]
    - [47, 4894.93]
  - - [448, 576, 1, 512, 448, 448, 512, 576]
    - [23, 6356.69]
  - - [576, 576, 1, 512, 576, 576, 512, 576]
    - [49, 7711.17]
  - - [704, 576, 1, 512, 704, 704, 512, 576]
    - [50, 8116.58]
  - - [832, 576, 1, 512, 832, 832, 512, 576]
    - [55, 9594.2]
  - - [960, 576, 1, 512, 960, 960, 512, 576]
    - [51, 11266.3]
  - - [64, 704, 1, 512, 64, 64, 512, 704]
    - [15, 1485.95]
  - - [192, 704, 1, 512, 192, 192, 512, 704]
    - [41, 3583.2]
  - - [320, 704, 1, 512, 320, 320, 512, 704]
    - [36, 5581.72]
  - - [448, 704, 1, 512, 448, 448, 512, 704]
    - [54, 7010.38]
  - - [576, 704, 1, 512, 576, 576, 512, 704]
    - [40, 8039.58]
  - - [704, 704, 1, 512, 704, 704, 512, 704]
    - [54, 9762.08]
  - - [832, 704, 1, 512, 832, 832, 512, 704]
    - [55, 10293.4]
  - - [960, 704, 1, 512, 960, 960, 512, 704]
    - [54, 11722.3]
  - - [64, 832, 1, 512, 64, 64, 512, 832]
    - [15, 1735.45]
  - - [192, 832, 1, 512, 192, 192, 512, 832]
    - [71, 4295.75]
  - - [320, 832, 1, 512, 320, 320, 512, 832]
    - [48, 6240.24]
  - - [448, 832, 1, 512, 448, 448, 512, 832]
    - [46, 7750.04]
  - - [576, 832, 1, 512, 576, 576, 512, 832]
    - [55, 9183.06]
  - - [704, 832, 1, 512, 704, 704, 512, 832]
    - [55, 10155.9]
  - - [832, 832, 1, 512, 832, 832, 512, 832]
    - [40, 11124.6]
  - - [960, 832, 1, 512, 960, 960, 512, 832]
    - [51, 12377.6]
  - - [64, 960, 1, 512, 64, 64, 512, 960]
    - [15, 1994.82]
  - - [192, 960, 1, 512, 192, 192, 512, 960]
    - [71, 5002.62]
  - - [320, 960, 1, 512, 320, 320, 512, 960]
    - [44, 7151.17]
  - - [448, 960, 1, 512, 448, 448, 512, 960]
    - [46, 8702.05]
  - - [576, 960, 1, 512, 576, 576, 512, 960]
    - [51, 11070.4]
  - - [704, 960, 1, 512, 704, 704, 512, 960]
    - [55, 12452.1]
  - - [832, 960, 1, 512, 832, 832, 512, 960]
    - [51, 12321.7]
  - - [960, 960, 1, 512, 960, 960, 512, 960]
    - [51, 14773.8]
  - - [64, 64, 1, 1024, 64, 64, 1024, 64]
    - [3, 247.751]
  - - [192, 64, 1, 1024, 192, 192, 1024, 64]
    - [12, 725.052]
  - - [320, 64, 1, 1024, 320, 320, 1024, 64]
    - [15, 1215.78]
  - - [448, 64, 1, 1024, 448, 448, 1024, 64]
    - [1, 1688.87]
  - - [576, 64, 1, 1024, 576, 576, 1024, 64]
    - [6, 2065.65]
  - - [704, 64, 1, 1024, 704, 704, 1024, 64]
    - [15, 2611.13]
  - - [832, 64, 1, 1024, 832, 832, 1024, 64]
    - [15, 2984.62]
  - - [960, 64, 1, 1024, 960, 960, 1024, 64]
    - [15, 3441.81]
  - - [64, 192, 1, 1024, 64, 64, 1024, 192]
    - [1, 704.57]
  - - [192, 192, 1, 1024, 192, 192, 1024, 192]
    - [6, 2094.3]
  - - [320, 192, 1, 1024, 320, 320, 1024, 192]
    - [67, 3456.94]
  - - [448, 192, 1, 1024, 448, 448, 1024, 192]
    - [71, 4327.32]
  - - [576, 192, 1, 1024, 576, 576, 1024, 192]
    - [36, 5313.11]
  - - [704, 192, 1, 1024, 704, 704, 1024, 192]
    - [56, 5921.5]
  - - [832, 192, 1, 1024, 832, 832, 1024, 192]
    - [36, 6508.23]
  - - [960, 192, 1, 1024, 960, 960, 1024, 192]
    - [24, 8107.72]
  - - [64, 320, 1, 1024, 64, 64, 1024, 320]
    - [1, 1197.04]
  - - [192, 320, 1, 1024, 192, 192, 1024, 320]
    - [15, 3429.61]
  - - [320, 320, 1, 1024, 320, 320, 1024, 320]
    - [36, 4934.59]
  - - [448, 320, 1, 1024, 448, 448, 1024, 320]
    - [56, 6052.64]
  - - [576, 320, 1, 1024, 576, 576, 1024, 320]
    - [71, 8127.1]
  - - [704, 320, 1, 1024, 704, 704, 1024, 320]
    - [36, 8382.82]
  - - [832, 320, 1, 1024, 832, 832, 1024, 320]
    - [71, 9854.86]
  - - [960, 320, 1, 1024, 960, 960, 1024, 320]
    - [25, 11045.8]
  - - [64, 448, 1, 1024, 64, 64, 1024, 448]
    - [1, 1698.64]
  - - [192, 448, 1, 1024, 192, 192, 1024, 448]
    - [15, 4308.27]
  - - [320, 448, 1, 1024, 320, 320, 1024, 448]
    - [69, 5982.22]
  - - [448, 448, 1, 1024, 448, 448, 1024, 448]
    - [53, 7661.83]
  - - [576, 448, 1, 1024, 576, 576, 1024, 448]
    - [71, 9491.76]
  - - [704, 448, 1, 1024, 704, 704, 1024, 448]
    - [49, 10753.2]
  - - [832, 448, 1, 1024, 832, 832, 1024, 448]
    - [52, 11822.6]
  - - [960, 448, 1, 1024, 960, 960, 1024, 448]
    - [51, 12693.9]
  - - [64, 576, 1, 1024, 64, 64, 1024, 576]
    - [6, 2073.02]
  - - [192, 576, 1, 1024, 192, 192, 1024, 576]
    - [36, 5212.83]
  - - [320, 576, 1, 1024, 320, 320, 1024, 576]
    - [36, 7575.81]
  - - [448, 576, 1, 1024, 448, 448, 1024, 576]
    - [71, 9605.63]
  - - [576, 576, 1, 1024, 576, 576, 1024, 576]
    - [49, 11534.5]
  - - [704, 576, 1, 1024, 704, 704, 1024, 576]
    - [55, 12200.6]
  - - [832, 576, 1, 1024, 832, 832, 1024, 576]
    - [55, 14101.9]
  - - [960, 576, 1, 1024, 960, 960, 1024, 576]
    - [51, 16870.2]
  - - [64, 704, 1, 1024, 64, 64, 1024, 704]
    - [15, 2586.25]
  - - [192, 704, 1, 1024, 192, 192, 1024, 704]
    - [71, 5961.03]
  - - [320, 704, 1, 1024, 320, 320, 1024, 704]
    - [36, 8370.65]
  - - [448, 704, 1, 1024, 448, 448, 1024, 704]
    - [54, 10959.2]
  - - [576, 704, 1, 1024, 576, 576, 1024, 704]
    - [54, 12041.2]
  - - [704, 704, 1, 1024, 704, 704, 1024, 704]
    - [54, 14681.1]
  - - [832, 704, 1, 1024, 832, 832, 1024, 704]
    - [55, 14703.0]
  - - [960, 704, 1, 1024, 960, 960, 1024, 704]
    - [54, 17126.6]
  - - [64, 832, 1, 1024, 64, 64, 1024, 832]
    - [6, 3090.25]
  - - [192, 832, 1, 1024, 192, 192, 1024, 832]
    - [71, 7101.43]
  - - [320, 832, 1, 1024, 320, 320, 1024, 832]
    - [44, 9529.51]
  - - [448, 832, 1, 1024, 448, 448, 1024, 832]
    - [52, 11789.8]
  - - [576, 832, 1, 1024, 576, 576, 1024, 832]
    - [55, 13758.0]
  - - [704, 832, 1, 1024, 704, 704, 1024, 832]
    - [55, 14833.7]
  - - [832, 832, 1, 1024, 832, 832, 1024, 832]
    - [50, 16269.5]
  - - [960, 832, 1, 1024, 960, 960, 1024, 832]
    - [51, 18465.2]
  - - [64, 960, 1, 1024, 64, 64, 1024, 960]
    - [15, 3457.89]
  - - [192, 960, 1, 1024, 192, 192, 1024, 960]
    - [71, 8114.69]
  - - [320, 960, 1, 1024, 320, 320, 1024, 960]
    - [44, 11045.8]
  - - [448, 960, 1, 1024, 448, 448, 1024, 960]
    - [46, 13255.5]
  - - [576, 960, 1, 1024, 576, 576, 1024, 960]
    - [51, 16777.7]
  - - [704, 960, 1, 1024, 704, 704, 1024, 960]
    - [55, 17594.5]
  - - [832, 960, 1, 1024, 832, 832, 1024, 960]
    - [51, 18421.6]
  - - [960, 960, 1, 1024, 960, 960, 1024, 960]
    - [51, 20538.6]
  - - [64, 64, 1, 2048, 64, 64, 2048, 64]
    - [8, 457.407]
  - - [192, 64, 1, 2048, 192, 192, 2048, 64]
    - [20, 1346.2]
  - - [320, 64, 1, 2048, 320, 320, 2048, 64]
    - [6, 2118.92]
  - - [448, 64, 1, 2048, 448, 448, 2048, 64]
    - [6, 2912.06]
  - - [576, 64, 1, 2048, 576, 576, 2048, 64]
    - [4, 3293.38]
  - - [704, 64, 1, 2048, 704, 704, 2048, 64]
    - [43, 3969.74]
  - - [832, 64, 1, 2048, 832, 832, 2048, 64]
    - [6, 4656.56]
  - - [960, 64, 1, 2048, 960, 960, 2048, 64]
    - [66, 5234.27]
  - - [64, 64, 1, 4096, 64, 64, 4096, 64]
    - [8, 876.575]
  - - [192, 64, 1, 4096, 192, 192, 4096, 64]
    - [20, 2374.75]
  - - [320, 64, 1, 4096, 320, 320, 4096, 64]
    - [72, 3597.25]
  - - [448, 64, 1, 4096, 448, 448, 4096, 64]
    - [39, 4669.7]
  - - [576, 64, 1, 4096, 576, 576, 4096, 64]
    - [72, 5608.19]
  - - [704, 64, 1, 4096, 704, 704, 4096, 64]
    - [72, 6771.34]
  - - [832, 64, 1, 4096, 832, 832, 4096, 64]
    - [72, 6941.78]
  - - [960, 64, 1, 4096, 960, 960, 4096, 64]
    - [72, 7991.81]
  - - [1280, 1280, 1, 64, 1280, 1280, 64, 1280]
    - [41, 4317.88]
  - - [1536, 1280, 1, 64, 1536, 1536, 64, 1280]
    - [42, 4813.85]
  - - [1792, 1280, 1, 64, 1792, 1792, 64, 1280]
    - [37, 5019.86]
  - - [2048, 1280, 1, 64, 2048, 2048, 64, 1280]
    - [13, 5204.82]
  - - [1280, 1536, 1, 64, 1280, 1280, 64, 1536]
    - [41, 4777.29]
  - - [1536, 1536, 1, 64, 1536, 1536, 64, 1536]
    - [41, 5244.88]
  - - [1792, 1536, 1, 64, 1792, 1792, 64, 1536]
    - [30, 5527.65]
  - - [2048, 1536, 1, 64, 2048, 2048, 64, 1536]
    - [13, 5659.3]
  - - [1280, 1792, 1, 64, 1280, 1280, 64, 1792]
    - [42, 5144.76]
  - - [1536, 1792, 1, 64, 1536, 1536, 64, 1792]
    - [41, 5842.91]
  - - [1792, 1792, 1, 64, 1792, 1792, 64, 1792]
    - [26, 6063.64]
  - - [2048, 1792, 1, 64, 2048, 2048, 64, 1792]
    - [13, 6039.08]
  - - [1280, 2048, 1, 64, 1280, 1280, 64, 2048]
    - [41, 5591.66]
  - - [1536, 2048, 1, 64, 1536, 1536, 64, 2048]
    - [41, 6092.59]
  - - [1792, 2048, 1, 64, 1792, 1792, 64, 2048]
    - [42, 6337.17]
  - - [2048, 2048, 1, 64, 2048, 2048, 64, 2048]
    - [13, 6234.86]
  - - [1280, 1280, 1, 256, 1280, 1280, 256, 1280]
    - [40, 12212.8]
  - - [1536, 1280, 1, 256, 1536, 1536, 256, 1280]
    - [40, 13266.6]
  - - [1792, 1280, 1, 256, 1792, 1792, 256, 1280]
    - [40, 13353.6]
  - - [2048, 1280, 1, 256, 2048, 2048, 256, 1280]
    - [40, 14067.8]
  - - [1280, 1536, 1, 256, 1280, 1280, 256, 1536]
    - [49, 13056.5]
  - - [1536, 1536, 1, 256, 1536, 1536, 256, 1536]
    - [49, 14307.6]
  - - [1792, 1536, 1, 256, 1792, 1792, 256, 1536]
    - [49, 15206.3]
  - - [2048, 1536, 1, 256, 2048, 2048, 256, 1536]
    - [29, 14891.4]
  - - [1280, 1792, 1, 256, 1280, 1280, 256, 1792]
    - [49, 13615.0]
  - - [1536, 1792, 1, 256, 1536, 1536, 256, 1792]
    - [40, 15139.5]
  - - [1792, 1792, 1, 256, 1792, 1792, 256, 1792]
    - [49, 14873.0]
  - - [2048, 1792, 1, 256, 2048, 2048, 256, 1792]
    - [51, 15377.3]
  - - [1280, 2048, 1, 256, 1280, 1280, 256, 2048]
    - [40, 14277.4]
  - - [1536, 2048, 1, 256, 1536, 1536, 256, 2048]
    - [40, 15058.4]
  - - [1792, 2048, 1, 256, 1792, 1792, 256, 2048]
    - [40, 15431.6]
  - - [2048, 2048, 1, 256, 2048, 2048, 256, 2048]
    - [29, 15668.5]
  - - [1280, 1280, 1, 512, 1280, 1280, 512, 1280]
    - [54, 17130.6]
  - - [1536, 1280, 1, 512, 1536, 1536, 512, 1280]
    - [51, 18977.5]
  - - [1792, 1280, 1, 512, 1792, 1792, 512, 1280]
    - [49, 18136.7]
  - - [2048, 1280, 1, 512, 2048, 2048, 512, 1280]
    - [51, 19130.8]
  - - [1280, 1536, 1, 512, 1280, 1280, 512, 1536]
    - [49, 19366.3]
  - - [1536, 1536, 1, 512, 1536, 1536, 512, 1536]
    - [49, 19950.3]
  - - [1792, 1536, 1, 512, 1792, 1792, 512, 1536]
    - [49, 20574.1]
  - - [2048, 1536, 1, 512, 2048, 2048, 512, 1536]
    - [51, 21415.6]
  - - [1280, 1792, 1, 512, 1280, 1280, 512, 1792]
    - [49, 19193.4]
  - - [1536, 1792, 1, 512, 1536, 1536, 512, 1792]
    - [51, 20014.4]
  - - [1792, 1792, 1, 512, 1792, 1792, 512, 1792]
    - [49, 21089.1]
  - - [2048, 1792, 1, 512, 2048, 2048, 512, 1792]
    - [51, 21369.1]
  - - [1280, 2048, 1, 512, 1280, 1280, 512, 2048]
    - [49, 19482.1]
  - - [1536, 2048, 1, 512, 1536, 1536, 512, 2048]
    - [51, 21936.2]
  - - [1792, 2048, 1, 512, 1792, 1792, 512, 2048]
    - [49, 21409.4]
  - - [2048, 2048, 1, 512, 2048, 2048, 512, 2048]
    - [51, 21992.3]
  - - [1280, 1280, 1, 1024, 1280, 1280, 1024, 1280]
    - [54, 21537.6]
  - - [1536, 1280, 1, 1024, 1536, 1536, 1024, 1280]
    - [51, 24111.7]
  - - [1792, 1280, 1, 1024, 1792, 1792, 1024, 1280]
    - [51, 23124.5]
  - - [2048, 1280, 1, 1024, 2048, 2048, 1024, 1280]
    - [51, 24049.8]
  - - [1280, 1536, 1, 1024, 1280, 1280, 1024, 1536]
    - [51, 23739.1]
  - - [1536, 1536, 1, 1024, 1536, 1536, 1024, 1536]
    - [49, 24724.9]
  - - [1792, 1536, 1, 1024, 1792, 1792, 1024, 1536]
    - [51, 25995.2]
  - - [2048, 1536, 1, 1024, 2048, 2048, 1024, 1536]
    - [51, 27455.2]
  - - [1280, 1792, 1, 1024, 1280, 1280, 1024, 1792]
    - [49, 23714.1]
  - - [1536, 1792, 1, 1024, 1536, 1536, 1024, 1792]
    - [51, 25564.9]
  - - [1792, 1792, 1, 1024, 1792, 1792, 1024, 1792]
    - [51, 25752.2]
  - - [2048, 1792, 1, 1024, 2048, 2048, 1024, 1792]
    - [51, 27350.3]
  - - [1280, 2048, 1, 1024, 1280, 1280, 1024, 2048]
    - [51, 24607.5]
  - - [1536, 2048, 1, 1024, 1536, 1536, 1024, 2048]
    - [51, 28040.9]
  - - [1792, 2048, 1, 1024, 1792, 1792, 1024, 2048]
    - [51, 26929.9]
  - - [2048, 2048, 1, 1024, 2048, 2048, 1024, 2048]
    - [51, 26998.6]
  - - [1280, 1280, 1, 2048, 1280, 1280, 2048, 1280]
    - [54, 25292.3]
  - - [1536, 1280, 1, 2048, 1536, 1536, 2048, 1280]
    - [51, 29141.7]
  - - [1792, 1280, 1, 2048, 1792, 1792, 2048, 1280]
    - [51, 26753.4]
  - - [2048, 1280, 1, 2048, 2048, 2048, 2048, 1280]
    - [51, 27705.2]
  - - [1280, 1536, 1, 2048, 1280, 1280, 2048, 1536]
    - [51, 28608.6]
  - - [1536, 1536, 1, 2048, 1536, 1536, 2048, 1536]
    - [52, 27895.9]
  - - [1792, 1536, 1, 2048, 1792, 1792, 2048, 1536]
    - [51, 30177.4]
  - - [2048, 1536, 1, 2048, 2048, 2048, 2048, 1536]
    - [51, 32178.6]
  - - [1280, 1792, 1, 2048, 1280, 1280, 2048, 1792]
    - [51, 27240.5]
  - - [1536, 1792, 1, 2048, 1536, 1536, 2048, 1792]
    - [51, 29490.1]
  - - [1792, 1792, 1, 2048, 1792, 1792, 2048, 1792]
    - [51, 29365.6]
  - - [2048, 1792, 1, 2048, 2048, 2048, 2048, 1792]
    - [51, 30875.1]
  - - [1280, 2048, 1, 2048, 1280, 1280, 2048, 2048]
    - [51, 28879.6]
  - - [1536, 2048, 1, 2048, 1536, 1536, 2048, 2048]
    - [51, 32218.8]
  - - [1792, 2048, 1, 2048, 1792, 1792, 2048, 2048]
    - [51, 30779.1]
  - - [2048, 2048, 1, 2048, 2048, 2048, 2048, 2048]
    - [51, 30412.5]
  - - [1280, 1280, 1, 4096, 1280, 1280, 4096, 1280]
    - [53, 29096.4]
  - - [1536, 1280, 1, 4096, 1536, 1536, 4096, 1280]
    - [51, 31935.4]
  - - [1792, 1280, 1, 4096, 1792, 1792, 4096, 1280]
    - [5, 30907.4]
  - - [2048, 1280, 1, 4096, 2048, 2048, 4096, 1280]
    - [51, 30079.3]
  - - [1280, 1536, 1, 4096, 1280, 1280, 4096, 1536]
    - [5, 32249.4]
  - - [1536, 1536, 1, 4096, 1536, 1536, 4096, 1536]
    - [52, 31129.4]
  - - [1792, 1536, 1, 4096, 1792, 1792, 4096, 1536]
    - [5, 33704.8]
  - - [2048, 1536, 1, 4096, 2048, 2048, 4096, 1536]
    - [51, 34982.9]
  - - [1280, 1792, 1, 4096, 1280, 1280, 4096, 1792]
    - [5, 31349.2]
  - - [1536, 1792, 1, 4096, 1536, 1536, 4096, 1792]
    - [51, 31821.3]
  - - [1792, 1792, 1, 4096, 1792, 1792, 4096, 1792]
    - [5, 33693.7]
  - - [2048, 1792, 1, 4096, 2048, 2048, 4096, 1792]
    - [51, 32958.0]
  - - [1280, 2048, 1, 4096, 1280, 1280, 4096, 2048]
    - [5, 32362.0]
  - - [1536, 2048, 1, 4096, 1536, 1536, 4096, 2048]
    - [51, 35142.2]
  - - [1792, 2048, 1, 4096, 1792, 1792, 4096, 2048]
    - [5, 33689.6]
  - - [2048, 2048, 1, 4096, 2048, 2048, 4096, 2048]
    - [51, 32394.2]
  - - [2560, 2560, 1, 64, 2560, 2560, 64, 2560]
    - [41, 7477.41]
  - - [3072, 2560, 1, 64, 3072, 3072, 64, 2560]
    - [41, 7870.1]
  - - [3584, 2560, 1, 64, 3584, 3584, 64, 2560]
    - [26, 8292.3]
  - - [4096, 2560, 1, 64, 4096, 4096, 64, 2560]
    - [26, 8046.87]
  - - [2560, 3072, 1, 64, 2560, 2560, 64, 3072]
    - [42, 7809.05]
  - - [3072, 3072, 1, 64, 3072, 3072, 64, 3072]
    - [51, 8294.37]
  - - [3584, 3072, 1, 64, 3584, 3584, 64, 3072]
    - [26, 8729.69]
  - - [4096, 3072, 1, 64, 4096, 4096, 64, 3072]
    - [26, 8421.33]
  - - [2560, 3584, 1, 64, 2560, 2560, 64, 3584]
    - [41, 8080.62]
  - - [3072, 3584, 1, 64, 3072, 3072, 64, 3584]
    - [41, 8518.62]
  - - [3584, 3584, 1, 64, 3584, 3584, 64, 3584]
    - [26, 9007.41]
  - - [4096, 3584, 1, 64, 4096, 4096, 64, 3584]
    - [26, 8571.4]
  - - [2560, 4096, 1, 64, 2560, 2560, 64, 4096]
    - [41, 8388.35]
  - - [3072, 4096, 1, 64, 3072, 3072, 64, 4096]
    - [42, 8791.79]
  - - [3584, 4096, 1, 64, 3584, 3584, 64, 4096]
    - [26, 9238.92]
  - - [4096, 4096, 1, 64, 4096, 4096, 64, 4096]
    - [26, 8757.3]
  - - [2560, 2560, 1, 256, 2560, 2560, 256, 2560]
    - [49, 18551.2]
  - - [3072, 2560, 1, 256, 3072, 3072, 256, 2560]
    - [51, 19399.0]
  - - [3584, 2560, 1, 256, 3584, 3584, 256, 2560]
    - [49, 19760.1]
  - - [4096, 2560, 1, 256, 4096, 4096, 256, 2560]
    - [51, 20206.5]
  - - [2560, 3072, 1, 256, 2560, 2560, 256, 3072]
    - [49, 19895.5]
  - - [3072, 3072, 1, 256, 3072, 3072, 256, 3072]
    - [51, 20923.9]
  - - [3584, 3072, 1, 256, 3584, 3584, 256, 3072]
    - [49, 20980.8]
  - - [4096, 3072, 1, 256, 4096, 4096, 256, 3072]
    - [51, 21472.6]
  - - [2560, 3584, 1, 256, 2560, 2560, 256, 3584]
    - [51, 19901.5]
  - - [3072, 3584, 1, 256, 3072, 3072, 256, 3584]
    - [51, 20855.7]
  - - [3584, 3584, 1, 256, 3584, 3584, 256, 3584]
    - [51, 21273.4]
  - - [4096, 3584, 1, 256, 4096, 4096, 256, 3584]
    - [51, 21609.4]
  - - [2560, 4096, 1, 256, 2560, 2560, 256, 4096]
    - [51, 20522.4]
  - - [3072, 4096, 1, 256, 3072, 3072, 256, 4096]
    - [51, 21450.4]
  - - [3584, 4096, 1, 256, 3584, 3584, 256, 4096]
    - [51, 21505.6]
  - - [4096, 4096, 1, 256, 4096, 4096, 256, 4096]
    - [51, 21949.0]
  - - [2560, 2560, 1, 512, 2560, 2560, 512, 2560]
    - [51, 25018.0]
  - - [3072, 2560, 1, 512, 3072, 3072, 512, 2560]
    - [51, 26240.0]
  - - [3584, 2560, 1, 512, 3584, 3584, 512, 2560]
    - [51, 26414.1]
  - - [4096, 2560, 1, 512, 4096, 4096, 512, 2560]
    - [51, 27553.2]
  - - [2560, 3072, 1, 512, 2560, 2560, 512, 3072]
    - [51, 26579.4]
  - - [3072, 3072, 1, 512, 3072, 3072, 512, 3072]
    - [51, 27997.6]
  - - [3584, 3072, 1, 512, 3584, 3584, 512, 3072]
    - [51, 28033.0]
  - - [4096, 3072, 1, 512, 4096, 4096, 512, 3072]
    - [51, 28870.8]
  - - [2560, 3584, 1, 512, 2560, 2560, 512, 3584]
    - [51, 26706.3]
  - - [3072, 3584, 1, 512, 3072, 3072, 512, 3584]
    - [51, 28077.8]
  - - [3584, 3584, 1, 512, 3584, 3584, 512, 3584]
    - [51, 28206.3]
  - - [4096, 3584, 1, 512, 4096, 4096, 512, 3584]
    - [51, 28764.3]
  - - [2560, 4096, 1, 512, 2560, 2560, 512, 4096]
    - [51, 27587.2]
  - - [3072, 4096, 1, 512, 3072, 3072, 512, 4096]
    - [51, 28756.7]
  - - [3584, 4096, 1, 512, 3584, 3584, 512, 4096]
    - [51, 28556.1]
  - - [4096, 4096, 1, 512, 4096, 4096, 512, 4096]
    - [51, 28880.3]
  - - [2560, 2560, 1, 1024, 2560, 2560, 1024, 2560]
    - [51, 30317.4]
  - - [3072, 2560, 1, 1024, 3072, 3072, 1024, 2560]
    - [51, 31579.7]
  - - [3584, 2560, 1, 1024, 3584, 3584, 1024, 2560]
    - [51, 31549.8]
  - - [4096, 2560, 1, 1024, 4096, 4096, 1024, 2560]
    - [51, 32429.9]
  - - [2560, 3072, 1, 1024, 2560, 2560, 1024, 3072]
    - [51, 32111.1]
  - - [3072, 3072, 1, 1024, 3072, 3072, 1024, 3072]
    - [51, 33083.2]
  - - [3584, 3072, 1, 1024, 3584, 3584, 1024, 3072]
    - [51, 32957.2]
  - - [4096, 3072, 1, 1024, 4096, 4096, 1024, 3072]
    - [51, 33563.2]
  - - [2560, 3584, 1, 1024, 2560, 2560, 1024, 3584]
    - [51, 31923.4]
  - - [3072, 3584, 1, 1024, 3072, 3072, 1024, 3584]
    - [51, 32528.2]
  - - [3584, 3584, 1, 1024, 3584, 3584, 1024, 3584]
    - [51, 32921.7]
  - - [4096, 3584, 1, 1024, 4096, 4096, 1024, 3584]
    - [51, 33072.9]
  - - [2560, 4096, 1, 1024, 2560, 2560, 1024, 4096]
    - [51, 32913.5]
  - - [3072, 4096, 1, 1024, 3072, 3072, 1024, 4096]
    - [51, 33496.2]
  - - [3584, 4096, 1, 1024, 3584, 3584, 1024, 4096]
    - [51, 33370.4]
  - - [4096, 4096, 1, 1024, 4096, 4096, 1024, 4096]
    - [51, 33591.2]
  - - [2560, 2560, 1, 2048, 2560, 2560, 2048, 2560]
    - [51, 32094.6]
  - - [3072, 2560, 1, 2048, 3072, 3072, 2048, 2560]
    - [51, 34512.1]
  - - [3584, 2560, 1, 2048, 3584, 3584, 2048, 2560]
    - [51, 34342.3]
  - - [4096, 2560, 1, 2048, 4096, 4096, 2048, 2560]
    - [51, 35796.3]
  - - [2560, 3072, 1, 2048, 2560, 2560, 2048, 3072]
    - [51, 34349.3]
  - - [3072, 3072, 1, 2048, 3072, 3072, 2048, 3072]
    - [51, 35613.4]
  - - [3584, 3072, 1, 2048, 3584, 3584, 2048, 3072]
    - [51, 35700.0]
  - - [4096, 3072, 1, 2048, 4096, 4096, 2048, 3072]
    - [51, 36273.9]
  - - [2560, 3584, 1, 2048, 2560, 2560, 2048, 3584]
    - [51, 34722.4]
  - - [3072, 3584, 1, 2048, 3072, 3072, 2048, 3584]
    - [51, 35487.9]
  - - [3584, 3584, 1, 2048, 3584, 3584, 2048, 3584]
    - [51, 35433.5]
  - - [4096, 3584, 1, 2048, 4096, 4096, 2048, 3584]
    - [51, 36123.5]
  - - [2560, 4096, 1, 2048, 2560, 2560, 2048, 4096]
    - [51, 35440.3]
  - - [3072, 4096, 1, 2048, 3072, 3072, 2048, 4096]
    - [51, 35478.0]
  - - [3584, 4096, 1, 2048, 3584, 3584, 2048, 4096]
    - [51, 35358.5]
  - - [4096, 4096, 1, 2048, 4096, 4096, 2048, 4096]
    - [51, 35798.6]
  - - [2560, 2560, 1, 4096, 2560, 2560, 4096, 2560]
    - [5, 35599.0]
  - - [3072, 2560, 1, 4096, 3072, 3072, 4096, 2560]
    - [51, 36442.9]
  - - [3584, 2560, 1, 4096, 3584, 3584, 4096, 2560]
    - [5, 36321.8]
  - - [4096, 2560, 1, 4096, 4096, 4096, 4096, 2560]
    - [51, 37406.4]
  - - [2560, 3072, 1, 4096, 2560, 2560, 4096, 3072]
    - [51, 36441.1]
  - - [3072, 3072, 1, 4096, 3072, 3072, 4096, 3072]
    - [51, 37431.5]
  - - [3584, 3072, 1, 4096, 3584, 3584, 4096, 3072]
    - [51, 37187.6]
  - - [4096, 3072, 1, 4096, 4096, 4096, 4096, 3072]
    - [51, 37943.1]
  - - [2560, 3584, 1, 4096, 2560, 2560, 4096, 3584]
    - [51, 36729.6]
  - - [3072, 3584, 1, 4096, 3072, 3072, 4096, 3584]
    - [51, 37071.6]
  - - [3584, 3584, 1, 4096, 3584, 3584, 4096, 3584]
    - [5, 36902.8]
  - - [4096, 3584, 1, 4096, 4096, 4096, 4096, 3584]
    - [51, 37522.8]
  - - [2560, 4096, 1, 4096, 2560, 2560, 4096, 4096]
    - [51, 36766.4]
  - - [3072, 4096, 1, 4096, 3072, 3072, 4096, 4096]
    - [51, 36839.0]
  - - [3584, 4096, 1, 4096, 3584, 3584, 4096, 4096]
    - [51, 35913.9]
  - - [4096, 4096, 1, 4096, 4096, 4096, 4096, 4096]
    - [51, 36191.3]
  - - [1, 1, 1, 1, 1, 1, 1, 1]
    - [33, 6.41252e-05]
  - - [1, 1, 1, 64, 1, 1, 64, 1]
    - [61, 0.0042247]
  - - [1, 64, 1, 1, 1, 1, 1, 64]
    - [59, 0.00414119]
  - - [64, 1, 1, 1, 64, 64, 1, 1]
    - [33, 0.00448666]
  - - [64, 64, 1, 1, 64, 64, 1, 64]
    - [11, 0.281135]
  - - [64, 1, 1, 64, 64, 64, 64, 1]
    - [7, 0.258512]
  - - [1, 64, 1, 64, 1, 1, 64, 64]
    - [59, 0.274724]
- null
- null
- DeviceEfficiency
- GridBased
