library/src/amd_detail/rocblaslt/src/Tensile/Logic/asm_full/navi31/GridBased/navi31_Cijk_Alik_Bljk_HSS_BH_Bias_HAH.yaml
- {MinimumRequiredVersion: 4.33.0}
- navi31
- gfx1100
- [Device 73f0]
    SolutionIndex: 0
    SolutionNameMin: Cijk_Alik_Bljk_HSS_BH_Bias_HAH_MT32x32x64_MI16x16x16x1_SN_MIWT1_1_WG32_4_1
    SolutionIndex: 1
    SolutionNameMin: Cijk_Alik_Bljk_HSS_BH_Bias_HAH_MT16x16x64_MI16x16x16x1_SN_MIWT1_1_WG16_2_1
    SolutionIndex: 2
    SolutionNameMin: Cijk_Alik_Bljk_HSS_BH_Bias_HAH_MT32x16x64_MI16x16x16x1_SN_MIWT1_1_WG32_2_1
    SolutionIndex: 3
    SolutionNameMin: Cijk_Alik_Bljk_HSS_BH_Bias_HAH_MT16x32x64_MI16x16x16x1_SN_MIWT1_1_WG16_4_1
- - - [64, 64, 1, 64, 64, 64, 64, 64]
    - [1, 0.095]
  - - [192, 64, 1, 64, 192, 192, 64, 64]
    - [3, 0.274]
  - - [320, 64, 1, 64, 320, 320, 64, 64]
    - [3, 0.085]
  - - [448, 64, 1, 64, 448, 448, 64, 64]
    - [3, 0.118]
  - - [576, 64, 1, 64, 576, 576, 64, 64]
    - [3, 0.152]
  - - [704, 64, 1, 64, 704, 704, 64, 64]
    - [3, 0.928]
  - - [832, 64, 1, 64, 832, 832, 64, 64]
    - [2, 0.219]
  - - [960, 64, 1, 64, 960, 960, 64, 64]
    - [1, 0.253]
  - - [1088, 64, 1, 64, 1088, 1088, 64, 64]
    - [2, 0.285]
  - - [1216, 64, 1, 64, 1216, 1216, 64, 64]
    - [2, 0.321]
  - - [1344, 64, 1, 64, 1344, 1344, 64, 64]
    - [3, 0.357]
  - - [1472, 64, 1, 64, 1472, 1472, 64, 64]
    - [2, 0.387]
  - - [1600, 64, 1, 64, 1600, 1600, 64, 64]
    - [2, 1.744]
  - - [1728, 64, 1, 64, 1728, 1728, 64, 64]
    - [1, 0.456]
  - - [1856, 64, 1, 64, 1856, 1856, 64, 64]
    - [3, 0.945]
  - - [1984, 64, 1, 64, 1984, 1984, 64, 64]
    - [3, 0.526]
  - - [2112, 64, 1, 64, 2112, 2112, 64, 64]
    - [1, 2.167]
  - - [2240, 64, 1, 64, 2240, 2240, 64, 64]
    - [3, 1.143]
  - - [2368, 64, 1, 64, 2368, 2368, 64, 64]
    - [1, 1.219]
  - - [2496, 64, 1, 64, 2496, 2496, 64, 64]
    - [3, 0.684]
  - - [2624, 64, 1, 64, 2624, 2624, 64, 64]
    - [3, 0.695]
  - - [2752, 64, 1, 64, 2752, 2752, 64, 64]
    - [1, 1.413]
  - - [2880, 64, 1, 64, 2880, 2880, 64, 64]
    - [0, 0.765]
  - - [3008, 64, 1, 64, 3008, 3008, 64, 64]
    - [2, 0.797]
  - - [3136, 64, 1, 64, 3136, 3136, 64, 64]
    - [2, 1.591]
  - - [3264, 64, 1, 64, 3264, 3264, 64, 64]
    - [3, 1.679]
  - - [3392, 64, 1, 64, 3392, 3392, 64, 64]
    - [3, 1.722]
  - - [3520, 64, 1, 64, 3520, 3520, 64, 64]
    - [0, 1.797]
  - - [3648, 64, 1, 64, 3648, 3648, 64, 64]
    - [2, 1.857]
  - - [3776, 64, 1, 64, 3776, 3776, 64, 64]
    - [0, 1.936]
  - - [3904, 64, 1, 64, 3904, 3904, 64, 64]
    - [0, 1.995]
  - - [4032, 64, 1, 64, 4032, 4032, 64, 64]
    - [3, 2.043]
  - - [64, 192, 1, 64, 64, 64, 64, 64]
    - [3, 0.051]
  - - [192, 192, 1, 64, 192, 192, 64, 64]
    - [2, 0.153]
  - - [320, 192, 1, 64, 320, 320, 64, 64]
    - [1, 0.492]
  - - [448, 192, 1, 64, 448, 448, 64, 64]
    - [3, 0.355]
  - - [576, 192, 1, 64, 576, 576, 64, 64]
    - [3, 0.884]
  - - [704, 192, 1, 64, 704, 704, 64, 64]
    - [2, 1.074]
  - - [832, 192, 1, 64, 832, 832, 64, 64]
    - [1, 1.275]
  - - [960, 192, 1, 64, 960, 960, 64, 64]
    - [3, 1.477]
  - - [1088, 192, 1, 64, 1088, 1088, 64, 64]
    - [3, 1.667]
  - - [1216, 192, 1, 64, 1216, 1216, 64, 64]
    - [3, 1.863]
  - - [1344, 192, 1, 64, 1344, 1344, 64, 64]
    - [2, 2.056]
  - - [1472, 192, 1, 64, 1472, 1472, 64, 64]
    - [1, 2.246]
  - - [1600, 192, 1, 64, 1600, 1600, 64, 64]
    - [0, 2.452]
  - - [1728, 192, 1, 64, 1728, 1728, 64, 64]
    - [0, 2.642]
  - - [1856, 192, 1, 64, 1856, 1856, 64, 64]
    - [3, 2.82]
  - - [1984, 192, 1, 64, 1984, 1984, 64, 64]
    - [2, 3.03]
  - - [2112, 192, 1, 64, 2112, 2112, 64, 64]
    - [0, 3.221]
  - - [2240, 192, 1, 64, 2240, 2240, 64, 64]
    - [0, 3.406]
  - - [2368, 192, 1, 64, 2368, 2368, 64, 64]
    - [1, 3.624]
  - - [2496, 192, 1, 64, 2496, 2496, 64, 64]
    - [3, 3.773]
  - - [2624, 192, 1, 64, 2624, 2624, 64, 64]
    - [2, 3.991]
  - - [2752, 192, 1, 64, 2752, 2752, 64, 64]
    - [0, 5.027]
  - - [2880, 192, 1, 64, 2880, 2880, 64, 64]
    - [0, 4.436]
  - - [3008, 192, 1, 64, 3008, 3008, 64, 64]
    - [0, 4.621]
  - - [3136, 192, 1, 64, 3136, 3136, 64, 64]
    - [0, 4.815]
  - - [3264, 192, 1, 64, 3264, 3264, 64, 64]
    - [0, 4.987]
  - - [3392, 192, 1, 64, 3392, 3392, 64, 64]
    - [0, 5.192]
  - - [3520, 192, 1, 64, 3520, 3520, 64, 64]
    - [0, 5.388]
  - - [3648, 192, 1, 64, 3648, 3648, 64, 64]
    - [0, 5.596]
  - - [3776, 192, 1, 64, 3776, 3776, 64, 64]
    - [0, 5.725]
  - - [3904, 192, 1, 64, 3904, 3904, 64, 64]
    - [0, 5.847]
  - - [4032, 192, 1, 64, 4032, 4032, 64, 64]
    - [0, 6.069]
  - - [64, 320, 1, 64, 64, 64, 64, 64]
    - [3, 0.084]
  - - [192, 320, 1, 64, 192, 192, 64, 64]
    - [3, 0.254]
  - - [320, 320, 1, 64, 320, 320, 64, 64]
    - [2, 0.423]
  - - [448, 320, 1, 64, 448, 448, 64, 64]
    - [0, 0.595]
  - - [576, 320, 1, 64, 576, 576, 64, 64]
    - [2, 0.76]
  - - [704, 320, 1, 64, 704, 704, 64, 64]
    - [1, 1.788]
  - - [832, 320, 1, 64, 832, 832, 64, 64]
    - [3, 2.124]
  - - [960, 320, 1, 64, 960, 960, 64, 64]
    - [3, 2.468]
  - - [1088, 320, 1, 64, 1088, 1088, 64, 64]
    - [0, 2.78]
  - - [1216, 320, 1, 64, 1216, 1216, 64, 64]
    - [3, 3.126]
  - - [1344, 320, 1, 64, 1344, 1344, 64, 64]
    - [0, 3.446]
  - - [1472, 320, 1, 64, 1472, 1472, 64, 64]
    - [1, 3.761]
  - - [1600, 320, 1, 64, 1600, 1600, 64, 64]
    - [0, 4.084]
  - - [1728, 320, 1, 64, 1728, 1728, 64, 64]
    - [2, 4.431]
  - - [1856, 320, 1, 64, 1856, 1856, 64, 64]
    - [0, 4.74]
  - - [1984, 320, 1, 64, 1984, 1984, 64, 64]
    - [0, 5.043]
  - - [2112, 320, 1, 64, 2112, 2112, 64, 64]
    - [0, 5.351]
  - - [2240, 320, 1, 64, 2240, 2240, 64, 64]
    - [0, 5.699]
  - - [2368, 320, 1, 64, 2368, 2368, 64, 64]
    - [0, 5.87]
  - - [2496, 320, 1, 64, 2496, 2496, 64, 64]
    - [0, 5.96]
  - - [2624, 320, 1, 64, 2624, 2624, 64, 64]
    - [0, 6.138]
  - - [2752, 320, 1, 64, 2752, 2752, 64, 64]
    - [0, 6.197]
  - - [2880, 320, 1, 64, 2880, 2880, 64, 64]
    - [0, 6.3]
  - - [3008, 320, 1, 64, 3008, 3008, 64, 64]
    - [0, 6.368]
  - - [3136, 320, 1, 64, 3136, 3136, 64, 64]
    - [0, 6.398]
  - - [3264, 320, 1, 64, 3264, 3264, 64, 64]
    - [0, 6.449]
  - - [3392, 320, 1, 64, 3392, 3392, 64, 64]
    - [0, 6.642]
  - - [3520, 320, 1, 64, 3520, 3520, 64, 64]
    - [0, 6.742]
  - - [3648, 320, 1, 64, 3648, 3648, 64, 64]
    - [0, 6.74]
  - - [3776, 320, 1, 64, 3776, 3776, 64, 64]
    - [0, 6.879]
  - - [3904, 320, 1, 64, 3904, 3904, 64, 64]
    - [0, 6.916]
  - - [4032, 320, 1, 64, 4032, 4032, 64, 64]
    - [0, 6.974]
  - - [64, 448, 1, 64, 64, 64, 64, 64]
    - [3, 0.119]
  - - [192, 448, 1, 64, 192, 192, 64, 64]
    - [3, 0.355]
  - - [320, 448, 1, 64, 320, 320, 64, 64]
    - [0, 0.594]
  - - [448, 448, 1, 64, 448, 448, 64, 64]
    - [3, 2.675]
  - - [576, 448, 1, 64, 576, 576, 64, 64]
    - [0, 3.509]
  - - [704, 448, 1, 64, 704, 704, 64, 64]
    - [0, 3.962]
  - - [832, 448, 1, 64, 832, 832, 64, 64]
    - [0, 4.402]
  - - [960, 448, 1, 64, 960, 960, 64, 64]
    - [0, 4.558]
  - - [1088, 448, 1, 64, 1088, 1088, 64, 64]
    - [0, 4.884]
  - - [1216, 448, 1, 64, 1216, 1216, 64, 64]
    - [0, 5.17]
  - - [1344, 448, 1, 64, 1344, 1344, 64, 64]
    - [0, 5.436]
  - - [1472, 448, 1, 64, 1472, 1472, 64, 64]
    - [0, 5.66]
  - - [1600, 448, 1, 64, 1600, 1600, 64, 64]
    - [0, 5.752]
  - - [1728, 448, 1, 64, 1728, 1728, 64, 64]
    - [0, 5.952]
  - - [1856, 448, 1, 64, 1856, 1856, 64, 64]
    - [0, 6.112]
  - - [1984, 448, 1, 64, 1984, 1984, 64, 64]
    - [0, 6.249]
  - - [2112, 448, 1, 64, 2112, 2112, 64, 64]
    - [0, 6.347]
  - - [2240, 448, 1, 64, 2240, 2240, 64, 64]
    - [0, 6.481]
  - - [2368, 448, 1, 64, 2368, 2368, 64, 64]
    - [0, 6.522]
  - - [2496, 448, 1, 64, 2496, 2496, 64, 64]
    - [0, 6.707]
  - - [2624, 448, 1, 64, 2624, 2624, 64, 64]
    - [0, 6.638]
  - - [2752, 448, 1, 64, 2752, 2752, 64, 64]
    - [0, 6.874]
  - - [2880, 448, 1, 64, 2880, 2880, 64, 64]
    - [0, 6.977]
  - - [3008, 448, 1, 64, 3008, 3008, 64, 64]
    - [0, 7.042]
  - - [3136, 448, 1, 64, 3136, 3136, 64, 64]
    - [0, 7.105]
  - - [3264, 448, 1, 64, 3264, 3264, 64, 64]
    - [0, 7.183]
  - - [3392, 448, 1, 64, 3392, 3392, 64, 64]
    - [0, 7.235]
  - - [3520, 448, 1, 64, 3520, 3520, 64, 64]
    - [0, 7.327]
  - - [3648, 448, 1, 64, 3648, 3648, 64, 64]
    - [0, 7.416]
  - - [3776, 448, 1, 64, 3776, 3776, 64, 64]
    - [0, 7.448]
  - - [3904, 448, 1, 64, 3904, 3904, 64, 64]
    - [0, 7.448]
  - - [4032, 448, 1, 64, 4032, 4032, 64, 64]
    - [0, 7.581]
  - - [64, 576, 1, 64, 64, 64, 64, 64]
    - [0, 0.794]
  - - [192, 576, 1, 64, 192, 192, 64, 64]
    - [0, 1.909]
  - - [320, 576, 1, 64, 320, 320, 64, 64]
    - [0, 2.906]
  - - [448, 576, 1, 64, 448, 448, 64, 64]
    - [0, 3.497]
  - - [576, 576, 1, 64, 576, 576, 64, 64]
    - [0, 4.172]
  - - [704, 576, 1, 64, 704, 704, 64, 64]
    - [0, 4.512]
  - - [832, 576, 1, 64, 832, 832, 64, 64]
    - [0, 4.923]
  - - [960, 576, 1, 64, 960, 960, 64, 64]
    - [0, 5.215]
  - - [1088, 576, 1, 64, 1088, 1088, 64, 64]
    - [0, 5.574]
  - - [1216, 576, 1, 64, 1216, 1216, 64, 64]
    - [0, 5.699]
  - - [1344, 576, 1, 64, 1344, 1344, 64, 64]
    - [0, 5.936]
  - - [1472, 576, 1, 64, 1472, 1472, 64, 64]
    - [0, 6.059]
  - - [1600, 576, 1, 64, 1600, 1600, 64, 64]
    - [0, 6.295]
  - - [1728, 576, 1, 64, 1728, 1728, 64, 64]
    - [0, 6.503]
  - - [1856, 576, 1, 64, 1856, 1856, 64, 64]
    - [0, 6.551]
  - - [1984, 576, 1, 64, 1984, 1984, 64, 64]
    - [0, 6.721]
  - - [2112, 576, 1, 64, 2112, 2112, 64, 64]
    - [0, 6.863]
  - - [2240, 576, 1, 64, 2240, 2240, 64, 64]
    - [0, 6.967]
  - - [2368, 576, 1, 64, 2368, 2368, 64, 64]
    - [0, 7.004]
  - - [2496, 576, 1, 64, 2496, 2496, 64, 64]
    - [0, 7.16]
  - - [2624, 576, 1, 64, 2624, 2624, 64, 64]
    - [0, 7.287]
  - - [2752, 576, 1, 64, 2752, 2752, 64, 64]
    - [0, 7.287]
  - - [2880, 576, 1, 64, 2880, 2880, 64, 64]
    - [0, 7.366]
  - - [3008, 576, 1, 64, 3008, 3008, 64, 64]
    - [0, 7.457]
  - - [3136, 576, 1, 64, 3136, 3136, 64, 64]
    - [0, 7.563]
  - - [3264, 576, 1, 64, 3264, 3264, 64, 64]
    - [0, 7.548]
  - - [3392, 576, 1, 64, 3392, 3392, 64, 64]
    - [0, 6.845]
  - - [3520, 576, 1, 64, 3520, 3520, 64, 64]
    - [0, 7.764]
  - - [3648, 576, 1, 64, 3648, 3648, 64, 64]
    - [0, 7.784]
  - - [3776, 576, 1, 64, 3776, 3776, 64, 64]
    - [0, 7.774]
  - - [3904, 576, 1, 64, 3904, 3904, 64, 64]
    - [0, 7.887]
  - - [4032, 576, 1, 64, 4032, 4032, 64, 64]
    - [0, 7.926]
  - - [64, 704, 1, 64, 64, 64, 64, 64]
    - [0, 0.969]
  - - [192, 704, 1, 64, 192, 192, 64, 64]
    - [0, 2.321]
  - - [320, 704, 1, 64, 320, 320, 64, 64]
    - [0, 3.292]
  - - [448, 704, 1, 64, 448, 448, 64, 64]
    - [0, 3.972]
  - - [576, 704, 1, 64, 576, 576, 64, 64]
    - [0, 4.517]
  - - [704, 704, 1, 64, 704, 704, 64, 64]
    - [0, 4.947]
  - - [832, 704, 1, 64, 832, 832, 64, 64]
    - [0, 5.478]
  - - [960, 704, 1, 64, 960, 960, 64, 64]
    - [0, 5.7]
  - - [1088, 704, 1, 64, 1088, 1088, 64, 64]
    - [0, 5.901]
  - - [1216, 704, 1, 64, 1216, 1216, 64, 64]
    - [0, 6.104]
  - - [1344, 704, 1, 64, 1344, 1344, 64, 64]
    - [0, 6.321]
  - - [1472, 704, 1, 64, 1472, 1472, 64, 64]
    - [0, 6.576]
  - - [1600, 704, 1, 64, 1600, 1600, 64, 64]
    - [0, 6.726]
  - - [1728, 704, 1, 64, 1728, 1728, 64, 64]
    - [0, 6.925]
  - - [1856, 704, 1, 64, 1856, 1856, 64, 64]
    - [0, 7.026]
  - - [1984, 704, 1, 64, 1984, 1984, 64, 64]
    - [0, 7.117]
  - - [2112, 704, 1, 64, 2112, 2112, 64, 64]
    - [0, 7.258]
  - - [2240, 704, 1, 64, 2240, 2240, 64, 64]
    - [0, 7.293]
  - - [2368, 704, 1, 64, 2368, 2368, 64, 64]
    - [0, 7.415]
  - - [2496, 704, 1, 64, 2496, 2496, 64, 64]
    - [0, 7.502]
  - - [2624, 704, 1, 64, 2624, 2624, 64, 64]
    - [0, 7.576]
  - - [2752, 704, 1, 64, 2752, 2752, 64, 64]
    - [0, 7.676]
  - - [2880, 704, 1, 64, 2880, 2880, 64, 64]
    - [0, 7.702]
  - - [3008, 704, 1, 64, 3008, 3008, 64, 64]
    - [0, 7.746]
  - - [3136, 704, 1, 64, 3136, 3136, 64, 64]
    - [0, 7.829]
  - - [3264, 704, 1, 64, 3264, 3264, 64, 64]
    - [0, 7.9]
  - - [3392, 704, 1, 64, 3392, 3392, 64, 64]
    - [0, 7.861]
  - - [3520, 704, 1, 64, 3520, 3520, 64, 64]
    - [0, 8.047]
  - - [3648, 704, 1, 64, 3648, 3648, 64, 64]
    - [0, 8.006]
  - - [3776, 704, 1, 64, 3776, 3776, 64, 64]
    - [0, 8.029]
  - - [3904, 704, 1, 64, 3904, 3904, 64, 64]
    - [0, 8.096]
  - - [4032, 704, 1, 64, 4032, 4032, 64, 64]
    - [0, 8.174]
  - - [64, 832, 1, 64, 64, 64, 64, 64]
    - [0, 1.025]
  - - [192, 832, 1, 64, 192, 192, 64, 64]
    - [0, 2.535]
  - - [320, 832, 1, 64, 320, 320, 64, 64]
    - [0, 3.604]
  - - [448, 832, 1, 64, 448, 448, 64, 64]
    - [0, 4.393]
  - - [576, 832, 1, 64, 576, 576, 64, 64]
    - [0, 4.901]
  - - [704, 832, 1, 64, 704, 704, 64, 64]
    - [0, 5.455]
  - - [832, 832, 1, 64, 832, 832, 64, 64]
    - [0, 5.703]
  - - [960, 832, 1, 64, 960, 960, 64, 64]
    - [0, 5.988]
  - - [1088, 832, 1, 64, 1088, 1088, 64, 64]
    - [0, 6.218]
  - - [1216, 832, 1, 64, 1216, 1216, 64, 64]
    - [0, 6.475]
  - - [1344, 832, 1, 64, 1344, 1344, 64, 64]
    - [0, 6.7]
  - - [1472, 832, 1, 64, 1472, 1472, 64, 64]
    - [0, 6.851]
  - - [1600, 832, 1, 64, 1600, 1600, 64, 64]
    - [0, 7.036]
  - - [1728, 832, 1, 64, 1728, 1728, 64, 64]
    - [0, 7.126]
  - - [1856, 832, 1, 64, 1856, 1856, 64, 64]
    - [0, 7.227]
  - - [1984, 832, 1, 64, 1984, 1984, 64, 64]
    - [0, 7.42]
  - - [2112, 832, 1, 64, 2112, 2112, 64, 64]
    - [0, 7.481]
  - - [2240, 832, 1, 64, 2240, 2240, 64, 64]
    - [0, 7.577]
  - - [2368, 832, 1, 64, 2368, 2368, 64, 64]
    - [0, 7.136]
  - - [2496, 832, 1, 64, 2496, 2496, 64, 64]
    - [0, 7.767]
  - - [2624, 832, 1, 64, 2624, 2624, 64, 64]
    - [0, 7.765]
  - - [2752, 832, 1, 64, 2752, 2752, 64, 64]
    - [0, 7.849]
  - - [2880, 832, 1, 64, 2880, 2880, 64, 64]
    - [0, 7.88]
  - - [3008, 832, 1, 64, 3008, 3008, 64, 64]
    - [0, 7.866]
  - - [3136, 832, 1, 64, 3136, 3136, 64, 64]
    - [0, 7.968]
  - - [3264, 832, 1, 64, 3264, 3264, 64, 64]
    - [0, 8.072]
  - - [3392, 832, 1, 64, 3392, 3392, 64, 64]
    - [0, 8.057]
  - - [3520, 832, 1, 64, 3520, 3520, 64, 64]
    - [0, 7.988]
  - - [3648, 832, 1, 64, 3648, 3648, 64, 64]
    - [0, 8.093]
  - - [3776, 832, 1, 64, 3776, 3776, 64, 64]
    - [0, 8.158]
  - - [3904, 832, 1, 64, 3904, 3904, 64, 64]
    - [0, 8.235]
  - - [4032, 832, 1, 64, 4032, 4032, 64, 64]
    - [0, 8.246]
  - - [64, 960, 1, 64, 64, 64, 64, 64]
    - [2, 0.255]
  - - [192, 960, 1, 64, 192, 192, 64, 64]
    - [2, 0.762]
  - - [320, 960, 1, 64, 320, 320, 64, 64]
    - [2, 2.447]
  - - [448, 960, 1, 64, 448, 448, 64, 64]
    - [0, 3.448]
  - - [576, 960, 1, 64, 576, 576, 64, 64]
    - [0, 4.43]
  - - [704, 960, 1, 64, 704, 704, 64, 64]
    - [0, 5.422]
  - - [832, 960, 1, 64, 832, 832, 64, 64]
    - [0, 5.951]
  - - [960, 960, 1, 64, 960, 960, 64, 64]
    - [0, 6.22]
  - - [1088, 960, 1, 64, 1088, 1088, 64, 64]
    - [0, 6.415]
  - - [1216, 960, 1, 64, 1216, 1216, 64, 64]
    - [0, 6.7]
  - - [1344, 960, 1, 64, 1344, 1344, 64, 64]
    - [0, 6.84]
  - - [1472, 960, 1, 64, 1472, 1472, 64, 64]
    - [0, 7.066]
  - - [1600, 960, 1, 64, 1600, 1600, 64, 64]
    - [0, 7.144]
  - - [1728, 960, 1, 64, 1728, 1728, 64, 64]
    - [0, 7.285]
  - - [1856, 960, 1, 64, 1856, 1856, 64, 64]
    - [0, 7.351]
  - - [1984, 960, 1, 64, 1984, 1984, 64, 64]
    - [0, 7.596]
  - - [2112, 960, 1, 64, 2112, 2112, 64, 64]
    - [0, 7.666]
  - - [2240, 960, 1, 64, 2240, 2240, 64, 64]
    - [0, 7.682]
  - - [2368, 960, 1, 64, 2368, 2368, 64, 64]
    - [0, 7.73]
  - - [2496, 960, 1, 64, 2496, 2496, 64, 64]
    - [0, 7.782]
  - - [2624, 960, 1, 64, 2624, 2624, 64, 64]
    - [0, 7.865]
  - - [2752, 960, 1, 64, 2752, 2752, 64, 64]
    - [0, 7.953]
  - - [2880, 960, 1, 64, 2880, 2880, 64, 64]
    - [0, 8.022]
  - - [3008, 960, 1, 64, 3008, 3008, 64, 64]
    - [0, 8.12]
  - - [3136, 960, 1, 64, 3136, 3136, 64, 64]
    - [0, 8.135]
  - - [3264, 960, 1, 64, 3264, 3264, 64, 64]
    - [0, 8.092]
  - - [3392, 960, 1, 64, 3392, 3392, 64, 64]
    - [0, 8.187]
  - - [3520, 960, 1, 64, 3520, 3520, 64, 64]
    - [0, 8.213]
  - - [3648, 960, 1, 64, 3648, 3648, 64, 64]
    - [0, 8.274]
  - - [3776, 960, 1, 64, 3776, 3776, 64, 64]
    - [0, 8.335]
  - - [3904, 960, 1, 64, 3904, 3904, 64, 64]
    - [0, 8.362]
  - - [4032, 960, 1, 64, 4032, 4032, 64, 64]
    - [0, 8.347]
  - - [64, 1088, 1, 64, 64, 64, 64, 64]
    - [3, 0.29]
  - - [192, 1088, 1, 64, 192, 192, 64, 64]
    - [3, 1.695]
  - - [320, 1088, 1, 64, 320, 320, 64, 64]
    - [1, 2.771]
  - - [448, 1088, 1, 64, 448, 448, 64, 64]
    - [0, 3.904]
  - - [576, 1088, 1, 64, 576, 576, 64, 64]
    - [0, 5.027]
  - - [704, 1088, 1, 64, 704, 704, 64, 64]
    - [0, 5.874]
  - - [832, 1088, 1, 64, 832, 832, 64, 64]
    - [0, 6.186]
  - - [960, 1088, 1, 64, 960, 960, 64, 64]
    - [0, 6.393]
  - - [1088, 1088, 1, 64, 1088, 1088, 64, 64]
    - [0, 6.731]
  - - [1216, 1088, 1, 64, 1216, 1216, 64, 64]
    - [0, 6.848]
  - - [1344, 1088, 1, 64, 1344, 1344, 64, 64]
    - [0, 7.061]
  - - [1472, 1088, 1, 64, 1472, 1472, 64, 64]
    - [0, 7.281]
  - - [1600, 1088, 1, 64, 1600, 1600, 64, 64]
    - [0, 7.307]
  - - [1728, 1088, 1, 64, 1728, 1728, 64, 64]
    - [0, 7.499]
  - - [1856, 1088, 1, 64, 1856, 1856, 64, 64]
    - [0, 7.671]
  - - [1984, 1088, 1, 64, 1984, 1984, 64, 64]
    - [0, 7.702]
  - - [2112, 1088, 1, 64, 2112, 2112, 64, 64]
    - [0, 7.827]
  - - [2240, 1088, 1, 64, 2240, 2240, 64, 64]
    - [0, 7.85]
  - - [2368, 1088, 1, 64, 2368, 2368, 64, 64]
    - [0, 7.907]
  - - [2496, 1088, 1, 64, 2496, 2496, 64, 64]
    - [0, 7.989]
  - - [2624, 1088, 1, 64, 2624, 2624, 64, 64]
    - [0, 8.072]
  - - [2752, 1088, 1, 64, 2752, 2752, 64, 64]
    - [0, 8.089]
  - - [2880, 1088, 1, 64, 2880, 2880, 64, 64]
    - [0, 8.077]
  - - [3008, 1088, 1, 64, 3008, 3008, 64, 64]
    - [0, 8.222]
  - - [3136, 1088, 1, 64, 3136, 3136, 64, 64]
    - [0, 8.245]
  - - [3264, 1088, 1, 64, 3264, 3264, 64, 64]
    - [0, 8.276]
  - - [3392, 1088, 1, 64, 3392, 3392, 64, 64]
    - [0, 8.33]
  - - [3520, 1088, 1, 64, 3520, 3520, 64, 64]
    - [0, 8.356]
  - - [3648, 1088, 1, 64, 3648, 3648, 64, 64]
    - [0, 8.409]
  - - [3776, 1088, 1, 64, 3776, 3776, 64, 64]
    - [0, 8.324]
  - - [3904, 1088, 1, 64, 3904, 3904, 64, 64]
    - [0, 8.397]
  - - [4032, 1088, 1, 64, 4032, 4032, 64, 64]
    - [0, 8.45]
  - - [64, 1216, 1, 64, 64, 64, 64, 64]
    - [2, 0.322]
  - - [192, 1216, 1, 64, 192, 192, 64, 64]
    - [3, 2.934]
  - - [320, 1216, 1, 64, 320, 320, 64, 64]
    - [0, 3.127]
  - - [448, 1216, 1, 64, 448, 448, 64, 64]
    - [0, 4.39]
  - - [576, 1216, 1, 64, 576, 576, 64, 64]
    - [0, 5.628]
  - - [704, 1216, 1, 64, 704, 704, 64, 64]
    - [0, 6.058]
  - - [832, 1216, 1, 64, 832, 832, 64, 64]
    - [0, 6.38]
  - - [960, 1216, 1, 64, 960, 960, 64, 64]
    - [0, 6.669]
  - - [1088, 1216, 1, 64, 1088, 1088, 64, 64]
    - [0, 6.904]
  - - [1216, 1216, 1, 64, 1216, 1216, 64, 64]
    - [0, 7.123]
  - - [1344, 1216, 1, 64, 1344, 1344, 64, 64]
    - [0, 7.282]
  - - [1472, 1216, 1, 64, 1472, 1472, 64, 64]
    - [0, 7.397]
  - - [1600, 1216, 1, 64, 1600, 1600, 64, 64]
    - [0, 7.511]
  - - [1728, 1216, 1, 64, 1728, 1728, 64, 64]
    - [0, 7.623]
  - - [1856, 1216, 1, 64, 1856, 1856, 64, 64]
    - [0, 7.764]
  - - [1984, 1216, 1, 64, 1984, 1984, 64, 64]
    - [0, 7.872]
  - - [2112, 1216, 1, 64, 2112, 2112, 64, 64]
    - [0, 7.923]
  - - [2240, 1216, 1, 64, 2240, 2240, 64, 64]
    - [0, 8.035]
  - - [2368, 1216, 1, 64, 2368, 2368, 64, 64]
    - [0, 8.088]
  - - [2496, 1216, 1, 64, 2496, 2496, 64, 64]
    - [0, 8.121]
  - - [2624, 1216, 1, 64, 2624, 2624, 64, 64]
    - [0, 8.2]
  - - [2752, 1216, 1, 64, 2752, 2752, 64, 64]
    - [0, 8.223]
  - - [2880, 1216, 1, 64, 2880, 2880, 64, 64]
    - [0, 8.327]
  - - [3008, 1216, 1, 64, 3008, 3008, 64, 64]
    - [0, 8.345]
  - - [3136, 1216, 1, 64, 3136, 3136, 64, 64]
    - [0, 8.408]
  - - [3264, 1216, 1, 64, 3264, 3264, 64, 64]
    - [0, 8.493]
  - - [3392, 1216, 1, 64, 3392, 3392, 64, 64]
    - [0, 8.649]
  - - [3520, 1216, 1, 64, 3520, 3520, 64, 64]
    - [0, 8.461]
  - - [3648, 1216, 1, 64, 3648, 3648, 64, 64]
    - [0, 8.5]
  - - [3776, 1216, 1, 64, 3776, 3776, 64, 64]
    - [0, 8.714]
  - - [3904, 1216, 1, 64, 3904, 3904, 64, 64]
    - [0, 8.656]
  - - [4032, 1216, 1, 64, 4032, 4032, 64, 64]
    - [0, 8.61]
  - - [64, 1344, 1, 64, 64, 64, 64, 64]
    - [0, 1.632]
  - - [192, 1344, 1, 64, 192, 192, 64, 64]
    - [0, 3.442]
  - - [320, 1344, 1, 64, 320, 320, 64, 64]
    - [0, 4.479]
  - - [448, 1344, 1, 64, 448, 448, 64, 64]
    - [0, 5.335]
  - - [576, 1344, 1, 64, 576, 576, 64, 64]
    - [0, 5.891]
  - - [704, 1344, 1, 64, 704, 704, 64, 64]
    - [0, 6.22]
  - - [832, 1344, 1, 64, 832, 832, 64, 64]
    - [0, 6.591]
  - - [960, 1344, 1, 64, 960, 960, 64, 64]
    - [0, 6.92]
  - - [1088, 1344, 1, 64, 1088, 1088, 64, 64]
    - [0, 7.053]
  - - [1216, 1344, 1, 64, 1216, 1216, 64, 64]
    - [0, 7.283]
  - - [1344, 1344, 1, 64, 1344, 1344, 64, 64]
    - [0, 7.462]
  - - [1472, 1344, 1, 64, 1472, 1472, 64, 64]
    - [0, 7.585]
  - - [1600, 1344, 1, 64, 1600, 1600, 64, 64]
    - [0, 7.714]
  - - [1728, 1344, 1, 64, 1728, 1728, 64, 64]
    - [0, 7.803]
  - - [1856, 1344, 1, 64, 1856, 1856, 64, 64]
    - [0, 7.91]
  - - [1984, 1344, 1, 64, 1984, 1984, 64, 64]
    - [0, 8.033]
  - - [2112, 1344, 1, 64, 2112, 2112, 64, 64]
    - [0, 8.076]
  - - [2240, 1344, 1, 64, 2240, 2240, 64, 64]
    - [0, 8.146]
  - - [2368, 1344, 1, 64, 2368, 2368, 64, 64]
    - [0, 8.192]
  - - [2496, 1344, 1, 64, 2496, 2496, 64, 64]
    - [0, 8.187]
  - - [2624, 1344, 1, 64, 2624, 2624, 64, 64]
    - [0, 8.312]
  - - [2752, 1344, 1, 64, 2752, 2752, 64, 64]
    - [0, 8.36]
  - - [2880, 1344, 1, 64, 2880, 2880, 64, 64]
    - [0, 8.351]
  - - [3008, 1344, 1, 64, 3008, 3008, 64, 64]
    - [0, 8.422]
  - - [3136, 1344, 1, 64, 3136, 3136, 64, 64]
    - [0, 8.408]
  - - [3264, 1344, 1, 64, 3264, 3264, 64, 64]
    - [0, 8.684]
  - - [3392, 1344, 1, 64, 3392, 3392, 64, 64]
    - [0, 8.511]
  - - [3520, 1344, 1, 64, 3520, 3520, 64, 64]
    - [0, 8.531]
  - - [3648, 1344, 1, 64, 3648, 3648, 64, 64]
    - [0, 8.639]
  - - [3776, 1344, 1, 64, 3776, 3776, 64, 64]
    - [0, 8.701]
  - - [3904, 1344, 1, 64, 3904, 3904, 64, 64]
    - [0, 8.556]
  - - [4032, 1344, 1, 64, 4032, 4032, 64, 64]
    - [0, 8.662]
  - - [64, 1472, 1, 64, 64, 64, 64, 64]
    - [0, 1.786]
  - - [192, 1472, 1, 64, 192, 192, 64, 64]
    - [0, 3.792]
  - - [320, 1472, 1, 64, 320, 320, 64, 64]
    - [0, 4.811]
  - - [448, 1472, 1, 64, 448, 448, 64, 64]
    - [0, 5.527]
  - - [576, 1472, 1, 64, 576, 576, 64, 64]
    - [0, 6.014]
  - - [704, 1472, 1, 64, 704, 704, 64, 64]
    - [0, 6.427]
  - - [832, 1472, 1, 64, 832, 832, 64, 64]
    - [0, 6.811]
  - - [960, 1472, 1, 64, 960, 960, 64, 64]
    - [0, 7.062]
  - - [1088, 1472, 1, 64, 1088, 1088, 64, 64]
    - [0, 7.277]
  - - [1216, 1472, 1, 64, 1216, 1216, 64, 64]
    - [0, 7.419]
  - - [1344, 1472, 1, 64, 1344, 1344, 64, 64]
    - [0, 7.612]
  - - [1472, 1472, 1, 64, 1472, 1472, 64, 64]
    - [0, 7.71]
  - - [1600, 1472, 1, 64, 1600, 1600, 64, 64]
    - [0, 7.866]
  - - [1728, 1472, 1, 64, 1728, 1728, 64, 64]
    - [0, 7.927]
  - - [1856, 1472, 1, 64, 1856, 1856, 64, 64]
    - [0, 8.091]
  - - [1984, 1472, 1, 64, 1984, 1984, 64, 64]
    - [0, 8.07]
  - - [2112, 1472, 1, 64, 2112, 2112, 64, 64]
    - [0, 8.221]
  - - [2240, 1472, 1, 64, 2240, 2240, 64, 64]
    - [0, 8.229]
  - - [2368, 1472, 1, 64, 2368, 2368, 64, 64]
    - [0, 8.278]
  - - [2496, 1472, 1, 64, 2496, 2496, 64, 64]
    - [0, 8.36]
  - - [2624, 1472, 1, 64, 2624, 2624, 64, 64]
    - [0, 8.382]
  - - [2752, 1472, 1, 64, 2752, 2752, 64, 64]
    - [0, 8.445]
  - - [2880, 1472, 1, 64, 2880, 2880, 64, 64]
    - [0, 8.383]
  - - [3008, 1472, 1, 64, 3008, 3008, 64, 64]
    - [0, 8.547]
  - - [3136, 1472, 1, 64, 3136, 3136, 64, 64]
    - [0, 8.709]
  - - [3264, 1472, 1, 64, 3264, 3264, 64, 64]
    - [0, 8.613]
  - - [3392, 1472, 1, 64, 3392, 3392, 64, 64]
    - [0, 8.592]
  - - [3520, 1472, 1, 64, 3520, 3520, 64, 64]
    - [0, 8.69]
  - - [3648, 1472, 1, 64, 3648, 3648, 64, 64]
    - [0, 8.277]
  - - [3776, 1472, 1, 64, 3776, 3776, 64, 64]
    - [0, 8.716]
  - - [3904, 1472, 1, 64, 3904, 3904, 64, 64]
    - [0, 8.683]
  - - [4032, 1472, 1, 64, 4032, 4032, 64, 64]
    - [0, 8.741]
  - - [64, 1600, 1, 64, 64, 64, 64, 64]
    - [0, 1.76]
  - - [192, 1600, 1, 64, 192, 192, 64, 64]
    - [0, 3.832]
  - - [320, 1600, 1, 64, 320, 320, 64, 64]
    - [0, 5.038]
  - - [448, 1600, 1, 64, 448, 448, 64, 64]
    - [0, 5.652]
  - - [576, 1600, 1, 64, 576, 576, 64, 64]
    - [0, 6.304]
  - - [704, 1600, 1, 64, 704, 704, 64, 64]
    - [0, 6.593]
  - - [832, 1600, 1, 64, 832, 832, 64, 64]
    - [0, 6.905]
  - - [960, 1600, 1, 64, 960, 960, 64, 64]
    - [0, 7.13]
  - - [1088, 1600, 1, 64, 1088, 1088, 64, 64]
    - [0, 7.381]
  - - [1216, 1600, 1, 64, 1216, 1216, 64, 64]
    - [0, 7.462]
  - - [1344, 1600, 1, 64, 1344, 1344, 64, 64]
    - [0, 7.759]
  - - [1472, 1600, 1, 64, 1472, 1472, 64, 64]
    - [0, 7.749]
  - - [1600, 1600, 1, 64, 1600, 1600, 64, 64]
    - [0, 7.969]
  - - [1728, 1600, 1, 64, 1728, 1728, 64, 64]
    - [0, 7.97]
  - - [1856, 1600, 1, 64, 1856, 1856, 64, 64]
    - [0, 8.119]
  - - [1984, 1600, 1, 64, 1984, 1984, 64, 64]
    - [0, 8.099]
  - - [2112, 1600, 1, 64, 2112, 2112, 64, 64]
    - [0, 8.263]
  - - [2240, 1600, 1, 64, 2240, 2240, 64, 64]
    - [0, 8.371]
  - - [2368, 1600, 1, 64, 2368, 2368, 64, 64]
    - [0, 8.302]
  - - [2496, 1600, 1, 64, 2496, 2496, 64, 64]
    - [0, 8.389]
  - - [2624, 1600, 1, 64, 2624, 2624, 64, 64]
    - [0, 8.62]
  - - [2752, 1600, 1, 64, 2752, 2752, 64, 64]
    - [0, 8.58]
  - - [2880, 1600, 1, 64, 2880, 2880, 64, 64]
    - [0, 8.418]
  - - [3008, 1600, 1, 64, 3008, 3008, 64, 64]
    - [0, 8.431]
  - - [3136, 1600, 1, 64, 3136, 3136, 64, 64]
    - [0, 8.631]
  - - [3264, 1600, 1, 64, 3264, 3264, 64, 64]
    - [0, 8.564]
  - - [3392, 1600, 1, 64, 3392, 3392, 64, 64]
    - [0, 8.732]
  - - [3520, 1600, 1, 64, 3520, 3520, 64, 64]
    - [0, 8.105]
  - - [3648, 1600, 1, 64, 3648, 3648, 64, 64]
    - [0, 8.501]
  - - [3776, 1600, 1, 64, 3776, 3776, 64, 64]
    - [0, 8.452]
  - - [3904, 1600, 1, 64, 3904, 3904, 64, 64]
    - [0, 8.945]
  - - [4032, 1600, 1, 64, 4032, 4032, 64, 64]
    - [0, 8.807]
  - - [64, 1728, 1, 64, 64, 64, 64, 64]
    - [2, 0.456]
  - - [192, 1728, 1, 64, 192, 192, 64, 64]
    - [3, 2.654]
  - - [320, 1728, 1, 64, 320, 320, 64, 64]
    - [0, 4.405]
  - - [448, 1728, 1, 64, 448, 448, 64, 64]
    - [0, 5.875]
  - - [576, 1728, 1, 64, 576, 576, 64, 64]
    - [0, 6.364]
  - - [704, 1728, 1, 64, 704, 704, 64, 64]
    - [0, 6.805]
  - - [832, 1728, 1, 64, 832, 832, 64, 64]
    - [0, 7.036]
  - - [960, 1728, 1, 64, 960, 960, 64, 64]
    - [0, 7.284]
  - - [1088, 1728, 1, 64, 1088, 1088, 64, 64]
    - [0, 7.533]
  - - [1216, 1728, 1, 64, 1216, 1216, 64, 64]
    - [0, 7.624]
  - - [1344, 1728, 1, 64, 1344, 1344, 64, 64]
    - [0, 7.801]
  - - [1472, 1728, 1, 64, 1472, 1472, 64, 64]
    - [0, 7.853]
  - - [1600, 1728, 1, 64, 1600, 1600, 64, 64]
    - [0, 7.997]
  - - [1728, 1728, 1, 64, 1728, 1728, 64, 64]
    - [0, 8.085]
  - - [1856, 1728, 1, 64, 1856, 1856, 64, 64]
    - [0, 8.231]
  - - [1984, 1728, 1, 64, 1984, 1984, 64, 64]
    - [0, 8.312]
  - - [2112, 1728, 1, 64, 2112, 2112, 64, 64]
    - [0, 8.355]
  - - [2240, 1728, 1, 64, 2240, 2240, 64, 64]
    - [0, 8.375]
  - - [2368, 1728, 1, 64, 2368, 2368, 64, 64]
    - [0, 8.455]
  - - [2496, 1728, 1, 64, 2496, 2496, 64, 64]
    - [0, 8.478]
  - - [2624, 1728, 1, 64, 2624, 2624, 64, 64]
    - [0, 8.545]
  - - [2752, 1728, 1, 64, 2752, 2752, 64, 64]
    - [0, 8.539]
  - - [2880, 1728, 1, 64, 2880, 2880, 64, 64]
    - [0, 8.684]
  - - [3008, 1728, 1, 64, 3008, 3008, 64, 64]
    - [0, 8.732]
  - - [3136, 1728, 1, 64, 3136, 3136, 64, 64]
    - [0, 8.64]
  - - [3264, 1728, 1, 64, 3264, 3264, 64, 64]
    - [0, 8.703]
  - - [3392, 1728, 1, 64, 3392, 3392, 64, 64]
    - [0, 8.698]
  - - [3520, 1728, 1, 64, 3520, 3520, 64, 64]
    - [0, 8.794]
  - - [3648, 1728, 1, 64, 3648, 3648, 64, 64]
    - [0, 8.637]
  - - [3776, 1728, 1, 64, 3776, 3776, 64, 64]
    - [0, 8.672]
  - - [3904, 1728, 1, 64, 3904, 3904, 64, 64]
    - [0, 8.748]
  - - [4032, 1728, 1, 64, 4032, 4032, 64, 64]
    - [0, 8.739]
  - - [64, 1856, 1, 64, 64, 64, 64, 64]
    - [3, 0.492]
  - - [192, 1856, 1, 64, 192, 192, 64, 64]
    - [3, 3.636]
  - - [320, 1856, 1, 64, 320, 320, 64, 64]
    - [0, 4.718]
  - - [448, 1856, 1, 64, 448, 448, 64, 64]
    - [0, 6.004]
  - - [576, 1856, 1, 64, 576, 576, 64, 64]
    - [0, 6.542]
  - - [704, 1856, 1, 64, 704, 704, 64, 64]
    - [0, 6.916]
  - - [832, 1856, 1, 64, 832, 832, 64, 64]
    - [0, 7.159]
  - - [960, 1856, 1, 64, 960, 960, 64, 64]
    - [0, 7.443]
  - - [1088, 1856, 1, 64, 1088, 1088, 64, 64]
    - [0, 7.648]
  - - [1216, 1856, 1, 64, 1216, 1216, 64, 64]
    - [0, 7.717]
  - - [1344, 1856, 1, 64, 1344, 1344, 64, 64]
    - [0, 7.89]
  - - [1472, 1856, 1, 64, 1472, 1472, 64, 64]
    - [0, 8.036]
  - - [1600, 1856, 1, 64, 1600, 1600, 64, 64]
    - [0, 8.059]
  - - [1728, 1856, 1, 64, 1728, 1728, 64, 64]
    - [0, 8.244]
  - - [1856, 1856, 1, 64, 1856, 1856, 64, 64]
    - [0, 8.272]
  - - [1984, 1856, 1, 64, 1984, 1984, 64, 64]
    - [0, 8.358]
  - - [2112, 1856, 1, 64, 2112, 2112, 64, 64]
    - [0, 8.473]
  - - [2240, 1856, 1, 64, 2240, 2240, 64, 64]
    - [0, 8.474]
  - - [2368, 1856, 1, 64, 2368, 2368, 64, 64]
    - [0, 8.622]
  - - [2496, 1856, 1, 64, 2496, 2496, 64, 64]
    - [0, 8.453]
  - - [2624, 1856, 1, 64, 2624, 2624, 64, 64]
    - [0, 8.541]
  - - [2752, 1856, 1, 64, 2752, 2752, 64, 64]
    - [0, 8.652]
  - - [2880, 1856, 1, 64, 2880, 2880, 64, 64]
    - [0, 8.535]
  - - [3008, 1856, 1, 64, 3008, 3008, 64, 64]
    - [0, 8.348]
  - - [3136, 1856, 1, 64, 3136, 3136, 64, 64]
    - [0, 8.558]
  - - [3264, 1856, 1, 64, 3264, 3264, 64, 64]
    - [0, 8.642]
  - - [3392, 1856, 1, 64, 3392, 3392, 64, 64]
    - [0, 8.582]
  - - [3520, 1856, 1, 64, 3520, 3520, 64, 64]
    - [0, 8.612]
  - - [3648, 1856, 1, 64, 3648, 3648, 64, 64]
    - [0, 8.17]
  - - [3776, 1856, 1, 64, 3776, 3776, 64, 64]
    - [0, 8.165]
  - - [3904, 1856, 1, 64, 3904, 3904, 64, 64]
    - [0, 8.69]
  - - [4032, 1856, 1, 64, 4032, 4032, 64, 64]
    - [0, 8.412]
  - - [64, 1984, 1, 64, 64, 64, 64, 64]
    - [0, 2.171]
  - - [192, 1984, 1, 64, 192, 192, 64, 64]
    - [0, 4.436]
  - - [320, 1984, 1, 64, 320, 320, 64, 64]
    - [0, 5.515]
  - - [448, 1984, 1, 64, 448, 448, 64, 64]
    - [0, 6.183]
  - - [576, 1984, 1, 64, 576, 576, 64, 64]
    - [0, 6.604]
  - - [704, 1984, 1, 64, 704, 704, 64, 64]
    - [0, 6.999]
  - - [832, 1984, 1, 64, 832, 832, 64, 64]
    - [0, 7.27]
  - - [960, 1984, 1, 64, 960, 960, 64, 64]
    - [0, 7.555]
  - - [1088, 1984, 1, 64, 1088, 1088, 64, 64]
    - [0, 7.731]
  - - [1216, 1984, 1, 64, 1216, 1216, 64, 64]
    - [0, 7.819]
  - - [1344, 1984, 1, 64, 1344, 1344, 64, 64]
    - [0, 7.942]
  - - [1472, 1984, 1, 64, 1472, 1472, 64, 64]
    - [0, 8.063]
  - - [1600, 1984, 1, 64, 1600, 1600, 64, 64]
    - [0, 8.18]
  - - [1728, 1984, 1, 64, 1728, 1728, 64, 64]
    - [0, 8.34]
  - - [1856, 1984, 1, 64, 1856, 1856, 64, 64]
    - [0, 8.299]
  - - [1984, 1984, 1, 64, 1984, 1984, 64, 64]
    - [0, 8.326]
  - - [2112, 1984, 1, 64, 2112, 2112, 64, 64]
    - [0, 8.572]
  - - [2240, 1984, 1, 64, 2240, 2240, 64, 64]
    - [0, 8.649]
  - - [2368, 1984, 1, 64, 2368, 2368, 64, 64]
    - [0, 8.713]
  - - [2496, 1984, 1, 64, 2496, 2496, 64, 64]
    - [0, 8.585]
  - - [2624, 1984, 1, 64, 2624, 2624, 64, 64]
    - [0, 8.733]
  - - [2752, 1984, 1, 64, 2752, 2752, 64, 64]
    - [0, 8.685]
  - - [2880, 1984, 1, 64, 2880, 2880, 64, 64]
    - [0, 8.304]
  - - [3008, 1984, 1, 64, 3008, 3008, 64, 64]
    - [0, 8.772]
  - - [3136, 1984, 1, 64, 3136, 3136, 64, 64]
    - [0, 8.449]
  - - [3264, 1984, 1, 64, 3264, 3264, 64, 64]
    - [0, 8.449]
  - - [3392, 1984, 1, 64, 3392, 3392, 64, 64]
    - [0, 8.514]
  - - [3520, 1984, 1, 64, 3520, 3520, 64, 64]
    - [0, 8.153]
  - - [3648, 1984, 1, 64, 3648, 3648, 64, 64]
    - [0, 8.192]
  - - [3776, 1984, 1, 64, 3776, 3776, 64, 64]
    - [0, 8.244]
  - - [3904, 1984, 1, 64, 3904, 3904, 64, 64]
    - [0, 8.688]
  - - [4032, 1984, 1, 64, 4032, 4032, 64, 64]
    - [0, 8.755]
  - - [64, 2112, 1, 64, 64, 64, 64, 64]
    - [3, 0.559]
  - - [192, 2112, 1, 64, 192, 192, 64, 64]
    - [3, 3.286]
  - - [320, 2112, 1, 64, 320, 320, 64, 64]
    - [0, 5.388]
  - - [448, 2112, 1, 64, 448, 448, 64, 64]
    - [0, 6.217]
  - - [576, 2112, 1, 64, 576, 576, 64, 64]
    - [0, 6.791]
  - - [704, 2112, 1, 64, 704, 704, 64, 64]
    - [0, 7.116]
  - - [832, 2112, 1, 64, 832, 832, 64, 64]
    - [0, 7.355]
  - - [960, 2112, 1, 64, 960, 960, 64, 64]
    - [0, 7.641]
  - - [1088, 2112, 1, 64, 1088, 1088, 64, 64]
    - [0, 7.809]
  - - [1216, 2112, 1, 64, 1216, 1216, 64, 64]
    - [0, 7.889]
  - - [1344, 2112, 1, 64, 1344, 1344, 64, 64]
    - [0, 8.022]
  - - [1472, 2112, 1, 64, 1472, 1472, 64, 64]
    - [0, 8.117]
  - - [1600, 2112, 1, 64, 1600, 1600, 64, 64]
    - [0, 8.221]
  - - [1728, 2112, 1, 64, 1728, 1728, 64, 64]
    - [0, 8.29]
  - - [1856, 2112, 1, 64, 1856, 1856, 64, 64]
    - [0, 8.312]
  - - [1984, 2112, 1, 64, 1984, 1984, 64, 64]
    - [0, 8.379]
  - - [2112, 2112, 1, 64, 2112, 2112, 64, 64]
    - [0, 8.469]
  - - [2240, 2112, 1, 64, 2240, 2240, 64, 64]
    - [0, 8.712]
  - - [2368, 2112, 1, 64, 2368, 2368, 64, 64]
    - [0, 8.721]
  - - [2496, 2112, 1, 64, 2496, 2496, 64, 64]
    - [0, 8.517]
  - - [2624, 2112, 1, 64, 2624, 2624, 64, 64]
    - [0, 8.67]
  - - [2752, 2112, 1, 64, 2752, 2752, 64, 64]
    - [0, 8.128]
  - - [2880, 2112, 1, 64, 2880, 2880, 64, 64]
    - [0, 8.453]
  - - [3008, 2112, 1, 64, 3008, 3008, 64, 64]
    - [0, 8.212]
  - - [3136, 2112, 1, 64, 3136, 3136, 64, 64]
    - [0, 8.083]
  - - [3264, 2112, 1, 64, 3264, 3264, 64, 64]
    - [0, 8.541]
  - - [3392, 2112, 1, 64, 3392, 3392, 64, 64]
    - [0, 8.151]
  - - [3520, 2112, 1, 64, 3520, 3520, 64, 64]
    - [0, 8.337]
  - - [3648, 2112, 1, 64, 3648, 3648, 64, 64]
    - [0, 8.425]
  - - [3776, 2112, 1, 64, 3776, 3776, 64, 64]
    - [0, 8.624]
  - - [3904, 2112, 1, 64, 3904, 3904, 64, 64]
    - [0, 8.442]
  - - [4032, 2112, 1, 64, 4032, 4032, 64, 64]
    - [0, 8.59]
  - - [64, 2240, 1, 64, 64, 64, 64, 64]
    - [3, 0.594]
  - - [192, 2240, 1, 64, 192, 192, 64, 64]
    - [0, 3.446]
  - - [320, 2240, 1, 64, 320, 320, 64, 64]
    - [0, 5.713]
  - - [448, 2240, 1, 64, 448, 448, 64, 64]
    - [0, 6.394]
  - - [576, 2240, 1, 64, 576, 576, 64, 64]
    - [0, 6.915]
  - - [704, 2240, 1, 64, 704, 704, 64, 64]
    - [0, 7.193]
  - - [832, 2240, 1, 64, 832, 832, 64, 64]
    - [0, 7.458]
  - - [960, 2240, 1, 64, 960, 960, 64, 64]
    - [0, 7.574]
  - - [1088, 2240, 1, 64, 1088, 1088, 64, 64]
    - [0, 7.879]
  - - [1216, 2240, 1, 64, 1216, 1216, 64, 64]
    - [0, 8.007]
  - - [1344, 2240, 1, 64, 1344, 1344, 64, 64]
    - [0, 8.088]
  - - [1472, 2240, 1, 64, 1472, 1472, 64, 64]
    - [0, 8.273]
  - - [1600, 2240, 1, 64, 1600, 1600, 64, 64]
    - [0, 8.374]
  - - [1728, 2240, 1, 64, 1728, 1728, 64, 64]
    - [0, 8.474]
  - - [1856, 2240, 1, 64, 1856, 1856, 64, 64]
    - [0, 8.446]
  - - [1984, 2240, 1, 64, 1984, 1984, 64, 64]
    - [0, 8.448]
  - - [2112, 2240, 1, 64, 2112, 2112, 64, 64]
    - [0, 8.473]
  - - [2240, 2240, 1, 64, 2240, 2240, 64, 64]
    - [0, 8.768]
  - - [2368, 2240, 1, 64, 2368, 2368, 64, 64]
    - [0, 8.548]
  - - [2496, 2240, 1, 64, 2496, 2496, 64, 64]
    - [0, 8.477]
  - - [2624, 2240, 1, 64, 2624, 2624, 64, 64]
    - [0, 8.831]
  - - [2752, 2240, 1, 64, 2752, 2752, 64, 64]
    - [0, 8.366]
  - - [2880, 2240, 1, 64, 2880, 2880, 64, 64]
    - [0, 8.491]
  - - [3008, 2240, 1, 64, 3008, 3008, 64, 64]
    - [0, 8.131]
  - - [3136, 2240, 1, 64, 3136, 3136, 64, 64]
    - [0, 8.44]
  - - [3264, 2240, 1, 64, 3264, 3264, 64, 64]
    - [0, 8.195]
  - - [3392, 2240, 1, 64, 3392, 3392, 64, 64]
    - [0, 8.124]
  - - [3520, 2240, 1, 64, 3520, 3520, 64, 64]
    - [0, 8.218]
  - - [3648, 2240, 1, 64, 3648, 3648, 64, 64]
    - [0, 8.515]
  - - [3776, 2240, 1, 64, 3776, 3776, 64, 64]
    - [0, 8.154]
  - - [3904, 2240, 1, 64, 3904, 3904, 64, 64]
    - [0, 8.208]
  - - [4032, 2240, 1, 64, 4032, 4032, 64, 64]
    - [0, 8.348]
  - - [64, 2368, 1, 64, 64, 64, 64, 64]
    - [2, 0.627]
  - - [192, 2368, 1, 64, 192, 192, 64, 64]
    - [1, 3.638]
  - - [320, 2368, 1, 64, 320, 320, 64, 64]
    - [0, 5.775]
  - - [448, 2368, 1, 64, 448, 448, 64, 64]
    - [0, 6.498]
  - - [576, 2368, 1, 64, 576, 576, 64, 64]
    - [0, 6.988]
  - - [704, 2368, 1, 64, 704, 704, 64, 64]
    - [0, 7.296]
  - - [832, 2368, 1, 64, 832, 832, 64, 64]
    - [0, 7.598]
  - - [960, 2368, 1, 64, 960, 960, 64, 64]
    - [0, 7.667]
  - - [1088, 2368, 1, 64, 1088, 1088, 64, 64]
    - [0, 7.949]
  - - [1216, 2368, 1, 64, 1216, 1216, 64, 64]
    - [0, 8.032]
  - - [1344, 2368, 1, 64, 1344, 1344, 64, 64]
    - [0, 8.077]
  - - [1472, 2368, 1, 64, 1472, 1472, 64, 64]
    - [0, 8.193]
  - - [1600, 2368, 1, 64, 1600, 1600, 64, 64]
    - [0, 8.502]
  - - [1728, 2368, 1, 64, 1728, 1728, 64, 64]
    - [0, 8.546]
  - - [1856, 2368, 1, 64, 1856, 1856, 64, 64]
    - [0, 8.719]
  - - [1984, 2368, 1, 64, 1984, 1984, 64, 64]
    - [0, 8.58]
  - - [2112, 2368, 1, 64, 2112, 2112, 64, 64]
    - [0, 8.598]
  - - [2240, 2368, 1, 64, 2240, 2240, 64, 64]
    - [0, 8.519]
  - - [2368, 2368, 1, 64, 2368, 2368, 64, 64]
    - [0, 8.486]
  - - [2496, 2368, 1, 64, 2496, 2496, 64, 64]
    - [0, 8.605]
  - - [2624, 2368, 1, 64, 2624, 2624, 64, 64]
    - [0, 8.656]
  - - [2752, 2368, 1, 64, 2752, 2752, 64, 64]
    - [0, 8.274]
  - - [2880, 2368, 1, 64, 2880, 2880, 64, 64]
    - [0, 8.245]
  - - [3008, 2368, 1, 64, 3008, 3008, 64, 64]
    - [0, 8.436]
  - - [3136, 2368, 1, 64, 3136, 3136, 64, 64]
    - [0, 8.016]
  - - [3264, 2368, 1, 64, 3264, 3264, 64, 64]
    - [0, 8.425]
  - - [3392, 2368, 1, 64, 3392, 3392, 64, 64]
    - [0, 8.008]
  - - [3520, 2368, 1, 64, 3520, 3520, 64, 64]
    - [0, 8.014]
  - - [3648, 2368, 1, 64, 3648, 3648, 64, 64]
    - [0, 7.614]
  - - [3776, 2368, 1, 64, 3776, 3776, 64, 64]
    - [0, 8.166]
  - - [3904, 2368, 1, 64, 3904, 3904, 64, 64]
    - [0, 8.236]
  - - [4032, 2368, 1, 64, 4032, 4032, 64, 64]
    - [0, 8.18]
  - - [64, 2496, 1, 64, 64, 64, 64, 64]
    - [2, 1.284]
  - - [192, 2496, 1, 64, 192, 192, 64, 64]
    - [0, 3.849]
  - - [320, 2496, 1, 64, 320, 320, 64, 64]
    - [0, 5.84]
  - - [448, 2496, 1, 64, 448, 448, 64, 64]
    - [0, 6.506]
  - - [576, 2496, 1, 64, 576, 576, 64, 64]
    - [0, 6.999]
  - - [704, 2496, 1, 64, 704, 704, 64, 64]
    - [0, 7.343]
  - - [832, 2496, 1, 64, 832, 832, 64, 64]
    - [0, 7.629]
  - - [960, 2496, 1, 64, 960, 960, 64, 64]
    - [0, 7.848]
  - - [1088, 2496, 1, 64, 1088, 1088, 64, 64]
    - [0, 8.031]
  - - [1216, 2496, 1, 64, 1216, 1216, 64, 64]
    - [0, 8.054]
  - - [1344, 2496, 1, 64, 1344, 1344, 64, 64]
    - [0, 8.172]
  - - [1472, 2496, 1, 64, 1472, 1472, 64, 64]
    - [0, 8.278]
  - - [1600, 2496, 1, 64, 1600, 1600, 64, 64]
    - [0, 8.61]
  - - [1728, 2496, 1, 64, 1728, 1728, 64, 64]
    - [0, 8.432]
  - - [1856, 2496, 1, 64, 1856, 1856, 64, 64]
    - [0, 8.583]
  - - [1984, 2496, 1, 64, 1984, 1984, 64, 64]
    - [0, 8.664]
  - - [2112, 2496, 1, 64, 2112, 2112, 64, 64]
    - [0, 8.304]
  - - [2240, 2496, 1, 64, 2240, 2240, 64, 64]
    - [0, 8.553]
  - - [2368, 2496, 1, 64, 2368, 2368, 64, 64]
    - [0, 8.661]
  - - [2496, 2496, 1, 64, 2496, 2496, 64, 64]
    - [0, 8.382]
  - - [2624, 2496, 1, 64, 2624, 2624, 64, 64]
    - [0, 8.878]
  - - [2752, 2496, 1, 64, 2752, 2752, 64, 64]
    - [0, 8.5]
  - - [2880, 2496, 1, 64, 2880, 2880, 64, 64]
    - [0, 8.392]
  - - [3008, 2496, 1, 64, 3008, 3008, 64, 64]
    - [0, 8.164]
  - - [3136, 2496, 1, 64, 3136, 3136, 64, 64]
    - [0, 8.235]
  - - [3264, 2496, 1, 64, 3264, 3264, 64, 64]
    - [0, 8.249]
  - - [3392, 2496, 1, 64, 3392, 3392, 64, 64]
    - [0, 8.213]
  - - [3520, 2496, 1, 64, 3520, 3520, 64, 64]
    - [0, 8.175]
  - - [3648, 2496, 1, 64, 3648, 3648, 64, 64]
    - [0, 8.388]
  - - [3776, 2496, 1, 64, 3776, 3776, 64, 64]
    - [0, 8.343]
  - - [3904, 2496, 1, 64, 3904, 3904, 64, 64]
    - [0, 7.662]
  - - [4032, 2496, 1, 64, 4032, 4032, 64, 64]
    - [0, 8.392]
  - - [64, 2624, 1, 64, 64, 64, 64, 64]
    - [3, 0.698]
  - - [192, 2624, 1, 64, 192, 192, 64, 64]
    - [1, 3.765]
  - - [320, 2624, 1, 64, 320, 320, 64, 64]
    - [0, 5.955]
  - - [448, 2624, 1, 64, 448, 448, 64, 64]
    - [0, 6.742]
  - - [576, 2624, 1, 64, 576, 576, 64, 64]
    - [0, 7.143]
  - - [704, 2624, 1, 64, 704, 704, 64, 64]
    - [0, 7.425]
  - - [832, 2624, 1, 64, 832, 832, 64, 64]
    - [0, 7.733]
  - - [960, 2624, 1, 64, 960, 960, 64, 64]
    - [0, 7.866]
  - - [1088, 2624, 1, 64, 1088, 1088, 64, 64]
    - [0, 8.058]
  - - [1216, 2624, 1, 64, 1216, 1216, 64, 64]
    - [0, 8.13]
  - - [1344, 2624, 1, 64, 1344, 1344, 64, 64]
    - [0, 8.27]
  - - [1472, 2624, 1, 64, 1472, 1472, 64, 64]
    - [0, 8.345]
  - - [1600, 2624, 1, 64, 1600, 1600, 64, 64]
    - [0, 8.53]
  - - [1728, 2624, 1, 64, 1728, 1728, 64, 64]
    - [0, 8.688]
  - - [1856, 2624, 1, 64, 1856, 1856, 64, 64]
    - [0, 8.531]
  - - [1984, 2624, 1, 64, 1984, 1984, 64, 64]
    - [0, 8.628]
  - - [2112, 2624, 1, 64, 2112, 2112, 64, 64]
    - [0, 8.181]
  - - [2240, 2624, 1, 64, 2240, 2240, 64, 64]
    - [0, 8.788]
  - - [2368, 2624, 1, 64, 2368, 2368, 64, 64]
    - [0, 8.356]
  - - [2496, 2624, 1, 64, 2496, 2496, 64, 64]
    - [0, 8.296]
  - - [2624, 2624, 1, 64, 2624, 2624, 64, 64]
    - [0, 8.154]
  - - [2752, 2624, 1, 64, 2752, 2752, 64, 64]
    - [0, 8.178]
  - - [2880, 2624, 1, 64, 2880, 2880, 64, 64]
    - [0, 8.261]
  - - [3008, 2624, 1, 64, 3008, 3008, 64, 64]
    - [0, 8.343]
  - - [3136, 2624, 1, 64, 3136, 3136, 64, 64]
    - [0, 7.933]
  - - [3264, 2624, 1, 64, 3264, 3264, 64, 64]
    - [0, 8.263]
  - - [3392, 2624, 1, 64, 3392, 3392, 64, 64]
    - [0, 8.397]
  - - [3520, 2624, 1, 64, 3520, 3520, 64, 64]
    - [0, 8.312]
  - - [3648, 2624, 1, 64, 3648, 3648, 64, 64]
    - [0, 8.361]
  - - [3776, 2624, 1, 64, 3776, 3776, 64, 64]
    - [0, 8.085]
  - - [3904, 2624, 1, 64, 3904, 3904, 64, 64]
    - [0, 8.088]
  - - [4032, 2624, 1, 64, 4032, 4032, 64, 64]
    - [0, 8.382]
  - - [64, 2752, 1, 64, 64, 64, 64, 64]
    - [0, 2.752]
  - - [192, 2752, 1, 64, 192, 192, 64, 64]
    - [0, 4.929]
  - - [320, 2752, 1, 64, 320, 320, 64, 64]
    - [0, 6.115]
  - - [448, 2752, 1, 64, 448, 448, 64, 64]
    - [0, 6.802]
  - - [576, 2752, 1, 64, 576, 576, 64, 64]
    - [0, 7.233]
  - - [704, 2752, 1, 64, 704, 704, 64, 64]
    - [0, 7.512]
  - - [832, 2752, 1, 64, 832, 832, 64, 64]
    - [0, 7.743]
  - - [960, 2752, 1, 64, 960, 960, 64, 64]
    - [0, 7.961]
  - - [1088, 2752, 1, 64, 1088, 1088, 64, 64]
    - [0, 8.061]
  - - [1216, 2752, 1, 64, 1216, 1216, 64, 64]
    - [0, 8.145]
  - - [1344, 2752, 1, 64, 1344, 1344, 64, 64]
    - [0, 8.279]
  - - [1472, 2752, 1, 64, 1472, 1472, 64, 64]
    - [0, 8.412]
  - - [1600, 2752, 1, 64, 1600, 1600, 64, 64]
    - [0, 8.496]
  - - [1728, 2752, 1, 64, 1728, 1728, 64, 64]
    - [0, 8.747]
  - - [1856, 2752, 1, 64, 1856, 1856, 64, 64]
    - [0, 8.434]
  - - [1984, 2752, 1, 64, 1984, 1984, 64, 64]
    - [0, 8.31]
  - - [2112, 2752, 1, 64, 2112, 2112, 64, 64]
    - [0, 8.691]
  - - [2240, 2752, 1, 64, 2240, 2240, 64, 64]
    - [0, 8.309]
  - - [2368, 2752, 1, 64, 2368, 2368, 64, 64]
    - [0, 8.606]
  - - [2496, 2752, 1, 64, 2496, 2496, 64, 64]
    - [0, 8.325]
  - - [2624, 2752, 1, 64, 2624, 2624, 64, 64]
    - [0, 8.13]
  - - [2752, 2752, 1, 64, 2752, 2752, 64, 64]
    - [0, 8.54]
  - - [2880, 2752, 1, 64, 2880, 2880, 64, 64]
    - [0, 8.496]
  - - [3008, 2752, 1, 64, 3008, 3008, 64, 64]
    - [0, 8.341]
  - - [3136, 2752, 1, 64, 3136, 3136, 64, 64]
    - [0, 8.224]
  - - [3264, 2752, 1, 64, 3264, 3264, 64, 64]
    - [0, 8.339]
  - - [3392, 2752, 1, 64, 3392, 3392, 64, 64]
    - [0, 8.102]
  - - [3520, 2752, 1, 64, 3520, 3520, 64, 64]
    - [0, 8.489]
  - - [3648, 2752, 1, 64, 3648, 3648, 64, 64]
    - [0, 8.373]
  - - [3776, 2752, 1, 64, 3776, 3776, 64, 64]
    - [0, 8.072]
  - - [3904, 2752, 1, 64, 3904, 3904, 64, 64]
    - [0, 8.537]
  - - [4032, 2752, 1, 64, 4032, 4032, 64, 64]
    - [0, 8.542]
  - - [64, 2880, 1, 64, 64, 64, 64, 64]
    - [0, 0.761]
  - - [192, 2880, 1, 64, 192, 192, 64, 64]
    - [0, 4.415]
  - - [320, 2880, 1, 64, 320, 320, 64, 64]
    - [0, 6.214]
  - - [448, 2880, 1, 64, 448, 448, 64, 64]
    - [0, 6.877]
  - - [576, 2880, 1, 64, 576, 576, 64, 64]
    - [0, 7.324]
  - - [704, 2880, 1, 64, 704, 704, 64, 64]
    - [0, 7.574]
  - - [832, 2880, 1, 64, 832, 832, 64, 64]
    - [0, 7.783]
  - - [960, 2880, 1, 64, 960, 960, 64, 64]
    - [0, 8.043]
  - - [1088, 2880, 1, 64, 1088, 1088, 64, 64]
    - [0, 8.137]
  - - [1216, 2880, 1, 64, 1216, 1216, 64, 64]
    - [0, 8.225]
  - - [1344, 2880, 1, 64, 1344, 1344, 64, 64]
    - [0, 8.425]
  - - [1472, 2880, 1, 64, 1472, 1472, 64, 64]
    - [0, 8.652]
  - - [1600, 2880, 1, 64, 1600, 1600, 64, 64]
    - [0, 8.74]
  - - [1728, 2880, 1, 64, 1728, 1728, 64, 64]
    - [0, 8.712]
  - - [1856, 2880, 1, 64, 1856, 1856, 64, 64]
    - [0, 8.616]
  - - [1984, 2880, 1, 64, 1984, 1984, 64, 64]
    - [0, 8.727]
  - - [2112, 2880, 1, 64, 2112, 2112, 64, 64]
    - [0, 8.833]
  - - [2240, 2880, 1, 64, 2240, 2240, 64, 64]
    - [0, 8.07]
  - - [2368, 2880, 1, 64, 2368, 2368, 64, 64]
    - [0, 8.732]
  - - [2496, 2880, 1, 64, 2496, 2496, 64, 64]
    - [0, 8.174]
  - - [2624, 2880, 1, 64, 2624, 2624, 64, 64]
    - [0, 8.08]
  - - [2752, 2880, 1, 64, 2752, 2752, 64, 64]
    - [0, 8.211]
  - - [2880, 2880, 1, 64, 2880, 2880, 64, 64]
    - [0, 8.25]
  - - [3008, 2880, 1, 64, 3008, 3008, 64, 64]
    - [0, 8.249]
  - - [3136, 2880, 1, 64, 3136, 3136, 64, 64]
    - [0, 8.339]
  - - [3264, 2880, 1, 64, 3264, 3264, 64, 64]
    - [0, 8.211]
  - - [3392, 2880, 1, 64, 3392, 3392, 64, 64]
    - [0, 8.478]
  - - [3520, 2880, 1, 64, 3520, 3520, 64, 64]
    - [0, 7.931]
  - - [3648, 2880, 1, 64, 3648, 3648, 64, 64]
    - [0, 8.445]
  - - [3776, 2880, 1, 64, 3776, 3776, 64, 64]
    - [0, 8.564]
  - - [3904, 2880, 1, 64, 3904, 3904, 64, 64]
    - [0, 8.413]
  - - [4032, 2880, 1, 64, 4032, 4032, 64, 64]
    - [0, 8.726]
  - - [64, 3008, 1, 64, 64, 64, 64, 64]
    - [0, 2.996]
  - - [192, 3008, 1, 64, 192, 192, 64, 64]
    - [0, 5.34]
  - - [320, 3008, 1, 64, 320, 320, 64, 64]
    - [0, 6.243]
  - - [448, 3008, 1, 64, 448, 448, 64, 64]
    - [0, 6.895]
  - - [576, 3008, 1, 64, 576, 576, 64, 64]
    - [0, 7.347]
  - - [704, 3008, 1, 64, 704, 704, 64, 64]
    - [0, 7.708]
  - - [832, 3008, 1, 64, 832, 832, 64, 64]
    - [0, 7.811]
  - - [960, 3008, 1, 64, 960, 960, 64, 64]
    - [0, 8.015]
  - - [1088, 3008, 1, 64, 1088, 1088, 64, 64]
    - [0, 8.173]
  - - [1216, 3008, 1, 64, 1216, 1216, 64, 64]
    - [0, 8.303]
  - - [1344, 3008, 1, 64, 1344, 1344, 64, 64]
    - [0, 8.442]
  - - [1472, 3008, 1, 64, 1472, 1472, 64, 64]
    - [0, 8.508]
  - - [1600, 3008, 1, 64, 1600, 1600, 64, 64]
    - [0, 8.514]
  - - [1728, 3008, 1, 64, 1728, 1728, 64, 64]
    - [0, 8.562]
  - - [1856, 3008, 1, 64, 1856, 1856, 64, 64]
    - [0, 8.452]
  - - [1984, 3008, 1, 64, 1984, 1984, 64, 64]
    - [0, 8.619]
  - - [2112, 3008, 1, 64, 2112, 2112, 64, 64]
    - [0, 8.8]
  - - [2240, 3008, 1, 64, 2240, 2240, 64, 64]
    - [0, 8.249]
  - - [2368, 3008, 1, 64, 2368, 2368, 64, 64]
    - [0, 8.584]
  - - [2496, 3008, 1, 64, 2496, 2496, 64, 64]
    - [0, 8.142]
  - - [2624, 3008, 1, 64, 2624, 2624, 64, 64]
    - [0, 8.227]
  - - [2752, 3008, 1, 64, 2752, 2752, 64, 64]
    - [0, 8.314]
  - - [2880, 3008, 1, 64, 2880, 2880, 64, 64]
    - [0, 7.866]
  - - [3008, 3008, 1, 64, 3008, 3008, 64, 64]
    - [0, 7.969]
  - - [3136, 3008, 1, 64, 3136, 3136, 64, 64]
    - [0, 8.408]
  - - [3264, 3008, 1, 64, 3264, 3264, 64, 64]
    - [0, 7.814]
  - - [3392, 3008, 1, 64, 3392, 3392, 64, 64]
    - [0, 8.313]
  - - [3520, 3008, 1, 64, 3520, 3520, 64, 64]
    - [0, 8.547]
  - - [3648, 3008, 1, 64, 3648, 3648, 64, 64]
    - [0, 8.675]
  - - [3776, 3008, 1, 64, 3776, 3776, 64, 64]
    - [0, 8.48]
  - - [3904, 3008, 1, 64, 3904, 3904, 64, 64]
    - [0, 8.586]
  - - [4032, 3008, 1, 64, 4032, 4032, 64, 64]
    - [0, 8.755]
  - - [64, 3136, 1, 64, 64, 64, 64, 64]
    - [0, 2.925]
  - - [192, 3136, 1, 64, 192, 192, 64, 64]
    - [0, 5.34]
  - - [320, 3136, 1, 64, 320, 320, 64, 64]
    - [0, 6.351]
  - - [448, 3136, 1, 64, 448, 448, 64, 64]
    - [0, 7.056]
  - - [576, 3136, 1, 64, 576, 576, 64, 64]
    - [0, 7.478]
  - - [704, 3136, 1, 64, 704, 704, 64, 64]
    - [0, 7.706]
  - - [832, 3136, 1, 64, 832, 832, 64, 64]
    - [0, 7.966]
  - - [960, 3136, 1, 64, 960, 960, 64, 64]
    - [0, 8.062]
  - - [1088, 3136, 1, 64, 1088, 1088, 64, 64]
    - [0, 8.227]
  - - [1216, 3136, 1, 64, 1216, 1216, 64, 64]
    - [0, 8.339]
  - - [1344, 3136, 1, 64, 1344, 1344, 64, 64]
    - [0, 8.518]
  - - [1472, 3136, 1, 64, 1472, 1472, 64, 64]
    - [0, 8.718]
  - - [1600, 3136, 1, 64, 1600, 1600, 64, 64]
    - [0, 8.647]
  - - [1728, 3136, 1, 64, 1728, 1728, 64, 64]
    - [0, 8.621]
  - - [1856, 3136, 1, 64, 1856, 1856, 64, 64]
    - [0, 8.418]
  - - [1984, 3136, 1, 64, 1984, 1984, 64, 64]
    - [0, 8.747]
  - - [2112, 3136, 1, 64, 2112, 2112, 64, 64]
    - [0, 8.407]
  - - [2240, 3136, 1, 64, 2240, 2240, 64, 64]
    - [0, 8.072]
  - - [2368, 3136, 1, 64, 2368, 2368, 64, 64]
    - [0, 8.202]
  - - [2496, 3136, 1, 64, 2496, 2496, 64, 64]
    - [0, 8.159]
  - - [2624, 3136, 1, 64, 2624, 2624, 64, 64]
    - [0, 8.186]
  - - [2752, 3136, 1, 64, 2752, 2752, 64, 64]
    - [0, 8.468]
  - - [2880, 3136, 1, 64, 2880, 2880, 64, 64]
    - [0, 8.159]
  - - [3008, 3136, 1, 64, 3008, 3008, 64, 64]
    - [0, 8.412]
  - - [3136, 3136, 1, 64, 3136, 3136, 64, 64]
    - [0, 8.091]
  - - [3264, 3136, 1, 64, 3264, 3264, 64, 64]
    - [0, 8.368]
  - - [3392, 3136, 1, 64, 3392, 3392, 64, 64]
    - [0, 8.584]
  - - [3520, 3136, 1, 64, 3520, 3520, 64, 64]
    - [0, 8.343]
  - - [3648, 3136, 1, 64, 3648, 3648, 64, 64]
    - [0, 8.746]
  - - [3776, 3136, 1, 64, 3776, 3776, 64, 64]
    - [0, 8.685]
  - - [3904, 3136, 1, 64, 3904, 3904, 64, 64]
    - [0, 8.465]
  - - [4032, 3136, 1, 64, 4032, 4032, 64, 64]
    - [0, 8.639]
  - - [64, 3264, 1, 64, 64, 64, 64, 64]
    - [3, 0.865]
  - - [192, 3264, 1, 64, 192, 192, 64, 64]
    - [0, 5.017]
  - - [320, 3264, 1, 64, 320, 320, 64, 64]
    - [0, 6.439]
  - - [448, 3264, 1, 64, 448, 448, 64, 64]
    - [0, 7.019]
  - - [576, 3264, 1, 64, 576, 576, 64, 64]
    - [0, 7.484]
  - - [704, 3264, 1, 64, 704, 704, 64, 64]
    - [0, 7.813]
  - - [832, 3264, 1, 64, 832, 832, 64, 64]
    - [0, 8.004]
  - - [960, 3264, 1, 64, 960, 960, 64, 64]
    - [0, 8.103]
  - - [1088, 3264, 1, 64, 1088, 1088, 64, 64]
    - [0, 8.285]
  - - [1216, 3264, 1, 64, 1216, 1216, 64, 64]
    - [0, 8.3]
  - - [1344, 3264, 1, 64, 1344, 1344, 64, 64]
    - [0, 8.502]
  - - [1472, 3264, 1, 64, 1472, 1472, 64, 64]
    - [0, 8.591]
  - - [1600, 3264, 1, 64, 1600, 1600, 64, 64]
    - [0, 8.294]
  - - [1728, 3264, 1, 64, 1728, 1728, 64, 64]
    - [0, 8.766]
  - - [1856, 3264, 1, 64, 1856, 1856, 64, 64]
    - [0, 8.571]
  - - [1984, 3264, 1, 64, 1984, 1984, 64, 64]
    - [0, 8.099]
  - - [2112, 3264, 1, 64, 2112, 2112, 64, 64]
    - [0, 8.14]
  - - [2240, 3264, 1, 64, 2240, 2240, 64, 64]
    - [0, 8.175]
  - - [2368, 3264, 1, 64, 2368, 2368, 64, 64]
    - [0, 8.048]
  - - [2496, 3264, 1, 64, 2496, 2496, 64, 64]
    - [0, 7.768]
  - - [2624, 3264, 1, 64, 2624, 2624, 64, 64]
    - [0, 8.101]
  - - [2752, 3264, 1, 64, 2752, 2752, 64, 64]
    - [0, 8.166]
  - - [2880, 3264, 1, 64, 2880, 2880, 64, 64]
    - [0, 8.512]
  - - [3008, 3264, 1, 64, 3008, 3008, 64, 64]
    - [0, 8.726]
  - - [3136, 3264, 1, 64, 3136, 3136, 64, 64]
    - [0, 8.378]
  - - [3264, 3264, 1, 64, 3264, 3264, 64, 64]
    - [0, 8.341]
  - - [3392, 3264, 1, 64, 3392, 3392, 64, 64]
    - [0, 8.426]
  - - [3520, 3264, 1, 64, 3520, 3520, 64, 64]
    - [0, 8.643]
  - - [3648, 3264, 1, 64, 3648, 3648, 64, 64]
    - [0, 8.339]
  - - [3776, 3264, 1, 64, 3776, 3776, 64, 64]
    - [0, 8.716]
  - - [3904, 3264, 1, 64, 3904, 3904, 64, 64]
    - [0, 8.873]
  - - [4032, 3264, 1, 64, 4032, 4032, 64, 64]
    - [0, 8.689]
  - - [64, 3392, 1, 64, 64, 64, 64, 64]
    - [1, 0.9]
  - - [192, 3392, 1, 64, 192, 192, 64, 64]
    - [0, 5.223]
  - - [320, 3392, 1, 64, 320, 320, 64, 64]
    - [0, 6.566]
  - - [448, 3392, 1, 64, 448, 448, 64, 64]
    - [0, 7.107]
  - - [576, 3392, 1, 64, 576, 576, 64, 64]
    - [0, 7.479]
  - - [704, 3392, 1, 64, 704, 704, 64, 64]
    - [0, 7.819]
  - - [832, 3392, 1, 64, 832, 832, 64, 64]
    - [0, 8.011]
  - - [960, 3392, 1, 64, 960, 960, 64, 64]
    - [0, 8.206]
  - - [1088, 3392, 1, 64, 1088, 1088, 64, 64]
    - [0, 8.312]
  - - [1216, 3392, 1, 64, 1216, 1216, 64, 64]
    - [0, 8.484]
  - - [1344, 3392, 1, 64, 1344, 1344, 64, 64]
    - [0, 8.467]
  - - [1472, 3392, 1, 64, 1472, 1472, 64, 64]
    - [0, 8.64]
  - - [1600, 3392, 1, 64, 1600, 1600, 64, 64]
    - [0, 8.088]
  - - [1728, 3392, 1, 64, 1728, 1728, 64, 64]
    - [0, 8.188]
  - - [1856, 3392, 1, 64, 1856, 1856, 64, 64]
    - [0, 8.442]
  - - [1984, 3392, 1, 64, 1984, 1984, 64, 64]
    - [0, 8.145]
  - - [2112, 3392, 1, 64, 2112, 2112, 64, 64]
    - [0, 8.082]
  - - [2240, 3392, 1, 64, 2240, 2240, 64, 64]
    - [0, 8.842]
  - - [2368, 3392, 1, 64, 2368, 2368, 64, 64]
    - [0, 8.182]
  - - [2496, 3392, 1, 64, 2496, 2496, 64, 64]
    - [0, 8.547]
  - - [2624, 3392, 1, 64, 2624, 2624, 64, 64]
    - [0, 7.682]
  - - [2752, 3392, 1, 64, 2752, 2752, 64, 64]
    - [0, 8.312]
  - - [2880, 3392, 1, 64, 2880, 2880, 64, 64]
    - [0, 8.245]
  - - [3008, 3392, 1, 64, 3008, 3008, 64, 64]
    - [0, 8.17]
  - - [3136, 3392, 1, 64, 3136, 3136, 64, 64]
    - [0, 8.38]
  - - [3264, 3392, 1, 64, 3264, 3264, 64, 64]
    - [0, 8.293]
  - - [3392, 3392, 1, 64, 3392, 3392, 64, 64]
    - [0, 8.277]
  - - [3520, 3392, 1, 64, 3520, 3520, 64, 64]
    - [0, 8.359]
  - - [3648, 3392, 1, 64, 3648, 3648, 64, 64]
    - [0, 8.635]
  - - [3776, 3392, 1, 64, 3776, 3776, 64, 64]
    - [0, 8.805]
  - - [3904, 3392, 1, 64, 3904, 3904, 64, 64]
    - [0, 8.487]
  - - [4032, 3392, 1, 64, 4032, 4032, 64, 64]
    - [0, 8.872]
  - - [64, 3520, 1, 64, 64, 64, 64, 64]
    - [3, 2.931]
  - - [192, 3520, 1, 64, 192, 192, 64, 64]
    - [0, 5.566]
  - - [320, 3520, 1, 64, 320, 320, 64, 64]
    - [0, 6.586]
  - - [448, 3520, 1, 64, 448, 448, 64, 64]
    - [0, 7.167]
  - - [576, 3520, 1, 64, 576, 576, 64, 64]
    - [0, 7.614]
  - - [704, 3520, 1, 64, 704, 704, 64, 64]
    - [0, 7.812]
  - - [832, 3520, 1, 64, 832, 832, 64, 64]
    - [0, 8.047]
  - - [960, 3520, 1, 64, 960, 960, 64, 64]
    - [0, 8.186]
  - - [1088, 3520, 1, 64, 1088, 1088, 64, 64]
    - [0, 8.387]
  - - [1216, 3520, 1, 64, 1216, 1216, 64, 64]
    - [0, 8.424]
  - - [1344, 3520, 1, 64, 1344, 1344, 64, 64]
    - [0, 8.637]
  - - [1472, 3520, 1, 64, 1472, 1472, 64, 64]
    - [0, 8.551]
  - - [1600, 3520, 1, 64, 1600, 1600, 64, 64]
    - [0, 8.215]
  - - [1728, 3520, 1, 64, 1728, 1728, 64, 64]
    - [0, 8.75]
  - - [1856, 3520, 1, 64, 1856, 1856, 64, 64]
    - [0, 8.366]
  - - [1984, 3520, 1, 64, 1984, 1984, 64, 64]
    - [0, 8.384]
  - - [2112, 3520, 1, 64, 2112, 2112, 64, 64]
    - [0, 8.115]
  - - [2240, 3520, 1, 64, 2240, 2240, 64, 64]
    - [0, 8.628]
  - - [2368, 3520, 1, 64, 2368, 2368, 64, 64]
    - [0, 8.137]
  - - [2496, 3520, 1, 64, 2496, 2496, 64, 64]
    - [0, 8.145]
  - - [2624, 3520, 1, 64, 2624, 2624, 64, 64]
    - [0, 8.031]
  - - [2752, 3520, 1, 64, 2752, 2752, 64, 64]
    - [0, 8.306]
  - - [2880, 3520, 1, 64, 2880, 2880, 64, 64]
    - [0, 8.32]
  - - [3008, 3520, 1, 64, 3008, 3008, 64, 64]
    - [0, 8.045]
  - - [3136, 3520, 1, 64, 3136, 3136, 64, 64]
    - [0, 8.55]
  - - [3264, 3520, 1, 64, 3264, 3264, 64, 64]
    - [0, 8.551]
  - - [3392, 3520, 1, 64, 3392, 3392, 64, 64]
    - [0, 8.811]
  - - [3520, 3520, 1, 64, 3520, 3520, 64, 64]
    - [0, 8.504]
  - - [3648, 3520, 1, 64, 3648, 3648, 64, 64]
    - [0, 8.353]
  - - [3776, 3520, 1, 64, 3776, 3776, 64, 64]
    - [0, 8.589]
  - - [3904, 3520, 1, 64, 3904, 3904, 64, 64]
    - [0, 8.947]
  - - [4032, 3520, 1, 64, 4032, 4032, 64, 64]
    - [0, 8.952]
  - - [64, 3648, 1, 64, 64, 64, 64, 64]
    - [0, 3.373]
  - - [192, 3648, 1, 64, 192, 192, 64, 64]
    - [0, 5.567]
  - - [320, 3648, 1, 64, 320, 320, 64, 64]
    - [0, 6.669]
  - - [448, 3648, 1, 64, 448, 448, 64, 64]
    - [0, 7.224]
  - - [576, 3648, 1, 64, 576, 576, 64, 64]
    - [0, 7.648]
  - - [704, 3648, 1, 64, 704, 704, 64, 64]
    - [0, 7.895]
  - - [832, 3648, 1, 64, 832, 832, 64, 64]
    - [0, 8.173]
  - - [960, 3648, 1, 64, 960, 960, 64, 64]
    - [0, 8.243]
  - - [1088, 3648, 1, 64, 1088, 1088, 64, 64]
    - [0, 8.558]
  - - [1216, 3648, 1, 64, 1216, 1216, 64, 64]
    - [0, 8.383]
  - - [1344, 3648, 1, 64, 1344, 1344, 64, 64]
    - [0, 8.733]
  - - [1472, 3648, 1, 64, 1472, 1472, 64, 64]
    - [0, 8.6]
  - - [1600, 3648, 1, 64, 1600, 1600, 64, 64]
    - [0, 8.359]
  - - [1728, 3648, 1, 64, 1728, 1728, 64, 64]
    - [0, 8.573]
  - - [1856, 3648, 1, 64, 1856, 1856, 64, 64]
    - [0, 8.725]
  - - [1984, 3648, 1, 64, 1984, 1984, 64, 64]
    - [0, 8.583]
  - - [2112, 3648, 1, 64, 2112, 2112, 64, 64]
    - [0, 8.466]
  - - [2240, 3648, 1, 64, 2240, 2240, 64, 64]
    - [0, 8.001]
  - - [2368, 3648, 1, 64, 2368, 2368, 64, 64]
    - [0, 8.131]
  - - [2496, 3648, 1, 64, 2496, 2496, 64, 64]
    - [0, 8.178]
  - - [2624, 3648, 1, 64, 2624, 2624, 64, 64]
    - [0, 8.28]
  - - [2752, 3648, 1, 64, 2752, 2752, 64, 64]
    - [0, 8.21]
  - - [2880, 3648, 1, 64, 2880, 2880, 64, 64]
    - [0, 8.26]
  - - [3008, 3648, 1, 64, 3008, 3008, 64, 64]
    - [0, 8.415]
  - - [3136, 3648, 1, 64, 3136, 3136, 64, 64]
    - [0, 8.349]
  - - [3264, 3648, 1, 64, 3264, 3264, 64, 64]
    - [0, 8.43]
  - - [3392, 3648, 1, 64, 3392, 3392, 64, 64]
    - [0, 8.808]
  - - [3520, 3648, 1, 64, 3520, 3520, 64, 64]
    - [0, 8.611]
  - - [3648, 3648, 1, 64, 3648, 3648, 64, 64]
    - [0, 8.449]
  - - [3776, 3648, 1, 64, 3776, 3776, 64, 64]
    - [0, 8.732]
  - - [3904, 3648, 1, 64, 3904, 3904, 64, 64]
    - [0, 8.779]
  - - [4032, 3648, 1, 64, 4032, 4032, 64, 64]
    - [0, 7.746]
  - - [64, 3776, 1, 64, 64, 64, 64, 64]
    - [2, 1.939]
  - - [192, 3776, 1, 64, 192, 192, 64, 64]
    - [0, 5.742]
  - - [320, 3776, 1, 64, 320, 320, 64, 64]
    - [0, 6.733]
  - - [448, 3776, 1, 64, 448, 448, 64, 64]
    - [0, 7.349]
  - - [576, 3776, 1, 64, 576, 576, 64, 64]
    - [0, 7.668]
  - - [704, 3776, 1, 64, 704, 704, 64, 64]
    - [0, 7.958]
  - - [832, 3776, 1, 64, 832, 832, 64, 64]
    - [0, 8.138]
  - - [960, 3776, 1, 64, 960, 960, 64, 64]
    - [0, 8.282]
  - - [1088, 3776, 1, 64, 1088, 1088, 64, 64]
    - [0, 8.379]
  - - [1216, 3776, 1, 64, 1216, 1216, 64, 64]
    - [0, 8.372]
  - - [1344, 3776, 1, 64, 1344, 1344, 64, 64]
    - [0, 8.689]
  - - [1472, 3776, 1, 64, 1472, 1472, 64, 64]
    - [0, 8.538]
  - - [1600, 3776, 1, 64, 1600, 1600, 64, 64]
    - [0, 8.38]
  - - [1728, 3776, 1, 64, 1728, 1728, 64, 64]
    - [0, 8.054]
  - - [1856, 3776, 1, 64, 1856, 1856, 64, 64]
    - [0, 7.907]
  - - [1984, 3776, 1, 64, 1984, 1984, 64, 64]
    - [0, 8.656]
  - - [2112, 3776, 1, 64, 2112, 2112, 64, 64]
    - [0, 8.304]
  - - [2240, 3776, 1, 64, 2240, 2240, 64, 64]
    - [0, 8.421]
  - - [2368, 3776, 1, 64, 2368, 2368, 64, 64]
    - [0, 8.142]
  - - [2496, 3776, 1, 64, 2496, 2496, 64, 64]
    - [0, 8.349]
  - - [2624, 3776, 1, 64, 2624, 2624, 64, 64]
    - [0, 8.183]
  - - [2752, 3776, 1, 64, 2752, 2752, 64, 64]
    - [0, 8.512]
  - - [2880, 3776, 1, 64, 2880, 2880, 64, 64]
    - [0, 8.567]
  - - [3008, 3776, 1, 64, 3008, 3008, 64, 64]
    - [0, 8.031]
  - - [3136, 3776, 1, 64, 3136, 3136, 64, 64]
    - [0, 8.602]
  - - [3264, 3776, 1, 64, 3264, 3264, 64, 64]
    - [0, 8.622]
  - - [3392, 3776, 1, 64, 3392, 3392, 64, 64]
    - [0, 8.51]
  - - [3520, 3776, 1, 64, 3520, 3520, 64, 64]
    - [0, 8.674]
  - - [3648, 3776, 1, 64, 3648, 3648, 64, 64]
    - [0, 8.815]
  - - [3776, 3776, 1, 64, 3776, 3776, 64, 64]
    - [0, 8.264]
  - - [3904, 3776, 1, 64, 3904, 3904, 64, 64]
    - [0, 7.722]
  - - [4032, 3776, 1, 64, 4032, 4032, 64, 64]
    - [0, 7.854]
  - - [64, 3904, 1, 64, 64, 64, 64, 64]
    - [0, 3.383]
  - - [192, 3904, 1, 64, 192, 192, 64, 64]
    - [0, 5.722]
  - - [320, 3904, 1, 64, 320, 320, 64, 64]
    - [0, 6.811]
  - - [448, 3904, 1, 64, 448, 448, 64, 64]
    - [0, 7.347]
  - - [576, 3904, 1, 64, 576, 576, 64, 64]
    - [0, 7.714]
  - - [704, 3904, 1, 64, 704, 704, 64, 64]
    - [0, 7.968]
  - - [832, 3904, 1, 64, 832, 832, 64, 64]
    - [0, 8.183]
  - - [960, 3904, 1, 64, 960, 960, 64, 64]
    - [0, 8.322]
  - - [1088, 3904, 1, 64, 1088, 1088, 64, 64]
    - [0, 8.505]
  - - [1216, 3904, 1, 64, 1216, 1216, 64, 64]
    - [0, 8.467]
  - - [1344, 3904, 1, 64, 1344, 1344, 64, 64]
    - [0, 8.606]
  - - [1472, 3904, 1, 64, 1472, 1472, 64, 64]
    - [0, 8.113]
  - - [1600, 3904, 1, 64, 1600, 1600, 64, 64]
    - [0, 8.301]
  - - [1728, 3904, 1, 64, 1728, 1728, 64, 64]
    - [0, 8.022]
  - - [1856, 3904, 1, 64, 1856, 1856, 64, 64]
    - [0, 8.775]
  - - [1984, 3904, 1, 64, 1984, 1984, 64, 64]
    - [0, 7.955]
  - - [2112, 3904, 1, 64, 2112, 2112, 64, 64]
    - [0, 8.398]
  - - [2240, 3904, 1, 64, 2240, 2240, 64, 64]
    - [0, 8.105]
  - - [2368, 3904, 1, 64, 2368, 2368, 64, 64]
    - [0, 8.325]
  - - [2496, 3904, 1, 64, 2496, 2496, 64, 64]
    - [0, 8.353]
  - - [2624, 3904, 1, 64, 2624, 2624, 64, 64]
    - [0, 8.311]
  - - [2752, 3904, 1, 64, 2752, 2752, 64, 64]
    - [0, 8.231]
  - - [2880, 3904, 1, 64, 2880, 2880, 64, 64]
    - [0, 8.407]
  - - [3008, 3904, 1, 64, 3008, 3008, 64, 64]
    - [0, 8.591]
  - - [3136, 3904, 1, 64, 3136, 3136, 64, 64]
    - [0, 8.654]
  - - [3264, 3904, 1, 64, 3264, 3264, 64, 64]
    - [0, 8.572]
  - - [3392, 3904, 1, 64, 3392, 3392, 64, 64]
    - [0, 8.815]
  - - [3520, 3904, 1, 64, 3520, 3520, 64, 64]
    - [0, 8.749]
  - - [3648, 3904, 1, 64, 3648, 3648, 64, 64]
    - [0, 8.733]
  - - [3776, 3904, 1, 64, 3776, 3776, 64, 64]
    - [0, 7.342]
  - - [3904, 3904, 1, 64, 3904, 3904, 64, 64]
    - [0, 7.795]
  - - [4032, 3904, 1, 64, 4032, 4032, 64, 64]
    - [0, 7.688]
  - - [64, 4032, 1, 64, 64, 64, 64, 64]
    - [0, 3.472]
  - - [192, 4032, 1, 64, 192, 192, 64, 64]
    - [0, 5.889]
  - - [320, 4032, 1, 64, 320, 320, 64, 64]
    - [0, 6.886]
  - - [448, 4032, 1, 64, 448, 448, 64, 64]
    - [0, 7.407]
  - - [576, 4032, 1, 64, 576, 576, 64, 64]
    - [0, 7.78]
  - - [704, 4032, 1, 64, 704, 704, 64, 64]
    - [0, 8.08]
  - - [832, 4032, 1, 64, 832, 832, 64, 64]
    - [0, 8.252]
  - - [960, 4032, 1, 64, 960, 960, 64, 64]
    - [0, 8.344]
  - - [1088, 4032, 1, 64, 1088, 1088, 64, 64]
    - [0, 8.393]
  - - [1216, 4032, 1, 64, 1216, 1216, 64, 64]
    - [0, 8.557]
  - - [1344, 4032, 1, 64, 1344, 1344, 64, 64]
    - [0, 8.614]
  - - [1472, 4032, 1, 64, 1472, 1472, 64, 64]
    - [0, 8.52]
  - - [1600, 4032, 1, 64, 1600, 1600, 64, 64]
    - [0, 8.458]
  - - [1728, 4032, 1, 64, 1728, 1728, 64, 64]
    - [0, 8.521]
  - - [1856, 4032, 1, 64, 1856, 1856, 64, 64]
    - [0, 8.245]
  - - [1984, 4032, 1, 64, 1984, 1984, 64, 64]
    - [0, 8.119]
  - - [2112, 4032, 1, 64, 2112, 2112, 64, 64]
    - [0, 7.894]
  - - [2240, 4032, 1, 64, 2240, 2240, 64, 64]
    - [0, 8.262]
  - - [2368, 4032, 1, 64, 2368, 2368, 64, 64]
    - [0, 8.401]
  - - [2496, 4032, 1, 64, 2496, 2496, 64, 64]
    - [0, 8.267]
  - - [2624, 4032, 1, 64, 2624, 2624, 64, 64]
    - [0, 8.371]
  - - [2752, 4032, 1, 64, 2752, 2752, 64, 64]
    - [0, 8.465]
  - - [2880, 4032, 1, 64, 2880, 2880, 64, 64]
    - [0, 8.566]
  - - [3008, 4032, 1, 64, 3008, 3008, 64, 64]
    - [0, 8.668]
  - - [3136, 4032, 1, 64, 3136, 3136, 64, 64]
    - [0, 8.711]
  - - [3264, 4032, 1, 64, 3264, 3264, 64, 64]
    - [0, 8.619]
  - - [3392, 4032, 1, 64, 3392, 3392, 64, 64]
    - [0, 8.932]
  - - [3520, 4032, 1, 64, 3520, 3520, 64, 64]
    - [0, 8.728]
  - - [3648, 4032, 1, 64, 3648, 3648, 64, 64]
    - [0, 7.697]
  - - [3776, 4032, 1, 64, 3776, 3776, 64, 64]
    - [0, 7.403]
  - - [3904, 4032, 1, 64, 3904, 3904, 64, 64]
    - [0, 7.703]
  - - [4032, 4032, 1, 64, 4032, 4032, 64, 64]
    - [0, 7.798]
  - - [64, 64, 1, 256, 64, 64, 256, 256]
    - [0, 0.257]
  - - [192, 64, 1, 256, 192, 192, 256, 256]
    - [3, 0.204]
  - - [320, 64, 1, 256, 320, 320, 256, 256]
    - [0, 0.341]
  - - [448, 64, 1, 256, 448, 448, 256, 256]
    - [2, 0.925]
  - - [576, 64, 1, 256, 576, 576, 256, 256]
    - [3, 1.184]
  - - [704, 64, 1, 256, 704, 704, 256, 256]
    - [1, 1.445]
  - - [832, 64, 1, 256, 832, 832, 256, 256]
    - [2, 1.715]
  - - [960, 64, 1, 256, 960, 960, 256, 256]
    - [3, 1.983]
  - - [1088, 64, 1, 256, 1088, 1088, 256, 256]
    - [2, 2.247]
  - - [1216, 64, 1, 256, 1216, 1216, 256, 256]
    - [2, 2.501]
  - - [1344, 64, 1, 256, 1344, 1344, 256, 256]
    - [0, 2.782]
  - - [1472, 64, 1, 256, 1472, 1472, 256, 256]
    - [2, 3.026]
  - - [1600, 64, 1, 256, 1600, 1600, 256, 256]
    - [0, 3.304]
  - - [1728, 64, 1, 256, 1728, 1728, 256, 256]
    - [3, 3.553]
  - - [1856, 64, 1, 256, 1856, 1856, 256, 256]
    - [0, 3.833]
  - - [1984, 64, 1, 256, 1984, 1984, 256, 256]
    - [0, 4.099]
  - - [2112, 64, 1, 256, 2112, 2112, 256, 256]
    - [0, 4.358]
  - - [2240, 64, 1, 256, 2240, 2240, 256, 256]
    - [0, 4.637]
  - - [2368, 64, 1, 256, 2368, 2368, 256, 256]
    - [0, 4.645]
  - - [2496, 64, 1, 256, 2496, 2496, 256, 256]
    - [0, 4.868]
  - - [2624, 64, 1, 256, 2624, 2624, 256, 256]
    - [0, 5.121]
  - - [2752, 64, 1, 256, 2752, 2752, 256, 256]
    - [0, 5.361]
  - - [2880, 64, 1, 256, 2880, 2880, 256, 256]
    - [0, 5.53]
  - - [3008, 64, 1, 256, 3008, 3008, 256, 256]
    - [0, 5.78]
  - - [3136, 64, 1, 256, 3136, 3136, 256, 256]
    - [0, 5.3]
  - - [3264, 64, 1, 256, 3264, 3264, 256, 256]
    - [0, 5.468]
  - - [3392, 64, 1, 256, 3392, 3392, 256, 256]
    - [0, 5.656]
  - - [3520, 64, 1, 256, 3520, 3520, 256, 256]
    - [0, 5.872]
  - - [3648, 64, 1, 256, 3648, 3648, 256, 256]
    - [0, 6.092]
  - - [3776, 64, 1, 256, 3776, 3776, 256, 256]
    - [0, 6.268]
  - - [3904, 64, 1, 256, 3904, 3904, 256, 256]
    - [0, 5.75]
  - - [4032, 64, 1, 256, 4032, 4032, 256, 256]
    - [0, 5.912]
  - - [64, 192, 1, 256, 64, 64, 256, 256]
    - [1, 0.893]
  - - [192, 192, 1, 256, 192, 192, 256, 256]
    - [0, 2.245]
  - - [320, 192, 1, 256, 320, 320, 256, 256]
    - [0, 2.813]
  - - [448, 192, 1, 256, 448, 448, 256, 256]
    - [0, 3.914]
  - - [576, 192, 1, 256, 576, 576, 256, 256]
    - [0, 4.017]
  - - [704, 192, 1, 256, 704, 704, 256, 256]
    - [0, 4.886]
  - - [832, 192, 1, 256, 832, 832, 256, 256]
    - [0, 4.818]
  - - [960, 192, 1, 256, 960, 960, 256, 256]
    - [0, 5.549]
  - - [1088, 192, 1, 256, 1088, 1088, 256, 256]
    - [0, 5.485]
  - - [1216, 192, 1, 256, 1216, 1216, 256, 256]
    - [0, 6.107]
  - - [1344, 192, 1, 256, 1344, 1344, 256, 256]
    - [0, 5.919]
  - - [1472, 192, 1, 256, 1472, 1472, 256, 256]
    - [0, 6.454]
  - - [1600, 192, 1, 256, 1600, 1600, 256, 256]
    - [0, 6.252]
  - - [1728, 192, 1, 256, 1728, 1728, 256, 256]
    - [0, 6.696]
  - - [1856, 192, 1, 256, 1856, 1856, 256, 256]
    - [0, 6.494]
  - - [1984, 192, 1, 256, 1984, 1984, 256, 256]
    - [0, 6.887]
  - - [2112, 192, 1, 256, 2112, 2112, 256, 256]
    - [0, 6.764]
  - - [2240, 192, 1, 256, 2240, 2240, 256, 256]
    - [0, 7.136]
  - - [2368, 192, 1, 256, 2368, 2368, 256, 256]
    - [0, 6.965]
  - - [2496, 192, 1, 256, 2496, 2496, 256, 256]
    - [0, 7.25]
  - - [2624, 192, 1, 256, 2624, 2624, 256, 256]
    - [0, 7.068]
  - - [2752, 192, 1, 256, 2752, 2752, 256, 256]
    - [0, 7.322]
  - - [2880, 192, 1, 256, 2880, 2880, 256, 256]
    - [0, 7.175]
  - - [3008, 192, 1, 256, 3008, 3008, 256, 256]
    - [0, 7.466]
  - - [3136, 192, 1, 256, 3136, 3136, 256, 256]
    - [0, 7.34]
  - - [3264, 192, 1, 256, 3264, 3264, 256, 256]
    - [0, 7.566]
  - - [3392, 192, 1, 256, 3392, 3392, 256, 256]
    - [0, 7.445]
  - - [3520, 192, 1, 256, 3520, 3520, 256, 256]
    - [0, 7.667]
  - - [3648, 192, 1, 256, 3648, 3648, 256, 256]
    - [0, 7.51]
  - - [3776, 192, 1, 256, 3776, 3776, 256, 256]
    - [0, 7.734]
  - - [3904, 192, 1, 256, 3904, 3904, 256, 256]
    - [0, 7.607]
  - - [4032, 192, 1, 256, 4032, 4032, 256, 256]
    - [0, 7.802]
  - - [64, 320, 1, 256, 64, 64, 256, 256]
    - [3, 0.339]
  - - [192, 320, 1, 256, 192, 192, 256, 256]
    - [0, 1.975]
  - - [320, 320, 1, 256, 320, 320, 256, 256]
    - [3, 3.451]
  - - [448, 320, 1, 256, 448, 448, 256, 256]
    - [0, 5.183]
  - - [576, 320, 1, 256, 576, 576, 256, 256]
    - [0, 5.536]
  - - [704, 320, 1, 256, 704, 704, 256, 256]
    - [0, 5.865]
  - - [832, 320, 1, 256, 832, 832, 256, 256]
    - [0, 6.065]
  - - [960, 320, 1, 256, 960, 960, 256, 256]
    - [0, 6.224]
  - - [1088, 320, 1, 256, 1088, 1088, 256, 256]
    - [0, 6.358]
  - - [1216, 320, 1, 256, 1216, 1216, 256, 256]
    - [0, 7.03]
  - - [1344, 320, 1, 256, 1344, 1344, 256, 256]
    - [0, 7.135]
  - - [1472, 320, 1, 256, 1472, 1472, 256, 256]
    - [0, 7.177]
  - - [1600, 320, 1, 256, 1600, 1600, 256, 256]
    - [0, 7.197]
  - - [1728, 320, 1, 256, 1728, 1728, 256, 256]
    - [0, 7.205]
  - - [1856, 320, 1, 256, 1856, 1856, 256, 256]
    - [0, 7.322]
  - - [1984, 320, 1, 256, 1984, 1984, 256, 256]
    - [0, 7.628]
  - - [2112, 320, 1, 256, 2112, 2112, 256, 256]
    - [0, 7.696]
  - - [2240, 320, 1, 256, 2240, 2240, 256, 256]
    - [0, 7.681]
  - - [2368, 320, 1, 256, 2368, 2368, 256, 256]
    - [0, 7.687]
  - - [2496, 320, 1, 256, 2496, 2496, 256, 256]
    - [0, 7.694]
  - - [2624, 320, 1, 256, 2624, 2624, 256, 256]
    - [0, 7.749]
  - - [2752, 320, 1, 256, 2752, 2752, 256, 256]
    - [0, 7.993]
  - - [2880, 320, 1, 256, 2880, 2880, 256, 256]
    - [0, 7.998]
  - - [3008, 320, 1, 256, 3008, 3008, 256, 256]
    - [0, 7.992]
  - - [3136, 320, 1, 256, 3136, 3136, 256, 256]
    - [0, 8.043]
  - - [3264, 320, 1, 256, 3264, 3264, 256, 256]
    - [0, 8.031]
  - - [3392, 320, 1, 256, 3392, 3392, 256, 256]
    - [0, 8.014]
  - - [3520, 320, 1, 256, 3520, 3520, 256, 256]
    - [0, 8.204]
  - - [3648, 320, 1, 256, 3648, 3648, 256, 256]
    - [0, 8.199]
  - - [3776, 320, 1, 256, 3776, 3776, 256, 256]
    - [0, 8.271]
  - - [3904, 320, 1, 256, 3904, 3904, 256, 256]
    - [0, 8.301]
  - - [4032, 320, 1, 256, 4032, 4032, 256, 256]
    - [0, 8.244]
  - - [64, 448, 1, 256, 64, 64, 256, 256]
    - [3, 0.923]
  - - [192, 448, 1, 256, 192, 192, 256, 256]
    - [0, 2.772]
  - - [320, 448, 1, 256, 320, 320, 256, 256]
    - [0, 4.587]
  - - [448, 448, 1, 256, 448, 448, 256, 256]
    - [0, 5.268]
  - - [576, 448, 1, 256, 576, 576, 256, 256]
    - [0, 5.936]
  - - [704, 448, 1, 256, 704, 704, 256, 256]
    - [0, 6.391]
  - - [832, 448, 1, 256, 832, 832, 256, 256]
    - [0, 6.771]
  - - [960, 448, 1, 256, 960, 960, 256, 256]
    - [0, 7.149]
  - - [1088, 448, 1, 256, 1088, 1088, 256, 256]
    - [0, 7.389]
  - - [1216, 448, 1, 256, 1216, 1216, 256, 256]
    - [0, 7.14]
  - - [1344, 448, 1, 256, 1344, 1344, 256, 256]
    - [0, 7.337]
  - - [1472, 448, 1, 256, 1472, 1472, 256, 256]
    - [0, 7.522]
  - - [1600, 448, 1, 256, 1600, 1600, 256, 256]
    - [0, 7.705]
  - - [1728, 448, 1, 256, 1728, 1728, 256, 256]
    - [0, 7.813]
  - - [1856, 448, 1, 256, 1856, 1856, 256, 256]
    - [0, 7.892]
  - - [1984, 448, 1, 256, 1984, 1984, 256, 256]
    - [0, 7.802]
  - - [2112, 448, 1, 256, 2112, 2112, 256, 256]
    - [0, 7.852]
  - - [2240, 448, 1, 256, 2240, 2240, 256, 256]
    - [0, 7.979]
  - - [2368, 448, 1, 256, 2368, 2368, 256, 256]
    - [0, 8.087]
  - - [2496, 448, 1, 256, 2496, 2496, 256, 256]
    - [0, 8.158]
  - - [2624, 448, 1, 256, 2624, 2624, 256, 256]
    - [0, 8.119]
  - - [2752, 448, 1, 256, 2752, 2752, 256, 256]
    - [0, 8.224]
  - - [2880, 448, 1, 256, 2880, 2880, 256, 256]
    - [0, 8.325]
  - - [3008, 448, 1, 256, 3008, 3008, 256, 256]
    - [0, 8.284]
  - - [3136, 448, 1, 256, 3136, 3136, 256, 256]
    - [0, 8.37]
  - - [3264, 448, 1, 256, 3264, 3264, 256, 256]
    - [0, 8.547]
  - - [3392, 448, 1, 256, 3392, 3392, 256, 256]
    - [0, 8.498]
  - - [3520, 448, 1, 256, 3520, 3520, 256, 256]
    - [0, 8.496]
  - - [3648, 448, 1, 256, 3648, 3648, 256, 256]
    - [0, 8.511]
  - - [3776, 448, 1, 256, 3776, 3776, 256, 256]
    - [0, 8.538]
  - - [3904, 448, 1, 256, 3904, 3904, 256, 256]
    - [0, 8.486]
  - - [4032, 448, 1, 256, 4032, 4032, 256, 256]
    - [0, 8.541]
  - - [64, 576, 1, 256, 64, 64, 256, 256]
    - [3, 1.186]
  - - [192, 576, 1, 256, 192, 192, 256, 256]
    - [0, 3.544]
  - - [320, 576, 1, 256, 320, 320, 256, 256]
    - [0, 5.534]
  - - [448, 576, 1, 256, 448, 448, 256, 256]
    - [0, 5.895]
  - - [576, 576, 1, 256, 576, 576, 256, 256]
    - [0, 6.71]
  - - [704, 576, 1, 256, 704, 704, 256, 256]
    - [0, 6.76]
  - - [832, 576, 1, 256, 832, 832, 256, 256]
    - [0, 7.282]
  - - [960, 576, 1, 256, 960, 960, 256, 256]
    - [0, 7.224]
  - - [1088, 576, 1, 256, 1088, 1088, 256, 256]
    - [0, 7.563]
  - - [1216, 576, 1, 256, 1216, 1216, 256, 256]
    - [0, 7.537]
  - - [1344, 576, 1, 256, 1344, 1344, 256, 256]
    - [0, 7.792]
  - - [1472, 576, 1, 256, 1472, 1472, 256, 256]
    - [0, 7.744]
  - - [1600, 576, 1, 256, 1600, 1600, 256, 256]
    - [0, 8.063]
  - - [1728, 576, 1, 256, 1728, 1728, 256, 256]
    - [0, 7.925]
  - - [1856, 576, 1, 256, 1856, 1856, 256, 256]
    - [0, 8.125]
  - - [1984, 576, 1, 256, 1984, 1984, 256, 256]
    - [0, 8.21]
  - - [2112, 576, 1, 256, 2112, 2112, 256, 256]
    - [0, 8.332]
  - - [2240, 576, 1, 256, 2240, 2240, 256, 256]
    - [0, 8.384]
  - - [2368, 576, 1, 256, 2368, 2368, 256, 256]
    - [0, 8.377]
  - - [2496, 576, 1, 256, 2496, 2496, 256, 256]
    - [0, 8.455]
  - - [2624, 576, 1, 256, 2624, 2624, 256, 256]
    - [0, 8.421]
  - - [2752, 576, 1, 256, 2752, 2752, 256, 256]
    - [0, 8.495]
  - - [2880, 576, 1, 256, 2880, 2880, 256, 256]
    - [0, 8.57]
  - - [3008, 576, 1, 256, 3008, 3008, 256, 256]
    - [0, 8.556]
  - - [3136, 576, 1, 256, 3136, 3136, 256, 256]
    - [0, 8.546]
  - - [3264, 576, 1, 256, 3264, 3264, 256, 256]
    - [0, 8.541]
  - - [3392, 576, 1, 256, 3392, 3392, 256, 256]
    - [0, 8.505]
  - - [3520, 576, 1, 256, 3520, 3520, 256, 256]
    - [0, 8.503]
  - - [3648, 576, 1, 256, 3648, 3648, 256, 256]
    - [0, 8.397]
  - - [3776, 576, 1, 256, 3776, 3776, 256, 256]
    - [0, 8.483]
  - - [3904, 576, 1, 256, 3904, 3904, 256, 256]
    - [0, 8.429]
  - - [4032, 576, 1, 256, 4032, 4032, 256, 256]
    - [0, 8.469]
  - - [64, 704, 1, 256, 64, 64, 256, 256]
    - [1, 1.447]
  - - [192, 704, 1, 256, 192, 192, 256, 256]
    - [0, 4.338]
  - - [320, 704, 1, 256, 320, 320, 256, 256]
    - [0, 5.871]
  - - [448, 704, 1, 256, 448, 448, 256, 256]
    - [0, 6.414]
  - - [576, 704, 1, 256, 576, 576, 256, 256]
    - [0, 6.748]
  - - [704, 704, 1, 256, 704, 704, 256, 256]
    - [0, 7.046]
  - - [832, 704, 1, 256, 832, 832, 256, 256]
    - [0, 7.593]
  - - [960, 704, 1, 256, 960, 960, 256, 256]
    - [0, 7.64]
  - - [1088, 704, 1, 256, 1088, 1088, 256, 256]
    - [0, 7.747]
  - - [1216, 704, 1, 256, 1216, 1216, 256, 256]
    - [0, 7.844]
  - - [1344, 704, 1, 256, 1344, 1344, 256, 256]
    - [0, 7.861]
  - - [1472, 704, 1, 256, 1472, 1472, 256, 256]
    - [0, 7.994]
  - - [1600, 704, 1, 256, 1600, 1600, 256, 256]
    - [0, 8.199]
  - - [1728, 704, 1, 256, 1728, 1728, 256, 256]
    - [0, 8.26]
  - - [1856, 704, 1, 256, 1856, 1856, 256, 256]
    - [0, 8.475]
  - - [1984, 704, 1, 256, 1984, 1984, 256, 256]
    - [0, 8.483]
  - - [2112, 704, 1, 256, 2112, 2112, 256, 256]
    - [0, 8.408]
  - - [2240, 704, 1, 256, 2240, 2240, 256, 256]
    - [0, 8.534]
  - - [2368, 704, 1, 256, 2368, 2368, 256, 256]
    - [0, 8.623]
  - - [2496, 704, 1, 256, 2496, 2496, 256, 256]
    - [0, 8.449]
  - - [2624, 704, 1, 256, 2624, 2624, 256, 256]
    - [0, 8.664]
  - - [2752, 704, 1, 256, 2752, 2752, 256, 256]
    - [0, 8.387]
  - - [2880, 704, 1, 256, 2880, 2880, 256, 256]
    - [0, 8.541]
  - - [3008, 704, 1, 256, 3008, 3008, 256, 256]
    - [0, 8.585]
  - - [3136, 704, 1, 256, 3136, 3136, 256, 256]
    - [0, 8.532]
  - - [3264, 704, 1, 256, 3264, 3264, 256, 256]
    - [0, 8.643]
  - - [3392, 704, 1, 256, 3392, 3392, 256, 256]
    - [0, 8.518]
  - - [3520, 704, 1, 256, 3520, 3520, 256, 256]
    - [0, 8.543]
  - - [3648, 704, 1, 256, 3648, 3648, 256, 256]
    - [0, 8.495]
  - - [3776, 704, 1, 256, 3776, 3776, 256, 256]
    - [0, 8.341]
  - - [3904, 704, 1, 256, 3904, 3904, 256, 256]
    - [0, 8.471]
  - - [4032, 704, 1, 256, 4032, 4032, 256, 256]
    - [0, 8.577]
  - - [64, 832, 1, 256, 64, 64, 256, 256]
    - [3, 0.884]
  - - [192, 832, 1, 256, 192, 192, 256, 256]
    - [2, 4.325]
  - - [320, 832, 1, 256, 320, 320, 256, 256]
    - [0, 6.084]
  - - [448, 832, 1, 256, 448, 448, 256, 256]
    - [0, 6.758]
  - - [576, 832, 1, 256, 576, 576, 256, 256]
    - [0, 7.291]
  - - [704, 832, 1, 256, 704, 704, 256, 256]
    - [0, 7.584]
  - - [832, 832, 1, 256, 832, 832, 256, 256]
    - [0, 7.433]
  - - [960, 832, 1, 256, 960, 960, 256, 256]
    - [0, 7.677]
  - - [1088, 832, 1, 256, 1088, 1088, 256, 256]
    - [0, 7.893]
  - - [1216, 832, 1, 256, 1216, 1216, 256, 256]
    - [0, 8.028]
  - - [1344, 832, 1, 256, 1344, 1344, 256, 256]
    - [0, 8.128]
  - - [1472, 832, 1, 256, 1472, 1472, 256, 256]
    - [0, 8.344]
  - - [1600, 832, 1, 256, 1600, 1600, 256, 256]
    - [0, 8.262]
  - - [1728, 832, 1, 256, 1728, 1728, 256, 256]
    - [0, 8.429]
  - - [1856, 832, 1, 256, 1856, 1856, 256, 256]
    - [0, 8.577]
  - - [1984, 832, 1, 256, 1984, 1984, 256, 256]
    - [0, 8.605]
  - - [2112, 832, 1, 256, 2112, 2112, 256, 256]
    - [0, 8.467]
  - - [2240, 832, 1, 256, 2240, 2240, 256, 256]
    - [0, 8.539]
  - - [2368, 832, 1, 256, 2368, 2368, 256, 256]
    - [0, 8.506]
  - - [2496, 832, 1, 256, 2496, 2496, 256, 256]
    - [0, 8.514]
  - - [2624, 832, 1, 256, 2624, 2624, 256, 256]
    - [0, 8.544]
  - - [2752, 832, 1, 256, 2752, 2752, 256, 256]
    - [0, 8.543]
  - - [2880, 832, 1, 256, 2880, 2880, 256, 256]
    - [0, 8.543]
  - - [3008, 832, 1, 256, 3008, 3008, 256, 256]
    - [0, 8.188]
  - - [3136, 832, 1, 256, 3136, 3136, 256, 256]
    - [0, 8.374]
  - - [3264, 832, 1, 256, 3264, 3264, 256, 256]
    - [0, 8.464]
  - - [3392, 832, 1, 256, 3392, 3392, 256, 256]
    - [0, 8.515]
  - - [3520, 832, 1, 256, 3520, 3520, 256, 256]
    - [0, 8.677]
  - - [3648, 832, 1, 256, 3648, 3648, 256, 256]
    - [0, 8.498]
  - - [3776, 832, 1, 256, 3776, 3776, 256, 256]
    - [0, 8.444]
  - - [3904, 832, 1, 256, 3904, 3904, 256, 256]
    - [0, 8.502]
  - - [4032, 832, 1, 256, 4032, 4032, 256, 256]
    - [0, 8.605]
  - - [64, 960, 1, 256, 64, 64, 256, 256]
    - [3, 1.017]
  - - [192, 960, 1, 256, 192, 192, 256, 256]
    - [0, 5.54]
  - - [320, 960, 1, 256, 320, 320, 256, 256]
    - [0, 6.25]
  - - [448, 960, 1, 256, 448, 448, 256, 256]
    - [0, 7.147]
  - - [576, 960, 1, 256, 576, 576, 256, 256]
    - [0, 7.239]
  - - [704, 960, 1, 256, 704, 704, 256, 256]
    - [0, 7.67]
  - - [832, 960, 1, 256, 832, 832, 256, 256]
    - [0, 7.682]
  - - [960, 960, 1, 256, 960, 960, 256, 256]
    - [0, 7.978]
  - - [1088, 960, 1, 256, 1088, 1088, 256, 256]
    - [0, 7.984]
  - - [1216, 960, 1, 256, 1216, 1216, 256, 256]
    - [0, 8.182]
  - - [1344, 960, 1, 256, 1344, 1344, 256, 256]
    - [0, 8.432]
  - - [1472, 960, 1, 256, 1472, 1472, 256, 256]
    - [0, 8.485]
  - - [1600, 960, 1, 256, 1600, 1600, 256, 256]
    - [0, 8.351]
  - - [1728, 960, 1, 256, 1728, 1728, 256, 256]
    - [0, 8.507]
  - - [1856, 960, 1, 256, 1856, 1856, 256, 256]
    - [0, 8.415]
  - - [1984, 960, 1, 256, 1984, 1984, 256, 256]
    - [0, 8.623]
  - - [2112, 960, 1, 256, 2112, 2112, 256, 256]
    - [0, 8.425]
  - - [2240, 960, 1, 256, 2240, 2240, 256, 256]
    - [0, 8.489]
  - - [2368, 960, 1, 256, 2368, 2368, 256, 256]
    - [0, 8.545]
  - - [2496, 960, 1, 256, 2496, 2496, 256, 256]
    - [0, 8.596]
  - - [2624, 960, 1, 256, 2624, 2624, 256, 256]
    - [0, 8.439]
  - - [2752, 960, 1, 256, 2752, 2752, 256, 256]
    - [0, 8.48]
  - - [2880, 960, 1, 256, 2880, 2880, 256, 256]
    - [0, 8.483]
  - - [3008, 960, 1, 256, 3008, 3008, 256, 256]
    - [0, 8.487]
  - - [3136, 960, 1, 256, 3136, 3136, 256, 256]
    - [0, 8.577]
  - - [3264, 960, 1, 256, 3264, 3264, 256, 256]
    - [0, 8.631]
  - - [3392, 960, 1, 256, 3392, 3392, 256, 256]
    - [0, 8.579]
  - - [3520, 960, 1, 256, 3520, 3520, 256, 256]
    - [0, 8.634]
  - - [3648, 960, 1, 256, 3648, 3648, 256, 256]
    - [0, 8.663]
  - - [3776, 960, 1, 256, 3776, 3776, 256, 256]
    - [0, 8.618]
  - - [3904, 960, 1, 256, 3904, 3904, 256, 256]
    - [0, 8.693]
  - - [4032, 960, 1, 256, 4032, 4032, 256, 256]
    - [0, 8.726]
  - - [64, 1088, 1, 256, 64, 64, 256, 256]
    - [0, 3.176]
  - - [192, 1088, 1, 256, 192, 192, 256, 256]
    - [0, 5.459]
  - - [320, 1088, 1, 256, 320, 320, 256, 256]
    - [0, 6.372]
  - - [448, 1088, 1, 256, 448, 448, 256, 256]
    - [0, 7.395]
  - - [576, 1088, 1, 256, 576, 576, 256, 256]
    - [0, 7.611]
  - - [704, 1088, 1, 256, 704, 704, 256, 256]
    - [0, 7.707]
  - - [832, 1088, 1, 256, 832, 832, 256, 256]
    - [0, 7.863]
  - - [960, 1088, 1, 256, 960, 960, 256, 256]
    - [0, 7.969]
  - - [1088, 1088, 1, 256, 1088, 1088, 256, 256]
    - [0, 8.154]
  - - [1216, 1088, 1, 256, 1216, 1216, 256, 256]
    - [0, 8.417]
  - - [1344, 1088, 1, 256, 1344, 1344, 256, 256]
    - [0, 8.358]
  - - [1472, 1088, 1, 256, 1472, 1472, 256, 256]
    - [0, 8.367]
  - - [1600, 1088, 1, 256, 1600, 1600, 256, 256]
    - [0, 8.356]
  - - [1728, 1088, 1, 256, 1728, 1728, 256, 256]
    - [0, 8.329]
  - - [1856, 1088, 1, 256, 1856, 1856, 256, 256]
    - [0, 8.393]
  - - [1984, 1088, 1, 256, 1984, 1984, 256, 256]
    - [0, 8.42]
  - - [2112, 1088, 1, 256, 2112, 2112, 256, 256]
    - [0, 8.407]
  - - [2240, 1088, 1, 256, 2240, 2240, 256, 256]
    - [0, 8.47]
  - - [2368, 1088, 1, 256, 2368, 2368, 256, 256]
    - [0, 8.335]
  - - [2496, 1088, 1, 256, 2496, 2496, 256, 256]
    - [0, 8.389]
  - - [2624, 1088, 1, 256, 2624, 2624, 256, 256]
    - [0, 8.481]
  - - [2752, 1088, 1, 256, 2752, 2752, 256, 256]
    - [0, 8.471]
  - - [2880, 1088, 1, 256, 2880, 2880, 256, 256]
    - [0, 8.556]
  - - [3008, 1088, 1, 256, 3008, 3008, 256, 256]
    - [0, 8.469]
  - - [3136, 1088, 1, 256, 3136, 3136, 256, 256]
    - [0, 8.641]
  - - [3264, 1088, 1, 256, 3264, 3264, 256, 256]
    - [0, 8.585]
  - - [3392, 1088, 1, 256, 3392, 3392, 256, 256]
    - [0, 8.629]
  - - [3520, 1088, 1, 256, 3520, 3520, 256, 256]
    - [0, 8.725]
  - - [3648, 1088, 1, 256, 3648, 3648, 256, 256]
    - [0, 8.664]
  - - [3776, 1088, 1, 256, 3776, 3776, 256, 256]
    - [0, 8.655]
  - - [3904, 1088, 1, 256, 3904, 3904, 256, 256]
    - [0, 8.691]
  - - [4032, 1088, 1, 256, 4032, 4032, 256, 256]
    - [0, 8.658]
  - - [64, 1216, 1, 256, 64, 64, 256, 256]
    - [0, 3.547]
  - - [192, 1216, 1, 256, 192, 192, 256, 256]
    - [0, 6.072]
  - - [320, 1216, 1, 256, 320, 320, 256, 256]
    - [0, 7.058]
  - - [448, 1216, 1, 256, 448, 448, 256, 256]
    - [0, 7.15]
  - - [576, 1216, 1, 256, 576, 576, 256, 256]
    - [0, 7.523]
  - - [704, 1216, 1, 256, 704, 704, 256, 256]
    - [0, 7.825]
  - - [832, 1216, 1, 256, 832, 832, 256, 256]
    - [0, 8.03]
  - - [960, 1216, 1, 256, 960, 960, 256, 256]
    - [0, 8.157]
  - - [1088, 1216, 1, 256, 1088, 1088, 256, 256]
    - [0, 8.472]
  - - [1216, 1216, 1, 256, 1216, 1216, 256, 256]
    - [0, 8.407]
  - - [1344, 1216, 1, 256, 1344, 1344, 256, 256]
    - [0, 8.431]
  - - [1472, 1216, 1, 256, 1472, 1472, 256, 256]
    - [0, 8.439]
  - - [1600, 1216, 1, 256, 1600, 1600, 256, 256]
    - [0, 8.391]
  - - [1728, 1216, 1, 256, 1728, 1728, 256, 256]
    - [0, 8.4]
  - - [1856, 1216, 1, 256, 1856, 1856, 256, 256]
    - [0, 8.394]
  - - [1984, 1216, 1, 256, 1984, 1984, 256, 256]
    - [0, 8.534]
  - - [2112, 1216, 1, 256, 2112, 2112, 256, 256]
    - [0, 8.405]
  - - [2240, 1216, 1, 256, 2240, 2240, 256, 256]
    - [0, 8.536]
  - - [2368, 1216, 1, 256, 2368, 2368, 256, 256]
    - [0, 8.505]
  - - [2496, 1216, 1, 256, 2496, 2496, 256, 256]
    - [0, 8.464]
  - - [2624, 1216, 1, 256, 2624, 2624, 256, 256]
    - [0, 8.54]
  - - [2752, 1216, 1, 256, 2752, 2752, 256, 256]
    - [0, 8.449]
  - - [2880, 1216, 1, 256, 2880, 2880, 256, 256]
    - [0, 8.575]
  - - [3008, 1216, 1, 256, 3008, 3008, 256, 256]
    - [0, 8.696]
  - - [3136, 1216, 1, 256, 3136, 3136, 256, 256]
    - [0, 8.614]
  - - [3264, 1216, 1, 256, 3264, 3264, 256, 256]
    - [0, 8.69]
  - - [3392, 1216, 1, 256, 3392, 3392, 256, 256]
    - [0, 8.679]
  - - [3520, 1216, 1, 256, 3520, 3520, 256, 256]
    - [0, 8.701]
  - - [3648, 1216, 1, 256, 3648, 3648, 256, 256]
    - [0, 8.79]
  - - [3776, 1216, 1, 256, 3776, 3776, 256, 256]
    - [0, 8.815]
  - - [3904, 1216, 1, 256, 3904, 3904, 256, 256]
    - [0, 8.739]
  - - [4032, 1216, 1, 256, 4032, 4032, 256, 256]
    - [0, 8.746]
  - - [64, 1344, 1, 256, 64, 64, 256, 256]
    - [0, 3.931]
  - - [192, 1344, 1, 256, 192, 192, 256, 256]
    - [0, 5.916]
  - - [320, 1344, 1, 256, 320, 320, 256, 256]
    - [0, 7.115]
  - - [448, 1344, 1, 256, 448, 448, 256, 256]
    - [0, 7.336]
  - - [576, 1344, 1, 256, 576, 576, 256, 256]
    - [0, 7.822]
  - - [704, 1344, 1, 256, 704, 704, 256, 256]
    - [0, 7.868]
  - - [832, 1344, 1, 256, 832, 832, 256, 256]
    - [0, 8.061]
  - - [960, 1344, 1, 256, 960, 960, 256, 256]
    - [0, 8.427]
  - - [1088, 1344, 1, 256, 1088, 1088, 256, 256]
    - [0, 8.62]
  - - [1216, 1344, 1, 256, 1216, 1216, 256, 256]
    - [0, 8.474]
  - - [1344, 1344, 1, 256, 1344, 1344, 256, 256]
    - [0, 8.351]
  - - [1472, 1344, 1, 256, 1472, 1472, 256, 256]
    - [0, 8.412]
  - - [1600, 1344, 1, 256, 1600, 1600, 256, 256]
    - [0, 8.279]
  - - [1728, 1344, 1, 256, 1728, 1728, 256, 256]
    - [0, 8.349]
  - - [1856, 1344, 1, 256, 1856, 1856, 256, 256]
    - [0, 8.481]
  - - [1984, 1344, 1, 256, 1984, 1984, 256, 256]
    - [0, 8.452]
  - - [2112, 1344, 1, 256, 2112, 2112, 256, 256]
    - [0, 8.338]
  - - [2240, 1344, 1, 256, 2240, 2240, 256, 256]
    - [0, 8.457]
  - - [2368, 1344, 1, 256, 2368, 2368, 256, 256]
    - [0, 8.503]
  - - [2496, 1344, 1, 256, 2496, 2496, 256, 256]
    - [0, 8.598]
  - - [2624, 1344, 1, 256, 2624, 2624, 256, 256]
    - [0, 8.478]
  - - [2752, 1344, 1, 256, 2752, 2752, 256, 256]
    - [0, 8.593]
  - - [2880, 1344, 1, 256, 2880, 2880, 256, 256]
    - [0, 8.672]
  - - [3008, 1344, 1, 256, 3008, 3008, 256, 256]
    - [0, 8.786]
  - - [3136, 1344, 1, 256, 3136, 3136, 256, 256]
    - [0, 8.769]
  - - [3264, 1344, 1, 256, 3264, 3264, 256, 256]
    - [0, 8.665]
  - - [3392, 1344, 1, 256, 3392, 3392, 256, 256]
    - [0, 8.689]
  - - [3520, 1344, 1, 256, 3520, 3520, 256, 256]
    - [0, 8.696]
  - - [3648, 1344, 1, 256, 3648, 3648, 256, 256]
    - [0, 8.674]
  - - [3776, 1344, 1, 256, 3776, 3776, 256, 256]
    - [0, 8.759]
  - - [3904, 1344, 1, 256, 3904, 3904, 256, 256]
    - [0, 8.819]
  - - [4032, 1344, 1, 256, 4032, 4032, 256, 256]
    - [0, 8.929]
  - - [64, 1472, 1, 256, 64, 64, 256, 256]
    - [0, 4.301]
  - - [192, 1472, 1, 256, 192, 192, 256, 256]
    - [0, 6.47]
  - - [320, 1472, 1, 256, 320, 320, 256, 256]
    - [0, 7.191]
  - - [448, 1472, 1, 256, 448, 448, 256, 256]
    - [0, 7.561]
  - - [576, 1472, 1, 256, 576, 576, 256, 256]
    - [0, 7.904]
  - - [704, 1472, 1, 256, 704, 704, 256, 256]
    - [0, 8.158]
  - - [832, 1472, 1, 256, 832, 832, 256, 256]
    - [0, 8.453]
  - - [960, 1472, 1, 256, 960, 960, 256, 256]
    - [0, 8.635]
  - - [1088, 1472, 1, 256, 1088, 1088, 256, 256]
    - [0, 8.353]
  - - [1216, 1472, 1, 256, 1216, 1216, 256, 256]
    - [0, 8.729]
  - - [1344, 1472, 1, 256, 1344, 1344, 256, 256]
    - [0, 8.616]
  - - [1472, 1472, 1, 256, 1472, 1472, 256, 256]
    - [0, 8.659]
  - - [1600, 1472, 1, 256, 1600, 1600, 256, 256]
    - [0, 8.504]
  - - [1728, 1472, 1, 256, 1728, 1728, 256, 256]
    - [0, 8.659]
  - - [1856, 1472, 1, 256, 1856, 1856, 256, 256]
    - [0, 8.552]
  - - [1984, 1472, 1, 256, 1984, 1984, 256, 256]
    - [0, 8.674]
  - - [2112, 1472, 1, 256, 2112, 2112, 256, 256]
    - [0, 8.717]
  - - [2240, 1472, 1, 256, 2240, 2240, 256, 256]
    - [0, 8.83]
  - - [2368, 1472, 1, 256, 2368, 2368, 256, 256]
    - [0, 8.677]
  - - [2496, 1472, 1, 256, 2496, 2496, 256, 256]
    - [0, 8.842]
  - - [2624, 1472, 1, 256, 2624, 2624, 256, 256]
    - [0, 8.776]
  - - [2752, 1472, 1, 256, 2752, 2752, 256, 256]
    - [0, 8.868]
  - - [2880, 1472, 1, 256, 2880, 2880, 256, 256]
    - [0, 8.837]
  - - [3008, 1472, 1, 256, 3008, 3008, 256, 256]
    - [0, 8.973]
  - - [3136, 1472, 1, 256, 3136, 3136, 256, 256]
    - [0, 8.997]
  - - [3264, 1472, 1, 256, 3264, 3264, 256, 256]
    - [0, 8.904]
  - - [3392, 1472, 1, 256, 3392, 3392, 256, 256]
    - [0, 9.003]
  - - [3520, 1472, 1, 256, 3520, 3520, 256, 256]
    - [0, 8.959]
  - - [3648, 1472, 1, 256, 3648, 3648, 256, 256]
    - [0, 9.05]
  - - [3776, 1472, 1, 256, 3776, 3776, 256, 256]
    - [0, 8.976]
  - - [3904, 1472, 1, 256, 3904, 3904, 256, 256]
    - [0, 8.922]
  - - [4032, 1472, 1, 256, 4032, 4032, 256, 256]
    - [0, 8.906]
  - - [64, 1600, 1, 256, 64, 64, 256, 256]
    - [0, 3.811]
  - - [192, 1600, 1, 256, 192, 192, 256, 256]
    - [0, 6.39]
  - - [320, 1600, 1, 256, 320, 320, 256, 256]
    - [0, 7.277]
  - - [448, 1600, 1, 256, 448, 448, 256, 256]
    - [0, 7.757]
  - - [576, 1600, 1, 256, 576, 576, 256, 256]
    - [0, 8.077]
  - - [704, 1600, 1, 256, 704, 704, 256, 256]
    - [0, 8.291]
  - - [832, 1600, 1, 256, 832, 832, 256, 256]
    - [0, 8.511]
  - - [960, 1600, 1, 256, 960, 960, 256, 256]
    - [0, 8.683]
  - - [1088, 1600, 1, 256, 1088, 1088, 256, 256]
    - [0, 8.648]
  - - [1216, 1600, 1, 256, 1216, 1216, 256, 256]
    - [0, 8.527]
  - - [1344, 1600, 1, 256, 1344, 1344, 256, 256]
    - [0, 8.504]
  - - [1472, 1600, 1, 256, 1472, 1472, 256, 256]
    - [0, 8.592]
  - - [1600, 1600, 1, 256, 1600, 1600, 256, 256]
    - [0, 8.655]
  - - [1728, 1600, 1, 256, 1728, 1728, 256, 256]
    - [0, 8.506]
  - - [1856, 1600, 1, 256, 1856, 1856, 256, 256]
    - [0, 8.648]
  - - [1984, 1600, 1, 256, 1984, 1984, 256, 256]
    - [0, 8.68]
  - - [2112, 1600, 1, 256, 2112, 2112, 256, 256]
    - [0, 8.618]
  - - [2240, 1600, 1, 256, 2240, 2240, 256, 256]
    - [0, 8.623]
  - - [2368, 1600, 1, 256, 2368, 2368, 256, 256]
    - [0, 8.832]
  - - [2496, 1600, 1, 256, 2496, 2496, 256, 256]
    - [0, 8.92]
  - - [2624, 1600, 1, 256, 2624, 2624, 256, 256]
    - [0, 8.883]
  - - [2752, 1600, 1, 256, 2752, 2752, 256, 256]
    - [0, 8.835]
  - - [2880, 1600, 1, 256, 2880, 2880, 256, 256]
    - [0, 8.917]
  - - [3008, 1600, 1, 256, 3008, 3008, 256, 256]
    - [0, 9.052]
  - - [3136, 1600, 1, 256, 3136, 3136, 256, 256]
    - [0, 9.015]
  - - [3264, 1600, 1, 256, 3264, 3264, 256, 256]
    - [0, 8.928]
  - - [3392, 1600, 1, 256, 3392, 3392, 256, 256]
    - [0, 8.967]
  - - [3520, 1600, 1, 256, 3520, 3520, 256, 256]
    - [0, 9.011]
  - - [3648, 1600, 1, 256, 3648, 3648, 256, 256]
    - [0, 9.083]
  - - [3776, 1600, 1, 256, 3776, 3776, 256, 256]
    - [0, 8.842]
  - - [3904, 1600, 1, 256, 3904, 3904, 256, 256]
    - [0, 8.902]
  - - [4032, 1600, 1, 256, 4032, 4032, 256, 256]
    - [0, 8.946]
  - - [64, 1728, 1, 256, 64, 64, 256, 256]
    - [0, 4.023]
  - - [192, 1728, 1, 256, 192, 192, 256, 256]
    - [0, 6.728]
  - - [320, 1728, 1, 256, 320, 320, 256, 256]
    - [0, 7.235]
  - - [448, 1728, 1, 256, 448, 448, 256, 256]
    - [0, 7.822]
  - - [576, 1728, 1, 256, 576, 576, 256, 256]
    - [0, 8.02]
  - - [704, 1728, 1, 256, 704, 704, 256, 256]
    - [0, 8.309]
  - - [832, 1728, 1, 256, 832, 832, 256, 256]
    - [0, 8.499]
  - - [960, 1728, 1, 256, 960, 960, 256, 256]
    - [0, 8.534]
  - - [1088, 1728, 1, 256, 1088, 1088, 256, 256]
    - [0, 8.503]
  - - [1216, 1728, 1, 256, 1216, 1216, 256, 256]
    - [0, 8.443]
  - - [1344, 1728, 1, 256, 1344, 1344, 256, 256]
    - [0, 8.599]
  - - [1472, 1728, 1, 256, 1472, 1472, 256, 256]
    - [0, 8.415]
  - - [1600, 1728, 1, 256, 1600, 1600, 256, 256]
    - [0, 8.535]
  - - [1728, 1728, 1, 256, 1728, 1728, 256, 256]
    - [0, 8.561]
  - - [1856, 1728, 1, 256, 1856, 1856, 256, 256]
    - [0, 8.722]
  - - [1984, 1728, 1, 256, 1984, 1984, 256, 256]
    - [0, 8.716]
  - - [2112, 1728, 1, 256, 2112, 2112, 256, 256]
    - [0, 8.824]
  - - [2240, 1728, 1, 256, 2240, 2240, 256, 256]
    - [0, 8.829]
  - - [2368, 1728, 1, 256, 2368, 2368, 256, 256]
    - [0, 8.821]
  - - [2496, 1728, 1, 256, 2496, 2496, 256, 256]
    - [0, 8.835]
  - - [2624, 1728, 1, 256, 2624, 2624, 256, 256]
    - [0, 8.881]
  - - [2752, 1728, 1, 256, 2752, 2752, 256, 256]
    - [0, 8.742]
  - - [2880, 1728, 1, 256, 2880, 2880, 256, 256]
    - [0, 8.85]
  - - [3008, 1728, 1, 256, 3008, 3008, 256, 256]
    - [0, 8.77]
  - - [3136, 1728, 1, 256, 3136, 3136, 256, 256]
    - [0, 8.88]
  - - [3264, 1728, 1, 256, 3264, 3264, 256, 256]
    - [0, 8.851]
  - - [3392, 1728, 1, 256, 3392, 3392, 256, 256]
    - [0, 8.792]
  - - [3520, 1728, 1, 256, 3520, 3520, 256, 256]
    - [0, 8.814]
  - - [3648, 1728, 1, 256, 3648, 3648, 256, 256]
    - [0, 8.788]
  - - [3776, 1728, 1, 256, 3776, 3776, 256, 256]
    - [0, 8.839]
  - - [3904, 1728, 1, 256, 3904, 3904, 256, 256]
    - [0, 8.826]
  - - [4032, 1728, 1, 256, 4032, 4032, 256, 256]
    - [0, 8.881]
  - - [64, 1856, 1, 256, 64, 64, 256, 256]
    - [0, 4.314]
  - - [192, 1856, 1, 256, 192, 192, 256, 256]
    - [0, 6.469]
  - - [320, 1856, 1, 256, 320, 320, 256, 256]
    - [0, 7.384]
  - - [448, 1856, 1, 256, 448, 448, 256, 256]
    - [0, 7.852]
  - - [576, 1856, 1, 256, 576, 576, 256, 256]
    - [0, 8.197]
  - - [704, 1856, 1, 256, 704, 704, 256, 256]
    - [0, 8.246]
  - - [832, 1856, 1, 256, 832, 832, 256, 256]
    - [0, 8.357]
  - - [960, 1856, 1, 256, 960, 960, 256, 256]
    - [0, 8.435]
  - - [1088, 1856, 1, 256, 1088, 1088, 256, 256]
    - [0, 8.491]
  - - [1216, 1856, 1, 256, 1216, 1216, 256, 256]
    - [0, 8.372]
  - - [1344, 1856, 1, 256, 1344, 1344, 256, 256]
    - [0, 8.431]
  - - [1472, 1856, 1, 256, 1472, 1472, 256, 256]
    - [0, 8.395]
  - - [1600, 1856, 1, 256, 1600, 1600, 256, 256]
    - [0, 8.334]
  - - [1728, 1856, 1, 256, 1728, 1728, 256, 256]
    - [0, 8.528]
  - - [1856, 1856, 1, 256, 1856, 1856, 256, 256]
    - [0, 8.684]
  - - [1984, 1856, 1, 256, 1984, 1984, 256, 256]
    - [0, 8.654]
  - - [2112, 1856, 1, 256, 2112, 2112, 256, 256]
    - [0, 8.698]
  - - [2240, 1856, 1, 256, 2240, 2240, 256, 256]
    - [0, 8.699]
  - - [2368, 1856, 1, 256, 2368, 2368, 256, 256]
    - [0, 8.793]
  - - [2496, 1856, 1, 256, 2496, 2496, 256, 256]
    - [0, 8.863]
  - - [2624, 1856, 1, 256, 2624, 2624, 256, 256]
    - [0, 8.788]
  - - [2752, 1856, 1, 256, 2752, 2752, 256, 256]
    - [0, 8.853]
  - - [2880, 1856, 1, 256, 2880, 2880, 256, 256]
    - [0, 8.784]
  - - [3008, 1856, 1, 256, 3008, 3008, 256, 256]
    - [0, 8.979]
  - - [3136, 1856, 1, 256, 3136, 3136, 256, 256]
    - [0, 8.917]
  - - [3264, 1856, 1, 256, 3264, 3264, 256, 256]
    - [0, 8.853]
  - - [3392, 1856, 1, 256, 3392, 3392, 256, 256]
    - [0, 8.883]
  - - [3520, 1856, 1, 256, 3520, 3520, 256, 256]
    - [0, 8.872]
  - - [3648, 1856, 1, 256, 3648, 3648, 256, 256]
    - [0, 8.866]
  - - [3776, 1856, 1, 256, 3776, 3776, 256, 256]
    - [0, 8.766]
  - - [3904, 1856, 1, 256, 3904, 3904, 256, 256]
    - [0, 8.877]
  - - [4032, 1856, 1, 256, 4032, 4032, 256, 256]
    - [0, 8.93]
  - - [64, 1984, 1, 256, 64, 64, 256, 256]
    - [0, 4.604]
  - - [192, 1984, 1, 256, 192, 192, 256, 256]
    - [0, 6.894]
  - - [320, 1984, 1, 256, 320, 320, 256, 256]
    - [0, 7.521]
  - - [448, 1984, 1, 256, 448, 448, 256, 256]
    - [0, 7.83]
  - - [576, 1984, 1, 256, 576, 576, 256, 256]
    - [0, 8.125]
  - - [704, 1984, 1, 256, 704, 704, 256, 256]
    - [0, 8.476]
  - - [832, 1984, 1, 256, 832, 832, 256, 256]
    - [0, 8.477]
  - - [960, 1984, 1, 256, 960, 960, 256, 256]
    - [0, 8.44]
  - - [1088, 1984, 1, 256, 1088, 1088, 256, 256]
    - [0, 8.479]
  - - [1216, 1984, 1, 256, 1216, 1216, 256, 256]
    - [0, 8.424]
  - - [1344, 1984, 1, 256, 1344, 1344, 256, 256]
    - [0, 8.583]
  - - [1472, 1984, 1, 256, 1472, 1472, 256, 256]
    - [0, 8.591]
  - - [1600, 1984, 1, 256, 1600, 1600, 256, 256]
    - [0, 8.509]
  - - [1728, 1984, 1, 256, 1728, 1728, 256, 256]
    - [0, 8.71]
  - - [1856, 1984, 1, 256, 1856, 1856, 256, 256]
    - [0, 8.688]
  - - [1984, 1984, 1, 256, 1984, 1984, 256, 256]
    - [0, 8.669]
  - - [2112, 1984, 1, 256, 2112, 2112, 256, 256]
    - [0, 8.74]
  - - [2240, 1984, 1, 256, 2240, 2240, 256, 256]
    - [0, 8.803]
  - - [2368, 1984, 1, 256, 2368, 2368, 256, 256]
    - [0, 8.649]
  - - [2496, 1984, 1, 256, 2496, 2496, 256, 256]
    - [0, 8.833]
  - - [2624, 1984, 1, 256, 2624, 2624, 256, 256]
    - [0, 8.76]
  - - [2752, 1984, 1, 256, 2752, 2752, 256, 256]
    - [0, 8.865]
  - - [2880, 1984, 1, 256, 2880, 2880, 256, 256]
    - [0, 8.694]
  - - [3008, 1984, 1, 256, 3008, 3008, 256, 256]
    - [0, 8.729]
  - - [3136, 1984, 1, 256, 3136, 3136, 256, 256]
    - [0, 8.788]
  - - [3264, 1984, 1, 256, 3264, 3264, 256, 256]
    - [0, 8.736]
  - - [3392, 1984, 1, 256, 3392, 3392, 256, 256]
    - [0, 8.755]
  - - [3520, 1984, 1, 256, 3520, 3520, 256, 256]
    - [0, 8.877]
  - - [3648, 1984, 1, 256, 3648, 3648, 256, 256]
    - [0, 8.856]
  - - [3776, 1984, 1, 256, 3776, 3776, 256, 256]
    - [0, 8.873]
  - - [3904, 1984, 1, 256, 3904, 3904, 256, 256]
    - [0, 8.84]
  - - [4032, 1984, 1, 256, 4032, 4032, 256, 256]
    - [0, 8.922]
  - - [64, 2112, 1, 256, 64, 64, 256, 256]
    - [0, 4.968]
  - - [192, 2112, 1, 256, 192, 192, 256, 256]
    - [0, 6.845]
  - - [320, 2112, 1, 256, 320, 320, 256, 256]
    - [0, 7.729]
  - - [448, 2112, 1, 256, 448, 448, 256, 256]
    - [0, 7.931]
  - - [576, 2112, 1, 256, 576, 576, 256, 256]
    - [0, 8.486]
  - - [704, 2112, 1, 256, 704, 704, 256, 256]
    - [0, 8.496]
  - - [832, 2112, 1, 256, 832, 832, 256, 256]
    - [0, 8.336]
  - - [960, 2112, 1, 256, 960, 960, 256, 256]
    - [0, 8.419]
  - - [1088, 2112, 1, 256, 1088, 1088, 256, 256]
    - [0, 8.544]
  - - [1216, 2112, 1, 256, 1216, 1216, 256, 256]
    - [0, 8.342]
  - - [1344, 2112, 1, 256, 1344, 1344, 256, 256]
    - [0, 8.568]
  - - [1472, 2112, 1, 256, 1472, 1472, 256, 256]
    - [0, 8.583]
  - - [1600, 2112, 1, 256, 1600, 1600, 256, 256]
    - [0, 8.677]
  - - [1728, 2112, 1, 256, 1728, 1728, 256, 256]
    - [0, 8.526]
  - - [1856, 2112, 1, 256, 1856, 1856, 256, 256]
    - [0, 8.497]
  - - [1984, 2112, 1, 256, 1984, 1984, 256, 256]
    - [0, 8.738]
  - - [2112, 2112, 1, 256, 2112, 2112, 256, 256]
    - [0, 8.732]
  - - [2240, 2112, 1, 256, 2240, 2240, 256, 256]
    - [0, 8.855]
  - - [2368, 2112, 1, 256, 2368, 2368, 256, 256]
    - [0, 8.779]
  - - [2496, 2112, 1, 256, 2496, 2496, 256, 256]
    - [0, 8.592]
  - - [2624, 2112, 1, 256, 2624, 2624, 256, 256]
    - [0, 8.756]
  - - [2752, 2112, 1, 256, 2752, 2752, 256, 256]
    - [0, 8.891]
  - - [2880, 2112, 1, 256, 2880, 2880, 256, 256]
    - [0, 8.769]
  - - [3008, 2112, 1, 256, 3008, 3008, 256, 256]
    - [0, 8.81]
  - - [3136, 2112, 1, 256, 3136, 3136, 256, 256]
    - [0, 8.845]
  - - [3264, 2112, 1, 256, 3264, 3264, 256, 256]
    - [0, 8.882]
  - - [3392, 2112, 1, 256, 3392, 3392, 256, 256]
    - [0, 8.9]
  - - [3520, 2112, 1, 256, 3520, 3520, 256, 256]
    - [0, 8.895]
  - - [3648, 2112, 1, 256, 3648, 3648, 256, 256]
    - [0, 8.864]
  - - [3776, 2112, 1, 256, 3776, 3776, 256, 256]
    - [0, 8.889]
  - - [3904, 2112, 1, 256, 3904, 3904, 256, 256]
    - [0, 8.758]
  - - [4032, 2112, 1, 256, 4032, 4032, 256, 256]
    - [0, 8.937]
  - - [64, 2240, 1, 256, 64, 64, 256, 256]
    - [0, 5.186]
  - - [192, 2240, 1, 256, 192, 192, 256, 256]
    - [0, 7.075]
  - - [320, 2240, 1, 256, 320, 320, 256, 256]
    - [0, 7.659]
  - - [448, 2240, 1, 256, 448, 448, 256, 256]
    - [0, 7.984]
  - - [576, 2240, 1, 256, 576, 576, 256, 256]
    - [0, 8.178]
  - - [704, 2240, 1, 256, 704, 704, 256, 256]
    - [0, 8.5]
  - - [832, 2240, 1, 256, 832, 832, 256, 256]
    - [0, 8.38]
  - - [960, 2240, 1, 256, 960, 960, 256, 256]
    - [0, 8.415]
  - - [1088, 2240, 1, 256, 1088, 1088, 256, 256]
    - [0, 8.419]
  - - [1216, 2240, 1, 256, 1216, 1216, 256, 256]
    - [0, 8.356]
  - - [1344, 2240, 1, 256, 1344, 1344, 256, 256]
    - [0, 8.537]
  - - [1472, 2240, 1, 256, 1472, 1472, 256, 256]
    - [0, 8.609]
  - - [1600, 2240, 1, 256, 1600, 1600, 256, 256]
    - [0, 8.763]
  - - [1728, 2240, 1, 256, 1728, 1728, 256, 256]
    - [0, 8.701]
  - - [1856, 2240, 1, 256, 1856, 1856, 256, 256]
    - [0, 8.715]
  - - [1984, 2240, 1, 256, 1984, 1984, 256, 256]
    - [0, 8.62]
  - - [2112, 2240, 1, 256, 2112, 2112, 256, 256]
    - [0, 8.628]
  - - [2240, 2240, 1, 256, 2240, 2240, 256, 256]
    - [0, 8.712]
  - - [2368, 2240, 1, 256, 2368, 2368, 256, 256]
    - [0, 8.792]
  - - [2496, 2240, 1, 256, 2496, 2496, 256, 256]
    - [0, 8.874]
  - - [2624, 2240, 1, 256, 2624, 2624, 256, 256]
    - [0, 8.731]
  - - [2752, 2240, 1, 256, 2752, 2752, 256, 256]
    - [0, 8.821]
  - - [2880, 2240, 1, 256, 2880, 2880, 256, 256]
    - [0, 8.825]
  - - [3008, 2240, 1, 256, 3008, 3008, 256, 256]
    - [0, 8.942]
  - - [3136, 2240, 1, 256, 3136, 3136, 256, 256]
    - [0, 8.84]
  - - [3264, 2240, 1, 256, 3264, 3264, 256, 256]
    - [0, 8.853]
  - - [3392, 2240, 1, 256, 3392, 3392, 256, 256]
    - [0, 8.92]
  - - [3520, 2240, 1, 256, 3520, 3520, 256, 256]
    - [0, 8.825]
  - - [3648, 2240, 1, 256, 3648, 3648, 256, 256]
    - [0, 8.927]
  - - [3776, 2240, 1, 256, 3776, 3776, 256, 256]
    - [0, 8.798]
  - - [3904, 2240, 1, 256, 3904, 3904, 256, 256]
    - [0, 8.94]
  - - [4032, 2240, 1, 256, 4032, 4032, 256, 256]
    - [0, 8.888]
  - - [64, 2368, 1, 256, 64, 64, 256, 256]
    - [0, 4.646]
  - - [192, 2368, 1, 256, 192, 192, 256, 256]
    - [0, 7.03]
  - - [320, 2368, 1, 256, 320, 320, 256, 256]
    - [0, 7.707]
  - - [448, 2368, 1, 256, 448, 448, 256, 256]
    - [0, 8.183]
  - - [576, 2368, 1, 256, 576, 576, 256, 256]
    - [0, 8.399]
  - - [704, 2368, 1, 256, 704, 704, 256, 256]
    - [0, 8.587]
  - - [832, 2368, 1, 256, 832, 832, 256, 256]
    - [0, 8.434]
  - - [960, 2368, 1, 256, 960, 960, 256, 256]
    - [0, 8.371]
  - - [1088, 2368, 1, 256, 1088, 1088, 256, 256]
    - [0, 8.568]
  - - [1216, 2368, 1, 256, 1216, 1216, 256, 256]
    - [0, 8.579]
  - - [1344, 2368, 1, 256, 1344, 1344, 256, 256]
    - [0, 8.598]
  - - [1472, 2368, 1, 256, 1472, 1472, 256, 256]
    - [0, 8.6]
  - - [1600, 2368, 1, 256, 1600, 1600, 256, 256]
    - [0, 8.72]
  - - [1728, 2368, 1, 256, 1728, 1728, 256, 256]
    - [0, 8.791]
  - - [1856, 2368, 1, 256, 1856, 1856, 256, 256]
    - [0, 8.594]
  - - [1984, 2368, 1, 256, 1984, 1984, 256, 256]
    - [0, 8.621]
  - - [2112, 2368, 1, 256, 2112, 2112, 256, 256]
    - [0, 8.68]
  - - [2240, 2368, 1, 256, 2240, 2240, 256, 256]
    - [0, 8.697]
  - - [2368, 2368, 1, 256, 2368, 2368, 256, 256]
    - [0, 8.709]
  - - [2496, 2368, 1, 256, 2496, 2496, 256, 256]
    - [0, 8.775]
  - - [2624, 2368, 1, 256, 2624, 2624, 256, 256]
    - [0, 8.788]
  - - [2752, 2368, 1, 256, 2752, 2752, 256, 256]
    - [0, 8.737]
  - - [2880, 2368, 1, 256, 2880, 2880, 256, 256]
    - [0, 8.684]
  - - [3008, 2368, 1, 256, 3008, 3008, 256, 256]
    - [0, 8.691]
  - - [3136, 2368, 1, 256, 3136, 3136, 256, 256]
    - [0, 8.688]
  - - [3264, 2368, 1, 256, 3264, 3264, 256, 256]
    - [0, 8.785]
  - - [3392, 2368, 1, 256, 3392, 3392, 256, 256]
    - [0, 8.743]
  - - [3520, 2368, 1, 256, 3520, 3520, 256, 256]
    - [0, 8.851]
  - - [3648, 2368, 1, 256, 3648, 3648, 256, 256]
    - [0, 8.786]
  - - [3776, 2368, 1, 256, 3776, 3776, 256, 256]
    - [0, 8.902]
  - - [3904, 2368, 1, 256, 3904, 3904, 256, 256]
    - [0, 8.892]
  - - [4032, 2368, 1, 256, 4032, 4032, 256, 256]
    - [0, 8.868]
  - - [64, 2496, 1, 256, 64, 64, 256, 256]
    - [0, 4.819]
  - - [192, 2496, 1, 256, 192, 192, 256, 256]
    - [0, 7.26]
  - - [320, 2496, 1, 256, 320, 320, 256, 256]
    - [0, 7.696]
  - - [448, 2496, 1, 256, 448, 448, 256, 256]
    - [0, 8.25]
  - - [576, 2496, 1, 256, 576, 576, 256, 256]
    - [0, 8.413]
  - - [704, 2496, 1, 256, 704, 704, 256, 256]
    - [0, 8.384]
  - - [832, 2496, 1, 256, 832, 832, 256, 256]
    - [0, 8.225]
  - - [960, 2496, 1, 256, 960, 960, 256, 256]
    - [0, 8.414]
  - - [1088, 2496, 1, 256, 1088, 1088, 256, 256]
    - [0, 8.419]
  - - [1216, 2496, 1, 256, 1216, 1216, 256, 256]
    - [0, 8.448]
  - - [1344, 2496, 1, 256, 1344, 1344, 256, 256]
    - [0, 8.539]
  - - [1472, 2496, 1, 256, 1472, 1472, 256, 256]
    - [0, 8.56]
  - - [1600, 2496, 1, 256, 1600, 1600, 256, 256]
    - [0, 8.669]
  - - [1728, 2496, 1, 256, 1728, 1728, 256, 256]
    - [0, 8.669]
  - - [1856, 2496, 1, 256, 1856, 1856, 256, 256]
    - [0, 8.762]
  - - [1984, 2496, 1, 256, 1984, 1984, 256, 256]
    - [0, 8.873]
  - - [2112, 2496, 1, 256, 2112, 2112, 256, 256]
    - [0, 8.725]
  - - [2240, 2496, 1, 256, 2240, 2240, 256, 256]
    - [0, 8.662]
  - - [2368, 2496, 1, 256, 2368, 2368, 256, 256]
    - [0, 8.707]
  - - [2496, 2496, 1, 256, 2496, 2496, 256, 256]
    - [0, 8.825]
  - - [2624, 2496, 1, 256, 2624, 2624, 256, 256]
    - [0, 8.775]
  - - [2752, 2496, 1, 256, 2752, 2752, 256, 256]
    - [0, 8.692]
  - - [2880, 2496, 1, 256, 2880, 2880, 256, 256]
    - [0, 8.866]
  - - [3008, 2496, 1, 256, 3008, 3008, 256, 256]
    - [0, 8.755]
  - - [3136, 2496, 1, 256, 3136, 3136, 256, 256]
    - [0, 8.746]
  - - [3264, 2496, 1, 256, 3264, 3264, 256, 256]
    - [0, 8.839]
  - - [3392, 2496, 1, 256, 3392, 3392, 256, 256]
    - [0, 8.867]
  - - [3520, 2496, 1, 256, 3520, 3520, 256, 256]
    - [0, 8.827]
  - - [3648, 2496, 1, 256, 3648, 3648, 256, 256]
    - [0, 8.836]
  - - [3776, 2496, 1, 256, 3776, 3776, 256, 256]
    - [0, 8.9]
  - - [3904, 2496, 1, 256, 3904, 3904, 256, 256]
    - [0, 8.816]
  - - [4032, 2496, 1, 256, 4032, 4032, 256, 256]
    - [0, 8.878]
  - - [64, 2624, 1, 256, 64, 64, 256, 256]
    - [0, 5.062]
  - - [192, 2624, 1, 256, 192, 192, 256, 256]
    - [0, 7.103]
  - - [320, 2624, 1, 256, 320, 320, 256, 256]
    - [0, 7.794]
  - - [448, 2624, 1, 256, 448, 448, 256, 256]
    - [0, 8.229]
  - - [576, 2624, 1, 256, 576, 576, 256, 256]
    - [0, 8.468]
  - - [704, 2624, 1, 256, 704, 704, 256, 256]
    - [0, 8.409]
  - - [832, 2624, 1, 256, 832, 832, 256, 256]
    - [0, 8.49]
  - - [960, 2624, 1, 256, 960, 960, 256, 256]
    - [0, 8.247]
  - - [1088, 2624, 1, 256, 1088, 1088, 256, 256]
    - [0, 8.418]
  - - [1216, 2624, 1, 256, 1216, 1216, 256, 256]
    - [0, 8.562]
  - - [1344, 2624, 1, 256, 1344, 1344, 256, 256]
    - [0, 8.534]
  - - [1472, 2624, 1, 256, 1472, 1472, 256, 256]
    - [0, 8.583]
  - - [1600, 2624, 1, 256, 1600, 1600, 256, 256]
    - [0, 8.64]
  - - [1728, 2624, 1, 256, 1728, 1728, 256, 256]
    - [0, 8.784]
  - - [1856, 2624, 1, 256, 1856, 1856, 256, 256]
    - [0, 8.756]
  - - [1984, 2624, 1, 256, 1984, 1984, 256, 256]
    - [0, 8.81]
  - - [2112, 2624, 1, 256, 2112, 2112, 256, 256]
    - [0, 8.818]
  - - [2240, 2624, 1, 256, 2240, 2240, 256, 256]
    - [0, 8.793]
  - - [2368, 2624, 1, 256, 2368, 2368, 256, 256]
    - [0, 8.701]
  - - [2496, 2624, 1, 256, 2496, 2496, 256, 256]
    - [0, 8.713]
  - - [2624, 2624, 1, 256, 2624, 2624, 256, 256]
    - [0, 8.695]
  - - [2752, 2624, 1, 256, 2752, 2752, 256, 256]
    - [0, 8.813]
  - - [2880, 2624, 1, 256, 2880, 2880, 256, 256]
    - [0, 8.8]
  - - [3008, 2624, 1, 256, 3008, 3008, 256, 256]
    - [0, 8.806]
  - - [3136, 2624, 1, 256, 3136, 3136, 256, 256]
    - [0, 8.873]
  - - [3264, 2624, 1, 256, 3264, 3264, 256, 256]
    - [0, 8.784]
  - - [3392, 2624, 1, 256, 3392, 3392, 256, 256]
    - [0, 8.817]
  - - [3520, 2624, 1, 256, 3520, 3520, 256, 256]
    - [0, 8.785]
  - - [3648, 2624, 1, 256, 3648, 3648, 256, 256]
    - [0, 8.685]
  - - [3776, 2624, 1, 256, 3776, 3776, 256, 256]
    - [0, 8.921]
  - - [3904, 2624, 1, 256, 3904, 3904, 256, 256]
    - [0, 8.924]
  - - [4032, 2624, 1, 256, 4032, 4032, 256, 256]
    - [0, 8.859]
  - - [64, 2752, 1, 256, 64, 64, 256, 256]
    - [0, 5.368]
  - - [192, 2752, 1, 256, 192, 192, 256, 256]
    - [0, 7.411]
  - - [320, 2752, 1, 256, 320, 320, 256, 256]
    - [0, 8.097]
  - - [448, 2752, 1, 256, 448, 448, 256, 256]
    - [0, 8.383]
  - - [576, 2752, 1, 256, 576, 576, 256, 256]
    - [0, 8.47]
  - - [704, 2752, 1, 256, 704, 704, 256, 256]
    - [0, 8.497]
  - - [832, 2752, 1, 256, 832, 832, 256, 256]
    - [0, 8.38]
  - - [960, 2752, 1, 256, 960, 960, 256, 256]
    - [0, 8.427]
  - - [1088, 2752, 1, 256, 1088, 1088, 256, 256]
    - [0, 8.389]
  - - [1216, 2752, 1, 256, 1216, 1216, 256, 256]
    - [0, 8.486]
  - - [1344, 2752, 1, 256, 1344, 1344, 256, 256]
    - [0, 8.579]
  - - [1472, 2752, 1, 256, 1472, 1472, 256, 256]
    - [0, 8.763]
  - - [1600, 2752, 1, 256, 1600, 1600, 256, 256]
    - [0, 8.711]
  - - [1728, 2752, 1, 256, 1728, 1728, 256, 256]
    - [0, 8.67]
  - - [1856, 2752, 1, 256, 1856, 1856, 256, 256]
    - [0, 8.683]
  - - [1984, 2752, 1, 256, 1984, 1984, 256, 256]
    - [0, 8.736]
  - - [2112, 2752, 1, 256, 2112, 2112, 256, 256]
    - [0, 8.669]
  - - [2240, 2752, 1, 256, 2240, 2240, 256, 256]
    - [0, 8.724]
  - - [2368, 2752, 1, 256, 2368, 2368, 256, 256]
    - [0, 8.807]
  - - [2496, 2752, 1, 256, 2496, 2496, 256, 256]
    - [0, 8.764]
  - - [2624, 2752, 1, 256, 2624, 2624, 256, 256]
    - [0, 8.787]
  - - [2752, 2752, 1, 256, 2752, 2752, 256, 256]
    - [0, 8.831]
  - - [2880, 2752, 1, 256, 2880, 2880, 256, 256]
    - [0, 8.926]
  - - [3008, 2752, 1, 256, 3008, 3008, 256, 256]
    - [0, 8.906]
  - - [3136, 2752, 1, 256, 3136, 3136, 256, 256]
    - [0, 8.872]
  - - [3264, 2752, 1, 256, 3264, 3264, 256, 256]
    - [0, 8.795]
  - - [3392, 2752, 1, 256, 3392, 3392, 256, 256]
    - [0, 8.919]
  - - [3520, 2752, 1, 256, 3520, 3520, 256, 256]
    - [0, 8.916]
  - - [3648, 2752, 1, 256, 3648, 3648, 256, 256]
    - [0, 8.856]
  - - [3776, 2752, 1, 256, 3776, 3776, 256, 256]
    - [0, 8.791]
  - - [3904, 2752, 1, 256, 3904, 3904, 256, 256]
    - [0, 8.888]
  - - [4032, 2752, 1, 256, 4032, 4032, 256, 256]
    - [0, 9.002]
  - - [64, 2880, 1, 256, 64, 64, 256, 256]
    - [0, 5.618]
  - - [192, 2880, 1, 256, 192, 192, 256, 256]
    - [0, 7.267]
  - - [320, 2880, 1, 256, 320, 320, 256, 256]
    - [0, 7.982]
  - - [448, 2880, 1, 256, 448, 448, 256, 256]
    - [0, 8.303]
  - - [576, 2880, 1, 256, 576, 576, 256, 256]
    - [0, 8.399]
  - - [704, 2880, 1, 256, 704, 704, 256, 256]
    - [0, 8.441]
  - - [832, 2880, 1, 256, 832, 832, 256, 256]
    - [0, 8.432]
  - - [960, 2880, 1, 256, 960, 960, 256, 256]
    - [0, 8.465]
  - - [1088, 2880, 1, 256, 1088, 1088, 256, 256]
    - [0, 8.459]
  - - [1216, 2880, 1, 256, 1216, 1216, 256, 256]
    - [0, 8.596]
  - - [1344, 2880, 1, 256, 1344, 1344, 256, 256]
    - [0, 8.664]
  - - [1472, 2880, 1, 256, 1472, 1472, 256, 256]
    - [0, 8.809]
  - - [1600, 2880, 1, 256, 1600, 1600, 256, 256]
    - [0, 8.751]
  - - [1728, 2880, 1, 256, 1728, 1728, 256, 256]
    - [0, 8.705]
  - - [1856, 2880, 1, 256, 1856, 1856, 256, 256]
    - [0, 8.629]
  - - [1984, 2880, 1, 256, 1984, 1984, 256, 256]
    - [0, 8.647]
  - - [2112, 2880, 1, 256, 2112, 2112, 256, 256]
    - [0, 8.829]
  - - [2240, 2880, 1, 256, 2240, 2240, 256, 256]
    - [0, 8.669]
  - - [2368, 2880, 1, 256, 2368, 2368, 256, 256]
    - [0, 8.803]
  - - [2496, 2880, 1, 256, 2496, 2496, 256, 256]
    - [0, 8.844]
  - - [2624, 2880, 1, 256, 2624, 2624, 256, 256]
    - [0, 8.823]
  - - [2752, 2880, 1, 256, 2752, 2752, 256, 256]
    - [0, 8.746]
  - - [2880, 2880, 1, 256, 2880, 2880, 256, 256]
    - [0, 8.793]
  - - [3008, 2880, 1, 256, 3008, 3008, 256, 256]
    - [0, 8.855]
  - - [3136, 2880, 1, 256, 3136, 3136, 256, 256]
    - [0, 8.935]
  - - [3264, 2880, 1, 256, 3264, 3264, 256, 256]
    - [0, 8.953]
  - - [3392, 2880, 1, 256, 3392, 3392, 256, 256]
    - [0, 8.945]
  - - [3520, 2880, 1, 256, 3520, 3520, 256, 256]
    - [0, 8.944]
  - - [3648, 2880, 1, 256, 3648, 3648, 256, 256]
    - [0, 8.926]
  - - [3776, 2880, 1, 256, 3776, 3776, 256, 256]
    - [0, 9.045]
  - - [3904, 2880, 1, 256, 3904, 3904, 256, 256]
    - [0, 9.027]
  - - [4032, 2880, 1, 256, 4032, 4032, 256, 256]
    - [0, 8.986]
  - - [64, 3008, 1, 256, 64, 64, 256, 256]
    - [0, 5.862]
  - - [192, 3008, 1, 256, 192, 192, 256, 256]
    - [0, 7.541]
  - - [320, 3008, 1, 256, 320, 320, 256, 256]
    - [0, 7.995]
  - - [448, 3008, 1, 256, 448, 448, 256, 256]
    - [0, 8.474]
  - - [576, 3008, 1, 256, 576, 576, 256, 256]
    - [0, 8.469]
  - - [704, 3008, 1, 256, 704, 704, 256, 256]
    - [0, 8.479]
  - - [832, 3008, 1, 256, 832, 832, 256, 256]
    - [0, 8.332]
  - - [960, 3008, 1, 256, 960, 960, 256, 256]
    - [0, 8.353]
  - - [1088, 3008, 1, 256, 1088, 1088, 256, 256]
    - [0, 8.386]
  - - [1216, 3008, 1, 256, 1216, 1216, 256, 256]
    - [0, 8.631]
  - - [1344, 3008, 1, 256, 1344, 1344, 256, 256]
    - [0, 8.784]
  - - [1472, 3008, 1, 256, 1472, 1472, 256, 256]
    - [0, 8.819]
  - - [1600, 3008, 1, 256, 1600, 1600, 256, 256]
    - [0, 8.753]
  - - [1728, 3008, 1, 256, 1728, 1728, 256, 256]
    - [0, 8.782]
  - - [1856, 3008, 1, 256, 1856, 1856, 256, 256]
    - [0, 8.798]
  - - [1984, 3008, 1, 256, 1984, 1984, 256, 256]
    - [0, 8.82]
  - - [2112, 3008, 1, 256, 2112, 2112, 256, 256]
    - [0, 8.757]
  - - [2240, 3008, 1, 256, 2240, 2240, 256, 256]
    - [0, 8.773]
  - - [2368, 3008, 1, 256, 2368, 2368, 256, 256]
    - [0, 8.838]
  - - [2496, 3008, 1, 256, 2496, 2496, 256, 256]
    - [0, 8.832]
  - - [2624, 3008, 1, 256, 2624, 2624, 256, 256]
    - [0, 8.855]
  - - [2752, 3008, 1, 256, 2752, 2752, 256, 256]
    - [0, 8.85]
  - - [2880, 3008, 1, 256, 2880, 2880, 256, 256]
    - [0, 8.844]
  - - [3008, 3008, 1, 256, 3008, 3008, 256, 256]
    - [0, 8.923]
  - - [3136, 3008, 1, 256, 3136, 3136, 256, 256]
    - [0, 9.048]
  - - [3264, 3008, 1, 256, 3264, 3264, 256, 256]
    - [0, 9.017]
  - - [3392, 3008, 1, 256, 3392, 3392, 256, 256]
    - [0, 9.003]
  - - [3520, 3008, 1, 256, 3520, 3520, 256, 256]
    - [0, 8.922]
  - - [3648, 3008, 1, 256, 3648, 3648, 256, 256]
    - [0, 8.91]
  - - [3776, 3008, 1, 256, 3776, 3776, 256, 256]
    - [0, 8.947]
  - - [3904, 3008, 1, 256, 3904, 3904, 256, 256]
    - [0, 9.043]
  - - [4032, 3008, 1, 256, 4032, 4032, 256, 256]
    - [0, 9.041]
  - - [64, 3136, 1, 256, 64, 64, 256, 256]
    - [0, 5.342]
  - - [192, 3136, 1, 256, 192, 192, 256, 256]
    - [0, 7.411]
  - - [320, 3136, 1, 256, 320, 320, 256, 256]
    - [0, 8.066]
  - - [448, 3136, 1, 256, 448, 448, 256, 256]
    - [0, 8.569]
  - - [576, 3136, 1, 256, 576, 576, 256, 256]
    - [0, 8.307]
  - - [704, 3136, 1, 256, 704, 704, 256, 256]
    - [0, 8.408]
  - - [832, 3136, 1, 256, 832, 832, 256, 256]
    - [0, 8.499]
  - - [960, 3136, 1, 256, 960, 960, 256, 256]
    - [0, 8.496]
  - - [1088, 3136, 1, 256, 1088, 1088, 256, 256]
    - [0, 8.527]
  - - [1216, 3136, 1, 256, 1216, 1216, 256, 256]
    - [0, 8.599]
  - - [1344, 3136, 1, 256, 1344, 1344, 256, 256]
    - [0, 8.712]
  - - [1472, 3136, 1, 256, 1472, 1472, 256, 256]
    - [0, 8.675]
  - - [1600, 3136, 1, 256, 1600, 1600, 256, 256]
    - [0, 8.673]
  - - [1728, 3136, 1, 256, 1728, 1728, 256, 256]
    - [0, 8.683]
  - - [1856, 3136, 1, 256, 1856, 1856, 256, 256]
    - [0, 8.798]
  - - [1984, 3136, 1, 256, 1984, 1984, 256, 256]
    - [0, 8.772]
  - - [2112, 3136, 1, 256, 2112, 2112, 256, 256]
    - [0, 8.809]
  - - [2240, 3136, 1, 256, 2240, 2240, 256, 256]
    - [0, 8.937]
  - - [2368, 3136, 1, 256, 2368, 2368, 256, 256]
    - [0, 8.782]
  - - [2496, 3136, 1, 256, 2496, 2496, 256, 256]
    - [0, 8.832]
  - - [2624, 3136, 1, 256, 2624, 2624, 256, 256]
    - [0, 8.808]
  - - [2752, 3136, 1, 256, 2752, 2752, 256, 256]
    - [0, 8.912]
  - - [2880, 3136, 1, 256, 2880, 2880, 256, 256]
    - [0, 8.972]
  - - [3008, 3136, 1, 256, 3008, 3008, 256, 256]
    - [0, 8.919]
  - - [3136, 3136, 1, 256, 3136, 3136, 256, 256]
    - [0, 8.844]
  - - [3264, 3136, 1, 256, 3264, 3264, 256, 256]
    - [0, 8.848]
  - - [3392, 3136, 1, 256, 3392, 3392, 256, 256]
    - [0, 8.946]
  - - [3520, 3136, 1, 256, 3520, 3520, 256, 256]
    - [0, 8.936]
  - - [3648, 3136, 1, 256, 3648, 3648, 256, 256]
    - [0, 9.036]
  - - [3776, 3136, 1, 256, 3776, 3776, 256, 256]
    - [0, 9.041]
  - - [3904, 3136, 1, 256, 3904, 3904, 256, 256]
    - [0, 9.008]
  - - [4032, 3136, 1, 256, 4032, 4032, 256, 256]
    - [0, 8.934]
  - - [64, 3264, 1, 256, 64, 64, 256, 256]
    - [0, 5.543]
  - - [192, 3264, 1, 256, 192, 192, 256, 256]
    - [0, 7.664]
  - - [320, 3264, 1, 256, 320, 320, 256, 256]
    - [0, 8.188]
  - - [448, 3264, 1, 256, 448, 448, 256, 256]
    - [0, 8.278]
  - - [576, 3264, 1, 256, 576, 576, 256, 256]
    - [0, 8.396]
  - - [704, 3264, 1, 256, 704, 704, 256, 256]
    - [0, 8.489]
  - - [832, 3264, 1, 256, 832, 832, 256, 256]
    - [0, 8.421]
  - - [960, 3264, 1, 256, 960, 960, 256, 256]
    - [0, 8.546]
  - - [1088, 3264, 1, 256, 1088, 1088, 256, 256]
    - [0, 8.636]
  - - [1216, 3264, 1, 256, 1216, 1216, 256, 256]
    - [0, 8.787]
  - - [1344, 3264, 1, 256, 1344, 1344, 256, 256]
    - [0, 8.737]
  - - [1472, 3264, 1, 256, 1472, 1472, 256, 256]
    - [0, 8.744]
  - - [1600, 3264, 1, 256, 1600, 1600, 256, 256]
    - [0, 8.79]
  - - [1728, 3264, 1, 256, 1728, 1728, 256, 256]
    - [0, 8.796]
  - - [1856, 3264, 1, 256, 1856, 1856, 256, 256]
    - [0, 8.734]
  - - [1984, 3264, 1, 256, 1984, 1984, 256, 256]
    - [0, 8.774]
  - - [2112, 3264, 1, 256, 2112, 2112, 256, 256]
    - [0, 8.887]
  - - [2240, 3264, 1, 256, 2240, 2240, 256, 256]
    - [0, 8.796]
  - - [2368, 3264, 1, 256, 2368, 2368, 256, 256]
    - [0, 8.879]
  - - [2496, 3264, 1, 256, 2496, 2496, 256, 256]
    - [0, 8.884]
  - - [2624, 3264, 1, 256, 2624, 2624, 256, 256]
    - [0, 8.867]
  - - [2752, 3264, 1, 256, 2752, 2752, 256, 256]
    - [0, 8.83]
  - - [2880, 3264, 1, 256, 2880, 2880, 256, 256]
    - [0, 8.897]
  - - [3008, 3264, 1, 256, 3008, 3008, 256, 256]
    - [0, 8.96]
  - - [3136, 3264, 1, 256, 3136, 3136, 256, 256]
    - [0, 9.015]
  - - [3264, 3264, 1, 256, 3264, 3264, 256, 256]
    - [0, 8.901]
  - - [3392, 3264, 1, 256, 3392, 3392, 256, 256]
    - [0, 8.958]
  - - [3520, 3264, 1, 256, 3520, 3520, 256, 256]
    - [0, 9.004]
  - - [3648, 3264, 1, 256, 3648, 3648, 256, 256]
    - [0, 8.994]
  - - [3776, 3264, 1, 256, 3776, 3776, 256, 256]
    - [0, 8.97]
  - - [3904, 3264, 1, 256, 3904, 3904, 256, 256]
    - [0, 9.015]
  - - [4032, 3264, 1, 256, 4032, 4032, 256, 256]
    - [0, 8.941]
  - - [64, 3392, 1, 256, 64, 64, 256, 256]
    - [0, 5.747]
  - - [192, 3392, 1, 256, 192, 192, 256, 256]
    - [0, 7.506]
  - - [320, 3392, 1, 256, 320, 320, 256, 256]
    - [0, 8.197]
  - - [448, 3392, 1, 256, 448, 448, 256, 256]
    - [0, 8.466]
  - - [576, 3392, 1, 256, 576, 576, 256, 256]
    - [0, 8.489]
  - - [704, 3392, 1, 256, 704, 704, 256, 256]
    - [0, 8.505]
  - - [832, 3392, 1, 256, 832, 832, 256, 256]
    - [0, 8.415]
  - - [960, 3392, 1, 256, 960, 960, 256, 256]
    - [0, 8.479]
  - - [1088, 3392, 1, 256, 1088, 1088, 256, 256]
    - [0, 8.756]
  - - [1216, 3392, 1, 256, 1216, 1216, 256, 256]
    - [0, 8.654]
  - - [1344, 3392, 1, 256, 1344, 1344, 256, 256]
    - [0, 8.707]
  - - [1472, 3392, 1, 256, 1472, 1472, 256, 256]
    - [0, 8.792]
  - - [1600, 3392, 1, 256, 1600, 1600, 256, 256]
    - [0, 8.823]
  - - [1728, 3392, 1, 256, 1728, 1728, 256, 256]
    - [0, 8.685]
  - - [1856, 3392, 1, 256, 1856, 1856, 256, 256]
    - [0, 8.91]
  - - [1984, 3392, 1, 256, 1984, 1984, 256, 256]
    - [0, 8.944]
  - - [2112, 3392, 1, 256, 2112, 2112, 256, 256]
    - [0, 8.792]
  - - [2240, 3392, 1, 256, 2240, 2240, 256, 256]
    - [0, 8.872]
  - - [2368, 3392, 1, 256, 2368, 2368, 256, 256]
    - [0, 8.891]
  - - [2496, 3392, 1, 256, 2496, 2496, 256, 256]
    - [0, 8.862]
  - - [2624, 3392, 1, 256, 2624, 2624, 256, 256]
    - [0, 8.867]
  - - [2752, 3392, 1, 256, 2752, 2752, 256, 256]
    - [0, 8.914]
  - - [2880, 3392, 1, 256, 2880, 2880, 256, 256]
    - [0, 8.887]
  - - [3008, 3392, 1, 256, 3008, 3008, 256, 256]
    - [0, 9.022]
  - - [3136, 3392, 1, 256, 3136, 3136, 256, 256]
    - [0, 9.006]
  - - [3264, 3392, 1, 256, 3264, 3264, 256, 256]
    - [0, 9.001]
  - - [3392, 3392, 1, 256, 3392, 3392, 256, 256]
    - [0, 9.107]
  - - [3520, 3392, 1, 256, 3520, 3520, 256, 256]
    - [0, 8.963]
  - - [3648, 3392, 1, 256, 3648, 3648, 256, 256]
    - [0, 9.003]
  - - [3776, 3392, 1, 256, 3776, 3776, 256, 256]
    - [0, 9.083]
  - - [3904, 3392, 1, 256, 3904, 3904, 256, 256]
    - [0, 8.978]
  - - [4032, 3392, 1, 256, 4032, 4032, 256, 256]
    - [0, 8.972]
  - - [64, 3520, 1, 256, 64, 64, 256, 256]
    - [0, 5.959]
  - - [192, 3520, 1, 256, 192, 192, 256, 256]
    - [0, 7.762]
  - - [320, 3520, 1, 256, 320, 320, 256, 256]
    - [0, 8.278]
  - - [448, 3520, 1, 256, 448, 448, 256, 256]
    - [0, 8.509]
  - - [576, 3520, 1, 256, 576, 576, 256, 256]
    - [0, 8.467]
  - - [704, 3520, 1, 256, 704, 704, 256, 256]
    - [0, 8.419]
  - - [832, 3520, 1, 256, 832, 832, 256, 256]
    - [0, 8.46]
  - - [960, 3520, 1, 256, 960, 960, 256, 256]
    - [0, 8.625]
  - - [1088, 3520, 1, 256, 1088, 1088, 256, 256]
    - [0, 8.618]
  - - [1216, 3520, 1, 256, 1216, 1216, 256, 256]
    - [0, 8.857]
  - - [1344, 3520, 1, 256, 1344, 1344, 256, 256]
    - [0, 8.763]
  - - [1472, 3520, 1, 256, 1472, 1472, 256, 256]
    - [0, 8.782]
  - - [1600, 3520, 1, 256, 1600, 1600, 256, 256]
    - [0, 8.808]
  - - [1728, 3520, 1, 256, 1728, 1728, 256, 256]
    - [0, 8.859]
  - - [1856, 3520, 1, 256, 1856, 1856, 256, 256]
    - [0, 8.788]
  - - [1984, 3520, 1, 256, 1984, 1984, 256, 256]
    - [0, 8.853]
  - - [2112, 3520, 1, 256, 2112, 2112, 256, 256]
    - [0, 8.89]
  - - [2240, 3520, 1, 256, 2240, 2240, 256, 256]
    - [0, 8.94]
  - - [2368, 3520, 1, 256, 2368, 2368, 256, 256]
    - [0, 8.901]
  - - [2496, 3520, 1, 256, 2496, 2496, 256, 256]
    - [0, 8.882]
  - - [2624, 3520, 1, 256, 2624, 2624, 256, 256]
    - [0, 8.957]
  - - [2752, 3520, 1, 256, 2752, 2752, 256, 256]
    - [0, 9.004]
  - - [2880, 3520, 1, 256, 2880, 2880, 256, 256]
    - [0, 9.008]
  - - [3008, 3520, 1, 256, 3008, 3008, 256, 256]
    - [0, 8.976]
  - - [3136, 3520, 1, 256, 3136, 3136, 256, 256]
    - [0, 8.955]
  - - [3264, 3520, 1, 256, 3264, 3264, 256, 256]
    - [0, 8.899]
  - - [3392, 3520, 1, 256, 3392, 3392, 256, 256]
    - [0, 8.928]
  - - [3520, 3520, 1, 256, 3520, 3520, 256, 256]
    - [0, 8.983]
  - - [3648, 3520, 1, 256, 3648, 3648, 256, 256]
    - [0, 8.946]
  - - [3776, 3520, 1, 256, 3776, 3776, 256, 256]
    - [0, 8.98]
  - - [3904, 3520, 1, 256, 3904, 3904, 256, 256]
    - [0, 9.013]
  - - [4032, 3520, 1, 256, 4032, 4032, 256, 256]
    - [0, 9.078]
  - - [64, 3648, 1, 256, 64, 64, 256, 256]
    - [0, 6.173]
  - - [192, 3648, 1, 256, 192, 192, 256, 256]
    - [0, 7.606]
  - - [320, 3648, 1, 256, 320, 320, 256, 256]
    - [0, 8.412]
  - - [448, 3648, 1, 256, 448, 448, 256, 256]
    - [0, 8.406]
  - - [576, 3648, 1, 256, 576, 576, 256, 256]
    - [0, 8.44]
  - - [704, 3648, 1, 256, 704, 704, 256, 256]
    - [0, 8.448]
  - - [832, 3648, 1, 256, 832, 832, 256, 256]
    - [0, 8.553]
  - - [960, 3648, 1, 256, 960, 960, 256, 256]
    - [0, 8.566]
  - - [1088, 3648, 1, 256, 1088, 1088, 256, 256]
    - [0, 8.732]
  - - [1216, 3648, 1, 256, 1216, 1216, 256, 256]
    - [0, 8.716]
  - - [1344, 3648, 1, 256, 1344, 1344, 256, 256]
    - [0, 8.742]
  - - [1472, 3648, 1, 256, 1472, 1472, 256, 256]
    - [0, 8.742]
  - - [1600, 3648, 1, 256, 1600, 1600, 256, 256]
    - [0, 8.69]
  - - [1728, 3648, 1, 256, 1728, 1728, 256, 256]
    - [0, 8.816]
  - - [1856, 3648, 1, 256, 1856, 1856, 256, 256]
    - [0, 8.743]
  - - [1984, 3648, 1, 256, 1984, 1984, 256, 256]
    - [0, 8.832]
  - - [2112, 3648, 1, 256, 2112, 2112, 256, 256]
    - [0, 8.722]
  - - [2240, 3648, 1, 256, 2240, 2240, 256, 256]
    - [0, 8.869]
  - - [2368, 3648, 1, 256, 2368, 2368, 256, 256]
    - [0, 8.894]
  - - [2496, 3648, 1, 256, 2496, 2496, 256, 256]
    - [0, 8.927]
  - - [2624, 3648, 1, 256, 2624, 2624, 256, 256]
    - [0, 8.93]
  - - [2752, 3648, 1, 256, 2752, 2752, 256, 256]
    - [0, 8.99]
  - - [2880, 3648, 1, 256, 2880, 2880, 256, 256]
    - [0, 8.912]
  - - [3008, 3648, 1, 256, 3008, 3008, 256, 256]
    - [0, 8.943]
  - - [3136, 3648, 1, 256, 3136, 3136, 256, 256]
    - [0, 8.978]
  - - [3264, 3648, 1, 256, 3264, 3264, 256, 256]
    - [0, 9.015]
  - - [3392, 3648, 1, 256, 3392, 3392, 256, 256]
    - [0, 8.948]
  - - [3520, 3648, 1, 256, 3520, 3520, 256, 256]
    - [0, 8.936]
  - - [3648, 3648, 1, 256, 3648, 3648, 256, 256]
    - [0, 8.99]
  - - [3776, 3648, 1, 256, 3776, 3776, 256, 256]
    - [0, 9.097]
  - - [3904, 3648, 1, 256, 3904, 3904, 256, 256]
    - [0, 8.98]
  - - [4032, 3648, 1, 256, 4032, 4032, 256, 256]
    - [0, 9.005]
  - - [64, 3776, 1, 256, 64, 64, 256, 256]
    - [0, 6.383]
  - - [192, 3776, 1, 256, 192, 192, 256, 256]
    - [0, 7.776]
  - - [320, 3776, 1, 256, 320, 320, 256, 256]
    - [0, 8.18]
  - - [448, 3776, 1, 256, 448, 448, 256, 256]
    - [0, 8.512]
  - - [576, 3776, 1, 256, 576, 576, 256, 256]
    - [0, 8.551]
  - - [704, 3776, 1, 256, 704, 704, 256, 256]
    - [0, 8.578]
  - - [832, 3776, 1, 256, 832, 832, 256, 256]
    - [0, 8.494]
  - - [960, 3776, 1, 256, 960, 960, 256, 256]
    - [0, 8.54]
  - - [1088, 3776, 1, 256, 1088, 1088, 256, 256]
    - [0, 8.691]
  - - [1216, 3776, 1, 256, 1216, 1216, 256, 256]
    - [0, 8.59]
  - - [1344, 3776, 1, 256, 1344, 1344, 256, 256]
    - [0, 8.81]
  - - [1472, 3776, 1, 256, 1472, 1472, 256, 256]
    - [0, 8.727]
  - - [1600, 3776, 1, 256, 1600, 1600, 256, 256]
    - [0, 8.839]
  - - [1728, 3776, 1, 256, 1728, 1728, 256, 256]
    - [0, 8.809]
  - - [1856, 3776, 1, 256, 1856, 1856, 256, 256]
    - [0, 8.841]
  - - [1984, 3776, 1, 256, 1984, 1984, 256, 256]
    - [0, 8.924]
  - - [2112, 3776, 1, 256, 2112, 2112, 256, 256]
    - [0, 8.828]
  - - [2240, 3776, 1, 256, 2240, 2240, 256, 256]
    - [0, 8.884]
  - - [2368, 3776, 1, 256, 2368, 2368, 256, 256]
    - [0, 8.857]
  - - [2496, 3776, 1, 256, 2496, 2496, 256, 256]
    - [0, 9.018]
  - - [2624, 3776, 1, 256, 2624, 2624, 256, 256]
    - [0, 9.035]
  - - [2752, 3776, 1, 256, 2752, 2752, 256, 256]
    - [0, 8.941]
  - - [2880, 3776, 1, 256, 2880, 2880, 256, 256]
    - [0, 8.987]
  - - [3008, 3776, 1, 256, 3008, 3008, 256, 256]
    - [0, 9.013]
  - - [3136, 3776, 1, 256, 3136, 3136, 256, 256]
    - [0, 9.035]
  - - [3264, 3776, 1, 256, 3264, 3264, 256, 256]
    - [0, 9.012]
  - - [3392, 3776, 1, 256, 3392, 3392, 256, 256]
    - [0, 9.043]
  - - [3520, 3776, 1, 256, 3520, 3520, 256, 256]
    - [0, 9.018]
  - - [3648, 3776, 1, 256, 3648, 3648, 256, 256]
    - [0, 9.045]
  - - [3776, 3776, 1, 256, 3776, 3776, 256, 256]
    - [0, 9.002]
  - - [3904, 3776, 1, 256, 3904, 3904, 256, 256]
    - [0, 9.158]
  - - [4032, 3776, 1, 256, 4032, 4032, 256, 256]
    - [0, 9.096]
  - - [64, 3904, 1, 256, 64, 64, 256, 256]
    - [0, 5.811]
  - - [192, 3904, 1, 256, 192, 192, 256, 256]
    - [0, 7.65]
  - - [320, 3904, 1, 256, 320, 320, 256, 256]
    - [0, 8.406]
  - - [448, 3904, 1, 256, 448, 448, 256, 256]
    - [0, 8.431]
  - - [576, 3904, 1, 256, 576, 576, 256, 256]
    - [0, 8.506]
  - - [704, 3904, 1, 256, 704, 704, 256, 256]
    - [0, 8.415]
  - - [832, 3904, 1, 256, 832, 832, 256, 256]
    - [0, 8.433]
  - - [960, 3904, 1, 256, 960, 960, 256, 256]
    - [0, 8.494]
  - - [1088, 3904, 1, 256, 1088, 1088, 256, 256]
    - [0, 8.734]
  - - [1216, 3904, 1, 256, 1216, 1216, 256, 256]
    - [0, 8.729]
  - - [1344, 3904, 1, 256, 1344, 1344, 256, 256]
    - [0, 8.778]
  - - [1472, 3904, 1, 256, 1472, 1472, 256, 256]
    - [0, 8.783]
  - - [1600, 3904, 1, 256, 1600, 1600, 256, 256]
    - [0, 8.797]
  - - [1728, 3904, 1, 256, 1728, 1728, 256, 256]
    - [0, 8.765]
  - - [1856, 3904, 1, 256, 1856, 1856, 256, 256]
    - [0, 8.901]
  - - [1984, 3904, 1, 256, 1984, 1984, 256, 256]
    - [0, 8.847]
  - - [2112, 3904, 1, 256, 2112, 2112, 256, 256]
    - [0, 8.964]
  - - [2240, 3904, 1, 256, 2240, 2240, 256, 256]
    - [0, 8.937]
  - - [2368, 3904, 1, 256, 2368, 2368, 256, 256]
    - [0, 8.864]
  - - [2496, 3904, 1, 256, 2496, 2496, 256, 256]
    - [0, 8.951]
  - - [2624, 3904, 1, 256, 2624, 2624, 256, 256]
    - [0, 8.91]
  - - [2752, 3904, 1, 256, 2752, 2752, 256, 256]
    - [0, 8.907]
  - - [2880, 3904, 1, 256, 2880, 2880, 256, 256]
    - [0, 9.093]
  - - [3008, 3904, 1, 256, 3008, 3008, 256, 256]
    - [0, 8.977]
  - - [3136, 3904, 1, 256, 3136, 3136, 256, 256]
    - [0, 9.005]
  - - [3264, 3904, 1, 256, 3264, 3264, 256, 256]
    - [0, 9.076]
  - - [3392, 3904, 1, 256, 3392, 3392, 256, 256]
    - [0, 9.085]
  - - [3520, 3904, 1, 256, 3520, 3520, 256, 256]
    - [0, 9.008]
  - - [3648, 3904, 1, 256, 3648, 3648, 256, 256]
    - [0, 9.071]
  - - [3776, 3904, 1, 256, 3776, 3776, 256, 256]
    - [0, 9.109]
  - - [3904, 3904, 1, 256, 3904, 3904, 256, 256]
    - [0, 9.166]
  - - [4032, 3904, 1, 256, 4032, 4032, 256, 256]
    - [0, 9.173]
  - - [64, 4032, 1, 256, 64, 64, 256, 256]
    - [0, 5.959]
  - - [192, 4032, 1, 256, 192, 192, 256, 256]
    - [0, 7.859]
  - - [320, 4032, 1, 256, 320, 320, 256, 256]
    - [0, 8.544]
  - - [448, 4032, 1, 256, 448, 448, 256, 256]
    - [0, 8.485]
  - - [576, 4032, 1, 256, 576, 576, 256, 256]
    - [0, 8.376]
  - - [704, 4032, 1, 256, 704, 704, 256, 256]
    - [0, 8.376]
  - - [832, 4032, 1, 256, 832, 832, 256, 256]
    - [0, 8.475]
  - - [960, 4032, 1, 256, 960, 960, 256, 256]
    - [0, 8.607]
  - - [1088, 4032, 1, 256, 1088, 1088, 256, 256]
    - [0, 8.702]
  - - [1216, 4032, 1, 256, 1216, 1216, 256, 256]
    - [0, 8.754]
  - - [1344, 4032, 1, 256, 1344, 1344, 256, 256]
    - [0, 8.735]
  - - [1472, 4032, 1, 256, 1472, 1472, 256, 256]
    - [0, 8.831]
  - - [1600, 4032, 1, 256, 1600, 1600, 256, 256]
    - [0, 8.77]
  - - [1728, 4032, 1, 256, 1728, 1728, 256, 256]
    - [0, 8.9]
  - - [1856, 4032, 1, 256, 1856, 1856, 256, 256]
    - [0, 8.885]
  - - [1984, 4032, 1, 256, 1984, 1984, 256, 256]
    - [0, 8.902]
  - - [2112, 4032, 1, 256, 2112, 2112, 256, 256]
    - [0, 8.984]
  - - [2240, 4032, 1, 256, 2240, 2240, 256, 256]
    - [0, 8.986]
  - - [2368, 4032, 1, 256, 2368, 2368, 256, 256]
    - [0, 8.901]
  - - [2496, 4032, 1, 256, 2496, 2496, 256, 256]
    - [0, 9.03]
  - - [2624, 4032, 1, 256, 2624, 2624, 256, 256]
    - [0, 8.987]
  - - [2752, 4032, 1, 256, 2752, 2752, 256, 256]
    - [0, 8.996]
  - - [2880, 4032, 1, 256, 2880, 2880, 256, 256]
    - [0, 9.07]
  - - [3008, 4032, 1, 256, 3008, 3008, 256, 256]
    - [0, 9.052]
  - - [3136, 4032, 1, 256, 3136, 3136, 256, 256]
    - [0, 9.148]
  - - [3264, 4032, 1, 256, 3264, 3264, 256, 256]
    - [0, 8.969]
  - - [3392, 4032, 1, 256, 3392, 3392, 256, 256]
    - [0, 9.087]
  - - [3520, 4032, 1, 256, 3520, 3520, 256, 256]
    - [0, 9.078]
  - - [3648, 4032, 1, 256, 3648, 3648, 256, 256]
    - [0, 9.006]
  - - [3776, 4032, 1, 256, 3776, 3776, 256, 256]
    - [0, 9.071]
  - - [3904, 4032, 1, 256, 3904, 3904, 256, 256]
    - [0, 9.02]
  - - [4032, 4032, 1, 256, 4032, 4032, 256, 256]
    - [0, 9.151]
  - - [64, 64, 1, 512, 64, 64, 512, 512]
    - [1, 0.488]
  - - [192, 64, 1, 512, 192, 192, 512, 512]
    - [1, 1.472]
  - - [320, 64, 1, 512, 320, 320, 512, 512]
    - [3, 2.171]
  - - [448, 64, 1, 512, 448, 448, 512, 512]
    - [0, 2.632]
  - - [576, 64, 1, 512, 576, 576, 512, 512]
    - [0, 3.365]
  - - [704, 64, 1, 512, 704, 704, 512, 512]
    - [3, 3.517]
  - - [832, 64, 1, 512, 832, 832, 512, 512]
    - [0, 3.258]
  - - [960, 64, 1, 512, 960, 960, 512, 512]
    - [0, 3.741]
  - - [1088, 64, 1, 512, 1088, 1088, 512, 512]
    - [0, 4.234]
  - - [1216, 64, 1, 512, 1216, 1216, 512, 512]
    - [0, 4.725]
  - - [1344, 64, 1, 512, 1344, 1344, 512, 512]
    - [0, 5.225]
  - - [1472, 64, 1, 512, 1472, 1472, 512, 512]
    - [0, 5.712]
  - - [1600, 64, 1, 512, 1600, 1600, 512, 512]
    - [0, 4.667]
  - - [1728, 64, 1, 512, 1728, 1728, 512, 512]
    - [0, 5.015]
  - - [1856, 64, 1, 512, 1856, 1856, 512, 512]
    - [0, 5.368]
  - - [1984, 64, 1, 512, 1984, 1984, 512, 512]
    - [0, 5.741]
  - - [2112, 64, 1, 512, 2112, 2112, 512, 512]
    - [0, 6.103]
  - - [2240, 64, 1, 512, 2240, 2240, 512, 512]
    - [0, 6.485]
  - - [2368, 64, 1, 512, 2368, 2368, 512, 512]
    - [0, 5.485]
  - - [2496, 64, 1, 512, 2496, 2496, 512, 512]
    - [0, 5.765]
  - - [2624, 64, 1, 512, 2624, 2624, 512, 512]
    - [0, 6.05]
  - - [2752, 64, 1, 512, 2752, 2752, 512, 512]
    - [0, 6.342]
  - - [2880, 64, 1, 512, 2880, 2880, 512, 512]
    - [0, 6.586]
  - - [3008, 64, 1, 512, 3008, 3008, 512, 512]
    - [0, 6.877]
  - - [3136, 64, 1, 512, 3136, 3136, 512, 512]
    - [0, 6.13]
  - - [3264, 64, 1, 512, 3264, 3264, 512, 512]
    - [0, 6.333]
  - - [3392, 64, 1, 512, 3392, 3392, 512, 512]
    - [0, 6.569]
  - - [3520, 64, 1, 512, 3520, 3520, 512, 512]
    - [0, 6.831]
  - - [3648, 64, 1, 512, 3648, 3648, 512, 512]
    - [0, 7.07]
  - - [3776, 64, 1, 512, 3776, 3776, 512, 512]
    - [0, 7.271]
  - - [3904, 64, 1, 512, 3904, 3904, 512, 512]
    - [0, 6.511]
  - - [4032, 64, 1, 512, 4032, 4032, 512, 512]
    - [0, 6.682]
  - - [64, 192, 1, 512, 64, 64, 512, 512]
    - [3, 0.407]
  - - [192, 192, 1, 512, 192, 192, 512, 512]
    - [3, 2.364]
  - - [320, 192, 1, 512, 320, 320, 512, 512]
    - [0, 3.707]
  - - [448, 192, 1, 512, 448, 448, 512, 512]
    - [0, 5.158]
  - - [576, 192, 1, 512, 576, 576, 512, 512]
    - [0, 4.974]
  - - [704, 192, 1, 512, 704, 704, 512, 512]
    - [0, 6.055]
  - - [832, 192, 1, 512, 832, 832, 512, 512]
    - [0, 5.733]
  - - [960, 192, 1, 512, 960, 960, 512, 512]
    - [0, 6.6]
  - - [1088, 192, 1, 512, 1088, 1088, 512, 512]
    - [0, 6.359]
  - - [1216, 192, 1, 512, 1216, 1216, 512, 512]
    - [0, 7.074]
  - - [1344, 192, 1, 512, 1344, 1344, 512, 512]
    - [0, 6.76]
  - - [1472, 192, 1, 512, 1472, 1472, 512, 512]
    - [0, 7.373]
  - - [1600, 192, 1, 512, 1600, 1600, 512, 512]
    - [0, 6.992]
  - - [1728, 192, 1, 512, 1728, 1728, 512, 512]
    - [0, 7.557]
  - - [1856, 192, 1, 512, 1856, 1856, 512, 512]
    - [0, 7.21]
  - - [1984, 192, 1, 512, 1984, 1984, 512, 512]
    - [0, 7.673]
  - - [2112, 192, 1, 512, 2112, 2112, 512, 512]
    - [0, 7.435]
  - - [2240, 192, 1, 512, 2240, 2240, 512, 512]
    - [0, 7.839]
  - - [2368, 192, 1, 512, 2368, 2368, 512, 512]
    - [0, 7.568]
  - - [2496, 192, 1, 512, 2496, 2496, 512, 512]
    - [0, 7.954]
  - - [2624, 192, 1, 512, 2624, 2624, 512, 512]
    - [0, 7.728]
  - - [2752, 192, 1, 512, 2752, 2752, 512, 512]
    - [0, 8.024]
  - - [2880, 192, 1, 512, 2880, 2880, 512, 512]
    - [0, 7.944]
  - - [3008, 192, 1, 512, 3008, 3008, 512, 512]
    - [0, 8.156]
  - - [3136, 192, 1, 512, 3136, 3136, 512, 512]
    - [0, 7.972]
  - - [3264, 192, 1, 512, 3264, 3264, 512, 512]
    - [0, 8.308]
  - - [3392, 192, 1, 512, 3392, 3392, 512, 512]
    - [0, 8.087]
  - - [3520, 192, 1, 512, 3520, 3520, 512, 512]
    - [0, 8.426]
  - - [3648, 192, 1, 512, 3648, 3648, 512, 512]
    - [0, 8.279]
  - - [3776, 192, 1, 512, 3776, 3776, 512, 512]
    - [0, 8.44]
  - - [3904, 192, 1, 512, 3904, 3904, 512, 512]
    - [0, 8.251]
  - - [4032, 192, 1, 512, 4032, 4032, 512, 512]
    - [0, 8.34]
  - - [64, 320, 1, 512, 64, 64, 512, 512]
    - [1, 1.327]
  - - [192, 320, 1, 512, 192, 192, 512, 512]
    - [0, 3.688]
  - - [320, 320, 1, 512, 320, 320, 512, 512]
    - [0, 4.595]
  - - [448, 320, 1, 512, 448, 448, 512, 512]
    - [0, 6.418]
  - - [576, 320, 1, 512, 576, 576, 512, 512]
    - [0, 6.584]
  - - [704, 320, 1, 512, 704, 704, 512, 512]
    - [0, 6.842]
  - - [832, 320, 1, 512, 832, 832, 512, 512]
    - [0, 6.954]
  - - [960, 320, 1, 512, 960, 960, 512, 512]
    - [0, 6.999]
  - - [1088, 320, 1, 512, 1088, 1088, 512, 512]
    - [0, 7.052]
  - - [1216, 320, 1, 512, 1216, 1216, 512, 512]
    - [0, 7.843]
  - - [1344, 320, 1, 512, 1344, 1344, 512, 512]
    - [0, 7.877]
  - - [1472, 320, 1, 512, 1472, 1472, 512, 512]
    - [0, 7.944]
  - - [1600, 320, 1, 512, 1600, 1600, 512, 512]
    - [0, 7.978]
  - - [1728, 320, 1, 512, 1728, 1728, 512, 512]
    - [0, 7.947]
  - - [1856, 320, 1, 512, 1856, 1856, 512, 512]
    - [0, 8.236]
  - - [1984, 320, 1, 512, 1984, 1984, 512, 512]
    - [0, 8.289]
  - - [2112, 320, 1, 512, 2112, 2112, 512, 512]
    - [0, 8.32]
  - - [2240, 320, 1, 512, 2240, 2240, 512, 512]
    - [0, 8.285]
  - - [2368, 320, 1, 512, 2368, 2368, 512, 512]
    - [0, 8.229]
  - - [2496, 320, 1, 512, 2496, 2496, 512, 512]
    - [0, 8.293]
  - - [2624, 320, 1, 512, 2624, 2624, 512, 512]
    - [0, 8.37]
  - - [2752, 320, 1, 512, 2752, 2752, 512, 512]
    - [0, 8.504]
  - - [2880, 320, 1, 512, 2880, 2880, 512, 512]
    - [0, 8.357]
  - - [3008, 320, 1, 512, 3008, 3008, 512, 512]
    - [0, 8.254]
  - - [3136, 320, 1, 512, 3136, 3136, 512, 512]
    - [0, 8.309]
  - - [3264, 320, 1, 512, 3264, 3264, 512, 512]
    - [0, 8.386]
  - - [3392, 320, 1, 512, 3392, 3392, 512, 512]
    - [0, 8.504]
  - - [3520, 320, 1, 512, 3520, 3520, 512, 512]
    - [0, 8.398]
  - - [3648, 320, 1, 512, 3648, 3648, 512, 512]
    - [0, 8.43]
  - - [3776, 320, 1, 512, 3776, 3776, 512, 512]
    - [0, 8.275]
  - - [3904, 320, 1, 512, 3904, 3904, 512, 512]
    - [0, 8.357]
  - - [4032, 320, 1, 512, 4032, 4032, 512, 512]
    - [0, 8.413]
  - - [64, 448, 1, 512, 64, 64, 512, 512]
    - [0, 1.844]
  - - [192, 448, 1, 512, 192, 192, 512, 512]
    - [0, 5.167]
  - - [320, 448, 1, 512, 320, 320, 512, 512]
    - [0, 6.417]
  - - [448, 448, 1, 512, 448, 448, 512, 512]
    - [0, 6.139]
  - - [576, 448, 1, 512, 576, 576, 512, 512]
    - [0, 6.748]
  - - [704, 448, 1, 512, 704, 704, 512, 512]
    - [0, 7.173]
  - - [832, 448, 1, 512, 832, 832, 512, 512]
    - [0, 7.533]
  - - [960, 448, 1, 512, 960, 960, 512, 512]
    - [0, 7.876]
  - - [1088, 448, 1, 512, 1088, 1088, 512, 512]
    - [0, 8.101]
  - - [1216, 448, 1, 512, 1216, 1216, 512, 512]
    - [0, 7.935]
  - - [1344, 448, 1, 512, 1344, 1344, 512, 512]
    - [0, 8.222]
  - - [1472, 448, 1, 512, 1472, 1472, 512, 512]
    - [0, 8.283]
  - - [1600, 448, 1, 512, 1600, 1600, 512, 512]
    - [0, 8.281]
  - - [1728, 448, 1, 512, 1728, 1728, 512, 512]
    - [0, 8.412]
  - - [1856, 448, 1, 512, 1856, 1856, 512, 512]
    - [0, 8.6]
  - - [1984, 448, 1, 512, 1984, 1984, 512, 512]
    - [0, 8.573]
  - - [2112, 448, 1, 512, 2112, 2112, 512, 512]
    - [0, 8.29]
  - - [2240, 448, 1, 512, 2240, 2240, 512, 512]
    - [0, 8.356]
  - - [2368, 448, 1, 512, 2368, 2368, 512, 512]
    - [0, 8.43]
  - - [2496, 448, 1, 512, 2496, 2496, 512, 512]
    - [0, 8.499]
  - - [2624, 448, 1, 512, 2624, 2624, 512, 512]
    - [0, 8.494]
  - - [2752, 448, 1, 512, 2752, 2752, 512, 512]
    - [0, 8.479]
  - - [2880, 448, 1, 512, 2880, 2880, 512, 512]
    - [0, 8.479]
  - - [3008, 448, 1, 512, 3008, 3008, 512, 512]
    - [0, 8.433]
  - - [3136, 448, 1, 512, 3136, 3136, 512, 512]
    - [0, 8.484]
  - - [3264, 448, 1, 512, 3264, 3264, 512, 512]
    - [0, 8.569]
  - - [3392, 448, 1, 512, 3392, 3392, 512, 512]
    - [0, 8.601]
  - - [3520, 448, 1, 512, 3520, 3520, 512, 512]
    - [0, 8.63]
  - - [3648, 448, 1, 512, 3648, 3648, 512, 512]
    - [0, 8.558]
  - - [3776, 448, 1, 512, 3776, 3776, 512, 512]
    - [0, 8.531]
  - - [3904, 448, 1, 512, 3904, 3904, 512, 512]
    - [0, 8.603]
  - - [4032, 448, 1, 512, 4032, 4032, 512, 512]
    - [0, 8.665]
  - - [64, 576, 1, 512, 64, 64, 512, 512]
    - [3, 2.363]
  - - [192, 576, 1, 512, 192, 192, 512, 512]
    - [0, 4.969]
  - - [320, 576, 1, 512, 320, 320, 512, 512]
    - [0, 6.599]
  - - [448, 576, 1, 512, 448, 448, 512, 512]
    - [0, 6.741]
  - - [576, 576, 1, 512, 576, 576, 512, 512]
    - [0, 7.532]
  - - [704, 576, 1, 512, 704, 704, 512, 512]
    - [0, 7.471]
  - - [832, 576, 1, 512, 832, 832, 512, 512]
    - [0, 7.94]
  - - [960, 576, 1, 512, 960, 960, 512, 512]
    - [0, 7.821]
  - - [1088, 576, 1, 512, 1088, 1088, 512, 512]
    - [0, 8.24]
  - - [1216, 576, 1, 512, 1216, 1216, 512, 512]
    - [0, 8.209]
  - - [1344, 576, 1, 512, 1344, 1344, 512, 512]
    - [0, 8.376]
  - - [1472, 576, 1, 512, 1472, 1472, 512, 512]
    - [0, 8.302]
  - - [1600, 576, 1, 512, 1600, 1600, 512, 512]
    - [0, 8.386]
  - - [1728, 576, 1, 512, 1728, 1728, 512, 512]
    - [0, 8.34]
  - - [1856, 576, 1, 512, 1856, 1856, 512, 512]
    - [0, 8.411]
  - - [1984, 576, 1, 512, 1984, 1984, 512, 512]
    - [0, 8.446]
  - - [2112, 576, 1, 512, 2112, 2112, 512, 512]
    - [0, 8.472]
  - - [2240, 576, 1, 512, 2240, 2240, 512, 512]
    - [0, 8.39]
  - - [2368, 576, 1, 512, 2368, 2368, 512, 512]
    - [0, 8.518]
  - - [2496, 576, 1, 512, 2496, 2496, 512, 512]
    - [0, 8.463]
  - - [2624, 576, 1, 512, 2624, 2624, 512, 512]
    - [0, 8.459]
  - - [2752, 576, 1, 512, 2752, 2752, 512, 512]
    - [0, 8.606]
  - - [2880, 576, 1, 512, 2880, 2880, 512, 512]
    - [0, 8.6]
  - - [3008, 576, 1, 512, 3008, 3008, 512, 512]
    - [0, 8.611]
  - - [3136, 576, 1, 512, 3136, 3136, 512, 512]
    - [0, 8.63]
  - - [3264, 576, 1, 512, 3264, 3264, 512, 512]
    - [0, 8.707]
  - - [3392, 576, 1, 512, 3392, 3392, 512, 512]
    - [0, 8.661]
  - - [3520, 576, 1, 512, 3520, 3520, 512, 512]
    - [0, 8.747]
  - - [3648, 576, 1, 512, 3648, 3648, 512, 512]
    - [0, 8.697]
  - - [3776, 576, 1, 512, 3776, 3776, 512, 512]
    - [0, 8.784]
  - - [3904, 576, 1, 512, 3904, 3904, 512, 512]
    - [0, 8.723]
  - - [4032, 576, 1, 512, 4032, 4032, 512, 512]
    - [0, 8.762]
  - - [64, 704, 1, 512, 64, 64, 512, 512]
    - [0, 4.038]
  - - [192, 704, 1, 512, 192, 192, 512, 512]
    - [0, 6.058]
  - - [320, 704, 1, 512, 320, 320, 512, 512]
    - [0, 6.852]
  - - [448, 704, 1, 512, 448, 448, 512, 512]
    - [0, 7.17]
  - - [576, 704, 1, 512, 576, 576, 512, 512]
    - [0, 7.467]
  - - [704, 704, 1, 512, 704, 704, 512, 512]
    - [0, 7.776]
  - - [832, 704, 1, 512, 832, 832, 512, 512]
    - [0, 8.45]
  - - [960, 704, 1, 512, 960, 960, 512, 512]
    - [0, 8.293]
  - - [1088, 704, 1, 512, 1088, 1088, 512, 512]
    - [0, 8.328]
  - - [1216, 704, 1, 512, 1216, 1216, 512, 512]
    - [0, 8.397]
  - - [1344, 704, 1, 512, 1344, 1344, 512, 512]
    - [0, 8.324]
  - - [1472, 704, 1, 512, 1472, 1472, 512, 512]
    - [0, 8.578]
  - - [1600, 704, 1, 512, 1600, 1600, 512, 512]
    - [0, 8.476]
  - - [1728, 704, 1, 512, 1728, 1728, 512, 512]
    - [0, 8.435]
  - - [1856, 704, 1, 512, 1856, 1856, 512, 512]
    - [0, 8.449]
  - - [1984, 704, 1, 512, 1984, 1984, 512, 512]
    - [0, 8.398]
  - - [2112, 704, 1, 512, 2112, 2112, 512, 512]
    - [0, 8.6]
  - - [2240, 704, 1, 512, 2240, 2240, 512, 512]
    - [0, 8.59]
  - - [2368, 704, 1, 512, 2368, 2368, 512, 512]
    - [0, 8.585]
  - - [2496, 704, 1, 512, 2496, 2496, 512, 512]
    - [0, 8.604]
  - - [2624, 704, 1, 512, 2624, 2624, 512, 512]
    - [0, 8.595]
  - - [2752, 704, 1, 512, 2752, 2752, 512, 512]
    - [0, 8.617]
  - - [2880, 704, 1, 512, 2880, 2880, 512, 512]
    - [0, 8.834]
  - - [3008, 704, 1, 512, 3008, 3008, 512, 512]
    - [0, 8.722]
  - - [3136, 704, 1, 512, 3136, 3136, 512, 512]
    - [0, 8.857]
  - - [3264, 704, 1, 512, 3264, 3264, 512, 512]
    - [0, 8.75]
  - - [3392, 704, 1, 512, 3392, 3392, 512, 512]
    - [0, 8.739]
  - - [3520, 704, 1, 512, 3520, 3520, 512, 512]
    - [0, 8.783]
  - - [3648, 704, 1, 512, 3648, 3648, 512, 512]
    - [0, 8.795]
  - - [3776, 704, 1, 512, 3776, 3776, 512, 512]
    - [0, 8.846]
  - - [3904, 704, 1, 512, 3904, 3904, 512, 512]
    - [0, 8.774]
  - - [4032, 704, 1, 512, 4032, 4032, 512, 512]
    - [0, 8.803]
  - - [64, 832, 1, 512, 64, 64, 512, 512]
    - [0, 3.216]
  - - [192, 832, 1, 512, 192, 192, 512, 512]
    - [0, 5.728]
  - - [320, 832, 1, 512, 320, 320, 512, 512]
    - [0, 6.95]
  - - [448, 832, 1, 512, 448, 448, 512, 512]
    - [0, 7.51]
  - - [576, 832, 1, 512, 576, 576, 512, 512]
    - [0, 7.967]
  - - [704, 832, 1, 512, 704, 704, 512, 512]
    - [0, 8.202]
  - - [832, 832, 1, 512, 832, 832, 512, 512]
    - [0, 8.271]
  - - [960, 832, 1, 512, 960, 960, 512, 512]
    - [0, 8.318]
  - - [1088, 832, 1, 512, 1088, 1088, 512, 512]
    - [0, 8.426]
  - - [1216, 832, 1, 512, 1216, 1216, 512, 512]
    - [0, 8.422]
  - - [1344, 832, 1, 512, 1344, 1344, 512, 512]
    - [0, 8.492]
  - - [1472, 832, 1, 512, 1472, 1472, 512, 512]
    - [0, 8.555]
  - - [1600, 832, 1, 512, 1600, 1600, 512, 512]
    - [0, 8.414]
  - - [1728, 832, 1, 512, 1728, 1728, 512, 512]
    - [0, 8.444]
  - - [1856, 832, 1, 512, 1856, 1856, 512, 512]
    - [0, 8.502]
  - - [1984, 832, 1, 512, 1984, 1984, 512, 512]
    - [0, 8.556]
  - - [2112, 832, 1, 512, 2112, 2112, 512, 512]
    - [0, 8.569]
  - - [2240, 832, 1, 512, 2240, 2240, 512, 512]
    - [0, 8.654]
  - - [2368, 832, 1, 512, 2368, 2368, 512, 512]
    - [0, 8.7]
  - - [2496, 832, 1, 512, 2496, 2496, 512, 512]
    - [0, 8.644]
  - - [2624, 832, 1, 512, 2624, 2624, 512, 512]
    - [0, 8.681]
  - - [2752, 832, 1, 512, 2752, 2752, 512, 512]
    - [0, 8.695]
  - - [2880, 832, 1, 512, 2880, 2880, 512, 512]
    - [0, 8.766]
  - - [3008, 832, 1, 512, 3008, 3008, 512, 512]
    - [0, 8.764]
  - - [3136, 832, 1, 512, 3136, 3136, 512, 512]
    - [0, 8.759]
  - - [3264, 832, 1, 512, 3264, 3264, 512, 512]
    - [0, 8.727]
  - - [3392, 832, 1, 512, 3392, 3392, 512, 512]
    - [0, 8.758]
  - - [3520, 832, 1, 512, 3520, 3520, 512, 512]
    - [0, 8.736]
  - - [3648, 832, 1, 512, 3648, 3648, 512, 512]
    - [0, 8.777]
  - - [3776, 832, 1, 512, 3776, 3776, 512, 512]
    - [0, 8.88]
  - - [3904, 832, 1, 512, 3904, 3904, 512, 512]
    - [0, 8.867]
  - - [4032, 832, 1, 512, 4032, 4032, 512, 512]
    - [0, 8.847]
  - - [64, 960, 1, 512, 64, 64, 512, 512]
    - [0, 3.694]
  - - [192, 960, 1, 512, 192, 192, 512, 512]
    - [0, 6.586]
  - - [320, 960, 1, 512, 320, 320, 512, 512]
    - [0, 7.01]
  - - [448, 960, 1, 512, 448, 448, 512, 512]
    - [0, 7.86]
  - - [576, 960, 1, 512, 576, 576, 512, 512]
    - [0, 8.088]
  - - [704, 960, 1, 512, 704, 704, 512, 512]
    - [0, 8.415]
  - - [832, 960, 1, 512, 832, 832, 512, 512]
    - [0, 8.497]
  - - [960, 960, 1, 512, 960, 960, 512, 512]
    - [0, 8.393]
  - - [1088, 960, 1, 512, 1088, 1088, 512, 512]
    - [0, 8.497]
  - - [1216, 960, 1, 512, 1216, 1216, 512, 512]
    - [0, 8.439]
  - - [1344, 960, 1, 512, 1344, 1344, 512, 512]
    - [0, 8.579]
  - - [1472, 960, 1, 512, 1472, 1472, 512, 512]
    - [0, 8.498]
  - - [1600, 960, 1, 512, 1600, 1600, 512, 512]
    - [0, 8.674]
  - - [1728, 960, 1, 512, 1728, 1728, 512, 512]
    - [0, 8.585]
  - - [1856, 960, 1, 512, 1856, 1856, 512, 512]
    - [0, 8.697]
  - - [1984, 960, 1, 512, 1984, 1984, 512, 512]
    - [0, 8.716]
  - - [2112, 960, 1, 512, 2112, 2112, 512, 512]
    - [0, 8.758]
  - - [2240, 960, 1, 512, 2240, 2240, 512, 512]
    - [0, 8.721]
  - - [2368, 960, 1, 512, 2368, 2368, 512, 512]
    - [0, 8.796]
  - - [2496, 960, 1, 512, 2496, 2496, 512, 512]
    - [0, 8.759]
  - - [2624, 960, 1, 512, 2624, 2624, 512, 512]
    - [0, 8.819]
  - - [2752, 960, 1, 512, 2752, 2752, 512, 512]
    - [0, 8.78]
  - - [2880, 960, 1, 512, 2880, 2880, 512, 512]
    - [0, 8.822]
  - - [3008, 960, 1, 512, 3008, 3008, 512, 512]
    - [0, 8.776]
  - - [3136, 960, 1, 512, 3136, 3136, 512, 512]
    - [0, 8.826]
  - - [3264, 960, 1, 512, 3264, 3264, 512, 512]
    - [0, 8.763]
  - - [3392, 960, 1, 512, 3392, 3392, 512, 512]
    - [0, 8.867]
  - - [3520, 960, 1, 512, 3520, 3520, 512, 512]
    - [0, 8.835]
  - - [3648, 960, 1, 512, 3648, 3648, 512, 512]
    - [0, 8.867]
  - - [3776, 960, 1, 512, 3776, 3776, 512, 512]
    - [0, 8.822]
  - - [3904, 960, 1, 512, 3904, 3904, 512, 512]
    - [0, 8.815]
  - - [4032, 960, 1, 512, 4032, 4032, 512, 512]
    - [0, 8.933]
  - - [64, 1088, 1, 512, 64, 64, 512, 512]
    - [0, 4.174]
  - - [192, 1088, 1, 512, 192, 192, 512, 512]
    - [0, 6.354]
  - - [320, 1088, 1, 512, 320, 320, 512, 512]
    - [0, 7.046]
  - - [448, 1088, 1, 512, 448, 448, 512, 512]
    - [0, 8.107]
  - - [576, 1088, 1, 512, 576, 576, 512, 512]
    - [0, 8.202]
  - - [704, 1088, 1, 512, 704, 704, 512, 512]
    - [0, 8.348]
  - - [832, 1088, 1, 512, 832, 832, 512, 512]
    - [0, 8.293]
  - - [960, 1088, 1, 512, 960, 960, 512, 512]
    - [0, 8.516]
  - - [1088, 1088, 1, 512, 1088, 1088, 512, 512]
    - [0, 8.522]
  - - [1216, 1088, 1, 512, 1216, 1216, 512, 512]
    - [0, 8.461]
  - - [1344, 1088, 1, 512, 1344, 1344, 512, 512]
    - [0, 8.511]
  - - [1472, 1088, 1, 512, 1472, 1472, 512, 512]
    - [0, 8.552]
  - - [1600, 1088, 1, 512, 1600, 1600, 512, 512]
    - [0, 8.539]
  - - [1728, 1088, 1, 512, 1728, 1728, 512, 512]
    - [0, 8.748]
  - - [1856, 1088, 1, 512, 1856, 1856, 512, 512]
    - [0, 8.716]
  - - [1984, 1088, 1, 512, 1984, 1984, 512, 512]
    - [0, 8.731]
  - - [2112, 1088, 1, 512, 2112, 2112, 512, 512]
    - [0, 8.78]
  - - [2240, 1088, 1, 512, 2240, 2240, 512, 512]
    - [0, 8.821]
  - - [2368, 1088, 1, 512, 2368, 2368, 512, 512]
    - [0, 8.74]
  - - [2496, 1088, 1, 512, 2496, 2496, 512, 512]
    - [0, 8.79]
  - - [2624, 1088, 1, 512, 2624, 2624, 512, 512]
    - [0, 8.781]
  - - [2752, 1088, 1, 512, 2752, 2752, 512, 512]
    - [0, 8.8]
  - - [2880, 1088, 1, 512, 2880, 2880, 512, 512]
    - [0, 8.77]
  - - [3008, 1088, 1, 512, 3008, 3008, 512, 512]
    - [0, 8.781]
  - - [3136, 1088, 1, 512, 3136, 3136, 512, 512]
    - [0, 8.862]
  - - [3264, 1088, 1, 512, 3264, 3264, 512, 512]
    - [0, 8.84]
  - - [3392, 1088, 1, 512, 3392, 3392, 512, 512]
    - [0, 8.888]
  - - [3520, 1088, 1, 512, 3520, 3520, 512, 512]
    - [0, 8.85]
  - - [3648, 1088, 1, 512, 3648, 3648, 512, 512]
    - [0, 8.862]
  - - [3776, 1088, 1, 512, 3776, 3776, 512, 512]
    - [0, 8.945]
  - - [3904, 1088, 1, 512, 3904, 3904, 512, 512]
    - [0, 8.913]
  - - [4032, 1088, 1, 512, 4032, 4032, 512, 512]
    - [0, 8.911]
  - - [64, 1216, 1, 512, 64, 64, 512, 512]
    - [0, 4.673]
  - - [192, 1216, 1, 512, 192, 192, 512, 512]
    - [0, 7.086]
  - - [320, 1216, 1, 512, 320, 320, 512, 512]
    - [0, 7.822]
  - - [448, 1216, 1, 512, 448, 448, 512, 512]
    - [0, 7.811]
  - - [576, 1216, 1, 512, 576, 576, 512, 512]
    - [0, 8.114]
  - - [704, 1216, 1, 512, 704, 704, 512, 512]
    - [0, 8.339]
  - - [832, 1216, 1, 512, 832, 832, 512, 512]
    - [0, 8.347]
  - - [960, 1216, 1, 512, 960, 960, 512, 512]
    - [0, 8.386]
  - - [1088, 1216, 1, 512, 1088, 1088, 512, 512]
    - [0, 8.527]
  - - [1216, 1216, 1, 512, 1216, 1216, 512, 512]
    - [0, 8.488]
  - - [1344, 1216, 1, 512, 1344, 1344, 512, 512]
    - [0, 8.534]
  - - [1472, 1216, 1, 512, 1472, 1472, 512, 512]
    - [0, 8.544]
  - - [1600, 1216, 1, 512, 1600, 1600, 512, 512]
    - [0, 8.608]
  - - [1728, 1216, 1, 512, 1728, 1728, 512, 512]
    - [0, 8.768]
  - - [1856, 1216, 1, 512, 1856, 1856, 512, 512]
    - [0, 8.702]
  - - [1984, 1216, 1, 512, 1984, 1984, 512, 512]
    - [0, 8.751]
  - - [2112, 1216, 1, 512, 2112, 2112, 512, 512]
    - [0, 8.714]
  - - [2240, 1216, 1, 512, 2240, 2240, 512, 512]
    - [0, 8.734]
  - - [2368, 1216, 1, 512, 2368, 2368, 512, 512]
    - [0, 8.673]
  - - [2496, 1216, 1, 512, 2496, 2496, 512, 512]
    - [0, 8.828]
  - - [2624, 1216, 1, 512, 2624, 2624, 512, 512]
    - [0, 8.778]
  - - [2752, 1216, 1, 512, 2752, 2752, 512, 512]
    - [0, 8.824]
  - - [2880, 1216, 1, 512, 2880, 2880, 512, 512]
    - [0, 8.827]
  - - [3008, 1216, 1, 512, 3008, 3008, 512, 512]
    - [0, 8.859]
  - - [3136, 1216, 1, 512, 3136, 3136, 512, 512]
    - [0, 8.831]
  - - [3264, 1216, 1, 512, 3264, 3264, 512, 512]
    - [0, 8.896]
  - - [3392, 1216, 1, 512, 3392, 3392, 512, 512]
    - [0, 8.954]
  - - [3520, 1216, 1, 512, 3520, 3520, 512, 512]
    - [0, 8.888]
  - - [3648, 1216, 1, 512, 3648, 3648, 512, 512]
    - [0, 8.972]
  - - [3776, 1216, 1, 512, 3776, 3776, 512, 512]
    - [0, 8.969]
  - - [3904, 1216, 1, 512, 3904, 3904, 512, 512]
    - [0, 8.934]
  - - [4032, 1216, 1, 512, 4032, 4032, 512, 512]
    - [0, 8.975]
  - - [64, 1344, 1, 512, 64, 64, 512, 512]
    - [0, 5.163]
  - - [192, 1344, 1, 512, 192, 192, 512, 512]
    - [0, 6.728]
  - - [320, 1344, 1, 512, 320, 320, 512, 512]
    - [0, 7.873]
  - - [448, 1344, 1, 512, 448, 448, 512, 512]
    - [0, 8.053]
  - - [576, 1344, 1, 512, 576, 576, 512, 512]
    - [0, 8.3]
  - - [704, 1344, 1, 512, 704, 704, 512, 512]
    - [0, 8.156]
  - - [832, 1344, 1, 512, 832, 832, 512, 512]
    - [0, 8.408]
  - - [960, 1344, 1, 512, 960, 960, 512, 512]
    - [0, 8.397]
  - - [1088, 1344, 1, 512, 1088, 1088, 512, 512]
    - [0, 8.483]
  - - [1216, 1344, 1, 512, 1216, 1216, 512, 512]
    - [0, 8.436]
  - - [1344, 1344, 1, 512, 1344, 1344, 512, 512]
    - [0, 8.628]
  - - [1472, 1344, 1, 512, 1472, 1472, 512, 512]
    - [0, 8.668]
  - - [1600, 1344, 1, 512, 1600, 1600, 512, 512]
    - [0, 8.665]
  - - [1728, 1344, 1, 512, 1728, 1728, 512, 512]
    - [0, 8.765]
  - - [1856, 1344, 1, 512, 1856, 1856, 512, 512]
    - [0, 8.771]
  - - [1984, 1344, 1, 512, 1984, 1984, 512, 512]
    - [0, 8.798]
  - - [2112, 1344, 1, 512, 2112, 2112, 512, 512]
    - [0, 8.76]
  - - [2240, 1344, 1, 512, 2240, 2240, 512, 512]
    - [0, 8.813]
  - - [2368, 1344, 1, 512, 2368, 2368, 512, 512]
    - [0, 8.789]
  - - [2496, 1344, 1, 512, 2496, 2496, 512, 512]
    - [0, 8.843]
  - - [2624, 1344, 1, 512, 2624, 2624, 512, 512]
    - [0, 8.734]
  - - [2752, 1344, 1, 512, 2752, 2752, 512, 512]
    - [0, 8.853]
  - - [2880, 1344, 1, 512, 2880, 2880, 512, 512]
    - [0, 8.849]
  - - [3008, 1344, 1, 512, 3008, 3008, 512, 512]
    - [0, 8.901]
  - - [3136, 1344, 1, 512, 3136, 3136, 512, 512]
    - [0, 8.865]
  - - [3264, 1344, 1, 512, 3264, 3264, 512, 512]
    - [0, 8.895]
  - - [3392, 1344, 1, 512, 3392, 3392, 512, 512]
    - [0, 8.95]
  - - [3520, 1344, 1, 512, 3520, 3520, 512, 512]
    - [0, 8.705]
  - - [3648, 1344, 1, 512, 3648, 3648, 512, 512]
    - [0, 8.903]
  - - [3776, 1344, 1, 512, 3776, 3776, 512, 512]
    - [0, 8.968]
  - - [3904, 1344, 1, 512, 3904, 3904, 512, 512]
    - [0, 8.965]
  - - [4032, 1344, 1, 512, 4032, 4032, 512, 512]
    - [0, 8.995]
  - - [64, 1472, 1, 512, 64, 64, 512, 512]
    - [0, 5.659]
  - - [192, 1472, 1, 512, 192, 192, 512, 512]
    - [0, 7.362]
  - - [320, 1472, 1, 512, 320, 320, 512, 512]
    - [0, 7.857]
  - - [448, 1472, 1, 512, 448, 448, 512, 512]
    - [0, 8.302]
  - - [576, 1472, 1, 512, 576, 576, 512, 512]
    - [0, 8.392]
  - - [704, 1472, 1, 512, 704, 704, 512, 512]
    - [0, 8.594]
  - - [832, 1472, 1, 512, 832, 832, 512, 512]
    - [0, 8.578]
  - - [960, 1472, 1, 512, 960, 960, 512, 512]
    - [0, 8.523]
  - - [1088, 1472, 1, 512, 1088, 1088, 512, 512]
    - [0, 8.588]
  - - [1216, 1472, 1, 512, 1216, 1216, 512, 512]
    - [0, 8.606]
  - - [1344, 1472, 1, 512, 1344, 1344, 512, 512]
    - [0, 8.66]
  - - [1472, 1472, 1, 512, 1472, 1472, 512, 512]
    - [0, 8.769]
  - - [1600, 1472, 1, 512, 1600, 1600, 512, 512]
    - [0, 8.739]
  - - [1728, 1472, 1, 512, 1728, 1728, 512, 512]
    - [0, 8.724]
  - - [1856, 1472, 1, 512, 1856, 1856, 512, 512]
    - [0, 8.747]
  - - [1984, 1472, 1, 512, 1984, 1984, 512, 512]
    - [0, 8.738]
  - - [2112, 1472, 1, 512, 2112, 2112, 512, 512]
    - [0, 8.744]
  - - [2240, 1472, 1, 512, 2240, 2240, 512, 512]
    - [0, 8.836]
  - - [2368, 1472, 1, 512, 2368, 2368, 512, 512]
    - [0, 8.88]
  - - [2496, 1472, 1, 512, 2496, 2496, 512, 512]
    - [0, 8.872]
  - - [2624, 1472, 1, 512, 2624, 2624, 512, 512]
    - [0, 8.846]
  - - [2752, 1472, 1, 512, 2752, 2752, 512, 512]
    - [0, 8.863]
  - - [2880, 1472, 1, 512, 2880, 2880, 512, 512]
    - [0, 8.876]
  - - [3008, 1472, 1, 512, 3008, 3008, 512, 512]
    - [0, 8.941]
  - - [3136, 1472, 1, 512, 3136, 3136, 512, 512]
    - [0, 8.936]
  - - [3264, 1472, 1, 512, 3264, 3264, 512, 512]
    - [0, 9.022]
  - - [3392, 1472, 1, 512, 3392, 3392, 512, 512]
    - [0, 9.011]
  - - [3520, 1472, 1, 512, 3520, 3520, 512, 512]
    - [0, 9.023]
  - - [3648, 1472, 1, 512, 3648, 3648, 512, 512]
    - [0, 8.936]
  - - [3776, 1472, 1, 512, 3776, 3776, 512, 512]
    - [0, 9.031]
  - - [3904, 1472, 1, 512, 3904, 3904, 512, 512]
    - [0, 9.1]
  - - [4032, 1472, 1, 512, 4032, 4032, 512, 512]
    - [0, 8.96]
  - - [64, 1600, 1, 512, 64, 64, 512, 512]
    - [0, 4.601]
  - - [192, 1600, 1, 512, 192, 192, 512, 512]
    - [0, 6.997]
  - - [320, 1600, 1, 512, 320, 320, 512, 512]
    - [0, 7.78]
  - - [448, 1600, 1, 512, 448, 448, 512, 512]
    - [0, 8.266]
  - - [576, 1600, 1, 512, 576, 576, 512, 512]
    - [0, 8.499]
  - - [704, 1600, 1, 512, 704, 704, 512, 512]
    - [0, 8.542]
  - - [832, 1600, 1, 512, 832, 832, 512, 512]
    - [0, 8.337]
  - - [960, 1600, 1, 512, 960, 960, 512, 512]
    - [0, 8.44]
  - - [1088, 1600, 1, 512, 1088, 1088, 512, 512]
    - [0, 8.565]
  - - [1216, 1600, 1, 512, 1216, 1216, 512, 512]
    - [0, 8.654]
  - - [1344, 1600, 1, 512, 1344, 1344, 512, 512]
    - [0, 8.655]
  - - [1472, 1600, 1, 512, 1472, 1472, 512, 512]
    - [0, 8.805]
  - - [1600, 1600, 1, 512, 1600, 1600, 512, 512]
    - [0, 8.765]
  - - [1728, 1600, 1, 512, 1728, 1728, 512, 512]
    - [0, 8.729]
  - - [1856, 1600, 1, 512, 1856, 1856, 512, 512]
    - [0, 8.776]
  - - [1984, 1600, 1, 512, 1984, 1984, 512, 512]
    - [0, 8.813]
  - - [2112, 1600, 1, 512, 2112, 2112, 512, 512]
    - [0, 8.833]
  - - [2240, 1600, 1, 512, 2240, 2240, 512, 512]
    - [0, 8.872]
  - - [2368, 1600, 1, 512, 2368, 2368, 512, 512]
    - [0, 8.962]
  - - [2496, 1600, 1, 512, 2496, 2496, 512, 512]
    - [0, 8.882]
  - - [2624, 1600, 1, 512, 2624, 2624, 512, 512]
    - [0, 8.86]
  - - [2752, 1600, 1, 512, 2752, 2752, 512, 512]
    - [0, 8.864]
  - - [2880, 1600, 1, 512, 2880, 2880, 512, 512]
    - [0, 8.88]
  - - [3008, 1600, 1, 512, 3008, 3008, 512, 512]
    - [0, 8.934]
  - - [3136, 1600, 1, 512, 3136, 3136, 512, 512]
    - [0, 8.927]
  - - [3264, 1600, 1, 512, 3264, 3264, 512, 512]
    - [0, 9.042]
  - - [3392, 1600, 1, 512, 3392, 3392, 512, 512]
    - [0, 9.029]
  - - [3520, 1600, 1, 512, 3520, 3520, 512, 512]
    - [0, 9.017]
  - - [3648, 1600, 1, 512, 3648, 3648, 512, 512]
    - [0, 9.045]
  - - [3776, 1600, 1, 512, 3776, 3776, 512, 512]
    - [0, 9.054]
  - - [3904, 1600, 1, 512, 3904, 3904, 512, 512]
    - [0, 9.024]
  - - [4032, 1600, 1, 512, 4032, 4032, 512, 512]
    - [0, 9.062]
  - - [64, 1728, 1, 512, 64, 64, 512, 512]
    - [0, 5.001]
  - - [192, 1728, 1, 512, 192, 192, 512, 512]
    - [0, 7.578]
  - - [320, 1728, 1, 512, 320, 320, 512, 512]
    - [0, 7.963]
  - - [448, 1728, 1, 512, 448, 448, 512, 512]
    - [0, 8.443]
  - - [576, 1728, 1, 512, 576, 576, 512, 512]
    - [0, 8.242]
  - - [704, 1728, 1, 512, 704, 704, 512, 512]
    - [0, 8.375]
  - - [832, 1728, 1, 512, 832, 832, 512, 512]
    - [0, 8.514]
  - - [960, 1728, 1, 512, 960, 960, 512, 512]
    - [0, 8.477]
  - - [1088, 1728, 1, 512, 1088, 1088, 512, 512]
    - [0, 8.706]
  - - [1216, 1728, 1, 512, 1216, 1216, 512, 512]
    - [0, 8.664]
  - - [1344, 1728, 1, 512, 1344, 1344, 512, 512]
    - [0, 8.764]
  - - [1472, 1728, 1, 512, 1472, 1472, 512, 512]
    - [0, 8.722]
  - - [1600, 1728, 1, 512, 1600, 1600, 512, 512]
    - [0, 8.796]
  - - [1728, 1728, 1, 512, 1728, 1728, 512, 512]
    - [0, 8.83]
  - - [1856, 1728, 1, 512, 1856, 1856, 512, 512]
    - [0, 8.829]
  - - [1984, 1728, 1, 512, 1984, 1984, 512, 512]
    - [0, 8.881]
  - - [2112, 1728, 1, 512, 2112, 2112, 512, 512]
    - [0, 8.882]
  - - [2240, 1728, 1, 512, 2240, 2240, 512, 512]
    - [0, 8.894]
  - - [2368, 1728, 1, 512, 2368, 2368, 512, 512]
    - [0, 8.89]
  - - [2496, 1728, 1, 512, 2496, 2496, 512, 512]
    - [0, 8.921]
  - - [2624, 1728, 1, 512, 2624, 2624, 512, 512]
    - [0, 8.906]
  - - [2752, 1728, 1, 512, 2752, 2752, 512, 512]
    - [0, 8.928]
  - - [2880, 1728, 1, 512, 2880, 2880, 512, 512]
    - [0, 9.0]
  - - [3008, 1728, 1, 512, 3008, 3008, 512, 512]
    - [0, 8.949]
  - - [3136, 1728, 1, 512, 3136, 3136, 512, 512]
    - [0, 8.982]
  - - [3264, 1728, 1, 512, 3264, 3264, 512, 512]
    - [0, 8.98]
  - - [3392, 1728, 1, 512, 3392, 3392, 512, 512]
    - [0, 9.007]
  - - [3520, 1728, 1, 512, 3520, 3520, 512, 512]
    - [0, 9.029]
  - - [3648, 1728, 1, 512, 3648, 3648, 512, 512]
    - [0, 9.058]
  - - [3776, 1728, 1, 512, 3776, 3776, 512, 512]
    - [0, 9.04]
  - - [3904, 1728, 1, 512, 3904, 3904, 512, 512]
    - [0, 9.048]
  - - [4032, 1728, 1, 512, 4032, 4032, 512, 512]
    - [0, 9.054]
  - - [64, 1856, 1, 512, 64, 64, 512, 512]
    - [0, 5.316]
  - - [192, 1856, 1, 512, 192, 192, 512, 512]
    - [0, 7.188]
  - - [320, 1856, 1, 512, 320, 320, 512, 512]
    - [0, 7.82]
  - - [448, 1856, 1, 512, 448, 448, 512, 512]
    - [0, 8.629]
  - - [576, 1856, 1, 512, 576, 576, 512, 512]
    - [0, 8.385]
  - - [704, 1856, 1, 512, 704, 704, 512, 512]
    - [0, 8.467]
  - - [832, 1856, 1, 512, 832, 832, 512, 512]
    - [0, 8.489]
  - - [960, 1856, 1, 512, 960, 960, 512, 512]
    - [0, 8.569]
  - - [1088, 1856, 1, 512, 1088, 1088, 512, 512]
    - [0, 8.587]
  - - [1216, 1856, 1, 512, 1216, 1216, 512, 512]
    - [0, 8.767]
  - - [1344, 1856, 1, 512, 1344, 1344, 512, 512]
    - [0, 8.741]
  - - [1472, 1856, 1, 512, 1472, 1472, 512, 512]
    - [0, 8.793]
  - - [1600, 1856, 1, 512, 1600, 1600, 512, 512]
    - [0, 8.765]
  - - [1728, 1856, 1, 512, 1728, 1728, 512, 512]
    - [0, 8.841]
  - - [1856, 1856, 1, 512, 1856, 1856, 512, 512]
    - [0, 8.833]
  - - [1984, 1856, 1, 512, 1984, 1984, 512, 512]
    - [0, 8.82]
  - - [2112, 1856, 1, 512, 2112, 2112, 512, 512]
    - [0, 8.845]
  - - [2240, 1856, 1, 512, 2240, 2240, 512, 512]
    - [0, 8.908]
  - - [2368, 1856, 1, 512, 2368, 2368, 512, 512]
    - [0, 8.896]
  - - [2496, 1856, 1, 512, 2496, 2496, 512, 512]
    - [0, 8.926]
  - - [2624, 1856, 1, 512, 2624, 2624, 512, 512]
    - [0, 8.966]
  - - [2752, 1856, 1, 512, 2752, 2752, 512, 512]
    - [0, 8.958]
  - - [2880, 1856, 1, 512, 2880, 2880, 512, 512]
    - [0, 8.966]
  - - [3008, 1856, 1, 512, 3008, 3008, 512, 512]
    - [0, 8.98]
  - - [3136, 1856, 1, 512, 3136, 3136, 512, 512]
    - [0, 8.941]
  - - [3264, 1856, 1, 512, 3264, 3264, 512, 512]
    - [0, 8.976]
  - - [3392, 1856, 1, 512, 3392, 3392, 512, 512]
    - [0, 9.02]
  - - [3520, 1856, 1, 512, 3520, 3520, 512, 512]
    - [0, 9.072]
  - - [3648, 1856, 1, 512, 3648, 3648, 512, 512]
    - [0, 9.058]
  - - [3776, 1856, 1, 512, 3776, 3776, 512, 512]
    - [0, 9.003]
  - - [3904, 1856, 1, 512, 3904, 3904, 512, 512]
    - [0, 9.046]
  - - [4032, 1856, 1, 512, 4032, 4032, 512, 512]
    - [0, 9.046]
  - - [64, 1984, 1, 512, 64, 64, 512, 512]
    - [0, 5.685]
  - - [192, 1984, 1, 512, 192, 192, 512, 512]
    - [0, 7.688]
  - - [320, 1984, 1, 512, 320, 320, 512, 512]
    - [0, 8.369]
  - - [448, 1984, 1, 512, 448, 448, 512, 512]
    - [0, 8.325]
  - - [576, 1984, 1, 512, 576, 576, 512, 512]
    - [0, 8.293]
  - - [704, 1984, 1, 512, 704, 704, 512, 512]
    - [0, 8.481]
  - - [832, 1984, 1, 512, 832, 832, 512, 512]
    - [0, 8.565]
  - - [960, 1984, 1, 512, 960, 960, 512, 512]
    - [0, 8.667]
  - - [1088, 1984, 1, 512, 1088, 1088, 512, 512]
    - [0, 8.685]
  - - [1216, 1984, 1, 512, 1216, 1216, 512, 512]
    - [0, 8.737]
  - - [1344, 1984, 1, 512, 1344, 1344, 512, 512]
    - [0, 8.683]
  - - [1472, 1984, 1, 512, 1472, 1472, 512, 512]
    - [0, 8.772]
  - - [1600, 1984, 1, 512, 1600, 1600, 512, 512]
    - [0, 8.82]
  - - [1728, 1984, 1, 512, 1728, 1728, 512, 512]
    - [0, 8.807]
  - - [1856, 1984, 1, 512, 1856, 1856, 512, 512]
    - [0, 8.831]
  - - [1984, 1984, 1, 512, 1984, 1984, 512, 512]
    - [0, 8.859]
  - - [2112, 1984, 1, 512, 2112, 2112, 512, 512]
    - [0, 8.854]
  - - [2240, 1984, 1, 512, 2240, 2240, 512, 512]
    - [0, 8.911]
  - - [2368, 1984, 1, 512, 2368, 2368, 512, 512]
    - [0, 8.89]
  - - [2496, 1984, 1, 512, 2496, 2496, 512, 512]
    - [0, 8.971]
  - - [2624, 1984, 1, 512, 2624, 2624, 512, 512]
    - [0, 8.95]
  - - [2752, 1984, 1, 512, 2752, 2752, 512, 512]
    - [0, 9.005]
  - - [2880, 1984, 1, 512, 2880, 2880, 512, 512]
    - [0, 9.025]
  - - [3008, 1984, 1, 512, 3008, 3008, 512, 512]
    - [0, 8.988]
  - - [3136, 1984, 1, 512, 3136, 3136, 512, 512]
    - [0, 8.96]
  - - [3264, 1984, 1, 512, 3264, 3264, 512, 512]
    - [0, 9.024]
  - - [3392, 1984, 1, 512, 3392, 3392, 512, 512]
    - [0, 9.044]
  - - [3520, 1984, 1, 512, 3520, 3520, 512, 512]
    - [0, 9.046]
  - - [3648, 1984, 1, 512, 3648, 3648, 512, 512]
    - [0, 9.06]
  - - [3776, 1984, 1, 512, 3776, 3776, 512, 512]
    - [0, 9.017]
  - - [3904, 1984, 1, 512, 3904, 3904, 512, 512]
    - [0, 9.071]
  - - [4032, 1984, 1, 512, 4032, 4032, 512, 512]
    - [0, 9.107]
  - - [64, 2112, 1, 512, 64, 64, 512, 512]
    - [0, 5.98]
  - - [192, 2112, 1, 512, 192, 192, 512, 512]
    - [0, 7.391]
  - - [320, 2112, 1, 512, 320, 320, 512, 512]
    - [0, 8.217]
  - - [448, 2112, 1, 512, 448, 448, 512, 512]
    - [0, 8.189]
  - - [576, 2112, 1, 512, 576, 576, 512, 512]
    - [0, 8.423]
  - - [704, 2112, 1, 512, 704, 704, 512, 512]
    - [0, 8.289]
  - - [832, 2112, 1, 512, 832, 832, 512, 512]
    - [0, 8.569]
  - - [960, 2112, 1, 512, 960, 960, 512, 512]
    - [0, 8.592]
  - - [1088, 2112, 1, 512, 1088, 1088, 512, 512]
    - [0, 8.713]
  - - [1216, 2112, 1, 512, 1216, 1216, 512, 512]
    - [0, 8.742]
  - - [1344, 2112, 1, 512, 1344, 1344, 512, 512]
    - [0, 8.754]
  - - [1472, 2112, 1, 512, 1472, 1472, 512, 512]
    - [0, 8.774]
  - - [1600, 2112, 1, 512, 1600, 1600, 512, 512]
    - [0, 8.812]
  - - [1728, 2112, 1, 512, 1728, 1728, 512, 512]
    - [0, 8.748]
  - - [1856, 2112, 1, 512, 1856, 1856, 512, 512]
    - [0, 8.825]
  - - [1984, 2112, 1, 512, 1984, 1984, 512, 512]
    - [0, 8.822]
  - - [2112, 2112, 1, 512, 2112, 2112, 512, 512]
    - [0, 8.859]
  - - [2240, 2112, 1, 512, 2240, 2240, 512, 512]
    - [0, 8.905]
  - - [2368, 2112, 1, 512, 2368, 2368, 512, 512]
    - [0, 8.945]
  - - [2496, 2112, 1, 512, 2496, 2496, 512, 512]
    - [0, 8.909]
  - - [2624, 2112, 1, 512, 2624, 2624, 512, 512]
    - [0, 8.902]
  - - [2752, 2112, 1, 512, 2752, 2752, 512, 512]
    - [0, 8.981]
  - - [2880, 2112, 1, 512, 2880, 2880, 512, 512]
    - [0, 9.014]
  - - [3008, 2112, 1, 512, 3008, 3008, 512, 512]
    - [0, 8.959]
  - - [3136, 2112, 1, 512, 3136, 3136, 512, 512]
    - [0, 8.841]
  - - [3264, 2112, 1, 512, 3264, 3264, 512, 512]
    - [0, 8.912]
  - - [3392, 2112, 1, 512, 3392, 3392, 512, 512]
    - [0, 8.994]
  - - [3520, 2112, 1, 512, 3520, 3520, 512, 512]
    - [0, 9.019]
  - - [3648, 2112, 1, 512, 3648, 3648, 512, 512]
    - [0, 9.097]
  - - [3776, 2112, 1, 512, 3776, 3776, 512, 512]
    - [0, 9.06]
  - - [3904, 2112, 1, 512, 3904, 3904, 512, 512]
    - [0, 9.074]
  - - [4032, 2112, 1, 512, 4032, 4032, 512, 512]
    - [0, 9.079]
  - - [64, 2240, 1, 512, 64, 64, 512, 512]
    - [0, 6.478]
  - - [192, 2240, 1, 512, 192, 192, 512, 512]
    - [0, 7.891]
  - - [320, 2240, 1, 512, 320, 320, 512, 512]
    - [0, 8.383]
  - - [448, 2240, 1, 512, 448, 448, 512, 512]
    - [0, 8.322]
  - - [576, 2240, 1, 512, 576, 576, 512, 512]
    - [0, 8.333]
  - - [704, 2240, 1, 512, 704, 704, 512, 512]
    - [0, 8.608]
  - - [832, 2240, 1, 512, 832, 832, 512, 512]
    - [0, 8.663]
  - - [960, 2240, 1, 512, 960, 960, 512, 512]
    - [0, 8.69]
  - - [1088, 2240, 1, 512, 1088, 1088, 512, 512]
    - [0, 8.742]
  - - [1216, 2240, 1, 512, 1216, 1216, 512, 512]
    - [0, 8.737]
  - - [1344, 2240, 1, 512, 1344, 1344, 512, 512]
    - [0, 8.785]
  - - [1472, 2240, 1, 512, 1472, 1472, 512, 512]
    - [0, 8.759]
  - - [1600, 2240, 1, 512, 1600, 1600, 512, 512]
    - [0, 8.83]
  - - [1728, 2240, 1, 512, 1728, 1728, 512, 512]
    - [0, 8.815]
  - - [1856, 2240, 1, 512, 1856, 1856, 512, 512]
    - [0, 8.843]
  - - [1984, 2240, 1, 512, 1984, 1984, 512, 512]
    - [0, 8.855]
  - - [2112, 2240, 1, 512, 2112, 2112, 512, 512]
    - [0, 8.907]
  - - [2240, 2240, 1, 512, 2240, 2240, 512, 512]
    - [0, 8.898]
  - - [2368, 2240, 1, 512, 2368, 2368, 512, 512]
    - [0, 8.899]
  - - [2496, 2240, 1, 512, 2496, 2496, 512, 512]
    - [0, 8.956]
  - - [2624, 2240, 1, 512, 2624, 2624, 512, 512]
    - [0, 8.956]
  - - [2752, 2240, 1, 512, 2752, 2752, 512, 512]
    - [0, 8.997]
  - - [2880, 2240, 1, 512, 2880, 2880, 512, 512]
    - [0, 9.024]
  - - [3008, 2240, 1, 512, 3008, 3008, 512, 512]
    - [0, 8.988]
  - - [3136, 2240, 1, 512, 3136, 3136, 512, 512]
    - [0, 8.991]
  - - [3264, 2240, 1, 512, 3264, 3264, 512, 512]
    - [0, 9.034]
  - - [3392, 2240, 1, 512, 3392, 3392, 512, 512]
    - [0, 9.078]
  - - [3520, 2240, 1, 512, 3520, 3520, 512, 512]
    - [0, 9.125]
  - - [3648, 2240, 1, 512, 3648, 3648, 512, 512]
    - [0, 9.187]
  - - [3776, 2240, 1, 512, 3776, 3776, 512, 512]
    - [0, 9.155]
  - - [3904, 2240, 1, 512, 3904, 3904, 512, 512]
    - [0, 9.159]
  - - [4032, 2240, 1, 512, 4032, 4032, 512, 512]
    - [0, 9.179]
  - - [64, 2368, 1, 512, 64, 64, 512, 512]
    - [0, 5.488]
  - - [192, 2368, 1, 512, 192, 192, 512, 512]
    - [0, 7.627]
  - - [320, 2368, 1, 512, 320, 320, 512, 512]
    - [0, 8.341]
  - - [448, 2368, 1, 512, 448, 448, 512, 512]
    - [0, 8.393]
  - - [576, 2368, 1, 512, 576, 576, 512, 512]
    - [0, 8.507]
  - - [704, 2368, 1, 512, 704, 704, 512, 512]
    - [0, 8.536]
  - - [832, 2368, 1, 512, 832, 832, 512, 512]
    - [0, 8.701]
  - - [960, 2368, 1, 512, 960, 960, 512, 512]
    - [0, 8.754]
  - - [1088, 2368, 1, 512, 1088, 1088, 512, 512]
    - [0, 8.787]
  - - [1216, 2368, 1, 512, 1216, 1216, 512, 512]
    - [0, 8.774]
  - - [1344, 2368, 1, 512, 1344, 1344, 512, 512]
    - [0, 8.752]
  - - [1472, 2368, 1, 512, 1472, 1472, 512, 512]
    - [0, 8.809]
  - - [1600, 2368, 1, 512, 1600, 1600, 512, 512]
    - [0, 8.83]
  - - [1728, 2368, 1, 512, 1728, 1728, 512, 512]
    - [0, 8.9]
  - - [1856, 2368, 1, 512, 1856, 1856, 512, 512]
    - [0, 8.892]
  - - [1984, 2368, 1, 512, 1984, 1984, 512, 512]
    - [0, 8.883]
  - - [2112, 2368, 1, 512, 2112, 2112, 512, 512]
    - [0, 8.921]
  - - [2240, 2368, 1, 512, 2240, 2240, 512, 512]
    - [0, 8.968]
  - - [2368, 2368, 1, 512, 2368, 2368, 512, 512]
    - [0, 8.981]
  - - [2496, 2368, 1, 512, 2496, 2496, 512, 512]
    - [0, 8.959]
  - - [2624, 2368, 1, 512, 2624, 2624, 512, 512]
    - [0, 9.074]
  - - [2752, 2368, 1, 512, 2752, 2752, 512, 512]
    - [0, 9.041]
  - - [2880, 2368, 1, 512, 2880, 2880, 512, 512]
    - [0, 9.074]
  - - [3008, 2368, 1, 512, 3008, 3008, 512, 512]
    - [0, 9.063]
  - - [3136, 2368, 1, 512, 3136, 3136, 512, 512]
    - [0, 9.013]
  - - [3264, 2368, 1, 512, 3264, 3264, 512, 512]
    - [0, 9.125]
  - - [3392, 2368, 1, 512, 3392, 3392, 512, 512]
    - [0, 9.128]
  - - [3520, 2368, 1, 512, 3520, 3520, 512, 512]
    - [0, 9.116]
  - - [3648, 2368, 1, 512, 3648, 3648, 512, 512]
    - [0, 9.173]
  - - [3776, 2368, 1, 512, 3776, 3776, 512, 512]
    - [0, 9.179]
  - - [3904, 2368, 1, 512, 3904, 3904, 512, 512]
    - [0, 9.204]
  - - [4032, 2368, 1, 512, 4032, 4032, 512, 512]
    - [0, 8.97]
  - - [64, 2496, 1, 512, 64, 64, 512, 512]
    - [0, 5.734]
  - - [192, 2496, 1, 512, 192, 192, 512, 512]
    - [0, 7.93]
  - - [320, 2496, 1, 512, 320, 320, 512, 512]
    - [0, 8.197]
  - - [448, 2496, 1, 512, 448, 448, 512, 512]
    - [0, 8.41]
  - - [576, 2496, 1, 512, 576, 576, 512, 512]
    - [0, 8.417]
  - - [704, 2496, 1, 512, 704, 704, 512, 512]
    - [0, 8.614]
  - - [832, 2496, 1, 512, 832, 832, 512, 512]
    - [0, 8.661]
  - - [960, 2496, 1, 512, 960, 960, 512, 512]
    - [0, 8.764]
  - - [1088, 2496, 1, 512, 1088, 1088, 512, 512]
    - [0, 8.683]
  - - [1216, 2496, 1, 512, 1216, 1216, 512, 512]
    - [0, 8.797]
  - - [1344, 2496, 1, 512, 1344, 1344, 512, 512]
    - [0, 8.845]
  - - [1472, 2496, 1, 512, 1472, 1472, 512, 512]
    - [0, 8.835]
  - - [1600, 2496, 1, 512, 1600, 1600, 512, 512]
    - [0, 8.828]
  - - [1728, 2496, 1, 512, 1728, 1728, 512, 512]
    - [0, 8.86]
  - - [1856, 2496, 1, 512, 1856, 1856, 512, 512]
    - [0, 8.886]
  - - [1984, 2496, 1, 512, 1984, 1984, 512, 512]
    - [0, 8.937]
  - - [2112, 2496, 1, 512, 2112, 2112, 512, 512]
    - [0, 8.93]
  - - [2240, 2496, 1, 512, 2240, 2240, 512, 512]
    - [0, 8.87]
  - - [2368, 2496, 1, 512, 2368, 2368, 512, 512]
    - [0, 8.97]
  - - [2496, 2496, 1, 512, 2496, 2496, 512, 512]
    - [0, 9.048]
  - - [2624, 2496, 1, 512, 2624, 2624, 512, 512]
    - [0, 9.068]
  - - [2752, 2496, 1, 512, 2752, 2752, 512, 512]
    - [0, 9.055]
  - - [2880, 2496, 1, 512, 2880, 2880, 512, 512]
    - [0, 9.075]
  - - [3008, 2496, 1, 512, 3008, 3008, 512, 512]
    - [0, 9.096]
  - - [3136, 2496, 1, 512, 3136, 3136, 512, 512]
    - [0, 9.078]
  - - [3264, 2496, 1, 512, 3264, 3264, 512, 512]
    - [0, 9.134]
  - - [3392, 2496, 1, 512, 3392, 3392, 512, 512]
    - [0, 9.128]
  - - [3520, 2496, 1, 512, 3520, 3520, 512, 512]
    - [0, 9.083]
  - - [3648, 2496, 1, 512, 3648, 3648, 512, 512]
    - [0, 9.133]
  - - [3776, 2496, 1, 512, 3776, 3776, 512, 512]
    - [0, 9.089]
  - - [3904, 2496, 1, 512, 3904, 3904, 512, 512]
    - [0, 9.181]
  - - [4032, 2496, 1, 512, 4032, 4032, 512, 512]
    - [0, 9.158]
  - - [64, 2624, 1, 512, 64, 64, 512, 512]
    - [0, 6.012]
  - - [192, 2624, 1, 512, 192, 192, 512, 512]
    - [0, 7.707]
  - - [320, 2624, 1, 512, 320, 320, 512, 512]
    - [0, 8.349]
  - - [448, 2624, 1, 512, 448, 448, 512, 512]
    - [0, 8.386]
  - - [576, 2624, 1, 512, 576, 576, 512, 512]
    - [0, 8.556]
  - - [704, 2624, 1, 512, 704, 704, 512, 512]
    - [0, 8.566]
  - - [832, 2624, 1, 512, 832, 832, 512, 512]
    - [0, 8.648]
  - - [960, 2624, 1, 512, 960, 960, 512, 512]
    - [0, 8.765]
  - - [1088, 2624, 1, 512, 1088, 1088, 512, 512]
    - [0, 8.777]
  - - [1216, 2624, 1, 512, 1216, 1216, 512, 512]
    - [0, 8.746]
  - - [1344, 2624, 1, 512, 1344, 1344, 512, 512]
    - [0, 8.753]
  - - [1472, 2624, 1, 512, 1472, 1472, 512, 512]
    - [0, 8.801]
  - - [1600, 2624, 1, 512, 1600, 1600, 512, 512]
    - [0, 8.825]
  - - [1728, 2624, 1, 512, 1728, 1728, 512, 512]
    - [0, 8.857]
  - - [1856, 2624, 1, 512, 1856, 1856, 512, 512]
    - [0, 8.895]
  - - [1984, 2624, 1, 512, 1984, 1984, 512, 512]
    - [0, 8.865]
  - - [2112, 2624, 1, 512, 2112, 2112, 512, 512]
    - [0, 8.921]
  - - [2240, 2624, 1, 512, 2240, 2240, 512, 512]
    - [0, 8.925]
  - - [2368, 2624, 1, 512, 2368, 2368, 512, 512]
    - [0, 8.984]
  - - [2496, 2624, 1, 512, 2496, 2496, 512, 512]
    - [0, 8.987]
  - - [2624, 2624, 1, 512, 2624, 2624, 512, 512]
    - [0, 9.045]
  - - [2752, 2624, 1, 512, 2752, 2752, 512, 512]
    - [0, 9.021]
  - - [2880, 2624, 1, 512, 2880, 2880, 512, 512]
    - [0, 9.008]
  - - [3008, 2624, 1, 512, 3008, 3008, 512, 512]
    - [0, 9.052]
  - - [3136, 2624, 1, 512, 3136, 3136, 512, 512]
    - [0, 9.177]
  - - [3264, 2624, 1, 512, 3264, 3264, 512, 512]
    - [0, 9.13]
  - - [3392, 2624, 1, 512, 3392, 3392, 512, 512]
    - [0, 9.119]
  - - [3520, 2624, 1, 512, 3520, 3520, 512, 512]
    - [0, 9.058]
  - - [3648, 2624, 1, 512, 3648, 3648, 512, 512]
    - [0, 9.191]
  - - [3776, 2624, 1, 512, 3776, 3776, 512, 512]
    - [0, 9.127]
  - - [3904, 2624, 1, 512, 3904, 3904, 512, 512]
    - [0, 9.192]
  - - [4032, 2624, 1, 512, 4032, 4032, 512, 512]
    - [0, 9.14]
  - - [64, 2752, 1, 512, 64, 64, 512, 512]
    - [0, 6.243]
  - - [192, 2752, 1, 512, 192, 192, 512, 512]
    - [0, 7.967]
  - - [320, 2752, 1, 512, 320, 320, 512, 512]
    - [0, 8.439]
  - - [448, 2752, 1, 512, 448, 448, 512, 512]
    - [0, 8.393]
  - - [576, 2752, 1, 512, 576, 576, 512, 512]
    - [0, 8.408]
  - - [704, 2752, 1, 512, 704, 704, 512, 512]
    - [0, 8.621]
  - - [832, 2752, 1, 512, 832, 832, 512, 512]
    - [0, 8.725]
  - - [960, 2752, 1, 512, 960, 960, 512, 512]
    - [0, 8.714]
  - - [1088, 2752, 1, 512, 1088, 1088, 512, 512]
    - [0, 8.714]
  - - [1216, 2752, 1, 512, 1216, 1216, 512, 512]
    - [0, 8.826]
  - - [1344, 2752, 1, 512, 1344, 1344, 512, 512]
    - [0, 8.829]
  - - [1472, 2752, 1, 512, 1472, 1472, 512, 512]
    - [0, 8.883]
  - - [1600, 2752, 1, 512, 1600, 1600, 512, 512]
    - [0, 8.936]
  - - [1728, 2752, 1, 512, 1728, 1728, 512, 512]
    - [0, 8.969]
  - - [1856, 2752, 1, 512, 1856, 1856, 512, 512]
    - [0, 8.897]
  - - [1984, 2752, 1, 512, 1984, 1984, 512, 512]
    - [0, 8.942]
  - - [2112, 2752, 1, 512, 2112, 2112, 512, 512]
    - [0, 9.002]
  - - [2240, 2752, 1, 512, 2240, 2240, 512, 512]
    - [0, 8.985]
  - - [2368, 2752, 1, 512, 2368, 2368, 512, 512]
    - [0, 9.049]
  - - [2496, 2752, 1, 512, 2496, 2496, 512, 512]
    - [0, 9.035]
  - - [2624, 2752, 1, 512, 2624, 2624, 512, 512]
    - [0, 8.982]
  - - [2752, 2752, 1, 512, 2752, 2752, 512, 512]
    - [0, 9.001]
  - - [2880, 2752, 1, 512, 2880, 2880, 512, 512]
    - [0, 9.037]
  - - [3008, 2752, 1, 512, 3008, 3008, 512, 512]
    - [0, 8.979]
  - - [3136, 2752, 1, 512, 3136, 3136, 512, 512]
    - [0, 9.146]
  - - [3264, 2752, 1, 512, 3264, 3264, 512, 512]
    - [0, 9.1]
  - - [3392, 2752, 1, 512, 3392, 3392, 512, 512]
    - [0, 9.119]
  - - [3520, 2752, 1, 512, 3520, 3520, 512, 512]
    - [0, 9.142]
  - - [3648, 2752, 1, 512, 3648, 3648, 512, 512]
    - [0, 9.093]
  - - [3776, 2752, 1, 512, 3776, 3776, 512, 512]
    - [0, 9.171]
  - - [3904, 2752, 1, 512, 3904, 3904, 512, 512]
    - [0, 9.229]
  - - [4032, 2752, 1, 512, 4032, 4032, 512, 512]
    - [0, 9.202]
  - - [64, 2880, 1, 512, 64, 64, 512, 512]
    - [0, 6.592]
  - - [192, 2880, 1, 512, 192, 192, 512, 512]
    - [0, 7.93]
  - - [320, 2880, 1, 512, 320, 320, 512, 512]
    - [0, 8.338]
  - - [448, 2880, 1, 512, 448, 448, 512, 512]
    - [0, 8.347]
  - - [576, 2880, 1, 512, 576, 576, 512, 512]
    - [0, 8.462]
  - - [704, 2880, 1, 512, 704, 704, 512, 512]
    - [0, 8.645]
  - - [832, 2880, 1, 512, 832, 832, 512, 512]
    - [0, 8.69]
  - - [960, 2880, 1, 512, 960, 960, 512, 512]
    - [0, 8.773]
  - - [1088, 2880, 1, 512, 1088, 1088, 512, 512]
    - [0, 8.753]
  - - [1216, 2880, 1, 512, 1216, 1216, 512, 512]
    - [0, 8.822]
  - - [1344, 2880, 1, 512, 1344, 1344, 512, 512]
    - [0, 8.868]
  - - [1472, 2880, 1, 512, 1472, 1472, 512, 512]
    - [0, 8.782]
  - - [1600, 2880, 1, 512, 1600, 1600, 512, 512]
    - [0, 8.851]
  - - [1728, 2880, 1, 512, 1728, 1728, 512, 512]
    - [0, 8.877]
  - - [1856, 2880, 1, 512, 1856, 1856, 512, 512]
    - [0, 8.935]
  - - [1984, 2880, 1, 512, 1984, 1984, 512, 512]
    - [0, 8.953]
  - - [2112, 2880, 1, 512, 2112, 2112, 512, 512]
    - [0, 8.94]
  - - [2240, 2880, 1, 512, 2240, 2240, 512, 512]
    - [0, 8.965]
  - - [2368, 2880, 1, 512, 2368, 2368, 512, 512]
    - [0, 8.973]
  - - [2496, 2880, 1, 512, 2496, 2496, 512, 512]
    - [0, 9.016]
  - - [2624, 2880, 1, 512, 2624, 2624, 512, 512]
    - [0, 9.036]
  - - [2752, 2880, 1, 512, 2752, 2752, 512, 512]
    - [0, 9.072]
  - - [2880, 2880, 1, 512, 2880, 2880, 512, 512]
    - [0, 9.079]
  - - [3008, 2880, 1, 512, 3008, 3008, 512, 512]
    - [0, 9.175]
  - - [3136, 2880, 1, 512, 3136, 3136, 512, 512]
    - [0, 9.088]
  - - [3264, 2880, 1, 512, 3264, 3264, 512, 512]
    - [0, 9.148]
  - - [3392, 2880, 1, 512, 3392, 3392, 512, 512]
    - [0, 9.173]
  - - [3520, 2880, 1, 512, 3520, 3520, 512, 512]
    - [0, 9.17]
  - - [3648, 2880, 1, 512, 3648, 3648, 512, 512]
    - [0, 9.184]
  - - [3776, 2880, 1, 512, 3776, 3776, 512, 512]
    - [0, 9.224]
  - - [3904, 2880, 1, 512, 3904, 3904, 512, 512]
    - [0, 9.246]
  - - [4032, 2880, 1, 512, 4032, 4032, 512, 512]
    - [0, 9.146]
  - - [64, 3008, 1, 512, 64, 64, 512, 512]
    - [0, 6.825]
  - - [192, 3008, 1, 512, 192, 192, 512, 512]
    - [0, 8.152]
  - - [320, 3008, 1, 512, 320, 320, 512, 512]
    - [0, 8.289]
  - - [448, 3008, 1, 512, 448, 448, 512, 512]
    - [0, 8.309]
  - - [576, 3008, 1, 512, 576, 576, 512, 512]
    - [0, 8.494]
  - - [704, 3008, 1, 512, 704, 704, 512, 512]
    - [0, 8.743]
  - - [832, 3008, 1, 512, 832, 832, 512, 512]
    - [0, 8.684]
  - - [960, 3008, 1, 512, 960, 960, 512, 512]
    - [0, 8.728]
  - - [1088, 3008, 1, 512, 1088, 1088, 512, 512]
    - [0, 8.833]
  - - [1216, 3008, 1, 512, 1216, 1216, 512, 512]
    - [0, 8.883]
  - - [1344, 3008, 1, 512, 1344, 1344, 512, 512]
    - [0, 8.946]
  - - [1472, 3008, 1, 512, 1472, 1472, 512, 512]
    - [0, 8.828]
  - - [1600, 3008, 1, 512, 1600, 1600, 512, 512]
    - [0, 8.887]
  - - [1728, 3008, 1, 512, 1728, 1728, 512, 512]
    - [0, 8.921]
  - - [1856, 3008, 1, 512, 1856, 1856, 512, 512]
    - [0, 8.945]
  - - [1984, 3008, 1, 512, 1984, 1984, 512, 512]
    - [0, 8.979]
  - - [2112, 3008, 1, 512, 2112, 2112, 512, 512]
    - [0, 9.02]
  - - [2240, 3008, 1, 512, 2240, 2240, 512, 512]
    - [0, 8.981]
  - - [2368, 3008, 1, 512, 2368, 2368, 512, 512]
    - [0, 9.053]
  - - [2496, 3008, 1, 512, 2496, 2496, 512, 512]
    - [0, 9.024]
  - - [2624, 3008, 1, 512, 2624, 2624, 512, 512]
    - [0, 9.09]
  - - [2752, 3008, 1, 512, 2752, 2752, 512, 512]
    - [0, 9.082]
  - - [2880, 3008, 1, 512, 2880, 2880, 512, 512]
    - [0, 9.097]
  - - [3008, 3008, 1, 512, 3008, 3008, 512, 512]
    - [0, 9.069]
  - - [3136, 3008, 1, 512, 3136, 3136, 512, 512]
    - [0, 9.228]
  - - [3264, 3008, 1, 512, 3264, 3264, 512, 512]
    - [0, 9.089]
  - - [3392, 3008, 1, 512, 3392, 3392, 512, 512]
    - [0, 9.148]
  - - [3520, 3008, 1, 512, 3520, 3520, 512, 512]
    - [0, 9.191]
  - - [3648, 3008, 1, 512, 3648, 3648, 512, 512]
    - [0, 9.175]
  - - [3776, 3008, 1, 512, 3776, 3776, 512, 512]
    - [0, 9.209]
  - - [3904, 3008, 1, 512, 3904, 3904, 512, 512]
    - [0, 9.145]
  - - [4032, 3008, 1, 512, 4032, 4032, 512, 512]
    - [0, 9.24]
  - - [64, 3136, 1, 512, 64, 64, 512, 512]
    - [0, 6.123]
  - - [192, 3136, 1, 512, 192, 192, 512, 512]
    - [0, 8.146]
  - - [320, 3136, 1, 512, 320, 320, 512, 512]
    - [0, 8.313]
  - - [448, 3136, 1, 512, 448, 448, 512, 512]
    - [0, 8.511]
  - - [576, 3136, 1, 512, 576, 576, 512, 512]
    - [0, 8.557]
  - - [704, 3136, 1, 512, 704, 704, 512, 512]
    - [0, 8.721]
  - - [832, 3136, 1, 512, 832, 832, 512, 512]
    - [0, 8.764]
  - - [960, 3136, 1, 512, 960, 960, 512, 512]
    - [0, 8.646]
  - - [1088, 3136, 1, 512, 1088, 1088, 512, 512]
    - [0, 8.743]
  - - [1216, 3136, 1, 512, 1216, 1216, 512, 512]
    - [0, 8.76]
  - - [1344, 3136, 1, 512, 1344, 1344, 512, 512]
    - [0, 8.763]
  - - [1472, 3136, 1, 512, 1472, 1472, 512, 512]
    - [0, 8.873]
  - - [1600, 3136, 1, 512, 1600, 1600, 512, 512]
    - [0, 8.883]
  - - [1728, 3136, 1, 512, 1728, 1728, 512, 512]
    - [0, 8.92]
  - - [1856, 3136, 1, 512, 1856, 1856, 512, 512]
    - [0, 8.949]
  - - [1984, 3136, 1, 512, 1984, 1984, 512, 512]
    - [0, 8.88]
  - - [2112, 3136, 1, 512, 2112, 2112, 512, 512]
    - [0, 8.958]
  - - [2240, 3136, 1, 512, 2240, 2240, 512, 512]
    - [0, 8.956]
  - - [2368, 3136, 1, 512, 2368, 2368, 512, 512]
    - [0, 9.005]
  - - [2496, 3136, 1, 512, 2496, 2496, 512, 512]
    - [0, 9.065]
  - - [2624, 3136, 1, 512, 2624, 2624, 512, 512]
    - [0, 9.075]
  - - [2752, 3136, 1, 512, 2752, 2752, 512, 512]
    - [0, 9.052]
  - - [2880, 3136, 1, 512, 2880, 2880, 512, 512]
    - [0, 9.122]
  - - [3008, 3136, 1, 512, 3008, 3008, 512, 512]
    - [0, 9.174]
  - - [3136, 3136, 1, 512, 3136, 3136, 512, 512]
    - [0, 9.123]
  - - [3264, 3136, 1, 512, 3264, 3264, 512, 512]
    - [0, 9.14]
  - - [3392, 3136, 1, 512, 3392, 3392, 512, 512]
    - [0, 9.112]
  - - [3520, 3136, 1, 512, 3520, 3520, 512, 512]
    - [0, 9.189]
  - - [3648, 3136, 1, 512, 3648, 3648, 512, 512]
    - [0, 9.206]
  - - [3776, 3136, 1, 512, 3776, 3776, 512, 512]
    - [0, 9.24]
  - - [3904, 3136, 1, 512, 3904, 3904, 512, 512]
    - [0, 9.211]
  - - [4032, 3136, 1, 512, 4032, 4032, 512, 512]
    - [0, 9.117]
  - - [64, 3264, 1, 512, 64, 64, 512, 512]
    - [0, 6.379]
  - - [192, 3264, 1, 512, 192, 192, 512, 512]
    - [0, 8.186]
  - - [320, 3264, 1, 512, 320, 320, 512, 512]
    - [0, 8.354]
  - - [448, 3264, 1, 512, 448, 448, 512, 512]
    - [0, 8.538]
  - - [576, 3264, 1, 512, 576, 576, 512, 512]
    - [0, 8.578]
  - - [704, 3264, 1, 512, 704, 704, 512, 512]
    - [0, 8.707]
  - - [832, 3264, 1, 512, 832, 832, 512, 512]
    - [0, 8.735]
  - - [960, 3264, 1, 512, 960, 960, 512, 512]
    - [0, 8.689]
  - - [1088, 3264, 1, 512, 1088, 1088, 512, 512]
    - [0, 8.693]
  - - [1216, 3264, 1, 512, 1216, 1216, 512, 512]
    - [0, 8.838]
  - - [1344, 3264, 1, 512, 1344, 1344, 512, 512]
    - [0, 8.848]
  - - [1472, 3264, 1, 512, 1472, 1472, 512, 512]
    - [0, 8.933]
  - - [1600, 3264, 1, 512, 1600, 1600, 512, 512]
    - [0, 8.902]
  - - [1728, 3264, 1, 512, 1728, 1728, 512, 512]
    - [0, 8.932]
  - - [1856, 3264, 1, 512, 1856, 1856, 512, 512]
    - [0, 9.012]
  - - [1984, 3264, 1, 512, 1984, 1984, 512, 512]
    - [0, 8.982]
  - - [2112, 3264, 1, 512, 2112, 2112, 512, 512]
    - [0, 8.976]
  - - [2240, 3264, 1, 512, 2240, 2240, 512, 512]
    - [0, 9.029]
  - - [2368, 3264, 1, 512, 2368, 2368, 512, 512]
    - [0, 9.063]
  - - [2496, 3264, 1, 512, 2496, 2496, 512, 512]
    - [0, 9.021]
  - - [2624, 3264, 1, 512, 2624, 2624, 512, 512]
    - [0, 9.11]
  - - [2752, 3264, 1, 512, 2752, 2752, 512, 512]
    - [0, 9.074]
  - - [2880, 3264, 1, 512, 2880, 2880, 512, 512]
    - [0, 9.107]
  - - [3008, 3264, 1, 512, 3008, 3008, 512, 512]
    - [0, 9.152]
  - - [3136, 3264, 1, 512, 3136, 3136, 512, 512]
    - [0, 9.122]
  - - [3264, 3264, 1, 512, 3264, 3264, 512, 512]
    - [0, 9.188]
  - - [3392, 3264, 1, 512, 3392, 3392, 512, 512]
    - [0, 9.207]
  - - [3520, 3264, 1, 512, 3520, 3520, 512, 512]
    - [0, 9.207]
  - - [3648, 3264, 1, 512, 3648, 3648, 512, 512]
    - [0, 9.235]
  - - [3776, 3264, 1, 512, 3776, 3776, 512, 512]
    - [0, 9.221]
  - - [3904, 3264, 1, 512, 3904, 3904, 512, 512]
    - [0, 9.222]
  - - [4032, 3264, 1, 512, 4032, 4032, 512, 512]
    - [0, 9.321]
  - - [64, 3392, 1, 512, 64, 64, 512, 512]
    - [0, 6.582]
  - - [192, 3392, 1, 512, 192, 192, 512, 512]
    - [0, 8.127]
  - - [320, 3392, 1, 512, 320, 320, 512, 512]
    - [0, 8.269]
  - - [448, 3392, 1, 512, 448, 448, 512, 512]
    - [0, 8.53]
  - - [576, 3392, 1, 512, 576, 576, 512, 512]
    - [0, 8.612]
  - - [704, 3392, 1, 512, 704, 704, 512, 512]
    - [0, 8.764]
  - - [832, 3392, 1, 512, 832, 832, 512, 512]
    - [0, 8.66]
  - - [960, 3392, 1, 512, 960, 960, 512, 512]
    - [0, 8.775]
  - - [1088, 3392, 1, 512, 1088, 1088, 512, 512]
    - [0, 8.806]
  - - [1216, 3392, 1, 512, 1216, 1216, 512, 512]
    - [0, 8.889]
  - - [1344, 3392, 1, 512, 1344, 1344, 512, 512]
    - [0, 8.93]
  - - [1472, 3392, 1, 512, 1472, 1472, 512, 512]
    - [0, 8.914]
  - - [1600, 3392, 1, 512, 1600, 1600, 512, 512]
    - [0, 8.887]
  - - [1728, 3392, 1, 512, 1728, 1728, 512, 512]
    - [0, 8.917]
  - - [1856, 3392, 1, 512, 1856, 1856, 512, 512]
    - [0, 8.968]
  - - [1984, 3392, 1, 512, 1984, 1984, 512, 512]
    - [0, 9.045]
  - - [2112, 3392, 1, 512, 2112, 2112, 512, 512]
    - [0, 8.999]
  - - [2240, 3392, 1, 512, 2240, 2240, 512, 512]
    - [0, 8.989]
  - - [2368, 3392, 1, 512, 2368, 2368, 512, 512]
    - [0, 9.067]
  - - [2496, 3392, 1, 512, 2496, 2496, 512, 512]
    - [0, 9.052]
  - - [2624, 3392, 1, 512, 2624, 2624, 512, 512]
    - [0, 9.07]
  - - [2752, 3392, 1, 512, 2752, 2752, 512, 512]
    - [0, 9.116]
  - - [2880, 3392, 1, 512, 2880, 2880, 512, 512]
    - [0, 9.13]
  - - [3008, 3392, 1, 512, 3008, 3008, 512, 512]
    - [0, 9.121]
  - - [3136, 3392, 1, 512, 3136, 3136, 512, 512]
    - [0, 9.27]
  - - [3264, 3392, 1, 512, 3264, 3264, 512, 512]
    - [0, 9.236]
  - - [3392, 3392, 1, 512, 3392, 3392, 512, 512]
    - [0, 9.229]
  - - [3520, 3392, 1, 512, 3520, 3520, 512, 512]
    - [0, 9.277]
  - - [3648, 3392, 1, 512, 3648, 3648, 512, 512]
    - [0, 9.27]
  - - [3776, 3392, 1, 512, 3776, 3776, 512, 512]
    - [0, 9.251]
  - - [3904, 3392, 1, 512, 3904, 3904, 512, 512]
    - [0, 9.284]
  - - [4032, 3392, 1, 512, 4032, 4032, 512, 512]
    - [0, 9.325]
  - - [64, 3520, 1, 512, 64, 64, 512, 512]
    - [0, 6.803]
  - - [192, 3520, 1, 512, 192, 192, 512, 512]
    - [0, 8.228]
  - - [320, 3520, 1, 512, 320, 320, 512, 512]
    - [0, 8.613]
  - - [448, 3520, 1, 512, 448, 448, 512, 512]
    - [0, 8.486]
  - - [576, 3520, 1, 512, 576, 576, 512, 512]
    - [0, 8.578]
  - - [704, 3520, 1, 512, 704, 704, 512, 512]
    - [0, 8.662]
  - - [832, 3520, 1, 512, 832, 832, 512, 512]
    - [0, 8.721]
  - - [960, 3520, 1, 512, 960, 960, 512, 512]
    - [0, 8.773]
  - - [1088, 3520, 1, 512, 1088, 1088, 512, 512]
    - [0, 8.818]
  - - [1216, 3520, 1, 512, 1216, 1216, 512, 512]
    - [0, 8.803]
  - - [1344, 3520, 1, 512, 1344, 1344, 512, 512]
    - [0, 8.914]
  - - [1472, 3520, 1, 512, 1472, 1472, 512, 512]
    - [0, 8.899]
  - - [1600, 3520, 1, 512, 1600, 1600, 512, 512]
    - [0, 8.927]
  - - [1728, 3520, 1, 512, 1728, 1728, 512, 512]
    - [0, 8.966]
  - - [1856, 3520, 1, 512, 1856, 1856, 512, 512]
    - [0, 9.022]
  - - [1984, 3520, 1, 512, 1984, 1984, 512, 512]
    - [0, 9.105]
  - - [2112, 3520, 1, 512, 2112, 2112, 512, 512]
    - [0, 8.998]
  - - [2240, 3520, 1, 512, 2240, 2240, 512, 512]
    - [0, 9.15]
  - - [2368, 3520, 1, 512, 2368, 2368, 512, 512]
    - [0, 9.098]
  - - [2496, 3520, 1, 512, 2496, 2496, 512, 512]
    - [0, 9.161]
  - - [2624, 3520, 1, 512, 2624, 2624, 512, 512]
    - [0, 9.11]
  - - [2752, 3520, 1, 512, 2752, 2752, 512, 512]
    - [0, 9.146]
  - - [2880, 3520, 1, 512, 2880, 2880, 512, 512]
    - [0, 9.147]
  - - [3008, 3520, 1, 512, 3008, 3008, 512, 512]
    - [0, 9.218]
  - - [3136, 3520, 1, 512, 3136, 3136, 512, 512]
    - [0, 9.194]
  - - [3264, 3520, 1, 512, 3264, 3264, 512, 512]
    - [0, 9.142]
  - - [3392, 3520, 1, 512, 3392, 3392, 512, 512]
    - [0, 9.315]
  - - [3520, 3520, 1, 512, 3520, 3520, 512, 512]
    - [0, 9.271]
  - - [3648, 3520, 1, 512, 3648, 3648, 512, 512]
    - [0, 9.292]
  - - [3776, 3520, 1, 512, 3776, 3776, 512, 512]
    - [0, 9.368]
  - - [3904, 3520, 1, 512, 3904, 3904, 512, 512]
    - [0, 9.293]
  - - [4032, 3520, 1, 512, 4032, 4032, 512, 512]
    - [0, 9.408]
  - - [64, 3648, 1, 512, 64, 64, 512, 512]
    - [0, 7.028]
  - - [192, 3648, 1, 512, 192, 192, 512, 512]
    - [0, 8.166]
  - - [320, 3648, 1, 512, 320, 320, 512, 512]
    - [0, 8.431]
  - - [448, 3648, 1, 512, 448, 448, 512, 512]
    - [0, 8.575]
  - - [576, 3648, 1, 512, 576, 576, 512, 512]
    - [0, 8.68]
  - - [704, 3648, 1, 512, 704, 704, 512, 512]
    - [0, 8.753]
  - - [832, 3648, 1, 512, 832, 832, 512, 512]
    - [0, 8.698]
  - - [960, 3648, 1, 512, 960, 960, 512, 512]
    - [0, 8.77]
  - - [1088, 3648, 1, 512, 1088, 1088, 512, 512]
    - [0, 8.761]
  - - [1216, 3648, 1, 512, 1216, 1216, 512, 512]
    - [0, 8.896]
  - - [1344, 3648, 1, 512, 1344, 1344, 512, 512]
    - [0, 8.91]
  - - [1472, 3648, 1, 512, 1472, 1472, 512, 512]
    - [0, 8.934]
  - - [1600, 3648, 1, 512, 1600, 1600, 512, 512]
    - [0, 8.924]
  - - [1728, 3648, 1, 512, 1728, 1728, 512, 512]
    - [0, 9.029]
  - - [1856, 3648, 1, 512, 1856, 1856, 512, 512]
    - [0, 9.037]
  - - [1984, 3648, 1, 512, 1984, 1984, 512, 512]
    - [0, 9.073]
  - - [2112, 3648, 1, 512, 2112, 2112, 512, 512]
    - [0, 9.146]
  - - [2240, 3648, 1, 512, 2240, 2240, 512, 512]
    - [0, 9.067]
  - - [2368, 3648, 1, 512, 2368, 2368, 512, 512]
    - [0, 9.076]
  - - [2496, 3648, 1, 512, 2496, 2496, 512, 512]
    - [0, 9.133]
  - - [2624, 3648, 1, 512, 2624, 2624, 512, 512]
    - [0, 9.119]
  - - [2752, 3648, 1, 512, 2752, 2752, 512, 512]
    - [0, 9.154]
  - - [2880, 3648, 1, 512, 2880, 2880, 512, 512]
    - [0, 9.193]
  - - [3008, 3648, 1, 512, 3008, 3008, 512, 512]
    - [0, 9.184]
  - - [3136, 3648, 1, 512, 3136, 3136, 512, 512]
    - [0, 9.256]
  - - [3264, 3648, 1, 512, 3264, 3264, 512, 512]
    - [0, 9.233]
  - - [3392, 3648, 1, 512, 3392, 3392, 512, 512]
    - [0, 9.286]
  - - [3520, 3648, 1, 512, 3520, 3520, 512, 512]
    - [0, 9.386]
  - - [3648, 3648, 1, 512, 3648, 3648, 512, 512]
    - [0, 9.297]
  - - [3776, 3648, 1, 512, 3776, 3776, 512, 512]
    - [0, 9.295]
  - - [3904, 3648, 1, 512, 3904, 3904, 512, 512]
    - [0, 9.339]
  - - [4032, 3648, 1, 512, 4032, 4032, 512, 512]
    - [0, 9.429]
  - - [64, 3776, 1, 512, 64, 64, 512, 512]
    - [0, 7.343]
  - - [192, 3776, 1, 512, 192, 192, 512, 512]
    - [0, 8.378]
  - - [320, 3776, 1, 512, 320, 320, 512, 512]
    - [0, 8.432]
  - - [448, 3776, 1, 512, 448, 448, 512, 512]
    - [0, 8.476]
  - - [576, 3776, 1, 512, 576, 576, 512, 512]
    - [0, 8.593]
  - - [704, 3776, 1, 512, 704, 704, 512, 512]
    - [0, 8.675]
  - - [832, 3776, 1, 512, 832, 832, 512, 512]
    - [0, 8.772]
  - - [960, 3776, 1, 512, 960, 960, 512, 512]
    - [0, 8.815]
  - - [1088, 3776, 1, 512, 1088, 1088, 512, 512]
    - [0, 8.842]
  - - [1216, 3776, 1, 512, 1216, 1216, 512, 512]
    - [0, 8.885]
  - - [1344, 3776, 1, 512, 1344, 1344, 512, 512]
    - [0, 8.867]
  - - [1472, 3776, 1, 512, 1472, 1472, 512, 512]
    - [0, 8.917]
  - - [1600, 3776, 1, 512, 1600, 1600, 512, 512]
    - [0, 8.989]
  - - [1728, 3776, 1, 512, 1728, 1728, 512, 512]
    - [0, 8.981]
  - - [1856, 3776, 1, 512, 1856, 1856, 512, 512]
    - [0, 9.054]
  - - [1984, 3776, 1, 512, 1984, 1984, 512, 512]
    - [0, 9.066]
  - - [2112, 3776, 1, 512, 2112, 2112, 512, 512]
    - [0, 9.096]
  - - [2240, 3776, 1, 512, 2240, 2240, 512, 512]
    - [0, 9.087]
  - - [2368, 3776, 1, 512, 2368, 2368, 512, 512]
    - [0, 9.094]
  - - [2496, 3776, 1, 512, 2496, 2496, 512, 512]
    - [0, 9.162]
  - - [2624, 3776, 1, 512, 2624, 2624, 512, 512]
    - [0, 9.166]
  - - [2752, 3776, 1, 512, 2752, 2752, 512, 512]
    - [0, 9.206]
  - - [2880, 3776, 1, 512, 2880, 2880, 512, 512]
    - [0, 9.267]
  - - [3008, 3776, 1, 512, 3008, 3008, 512, 512]
    - [0, 9.26]
  - - [3136, 3776, 1, 512, 3136, 3136, 512, 512]
    - [0, 9.212]
  - - [3264, 3776, 1, 512, 3264, 3264, 512, 512]
    - [0, 9.21]
  - - [3392, 3776, 1, 512, 3392, 3392, 512, 512]
    - [0, 9.232]
  - - [3520, 3776, 1, 512, 3520, 3520, 512, 512]
    - [0, 9.329]
  - - [3648, 3776, 1, 512, 3648, 3648, 512, 512]
    - [0, 9.308]
  - - [3776, 3776, 1, 512, 3776, 3776, 512, 512]
    - [0, 9.369]
  - - [3904, 3776, 1, 512, 3904, 3904, 512, 512]
    - [0, 9.379]
  - - [4032, 3776, 1, 512, 4032, 4032, 512, 512]
    - [0, 9.386]
  - - [64, 3904, 1, 512, 64, 64, 512, 512]
    - [0, 6.548]
  - - [192, 3904, 1, 512, 192, 192, 512, 512]
    - [0, 8.303]
  - - [320, 3904, 1, 512, 320, 320, 512, 512]
    - [0, 8.36]
  - - [448, 3904, 1, 512, 448, 448, 512, 512]
    - [0, 8.569]
  - - [576, 3904, 1, 512, 576, 576, 512, 512]
    - [0, 8.707]
  - - [704, 3904, 1, 512, 704, 704, 512, 512]
    - [0, 8.762]
  - - [832, 3904, 1, 512, 832, 832, 512, 512]
    - [0, 8.819]
  - - [960, 3904, 1, 512, 960, 960, 512, 512]
    - [0, 8.881]
  - - [1088, 3904, 1, 512, 1088, 1088, 512, 512]
    - [0, 8.833]
  - - [1216, 3904, 1, 512, 1216, 1216, 512, 512]
    - [0, 8.876]
  - - [1344, 3904, 1, 512, 1344, 1344, 512, 512]
    - [0, 8.904]
  - - [1472, 3904, 1, 512, 1472, 1472, 512, 512]
    - [0, 8.944]
  - - [1600, 3904, 1, 512, 1600, 1600, 512, 512]
    - [0, 9.007]
  - - [1728, 3904, 1, 512, 1728, 1728, 512, 512]
    - [0, 9.061]
  - - [1856, 3904, 1, 512, 1856, 1856, 512, 512]
    - [0, 9.026]
  - - [1984, 3904, 1, 512, 1984, 1984, 512, 512]
    - [0, 9.052]
  - - [2112, 3904, 1, 512, 2112, 2112, 512, 512]
    - [0, 9.072]
  - - [2240, 3904, 1, 512, 2240, 2240, 512, 512]
    - [0, 9.17]
  - - [2368, 3904, 1, 512, 2368, 2368, 512, 512]
    - [0, 9.121]
  - - [2496, 3904, 1, 512, 2496, 2496, 512, 512]
    - [0, 9.162]
  - - [2624, 3904, 1, 512, 2624, 2624, 512, 512]
    - [0, 9.17]
  - - [2752, 3904, 1, 512, 2752, 2752, 512, 512]
    - [0, 9.154]
  - - [2880, 3904, 1, 512, 2880, 2880, 512, 512]
    - [0, 9.211]
  - - [3008, 3904, 1, 512, 3008, 3008, 512, 512]
    - [0, 9.221]
  - - [3136, 3904, 1, 512, 3136, 3136, 512, 512]
    - [0, 9.28]
  - - [3264, 3904, 1, 512, 3264, 3264, 512, 512]
    - [0, 9.236]
  - - [3392, 3904, 1, 512, 3392, 3392, 512, 512]
    - [0, 9.27]
  - - [3520, 3904, 1, 512, 3520, 3520, 512, 512]
    - [0, 9.264]
  - - [3648, 3904, 1, 512, 3648, 3648, 512, 512]
    - [0, 9.373]
  - - [3776, 3904, 1, 512, 3776, 3776, 512, 512]
    - [0, 9.48]
  - - [3904, 3904, 1, 512, 3904, 3904, 512, 512]
    - [0, 9.386]
  - - [4032, 3904, 1, 512, 4032, 4032, 512, 512]
    - [0, 9.408]
  - - [64, 4032, 1, 512, 64, 64, 512, 512]
    - [0, 6.669]
  - - [192, 4032, 1, 512, 192, 192, 512, 512]
    - [0, 8.425]
  - - [320, 4032, 1, 512, 320, 320, 512, 512]
    - [0, 8.437]
  - - [448, 4032, 1, 512, 448, 448, 512, 512]
    - [0, 8.64]
  - - [576, 4032, 1, 512, 576, 576, 512, 512]
    - [0, 8.756]
  - - [704, 4032, 1, 512, 704, 704, 512, 512]
    - [0, 8.737]
  - - [832, 4032, 1, 512, 832, 832, 512, 512]
    - [0, 8.754]
  - - [960, 4032, 1, 512, 960, 960, 512, 512]
    - [0, 8.823]
  - - [1088, 4032, 1, 512, 1088, 1088, 512, 512]
    - [0, 8.865]
  - - [1216, 4032, 1, 512, 1216, 1216, 512, 512]
    - [0, 8.966]
  - - [1344, 4032, 1, 512, 1344, 1344, 512, 512]
    - [0, 8.715]
  - - [1472, 4032, 1, 512, 1472, 1472, 512, 512]
    - [0, 8.921]
  - - [1600, 4032, 1, 512, 1600, 1600, 512, 512]
    - [0, 9.025]
  - - [1728, 4032, 1, 512, 1728, 1728, 512, 512]
    - [0, 9.003]
  - - [1856, 4032, 1, 512, 1856, 1856, 512, 512]
    - [0, 9.069]
  - - [1984, 4032, 1, 512, 1984, 1984, 512, 512]
    - [0, 9.083]
  - - [2112, 4032, 1, 512, 2112, 2112, 512, 512]
    - [0, 9.05]
  - - [2240, 4032, 1, 512, 2240, 2240, 512, 512]
    - [0, 9.058]
  - - [2368, 4032, 1, 512, 2368, 2368, 512, 512]
    - [0, 9.132]
  - - [2496, 4032, 1, 512, 2496, 2496, 512, 512]
    - [0, 9.165]
  - - [2624, 4032, 1, 512, 2624, 2624, 512, 512]
    - [0, 9.195]
  - - [2752, 4032, 1, 512, 2752, 2752, 512, 512]
    - [0, 9.173]
  - - [2880, 4032, 1, 512, 2880, 2880, 512, 512]
    - [0, 9.264]
  - - [3008, 4032, 1, 512, 3008, 3008, 512, 512]
    - [0, 9.229]
  - - [3136, 4032, 1, 512, 3136, 3136, 512, 512]
    - [0, 9.325]
  - - [3264, 4032, 1, 512, 3264, 3264, 512, 512]
    - [0, 9.352]
  - - [3392, 4032, 1, 512, 3392, 3392, 512, 512]
    - [0, 9.375]
  - - [3520, 4032, 1, 512, 3520, 3520, 512, 512]
    - [0, 9.413]
  - - [3648, 4032, 1, 512, 3648, 3648, 512, 512]
    - [0, 9.432]
  - - [3776, 4032, 1, 512, 3776, 3776, 512, 512]
    - [0, 9.402]
  - - [3904, 4032, 1, 512, 3904, 3904, 512, 512]
    - [0, 9.404]
  - - [4032, 4032, 1, 512, 4032, 4032, 512, 512]
    - [0, 9.39]
  - - [64, 64, 1, 1024, 64, 64, 1024, 1024]
    - [1, 0.694]
  - - [192, 64, 1, 1024, 192, 192, 1024, 1024]
    - [1, 2.074]
  - - [320, 64, 1, 1024, 320, 320, 1024, 1024]
    - [3, 2.94]
  - - [448, 64, 1, 1024, 448, 448, 1024, 1024]
    - [0, 3.396]
  - - [576, 64, 1, 1024, 576, 576, 1024, 1024]
    - [0, 4.349]
  - - [704, 64, 1, 1024, 704, 704, 1024, 1024]
    - [0, 5.299]
  - - [832, 64, 1, 1024, 832, 832, 1024, 1024]
    - [0, 3.824]
  - - [960, 64, 1, 1024, 960, 960, 1024, 1024]
    - [0, 4.517]
  - - [1088, 64, 1, 1024, 1088, 1088, 1024, 1024]
    - [0, 4.982]
  - - [1216, 64, 1, 1024, 1216, 1216, 1024, 1024]
    - [0, 5.548]
  - - [1344, 64, 1, 1024, 1344, 1344, 1024, 1024]
    - [0, 6.127]
  - - [1472, 64, 1, 1024, 1472, 1472, 1024, 1024]
    - [0, 6.713]
  - - [1600, 64, 1, 1024, 1600, 1600, 1024, 1024]
    - [0, 5.241]
  - - [1728, 64, 1, 1024, 1728, 1728, 1024, 1024]
    - [0, 5.649]
  - - [1856, 64, 1, 1024, 1856, 1856, 1024, 1024]
    - [0, 6.037]
  - - [1984, 64, 1, 1024, 1984, 1984, 1024, 1024]
    - [0, 6.447]
  - - [2112, 64, 1, 1024, 2112, 2112, 1024, 1024]
    - [0, 6.85]
  - - [2240, 64, 1, 1024, 2240, 2240, 1024, 1024]
    - [0, 7.228]
  - - [2368, 64, 1, 1024, 2368, 2368, 1024, 1024]
    - [0, 5.993]
  - - [2496, 64, 1, 1024, 2496, 2496, 1024, 1024]
    - [0, 6.29]
  - - [2624, 64, 1, 1024, 2624, 2624, 1024, 1024]
    - [0, 6.61]
  - - [2752, 64, 1, 1024, 2752, 2752, 1024, 1024]
    - [0, 6.91]
  - - [2880, 64, 1, 1024, 2880, 2880, 1024, 1024]
    - [0, 7.221]
  - - [3008, 64, 1, 1024, 3008, 3008, 1024, 1024]
    - [0, 7.539]
  - - [3136, 64, 1, 1024, 3136, 3136, 1024, 1024]
    - [0, 6.614]
  - - [3264, 64, 1, 1024, 3264, 3264, 1024, 1024]
    - [0, 6.862]
  - - [3392, 64, 1, 1024, 3392, 3392, 1024, 1024]
    - [0, 7.125]
  - - [3520, 64, 1, 1024, 3520, 3520, 1024, 1024]
    - [0, 7.386]
  - - [3648, 64, 1, 1024, 3648, 3648, 1024, 1024]
    - [0, 7.643]
  - - [3776, 64, 1, 1024, 3776, 3776, 1024, 1024]
    - [0, 7.917]
  - - [3904, 64, 1, 1024, 3904, 3904, 1024, 1024]
    - [0, 6.985]
  - - [4032, 64, 1, 1024, 4032, 4032, 1024, 1024]
    - [0, 7.192]
  - - [64, 192, 1, 1024, 64, 64, 1024, 1024]
    - [1, 2.082]
  - - [192, 192, 1, 1024, 192, 192, 1024, 1024]
    - [0, 4.353]
  - - [320, 192, 1, 1024, 320, 320, 1024, 1024]
    - [0, 4.394]
  - - [448, 192, 1, 1024, 448, 448, 1024, 1024]
    - [0, 6.137]
  - - [576, 192, 1, 1024, 576, 576, 1024, 1024]
    - [0, 5.645]
  - - [704, 192, 1, 1024, 704, 704, 1024, 1024]
    - [0, 6.879]
  - - [832, 192, 1, 1024, 832, 832, 1024, 1024]
    - [0, 6.33]
  - - [960, 192, 1, 1024, 960, 960, 1024, 1024]
    - [0, 7.289]
  - - [1088, 192, 1, 1024, 1088, 1088, 1024, 1024]
    - [0, 6.926]
  - - [1216, 192, 1, 1024, 1216, 1216, 1024, 1024]
    - [0, 7.708]
  - - [1344, 192, 1, 1024, 1344, 1344, 1024, 1024]
    - [0, 7.236]
  - - [1472, 192, 1, 1024, 1472, 1472, 1024, 1024]
    - [0, 7.897]
  - - [1600, 192, 1, 1024, 1600, 1600, 1024, 1024]
    - [0, 7.529]
  - - [1728, 192, 1, 1024, 1728, 1728, 1024, 1024]
    - [0, 8.243]
  - - [1856, 192, 1, 1024, 1856, 1856, 1024, 1024]
    - [0, 7.737]
  - - [1984, 192, 1, 1024, 1984, 1984, 1024, 1024]
    - [0, 8.261]
  - - [2112, 192, 1, 1024, 2112, 2112, 1024, 1024]
    - [0, 7.945]
  - - [2240, 192, 1, 1024, 2240, 2240, 1024, 1024]
    - [0, 8.396]
  - - [2368, 192, 1, 1024, 2368, 2368, 1024, 1024]
    - [0, 8.054]
  - - [2496, 192, 1, 1024, 2496, 2496, 1024, 1024]
    - [0, 8.274]
  - - [2624, 192, 1, 1024, 2624, 2624, 1024, 1024]
    - [0, 7.979]
  - - [2752, 192, 1, 1024, 2752, 2752, 1024, 1024]
    - [0, 8.277]
  - - [2880, 192, 1, 1024, 2880, 2880, 1024, 1024]
    - [0, 8.11]
  - - [3008, 192, 1, 1024, 3008, 3008, 1024, 1024]
    - [0, 8.305]
  - - [3136, 192, 1, 1024, 3136, 3136, 1024, 1024]
    - [0, 8.178]
  - - [3264, 192, 1, 1024, 3264, 3264, 1024, 1024]
    - [0, 8.407]
  - - [3392, 192, 1, 1024, 3392, 3392, 1024, 1024]
    - [0, 8.17]
  - - [3520, 192, 1, 1024, 3520, 3520, 1024, 1024]
    - [0, 8.474]
  - - [3648, 192, 1, 1024, 3648, 3648, 1024, 1024]
    - [0, 8.192]
  - - [3776, 192, 1, 1024, 3776, 3776, 1024, 1024]
    - [0, 8.406]
  - - [3904, 192, 1, 1024, 3904, 3904, 1024, 1024]
    - [0, 8.238]
  - - [4032, 192, 1, 1024, 4032, 4032, 1024, 1024]
    - [0, 8.445]
  - - [64, 320, 1, 1024, 64, 64, 1024, 1024]
    - [3, 2.626]
  - - [192, 320, 1, 1024, 192, 192, 1024, 1024]
    - [0, 4.38]
  - - [320, 320, 1, 1024, 320, 320, 1024, 1024]
    - [0, 5.222]
  - - [448, 320, 1, 1024, 448, 448, 1024, 1024]
    - [0, 7.262]
  - - [576, 320, 1, 1024, 576, 576, 1024, 1024]
    - [0, 7.28]
  - - [704, 320, 1, 1024, 704, 704, 1024, 1024]
    - [0, 7.437]
  - - [832, 320, 1, 1024, 832, 832, 1024, 1024]
    - [0, 7.439]
  - - [960, 320, 1, 1024, 960, 960, 1024, 1024]
    - [0, 7.438]
  - - [1088, 320, 1, 1024, 1088, 1088, 1024, 1024]
    - [0, 7.563]
  - - [1216, 320, 1, 1024, 1216, 1216, 1024, 1024]
    - [0, 8.347]
  - - [1344, 320, 1, 1024, 1344, 1344, 1024, 1024]
    - [0, 8.433]
  - - [1472, 320, 1, 1024, 1472, 1472, 1024, 1024]
    - [0, 8.218]
  - - [1600, 320, 1, 1024, 1600, 1600, 1024, 1024]
    - [0, 8.169]
  - - [1728, 320, 1, 1024, 1728, 1728, 1024, 1024]
    - [0, 7.99]
  - - [1856, 320, 1, 1024, 1856, 1856, 1024, 1024]
    - [0, 8.339]
  - - [1984, 320, 1, 1024, 1984, 1984, 1024, 1024]
    - [0, 8.506]
  - - [2112, 320, 1, 1024, 2112, 2112, 1024, 1024]
    - [0, 8.342]
  - - [2240, 320, 1, 1024, 2240, 2240, 1024, 1024]
    - [0, 8.311]
  - - [2368, 320, 1, 1024, 2368, 2368, 1024, 1024]
    - [0, 8.291]
  - - [2496, 320, 1, 1024, 2496, 2496, 1024, 1024]
    - [0, 8.38]
  - - [2624, 320, 1, 1024, 2624, 2624, 1024, 1024]
    - [0, 8.491]
  - - [2752, 320, 1, 1024, 2752, 2752, 1024, 1024]
    - [0, 8.615]
  - - [2880, 320, 1, 1024, 2880, 2880, 1024, 1024]
    - [0, 8.466]
  - - [3008, 320, 1, 1024, 3008, 3008, 1024, 1024]
    - [0, 8.456]
  - - [3136, 320, 1, 1024, 3136, 3136, 1024, 1024]
    - [0, 8.571]
  - - [3264, 320, 1, 1024, 3264, 3264, 1024, 1024]
    - [0, 8.464]
  - - [3392, 320, 1, 1024, 3392, 3392, 1024, 1024]
    - [0, 8.638]
  - - [3520, 320, 1, 1024, 3520, 3520, 1024, 1024]
    - [0, 8.742]
  - - [3648, 320, 1, 1024, 3648, 3648, 1024, 1024]
    - [0, 8.624]
  - - [3776, 320, 1, 1024, 3776, 3776, 1024, 1024]
    - [0, 8.624]
  - - [3904, 320, 1, 1024, 3904, 3904, 1024, 1024]
    - [0, 8.563]
  - - [4032, 320, 1, 1024, 4032, 4032, 1024, 1024]
    - [0, 8.562]
  - - [64, 448, 1, 1024, 64, 64, 1024, 1024]
    - [0, 3.377]
  - - [192, 448, 1, 1024, 192, 192, 1024, 1024]
    - [0, 6.127]
  - - [320, 448, 1, 1024, 320, 320, 1024, 1024]
    - [0, 7.261]
  - - [448, 448, 1, 1024, 448, 448, 1024, 1024]
    - [0, 6.659]
  - - [576, 448, 1, 1024, 576, 576, 1024, 1024]
    - [0, 7.234]
  - - [704, 448, 1, 1024, 704, 704, 1024, 1024]
    - [0, 7.666]
  - - [832, 448, 1, 1024, 832, 832, 1024, 1024]
    - [0, 8.05]
  - - [960, 448, 1, 1024, 960, 960, 1024, 1024]
    - [0, 8.256]
  - - [1088, 448, 1, 1024, 1088, 1088, 1024, 1024]
    - [0, 8.423]
  - - [1216, 448, 1, 1024, 1216, 1216, 1024, 1024]
    - [0, 8.128]
  - - [1344, 448, 1, 1024, 1344, 1344, 1024, 1024]
    - [0, 8.087]
  - - [1472, 448, 1, 1024, 1472, 1472, 1024, 1024]
    - [0, 8.36]
  - - [1600, 448, 1, 1024, 1600, 1600, 1024, 1024]
    - [0, 8.37]
  - - [1728, 448, 1, 1024, 1728, 1728, 1024, 1024]
    - [0, 8.323]
  - - [1856, 448, 1, 1024, 1856, 1856, 1024, 1024]
    - [0, 8.599]
  - - [1984, 448, 1, 1024, 1984, 1984, 1024, 1024]
    - [0, 8.581]
  - - [2112, 448, 1, 1024, 2112, 2112, 1024, 1024]
    - [0, 8.324]
  - - [2240, 448, 1, 1024, 2240, 2240, 1024, 1024]
    - [0, 8.504]
  - - [2368, 448, 1, 1024, 2368, 2368, 1024, 1024]
    - [0, 8.6]
  - - [2496, 448, 1, 1024, 2496, 2496, 1024, 1024]
    - [0, 8.633]
  - - [2624, 448, 1, 1024, 2624, 2624, 1024, 1024]
    - [0, 8.738]
  - - [2752, 448, 1, 1024, 2752, 2752, 1024, 1024]
    - [0, 8.745]
  - - [2880, 448, 1, 1024, 2880, 2880, 1024, 1024]
    - [0, 8.567]
  - - [3008, 448, 1, 1024, 3008, 3008, 1024, 1024]
    - [0, 8.601]
  - - [3136, 448, 1, 1024, 3136, 3136, 1024, 1024]
    - [0, 8.66]
  - - [3264, 448, 1, 1024, 3264, 3264, 1024, 1024]
    - [0, 8.749]
  - - [3392, 448, 1, 1024, 3392, 3392, 1024, 1024]
    - [0, 8.756]
  - - [3520, 448, 1, 1024, 3520, 3520, 1024, 1024]
    - [0, 8.793]
  - - [3648, 448, 1, 1024, 3648, 3648, 1024, 1024]
    - [0, 8.638]
  - - [3776, 448, 1, 1024, 3776, 3776, 1024, 1024]
    - [0, 8.705]
  - - [3904, 448, 1, 1024, 3904, 3904, 1024, 1024]
    - [0, 8.716]
  - - [4032, 448, 1, 1024, 4032, 4032, 1024, 1024]
    - [0, 8.793]
  - - [64, 576, 1, 1024, 64, 64, 1024, 1024]
    - [0, 4.346]
  - - [192, 576, 1, 1024, 192, 192, 1024, 1024]
    - [0, 5.633]
  - - [320, 576, 1, 1024, 320, 320, 1024, 1024]
    - [0, 7.286]
  - - [448, 576, 1, 1024, 448, 448, 1024, 1024]
    - [0, 7.238]
  - - [576, 576, 1, 1024, 576, 576, 1024, 1024]
    - [0, 8.028]
  - - [704, 576, 1, 1024, 704, 704, 1024, 1024]
    - [0, 8.011]
  - - [832, 576, 1, 1024, 832, 832, 1024, 1024]
    - [0, 8.362]
  - - [960, 576, 1, 1024, 960, 960, 1024, 1024]
    - [0, 7.983]
  - - [1088, 576, 1, 1024, 1088, 1088, 1024, 1024]
    - [0, 8.218]
  - - [1216, 576, 1, 1024, 1216, 1216, 1024, 1024]
    - [0, 8.186]
  - - [1344, 576, 1, 1024, 1344, 1344, 1024, 1024]
    - [0, 8.44]
  - - [1472, 576, 1, 1024, 1472, 1472, 1024, 1024]
    - [0, 8.314]
  - - [1600, 576, 1, 1024, 1600, 1600, 1024, 1024]
    - [0, 8.625]
  - - [1728, 576, 1, 1024, 1728, 1728, 1024, 1024]
    - [0, 8.473]
  - - [1856, 576, 1, 1024, 1856, 1856, 1024, 1024]
    - [0, 8.603]
  - - [1984, 576, 1, 1024, 1984, 1984, 1024, 1024]
    - [0, 8.474]
  - - [2112, 576, 1, 1024, 2112, 2112, 1024, 1024]
    - [0, 8.697]
  - - [2240, 576, 1, 1024, 2240, 2240, 1024, 1024]
    - [0, 8.63]
  - - [2368, 576, 1, 1024, 2368, 2368, 1024, 1024]
    - [0, 8.69]
  - - [2496, 576, 1, 1024, 2496, 2496, 1024, 1024]
    - [0, 8.621]
  - - [2624, 576, 1, 1024, 2624, 2624, 1024, 1024]
    - [0, 8.768]
  - - [2752, 576, 1, 1024, 2752, 2752, 1024, 1024]
    - [0, 8.696]
  - - [2880, 576, 1, 1024, 2880, 2880, 1024, 1024]
    - [0, 8.776]
  - - [3008, 576, 1, 1024, 3008, 3008, 1024, 1024]
    - [0, 8.732]
  - - [3136, 576, 1, 1024, 3136, 3136, 1024, 1024]
    - [0, 8.815]
  - - [3264, 576, 1, 1024, 3264, 3264, 1024, 1024]
    - [0, 8.775]
  - - [3392, 576, 1, 1024, 3392, 3392, 1024, 1024]
    - [0, 8.81]
  - - [3520, 576, 1, 1024, 3520, 3520, 1024, 1024]
    - [0, 8.803]
  - - [3648, 576, 1, 1024, 3648, 3648, 1024, 1024]
    - [0, 8.828]
  - - [3776, 576, 1, 1024, 3776, 3776, 1024, 1024]
    - [0, 8.787]
  - - [3904, 576, 1, 1024, 3904, 3904, 1024, 1024]
    - [0, 8.844]
  - - [4032, 576, 1, 1024, 4032, 4032, 1024, 1024]
    - [0, 8.774]
  - - [64, 704, 1, 1024, 64, 64, 1024, 1024]
    - [0, 5.284]
  - - [192, 704, 1, 1024, 192, 192, 1024, 1024]
    - [0, 6.88]
  - - [320, 704, 1, 1024, 320, 320, 1024, 1024]
    - [0, 7.4]
  - - [448, 704, 1, 1024, 448, 448, 1024, 1024]
    - [0, 7.625]
  - - [576, 704, 1, 1024, 576, 576, 1024, 1024]
    - [0, 8.024]
  - - [704, 704, 1, 1024, 704, 704, 1024, 1024]
    - [0, 7.994]
  - - [832, 704, 1, 1024, 832, 832, 1024, 1024]
    - [0, 8.353]
  - - [960, 704, 1, 1024, 960, 960, 1024, 1024]
    - [0, 8.431]
  - - [1088, 704, 1, 1024, 1088, 1088, 1024, 1024]
    - [0, 8.325]
  - - [1216, 704, 1, 1024, 1216, 1216, 1024, 1024]
    - [0, 8.422]
  - - [1344, 704, 1, 1024, 1344, 1344, 1024, 1024]
    - [0, 8.378]
  - - [1472, 704, 1, 1024, 1472, 1472, 1024, 1024]
    - [0, 8.654]
  - - [1600, 704, 1, 1024, 1600, 1600, 1024, 1024]
    - [0, 8.683]
  - - [1728, 704, 1, 1024, 1728, 1728, 1024, 1024]
    - [0, 8.69]
  - - [1856, 704, 1, 1024, 1856, 1856, 1024, 1024]
    - [0, 8.666]
  - - [1984, 704, 1, 1024, 1984, 1984, 1024, 1024]
    - [0, 8.64]
  - - [2112, 704, 1, 1024, 2112, 2112, 1024, 1024]
    - [0, 8.695]
  - - [2240, 704, 1, 1024, 2240, 2240, 1024, 1024]
    - [0, 8.802]
  - - [2368, 704, 1, 1024, 2368, 2368, 1024, 1024]
    - [0, 8.775]
  - - [2496, 704, 1, 1024, 2496, 2496, 1024, 1024]
    - [0, 8.784]
  - - [2624, 704, 1, 1024, 2624, 2624, 1024, 1024]
    - [0, 8.72]
  - - [2752, 704, 1, 1024, 2752, 2752, 1024, 1024]
    - [0, 8.764]
  - - [2880, 704, 1, 1024, 2880, 2880, 1024, 1024]
    - [0, 8.719]
  - - [3008, 704, 1, 1024, 3008, 3008, 1024, 1024]
    - [0, 8.8]
  - - [3136, 704, 1, 1024, 3136, 3136, 1024, 1024]
    - [0, 8.851]
  - - [3264, 704, 1, 1024, 3264, 3264, 1024, 1024]
    - [0, 8.843]
  - - [3392, 704, 1, 1024, 3392, 3392, 1024, 1024]
    - [0, 8.831]
  - - [3520, 704, 1, 1024, 3520, 3520, 1024, 1024]
    - [0, 8.833]
  - - [3648, 704, 1, 1024, 3648, 3648, 1024, 1024]
    - [0, 8.866]
  - - [3776, 704, 1, 1024, 3776, 3776, 1024, 1024]
    - [0, 9.007]
  - - [3904, 704, 1, 1024, 3904, 3904, 1024, 1024]
    - [0, 8.916]
  - - [4032, 704, 1, 1024, 4032, 4032, 1024, 1024]
    - [0, 8.88]
  - - [64, 832, 1, 1024, 64, 64, 1024, 1024]
    - [0, 3.787]
  - - [192, 832, 1, 1024, 192, 192, 1024, 1024]
    - [0, 6.301]
  - - [320, 832, 1, 1024, 320, 320, 1024, 1024]
    - [0, 7.442]
  - - [448, 832, 1, 1024, 448, 448, 1024, 1024]
    - [0, 8.023]
  - - [576, 832, 1, 1024, 576, 576, 1024, 1024]
    - [0, 8.29]
  - - [704, 832, 1, 1024, 704, 704, 1024, 1024]
    - [0, 8.361]
  - - [832, 832, 1, 1024, 832, 832, 1024, 1024]
    - [0, 8.164]
  - - [960, 832, 1, 1024, 960, 960, 1024, 1024]
    - [0, 8.328]
  - - [1088, 832, 1, 1024, 1088, 1088, 1024, 1024]
    - [0, 8.404]
  - - [1216, 832, 1, 1024, 1216, 1216, 1024, 1024]
    - [0, 8.561]
  - - [1344, 832, 1, 1024, 1344, 1344, 1024, 1024]
    - [0, 8.639]
  - - [1472, 832, 1, 1024, 1472, 1472, 1024, 1024]
    - [0, 8.697]
  - - [1600, 832, 1, 1024, 1600, 1600, 1024, 1024]
    - [0, 8.692]
  - - [1728, 832, 1, 1024, 1728, 1728, 1024, 1024]
    - [0, 8.645]
  - - [1856, 832, 1, 1024, 1856, 1856, 1024, 1024]
    - [0, 8.626]
  - - [1984, 832, 1, 1024, 1984, 1984, 1024, 1024]
    - [0, 8.752]
  - - [2112, 832, 1, 1024, 2112, 2112, 1024, 1024]
    - [0, 8.735]
  - - [2240, 832, 1, 1024, 2240, 2240, 1024, 1024]
    - [0, 8.8]
  - - [2368, 832, 1, 1024, 2368, 2368, 1024, 1024]
    - [0, 8.816]
  - - [2496, 832, 1, 1024, 2496, 2496, 1024, 1024]
    - [0, 8.728]
  - - [2624, 832, 1, 1024, 2624, 2624, 1024, 1024]
    - [0, 8.804]
  - - [2752, 832, 1, 1024, 2752, 2752, 1024, 1024]
    - [0, 8.81]
  - - [2880, 832, 1, 1024, 2880, 2880, 1024, 1024]
    - [0, 8.875]
  - - [3008, 832, 1, 1024, 3008, 3008, 1024, 1024]
    - [0, 8.871]
  - - [3136, 832, 1, 1024, 3136, 3136, 1024, 1024]
    - [0, 8.873]
  - - [3264, 832, 1, 1024, 3264, 3264, 1024, 1024]
    - [0, 8.894]
  - - [3392, 832, 1, 1024, 3392, 3392, 1024, 1024]
    - [0, 8.884]
  - - [3520, 832, 1, 1024, 3520, 3520, 1024, 1024]
    - [0, 8.874]
  - - [3648, 832, 1, 1024, 3648, 3648, 1024, 1024]
    - [0, 8.967]
  - - [3776, 832, 1, 1024, 3776, 3776, 1024, 1024]
    - [0, 8.978]
  - - [3904, 832, 1, 1024, 3904, 3904, 1024, 1024]
    - [0, 8.975]
  - - [4032, 832, 1, 1024, 4032, 4032, 1024, 1024]
    - [0, 8.931]
  - - [64, 960, 1, 1024, 64, 64, 1024, 1024]
    - [0, 4.343]
  - - [192, 960, 1, 1024, 192, 192, 1024, 1024]
    - [0, 7.251]
  - - [320, 960, 1, 1024, 320, 320, 1024, 1024]
    - [0, 7.445]
  - - [448, 960, 1, 1024, 448, 448, 1024, 1024]
    - [0, 8.242]
  - - [576, 960, 1, 1024, 576, 576, 1024, 1024]
    - [0, 8.022]
  - - [704, 960, 1, 1024, 704, 704, 1024, 1024]
    - [0, 8.227]
  - - [832, 960, 1, 1024, 832, 832, 1024, 1024]
    - [0, 8.336]
  - - [960, 960, 1, 1024, 960, 960, 1024, 1024]
    - [0, 8.54]
  - - [1088, 960, 1, 1024, 1088, 1088, 1024, 1024]
    - [0, 8.503]
  - - [1216, 960, 1, 1024, 1216, 1216, 1024, 1024]
    - [0, 8.643]
  - - [1344, 960, 1, 1024, 1344, 1344, 1024, 1024]
    - [0, 8.71]
  - - [1472, 960, 1, 1024, 1472, 1472, 1024, 1024]
    - [0, 8.73]
  - - [1600, 960, 1, 1024, 1600, 1600, 1024, 1024]
    - [0, 8.732]
  - - [1728, 960, 1, 1024, 1728, 1728, 1024, 1024]
    - [0, 8.748]
  - - [1856, 960, 1, 1024, 1856, 1856, 1024, 1024]
    - [0, 8.831]
  - - [1984, 960, 1, 1024, 1984, 1984, 1024, 1024]
    - [0, 8.763]
  - - [2112, 960, 1, 1024, 2112, 2112, 1024, 1024]
    - [0, 8.794]
  - - [2240, 960, 1, 1024, 2240, 2240, 1024, 1024]
    - [0, 8.801]
  - - [2368, 960, 1, 1024, 2368, 2368, 1024, 1024]
    - [0, 8.76]
  - - [2496, 960, 1, 1024, 2496, 2496, 1024, 1024]
    - [0, 8.831]
  - - [2624, 960, 1, 1024, 2624, 2624, 1024, 1024]
    - [0, 8.969]
  - - [2752, 960, 1, 1024, 2752, 2752, 1024, 1024]
    - [0, 8.935]
  - - [2880, 960, 1, 1024, 2880, 2880, 1024, 1024]
    - [0, 8.926]
  - - [3008, 960, 1, 1024, 3008, 3008, 1024, 1024]
    - [0, 8.926]
  - - [3136, 960, 1, 1024, 3136, 3136, 1024, 1024]
    - [0, 8.863]
  - - [3264, 960, 1, 1024, 3264, 3264, 1024, 1024]
    - [0, 8.921]
  - - [3392, 960, 1, 1024, 3392, 3392, 1024, 1024]
    - [0, 8.966]
  - - [3520, 960, 1, 1024, 3520, 3520, 1024, 1024]
    - [0, 8.978]
  - - [3648, 960, 1, 1024, 3648, 3648, 1024, 1024]
    - [0, 9.011]
  - - [3776, 960, 1, 1024, 3776, 3776, 1024, 1024]
    - [0, 9.046]
  - - [3904, 960, 1, 1024, 3904, 3904, 1024, 1024]
    - [0, 9.052]
  - - [4032, 960, 1, 1024, 4032, 4032, 1024, 1024]
    - [0, 9.05]
  - - [64, 1088, 1, 1024, 64, 64, 1024, 1024]
    - [0, 4.947]
  - - [192, 1088, 1, 1024, 192, 192, 1024, 1024]
    - [0, 6.9]
  - - [320, 1088, 1, 1024, 320, 320, 1024, 1024]
    - [0, 7.433]
  - - [448, 1088, 1, 1024, 448, 448, 1024, 1024]
    - [0, 8.401]
  - - [576, 1088, 1, 1024, 576, 576, 1024, 1024]
    - [0, 8.378]
  - - [704, 1088, 1, 1024, 704, 704, 1024, 1024]
    - [0, 8.348]
  - - [832, 1088, 1, 1024, 832, 832, 1024, 1024]
    - [0, 8.439]
  - - [960, 1088, 1, 1024, 960, 960, 1024, 1024]
    - [0, 8.513]
  - - [1088, 1088, 1, 1024, 1088, 1088, 1024, 1024]
    - [0, 8.658]
  - - [1216, 1088, 1, 1024, 1216, 1216, 1024, 1024]
    - [0, 8.741]
  - - [1344, 1088, 1, 1024, 1344, 1344, 1024, 1024]
    - [0, 8.655]
  - - [1472, 1088, 1, 1024, 1472, 1472, 1024, 1024]
    - [0, 8.702]
  - - [1600, 1088, 1, 1024, 1600, 1600, 1024, 1024]
    - [0, 8.691]
  - - [1728, 1088, 1, 1024, 1728, 1728, 1024, 1024]
    - [0, 8.703]
  - - [1856, 1088, 1, 1024, 1856, 1856, 1024, 1024]
    - [0, 8.736]
  - - [1984, 1088, 1, 1024, 1984, 1984, 1024, 1024]
    - [0, 8.839]
  - - [2112, 1088, 1, 1024, 2112, 2112, 1024, 1024]
    - [0, 8.759]
  - - [2240, 1088, 1, 1024, 2240, 2240, 1024, 1024]
    - [0, 8.863]
  - - [2368, 1088, 1, 1024, 2368, 2368, 1024, 1024]
    - [0, 8.865]
  - - [2496, 1088, 1, 1024, 2496, 2496, 1024, 1024]
    - [0, 8.872]
  - - [2624, 1088, 1, 1024, 2624, 2624, 1024, 1024]
    - [0, 8.988]
  - - [2752, 1088, 1, 1024, 2752, 2752, 1024, 1024]
    - [0, 8.95]
  - - [2880, 1088, 1, 1024, 2880, 2880, 1024, 1024]
    - [0, 9.016]
  - - [3008, 1088, 1, 1024, 3008, 3008, 1024, 1024]
    - [0, 8.938]
  - - [3136, 1088, 1, 1024, 3136, 3136, 1024, 1024]
    - [0, 9.016]
  - - [3264, 1088, 1, 1024, 3264, 3264, 1024, 1024]
    - [0, 8.975]
  - - [3392, 1088, 1, 1024, 3392, 3392, 1024, 1024]
    - [0, 9.032]
  - - [3520, 1088, 1, 1024, 3520, 3520, 1024, 1024]
    - [0, 9.008]
  - - [3648, 1088, 1, 1024, 3648, 3648, 1024, 1024]
    - [0, 9.046]
  - - [3776, 1088, 1, 1024, 3776, 3776, 1024, 1024]
    - [0, 8.971]
  - - [3904, 1088, 1, 1024, 3904, 3904, 1024, 1024]
    - [0, 9.033]
  - - [4032, 1088, 1, 1024, 4032, 4032, 1024, 1024]
    - [0, 9.124]
  - - [64, 1216, 1, 1024, 64, 64, 1024, 1024]
    - [0, 5.531]
  - - [192, 1216, 1, 1024, 192, 192, 1024, 1024]
    - [0, 7.711]
  - - [320, 1216, 1, 1024, 320, 320, 1024, 1024]
    - [0, 8.365]
  - - [448, 1216, 1, 1024, 448, 448, 1024, 1024]
    - [0, 8.087]
  - - [576, 1216, 1, 1024, 576, 576, 1024, 1024]
    - [0, 8.189]
  - - [704, 1216, 1, 1024, 704, 704, 1024, 1024]
    - [0, 8.406]
  - - [832, 1216, 1, 1024, 832, 832, 1024, 1024]
    - [0, 8.615]
  - - [960, 1216, 1, 1024, 960, 960, 1024, 1024]
    - [0, 8.622]
  - - [1088, 1216, 1, 1024, 1088, 1088, 1024, 1024]
    - [0, 8.766]
  - - [1216, 1216, 1, 1024, 1216, 1216, 1024, 1024]
    - [0, 8.69]
  - - [1344, 1216, 1, 1024, 1344, 1344, 1024, 1024]
    - [0, 8.714]
  - - [1472, 1216, 1, 1024, 1472, 1472, 1024, 1024]
    - [0, 8.771]
  - - [1600, 1216, 1, 1024, 1600, 1600, 1024, 1024]
    - [0, 8.818]
  - - [1728, 1216, 1, 1024, 1728, 1728, 1024, 1024]
    - [0, 8.845]
  - - [1856, 1216, 1, 1024, 1856, 1856, 1024, 1024]
    - [0, 8.902]
  - - [1984, 1216, 1, 1024, 1984, 1984, 1024, 1024]
    - [0, 8.887]
  - - [2112, 1216, 1, 1024, 2112, 2112, 1024, 1024]
    - [0, 8.923]
  - - [2240, 1216, 1, 1024, 2240, 2240, 1024, 1024]
    - [0, 8.873]
  - - [2368, 1216, 1, 1024, 2368, 2368, 1024, 1024]
    - [0, 8.956]
  - - [2496, 1216, 1, 1024, 2496, 2496, 1024, 1024]
    - [0, 8.949]
  - - [2624, 1216, 1, 1024, 2624, 2624, 1024, 1024]
    - [0, 9.0]
  - - [2752, 1216, 1, 1024, 2752, 2752, 1024, 1024]
    - [0, 8.971]
  - - [2880, 1216, 1, 1024, 2880, 2880, 1024, 1024]
    - [0, 9.053]
  - - [3008, 1216, 1, 1024, 3008, 3008, 1024, 1024]
    - [0, 8.948]
  - - [3136, 1216, 1, 1024, 3136, 3136, 1024, 1024]
    - [0, 9.023]
  - - [3264, 1216, 1, 1024, 3264, 3264, 1024, 1024]
    - [0, 9.008]
  - - [3392, 1216, 1, 1024, 3392, 3392, 1024, 1024]
    - [0, 9.072]
  - - [3520, 1216, 1, 1024, 3520, 3520, 1024, 1024]
    - [0, 9.069]
  - - [3648, 1216, 1, 1024, 3648, 3648, 1024, 1024]
    - [0, 9.072]
  - - [3776, 1216, 1, 1024, 3776, 3776, 1024, 1024]
    - [0, 9.117]
  - - [3904, 1216, 1, 1024, 3904, 3904, 1024, 1024]
    - [0, 9.079]
  - - [4032, 1216, 1, 1024, 4032, 4032, 1024, 1024]
    - [0, 9.114]
  - - [64, 1344, 1, 1024, 64, 64, 1024, 1024]
    - [0, 6.106]
  - - [192, 1344, 1, 1024, 192, 192, 1024, 1024]
    - [0, 7.383]
  - - [320, 1344, 1, 1024, 320, 320, 1024, 1024]
    - [0, 8.288]
  - - [448, 1344, 1, 1024, 448, 448, 1024, 1024]
    - [0, 8.183]
  - - [576, 1344, 1, 1024, 576, 576, 1024, 1024]
    - [0, 8.43]
  - - [704, 1344, 1, 1024, 704, 704, 1024, 1024]
    - [0, 8.518]
  - - [832, 1344, 1, 1024, 832, 832, 1024, 1024]
    - [0, 8.656]
  - - [960, 1344, 1, 1024, 960, 960, 1024, 1024]
    - [0, 8.741]
  - - [1088, 1344, 1, 1024, 1088, 1088, 1024, 1024]
    - [0, 8.727]
  - - [1216, 1344, 1, 1024, 1216, 1216, 1024, 1024]
    - [0, 8.674]
  - - [1344, 1344, 1, 1024, 1344, 1344, 1024, 1024]
    - [0, 8.776]
  - - [1472, 1344, 1, 1024, 1472, 1472, 1024, 1024]
    - [0, 8.832]
  - - [1600, 1344, 1, 1024, 1600, 1600, 1024, 1024]
    - [0, 8.842]
  - - [1728, 1344, 1, 1024, 1728, 1728, 1024, 1024]
    - [0, 8.788]
  - - [1856, 1344, 1, 1024, 1856, 1856, 1024, 1024]
    - [0, 8.845]
  - - [1984, 1344, 1, 1024, 1984, 1984, 1024, 1024]
    - [0, 8.832]
  - - [2112, 1344, 1, 1024, 2112, 2112, 1024, 1024]
    - [0, 8.877]
  - - [2240, 1344, 1, 1024, 2240, 2240, 1024, 1024]
    - [0, 8.902]
  - - [2368, 1344, 1, 1024, 2368, 2368, 1024, 1024]
    - [0, 8.918]
  - - [2496, 1344, 1, 1024, 2496, 2496, 1024, 1024]
    - [0, 8.988]
  - - [2624, 1344, 1, 1024, 2624, 2624, 1024, 1024]
    - [0, 8.948]
  - - [2752, 1344, 1, 1024, 2752, 2752, 1024, 1024]
    - [0, 9.015]
  - - [2880, 1344, 1, 1024, 2880, 2880, 1024, 1024]
    - [0, 9.028]
  - - [3008, 1344, 1, 1024, 3008, 3008, 1024, 1024]
    - [0, 9.026]
  - - [3136, 1344, 1, 1024, 3136, 3136, 1024, 1024]
    - [0, 9.039]
  - - [3264, 1344, 1, 1024, 3264, 3264, 1024, 1024]
    - [0, 9.034]
  - - [3392, 1344, 1, 1024, 3392, 3392, 1024, 1024]
    - [0, 9.053]
  - - [3520, 1344, 1, 1024, 3520, 3520, 1024, 1024]
    - [0, 9.144]
  - - [3648, 1344, 1, 1024, 3648, 3648, 1024, 1024]
    - [0, 9.134]
  - - [3776, 1344, 1, 1024, 3776, 3776, 1024, 1024]
    - [0, 9.143]
  - - [3904, 1344, 1, 1024, 3904, 3904, 1024, 1024]
    - [0, 9.179]
  - - [4032, 1344, 1, 1024, 4032, 4032, 1024, 1024]
    - [0, 9.188]
  - - [64, 1472, 1, 1024, 64, 64, 1024, 1024]
    - [0, 6.659]
  - - [192, 1472, 1, 1024, 192, 192, 1024, 1024]
    - [0, 8.048]
  - - [320, 1472, 1, 1024, 320, 320, 1024, 1024]
    - [0, 8.127]
  - - [448, 1472, 1, 1024, 448, 448, 1024, 1024]
    - [0, 8.23]
  - - [576, 1472, 1, 1024, 576, 576, 1024, 1024]
    - [0, 8.428]
  - - [704, 1472, 1, 1024, 704, 704, 1024, 1024]
    - [0, 8.725]
  - - [832, 1472, 1, 1024, 832, 832, 1024, 1024]
    - [0, 8.727]
  - - [960, 1472, 1, 1024, 960, 960, 1024, 1024]
    - [0, 8.709]
  - - [1088, 1472, 1, 1024, 1088, 1088, 1024, 1024]
    - [0, 8.699]
  - - [1216, 1472, 1, 1024, 1216, 1216, 1024, 1024]
    - [0, 8.681]
  - - [1344, 1472, 1, 1024, 1344, 1344, 1024, 1024]
    - [0, 8.851]
  - - [1472, 1472, 1, 1024, 1472, 1472, 1024, 1024]
    - [0, 8.76]
  - - [1600, 1472, 1, 1024, 1600, 1600, 1024, 1024]
    - [0, 8.873]
  - - [1728, 1472, 1, 1024, 1728, 1728, 1024, 1024]
    - [0, 8.843]
  - - [1856, 1472, 1, 1024, 1856, 1856, 1024, 1024]
    - [0, 8.84]
  - - [1984, 1472, 1, 1024, 1984, 1984, 1024, 1024]
    - [0, 8.843]
  - - [2112, 1472, 1, 1024, 2112, 2112, 1024, 1024]
    - [0, 8.915]
  - - [2240, 1472, 1, 1024, 2240, 2240, 1024, 1024]
    - [0, 8.948]
  - - [2368, 1472, 1, 1024, 2368, 2368, 1024, 1024]
    - [0, 9.035]
  - - [2496, 1472, 1, 1024, 2496, 2496, 1024, 1024]
    - [0, 8.989]
  - - [2624, 1472, 1, 1024, 2624, 2624, 1024, 1024]
    - [0, 9.076]
  - - [2752, 1472, 1, 1024, 2752, 2752, 1024, 1024]
    - [0, 9.052]
  - - [2880, 1472, 1, 1024, 2880, 2880, 1024, 1024]
    - [0, 9.08]
  - - [3008, 1472, 1, 1024, 3008, 3008, 1024, 1024]
    - [0, 9.111]
  - - [3136, 1472, 1, 1024, 3136, 3136, 1024, 1024]
    - [0, 9.056]
  - - [3264, 1472, 1, 1024, 3264, 3264, 1024, 1024]
    - [0, 9.132]
  - - [3392, 1472, 1, 1024, 3392, 3392, 1024, 1024]
    - [0, 9.113]
  - - [3520, 1472, 1, 1024, 3520, 3520, 1024, 1024]
    - [0, 9.16]
  - - [3648, 1472, 1, 1024, 3648, 3648, 1024, 1024]
    - [0, 9.185]
  - - [3776, 1472, 1, 1024, 3776, 3776, 1024, 1024]
    - [0, 9.228]
  - - [3904, 1472, 1, 1024, 3904, 3904, 1024, 1024]
    - [0, 9.22]
  - - [4032, 1472, 1, 1024, 4032, 4032, 1024, 1024]
    - [0, 9.226]
  - - [64, 1600, 1, 1024, 64, 64, 1024, 1024]
    - [0, 5.211]
  - - [192, 1600, 1, 1024, 192, 192, 1024, 1024]
    - [0, 7.424]
  - - [320, 1600, 1, 1024, 320, 320, 1024, 1024]
    - [0, 8.098]
  - - [448, 1600, 1, 1024, 448, 448, 1024, 1024]
    - [0, 8.296]
  - - [576, 1600, 1, 1024, 576, 576, 1024, 1024]
    - [0, 8.553]
  - - [704, 1600, 1, 1024, 704, 704, 1024, 1024]
    - [0, 8.664]
  - - [832, 1600, 1, 1024, 832, 832, 1024, 1024]
    - [0, 8.693]
  - - [960, 1600, 1, 1024, 960, 960, 1024, 1024]
    - [0, 8.588]
  - - [1088, 1600, 1, 1024, 1088, 1088, 1024, 1024]
    - [0, 8.654]
  - - [1216, 1600, 1, 1024, 1216, 1216, 1024, 1024]
    - [0, 8.813]
  - - [1344, 1600, 1, 1024, 1344, 1344, 1024, 1024]
    - [0, 8.832]
  - - [1472, 1600, 1, 1024, 1472, 1472, 1024, 1024]
    - [0, 8.835]
  - - [1600, 1600, 1, 1024, 1600, 1600, 1024, 1024]
    - [0, 8.924]
  - - [1728, 1600, 1, 1024, 1728, 1728, 1024, 1024]
    - [0, 8.89]
  - - [1856, 1600, 1, 1024, 1856, 1856, 1024, 1024]
    - [0, 8.977]
  - - [1984, 1600, 1, 1024, 1984, 1984, 1024, 1024]
    - [0, 8.948]
  - - [2112, 1600, 1, 1024, 2112, 2112, 1024, 1024]
    - [0, 8.972]
  - - [2240, 1600, 1, 1024, 2240, 2240, 1024, 1024]
    - [0, 9.052]
  - - [2368, 1600, 1, 1024, 2368, 2368, 1024, 1024]
    - [0, 9.046]
  - - [2496, 1600, 1, 1024, 2496, 2496, 1024, 1024]
    - [0, 8.986]
  - - [2624, 1600, 1, 1024, 2624, 2624, 1024, 1024]
    - [0, 9.121]
  - - [2752, 1600, 1, 1024, 2752, 2752, 1024, 1024]
    - [0, 9.111]
  - - [2880, 1600, 1, 1024, 2880, 2880, 1024, 1024]
    - [0, 9.095]
  - - [3008, 1600, 1, 1024, 3008, 3008, 1024, 1024]
    - [0, 9.155]
  - - [3136, 1600, 1, 1024, 3136, 3136, 1024, 1024]
    - [0, 9.155]
  - - [3264, 1600, 1, 1024, 3264, 3264, 1024, 1024]
    - [0, 9.194]
  - - [3392, 1600, 1, 1024, 3392, 3392, 1024, 1024]
    - [0, 9.19]
  - - [3520, 1600, 1, 1024, 3520, 3520, 1024, 1024]
    - [0, 9.236]
  - - [3648, 1600, 1, 1024, 3648, 3648, 1024, 1024]
    - [0, 9.226]
  - - [3776, 1600, 1, 1024, 3776, 3776, 1024, 1024]
    - [0, 9.272]
  - - [3904, 1600, 1, 1024, 3904, 3904, 1024, 1024]
    - [0, 9.245]
  - - [4032, 1600, 1, 1024, 4032, 4032, 1024, 1024]
    - [0, 9.313]
  - - [64, 1728, 1, 1024, 64, 64, 1024, 1024]
    - [0, 5.602]
  - - [192, 1728, 1, 1024, 192, 192, 1024, 1024]
    - [0, 8.042]
  - - [320, 1728, 1, 1024, 320, 320, 1024, 1024]
    - [0, 7.972]
  - - [448, 1728, 1, 1024, 448, 448, 1024, 1024]
    - [0, 8.424]
  - - [576, 1728, 1, 1024, 576, 576, 1024, 1024]
    - [0, 8.537]
  - - [704, 1728, 1, 1024, 704, 704, 1024, 1024]
    - [0, 8.692]
  - - [832, 1728, 1, 1024, 832, 832, 1024, 1024]
    - [0, 8.711]
  - - [960, 1728, 1, 1024, 960, 960, 1024, 1024]
    - [0, 8.766]
  - - [1088, 1728, 1, 1024, 1088, 1088, 1024, 1024]
    - [0, 8.802]
  - - [1216, 1728, 1, 1024, 1216, 1216, 1024, 1024]
    - [0, 8.84]
  - - [1344, 1728, 1, 1024, 1344, 1344, 1024, 1024]
    - [0, 8.877]
  - - [1472, 1728, 1, 1024, 1472, 1472, 1024, 1024]
    - [0, 8.912]
  - - [1600, 1728, 1, 1024, 1600, 1600, 1024, 1024]
    - [0, 8.931]
  - - [1728, 1728, 1, 1024, 1728, 1728, 1024, 1024]
    - [0, 8.944]
  - - [1856, 1728, 1, 1024, 1856, 1856, 1024, 1024]
    - [0, 9.011]
  - - [1984, 1728, 1, 1024, 1984, 1984, 1024, 1024]
    - [0, 9.0]
  - - [2112, 1728, 1, 1024, 2112, 2112, 1024, 1024]
    - [0, 9.012]
  - - [2240, 1728, 1, 1024, 2240, 2240, 1024, 1024]
    - [0, 9.026]
  - - [2368, 1728, 1, 1024, 2368, 2368, 1024, 1024]
    - [0, 9.077]
  - - [2496, 1728, 1, 1024, 2496, 2496, 1024, 1024]
    - [0, 9.047]
  - - [2624, 1728, 1, 1024, 2624, 2624, 1024, 1024]
    - [0, 8.857]
  - - [2752, 1728, 1, 1024, 2752, 2752, 1024, 1024]
    - [0, 9.096]
  - - [2880, 1728, 1, 1024, 2880, 2880, 1024, 1024]
    - [0, 9.164]
  - - [3008, 1728, 1, 1024, 3008, 3008, 1024, 1024]
    - [0, 9.115]
  - - [3136, 1728, 1, 1024, 3136, 3136, 1024, 1024]
    - [0, 9.214]
  - - [3264, 1728, 1, 1024, 3264, 3264, 1024, 1024]
    - [0, 9.258]
  - - [3392, 1728, 1, 1024, 3392, 3392, 1024, 1024]
    - [0, 9.202]
  - - [3520, 1728, 1, 1024, 3520, 3520, 1024, 1024]
    - [0, 9.233]
  - - [3648, 1728, 1, 1024, 3648, 3648, 1024, 1024]
    - [0, 9.268]
  - - [3776, 1728, 1, 1024, 3776, 3776, 1024, 1024]
    - [0, 9.269]
  - - [3904, 1728, 1, 1024, 3904, 3904, 1024, 1024]
    - [0, 9.279]
  - - [4032, 1728, 1, 1024, 4032, 4032, 1024, 1024]
    - [0, 9.288]
  - - [64, 1856, 1, 1024, 64, 64, 1024, 1024]
    - [0, 6.031]
  - - [192, 1856, 1, 1024, 192, 192, 1024, 1024]
    - [0, 7.648]
  - - [320, 1856, 1, 1024, 320, 320, 1024, 1024]
    - [0, 8.131]
  - - [448, 1856, 1, 1024, 448, 448, 1024, 1024]
    - [0, 8.513]
  - - [576, 1856, 1, 1024, 576, 576, 1024, 1024]
    - [0, 8.642]
  - - [704, 1856, 1, 1024, 704, 704, 1024, 1024]
    - [0, 8.632]
  - - [832, 1856, 1, 1024, 832, 832, 1024, 1024]
    - [0, 8.603]
  - - [960, 1856, 1, 1024, 960, 960, 1024, 1024]
    - [0, 8.684]
  - - [1088, 1856, 1, 1024, 1088, 1088, 1024, 1024]
    - [0, 8.821]
  - - [1216, 1856, 1, 1024, 1216, 1216, 1024, 1024]
    - [0, 8.866]
  - - [1344, 1856, 1, 1024, 1344, 1344, 1024, 1024]
    - [0, 8.884]
  - - [1472, 1856, 1, 1024, 1472, 1472, 1024, 1024]
    - [0, 8.872]
  - - [1600, 1856, 1, 1024, 1600, 1600, 1024, 1024]
    - [0, 8.881]
  - - [1728, 1856, 1, 1024, 1728, 1728, 1024, 1024]
    - [0, 8.947]
  - - [1856, 1856, 1, 1024, 1856, 1856, 1024, 1024]
    - [0, 9.022]
  - - [1984, 1856, 1, 1024, 1984, 1984, 1024, 1024]
    - [0, 8.989]
  - - [2112, 1856, 1, 1024, 2112, 2112, 1024, 1024]
    - [0, 9.001]
  - - [2240, 1856, 1, 1024, 2240, 2240, 1024, 1024]
    - [0, 9.053]
  - - [2368, 1856, 1, 1024, 2368, 2368, 1024, 1024]
    - [0, 9.043]
  - - [2496, 1856, 1, 1024, 2496, 2496, 1024, 1024]
    - [0, 9.108]
  - - [2624, 1856, 1, 1024, 2624, 2624, 1024, 1024]
    - [0, 9.157]
  - - [2752, 1856, 1, 1024, 2752, 2752, 1024, 1024]
    - [0, 9.125]
  - - [2880, 1856, 1, 1024, 2880, 2880, 1024, 1024]
    - [0, 9.161]
  - - [3008, 1856, 1, 1024, 3008, 3008, 1024, 1024]
    - [0, 9.175]
  - - [3136, 1856, 1, 1024, 3136, 3136, 1024, 1024]
    - [0, 9.262]
  - - [3264, 1856, 1, 1024, 3264, 3264, 1024, 1024]
    - [0, 9.225]
  - - [3392, 1856, 1, 1024, 3392, 3392, 1024, 1024]
    - [0, 9.277]
  - - [3520, 1856, 1, 1024, 3520, 3520, 1024, 1024]
    - [0, 9.294]
  - - [3648, 1856, 1, 1024, 3648, 3648, 1024, 1024]
    - [0, 9.326]
  - - [3776, 1856, 1, 1024, 3776, 3776, 1024, 1024]
    - [0, 9.281]
  - - [3904, 1856, 1, 1024, 3904, 3904, 1024, 1024]
    - [0, 9.085]
  - - [4032, 1856, 1, 1024, 4032, 4032, 1024, 1024]
    - [0, 9.352]
  - - [64, 1984, 1, 1024, 64, 64, 1024, 1024]
    - [0, 6.403]
  - - [192, 1984, 1, 1024, 192, 192, 1024, 1024]
    - [0, 8.206]
  - - [320, 1984, 1, 1024, 320, 320, 1024, 1024]
    - [0, 8.466]
  - - [448, 1984, 1, 1024, 448, 448, 1024, 1024]
    - [0, 8.373]
  - - [576, 1984, 1, 1024, 576, 576, 1024, 1024]
    - [0, 8.493]
  - - [704, 1984, 1, 1024, 704, 704, 1024, 1024]
    - [0, 8.597]
  - - [832, 1984, 1, 1024, 832, 832, 1024, 1024]
    - [0, 8.688]
  - - [960, 1984, 1, 1024, 960, 960, 1024, 1024]
    - [0, 8.769]
  - - [1088, 1984, 1, 1024, 1088, 1088, 1024, 1024]
    - [0, 8.797]
  - - [1216, 1984, 1, 1024, 1216, 1216, 1024, 1024]
    - [0, 8.764]
  - - [1344, 1984, 1, 1024, 1344, 1344, 1024, 1024]
    - [0, 8.846]
  - - [1472, 1984, 1, 1024, 1472, 1472, 1024, 1024]
    - [0, 8.896]
  - - [1600, 1984, 1, 1024, 1600, 1600, 1024, 1024]
    - [0, 8.94]
  - - [1728, 1984, 1, 1024, 1728, 1728, 1024, 1024]
    - [0, 8.969]
  - - [1856, 1984, 1, 1024, 1856, 1856, 1024, 1024]
    - [0, 9.023]
  - - [1984, 1984, 1, 1024, 1984, 1984, 1024, 1024]
    - [0, 9.031]
  - - [2112, 1984, 1, 1024, 2112, 2112, 1024, 1024]
    - [0, 9.088]
  - - [2240, 1984, 1, 1024, 2240, 2240, 1024, 1024]
    - [0, 9.105]
  - - [2368, 1984, 1, 1024, 2368, 2368, 1024, 1024]
    - [0, 9.148]
  - - [2496, 1984, 1, 1024, 2496, 2496, 1024, 1024]
    - [0, 9.175]
  - - [2624, 1984, 1, 1024, 2624, 2624, 1024, 1024]
    - [0, 9.143]
  - - [2752, 1984, 1, 1024, 2752, 2752, 1024, 1024]
    - [0, 9.175]
  - - [2880, 1984, 1, 1024, 2880, 2880, 1024, 1024]
    - [0, 9.074]
  - - [3008, 1984, 1, 1024, 3008, 3008, 1024, 1024]
    - [0, 9.155]
  - - [3136, 1984, 1, 1024, 3136, 3136, 1024, 1024]
    - [0, 9.201]
  - - [3264, 1984, 1, 1024, 3264, 3264, 1024, 1024]
    - [0, 9.235]
  - - [3392, 1984, 1, 1024, 3392, 3392, 1024, 1024]
    - [0, 9.298]
  - - [3520, 1984, 1, 1024, 3520, 3520, 1024, 1024]
    - [0, 9.324]
  - - [3648, 1984, 1, 1024, 3648, 3648, 1024, 1024]
    - [0, 9.35]
  - - [3776, 1984, 1, 1024, 3776, 3776, 1024, 1024]
    - [0, 9.316]
  - - [3904, 1984, 1, 1024, 3904, 3904, 1024, 1024]
    - [0, 9.317]
  - - [4032, 1984, 1, 1024, 4032, 4032, 1024, 1024]
    - [0, 9.259]
  - - [64, 2112, 1, 1024, 64, 64, 1024, 1024]
    - [0, 6.793]
  - - [192, 2112, 1, 1024, 192, 192, 1024, 1024]
    - [0, 7.88]
  - - [320, 2112, 1, 1024, 320, 320, 1024, 1024]
    - [0, 8.32]
  - - [448, 2112, 1, 1024, 448, 448, 1024, 1024]
    - [0, 8.353]
  - - [576, 2112, 1, 1024, 576, 576, 1024, 1024]
    - [0, 8.64]
  - - [704, 2112, 1, 1024, 704, 704, 1024, 1024]
    - [0, 8.609]
  - - [832, 2112, 1, 1024, 832, 832, 1024, 1024]
    - [0, 8.693]
  - - [960, 2112, 1, 1024, 960, 960, 1024, 1024]
    - [0, 8.803]
  - - [1088, 2112, 1, 1024, 1088, 1088, 1024, 1024]
    - [0, 8.786]
  - - [1216, 2112, 1, 1024, 1216, 1216, 1024, 1024]
    - [0, 8.93]
  - - [1344, 2112, 1, 1024, 1344, 1344, 1024, 1024]
    - [0, 8.921]
  - - [1472, 2112, 1, 1024, 1472, 1472, 1024, 1024]
    - [0, 8.961]
  - - [1600, 2112, 1, 1024, 1600, 1600, 1024, 1024]
    - [0, 8.945]
  - - [1728, 2112, 1, 1024, 1728, 1728, 1024, 1024]
    - [0, 8.991]
  - - [1856, 2112, 1, 1024, 1856, 1856, 1024, 1024]
    - [0, 9.039]
  - - [1984, 2112, 1, 1024, 1984, 1984, 1024, 1024]
    - [0, 9.005]
  - - [2112, 2112, 1, 1024, 2112, 2112, 1024, 1024]
    - [0, 9.109]
  - - [2240, 2112, 1, 1024, 2240, 2240, 1024, 1024]
    - [0, 9.057]
  - - [2368, 2112, 1, 1024, 2368, 2368, 1024, 1024]
    - [0, 9.122]
  - - [2496, 2112, 1, 1024, 2496, 2496, 1024, 1024]
    - [0, 9.114]
  - - [2624, 2112, 1, 1024, 2624, 2624, 1024, 1024]
    - [0, 9.135]
  - - [2752, 2112, 1, 1024, 2752, 2752, 1024, 1024]
    - [0, 9.156]
  - - [2880, 2112, 1, 1024, 2880, 2880, 1024, 1024]
    - [0, 9.187]
  - - [3008, 2112, 1, 1024, 3008, 3008, 1024, 1024]
    - [0, 9.311]
  - - [3136, 2112, 1, 1024, 3136, 3136, 1024, 1024]
    - [0, 9.265]
  - - [3264, 2112, 1, 1024, 3264, 3264, 1024, 1024]
    - [0, 9.284]
  - - [3392, 2112, 1, 1024, 3392, 3392, 1024, 1024]
    - [0, 9.352]
  - - [3520, 2112, 1, 1024, 3520, 3520, 1024, 1024]
    - [0, 9.372]
  - - [3648, 2112, 1, 1024, 3648, 3648, 1024, 1024]
    - [0, 9.366]
  - - [3776, 2112, 1, 1024, 3776, 3776, 1024, 1024]
    - [0, 9.348]
  - - [3904, 2112, 1, 1024, 3904, 3904, 1024, 1024]
    - [0, 9.281]
  - - [4032, 2112, 1, 1024, 4032, 4032, 1024, 1024]
    - [0, 9.138]
  - - [64, 2240, 1, 1024, 64, 64, 1024, 1024]
    - [0, 7.196]
  - - [192, 2240, 1, 1024, 192, 192, 1024, 1024]
    - [0, 8.43]
  - - [320, 2240, 1, 1024, 320, 320, 1024, 1024]
    - [0, 8.157]
  - - [448, 2240, 1, 1024, 448, 448, 1024, 1024]
    - [0, 8.51]
  - - [576, 2240, 1, 1024, 576, 576, 1024, 1024]
    - [0, 8.636]
  - - [704, 2240, 1, 1024, 704, 704, 1024, 1024]
    - [0, 8.678]
  - - [832, 2240, 1, 1024, 832, 832, 1024, 1024]
    - [0, 8.772]
  - - [960, 2240, 1, 1024, 960, 960, 1024, 1024]
    - [0, 8.838]
  - - [1088, 2240, 1, 1024, 1088, 1088, 1024, 1024]
    - [0, 8.815]
  - - [1216, 2240, 1, 1024, 1216, 1216, 1024, 1024]
    - [0, 8.789]
  - - [1344, 2240, 1, 1024, 1344, 1344, 1024, 1024]
    - [0, 8.926]
  - - [1472, 2240, 1, 1024, 1472, 1472, 1024, 1024]
    - [0, 8.911]
  - - [1600, 2240, 1, 1024, 1600, 1600, 1024, 1024]
    - [0, 8.999]
  - - [1728, 2240, 1, 1024, 1728, 1728, 1024, 1024]
    - [0, 9.038]
  - - [1856, 2240, 1, 1024, 1856, 1856, 1024, 1024]
    - [0, 9.035]
  - - [1984, 2240, 1, 1024, 1984, 1984, 1024, 1024]
    - [0, 9.117]
  - - [2112, 2240, 1, 1024, 2112, 2112, 1024, 1024]
    - [0, 9.088]
  - - [2240, 2240, 1, 1024, 2240, 2240, 1024, 1024]
    - [0, 9.141]
  - - [2368, 2240, 1, 1024, 2368, 2368, 1024, 1024]
    - [0, 9.158]
  - - [2496, 2240, 1, 1024, 2496, 2496, 1024, 1024]
    - [0, 9.113]
  - - [2624, 2240, 1, 1024, 2624, 2624, 1024, 1024]
    - [0, 9.18]
  - - [2752, 2240, 1, 1024, 2752, 2752, 1024, 1024]
    - [0, 9.244]
  - - [2880, 2240, 1, 1024, 2880, 2880, 1024, 1024]
    - [0, 9.296]
  - - [3008, 2240, 1, 1024, 3008, 3008, 1024, 1024]
    - [0, 9.27]
  - - [3136, 2240, 1, 1024, 3136, 3136, 1024, 1024]
    - [0, 9.315]
  - - [3264, 2240, 1, 1024, 3264, 3264, 1024, 1024]
    - [0, 9.309]
  - - [3392, 2240, 1, 1024, 3392, 3392, 1024, 1024]
    - [0, 9.337]
  - - [3520, 2240, 1, 1024, 3520, 3520, 1024, 1024]
    - [0, 9.372]
  - - [3648, 2240, 1, 1024, 3648, 3648, 1024, 1024]
    - [0, 9.313]
  - - [3776, 2240, 1, 1024, 3776, 3776, 1024, 1024]
    - [0, 9.344]
  - - [3904, 2240, 1, 1024, 3904, 3904, 1024, 1024]
    - [0, 9.266]
  - - [4032, 2240, 1, 1024, 4032, 4032, 1024, 1024]
    - [0, 9.152]
  - - [64, 2368, 1, 1024, 64, 64, 1024, 1024]
    - [0, 5.975]
  - - [192, 2368, 1, 1024, 192, 192, 1024, 1024]
    - [0, 8.053]
  - - [320, 2368, 1, 1024, 320, 320, 1024, 1024]
    - [0, 8.259]
  - - [448, 2368, 1, 1024, 448, 448, 1024, 1024]
    - [0, 8.555]
  - - [576, 2368, 1, 1024, 576, 576, 1024, 1024]
    - [0, 8.636]
  - - [704, 2368, 1, 1024, 704, 704, 1024, 1024]
    - [0, 8.801]
  - - [832, 2368, 1, 1024, 832, 832, 1024, 1024]
    - [0, 8.807]
  - - [960, 2368, 1, 1024, 960, 960, 1024, 1024]
    - [0, 8.906]
  - - [1088, 2368, 1, 1024, 1088, 1088, 1024, 1024]
    - [0, 8.889]
  - - [1216, 2368, 1, 1024, 1216, 1216, 1024, 1024]
    - [0, 8.895]
  - - [1344, 2368, 1, 1024, 1344, 1344, 1024, 1024]
    - [0, 8.962]
  - - [1472, 2368, 1, 1024, 1472, 1472, 1024, 1024]
    - [0, 8.994]
  - - [1600, 2368, 1, 1024, 1600, 1600, 1024, 1024]
    - [0, 8.961]
  - - [1728, 2368, 1, 1024, 1728, 1728, 1024, 1024]
    - [0, 9.064]
  - - [1856, 2368, 1, 1024, 1856, 1856, 1024, 1024]
    - [0, 9.082]
  - - [1984, 2368, 1, 1024, 1984, 1984, 1024, 1024]
    - [0, 9.072]
  - - [2112, 2368, 1, 1024, 2112, 2112, 1024, 1024]
    - [0, 9.174]
  - - [2240, 2368, 1, 1024, 2240, 2240, 1024, 1024]
    - [0, 9.173]
  - - [2368, 2368, 1, 1024, 2368, 2368, 1024, 1024]
    - [0, 9.144]
  - - [2496, 2368, 1, 1024, 2496, 2496, 1024, 1024]
    - [0, 9.193]
  - - [2624, 2368, 1, 1024, 2624, 2624, 1024, 1024]
    - [0, 9.285]
  - - [2752, 2368, 1, 1024, 2752, 2752, 1024, 1024]
    - [0, 9.269]
  - - [2880, 2368, 1, 1024, 2880, 2880, 1024, 1024]
    - [0, 9.29]
  - - [3008, 2368, 1, 1024, 3008, 3008, 1024, 1024]
    - [0, 9.38]
  - - [3136, 2368, 1, 1024, 3136, 3136, 1024, 1024]
    - [0, 9.307]
  - - [3264, 2368, 1, 1024, 3264, 3264, 1024, 1024]
    - [0, 9.347]
  - - [3392, 2368, 1, 1024, 3392, 3392, 1024, 1024]
    - [0, 9.316]
  - - [3520, 2368, 1, 1024, 3520, 3520, 1024, 1024]
    - [0, 9.275]
  - - [3648, 2368, 1, 1024, 3648, 3648, 1024, 1024]
    - [0, 9.349]
  - - [3776, 2368, 1, 1024, 3776, 3776, 1024, 1024]
    - [0, 9.292]
  - - [3904, 2368, 1, 1024, 3904, 3904, 1024, 1024]
    - [0, 9.319]
  - - [4032, 2368, 1, 1024, 4032, 4032, 1024, 1024]
    - [0, 9.225]
  - - [64, 2496, 1, 1024, 64, 64, 1024, 1024]
    - [0, 6.25]
  - - [192, 2496, 1, 1024, 192, 192, 1024, 1024]
    - [0, 8.243]
  - - [320, 2496, 1, 1024, 320, 320, 1024, 1024]
    - [0, 8.192]
  - - [448, 2496, 1, 1024, 448, 448, 1024, 1024]
    - [0, 8.601]
  - - [576, 2496, 1, 1024, 576, 576, 1024, 1024]
    - [0, 8.579]
  - - [704, 2496, 1, 1024, 704, 704, 1024, 1024]
    - [0, 8.719]
  - - [832, 2496, 1, 1024, 832, 832, 1024, 1024]
    - [0, 8.731]
  - - [960, 2496, 1, 1024, 960, 960, 1024, 1024]
    - [0, 8.805]
  - - [1088, 2496, 1, 1024, 1088, 1088, 1024, 1024]
    - [0, 8.771]
  - - [1216, 2496, 1, 1024, 1216, 1216, 1024, 1024]
    - [0, 8.895]
  - - [1344, 2496, 1, 1024, 1344, 1344, 1024, 1024]
    - [0, 8.914]
  - - [1472, 2496, 1, 1024, 1472, 1472, 1024, 1024]
    - [0, 8.94]
  - - [1600, 2496, 1, 1024, 1600, 1600, 1024, 1024]
    - [0, 9.021]
  - - [1728, 2496, 1, 1024, 1728, 1728, 1024, 1024]
    - [0, 9.039]
  - - [1856, 2496, 1, 1024, 1856, 1856, 1024, 1024]
    - [0, 9.07]
  - - [1984, 2496, 1, 1024, 1984, 1984, 1024, 1024]
    - [0, 9.088]
  - - [2112, 2496, 1, 1024, 2112, 2112, 1024, 1024]
    - [0, 9.146]
  - - [2240, 2496, 1, 1024, 2240, 2240, 1024, 1024]
    - [0, 9.162]
  - - [2368, 2496, 1, 1024, 2368, 2368, 1024, 1024]
    - [0, 9.065]
  - - [2496, 2496, 1, 1024, 2496, 2496, 1024, 1024]
    - [0, 9.256]
  - - [2624, 2496, 1, 1024, 2624, 2624, 1024, 1024]
    - [0, 9.3]
  - - [2752, 2496, 1, 1024, 2752, 2752, 1024, 1024]
    - [0, 9.271]
  - - [2880, 2496, 1, 1024, 2880, 2880, 1024, 1024]
    - [0, 9.292]
  - - [3008, 2496, 1, 1024, 3008, 3008, 1024, 1024]
    - [0, 9.292]
  - - [3136, 2496, 1, 1024, 3136, 3136, 1024, 1024]
    - [0, 9.346]
  - - [3264, 2496, 1, 1024, 3264, 3264, 1024, 1024]
    - [0, 9.379]
  - - [3392, 2496, 1, 1024, 3392, 3392, 1024, 1024]
    - [0, 9.296]
  - - [3520, 2496, 1, 1024, 3520, 3520, 1024, 1024]
    - [0, 9.289]
  - - [3648, 2496, 1, 1024, 3648, 3648, 1024, 1024]
    - [0, 9.246]
  - - [3776, 2496, 1, 1024, 3776, 3776, 1024, 1024]
    - [0, 9.295]
  - - [3904, 2496, 1, 1024, 3904, 3904, 1024, 1024]
    - [0, 9.149]
  - - [4032, 2496, 1, 1024, 4032, 4032, 1024, 1024]
    - [0, 9.167]
  - - [64, 2624, 1, 1024, 64, 64, 1024, 1024]
    - [0, 6.551]
  - - [192, 2624, 1, 1024, 192, 192, 1024, 1024]
    - [0, 8.017]
  - - [320, 2624, 1, 1024, 320, 320, 1024, 1024]
    - [0, 8.49]
  - - [448, 2624, 1, 1024, 448, 448, 1024, 1024]
    - [0, 8.632]
  - - [576, 2624, 1, 1024, 576, 576, 1024, 1024]
    - [0, 8.698]
  - - [704, 2624, 1, 1024, 704, 704, 1024, 1024]
    - [0, 8.739]
  - - [832, 2624, 1, 1024, 832, 832, 1024, 1024]
    - [0, 8.766]
  - - [960, 2624, 1, 1024, 960, 960, 1024, 1024]
    - [0, 8.758]
  - - [1088, 2624, 1, 1024, 1088, 1088, 1024, 1024]
    - [0, 8.899]
  - - [1216, 2624, 1, 1024, 1216, 1216, 1024, 1024]
    - [0, 8.959]
  - - [1344, 2624, 1, 1024, 1344, 1344, 1024, 1024]
    - [0, 8.976]
  - - [1472, 2624, 1, 1024, 1472, 1472, 1024, 1024]
    - [0, 9.045]
  - - [1600, 2624, 1, 1024, 1600, 1600, 1024, 1024]
    - [0, 9.043]
  - - [1728, 2624, 1, 1024, 1728, 1728, 1024, 1024]
    - [0, 9.08]
  - - [1856, 2624, 1, 1024, 1856, 1856, 1024, 1024]
    - [0, 9.129]
  - - [1984, 2624, 1, 1024, 1984, 1984, 1024, 1024]
    - [0, 9.004]
  - - [2112, 2624, 1, 1024, 2112, 2112, 1024, 1024]
    - [0, 9.148]
  - - [2240, 2624, 1, 1024, 2240, 2240, 1024, 1024]
    - [0, 9.22]
  - - [2368, 2624, 1, 1024, 2368, 2368, 1024, 1024]
    - [0, 9.214]
  - - [2496, 2624, 1, 1024, 2496, 2496, 1024, 1024]
    - [0, 9.268]
  - - [2624, 2624, 1, 1024, 2624, 2624, 1024, 1024]
    - [0, 9.28]
  - - [2752, 2624, 1, 1024, 2752, 2752, 1024, 1024]
    - [0, 9.292]
  - - [2880, 2624, 1, 1024, 2880, 2880, 1024, 1024]
    - [0, 9.234]
  - - [3008, 2624, 1, 1024, 3008, 3008, 1024, 1024]
    - [0, 9.347]
  - - [3136, 2624, 1, 1024, 3136, 3136, 1024, 1024]
    - [0, 9.353]
  - - [3264, 2624, 1, 1024, 3264, 3264, 1024, 1024]
    - [0, 9.254]
  - - [3392, 2624, 1, 1024, 3392, 3392, 1024, 1024]
    - [0, 9.26]
  - - [3520, 2624, 1, 1024, 3520, 3520, 1024, 1024]
    - [0, 9.24]
  - - [3648, 2624, 1, 1024, 3648, 3648, 1024, 1024]
    - [0, 9.144]
  - - [3776, 2624, 1, 1024, 3776, 3776, 1024, 1024]
    - [0, 9.171]
  - - [3904, 2624, 1, 1024, 3904, 3904, 1024, 1024]
    - [0, 9.123]
  - - [4032, 2624, 1, 1024, 4032, 4032, 1024, 1024]
    - [0, 9.083]
  - - [64, 2752, 1, 1024, 64, 64, 1024, 1024]
    - [0, 6.857]
  - - [192, 2752, 1, 1024, 192, 192, 1024, 1024]
    - [0, 8.264]
  - - [320, 2752, 1, 1024, 320, 320, 1024, 1024]
    - [0, 8.597]
  - - [448, 2752, 1, 1024, 448, 448, 1024, 1024]
    - [0, 8.689]
  - - [576, 2752, 1, 1024, 576, 576, 1024, 1024]
    - [0, 8.817]
  - - [704, 2752, 1, 1024, 704, 704, 1024, 1024]
    - [0, 8.798]
  - - [832, 2752, 1, 1024, 832, 832, 1024, 1024]
    - [0, 8.802]
  - - [960, 2752, 1, 1024, 960, 960, 1024, 1024]
    - [0, 8.878]
  - - [1088, 2752, 1, 1024, 1088, 1088, 1024, 1024]
    - [0, 8.918]
  - - [1216, 2752, 1, 1024, 1216, 1216, 1024, 1024]
    - [0, 8.998]
  - - [1344, 2752, 1, 1024, 1344, 1344, 1024, 1024]
    - [0, 9.01]
  - - [1472, 2752, 1, 1024, 1472, 1472, 1024, 1024]
    - [0, 9.067]
  - - [1600, 2752, 1, 1024, 1600, 1600, 1024, 1024]
    - [0, 9.023]
  - - [1728, 2752, 1, 1024, 1728, 1728, 1024, 1024]
    - [0, 9.057]
  - - [1856, 2752, 1, 1024, 1856, 1856, 1024, 1024]
    - [0, 9.149]
  - - [1984, 2752, 1, 1024, 1984, 1984, 1024, 1024]
    - [0, 9.112]
  - - [2112, 2752, 1, 1024, 2112, 2112, 1024, 1024]
    - [0, 9.177]
  - - [2240, 2752, 1, 1024, 2240, 2240, 1024, 1024]
    - [0, 9.205]
  - - [2368, 2752, 1, 1024, 2368, 2368, 1024, 1024]
    - [0, 9.222]
  - - [2496, 2752, 1, 1024, 2496, 2496, 1024, 1024]
    - [0, 9.271]
  - - [2624, 2752, 1, 1024, 2624, 2624, 1024, 1024]
    - [0, 9.299]
  - - [2752, 2752, 1, 1024, 2752, 2752, 1024, 1024]
    - [0, 9.356]
  - - [2880, 2752, 1, 1024, 2880, 2880, 1024, 1024]
    - [0, 9.348]
  - - [3008, 2752, 1, 1024, 3008, 3008, 1024, 1024]
    - [0, 9.393]
  - - [3136, 2752, 1, 1024, 3136, 3136, 1024, 1024]
    - [0, 9.345]
  - - [3264, 2752, 1, 1024, 3264, 3264, 1024, 1024]
    - [0, 9.326]
  - - [3392, 2752, 1, 1024, 3392, 3392, 1024, 1024]
    - [0, 9.099]
  - - [3520, 2752, 1, 1024, 3520, 3520, 1024, 1024]
    - [0, 9.119]
  - - [3648, 2752, 1, 1024, 3648, 3648, 1024, 1024]
    - [0, 9.139]
  - - [3776, 2752, 1, 1024, 3776, 3776, 1024, 1024]
    - [0, 9.175]
  - - [3904, 2752, 1, 1024, 3904, 3904, 1024, 1024]
    - [0, 9.135]
  - - [4032, 2752, 1, 1024, 4032, 4032, 1024, 1024]
    - [0, 9.358]
  - - [64, 2880, 1, 1024, 64, 64, 1024, 1024]
    - [0, 7.156]
  - - [192, 2880, 1, 1024, 192, 192, 1024, 1024]
    - [0, 8.148]
  - - [320, 2880, 1, 1024, 320, 320, 1024, 1024]
    - [0, 8.493]
  - - [448, 2880, 1, 1024, 448, 448, 1024, 1024]
    - [0, 8.791]
  - - [576, 2880, 1, 1024, 576, 576, 1024, 1024]
    - [0, 8.758]
  - - [704, 2880, 1, 1024, 704, 704, 1024, 1024]
    - [0, 8.887]
  - - [832, 2880, 1, 1024, 832, 832, 1024, 1024]
    - [0, 8.83]
  - - [960, 2880, 1, 1024, 960, 960, 1024, 1024]
    - [0, 8.931]
  - - [1088, 2880, 1, 1024, 1088, 1088, 1024, 1024]
    - [0, 8.877]
  - - [1216, 2880, 1, 1024, 1216, 1216, 1024, 1024]
    - [0, 8.928]
  - - [1344, 2880, 1, 1024, 1344, 1344, 1024, 1024]
    - [0, 9.006]
  - - [1472, 2880, 1, 1024, 1472, 1472, 1024, 1024]
    - [0, 8.963]
  - - [1600, 2880, 1, 1024, 1600, 1600, 1024, 1024]
    - [0, 9.095]
  - - [1728, 2880, 1, 1024, 1728, 1728, 1024, 1024]
    - [0, 9.106]
  - - [1856, 2880, 1, 1024, 1856, 1856, 1024, 1024]
    - [0, 9.125]
  - - [1984, 2880, 1, 1024, 1984, 1984, 1024, 1024]
    - [0, 9.143]
  - - [2112, 2880, 1, 1024, 2112, 2112, 1024, 1024]
    - [0, 9.281]
  - - [2240, 2880, 1, 1024, 2240, 2240, 1024, 1024]
    - [0, 9.245]
  - - [2368, 2880, 1, 1024, 2368, 2368, 1024, 1024]
    - [0, 9.33]
  - - [2496, 2880, 1, 1024, 2496, 2496, 1024, 1024]
    - [0, 9.295]
  - - [2624, 2880, 1, 1024, 2624, 2624, 1024, 1024]
    - [0, 9.344]
  - - [2752, 2880, 1, 1024, 2752, 2752, 1024, 1024]
    - [0, 9.354]
  - - [2880, 2880, 1, 1024, 2880, 2880, 1024, 1024]
    - [0, 9.232]
  - - [3008, 2880, 1, 1024, 3008, 3008, 1024, 1024]
    - [0, 9.219]
  - - [3136, 2880, 1, 1024, 3136, 3136, 1024, 1024]
    - [0, 9.181]
  - - [3264, 2880, 1, 1024, 3264, 3264, 1024, 1024]
    - [0, 9.18]
  - - [3392, 2880, 1, 1024, 3392, 3392, 1024, 1024]
    - [0, 9.127]
  - - [3520, 2880, 1, 1024, 3520, 3520, 1024, 1024]
    - [0, 9.112]
  - - [3648, 2880, 1, 1024, 3648, 3648, 1024, 1024]
    - [0, 9.234]
  - - [3776, 2880, 1, 1024, 3776, 3776, 1024, 1024]
    - [0, 9.15]
  - - [3904, 2880, 1, 1024, 3904, 3904, 1024, 1024]
    - [0, 9.151]
  - - [4032, 2880, 1, 1024, 4032, 4032, 1024, 1024]
    - [0, 9.221]
  - - [64, 3008, 1, 1024, 64, 64, 1024, 1024]
    - [0, 7.448]
  - - [192, 3008, 1, 1024, 192, 192, 1024, 1024]
    - [0, 8.214]
  - - [320, 3008, 1, 1024, 320, 320, 1024, 1024]
    - [0, 8.466]
  - - [448, 3008, 1, 1024, 448, 448, 1024, 1024]
    - [0, 8.585]
  - - [576, 3008, 1, 1024, 576, 576, 1024, 1024]
    - [0, 8.62]
  - - [704, 3008, 1, 1024, 704, 704, 1024, 1024]
    - [0, 8.66]
  - - [832, 3008, 1, 1024, 832, 832, 1024, 1024]
    - [0, 8.615]
  - - [960, 3008, 1, 1024, 960, 960, 1024, 1024]
    - [0, 8.85]
  - - [1088, 3008, 1, 1024, 1088, 1088, 1024, 1024]
    - [0, 8.921]
  - - [1216, 3008, 1, 1024, 1216, 1216, 1024, 1024]
    - [0, 8.986]
  - - [1344, 3008, 1, 1024, 1344, 1344, 1024, 1024]
    - [0, 9.087]
  - - [1472, 3008, 1, 1024, 1472, 1472, 1024, 1024]
    - [0, 9.06]
  - - [1600, 3008, 1, 1024, 1600, 1600, 1024, 1024]
    - [0, 9.08]
  - - [1728, 3008, 1, 1024, 1728, 1728, 1024, 1024]
    - [0, 9.133]
  - - [1856, 3008, 1, 1024, 1856, 1856, 1024, 1024]
    - [0, 9.176]
  - - [1984, 3008, 1, 1024, 1984, 1984, 1024, 1024]
    - [0, 9.218]
  - - [2112, 3008, 1, 1024, 2112, 2112, 1024, 1024]
    - [0, 9.26]
  - - [2240, 3008, 1, 1024, 2240, 2240, 1024, 1024]
    - [0, 9.291]
  - - [2368, 3008, 1, 1024, 2368, 2368, 1024, 1024]
    - [0, 9.316]
  - - [2496, 3008, 1, 1024, 2496, 2496, 1024, 1024]
    - [0, 9.319]
  - - [2624, 3008, 1, 1024, 2624, 2624, 1024, 1024]
    - [0, 9.324]
  - - [2752, 3008, 1, 1024, 2752, 2752, 1024, 1024]
    - [0, 9.298]
  - - [2880, 3008, 1, 1024, 2880, 2880, 1024, 1024]
    - [0, 9.245]
  - - [3008, 3008, 1, 1024, 3008, 3008, 1024, 1024]
    - [0, 9.199]
  - - [3136, 3008, 1, 1024, 3136, 3136, 1024, 1024]
    - [0, 9.119]
  - - [3264, 3008, 1, 1024, 3264, 3264, 1024, 1024]
    - [0, 9.239]
  - - [3392, 3008, 1, 1024, 3392, 3392, 1024, 1024]
    - [0, 9.143]
  - - [3520, 3008, 1, 1024, 3520, 3520, 1024, 1024]
    - [0, 9.116]
  - - [3648, 3008, 1, 1024, 3648, 3648, 1024, 1024]
    - [0, 9.154]
  - - [3776, 3008, 1, 1024, 3776, 3776, 1024, 1024]
    - [0, 9.168]
  - - [3904, 3008, 1, 1024, 3904, 3904, 1024, 1024]
    - [0, 9.162]
  - - [4032, 3008, 1, 1024, 4032, 4032, 1024, 1024]
    - [0, 9.109]
  - - [64, 3136, 1, 1024, 64, 64, 1024, 1024]
    - [0, 6.573]
  - - [192, 3136, 1, 1024, 192, 192, 1024, 1024]
    - [0, 8.05]
  - - [320, 3136, 1, 1024, 320, 320, 1024, 1024]
    - [0, 8.464]
  - - [448, 3136, 1, 1024, 448, 448, 1024, 1024]
    - [0, 8.629]
  - - [576, 3136, 1, 1024, 576, 576, 1024, 1024]
    - [0, 8.736]
  - - [704, 3136, 1, 1024, 704, 704, 1024, 1024]
    - [0, 8.892]
  - - [832, 3136, 1, 1024, 832, 832, 1024, 1024]
    - [0, 8.903]
  - - [960, 3136, 1, 1024, 960, 960, 1024, 1024]
    - [0, 9.014]
  - - [1088, 3136, 1, 1024, 1088, 1088, 1024, 1024]
    - [0, 8.93]
  - - [1216, 3136, 1, 1024, 1216, 1216, 1024, 1024]
    - [0, 8.993]
  - - [1344, 3136, 1, 1024, 1344, 1344, 1024, 1024]
    - [0, 9.033]
  - - [1472, 3136, 1, 1024, 1472, 1472, 1024, 1024]
    - [0, 9.135]
  - - [1600, 3136, 1, 1024, 1600, 1600, 1024, 1024]
    - [0, 9.119]
  - - [1728, 3136, 1, 1024, 1728, 1728, 1024, 1024]
    - [0, 9.116]
  - - [1856, 3136, 1, 1024, 1856, 1856, 1024, 1024]
    - [0, 9.221]
  - - [1984, 3136, 1, 1024, 1984, 1984, 1024, 1024]
    - [0, 9.215]
  - - [2112, 3136, 1, 1024, 2112, 2112, 1024, 1024]
    - [0, 9.246]
  - - [2240, 3136, 1, 1024, 2240, 2240, 1024, 1024]
    - [0, 9.273]
  - - [2368, 3136, 1, 1024, 2368, 2368, 1024, 1024]
    - [0, 9.344]
  - - [2496, 3136, 1, 1024, 2496, 2496, 1024, 1024]
    - [0, 9.342]
  - - [2624, 3136, 1, 1024, 2624, 2624, 1024, 1024]
    - [0, 9.372]
  - - [2752, 3136, 1, 1024, 2752, 2752, 1024, 1024]
    - [0, 9.187]
  - - [2880, 3136, 1, 1024, 2880, 2880, 1024, 1024]
    - [0, 9.268]
  - - [3008, 3136, 1, 1024, 3008, 3008, 1024, 1024]
    - [0, 9.136]
  - - [3136, 3136, 1, 1024, 3136, 3136, 1024, 1024]
    - [0, 9.153]
  - - [3264, 3136, 1, 1024, 3264, 3264, 1024, 1024]
    - [0, 9.191]
  - - [3392, 3136, 1, 1024, 3392, 3392, 1024, 1024]
    - [0, 9.135]
  - - [3520, 3136, 1, 1024, 3520, 3520, 1024, 1024]
    - [0, 9.17]
  - - [3648, 3136, 1, 1024, 3648, 3648, 1024, 1024]
    - [0, 9.128]
  - - [3776, 3136, 1, 1024, 3776, 3776, 1024, 1024]
    - [0, 9.134]
  - - [3904, 3136, 1, 1024, 3904, 3904, 1024, 1024]
    - [0, 9.193]
  - - [4032, 3136, 1, 1024, 4032, 4032, 1024, 1024]
    - [0, 9.19]
  - - [64, 3264, 1, 1024, 64, 64, 1024, 1024]
    - [0, 6.788]
  - - [192, 3264, 1, 1024, 192, 192, 1024, 1024]
    - [0, 8.365]
  - - [320, 3264, 1, 1024, 320, 320, 1024, 1024]
    - [0, 8.466]
  - - [448, 3264, 1, 1024, 448, 448, 1024, 1024]
    - [0, 8.687]
  - - [576, 3264, 1, 1024, 576, 576, 1024, 1024]
    - [0, 8.753]
  - - [704, 3264, 1, 1024, 704, 704, 1024, 1024]
    - [0, 8.928]
  - - [832, 3264, 1, 1024, 832, 832, 1024, 1024]
    - [0, 8.956]
  - - [960, 3264, 1, 1024, 960, 960, 1024, 1024]
    - [0, 8.917]
  - - [1088, 3264, 1, 1024, 1088, 1088, 1024, 1024]
    - [0, 9.002]
  - - [1216, 3264, 1, 1024, 1216, 1216, 1024, 1024]
    - [0, 9.049]
  - - [1344, 3264, 1, 1024, 1344, 1344, 1024, 1024]
    - [0, 9.094]
  - - [1472, 3264, 1, 1024, 1472, 1472, 1024, 1024]
    - [0, 9.064]
  - - [1600, 3264, 1, 1024, 1600, 1600, 1024, 1024]
    - [0, 9.097]
  - - [1728, 3264, 1, 1024, 1728, 1728, 1024, 1024]
    - [0, 9.15]
  - - [1856, 3264, 1, 1024, 1856, 1856, 1024, 1024]
    - [0, 9.149]
  - - [1984, 3264, 1, 1024, 1984, 1984, 1024, 1024]
    - [0, 9.25]
  - - [2112, 3264, 1, 1024, 2112, 2112, 1024, 1024]
    - [0, 9.289]
  - - [2240, 3264, 1, 1024, 2240, 2240, 1024, 1024]
    - [0, 8.9]
  - - [2368, 3264, 1, 1024, 2368, 2368, 1024, 1024]
    - [0, 9.211]
  - - [2496, 3264, 1, 1024, 2496, 2496, 1024, 1024]
    - [0, 9.327]
  - - [2624, 3264, 1, 1024, 2624, 2624, 1024, 1024]
    - [0, 9.284]
  - - [2752, 3264, 1, 1024, 2752, 2752, 1024, 1024]
    - [0, 9.215]
  - - [2880, 3264, 1, 1024, 2880, 2880, 1024, 1024]
    - [0, 9.158]
  - - [3008, 3264, 1, 1024, 3008, 3008, 1024, 1024]
    - [0, 9.148]
  - - [3136, 3264, 1, 1024, 3136, 3136, 1024, 1024]
    - [0, 9.161]
  - - [3264, 3264, 1, 1024, 3264, 3264, 1024, 1024]
    - [0, 9.183]
  - - [3392, 3264, 1, 1024, 3392, 3392, 1024, 1024]
    - [0, 9.164]
  - - [3520, 3264, 1, 1024, 3520, 3520, 1024, 1024]
    - [0, 9.205]
  - - [3648, 3264, 1, 1024, 3648, 3648, 1024, 1024]
    - [0, 9.192]
  - - [3776, 3264, 1, 1024, 3776, 3776, 1024, 1024]
    - [0, 9.159]
  - - [3904, 3264, 1, 1024, 3904, 3904, 1024, 1024]
    - [0, 9.165]
  - - [4032, 3264, 1, 1024, 4032, 4032, 1024, 1024]
    - [0, 9.178]
  - - [64, 3392, 1, 1024, 64, 64, 1024, 1024]
    - [0, 7.057]
  - - [192, 3392, 1, 1024, 192, 192, 1024, 1024]
    - [0, 8.111]
  - - [320, 3392, 1, 1024, 320, 320, 1024, 1024]
    - [0, 8.771]
  - - [448, 3392, 1, 1024, 448, 448, 1024, 1024]
    - [0, 8.749]
  - - [576, 3392, 1, 1024, 576, 576, 1024, 1024]
    - [0, 8.762]
  - - [704, 3392, 1, 1024, 704, 704, 1024, 1024]
    - [0, 8.784]
  - - [832, 3392, 1, 1024, 832, 832, 1024, 1024]
    - [0, 8.845]
  - - [960, 3392, 1, 1024, 960, 960, 1024, 1024]
    - [0, 8.89]
  - - [1088, 3392, 1, 1024, 1088, 1088, 1024, 1024]
    - [0, 8.998]
  - - [1216, 3392, 1, 1024, 1216, 1216, 1024, 1024]
    - [0, 9.019]
  - - [1344, 3392, 1, 1024, 1344, 1344, 1024, 1024]
    - [0, 9.082]
  - - [1472, 3392, 1, 1024, 1472, 1472, 1024, 1024]
    - [0, 9.07]
  - - [1600, 3392, 1, 1024, 1600, 1600, 1024, 1024]
    - [0, 9.161]
  - - [1728, 3392, 1, 1024, 1728, 1728, 1024, 1024]
    - [0, 9.185]
  - - [1856, 3392, 1, 1024, 1856, 1856, 1024, 1024]
    - [0, 9.233]
  - - [1984, 3392, 1, 1024, 1984, 1984, 1024, 1024]
    - [0, 9.27]
  - - [2112, 3392, 1, 1024, 2112, 2112, 1024, 1024]
    - [0, 9.303]
  - - [2240, 3392, 1, 1024, 2240, 2240, 1024, 1024]
    - [0, 9.337]
  - - [2368, 3392, 1, 1024, 2368, 2368, 1024, 1024]
    - [0, 9.345]
  - - [2496, 3392, 1, 1024, 2496, 2496, 1024, 1024]
    - [0, 9.275]
  - - [2624, 3392, 1, 1024, 2624, 2624, 1024, 1024]
    - [0, 9.288]
  - - [2752, 3392, 1, 1024, 2752, 2752, 1024, 1024]
    - [0, 9.172]
  - - [2880, 3392, 1, 1024, 2880, 2880, 1024, 1024]
    - [0, 9.157]
  - - [3008, 3392, 1, 1024, 3008, 3008, 1024, 1024]
    - [0, 9.146]
  - - [3136, 3392, 1, 1024, 3136, 3136, 1024, 1024]
    - [0, 9.141]
  - - [3264, 3392, 1, 1024, 3264, 3264, 1024, 1024]
    - [0, 9.153]
  - - [3392, 3392, 1, 1024, 3392, 3392, 1024, 1024]
    - [0, 9.194]
  - - [3520, 3392, 1, 1024, 3520, 3520, 1024, 1024]
    - [0, 9.156]
  - - [3648, 3392, 1, 1024, 3648, 3648, 1024, 1024]
    - [0, 9.219]
  - - [3776, 3392, 1, 1024, 3776, 3776, 1024, 1024]
    - [0, 9.148]
  - - [3904, 3392, 1, 1024, 3904, 3904, 1024, 1024]
    - [0, 9.206]
  - - [4032, 3392, 1, 1024, 4032, 4032, 1024, 1024]
    - [0, 9.195]
  - - [64, 3520, 1, 1024, 64, 64, 1024, 1024]
    - [0, 7.271]
  - - [192, 3520, 1, 1024, 192, 192, 1024, 1024]
    - [0, 8.284]
  - - [320, 3520, 1, 1024, 320, 320, 1024, 1024]
    - [0, 8.674]
  - - [448, 3520, 1, 1024, 448, 448, 1024, 1024]
    - [0, 8.653]
  - - [576, 3520, 1, 1024, 576, 576, 1024, 1024]
    - [0, 8.826]
  - - [704, 3520, 1, 1024, 704, 704, 1024, 1024]
    - [0, 8.828]
  - - [832, 3520, 1, 1024, 832, 832, 1024, 1024]
    - [0, 8.887]
  - - [960, 3520, 1, 1024, 960, 960, 1024, 1024]
    - [0, 8.963]
  - - [1088, 3520, 1, 1024, 1088, 1088, 1024, 1024]
    - [0, 9.023]
  - - [1216, 3520, 1, 1024, 1216, 1216, 1024, 1024]
    - [0, 9.064]
  - - [1344, 3520, 1, 1024, 1344, 1344, 1024, 1024]
    - [0, 9.066]
  - - [1472, 3520, 1, 1024, 1472, 1472, 1024, 1024]
    - [0, 9.096]
  - - [1600, 3520, 1, 1024, 1600, 1600, 1024, 1024]
    - [0, 9.155]
  - - [1728, 3520, 1, 1024, 1728, 1728, 1024, 1024]
    - [0, 9.138]
  - - [1856, 3520, 1, 1024, 1856, 1856, 1024, 1024]
    - [0, 9.264]
  - - [1984, 3520, 1, 1024, 1984, 1984, 1024, 1024]
    - [0, 9.262]
