library/src/amd_detail/rocblaslt/src/Tensile/Logic/asm_full/navi31/GridBased/navi31_Cijk_Ailk_Bljk_BBS_BH_Bias_AuxB_HAS_SAV_UserArgs.yaml
- {MinimumRequiredVersion: 4.33.0}
- navi31
- gfx1100
- [Device 73f0]
    SolutionIndex: 0
    SolutionNameMin: Cijk_Ailk_Bljk_BBS_BH_Bias_AuxB_HAS_SAV_UserArgs_MT32x32x32_MI16x16x1_SN_LDSB0_GRVWA2_GRVWB8_GSU1_LBSPPA1024_LBSPPB128_MIWT1_1_NLCA1_SS0_SU32_SUM0_SUS256_TLDS1_WG32_4_1_WGM8
    SolutionIndex: 1
    SolutionNameMin: Cijk_Ailk_Bljk_BBS_BH_Bias_AuxB_HAS_SAV_UserArgs_MT32x32x32_MI16x16x1_SN_LDSB0_GRVWA2_GRVWB1_GSU1_LBSPPA1024_LBSPPB1024_MIWT1_1_NLCA1_SS0_SU32_SUM0_SUS256_TLDS0_WG32_4_1_WGM8
    SolutionIndex: 2
    SolutionNameMin: Cijk_Ailk_Bljk_BBS_BH_Bias_AuxB_HAS_SAV_UserArgs_MT16x64x32_MI16x16x1_SN_LDSB0_GRVWA1_GRVWB8_GSU1_LBSPPA512_LBSPPB2048_MIWT1_1_NLCA1_SS0_SU32_SUM0_SUS256_TLDS0_WG16_8_1_WGM8
    SolutionIndex: 3
    SolutionNameMin: Cijk_Ailk_Bljk_BBS_BH_Bias_AuxB_HAS_SAV_UserArgs_MT16x64x32_MI16x16x1_SN_LDSB0_GRVWA1_GRVWB8_GSU4_LBSPPA512_LBSPPB2048_MIWT1_1_NLCA1_SS0_SU32_SUM0_SUS256_TLDS0_WG16_8_1_WGM8
    SolutionIndex: 4
    SolutionNameMin: Cijk_Ailk_Bljk_BBS_BH_Bias_AuxB_HAS_SAV_UserArgs_MT64x16x64_MI16x16x1_SN_LDSB0_GRVWA1_GRVWB8_GSU1_LBSPPA2048_LBSPPB128_MIWT1_1_NLCA1_SS0_SU32_SUM0_SUS256_TLDS1_WG64_2_1_WGM8
    SolutionIndex: 5
    SolutionNameMin: Cijk_Ailk_Bljk_BBS_BH_Bias_AuxB_HAS_SAV_UserArgs_MT32x32x64_MI16x16x1_SN_LDSB0_GRVWA1_GRVWB8_GSU1_LBSPPA1024_LBSPPB1024_MIWT1_1_NLCA1_SS0_SU32_SUM0_SUS256_TLDS0_WG32_4_1_WGM8
    SolutionIndex: 6
    SolutionNameMin: Cijk_Ailk_Bljk_BBS_BH_Bias_AuxB_HAS_SAV_UserArgs_MT16x64x64_MI16x16x1_SN_LDSB0_GRVWA1_GRVWB8_GSU1_LBSPPA512_LBSPPB2048_MIWT1_1_NLCA1_SS0_SU32_SUM0_SUS256_TLDS0_WG16_8_1_WGM8
    SolutionIndex: 7
    SolutionNameMin: Cijk_Ailk_Bljk_BBS_BH_Bias_AuxB_HAS_SAV_UserArgs_MT64x16x32_MI16x16x1_SN_LDSB0_GRVWA8_GRVWB4_GSU1_LBSPPA2048_LBSPPB512_MIWT1_1_NLCA1_SS1_SU32_SUM0_SUS256_TLDS0_WG64_2_1_WGM8
    SolutionIndex: 8
    SolutionNameMin: Cijk_Ailk_Bljk_BBS_BH_Bias_AuxB_HAS_SAV_UserArgs_MT64x16x32_MI16x16x1_SN_LDSB0_GRVWA8_GRVWB4_GSU1_LBSPPA2048_LBSPPB128_MIWT1_1_NLCA1_SS1_SU32_SUM0_SUS256_TLDS1_WG64_2_1_WGM8
    SolutionIndex: 9
    SolutionNameMin: Cijk_Ailk_Bljk_BBS_BH_Bias_AuxB_HAS_SAV_UserArgs_MT64x16x32_MI16x16x1_SN_LDSB0_GRVWA1_GRVWB4_GSU1_LBSPPA2048_LBSPPB128_MIWT1_1_NLCA1_SS1_SU32_SUM0_SUS256_TLDS1_WG64_2_1_WGM8
    SolutionIndex: 10
    SolutionNameMin: Cijk_Ailk_Bljk_BBS_BH_Bias_AuxB_HAS_SAV_UserArgs_MT64x16x32_MI16x16x1_SN_LDSB0_GRVWA8_GRVWB1_GSU1_LBSPPA2048_LBSPPB512_MIWT1_1_NLCA1_SS1_SU32_SUM0_SUS256_TLDS0_WG64_2_1_WGM8
    SolutionIndex: 11
    SolutionNameMin: Cijk_Ailk_Bljk_BBS_BH_Bias_AuxB_HAS_SAV_UserArgs_MT64x16x32_MI16x16x1_SN_LDSB0_GRVWA8_GRVWB1_GSU1_LBSPPA2048_LBSPPB128_MIWT1_1_NLCA1_SS1_SU32_SUM0_SUS256_TLDS1_WG64_2_1_WGM8
    SolutionIndex: 12
    SolutionNameMin: Cijk_Ailk_Bljk_BBS_BH_Bias_AuxB_HAS_SAV_UserArgs_MT64x16x32_MI16x16x1_SN_LDSB0_GRVWA1_GRVWB1_GSU1_LBSPPA2048_LBSPPB128_MIWT1_1_NLCA1_SS1_SU32_SUM0_SUS256_TLDS1_WG64_2_1_WGM8
    SolutionIndex: 13
    SolutionNameMin: Cijk_Ailk_Bljk_BBS_BH_Bias_AuxB_HAS_SAV_UserArgs_MT64x16x32_MI16x16x1_SN_LDSB0_GRVWA8_GRVWB4_GSU4_LBSPPA2048_LBSPPB128_MIWT1_1_NLCA1_SS1_SU32_SUM0_SUS256_TLDS1_WG64_2_1_WGM8
    SolutionIndex: 14
    SolutionNameMin: Cijk_Ailk_Bljk_BBS_BH_Bias_AuxB_HAS_SAV_UserArgs_MT192x16x32_MI16x16x1_SN_LDSB0_GRVWA8_GRVWB1_GSU1_LBSPPA6144_LBSPPB128_MIWT3_1_NLCA3_SS1_SU32_SUM0_SUS256_TLDS1_WG64_2_1_WGM8
    SolutionIndex: 15
    SolutionNameMin: Cijk_Ailk_Bljk_BBS_BH_Bias_AuxB_HAS_SAV_UserArgs_MT32x32x32_MI16x16x1_SN_LDSB0_GRVWA8_GRVWB8_GSU1_LBSPPA1024_LBSPPB128_MIWT1_1_NLCA1_SS1_SU32_SUM0_SUS256_TLDS1_WG32_4_1_WGM8
    SolutionIndex: 16
    SolutionNameMin: Cijk_Ailk_Bljk_BBS_BH_Bias_AuxB_HAS_SAV_UserArgs_MT32x32x32_MI16x16x1_SN_LDSB0_GRVWA1_GRVWB8_GSU1_LBSPPA1024_LBSPPB128_MIWT1_1_NLCA1_SS1_SU32_SUM0_SUS256_TLDS1_WG32_4_1_WGM8
    SolutionIndex: 17
    SolutionNameMin: Cijk_Ailk_Bljk_BBS_BH_Bias_AuxB_HAS_SAV_UserArgs_MT32x32x32_MI16x16x1_SN_LDSB0_GRVWA8_GRVWB1_GSU1_LBSPPA1024_LBSPPB128_MIWT1_1_NLCA1_SS1_SU32_SUM0_SUS256_TLDS1_WG32_4_1_WGM8
    SolutionIndex: 18
    SolutionNameMin: Cijk_Ailk_Bljk_BBS_BH_Bias_AuxB_HAS_SAV_UserArgs_MT32x32x32_MI16x16x1_SN_LDSB0_GRVWA1_GRVWB1_GSU1_LBSPPA1024_LBSPPB128_MIWT1_1_NLCA1_SS1_SU32_SUM0_SUS256_TLDS1_WG32_4_1_WGM8
    SolutionIndex: 19
    SolutionNameMin: Cijk_Ailk_Bljk_BBS_BH_Bias_AuxB_HAS_SAV_UserArgs_MT32x32x32_MI16x16x1_SN_LDSB0_GRVWA8_GRVWB8_GSU4_LBSPPA1024_LBSPPB128_MIWT1_1_NLCA1_SS1_SU32_SUM0_SUS256_TLDS1_WG32_4_1_WGM8
    SolutionIndex: 20
    SolutionNameMin: Cijk_Ailk_Bljk_BBS_BH_Bias_AuxB_HAS_SAV_UserArgs_MT64x32x32_MI16x16x1_SN_LDSB0_GRVWA8_GRVWB8_GSU1_LBSPPA2048_LBSPPB1024_MIWT2_1_NLCA1_SS1_SU32_SUM0_SUS256_TLDS0_WG32_4_1_WGM8
    SolutionIndex: 21
    SolutionNameMin: Cijk_Ailk_Bljk_BBS_BH_Bias_AuxB_HAS_SAV_UserArgs_MT64x32x32_MI16x16x1_SN_LDSB0_GRVWA8_GRVWB8_GSU1_LBSPPA2048_LBSPPB128_MIWT2_1_NLCA1_SS1_SU32_SUM0_SUS256_TLDS1_WG32_4_1_WGM8
    SolutionIndex: 22
    SolutionNameMin: Cijk_Ailk_Bljk_BBS_BH_Bias_AuxB_HAS_SAV_UserArgs_MT64x32x32_MI16x16x1_SN_LDSB0_GRVWA1_GRVWB8_GSU1_LBSPPA2048_LBSPPB1024_MIWT2_1_NLCA1_SS1_SU32_SUM0_SUS256_TLDS0_WG32_4_1_WGM8
    SolutionIndex: 23
    SolutionNameMin: Cijk_Ailk_Bljk_BBS_BH_Bias_AuxB_HAS_SAV_UserArgs_MT64x32x32_MI16x16x1_SN_LDSB0_GRVWA1_GRVWB8_GSU1_LBSPPA2048_LBSPPB128_MIWT2_1_NLCA1_SS1_SU32_SUM0_SUS256_TLDS1_WG32_4_1_WGM8
    SolutionIndex: 24
    SolutionNameMin: Cijk_Ailk_Bljk_BBS_BH_Bias_AuxB_HAS_SAV_UserArgs_MT64x32x32_MI16x16x1_SN_LDSB0_GRVWA8_GRVWB1_GSU1_LBSPPA2048_LBSPPB1024_MIWT2_1_NLCA1_SS1_SU32_SUM0_SUS256_TLDS0_WG32_4_1_WGM8
    SolutionIndex: 25
    SolutionNameMin: Cijk_Ailk_Bljk_BBS_BH_Bias_AuxB_HAS_SAV_UserArgs_MT64x32x32_MI16x16x1_SN_LDSB0_GRVWA8_GRVWB1_GSU1_LBSPPA2048_LBSPPB128_MIWT2_1_NLCA1_SS1_SU32_SUM0_SUS256_TLDS1_WG32_4_1_WGM8
    SolutionIndex: 26
    SolutionNameMin: Cijk_Ailk_Bljk_BBS_BH_Bias_AuxB_HAS_SAV_UserArgs_MT64x32x32_MI16x16x1_SN_LDSB0_GRVWA1_GRVWB1_GSU1_LBSPPA2048_LBSPPB128_MIWT2_1_NLCA1_SS1_SU32_SUM0_SUS256_TLDS1_WG32_4_1_WGM8
    SolutionIndex: 27
    SolutionNameMin: Cijk_Ailk_Bljk_BBS_BH_Bias_AuxB_HAS_SAV_UserArgs_MT64x32x32_MI16x16x1_SN_LDSB0_GRVWA8_GRVWB8_GSU4_LBSPPA2048_LBSPPB128_MIWT2_1_NLCA1_SS1_SU32_SUM0_SUS256_TLDS1_WG32_4_1_WGM8
    SolutionIndex: 28
    SolutionNameMin: Cijk_Ailk_Bljk_BBS_BH_Bias_AuxB_HAS_SAV_UserArgs_MT96x32x32_MI16x16x1_SN_LDSB0_GRVWA8_GRVWB8_GSU1_LBSPPA3072_LBSPPB128_MIWT3_1_NLCA3_SS1_SU32_SUM0_SUS256_TLDS1_WG32_4_1_WGM8
    SolutionIndex: 29
    SolutionNameMin: Cijk_Ailk_Bljk_BBS_BH_Bias_AuxB_HAS_SAV_UserArgs_MT96x32x32_MI16x16x1_SN_LDSB0_GRVWA8_GRVWB1_GSU1_LBSPPA3072_LBSPPB128_MIWT3_1_NLCA3_SS1_SU32_SUM0_SUS256_TLDS1_WG32_4_1_WGM8
    SolutionIndex: 30
    SolutionNameMin: Cijk_Ailk_Bljk_BBS_BH_Bias_AuxB_HAS_SAV_UserArgs_MT96x32x32_MI16x16x1_SN_LDSB0_GRVWA8_GRVWB8_GSU4_LBSPPA3072_LBSPPB128_MIWT3_1_NLCA3_SS1_SU32_SUM0_SUS256_TLDS1_WG32_4_1_WGM8
    SolutionIndex: 31
    SolutionNameMin: Cijk_Ailk_Bljk_BBS_BH_Bias_AuxB_HAS_SAV_UserArgs_MT160x32x32_MI16x16x1_SN_LDSB0_GRVWA8_GRVWB8_GSU1_LBSPPA5120_LBSPPB128_MIWT5_1_NLCA5_SS1_SU32_SUM0_SUS256_TLDS1_WG32_4_1_WGM8
    SolutionIndex: 32
    SolutionNameMin: Cijk_Ailk_Bljk_BBS_BH_Bias_AuxB_HAS_SAV_UserArgs_MT64x48x32_MI16x16x1_SN_LDSB0_GRVWA8_GRVWB4_GSU1_LBSPPA2048_LBSPPB128_MIWT1_3_NLCA1_SS1_SU32_SUM0_SUS256_TLDS1_WG64_2_1_WGM8
    SolutionIndex: 33
    SolutionNameMin: Cijk_Ailk_Bljk_BBS_BH_Bias_AuxB_HAS_SAV_UserArgs_MT64x48x32_MI16x16x1_SN_LDSB0_GRVWA1_GRVWB4_GSU1_LBSPPA2048_LBSPPB128_MIWT1_3_NLCA1_SS1_SU32_SUM0_SUS256_TLDS1_WG64_2_1_WGM8
    SolutionIndex: 34
    SolutionNameMin: Cijk_Ailk_Bljk_BBS_BH_Bias_AuxB_HAS_SAV_UserArgs_MT64x48x32_MI16x16x1_SN_LDSB0_GRVWA8_GRVWB1_GSU1_LBSPPA2048_LBSPPB128_MIWT1_3_NLCA1_SS1_SU32_SUM0_SUS256_TLDS1_WG64_2_1_WGM8
    SolutionIndex: 35
    SolutionNameMin: Cijk_Ailk_Bljk_BBS_BH_Bias_AuxB_HAS_SAV_UserArgs_MT64x48x32_MI16x16x1_SN_LDSB0_GRVWA1_GRVWB1_GSU1_LBSPPA2048_LBSPPB128_MIWT1_3_NLCA1_SS1_SU32_SUM0_SUS256_TLDS1_WG64_2_1_WGM8
    SolutionIndex: 36
    SolutionNameMin: Cijk_Ailk_Bljk_BBS_BH_Bias_AuxB_HAS_SAV_UserArgs_MT128x48x32_MI16x16x1_SN_LDSB0_GRVWA8_GRVWB4_GSU1_LBSPPA4096_LBSPPB1536_MIWT2_3_NLCA1_SS1_SU32_SUM0_SUS256_TLDS0_WG64_2_1_WGM8
    SolutionIndex: 37
    SolutionNameMin: Cijk_Ailk_Bljk_BBS_BH_Bias_AuxB_HAS_SAV_UserArgs_MT128x48x32_MI16x16x1_SN_LDSB0_GRVWA8_GRVWB4_GSU1_LBSPPA4096_LBSPPB128_MIWT2_3_NLCA1_SS1_SU32_SUM0_SUS256_TLDS1_WG64_2_1_WGM8
    SolutionIndex: 38
    SolutionNameMin: Cijk_Ailk_Bljk_BBS_BH_Bias_AuxB_HAS_SAV_UserArgs_MT128x48x32_MI16x16x1_SN_LDSB0_GRVWA8_GRVWB4_GSU2_LBSPPA4096_LBSPPB128_MIWT2_3_NLCA1_SS1_SU32_SUM0_SUS256_TLDS1_WG64_2_1_WGM8
    SolutionIndex: 39
    SolutionNameMin: Cijk_Ailk_Bljk_BBS_BH_Bias_AuxB_HAS_SAV_UserArgs_MT128x48x32_MI16x16x1_SN_LDSB0_GRVWA8_GRVWB4_GSU4_LBSPPA4096_LBSPPB128_MIWT2_3_NLCA1_SS1_SU32_SUM0_SUS256_TLDS1_WG64_2_1_WGM8
    SolutionIndex: 40
    SolutionNameMin: Cijk_Ailk_Bljk_BBS_BH_Bias_AuxB_HAS_SAV_UserArgs_MT16x64x32_MI16x16x1_SN_LDSB0_GRVWA4_GRVWB8_GSU1_LBSPPA512_LBSPPB2048_MIWT1_1_NLCA1_SS1_SU32_SUM0_SUS256_TLDS0_WG16_8_1_WGM8
    SolutionIndex: 41
    SolutionNameMin: Cijk_Ailk_Bljk_BBS_BH_Bias_AuxB_HAS_SAV_UserArgs_MT16x64x32_MI16x16x1_SN_LDSB0_GRVWA1_GRVWB8_GSU1_LBSPPA512_LBSPPB2048_MIWT1_1_NLCA1_SS1_SU32_SUM0_SUS256_TLDS0_WG16_8_1_WGM8
    SolutionIndex: 42
    SolutionNameMin: Cijk_Ailk_Bljk_BBS_BH_Bias_AuxB_HAS_SAV_UserArgs_MT32x64x32_MI16x16x1_SN_LDSB0_GRVWA1_GRVWB8_GSU1_LBSPPA1024_LBSPPB2048_MIWT2_1_NLCA1_SS1_SU32_SUM0_SUS256_TLDS0_WG16_8_1_WGM8
    SolutionIndex: 43
    SolutionNameMin: Cijk_Ailk_Bljk_BBS_BH_Bias_AuxB_HAS_SAV_UserArgs_MT32x64x32_MI16x16x1_SN_LDSB0_GRVWA8_GRVWB1_GSU1_LBSPPA1024_LBSPPB128_MIWT2_1_NLCA1_SS1_SU32_SUM0_SUS256_TLDS1_WG16_8_1_WGM8
    SolutionIndex: 44
    SolutionNameMin: Cijk_Ailk_Bljk_BBS_BH_Bias_AuxB_HAS_SAV_UserArgs_MT64x80x32_MI16x16x1_SN_LDSB0_GRVWA8_GRVWB4_GSU1_LBSPPA2048_LBSPPB128_MIWT1_5_NLCA1_SS1_SU32_SUM0_SUS256_TLDS1_WG64_2_1_WGM8
    SolutionIndex: 45
    SolutionNameMin: Cijk_Ailk_Bljk_BBS_BH_Bias_AuxB_HAS_SAV_UserArgs_MT32x96x32_MI16x16x1_SN_LDSB0_GRVWA8_GRVWB8_GSU1_LBSPPA1024_LBSPPB128_MIWT1_3_NLCA1_SS1_SU32_SUM0_SUS256_TLDS1_WG32_4_1_WGM8
    SolutionIndex: 46
    SolutionNameMin: Cijk_Ailk_Bljk_BBS_BH_Bias_AuxB_HAS_SAV_UserArgs_MT32x96x32_MI16x16x1_SN_LDSB0_GRVWA1_GRVWB8_GSU1_LBSPPA1024_LBSPPB3072_MIWT1_3_NLCA1_SS1_SU32_SUM0_SUS256_TLDS0_WG32_4_1_WGM8
    SolutionIndex: 47
    SolutionNameMin: Cijk_Ailk_Bljk_BBS_BH_Bias_AuxB_HAS_SAV_UserArgs_MT64x96x32_MI16x16x1_SN_LDSB0_GRVWA8_GRVWB8_GSU1_LBSPPA2048_LBSPPB3072_MIWT2_3_NLCA1_SS1_SU32_SUM0_SUS256_TLDS0_WG32_4_1_WGM8
    SolutionIndex: 48
    SolutionNameMin: Cijk_Ailk_Bljk_BBS_BH_Bias_AuxB_HAS_SAV_UserArgs_MT64x96x32_MI16x16x1_SN_LDSB0_GRVWA8_GRVWB8_GSU1_LBSPPA2048_LBSPPB128_MIWT2_3_NLCA1_SS1_SU32_SUM0_SUS256_TLDS1_WG32_4_1_WGM8
    SolutionIndex: 49
    SolutionNameMin: Cijk_Ailk_Bljk_BBS_BH_Bias_AuxB_HAS_SAV_UserArgs_MT64x96x32_MI16x16x1_SN_LDSB0_GRVWA1_GRVWB8_GSU1_LBSPPA2048_LBSPPB128_MIWT2_3_NLCA1_SS1_SU32_SUM0_SUS256_TLDS1_WG32_4_1_WGM8
    SolutionIndex: 50
    SolutionNameMin: Cijk_Ailk_Bljk_BBS_BH_Bias_AuxB_HAS_SAV_UserArgs_MT64x96x32_MI16x16x1_SN_LDSB0_GRVWA1_GRVWB1_GSU1_LBSPPA2048_LBSPPB128_MIWT2_3_NLCA1_SS1_SU32_SUM0_SUS256_TLDS1_WG32_4_1_WGM8
    SolutionIndex: 51
    SolutionNameMin: Cijk_Ailk_Bljk_BBS_BH_Bias_AuxB_HAS_SAV_UserArgs_MT64x96x32_MI16x16x1_SN_LDSB0_GRVWA8_GRVWB8_GSU2_LBSPPA2048_LBSPPB128_MIWT2_3_NLCA1_SS1_SU32_SUM0_SUS256_TLDS1_WG32_4_1_WGM8
    SolutionIndex: 52
    SolutionNameMin: Cijk_Ailk_Bljk_BBS_BH_Bias_AuxB_HAS_SAV_UserArgs_MT64x96x32_MI16x16x1_SN_LDSB0_GRVWA8_GRVWB8_GSU4_LBSPPA2048_LBSPPB128_MIWT2_3_NLCA1_SS1_SU32_SUM0_SUS256_TLDS1_WG32_4_1_WGM8
    SolutionIndex: 53
    SolutionNameMin: Cijk_Ailk_Bljk_BBS_BH_Bias_AuxB_HAS_SAV_UserArgs_MT64x96x32_MI16x16x1_SN_LDSB0_GRVWA1_GRVWB8_GSU4_LBSPPA2048_LBSPPB128_MIWT2_3_NLCA1_SS1_SU32_SUM0_SUS256_TLDS1_WG32_4_1_WGM8
    SolutionIndex: 54
    SolutionNameMin: Cijk_Ailk_Bljk_BBS_BH_Bias_AuxB_HAS_SAV_UserArgs_MT96x96x32_MI16x16x1_SN_LDSB0_GRVWA8_GRVWB8_GSU1_LBSPPA3072_LBSPPB128_MIWT3_3_NLCA3_SS1_SU32_SUM0_SUS256_TLDS1_WG32_4_1_WGM8
    SolutionIndex: 55
    SolutionNameMin: Cijk_Ailk_Bljk_BBS_BH_Bias_AuxB_HAS_SAV_UserArgs_MT96x96x32_MI16x16x1_SN_LDSB0_GRVWA8_GRVWB8_GSU2_LBSPPA3072_LBSPPB128_MIWT3_3_NLCA3_SS1_SU32_SUM0_SUS256_TLDS1_WG32_4_1_WGM8
    SolutionIndex: 56
    SolutionNameMin: Cijk_Ailk_Bljk_BBS_BH_Bias_AuxB_HAS_SAV_UserArgs_MT96x96x32_MI16x16x1_SN_LDSB0_GRVWA8_GRVWB8_GSU4_LBSPPA3072_LBSPPB128_MIWT3_3_NLCA3_SS1_SU32_SUM0_SUS256_TLDS1_WG32_4_1_WGM8
    SolutionIndex: 57
    SolutionNameMin: Cijk_Ailk_Bljk_BBS_BH_Bias_AuxB_HAS_SAV_UserArgs_MT96x96x32_MI16x16x1_SN_LDSB0_GRVWA1_GRVWB8_GSU4_LBSPPA3072_LBSPPB128_MIWT3_3_NLCA3_SS1_SU32_SUM0_SUS256_TLDS1_WG32_4_1_WGM8
    SolutionIndex: 58
    SolutionNameMin: Cijk_Ailk_Bljk_BBS_BH_Bias_AuxB_HAS_SAV_UserArgs_MT64x112x32_MI16x16x1_SN_LDSB0_GRVWA8_GRVWB4_GSU1_LBSPPA2048_LBSPPB128_MIWT1_7_NLCA1_SS1_SU32_SUM0_SUS256_TLDS1_WG64_2_1_WGM8
    SolutionIndex: 59
    SolutionNameMin: Cijk_Ailk_Bljk_BBS_BH_Bias_AuxB_HAS_SAV_UserArgs_MT64x112x32_MI16x16x1_SN_LDSB0_GRVWA1_GRVWB4_GSU1_LBSPPA2048_LBSPPB128_MIWT1_7_NLCA1_SS1_SU32_SUM0_SUS256_TLDS1_WG64_2_1_WGM8
    SolutionIndex: 60
    SolutionNameMin: Cijk_Ailk_Bljk_BBS_BH_Bias_AuxB_HAS_SAV_UserArgs_MT48x128x32_MI16x16x1_SN_LDSB0_GRVWA4_GRVWB8_GSU1_LBSPPA1536_LBSPPB4096_MIWT3_2_NLCA3_SS1_SU32_SUM0_SUS256_TLDS0_WG16_8_1_WGM8
    SolutionIndex: 61
    SolutionNameMin: Cijk_Ailk_Bljk_BBS_BH_Bias_AuxB_HAS_SAV_UserArgs_MT32x224x32_MI16x16x1_SN_LDSB1_GRVWA1_GRVWB8_GSU1_LBSPPA1024_LBSPPB128_MIWT1_7_NLCA1_SS1_SU32_SUM0_SUS256_TLDS1_WG32_4_1_WGM8
    SolutionIndex: 62
    SolutionNameMin: Cijk_Ailk_Bljk_BBS_BH_Bias_AuxB_HAS_SAV_UserArgs_MT64x16x64_MI16x16x1_SN_LDSB0_GRVWA8_GRVWB8_GSU1_LBSPPA2048_LBSPPB512_MIWT1_1_NLCA1_SS1_SU32_SUM0_SUS256_TLDS0_WG64_2_1_WGM8
    SolutionIndex: 63
    SolutionNameMin: Cijk_Ailk_Bljk_BBS_BH_Bias_AuxB_HAS_SAV_UserArgs_MT64x16x64_MI16x16x1_SN_LDSB0_GRVWA8_GRVWB8_GSU1_LBSPPA2048_LBSPPB128_MIWT1_1_NLCA1_SS1_SU32_SUM0_SUS256_TLDS1_WG64_2_1_WGM8
    SolutionIndex: 64
    SolutionNameMin: Cijk_Ailk_Bljk_BBS_BH_Bias_AuxB_HAS_SAV_UserArgs_MT64x16x64_MI16x16x1_SN_LDSB0_GRVWA8_GRVWB1_GSU1_LBSPPA2048_LBSPPB128_MIWT1_1_NLCA1_SS1_SU32_SUM0_SUS256_TLDS1_WG64_2_1_WGM8
    SolutionIndex: 65
    SolutionNameMin: Cijk_Ailk_Bljk_BBS_BH_Bias_AuxB_HAS_SAV_UserArgs_MT64x16x64_MI16x16x1_SN_LDSB0_GRVWA8_GRVWB8_GSU4_LBSPPA2048_LBSPPB128_MIWT1_1_NLCA1_SS1_SU32_SUM0_SUS256_TLDS1_WG64_2_1_WGM8
    SolutionIndex: 66
    SolutionNameMin: Cijk_Ailk_Bljk_BBS_BH_Bias_AuxB_HAS_SAV_UserArgs_MT32x32x64_MI16x16x1_SN_LDSB0_GRVWA8_GRVWB8_GSU1_LBSPPA1024_LBSPPB1024_MIWT1_1_NLCA1_SS1_SU32_SUM0_SUS256_TLDS0_WG32_4_1_WGM8
    SolutionIndex: 67
    SolutionNameMin: Cijk_Ailk_Bljk_BBS_BH_Bias_AuxB_HAS_SAV_UserArgs_MT64x32x64_MI16x16x1_SN_LDSB0_GRVWA8_GRVWB8_GSU1_LBSPPA2048_LBSPPB1024_MIWT2_1_NLCA1_SS1_SU32_SUM0_SUS256_TLDS0_WG32_4_1_WGM8
    SolutionIndex: 68
    SolutionNameMin: Cijk_Ailk_Bljk_BBS_BH_Bias_AuxB_HAS_SAV_UserArgs_MT64x32x64_MI16x16x1_SN_LDSB0_GRVWA8_GRVWB1_GSU1_LBSPPA2048_LBSPPB128_MIWT2_1_NLCA1_SS1_SU32_SUM0_SUS256_TLDS1_WG32_4_1_WGM8
    SolutionIndex: 69
    SolutionNameMin: Cijk_Ailk_Bljk_BBS_BH_Bias_AuxB_HAS_SAV_UserArgs_MT64x32x64_MI16x16x1_SN_LDSB0_GRVWA8_GRVWB8_GSU4_LBSPPA2048_LBSPPB1024_MIWT2_1_NLCA1_SS1_SU32_SUM0_SUS256_TLDS0_WG32_4_1_WGM8
    SolutionIndex: 70
    SolutionNameMin: Cijk_Ailk_Bljk_BBS_BH_Bias_AuxB_HAS_SAV_UserArgs_MT64x48x64_MI16x16x1_SN_LDSB0_GRVWA8_GRVWB8_GSU1_LBSPPA2048_LBSPPB128_MIWT1_3_NLCA1_SS1_SU32_SUM0_SUS256_TLDS1_WG64_2_1_WGM8
    SolutionIndex: 71
    SolutionNameMin: Cijk_Ailk_Bljk_BBS_BH_Bias_AuxB_HAS_SAV_UserArgs_MT16x64x64_MI16x16x1_SN_LDSB0_GRVWA8_GRVWB8_GSU1_LBSPPA512_LBSPPB2048_MIWT1_1_NLCA1_SS1_SU32_SUM0_SUS256_TLDS0_WG16_8_1_WGM8
    SolutionIndex: 72
    SolutionNameMin: Cijk_Ailk_Bljk_BBS_BH_Bias_AuxB_HAS_SAV_UserArgs_MT32x64x64_MI16x16x1_SN_LDSB0_GRVWA8_GRVWB8_GSU1_LBSPPA1024_LBSPPB2048_MIWT2_1_NLCA1_SS1_SU32_SUM0_SUS256_TLDS0_WG16_8_1_WGM8
- - - [64, 64, 1, 64, 64, 64, 64, 64]
    - [10, 17.9495]
  - - [192, 64, 1, 64, 192, 192, 192, 64]
    - [8, 53.3192]
  - - [320, 64, 1, 64, 320, 320, 320, 64]
    - [11, 92.1452]
  - - [448, 64, 1, 64, 448, 448, 448, 64]
    - [63, 126.426]
  - - [576, 64, 1, 64, 576, 576, 576, 64]
    - [7, 173.868]
  - - [704, 64, 1, 64, 704, 704, 704, 64]
    - [7, 213.686]
  - - [832, 64, 1, 64, 832, 832, 832, 64]
    - [7, 253.289]
  - - [960, 64, 1, 64, 960, 960, 960, 64]
    - [7, 290.529]
  - - [64, 192, 1, 64, 64, 64, 64, 64]
    - [41, 51.6727]
  - - [192, 192, 1, 64, 192, 192, 192, 64]
    - [8, 175.289]
  - - [320, 192, 1, 64, 320, 320, 320, 64]
    - [64, 281.381]
  - - [448, 192, 1, 64, 448, 448, 448, 64]
    - [63, 406.44]
  - - [576, 192, 1, 64, 576, 576, 576, 64]
    - [7, 513.84]
  - - [704, 192, 1, 64, 704, 704, 704, 64]
    - [8, 611.598]
  - - [832, 192, 1, 64, 832, 832, 832, 64]
    - [33, 725.105]
  - - [960, 192, 1, 64, 960, 960, 960, 64]
    - [43, 831.353]
  - - [64, 320, 1, 64, 64, 64, 64, 64]
    - [15, 92.4703]
  - - [192, 320, 1, 64, 192, 192, 192, 64]
    - [7, 287.134]
  - - [320, 320, 1, 64, 320, 320, 320, 64]
    - [8, 491.846]
  - - [448, 320, 1, 64, 448, 448, 448, 64]
    - [7, 650.504]
  - - [576, 320, 1, 64, 576, 576, 576, 64]
    - [8, 822.656]
  - - [704, 320, 1, 64, 704, 704, 704, 64]
    - [22, 1024.04]
  - - [832, 320, 1, 64, 832, 832, 832, 64]
    - [11, 1165.52]
  - - [960, 320, 1, 64, 960, 960, 960, 64]
    - [23, 1249.14]
  - - [64, 448, 1, 64, 64, 64, 64, 64]
    - [66, 121.81]
  - - [192, 448, 1, 64, 192, 192, 192, 64]
    - [8, 398.626]
  - - [320, 448, 1, 64, 320, 320, 320, 64]
    - [20, 631.477]
  - - [448, 448, 1, 64, 448, 448, 448, 64]
    - [7, 889.886]
  - - [576, 448, 1, 64, 576, 576, 576, 64]
    - [7, 1109.55]
  - - [704, 448, 1, 64, 704, 704, 704, 64]
    - [23, 1304.41]
  - - [832, 448, 1, 64, 832, 832, 832, 64]
    - [24, 1468.05]
  - - [960, 448, 1, 64, 960, 960, 960, 64]
    - [23, 1705.45]
  - - [64, 576, 1, 64, 64, 64, 64, 64]
    - [40, 172.406]
  - - [192, 576, 1, 64, 192, 192, 192, 64]
    - [18, 515.336]
  - - [320, 576, 1, 64, 320, 320, 320, 64]
    - [7, 830.475]
  - - [448, 576, 1, 64, 448, 448, 448, 64]
    - [18, 1121.22]
  - - [576, 576, 1, 64, 576, 576, 576, 64]
    - [32, 1370.4]
  - - [704, 576, 1, 64, 704, 704, 704, 64]
    - [46, 1573.39]
  - - [832, 576, 1, 64, 832, 832, 832, 64]
    - [20, 1796.82]
  - - [960, 576, 1, 64, 960, 960, 960, 64]
    - [50, 2130.03]
  - - [64, 704, 1, 64, 64, 64, 64, 64]
    - [7, 207.908]
  - - [192, 704, 1, 64, 192, 192, 192, 64]
    - [26, 620.815]
  - - [320, 704, 1, 64, 320, 320, 320, 64]
    - [72, 1014.31]
  - - [448, 704, 1, 64, 448, 448, 448, 64]
    - [20, 1242.2]
  - - [576, 704, 1, 64, 576, 576, 576, 64]
    - [23, 1617.52]
  - - [704, 704, 1, 64, 704, 704, 704, 64]
    - [42, 1853.37]
  - - [832, 704, 1, 64, 832, 832, 832, 64]
    - [23, 2114.96]
  - - [960, 704, 1, 64, 960, 960, 960, 64]
    - [23, 2389.18]
  - - [64, 832, 1, 64, 64, 64, 64, 64]
    - [7, 251.327]
  - - [192, 832, 1, 64, 192, 192, 192, 64]
    - [7, 716.969]
  - - [320, 832, 1, 64, 320, 320, 320, 64]
    - [40, 1085.66]
  - - [448, 832, 1, 64, 448, 448, 448, 64]
    - [23, 1501.69]
  - - [576, 832, 1, 64, 576, 576, 576, 64]
    - [21, 1867.95]
  - - [704, 832, 1, 64, 704, 704, 704, 64]
    - [23, 2130.59]
  - - [832, 832, 1, 64, 832, 832, 832, 64]
    - [26, 2410.49]
  - - [960, 832, 1, 64, 960, 960, 960, 64]
    - [20, 2698.95]
  - - [64, 960, 1, 64, 64, 64, 64, 64]
    - [7, 287.134]
  - - [192, 960, 1, 64, 192, 192, 192, 64]
    - [16, 806.845]
  - - [320, 960, 1, 64, 320, 320, 320, 64]
    - [21, 1290.97]
  - - [448, 960, 1, 64, 448, 448, 448, 64]
    - [21, 1713.36]
  - - [576, 960, 1, 64, 576, 576, 576, 64]
    - [49, 2038.56]
  - - [704, 960, 1, 64, 704, 704, 704, 64]
    - [49, 2459.77]
  - - [832, 960, 1, 64, 832, 832, 832, 64]
    - [20, 2711.91]
  - - [960, 960, 1, 64, 960, 960, 960, 64]
    - [20, 2938.1]
  - - [64, 64, 1, 256, 64, 64, 64, 256]
    - [8, 66.961]
  - - [192, 64, 1, 256, 192, 192, 192, 256]
    - [11, 204.673]
  - - [320, 64, 1, 256, 320, 320, 320, 256]
    - [15, 356.283]
  - - [448, 64, 1, 256, 448, 448, 448, 256]
    - [8, 491.646]
  - - [576, 64, 1, 256, 576, 576, 576, 256]
    - [8, 666.703]
  - - [704, 64, 1, 256, 704, 704, 704, 256]
    - [15, 812.85]
  - - [832, 64, 1, 256, 832, 832, 832, 256]
    - [15, 945.679]
  - - [960, 64, 1, 256, 960, 960, 960, 256]
    - [11, 1111.56]
  - - [64, 192, 1, 256, 64, 64, 64, 256]
    - [8, 204.8]
  - - [192, 192, 1, 256, 192, 192, 192, 256]
    - [63, 659.735]
  - - [320, 192, 1, 256, 320, 320, 320, 256]
    - [71, 1101.87]
  - - [448, 192, 1, 256, 448, 448, 448, 256]
    - [63, 1426.63]
  - - [576, 192, 1, 256, 576, 576, 576, 256]
    - [8, 1843.2]
  - - [704, 192, 1, 256, 704, 704, 704, 256]
    - [34, 2113.81]
  - - [832, 192, 1, 256, 832, 832, 832, 256]
    - [32, 2547.94]
  - - [960, 192, 1, 256, 960, 960, 960, 256]
    - [70, 2869.32]
  - - [64, 320, 1, 256, 64, 64, 64, 256]
    - [12, 348.491]
  - - [192, 320, 1, 256, 192, 192, 192, 256]
    - [17, 1116.3]
  - - [320, 320, 1, 256, 320, 320, 320, 256]
    - [20, 1645.65]
  - - [448, 320, 1, 256, 448, 448, 448, 256]
    - [15, 2199.0]
  - - [576, 320, 1, 256, 576, 576, 576, 256]
    - [14, 2984.56]
  - - [704, 320, 1, 256, 704, 704, 704, 256]
    - [21, 3265.76]
  - - [832, 320, 1, 256, 832, 832, 832, 256]
    - [44, 3802.37]
  - - [960, 320, 1, 256, 960, 960, 960, 256]
    - [44, 4370.28]
  - - [64, 448, 1, 256, 64, 64, 64, 256]
    - [7, 475.083]
  - - [192, 448, 1, 256, 192, 192, 192, 256]
    - [63, 1490.87]
  - - [320, 448, 1, 256, 320, 320, 320, 256]
    - [15, 2319.2]
  - - [448, 448, 1, 256, 448, 448, 448, 256]
    - [15, 2948.73]
  - - [576, 448, 1, 256, 576, 576, 576, 256]
    - [29, 3721.81]
  - - [704, 448, 1, 256, 704, 704, 704, 256]
    - [21, 4316.51]
  - - [832, 448, 1, 256, 832, 832, 832, 256]
    - [59, 4748.58]
  - - [960, 448, 1, 256, 960, 960, 960, 256]
    - [31, 5659.24]
  - - [64, 576, 1, 256, 64, 64, 64, 256]
    - [8, 650.638]
  - - [192, 576, 1, 256, 192, 192, 192, 256]
    - [8, 1845.06]
  - - [320, 576, 1, 256, 320, 320, 320, 256]
    - [70, 2930.8]
  - - [448, 576, 1, 256, 448, 448, 448, 256]
    - [70, 3840.71]
  - - [576, 576, 1, 256, 576, 576, 576, 256]
    - [48, 4623.55]
  - - [704, 576, 1, 256, 704, 704, 704, 256]
    - [48, 5202.16]
  - - [832, 576, 1, 256, 832, 832, 832, 256]
    - [48, 6061.58]
  - - [960, 576, 1, 256, 960, 960, 960, 256]
    - [48, 7133.35]
  - - [64, 704, 1, 256, 64, 64, 64, 256]
    - [62, 807.161]
  - - [192, 704, 1, 256, 192, 192, 192, 256]
    - [15, 2180.4]
  - - [320, 704, 1, 256, 320, 320, 320, 256]
    - [67, 3340.38]
  - - [448, 704, 1, 256, 448, 448, 448, 256]
    - [21, 4318.94]
  - - [576, 704, 1, 256, 576, 576, 576, 256]
    - [21, 5126.5]
  - - [704, 704, 1, 256, 704, 704, 704, 256]
    - [37, 6094.18]
  - - [832, 704, 1, 256, 832, 832, 832, 256]
    - [21, 6541.02]
  - - [960, 704, 1, 256, 960, 960, 960, 256]
    - [48, 7647.07]
  - - [64, 832, 1, 256, 64, 64, 64, 256]
    - [15, 932.737]
  - - [192, 832, 1, 256, 192, 192, 192, 256]
    - [25, 2510.56]
  - - [320, 832, 1, 256, 320, 320, 320, 256]
    - [32, 3844.4]
  - - [448, 832, 1, 256, 448, 448, 448, 256]
    - [21, 4861.07]
  - - [576, 832, 1, 256, 576, 576, 576, 256]
    - [21, 5896.96]
  - - [704, 832, 1, 256, 704, 704, 704, 256]
    - [21, 6748.57]
  - - [832, 832, 1, 256, 832, 832, 832, 256]
    - [21, 7390.03]
  - - [960, 832, 1, 256, 960, 960, 960, 256]
    - [28, 8370.24]
  - - [64, 960, 1, 256, 64, 64, 64, 256]
    - [62, 1081.08]
  - - [192, 960, 1, 256, 192, 192, 192, 256]
    - [70, 2812.96]
  - - [320, 960, 1, 256, 320, 320, 320, 256]
    - [48, 4412.08]
  - - [448, 960, 1, 256, 448, 448, 448, 256]
    - [48, 5593.26]
  - - [576, 960, 1, 256, 576, 576, 576, 256]
    - [48, 7140.91]
  - - [704, 960, 1, 256, 704, 704, 704, 256]
    - [48, 7973.04]
  - - [832, 960, 1, 256, 832, 832, 832, 256]
    - [32, 8439.33]
  - - [960, 960, 1, 256, 960, 960, 960, 256]
    - [54, 9737.49]
  - - [64, 64, 1, 512, 64, 64, 64, 512]
    - [8, 125.925]
  - - [192, 64, 1, 512, 192, 192, 192, 512]
    - [15, 386.453]
  - - [320, 64, 1, 512, 320, 320, 320, 512]
    - [8, 675.672]
  - - [448, 64, 1, 512, 448, 448, 448, 512]
    - [8, 906.513]
  - - [576, 64, 1, 512, 576, 576, 576, 512]
    - [15, 1233.66]
  - - [704, 64, 1, 512, 704, 704, 704, 512]
    - [63, 1470.84]
  - - [832, 64, 1, 512, 832, 832, 832, 512]
    - [62, 1756.18]
  - - [960, 64, 1, 512, 960, 960, 960, 512]
    - [63, 2008.19]
  - - [64, 192, 1, 512, 64, 64, 64, 512]
    - [15, 389.95]
  - - [192, 192, 1, 512, 192, 192, 192, 512]
    - [63, 1227.64]
  - - [320, 192, 1, 512, 320, 320, 320, 512]
    - [15, 2034.16]
  - - [448, 192, 1, 512, 448, 448, 448, 512]
    - [63, 2599.08]
  - - [576, 192, 1, 512, 576, 576, 576, 512]
    - [20, 3170.48]
  - - [704, 192, 1, 512, 704, 704, 704, 512]
    - [70, 3827.98]
  - - [832, 192, 1, 512, 832, 832, 832, 512]
    - [70, 4585.87]
  - - [960, 192, 1, 512, 960, 960, 960, 512]
    - [70, 5086.2]
  - - [64, 320, 1, 512, 64, 64, 64, 512]
    - [15, 659.938]
  - - [192, 320, 1, 512, 192, 192, 192, 512]
    - [63, 2028.26]
  - - [320, 320, 1, 512, 320, 320, 320, 512]
    - [68, 3022.01]
  - - [448, 320, 1, 512, 448, 448, 448, 512]
    - [15, 3890.92]
  - - [576, 320, 1, 512, 576, 576, 576, 512]
    - [28, 4965.76]
  - - [704, 320, 1, 512, 704, 704, 704, 512]
    - [21, 5545.35]
  - - [832, 320, 1, 512, 832, 832, 832, 512]
    - [44, 6481.92]
  - - [960, 320, 1, 512, 960, 960, 960, 512]
    - [44, 7442.34]
  - - [64, 448, 1, 512, 64, 64, 64, 512]
    - [8, 944.998]
  - - [192, 448, 1, 512, 192, 192, 192, 512]
    - [15, 2657.19]
  - - [320, 448, 1, 512, 320, 320, 320, 512]
    - [15, 3901.26]
  - - [448, 448, 1, 512, 448, 448, 448, 512]
    - [21, 5004.28]
  - - [576, 448, 1, 512, 576, 576, 576, 512]
    - [70, 6350.42]
  - - [704, 448, 1, 512, 704, 704, 704, 512]
    - [48, 7526.83]
  - - [832, 448, 1, 512, 832, 832, 832, 512]
    - [58, 7892.83]
  - - [960, 448, 1, 512, 960, 960, 960, 512]
    - [58, 8928.03]
  - - [64, 576, 1, 512, 64, 64, 64, 512]
    - [63, 1241.82]
  - - [192, 576, 1, 512, 192, 192, 192, 512]
    - [68, 3283.64]
  - - [320, 576, 1, 512, 320, 320, 320, 512]
    - [32, 5171.2]
  - - [448, 576, 1, 512, 448, 448, 448, 512]
    - [70, 6475.07]
  - - [576, 576, 1, 512, 576, 576, 576, 512]
    - [48, 8212.59]
  - - [704, 576, 1, 512, 704, 704, 704, 512]
    - [48, 8790.3]
  - - [832, 576, 1, 512, 832, 832, 832, 512]
    - [48, 10303.5]
  - - [960, 576, 1, 512, 960, 960, 960, 512]
    - [54, 11966.5]
  - - [64, 704, 1, 512, 64, 64, 64, 512]
    - [8, 1497.48]
  - - [192, 704, 1, 512, 192, 192, 192, 512]
    - [63, 3564.75]
  - - [320, 704, 1, 512, 320, 320, 320, 512]
    - [21, 5462.89]
  - - [448, 704, 1, 512, 448, 448, 448, 512]
    - [37, 7392.28]
  - - [576, 704, 1, 512, 576, 576, 576, 512]
    - [28, 8204.79]
  - - [704, 704, 1, 512, 704, 704, 704, 512]
    - [37, 10130.2]
  - - [832, 704, 1, 512, 832, 832, 832, 512]
    - [48, 10597.3]
  - - [960, 704, 1, 512, 960, 960, 960, 512]
    - [37, 12332.5]
  - - [64, 832, 1, 512, 64, 64, 64, 512]
    - [63, 1767.51]
  - - [192, 832, 1, 512, 192, 192, 192, 512]
    - [28, 4228.13]
  - - [320, 832, 1, 512, 320, 320, 320, 512]
    - [70, 6450.03]
  - - [448, 832, 1, 512, 448, 448, 448, 512]
    - [21, 7531.36]
  - - [576, 832, 1, 512, 576, 576, 576, 512]
    - [37, 9675.54]
  - - [704, 832, 1, 512, 704, 704, 704, 512]
    - [21, 9844.17]
  - - [832, 832, 1, 512, 832, 832, 832, 512]
    - [48, 11518.7]
  - - [960, 832, 1, 512, 960, 960, 960, 512]
    - [54, 13234.9]
  - - [64, 960, 1, 512, 64, 64, 64, 512]
    - [15, 1963.69]
  - - [192, 960, 1, 512, 192, 192, 192, 512]
    - [70, 5148.63]
  - - [320, 960, 1, 512, 320, 320, 320, 512]
    - [48, 7611.43]
  - - [448, 960, 1, 512, 448, 448, 448, 512]
    - [48, 9254.28]
  - - [576, 960, 1, 512, 576, 576, 576, 512]
    - [54, 12027.5]
  - - [704, 960, 1, 512, 704, 704, 704, 512]
    - [48, 12972.3]
  - - [832, 960, 1, 512, 832, 832, 832, 512]
    - [54, 13186.0]
  - - [960, 960, 1, 512, 960, 960, 960, 512]
    - [54, 15378.0]
  - - [64, 64, 1, 1024, 64, 64, 64, 1024]
    - [3, 237.174]
  - - [192, 64, 1, 1024, 192, 192, 192, 1024]
    - [65, 725.47]
  - - [320, 64, 1, 1024, 320, 320, 320, 1024]
    - [8, 1244.27]
  - - [448, 64, 1, 1024, 448, 448, 448, 1024]
    - [15, 1713.51]
  - - [576, 64, 1, 1024, 576, 576, 576, 1024]
    - [63, 2130.95]
  - - [704, 64, 1, 1024, 704, 704, 704, 1024]
    - [15, 2530.92]
  - - [832, 64, 1, 1024, 832, 832, 832, 1024]
    - [63, 3077.17]
  - - [960, 64, 1, 1024, 960, 960, 960, 1024]
    - [63, 3474.22]
  - - [64, 192, 1, 1024, 64, 64, 64, 1024]
    - [11, 734.168]
  - - [192, 192, 1, 1024, 192, 192, 192, 1024]
    - [63, 2144.88]
  - - [320, 192, 1, 1024, 320, 320, 320, 1024]
    - [8, 3510.07]
  - - [448, 192, 1, 1024, 448, 448, 448, 1024]
    - [15, 4392.16]
  - - [576, 192, 1, 1024, 576, 576, 576, 1024]
    - [68, 5283.48]
  - - [704, 192, 1, 1024, 704, 704, 704, 1024]
    - [53, 6061.53]
  - - [832, 192, 1, 1024, 832, 832, 832, 1024]
    - [70, 7203.22]
  - - [960, 192, 1, 1024, 960, 960, 960, 1024]
    - [70, 8347.98]
  - - [64, 320, 1, 1024, 64, 64, 64, 1024]
    - [15, 1246.86]
  - - [192, 320, 1, 1024, 192, 192, 192, 1024]
    - [8, 3459.79]
  - - [320, 320, 1, 1024, 320, 320, 320, 1024]
    - [68, 4925.32]
  - - [448, 320, 1, 1024, 448, 448, 448, 1024]
    - [38, 6133.43]
  - - [576, 320, 1, 1024, 576, 576, 576, 1024]
    - [28, 7769.15]
  - - [704, 320, 1, 1024, 704, 704, 704, 1024]
    - [51, 8401.13]
  - - [832, 320, 1, 1024, 832, 832, 832, 1024]
    - [44, 9816.01]
  - - [960, 320, 1, 1024, 960, 960, 960, 1024]
    - [48, 11468.6]
  - - [64, 448, 1, 1024, 64, 64, 64, 1024]
    - [15, 1678.25]
  - - [192, 448, 1, 1024, 192, 192, 192, 1024]
    - [70, 4463.27]
  - - [320, 448, 1, 1024, 320, 320, 320, 1024]
    - [45, 6400.87]
  - - [448, 448, 1, 1024, 448, 448, 448, 1024]
    - [57, 7805.88]
  - - [576, 448, 1, 1024, 576, 576, 576, 1024]
    - [48, 9821.63]
  - - [704, 448, 1, 1024, 704, 704, 704, 1024]
    - [37, 11636.4]
  - - [832, 448, 1, 1024, 832, 832, 832, 1024]
    - [55, 12053.9]
  - - [960, 448, 1, 1024, 960, 960, 960, 1024]
    - [54, 14055.1]
  - - [64, 576, 1, 1024, 64, 64, 64, 1024]
    - [63, 2137.59]
  - - [192, 576, 1, 1024, 192, 192, 192, 1024]
    - [67, 5330.61]
  - - [320, 576, 1, 1024, 320, 320, 320, 1024]
    - [70, 8242.26]
  - - [448, 576, 1, 1024, 448, 448, 448, 1024]
    - [48, 10108.9]
  - - [576, 576, 1, 1024, 576, 576, 576, 1024]
    - [48, 13017.3]
  - - [704, 576, 1, 1024, 704, 704, 704, 1024]
    - [48, 13209.8]
  - - [832, 576, 1, 1024, 832, 832, 832, 1024]
    - [48, 15278.4]
  - - [960, 576, 1, 1024, 960, 960, 960, 1024]
    - [54, 18605.2]
  - - [64, 704, 1, 1024, 64, 64, 64, 1024]
    - [63, 2554.74]
  - - [192, 704, 1, 1024, 192, 192, 192, 1024]
    - [28, 5842.76]
  - - [320, 704, 1, 1024, 320, 320, 320, 1024]
    - [21, 8340.39]
  - - [448, 704, 1, 1024, 448, 448, 448, 1024]
    - [37, 11491.7]
  - - [576, 704, 1, 1024, 576, 576, 576, 1024]
    - [48, 12294.7]
  - - [704, 704, 1, 1024, 704, 704, 704, 1024]
    - [37, 15172.9]
  - - [832, 704, 1, 1024, 832, 832, 832, 1024]
    - [48, 15823.8]
  - - [960, 704, 1, 1024, 960, 960, 960, 1024]
    - [48, 17966.7]
  - - [64, 832, 1, 1024, 64, 64, 64, 1024]
    - [63, 3099.91]
  - - [192, 832, 1, 1024, 192, 192, 192, 1024]
    - [28, 6930.09]
  - - [320, 832, 1, 1024, 320, 320, 320, 1024]
    - [70, 9948.54]
  - - [448, 832, 1, 1024, 448, 448, 448, 1024]
    - [55, 11944.9]
  - - [576, 832, 1, 1024, 576, 576, 576, 1024]
    - [37, 14882.4]
  - - [704, 832, 1, 1024, 704, 704, 704, 1024]
    - [54, 14782.7]
  - - [832, 832, 1, 1024, 832, 832, 832, 1024]
    - [48, 17352.6]
  - - [960, 832, 1, 1024, 960, 960, 960, 1024]
    - [54, 20295.5]
  - - [64, 960, 1, 1024, 64, 64, 64, 1024]
    - [63, 3557.61]
  - - [192, 960, 1, 1024, 192, 192, 192, 1024]
    - [32, 8379.48]
  - - [320, 960, 1, 1024, 320, 320, 320, 1024]
    - [48, 12011.6]
  - - [448, 960, 1, 1024, 448, 448, 448, 1024]
    - [48, 13875.7]
  - - [576, 960, 1, 1024, 576, 576, 576, 1024]
    - [54, 18825.1]
  - - [704, 960, 1, 1024, 704, 704, 704, 1024]
    - [48, 18594.3]
  - - [832, 960, 1, 1024, 832, 832, 832, 1024]
    - [54, 20361.2]
  - - [960, 960, 1, 1024, 960, 960, 960, 1024]
    - [54, 21760.2]
  - - [64, 64, 1, 2048, 64, 64, 64, 2048]
    - [19, 479.089]
  - - [192, 64, 1, 2048, 192, 192, 192, 2048]
    - [13, 1367.0]
  - - [320, 64, 1, 2048, 320, 320, 320, 2048]
    - [63, 2148.23]
  - - [448, 64, 1, 2048, 448, 448, 448, 2048]
    - [8, 2901.34]
  - - [576, 64, 1, 2048, 576, 576, 576, 2048]
    - [30, 3434.9]
  - - [704, 64, 1, 2048, 704, 704, 704, 2048]
    - [0, 4007.67]
  - - [832, 64, 1, 2048, 832, 832, 832, 2048]
    - [15, 4850.09]
  - - [960, 64, 1, 2048, 960, 960, 960, 2048]
    - [63, 5474.52]
  - - [64, 64, 1, 4096, 64, 64, 64, 4096]
    - [65, 883.035]
  - - [192, 64, 1, 4096, 192, 192, 192, 4096]
    - [13, 2417.0]
  - - [320, 64, 1, 4096, 320, 320, 320, 4096]
    - [19, 3494.67]
  - - [448, 64, 1, 4096, 448, 448, 448, 4096]
    - [69, 4631.94]
  - - [576, 64, 1, 4096, 576, 576, 576, 4096]
    - [30, 5505.84]
  - - [704, 64, 1, 4096, 704, 704, 704, 4096]
    - [27, 6524.87]
  - - [832, 64, 1, 4096, 832, 832, 832, 4096]
    - [39, 7289.81]
  - - [960, 64, 1, 4096, 960, 960, 960, 4096]
    - [52, 8554.28]
  - - [1280, 1280, 1, 64, 1280, 1280, 1280, 64]
    - [35, 4360.07]
  - - [1536, 1280, 1, 64, 1536, 1536, 1536, 64]
    - [26, 4800.07]
  - - [1792, 1280, 1, 64, 1792, 1792, 1792, 64]
    - [33, 5120.54]
  - - [2048, 1280, 1, 64, 2048, 2048, 2048, 64]
    - [33, 5419.17]
  - - [1280, 1536, 1, 64, 1280, 1280, 1280, 64]
    - [35, 4905.81]
  - - [1536, 1536, 1, 64, 1536, 1536, 1536, 64]
    - [33, 5314.95]
  - - [1792, 1536, 1, 64, 1792, 1792, 1792, 64]
    - [35, 5787.34]
  - - [2048, 1536, 1, 64, 2048, 2048, 2048, 64]
    - [33, 5988.48]
  - - [1280, 1792, 1, 64, 1280, 1280, 1280, 64]
    - [33, 5077.06]
  - - [1536, 1792, 1, 64, 1536, 1536, 1536, 64]
    - [61, 5663.6]
  - - [1792, 1792, 1, 64, 1792, 1792, 1792, 64]
    - [61, 6232.82]
  - - [2048, 1792, 1, 64, 2048, 2048, 2048, 64]
    - [33, 6305.7]
  - - [1280, 2048, 1, 64, 1280, 1280, 1280, 64]
    - [23, 5386.12]
  - - [1536, 2048, 1, 64, 1536, 1536, 1536, 64]
    - [33, 6013.52]
  - - [1792, 2048, 1, 64, 1792, 1792, 1792, 64]
    - [35, 6294.72]
  - - [2048, 2048, 1, 64, 2048, 2048, 2048, 64]
    - [33, 6452.15]
  - - [1280, 1280, 1, 256, 1280, 1280, 1280, 256]
    - [37, 12331.1]
  - - [1536, 1280, 1, 256, 1536, 1536, 1536, 256]
    - [32, 13044.7]
  - - [1792, 1280, 1, 256, 1792, 1792, 1792, 256]
    - [32, 13784.6]
  - - [2048, 1280, 1, 256, 2048, 2048, 2048, 256]
    - [32, 14557.7]
  - - [1280, 1536, 1, 256, 1280, 1280, 1280, 256]
    - [37, 13685.1]
  - - [1536, 1536, 1, 256, 1536, 1536, 1536, 256]
    - [47, 14889.7]
  - - [1792, 1536, 1, 256, 1792, 1792, 1792, 256]
    - [37, 15605.5]
  - - [2048, 1536, 1, 256, 2048, 2048, 2048, 256]
    - [36, 15392.4]
  - - [1280, 1792, 1, 256, 1280, 1280, 1280, 256]
    - [31, 13968.2]
  - - [1536, 1792, 1, 256, 1536, 1536, 1536, 256]
    - [60, 15081.1]
  - - [1792, 1792, 1, 256, 1792, 1792, 1792, 256]
    - [47, 15154.0]
  - - [2048, 1792, 1, 256, 2048, 2048, 2048, 256]
    - [54, 15704.9]
  - - [1280, 2048, 1, 256, 1280, 1280, 1280, 256]
    - [32, 14534.1]
  - - [1536, 2048, 1, 256, 1536, 1536, 1536, 256]
    - [54, 15160.4]
  - - [1792, 2048, 1, 256, 1792, 1792, 1792, 256]
    - [37, 15834.8]
  - - [2048, 2048, 1, 256, 2048, 2048, 2048, 256]
    - [32, 16336.1]
  - - [1280, 1280, 1, 512, 1280, 1280, 1280, 512]
    - [37, 17986.3]
  - - [1536, 1280, 1, 512, 1536, 1536, 1536, 512]
    - [54, 20045.1]
  - - [1792, 1280, 1, 512, 1792, 1792, 1792, 512]
    - [37, 18624.2]
  - - [2048, 1280, 1, 512, 2048, 2048, 2048, 512]
    - [54, 19836.2]
  - - [1280, 1536, 1, 512, 1280, 1280, 1280, 512]
    - [48, 19744.3]
  - - [1536, 1536, 1, 512, 1536, 1536, 1536, 512]
    - [48, 20163.6]
  - - [1792, 1536, 1, 512, 1792, 1792, 1792, 512]
    - [37, 21444.4]
  - - [2048, 1536, 1, 512, 2048, 2048, 2048, 512]
    - [54, 22481.1]
  - - [1280, 1792, 1, 512, 1280, 1280, 1280, 512]
    - [48, 19400.9]
  - - [1536, 1792, 1, 512, 1536, 1536, 1536, 512]
    - [54, 21340.5]
  - - [1792, 1792, 1, 512, 1792, 1792, 1792, 512]
    - [54, 21391.0]
  - - [2048, 1792, 1, 512, 2048, 2048, 2048, 512]
    - [54, 22504.4]
  - - [1280, 2048, 1, 512, 1280, 1280, 1280, 512]
    - [48, 20499.7]
  - - [1536, 2048, 1, 512, 1536, 1536, 1536, 512]
    - [54, 22870.7]
  - - [1792, 2048, 1, 512, 1792, 1792, 1792, 512]
    - [54, 22733.1]
  - - [2048, 2048, 1, 512, 2048, 2048, 2048, 512]
    - [54, 23221.7]
  - - [1280, 1280, 1, 1024, 1280, 1280, 1280, 1024]
    - [37, 23347.7]
  - - [1536, 1280, 1, 1024, 1536, 1536, 1536, 1024]
    - [54, 26319.8]
  - - [1792, 1280, 1, 1024, 1792, 1792, 1792, 1024]
    - [54, 25451.0]
  - - [2048, 1280, 1, 1024, 2048, 2048, 2048, 1024]
    - [54, 26056.3]
  - - [1280, 1536, 1, 1024, 1280, 1280, 1280, 1024]
    - [48, 25611.6]
  - - [1536, 1536, 1, 1024, 1536, 1536, 1536, 1024]
    - [48, 26420.2]
  - - [1792, 1536, 1, 1024, 1792, 1792, 1792, 1024]
    - [54, 27772.7]
  - - [2048, 1536, 1, 1024, 2048, 2048, 2048, 1024]
    - [54, 28954.4]
  - - [1280, 1792, 1, 1024, 1280, 1280, 1280, 1024]
    - [54, 25605.1]
  - - [1536, 1792, 1, 1024, 1536, 1536, 1536, 1024]
    - [54, 27667.9]
  - - [1792, 1792, 1, 1024, 1792, 1792, 1792, 1024]
    - [54, 27824.6]
  - - [2048, 1792, 1, 1024, 2048, 2048, 2048, 1024]
    - [54, 29325.4]
  - - [1280, 2048, 1, 1024, 1280, 1280, 1280, 1024]
    - [54, 26979.3]
  - - [1536, 2048, 1, 1024, 1536, 1536, 1536, 1024]
    - [54, 30319.7]
  - - [1792, 2048, 1, 1024, 1792, 1792, 1792, 1024]
    - [54, 29240.0]
  - - [2048, 2048, 1, 1024, 2048, 2048, 2048, 1024]
    - [54, 29321.0]
  - - [1280, 1280, 1, 2048, 1280, 1280, 1280, 2048]
    - [37, 27533.9]
  - - [1536, 1280, 1, 2048, 1536, 1536, 1536, 2048]
    - [54, 31285.9]
  - - [1792, 1280, 1, 2048, 1792, 1792, 1792, 2048]
    - [54, 30053.2]
  - - [2048, 1280, 1, 2048, 2048, 2048, 2048, 2048]
    - [54, 30532.8]
  - - [1280, 1536, 1, 2048, 1280, 1280, 1280, 2048]
    - [54, 31167.3]
  - - [1536, 1536, 1, 2048, 1536, 1536, 1536, 2048]
    - [55, 30738.7]
  - - [1792, 1536, 1, 2048, 1792, 1792, 1792, 2048]
    - [54, 33161.6]
  - - [2048, 1536, 1, 2048, 2048, 2048, 2048, 2048]
    - [54, 35291.5]
  - - [1280, 1792, 1, 2048, 1280, 1280, 1280, 2048]
    - [54, 30943.1]
  - - [1536, 1792, 1, 2048, 1536, 1536, 1536, 2048]
    - [54, 32476.9]
  - - [1792, 1792, 1, 2048, 1792, 1792, 1792, 2048]
    - [54, 32488.8]
  - - [2048, 1792, 1, 2048, 2048, 2048, 2048, 2048]
    - [54, 34391.5]
  - - [1280, 2048, 1, 2048, 1280, 1280, 1280, 2048]
    - [54, 32218.4]
  - - [1536, 2048, 1, 2048, 1536, 1536, 1536, 2048]
    - [54, 35846.2]
  - - [1792, 2048, 1, 2048, 1792, 1792, 1792, 2048]
    - [54, 34009.5]
  - - [2048, 2048, 1, 2048, 2048, 2048, 2048, 2048]
    - [54, 34034.7]
  - - [1280, 1280, 1, 4096, 1280, 1280, 1280, 4096]
    - [56, 31801.6]
  - - [1536, 1280, 1, 4096, 1536, 1536, 1536, 4096]
    - [54, 35594.0]
  - - [1792, 1280, 1, 4096, 1792, 1792, 1792, 4096]
    - [54, 34580.6]
  - - [2048, 1280, 1, 4096, 2048, 2048, 2048, 4096]
    - [54, 33729.8]
  - - [1280, 1536, 1, 4096, 1280, 1280, 1280, 4096]
    - [54, 35303.0]
  - - [1536, 1536, 1, 4096, 1536, 1536, 1536, 4096]
    - [55, 34211.8]
  - - [1792, 1536, 1, 4096, 1792, 1792, 1792, 4096]
    - [54, 36988.4]
  - - [2048, 1536, 1, 4096, 2048, 2048, 2048, 4096]
    - [54, 38760.4]
  - - [1280, 1792, 1, 4096, 1280, 1280, 1280, 4096]
    - [54, 34866.0]
  - - [1536, 1792, 1, 4096, 1536, 1536, 1536, 4096]
    - [55, 35794.7]
  - - [1792, 1792, 1, 4096, 1792, 1792, 1792, 4096]
    - [54, 35800.3]
  - - [2048, 1792, 1, 4096, 2048, 2048, 2048, 4096]
    - [54, 37851.9]
  - - [1280, 2048, 1, 4096, 1280, 1280, 1280, 4096]
    - [54, 35281.5]
  - - [1536, 2048, 1, 4096, 1536, 1536, 1536, 4096]
    - [54, 39169.1]
  - - [1792, 2048, 1, 4096, 1792, 1792, 1792, 4096]
    - [54, 36856.3]
  - - [2048, 2048, 1, 4096, 2048, 2048, 2048, 4096]
    - [54, 36502.1]
  - - [2560, 2560, 1, 64, 2560, 2560, 2560, 64]
    - [33, 7373.95]
  - - [3072, 2560, 1, 64, 3072, 3072, 3072, 64]
    - [33, 7828.3]
  - - [3584, 2560, 1, 64, 3584, 3584, 3584, 64]
    - [33, 8056.78]
  - - [4096, 2560, 1, 64, 4096, 4096, 4096, 64]
    - [33, 8178.77]
  - - [2560, 3072, 1, 64, 2560, 2560, 2560, 64]
    - [33, 7979.9]
  - - [3072, 3072, 1, 64, 3072, 3072, 3072, 64]
    - [35, 8368.85]
  - - [3584, 3072, 1, 64, 3584, 3584, 3584, 64]
    - [33, 8634.8]
  - - [4096, 3072, 1, 64, 4096, 4096, 4096, 64]
    - [33, 8703.9]
  - - [2560, 3584, 1, 64, 2560, 2560, 2560, 64]
    - [61, 8439.49]
  - - [3072, 3584, 1, 64, 3072, 3072, 3072, 64]
    - [35, 8513.52]
  - - [3584, 3584, 1, 64, 3584, 3584, 3584, 64]
    - [61, 9141.63]
  - - [4096, 3584, 1, 64, 4096, 4096, 4096, 64]
    - [33, 8825.18]
  - - [2560, 4096, 1, 64, 2560, 2560, 2560, 64]
    - [33, 8318.94]
  - - [3072, 4096, 1, 64, 3072, 3072, 3072, 64]
    - [33, 8625.86]
  - - [3584, 4096, 1, 64, 3584, 3584, 3584, 64]
    - [33, 8829.12]
  - - [4096, 4096, 1, 64, 4096, 4096, 4096, 64]
    - [33, 8870.86]
  - - [2560, 2560, 1, 256, 2560, 2560, 2560, 256]
    - [48, 19153.7]
  - - [3072, 2560, 1, 256, 3072, 3072, 3072, 256]
    - [54, 19977.9]
  - - [3584, 2560, 1, 256, 3584, 3584, 3584, 256]
    - [48, 20495.9]
  - - [4096, 2560, 1, 256, 4096, 4096, 4096, 256]
    - [54, 21305.0]
  - - [2560, 3072, 1, 256, 2560, 2560, 2560, 256]
    - [47, 20486.7]
  - - [3072, 3072, 1, 256, 3072, 3072, 3072, 256]
    - [54, 22093.0]
  - - [3584, 3072, 1, 256, 3584, 3584, 3584, 256]
    - [54, 21755.9]
  - - [4096, 3072, 1, 256, 4096, 4096, 4096, 256]
    - [54, 22590.7]
  - - [2560, 3584, 1, 256, 2560, 2560, 2560, 256]
    - [37, 20620.5]
  - - [3072, 3584, 1, 256, 3072, 3072, 3072, 256]
    - [54, 21610.5]
  - - [3584, 3584, 1, 256, 3584, 3584, 3584, 256]
    - [54, 22093.2]
  - - [4096, 3584, 1, 256, 4096, 4096, 4096, 256]
    - [54, 22759.3]
  - - [2560, 4096, 1, 256, 2560, 2560, 2560, 256]
    - [54, 21480.2]
  - - [3072, 4096, 1, 256, 3072, 3072, 3072, 256]
    - [54, 22359.5]
  - - [3584, 4096, 1, 256, 3584, 3584, 3584, 256]
    - [54, 22501.1]
  - - [4096, 4096, 1, 256, 4096, 4096, 4096, 256]
    - [54, 23053.0]
  - - [2560, 2560, 1, 512, 2560, 2560, 2560, 512]
    - [54, 26937.0]
  - - [3072, 2560, 1, 512, 3072, 3072, 3072, 512]
    - [54, 28092.0]
  - - [3584, 2560, 1, 512, 3584, 3584, 3584, 512]
    - [54, 28371.0]
  - - [4096, 2560, 1, 512, 4096, 4096, 4096, 512]
    - [54, 29282.1]
  - - [2560, 3072, 1, 512, 2560, 2560, 2560, 512]
    - [54, 28580.1]
  - - [3072, 3072, 1, 512, 3072, 3072, 3072, 512]
    - [54, 29870.3]
  - - [3584, 3072, 1, 512, 3584, 3584, 3584, 512]
    - [54, 29684.1]
  - - [4096, 3072, 1, 512, 4096, 4096, 4096, 512]
    - [54, 31139.8]
  - - [2560, 3584, 1, 512, 2560, 2560, 2560, 512]
    - [54, 28617.0]
  - - [3072, 3584, 1, 512, 3072, 3072, 3072, 512]
    - [54, 30297.5]
  - - [3584, 3584, 1, 512, 3584, 3584, 3584, 512]
    - [54, 30049.9]
  - - [4096, 3584, 1, 512, 4096, 4096, 4096, 512]
    - [54, 31022.4]
  - - [2560, 4096, 1, 512, 2560, 2560, 2560, 512]
    - [54, 29408.8]
  - - [3072, 4096, 1, 512, 3072, 3072, 3072, 512]
    - [54, 30548.3]
  - - [3584, 4096, 1, 512, 3584, 3584, 3584, 512]
    - [54, 30733.8]
  - - [4096, 4096, 1, 512, 4096, 4096, 4096, 512]
    - [54, 31815.5]
  - - [2560, 2560, 1, 1024, 2560, 2560, 2560, 1024]
    - [54, 33377.9]
  - - [3072, 2560, 1, 1024, 3072, 3072, 3072, 1024]
    - [54, 34796.7]
  - - [3584, 2560, 1, 1024, 3584, 3584, 3584, 1024]
    - [54, 34786.6]
  - - [4096, 2560, 1, 1024, 4096, 4096, 4096, 1024]
    - [54, 35862.9]
  - - [2560, 3072, 1, 1024, 2560, 2560, 2560, 1024]
    - [54, 34914.9]
  - - [3072, 3072, 1, 1024, 3072, 3072, 3072, 1024]
    - [54, 36183.8]
  - - [3584, 3072, 1, 1024, 3584, 3584, 3584, 1024]
    - [54, 36370.4]
  - - [4096, 3072, 1, 1024, 4096, 4096, 4096, 1024]
    - [54, 37557.0]
  - - [2560, 3584, 1, 1024, 2560, 2560, 2560, 1024]
    - [54, 35000.4]
  - - [3072, 3584, 1, 1024, 3072, 3072, 3072, 1024]
    - [54, 36341.6]
  - - [3584, 3584, 1, 1024, 3584, 3584, 3584, 1024]
    - [54, 36374.4]
  - - [4096, 3584, 1, 1024, 4096, 4096, 4096, 1024]
    - [54, 36935.6]
  - - [2560, 4096, 1, 1024, 2560, 2560, 2560, 1024]
    - [54, 36085.3]
  - - [3072, 4096, 1, 1024, 3072, 3072, 3072, 1024]
    - [54, 36807.7]
  - - [3584, 4096, 1, 1024, 3584, 3584, 3584, 1024]
    - [54, 36346.2]
  - - [4096, 4096, 1, 1024, 4096, 4096, 4096, 1024]
    - [54, 37894.8]
  - - [2560, 2560, 1, 2048, 2560, 2560, 2560, 2048]
    - [54, 37054.2]
  - - [3072, 2560, 1, 2048, 3072, 3072, 3072, 2048]
    - [54, 39220.2]
  - - [3584, 2560, 1, 2048, 3584, 3584, 3584, 2048]
    - [54, 38217.5]
  - - [4096, 2560, 1, 2048, 4096, 4096, 4096, 2048]
    - [54, 39670.4]
  - - [2560, 3072, 1, 2048, 2560, 2560, 2560, 2048]
    - [54, 38790.0]
  - - [3072, 3072, 1, 2048, 3072, 3072, 3072, 2048]
    - [54, 40414.6]
  - - [3584, 3072, 1, 2048, 3584, 3584, 3584, 2048]
    - [54, 39768.1]
  - - [4096, 3072, 1, 2048, 4096, 4096, 4096, 2048]
    - [54, 40731.9]
  - - [2560, 3584, 1, 2048, 2560, 2560, 2560, 2048]
    - [54, 38963.3]
  - - [3072, 3584, 1, 2048, 3072, 3072, 3072, 2048]
    - [54, 39728.0]
  - - [3584, 3584, 1, 2048, 3584, 3584, 3584, 2048]
    - [54, 39505.2]
  - - [4096, 3584, 1, 2048, 4096, 4096, 4096, 2048]
    - [54, 40429.6]
  - - [2560, 4096, 1, 2048, 2560, 2560, 2560, 2048]
    - [54, 39864.9]
  - - [3072, 4096, 1, 2048, 3072, 3072, 3072, 2048]
    - [54, 40324.6]
  - - [3584, 4096, 1, 2048, 3584, 3584, 3584, 2048]
    - [54, 40135.7]
  - - [4096, 4096, 1, 2048, 4096, 4096, 4096, 2048]
    - [54, 40790.8]
  - - [2560, 2560, 1, 4096, 2560, 2560, 2560, 4096]
    - [54, 39839.6]
  - - [3072, 2560, 1, 4096, 3072, 3072, 3072, 4096]
    - [54, 41434.0]
  - - [3584, 2560, 1, 4096, 3584, 3584, 3584, 4096]
    - [54, 40513.8]
  - - [4096, 2560, 1, 4096, 4096, 4096, 4096, 4096]
    - [54, 41869.0]
  - - [2560, 3072, 1, 4096, 2560, 2560, 2560, 4096]
    - [54, 41354.0]
  - - [3072, 3072, 1, 4096, 3072, 3072, 3072, 4096]
    - [54, 41796.4]
  - - [3584, 3072, 1, 4096, 3584, 3584, 3584, 4096]
    - [54, 41744.7]
  - - [4096, 3072, 1, 4096, 4096, 4096, 4096, 4096]
    - [54, 42535.8]
  - - [2560, 3584, 1, 4096, 2560, 2560, 2560, 4096]
    - [54, 40888.0]
  - - [3072, 3584, 1, 4096, 3072, 3072, 3072, 4096]
    - [54, 41763.8]
  - - [3584, 3584, 1, 4096, 3584, 3584, 3584, 4096]
    - [54, 41241.0]
  - - [4096, 3584, 1, 4096, 4096, 4096, 4096, 4096]
    - [54, 41983.6]
  - - [2560, 4096, 1, 4096, 2560, 2560, 2560, 4096]
    - [54, 41914.6]
  - - [3072, 4096, 1, 4096, 3072, 3072, 3072, 4096]
    - [54, 42556.4]
  - - [3584, 4096, 1, 4096, 3584, 3584, 3584, 4096]
    - [54, 41947.0]
  - - [4096, 4096, 1, 4096, 4096, 4096, 4096, 4096]
    - [54, 42579.5]
  - - [1, 1, 1, 1, 1, 1, 1, 1]
    - [9, 6.88255e-05]
  - - [1, 1, 1, 64, 1, 1, 1, 64]
    - [6, 0.00430846]
  - - [1, 64, 1, 1, 1, 1, 1, 1]
    - [5, 0.00427679]
  - - [64, 1, 1, 1, 64, 64, 64, 1]
    - [2, 0.00444923]
  - - [64, 64, 1, 1, 64, 64, 64, 1]
    - [1, 0.281618]
  - - [64, 1, 1, 64, 64, 64, 64, 64]
    - [11, 0.282006]
  - - [1, 64, 1, 64, 1, 1, 1, 64]
    - [4, 0.267276]
- null
- null
- DeviceEfficiency
- GridBased
