library/src/amd_detail/rocblaslt/src/Tensile/Logic/asm_full/navi31/GridBased/navi31_Cijk_Ailk_Bljk_HSS_BH_Bias_AH.yaml
- {MinimumRequiredVersion: 4.33.0}
- navi31
- gfx1100
- [Device 73f0]
    SolutionIndex: 0
    SolutionNameMin: Cijk_Ailk_Bljk_HSS_BH_Bias_AH_MT64x64x32_MI16x16x16x1_SN_MIWT2_2_PLR3_WG32_4_1
    SolutionIndex: 1
    SolutionNameMin: Cijk_Ailk_Bljk_HSS_BH_Bias_AH_MT64x32x32_MI16x16x16x1_SN_MIWT2_2_PLR3_WG32_2_1
    SolutionIndex: 2
    SolutionNameMin: Cijk_Ailk_Bljk_HSS_BH_Bias_AH_MT32x32x32_MI16x16x16x1_SN_MIWT2_2_PLR3_WG16_2_1
    SolutionIndex: 3
    SolutionNameMin: Cijk_Ailk_Bljk_HSS_BH_Bias_AH_MT32x64x32_MI16x16x16x1_SN_MIWT2_2_PLR3_WG16_4_1
    SolutionIndex: 4
    SolutionNameMin: Cijk_Ailk_Bljk_HSS_BH_Bias_AH_MT32x32x32_MI16x16x16x1_SN_MIWT1_1_PLR3_WG32_4_1
    SolutionIndex: 5
    SolutionNameMin: Cijk_Ailk_Bljk_HSS_BH_Bias_AH_MT16x16x32_MI16x16x16x1_SN_MIWT1_1_PLR3_WG16_2_1
    SolutionIndex: 6
    SolutionNameMin: Cijk_Ailk_Bljk_HSS_BH_Bias_AH_MT32x16x32_MI16x16x16x1_SN_MIWT1_1_PLR3_WG32_2_1
    SolutionIndex: 7
    SolutionNameMin: Cijk_Ailk_Bljk_HSS_BH_Bias_AH_MT16x32x32_MI16x16x16x1_SN_MIWT1_1_PLR3_WG16_4_1
    SolutionIndex: 8
    SolutionNameMin: Cijk_Ailk_Bljk_HSS_BH_Bias_AH_MT64x16x32_MI16x16x16x1_SN_MIWT4_1_PLR3_WG16_2_1
    SolutionIndex: 9
    SolutionNameMin: Cijk_Ailk_Bljk_HSS_BH_Bias_AH_MT64x64x32_MI16x16x16x1_SN_MIWT4_1_PLR3_WG16_8_1
    SolutionIndex: 10
    SolutionNameMin: Cijk_Ailk_Bljk_HSS_BH_Bias_AH_MT16x64x32_MI16x16x16x1_SN_MIWT1_4_PLR3_WG16_2_1
    SolutionIndex: 11
    SolutionNameMin: Cijk_Ailk_Bljk_HSS_BH_Bias_AH_MT64x64x32_MI16x16x16x1_SN_MIWT1_4_PLR3_WG64_2_1
    SolutionIndex: 12
    SolutionNameMin: Cijk_Ailk_Bljk_HSS_BH_Bias_AH_MT64x32x64_MI16x16x16x1_SN_MIWT2_2_PLR5_WG32_2_1
    SolutionIndex: 13
    SolutionNameMin: Cijk_Ailk_Bljk_HSS_BH_Bias_AH_MT32x32x64_MI16x16x16x1_SN_MIWT2_2_PLR5_WG16_2_1
    SolutionIndex: 14
    SolutionNameMin: Cijk_Ailk_Bljk_HSS_BH_Bias_AH_MT32x64x64_MI16x16x16x1_SN_MIWT2_2_PLR5_WG16_4_1
    SolutionIndex: 15
    SolutionNameMin: Cijk_Ailk_Bljk_HSS_BH_Bias_AH_MT32x32x64_MI16x16x16x1_SN_MIWT1_1_PLR5_WG32_4_1
    SolutionIndex: 16
    SolutionNameMin: Cijk_Ailk_Bljk_HSS_BH_Bias_AH_MT16x16x64_MI16x16x16x1_SN_MIWT1_1_PLR5_WG16_2_1
    SolutionIndex: 17
    SolutionNameMin: Cijk_Ailk_Bljk_HSS_BH_Bias_AH_MT32x16x64_MI16x16x16x1_SN_MIWT1_1_PLR5_WG32_2_1
    SolutionIndex: 18
    SolutionNameMin: Cijk_Ailk_Bljk_HSS_BH_Bias_AH_MT16x32x64_MI16x16x16x1_SN_MIWT1_1_PLR5_WG16_4_1
- - - [64, 64, 1, 64, 64, 64, 64, 64]
    - [17, 62.4595]
  - - [128, 64, 1, 64, 128, 128, 128, 64]
    - [18, 124.919]
  - - [192, 64, 1, 64, 192, 192, 192, 64]
    - [18, 185.697]
  - - [256, 64, 1, 64, 256, 256, 256, 64]
    - [16, 244.479]
  - - [320, 64, 1, 64, 320, 320, 320, 64]
    - [18, 300.278]
  - - [384, 64, 1, 64, 384, 384, 384, 64]
    - [17, 360.251]
  - - [448, 64, 1, 64, 448, 448, 448, 64]
    - [18, 418.093]
  - - [512, 64, 1, 64, 512, 512, 512, 64]
    - [18, 475.329]
  - - [576, 64, 1, 64, 576, 576, 576, 64]
    - [17, 532.329]
  - - [640, 64, 1, 64, 640, 640, 640, 64]
    - [4, 557.155]
  - - [704, 64, 1, 64, 704, 704, 704, 64]
    - [17, 647.993]
  - - [768, 64, 1, 64, 768, 768, 768, 64]
    - [6, 700.14]
  - - [832, 64, 1, 64, 832, 832, 832, 64]
    - [18, 721.239]
  - - [896, 64, 1, 64, 896, 896, 896, 64]
    - [5, 789.926]
  - - [960, 64, 1, 64, 960, 960, 960, 64]
    - [16, 834.322]
  - - [1024, 64, 1, 64, 1024, 1024, 1024, 64]
    - [5, 861.249]
  - - [1088, 64, 1, 64, 1088, 1088, 1088, 64]
    - [16, 937.208]
  - - [1152, 64, 1, 64, 1152, 1152, 1152, 64]
    - [5, 995.058]
  - - [1216, 64, 1, 64, 1216, 1216, 1216, 64]
    - [17, 1014.18]
  - - [1280, 64, 1, 64, 1280, 1280, 1280, 64]
    - [17, 1123.62]
  - - [1344, 64, 1, 64, 1344, 1344, 1344, 64]
    - [5, 1146.15]
  - - [1408, 64, 1, 64, 1408, 1408, 1408, 64]
    - [12, 1171.95]
  - - [1472, 64, 1, 64, 1472, 1472, 1472, 64]
    - [7, 1229.96]
  - - [1536, 64, 1, 64, 1536, 1536, 1536, 64]
    - [17, 1296.66]
  - - [1600, 64, 1, 64, 1600, 1600, 1600, 64]
    - [17, 1385.24]
  - - [1664, 64, 1, 64, 1664, 1664, 1664, 64]
    - [18, 1424.99]
  - - [1728, 64, 1, 64, 1728, 1728, 1728, 64]
    - [6, 1477.33]
  - - [1792, 64, 1, 64, 1792, 1792, 1792, 64]
    - [4, 1467.71]
  - - [1856, 64, 1, 64, 1856, 1856, 1856, 64]
    - [3, 1521.35]
  - - [1920, 64, 1, 64, 1920, 1920, 1920, 64]
    - [5, 1661.58]
  - - [1984, 64, 1, 64, 1984, 1984, 1984, 64]
    - [4, 1716.97]
  - - [2048, 64, 1, 64, 2048, 2048, 2048, 64]
    - [18, 1766.77]
  - - [2112, 64, 1, 64, 2112, 2112, 2112, 64]
    - [15, 1825.81]
  - - [2176, 64, 1, 64, 2176, 2176, 2176, 64]
    - [4, 1859.56]
  - - [2240, 64, 1, 64, 2240, 2240, 2240, 64]
    - [5, 1934.43]
  - - [2304, 64, 1, 64, 2304, 2304, 2304, 64]
    - [6, 1970.59]
  - - [2368, 64, 1, 64, 2368, 2368, 2368, 64]
    - [7, 2013.98]
  - - [2432, 64, 1, 64, 2432, 2432, 2432, 64]
    - [18, 2053.91]
  - - [2496, 64, 1, 64, 2496, 2496, 2496, 64]
    - [17, 2130.35]
  - - [2560, 64, 1, 64, 2560, 2560, 2560, 64]
    - [18, 2185.43]
  - - [2624, 64, 1, 64, 2624, 2624, 2624, 64]
    - [4, 2208.31]
  - - [2688, 64, 1, 64, 2688, 2688, 2688, 64]
    - [18, 2267.3]
  - - [2752, 64, 1, 64, 2752, 2752, 2752, 64]
    - [4, 2319.37]
  - - [2816, 64, 1, 64, 2816, 2816, 2816, 64]
    - [4, 2366.95]
  - - [2880, 64, 1, 64, 2880, 2880, 2880, 64]
    - [6, 2461.65]
  - - [2944, 64, 1, 64, 2944, 2944, 2944, 64]
    - [18, 2493.51]
  - - [3008, 64, 1, 64, 3008, 3008, 3008, 64]
    - [15, 2532.0]
  - - [3072, 64, 1, 64, 3072, 3072, 3072, 64]
    - [4, 2558.53]
  - - [3136, 64, 1, 64, 3136, 3136, 3136, 64]
    - [4, 2610.24]
  - - [3200, 64, 1, 64, 3200, 3200, 3200, 64]
    - [5, 2656.47]
  - - [3264, 64, 1, 64, 3264, 3264, 3264, 64]
    - [7, 2688.37]
  - - [3328, 64, 1, 64, 3328, 3328, 3328, 64]
    - [6, 2743.84]
  - - [3392, 64, 1, 64, 3392, 3392, 3392, 64]
    - [15, 2661.09]
  - - [3456, 64, 1, 64, 3456, 3456, 3456, 64]
    - [5, 2835.11]
  - - [3520, 64, 1, 64, 3520, 3520, 3520, 64]
    - [15, 2833.1]
  - - [3584, 64, 1, 64, 3584, 3584, 3584, 64]
    - [6, 2826.87]
  - - [3648, 64, 1, 64, 3648, 3648, 3648, 64]
    - [4, 2862.46]
  - - [3712, 64, 1, 64, 3712, 3712, 3712, 64]
    - [7, 2887.79]
  - - [3776, 64, 1, 64, 3776, 3776, 3776, 64]
    - [4, 2927.0]
  - - [3840, 64, 1, 64, 3840, 3840, 3840, 64]
    - [6, 2932.77]
  - - [3904, 64, 1, 64, 3904, 3904, 3904, 64]
    - [6, 3022.79]
  - - [3968, 64, 1, 64, 3968, 3968, 3968, 64]
    - [4, 3029.99]
  - - [4032, 64, 1, 64, 4032, 4032, 4032, 64]
    - [7, 3130.77]
  - - [4096, 64, 1, 64, 4096, 4096, 4096, 64]
    - [8, 3115.49]
  - - [64, 128, 1, 64, 64, 64, 64, 64]
    - [5, 112.217]
  - - [128, 128, 1, 64, 128, 128, 128, 64]
    - [15, 223.478]
  - - [192, 128, 1, 64, 192, 192, 192, 64]
    - [5, 334.437]
  - - [256, 128, 1, 64, 256, 256, 256, 64]
    - [6, 455.695]
  - - [320, 128, 1, 64, 320, 320, 320, 64]
    - [5, 535.201]
  - - [384, 128, 1, 64, 384, 384, 384, 64]
    - [18, 643.558]
  - - [448, 128, 1, 64, 448, 448, 448, 64]
    - [7, 748.364]
  - - [512, 128, 1, 64, 512, 512, 512, 64]
    - [18, 839.02]
  - - [576, 128, 1, 64, 576, 576, 576, 64]
    - [7, 1034.54]
  - - [640, 128, 1, 64, 640, 640, 640, 64]
    - [16, 1099.58]
  - - [704, 128, 1, 64, 704, 704, 704, 64]
    - [7, 1203.74]
  - - [768, 128, 1, 64, 768, 768, 768, 64]
    - [5, 1306.34]
  - - [832, 128, 1, 64, 832, 832, 832, 64]
    - [15, 1398.09]
  - - [896, 128, 1, 64, 896, 896, 896, 64]
    - [4, 1510.59]
  - - [960, 128, 1, 64, 960, 960, 960, 64]
    - [4, 1613.5]
  - - [1024, 128, 1, 64, 1024, 1024, 1024, 64]
    - [5, 1661.09]
  - - [1088, 128, 1, 64, 1088, 1088, 1088, 64]
    - [6, 1794.4]
  - - [1152, 128, 1, 64, 1152, 1152, 1152, 64]
    - [15, 1876.52]
  - - [1216, 128, 1, 64, 1216, 1216, 1216, 64]
    - [15, 1983.55]
  - - [1280, 128, 1, 64, 1280, 1280, 1280, 64]
    - [15, 2099.23]
  - - [1344, 128, 1, 64, 1344, 1344, 1344, 64]
    - [4, 2193.2]
  - - [1408, 128, 1, 64, 1408, 1408, 1408, 64]
    - [4, 2293.54]
  - - [1472, 128, 1, 64, 1472, 1472, 1472, 64]
    - [7, 2397.33]
  - - [1536, 128, 1, 64, 1536, 1536, 1536, 64]
    - [7, 2441.84]
  - - [1600, 128, 1, 64, 1600, 1600, 1600, 64]
    - [4, 2493.25]
  - - [1664, 128, 1, 64, 1664, 1664, 1664, 64]
    - [7, 2681.77]
  - - [1728, 128, 1, 64, 1728, 1728, 1728, 64]
    - [6, 2832.83]
  - - [1792, 128, 1, 64, 1792, 1792, 1792, 64]
    - [1, 2743.41]
  - - [1856, 128, 1, 64, 1856, 1856, 1856, 64]
    - [7, 2958.02]
  - - [1920, 128, 1, 64, 1920, 1920, 1920, 64]
    - [6, 3012.0]
  - - [1984, 128, 1, 64, 1984, 1984, 1984, 64]
    - [7, 3048.17]
  - - [2048, 128, 1, 64, 2048, 2048, 2048, 64]
    - [4, 3161.92]
  - - [2112, 128, 1, 64, 2112, 2112, 2112, 64]
    - [4, 3287.99]
  - - [2176, 128, 1, 64, 2176, 2176, 2176, 64]
    - [4, 3336.27]
  - - [2240, 128, 1, 64, 2240, 2240, 2240, 64]
    - [7, 3414.59]
  - - [2304, 128, 1, 64, 2304, 2304, 2304, 64]
    - [7, 3503.04]
  - - [2368, 128, 1, 64, 2368, 2368, 2368, 64]
    - [4, 3578.43]
  - - [2432, 128, 1, 64, 2432, 2432, 2432, 64]
    - [7, 3647.52]
  - - [2496, 128, 1, 64, 2496, 2496, 2496, 64]
    - [4, 3753.83]
  - - [2560, 128, 1, 64, 2560, 2560, 2560, 64]
    - [6, 3775.91]
  - - [2624, 128, 1, 64, 2624, 2624, 2624, 64]
    - [6, 3883.61]
  - - [2688, 128, 1, 64, 2688, 2688, 2688, 64]
    - [6, 3955.45]
  - - [2752, 128, 1, 64, 2752, 2752, 2752, 64]
    - [14, 3996.49]
  - - [2816, 128, 1, 64, 2816, 2816, 2816, 64]
    - [4, 4138.55]
  - - [2880, 128, 1, 64, 2880, 2880, 2880, 64]
    - [4, 4150.69]
  - - [2944, 128, 1, 64, 2944, 2944, 2944, 64]
    - [4, 4291.25]
  - - [3008, 128, 1, 64, 3008, 3008, 3008, 64]
    - [4, 4332.88]
  - - [3072, 128, 1, 64, 3072, 3072, 3072, 64]
    - [7, 4368.27]
  - - [3136, 128, 1, 64, 3136, 3136, 3136, 64]
    - [4, 4503.05]
  - - [3200, 128, 1, 64, 3200, 3200, 3200, 64]
    - [4, 4559.74]
  - - [3264, 128, 1, 64, 3264, 3264, 3264, 64]
    - [4, 4650.17]
  - - [3328, 128, 1, 64, 3328, 3328, 3328, 64]
    - [4, 4719.96]
  - - [3392, 128, 1, 64, 3392, 3392, 3392, 64]
    - [4, 4671.6]
  - - [3456, 128, 1, 64, 3456, 3456, 3456, 64]
    - [4, 4876.19]
  - - [3520, 128, 1, 64, 3520, 3520, 3520, 64]
    - [4, 4794.73]
  - - [3584, 128, 1, 64, 3584, 3584, 3584, 64]
    - [9, 4824.11]
  - - [3648, 128, 1, 64, 3648, 3648, 3648, 64]
    - [1, 4914.35]
  - - [3712, 128, 1, 64, 3712, 3712, 3712, 64]
    - [1, 4955.73]
  - - [3776, 128, 1, 64, 3776, 3776, 3776, 64]
    - [3, 4933.41]
  - - [3840, 128, 1, 64, 3840, 3840, 3840, 64]
    - [9, 5074.51]
  - - [3904, 128, 1, 64, 3904, 3904, 3904, 64]
    - [4, 5157.44]
  - - [3968, 128, 1, 64, 3968, 3968, 3968, 64]
    - [0, 5188.42]
  - - [4032, 128, 1, 64, 4032, 4032, 4032, 64]
    - [9, 5290.71]
  - - [4096, 128, 1, 64, 4096, 4096, 4096, 64]
    - [0, 5346.4]
  - - [64, 192, 1, 64, 64, 64, 64, 64]
    - [5, 161.516]
  - - [128, 192, 1, 64, 128, 128, 128, 64]
    - [4, 333.16]
  - - [192, 192, 1, 64, 192, 192, 192, 64]
    - [5, 491.305]
  - - [256, 192, 1, 64, 256, 256, 256, 64]
    - [5, 662.953]
  - - [320, 192, 1, 64, 320, 320, 320, 64]
    - [18, 862.694]
  - - [384, 192, 1, 64, 384, 384, 384, 64]
    - [16, 984.666]
  - - [448, 192, 1, 64, 448, 448, 448, 64]
    - [7, 1146.87]
  - - [512, 192, 1, 64, 512, 512, 512, 64]
    - [6, 1259.03]
  - - [576, 192, 1, 64, 576, 576, 576, 64]
    - [15, 1459.33]
  - - [640, 192, 1, 64, 640, 640, 640, 64]
    - [7, 1622.16]
  - - [704, 192, 1, 64, 704, 704, 704, 64]
    - [6, 1754.34]
  - - [768, 192, 1, 64, 768, 768, 768, 64]
    - [11, 1879.51]
  - - [832, 192, 1, 64, 832, 832, 832, 64]
    - [17, 1989.78]
  - - [896, 192, 1, 64, 896, 896, 896, 64]
    - [7, 2166.04]
  - - [960, 192, 1, 64, 960, 960, 960, 64]
    - [4, 2293.66]
  - - [1024, 192, 1, 64, 1024, 1024, 1024, 64]
    - [6, 2505.02]
  - - [1088, 192, 1, 64, 1088, 1088, 1088, 64]
    - [6, 2570.03]
  - - [1152, 192, 1, 64, 1152, 1152, 1152, 64]
    - [13, 2556.09]
  - - [1216, 192, 1, 64, 1216, 1216, 1216, 64]
    - [15, 2817.66]
  - - [1280, 192, 1, 64, 1280, 1280, 1280, 64]
    - [7, 2938.79]
  - - [1344, 192, 1, 64, 1344, 1344, 1344, 64]
    - [12, 3067.38]
  - - [1408, 192, 1, 64, 1408, 1408, 1408, 64]
    - [14, 3218.84]
  - - [1472, 192, 1, 64, 1472, 1472, 1472, 64]
    - [4, 3394.84]
  - - [1536, 192, 1, 64, 1536, 1536, 1536, 64]
    - [6, 3492.65]
  - - [1600, 192, 1, 64, 1600, 1600, 1600, 64]
    - [0, 3600.81]
  - - [1664, 192, 1, 64, 1664, 1664, 1664, 64]
    - [6, 3723.06]
  - - [1728, 192, 1, 64, 1728, 1728, 1728, 64]
    - [7, 3843.14]
  - - [1792, 192, 1, 64, 1792, 1792, 1792, 64]
    - [4, 3979.74]
  - - [1856, 192, 1, 64, 1856, 1856, 1856, 64]
    - [4, 4013.04]
  - - [1920, 192, 1, 64, 1920, 1920, 1920, 64]
    - [4, 4175.67]
  - - [1984, 192, 1, 64, 1984, 1984, 1984, 64]
    - [14, 4250.17]
  - - [2048, 192, 1, 64, 2048, 2048, 2048, 64]
    - [4, 4243.76]
  - - [2112, 192, 1, 64, 2112, 2112, 2112, 64]
    - [8, 4366.09]
  - - [2176, 192, 1, 64, 2176, 2176, 2176, 64]
    - [7, 4499.89]
  - - [2240, 192, 1, 64, 2240, 2240, 2240, 64]
    - [7, 4521.88]
  - - [2304, 192, 1, 64, 2304, 2304, 2304, 64]
    - [7, 4643.46]
  - - [2368, 192, 1, 64, 2368, 2368, 2368, 64]
    - [3, 4735.92]
  - - [2432, 192, 1, 64, 2432, 2432, 2432, 64]
    - [7, 4817.68]
  - - [2496, 192, 1, 64, 2496, 2496, 2496, 64]
    - [3, 4926.96]
  - - [2560, 192, 1, 64, 2560, 2560, 2560, 64]
    - [4, 4995.56]
  - - [2624, 192, 1, 64, 2624, 2624, 2624, 64]
    - [9, 5140.04]
  - - [2688, 192, 1, 64, 2688, 2688, 2688, 64]
    - [1, 5246.13]
  - - [2752, 192, 1, 64, 2752, 2752, 2752, 64]
    - [4, 5304.52]
  - - [2816, 192, 1, 64, 2816, 2816, 2816, 64]
    - [3, 5383.92]
  - - [2880, 192, 1, 64, 2880, 2880, 2880, 64]
    - [11, 5479.85]
  - - [2944, 192, 1, 64, 2944, 2944, 2944, 64]
    - [0, 5614.67]
  - - [3008, 192, 1, 64, 3008, 3008, 3008, 64]
    - [1, 5685.57]
  - - [3072, 192, 1, 64, 3072, 3072, 3072, 64]
    - [3, 5722.91]
  - - [3136, 192, 1, 64, 3136, 3136, 3136, 64]
    - [3, 5799.97]
  - - [3200, 192, 1, 64, 3200, 3200, 3200, 64]
    - [1, 5891.74]
  - - [3264, 192, 1, 64, 3264, 3264, 3264, 64]
    - [3, 5967.5]
  - - [3328, 192, 1, 64, 3328, 3328, 3328, 64]
    - [3, 6036.89]
  - - [3392, 192, 1, 64, 3392, 3392, 3392, 64]
    - [3, 6120.45]
  - - [3456, 192, 1, 64, 3456, 3456, 3456, 64]
    - [3, 6212.24]
  - - [3520, 192, 1, 64, 3520, 3520, 3520, 64]
    - [9, 6351.41]
  - - [3584, 192, 1, 64, 3584, 3584, 3584, 64]
    - [9, 6442.3]
  - - [3648, 192, 1, 64, 3648, 3648, 3648, 64]
    - [0, 6519.22]
  - - [3712, 192, 1, 64, 3712, 3712, 3712, 64]
    - [4, 6617.23]
  - - [3776, 192, 1, 64, 3776, 3776, 3776, 64]
    - [0, 6616.09]
  - - [3840, 192, 1, 64, 3840, 3840, 3840, 64]
    - [3, 6708.14]
  - - [3904, 192, 1, 64, 3904, 3904, 3904, 64]
    - [4, 6832.6]
  - - [3968, 192, 1, 64, 3968, 3968, 3968, 64]
    - [4, 6859.58]
  - - [4032, 192, 1, 64, 4032, 4032, 4032, 64]
    - [9, 6941.93]
  - - [4096, 192, 1, 64, 4096, 4096, 4096, 64]
    - [1, 7001.18]
  - - [64, 256, 1, 64, 64, 64, 64, 64]
    - [17, 205.803]
  - - [128, 256, 1, 64, 128, 128, 128, 64]
    - [6, 406.025]
  - - [192, 256, 1, 64, 192, 192, 192, 64]
    - [16, 585.238]
  - - [256, 256, 1, 64, 256, 256, 256, 64]
    - [7, 808.763]
  - - [320, 256, 1, 64, 320, 320, 320, 64]
    - [11, 1003.99]
  - - [384, 256, 1, 64, 384, 384, 384, 64]
    - [17, 1170.92]
  - - [448, 256, 1, 64, 448, 448, 448, 64]
    - [16, 1383.35]
  - - [512, 256, 1, 64, 512, 512, 512, 64]
    - [6, 1583.64]
  - - [576, 256, 1, 64, 576, 576, 576, 64]
    - [7, 1740.5]
  - - [640, 256, 1, 64, 640, 640, 640, 64]
    - [6, 1880.49]
  - - [704, 256, 1, 64, 704, 704, 704, 64]
    - [7, 2081.23]
  - - [768, 256, 1, 64, 768, 768, 768, 64]
    - [2, 2282.78]
  - - [832, 256, 1, 64, 832, 832, 832, 64]
    - [4, 2416.06]
  - - [896, 256, 1, 64, 896, 896, 896, 64]
    - [18, 2840.56]
  - - [960, 256, 1, 64, 960, 960, 960, 64]
    - [4, 3231.67]
  - - [1024, 256, 1, 64, 1024, 1024, 1024, 64]
    - [6, 3162.51]
  - - [1088, 256, 1, 64, 1088, 1088, 1088, 64]
    - [4, 3343.16]
  - - [1152, 256, 1, 64, 1152, 1152, 1152, 64]
    - [3, 3439.19]
  - - [1216, 256, 1, 64, 1216, 1216, 1216, 64]
    - [1, 3594.24]
  - - [1280, 256, 1, 64, 1280, 1280, 1280, 64]
    - [0, 3773.88]
  - - [1344, 256, 1, 64, 1344, 1344, 1344, 64]
    - [6, 4082.31]
  - - [1408, 256, 1, 64, 1408, 1408, 1408, 64]
    - [7, 4201.18]
  - - [1472, 256, 1, 64, 1472, 1472, 1472, 64]
    - [6, 4305.08]
  - - [1536, 256, 1, 64, 1536, 1536, 1536, 64]
    - [0, 4404.99]
  - - [1600, 256, 1, 64, 1600, 1600, 1600, 64]
    - [4, 4572.52]
  - - [1664, 256, 1, 64, 1664, 1664, 1664, 64]
    - [4, 4654.77]
  - - [1728, 256, 1, 64, 1728, 1728, 1728, 64]
    - [4, 4906.66]
  - - [1792, 256, 1, 64, 1792, 1792, 1792, 64]
    - [4, 4853.68]
  - - [1856, 256, 1, 64, 1856, 1856, 1856, 64]
    - [1, 5021.23]
  - - [1920, 256, 1, 64, 1920, 1920, 1920, 64]
    - [9, 5156.06]
  - - [1984, 256, 1, 64, 1984, 1984, 1984, 64]
    - [1, 5270.93]
  - - [2048, 256, 1, 64, 2048, 2048, 2048, 64]
    - [3, 5353.27]
  - - [2112, 256, 1, 64, 2112, 2112, 2112, 64]
    - [9, 5476.87]
  - - [2176, 256, 1, 64, 2176, 2176, 2176, 64]
    - [0, 5645.5]
  - - [2240, 256, 1, 64, 2240, 2240, 2240, 64]
    - [0, 5717.4]
  - - [2304, 256, 1, 64, 2304, 2304, 2304, 64]
    - [0, 5797.66]
  - - [2368, 256, 1, 64, 2368, 2368, 2368, 64]
    - [3, 5879.23]
  - - [2432, 256, 1, 64, 2432, 2432, 2432, 64]
    - [1, 5997.23]
  - - [2496, 256, 1, 64, 2496, 2496, 2496, 64]
    - [1, 6128.32]
  - - [2560, 256, 1, 64, 2560, 2560, 2560, 64]
    - [1, 6129.34]
  - - [2624, 256, 1, 64, 2624, 2624, 2624, 64]
    - [3, 6278.9]
  - - [2688, 256, 1, 64, 2688, 2688, 2688, 64]
    - [0, 6395.52]
  - - [2752, 256, 1, 64, 2752, 2752, 2752, 64]
    - [0, 6562.14]
  - - [2816, 256, 1, 64, 2816, 2816, 2816, 64]
    - [1, 6618.4]
  - - [2880, 256, 1, 64, 2880, 2880, 2880, 64]
    - [3, 6805.01]
  - - [2944, 256, 1, 64, 2944, 2944, 2944, 64]
    - [1, 6887.64]
  - - [3008, 256, 1, 64, 3008, 3008, 3008, 64]
    - [1, 6943.23]
  - - [3072, 256, 1, 64, 3072, 3072, 3072, 64]
    - [3, 6958.61]
  - - [3136, 256, 1, 64, 3136, 3136, 3136, 64]
    - [0, 7110.42]
  - - [3200, 256, 1, 64, 3200, 3200, 3200, 64]
    - [4, 7226.57]
  - - [3264, 256, 1, 64, 3264, 3264, 3264, 64]
    - [9, 7341.73]
  - - [3328, 256, 1, 64, 3328, 3328, 3328, 64]
    - [4, 7422.49]
  - - [3392, 256, 1, 64, 3392, 3392, 3392, 64]
    - [9, 7559.1]
  - - [3456, 256, 1, 64, 3456, 3456, 3456, 64]
    - [0, 7686.96]
  - - [3520, 256, 1, 64, 3520, 3520, 3520, 64]
    - [0, 7791.26]
  - - [3584, 256, 1, 64, 3584, 3584, 3584, 64]
    - [0, 7886.09]
  - - [3648, 256, 1, 64, 3648, 3648, 3648, 64]
    - [9, 8010.81]
  - - [3712, 256, 1, 64, 3712, 3712, 3712, 64]
    - [9, 8081.99]
  - - [3776, 256, 1, 64, 3776, 3776, 3776, 64]
    - [0, 8096.45]
  - - [3840, 256, 1, 64, 3840, 3840, 3840, 64]
    - [9, 8324.18]
  - - [3904, 256, 1, 64, 3904, 3904, 3904, 64]
    - [7, 8075.13]
  - - [3968, 256, 1, 64, 3968, 3968, 3968, 64]
    - [7, 9362.25]
  - - [4032, 256, 1, 64, 4032, 4032, 4032, 64]
    - [4, 9747.68]
  - - [4096, 256, 1, 64, 4096, 4096, 4096, 64]
    - [4, 9701.91]
  - - [64, 320, 1, 64, 64, 64, 64, 64]
    - [7, 276.465]
  - - [128, 320, 1, 64, 128, 128, 128, 64]
    - [5, 541.391]
  - - [192, 320, 1, 64, 192, 192, 192, 64]
    - [6, 843.078]
  - - [256, 320, 1, 64, 256, 256, 256, 64]
    - [15, 1153.04]
  - - [320, 320, 1, 64, 320, 320, 320, 64]
    - [7, 1362.76]
  - - [384, 320, 1, 64, 384, 384, 384, 64]
    - [18, 1690.87]
  - - [448, 320, 1, 64, 448, 448, 448, 64]
    - [18, 1840.86]
  - - [512, 320, 1, 64, 512, 512, 512, 64]
    - [14, 2155.34]
  - - [576, 320, 1, 64, 576, 576, 576, 64]
    - [11, 2317.12]
  - - [640, 320, 1, 64, 640, 640, 640, 64]
    - [2, 2653.8]
  - - [704, 320, 1, 64, 704, 704, 704, 64]
    - [17, 2910.36]
  - - [768, 320, 1, 64, 768, 768, 768, 64]
    - [7, 3085.83]
  - - [832, 320, 1, 64, 832, 832, 832, 64]
    - [8, 3319.57]
  - - [896, 320, 1, 64, 896, 896, 896, 64]
    - [6, 3583.97]
  - - [960, 320, 1, 64, 960, 960, 960, 64]
    - [6, 3889.38]
  - - [1024, 320, 1, 64, 1024, 1024, 1024, 64]
    - [7, 3968.87]
  - - [1088, 320, 1, 64, 1088, 1088, 1088, 64]
    - [14, 3978.23]
  - - [1152, 320, 1, 64, 1152, 1152, 1152, 64]
    - [7, 4212.99]
  - - [1216, 320, 1, 64, 1216, 1216, 1216, 64]
    - [4, 4404.59]
  - - [1280, 320, 1, 64, 1280, 1280, 1280, 64]
    - [7, 4479.54]
  - - [1344, 320, 1, 64, 1344, 1344, 1344, 64]
    - [6, 4625.27]
  - - [1408, 320, 1, 64, 1408, 1408, 1408, 64]
    - [4, 4793.95]
  - - [1472, 320, 1, 64, 1472, 1472, 1472, 64]
    - [4, 4932.34]
  - - [1536, 320, 1, 64, 1536, 1536, 1536, 64]
    - [3, 5050.9]
  - - [1600, 320, 1, 64, 1600, 1600, 1600, 64]
    - [11, 5266.47]
  - - [1664, 320, 1, 64, 1664, 1664, 1664, 64]
    - [4, 5409.32]
  - - [1728, 320, 1, 64, 1728, 1728, 1728, 64]
    - [9, 5607.56]
  - - [1792, 320, 1, 64, 1792, 1792, 1792, 64]
    - [3, 5758.67]
  - - [1856, 320, 1, 64, 1856, 1856, 1856, 64]
    - [1, 5814.68]
  - - [1920, 320, 1, 64, 1920, 1920, 1920, 64]
    - [0, 5959.6]
  - - [1984, 320, 1, 64, 1984, 1984, 1984, 64]
    - [1, 6154.5]
  - - [2048, 320, 1, 64, 2048, 2048, 2048, 64]
    - [1, 6243.36]
  - - [2112, 320, 1, 64, 2112, 2112, 2112, 64]
    - [1, 6447.1]
  - - [2176, 320, 1, 64, 2176, 2176, 2176, 64]
    - [1, 6535.32]
  - - [2240, 320, 1, 64, 2240, 2240, 2240, 64]
    - [4, 6709.82]
  - - [2304, 320, 1, 64, 2304, 2304, 2304, 64]
    - [1, 6777.59]
  - - [2368, 320, 1, 64, 2368, 2368, 2368, 64]
    - [9, 6932.0]
  - - [2432, 320, 1, 64, 2432, 2432, 2432, 64]
    - [4, 7002.23]
  - - [2496, 320, 1, 64, 2496, 2496, 2496, 64]
    - [4, 7137.38]
  - - [2560, 320, 1, 64, 2560, 2560, 2560, 64]
    - [4, 7169.21]
  - - [2624, 320, 1, 64, 2624, 2624, 2624, 64]
    - [4, 7436.94]
  - - [2688, 320, 1, 64, 2688, 2688, 2688, 64]
    - [4, 7523.48]
  - - [2752, 320, 1, 64, 2752, 2752, 2752, 64]
    - [4, 7701.69]
  - - [2816, 320, 1, 64, 2816, 2816, 2816, 64]
    - [9, 7698.67]
  - - [2880, 320, 1, 64, 2880, 2880, 2880, 64]
    - [9, 7896.93]
  - - [2944, 320, 1, 64, 2944, 2944, 2944, 64]
    - [9, 8035.81]
  - - [3008, 320, 1, 64, 3008, 3008, 3008, 64]
    - [9, 8120.65]
  - - [3072, 320, 1, 64, 3072, 3072, 3072, 64]
    - [0, 7978.01]
  - - [3136, 320, 1, 64, 3136, 3136, 3136, 64]
    - [9, 9630.39]
  - - [3200, 320, 1, 64, 3200, 3200, 3200, 64]
    - [4, 9743.65]
  - - [3264, 320, 1, 64, 3264, 3264, 3264, 64]
    - [4, 9898.78]
  - - [3328, 320, 1, 64, 3328, 3328, 3328, 64]
    - [4, 10018.6]
  - - [3392, 320, 1, 64, 3392, 3392, 3392, 64]
    - [4, 10122.0]
  - - [3456, 320, 1, 64, 3456, 3456, 3456, 64]
    - [4, 10266.6]
  - - [3520, 320, 1, 64, 3520, 3520, 3520, 64]
    - [4, 10400.9]
  - - [3584, 320, 1, 64, 3584, 3584, 3584, 64]
    - [4, 10466.2]
  - - [3648, 320, 1, 64, 3648, 3648, 3648, 64]
    - [4, 10663.7]
  - - [3712, 320, 1, 64, 3712, 3712, 3712, 64]
    - [4, 10847.7]
  - - [3776, 320, 1, 64, 3776, 3776, 3776, 64]
    - [9, 10922.5]
  - - [3840, 320, 1, 64, 3840, 3840, 3840, 64]
    - [9, 11204.3]
  - - [3904, 320, 1, 64, 3904, 3904, 3904, 64]
    - [0, 11280.1]
  - - [3968, 320, 1, 64, 3968, 3968, 3968, 64]
    - [0, 11432.8]
  - - [4032, 320, 1, 64, 4032, 4032, 4032, 64]
    - [0, 11721.0]
  - - [4096, 320, 1, 64, 4096, 4096, 4096, 64]
    - [0, 11543.3]
  - - [64, 384, 1, 64, 64, 64, 64, 64]
    - [17, 339.49]
  - - [128, 384, 1, 64, 128, 128, 128, 64]
    - [6, 657.538]
  - - [192, 384, 1, 64, 192, 192, 192, 64]
    - [12, 1009.74]
  - - [256, 384, 1, 64, 256, 256, 256, 64]
    - [18, 1391.3]
  - - [320, 384, 1, 64, 320, 320, 320, 64]
    - [6, 1608.89]
  - - [384, 384, 1, 64, 384, 384, 384, 64]
    - [7, 2052.88]
  - - [448, 384, 1, 64, 448, 448, 448, 64]
    - [16, 2199.35]
  - - [512, 384, 1, 64, 512, 512, 512, 64]
    - [0, 2535.82]
  - - [576, 384, 1, 64, 576, 576, 576, 64]
    - [15, 2852.79]
  - - [640, 384, 1, 64, 640, 640, 640, 64]
    - [7, 3122.61]
  - - [704, 384, 1, 64, 704, 704, 704, 64]
    - [2, 3376.51]
  - - [768, 384, 1, 64, 768, 768, 768, 64]
    - [5, 3591.66]
  - - [832, 384, 1, 64, 832, 832, 832, 64]
    - [15, 3986.53]
  - - [896, 384, 1, 64, 896, 896, 896, 64]
    - [7, 4128.99]
  - - [960, 384, 1, 64, 960, 960, 960, 64]
    - [4, 4606.18]
  - - [1024, 384, 1, 64, 1024, 1024, 1024, 64]
    - [9, 4787.95]
  - - [1088, 384, 1, 64, 1088, 1088, 1088, 64]
    - [6, 5056.36]
  - - [1152, 384, 1, 64, 1152, 1152, 1152, 64]
    - [4, 4856.1]
  - - [1216, 384, 1, 64, 1216, 1216, 1216, 64]
    - [4, 4971.56]
  - - [1280, 384, 1, 64, 1280, 1280, 1280, 64]
    - [0, 5139.18]
  - - [1344, 384, 1, 64, 1344, 1344, 1344, 64]
    - [1, 5303.45]
  - - [1408, 384, 1, 64, 1408, 1408, 1408, 64]
    - [9, 5475.96]
  - - [1472, 384, 1, 64, 1472, 1472, 1472, 64]
    - [3, 5650.69]
  - - [1536, 384, 1, 64, 1536, 1536, 1536, 64]
    - [0, 5816.36]
  - - [1600, 384, 1, 64, 1600, 1600, 1600, 64]
    - [4, 5920.99]
  - - [1664, 384, 1, 64, 1664, 1664, 1664, 64]
    - [1, 6137.45]
  - - [1728, 384, 1, 64, 1728, 1728, 1728, 64]
    - [3, 6320.46]
  - - [1792, 384, 1, 64, 1792, 1792, 1792, 64]
    - [0, 6469.77]
  - - [1856, 384, 1, 64, 1856, 1856, 1856, 64]
    - [0, 6639.36]
  - - [1920, 384, 1, 64, 1920, 1920, 1920, 64]
    - [4, 6783.39]
  - - [1984, 384, 1, 64, 1984, 1984, 1984, 64]
    - [3, 6926.87]
  - - [2048, 384, 1, 64, 2048, 2048, 2048, 64]
    - [9, 6977.88]
  - - [2112, 384, 1, 64, 2112, 2112, 2112, 64]
    - [9, 7141.39]
  - - [2176, 384, 1, 64, 2176, 2176, 2176, 64]
    - [4, 7374.1]
  - - [2240, 384, 1, 64, 2240, 2240, 2240, 64]
    - [9, 7496.84]
  - - [2304, 384, 1, 64, 2304, 2304, 2304, 64]
    - [0, 7657.93]
  - - [2368, 384, 1, 64, 2368, 2368, 2368, 64]
    - [0, 7801.98]
  - - [2432, 384, 1, 64, 2432, 2432, 2432, 64]
    - [0, 7970.16]
  - - [2496, 384, 1, 64, 2496, 2496, 2496, 64]
    - [9, 8157.11]
  - - [2560, 384, 1, 64, 2560, 2560, 2560, 64]
    - [9, 8341.76]
  - - [2624, 384, 1, 64, 2624, 2624, 2624, 64]
    - [7, 9473.59]
  - - [2688, 384, 1, 64, 2688, 2688, 2688, 64]
    - [4, 9914.35]
  - - [2752, 384, 1, 64, 2752, 2752, 2752, 64]
    - [0, 10161.0]
  - - [2816, 384, 1, 64, 2816, 2816, 2816, 64]
    - [4, 10089.6]
  - - [2880, 384, 1, 64, 2880, 2880, 2880, 64]
    - [4, 10195.7]
  - - [2944, 384, 1, 64, 2944, 2944, 2944, 64]
    - [4, 10429.7]
  - - [3008, 384, 1, 64, 3008, 3008, 3008, 64]
    - [9, 10590.8]
  - - [3072, 384, 1, 64, 3072, 3072, 3072, 64]
    - [0, 10636.4]
  - - [3136, 384, 1, 64, 3136, 3136, 3136, 64]
    - [9, 10966.1]
  - - [3200, 384, 1, 64, 3200, 3200, 3200, 64]
    - [0, 11210.5]
  - - [3264, 384, 1, 64, 3264, 3264, 3264, 64]
    - [0, 11581.7]
  - - [3328, 384, 1, 64, 3328, 3328, 3328, 64]
    - [0, 11679.0]
  - - [3392, 384, 1, 64, 3392, 3392, 3392, 64]
    - [0, 11852.7]
  - - [3456, 384, 1, 64, 3456, 3456, 3456, 64]
    - [9, 12093.7]
  - - [3520, 384, 1, 64, 3520, 3520, 3520, 64]
    - [0, 12189.1]
  - - [3584, 384, 1, 64, 3584, 3584, 3584, 64]
    - [0, 12090.6]
  - - [3648, 384, 1, 64, 3648, 3648, 3648, 64]
    - [9, 12408.7]
  - - [3712, 384, 1, 64, 3712, 3712, 3712, 64]
    - [9, 12448.8]
  - - [3776, 384, 1, 64, 3776, 3776, 3776, 64]
    - [9, 12503.1]
  - - [3840, 384, 1, 64, 3840, 3840, 3840, 64]
    - [0, 12981.0]
  - - [3904, 384, 1, 64, 3904, 3904, 3904, 64]
    - [0, 12736.5]
  - - [3968, 384, 1, 64, 3968, 3968, 3968, 64]
    - [0, 12924.6]
  - - [4032, 384, 1, 64, 4032, 4032, 4032, 64]
    - [0, 13178.7]
  - - [4096, 384, 1, 64, 4096, 4096, 4096, 64]
    - [0, 13047.7]
  - - [64, 448, 1, 64, 64, 64, 64, 64]
    - [15, 381.967]
  - - [128, 448, 1, 64, 128, 128, 128, 64]
    - [6, 729.473]
  - - [192, 448, 1, 64, 192, 192, 192, 64]
    - [7, 1138.81]
  - - [256, 448, 1, 64, 256, 256, 256, 64]
    - [4, 1519.98]
  - - [320, 448, 1, 64, 320, 320, 320, 64]
    - [6, 1892.91]
  - - [384, 448, 1, 64, 384, 384, 384, 64]
    - [17, 2310.1]
  - - [448, 448, 1, 64, 448, 448, 448, 64]
    - [4, 2495.15]
  - - [512, 448, 1, 64, 512, 512, 512, 64]
    - [1, 2848.27]
  - - [576, 448, 1, 64, 576, 576, 576, 64]
    - [5, 3267.04]
  - - [640, 448, 1, 64, 640, 640, 640, 64]
    - [5, 3544.49]
  - - [704, 448, 1, 64, 704, 704, 704, 64]
    - [6, 3982.83]
  - - [768, 448, 1, 64, 768, 768, 768, 64]
    - [10, 4160.21]
  - - [832, 448, 1, 64, 832, 832, 832, 64]
    - [5, 4483.18]
  - - [896, 448, 1, 64, 896, 896, 896, 64]
    - [6, 4736.29]
  - - [960, 448, 1, 64, 960, 960, 960, 64]
    - [7, 5249.83]
  - - [1024, 448, 1, 64, 1024, 1024, 1024, 64]
    - [7, 5443.08]
  - - [1088, 448, 1, 64, 1088, 1088, 1088, 64]
    - [4, 5680.0]
  - - [1152, 448, 1, 64, 1152, 1152, 1152, 64]
    - [1, 5322.25]
  - - [1216, 448, 1, 64, 1216, 1216, 1216, 64]
    - [1, 5590.95]
  - - [1280, 448, 1, 64, 1280, 1280, 1280, 64]
    - [1, 5746.05]
  - - [1344, 448, 1, 64, 1344, 1344, 1344, 64]
    - [0, 5887.7]
  - - [1408, 448, 1, 64, 1408, 1408, 1408, 64]
    - [1, 6114.84]
  - - [1472, 448, 1, 64, 1472, 1472, 1472, 64]
    - [1, 6315.28]
  - - [1536, 448, 1, 64, 1536, 1536, 1536, 64]
    - [1, 6473.64]
  - - [1600, 448, 1, 64, 1600, 1600, 1600, 64]
    - [1, 6691.25]
  - - [1664, 448, 1, 64, 1664, 1664, 1664, 64]
    - [3, 6877.59]
  - - [1728, 448, 1, 64, 1728, 1728, 1728, 64]
    - [4, 7018.71]
  - - [1792, 448, 1, 64, 1792, 1792, 1792, 64]
    - [4, 7139.98]
  - - [1856, 448, 1, 64, 1856, 1856, 1856, 64]
    - [4, 7292.73]
  - - [1920, 448, 1, 64, 1920, 1920, 1920, 64]
    - [4, 7516.39]
  - - [1984, 448, 1, 64, 1984, 1984, 1984, 64]
    - [9, 7662.34]
  - - [2048, 448, 1, 64, 2048, 2048, 2048, 64]
    - [6, 7574.83]
  - - [2112, 448, 1, 64, 2112, 2112, 2112, 64]
    - [9, 8001.44]
  - - [2176, 448, 1, 64, 2176, 2176, 2176, 64]
    - [0, 8237.4]
  - - [2240, 448, 1, 64, 2240, 2240, 2240, 64]
    - [4, 8168.01]
  - - [2304, 448, 1, 64, 2304, 2304, 2304, 64]
    - [7, 9500.94]
  - - [2368, 448, 1, 64, 2368, 2368, 2368, 64]
    - [4, 9921.83]
  - - [2432, 448, 1, 64, 2432, 2432, 2432, 64]
    - [3, 10005.6]
  - - [2496, 448, 1, 64, 2496, 2496, 2496, 64]
    - [4, 10376.3]
  - - [2560, 448, 1, 64, 2560, 2560, 2560, 64]
    - [0, 10354.0]
  - - [2624, 448, 1, 64, 2624, 2624, 2624, 64]
    - [9, 10605.4]
  - - [2688, 448, 1, 64, 2688, 2688, 2688, 64]
    - [9, 11013.1]
  - - [2752, 448, 1, 64, 2752, 2752, 2752, 64]
    - [9, 11181.0]
  - - [2816, 448, 1, 64, 2816, 2816, 2816, 64]
    - [0, 11220.1]
  - - [2880, 448, 1, 64, 2880, 2880, 2880, 64]
    - [0, 11502.2]
  - - [2944, 448, 1, 64, 2944, 2944, 2944, 64]
    - [0, 11798.8]
  - - [3008, 448, 1, 64, 3008, 3008, 3008, 64]
    - [0, 11966.7]
  - - [3072, 448, 1, 64, 3072, 3072, 3072, 64]
    - [3, 11569.5]
  - - [3136, 448, 1, 64, 3136, 3136, 3136, 64]
    - [9, 12225.0]
  - - [3200, 448, 1, 64, 3200, 3200, 3200, 64]
    - [9, 12417.1]
  - - [3264, 448, 1, 64, 3264, 3264, 3264, 64]
    - [0, 12839.1]
  - - [3328, 448, 1, 64, 3328, 3328, 3328, 64]
    - [9, 12698.9]
  - - [3392, 448, 1, 64, 3392, 3392, 3392, 64]
    - [0, 12955.1]
  - - [3456, 448, 1, 64, 3456, 3456, 3456, 64]
    - [9, 13318.5]
  - - [3520, 448, 1, 64, 3520, 3520, 3520, 64]
    - [0, 13302.4]
  - - [3584, 448, 1, 64, 3584, 3584, 3584, 64]
    - [0, 13147.4]
  - - [3648, 448, 1, 64, 3648, 3648, 3648, 64]
    - [0, 13778.9]
  - - [3712, 448, 1, 64, 3712, 3712, 3712, 64]
    - [0, 13797.0]
  - - [3776, 448, 1, 64, 3776, 3776, 3776, 64]
    - [0, 14000.4]
  - - [3840, 448, 1, 64, 3840, 3840, 3840, 64]
    - [0, 14011.2]
  - - [3904, 448, 1, 64, 3904, 3904, 3904, 64]
    - [0, 14330.4]
  - - [3968, 448, 1, 64, 3968, 3968, 3968, 64]
    - [0, 14334.1]
  - - [4032, 448, 1, 64, 4032, 4032, 4032, 64]
    - [0, 14594.7]
  - - [4096, 448, 1, 64, 4096, 4096, 4096, 64]
    - [0, 13788.9]
  - - [64, 512, 1, 64, 64, 64, 64, 64]
    - [18, 477.048]
  - - [128, 512, 1, 64, 128, 128, 128, 64]
    - [4, 864.787]
  - - [192, 512, 1, 64, 192, 192, 192, 64]
    - [17, 1341.44]
  - - [256, 512, 1, 64, 256, 256, 256, 64]
    - [6, 1698.42]
  - - [320, 512, 1, 64, 320, 320, 320, 64]
    - [1, 2120.91]
  - - [384, 512, 1, 64, 384, 384, 384, 64]
    - [7, 2444.71]
  - - [448, 512, 1, 64, 448, 448, 448, 64]
    - [15, 2749.06]
  - - [512, 512, 1, 64, 512, 512, 512, 64]
    - [2, 3181.68]
  - - [576, 512, 1, 64, 576, 576, 576, 64]
    - [15, 3599.16]
  - - [640, 512, 1, 64, 640, 640, 640, 64]
    - [4, 3866.38]
  - - [704, 512, 1, 64, 704, 704, 704, 64]
    - [4, 4355.78]
  - - [768, 512, 1, 64, 768, 768, 768, 64]
    - [10, 4569.75]
  - - [832, 512, 1, 64, 832, 832, 832, 64]
    - [1, 4795.51]
  - - [896, 512, 1, 64, 896, 896, 896, 64]
    - [7, 5209.34]
  - - [960, 512, 1, 64, 960, 960, 960, 64]
    - [11, 5644.59]
  - - [1024, 512, 1, 64, 1024, 1024, 1024, 64]
    - [1, 5867.13]
  - - [1088, 512, 1, 64, 1088, 1088, 1088, 64]
    - [4, 5494.11]
  - - [1152, 512, 1, 64, 1152, 1152, 1152, 64]
    - [9, 5762.24]
  - - [1216, 512, 1, 64, 1216, 1216, 1216, 64]
    - [3, 6003.58]
  - - [1280, 512, 1, 64, 1280, 1280, 1280, 64]
    - [1, 6226.63]
  - - [1344, 512, 1, 64, 1344, 1344, 1344, 64]
    - [3, 6448.97]
  - - [1408, 512, 1, 64, 1408, 1408, 1408, 64]
    - [3, 6674.91]
  - - [1472, 512, 1, 64, 1472, 1472, 1472, 64]
    - [9, 6867.98]
  - - [1536, 512, 1, 64, 1536, 1536, 1536, 64]
    - [1, 6968.13]
  - - [1600, 512, 1, 64, 1600, 1600, 1600, 64]
    - [4, 7264.57]
  - - [1664, 512, 1, 64, 1664, 1664, 1664, 64]
    - [4, 7443.71]
  - - [1728, 512, 1, 64, 1728, 1728, 1728, 64]
    - [4, 7693.3]
  - - [1792, 512, 1, 64, 1792, 1792, 1792, 64]
    - [9, 7847.13]
  - - [1856, 512, 1, 64, 1856, 1856, 1856, 64]
    - [0, 7992.75]
  - - [1920, 512, 1, 64, 1920, 1920, 1920, 64]
    - [9, 8316.53]
  - - [1984, 512, 1, 64, 1984, 1984, 1984, 64]
    - [9, 9343.31]
  - - [2048, 512, 1, 64, 2048, 2048, 2048, 64]
    - [4, 9548.68]
  - - [2112, 512, 1, 64, 2112, 2112, 2112, 64]
    - [4, 10031.2]
  - - [2176, 512, 1, 64, 2176, 2176, 2176, 64]
    - [0, 10254.8]
  - - [2240, 512, 1, 64, 2240, 2240, 2240, 64]
    - [0, 10568.7]
  - - [2304, 512, 1, 64, 2304, 2304, 2304, 64]
    - [0, 10618.3]
  - - [2368, 512, 1, 64, 2368, 2368, 2368, 64]
    - [9, 10956.4]
  - - [2432, 512, 1, 64, 2432, 2432, 2432, 64]
    - [0, 11345.6]
  - - [2496, 512, 1, 64, 2496, 2496, 2496, 64]
    - [0, 11655.6]
  - - [2560, 512, 1, 64, 2560, 2560, 2560, 64]
    - [0, 11458.2]
  - - [2624, 512, 1, 64, 2624, 2624, 2624, 64]
    - [0, 11963.6]
  - - [2688, 512, 1, 64, 2688, 2688, 2688, 64]
    - [0, 12236.7]
  - - [2752, 512, 1, 64, 2752, 2752, 2752, 64]
    - [0, 12300.7]
  - - [2816, 512, 1, 64, 2816, 2816, 2816, 64]
    - [0, 12306.5]
  - - [2880, 512, 1, 64, 2880, 2880, 2880, 64]
    - [9, 12670.7]
  - - [2944, 512, 1, 64, 2944, 2944, 2944, 64]
    - [0, 12876.3]
  - - [3008, 512, 1, 64, 3008, 3008, 3008, 64]
    - [9, 12928.3]
  - - [3072, 512, 1, 64, 3072, 3072, 3072, 64]
    - [0, 12600.2]
  - - [3136, 512, 1, 64, 3136, 3136, 3136, 64]
    - [0, 13430.9]
  - - [3200, 512, 1, 64, 3200, 3200, 3200, 64]
    - [0, 13598.4]
  - - [3264, 512, 1, 64, 3264, 3264, 3264, 64]
    - [0, 14048.9]
  - - [3328, 512, 1, 64, 3328, 3328, 3328, 64]
    - [0, 13950.5]
  - - [3392, 512, 1, 64, 3392, 3392, 3392, 64]
    - [0, 14273.5]
  - - [3456, 512, 1, 64, 3456, 3456, 3456, 64]
    - [0, 14345.9]
  - - [3520, 512, 1, 64, 3520, 3520, 3520, 64]
    - [0, 14523.2]
  - - [3584, 512, 1, 64, 3584, 3584, 3584, 64]
    - [0, 14261.1]
  - - [3648, 512, 1, 64, 3648, 3648, 3648, 64]
    - [0, 14923.4]
  - - [3712, 512, 1, 64, 3712, 3712, 3712, 64]
    - [0, 14973.9]
  - - [3776, 512, 1, 64, 3776, 3776, 3776, 64]
    - [0, 15081.8]
  - - [3840, 512, 1, 64, 3840, 3840, 3840, 64]
    - [0, 15051.3]
  - - [3904, 512, 1, 64, 3904, 3904, 3904, 64]
    - [0, 14700.8]
  - - [3968, 512, 1, 64, 3968, 3968, 3968, 64]
    - [0, 14753.5]
  - - [4032, 512, 1, 64, 4032, 4032, 4032, 64]
    - [0, 14923.8]
  - - [4096, 512, 1, 64, 4096, 4096, 4096, 64]
    - [3, 14316.5]
  - - [64, 576, 1, 64, 64, 64, 64, 64]
    - [17, 481.096]
  - - [128, 576, 1, 64, 128, 128, 128, 64]
    - [7, 973.694]
  - - [192, 576, 1, 64, 192, 192, 192, 64]
    - [4, 1445.34]
  - - [256, 576, 1, 64, 256, 256, 256, 64]
    - [7, 1835.98]
  - - [320, 576, 1, 64, 320, 320, 320, 64]
    - [0, 2303.55]
  - - [384, 576, 1, 64, 384, 384, 384, 64]
    - [4, 2716.48]
  - - [448, 576, 1, 64, 448, 448, 448, 64]
    - [17, 3228.06]
  - - [512, 576, 1, 64, 512, 512, 512, 64]
    - [2, 3452.37]
  - - [576, 576, 1, 64, 576, 576, 576, 64]
    - [15, 3908.96]
  - - [640, 576, 1, 64, 640, 640, 640, 64]
    - [12, 4433.06]
  - - [704, 576, 1, 64, 704, 704, 704, 64]
    - [6, 4908.62]
  - - [768, 576, 1, 64, 768, 768, 768, 64]
    - [6, 5225.37]
  - - [832, 576, 1, 64, 832, 832, 832, 64]
    - [4, 5590.72]
  - - [896, 576, 1, 64, 896, 896, 896, 64]
    - [4, 5699.77]
  - - [960, 576, 1, 64, 960, 960, 960, 64]
    - [4, 6234.9]
  - - [1024, 576, 1, 64, 1024, 1024, 1024, 64]
    - [11, 6240.39]
  - - [1088, 576, 1, 64, 1088, 1088, 1088, 64]
    - [3, 6052.19]
  - - [1152, 576, 1, 64, 1152, 1152, 1152, 64]
    - [9, 6311.07]
  - - [1216, 576, 1, 64, 1216, 1216, 1216, 64]
    - [3, 6615.48]
  - - [1280, 576, 1, 64, 1280, 1280, 1280, 64]
    - [1, 6809.89]
  - - [1344, 576, 1, 64, 1344, 1344, 1344, 64]
    - [1, 7009.77]
  - - [1408, 576, 1, 64, 1408, 1408, 1408, 64]
    - [7, 7158.23]
  - - [1472, 576, 1, 64, 1472, 1472, 1472, 64]
    - [4, 7473.32]
  - - [1536, 576, 1, 64, 1536, 1536, 1536, 64]
    - [6, 7325.04]
  - - [1600, 576, 1, 64, 1600, 1600, 1600, 64]
    - [9, 7896.91]
  - - [1664, 576, 1, 64, 1664, 1664, 1664, 64]
    - [0, 8095.75]
  - - [1728, 576, 1, 64, 1728, 1728, 1728, 64]
    - [7, 8225.82]
  - - [1792, 576, 1, 64, 1792, 1792, 1792, 64]
    - [9, 9439.88]
  - - [1856, 576, 1, 64, 1856, 1856, 1856, 64]
    - [4, 9944.56]
  - - [1920, 576, 1, 64, 1920, 1920, 1920, 64]
    - [9, 10219.2]
  - - [1984, 576, 1, 64, 1984, 1984, 1984, 64]
    - [9, 10302.6]
  - - [2048, 576, 1, 64, 2048, 2048, 2048, 64]
    - [4, 10439.2]
  - - [2112, 576, 1, 64, 2112, 2112, 2112, 64]
    - [0, 10971.8]
  - - [2176, 576, 1, 64, 2176, 2176, 2176, 64]
    - [0, 11366.7]
  - - [2240, 576, 1, 64, 2240, 2240, 2240, 64]
    - [0, 11709.4]
  - - [2304, 576, 1, 64, 2304, 2304, 2304, 64]
    - [0, 11734.5]
  - - [2368, 576, 1, 64, 2368, 2368, 2368, 64]
    - [0, 12178.2]
  - - [2432, 576, 1, 64, 2432, 2432, 2432, 64]
    - [0, 12400.1]
  - - [2496, 576, 1, 64, 2496, 2496, 2496, 64]
    - [0, 12554.5]
  - - [2560, 576, 1, 64, 2560, 2560, 2560, 64]
    - [0, 12440.3]
  - - [2624, 576, 1, 64, 2624, 2624, 2624, 64]
    - [0, 12912.9]
  - - [2688, 576, 1, 64, 2688, 2688, 2688, 64]
    - [0, 13191.0]
  - - [2752, 576, 1, 64, 2752, 2752, 2752, 64]
    - [0, 13375.0]
  - - [2816, 576, 1, 64, 2816, 2816, 2816, 64]
    - [0, 13448.4]
  - - [2880, 576, 1, 64, 2880, 2880, 2880, 64]
    - [0, 13800.6]
  - - [2944, 576, 1, 64, 2944, 2944, 2944, 64]
    - [0, 14034.2]
  - - [3008, 576, 1, 64, 3008, 3008, 3008, 64]
    - [0, 14136.3]
  - - [3072, 576, 1, 64, 3072, 3072, 3072, 64]
    - [0, 13446.4]
  - - [3136, 576, 1, 64, 3136, 3136, 3136, 64]
    - [0, 14494.1]
  - - [3200, 576, 1, 64, 3200, 3200, 3200, 64]
    - [0, 14646.7]
  - - [3264, 576, 1, 64, 3264, 3264, 3264, 64]
    - [0, 14937.6]
  - - [3328, 576, 1, 64, 3328, 3328, 3328, 64]
    - [0, 14847.2]
  - - [3392, 576, 1, 64, 3392, 3392, 3392, 64]
    - [9, 14480.8]
  - - [3456, 576, 1, 64, 3456, 3456, 3456, 64]
    - [9, 14540.2]
  - - [3520, 576, 1, 64, 3520, 3520, 3520, 64]
    - [0, 14725.3]
  - - [3584, 576, 1, 64, 3584, 3584, 3584, 64]
    - [3, 14660.4]
  - - [3648, 576, 1, 64, 3648, 3648, 3648, 64]
    - [3, 15052.3]
  - - [3712, 576, 1, 64, 3712, 3712, 3712, 64]
    - [0, 15287.5]
  - - [3776, 576, 1, 64, 3776, 3776, 3776, 64]
    - [0, 15217.9]
  - - [3840, 576, 1, 64, 3840, 3840, 3840, 64]
    - [3, 15315.1]
  - - [3904, 576, 1, 64, 3904, 3904, 3904, 64]
    - [0, 15706.1]
  - - [3968, 576, 1, 64, 3968, 3968, 3968, 64]
    - [0, 15720.1]
  - - [4032, 576, 1, 64, 4032, 4032, 4032, 64]
    - [9, 16040.9]
  - - [4096, 576, 1, 64, 4096, 4096, 4096, 64]
    - [3, 15051.3]
  - - [64, 640, 1, 64, 64, 64, 64, 64]
    - [16, 525.018]
  - - [128, 640, 1, 64, 128, 128, 128, 64]
    - [18, 1127.99]
  - - [192, 640, 1, 64, 192, 192, 192, 64]
    - [5, 1547.77]
  - - [256, 640, 1, 64, 256, 256, 256, 64]
    - [17, 2152.25]
  - - [320, 640, 1, 64, 320, 320, 320, 64]
    - [15, 2502.76]
  - - [384, 640, 1, 64, 384, 384, 384, 64]
    - [14, 3104.1]
  - - [448, 640, 1, 64, 448, 448, 448, 64]
    - [4, 3746.41]
  - - [512, 640, 1, 64, 512, 512, 512, 64]
    - [8, 3788.17]
  - - [576, 640, 1, 64, 576, 576, 576, 64]
    - [12, 4340.87]
  - - [640, 640, 1, 64, 640, 640, 640, 64]
    - [6, 4719.85]
  - - [704, 640, 1, 64, 704, 704, 704, 64]
    - [4, 5185.35]
  - - [768, 640, 1, 64, 768, 768, 768, 64]
    - [7, 5657.76]
  - - [832, 640, 1, 64, 832, 832, 832, 64]
    - [0, 6014.6]
  - - [896, 640, 1, 64, 896, 896, 896, 64]
    - [11, 6363.77]
  - - [960, 640, 1, 64, 960, 960, 960, 64]
    - [4, 6647.66]
  - - [1024, 640, 1, 64, 1024, 1024, 1024, 64]
    - [4, 6945.33]
  - - [1088, 640, 1, 64, 1088, 1088, 1088, 64]
    - [1, 6553.55]
  - - [1152, 640, 1, 64, 1152, 1152, 1152, 64]
    - [3, 6817.76]
  - - [1216, 640, 1, 64, 1216, 1216, 1216, 64]
    - [1, 7012.11]
  - - [1280, 640, 1, 64, 1280, 1280, 1280, 64]
    - [7, 7225.53]
  - - [1344, 640, 1, 64, 1344, 1344, 1344, 64]
    - [4, 7541.1]
  - - [1408, 640, 1, 64, 1408, 1408, 1408, 64]
    - [0, 7694.64]
  - - [1472, 640, 1, 64, 1472, 1472, 1472, 64]
    - [9, 8002.78]
  - - [1536, 640, 1, 64, 1536, 1536, 1536, 64]
    - [6, 7879.98]
  - - [1600, 640, 1, 64, 1600, 1600, 1600, 64]
    - [9, 9480.01]
  - - [1664, 640, 1, 64, 1664, 1664, 1664, 64]
    - [4, 9949.96]
  - - [1728, 640, 1, 64, 1728, 1728, 1728, 64]
    - [0, 10259.3]
  - - [1792, 640, 1, 64, 1792, 1792, 1792, 64]
    - [3, 10405.3]
  - - [1856, 640, 1, 64, 1856, 1856, 1856, 64]
    - [0, 10702.6]
  - - [1920, 640, 1, 64, 1920, 1920, 1920, 64]
    - [9, 11056.2]
  - - [1984, 640, 1, 64, 1984, 1984, 1984, 64]
    - [0, 11383.0]
  - - [2048, 640, 1, 64, 2048, 2048, 2048, 64]
    - [4, 11098.8]
  - - [2112, 640, 1, 64, 2112, 2112, 2112, 64]
    - [0, 11834.0]
  - - [2176, 640, 1, 64, 2176, 2176, 2176, 64]
    - [0, 12167.7]
  - - [2240, 640, 1, 64, 2240, 2240, 2240, 64]
    - [0, 12460.8]
  - - [2304, 640, 1, 64, 2304, 2304, 2304, 64]
    - [0, 12584.4]
  - - [2368, 640, 1, 64, 2368, 2368, 2368, 64]
    - [0, 12908.3]
  - - [2432, 640, 1, 64, 2432, 2432, 2432, 64]
    - [0, 13160.8]
  - - [2496, 640, 1, 64, 2496, 2496, 2496, 64]
    - [0, 13381.6]
  - - [2560, 640, 1, 64, 2560, 2560, 2560, 64]
    - [0, 13191.2]
  - - [2624, 640, 1, 64, 2624, 2624, 2624, 64]
    - [0, 13969.2]
  - - [2688, 640, 1, 64, 2688, 2688, 2688, 64]
    - [0, 14046.9]
  - - [2752, 640, 1, 64, 2752, 2752, 2752, 64]
    - [0, 14265.0]
  - - [2816, 640, 1, 64, 2816, 2816, 2816, 64]
    - [0, 14241.7]
  - - [2880, 640, 1, 64, 2880, 2880, 2880, 64]
    - [0, 14694.1]
  - - [2944, 640, 1, 64, 2944, 2944, 2944, 64]
    - [0, 14841.2]
  - - [3008, 640, 1, 64, 3008, 3008, 3008, 64]
    - [0, 15147.1]
  - - [3072, 640, 1, 64, 3072, 3072, 3072, 64]
    - [0, 14224.3]
  - - [3136, 640, 1, 64, 3136, 3136, 3136, 64]
    - [0, 14718.7]
  - - [3200, 640, 1, 64, 3200, 3200, 3200, 64]
    - [0, 14881.0]
  - - [3264, 640, 1, 64, 3264, 3264, 3264, 64]
    - [0, 14947.8]
  - - [3328, 640, 1, 64, 3328, 3328, 3328, 64]
    - [0, 15115.8]
  - - [3392, 640, 1, 64, 3392, 3392, 3392, 64]
    - [0, 15511.4]
  - - [3456, 640, 1, 64, 3456, 3456, 3456, 64]
    - [0, 15530.1]
  - - [3520, 640, 1, 64, 3520, 3520, 3520, 64]
    - [0, 15762.2]
  - - [3584, 640, 1, 64, 3584, 3584, 3584, 64]
    - [0, 15433.1]
  - - [3648, 640, 1, 64, 3648, 3648, 3648, 64]
    - [0, 15924.7]
  - - [3712, 640, 1, 64, 3712, 3712, 3712, 64]
    - [0, 15927.4]
  - - [3776, 640, 1, 64, 3776, 3776, 3776, 64]
    - [0, 15869.5]
  - - [3840, 640, 1, 64, 3840, 3840, 3840, 64]
    - [0, 16170.0]
  - - [3904, 640, 1, 64, 3904, 3904, 3904, 64]
    - [0, 16531.3]
  - - [3968, 640, 1, 64, 3968, 3968, 3968, 64]
    - [0, 16666.2]
  - - [4032, 640, 1, 64, 4032, 4032, 4032, 64]
    - [0, 16900.3]
  - - [4096, 640, 1, 64, 4096, 4096, 4096, 64]
    - [0, 15890.4]
  - - [64, 704, 1, 64, 64, 64, 64, 64]
    - [5, 640.366]
  - - [128, 704, 1, 64, 128, 128, 128, 64]
    - [17, 1172.65]
  - - [192, 704, 1, 64, 192, 192, 192, 64]
    - [4, 1793.27]
  - - [256, 704, 1, 64, 256, 256, 256, 64]
    - [2, 2219.4]
  - - [320, 704, 1, 64, 320, 320, 320, 64]
    - [6, 2851.6]
  - - [384, 704, 1, 64, 384, 384, 384, 64]
    - [14, 3312.51]
  - - [448, 704, 1, 64, 448, 448, 448, 64]
    - [0, 3698.21]
  - - [512, 704, 1, 64, 512, 512, 512, 64]
    - [15, 4257.0]
  - - [576, 704, 1, 64, 576, 576, 576, 64]
    - [6, 4583.56]
  - - [640, 704, 1, 64, 640, 640, 640, 64]
    - [4, 5122.66]
  - - [704, 704, 1, 64, 704, 704, 704, 64]
    - [4, 5493.47]
  - - [768, 704, 1, 64, 768, 768, 768, 64]
    - [11, 5782.52]
  - - [832, 704, 1, 64, 832, 832, 832, 64]
    - [7, 6373.02]
  - - [896, 704, 1, 64, 896, 896, 896, 64]
    - [9, 7039.23]
  - - [960, 704, 1, 64, 960, 960, 960, 64]
    - [9, 7433.16]
  - - [1024, 704, 1, 64, 1024, 1024, 1024, 64]
    - [1, 7912.39]
  - - [1088, 704, 1, 64, 1088, 1088, 1088, 64]
    - [1, 6957.25]
  - - [1152, 704, 1, 64, 1152, 1152, 1152, 64]
    - [4, 7160.18]
  - - [1216, 704, 1, 64, 1216, 1216, 1216, 64]
    - [9, 7460.13]
  - - [1280, 704, 1, 64, 1280, 1280, 1280, 64]
    - [4, 7697.77]
  - - [1344, 704, 1, 64, 1344, 1344, 1344, 64]
    - [9, 8054.7]
  - - [1408, 704, 1, 64, 1408, 1408, 1408, 64]
    - [7, 8099.9]
  - - [1472, 704, 1, 64, 1472, 1472, 1472, 64]
    - [9, 9630.02]
  - - [1536, 704, 1, 64, 1536, 1536, 1536, 64]
    - [9, 9911.99]
  - - [1600, 704, 1, 64, 1600, 1600, 1600, 64]
    - [9, 10330.9]
  - - [1664, 704, 1, 64, 1664, 1664, 1664, 64]
    - [9, 10813.9]
  - - [1728, 704, 1, 64, 1728, 1728, 1728, 64]
    - [9, 11093.8]
  - - [1792, 704, 1, 64, 1792, 1792, 1792, 64]
    - [0, 11308.1]
  - - [1856, 704, 1, 64, 1856, 1856, 1856, 64]
    - [0, 11588.6]
  - - [1920, 704, 1, 64, 1920, 1920, 1920, 64]
    - [9, 11928.7]
  - - [1984, 704, 1, 64, 1984, 1984, 1984, 64]
    - [9, 12024.5]
  - - [2048, 704, 1, 64, 2048, 2048, 2048, 64]
    - [3, 11741.2]
  - - [2112, 704, 1, 64, 2112, 2112, 2112, 64]
    - [9, 12492.9]
  - - [2176, 704, 1, 64, 2176, 2176, 2176, 64]
    - [0, 12879.7]
  - - [2240, 704, 1, 64, 2240, 2240, 2240, 64]
    - [0, 13110.4]
  - - [2304, 704, 1, 64, 2304, 2304, 2304, 64]
    - [0, 13203.8]
  - - [2368, 704, 1, 64, 2368, 2368, 2368, 64]
    - [0, 13669.7]
  - - [2432, 704, 1, 64, 2432, 2432, 2432, 64]
    - [0, 13933.6]
  - - [2496, 704, 1, 64, 2496, 2496, 2496, 64]
    - [0, 14085.5]
  - - [2560, 704, 1, 64, 2560, 2560, 2560, 64]
    - [0, 13845.0]
  - - [2624, 704, 1, 64, 2624, 2624, 2624, 64]
    - [0, 14659.2]
  - - [2688, 704, 1, 64, 2688, 2688, 2688, 64]
    - [0, 14796.6]
  - - [2752, 704, 1, 64, 2752, 2752, 2752, 64]
    - [0, 15086.2]
  - - [2816, 704, 1, 64, 2816, 2816, 2816, 64]
    - [9, 14275.1]
  - - [2880, 704, 1, 64, 2880, 2880, 2880, 64]
    - [0, 14635.7]
  - - [2944, 704, 1, 64, 2944, 2944, 2944, 64]
    - [0, 14868.7]
  - - [3008, 704, 1, 64, 3008, 3008, 3008, 64]
    - [9, 15010.3]
  - - [3072, 704, 1, 64, 3072, 3072, 3072, 64]
    - [0, 14457.0]
  - - [3136, 704, 1, 64, 3136, 3136, 3136, 64]
    - [0, 15435.3]
  - - [3200, 704, 1, 64, 3200, 3200, 3200, 64]
    - [0, 15654.5]
  - - [3264, 704, 1, 64, 3264, 3264, 3264, 64]
    - [0, 15813.0]
  - - [3328, 704, 1, 64, 3328, 3328, 3328, 64]
    - [0, 15701.1]
  - - [3392, 704, 1, 64, 3392, 3392, 3392, 64]
    - [0, 16170.6]
  - - [3456, 704, 1, 64, 3456, 3456, 3456, 64]
    - [9, 16305.0]
  - - [3520, 704, 1, 64, 3520, 3520, 3520, 64]
    - [0, 16474.0]
  - - [3584, 704, 1, 64, 3584, 3584, 3584, 64]
    - [0, 16209.5]
  - - [3648, 704, 1, 64, 3648, 3648, 3648, 64]
    - [0, 16761.4]
  - - [3712, 704, 1, 64, 3712, 3712, 3712, 64]
    - [0, 16743.1]
  - - [3776, 704, 1, 64, 3776, 3776, 3776, 64]
    - [0, 16536.8]
  - - [3840, 704, 1, 64, 3840, 3840, 3840, 64]
    - [0, 16656.8]
  - - [3904, 704, 1, 64, 3904, 3904, 3904, 64]
    - [0, 17109.0]
  - - [3968, 704, 1, 64, 3968, 3968, 3968, 64]
    - [0, 17243.5]
  - - [4032, 704, 1, 64, 4032, 4032, 4032, 64]
    - [0, 17697.5]
  - - [4096, 704, 1, 64, 4096, 4096, 4096, 64]
    - [0, 16543.9]
  - - [64, 768, 1, 64, 64, 64, 64, 64]
    - [4, 705.463]
  - - [128, 768, 1, 64, 128, 128, 128, 64]
    - [7, 1368.59]
  - - [192, 768, 1, 64, 192, 192, 192, 64]
    - [5, 1906.88]
  - - [256, 768, 1, 64, 256, 256, 256, 64]
    - [15, 2653.5]
  - - [320, 768, 1, 64, 320, 320, 320, 64]
    - [15, 3089.45]
  - - [384, 768, 1, 64, 384, 384, 384, 64]
    - [8, 3615.02]
  - - [448, 768, 1, 64, 448, 448, 448, 64]
    - [14, 4021.15]
  - - [512, 768, 1, 64, 512, 512, 512, 64]
    - [15, 4549.96]
  - - [576, 768, 1, 64, 576, 576, 576, 64]
    - [6, 5071.89]
  - - [640, 768, 1, 64, 640, 640, 640, 64]
    - [3, 5544.04]
  - - [704, 768, 1, 64, 704, 704, 704, 64]
    - [0, 5956.74]
  - - [768, 768, 1, 64, 768, 768, 768, 64]
    - [3, 6358.14]
  - - [832, 768, 1, 64, 832, 832, 832, 64]
    - [7, 6685.27]
  - - [896, 768, 1, 64, 896, 896, 896, 64]
    - [4, 7212.55]
  - - [960, 768, 1, 64, 960, 960, 960, 64]
    - [1, 7552.1]
  - - [1024, 768, 1, 64, 1024, 1024, 1024, 64]
    - [1, 8099.72]
  - - [1088, 768, 1, 64, 1088, 1088, 1088, 64]
    - [4, 7358.91]
  - - [1152, 768, 1, 64, 1152, 1152, 1152, 64]
    - [0, 7635.24]
  - - [1216, 768, 1, 64, 1216, 1216, 1216, 64]
    - [9, 7966.92]
  - - [1280, 768, 1, 64, 1280, 1280, 1280, 64]
    - [9, 8196.19]
  - - [1344, 768, 1, 64, 1344, 1344, 1344, 64]
    - [7, 9442.51]
  - - [1408, 768, 1, 64, 1408, 1408, 1408, 64]
    - [9, 10048.8]
  - - [1472, 768, 1, 64, 1472, 1472, 1472, 64]
    - [9, 10227.7]
  - - [1536, 768, 1, 64, 1536, 1536, 1536, 64]
    - [0, 10430.7]
  - - [1600, 768, 1, 64, 1600, 1600, 1600, 64]
    - [0, 11020.5]
  - - [1664, 768, 1, 64, 1664, 1664, 1664, 64]
    - [0, 11615.9]
  - - [1728, 768, 1, 64, 1728, 1728, 1728, 64]
    - [0, 12003.2]
  - - [1792, 768, 1, 64, 1792, 1792, 1792, 64]
    - [0, 11880.2]
  - - [1856, 768, 1, 64, 1856, 1856, 1856, 64]
    - [3, 12041.3]
  - - [1920, 768, 1, 64, 1920, 1920, 1920, 64]
    - [9, 12561.1]
  - - [1984, 768, 1, 64, 1984, 1984, 1984, 64]
    - [0, 12725.6]
  - - [2048, 768, 1, 64, 2048, 2048, 2048, 64]
    - [0, 12316.5]
  - - [2112, 768, 1, 64, 2112, 2112, 2112, 64]
    - [0, 13382.6]
  - - [2176, 768, 1, 64, 2176, 2176, 2176, 64]
    - [0, 13673.5]
  - - [2240, 768, 1, 64, 2240, 2240, 2240, 64]
    - [0, 13812.5]
  - - [2304, 768, 1, 64, 2304, 2304, 2304, 64]
    - [9, 13797.0]
  - - [2368, 768, 1, 64, 2368, 2368, 2368, 64]
    - [0, 14135.4]
  - - [2432, 768, 1, 64, 2432, 2432, 2432, 64]
    - [0, 14431.6]
  - - [2496, 768, 1, 64, 2496, 2496, 2496, 64]
    - [0, 14786.3]
  - - [2560, 768, 1, 64, 2560, 2560, 2560, 64]
    - [0, 14625.9]
  - - [2624, 768, 1, 64, 2624, 2624, 2624, 64]
    - [9, 14530.5]
  - - [2688, 768, 1, 64, 2688, 2688, 2688, 64]
    - [9, 14657.2]
  - - [2752, 768, 1, 64, 2752, 2752, 2752, 64]
    - [9, 14958.0]
  - - [2816, 768, 1, 64, 2816, 2816, 2816, 64]
    - [0, 15110.4]
  - - [2880, 768, 1, 64, 2880, 2880, 2880, 64]
    - [0, 15445.3]
  - - [2944, 768, 1, 64, 2944, 2944, 2944, 64]
    - [0, 15497.7]
  - - [3008, 768, 1, 64, 3008, 3008, 3008, 64]
    - [0, 15676.7]
  - - [3072, 768, 1, 64, 3072, 3072, 3072, 64]
    - [0, 14908.5]
  - - [3136, 768, 1, 64, 3136, 3136, 3136, 64]
    - [0, 16059.6]
  - - [3200, 768, 1, 64, 3200, 3200, 3200, 64]
    - [0, 16282.0]
  - - [3264, 768, 1, 64, 3264, 3264, 3264, 64]
    - [0, 16524.0]
  - - [3328, 768, 1, 64, 3328, 3328, 3328, 64]
    - [0, 16645.7]
  - - [3392, 768, 1, 64, 3392, 3392, 3392, 64]
    - [0, 16955.5]
  - - [3456, 768, 1, 64, 3456, 3456, 3456, 64]
    - [0, 17096.1]
  - - [3520, 768, 1, 64, 3520, 3520, 3520, 64]
    - [0, 17241.1]
  - - [3584, 768, 1, 64, 3584, 3584, 3584, 64]
    - [0, 16838.0]
  - - [3648, 768, 1, 64, 3648, 3648, 3648, 64]
    - [0, 17525.7]
  - - [3712, 768, 1, 64, 3712, 3712, 3712, 64]
    - [0, 17670.8]
  - - [3776, 768, 1, 64, 3776, 3776, 3776, 64]
    - [0, 17573.8]
  - - [3840, 768, 1, 64, 3840, 3840, 3840, 64]
    - [0, 17790.8]
  - - [3904, 768, 1, 64, 3904, 3904, 3904, 64]
    - [3, 17657.9]
  - - [3968, 768, 1, 64, 3968, 3968, 3968, 64]
    - [3, 17772.5]
  - - [4032, 768, 1, 64, 4032, 4032, 4032, 64]
    - [3, 17731.1]
  - - [4096, 768, 1, 64, 4096, 4096, 4096, 64]
    - [3, 17064.4]
  - - [64, 832, 1, 64, 64, 64, 64, 64]
    - [5, 750.133]
  - - [128, 832, 1, 64, 128, 128, 128, 64]
    - [15, 1419.04]
  - - [192, 832, 1, 64, 192, 192, 192, 64]
    - [6, 2034.94]
  - - [256, 832, 1, 64, 256, 256, 256, 64]
    - [5, 2640.21]
  - - [320, 832, 1, 64, 320, 320, 320, 64]
    - [7, 3237.56]
  - - [384, 832, 1, 64, 384, 384, 384, 64]
    - [18, 3809.04]
  - - [448, 832, 1, 64, 448, 448, 448, 64]
    - [1, 4407.76]
  - - [512, 832, 1, 64, 512, 512, 512, 64]
    - [10, 4826.14]
  - - [576, 832, 1, 64, 576, 576, 576, 64]
    - [4, 5491.57]
  - - [640, 832, 1, 64, 640, 640, 640, 64]
    - [4, 6004.95]
  - - [704, 832, 1, 64, 704, 704, 704, 64]
    - [4, 6415.59]
  - - [768, 832, 1, 64, 768, 768, 768, 64]
    - [4, 6866.01]
  - - [832, 832, 1, 64, 832, 832, 832, 64]
    - [1, 7123.59]
  - - [896, 832, 1, 64, 896, 896, 896, 64]
    - [3, 7751.33]
  - - [960, 832, 1, 64, 960, 960, 960, 64]
    - [0, 7861.78]
  - - [1024, 832, 1, 64, 1024, 1024, 1024, 64]
    - [4, 8432.65]
  - - [1088, 832, 1, 64, 1088, 1088, 1088, 64]
    - [9, 7790.94]
  - - [1152, 832, 1, 64, 1152, 1152, 1152, 64]
    - [9, 8107.49]
  - - [1216, 832, 1, 64, 1216, 1216, 1216, 64]
    - [9, 9356.81]
  - - [1280, 832, 1, 64, 1280, 1280, 1280, 64]
    - [0, 9989.29]
  - - [1344, 832, 1, 64, 1344, 1344, 1344, 64]
    - [4, 10201.6]
  - - [1408, 832, 1, 64, 1408, 1408, 1408, 64]
    - [0, 10590.9]
  - - [1472, 832, 1, 64, 1472, 1472, 1472, 64]
    - [0, 11033.3]
  - - [1536, 832, 1, 64, 1536, 1536, 1536, 64]
    - [0, 11097.4]
  - - [1600, 832, 1, 64, 1600, 1600, 1600, 64]
    - [0, 11847.6]
  - - [1664, 832, 1, 64, 1664, 1664, 1664, 64]
    - [0, 12246.6]
  - - [1728, 832, 1, 64, 1728, 1728, 1728, 64]
    - [0, 12393.8]
  - - [1792, 832, 1, 64, 1792, 1792, 1792, 64]
    - [0, 12405.1]
  - - [1856, 832, 1, 64, 1856, 1856, 1856, 64]
    - [0, 12686.4]
  - - [1920, 832, 1, 64, 1920, 1920, 1920, 64]
    - [9, 13031.9]
  - - [1984, 832, 1, 64, 1984, 1984, 1984, 64]
    - [0, 13430.4]
  - - [2048, 832, 1, 64, 2048, 2048, 2048, 64]
    - [0, 12855.3]
  - - [2112, 832, 1, 64, 2112, 2112, 2112, 64]
    - [0, 13933.6]
  - - [2176, 832, 1, 64, 2176, 2176, 2176, 64]
    - [0, 14147.4]
  - - [2240, 832, 1, 64, 2240, 2240, 2240, 64]
    - [0, 14356.5]
  - - [2304, 832, 1, 64, 2304, 2304, 2304, 64]
    - [0, 14262.1]
  - - [2368, 832, 1, 64, 2368, 2368, 2368, 64]
    - [4, 14082.0]
  - - [2432, 832, 1, 64, 2432, 2432, 2432, 64]
    - [0, 14340.9]
  - - [2496, 832, 1, 64, 2496, 2496, 2496, 64]
    - [3, 14689.1]
  - - [2560, 832, 1, 64, 2560, 2560, 2560, 64]
    - [0, 14744.7]
  - - [2624, 832, 1, 64, 2624, 2624, 2624, 64]
    - [0, 15404.8]
  - - [2688, 832, 1, 64, 2688, 2688, 2688, 64]
    - [0, 15460.1]
  - - [2752, 832, 1, 64, 2752, 2752, 2752, 64]
    - [0, 15728.0]
  - - [2816, 832, 1, 64, 2816, 2816, 2816, 64]
    - [0, 15683.0]
  - - [2880, 832, 1, 64, 2880, 2880, 2880, 64]
    - [0, 15992.5]
  - - [2944, 832, 1, 64, 2944, 2944, 2944, 64]
    - [0, 16231.1]
  - - [3008, 832, 1, 64, 3008, 3008, 3008, 64]
    - [0, 16452.9]
  - - [3072, 832, 1, 64, 3072, 3072, 3072, 64]
    - [0, 15944.7]
  - - [3136, 832, 1, 64, 3136, 3136, 3136, 64]
    - [0, 16920.1]
  - - [3200, 832, 1, 64, 3200, 3200, 3200, 64]
    - [0, 17099.1]
  - - [3264, 832, 1, 64, 3264, 3264, 3264, 64]
    - [0, 17329.6]
  - - [3328, 832, 1, 64, 3328, 3328, 3328, 64]
    - [0, 17366.6]
  - - [3392, 832, 1, 64, 3392, 3392, 3392, 64]
    - [0, 17731.8]
  - - [3456, 832, 1, 64, 3456, 3456, 3456, 64]
    - [0, 17875.1]
  - - [3520, 832, 1, 64, 3520, 3520, 3520, 64]
    - [0, 18058.6]
  - - [3584, 832, 1, 64, 3584, 3584, 3584, 64]
    - [3, 17396.5]
  - - [3648, 832, 1, 64, 3648, 3648, 3648, 64]
    - [3, 17982.6]
  - - [3712, 832, 1, 64, 3712, 3712, 3712, 64]
    - [3, 17949.1]
  - - [3776, 832, 1, 64, 3776, 3776, 3776, 64]
    - [0, 17617.1]
  - - [3840, 832, 1, 64, 3840, 3840, 3840, 64]
    - [0, 18038.9]
  - - [3904, 832, 1, 64, 3904, 3904, 3904, 64]
    - [0, 18263.8]
  - - [3968, 832, 1, 64, 3968, 3968, 3968, 64]
    - [0, 18480.4]
  - - [4032, 832, 1, 64, 4032, 4032, 4032, 64]
    - [0, 18767.0]
  - - [4096, 832, 1, 64, 4096, 4096, 4096, 64]
    - [0, 17789.8]
  - - [64, 896, 1, 64, 64, 64, 64, 64]
    - [15, 753.438]
  - - [128, 896, 1, 64, 128, 128, 128, 64]
    - [4, 1527.57]
  - - [192, 896, 1, 64, 192, 192, 192, 64]
    - [6, 2277.59]
  - - [256, 896, 1, 64, 256, 256, 256, 64]
    - [4, 2943.06]
  - - [320, 896, 1, 64, 320, 320, 320, 64]
    - [12, 3418.4]
  - - [384, 896, 1, 64, 384, 384, 384, 64]
    - [6, 4211.11]
  - - [448, 896, 1, 64, 448, 448, 448, 64]
    - [4, 4609.64]
  - - [512, 896, 1, 64, 512, 512, 512, 64]
    - [4, 5217.68]
  - - [576, 896, 1, 64, 576, 576, 576, 64]
    - [9, 5797.74]
  - - [640, 896, 1, 64, 640, 640, 640, 64]
    - [4, 6371.47]
  - - [704, 896, 1, 64, 704, 704, 704, 64]
    - [4, 6728.22]
  - - [768, 896, 1, 64, 768, 768, 768, 64]
    - [0, 7301.0]
  - - [832, 896, 1, 64, 832, 832, 832, 64]
    - [7, 7585.06]
  - - [896, 896, 1, 64, 896, 896, 896, 64]
    - [4, 8141.31]
  - - [960, 896, 1, 64, 960, 960, 960, 64]
    - [4, 8582.76]
  - - [1024, 896, 1, 64, 1024, 1024, 1024, 64]
    - [4, 8892.9]
  - - [1088, 896, 1, 64, 1088, 1088, 1088, 64]
    - [9, 8215.65]
  - - [1152, 896, 1, 64, 1152, 1152, 1152, 64]
    - [9, 9532.37]
  - - [1216, 896, 1, 64, 1216, 1216, 1216, 64]
    - [0, 10164.7]
  - - [1280, 896, 1, 64, 1280, 1280, 1280, 64]
    - [9, 10473.6]
  - - [1344, 896, 1, 64, 1344, 1344, 1344, 64]
    - [0, 10776.0]
  - - [1408, 896, 1, 64, 1408, 1408, 1408, 64]
    - [0, 11410.4]
  - - [1472, 896, 1, 64, 1472, 1472, 1472, 64]
    - [0, 11625.0]
  - - [1536, 896, 1, 64, 1536, 1536, 1536, 64]
    - [9, 11623.1]
  - - [1600, 896, 1, 64, 1600, 1600, 1600, 64]
    - [9, 12253.0]
  - - [1664, 896, 1, 64, 1664, 1664, 1664, 64]
    - [0, 12742.9]
  - - [1728, 896, 1, 64, 1728, 1728, 1728, 64]
    - [0, 12930.8]
  - - [1792, 896, 1, 64, 1792, 1792, 1792, 64]
    - [0, 12999.3]
  - - [1856, 896, 1, 64, 1856, 1856, 1856, 64]
    - [0, 13478.8]
  - - [1920, 896, 1, 64, 1920, 1920, 1920, 64]
    - [9, 13745.3]
  - - [1984, 896, 1, 64, 1984, 1984, 1984, 64]
    - [0, 13956.0]
  - - [2048, 896, 1, 64, 2048, 2048, 2048, 64]
    - [0, 13429.4]
  - - [2112, 896, 1, 64, 2112, 2112, 2112, 64]
    - [0, 14474.7]
  - - [2176, 896, 1, 64, 2176, 2176, 2176, 64]
    - [0, 14711.1]
  - - [2240, 896, 1, 64, 2240, 2240, 2240, 64]
    - [0, 14155.7]
  - - [2304, 896, 1, 64, 2304, 2304, 2304, 64]
    - [0, 14360.8]
  - - [2368, 896, 1, 64, 2368, 2368, 2368, 64]
    - [0, 14801.6]
  - - [2432, 896, 1, 64, 2432, 2432, 2432, 64]
    - [0, 15058.7]
  - - [2496, 896, 1, 64, 2496, 2496, 2496, 64]
    - [0, 15382.0]
  - - [2560, 896, 1, 64, 2560, 2560, 2560, 64]
    - [3, 15267.8]
  - - [2624, 896, 1, 64, 2624, 2624, 2624, 64]
    - [0, 15966.6]
  - - [2688, 896, 1, 64, 2688, 2688, 2688, 64]
    - [9, 16069.6]
  - - [2752, 896, 1, 64, 2752, 2752, 2752, 64]
    - [0, 16519.4]
  - - [2816, 896, 1, 64, 2816, 2816, 2816, 64]
    - [0, 16455.7]
  - - [2880, 896, 1, 64, 2880, 2880, 2880, 64]
    - [0, 16810.9]
  - - [2944, 896, 1, 64, 2944, 2944, 2944, 64]
    - [0, 16989.1]
  - - [3008, 896, 1, 64, 3008, 3008, 3008, 64]
    - [0, 17206.0]
  - - [3072, 896, 1, 64, 3072, 3072, 3072, 64]
    - [0, 16636.1]
  - - [3136, 896, 1, 64, 3136, 3136, 3136, 64]
    - [0, 17630.3]
  - - [3200, 896, 1, 64, 3200, 3200, 3200, 64]
    - [0, 17865.9]
  - - [3264, 896, 1, 64, 3264, 3264, 3264, 64]
    - [0, 18115.4]
  - - [3328, 896, 1, 64, 3328, 3328, 3328, 64]
    - [3, 17614.9]
  - - [3392, 896, 1, 64, 3392, 3392, 3392, 64]
    - [3, 17748.9]
  - - [3456, 896, 1, 64, 3456, 3456, 3456, 64]
    - [3, 18011.5]
  - - [3520, 896, 1, 64, 3520, 3520, 3520, 64]
    - [0, 18296.7]
  - - [3584, 896, 1, 64, 3584, 3584, 3584, 64]
    - [0, 17877.5]
  - - [3648, 896, 1, 64, 3648, 3648, 3648, 64]
    - [0, 18540.2]
  - - [3712, 896, 1, 64, 3712, 3712, 3712, 64]
    - [0, 18644.1]
  - - [3776, 896, 1, 64, 3776, 3776, 3776, 64]
    - [0, 18429.6]
  - - [3840, 896, 1, 64, 3840, 3840, 3840, 64]
    - [0, 18751.6]
  - - [3904, 896, 1, 64, 3904, 3904, 3904, 64]
    - [0, 18991.3]
  - - [3968, 896, 1, 64, 3968, 3968, 3968, 64]
    - [0, 19185.5]
  - - [4032, 896, 1, 64, 4032, 4032, 4032, 64]
    - [0, 19424.5]
  - - [4096, 896, 1, 64, 4096, 4096, 4096, 64]
    - [0, 18409.0]
  - - [64, 960, 1, 64, 64, 64, 64, 64]
    - [6, 871.678]
  - - [128, 960, 1, 64, 128, 128, 128, 64]
    - [15, 1731.07]
  - - [192, 960, 1, 64, 192, 192, 192, 64]
    - [14, 2390.82]
  - - [256, 960, 1, 64, 256, 256, 256, 64]
    - [0, 2967.64]
  - - [320, 960, 1, 64, 320, 320, 320, 64]
    - [3, 3756.34]
  - - [384, 960, 1, 64, 384, 384, 384, 64]
    - [10, 4233.42]
  - - [448, 960, 1, 64, 448, 448, 448, 64]
    - [7, 4996.3]
  - - [512, 960, 1, 64, 512, 512, 512, 64]
    - [6, 5444.23]
  - - [576, 960, 1, 64, 576, 576, 576, 64]
    - [9, 6002.18]
  - - [640, 960, 1, 64, 640, 640, 640, 64]
    - [7, 6536.14]
  - - [704, 960, 1, 64, 704, 704, 704, 64]
    - [1, 7052.57]
  - - [768, 960, 1, 64, 768, 768, 768, 64]
    - [4, 7555.73]
  - - [832, 960, 1, 64, 832, 832, 832, 64]
    - [0, 8137.13]
  - - [896, 960, 1, 64, 896, 896, 896, 64]
    - [11, 8577.41]
  - - [960, 960, 1, 64, 960, 960, 960, 64]
    - [9, 9181.53]
  - - [1024, 960, 1, 64, 1024, 1024, 1024, 64]
    - [0, 9613.97]
  - - [1088, 960, 1, 64, 1088, 1088, 1088, 64]
    - [9, 9633.41]
  - - [1152, 960, 1, 64, 1152, 1152, 1152, 64]
    - [9, 10312.9]
  - - [1216, 960, 1, 64, 1216, 1216, 1216, 64]
    - [9, 10612.3]
  - - [1280, 960, 1, 64, 1280, 1280, 1280, 64]
    - [0, 11142.3]
  - - [1344, 960, 1, 64, 1344, 1344, 1344, 64]
    - [0, 11622.0]
  - - [1408, 960, 1, 64, 1408, 1408, 1408, 64]
    - [0, 11956.7]
  - - [1472, 960, 1, 64, 1472, 1472, 1472, 64]
    - [9, 12123.2]
  - - [1536, 960, 1, 64, 1536, 1536, 1536, 64]
    - [0, 11845.2]
  - - [1600, 960, 1, 64, 1600, 1600, 1600, 64]
    - [0, 12764.9]
  - - [1664, 960, 1, 64, 1664, 1664, 1664, 64]
    - [0, 13161.1]
  - - [1728, 960, 1, 64, 1728, 1728, 1728, 64]
    - [0, 13445.7]
  - - [1792, 960, 1, 64, 1792, 1792, 1792, 64]
    - [0, 13555.8]
  - - [1856, 960, 1, 64, 1856, 1856, 1856, 64]
    - [0, 13933.6]
  - - [1920, 960, 1, 64, 1920, 1920, 1920, 64]
    - [9, 14171.5]
  - - [1984, 960, 1, 64, 1984, 1984, 1984, 64]
    - [0, 14586.2]
  - - [2048, 960, 1, 64, 2048, 2048, 2048, 64]
    - [4, 13718.8]
  - - [2112, 960, 1, 64, 2112, 2112, 2112, 64]
    - [0, 14323.9]
  - - [2176, 960, 1, 64, 2176, 2176, 2176, 64]
    - [3, 14630.4]
  - - [2240, 960, 1, 64, 2240, 2240, 2240, 64]
    - [0, 14817.5]
  - - [2304, 960, 1, 64, 2304, 2304, 2304, 64]
    - [0, 15088.1]
  - - [2368, 960, 1, 64, 2368, 2368, 2368, 64]
    - [0, 15425.0]
  - - [2432, 960, 1, 64, 2432, 2432, 2432, 64]
    - [0, 15713.6]
  - - [2496, 960, 1, 64, 2496, 2496, 2496, 64]
    - [0, 15937.8]
  - - [2560, 960, 1, 64, 2560, 2560, 2560, 64]
    - [0, 15879.4]
  - - [2624, 960, 1, 64, 2624, 2624, 2624, 64]
    - [0, 16675.2]
  - - [2688, 960, 1, 64, 2688, 2688, 2688, 64]
    - [0, 16800.6]
  - - [2752, 960, 1, 64, 2752, 2752, 2752, 64]
    - [0, 17155.2]
  - - [2816, 960, 1, 64, 2816, 2816, 2816, 64]
    - [0, 17033.9]
  - - [2880, 960, 1, 64, 2880, 2880, 2880, 64]
    - [0, 17479.6]
  - - [2944, 960, 1, 64, 2944, 2944, 2944, 64]
    - [0, 17634.4]
  - - [3008, 960, 1, 64, 3008, 3008, 3008, 64]
    - [0, 17949.7]
  - - [3072, 960, 1, 64, 3072, 3072, 3072, 64]
    - [0, 17022.3]
  - - [3136, 960, 1, 64, 3136, 3136, 3136, 64]
    - [0, 17657.2]
  - - [3200, 960, 1, 64, 3200, 3200, 3200, 64]
    - [0, 17813.4]
  - - [3264, 960, 1, 64, 3264, 3264, 3264, 64]
    - [3, 18105.7]
  - - [3328, 960, 1, 64, 3328, 3328, 3328, 64]
    - [0, 18238.5]
  - - [3392, 960, 1, 64, 3392, 3392, 3392, 64]
    - [0, 18483.7]
  - - [3456, 960, 1, 64, 3456, 3456, 3456, 64]
    - [0, 18640.6]
  - - [3520, 960, 1, 64, 3520, 3520, 3520, 64]
    - [0, 18914.4]
  - - [3584, 960, 1, 64, 3584, 3584, 3584, 64]
    - [0, 18565.0]
  - - [3648, 960, 1, 64, 3648, 3648, 3648, 64]
    - [0, 19186.1]
  - - [3712, 960, 1, 64, 3712, 3712, 3712, 64]
    - [0, 19186.0]
  - - [3776, 960, 1, 64, 3776, 3776, 3776, 64]
    - [0, 19135.3]
  - - [3840, 960, 1, 64, 3840, 3840, 3840, 64]
    - [0, 19242.2]
  - - [3904, 960, 1, 64, 3904, 3904, 3904, 64]
    - [0, 19693.0]
  - - [3968, 960, 1, 64, 3968, 3968, 3968, 64]
    - [0, 19945.3]
  - - [4032, 960, 1, 64, 4032, 4032, 4032, 64]
    - [0, 19974.6]
  - - [4096, 960, 1, 64, 4096, 4096, 4096, 64]
    - [0, 18652.3]
  - - [64, 1024, 1, 64, 64, 64, 64, 64]
    - [5, 877.272]
  - - [128, 1024, 1, 64, 128, 128, 128, 64]
    - [15, 1720.01]
  - - [192, 1024, 1, 64, 192, 192, 192, 64]
    - [3, 2581.61]
  - - [256, 1024, 1, 64, 256, 256, 256, 64]
    - [4, 3170.28]
  - - [320, 1024, 1, 64, 320, 320, 320, 64]
    - [4, 3874.27]
  - - [384, 1024, 1, 64, 384, 384, 384, 64]
    - [10, 4545.81]
  - - [448, 1024, 1, 64, 448, 448, 448, 64]
    - [7, 5243.72]
  - - [512, 1024, 1, 64, 512, 512, 512, 64]
    - [4, 5570.06]
  - - [576, 1024, 1, 64, 576, 576, 576, 64]
    - [0, 6466.01]
  - - [640, 1024, 1, 64, 640, 640, 640, 64]
    - [1, 6914.42]
  - - [704, 1024, 1, 64, 704, 704, 704, 64]
    - [0, 7536.16]
  - - [768, 1024, 1, 64, 768, 768, 768, 64]
    - [0, 7972.54]
  - - [832, 1024, 1, 64, 832, 832, 832, 64]
    - [4, 8458.75]
  - - [896, 1024, 1, 64, 896, 896, 896, 64]
    - [0, 9282.33]
  - - [960, 1024, 1, 64, 960, 960, 960, 64]
    - [0, 10008.5]
  - - [1024, 1024, 1, 64, 1024, 1024, 1024, 64]
    - [1, 9248.58]
  - - [1088, 1024, 1, 64, 1088, 1088, 1088, 64]
    - [9, 9999.01]
  - - [1152, 1024, 1, 64, 1152, 1152, 1152, 64]
    - [9, 10707.2]
  - - [1216, 1024, 1, 64, 1216, 1216, 1216, 64]
    - [9, 11303.8]
  - - [1280, 1024, 1, 64, 1280, 1280, 1280, 64]
    - [9, 11596.0]
  - - [1344, 1024, 1, 64, 1344, 1344, 1344, 64]
    - [9, 12001.6]
  - - [1408, 1024, 1, 64, 1408, 1408, 1408, 64]
    - [0, 12469.5]
  - - [1472, 1024, 1, 64, 1472, 1472, 1472, 64]
    - [9, 12605.3]
  - - [1536, 1024, 1, 64, 1536, 1536, 1536, 64]
    - [1, 12172.0]
  - - [1600, 1024, 1, 64, 1600, 1600, 1600, 64]
    - [0, 13424.2]
  - - [1664, 1024, 1, 64, 1664, 1664, 1664, 64]
    - [0, 13675.7]
  - - [1728, 1024, 1, 64, 1728, 1728, 1728, 64]
    - [0, 14003.4]
  - - [1792, 1024, 1, 64, 1792, 1792, 1792, 64]
    - [0, 14096.7]
  - - [1856, 1024, 1, 64, 1856, 1856, 1856, 64]
    - [0, 14457.8]
  - - [1920, 1024, 1, 64, 1920, 1920, 1920, 64]
    - [9, 14847.1]
  - - [1984, 1024, 1, 64, 1984, 1984, 1984, 64]
    - [0, 14322.9]
  - - [2048, 1024, 1, 64, 2048, 2048, 2048, 64]
    - [1, 14092.5]
  - - [2112, 1024, 1, 64, 2112, 2112, 2112, 64]
    - [0, 14935.9]
  - - [2176, 1024, 1, 64, 2176, 2176, 2176, 64]
    - [0, 15256.8]
  - - [2240, 1024, 1, 64, 2240, 2240, 2240, 64]
    - [0, 15330.0]
  - - [2304, 1024, 1, 64, 2304, 2304, 2304, 64]
    - [0, 15576.0]
  - - [2368, 1024, 1, 64, 2368, 2368, 2368, 64]
    - [0, 16118.4]
  - - [2432, 1024, 1, 64, 2432, 2432, 2432, 64]
    - [0, 16441.4]
  - - [2496, 1024, 1, 64, 2496, 2496, 2496, 64]
    - [0, 16650.8]
  - - [2560, 1024, 1, 64, 2560, 2560, 2560, 64]
    - [0, 16334.5]
  - - [2624, 1024, 1, 64, 2624, 2624, 2624, 64]
    - [0, 17179.4]
  - - [2688, 1024, 1, 64, 2688, 2688, 2688, 64]
    - [0, 17360.7]
  - - [2752, 1024, 1, 64, 2752, 2752, 2752, 64]
    - [0, 17693.9]
  - - [2816, 1024, 1, 64, 2816, 2816, 2816, 64]
    - [0, 17700.8]
  - - [2880, 1024, 1, 64, 2880, 2880, 2880, 64]
    - [3, 17531.3]
  - - [2944, 1024, 1, 64, 2944, 2944, 2944, 64]
    - [3, 17689.3]
  - - [3008, 1024, 1, 64, 3008, 3008, 3008, 64]
    - [3, 18037.4]
  - - [3072, 1024, 1, 64, 3072, 3072, 3072, 64]
    - [0, 17163.2]
  - - [3136, 1024, 1, 64, 3136, 3136, 3136, 64]
    - [0, 18274.9]
  - - [3200, 1024, 1, 64, 3200, 3200, 3200, 64]
    - [0, 18454.1]
  - - [3264, 1024, 1, 64, 3264, 3264, 3264, 64]
    - [0, 18706.5]
  - - [3328, 1024, 1, 64, 3328, 3328, 3328, 64]
    - [0, 18871.9]
  - - [3392, 1024, 1, 64, 3392, 3392, 3392, 64]
    - [0, 19160.2]
  - - [3456, 1024, 1, 64, 3456, 3456, 3456, 64]
    - [0, 19325.2]
  - - [3520, 1024, 1, 64, 3520, 3520, 3520, 64]
    - [0, 19444.1]
  - - [3584, 1024, 1, 64, 3584, 3584, 3584, 64]
    - [0, 19094.4]
  - - [3648, 1024, 1, 64, 3648, 3648, 3648, 64]
    - [0, 19736.9]
  - - [3712, 1024, 1, 64, 3712, 3712, 3712, 64]
    - [0, 19764.9]
  - - [3776, 1024, 1, 64, 3776, 3776, 3776, 64]
    - [0, 19577.7]
  - - [3840, 1024, 1, 64, 3840, 3840, 3840, 64]
    - [0, 19882.9]
  - - [3904, 1024, 1, 64, 3904, 3904, 3904, 64]
    - [3, 20114.1]
  - - [3968, 1024, 1, 64, 3968, 3968, 3968, 64]
    - [3, 20246.5]
  - - [4032, 1024, 1, 64, 4032, 4032, 4032, 64]
    - [3, 20186.4]
  - - [4096, 1024, 1, 64, 4096, 4096, 4096, 64]
    - [0, 19013.6]
  - - [64, 1088, 1, 64, 64, 64, 64, 64]
    - [7, 965.006]
  - - [128, 1088, 1, 64, 128, 128, 128, 64]
    - [18, 1779.01]
  - - [192, 1088, 1, 64, 192, 192, 192, 64]
    - [7, 2538.31]
  - - [256, 1088, 1, 64, 256, 256, 256, 64]
    - [7, 3505.55]
  - - [320, 1088, 1, 64, 320, 320, 320, 64]
    - [15, 4066.03]
  - - [384, 1088, 1, 64, 384, 384, 384, 64]
    - [11, 4763.69]
  - - [448, 1088, 1, 64, 448, 448, 448, 64]
    - [7, 5508.52]
  - - [512, 1088, 1, 64, 512, 512, 512, 64]
    - [4, 6114.09]
  - - [576, 1088, 1, 64, 576, 576, 576, 64]
    - [9, 6587.94]
  - - [640, 1088, 1, 64, 640, 640, 640, 64]
    - [9, 7307.96]
  - - [704, 1088, 1, 64, 704, 704, 704, 64]
    - [3, 7852.14]
  - - [768, 1088, 1, 64, 768, 768, 768, 64]
    - [4, 8255.1]
  - - [832, 1088, 1, 64, 832, 832, 832, 64]
    - [9, 9131.96]
  - - [896, 1088, 1, 64, 896, 896, 896, 64]
    - [0, 9806.63]
  - - [960, 1088, 1, 64, 960, 960, 960, 64]
    - [9, 9761.42]
  - - [1024, 1088, 1, 64, 1024, 1024, 1024, 64]
    - [4, 9994.73]
  - - [1088, 1088, 1, 64, 1088, 1088, 1088, 64]
    - [4, 10620.9]
  - - [1152, 1088, 1, 64, 1152, 1152, 1152, 64]
    - [0, 11368.4]
  - - [1216, 1088, 1, 64, 1216, 1216, 1216, 64]
    - [0, 11925.6]
  - - [1280, 1088, 1, 64, 1280, 1280, 1280, 64]
    - [0, 12137.9]
  - - [1344, 1088, 1, 64, 1344, 1344, 1344, 64]
    - [9, 12362.5]
  - - [1408, 1088, 1, 64, 1408, 1408, 1408, 64]
    - [9, 12883.3]
  - - [1472, 1088, 1, 64, 1472, 1472, 1472, 64]
    - [0, 13227.2]
  - - [1536, 1088, 1, 64, 1536, 1536, 1536, 64]
    - [0, 12708.4]
  - - [1600, 1088, 1, 64, 1600, 1600, 1600, 64]
    - [0, 13931.4]
  - - [1664, 1088, 1, 64, 1664, 1664, 1664, 64]
    - [0, 14218.6]
  - - [1728, 1088, 1, 64, 1728, 1728, 1728, 64]
    - [0, 14477.5]
  - - [1792, 1088, 1, 64, 1792, 1792, 1792, 64]
    - [0, 14654.1]
  - - [1856, 1088, 1, 64, 1856, 1856, 1856, 64]
    - [4, 14280.3]
  - - [1920, 1088, 1, 64, 1920, 1920, 1920, 64]
    - [9, 14715.7]
  - - [1984, 1088, 1, 64, 1984, 1984, 1984, 64]
    - [0, 14967.4]
  - - [2048, 1088, 1, 64, 2048, 2048, 2048, 64]
    - [1, 14536.7]
  - - [2112, 1088, 1, 64, 2112, 2112, 2112, 64]
    - [0, 15478.5]
  - - [2176, 1088, 1, 64, 2176, 2176, 2176, 64]
    - [9, 15832.6]
  - - [2240, 1088, 1, 64, 2240, 2240, 2240, 64]
    - [0, 15987.4]
  - - [2304, 1088, 1, 64, 2304, 2304, 2304, 64]
    - [0, 16244.5]
  - - [2368, 1088, 1, 64, 2368, 2368, 2368, 64]
    - [0, 16734.7]
  - - [2432, 1088, 1, 64, 2432, 2432, 2432, 64]
    - [0, 16956.4]
  - - [2496, 1088, 1, 64, 2496, 2496, 2496, 64]
    - [9, 17216.5]
  - - [2560, 1088, 1, 64, 2560, 2560, 2560, 64]
    - [0, 16843.7]
  - - [2624, 1088, 1, 64, 2624, 2624, 2624, 64]
    - [0, 17834.4]
  - - [2688, 1088, 1, 64, 2688, 2688, 2688, 64]
    - [0, 17923.1]
  - - [2752, 1088, 1, 64, 2752, 2752, 2752, 64]
    - [3, 17702.2]
  - - [2816, 1088, 1, 64, 2816, 2816, 2816, 64]
    - [3, 17745.0]
  - - [2880, 1088, 1, 64, 2880, 2880, 2880, 64]
    - [3, 18092.6]
  - - [2944, 1088, 1, 64, 2944, 2944, 2944, 64]
    - [9, 18210.5]
  - - [3008, 1088, 1, 64, 3008, 3008, 3008, 64]
    - [0, 18497.9]
  - - [3072, 1088, 1, 64, 3072, 3072, 3072, 64]
    - [0, 17659.4]
  - - [3136, 1088, 1, 64, 3136, 3136, 3136, 64]
    - [0, 18809.9]
  - - [3200, 1088, 1, 64, 3200, 3200, 3200, 64]
    - [0, 19073.9]
  - - [3264, 1088, 1, 64, 3264, 3264, 3264, 64]
    - [0, 19288.6]
  - - [3328, 1088, 1, 64, 3328, 3328, 3328, 64]
    - [0, 19392.0]
  - - [3392, 1088, 1, 64, 3392, 3392, 3392, 64]
    - [0, 19605.7]
  - - [3456, 1088, 1, 64, 3456, 3456, 3456, 64]
    - [0, 19668.7]
  - - [3520, 1088, 1, 64, 3520, 3520, 3520, 64]
    - [0, 19860.9]
  - - [3584, 1088, 1, 64, 3584, 3584, 3584, 64]
    - [0, 19297.8]
  - - [3648, 1088, 1, 64, 3648, 3648, 3648, 64]
    - [3, 19924.4]
  - - [3712, 1088, 1, 64, 3712, 3712, 3712, 64]
    - [3, 19946.9]
  - - [3776, 1088, 1, 64, 3776, 3776, 3776, 64]
    - [0, 19615.7]
  - - [3840, 1088, 1, 64, 3840, 3840, 3840, 64]
    - [3, 19995.9]
  - - [3904, 1088, 1, 64, 3904, 3904, 3904, 64]
    - [3, 20608.1]
  - - [3968, 1088, 1, 64, 3968, 3968, 3968, 64]
    - [3, 20744.7]
  - - [4032, 1088, 1, 64, 4032, 4032, 4032, 64]
    - [3, 20822.9]
  - - [4096, 1088, 1, 64, 4096, 4096, 4096, 64]
    - [0, 19528.3]
  - - [64, 1152, 1, 64, 64, 64, 64, 64]
    - [5, 1011.7]
  - - [128, 1152, 1, 64, 128, 128, 128, 64]
    - [18, 1891.59]
  - - [192, 1152, 1, 64, 192, 192, 192, 64]
    - [4, 2782.72]
  - - [256, 1152, 1, 64, 256, 256, 256, 64]
    - [4, 3422.94]
  - - [320, 1152, 1, 64, 320, 320, 320, 64]
    - [11, 4228.85]
  - - [384, 1152, 1, 64, 384, 384, 384, 64]
    - [6, 4988.73]
  - - [448, 1152, 1, 64, 448, 448, 448, 64]
    - [7, 5595.44]
  - - [512, 1152, 1, 64, 512, 512, 512, 64]
    - [6, 6229.11]
  - - [576, 1152, 1, 64, 576, 576, 576, 64]
    - [4, 6920.98]
  - - [640, 1152, 1, 64, 640, 640, 640, 64]
    - [9, 7510.06]
  - - [704, 1152, 1, 64, 704, 704, 704, 64]
    - [9, 8028.42]
  - - [768, 1152, 1, 64, 768, 768, 768, 64]
    - [4, 8754.28]
  - - [832, 1152, 1, 64, 832, 832, 832, 64]
    - [9, 9589.1]
  - - [896, 1152, 1, 64, 896, 896, 896, 64]
    - [4, 9684.77]
  - - [960, 1152, 1, 64, 960, 960, 960, 64]
    - [9, 10204.5]
  - - [1024, 1152, 1, 64, 1024, 1024, 1024, 64]
    - [4, 10364.8]
  - - [1088, 1152, 1, 64, 1088, 1088, 1088, 64]
    - [9, 11187.7]
  - - [1152, 1152, 1, 64, 1152, 1152, 1152, 64]
    - [0, 11830.9]
  - - [1216, 1152, 1, 64, 1216, 1216, 1216, 64]
    - [0, 12371.1]
  - - [1280, 1152, 1, 64, 1280, 1280, 1280, 64]
    - [0, 12592.9]
  - - [1344, 1152, 1, 64, 1344, 1344, 1344, 64]
    - [0, 12909.1]
  - - [1408, 1152, 1, 64, 1408, 1408, 1408, 64]
    - [0, 13327.6]
  - - [1472, 1152, 1, 64, 1472, 1472, 1472, 64]
    - [0, 13819.7]
  - - [1536, 1152, 1, 64, 1536, 1536, 1536, 64]
    - [0, 13148.3]
  - - [1600, 1152, 1, 64, 1600, 1600, 1600, 64]
    - [0, 14452.8]
  - - [1664, 1152, 1, 64, 1664, 1664, 1664, 64]
    - [0, 14781.0]
  - - [1728, 1152, 1, 64, 1728, 1728, 1728, 64]
    - [9, 14223.7]
  - - [1792, 1152, 1, 64, 1792, 1792, 1792, 64]
    - [9, 14552.2]
  - - [1856, 1152, 1, 64, 1856, 1856, 1856, 64]
    - [0, 14885.0]
  - - [1920, 1152, 1, 64, 1920, 1920, 1920, 64]
    - [9, 15100.9]
  - - [1984, 1152, 1, 64, 1984, 1984, 1984, 64]
    - [0, 15449.4]
  - - [2048, 1152, 1, 64, 2048, 2048, 2048, 64]
    - [4, 14896.8]
  - - [2112, 1152, 1, 64, 2112, 2112, 2112, 64]
    - [0, 15996.7]
  - - [2176, 1152, 1, 64, 2176, 2176, 2176, 64]
    - [0, 16378.9]
  - - [2240, 1152, 1, 64, 2240, 2240, 2240, 64]
    - [0, 16455.8]
  - - [2304, 1152, 1, 64, 2304, 2304, 2304, 64]
    - [0, 16760.5]
  - - [2368, 1152, 1, 64, 2368, 2368, 2368, 64]
    - [0, 17143.4]
  - - [2432, 1152, 1, 64, 2432, 2432, 2432, 64]
    - [0, 17460.8]
  - - [2496, 1152, 1, 64, 2496, 2496, 2496, 64]
    - [9, 17776.6]
  - - [2560, 1152, 1, 64, 2560, 2560, 2560, 64]
    - [0, 17453.6]
  - - [2624, 1152, 1, 64, 2624, 2624, 2624, 64]
    - [3, 17709.7]
  - - [2688, 1152, 1, 64, 2688, 2688, 2688, 64]
    - [3, 17878.2]
  - - [2752, 1152, 1, 64, 2752, 2752, 2752, 64]
    - [3, 18072.3]
  - - [2816, 1152, 1, 64, 2816, 2816, 2816, 64]
    - [0, 18157.8]
  - - [2880, 1152, 1, 64, 2880, 2880, 2880, 64]
    - [0, 18555.9]
  - - [2944, 1152, 1, 64, 2944, 2944, 2944, 64]
    - [0, 18784.4]
  - - [3008, 1152, 1, 64, 3008, 3008, 3008, 64]
    - [0, 18916.1]
  - - [3072, 1152, 1, 64, 3072, 3072, 3072, 64]
    - [0, 18096.1]
  - - [3136, 1152, 1, 64, 3136, 3136, 3136, 64]
    - [0, 19262.6]
  - - [3200, 1152, 1, 64, 3200, 3200, 3200, 64]
    - [9, 19462.8]
  - - [3264, 1152, 1, 64, 3264, 3264, 3264, 64]
    - [0, 19728.4]
  - - [3328, 1152, 1, 64, 3328, 3328, 3328, 64]
    - [0, 19911.2]
  - - [3392, 1152, 1, 64, 3392, 3392, 3392, 64]
    - [3, 19739.8]
  - - [3456, 1152, 1, 64, 3456, 3456, 3456, 64]
    - [3, 19781.2]
  - - [3520, 1152, 1, 64, 3520, 3520, 3520, 64]
    - [3, 19966.2]
  - - [3584, 1152, 1, 64, 3584, 3584, 3584, 64]
    - [0, 19649.0]
  - - [3648, 1152, 1, 64, 3648, 3648, 3648, 64]
    - [3, 20462.4]
  - - [3712, 1152, 1, 64, 3712, 3712, 3712, 64]
    - [3, 20451.0]
  - - [3776, 1152, 1, 64, 3776, 3776, 3776, 64]
    - [0, 20100.8]
  - - [3840, 1152, 1, 64, 3840, 3840, 3840, 64]
    - [3, 20447.3]
  - - [3904, 1152, 1, 64, 3904, 3904, 3904, 64]
    - [3, 20966.8]
  - - [3968, 1152, 1, 64, 3968, 3968, 3968, 64]
    - [0, 21098.5]
  - - [4032, 1152, 1, 64, 4032, 4032, 4032, 64]
    - [0, 21232.1]
  - - [4096, 1152, 1, 64, 4096, 4096, 4096, 64]
    - [0, 19798.6]
  - - [64, 1216, 1, 64, 64, 64, 64, 64]
    - [6, 1082.99]
  - - [128, 1216, 1, 64, 128, 128, 128, 64]
    - [17, 1960.14]
  - - [192, 1216, 1, 64, 192, 192, 192, 64]
    - [4, 3017.36]
  - - [256, 1216, 1, 64, 256, 256, 256, 64]
    - [6, 3619.03]
  - - [320, 1216, 1, 64, 320, 320, 320, 64]
    - [0, 4437.56]
  - - [384, 1216, 1, 64, 384, 384, 384, 64]
    - [5, 5122.39]
  - - [448, 1216, 1, 64, 448, 448, 448, 64]
    - [6, 6016.32]
  - - [512, 1216, 1, 64, 512, 512, 512, 64]
    - [4, 6728.34]
  - - [576, 1216, 1, 64, 576, 576, 576, 64]
    - [9, 7324.49]
  - - [640, 1216, 1, 64, 640, 640, 640, 64]
    - [1, 8045.06]
  - - [704, 1216, 1, 64, 704, 704, 704, 64]
    - [4, 8487.53]
  - - [768, 1216, 1, 64, 768, 768, 768, 64]
    - [0, 9252.0]
  - - [832, 1216, 1, 64, 832, 832, 832, 64]
    - [4, 9514.93]
  - - [896, 1216, 1, 64, 896, 896, 896, 64]
    - [4, 10014.3]
  - - [960, 1216, 1, 64, 960, 960, 960, 64]
    - [4, 10561.3]
  - - [1024, 1216, 1, 64, 1024, 1024, 1024, 64]
    - [4, 10753.1]
  - - [1088, 1216, 1, 64, 1088, 1088, 1088, 64]
    - [0, 11716.1]
  - - [1152, 1216, 1, 64, 1152, 1152, 1152, 64]
    - [9, 12174.4]
  - - [1216, 1216, 1, 64, 1216, 1216, 1216, 64]
    - [0, 12752.0]
  - - [1280, 1216, 1, 64, 1280, 1280, 1280, 64]
    - [0, 12900.0]
  - - [1344, 1216, 1, 64, 1344, 1344, 1344, 64]
    - [0, 13459.6]
  - - [1408, 1216, 1, 64, 1408, 1408, 1408, 64]
    - [0, 13809.0]
  - - [1472, 1216, 1, 64, 1472, 1472, 1472, 64]
    - [0, 14182.9]
  - - [1536, 1216, 1, 64, 1536, 1536, 1536, 64]
    - [0, 13546.8]
  - - [1600, 1216, 1, 64, 1600, 1600, 1600, 64]
    - [0, 14948.1]
  - - [1664, 1216, 1, 64, 1664, 1664, 1664, 64]
    - [0, 14432.0]
  - - [1728, 1216, 1, 64, 1728, 1728, 1728, 64]
    - [9, 14852.9]
  - - [1792, 1216, 1, 64, 1792, 1792, 1792, 64]
    - [0, 15143.9]
  - - [1856, 1216, 1, 64, 1856, 1856, 1856, 64]
    - [0, 15328.5]
  - - [1920, 1216, 1, 64, 1920, 1920, 1920, 64]
    - [9, 15576.0]
  - - [1984, 1216, 1, 64, 1984, 1984, 1984, 64]
    - [0, 15849.1]
  - - [2048, 1216, 1, 64, 2048, 2048, 2048, 64]
    - [4, 15300.2]
  - - [2112, 1216, 1, 64, 2112, 2112, 2112, 64]
    - [0, 16592.3]
  - - [2176, 1216, 1, 64, 2176, 2176, 2176, 64]
    - [0, 16820.0]
  - - [2240, 1216, 1, 64, 2240, 2240, 2240, 64]
    - [0, 16870.6]
  - - [2304, 1216, 1, 64, 2304, 2304, 2304, 64]
    - [0, 17184.7]
  - - [2368, 1216, 1, 64, 2368, 2368, 2368, 64]
    - [0, 17714.6]
  - - [2432, 1216, 1, 64, 2432, 2432, 2432, 64]
    - [0, 17381.4]
  - - [2496, 1216, 1, 64, 2496, 2496, 2496, 64]
    - [3, 17798.0]
  - - [2560, 1216, 1, 64, 2560, 2560, 2560, 64]
    - [3, 17506.9]
  - - [2624, 1216, 1, 64, 2624, 2624, 2624, 64]
    - [0, 18202.1]
  - - [2688, 1216, 1, 64, 2688, 2688, 2688, 64]
    - [0, 18223.6]
  - - [2752, 1216, 1, 64, 2752, 2752, 2752, 64]
    - [9, 18568.6]
  - - [2816, 1216, 1, 64, 2816, 2816, 2816, 64]
    - [0, 18462.4]
  - - [2880, 1216, 1, 64, 2880, 2880, 2880, 64]
    - [0, 18852.1]
  - - [2944, 1216, 1, 64, 2944, 2944, 2944, 64]
    - [0, 19018.2]
  - - [3008, 1216, 1, 64, 3008, 3008, 3008, 64]
    - [0, 19294.0]
  - - [3072, 1216, 1, 64, 3072, 3072, 3072, 64]
    - [0, 18332.5]
  - - [3136, 1216, 1, 64, 3136, 3136, 3136, 64]
    - [0, 19635.9]
  - - [3200, 1216, 1, 64, 3200, 3200, 3200, 64]
    - [0, 19879.9]
  - - [3264, 1216, 1, 64, 3264, 3264, 3264, 64]
    - [3, 19645.5]
  - - [3328, 1216, 1, 64, 3328, 3328, 3328, 64]
    - [0, 19808.5]
  - - [3392, 1216, 1, 64, 3392, 3392, 3392, 64]
    - [0, 20085.0]
  - - [3456, 1216, 1, 64, 3456, 3456, 3456, 64]
    - [0, 20134.6]
  - - [3520, 1216, 1, 64, 3520, 3520, 3520, 64]
    - [0, 20188.6]
  - - [3584, 1216, 1, 64, 3584, 3584, 3584, 64]
    - [0, 19964.2]
  - - [3648, 1216, 1, 64, 3648, 3648, 3648, 64]
    - [3, 20737.8]
  - - [3712, 1216, 1, 64, 3712, 3712, 3712, 64]
    - [3, 20671.2]
  - - [3776, 1216, 1, 64, 3776, 3776, 3776, 64]
    - [0, 20287.3]
  - - [3840, 1216, 1, 64, 3840, 3840, 3840, 64]
    - [3, 20602.7]
  - - [3904, 1216, 1, 64, 3904, 3904, 3904, 64]
    - [3, 21063.7]
  - - [3968, 1216, 1, 64, 3968, 3968, 3968, 64]
    - [0, 21434.3]
  - - [4032, 1216, 1, 64, 4032, 4032, 4032, 64]
    - [0, 21521.6]
  - - [4096, 1216, 1, 64, 4096, 4096, 4096, 64]
    - [1, 20099.9]
  - - [64, 1280, 1, 64, 64, 64, 64, 64]
    - [17, 1068.23]
  - - [128, 1280, 1, 64, 128, 128, 128, 64]
    - [17, 2032.11]
  - - [192, 1280, 1, 64, 192, 192, 192, 64]
    - [15, 3049.94]
  - - [256, 1280, 1, 64, 256, 256, 256, 64]
    - [4, 3947.91]
  - - [320, 1280, 1, 64, 320, 320, 320, 64]
    - [6, 4810.82]
  - - [384, 1280, 1, 64, 384, 384, 384, 64]
    - [6, 5490.79]
  - - [448, 1280, 1, 64, 448, 448, 448, 64]
    - [0, 6291.68]
  - - [512, 1280, 1, 64, 512, 512, 512, 64]
    - [3, 6638.61]
  - - [576, 1280, 1, 64, 576, 576, 576, 64]
    - [1, 7523.21]
  - - [640, 1280, 1, 64, 640, 640, 640, 64]
    - [4, 8227.84]
  - - [704, 1280, 1, 64, 704, 704, 704, 64]
    - [9, 8970.48]
  - - [768, 1280, 1, 64, 768, 768, 768, 64]
    - [0, 9778.3]
  - - [832, 1280, 1, 64, 832, 832, 832, 64]
    - [4, 9958.64]
  - - [896, 1280, 1, 64, 896, 896, 896, 64]
    - [4, 10387.7]
  - - [960, 1280, 1, 64, 960, 960, 960, 64]
    - [0, 11029.9]
  - - [1024, 1280, 1, 64, 1024, 1024, 1024, 64]
    - [4, 11110.7]
  - - [1088, 1280, 1, 64, 1088, 1088, 1088, 64]
    - [0, 12029.7]
  - - [1152, 1280, 1, 64, 1152, 1152, 1152, 64]
    - [0, 12633.3]
  - - [1216, 1280, 1, 64, 1216, 1216, 1216, 64]
    - [0, 13079.6]
  - - [1280, 1280, 1, 64, 1280, 1280, 1280, 64]
    - [0, 13306.7]
  - - [1344, 1280, 1, 64, 1344, 1344, 1344, 64]
    - [0, 13979.0]
  - - [1408, 1280, 1, 64, 1408, 1408, 1408, 64]
    - [0, 14152.3]
  - - [1472, 1280, 1, 64, 1472, 1472, 1472, 64]
    - [0, 14676.9]
  - - [1536, 1280, 1, 64, 1536, 1536, 1536, 64]
    - [0, 13892.9]
  - - [1600, 1280, 1, 64, 1600, 1600, 1600, 64]
    - [0, 14682.6]
  - - [1664, 1280, 1, 64, 1664, 1664, 1664, 64]
    - [0, 15039.0]
  - - [1728, 1280, 1, 64, 1728, 1728, 1728, 64]
    - [0, 15368.3]
  - - [1792, 1280, 1, 64, 1792, 1792, 1792, 64]
    - [0, 15470.5]
  - - [1856, 1280, 1, 64, 1856, 1856, 1856, 64]
    - [0, 15581.3]
  - - [1920, 1280, 1, 64, 1920, 1920, 1920, 64]
    - [9, 15974.5]
  - - [1984, 1280, 1, 64, 1984, 1984, 1984, 64]
    - [0, 16425.3]
  - - [2048, 1280, 1, 64, 2048, 2048, 2048, 64]
    - [0, 15584.9]
  - - [2112, 1280, 1, 64, 2112, 2112, 2112, 64]
    - [0, 16871.2]
  - - [2176, 1280, 1, 64, 2176, 2176, 2176, 64]
    - [0, 17202.9]
  - - [2240, 1280, 1, 64, 2240, 2240, 2240, 64]
    - [0, 17373.6]
  - - [2304, 1280, 1, 64, 2304, 2304, 2304, 64]
    - [0, 17577.1]
  - - [2368, 1280, 1, 64, 2368, 2368, 2368, 64]
    - [3, 17352.6]
  - - [2432, 1280, 1, 64, 2432, 2432, 2432, 64]
    - [0, 17712.3]
  - - [2496, 1280, 1, 64, 2496, 2496, 2496, 64]
    - [9, 18046.9]
  - - [2560, 1280, 1, 64, 2560, 2560, 2560, 64]
    - [0, 17785.9]
  - - [2624, 1280, 1, 64, 2624, 2624, 2624, 64]
    - [9, 18598.0]
  - - [2688, 1280, 1, 64, 2688, 2688, 2688, 64]
    - [0, 18499.5]
  - - [2752, 1280, 1, 64, 2752, 2752, 2752, 64]
    - [0, 18730.6]
  - - [2816, 1280, 1, 64, 2816, 2816, 2816, 64]
    - [0, 18805.3]
  - - [2880, 1280, 1, 64, 2880, 2880, 2880, 64]
    - [0, 19344.7]
  - - [2944, 1280, 1, 64, 2944, 2944, 2944, 64]
    - [0, 19540.6]
  - - [3008, 1280, 1, 64, 3008, 3008, 3008, 64]
    - [0, 19755.7]
  - - [3072, 1280, 1, 64, 3072, 3072, 3072, 64]
    - [0, 18569.6]
  - - [3136, 1280, 1, 64, 3136, 3136, 3136, 64]
    - [3, 19534.6]
  - - [3200, 1280, 1, 64, 3200, 3200, 3200, 64]
    - [3, 19875.8]
  - - [3264, 1280, 1, 64, 3264, 3264, 3264, 64]
    - [3, 20170.9]
  - - [3328, 1280, 1, 64, 3328, 3328, 3328, 64]
    - [0, 20247.1]
  - - [3392, 1280, 1, 64, 3392, 3392, 3392, 64]
    - [0, 20454.2]
  - - [3456, 1280, 1, 64, 3456, 3456, 3456, 64]
    - [0, 20524.4]
  - - [3520, 1280, 1, 64, 3520, 3520, 3520, 64]
    - [0, 20801.9]
  - - [3584, 1280, 1, 64, 3584, 3584, 3584, 64]
    - [0, 20568.8]
  - - [3648, 1280, 1, 64, 3648, 3648, 3648, 64]
    - [0, 21200.4]
  - - [3712, 1280, 1, 64, 3712, 3712, 3712, 64]
    - [3, 21098.0]
  - - [3776, 1280, 1, 64, 3776, 3776, 3776, 64]
    - [0, 20752.0]
  - - [3840, 1280, 1, 64, 3840, 3840, 3840, 64]
    - [0, 21059.9]
  - - [3904, 1280, 1, 64, 3904, 3904, 3904, 64]
    - [3, 21647.0]
  - - [3968, 1280, 1, 64, 3968, 3968, 3968, 64]
    - [3, 21690.6]
  - - [4032, 1280, 1, 64, 4032, 4032, 4032, 64]
    - [3, 21858.2]
  - - [4096, 1280, 1, 64, 4096, 4096, 4096, 64]
    - [0, 20501.1]
  - - [64, 1344, 1, 64, 64, 64, 64, 64]
    - [3, 1144.01]
  - - [128, 1344, 1, 64, 128, 128, 128, 64]
    - [13, 2136.18]
  - - [192, 1344, 1, 64, 192, 192, 192, 64]
    - [15, 3177.17]
  - - [256, 1344, 1, 64, 256, 256, 256, 64]
    - [4, 4064.21]
  - - [320, 1344, 1, 64, 320, 320, 320, 64]
    - [8, 4733.39]
  - - [384, 1344, 1, 64, 384, 384, 384, 64]
    - [7, 5616.3]
  - - [448, 1344, 1, 64, 448, 448, 448, 64]
    - [4, 6535.79]
  - - [512, 1344, 1, 64, 512, 512, 512, 64]
    - [4, 7162.17]
  - - [576, 1344, 1, 64, 576, 576, 576, 64]
    - [4, 7891.78]
  - - [640, 1344, 1, 64, 640, 640, 640, 64]
    - [0, 8517.65]
  - - [704, 1344, 1, 64, 704, 704, 704, 64]
    - [0, 9476.53]
  - - [768, 1344, 1, 64, 768, 768, 768, 64]
    - [9, 9696.1]
  - - [832, 1344, 1, 64, 832, 832, 832, 64]
    - [0, 10300.0]
  - - [896, 1344, 1, 64, 896, 896, 896, 64]
    - [0, 10680.3]
  - - [960, 1344, 1, 64, 960, 960, 960, 64]
    - [0, 11524.7]
  - - [1024, 1344, 1, 64, 1024, 1024, 1024, 64]
    - [4, 11507.6]
  - - [1088, 1344, 1, 64, 1088, 1088, 1088, 64]
    - [0, 12273.4]
  - - [1152, 1344, 1, 64, 1152, 1152, 1152, 64]
    - [9, 13053.6]
  - - [1216, 1344, 1, 64, 1216, 1216, 1216, 64]
    - [0, 13524.0]
  - - [1280, 1344, 1, 64, 1280, 1280, 1280, 64]
    - [0, 13677.0]
  - - [1344, 1344, 1, 64, 1344, 1344, 1344, 64]
    - [0, 14302.2]
  - - [1408, 1344, 1, 64, 1408, 1408, 1408, 64]
    - [0, 14609.1]
  - - [1472, 1344, 1, 64, 1472, 1472, 1472, 64]
    - [9, 14269.6]
  - - [1536, 1344, 1, 64, 1536, 1536, 1536, 64]
    - [1, 13947.0]
  - - [1600, 1344, 1, 64, 1600, 1600, 1600, 64]
    - [0, 15103.7]
  - - [1664, 1344, 1, 64, 1664, 1664, 1664, 64]
    - [0, 15396.9]
  - - [1728, 1344, 1, 64, 1728, 1728, 1728, 64]
    - [9, 15788.7]
  - - [1792, 1344, 1, 64, 1792, 1792, 1792, 64]
    - [0, 15809.2]
  - - [1856, 1344, 1, 64, 1856, 1856, 1856, 64]
    - [0, 16039.8]
  - - [1920, 1344, 1, 64, 1920, 1920, 1920, 64]
    - [9, 16202.2]
  - - [1984, 1344, 1, 64, 1984, 1984, 1984, 64]
    - [0, 16727.5]
  - - [2048, 1344, 1, 64, 2048, 2048, 2048, 64]
    - [4, 15947.8]
  - - [2112, 1344, 1, 64, 2112, 2112, 2112, 64]
    - [0, 17365.9]
  - - [2176, 1344, 1, 64, 2176, 2176, 2176, 64]
    - [0, 17672.5]
  - - [2240, 1344, 1, 64, 2240, 2240, 2240, 64]
    - [3, 17056.8]
  - - [2304, 1344, 1, 64, 2304, 2304, 2304, 64]
    - [0, 17387.2]
  - - [2368, 1344, 1, 64, 2368, 2368, 2368, 64]
    - [0, 17688.7]
  - - [2432, 1344, 1, 64, 2432, 2432, 2432, 64]
    - [0, 18207.8]
  - - [2496, 1344, 1, 64, 2496, 2496, 2496, 64]
    - [3, 18381.4]
  - - [2560, 1344, 1, 64, 2560, 2560, 2560, 64]
    - [0, 18222.4]
  - - [2624, 1344, 1, 64, 2624, 2624, 2624, 64]
    - [0, 18780.5]
  - - [2688, 1344, 1, 64, 2688, 2688, 2688, 64]
    - [0, 18937.6]
  - - [2752, 1344, 1, 64, 2752, 2752, 2752, 64]
    - [0, 19342.5]
  - - [2816, 1344, 1, 64, 2816, 2816, 2816, 64]
    - [0, 19360.5]
  - - [2880, 1344, 1, 64, 2880, 2880, 2880, 64]
    - [9, 19751.6]
  - - [2944, 1344, 1, 64, 2944, 2944, 2944, 64]
    - [3, 19531.8]
  - - [3008, 1344, 1, 64, 3008, 3008, 3008, 64]
    - [3, 19904.2]
  - - [3072, 1344, 1, 64, 3072, 3072, 3072, 64]
    - [0, 19036.1]
  - - [3136, 1344, 1, 64, 3136, 3136, 3136, 64]
    - [3, 20185.9]
  - - [3200, 1344, 1, 64, 3200, 3200, 3200, 64]
    - [3, 20354.2]
  - - [3264, 1344, 1, 64, 3264, 3264, 3264, 64]
    - [9, 20590.7]
  - - [3328, 1344, 1, 64, 3328, 3328, 3328, 64]
    - [0, 20802.2]
  - - [3392, 1344, 1, 64, 3392, 3392, 3392, 64]
    - [0, 21053.8]
  - - [3456, 1344, 1, 64, 3456, 3456, 3456, 64]
    - [0, 21067.9]
  - - [3520, 1344, 1, 64, 3520, 3520, 3520, 64]
    - [0, 21277.2]
  - - [3584, 1344, 1, 64, 3584, 3584, 3584, 64]
    - [0, 20938.6]
  - - [3648, 1344, 1, 64, 3648, 3648, 3648, 64]
    - [0, 21582.2]
  - - [3712, 1344, 1, 64, 3712, 3712, 3712, 64]
    - [3, 21560.4]
  - - [3776, 1344, 1, 64, 3776, 3776, 3776, 64]
    - [3, 20897.8]
  - - [3840, 1344, 1, 64, 3840, 3840, 3840, 64]
    - [3, 21529.1]
  - - [3904, 1344, 1, 64, 3904, 3904, 3904, 64]
    - [3, 22053.2]
  - - [3968, 1344, 1, 64, 3968, 3968, 3968, 64]
    - [3, 22165.7]
  - - [4032, 1344, 1, 64, 4032, 4032, 4032, 64]
    - [3, 22247.3]
  - - [4096, 1344, 1, 64, 4096, 4096, 4096, 64]
    - [0, 20983.8]
  - - [64, 1408, 1, 64, 64, 64, 64, 64]
    - [18, 1195.5]
  - - [128, 1408, 1, 64, 128, 128, 128, 64]
    - [4, 2270.06]
  - - [192, 1408, 1, 64, 192, 192, 192, 64]
    - [5, 3261.94]
  - - [256, 1408, 1, 64, 256, 256, 256, 64]
    - [15, 4090.15]
  - - [320, 1408, 1, 64, 320, 320, 320, 64]
    - [0, 5189.97]
  - - [384, 1408, 1, 64, 384, 384, 384, 64]
    - [4, 6035.71]
  - - [448, 1408, 1, 64, 448, 448, 448, 64]
    - [4, 6760.96]
  - - [512, 1408, 1, 64, 512, 512, 512, 64]
    - [4, 7549.76]
  - - [576, 1408, 1, 64, 576, 576, 576, 64]
    - [9, 8291.36]
  - - [640, 1408, 1, 64, 640, 640, 640, 64]
    - [0, 9086.38]
  - - [704, 1408, 1, 64, 704, 704, 704, 64]
    - [4, 9419.14]
  - - [768, 1408, 1, 64, 768, 768, 768, 64]
    - [9, 9944.68]
  - - [832, 1408, 1, 64, 832, 832, 832, 64]
    - [9, 10518.0]
  - - [896, 1408, 1, 64, 896, 896, 896, 64]
    - [9, 11218.5]
  - - [960, 1408, 1, 64, 960, 960, 960, 64]
    - [0, 11961.6]
  - - [1024, 1408, 1, 64, 1024, 1024, 1024, 64]
    - [4, 11750.1]
  - - [1088, 1408, 1, 64, 1088, 1088, 1088, 64]
    - [0, 12794.0]
  - - [1152, 1408, 1, 64, 1152, 1152, 1152, 64]
    - [0, 13329.3]
  - - [1216, 1408, 1, 64, 1216, 1216, 1216, 64]
    - [0, 13838.7]
  - - [1280, 1408, 1, 64, 1280, 1280, 1280, 64]
    - [0, 14009.8]
  - - [1344, 1408, 1, 64, 1344, 1344, 1344, 64]
    - [0, 14669.2]
  - - [1408, 1408, 1, 64, 1408, 1408, 1408, 64]
    - [0, 14144.4]
  - - [1472, 1408, 1, 64, 1472, 1472, 1472, 64]
    - [9, 14710.5]
  - - [1536, 1408, 1, 64, 1536, 1536, 1536, 64]
    - [1, 14341.5]
  - - [1600, 1408, 1, 64, 1600, 1600, 1600, 64]
    - [0, 15511.4]
  - - [1664, 1408, 1, 64, 1664, 1664, 1664, 64]
    - [0, 15745.6]
  - - [1728, 1408, 1, 64, 1728, 1728, 1728, 64]
    - [0, 16069.4]
  - - [1792, 1408, 1, 64, 1792, 1792, 1792, 64]
    - [0, 16212.8]
  - - [1856, 1408, 1, 64, 1856, 1856, 1856, 64]
    - [0, 16388.7]
  - - [1920, 1408, 1, 64, 1920, 1920, 1920, 64]
    - [9, 16529.4]
  - - [1984, 1408, 1, 64, 1984, 1984, 1984, 64]
    - [0, 16954.1]
  - - [2048, 1408, 1, 64, 2048, 2048, 2048, 64]
    - [0, 16261.2]
  - - [2112, 1408, 1, 64, 2112, 2112, 2112, 64]
    - [0, 17174.9]
  - - [2176, 1408, 1, 64, 2176, 2176, 2176, 64]
    - [3, 17383.2]
  - - [2240, 1408, 1, 64, 2240, 2240, 2240, 64]
    - [0, 17252.0]
  - - [2304, 1408, 1, 64, 2304, 2304, 2304, 64]
    - [0, 17818.1]
  - - [2368, 1408, 1, 64, 2368, 2368, 2368, 64]
    - [0, 18157.2]
  - - [2432, 1408, 1, 64, 2432, 2432, 2432, 64]
    - [0, 18616.3]
  - - [2496, 1408, 1, 64, 2496, 2496, 2496, 64]
    - [3, 18741.6]
  - - [2560, 1408, 1, 64, 2560, 2560, 2560, 64]
    - [0, 18527.5]
  - - [2624, 1408, 1, 64, 2624, 2624, 2624, 64]
    - [9, 19365.4]
  - - [2688, 1408, 1, 64, 2688, 2688, 2688, 64]
    - [9, 19380.7]
  - - [2752, 1408, 1, 64, 2752, 2752, 2752, 64]
    - [9, 19904.2]
  - - [2816, 1408, 1, 64, 2816, 2816, 2816, 64]
    - [3, 19507.5]
  - - [2880, 1408, 1, 64, 2880, 2880, 2880, 64]
    - [3, 19917.1]
  - - [2944, 1408, 1, 64, 2944, 2944, 2944, 64]
    - [3, 20039.9]
  - - [3008, 1408, 1, 64, 3008, 3008, 3008, 64]
    - [3, 20253.5]
  - - [3072, 1408, 1, 64, 3072, 3072, 3072, 64]
    - [0, 19286.7]
  - - [3136, 1408, 1, 64, 3136, 3136, 3136, 64]
    - [0, 20505.7]
  - - [3200, 1408, 1, 64, 3200, 3200, 3200, 64]
    - [0, 20828.9]
  - - [3264, 1408, 1, 64, 3264, 3264, 3264, 64]
    - [0, 21163.0]
  - - [3328, 1408, 1, 64, 3328, 3328, 3328, 64]
    - [0, 21207.1]
  - - [3392, 1408, 1, 64, 3392, 3392, 3392, 64]
    - [0, 21286.9]
  - - [3456, 1408, 1, 64, 3456, 3456, 3456, 64]
    - [0, 21449.4]
  - - [3520, 1408, 1, 64, 3520, 3520, 3520, 64]
    - [3, 21602.6]
  - - [3584, 1408, 1, 64, 3584, 3584, 3584, 64]
    - [0, 21069.9]
  - - [3648, 1408, 1, 64, 3648, 3648, 3648, 64]
    - [3, 21961.9]
  - - [3712, 1408, 1, 64, 3712, 3712, 3712, 64]
    - [3, 21922.5]
  - - [3776, 1408, 1, 64, 3776, 3776, 3776, 64]
    - [0, 21427.0]
  - - [3840, 1408, 1, 64, 3840, 3840, 3840, 64]
    - [0, 21814.8]
  - - [3904, 1408, 1, 64, 3904, 3904, 3904, 64]
    - [3, 22483.2]
  - - [3968, 1408, 1, 64, 3968, 3968, 3968, 64]
    - [0, 22633.3]
  - - [4032, 1408, 1, 64, 4032, 4032, 4032, 64]
    - [3, 22613.2]
  - - [4096, 1408, 1, 64, 4096, 4096, 4096, 64]
    - [0, 21253.9]
  - - [64, 1472, 1, 64, 64, 64, 64, 64]
    - [9, 1201.06]
  - - [128, 1472, 1, 64, 128, 128, 128, 64]
    - [4, 2456.42]
  - - [192, 1472, 1, 64, 192, 192, 192, 64]
    - [11, 3450.56]
  - - [256, 1472, 1, 64, 256, 256, 256, 64]
    - [12, 4369.84]
  - - [320, 1472, 1, 64, 320, 320, 320, 64]
    - [1, 5226.47]
  - - [384, 1472, 1, 64, 384, 384, 384, 64]
    - [9, 6194.47]
  - - [448, 1472, 1, 64, 448, 448, 448, 64]
    - [0, 6832.58]
  - - [512, 1472, 1, 64, 512, 512, 512, 64]
    - [4, 7640.41]
  - - [576, 1472, 1, 64, 576, 576, 576, 64]
    - [9, 8491.96]
  - - [640, 1472, 1, 64, 640, 640, 640, 64]
    - [0, 9457.67]
  - - [704, 1472, 1, 64, 704, 704, 704, 64]
    - [9, 9645.36]
  - - [768, 1472, 1, 64, 768, 768, 768, 64]
    - [9, 10209.0]
  - - [832, 1472, 1, 64, 832, 832, 832, 64]
    - [0, 11022.5]
  - - [896, 1472, 1, 64, 896, 896, 896, 64]
    - [0, 11697.5]
  - - [960, 1472, 1, 64, 960, 960, 960, 64]
    - [9, 12128.0]
  - - [1024, 1472, 1, 64, 1024, 1024, 1024, 64]
    - [4, 12018.0]
  - - [1088, 1472, 1, 64, 1088, 1088, 1088, 64]
    - [0, 13237.3]
  - - [1152, 1472, 1, 64, 1152, 1152, 1152, 64]
    - [0, 13625.4]
  - - [1216, 1472, 1, 64, 1216, 1216, 1216, 64]
    - [0, 14153.1]
  - - [1280, 1472, 1, 64, 1280, 1280, 1280, 64]
    - [0, 14280.6]
  - - [1344, 1472, 1, 64, 1344, 1344, 1344, 64]
    - [9, 14181.7]
  - - [1408, 1472, 1, 64, 1408, 1408, 1408, 64]
    - [9, 14721.8]
  - - [1472, 1472, 1, 64, 1472, 1472, 1472, 64]
    - [0, 15115.8]
  - - [1536, 1472, 1, 64, 1536, 1536, 1536, 64]
    - [0, 14622.2]
  - - [1600, 1472, 1, 64, 1600, 1600, 1600, 64]
    - [9, 15693.0]
  - - [1664, 1472, 1, 64, 1664, 1664, 1664, 64]
    - [0, 16121.1]
  - - [1728, 1472, 1, 64, 1728, 1728, 1728, 64]
    - [9, 16362.5]
  - - [1792, 1472, 1, 64, 1792, 1792, 1792, 64]
    - [0, 16555.8]
  - - [1856, 1472, 1, 64, 1856, 1856, 1856, 64]
    - [0, 16623.6]
  - - [1920, 1472, 1, 64, 1920, 1920, 1920, 64]
    - [9, 16926.6]
  - - [1984, 1472, 1, 64, 1984, 1984, 1984, 64]
    - [0, 17052.0]
  - - [2048, 1472, 1, 64, 2048, 2048, 2048, 64]
    - [4, 16724.7]
  - - [2112, 1472, 1, 64, 2112, 2112, 2112, 64]
    - [3, 17531.5]
  - - [2176, 1472, 1, 64, 2176, 2176, 2176, 64]
    - [0, 17788.4]
  - - [2240, 1472, 1, 64, 2240, 2240, 2240, 64]
    - [0, 17932.0]
  - - [2304, 1472, 1, 64, 2304, 2304, 2304, 64]
    - [0, 18175.6]
  - - [2368, 1472, 1, 64, 2368, 2368, 2368, 64]
    - [0, 18574.7]
  - - [2432, 1472, 1, 64, 2432, 2432, 2432, 64]
    - [0, 18913.0]
  - - [2496, 1472, 1, 64, 2496, 2496, 2496, 64]
    - [9, 19267.6]
  - - [2560, 1472, 1, 64, 2560, 2560, 2560, 64]
    - [0, 19018.3]
  - - [2624, 1472, 1, 64, 2624, 2624, 2624, 64]
    - [9, 19924.3]
  - - [2688, 1472, 1, 64, 2688, 2688, 2688, 64]
    - [3, 19540.8]
  - - [2752, 1472, 1, 64, 2752, 2752, 2752, 64]
    - [3, 19895.6]
  - - [2816, 1472, 1, 64, 2816, 2816, 2816, 64]
    - [0, 19963.0]
  - - [2880, 1472, 1, 64, 2880, 2880, 2880, 64]
    - [3, 20317.2]
  - - [2944, 1472, 1, 64, 2944, 2944, 2944, 64]
    - [3, 20436.7]
  - - [3008, 1472, 1, 64, 3008, 3008, 3008, 64]
    - [3, 20675.3]
  - - [3072, 1472, 1, 64, 3072, 3072, 3072, 64]
    - [0, 19797.9]
  - - [3136, 1472, 1, 64, 3136, 3136, 3136, 64]
    - [0, 20982.5]
  - - [3200, 1472, 1, 64, 3200, 3200, 3200, 64]
    - [0, 21149.4]
  - - [3264, 1472, 1, 64, 3264, 3264, 3264, 64]
    - [0, 21422.1]
  - - [3328, 1472, 1, 64, 3328, 3328, 3328, 64]
    - [3, 21397.9]
  - - [3392, 1472, 1, 64, 3392, 3392, 3392, 64]
    - [3, 21607.3]
  - - [3456, 1472, 1, 64, 3456, 3456, 3456, 64]
    - [3, 21753.2]
  - - [3520, 1472, 1, 64, 3520, 3520, 3520, 64]
    - [3, 21897.1]
  - - [3584, 1472, 1, 64, 3584, 3584, 3584, 64]
    - [0, 21606.1]
  - - [3648, 1472, 1, 64, 3648, 3648, 3648, 64]
    - [3, 22278.5]
  - - [3712, 1472, 1, 64, 3712, 3712, 3712, 64]
    - [0, 22390.6]
  - - [3776, 1472, 1, 64, 3776, 3776, 3776, 64]
    - [0, 21584.0]
  - - [3840, 1472, 1, 64, 3840, 3840, 3840, 64]
    - [3, 22301.7]
  - - [3904, 1472, 1, 64, 3904, 3904, 3904, 64]
    - [3, 22829.6]
  - - [3968, 1472, 1, 64, 3968, 3968, 3968, 64]
    - [3, 22978.5]
  - - [4032, 1472, 1, 64, 4032, 4032, 4032, 64]
    - [3, 23005.4]
  - - [4096, 1472, 1, 64, 4096, 4096, 4096, 64]
    - [0, 21663.6]
  - - [64, 1536, 1, 64, 64, 64, 64, 64]
    - [4, 1291.34]
  - - [128, 1536, 1, 64, 128, 128, 128, 64]
    - [18, 2489.67]
  - - [192, 1536, 1, 64, 192, 192, 192, 64]
    - [5, 3580.78]
  - - [256, 1536, 1, 64, 256, 256, 256, 64]
    - [3, 4433.63]
  - - [320, 1536, 1, 64, 320, 320, 320, 64]
    - [5, 5263.01]
  - - [384, 1536, 1, 64, 384, 384, 384, 64]
    - [9, 6405.58]
  - - [448, 1536, 1, 64, 448, 448, 448, 64]
    - [4, 7285.33]
  - - [512, 1536, 1, 64, 512, 512, 512, 64]
    - [0, 7926.15]
  - - [576, 1536, 1, 64, 576, 576, 576, 64]
    - [4, 8819.73]
  - - [640, 1536, 1, 64, 640, 640, 640, 64]
    - [9, 9763.2]
  - - [704, 1536, 1, 64, 704, 704, 704, 64]
    - [4, 9964.8]
  - - [768, 1536, 1, 64, 768, 768, 768, 64]
    - [4, 10536.8]
  - - [832, 1536, 1, 64, 832, 832, 832, 64]
    - [0, 11530.9]
  - - [896, 1536, 1, 64, 896, 896, 896, 64]
    - [9, 11980.3]
  - - [960, 1536, 1, 64, 960, 960, 960, 64]
    - [0, 12423.8]
  - - [1024, 1536, 1, 64, 1024, 1024, 1024, 64]
    - [4, 12268.3]
  - - [1088, 1536, 1, 64, 1088, 1088, 1088, 64]
    - [0, 13628.2]
  - - [1152, 1536, 1, 64, 1152, 1152, 1152, 64]
    - [0, 13917.3]
  - - [1216, 1536, 1, 64, 1216, 1216, 1216, 64]
    - [0, 14499.8]
  - - [1280, 1536, 1, 64, 1280, 1280, 1280, 64]
    - [0, 14634.6]
  - - [1344, 1536, 1, 64, 1344, 1344, 1344, 64]
    - [0, 14645.8]
  - - [1408, 1536, 1, 64, 1408, 1408, 1408, 64]
    - [0, 15048.0]
  - - [1472, 1536, 1, 64, 1472, 1472, 1472, 64]
    - [0, 15415.2]
  - - [1536, 1536, 1, 64, 1536, 1536, 1536, 64]
    - [0, 14706.8]
  - - [1600, 1536, 1, 64, 1600, 1600, 1600, 64]
    - [0, 16102.0]
  - - [1664, 1536, 1, 64, 1664, 1664, 1664, 64]
    - [0, 16608.4]
  - - [1728, 1536, 1, 64, 1728, 1728, 1728, 64]
    - [0, 16969.7]
  - - [1792, 1536, 1, 64, 1792, 1792, 1792, 64]
    - [0, 16896.1]
  - - [1856, 1536, 1, 64, 1856, 1856, 1856, 64]
    - [0, 17155.7]
  - - [1920, 1536, 1, 64, 1920, 1920, 1920, 64]
    - [9, 17583.5]
  - - [1984, 1536, 1, 64, 1984, 1984, 1984, 64]
    - [3, 17293.3]
  - - [2048, 1536, 1, 64, 2048, 2048, 2048, 64]
    - [4, 16767.3]
  - - [2112, 1536, 1, 64, 2112, 2112, 2112, 64]
    - [0, 17925.8]
  - - [2176, 1536, 1, 64, 2176, 2176, 2176, 64]
    - [0, 18274.9]
  - - [2240, 1536, 1, 64, 2240, 2240, 2240, 64]
    - [0, 18301.1]
  - - [2304, 1536, 1, 64, 2304, 2304, 2304, 64]
    - [0, 18545.0]
  - - [2368, 1536, 1, 64, 2368, 2368, 2368, 64]
    - [0, 19110.2]
  - - [2432, 1536, 1, 64, 2432, 2432, 2432, 64]
    - [0, 19358.2]
  - - [2496, 1536, 1, 64, 2496, 2496, 2496, 64]
    - [9, 19652.8]
  - - [2560, 1536, 1, 64, 2560, 2560, 2560, 64]
    - [0, 19255.9]
  - - [2624, 1536, 1, 64, 2624, 2624, 2624, 64]
    - [3, 19892.7]
  - - [2688, 1536, 1, 64, 2688, 2688, 2688, 64]
    - [3, 19951.7]
  - - [2752, 1536, 1, 64, 2752, 2752, 2752, 64]
    - [3, 20345.2]
  - - [2816, 1536, 1, 64, 2816, 2816, 2816, 64]
    - [0, 20311.2]
  - - [2880, 1536, 1, 64, 2880, 2880, 2880, 64]
    - [3, 20727.2]
  - - [2944, 1536, 1, 64, 2944, 2944, 2944, 64]
    - [0, 20798.1]
  - - [3008, 1536, 1, 64, 3008, 3008, 3008, 64]
    - [3, 21127.2]
  - - [3072, 1536, 1, 64, 3072, 3072, 3072, 64]
    - [0, 19982.0]
  - - [3136, 1536, 1, 64, 3136, 3136, 3136, 64]
    - [0, 21356.4]
  - - [3200, 1536, 1, 64, 3200, 3200, 3200, 64]
    - [3, 21467.9]
  - - [3264, 1536, 1, 64, 3264, 3264, 3264, 64]
    - [3, 21700.4]
  - - [3328, 1536, 1, 64, 3328, 3328, 3328, 64]
    - [3, 21698.8]
  - - [3392, 1536, 1, 64, 3392, 3392, 3392, 64]
    - [0, 21879.5]
  - - [3456, 1536, 1, 64, 3456, 3456, 3456, 64]
    - [3, 22053.5]
  - - [3520, 1536, 1, 64, 3520, 3520, 3520, 64]
    - [0, 22463.5]
  - - [3584, 1536, 1, 64, 3584, 3584, 3584, 64]
    - [0, 21906.3]
  - - [3648, 1536, 1, 64, 3648, 3648, 3648, 64]
    - [3, 22615.2]
  - - [3712, 1536, 1, 64, 3712, 3712, 3712, 64]
    - [3, 22609.9]
  - - [3776, 1536, 1, 64, 3776, 3776, 3776, 64]
    - [0, 21861.9]
  - - [3840, 1536, 1, 64, 3840, 3840, 3840, 64]
    - [3, 22493.4]
  - - [3904, 1536, 1, 64, 3904, 3904, 3904, 64]
    - [3, 23388.0]
  - - [3968, 1536, 1, 64, 3968, 3968, 3968, 64]
    - [3, 23275.1]
  - - [4032, 1536, 1, 64, 4032, 4032, 4032, 64]
    - [3, 23241.3]
  - - [4096, 1536, 1, 64, 4096, 4096, 4096, 64]
    - [0, 21889.0]
  - - [64, 1600, 1, 64, 64, 64, 64, 64]
    - [4, 1347.63]
  - - [128, 1600, 1, 64, 128, 128, 128, 64]
    - [15, 2581.66]
  - - [192, 1600, 1, 64, 192, 192, 192, 64]
    - [7, 3656.39]
  - - [256, 1600, 1, 64, 256, 256, 256, 64]
    - [5, 4566.07]
  - - [320, 1600, 1, 64, 320, 320, 320, 64]
    - [6, 5608.97]
  - - [384, 1600, 1, 64, 384, 384, 384, 64]
    - [4, 6619.77]
  - - [448, 1600, 1, 64, 448, 448, 448, 64]
    - [4, 7465.39]
  - - [512, 1600, 1, 64, 512, 512, 512, 64]
    - [4, 8149.85]
  - - [576, 1600, 1, 64, 576, 576, 576, 64]
    - [11, 9353.23]
  - - [640, 1600, 1, 64, 640, 640, 640, 64]
    - [4, 9574.25]
  - - [704, 1600, 1, 64, 704, 704, 704, 64]
    - [9, 10314.6]
  - - [768, 1600, 1, 64, 768, 768, 768, 64]
    - [9, 10801.1]
  - - [832, 1600, 1, 64, 832, 832, 832, 64]
    - [0, 11874.0]
  - - [896, 1600, 1, 64, 896, 896, 896, 64]
    - [0, 12117.0]
  - - [960, 1600, 1, 64, 960, 960, 960, 64]
    - [9, 12883.8]
  - - [1024, 1600, 1, 64, 1024, 1024, 1024, 64]
    - [0, 12733.0]
  - - [1088, 1600, 1, 64, 1088, 1088, 1088, 64]
    - [0, 13905.4]
  - - [1152, 1600, 1, 64, 1152, 1152, 1152, 64]
    - [0, 14197.1]
  - - [1216, 1600, 1, 64, 1216, 1216, 1216, 64]
    - [0, 14747.9]
  - - [1280, 1600, 1, 64, 1280, 1280, 1280, 64]
    - [3, 14332.5]
  - - [1344, 1600, 1, 64, 1344, 1344, 1344, 64]
    - [0, 14978.7]
  - - [1408, 1600, 1, 64, 1408, 1408, 1408, 64]
    - [0, 15405.3]
  - - [1472, 1600, 1, 64, 1472, 1472, 1472, 64]
    - [9, 15785.0]
  - - [1536, 1600, 1, 64, 1536, 1536, 1536, 64]
    - [0, 15072.9]
  - - [1600, 1600, 1, 64, 1600, 1600, 1600, 64]
    - [0, 16547.6]
  - - [1664, 1600, 1, 64, 1664, 1664, 1664, 64]
    - [0, 16887.2]
  - - [1728, 1600, 1, 64, 1728, 1728, 1728, 64]
    - [9, 17165.9]
  - - [1792, 1600, 1, 64, 1792, 1792, 1792, 64]
    - [9, 17413.1]
  - - [1856, 1600, 1, 64, 1856, 1856, 1856, 64]
    - [9, 16996.3]
  - - [1920, 1600, 1, 64, 1920, 1920, 1920, 64]
    - [3, 17425.0]
  - - [1984, 1600, 1, 64, 1984, 1984, 1984, 64]
    - [0, 17726.2]
  - - [2048, 1600, 1, 64, 2048, 2048, 2048, 64]
    - [4, 17072.1]
  - - [2112, 1600, 1, 64, 2112, 2112, 2112, 64]
    - [0, 18368.2]
  - - [2176, 1600, 1, 64, 2176, 2176, 2176, 64]
    - [3, 18545.2]
  - - [2240, 1600, 1, 64, 2240, 2240, 2240, 64]
    - [0, 18687.8]
  - - [2304, 1600, 1, 64, 2304, 2304, 2304, 64]
    - [0, 18907.5]
  - - [2368, 1600, 1, 64, 2368, 2368, 2368, 64]
    - [0, 19401.5]
  - - [2432, 1600, 1, 64, 2432, 2432, 2432, 64]
    - [0, 19669.5]
  - - [2496, 1600, 1, 64, 2496, 2496, 2496, 64]
    - [3, 19870.0]
  - - [2560, 1600, 1, 64, 2560, 2560, 2560, 64]
    - [0, 19292.2]
  - - [2624, 1600, 1, 64, 2624, 2624, 2624, 64]
    - [3, 20291.2]
  - - [2688, 1600, 1, 64, 2688, 2688, 2688, 64]
    - [3, 20355.7]
  - - [2752, 1600, 1, 64, 2752, 2752, 2752, 64]
    - [3, 20673.6]
  - - [2816, 1600, 1, 64, 2816, 2816, 2816, 64]
    - [0, 20721.2]
  - - [2880, 1600, 1, 64, 2880, 2880, 2880, 64]
    - [3, 21072.5]
  - - [2944, 1600, 1, 64, 2944, 2944, 2944, 64]
    - [3, 21176.2]
  - - [3008, 1600, 1, 64, 3008, 3008, 3008, 64]
    - [3, 21448.1]
  - - [3072, 1600, 1, 64, 3072, 3072, 3072, 64]
    - [0, 20129.8]
  - - [3136, 1600, 1, 64, 3136, 3136, 3136, 64]
    - [3, 21611.5]
  - - [3200, 1600, 1, 64, 3200, 3200, 3200, 64]
    - [3, 21836.4]
  - - [3264, 1600, 1, 64, 3264, 3264, 3264, 64]
    - [3, 22000.3]
  - - [3328, 1600, 1, 64, 3328, 3328, 3328, 64]
    - [3, 22024.4]
  - - [3392, 1600, 1, 64, 3392, 3392, 3392, 64]
    - [0, 22188.5]
  - - [3456, 1600, 1, 64, 3456, 3456, 3456, 64]
    - [0, 22330.4]
  - - [3520, 1600, 1, 64, 3520, 3520, 3520, 64]
    - [3, 22698.0]
  - - [3584, 1600, 1, 64, 3584, 3584, 3584, 64]
    - [0, 21943.0]
  - - [3648, 1600, 1, 64, 3648, 3648, 3648, 64]
    - [3, 23003.3]
  - - [3712, 1600, 1, 64, 3712, 3712, 3712, 64]
    - [3, 22859.2]
  - - [3776, 1600, 1, 64, 3776, 3776, 3776, 64]
    - [3, 21911.9]
  - - [3840, 1600, 1, 64, 3840, 3840, 3840, 64]
    - [3, 22731.7]
  - - [3904, 1600, 1, 64, 3904, 3904, 3904, 64]
    - [3, 23465.9]
  - - [3968, 1600, 1, 64, 3968, 3968, 3968, 64]
    - [3, 23429.8]
  - - [4032, 1600, 1, 64, 4032, 4032, 4032, 64]
    - [0, 23683.4]
  - - [4096, 1600, 1, 64, 4096, 4096, 4096, 64]
    - [0, 21979.1]
  - - [64, 1664, 1, 64, 64, 64, 64, 64]
    - [18, 1435.19]
  - - [128, 1664, 1, 64, 128, 128, 128, 64]
    - [16, 2610.9]
  - - [192, 1664, 1, 64, 192, 192, 192, 64]
    - [15, 3783.67]
  - - [256, 1664, 1, 64, 256, 256, 256, 64]
    - [6, 4724.07]
  - - [320, 1664, 1, 64, 320, 320, 320, 64]
    - [0, 5890.83]
  - - [384, 1664, 1, 64, 384, 384, 384, 64]
    - [1, 6825.95]
  - - [448, 1664, 1, 64, 448, 448, 448, 64]
    - [4, 7695.1]
  - - [512, 1664, 1, 64, 512, 512, 512, 64]
    - [4, 8452.23]
  - - [576, 1664, 1, 64, 576, 576, 576, 64]
    - [9, 9675.19]
  - - [640, 1664, 1, 64, 640, 640, 640, 64]
    - [4, 9899.23]
  - - [704, 1664, 1, 64, 704, 704, 704, 64]
    - [4, 10473.9]
  - - [768, 1664, 1, 64, 768, 768, 768, 64]
    - [9, 11148.9]
  - - [832, 1664, 1, 64, 832, 832, 832, 64]
    - [0, 12135.8]
  - - [896, 1664, 1, 64, 896, 896, 896, 64]
    - [0, 12550.3]
  - - [960, 1664, 1, 64, 960, 960, 960, 64]
    - [0, 13208.7]
  - - [1024, 1664, 1, 64, 1024, 1024, 1024, 64]
    - [9, 13027.2]
  - - [1088, 1664, 1, 64, 1088, 1088, 1088, 64]
    - [0, 14264.0]
  - - [1152, 1664, 1, 64, 1152, 1152, 1152, 64]
    - [0, 14424.7]
  - - [1216, 1664, 1, 64, 1216, 1216, 1216, 64]
    - [4, 14307.6]
  - - [1280, 1664, 1, 64, 1280, 1280, 1280, 64]
    - [3, 14708.0]
  - - [1344, 1664, 1, 64, 1344, 1344, 1344, 64]
    - [0, 15415.1]
  - - [1408, 1664, 1, 64, 1408, 1408, 1408, 64]
    - [0, 15583.5]
  - - [1472, 1664, 1, 64, 1472, 1472, 1472, 64]
    - [0, 16200.9]
  - - [1536, 1664, 1, 64, 1536, 1536, 1536, 64]
    - [0, 15447.7]
  - - [1600, 1664, 1, 64, 1600, 1600, 1600, 64]
    - [9, 16941.0]
  - - [1664, 1664, 1, 64, 1664, 1664, 1664, 64]
    - [0, 17241.5]
  - - [1728, 1664, 1, 64, 1728, 1728, 1728, 64]
    - [0, 17643.7]
  - - [1792, 1664, 1, 64, 1792, 1792, 1792, 64]
    - [3, 17219.1]
  - - [1856, 1664, 1, 64, 1856, 1856, 1856, 64]
    - [3, 17434.5]
  - - [1920, 1664, 1, 64, 1920, 1920, 1920, 64]
    - [9, 17664.9]
  - - [1984, 1664, 1, 64, 1984, 1984, 1984, 64]
    - [0, 18139.2]
  - - [2048, 1664, 1, 64, 2048, 2048, 2048, 64]
    - [4, 17424.4]
  - - [2112, 1664, 1, 64, 2112, 2112, 2112, 64]
    - [0, 18711.9]
  - - [2176, 1664, 1, 64, 2176, 2176, 2176, 64]
    - [0, 18930.8]
  - - [2240, 1664, 1, 64, 2240, 2240, 2240, 64]
    - [0, 19009.4]
  - - [2304, 1664, 1, 64, 2304, 2304, 2304, 64]
    - [0, 19227.7]
  - - [2368, 1664, 1, 64, 2368, 2368, 2368, 64]
    - [3, 19517.1]
  - - [2432, 1664, 1, 64, 2432, 2432, 2432, 64]
    - [3, 19878.4]
  - - [2496, 1664, 1, 64, 2496, 2496, 2496, 64]
    - [3, 20224.5]
  - - [2560, 1664, 1, 64, 2560, 2560, 2560, 64]
    - [0, 19661.6]
  - - [2624, 1664, 1, 64, 2624, 2624, 2624, 64]
    - [3, 20551.8]
  - - [2688, 1664, 1, 64, 2688, 2688, 2688, 64]
    - [3, 20685.0]
  - - [2752, 1664, 1, 64, 2752, 2752, 2752, 64]
    - [3, 21014.9]
  - - [2816, 1664, 1, 64, 2816, 2816, 2816, 64]
    - [0, 21040.5]
  - - [2880, 1664, 1, 64, 2880, 2880, 2880, 64]
    - [3, 21331.6]
  - - [2944, 1664, 1, 64, 2944, 2944, 2944, 64]
    - [3, 21418.2]
  - - [3008, 1664, 1, 64, 3008, 3008, 3008, 64]
    - [3, 21650.2]
  - - [3072, 1664, 1, 64, 3072, 3072, 3072, 64]
    - [0, 20377.0]
  - - [3136, 1664, 1, 64, 3136, 3136, 3136, 64]
    - [3, 21666.6]
  - - [3200, 1664, 1, 64, 3200, 3200, 3200, 64]
    - [3, 22064.4]
  - - [3264, 1664, 1, 64, 3264, 3264, 3264, 64]
    - [3, 22297.7]
  - - [3328, 1664, 1, 64, 3328, 3328, 3328, 64]
    - [0, 22363.5]
  - - [3392, 1664, 1, 64, 3392, 3392, 3392, 64]
    - [0, 22574.1]
  - - [3456, 1664, 1, 64, 3456, 3456, 3456, 64]
    - [0, 22792.1]
  - - [3520, 1664, 1, 64, 3520, 3520, 3520, 64]
    - [0, 22842.2]
  - - [3584, 1664, 1, 64, 3584, 3584, 3584, 64]
    - [3, 22050.9]
  - - [3648, 1664, 1, 64, 3648, 3648, 3648, 64]
    - [3, 23073.7]
  - - [3712, 1664, 1, 64, 3712, 3712, 3712, 64]
    - [3, 23112.0]
  - - [3776, 1664, 1, 64, 3776, 3776, 3776, 64]
    - [3, 21990.9]
  - - [3840, 1664, 1, 64, 3840, 3840, 3840, 64]
    - [0, 22881.7]
  - - [3904, 1664, 1, 64, 3904, 3904, 3904, 64]
    - [3, 23233.0]
  - - [3968, 1664, 1, 64, 3968, 3968, 3968, 64]
    - [3, 23499.6]
  - - [4032, 1664, 1, 64, 4032, 4032, 4032, 64]
    - [0, 23812.6]
  - - [4096, 1664, 1, 64, 4096, 4096, 4096, 64]
    - [0, 22216.8]
  - - [64, 1728, 1, 64, 64, 64, 64, 64]
    - [4, 1495.42]
  - - [128, 1728, 1, 64, 128, 128, 128, 64]
    - [4, 2741.75]
  - - [192, 1728, 1, 64, 192, 192, 192, 64]
    - [14, 4434.72]
  - - [256, 1728, 1, 64, 256, 256, 256, 64]
    - [0, 5429.83]
  - - [320, 1728, 1, 64, 320, 320, 320, 64]
    - [4, 6195.58]
  - - [384, 1728, 1, 64, 384, 384, 384, 64]
    - [3, 7410.08]
  - - [448, 1728, 1, 64, 448, 448, 448, 64]
    - [0, 8272.67]
  - - [512, 1728, 1, 64, 512, 512, 512, 64]
    - [9, 8891.71]
  - - [576, 1728, 1, 64, 576, 576, 576, 64]
    - [4, 9557.47]
  - - [640, 1728, 1, 64, 640, 640, 640, 64]
    - [4, 10205.9]
  - - [704, 1728, 1, 64, 704, 704, 704, 64]
    - [0, 10930.2]
  - - [768, 1728, 1, 64, 768, 768, 768, 64]
    - [9, 11423.5]
  - - [832, 1728, 1, 64, 832, 832, 832, 64]
    - [0, 12513.6]
  - - [896, 1728, 1, 64, 896, 896, 896, 64]
    - [0, 12752.8]
  - - [960, 1728, 1, 64, 960, 960, 960, 64]
    - [9, 13562.6]
  - - [1024, 1728, 1, 64, 1024, 1024, 1024, 64]
    - [0, 13240.4]
  - - [1088, 1728, 1, 64, 1088, 1088, 1088, 64]
    - [0, 14621.8]
  - - [1152, 1728, 1, 64, 1152, 1152, 1152, 64]
    - [4, 14182.4]
  - - [1216, 1728, 1, 64, 1216, 1216, 1216, 64]
    - [3, 14645.9]
  - - [1280, 1728, 1, 64, 1280, 1280, 1280, 64]
    - [3, 15017.8]
  - - [1344, 1728, 1, 64, 1344, 1344, 1344, 64]
    - [0, 15723.5]
  - - [1408, 1728, 1, 64, 1408, 1408, 1408, 64]
    - [0, 16018.1]
  - - [1472, 1728, 1, 64, 1472, 1472, 1472, 64]
    - [0, 16535.2]
  - - [1536, 1728, 1, 64, 1536, 1536, 1536, 64]
    - [0, 15740.1]
  - - [1600, 1728, 1, 64, 1600, 1600, 1600, 64]
    - [0, 17180.9]
  - - [1664, 1728, 1, 64, 1664, 1664, 1664, 64]
    - [0, 17633.5]
  - - [1728, 1728, 1, 64, 1728, 1728, 1728, 64]
    - [3, 17247.4]
  - - [1792, 1728, 1, 64, 1792, 1792, 1792, 64]
    - [9, 17561.2]
  - - [1856, 1728, 1, 64, 1856, 1856, 1856, 64]
    - [0, 17751.1]
  - - [1920, 1728, 1, 64, 1920, 1920, 1920, 64]
    - [9, 18035.7]
  - - [1984, 1728, 1, 64, 1984, 1984, 1984, 64]
    - [0, 18388.6]
  - - [2048, 1728, 1, 64, 2048, 2048, 2048, 64]
    - [4, 17704.2]
  - - [2112, 1728, 1, 64, 2112, 2112, 2112, 64]
    - [0, 19094.8]
  - - [2176, 1728, 1, 64, 2176, 2176, 2176, 64]
    - [0, 19227.1]
  - - [2240, 1728, 1, 64, 2240, 2240, 2240, 64]
    - [0, 19348.8]
  - - [2304, 1728, 1, 64, 2304, 2304, 2304, 64]
    - [3, 19198.4]
  - - [2368, 1728, 1, 64, 2368, 2368, 2368, 64]
    - [3, 19764.4]
  - - [2432, 1728, 1, 64, 2432, 2432, 2432, 64]
    - [3, 20143.6]
  - - [2496, 1728, 1, 64, 2496, 2496, 2496, 64]
    - [3, 20377.6]
  - - [2560, 1728, 1, 64, 2560, 2560, 2560, 64]
    - [0, 19755.2]
  - - [2624, 1728, 1, 64, 2624, 2624, 2624, 64]
    - [0, 20835.0]
  - - [2688, 1728, 1, 64, 2688, 2688, 2688, 64]
    - [3, 21084.4]
  - - [2752, 1728, 1, 64, 2752, 2752, 2752, 64]
    - [0, 21126.4]
  - - [2816, 1728, 1, 64, 2816, 2816, 2816, 64]
    - [0, 21355.3]
  - - [2880, 1728, 1, 64, 2880, 2880, 2880, 64]
    - [3, 21609.5]
  - - [2944, 1728, 1, 64, 2944, 2944, 2944, 64]
    - [3, 21472.0]
  - - [3008, 1728, 1, 64, 3008, 3008, 3008, 64]
    - [3, 21902.7]
  - - [3072, 1728, 1, 64, 3072, 3072, 3072, 64]
    - [0, 20561.3]
  - - [3136, 1728, 1, 64, 3136, 3136, 3136, 64]
    - [3, 21832.8]
  - - [3200, 1728, 1, 64, 3200, 3200, 3200, 64]
    - [3, 22179.2]
  - - [3264, 1728, 1, 64, 3264, 3264, 3264, 64]
    - [3, 22417.7]
  - - [3328, 1728, 1, 64, 3328, 3328, 3328, 64]
    - [0, 22551.9]
  - - [3392, 1728, 1, 64, 3392, 3392, 3392, 64]
    - [0, 22809.4]
  - - [3456, 1728, 1, 64, 3456, 3456, 3456, 64]
    - [3, 22816.6]
  - - [3520, 1728, 1, 64, 3520, 3520, 3520, 64]
    - [3, 22951.4]
  - - [3584, 1728, 1, 64, 3584, 3584, 3584, 64]
    - [0, 22311.2]
  - - [3648, 1728, 1, 64, 3648, 3648, 3648, 64]
    - [3, 22932.9]
  - - [3712, 1728, 1, 64, 3712, 3712, 3712, 64]
    - [3, 23535.9]
  - - [3776, 1728, 1, 64, 3776, 3776, 3776, 64]
    - [0, 22399.4]
  - - [3840, 1728, 1, 64, 3840, 3840, 3840, 64]
    - [3, 23076.1]
  - - [3904, 1728, 1, 64, 3904, 3904, 3904, 64]
    - [3, 23515.6]
  - - [3968, 1728, 1, 64, 3968, 3968, 3968, 64]
    - [3, 23878.9]
  - - [4032, 1728, 1, 64, 4032, 4032, 4032, 64]
    - [3, 23720.7]
  - - [4096, 1728, 1, 64, 4096, 4096, 4096, 64]
    - [1, 22117.0]
  - - [64, 1792, 1, 64, 64, 64, 64, 64]
    - [5, 1470.64]
  - - [128, 1792, 1, 64, 128, 128, 128, 64]
    - [11, 2812.78]
  - - [192, 1792, 1, 64, 192, 192, 192, 64]
    - [5, 4132.86]
  - - [256, 1792, 1, 64, 256, 256, 256, 64]
    - [4, 5323.59]
  - - [320, 1792, 1, 64, 320, 320, 320, 64]
    - [4, 6349.45]
  - - [384, 1792, 1, 64, 384, 384, 384, 64]
    - [4, 7159.76]
  - - [448, 1792, 1, 64, 448, 448, 448, 64]
    - [4, 7985.67]
  - - [512, 1792, 1, 64, 512, 512, 512, 64]
    - [9, 9063.03]
  - - [576, 1792, 1, 64, 576, 576, 576, 64]
    - [0, 9689.03]
  - - [640, 1792, 1, 64, 640, 640, 640, 64]
    - [4, 10380.4]
  - - [704, 1792, 1, 64, 704, 704, 704, 64]
    - [0, 11330.3]
  - - [768, 1792, 1, 64, 768, 768, 768, 64]
    - [9, 11697.2]
  - - [832, 1792, 1, 64, 832, 832, 832, 64]
    - [0, 12633.4]
  - - [896, 1792, 1, 64, 896, 896, 896, 64]
    - [0, 13150.7]
  - - [960, 1792, 1, 64, 960, 960, 960, 64]
    - [0, 13829.9]
  - - [1024, 1792, 1, 64, 1024, 1024, 1024, 64]
    - [9, 13540.9]
  - - [1088, 1792, 1, 64, 1088, 1088, 1088, 64]
    - [0, 14803.6]
  - - [1152, 1792, 1, 64, 1152, 1152, 1152, 64]
    - [9, 14549.0]
  - - [1216, 1792, 1, 64, 1216, 1216, 1216, 64]
    - [0, 15054.0]
  - - [1280, 1792, 1, 64, 1280, 1280, 1280, 64]
    - [0, 15236.1]
  - - [1344, 1792, 1, 64, 1344, 1344, 1344, 64]
    - [0, 15984.6]
  - - [1408, 1792, 1, 64, 1408, 1408, 1408, 64]
    - [0, 16317.6]
  - - [1472, 1792, 1, 64, 1472, 1472, 1472, 64]
    - [0, 16849.9]
  - - [1536, 1792, 1, 64, 1536, 1536, 1536, 64]
    - [0, 15989.7]
  - - [1600, 1792, 1, 64, 1600, 1600, 1600, 64]
    - [0, 17606.9]
  - - [1664, 1792, 1, 64, 1664, 1664, 1664, 64]
    - [9, 17289.2]
  - - [1728, 1792, 1, 64, 1728, 1728, 1728, 64]
    - [3, 17642.5]
  - - [1792, 1792, 1, 64, 1792, 1792, 1792, 64]
    - [0, 17815.4]
  - - [1856, 1792, 1, 64, 1856, 1856, 1856, 64]
    - [0, 18016.0]
  - - [1920, 1792, 1, 64, 1920, 1920, 1920, 64]
    - [9, 18319.4]
  - - [1984, 1792, 1, 64, 1984, 1984, 1984, 64]
    - [0, 18481.1]
  - - [2048, 1792, 1, 64, 2048, 2048, 2048, 64]
    - [1, 17888.7]
  - - [2112, 1792, 1, 64, 2112, 2112, 2112, 64]
    - [0, 19338.8]
  - - [2176, 1792, 1, 64, 2176, 2176, 2176, 64]
    - [0, 19553.2]
  - - [2240, 1792, 1, 64, 2240, 2240, 2240, 64]
    - [3, 19193.0]
  - - [2304, 1792, 1, 64, 2304, 2304, 2304, 64]
    - [0, 19531.2]
  - - [2368, 1792, 1, 64, 2368, 2368, 2368, 64]
    - [3, 19958.7]
  - - [2432, 1792, 1, 64, 2432, 2432, 2432, 64]
    - [3, 20290.9]
  - - [2496, 1792, 1, 64, 2496, 2496, 2496, 64]
    - [3, 20614.9]
  - - [2560, 1792, 1, 64, 2560, 2560, 2560, 64]
    - [0, 20017.6]
  - - [2624, 1792, 1, 64, 2624, 2624, 2624, 64]
    - [3, 20873.8]
  - - [2688, 1792, 1, 64, 2688, 2688, 2688, 64]
    - [3, 21030.0]
  - - [2752, 1792, 1, 64, 2752, 2752, 2752, 64]
    - [3, 21370.4]
  - - [2816, 1792, 1, 64, 2816, 2816, 2816, 64]
    - [0, 21226.3]
  - - [2880, 1792, 1, 64, 2880, 2880, 2880, 64]
    - [3, 21797.5]
  - - [2944, 1792, 1, 64, 2944, 2944, 2944, 64]
    - [3, 21764.8]
  - - [3008, 1792, 1, 64, 3008, 3008, 3008, 64]
    - [3, 21988.4]
  - - [3072, 1792, 1, 64, 3072, 3072, 3072, 64]
    - [0, 20839.7]
  - - [3136, 1792, 1, 64, 3136, 3136, 3136, 64]
    - [3, 22319.6]
  - - [3200, 1792, 1, 64, 3200, 3200, 3200, 64]
    - [3, 22443.5]
  - - [3264, 1792, 1, 64, 3264, 3264, 3264, 64]
    - [3, 22828.3]
  - - [3328, 1792, 1, 64, 3328, 3328, 3328, 64]
    - [3, 22727.0]
  - - [3392, 1792, 1, 64, 3392, 3392, 3392, 64]
    - [3, 22892.7]
  - - [3456, 1792, 1, 64, 3456, 3456, 3456, 64]
    - [3, 23200.6]
  - - [3520, 1792, 1, 64, 3520, 3520, 3520, 64]
    - [3, 23289.3]
  - - [3584, 1792, 1, 64, 3584, 3584, 3584, 64]
    - [0, 22634.2]
  - - [3648, 1792, 1, 64, 3648, 3648, 3648, 64]
    - [3, 23442.5]
  - - [3712, 1792, 1, 64, 3712, 3712, 3712, 64]
    - [3, 23524.2]
  - - [3776, 1792, 1, 64, 3776, 3776, 3776, 64]
    - [3, 22521.0]
  - - [3840, 1792, 1, 64, 3840, 3840, 3840, 64]
    - [3, 23355.8]
  - - [3904, 1792, 1, 64, 3904, 3904, 3904, 64]
    - [3, 24224.2]
  - - [3968, 1792, 1, 64, 3968, 3968, 3968, 64]
    - [0, 24073.0]
  - - [4032, 1792, 1, 64, 4032, 4032, 4032, 64]
    - [0, 23927.2]
  - - [4096, 1792, 1, 64, 4096, 4096, 4096, 64]
    - [0, 22645.5]
  - - [64, 1856, 1, 64, 64, 64, 64, 64]
    - [15, 1522.24]
  - - [128, 1856, 1, 64, 128, 128, 128, 64]
    - [7, 3011.93]
  - - [192, 1856, 1, 64, 192, 192, 192, 64]
    - [15, 4252.55]
  - - [256, 1856, 1, 64, 256, 256, 256, 64]
    - [4, 5287.5]
  - - [320, 1856, 1, 64, 320, 320, 320, 64]
    - [4, 6403.37]
  - - [384, 1856, 1, 64, 384, 384, 384, 64]
    - [3, 7490.94]
  - - [448, 1856, 1, 64, 448, 448, 448, 64]
    - [4, 8359.19]
  - - [512, 1856, 1, 64, 512, 512, 512, 64]
    - [11, 9168.81]
  - - [576, 1856, 1, 64, 576, 576, 576, 64]
    - [9, 9935.9]
  - - [640, 1856, 1, 64, 640, 640, 640, 64]
    - [9, 10582.1]
  - - [704, 1856, 1, 64, 704, 704, 704, 64]
    - [0, 11640.3]
  - - [768, 1856, 1, 64, 768, 768, 768, 64]
    - [9, 11881.4]
  - - [832, 1856, 1, 64, 832, 832, 832, 64]
    - [9, 12829.7]
  - - [896, 1856, 1, 64, 896, 896, 896, 64]
    - [0, 13530.3]
  - - [960, 1856, 1, 64, 960, 960, 960, 64]
    - [0, 14019.1]
  - - [1024, 1856, 1, 64, 1024, 1024, 1024, 64]
    - [9, 13885.1]
  - - [1088, 1856, 1, 64, 1088, 1088, 1088, 64]
    - [4, 14275.4]
  - - [1152, 1856, 1, 64, 1152, 1152, 1152, 64]
    - [9, 14772.5]
  - - [1216, 1856, 1, 64, 1216, 1216, 1216, 64]
    - [9, 15420.1]
  - - [1280, 1856, 1, 64, 1280, 1280, 1280, 64]
    - [0, 15560.5]
  - - [1344, 1856, 1, 64, 1344, 1344, 1344, 64]
    - [0, 16362.0]
  - - [1408, 1856, 1, 64, 1408, 1408, 1408, 64]
    - [0, 16606.8]
  - - [1472, 1856, 1, 64, 1472, 1472, 1472, 64]
    - [9, 17071.7]
  - - [1536, 1856, 1, 64, 1536, 1536, 1536, 64]
    - [0, 16392.7]
  - - [1600, 1856, 1, 64, 1600, 1600, 1600, 64]
    - [0, 17274.4]
  - - [1664, 1856, 1, 64, 1664, 1664, 1664, 64]
    - [0, 17643.0]
  - - [1728, 1856, 1, 64, 1728, 1728, 1728, 64]
    - [9, 17934.1]
  - - [1792, 1856, 1, 64, 1792, 1792, 1792, 64]
    - [9, 18149.6]
  - - [1856, 1856, 1, 64, 1856, 1856, 1856, 64]
    - [0, 18177.8]
  - - [1920, 1856, 1, 64, 1920, 1920, 1920, 64]
    - [9, 18413.0]
  - - [1984, 1856, 1, 64, 1984, 1984, 1984, 64]
    - [0, 18903.1]
  - - [2048, 1856, 1, 64, 2048, 2048, 2048, 64]
    - [1, 18025.1]
  - - [2112, 1856, 1, 64, 2112, 2112, 2112, 64]
    - [3, 19065.9]
  - - [2176, 1856, 1, 64, 2176, 2176, 2176, 64]
    - [3, 19441.2]
  - - [2240, 1856, 1, 64, 2240, 2240, 2240, 64]
    - [3, 19580.1]
  - - [2304, 1856, 1, 64, 2304, 2304, 2304, 64]
    - [0, 19583.2]
  - - [2368, 1856, 1, 64, 2368, 2368, 2368, 64]
    - [3, 20125.7]
  - - [2432, 1856, 1, 64, 2432, 2432, 2432, 64]
    - [3, 20590.2]
  - - [2496, 1856, 1, 64, 2496, 2496, 2496, 64]
    - [3, 20801.4]
  - - [2560, 1856, 1, 64, 2560, 2560, 2560, 64]
    - [0, 20170.1]
  - - [2624, 1856, 1, 64, 2624, 2624, 2624, 64]
    - [0, 21242.1]
  - - [2688, 1856, 1, 64, 2688, 2688, 2688, 64]
    - [3, 21344.3]
  - - [2752, 1856, 1, 64, 2752, 2752, 2752, 64]
    - [3, 21484.7]
  - - [2816, 1856, 1, 64, 2816, 2816, 2816, 64]
    - [0, 21541.1]
  - - [2880, 1856, 1, 64, 2880, 2880, 2880, 64]
    - [3, 22020.9]
  - - [2944, 1856, 1, 64, 2944, 2944, 2944, 64]
    - [3, 22125.8]
  - - [3008, 1856, 1, 64, 3008, 3008, 3008, 64]
    - [3, 22519.9]
  - - [3072, 1856, 1, 64, 3072, 3072, 3072, 64]
    - [0, 21360.5]
  - - [3136, 1856, 1, 64, 3136, 3136, 3136, 64]
    - [3, 22521.4]
  - - [3200, 1856, 1, 64, 3200, 3200, 3200, 64]
    - [3, 22770.3]
  - - [3264, 1856, 1, 64, 3264, 3264, 3264, 64]
    - [3, 23006.7]
  - - [3328, 1856, 1, 64, 3328, 3328, 3328, 64]
    - [3, 23089.0]
  - - [3392, 1856, 1, 64, 3392, 3392, 3392, 64]
    - [3, 23235.8]
  - - [3456, 1856, 1, 64, 3456, 3456, 3456, 64]
    - [3, 23216.5]
  - - [3520, 1856, 1, 64, 3520, 3520, 3520, 64]
    - [0, 23689.3]
  - - [3584, 1856, 1, 64, 3584, 3584, 3584, 64]
    - [0, 22965.8]
  - - [3648, 1856, 1, 64, 3648, 3648, 3648, 64]
    - [3, 23958.9]
  - - [3712, 1856, 1, 64, 3712, 3712, 3712, 64]
    - [3, 23723.2]
  - - [3776, 1856, 1, 64, 3776, 3776, 3776, 64]
    - [3, 23021.2]
  - - [3840, 1856, 1, 64, 3840, 3840, 3840, 64]
    - [0, 23698.6]
  - - [3904, 1856, 1, 64, 3904, 3904, 3904, 64]
    - [3, 24322.3]
  - - [3968, 1856, 1, 64, 3968, 3968, 3968, 64]
    - [0, 24536.9]
  - - [4032, 1856, 1, 64, 4032, 4032, 4032, 64]
    - [3, 24642.8]
  - - [4096, 1856, 1, 64, 4096, 4096, 4096, 64]
    - [0, 22781.0]
  - - [64, 1920, 1, 64, 64, 64, 64, 64]
    - [18, 1655.99]
  - - [128, 1920, 1, 64, 128, 128, 128, 64]
    - [15, 3152.03]
  - - [192, 1920, 1, 64, 192, 192, 192, 64]
    - [4, 4268.65]
  - - [256, 1920, 1, 64, 256, 256, 256, 64]
    - [4, 5621.29]
  - - [320, 1920, 1, 64, 320, 320, 320, 64]
    - [0, 6420.82]
  - - [384, 1920, 1, 64, 384, 384, 384, 64]
    - [7, 7458.99]
  - - [448, 1920, 1, 64, 448, 448, 448, 64]
    - [4, 8588.11]
  - - [512, 1920, 1, 64, 512, 512, 512, 64]
    - [9, 9689.49]
  - - [576, 1920, 1, 64, 576, 576, 576, 64]
    - [9, 10289.0]
  - - [640, 1920, 1, 64, 640, 640, 640, 64]
    - [0, 10881.7]
  - - [704, 1920, 1, 64, 704, 704, 704, 64]
    - [0, 11920.4]
  - - [768, 1920, 1, 64, 768, 768, 768, 64]
    - [9, 12153.4]
  - - [832, 1920, 1, 64, 832, 832, 832, 64]
    - [0, 13123.9]
  - - [896, 1920, 1, 64, 896, 896, 896, 64]
    - [0, 13764.1]
  - - [960, 1920, 1, 64, 960, 960, 960, 64]
    - [0, 14392.9]
  - - [1024, 1920, 1, 64, 1024, 1024, 1024, 64]
    - [9, 14090.4]
  - - [1088, 1920, 1, 64, 1088, 1088, 1088, 64]
    - [0, 14694.7]
  - - [1152, 1920, 1, 64, 1152, 1152, 1152, 64]
    - [9, 15149.4]
  - - [1216, 1920, 1, 64, 1216, 1216, 1216, 64]
    - [9, 15593.9]
  - - [1280, 1920, 1, 64, 1280, 1280, 1280, 64]
    - [0, 15837.8]
  - - [1344, 1920, 1, 64, 1344, 1344, 1344, 64]
    - [0, 16668.3]
  - - [1408, 1920, 1, 64, 1408, 1408, 1408, 64]
    - [0, 16867.8]
  - - [1472, 1920, 1, 64, 1472, 1472, 1472, 64]
    - [0, 17429.0]
  - - [1536, 1920, 1, 64, 1536, 1536, 1536, 64]
    - [0, 16719.0]
  - - [1600, 1920, 1, 64, 1600, 1600, 1600, 64]
    - [9, 17505.6]
  - - [1664, 1920, 1, 64, 1664, 1664, 1664, 64]
    - [9, 17984.9]
  - - [1728, 1920, 1, 64, 1728, 1728, 1728, 64]
    - [0, 18213.7]
  - - [1792, 1920, 1, 64, 1792, 1792, 1792, 64]
    - [0, 18254.0]
  - - [1856, 1920, 1, 64, 1856, 1856, 1856, 64]
    - [0, 18352.2]
  - - [1920, 1920, 1, 64, 1920, 1920, 1920, 64]
    - [9, 18736.3]
  - - [1984, 1920, 1, 64, 1984, 1984, 1984, 64]
    - [0, 19176.6]
  - - [2048, 1920, 1, 64, 2048, 2048, 2048, 64]
    - [4, 18195.0]
  - - [2112, 1920, 1, 64, 2112, 2112, 2112, 64]
    - [0, 19352.8]
  - - [2176, 1920, 1, 64, 2176, 2176, 2176, 64]
    - [3, 19744.7]
  - - [2240, 1920, 1, 64, 2240, 2240, 2240, 64]
    - [3, 19687.2]
  - - [2304, 1920, 1, 64, 2304, 2304, 2304, 64]
    - [0, 19993.9]
  - - [2368, 1920, 1, 64, 2368, 2368, 2368, 64]
    - [3, 20466.9]
  - - [2432, 1920, 1, 64, 2432, 2432, 2432, 64]
    - [3, 20877.6]
  - - [2496, 1920, 1, 64, 2496, 2496, 2496, 64]
    - [3, 21165.2]
  - - [2560, 1920, 1, 64, 2560, 2560, 2560, 64]
    - [0, 20596.4]
  - - [2624, 1920, 1, 64, 2624, 2624, 2624, 64]
    - [3, 21603.6]
  - - [2688, 1920, 1, 64, 2688, 2688, 2688, 64]
    - [3, 21592.4]
  - - [2752, 1920, 1, 64, 2752, 2752, 2752, 64]
    - [3, 21930.1]
  - - [2816, 1920, 1, 64, 2816, 2816, 2816, 64]
    - [0, 22056.7]
  - - [2880, 1920, 1, 64, 2880, 2880, 2880, 64]
    - [3, 22250.3]
  - - [2944, 1920, 1, 64, 2944, 2944, 2944, 64]
    - [3, 22275.5]
  - - [3008, 1920, 1, 64, 3008, 3008, 3008, 64]
    - [3, 22597.0]
  - - [3072, 1920, 1, 64, 3072, 3072, 3072, 64]
    - [0, 21221.2]
  - - [3136, 1920, 1, 64, 3136, 3136, 3136, 64]
    - [3, 22996.2]
  - - [3200, 1920, 1, 64, 3200, 3200, 3200, 64]
    - [3, 22930.5]
  - - [3264, 1920, 1, 64, 3264, 3264, 3264, 64]
    - [0, 23037.1]
  - - [3328, 1920, 1, 64, 3328, 3328, 3328, 64]
    - [0, 23397.5]
  - - [3392, 1920, 1, 64, 3392, 3392, 3392, 64]
    - [0, 23431.8]
  - - [3456, 1920, 1, 64, 3456, 3456, 3456, 64]
    - [0, 23439.1]
  - - [3520, 1920, 1, 64, 3520, 3520, 3520, 64]
    - [0, 23969.7]
  - - [3584, 1920, 1, 64, 3584, 3584, 3584, 64]
    - [0, 23086.4]
  - - [3648, 1920, 1, 64, 3648, 3648, 3648, 64]
    - [3, 24191.1]
  - - [3712, 1920, 1, 64, 3712, 3712, 3712, 64]
    - [0, 24023.1]
  - - [3776, 1920, 1, 64, 3776, 3776, 3776, 64]
    - [3, 23203.0]
  - - [3840, 1920, 1, 64, 3840, 3840, 3840, 64]
    - [0, 23922.9]
  - - [3904, 1920, 1, 64, 3904, 3904, 3904, 64]
    - [0, 24053.3]
  - - [3968, 1920, 1, 64, 3968, 3968, 3968, 64]
    - [0, 24560.8]
  - - [4032, 1920, 1, 64, 4032, 4032, 4032, 64]
    - [3, 24689.6]
  - - [4096, 1920, 1, 64, 4096, 4096, 4096, 64]
    - [0, 23133.3]
  - - [64, 1984, 1, 64, 64, 64, 64, 64]
    - [5, 1681.44]
  - - [128, 1984, 1, 64, 128, 128, 128, 64]
    - [15, 3158.98]
  - - [192, 1984, 1, 64, 192, 192, 192, 64]
    - [4, 4330.23]
  - - [256, 1984, 1, 64, 256, 256, 256, 64]
    - [4, 5786.97]
  - - [320, 1984, 1, 64, 320, 320, 320, 64]
    - [0, 6748.35]
  - - [384, 1984, 1, 64, 384, 384, 384, 64]
    - [4, 7701.5]
  - - [448, 1984, 1, 64, 448, 448, 448, 64]
    - [9, 8823.42]
  - - [512, 1984, 1, 64, 512, 512, 512, 64]
    - [4, 9378.36]
  - - [576, 1984, 1, 64, 576, 576, 576, 64]
    - [0, 10384.4]
  - - [640, 1984, 1, 64, 640, 640, 640, 64]
    - [0, 11242.9]
  - - [704, 1984, 1, 64, 704, 704, 704, 64]
    - [0, 12047.2]
  - - [768, 1984, 1, 64, 768, 768, 768, 64]
    - [9, 12433.6]
  - - [832, 1984, 1, 64, 832, 832, 832, 64]
    - [0, 13507.7]
  - - [896, 1984, 1, 64, 896, 896, 896, 64]
    - [0, 13986.9]
  - - [960, 1984, 1, 64, 960, 960, 960, 64]
    - [0, 14566.9]
  - - [1024, 1984, 1, 64, 1024, 1024, 1024, 64]
    - [4, 13923.9]
  - - [1088, 1984, 1, 64, 1088, 1088, 1088, 64]
    - [0, 14991.6]
  - - [1152, 1984, 1, 64, 1152, 1152, 1152, 64]
    - [0, 15446.1]
  - - [1216, 1984, 1, 64, 1216, 1216, 1216, 64]
    - [0, 15891.5]
  - - [1280, 1984, 1, 64, 1280, 1280, 1280, 64]
    - [0, 16111.0]
  - - [1344, 1984, 1, 64, 1344, 1344, 1344, 64]
    - [0, 16790.0]
  - - [1408, 1984, 1, 64, 1408, 1408, 1408, 64]
    - [0, 17039.7]
  - - [1472, 1984, 1, 64, 1472, 1472, 1472, 64]
    - [9, 17267.8]
  - - [1536, 1984, 1, 64, 1536, 1536, 1536, 64]
    - [0, 16556.3]
  - - [1600, 1984, 1, 64, 1600, 1600, 1600, 64]
    - [0, 17877.5]
  - - [1664, 1984, 1, 64, 1664, 1664, 1664, 64]
    - [0, 18255.2]
  - - [1728, 1984, 1, 64, 1728, 1728, 1728, 64]
    - [0, 18368.6]
  - - [1792, 1984, 1, 64, 1792, 1792, 1792, 64]
    - [0, 18472.1]
  - - [1856, 1984, 1, 64, 1856, 1856, 1856, 64]
    - [0, 18784.1]
  - - [1920, 1984, 1, 64, 1920, 1920, 1920, 64]
    - [9, 18972.1]
  - - [1984, 1984, 1, 64, 1984, 1984, 1984, 64]
    - [3, 19112.2]
  - - [2048, 1984, 1, 64, 2048, 2048, 2048, 64]
    - [1, 18397.2]
  - - [2112, 1984, 1, 64, 2112, 2112, 2112, 64]
    - [3, 19749.0]
  - - [2176, 1984, 1, 64, 2176, 2176, 2176, 64]
    - [3, 20091.4]
  - - [2240, 1984, 1, 64, 2240, 2240, 2240, 64]
    - [3, 20052.3]
  - - [2304, 1984, 1, 64, 2304, 2304, 2304, 64]
    - [0, 20310.3]
  - - [2368, 1984, 1, 64, 2368, 2368, 2368, 64]
    - [3, 20802.3]
  - - [2432, 1984, 1, 64, 2432, 2432, 2432, 64]
    - [3, 21146.5]
  - - [2496, 1984, 1, 64, 2496, 2496, 2496, 64]
    - [3, 21464.9]
  - - [2560, 1984, 1, 64, 2560, 2560, 2560, 64]
    - [0, 20664.7]
  - - [2624, 1984, 1, 64, 2624, 2624, 2624, 64]
    - [3, 21934.3]
  - - [2688, 1984, 1, 64, 2688, 2688, 2688, 64]
    - [3, 21899.8]
  - - [2752, 1984, 1, 64, 2752, 2752, 2752, 64]
    - [3, 22251.3]
  - - [2816, 1984, 1, 64, 2816, 2816, 2816, 64]
    - [0, 22258.5]
  - - [2880, 1984, 1, 64, 2880, 2880, 2880, 64]
    - [3, 22595.6]
  - - [2944, 1984, 1, 64, 2944, 2944, 2944, 64]
    - [3, 22593.8]
  - - [3008, 1984, 1, 64, 3008, 3008, 3008, 64]
    - [3, 23093.3]
  - - [3072, 1984, 1, 64, 3072, 3072, 3072, 64]
    - [0, 21535.2]
  - - [3136, 1984, 1, 64, 3136, 3136, 3136, 64]
    - [3, 23140.0]
  - - [3200, 1984, 1, 64, 3200, 3200, 3200, 64]
    - [3, 23519.3]
  - - [3264, 1984, 1, 64, 3264, 3264, 3264, 64]
    - [3, 23513.2]
  - - [3328, 1984, 1, 64, 3328, 3328, 3328, 64]
    - [3, 23404.6]
  - - [3392, 1984, 1, 64, 3392, 3392, 3392, 64]
    - [0, 23877.3]
  - - [3456, 1984, 1, 64, 3456, 3456, 3456, 64]
    - [3, 24087.4]
  - - [3520, 1984, 1, 64, 3520, 3520, 3520, 64]
    - [0, 24197.5]
  - - [3584, 1984, 1, 64, 3584, 3584, 3584, 64]
    - [0, 23419.0]
  - - [3648, 1984, 1, 64, 3648, 3648, 3648, 64]
    - [0, 24365.1]
  - - [3712, 1984, 1, 64, 3712, 3712, 3712, 64]
    - [3, 24295.4]
  - - [3776, 1984, 1, 64, 3776, 3776, 3776, 64]
    - [0, 23494.7]
  - - [3840, 1984, 1, 64, 3840, 3840, 3840, 64]
    - [3, 24317.1]
  - - [3904, 1984, 1, 64, 3904, 3904, 3904, 64]
    - [3, 24739.7]
  - - [3968, 1984, 1, 64, 3968, 3968, 3968, 64]
    - [0, 24823.2]
  - - [4032, 1984, 1, 64, 4032, 4032, 4032, 64]
    - [0, 24630.1]
  - - [4096, 1984, 1, 64, 4096, 4096, 4096, 64]
    - [0, 23198.5]
  - - [64, 2048, 1, 64, 64, 64, 64, 64]
    - [18, 1673.02]
  - - [128, 2048, 1, 64, 128, 128, 128, 64]
    - [0, 3267.85]
  - - [192, 2048, 1, 64, 192, 192, 192, 64]
    - [9, 4516.4]
  - - [256, 2048, 1, 64, 256, 256, 256, 64]
    - [6, 5636.44]
  - - [320, 2048, 1, 64, 320, 320, 320, 64]
    - [3, 6956.8]
  - - [384, 2048, 1, 64, 384, 384, 384, 64]
    - [4, 7849.51]
  - - [448, 2048, 1, 64, 448, 448, 448, 64]
    - [0, 9197.93]
  - - [512, 2048, 1, 64, 512, 512, 512, 64]
    - [4, 9626.79]
  - - [576, 2048, 1, 64, 576, 576, 576, 64]
    - [0, 10609.4]
  - - [640, 2048, 1, 64, 640, 640, 640, 64]
    - [0, 11554.5]
  - - [704, 2048, 1, 64, 704, 704, 704, 64]
    - [0, 12286.7]
  - - [768, 2048, 1, 64, 768, 768, 768, 64]
    - [0, 12557.6]
  - - [832, 2048, 1, 64, 832, 832, 832, 64]
    - [0, 13701.5]
  - - [896, 2048, 1, 64, 896, 896, 896, 64]
    - [0, 14267.9]
  - - [960, 2048, 1, 64, 960, 960, 960, 64]
    - [0, 14806.7]
  - - [1024, 2048, 1, 64, 1024, 1024, 1024, 64]
    - [3, 14141.4]
  - - [1088, 2048, 1, 64, 1088, 1088, 1088, 64]
    - [0, 15340.4]
  - - [1152, 2048, 1, 64, 1152, 1152, 1152, 64]
    - [9, 15648.6]
  - - [1216, 2048, 1, 64, 1216, 1216, 1216, 64]
    - [0, 16136.7]
  - - [1280, 2048, 1, 64, 1280, 1280, 1280, 64]
    - [0, 16272.6]
  - - [1344, 2048, 1, 64, 1344, 1344, 1344, 64]
    - [0, 16972.6]
  - - [1408, 2048, 1, 64, 1408, 1408, 1408, 64]
    - [0, 17405.2]
  - - [1472, 2048, 1, 64, 1472, 1472, 1472, 64]
    - [9, 17314.6]
  - - [1536, 2048, 1, 64, 1536, 1536, 1536, 64]
    - [0, 16656.2]
  - - [1600, 2048, 1, 64, 1600, 1600, 1600, 64]
    - [0, 18094.3]
  - - [1664, 2048, 1, 64, 1664, 1664, 1664, 64]
    - [9, 18509.8]
  - - [1728, 2048, 1, 64, 1728, 1728, 1728, 64]
    - [0, 18685.8]
  - - [1792, 2048, 1, 64, 1792, 1792, 1792, 64]
    - [0, 18880.9]
  - - [1856, 2048, 1, 64, 1856, 1856, 1856, 64]
    - [0, 19060.4]
  - - [1920, 2048, 1, 64, 1920, 1920, 1920, 64]
    - [9, 19313.5]
  - - [1984, 2048, 1, 64, 1984, 1984, 1984, 64]
    - [3, 19602.3]
  - - [2048, 2048, 1, 64, 2048, 2048, 2048, 64]
    - [4, 18668.3]
  - - [2112, 2048, 1, 64, 2112, 2112, 2112, 64]
    - [3, 20017.4]
  - - [2176, 2048, 1, 64, 2176, 2176, 2176, 64]
    - [3, 20372.1]
  - - [2240, 2048, 1, 64, 2240, 2240, 2240, 64]
    - [3, 20393.0]
  - - [2304, 2048, 1, 64, 2304, 2304, 2304, 64]
    - [0, 20705.3]
  - - [2368, 2048, 1, 64, 2368, 2368, 2368, 64]
    - [3, 21359.5]
  - - [2432, 2048, 1, 64, 2432, 2432, 2432, 64]
    - [3, 21516.3]
  - - [2496, 2048, 1, 64, 2496, 2496, 2496, 64]
    - [3, 21746.3]
  - - [2560, 2048, 1, 64, 2560, 2560, 2560, 64]
    - [0, 21107.2]
  - - [2624, 2048, 1, 64, 2624, 2624, 2624, 64]
    - [3, 22082.1]
  - - [2688, 2048, 1, 64, 2688, 2688, 2688, 64]
    - [3, 22127.8]
  - - [2752, 2048, 1, 64, 2752, 2752, 2752, 64]
    - [3, 22450.1]
  - - [2816, 2048, 1, 64, 2816, 2816, 2816, 64]
    - [0, 22576.0]
  - - [2880, 2048, 1, 64, 2880, 2880, 2880, 64]
    - [3, 22938.9]
  - - [2944, 2048, 1, 64, 2944, 2944, 2944, 64]
    - [3, 22791.1]
  - - [3008, 2048, 1, 64, 3008, 3008, 3008, 64]
    - [3, 23049.3]
  - - [3072, 2048, 1, 64, 3072, 3072, 3072, 64]
    - [0, 21648.9]
  - - [3136, 2048, 1, 64, 3136, 3136, 3136, 64]
    - [3, 23433.0]
  - - [3200, 2048, 1, 64, 3200, 3200, 3200, 64]
    - [3, 23498.6]
  - - [3264, 2048, 1, 64, 3264, 3264, 3264, 64]
    - [3, 23629.6]
  - - [3328, 2048, 1, 64, 3328, 3328, 3328, 64]
    - [0, 23572.1]
  - - [3392, 2048, 1, 64, 3392, 3392, 3392, 64]
    - [3, 24133.7]
  - - [3456, 2048, 1, 64, 3456, 3456, 3456, 64]
    - [3, 23895.2]
  - - [3520, 2048, 1, 64, 3520, 3520, 3520, 64]
    - [0, 24174.3]
  - - [3584, 2048, 1, 64, 3584, 3584, 3584, 64]
    - [0, 23660.5]
  - - [3648, 2048, 1, 64, 3648, 3648, 3648, 64]
    - [0, 24551.8]
  - - [3712, 2048, 1, 64, 3712, 3712, 3712, 64]
    - [3, 24462.4]
  - - [3776, 2048, 1, 64, 3776, 3776, 3776, 64]
    - [0, 23558.8]
  - - [3840, 2048, 1, 64, 3840, 3840, 3840, 64]
    - [0, 24244.4]
  - - [3904, 2048, 1, 64, 3904, 3904, 3904, 64]
    - [0, 24402.6]
  - - [3968, 2048, 1, 64, 3968, 3968, 3968, 64]
    - [3, 25129.9]
  - - [4032, 2048, 1, 64, 4032, 4032, 4032, 64]
    - [0, 25022.5]
  - - [4096, 2048, 1, 64, 4096, 4096, 4096, 64]
    - [0, 23504.4]
  - - [64, 2112, 1, 64, 64, 64, 64, 64]
    - [15, 1655.0]
  - - [128, 2112, 1, 64, 128, 128, 128, 64]
    - [18, 3180.95]
  - - [192, 2112, 1, 64, 192, 192, 192, 64]
    - [9, 4560.97]
  - - [256, 2112, 1, 64, 256, 256, 256, 64]
    - [0, 6014.67]
  - - [320, 2112, 1, 64, 320, 320, 320, 64]
    - [4, 7046.8]
  - - [384, 2112, 1, 64, 384, 384, 384, 64]
    - [0, 8143.07]
  - - [448, 2112, 1, 64, 448, 448, 448, 64]
    - [11, 9545.17]
  - - [512, 2112, 1, 64, 512, 512, 512, 64]
    - [4, 9820.53]
  - - [576, 2112, 1, 64, 576, 576, 576, 64]
    - [0, 10991.9]
  - - [640, 2112, 1, 64, 640, 640, 640, 64]
    - [0, 11790.4]
  - - [704, 2112, 1, 64, 704, 704, 704, 64]
    - [0, 12595.2]
  - - [768, 2112, 1, 64, 768, 768, 768, 64]
    - [0, 12800.0]
  - - [832, 2112, 1, 64, 832, 832, 832, 64]
    - [0, 13911.1]
  - - [896, 2112, 1, 64, 896, 896, 896, 64]
    - [0, 14511.0]
  - - [960, 2112, 1, 64, 960, 960, 960, 64]
    - [4, 14286.0]
  - - [1024, 2112, 1, 64, 1024, 1024, 1024, 64]
    - [4, 14447.9]
  - - [1088, 2112, 1, 64, 1088, 1088, 1088, 64]
    - [0, 15509.5]
  - - [1152, 2112, 1, 64, 1152, 1152, 1152, 64]
    - [9, 15986.8]
  - - [1216, 2112, 1, 64, 1216, 1216, 1216, 64]
    - [0, 16472.5]
  - - [1280, 2112, 1, 64, 1280, 1280, 1280, 64]
    - [9, 16469.7]
  - - [1344, 2112, 1, 64, 1344, 1344, 1344, 64]
    - [0, 17337.5]
  - - [1408, 2112, 1, 64, 1408, 1408, 1408, 64]
    - [3, 16984.8]
  - - [1472, 2112, 1, 64, 1472, 1472, 1472, 64]
    - [0, 17609.1]
  - - [1536, 2112, 1, 64, 1536, 1536, 1536, 64]
    - [0, 17049.7]
  - - [1600, 2112, 1, 64, 1600, 1600, 1600, 64]
    - [0, 18376.0]
  - - [1664, 2112, 1, 64, 1664, 1664, 1664, 64]
    - [0, 18801.1]
  - - [1728, 2112, 1, 64, 1728, 1728, 1728, 64]
    - [9, 18978.5]
  - - [1792, 2112, 1, 64, 1792, 1792, 1792, 64]
    - [0, 19191.7]
  - - [1856, 2112, 1, 64, 1856, 1856, 1856, 64]
    - [3, 19164.9]
  - - [1920, 2112, 1, 64, 1920, 1920, 1920, 64]
    - [3, 19394.6]
  - - [1984, 2112, 1, 64, 1984, 1984, 1984, 64]
    - [3, 19882.2]
  - - [2048, 2112, 1, 64, 2048, 2048, 2048, 64]
    - [1, 18904.6]
  - - [2112, 2112, 1, 64, 2112, 2112, 2112, 64]
    - [0, 20357.4]
  - - [2176, 2112, 1, 64, 2176, 2176, 2176, 64]
    - [3, 20672.1]
  - - [2240, 2112, 1, 64, 2240, 2240, 2240, 64]
    - [3, 20605.2]
  - - [2304, 2112, 1, 64, 2304, 2304, 2304, 64]
    - [0, 20905.1]
  - - [2368, 2112, 1, 64, 2368, 2368, 2368, 64]
    - [3, 21324.1]
  - - [2432, 2112, 1, 64, 2432, 2432, 2432, 64]
    - [3, 21721.0]
  - - [2496, 2112, 1, 64, 2496, 2496, 2496, 64]
    - [3, 22026.2]
  - - [2560, 2112, 1, 64, 2560, 2560, 2560, 64]
    - [0, 21363.6]
  - - [2624, 2112, 1, 64, 2624, 2624, 2624, 64]
    - [3, 22430.9]
  - - [2688, 2112, 1, 64, 2688, 2688, 2688, 64]
    - [3, 22349.0]
  - - [2752, 2112, 1, 64, 2752, 2752, 2752, 64]
    - [3, 22929.1]
  - - [2816, 2112, 1, 64, 2816, 2816, 2816, 64]
    - [0, 22577.1]
  - - [2880, 2112, 1, 64, 2880, 2880, 2880, 64]
    - [3, 23264.2]
  - - [2944, 2112, 1, 64, 2944, 2944, 2944, 64]
    - [3, 23178.5]
  - - [3008, 2112, 1, 64, 3008, 3008, 3008, 64]
    - [3, 23411.1]
  - - [3072, 2112, 1, 64, 3072, 3072, 3072, 64]
    - [0, 21903.9]
  - - [3136, 2112, 1, 64, 3136, 3136, 3136, 64]
    - [3, 23786.9]
  - - [3200, 2112, 1, 64, 3200, 3200, 3200, 64]
    - [3, 23753.7]
  - - [3264, 2112, 1, 64, 3264, 3264, 3264, 64]
    - [3, 24126.9]
  - - [3328, 2112, 1, 64, 3328, 3328, 3328, 64]
    - [0, 23866.4]
  - - [3392, 2112, 1, 64, 3392, 3392, 3392, 64]
    - [3, 24204.7]
  - - [3456, 2112, 1, 64, 3456, 3456, 3456, 64]
    - [0, 23912.7]
  - - [3520, 2112, 1, 64, 3520, 3520, 3520, 64]
    - [0, 24197.0]
  - - [3584, 2112, 1, 64, 3584, 3584, 3584, 64]
    - [0, 23554.0]
  - - [3648, 2112, 1, 64, 3648, 3648, 3648, 64]
    - [3, 23961.9]
  - - [3712, 2112, 1, 64, 3712, 3712, 3712, 64]
    - [0, 24146.3]
  - - [3776, 2112, 1, 64, 3776, 3776, 3776, 64]
    - [0, 23263.0]
  - - [3840, 2112, 1, 64, 3840, 3840, 3840, 64]
    - [0, 24340.6]
  - - [3904, 2112, 1, 64, 3904, 3904, 3904, 64]
    - [0, 25464.0]
  - - [3968, 2112, 1, 64, 3968, 3968, 3968, 64]
    - [0, 25032.2]
  - - [4032, 2112, 1, 64, 4032, 4032, 4032, 64]
    - [0, 26257.0]
  - - [4096, 2112, 1, 64, 4096, 4096, 4096, 64]
    - [1, 23025.3]
  - - [64, 2176, 1, 64, 64, 64, 64, 64]
    - [17, 1796.56]
  - - [128, 2176, 1, 64, 128, 128, 128, 64]
    - [1, 3259.39]
  - - [192, 2176, 1, 64, 192, 192, 192, 64]
    - [6, 4681.94]
  - - [256, 2176, 1, 64, 256, 256, 256, 64]
    - [7, 6060.05]
  - - [320, 2176, 1, 64, 320, 320, 320, 64]
    - [4, 7261.55]
  - - [384, 2176, 1, 64, 384, 384, 384, 64]
    - [0, 8199.47]
  - - [448, 2176, 1, 64, 448, 448, 448, 64]
    - [0, 9638.39]
  - - [512, 2176, 1, 64, 512, 512, 512, 64]
    - [4, 10076.7]
  - - [576, 2176, 1, 64, 576, 576, 576, 64]
    - [0, 11349.1]
  - - [640, 2176, 1, 64, 640, 640, 640, 64]
    - [9, 11976.4]
  - - [704, 2176, 1, 64, 704, 704, 704, 64]
    - [9, 12759.0]
  - - [768, 2176, 1, 64, 768, 768, 768, 64]
    - [0, 13126.4]
  - - [832, 2176, 1, 64, 832, 832, 832, 64]
    - [0, 14142.1]
  - - [896, 2176, 1, 64, 896, 896, 896, 64]
    - [9, 14700.7]
  - - [960, 2176, 1, 64, 960, 960, 960, 64]
    - [0, 14620.7]
  - - [1024, 2176, 1, 64, 1024, 1024, 1024, 64]
    - [4, 14648.6]
  - - [1088, 2176, 1, 64, 1088, 1088, 1088, 64]
    - [0, 15704.5]
  - - [1152, 2176, 1, 64, 1152, 1152, 1152, 64]
    - [0, 16280.7]
  - - [1216, 2176, 1, 64, 1216, 1216, 1216, 64]
    - [0, 16646.3]
  - - [1280, 2176, 1, 64, 1280, 1280, 1280, 64]
    - [0, 16645.5]
  - - [1344, 2176, 1, 64, 1344, 1344, 1344, 64]
    - [0, 17640.8]
  - - [1408, 2176, 1, 64, 1408, 1408, 1408, 64]
    - [3, 17256.1]
  - - [1472, 2176, 1, 64, 1472, 1472, 1472, 64]
    - [0, 17903.4]
  - - [1536, 2176, 1, 64, 1536, 1536, 1536, 64]
    - [0, 17203.4]
  - - [1600, 2176, 1, 64, 1600, 1600, 1600, 64]
    - [0, 18691.4]
  - - [1664, 2176, 1, 64, 1664, 1664, 1664, 64]
    - [0, 19075.9]
  - - [1728, 2176, 1, 64, 1728, 1728, 1728, 64]
    - [0, 19355.4]
  - - [1792, 2176, 1, 64, 1792, 1792, 1792, 64]
    - [0, 19401.2]
  - - [1856, 2176, 1, 64, 1856, 1856, 1856, 64]
    - [3, 19375.6]
  - - [1920, 2176, 1, 64, 1920, 1920, 1920, 64]
    - [3, 19701.2]
  - - [1984, 2176, 1, 64, 1984, 1984, 1984, 64]
    - [3, 19989.6]
  - - [2048, 2176, 1, 64, 2048, 2048, 2048, 64]
    - [1, 19144.2]
  - - [2112, 2176, 1, 64, 2112, 2112, 2112, 64]
    - [3, 20660.5]
  - - [2176, 2176, 1, 64, 2176, 2176, 2176, 64]
    - [3, 20903.3]
  - - [2240, 2176, 1, 64, 2240, 2240, 2240, 64]
    - [3, 20854.9]
  - - [2304, 2176, 1, 64, 2304, 2304, 2304, 64]
    - [3, 20950.8]
  - - [2368, 2176, 1, 64, 2368, 2368, 2368, 64]
    - [3, 21545.4]
  - - [2432, 2176, 1, 64, 2432, 2432, 2432, 64]
    - [3, 21886.0]
  - - [2496, 2176, 1, 64, 2496, 2496, 2496, 64]
    - [3, 22339.3]
  - - [2560, 2176, 1, 64, 2560, 2560, 2560, 64]
    - [0, 21548.0]
  - - [2624, 2176, 1, 64, 2624, 2624, 2624, 64]
    - [3, 22649.4]
  - - [2688, 2176, 1, 64, 2688, 2688, 2688, 64]
    - [3, 22534.2]
  - - [2752, 2176, 1, 64, 2752, 2752, 2752, 64]
    - [3, 23083.1]
  - - [2816, 2176, 1, 64, 2816, 2816, 2816, 64]
    - [0, 22901.4]
  - - [2880, 2176, 1, 64, 2880, 2880, 2880, 64]
    - [3, 23344.1]
  - - [2944, 2176, 1, 64, 2944, 2944, 2944, 64]
    - [3, 23526.1]
  - - [3008, 2176, 1, 64, 3008, 3008, 3008, 64]
    - [3, 23260.7]
  - - [3072, 2176, 1, 64, 3072, 3072, 3072, 64]
    - [0, 21878.6]
  - - [3136, 2176, 1, 64, 3136, 3136, 3136, 64]
    - [3, 23931.6]
  - - [3200, 2176, 1, 64, 3200, 3200, 3200, 64]
    - [3, 23982.3]
  - - [3264, 2176, 1, 64, 3264, 3264, 3264, 64]
    - [3, 24079.7]
  - - [3328, 2176, 1, 64, 3328, 3328, 3328, 64]
    - [0, 23545.2]
  - - [3392, 2176, 1, 64, 3392, 3392, 3392, 64]
    - [3, 24146.6]
  - - [3456, 2176, 1, 64, 3456, 3456, 3456, 64]
    - [0, 23981.8]
  - - [3520, 2176, 1, 64, 3520, 3520, 3520, 64]
    - [3, 24597.4]
  - - [3584, 2176, 1, 64, 3584, 3584, 3584, 64]
    - [3, 23518.9]
  - - [3648, 2176, 1, 64, 3648, 3648, 3648, 64]
    - [0, 24391.6]
  - - [3712, 2176, 1, 64, 3712, 3712, 3712, 64]
    - [0, 25760.7]
  - - [3776, 2176, 1, 64, 3776, 3776, 3776, 64]
    - [0, 23569.3]
  - - [3840, 2176, 1, 64, 3840, 3840, 3840, 64]
    - [3, 23766.3]
  - - [3904, 2176, 1, 64, 3904, 3904, 3904, 64]
    - [0, 26224.1]
  - - [3968, 2176, 1, 64, 3968, 3968, 3968, 64]
    - [0, 25699.6]
  - - [4032, 2176, 1, 64, 4032, 4032, 4032, 64]
    - [0, 26671.1]
  - - [4096, 2176, 1, 64, 4096, 4096, 4096, 64]
    - [0, 23529.2]
  - - [64, 2240, 1, 64, 64, 64, 64, 64]
    - [15, 1941.77]
  - - [128, 2240, 1, 64, 128, 128, 128, 64]
    - [4, 3574.87]
  - - [192, 2240, 1, 64, 192, 192, 192, 64]
    - [3, 4929.28]
  - - [256, 2240, 1, 64, 256, 256, 256, 64]
    - [4, 6286.37]
  - - [320, 2240, 1, 64, 320, 320, 320, 64]
    - [4, 7494.63]
  - - [384, 2240, 1, 64, 384, 384, 384, 64]
    - [11, 8554.65]
  - - [448, 2240, 1, 64, 448, 448, 448, 64]
    - [9, 9510.49]
  - - [512, 2240, 1, 64, 512, 512, 512, 64]
    - [4, 10231.4]
  - - [576, 2240, 1, 64, 576, 576, 576, 64]
    - [0, 11654.8]
  - - [640, 2240, 1, 64, 640, 640, 640, 64]
    - [0, 12220.3]
  - - [704, 2240, 1, 64, 704, 704, 704, 64]
    - [0, 12950.7]
  - - [768, 2240, 1, 64, 768, 768, 768, 64]
    - [0, 13340.5]
  - - [832, 2240, 1, 64, 832, 832, 832, 64]
    - [0, 14427.7]
  - - [896, 2240, 1, 64, 896, 896, 896, 64]
    - [4, 14259.4]
  - - [960, 2240, 1, 64, 960, 960, 960, 64]
    - [0, 14815.9]
  - - [1024, 2240, 1, 64, 1024, 1024, 1024, 64]
    - [4, 14817.7]
  - - [1088, 2240, 1, 64, 1088, 1088, 1088, 64]
    - [0, 16038.4]
  - - [1152, 2240, 1, 64, 1152, 1152, 1152, 64]
    - [0, 16462.2]
  - - [1216, 2240, 1, 64, 1216, 1216, 1216, 64]
    - [0, 16815.4]
  - - [1280, 2240, 1, 64, 1280, 1280, 1280, 64]
    - [0, 17036.4]
  - - [1344, 2240, 1, 64, 1344, 1344, 1344, 64]
    - [3, 17274.0]
  - - [1408, 2240, 1, 64, 1408, 1408, 1408, 64]
    - [3, 17438.4]
  - - [1472, 2240, 1, 64, 1472, 1472, 1472, 64]
    - [9, 18187.0]
  - - [1536, 2240, 1, 64, 1536, 1536, 1536, 64]
    - [0, 17447.0]
  - - [1600, 2240, 1, 64, 1600, 1600, 1600, 64]
    - [0, 18895.6]
  - - [1664, 2240, 1, 64, 1664, 1664, 1664, 64]
    - [9, 19398.9]
  - - [1728, 2240, 1, 64, 1728, 1728, 1728, 64]
    - [9, 19621.6]
  - - [1792, 2240, 1, 64, 1792, 1792, 1792, 64]
    - [0, 19403.2]
  - - [1856, 2240, 1, 64, 1856, 1856, 1856, 64]
    - [3, 19664.0]
  - - [1920, 2240, 1, 64, 1920, 1920, 1920, 64]
    - [3, 19748.1]
  - - [1984, 2240, 1, 64, 1984, 1984, 1984, 64]
    - [3, 20196.2]
  - - [2048, 2240, 1, 64, 2048, 2048, 2048, 64]
    - [1, 19291.6]
  - - [2112, 2240, 1, 64, 2112, 2112, 2112, 64]
    - [0, 20696.7]
  - - [2176, 2240, 1, 64, 2176, 2176, 2176, 64]
    - [0, 21040.6]
  - - [2240, 2240, 1, 64, 2240, 2240, 2240, 64]
    - [3, 20954.2]
  - - [2304, 2240, 1, 64, 2304, 2304, 2304, 64]
    - [0, 21066.3]
  - - [2368, 2240, 1, 64, 2368, 2368, 2368, 64]
    - [3, 21734.7]
  - - [2432, 2240, 1, 64, 2432, 2432, 2432, 64]
    - [3, 22032.8]
  - - [2496, 2240, 1, 64, 2496, 2496, 2496, 64]
    - [3, 22375.1]
  - - [2560, 2240, 1, 64, 2560, 2560, 2560, 64]
    - [0, 21846.4]
  - - [2624, 2240, 1, 64, 2624, 2624, 2624, 64]
    - [3, 22659.5]
  - - [2688, 2240, 1, 64, 2688, 2688, 2688, 64]
    - [3, 22718.3]
  - - [2752, 2240, 1, 64, 2752, 2752, 2752, 64]
    - [3, 23238.7]
  - - [2816, 2240, 1, 64, 2816, 2816, 2816, 64]
    - [3, 22984.4]
  - - [2880, 2240, 1, 64, 2880, 2880, 2880, 64]
    - [3, 23477.4]
  - - [2944, 2240, 1, 64, 2944, 2944, 2944, 64]
    - [3, 23406.8]
  - - [3008, 2240, 1, 64, 3008, 3008, 3008, 64]
    - [3, 23485.8]
  - - [3072, 2240, 1, 64, 3072, 3072, 3072, 64]
    - [0, 22121.6]
  - - [3136, 2240, 1, 64, 3136, 3136, 3136, 64]
    - [0, 23173.8]
  - - [3200, 2240, 1, 64, 3200, 3200, 3200, 64]
    - [3, 23890.5]
  - - [3264, 2240, 1, 64, 3264, 3264, 3264, 64]
    - [0, 23879.7]
  - - [3328, 2240, 1, 64, 3328, 3328, 3328, 64]
    - [0, 23891.8]
  - - [3392, 2240, 1, 64, 3392, 3392, 3392, 64]
    - [0, 24251.7]
  - - [3456, 2240, 1, 64, 3456, 3456, 3456, 64]
    - [0, 24662.6]
  - - [3520, 2240, 1, 64, 3520, 3520, 3520, 64]
    - [0, 24548.7]
  - - [3584, 2240, 1, 64, 3584, 3584, 3584, 64]
    - [0, 23801.1]
  - - [3648, 2240, 1, 64, 3648, 3648, 3648, 64]
    - [0, 25668.7]
  - - [3712, 2240, 1, 64, 3712, 3712, 3712, 64]
    - [0, 25381.5]
  - - [3776, 2240, 1, 64, 3776, 3776, 3776, 64]
    - [0, 24194.2]
  - - [3840, 2240, 1, 64, 3840, 3840, 3840, 64]
    - [3, 23777.4]
  - - [3904, 2240, 1, 64, 3904, 3904, 3904, 64]
    - [0, 25641.2]
  - - [3968, 2240, 1, 64, 3968, 3968, 3968, 64]
    - [0, 26255.3]
  - - [4032, 2240, 1, 64, 4032, 4032, 4032, 64]
    - [0, 26897.2]
  - - [4096, 2240, 1, 64, 4096, 4096, 4096, 64]
    - [1, 23347.8]
  - - [64, 2304, 1, 64, 64, 64, 64, 64]
    - [7, 1981.34]
  - - [128, 2304, 1, 64, 128, 128, 128, 64]
    - [4, 3537.13]
  - - [192, 2304, 1, 64, 192, 192, 192, 64]
    - [6, 4983.48]
  - - [256, 2304, 1, 64, 256, 256, 256, 64]
    - [4, 6358.19]
  - - [320, 2304, 1, 64, 320, 320, 320, 64]
    - [4, 7614.19]
  - - [384, 2304, 1, 64, 384, 384, 384, 64]
    - [4, 8791.01]
  - - [448, 2304, 1, 64, 448, 448, 448, 64]
    - [4, 9679.06]
  - - [512, 2304, 1, 64, 512, 512, 512, 64]
    - [4, 10397.6]
  - - [576, 2304, 1, 64, 576, 576, 576, 64]
    - [0, 11865.5]
  - - [640, 2304, 1, 64, 640, 640, 640, 64]
    - [9, 12379.7]
  - - [704, 2304, 1, 64, 704, 704, 704, 64]
    - [0, 13372.2]
  - - [768, 2304, 1, 64, 768, 768, 768, 64]
    - [0, 13630.9]
  - - [832, 2304, 1, 64, 832, 832, 832, 64]
    - [0, 14648.6]
  - - [896, 2304, 1, 64, 896, 896, 896, 64]
    - [9, 14505.8]
  - - [960, 2304, 1, 64, 960, 960, 960, 64]
    - [0, 15214.5]
  - - [1024, 2304, 1, 64, 1024, 1024, 1024, 64]
    - [4, 14963.1]
  - - [1088, 2304, 1, 64, 1088, 1088, 1088, 64]
    - [0, 16259.3]
  - - [1152, 2304, 1, 64, 1152, 1152, 1152, 64]
    - [0, 16663.4]
  - - [1216, 2304, 1, 64, 1216, 1216, 1216, 64]
    - [0, 17092.9]
  - - [1280, 2304, 1, 64, 1280, 1280, 1280, 64]
    - [0, 17401.9]
  - - [1344, 2304, 1, 64, 1344, 1344, 1344, 64]
    - [3, 17523.9]
  - - [1408, 2304, 1, 64, 1408, 1408, 1408, 64]
    - [0, 17827.2]
  - - [1472, 2304, 1, 64, 1472, 1472, 1472, 64]
    - [9, 18389.6]
  - - [1536, 2304, 1, 64, 1536, 1536, 1536, 64]
    - [0, 17657.3]
  - - [1600, 2304, 1, 64, 1600, 1600, 1600, 64]
    - [0, 19162.4]
  - - [1664, 2304, 1, 64, 1664, 1664, 1664, 64]
    - [0, 19613.4]
  - - [1728, 2304, 1, 64, 1728, 1728, 1728, 64]
    - [0, 19444.6]
  - - [1792, 2304, 1, 64, 1792, 1792, 1792, 64]
    - [3, 19632.9]
  - - [1856, 2304, 1, 64, 1856, 1856, 1856, 64]
    - [3, 19721.6]
  - - [1920, 2304, 1, 64, 1920, 1920, 1920, 64]
    - [3, 19927.6]
  - - [1984, 2304, 1, 64, 1984, 1984, 1984, 64]
    - [3, 20385.3]
  - - [2048, 2304, 1, 64, 2048, 2048, 2048, 64]
    - [1, 19359.3]
  - - [2112, 2304, 1, 64, 2112, 2112, 2112, 64]
    - [0, 21086.3]
  - - [2176, 2304, 1, 64, 2176, 2176, 2176, 64]
    - [3, 21139.9]
  - - [2240, 2304, 1, 64, 2240, 2240, 2240, 64]
    - [3, 20985.9]
  - - [2304, 2304, 1, 64, 2304, 2304, 2304, 64]
    - [0, 21194.9]
  - - [2368, 2304, 1, 64, 2368, 2368, 2368, 64]
    - [3, 21824.6]
  - - [2432, 2304, 1, 64, 2432, 2432, 2432, 64]
    - [3, 22162.3]
  - - [2496, 2304, 1, 64, 2496, 2496, 2496, 64]
    - [3, 22398.2]
  - - [2560, 2304, 1, 64, 2560, 2560, 2560, 64]
    - [0, 21612.4]
  - - [2624, 2304, 1, 64, 2624, 2624, 2624, 64]
    - [3, 22707.8]
  - - [2688, 2304, 1, 64, 2688, 2688, 2688, 64]
    - [3, 22734.7]
  - - [2752, 2304, 1, 64, 2752, 2752, 2752, 64]
    - [3, 23318.8]
  - - [2816, 2304, 1, 64, 2816, 2816, 2816, 64]
    - [0, 23229.8]
  - - [2880, 2304, 1, 64, 2880, 2880, 2880, 64]
    - [3, 23417.1]
  - - [2944, 2304, 1, 64, 2944, 2944, 2944, 64]
    - [3, 23540.2]
  - - [3008, 2304, 1, 64, 3008, 3008, 3008, 64]
    - [0, 23236.7]
  - - [3072, 2304, 1, 64, 3072, 3072, 3072, 64]
    - [0, 21722.5]
  - - [3136, 2304, 1, 64, 3136, 3136, 3136, 64]
    - [0, 23645.8]
  - - [3200, 2304, 1, 64, 3200, 3200, 3200, 64]
    - [3, 24233.6]
  - - [3264, 2304, 1, 64, 3264, 3264, 3264, 64]
    - [3, 24280.6]
  - - [3328, 2304, 1, 64, 3328, 3328, 3328, 64]
    - [3, 24234.7]
  - - [3392, 2304, 1, 64, 3392, 3392, 3392, 64]
    - [0, 25696.9]
  - - [3456, 2304, 1, 64, 3456, 3456, 3456, 64]
    - [0, 24945.1]
  - - [3520, 2304, 1, 64, 3520, 3520, 3520, 64]
    - [0, 24572.3]
  - - [3584, 2304, 1, 64, 3584, 3584, 3584, 64]
    - [0, 24194.3]
  - - [3648, 2304, 1, 64, 3648, 3648, 3648, 64]
    - [0, 25288.6]
  - - [3712, 2304, 1, 64, 3712, 3712, 3712, 64]
    - [0, 25426.3]
  - - [3776, 2304, 1, 64, 3776, 3776, 3776, 64]
    - [0, 24026.3]
  - - [3840, 2304, 1, 64, 3840, 3840, 3840, 64]
    - [0, 24863.8]
  - - [3904, 2304, 1, 64, 3904, 3904, 3904, 64]
    - [0, 25952.9]
  - - [3968, 2304, 1, 64, 3968, 3968, 3968, 64]
    - [0, 25430.2]
  - - [4032, 2304, 1, 64, 4032, 4032, 4032, 64]
    - [0, 26401.5]
  - - [4096, 2304, 1, 64, 4096, 4096, 4096, 64]
    - [0, 23823.5]
  - - [64, 2368, 1, 64, 64, 64, 64, 64]
    - [1, 1870.99]
  - - [128, 2368, 1, 64, 128, 128, 128, 64]
    - [5, 3590.3]
  - - [192, 2368, 1, 64, 192, 192, 192, 64]
    - [4, 5257.99]
  - - [256, 2368, 1, 64, 256, 256, 256, 64]
    - [4, 6504.08]
  - - [320, 2368, 1, 64, 320, 320, 320, 64]
    - [4, 7808.09]
  - - [384, 2368, 1, 64, 384, 384, 384, 64]
    - [9, 9256.48]
  - - [448, 2368, 1, 64, 448, 448, 448, 64]
    - [4, 9836.98]
  - - [512, 2368, 1, 64, 512, 512, 512, 64]
    - [4, 10593.0]
  - - [576, 2368, 1, 64, 576, 576, 576, 64]
    - [0, 12145.9]
  - - [640, 2368, 1, 64, 640, 640, 640, 64]
    - [9, 12693.6]
  - - [704, 2368, 1, 64, 704, 704, 704, 64]
    - [0, 13582.6]
  - - [768, 2368, 1, 64, 768, 768, 768, 64]
    - [0, 13837.9]
  - - [832, 2368, 1, 64, 832, 832, 832, 64]
    - [4, 14093.0]
  - - [896, 2368, 1, 64, 896, 896, 896, 64]
    - [9, 14775.7]
  - - [960, 2368, 1, 64, 960, 960, 960, 64]
    - [0, 15234.4]
  - - [1024, 2368, 1, 64, 1024, 1024, 1024, 64]
    - [4, 15144.6]
  - - [1088, 2368, 1, 64, 1088, 1088, 1088, 64]
    - [0, 16470.5]
  - - [1152, 2368, 1, 64, 1152, 1152, 1152, 64]
    - [9, 16956.7]
  - - [1216, 2368, 1, 64, 1216, 1216, 1216, 64]
    - [0, 17504.2]
  - - [1280, 2368, 1, 64, 1280, 1280, 1280, 64]
    - [3, 17278.4]
  - - [1344, 2368, 1, 64, 1344, 1344, 1344, 64]
    - [0, 17693.2]
  - - [1408, 2368, 1, 64, 1408, 1408, 1408, 64]
    - [0, 17996.4]
  - - [1472, 2368, 1, 64, 1472, 1472, 1472, 64]
    - [9, 18570.1]
  - - [1536, 2368, 1, 64, 1536, 1536, 1536, 64]
    - [0, 18035.2]
  - - [1600, 2368, 1, 64, 1600, 1600, 1600, 64]
    - [0, 19421.8]
  - - [1664, 2368, 1, 64, 1664, 1664, 1664, 64]
    - [0, 19373.1]
  - - [1728, 2368, 1, 64, 1728, 1728, 1728, 64]
    - [3, 19590.0]
  - - [1792, 2368, 1, 64, 1792, 1792, 1792, 64]
    - [0, 19752.5]
  - - [1856, 2368, 1, 64, 1856, 1856, 1856, 64]
    - [0, 19883.9]
  - - [1920, 2368, 1, 64, 1920, 1920, 1920, 64]
    - [3, 20109.0]
  - - [1984, 2368, 1, 64, 1984, 1984, 1984, 64]
    - [3, 20429.1]
  - - [2048, 2368, 1, 64, 2048, 2048, 2048, 64]
    - [1, 19588.2]
  - - [2112, 2368, 1, 64, 2112, 2112, 2112, 64]
    - [3, 20958.2]
  - - [2176, 2368, 1, 64, 2176, 2176, 2176, 64]
    - [3, 21204.6]
  - - [2240, 2368, 1, 64, 2240, 2240, 2240, 64]
    - [3, 21294.3]
  - - [2304, 2368, 1, 64, 2304, 2304, 2304, 64]
    - [0, 21323.5]
  - - [2368, 2368, 1, 64, 2368, 2368, 2368, 64]
    - [3, 22157.9]
  - - [2432, 2368, 1, 64, 2432, 2432, 2432, 64]
    - [3, 22329.5]
  - - [2496, 2368, 1, 64, 2496, 2496, 2496, 64]
    - [3, 22563.1]
  - - [2560, 2368, 1, 64, 2560, 2560, 2560, 64]
    - [0, 21847.5]
  - - [2624, 2368, 1, 64, 2624, 2624, 2624, 64]
    - [3, 23013.1]
  - - [2688, 2368, 1, 64, 2688, 2688, 2688, 64]
    - [3, 22963.1]
  - - [2752, 2368, 1, 64, 2752, 2752, 2752, 64]
    - [3, 23323.2]
  - - [2816, 2368, 1, 64, 2816, 2816, 2816, 64]
    - [0, 23277.2]
  - - [2880, 2368, 1, 64, 2880, 2880, 2880, 64]
    - [3, 23836.2]
  - - [2944, 2368, 1, 64, 2944, 2944, 2944, 64]
    - [3, 23624.1]
  - - [3008, 2368, 1, 64, 3008, 3008, 3008, 64]
    - [3, 23634.5]
  - - [3072, 2368, 1, 64, 3072, 3072, 3072, 64]
    - [0, 22541.0]
  - - [3136, 2368, 1, 64, 3136, 3136, 3136, 64]
    - [0, 23908.9]
  - - [3200, 2368, 1, 64, 3200, 3200, 3200, 64]
    - [3, 23735.3]
  - - [3264, 2368, 1, 64, 3264, 3264, 3264, 64]
    - [0, 24335.2]
  - - [3328, 2368, 1, 64, 3328, 3328, 3328, 64]
    - [0, 24871.0]
  - - [3392, 2368, 1, 64, 3392, 3392, 3392, 64]
    - [0, 24575.0]
  - - [3456, 2368, 1, 64, 3456, 3456, 3456, 64]
    - [0, 24646.2]
  - - [3520, 2368, 1, 64, 3520, 3520, 3520, 64]
    - [0, 25961.5]
  - - [3584, 2368, 1, 64, 3584, 3584, 3584, 64]
    - [0, 24595.1]
  - - [3648, 2368, 1, 64, 3648, 3648, 3648, 64]
    - [0, 26121.2]
  - - [3712, 2368, 1, 64, 3712, 3712, 3712, 64]
    - [0, 26053.8]
  - - [3776, 2368, 1, 64, 3776, 3776, 3776, 64]
    - [0, 24021.0]
  - - [3840, 2368, 1, 64, 3840, 3840, 3840, 64]
    - [0, 25786.7]
  - - [3904, 2368, 1, 64, 3904, 3904, 3904, 64]
    - [0, 27161.2]
  - - [3968, 2368, 1, 64, 3968, 3968, 3968, 64]
    - [9, 25091.9]
  - - [4032, 2368, 1, 64, 4032, 4032, 4032, 64]
    - [0, 27369.4]
  - - [4096, 2368, 1, 64, 4096, 4096, 4096, 64]
    - [0, 23603.5]
  - - [64, 2432, 1, 64, 64, 64, 64, 64]
    - [5, 1920.08]
  - - [128, 2432, 1, 64, 128, 128, 128, 64]
    - [14, 3732.25]
  - - [192, 2432, 1, 64, 192, 192, 192, 64]
    - [7, 5271.46]
  - - [256, 2432, 1, 64, 256, 256, 256, 64]
    - [4, 6776.43]
  - - [320, 2432, 1, 64, 320, 320, 320, 64]
    - [1, 8067.21]
  - - [384, 2432, 1, 64, 384, 384, 384, 64]
    - [11, 9199.38]
  - - [448, 2432, 1, 64, 448, 448, 448, 64]
    - [4, 10010.0]
  - - [512, 2432, 1, 64, 512, 512, 512, 64]
    - [4, 10769.1]
  - - [576, 2432, 1, 64, 576, 576, 576, 64]
    - [0, 12264.4]
  - - [640, 2432, 1, 64, 640, 640, 640, 64]
    - [9, 12893.3]
  - - [704, 2432, 1, 64, 704, 704, 704, 64]
    - [0, 13741.5]
  - - [768, 2432, 1, 64, 768, 768, 768, 64]
    - [0, 13899.6]
  - - [832, 2432, 1, 64, 832, 832, 832, 64]
    - [0, 14321.8]
  - - [896, 2432, 1, 64, 896, 896, 896, 64]
    - [0, 15024.7]
  - - [960, 2432, 1, 64, 960, 960, 960, 64]
    - [0, 15453.6]
  - - [1024, 2432, 1, 64, 1024, 1024, 1024, 64]
    - [4, 15375.5]
  - - [1088, 2432, 1, 64, 1088, 1088, 1088, 64]
    - [0, 16715.3]
  - - [1152, 2432, 1, 64, 1152, 1152, 1152, 64]
    - [0, 17088.0]
  - - [1216, 2432, 1, 64, 1216, 1216, 1216, 64]
    - [3, 17176.3]
  - - [1280, 2432, 1, 64, 1280, 1280, 1280, 64]
    - [3, 17539.2]
  - - [1344, 2432, 1, 64, 1344, 1344, 1344, 64]
    - [0, 17993.2]
  - - [1408, 2432, 1, 64, 1408, 1408, 1408, 64]
    - [9, 18140.1]
  - - [1472, 2432, 1, 64, 1472, 1472, 1472, 64]
    - [0, 18649.7]
  - - [1536, 2432, 1, 64, 1536, 1536, 1536, 64]
    - [0, 18186.0]
  - - [1600, 2432, 1, 64, 1600, 1600, 1600, 64]
    - [0, 19674.0]
  - - [1664, 2432, 1, 64, 1664, 1664, 1664, 64]
    - [0, 19483.6]
  - - [1728, 2432, 1, 64, 1728, 1728, 1728, 64]
    - [0, 19783.6]
  - - [1792, 2432, 1, 64, 1792, 1792, 1792, 64]
    - [0, 19909.9]
  - - [1856, 2432, 1, 64, 1856, 1856, 1856, 64]
    - [0, 20140.8]
  - - [1920, 2432, 1, 64, 1920, 1920, 1920, 64]
    - [3, 20185.2]
  - - [1984, 2432, 1, 64, 1984, 1984, 1984, 64]
    - [3, 20744.5]
  - - [2048, 2432, 1, 64, 2048, 2048, 2048, 64]
    - [1, 19889.2]
  - - [2112, 2432, 1, 64, 2112, 2112, 2112, 64]
    - [3, 21086.9]
  - - [2176, 2432, 1, 64, 2176, 2176, 2176, 64]
    - [3, 21475.3]
  - - [2240, 2432, 1, 64, 2240, 2240, 2240, 64]
    - [3, 21410.5]
  - - [2304, 2432, 1, 64, 2304, 2304, 2304, 64]
    - [0, 21663.0]
  - - [2368, 2432, 1, 64, 2368, 2368, 2368, 64]
    - [3, 22288.9]
  - - [2432, 2432, 1, 64, 2432, 2432, 2432, 64]
    - [3, 22777.1]
  - - [2496, 2432, 1, 64, 2496, 2496, 2496, 64]
    - [3, 22975.5]
  - - [2560, 2432, 1, 64, 2560, 2560, 2560, 64]
    - [0, 21958.2]
  - - [2624, 2432, 1, 64, 2624, 2624, 2624, 64]
    - [3, 23419.6]
  - - [2688, 2432, 1, 64, 2688, 2688, 2688, 64]
    - [3, 23208.4]
  - - [2752, 2432, 1, 64, 2752, 2752, 2752, 64]
    - [3, 23466.8]
  - - [2816, 2432, 1, 64, 2816, 2816, 2816, 64]
    - [0, 23539.2]
  - - [2880, 2432, 1, 64, 2880, 2880, 2880, 64]
    - [3, 23310.5]
  - - [2944, 2432, 1, 64, 2944, 2944, 2944, 64]
    - [3, 23653.9]
  - - [3008, 2432, 1, 64, 3008, 3008, 3008, 64]
    - [3, 24236.9]
  - - [3072, 2432, 1, 64, 3072, 3072, 3072, 64]
    - [0, 22687.8]
  - - [3136, 2432, 1, 64, 3136, 3136, 3136, 64]
    - [3, 24460.3]
  - - [3200, 2432, 1, 64, 3200, 3200, 3200, 64]
    - [3, 24385.2]
  - - [3264, 2432, 1, 64, 3264, 3264, 3264, 64]
    - [0, 24642.5]
  - - [3328, 2432, 1, 64, 3328, 3328, 3328, 64]
    - [0, 24442.7]
  - - [3392, 2432, 1, 64, 3392, 3392, 3392, 64]
    - [0, 25521.0]
  - - [3456, 2432, 1, 64, 3456, 3456, 3456, 64]
    - [0, 25428.5]
  - - [3520, 2432, 1, 64, 3520, 3520, 3520, 64]
    - [0, 26836.8]
  - - [3584, 2432, 1, 64, 3584, 3584, 3584, 64]
    - [0, 24558.0]
  - - [3648, 2432, 1, 64, 3648, 3648, 3648, 64]
    - [0, 27162.1]
  - - [3712, 2432, 1, 64, 3712, 3712, 3712, 64]
    - [0, 26160.7]
  - - [3776, 2432, 1, 64, 3776, 3776, 3776, 64]
    - [0, 24803.5]
  - - [3840, 2432, 1, 64, 3840, 3840, 3840, 64]
    - [0, 25518.0]
  - - [3904, 2432, 1, 64, 3904, 3904, 3904, 64]
    - [0, 27113.5]
  - - [3968, 2432, 1, 64, 3968, 3968, 3968, 64]
    - [0, 26960.2]
  - - [4032, 2432, 1, 64, 4032, 4032, 4032, 64]
    - [0, 27515.1]
  - - [4096, 2432, 1, 64, 4096, 4096, 4096, 64]
    - [0, 23635.7]
  - - [64, 2496, 1, 64, 64, 64, 64, 64]
    - [3, 2028.06]
  - - [128, 2496, 1, 64, 128, 128, 128, 64]
    - [15, 3818.31]
  - - [192, 2496, 1, 64, 192, 192, 192, 64]
    - [4, 5610.13]
  - - [256, 2496, 1, 64, 256, 256, 256, 64]
    - [4, 6823.65]
  - - [320, 2496, 1, 64, 320, 320, 320, 64]
    - [4, 8072.88]
  - - [384, 2496, 1, 64, 384, 384, 384, 64]
    - [9, 9339.3]
  - - [448, 2496, 1, 64, 448, 448, 448, 64]
    - [4, 10162.5]
  - - [512, 2496, 1, 64, 512, 512, 512, 64]
    - [4, 10967.9]
  - - [576, 2496, 1, 64, 576, 576, 576, 64]
    - [0, 12408.8]
  - - [640, 2496, 1, 64, 640, 640, 640, 64]
    - [0, 13063.5]
  - - [704, 2496, 1, 64, 704, 704, 704, 64]
    - [0, 13849.5]
  - - [768, 2496, 1, 64, 768, 768, 768, 64]
    - [0, 14057.7]
  - - [832, 2496, 1, 64, 832, 832, 832, 64]
    - [0, 14672.8]
  - - [896, 2496, 1, 64, 896, 896, 896, 64]
    - [0, 15179.6]
  - - [960, 2496, 1, 64, 960, 960, 960, 64]
    - [0, 15697.8]
  - - [1024, 2496, 1, 64, 1024, 1024, 1024, 64]
    - [4, 15593.5]
  - - [1088, 2496, 1, 64, 1088, 1088, 1088, 64]
    - [0, 16810.1]
  - - [1152, 2496, 1, 64, 1152, 1152, 1152, 64]
    - [0, 17344.3]
  - - [1216, 2496, 1, 64, 1216, 1216, 1216, 64]
    - [3, 17372.9]
  - - [1280, 2496, 1, 64, 1280, 1280, 1280, 64]
    - [9, 17660.2]
  - - [1344, 2496, 1, 64, 1344, 1344, 1344, 64]
    - [0, 18116.1]
  - - [1408, 2496, 1, 64, 1408, 1408, 1408, 64]
    - [9, 18287.4]
  - - [1472, 2496, 1, 64, 1472, 1472, 1472, 64]
    - [0, 18959.9]
  - - [1536, 2496, 1, 64, 1536, 1536, 1536, 64]
    - [0, 18293.0]
  - - [1600, 2496, 1, 64, 1600, 1600, 1600, 64]
    - [9, 19247.5]
  - - [1664, 2496, 1, 64, 1664, 1664, 1664, 64]
    - [0, 19799.7]
  - - [1728, 2496, 1, 64, 1728, 1728, 1728, 64]
    - [0, 19786.0]
  - - [1792, 2496, 1, 64, 1792, 1792, 1792, 64]
    - [0, 20208.8]
  - - [1856, 2496, 1, 64, 1856, 1856, 1856, 64]
    - [0, 20306.9]
  - - [1920, 2496, 1, 64, 1920, 1920, 1920, 64]
    - [3, 20455.2]
  - - [1984, 2496, 1, 64, 1984, 1984, 1984, 64]
    - [3, 20972.0]
  - - [2048, 2496, 1, 64, 2048, 2048, 2048, 64]
    - [1, 20065.7]
  - - [2112, 2496, 1, 64, 2112, 2112, 2112, 64]
    - [3, 21392.1]
  - - [2176, 2496, 1, 64, 2176, 2176, 2176, 64]
    - [3, 21738.6]
  - - [2240, 2496, 1, 64, 2240, 2240, 2240, 64]
    - [3, 21665.2]
  - - [2304, 2496, 1, 64, 2304, 2304, 2304, 64]
    - [0, 21842.4]
  - - [2368, 2496, 1, 64, 2368, 2368, 2368, 64]
    - [3, 22458.5]
  - - [2432, 2496, 1, 64, 2432, 2432, 2432, 64]
    - [3, 22820.3]
  - - [2496, 2496, 1, 64, 2496, 2496, 2496, 64]
    - [3, 23219.1]
  - - [2560, 2496, 1, 64, 2560, 2560, 2560, 64]
    - [0, 22346.4]
  - - [2624, 2496, 1, 64, 2624, 2624, 2624, 64]
    - [3, 23632.2]
  - - [2688, 2496, 1, 64, 2688, 2688, 2688, 64]
    - [3, 23421.5]
  - - [2752, 2496, 1, 64, 2752, 2752, 2752, 64]
    - [3, 23783.2]
  - - [2816, 2496, 1, 64, 2816, 2816, 2816, 64]
    - [0, 23790.7]
  - - [2880, 2496, 1, 64, 2880, 2880, 2880, 64]
    - [3, 23967.5]
  - - [2944, 2496, 1, 64, 2944, 2944, 2944, 64]
    - [3, 24190.1]
  - - [3008, 2496, 1, 64, 3008, 3008, 3008, 64]
    - [3, 24407.2]
  - - [3072, 2496, 1, 64, 3072, 3072, 3072, 64]
    - [0, 22735.7]
  - - [3136, 2496, 1, 64, 3136, 3136, 3136, 64]
    - [3, 24387.9]
  - - [3200, 2496, 1, 64, 3200, 3200, 3200, 64]
    - [0, 24865.0]
  - - [3264, 2496, 1, 64, 3264, 3264, 3264, 64]
    - [0, 24999.9]
  - - [3328, 2496, 1, 64, 3328, 3328, 3328, 64]
    - [0, 23749.0]
  - - [3392, 2496, 1, 64, 3392, 3392, 3392, 64]
    - [0, 26542.9]
  - - [3456, 2496, 1, 64, 3456, 3456, 3456, 64]
    - [0, 26470.5]
  - - [3520, 2496, 1, 64, 3520, 3520, 3520, 64]
    - [0, 25366.1]
  - - [3584, 2496, 1, 64, 3584, 3584, 3584, 64]
    - [0, 25675.6]
  - - [3648, 2496, 1, 64, 3648, 3648, 3648, 64]
    - [0, 27401.1]
  - - [3712, 2496, 1, 64, 3712, 3712, 3712, 64]
    - [0, 26214.1]
  - - [3776, 2496, 1, 64, 3776, 3776, 3776, 64]
    - [0, 24330.9]
  - - [3840, 2496, 1, 64, 3840, 3840, 3840, 64]
    - [0, 26466.3]
  - - [3904, 2496, 1, 64, 3904, 3904, 3904, 64]
    - [0, 27454.7]
  - - [3968, 2496, 1, 64, 3968, 3968, 3968, 64]
    - [0, 27031.2]
  - - [4032, 2496, 1, 64, 4032, 4032, 4032, 64]
    - [0, 26825.4]
  - - [4096, 2496, 1, 64, 4096, 4096, 4096, 64]
    - [0, 23763.5]
  - - [64, 2560, 1, 64, 64, 64, 64, 64]
    - [5, 2058.01]
  - - [128, 2560, 1, 64, 128, 128, 128, 64]
    - [4, 4074.49]
  - - [192, 2560, 1, 64, 192, 192, 192, 64]
    - [4, 5501.35]
  - - [256, 2560, 1, 64, 256, 256, 256, 64]
    - [4, 7002.09]
  - - [320, 2560, 1, 64, 320, 320, 320, 64]
    - [11, 8100.77]
  - - [384, 2560, 1, 64, 384, 384, 384, 64]
    - [0, 9737.44]
  - - [448, 2560, 1, 64, 448, 448, 448, 64]
    - [4, 10336.5]
  - - [512, 2560, 1, 64, 512, 512, 512, 64]
    - [9, 11157.8]
  - - [576, 2560, 1, 64, 576, 576, 576, 64]
    - [0, 12596.2]
  - - [640, 2560, 1, 64, 640, 640, 640, 64]
    - [0, 13350.7]
  - - [704, 2560, 1, 64, 704, 704, 704, 64]
    - [0, 14067.8]
  - - [768, 2560, 1, 64, 768, 768, 768, 64]
    - [9, 14197.0]
  - - [832, 2560, 1, 64, 832, 832, 832, 64]
    - [0, 14852.1]
  - - [896, 2560, 1, 64, 896, 896, 896, 64]
    - [0, 15446.0]
  - - [960, 2560, 1, 64, 960, 960, 960, 64]
    - [0, 16042.9]
  - - [1024, 2560, 1, 64, 1024, 1024, 1024, 64]
    - [4, 15679.5]
  - - [1088, 2560, 1, 64, 1088, 1088, 1088, 64]
    - [0, 17089.0]
  - - [1152, 2560, 1, 64, 1152, 1152, 1152, 64]
    - [0, 17591.8]
  - - [1216, 2560, 1, 64, 1216, 1216, 1216, 64]
    - [0, 17559.3]
  - - [1280, 2560, 1, 64, 1280, 1280, 1280, 64]
    - [0, 17832.7]
  - - [1344, 2560, 1, 64, 1344, 1344, 1344, 64]
    - [9, 18235.9]
  - - [1408, 2560, 1, 64, 1408, 1408, 1408, 64]
    - [0, 18500.6]
  - - [1472, 2560, 1, 64, 1472, 1472, 1472, 64]
    - [9, 19193.8]
  - - [1536, 2560, 1, 64, 1536, 1536, 1536, 64]
    - [0, 18273.0]
  - - [1600, 2560, 1, 64, 1600, 1600, 1600, 64]
    - [0, 19455.4]
  - - [1664, 2560, 1, 64, 1664, 1664, 1664, 64]
    - [0, 19966.8]
  - - [1728, 2560, 1, 64, 1728, 1728, 1728, 64]
    - [0, 20248.4]
  - - [1792, 2560, 1, 64, 1792, 1792, 1792, 64]
    - [0, 20444.1]
  - - [1856, 2560, 1, 64, 1856, 1856, 1856, 64]
    - [3, 20540.6]
  - - [1920, 2560, 1, 64, 1920, 1920, 1920, 64]
    - [3, 20905.8]
  - - [1984, 2560, 1, 64, 1984, 1984, 1984, 64]
    - [3, 21117.1]
  - - [2048, 2560, 1, 64, 2048, 2048, 2048, 64]
    - [1, 20229.2]
  - - [2112, 2560, 1, 64, 2112, 2112, 2112, 64]
    - [3, 21665.9]
  - - [2176, 2560, 1, 64, 2176, 2176, 2176, 64]
    - [3, 21981.1]
  - - [2240, 2560, 1, 64, 2240, 2240, 2240, 64]
    - [3, 21986.5]
  - - [2304, 2560, 1, 64, 2304, 2304, 2304, 64]
    - [0, 21997.9]
  - - [2368, 2560, 1, 64, 2368, 2368, 2368, 64]
    - [3, 22847.2]
  - - [2432, 2560, 1, 64, 2432, 2432, 2432, 64]
    - [3, 23203.6]
  - - [2496, 2560, 1, 64, 2496, 2496, 2496, 64]
    - [3, 23312.0]
  - - [2560, 2560, 1, 64, 2560, 2560, 2560, 64]
    - [0, 22497.7]
  - - [2624, 2560, 1, 64, 2624, 2624, 2624, 64]
    - [3, 23812.5]
  - - [2688, 2560, 1, 64, 2688, 2688, 2688, 64]
    - [3, 23305.1]
  - - [2752, 2560, 1, 64, 2752, 2752, 2752, 64]
    - [3, 23822.2]
  - - [2816, 2560, 1, 64, 2816, 2816, 2816, 64]
    - [0, 23609.0]
  - - [2880, 2560, 1, 64, 2880, 2880, 2880, 64]
    - [3, 23606.8]
  - - [2944, 2560, 1, 64, 2944, 2944, 2944, 64]
    - [3, 24307.8]
  - - [3008, 2560, 1, 64, 3008, 3008, 3008, 64]
    - [3, 23736.8]
  - - [3072, 2560, 1, 64, 3072, 3072, 3072, 64]
    - [0, 22791.8]
  - - [3136, 2560, 1, 64, 3136, 3136, 3136, 64]
    - [0, 24594.1]
  - - [3200, 2560, 1, 64, 3200, 3200, 3200, 64]
    - [0, 24531.2]
  - - [3264, 2560, 1, 64, 3264, 3264, 3264, 64]
    - [0, 25996.1]
  - - [3328, 2560, 1, 64, 3328, 3328, 3328, 64]
    - [0, 25199.0]
  - - [3392, 2560, 1, 64, 3392, 3392, 3392, 64]
    - [0, 25859.4]
  - - [3456, 2560, 1, 64, 3456, 3456, 3456, 64]
    - [0, 26550.9]
  - - [3520, 2560, 1, 64, 3520, 3520, 3520, 64]
    - [0, 26314.6]
  - - [3584, 2560, 1, 64, 3584, 3584, 3584, 64]
    - [0, 24646.2]
  - - [3648, 2560, 1, 64, 3648, 3648, 3648, 64]
    - [0, 26505.8]
  - - [3712, 2560, 1, 64, 3712, 3712, 3712, 64]
    - [0, 26956.6]
  - - [3776, 2560, 1, 64, 3776, 3776, 3776, 64]
    - [9, 24359.3]
  - - [3840, 2560, 1, 64, 3840, 3840, 3840, 64]
    - [0, 26426.6]
  - - [3904, 2560, 1, 64, 3904, 3904, 3904, 64]
    - [0, 26716.6]
  - - [3968, 2560, 1, 64, 3968, 3968, 3968, 64]
    - [0, 26431.6]
  - - [4032, 2560, 1, 64, 4032, 4032, 4032, 64]
    - [0, 26938.9]
  - - [4096, 2560, 1, 64, 4096, 4096, 4096, 64]
    - [0, 23717.2]
  - - [64, 2624, 1, 64, 64, 64, 64, 64]
    - [9, 2068.87]
  - - [128, 2624, 1, 64, 128, 128, 128, 64]
    - [5, 3923.99]
  - - [192, 2624, 1, 64, 192, 192, 192, 64]
    - [6, 5687.7]
  - - [256, 2624, 1, 64, 256, 256, 256, 64]
    - [4, 7101.24]
  - - [320, 2624, 1, 64, 320, 320, 320, 64]
    - [9, 8452.17]
  - - [384, 2624, 1, 64, 384, 384, 384, 64]
    - [4, 9474.98]
  - - [448, 2624, 1, 64, 448, 448, 448, 64]
    - [4, 10531.2]
  - - [512, 2624, 1, 64, 512, 512, 512, 64]
    - [9, 11401.9]
  - - [576, 2624, 1, 64, 576, 576, 576, 64]
    - [0, 12734.4]
  - - [640, 2624, 1, 64, 640, 640, 640, 64]
    - [0, 13507.4]
  - - [704, 2624, 1, 64, 704, 704, 704, 64]
    - [0, 14302.7]
  - - [768, 2624, 1, 64, 768, 768, 768, 64]
    - [4, 14078.5]
  - - [832, 2624, 1, 64, 832, 832, 832, 64]
    - [0, 15088.6]
  - - [896, 2624, 1, 64, 896, 896, 896, 64]
    - [9, 15597.5]
  - - [960, 2624, 1, 64, 960, 960, 960, 64]
    - [0, 16266.5]
  - - [1024, 2624, 1, 64, 1024, 1024, 1024, 64]
    - [4, 15858.1]
  - - [1088, 2624, 1, 64, 1088, 1088, 1088, 64]
    - [0, 17343.4]
  - - [1152, 2624, 1, 64, 1152, 1152, 1152, 64]
    - [4, 17072.1]
  - - [1216, 2624, 1, 64, 1216, 1216, 1216, 64]
    - [0, 17878.5]
  - - [1280, 2624, 1, 64, 1280, 1280, 1280, 64]
    - [3, 17972.9]
  - - [1344, 2624, 1, 64, 1344, 1344, 1344, 64]
    - [0, 18387.3]
  - - [1408, 2624, 1, 64, 1408, 1408, 1408, 64]
    - [0, 18768.9]
  - - [1472, 2624, 1, 64, 1472, 1472, 1472, 64]
    - [0, 19377.5]
  - - [1536, 2624, 1, 64, 1536, 1536, 1536, 64]
    - [0, 18426.1]
  - - [1600, 2624, 1, 64, 1600, 1600, 1600, 64]
    - [0, 19712.0]
  - - [1664, 2624, 1, 64, 1664, 1664, 1664, 64]
    - [0, 20212.8]
  - - [1728, 2624, 1, 64, 1728, 1728, 1728, 64]
    - [0, 20460.4]
  - - [1792, 2624, 1, 64, 1792, 1792, 1792, 64]
    - [0, 20640.4]
  - - [1856, 2624, 1, 64, 1856, 1856, 1856, 64]
    - [0, 20795.7]
  - - [1920, 2624, 1, 64, 1920, 1920, 1920, 64]
    - [3, 20960.4]
  - - [1984, 2624, 1, 64, 1984, 1984, 1984, 64]
    - [3, 21323.6]
  - - [2048, 2624, 1, 64, 2048, 2048, 2048, 64]
    - [1, 20234.7]
  - - [2112, 2624, 1, 64, 2112, 2112, 2112, 64]
    - [0, 21866.7]
  - - [2176, 2624, 1, 64, 2176, 2176, 2176, 64]
    - [3, 22435.2]
  - - [2240, 2624, 1, 64, 2240, 2240, 2240, 64]
    - [3, 22126.5]
  - - [2304, 2624, 1, 64, 2304, 2304, 2304, 64]
    - [0, 22088.3]
  - - [2368, 2624, 1, 64, 2368, 2368, 2368, 64]
    - [3, 23023.8]
  - - [2432, 2624, 1, 64, 2432, 2432, 2432, 64]
    - [3, 23427.7]
  - - [2496, 2624, 1, 64, 2496, 2496, 2496, 64]
    - [3, 23117.3]
  - - [2560, 2624, 1, 64, 2560, 2560, 2560, 64]
    - [0, 22753.9]
  - - [2624, 2624, 1, 64, 2624, 2624, 2624, 64]
    - [3, 23490.6]
  - - [2688, 2624, 1, 64, 2688, 2688, 2688, 64]
    - [3, 23642.5]
  - - [2752, 2624, 1, 64, 2752, 2752, 2752, 64]
    - [3, 23855.6]
  - - [2816, 2624, 1, 64, 2816, 2816, 2816, 64]
    - [3, 23951.6]
  - - [2880, 2624, 1, 64, 2880, 2880, 2880, 64]
    - [3, 23737.5]
  - - [2944, 2624, 1, 64, 2944, 2944, 2944, 64]
    - [3, 24546.8]
  - - [3008, 2624, 1, 64, 3008, 3008, 3008, 64]
    - [3, 24906.1]
  - - [3072, 2624, 1, 64, 3072, 3072, 3072, 64]
    - [0, 22838.3]
  - - [3136, 2624, 1, 64, 3136, 3136, 3136, 64]
    - [3, 24269.2]
  - - [3200, 2624, 1, 64, 3200, 3200, 3200, 64]
    - [0, 24378.0]
  - - [3264, 2624, 1, 64, 3264, 3264, 3264, 64]
    - [0, 26537.7]
  - - [3328, 2624, 1, 64, 3328, 3328, 3328, 64]
    - [3, 24911.3]
  - - [3392, 2624, 1, 64, 3392, 3392, 3392, 64]
    - [0, 26681.9]
  - - [3456, 2624, 1, 64, 3456, 3456, 3456, 64]
    - [0, 26626.5]
  - - [3520, 2624, 1, 64, 3520, 3520, 3520, 64]
    - [0, 26504.4]
  - - [3584, 2624, 1, 64, 3584, 3584, 3584, 64]
    - [0, 25004.1]
  - - [3648, 2624, 1, 64, 3648, 3648, 3648, 64]
    - [0, 26715.9]
  - - [3712, 2624, 1, 64, 3712, 3712, 3712, 64]
    - [0, 26060.7]
  - - [3776, 2624, 1, 64, 3776, 3776, 3776, 64]
    - [0, 25576.5]
  - - [3840, 2624, 1, 64, 3840, 3840, 3840, 64]
    - [0, 25933.7]
  - - [3904, 2624, 1, 64, 3904, 3904, 3904, 64]
    - [0, 27619.9]
  - - [3968, 2624, 1, 64, 3968, 3968, 3968, 64]
    - [0, 26517.7]
  - - [4032, 2624, 1, 64, 4032, 4032, 4032, 64]
    - [0, 26860.8]
  - - [4096, 2624, 1, 64, 4096, 4096, 4096, 64]
    - [0, 24305.9]
  - - [64, 2688, 1, 64, 64, 64, 64, 64]
    - [12, 2174.58]
  - - [128, 2688, 1, 64, 128, 128, 128, 64]
    - [2, 4181.48]
  - - [192, 2688, 1, 64, 192, 192, 192, 64]
    - [4, 5774.45]
  - - [256, 2688, 1, 64, 256, 256, 256, 64]
    - [4, 7220.83]
  - - [320, 2688, 1, 64, 320, 320, 320, 64]
    - [0, 8590.73]
  - - [384, 2688, 1, 64, 384, 384, 384, 64]
    - [4, 9726.05]
  - - [448, 2688, 1, 64, 448, 448, 448, 64]
    - [4, 10760.9]
  - - [512, 2688, 1, 64, 512, 512, 512, 64]
    - [9, 11551.4]
  - - [576, 2688, 1, 64, 576, 576, 576, 64]
    - [9, 12842.0]
  - - [640, 2688, 1, 64, 640, 640, 640, 64]
    - [0, 13745.2]
  - - [704, 2688, 1, 64, 704, 704, 704, 64]
    - [0, 14448.8]
  - - [768, 2688, 1, 64, 768, 768, 768, 64]
    - [4, 14180.4]
  - - [832, 2688, 1, 64, 832, 832, 832, 64]
    - [0, 15430.0]
  - - [896, 2688, 1, 64, 896, 896, 896, 64]
    - [0, 15757.4]
  - - [960, 2688, 1, 64, 960, 960, 960, 64]
    - [0, 16444.1]
  - - [1024, 2688, 1, 64, 1024, 1024, 1024, 64]
    - [4, 15975.2]
  - - [1088, 2688, 1, 64, 1088, 1088, 1088, 64]
    - [0, 17604.2]
  - - [1152, 2688, 1, 64, 1152, 1152, 1152, 64]
    - [4, 17220.9]
  - - [1216, 2688, 1, 64, 1216, 1216, 1216, 64]
    - [0, 18002.5]
  - - [1280, 2688, 1, 64, 1280, 1280, 1280, 64]
    - [3, 18151.7]
  - - [1344, 2688, 1, 64, 1344, 1344, 1344, 64]
    - [0, 18653.4]
  - - [1408, 2688, 1, 64, 1408, 1408, 1408, 64]
    - [0, 19022.9]
  - - [1472, 2688, 1, 64, 1472, 1472, 1472, 64]
    - [3, 19016.8]
  - - [1536, 2688, 1, 64, 1536, 1536, 1536, 64]
    - [0, 18639.7]
  - - [1600, 2688, 1, 64, 1600, 1600, 1600, 64]
    - [0, 19958.6]
  - - [1664, 2688, 1, 64, 1664, 1664, 1664, 64]
    - [0, 20467.4]
  - - [1728, 2688, 1, 64, 1728, 1728, 1728, 64]
    - [0, 20680.9]
  - - [1792, 2688, 1, 64, 1792, 1792, 1792, 64]
    - [0, 20905.9]
  - - [1856, 2688, 1, 64, 1856, 1856, 1856, 64]
    - [3, 20943.8]
  - - [1920, 2688, 1, 64, 1920, 1920, 1920, 64]
    - [3, 21155.3]
  - - [1984, 2688, 1, 64, 1984, 1984, 1984, 64]
    - [3, 21662.1]
  - - [2048, 2688, 1, 64, 2048, 2048, 2048, 64]
    - [1, 20355.8]
  - - [2112, 2688, 1, 64, 2112, 2112, 2112, 64]
    - [0, 22031.9]
  - - [2176, 2688, 1, 64, 2176, 2176, 2176, 64]
    - [3, 22333.9]
  - - [2240, 2688, 1, 64, 2240, 2240, 2240, 64]
    - [3, 22282.2]
  - - [2304, 2688, 1, 64, 2304, 2304, 2304, 64]
    - [3, 22359.0]
  - - [2368, 2688, 1, 64, 2368, 2368, 2368, 64]
    - [3, 23114.4]
  - - [2432, 2688, 1, 64, 2432, 2432, 2432, 64]
    - [3, 23495.1]
  - - [2496, 2688, 1, 64, 2496, 2496, 2496, 64]
    - [3, 23497.1]
  - - [2560, 2688, 1, 64, 2560, 2560, 2560, 64]
    - [0, 22815.0]
  - - [2624, 2688, 1, 64, 2624, 2624, 2624, 64]
    - [3, 23694.7]
  - - [2688, 2688, 1, 64, 2688, 2688, 2688, 64]
    - [3, 23673.6]
  - - [2752, 2688, 1, 64, 2752, 2752, 2752, 64]
    - [3, 24388.4]
  - - [2816, 2688, 1, 64, 2816, 2816, 2816, 64]
    - [0, 24602.0]
  - - [2880, 2688, 1, 64, 2880, 2880, 2880, 64]
    - [3, 24538.0]
  - - [2944, 2688, 1, 64, 2944, 2944, 2944, 64]
    - [3, 24569.7]
  - - [3008, 2688, 1, 64, 3008, 3008, 3008, 64]
    - [0, 23989.0]
  - - [3072, 2688, 1, 64, 3072, 3072, 3072, 64]
    - [0, 23149.3]
  - - [3136, 2688, 1, 64, 3136, 3136, 3136, 64]
    - [0, 25223.9]
  - - [3200, 2688, 1, 64, 3200, 3200, 3200, 64]
    - [0, 25436.5]
  - - [3264, 2688, 1, 64, 3264, 3264, 3264, 64]
    - [0, 25829.4]
  - - [3328, 2688, 1, 64, 3328, 3328, 3328, 64]
    - [0, 26423.4]
  - - [3392, 2688, 1, 64, 3392, 3392, 3392, 64]
    - [0, 27106.7]
  - - [3456, 2688, 1, 64, 3456, 3456, 3456, 64]
    - [0, 25628.7]
  - - [3520, 2688, 1, 64, 3520, 3520, 3520, 64]
    - [0, 26602.2]
  - - [3584, 2688, 1, 64, 3584, 3584, 3584, 64]
    - [0, 25440.7]
  - - [3648, 2688, 1, 64, 3648, 3648, 3648, 64]
    - [0, 26724.3]
  - - [3712, 2688, 1, 64, 3712, 3712, 3712, 64]
    - [0, 25714.8]
  - - [3776, 2688, 1, 64, 3776, 3776, 3776, 64]
    - [0, 25315.1]
  - - [3840, 2688, 1, 64, 3840, 3840, 3840, 64]
    - [0, 26267.3]
  - - [3904, 2688, 1, 64, 3904, 3904, 3904, 64]
    - [0, 27196.0]
  - - [3968, 2688, 1, 64, 3968, 3968, 3968, 64]
    - [9, 26289.8]
  - - [4032, 2688, 1, 64, 4032, 4032, 4032, 64]
    - [0, 27592.6]
  - - [4096, 2688, 1, 64, 4096, 4096, 4096, 64]
    - [0, 24459.7]
  - - [64, 2752, 1, 64, 64, 64, 64, 64]
    - [3, 2164.78]
  - - [128, 2752, 1, 64, 128, 128, 128, 64]
    - [6, 4136.55]
  - - [192, 2752, 1, 64, 192, 192, 192, 64]
    - [7, 5717.96]
  - - [256, 2752, 1, 64, 256, 256, 256, 64]
    - [7, 7194.58]
  - - [320, 2752, 1, 64, 320, 320, 320, 64]
    - [0, 8831.13]
  - - [384, 2752, 1, 64, 384, 384, 384, 64]
    - [4, 9760.74]
  - - [448, 2752, 1, 64, 448, 448, 448, 64]
    - [9, 10903.0]
  - - [512, 2752, 1, 64, 512, 512, 512, 64]
    - [9, 11647.7]
  - - [576, 2752, 1, 64, 576, 576, 576, 64]
    - [0, 12968.0]
  - - [640, 2752, 1, 64, 640, 640, 640, 64]
    - [0, 13893.8]
  - - [704, 2752, 1, 64, 704, 704, 704, 64]
    - [0, 14577.0]
  - - [768, 2752, 1, 64, 768, 768, 768, 64]
    - [4, 14347.1]
  - - [832, 2752, 1, 64, 832, 832, 832, 64]
    - [0, 15518.0]
  - - [896, 2752, 1, 64, 896, 896, 896, 64]
    - [0, 16009.8]
  - - [960, 2752, 1, 64, 960, 960, 960, 64]
    - [0, 16526.3]
  - - [1024, 2752, 1, 64, 1024, 1024, 1024, 64]
    - [4, 16120.2]
  - - [1088, 2752, 1, 64, 1088, 1088, 1088, 64]
    - [4, 17204.6]
  - - [1152, 2752, 1, 64, 1152, 1152, 1152, 64]
    - [0, 17547.2]
  - - [1216, 2752, 1, 64, 1216, 1216, 1216, 64]
    - [0, 18185.3]
  - - [1280, 2752, 1, 64, 1280, 1280, 1280, 64]
    - [3, 18287.0]
  - - [1344, 2752, 1, 64, 1344, 1344, 1344, 64]
    - [0, 18926.5]
  - - [1408, 2752, 1, 64, 1408, 1408, 1408, 64]
    - [0, 19268.5]
  - - [1472, 2752, 1, 64, 1472, 1472, 1472, 64]
    - [3, 19210.0]
  - - [1536, 2752, 1, 64, 1536, 1536, 1536, 64]
    - [0, 18756.8]
  - - [1600, 2752, 1, 64, 1600, 1600, 1600, 64]
    - [0, 20253.1]
  - - [1664, 2752, 1, 64, 1664, 1664, 1664, 64]
    - [0, 20738.3]
  - - [1728, 2752, 1, 64, 1728, 1728, 1728, 64]
    - [0, 20758.9]
  - - [1792, 2752, 1, 64, 1792, 1792, 1792, 64]
    - [3, 20894.9]
  - - [1856, 2752, 1, 64, 1856, 1856, 1856, 64]
    - [3, 20930.3]
  - - [1920, 2752, 1, 64, 1920, 1920, 1920, 64]
    - [3, 21317.6]
  - - [1984, 2752, 1, 64, 1984, 1984, 1984, 64]
    - [3, 21804.2]
  - - [2048, 2752, 1, 64, 2048, 2048, 2048, 64]
    - [1, 20693.4]
  - - [2112, 2752, 1, 64, 2112, 2112, 2112, 64]
    - [3, 22198.3]
  - - [2176, 2752, 1, 64, 2176, 2176, 2176, 64]
    - [3, 22642.6]
  - - [2240, 2752, 1, 64, 2240, 2240, 2240, 64]
    - [3, 22439.0]
  - - [2304, 2752, 1, 64, 2304, 2304, 2304, 64]
    - [0, 22433.2]
  - - [2368, 2752, 1, 64, 2368, 2368, 2368, 64]
    - [3, 23107.5]
  - - [2432, 2752, 1, 64, 2432, 2432, 2432, 64]
    - [3, 23383.5]
  - - [2496, 2752, 1, 64, 2496, 2496, 2496, 64]
    - [3, 23845.2]
  - - [2560, 2752, 1, 64, 2560, 2560, 2560, 64]
    - [0, 22922.4]
  - - [2624, 2752, 1, 64, 2624, 2624, 2624, 64]
    - [3, 23906.2]
  - - [2688, 2752, 1, 64, 2688, 2688, 2688, 64]
    - [3, 24205.0]
  - - [2752, 2752, 1, 64, 2752, 2752, 2752, 64]
    - [3, 24651.5]
  - - [2816, 2752, 1, 64, 2816, 2816, 2816, 64]
    - [9, 23929.8]
  - - [2880, 2752, 1, 64, 2880, 2880, 2880, 64]
    - [3, 24782.2]
  - - [2944, 2752, 1, 64, 2944, 2944, 2944, 64]
    - [0, 24114.7]
  - - [3008, 2752, 1, 64, 3008, 3008, 3008, 64]
    - [0, 24108.6]
  - - [3072, 2752, 1, 64, 3072, 3072, 3072, 64]
    - [0, 22625.2]
  - - [3136, 2752, 1, 64, 3136, 3136, 3136, 64]
    - [0, 24492.5]
  - - [3200, 2752, 1, 64, 3200, 3200, 3200, 64]
    - [0, 24690.2]
  - - [3264, 2752, 1, 64, 3264, 3264, 3264, 64]
    - [0, 26301.6]
  - - [3328, 2752, 1, 64, 3328, 3328, 3328, 64]
    - [0, 25711.6]
  - - [3392, 2752, 1, 64, 3392, 3392, 3392, 64]
    - [0, 26274.0]
  - - [3456, 2752, 1, 64, 3456, 3456, 3456, 64]
    - [0, 25773.4]
  - - [3520, 2752, 1, 64, 3520, 3520, 3520, 64]
    - [0, 26791.9]
  - - [3584, 2752, 1, 64, 3584, 3584, 3584, 64]
    - [0, 25077.9]
  - - [3648, 2752, 1, 64, 3648, 3648, 3648, 64]
    - [0, 27608.6]
  - - [3712, 2752, 1, 64, 3712, 3712, 3712, 64]
    - [0, 25887.1]
  - - [3776, 2752, 1, 64, 3776, 3776, 3776, 64]
    - [0, 25745.2]
  - - [3840, 2752, 1, 64, 3840, 3840, 3840, 64]
    - [9, 25102.9]
  - - [3904, 2752, 1, 64, 3904, 3904, 3904, 64]
    - [0, 26816.2]
  - - [3968, 2752, 1, 64, 3968, 3968, 3968, 64]
    - [0, 27092.1]
  - - [4032, 2752, 1, 64, 4032, 4032, 4032, 64]
    - [0, 27584.6]
  - - [4096, 2752, 1, 64, 4096, 4096, 4096, 64]
    - [0, 25032.6]
  - - [64, 2816, 1, 64, 64, 64, 64, 64]
    - [7, 2253.67]
  - - [128, 2816, 1, 64, 128, 128, 128, 64]
    - [5, 4294.2]
  - - [192, 2816, 1, 64, 192, 192, 192, 64]
    - [7, 5999.08]
  - - [256, 2816, 1, 64, 256, 256, 256, 64]
    - [3, 7359.46]
  - - [320, 2816, 1, 64, 320, 320, 320, 64]
    - [0, 8898.47]
  - - [384, 2816, 1, 64, 384, 384, 384, 64]
    - [4, 10016.7]
  - - [448, 2816, 1, 64, 448, 448, 448, 64]
    - [0, 11145.6]
  - - [512, 2816, 1, 64, 512, 512, 512, 64]
    - [0, 11840.5]
  - - [576, 2816, 1, 64, 576, 576, 576, 64]
    - [0, 13389.4]
  - - [640, 2816, 1, 64, 640, 640, 640, 64]
    - [0, 14004.7]
  - - [704, 2816, 1, 64, 704, 704, 704, 64]
    - [4, 14073.9]
  - - [768, 2816, 1, 64, 768, 768, 768, 64]
    - [9, 14444.8]
  - - [832, 2816, 1, 64, 832, 832, 832, 64]
    - [0, 15581.8]
  - - [896, 2816, 1, 64, 896, 896, 896, 64]
    - [0, 16224.2]
  - - [960, 2816, 1, 64, 960, 960, 960, 64]
    - [0, 16600.7]
  - - [1024, 2816, 1, 64, 1024, 1024, 1024, 64]
    - [9, 16322.9]
  - - [1088, 2816, 1, 64, 1088, 1088, 1088, 64]
    - [3, 17207.7]
  - - [1152, 2816, 1, 64, 1152, 1152, 1152, 64]
    - [0, 17734.2]
  - - [1216, 2816, 1, 64, 1216, 1216, 1216, 64]
    - [0, 18408.3]
  - - [1280, 2816, 1, 64, 1280, 1280, 1280, 64]
    - [3, 18536.3]
  - - [1344, 2816, 1, 64, 1344, 1344, 1344, 64]
    - [0, 19119.0]
  - - [1408, 2816, 1, 64, 1408, 1408, 1408, 64]
    - [3, 19172.8]
  - - [1472, 2816, 1, 64, 1472, 1472, 1472, 64]
    - [3, 19492.1]
  - - [1536, 2816, 1, 64, 1536, 1536, 1536, 64]
    - [0, 18940.8]
  - - [1600, 2816, 1, 64, 1600, 1600, 1600, 64]
    - [0, 20411.6]
  - - [1664, 2816, 1, 64, 1664, 1664, 1664, 64]
    - [0, 20834.4]
  - - [1728, 2816, 1, 64, 1728, 1728, 1728, 64]
    - [0, 21152.2]
  - - [1792, 2816, 1, 64, 1792, 1792, 1792, 64]
    - [3, 20986.3]
  - - [1856, 2816, 1, 64, 1856, 1856, 1856, 64]
    - [3, 21360.9]
  - - [1920, 2816, 1, 64, 1920, 1920, 1920, 64]
    - [3, 21421.8]
  - - [1984, 2816, 1, 64, 1984, 1984, 1984, 64]
    - [3, 21916.0]
  - - [2048, 2816, 1, 64, 2048, 2048, 2048, 64]
    - [1, 20866.9]
  - - [2112, 2816, 1, 64, 2112, 2112, 2112, 64]
    - [3, 22355.7]
  - - [2176, 2816, 1, 64, 2176, 2176, 2176, 64]
    - [3, 22554.9]
  - - [2240, 2816, 1, 64, 2240, 2240, 2240, 64]
    - [3, 22391.5]
  - - [2304, 2816, 1, 64, 2304, 2304, 2304, 64]
    - [3, 22510.6]
  - - [2368, 2816, 1, 64, 2368, 2368, 2368, 64]
    - [3, 23070.9]
  - - [2432, 2816, 1, 64, 2432, 2432, 2432, 64]
    - [3, 23320.0]
  - - [2496, 2816, 1, 64, 2496, 2496, 2496, 64]
    - [3, 23554.0]
  - - [2560, 2816, 1, 64, 2560, 2560, 2560, 64]
    - [0, 22709.6]
  - - [2624, 2816, 1, 64, 2624, 2624, 2624, 64]
    - [3, 23833.4]
  - - [2688, 2816, 1, 64, 2688, 2688, 2688, 64]
    - [3, 24291.0]
  - - [2752, 2816, 1, 64, 2752, 2752, 2752, 64]
    - [3, 23648.0]
  - - [2816, 2816, 1, 64, 2816, 2816, 2816, 64]
    - [0, 23998.8]
  - - [2880, 2816, 1, 64, 2880, 2880, 2880, 64]
    - [0, 23818.9]
  - - [2944, 2816, 1, 64, 2944, 2944, 2944, 64]
    - [0, 23821.3]
  - - [3008, 2816, 1, 64, 3008, 3008, 3008, 64]
    - [3, 24401.7]
  - - [3072, 2816, 1, 64, 3072, 3072, 3072, 64]
    - [0, 23029.0]
  - - [3136, 2816, 1, 64, 3136, 3136, 3136, 64]
    - [0, 25254.7]
  - - [3200, 2816, 1, 64, 3200, 3200, 3200, 64]
    - [0, 25346.6]
  - - [3264, 2816, 1, 64, 3264, 3264, 3264, 64]
    - [0, 26279.6]
  - - [3328, 2816, 1, 64, 3328, 3328, 3328, 64]
    - [0, 25718.4]
  - - [3392, 2816, 1, 64, 3392, 3392, 3392, 64]
    - [0, 26203.9]
  - - [3456, 2816, 1, 64, 3456, 3456, 3456, 64]
    - [0, 27192.6]
  - - [3520, 2816, 1, 64, 3520, 3520, 3520, 64]
    - [0, 27065.2]
  - - [3584, 2816, 1, 64, 3584, 3584, 3584, 64]
    - [0, 25495.0]
  - - [3648, 2816, 1, 64, 3648, 3648, 3648, 64]
    - [0, 27897.1]
  - - [3712, 2816, 1, 64, 3712, 3712, 3712, 64]
    - [0, 26664.5]
  - - [3776, 2816, 1, 64, 3776, 3776, 3776, 64]
    - [0, 24657.3]
  - - [3840, 2816, 1, 64, 3840, 3840, 3840, 64]
    - [0, 26508.3]
  - - [3904, 2816, 1, 64, 3904, 3904, 3904, 64]
    - [0, 26305.2]
  - - [3968, 2816, 1, 64, 3968, 3968, 3968, 64]
    - [0, 27180.5]
  - - [4032, 2816, 1, 64, 4032, 4032, 4032, 64]
    - [0, 28706.8]
  - - [4096, 2816, 1, 64, 4096, 4096, 4096, 64]
    - [0, 26072.4]
  - - [64, 2880, 1, 64, 64, 64, 64, 64]
    - [18, 2373.99]
  - - [128, 2880, 1, 64, 128, 128, 128, 64]
    - [14, 4351.26]
  - - [192, 2880, 1, 64, 192, 192, 192, 64]
    - [11, 5911.0]
  - - [256, 2880, 1, 64, 256, 256, 256, 64]
    - [9, 7718.85]
  - - [320, 2880, 1, 64, 320, 320, 320, 64]
    - [0, 9177.14]
  - - [384, 2880, 1, 64, 384, 384, 384, 64]
    - [4, 10163.4]
  - - [448, 2880, 1, 64, 448, 448, 448, 64]
    - [9, 11436.9]
  - - [512, 2880, 1, 64, 512, 512, 512, 64]
    - [0, 12038.6]
  - - [576, 2880, 1, 64, 576, 576, 576, 64]
    - [0, 13625.1]
  - - [640, 2880, 1, 64, 640, 640, 640, 64]
    - [0, 14250.2]
  - - [704, 2880, 1, 64, 704, 704, 704, 64]
    - [0, 14344.5]
  - - [768, 2880, 1, 64, 768, 768, 768, 64]
    - [1, 14655.3]
  - - [832, 2880, 1, 64, 832, 832, 832, 64]
    - [0, 15820.9]
  - - [896, 2880, 1, 64, 896, 896, 896, 64]
    - [0, 16485.2]
  - - [960, 2880, 1, 64, 960, 960, 960, 64]
    - [0, 16638.1]
  - - [1024, 2880, 1, 64, 1024, 1024, 1024, 64]
    - [9, 16576.6]
  - - [1088, 2880, 1, 64, 1088, 1088, 1088, 64]
    - [0, 17415.3]
  - - [1152, 2880, 1, 64, 1152, 1152, 1152, 64]
    - [0, 17936.7]
  - - [1216, 2880, 1, 64, 1216, 1216, 1216, 64]
    - [0, 18478.9]
  - - [1280, 2880, 1, 64, 1280, 1280, 1280, 64]
    - [3, 18868.1]
  - - [1344, 2880, 1, 64, 1344, 1344, 1344, 64]
    - [0, 19433.8]
  - - [1408, 2880, 1, 64, 1408, 1408, 1408, 64]
    - [3, 19335.4]
  - - [1472, 2880, 1, 64, 1472, 1472, 1472, 64]
    - [0, 19663.3]
  - - [1536, 2880, 1, 64, 1536, 1536, 1536, 64]
    - [0, 19201.9]
  - - [1600, 2880, 1, 64, 1600, 1600, 1600, 64]
    - [0, 20611.4]
  - - [1664, 2880, 1, 64, 1664, 1664, 1664, 64]
    - [0, 21038.8]
  - - [1728, 2880, 1, 64, 1728, 1728, 1728, 64]
    - [3, 20981.6]
  - - [1792, 2880, 1, 64, 1792, 1792, 1792, 64]
    - [0, 21181.1]
  - - [1856, 2880, 1, 64, 1856, 1856, 1856, 64]
    - [3, 21286.4]
  - - [1920, 2880, 1, 64, 1920, 1920, 1920, 64]
    - [3, 21603.6]
  - - [1984, 2880, 1, 64, 1984, 1984, 1984, 64]
    - [3, 21955.2]
  - - [2048, 2880, 1, 64, 2048, 2048, 2048, 64]
    - [1, 20939.8]
  - - [2112, 2880, 1, 64, 2112, 2112, 2112, 64]
    - [3, 22488.6]
  - - [2176, 2880, 1, 64, 2176, 2176, 2176, 64]
    - [3, 22604.7]
  - - [2240, 2880, 1, 64, 2240, 2240, 2240, 64]
    - [3, 22679.1]
  - - [2304, 2880, 1, 64, 2304, 2304, 2304, 64]
    - [0, 22579.1]
  - - [2368, 2880, 1, 64, 2368, 2368, 2368, 64]
    - [3, 23536.7]
  - - [2432, 2880, 1, 64, 2432, 2432, 2432, 64]
    - [3, 23491.3]
  - - [2496, 2880, 1, 64, 2496, 2496, 2496, 64]
    - [3, 24141.1]
  - - [2560, 2880, 1, 64, 2560, 2560, 2560, 64]
    - [3, 22840.1]
  - - [2624, 2880, 1, 64, 2624, 2624, 2624, 64]
    - [0, 24029.9]
  - - [2688, 2880, 1, 64, 2688, 2688, 2688, 64]
    - [3, 24155.1]
  - - [2752, 2880, 1, 64, 2752, 2752, 2752, 64]
    - [3, 24506.8]
  - - [2816, 2880, 1, 64, 2816, 2816, 2816, 64]
    - [0, 24084.2]
  - - [2880, 2880, 1, 64, 2880, 2880, 2880, 64]
    - [0, 24086.2]
  - - [2944, 2880, 1, 64, 2944, 2944, 2944, 64]
    - [3, 24392.4]
  - - [3008, 2880, 1, 64, 3008, 3008, 3008, 64]
    - [0, 24609.5]
  - - [3072, 2880, 1, 64, 3072, 3072, 3072, 64]
    - [0, 24074.1]
  - - [3136, 2880, 1, 64, 3136, 3136, 3136, 64]
    - [0, 25821.8]
  - - [3200, 2880, 1, 64, 3200, 3200, 3200, 64]
    - [0, 25790.0]
  - - [3264, 2880, 1, 64, 3264, 3264, 3264, 64]
    - [0, 26541.3]
  - - [3328, 2880, 1, 64, 3328, 3328, 3328, 64]
    - [0, 26779.4]
  - - [3392, 2880, 1, 64, 3392, 3392, 3392, 64]
    - [0, 25988.5]
  - - [3456, 2880, 1, 64, 3456, 3456, 3456, 64]
    - [0, 26754.7]
  - - [3520, 2880, 1, 64, 3520, 3520, 3520, 64]
    - [0, 26837.6]
  - - [3584, 2880, 1, 64, 3584, 3584, 3584, 64]
    - [9, 25696.1]
  - - [3648, 2880, 1, 64, 3648, 3648, 3648, 64]
    - [0, 27389.8]
  - - [3712, 2880, 1, 64, 3712, 3712, 3712, 64]
    - [0, 27291.1]
  - - [3776, 2880, 1, 64, 3776, 3776, 3776, 64]
    - [0, 25396.3]
  - - [3840, 2880, 1, 64, 3840, 3840, 3840, 64]
    - [3, 26151.2]
  - - [3904, 2880, 1, 64, 3904, 3904, 3904, 64]
    - [0, 27454.3]
  - - [3968, 2880, 1, 64, 3968, 3968, 3968, 64]
    - [9, 27494.1]
  - - [4032, 2880, 1, 64, 4032, 4032, 4032, 64]
    - [9, 27617.9]
  - - [4096, 2880, 1, 64, 4096, 4096, 4096, 64]
    - [0, 26063.0]
  - - [64, 2944, 1, 64, 64, 64, 64, 64]
    - [4, 2388.78]
  - - [128, 2944, 1, 64, 128, 128, 128, 64]
    - [1, 4495.25]
  - - [192, 2944, 1, 64, 192, 192, 192, 64]
    - [0, 6076.86]
  - - [256, 2944, 1, 64, 256, 256, 256, 64]
    - [3, 7793.49]
  - - [320, 2944, 1, 64, 320, 320, 320, 64]
    - [0, 9524.87]
  - - [384, 2944, 1, 64, 384, 384, 384, 64]
    - [4, 10239.3]
  - - [448, 2944, 1, 64, 448, 448, 448, 64]
    - [0, 11620.3]
  - - [512, 2944, 1, 64, 512, 512, 512, 64]
    - [0, 12126.7]
  - - [576, 2944, 1, 64, 576, 576, 576, 64]
    - [0, 13709.8]
  - - [640, 2944, 1, 64, 640, 640, 640, 64]
    - [0, 14405.1]
  - - [704, 2944, 1, 64, 704, 704, 704, 64]
    - [0, 14557.0]
  - - [768, 2944, 1, 64, 768, 768, 768, 64]
    - [4, 14792.7]
  - - [832, 2944, 1, 64, 832, 832, 832, 64]
    - [0, 16023.7]
  - - [896, 2944, 1, 64, 896, 896, 896, 64]
    - [0, 16650.4]
  - - [960, 2944, 1, 64, 960, 960, 960, 64]
    - [0, 16849.4]
  - - [1024, 2944, 1, 64, 1024, 1024, 1024, 64]
    - [4, 16643.8]
  - - [1088, 2944, 1, 64, 1088, 1088, 1088, 64]
    - [0, 17704.0]
  - - [1152, 2944, 1, 64, 1152, 1152, 1152, 64]
    - [0, 18114.9]
  - - [1216, 2944, 1, 64, 1216, 1216, 1216, 64]
    - [0, 18698.4]
  - - [1280, 2944, 1, 64, 1280, 1280, 1280, 64]
    - [0, 18995.7]
  - - [1344, 2944, 1, 64, 1344, 1344, 1344, 64]
    - [3, 19273.0]
  - - [1408, 2944, 1, 64, 1408, 1408, 1408, 64]
    - [3, 19525.1]
  - - [1472, 2944, 1, 64, 1472, 1472, 1472, 64]
    - [0, 19605.9]
  - - [1536, 2944, 1, 64, 1536, 1536, 1536, 64]
    - [0, 19287.1]
  - - [1600, 2944, 1, 64, 1600, 1600, 1600, 64]
    - [0, 20673.6]
  - - [1664, 2944, 1, 64, 1664, 1664, 1664, 64]
    - [0, 21149.6]
  - - [1728, 2944, 1, 64, 1728, 1728, 1728, 64]
    - [3, 21009.1]
  - - [1792, 2944, 1, 64, 1792, 1792, 1792, 64]
    - [0, 21369.5]
  - - [1856, 2944, 1, 64, 1856, 1856, 1856, 64]
    - [3, 21413.0]
  - - [1920, 2944, 1, 64, 1920, 1920, 1920, 64]
    - [3, 21731.0]
  - - [1984, 2944, 1, 64, 1984, 1984, 1984, 64]
    - [3, 22026.6]
  - - [2048, 2944, 1, 64, 2048, 2048, 2048, 64]
    - [1, 21209.9]
  - - [2112, 2944, 1, 64, 2112, 2112, 2112, 64]
    - [3, 22494.6]
  - - [2176, 2944, 1, 64, 2176, 2176, 2176, 64]
    - [3, 22878.8]
  - - [2240, 2944, 1, 64, 2240, 2240, 2240, 64]
    - [3, 22759.2]
  - - [2304, 2944, 1, 64, 2304, 2304, 2304, 64]
    - [0, 22790.0]
  - - [2368, 2944, 1, 64, 2368, 2368, 2368, 64]
    - [3, 23634.0]
  - - [2432, 2944, 1, 64, 2432, 2432, 2432, 64]
    - [3, 23829.8]
  - - [2496, 2944, 1, 64, 2496, 2496, 2496, 64]
    - [3, 24300.2]
  - - [2560, 2944, 1, 64, 2560, 2560, 2560, 64]
    - [0, 23430.4]
  - - [2624, 2944, 1, 64, 2624, 2624, 2624, 64]
    - [3, 24087.6]
  - - [2688, 2944, 1, 64, 2688, 2688, 2688, 64]
    - [1, 23811.9]
  - - [2752, 2944, 1, 64, 2752, 2752, 2752, 64]
    - [0, 24429.4]
  - - [2816, 2944, 1, 64, 2816, 2816, 2816, 64]
    - [3, 24484.2]
  - - [2880, 2944, 1, 64, 2880, 2880, 2880, 64]
    - [0, 24716.8]
  - - [2944, 2944, 1, 64, 2944, 2944, 2944, 64]
    - [0, 25330.7]
  - - [3008, 2944, 1, 64, 3008, 3008, 3008, 64]
    - [3, 24352.1]
  - - [3072, 2944, 1, 64, 3072, 3072, 3072, 64]
    - [0, 22980.3]
  - - [3136, 2944, 1, 64, 3136, 3136, 3136, 64]
    - [0, 26410.9]
  - - [3200, 2944, 1, 64, 3200, 3200, 3200, 64]
    - [0, 26669.9]
  - - [3264, 2944, 1, 64, 3264, 3264, 3264, 64]
    - [0, 26829.4]
  - - [3328, 2944, 1, 64, 3328, 3328, 3328, 64]
    - [0, 26790.9]
  - - [3392, 2944, 1, 64, 3392, 3392, 3392, 64]
    - [0, 27301.4]
  - - [3456, 2944, 1, 64, 3456, 3456, 3456, 64]
    - [0, 27128.2]
  - - [3520, 2944, 1, 64, 3520, 3520, 3520, 64]
    - [0, 28141.8]
  - - [3584, 2944, 1, 64, 3584, 3584, 3584, 64]
    - [9, 25515.7]
  - - [3648, 2944, 1, 64, 3648, 3648, 3648, 64]
    - [0, 27194.2]
  - - [3712, 2944, 1, 64, 3712, 3712, 3712, 64]
    - [0, 27879.8]
  - - [3776, 2944, 1, 64, 3776, 3776, 3776, 64]
    - [0, 26976.5]
  - - [3840, 2944, 1, 64, 3840, 3840, 3840, 64]
    - [9, 26509.0]
  - - [3904, 2944, 1, 64, 3904, 3904, 3904, 64]
    - [0, 27219.0]
  - - [3968, 2944, 1, 64, 3968, 3968, 3968, 64]
    - [0, 26349.0]
  - - [4032, 2944, 1, 64, 4032, 4032, 4032, 64]
    - [0, 28028.5]
  - - [4096, 2944, 1, 64, 4096, 4096, 4096, 64]
    - [0, 26163.5]
  - - [64, 3008, 1, 64, 64, 64, 64, 64]
    - [15, 2479.98]
  - - [128, 3008, 1, 64, 128, 128, 128, 64]
    - [18, 4442.28]
  - - [192, 3008, 1, 64, 192, 192, 192, 64]
    - [4, 6169.56]
  - - [256, 3008, 1, 64, 256, 256, 256, 64]
    - [3, 7838.79]
  - - [320, 3008, 1, 64, 320, 320, 320, 64]
    - [0, 9803.21]
  - - [384, 3008, 1, 64, 384, 384, 384, 64]
    - [4, 10448.6]
  - - [448, 3008, 1, 64, 448, 448, 448, 64]
    - [9, 11848.4]
  - - [512, 3008, 1, 64, 512, 512, 512, 64]
    - [0, 12239.5]
  - - [576, 3008, 1, 64, 576, 576, 576, 64]
    - [0, 13795.1]
  - - [640, 3008, 1, 64, 640, 640, 640, 64]
    - [0, 14535.9]
  - - [704, 3008, 1, 64, 704, 704, 704, 64]
    - [0, 14689.8]
  - - [768, 3008, 1, 64, 768, 768, 768, 64]
    - [4, 14941.6]
  - - [832, 3008, 1, 64, 832, 832, 832, 64]
    - [0, 16287.2]
  - - [896, 3008, 1, 64, 896, 896, 896, 64]
    - [0, 16667.2]
  - - [960, 3008, 1, 64, 960, 960, 960, 64]
    - [9, 17164.5]
  - - [1024, 3008, 1, 64, 1024, 1024, 1024, 64]
    - [4, 16711.5]
  - - [1088, 3008, 1, 64, 1088, 1088, 1088, 64]
    - [9, 17911.0]
  - - [1152, 3008, 1, 64, 1152, 1152, 1152, 64]
    - [0, 18197.4]
  - - [1216, 3008, 1, 64, 1216, 1216, 1216, 64]
    - [0, 18872.3]
  - - [1280, 3008, 1, 64, 1280, 1280, 1280, 64]
    - [0, 19219.4]
  - - [1344, 3008, 1, 64, 1344, 1344, 1344, 64]
    - [3, 19452.2]
  - - [1408, 3008, 1, 64, 1408, 1408, 1408, 64]
    - [3, 19536.8]
  - - [1472, 3008, 1, 64, 1472, 1472, 1472, 64]
    - [9, 19986.9]
  - - [1536, 3008, 1, 64, 1536, 1536, 1536, 64]
    - [0, 19403.8]
  - - [1600, 3008, 1, 64, 1600, 1600, 1600, 64]
    - [0, 20910.8]
  - - [1664, 3008, 1, 64, 1664, 1664, 1664, 64]
    - [3, 20802.4]
  - - [1728, 3008, 1, 64, 1728, 1728, 1728, 64]
    - [3, 21280.5]
  - - [1792, 3008, 1, 64, 1792, 1792, 1792, 64]
    - [0, 21504.6]
  - - [1856, 3008, 1, 64, 1856, 1856, 1856, 64]
    - [3, 21534.4]
  - - [1920, 3008, 1, 64, 1920, 1920, 1920, 64]
    - [3, 21956.6]
  - - [1984, 3008, 1, 64, 1984, 1984, 1984, 64]
    - [3, 22258.8]
  - - [2048, 3008, 1, 64, 2048, 2048, 2048, 64]
    - [1, 21166.0]
  - - [2112, 3008, 1, 64, 2112, 2112, 2112, 64]
    - [3, 22778.9]
  - - [2176, 3008, 1, 64, 2176, 2176, 2176, 64]
    - [3, 23116.9]
  - - [2240, 3008, 1, 64, 2240, 2240, 2240, 64]
    - [3, 22898.4]
  - - [2304, 3008, 1, 64, 2304, 2304, 2304, 64]
    - [0, 22830.1]
  - - [2368, 3008, 1, 64, 2368, 2368, 2368, 64]
    - [3, 23617.4]
  - - [2432, 3008, 1, 64, 2432, 2432, 2432, 64]
    - [3, 24160.6]
  - - [2496, 3008, 1, 64, 2496, 2496, 2496, 64]
    - [3, 24144.7]
  - - [2560, 3008, 1, 64, 2560, 2560, 2560, 64]
    - [0, 23507.0]
  - - [2624, 3008, 1, 64, 2624, 2624, 2624, 64]
    - [3, 24712.4]
  - - [2688, 3008, 1, 64, 2688, 2688, 2688, 64]
    - [0, 24276.0]
  - - [2752, 3008, 1, 64, 2752, 2752, 2752, 64]
    - [0, 24926.4]
  - - [2816, 3008, 1, 64, 2816, 2816, 2816, 64]
    - [0, 24980.8]
  - - [2880, 3008, 1, 64, 2880, 2880, 2880, 64]
    - [0, 24750.2]
  - - [2944, 3008, 1, 64, 2944, 2944, 2944, 64]
    - [0, 25586.9]
  - - [3008, 3008, 1, 64, 3008, 3008, 3008, 64]
    - [0, 26368.1]
  - - [3072, 3008, 1, 64, 3072, 3072, 3072, 64]
    - [0, 23441.8]
  - - [3136, 3008, 1, 64, 3136, 3136, 3136, 64]
    - [0, 26144.8]
  - - [3200, 3008, 1, 64, 3200, 3200, 3200, 64]
    - [0, 25834.8]
  - - [3264, 3008, 1, 64, 3264, 3264, 3264, 64]
    - [0, 27336.2]
  - - [3328, 3008, 1, 64, 3328, 3328, 3328, 64]
    - [0, 26679.0]
  - - [3392, 3008, 1, 64, 3392, 3392, 3392, 64]
    - [0, 27350.5]
  - - [3456, 3008, 1, 64, 3456, 3456, 3456, 64]
    - [0, 27254.6]
  - - [3520, 3008, 1, 64, 3520, 3520, 3520, 64]
    - [0, 27081.6]
  - - [3584, 3008, 1, 64, 3584, 3584, 3584, 64]
    - [0, 26186.2]
  - - [3648, 3008, 1, 64, 3648, 3648, 3648, 64]
    - [0, 27082.5]
  - - [3712, 3008, 1, 64, 3712, 3712, 3712, 64]
    - [0, 27081.4]
  - - [3776, 3008, 1, 64, 3776, 3776, 3776, 64]
    - [0, 26335.7]
  - - [3840, 3008, 1, 64, 3840, 3840, 3840, 64]
    - [0, 26829.7]
  - - [3904, 3008, 1, 64, 3904, 3904, 3904, 64]
    - [9, 27312.4]
  - - [3968, 3008, 1, 64, 3968, 3968, 3968, 64]
    - [0, 27188.1]
  - - [4032, 3008, 1, 64, 4032, 4032, 4032, 64]
    - [0, 28667.4]
  - - [4096, 3008, 1, 64, 4096, 4096, 4096, 64]
    - [0, 25794.7]
  - - [64, 3072, 1, 64, 64, 64, 64, 64]
    - [4, 2450.87]
  - - [128, 3072, 1, 64, 128, 128, 128, 64]
    - [7, 4544.17]
  - - [192, 3072, 1, 64, 192, 192, 192, 64]
    - [11, 6300.83]
  - - [256, 3072, 1, 64, 256, 256, 256, 64]
    - [9, 7985.25]
  - - [320, 3072, 1, 64, 320, 320, 320, 64]
    - [9, 9892.11]
  - - [384, 3072, 1, 64, 384, 384, 384, 64]
    - [4, 10504.6]
  - - [448, 3072, 1, 64, 448, 448, 448, 64]
    - [9, 11880.1]
  - - [512, 3072, 1, 64, 512, 512, 512, 64]
    - [0, 12343.6]
  - - [576, 3072, 1, 64, 576, 576, 576, 64]
    - [0, 14011.9]
  - - [640, 3072, 1, 64, 640, 640, 640, 64]
    - [0, 14643.0]
  - - [704, 3072, 1, 64, 704, 704, 704, 64]
    - [0, 14897.2]
  - - [768, 3072, 1, 64, 768, 768, 768, 64]
    - [4, 15125.0]
  - - [832, 3072, 1, 64, 832, 832, 832, 64]
    - [0, 16429.9]
  - - [896, 3072, 1, 64, 896, 896, 896, 64]
    - [9, 16785.0]
  - - [960, 3072, 1, 64, 960, 960, 960, 64]
    - [9, 17513.3]
  - - [1024, 3072, 1, 64, 1024, 1024, 1024, 64]
    - [4, 16899.6]
  - - [1088, 3072, 1, 64, 1088, 1088, 1088, 64]
    - [0, 18039.0]
  - - [1152, 3072, 1, 64, 1152, 1152, 1152, 64]
    - [0, 18412.3]
  - - [1216, 3072, 1, 64, 1216, 1216, 1216, 64]
    - [0, 19092.2]
  - - [1280, 3072, 1, 64, 1280, 1280, 1280, 64]
    - [9, 19226.5]
  - - [1344, 3072, 1, 64, 1344, 1344, 1344, 64]
    - [3, 19685.5]
  - - [1408, 3072, 1, 64, 1408, 1408, 1408, 64]
    - [3, 19579.9]
  - - [1472, 3072, 1, 64, 1472, 1472, 1472, 64]
    - [0, 20169.0]
  - - [1536, 3072, 1, 64, 1536, 1536, 1536, 64]
    - [0, 19205.5]
  - - [1600, 3072, 1, 64, 1600, 1600, 1600, 64]
    - [3, 20814.4]
  - - [1664, 3072, 1, 64, 1664, 1664, 1664, 64]
    - [3, 20965.9]
  - - [1728, 3072, 1, 64, 1728, 1728, 1728, 64]
    - [3, 21556.9]
  - - [1792, 3072, 1, 64, 1792, 1792, 1792, 64]
    - [0, 21870.8]
  - - [1856, 3072, 1, 64, 1856, 1856, 1856, 64]
    - [3, 21744.8]
  - - [1920, 3072, 1, 64, 1920, 1920, 1920, 64]
    - [3, 22058.2]
  - - [1984, 3072, 1, 64, 1984, 1984, 1984, 64]
    - [3, 22497.8]
  - - [2048, 3072, 1, 64, 2048, 2048, 2048, 64]
    - [1, 21245.7]
  - - [2112, 3072, 1, 64, 2112, 2112, 2112, 64]
    - [0, 22953.6]
  - - [2176, 3072, 1, 64, 2176, 2176, 2176, 64]
    - [3, 23075.1]
  - - [2240, 3072, 1, 64, 2240, 2240, 2240, 64]
    - [3, 23180.0]
  - - [2304, 3072, 1, 64, 2304, 2304, 2304, 64]
    - [3, 22927.5]
  - - [2368, 3072, 1, 64, 2368, 2368, 2368, 64]
    - [3, 23576.3]
  - - [2432, 3072, 1, 64, 2432, 2432, 2432, 64]
    - [3, 23889.3]
  - - [2496, 3072, 1, 64, 2496, 2496, 2496, 64]
    - [3, 23837.9]
  - - [2560, 3072, 1, 64, 2560, 2560, 2560, 64]
    - [0, 23162.0]
  - - [2624, 3072, 1, 64, 2624, 2624, 2624, 64]
    - [0, 24014.1]
  - - [2688, 3072, 1, 64, 2688, 2688, 2688, 64]
    - [0, 24147.9]
  - - [2752, 3072, 1, 64, 2752, 2752, 2752, 64]
    - [0, 24708.1]
  - - [2816, 3072, 1, 64, 2816, 2816, 2816, 64]
    - [0, 24547.4]
  - - [2880, 3072, 1, 64, 2880, 2880, 2880, 64]
    - [0, 24649.6]
  - - [2944, 3072, 1, 64, 2944, 2944, 2944, 64]
    - [0, 25111.0]
  - - [3008, 3072, 1, 64, 3008, 3008, 3008, 64]
    - [0, 26190.8]
  - - [3072, 3072, 1, 64, 3072, 3072, 3072, 64]
    - [1, 23059.5]
  - - [3136, 3072, 1, 64, 3136, 3136, 3136, 64]
    - [0, 26305.9]
  - - [3200, 3072, 1, 64, 3200, 3200, 3200, 64]
    - [0, 26180.3]
  - - [3264, 3072, 1, 64, 3264, 3264, 3264, 64]
    - [0, 27353.8]
  - - [3328, 3072, 1, 64, 3328, 3328, 3328, 64]
    - [0, 26530.9]
  - - [3392, 3072, 1, 64, 3392, 3392, 3392, 64]
    - [0, 27322.4]
  - - [3456, 3072, 1, 64, 3456, 3456, 3456, 64]
    - [0, 26661.6]
  - - [3520, 3072, 1, 64, 3520, 3520, 3520, 64]
    - [0, 27140.4]
  - - [3584, 3072, 1, 64, 3584, 3584, 3584, 64]
    - [0, 25173.6]
  - - [3648, 3072, 1, 64, 3648, 3648, 3648, 64]
    - [0, 26978.3]
  - - [3712, 3072, 1, 64, 3712, 3712, 3712, 64]
    - [9, 27305.8]
  - - [3776, 3072, 1, 64, 3776, 3776, 3776, 64]
    - [0, 26330.3]
  - - [3840, 3072, 1, 64, 3840, 3840, 3840, 64]
    - [0, 27465.3]
  - - [3904, 3072, 1, 64, 3904, 3904, 3904, 64]
    - [0, 27117.1]
  - - [3968, 3072, 1, 64, 3968, 3968, 3968, 64]
    - [0, 28039.1]
  - - [4032, 3072, 1, 64, 4032, 4032, 4032, 64]
    - [0, 27241.9]
  - - [4096, 3072, 1, 64, 4096, 4096, 4096, 64]
    - [0, 25983.3]
  - - [64, 3136, 1, 64, 64, 64, 64, 64]
    - [15, 2432.75]
  - - [128, 3136, 1, 64, 128, 128, 128, 64]
    - [7, 4670.0]
  - - [192, 3136, 1, 64, 192, 192, 192, 64]
    - [0, 6441.8]
  - - [256, 3136, 1, 64, 256, 256, 256, 64]
    - [11, 7980.68]
  - - [320, 3136, 1, 64, 320, 320, 320, 64]
    - [4, 9450.31]
  - - [384, 3136, 1, 64, 384, 384, 384, 64]
    - [4, 10756.4]
  - - [448, 3136, 1, 64, 448, 448, 448, 64]
    - [9, 12001.4]
  - - [512, 3136, 1, 64, 512, 512, 512, 64]
    - [0, 12540.8]
  - - [576, 3136, 1, 64, 576, 576, 576, 64]
    - [0, 14149.8]
  - - [640, 3136, 1, 64, 640, 640, 640, 64]
    - [4, 14235.8]
  - - [704, 3136, 1, 64, 704, 704, 704, 64]
    - [0, 15114.9]
  - - [768, 3136, 1, 64, 768, 768, 768, 64]
    - [9, 15299.2]
  - - [832, 3136, 1, 64, 832, 832, 832, 64]
    - [0, 16551.0]
  - - [896, 3136, 1, 64, 896, 896, 896, 64]
    - [0, 17040.5]
  - - [960, 3136, 1, 64, 960, 960, 960, 64]
    - [3, 17047.7]
  - - [1024, 3136, 1, 64, 1024, 1024, 1024, 64]
    - [4, 17008.9]
  - - [1088, 3136, 1, 64, 1088, 1088, 1088, 64]
    - [0, 18172.7]
  - - [1152, 3136, 1, 64, 1152, 1152, 1152, 64]
    - [0, 18509.9]
  - - [1216, 3136, 1, 64, 1216, 1216, 1216, 64]
    - [0, 19135.4]
  - - [1280, 3136, 1, 64, 1280, 1280, 1280, 64]
    - [3, 19243.3]
  - - [1344, 3136, 1, 64, 1344, 1344, 1344, 64]
    - [3, 19820.9]
  - - [1408, 3136, 1, 64, 1408, 1408, 1408, 64]
    - [0, 19811.3]
  - - [1472, 3136, 1, 64, 1472, 1472, 1472, 64]
    - [0, 20311.6]
  - - [1536, 3136, 1, 64, 1536, 1536, 1536, 64]
    - [0, 19683.1]
  - - [1600, 3136, 1, 64, 1600, 1600, 1600, 64]
    - [3, 20872.5]
  - - [1664, 3136, 1, 64, 1664, 1664, 1664, 64]
    - [0, 21383.5]
  - - [1728, 3136, 1, 64, 1728, 1728, 1728, 64]
    - [3, 21758.7]
  - - [1792, 3136, 1, 64, 1792, 1792, 1792, 64]
    - [3, 21886.3]
  - - [1856, 3136, 1, 64, 1856, 1856, 1856, 64]
    - [0, 22031.2]
  - - [1920, 3136, 1, 64, 1920, 1920, 1920, 64]
    - [3, 22169.3]
  - - [1984, 3136, 1, 64, 1984, 1984, 1984, 64]
    - [3, 22652.8]
  - - [2048, 3136, 1, 64, 2048, 2048, 2048, 64]
    - [1, 21533.8]
  - - [2112, 3136, 1, 64, 2112, 2112, 2112, 64]
    - [3, 23101.0]
  - - [2176, 3136, 1, 64, 2176, 2176, 2176, 64]
    - [0, 23295.8]
  - - [2240, 3136, 1, 64, 2240, 2240, 2240, 64]
    - [3, 23284.2]
  - - [2304, 3136, 1, 64, 2304, 2304, 2304, 64]
    - [3, 23167.1]
  - - [2368, 3136, 1, 64, 2368, 2368, 2368, 64]
    - [3, 23786.9]
  - - [2432, 3136, 1, 64, 2432, 2432, 2432, 64]
    - [3, 24310.5]
  - - [2496, 3136, 1, 64, 2496, 2496, 2496, 64]
    - [3, 24247.4]
  - - [2560, 3136, 1, 64, 2560, 2560, 2560, 64]
    - [0, 23460.9]
  - - [2624, 3136, 1, 64, 2624, 2624, 2624, 64]
    - [0, 24650.9]
  - - [2688, 3136, 1, 64, 2688, 2688, 2688, 64]
    - [0, 23885.8]
  - - [2752, 3136, 1, 64, 2752, 2752, 2752, 64]
    - [0, 25480.1]
  - - [2816, 3136, 1, 64, 2816, 2816, 2816, 64]
    - [0, 25961.1]
  - - [2880, 3136, 1, 64, 2880, 2880, 2880, 64]
    - [0, 26018.2]
  - - [2944, 3136, 1, 64, 2944, 2944, 2944, 64]
    - [0, 26491.4]
  - - [3008, 3136, 1, 64, 3008, 3008, 3008, 64]
    - [0, 26636.3]
  - - [3072, 3136, 1, 64, 3072, 3072, 3072, 64]
    - [1, 22927.0]
  - - [3136, 3136, 1, 64, 3136, 3136, 3136, 64]
    - [0, 26294.0]
  - - [3200, 3136, 1, 64, 3200, 3200, 3200, 64]
    - [0, 26289.2]
  - - [3264, 3136, 1, 64, 3264, 3264, 3264, 64]
    - [0, 27082.1]
  - - [3328, 3136, 1, 64, 3328, 3328, 3328, 64]
    - [9, 25845.9]
  - - [3392, 3136, 1, 64, 3392, 3392, 3392, 64]
    - [0, 26926.4]
  - - [3456, 3136, 1, 64, 3456, 3456, 3456, 64]
    - [0, 27922.6]
  - - [3520, 3136, 1, 64, 3520, 3520, 3520, 64]
    - [0, 26626.1]
  - - [3584, 3136, 1, 64, 3584, 3584, 3584, 64]
    - [0, 26481.4]
  - - [3648, 3136, 1, 64, 3648, 3648, 3648, 64]
    - [0, 28475.4]
  - - [3712, 3136, 1, 64, 3712, 3712, 3712, 64]
    - [9, 27440.3]
  - - [3776, 3136, 1, 64, 3776, 3776, 3776, 64]
    - [0, 26670.7]
  - - [3840, 3136, 1, 64, 3840, 3840, 3840, 64]
    - [0, 27372.3]
  - - [3904, 3136, 1, 64, 3904, 3904, 3904, 64]
    - [0, 27296.2]
  - - [3968, 3136, 1, 64, 3968, 3968, 3968, 64]
    - [0, 26855.9]
  - - [4032, 3136, 1, 64, 4032, 4032, 4032, 64]
    - [0, 26631.6]
  - - [4096, 3136, 1, 64, 4096, 4096, 4096, 64]
    - [1, 22679.7]
  - - [64, 3200, 1, 64, 64, 64, 64, 64]
    - [6, 2481.91]
  - - [128, 3200, 1, 64, 128, 128, 128, 64]
    - [8, 4642.98]
  - - [192, 3200, 1, 64, 192, 192, 192, 64]
    - [6, 6399.92]
  - - [256, 3200, 1, 64, 256, 256, 256, 64]
    - [4, 8221.45]
  - - [320, 3200, 1, 64, 320, 320, 320, 64]
    - [9, 9588.16]
  - - [384, 3200, 1, 64, 384, 384, 384, 64]
    - [4, 10868.2]
  - - [448, 3200, 1, 64, 448, 448, 448, 64]
    - [9, 12116.9]
  - - [512, 3200, 1, 64, 512, 512, 512, 64]
    - [0, 12703.7]
  - - [576, 3200, 1, 64, 576, 576, 576, 64]
    - [0, 14333.3]
  - - [640, 3200, 1, 64, 640, 640, 640, 64]
    - [4, 14401.7]
  - - [704, 3200, 1, 64, 704, 704, 704, 64]
    - [0, 15234.3]
  - - [768, 3200, 1, 64, 768, 768, 768, 64]
    - [0, 15480.8]
  - - [832, 3200, 1, 64, 832, 832, 832, 64]
    - [0, 16669.0]
  - - [896, 3200, 1, 64, 896, 896, 896, 64]
    - [0, 17231.6]
  - - [960, 3200, 1, 64, 960, 960, 960, 64]
    - [9, 17223.5]
  - - [1024, 3200, 1, 64, 1024, 1024, 1024, 64]
    - [4, 17310.2]
  - - [1088, 3200, 1, 64, 1088, 1088, 1088, 64]
    - [0, 18260.9]
  - - [1152, 3200, 1, 64, 1152, 1152, 1152, 64]
    - [9, 18766.1]
  - - [1216, 3200, 1, 64, 1216, 1216, 1216, 64]
    - [0, 19324.5]
  - - [1280, 3200, 1, 64, 1280, 1280, 1280, 64]
    - [3, 19445.2]
  - - [1344, 3200, 1, 64, 1344, 1344, 1344, 64]
    - [3, 19884.9]
  - - [1408, 3200, 1, 64, 1408, 1408, 1408, 64]
    - [0, 20017.7]
  - - [1472, 3200, 1, 64, 1472, 1472, 1472, 64]
    - [9, 20608.6]
  - - [1536, 3200, 1, 64, 1536, 1536, 1536, 64]
    - [0, 19735.9]
  - - [1600, 3200, 1, 64, 1600, 1600, 1600, 64]
    - [3, 20978.0]
  - - [1664, 3200, 1, 64, 1664, 1664, 1664, 64]
    - [3, 21653.6]
  - - [1728, 3200, 1, 64, 1728, 1728, 1728, 64]
    - [3, 21847.8]
  - - [1792, 3200, 1, 64, 1792, 1792, 1792, 64]
    - [0, 22193.8]
  - - [1856, 3200, 1, 64, 1856, 1856, 1856, 64]
    - [3, 22330.2]
  - - [1920, 3200, 1, 64, 1920, 1920, 1920, 64]
    - [3, 22347.9]
  - - [1984, 3200, 1, 64, 1984, 1984, 1984, 64]
    - [3, 22868.0]
  - - [2048, 3200, 1, 64, 2048, 2048, 2048, 64]
    - [1, 21675.7]
  - - [2112, 3200, 1, 64, 2112, 2112, 2112, 64]
    - [3, 23437.1]
  - - [2176, 3200, 1, 64, 2176, 2176, 2176, 64]
    - [3, 23105.7]
  - - [2240, 3200, 1, 64, 2240, 2240, 2240, 64]
    - [3, 23095.5]
  - - [2304, 3200, 1, 64, 2304, 2304, 2304, 64]
    - [0, 23516.2]
  - - [2368, 3200, 1, 64, 2368, 2368, 2368, 64]
    - [3, 23608.2]
  - - [2432, 3200, 1, 64, 2432, 2432, 2432, 64]
    - [3, 24300.7]
  - - [2496, 3200, 1, 64, 2496, 2496, 2496, 64]
    - [3, 24771.0]
  - - [2560, 3200, 1, 64, 2560, 2560, 2560, 64]
    - [3, 23309.7]
  - - [2624, 3200, 1, 64, 2624, 2624, 2624, 64]
    - [0, 24584.3]
  - - [2688, 3200, 1, 64, 2688, 2688, 2688, 64]
    - [0, 25803.7]
  - - [2752, 3200, 1, 64, 2752, 2752, 2752, 64]
    - [0, 26302.2]
  - - [2816, 3200, 1, 64, 2816, 2816, 2816, 64]
    - [0, 24751.5]
  - - [2880, 3200, 1, 64, 2880, 2880, 2880, 64]
    - [0, 26018.6]
  - - [2944, 3200, 1, 64, 2944, 2944, 2944, 64]
    - [0, 26693.5]
  - - [3008, 3200, 1, 64, 3008, 3008, 3008, 64]
    - [0, 26205.1]
  - - [3072, 3200, 1, 64, 3072, 3072, 3072, 64]
    - [0, 24354.1]
  - - [3136, 3200, 1, 64, 3136, 3136, 3136, 64]
    - [0, 26521.5]
  - - [3200, 3200, 1, 64, 3200, 3200, 3200, 64]
    - [0, 27123.2]
  - - [3264, 3200, 1, 64, 3264, 3264, 3264, 64]
    - [0, 27713.9]
  - - [3328, 3200, 1, 64, 3328, 3328, 3328, 64]
    - [0, 26781.6]
  - - [3392, 3200, 1, 64, 3392, 3392, 3392, 64]
    - [0, 27727.1]
  - - [3456, 3200, 1, 64, 3456, 3456, 3456, 64]
    - [0, 27963.4]
  - - [3520, 3200, 1, 64, 3520, 3520, 3520, 64]
    - [0, 28456.4]
  - - [3584, 3200, 1, 64, 3584, 3584, 3584, 64]
    - [0, 26179.5]
  - - [3648, 3200, 1, 64, 3648, 3648, 3648, 64]
    - [0, 28063.3]
  - - [3712, 3200, 1, 64, 3712, 3712, 3712, 64]
    - [9, 26753.8]
  - - [3776, 3200, 1, 64, 3776, 3776, 3776, 64]
    - [0, 27302.5]
  - - [3840, 3200, 1, 64, 3840, 3840, 3840, 64]
    - [0, 27304.4]
  - - [3904, 3200, 1, 64, 3904, 3904, 3904, 64]
    - [9, 27025.7]
  - - [3968, 3200, 1, 64, 3968, 3968, 3968, 64]
    - [0, 25780.8]
  - - [4032, 3200, 1, 64, 4032, 4032, 4032, 64]
    - [0, 22398.5]
  - - [4096, 3200, 1, 64, 4096, 4096, 4096, 64]
    - [1, 17538.2]
  - - [64, 3264, 1, 64, 64, 64, 64, 64]
    - [7, 2574.48]
  - - [128, 3264, 1, 64, 128, 128, 128, 64]
    - [4, 4858.89]
  - - [192, 3264, 1, 64, 192, 192, 192, 64]
    - [4, 6741.95]
  - - [256, 3264, 1, 64, 256, 256, 256, 64]
    - [4, 8276.79]
  - - [320, 3264, 1, 64, 320, 320, 320, 64]
    - [9, 9772.91]
  - - [384, 3264, 1, 64, 384, 384, 384, 64]
    - [0, 11056.5]
  - - [448, 3264, 1, 64, 448, 448, 448, 64]
    - [9, 12291.1]
  - - [512, 3264, 1, 64, 512, 512, 512, 64]
    - [0, 12854.9]
  - - [576, 3264, 1, 64, 576, 576, 576, 64]
    - [0, 14486.3]
  - - [640, 3264, 1, 64, 640, 640, 640, 64]
    - [9, 14517.5]
  - - [704, 3264, 1, 64, 704, 704, 704, 64]
    - [0, 15366.9]
  - - [768, 3264, 1, 64, 768, 768, 768, 64]
    - [0, 15688.4]
  - - [832, 3264, 1, 64, 832, 832, 832, 64]
    - [0, 16740.5]
  - - [896, 3264, 1, 64, 896, 896, 896, 64]
    - [0, 17569.6]
  - - [960, 3264, 1, 64, 960, 960, 960, 64]
    - [3, 17277.3]
  - - [1024, 3264, 1, 64, 1024, 1024, 1024, 64]
    - [4, 17386.6]
  - - [1088, 3264, 1, 64, 1088, 1088, 1088, 64]
    - [0, 18382.1]
  - - [1152, 3264, 1, 64, 1152, 1152, 1152, 64]
    - [0, 18858.0]
  - - [1216, 3264, 1, 64, 1216, 1216, 1216, 64]
    - [4, 19044.4]
  - - [1280, 3264, 1, 64, 1280, 1280, 1280, 64]
    - [3, 19711.3]
  - - [1344, 3264, 1, 64, 1344, 1344, 1344, 64]
    - [3, 20129.9]
  - - [1408, 3264, 1, 64, 1408, 1408, 1408, 64]
    - [3, 20266.1]
  - - [1472, 3264, 1, 64, 1472, 1472, 1472, 64]
    - [0, 20699.5]
  - - [1536, 3264, 1, 64, 1536, 1536, 1536, 64]
    - [0, 19833.2]
  - - [1600, 3264, 1, 64, 1600, 1600, 1600, 64]
    - [3, 21233.0]
  - - [1664, 3264, 1, 64, 1664, 1664, 1664, 64]
    - [0, 21655.9]
  - - [1728, 3264, 1, 64, 1728, 1728, 1728, 64]
    - [3, 22145.2]
  - - [1792, 3264, 1, 64, 1792, 1792, 1792, 64]
    - [0, 22268.8]
  - - [1856, 3264, 1, 64, 1856, 1856, 1856, 64]
    - [3, 22310.2]
  - - [1920, 3264, 1, 64, 1920, 1920, 1920, 64]
    - [3, 22449.1]
  - - [1984, 3264, 1, 64, 1984, 1984, 1984, 64]
    - [3, 22933.0]
  - - [2048, 3264, 1, 64, 2048, 2048, 2048, 64]
    - [1, 21692.2]
  - - [2112, 3264, 1, 64, 2112, 2112, 2112, 64]
    - [3, 23491.0]
  - - [2176, 3264, 1, 64, 2176, 2176, 2176, 64]
    - [3, 23714.2]
  - - [2240, 3264, 1, 64, 2240, 2240, 2240, 64]
    - [3, 23517.1]
  - - [2304, 3264, 1, 64, 2304, 2304, 2304, 64]
    - [0, 23633.2]
  - - [2368, 3264, 1, 64, 2368, 2368, 2368, 64]
    - [3, 24393.9]
  - - [2432, 3264, 1, 64, 2432, 2432, 2432, 64]
    - [3, 24234.6]
  - - [2496, 3264, 1, 64, 2496, 2496, 2496, 64]
    - [3, 24863.9]
  - - [2560, 3264, 1, 64, 2560, 2560, 2560, 64]
    - [0, 23450.6]
  - - [2624, 3264, 1, 64, 2624, 2624, 2624, 64]
    - [3, 25116.2]
  - - [2688, 3264, 1, 64, 2688, 2688, 2688, 64]
    - [0, 24506.0]
  - - [2752, 3264, 1, 64, 2752, 2752, 2752, 64]
    - [0, 26380.0]
  - - [2816, 3264, 1, 64, 2816, 2816, 2816, 64]
    - [3, 25598.1]
  - - [2880, 3264, 1, 64, 2880, 2880, 2880, 64]
    - [0, 25151.1]
  - - [2944, 3264, 1, 64, 2944, 2944, 2944, 64]
    - [0, 26125.0]
  - - [3008, 3264, 1, 64, 3008, 3008, 3008, 64]
    - [0, 26227.3]
  - - [3072, 3264, 1, 64, 3072, 3072, 3072, 64]
    - [0, 23249.9]
  - - [3136, 3264, 1, 64, 3136, 3136, 3136, 64]
    - [0, 25931.8]
  - - [3200, 3264, 1, 64, 3200, 3200, 3200, 64]
    - [0, 26921.5]
  - - [3264, 3264, 1, 64, 3264, 3264, 3264, 64]
    - [0, 27084.6]
  - - [3328, 3264, 1, 64, 3328, 3328, 3328, 64]
    - [0, 27259.5]
  - - [3392, 3264, 1, 64, 3392, 3392, 3392, 64]
    - [0, 27609.3]
  - - [3456, 3264, 1, 64, 3456, 3456, 3456, 64]
    - [9, 27300.6]
  - - [3520, 3264, 1, 64, 3520, 3520, 3520, 64]
    - [0, 27121.0]
  - - [3584, 3264, 1, 64, 3584, 3584, 3584, 64]
    - [0, 26129.9]
  - - [3648, 3264, 1, 64, 3648, 3648, 3648, 64]
    - [0, 28296.2]
  - - [3712, 3264, 1, 64, 3712, 3712, 3712, 64]
    - [9, 26966.1]
  - - [3776, 3264, 1, 64, 3776, 3776, 3776, 64]
    - [0, 26714.0]
  - - [3840, 3264, 1, 64, 3840, 3840, 3840, 64]
    - [0, 26791.0]
  - - [3904, 3264, 1, 64, 3904, 3904, 3904, 64]
    - [0, 26330.1]
  - - [3968, 3264, 1, 64, 3968, 3968, 3968, 64]
    - [0, 21790.5]
  - - [4032, 3264, 1, 64, 4032, 4032, 4032, 64]
    - [0, 16661.2]
  - - [4096, 3264, 1, 64, 4096, 4096, 4096, 64]
    - [0, 13802.2]
  - - [64, 3328, 1, 64, 64, 64, 64, 64]
    - [6, 2789.88]
  - - [128, 3328, 1, 64, 128, 128, 128, 64]
    - [7, 5090.06]
  - - [192, 3328, 1, 64, 192, 192, 192, 64]
    - [0, 7013.16]
  - - [256, 3328, 1, 64, 256, 256, 256, 64]
    - [0, 8711.5]
  - - [320, 3328, 1, 64, 320, 320, 320, 64]
    - [9, 9946.94]
  - - [384, 3328, 1, 64, 384, 384, 384, 64]
    - [0, 11261.0]
  - - [448, 3328, 1, 64, 448, 448, 448, 64]
    - [0, 12310.6]
  - - [512, 3328, 1, 64, 512, 512, 512, 64]
    - [0, 13050.6]
  - - [576, 3328, 1, 64, 576, 576, 576, 64]
    - [0, 14556.5]
  - - [640, 3328, 1, 64, 640, 640, 640, 64]
    - [9, 14607.1]
  - - [704, 3328, 1, 64, 704, 704, 704, 64]
    - [0, 15494.9]
  - - [768, 3328, 1, 64, 768, 768, 768, 64]
    - [0, 15960.2]
  - - [832, 3328, 1, 64, 832, 832, 832, 64]
    - [0, 16833.6]
  - - [896, 3328, 1, 64, 896, 896, 896, 64]
    - [4, 17091.0]
  - - [960, 3328, 1, 64, 960, 960, 960, 64]
    - [0, 17477.6]
  - - [1024, 3328, 1, 64, 1024, 1024, 1024, 64]
    - [4, 17453.7]
  - - [1088, 3328, 1, 64, 1088, 1088, 1088, 64]
    - [0, 18592.1]
  - - [1152, 3328, 1, 64, 1152, 1152, 1152, 64]
    - [0, 19041.1]
  - - [1216, 3328, 1, 64, 1216, 1216, 1216, 64]
    - [3, 19174.8]
  - - [1280, 3328, 1, 64, 1280, 1280, 1280, 64]
    - [3, 19784.2]
  - - [1344, 3328, 1, 64, 1344, 1344, 1344, 64]
    - [3, 20330.8]
  - - [1408, 3328, 1, 64, 1408, 1408, 1408, 64]
    - [0, 20410.3]
  - - [1472, 3328, 1, 64, 1472, 1472, 1472, 64]
    - [3, 20723.1]
  - - [1536, 3328, 1, 64, 1536, 1536, 1536, 64]
    - [0, 19850.3]
  - - [1600, 3328, 1, 64, 1600, 1600, 1600, 64]
    - [3, 21442.3]
  - - [1664, 3328, 1, 64, 1664, 1664, 1664, 64]
    - [0, 21812.8]
  - - [1728, 3328, 1, 64, 1728, 1728, 1728, 64]
    - [0, 22218.3]
  - - [1792, 3328, 1, 64, 1792, 1792, 1792, 64]
    - [0, 22234.4]
  - - [1856, 3328, 1, 64, 1856, 1856, 1856, 64]
    - [0, 22454.3]
  - - [1920, 3328, 1, 64, 1920, 1920, 1920, 64]
    - [3, 22542.3]
  - - [1984, 3328, 1, 64, 1984, 1984, 1984, 64]
    - [3, 22748.2]
  - - [2048, 3328, 1, 64, 2048, 2048, 2048, 64]
    - [1, 21816.7]
  - - [2112, 3328, 1, 64, 2112, 2112, 2112, 64]
    - [3, 23381.3]
  - - [2176, 3328, 1, 64, 2176, 2176, 2176, 64]
    - [3, 23500.0]
  - - [2240, 3328, 1, 64, 2240, 2240, 2240, 64]
    - [3, 23633.8]
  - - [2304, 3328, 1, 64, 2304, 2304, 2304, 64]
    - [0, 23369.0]
  - - [2368, 3328, 1, 64, 2368, 2368, 2368, 64]
    - [3, 23798.4]
  - - [2432, 3328, 1, 64, 2432, 2432, 2432, 64]
    - [3, 24557.4]
  - - [2496, 3328, 1, 64, 2496, 2496, 2496, 64]
    - [3, 24851.4]
  - - [2560, 3328, 1, 64, 2560, 2560, 2560, 64]
    - [0, 23565.2]
  - - [2624, 3328, 1, 64, 2624, 2624, 2624, 64]
    - [0, 25295.7]
  - - [2688, 3328, 1, 64, 2688, 2688, 2688, 64]
    - [0, 24564.1]
  - - [2752, 3328, 1, 64, 2752, 2752, 2752, 64]
    - [0, 25826.0]
  - - [2816, 3328, 1, 64, 2816, 2816, 2816, 64]
    - [0, 25511.6]
  - - [2880, 3328, 1, 64, 2880, 2880, 2880, 64]
    - [0, 26773.6]
  - - [2944, 3328, 1, 64, 2944, 2944, 2944, 64]
    - [0, 26125.6]
  - - [3008, 3328, 1, 64, 3008, 3008, 3008, 64]
    - [0, 27086.3]
  - - [3072, 3328, 1, 64, 3072, 3072, 3072, 64]
    - [1, 23424.1]
  - - [3136, 3328, 1, 64, 3136, 3136, 3136, 64]
    - [0, 26784.9]
  - - [3200, 3328, 1, 64, 3200, 3200, 3200, 64]
    - [0, 25701.0]
  - - [3264, 3328, 1, 64, 3264, 3264, 3264, 64]
    - [0, 27060.9]
  - - [3328, 3328, 1, 64, 3328, 3328, 3328, 64]
    - [0, 28269.5]
  - - [3392, 3328, 1, 64, 3392, 3392, 3392, 64]
    - [9, 28013.2]
  - - [3456, 3328, 1, 64, 3456, 3456, 3456, 64]
    - [0, 27342.6]
  - - [3520, 3328, 1, 64, 3520, 3520, 3520, 64]
    - [0, 27002.5]
  - - [3584, 3328, 1, 64, 3584, 3584, 3584, 64]
    - [0, 26668.3]
  - - [3648, 3328, 1, 64, 3648, 3648, 3648, 64]
    - [0, 28042.9]
  - - [3712, 3328, 1, 64, 3712, 3712, 3712, 64]
    - [9, 26999.2]
  - - [3776, 3328, 1, 64, 3776, 3776, 3776, 64]
    - [0, 26751.2]
  - - [3840, 3328, 1, 64, 3840, 3840, 3840, 64]
    - [0, 25139.2]
  - - [3904, 3328, 1, 64, 3904, 3904, 3904, 64]
    - [0, 20677.2]
  - - [3968, 3328, 1, 64, 3968, 3968, 3968, 64]
    - [0, 16594.5]
  - - [4032, 3328, 1, 64, 4032, 4032, 4032, 64]
    - [0, 13484.9]
  - - [4096, 3328, 1, 64, 4096, 4096, 4096, 64]
    - [1, 13312.0]
  - - [64, 3392, 1, 64, 64, 64, 64, 64]
    - [6, 2814.16]
  - - [128, 3392, 1, 64, 128, 128, 128, 64]
    - [4, 5068.75]
  - - [192, 3392, 1, 64, 192, 192, 192, 64]
    - [9, 6946.73]
  - - [256, 3392, 1, 64, 256, 256, 256, 64]
    - [11, 8771.09]
  - - [320, 3392, 1, 64, 320, 320, 320, 64]
    - [0, 10101.4]
  - - [384, 3392, 1, 64, 384, 384, 384, 64]
    - [0, 11477.5]
  - - [448, 3392, 1, 64, 448, 448, 448, 64]
    - [0, 12524.6]
  - - [512, 3392, 1, 64, 512, 512, 512, 64]
    - [0, 13156.7]
  - - [576, 3392, 1, 64, 576, 576, 576, 64]
    - [0, 14703.8]
  - - [640, 3392, 1, 64, 640, 640, 640, 64]
    - [4, 14764.5]
  - - [704, 3392, 1, 64, 704, 704, 704, 64]
    - [0, 15620.2]
  - - [768, 3392, 1, 64, 768, 768, 768, 64]
    - [0, 16095.9]
  - - [832, 3392, 1, 64, 832, 832, 832, 64]
    - [0, 17085.9]
  - - [896, 3392, 1, 64, 896, 896, 896, 64]
    - [4, 17096.6]
  - - [960, 3392, 1, 64, 960, 960, 960, 64]
    - [0, 17677.7]
  - - [1024, 3392, 1, 64, 1024, 1024, 1024, 64]
    - [4, 17450.1]
  - - [1088, 3392, 1, 64, 1088, 1088, 1088, 64]
    - [9, 18889.0]
  - - [1152, 3392, 1, 64, 1152, 1152, 1152, 64]
    - [0, 19237.1]
  - - [1216, 3392, 1, 64, 1216, 1216, 1216, 64]
    - [3, 19365.9]
  - - [1280, 3392, 1, 64, 1280, 1280, 1280, 64]
    - [3, 19832.2]
  - - [1344, 3392, 1, 64, 1344, 1344, 1344, 64]
    - [3, 20539.4]
  - - [1408, 3392, 1, 64, 1408, 1408, 1408, 64]
    - [9, 20551.0]
  - - [1472, 3392, 1, 64, 1472, 1472, 1472, 64]
    - [3, 20713.6]
  - - [1536, 3392, 1, 64, 1536, 1536, 1536, 64]
    - [0, 20070.0]
  - - [1600, 3392, 1, 64, 1600, 1600, 1600, 64]
    - [3, 21506.9]
  - - [1664, 3392, 1, 64, 1664, 1664, 1664, 64]
    - [0, 21914.0]
  - - [1728, 3392, 1, 64, 1728, 1728, 1728, 64]
    - [3, 22281.0]
  - - [1792, 3392, 1, 64, 1792, 1792, 1792, 64]
    - [0, 22357.3]
  - - [1856, 3392, 1, 64, 1856, 1856, 1856, 64]
    - [3, 22437.6]
  - - [1920, 3392, 1, 64, 1920, 1920, 1920, 64]
    - [3, 22493.4]
  - - [1984, 3392, 1, 64, 1984, 1984, 1984, 64]
    - [3, 23014.7]
  - - [2048, 3392, 1, 64, 2048, 2048, 2048, 64]
    - [1, 21793.7]
  - - [2112, 3392, 1, 64, 2112, 2112, 2112, 64]
    - [3, 23429.1]
  - - [2176, 3392, 1, 64, 2176, 2176, 2176, 64]
    - [3, 23322.7]
  - - [2240, 3392, 1, 64, 2240, 2240, 2240, 64]
    - [3, 23404.3]
  - - [2304, 3392, 1, 64, 2304, 2304, 2304, 64]
    - [0, 23273.3]
  - - [2368, 3392, 1, 64, 2368, 2368, 2368, 64]
    - [3, 24426.7]
  - - [2432, 3392, 1, 64, 2432, 2432, 2432, 64]
    - [3, 24446.7]
  - - [2496, 3392, 1, 64, 2496, 2496, 2496, 64]
    - [0, 24044.6]
  - - [2560, 3392, 1, 64, 2560, 2560, 2560, 64]
    - [0, 23894.5]
  - - [2624, 3392, 1, 64, 2624, 2624, 2624, 64]
    - [0, 25548.6]
  - - [2688, 3392, 1, 64, 2688, 2688, 2688, 64]
    - [0, 24442.8]
  - - [2752, 3392, 1, 64, 2752, 2752, 2752, 64]
    - [0, 26792.5]
  - - [2816, 3392, 1, 64, 2816, 2816, 2816, 64]
    - [0, 25302.7]
  - - [2880, 3392, 1, 64, 2880, 2880, 2880, 64]
    - [0, 26593.2]
  - - [2944, 3392, 1, 64, 2944, 2944, 2944, 64]
    - [0, 26710.4]
  - - [3008, 3392, 1, 64, 3008, 3008, 3008, 64]
    - [0, 27005.5]
  - - [3072, 3392, 1, 64, 3072, 3072, 3072, 64]
    - [0, 24180.1]
  - - [3136, 3392, 1, 64, 3136, 3136, 3136, 64]
    - [0, 26872.1]
  - - [3200, 3392, 1, 64, 3200, 3200, 3200, 64]
    - [0, 26909.7]
  - - [3264, 3392, 1, 64, 3264, 3264, 3264, 64]
    - [0, 28947.1]
  - - [3328, 3392, 1, 64, 3328, 3328, 3328, 64]
    - [0, 28204.6]
  - - [3392, 3392, 1, 64, 3392, 3392, 3392, 64]
    - [0, 27938.7]
  - - [3456, 3392, 1, 64, 3456, 3456, 3456, 64]
    - [0, 27138.6]
  - - [3520, 3392, 1, 64, 3520, 3520, 3520, 64]
    - [9, 27735.5]
  - - [3584, 3392, 1, 64, 3584, 3584, 3584, 64]
    - [0, 26526.0]
  - - [3648, 3392, 1, 64, 3648, 3648, 3648, 64]
    - [0, 28157.4]
  - - [3712, 3392, 1, 64, 3712, 3712, 3712, 64]
    - [0, 26549.2]
  - - [3776, 3392, 1, 64, 3776, 3776, 3776, 64]
    - [0, 24281.3]
  - - [3840, 3392, 1, 64, 3840, 3840, 3840, 64]
    - [0, 19319.3]
  - - [3904, 3392, 1, 64, 3904, 3904, 3904, 64]
    - [0, 15660.6]
  - - [3968, 3392, 1, 64, 3968, 3968, 3968, 64]
    - [0, 13728.7]
  - - [4032, 3392, 1, 64, 4032, 4032, 4032, 64]
    - [0, 12916.9]
  - - [4096, 3392, 1, 64, 4096, 4096, 4096, 64]
    - [1, 13049.5]
  - - [64, 3456, 1, 64, 64, 64, 64, 64]
    - [7, 2889.48]
  - - [128, 3456, 1, 64, 128, 128, 128, 64]
    - [4, 5244.77]
  - - [192, 3456, 1, 64, 192, 192, 192, 64]
    - [0, 7287.93]
  - - [256, 3456, 1, 64, 256, 256, 256, 64]
    - [0, 8936.59]
  - - [320, 3456, 1, 64, 320, 320, 320, 64]
    - [9, 10182.4]
  - - [384, 3456, 1, 64, 384, 384, 384, 64]
    - [0, 11609.3]
  - - [448, 3456, 1, 64, 448, 448, 448, 64]
    - [0, 12664.8]
  - - [512, 3456, 1, 64, 512, 512, 512, 64]
    - [0, 13346.5]
  - - [576, 3456, 1, 64, 576, 576, 576, 64]
    - [4, 14158.7]
  - - [640, 3456, 1, 64, 640, 640, 640, 64]
    - [0, 14981.1]
  - - [704, 3456, 1, 64, 704, 704, 704, 64]
    - [0, 15816.3]
  - - [768, 3456, 1, 64, 768, 768, 768, 64]
    - [0, 16148.6]
  - - [832, 3456, 1, 64, 832, 832, 832, 64]
    - [0, 17342.6]
  - - [896, 3456, 1, 64, 896, 896, 896, 64]
    - [4, 17445.3]
  - - [960, 3456, 1, 64, 960, 960, 960, 64]
    - [0, 17804.3]
  - - [1024, 3456, 1, 64, 1024, 1024, 1024, 64]
    - [4, 17693.1]
  - - [1088, 3456, 1, 64, 1088, 1088, 1088, 64]
    - [0, 19041.4]
  - - [1152, 3456, 1, 64, 1152, 1152, 1152, 64]
    - [9, 18874.2]
  - - [1216, 3456, 1, 64, 1216, 1216, 1216, 64]
    - [3, 19549.1]
  - - [1280, 3456, 1, 64, 1280, 1280, 1280, 64]
    - [3, 20076.0]
  - - [1344, 3456, 1, 64, 1344, 1344, 1344, 64]
    - [3, 20660.8]
  - - [1408, 3456, 1, 64, 1408, 1408, 1408, 64]
    - [9, 20661.0]
  - - [1472, 3456, 1, 64, 1472, 1472, 1472, 64]
    - [9, 20855.8]
  - - [1536, 3456, 1, 64, 1536, 1536, 1536, 64]
    - [0, 20193.4]
  - - [1600, 3456, 1, 64, 1600, 1600, 1600, 64]
    - [3, 21626.2]
  - - [1664, 3456, 1, 64, 1664, 1664, 1664, 64]
    - [0, 21972.9]
  - - [1728, 3456, 1, 64, 1728, 1728, 1728, 64]
    - [3, 22241.8]
  - - [1792, 3456, 1, 64, 1792, 1792, 1792, 64]
    - [0, 22434.9]
  - - [1856, 3456, 1, 64, 1856, 1856, 1856, 64]
    - [0, 22602.9]
  - - [1920, 3456, 1, 64, 1920, 1920, 1920, 64]
    - [3, 22367.4]
  - - [1984, 3456, 1, 64, 1984, 1984, 1984, 64]
    - [3, 23166.7]
  - - [2048, 3456, 1, 64, 2048, 2048, 2048, 64]
    - [1, 22042.8]
  - - [2112, 3456, 1, 64, 2112, 2112, 2112, 64]
    - [3, 23537.9]
  - - [2176, 3456, 1, 64, 2176, 2176, 2176, 64]
    - [3, 23798.0]
  - - [2240, 3456, 1, 64, 2240, 2240, 2240, 64]
    - [0, 23541.1]
  - - [2304, 3456, 1, 64, 2304, 2304, 2304, 64]
    - [0, 23798.7]
  - - [2368, 3456, 1, 64, 2368, 2368, 2368, 64]
    - [3, 24642.7]
  - - [2432, 3456, 1, 64, 2432, 2432, 2432, 64]
    - [0, 24503.0]
  - - [2496, 3456, 1, 64, 2496, 2496, 2496, 64]
    - [0, 24351.3]
  - - [2560, 3456, 1, 64, 2560, 2560, 2560, 64]
    - [1, 23824.0]
  - - [2624, 3456, 1, 64, 2624, 2624, 2624, 64]
    - [0, 25238.3]
  - - [2688, 3456, 1, 64, 2688, 2688, 2688, 64]
    - [0, 25505.6]
  - - [2752, 3456, 1, 64, 2752, 2752, 2752, 64]
    - [0, 26401.7]
  - - [2816, 3456, 1, 64, 2816, 2816, 2816, 64]
    - [0, 26444.5]
  - - [2880, 3456, 1, 64, 2880, 2880, 2880, 64]
    - [0, 26939.1]
  - - [2944, 3456, 1, 64, 2944, 2944, 2944, 64]
    - [0, 26212.0]
  - - [3008, 3456, 1, 64, 3008, 3008, 3008, 64]
    - [0, 26424.4]
  - - [3072, 3456, 1, 64, 3072, 3072, 3072, 64]
    - [0, 23932.6]
  - - [3136, 3456, 1, 64, 3136, 3136, 3136, 64]
    - [0, 26922.3]
  - - [3200, 3456, 1, 64, 3200, 3200, 3200, 64]
    - [0, 26953.8]
  - - [3264, 3456, 1, 64, 3264, 3264, 3264, 64]
    - [0, 27390.7]
  - - [3328, 3456, 1, 64, 3328, 3328, 3328, 64]
    - [0, 27224.3]
  - - [3392, 3456, 1, 64, 3392, 3392, 3392, 64]
    - [0, 27573.5]
  - - [3456, 3456, 1, 64, 3456, 3456, 3456, 64]
    - [0, 27383.2]
  - - [3520, 3456, 1, 64, 3520, 3520, 3520, 64]
    - [0, 27957.4]
  - - [3584, 3456, 1, 64, 3584, 3584, 3584, 64]
    - [0, 26384.3]
  - - [3648, 3456, 1, 64, 3648, 3648, 3648, 64]
    - [0, 28062.0]
  - - [3712, 3456, 1, 64, 3712, 3712, 3712, 64]
    - [0, 24978.0]
  - - [3776, 3456, 1, 64, 3776, 3776, 3776, 64]
    - [0, 18301.7]
  - - [3840, 3456, 1, 64, 3840, 3840, 3840, 64]
    - [0, 14747.5]
  - - [3904, 3456, 1, 64, 3904, 3904, 3904, 64]
    - [0, 13416.8]
  - - [3968, 3456, 1, 64, 3968, 3968, 3968, 64]
    - [0, 13090.0]
  - - [4032, 3456, 1, 64, 4032, 4032, 4032, 64]
    - [0, 12387.4]
  - - [4096, 3456, 1, 64, 4096, 4096, 4096, 64]
    - [1, 12877.7]
  - - [64, 3520, 1, 64, 64, 64, 64, 64]
    - [4, 3020.04]
  - - [128, 3520, 1, 64, 128, 128, 128, 64]
    - [7, 5324.12]
  - - [192, 3520, 1, 64, 192, 192, 192, 64]
    - [0, 7100.03]
  - - [256, 3520, 1, 64, 256, 256, 256, 64]
    - [9, 9154.09]
  - - [320, 3520, 1, 64, 320, 320, 320, 64]
    - [9, 10301.4]
  - - [384, 3520, 1, 64, 384, 384, 384, 64]
    - [0, 11782.4]
  - - [448, 3520, 1, 64, 448, 448, 448, 64]
    - [0, 12855.0]
  - - [512, 3520, 1, 64, 512, 512, 512, 64]
    - [0, 13545.7]
  - - [576, 3520, 1, 64, 576, 576, 576, 64]
    - [4, 14308.0]
  - - [640, 3520, 1, 64, 640, 640, 640, 64]
    - [0, 15114.5]
  - - [704, 3520, 1, 64, 704, 704, 704, 64]
    - [0, 16005.1]
  - - [768, 3520, 1, 64, 768, 768, 768, 64]
    - [0, 16177.0]
  - - [832, 3520, 1, 64, 832, 832, 832, 64]
    - [0, 17609.1]
  - - [896, 3520, 1, 64, 896, 896, 896, 64]
    - [4, 17385.8]
  - - [960, 3520, 1, 64, 960, 960, 960, 64]
    - [0, 17977.3]
  - - [1024, 3520, 1, 64, 1024, 1024, 1024, 64]
    - [1, 17705.4]
  - - [1088, 3520, 1, 64, 1088, 1088, 1088, 64]
    - [0, 19211.7]
  - - [1152, 3520, 1, 64, 1152, 1152, 1152, 64]
    - [0, 19006.9]
  - - [1216, 3520, 1, 64, 1216, 1216, 1216, 64]
    - [0, 19631.4]
  - - [1280, 3520, 1, 64, 1280, 1280, 1280, 64]
    - [3, 20143.5]
  - - [1344, 3520, 1, 64, 1344, 1344, 1344, 64]
    - [3, 20692.5]
  - - [1408, 3520, 1, 64, 1408, 1408, 1408, 64]
    - [3, 20639.7]
  - - [1472, 3520, 1, 64, 1472, 1472, 1472, 64]
    - [3, 20966.6]
  - - [1536, 3520, 1, 64, 1536, 1536, 1536, 64]
    - [0, 20183.4]
  - - [1600, 3520, 1, 64, 1600, 1600, 1600, 64]
    - [3, 21825.2]
  - - [1664, 3520, 1, 64, 1664, 1664, 1664, 64]
    - [0, 22017.0]
  - - [1728, 3520, 1, 64, 1728, 1728, 1728, 64]
    - [3, 22517.3]
  - - [1792, 3520, 1, 64, 1792, 1792, 1792, 64]
    - [3, 22475.0]
  - - [1856, 3520, 1, 64, 1856, 1856, 1856, 64]
    - [3, 22783.1]
  - - [1920, 3520, 1, 64, 1920, 1920, 1920, 64]
    - [3, 22843.1]
  - - [1984, 3520, 1, 64, 1984, 1984, 1984, 64]
    - [3, 23261.8]
  - - [2048, 3520, 1, 64, 2048, 2048, 2048, 64]
    - [1, 22275.4]
  - - [2112, 3520, 1, 64, 2112, 2112, 2112, 64]
    - [3, 23703.9]
  - - [2176, 3520, 1, 64, 2176, 2176, 2176, 64]
    - [3, 24030.8]
  - - [2240, 3520, 1, 64, 2240, 2240, 2240, 64]
    - [3, 23739.0]
  - - [2304, 3520, 1, 64, 2304, 2304, 2304, 64]
    - [0, 23980.8]
  - - [2368, 3520, 1, 64, 2368, 2368, 2368, 64]
    - [0, 24304.4]
  - - [2432, 3520, 1, 64, 2432, 2432, 2432, 64]
    - [3, 24383.6]
  - - [2496, 3520, 1, 64, 2496, 2496, 2496, 64]
    - [0, 24989.6]
  - - [2560, 3520, 1, 64, 2560, 2560, 2560, 64]
    - [1, 23716.3]
  - - [2624, 3520, 1, 64, 2624, 2624, 2624, 64]
    - [0, 26471.1]
  - - [2688, 3520, 1, 64, 2688, 2688, 2688, 64]
    - [0, 26318.9]
  - - [2752, 3520, 1, 64, 2752, 2752, 2752, 64]
    - [0, 26451.2]
  - - [2816, 3520, 1, 64, 2816, 2816, 2816, 64]
    - [0, 25508.9]
  - - [2880, 3520, 1, 64, 2880, 2880, 2880, 64]
    - [0, 27157.7]
  - - [2944, 3520, 1, 64, 2944, 2944, 2944, 64]
    - [0, 26928.2]
  - - [3008, 3520, 1, 64, 3008, 3008, 3008, 64]
    - [0, 27286.5]
  - - [3072, 3520, 1, 64, 3072, 3072, 3072, 64]
    - [0, 24152.9]
  - - [3136, 3520, 1, 64, 3136, 3136, 3136, 64]
    - [0, 27363.4]
  - - [3200, 3520, 1, 64, 3200, 3200, 3200, 64]
    - [0, 26670.9]
  - - [3264, 3520, 1, 64, 3264, 3264, 3264, 64]
    - [0, 27990.3]
  - - [3328, 3520, 1, 64, 3328, 3328, 3328, 64]
    - [9, 26916.2]
  - - [3392, 3520, 1, 64, 3392, 3392, 3392, 64]
    - [0, 28153.4]
  - - [3456, 3520, 1, 64, 3456, 3456, 3456, 64]
    - [0, 27994.6]
  - - [3520, 3520, 1, 64, 3520, 3520, 3520, 64]
    - [0, 28167.6]
  - - [3584, 3520, 1, 64, 3584, 3584, 3584, 64]
    - [0, 26155.5]
  - - [3648, 3520, 1, 64, 3648, 3648, 3648, 64]
    - [0, 25383.3]
  - - [3712, 3520, 1, 64, 3712, 3712, 3712, 64]
    - [0, 18478.6]
  - - [3776, 3520, 1, 64, 3776, 3776, 3776, 64]
    - [0, 14005.2]
  - - [3840, 3520, 1, 64, 3840, 3840, 3840, 64]
    - [0, 13195.4]
  - - [3904, 3520, 1, 64, 3904, 3904, 3904, 64]
    - [0, 12719.0]
  - - [3968, 3520, 1, 64, 3968, 3968, 3968, 64]
    - [0, 12616.2]
  - - [4032, 3520, 1, 64, 4032, 4032, 4032, 64]
    - [8, 12092.5]
  - - [4096, 3520, 1, 64, 4096, 4096, 4096, 64]
    - [1, 12837.2]
  - - [64, 3584, 1, 64, 64, 64, 64, 64]
    - [4, 3110.17]
  - - [128, 3584, 1, 64, 128, 128, 128, 64]
    - [4, 5383.18]
  - - [192, 3584, 1, 64, 192, 192, 192, 64]
    - [3, 7599.56]
  - - [256, 3584, 1, 64, 256, 256, 256, 64]
    - [0, 9371.14]
  - - [320, 3584, 1, 64, 320, 320, 320, 64]
    - [9, 10464.7]
  - - [384, 3584, 1, 64, 384, 384, 384, 64]
    - [0, 11844.9]
  - - [448, 3584, 1, 64, 448, 448, 448, 64]
    - [0, 13068.7]
  - - [512, 3584, 1, 64, 512, 512, 512, 64]
    - [0, 13579.9]
  - - [576, 3584, 1, 64, 576, 576, 576, 64]
    - [4, 14434.5]
  - - [640, 3584, 1, 64, 640, 640, 640, 64]
    - [0, 15285.2]
  - - [704, 3584, 1, 64, 704, 704, 704, 64]
    - [0, 16230.6]
  - - [768, 3584, 1, 64, 768, 768, 768, 64]
    - [0, 16237.4]
  - - [832, 3584, 1, 64, 832, 832, 832, 64]
    - [4, 17084.9]
  - - [896, 3584, 1, 64, 896, 896, 896, 64]
    - [0, 17685.1]
  - - [960, 3584, 1, 64, 960, 960, 960, 64]
    - [0, 18150.2]
  - - [1024, 3584, 1, 64, 1024, 1024, 1024, 64]
    - [1, 17862.8]
  - - [1088, 3584, 1, 64, 1088, 1088, 1088, 64]
    - [0, 19348.6]
  - - [1152, 3584, 1, 64, 1152, 1152, 1152, 64]
    - [0, 19200.6]
  - - [1216, 3584, 1, 64, 1216, 1216, 1216, 64]
    - [3, 19743.5]
  - - [1280, 3584, 1, 64, 1280, 1280, 1280, 64]
    - [3, 20206.3]
  - - [1344, 3584, 1, 64, 1344, 1344, 1344, 64]
    - [3, 21005.6]
  - - [1408, 3584, 1, 64, 1408, 1408, 1408, 64]
    - [3, 20657.4]
  - - [1472, 3584, 1, 64, 1472, 1472, 1472, 64]
    - [3, 21102.3]
  - - [1536, 3584, 1, 64, 1536, 1536, 1536, 64]
    - [0, 20153.2]
  - - [1600, 3584, 1, 64, 1600, 1600, 1600, 64]
    - [3, 21957.4]
  - - [1664, 3584, 1, 64, 1664, 1664, 1664, 64]
    - [3, 22045.6]
  - - [1728, 3584, 1, 64, 1728, 1728, 1728, 64]
    - [3, 22612.8]
  - - [1792, 3584, 1, 64, 1792, 1792, 1792, 64]
    - [0, 22642.9]
  - - [1856, 3584, 1, 64, 1856, 1856, 1856, 64]
    - [3, 22710.9]
  - - [1920, 3584, 1, 64, 1920, 1920, 1920, 64]
    - [3, 22857.6]
  - - [1984, 3584, 1, 64, 1984, 1984, 1984, 64]
    - [3, 22891.2]
  - - [2048, 3584, 1, 64, 2048, 2048, 2048, 64]
    - [1, 22386.4]
  - - [2112, 3584, 1, 64, 2112, 2112, 2112, 64]
    - [3, 23958.3]
  - - [2176, 3584, 1, 64, 2176, 2176, 2176, 64]
    - [3, 23572.1]
  - - [2240, 3584, 1, 64, 2240, 2240, 2240, 64]
    - [3, 23635.9]
  - - [2304, 3584, 1, 64, 2304, 2304, 2304, 64]
    - [0, 24114.8]
  - - [2368, 3584, 1, 64, 2368, 2368, 2368, 64]
    - [0, 24194.0]
  - - [2432, 3584, 1, 64, 2432, 2432, 2432, 64]
    - [0, 25185.6]
  - - [2496, 3584, 1, 64, 2496, 2496, 2496, 64]
    - [0, 25206.5]
  - - [2560, 3584, 1, 64, 2560, 2560, 2560, 64]
    - [1, 23717.4]
  - - [2624, 3584, 1, 64, 2624, 2624, 2624, 64]
    - [0, 25668.5]
  - - [2688, 3584, 1, 64, 2688, 2688, 2688, 64]
    - [3, 26085.4]
  - - [2752, 3584, 1, 64, 2752, 2752, 2752, 64]
    - [0, 26415.9]
  - - [2816, 3584, 1, 64, 2816, 2816, 2816, 64]
    - [0, 26750.4]
  - - [2880, 3584, 1, 64, 2880, 2880, 2880, 64]
    - [0, 25985.2]
  - - [2944, 3584, 1, 64, 2944, 2944, 2944, 64]
    - [0, 26363.5]
  - - [3008, 3584, 1, 64, 3008, 3008, 3008, 64]
    - [0, 27350.9]
  - - [3072, 3584, 1, 64, 3072, 3072, 3072, 64]
    - [9, 23865.7]
  - - [3136, 3584, 1, 64, 3136, 3136, 3136, 64]
    - [0, 27792.0]
  - - [3200, 3584, 1, 64, 3200, 3200, 3200, 64]
    - [0, 27787.0]
  - - [3264, 3584, 1, 64, 3264, 3264, 3264, 64]
    - [0, 27569.4]
  - - [3328, 3584, 1, 64, 3328, 3328, 3328, 64]
    - [9, 27879.0]
  - - [3392, 3584, 1, 64, 3392, 3392, 3392, 64]
    - [9, 27136.6]
  - - [3456, 3584, 1, 64, 3456, 3456, 3456, 64]
    - [0, 27828.2]
  - - [3520, 3584, 1, 64, 3520, 3520, 3520, 64]
    - [9, 26532.8]
  - - [3584, 3584, 1, 64, 3584, 3584, 3584, 64]
    - [1, 22481.3]
  - - [3648, 3584, 1, 64, 3648, 3648, 3648, 64]
    - [0, 18783.6]
  - - [3712, 3584, 1, 64, 3712, 3712, 3712, 64]
    - [0, 14003.4]
  - - [3776, 3584, 1, 64, 3776, 3776, 3776, 64]
    - [0, 12833.8]
  - - [3840, 3584, 1, 64, 3840, 3840, 3840, 64]
    - [0, 12862.2]
  - - [3904, 3584, 1, 64, 3904, 3904, 3904, 64]
    - [1, 12256.7]
  - - [3968, 3584, 1, 64, 3968, 3968, 3968, 64]
    - [1, 12300.7]
  - - [4032, 3584, 1, 64, 4032, 4032, 4032, 64]
    - [12, 12063.8]
  - - [4096, 3584, 1, 64, 4096, 4096, 4096, 64]
    - [8, 12679.1]
  - - [64, 3648, 1, 64, 64, 64, 64, 64]
    - [1, 3093.58]
  - - [128, 3648, 1, 64, 128, 128, 128, 64]
    - [4, 5597.3]
  - - [192, 3648, 1, 64, 192, 192, 192, 64]
    - [0, 7763.4]
  - - [256, 3648, 1, 64, 256, 256, 256, 64]
    - [0, 9527.8]
  - - [320, 3648, 1, 64, 320, 320, 320, 64]
    - [9, 10530.0]
  - - [384, 3648, 1, 64, 384, 384, 384, 64]
    - [0, 11932.9]
  - - [448, 3648, 1, 64, 448, 448, 448, 64]
    - [0, 13344.5]
  - - [512, 3648, 1, 64, 512, 512, 512, 64]
    - [0, 13735.0]
  - - [576, 3648, 1, 64, 576, 576, 576, 64]
    - [0, 14553.9]
  - - [640, 3648, 1, 64, 640, 640, 640, 64]
    - [0, 15409.0]
  - - [704, 3648, 1, 64, 704, 704, 704, 64]
    - [0, 16310.6]
  - - [768, 3648, 1, 64, 768, 768, 768, 64]
    - [9, 16433.3]
  - - [832, 3648, 1, 64, 832, 832, 832, 64]
    - [4, 17090.1]
  - - [896, 3648, 1, 64, 896, 896, 896, 64]
    - [0, 17873.2]
  - - [960, 3648, 1, 64, 960, 960, 960, 64]
    - [0, 18190.9]
  - - [1024, 3648, 1, 64, 1024, 1024, 1024, 64]
    - [1, 17968.6]
  - - [1088, 3648, 1, 64, 1088, 1088, 1088, 64]
    - [3, 18981.7]
  - - [1152, 3648, 1, 64, 1152, 1152, 1152, 64]
    - [0, 19359.1]
  - - [1216, 3648, 1, 64, 1216, 1216, 1216, 64]
    - [0, 19866.9]
  - - [1280, 3648, 1, 64, 1280, 1280, 1280, 64]
    - [3, 20215.1]
  - - [1344, 3648, 1, 64, 1344, 1344, 1344, 64]
    - [3, 20995.9]
  - - [1408, 3648, 1, 64, 1408, 1408, 1408, 64]
    - [3, 20779.0]
  - - [1472, 3648, 1, 64, 1472, 1472, 1472, 64]
    - [3, 21296.8]
  - - [1536, 3648, 1, 64, 1536, 1536, 1536, 64]
    - [0, 20424.2]
  - - [1600, 3648, 1, 64, 1600, 1600, 1600, 64]
    - [3, 22087.8]
  - - [1664, 3648, 1, 64, 1664, 1664, 1664, 64]
    - [3, 22269.5]
  - - [1728, 3648, 1, 64, 1728, 1728, 1728, 64]
    - [3, 22753.0]
  - - [1792, 3648, 1, 64, 1792, 1792, 1792, 64]
    - [3, 22864.6]
  - - [1856, 3648, 1, 64, 1856, 1856, 1856, 64]
    - [3, 23034.1]
  - - [1920, 3648, 1, 64, 1920, 1920, 1920, 64]
    - [3, 23295.9]
  - - [1984, 3648, 1, 64, 1984, 1984, 1984, 64]
    - [3, 23573.8]
  - - [2048, 3648, 1, 64, 2048, 2048, 2048, 64]
    - [1, 22423.9]
  - - [2112, 3648, 1, 64, 2112, 2112, 2112, 64]
    - [3, 24102.4]
  - - [2176, 3648, 1, 64, 2176, 2176, 2176, 64]
    - [3, 24335.6]
  - - [2240, 3648, 1, 64, 2240, 2240, 2240, 64]
    - [0, 23662.7]
  - - [2304, 3648, 1, 64, 2304, 2304, 2304, 64]
    - [0, 23510.2]
  - - [2368, 3648, 1, 64, 2368, 2368, 2368, 64]
    - [3, 23711.4]
  - - [2432, 3648, 1, 64, 2432, 2432, 2432, 64]
    - [3, 24203.8]
  - - [2496, 3648, 1, 64, 2496, 2496, 2496, 64]
    - [0, 25547.5]
  - - [2560, 3648, 1, 64, 2560, 2560, 2560, 64]
    - [0, 24267.3]
  - - [2624, 3648, 1, 64, 2624, 2624, 2624, 64]
    - [0, 26210.7]
  - - [2688, 3648, 1, 64, 2688, 2688, 2688, 64]
    - [0, 26394.9]
  - - [2752, 3648, 1, 64, 2752, 2752, 2752, 64]
    - [0, 26454.8]
  - - [2816, 3648, 1, 64, 2816, 2816, 2816, 64]
    - [9, 25612.6]
  - - [2880, 3648, 1, 64, 2880, 2880, 2880, 64]
    - [0, 26230.4]
  - - [2944, 3648, 1, 64, 2944, 2944, 2944, 64]
    - [0, 26362.8]
  - - [3008, 3648, 1, 64, 3008, 3008, 3008, 64]
    - [0, 26970.1]
  - - [3072, 3648, 1, 64, 3072, 3072, 3072, 64]
    - [1, 24237.7]
  - - [3136, 3648, 1, 64, 3136, 3136, 3136, 64]
    - [0, 28156.7]
  - - [3200, 3648, 1, 64, 3200, 3200, 3200, 64]
    - [0, 27231.7]
  - - [3264, 3648, 1, 64, 3264, 3264, 3264, 64]
    - [9, 27223.6]
  - - [3328, 3648, 1, 64, 3328, 3328, 3328, 64]
    - [0, 27214.9]
  - - [3392, 3648, 1, 64, 3392, 3392, 3392, 64]
    - [0, 28157.4]
  - - [3456, 3648, 1, 64, 3456, 3456, 3456, 64]
    - [0, 27379.4]
  - - [3520, 3648, 1, 64, 3520, 3520, 3520, 64]
    - [0, 24868.0]
  - - [3584, 3648, 1, 64, 3584, 3584, 3584, 64]
    - [0, 18354.7]
  - - [3648, 3648, 1, 64, 3648, 3648, 3648, 64]
    - [0, 14500.4]
  - - [3712, 3648, 1, 64, 3712, 3712, 3712, 64]
    - [0, 12962.0]
  - - [3776, 3648, 1, 64, 3776, 3776, 3776, 64]
    - [0, 12459.8]
  - - [3840, 3648, 1, 64, 3840, 3840, 3840, 64]
    - [0, 12423.4]
  - - [3904, 3648, 1, 64, 3904, 3904, 3904, 64]
    - [1, 12044.0]
  - - [3968, 3648, 1, 64, 3968, 3968, 3968, 64]
    - [1, 12178.3]
  - - [4032, 3648, 1, 64, 4032, 4032, 4032, 64]
    - [12, 11962.3]
  - - [4096, 3648, 1, 64, 4096, 4096, 4096, 64]
    - [8, 12685.7]
  - - [64, 3712, 1, 64, 64, 64, 64, 64]
    - [15, 3135.53]
  - - [128, 3712, 1, 64, 128, 128, 128, 64]
    - [4, 5572.32]
  - - [192, 3712, 1, 64, 192, 192, 192, 64]
    - [0, 7697.04]
  - - [256, 3712, 1, 64, 256, 256, 256, 64]
    - [9, 9590.99]
  - - [320, 3712, 1, 64, 320, 320, 320, 64]
    - [4, 10671.1]
  - - [384, 3712, 1, 64, 384, 384, 384, 64]
    - [0, 12147.1]
  - - [448, 3712, 1, 64, 448, 448, 448, 64]
    - [0, 13540.6]
  - - [512, 3712, 1, 64, 512, 512, 512, 64]
    - [0, 13804.6]
  - - [576, 3712, 1, 64, 576, 576, 576, 64]
    - [4, 14657.0]
  - - [640, 3712, 1, 64, 640, 640, 640, 64]
    - [0, 15490.8]
  - - [704, 3712, 1, 64, 704, 704, 704, 64]
    - [0, 16464.4]
  - - [768, 3712, 1, 64, 768, 768, 768, 64]
    - [0, 16622.6]
  - - [832, 3712, 1, 64, 832, 832, 832, 64]
    - [3, 17188.8]
  - - [896, 3712, 1, 64, 896, 896, 896, 64]
    - [9, 17902.4]
  - - [960, 3712, 1, 64, 960, 960, 960, 64]
    - [0, 18333.1]
  - - [1024, 3712, 1, 64, 1024, 1024, 1024, 64]
    - [4, 18121.8]
  - - [1088, 3712, 1, 64, 1088, 1088, 1088, 64]
    - [3, 19255.8]
  - - [1152, 3712, 1, 64, 1152, 1152, 1152, 64]
    - [0, 19430.2]
  - - [1216, 3712, 1, 64, 1216, 1216, 1216, 64]
    - [0, 20114.2]
  - - [1280, 3712, 1, 64, 1280, 1280, 1280, 64]
    - [3, 20396.0]
  - - [1344, 3712, 1, 64, 1344, 1344, 1344, 64]
    - [3, 21143.4]
  - - [1408, 3712, 1, 64, 1408, 1408, 1408, 64]
    - [3, 21025.3]
  - - [1472, 3712, 1, 64, 1472, 1472, 1472, 64]
    - [3, 21449.7]
  - - [1536, 3712, 1, 64, 1536, 1536, 1536, 64]
    - [0, 20634.4]
  - - [1600, 3712, 1, 64, 1600, 1600, 1600, 64]
    - [3, 22207.5]
  - - [1664, 3712, 1, 64, 1664, 1664, 1664, 64]
    - [3, 22569.7]
  - - [1728, 3712, 1, 64, 1728, 1728, 1728, 64]
    - [3, 22899.1]
  - - [1792, 3712, 1, 64, 1792, 1792, 1792, 64]
    - [0, 23111.6]
  - - [1856, 3712, 1, 64, 1856, 1856, 1856, 64]
    - [3, 23262.7]
  - - [1920, 3712, 1, 64, 1920, 1920, 1920, 64]
    - [3, 23272.8]
  - - [1984, 3712, 1, 64, 1984, 1984, 1984, 64]
    - [3, 23096.5]
  - - [2048, 3712, 1, 64, 2048, 2048, 2048, 64]
    - [1, 22215.1]
  - - [2112, 3712, 1, 64, 2112, 2112, 2112, 64]
    - [3, 24091.9]
  - - [2176, 3712, 1, 64, 2176, 2176, 2176, 64]
    - [0, 24265.0]
  - - [2240, 3712, 1, 64, 2240, 2240, 2240, 64]
    - [0, 23580.7]
  - - [2304, 3712, 1, 64, 2304, 2304, 2304, 64]
    - [3, 23825.8]
  - - [2368, 3712, 1, 64, 2368, 2368, 2368, 64]
    - [0, 23968.0]
  - - [2432, 3712, 1, 64, 2432, 2432, 2432, 64]
    - [0, 24782.7]
  - - [2496, 3712, 1, 64, 2496, 2496, 2496, 64]
    - [0, 25545.4]
  - - [2560, 3712, 1, 64, 2560, 2560, 2560, 64]
    - [0, 23923.8]
  - - [2624, 3712, 1, 64, 2624, 2624, 2624, 64]
    - [0, 27084.2]
  - - [2688, 3712, 1, 64, 2688, 2688, 2688, 64]
    - [0, 26824.2]
  - - [2752, 3712, 1, 64, 2752, 2752, 2752, 64]
    - [0, 26546.1]
  - - [2816, 3712, 1, 64, 2816, 2816, 2816, 64]
    - [0, 27000.1]
  - - [2880, 3712, 1, 64, 2880, 2880, 2880, 64]
    - [0, 27266.1]
  - - [2944, 3712, 1, 64, 2944, 2944, 2944, 64]
    - [0, 26798.6]
  - - [3008, 3712, 1, 64, 3008, 3008, 3008, 64]
    - [0, 28101.6]
  - - [3072, 3712, 1, 64, 3072, 3072, 3072, 64]
    - [0, 24274.1]
  - - [3136, 3712, 1, 64, 3136, 3136, 3136, 64]
    - [0, 27076.3]
  - - [3200, 3712, 1, 64, 3200, 3200, 3200, 64]
    - [0, 26804.7]
  - - [3264, 3712, 1, 64, 3264, 3264, 3264, 64]
    - [0, 27424.0]
  - - [3328, 3712, 1, 64, 3328, 3328, 3328, 64]
    - [0, 27171.7]
  - - [3392, 3712, 1, 64, 3392, 3392, 3392, 64]
    - [0, 26101.1]
  - - [3456, 3712, 1, 64, 3456, 3456, 3456, 64]
    - [0, 25120.9]
  - - [3520, 3712, 1, 64, 3520, 3520, 3520, 64]
    - [0, 18952.2]
  - - [3584, 3712, 1, 64, 3584, 3584, 3584, 64]
    - [0, 14485.3]
  - - [3648, 3712, 1, 64, 3648, 3648, 3648, 64]
    - [0, 13197.7]
  - - [3712, 3712, 1, 64, 3712, 3712, 3712, 64]
    - [0, 12672.7]
  - - [3776, 3712, 1, 64, 3776, 3776, 3776, 64]
    - [0, 12003.0]
  - - [3840, 3712, 1, 64, 3840, 3840, 3840, 64]
    - [0, 12017.5]
  - - [3904, 3712, 1, 64, 3904, 3904, 3904, 64]
    - [8, 12119.9]
  - - [3968, 3712, 1, 64, 3968, 3968, 3968, 64]
    - [12, 11851.2]
  - - [4032, 3712, 1, 64, 4032, 4032, 4032, 64]
    - [12, 12036.0]
  - - [4096, 3712, 1, 64, 4096, 4096, 4096, 64]
    - [1, 12706.9]
  - - [64, 3776, 1, 64, 64, 64, 64, 64]
    - [7, 3262.27]
  - - [128, 3776, 1, 64, 128, 128, 128, 64]
    - [1, 5666.37]
  - - [192, 3776, 1, 64, 192, 192, 192, 64]
    - [0, 7895.0]
  - - [256, 3776, 1, 64, 256, 256, 256, 64]
    - [9, 9846.49]
  - - [320, 3776, 1, 64, 320, 320, 320, 64]
    - [9, 10791.4]
  - - [384, 3776, 1, 64, 384, 384, 384, 64]
    - [9, 12284.5]
  - - [448, 3776, 1, 64, 448, 448, 448, 64]
    - [0, 13628.4]
  - - [512, 3776, 1, 64, 512, 512, 512, 64]
    - [0, 13941.4]
  - - [576, 3776, 1, 64, 576, 576, 576, 64]
    - [9, 14895.3]
  - - [640, 3776, 1, 64, 640, 640, 640, 64]
    - [0, 15654.2]
  - - [704, 3776, 1, 64, 704, 704, 704, 64]
    - [0, 16530.2]
  - - [768, 3776, 1, 64, 768, 768, 768, 64]
    - [0, 16814.2]
  - - [832, 3776, 1, 64, 832, 832, 832, 64]
    - [4, 17347.9]
  - - [896, 3776, 1, 64, 896, 896, 896, 64]
    - [0, 18081.7]
  - - [960, 3776, 1, 64, 960, 960, 960, 64]
    - [0, 18468.0]
  - - [1024, 3776, 1, 64, 1024, 1024, 1024, 64]
    - [4, 18209.1]
  - - [1088, 3776, 1, 64, 1088, 1088, 1088, 64]
    - [0, 19411.4]
  - - [1152, 3776, 1, 64, 1152, 1152, 1152, 64]
    - [3, 19447.6]
  - - [1216, 3776, 1, 64, 1216, 1216, 1216, 64]
    - [0, 20230.0]
  - - [1280, 3776, 1, 64, 1280, 1280, 1280, 64]
    - [3, 20625.9]
  - - [1344, 3776, 1, 64, 1344, 1344, 1344, 64]
    - [3, 21250.5]
  - - [1408, 3776, 1, 64, 1408, 1408, 1408, 64]
    - [3, 21263.5]
  - - [1472, 3776, 1, 64, 1472, 1472, 1472, 64]
    - [3, 21597.1]
  - - [1536, 3776, 1, 64, 1536, 1536, 1536, 64]
    - [0, 20824.2]
  - - [1600, 3776, 1, 64, 1600, 1600, 1600, 64]
    - [3, 22307.6]
  - - [1664, 3776, 1, 64, 1664, 1664, 1664, 64]
    - [3, 22756.1]
  - - [1728, 3776, 1, 64, 1728, 1728, 1728, 64]
    - [3, 23149.3]
  - - [1792, 3776, 1, 64, 1792, 1792, 1792, 64]
    - [0, 23177.9]
  - - [1856, 3776, 1, 64, 1856, 1856, 1856, 64]
    - [0, 23245.5]
  - - [1920, 3776, 1, 64, 1920, 1920, 1920, 64]
    - [3, 22915.3]
  - - [1984, 3776, 1, 64, 1984, 1984, 1984, 64]
    - [3, 23794.3]
  - - [2048, 3776, 1, 64, 2048, 2048, 2048, 64]
    - [1, 22376.4]
  - - [2112, 3776, 1, 64, 2112, 2112, 2112, 64]
    - [0, 23589.7]
  - - [2176, 3776, 1, 64, 2176, 2176, 2176, 64]
    - [0, 24236.3]
  - - [2240, 3776, 1, 64, 2240, 2240, 2240, 64]
    - [0, 23663.2]
  - - [2304, 3776, 1, 64, 2304, 2304, 2304, 64]
    - [0, 24186.1]
  - - [2368, 3776, 1, 64, 2368, 2368, 2368, 64]
    - [0, 24537.1]
  - - [2432, 3776, 1, 64, 2432, 2432, 2432, 64]
    - [0, 24232.9]
  - - [2496, 3776, 1, 64, 2496, 2496, 2496, 64]
    - [0, 24828.6]
  - - [2560, 3776, 1, 64, 2560, 2560, 2560, 64]
    - [1, 24488.5]
  - - [2624, 3776, 1, 64, 2624, 2624, 2624, 64]
    - [3, 24753.8]
  - - [2688, 3776, 1, 64, 2688, 2688, 2688, 64]
    - [0, 26389.8]
  - - [2752, 3776, 1, 64, 2752, 2752, 2752, 64]
    - [0, 26544.7]
  - - [2816, 3776, 1, 64, 2816, 2816, 2816, 64]
    - [0, 25672.2]
  - - [2880, 3776, 1, 64, 2880, 2880, 2880, 64]
    - [0, 27362.2]
  - - [2944, 3776, 1, 64, 2944, 2944, 2944, 64]
    - [0, 27869.4]
  - - [3008, 3776, 1, 64, 3008, 3008, 3008, 64]
    - [0, 28658.3]
  - - [3072, 3776, 1, 64, 3072, 3072, 3072, 64]
    - [0, 25025.5]
  - - [3136, 3776, 1, 64, 3136, 3136, 3136, 64]
    - [0, 26890.3]
  - - [3200, 3776, 1, 64, 3200, 3200, 3200, 64]
    - [0, 27106.3]
  - - [3264, 3776, 1, 64, 3264, 3264, 3264, 64]
    - [0, 26980.7]
  - - [3328, 3776, 1, 64, 3328, 3328, 3328, 64]
    - [0, 26928.5]
  - - [3392, 3776, 1, 64, 3392, 3392, 3392, 64]
    - [0, 25656.1]
  - - [3456, 3776, 1, 64, 3456, 3456, 3456, 64]
    - [0, 19727.9]
  - - [3520, 3776, 1, 64, 3520, 3520, 3520, 64]
    - [0, 14557.4]
  - - [3584, 3776, 1, 64, 3584, 3584, 3584, 64]
    - [0, 13216.5]
  - - [3648, 3776, 1, 64, 3648, 3648, 3648, 64]
    - [0, 12659.6]
  - - [3712, 3776, 1, 64, 3712, 3712, 3712, 64]
    - [0, 12316.0]
  - - [3776, 3776, 1, 64, 3776, 3776, 3776, 64]
    - [1, 11830.2]
  - - [3840, 3776, 1, 64, 3840, 3840, 3840, 64]
    - [1, 11893.1]
  - - [3904, 3776, 1, 64, 3904, 3904, 3904, 64]
    - [8, 11886.4]
  - - [3968, 3776, 1, 64, 3968, 3968, 3968, 64]
    - [8, 11894.1]
  - - [4032, 3776, 1, 64, 4032, 4032, 4032, 64]
    - [12, 12184.7]
  - - [4096, 3776, 1, 64, 4096, 4096, 4096, 64]
    - [8, 12780.2]
  - - [64, 3840, 1, 64, 64, 64, 64, 64]
    - [8, 3319.63]
  - - [128, 3840, 1, 64, 128, 128, 128, 64]
    - [1, 6055.24]
  - - [192, 3840, 1, 64, 192, 192, 192, 64]
    - [0, 8128.43]
  - - [256, 3840, 1, 64, 256, 256, 256, 64]
    - [9, 9986.32]
  - - [320, 3840, 1, 64, 320, 320, 320, 64]
    - [0, 10960.6]
  - - [384, 3840, 1, 64, 384, 384, 384, 64]
    - [9, 12425.4]
  - - [448, 3840, 1, 64, 448, 448, 448, 64]
    - [0, 13747.0]
  - - [512, 3840, 1, 64, 512, 512, 512, 64]
    - [0, 14030.7]
  - - [576, 3840, 1, 64, 576, 576, 576, 64]
    - [0, 15167.3]
  - - [640, 3840, 1, 64, 640, 640, 640, 64]
    - [0, 15839.3]
  - - [704, 3840, 1, 64, 704, 704, 704, 64]
    - [0, 16551.6]
  - - [768, 3840, 1, 64, 768, 768, 768, 64]
    - [9, 17006.8]
  - - [832, 3840, 1, 64, 832, 832, 832, 64]
    - [0, 17563.1]
  - - [896, 3840, 1, 64, 896, 896, 896, 64]
    - [0, 18141.2]
  - - [960, 3840, 1, 64, 960, 960, 960, 64]
    - [0, 18643.0]
  - - [1024, 3840, 1, 64, 1024, 1024, 1024, 64]
    - [4, 18395.8]
  - - [1088, 3840, 1, 64, 1088, 1088, 1088, 64]
    - [3, 19433.4]
  - - [1152, 3840, 1, 64, 1152, 1152, 1152, 64]
    - [0, 19786.9]
  - - [1216, 3840, 1, 64, 1216, 1216, 1216, 64]
    - [0, 20362.5]
  - - [1280, 3840, 1, 64, 1280, 1280, 1280, 64]
    - [3, 20923.8]
  - - [1344, 3840, 1, 64, 1344, 1344, 1344, 64]
    - [3, 21445.1]
  - - [1408, 3840, 1, 64, 1408, 1408, 1408, 64]
    - [3, 21501.6]
  - - [1472, 3840, 1, 64, 1472, 1472, 1472, 64]
    - [3, 21736.1]
  - - [1536, 3840, 1, 64, 1536, 1536, 1536, 64]
    - [0, 20879.6]
  - - [1600, 3840, 1, 64, 1600, 1600, 1600, 64]
    - [3, 22687.0]
  - - [1664, 3840, 1, 64, 1664, 1664, 1664, 64]
    - [3, 22821.6]
  - - [1728, 3840, 1, 64, 1728, 1728, 1728, 64]
    - [3, 22947.7]
  - - [1792, 3840, 1, 64, 1792, 1792, 1792, 64]
    - [0, 23301.5]
  - - [1856, 3840, 1, 64, 1856, 1856, 1856, 64]
    - [0, 22964.7]
  - - [1920, 3840, 1, 64, 1920, 1920, 1920, 64]
    - [3, 23573.8]
  - - [1984, 3840, 1, 64, 1984, 1984, 1984, 64]
    - [3, 23912.8]
  - - [2048, 3840, 1, 64, 2048, 2048, 2048, 64]
    - [1, 22336.5]
  - - [2112, 3840, 1, 64, 2112, 2112, 2112, 64]
    - [3, 24177.4]
  - - [2176, 3840, 1, 64, 2176, 2176, 2176, 64]
    - [3, 24538.5]
  - - [2240, 3840, 1, 64, 2240, 2240, 2240, 64]
    - [1, 23566.7]
  - - [2304, 3840, 1, 64, 2304, 2304, 2304, 64]
    - [1, 23523.1]
  - - [2368, 3840, 1, 64, 2368, 2368, 2368, 64]
    - [0, 24362.7]
  - - [2432, 3840, 1, 64, 2432, 2432, 2432, 64]
    - [0, 25294.4]
  - - [2496, 3840, 1, 64, 2496, 2496, 2496, 64]
    - [0, 25987.5]
  - - [2560, 3840, 1, 64, 2560, 2560, 2560, 64]
    - [0, 24358.8]
  - - [2624, 3840, 1, 64, 2624, 2624, 2624, 64]
    - [0, 26316.8]
  - - [2688, 3840, 1, 64, 2688, 2688, 2688, 64]
    - [0, 25798.4]
  - - [2752, 3840, 1, 64, 2752, 2752, 2752, 64]
    - [0, 27037.8]
  - - [2816, 3840, 1, 64, 2816, 2816, 2816, 64]
    - [3, 25989.6]
  - - [2880, 3840, 1, 64, 2880, 2880, 2880, 64]
    - [0, 27769.2]
  - - [2944, 3840, 1, 64, 2944, 2944, 2944, 64]
    - [0, 27083.5]
  - - [3008, 3840, 1, 64, 3008, 3008, 3008, 64]
    - [9, 27488.1]
  - - [3072, 3840, 1, 64, 3072, 3072, 3072, 64]
    - [11, 23938.3]
  - - [3136, 3840, 1, 64, 3136, 3136, 3136, 64]
    - [0, 27553.3]
  - - [3200, 3840, 1, 64, 3200, 3200, 3200, 64]
    - [0, 27993.5]
  - - [3264, 3840, 1, 64, 3264, 3264, 3264, 64]
    - [0, 27482.2]
  - - [3328, 3840, 1, 64, 3328, 3328, 3328, 64]
    - [0, 24837.7]
  - - [3392, 3840, 1, 64, 3392, 3392, 3392, 64]
    - [0, 19475.0]
  - - [3456, 3840, 1, 64, 3456, 3456, 3456, 64]
    - [0, 15417.8]
  - - [3520, 3840, 1, 64, 3520, 3520, 3520, 64]
    - [0, 13071.2]
  - - [3584, 3840, 1, 64, 3584, 3584, 3584, 64]
    - [0, 12706.0]
  - - [3648, 3840, 1, 64, 3648, 3648, 3648, 64]
    - [0, 12189.6]
  - - [3712, 3840, 1, 64, 3712, 3712, 3712, 64]
    - [12, 12062.5]
  - - [3776, 3840, 1, 64, 3776, 3776, 3776, 64]
    - [1, 11712.2]
  - - [3840, 3840, 1, 64, 3840, 3840, 3840, 64]
    - [8, 11714.9]
  - - [3904, 3840, 1, 64, 3904, 3904, 3904, 64]
    - [8, 11895.0]
  - - [3968, 3840, 1, 64, 3968, 3968, 3968, 64]
    - [8, 11961.1]
  - - [4032, 3840, 1, 64, 4032, 4032, 4032, 64]
    - [12, 12242.9]
  - - [4096, 3840, 1, 64, 4096, 4096, 4096, 64]
    - [8, 12752.8]
  - - [64, 3904, 1, 64, 64, 64, 64, 64]
    - [12, 3342.5]
  - - [128, 3904, 1, 64, 128, 128, 128, 64]
    - [1, 6098.61]
  - - [192, 3904, 1, 64, 192, 192, 192, 64]
    - [1, 8259.67]
  - - [256, 3904, 1, 64, 256, 256, 256, 64]
    - [4, 9511.14]
  - - [320, 3904, 1, 64, 320, 320, 320, 64]
    - [0, 11179.0]
  - - [384, 3904, 1, 64, 384, 384, 384, 64]
    - [9, 12559.7]
  - - [448, 3904, 1, 64, 448, 448, 448, 64]
    - [0, 13891.1]
  - - [512, 3904, 1, 64, 512, 512, 512, 64]
    - [4, 13935.1]
  - - [576, 3904, 1, 64, 576, 576, 576, 64]
    - [0, 15221.1]
  - - [640, 3904, 1, 64, 640, 640, 640, 64]
    - [0, 16006.6]
  - - [704, 3904, 1, 64, 704, 704, 704, 64]
    - [0, 16664.8]
  - - [768, 3904, 1, 64, 768, 768, 768, 64]
    - [4, 16729.5]
  - - [832, 3904, 1, 64, 832, 832, 832, 64]
    - [9, 17703.7]
  - - [896, 3904, 1, 64, 896, 896, 896, 64]
    - [0, 18188.8]
  - - [960, 3904, 1, 64, 960, 960, 960, 64]
    - [0, 18730.2]
  - - [1024, 3904, 1, 64, 1024, 1024, 1024, 64]
    - [4, 18369.4]
  - - [1088, 3904, 1, 64, 1088, 1088, 1088, 64]
    - [3, 19518.9]
