library/src/amd_detail/rocblaslt/src/Tensile/Logic/asm_full/navi31/GridBased/navi31_Cijk_Ailk_Bjlk_HSS_BH_Bias_AH.yaml
- {MinimumRequiredVersion: 4.33.0}
- navi31
- gfx1100
- [Device 73f0]
    SolutionIndex: 0
    SolutionNameMin: Cijk_Ailk_Bjlk_HSS_BH_Bias_AH_MT64x64x32_MI16x16x16x1_SN_MIWT2_2_PLR3_WG32_4_1
    SolutionIndex: 1
    SolutionNameMin: Cijk_Ailk_Bjlk_HSS_BH_Bias_AH_MT64x32x32_MI16x16x16x1_SN_MIWT2_2_PLR3_WG32_2_1
    SolutionIndex: 2
    SolutionNameMin: Cijk_Ailk_Bjlk_HSS_BH_Bias_AH_MT32x32x32_MI16x16x16x1_SN_MIWT2_2_PLR3_WG16_2_1
    SolutionIndex: 3
    SolutionNameMin: Cijk_Ailk_Bjlk_HSS_BH_Bias_AH_MT32x64x32_MI16x16x16x1_SN_MIWT2_2_PLR3_WG16_4_1
    SolutionIndex: 4
    SolutionNameMin: Cijk_Ailk_Bjlk_HSS_BH_Bias_AH_MT32x32x32_MI16x16x16x1_SN_MIWT1_1_PLR3_WG32_4_1
    SolutionIndex: 5
    SolutionNameMin: Cijk_Ailk_Bjlk_HSS_BH_Bias_AH_MT16x16x32_MI16x16x16x1_SN_MIWT1_1_PLR3_WG16_2_1
    SolutionIndex: 6
    SolutionNameMin: Cijk_Ailk_Bjlk_HSS_BH_Bias_AH_MT32x16x32_MI16x16x16x1_SN_MIWT1_1_PLR3_WG32_2_1
    SolutionIndex: 7
    SolutionNameMin: Cijk_Ailk_Bjlk_HSS_BH_Bias_AH_MT16x32x32_MI16x16x16x1_SN_MIWT1_1_PLR3_WG16_4_1
    SolutionIndex: 8
    SolutionNameMin: Cijk_Ailk_Bjlk_HSS_BH_Bias_AH_MT64x16x32_MI16x16x16x1_SN_MIWT4_1_PLR3_WG16_2_1
    SolutionIndex: 9
    SolutionNameMin: Cijk_Ailk_Bjlk_HSS_BH_Bias_AH_MT64x64x32_MI16x16x16x1_SN_MIWT4_1_PLR3_WG16_8_1
    SolutionIndex: 10
    SolutionNameMin: Cijk_Ailk_Bjlk_HSS_BH_Bias_AH_MT16x64x32_MI16x16x16x1_SN_MIWT1_4_PLR3_WG16_2_1
    SolutionIndex: 11
    SolutionNameMin: Cijk_Ailk_Bjlk_HSS_BH_Bias_AH_MT64x64x32_MI16x16x16x1_SN_MIWT1_4_PLR3_WG64_2_1
    SolutionIndex: 12
    SolutionNameMin: Cijk_Ailk_Bjlk_HSS_BH_Bias_AH_MT64x64x64_MI16x16x16x1_SN_MIWT2_2_PLR5_WG32_4_1
    SolutionIndex: 13
    SolutionNameMin: Cijk_Ailk_Bjlk_HSS_BH_Bias_AH_MT64x32x64_MI16x16x16x1_SN_MIWT2_2_PLR5_WG32_2_1
    SolutionIndex: 14
    SolutionNameMin: Cijk_Ailk_Bjlk_HSS_BH_Bias_AH_MT32x32x64_MI16x16x16x1_SN_MIWT2_2_PLR5_WG16_2_1
    SolutionIndex: 15
    SolutionNameMin: Cijk_Ailk_Bjlk_HSS_BH_Bias_AH_MT32x64x64_MI16x16x16x1_SN_MIWT2_2_PLR5_WG16_4_1
    SolutionIndex: 16
    SolutionNameMin: Cijk_Ailk_Bjlk_HSS_BH_Bias_AH_MT32x32x64_MI16x16x16x1_SN_MIWT1_1_PLR5_WG32_4_1
    SolutionIndex: 17
    SolutionNameMin: Cijk_Ailk_Bjlk_HSS_BH_Bias_AH_MT16x16x64_MI16x16x16x1_SN_MIWT1_1_PLR5_WG16_2_1
    SolutionIndex: 18
    SolutionNameMin: Cijk_Ailk_Bjlk_HSS_BH_Bias_AH_MT32x16x64_MI16x16x16x1_SN_MIWT1_1_PLR5_WG32_2_1
    SolutionIndex: 19
    SolutionNameMin: Cijk_Ailk_Bjlk_HSS_BH_Bias_AH_MT16x32x64_MI16x16x16x1_SN_MIWT1_1_PLR5_WG16_4_1
    SolutionIndex: 20
    SolutionNameMin: Cijk_Ailk_Bjlk_HSS_BH_Bias_AH_MT64x64x64_MI16x16x16x1_SN_MIWT4_1_PLR5_WG16_8_1
    SolutionIndex: 21
    SolutionNameMin: Cijk_Ailk_Bjlk_HSS_BH_Bias_AH_MT64x64x64_MI16x16x16x1_SN_MIWT1_4_PLR5_WG64_2_1
- - - [64, 64, 1, 64, 64, 64, 64, 64]
    - [17, 62.7589]
  - - [128, 64, 1, 64, 128, 128, 128, 64]
    - [16, 125.307]
  - - [192, 64, 1, 64, 192, 192, 192, 64]
    - [16, 187.648]
  - - [256, 64, 1, 64, 256, 256, 256, 64]
    - [17, 247.479]
  - - [320, 64, 1, 64, 320, 320, 320, 64]
    - [19, 308.766]
  - - [384, 64, 1, 64, 384, 384, 384, 64]
    - [18, 368.436]
  - - [448, 64, 1, 64, 448, 448, 448, 64]
    - [17, 426.052]
  - - [512, 64, 1, 64, 512, 512, 512, 64]
    - [1, 435.815]
  - - [576, 64, 1, 64, 576, 576, 576, 64]
    - [16, 492.025]
  - - [640, 64, 1, 64, 640, 640, 640, 64]
    - [19, 563.018]
  - - [704, 64, 1, 64, 704, 704, 704, 64]
    - [17, 618.254]
  - - [768, 64, 1, 64, 768, 768, 768, 64]
    - [17, 669.717]
  - - [832, 64, 1, 64, 832, 832, 832, 64]
    - [17, 715.184]
  - - [896, 64, 1, 64, 896, 896, 896, 64]
    - [17, 739.021]
  - - [960, 64, 1, 64, 960, 960, 960, 64]
    - [16, 838.758]
  - - [1024, 64, 1, 64, 1024, 1024, 1024, 64]
    - [19, 855.444]
  - - [1088, 64, 1, 64, 1088, 1088, 1088, 64]
    - [19, 928.03]
  - - [1152, 64, 1, 64, 1152, 1152, 1152, 64]
    - [5, 976.924]
  - - [1216, 64, 1, 64, 1216, 1216, 1216, 64]
    - [16, 1017.08]
  - - [1280, 64, 1, 64, 1280, 1280, 1280, 64]
    - [19, 1066.91]
  - - [1344, 64, 1, 64, 1344, 1344, 1344, 64]
    - [19, 1129.68]
  - - [1408, 64, 1, 64, 1408, 1408, 1408, 64]
    - [6, 1197.74]
  - - [1472, 64, 1, 64, 1472, 1472, 1472, 64]
    - [4, 1210.92]
  - - [1536, 64, 1, 64, 1536, 1536, 1536, 64]
    - [18, 1252.01]
  - - [1600, 64, 1, 64, 1600, 1600, 1600, 64]
    - [4, 1380.27]
  - - [1664, 64, 1, 64, 1664, 1664, 1664, 64]
    - [4, 1387.27]
  - - [1728, 64, 1, 64, 1728, 1728, 1728, 64]
    - [6, 1511.38]
  - - [1792, 64, 1, 64, 1792, 1792, 1792, 64]
    - [7, 1502.85]
  - - [1856, 64, 1, 64, 1856, 1856, 1856, 64]
    - [7, 1639.08]
  - - [1920, 64, 1, 64, 1920, 1920, 1920, 64]
    - [6, 1610.2]
  - - [1984, 64, 1, 64, 1984, 1984, 1984, 64]
    - [4, 1648.69]
  - - [2048, 64, 1, 64, 2048, 2048, 2048, 64]
    - [7, 1777.22]
  - - [2112, 64, 1, 64, 2112, 2112, 2112, 64]
    - [4, 1740.59]
  - - [2176, 64, 1, 64, 2176, 2176, 2176, 64]
    - [5, 1793.69]
  - - [2240, 64, 1, 64, 2240, 2240, 2240, 64]
    - [7, 1907.09]
  - - [2304, 64, 1, 64, 2304, 2304, 2304, 64]
    - [4, 1903.01]
  - - [2368, 64, 1, 64, 2368, 2368, 2368, 64]
    - [16, 2002.74]
  - - [2432, 64, 1, 64, 2432, 2432, 2432, 64]
    - [19, 2153.37]
  - - [2496, 64, 1, 64, 2496, 2496, 2496, 64]
    - [16, 2212.89]
  - - [2560, 64, 1, 64, 2560, 2560, 2560, 64]
    - [16, 2251.12]
  - - [2624, 64, 1, 64, 2624, 2624, 2624, 64]
    - [17, 2308.39]
  - - [2688, 64, 1, 64, 2688, 2688, 2688, 64]
    - [5, 2373.37]
  - - [2752, 64, 1, 64, 2752, 2752, 2752, 64]
    - [16, 2423.09]
  - - [2816, 64, 1, 64, 2816, 2816, 2816, 64]
    - [7, 2448.89]
  - - [2880, 64, 1, 64, 2880, 2880, 2880, 64]
    - [4, 2513.62]
  - - [2944, 64, 1, 64, 2944, 2944, 2944, 64]
    - [19, 2561.85]
  - - [3008, 64, 1, 64, 3008, 3008, 3008, 64]
    - [19, 2607.57]
  - - [3072, 64, 1, 64, 3072, 3072, 3072, 64]
    - [18, 2651.25]
  - - [3136, 64, 1, 64, 3136, 3136, 3136, 64]
    - [7, 2674.38]
  - - [3200, 64, 1, 64, 3200, 3200, 3200, 64]
    - [7, 2723.28]
  - - [3264, 64, 1, 64, 3264, 3264, 3264, 64]
    - [5, 2761.11]
  - - [3328, 64, 1, 64, 3328, 3328, 3328, 64]
    - [7, 2808.3]
  - - [3392, 64, 1, 64, 3392, 3392, 3392, 64]
    - [7, 2874.13]
  - - [3456, 64, 1, 64, 3456, 3456, 3456, 64]
    - [7, 2909.7]
  - - [3520, 64, 1, 64, 3520, 3520, 3520, 64]
    - [7, 2898.64]
  - - [3584, 64, 1, 64, 3584, 3584, 3584, 64]
    - [4, 2943.67]
  - - [3648, 64, 1, 64, 3648, 3648, 3648, 64]
    - [5, 2986.04]
  - - [3712, 64, 1, 64, 3712, 3712, 3712, 64]
    - [4, 3017.93]
  - - [3776, 64, 1, 64, 3776, 3776, 3776, 64]
    - [4, 3030.25]
  - - [3840, 64, 1, 64, 3840, 3840, 3840, 64]
    - [5, 3035.82]
  - - [3904, 64, 1, 64, 3904, 3904, 3904, 64]
    - [7, 3099.59]
  - - [3968, 64, 1, 64, 3968, 3968, 3968, 64]
    - [7, 3147.35]
  - - [4032, 64, 1, 64, 4032, 4032, 4032, 64]
    - [4, 3106.07]
  - - [4096, 64, 1, 64, 4096, 4096, 4096, 64]
    - [4, 3155.39]
  - - [64, 128, 1, 64, 64, 64, 64, 128]
    - [4, 121.757]
  - - [128, 128, 1, 64, 128, 128, 128, 128]
    - [19, 244.593]
  - - [192, 128, 1, 64, 192, 192, 192, 128]
    - [6, 346.597]
  - - [256, 128, 1, 64, 256, 256, 256, 128]
    - [4, 451.775]
  - - [320, 128, 1, 64, 320, 320, 320, 128]
    - [16, 578.298]
  - - [384, 128, 1, 64, 384, 384, 384, 128]
    - [16, 689.093]
  - - [448, 128, 1, 64, 448, 448, 448, 128]
    - [18, 787.384]
  - - [512, 128, 1, 64, 512, 512, 512, 128]
    - [19, 945.936]
  - - [576, 128, 1, 64, 576, 576, 576, 128]
    - [4, 1014.31]
  - - [640, 128, 1, 64, 640, 640, 640, 128]
    - [7, 1100.96]
  - - [704, 128, 1, 64, 704, 704, 704, 128]
    - [18, 1262.51]
  - - [768, 128, 1, 64, 768, 768, 768, 128]
    - [19, 1317.84]
  - - [832, 128, 1, 64, 832, 832, 832, 128]
    - [13, 1381.94]
  - - [896, 128, 1, 64, 896, 896, 896, 128]
    - [17, 1578.83]
  - - [960, 128, 1, 64, 960, 960, 960, 128]
    - [5, 1583.93]
  - - [1024, 128, 1, 64, 1024, 1024, 1024, 128]
    - [1, 1699.47]
  - - [1088, 128, 1, 64, 1088, 1088, 1088, 128]
    - [17, 1746.23]
  - - [1152, 128, 1, 64, 1152, 1152, 1152, 128]
    - [21, 1871.32]
  - - [1216, 128, 1, 64, 1216, 1216, 1216, 128]
    - [6, 1955.51]
  - - [1280, 128, 1, 64, 1280, 1280, 1280, 128]
    - [17, 2149.6]
  - - [1344, 128, 1, 64, 1344, 1344, 1344, 128]
    - [7, 2195.83]
  - - [1408, 128, 1, 64, 1408, 1408, 1408, 128]
    - [16, 2212.56]
  - - [1472, 128, 1, 64, 1472, 1472, 1472, 128]
    - [19, 2520.08]
  - - [1536, 128, 1, 64, 1536, 1536, 1536, 128]
    - [6, 2494.58]
  - - [1600, 128, 1, 64, 1600, 1600, 1600, 128]
    - [15, 2408.92]
  - - [1664, 128, 1, 64, 1664, 1664, 1664, 128]
    - [7, 2672.28]
  - - [1728, 128, 1, 64, 1728, 1728, 1728, 128]
    - [15, 2747.59]
  - - [1792, 128, 1, 64, 1792, 1792, 1792, 128]
    - [4, 2725.05]
  - - [1856, 128, 1, 64, 1856, 1856, 1856, 128]
    - [7, 2821.85]
  - - [1920, 128, 1, 64, 1920, 1920, 1920, 128]
    - [16, 2994.16]
  - - [1984, 128, 1, 64, 1984, 1984, 1984, 128]
    - [8, 3028.28]
  - - [2048, 128, 1, 64, 2048, 2048, 2048, 128]
    - [16, 3082.32]
  - - [2112, 128, 1, 64, 2112, 2112, 2112, 128]
    - [5, 3349.08]
  - - [2176, 128, 1, 64, 2176, 2176, 2176, 128]
    - [19, 3213.56]
  - - [2240, 128, 1, 64, 2240, 2240, 2240, 128]
    - [16, 3347.29]
  - - [2304, 128, 1, 64, 2304, 2304, 2304, 128]
    - [7, 3481.68]
  - - [2368, 128, 1, 64, 2368, 2368, 2368, 128]
    - [0, 3593.64]
  - - [2432, 128, 1, 64, 2432, 2432, 2432, 128]
    - [20, 3537.45]
  - - [2496, 128, 1, 64, 2496, 2496, 2496, 128]
    - [6, 3799.84]
  - - [2560, 128, 1, 64, 2560, 2560, 2560, 128]
    - [5, 3835.97]
  - - [2624, 128, 1, 64, 2624, 2624, 2624, 128]
    - [12, 3805.86]
  - - [2688, 128, 1, 64, 2688, 2688, 2688, 128]
    - [11, 3865.84]
  - - [2752, 128, 1, 64, 2752, 2752, 2752, 128]
    - [10, 4003.55]
  - - [2816, 128, 1, 64, 2816, 2816, 2816, 128]
    - [5, 4148.24]
  - - [2880, 128, 1, 64, 2880, 2880, 2880, 128]
    - [11, 4149.25]
  - - [2944, 128, 1, 64, 2944, 2944, 2944, 128]
    - [7, 4245.94]
  - - [3008, 128, 1, 64, 3008, 3008, 3008, 128]
    - [5, 4302.64]
  - - [3072, 128, 1, 64, 3072, 3072, 3072, 128]
    - [7, 4368.23]
  - - [3136, 128, 1, 64, 3136, 3136, 3136, 128]
    - [4, 4355.66]
  - - [3200, 128, 1, 64, 3200, 3200, 3200, 128]
    - [6, 4436.3]
  - - [3264, 128, 1, 64, 3264, 3264, 3264, 128]
    - [4, 4661.48]
  - - [3328, 128, 1, 64, 3328, 3328, 3328, 128]
    - [4, 4714.25]
  - - [3392, 128, 1, 64, 3392, 3392, 3392, 128]
    - [7, 4747.46]
  - - [3456, 128, 1, 64, 3456, 3456, 3456, 128]
    - [4, 4768.6]
  - - [3520, 128, 1, 64, 3520, 3520, 3520, 128]
    - [7, 4843.04]
  - - [3584, 128, 1, 64, 3584, 3584, 3584, 128]
    - [1, 4868.95]
  - - [3648, 128, 1, 64, 3648, 3648, 3648, 128]
    - [11, 4919.97]
  - - [3712, 128, 1, 64, 3712, 3712, 3712, 128]
    - [3, 5022.02]
  - - [3776, 128, 1, 64, 3776, 3776, 3776, 128]
    - [2, 5037.91]
  - - [3840, 128, 1, 64, 3840, 3840, 3840, 128]
    - [4, 5141.7]
  - - [3904, 128, 1, 64, 3904, 3904, 3904, 128]
    - [1, 5206.94]
  - - [3968, 128, 1, 64, 3968, 3968, 3968, 128]
    - [1, 5225.98]
  - - [4032, 128, 1, 64, 4032, 4032, 4032, 128]
    - [11, 5320.51]
  - - [4096, 128, 1, 64, 4096, 4096, 4096, 128]
    - [0, 5389.34]
  - - [64, 192, 1, 64, 64, 64, 64, 192]
    - [6, 168.039]
  - - [128, 192, 1, 64, 128, 128, 128, 192]
    - [17, 322.832]
  - - [192, 192, 1, 64, 192, 192, 192, 192]
    - [16, 534.131]
  - - [256, 192, 1, 64, 256, 256, 256, 192]
    - [19, 664.63]
  - - [320, 192, 1, 64, 320, 320, 320, 192]
    - [18, 823.994]
  - - [384, 192, 1, 64, 384, 384, 384, 192]
    - [4, 1013.87]
  - - [448, 192, 1, 64, 448, 448, 448, 192]
    - [4, 1147.82]
  - - [512, 192, 1, 64, 512, 512, 512, 192]
    - [5, 1272.79]
  - - [576, 192, 1, 64, 576, 576, 576, 192]
    - [17, 1508.16]
  - - [640, 192, 1, 64, 640, 640, 640, 192]
    - [4, 1642.14]
  - - [704, 192, 1, 64, 704, 704, 704, 192]
    - [10, 1767.25]
  - - [768, 192, 1, 64, 768, 768, 768, 192]
    - [18, 1918.87]
  - - [832, 192, 1, 64, 832, 832, 832, 192]
    - [7, 2007.77]
  - - [896, 192, 1, 64, 896, 896, 896, 192]
    - [18, 2141.58]
  - - [960, 192, 1, 64, 960, 960, 960, 192]
    - [6, 2300.82]
  - - [1024, 192, 1, 64, 1024, 1024, 1024, 192]
    - [17, 2465.28]
  - - [1088, 192, 1, 64, 1088, 1088, 1088, 192]
    - [7, 2497.52]
  - - [1152, 192, 1, 64, 1152, 1152, 1152, 192]
    - [9, 2634.59]
  - - [1216, 192, 1, 64, 1216, 1216, 1216, 192]
    - [16, 2840.16]
  - - [1280, 192, 1, 64, 1280, 1280, 1280, 192]
    - [9, 3051.14]
  - - [1344, 192, 1, 64, 1344, 1344, 1344, 192]
    - [6, 3154.73]
  - - [1408, 192, 1, 64, 1408, 1408, 1408, 192]
    - [16, 3196.83]
  - - [1472, 192, 1, 64, 1472, 1472, 1472, 192]
    - [19, 3267.27]
  - - [1536, 192, 1, 64, 1536, 1536, 1536, 192]
    - [7, 3368.57]
  - - [1600, 192, 1, 64, 1600, 1600, 1600, 192]
    - [4, 3497.06]
  - - [1664, 192, 1, 64, 1664, 1664, 1664, 192]
    - [1, 3622.78]
  - - [1728, 192, 1, 64, 1728, 1728, 1728, 192]
    - [20, 3818.94]
  - - [1792, 192, 1, 64, 1792, 1792, 1792, 192]
    - [2, 3852.98]
  - - [1856, 192, 1, 64, 1856, 1856, 1856, 192]
    - [10, 3992.69]
  - - [1920, 192, 1, 64, 1920, 1920, 1920, 192]
    - [5, 4257.08]
  - - [1984, 192, 1, 64, 1984, 1984, 1984, 192]
    - [2, 4299.7]
  - - [2048, 192, 1, 64, 2048, 2048, 2048, 192]
    - [5, 4442.26]
  - - [2112, 192, 1, 64, 2112, 2112, 2112, 192]
    - [16, 4482.95]
  - - [2176, 192, 1, 64, 2176, 2176, 2176, 192]
    - [5, 4573.8]
  - - [2240, 192, 1, 64, 2240, 2240, 2240, 192]
    - [6, 4598.98]
  - - [2304, 192, 1, 64, 2304, 2304, 2304, 192]
    - [7, 4797.71]
  - - [2368, 192, 1, 64, 2368, 2368, 2368, 192]
    - [4, 4928.46]
  - - [2432, 192, 1, 64, 2432, 2432, 2432, 192]
    - [3, 4969.91]
  - - [2496, 192, 1, 64, 2496, 2496, 2496, 192]
    - [9, 5028.77]
  - - [2560, 192, 1, 64, 2560, 2560, 2560, 192]
    - [4, 5260.33]
  - - [2624, 192, 1, 64, 2624, 2624, 2624, 192]
    - [4, 5336.53]
  - - [2688, 192, 1, 64, 2688, 2688, 2688, 192]
    - [0, 5352.37]
  - - [2752, 192, 1, 64, 2752, 2752, 2752, 192]
    - [4, 5540.0]
  - - [2816, 192, 1, 64, 2816, 2816, 2816, 192]
    - [4, 5577.44]
  - - [2880, 192, 1, 64, 2880, 2880, 2880, 192]
    - [1, 5592.43]
  - - [2944, 192, 1, 64, 2944, 2944, 2944, 192]
    - [11, 5681.73]
  - - [3008, 192, 1, 64, 3008, 3008, 3008, 192]
    - [4, 5849.32]
  - - [3072, 192, 1, 64, 3072, 3072, 3072, 192]
    - [3, 5798.51]
  - - [3136, 192, 1, 64, 3136, 3136, 3136, 192]
    - [4, 6002.32]
  - - [3200, 192, 1, 64, 3200, 3200, 3200, 192]
    - [4, 6062.46]
  - - [3264, 192, 1, 64, 3264, 3264, 3264, 192]
    - [4, 6049.41]
  - - [3328, 192, 1, 64, 3328, 3328, 3328, 192]
    - [4, 6275.96]
  - - [3392, 192, 1, 64, 3392, 3392, 3392, 192]
    - [4, 6314.26]
  - - [3456, 192, 1, 64, 3456, 3456, 3456, 192]
    - [4, 6428.5]
  - - [3520, 192, 1, 64, 3520, 3520, 3520, 192]
    - [4, 6482.78]
  - - [3584, 192, 1, 64, 3584, 3584, 3584, 192]
    - [4, 6507.02]
  - - [3648, 192, 1, 64, 3648, 3648, 3648, 192]
    - [4, 6684.46]
  - - [3712, 192, 1, 64, 3712, 3712, 3712, 192]
    - [4, 6776.49]
  - - [3776, 192, 1, 64, 3776, 3776, 3776, 192]
    - [0, 6727.39]
  - - [3840, 192, 1, 64, 3840, 3840, 3840, 192]
    - [4, 6826.59]
  - - [3904, 192, 1, 64, 3904, 3904, 3904, 192]
    - [4, 6909.38]
  - - [3968, 192, 1, 64, 3968, 3968, 3968, 192]
    - [4, 7051.09]
  - - [4032, 192, 1, 64, 4032, 4032, 4032, 192]
    - [0, 7096.03]
  - - [4096, 192, 1, 64, 4096, 4096, 4096, 192]
    - [11, 7095.84]
  - - [64, 256, 1, 64, 64, 64, 64, 256]
    - [4, 227.949]
  - - [128, 256, 1, 64, 128, 128, 128, 256]
    - [16, 478.466]
  - - [192, 256, 1, 64, 192, 192, 192, 256]
    - [18, 664.486]
  - - [256, 256, 1, 64, 256, 256, 256, 256]
    - [13, 889.373]
  - - [320, 256, 1, 64, 320, 320, 320, 256]
    - [17, 1072.15]
  - - [384, 256, 1, 64, 384, 384, 384, 256]
    - [5, 1367.98]
  - - [448, 256, 1, 64, 448, 448, 448, 256]
    - [4, 1513.39]
  - - [512, 256, 1, 64, 512, 512, 512, 256]
    - [18, 1728.16]
  - - [576, 256, 1, 64, 576, 576, 576, 256]
    - [9, 1828.89]
  - - [640, 256, 1, 64, 640, 640, 640, 256]
    - [5, 2073.08]
  - - [704, 256, 1, 64, 704, 704, 704, 256]
    - [6, 2261.6]
  - - [768, 256, 1, 64, 768, 768, 768, 256]
    - [5, 2509.52]
  - - [832, 256, 1, 64, 832, 832, 832, 256]
    - [6, 2585.1]
  - - [896, 256, 1, 64, 896, 896, 896, 256]
    - [19, 2812.77]
  - - [960, 256, 1, 64, 960, 960, 960, 256]
    - [6, 3257.07]
  - - [1024, 256, 1, 64, 1024, 1024, 1024, 256]
    - [16, 3083.99]
  - - [1088, 256, 1, 64, 1088, 1088, 1088, 256]
    - [17, 3242.2]
  - - [1152, 256, 1, 64, 1152, 1152, 1152, 256]
    - [0, 3430.41]
  - - [1216, 256, 1, 64, 1216, 1216, 1216, 256]
    - [16, 3681.88]
  - - [1280, 256, 1, 64, 1280, 1280, 1280, 256]
    - [13, 3764.36]
  - - [1344, 256, 1, 64, 1344, 1344, 1344, 256]
    - [1, 3945.55]
  - - [1408, 256, 1, 64, 1408, 1408, 1408, 256]
    - [16, 4027.97]
  - - [1472, 256, 1, 64, 1472, 1472, 1472, 256]
    - [1, 4158.83]
  - - [1536, 256, 1, 64, 1536, 1536, 1536, 256]
    - [16, 4376.59]
  - - [1600, 256, 1, 64, 1600, 1600, 1600, 256]
    - [7, 4672.8]
  - - [1664, 256, 1, 64, 1664, 1664, 1664, 256]
    - [16, 4634.12]
  - - [1728, 256, 1, 64, 1728, 1728, 1728, 256]
    - [7, 4904.9]
  - - [1792, 256, 1, 64, 1792, 1792, 1792, 256]
    - [4, 5015.31]
  - - [1856, 256, 1, 64, 1856, 1856, 1856, 256]
    - [11, 4985.79]
  - - [1920, 256, 1, 64, 1920, 1920, 1920, 256]
    - [9, 5122.44]
  - - [1984, 256, 1, 64, 1984, 1984, 1984, 256]
    - [1, 5282.89]
  - - [2048, 256, 1, 64, 2048, 2048, 2048, 256]
    - [4, 5433.83]
  - - [2112, 256, 1, 64, 2112, 2112, 2112, 256]
    - [4, 5635.58]
  - - [2176, 256, 1, 64, 2176, 2176, 2176, 256]
    - [12, 5625.9]
  - - [2240, 256, 1, 64, 2240, 2240, 2240, 256]
    - [4, 5784.95]
  - - [2304, 256, 1, 64, 2304, 2304, 2304, 256]
    - [4, 5824.48]
  - - [2368, 256, 1, 64, 2368, 2368, 2368, 256]
    - [4, 6000.16]
  - - [2432, 256, 1, 64, 2432, 2432, 2432, 256]
    - [4, 6103.77]
  - - [2496, 256, 1, 64, 2496, 2496, 2496, 256]
    - [4, 6241.45]
  - - [2560, 256, 1, 64, 2560, 2560, 2560, 256]
    - [2, 6189.87]
  - - [2624, 256, 1, 64, 2624, 2624, 2624, 256]
    - [4, 6442.57]
  - - [2688, 256, 1, 64, 2688, 2688, 2688, 256]
    - [11, 6483.08]
  - - [2752, 256, 1, 64, 2752, 2752, 2752, 256]
    - [4, 6743.71]
  - - [2816, 256, 1, 64, 2816, 2816, 2816, 256]
    - [4, 6821.92]
  - - [2880, 256, 1, 64, 2880, 2880, 2880, 256]
    - [4, 6956.39]
  - - [2944, 256, 1, 64, 2944, 2944, 2944, 256]
    - [0, 6954.12]
  - - [3008, 256, 1, 64, 3008, 3008, 3008, 256]
    - [4, 7085.92]
  - - [3072, 256, 1, 64, 3072, 3072, 3072, 256]
    - [0, 7018.65]
  - - [3136, 256, 1, 64, 3136, 3136, 3136, 256]
    - [4, 7352.56]
  - - [3200, 256, 1, 64, 3200, 3200, 3200, 256]
    - [4, 7504.76]
  - - [3264, 256, 1, 64, 3264, 3264, 3264, 256]
    - [4, 7526.59]
  - - [3328, 256, 1, 64, 3328, 3328, 3328, 256]
    - [4, 7592.95]
  - - [3392, 256, 1, 64, 3392, 3392, 3392, 256]
    - [4, 7674.93]
  - - [3456, 256, 1, 64, 3456, 3456, 3456, 256]
    - [4, 7817.55]
  - - [3520, 256, 1, 64, 3520, 3520, 3520, 256]
    - [4, 7852.76]
  - - [3584, 256, 1, 64, 3584, 3584, 3584, 256]
    - [0, 7937.18]
  - - [3648, 256, 1, 64, 3648, 3648, 3648, 256]
    - [0, 8192.98]
  - - [3712, 256, 1, 64, 3712, 3712, 3712, 256]
    - [9, 8198.49]
  - - [3776, 256, 1, 64, 3776, 3776, 3776, 256]
    - [0, 8304.02]
  - - [3840, 256, 1, 64, 3840, 3840, 3840, 256]
    - [0, 8434.72]
  - - [3904, 256, 1, 64, 3904, 3904, 3904, 256]
    - [9, 10209.5]
  - - [3968, 256, 1, 64, 3968, 3968, 3968, 256]
    - [0, 10271.9]
  - - [4032, 256, 1, 64, 4032, 4032, 4032, 256]
    - [0, 10401.4]
  - - [4096, 256, 1, 64, 4096, 4096, 4096, 256]
    - [0, 10345.1]
  - - [64, 320, 1, 64, 64, 64, 64, 320]
    - [7, 275.473]
  - - [128, 320, 1, 64, 128, 128, 128, 320]
    - [1, 585.532]
  - - [192, 320, 1, 64, 192, 192, 192, 320]
    - [6, 837.686]
  - - [256, 320, 1, 64, 256, 256, 256, 320]
    - [7, 1101.89]
  - - [320, 320, 1, 64, 320, 320, 320, 320]
    - [16, 1374.19]
  - - [384, 320, 1, 64, 384, 384, 384, 320]
    - [9, 1657.03]
  - - [448, 320, 1, 64, 448, 448, 448, 320]
    - [9, 1839.75]
  - - [512, 320, 1, 64, 512, 512, 512, 320]
    - [5, 2216.82]
  - - [576, 320, 1, 64, 576, 576, 576, 320]
    - [9, 2495.0]
  - - [640, 320, 1, 64, 640, 640, 640, 320]
    - [5, 2733.47]
  - - [704, 320, 1, 64, 704, 704, 704, 320]
    - [6, 3011.25]
  - - [768, 320, 1, 64, 768, 768, 768, 320]
    - [7, 3160.85]
  - - [832, 320, 1, 64, 832, 832, 832, 320]
    - [7, 3426.32]
  - - [896, 320, 1, 64, 896, 896, 896, 320]
    - [3, 3689.9]
  - - [960, 320, 1, 64, 960, 960, 960, 320]
    - [0, 3618.06]
  - - [1024, 320, 1, 64, 1024, 1024, 1024, 320]
    - [16, 3760.29]
  - - [1088, 320, 1, 64, 1088, 1088, 1088, 320]
    - [3, 3996.06]
  - - [1152, 320, 1, 64, 1152, 1152, 1152, 320]
    - [5, 4146.32]
  - - [1216, 320, 1, 64, 1216, 1216, 1216, 320]
    - [4, 4345.4]
  - - [1280, 320, 1, 64, 1280, 1280, 1280, 320]
    - [5, 4547.91]
  - - [1344, 320, 1, 64, 1344, 1344, 1344, 320]
    - [7, 4771.17]
  - - [1408, 320, 1, 64, 1408, 1408, 1408, 320]
    - [4, 4896.48]
  - - [1472, 320, 1, 64, 1472, 1472, 1472, 320]
    - [3, 4993.57]
  - - [1536, 320, 1, 64, 1536, 1536, 1536, 320]
    - [1, 5105.81]
  - - [1600, 320, 1, 64, 1600, 1600, 1600, 320]
    - [4, 5355.93]
  - - [1664, 320, 1, 64, 1664, 1664, 1664, 320]
    - [11, 5477.07]
  - - [1728, 320, 1, 64, 1728, 1728, 1728, 320]
    - [11, 5656.81]
  - - [1792, 320, 1, 64, 1792, 1792, 1792, 320]
    - [0, 5770.37]
  - - [1856, 320, 1, 64, 1856, 1856, 1856, 320]
    - [4, 5973.64]
  - - [1920, 320, 1, 64, 1920, 1920, 1920, 320]
    - [1, 6038.26]
  - - [1984, 320, 1, 64, 1984, 1984, 1984, 320]
    - [4, 6254.86]
  - - [2048, 320, 1, 64, 2048, 2048, 2048, 320]
    - [4, 6271.32]
  - - [2112, 320, 1, 64, 2112, 2112, 2112, 320]
    - [4, 6582.42]
  - - [2176, 320, 1, 64, 2176, 2176, 2176, 320]
    - [4, 6671.23]
  - - [2240, 320, 1, 64, 2240, 2240, 2240, 320]
    - [0, 6743.28]
  - - [2304, 320, 1, 64, 2304, 2304, 2304, 320]
    - [4, 6954.34]
  - - [2368, 320, 1, 64, 2368, 2368, 2368, 320]
    - [4, 7044.78]
  - - [2432, 320, 1, 64, 2432, 2432, 2432, 320]
    - [4, 7224.64]
  - - [2496, 320, 1, 64, 2496, 2496, 2496, 320]
    - [4, 7392.27]
  - - [2560, 320, 1, 64, 2560, 2560, 2560, 320]
    - [4, 7422.92]
  - - [2624, 320, 1, 64, 2624, 2624, 2624, 320]
    - [9, 7470.96]
  - - [2688, 320, 1, 64, 2688, 2688, 2688, 320]
    - [3, 7606.7]
  - - [2752, 320, 1, 64, 2752, 2752, 2752, 320]
    - [0, 7809.34]
  - - [2816, 320, 1, 64, 2816, 2816, 2816, 320]
    - [4, 7893.69]
  - - [2880, 320, 1, 64, 2880, 2880, 2880, 320]
    - [11, 7973.69]
  - - [2944, 320, 1, 64, 2944, 2944, 2944, 320]
    - [0, 8203.12]
  - - [3008, 320, 1, 64, 3008, 3008, 3008, 320]
    - [0, 8275.5]
  - - [3072, 320, 1, 64, 3072, 3072, 3072, 320]
    - [0, 8107.44]
  - - [3136, 320, 1, 64, 3136, 3136, 3136, 320]
    - [9, 10106.1]
  - - [3200, 320, 1, 64, 3200, 3200, 3200, 320]
    - [11, 10453.9]
  - - [3264, 320, 1, 64, 3264, 3264, 3264, 320]
    - [11, 10666.3]
  - - [3328, 320, 1, 64, 3328, 3328, 3328, 320]
    - [11, 10846.1]
  - - [3392, 320, 1, 64, 3392, 3392, 3392, 320]
    - [0, 11111.3]
  - - [3456, 320, 1, 64, 3456, 3456, 3456, 320]
    - [9, 11142.6]
  - - [3520, 320, 1, 64, 3520, 3520, 3520, 320]
    - [11, 11420.9]
  - - [3584, 320, 1, 64, 3584, 3584, 3584, 320]
    - [0, 11584.4]
  - - [3648, 320, 1, 64, 3648, 3648, 3648, 320]
    - [0, 11765.4]
  - - [3712, 320, 1, 64, 3712, 3712, 3712, 320]
    - [0, 11806.3]
  - - [3776, 320, 1, 64, 3776, 3776, 3776, 320]
    - [0, 11963.4]
  - - [3840, 320, 1, 64, 3840, 3840, 3840, 320]
    - [0, 12085.8]
  - - [3904, 320, 1, 64, 3904, 3904, 3904, 320]
    - [0, 12353.6]
  - - [3968, 320, 1, 64, 3968, 3968, 3968, 320]
    - [0, 12353.8]
  - - [4032, 320, 1, 64, 4032, 4032, 4032, 320]
    - [0, 12778.5]
  - - [4096, 320, 1, 64, 4096, 4096, 4096, 320]
    - [0, 12488.5]
  - - [64, 384, 1, 64, 64, 64, 64, 384]
    - [15, 324.764]
  - - [128, 384, 1, 64, 128, 128, 128, 384]
    - [7, 725.144]
  - - [192, 384, 1, 64, 192, 192, 192, 384]
    - [19, 996.945]
  - - [256, 384, 1, 64, 256, 256, 256, 384]
    - [5, 1265.62]
  - - [320, 384, 1, 64, 320, 320, 320, 384]
    - [19, 1626.51]
  - - [384, 384, 1, 64, 384, 384, 384, 384]
    - [16, 2104.17]
  - - [448, 384, 1, 64, 448, 448, 448, 384]
    - [20, 2246.46]
  - - [512, 384, 1, 64, 512, 512, 512, 384]
    - [5, 2592.78]
  - - [576, 384, 1, 64, 576, 576, 576, 384]
    - [7, 2898.37]
  - - [640, 384, 1, 64, 640, 640, 640, 384]
    - [7, 3129.39]
  - - [704, 384, 1, 64, 704, 704, 704, 384]
    - [9, 3434.83]
  - - [768, 384, 1, 64, 768, 768, 768, 384]
    - [15, 3801.45]
  - - [832, 384, 1, 64, 832, 832, 832, 384]
    - [20, 4092.66]
  - - [896, 384, 1, 64, 896, 896, 896, 384]
    - [13, 4266.57]
  - - [960, 384, 1, 64, 960, 960, 960, 384]
    - [2, 4467.43]
  - - [1024, 384, 1, 64, 1024, 1024, 1024, 384]
    - [7, 4432.1]
  - - [1088, 384, 1, 64, 1088, 1088, 1088, 384]
    - [6, 4712.41]
  - - [1152, 384, 1, 64, 1152, 1152, 1152, 384]
    - [7, 4872.84]
  - - [1216, 384, 1, 64, 1216, 1216, 1216, 384]
    - [4, 5059.11]
  - - [1280, 384, 1, 64, 1280, 1280, 1280, 384]
    - [4, 5292.21]
  - - [1344, 384, 1, 64, 1344, 1344, 1344, 384]
    - [4, 5409.41]
  - - [1408, 384, 1, 64, 1408, 1408, 1408, 384]
    - [3, 5595.48]
  - - [1472, 384, 1, 64, 1472, 1472, 1472, 384]
    - [4, 5811.29]
  - - [1536, 384, 1, 64, 1536, 1536, 1536, 384]
    - [4, 5935.24]
  - - [1600, 384, 1, 64, 1600, 1600, 1600, 384]
    - [4, 6171.85]
  - - [1664, 384, 1, 64, 1664, 1664, 1664, 384]
    - [4, 6303.02]
  - - [1728, 384, 1, 64, 1728, 1728, 1728, 384]
    - [4, 6470.64]
  - - [1792, 384, 1, 64, 1792, 1792, 1792, 384]
    - [4, 6678.8]
  - - [1856, 384, 1, 64, 1856, 1856, 1856, 384]
    - [4, 6831.34]
  - - [1920, 384, 1, 64, 1920, 1920, 1920, 384]
    - [4, 7035.32]
  - - [1984, 384, 1, 64, 1984, 1984, 1984, 384]
    - [4, 7111.82]
  - - [2048, 384, 1, 64, 2048, 2048, 2048, 384]
    - [11, 7132.11]
  - - [2112, 384, 1, 64, 2112, 2112, 2112, 384]
    - [4, 7394.86]
  - - [2176, 384, 1, 64, 2176, 2176, 2176, 384]
    - [4, 7569.31]
  - - [2240, 384, 1, 64, 2240, 2240, 2240, 384]
    - [4, 7713.3]
  - - [2304, 384, 1, 64, 2304, 2304, 2304, 384]
    - [3, 7759.75]
  - - [2368, 384, 1, 64, 2368, 2368, 2368, 384]
    - [0, 8038.09]
  - - [2432, 384, 1, 64, 2432, 2432, 2432, 384]
    - [0, 8165.11]
  - - [2496, 384, 1, 64, 2496, 2496, 2496, 384]
    - [0, 8293.85]
  - - [2560, 384, 1, 64, 2560, 2560, 2560, 384]
    - [0, 8499.64]
  - - [2624, 384, 1, 64, 2624, 2624, 2624, 384]
    - [9, 10451.6]
  - - [2688, 384, 1, 64, 2688, 2688, 2688, 384]
    - [0, 10666.9]
  - - [2752, 384, 1, 64, 2752, 2752, 2752, 384]
    - [9, 10984.7]
  - - [2816, 384, 1, 64, 2816, 2816, 2816, 384]
    - [0, 11183.9]
  - - [2880, 384, 1, 64, 2880, 2880, 2880, 384]
    - [9, 11155.0]
  - - [2944, 384, 1, 64, 2944, 2944, 2944, 384]
    - [0, 11703.6]
  - - [3008, 384, 1, 64, 3008, 3008, 3008, 384]
    - [9, 11636.1]
  - - [3072, 384, 1, 64, 3072, 3072, 3072, 384]
    - [11, 11829.7]
  - - [3136, 384, 1, 64, 3136, 3136, 3136, 384]
    - [0, 12004.7]
  - - [3200, 384, 1, 64, 3200, 3200, 3200, 384]
    - [0, 12234.4]
  - - [3264, 384, 1, 64, 3264, 3264, 3264, 384]
    - [0, 12551.3]
  - - [3328, 384, 1, 64, 3328, 3328, 3328, 384]
    - [0, 12698.1]
  - - [3392, 384, 1, 64, 3392, 3392, 3392, 384]
    - [0, 13053.7]
  - - [3456, 384, 1, 64, 3456, 3456, 3456, 384]
    - [0, 13070.7]
  - - [3520, 384, 1, 64, 3520, 3520, 3520, 384]
    - [0, 13430.8]
  - - [3584, 384, 1, 64, 3584, 3584, 3584, 384]
    - [0, 13573.7]
  - - [3648, 384, 1, 64, 3648, 3648, 3648, 384]
    - [0, 13413.1]
  - - [3712, 384, 1, 64, 3712, 3712, 3712, 384]
    - [0, 13650.4]
  - - [3776, 384, 1, 64, 3776, 3776, 3776, 384]
    - [0, 13850.5]
  - - [3840, 384, 1, 64, 3840, 3840, 3840, 384]
    - [0, 13937.6]
  - - [3904, 384, 1, 64, 3904, 3904, 3904, 384]
    - [0, 14320.1]
  - - [3968, 384, 1, 64, 3968, 3968, 3968, 384]
    - [0, 14261.0]
  - - [4032, 384, 1, 64, 4032, 4032, 4032, 384]
    - [0, 14597.8]
  - - [4096, 384, 1, 64, 4096, 4096, 4096, 384]
    - [0, 14454.8]
  - - [64, 448, 1, 64, 64, 64, 64, 448]
    - [18, 472.453]
  - - [128, 448, 1, 64, 128, 128, 128, 448]
    - [20, 830.32]
  - - [192, 448, 1, 64, 192, 192, 192, 448]
    - [4, 1310.08]
  - - [256, 448, 1, 64, 256, 256, 256, 448]
    - [17, 1774.24]
  - - [320, 448, 1, 64, 320, 320, 320, 448]
    - [12, 2089.99]
  - - [384, 448, 1, 64, 384, 384, 384, 448]
    - [19, 2343.54]
  - - [448, 448, 1, 64, 448, 448, 448, 448]
    - [5, 2847.46]
  - - [512, 448, 1, 64, 512, 512, 512, 448]
    - [7, 3309.3]
  - - [576, 448, 1, 64, 576, 576, 576, 448]
    - [4, 3444.21]
  - - [640, 448, 1, 64, 640, 640, 640, 448]
    - [16, 3804.68]
  - - [704, 448, 1, 64, 704, 704, 704, 448]
    - [6, 4152.43]
  - - [768, 448, 1, 64, 768, 768, 768, 448]
    - [16, 4724.3]
  - - [832, 448, 1, 64, 832, 832, 832, 448]
    - [7, 4790.16]
  - - [896, 448, 1, 64, 896, 896, 896, 448]
    - [6, 5087.13]
  - - [960, 448, 1, 64, 960, 960, 960, 448]
    - [4, 5455.92]
  - - [1024, 448, 1, 64, 1024, 1024, 1024, 448]
    - [1, 5375.34]
  - - [1088, 448, 1, 64, 1088, 1088, 1088, 448]
    - [4, 5217.41]
  - - [1152, 448, 1, 64, 1152, 1152, 1152, 448]
    - [2, 5434.35]
  - - [1216, 448, 1, 64, 1216, 1216, 1216, 448]
    - [4, 5718.39]
  - - [1280, 448, 1, 64, 1280, 1280, 1280, 448]
    - [4, 5940.46]
  - - [1344, 448, 1, 64, 1344, 1344, 1344, 448]
    - [4, 6080.96]
  - - [1408, 448, 1, 64, 1408, 1408, 1408, 448]
    - [2, 6168.99]
  - - [1472, 448, 1, 64, 1472, 1472, 1472, 448]
    - [4, 6493.08]
  - - [1536, 448, 1, 64, 1536, 1536, 1536, 448]
    - [4, 6605.65]
  - - [1600, 448, 1, 64, 1600, 1600, 1600, 448]
    - [4, 6917.22]
  - - [1664, 448, 1, 64, 1664, 1664, 1664, 448]
    - [4, 7073.37]
  - - [1728, 448, 1, 64, 1728, 1728, 1728, 448]
    - [4, 7284.96]
  - - [1792, 448, 1, 64, 1792, 1792, 1792, 448]
    - [4, 7433.45]
  - - [1856, 448, 1, 64, 1856, 1856, 1856, 448]
    - [4, 7567.53]
  - - [1920, 448, 1, 64, 1920, 1920, 1920, 448]
    - [4, 7749.13]
  - - [1984, 448, 1, 64, 1984, 1984, 1984, 448]
    - [0, 7849.49]
  - - [2048, 448, 1, 64, 2048, 2048, 2048, 448]
    - [0, 7773.37]
  - - [2112, 448, 1, 64, 2112, 2112, 2112, 448]
    - [0, 8184.22]
  - - [2176, 448, 1, 64, 2176, 2176, 2176, 448]
    - [0, 8489.6]
  - - [2240, 448, 1, 64, 2240, 2240, 2240, 448]
    - [9, 10385.6]
  - - [2304, 448, 1, 64, 2304, 2304, 2304, 448]
    - [0, 10583.1]
  - - [2368, 448, 1, 64, 2368, 2368, 2368, 448]
    - [0, 11181.7]
  - - [2432, 448, 1, 64, 2432, 2432, 2432, 448]
    - [0, 11351.1]
  - - [2496, 448, 1, 64, 2496, 2496, 2496, 448]
    - [11, 11441.3]
  - - [2560, 448, 1, 64, 2560, 2560, 2560, 448]
    - [0, 11621.2]
  - - [2624, 448, 1, 64, 2624, 2624, 2624, 448]
    - [0, 12158.3]
  - - [2688, 448, 1, 64, 2688, 2688, 2688, 448]
    - [0, 12085.6]
  - - [2752, 448, 1, 64, 2752, 2752, 2752, 448]
    - [0, 12502.7]
  - - [2816, 448, 1, 64, 2816, 2816, 2816, 448]
    - [0, 12611.7]
  - - [2880, 448, 1, 64, 2880, 2880, 2880, 448]
    - [0, 12892.3]
  - - [2944, 448, 1, 64, 2944, 2944, 2944, 448]
    - [0, 13117.4]
  - - [3008, 448, 1, 64, 3008, 3008, 3008, 448]
    - [0, 13342.4]
  - - [3072, 448, 1, 64, 3072, 3072, 3072, 448]
    - [0, 13185.7]
  - - [3136, 448, 1, 64, 3136, 3136, 3136, 448]
    - [0, 13512.9]
  - - [3200, 448, 1, 64, 3200, 3200, 3200, 448]
    - [0, 13706.3]
  - - [3264, 448, 1, 64, 3264, 3264, 3264, 448]
    - [0, 13959.5]
  - - [3328, 448, 1, 64, 3328, 3328, 3328, 448]
    - [0, 14107.1]
  - - [3392, 448, 1, 64, 3392, 3392, 3392, 448]
    - [0, 14357.1]
  - - [3456, 448, 1, 64, 3456, 3456, 3456, 448]
    - [0, 14559.2]
  - - [3520, 448, 1, 64, 3520, 3520, 3520, 448]
    - [9, 14224.8]
  - - [3584, 448, 1, 64, 3584, 3584, 3584, 448]
    - [9, 14009.6]
  - - [3648, 448, 1, 64, 3648, 3648, 3648, 448]
    - [9, 14608.3]
  - - [3712, 448, 1, 64, 3712, 3712, 3712, 448]
    - [9, 14726.7]
  - - [3776, 448, 1, 64, 3776, 3776, 3776, 448]
    - [9, 14892.0]
  - - [3840, 448, 1, 64, 3840, 3840, 3840, 448]
    - [9, 14872.4]
  - - [3904, 448, 1, 64, 3904, 3904, 3904, 448]
    - [9, 15103.9]
  - - [3968, 448, 1, 64, 3968, 3968, 3968, 448]
    - [9, 15189.6]
  - - [4032, 448, 1, 64, 4032, 4032, 4032, 448]
    - [9, 15328.2]
  - - [4096, 448, 1, 64, 4096, 4096, 4096, 448]
    - [9, 14768.6]
  - - [64, 512, 1, 64, 64, 64, 64, 512]
    - [5, 519.737]
  - - [128, 512, 1, 64, 128, 128, 128, 512]
    - [19, 959.789]
  - - [192, 512, 1, 64, 192, 192, 192, 512]
    - [2, 1371.29]
  - - [256, 512, 1, 64, 256, 256, 256, 512]
    - [19, 1900.89]
  - - [320, 512, 1, 64, 320, 320, 320, 512]
    - [7, 2366.98]
  - - [384, 512, 1, 64, 384, 384, 384, 512]
    - [4, 2710.08]
  - - [448, 512, 1, 64, 448, 448, 448, 512]
    - [9, 3134.72]
  - - [512, 512, 1, 64, 512, 512, 512, 512]
    - [2, 3502.53]
  - - [576, 512, 1, 64, 576, 576, 576, 512]
    - [4, 4167.42]
  - - [640, 512, 1, 64, 640, 640, 640, 512]
    - [10, 4246.06]
  - - [704, 512, 1, 64, 704, 704, 704, 512]
    - [12, 4749.52]
  - - [768, 512, 1, 64, 768, 768, 768, 512]
    - [15, 5081.93]
  - - [832, 512, 1, 64, 832, 832, 832, 512]
    - [6, 5379.38]
  - - [896, 512, 1, 64, 896, 896, 896, 512]
    - [3, 5652.7]
  - - [960, 512, 1, 64, 960, 960, 960, 512]
    - [1, 6028.58]
  - - [1024, 512, 1, 64, 1024, 1024, 1024, 512]
    - [4, 5553.53]
  - - [1088, 512, 1, 64, 1088, 1088, 1088, 512]
    - [3, 5766.04]
  - - [1152, 512, 1, 64, 1152, 1152, 1152, 512]
    - [4, 6118.11]
  - - [1216, 512, 1, 64, 1216, 1216, 1216, 512]
    - [4, 6277.91]
  - - [1280, 512, 1, 64, 1280, 1280, 1280, 512]
    - [4, 6413.26]
  - - [1344, 512, 1, 64, 1344, 1344, 1344, 512]
    - [4, 6712.37]
  - - [1408, 512, 1, 64, 1408, 1408, 1408, 512]
    - [4, 6818.97]
  - - [1472, 512, 1, 64, 1472, 1472, 1472, 512]
    - [4, 7074.53]
  - - [1536, 512, 1, 64, 1536, 1536, 1536, 512]
    - [1, 7048.21]
  - - [1600, 512, 1, 64, 1600, 1600, 1600, 512]
    - [4, 7487.64]
  - - [1664, 512, 1, 64, 1664, 1664, 1664, 512]
    - [4, 7700.26]
  - - [1728, 512, 1, 64, 1728, 1728, 1728, 512]
    - [4, 7838.14]
  - - [1792, 512, 1, 64, 1792, 1792, 1792, 512]
    - [4, 8024.09]
  - - [1856, 512, 1, 64, 1856, 1856, 1856, 512]
    - [0, 8256.48]
  - - [1920, 512, 1, 64, 1920, 1920, 1920, 512]
    - [9, 8484.71]
  - - [1984, 512, 1, 64, 1984, 1984, 1984, 512]
    - [9, 10395.2]
  - - [2048, 512, 1, 64, 2048, 2048, 2048, 512]
    - [0, 10112.8]
  - - [2112, 512, 1, 64, 2112, 2112, 2112, 512]
    - [9, 11028.8]
  - - [2176, 512, 1, 64, 2176, 2176, 2176, 512]
    - [11, 11285.7]
  - - [2240, 512, 1, 64, 2240, 2240, 2240, 512]
    - [0, 11689.8]
  - - [2304, 512, 1, 64, 2304, 2304, 2304, 512]
    - [9, 11701.4]
  - - [2368, 512, 1, 64, 2368, 2368, 2368, 512]
    - [9, 11875.5]
  - - [2432, 512, 1, 64, 2432, 2432, 2432, 512]
    - [0, 12403.3]
  - - [2496, 512, 1, 64, 2496, 2496, 2496, 512]
    - [11, 12373.4]
  - - [2560, 512, 1, 64, 2560, 2560, 2560, 512]
    - [0, 12548.4]
  - - [2624, 512, 1, 64, 2624, 2624, 2624, 512]
    - [0, 13250.6]
  - - [2688, 512, 1, 64, 2688, 2688, 2688, 512]
    - [11, 13175.8]
  - - [2752, 512, 1, 64, 2752, 2752, 2752, 512]
    - [0, 13341.8]
  - - [2816, 512, 1, 64, 2816, 2816, 2816, 512]
    - [0, 13421.7]
  - - [2880, 512, 1, 64, 2880, 2880, 2880, 512]
    - [0, 13910.9]
  - - [2944, 512, 1, 64, 2944, 2944, 2944, 512]
    - [0, 14019.6]
  - - [3008, 512, 1, 64, 3008, 3008, 3008, 512]
    - [0, 14437.6]
  - - [3072, 512, 1, 64, 3072, 3072, 3072, 512]
    - [0, 13951.8]
  - - [3136, 512, 1, 64, 3136, 3136, 3136, 512]
    - [9, 14284.1]
  - - [3200, 512, 1, 64, 3200, 3200, 3200, 512]
    - [9, 14409.5]
  - - [3264, 512, 1, 64, 3264, 3264, 3264, 512]
    - [9, 14732.0]
  - - [3328, 512, 1, 64, 3328, 3328, 3328, 512]
    - [9, 14661.4]
  - - [3392, 512, 1, 64, 3392, 3392, 3392, 512]
    - [9, 14955.4]
  - - [3456, 512, 1, 64, 3456, 3456, 3456, 512]
    - [9, 15174.3]
  - - [3520, 512, 1, 64, 3520, 3520, 3520, 512]
    - [9, 15358.6]
  - - [3584, 512, 1, 64, 3584, 3584, 3584, 512]
    - [9, 15112.6]
  - - [3648, 512, 1, 64, 3648, 3648, 3648, 512]
    - [9, 15570.8]
  - - [3712, 512, 1, 64, 3712, 3712, 3712, 512]
    - [9, 15700.8]
  - - [3776, 512, 1, 64, 3776, 3776, 3776, 512]
    - [9, 15495.5]
  - - [3840, 512, 1, 64, 3840, 3840, 3840, 512]
    - [9, 15879.4]
  - - [3904, 512, 1, 64, 3904, 3904, 3904, 512]
    - [9, 16232.1]
  - - [3968, 512, 1, 64, 3968, 3968, 3968, 512]
    - [9, 16388.0]
  - - [4032, 512, 1, 64, 4032, 4032, 4032, 512]
    - [9, 16455.3]
  - - [4096, 512, 1, 64, 4096, 4096, 4096, 512]
    - [9, 15732.8]
  - - [64, 576, 1, 64, 64, 64, 64, 576]
    - [19, 493.781]
  - - [128, 576, 1, 64, 128, 128, 128, 576]
    - [5, 984.882]
  - - [192, 576, 1, 64, 192, 192, 192, 576]
    - [1, 1435.67]
  - - [256, 576, 1, 64, 256, 256, 256, 576]
    - [7, 2102.27]
  - - [320, 576, 1, 64, 320, 320, 320, 576]
    - [19, 2348.03]
  - - [384, 576, 1, 64, 384, 384, 384, 576]
    - [5, 2796.48]
  - - [448, 576, 1, 64, 448, 448, 448, 576]
    - [6, 3345.15]
  - - [512, 576, 1, 64, 512, 512, 512, 576]
    - [2, 3708.13]
  - - [576, 576, 1, 64, 576, 576, 576, 576]
    - [7, 4094.4]
  - - [640, 576, 1, 64, 640, 640, 640, 576]
    - [12, 4770.11]
  - - [704, 576, 1, 64, 704, 704, 704, 576]
    - [5, 4892.01]
  - - [768, 576, 1, 64, 768, 768, 768, 576]
    - [0, 5144.73]
  - - [832, 576, 1, 64, 832, 832, 832, 576]
    - [21, 5540.23]
  - - [896, 576, 1, 64, 896, 896, 896, 576]
    - [11, 5796.75]
  - - [960, 576, 1, 64, 960, 960, 960, 576]
    - [4, 6304.85]
  - - [1024, 576, 1, 64, 1024, 1024, 1024, 576]
    - [4, 5985.17]
  - - [1088, 576, 1, 64, 1088, 1088, 1088, 576]
    - [4, 6237.62]
  - - [1152, 576, 1, 64, 1152, 1152, 1152, 576]
    - [4, 6456.9]
  - - [1216, 576, 1, 64, 1216, 1216, 1216, 576]
    - [4, 6686.5]
  - - [1280, 576, 1, 64, 1280, 1280, 1280, 576]
    - [4, 6973.95]
  - - [1344, 576, 1, 64, 1344, 1344, 1344, 576]
    - [4, 7261.45]
  - - [1408, 576, 1, 64, 1408, 1408, 1408, 576]
    - [4, 7406.44]
  - - [1472, 576, 1, 64, 1472, 1472, 1472, 576]
    - [4, 7666.49]
  - - [1536, 576, 1, 64, 1536, 1536, 1536, 576]
    - [1, 7602.43]
  - - [1600, 576, 1, 64, 1600, 1600, 1600, 576]
    - [0, 8069.78]
  - - [1664, 576, 1, 64, 1664, 1664, 1664, 576]
    - [0, 8315.21]
  - - [1728, 576, 1, 64, 1728, 1728, 1728, 576]
    - [9, 10229.7]
  - - [1792, 576, 1, 64, 1792, 1792, 1792, 576]
    - [0, 10722.3]
  - - [1856, 576, 1, 64, 1856, 1856, 1856, 576]
    - [11, 10931.3]
  - - [1920, 576, 1, 64, 1920, 1920, 1920, 576]
    - [9, 11165.6]
  - - [1984, 576, 1, 64, 1984, 1984, 1984, 576]
    - [11, 11281.4]
  - - [2048, 576, 1, 64, 2048, 2048, 2048, 576]
    - [0, 11312.1]
  - - [2112, 576, 1, 64, 2112, 2112, 2112, 576]
    - [0, 11846.7]
  - - [2176, 576, 1, 64, 2176, 2176, 2176, 576]
    - [0, 12467.5]
  - - [2240, 576, 1, 64, 2240, 2240, 2240, 576]
    - [0, 12633.8]
  - - [2304, 576, 1, 64, 2304, 2304, 2304, 576]
    - [0, 12829.9]
  - - [2368, 576, 1, 64, 2368, 2368, 2368, 576]
    - [0, 13413.2]
  - - [2432, 576, 1, 64, 2432, 2432, 2432, 576]
    - [0, 13174.5]
  - - [2496, 576, 1, 64, 2496, 2496, 2496, 576]
    - [0, 13495.5]
  - - [2560, 576, 1, 64, 2560, 2560, 2560, 576]
    - [0, 13504.8]
  - - [2624, 576, 1, 64, 2624, 2624, 2624, 576]
    - [0, 14294.5]
  - - [2688, 576, 1, 64, 2688, 2688, 2688, 576]
    - [0, 14340.0]
  - - [2752, 576, 1, 64, 2752, 2752, 2752, 576]
    - [9, 14092.1]
  - - [2816, 576, 1, 64, 2816, 2816, 2816, 576]
    - [9, 14142.8]
  - - [2880, 576, 1, 64, 2880, 2880, 2880, 576]
    - [9, 14615.6]
  - - [2944, 576, 1, 64, 2944, 2944, 2944, 576]
    - [9, 14652.0]
  - - [3008, 576, 1, 64, 3008, 3008, 3008, 576]
    - [9, 14779.0]
  - - [3072, 576, 1, 64, 3072, 3072, 3072, 576]
    - [0, 14136.3]
  - - [3136, 576, 1, 64, 3136, 3136, 3136, 576]
    - [9, 15241.3]
  - - [3200, 576, 1, 64, 3200, 3200, 3200, 576]
    - [9, 15519.6]
  - - [3264, 576, 1, 64, 3264, 3264, 3264, 576]
    - [9, 15661.0]
  - - [3328, 576, 1, 64, 3328, 3328, 3328, 576]
    - [9, 15636.4]
  - - [3392, 576, 1, 64, 3392, 3392, 3392, 576]
    - [9, 15937.0]
  - - [3456, 576, 1, 64, 3456, 3456, 3456, 576]
    - [9, 16126.7]
  - - [3520, 576, 1, 64, 3520, 3520, 3520, 576]
    - [9, 16258.7]
  - - [3584, 576, 1, 64, 3584, 3584, 3584, 576]
    - [9, 16078.9]
  - - [3648, 576, 1, 64, 3648, 3648, 3648, 576]
    - [9, 16616.7]
  - - [3712, 576, 1, 64, 3712, 3712, 3712, 576]
    - [9, 16800.3]
  - - [3776, 576, 1, 64, 3776, 3776, 3776, 576]
    - [9, 16529.8]
  - - [3840, 576, 1, 64, 3840, 3840, 3840, 576]
    - [9, 16832.0]
  - - [3904, 576, 1, 64, 3904, 3904, 3904, 576]
    - [9, 17326.8]
  - - [3968, 576, 1, 64, 3968, 3968, 3968, 576]
    - [9, 17160.5]
  - - [4032, 576, 1, 64, 4032, 4032, 4032, 576]
    - [9, 17382.2]
  - - [4096, 576, 1, 64, 4096, 4096, 4096, 576]
    - [9, 16435.7]
  - - [64, 640, 1, 64, 64, 64, 64, 640]
    - [5, 550.954]
  - - [128, 640, 1, 64, 128, 128, 128, 640]
    - [5, 1162.5]
  - - [192, 640, 1, 64, 192, 192, 192, 640]
    - [17, 1587.15]
  - - [256, 640, 1, 64, 256, 256, 256, 640]
    - [19, 2180.9]
  - - [320, 640, 1, 64, 320, 320, 320, 640]
    - [5, 2667.32]
  - - [384, 640, 1, 64, 384, 384, 384, 640]
    - [7, 3226.39]
  - - [448, 640, 1, 64, 448, 448, 448, 640]
    - [5, 3584.68]
  - - [512, 640, 1, 64, 512, 512, 512, 640]
    - [5, 4119.33]
  - - [576, 640, 1, 64, 576, 576, 576, 640]
    - [15, 4532.73]
  - - [640, 640, 1, 64, 640, 640, 640, 640]
    - [0, 4802.91]
  - - [704, 640, 1, 64, 704, 704, 704, 640]
    - [4, 5288.04]
  - - [768, 640, 1, 64, 768, 768, 768, 640]
    - [3, 5827.53]
  - - [832, 640, 1, 64, 832, 832, 832, 640]
    - [4, 5996.58]
  - - [896, 640, 1, 64, 896, 896, 896, 640]
    - [12, 6369.32]
  - - [960, 640, 1, 64, 960, 960, 960, 640]
    - [0, 6575.46]
  - - [1024, 640, 1, 64, 1024, 1024, 1024, 640]
    - [4, 6344.41]
  - - [1088, 640, 1, 64, 1088, 1088, 1088, 640]
    - [4, 6723.62]
  - - [1152, 640, 1, 64, 1152, 1152, 1152, 640]
    - [4, 7032.15]
  - - [1216, 640, 1, 64, 1216, 1216, 1216, 640]
    - [4, 7236.26]
  - - [1280, 640, 1, 64, 1280, 1280, 1280, 640]
    - [4, 7488.71]
  - - [1344, 640, 1, 64, 1344, 1344, 1344, 640]
    - [4, 7727.41]
  - - [1408, 640, 1, 64, 1408, 1408, 1408, 640]
    - [0, 7844.35]
  - - [1472, 640, 1, 64, 1472, 1472, 1472, 640]
    - [0, 8223.26]
  - - [1536, 640, 1, 64, 1536, 1536, 1536, 640]
    - [4, 8087.69]
  - - [1600, 640, 1, 64, 1600, 1600, 1600, 640]
    - [9, 10543.1]
  - - [1664, 640, 1, 64, 1664, 1664, 1664, 640]
    - [11, 10982.4]
  - - [1728, 640, 1, 64, 1728, 1728, 1728, 640]
    - [0, 11270.5]
  - - [1792, 640, 1, 64, 1792, 1792, 1792, 640]
    - [11, 11406.3]
  - - [1856, 640, 1, 64, 1856, 1856, 1856, 640]
    - [9, 11692.0]
  - - [1920, 640, 1, 64, 1920, 1920, 1920, 640]
    - [0, 11999.2]
  - - [1984, 640, 1, 64, 1984, 1984, 1984, 640]
    - [0, 12403.0]
  - - [2048, 640, 1, 64, 2048, 2048, 2048, 640]
    - [0, 12176.7]
  - - [2112, 640, 1, 64, 2112, 2112, 2112, 640]
    - [0, 13231.4]
  - - [2176, 640, 1, 64, 2176, 2176, 2176, 640]
    - [0, 13149.6]
  - - [2240, 640, 1, 64, 2240, 2240, 2240, 640]
    - [0, 13528.5]
  - - [2304, 640, 1, 64, 2304, 2304, 2304, 640]
    - [0, 13625.6]
  - - [2368, 640, 1, 64, 2368, 2368, 2368, 640]
    - [0, 14120.3]
  - - [2432, 640, 1, 64, 2432, 2432, 2432, 640]
    - [0, 14306.2]
  - - [2496, 640, 1, 64, 2496, 2496, 2496, 640]
    - [9, 14154.2]
  - - [2560, 640, 1, 64, 2560, 2560, 2560, 640]
    - [9, 14057.8]
  - - [2624, 640, 1, 64, 2624, 2624, 2624, 640]
    - [9, 14599.1]
  - - [2688, 640, 1, 64, 2688, 2688, 2688, 640]
    - [9, 14834.3]
  - - [2752, 640, 1, 64, 2752, 2752, 2752, 640]
    - [9, 14969.7]
  - - [2816, 640, 1, 64, 2816, 2816, 2816, 640]
    - [9, 15218.7]
  - - [2880, 640, 1, 64, 2880, 2880, 2880, 640]
    - [9, 15505.3]
  - - [2944, 640, 1, 64, 2944, 2944, 2944, 640]
    - [9, 15652.4]
  - - [3008, 640, 1, 64, 3008, 3008, 3008, 640]
    - [9, 15903.8]
  - - [3072, 640, 1, 64, 3072, 3072, 3072, 640]
    - [11, 15250.1]
  - - [3136, 640, 1, 64, 3136, 3136, 3136, 640]
    - [9, 16204.1]
  - - [3200, 640, 1, 64, 3200, 3200, 3200, 640]
    - [9, 16294.3]
  - - [3264, 640, 1, 64, 3264, 3264, 3264, 640]
    - [9, 16540.0]
  - - [3328, 640, 1, 64, 3328, 3328, 3328, 640]
    - [9, 16521.0]
  - - [3392, 640, 1, 64, 3392, 3392, 3392, 640]
    - [9, 16785.7]
  - - [3456, 640, 1, 64, 3456, 3456, 3456, 640]
    - [0, 16535.1]
  - - [3520, 640, 1, 64, 3520, 3520, 3520, 640]
    - [10, 8870.34]
  - - [3584, 640, 1, 64, 3584, 3584, 3584, 640]
    - [11, 9037.17]
  - - [3648, 640, 1, 64, 3648, 3648, 3648, 640]
    - [2, 9103.75]
  - - [3712, 640, 1, 64, 3712, 3712, 3712, 640]
    - [5, 9245.45]
  - - [3776, 640, 1, 64, 3776, 3776, 3776, 640]
    - [5, 9490.34]
  - - [3840, 640, 1, 64, 3840, 3840, 3840, 640]
    - [6, 9589.42]
  - - [3904, 640, 1, 64, 3904, 3904, 3904, 640]
    - [5, 9720.21]
  - - [3968, 640, 1, 64, 3968, 3968, 3968, 640]
    - [5, 9931.44]
  - - [4032, 640, 1, 64, 4032, 4032, 4032, 640]
    - [5, 10133.7]
  - - [4096, 640, 1, 64, 4096, 4096, 4096, 640]
    - [7, 10378.6]
  - - [64, 704, 1, 64, 64, 64, 64, 704]
    - [5, 179.037]
  - - [128, 704, 1, 64, 128, 128, 128, 704]
    - [19, 360.401]
  - - [192, 704, 1, 64, 192, 192, 192, 704]
    - [0, 541.239]
  - - [256, 704, 1, 64, 256, 256, 256, 704]
    - [13, 735.832]
  - - [320, 704, 1, 64, 320, 320, 320, 704]
    - [11, 918.86]
  - - [384, 704, 1, 64, 384, 384, 384, 704]
    - [17, 1099.97]
  - - [448, 704, 1, 64, 448, 448, 448, 704]
    - [5, 1297.31]
  - - [512, 704, 1, 64, 512, 512, 512, 704]
    - [12, 2009.11]
  - - [576, 704, 1, 64, 576, 576, 576, 704]
    - [8, 1646.4]
  - - [640, 704, 1, 64, 640, 640, 640, 704]
    - [19, 1826.08]
  - - [704, 704, 1, 64, 704, 704, 704, 704]
    - [19, 1990.04]
  - - [768, 704, 1, 64, 768, 768, 768, 704]
    - [14, 2157.41]
  - - [832, 704, 1, 64, 832, 832, 832, 704]
    - [17, 2305.58]
  - - [896, 704, 1, 64, 896, 896, 896, 704]
    - [16, 2777.42]
  - - [960, 704, 1, 64, 960, 960, 960, 704]
    - [5, 2701.32]
  - - [1024, 704, 1, 64, 1024, 1024, 1024, 704]
    - [12, 2860.15]
  - - [1088, 704, 1, 64, 1088, 1088, 1088, 704]
    - [19, 3163.0]
  - - [1152, 704, 1, 64, 1152, 1152, 1152, 704]
    - [19, 3238.33]
  - - [1216, 704, 1, 64, 1216, 1216, 1216, 704]
    - [8, 3386.36]
  - - [1280, 704, 1, 64, 1280, 1280, 1280, 704]
    - [6, 3553.82]
  - - [1344, 704, 1, 64, 1344, 1344, 1344, 704]
    - [10, 3894.18]
  - - [1408, 704, 1, 64, 1408, 1408, 1408, 704]
    - [6, 3915.2]
  - - [1472, 704, 1, 64, 1472, 1472, 1472, 704]
    - [9, 4282.71]
  - - [1536, 704, 1, 64, 1536, 1536, 1536, 704]
    - [5, 4260.35]
  - - [1600, 704, 1, 64, 1600, 1600, 1600, 704]
    - [4, 4416.96]
  - - [1664, 704, 1, 64, 1664, 1664, 1664, 704]
    - [19, 4721.8]
  - - [1728, 704, 1, 64, 1728, 1728, 1728, 704]
    - [21, 5295.27]
  - - [1792, 704, 1, 64, 1792, 1792, 1792, 704]
    - [4, 5766.3]
  - - [1856, 704, 1, 64, 1856, 1856, 1856, 704]
    - [1, 9432.96]
  - - [1920, 704, 1, 64, 1920, 1920, 1920, 704]
    - [0, 7054.25]
  - - [1984, 704, 1, 64, 1984, 1984, 1984, 704]
    - [8, 5508.37]
  - - [2048, 704, 1, 64, 2048, 2048, 2048, 704]
    - [20, 5769.3]
  - - [2112, 704, 1, 64, 2112, 2112, 2112, 704]
    - [7, 5923.65]
  - - [2176, 704, 1, 64, 2176, 2176, 2176, 704]
    - [16, 6103.52]
  - - [2240, 704, 1, 64, 2240, 2240, 2240, 704]
    - [19, 6174.6]
  - - [2304, 704, 1, 64, 2304, 2304, 2304, 704]
    - [18, 6442.52]
  - - [2368, 704, 1, 64, 2368, 2368, 2368, 704]
    - [21, 7418.89]
  - - [2432, 704, 1, 64, 2432, 2432, 2432, 704]
    - [4, 9392.64]
  - - [2496, 704, 1, 64, 2496, 2496, 2496, 704]
    - [9, 9998.0]
  - - [2560, 704, 1, 64, 2560, 2560, 2560, 704]
    - [4, 11438.2]
  - - [2624, 704, 1, 64, 2624, 2624, 2624, 704]
    - [11, 7321.36]
  - - [2688, 704, 1, 64, 2688, 2688, 2688, 704]
    - [9, 7496.27]
  - - [2752, 704, 1, 64, 2752, 2752, 2752, 704]
    - [16, 7670.42]
  - - [2816, 704, 1, 64, 2816, 2816, 2816, 704]
    - [2, 7817.36]
  - - [2880, 704, 1, 64, 2880, 2880, 2880, 704]
    - [3, 8003.51]
  - - [2944, 704, 1, 64, 2944, 2944, 2944, 704]
    - [15, 8298.58]
  - - [3008, 704, 1, 64, 3008, 3008, 3008, 704]
    - [0, 16134.2]
  - - [3072, 704, 1, 64, 3072, 3072, 3072, 704]
    - [13, 9511.48]
  - - [3136, 704, 1, 64, 3136, 3136, 3136, 704]
    - [18, 9550.18]
  - - [3200, 704, 1, 64, 3200, 3200, 3200, 704]
    - [0, 9811.4]
  - - [3264, 704, 1, 64, 3264, 3264, 3264, 704]
    - [6, 10412.9]
  - - [3328, 704, 1, 64, 3328, 3328, 3328, 704]
    - [21, 10242.9]
  - - [3392, 704, 1, 64, 3392, 3392, 3392, 704]
    - [21, 10427.0]
  - - [3456, 704, 1, 64, 3456, 3456, 3456, 704]
    - [11, 16100.9]
  - - [3520, 704, 1, 64, 3520, 3520, 3520, 704]
    - [4, 10980.1]
  - - [3584, 704, 1, 64, 3584, 3584, 3584, 704]
    - [6, 10912.3]
  - - [3648, 704, 1, 64, 3648, 3648, 3648, 704]
    - [0, 11120.6]
  - - [3712, 704, 1, 64, 3712, 3712, 3712, 704]
    - [8, 11539.1]
  - - [3776, 704, 1, 64, 3776, 3776, 3776, 704]
    - [12, 11466.6]
  - - [3840, 704, 1, 64, 3840, 3840, 3840, 704]
    - [4, 11663.3]
  - - [3904, 704, 1, 64, 3904, 3904, 3904, 704]
    - [5, 11998.5]
  - - [3968, 704, 1, 64, 3968, 3968, 3968, 704]
    - [2, 12107.6]
  - - [4032, 704, 1, 64, 4032, 4032, 4032, 704]
    - [6, 12607.8]
  - - [4096, 704, 1, 64, 4096, 4096, 4096, 704]
    - [7, 12358.4]
  - - [64, 768, 1, 64, 64, 64, 64, 768]
    - [6, 228.148]
  - - [128, 768, 1, 64, 128, 128, 128, 768]
    - [14, 445.19]
  - - [192, 768, 1, 64, 192, 192, 192, 768]
    - [11, 1008.99]
  - - [256, 768, 1, 64, 256, 256, 256, 768]
    - [9, 785.447]
  - - [320, 768, 1, 64, 320, 320, 320, 768]
    - [4, 997.371]
  - - [384, 768, 1, 64, 384, 384, 384, 768]
    - [19, 1179.56]
  - - [448, 768, 1, 64, 448, 448, 448, 768]
    - [21, 1406.3]
  - - [512, 768, 1, 64, 512, 512, 512, 768]
    - [16, 1586.74]
  - - [576, 768, 1, 64, 576, 576, 576, 768]
    - [6, 1782.16]
  - - [640, 768, 1, 64, 640, 640, 640, 768]
    - [10, 1952.87]
  - - [704, 768, 1, 64, 704, 704, 704, 768]
    - [1, 2159.55]
  - - [768, 768, 1, 64, 768, 768, 768, 768]
    - [16, 2395.67]
  - - [832, 768, 1, 64, 832, 832, 832, 768]
    - [3, 2540.17]
  - - [896, 768, 1, 64, 896, 896, 896, 768]
    - [18, 2856.0]
  - - [960, 768, 1, 64, 960, 960, 960, 768]
    - [21, 3400.24]
  - - [1024, 768, 1, 64, 1024, 1024, 1024, 768]
    - [5, 4073.1]
  - - [1088, 768, 1, 64, 1088, 1088, 1088, 768]
    - [16, 4869.97]
  - - [1152, 768, 1, 64, 1152, 1152, 1152, 768]
    - [5, 4453.56]
  - - [1216, 768, 1, 64, 1216, 1216, 1216, 768]
    - [16, 3686.88]
  - - [1280, 768, 1, 64, 1280, 1280, 1280, 768]
    - [5, 3970.59]
  - - [1344, 768, 1, 64, 1344, 1344, 1344, 768]
    - [5, 4120.51]
  - - [1408, 768, 1, 64, 1408, 1408, 1408, 768]
    - [4, 4236.91]
  - - [1472, 768, 1, 64, 1472, 1472, 1472, 768]
    - [9, 4514.61]
  - - [1536, 768, 1, 64, 1536, 1536, 1536, 768]
    - [3, 4594.23]
  - - [1600, 768, 1, 64, 1600, 1600, 1600, 768]
    - [6, 4924.72]
  - - [1664, 768, 1, 64, 1664, 1664, 1664, 768]
    - [7, 5099.98]
  - - [1728, 768, 1, 64, 1728, 1728, 1728, 768]
    - [4, 5217.36]
  - - [1792, 768, 1, 64, 1792, 1792, 1792, 768]
    - [5, 5419.93]
  - - [1856, 768, 1, 64, 1856, 1856, 1856, 768]
    - [18, 5664.07]
  - - [1920, 768, 1, 64, 1920, 1920, 1920, 768]
    - [5, 5864.5]
  - - [1984, 768, 1, 64, 1984, 1984, 1984, 768]
    - [3, 5972.38]
  - - [2048, 768, 1, 64, 2048, 2048, 2048, 768]
    - [4, 6156.31]
  - - [2112, 768, 1, 64, 2112, 2112, 2112, 768]
    - [16, 6339.05]
  - - [2176, 768, 1, 64, 2176, 2176, 2176, 768]
    - [8, 6491.52]
  - - [2240, 768, 1, 64, 2240, 2240, 2240, 768]
    - [21, 6808.05]
  - - [2304, 768, 1, 64, 2304, 2304, 2304, 768]
    - [18, 6997.34]
  - - [2368, 768, 1, 64, 2368, 2368, 2368, 768]
    - [5, 7287.67]
  - - [2432, 768, 1, 64, 2432, 2432, 2432, 768]
    - [17, 7465.87]
  - - [2496, 768, 1, 64, 2496, 2496, 2496, 768]
    - [19, 7630.88]
  - - [2560, 768, 1, 64, 2560, 2560, 2560, 768]
    - [13, 7796.06]
  - - [2624, 768, 1, 64, 2624, 2624, 2624, 768]
    - [11, 9753.75]
  - - [2688, 768, 1, 64, 2688, 2688, 2688, 768]
    - [11, 9519.39]
  - - [2752, 768, 1, 64, 2752, 2752, 2752, 768]
    - [9, 10360.4]
  - - [2816, 768, 1, 64, 2816, 2816, 2816, 768]
    - [0, 14863.8]
  - - [2880, 768, 1, 64, 2880, 2880, 2880, 768]
    - [4, 9370.22]
  - - [2944, 768, 1, 64, 2944, 2944, 2944, 768]
    - [10, 8933.35]
  - - [3008, 768, 1, 64, 3008, 3008, 3008, 768]
    - [4, 9124.68]
  - - [3072, 768, 1, 64, 3072, 3072, 3072, 768]
    - [7, 9160.52]
  - - [3136, 768, 1, 64, 3136, 3136, 3136, 768]
    - [9, 9449.98]
  - - [3200, 768, 1, 64, 3200, 3200, 3200, 768]
    - [6, 9582.32]
  - - [3264, 768, 1, 64, 3264, 3264, 3264, 768]
    - [5, 9891.46]
  - - [3328, 768, 1, 64, 3328, 3328, 3328, 768]
    - [16, 9994.9]
  - - [3392, 768, 1, 64, 3392, 3392, 3392, 768]
    - [16, 10154.8]
  - - [3456, 768, 1, 64, 3456, 3456, 3456, 768]
    - [11, 10695.0]
  - - [3520, 768, 1, 64, 3520, 3520, 3520, 768]
    - [11, 11864.8]
  - - [3584, 768, 1, 64, 3584, 3584, 3584, 768]
    - [16, 10828.6]
  - - [3648, 768, 1, 64, 3648, 3648, 3648, 768]
    - [13, 11084.6]
  - - [3712, 768, 1, 64, 3712, 3712, 3712, 768]
    - [6, 11129.8]
  - - [3776, 768, 1, 64, 3776, 3776, 3776, 768]
    - [4, 11530.7]
  - - [3840, 768, 1, 64, 3840, 3840, 3840, 768]
    - [6, 11688.3]
  - - [3904, 768, 1, 64, 3904, 3904, 3904, 768]
    - [4, 11883.1]
  - - [3968, 768, 1, 64, 3968, 3968, 3968, 768]
    - [12, 12052.6]
  - - [4032, 768, 1, 64, 4032, 4032, 4032, 768]
    - [7, 12246.8]
  - - [4096, 768, 1, 64, 4096, 4096, 4096, 768]
    - [4, 12554.6]
  - - [64, 832, 1, 64, 64, 64, 64, 832]
    - [19, 212.089]
  - - [128, 832, 1, 64, 128, 128, 128, 832]
    - [12, 422.628]
  - - [192, 832, 1, 64, 192, 192, 192, 832]
    - [0, 647.425]
  - - [256, 832, 1, 64, 256, 256, 256, 832]
    - [6, 847.83]
  - - [320, 832, 1, 64, 320, 320, 320, 832]
    - [7, 1053.1]
  - - [384, 832, 1, 64, 384, 384, 384, 832]
    - [19, 1284.11]
  - - [448, 832, 1, 64, 448, 448, 448, 832]
    - [3, 1520.49]
  - - [512, 832, 1, 64, 512, 512, 512, 832]
    - [2, 1706.91]
  - - [576, 832, 1, 64, 576, 576, 576, 832]
    - [19, 1933.72]
  - - [640, 832, 1, 64, 640, 640, 640, 832]
    - [19, 3987.67]
  - - [704, 832, 1, 64, 704, 704, 704, 832]
    - [6, 3639.1]
  - - [768, 832, 1, 64, 768, 768, 768, 832]
    - [18, 2531.19]
  - - [832, 832, 1, 64, 832, 832, 832, 832]
    - [18, 2846.61]
  - - [896, 832, 1, 64, 896, 896, 896, 832]
    - [17, 2932.18]
  - - [960, 832, 1, 64, 960, 960, 960, 832]
    - [19, 3219.21]
  - - [1024, 832, 1, 64, 1024, 1024, 1024, 832]
    - [2, 3399.35]
  - - [1088, 832, 1, 64, 1088, 1088, 1088, 832]
    - [10, 3555.71]
  - - [1152, 832, 1, 64, 1152, 1152, 1152, 832]
    - [10, 3983.2]
  - - [1216, 832, 1, 64, 1216, 1216, 1216, 832]
    - [5, 4075.61]
  - - [1280, 832, 1, 64, 1280, 1280, 1280, 832]
    - [16, 4197.11]
  - - [1344, 832, 1, 64, 1344, 1344, 1344, 832]
    - [2, 4328.88]
  - - [1408, 832, 1, 64, 1408, 1408, 1408, 832]
    - [6, 4577.09]
  - - [1472, 832, 1, 64, 1472, 1472, 1472, 832]
    - [17, 5291.7]
  - - [1536, 832, 1, 64, 1536, 1536, 1536, 832]
    - [17, 4974.06]
  - - [1600, 832, 1, 64, 1600, 1600, 1600, 832]
    - [5, 5203.8]
  - - [1664, 832, 1, 64, 1664, 1664, 1664, 832]
    - [21, 5699.46]
  - - [1728, 832, 1, 64, 1728, 1728, 1728, 832]
    - [3, 6238.89]
  - - [1792, 832, 1, 64, 1792, 1792, 1792, 832]
    - [18, 5855.4]
  - - [1856, 832, 1, 64, 1856, 1856, 1856, 832]
    - [17, 6036.38]
  - - [1920, 832, 1, 64, 1920, 1920, 1920, 832]
    - [5, 6373.39]
  - - [1984, 832, 1, 64, 1984, 1984, 1984, 832]
    - [19, 6479.59]
  - - [2048, 832, 1, 64, 2048, 2048, 2048, 832]
    - [13, 6658.79]
  - - [2112, 832, 1, 64, 2112, 2112, 2112, 832]
    - [10, 6944.48]
  - - [2176, 832, 1, 64, 2176, 2176, 2176, 832]
    - [18, 7260.74]
  - - [2240, 832, 1, 64, 2240, 2240, 2240, 832]
    - [19, 7356.74]
  - - [2304, 832, 1, 64, 2304, 2304, 2304, 832]
    - [13, 7599.28]
  - - [2368, 832, 1, 64, 2368, 2368, 2368, 832]
    - [19, 7988.5]
  - - [2432, 832, 1, 64, 2432, 2432, 2432, 832]
    - [19, 8037.4]
  - - [2496, 832, 1, 64, 2496, 2496, 2496, 832]
    - [2, 8040.72]
  - - [2560, 832, 1, 64, 2560, 2560, 2560, 832]
    - [14, 8336.23]
  - - [2624, 832, 1, 64, 2624, 2624, 2624, 832]
    - [12, 9033.55]
  - - [2688, 832, 1, 64, 2688, 2688, 2688, 832]
    - [2, 8735.93]
  - - [2752, 832, 1, 64, 2752, 2752, 2752, 832]
    - [10, 8913.99]
  - - [2816, 832, 1, 64, 2816, 2816, 2816, 832]
    - [8, 9465.04]
  - - [2880, 832, 1, 64, 2880, 2880, 2880, 832]
    - [8, 9452.77]
  - - [2944, 832, 1, 64, 2944, 2944, 2944, 832]
    - [6, 9572.62]
  - - [3008, 832, 1, 64, 3008, 3008, 3008, 832]
    - [7, 9851.01]
  - - [3072, 832, 1, 64, 3072, 3072, 3072, 832]
    - [21, 10073.7]
  - - [3136, 832, 1, 64, 3136, 3136, 3136, 832]
    - [7, 10291.2]
  - - [3200, 832, 1, 64, 3200, 3200, 3200, 832]
    - [6, 10599.7]
  - - [3264, 832, 1, 64, 3264, 3264, 3264, 832]
    - [16, 10696.1]
  - - [3328, 832, 1, 64, 3328, 3328, 3328, 832]
    - [21, 10792.2]
  - - [3392, 832, 1, 64, 3392, 3392, 3392, 832]
    - [16, 11276.5]
  - - [3456, 832, 1, 64, 3456, 3456, 3456, 832]
    - [6, 11287.8]
  - - [3520, 832, 1, 64, 3520, 3520, 3520, 832]
    - [6, 11523.6]
  - - [3584, 832, 1, 64, 3584, 3584, 3584, 832]
    - [7, 11781.7]
  - - [3648, 832, 1, 64, 3648, 3648, 3648, 832]
    - [3, 13308.2]
  - - [3712, 832, 1, 64, 3712, 3712, 3712, 832]
    - [4, 13376.8]
  - - [3776, 832, 1, 64, 3776, 3776, 3776, 832]
    - [13, 12465.2]
  - - [3840, 832, 1, 64, 3840, 3840, 3840, 832]
    - [5, 12492.8]
  - - [3904, 832, 1, 64, 3904, 3904, 3904, 832]
    - [3, 12734.6]
  - - [3968, 832, 1, 64, 3968, 3968, 3968, 832]
    - [3, 12925.9]
  - - [4032, 832, 1, 64, 4032, 4032, 4032, 832]
    - [4, 13187.6]
  - - [4096, 832, 1, 64, 4096, 4096, 4096, 832]
    - [16, 13439.8]
  - - [64, 896, 1, 64, 64, 64, 64, 896]
    - [0, 396.156]
  - - [128, 896, 1, 64, 128, 128, 128, 896]
    - [13, 459.637]
  - - [192, 896, 1, 64, 192, 192, 192, 896]
    - [18, 672.325]
  - - [256, 896, 1, 64, 256, 256, 256, 896]
    - [15, 922.455]
  - - [320, 896, 1, 64, 320, 320, 320, 896]
    - [4, 1146.65]
  - - [384, 896, 1, 64, 384, 384, 384, 896]
    - [17, 1548.3]
  - - [448, 896, 1, 64, 448, 448, 448, 896]
    - [13, 1624.92]
  - - [512, 896, 1, 64, 512, 512, 512, 896]
    - [14, 1847.8]
  - - [576, 896, 1, 64, 576, 576, 576, 896]
    - [3, 2531.98]
  - - [640, 896, 1, 64, 640, 640, 640, 896]
    - [16, 3055.53]
  - - [704, 896, 1, 64, 704, 704, 704, 896]
    - [0, 2696.55]
  - - [768, 896, 1, 64, 768, 768, 768, 896]
    - [17, 2946.97]
  - - [832, 896, 1, 64, 832, 832, 832, 896]
    - [18, 3068.95]
  - - [896, 896, 1, 64, 896, 896, 896, 896]
    - [15, 3202.81]
  - - [960, 896, 1, 64, 960, 960, 960, 896]
    - [16, 3455.95]
  - - [1024, 896, 1, 64, 1024, 1024, 1024, 896]
    - [5, 3648.1]
  - - [1088, 896, 1, 64, 1088, 1088, 1088, 896]
    - [21, 4049.42]
  - - [1152, 896, 1, 64, 1152, 1152, 1152, 896]
    - [1, 4269.89]
  - - [1216, 896, 1, 64, 1216, 1216, 1216, 896]
    - [5, 4329.13]
  - - [1280, 896, 1, 64, 1280, 1280, 1280, 896]
    - [20, 4711.12]
  - - [1344, 896, 1, 64, 1344, 1344, 1344, 896]
    - [5, 6014.0]
  - - [1408, 896, 1, 64, 1408, 1408, 1408, 896]
    - [16, 5863.43]
  - - [1472, 896, 1, 64, 1472, 1472, 1472, 896]
    - [7, 5760.13]
  - - [1536, 896, 1, 64, 1536, 1536, 1536, 896]
    - [17, 5412.27]
  - - [1600, 896, 1, 64, 1600, 1600, 1600, 896]
    - [7, 5578.18]
  - - [1664, 896, 1, 64, 1664, 1664, 1664, 896]
    - [17, 5794.57]
  - - [1728, 896, 1, 64, 1728, 1728, 1728, 896]
    - [7, 6069.77]
  - - [1792, 896, 1, 64, 1792, 1792, 1792, 896]
    - [21, 6577.04]
  - - [1856, 896, 1, 64, 1856, 1856, 1856, 896]
    - [0, 6691.58]
  - - [1920, 896, 1, 64, 1920, 1920, 1920, 896]
    - [19, 6831.65]
  - - [1984, 896, 1, 64, 1984, 1984, 1984, 896]
    - [8, 6924.87]
  - - [2048, 896, 1, 64, 2048, 2048, 2048, 896]
    - [20, 7277.21]
  - - [2112, 896, 1, 64, 2112, 2112, 2112, 896]
    - [11, 15247.2]
  - - [2176, 896, 1, 64, 2176, 2176, 2176, 896]
    - [9, 15391.5]
  - - [2240, 896, 1, 64, 2240, 2240, 2240, 896]
    - [0, 15687.5]
  - - [2304, 896, 1, 64, 2304, 2304, 2304, 896]
    - [11, 15952.5]
  - - [2368, 896, 1, 64, 2368, 2368, 2368, 896]
    - [9, 16588.0]
  - - [2432, 896, 1, 64, 2432, 2432, 2432, 896]
    - [9, 16727.9]
  - - [2496, 896, 1, 64, 2496, 2496, 2496, 896]
    - [9, 17168.0]
  - - [2560, 896, 1, 64, 2560, 2560, 2560, 896]
    - [9, 16875.4]
  - - [2624, 896, 1, 64, 2624, 2624, 2624, 896]
    - [9, 17425.4]
  - - [2688, 896, 1, 64, 2688, 2688, 2688, 896]
    - [9, 17545.9]
  - - [2752, 896, 1, 64, 2752, 2752, 2752, 896]
    - [9, 17875.9]
  - - [2816, 896, 1, 64, 2816, 2816, 2816, 896]
    - [9, 17980.1]
  - - [2880, 896, 1, 64, 2880, 2880, 2880, 896]
    - [9, 18417.6]
  - - [2944, 896, 1, 64, 2944, 2944, 2944, 896]
    - [9, 18454.3]
  - - [3008, 896, 1, 64, 3008, 3008, 3008, 896]
    - [9, 18669.6]
  - - [3072, 896, 1, 64, 3072, 3072, 3072, 896]
    - [0, 17875.1]
  - - [3136, 896, 1, 64, 3136, 3136, 3136, 896]
    - [9, 19094.1]
  - - [3200, 896, 1, 64, 3200, 3200, 3200, 896]
    - [9, 19446.6]
  - - [3264, 896, 1, 64, 3264, 3264, 3264, 896]
    - [9, 19712.4]
  - - [3328, 896, 1, 64, 3328, 3328, 3328, 896]
    - [9, 19809.0]
  - - [3392, 896, 1, 64, 3392, 3392, 3392, 896]
    - [9, 19968.1]
  - - [3456, 896, 1, 64, 3456, 3456, 3456, 896]
    - [9, 20205.9]
  - - [3520, 896, 1, 64, 3520, 3520, 3520, 896]
    - [9, 20463.2]
  - - [3584, 896, 1, 64, 3584, 3584, 3584, 896]
    - [9, 20242.1]
  - - [3648, 896, 1, 64, 3648, 3648, 3648, 896]
    - [9, 20841.9]
  - - [3712, 896, 1, 64, 3712, 3712, 3712, 896]
    - [9, 21033.5]
  - - [3776, 896, 1, 64, 3776, 3776, 3776, 896]
    - [9, 20625.8]
  - - [3840, 896, 1, 64, 3840, 3840, 3840, 896]
    - [9, 21001.5]
  - - [3904, 896, 1, 64, 3904, 3904, 3904, 896]
    - [9, 21443.4]
  - - [3968, 896, 1, 64, 3968, 3968, 3968, 896]
    - [9, 21371.2]
  - - [4032, 896, 1, 64, 4032, 4032, 4032, 896]
    - [9, 21507.7]
  - - [4096, 896, 1, 64, 4096, 4096, 4096, 896]
    - [9, 20463.5]
  - - [64, 960, 1, 64, 64, 64, 64, 960]
    - [7, 857.413]
  - - [128, 960, 1, 64, 128, 128, 128, 960]
    - [4, 1585.22]
  - - [192, 960, 1, 64, 192, 192, 192, 960]
    - [15, 2448.39]
  - - [256, 960, 1, 64, 256, 256, 256, 960]
    - [17, 3118.84]
  - - [320, 960, 1, 64, 320, 320, 320, 960]
    - [4, 3862.59]
  - - [384, 960, 1, 64, 384, 384, 384, 960]
    - [13, 4440.55]
  - - [448, 960, 1, 64, 448, 448, 448, 960]
    - [7, 5258.86]
  - - [512, 960, 1, 64, 512, 512, 512, 960]
    - [1, 5577.51]
  - - [576, 960, 1, 64, 576, 576, 576, 960]
    - [0, 6414.59]
  - - [640, 960, 1, 64, 640, 640, 640, 960]
    - [20, 6757.39]
  - - [704, 960, 1, 64, 704, 704, 704, 960]
    - [12, 7440.87]
  - - [768, 960, 1, 64, 768, 768, 768, 960]
    - [12, 7787.71]
  - - [832, 960, 1, 64, 832, 832, 832, 960]
    - [3, 8406.09]
  - - [896, 960, 1, 64, 896, 896, 896, 960]
    - [0, 9000.95]
  - - [960, 960, 1, 64, 960, 960, 960, 960]
    - [0, 8055.42]
  - - [1024, 960, 1, 64, 1024, 1024, 1024, 960]
    - [4, 8260.79]
  - - [1088, 960, 1, 64, 1088, 1088, 1088, 960]
    - [11, 10571.9]
  - - [1152, 960, 1, 64, 1152, 1152, 1152, 960]
    - [0, 11292.0]
  - - [1216, 960, 1, 64, 1216, 1216, 1216, 960]
    - [9, 11728.4]
  - - [1280, 960, 1, 64, 1280, 1280, 1280, 960]
    - [0, 12078.4]
  - - [1344, 960, 1, 64, 1344, 1344, 1344, 960]
    - [0, 12800.2]
  - - [1408, 960, 1, 64, 1408, 1408, 1408, 960]
    - [0, 13211.2]
  - - [1472, 960, 1, 64, 1472, 1472, 1472, 960]
    - [0, 13323.3]
  - - [1536, 960, 1, 64, 1536, 1536, 1536, 960]
    - [0, 12899.3]
  - - [1600, 960, 1, 64, 1600, 1600, 1600, 960]
    - [0, 14265.3]
  - - [1664, 960, 1, 64, 1664, 1664, 1664, 960]
    - [9, 13979.9]
  - - [1728, 960, 1, 64, 1728, 1728, 1728, 960]
    - [9, 14364.3]
  - - [1792, 960, 1, 64, 1792, 1792, 1792, 960]
    - [9, 14607.8]
  - - [1856, 960, 1, 64, 1856, 1856, 1856, 960]
    - [9, 14851.6]
  - - [1920, 960, 1, 64, 1920, 1920, 1920, 960]
    - [9, 15166.2]
  - - [1984, 960, 1, 64, 1984, 1984, 1984, 960]
    - [9, 15457.2]
  - - [2048, 960, 1, 64, 2048, 2048, 2048, 960]
    - [0, 14604.0]
  - - [2112, 960, 1, 64, 2112, 2112, 2112, 960]
    - [9, 15948.8]
  - - [2176, 960, 1, 64, 2176, 2176, 2176, 960]
    - [9, 16250.4]
  - - [2240, 960, 1, 64, 2240, 2240, 2240, 960]
    - [9, 16627.4]
  - - [2304, 960, 1, 64, 2304, 2304, 2304, 960]
    - [9, 16665.4]
  - - [2368, 960, 1, 64, 2368, 2368, 2368, 960]
    - [9, 17199.2]
  - - [2432, 960, 1, 64, 2432, 2432, 2432, 960]
    - [9, 17302.0]
  - - [2496, 960, 1, 64, 2496, 2496, 2496, 960]
    - [9, 17724.5]
  - - [2560, 960, 1, 64, 2560, 2560, 2560, 960]
    - [9, 17410.2]
  - - [2624, 960, 1, 64, 2624, 2624, 2624, 960]
    - [9, 18261.9]
  - - [2688, 960, 1, 64, 2688, 2688, 2688, 960]
    - [9, 18405.1]
  - - [2752, 960, 1, 64, 2752, 2752, 2752, 960]
    - [9, 18578.2]
  - - [2816, 960, 1, 64, 2816, 2816, 2816, 960]
    - [9, 18637.6]
  - - [2880, 960, 1, 64, 2880, 2880, 2880, 960]
    - [9, 19116.8]
  - - [2944, 960, 1, 64, 2944, 2944, 2944, 960]
    - [9, 19207.5]
  - - [3008, 960, 1, 64, 3008, 3008, 3008, 960]
    - [9, 19527.6]
  - - [3072, 960, 1, 64, 3072, 3072, 3072, 960]
    - [0, 18496.8]
  - - [3136, 960, 1, 64, 3136, 3136, 3136, 960]
    - [9, 20011.7]
  - - [3200, 960, 1, 64, 3200, 3200, 3200, 960]
    - [9, 20113.1]
  - - [3264, 960, 1, 64, 3264, 3264, 3264, 960]
    - [9, 20532.1]
  - - [3328, 960, 1, 64, 3328, 3328, 3328, 960]
    - [9, 20488.0]
  - - [3392, 960, 1, 64, 3392, 3392, 3392, 960]
    - [9, 20848.6]
  - - [3456, 960, 1, 64, 3456, 3456, 3456, 960]
    - [9, 21025.3]
  - - [3520, 960, 1, 64, 3520, 3520, 3520, 960]
    - [9, 21101.3]
  - - [3584, 960, 1, 64, 3584, 3584, 3584, 960]
    - [9, 20671.9]
  - - [3648, 960, 1, 64, 3648, 3648, 3648, 960]
    - [9, 21555.0]
  - - [3712, 960, 1, 64, 3712, 3712, 3712, 960]
    - [9, 21549.9]
  - - [3776, 960, 1, 64, 3776, 3776, 3776, 960]
    - [9, 21036.9]
  - - [3840, 960, 1, 64, 3840, 3840, 3840, 960]
    - [9, 21648.7]
  - - [3904, 960, 1, 64, 3904, 3904, 3904, 960]
    - [9, 22023.5]
  - - [3968, 960, 1, 64, 3968, 3968, 3968, 960]
    - [9, 21917.7]
  - - [4032, 960, 1, 64, 4032, 4032, 4032, 960]
    - [9, 22177.5]
  - - [4096, 960, 1, 64, 4096, 4096, 4096, 960]
    - [9, 20943.3]
  - - [64, 1024, 1, 64, 64, 64, 64, 1024]
    - [19, 897.36]
  - - [128, 1024, 1, 64, 128, 128, 128, 1024]
    - [6, 1760.81]
  - - [192, 1024, 1, 64, 192, 192, 192, 1024]
    - [9, 2542.49]
  - - [256, 1024, 1, 64, 256, 256, 256, 1024]
    - [7, 3423.89]
  - - [320, 1024, 1, 64, 320, 320, 320, 1024]
    - [6, 4054.76]
  - - [384, 1024, 1, 64, 384, 384, 384, 1024]
    - [3, 4832.12]
  - - [448, 1024, 1, 64, 448, 448, 448, 1024]
    - [21, 5360.57]
  - - [512, 1024, 1, 64, 512, 512, 512, 1024]
    - [6, 5907.39]
  - - [576, 1024, 1, 64, 576, 576, 576, 1024]
    - [11, 6698.86]
  - - [640, 1024, 1, 64, 640, 640, 640, 1024]
    - [1, 7122.12]
  - - [704, 1024, 1, 64, 704, 704, 704, 1024]
    - [11, 7798.61]
  - - [768, 1024, 1, 64, 768, 768, 768, 1024]
    - [1, 8268.68]
  - - [832, 1024, 1, 64, 832, 832, 832, 1024]
    - [1, 8867.34]
  - - [896, 1024, 1, 64, 896, 896, 896, 1024]
    - [9, 9616.81]
  - - [960, 1024, 1, 64, 960, 960, 960, 1024]
    - [0, 8473.31]
  - - [1024, 1024, 1, 64, 1024, 1024, 1024, 1024]
    - [9, 10163.3]
  - - [1088, 1024, 1, 64, 1088, 1088, 1088, 1024]
    - [9, 11282.1]
  - - [1152, 1024, 1, 64, 1152, 1152, 1152, 1024]
    - [0, 11906.1]
  - - [1216, 1024, 1, 64, 1216, 1216, 1216, 1024]
    - [0, 12148.1]
  - - [1280, 1024, 1, 64, 1280, 1280, 1280, 1024]
    - [0, 12891.5]
  - - [1344, 1024, 1, 64, 1344, 1344, 1344, 1024]
    - [0, 13455.5]
  - - [1408, 1024, 1, 64, 1408, 1408, 1408, 1024]
    - [0, 13349.8]
  - - [1472, 1024, 1, 64, 1472, 1472, 1472, 1024]
    - [0, 14072.6]
  - - [1536, 1024, 1, 64, 1536, 1536, 1536, 1024]
    - [0, 13621.5]
  - - [1600, 1024, 1, 64, 1600, 1600, 1600, 1024]
    - [9, 14126.0]
  - - [1664, 1024, 1, 64, 1664, 1664, 1664, 1024]
    - [9, 14499.6]
  - - [1728, 1024, 1, 64, 1728, 1728, 1728, 1024]
    - [9, 14793.6]
  - - [1792, 1024, 1, 64, 1792, 1792, 1792, 1024]
    - [9, 15179.0]
  - - [1856, 1024, 1, 64, 1856, 1856, 1856, 1024]
    - [9, 15447.6]
  - - [1920, 1024, 1, 64, 1920, 1920, 1920, 1024]
    - [9, 15601.8]
  - - [1984, 1024, 1, 64, 1984, 1984, 1984, 1024]
    - [9, 16105.9]
  - - [2048, 1024, 1, 64, 2048, 2048, 2048, 1024]
    - [0, 15068.7]
  - - [2112, 1024, 1, 64, 2112, 2112, 2112, 1024]
    - [9, 16582.1]
  - - [2176, 1024, 1, 64, 2176, 2176, 2176, 1024]
    - [9, 16735.6]
  - - [2240, 1024, 1, 64, 2240, 2240, 2240, 1024]
    - [9, 17049.9]
  - - [2304, 1024, 1, 64, 2304, 2304, 2304, 1024]
    - [9, 17038.2]
  - - [2368, 1024, 1, 64, 2368, 2368, 2368, 1024]
    - [9, 17811.1]
  - - [2432, 1024, 1, 64, 2432, 2432, 2432, 1024]
    - [9, 17822.0]
  - - [2496, 1024, 1, 64, 2496, 2496, 2496, 1024]
    - [9, 18258.2]
  - - [2560, 1024, 1, 64, 2560, 2560, 2560, 1024]
    - [9, 17962.7]
  - - [2624, 1024, 1, 64, 2624, 2624, 2624, 1024]
    - [9, 18708.2]
  - - [2688, 1024, 1, 64, 2688, 2688, 2688, 1024]
    - [9, 18895.0]
  - - [2752, 1024, 1, 64, 2752, 2752, 2752, 1024]
    - [9, 19262.3]
  - - [2816, 1024, 1, 64, 2816, 2816, 2816, 1024]
    - [9, 19322.3]
  - - [2880, 1024, 1, 64, 2880, 2880, 2880, 1024]
    - [9, 19755.3]
  - - [2944, 1024, 1, 64, 2944, 2944, 2944, 1024]
    - [9, 19843.2]
  - - [3008, 1024, 1, 64, 3008, 3008, 3008, 1024]
    - [9, 20109.2]
  - - [3072, 1024, 1, 64, 3072, 3072, 3072, 1024]
    - [0, 18948.1]
  - - [3136, 1024, 1, 64, 3136, 3136, 3136, 1024]
    - [9, 20688.5]
  - - [3200, 1024, 1, 64, 3200, 3200, 3200, 1024]
    - [9, 20854.6]
  - - [3264, 1024, 1, 64, 3264, 3264, 3264, 1024]
    - [9, 21101.6]
  - - [3328, 1024, 1, 64, 3328, 3328, 3328, 1024]
    - [9, 21137.9]
  - - [3392, 1024, 1, 64, 3392, 3392, 3392, 1024]
    - [9, 21319.2]
  - - [3456, 1024, 1, 64, 3456, 3456, 3456, 1024]
    - [9, 21437.6]
  - - [3520, 1024, 1, 64, 3520, 3520, 3520, 1024]
    - [9, 21727.9]
  - - [3584, 1024, 1, 64, 3584, 3584, 3584, 1024]
    - [9, 21204.2]
  - - [3648, 1024, 1, 64, 3648, 3648, 3648, 1024]
    - [9, 21967.6]
  - - [3712, 1024, 1, 64, 3712, 3712, 3712, 1024]
    - [9, 22033.1]
  - - [3776, 1024, 1, 64, 3776, 3776, 3776, 1024]
    - [9, 21299.9]
  - - [3840, 1024, 1, 64, 3840, 3840, 3840, 1024]
    - [9, 22223.2]
  - - [3904, 1024, 1, 64, 3904, 3904, 3904, 1024]
    - [9, 22621.7]
  - - [3968, 1024, 1, 64, 3968, 3968, 3968, 1024]
    - [9, 22640.1]
  - - [4032, 1024, 1, 64, 4032, 4032, 4032, 1024]
    - [9, 22915.5]
  - - [4096, 1024, 1, 64, 4096, 4096, 4096, 1024]
    - [9, 21297.5]
  - - [64, 1088, 1, 64, 64, 64, 64, 1088]
    - [16, 900.465]
  - - [128, 1088, 1, 64, 128, 128, 128, 1088]
    - [12, 1902.84]
  - - [192, 1088, 1, 64, 192, 192, 192, 1088]
    - [7, 2763.95]
  - - [256, 1088, 1, 64, 256, 256, 256, 1088]
    - [1, 3453.24]
  - - [320, 1088, 1, 64, 320, 320, 320, 1088]
    - [14, 4237.74]
  - - [384, 1088, 1, 64, 384, 384, 384, 1088]
    - [6, 5014.76]
  - - [448, 1088, 1, 64, 448, 448, 448, 1088]
    - [3, 5716.48]
  - - [512, 1088, 1, 64, 512, 512, 512, 1088]
    - [1, 6268.91]
  - - [576, 1088, 1, 64, 576, 576, 576, 1088]
    - [3, 6885.44]
  - - [640, 1088, 1, 64, 640, 640, 640, 1088]
    - [9, 7598.31]
  - - [704, 1088, 1, 64, 704, 704, 704, 1088]
    - [0, 8236.01]
  - - [768, 1088, 1, 64, 768, 768, 768, 1088]
    - [1, 8650.43]
  - - [832, 1088, 1, 64, 832, 832, 832, 1088]
    - [4, 9217.72]
  - - [896, 1088, 1, 64, 896, 896, 896, 1088]
    - [11, 10024.1]
  - - [960, 1088, 1, 64, 960, 960, 960, 1088]
    - [9, 10666.3]
  - - [1024, 1088, 1, 64, 1024, 1024, 1024, 1088]
    - [0, 10803.4]
  - - [1088, 1088, 1, 64, 1088, 1088, 1088, 1088]
    - [0, 11696.6]
  - - [1152, 1088, 1, 64, 1152, 1152, 1152, 1088]
    - [11, 12042.5]
  - - [1216, 1088, 1, 64, 1216, 1216, 1216, 1088]
    - [0, 13056.6]
  - - [1280, 1088, 1, 64, 1280, 1280, 1280, 1088]
    - [0, 13118.7]
  - - [1344, 1088, 1, 64, 1344, 1344, 1344, 1088]
    - [0, 13598.5]
  - - [1408, 1088, 1, 64, 1408, 1408, 1408, 1088]
    - [0, 14033.9]
  - - [1472, 1088, 1, 64, 1472, 1472, 1472, 1088]
    - [9, 13916.8]
  - - [1536, 1088, 1, 64, 1536, 1536, 1536, 1088]
    - [11, 13429.7]
  - - [1600, 1088, 1, 64, 1600, 1600, 1600, 1088]
    - [9, 14694.0]
  - - [1664, 1088, 1, 64, 1664, 1664, 1664, 1088]
    - [9, 14998.9]
  - - [1728, 1088, 1, 64, 1728, 1728, 1728, 1088]
    - [9, 15439.9]
  - - [1792, 1088, 1, 64, 1792, 1792, 1792, 1088]
    - [0, 15519.9]
  - - [1856, 1088, 1, 64, 1856, 1856, 1856, 1088]
    - [9, 15994.6]
  - - [1920, 1088, 1, 64, 1920, 1920, 1920, 1088]
    - [9, 16260.4]
  - - [1984, 1088, 1, 64, 1984, 1984, 1984, 1088]
    - [9, 16670.5]
  - - [2048, 1088, 1, 64, 2048, 2048, 2048, 1088]
    - [9, 15600.7]
  - - [2112, 1088, 1, 64, 2112, 2112, 2112, 1088]
    - [9, 17110.1]
  - - [2176, 1088, 1, 64, 2176, 2176, 2176, 1088]
    - [9, 17290.7]
  - - [2240, 1088, 1, 64, 2240, 2240, 2240, 1088]
    - [9, 17624.3]
  - - [2304, 1088, 1, 64, 2304, 2304, 2304, 1088]
    - [9, 17637.5]
  - - [2368, 1088, 1, 64, 2368, 2368, 2368, 1088]
    - [9, 18367.7]
  - - [2432, 1088, 1, 64, 2432, 2432, 2432, 1088]
    - [9, 18435.0]
  - - [2496, 1088, 1, 64, 2496, 2496, 2496, 1088]
    - [9, 18895.4]
  - - [2560, 1088, 1, 64, 2560, 2560, 2560, 1088]
    - [9, 18512.4]
  - - [2624, 1088, 1, 64, 2624, 2624, 2624, 1088]
    - [9, 19371.6]
  - - [2688, 1088, 1, 64, 2688, 2688, 2688, 1088]
    - [9, 19570.2]
  - - [2752, 1088, 1, 64, 2752, 2752, 2752, 1088]
    - [9, 19833.1]
  - - [2816, 1088, 1, 64, 2816, 2816, 2816, 1088]
    - [9, 19828.3]
  - - [2880, 1088, 1, 64, 2880, 2880, 2880, 1088]
    - [9, 20417.2]
  - - [2944, 1088, 1, 64, 2944, 2944, 2944, 1088]
    - [9, 20579.8]
  - - [3008, 1088, 1, 64, 3008, 3008, 3008, 1088]
    - [9, 21109.9]
  - - [3072, 1088, 1, 64, 3072, 3072, 3072, 1088]
    - [11, 19260.6]
  - - [3136, 1088, 1, 64, 3136, 3136, 3136, 1088]
    - [9, 21008.7]
  - - [3200, 1088, 1, 64, 3200, 3200, 3200, 1088]
    - [9, 21148.6]
  - - [3264, 1088, 1, 64, 3264, 3264, 3264, 1088]
    - [9, 21413.0]
  - - [3328, 1088, 1, 64, 3328, 3328, 3328, 1088]
    - [9, 21381.6]
  - - [3392, 1088, 1, 64, 3392, 3392, 3392, 1088]
    - [9, 21726.6]
  - - [3456, 1088, 1, 64, 3456, 3456, 3456, 1088]
    - [9, 21734.7]
  - - [3520, 1088, 1, 64, 3520, 3520, 3520, 1088]
    - [9, 21974.4]
  - - [3584, 1088, 1, 64, 3584, 3584, 3584, 1088]
    - [9, 21573.3]
  - - [3648, 1088, 1, 64, 3648, 3648, 3648, 1088]
    - [9, 22421.7]
  - - [3712, 1088, 1, 64, 3712, 3712, 3712, 1088]
    - [9, 22491.5]
  - - [3776, 1088, 1, 64, 3776, 3776, 3776, 1088]
    - [9, 21914.3]
  - - [3840, 1088, 1, 64, 3840, 3840, 3840, 1088]
    - [9, 22604.2]
  - - [3904, 1088, 1, 64, 3904, 3904, 3904, 1088]
    - [9, 23172.9]
  - - [3968, 1088, 1, 64, 3968, 3968, 3968, 1088]
    - [9, 23131.0]
  - - [4032, 1088, 1, 64, 4032, 4032, 4032, 1088]
    - [9, 23320.4]
  - - [4096, 1088, 1, 64, 4096, 4096, 4096, 1088]
    - [9, 21805.1]
  - - [64, 1152, 1, 64, 64, 64, 64, 1152]
    - [7, 950.558]
  - - [128, 1152, 1, 64, 128, 128, 128, 1152]
    - [18, 2007.9]
  - - [192, 1152, 1, 64, 192, 192, 192, 1152]
    - [7, 2837.95]
  - - [256, 1152, 1, 64, 256, 256, 256, 1152]
    - [6, 3866.89]
  - - [320, 1152, 1, 64, 320, 320, 320, 1152]
    - [7, 4543.18]
  - - [384, 1152, 1, 64, 384, 384, 384, 1152]
    - [11, 5399.8]
  - - [448, 1152, 1, 64, 448, 448, 448, 1152]
    - [16, 5931.02]
  - - [512, 1152, 1, 64, 512, 512, 512, 1152]
    - [7, 6513.99]
  - - [576, 1152, 1, 64, 576, 576, 576, 1152]
    - [2, 7076.62]
  - - [640, 1152, 1, 64, 640, 640, 640, 1152]
    - [1, 8131.23]
  - - [704, 1152, 1, 64, 704, 704, 704, 1152]
    - [3, 8546.73]
  - - [768, 1152, 1, 64, 768, 768, 768, 1152]
    - [1, 8945.16]
  - - [832, 1152, 1, 64, 832, 832, 832, 1152]
    - [11, 9881.03]
  - - [896, 1152, 1, 64, 896, 896, 896, 1152]
    - [0, 10672.1]
  - - [960, 1152, 1, 64, 960, 960, 960, 1152]
    - [0, 11333.6]
  - - [1024, 1152, 1, 64, 1024, 1024, 1024, 1152]
    - [0, 11454.5]
  - - [1088, 1152, 1, 64, 1088, 1088, 1088, 1152]
    - [0, 12388.5]
  - - [1152, 1152, 1, 64, 1152, 1152, 1152, 1152]
    - [0, 12974.9]
  - - [1216, 1152, 1, 64, 1216, 1216, 1216, 1152]
    - [9, 12871.9]
  - - [1280, 1152, 1, 64, 1280, 1280, 1280, 1152]
    - [0, 13637.5]
  - - [1344, 1152, 1, 64, 1344, 1344, 1344, 1152]
    - [0, 14288.4]
  - - [1408, 1152, 1, 64, 1408, 1408, 1408, 1152]
    - [9, 14009.2]
  - - [1472, 1152, 1, 64, 1472, 1472, 1472, 1152]
    - [9, 14435.6]
  - - [1536, 1152, 1, 64, 1536, 1536, 1536, 1152]
    - [0, 13931.1]
  - - [1600, 1152, 1, 64, 1600, 1600, 1600, 1152]
    - [9, 15050.2]
  - - [1664, 1152, 1, 64, 1664, 1664, 1664, 1152]
    - [9, 15449.3]
  - - [1728, 1152, 1, 64, 1728, 1728, 1728, 1152]
    - [9, 15840.0]
  - - [1792, 1152, 1, 64, 1792, 1792, 1792, 1152]
    - [9, 16264.8]
  - - [1856, 1152, 1, 64, 1856, 1856, 1856, 1152]
    - [9, 16622.7]
  - - [1920, 1152, 1, 64, 1920, 1920, 1920, 1152]
    - [9, 16696.9]
  - - [1984, 1152, 1, 64, 1984, 1984, 1984, 1152]
    - [9, 17088.3]
  - - [2048, 1152, 1, 64, 2048, 2048, 2048, 1152]
    - [9, 16034.2]
  - - [2112, 1152, 1, 64, 2112, 2112, 2112, 1152]
    - [9, 17757.2]
  - - [2176, 1152, 1, 64, 2176, 2176, 2176, 1152]
    - [9, 17784.2]
  - - [2240, 1152, 1, 64, 2240, 2240, 2240, 1152]
    - [9, 18094.6]
  - - [2304, 1152, 1, 64, 2304, 2304, 2304, 1152]
    - [9, 18187.2]
  - - [2368, 1152, 1, 64, 2368, 2368, 2368, 1152]
    - [9, 18966.4]
  - - [2432, 1152, 1, 64, 2432, 2432, 2432, 1152]
    - [9, 19199.6]
  - - [2496, 1152, 1, 64, 2496, 2496, 2496, 1152]
    - [9, 19492.0]
  - - [2560, 1152, 1, 64, 2560, 2560, 2560, 1152]
    - [9, 19126.6]
  - - [2624, 1152, 1, 64, 2624, 2624, 2624, 1152]
    - [9, 19962.9]
  - - [2688, 1152, 1, 64, 2688, 2688, 2688, 1152]
    - [9, 20263.8]
  - - [2752, 1152, 1, 64, 2752, 2752, 2752, 1152]
    - [9, 20708.1]
  - - [2816, 1152, 1, 64, 2816, 2816, 2816, 1152]
    - [9, 20562.2]
  - - [2880, 1152, 1, 64, 2880, 2880, 2880, 1152]
    - [9, 21085.9]
  - - [2944, 1152, 1, 64, 2944, 2944, 2944, 1152]
    - [9, 21157.4]
  - - [3008, 1152, 1, 64, 3008, 3008, 3008, 1152]
    - [9, 21452.1]
  - - [3072, 1152, 1, 64, 3072, 3072, 3072, 1152]
    - [11, 19890.3]
  - - [3136, 1152, 1, 64, 3136, 3136, 3136, 1152]
    - [9, 21541.9]
  - - [3200, 1152, 1, 64, 3200, 3200, 3200, 1152]
    - [9, 21714.4]
  - - [3264, 1152, 1, 64, 3264, 3264, 3264, 1152]
    - [9, 21886.9]
  - - [3328, 1152, 1, 64, 3328, 3328, 3328, 1152]
    - [9, 21997.9]
  - - [3392, 1152, 1, 64, 3392, 3392, 3392, 1152]
    - [9, 21818.5]
  - - [3456, 1152, 1, 64, 3456, 3456, 3456, 1152]
    - [9, 22224.3]
  - - [3520, 1152, 1, 64, 3520, 3520, 3520, 1152]
    - [9, 22604.3]
  - - [3584, 1152, 1, 64, 3584, 3584, 3584, 1152]
    - [9, 22053.0]
  - - [3648, 1152, 1, 64, 3648, 3648, 3648, 1152]
    - [9, 22882.2]
  - - [3712, 1152, 1, 64, 3712, 3712, 3712, 1152]
    - [9, 22945.9]
  - - [3776, 1152, 1, 64, 3776, 3776, 3776, 1152]
    - [9, 22449.4]
  - - [3840, 1152, 1, 64, 3840, 3840, 3840, 1152]
    - [9, 23126.4]
  - - [3904, 1152, 1, 64, 3904, 3904, 3904, 1152]
    - [9, 23643.2]
  - - [3968, 1152, 1, 64, 3968, 3968, 3968, 1152]
    - [9, 23577.5]
  - - [4032, 1152, 1, 64, 4032, 4032, 4032, 1152]
    - [11, 23581.5]
  - - [4096, 1152, 1, 64, 4096, 4096, 4096, 1152]
    - [9, 22203.3]
  - - [64, 1216, 1, 64, 64, 64, 64, 1216]
    - [18, 1036.36]
  - - [128, 1216, 1, 64, 128, 128, 128, 1216]
    - [4, 2077.45]
  - - [192, 1216, 1, 64, 192, 192, 192, 1216]
    - [5, 3167.05]
  - - [256, 1216, 1, 64, 256, 256, 256, 1216]
    - [0, 4011.85]
  - - [320, 1216, 1, 64, 320, 320, 320, 1216]
    - [13, 4522.17]
  - - [384, 1216, 1, 64, 384, 384, 384, 1216]
    - [16, 5573.32]
  - - [448, 1216, 1, 64, 448, 448, 448, 1216]
    - [20, 6104.83]
  - - [512, 1216, 1, 64, 512, 512, 512, 1216]
    - [1, 6819.39]
  - - [576, 1216, 1, 64, 576, 576, 576, 1216]
    - [7, 6266.78]
  - - [640, 1216, 1, 64, 640, 640, 640, 1216]
    - [11, 6830.34]
  - - [704, 1216, 1, 64, 704, 704, 704, 1216]
    - [9, 7446.01]
  - - [768, 1216, 1, 64, 768, 768, 768, 1216]
    - [9, 8142.86]
  - - [832, 1216, 1, 64, 832, 832, 832, 1216]
    - [4, 8795.08]
  - - [896, 1216, 1, 64, 896, 896, 896, 1216]
    - [9, 9708.9]
  - - [960, 1216, 1, 64, 960, 960, 960, 1216]
    - [0, 10085.0]
  - - [1024, 1216, 1, 64, 1024, 1024, 1024, 1216]
    - [0, 10542.6]
  - - [1088, 1216, 1, 64, 1088, 1088, 1088, 1216]
    - [9, 11307.7]
  - - [1152, 1216, 1, 64, 1152, 1152, 1152, 1216]
    - [9, 11315.5]
  - - [1216, 1216, 1, 64, 1216, 1216, 1216, 1216]
    - [9, 12414.1]
  - - [1280, 1216, 1, 64, 1280, 1280, 1280, 1216]
    - [9, 11877.2]
  - - [1344, 1216, 1, 64, 1344, 1344, 1344, 1216]
    - [9, 12360.6]
  - - [1408, 1216, 1, 64, 1408, 1408, 1408, 1216]
    - [11, 13541.2]
  - - [1472, 1216, 1, 64, 1472, 1472, 1472, 1216]
    - [4, 13191.6]
  - - [1536, 1216, 1, 64, 1536, 1536, 1536, 1216]
    - [0, 13059.8]
  - - [1600, 1216, 1, 64, 1600, 1600, 1600, 1216]
    - [9, 13953.1]
  - - [1664, 1216, 1, 64, 1664, 1664, 1664, 1216]
    - [0, 15021.2]
  - - [1728, 1216, 1, 64, 1728, 1728, 1728, 1216]
    - [11, 15311.3]
  - - [1792, 1216, 1, 64, 1792, 1792, 1792, 1216]
    - [9, 15288.3]
  - - [1856, 1216, 1, 64, 1856, 1856, 1856, 1216]
    - [0, 15841.3]
  - - [1920, 1216, 1, 64, 1920, 1920, 1920, 1216]
    - [11, 16108.3]
  - - [1984, 1216, 1, 64, 1984, 1984, 1984, 1216]
    - [0, 16570.2]
  - - [2048, 1216, 1, 64, 2048, 2048, 2048, 1216]
    - [9, 16431.2]
  - - [2112, 1216, 1, 64, 2112, 2112, 2112, 1216]
    - [9, 17560.1]
  - - [2176, 1216, 1, 64, 2176, 2176, 2176, 1216]
    - [0, 18049.8]
  - - [2240, 1216, 1, 64, 2240, 2240, 2240, 1216]
    - [9, 18478.3]
  - - [2304, 1216, 1, 64, 2304, 2304, 2304, 1216]
    - [9, 18519.4]
  - - [2368, 1216, 1, 64, 2368, 2368, 2368, 1216]
    - [9, 19319.2]
  - - [2432, 1216, 1, 64, 2432, 2432, 2432, 1216]
    - [9, 19645.7]
  - - [2496, 1216, 1, 64, 2496, 2496, 2496, 1216]
    - [9, 19851.5]
  - - [2560, 1216, 1, 64, 2560, 2560, 2560, 1216]
    - [9, 19678.7]
  - - [2624, 1216, 1, 64, 2624, 2624, 2624, 1216]
    - [9, 20585.5]
  - - [2688, 1216, 1, 64, 2688, 2688, 2688, 1216]
    - [9, 20701.6]
  - - [2752, 1216, 1, 64, 2752, 2752, 2752, 1216]
    - [9, 20997.0]
  - - [2816, 1216, 1, 64, 2816, 2816, 2816, 1216]
    - [9, 20776.5]
  - - [2880, 1216, 1, 64, 2880, 2880, 2880, 1216]
    - [9, 21313.4]
  - - [2944, 1216, 1, 64, 2944, 2944, 2944, 1216]
    - [9, 21186.6]
  - - [3008, 1216, 1, 64, 3008, 3008, 3008, 1216]
    - [9, 21413.5]
  - - [3072, 1216, 1, 64, 3072, 3072, 3072, 1216]
    - [11, 20173.3]
  - - [3136, 1216, 1, 64, 3136, 3136, 3136, 1216]
    - [9, 21794.4]
  - - [3200, 1216, 1, 64, 3200, 3200, 3200, 1216]
    - [9, 21660.9]
  - - [3264, 1216, 1, 64, 3264, 3264, 3264, 1216]
    - [9, 21968.0]
  - - [3328, 1216, 1, 64, 3328, 3328, 3328, 1216]
    - [9, 22134.5]
  - - [3392, 1216, 1, 64, 3392, 3392, 3392, 1216]
    - [9, 22274.7]
  - - [3456, 1216, 1, 64, 3456, 3456, 3456, 1216]
    - [9, 22342.4]
  - - [3520, 1216, 1, 64, 3520, 3520, 3520, 1216]
    - [9, 22602.2]
  - - [3584, 1216, 1, 64, 3584, 3584, 3584, 1216]
    - [9, 22336.7]
  - - [3648, 1216, 1, 64, 3648, 3648, 3648, 1216]
    - [9, 23151.0]
  - - [3712, 1216, 1, 64, 3712, 3712, 3712, 1216]
    - [9, 23450.1]
  - - [3776, 1216, 1, 64, 3776, 3776, 3776, 1216]
    - [9, 22779.9]
  - - [3840, 1216, 1, 64, 3840, 3840, 3840, 1216]
    - [9, 23132.0]
  - - [3904, 1216, 1, 64, 3904, 3904, 3904, 1216]
    - [9, 23998.6]
  - - [3968, 1216, 1, 64, 3968, 3968, 3968, 1216]
    - [9, 23962.4]
  - - [4032, 1216, 1, 64, 4032, 4032, 4032, 1216]
    - [9, 24318.6]
  - - [4096, 1216, 1, 64, 4096, 4096, 4096, 1216]
    - [9, 22516.5]
  - - [64, 1280, 1, 64, 64, 64, 64, 1280]
    - [17, 833.781]
  - - [128, 1280, 1, 64, 128, 128, 128, 1280]
    - [12, 1617.16]
  - - [192, 1280, 1, 64, 192, 192, 192, 1280]
    - [19, 2530.33]
  - - [256, 1280, 1, 64, 256, 256, 256, 1280]
    - [4, 3280.35]
  - - [320, 1280, 1, 64, 320, 320, 320, 1280]
    - [7, 3927.8]
  - - [384, 1280, 1, 64, 384, 384, 384, 1280]
    - [21, 5119.1]
  - - [448, 1280, 1, 64, 448, 448, 448, 1280]
    - [4, 5898.36]
  - - [512, 1280, 1, 64, 512, 512, 512, 1280]
    - [4, 6298.6]
  - - [576, 1280, 1, 64, 576, 576, 576, 1280]
    - [4, 7053.1]
  - - [640, 1280, 1, 64, 640, 640, 640, 1280]
    - [4, 7445.05]
  - - [704, 1280, 1, 64, 704, 704, 704, 1280]
    - [11, 7938.24]
  - - [768, 1280, 1, 64, 768, 768, 768, 1280]
    - [0, 8328.56]
  - - [832, 1280, 1, 64, 832, 832, 832, 1280]
    - [11, 10647.8]
  - - [896, 1280, 1, 64, 896, 896, 896, 1280]
    - [0, 11648.9]
  - - [960, 1280, 1, 64, 960, 960, 960, 1280]
    - [0, 12069.1]
  - - [1024, 1280, 1, 64, 1024, 1024, 1024, 1280]
    - [0, 12251.4]
  - - [1088, 1280, 1, 64, 1088, 1088, 1088, 1280]
    - [0, 13145.7]
  - - [1152, 1280, 1, 64, 1152, 1152, 1152, 1280]
    - [0, 13408.8]
  - - [1216, 1280, 1, 64, 1216, 1216, 1216, 1280]
    - [0, 14380.5]
  - - [1280, 1280, 1, 64, 1280, 1280, 1280, 1280]
    - [9, 13982.6]
  - - [1344, 1280, 1, 64, 1344, 1344, 1344, 1280]
    - [9, 14515.5]
  - - [1408, 1280, 1, 64, 1408, 1408, 1408, 1280]
    - [9, 14819.8]
  - - [1472, 1280, 1, 64, 1472, 1472, 1472, 1280]
    - [9, 15291.0]
  - - [1536, 1280, 1, 64, 1536, 1536, 1536, 1280]
    - [9, 14798.0]
  - - [1600, 1280, 1, 64, 1600, 1600, 1600, 1280]
    - [9, 16163.6]
  - - [1664, 1280, 1, 64, 1664, 1664, 1664, 1280]
    - [9, 16419.3]
  - - [1728, 1280, 1, 64, 1728, 1728, 1728, 1280]
    - [9, 16833.9]
  - - [1792, 1280, 1, 64, 1792, 1792, 1792, 1280]
    - [9, 16945.5]
  - - [1856, 1280, 1, 64, 1856, 1856, 1856, 1280]
    - [9, 17378.2]
  - - [1920, 1280, 1, 64, 1920, 1920, 1920, 1280]
    - [9, 17339.2]
  - - [1984, 1280, 1, 64, 1984, 1984, 1984, 1280]
    - [9, 17972.7]
  - - [2048, 1280, 1, 64, 2048, 2048, 2048, 1280]
    - [9, 16924.3]
  - - [2112, 1280, 1, 64, 2112, 2112, 2112, 1280]
    - [9, 18488.2]
  - - [2176, 1280, 1, 64, 2176, 2176, 2176, 1280]
    - [9, 18813.4]
  - - [2240, 1280, 1, 64, 2240, 2240, 2240, 1280]
    - [9, 19019.4]
  - - [2304, 1280, 1, 64, 2304, 2304, 2304, 1280]
    - [9, 19245.6]
  - - [2368, 1280, 1, 64, 2368, 2368, 2368, 1280]
    - [9, 19904.0]
  - - [2432, 1280, 1, 64, 2432, 2432, 2432, 1280]
    - [9, 20132.1]
  - - [2496, 1280, 1, 64, 2496, 2496, 2496, 1280]
    - [9, 20695.4]
  - - [2560, 1280, 1, 64, 2560, 2560, 2560, 1280]
    - [9, 20180.3]
  - - [2624, 1280, 1, 64, 2624, 2624, 2624, 1280]
    - [9, 21055.6]
  - - [2688, 1280, 1, 64, 2688, 2688, 2688, 1280]
    - [9, 21069.5]
  - - [2752, 1280, 1, 64, 2752, 2752, 2752, 1280]
    - [9, 21326.3]
  - - [2816, 1280, 1, 64, 2816, 2816, 2816, 1280]
    - [9, 21259.3]
  - - [2880, 1280, 1, 64, 2880, 2880, 2880, 1280]
    - [9, 21624.8]
  - - [2944, 1280, 1, 64, 2944, 2944, 2944, 1280]
    - [9, 21948.5]
  - - [3008, 1280, 1, 64, 3008, 3008, 3008, 1280]
    - [9, 21930.7]
  - - [3072, 1280, 1, 64, 3072, 3072, 3072, 1280]
    - [11, 20421.5]
  - - [3136, 1280, 1, 64, 3136, 3136, 3136, 1280]
    - [9, 22104.4]
  - - [3200, 1280, 1, 64, 3200, 3200, 3200, 1280]
    - [9, 22393.8]
  - - [3264, 1280, 1, 64, 3264, 3264, 3264, 1280]
    - [9, 22762.0]
  - - [3328, 1280, 1, 64, 3328, 3328, 3328, 1280]
    - [9, 22789.3]
  - - [3392, 1280, 1, 64, 3392, 3392, 3392, 1280]
    - [9, 22761.2]
  - - [3456, 1280, 1, 64, 3456, 3456, 3456, 1280]
    - [9, 22996.9]
  - - [3520, 1280, 1, 64, 3520, 3520, 3520, 1280]
    - [9, 23405.5]
  - - [3584, 1280, 1, 64, 3584, 3584, 3584, 1280]
    - [9, 23061.8]
  - - [3648, 1280, 1, 64, 3648, 3648, 3648, 1280]
    - [9, 23955.3]
  - - [3712, 1280, 1, 64, 3712, 3712, 3712, 1280]
    - [9, 23816.1]
  - - [3776, 1280, 1, 64, 3776, 3776, 3776, 1280]
    - [9, 23252.3]
  - - [3840, 1280, 1, 64, 3840, 3840, 3840, 1280]
    - [9, 24182.8]
  - - [3904, 1280, 1, 64, 3904, 3904, 3904, 1280]
    - [9, 24521.7]
  - - [3968, 1280, 1, 64, 3968, 3968, 3968, 1280]
    - [9, 24497.5]
  - - [4032, 1280, 1, 64, 4032, 4032, 4032, 1280]
    - [11, 24335.0]
  - - [4096, 1280, 1, 64, 4096, 4096, 4096, 1280]
    - [9, 23113.7]
  - - [64, 1344, 1, 64, 64, 64, 64, 1344]
    - [5, 1166.07]
  - - [128, 1344, 1, 64, 128, 128, 128, 1344]
    - [5, 2279.96]
  - - [192, 1344, 1, 64, 192, 192, 192, 1344]
    - [9, 3198.72]
  - - [256, 1344, 1, 64, 256, 256, 256, 1344]
    - [7, 4488.36]
  - - [320, 1344, 1, 64, 320, 320, 320, 1344]
    - [2, 5165.08]
  - - [384, 1344, 1, 64, 384, 384, 384, 1344]
    - [21, 5984.72]
  - - [448, 1344, 1, 64, 448, 448, 448, 1344]
    - [1, 6738.04]
  - - [512, 1344, 1, 64, 512, 512, 512, 1344]
    - [2, 7533.36]
  - - [576, 1344, 1, 64, 576, 576, 576, 1344]
    - [0, 8317.11]
  - - [640, 1344, 1, 64, 640, 640, 640, 1344]
    - [3, 9171.91]
  - - [704, 1344, 1, 64, 704, 704, 704, 1344]
    - [9, 9961.3]
  - - [768, 1344, 1, 64, 768, 768, 768, 1344]
    - [0, 10445.8]
  - - [832, 1344, 1, 64, 832, 832, 832, 1344]
    - [0, 11529.6]
  - - [896, 1344, 1, 64, 896, 896, 896, 1344]
    - [0, 11902.7]
  - - [960, 1344, 1, 64, 960, 960, 960, 1344]
    - [0, 12782.5]
  - - [1024, 1344, 1, 64, 1024, 1024, 1024, 1344]
    - [0, 13031.5]
  - - [1088, 1344, 1, 64, 1088, 1088, 1088, 1344]
    - [0, 13746.2]
  - - [1152, 1344, 1, 64, 1152, 1152, 1152, 1344]
    - [0, 14143.5]
  - - [1216, 1344, 1, 64, 1216, 1216, 1216, 1344]
    - [9, 14199.7]
  - - [1280, 1344, 1, 64, 1280, 1280, 1280, 1344]
    - [9, 14592.4]
  - - [1344, 1344, 1, 64, 1344, 1344, 1344, 1344]
    - [9, 15001.9]
  - - [1408, 1344, 1, 64, 1408, 1408, 1408, 1344]
    - [9, 15408.4]
  - - [1472, 1344, 1, 64, 1472, 1472, 1472, 1344]
    - [9, 15785.4]
  - - [1536, 1344, 1, 64, 1536, 1536, 1536, 1344]
    - [9, 15229.8]
  - - [1600, 1344, 1, 64, 1600, 1600, 1600, 1344]
    - [11, 16491.9]
  - - [1664, 1344, 1, 64, 1664, 1664, 1664, 1344]
    - [9, 16932.5]
  - - [1728, 1344, 1, 64, 1728, 1728, 1728, 1344]
    - [9, 17121.8]
  - - [1792, 1344, 1, 64, 1792, 1792, 1792, 1344]
    - [9, 17409.0]
  - - [1856, 1344, 1, 64, 1856, 1856, 1856, 1344]
    - [9, 17857.4]
  - - [1920, 1344, 1, 64, 1920, 1920, 1920, 1344]
    - [9, 17836.7]
  - - [1984, 1344, 1, 64, 1984, 1984, 1984, 1344]
    - [9, 18312.5]
  - - [2048, 1344, 1, 64, 2048, 2048, 2048, 1344]
    - [9, 17401.9]
  - - [2112, 1344, 1, 64, 2112, 2112, 2112, 1344]
    - [9, 19116.5]
  - - [2176, 1344, 1, 64, 2176, 2176, 2176, 1344]
    - [0, 19329.7]
  - - [2240, 1344, 1, 64, 2240, 2240, 2240, 1344]
    - [0, 19513.3]
  - - [2304, 1344, 1, 64, 2304, 2304, 2304, 1344]
    - [9, 19602.3]
  - - [2368, 1344, 1, 64, 2368, 2368, 2368, 1344]
    - [9, 20358.3]
  - - [2432, 1344, 1, 64, 2432, 2432, 2432, 1344]
    - [9, 20601.6]
  - - [2496, 1344, 1, 64, 2496, 2496, 2496, 1344]
    - [9, 20980.5]
  - - [2560, 1344, 1, 64, 2560, 2560, 2560, 1344]
    - [9, 20489.5]
  - - [2624, 1344, 1, 64, 2624, 2624, 2624, 1344]
    - [9, 21324.9]
  - - [2688, 1344, 1, 64, 2688, 2688, 2688, 1344]
    - [9, 21337.0]
  - - [2752, 1344, 1, 64, 2752, 2752, 2752, 1344]
    - [9, 21782.8]
  - - [2816, 1344, 1, 64, 2816, 2816, 2816, 1344]
    - [9, 21764.7]
  - - [2880, 1344, 1, 64, 2880, 2880, 2880, 1344]
    - [9, 22139.8]
  - - [2944, 1344, 1, 64, 2944, 2944, 2944, 1344]
    - [9, 22201.4]
  - - [3008, 1344, 1, 64, 3008, 3008, 3008, 1344]
    - [9, 22473.2]
  - - [3072, 1344, 1, 64, 3072, 3072, 3072, 1344]
    - [11, 20921.5]
  - - [3136, 1344, 1, 64, 3136, 3136, 3136, 1344]
    - [9, 22817.0]
  - - [3200, 1344, 1, 64, 3200, 3200, 3200, 1344]
    - [9, 22903.1]
  - - [3264, 1344, 1, 64, 3264, 3264, 3264, 1344]
    - [9, 23320.3]
  - - [3328, 1344, 1, 64, 3328, 3328, 3328, 1344]
    - [9, 23533.2]
  - - [3392, 1344, 1, 64, 3392, 3392, 3392, 1344]
    - [9, 23620.7]
  - - [3456, 1344, 1, 64, 3456, 3456, 3456, 1344]
    - [9, 23735.9]
  - - [3520, 1344, 1, 64, 3520, 3520, 3520, 1344]
    - [9, 23763.6]
  - - [3584, 1344, 1, 64, 3584, 3584, 3584, 1344]
    - [9, 23541.7]
  - - [3648, 1344, 1, 64, 3648, 3648, 3648, 1344]
    - [9, 24398.0]
  - - [3712, 1344, 1, 64, 3712, 3712, 3712, 1344]
    - [9, 24568.2]
  - - [3776, 1344, 1, 64, 3776, 3776, 3776, 1344]
    - [9, 23799.6]
  - - [3840, 1344, 1, 64, 3840, 3840, 3840, 1344]
    - [9, 24488.2]
  - - [3904, 1344, 1, 64, 3904, 3904, 3904, 1344]
    - [9, 24961.1]
  - - [3968, 1344, 1, 64, 3968, 3968, 3968, 1344]
    - [9, 24903.9]
  - - [4032, 1344, 1, 64, 4032, 4032, 4032, 1344]
    - [9, 25986.2]
  - - [4096, 1344, 1, 64, 4096, 4096, 4096, 1344]
    - [9, 23572.6]
  - - [64, 1408, 1, 64, 64, 64, 64, 1408]
    - [4, 1254.8]
  - - [128, 1408, 1, 64, 128, 128, 128, 1408]
    - [3, 2483.69]
  - - [192, 1408, 1, 64, 192, 192, 192, 1408]
    - [6, 3565.06]
  - - [256, 1408, 1, 64, 256, 256, 256, 1408]
    - [4, 4409.07]
  - - [320, 1408, 1, 64, 320, 320, 320, 1408]
    - [4, 5427.34]
  - - [384, 1408, 1, 64, 384, 384, 384, 1408]
    - [9, 6210.13]
  - - [448, 1408, 1, 64, 448, 448, 448, 1408]
    - [4, 7030.59]
  - - [512, 1408, 1, 64, 512, 512, 512, 1408]
    - [4, 7776.3]
  - - [576, 1408, 1, 64, 576, 576, 576, 1408]
    - [4, 8531.21]
  - - [640, 1408, 1, 64, 640, 640, 640, 1408]
    - [0, 9446.51]
  - - [704, 1408, 1, 64, 704, 704, 704, 1408]
    - [9, 10079.2]
  - - [768, 1408, 1, 64, 768, 768, 768, 1408]
    - [0, 10876.3]
  - - [832, 1408, 1, 64, 832, 832, 832, 1408]
    - [0, 11860.8]
  - - [896, 1408, 1, 64, 896, 896, 896, 1408]
    - [0, 12473.3]
  - - [960, 1408, 1, 64, 960, 960, 960, 1408]
    - [0, 13308.8]
  - - [1024, 1408, 1, 64, 1024, 1024, 1024, 1408]
    - [0, 12987.2]
  - - [1088, 1408, 1, 64, 1088, 1088, 1088, 1408]
    - [0, 14221.2]
  - - [1152, 1408, 1, 64, 1152, 1152, 1152, 1408]
    - [9, 14003.6]
  - - [1216, 1408, 1, 64, 1216, 1216, 1216, 1408]
    - [9, 14547.9]
  - - [1280, 1408, 1, 64, 1280, 1280, 1280, 1408]
    - [9, 14892.5]
  - - [1344, 1408, 1, 64, 1344, 1344, 1344, 1408]
    - [9, 15307.1]
  - - [1408, 1408, 1, 64, 1408, 1408, 1408, 1408]
    - [9, 15720.0]
  - - [1472, 1408, 1, 64, 1472, 1472, 1472, 1408]
    - [9, 16277.3]
  - - [1536, 1408, 1, 64, 1536, 1536, 1536, 1408]
    - [9, 15513.4]
  - - [1600, 1408, 1, 64, 1600, 1600, 1600, 1408]
    - [9, 16835.4]
  - - [1664, 1408, 1, 64, 1664, 1664, 1664, 1408]
    - [9, 16804.3]
  - - [1728, 1408, 1, 64, 1728, 1728, 1728, 1408]
    - [9, 17402.0]
  - - [1792, 1408, 1, 64, 1792, 1792, 1792, 1408]
    - [9, 17737.2]
  - - [1856, 1408, 1, 64, 1856, 1856, 1856, 1408]
    - [9, 17989.3]
  - - [1920, 1408, 1, 64, 1920, 1920, 1920, 1408]
    - [9, 18107.1]
  - - [1984, 1408, 1, 64, 1984, 1984, 1984, 1408]
    - [0, 18541.8]
  - - [2048, 1408, 1, 64, 2048, 2048, 2048, 1408]
    - [0, 17837.6]
  - - [2112, 1408, 1, 64, 2112, 2112, 2112, 1408]
    - [9, 19547.6]
  - - [2176, 1408, 1, 64, 2176, 2176, 2176, 1408]
    - [0, 19834.4]
  - - [2240, 1408, 1, 64, 2240, 2240, 2240, 1408]
    - [9, 19898.4]
  - - [2304, 1408, 1, 64, 2304, 2304, 2304, 1408]
    - [9, 20084.7]
  - - [2368, 1408, 1, 64, 2368, 2368, 2368, 1408]
    - [9, 20748.9]
  - - [2432, 1408, 1, 64, 2432, 2432, 2432, 1408]
    - [9, 20913.3]
  - - [2496, 1408, 1, 64, 2496, 2496, 2496, 1408]
    - [9, 21414.6]
  - - [2560, 1408, 1, 64, 2560, 2560, 2560, 1408]
    - [9, 20825.5]
  - - [2624, 1408, 1, 64, 2624, 2624, 2624, 1408]
    - [9, 21905.9]
  - - [2688, 1408, 1, 64, 2688, 2688, 2688, 1408]
    - [9, 21934.2]
  - - [2752, 1408, 1, 64, 2752, 2752, 2752, 1408]
    - [9, 22272.9]
  - - [2816, 1408, 1, 64, 2816, 2816, 2816, 1408]
    - [9, 22138.6]
  - - [2880, 1408, 1, 64, 2880, 2880, 2880, 1408]
    - [9, 22514.0]
  - - [2944, 1408, 1, 64, 2944, 2944, 2944, 1408]
    - [9, 22826.3]
  - - [3008, 1408, 1, 64, 3008, 3008, 3008, 1408]
    - [9, 22796.9]
  - - [3072, 1408, 1, 64, 3072, 3072, 3072, 1408]
    - [11, 21470.7]
  - - [3136, 1408, 1, 64, 3136, 3136, 3136, 1408]
    - [9, 23160.9]
  - - [3200, 1408, 1, 64, 3200, 3200, 3200, 1408]
    - [9, 23401.7]
  - - [3264, 1408, 1, 64, 3264, 3264, 3264, 1408]
    - [9, 23756.0]
  - - [3328, 1408, 1, 64, 3328, 3328, 3328, 1408]
    - [9, 23813.9]
  - - [3392, 1408, 1, 64, 3392, 3392, 3392, 1408]
    - [9, 23995.6]
  - - [3456, 1408, 1, 64, 3456, 3456, 3456, 1408]
    - [9, 24224.1]
  - - [3520, 1408, 1, 64, 3520, 3520, 3520, 1408]
    - [9, 24433.2]
  - - [3584, 1408, 1, 64, 3584, 3584, 3584, 1408]
    - [9, 24117.4]
  - - [3648, 1408, 1, 64, 3648, 3648, 3648, 1408]
    - [9, 24684.6]
  - - [3712, 1408, 1, 64, 3712, 3712, 3712, 1408]
    - [9, 24731.3]
  - - [3776, 1408, 1, 64, 3776, 3776, 3776, 1408]
    - [9, 24459.8]
  - - [3840, 1408, 1, 64, 3840, 3840, 3840, 1408]
    - [9, 25019.9]
  - - [3904, 1408, 1, 64, 3904, 3904, 3904, 1408]
    - [9, 25400.3]
  - - [3968, 1408, 1, 64, 3968, 3968, 3968, 1408]
    - [9, 25214.1]
  - - [4032, 1408, 1, 64, 4032, 4032, 4032, 1408]
    - [9, 26607.7]
  - - [4096, 1408, 1, 64, 4096, 4096, 4096, 1408]
    - [9, 23840.4]
  - - [64, 1472, 1, 64, 64, 64, 64, 1472]
    - [6, 1300.51]
  - - [128, 1472, 1, 64, 128, 128, 128, 1472]
    - [6, 2570.56]
  - - [192, 1472, 1, 64, 192, 192, 192, 1472]
    - [16, 3614.68]
  - - [256, 1472, 1, 64, 256, 256, 256, 1472]
    - [8, 4556.42]
  - - [320, 1472, 1, 64, 320, 320, 320, 1472]
    - [21, 5681.6]
  - - [384, 1472, 1, 64, 384, 384, 384, 1472]
    - [1, 6828.18]
  - - [448, 1472, 1, 64, 448, 448, 448, 1472]
    - [1, 7513.76]
  - - [512, 1472, 1, 64, 512, 512, 512, 1472]
    - [2, 8235.29]
  - - [576, 1472, 1, 64, 576, 576, 576, 1472]
    - [3, 9089.34]
  - - [640, 1472, 1, 64, 640, 640, 640, 1472]
    - [0, 10146.9]
  - - [704, 1472, 1, 64, 704, 704, 704, 1472]
    - [0, 10623.3]
  - - [768, 1472, 1, 64, 768, 768, 768, 1472]
    - [0, 11252.1]
  - - [832, 1472, 1, 64, 832, 832, 832, 1472]
    - [0, 12118.2]
  - - [896, 1472, 1, 64, 896, 896, 896, 1472]
    - [0, 13002.1]
  - - [960, 1472, 1, 64, 960, 960, 960, 1472]
    - [0, 13253.1]
  - - [1024, 1472, 1, 64, 1024, 1024, 1024, 1472]
    - [0, 13252.9]
  - - [1088, 1472, 1, 64, 1088, 1088, 1088, 1472]
    - [9, 13879.2]
  - - [1152, 1472, 1, 64, 1152, 1152, 1152, 1472]
    - [9, 14385.9]
  - - [1216, 1472, 1, 64, 1216, 1216, 1216, 1472]
    - [9, 14842.7]
  - - [1280, 1472, 1, 64, 1280, 1280, 1280, 1472]
    - [9, 15291.1]
  - - [1344, 1472, 1, 64, 1344, 1344, 1344, 1472]
    - [9, 15548.9]
  - - [1408, 1472, 1, 64, 1408, 1408, 1408, 1472]
    - [9, 16103.3]
  - - [1472, 1472, 1, 64, 1472, 1472, 1472, 1472]
    - [9, 16524.5]
  - - [1536, 1472, 1, 64, 1536, 1536, 1536, 1472]
    - [9, 15577.7]
  - - [1600, 1472, 1, 64, 1600, 1600, 1600, 1472]
    - [9, 16982.0]
  - - [1664, 1472, 1, 64, 1664, 1664, 1664, 1472]
    - [9, 17346.6]
  - - [1728, 1472, 1, 64, 1728, 1728, 1728, 1472]
    - [9, 17877.3]
  - - [1792, 1472, 1, 64, 1792, 1792, 1792, 1472]
    - [9, 18111.7]
  - - [1856, 1472, 1, 64, 1856, 1856, 1856, 1472]
    - [9, 18226.6]
  - - [1920, 1472, 1, 64, 1920, 1920, 1920, 1472]
    - [9, 18523.0]
  - - [1984, 1472, 1, 64, 1984, 1984, 1984, 1472]
    - [9, 19209.3]
  - - [2048, 1472, 1, 64, 2048, 2048, 2048, 1472]
    - [0, 18401.2]
  - - [2112, 1472, 1, 64, 2112, 2112, 2112, 1472]
    - [0, 20126.0]
  - - [2176, 1472, 1, 64, 2176, 2176, 2176, 1472]
    - [9, 20190.5]
  - - [2240, 1472, 1, 64, 2240, 2240, 2240, 1472]
    - [9, 20501.7]
  - - [2304, 1472, 1, 64, 2304, 2304, 2304, 1472]
    - [9, 20457.4]
  - - [2368, 1472, 1, 64, 2368, 2368, 2368, 1472]
    - [9, 21107.1]
  - - [2432, 1472, 1, 64, 2432, 2432, 2432, 1472]
    - [9, 21372.4]
  - - [2496, 1472, 1, 64, 2496, 2496, 2496, 1472]
    - [9, 21924.6]
  - - [2560, 1472, 1, 64, 2560, 2560, 2560, 1472]
    - [9, 21276.6]
  - - [2624, 1472, 1, 64, 2624, 2624, 2624, 1472]
    - [9, 22216.0]
  - - [2688, 1472, 1, 64, 2688, 2688, 2688, 1472]
    - [9, 22291.3]
  - - [2752, 1472, 1, 64, 2752, 2752, 2752, 1472]
    - [9, 22575.6]
  - - [2816, 1472, 1, 64, 2816, 2816, 2816, 1472]
    - [9, 22598.7]
  - - [2880, 1472, 1, 64, 2880, 2880, 2880, 1472]
    - [9, 22992.9]
  - - [2944, 1472, 1, 64, 2944, 2944, 2944, 1472]
    - [9, 23108.4]
  - - [3008, 1472, 1, 64, 3008, 3008, 3008, 1472]
    - [9, 23349.9]
  - - [3072, 1472, 1, 64, 3072, 3072, 3072, 1472]
    - [11, 21753.2]
  - - [3136, 1472, 1, 64, 3136, 3136, 3136, 1472]
    - [9, 23680.1]
  - - [3200, 1472, 1, 64, 3200, 3200, 3200, 1472]
    - [9, 23980.7]
  - - [3264, 1472, 1, 64, 3264, 3264, 3264, 1472]
    - [9, 24096.1]
  - - [3328, 1472, 1, 64, 3328, 3328, 3328, 1472]
    - [9, 24390.8]
  - - [3392, 1472, 1, 64, 3392, 3392, 3392, 1472]
    - [9, 24543.0]
  - - [3456, 1472, 1, 64, 3456, 3456, 3456, 1472]
    - [9, 24607.3]
  - - [3520, 1472, 1, 64, 3520, 3520, 3520, 1472]
    - [9, 24783.8]
  - - [3584, 1472, 1, 64, 3584, 3584, 3584, 1472]
    - [9, 24283.5]
  - - [3648, 1472, 1, 64, 3648, 3648, 3648, 1472]
    - [9, 25625.9]
  - - [3712, 1472, 1, 64, 3712, 3712, 3712, 1472]
    - [9, 25014.2]
  - - [3776, 1472, 1, 64, 3776, 3776, 3776, 1472]
    - [9, 24592.3]
  - - [3840, 1472, 1, 64, 3840, 3840, 3840, 1472]
    - [9, 25370.3]
  - - [3904, 1472, 1, 64, 3904, 3904, 3904, 1472]
    - [9, 26981.3]
  - - [3968, 1472, 1, 64, 3968, 3968, 3968, 1472]
    - [9, 27007.8]
  - - [4032, 1472, 1, 64, 4032, 4032, 4032, 1472]
    - [0, 26356.0]
  - - [4096, 1472, 1, 64, 4096, 4096, 4096, 1472]
    - [9, 24129.0]
  - - [64, 1536, 1, 64, 64, 64, 64, 1536]
    - [1, 1368.0]
  - - [128, 1536, 1, 64, 128, 128, 128, 1536]
    - [4, 2615.42]
  - - [192, 1536, 1, 64, 192, 192, 192, 1536]
    - [4, 3806.05]
  - - [256, 1536, 1, 64, 256, 256, 256, 1536]
    - [4, 4784.35]
  - - [320, 1536, 1, 64, 320, 320, 320, 1536]
    - [7, 5685.32]
  - - [384, 1536, 1, 64, 384, 384, 384, 1536]
    - [0, 6695.32]
  - - [448, 1536, 1, 64, 448, 448, 448, 1536]
    - [12, 7547.49]
  - - [512, 1536, 1, 64, 512, 512, 512, 1536]
    - [11, 8240.18]
  - - [576, 1536, 1, 64, 576, 576, 576, 1536]
    - [0, 9366.82]
  - - [640, 1536, 1, 64, 640, 640, 640, 1536]
    - [9, 10122.9]
  - - [704, 1536, 1, 64, 704, 704, 704, 1536]
    - [0, 11094.1]
  - - [768, 1536, 1, 64, 768, 768, 768, 1536]
    - [0, 11577.5]
  - - [832, 1536, 1, 64, 832, 832, 832, 1536]
    - [0, 12590.6]
  - - [896, 1536, 1, 64, 896, 896, 896, 1536]
    - [0, 13315.1]
  - - [960, 1536, 1, 64, 960, 960, 960, 1536]
    - [0, 13680.8]
  - - [1024, 1536, 1, 64, 1024, 1024, 1024, 1536]
    - [0, 13859.5]
  - - [1088, 1536, 1, 64, 1088, 1088, 1088, 1536]
    - [11, 14289.1]
  - - [1152, 1536, 1, 64, 1152, 1152, 1152, 1536]
    - [9, 14672.8]
  - - [1216, 1536, 1, 64, 1216, 1216, 1216, 1536]
    - [9, 15252.8]
  - - [1280, 1536, 1, 64, 1280, 1280, 1280, 1536]
    - [9, 15391.9]
  - - [1344, 1536, 1, 64, 1344, 1344, 1344, 1536]
    - [9, 16074.9]
  - - [1408, 1536, 1, 64, 1408, 1408, 1408, 1536]
    - [9, 16532.6]
  - - [1472, 1536, 1, 64, 1472, 1472, 1472, 1536]
    - [9, 16747.9]
  - - [1536, 1536, 1, 64, 1536, 1536, 1536, 1536]
    - [9, 15673.0]
  - - [1600, 1536, 1, 64, 1600, 1600, 1600, 1536]
    - [9, 17435.4]
  - - [1664, 1536, 1, 64, 1664, 1664, 1664, 1536]
    - [9, 17791.6]
  - - [1728, 1536, 1, 64, 1728, 1728, 1728, 1536]
    - [9, 18200.8]
  - - [1792, 1536, 1, 64, 1792, 1792, 1792, 1536]
    - [9, 18484.7]
  - - [1856, 1536, 1, 64, 1856, 1856, 1856, 1536]
    - [9, 18889.2]
  - - [1920, 1536, 1, 64, 1920, 1920, 1920, 1536]
    - [9, 19138.4]
  - - [1984, 1536, 1, 64, 1984, 1984, 1984, 1536]
    - [9, 19722.2]
  - - [2048, 1536, 1, 64, 2048, 2048, 2048, 1536]
    - [0, 18658.4]
  - - [2112, 1536, 1, 64, 2112, 2112, 2112, 1536]
    - [9, 20392.5]
  - - [2176, 1536, 1, 64, 2176, 2176, 2176, 1536]
    - [9, 20729.5]
  - - [2240, 1536, 1, 64, 2240, 2240, 2240, 1536]
    - [9, 20868.0]
  - - [2304, 1536, 1, 64, 2304, 2304, 2304, 1536]
    - [9, 20797.9]
  - - [2368, 1536, 1, 64, 2368, 2368, 2368, 1536]
    - [9, 21543.9]
  - - [2432, 1536, 1, 64, 2432, 2432, 2432, 1536]
    - [9, 21933.3]
  - - [2496, 1536, 1, 64, 2496, 2496, 2496, 1536]
    - [9, 22251.2]
  - - [2560, 1536, 1, 64, 2560, 2560, 2560, 1536]
    - [9, 21655.3]
  - - [2624, 1536, 1, 64, 2624, 2624, 2624, 1536]
    - [9, 22599.2]
  - - [2688, 1536, 1, 64, 2688, 2688, 2688, 1536]
    - [9, 22642.5]
  - - [2752, 1536, 1, 64, 2752, 2752, 2752, 1536]
    - [9, 23106.4]
  - - [2816, 1536, 1, 64, 2816, 2816, 2816, 1536]
    - [9, 22995.6]
  - - [2880, 1536, 1, 64, 2880, 2880, 2880, 1536]
    - [9, 23494.8]
  - - [2944, 1536, 1, 64, 2944, 2944, 2944, 1536]
    - [9, 23665.2]
  - - [3008, 1536, 1, 64, 3008, 3008, 3008, 1536]
    - [9, 23775.4]
  - - [3072, 1536, 1, 64, 3072, 3072, 3072, 1536]
    - [9, 22125.1]
  - - [3136, 1536, 1, 64, 3136, 3136, 3136, 1536]
    - [9, 24276.0]
  - - [3200, 1536, 1, 64, 3200, 3200, 3200, 1536]
    - [9, 24390.8]
  - - [3264, 1536, 1, 64, 3264, 3264, 3264, 1536]
    - [11, 24407.4]
  - - [3328, 1536, 1, 64, 3328, 3328, 3328, 1536]
    - [11, 24300.1]
  - - [3392, 1536, 1, 64, 3392, 3392, 3392, 1536]
    - [9, 25222.6]
  - - [3456, 1536, 1, 64, 3456, 3456, 3456, 1536]
    - [9, 24923.7]
  - - [3520, 1536, 1, 64, 3520, 3520, 3520, 1536]
    - [11, 24532.2]
  - - [3584, 1536, 1, 64, 3584, 3584, 3584, 1536]
    - [11, 24418.9]
  - - [3648, 1536, 1, 64, 3648, 3648, 3648, 1536]
    - [0, 25712.2]
  - - [3712, 1536, 1, 64, 3712, 3712, 3712, 1536]
    - [9, 25804.5]
  - - [3776, 1536, 1, 64, 3776, 3776, 3776, 1536]
    - [9, 24950.7]
  - - [3840, 1536, 1, 64, 3840, 3840, 3840, 1536]
    - [9, 25839.1]
  - - [3904, 1536, 1, 64, 3904, 3904, 3904, 1536]
    - [9, 27024.5]
  - - [3968, 1536, 1, 64, 3968, 3968, 3968, 1536]
    - [11, 26531.6]
  - - [4032, 1536, 1, 64, 4032, 4032, 4032, 1536]
    - [9, 27736.8]
  - - [4096, 1536, 1, 64, 4096, 4096, 4096, 1536]
    - [9, 24767.6]
  - - [64, 1600, 1, 64, 64, 64, 64, 1600]
    - [18, 1464.15]
  - - [128, 1600, 1, 64, 128, 128, 128, 1600]
    - [16, 2714.24]
  - - [192, 1600, 1, 64, 192, 192, 192, 1600]
    - [6, 3854.27]
  - - [256, 1600, 1, 64, 256, 256, 256, 1600]
    - [0, 4946.07]
  - - [320, 1600, 1, 64, 320, 320, 320, 1600]
    - [4, 5889.24]
  - - [384, 1600, 1, 64, 384, 384, 384, 1600]
    - [7, 6718.14]
  - - [448, 1600, 1, 64, 448, 448, 448, 1600]
    - [0, 7774.11]
  - - [512, 1600, 1, 64, 512, 512, 512, 1600]
    - [3, 8400.6]
  - - [576, 1600, 1, 64, 576, 576, 576, 1600]
    - [11, 9444.63]
  - - [640, 1600, 1, 64, 640, 640, 640, 1600]
    - [0, 10414.0]
  - - [704, 1600, 1, 64, 704, 704, 704, 1600]
    - [0, 11495.6]
  - - [768, 1600, 1, 64, 768, 768, 768, 1600]
    - [0, 11685.4]
  - - [832, 1600, 1, 64, 832, 832, 832, 1600]
    - [0, 13161.7]
  - - [896, 1600, 1, 64, 896, 896, 896, 1600]
    - [0, 13343.5]
  - - [960, 1600, 1, 64, 960, 960, 960, 1600]
    - [0, 14240.6]
  - - [1024, 1600, 1, 64, 1024, 1024, 1024, 1600]
    - [9, 13679.9]
  - - [1088, 1600, 1, 64, 1088, 1088, 1088, 1600]
    - [9, 14538.7]
  - - [1152, 1600, 1, 64, 1152, 1152, 1152, 1600]
    - [9, 14915.1]
  - - [1216, 1600, 1, 64, 1216, 1216, 1216, 1600]
    - [0, 15506.5]
  - - [1280, 1600, 1, 64, 1280, 1280, 1280, 1600]
    - [9, 15964.8]
  - - [1344, 1600, 1, 64, 1344, 1344, 1344, 1600]
    - [9, 16430.8]
  - - [1408, 1600, 1, 64, 1408, 1408, 1408, 1600]
    - [9, 16731.9]
  - - [1472, 1600, 1, 64, 1472, 1472, 1472, 1600]
    - [9, 17103.3]
  - - [1536, 1600, 1, 64, 1536, 1536, 1536, 1600]
    - [9, 16146.8]
  - - [1600, 1600, 1, 64, 1600, 1600, 1600, 1600]
    - [9, 17909.8]
  - - [1664, 1600, 1, 64, 1664, 1664, 1664, 1600]
    - [9, 18288.3]
  - - [1728, 1600, 1, 64, 1728, 1728, 1728, 1600]
    - [9, 18619.9]
  - - [1792, 1600, 1, 64, 1792, 1792, 1792, 1600]
    - [9, 18984.0]
  - - [1856, 1600, 1, 64, 1856, 1856, 1856, 1600]
    - [0, 19324.1]
  - - [1920, 1600, 1, 64, 1920, 1920, 1920, 1600]
    - [9, 19605.8]
  - - [1984, 1600, 1, 64, 1984, 1984, 1984, 1600]
    - [9, 20098.9]
  - - [2048, 1600, 1, 64, 2048, 2048, 2048, 1600]
    - [11, 18830.4]
  - - [2112, 1600, 1, 64, 2112, 2112, 2112, 1600]
    - [9, 20861.1]
  - - [2176, 1600, 1, 64, 2176, 2176, 2176, 1600]
    - [9, 20981.2]
  - - [2240, 1600, 1, 64, 2240, 2240, 2240, 1600]
    - [9, 21154.1]
  - - [2304, 1600, 1, 64, 2304, 2304, 2304, 1600]
    - [9, 21180.2]
  - - [2368, 1600, 1, 64, 2368, 2368, 2368, 1600]
    - [9, 21936.0]
  - - [2432, 1600, 1, 64, 2432, 2432, 2432, 1600]
    - [9, 22148.3]
  - - [2496, 1600, 1, 64, 2496, 2496, 2496, 1600]
    - [9, 22638.5]
  - - [2560, 1600, 1, 64, 2560, 2560, 2560, 1600]
    - [9, 22062.1]
  - - [2624, 1600, 1, 64, 2624, 2624, 2624, 1600]
    - [9, 23004.6]
  - - [2688, 1600, 1, 64, 2688, 2688, 2688, 1600]
    - [9, 23124.4]
  - - [2752, 1600, 1, 64, 2752, 2752, 2752, 1600]
    - [9, 23454.3]
  - - [2816, 1600, 1, 64, 2816, 2816, 2816, 1600]
    - [9, 23568.2]
  - - [2880, 1600, 1, 64, 2880, 2880, 2880, 1600]
    - [9, 23860.0]
  - - [2944, 1600, 1, 64, 2944, 2944, 2944, 1600]
    - [9, 24078.7]
  - - [3008, 1600, 1, 64, 3008, 3008, 3008, 1600]
    - [9, 24245.5]
  - - [3072, 1600, 1, 64, 3072, 3072, 3072, 1600]
    - [11, 22501.4]
  - - [3136, 1600, 1, 64, 3136, 3136, 3136, 1600]
    - [9, 24755.1]
  - - [3200, 1600, 1, 64, 3200, 3200, 3200, 1600]
    - [11, 24359.0]
  - - [3264, 1600, 1, 64, 3264, 3264, 3264, 1600]
    - [9, 25024.7]
  - - [3328, 1600, 1, 64, 3328, 3328, 3328, 1600]
    - [9, 24943.8]
  - - [3392, 1600, 1, 64, 3392, 3392, 3392, 1600]
    - [9, 25816.7]
  - - [3456, 1600, 1, 64, 3456, 3456, 3456, 1600]
    - [11, 24913.1]
  - - [3520, 1600, 1, 64, 3520, 3520, 3520, 1600]
    - [11, 25869.9]
  - - [3584, 1600, 1, 64, 3584, 3584, 3584, 1600]
    - [9, 24947.1]
  - - [3648, 1600, 1, 64, 3648, 3648, 3648, 1600]
    - [0, 26241.7]
  - - [3712, 1600, 1, 64, 3712, 3712, 3712, 1600]
    - [0, 26410.8]
  - - [3776, 1600, 1, 64, 3776, 3776, 3776, 1600]
    - [9, 25958.9]
  - - [3840, 1600, 1, 64, 3840, 3840, 3840, 1600]
    - [9, 27291.2]
  - - [3904, 1600, 1, 64, 3904, 3904, 3904, 1600]
    - [9, 27414.9]
  - - [3968, 1600, 1, 64, 3968, 3968, 3968, 1600]
    - [9, 27322.9]
  - - [4032, 1600, 1, 64, 4032, 4032, 4032, 1600]
    - [9, 27737.5]
  - - [4096, 1600, 1, 64, 4096, 4096, 4096, 1600]
    - [9, 24571.0]
  - - [64, 1664, 1, 64, 64, 64, 64, 1664]
    - [16, 1438.51]
  - - [128, 1664, 1, 64, 128, 128, 128, 1664]
    - [19, 2771.16]
  - - [192, 1664, 1, 64, 192, 192, 192, 1664]
    - [4, 3979.57]
  - - [256, 1664, 1, 64, 256, 256, 256, 1664]
    - [7, 5100.63]
  - - [320, 1664, 1, 64, 320, 320, 320, 1664]
    - [7, 6102.92]
  - - [384, 1664, 1, 64, 384, 384, 384, 1664]
    - [3, 6995.2]
  - - [448, 1664, 1, 64, 448, 448, 448, 1664]
    - [9, 8075.42]
  - - [512, 1664, 1, 64, 512, 512, 512, 1664]
    - [4, 8827.22]
  - - [576, 1664, 1, 64, 576, 576, 576, 1664]
    - [0, 10147.4]
  - - [640, 1664, 1, 64, 640, 640, 640, 1664]
    - [0, 10970.0]
  - - [704, 1664, 1, 64, 704, 704, 704, 1664]
    - [0, 11808.5]
  - - [768, 1664, 1, 64, 768, 768, 768, 1664]
    - [0, 12131.2]
  - - [832, 1664, 1, 64, 832, 832, 832, 1664]
    - [0, 13016.5]
  - - [896, 1664, 1, 64, 896, 896, 896, 1664]
    - [0, 13741.2]
  - - [960, 1664, 1, 64, 960, 960, 960, 1664]
    - [9, 13866.1]
  - - [1024, 1664, 1, 64, 1024, 1024, 1024, 1664]
    - [9, 13952.3]
  - - [1088, 1664, 1, 64, 1088, 1088, 1088, 1664]
    - [11, 14812.9]
  - - [1152, 1664, 1, 64, 1152, 1152, 1152, 1664]
    - [0, 15189.1]
  - - [1216, 1664, 1, 64, 1216, 1216, 1216, 1664]
    - [11, 15782.8]
  - - [1280, 1664, 1, 64, 1280, 1280, 1280, 1664]
    - [9, 16344.5]
  - - [1344, 1664, 1, 64, 1344, 1344, 1344, 1664]
    - [9, 16750.1]
  - - [1408, 1664, 1, 64, 1408, 1408, 1408, 1664]
    - [9, 17010.1]
  - - [1472, 1664, 1, 64, 1472, 1472, 1472, 1664]
    - [9, 17579.9]
  - - [1536, 1664, 1, 64, 1536, 1536, 1536, 1664]
    - [0, 16616.8]
  - - [1600, 1664, 1, 64, 1600, 1600, 1600, 1664]
    - [9, 18184.8]
  - - [1664, 1664, 1, 64, 1664, 1664, 1664, 1664]
    - [9, 18610.5]
  - - [1728, 1664, 1, 64, 1728, 1728, 1728, 1664]
    - [9, 18993.0]
  - - [1792, 1664, 1, 64, 1792, 1792, 1792, 1664]
    - [9, 19378.4]
  - - [1856, 1664, 1, 64, 1856, 1856, 1856, 1664]
    - [9, 19876.8]
  - - [1920, 1664, 1, 64, 1920, 1920, 1920, 1664]
    - [9, 20055.9]
  - - [1984, 1664, 1, 64, 1984, 1984, 1984, 1664]
    - [9, 20623.4]
  - - [2048, 1664, 1, 64, 2048, 2048, 2048, 1664]
    - [9, 19094.9]
  - - [2112, 1664, 1, 64, 2112, 2112, 2112, 1664]
    - [9, 21194.7]
  - - [2176, 1664, 1, 64, 2176, 2176, 2176, 1664]
    - [9, 21379.6]
  - - [2240, 1664, 1, 64, 2240, 2240, 2240, 1664]
    - [9, 21490.9]
  - - [2304, 1664, 1, 64, 2304, 2304, 2304, 1664]
    - [9, 21566.7]
  - - [2368, 1664, 1, 64, 2368, 2368, 2368, 1664]
    - [9, 22263.7]
  - - [2432, 1664, 1, 64, 2432, 2432, 2432, 1664]
    - [9, 22396.8]
  - - [2496, 1664, 1, 64, 2496, 2496, 2496, 1664]
    - [9, 23024.0]
  - - [2560, 1664, 1, 64, 2560, 2560, 2560, 1664]
    - [9, 22324.4]
  - - [2624, 1664, 1, 64, 2624, 2624, 2624, 1664]
    - [9, 23321.9]
  - - [2688, 1664, 1, 64, 2688, 2688, 2688, 1664]
    - [9, 23539.0]
  - - [2752, 1664, 1, 64, 2752, 2752, 2752, 1664]
    - [9, 23872.0]
  - - [2816, 1664, 1, 64, 2816, 2816, 2816, 1664]
    - [9, 23903.1]
  - - [2880, 1664, 1, 64, 2880, 2880, 2880, 1664]
    - [9, 24351.3]
  - - [2944, 1664, 1, 64, 2944, 2944, 2944, 1664]
    - [9, 24530.3]
  - - [3008, 1664, 1, 64, 3008, 3008, 3008, 1664]
    - [9, 24675.4]
  - - [3072, 1664, 1, 64, 3072, 3072, 3072, 1664]
    - [9, 22849.0]
  - - [3136, 1664, 1, 64, 3136, 3136, 3136, 1664]
    - [9, 24960.3]
  - - [3200, 1664, 1, 64, 3200, 3200, 3200, 1664]
    - [9, 25179.8]
  - - [3264, 1664, 1, 64, 3264, 3264, 3264, 1664]
    - [9, 25327.9]
  - - [3328, 1664, 1, 64, 3328, 3328, 3328, 1664]
    - [9, 25283.0]
  - - [3392, 1664, 1, 64, 3392, 3392, 3392, 1664]
    - [9, 25326.3]
  - - [3456, 1664, 1, 64, 3456, 3456, 3456, 1664]
    - [9, 25187.9]
  - - [3520, 1664, 1, 64, 3520, 3520, 3520, 1664]
    - [9, 26989.8]
  - - [3584, 1664, 1, 64, 3584, 3584, 3584, 1664]
    - [0, 24723.2]
  - - [3648, 1664, 1, 64, 3648, 3648, 3648, 1664]
    - [0, 26896.5]
  - - [3712, 1664, 1, 64, 3712, 3712, 3712, 1664]
    - [9, 27223.2]
  - - [3776, 1664, 1, 64, 3776, 3776, 3776, 1664]
    - [9, 26534.1]
  - - [3840, 1664, 1, 64, 3840, 3840, 3840, 1664]
    - [11, 26875.6]
  - - [3904, 1664, 1, 64, 3904, 3904, 3904, 1664]
    - [0, 27191.4]
  - - [3968, 1664, 1, 64, 3968, 3968, 3968, 1664]
    - [9, 28113.4]
  - - [4032, 1664, 1, 64, 4032, 4032, 4032, 1664]
    - [9, 28568.6]
  - - [4096, 1664, 1, 64, 4096, 4096, 4096, 1664]
    - [11, 24098.3]
  - - [64, 1728, 1, 64, 64, 64, 64, 1728]
    - [16, 1756.71]
  - - [128, 1728, 1, 64, 128, 128, 128, 1728]
    - [6, 3352.03]
  - - [192, 1728, 1, 64, 192, 192, 192, 1728]
    - [7, 4760.8]
  - - [256, 1728, 1, 64, 256, 256, 256, 1728]
    - [7, 5873.67]
  - - [320, 1728, 1, 64, 320, 320, 320, 1728]
    - [3, 6868.97]
  - - [384, 1728, 1, 64, 384, 384, 384, 1728]
    - [3, 7782.03]
  - - [448, 1728, 1, 64, 448, 448, 448, 1728]
    - [1, 8684.37]
  - - [512, 1728, 1, 64, 512, 512, 512, 1728]
    - [1, 9516.33]
  - - [576, 1728, 1, 64, 576, 576, 576, 1728]
    - [0, 10553.4]
  - - [640, 1728, 1, 64, 640, 640, 640, 1728]
    - [0, 11620.1]
  - - [704, 1728, 1, 64, 704, 704, 704, 1728]
    - [0, 12208.9]
  - - [768, 1728, 1, 64, 768, 768, 768, 1728]
    - [0, 12880.5]
  - - [832, 1728, 1, 64, 832, 832, 832, 1728]
    - [0, 13647.5]
  - - [896, 1728, 1, 64, 896, 896, 896, 1728]
    - [0, 14446.6]
  - - [960, 1728, 1, 64, 960, 960, 960, 1728]
    - [9, 14444.6]
  - - [1024, 1728, 1, 64, 1024, 1024, 1024, 1728]
    - [0, 14345.6]
  - - [1088, 1728, 1, 64, 1088, 1088, 1088, 1728]
    - [0, 15404.2]
  - - [1152, 1728, 1, 64, 1152, 1152, 1152, 1728]
    - [0, 15626.1]
  - - [1216, 1728, 1, 64, 1216, 1216, 1216, 1728]
    - [9, 16235.4]
  - - [1280, 1728, 1, 64, 1280, 1280, 1280, 1728]
    - [9, 16599.0]
  - - [1344, 1728, 1, 64, 1344, 1344, 1344, 1728]
    - [9, 17059.0]
  - - [1408, 1728, 1, 64, 1408, 1408, 1408, 1728]
    - [9, 17442.8]
  - - [1472, 1728, 1, 64, 1472, 1472, 1472, 1728]
    - [9, 17938.3]
  - - [1536, 1728, 1, 64, 1536, 1536, 1536, 1728]
    - [0, 16990.1]
  - - [1600, 1728, 1, 64, 1600, 1600, 1600, 1728]
    - [9, 18598.4]
  - - [1664, 1728, 1, 64, 1664, 1664, 1664, 1728]
    - [9, 19141.2]
  - - [1728, 1728, 1, 64, 1728, 1728, 1728, 1728]
    - [9, 19542.0]
  - - [1792, 1728, 1, 64, 1792, 1792, 1792, 1728]
    - [9, 19857.6]
  - - [1856, 1728, 1, 64, 1856, 1856, 1856, 1728]
    - [9, 20350.6]
  - - [1920, 1728, 1, 64, 1920, 1920, 1920, 1728]
    - [9, 20545.1]
  - - [1984, 1728, 1, 64, 1984, 1984, 1984, 1728]
    - [9, 21038.6]
  - - [2048, 1728, 1, 64, 2048, 2048, 2048, 1728]
    - [11, 19303.6]
  - - [2112, 1728, 1, 64, 2112, 2112, 2112, 1728]
    - [9, 21526.9]
  - - [2176, 1728, 1, 64, 2176, 2176, 2176, 1728]
    - [9, 21775.9]
  - - [2240, 1728, 1, 64, 2240, 2240, 2240, 1728]
    - [9, 21802.7]
  - - [2304, 1728, 1, 64, 2304, 2304, 2304, 1728]
    - [9, 21924.0]
  - - [2368, 1728, 1, 64, 2368, 2368, 2368, 1728]
    - [9, 22657.8]
  - - [2432, 1728, 1, 64, 2432, 2432, 2432, 1728]
    - [9, 22874.3]
  - - [2496, 1728, 1, 64, 2496, 2496, 2496, 1728]
    - [9, 23252.8]
  - - [2560, 1728, 1, 64, 2560, 2560, 2560, 1728]
    - [9, 22641.7]
  - - [2624, 1728, 1, 64, 2624, 2624, 2624, 1728]
    - [9, 23760.8]
  - - [2688, 1728, 1, 64, 2688, 2688, 2688, 1728]
    - [9, 23936.6]
  - - [2752, 1728, 1, 64, 2752, 2752, 2752, 1728]
    - [9, 24343.7]
  - - [2816, 1728, 1, 64, 2816, 2816, 2816, 1728]
    - [9, 24309.2]
  - - [2880, 1728, 1, 64, 2880, 2880, 2880, 1728]
    - [11, 24413.7]
  - - [2944, 1728, 1, 64, 2944, 2944, 2944, 1728]
    - [9, 24740.0]
  - - [3008, 1728, 1, 64, 3008, 3008, 3008, 1728]
    - [9, 25010.0]
  - - [3072, 1728, 1, 64, 3072, 3072, 3072, 1728]
    - [11, 23266.3]
  - - [3136, 1728, 1, 64, 3136, 3136, 3136, 1728]
    - [9, 25091.3]
  - - [3200, 1728, 1, 64, 3200, 3200, 3200, 1728]
    - [11, 24742.3]
  - - [3264, 1728, 1, 64, 3264, 3264, 3264, 1728]
    - [0, 25375.6]
  - - [3328, 1728, 1, 64, 3328, 3328, 3328, 1728]
    - [11, 24603.7]
  - - [3392, 1728, 1, 64, 3392, 3392, 3392, 1728]
    - [9, 26505.0]
  - - [3456, 1728, 1, 64, 3456, 3456, 3456, 1728]
    - [11, 26117.3]
  - - [3520, 1728, 1, 64, 3520, 3520, 3520, 1728]
    - [0, 26510.4]
  - - [3584, 1728, 1, 64, 3584, 3584, 3584, 1728]
    - [0, 26148.3]
  - - [3648, 1728, 1, 64, 3648, 3648, 3648, 1728]
    - [9, 26470.3]
  - - [3712, 1728, 1, 64, 3712, 3712, 3712, 1728]
    - [9, 27618.0]
  - - [3776, 1728, 1, 64, 3776, 3776, 3776, 1728]
    - [0, 25769.5]
  - - [3840, 1728, 1, 64, 3840, 3840, 3840, 1728]
    - [9, 27533.0]
  - - [3904, 1728, 1, 64, 3904, 3904, 3904, 1728]
    - [11, 27905.1]
  - - [3968, 1728, 1, 64, 3968, 3968, 3968, 1728]
    - [9, 27757.9]
  - - [4032, 1728, 1, 64, 4032, 4032, 4032, 1728]
    - [9, 28814.4]
  - - [4096, 1728, 1, 64, 4096, 4096, 4096, 1728]
    - [9, 24267.7]
  - - [64, 1792, 1, 64, 64, 64, 64, 1792]
    - [5, 1829.04]
  - - [128, 1792, 1, 64, 128, 128, 128, 1792]
    - [16, 3466.33]
  - - [192, 1792, 1, 64, 192, 192, 192, 1792]
    - [4, 4907.45]
  - - [256, 1792, 1, 64, 256, 256, 256, 1792]
    - [4, 5942.08]
  - - [320, 1792, 1, 64, 320, 320, 320, 1792]
    - [3, 7064.41]
  - - [384, 1792, 1, 64, 384, 384, 384, 1792]
    - [1, 7999.93]
  - - [448, 1792, 1, 64, 448, 448, 448, 1792]
    - [3, 8775.29]
  - - [512, 1792, 1, 64, 512, 512, 512, 1792]
    - [0, 9688.09]
  - - [576, 1792, 1, 64, 576, 576, 576, 1792]
    - [0, 10911.7]
  - - [640, 1792, 1, 64, 640, 640, 640, 1792]
    - [0, 11869.2]
  - - [704, 1792, 1, 64, 704, 704, 704, 1792]
    - [0, 12704.9]
  - - [768, 1792, 1, 64, 768, 768, 768, 1792]
    - [0, 13215.3]
  - - [832, 1792, 1, 64, 832, 832, 832, 1792]
    - [0, 14111.1]
  - - [896, 1792, 1, 64, 896, 896, 896, 1792]
    - [9, 14065.0]
  - - [960, 1792, 1, 64, 960, 960, 960, 1792]
    - [9, 14756.7]
  - - [1024, 1792, 1, 64, 1024, 1024, 1024, 1792]
    - [9, 14632.3]
  - - [1088, 1792, 1, 64, 1088, 1088, 1088, 1792]
    - [0, 15723.1]
  - - [1152, 1792, 1, 64, 1152, 1152, 1152, 1792]
    - [9, 16078.7]
  - - [1216, 1792, 1, 64, 1216, 1216, 1216, 1792]
    - [9, 16679.7]
  - - [1280, 1792, 1, 64, 1280, 1280, 1280, 1792]
    - [9, 17022.1]
  - - [1344, 1792, 1, 64, 1344, 1344, 1344, 1792]
    - [9, 17601.8]
  - - [1408, 1792, 1, 64, 1408, 1408, 1408, 1792]
    - [9, 17986.0]
  - - [1472, 1792, 1, 64, 1472, 1472, 1472, 1792]
    - [9, 18415.9]
  - - [1536, 1792, 1, 64, 1536, 1536, 1536, 1792]
    - [0, 17470.8]
  - - [1600, 1792, 1, 64, 1600, 1600, 1600, 1792]
    - [9, 19158.3]
  - - [1664, 1792, 1, 64, 1664, 1664, 1664, 1792]
    - [9, 19569.2]
  - - [1728, 1792, 1, 64, 1728, 1728, 1728, 1792]
    - [0, 20076.8]
  - - [1792, 1792, 1, 64, 1792, 1792, 1792, 1792]
    - [9, 20260.0]
  - - [1856, 1792, 1, 64, 1856, 1856, 1856, 1792]
    - [9, 20793.0]
  - - [1920, 1792, 1, 64, 1920, 1920, 1920, 1792]
    - [9, 20915.4]
  - - [1984, 1792, 1, 64, 1984, 1984, 1984, 1792]
    - [9, 21219.6]
  - - [2048, 1792, 1, 64, 2048, 2048, 2048, 1792]
    - [11, 19655.2]
  - - [2112, 1792, 1, 64, 2112, 2112, 2112, 1792]
    - [9, 21839.2]
  - - [2176, 1792, 1, 64, 2176, 2176, 2176, 1792]
    - [9, 22063.3]
  - - [2240, 1792, 1, 64, 2240, 2240, 2240, 1792]
    - [9, 22146.4]
  - - [2304, 1792, 1, 64, 2304, 2304, 2304, 1792]
    - [9, 22102.8]
  - - [2368, 1792, 1, 64, 2368, 2368, 2368, 1792]
    - [9, 22770.0]
  - - [2432, 1792, 1, 64, 2432, 2432, 2432, 1792]
    - [9, 23051.0]
  - - [2496, 1792, 1, 64, 2496, 2496, 2496, 1792]
    - [9, 23577.8]
  - - [2560, 1792, 1, 64, 2560, 2560, 2560, 1792]
    - [9, 22967.9]
  - - [2624, 1792, 1, 64, 2624, 2624, 2624, 1792]
    - [9, 23933.3]
  - - [2688, 1792, 1, 64, 2688, 2688, 2688, 1792]
    - [9, 24201.5]
  - - [2752, 1792, 1, 64, 2752, 2752, 2752, 1792]
    - [9, 24544.5]
  - - [2816, 1792, 1, 64, 2816, 2816, 2816, 1792]
    - [9, 24363.2]
  - - [2880, 1792, 1, 64, 2880, 2880, 2880, 1792]
    - [9, 24875.6]
  - - [2944, 1792, 1, 64, 2944, 2944, 2944, 1792]
    - [9, 24995.4]
  - - [3008, 1792, 1, 64, 3008, 3008, 3008, 1792]
    - [11, 24669.5]
  - - [3072, 1792, 1, 64, 3072, 3072, 3072, 1792]
    - [11, 23361.7]
  - - [3136, 1792, 1, 64, 3136, 3136, 3136, 1792]
    - [9, 25115.7]
  - - [3200, 1792, 1, 64, 3200, 3200, 3200, 1792]
    - [9, 25396.0]
  - - [3264, 1792, 1, 64, 3264, 3264, 3264, 1792]
    - [11, 26186.6]
  - - [3328, 1792, 1, 64, 3328, 3328, 3328, 1792]
    - [9, 25497.8]
  - - [3392, 1792, 1, 64, 3392, 3392, 3392, 1792]
    - [9, 26244.2]
  - - [3456, 1792, 1, 64, 3456, 3456, 3456, 1792]
    - [9, 27064.2]
  - - [3520, 1792, 1, 64, 3520, 3520, 3520, 1792]
    - [0, 26976.1]
  - - [3584, 1792, 1, 64, 3584, 3584, 3584, 1792]
    - [9, 25957.6]
  - - [3648, 1792, 1, 64, 3648, 3648, 3648, 1792]
    - [9, 27841.6]
  - - [3712, 1792, 1, 64, 3712, 3712, 3712, 1792]
    - [9, 27819.3]
  - - [3776, 1792, 1, 64, 3776, 3776, 3776, 1792]
    - [9, 26854.6]
  - - [3840, 1792, 1, 64, 3840, 3840, 3840, 1792]
    - [9, 28185.5]
  - - [3904, 1792, 1, 64, 3904, 3904, 3904, 1792]
    - [9, 28353.9]
  - - [3968, 1792, 1, 64, 3968, 3968, 3968, 1792]
    - [9, 28075.5]
  - - [4032, 1792, 1, 64, 4032, 4032, 4032, 1792]
    - [9, 28593.6]
  - - [4096, 1792, 1, 64, 4096, 4096, 4096, 1792]
    - [11, 26059.9]
  - - [64, 1856, 1, 64, 64, 64, 64, 1856]
    - [6, 1887.31]
  - - [128, 1856, 1, 64, 128, 128, 128, 1856]
    - [7, 3585.89]
  - - [192, 1856, 1, 64, 192, 192, 192, 1856]
    - [4, 4982.83]
  - - [256, 1856, 1, 64, 256, 256, 256, 1856]
    - [4, 6113.47]
  - - [320, 1856, 1, 64, 320, 320, 320, 1856]
    - [2, 7162.3]
  - - [384, 1856, 1, 64, 384, 384, 384, 1856]
    - [3, 8190.38]
  - - [448, 1856, 1, 64, 448, 448, 448, 1856]
    - [3, 9126.26]
  - - [512, 1856, 1, 64, 512, 512, 512, 1856]
    - [0, 10049.0]
  - - [576, 1856, 1, 64, 576, 576, 576, 1856]
    - [0, 11386.0]
  - - [640, 1856, 1, 64, 640, 640, 640, 1856]
    - [0, 12024.8]
  - - [704, 1856, 1, 64, 704, 704, 704, 1856]
    - [0, 13171.1]
  - - [768, 1856, 1, 64, 768, 768, 768, 1856]
    - [0, 13114.6]
  - - [832, 1856, 1, 64, 832, 832, 832, 1856]
    - [0, 14533.4]
  - - [896, 1856, 1, 64, 896, 896, 896, 1856]
    - [9, 14431.1]
  - - [960, 1856, 1, 64, 960, 960, 960, 1856]
    - [9, 14913.8]
  - - [1024, 1856, 1, 64, 1024, 1024, 1024, 1856]
    - [0, 14931.7]
  - - [1088, 1856, 1, 64, 1088, 1088, 1088, 1856]
    - [0, 15939.2]
  - - [1152, 1856, 1, 64, 1152, 1152, 1152, 1856]
    - [9, 16470.6]
  - - [1216, 1856, 1, 64, 1216, 1216, 1216, 1856]
    - [9, 16965.0]
  - - [1280, 1856, 1, 64, 1280, 1280, 1280, 1856]
    - [9, 17303.0]
  - - [1344, 1856, 1, 64, 1344, 1344, 1344, 1856]
    - [9, 18024.6]
  - - [1408, 1856, 1, 64, 1408, 1408, 1408, 1856]
    - [9, 18294.3]
  - - [1472, 1856, 1, 64, 1472, 1472, 1472, 1856]
    - [9, 18750.4]
  - - [1536, 1856, 1, 64, 1536, 1536, 1536, 1856]
    - [0, 17831.3]
  - - [1600, 1856, 1, 64, 1600, 1600, 1600, 1856]
    - [9, 19615.2]
  - - [1664, 1856, 1, 64, 1664, 1664, 1664, 1856]
    - [9, 20150.3]
  - - [1728, 1856, 1, 64, 1728, 1728, 1728, 1856]
    - [9, 20509.2]
  - - [1792, 1856, 1, 64, 1792, 1792, 1792, 1856]
    - [9, 20552.1]
  - - [1856, 1856, 1, 64, 1856, 1856, 1856, 1856]
    - [9, 20958.2]
  - - [1920, 1856, 1, 64, 1920, 1920, 1920, 1856]
    - [9, 21105.1]
  - - [1984, 1856, 1, 64, 1984, 1984, 1984, 1856]
    - [9, 21527.8]
  - - [2048, 1856, 1, 64, 2048, 2048, 2048, 1856]
    - [9, 19952.9]
  - - [2112, 1856, 1, 64, 2112, 2112, 2112, 1856]
    - [9, 21774.9]
  - - [2176, 1856, 1, 64, 2176, 2176, 2176, 1856]
    - [9, 22169.2]
  - - [2240, 1856, 1, 64, 2240, 2240, 2240, 1856]
    - [9, 22314.1]
  - - [2304, 1856, 1, 64, 2304, 2304, 2304, 1856]
    - [9, 22072.4]
  - - [2368, 1856, 1, 64, 2368, 2368, 2368, 1856]
    - [9, 22950.2]
  - - [2432, 1856, 1, 64, 2432, 2432, 2432, 1856]
    - [9, 23266.8]
  - - [2496, 1856, 1, 64, 2496, 2496, 2496, 1856]
    - [9, 23762.3]
  - - [2560, 1856, 1, 64, 2560, 2560, 2560, 1856]
    - [9, 23150.6]
  - - [2624, 1856, 1, 64, 2624, 2624, 2624, 1856]
    - [9, 24358.0]
  - - [2688, 1856, 1, 64, 2688, 2688, 2688, 1856]
    - [9, 24451.5]
  - - [2752, 1856, 1, 64, 2752, 2752, 2752, 1856]
    - [9, 24768.0]
  - - [2816, 1856, 1, 64, 2816, 2816, 2816, 1856]
    - [9, 24569.8]
  - - [2880, 1856, 1, 64, 2880, 2880, 2880, 1856]
    - [9, 25165.1]
  - - [2944, 1856, 1, 64, 2944, 2944, 2944, 1856]
    - [9, 25257.9]
  - - [3008, 1856, 1, 64, 3008, 3008, 3008, 1856]
    - [9, 25354.7]
  - - [3072, 1856, 1, 64, 3072, 3072, 3072, 1856]
    - [11, 23786.0]
  - - [3136, 1856, 1, 64, 3136, 3136, 3136, 1856]
    - [9, 25285.2]
  - - [3200, 1856, 1, 64, 3200, 3200, 3200, 1856]
    - [9, 26690.7]
  - - [3264, 1856, 1, 64, 3264, 3264, 3264, 1856]
    - [9, 27247.7]
  - - [3328, 1856, 1, 64, 3328, 3328, 3328, 1856]
    - [9, 27154.0]
  - - [3392, 1856, 1, 64, 3392, 3392, 3392, 1856]
    - [9, 27128.4]
  - - [3456, 1856, 1, 64, 3456, 3456, 3456, 1856]
    - [9, 27536.3]
  - - [3520, 1856, 1, 64, 3520, 3520, 3520, 1856]
    - [9, 27881.8]
  - - [3584, 1856, 1, 64, 3584, 3584, 3584, 1856]
    - [9, 27294.7]
  - - [3648, 1856, 1, 64, 3648, 3648, 3648, 1856]
    - [9, 28260.6]
  - - [3712, 1856, 1, 64, 3712, 3712, 3712, 1856]
    - [9, 27792.1]
  - - [3776, 1856, 1, 64, 3776, 3776, 3776, 1856]
    - [9, 27115.9]
  - - [3840, 1856, 1, 64, 3840, 3840, 3840, 1856]
    - [9, 28495.4]
  - - [3904, 1856, 1, 64, 3904, 3904, 3904, 1856]
    - [9, 28966.6]
  - - [3968, 1856, 1, 64, 3968, 3968, 3968, 1856]
    - [9, 28525.7]
  - - [4032, 1856, 1, 64, 4032, 4032, 4032, 1856]
    - [0, 28224.0]
  - - [4096, 1856, 1, 64, 4096, 4096, 4096, 1856]
    - [9, 26633.1]
  - - [64, 1920, 1, 64, 64, 64, 64, 1920]
    - [6, 1948.52]
  - - [128, 1920, 1, 64, 128, 128, 128, 1920]
    - [7, 3700.81]
  - - [192, 1920, 1, 64, 192, 192, 192, 1920]
    - [7, 5147.85]
  - - [256, 1920, 1, 64, 256, 256, 256, 1920]
    - [4, 6316.66]
  - - [320, 1920, 1, 64, 320, 320, 320, 1920]
    - [1, 7331.91]
  - - [384, 1920, 1, 64, 384, 384, 384, 1920]
    - [1, 8373.57]
  - - [448, 1920, 1, 64, 448, 448, 448, 1920]
    - [3, 9434.33]
  - - [512, 1920, 1, 64, 512, 512, 512, 1920]
    - [9, 10457.8]
  - - [576, 1920, 1, 64, 576, 576, 576, 1920]
    - [0, 11737.6]
  - - [640, 1920, 1, 64, 640, 640, 640, 1920]
    - [0, 12427.6]
  - - [704, 1920, 1, 64, 704, 704, 704, 1920]
    - [0, 13508.2]
  - - [768, 1920, 1, 64, 768, 768, 768, 1920]
    - [0, 13539.6]
  - - [832, 1920, 1, 64, 832, 832, 832, 1920]
    - [9, 13974.2]
  - - [896, 1920, 1, 64, 896, 896, 896, 1920]
    - [9, 14652.5]
  - - [960, 1920, 1, 64, 960, 960, 960, 1920]
    - [9, 15189.7]
  - - [1024, 1920, 1, 64, 1024, 1024, 1024, 1920]
    - [9, 15002.7]
  - - [1088, 1920, 1, 64, 1088, 1088, 1088, 1920]
    - [9, 16403.9]
  - - [1152, 1920, 1, 64, 1152, 1152, 1152, 1920]
    - [9, 16736.3]
  - - [1216, 1920, 1, 64, 1216, 1216, 1216, 1920]
    - [9, 17158.9]
  - - [1280, 1920, 1, 64, 1280, 1280, 1280, 1920]
    - [9, 17611.1]
  - - [1344, 1920, 1, 64, 1344, 1344, 1344, 1920]
    - [9, 18246.4]
  - - [1408, 1920, 1, 64, 1408, 1408, 1408, 1920]
    - [9, 18601.5]
  - - [1472, 1920, 1, 64, 1472, 1472, 1472, 1920]
    - [9, 19248.4]
  - - [1536, 1920, 1, 64, 1536, 1536, 1536, 1920]
    - [0, 18207.7]
  - - [1600, 1920, 1, 64, 1600, 1600, 1600, 1920]
    - [9, 20033.1]
  - - [1664, 1920, 1, 64, 1664, 1664, 1664, 1920]
    - [9, 20430.7]
  - - [1728, 1920, 1, 64, 1728, 1728, 1728, 1920]
    - [9, 20806.8]
  - - [1792, 1920, 1, 64, 1792, 1792, 1792, 1920]
    - [9, 20816.5]
  - - [1856, 1920, 1, 64, 1856, 1856, 1856, 1920]
    - [9, 21228.9]
  - - [1920, 1920, 1, 64, 1920, 1920, 1920, 1920]
    - [9, 21420.5]
  - - [1984, 1920, 1, 64, 1984, 1984, 1984, 1920]
    - [9, 21884.2]
  - - [2048, 1920, 1, 64, 2048, 2048, 2048, 1920]
    - [11, 20193.8]
  - - [2112, 1920, 1, 64, 2112, 2112, 2112, 1920]
    - [9, 22337.7]
  - - [2176, 1920, 1, 64, 2176, 2176, 2176, 1920]
    - [9, 22554.4]
  - - [2240, 1920, 1, 64, 2240, 2240, 2240, 1920]
    - [9, 22680.3]
  - - [2304, 1920, 1, 64, 2304, 2304, 2304, 1920]
    - [9, 22656.2]
  - - [2368, 1920, 1, 64, 2368, 2368, 2368, 1920]
    - [9, 23460.1]
  - - [2432, 1920, 1, 64, 2432, 2432, 2432, 1920]
    - [9, 23726.9]
  - - [2496, 1920, 1, 64, 2496, 2496, 2496, 1920]
    - [9, 24228.2]
  - - [2560, 1920, 1, 64, 2560, 2560, 2560, 1920]
    - [9, 23653.6]
  - - [2624, 1920, 1, 64, 2624, 2624, 2624, 1920]
    - [9, 24654.5]
  - - [2688, 1920, 1, 64, 2688, 2688, 2688, 1920]
    - [9, 24475.7]
  - - [2752, 1920, 1, 64, 2752, 2752, 2752, 1920]
    - [9, 25194.6]
  - - [2816, 1920, 1, 64, 2816, 2816, 2816, 1920]
    - [9, 24856.4]
  - - [2880, 1920, 1, 64, 2880, 2880, 2880, 1920]
    - [11, 25869.2]
  - - [2944, 1920, 1, 64, 2944, 2944, 2944, 1920]
    - [9, 25434.5]
  - - [3008, 1920, 1, 64, 3008, 3008, 3008, 1920]
    - [9, 25652.0]
  - - [3072, 1920, 1, 64, 3072, 3072, 3072, 1920]
    - [11, 23877.7]
  - - [3136, 1920, 1, 64, 3136, 3136, 3136, 1920]
    - [9, 27041.9]
  - - [3200, 1920, 1, 64, 3200, 3200, 3200, 1920]
    - [11, 26600.8]
  - - [3264, 1920, 1, 64, 3264, 3264, 3264, 1920]
    - [9, 27788.8]
  - - [3328, 1920, 1, 64, 3328, 3328, 3328, 1920]
    - [9, 26513.2]
  - - [3392, 1920, 1, 64, 3392, 3392, 3392, 1920]
    - [9, 27835.1]
  - - [3456, 1920, 1, 64, 3456, 3456, 3456, 1920]
    - [9, 28093.9]
  - - [3520, 1920, 1, 64, 3520, 3520, 3520, 1920]
    - [9, 28310.7]
  - - [3584, 1920, 1, 64, 3584, 3584, 3584, 1920]
    - [9, 27767.7]
  - - [3648, 1920, 1, 64, 3648, 3648, 3648, 1920]
    - [9, 28688.7]
  - - [3712, 1920, 1, 64, 3712, 3712, 3712, 1920]
    - [11, 27706.2]
  - - [3776, 1920, 1, 64, 3776, 3776, 3776, 1920]
    - [9, 26604.9]
  - - [3840, 1920, 1, 64, 3840, 3840, 3840, 1920]
    - [9, 28128.4]
  - - [3904, 1920, 1, 64, 3904, 3904, 3904, 1920]
    - [9, 28917.9]
  - - [3968, 1920, 1, 64, 3968, 3968, 3968, 1920]
    - [9, 29280.6]
  - - [4032, 1920, 1, 64, 4032, 4032, 4032, 1920]
    - [9, 28811.6]
  - - [4096, 1920, 1, 64, 4096, 4096, 4096, 1920]
    - [11, 25711.8]
  - - [64, 1984, 1, 64, 64, 64, 64, 1984]
    - [17, 1768.91]
  - - [128, 1984, 1, 64, 128, 128, 128, 1984]
    - [5, 3191.82]
  - - [192, 1984, 1, 64, 192, 192, 192, 1984]
    - [1, 4731.96]
  - - [256, 1984, 1, 64, 256, 256, 256, 1984]
    - [6, 5882.35]
  - - [320, 1984, 1, 64, 320, 320, 320, 1984]
    - [3, 7010.35]
  - - [384, 1984, 1, 64, 384, 384, 384, 1984]
    - [12, 8230.62]
  - - [448, 1984, 1, 64, 448, 448, 448, 1984]
    - [9, 9230.05]
  - - [512, 1984, 1, 64, 512, 512, 512, 1984]
    - [9, 10146.9]
  - - [576, 1984, 1, 64, 576, 576, 576, 1984]
    - [0, 11601.7]
  - - [640, 1984, 1, 64, 640, 640, 640, 1984]
    - [0, 12571.8]
  - - [704, 1984, 1, 64, 704, 704, 704, 1984]
    - [0, 13122.4]
  - - [768, 1984, 1, 64, 768, 768, 768, 1984]
    - [0, 13594.9]
  - - [832, 1984, 1, 64, 832, 832, 832, 1984]
    - [9, 14165.1]
  - - [896, 1984, 1, 64, 896, 896, 896, 1984]
    - [9, 14708.4]
  - - [960, 1984, 1, 64, 960, 960, 960, 1984]
    - [0, 15265.6]
  - - [1024, 1984, 1, 64, 1024, 1024, 1024, 1984]
    - [9, 15132.9]
  - - [1088, 1984, 1, 64, 1088, 1088, 1088, 1984]
    - [9, 16372.2]
  - - [1152, 1984, 1, 64, 1152, 1152, 1152, 1984]
    - [9, 16711.4]
  - - [1216, 1984, 1, 64, 1216, 1216, 1216, 1984]
    - [9, 17379.7]
  - - [1280, 1984, 1, 64, 1280, 1280, 1280, 1984]
    - [9, 17685.3]
  - - [1344, 1984, 1, 64, 1344, 1344, 1344, 1984]
    - [9, 18160.5]
  - - [1408, 1984, 1, 64, 1408, 1408, 1408, 1984]
    - [9, 18617.2]
  - - [1472, 1984, 1, 64, 1472, 1472, 1472, 1984]
    - [9, 19304.6]
  - - [1536, 1984, 1, 64, 1536, 1536, 1536, 1984]
    - [0, 18366.4]
  - - [1600, 1984, 1, 64, 1600, 1600, 1600, 1984]
    - [9, 19996.0]
  - - [1664, 1984, 1, 64, 1664, 1664, 1664, 1984]
    - [9, 20421.9]
  - - [1728, 1984, 1, 64, 1728, 1728, 1728, 1984]
    - [9, 20868.5]
  - - [1792, 1984, 1, 64, 1792, 1792, 1792, 1984]
    - [9, 20882.7]
  - - [1856, 1984, 1, 64, 1856, 1856, 1856, 1984]
    - [9, 21267.4]
  - - [1920, 1984, 1, 64, 1920, 1920, 1920, 1984]
    - [9, 21532.5]
  - - [1984, 1984, 1, 64, 1984, 1984, 1984, 1984]
    - [9, 21902.1]
  - - [2048, 1984, 1, 64, 2048, 2048, 2048, 1984]
    - [9, 20418.1]
  - - [2112, 1984, 1, 64, 2112, 2112, 2112, 1984]
    - [9, 22336.4]
  - - [2176, 1984, 1, 64, 2176, 2176, 2176, 1984]
    - [9, 22615.7]
  - - [2240, 1984, 1, 64, 2240, 2240, 2240, 1984]
    - [9, 22761.2]
  - - [2304, 1984, 1, 64, 2304, 2304, 2304, 1984]
    - [9, 22887.7]
  - - [2368, 1984, 1, 64, 2368, 2368, 2368, 1984]
    - [9, 23604.7]
  - - [2432, 1984, 1, 64, 2432, 2432, 2432, 1984]
    - [9, 24057.6]
  - - [2496, 1984, 1, 64, 2496, 2496, 2496, 1984]
    - [9, 24535.8]
  - - [2560, 1984, 1, 64, 2560, 2560, 2560, 1984]
    - [9, 23810.1]
  - - [2624, 1984, 1, 64, 2624, 2624, 2624, 1984]
    - [9, 24280.8]
  - - [2688, 1984, 1, 64, 2688, 2688, 2688, 1984]
    - [9, 24986.0]
  - - [2752, 1984, 1, 64, 2752, 2752, 2752, 1984]
    - [9, 25250.0]
  - - [2816, 1984, 1, 64, 2816, 2816, 2816, 1984]
    - [9, 25262.2]
  - - [2880, 1984, 1, 64, 2880, 2880, 2880, 1984]
    - [9, 26918.4]
  - - [2944, 1984, 1, 64, 2944, 2944, 2944, 1984]
    - [11, 25600.2]
  - - [3008, 1984, 1, 64, 3008, 3008, 3008, 1984]
    - [11, 26453.8]
  - - [3072, 1984, 1, 64, 3072, 3072, 3072, 1984]
    - [0, 23674.7]
  - - [3136, 1984, 1, 64, 3136, 3136, 3136, 1984]
    - [0, 26150.4]
  - - [3200, 1984, 1, 64, 3200, 3200, 3200, 1984]
    - [9, 26588.1]
  - - [3264, 1984, 1, 64, 3264, 3264, 3264, 1984]
    - [11, 27446.7]
  - - [3328, 1984, 1, 64, 3328, 3328, 3328, 1984]
    - [9, 23922.7]
  - - [3392, 1984, 1, 64, 3392, 3392, 3392, 1984]
    - [11, 24163.9]
  - - [3456, 1984, 1, 64, 3456, 3456, 3456, 1984]
    - [11, 24878.0]
  - - [3520, 1984, 1, 64, 3520, 3520, 3520, 1984]
    - [0, 24849.9]
  - - [3584, 1984, 1, 64, 3584, 3584, 3584, 1984]
    - [9, 25498.7]
  - - [3648, 1984, 1, 64, 3648, 3648, 3648, 1984]
    - [9, 26150.5]
  - - [3712, 1984, 1, 64, 3712, 3712, 3712, 1984]
    - [11, 26488.1]
  - - [3776, 1984, 1, 64, 3776, 3776, 3776, 1984]
    - [11, 26006.4]
  - - [3840, 1984, 1, 64, 3840, 3840, 3840, 1984]
    - [11, 27854.0]
  - - [3904, 1984, 1, 64, 3904, 3904, 3904, 1984]
    - [9, 27499.5]
  - - [3968, 1984, 1, 64, 3968, 3968, 3968, 1984]
    - [11, 27023.9]
  - - [4032, 1984, 1, 64, 4032, 4032, 4032, 1984]
    - [9, 28710.3]
  - - [4096, 1984, 1, 64, 4096, 4096, 4096, 1984]
    - [0, 26007.1]
  - - [64, 2048, 1, 64, 64, 64, 64, 2048]
    - [18, 519.929]
  - - [128, 2048, 1, 64, 128, 128, 128, 2048]
    - [15, 1041.47]
  - - [192, 2048, 1, 64, 192, 192, 192, 2048]
    - [20, 1563.76]
  - - [256, 2048, 1, 64, 256, 256, 256, 2048]
    - [14, 2074.57]
  - - [320, 2048, 1, 64, 320, 320, 320, 2048]
    - [6, 2590.48]
  - - [384, 2048, 1, 64, 384, 384, 384, 2048]
    - [18, 3227.81]
  - - [448, 2048, 1, 64, 448, 448, 448, 2048]
    - [16, 3739.85]
  - - [512, 2048, 1, 64, 512, 512, 512, 2048]
    - [8, 4243.03]
  - - [576, 2048, 1, 64, 576, 576, 576, 2048]
    - [7, 4806.25]
  - - [640, 2048, 1, 64, 640, 640, 640, 2048]
    - [8, 5153.58]
  - - [704, 2048, 1, 64, 704, 704, 704, 2048]
    - [12, 5736.65]
  - - [768, 2048, 1, 64, 768, 768, 768, 2048]
    - [5, 6195.73]
  - - [832, 2048, 1, 64, 832, 832, 832, 2048]
    - [13, 6649.03]
  - - [896, 2048, 1, 64, 896, 896, 896, 2048]
    - [7, 7219.92]
  - - [960, 2048, 1, 64, 960, 960, 960, 2048]
    - [20, 8079.36]
  - - [1024, 2048, 1, 64, 1024, 1024, 1024, 2048]
    - [9, 8930.51]
  - - [1088, 2048, 1, 64, 1088, 1088, 1088, 2048]
    - [9, 10718.1]
  - - [1152, 2048, 1, 64, 1152, 1152, 1152, 2048]
    - [11, 9816.24]
  - - [1216, 2048, 1, 64, 1216, 1216, 1216, 2048]
    - [0, 10168.6]
  - - [1280, 2048, 1, 64, 1280, 1280, 1280, 2048]
    - [9, 10833.7]
  - - [1344, 2048, 1, 64, 1344, 1344, 1344, 2048]
    - [0, 10921.2]
  - - [1408, 2048, 1, 64, 1408, 1408, 1408, 2048]
    - [8, 11459.0]
  - - [1472, 2048, 1, 64, 1472, 1472, 1472, 2048]
    - [2, 11878.1]
  - - [1536, 2048, 1, 64, 1536, 1536, 1536, 2048]
    - [1, 12311.1]
  - - [1600, 2048, 1, 64, 1600, 1600, 1600, 2048]
    - [3, 12925.3]
  - - [1664, 2048, 1, 64, 1664, 1664, 1664, 2048]
    - [3, 13272.2]
  - - [1728, 2048, 1, 64, 1728, 1728, 1728, 2048]
    - [4, 13779.2]
  - - [1792, 2048, 1, 64, 1792, 1792, 1792, 2048]
    - [7, 14222.1]
  - - [1856, 2048, 1, 64, 1856, 1856, 1856, 2048]
    - [0, 14666.9]
  - - [1920, 2048, 1, 64, 1920, 1920, 1920, 2048]
    - [0, 15274.0]
  - - [1984, 2048, 1, 64, 1984, 1984, 1984, 2048]
    - [9, 15899.9]
  - - [2048, 2048, 1, 64, 2048, 2048, 2048, 2048]
    - [0, 15882.7]
  - - [2112, 2048, 1, 64, 2112, 2112, 2112, 2048]
    - [9, 16715.2]
  - - [2176, 2048, 1, 64, 2176, 2176, 2176, 2048]
    - [0, 17136.9]
  - - [2240, 2048, 1, 64, 2240, 2240, 2240, 2048]
    - [0, 17453.2]
  - - [2304, 2048, 1, 64, 2304, 2304, 2304, 2048]
    - [9, 17746.1]
  - - [2368, 2048, 1, 64, 2368, 2368, 2368, 2048]
    - [11, 19385.1]
  - - [2432, 2048, 1, 64, 2432, 2432, 2432, 2048]
    - [4, 21134.0]
  - - [2496, 2048, 1, 64, 2496, 2496, 2496, 2048]
    - [0, 20499.6]
  - - [2560, 2048, 1, 64, 2560, 2560, 2560, 2048]
    - [9, 20045.5]
  - - [2624, 2048, 1, 64, 2624, 2624, 2624, 2048]
    - [0, 21290.6]
  - - [2688, 2048, 1, 64, 2688, 2688, 2688, 2048]
    - [11, 21030.2]
  - - [2752, 2048, 1, 64, 2752, 2752, 2752, 2048]
    - [9, 20668.4]
  - - [2816, 2048, 1, 64, 2816, 2816, 2816, 2048]
    - [9, 21527.8]
  - - [2880, 2048, 1, 64, 2880, 2880, 2880, 2048]
    - [11, 22992.0]
  - - [2944, 2048, 1, 64, 2944, 2944, 2944, 2048]
    - [0, 24226.0]
  - - [3008, 2048, 1, 64, 3008, 3008, 3008, 2048]
    - [11, 24579.9]
  - - [3072, 2048, 1, 64, 3072, 3072, 3072, 2048]
    - [11, 24566.8]
  - - [3136, 2048, 1, 64, 3136, 3136, 3136, 2048]
    - [11, 25690.0]
  - - [3200, 2048, 1, 64, 3200, 3200, 3200, 2048]
    - [9, 25679.7]
  - - [3264, 2048, 1, 64, 3264, 3264, 3264, 2048]
    - [3, 23878.9]
  - - [3328, 2048, 1, 64, 3328, 3328, 3328, 2048]
    - [11, 24863.2]
  - - [3392, 2048, 1, 64, 3392, 3392, 3392, 2048]
    - [0, 27218.7]
  - - [3456, 2048, 1, 64, 3456, 3456, 3456, 2048]
    - [0, 27224.0]
  - - [3520, 2048, 1, 64, 3520, 3520, 3520, 2048]
    - [9, 28944.1]
  - - [3584, 2048, 1, 64, 3584, 3584, 3584, 2048]
    - [0, 27354.4]
  - - [3648, 2048, 1, 64, 3648, 3648, 3648, 2048]
    - [9, 29086.0]
  - - [3712, 2048, 1, 64, 3712, 3712, 3712, 2048]
    - [0, 28058.5]
  - - [3776, 2048, 1, 64, 3776, 3776, 3776, 2048]
    - [9, 26884.7]
  - - [3840, 2048, 1, 64, 3840, 3840, 3840, 2048]
    - [11, 28833.0]
  - - [3904, 2048, 1, 64, 3904, 3904, 3904, 2048]
    - [0, 29106.9]
  - - [3968, 2048, 1, 64, 3968, 3968, 3968, 2048]
    - [11, 27170.0]
  - - [4032, 2048, 1, 64, 4032, 4032, 4032, 2048]
    - [9, 29204.0]
  - - [4096, 2048, 1, 64, 4096, 4096, 4096, 2048]
    - [0, 26271.8]
  - - [64, 2112, 1, 64, 64, 64, 64, 2112]
    - [5, 1016.77]
  - - [128, 2112, 1, 64, 128, 128, 128, 2112]
    - [19, 3084.57]
  - - [192, 2112, 1, 64, 192, 192, 192, 2112]
    - [21, 2890.3]
  - - [256, 2112, 1, 64, 256, 256, 256, 2112]
    - [18, 5011.97]
  - - [320, 2112, 1, 64, 320, 320, 320, 2112]
    - [11, 3985.02]
  - - [384, 2112, 1, 64, 384, 384, 384, 2112]
    - [13, 5563.08]
  - - [448, 2112, 1, 64, 448, 448, 448, 2112]
    - [16, 3852.82]
  - - [512, 2112, 1, 64, 512, 512, 512, 2112]
    - [7, 4443.92]
  - - [576, 2112, 1, 64, 576, 576, 576, 2112]
    - [8, 4876.98]
  - - [640, 2112, 1, 64, 640, 640, 640, 2112]
    - [6, 5278.63]
  - - [704, 2112, 1, 64, 704, 704, 704, 2112]
    - [18, 5998.7]
  - - [768, 2112, 1, 64, 768, 768, 768, 2112]
    - [10, 6407.88]
  - - [832, 2112, 1, 64, 832, 832, 832, 2112]
    - [16, 10383.0]
  - - [896, 2112, 1, 64, 896, 896, 896, 2112]
    - [0, 9566.3]
  - - [960, 2112, 1, 64, 960, 960, 960, 2112]
    - [9, 10143.9]
  - - [1024, 2112, 1, 64, 1024, 1024, 1024, 2112]
    - [1, 9550.86]
  - - [1088, 2112, 1, 64, 1088, 1088, 1088, 2112]
    - [8, 9067.78]
  - - [1152, 2112, 1, 64, 1152, 1152, 1152, 2112]
    - [7, 9615.97]
  - - [1216, 2112, 1, 64, 1216, 1216, 1216, 2112]
    - [12, 10071.8]
  - - [1280, 2112, 1, 64, 1280, 1280, 1280, 2112]
    - [7, 10614.3]
  - - [1344, 2112, 1, 64, 1344, 1344, 1344, 2112]
    - [6, 11151.1]
  - - [1408, 2112, 1, 64, 1408, 1408, 1408, 2112]
    - [7, 11759.4]
  - - [1472, 2112, 1, 64, 1472, 1472, 1472, 2112]
    - [5, 12265.1]
  - - [1536, 2112, 1, 64, 1536, 1536, 1536, 2112]
    - [3, 12679.6]
  - - [1600, 2112, 1, 64, 1600, 1600, 1600, 2112]
    - [4, 13493.0]
  - - [1664, 2112, 1, 64, 1664, 1664, 1664, 2112]
    - [3, 13736.2]
  - - [1728, 2112, 1, 64, 1728, 1728, 1728, 2112]
    - [4, 14270.6]
  - - [1792, 2112, 1, 64, 1792, 1792, 1792, 2112]
    - [11, 14679.0]
  - - [1856, 2112, 1, 64, 1856, 1856, 1856, 2112]
    - [0, 15214.3]
  - - [1920, 2112, 1, 64, 1920, 1920, 1920, 2112]
    - [9, 16006.8]
  - - [1984, 2112, 1, 64, 1984, 1984, 1984, 2112]
    - [11, 16361.8]
  - - [2048, 2112, 1, 64, 2048, 2048, 2048, 2112]
    - [9, 17410.1]
  - - [2112, 2112, 1, 64, 2112, 2112, 2112, 2112]
    - [3, 18208.4]
  - - [2176, 2112, 1, 64, 2176, 2176, 2176, 2112]
    - [0, 17661.8]
  - - [2240, 2112, 1, 64, 2240, 2240, 2240, 2112]
    - [11, 17838.5]
  - - [2304, 2112, 1, 64, 2304, 2304, 2304, 2112]
    - [9, 18399.1]
  - - [2368, 2112, 1, 64, 2368, 2368, 2368, 2112]
    - [9, 19698.1]
  - - [2432, 2112, 1, 64, 2432, 2432, 2432, 2112]
    - [1, 20184.5]
  - - [2496, 2112, 1, 64, 2496, 2496, 2496, 2112]
    - [0, 20896.6]
  - - [2560, 2112, 1, 64, 2560, 2560, 2560, 2112]
    - [11, 20221.3]
  - - [2624, 2112, 1, 64, 2624, 2624, 2624, 2112]
    - [9, 22692.0]
  - - [2688, 2112, 1, 64, 2688, 2688, 2688, 2112]
    - [9, 26284.3]
  - - [2752, 2112, 1, 64, 2752, 2752, 2752, 2112]
    - [11, 24708.0]
  - - [2816, 2112, 1, 64, 2816, 2816, 2816, 2112]
    - [9, 24682.5]
  - - [2880, 2112, 1, 64, 2880, 2880, 2880, 2112]
    - [9, 26049.3]
  - - [2944, 2112, 1, 64, 2944, 2944, 2944, 2112]
    - [9, 26150.4]
  - - [3008, 2112, 1, 64, 3008, 3008, 3008, 2112]
    - [11, 26631.4]
  - - [3072, 2112, 1, 64, 3072, 3072, 3072, 2112]
    - [9, 24085.3]
  - - [3136, 2112, 1, 64, 3136, 3136, 3136, 2112]
    - [9, 28016.0]
  - - [3200, 2112, 1, 64, 3200, 3200, 3200, 2112]
    - [9, 28361.0]
  - - [3264, 2112, 1, 64, 3264, 3264, 3264, 2112]
    - [11, 27912.4]
  - - [3328, 2112, 1, 64, 3328, 3328, 3328, 2112]
    - [9, 27983.5]
  - - [3392, 2112, 1, 64, 3392, 3392, 3392, 2112]
    - [9, 28696.6]
  - - [3456, 2112, 1, 64, 3456, 3456, 3456, 2112]
    - [9, 28611.2]
  - - [3520, 2112, 1, 64, 3520, 3520, 3520, 2112]
    - [9, 28881.1]
  - - [3584, 2112, 1, 64, 3584, 3584, 3584, 2112]
    - [9, 28467.8]
  - - [3648, 2112, 1, 64, 3648, 3648, 3648, 2112]
    - [9, 27784.3]
  - - [3712, 2112, 1, 64, 3712, 3712, 3712, 2112]
    - [9, 29209.9]
  - - [3776, 2112, 1, 64, 3776, 3776, 3776, 2112]
    - [0, 27584.1]
  - - [3840, 2112, 1, 64, 3840, 3840, 3840, 2112]
    - [9, 28784.3]
  - - [3904, 2112, 1, 64, 3904, 3904, 3904, 2112]
    - [9, 28264.1]
  - - [3968, 2112, 1, 64, 3968, 3968, 3968, 2112]
    - [9, 28377.8]
  - - [4032, 2112, 1, 64, 4032, 4032, 4032, 2112]
    - [9, 29774.4]
  - - [4096, 2112, 1, 64, 4096, 4096, 4096, 2112]
    - [9, 26649.4]
  - - [64, 2176, 1, 64, 64, 64, 64, 2176]
    - [1, 1836.55]
  - - [128, 2176, 1, 64, 128, 128, 128, 2176]
    - [4, 3505.55]
  - - [192, 2176, 1, 64, 192, 192, 192, 2176]
    - [5, 5064.07]
  - - [256, 2176, 1, 64, 256, 256, 256, 2176]
    - [2, 6301.04]
  - - [320, 2176, 1, 64, 320, 320, 320, 2176]
    - [0, 7491.02]
  - - [384, 2176, 1, 64, 384, 384, 384, 2176]
    - [4, 8524.97]
  - - [448, 2176, 1, 64, 448, 448, 448, 2176]
    - [9, 10191.0]
  - - [512, 2176, 1, 64, 512, 512, 512, 2176]
    - [9, 10951.0]
  - - [576, 2176, 1, 64, 576, 576, 576, 2176]
    - [0, 12363.6]
  - - [640, 2176, 1, 64, 640, 640, 640, 2176]
    - [0, 13007.5]
  - - [704, 2176, 1, 64, 704, 704, 704, 2176]
    - [0, 14116.7]
  - - [768, 2176, 1, 64, 768, 768, 768, 2176]
    - [9, 13969.9]
  - - [832, 2176, 1, 64, 832, 832, 832, 2176]
    - [9, 14777.0]
  - - [896, 2176, 1, 64, 896, 896, 896, 2176]
    - [9, 15297.2]
  - - [960, 2176, 1, 64, 960, 960, 960, 2176]
    - [9, 15995.7]
  - - [1024, 2176, 1, 64, 1024, 1024, 1024, 2176]
    - [9, 15792.3]
  - - [1088, 2176, 1, 64, 1088, 1088, 1088, 2176]
    - [9, 16899.1]
  - - [1152, 2176, 1, 64, 1152, 1152, 1152, 2176]
    - [9, 17436.2]
  - - [1216, 2176, 1, 64, 1216, 1216, 1216, 2176]
    - [9, 17838.7]
  - - [1280, 2176, 1, 64, 1280, 1280, 1280, 2176]
    - [0, 18230.3]
  - - [1344, 2176, 1, 64, 1344, 1344, 1344, 2176]
    - [0, 19058.0]
  - - [1408, 2176, 1, 64, 1408, 1408, 1408, 2176]
    - [9, 19508.7]
  - - [1472, 2176, 1, 64, 1472, 1472, 1472, 2176]
    - [9, 20146.9]
  - - [1536, 2176, 1, 64, 1536, 1536, 1536, 2176]
    - [9, 18838.1]
  - - [1600, 2176, 1, 64, 1600, 1600, 1600, 2176]
    - [9, 20631.6]
  - - [1664, 2176, 1, 64, 1664, 1664, 1664, 2176]
    - [9, 20975.1]
  - - [1728, 2176, 1, 64, 1728, 1728, 1728, 2176]
    - [9, 21576.8]
  - - [1792, 2176, 1, 64, 1792, 1792, 1792, 2176]
    - [9, 21889.1]
  - - [1856, 2176, 1, 64, 1856, 1856, 1856, 2176]
    - [9, 22065.2]
  - - [1920, 2176, 1, 64, 1920, 1920, 1920, 2176]
    - [9, 22243.1]
  - - [1984, 2176, 1, 64, 1984, 1984, 1984, 2176]
    - [9, 22599.1]
  - - [2048, 2176, 1, 64, 2048, 2048, 2048, 2176]
    - [9, 21209.9]
  - - [2112, 2176, 1, 64, 2112, 2112, 2112, 2176]
    - [9, 23304.2]
  - - [2176, 2176, 1, 64, 2176, 2176, 2176, 2176]
    - [9, 23591.8]
  - - [2240, 2176, 1, 64, 2240, 2240, 2240, 2176]
    - [9, 23878.4]
  - - [2304, 2176, 1, 64, 2304, 2304, 2304, 2176]
    - [9, 23762.3]
  - - [2368, 2176, 1, 64, 2368, 2368, 2368, 2176]
    - [9, 24741.1]
  - - [2432, 2176, 1, 64, 2432, 2432, 2432, 2176]
    - [9, 24743.3]
  - - [2496, 2176, 1, 64, 2496, 2496, 2496, 2176]
    - [11, 24899.7]
  - - [2560, 2176, 1, 64, 2560, 2560, 2560, 2176]
    - [9, 24529.5]
  - - [2624, 2176, 1, 64, 2624, 2624, 2624, 2176]
    - [11, 25745.1]
  - - [2688, 2176, 1, 64, 2688, 2688, 2688, 2176]
    - [9, 25334.2]
  - - [2752, 2176, 1, 64, 2752, 2752, 2752, 2176]
    - [9, 27111.7]
  - - [2816, 2176, 1, 64, 2816, 2816, 2816, 2176]
    - [11, 25559.7]
  - - [2880, 2176, 1, 64, 2880, 2880, 2880, 2176]
    - [11, 26903.4]
  - - [2944, 2176, 1, 64, 2944, 2944, 2944, 2176]
    - [9, 27653.3]
  - - [3008, 2176, 1, 64, 3008, 3008, 3008, 2176]
    - [9, 26504.5]
  - - [3072, 2176, 1, 64, 3072, 3072, 3072, 2176]
    - [9, 24421.3]
  - - [3136, 2176, 1, 64, 3136, 3136, 3136, 2176]
    - [9, 27136.1]
  - - [3200, 2176, 1, 64, 3200, 3200, 3200, 2176]
    - [9, 28146.3]
  - - [3264, 2176, 1, 64, 3264, 3264, 3264, 2176]
    - [9, 27792.9]
  - - [3328, 2176, 1, 64, 3328, 3328, 3328, 2176]
    - [11, 27574.2]
  - - [3392, 2176, 1, 64, 3392, 3392, 3392, 2176]
    - [9, 28584.0]
  - - [3456, 2176, 1, 64, 3456, 3456, 3456, 2176]
    - [9, 28524.4]
  - - [3520, 2176, 1, 64, 3520, 3520, 3520, 2176]
    - [0, 28379.8]
  - - [3584, 2176, 1, 64, 3584, 3584, 3584, 2176]
    - [9, 27781.1]
  - - [3648, 2176, 1, 64, 3648, 3648, 3648, 2176]
    - [9, 29342.1]
  - - [3712, 2176, 1, 64, 3712, 3712, 3712, 2176]
    - [9, 28850.6]
  - - [3776, 2176, 1, 64, 3776, 3776, 3776, 2176]
    - [9, 27347.0]
  - - [3840, 2176, 1, 64, 3840, 3840, 3840, 2176]
    - [9, 29622.1]
  - - [3904, 2176, 1, 64, 3904, 3904, 3904, 2176]
    - [9, 28720.5]
  - - [3968, 2176, 1, 64, 3968, 3968, 3968, 2176]
    - [9, 29191.4]
  - - [4032, 2176, 1, 64, 4032, 4032, 4032, 2176]
    - [9, 29777.1]
  - - [4096, 2176, 1, 64, 4096, 4096, 4096, 2176]
    - [0, 26610.3]
  - - [64, 2240, 1, 64, 64, 64, 64, 2240]
    - [20, 1918.23]
  - - [128, 2240, 1, 64, 128, 128, 128, 2240]
    - [7, 3562.4]
  - - [192, 2240, 1, 64, 192, 192, 192, 2240]
    - [5, 5134.25]
  - - [256, 2240, 1, 64, 256, 256, 256, 2240]
    - [6, 6397.07]
  - - [320, 2240, 1, 64, 320, 320, 320, 2240]
    - [2, 7702.25]
  - - [384, 2240, 1, 64, 384, 384, 384, 2240]
    - [3, 8984.79]
  - - [448, 2240, 1, 64, 448, 448, 448, 2240]
    - [0, 10295.7]
  - - [512, 2240, 1, 64, 512, 512, 512, 2240]
    - [9, 11255.9]
  - - [576, 2240, 1, 64, 576, 576, 576, 2240]
    - [0, 12628.0]
  - - [640, 2240, 1, 64, 640, 640, 640, 2240]
    - [0, 13171.0]
  - - [704, 2240, 1, 64, 704, 704, 704, 2240]
    - [9, 13627.3]
  - - [768, 2240, 1, 64, 768, 768, 768, 2240]
    - [0, 14095.4]
  - - [832, 2240, 1, 64, 832, 832, 832, 2240]
    - [9, 15075.0]
  - - [896, 2240, 1, 64, 896, 896, 896, 2240]
    - [9, 15666.4]
  - - [960, 2240, 1, 64, 960, 960, 960, 2240]
    - [9, 16333.3]
  - - [1024, 2240, 1, 64, 1024, 1024, 1024, 2240]
    - [9, 16069.9]
  - - [1088, 2240, 1, 64, 1088, 1088, 1088, 2240]
    - [9, 17359.3]
  - - [1152, 2240, 1, 64, 1152, 1152, 1152, 2240]
    - [9, 17685.6]
  - - [1216, 2240, 1, 64, 1216, 1216, 1216, 2240]
    - [0, 18137.9]
  - - [1280, 2240, 1, 64, 1280, 1280, 1280, 2240]
    - [9, 18634.9]
  - - [1344, 2240, 1, 64, 1344, 1344, 1344, 2240]
    - [0, 19377.8]
  - - [1408, 2240, 1, 64, 1408, 1408, 1408, 2240]
    - [9, 19826.0]
  - - [1472, 2240, 1, 64, 1472, 1472, 1472, 2240]
    - [9, 20487.7]
  - - [1536, 2240, 1, 64, 1536, 1536, 1536, 2240]
    - [9, 19157.7]
  - - [1600, 2240, 1, 64, 1600, 1600, 1600, 2240]
    - [9, 21082.2]
  - - [1664, 2240, 1, 64, 1664, 1664, 1664, 2240]
    - [9, 21599.8]
  - - [1728, 2240, 1, 64, 1728, 1728, 1728, 2240]
    - [9, 21870.1]
  - - [1792, 2240, 1, 64, 1792, 1792, 1792, 2240]
    - [9, 22066.5]
  - - [1856, 2240, 1, 64, 1856, 1856, 1856, 2240]
    - [9, 22411.8]
  - - [1920, 2240, 1, 64, 1920, 1920, 1920, 2240]
    - [9, 22495.0]
  - - [1984, 2240, 1, 64, 1984, 1984, 1984, 2240]
    - [9, 23161.5]
  - - [2048, 2240, 1, 64, 2048, 2048, 2048, 2240]
    - [0, 21386.8]
  - - [2112, 2240, 1, 64, 2112, 2112, 2112, 2240]
    - [9, 23676.4]
  - - [2176, 2240, 1, 64, 2176, 2176, 2176, 2240]
    - [9, 24073.7]
  - - [2240, 2240, 1, 64, 2240, 2240, 2240, 2240]
    - [9, 24135.4]
  - - [2304, 2240, 1, 64, 2304, 2304, 2304, 2240]
    - [9, 24091.7]
  - - [2368, 2240, 1, 64, 2368, 2368, 2368, 2240]
    - [9, 24939.2]
  - - [2432, 2240, 1, 64, 2432, 2432, 2432, 2240]
    - [11, 24690.0]
  - - [2496, 2240, 1, 64, 2496, 2496, 2496, 2240]
    - [9, 25214.7]
  - - [2560, 2240, 1, 64, 2560, 2560, 2560, 2240]
    - [9, 24715.3]
  - - [2624, 2240, 1, 64, 2624, 2624, 2624, 2240]
    - [9, 25024.7]
  - - [2688, 2240, 1, 64, 2688, 2688, 2688, 2240]
    - [9, 26697.2]
  - - [2752, 2240, 1, 64, 2752, 2752, 2752, 2240]
    - [9, 27327.1]
  - - [2816, 2240, 1, 64, 2816, 2816, 2816, 2240]
    - [9, 27102.9]
  - - [2880, 2240, 1, 64, 2880, 2880, 2880, 2240]
    - [0, 26971.0]
  - - [2944, 2240, 1, 64, 2944, 2944, 2944, 2240]
    - [9, 27968.6]
  - - [3008, 2240, 1, 64, 3008, 3008, 3008, 2240]
    - [9, 28195.5]
  - - [3072, 2240, 1, 64, 3072, 3072, 3072, 2240]
    - [9, 25787.3]
  - - [3136, 2240, 1, 64, 3136, 3136, 3136, 2240]
    - [9, 28584.1]
  - - [3200, 2240, 1, 64, 3200, 3200, 3200, 2240]
    - [11, 27814.7]
  - - [3264, 2240, 1, 64, 3264, 3264, 3264, 2240]
    - [9, 28287.0]
  - - [3328, 2240, 1, 64, 3328, 3328, 3328, 2240]
    - [9, 28248.9]
  - - [3392, 2240, 1, 64, 3392, 3392, 3392, 2240]
    - [9, 28692.0]
  - - [3456, 2240, 1, 64, 3456, 3456, 3456, 2240]
    - [0, 28115.3]
  - - [3520, 2240, 1, 64, 3520, 3520, 3520, 2240]
    - [9, 28676.6]
  - - [3584, 2240, 1, 64, 3584, 3584, 3584, 2240]
    - [11, 28085.4]
  - - [3648, 2240, 1, 64, 3648, 3648, 3648, 2240]
    - [9, 28507.5]
  - - [3712, 2240, 1, 64, 3712, 3712, 3712, 2240]
    - [9, 29822.1]
  - - [3776, 2240, 1, 64, 3776, 3776, 3776, 2240]
    - [9, 28691.5]
  - - [3840, 2240, 1, 64, 3840, 3840, 3840, 2240]
    - [9, 29735.5]
  - - [3904, 2240, 1, 64, 3904, 3904, 3904, 2240]
    - [9, 29687.6]
  - - [3968, 2240, 1, 64, 3968, 3968, 3968, 2240]
    - [9, 29504.5]
  - - [4032, 2240, 1, 64, 4032, 4032, 4032, 2240]
    - [9, 29576.9]
  - - [4096, 2240, 1, 64, 4096, 4096, 4096, 2240]
    - [11, 26559.1]
  - - [64, 2304, 1, 64, 64, 64, 64, 2304]
    - [18, 2067.73]
  - - [128, 2304, 1, 64, 128, 128, 128, 2304]
    - [1, 3719.77]
  - - [192, 2304, 1, 64, 192, 192, 192, 2304]
    - [2, 5280.01]
  - - [256, 2304, 1, 64, 256, 256, 256, 2304]
    - [9, 6501.62]
  - - [320, 2304, 1, 64, 320, 320, 320, 2304]
    - [1, 7997.55]
  - - [384, 2304, 1, 64, 384, 384, 384, 2304]
    - [3, 9233.92]
  - - [448, 2304, 1, 64, 448, 448, 448, 2304]
    - [9, 10174.0]
  - - [512, 2304, 1, 64, 512, 512, 512, 2304]
    - [0, 11528.0]
  - - [576, 2304, 1, 64, 576, 576, 576, 2304]
    - [0, 13052.7]
  - - [640, 2304, 1, 64, 640, 640, 640, 2304]
    - [0, 13594.2]
  - - [704, 2304, 1, 64, 704, 704, 704, 2304]
    - [9, 13898.5]
  - - [768, 2304, 1, 64, 768, 768, 768, 2304]
    - [0, 14305.8]
  - - [832, 2304, 1, 64, 832, 832, 832, 2304]
    - [0, 15249.5]
  - - [896, 2304, 1, 64, 896, 896, 896, 2304]
    - [9, 15918.0]
  - - [960, 2304, 1, 64, 960, 960, 960, 2304]
    - [9, 16420.0]
  - - [1024, 2304, 1, 64, 1024, 1024, 1024, 2304]
    - [9, 16255.1]
  - - [1088, 2304, 1, 64, 1088, 1088, 1088, 2304]
    - [9, 17428.7]
  - - [1152, 2304, 1, 64, 1152, 1152, 1152, 2304]
    - [9, 17929.9]
  - - [1216, 2304, 1, 64, 1216, 1216, 1216, 2304]
    - [9, 18538.6]
  - - [1280, 2304, 1, 64, 1280, 1280, 1280, 2304]
    - [9, 18974.7]
  - - [1344, 2304, 1, 64, 1344, 1344, 1344, 2304]
    - [0, 19709.4]
  - - [1408, 2304, 1, 64, 1408, 1408, 1408, 2304]
    - [9, 20170.6]
  - - [1472, 2304, 1, 64, 1472, 1472, 1472, 2304]
    - [9, 20705.2]
  - - [1536, 2304, 1, 64, 1536, 1536, 1536, 2304]
    - [11, 19346.6]
  - - [1600, 2304, 1, 64, 1600, 1600, 1600, 2304]
    - [9, 21383.8]
  - - [1664, 2304, 1, 64, 1664, 1664, 1664, 2304]
    - [9, 21717.4]
  - - [1728, 2304, 1, 64, 1728, 1728, 1728, 2304]
    - [9, 21880.7]
  - - [1792, 2304, 1, 64, 1792, 1792, 1792, 2304]
    - [9, 22218.0]
  - - [1856, 2304, 1, 64, 1856, 1856, 1856, 2304]
    - [9, 22417.8]
  - - [1920, 2304, 1, 64, 1920, 1920, 1920, 2304]
    - [9, 22729.0]
  - - [1984, 2304, 1, 64, 1984, 1984, 1984, 2304]
    - [9, 23268.1]
  - - [2048, 2304, 1, 64, 2048, 2048, 2048, 2304]
    - [9, 21666.5]
  - - [2112, 2304, 1, 64, 2112, 2112, 2112, 2304]
    - [9, 24109.6]
  - - [2176, 2304, 1, 64, 2176, 2176, 2176, 2304]
    - [9, 24259.8]
  - - [2240, 2304, 1, 64, 2240, 2240, 2240, 2304]
    - [9, 24268.8]
  - - [2304, 2304, 1, 64, 2304, 2304, 2304, 2304]
    - [9, 24249.5]
  - - [2368, 2304, 1, 64, 2368, 2368, 2368, 2304]
    - [9, 24876.8]
  - - [2432, 2304, 1, 64, 2432, 2432, 2432, 2304]
    - [9, 25007.6]
  - - [2496, 2304, 1, 64, 2496, 2496, 2496, 2304]
    - [11, 24764.2]
  - - [2560, 2304, 1, 64, 2560, 2560, 2560, 2304]
    - [11, 24503.9]
  - - [2624, 2304, 1, 64, 2624, 2624, 2624, 2304]
    - [11, 26085.1]
  - - [2688, 2304, 1, 64, 2688, 2688, 2688, 2304]
    - [0, 26306.4]
  - - [2752, 2304, 1, 64, 2752, 2752, 2752, 2304]
    - [9, 26114.6]
  - - [2816, 2304, 1, 64, 2816, 2816, 2816, 2304]
    - [11, 26818.5]
  - - [2880, 2304, 1, 64, 2880, 2880, 2880, 2304]
    - [9, 27788.8]
  - - [2944, 2304, 1, 64, 2944, 2944, 2944, 2304]
    - [9, 28258.4]
  - - [3008, 2304, 1, 64, 3008, 3008, 3008, 2304]
    - [9, 28225.9]
  - - [3072, 2304, 1, 64, 3072, 3072, 3072, 2304]
    - [11, 25989.9]
  - - [3136, 2304, 1, 64, 3136, 3136, 3136, 2304]
    - [9, 28144.8]
  - - [3200, 2304, 1, 64, 3200, 3200, 3200, 2304]
    - [9, 28435.3]
  - - [3264, 2304, 1, 64, 3264, 3264, 3264, 2304]
    - [9, 28720.2]
  - - [3328, 2304, 1, 64, 3328, 3328, 3328, 2304]
    - [11, 28160.8]
  - - [3392, 2304, 1, 64, 3392, 3392, 3392, 2304]
    - [0, 27690.0]
  - - [3456, 2304, 1, 64, 3456, 3456, 3456, 2304]
    - [0, 27277.8]
  - - [3520, 2304, 1, 64, 3520, 3520, 3520, 2304]
    - [9, 27636.5]
  - - [3584, 2304, 1, 64, 3584, 3584, 3584, 2304]
    - [9, 28162.9]
  - - [3648, 2304, 1, 64, 3648, 3648, 3648, 2304]
    - [11, 29126.7]
  - - [3712, 2304, 1, 64, 3712, 3712, 3712, 2304]
    - [9, 29690.8]
  - - [3776, 2304, 1, 64, 3776, 3776, 3776, 2304]
    - [9, 27924.6]
  - - [3840, 2304, 1, 64, 3840, 3840, 3840, 2304]
    - [9, 29737.2]
  - - [3904, 2304, 1, 64, 3904, 3904, 3904, 2304]
    - [9, 30594.2]
  - - [3968, 2304, 1, 64, 3968, 3968, 3968, 2304]
    - [9, 30150.4]
  - - [4032, 2304, 1, 64, 4032, 4032, 4032, 2304]
    - [9, 30233.3]
  - - [4096, 2304, 1, 64, 4096, 4096, 4096, 2304]
    - [11, 26583.4]
  - - [64, 2368, 1, 64, 64, 64, 64, 2368]
    - [17, 2103.94]
  - - [128, 2368, 1, 64, 128, 128, 128, 2368]
    - [5, 3764.52]
  - - [192, 2368, 1, 64, 192, 192, 192, 2368]
    - [1, 5258.01]
  - - [256, 2368, 1, 64, 256, 256, 256, 2368]
    - [12, 6609.37]
  - - [320, 2368, 1, 64, 320, 320, 320, 2368]
    - [11, 7971.05]
  - - [384, 2368, 1, 64, 384, 384, 384, 2368]
    - [9, 9122.95]
  - - [448, 2368, 1, 64, 448, 448, 448, 2368]
    - [9, 10854.6]
  - - [512, 2368, 1, 64, 512, 512, 512, 2368]
    - [0, 11534.7]
  - - [576, 2368, 1, 64, 576, 576, 576, 2368]
    - [0, 13331.2]
  - - [640, 2368, 1, 64, 640, 640, 640, 2368]
    - [0, 13826.4]
  - - [704, 2368, 1, 64, 704, 704, 704, 2368]
    - [9, 14151.9]
  - - [768, 2368, 1, 64, 768, 768, 768, 2368]
    - [0, 14503.5]
  - - [832, 2368, 1, 64, 832, 832, 832, 2368]
    - [0, 15361.9]
  - - [896, 2368, 1, 64, 896, 896, 896, 2368]
    - [9, 16144.2]
  - - [960, 2368, 1, 64, 960, 960, 960, 2368]
    - [9, 16697.8]
  - - [1024, 2368, 1, 64, 1024, 1024, 1024, 2368]
    - [9, 16418.5]
  - - [1088, 2368, 1, 64, 1088, 1088, 1088, 2368]
    - [9, 17587.9]
  - - [1152, 2368, 1, 64, 1152, 1152, 1152, 2368]
    - [9, 18093.7]
  - - [1216, 2368, 1, 64, 1216, 1216, 1216, 2368]
    - [9, 18905.0]
  - - [1280, 2368, 1, 64, 1280, 1280, 1280, 2368]
    - [0, 19288.7]
  - - [1344, 2368, 1, 64, 1344, 1344, 1344, 2368]
    - [9, 20045.6]
  - - [1408, 2368, 1, 64, 1408, 1408, 1408, 2368]
    - [9, 20439.0]
  - - [1472, 2368, 1, 64, 1472, 1472, 1472, 2368]
    - [9, 20930.9]
  - - [1536, 2368, 1, 64, 1536, 1536, 1536, 2368]
    - [9, 19648.9]
  - - [1600, 2368, 1, 64, 1600, 1600, 1600, 2368]
    - [9, 21563.5]
  - - [1664, 2368, 1, 64, 1664, 1664, 1664, 2368]
    - [9, 21799.8]
  - - [1728, 2368, 1, 64, 1728, 1728, 1728, 2368]
    - [9, 22161.3]
  - - [1792, 2368, 1, 64, 1792, 1792, 1792, 2368]
    - [9, 22366.9]
  - - [1856, 2368, 1, 64, 1856, 1856, 1856, 2368]
    - [9, 22625.3]
  - - [1920, 2368, 1, 64, 1920, 1920, 1920, 2368]
    - [9, 22965.8]
  - - [1984, 2368, 1, 64, 1984, 1984, 1984, 2368]
    - [9, 23431.7]
  - - [2048, 2368, 1, 64, 2048, 2048, 2048, 2368]
    - [9, 21998.4]
  - - [2112, 2368, 1, 64, 2112, 2112, 2112, 2368]
    - [9, 23954.1]
  - - [2176, 2368, 1, 64, 2176, 2176, 2176, 2368]
    - [9, 24294.5]
  - - [2240, 2368, 1, 64, 2240, 2240, 2240, 2368]
    - [9, 24505.3]
  - - [2304, 2368, 1, 64, 2304, 2304, 2304, 2368]
    - [9, 24293.6]
  - - [2368, 2368, 1, 64, 2368, 2368, 2368, 2368]
    - [11, 24862.9]
  - - [2432, 2368, 1, 64, 2432, 2432, 2432, 2368]
    - [9, 25301.7]
  - - [2496, 2368, 1, 64, 2496, 2496, 2496, 2368]
    - [0, 24526.3]
  - - [2560, 2368, 1, 64, 2560, 2560, 2560, 2368]
    - [11, 24539.4]
  - - [2624, 2368, 1, 64, 2624, 2624, 2624, 2368]
    - [11, 26382.8]
  - - [2688, 2368, 1, 64, 2688, 2688, 2688, 2368]
    - [9, 25641.5]
  - - [2752, 2368, 1, 64, 2752, 2752, 2752, 2368]
    - [11, 27040.1]
  - - [2816, 2368, 1, 64, 2816, 2816, 2816, 2368]
    - [0, 26350.1]
  - - [2880, 2368, 1, 64, 2880, 2880, 2880, 2368]
    - [9, 28246.5]
  - - [2944, 2368, 1, 64, 2944, 2944, 2944, 2368]
    - [9, 28004.3]
  - - [3008, 2368, 1, 64, 3008, 3008, 3008, 2368]
    - [9, 28455.9]
  - - [3072, 2368, 1, 64, 3072, 3072, 3072, 2368]
    - [11, 26420.9]
  - - [3136, 2368, 1, 64, 3136, 3136, 3136, 2368]
    - [9, 27435.3]
  - - [3200, 2368, 1, 64, 3200, 3200, 3200, 2368]
    - [9, 28092.4]
  - - [3264, 2368, 1, 64, 3264, 3264, 3264, 2368]
    - [9, 28454.9]
  - - [3328, 2368, 1, 64, 3328, 3328, 3328, 2368]
    - [9, 28924.7]
  - - [3392, 2368, 1, 64, 3392, 3392, 3392, 2368]
    - [9, 29484.4]
  - - [3456, 2368, 1, 64, 3456, 3456, 3456, 2368]
    - [11, 28198.5]
  - - [3520, 2368, 1, 64, 3520, 3520, 3520, 2368]
    - [9, 28863.7]
  - - [3584, 2368, 1, 64, 3584, 3584, 3584, 2368]
    - [9, 28277.6]
  - - [3648, 2368, 1, 64, 3648, 3648, 3648, 2368]
    - [9, 29335.4]
  - - [3712, 2368, 1, 64, 3712, 3712, 3712, 2368]
    - [9, 30100.8]
  - - [3776, 2368, 1, 64, 3776, 3776, 3776, 2368]
    - [9, 28238.6]
  - - [3840, 2368, 1, 64, 3840, 3840, 3840, 2368]
    - [11, 29436.2]
  - - [3904, 2368, 1, 64, 3904, 3904, 3904, 2368]
    - [9, 30581.1]
  - - [3968, 2368, 1, 64, 3968, 3968, 3968, 2368]
    - [9, 29460.7]
  - - [4032, 2368, 1, 64, 4032, 4032, 4032, 2368]
    - [9, 29321.0]
  - - [4096, 2368, 1, 64, 4096, 4096, 4096, 2368]
    - [11, 27066.8]
  - - [64, 2432, 1, 64, 64, 64, 64, 2432]
    - [0, 2048.4]
  - - [128, 2432, 1, 64, 128, 128, 128, 2432]
    - [4, 3925.65]
  - - [192, 2432, 1, 64, 192, 192, 192, 2432]
    - [7, 5577.45]
  - - [256, 2432, 1, 64, 256, 256, 256, 2432]
    - [0, 6787.97]
  - - [320, 2432, 1, 64, 320, 320, 320, 2432]
    - [4, 8354.03]
  - - [384, 2432, 1, 64, 384, 384, 384, 2432]
    - [9, 9719.97]
  - - [448, 2432, 1, 64, 448, 448, 448, 2432]
    - [0, 11214.1]
  - - [512, 2432, 1, 64, 512, 512, 512, 2432]
    - [0, 11705.5]
  - - [576, 2432, 1, 64, 576, 576, 576, 2432]
    - [0, 12968.6]
  - - [640, 2432, 1, 64, 640, 640, 640, 2432]
    - [0, 14135.6]
  - - [704, 2432, 1, 64, 704, 704, 704, 2432]
    - [11, 14254.6]
  - - [768, 2432, 1, 64, 768, 768, 768, 2432]
    - [11, 14746.7]
  - - [832, 2432, 1, 64, 832, 832, 832, 2432]
    - [11, 15632.3]
  - - [896, 2432, 1, 64, 896, 896, 896, 2432]
    - [9, 16374.2]
  - - [960, 2432, 1, 64, 960, 960, 960, 2432]
    - [9, 16773.7]
  - - [1024, 2432, 1, 64, 1024, 1024, 1024, 2432]
    - [9, 16691.0]
  - - [1088, 2432, 1, 64, 1088, 1088, 1088, 2432]
    - [9, 17906.7]
  - - [1152, 2432, 1, 64, 1152, 1152, 1152, 2432]
    - [9, 18429.9]
  - - [1216, 2432, 1, 64, 1216, 1216, 1216, 2432]
    - [9, 19259.7]
  - - [1280, 2432, 1, 64, 1280, 1280, 1280, 2432]
    - [9, 19564.7]
  - - [1344, 2432, 1, 64, 1344, 1344, 1344, 2432]
    - [9, 20371.0]
  - - [1408, 2432, 1, 64, 1408, 1408, 1408, 2432]
    - [9, 20794.2]
  - - [1472, 2432, 1, 64, 1472, 1472, 1472, 2432]
    - [9, 21174.8]
  - - [1536, 2432, 1, 64, 1536, 1536, 1536, 2432]
    - [9, 19828.5]
  - - [1600, 2432, 1, 64, 1600, 1600, 1600, 2432]
    - [9, 21738.3]
  - - [1664, 2432, 1, 64, 1664, 1664, 1664, 2432]
    - [9, 22078.0]
  - - [1728, 2432, 1, 64, 1728, 1728, 1728, 2432]
    - [9, 22180.2]
  - - [1792, 2432, 1, 64, 1792, 1792, 1792, 2432]
    - [9, 22538.9]
  - - [1856, 2432, 1, 64, 1856, 1856, 1856, 2432]
    - [9, 23091.9]
  - - [1920, 2432, 1, 64, 1920, 1920, 1920, 2432]
    - [9, 23094.4]
  - - [1984, 2432, 1, 64, 1984, 1984, 1984, 2432]
    - [9, 23713.9]
  - - [2048, 2432, 1, 64, 2048, 2048, 2048, 2432]
    - [11, 22201.1]
  - - [2112, 2432, 1, 64, 2112, 2112, 2112, 2432]
    - [9, 24199.5]
  - - [2176, 2432, 1, 64, 2176, 2176, 2176, 2432]
    - [9, 24638.9]
  - - [2240, 2432, 1, 64, 2240, 2240, 2240, 2432]
    - [9, 24620.5]
  - - [2304, 2432, 1, 64, 2304, 2304, 2304, 2432]
    - [9, 24485.1]
  - - [2368, 2432, 1, 64, 2368, 2368, 2368, 2432]
    - [9, 24671.7]
  - - [2432, 2432, 1, 64, 2432, 2432, 2432, 2432]
    - [9, 25379.3]
  - - [2496, 2432, 1, 64, 2496, 2496, 2496, 2432]
    - [9, 26818.5]
  - - [2560, 2432, 1, 64, 2560, 2560, 2560, 2432]
    - [9, 25447.4]
  - - [2624, 2432, 1, 64, 2624, 2624, 2624, 2432]
    - [9, 26091.9]
  - - [2688, 2432, 1, 64, 2688, 2688, 2688, 2432]
    - [0, 26677.2]
  - - [2752, 2432, 1, 64, 2752, 2752, 2752, 2432]
    - [9, 27843.2]
  - - [2816, 2432, 1, 64, 2816, 2816, 2816, 2432]
    - [9, 28063.8]
  - - [2880, 2432, 1, 64, 2880, 2880, 2880, 2432]
    - [9, 28283.3]
  - - [2944, 2432, 1, 64, 2944, 2944, 2944, 2432]
    - [9, 28170.5]
  - - [3008, 2432, 1, 64, 3008, 3008, 3008, 2432]
    - [11, 28144.5]
  - - [3072, 2432, 1, 64, 3072, 3072, 3072, 2432]
    - [9, 26557.8]
  - - [3136, 2432, 1, 64, 3136, 3136, 3136, 2432]
    - [0, 27491.3]
  - - [3200, 2432, 1, 64, 3200, 3200, 3200, 2432]
    - [9, 28039.8]
  - - [3264, 2432, 1, 64, 3264, 3264, 3264, 2432]
    - [9, 29567.7]
  - - [3328, 2432, 1, 64, 3328, 3328, 3328, 2432]
    - [9, 28417.3]
  - - [3392, 2432, 1, 64, 3392, 3392, 3392, 2432]
    - [9, 28066.2]
  - - [3456, 2432, 1, 64, 3456, 3456, 3456, 2432]
    - [11, 29243.9]
  - - [3520, 2432, 1, 64, 3520, 3520, 3520, 2432]
    - [11, 28837.1]
  - - [3584, 2432, 1, 64, 3584, 3584, 3584, 2432]
    - [11, 27822.3]
  - - [3648, 2432, 1, 64, 3648, 3648, 3648, 2432]
    - [9, 29766.6]
  - - [3712, 2432, 1, 64, 3712, 3712, 3712, 2432]
    - [9, 29363.6]
  - - [3776, 2432, 1, 64, 3776, 3776, 3776, 2432]
    - [11, 28445.8]
  - - [3840, 2432, 1, 64, 3840, 3840, 3840, 2432]
    - [9, 30011.6]
  - - [3904, 2432, 1, 64, 3904, 3904, 3904, 2432]
    - [9, 30755.8]
  - - [3968, 2432, 1, 64, 3968, 3968, 3968, 2432]
    - [0, 30053.7]
  - - [4032, 2432, 1, 64, 4032, 4032, 4032, 2432]
    - [9, 30174.2]
  - - [4096, 2432, 1, 64, 4096, 4096, 4096, 2432]
    - [9, 27478.4]
  - - [64, 2496, 1, 64, 64, 64, 64, 2496]
    - [5, 2227.36]
  - - [128, 2496, 1, 64, 128, 128, 128, 2496]
    - [3, 4033.74]
  - - [192, 2496, 1, 64, 192, 192, 192, 2496]
    - [16, 5653.53]
  - - [256, 2496, 1, 64, 256, 256, 256, 2496]
    - [21, 6903.1]
  - - [320, 2496, 1, 64, 320, 320, 320, 2496]
    - [9, 8302.33]
  - - [384, 2496, 1, 64, 384, 384, 384, 2496]
    - [9, 9919.3]
  - - [448, 2496, 1, 64, 448, 448, 448, 2496]
    - [0, 11257.6]
  - - [512, 2496, 1, 64, 512, 512, 512, 2496]
    - [0, 12041.8]
  - - [576, 2496, 1, 64, 576, 576, 576, 2496]
    - [0, 13277.3]
  - - [640, 2496, 1, 64, 640, 640, 640, 2496]
    - [9, 13721.0]
  - - [704, 2496, 1, 64, 704, 704, 704, 2496]
    - [9, 14540.8]
  - - [768, 2496, 1, 64, 768, 768, 768, 2496]
    - [11, 14912.2]
  - - [832, 2496, 1, 64, 832, 832, 832, 2496]
    - [9, 15949.4]
  - - [896, 2496, 1, 64, 896, 896, 896, 2496]
    - [9, 16575.4]
  - - [960, 2496, 1, 64, 960, 960, 960, 2496]
    - [9, 17048.7]
  - - [1024, 2496, 1, 64, 1024, 1024, 1024, 2496]
    - [9, 16886.2]
  - - [1088, 2496, 1, 64, 1088, 1088, 1088, 2496]
    - [9, 18100.4]
  - - [1152, 2496, 1, 64, 1152, 1152, 1152, 2496]
    - [9, 18697.7]
  - - [1216, 2496, 1, 64, 1216, 1216, 1216, 2496]
    - [0, 19551.8]
  - - [1280, 2496, 1, 64, 1280, 1280, 1280, 2496]
    - [9, 19836.0]
  - - [1344, 2496, 1, 64, 1344, 1344, 1344, 2496]
    - [9, 20560.6]
  - - [1408, 2496, 1, 64, 1408, 1408, 1408, 2496]
    - [9, 20748.8]
  - - [1472, 2496, 1, 64, 1472, 1472, 1472, 2496]
    - [9, 21401.8]
  - - [1536, 2496, 1, 64, 1536, 1536, 1536, 2496]
    - [9, 19922.4]
  - - [1600, 2496, 1, 64, 1600, 1600, 1600, 2496]
    - [9, 21828.3]
  - - [1664, 2496, 1, 64, 1664, 1664, 1664, 2496]
    - [9, 22160.2]
  - - [1728, 2496, 1, 64, 1728, 1728, 1728, 2496]
    - [9, 22178.6]
  - - [1792, 2496, 1, 64, 1792, 1792, 1792, 2496]
    - [9, 22823.9]
  - - [1856, 2496, 1, 64, 1856, 1856, 1856, 2496]
    - [9, 23189.8]
  - - [1920, 2496, 1, 64, 1920, 1920, 1920, 2496]
    - [9, 23412.6]
  - - [1984, 2496, 1, 64, 1984, 1984, 1984, 2496]
    - [9, 24031.6]
  - - [2048, 2496, 1, 64, 2048, 2048, 2048, 2496]
    - [9, 22226.5]
  - - [2112, 2496, 1, 64, 2112, 2112, 2112, 2496]
    - [11, 24399.8]
  - - [2176, 2496, 1, 64, 2176, 2176, 2176, 2496]
    - [9, 24840.9]
  - - [2240, 2496, 1, 64, 2240, 2240, 2240, 2496]
    - [9, 24674.0]
  - - [2304, 2496, 1, 64, 2304, 2304, 2304, 2496]
    - [11, 23749.5]
  - - [2368, 2496, 1, 64, 2368, 2368, 2368, 2496]
    - [9, 26274.2]
  - - [2432, 2496, 1, 64, 2432, 2432, 2432, 2496]
    - [9, 26715.3]
  - - [2496, 2496, 1, 64, 2496, 2496, 2496, 2496]
    - [9, 26980.4]
  - - [2560, 2496, 1, 64, 2560, 2560, 2560, 2496]
    - [0, 25487.1]
  - - [2624, 2496, 1, 64, 2624, 2624, 2624, 2496]
    - [9, 27531.3]
  - - [2688, 2496, 1, 64, 2688, 2688, 2688, 2496]
    - [9, 25470.9]
  - - [2752, 2496, 1, 64, 2752, 2752, 2752, 2496]
    - [9, 27981.0]
  - - [2816, 2496, 1, 64, 2816, 2816, 2816, 2496]
    - [9, 28118.2]
  - - [2880, 2496, 1, 64, 2880, 2880, 2880, 2496]
    - [9, 28276.4]
  - - [2944, 2496, 1, 64, 2944, 2944, 2944, 2496]
    - [9, 28446.7]
  - - [3008, 2496, 1, 64, 3008, 3008, 3008, 2496]
    - [9, 29147.9]
  - - [3072, 2496, 1, 64, 3072, 3072, 3072, 2496]
    - [11, 27119.5]
  - - [3136, 2496, 1, 64, 3136, 3136, 3136, 2496]
    - [9, 28835.1]
  - - [3200, 2496, 1, 64, 3200, 3200, 3200, 2496]
    - [9, 29085.4]
  - - [3264, 2496, 1, 64, 3264, 3264, 3264, 2496]
    - [0, 28568.2]
  - - [3328, 2496, 1, 64, 3328, 3328, 3328, 2496]
    - [9, 28079.0]
  - - [3392, 2496, 1, 64, 3392, 3392, 3392, 2496]
    - [9, 29675.5]
  - - [3456, 2496, 1, 64, 3456, 3456, 3456, 2496]
    - [9, 29807.7]
  - - [3520, 2496, 1, 64, 3520, 3520, 3520, 2496]
    - [9, 30294.3]
  - - [3584, 2496, 1, 64, 3584, 3584, 3584, 2496]
    - [9, 29647.1]
  - - [3648, 2496, 1, 64, 3648, 3648, 3648, 2496]
    - [9, 30540.2]
  - - [3712, 2496, 1, 64, 3712, 3712, 3712, 2496]
    - [9, 29668.9]
  - - [3776, 2496, 1, 64, 3776, 3776, 3776, 2496]
    - [0, 28871.6]
  - - [3840, 2496, 1, 64, 3840, 3840, 3840, 2496]
    - [9, 29797.4]
  - - [3904, 2496, 1, 64, 3904, 3904, 3904, 2496]
    - [11, 29384.7]
  - - [3968, 2496, 1, 64, 3968, 3968, 3968, 2496]
    - [0, 29649.9]
  - - [4032, 2496, 1, 64, 4032, 4032, 4032, 2496]
    - [9, 30331.0]
  - - [4096, 2496, 1, 64, 4096, 4096, 4096, 2496]
    - [9, 28098.6]
  - - [64, 2560, 1, 64, 64, 64, 64, 2560]
    - [18, 2227.19]
  - - [128, 2560, 1, 64, 128, 128, 128, 2560]
    - [6, 4155.18]
  - - [192, 2560, 1, 64, 192, 192, 192, 2560]
    - [5, 5676.06]
  - - [256, 2560, 1, 64, 256, 256, 256, 2560]
    - [3, 7281.71]
  - - [320, 2560, 1, 64, 320, 320, 320, 2560]
    - [0, 8583.52]
  - - [384, 2560, 1, 64, 384, 384, 384, 2560]
    - [9, 10121.3]
  - - [448, 2560, 1, 64, 448, 448, 448, 2560]
    - [0, 11667.4]
  - - [512, 2560, 1, 64, 512, 512, 512, 2560]
    - [0, 12469.9]
  - - [576, 2560, 1, 64, 576, 576, 576, 2560]
    - [0, 6363.51]
  - - [640, 2560, 1, 64, 640, 640, 640, 2560]
    - [21, 7127.75]
  - - [704, 2560, 1, 64, 704, 704, 704, 2560]
    - [11, 9294.28]
  - - [768, 2560, 1, 64, 768, 768, 768, 2560]
    - [0, 13033.7]
  - - [832, 2560, 1, 64, 832, 832, 832, 2560]
    - [1, 8326.05]
  - - [896, 2560, 1, 64, 896, 896, 896, 2560]
    - [4, 8933.15]
  - - [960, 2560, 1, 64, 960, 960, 960, 2560]
    - [5, 9699.95]
  - - [1024, 2560, 1, 64, 1024, 1024, 1024, 2560]
    - [21, 10502.7]
  - - [1088, 2560, 1, 64, 1088, 1088, 1088, 2560]
    - [0, 18570.2]
  - - [1152, 2560, 1, 64, 1152, 1152, 1152, 2560]
    - [7, 12573.5]
  - - [1216, 2560, 1, 64, 1216, 1216, 1216, 2560]
    - [16, 13333.4]
  - - [1280, 2560, 1, 64, 1280, 1280, 1280, 2560]
    - [7, 14206.3]
  - - [1344, 2560, 1, 64, 1344, 1344, 1344, 2560]
    - [2, 14937.8]
  - - [1408, 2560, 1, 64, 1408, 1408, 1408, 2560]
    - [5, 15291.3]
  - - [1472, 2560, 1, 64, 1472, 1472, 1472, 2560]
    - [7, 16265.6]
  - - [1536, 2560, 1, 64, 1536, 1536, 1536, 2560]
    - [3, 16772.5]
  - - [1600, 2560, 1, 64, 1600, 1600, 1600, 2560]
    - [2, 17228.0]
  - - [1664, 2560, 1, 64, 1664, 1664, 1664, 2560]
    - [11, 18337.7]
  - - [1728, 2560, 1, 64, 1728, 1728, 1728, 2560]
    - [0, 18942.4]
  - - [1792, 2560, 1, 64, 1792, 1792, 1792, 2560]
    - [0, 17380.9]
  - - [1856, 2560, 1, 64, 1856, 1856, 1856, 2560]
    - [3, 19070.7]
  - - [1920, 2560, 1, 64, 1920, 1920, 1920, 2560]
    - [9, 18475.8]
  - - [1984, 2560, 1, 64, 1984, 1984, 1984, 2560]
    - [11, 19290.0]
  - - [2048, 2560, 1, 64, 2048, 2048, 2048, 2560]
    - [9, 19766.7]
  - - [2112, 2560, 1, 64, 2112, 2112, 2112, 2560]
    - [0, 20131.8]
  - - [2176, 2560, 1, 64, 2176, 2176, 2176, 2560]
    - [0, 22172.5]
  - - [2240, 2560, 1, 64, 2240, 2240, 2240, 2560]
    - [9, 21240.6]
  - - [2304, 2560, 1, 64, 2304, 2304, 2304, 2560]
    - [11, 21601.3]
  - - [2368, 2560, 1, 64, 2368, 2368, 2368, 2560]
    - [11, 21739.8]
  - - [2432, 2560, 1, 64, 2432, 2432, 2432, 2560]
    - [11, 22372.5]
  - - [2496, 2560, 1, 64, 2496, 2496, 2496, 2560]
    - [9, 26155.5]
  - - [2560, 2560, 1, 64, 2560, 2560, 2560, 2560]
    - [11, 26422.2]
  - - [2624, 2560, 1, 64, 2624, 2624, 2624, 2560]
    - [9, 27981.8]
  - - [2688, 2560, 1, 64, 2688, 2688, 2688, 2560]
    - [0, 27128.1]
  - - [2752, 2560, 1, 64, 2752, 2752, 2752, 2560]
    - [11, 27885.6]
  - - [2816, 2560, 1, 64, 2816, 2816, 2816, 2560]
    - [9, 28456.7]
  - - [2880, 2560, 1, 64, 2880, 2880, 2880, 2560]
    - [0, 28056.5]
  - - [2944, 2560, 1, 64, 2944, 2944, 2944, 2560]
    - [9, 27443.0]
  - - [3008, 2560, 1, 64, 3008, 3008, 3008, 2560]
    - [0, 28297.3]
  - - [3072, 2560, 1, 64, 3072, 3072, 3072, 2560]
    - [9, 26473.4]
  - - [3136, 2560, 1, 64, 3136, 3136, 3136, 2560]
    - [9, 29299.5]
  - - [3200, 2560, 1, 64, 3200, 3200, 3200, 2560]
    - [9, 29707.6]
  - - [3264, 2560, 1, 64, 3264, 3264, 3264, 2560]
    - [9, 28959.6]
  - - [3328, 2560, 1, 64, 3328, 3328, 3328, 2560]
    - [9, 29537.0]
  - - [3392, 2560, 1, 64, 3392, 3392, 3392, 2560]
    - [9, 30293.8]
  - - [3456, 2560, 1, 64, 3456, 3456, 3456, 2560]
    - [9, 29723.1]
  - - [3520, 2560, 1, 64, 3520, 3520, 3520, 2560]
    - [9, 29896.9]
  - - [3584, 2560, 1, 64, 3584, 3584, 3584, 2560]
    - [9, 28876.1]
  - - [3648, 2560, 1, 64, 3648, 3648, 3648, 2560]
    - [9, 30010.2]
  - - [3712, 2560, 1, 64, 3712, 3712, 3712, 2560]
    - [11, 29866.3]
  - - [3776, 2560, 1, 64, 3776, 3776, 3776, 2560]
    - [9, 29020.2]
  - - [3840, 2560, 1, 64, 3840, 3840, 3840, 2560]
    - [9, 29950.5]
  - - [3904, 2560, 1, 64, 3904, 3904, 3904, 2560]
    - [9, 30946.0]
  - - [3968, 2560, 1, 64, 3968, 3968, 3968, 2560]
    - [11, 29168.6]
  - - [4032, 2560, 1, 64, 4032, 4032, 4032, 2560]
    - [9, 30945.6]
  - - [4096, 2560, 1, 64, 4096, 4096, 4096, 2560]
    - [9, 27452.7]
  - - [64, 2624, 1, 64, 64, 64, 64, 2624]
    - [16, 2208.29]
  - - [128, 2624, 1, 64, 128, 128, 128, 2624]
    - [15, 4186.89]
  - - [192, 2624, 1, 64, 192, 192, 192, 2624]
    - [2, 5764.93]
  - - [256, 2624, 1, 64, 256, 256, 256, 2624]
    - [3, 7550.24]
  - - [320, 2624, 1, 64, 320, 320, 320, 2624]
    - [1, 8732.31]
  - - [384, 2624, 1, 64, 384, 384, 384, 2624]
    - [9, 10117.1]
  - - [448, 2624, 1, 64, 448, 448, 448, 2624]
    - [0, 11768.3]
  - - [512, 2624, 1, 64, 512, 512, 512, 2624]
    - [0, 12668.7]
  - - [576, 2624, 1, 64, 576, 576, 576, 2624]
    - [0, 13900.0]
  - - [640, 2624, 1, 64, 640, 640, 640, 2624]
    - [9, 14190.3]
  - - [704, 2624, 1, 64, 704, 704, 704, 2624]
    - [9, 14923.7]
  - - [768, 2624, 1, 64, 768, 768, 768, 2624]
    - [11, 15386.9]
  - - [832, 2624, 1, 64, 832, 832, 832, 2624]
    - [9, 16443.5]
  - - [896, 2624, 1, 64, 896, 896, 896, 2624]
    - [9, 16750.4]
  - - [960, 2624, 1, 64, 960, 960, 960, 2624]
    - [9, 17443.9]
  - - [1024, 2624, 1, 64, 1024, 1024, 1024, 2624]
    - [9, 17361.4]
  - - [1088, 2624, 1, 64, 1088, 1088, 1088, 2624]
    - [0, 18867.6]
  - - [1152, 2624, 1, 64, 1152, 1152, 1152, 2624]
    - [9, 19297.8]
  - - [1216, 2624, 1, 64, 1216, 1216, 1216, 2624]
    - [9, 20059.7]
  - - [1280, 2624, 1, 64, 1280, 1280, 1280, 2624]
    - [9, 20311.4]
  - - [1344, 2624, 1, 64, 1344, 1344, 1344, 2624]
    - [9, 20617.8]
  - - [1408, 2624, 1, 64, 1408, 1408, 1408, 2624]
    - [9, 21242.6]
  - - [1472, 2624, 1, 64, 1472, 1472, 1472, 2624]
    - [9, 21614.0]
  - - [1536, 2624, 1, 64, 1536, 1536, 1536, 2624]
    - [9, 20078.4]
  - - [1600, 2624, 1, 64, 1600, 1600, 1600, 2624]
    - [9, 22252.2]
  - - [1664, 2624, 1, 64, 1664, 1664, 1664, 2624]
    - [9, 22544.8]
  - - [1728, 2624, 1, 64, 1728, 1728, 1728, 2624]
    - [9, 23012.7]
  - - [1792, 2624, 1, 64, 1792, 1792, 1792, 2624]
    - [9, 23306.9]
  - - [1856, 2624, 1, 64, 1856, 1856, 1856, 2624]
    - [9, 23854.7]
  - - [1920, 2624, 1, 64, 1920, 1920, 1920, 2624]
    - [9, 24109.0]
  - - [1984, 2624, 1, 64, 1984, 1984, 1984, 2624]
    - [9, 24346.7]
  - - [2048, 2624, 1, 64, 2048, 2048, 2048, 2624]
    - [9, 22573.4]
  - - [2112, 2624, 1, 64, 2112, 2112, 2112, 2624]
    - [9, 24825.2]
  - - [2176, 2624, 1, 64, 2176, 2176, 2176, 2624]
    - [9, 24493.9]
  - - [2240, 2624, 1, 64, 2240, 2240, 2240, 2624]
    - [11, 24650.8]
  - - [2304, 2624, 1, 64, 2304, 2304, 2304, 2624]
    - [9, 24582.0]
  - - [2368, 2624, 1, 64, 2368, 2368, 2368, 2624]
    - [9, 26969.7]
  - - [2432, 2624, 1, 64, 2432, 2432, 2432, 2624]
    - [0, 26659.0]
  - - [2496, 2624, 1, 64, 2496, 2496, 2496, 2624]
    - [11, 27009.7]
  - - [2560, 2624, 1, 64, 2560, 2560, 2560, 2624]
    - [11, 26694.3]
  - - [2624, 2624, 1, 64, 2624, 2624, 2624, 2624]
    - [9, 26844.9]
  - - [2688, 2624, 1, 64, 2688, 2688, 2688, 2624]
    - [11, 26361.1]
  - - [2752, 2624, 1, 64, 2752, 2752, 2752, 2624]
    - [11, 28068.9]
  - - [2816, 2624, 1, 64, 2816, 2816, 2816, 2624]
    - [11, 26750.9]
  - - [2880, 2624, 1, 64, 2880, 2880, 2880, 2624]
    - [9, 28589.6]
  - - [2944, 2624, 1, 64, 2944, 2944, 2944, 2624]
    - [9, 28817.9]
  - - [3008, 2624, 1, 64, 3008, 3008, 3008, 2624]
    - [9, 28009.2]
  - - [3072, 2624, 1, 64, 3072, 3072, 3072, 2624]
    - [11, 26694.3]
  - - [3136, 2624, 1, 64, 3136, 3136, 3136, 2624]
    - [9, 28373.5]
  - - [3200, 2624, 1, 64, 3200, 3200, 3200, 2624]
    - [11, 29166.3]
  - - [3264, 2624, 1, 64, 3264, 3264, 3264, 2624]
    - [9, 28847.8]
  - - [3328, 2624, 1, 64, 3328, 3328, 3328, 2624]
    - [9, 29816.7]
  - - [3392, 2624, 1, 64, 3392, 3392, 3392, 2624]
    - [9, 29278.0]
  - - [3456, 2624, 1, 64, 3456, 3456, 3456, 2624]
    - [9, 29931.9]
  - - [3520, 2624, 1, 64, 3520, 3520, 3520, 2624]
    - [9, 30162.7]
  - - [3584, 2624, 1, 64, 3584, 3584, 3584, 2624]
    - [9, 28731.9]
  - - [3648, 2624, 1, 64, 3648, 3648, 3648, 2624]
    - [9, 30011.5]
  - - [3712, 2624, 1, 64, 3712, 3712, 3712, 2624]
    - [9, 30636.9]
  - - [3776, 2624, 1, 64, 3776, 3776, 3776, 2624]
    - [0, 28164.3]
  - - [3840, 2624, 1, 64, 3840, 3840, 3840, 2624]
    - [0, 29575.5]
  - - [3904, 2624, 1, 64, 3904, 3904, 3904, 2624]
    - [9, 29341.9]
  - - [3968, 2624, 1, 64, 3968, 3968, 3968, 2624]
    - [9, 28821.8]
  - - [4032, 2624, 1, 64, 4032, 4032, 4032, 2624]
    - [9, 31051.6]
  - - [4096, 2624, 1, 64, 4096, 4096, 4096, 2624]
    - [9, 26293.2]
  - - [64, 2688, 1, 64, 64, 64, 64, 2688]
    - [5, 2308.15]
  - - [128, 2688, 1, 64, 128, 128, 128, 2688]
    - [0, 4381.19]
  - - [192, 2688, 1, 64, 192, 192, 192, 2688]
    - [4, 5919.3]
  - - [256, 2688, 1, 64, 256, 256, 256, 2688]
    - [1, 7475.72]
  - - [320, 2688, 1, 64, 320, 320, 320, 2688]
    - [3, 9040.78]
  - - [384, 2688, 1, 64, 384, 384, 384, 2688]
    - [9, 10312.2]
  - - [448, 2688, 1, 64, 448, 448, 448, 2688]
    - [0, 11838.7]
  - - [512, 2688, 1, 64, 512, 512, 512, 2688]
    - [0, 12972.0]
  - - [576, 2688, 1, 64, 576, 576, 576, 2688]
    - [0, 14155.6]
  - - [640, 2688, 1, 64, 640, 640, 640, 2688]
    - [9, 14358.3]
  - - [704, 2688, 1, 64, 704, 704, 704, 2688]
    - [9, 15057.7]
  - - [768, 2688, 1, 64, 768, 768, 768, 2688]
    - [9, 15499.7]
  - - [832, 2688, 1, 64, 832, 832, 832, 2688]
    - [9, 16598.5]
  - - [896, 2688, 1, 64, 896, 896, 896, 2688]
    - [9, 17077.2]
  - - [960, 2688, 1, 64, 960, 960, 960, 2688]
    - [9, 17494.5]
  - - [1024, 2688, 1, 64, 1024, 1024, 1024, 2688]
    - [9, 17355.6]
  - - [1088, 2688, 1, 64, 1088, 1088, 1088, 2688]
    - [0, 18994.2]
  - - [1152, 2688, 1, 64, 1152, 1152, 1152, 2688]
    - [9, 19473.2]
  - - [1216, 2688, 1, 64, 1216, 1216, 1216, 2688]
    - [9, 20376.8]
  - - [1280, 2688, 1, 64, 1280, 1280, 1280, 2688]
    - [9, 20430.4]
  - - [1344, 2688, 1, 64, 1344, 1344, 1344, 2688]
    - [9, 20871.0]
  - - [1408, 2688, 1, 64, 1408, 1408, 1408, 2688]
    - [9, 21401.2]
  - - [1472, 2688, 1, 64, 1472, 1472, 1472, 2688]
    - [9, 21818.7]
  - - [1536, 2688, 1, 64, 1536, 1536, 1536, 2688]
    - [9, 20294.8]
  - - [1600, 2688, 1, 64, 1600, 1600, 1600, 2688]
    - [9, 22363.4]
  - - [1664, 2688, 1, 64, 1664, 1664, 1664, 2688]
    - [9, 22919.0]
  - - [1728, 2688, 1, 64, 1728, 1728, 1728, 2688]
    - [9, 23200.5]
  - - [1792, 2688, 1, 64, 1792, 1792, 1792, 2688]
    - [9, 23597.5]
  - - [1856, 2688, 1, 64, 1856, 1856, 1856, 2688]
    - [9, 24091.8]
  - - [1920, 2688, 1, 64, 1920, 1920, 1920, 2688]
    - [9, 24215.3]
  - - [1984, 2688, 1, 64, 1984, 1984, 1984, 2688]
    - [9, 24577.5]
  - - [2048, 2688, 1, 64, 2048, 2048, 2048, 2688]
    - [9, 22912.1]
  - - [2112, 2688, 1, 64, 2112, 2112, 2112, 2688]
    - [9, 25145.5]
  - - [2176, 2688, 1, 64, 2176, 2176, 2176, 2688]
    - [9, 25366.8]
  - - [2240, 2688, 1, 64, 2240, 2240, 2240, 2688]
    - [0, 24906.1]
  - - [2304, 2688, 1, 64, 2304, 2304, 2304, 2688]
    - [9, 24722.9]
  - - [2368, 2688, 1, 64, 2368, 2368, 2368, 2688]
    - [9, 27194.2]
  - - [2432, 2688, 1, 64, 2432, 2432, 2432, 2688]
    - [9, 27344.9]
  - - [2496, 2688, 1, 64, 2496, 2496, 2496, 2688]
    - [9, 27071.9]
  - - [2560, 2688, 1, 64, 2560, 2560, 2560, 2688]
    - [9, 27325.0]
  - - [2624, 2688, 1, 64, 2624, 2624, 2624, 2688]
    - [9, 28379.7]
  - - [2688, 2688, 1, 64, 2688, 2688, 2688, 2688]
    - [9, 28043.9]
  - - [2752, 2688, 1, 64, 2752, 2752, 2752, 2688]
    - [0, 27516.8]
  - - [2816, 2688, 1, 64, 2816, 2816, 2816, 2688]
    - [9, 26680.4]
  - - [2880, 2688, 1, 64, 2880, 2880, 2880, 2688]
    - [0, 28478.9]
  - - [2944, 2688, 1, 64, 2944, 2944, 2944, 2688]
    - [9, 28468.6]
  - - [3008, 2688, 1, 64, 3008, 3008, 3008, 2688]
    - [0, 28496.4]
  - - [3072, 2688, 1, 64, 3072, 3072, 3072, 2688]
    - [11, 27130.6]
  - - [3136, 2688, 1, 64, 3136, 3136, 3136, 2688]
    - [9, 29901.7]
  - - [3200, 2688, 1, 64, 3200, 3200, 3200, 2688]
    - [11, 29403.7]
  - - [3264, 2688, 1, 64, 3264, 3264, 3264, 2688]
    - [9, 30300.9]
  - - [3328, 2688, 1, 64, 3328, 3328, 3328, 2688]
    - [9, 29966.8]
  - - [3392, 2688, 1, 64, 3392, 3392, 3392, 2688]
    - [9, 29626.5]
  - - [3456, 2688, 1, 64, 3456, 3456, 3456, 2688]
    - [9, 30386.1]
  - - [3520, 2688, 1, 64, 3520, 3520, 3520, 2688]
    - [9, 30357.7]
  - - [3584, 2688, 1, 64, 3584, 3584, 3584, 2688]
    - [11, 29280.4]
  - - [3648, 2688, 1, 64, 3648, 3648, 3648, 2688]
    - [9, 30800.7]
  - - [3712, 2688, 1, 64, 3712, 3712, 3712, 2688]
    - [9, 30282.9]
  - - [3776, 2688, 1, 64, 3776, 3776, 3776, 2688]
    - [9, 28179.2]
  - - [3840, 2688, 1, 64, 3840, 3840, 3840, 2688]
    - [0, 29529.0]
  - - [3904, 2688, 1, 64, 3904, 3904, 3904, 2688]
    - [9, 31445.1]
  - - [3968, 2688, 1, 64, 3968, 3968, 3968, 2688]
    - [9, 29381.3]
  - - [4032, 2688, 1, 64, 4032, 4032, 4032, 2688]
    - [9, 30406.2]
  - - [4096, 2688, 1, 64, 4096, 4096, 4096, 2688]
    - [9, 27100.2]
  - - [64, 2752, 1, 64, 64, 64, 64, 2752]
    - [7, 695.894]
  - - [128, 2752, 1, 64, 128, 128, 128, 2752]
    - [1, 1406.29]
  - - [192, 2752, 1, 64, 192, 192, 192, 2752]
    - [7, 2095.57]
  - - [256, 2752, 1, 64, 256, 256, 256, 2752]
    - [21, 2777.92]
  - - [320, 2752, 1, 64, 320, 320, 320, 2752]
    - [8, 3462.57]
  - - [384, 2752, 1, 64, 384, 384, 384, 2752]
    - [9, 5647.82]
  - - [448, 2752, 1, 64, 448, 448, 448, 2752]
    - [17, 4875.77]
  - - [512, 2752, 1, 64, 512, 512, 512, 2752]
    - [18, 5672.89]
  - - [576, 2752, 1, 64, 576, 576, 576, 2752]
    - [18, 6221.94]
  - - [640, 2752, 1, 64, 640, 640, 640, 2752]
    - [18, 6892.94]
  - - [704, 2752, 1, 64, 704, 704, 704, 2752]
    - [13, 7652.43]
  - - [768, 2752, 1, 64, 768, 768, 768, 2752]
    - [10, 8299.95]
  - - [832, 2752, 1, 64, 832, 832, 832, 2752]
    - [10, 9023.21]
  - - [896, 2752, 1, 64, 896, 896, 896, 2752]
    - [5, 9804.86]
  - - [960, 2752, 1, 64, 960, 960, 960, 2752]
    - [5, 10316.7]
  - - [1024, 2752, 1, 64, 1024, 1024, 1024, 2752]
    - [20, 11090.4]
  - - [1088, 2752, 1, 64, 1088, 1088, 1088, 2752]
    - [8, 12221.7]
  - - [1152, 2752, 1, 64, 1152, 1152, 1152, 2752]
    - [1, 12359.0]
  - - [1216, 2752, 1, 64, 1216, 1216, 1216, 2752]
    - [3, 13028.1]
  - - [1280, 2752, 1, 64, 1280, 1280, 1280, 2752]
    - [4, 14009.5]
  - - [1344, 2752, 1, 64, 1344, 1344, 1344, 2752]
    - [11, 14471.7]
  - - [1408, 2752, 1, 64, 1408, 1408, 1408, 2752]
    - [5, 15482.6]
  - - [1472, 2752, 1, 64, 1472, 1472, 1472, 2752]
    - [0, 15770.9]
  - - [1536, 2752, 1, 64, 1536, 1536, 1536, 2752]
    - [11, 16177.1]
  - - [1600, 2752, 1, 64, 1600, 1600, 1600, 2752]
    - [11, 17059.3]
  - - [1664, 2752, 1, 64, 1664, 1664, 1664, 2752]
    - [11, 17563.0]
  - - [1728, 2752, 1, 64, 1728, 1728, 1728, 2752]
    - [9, 18019.3]
  - - [1792, 2752, 1, 64, 1792, 1792, 1792, 2752]
    - [11, 18785.6]
  - - [1856, 2752, 1, 64, 1856, 1856, 1856, 2752]
    - [11, 19600.0]
  - - [1920, 2752, 1, 64, 1920, 1920, 1920, 2752]
    - [9, 20921.9]
  - - [1984, 2752, 1, 64, 1984, 1984, 1984, 2752]
    - [11, 22026.9]
  - - [2048, 2752, 1, 64, 2048, 2048, 2048, 2752]
    - [3, 20423.8]
  - - [2112, 2752, 1, 64, 2112, 2112, 2112, 2752]
    - [1, 21459.4]
  - - [2176, 2752, 1, 64, 2176, 2176, 2176, 2752]
    - [3, 21611.1]
  - - [2240, 2752, 1, 64, 2240, 2240, 2240, 2752]
    - [3, 22616.4]
  - - [2304, 2752, 1, 64, 2304, 2304, 2304, 2752]
    - [0, 22927.5]
  - - [2368, 2752, 1, 64, 2368, 2368, 2368, 2752]
    - [3, 23107.4]
  - - [2432, 2752, 1, 64, 2432, 2432, 2432, 2752]
    - [11, 24111.4]
  - - [2496, 2752, 1, 64, 2496, 2496, 2496, 2752]
    - [0, 24429.6]
  - - [2560, 2752, 1, 64, 2560, 2560, 2560, 2752]
    - [0, 25210.0]
  - - [2624, 2752, 1, 64, 2624, 2624, 2624, 2752]
    - [11, 25275.1]
  - - [2688, 2752, 1, 64, 2688, 2688, 2688, 2752]
    - [11, 26043.9]
  - - [2752, 2752, 1, 64, 2752, 2752, 2752, 2752]
    - [11, 26434.3]
  - - [2816, 2752, 1, 64, 2816, 2816, 2816, 2752]
    - [0, 26935.8]
  - - [2880, 2752, 1, 64, 2880, 2880, 2880, 2752]
    - [9, 28083.5]
  - - [2944, 2752, 1, 64, 2944, 2944, 2944, 2752]
    - [9, 28132.8]
  - - [3008, 2752, 1, 64, 3008, 3008, 3008, 2752]
    - [9, 28217.6]
  - - [3072, 2752, 1, 64, 3072, 3072, 3072, 2752]
    - [9, 27186.2]
  - - [3136, 2752, 1, 64, 3136, 3136, 3136, 2752]
    - [9, 30157.2]
  - - [3200, 2752, 1, 64, 3200, 3200, 3200, 2752]
    - [9, 28859.8]
  - - [3264, 2752, 1, 64, 3264, 3264, 3264, 2752]
    - [9, 30174.0]
  - - [3328, 2752, 1, 64, 3328, 3328, 3328, 2752]
    - [9, 30342.0]
  - - [3392, 2752, 1, 64, 3392, 3392, 3392, 2752]
    - [9, 29679.5]
  - - [3456, 2752, 1, 64, 3456, 3456, 3456, 2752]
    - [9, 29199.3]
  - - [3520, 2752, 1, 64, 3520, 3520, 3520, 2752]
    - [9, 29978.9]
  - - [3584, 2752, 1, 64, 3584, 3584, 3584, 2752]
    - [9, 29943.3]
  - - [3648, 2752, 1, 64, 3648, 3648, 3648, 2752]
    - [0, 29874.3]
  - - [3712, 2752, 1, 64, 3712, 3712, 3712, 2752]
    - [9, 30747.3]
  - - [3776, 2752, 1, 64, 3776, 3776, 3776, 2752]
    - [9, 28198.0]
  - - [3840, 2752, 1, 64, 3840, 3840, 3840, 2752]
    - [9, 30951.5]
  - - [3904, 2752, 1, 64, 3904, 3904, 3904, 2752]
    - [9, 31062.4]
  - - [3968, 2752, 1, 64, 3968, 3968, 3968, 2752]
    - [0, 30328.8]
  - - [4032, 2752, 1, 64, 4032, 4032, 4032, 2752]
    - [0, 30850.0]
  - - [4096, 2752, 1, 64, 4096, 4096, 4096, 2752]
    - [0, 28739.3]
  - - [64, 2816, 1, 64, 64, 64, 64, 2816]
    - [11, 2503.61]
  - - [128, 2816, 1, 64, 128, 128, 128, 2816]
    - [2, 4456.79]
  - - [192, 2816, 1, 64, 192, 192, 192, 2816]
    - [21, 6234.72]
  - - [256, 2816, 1, 64, 256, 256, 256, 2816]
    - [3, 7857.04]
  - - [320, 2816, 1, 64, 320, 320, 320, 2816]
    - [0, 9537.16]
  - - [384, 2816, 1, 64, 384, 384, 384, 2816]
    - [0, 10717.9]
  - - [448, 2816, 1, 64, 448, 448, 448, 2816]
    - [0, 12444.3]
  - - [512, 2816, 1, 64, 512, 512, 512, 2816]
    - [0, 13003.6]
  - - [576, 2816, 1, 64, 576, 576, 576, 2816]
    - [9, 13771.3]
  - - [640, 2816, 1, 64, 640, 640, 640, 2816]
    - [9, 14609.5]
  - - [704, 2816, 1, 64, 704, 704, 704, 2816]
    - [0, 15435.1]
  - - [768, 2816, 1, 64, 768, 768, 768, 2816]
    - [9, 15901.9]
  - - [832, 2816, 1, 64, 832, 832, 832, 2816]
    - [9, 16791.2]
  - - [896, 2816, 1, 64, 896, 896, 896, 2816]
    - [9, 17615.2]
  - - [960, 2816, 1, 64, 960, 960, 960, 2816]
    - [9, 17878.8]
  - - [1024, 2816, 1, 64, 1024, 1024, 1024, 2816]
    - [9, 17981.8]
  - - [1088, 2816, 1, 64, 1088, 1088, 1088, 2816]
    - [0, 19520.3]
  - - [1152, 2816, 1, 64, 1152, 1152, 1152, 2816]
    - [9, 19928.5]
  - - [1216, 2816, 1, 64, 1216, 1216, 1216, 2816]
    - [9, 20629.9]
  - - [1280, 2816, 1, 64, 1280, 1280, 1280, 2816]
    - [9, 20880.2]
  - - [1344, 2816, 1, 64, 1344, 1344, 1344, 2816]
    - [9, 21404.9]
  - - [1408, 2816, 1, 64, 1408, 1408, 1408, 2816]
    - [9, 21992.7]
  - - [1472, 2816, 1, 64, 1472, 1472, 1472, 2816]
    - [9, 22459.1]
  - - [1536, 2816, 1, 64, 1536, 1536, 1536, 2816]
    - [0, 20566.1]
  - - [1600, 2816, 1, 64, 1600, 1600, 1600, 2816]
    - [9, 23103.5]
  - - [1664, 2816, 1, 64, 1664, 1664, 1664, 2816]
    - [9, 23359.4]
  - - [1728, 2816, 1, 64, 1728, 1728, 1728, 2816]
    - [9, 23820.0]
  - - [1792, 2816, 1, 64, 1792, 1792, 1792, 2816]
    - [11, 23755.6]
  - - [1856, 2816, 1, 64, 1856, 1856, 1856, 2816]
    - [9, 24445.8]
  - - [1920, 2816, 1, 64, 1920, 1920, 1920, 2816]
    - [9, 24504.3]
  - - [1984, 2816, 1, 64, 1984, 1984, 1984, 2816]
    - [9, 24847.7]
  - - [2048, 2816, 1, 64, 2048, 2048, 2048, 2816]
    - [11, 23272.0]
  - - [2112, 2816, 1, 64, 2112, 2112, 2112, 2816]
    - [9, 25021.6]
  - - [2176, 2816, 1, 64, 2176, 2176, 2176, 2816]
    - [11, 25042.3]
  - - [2240, 2816, 1, 64, 2240, 2240, 2240, 2816]
    - [9, 26558.9]
  - - [2304, 2816, 1, 64, 2304, 2304, 2304, 2816]
    - [9, 25286.6]
  - - [2368, 2816, 1, 64, 2368, 2368, 2368, 2816]
    - [11, 27101.3]
  - - [2432, 2816, 1, 64, 2432, 2432, 2432, 2816]
    - [11, 27402.3]
  - - [2496, 2816, 1, 64, 2496, 2496, 2496, 2816]
    - [9, 27062.5]
  - - [2560, 2816, 1, 64, 2560, 2560, 2560, 2816]
    - [11, 27067.6]
  - - [2624, 2816, 1, 64, 2624, 2624, 2624, 2816]
    - [0, 27664.7]
  - - [2688, 2816, 1, 64, 2688, 2688, 2688, 2816]
    - [0, 27157.5]
  - - [2752, 2816, 1, 64, 2752, 2752, 2752, 2816]
    - [9, 28982.0]
  - - [2816, 2816, 1, 64, 2816, 2816, 2816, 2816]
    - [9, 27918.6]
  - - [2880, 2816, 1, 64, 2880, 2880, 2880, 2816]
    - [9, 28445.2]
  - - [2944, 2816, 1, 64, 2944, 2944, 2944, 2816]
    - [9, 29178.0]
  - - [3008, 2816, 1, 64, 3008, 3008, 3008, 2816]
    - [11, 29158.2]
  - - [3072, 2816, 1, 64, 3072, 3072, 3072, 2816]
    - [9, 27463.8]
  - - [3136, 2816, 1, 64, 3136, 3136, 3136, 2816]
    - [11, 28728.4]
  - - [3200, 2816, 1, 64, 3200, 3200, 3200, 2816]
    - [9, 30012.0]
  - - [3264, 2816, 1, 64, 3264, 3264, 3264, 2816]
    - [9, 30331.2]
  - - [3328, 2816, 1, 64, 3328, 3328, 3328, 2816]
    - [11, 29519.6]
  - - [3392, 2816, 1, 64, 3392, 3392, 3392, 2816]
    - [11, 28866.8]
  - - [3456, 2816, 1, 64, 3456, 3456, 3456, 2816]
    - [9, 29662.2]
  - - [3520, 2816, 1, 64, 3520, 3520, 3520, 2816]
    - [11, 29652.2]
  - - [3584, 2816, 1, 64, 3584, 3584, 3584, 2816]
    - [11, 28866.4]
  - - [3648, 2816, 1, 64, 3648, 3648, 3648, 2816]
    - [9, 30491.1]
  - - [3712, 2816, 1, 64, 3712, 3712, 3712, 2816]
    - [11, 30055.9]
  - - [3776, 2816, 1, 64, 3776, 3776, 3776, 2816]
    - [9, 29678.0]
  - - [3840, 2816, 1, 64, 3840, 3840, 3840, 2816]
    - [9, 30778.3]
  - - [3904, 2816, 1, 64, 3904, 3904, 3904, 2816]
    - [9, 30447.7]
  - - [3968, 2816, 1, 64, 3968, 3968, 3968, 2816]
    - [9, 32333.5]
  - - [4032, 2816, 1, 64, 4032, 4032, 4032, 2816]
    - [0, 30023.2]
  - - [4096, 2816, 1, 64, 4096, 4096, 4096, 2816]
    - [0, 28252.8]
  - - [64, 2880, 1, 64, 64, 64, 64, 2880]
    - [16, 2367.8]
  - - [128, 2880, 1, 64, 128, 128, 128, 2880]
    - [15, 4595.34]
  - - [192, 2880, 1, 64, 192, 192, 192, 2880]
    - [4, 6187.97]
  - - [256, 2880, 1, 64, 256, 256, 256, 2880]
    - [4, 8049.39]
  - - [320, 2880, 1, 64, 320, 320, 320, 2880]
    - [11, 9453.71]
  - - [384, 2880, 1, 64, 384, 384, 384, 2880]
    - [0, 10971.7]
  - - [448, 2880, 1, 64, 448, 448, 448, 2880]
    - [0, 12341.2]
  - - [512, 2880, 1, 64, 512, 512, 512, 2880]
    - [0, 13027.4]
  - - [576, 2880, 1, 64, 576, 576, 576, 2880]
    - [0, 14047.1]
  - - [640, 2880, 1, 64, 640, 640, 640, 2880]
    - [9, 14920.7]
  - - [704, 2880, 1, 64, 704, 704, 704, 2880]
    - [9, 15656.3]
  - - [768, 2880, 1, 64, 768, 768, 768, 2880]
    - [9, 16020.4]
  - - [832, 2880, 1, 64, 832, 832, 832, 2880]
    - [9, 17025.8]
  - - [896, 2880, 1, 64, 896, 896, 896, 2880]
    - [9, 17807.7]
  - - [960, 2880, 1, 64, 960, 960, 960, 2880]
    - [9, 17993.2]
  - - [1024, 2880, 1, 64, 1024, 1024, 1024, 2880]
    - [9, 18170.9]
  - - [1088, 2880, 1, 64, 1088, 1088, 1088, 2880]
    - [0, 19631.6]
  - - [1152, 2880, 1, 64, 1152, 1152, 1152, 2880]
    - [9, 20191.4]
  - - [1216, 2880, 1, 64, 1216, 1216, 1216, 2880]
    - [9, 20814.4]
  - - [1280, 2880, 1, 64, 1280, 1280, 1280, 2880]
    - [9, 21176.4]
  - - [1344, 2880, 1, 64, 1344, 1344, 1344, 2880]
    - [9, 21690.1]
  - - [1408, 2880, 1, 64, 1408, 1408, 1408, 2880]
    - [9, 22032.3]
  - - [1472, 2880, 1, 64, 1472, 1472, 1472, 2880]
    - [9, 22491.6]
  - - [1536, 2880, 1, 64, 1536, 1536, 1536, 2880]
    - [9, 21078.9]
  - - [1600, 2880, 1, 64, 1600, 1600, 1600, 2880]
    - [9, 23347.9]
  - - [1664, 2880, 1, 64, 1664, 1664, 1664, 2880]
    - [9, 23583.6]
  - - [1728, 2880, 1, 64, 1728, 1728, 1728, 2880]
    - [9, 24041.4]
  - - [1792, 2880, 1, 64, 1792, 1792, 1792, 2880]
    - [9, 24218.9]
  - - [1856, 2880, 1, 64, 1856, 1856, 1856, 2880]
    - [9, 24637.6]
  - - [1920, 2880, 1, 64, 1920, 1920, 1920, 2880]
    - [9, 24763.2]
  - - [1984, 2880, 1, 64, 1984, 1984, 1984, 2880]
    - [9, 24673.5]
  - - [2048, 2880, 1, 64, 2048, 2048, 2048, 2880]
    - [9, 23312.9]
  - - [2112, 2880, 1, 64, 2112, 2112, 2112, 2880]
    - [9, 25727.2]
  - - [2176, 2880, 1, 64, 2176, 2176, 2176, 2880]
    - [9, 25109.5]
  - - [2240, 2880, 1, 64, 2240, 2240, 2240, 2880]
    - [9, 26730.0]
  - - [2304, 2880, 1, 64, 2304, 2304, 2304, 2880]
    - [9, 26178.4]
  - - [2368, 2880, 1, 64, 2368, 2368, 2368, 2880]
    - [11, 25872.2]
  - - [2432, 2880, 1, 64, 2432, 2432, 2432, 2880]
    - [9, 27983.0]
  - - [2496, 2880, 1, 64, 2496, 2496, 2496, 2880]
    - [11, 27541.7]
  - - [2560, 2880, 1, 64, 2560, 2560, 2560, 2880]
    - [11, 27307.9]
  - - [2624, 2880, 1, 64, 2624, 2624, 2624, 2880]
    - [9, 28403.1]
  - - [2688, 2880, 1, 64, 2688, 2688, 2688, 2880]
    - [9, 28560.8]
  - - [2752, 2880, 1, 64, 2752, 2752, 2752, 2880]
    - [9, 28015.1]
  - - [2816, 2880, 1, 64, 2816, 2816, 2816, 2880]
    - [0, 28139.8]
  - - [2880, 2880, 1, 64, 2880, 2880, 2880, 2880]
    - [0, 27764.8]
  - - [2944, 2880, 1, 64, 2944, 2944, 2944, 2880]
    - [9, 29553.4]
  - - [3008, 2880, 1, 64, 3008, 3008, 3008, 2880]
    - [9, 29029.1]
  - - [3072, 2880, 1, 64, 3072, 3072, 3072, 2880]
    - [9, 27533.6]
  - - [3136, 2880, 1, 64, 3136, 3136, 3136, 2880]
    - [9, 29873.4]
  - - [3200, 2880, 1, 64, 3200, 3200, 3200, 2880]
    - [11, 29417.4]
  - - [3264, 2880, 1, 64, 3264, 3264, 3264, 2880]
    - [9, 30703.9]
  - - [3328, 2880, 1, 64, 3328, 3328, 3328, 2880]
    - [11, 29988.2]
  - - [3392, 2880, 1, 64, 3392, 3392, 3392, 2880]
    - [0, 29096.9]
  - - [3456, 2880, 1, 64, 3456, 3456, 3456, 2880]
    - [9, 28835.4]
  - - [3520, 2880, 1, 64, 3520, 3520, 3520, 2880]
    - [11, 29285.9]
  - - [3584, 2880, 1, 64, 3584, 3584, 3584, 2880]
    - [11, 28680.3]
  - - [3648, 2880, 1, 64, 3648, 3648, 3648, 2880]
    - [9, 31002.9]
  - - [3712, 2880, 1, 64, 3712, 3712, 3712, 2880]
    - [9, 30190.9]
  - - [3776, 2880, 1, 64, 3776, 3776, 3776, 2880]
    - [9, 29774.7]
  - - [3840, 2880, 1, 64, 3840, 3840, 3840, 2880]
    - [9, 29472.5]
  - - [3904, 2880, 1, 64, 3904, 3904, 3904, 2880]
    - [11, 30992.2]
  - - [3968, 2880, 1, 64, 3968, 3968, 3968, 2880]
    - [9, 31662.5]
  - - [4032, 2880, 1, 64, 4032, 4032, 4032, 2880]
    - [11, 32472.7]
  - - [4096, 2880, 1, 64, 4096, 4096, 4096, 2880]
    - [0, 28199.8]
  - - [64, 2944, 1, 64, 64, 64, 64, 2944]
    - [9, 2407.36]
  - - [128, 2944, 1, 64, 128, 128, 128, 2944]
    - [16, 4465.29]
  - - [192, 2944, 1, 64, 192, 192, 192, 2944]
    - [21, 6305.71]
  - - [256, 2944, 1, 64, 256, 256, 256, 2944]
    - [20, 8091.58]
  - - [320, 2944, 1, 64, 320, 320, 320, 2944]
    - [11, 9757.63]
  - - [384, 2944, 1, 64, 384, 384, 384, 2944]
    - [0, 11093.4]
  - - [448, 2944, 1, 64, 448, 448, 448, 2944]
    - [0, 12946.2]
  - - [512, 2944, 1, 64, 512, 512, 512, 2944]
    - [0, 13315.0]
  - - [576, 2944, 1, 64, 576, 576, 576, 2944]
    - [9, 14261.0]
  - - [640, 2944, 1, 64, 640, 640, 640, 2944]
    - [9, 15035.5]
  - - [704, 2944, 1, 64, 704, 704, 704, 2944]
    - [9, 15885.4]
  - - [768, 2944, 1, 64, 768, 768, 768, 2944]
    - [9, 16126.3]
  - - [832, 2944, 1, 64, 832, 832, 832, 2944]
    - [9, 17213.1]
  - - [896, 2944, 1, 64, 896, 896, 896, 2944]
    - [9, 17694.1]
  - - [960, 2944, 1, 64, 960, 960, 960, 2944]
    - [0, 18417.3]
  - - [1024, 2944, 1, 64, 1024, 1024, 1024, 2944]
    - [9, 18461.0]
  - - [1088, 2944, 1, 64, 1088, 1088, 1088, 2944]
    - [9, 19987.7]
  - - [1152, 2944, 1, 64, 1152, 1152, 1152, 2944]
    - [9, 20211.5]
  - - [1216, 2944, 1, 64, 1216, 1216, 1216, 2944]
    - [9, 20786.8]
  - - [1280, 2944, 1, 64, 1280, 1280, 1280, 2944]
    - [9, 21276.5]
  - - [1344, 2944, 1, 64, 1344, 1344, 1344, 2944]
    - [9, 21841.3]
  - - [1408, 2944, 1, 64, 1408, 1408, 1408, 2944]
    - [9, 16957.7]
  - - [1472, 2944, 1, 64, 1472, 1472, 1472, 2944]
    - [9, 17640.6]
  - - [1536, 2944, 1, 64, 1536, 1536, 1536, 2944]
    - [11, 18148.9]
  - - [1600, 2944, 1, 64, 1600, 1600, 1600, 2944]
    - [11, 18963.5]
  - - [1664, 2944, 1, 64, 1664, 1664, 1664, 2944]
    - [0, 19763.0]
  - - [1728, 2944, 1, 64, 1728, 1728, 1728, 2944]
    - [0, 20060.4]
  - - [1792, 2944, 1, 64, 1792, 1792, 1792, 2944]
    - [9, 20225.0]
  - - [1856, 2944, 1, 64, 1856, 1856, 1856, 2944]
    - [9, 20553.4]
  - - [1920, 2944, 1, 64, 1920, 1920, 1920, 2944]
    - [9, 20979.8]
  - - [1984, 2944, 1, 64, 1984, 1984, 1984, 2944]
    - [9, 21458.8]
  - - [2048, 2944, 1, 64, 2048, 2048, 2048, 2944]
    - [11, 23369.1]
  - - [2112, 2944, 1, 64, 2112, 2112, 2112, 2944]
    - [0, 22311.8]
  - - [2176, 2944, 1, 64, 2176, 2176, 2176, 2944]
    - [0, 22835.4]
  - - [2240, 2944, 1, 64, 2240, 2240, 2240, 2944]
    - [11, 25617.4]
  - - [2304, 2944, 1, 64, 2304, 2304, 2304, 2944]
    - [9, 27050.5]
  - - [2368, 2944, 1, 64, 2368, 2368, 2368, 2944]
    - [9, 28182.9]
  - - [2432, 2944, 1, 64, 2432, 2432, 2432, 2944]
    - [9, 28186.1]
  - - [2496, 2944, 1, 64, 2496, 2496, 2496, 2944]
    - [9, 27575.9]
  - - [2560, 2944, 1, 64, 2560, 2560, 2560, 2944]
    - [11, 25869.7]
  - - [2624, 2944, 1, 64, 2624, 2624, 2624, 2944]
    - [9, 28779.2]
  - - [2688, 2944, 1, 64, 2688, 2688, 2688, 2944]
    - [9, 28560.1]
  - - [2752, 2944, 1, 64, 2752, 2752, 2752, 2944]
    - [9, 27889.2]
  - - [2816, 2944, 1, 64, 2816, 2816, 2816, 2944]
    - [9, 27277.4]
  - - [2880, 2944, 1, 64, 2880, 2880, 2880, 2944]
    - [9, 29983.0]
  - - [2944, 2944, 1, 64, 2944, 2944, 2944, 2944]
    - [9, 30036.9]
  - - [3008, 2944, 1, 64, 3008, 3008, 3008, 2944]
    - [9, 30111.0]
  - - [3072, 2944, 1, 64, 3072, 3072, 3072, 2944]
    - [9, 27116.7]
  - - [3136, 2944, 1, 64, 3136, 3136, 3136, 2944]
    - [9, 30276.0]
  - - [3200, 2944, 1, 64, 3200, 3200, 3200, 2944]
    - [9, 29521.8]
  - - [3264, 2944, 1, 64, 3264, 3264, 3264, 2944]
    - [9, 30050.4]
  - - [3328, 2944, 1, 64, 3328, 3328, 3328, 2944]
    - [9, 30102.8]
  - - [3392, 2944, 1, 64, 3392, 3392, 3392, 2944]
    - [11, 29444.7]
  - - [3456, 2944, 1, 64, 3456, 3456, 3456, 2944]
    - [0, 29265.5]
  - - [3520, 2944, 1, 64, 3520, 3520, 3520, 2944]
    - [0, 29998.9]
  - - [3584, 2944, 1, 64, 3584, 3584, 3584, 2944]
    - [9, 28538.4]
  - - [3648, 2944, 1, 64, 3648, 3648, 3648, 2944]
    - [9, 31164.5]
  - - [3712, 2944, 1, 64, 3712, 3712, 3712, 2944]
    - [9, 30499.8]
  - - [3776, 2944, 1, 64, 3776, 3776, 3776, 2944]
    - [9, 29953.3]
  - - [3840, 2944, 1, 64, 3840, 3840, 3840, 2944]
    - [9, 30832.1]
  - - [3904, 2944, 1, 64, 3904, 3904, 3904, 2944]
    - [9, 31764.3]
  - - [3968, 2944, 1, 64, 3968, 3968, 3968, 2944]
    - [11, 31263.0]
  - - [4032, 2944, 1, 64, 4032, 4032, 4032, 2944]
    - [0, 31981.4]
  - - [4096, 2944, 1, 64, 4096, 4096, 4096, 2944]
    - [9, 29794.7]
  - - [64, 3008, 1, 64, 64, 64, 64, 3008]
    - [19, 759.41]
  - - [128, 3008, 1, 64, 128, 128, 128, 3008]
    - [4, 1520.31]
  - - [192, 3008, 1, 64, 192, 192, 192, 3008]
    - [9, 2295.62]
  - - [256, 3008, 1, 64, 256, 256, 256, 3008]
    - [5, 3037.99]
  - - [320, 3008, 1, 64, 320, 320, 320, 3008]
    - [18, 3787.93]
  - - [384, 3008, 1, 64, 384, 384, 384, 3008]
    - [16, 4553.08]
  - - [448, 3008, 1, 64, 448, 448, 448, 3008]
    - [19, 5357.79]
  - - [512, 3008, 1, 64, 512, 512, 512, 3008]
    - [19, 6073.75]
  - - [576, 3008, 1, 64, 576, 576, 576, 3008]
    - [5, 6979.65]
  - - [640, 3008, 1, 64, 640, 640, 640, 3008]
    - [18, 7723.06]
  - - [704, 3008, 1, 64, 704, 704, 704, 3008]
    - [18, 8258.25]
  - - [768, 3008, 1, 64, 768, 768, 768, 3008]
    - [9, 9045.39]
  - - [832, 3008, 1, 64, 832, 832, 832, 3008]
    - [6, 9794.98]
  - - [896, 3008, 1, 64, 896, 896, 896, 3008]
    - [6, 10510.5]
  - - [960, 3008, 1, 64, 960, 960, 960, 3008]
    - [12, 11281.3]
  - - [1024, 3008, 1, 64, 1024, 1024, 1024, 3008]
    - [2, 11974.9]
  - - [1088, 3008, 1, 64, 1088, 1088, 1088, 3008]
    - [2, 12815.9]
  - - [1152, 3008, 1, 64, 1152, 1152, 1152, 3008]
    - [11, 13535.0]
  - - [1216, 3008, 1, 64, 1216, 1216, 1216, 3008]
    - [11, 14329.0]
  - - [1280, 3008, 1, 64, 1280, 1280, 1280, 3008]
    - [0, 15141.5]
  - - [1344, 3008, 1, 64, 1344, 1344, 1344, 3008]
    - [11, 15954.4]
  - - [1408, 3008, 1, 64, 1408, 1408, 1408, 3008]
    - [11, 16470.3]
  - - [1472, 3008, 1, 64, 1472, 1472, 1472, 3008]
    - [0, 16966.5]
  - - [1536, 3008, 1, 64, 1536, 1536, 1536, 3008]
    - [11, 17305.2]
  - - [1600, 3008, 1, 64, 1600, 1600, 1600, 3008]
    - [9, 18220.4]
  - - [1664, 3008, 1, 64, 1664, 1664, 1664, 3008]
    - [20, 19130.2]
  - - [1728, 3008, 1, 64, 1728, 1728, 1728, 3008]
    - [4, 20334.7]
  - - [1792, 3008, 1, 64, 1792, 1792, 1792, 3008]
    - [3, 21057.0]
  - - [1856, 3008, 1, 64, 1856, 1856, 1856, 3008]
    - [9, 21288.0]
  - - [1920, 3008, 1, 64, 1920, 1920, 1920, 3008]
    - [3, 20913.1]
  - - [1984, 3008, 1, 64, 1984, 1984, 1984, 3008]
    - [11, 24361.5]
  - - [2048, 3008, 1, 64, 2048, 2048, 2048, 3008]
    - [11, 23502.8]
  - - [2112, 3008, 1, 64, 2112, 2112, 2112, 3008]
    - [11, 25085.1]
  - - [2176, 3008, 1, 64, 2176, 2176, 2176, 3008]
    - [0, 25477.5]
  - - [2240, 3008, 1, 64, 2240, 2240, 2240, 3008]
    - [9, 26292.4]
  - - [2304, 3008, 1, 64, 2304, 2304, 2304, 3008]
    - [9, 26811.4]
  - - [2368, 3008, 1, 64, 2368, 2368, 2368, 3008]
    - [0, 27591.3]
  - - [2432, 3008, 1, 64, 2432, 2432, 2432, 3008]
    - [9, 27459.4]
  - - [2496, 3008, 1, 64, 2496, 2496, 2496, 3008]
    - [9, 27547.0]
  - - [2560, 3008, 1, 64, 2560, 2560, 2560, 3008]
    - [0, 27345.7]
  - - [2624, 3008, 1, 64, 2624, 2624, 2624, 3008]
    - [9, 27174.4]
  - - [2688, 3008, 1, 64, 2688, 2688, 2688, 3008]
    - [9, 27402.3]
  - - [2752, 3008, 1, 64, 2752, 2752, 2752, 3008]
    - [0, 28675.9]
  - - [2816, 3008, 1, 64, 2816, 2816, 2816, 3008]
    - [11, 28758.9]
  - - [2880, 3008, 1, 64, 2880, 2880, 2880, 3008]
    - [9, 29082.4]
  - - [2944, 3008, 1, 64, 2944, 2944, 2944, 3008]
    - [9, 29122.2]
  - - [3008, 3008, 1, 64, 3008, 3008, 3008, 3008]
    - [9, 30480.5]
  - - [3072, 3008, 1, 64, 3072, 3072, 3072, 3008]
    - [11, 26406.1]
  - - [3136, 3008, 1, 64, 3136, 3136, 3136, 3008]
    - [9, 30445.9]
  - - [3200, 3008, 1, 64, 3200, 3200, 3200, 3008]
    - [9, 30048.7]
  - - [3264, 3008, 1, 64, 3264, 3264, 3264, 3008]
    - [11, 30245.5]
  - - [3328, 3008, 1, 64, 3328, 3328, 3328, 3008]
    - [9, 30893.7]
  - - [3392, 3008, 1, 64, 3392, 3392, 3392, 3008]
    - [9, 29878.3]
  - - [3456, 3008, 1, 64, 3456, 3456, 3456, 3008]
    - [9, 30901.6]
  - - [3520, 3008, 1, 64, 3520, 3520, 3520, 3008]
    - [11, 29369.2]
  - - [3584, 3008, 1, 64, 3584, 3584, 3584, 3008]
    - [9, 30419.9]
  - - [3648, 3008, 1, 64, 3648, 3648, 3648, 3008]
    - [9, 30957.7]
  - - [3712, 3008, 1, 64, 3712, 3712, 3712, 3008]
    - [0, 30234.6]
  - - [3776, 3008, 1, 64, 3776, 3776, 3776, 3008]
    - [9, 29972.3]
  - - [3840, 3008, 1, 64, 3840, 3840, 3840, 3008]
    - [9, 30899.4]
  - - [3904, 3008, 1, 64, 3904, 3904, 3904, 3008]
    - [9, 32422.7]
  - - [3968, 3008, 1, 64, 3968, 3968, 3968, 3008]
    - [11, 31801.8]
  - - [4032, 3008, 1, 64, 4032, 4032, 4032, 3008]
    - [9, 31340.0]
  - - [4096, 3008, 1, 64, 4096, 4096, 4096, 3008]
    - [9, 28200.7]
  - - [64, 3072, 1, 64, 64, 64, 64, 3072]
    - [11, 1469.27]
  - - [128, 3072, 1, 64, 128, 128, 128, 3072]
    - [4, 1569.71]
  - - [192, 3072, 1, 64, 192, 192, 192, 3072]
    - [12, 2320.54]
  - - [256, 3072, 1, 64, 256, 256, 256, 3072]
    - [4, 3298.22]
  - - [320, 3072, 1, 64, 320, 320, 320, 3072]
    - [3, 3894.4]
  - - [384, 3072, 1, 64, 384, 384, 384, 3072]
    - [5, 4649.37]
  - - [448, 3072, 1, 64, 448, 448, 448, 3072]
    - [9, 5721.26]
  - - [512, 3072, 1, 64, 512, 512, 512, 3072]
    - [18, 6246.07]
  - - [576, 3072, 1, 64, 576, 576, 576, 3072]
    - [15, 7006.86]
  - - [640, 3072, 1, 64, 640, 640, 640, 3072]
    - [20, 7704.83]
  - - [704, 3072, 1, 64, 704, 704, 704, 3072]
    - [9, 8497.18]
  - - [768, 3072, 1, 64, 768, 768, 768, 3072]
    - [5, 9216.51]
  - - [832, 3072, 1, 64, 832, 832, 832, 3072]
    - [8, 10703.8]
  - - [896, 3072, 1, 64, 896, 896, 896, 3072]
    - [4, 10790.1]
  - - [960, 3072, 1, 64, 960, 960, 960, 3072]
    - [21, 11589.9]
  - - [1024, 3072, 1, 64, 1024, 1024, 1024, 3072]
    - [1, 12370.9]
  - - [1088, 3072, 1, 64, 1088, 1088, 1088, 3072]
    - [1, 13215.5]
  - - [1152, 3072, 1, 64, 1152, 1152, 1152, 3072]
    - [4, 13735.0]
  - - [1216, 3072, 1, 64, 1216, 1216, 1216, 3072]
    - [0, 14320.0]
  - - [1280, 3072, 1, 64, 1280, 1280, 1280, 3072]
    - [0, 15379.6]
  - - [1344, 3072, 1, 64, 1344, 1344, 1344, 3072]
    - [0, 16336.2]
  - - [1408, 3072, 1, 64, 1408, 1408, 1408, 3072]
    - [9, 16713.2]
  - - [1472, 3072, 1, 64, 1472, 1472, 1472, 3072]
    - [11, 17190.6]
  - - [1536, 3072, 1, 64, 1536, 1536, 1536, 3072]
    - [11, 17667.2]
  - - [1600, 3072, 1, 64, 1600, 1600, 1600, 3072]
    - [11, 19083.3]
  - - [1664, 3072, 1, 64, 1664, 1664, 1664, 3072]
    - [20, 19379.9]
  - - [1728, 3072, 1, 64, 1728, 1728, 1728, 3072]
    - [11, 21536.2]
  - - [1792, 3072, 1, 64, 1792, 1792, 1792, 3072]
    - [1, 20180.9]
  - - [1856, 3072, 1, 64, 1856, 1856, 1856, 3072]
    - [11, 20770.7]
  - - [1920, 3072, 1, 64, 1920, 1920, 1920, 3072]
    - [9, 21784.5]
  - - [1984, 3072, 1, 64, 1984, 1984, 1984, 3072]
    - [3, 21829.2]
  - - [2048, 3072, 1, 64, 2048, 2048, 2048, 3072]
    - [9, 23661.5]
  - - [2112, 3072, 1, 64, 2112, 2112, 2112, 3072]
    - [9, 26842.8]
  - - [2176, 3072, 1, 64, 2176, 2176, 2176, 3072]
    - [9, 23968.5]
  - - [2240, 3072, 1, 64, 2240, 2240, 2240, 3072]
    - [9, 24696.9]
  - - [2304, 3072, 1, 64, 2304, 2304, 2304, 3072]
    - [9, 26033.3]
  - - [2368, 3072, 1, 64, 2368, 2368, 2368, 3072]
    - [0, 26049.8]
  - - [2432, 3072, 1, 64, 2432, 2432, 2432, 3072]
    - [11, 26659.9]
  - - [2496, 3072, 1, 64, 2496, 2496, 2496, 3072]
    - [9, 28329.7]
  - - [2560, 3072, 1, 64, 2560, 2560, 2560, 3072]
    - [9, 28225.1]
  - - [2624, 3072, 1, 64, 2624, 2624, 2624, 3072]
    - [9, 29062.8]
  - - [2688, 3072, 1, 64, 2688, 2688, 2688, 3072]
    - [9, 28278.9]
  - - [2752, 3072, 1, 64, 2752, 2752, 2752, 3072]
    - [9, 29537.0]
  - - [2816, 3072, 1, 64, 2816, 2816, 2816, 3072]
    - [0, 28563.3]
  - - [2880, 3072, 1, 64, 2880, 2880, 2880, 3072]
    - [9, 30164.8]
  - - [2944, 3072, 1, 64, 2944, 2944, 2944, 3072]
    - [9, 29399.0]
  - - [3008, 3072, 1, 64, 3008, 3008, 3008, 3072]
    - [9, 29682.5]
  - - [3072, 3072, 1, 64, 3072, 3072, 3072, 3072]
    - [9, 27170.5]
  - - [3136, 3072, 1, 64, 3136, 3136, 3136, 3072]
    - [11, 29963.2]
  - - [3200, 3072, 1, 64, 3200, 3200, 3200, 3072]
    - [9, 29230.9]
  - - [3264, 3072, 1, 64, 3264, 3264, 3264, 3072]
    - [0, 29662.6]
  - - [3328, 3072, 1, 64, 3328, 3328, 3328, 3072]
    - [9, 29808.8]
  - - [3392, 3072, 1, 64, 3392, 3392, 3392, 3072]
    - [9, 31227.1]
  - - [3456, 3072, 1, 64, 3456, 3456, 3456, 3072]
    - [9, 30991.9]
  - - [3520, 3072, 1, 64, 3520, 3520, 3520, 3072]
    - [11, 29189.4]
  - - [3584, 3072, 1, 64, 3584, 3584, 3584, 3072]
    - [9, 28940.2]
  - - [3648, 3072, 1, 64, 3648, 3648, 3648, 3072]
    - [11, 30382.9]
  - - [3712, 3072, 1, 64, 3712, 3712, 3712, 3072]
    - [9, 31660.2]
  - - [3776, 3072, 1, 64, 3776, 3776, 3776, 3072]
    - [9, 29838.6]
  - - [3840, 3072, 1, 64, 3840, 3840, 3840, 3072]
    - [0, 30529.5]
  - - [3904, 3072, 1, 64, 3904, 3904, 3904, 3072]
    - [0, 31212.6]
  - - [3968, 3072, 1, 64, 3968, 3968, 3968, 3072]
    - [0, 31730.7]
  - - [4032, 3072, 1, 64, 4032, 4032, 4032, 3072]
    - [0, 31448.1]
  - - [4096, 3072, 1, 64, 4096, 4096, 4096, 3072]
    - [0, 29075.3]
  - - [64, 3136, 1, 64, 64, 64, 64, 3136]
    - [5, 2552.13]
  - - [128, 3136, 1, 64, 128, 128, 128, 3136]
    - [16, 4804.52]
  - - [192, 3136, 1, 64, 192, 192, 192, 3136]
    - [12, 6543.47]
  - - [256, 3136, 1, 64, 256, 256, 256, 3136]
    - [4, 8519.25]
  - - [320, 3136, 1, 64, 320, 320, 320, 3136]
    - [11, 10184.7]
  - - [384, 3136, 1, 64, 384, 384, 384, 3136]
    - [0, 11465.3]
  - - [448, 3136, 1, 64, 448, 448, 448, 3136]
    - [0, 13097.6]
  - - [512, 3136, 1, 64, 512, 512, 512, 3136]
    - [0, 13307.3]
  - - [576, 3136, 1, 64, 576, 576, 576, 3136]
    - [9, 14726.7]
  - - [640, 3136, 1, 64, 640, 640, 640, 3136]
    - [9, 15601.7]
  - - [704, 3136, 1, 64, 704, 704, 704, 3136]
    - [9, 16421.9]
  - - [768, 3136, 1, 64, 768, 768, 768, 3136]
    - [9, 16602.6]
  - - [832, 3136, 1, 64, 832, 832, 832, 3136]
    - [0, 17705.8]
  - - [896, 3136, 1, 64, 896, 896, 896, 3136]
    - [9, 18400.6]
  - - [960, 3136, 1, 64, 960, 960, 960, 3136]
    - [0, 19288.7]
  - - [1024, 3136, 1, 64, 1024, 1024, 1024, 3136]
    - [9, 18971.5]
  - - [1088, 3136, 1, 64, 1088, 1088, 1088, 3136]
    - [9, 20580.9]
  - - [1152, 3136, 1, 64, 1152, 1152, 1152, 3136]
    - [9, 20887.9]
  - - [1216, 3136, 1, 64, 1216, 1216, 1216, 3136]
    - [9, 21603.3]
  - - [1280, 3136, 1, 64, 1280, 1280, 1280, 3136]
    - [9, 21826.5]
  - - [1344, 3136, 1, 64, 1344, 1344, 1344, 3136]
    - [9, 22010.9]
  - - [1408, 3136, 1, 64, 1408, 1408, 1408, 3136]
    - [9, 22561.9]
  - - [1472, 3136, 1, 64, 1472, 1472, 1472, 3136]
    - [9, 23144.0]
  - - [1536, 3136, 1, 64, 1536, 1536, 1536, 3136]
    - [9, 21700.5]
  - - [1600, 3136, 1, 64, 1600, 1600, 1600, 3136]
    - [9, 23912.6]
  - - [1664, 3136, 1, 64, 1664, 1664, 1664, 3136]
    - [9, 24226.9]
  - - [1728, 3136, 1, 64, 1728, 1728, 1728, 3136]
    - [9, 24540.9]
  - - [1792, 3136, 1, 64, 1792, 1792, 1792, 3136]
    - [9, 24696.7]
  - - [1856, 3136, 1, 64, 1856, 1856, 1856, 3136]
    - [9, 24983.5]
  - - [1920, 3136, 1, 64, 1920, 1920, 1920, 3136]
    - [9, 25450.6]
  - - [1984, 3136, 1, 64, 1984, 1984, 1984, 3136]
    - [0, 25995.1]
  - - [2048, 3136, 1, 64, 2048, 2048, 2048, 3136]
    - [9, 23835.2]
  - - [2112, 3136, 1, 64, 2112, 2112, 2112, 3136]
    - [9, 27105.9]
  - - [2176, 3136, 1, 64, 2176, 2176, 2176, 3136]
    - [9, 27767.5]
  - - [2240, 3136, 1, 64, 2240, 2240, 2240, 3136]
    - [0, 26985.1]
  - - [2304, 3136, 1, 64, 2304, 2304, 2304, 3136]
    - [11, 27097.4]
  - - [2368, 3136, 1, 64, 2368, 2368, 2368, 3136]
    - [9, 28009.3]
  - - [2432, 3136, 1, 64, 2432, 2432, 2432, 3136]
    - [0, 27556.4]
  - - [2496, 3136, 1, 64, 2496, 2496, 2496, 3136]
    - [9, 27987.7]
  - - [2560, 3136, 1, 64, 2560, 2560, 2560, 3136]
    - [0, 27143.3]
  - - [2624, 3136, 1, 64, 2624, 2624, 2624, 3136]
    - [9, 28718.6]
  - - [2688, 3136, 1, 64, 2688, 2688, 2688, 3136]
    - [9, 27996.1]
  - - [2752, 3136, 1, 64, 2752, 2752, 2752, 3136]
    - [9, 29451.4]
  - - [2816, 3136, 1, 64, 2816, 2816, 2816, 3136]
    - [9, 29960.6]
  - - [2880, 3136, 1, 64, 2880, 2880, 2880, 3136]
    - [9, 29764.2]
  - - [2944, 3136, 1, 64, 2944, 2944, 2944, 3136]
    - [9, 30564.1]
  - - [3008, 3136, 1, 64, 3008, 3008, 3008, 3136]
    - [0, 29761.3]
  - - [3072, 3136, 1, 64, 3072, 3072, 3072, 3136]
    - [11, 27478.2]
  - - [3136, 3136, 1, 64, 3136, 3136, 3136, 3136]
    - [9, 29130.8]
  - - [3200, 3136, 1, 64, 3200, 3200, 3200, 3136]
    - [9, 30425.2]
  - - [3264, 3136, 1, 64, 3264, 3264, 3264, 3136]
    - [9, 31120.7]
  - - [3328, 3136, 1, 64, 3328, 3328, 3328, 3136]
    - [0, 28950.0]
  - - [3392, 3136, 1, 64, 3392, 3392, 3392, 3136]
    - [9, 30304.0]
  - - [3456, 3136, 1, 64, 3456, 3456, 3456, 3136]
    - [9, 29110.9]
  - - [3520, 3136, 1, 64, 3520, 3520, 3520, 3136]
    - [0, 30737.4]
  - - [3584, 3136, 1, 64, 3584, 3584, 3584, 3136]
    - [9, 28701.4]
  - - [3648, 3136, 1, 64, 3648, 3648, 3648, 3136]
    - [9, 32293.5]
  - - [3712, 3136, 1, 64, 3712, 3712, 3712, 3136]
    - [0, 30941.3]
  - - [3776, 3136, 1, 64, 3776, 3776, 3776, 3136]
    - [9, 30188.3]
  - - [3840, 3136, 1, 64, 3840, 3840, 3840, 3136]
    - [11, 31067.6]
  - - [3904, 3136, 1, 64, 3904, 3904, 3904, 3136]
    - [9, 32381.6]
  - - [3968, 3136, 1, 64, 3968, 3968, 3968, 3136]
    - [9, 32882.5]
  - - [4032, 3136, 1, 64, 4032, 4032, 4032, 3136]
    - [9, 30651.5]
  - - [4096, 3136, 1, 64, 4096, 4096, 4096, 3136]
    - [9, 24528.5]
  - - [64, 3200, 1, 64, 64, 64, 64, 3200]
    - [19, 2579.12]
  - - [128, 3200, 1, 64, 128, 128, 128, 3200]
    - [3, 4957.24]
  - - [192, 3200, 1, 64, 192, 192, 192, 3200]
    - [2, 6784.18]
  - - [256, 3200, 1, 64, 256, 256, 256, 3200]
    - [4, 8569.56]
  - - [320, 3200, 1, 64, 320, 320, 320, 3200]
    - [9, 10462.2]
  - - [384, 3200, 1, 64, 384, 384, 384, 3200]
    - [9, 11599.1]
  - - [448, 3200, 1, 64, 448, 448, 448, 3200]
    - [0, 13407.7]
  - - [512, 3200, 1, 64, 512, 512, 512, 3200]
    - [9, 13526.3]
  - - [576, 3200, 1, 64, 576, 576, 576, 3200]
    - [0, 14817.7]
  - - [640, 3200, 1, 64, 640, 640, 640, 3200]
    - [9, 15736.6]
  - - [704, 3200, 1, 64, 704, 704, 704, 3200]
    - [9, 16587.4]
  - - [768, 3200, 1, 64, 768, 768, 768, 3200]
    - [9, 16757.3]
  - - [832, 3200, 1, 64, 832, 832, 832, 3200]
    - [9, 18057.6]
  - - [896, 3200, 1, 64, 896, 896, 896, 3200]
    - [9, 18680.5]
  - - [960, 3200, 1, 64, 960, 960, 960, 3200]
    - [0, 19464.0]
  - - [1024, 3200, 1, 64, 1024, 1024, 1024, 3200]
    - [9, 19167.7]
  - - [1088, 3200, 1, 64, 1088, 1088, 1088, 3200]
    - [9, 20564.9]
  - - [1152, 3200, 1, 64, 1152, 1152, 1152, 3200]
    - [9, 21012.4]
  - - [1216, 3200, 1, 64, 1216, 1216, 1216, 3200]
    - [9, 21396.5]
  - - [1280, 3200, 1, 64, 1280, 1280, 1280, 3200]
    - [9, 22024.9]
  - - [1344, 3200, 1, 64, 1344, 1344, 1344, 3200]
    - [9, 22343.4]
  - - [1408, 3200, 1, 64, 1408, 1408, 1408, 3200]
    - [9, 22601.9]
  - - [1472, 3200, 1, 64, 1472, 1472, 1472, 3200]
    - [9, 23314.9]
  - - [1536, 3200, 1, 64, 1536, 1536, 1536, 3200]
    - [9, 21854.2]
  - - [1600, 3200, 1, 64, 1600, 1600, 1600, 3200]
    - [9, 24115.1]
  - - [1664, 3200, 1, 64, 1664, 1664, 1664, 3200]
    - [9, 24515.0]
  - - [1728, 3200, 1, 64, 1728, 1728, 1728, 3200]
    - [9, 24775.2]
  - - [1792, 3200, 1, 64, 1792, 1792, 1792, 3200]
    - [9, 24721.9]
  - - [1856, 3200, 1, 64, 1856, 1856, 1856, 3200]
    - [11, 24147.4]
  - - [1920, 3200, 1, 64, 1920, 1920, 1920, 3200]
    - [11, 24871.0]
  - - [1984, 3200, 1, 64, 1984, 1984, 1984, 3200]
    - [0, 25559.4]
  - - [2048, 3200, 1, 64, 2048, 2048, 2048, 3200]
    - [11, 23764.8]
  - - [2112, 3200, 1, 64, 2112, 2112, 2112, 3200]
    - [9, 27514.8]
  - - [2176, 3200, 1, 64, 2176, 2176, 2176, 3200]
    - [9, 27462.8]
  - - [2240, 3200, 1, 64, 2240, 2240, 2240, 3200]
    - [9, 26641.9]
  - - [2304, 3200, 1, 64, 2304, 2304, 2304, 3200]
    - [11, 27265.2]
  - - [2368, 3200, 1, 64, 2368, 2368, 2368, 3200]
    - [11, 27974.2]
  - - [2432, 3200, 1, 64, 2432, 2432, 2432, 3200]
    - [0, 27745.9]
  - - [2496, 3200, 1, 64, 2496, 2496, 2496, 3200]
    - [9, 28323.1]
  - - [2560, 3200, 1, 64, 2560, 2560, 2560, 3200]
    - [11, 28122.1]
  - - [2624, 3200, 1, 64, 2624, 2624, 2624, 3200]
    - [9, 28837.6]
  - - [2688, 3200, 1, 64, 2688, 2688, 2688, 3200]
    - [9, 29697.1]
  - - [2752, 3200, 1, 64, 2752, 2752, 2752, 3200]
    - [9, 29861.3]
  - - [2816, 3200, 1, 64, 2816, 2816, 2816, 3200]
    - [9, 29448.0]
  - - [2880, 3200, 1, 64, 2880, 2880, 2880, 3200]
    - [9, 29471.7]
  - - [2944, 3200, 1, 64, 2944, 2944, 2944, 3200]
    - [9, 29730.0]
  - - [3008, 3200, 1, 64, 3008, 3008, 3008, 3200]
    - [9, 30460.4]
  - - [3072, 3200, 1, 64, 3072, 3072, 3072, 3200]
    - [0, 26468.8]
  - - [3136, 3200, 1, 64, 3136, 3136, 3136, 3200]
    - [11, 29776.2]
  - - [3200, 3200, 1, 64, 3200, 3200, 3200, 3200]
    - [9, 30136.7]
  - - [3264, 3200, 1, 64, 3264, 3264, 3264, 3200]
    - [0, 28994.0]
  - - [3328, 3200, 1, 64, 3328, 3328, 3328, 3200]
    - [11, 29725.1]
  - - [3392, 3200, 1, 64, 3392, 3392, 3392, 3200]
    - [0, 30221.6]
  - - [3456, 3200, 1, 64, 3456, 3456, 3456, 3200]
    - [9, 30413.5]
  - - [3520, 3200, 1, 64, 3520, 3520, 3520, 3200]
    - [9, 32042.3]
  - - [3584, 3200, 1, 64, 3584, 3584, 3584, 3200]
    - [9, 30458.7]
  - - [3648, 3200, 1, 64, 3648, 3648, 3648, 3200]
    - [11, 32122.4]
  - - [3712, 3200, 1, 64, 3712, 3712, 3712, 3200]
    - [11, 31500.8]
  - - [3776, 3200, 1, 64, 3776, 3776, 3776, 3200]
    - [0, 30189.9]
  - - [3840, 3200, 1, 64, 3840, 3840, 3840, 3200]
    - [9, 32193.5]
  - - [3904, 3200, 1, 64, 3904, 3904, 3904, 3200]
    - [9, 32680.6]
  - - [3968, 3200, 1, 64, 3968, 3968, 3968, 3200]
    - [0, 27839.5]
  - - [4032, 3200, 1, 64, 4032, 4032, 4032, 3200]
    - [9, 24397.8]
  - - [4096, 3200, 1, 64, 4096, 4096, 4096, 3200]
    - [9, 18991.9]
  - - [64, 3264, 1, 64, 64, 64, 64, 3264]
    - [10, 2628.62]
  - - [128, 3264, 1, 64, 128, 128, 128, 3264]
    - [16, 4986.63]
  - - [192, 3264, 1, 64, 192, 192, 192, 3264]
    - [1, 6999.6]
  - - [256, 3264, 1, 64, 256, 256, 256, 3264]
    - [0, 8762.33]
  - - [320, 3264, 1, 64, 320, 320, 320, 3264]
    - [0, 10640.9]
  - - [384, 3264, 1, 64, 384, 384, 384, 3264]
    - [0, 11871.4]
  - - [448, 3264, 1, 64, 448, 448, 448, 3264]
    - [0, 13521.8]
  - - [512, 3264, 1, 64, 512, 512, 512, 3264]
    - [9, 13752.5]
  - - [576, 3264, 1, 64, 576, 576, 576, 3264]
    - [0, 15123.5]
  - - [640, 3264, 1, 64, 640, 640, 640, 3264]
    - [9, 15997.6]
  - - [704, 3264, 1, 64, 704, 704, 704, 3264]
    - [9, 16696.3]
  - - [768, 3264, 1, 64, 768, 768, 768, 3264]
    - [9, 17018.1]
  - - [832, 3264, 1, 64, 832, 832, 832, 3264]
    - [9, 18121.1]
  - - [896, 3264, 1, 64, 896, 896, 896, 3264]
    - [9, 19124.2]
  - - [960, 3264, 1, 64, 960, 960, 960, 3264]
    - [0, 19896.6]
  - - [1024, 3264, 1, 64, 1024, 1024, 1024, 3264]
    - [9, 19495.7]
  - - [1088, 3264, 1, 64, 1088, 1088, 1088, 3264]
    - [9, 20667.1]
  - - [1152, 3264, 1, 64, 1152, 1152, 1152, 3264]
    - [9, 21100.0]
  - - [1216, 3264, 1, 64, 1216, 1216, 1216, 3264]
    - [9, 21493.8]
  - - [1280, 3264, 1, 64, 1280, 1280, 1280, 3264]
    - [9, 22171.1]
  - - [1344, 3264, 1, 64, 1344, 1344, 1344, 3264]
    - [9, 22692.6]
  - - [1408, 3264, 1, 64, 1408, 1408, 1408, 3264]
    - [9, 22844.6]
  - - [1472, 3264, 1, 64, 1472, 1472, 1472, 3264]
    - [9, 23805.1]
  - - [1536, 3264, 1, 64, 1536, 1536, 1536, 3264]
    - [9, 22174.2]
  - - [1600, 3264, 1, 64, 1600, 1600, 1600, 3264]
    - [9, 24380.3]
  - - [1664, 3264, 1, 64, 1664, 1664, 1664, 3264]
    - [11, 24233.1]
  - - [1728, 3264, 1, 64, 1728, 1728, 1728, 3264]
    - [9, 24985.7]
  - - [1792, 3264, 1, 64, 1792, 1792, 1792, 3264]
    - [11, 24625.9]
  - - [1856, 3264, 1, 64, 1856, 1856, 1856, 3264]
    - [0, 25415.0]
  - - [1920, 3264, 1, 64, 1920, 1920, 1920, 3264]
    - [9, 25598.4]
  - - [1984, 3264, 1, 64, 1984, 1984, 1984, 3264]
    - [0, 25578.3]
  - - [2048, 3264, 1, 64, 2048, 2048, 2048, 3264]
    - [9, 24045.3]
  - - [2112, 3264, 1, 64, 2112, 2112, 2112, 3264]
    - [9, 27696.8]
  - - [2176, 3264, 1, 64, 2176, 2176, 2176, 3264]
    - [9, 27560.3]
  - - [2240, 3264, 1, 64, 2240, 2240, 2240, 3264]
    - [9, 27935.6]
  - - [2304, 3264, 1, 64, 2304, 2304, 2304, 3264]
    - [9, 27411.4]
  - - [2368, 3264, 1, 64, 2368, 2368, 2368, 3264]
    - [9, 28700.9]
  - - [2432, 3264, 1, 64, 2432, 2432, 2432, 3264]
    - [9, 28809.6]
  - - [2496, 3264, 1, 64, 2496, 2496, 2496, 3264]
    - [9, 27700.0]
  - - [2560, 3264, 1, 64, 2560, 2560, 2560, 3264]
    - [9, 28157.5]
  - - [2624, 3264, 1, 64, 2624, 2624, 2624, 3264]
    - [11, 29049.6]
  - - [2688, 3264, 1, 64, 2688, 2688, 2688, 3264]
    - [9, 29392.0]
  - - [2752, 3264, 1, 64, 2752, 2752, 2752, 3264]
    - [9, 29857.4]
  - - [2816, 3264, 1, 64, 2816, 2816, 2816, 3264]
    - [9, 29349.2]
  - - [2880, 3264, 1, 64, 2880, 2880, 2880, 3264]
    - [9, 30086.7]
  - - [2944, 3264, 1, 64, 2944, 2944, 2944, 3264]
    - [11, 28951.3]
  - - [3008, 3264, 1, 64, 3008, 3008, 3008, 3264]
    - [0, 28811.6]
  - - [3072, 3264, 1, 64, 3072, 3072, 3072, 3264]
    - [11, 27042.6]
  - - [3136, 3264, 1, 64, 3136, 3136, 3136, 3264]
    - [9, 29614.0]
  - - [3200, 3264, 1, 64, 3200, 3200, 3200, 3264]
    - [9, 30303.3]
  - - [3264, 3264, 1, 64, 3264, 3264, 3264, 3264]
    - [9, 30954.3]
  - - [3328, 3264, 1, 64, 3328, 3328, 3328, 3264]
    - [9, 30649.7]
  - - [3392, 3264, 1, 64, 3392, 3392, 3392, 3264]
    - [11, 30528.5]
  - - [3456, 3264, 1, 64, 3456, 3456, 3456, 3264]
    - [9, 31647.2]
  - - [3520, 3264, 1, 64, 3520, 3520, 3520, 3264]
    - [11, 30394.5]
  - - [3584, 3264, 1, 64, 3584, 3584, 3584, 3264]
    - [9, 30170.2]
  - - [3648, 3264, 1, 64, 3648, 3648, 3648, 3264]
    - [11, 32036.2]
  - - [3712, 3264, 1, 64, 3712, 3712, 3712, 3264]
    - [0, 30069.9]
  - - [3776, 3264, 1, 64, 3776, 3776, 3776, 3264]
    - [0, 29602.3]
  - - [3840, 3264, 1, 64, 3840, 3840, 3840, 3264]
    - [11, 30337.4]
  - - [3904, 3264, 1, 64, 3904, 3904, 3904, 3264]
    - [9, 28874.1]
  - - [3968, 3264, 1, 64, 3968, 3968, 3968, 3264]
    - [11, 23458.0]
  - - [4032, 3264, 1, 64, 4032, 4032, 4032, 3264]
    - [9, 17554.0]
  - - [4096, 3264, 1, 64, 4096, 4096, 4096, 3264]
    - [9, 15206.3]
  - - [64, 3328, 1, 64, 64, 64, 64, 3328]
    - [12, 2809.99]
  - - [128, 3328, 1, 64, 128, 128, 128, 3328]
    - [16, 4965.84]
  - - [192, 3328, 1, 64, 192, 192, 192, 3328]
    - [4, 6887.98]
  - - [256, 3328, 1, 64, 256, 256, 256, 3328]
    - [1, 8967.97]
  - - [320, 3328, 1, 64, 320, 320, 320, 3328]
    - [9, 10828.8]
  - - [384, 3328, 1, 64, 384, 384, 384, 3328]
    - [0, 11995.9]
  - - [448, 3328, 1, 64, 448, 448, 448, 3328]
    - [0, 13869.2]
  - - [512, 3328, 1, 64, 512, 512, 512, 3328]
    - [9, 13877.6]
  - - [576, 3328, 1, 64, 576, 576, 576, 3328]
    - [0, 15257.0]
  - - [640, 3328, 1, 64, 640, 640, 640, 3328]
    - [11, 16095.6]
  - - [704, 3328, 1, 64, 704, 704, 704, 3328]
    - [9, 16853.4]
  - - [768, 3328, 1, 64, 768, 768, 768, 3328]
    - [9, 17253.0]
  - - [832, 3328, 1, 64, 832, 832, 832, 3328]
    - [0, 18234.9]
  - - [896, 3328, 1, 64, 896, 896, 896, 3328]
    - [0, 19133.5]
  - - [960, 3328, 1, 64, 960, 960, 960, 3328]
    - [9, 19924.9]
  - - [1024, 3328, 1, 64, 1024, 1024, 1024, 3328]
    - [9, 19469.8]
  - - [1088, 3328, 1, 64, 1088, 1088, 1088, 3328]
    - [9, 20903.1]
  - - [1152, 3328, 1, 64, 1152, 1152, 1152, 3328]
    - [9, 21245.5]
  - - [1216, 3328, 1, 64, 1216, 1216, 1216, 3328]
    - [9, 21883.8]
  - - [1280, 3328, 1, 64, 1280, 1280, 1280, 3328]
    - [9, 22170.2]
  - - [1344, 3328, 1, 64, 1344, 1344, 1344, 3328]
    - [9, 22711.6]
  - - [1408, 3328, 1, 64, 1408, 1408, 1408, 3328]
    - [9, 23191.5]
  - - [1472, 3328, 1, 64, 1472, 1472, 1472, 3328]
    - [9, 23885.4]
  - - [1536, 3328, 1, 64, 1536, 1536, 1536, 3328]
    - [9, 22096.0]
  - - [1600, 3328, 1, 64, 1600, 1600, 1600, 3328]
    - [9, 24539.8]
  - - [1664, 3328, 1, 64, 1664, 1664, 1664, 3328]
    - [9, 24831.1]
  - - [1728, 3328, 1, 64, 1728, 1728, 1728, 3328]
    - [9, 25213.8]
  - - [1792, 3328, 1, 64, 1792, 1792, 1792, 3328]
    - [9, 25131.8]
  - - [1856, 3328, 1, 64, 1856, 1856, 1856, 3328]
    - [9, 26420.8]
  - - [1920, 3328, 1, 64, 1920, 1920, 1920, 3328]
    - [9, 25761.6]
  - - [1984, 3328, 1, 64, 1984, 1984, 1984, 3328]
    - [9, 27234.5]
  - - [2048, 3328, 1, 64, 2048, 2048, 2048, 3328]
    - [11, 24045.1]
  - - [2112, 3328, 1, 64, 2112, 2112, 2112, 3328]
    - [11, 27061.0]
  - - [2176, 3328, 1, 64, 2176, 2176, 2176, 3328]
    - [9, 26594.7]
  - - [2240, 3328, 1, 64, 2240, 2240, 2240, 3328]
    - [11, 27490.4]
  - - [2304, 3328, 1, 64, 2304, 2304, 2304, 3328]
    - [9, 27190.2]
  - - [2368, 3328, 1, 64, 2368, 2368, 2368, 3328]
    - [0, 27146.7]
  - - [2432, 3328, 1, 64, 2432, 2432, 2432, 3328]
    - [9, 28957.4]
  - - [2496, 3328, 1, 64, 2496, 2496, 2496, 3328]
    - [9, 29230.8]
  - - [2560, 3328, 1, 64, 2560, 2560, 2560, 3328]
    - [11, 27533.8]
  - - [2624, 3328, 1, 64, 2624, 2624, 2624, 3328]
    - [11, 29160.2]
  - - [2688, 3328, 1, 64, 2688, 2688, 2688, 3328]
    - [9, 28951.4]
  - - [2752, 3328, 1, 64, 2752, 2752, 2752, 3328]
    - [9, 30005.0]
  - - [2816, 3328, 1, 64, 2816, 2816, 2816, 3328]
    - [0, 28773.2]
  - - [2880, 3328, 1, 64, 2880, 2880, 2880, 3328]
    - [9, 30624.5]
  - - [2944, 3328, 1, 64, 2944, 2944, 2944, 3328]
    - [9, 30256.7]
  - - [3008, 3328, 1, 64, 3008, 3008, 3008, 3328]
    - [9, 29971.5]
  - - [3072, 3328, 1, 64, 3072, 3072, 3072, 3328]
    - [11, 26907.3]
  - - [3136, 3328, 1, 64, 3136, 3136, 3136, 3328]
    - [9, 31059.5]
  - - [3200, 3328, 1, 64, 3200, 3200, 3200, 3328]
    - [9, 29466.8]
  - - [3264, 3328, 1, 64, 3264, 3264, 3264, 3328]
    - [9, 31434.1]
  - - [3328, 3328, 1, 64, 3328, 3328, 3328, 3328]
    - [9, 32095.4]
  - - [3392, 3328, 1, 64, 3392, 3392, 3392, 3328]
    - [0, 30927.2]
  - - [3456, 3328, 1, 64, 3456, 3456, 3456, 3328]
    - [0, 30536.8]
  - - [3520, 3328, 1, 64, 3520, 3520, 3520, 3328]
    - [11, 30865.5]
  - - [3584, 3328, 1, 64, 3584, 3584, 3584, 3328]
    - [11, 30151.8]
  - - [3648, 3328, 1, 64, 3648, 3648, 3648, 3328]
    - [11, 31007.4]
  - - [3712, 3328, 1, 64, 3712, 3712, 3712, 3328]
    - [11, 30946.3]
  - - [3776, 3328, 1, 64, 3776, 3776, 3776, 3328]
    - [9, 30334.1]
  - - [3840, 3328, 1, 64, 3840, 3840, 3840, 3328]
    - [9, 26251.9]
  - - [3904, 3328, 1, 64, 3904, 3904, 3904, 3328]
    - [11, 21928.0]
  - - [3968, 3328, 1, 64, 3968, 3968, 3968, 3328]
    - [9, 18074.1]
  - - [4032, 3328, 1, 64, 4032, 4032, 4032, 3328]
    - [9, 14029.3]
  - - [4096, 3328, 1, 64, 4096, 4096, 4096, 3328]
    - [9, 14183.2]
  - - [64, 3392, 1, 64, 64, 64, 64, 3392]
    - [5, 2825.62]
  - - [128, 3392, 1, 64, 128, 128, 128, 3392]
    - [16, 5122.97]
  - - [192, 3392, 1, 64, 192, 192, 192, 3392]
    - [12, 7170.2]
  - - [256, 3392, 1, 64, 256, 256, 256, 3392]
    - [0, 8995.48]
  - - [320, 3392, 1, 64, 320, 320, 320, 3392]
    - [0, 11061.7]
  - - [384, 3392, 1, 64, 384, 384, 384, 3392]
    - [0, 12230.1]
  - - [448, 3392, 1, 64, 448, 448, 448, 3392]
    - [0, 13951.2]
  - - [512, 3392, 1, 64, 512, 512, 512, 3392]
    - [0, 14028.5]
  - - [576, 3392, 1, 64, 576, 576, 576, 3392]
    - [0, 15284.4]
  - - [640, 3392, 1, 64, 640, 640, 640, 3392]
    - [9, 16166.5]
  - - [704, 3392, 1, 64, 704, 704, 704, 3392]
    - [9, 16958.3]
  - - [768, 3392, 1, 64, 768, 768, 768, 3392]
    - [9, 17316.4]
  - - [832, 3392, 1, 64, 832, 832, 832, 3392]
    - [0, 18517.1]
  - - [896, 3392, 1, 64, 896, 896, 896, 3392]
    - [0, 19344.4]
  - - [960, 3392, 1, 64, 960, 960, 960, 3392]
    - [9, 20083.0]
  - - [1024, 3392, 1, 64, 1024, 1024, 1024, 3392]
    - [9, 19611.5]
  - - [1088, 3392, 1, 64, 1088, 1088, 1088, 3392]
    - [9, 21048.8]
  - - [1152, 3392, 1, 64, 1152, 1152, 1152, 3392]
    - [9, 21473.7]
  - - [1216, 3392, 1, 64, 1216, 1216, 1216, 3392]
    - [9, 22106.7]
  - - [1280, 3392, 1, 64, 1280, 1280, 1280, 3392]
    - [9, 22179.9]
  - - [1344, 3392, 1, 64, 1344, 1344, 1344, 3392]
    - [9, 22892.3]
  - - [1408, 3392, 1, 64, 1408, 1408, 1408, 3392]
    - [9, 23354.0]
  - - [1472, 3392, 1, 64, 1472, 1472, 1472, 3392]
    - [9, 24146.1]
  - - [1536, 3392, 1, 64, 1536, 1536, 1536, 3392]
    - [9, 22423.9]
  - - [1600, 3392, 1, 64, 1600, 1600, 1600, 3392]
    - [9, 24567.7]
  - - [1664, 3392, 1, 64, 1664, 1664, 1664, 3392]
    - [9, 24763.8]
  - - [1728, 3392, 1, 64, 1728, 1728, 1728, 3392]
    - [9, 24941.7]
  - - [1792, 3392, 1, 64, 1792, 1792, 1792, 3392]
    - [0, 24843.0]
  - - [1856, 3392, 1, 64, 1856, 1856, 1856, 3392]
    - [0, 25359.4]
  - - [1920, 3392, 1, 64, 1920, 1920, 1920, 3392]
    - [9, 26780.0]
  - - [1984, 3392, 1, 64, 1984, 1984, 1984, 3392]
    - [11, 25268.3]
  - - [2048, 3392, 1, 64, 2048, 2048, 2048, 3392]
    - [11, 23983.9]
  - - [2112, 3392, 1, 64, 2112, 2112, 2112, 3392]
    - [9, 27105.3]
  - - [2176, 3392, 1, 64, 2176, 2176, 2176, 3392]
    - [9, 27502.3]
  - - [2240, 3392, 1, 64, 2240, 2240, 2240, 3392]
    - [0, 27036.1]
  - - [2304, 3392, 1, 64, 2304, 2304, 2304, 3392]
    - [9, 27542.1]
  - - [2368, 3392, 1, 64, 2368, 2368, 2368, 3392]
    - [9, 28721.5]
  - - [2432, 3392, 1, 64, 2432, 2432, 2432, 3392]
    - [9, 27690.7]
  - - [2496, 3392, 1, 64, 2496, 2496, 2496, 3392]
    - [11, 29040.9]
  - - [2560, 3392, 1, 64, 2560, 2560, 2560, 3392]
    - [9, 29148.1]
  - - [2624, 3392, 1, 64, 2624, 2624, 2624, 3392]
    - [9, 29382.1]
  - - [2688, 3392, 1, 64, 2688, 2688, 2688, 3392]
    - [9, 29812.8]
  - - [2752, 3392, 1, 64, 2752, 2752, 2752, 3392]
    - [9, 29710.5]
  - - [2816, 3392, 1, 64, 2816, 2816, 2816, 3392]
    - [9, 29175.3]
  - - [2880, 3392, 1, 64, 2880, 2880, 2880, 3392]
    - [11, 29483.9]
  - - [2944, 3392, 1, 64, 2944, 2944, 2944, 3392]
    - [0, 29046.0]
  - - [3008, 3392, 1, 64, 3008, 3008, 3008, 3392]
    - [9, 29322.9]
  - - [3072, 3392, 1, 64, 3072, 3072, 3072, 3392]
    - [11, 26886.3]
  - - [3136, 3392, 1, 64, 3136, 3136, 3136, 3392]
    - [9, 30864.5]
  - - [3200, 3392, 1, 64, 3200, 3200, 3200, 3392]
    - [9, 29857.9]
  - - [3264, 3392, 1, 64, 3264, 3264, 3264, 3392]
    - [0, 30457.7]
  - - [3328, 3392, 1, 64, 3328, 3328, 3328, 3392]
    - [9, 31705.0]
  - - [3392, 3392, 1, 64, 3392, 3392, 3392, 3392]
    - [9, 32023.7]
  - - [3456, 3392, 1, 64, 3456, 3456, 3456, 3392]
    - [0, 30285.0]
  - - [3520, 3392, 1, 64, 3520, 3520, 3520, 3392]
    - [9, 32403.5]
  - - [3584, 3392, 1, 64, 3584, 3584, 3584, 3392]
    - [11, 30270.2]
  - - [3648, 3392, 1, 64, 3648, 3648, 3648, 3392]
    - [11, 30594.1]
  - - [3712, 3392, 1, 64, 3712, 3712, 3712, 3392]
    - [11, 29178.4]
  - - [3776, 3392, 1, 64, 3776, 3776, 3776, 3392]
    - [0, 25369.5]
  - - [3840, 3392, 1, 64, 3840, 3840, 3840, 3392]
    - [9, 20912.4]
  - - [3904, 3392, 1, 64, 3904, 3904, 3904, 3392]
    - [9, 16457.9]
  - - [3968, 3392, 1, 64, 3968, 3968, 3968, 3392]
    - [9, 14709.6]
  - - [4032, 3392, 1, 64, 4032, 4032, 4032, 3392]
    - [9, 13263.1]
  - - [4096, 3392, 1, 64, 4096, 4096, 4096, 3392]
    - [9, 13523.7]
  - - [64, 3456, 1, 64, 64, 64, 64, 3456]
    - [19, 2766.91]
  - - [128, 3456, 1, 64, 128, 128, 128, 3456]
    - [7, 5278.98]
  - - [192, 3456, 1, 64, 192, 192, 192, 3456]
    - [2, 7306.74]
  - - [256, 3456, 1, 64, 256, 256, 256, 3456]
    - [1, 9427.64]
  - - [320, 3456, 1, 64, 320, 320, 320, 3456]
    - [0, 11118.1]
  - - [384, 3456, 1, 64, 384, 384, 384, 3456]
    - [0, 12451.8]
  - - [448, 3456, 1, 64, 448, 448, 448, 3456]
    - [0, 14214.5]
  - - [512, 3456, 1, 64, 512, 512, 512, 3456]
    - [0, 14212.5]
  - - [576, 3456, 1, 64, 576, 576, 576, 3456]
    - [0, 15425.7]
  - - [640, 3456, 1, 64, 640, 640, 640, 3456]
    - [9, 16385.7]
  - - [704, 3456, 1, 64, 704, 704, 704, 3456]
    - [9, 17143.2]
  - - [768, 3456, 1, 64, 768, 768, 768, 3456]
    - [9, 17501.3]
  - - [832, 3456, 1, 64, 832, 832, 832, 3456]
    - [0, 18707.2]
  - - [896, 3456, 1, 64, 896, 896, 896, 3456]
    - [0, 19550.0]
  - - [960, 3456, 1, 64, 960, 960, 960, 3456]
    - [9, 20134.1]
  - - [1024, 3456, 1, 64, 1024, 1024, 1024, 3456]
    - [9, 19713.6]
  - - [1088, 3456, 1, 64, 1088, 1088, 1088, 3456]
    - [9, 21273.4]
  - - [1152, 3456, 1, 64, 1152, 1152, 1152, 3456]
    - [9, 21442.5]
  - - [1216, 3456, 1, 64, 1216, 1216, 1216, 3456]
    - [9, 22042.0]
  - - [1280, 3456, 1, 64, 1280, 1280, 1280, 3456]
    - [9, 22431.8]
  - - [1344, 3456, 1, 64, 1344, 1344, 1344, 3456]
    - [11, 23110.3]
  - - [1408, 3456, 1, 64, 1408, 1408, 1408, 3456]
    - [9, 23684.2]
  - - [1472, 3456, 1, 64, 1472, 1472, 1472, 3456]
    - [9, 24349.7]
  - - [1536, 3456, 1, 64, 1536, 1536, 1536, 3456]
    - [9, 22504.9]
  - - [1600, 3456, 1, 64, 1600, 1600, 1600, 3456]
    - [9, 24591.1]
  - - [1664, 3456, 1, 64, 1664, 1664, 1664, 3456]
    - [0, 24188.1]
  - - [1728, 3456, 1, 64, 1728, 1728, 1728, 3456]
    - [9, 25793.1]
  - - [1792, 3456, 1, 64, 1792, 1792, 1792, 3456]
    - [0, 24984.7]
  - - [1856, 3456, 1, 64, 1856, 1856, 1856, 3456]
    - [11, 25642.6]
  - - [1920, 3456, 1, 64, 1920, 1920, 1920, 3456]
    - [9, 26793.0]
  - - [1984, 3456, 1, 64, 1984, 1984, 1984, 3456]
    - [0, 26746.1]
  - - [2048, 3456, 1, 64, 2048, 2048, 2048, 3456]
    - [11, 24435.2]
  - - [2112, 3456, 1, 64, 2112, 2112, 2112, 3456]
    - [9, 27425.3]
  - - [2176, 3456, 1, 64, 2176, 2176, 2176, 3456]
    - [11, 27139.5]
  - - [2240, 3456, 1, 64, 2240, 2240, 2240, 3456]
    - [9, 26471.8]
  - - [2304, 3456, 1, 64, 2304, 2304, 2304, 3456]
    - [9, 27190.3]
  - - [2368, 3456, 1, 64, 2368, 2368, 2368, 3456]
    - [9, 28919.3]
  - - [2432, 3456, 1, 64, 2432, 2432, 2432, 3456]
    - [9, 28483.7]
  - - [2496, 3456, 1, 64, 2496, 2496, 2496, 3456]
    - [11, 28003.9]
  - - [2560, 3456, 1, 64, 2560, 2560, 2560, 3456]
    - [9, 28893.5]
  - - [2624, 3456, 1, 64, 2624, 2624, 2624, 3456]
    - [0, 29119.4]
  - - [2688, 3456, 1, 64, 2688, 2688, 2688, 3456]
    - [9, 29225.5]
  - - [2752, 3456, 1, 64, 2752, 2752, 2752, 3456]
    - [9, 29703.9]
  - - [2816, 3456, 1, 64, 2816, 2816, 2816, 3456]
    - [9, 30207.4]
  - - [2880, 3456, 1, 64, 2880, 2880, 2880, 3456]
    - [9, 29245.7]
  - - [2944, 3456, 1, 64, 2944, 2944, 2944, 3456]
    - [9, 30043.3]
  - - [3008, 3456, 1, 64, 3008, 3008, 3008, 3456]
    - [0, 29721.4]
  - - [3072, 3456, 1, 64, 3072, 3072, 3072, 3456]
    - [9, 27446.6]
  - - [3136, 3456, 1, 64, 3136, 3136, 3136, 3456]
    - [9, 28029.8]
  - - [3200, 3456, 1, 64, 3200, 3200, 3200, 3456]
    - [11, 30610.8]
  - - [3264, 3456, 1, 64, 3264, 3264, 3264, 3456]
    - [0, 29898.9]
  - - [3328, 3456, 1, 64, 3328, 3328, 3328, 3456]
    - [9, 29503.8]
  - - [3392, 3456, 1, 64, 3392, 3392, 3392, 3456]
    - [9, 31229.2]
  - - [3456, 3456, 1, 64, 3456, 3456, 3456, 3456]
    - [9, 31526.9]
  - - [3520, 3456, 1, 64, 3520, 3520, 3520, 3456]
    - [11, 28813.1]
  - - [3584, 3456, 1, 64, 3584, 3584, 3584, 3456]
    - [0, 30187.1]
  - - [3648, 3456, 1, 64, 3648, 3648, 3648, 3456]
    - [11, 30875.5]
  - - [3712, 3456, 1, 64, 3712, 3712, 3712, 3456]
    - [9, 25892.5]
  - - [3776, 3456, 1, 64, 3776, 3776, 3776, 3456]
    - [9, 19500.8]
  - - [3840, 3456, 1, 64, 3840, 3840, 3840, 3456]
    - [9, 15921.9]
  - - [3904, 3456, 1, 64, 3904, 3904, 3904, 3456]
    - [9, 13888.5]
  - - [3968, 3456, 1, 64, 3968, 3968, 3968, 3456]
    - [9, 13772.0]
  - - [4032, 3456, 1, 64, 4032, 4032, 4032, 3456]
    - [9, 12607.3]
  - - [4096, 3456, 1, 64, 4096, 4096, 4096, 3456]
    - [0, 13029.6]
  - - [64, 3520, 1, 64, 64, 64, 64, 3520]
    - [2, 2842.05]
  - - [128, 3520, 1, 64, 128, 128, 128, 3520]
    - [5, 5332.02]
  - - [192, 3520, 1, 64, 192, 192, 192, 3520]
    - [2, 7487.14]
  - - [256, 3520, 1, 64, 256, 256, 256, 3520]
    - [0, 9274.84]
  - - [320, 3520, 1, 64, 320, 320, 320, 3520]
    - [0, 11565.7]
  - - [384, 3520, 1, 64, 384, 384, 384, 3520]
    - [0, 12654.5]
  - - [448, 3520, 1, 64, 448, 448, 448, 3520]
    - [9, 13666.1]
  - - [512, 3520, 1, 64, 512, 512, 512, 3520]
    - [0, 14362.0]
  - - [576, 3520, 1, 64, 576, 576, 576, 3520]
    - [0, 15609.3]
  - - [640, 3520, 1, 64, 640, 640, 640, 3520]
    - [9, 16458.6]
  - - [704, 3520, 1, 64, 704, 704, 704, 3520]
    - [9, 17268.6]
  - - [768, 3520, 1, 64, 768, 768, 768, 3520]
    - [9, 17467.3]
  - - [832, 3520, 1, 64, 832, 832, 832, 3520]
    - [9, 18938.1]
  - - [896, 3520, 1, 64, 896, 896, 896, 3520]
    - [9, 19669.5]
  - - [960, 3520, 1, 64, 960, 960, 960, 3520]
    - [9, 20322.0]
  - - [1024, 3520, 1, 64, 1024, 1024, 1024, 3520]
    - [9, 19821.6]
  - - [1088, 3520, 1, 64, 1088, 1088, 1088, 3520]
    - [9, 21455.0]
  - - [1152, 3520, 1, 64, 1152, 1152, 1152, 3520]
    - [9, 21666.3]
  - - [1216, 3520, 1, 64, 1216, 1216, 1216, 3520]
    - [9, 22202.7]
  - - [1280, 3520, 1, 64, 1280, 1280, 1280, 3520]
    - [9, 22726.5]
  - - [1344, 3520, 1, 64, 1344, 1344, 1344, 3520]
    - [9, 23324.4]
  - - [1408, 3520, 1, 64, 1408, 1408, 1408, 3520]
    - [9, 23850.8]
  - - [1472, 3520, 1, 64, 1472, 1472, 1472, 3520]
    - [9, 24263.4]
  - - [1536, 3520, 1, 64, 1536, 1536, 1536, 3520]
    - [9, 22505.8]
  - - [1600, 3520, 1, 64, 1600, 1600, 1600, 3520]
    - [9, 24737.1]
  - - [1664, 3520, 1, 64, 1664, 1664, 1664, 3520]
    - [9, 24683.1]
  - - [1728, 3520, 1, 64, 1728, 1728, 1728, 3520]
    - [0, 24899.5]
  - - [1792, 3520, 1, 64, 1792, 1792, 1792, 3520]
    - [9, 25102.4]
  - - [1856, 3520, 1, 64, 1856, 1856, 1856, 3520]
    - [9, 26456.3]
  - - [1920, 3520, 1, 64, 1920, 1920, 1920, 3520]
    - [11, 25988.8]
  - - [1984, 3520, 1, 64, 1984, 1984, 1984, 3520]
    - [11, 26586.7]
  - - [2048, 3520, 1, 64, 2048, 2048, 2048, 3520]
    - [11, 23595.7]
  - - [2112, 3520, 1, 64, 2112, 2112, 2112, 3520]
    - [9, 27495.7]
  - - [2176, 3520, 1, 64, 2176, 2176, 2176, 3520]
    - [9, 28231.1]
  - - [2240, 3520, 1, 64, 2240, 2240, 2240, 3520]
    - [0, 27972.3]
  - - [2304, 3520, 1, 64, 2304, 2304, 2304, 3520]
    - [0, 27024.8]
  - - [2368, 3520, 1, 64, 2368, 2368, 2368, 3520]
    - [11, 28226.6]
  - - [2432, 3520, 1, 64, 2432, 2432, 2432, 3520]
    - [9, 28274.5]
  - - [2496, 3520, 1, 64, 2496, 2496, 2496, 3520]
    - [11, 29116.1]
  - - [2560, 3520, 1, 64, 2560, 2560, 2560, 3520]
    - [11, 28633.6]
  - - [2624, 3520, 1, 64, 2624, 2624, 2624, 3520]
    - [9, 30256.9]
  - - [2688, 3520, 1, 64, 2688, 2688, 2688, 3520]
    - [9, 28245.0]
  - - [2752, 3520, 1, 64, 2752, 2752, 2752, 3520]
    - [11, 29446.3]
  - - [2816, 3520, 1, 64, 2816, 2816, 2816, 3520]
    - [11, 28869.6]
  - - [2880, 3520, 1, 64, 2880, 2880, 2880, 3520]
    - [9, 30303.6]
  - - [2944, 3520, 1, 64, 2944, 2944, 2944, 3520]
    - [0, 28178.8]
  - - [3008, 3520, 1, 64, 3008, 3008, 3008, 3520]
    - [9, 28444.5]
  - - [3072, 3520, 1, 64, 3072, 3072, 3072, 3520]
    - [11, 28616.1]
  - - [3136, 3520, 1, 64, 3136, 3136, 3136, 3520]
    - [11, 30593.6]
  - - [3200, 3520, 1, 64, 3200, 3200, 3200, 3520]
    - [9, 32306.5]
  - - [3264, 3520, 1, 64, 3264, 3264, 3264, 3520]
    - [9, 30709.4]
  - - [3328, 3520, 1, 64, 3328, 3328, 3328, 3520]
    - [9, 31609.8]
  - - [3392, 3520, 1, 64, 3392, 3392, 3392, 3520]
    - [11, 30865.6]
  - - [3456, 3520, 1, 64, 3456, 3456, 3456, 3520]
    - [0, 30865.8]
  - - [3520, 3520, 1, 64, 3520, 3520, 3520, 3520]
    - [11, 30652.3]
  - - [3584, 3520, 1, 64, 3584, 3584, 3584, 3520]
    - [0, 28972.0]
  - - [3648, 3520, 1, 64, 3648, 3648, 3648, 3520]
    - [9, 25852.9]
  - - [3712, 3520, 1, 64, 3712, 3712, 3712, 3520]
    - [9, 19942.0]
  - - [3776, 3520, 1, 64, 3776, 3776, 3776, 3520]
    - [0, 14835.4]
  - - [3840, 3520, 1, 64, 3840, 3840, 3840, 3520]
    - [9, 14097.5]
  - - [3904, 3520, 1, 64, 3904, 3904, 3904, 3520]
    - [9, 13010.7]
  - - [3968, 3520, 1, 64, 3968, 3968, 3968, 3520]
    - [9, 12942.5]
  - - [4032, 3520, 1, 64, 4032, 4032, 4032, 3520]
    - [8, 12046.6]
  - - [4096, 3520, 1, 64, 4096, 4096, 4096, 3520]
    - [0, 12808.5]
  - - [64, 3584, 1, 64, 64, 64, 64, 3584]
    - [7, 2960.85]
  - - [128, 3584, 1, 64, 128, 128, 128, 3584]
    - [7, 5195.54]
  - - [192, 3584, 1, 64, 192, 192, 192, 3584]
    - [9, 7516.58]
  - - [256, 3584, 1, 64, 256, 256, 256, 3584]
    - [11, 9369.64]
  - - [320, 3584, 1, 64, 320, 320, 320, 3584]
    - [0, 11613.9]
  - - [384, 3584, 1, 64, 384, 384, 384, 3584]
    - [0, 12808.0]
  - - [448, 3584, 1, 64, 448, 448, 448, 3584]
    - [9, 13795.1]
  - - [512, 3584, 1, 64, 512, 512, 512, 3584]
    - [0, 14583.3]
  - - [576, 3584, 1, 64, 576, 576, 576, 3584]
    - [9, 15719.1]
  - - [640, 3584, 1, 64, 640, 640, 640, 3584]
    - [9, 16604.3]
  - - [704, 3584, 1, 64, 704, 704, 704, 3584]
    - [9, 17337.3]
  - - [768, 3584, 1, 64, 768, 768, 768, 3584]
    - [9, 17586.0]
  - - [832, 3584, 1, 64, 832, 832, 832, 3584]
    - [9, 19162.4]
  - - [896, 3584, 1, 64, 896, 896, 896, 3584]
    - [9, 19831.9]
  - - [960, 3584, 1, 64, 960, 960, 960, 3584]
    - [9, 20337.9]
  - - [1024, 3584, 1, 64, 1024, 1024, 1024, 3584]
    - [9, 20195.9]
  - - [1088, 3584, 1, 64, 1088, 1088, 1088, 3584]
    - [9, 21590.0]
  - - [1152, 3584, 1, 64, 1152, 1152, 1152, 3584]
    - [9, 21818.0]
  - - [1216, 3584, 1, 64, 1216, 1216, 1216, 3584]
    - [9, 22155.7]
  - - [1280, 3584, 1, 64, 1280, 1280, 1280, 3584]
    - [9, 22994.8]
  - - [1344, 3584, 1, 64, 1344, 1344, 1344, 3584]
    - [9, 23572.3]
  - - [1408, 3584, 1, 64, 1408, 1408, 1408, 3584]
    - [9, 23873.3]
  - - [1472, 3584, 1, 64, 1472, 1472, 1472, 3584]
    - [9, 24445.2]
  - - [1536, 3584, 1, 64, 1536, 1536, 1536, 3584]
    - [9, 22383.6]
  - - [1600, 3584, 1, 64, 1600, 1600, 1600, 3584]
    - [9, 24832.3]
  - - [1664, 3584, 1, 64, 1664, 1664, 1664, 3584]
    - [9, 24803.5]
  - - [1728, 3584, 1, 64, 1728, 1728, 1728, 3584]
    - [11, 25057.4]
  - - [1792, 3584, 1, 64, 1792, 1792, 1792, 3584]
    - [9, 26652.6]
  - - [1856, 3584, 1, 64, 1856, 1856, 1856, 3584]
    - [9, 25958.3]
  - - [1920, 3584, 1, 64, 1920, 1920, 1920, 3584]
    - [9, 27367.5]
  - - [1984, 3584, 1, 64, 1984, 1984, 1984, 3584]
    - [9, 27530.3]
  - - [2048, 3584, 1, 64, 2048, 2048, 2048, 3584]
    - [0, 23995.3]
  - - [2112, 3584, 1, 64, 2112, 2112, 2112, 3584]
    - [11, 26502.3]
  - - [2176, 3584, 1, 64, 2176, 2176, 2176, 3584]
    - [9, 28270.5]
  - - [2240, 3584, 1, 64, 2240, 2240, 2240, 3584]
    - [9, 27872.2]
  - - [2304, 3584, 1, 64, 2304, 2304, 2304, 3584]
    - [0, 27088.8]
  - - [2368, 3584, 1, 64, 2368, 2368, 2368, 3584]
    - [11, 27390.6]
  - - [2432, 3584, 1, 64, 2432, 2432, 2432, 3584]
    - [9, 29105.5]
  - - [2496, 3584, 1, 64, 2496, 2496, 2496, 3584]
    - [9, 30126.1]
  - - [2560, 3584, 1, 64, 2560, 2560, 2560, 3584]
    - [9, 28408.0]
  - - [2624, 3584, 1, 64, 2624, 2624, 2624, 3584]
    - [9, 30048.7]
  - - [2688, 3584, 1, 64, 2688, 2688, 2688, 3584]
    - [9, 28461.1]
  - - [2752, 3584, 1, 64, 2752, 2752, 2752, 3584]
    - [9, 30597.9]
  - - [2816, 3584, 1, 64, 2816, 2816, 2816, 3584]
    - [9, 30146.3]
  - - [2880, 3584, 1, 64, 2880, 2880, 2880, 3584]
    - [0, 29401.5]
  - - [2944, 3584, 1, 64, 2944, 2944, 2944, 3584]
    - [9, 30981.5]
  - - [3008, 3584, 1, 64, 3008, 3008, 3008, 3584]
    - [9, 30913.3]
  - - [3072, 3584, 1, 64, 3072, 3072, 3072, 3584]
    - [11, 28122.4]
  - - [3136, 3584, 1, 64, 3136, 3136, 3136, 3584]
    - [11, 29961.4]
  - - [3200, 3584, 1, 64, 3200, 3200, 3200, 3584]
    - [9, 30769.0]
  - - [3264, 3584, 1, 64, 3264, 3264, 3264, 3584]
    - [11, 29680.9]
  - - [3328, 3584, 1, 64, 3328, 3328, 3328, 3584]
    - [9, 29146.7]
  - - [3392, 3584, 1, 64, 3392, 3392, 3392, 3584]
    - [0, 29592.0]
  - - [3456, 3584, 1, 64, 3456, 3456, 3456, 3584]
    - [0, 30129.8]
  - - [3520, 3584, 1, 64, 3520, 3520, 3520, 3584]
    - [9, 28756.4]
  - - [3584, 3584, 1, 64, 3584, 3584, 3584, 3584]
    - [9, 25438.6]
  - - [3648, 3584, 1, 64, 3648, 3648, 3648, 3584]
    - [9, 20034.8]
  - - [3712, 3584, 1, 64, 3712, 3712, 3712, 3584]
    - [9, 15103.3]
  - - [3776, 3584, 1, 64, 3776, 3776, 3776, 3584]
    - [0, 13391.8]
  - - [3840, 3584, 1, 64, 3840, 3840, 3840, 3584]
    - [9, 13546.1]
  - - [3904, 3584, 1, 64, 3904, 3904, 3904, 3584]
    - [9, 12351.0]
  - - [3968, 3584, 1, 64, 3968, 3968, 3968, 3584]
    - [9, 12337.7]
  - - [4032, 3584, 1, 64, 4032, 4032, 4032, 3584]
    - [13, 12032.8]
  - - [4096, 3584, 1, 64, 4096, 4096, 4096, 3584]
    - [1, 12577.5]
  - - [64, 3648, 1, 64, 64, 64, 64, 3648]
    - [1, 2706.87]
  - - [128, 3648, 1, 64, 128, 128, 128, 3648]
    - [7, 5430.49]
  - - [192, 3648, 1, 64, 192, 192, 192, 3648]
    - [1, 7352.15]
  - - [256, 3648, 1, 64, 256, 256, 256, 3648]
    - [11, 8954.07]
  - - [320, 3648, 1, 64, 320, 320, 320, 3648]
    - [0, 11369.7]
  - - [384, 3648, 1, 64, 384, 384, 384, 3648]
    - [11, 12291.2]
  - - [448, 3648, 1, 64, 448, 448, 448, 3648]
    - [9, 13918.0]
  - - [512, 3648, 1, 64, 512, 512, 512, 3648]
    - [0, 14652.7]
  - - [576, 3648, 1, 64, 576, 576, 576, 3648]
    - [9, 16047.5]
  - - [640, 3648, 1, 64, 640, 640, 640, 3648]
    - [9, 16671.0]
  - - [704, 3648, 1, 64, 704, 704, 704, 3648]
    - [9, 17652.5]
  - - [768, 3648, 1, 64, 768, 768, 768, 3648]
    - [0, 17788.1]
  - - [832, 3648, 1, 64, 832, 832, 832, 3648]
    - [0, 19424.6]
  - - [896, 3648, 1, 64, 896, 896, 896, 3648]
    - [9, 20008.6]
  - - [960, 3648, 1, 64, 960, 960, 960, 3648]
    - [9, 20351.5]
  - - [1024, 3648, 1, 64, 1024, 1024, 1024, 3648]
    - [9, 20291.4]
  - - [1088, 3648, 1, 64, 1088, 1088, 1088, 3648]
    - [9, 21612.8]
  - - [1152, 3648, 1, 64, 1152, 1152, 1152, 3648]
    - [9, 21672.6]
  - - [1216, 3648, 1, 64, 1216, 1216, 1216, 3648]
    - [9, 22485.2]
  - - [1280, 3648, 1, 64, 1280, 1280, 1280, 3648]
    - [9, 22913.7]
  - - [1344, 3648, 1, 64, 1344, 1344, 1344, 3648]
    - [9, 23667.4]
  - - [1408, 3648, 1, 64, 1408, 1408, 1408, 3648]
    - [9, 23933.4]
  - - [1472, 3648, 1, 64, 1472, 1472, 1472, 3648]
    - [9, 24540.6]
  - - [1536, 3648, 1, 64, 1536, 1536, 1536, 3648]
    - [9, 22632.3]
  - - [1600, 3648, 1, 64, 1600, 1600, 1600, 3648]
    - [9, 24970.0]
  - - [1664, 3648, 1, 64, 1664, 1664, 1664, 3648]
    - [9, 25388.5]
  - - [1728, 3648, 1, 64, 1728, 1728, 1728, 3648]
    - [9, 26178.4]
  - - [1792, 3648, 1, 64, 1792, 1792, 1792, 3648]
    - [11, 25902.5]
  - - [1856, 3648, 1, 64, 1856, 1856, 1856, 3648]
    - [9, 27211.7]
  - - [1920, 3648, 1, 64, 1920, 1920, 1920, 3648]
    - [9, 26612.5]
  - - [1984, 3648, 1, 64, 1984, 1984, 1984, 3648]
    - [9, 27765.0]
  - - [2048, 3648, 1, 64, 2048, 2048, 2048, 3648]
    - [0, 24326.8]
  - - [2112, 3648, 1, 64, 2112, 2112, 2112, 3648]
    - [9, 27743.6]
  - - [2176, 3648, 1, 64, 2176, 2176, 2176, 3648]
    - [9, 27578.8]
  - - [2240, 3648, 1, 64, 2240, 2240, 2240, 3648]
    - [11, 27344.9]
  - - [2304, 3648, 1, 64, 2304, 2304, 2304, 3648]
    - [0, 27434.7]
  - - [2368, 3648, 1, 64, 2368, 2368, 2368, 3648]
    - [9, 28614.2]
  - - [2432, 3648, 1, 64, 2432, 2432, 2432, 3648]
    - [9, 28213.5]
  - - [2496, 3648, 1, 64, 2496, 2496, 2496, 3648]
    - [9, 28765.9]
  - - [2560, 3648, 1, 64, 2560, 2560, 2560, 3648]
    - [9, 28288.6]
  - - [2624, 3648, 1, 64, 2624, 2624, 2624, 3648]
    - [0, 29480.0]
  - - [2688, 3648, 1, 64, 2688, 2688, 2688, 3648]
    - [9, 29343.3]
  - - [2752, 3648, 1, 64, 2752, 2752, 2752, 3648]
    - [9, 28623.3]
  - - [2816, 3648, 1, 64, 2816, 2816, 2816, 3648]
    - [9, 28203.4]
  - - [2880, 3648, 1, 64, 2880, 2880, 2880, 3648]
    - [9, 30911.7]
  - - [2944, 3648, 1, 64, 2944, 2944, 2944, 3648]
    - [9, 31025.2]
  - - [3008, 3648, 1, 64, 3008, 3008, 3008, 3648]
    - [11, 30458.2]
  - - [3072, 3648, 1, 64, 3072, 3072, 3072, 3648]
    - [9, 28573.2]
  - - [3136, 3648, 1, 64, 3136, 3136, 3136, 3648]
    - [0, 29523.7]
  - - [3200, 3648, 1, 64, 3200, 3200, 3200, 3648]
    - [0, 30540.1]
  - - [3264, 3648, 1, 64, 3264, 3264, 3264, 3648]
    - [11, 31083.5]
  - - [3328, 3648, 1, 64, 3328, 3328, 3328, 3648]
    - [0, 29881.8]
  - - [3392, 3648, 1, 64, 3392, 3392, 3392, 3648]
    - [11, 31379.6]
  - - [3456, 3648, 1, 64, 3456, 3456, 3456, 3648]
    - [0, 30235.6]
  - - [3520, 3648, 1, 64, 3520, 3520, 3520, 3648]
    - [9, 25725.0]
  - - [3584, 3648, 1, 64, 3584, 3584, 3584, 3648]
    - [9, 19851.8]
  - - [3648, 3648, 1, 64, 3648, 3648, 3648, 3648]
    - [9, 15283.1]
  - - [3712, 3648, 1, 64, 3712, 3712, 3712, 3648]
    - [9, 13768.9]
  - - [3776, 3648, 1, 64, 3776, 3776, 3776, 3648]
    - [9, 12830.8]
  - - [3840, 3648, 1, 64, 3840, 3840, 3840, 3648]
    - [9, 12773.0]
  - - [3904, 3648, 1, 64, 3904, 3904, 3904, 3648]
    - [1, 12086.9]
  - - [3968, 3648, 1, 64, 3968, 3968, 3968, 3648]
    - [1, 12175.0]
  - - [4032, 3648, 1, 64, 4032, 4032, 4032, 3648]
    - [13, 11922.6]
  - - [4096, 3648, 1, 64, 4096, 4096, 4096, 3648]
    - [1, 12604.1]
  - - [64, 3712, 1, 64, 64, 64, 64, 3712]
    - [13, 2868.71]
  - - [128, 3712, 1, 64, 128, 128, 128, 3712]
    - [3, 5329.18]
  - - [192, 3712, 1, 64, 192, 192, 192, 3712]
    - [1, 7340.31]
  - - [256, 3712, 1, 64, 256, 256, 256, 3712]
    - [11, 9339.21]
  - - [320, 3712, 1, 64, 320, 320, 320, 3712]
    - [9, 11115.9]
  - - [384, 3712, 1, 64, 384, 384, 384, 3712]
    - [0, 12654.4]
  - - [448, 3712, 1, 64, 448, 448, 448, 3712]
    - [9, 14128.4]
  - - [512, 3712, 1, 64, 512, 512, 512, 3712]
    - [9, 14686.5]
  - - [576, 3712, 1, 64, 576, 576, 576, 3712]
    - [0, 16013.8]
  - - [640, 3712, 1, 64, 640, 640, 640, 3712]
    - [9, 16733.6]
  - - [704, 3712, 1, 64, 704, 704, 704, 3712]
    - [9, 17603.0]
  - - [768, 3712, 1, 64, 768, 768, 768, 3712]
    - [0, 18034.0]
  - - [832, 3712, 1, 64, 832, 832, 832, 3712]
    - [0, 19529.2]
  - - [896, 3712, 1, 64, 896, 896, 896, 3712]
    - [9, 20033.8]
  - - [960, 3712, 1, 64, 960, 960, 960, 3712]
    - [9, 20687.8]
  - - [1024, 3712, 1, 64, 1024, 1024, 1024, 3712]
    - [9, 20272.2]
  - - [1088, 3712, 1, 64, 1088, 1088, 1088, 3712]
    - [9, 21758.7]
  - - [1152, 3712, 1, 64, 1152, 1152, 1152, 3712]
    - [9, 21775.5]
  - - [1216, 3712, 1, 64, 1216, 1216, 1216, 3712]
    - [9, 22714.2]
  - - [1280, 3712, 1, 64, 1280, 1280, 1280, 3712]
    - [9, 22868.6]
  - - [1344, 3712, 1, 64, 1344, 1344, 1344, 3712]
    - [9, 23788.4]
  - - [1408, 3712, 1, 64, 1408, 1408, 1408, 3712]
    - [9, 24052.0]
  - - [1472, 3712, 1, 64, 1472, 1472, 1472, 3712]
    - [9, 24616.1]
  - - [1536, 3712, 1, 64, 1536, 1536, 1536, 3712]
    - [9, 22567.9]
  - - [1600, 3712, 1, 64, 1600, 1600, 1600, 3712]
    - [11, 24540.3]
  - - [1664, 3712, 1, 64, 1664, 1664, 1664, 3712]
    - [9, 25126.1]
  - - [1728, 3712, 1, 64, 1728, 1728, 1728, 3712]
    - [9, 25795.8]
  - - [1792, 3712, 1, 64, 1792, 1792, 1792, 3712]
    - [9, 27145.2]
  - - [1856, 3712, 1, 64, 1856, 1856, 1856, 3712]
    - [0, 26776.1]
  - - [1920, 3712, 1, 64, 1920, 1920, 1920, 3712]
    - [9, 27475.8]
  - - [1984, 3712, 1, 64, 1984, 1984, 1984, 3712]
    - [9, 27661.8]
  - - [2048, 3712, 1, 64, 2048, 2048, 2048, 3712]
    - [9, 24967.0]
  - - [2112, 3712, 1, 64, 2112, 2112, 2112, 3712]
    - [11, 26865.4]
  - - [2176, 3712, 1, 64, 2176, 2176, 2176, 3712]
    - [11, 27523.3]
  - - [2240, 3712, 1, 64, 2240, 2240, 2240, 3712]
    - [11, 27355.4]
  - - [2304, 3712, 1, 64, 2304, 2304, 2304, 3712]
    - [11, 27950.2]
  - - [2368, 3712, 1, 64, 2368, 2368, 2368, 3712]
    - [9, 29460.8]
  - - [2432, 3712, 1, 64, 2432, 2432, 2432, 3712]
    - [9, 28836.0]
  - - [2496, 3712, 1, 64, 2496, 2496, 2496, 3712]
    - [9, 29409.8]
  - - [2560, 3712, 1, 64, 2560, 2560, 2560, 3712]
    - [9, 28027.5]
  - - [2624, 3712, 1, 64, 2624, 2624, 2624, 3712]
    - [11, 29646.2]
  - - [2688, 3712, 1, 64, 2688, 2688, 2688, 3712]
    - [9, 28558.7]
  - - [2752, 3712, 1, 64, 2752, 2752, 2752, 3712]
    - [11, 29776.8]
  - - [2816, 3712, 1, 64, 2816, 2816, 2816, 3712]
    - [0, 28583.0]
  - - [2880, 3712, 1, 64, 2880, 2880, 2880, 3712]
    - [9, 30100.7]
  - - [2944, 3712, 1, 64, 2944, 2944, 2944, 3712]
    - [9, 30563.8]
  - - [3008, 3712, 1, 64, 3008, 3008, 3008, 3712]
    - [0, 31012.8]
  - - [3072, 3712, 1, 64, 3072, 3072, 3072, 3712]
    - [9, 28256.1]
  - - [3136, 3712, 1, 64, 3136, 3136, 3136, 3712]
    - [9, 32530.1]
  - - [3200, 3712, 1, 64, 3200, 3200, 3200, 3712]
    - [0, 30307.7]
  - - [3264, 3712, 1, 64, 3264, 3264, 3264, 3712]
    - [0, 30683.9]
  - - [3328, 3712, 1, 64, 3328, 3328, 3328, 3712]
    - [9, 32127.1]
  - - [3392, 3712, 1, 64, 3392, 3392, 3392, 3712]
    - [0, 31120.0]
  - - [3456, 3712, 1, 64, 3456, 3456, 3456, 3712]
    - [9, 25967.0]
  - - [3520, 3712, 1, 64, 3520, 3520, 3520, 3712]
    - [9, 19988.3]
  - - [3584, 3712, 1, 64, 3584, 3584, 3584, 3712]
    - [9, 15677.3]
  - - [3648, 3712, 1, 64, 3648, 3648, 3648, 3712]
    - [9, 13717.4]
  - - [3712, 3712, 1, 64, 3712, 3712, 3712, 3712]
    - [9, 13314.4]
  - - [3776, 3712, 1, 64, 3776, 3776, 3776, 3712]
    - [0, 12285.4]
  - - [3840, 3712, 1, 64, 3840, 3840, 3840, 3712]
    - [0, 12194.6]
  - - [3904, 3712, 1, 64, 3904, 3904, 3904, 3712]
    - [13, 12060.8]
  - - [3968, 3712, 1, 64, 3968, 3968, 3968, 3712]
    - [1, 11826.2]
  - - [4032, 3712, 1, 64, 4032, 4032, 4032, 3712]
    - [13, 12037.5]
  - - [4096, 3712, 1, 64, 4096, 4096, 4096, 3712]
    - [1, 12667.3]
  - - [64, 3776, 1, 64, 64, 64, 64, 3776]
    - [10, 3233.61]
  - - [128, 3776, 1, 64, 128, 128, 128, 3776]
    - [2, 5899.84]
  - - [192, 3776, 1, 64, 192, 192, 192, 3776]
    - [3, 8010.86]
  - - [256, 3776, 1, 64, 256, 256, 256, 3776]
    - [9, 9612.34]
  - - [320, 3776, 1, 64, 320, 320, 320, 3776]
    - [11, 10953.6]
  - - [384, 3776, 1, 64, 384, 384, 384, 3776]
    - [9, 12790.9]
  - - [448, 3776, 1, 64, 448, 448, 448, 3776]
    - [9, 14260.3]
  - - [512, 3776, 1, 64, 512, 512, 512, 3776]
    - [0, 14747.4]
  - - [576, 3776, 1, 64, 576, 576, 576, 3776]
    - [0, 16146.3]
  - - [640, 3776, 1, 64, 640, 640, 640, 3776]
    - [9, 16820.4]
  - - [704, 3776, 1, 64, 704, 704, 704, 3776]
    - [9, 17723.6]
  - - [768, 3776, 1, 64, 768, 768, 768, 3776]
    - [0, 18306.9]
  - - [832, 3776, 1, 64, 832, 832, 832, 3776]
    - [0, 19627.3]
  - - [896, 3776, 1, 64, 896, 896, 896, 3776]
    - [9, 20189.1]
  - - [960, 3776, 1, 64, 960, 960, 960, 3776]
    - [9, 20680.6]
  - - [1024, 3776, 1, 64, 1024, 1024, 1024, 3776]
    - [9, 20150.0]
  - - [1088, 3776, 1, 64, 1088, 1088, 1088, 3776]
    - [9, 21856.0]
  - - [1152, 3776, 1, 64, 1152, 1152, 1152, 3776]
    - [9, 21829.7]
  - - [1216, 3776, 1, 64, 1216, 1216, 1216, 3776]
    - [9, 22716.4]
  - - [1280, 3776, 1, 64, 1280, 1280, 1280, 3776]
    - [9, 23210.5]
  - - [1344, 3776, 1, 64, 1344, 1344, 1344, 3776]
    - [9, 23763.0]
  - - [1408, 3776, 1, 64, 1408, 1408, 1408, 3776]
    - [9, 24229.8]
  - - [1472, 3776, 1, 64, 1472, 1472, 1472, 3776]
    - [9, 24830.7]
  - - [1536, 3776, 1, 64, 1536, 1536, 1536, 3776]
    - [9, 22772.5]
  - - [1600, 3776, 1, 64, 1600, 1600, 1600, 3776]
    - [11, 24881.4]
  - - [1664, 3776, 1, 64, 1664, 1664, 1664, 3776]
    - [11, 24987.6]
  - - [1728, 3776, 1, 64, 1728, 1728, 1728, 3776]
    - [9, 25860.3]
  - - [1792, 3776, 1, 64, 1792, 1792, 1792, 3776]
    - [9, 26769.9]
  - - [1856, 3776, 1, 64, 1856, 1856, 1856, 3776]
    - [9, 27344.0]
  - - [1920, 3776, 1, 64, 1920, 1920, 1920, 3776]
    - [9, 27285.5]
  - - [1984, 3776, 1, 64, 1984, 1984, 1984, 3776]
    - [9, 27855.9]
  - - [2048, 3776, 1, 64, 2048, 2048, 2048, 3776]
    - [9, 24760.9]
  - - [2112, 3776, 1, 64, 2112, 2112, 2112, 3776]
    - [9, 28078.7]
  - - [2176, 3776, 1, 64, 2176, 2176, 2176, 3776]
    - [0, 27880.5]
