library/src/amd_detail/rocblaslt/src/Tensile/Logic/asm_full/navi32/GridBased/navi32_Cijk_Alik_Bljk_BSS_BH_Bias_HAH.yaml
- {MinimumRequiredVersion: 4.33.0}
- navi32
- gfx1101
- [Device 73f0]
    SolutionIndex: 0
    SolutionNameMin: Cijk_Alik_Bljk_BSS_BH_Bias_HAH_MT32x32x64_MI16x16x16x1_SN_MIWT1_1_WG32_4_1
    SolutionIndex: 1
    SolutionNameMin: Cijk_Alik_Bljk_BSS_BH_Bias_HAH_MT16x16x64_MI16x16x16x1_SN_MIWT1_1_WG16_2_1
    SolutionIndex: 2
    SolutionNameMin: Cijk_Alik_Bljk_BSS_BH_Bias_HAH_MT32x16x64_MI16x16x16x1_SN_MIWT1_1_WG32_2_1
    SolutionIndex: 3
    SolutionNameMin: Cijk_Alik_Bljk_BSS_BH_Bias_HAH_MT16x32x64_MI16x16x16x1_SN_MIWT1_1_WG16_4_1
- - - [64, 64, 1, 64, 64, 64, 64, 64]
    - [1, 0.153]
  - - [192, 64, 1, 64, 192, 192, 64, 64]
    - [0, 0.433]
  - - [320, 64, 1, 64, 320, 320, 64, 64]
    - [3, 0.38]
  - - [448, 64, 1, 64, 448, 448, 64, 64]
    - [1, 0.528]
  - - [576, 64, 1, 64, 576, 576, 64, 64]
    - [2, 0.674]
  - - [704, 64, 1, 64, 704, 704, 64, 64]
    - [0, 1.4]
  - - [832, 64, 1, 64, 832, 832, 64, 64]
    - [0, 1.651]
  - - [960, 64, 1, 64, 960, 960, 64, 64]
    - [2, 2.015]
  - - [1088, 64, 1, 64, 1088, 1088, 64, 64]
    - [0, 1.945]
  - - [1216, 64, 1, 64, 1216, 1216, 64, 64]
    - [0, 2.16]
  - - [1344, 64, 1, 64, 1344, 1344, 64, 64]
    - [0, 2.384]
  - - [1472, 64, 1, 64, 1472, 1472, 64, 64]
    - [0, 2.39]
  - - [1600, 64, 1, 64, 1600, 1600, 64, 64]
    - [0, 2.594]
  - - [1728, 64, 1, 64, 1728, 1728, 64, 64]
    - [0, 2.791]
  - - [1856, 64, 1, 64, 1856, 1856, 64, 64]
    - [0, 2.987]
  - - [1984, 64, 1, 64, 1984, 1984, 64, 64]
    - [0, 2.955]
  - - [2112, 64, 1, 64, 2112, 2112, 64, 64]
    - [0, 3.127]
  - - [2240, 64, 1, 64, 2240, 2240, 64, 64]
    - [0, 3.311]
  - - [2368, 64, 1, 64, 2368, 2368, 64, 64]
    - [0, 3.495]
  - - [2496, 64, 1, 64, 2496, 2496, 64, 64]
    - [0, 3.42]
  - - [2624, 64, 1, 64, 2624, 2624, 64, 64]
    - [0, 3.604]
  - - [2752, 64, 1, 64, 2752, 2752, 64, 64]
    - [0, 3.752]
  - - [2880, 64, 1, 64, 2880, 2880, 64, 64]
    - [0, 3.919]
  - - [3008, 64, 1, 64, 3008, 3008, 64, 64]
    - [0, 3.837]
  - - [3136, 64, 1, 64, 3136, 3136, 64, 64]
    - [0, 3.98]
  - - [3264, 64, 1, 64, 3264, 3264, 64, 64]
    - [0, 4.108]
  - - [3392, 64, 1, 64, 3392, 3392, 64, 64]
    - [0, 4.118]
  - - [3520, 64, 1, 64, 3520, 3520, 64, 64]
    - [0, 4.166]
  - - [3648, 64, 1, 64, 3648, 3648, 64, 64]
    - [0, 4.306]
  - - [3776, 64, 1, 64, 3776, 3776, 64, 64]
    - [0, 4.464]
  - - [3904, 64, 1, 64, 3904, 3904, 64, 64]
    - [0, 4.257]
  - - [4032, 64, 1, 64, 4032, 4032, 64, 64]
    - [0, 4.22]
  - - [64, 192, 1, 64, 64, 64, 64, 64]
    - [3, 0.451]
  - - [192, 192, 1, 64, 192, 192, 64, 64]
    - [0, 1.152]
  - - [320, 192, 1, 64, 320, 320, 64, 64]
    - [0, 1.888]
  - - [448, 192, 1, 64, 448, 448, 64, 64]
    - [0, 2.375]
  - - [576, 192, 1, 64, 576, 576, 64, 64]
    - [0, 2.787]
  - - [704, 192, 1, 64, 704, 704, 64, 64]
    - [0, 3.123]
  - - [832, 192, 1, 64, 832, 832, 64, 64]
    - [0, 3.438]
  - - [960, 192, 1, 64, 960, 960, 64, 64]
    - [0, 3.93]
  - - [1088, 192, 1, 64, 1088, 1088, 64, 64]
    - [0, 4.14]
  - - [1216, 192, 1, 64, 1216, 1216, 64, 64]
    - [3, 3.786]
  - - [1344, 192, 1, 64, 1344, 1344, 64, 64]
    - [0, 4.224]
  - - [1472, 192, 1, 64, 1472, 1472, 64, 64]
    - [3, 4.002]
  - - [1600, 192, 1, 64, 1600, 1600, 64, 64]
    - [3, 4.181]
  - - [1728, 192, 1, 64, 1728, 1728, 64, 64]
    - [3, 4.351]
  - - [1856, 192, 1, 64, 1856, 1856, 64, 64]
    - [0, 5.152]
  - - [1984, 192, 1, 64, 1984, 1984, 64, 64]
    - [0, 5.213]
  - - [2112, 192, 1, 64, 2112, 2112, 64, 64]
    - [0, 5.272]
  - - [2240, 192, 1, 64, 2240, 2240, 64, 64]
    - [0, 5.395]
  - - [2368, 192, 1, 64, 2368, 2368, 64, 64]
    - [0, 5.43]
  - - [2496, 192, 1, 64, 2496, 2496, 64, 64]
    - [0, 5.68]
  - - [2624, 192, 1, 64, 2624, 2624, 64, 64]
    - [0, 5.74]
  - - [2752, 192, 1, 64, 2752, 2752, 64, 64]
    - [0, 5.769]
  - - [2880, 192, 1, 64, 2880, 2880, 64, 64]
    - [0, 5.9]
  - - [3008, 192, 1, 64, 3008, 3008, 64, 64]
    - [0, 5.888]
  - - [3136, 192, 1, 64, 3136, 3136, 64, 64]
    - [0, 6.08]
  - - [3264, 192, 1, 64, 3264, 3264, 64, 64]
    - [0, 6.148]
  - - [3392, 192, 1, 64, 3392, 3392, 64, 64]
    - [0, 6.135]
  - - [3520, 192, 1, 64, 3520, 3520, 64, 64]
    - [0, 6.34]
  - - [3648, 192, 1, 64, 3648, 3648, 64, 64]
    - [0, 6.402]
  - - [3776, 192, 1, 64, 3776, 3776, 64, 64]
    - [0, 6.407]
  - - [3904, 192, 1, 64, 3904, 3904, 64, 64]
    - [0, 6.456]
  - - [4032, 192, 1, 64, 4032, 4032, 64, 64]
    - [0, 6.439]
  - - [64, 320, 1, 64, 64, 64, 64, 64]
    - [0, 0.725]
  - - [192, 320, 1, 64, 192, 192, 64, 64]
    - [0, 1.891]
  - - [320, 320, 1, 64, 320, 320, 64, 64]
    - [2, 2.39]
  - - [448, 320, 1, 64, 448, 448, 64, 64]
    - [0, 3.317]
  - - [576, 320, 1, 64, 576, 576, 64, 64]
    - [0, 3.824]
  - - [704, 320, 1, 64, 704, 704, 64, 64]
    - [0, 4.179]
  - - [832, 320, 1, 64, 832, 832, 64, 64]
    - [0, 4.345]
  - - [960, 320, 1, 64, 960, 960, 64, 64]
    - [0, 4.723]
  - - [1088, 320, 1, 64, 1088, 1088, 64, 64]
    - [0, 5.073]
  - - [1216, 320, 1, 64, 1216, 1216, 64, 64]
    - [0, 5.154]
  - - [1344, 320, 1, 64, 1344, 1344, 64, 64]
    - [0, 5.413]
  - - [1472, 320, 1, 64, 1472, 1472, 64, 64]
    - [0, 5.608]
  - - [1600, 320, 1, 64, 1600, 1600, 64, 64]
    - [0, 5.776]
  - - [1728, 320, 1, 64, 1728, 1728, 64, 64]
    - [0, 5.907]
  - - [1856, 320, 1, 64, 1856, 1856, 64, 64]
    - [0, 6.021]
  - - [1984, 320, 1, 64, 1984, 1984, 64, 64]
    - [0, 6.202]
  - - [2112, 320, 1, 64, 2112, 2112, 64, 64]
    - [0, 6.308]
  - - [2240, 320, 1, 64, 2240, 2240, 64, 64]
    - [0, 6.371]
  - - [2368, 320, 1, 64, 2368, 2368, 64, 64]
    - [0, 6.485]
  - - [2496, 320, 1, 64, 2496, 2496, 64, 64]
    - [0, 6.595]
  - - [2624, 320, 1, 64, 2624, 2624, 64, 64]
    - [0, 6.718]
  - - [2752, 320, 1, 64, 2752, 2752, 64, 64]
    - [0, 6.757]
  - - [2880, 320, 1, 64, 2880, 2880, 64, 64]
    - [0, 6.814]
  - - [3008, 320, 1, 64, 3008, 3008, 64, 64]
    - [0, 6.872]
  - - [3136, 320, 1, 64, 3136, 3136, 64, 64]
    - [0, 6.993]
  - - [3264, 320, 1, 64, 3264, 3264, 64, 64]
    - [0, 6.991]
  - - [3392, 320, 1, 64, 3392, 3392, 64, 64]
    - [0, 7.101]
  - - [3520, 320, 1, 64, 3520, 3520, 64, 64]
    - [0, 7.172]
  - - [3648, 320, 1, 64, 3648, 3648, 64, 64]
    - [0, 7.198]
  - - [3776, 320, 1, 64, 3776, 3776, 64, 64]
    - [0, 7.216]
  - - [3904, 320, 1, 64, 3904, 3904, 64, 64]
    - [0, 7.31]
  - - [4032, 320, 1, 64, 4032, 4032, 64, 64]
    - [0, 7.273]
  - - [64, 448, 1, 64, 64, 64, 64, 64]
    - [2, 0.964]
  - - [192, 448, 1, 64, 192, 192, 64, 64]
    - [2, 2.17]
  - - [320, 448, 1, 64, 320, 320, 64, 64]
    - [0, 3.323]
  - - [448, 448, 1, 64, 448, 448, 64, 64]
    - [0, 3.99]
  - - [576, 448, 1, 64, 576, 576, 64, 64]
    - [0, 4.238]
  - - [704, 448, 1, 64, 704, 704, 64, 64]
    - [0, 4.823]
  - - [832, 448, 1, 64, 832, 832, 64, 64]
    - [0, 5.179]
  - - [960, 448, 1, 64, 960, 960, 64, 64]
    - [0, 5.391]
  - - [1088, 448, 1, 64, 1088, 1088, 64, 64]
    - [0, 5.736]
  - - [1216, 448, 1, 64, 1216, 1216, 64, 64]
    - [0, 5.925]
  - - [1344, 448, 1, 64, 1344, 1344, 64, 64]
    - [0, 6.11]
  - - [1472, 448, 1, 64, 1472, 1472, 64, 64]
    - [0, 6.203]
  - - [1600, 448, 1, 64, 1600, 1600, 64, 64]
    - [0, 6.411]
  - - [1728, 448, 1, 64, 1728, 1728, 64, 64]
    - [0, 6.442]
  - - [1856, 448, 1, 64, 1856, 1856, 64, 64]
    - [0, 6.657]
  - - [1984, 448, 1, 64, 1984, 1984, 64, 64]
    - [0, 6.753]
  - - [2112, 448, 1, 64, 2112, 2112, 64, 64]
    - [0, 6.91]
  - - [2240, 448, 1, 64, 2240, 2240, 64, 64]
    - [0, 7.02]
  - - [2368, 448, 1, 64, 2368, 2368, 64, 64]
    - [0, 7.093]
  - - [2496, 448, 1, 64, 2496, 2496, 64, 64]
    - [0, 7.126]
  - - [2624, 448, 1, 64, 2624, 2624, 64, 64]
    - [0, 7.144]
  - - [2752, 448, 1, 64, 2752, 2752, 64, 64]
    - [0, 7.211]
  - - [2880, 448, 1, 64, 2880, 2880, 64, 64]
    - [0, 7.286]
  - - [3008, 448, 1, 64, 3008, 3008, 64, 64]
    - [0, 7.366]
  - - [3136, 448, 1, 64, 3136, 3136, 64, 64]
    - [0, 7.487]
  - - [3264, 448, 1, 64, 3264, 3264, 64, 64]
    - [0, 7.491]
  - - [3392, 448, 1, 64, 3392, 3392, 64, 64]
    - [0, 7.51]
  - - [3520, 448, 1, 64, 3520, 3520, 64, 64]
    - [0, 7.557]
  - - [3648, 448, 1, 64, 3648, 3648, 64, 64]
    - [0, 7.633]
  - - [3776, 448, 1, 64, 3776, 3776, 64, 64]
    - [2, 6.226]
  - - [3904, 448, 1, 64, 3904, 3904, 64, 64]
    - [0, 7.615]
  - - [4032, 448, 1, 64, 4032, 4032, 64, 64]
    - [0, 7.683]
  - - [64, 576, 1, 64, 64, 64, 64, 64]
    - [0, 1.151]
  - - [192, 576, 1, 64, 192, 192, 64, 64]
    - [0, 2.773]
  - - [320, 576, 1, 64, 320, 320, 64, 64]
    - [0, 3.916]
  - - [448, 576, 1, 64, 448, 448, 64, 64]
    - [0, 4.22]
  - - [576, 576, 1, 64, 576, 576, 64, 64]
    - [0, 4.811]
  - - [704, 576, 1, 64, 704, 704, 64, 64]
    - [0, 5.289]
  - - [832, 576, 1, 64, 832, 832, 64, 64]
    - [0, 5.73]
  - - [960, 576, 1, 64, 960, 960, 64, 64]
    - [0, 6.009]
  - - [1088, 576, 1, 64, 1088, 1088, 64, 64]
    - [0, 6.244]
  - - [1216, 576, 1, 64, 1216, 1216, 64, 64]
    - [0, 6.377]
  - - [1344, 576, 1, 64, 1344, 1344, 64, 64]
    - [0, 6.492]
  - - [1472, 576, 1, 64, 1472, 1472, 64, 64]
    - [0, 6.62]
  - - [1600, 576, 1, 64, 1600, 1600, 64, 64]
    - [0, 6.821]
  - - [1728, 576, 1, 64, 1728, 1728, 64, 64]
    - [0, 6.953]
  - - [1856, 576, 1, 64, 1856, 1856, 64, 64]
    - [0, 7.118]
  - - [1984, 576, 1, 64, 1984, 1984, 64, 64]
    - [0, 7.125]
  - - [2112, 576, 1, 64, 2112, 2112, 64, 64]
    - [0, 7.273]
  - - [2240, 576, 1, 64, 2240, 2240, 64, 64]
    - [0, 7.39]
  - - [2368, 576, 1, 64, 2368, 2368, 64, 64]
    - [0, 7.347]
  - - [2496, 576, 1, 64, 2496, 2496, 64, 64]
    - [0, 7.484]
  - - [2624, 576, 1, 64, 2624, 2624, 64, 64]
    - [0, 7.525]
  - - [2752, 576, 1, 64, 2752, 2752, 64, 64]
    - [0, 7.634]
  - - [2880, 576, 1, 64, 2880, 2880, 64, 64]
    - [0, 7.656]
  - - [3008, 576, 1, 64, 3008, 3008, 64, 64]
    - [0, 7.695]
  - - [3136, 576, 1, 64, 3136, 3136, 64, 64]
    - [0, 7.823]
  - - [3264, 576, 1, 64, 3264, 3264, 64, 64]
    - [0, 7.852]
  - - [3392, 576, 1, 64, 3392, 3392, 64, 64]
    - [0, 7.791]
  - - [3520, 576, 1, 64, 3520, 3520, 64, 64]
    - [0, 7.899]
  - - [3648, 576, 1, 64, 3648, 3648, 64, 64]
    - [0, 7.846]
  - - [3776, 576, 1, 64, 3776, 3776, 64, 64]
    - [0, 7.931]
  - - [3904, 576, 1, 64, 3904, 3904, 64, 64]
    - [0, 7.888]
  - - [4032, 576, 1, 64, 4032, 4032, 64, 64]
    - [0, 8.028]
  - - [64, 704, 1, 64, 64, 64, 64, 64]
    - [3, 1.373]
  - - [192, 704, 1, 64, 192, 192, 64, 64]
    - [0, 3.128]
  - - [320, 704, 1, 64, 320, 320, 64, 64]
    - [0, 4.189]
  - - [448, 704, 1, 64, 448, 448, 64, 64]
    - [0, 4.646]
  - - [576, 704, 1, 64, 576, 576, 64, 64]
    - [0, 5.292]
  - - [704, 704, 1, 64, 704, 704, 64, 64]
    - [0, 5.736]
  - - [832, 704, 1, 64, 832, 832, 64, 64]
    - [0, 5.965]
  - - [960, 704, 1, 64, 960, 960, 64, 64]
    - [0, 6.351]
  - - [1088, 704, 1, 64, 1088, 1088, 64, 64]
    - [0, 6.546]
  - - [1216, 704, 1, 64, 1216, 1216, 64, 64]
    - [0, 6.689]
  - - [1344, 704, 1, 64, 1344, 1344, 64, 64]
    - [0, 6.918]
  - - [1472, 704, 1, 64, 1472, 1472, 64, 64]
    - [0, 7.031]
  - - [1600, 704, 1, 64, 1600, 1600, 64, 64]
    - [0, 7.14]
  - - [1728, 704, 1, 64, 1728, 1728, 64, 64]
    - [0, 7.212]
  - - [1856, 704, 1, 64, 1856, 1856, 64, 64]
    - [0, 7.366]
  - - [1984, 704, 1, 64, 1984, 1984, 64, 64]
    - [0, 7.413]
  - - [2112, 704, 1, 64, 2112, 2112, 64, 64]
    - [0, 7.557]
  - - [2240, 704, 1, 64, 2240, 2240, 64, 64]
    - [0, 7.652]
  - - [2368, 704, 1, 64, 2368, 2368, 64, 64]
    - [0, 7.685]
  - - [2496, 704, 1, 64, 2496, 2496, 64, 64]
    - [0, 7.677]
  - - [2624, 704, 1, 64, 2624, 2624, 64, 64]
    - [0, 7.783]
  - - [2752, 704, 1, 64, 2752, 2752, 64, 64]
    - [0, 7.9]
  - - [2880, 704, 1, 64, 2880, 2880, 64, 64]
    - [0, 7.845]
  - - [3008, 704, 1, 64, 3008, 3008, 64, 64]
    - [0, 7.925]
  - - [3136, 704, 1, 64, 3136, 3136, 64, 64]
    - [0, 7.95]
  - - [3264, 704, 1, 64, 3264, 3264, 64, 64]
    - [0, 8.034]
  - - [3392, 704, 1, 64, 3392, 3392, 64, 64]
    - [0, 8.072]
  - - [3520, 704, 1, 64, 3520, 3520, 64, 64]
    - [0, 8.07]
  - - [3648, 704, 1, 64, 3648, 3648, 64, 64]
    - [0, 8.143]
  - - [3776, 704, 1, 64, 3776, 3776, 64, 64]
    - [0, 8.146]
  - - [3904, 704, 1, 64, 3904, 3904, 64, 64]
    - [0, 8.227]
  - - [4032, 704, 1, 64, 4032, 4032, 64, 64]
    - [0, 8.172]
  - - [64, 832, 1, 64, 64, 64, 64, 64]
    - [0, 1.646]
  - - [192, 832, 1, 64, 192, 192, 64, 64]
    - [0, 3.445]
  - - [320, 832, 1, 64, 320, 320, 64, 64]
    - [0, 4.352]
  - - [448, 832, 1, 64, 448, 448, 64, 64]
    - [0, 5.145]
  - - [576, 832, 1, 64, 576, 576, 64, 64]
    - [0, 5.722]
  - - [704, 832, 1, 64, 704, 704, 64, 64]
    - [0, 6.117]
  - - [832, 832, 1, 64, 832, 832, 64, 64]
    - [0, 6.446]
  - - [960, 832, 1, 64, 960, 960, 64, 64]
    - [0, 6.634]
  - - [1088, 832, 1, 64, 1088, 1088, 64, 64]
    - [0, 6.765]
  - - [1216, 832, 1, 64, 1216, 1216, 64, 64]
    - [0, 6.979]
  - - [1344, 832, 1, 64, 1344, 1344, 64, 64]
    - [0, 7.287]
  - - [1472, 832, 1, 64, 1472, 1472, 64, 64]
    - [0, 7.375]
  - - [1600, 832, 1, 64, 1600, 1600, 64, 64]
    - [0, 7.431]
  - - [1728, 832, 1, 64, 1728, 1728, 64, 64]
    - [0, 7.483]
  - - [1856, 832, 1, 64, 1856, 1856, 64, 64]
    - [0, 7.55]
  - - [1984, 832, 1, 64, 1984, 1984, 64, 64]
    - [0, 7.657]
  - - [2112, 832, 1, 64, 2112, 2112, 64, 64]
    - [0, 7.786]
  - - [2240, 832, 1, 64, 2240, 2240, 64, 64]
    - [0, 7.851]
  - - [2368, 832, 1, 64, 2368, 2368, 64, 64]
    - [0, 7.899]
  - - [2496, 832, 1, 64, 2496, 2496, 64, 64]
    - [0, 7.904]
  - - [2624, 832, 1, 64, 2624, 2624, 64, 64]
    - [0, 7.96]
  - - [2752, 832, 1, 64, 2752, 2752, 64, 64]
    - [0, 8.031]
  - - [2880, 832, 1, 64, 2880, 2880, 64, 64]
    - [0, 8.027]
  - - [3008, 832, 1, 64, 3008, 3008, 64, 64]
    - [0, 8.044]
  - - [3136, 832, 1, 64, 3136, 3136, 64, 64]
    - [0, 8.071]
  - - [3264, 832, 1, 64, 3264, 3264, 64, 64]
    - [0, 8.246]
  - - [3392, 832, 1, 64, 3392, 3392, 64, 64]
    - [0, 8.251]
  - - [3520, 832, 1, 64, 3520, 3520, 64, 64]
    - [0, 8.241]
  - - [3648, 832, 1, 64, 3648, 3648, 64, 64]
    - [0, 7.633]
  - - [3776, 832, 1, 64, 3776, 3776, 64, 64]
    - [0, 7.802]
  - - [3904, 832, 1, 64, 3904, 3904, 64, 64]
    - [0, 7.81]
  - - [4032, 832, 1, 64, 4032, 4032, 64, 64]
    - [0, 7.829]
  - - [64, 960, 1, 64, 64, 64, 64, 64]
    - [3, 1.748]
  - - [192, 960, 1, 64, 192, 192, 64, 64]
    - [3, 3.277]
  - - [320, 960, 1, 64, 320, 320, 64, 64]
    - [0, 4.731]
  - - [448, 960, 1, 64, 448, 448, 64, 64]
    - [0, 5.544]
  - - [576, 960, 1, 64, 576, 576, 64, 64]
    - [0, 5.924]
  - - [704, 960, 1, 64, 704, 704, 64, 64]
    - [0, 6.359]
  - - [832, 960, 1, 64, 832, 832, 64, 64]
    - [0, 6.578]
  - - [960, 960, 1, 64, 960, 960, 64, 64]
    - [0, 6.808]
  - - [1088, 960, 1, 64, 1088, 1088, 64, 64]
    - [0, 7.033]
  - - [1216, 960, 1, 64, 1216, 1216, 64, 64]
    - [0, 7.256]
  - - [1344, 960, 1, 64, 1344, 1344, 64, 64]
    - [0, 7.372]
  - - [1472, 960, 1, 64, 1472, 1472, 64, 64]
    - [0, 7.484]
  - - [1600, 960, 1, 64, 1600, 1600, 64, 64]
    - [0, 7.597]
  - - [1728, 960, 1, 64, 1728, 1728, 64, 64]
    - [0, 7.716]
  - - [1856, 960, 1, 64, 1856, 1856, 64, 64]
    - [0, 7.744]
  - - [1984, 960, 1, 64, 1984, 1984, 64, 64]
    - [0, 7.811]
  - - [2112, 960, 1, 64, 2112, 2112, 64, 64]
    - [0, 7.938]
  - - [2240, 960, 1, 64, 2240, 2240, 64, 64]
    - [0, 8.033]
  - - [2368, 960, 1, 64, 2368, 2368, 64, 64]
    - [0, 7.914]
  - - [2496, 960, 1, 64, 2496, 2496, 64, 64]
    - [0, 8.058]
  - - [2624, 960, 1, 64, 2624, 2624, 64, 64]
    - [0, 8.229]
  - - [2752, 960, 1, 64, 2752, 2752, 64, 64]
    - [0, 8.13]
  - - [2880, 960, 1, 64, 2880, 2880, 64, 64]
    - [0, 8.196]
  - - [3008, 960, 1, 64, 3008, 3008, 64, 64]
    - [0, 8.317]
  - - [3136, 960, 1, 64, 3136, 3136, 64, 64]
    - [0, 7.568]
  - - [3264, 960, 1, 64, 3264, 3264, 64, 64]
    - [0, 7.836]
  - - [3392, 960, 1, 64, 3392, 3392, 64, 64]
    - [0, 7.884]
  - - [3520, 960, 1, 64, 3520, 3520, 64, 64]
    - [0, 7.928]
  - - [3648, 960, 1, 64, 3648, 3648, 64, 64]
    - [0, 8.02]
  - - [3776, 960, 1, 64, 3776, 3776, 64, 64]
    - [0, 7.956]
  - - [3904, 960, 1, 64, 3904, 3904, 64, 64]
    - [0, 8.024]
  - - [4032, 960, 1, 64, 4032, 4032, 64, 64]
    - [0, 8.032]
  - - [64, 1088, 1, 64, 64, 64, 64, 64]
    - [0, 1.947]
  - - [192, 1088, 1, 64, 192, 192, 64, 64]
    - [0, 3.834]
  - - [320, 1088, 1, 64, 320, 320, 64, 64]
    - [0, 5.07]
  - - [448, 1088, 1, 64, 448, 448, 64, 64]
    - [0, 5.803]
  - - [576, 1088, 1, 64, 576, 576, 64, 64]
    - [0, 6.228]
  - - [704, 1088, 1, 64, 704, 704, 64, 64]
    - [0, 6.569]
  - - [832, 1088, 1, 64, 832, 832, 64, 64]
    - [0, 6.789]
  - - [960, 1088, 1, 64, 960, 960, 64, 64]
    - [0, 7.101]
  - - [1088, 1088, 1, 64, 1088, 1088, 64, 64]
    - [0, 7.215]
  - - [1216, 1088, 1, 64, 1216, 1216, 64, 64]
    - [0, 7.399]
  - - [1344, 1088, 1, 64, 1344, 1344, 64, 64]
    - [0, 7.508]
  - - [1472, 1088, 1, 64, 1472, 1472, 64, 64]
    - [0, 7.615]
  - - [1600, 1088, 1, 64, 1600, 1600, 64, 64]
    - [0, 7.846]
  - - [1728, 1088, 1, 64, 1728, 1728, 64, 64]
    - [0, 7.855]
  - - [1856, 1088, 1, 64, 1856, 1856, 64, 64]
    - [0, 7.895]
  - - [1984, 1088, 1, 64, 1984, 1984, 64, 64]
    - [0, 7.959]
  - - [2112, 1088, 1, 64, 2112, 2112, 64, 64]
    - [0, 8.04]
  - - [2240, 1088, 1, 64, 2240, 2240, 64, 64]
    - [0, 8.021]
  - - [2368, 1088, 1, 64, 2368, 2368, 64, 64]
    - [0, 8.203]
  - - [2496, 1088, 1, 64, 2496, 2496, 64, 64]
    - [0, 8.185]
  - - [2624, 1088, 1, 64, 2624, 2624, 64, 64]
    - [0, 8.316]
  - - [2752, 1088, 1, 64, 2752, 2752, 64, 64]
    - [0, 7.534]
  - - [2880, 1088, 1, 64, 2880, 2880, 64, 64]
    - [0, 7.874]
  - - [3008, 1088, 1, 64, 3008, 3008, 64, 64]
    - [0, 7.944]
  - - [3136, 1088, 1, 64, 3136, 3136, 64, 64]
    - [0, 7.954]
  - - [3264, 1088, 1, 64, 3264, 3264, 64, 64]
    - [0, 8.056]
  - - [3392, 1088, 1, 64, 3392, 3392, 64, 64]
    - [0, 8.044]
  - - [3520, 1088, 1, 64, 3520, 3520, 64, 64]
    - [0, 8.114]
  - - [3648, 1088, 1, 64, 3648, 3648, 64, 64]
    - [0, 8.055]
  - - [3776, 1088, 1, 64, 3776, 3776, 64, 64]
    - [0, 8.25]
  - - [3904, 1088, 1, 64, 3904, 3904, 64, 64]
    - [0, 8.256]
  - - [4032, 1088, 1, 64, 4032, 4032, 64, 64]
    - [0, 8.216]
  - - [64, 1216, 1, 64, 64, 64, 64, 64]
    - [0, 2.16]
  - - [192, 1216, 1, 64, 192, 192, 64, 64]
    - [2, 3.777]
  - - [320, 1216, 1, 64, 320, 320, 64, 64]
    - [3, 4.486]
  - - [448, 1216, 1, 64, 448, 448, 64, 64]
    - [0, 6.036]
  - - [576, 1216, 1, 64, 576, 576, 64, 64]
    - [0, 6.454]
  - - [704, 1216, 1, 64, 704, 704, 64, 64]
    - [0, 6.738]
  - - [832, 1216, 1, 64, 832, 832, 64, 64]
    - [0, 7.032]
  - - [960, 1216, 1, 64, 960, 960, 64, 64]
    - [0, 7.262]
  - - [1088, 1216, 1, 64, 1088, 1088, 64, 64]
    - [0, 7.38]
  - - [1216, 1216, 1, 64, 1216, 1216, 64, 64]
    - [0, 7.638]
  - - [1344, 1216, 1, 64, 1344, 1344, 64, 64]
    - [0, 7.645]
  - - [1472, 1216, 1, 64, 1472, 1472, 64, 64]
    - [0, 7.777]
  - - [1600, 1216, 1, 64, 1600, 1600, 64, 64]
    - [0, 7.856]
  - - [1728, 1216, 1, 64, 1728, 1728, 64, 64]
    - [0, 7.948]
  - - [1856, 1216, 1, 64, 1856, 1856, 64, 64]
    - [0, 8.049]
  - - [1984, 1216, 1, 64, 1984, 1984, 64, 64]
    - [0, 8.074]
  - - [2112, 1216, 1, 64, 2112, 2112, 64, 64]
    - [0, 8.169]
  - - [2240, 1216, 1, 64, 2240, 2240, 64, 64]
    - [0, 8.147]
  - - [2368, 1216, 1, 64, 2368, 2368, 64, 64]
    - [0, 8.206]
  - - [2496, 1216, 1, 64, 2496, 2496, 64, 64]
    - [0, 7.631]
  - - [2624, 1216, 1, 64, 2624, 2624, 64, 64]
    - [0, 7.93]
  - - [2752, 1216, 1, 64, 2752, 2752, 64, 64]
    - [0, 7.886]
  - - [2880, 1216, 1, 64, 2880, 2880, 64, 64]
    - [0, 7.988]
  - - [3008, 1216, 1, 64, 3008, 3008, 64, 64]
    - [0, 7.965]
  - - [3136, 1216, 1, 64, 3136, 3136, 64, 64]
    - [0, 8.031]
  - - [3264, 1216, 1, 64, 3264, 3264, 64, 64]
    - [0, 8.122]
  - - [3392, 1216, 1, 64, 3392, 3392, 64, 64]
    - [0, 8.189]
  - - [3520, 1216, 1, 64, 3520, 3520, 64, 64]
    - [0, 8.157]
  - - [3648, 1216, 1, 64, 3648, 3648, 64, 64]
    - [0, 8.234]
  - - [3776, 1216, 1, 64, 3776, 3776, 64, 64]
    - [0, 8.282]
  - - [3904, 1216, 1, 64, 3904, 3904, 64, 64]
    - [0, 8.237]
  - - [4032, 1216, 1, 64, 4032, 4032, 64, 64]
    - [0, 8.336]
  - - [64, 1344, 1, 64, 64, 64, 64, 64]
    - [0, 2.395]
  - - [192, 1344, 1, 64, 192, 192, 64, 64]
    - [0, 4.225]
  - - [320, 1344, 1, 64, 320, 320, 64, 64]
    - [0, 5.47]
  - - [448, 1344, 1, 64, 448, 448, 64, 64]
    - [0, 6.135]
  - - [576, 1344, 1, 64, 576, 576, 64, 64]
    - [0, 6.633]
  - - [704, 1344, 1, 64, 704, 704, 64, 64]
    - [0, 6.988]
  - - [832, 1344, 1, 64, 832, 832, 64, 64]
    - [0, 7.191]
  - - [960, 1344, 1, 64, 960, 960, 64, 64]
    - [0, 7.49]
  - - [1088, 1344, 1, 64, 1088, 1088, 64, 64]
    - [0, 7.611]
  - - [1216, 1344, 1, 64, 1216, 1216, 64, 64]
    - [0, 7.726]
  - - [1344, 1344, 1, 64, 1344, 1344, 64, 64]
    - [0, 7.831]
  - - [1472, 1344, 1, 64, 1472, 1472, 64, 64]
    - [0, 7.97]
  - - [1600, 1344, 1, 64, 1600, 1600, 64, 64]
    - [0, 8.034]
  - - [1728, 1344, 1, 64, 1728, 1728, 64, 64]
    - [0, 8.077]
  - - [1856, 1344, 1, 64, 1856, 1856, 64, 64]
    - [0, 8.206]
  - - [1984, 1344, 1, 64, 1984, 1984, 64, 64]
    - [3, 6.165]
  - - [2112, 1344, 1, 64, 2112, 2112, 64, 64]
    - [0, 8.332]
  - - [2240, 1344, 1, 64, 2240, 2240, 64, 64]
    - [0, 7.569]
  - - [2368, 1344, 1, 64, 2368, 2368, 64, 64]
    - [0, 7.918]
  - - [2496, 1344, 1, 64, 2496, 2496, 64, 64]
    - [0, 7.991]
  - - [2624, 1344, 1, 64, 2624, 2624, 64, 64]
    - [0, 7.981]
  - - [2752, 1344, 1, 64, 2752, 2752, 64, 64]
    - [0, 8.033]
  - - [2880, 1344, 1, 64, 2880, 2880, 64, 64]
    - [0, 8.144]
  - - [3008, 1344, 1, 64, 3008, 3008, 64, 64]
    - [0, 8.202]
  - - [3136, 1344, 1, 64, 3136, 3136, 64, 64]
    - [0, 8.239]
  - - [3264, 1344, 1, 64, 3264, 3264, 64, 64]
    - [0, 8.215]
  - - [3392, 1344, 1, 64, 3392, 3392, 64, 64]
    - [0, 8.189]
  - - [3520, 1344, 1, 64, 3520, 3520, 64, 64]
    - [0, 8.215]
  - - [3648, 1344, 1, 64, 3648, 3648, 64, 64]
    - [0, 8.245]
  - - [3776, 1344, 1, 64, 3776, 3776, 64, 64]
    - [0, 8.277]
  - - [3904, 1344, 1, 64, 3904, 3904, 64, 64]
    - [0, 8.378]
  - - [4032, 1344, 1, 64, 4032, 4032, 64, 64]
    - [0, 8.389]
  - - [64, 1472, 1, 64, 64, 64, 64, 64]
    - [0, 2.422]
  - - [192, 1472, 1, 64, 192, 192, 64, 64]
    - [0, 4.615]
  - - [320, 1472, 1, 64, 320, 320, 64, 64]
    - [0, 5.661]
  - - [448, 1472, 1, 64, 448, 448, 64, 64]
    - [0, 6.322]
  - - [576, 1472, 1, 64, 576, 576, 64, 64]
    - [0, 6.661]
  - - [704, 1472, 1, 64, 704, 704, 64, 64]
    - [0, 7.165]
  - - [832, 1472, 1, 64, 832, 832, 64, 64]
    - [0, 7.445]
  - - [960, 1472, 1, 64, 960, 960, 64, 64]
    - [0, 7.531]
  - - [1088, 1472, 1, 64, 1088, 1088, 64, 64]
    - [0, 7.716]
  - - [1216, 1472, 1, 64, 1216, 1216, 64, 64]
    - [0, 7.789]
  - - [1344, 1472, 1, 64, 1344, 1344, 64, 64]
    - [0, 7.932]
  - - [1472, 1472, 1, 64, 1472, 1472, 64, 64]
    - [0, 7.997]
  - - [1600, 1472, 1, 64, 1600, 1600, 64, 64]
    - [0, 8.021]
  - - [1728, 1472, 1, 64, 1728, 1728, 64, 64]
    - [0, 8.145]
  - - [1856, 1472, 1, 64, 1856, 1856, 64, 64]
    - [0, 8.319]
  - - [1984, 1472, 1, 64, 1984, 1984, 64, 64]
    - [0, 8.297]
  - - [2112, 1472, 1, 64, 2112, 2112, 64, 64]
    - [0, 7.809]
  - - [2240, 1472, 1, 64, 2240, 2240, 64, 64]
    - [0, 7.878]
  - - [2368, 1472, 1, 64, 2368, 2368, 64, 64]
    - [0, 7.949]
  - - [2496, 1472, 1, 64, 2496, 2496, 64, 64]
    - [0, 8.001]
  - - [2624, 1472, 1, 64, 2624, 2624, 64, 64]
    - [0, 8.11]
  - - [2752, 1472, 1, 64, 2752, 2752, 64, 64]
    - [0, 8.183]
  - - [2880, 1472, 1, 64, 2880, 2880, 64, 64]
    - [0, 8.184]
  - - [3008, 1472, 1, 64, 3008, 3008, 64, 64]
    - [0, 8.198]
  - - [3136, 1472, 1, 64, 3136, 3136, 64, 64]
    - [0, 8.225]
  - - [3264, 1472, 1, 64, 3264, 3264, 64, 64]
    - [0, 8.25]
  - - [3392, 1472, 1, 64, 3392, 3392, 64, 64]
    - [0, 8.251]
  - - [3520, 1472, 1, 64, 3520, 3520, 64, 64]
    - [0, 8.316]
  - - [3648, 1472, 1, 64, 3648, 3648, 64, 64]
    - [0, 8.382]
  - - [3776, 1472, 1, 64, 3776, 3776, 64, 64]
    - [0, 8.402]
  - - [3904, 1472, 1, 64, 3904, 3904, 64, 64]
    - [0, 8.307]
  - - [4032, 1472, 1, 64, 4032, 4032, 64, 64]
    - [0, 8.468]
  - - [64, 1600, 1, 64, 64, 64, 64, 64]
    - [0, 2.592]
  - - [192, 1600, 1, 64, 192, 192, 64, 64]
    - [0, 4.758]
  - - [320, 1600, 1, 64, 320, 320, 64, 64]
    - [0, 5.852]
  - - [448, 1600, 1, 64, 448, 448, 64, 64]
    - [0, 6.485]
  - - [576, 1600, 1, 64, 576, 576, 64, 64]
    - [0, 6.87]
  - - [704, 1600, 1, 64, 704, 704, 64, 64]
    - [0, 7.221]
  - - [832, 1600, 1, 64, 832, 832, 64, 64]
    - [0, 7.653]
  - - [960, 1600, 1, 64, 960, 960, 64, 64]
    - [0, 7.68]
  - - [1088, 1600, 1, 64, 1088, 1088, 64, 64]
    - [0, 7.828]
  - - [1216, 1600, 1, 64, 1216, 1216, 64, 64]
    - [0, 8.006]
  - - [1344, 1600, 1, 64, 1344, 1344, 64, 64]
    - [0, 8.095]
  - - [1472, 1600, 1, 64, 1472, 1472, 64, 64]
    - [0, 7.982]
  - - [1600, 1600, 1, 64, 1600, 1600, 64, 64]
    - [0, 8.129]
  - - [1728, 1600, 1, 64, 1728, 1728, 64, 64]
    - [0, 8.242]
  - - [1856, 1600, 1, 64, 1856, 1856, 64, 64]
    - [0, 8.365]
  - - [1984, 1600, 1, 64, 1984, 1984, 64, 64]
    - [0, 7.892]
  - - [2112, 1600, 1, 64, 2112, 2112, 64, 64]
    - [0, 7.918]
  - - [2240, 1600, 1, 64, 2240, 2240, 64, 64]
    - [0, 8.056]
  - - [2368, 1600, 1, 64, 2368, 2368, 64, 64]
    - [0, 8.033]
  - - [2496, 1600, 1, 64, 2496, 2496, 64, 64]
    - [0, 8.097]
  - - [2624, 1600, 1, 64, 2624, 2624, 64, 64]
    - [0, 8.209]
  - - [2752, 1600, 1, 64, 2752, 2752, 64, 64]
    - [0, 8.151]
  - - [2880, 1600, 1, 64, 2880, 2880, 64, 64]
    - [0, 8.222]
  - - [3008, 1600, 1, 64, 3008, 3008, 64, 64]
    - [0, 8.343]
  - - [3136, 1600, 1, 64, 3136, 3136, 64, 64]
    - [0, 8.256]
  - - [3264, 1600, 1, 64, 3264, 3264, 64, 64]
    - [0, 8.4]
  - - [3392, 1600, 1, 64, 3392, 3392, 64, 64]
    - [0, 8.334]
  - - [3520, 1600, 1, 64, 3520, 3520, 64, 64]
    - [0, 8.42]
  - - [3648, 1600, 1, 64, 3648, 3648, 64, 64]
    - [0, 8.339]
  - - [3776, 1600, 1, 64, 3776, 3776, 64, 64]
    - [0, 8.485]
  - - [3904, 1600, 1, 64, 3904, 3904, 64, 64]
    - [0, 8.521]
  - - [4032, 1600, 1, 64, 4032, 4032, 64, 64]
    - [0, 8.462]
  - - [64, 1728, 1, 64, 64, 64, 64, 64]
    - [0, 2.796]
  - - [192, 1728, 1, 64, 192, 192, 64, 64]
    - [0, 4.878]
  - - [320, 1728, 1, 64, 320, 320, 64, 64]
    - [0, 5.966]
  - - [448, 1728, 1, 64, 448, 448, 64, 64]
    - [0, 6.628]
  - - [576, 1728, 1, 64, 576, 576, 64, 64]
    - [0, 6.999]
  - - [704, 1728, 1, 64, 704, 704, 64, 64]
    - [0, 7.333]
  - - [832, 1728, 1, 64, 832, 832, 64, 64]
    - [0, 7.583]
  - - [960, 1728, 1, 64, 960, 960, 64, 64]
    - [0, 7.683]
  - - [1088, 1728, 1, 64, 1088, 1088, 64, 64]
    - [0, 7.884]
  - - [1216, 1728, 1, 64, 1216, 1216, 64, 64]
    - [0, 7.934]
  - - [1344, 1728, 1, 64, 1344, 1344, 64, 64]
    - [0, 8.091]
  - - [1472, 1728, 1, 64, 1472, 1472, 64, 64]
    - [0, 8.234]
  - - [1600, 1728, 1, 64, 1600, 1600, 64, 64]
    - [0, 8.28]
  - - [1728, 1728, 1, 64, 1728, 1728, 64, 64]
    - [0, 7.515]
  - - [1856, 1728, 1, 64, 1856, 1856, 64, 64]
    - [0, 7.923]
  - - [1984, 1728, 1, 64, 1984, 1984, 64, 64]
    - [0, 8.031]
  - - [2112, 1728, 1, 64, 2112, 2112, 64, 64]
    - [0, 8.086]
  - - [2240, 1728, 1, 64, 2240, 2240, 64, 64]
    - [0, 8.041]
  - - [2368, 1728, 1, 64, 2368, 2368, 64, 64]
    - [0, 8.12]
  - - [2496, 1728, 1, 64, 2496, 2496, 64, 64]
    - [0, 8.12]
  - - [2624, 1728, 1, 64, 2624, 2624, 64, 64]
    - [0, 8.125]
  - - [2752, 1728, 1, 64, 2752, 2752, 64, 64]
    - [0, 8.264]
  - - [2880, 1728, 1, 64, 2880, 2880, 64, 64]
    - [0, 8.319]
  - - [3008, 1728, 1, 64, 3008, 3008, 64, 64]
    - [0, 8.323]
  - - [3136, 1728, 1, 64, 3136, 3136, 64, 64]
    - [0, 8.351]
  - - [3264, 1728, 1, 64, 3264, 3264, 64, 64]
    - [0, 8.407]
  - - [3392, 1728, 1, 64, 3392, 3392, 64, 64]
    - [0, 8.376]
  - - [3520, 1728, 1, 64, 3520, 3520, 64, 64]
    - [0, 8.408]
  - - [3648, 1728, 1, 64, 3648, 3648, 64, 64]
    - [0, 8.454]
  - - [3776, 1728, 1, 64, 3776, 3776, 64, 64]
    - [0, 8.536]
  - - [3904, 1728, 1, 64, 3904, 3904, 64, 64]
    - [0, 8.497]
  - - [4032, 1728, 1, 64, 4032, 4032, 64, 64]
    - [0, 8.523]
  - - [64, 1856, 1, 64, 64, 64, 64, 64]
    - [1, 2.175]
  - - [192, 1856, 1, 64, 192, 192, 64, 64]
    - [0, 5.265]
  - - [320, 1856, 1, 64, 320, 320, 64, 64]
    - [0, 6.044]
  - - [448, 1856, 1, 64, 448, 448, 64, 64]
    - [0, 6.808]
  - - [576, 1856, 1, 64, 576, 576, 64, 64]
    - [0, 7.162]
  - - [704, 1856, 1, 64, 704, 704, 64, 64]
    - [0, 7.397]
  - - [832, 1856, 1, 64, 832, 832, 64, 64]
    - [0, 7.667]
  - - [960, 1856, 1, 64, 960, 960, 64, 64]
    - [0, 7.818]
  - - [1088, 1856, 1, 64, 1088, 1088, 64, 64]
    - [0, 7.942]
  - - [1216, 1856, 1, 64, 1216, 1216, 64, 64]
    - [0, 8.106]
  - - [1344, 1856, 1, 64, 1344, 1344, 64, 64]
    - [0, 8.21]
  - - [1472, 1856, 1, 64, 1472, 1472, 64, 64]
    - [0, 8.209]
  - - [1600, 1856, 1, 64, 1600, 1600, 64, 64]
    - [0, 7.555]
  - - [1728, 1856, 1, 64, 1728, 1728, 64, 64]
    - [0, 7.966]
  - - [1856, 1856, 1, 64, 1856, 1856, 64, 64]
    - [0, 7.949]
  - - [1984, 1856, 1, 64, 1984, 1984, 64, 64]
    - [0, 8.09]
  - - [2112, 1856, 1, 64, 2112, 2112, 64, 64]
    - [0, 8.103]
  - - [2240, 1856, 1, 64, 2240, 2240, 64, 64]
    - [0, 8.225]
  - - [2368, 1856, 1, 64, 2368, 2368, 64, 64]
    - [0, 8.232]
  - - [2496, 1856, 1, 64, 2496, 2496, 64, 64]
    - [0, 8.262]
  - - [2624, 1856, 1, 64, 2624, 2624, 64, 64]
    - [0, 8.355]
  - - [2752, 1856, 1, 64, 2752, 2752, 64, 64]
    - [0, 8.317]
  - - [2880, 1856, 1, 64, 2880, 2880, 64, 64]
    - [0, 8.372]
  - - [3008, 1856, 1, 64, 3008, 3008, 64, 64]
    - [0, 8.389]
  - - [3136, 1856, 1, 64, 3136, 3136, 64, 64]
    - [0, 8.412]
  - - [3264, 1856, 1, 64, 3264, 3264, 64, 64]
    - [0, 8.387]
  - - [3392, 1856, 1, 64, 3392, 3392, 64, 64]
    - [0, 8.487]
  - - [3520, 1856, 1, 64, 3520, 3520, 64, 64]
    - [0, 8.484]
  - - [3648, 1856, 1, 64, 3648, 3648, 64, 64]
    - [0, 8.525]
  - - [3776, 1856, 1, 64, 3776, 3776, 64, 64]
    - [0, 8.602]
  - - [3904, 1856, 1, 64, 3904, 3904, 64, 64]
    - [0, 8.538]
  - - [4032, 1856, 1, 64, 4032, 4032, 64, 64]
    - [0, 8.501]
  - - [64, 1984, 1, 64, 64, 64, 64, 64]
    - [0, 2.98]
  - - [192, 1984, 1, 64, 192, 192, 64, 64]
    - [0, 5.344]
  - - [320, 1984, 1, 64, 320, 320, 64, 64]
    - [0, 6.266]
  - - [448, 1984, 1, 64, 448, 448, 64, 64]
    - [0, 6.857]
  - - [576, 1984, 1, 64, 576, 576, 64, 64]
    - [0, 7.277]
  - - [704, 1984, 1, 64, 704, 704, 64, 64]
    - [0, 7.526]
  - - [832, 1984, 1, 64, 832, 832, 64, 64]
    - [0, 7.696]
  - - [960, 1984, 1, 64, 960, 960, 64, 64]
    - [0, 7.884]
  - - [1088, 1984, 1, 64, 1088, 1088, 64, 64]
    - [0, 8.066]
  - - [1216, 1984, 1, 64, 1216, 1216, 64, 64]
    - [0, 8.11]
  - - [1344, 1984, 1, 64, 1344, 1344, 64, 64]
    - [0, 8.206]
  - - [1472, 1984, 1, 64, 1472, 1472, 64, 64]
    - [0, 8.338]
  - - [1600, 1984, 1, 64, 1600, 1600, 64, 64]
    - [0, 7.971]
  - - [1728, 1984, 1, 64, 1728, 1728, 64, 64]
    - [0, 8.042]
  - - [1856, 1984, 1, 64, 1856, 1856, 64, 64]
    - [0, 7.979]
  - - [1984, 1984, 1, 64, 1984, 1984, 64, 64]
    - [0, 8.21]
  - - [2112, 1984, 1, 64, 2112, 2112, 64, 64]
    - [0, 8.193]
  - - [2240, 1984, 1, 64, 2240, 2240, 64, 64]
    - [0, 8.271]
  - - [2368, 1984, 1, 64, 2368, 2368, 64, 64]
    - [0, 8.249]
  - - [2496, 1984, 1, 64, 2496, 2496, 64, 64]
    - [0, 8.308]
  - - [2624, 1984, 1, 64, 2624, 2624, 64, 64]
    - [0, 8.348]
  - - [2752, 1984, 1, 64, 2752, 2752, 64, 64]
    - [0, 8.441]
  - - [2880, 1984, 1, 64, 2880, 2880, 64, 64]
    - [0, 8.343]
  - - [3008, 1984, 1, 64, 3008, 3008, 64, 64]
    - [0, 8.478]
  - - [3136, 1984, 1, 64, 3136, 3136, 64, 64]
    - [0, 8.481]
  - - [3264, 1984, 1, 64, 3264, 3264, 64, 64]
    - [0, 8.447]
  - - [3392, 1984, 1, 64, 3392, 3392, 64, 64]
    - [0, 8.509]
  - - [3520, 1984, 1, 64, 3520, 3520, 64, 64]
    - [0, 8.61]
  - - [3648, 1984, 1, 64, 3648, 3648, 64, 64]
    - [0, 8.548]
  - - [3776, 1984, 1, 64, 3776, 3776, 64, 64]
    - [0, 8.515]
  - - [3904, 1984, 1, 64, 3904, 3904, 64, 64]
    - [0, 8.572]
  - - [4032, 1984, 1, 64, 4032, 4032, 64, 64]
    - [0, 8.483]
  - - [64, 2112, 1, 64, 64, 64, 64, 64]
    - [0, 3.146]
  - - [192, 2112, 1, 64, 192, 192, 64, 64]
    - [0, 5.443]
  - - [320, 2112, 1, 64, 320, 320, 64, 64]
    - [0, 6.387]
  - - [448, 2112, 1, 64, 448, 448, 64, 64]
    - [0, 6.985]
  - - [576, 2112, 1, 64, 576, 576, 64, 64]
    - [0, 7.393]
  - - [704, 2112, 1, 64, 704, 704, 64, 64]
    - [0, 7.597]
  - - [832, 2112, 1, 64, 832, 832, 64, 64]
    - [0, 7.854]
  - - [960, 2112, 1, 64, 960, 960, 64, 64]
    - [0, 8.025]
  - - [1088, 2112, 1, 64, 1088, 1088, 64, 64]
    - [0, 8.151]
  - - [1216, 2112, 1, 64, 1216, 1216, 64, 64]
    - [0, 8.295]
  - - [1344, 2112, 1, 64, 1344, 1344, 64, 64]
    - [0, 8.289]
  - - [1472, 2112, 1, 64, 1472, 1472, 64, 64]
    - [0, 7.811]
  - - [1600, 2112, 1, 64, 1600, 1600, 64, 64]
    - [0, 7.987]
  - - [1728, 2112, 1, 64, 1728, 1728, 64, 64]
    - [0, 8.105]
  - - [1856, 2112, 1, 64, 1856, 1856, 64, 64]
    - [0, 8.148]
  - - [1984, 2112, 1, 64, 1984, 1984, 64, 64]
    - [0, 8.196]
  - - [2112, 2112, 1, 64, 2112, 2112, 64, 64]
    - [0, 8.157]
  - - [2240, 2112, 1, 64, 2240, 2240, 64, 64]
    - [0, 8.268]
  - - [2368, 2112, 1, 64, 2368, 2368, 64, 64]
    - [0, 8.341]
  - - [2496, 2112, 1, 64, 2496, 2496, 64, 64]
    - [0, 8.413]
  - - [2624, 2112, 1, 64, 2624, 2624, 64, 64]
    - [0, 8.42]
  - - [2752, 2112, 1, 64, 2752, 2752, 64, 64]
    - [0, 8.449]
  - - [2880, 2112, 1, 64, 2880, 2880, 64, 64]
    - [0, 8.522]
  - - [3008, 2112, 1, 64, 3008, 3008, 64, 64]
    - [0, 8.49]
  - - [3136, 2112, 1, 64, 3136, 3136, 64, 64]
    - [0, 8.506]
  - - [3264, 2112, 1, 64, 3264, 3264, 64, 64]
    - [0, 8.445]
  - - [3392, 2112, 1, 64, 3392, 3392, 64, 64]
    - [0, 8.537]
  - - [3520, 2112, 1, 64, 3520, 3520, 64, 64]
    - [0, 8.629]
  - - [3648, 2112, 1, 64, 3648, 3648, 64, 64]
    - [0, 8.55]
  - - [3776, 2112, 1, 64, 3776, 3776, 64, 64]
    - [0, 8.616]
  - - [3904, 2112, 1, 64, 3904, 3904, 64, 64]
    - [0, 8.587]
  - - [4032, 2112, 1, 64, 4032, 4032, 64, 64]
    - [0, 8.58]
  - - [64, 2240, 1, 64, 64, 64, 64, 64]
    - [0, 3.331]
  - - [192, 2240, 1, 64, 192, 192, 64, 64]
    - [0, 5.623]
  - - [320, 2240, 1, 64, 320, 320, 64, 64]
    - [0, 6.645]
  - - [448, 2240, 1, 64, 448, 448, 64, 64]
    - [0, 7.178]
  - - [576, 2240, 1, 64, 576, 576, 64, 64]
    - [0, 7.396]
  - - [704, 2240, 1, 64, 704, 704, 64, 64]
    - [0, 7.757]
  - - [832, 2240, 1, 64, 832, 832, 64, 64]
    - [0, 7.831]
  - - [960, 2240, 1, 64, 960, 960, 64, 64]
    - [0, 7.981]
  - - [1088, 2240, 1, 64, 1088, 1088, 64, 64]
    - [0, 8.231]
  - - [1216, 2240, 1, 64, 1216, 1216, 64, 64]
    - [0, 8.261]
  - - [1344, 2240, 1, 64, 1344, 1344, 64, 64]
    - [0, 7.573]
  - - [1472, 2240, 1, 64, 1472, 1472, 64, 64]
    - [0, 8.047]
  - - [1600, 2240, 1, 64, 1600, 1600, 64, 64]
    - [0, 8.01]
  - - [1728, 2240, 1, 64, 1728, 1728, 64, 64]
    - [0, 8.149]
  - - [1856, 2240, 1, 64, 1856, 1856, 64, 64]
    - [0, 8.152]
  - - [1984, 2240, 1, 64, 1984, 1984, 64, 64]
    - [0, 8.254]
  - - [2112, 2240, 1, 64, 2112, 2112, 64, 64]
    - [0, 8.296]
  - - [2240, 2240, 1, 64, 2240, 2240, 64, 64]
    - [0, 8.383]
  - - [2368, 2240, 1, 64, 2368, 2368, 64, 64]
    - [0, 8.312]
  - - [2496, 2240, 1, 64, 2496, 2496, 64, 64]
    - [0, 8.341]
  - - [2624, 2240, 1, 64, 2624, 2624, 64, 64]
    - [0, 8.468]
  - - [2752, 2240, 1, 64, 2752, 2752, 64, 64]
    - [0, 8.473]
  - - [2880, 2240, 1, 64, 2880, 2880, 64, 64]
    - [0, 8.551]
  - - [3008, 2240, 1, 64, 3008, 3008, 64, 64]
    - [0, 8.578]
  - - [3136, 2240, 1, 64, 3136, 3136, 64, 64]
    - [0, 8.57]
  - - [3264, 2240, 1, 64, 3264, 3264, 64, 64]
    - [0, 8.495]
  - - [3392, 2240, 1, 64, 3392, 3392, 64, 64]
    - [0, 8.63]
  - - [3520, 2240, 1, 64, 3520, 3520, 64, 64]
    - [0, 8.548]
  - - [3648, 2240, 1, 64, 3648, 3648, 64, 64]
    - [0, 8.653]
  - - [3776, 2240, 1, 64, 3776, 3776, 64, 64]
    - [0, 8.597]
  - - [3904, 2240, 1, 64, 3904, 3904, 64, 64]
    - [0, 8.624]
  - - [4032, 2240, 1, 64, 4032, 4032, 64, 64]
    - [0, 8.605]
  - - [64, 2368, 1, 64, 64, 64, 64, 64]
    - [0, 3.516]
  - - [192, 2368, 1, 64, 192, 192, 64, 64]
    - [0, 5.628]
  - - [320, 2368, 1, 64, 320, 320, 64, 64]
    - [0, 6.634]
  - - [448, 2368, 1, 64, 448, 448, 64, 64]
    - [0, 7.147]
  - - [576, 2368, 1, 64, 576, 576, 64, 64]
    - [0, 7.589]
  - - [704, 2368, 1, 64, 704, 704, 64, 64]
    - [0, 7.794]
  - - [832, 2368, 1, 64, 832, 832, 64, 64]
    - [0, 7.988]
  - - [960, 2368, 1, 64, 960, 960, 64, 64]
    - [0, 8.139]
  - - [1088, 2368, 1, 64, 1088, 1088, 64, 64]
    - [0, 8.216]
  - - [1216, 2368, 1, 64, 1216, 1216, 64, 64]
    - [0, 8.29]
  - - [1344, 2368, 1, 64, 1344, 1344, 64, 64]
    - [0, 7.968]
  - - [1472, 2368, 1, 64, 1472, 1472, 64, 64]
    - [0, 8.115]
  - - [1600, 2368, 1, 64, 1600, 1600, 64, 64]
    - [0, 8.109]
  - - [1728, 2368, 1, 64, 1728, 1728, 64, 64]
    - [0, 8.186]
  - - [1856, 2368, 1, 64, 1856, 1856, 64, 64]
    - [0, 8.248]
  - - [1984, 2368, 1, 64, 1984, 1984, 64, 64]
    - [0, 8.273]
  - - [2112, 2368, 1, 64, 2112, 2112, 64, 64]
    - [0, 8.294]
  - - [2240, 2368, 1, 64, 2240, 2240, 64, 64]
    - [0, 8.364]
  - - [2368, 2368, 1, 64, 2368, 2368, 64, 64]
    - [0, 8.429]
  - - [2496, 2368, 1, 64, 2496, 2496, 64, 64]
    - [0, 8.351]
  - - [2624, 2368, 1, 64, 2624, 2624, 64, 64]
    - [0, 8.508]
  - - [2752, 2368, 1, 64, 2752, 2752, 64, 64]
    - [0, 8.479]
  - - [2880, 2368, 1, 64, 2880, 2880, 64, 64]
    - [0, 8.508]
  - - [3008, 2368, 1, 64, 3008, 3008, 64, 64]
    - [0, 8.548]
  - - [3136, 2368, 1, 64, 3136, 3136, 64, 64]
    - [0, 8.564]
  - - [3264, 2368, 1, 64, 3264, 3264, 64, 64]
    - [0, 8.495]
  - - [3392, 2368, 1, 64, 3392, 3392, 64, 64]
    - [0, 8.617]
  - - [3520, 2368, 1, 64, 3520, 3520, 64, 64]
    - [0, 8.583]
  - - [3648, 2368, 1, 64, 3648, 3648, 64, 64]
    - [0, 8.62]
  - - [3776, 2368, 1, 64, 3776, 3776, 64, 64]
    - [0, 8.579]
  - - [3904, 2368, 1, 64, 3904, 3904, 64, 64]
    - [0, 8.6]
  - - [4032, 2368, 1, 64, 4032, 4032, 64, 64]
    - [0, 8.692]
  - - [64, 2496, 1, 64, 64, 64, 64, 64]
    - [0, 3.47]
  - - [192, 2496, 1, 64, 192, 192, 64, 64]
    - [0, 5.783]
  - - [320, 2496, 1, 64, 320, 320, 64, 64]
    - [0, 6.76]
  - - [448, 2496, 1, 64, 448, 448, 64, 64]
    - [0, 7.313]
  - - [576, 2496, 1, 64, 576, 576, 64, 64]
    - [0, 7.578]
  - - [704, 2496, 1, 64, 704, 704, 64, 64]
    - [0, 7.858]
  - - [832, 2496, 1, 64, 832, 832, 64, 64]
    - [0, 8.009]
  - - [960, 2496, 1, 64, 960, 960, 64, 64]
    - [0, 8.174]
  - - [1088, 2496, 1, 64, 1088, 1088, 64, 64]
    - [0, 8.273]
  - - [1216, 2496, 1, 64, 1216, 1216, 64, 64]
    - [0, 7.636]
  - - [1344, 2496, 1, 64, 1344, 1344, 64, 64]
    - [0, 7.973]
  - - [1472, 2496, 1, 64, 1472, 1472, 64, 64]
    - [0, 8.09]
  - - [1600, 2496, 1, 64, 1600, 1600, 64, 64]
    - [0, 8.136]
  - - [1728, 2496, 1, 64, 1728, 1728, 64, 64]
    - [0, 8.286]
  - - [1856, 2496, 1, 64, 1856, 1856, 64, 64]
    - [0, 8.292]
  - - [1984, 2496, 1, 64, 1984, 1984, 64, 64]
    - [0, 8.272]
  - - [2112, 2496, 1, 64, 2112, 2112, 64, 64]
    - [0, 8.374]
  - - [2240, 2496, 1, 64, 2240, 2240, 64, 64]
    - [0, 8.401]
  - - [2368, 2496, 1, 64, 2368, 2368, 64, 64]
    - [0, 8.413]
  - - [2496, 2496, 1, 64, 2496, 2496, 64, 64]
    - [0, 8.52]
  - - [2624, 2496, 1, 64, 2624, 2624, 64, 64]
    - [0, 8.531]
  - - [2752, 2496, 1, 64, 2752, 2752, 64, 64]
    - [0, 8.475]
  - - [2880, 2496, 1, 64, 2880, 2880, 64, 64]
    - [0, 8.563]
  - - [3008, 2496, 1, 64, 3008, 3008, 64, 64]
    - [0, 8.64]
  - - [3136, 2496, 1, 64, 3136, 3136, 64, 64]
    - [0, 8.509]
  - - [3264, 2496, 1, 64, 3264, 3264, 64, 64]
    - [0, 8.592]
  - - [3392, 2496, 1, 64, 3392, 3392, 64, 64]
    - [0, 8.65]
  - - [3520, 2496, 1, 64, 3520, 3520, 64, 64]
    - [0, 8.624]
  - - [3648, 2496, 1, 64, 3648, 3648, 64, 64]
    - [0, 8.54]
  - - [3776, 2496, 1, 64, 3776, 3776, 64, 64]
    - [0, 8.647]
  - - [3904, 2496, 1, 64, 3904, 3904, 64, 64]
    - [0, 8.677]
  - - [4032, 2496, 1, 64, 4032, 4032, 64, 64]
    - [0, 8.607]
  - - [64, 2624, 1, 64, 64, 64, 64, 64]
    - [0, 3.645]
  - - [192, 2624, 1, 64, 192, 192, 64, 64]
    - [0, 5.898]
  - - [320, 2624, 1, 64, 320, 320, 64, 64]
    - [0, 6.855]
  - - [448, 2624, 1, 64, 448, 448, 64, 64]
    - [0, 7.387]
  - - [576, 2624, 1, 64, 576, 576, 64, 64]
    - [0, 7.683]
  - - [704, 2624, 1, 64, 704, 704, 64, 64]
    - [0, 7.942]
  - - [832, 2624, 1, 64, 832, 832, 64, 64]
    - [0, 8.073]
  - - [960, 2624, 1, 64, 960, 960, 64, 64]
    - [0, 8.246]
  - - [1088, 2624, 1, 64, 1088, 1088, 64, 64]
    - [0, 8.372]
  - - [1216, 2624, 1, 64, 1216, 1216, 64, 64]
    - [0, 7.988]
  - - [1344, 2624, 1, 64, 1344, 1344, 64, 64]
    - [0, 8.086]
  - - [1472, 2624, 1, 64, 1472, 1472, 64, 64]
    - [0, 8.138]
  - - [1600, 2624, 1, 64, 1600, 1600, 64, 64]
    - [0, 8.19]
  - - [1728, 2624, 1, 64, 1728, 1728, 64, 64]
    - [0, 8.211]
  - - [1856, 2624, 1, 64, 1856, 1856, 64, 64]
    - [0, 8.308]
  - - [1984, 2624, 1, 64, 1984, 1984, 64, 64]
    - [0, 8.316]
  - - [2112, 2624, 1, 64, 2112, 2112, 64, 64]
    - [0, 8.406]
  - - [2240, 2624, 1, 64, 2240, 2240, 64, 64]
    - [0, 8.435]
  - - [2368, 2624, 1, 64, 2368, 2368, 64, 64]
    - [0, 8.459]
  - - [2496, 2624, 1, 64, 2496, 2496, 64, 64]
    - [0, 8.491]
  - - [2624, 2624, 1, 64, 2624, 2624, 64, 64]
    - [0, 8.542]
  - - [2752, 2624, 1, 64, 2752, 2752, 64, 64]
    - [0, 8.535]
  - - [2880, 2624, 1, 64, 2880, 2880, 64, 64]
    - [0, 8.548]
  - - [3008, 2624, 1, 64, 3008, 3008, 64, 64]
    - [0, 8.607]
  - - [3136, 2624, 1, 64, 3136, 3136, 64, 64]
    - [0, 8.597]
  - - [3264, 2624, 1, 64, 3264, 3264, 64, 64]
    - [0, 8.641]
  - - [3392, 2624, 1, 64, 3392, 3392, 64, 64]
    - [0, 8.643]
  - - [3520, 2624, 1, 64, 3520, 3520, 64, 64]
    - [0, 8.557]
  - - [3648, 2624, 1, 64, 3648, 3648, 64, 64]
    - [0, 8.631]
  - - [3776, 2624, 1, 64, 3776, 3776, 64, 64]
    - [0, 8.683]
  - - [3904, 2624, 1, 64, 3904, 3904, 64, 64]
    - [0, 8.654]
  - - [4032, 2624, 1, 64, 4032, 4032, 64, 64]
    - [0, 8.667]
  - - [64, 2752, 1, 64, 64, 64, 64, 64]
    - [0, 3.798]
  - - [192, 2752, 1, 64, 192, 192, 64, 64]
    - [0, 5.986]
  - - [320, 2752, 1, 64, 320, 320, 64, 64]
    - [0, 6.892]
  - - [448, 2752, 1, 64, 448, 448, 64, 64]
    - [0, 7.363]
  - - [576, 2752, 1, 64, 576, 576, 64, 64]
    - [0, 7.729]
  - - [704, 2752, 1, 64, 704, 704, 64, 64]
    - [0, 7.945]
  - - [832, 2752, 1, 64, 832, 832, 64, 64]
    - [0, 8.142]
  - - [960, 2752, 1, 64, 960, 960, 64, 64]
    - [0, 8.205]
  - - [1088, 2752, 1, 64, 1088, 1088, 64, 64]
    - [0, 7.738]
  - - [1216, 2752, 1, 64, 1216, 1216, 64, 64]
    - [0, 7.491]
  - - [1344, 2752, 1, 64, 1344, 1344, 64, 64]
    - [0, 8.126]
  - - [1472, 2752, 1, 64, 1472, 1472, 64, 64]
    - [0, 8.14]
  - - [1600, 2752, 1, 64, 1600, 1600, 64, 64]
    - [0, 8.27]
  - - [1728, 2752, 1, 64, 1728, 1728, 64, 64]
    - [0, 8.277]
  - - [1856, 2752, 1, 64, 1856, 1856, 64, 64]
    - [0, 8.298]
  - - [1984, 2752, 1, 64, 1984, 1984, 64, 64]
    - [0, 8.363]
  - - [2112, 2752, 1, 64, 2112, 2112, 64, 64]
    - [0, 8.437]
  - - [2240, 2752, 1, 64, 2240, 2240, 64, 64]
    - [0, 8.394]
  - - [2368, 2752, 1, 64, 2368, 2368, 64, 64]
    - [0, 8.398]
  - - [2496, 2752, 1, 64, 2496, 2496, 64, 64]
    - [0, 8.507]
  - - [2624, 2752, 1, 64, 2624, 2624, 64, 64]
    - [0, 8.529]
  - - [2752, 2752, 1, 64, 2752, 2752, 64, 64]
    - [0, 8.546]
  - - [2880, 2752, 1, 64, 2880, 2880, 64, 64]
    - [0, 8.577]
  - - [3008, 2752, 1, 64, 3008, 3008, 64, 64]
    - [0, 8.622]
  - - [3136, 2752, 1, 64, 3136, 3136, 64, 64]
    - [0, 8.603]
  - - [3264, 2752, 1, 64, 3264, 3264, 64, 64]
    - [0, 8.615]
  - - [3392, 2752, 1, 64, 3392, 3392, 64, 64]
    - [0, 8.63]
  - - [3520, 2752, 1, 64, 3520, 3520, 64, 64]
    - [0, 8.666]
  - - [3648, 2752, 1, 64, 3648, 3648, 64, 64]
    - [0, 8.611]
  - - [3776, 2752, 1, 64, 3776, 3776, 64, 64]
    - [0, 8.592]
  - - [3904, 2752, 1, 64, 3904, 3904, 64, 64]
    - [0, 8.597]
  - - [4032, 2752, 1, 64, 4032, 4032, 64, 64]
    - [0, 8.697]
  - - [64, 2880, 1, 64, 64, 64, 64, 64]
    - [0, 3.964]
  - - [192, 2880, 1, 64, 192, 192, 64, 64]
    - [0, 6.085]
  - - [320, 2880, 1, 64, 320, 320, 64, 64]
    - [0, 6.935]
  - - [448, 2880, 1, 64, 448, 448, 64, 64]
    - [0, 7.452]
  - - [576, 2880, 1, 64, 576, 576, 64, 64]
    - [0, 7.761]
  - - [704, 2880, 1, 64, 704, 704, 64, 64]
    - [0, 7.951]
  - - [832, 2880, 1, 64, 832, 832, 64, 64]
    - [0, 8.046]
  - - [960, 2880, 1, 64, 960, 960, 64, 64]
    - [0, 8.24]
  - - [1088, 2880, 1, 64, 1088, 1088, 64, 64]
    - [0, 7.87]
  - - [1216, 2880, 1, 64, 1216, 1216, 64, 64]
    - [0, 8.003]
  - - [1344, 2880, 1, 64, 1344, 1344, 64, 64]
    - [0, 8.066]
  - - [1472, 2880, 1, 64, 1472, 1472, 64, 64]
    - [0, 8.101]
  - - [1600, 2880, 1, 64, 1600, 1600, 64, 64]
    - [0, 8.284]
  - - [1728, 2880, 1, 64, 1728, 1728, 64, 64]
    - [0, 8.27]
  - - [1856, 2880, 1, 64, 1856, 1856, 64, 64]
    - [0, 8.261]
  - - [1984, 2880, 1, 64, 1984, 1984, 64, 64]
    - [0, 8.297]
  - - [2112, 2880, 1, 64, 2112, 2112, 64, 64]
    - [0, 8.429]
  - - [2240, 2880, 1, 64, 2240, 2240, 64, 64]
    - [0, 8.399]
  - - [2368, 2880, 1, 64, 2368, 2368, 64, 64]
    - [0, 8.493]
  - - [2496, 2880, 1, 64, 2496, 2496, 64, 64]
    - [0, 8.451]
  - - [2624, 2880, 1, 64, 2624, 2624, 64, 64]
    - [0, 8.556]
  - - [2752, 2880, 1, 64, 2752, 2752, 64, 64]
    - [0, 8.453]
  - - [2880, 2880, 1, 64, 2880, 2880, 64, 64]
    - [0, 8.579]
  - - [3008, 2880, 1, 64, 3008, 3008, 64, 64]
    - [0, 8.552]
  - - [3136, 2880, 1, 64, 3136, 3136, 64, 64]
    - [0, 8.627]
  - - [3264, 2880, 1, 64, 3264, 3264, 64, 64]
    - [0, 8.602]
  - - [3392, 2880, 1, 64, 3392, 3392, 64, 64]
    - [0, 8.555]
  - - [3520, 2880, 1, 64, 3520, 3520, 64, 64]
    - [0, 8.58]
  - - [3648, 2880, 1, 64, 3648, 3648, 64, 64]
    - [0, 8.619]
  - - [3776, 2880, 1, 64, 3776, 3776, 64, 64]
    - [0, 8.67]
  - - [3904, 2880, 1, 64, 3904, 3904, 64, 64]
    - [0, 8.72]
  - - [4032, 2880, 1, 64, 4032, 4032, 64, 64]
    - [0, 8.699]
  - - [64, 3008, 1, 64, 64, 64, 64, 64]
    - [0, 3.882]
  - - [192, 3008, 1, 64, 192, 192, 64, 64]
    - [0, 6.131]
  - - [320, 3008, 1, 64, 320, 320, 64, 64]
    - [0, 7.034]
  - - [448, 3008, 1, 64, 448, 448, 64, 64]
    - [0, 7.435]
  - - [576, 3008, 1, 64, 576, 576, 64, 64]
    - [0, 7.757]
  - - [704, 3008, 1, 64, 704, 704, 64, 64]
    - [0, 8.029]
  - - [832, 3008, 1, 64, 832, 832, 64, 64]
    - [0, 8.161]
  - - [960, 3008, 1, 64, 960, 960, 64, 64]
    - [0, 8.363]
  - - [1088, 3008, 1, 64, 1088, 1088, 64, 64]
    - [0, 7.951]
  - - [1216, 3008, 1, 64, 1216, 1216, 64, 64]
    - [0, 8.102]
  - - [1344, 3008, 1, 64, 1344, 1344, 64, 64]
    - [0, 8.111]
  - - [1472, 3008, 1, 64, 1472, 1472, 64, 64]
    - [0, 8.153]
  - - [1600, 3008, 1, 64, 1600, 1600, 64, 64]
    - [0, 8.203]
  - - [1728, 3008, 1, 64, 1728, 1728, 64, 64]
    - [0, 8.274]
  - - [1856, 3008, 1, 64, 1856, 1856, 64, 64]
    - [0, 8.365]
  - - [1984, 3008, 1, 64, 1984, 1984, 64, 64]
    - [0, 8.374]
  - - [2112, 3008, 1, 64, 2112, 2112, 64, 64]
    - [0, 8.483]
  - - [2240, 3008, 1, 64, 2240, 2240, 64, 64]
    - [0, 8.406]
  - - [2368, 3008, 1, 64, 2368, 2368, 64, 64]
    - [0, 8.493]
  - - [2496, 3008, 1, 64, 2496, 2496, 64, 64]
    - [0, 8.421]
  - - [2624, 3008, 1, 64, 2624, 2624, 64, 64]
    - [0, 8.493]
  - - [2752, 3008, 1, 64, 2752, 2752, 64, 64]
    - [0, 8.53]
  - - [2880, 3008, 1, 64, 2880, 2880, 64, 64]
    - [0, 8.539]
  - - [3008, 3008, 1, 64, 3008, 3008, 64, 64]
    - [0, 8.53]
  - - [3136, 3008, 1, 64, 3136, 3136, 64, 64]
    - [0, 8.634]
  - - [3264, 3008, 1, 64, 3264, 3264, 64, 64]
    - [0, 8.643]
  - - [3392, 3008, 1, 64, 3392, 3392, 64, 64]
    - [0, 8.662]
  - - [3520, 3008, 1, 64, 3520, 3520, 64, 64]
    - [0, 8.647]
  - - [3648, 3008, 1, 64, 3648, 3648, 64, 64]
    - [0, 8.663]
  - - [3776, 3008, 1, 64, 3776, 3776, 64, 64]
    - [0, 8.695]
  - - [3904, 3008, 1, 64, 3904, 3904, 64, 64]
    - [0, 8.644]
  - - [4032, 3008, 1, 64, 4032, 4032, 64, 64]
    - [0, 8.71]
  - - [64, 3136, 1, 64, 64, 64, 64, 64]
    - [0, 3.981]
  - - [192, 3136, 1, 64, 192, 192, 64, 64]
    - [0, 6.178]
  - - [320, 3136, 1, 64, 320, 320, 64, 64]
    - [0, 7.088]
  - - [448, 3136, 1, 64, 448, 448, 64, 64]
    - [0, 7.582]
  - - [576, 3136, 1, 64, 576, 576, 64, 64]
    - [0, 7.835]
  - - [704, 3136, 1, 64, 704, 704, 64, 64]
    - [0, 8.082]
  - - [832, 3136, 1, 64, 832, 832, 64, 64]
    - [0, 8.201]
  - - [960, 3136, 1, 64, 960, 960, 64, 64]
    - [0, 7.572]
  - - [1088, 3136, 1, 64, 1088, 1088, 64, 64]
    - [0, 8.007]
  - - [1216, 3136, 1, 64, 1216, 1216, 64, 64]
    - [0, 8.079]
  - - [1344, 3136, 1, 64, 1344, 1344, 64, 64]
    - [0, 8.166]
  - - [1472, 3136, 1, 64, 1472, 1472, 64, 64]
    - [0, 8.089]
  - - [1600, 3136, 1, 64, 1600, 1600, 64, 64]
    - [0, 8.286]
  - - [1728, 3136, 1, 64, 1728, 1728, 64, 64]
    - [0, 8.283]
  - - [1856, 3136, 1, 64, 1856, 1856, 64, 64]
    - [0, 8.381]
  - - [1984, 3136, 1, 64, 1984, 1984, 64, 64]
    - [0, 8.443]
  - - [2112, 3136, 1, 64, 2112, 2112, 64, 64]
    - [0, 8.475]
  - - [2240, 3136, 1, 64, 2240, 2240, 64, 64]
    - [0, 8.457]
  - - [2368, 3136, 1, 64, 2368, 2368, 64, 64]
    - [0, 8.491]
  - - [2496, 3136, 1, 64, 2496, 2496, 64, 64]
    - [0, 8.569]
  - - [2624, 3136, 1, 64, 2624, 2624, 64, 64]
    - [0, 8.573]
  - - [2752, 3136, 1, 64, 2752, 2752, 64, 64]
    - [0, 8.636]
  - - [2880, 3136, 1, 64, 2880, 2880, 64, 64]
    - [0, 8.645]
  - - [3008, 3136, 1, 64, 3008, 3008, 64, 64]
    - [0, 8.63]
  - - [3136, 3136, 1, 64, 3136, 3136, 64, 64]
    - [0, 8.605]
  - - [3264, 3136, 1, 64, 3264, 3264, 64, 64]
    - [0, 8.621]
  - - [3392, 3136, 1, 64, 3392, 3392, 64, 64]
    - [0, 8.655]
  - - [3520, 3136, 1, 64, 3520, 3520, 64, 64]
    - [0, 8.64]
  - - [3648, 3136, 1, 64, 3648, 3648, 64, 64]
    - [0, 8.66]
  - - [3776, 3136, 1, 64, 3776, 3776, 64, 64]
    - [0, 8.737]
  - - [3904, 3136, 1, 64, 3904, 3904, 64, 64]
    - [0, 8.665]
  - - [4032, 3136, 1, 64, 4032, 4032, 64, 64]
    - [0, 8.729]
  - - [64, 3264, 1, 64, 64, 64, 64, 64]
    - [0, 4.178]
  - - [192, 3264, 1, 64, 192, 192, 64, 64]
    - [0, 6.341]
  - - [320, 3264, 1, 64, 320, 320, 64, 64]
    - [0, 7.189]
  - - [448, 3264, 1, 64, 448, 448, 64, 64]
    - [0, 7.64]
  - - [576, 3264, 1, 64, 576, 576, 64, 64]
    - [0, 7.952]
  - - [704, 3264, 1, 64, 704, 704, 64, 64]
    - [0, 8.066]
  - - [832, 3264, 1, 64, 832, 832, 64, 64]
    - [0, 8.289]
  - - [960, 3264, 1, 64, 960, 960, 64, 64]
    - [0, 7.871]
  - - [1088, 3264, 1, 64, 1088, 1088, 64, 64]
    - [0, 7.999]
  - - [1216, 3264, 1, 64, 1216, 1216, 64, 64]
    - [0, 8.11]
  - - [1344, 3264, 1, 64, 1344, 1344, 64, 64]
    - [0, 8.25]
  - - [1472, 3264, 1, 64, 1472, 1472, 64, 64]
    - [0, 8.237]
  - - [1600, 3264, 1, 64, 1600, 1600, 64, 64]
    - [0, 8.302]
  - - [1728, 3264, 1, 64, 1728, 1728, 64, 64]
    - [0, 8.409]
  - - [1856, 3264, 1, 64, 1856, 1856, 64, 64]
    - [0, 8.434]
  - - [1984, 3264, 1, 64, 1984, 1984, 64, 64]
    - [0, 8.427]
  - - [2112, 3264, 1, 64, 2112, 2112, 64, 64]
    - [0, 8.487]
  - - [2240, 3264, 1, 64, 2240, 2240, 64, 64]
    - [0, 8.522]
  - - [2368, 3264, 1, 64, 2368, 2368, 64, 64]
    - [0, 8.566]
  - - [2496, 3264, 1, 64, 2496, 2496, 64, 64]
    - [0, 8.511]
  - - [2624, 3264, 1, 64, 2624, 2624, 64, 64]
    - [0, 8.559]
  - - [2752, 3264, 1, 64, 2752, 2752, 64, 64]
    - [0, 8.652]
  - - [2880, 3264, 1, 64, 2880, 2880, 64, 64]
    - [0, 8.638]
  - - [3008, 3264, 1, 64, 3008, 3008, 64, 64]
    - [0, 8.645]
  - - [3136, 3264, 1, 64, 3136, 3136, 64, 64]
    - [0, 8.635]
  - - [3264, 3264, 1, 64, 3264, 3264, 64, 64]
    - [0, 8.643]
  - - [3392, 3264, 1, 64, 3392, 3392, 64, 64]
    - [0, 8.721]
  - - [3520, 3264, 1, 64, 3520, 3520, 64, 64]
    - [0, 8.63]
  - - [3648, 3264, 1, 64, 3648, 3648, 64, 64]
    - [0, 8.701]
  - - [3776, 3264, 1, 64, 3776, 3776, 64, 64]
    - [0, 8.686]
  - - [3904, 3264, 1, 64, 3904, 3904, 64, 64]
    - [0, 8.703]
  - - [4032, 3264, 1, 64, 4032, 4032, 64, 64]
    - [0, 8.654]
  - - [64, 3392, 1, 64, 64, 64, 64, 64]
    - [0, 4.145]
  - - [192, 3392, 1, 64, 192, 192, 64, 64]
    - [0, 6.354]
  - - [320, 3392, 1, 64, 320, 320, 64, 64]
    - [0, 7.233]
  - - [448, 3392, 1, 64, 448, 448, 64, 64]
    - [0, 7.666]
  - - [576, 3392, 1, 64, 576, 576, 64, 64]
    - [0, 7.982]
  - - [704, 3392, 1, 64, 704, 704, 64, 64]
    - [0, 8.113]
  - - [832, 3392, 1, 64, 832, 832, 64, 64]
    - [0, 8.254]
  - - [960, 3392, 1, 64, 960, 960, 64, 64]
    - [0, 7.965]
  - - [1088, 3392, 1, 64, 1088, 1088, 64, 64]
    - [0, 8.091]
  - - [1216, 3392, 1, 64, 1216, 1216, 64, 64]
    - [0, 8.125]
  - - [1344, 3392, 1, 64, 1344, 1344, 64, 64]
    - [0, 8.238]
  - - [1472, 3392, 1, 64, 1472, 1472, 64, 64]
    - [0, 8.274]
  - - [1600, 3392, 1, 64, 1600, 1600, 64, 64]
    - [0, 8.335]
  - - [1728, 3392, 1, 64, 1728, 1728, 64, 64]
    - [0, 8.317]
  - - [1856, 3392, 1, 64, 1856, 1856, 64, 64]
    - [0, 8.425]
  - - [1984, 3392, 1, 64, 1984, 1984, 64, 64]
    - [0, 8.507]
  - - [2112, 3392, 1, 64, 2112, 2112, 64, 64]
    - [0, 8.493]
  - - [2240, 3392, 1, 64, 2240, 2240, 64, 64]
    - [0, 8.574]
  - - [2368, 3392, 1, 64, 2368, 2368, 64, 64]
    - [0, 8.527]
  - - [2496, 3392, 1, 64, 2496, 2496, 64, 64]
    - [0, 8.581]
  - - [2624, 3392, 1, 64, 2624, 2624, 64, 64]
    - [0, 8.59]
  - - [2752, 3392, 1, 64, 2752, 2752, 64, 64]
    - [0, 8.642]
  - - [2880, 3392, 1, 64, 2880, 2880, 64, 64]
    - [0, 8.634]
  - - [3008, 3392, 1, 64, 3008, 3008, 64, 64]
    - [0, 8.671]
  - - [3136, 3392, 1, 64, 3136, 3136, 64, 64]
    - [0, 8.696]
  - - [3264, 3392, 1, 64, 3264, 3264, 64, 64]
    - [0, 8.677]
  - - [3392, 3392, 1, 64, 3392, 3392, 64, 64]
    - [0, 8.693]
  - - [3520, 3392, 1, 64, 3520, 3520, 64, 64]
    - [0, 8.648]
  - - [3648, 3392, 1, 64, 3648, 3648, 64, 64]
    - [0, 8.691]
  - - [3776, 3392, 1, 64, 3776, 3776, 64, 64]
    - [0, 8.715]
  - - [3904, 3392, 1, 64, 3904, 3904, 64, 64]
    - [0, 8.715]
  - - [4032, 3392, 1, 64, 4032, 4032, 64, 64]
    - [0, 8.767]
  - - [64, 3520, 1, 64, 64, 64, 64, 64]
    - [0, 4.223]
  - - [192, 3520, 1, 64, 192, 192, 64, 64]
    - [0, 6.435]
  - - [320, 3520, 1, 64, 320, 320, 64, 64]
    - [0, 7.271]
  - - [448, 3520, 1, 64, 448, 448, 64, 64]
    - [0, 7.73]
  - - [576, 3520, 1, 64, 576, 576, 64, 64]
    - [0, 7.971]
  - - [704, 3520, 1, 64, 704, 704, 64, 64]
    - [0, 8.155]
  - - [832, 3520, 1, 64, 832, 832, 64, 64]
    - [0, 8.264]
  - - [960, 3520, 1, 64, 960, 960, 64, 64]
    - [0, 7.983]
  - - [1088, 3520, 1, 64, 1088, 1088, 64, 64]
    - [0, 8.134]
  - - [1216, 3520, 1, 64, 1216, 1216, 64, 64]
    - [0, 8.156]
  - - [1344, 3520, 1, 64, 1344, 1344, 64, 64]
    - [0, 8.275]
  - - [1472, 3520, 1, 64, 1472, 1472, 64, 64]
    - [0, 8.268]
  - - [1600, 3520, 1, 64, 1600, 1600, 64, 64]
    - [0, 8.377]
  - - [1728, 3520, 1, 64, 1728, 1728, 64, 64]
    - [0, 8.45]
  - - [1856, 3520, 1, 64, 1856, 1856, 64, 64]
    - [0, 8.479]
  - - [1984, 3520, 1, 64, 1984, 1984, 64, 64]
    - [0, 8.474]
  - - [2112, 3520, 1, 64, 2112, 2112, 64, 64]
    - [0, 8.523]
  - - [2240, 3520, 1, 64, 2240, 2240, 64, 64]
    - [0, 8.653]
  - - [2368, 3520, 1, 64, 2368, 2368, 64, 64]
    - [0, 8.603]
  - - [2496, 3520, 1, 64, 2496, 2496, 64, 64]
    - [0, 8.571]
  - - [2624, 3520, 1, 64, 2624, 2624, 64, 64]
    - [0, 8.636]
  - - [2752, 3520, 1, 64, 2752, 2752, 64, 64]
    - [0, 8.614]
  - - [2880, 3520, 1, 64, 2880, 2880, 64, 64]
    - [0, 8.668]
  - - [3008, 3520, 1, 64, 3008, 3008, 64, 64]
    - [0, 8.673]
  - - [3136, 3520, 1, 64, 3136, 3136, 64, 64]
    - [0, 8.675]
  - - [3264, 3520, 1, 64, 3264, 3264, 64, 64]
    - [0, 8.698]
  - - [3392, 3520, 1, 64, 3392, 3392, 64, 64]
    - [0, 8.629]
  - - [3520, 3520, 1, 64, 3520, 3520, 64, 64]
    - [0, 8.7]
  - - [3648, 3520, 1, 64, 3648, 3648, 64, 64]
    - [0, 8.681]
  - - [3776, 3520, 1, 64, 3776, 3776, 64, 64]
    - [0, 8.689]
  - - [3904, 3520, 1, 64, 3904, 3904, 64, 64]
    - [0, 8.82]
  - - [4032, 3520, 1, 64, 4032, 4032, 64, 64]
    - [0, 8.734]
  - - [64, 3648, 1, 64, 64, 64, 64, 64]
    - [0, 4.388]
  - - [192, 3648, 1, 64, 192, 192, 64, 64]
    - [0, 6.455]
  - - [320, 3648, 1, 64, 320, 320, 64, 64]
    - [0, 7.326]
  - - [448, 3648, 1, 64, 448, 448, 64, 64]
    - [0, 7.721]
  - - [576, 3648, 1, 64, 576, 576, 64, 64]
    - [0, 8.039]
  - - [704, 3648, 1, 64, 704, 704, 64, 64]
    - [0, 8.034]
  - - [832, 3648, 1, 64, 832, 832, 64, 64]
    - [0, 7.634]
  - - [960, 3648, 1, 64, 960, 960, 64, 64]
    - [0, 8.003]
  - - [1088, 3648, 1, 64, 1088, 1088, 64, 64]
    - [0, 8.046]
  - - [1216, 3648, 1, 64, 1216, 1216, 64, 64]
    - [0, 8.194]
  - - [1344, 3648, 1, 64, 1344, 1344, 64, 64]
    - [0, 8.235]
  - - [1472, 3648, 1, 64, 1472, 1472, 64, 64]
    - [0, 8.29]
  - - [1600, 3648, 1, 64, 1600, 1600, 64, 64]
    - [0, 8.382]
  - - [1728, 3648, 1, 64, 1728, 1728, 64, 64]
    - [0, 8.465]
  - - [1856, 3648, 1, 64, 1856, 1856, 64, 64]
    - [0, 8.423]
  - - [1984, 3648, 1, 64, 1984, 1984, 64, 64]
    - [0, 8.497]
  - - [2112, 3648, 1, 64, 2112, 2112, 64, 64]
    - [0, 8.524]
  - - [2240, 3648, 1, 64, 2240, 2240, 64, 64]
    - [0, 8.597]
  - - [2368, 3648, 1, 64, 2368, 2368, 64, 64]
    - [0, 8.586]
  - - [2496, 3648, 1, 64, 2496, 2496, 64, 64]
    - [0, 8.542]
  - - [2624, 3648, 1, 64, 2624, 2624, 64, 64]
    - [0, 8.614]
  - - [2752, 3648, 1, 64, 2752, 2752, 64, 64]
    - [0, 8.601]
  - - [2880, 3648, 1, 64, 2880, 2880, 64, 64]
    - [0, 8.579]
  - - [3008, 3648, 1, 64, 3008, 3008, 64, 64]
    - [0, 8.65]
  - - [3136, 3648, 1, 64, 3136, 3136, 64, 64]
    - [0, 8.673]
  - - [3264, 3648, 1, 64, 3264, 3264, 64, 64]
    - [0, 8.735]
  - - [3392, 3648, 1, 64, 3392, 3392, 64, 64]
    - [0, 8.685]
  - - [3520, 3648, 1, 64, 3520, 3520, 64, 64]
    - [0, 8.752]
  - - [3648, 3648, 1, 64, 3648, 3648, 64, 64]
    - [0, 8.711]
  - - [3776, 3648, 1, 64, 3776, 3776, 64, 64]
    - [0, 8.71]
  - - [3904, 3648, 1, 64, 3904, 3904, 64, 64]
    - [0, 8.775]
  - - [4032, 3648, 1, 64, 4032, 4032, 64, 64]
    - [0, 8.715]
  - - [64, 3776, 1, 64, 64, 64, 64, 64]
    - [0, 4.521]
  - - [192, 3776, 1, 64, 192, 192, 64, 64]
    - [0, 6.573]
  - - [320, 3776, 1, 64, 320, 320, 64, 64]
    - [0, 7.41]
  - - [448, 3776, 1, 64, 448, 448, 64, 64]
    - [0, 7.726]
  - - [576, 3776, 1, 64, 576, 576, 64, 64]
    - [0, 7.961]
  - - [704, 3776, 1, 64, 704, 704, 64, 64]
    - [0, 8.186]
  - - [832, 3776, 1, 64, 832, 832, 64, 64]
    - [0, 7.877]
  - - [960, 3776, 1, 64, 960, 960, 64, 64]
    - [0, 7.978]
  - - [1088, 3776, 1, 64, 1088, 1088, 64, 64]
    - [0, 8.177]
  - - [1216, 3776, 1, 64, 1216, 1216, 64, 64]
    - [0, 8.269]
  - - [1344, 3776, 1, 64, 1344, 1344, 64, 64]
    - [0, 8.355]
  - - [1472, 3776, 1, 64, 1472, 1472, 64, 64]
    - [0, 8.39]
  - - [1600, 3776, 1, 64, 1600, 1600, 64, 64]
    - [0, 8.388]
  - - [1728, 3776, 1, 64, 1728, 1728, 64, 64]
    - [0, 8.473]
  - - [1856, 3776, 1, 64, 1856, 1856, 64, 64]
    - [0, 8.512]
  - - [1984, 3776, 1, 64, 1984, 1984, 64, 64]
    - [0, 8.614]
  - - [2112, 3776, 1, 64, 2112, 2112, 64, 64]
    - [0, 8.493]
  - - [2240, 3776, 1, 64, 2240, 2240, 64, 64]
    - [0, 8.607]
  - - [2368, 3776, 1, 64, 2368, 2368, 64, 64]
    - [0, 8.549]
  - - [2496, 3776, 1, 64, 2496, 2496, 64, 64]
    - [0, 8.585]
  - - [2624, 3776, 1, 64, 2624, 2624, 64, 64]
    - [0, 8.623]
  - - [2752, 3776, 1, 64, 2752, 2752, 64, 64]
    - [0, 8.655]
  - - [2880, 3776, 1, 64, 2880, 2880, 64, 64]
    - [0, 8.692]
  - - [3008, 3776, 1, 64, 3008, 3008, 64, 64]
    - [0, 8.688]
  - - [3136, 3776, 1, 64, 3136, 3136, 64, 64]
    - [0, 8.621]
  - - [3264, 3776, 1, 64, 3264, 3264, 64, 64]
    - [0, 8.672]
  - - [3392, 3776, 1, 64, 3392, 3392, 64, 64]
    - [0, 8.716]
  - - [3520, 3776, 1, 64, 3520, 3520, 64, 64]
    - [0, 8.658]
  - - [3648, 3776, 1, 64, 3648, 3648, 64, 64]
    - [0, 8.703]
  - - [3776, 3776, 1, 64, 3776, 3776, 64, 64]
    - [0, 8.748]
  - - [3904, 3776, 1, 64, 3904, 3904, 64, 64]
    - [0, 8.726]
  - - [4032, 3776, 1, 64, 4032, 4032, 64, 64]
    - [0, 8.743]
  - - [64, 3904, 1, 64, 64, 64, 64, 64]
    - [0, 4.478]
  - - [192, 3904, 1, 64, 192, 192, 64, 64]
    - [0, 6.58]
  - - [320, 3904, 1, 64, 320, 320, 64, 64]
    - [0, 7.44]
  - - [448, 3904, 1, 64, 448, 448, 64, 64]
    - [0, 7.755]
  - - [576, 3904, 1, 64, 576, 576, 64, 64]
    - [0, 8.065]
  - - [704, 3904, 1, 64, 704, 704, 64, 64]
    - [0, 8.187]
  - - [832, 3904, 1, 64, 832, 832, 64, 64]
    - [0, 7.949]
  - - [960, 3904, 1, 64, 960, 960, 64, 64]
    - [0, 8.055]
  - - [1088, 3904, 1, 64, 1088, 1088, 64, 64]
    - [0, 8.151]
  - - [1216, 3904, 1, 64, 1216, 1216, 64, 64]
    - [0, 8.202]
  - - [1344, 3904, 1, 64, 1344, 1344, 64, 64]
    - [0, 8.322]
  - - [1472, 3904, 1, 64, 1472, 1472, 64, 64]
    - [0, 8.321]
  - - [1600, 3904, 1, 64, 1600, 1600, 64, 64]
    - [0, 8.45]
  - - [1728, 3904, 1, 64, 1728, 1728, 64, 64]
    - [0, 8.51]
  - - [1856, 3904, 1, 64, 1856, 1856, 64, 64]
    - [0, 8.459]
  - - [1984, 3904, 1, 64, 1984, 1984, 64, 64]
    - [0, 8.454]
  - - [2112, 3904, 1, 64, 2112, 2112, 64, 64]
    - [0, 8.499]
  - - [2240, 3904, 1, 64, 2240, 2240, 64, 64]
    - [0, 8.627]
  - - [2368, 3904, 1, 64, 2368, 2368, 64, 64]
    - [0, 8.579]
  - - [2496, 3904, 1, 64, 2496, 2496, 64, 64]
    - [0, 8.566]
  - - [2624, 3904, 1, 64, 2624, 2624, 64, 64]
    - [0, 8.591]
  - - [2752, 3904, 1, 64, 2752, 2752, 64, 64]
    - [0, 8.618]
  - - [2880, 3904, 1, 64, 2880, 2880, 64, 64]
    - [0, 8.717]
  - - [3008, 3904, 1, 64, 3008, 3008, 64, 64]
    - [0, 8.667]
  - - [3136, 3904, 1, 64, 3136, 3136, 64, 64]
    - [0, 8.632]
  - - [3264, 3904, 1, 64, 3264, 3264, 64, 64]
    - [0, 8.674]
  - - [3392, 3904, 1, 64, 3392, 3392, 64, 64]
    - [0, 8.725]
  - - [3520, 3904, 1, 64, 3520, 3520, 64, 64]
    - [0, 8.687]
  - - [3648, 3904, 1, 64, 3648, 3648, 64, 64]
    - [0, 8.649]
  - - [3776, 3904, 1, 64, 3776, 3776, 64, 64]
    - [0, 8.748]
  - - [3904, 3904, 1, 64, 3904, 3904, 64, 64]
    - [0, 8.754]
  - - [4032, 3904, 1, 64, 4032, 4032, 64, 64]
    - [0, 8.802]
  - - [64, 4032, 1, 64, 64, 64, 64, 64]
    - [0, 4.519]
  - - [192, 4032, 1, 64, 192, 192, 64, 64]
    - [0, 6.735]
  - - [320, 4032, 1, 64, 320, 320, 64, 64]
    - [0, 7.441]
  - - [448, 4032, 1, 64, 448, 448, 64, 64]
    - [0, 7.802]
  - - [576, 4032, 1, 64, 576, 576, 64, 64]
    - [0, 8.12]
  - - [704, 4032, 1, 64, 704, 704, 64, 64]
    - [0, 8.239]
  - - [832, 4032, 1, 64, 832, 832, 64, 64]
    - [0, 8.005]
  - - [960, 4032, 1, 64, 960, 960, 64, 64]
    - [0, 8.089]
  - - [1088, 4032, 1, 64, 1088, 1088, 64, 64]
    - [0, 8.172]
  - - [1216, 4032, 1, 64, 1216, 1216, 64, 64]
    - [0, 8.275]
  - - [1344, 4032, 1, 64, 1344, 1344, 64, 64]
    - [0, 8.311]
  - - [1472, 4032, 1, 64, 1472, 1472, 64, 64]
    - [0, 8.411]
  - - [1600, 4032, 1, 64, 1600, 1600, 64, 64]
    - [0, 8.445]
  - - [1728, 4032, 1, 64, 1728, 1728, 64, 64]
    - [0, 8.413]
  - - [1856, 4032, 1, 64, 1856, 1856, 64, 64]
    - [0, 8.531]
  - - [1984, 4032, 1, 64, 1984, 1984, 64, 64]
    - [0, 8.522]
  - - [2112, 4032, 1, 64, 2112, 2112, 64, 64]
    - [0, 8.522]
  - - [2240, 4032, 1, 64, 2240, 2240, 64, 64]
    - [0, 8.583]
  - - [2368, 4032, 1, 64, 2368, 2368, 64, 64]
    - [0, 8.609]
  - - [2496, 4032, 1, 64, 2496, 2496, 64, 64]
    - [0, 8.594]
  - - [2624, 4032, 1, 64, 2624, 2624, 64, 64]
    - [0, 8.679]
  - - [2752, 4032, 1, 64, 2752, 2752, 64, 64]
    - [0, 8.666]
  - - [2880, 4032, 1, 64, 2880, 2880, 64, 64]
    - [0, 8.669]
  - - [3008, 4032, 1, 64, 3008, 3008, 64, 64]
    - [0, 8.713]
  - - [3136, 4032, 1, 64, 3136, 3136, 64, 64]
    - [0, 8.74]
  - - [3264, 4032, 1, 64, 3264, 3264, 64, 64]
    - [0, 8.662]
  - - [3392, 4032, 1, 64, 3392, 3392, 64, 64]
    - [0, 8.762]
  - - [3520, 4032, 1, 64, 3520, 3520, 64, 64]
    - [0, 8.722]
  - - [3648, 4032, 1, 64, 3648, 3648, 64, 64]
    - [0, 8.718]
  - - [3776, 4032, 1, 64, 3776, 3776, 64, 64]
    - [0, 8.688]
  - - [3904, 4032, 1, 64, 3904, 3904, 64, 64]
    - [0, 8.751]
  - - [4032, 4032, 1, 64, 4032, 4032, 64, 64]
    - [0, 8.761]
  - - [64, 64, 1, 256, 64, 64, 256, 256]
    - [1, 0.498]
  - - [192, 64, 1, 256, 192, 192, 256, 256]
    - [3, 1.369]
  - - [320, 64, 1, 256, 320, 320, 256, 256]
    - [0, 2.05]
  - - [448, 64, 1, 256, 448, 448, 256, 256]
    - [0, 2.865]
  - - [576, 64, 1, 256, 576, 576, 256, 256]
    - [0, 2.798]
  - - [704, 64, 1, 256, 704, 704, 256, 256]
    - [0, 3.393]
  - - [832, 64, 1, 256, 832, 832, 256, 256]
    - [0, 3.992]
  - - [960, 64, 1, 256, 960, 960, 256, 256]
    - [0, 4.615]
  - - [1088, 64, 1, 256, 1088, 1088, 256, 256]
    - [0, 4.142]
  - - [1216, 64, 1, 256, 1216, 1216, 256, 256]
    - [0, 4.626]
  - - [1344, 64, 1, 256, 1344, 1344, 256, 256]
    - [0, 5.092]
  - - [1472, 64, 1, 256, 1472, 1472, 256, 256]
    - [0, 4.737]
  - - [1600, 64, 1, 256, 1600, 1600, 256, 256]
    - [0, 5.07]
  - - [1728, 64, 1, 256, 1728, 1728, 256, 256]
    - [0, 5.447]
  - - [1856, 64, 1, 256, 1856, 1856, 256, 256]
    - [0, 5.829]
  - - [1984, 64, 1, 256, 1984, 1984, 256, 256]
    - [0, 5.409]
  - - [2112, 64, 1, 256, 2112, 2112, 256, 256]
    - [0, 5.718]
  - - [2240, 64, 1, 256, 2240, 2240, 256, 256]
    - [0, 5.963]
  - - [2368, 64, 1, 256, 2368, 2368, 256, 256]
    - [0, 6.332]
  - - [2496, 64, 1, 256, 2496, 2496, 256, 256]
    - [0, 5.865]
  - - [2624, 64, 1, 256, 2624, 2624, 256, 256]
    - [0, 6.123]
  - - [2752, 64, 1, 256, 2752, 2752, 256, 256]
    - [0, 6.427]
  - - [2880, 64, 1, 256, 2880, 2880, 256, 256]
    - [0, 6.721]
  - - [3008, 64, 1, 256, 3008, 3008, 256, 256]
    - [0, 6.27]
  - - [3136, 64, 1, 256, 3136, 3136, 256, 256]
    - [0, 6.495]
  - - [3264, 64, 1, 256, 3264, 3264, 256, 256]
    - [0, 6.751]
  - - [3392, 64, 1, 256, 3392, 3392, 256, 256]
    - [0, 6.449]
  - - [3520, 64, 1, 256, 3520, 3520, 256, 256]
    - [0, 6.571]
  - - [3648, 64, 1, 256, 3648, 3648, 256, 256]
    - [0, 6.782]
  - - [3776, 64, 1, 256, 3776, 3776, 256, 256]
    - [0, 7.034]
  - - [3904, 64, 1, 256, 3904, 3904, 256, 256]
    - [0, 6.735]
  - - [4032, 64, 1, 256, 4032, 4032, 256, 256]
    - [0, 6.916]
  - - [64, 192, 1, 256, 64, 64, 256, 256]
    - [2, 1.376]
  - - [192, 192, 1, 256, 192, 192, 256, 256]
    - [0, 2.796]
  - - [320, 192, 1, 256, 320, 320, 256, 256]
    - [0, 4.61]
  - - [448, 192, 1, 256, 448, 448, 256, 256]
    - [0, 5.1]
  - - [576, 192, 1, 256, 576, 576, 256, 256]
    - [0, 5.453]
  - - [704, 192, 1, 256, 704, 704, 256, 256]
    - [0, 5.721]
  - - [832, 192, 1, 256, 832, 832, 256, 256]
    - [0, 5.935]
  - - [960, 192, 1, 256, 960, 960, 256, 256]
    - [0, 6.763]
  - - [1088, 192, 1, 256, 1088, 1088, 256, 256]
    - [0, 6.842]
  - - [1216, 192, 1, 256, 1216, 1216, 256, 256]
    - [0, 6.809]
  - - [1344, 192, 1, 256, 1344, 1344, 256, 256]
    - [0, 6.906]
  - - [1472, 192, 1, 256, 1472, 1472, 256, 256]
    - [0, 6.947]
  - - [1600, 192, 1, 256, 1600, 1600, 256, 256]
    - [0, 7.41]
  - - [1728, 192, 1, 256, 1728, 1728, 256, 256]
    - [0, 7.369]
  - - [1856, 192, 1, 256, 1856, 1856, 256, 256]
    - [0, 7.456]
  - - [1984, 192, 1, 256, 1984, 1984, 256, 256]
    - [0, 7.449]
  - - [2112, 192, 1, 256, 2112, 2112, 256, 256]
    - [0, 7.456]
  - - [2240, 192, 1, 256, 2240, 2240, 256, 256]
    - [0, 7.572]
  - - [2368, 192, 1, 256, 2368, 2368, 256, 256]
    - [0, 7.727]
  - - [2496, 192, 1, 256, 2496, 2496, 256, 256]
    - [0, 7.762]
  - - [2624, 192, 1, 256, 2624, 2624, 256, 256]
    - [0, 7.801]
  - - [2752, 192, 1, 256, 2752, 2752, 256, 256]
    - [0, 7.781]
  - - [2880, 192, 1, 256, 2880, 2880, 256, 256]
    - [0, 7.791]
  - - [3008, 192, 1, 256, 3008, 3008, 256, 256]
    - [0, 7.915]
  - - [3136, 192, 1, 256, 3136, 3136, 256, 256]
    - [0, 8.026]
  - - [3264, 192, 1, 256, 3264, 3264, 256, 256]
    - [0, 8.014]
  - - [3392, 192, 1, 256, 3392, 3392, 256, 256]
    - [0, 8.007]
  - - [3520, 192, 1, 256, 3520, 3520, 256, 256]
    - [0, 7.965]
  - - [3648, 192, 1, 256, 3648, 3648, 256, 256]
    - [0, 8.098]
  - - [3776, 192, 1, 256, 3776, 3776, 256, 256]
    - [0, 8.2]
  - - [3904, 192, 1, 256, 3904, 3904, 256, 256]
    - [0, 7.539]
  - - [4032, 192, 1, 256, 4032, 4032, 256, 256]
    - [0, 7.765]
  - - [64, 320, 1, 256, 64, 64, 256, 256]
    - [0, 2.067]
  - - [192, 320, 1, 256, 192, 192, 256, 256]
    - [0, 4.613]
  - - [320, 320, 1, 256, 320, 320, 256, 256]
    - [0, 5.058]
  - - [448, 320, 1, 256, 448, 448, 256, 256]
    - [0, 6.041]
  - - [576, 320, 1, 256, 576, 576, 256, 256]
    - [0, 6.758]
  - - [704, 320, 1, 256, 704, 704, 256, 256]
    - [0, 6.608]
  - - [832, 320, 1, 256, 832, 832, 256, 256]
    - [0, 7.064]
  - - [960, 320, 1, 256, 960, 960, 256, 256]
    - [0, 7.421]
  - - [1088, 320, 1, 256, 1088, 1088, 256, 256]
    - [0, 7.329]
  - - [1216, 320, 1, 256, 1216, 1216, 256, 256]
    - [0, 7.527]
  - - [1344, 320, 1, 256, 1344, 1344, 256, 256]
    - [0, 7.588]
  - - [1472, 320, 1, 256, 1472, 1472, 256, 256]
    - [0, 7.678]
  - - [1600, 320, 1, 256, 1600, 1600, 256, 256]
    - [0, 7.795]
  - - [1728, 320, 1, 256, 1728, 1728, 256, 256]
    - [0, 7.775]
  - - [1856, 320, 1, 256, 1856, 1856, 256, 256]
    - [0, 7.92]
  - - [1984, 320, 1, 256, 1984, 1984, 256, 256]
    - [0, 8.035]
  - - [2112, 320, 1, 256, 2112, 2112, 256, 256]
    - [0, 7.99]
  - - [2240, 320, 1, 256, 2240, 2240, 256, 256]
    - [0, 8.098]
  - - [2368, 320, 1, 256, 2368, 2368, 256, 256]
    - [0, 7.62]
  - - [2496, 320, 1, 256, 2496, 2496, 256, 256]
    - [0, 7.74]
  - - [2624, 320, 1, 256, 2624, 2624, 256, 256]
    - [0, 7.818]
  - - [2752, 320, 1, 256, 2752, 2752, 256, 256]
    - [0, 7.93]
  - - [2880, 320, 1, 256, 2880, 2880, 256, 256]
    - [0, 7.896]
  - - [3008, 320, 1, 256, 3008, 3008, 256, 256]
    - [0, 7.984]
  - - [3136, 320, 1, 256, 3136, 3136, 256, 256]
    - [0, 8.066]
  - - [3264, 320, 1, 256, 3264, 3264, 256, 256]
    - [0, 8.011]
  - - [3392, 320, 1, 256, 3392, 3392, 256, 256]
    - [0, 8.083]
  - - [3520, 320, 1, 256, 3520, 3520, 256, 256]
    - [0, 8.164]
  - - [3648, 320, 1, 256, 3648, 3648, 256, 256]
    - [0, 8.186]
  - - [3776, 320, 1, 256, 3776, 3776, 256, 256]
    - [0, 8.212]
  - - [3904, 320, 1, 256, 3904, 3904, 256, 256]
    - [0, 8.233]
  - - [4032, 320, 1, 256, 4032, 4032, 256, 256]
    - [0, 8.19]
  - - [64, 448, 1, 256, 64, 64, 256, 256]
    - [0, 2.882]
  - - [192, 448, 1, 256, 192, 192, 256, 256]
    - [0, 5.108]
  - - [320, 448, 1, 256, 320, 320, 256, 256]
    - [0, 6.019]
  - - [448, 448, 1, 256, 448, 448, 256, 256]
    - [0, 6.539]
  - - [576, 448, 1, 256, 576, 576, 256, 256]
    - [0, 6.946]
  - - [704, 448, 1, 256, 704, 704, 256, 256]
    - [0, 7.165]
  - - [832, 448, 1, 256, 832, 832, 256, 256]
    - [0, 7.358]
  - - [960, 448, 1, 256, 960, 960, 256, 256]
    - [0, 7.596]
  - - [1088, 448, 1, 256, 1088, 1088, 256, 256]
    - [0, 7.666]
  - - [1216, 448, 1, 256, 1216, 1216, 256, 256]
    - [0, 7.863]
  - - [1344, 448, 1, 256, 1344, 1344, 256, 256]
    - [0, 7.975]
  - - [1472, 448, 1, 256, 1472, 1472, 256, 256]
    - [0, 8.085]
  - - [1600, 448, 1, 256, 1600, 1600, 256, 256]
    - [0, 8.127]
  - - [1728, 448, 1, 256, 1728, 1728, 256, 256]
    - [0, 7.744]
  - - [1856, 448, 1, 256, 1856, 1856, 256, 256]
    - [0, 7.787]
  - - [1984, 448, 1, 256, 1984, 1984, 256, 256]
    - [0, 7.83]
  - - [2112, 448, 1, 256, 2112, 2112, 256, 256]
    - [0, 7.914]
  - - [2240, 448, 1, 256, 2240, 2240, 256, 256]
    - [0, 7.932]
  - - [2368, 448, 1, 256, 2368, 2368, 256, 256]
    - [0, 8.096]
  - - [2496, 448, 1, 256, 2496, 2496, 256, 256]
    - [0, 8.129]
  - - [2624, 448, 1, 256, 2624, 2624, 256, 256]
    - [0, 8.138]
  - - [2752, 448, 1, 256, 2752, 2752, 256, 256]
    - [0, 8.156]
  - - [2880, 448, 1, 256, 2880, 2880, 256, 256]
    - [0, 8.319]
  - - [3008, 448, 1, 256, 3008, 3008, 256, 256]
    - [0, 8.223]
  - - [3136, 448, 1, 256, 3136, 3136, 256, 256]
    - [0, 8.191]
  - - [3264, 448, 1, 256, 3264, 3264, 256, 256]
    - [0, 8.249]
  - - [3392, 448, 1, 256, 3392, 3392, 256, 256]
    - [0, 8.323]
  - - [3520, 448, 1, 256, 3520, 3520, 256, 256]
    - [0, 8.338]
  - - [3648, 448, 1, 256, 3648, 3648, 256, 256]
    - [0, 8.35]
  - - [3776, 448, 1, 256, 3776, 3776, 256, 256]
    - [0, 8.332]
  - - [3904, 448, 1, 256, 3904, 3904, 256, 256]
    - [0, 8.384]
  - - [4032, 448, 1, 256, 4032, 4032, 256, 256]
    - [0, 8.468]
  - - [64, 576, 1, 256, 64, 64, 256, 256]
    - [0, 2.808]
  - - [192, 576, 1, 256, 192, 192, 256, 256]
    - [0, 5.46]
  - - [320, 576, 1, 256, 320, 320, 256, 256]
    - [0, 6.761]
  - - [448, 576, 1, 256, 448, 448, 256, 256]
    - [0, 6.932]
  - - [576, 576, 1, 256, 576, 576, 256, 256]
    - [0, 7.291]
  - - [704, 576, 1, 256, 704, 704, 256, 256]
    - [0, 7.472]
  - - [832, 576, 1, 256, 832, 832, 256, 256]
    - [0, 7.759]
  - - [960, 576, 1, 256, 960, 960, 256, 256]
    - [0, 7.78]
  - - [1088, 576, 1, 256, 1088, 1088, 256, 256]
    - [0, 7.999]
  - - [1216, 576, 1, 256, 1216, 1216, 256, 256]
    - [0, 8.053]
  - - [1344, 576, 1, 256, 1344, 1344, 256, 256]
    - [0, 7.744]
  - - [1472, 576, 1, 256, 1472, 1472, 256, 256]
    - [0, 7.867]
  - - [1600, 576, 1, 256, 1600, 1600, 256, 256]
    - [0, 7.888]
  - - [1728, 576, 1, 256, 1728, 1728, 256, 256]
    - [0, 8.011]
  - - [1856, 576, 1, 256, 1856, 1856, 256, 256]
    - [0, 7.997]
  - - [1984, 576, 1, 256, 1984, 1984, 256, 256]
    - [0, 8.102]
  - - [2112, 576, 1, 256, 2112, 2112, 256, 256]
    - [0, 8.209]
  - - [2240, 576, 1, 256, 2240, 2240, 256, 256]
    - [0, 8.216]
  - - [2368, 576, 1, 256, 2368, 2368, 256, 256]
    - [0, 8.252]
  - - [2496, 576, 1, 256, 2496, 2496, 256, 256]
    - [0, 8.328]
  - - [2624, 576, 1, 256, 2624, 2624, 256, 256]
    - [0, 8.313]
  - - [2752, 576, 1, 256, 2752, 2752, 256, 256]
    - [0, 8.303]
  - - [2880, 576, 1, 256, 2880, 2880, 256, 256]
    - [0, 8.332]
  - - [3008, 576, 1, 256, 3008, 3008, 256, 256]
    - [0, 8.411]
  - - [3136, 576, 1, 256, 3136, 3136, 256, 256]
    - [0, 8.438]
  - - [3264, 576, 1, 256, 3264, 3264, 256, 256]
    - [0, 8.456]
  - - [3392, 576, 1, 256, 3392, 3392, 256, 256]
    - [0, 8.378]
  - - [3520, 576, 1, 256, 3520, 3520, 256, 256]
    - [0, 8.468]
  - - [3648, 576, 1, 256, 3648, 3648, 256, 256]
    - [0, 8.428]
  - - [3776, 576, 1, 256, 3776, 3776, 256, 256]
    - [0, 8.526]
  - - [3904, 576, 1, 256, 3904, 3904, 256, 256]
    - [0, 8.507]
  - - [4032, 576, 1, 256, 4032, 4032, 256, 256]
    - [0, 8.515]
  - - [64, 704, 1, 256, 64, 64, 256, 256]
    - [0, 3.404]
  - - [192, 704, 1, 256, 192, 192, 256, 256]
    - [0, 5.718]
  - - [320, 704, 1, 256, 320, 320, 256, 256]
    - [0, 6.629]
  - - [448, 704, 1, 256, 448, 448, 256, 256]
    - [0, 7.164]
  - - [576, 704, 1, 256, 576, 576, 256, 256]
    - [0, 7.475]
  - - [704, 704, 1, 256, 704, 704, 256, 256]
    - [0, 7.705]
  - - [832, 704, 1, 256, 832, 832, 256, 256]
    - [0, 7.845]
  - - [960, 704, 1, 256, 960, 960, 256, 256]
    - [0, 7.968]
  - - [1088, 704, 1, 256, 1088, 1088, 256, 256]
    - [0, 7.678]
  - - [1216, 704, 1, 256, 1216, 1216, 256, 256]
    - [0, 7.836]
  - - [1344, 704, 1, 256, 1344, 1344, 256, 256]
    - [0, 7.89]
  - - [1472, 704, 1, 256, 1472, 1472, 256, 256]
    - [0, 8.073]
  - - [1600, 704, 1, 256, 1600, 1600, 256, 256]
    - [0, 8.069]
  - - [1728, 704, 1, 256, 1728, 1728, 256, 256]
    - [0, 8.209]
  - - [1856, 704, 1, 256, 1856, 1856, 256, 256]
    - [0, 8.256]
  - - [1984, 704, 1, 256, 1984, 1984, 256, 256]
    - [0, 8.293]
  - - [2112, 704, 1, 256, 2112, 2112, 256, 256]
    - [0, 8.325]
  - - [2240, 704, 1, 256, 2240, 2240, 256, 256]
    - [0, 8.271]
  - - [2368, 704, 1, 256, 2368, 2368, 256, 256]
    - [0, 8.416]
  - - [2496, 704, 1, 256, 2496, 2496, 256, 256]
    - [0, 8.384]
  - - [2624, 704, 1, 256, 2624, 2624, 256, 256]
    - [0, 8.446]
  - - [2752, 704, 1, 256, 2752, 2752, 256, 256]
    - [0, 8.475]
  - - [2880, 704, 1, 256, 2880, 2880, 256, 256]
    - [0, 8.493]
  - - [3008, 704, 1, 256, 3008, 3008, 256, 256]
    - [0, 8.486]
  - - [3136, 704, 1, 256, 3136, 3136, 256, 256]
    - [0, 8.511]
  - - [3264, 704, 1, 256, 3264, 3264, 256, 256]
    - [0, 8.479]
  - - [3392, 704, 1, 256, 3392, 3392, 256, 256]
    - [0, 8.584]
  - - [3520, 704, 1, 256, 3520, 3520, 256, 256]
    - [0, 8.608]
  - - [3648, 704, 1, 256, 3648, 3648, 256, 256]
    - [0, 8.587]
  - - [3776, 704, 1, 256, 3776, 3776, 256, 256]
    - [0, 8.658]
  - - [3904, 704, 1, 256, 3904, 3904, 256, 256]
    - [0, 8.64]
  - - [4032, 704, 1, 256, 4032, 4032, 256, 256]
    - [0, 8.564]
  - - [64, 832, 1, 256, 64, 64, 256, 256]
    - [0, 4.025]
  - - [192, 832, 1, 256, 192, 192, 256, 256]
    - [0, 5.929]
  - - [320, 832, 1, 256, 320, 320, 256, 256]
    - [0, 7.12]
  - - [448, 832, 1, 256, 448, 448, 256, 256]
    - [0, 7.337]
  - - [576, 832, 1, 256, 576, 576, 256, 256]
    - [0, 7.756]
  - - [704, 832, 1, 256, 704, 704, 256, 256]
    - [0, 7.849]
  - - [832, 832, 1, 256, 832, 832, 256, 256]
    - [0, 8.066]
  - - [960, 832, 1, 256, 960, 960, 256, 256]
    - [0, 7.74]
  - - [1088, 832, 1, 256, 1088, 1088, 256, 256]
    - [0, 7.944]
  - - [1216, 832, 1, 256, 1216, 1216, 256, 256]
    - [0, 7.985]
  - - [1344, 832, 1, 256, 1344, 1344, 256, 256]
    - [0, 8.123]
  - - [1472, 832, 1, 256, 1472, 1472, 256, 256]
    - [0, 8.263]
  - - [1600, 832, 1, 256, 1600, 1600, 256, 256]
    - [0, 8.242]
  - - [1728, 832, 1, 256, 1728, 1728, 256, 256]
    - [0, 8.248]
  - - [1856, 832, 1, 256, 1856, 1856, 256, 256]
    - [0, 8.352]
  - - [1984, 832, 1, 256, 1984, 1984, 256, 256]
    - [0, 8.303]
  - - [2112, 832, 1, 256, 2112, 2112, 256, 256]
    - [0, 8.364]
  - - [2240, 832, 1, 256, 2240, 2240, 256, 256]
    - [0, 8.465]
  - - [2368, 832, 1, 256, 2368, 2368, 256, 256]
    - [0, 8.44]
  - - [2496, 832, 1, 256, 2496, 2496, 256, 256]
    - [0, 8.526]
  - - [2624, 832, 1, 256, 2624, 2624, 256, 256]
    - [0, 8.517]
  - - [2752, 832, 1, 256, 2752, 2752, 256, 256]
    - [0, 8.499]
  - - [2880, 832, 1, 256, 2880, 2880, 256, 256]
    - [0, 8.569]
  - - [3008, 832, 1, 256, 3008, 3008, 256, 256]
    - [0, 8.534]
  - - [3136, 832, 1, 256, 3136, 3136, 256, 256]
    - [0, 8.568]
  - - [3264, 832, 1, 256, 3264, 3264, 256, 256]
    - [0, 8.601]
  - - [3392, 832, 1, 256, 3392, 3392, 256, 256]
    - [0, 8.535]
  - - [3520, 832, 1, 256, 3520, 3520, 256, 256]
    - [0, 8.662]
  - - [3648, 832, 1, 256, 3648, 3648, 256, 256]
    - [0, 8.618]
  - - [3776, 832, 1, 256, 3776, 3776, 256, 256]
    - [0, 8.709]
  - - [3904, 832, 1, 256, 3904, 3904, 256, 256]
    - [0, 8.629]
  - - [4032, 832, 1, 256, 4032, 4032, 256, 256]
    - [0, 8.664]
  - - [64, 960, 1, 256, 64, 64, 256, 256]
    - [0, 4.615]
  - - [192, 960, 1, 256, 192, 192, 256, 256]
    - [0, 6.757]
  - - [320, 960, 1, 256, 320, 320, 256, 256]
    - [0, 7.452]
  - - [448, 960, 1, 256, 448, 448, 256, 256]
    - [0, 7.584]
  - - [576, 960, 1, 256, 576, 576, 256, 256]
    - [0, 7.791]
  - - [704, 960, 1, 256, 704, 704, 256, 256]
    - [0, 7.986]
  - - [832, 960, 1, 256, 832, 832, 256, 256]
    - [0, 7.708]
  - - [960, 960, 1, 256, 960, 960, 256, 256]
    - [0, 7.886]
  - - [1088, 960, 1, 256, 1088, 1088, 256, 256]
    - [0, 7.974]
  - - [1216, 960, 1, 256, 1216, 1216, 256, 256]
    - [0, 8.09]
  - - [1344, 960, 1, 256, 1344, 1344, 256, 256]
    - [0, 8.147]
  - - [1472, 960, 1, 256, 1472, 1472, 256, 256]
    - [0, 8.236]
  - - [1600, 960, 1, 256, 1600, 1600, 256, 256]
    - [0, 8.312]
  - - [1728, 960, 1, 256, 1728, 1728, 256, 256]
    - [0, 8.455]
  - - [1856, 960, 1, 256, 1856, 1856, 256, 256]
    - [0, 8.38]
  - - [1984, 960, 1, 256, 1984, 1984, 256, 256]
    - [0, 8.427]
  - - [2112, 960, 1, 256, 2112, 2112, 256, 256]
    - [0, 8.499]
  - - [2240, 960, 1, 256, 2240, 2240, 256, 256]
    - [0, 8.482]
  - - [2368, 960, 1, 256, 2368, 2368, 256, 256]
    - [0, 8.507]
  - - [2496, 960, 1, 256, 2496, 2496, 256, 256]
    - [0, 8.578]
  - - [2624, 960, 1, 256, 2624, 2624, 256, 256]
    - [0, 8.546]
  - - [2752, 960, 1, 256, 2752, 2752, 256, 256]
    - [0, 8.537]
  - - [2880, 960, 1, 256, 2880, 2880, 256, 256]
    - [0, 8.515]
  - - [3008, 960, 1, 256, 3008, 3008, 256, 256]
    - [0, 8.699]
  - - [3136, 960, 1, 256, 3136, 3136, 256, 256]
    - [0, 8.655]
  - - [3264, 960, 1, 256, 3264, 3264, 256, 256]
    - [0, 8.684]
  - - [3392, 960, 1, 256, 3392, 3392, 256, 256]
    - [0, 8.592]
  - - [3520, 960, 1, 256, 3520, 3520, 256, 256]
    - [0, 8.693]
  - - [3648, 960, 1, 256, 3648, 3648, 256, 256]
    - [0, 8.68]
  - - [3776, 960, 1, 256, 3776, 3776, 256, 256]
    - [0, 8.695]
  - - [3904, 960, 1, 256, 3904, 3904, 256, 256]
    - [0, 8.609]
  - - [4032, 960, 1, 256, 4032, 4032, 256, 256]
    - [0, 8.702]
  - - [64, 1088, 1, 256, 64, 64, 256, 256]
    - [0, 4.16]
  - - [192, 1088, 1, 256, 192, 192, 256, 256]
    - [0, 6.846]
  - - [320, 1088, 1, 256, 320, 320, 256, 256]
    - [0, 7.327]
  - - [448, 1088, 1, 256, 448, 448, 256, 256]
    - [0, 7.754]
  - - [576, 1088, 1, 256, 576, 576, 256, 256]
    - [0, 8.015]
  - - [704, 1088, 1, 256, 704, 704, 256, 256]
    - [0, 7.675]
  - - [832, 1088, 1, 256, 832, 832, 256, 256]
    - [0, 7.882]
  - - [960, 1088, 1, 256, 960, 960, 256, 256]
    - [0, 8.001]
  - - [1088, 1088, 1, 256, 1088, 1088, 256, 256]
    - [0, 8.182]
  - - [1216, 1088, 1, 256, 1216, 1216, 256, 256]
    - [0, 8.202]
  - - [1344, 1088, 1, 256, 1344, 1344, 256, 256]
    - [0, 8.315]
  - - [1472, 1088, 1, 256, 1472, 1472, 256, 256]
    - [0, 8.329]
  - - [1600, 1088, 1, 256, 1600, 1600, 256, 256]
    - [0, 8.437]
  - - [1728, 1088, 1, 256, 1728, 1728, 256, 256]
    - [0, 8.444]
  - - [1856, 1088, 1, 256, 1856, 1856, 256, 256]
    - [0, 8.531]
  - - [1984, 1088, 1, 256, 1984, 1984, 256, 256]
    - [0, 8.496]
  - - [2112, 1088, 1, 256, 2112, 2112, 256, 256]
    - [0, 8.576]
  - - [2240, 1088, 1, 256, 2240, 2240, 256, 256]
    - [0, 8.565]
  - - [2368, 1088, 1, 256, 2368, 2368, 256, 256]
    - [0, 8.567]
  - - [2496, 1088, 1, 256, 2496, 2496, 256, 256]
    - [0, 8.621]
  - - [2624, 1088, 1, 256, 2624, 2624, 256, 256]
    - [0, 8.617]
  - - [2752, 1088, 1, 256, 2752, 2752, 256, 256]
    - [0, 8.583]
  - - [2880, 1088, 1, 256, 2880, 2880, 256, 256]
    - [0, 8.618]
  - - [3008, 1088, 1, 256, 3008, 3008, 256, 256]
    - [0, 8.643]
  - - [3136, 1088, 1, 256, 3136, 3136, 256, 256]
    - [0, 8.721]
  - - [3264, 1088, 1, 256, 3264, 3264, 256, 256]
    - [0, 8.665]
  - - [3392, 1088, 1, 256, 3392, 3392, 256, 256]
    - [0, 8.726]
  - - [3520, 1088, 1, 256, 3520, 3520, 256, 256]
    - [0, 8.724]
  - - [3648, 1088, 1, 256, 3648, 3648, 256, 256]
    - [0, 8.681]
  - - [3776, 1088, 1, 256, 3776, 3776, 256, 256]
    - [0, 8.722]
  - - [3904, 1088, 1, 256, 3904, 3904, 256, 256]
    - [0, 8.738]
  - - [4032, 1088, 1, 256, 4032, 4032, 256, 256]
    - [0, 8.745]
  - - [64, 1216, 1, 256, 64, 64, 256, 256]
    - [0, 4.634]
  - - [192, 1216, 1, 256, 192, 192, 256, 256]
    - [0, 6.832]
  - - [320, 1216, 1, 256, 320, 320, 256, 256]
    - [0, 7.589]
  - - [448, 1216, 1, 256, 448, 448, 256, 256]
    - [0, 7.939]
  - - [576, 1216, 1, 256, 576, 576, 256, 256]
    - [0, 7.963]
  - - [704, 1216, 1, 256, 704, 704, 256, 256]
    - [0, 7.785]
  - - [832, 1216, 1, 256, 832, 832, 256, 256]
    - [0, 7.949]
  - - [960, 1216, 1, 256, 960, 960, 256, 256]
    - [0, 8.082]
  - - [1088, 1216, 1, 256, 1088, 1088, 256, 256]
    - [0, 8.216]
  - - [1216, 1216, 1, 256, 1216, 1216, 256, 256]
    - [0, 8.29]
  - - [1344, 1216, 1, 256, 1344, 1344, 256, 256]
    - [0, 8.382]
  - - [1472, 1216, 1, 256, 1472, 1472, 256, 256]
    - [0, 8.43]
  - - [1600, 1216, 1, 256, 1600, 1600, 256, 256]
    - [0, 8.492]
  - - [1728, 1216, 1, 256, 1728, 1728, 256, 256]
    - [0, 8.507]
  - - [1856, 1216, 1, 256, 1856, 1856, 256, 256]
    - [0, 8.553]
  - - [1984, 1216, 1, 256, 1984, 1984, 256, 256]
    - [0, 8.551]
  - - [2112, 1216, 1, 256, 2112, 2112, 256, 256]
    - [0, 8.645]
  - - [2240, 1216, 1, 256, 2240, 2240, 256, 256]
    - [0, 8.569]
  - - [2368, 1216, 1, 256, 2368, 2368, 256, 256]
    - [0, 8.664]
  - - [2496, 1216, 1, 256, 2496, 2496, 256, 256]
    - [0, 8.702]
  - - [2624, 1216, 1, 256, 2624, 2624, 256, 256]
    - [0, 8.645]
  - - [2752, 1216, 1, 256, 2752, 2752, 256, 256]
    - [0, 8.686]
  - - [2880, 1216, 1, 256, 2880, 2880, 256, 256]
    - [0, 8.726]
  - - [3008, 1216, 1, 256, 3008, 3008, 256, 256]
    - [0, 8.738]
  - - [3136, 1216, 1, 256, 3136, 3136, 256, 256]
    - [0, 8.69]
  - - [3264, 1216, 1, 256, 3264, 3264, 256, 256]
    - [0, 8.708]
  - - [3392, 1216, 1, 256, 3392, 3392, 256, 256]
    - [0, 8.79]
  - - [3520, 1216, 1, 256, 3520, 3520, 256, 256]
    - [0, 8.736]
  - - [3648, 1216, 1, 256, 3648, 3648, 256, 256]
    - [0, 8.848]
  - - [3776, 1216, 1, 256, 3776, 3776, 256, 256]
    - [0, 8.743]
  - - [3904, 1216, 1, 256, 3904, 3904, 256, 256]
    - [0, 8.79]
  - - [4032, 1216, 1, 256, 4032, 4032, 256, 256]
    - [0, 8.761]
  - - [64, 1344, 1, 256, 64, 64, 256, 256]
    - [0, 5.118]
  - - [192, 1344, 1, 256, 192, 192, 256, 256]
    - [0, 6.936]
  - - [320, 1344, 1, 256, 320, 320, 256, 256]
    - [0, 7.548]
  - - [448, 1344, 1, 256, 448, 448, 256, 256]
    - [0, 7.932]
  - - [576, 1344, 1, 256, 576, 576, 256, 256]
    - [0, 7.771]
  - - [704, 1344, 1, 256, 704, 704, 256, 256]
    - [0, 7.905]
  - - [832, 1344, 1, 256, 832, 832, 256, 256]
    - [0, 8.115]
  - - [960, 1344, 1, 256, 960, 960, 256, 256]
    - [0, 8.17]
  - - [1088, 1344, 1, 256, 1088, 1088, 256, 256]
    - [0, 8.332]
  - - [1216, 1344, 1, 256, 1216, 1216, 256, 256]
    - [0, 8.393]
  - - [1344, 1344, 1, 256, 1344, 1344, 256, 256]
    - [0, 8.406]
  - - [1472, 1344, 1, 256, 1472, 1472, 256, 256]
    - [0, 8.509]
  - - [1600, 1344, 1, 256, 1600, 1600, 256, 256]
    - [0, 8.568]
  - - [1728, 1344, 1, 256, 1728, 1728, 256, 256]
    - [0, 8.578]
  - - [1856, 1344, 1, 256, 1856, 1856, 256, 256]
    - [0, 8.569]
  - - [1984, 1344, 1, 256, 1984, 1984, 256, 256]
    - [0, 8.558]
  - - [2112, 1344, 1, 256, 2112, 2112, 256, 256]
    - [0, 8.637]
  - - [2240, 1344, 1, 256, 2240, 2240, 256, 256]
    - [0, 8.553]
  - - [2368, 1344, 1, 256, 2368, 2368, 256, 256]
    - [0, 8.659]
  - - [2496, 1344, 1, 256, 2496, 2496, 256, 256]
    - [0, 8.707]
  - - [2624, 1344, 1, 256, 2624, 2624, 256, 256]
    - [0, 8.6]
  - - [2752, 1344, 1, 256, 2752, 2752, 256, 256]
    - [0, 8.695]
  - - [2880, 1344, 1, 256, 2880, 2880, 256, 256]
    - [0, 8.719]
  - - [3008, 1344, 1, 256, 3008, 3008, 256, 256]
    - [0, 8.714]
  - - [3136, 1344, 1, 256, 3136, 3136, 256, 256]
    - [0, 8.692]
  - - [3264, 1344, 1, 256, 3264, 3264, 256, 256]
    - [0, 8.726]
  - - [3392, 1344, 1, 256, 3392, 3392, 256, 256]
    - [0, 8.795]
  - - [3520, 1344, 1, 256, 3520, 3520, 256, 256]
    - [0, 8.825]
  - - [3648, 1344, 1, 256, 3648, 3648, 256, 256]
    - [0, 8.777]
  - - [3776, 1344, 1, 256, 3776, 3776, 256, 256]
    - [0, 8.772]
  - - [3904, 1344, 1, 256, 3904, 3904, 256, 256]
    - [0, 8.752]
  - - [4032, 1344, 1, 256, 4032, 4032, 256, 256]
    - [0, 8.746]
  - - [64, 1472, 1, 256, 64, 64, 256, 256]
    - [0, 4.695]
  - - [192, 1472, 1, 256, 192, 192, 256, 256]
    - [0, 6.957]
  - - [320, 1472, 1, 256, 320, 320, 256, 256]
    - [0, 7.702]
  - - [448, 1472, 1, 256, 448, 448, 256, 256]
    - [0, 8.067]
  - - [576, 1472, 1, 256, 576, 576, 256, 256]
    - [0, 7.897]
  - - [704, 1472, 1, 256, 704, 704, 256, 256]
    - [0, 7.945]
  - - [832, 1472, 1, 256, 832, 832, 256, 256]
    - [0, 8.115]
  - - [960, 1472, 1, 256, 960, 960, 256, 256]
    - [0, 8.214]
  - - [1088, 1472, 1, 256, 1088, 1088, 256, 256]
    - [0, 8.35]
  - - [1216, 1472, 1, 256, 1216, 1216, 256, 256]
    - [0, 8.399]
  - - [1344, 1472, 1, 256, 1344, 1344, 256, 256]
    - [0, 8.521]
  - - [1472, 1472, 1, 256, 1472, 1472, 256, 256]
    - [0, 8.472]
  - - [1600, 1472, 1, 256, 1600, 1600, 256, 256]
    - [0, 8.485]
  - - [1728, 1472, 1, 256, 1728, 1728, 256, 256]
    - [0, 8.554]
  - - [1856, 1472, 1, 256, 1856, 1856, 256, 256]
    - [0, 8.598]
  - - [1984, 1472, 1, 256, 1984, 1984, 256, 256]
    - [0, 8.616]
  - - [2112, 1472, 1, 256, 2112, 2112, 256, 256]
    - [0, 8.664]
  - - [2240, 1472, 1, 256, 2240, 2240, 256, 256]
    - [0, 8.664]
  - - [2368, 1472, 1, 256, 2368, 2368, 256, 256]
    - [0, 8.704]
  - - [2496, 1472, 1, 256, 2496, 2496, 256, 256]
    - [0, 8.702]
  - - [2624, 1472, 1, 256, 2624, 2624, 256, 256]
    - [0, 8.724]
  - - [2752, 1472, 1, 256, 2752, 2752, 256, 256]
    - [0, 8.711]
  - - [2880, 1472, 1, 256, 2880, 2880, 256, 256]
    - [0, 8.747]
  - - [3008, 1472, 1, 256, 3008, 3008, 256, 256]
    - [0, 8.799]
  - - [3136, 1472, 1, 256, 3136, 3136, 256, 256]
    - [0, 8.723]
  - - [3264, 1472, 1, 256, 3264, 3264, 256, 256]
    - [0, 8.76]
  - - [3392, 1472, 1, 256, 3392, 3392, 256, 256]
    - [0, 8.745]
  - - [3520, 1472, 1, 256, 3520, 3520, 256, 256]
    - [0, 8.769]
  - - [3648, 1472, 1, 256, 3648, 3648, 256, 256]
    - [0, 8.779]
  - - [3776, 1472, 1, 256, 3776, 3776, 256, 256]
    - [0, 8.841]
  - - [3904, 1472, 1, 256, 3904, 3904, 256, 256]
    - [0, 8.648]
  - - [4032, 1472, 1, 256, 4032, 4032, 256, 256]
    - [0, 8.724]
  - - [64, 1600, 1, 256, 64, 64, 256, 256]
    - [0, 5.078]
  - - [192, 1600, 1, 256, 192, 192, 256, 256]
    - [0, 7.417]
  - - [320, 1600, 1, 256, 320, 320, 256, 256]
    - [0, 7.846]
  - - [448, 1600, 1, 256, 448, 448, 256, 256]
    - [0, 8.119]
  - - [576, 1600, 1, 256, 576, 576, 256, 256]
    - [0, 7.893]
  - - [704, 1600, 1, 256, 704, 704, 256, 256]
    - [0, 8.076]
  - - [832, 1600, 1, 256, 832, 832, 256, 256]
    - [0, 8.235]
  - - [960, 1600, 1, 256, 960, 960, 256, 256]
    - [0, 8.308]
  - - [1088, 1600, 1, 256, 1088, 1088, 256, 256]
    - [0, 8.415]
  - - [1216, 1600, 1, 256, 1216, 1216, 256, 256]
    - [0, 8.45]
  - - [1344, 1600, 1, 256, 1344, 1344, 256, 256]
    - [0, 8.467]
  - - [1472, 1600, 1, 256, 1472, 1472, 256, 256]
    - [0, 8.467]
  - - [1600, 1600, 1, 256, 1600, 1600, 256, 256]
    - [0, 8.576]
  - - [1728, 1600, 1, 256, 1728, 1728, 256, 256]
    - [0, 8.576]
  - - [1856, 1600, 1, 256, 1856, 1856, 256, 256]
    - [0, 8.631]
  - - [1984, 1600, 1, 256, 1984, 1984, 256, 256]
    - [0, 8.686]
  - - [2112, 1600, 1, 256, 2112, 2112, 256, 256]
    - [0, 8.66]
  - - [2240, 1600, 1, 256, 2240, 2240, 256, 256]
    - [0, 8.755]
  - - [2368, 1600, 1, 256, 2368, 2368, 256, 256]
    - [0, 8.708]
  - - [2496, 1600, 1, 256, 2496, 2496, 256, 256]
    - [0, 8.701]
  - - [2624, 1600, 1, 256, 2624, 2624, 256, 256]
    - [0, 8.706]
  - - [2752, 1600, 1, 256, 2752, 2752, 256, 256]
    - [0, 8.754]
  - - [2880, 1600, 1, 256, 2880, 2880, 256, 256]
    - [0, 8.76]
  - - [3008, 1600, 1, 256, 3008, 3008, 256, 256]
    - [0, 8.778]
  - - [3136, 1600, 1, 256, 3136, 3136, 256, 256]
    - [0, 8.812]
  - - [3264, 1600, 1, 256, 3264, 3264, 256, 256]
    - [0, 8.753]
  - - [3392, 1600, 1, 256, 3392, 3392, 256, 256]
    - [0, 8.803]
  - - [3520, 1600, 1, 256, 3520, 3520, 256, 256]
    - [0, 8.839]
  - - [3648, 1600, 1, 256, 3648, 3648, 256, 256]
    - [0, 8.727]
  - - [3776, 1600, 1, 256, 3776, 3776, 256, 256]
    - [0, 8.685]
  - - [3904, 1600, 1, 256, 3904, 3904, 256, 256]
    - [0, 8.673]
  - - [4032, 1600, 1, 256, 4032, 4032, 256, 256]
    - [0, 8.693]
  - - [64, 1728, 1, 256, 64, 64, 256, 256]
    - [0, 5.475]
  - - [192, 1728, 1, 256, 192, 192, 256, 256]
    - [0, 7.364]
  - - [320, 1728, 1, 256, 320, 320, 256, 256]
    - [0, 7.81]
  - - [448, 1728, 1, 256, 448, 448, 256, 256]
    - [0, 7.766]
  - - [576, 1728, 1, 256, 576, 576, 256, 256]
    - [0, 8.003]
  - - [704, 1728, 1, 256, 704, 704, 256, 256]
    - [0, 8.203]
  - - [832, 1728, 1, 256, 832, 832, 256, 256]
    - [0, 8.268]
  - - [960, 1728, 1, 256, 960, 960, 256, 256]
    - [0, 8.33]
  - - [1088, 1728, 1, 256, 1088, 1088, 256, 256]
    - [0, 8.463]
  - - [1216, 1728, 1, 256, 1216, 1216, 256, 256]
    - [0, 8.496]
  - - [1344, 1728, 1, 256, 1344, 1344, 256, 256]
    - [0, 8.535]
  - - [1472, 1728, 1, 256, 1472, 1472, 256, 256]
    - [0, 8.645]
  - - [1600, 1728, 1, 256, 1600, 1600, 256, 256]
    - [0, 8.66]
  - - [1728, 1728, 1, 256, 1728, 1728, 256, 256]
    - [0, 8.561]
  - - [1856, 1728, 1, 256, 1856, 1856, 256, 256]
    - [0, 8.62]
  - - [1984, 1728, 1, 256, 1984, 1984, 256, 256]
    - [0, 8.74]
  - - [2112, 1728, 1, 256, 2112, 2112, 256, 256]
    - [0, 8.672]
  - - [2240, 1728, 1, 256, 2240, 2240, 256, 256]
    - [0, 8.713]
  - - [2368, 1728, 1, 256, 2368, 2368, 256, 256]
    - [0, 8.718]
  - - [2496, 1728, 1, 256, 2496, 2496, 256, 256]
    - [0, 8.738]
  - - [2624, 1728, 1, 256, 2624, 2624, 256, 256]
    - [0, 8.68]
  - - [2752, 1728, 1, 256, 2752, 2752, 256, 256]
    - [0, 8.775]
  - - [2880, 1728, 1, 256, 2880, 2880, 256, 256]
    - [0, 8.709]
  - - [3008, 1728, 1, 256, 3008, 3008, 256, 256]
    - [0, 8.802]
  - - [3136, 1728, 1, 256, 3136, 3136, 256, 256]
    - [0, 8.796]
  - - [3264, 1728, 1, 256, 3264, 3264, 256, 256]
    - [0, 8.743]
  - - [3392, 1728, 1, 256, 3392, 3392, 256, 256]
    - [0, 8.659]
  - - [3520, 1728, 1, 256, 3520, 3520, 256, 256]
    - [0, 8.726]
  - - [3648, 1728, 1, 256, 3648, 3648, 256, 256]
    - [0, 8.682]
  - - [3776, 1728, 1, 256, 3776, 3776, 256, 256]
    - [0, 8.674]
  - - [3904, 1728, 1, 256, 3904, 3904, 256, 256]
    - [0, 8.736]
  - - [4032, 1728, 1, 256, 4032, 4032, 256, 256]
    - [0, 8.722]
  - - [64, 1856, 1, 256, 64, 64, 256, 256]
    - [0, 5.87]
  - - [192, 1856, 1, 256, 192, 192, 256, 256]
    - [0, 7.505]
  - - [320, 1856, 1, 256, 320, 320, 256, 256]
    - [0, 7.949]
  - - [448, 1856, 1, 256, 448, 448, 256, 256]
    - [0, 7.776]
  - - [576, 1856, 1, 256, 576, 576, 256, 256]
    - [0, 7.997]
  - - [704, 1856, 1, 256, 704, 704, 256, 256]
    - [0, 8.245]
  - - [832, 1856, 1, 256, 832, 832, 256, 256]
    - [0, 8.327]
  - - [960, 1856, 1, 256, 960, 960, 256, 256]
    - [0, 8.433]
  - - [1088, 1856, 1, 256, 1088, 1088, 256, 256]
    - [0, 8.545]
  - - [1216, 1856, 1, 256, 1216, 1216, 256, 256]
    - [0, 8.579]
  - - [1344, 1856, 1, 256, 1344, 1344, 256, 256]
    - [0, 8.528]
  - - [1472, 1856, 1, 256, 1472, 1472, 256, 256]
    - [0, 8.635]
  - - [1600, 1856, 1, 256, 1600, 1600, 256, 256]
    - [0, 8.66]
  - - [1728, 1856, 1, 256, 1728, 1728, 256, 256]
    - [0, 8.629]
  - - [1856, 1856, 1, 256, 1856, 1856, 256, 256]
    - [0, 8.682]
  - - [1984, 1856, 1, 256, 1984, 1984, 256, 256]
    - [0, 8.73]
  - - [2112, 1856, 1, 256, 2112, 2112, 256, 256]
    - [0, 8.704]
  - - [2240, 1856, 1, 256, 2240, 2240, 256, 256]
    - [0, 8.736]
  - - [2368, 1856, 1, 256, 2368, 2368, 256, 256]
    - [0, 8.811]
  - - [2496, 1856, 1, 256, 2496, 2496, 256, 256]
    - [0, 8.818]
  - - [2624, 1856, 1, 256, 2624, 2624, 256, 256]
    - [0, 8.867]
  - - [2752, 1856, 1, 256, 2752, 2752, 256, 256]
    - [0, 8.761]
  - - [2880, 1856, 1, 256, 2880, 2880, 256, 256]
    - [0, 8.854]
  - - [3008, 1856, 1, 256, 3008, 3008, 256, 256]
    - [0, 8.778]
  - - [3136, 1856, 1, 256, 3136, 3136, 256, 256]
    - [0, 8.687]
  - - [3264, 1856, 1, 256, 3264, 3264, 256, 256]
    - [0, 8.695]
  - - [3392, 1856, 1, 256, 3392, 3392, 256, 256]
    - [0, 8.623]
  - - [3520, 1856, 1, 256, 3520, 3520, 256, 256]
    - [0, 8.707]
  - - [3648, 1856, 1, 256, 3648, 3648, 256, 256]
    - [0, 8.708]
  - - [3776, 1856, 1, 256, 3776, 3776, 256, 256]
    - [0, 8.721]
  - - [3904, 1856, 1, 256, 3904, 3904, 256, 256]
    - [0, 8.726]
  - - [4032, 1856, 1, 256, 4032, 4032, 256, 256]
    - [0, 8.713]
  - - [64, 1984, 1, 256, 64, 64, 256, 256]
    - [0, 5.371]
  - - [192, 1984, 1, 256, 192, 192, 256, 256]
    - [0, 7.485]
  - - [320, 1984, 1, 256, 320, 320, 256, 256]
    - [0, 7.984]
  - - [448, 1984, 1, 256, 448, 448, 256, 256]
    - [0, 7.852]
  - - [576, 1984, 1, 256, 576, 576, 256, 256]
    - [0, 8.107]
  - - [704, 1984, 1, 256, 704, 704, 256, 256]
    - [0, 8.298]
  - - [832, 1984, 1, 256, 832, 832, 256, 256]
    - [0, 8.398]
  - - [960, 1984, 1, 256, 960, 960, 256, 256]
    - [0, 8.47]
  - - [1088, 1984, 1, 256, 1088, 1088, 256, 256]
    - [0, 8.512]
  - - [1216, 1984, 1, 256, 1216, 1216, 256, 256]
    - [0, 8.59]
  - - [1344, 1984, 1, 256, 1344, 1344, 256, 256]
    - [0, 8.623]
  - - [1472, 1984, 1, 256, 1472, 1472, 256, 256]
    - [0, 8.657]
  - - [1600, 1984, 1, 256, 1600, 1600, 256, 256]
    - [0, 8.689]
  - - [1728, 1984, 1, 256, 1728, 1728, 256, 256]
    - [0, 8.707]
  - - [1856, 1984, 1, 256, 1856, 1856, 256, 256]
    - [0, 8.716]
  - - [1984, 1984, 1, 256, 1984, 1984, 256, 256]
    - [0, 8.71]
  - - [2112, 1984, 1, 256, 2112, 2112, 256, 256]
    - [0, 8.782]
  - - [2240, 1984, 1, 256, 2240, 2240, 256, 256]
    - [0, 8.754]
  - - [2368, 1984, 1, 256, 2368, 2368, 256, 256]
    - [0, 8.742]
  - - [2496, 1984, 1, 256, 2496, 2496, 256, 256]
    - [0, 8.833]
  - - [2624, 1984, 1, 256, 2624, 2624, 256, 256]
    - [0, 8.75]
  - - [2752, 1984, 1, 256, 2752, 2752, 256, 256]
    - [0, 8.802]
  - - [2880, 1984, 1, 256, 2880, 2880, 256, 256]
    - [0, 8.598]
  - - [3008, 1984, 1, 256, 3008, 3008, 256, 256]
    - [0, 8.644]
  - - [3136, 1984, 1, 256, 3136, 3136, 256, 256]
    - [0, 8.69]
  - - [3264, 1984, 1, 256, 3264, 3264, 256, 256]
    - [0, 8.692]
  - - [3392, 1984, 1, 256, 3392, 3392, 256, 256]
    - [0, 8.782]
  - - [3520, 1984, 1, 256, 3520, 3520, 256, 256]
    - [0, 8.683]
  - - [3648, 1984, 1, 256, 3648, 3648, 256, 256]
    - [0, 8.76]
  - - [3776, 1984, 1, 256, 3776, 3776, 256, 256]
    - [0, 8.714]
  - - [3904, 1984, 1, 256, 3904, 3904, 256, 256]
    - [0, 8.751]
  - - [4032, 1984, 1, 256, 4032, 4032, 256, 256]
    - [0, 8.815]
  - - [64, 2112, 1, 256, 64, 64, 256, 256]
    - [0, 5.703]
  - - [192, 2112, 1, 256, 192, 192, 256, 256]
    - [0, 7.479]
  - - [320, 2112, 1, 256, 320, 320, 256, 256]
    - [0, 7.987]
  - - [448, 2112, 1, 256, 448, 448, 256, 256]
    - [0, 7.897]
  - - [576, 2112, 1, 256, 576, 576, 256, 256]
    - [0, 8.218]
  - - [704, 2112, 1, 256, 704, 704, 256, 256]
    - [0, 8.369]
  - - [832, 2112, 1, 256, 832, 832, 256, 256]
    - [0, 8.429]
  - - [960, 2112, 1, 256, 960, 960, 256, 256]
    - [0, 8.516]
  - - [1088, 2112, 1, 256, 1088, 1088, 256, 256]
    - [0, 8.622]
  - - [1216, 2112, 1, 256, 1216, 1216, 256, 256]
    - [0, 8.602]
  - - [1344, 2112, 1, 256, 1344, 1344, 256, 256]
    - [0, 8.539]
  - - [1472, 2112, 1, 256, 1472, 1472, 256, 256]
    - [0, 8.586]
  - - [1600, 2112, 1, 256, 1600, 1600, 256, 256]
    - [0, 8.673]
  - - [1728, 2112, 1, 256, 1728, 1728, 256, 256]
    - [0, 8.78]
  - - [1856, 2112, 1, 256, 1856, 1856, 256, 256]
    - [0, 8.666]
  - - [1984, 2112, 1, 256, 1984, 1984, 256, 256]
    - [0, 8.713]
  - - [2112, 2112, 1, 256, 2112, 2112, 256, 256]
    - [0, 8.76]
  - - [2240, 2112, 1, 256, 2240, 2240, 256, 256]
    - [0, 8.73]
  - - [2368, 2112, 1, 256, 2368, 2368, 256, 256]
    - [0, 8.738]
  - - [2496, 2112, 1, 256, 2496, 2496, 256, 256]
    - [0, 8.815]
  - - [2624, 2112, 1, 256, 2624, 2624, 256, 256]
    - [0, 8.747]
  - - [2752, 2112, 1, 256, 2752, 2752, 256, 256]
    - [0, 8.608]
  - - [2880, 2112, 1, 256, 2880, 2880, 256, 256]
    - [0, 8.726]
  - - [3008, 2112, 1, 256, 3008, 3008, 256, 256]
    - [0, 8.735]
  - - [3136, 2112, 1, 256, 3136, 3136, 256, 256]
    - [0, 8.701]
  - - [3264, 2112, 1, 256, 3264, 3264, 256, 256]
    - [0, 8.644]
  - - [3392, 2112, 1, 256, 3392, 3392, 256, 256]
    - [0, 8.716]
  - - [3520, 2112, 1, 256, 3520, 3520, 256, 256]
    - [0, 8.772]
  - - [3648, 2112, 1, 256, 3648, 3648, 256, 256]
    - [0, 8.74]
  - - [3776, 2112, 1, 256, 3776, 3776, 256, 256]
    - [0, 8.745]
  - - [3904, 2112, 1, 256, 3904, 3904, 256, 256]
    - [0, 8.71]
  - - [4032, 2112, 1, 256, 4032, 4032, 256, 256]
    - [0, 8.765]
  - - [64, 2240, 1, 256, 64, 64, 256, 256]
    - [0, 6.016]
  - - [192, 2240, 1, 256, 192, 192, 256, 256]
    - [0, 7.608]
  - - [320, 2240, 1, 256, 320, 320, 256, 256]
    - [0, 8.11]
  - - [448, 2240, 1, 256, 448, 448, 256, 256]
    - [0, 7.994]
  - - [576, 2240, 1, 256, 576, 576, 256, 256]
    - [0, 8.181]
  - - [704, 2240, 1, 256, 704, 704, 256, 256]
    - [0, 8.345]
  - - [832, 2240, 1, 256, 832, 832, 256, 256]
    - [0, 8.439]
  - - [960, 2240, 1, 256, 960, 960, 256, 256]
    - [0, 8.56]
  - - [1088, 2240, 1, 256, 1088, 1088, 256, 256]
    - [0, 8.497]
  - - [1216, 2240, 1, 256, 1216, 1216, 256, 256]
    - [0, 8.641]
  - - [1344, 2240, 1, 256, 1344, 1344, 256, 256]
    - [0, 8.733]
  - - [1472, 2240, 1, 256, 1472, 1472, 256, 256]
    - [0, 8.774]
  - - [1600, 2240, 1, 256, 1600, 1600, 256, 256]
    - [0, 8.685]
  - - [1728, 2240, 1, 256, 1728, 1728, 256, 256]
    - [0, 8.689]
  - - [1856, 2240, 1, 256, 1856, 1856, 256, 256]
    - [0, 8.778]
  - - [1984, 2240, 1, 256, 1984, 1984, 256, 256]
    - [0, 8.684]
  - - [2112, 2240, 1, 256, 2112, 2112, 256, 256]
    - [0, 8.807]
  - - [2240, 2240, 1, 256, 2240, 2240, 256, 256]
    - [0, 8.833]
  - - [2368, 2240, 1, 256, 2368, 2368, 256, 256]
    - [0, 8.736]
  - - [2496, 2240, 1, 256, 2496, 2496, 256, 256]
    - [0, 8.835]
  - - [2624, 2240, 1, 256, 2624, 2624, 256, 256]
    - [0, 8.638]
  - - [2752, 2240, 1, 256, 2752, 2752, 256, 256]
    - [0, 8.628]
  - - [2880, 2240, 1, 256, 2880, 2880, 256, 256]
    - [0, 8.737]
  - - [3008, 2240, 1, 256, 3008, 3008, 256, 256]
    - [0, 8.736]
  - - [3136, 2240, 1, 256, 3136, 3136, 256, 256]
    - [0, 8.71]
  - - [3264, 2240, 1, 256, 3264, 3264, 256, 256]
    - [0, 8.763]
  - - [3392, 2240, 1, 256, 3392, 3392, 256, 256]
    - [0, 8.757]
  - - [3520, 2240, 1, 256, 3520, 3520, 256, 256]
    - [0, 8.693]
  - - [3648, 2240, 1, 256, 3648, 3648, 256, 256]
    - [0, 8.723]
  - - [3776, 2240, 1, 256, 3776, 3776, 256, 256]
    - [0, 8.759]
  - - [3904, 2240, 1, 256, 3904, 3904, 256, 256]
    - [0, 8.812]
  - - [4032, 2240, 1, 256, 4032, 4032, 256, 256]
    - [0, 8.768]
  - - [64, 2368, 1, 256, 64, 64, 256, 256]
    - [2, 5.057]
  - - [192, 2368, 1, 256, 192, 192, 256, 256]
    - [0, 7.763]
  - - [320, 2368, 1, 256, 320, 320, 256, 256]
    - [0, 7.622]
  - - [448, 2368, 1, 256, 448, 448, 256, 256]
    - [0, 8.098]
  - - [576, 2368, 1, 256, 576, 576, 256, 256]
    - [0, 8.26]
  - - [704, 2368, 1, 256, 704, 704, 256, 256]
    - [0, 8.366]
  - - [832, 2368, 1, 256, 832, 832, 256, 256]
    - [0, 8.457]
  - - [960, 2368, 1, 256, 960, 960, 256, 256]
    - [0, 8.566]
  - - [1088, 2368, 1, 256, 1088, 1088, 256, 256]
    - [0, 8.534]
  - - [1216, 2368, 1, 256, 1216, 1216, 256, 256]
    - [0, 8.682]
  - - [1344, 2368, 1, 256, 1344, 1344, 256, 256]
    - [0, 8.654]
  - - [1472, 2368, 1, 256, 1472, 1472, 256, 256]
    - [0, 8.73]
  - - [1600, 2368, 1, 256, 1600, 1600, 256, 256]
    - [0, 8.72]
  - - [1728, 2368, 1, 256, 1728, 1728, 256, 256]
    - [0, 8.757]
  - - [1856, 2368, 1, 256, 1856, 1856, 256, 256]
    - [0, 8.765]
  - - [1984, 2368, 1, 256, 1984, 1984, 256, 256]
    - [0, 8.822]
  - - [2112, 2368, 1, 256, 2112, 2112, 256, 256]
    - [0, 8.834]
  - - [2240, 2368, 1, 256, 2240, 2240, 256, 256]
    - [0, 8.774]
  - - [2368, 2368, 1, 256, 2368, 2368, 256, 256]
    - [0, 8.801]
  - - [2496, 2368, 1, 256, 2496, 2496, 256, 256]
    - [0, 8.595]
  - - [2624, 2368, 1, 256, 2624, 2624, 256, 256]
    - [0, 8.715]
  - - [2752, 2368, 1, 256, 2752, 2752, 256, 256]
    - [0, 8.747]
  - - [2880, 2368, 1, 256, 2880, 2880, 256, 256]
    - [0, 8.719]
  - - [3008, 2368, 1, 256, 3008, 3008, 256, 256]
    - [0, 8.691]
  - - [3136, 2368, 1, 256, 3136, 3136, 256, 256]
    - [0, 8.738]
  - - [3264, 2368, 1, 256, 3264, 3264, 256, 256]
    - [0, 8.73]
  - - [3392, 2368, 1, 256, 3392, 3392, 256, 256]
    - [0, 8.815]
  - - [3520, 2368, 1, 256, 3520, 3520, 256, 256]
    - [0, 8.758]
  - - [3648, 2368, 1, 256, 3648, 3648, 256, 256]
    - [0, 8.793]
  - - [3776, 2368, 1, 256, 3776, 3776, 256, 256]
    - [0, 8.828]
  - - [3904, 2368, 1, 256, 3904, 3904, 256, 256]
    - [0, 8.766]
  - - [4032, 2368, 1, 256, 4032, 4032, 256, 256]
    - [0, 8.812]
  - - [64, 2496, 1, 256, 64, 64, 256, 256]
    - [0, 5.905]
  - - [192, 2496, 1, 256, 192, 192, 256, 256]
    - [0, 7.772]
  - - [320, 2496, 1, 256, 320, 320, 256, 256]
    - [0, 7.751]
  - - [448, 2496, 1, 256, 448, 448, 256, 256]
    - [0, 8.108]
  - - [576, 2496, 1, 256, 576, 576, 256, 256]
    - [0, 8.247]
  - - [704, 2496, 1, 256, 704, 704, 256, 256]
    - [0, 8.409]
  - - [832, 2496, 1, 256, 832, 832, 256, 256]
    - [0, 8.608]
  - - [960, 2496, 1, 256, 960, 960, 256, 256]
    - [0, 8.555]
  - - [1088, 2496, 1, 256, 1088, 1088, 256, 256]
    - [0, 8.625]
  - - [1216, 2496, 1, 256, 1216, 1216, 256, 256]
    - [0, 8.615]
  - - [1344, 2496, 1, 256, 1344, 1344, 256, 256]
    - [0, 8.678]
  - - [1472, 2496, 1, 256, 1472, 1472, 256, 256]
    - [0, 8.732]
  - - [1600, 2496, 1, 256, 1600, 1600, 256, 256]
    - [0, 8.695]
  - - [1728, 2496, 1, 256, 1728, 1728, 256, 256]
    - [0, 8.753]
  - - [1856, 2496, 1, 256, 1856, 1856, 256, 256]
    - [0, 8.809]
  - - [1984, 2496, 1, 256, 1984, 1984, 256, 256]
    - [0, 8.82]
  - - [2112, 2496, 1, 256, 2112, 2112, 256, 256]
    - [0, 8.781]
  - - [2240, 2496, 1, 256, 2240, 2240, 256, 256]
    - [0, 8.795]
  - - [2368, 2496, 1, 256, 2368, 2368, 256, 256]
    - [0, 8.725]
  - - [2496, 2496, 1, 256, 2496, 2496, 256, 256]
    - [0, 8.722]
  - - [2624, 2496, 1, 256, 2624, 2624, 256, 256]
    - [0, 8.779]
  - - [2752, 2496, 1, 256, 2752, 2752, 256, 256]
    - [0, 8.719]
  - - [2880, 2496, 1, 256, 2880, 2880, 256, 256]
    - [0, 8.703]
  - - [3008, 2496, 1, 256, 3008, 3008, 256, 256]
    - [0, 8.738]
  - - [3136, 2496, 1, 256, 3136, 3136, 256, 256]
    - [0, 8.749]
  - - [3264, 2496, 1, 256, 3264, 3264, 256, 256]
    - [0, 8.751]
  - - [3392, 2496, 1, 256, 3392, 3392, 256, 256]
    - [0, 8.801]
  - - [3520, 2496, 1, 256, 3520, 3520, 256, 256]
    - [0, 8.796]
  - - [3648, 2496, 1, 256, 3648, 3648, 256, 256]
    - [0, 8.795]
  - - [3776, 2496, 1, 256, 3776, 3776, 256, 256]
    - [0, 8.859]
  - - [3904, 2496, 1, 256, 3904, 3904, 256, 256]
    - [0, 8.779]
  - - [4032, 2496, 1, 256, 4032, 4032, 256, 256]
    - [0, 8.805]
  - - [64, 2624, 1, 256, 64, 64, 256, 256]
    - [0, 6.163]
  - - [192, 2624, 1, 256, 192, 192, 256, 256]
    - [0, 7.747]
  - - [320, 2624, 1, 256, 320, 320, 256, 256]
    - [0, 7.84]
  - - [448, 2624, 1, 256, 448, 448, 256, 256]
    - [0, 8.13]
  - - [576, 2624, 1, 256, 576, 576, 256, 256]
    - [0, 8.32]
  - - [704, 2624, 1, 256, 704, 704, 256, 256]
    - [0, 8.425]
  - - [832, 2624, 1, 256, 832, 832, 256, 256]
    - [0, 8.513]
  - - [960, 2624, 1, 256, 960, 960, 256, 256]
    - [0, 8.572]
  - - [1088, 2624, 1, 256, 1088, 1088, 256, 256]
    - [0, 8.606]
  - - [1216, 2624, 1, 256, 1216, 1216, 256, 256]
    - [0, 8.658]
  - - [1344, 2624, 1, 256, 1344, 1344, 256, 256]
    - [0, 8.67]
  - - [1472, 2624, 1, 256, 1472, 1472, 256, 256]
    - [0, 8.7]
  - - [1600, 2624, 1, 256, 1600, 1600, 256, 256]
    - [0, 8.757]
  - - [1728, 2624, 1, 256, 1728, 1728, 256, 256]
    - [0, 8.816]
  - - [1856, 2624, 1, 256, 1856, 1856, 256, 256]
    - [0, 8.75]
  - - [1984, 2624, 1, 256, 1984, 1984, 256, 256]
    - [0, 8.829]
  - - [2112, 2624, 1, 256, 2112, 2112, 256, 256]
    - [0, 8.778]
  - - [2240, 2624, 1, 256, 2240, 2240, 256, 256]
    - [0, 8.603]
  - - [2368, 2624, 1, 256, 2368, 2368, 256, 256]
    - [0, 8.691]
  - - [2496, 2624, 1, 256, 2496, 2496, 256, 256]
    - [0, 8.716]
  - - [2624, 2624, 1, 256, 2624, 2624, 256, 256]
    - [0, 8.777]
  - - [2752, 2624, 1, 256, 2752, 2752, 256, 256]
    - [0, 8.814]
  - - [2880, 2624, 1, 256, 2880, 2880, 256, 256]
    - [0, 8.733]
  - - [3008, 2624, 1, 256, 3008, 3008, 256, 256]
    - [0, 8.761]
  - - [3136, 2624, 1, 256, 3136, 3136, 256, 256]
    - [0, 8.825]
  - - [3264, 2624, 1, 256, 3264, 3264, 256, 256]
    - [0, 8.806]
  - - [3392, 2624, 1, 256, 3392, 3392, 256, 256]
    - [0, 8.816]
  - - [3520, 2624, 1, 256, 3520, 3520, 256, 256]
    - [0, 8.757]
  - - [3648, 2624, 1, 256, 3648, 3648, 256, 256]
    - [0, 8.824]
  - - [3776, 2624, 1, 256, 3776, 3776, 256, 256]
    - [0, 8.782]
  - - [3904, 2624, 1, 256, 3904, 3904, 256, 256]
    - [0, 8.839]
  - - [4032, 2624, 1, 256, 4032, 4032, 256, 256]
    - [0, 8.833]
  - - [64, 2752, 1, 256, 64, 64, 256, 256]
    - [0, 6.443]
  - - [192, 2752, 1, 256, 192, 192, 256, 256]
    - [0, 7.787]
  - - [320, 2752, 1, 256, 320, 320, 256, 256]
    - [0, 7.807]
  - - [448, 2752, 1, 256, 448, 448, 256, 256]
    - [0, 8.154]
  - - [576, 2752, 1, 256, 576, 576, 256, 256]
    - [0, 8.396]
  - - [704, 2752, 1, 256, 704, 704, 256, 256]
    - [0, 8.523]
  - - [832, 2752, 1, 256, 832, 832, 256, 256]
    - [0, 8.492]
  - - [960, 2752, 1, 256, 960, 960, 256, 256]
    - [0, 8.575]
  - - [1088, 2752, 1, 256, 1088, 1088, 256, 256]
    - [0, 8.582]
  - - [1216, 2752, 1, 256, 1216, 1216, 256, 256]
    - [0, 8.748]
  - - [1344, 2752, 1, 256, 1344, 1344, 256, 256]
    - [0, 8.728]
  - - [1472, 2752, 1, 256, 1472, 1472, 256, 256]
    - [0, 8.718]
  - - [1600, 2752, 1, 256, 1600, 1600, 256, 256]
    - [0, 8.771]
  - - [1728, 2752, 1, 256, 1728, 1728, 256, 256]
    - [0, 8.769]
  - - [1856, 2752, 1, 256, 1856, 1856, 256, 256]
    - [0, 8.792]
  - - [1984, 2752, 1, 256, 1984, 1984, 256, 256]
    - [0, 8.8]
  - - [2112, 2752, 1, 256, 2112, 2112, 256, 256]
    - [0, 8.644]
  - - [2240, 2752, 1, 256, 2240, 2240, 256, 256]
    - [0, 8.66]
  - - [2368, 2752, 1, 256, 2368, 2368, 256, 256]
    - [0, 8.738]
  - - [2496, 2752, 1, 256, 2496, 2496, 256, 256]
    - [0, 8.724]
  - - [2624, 2752, 1, 256, 2624, 2624, 256, 256]
    - [0, 8.86]
  - - [2752, 2752, 1, 256, 2752, 2752, 256, 256]
    - [0, 8.739]
  - - [2880, 2752, 1, 256, 2880, 2880, 256, 256]
    - [0, 8.706]
  - - [3008, 2752, 1, 256, 3008, 3008, 256, 256]
    - [0, 8.694]
  - - [3136, 2752, 1, 256, 3136, 3136, 256, 256]
    - [0, 8.756]
  - - [3264, 2752, 1, 256, 3264, 3264, 256, 256]
    - [0, 8.774]
  - - [3392, 2752, 1, 256, 3392, 3392, 256, 256]
    - [0, 8.823]
  - - [3520, 2752, 1, 256, 3520, 3520, 256, 256]
    - [0, 8.819]
  - - [3648, 2752, 1, 256, 3648, 3648, 256, 256]
    - [0, 8.8]
  - - [3776, 2752, 1, 256, 3776, 3776, 256, 256]
    - [0, 8.897]
  - - [3904, 2752, 1, 256, 3904, 3904, 256, 256]
    - [0, 8.823]
  - - [4032, 2752, 1, 256, 4032, 4032, 256, 256]
    - [0, 8.783]
  - - [64, 2880, 1, 256, 64, 64, 256, 256]
    - [0, 4.52]
  - - [192, 2880, 1, 256, 192, 192, 256, 256]
    - [0, 7.828]
  - - [320, 2880, 1, 256, 320, 320, 256, 256]
    - [0, 7.868]
  - - [448, 2880, 1, 256, 448, 448, 256, 256]
    - [0, 8.169]
  - - [576, 2880, 1, 256, 576, 576, 256, 256]
    - [0, 8.382]
  - - [704, 2880, 1, 256, 704, 704, 256, 256]
    - [0, 8.501]
  - - [832, 2880, 1, 256, 832, 832, 256, 256]
    - [0, 8.53]
  - - [960, 2880, 1, 256, 960, 960, 256, 256]
    - [0, 8.61]
  - - [1088, 2880, 1, 256, 1088, 1088, 256, 256]
    - [0, 8.689]
  - - [1216, 2880, 1, 256, 1216, 1216, 256, 256]
    - [0, 8.775]
  - - [1344, 2880, 1, 256, 1344, 1344, 256, 256]
    - [0, 8.657]
  - - [1472, 2880, 1, 256, 1472, 1472, 256, 256]
    - [0, 8.731]
  - - [1600, 2880, 1, 256, 1600, 1600, 256, 256]
    - [0, 8.726]
  - - [1728, 2880, 1, 256, 1728, 1728, 256, 256]
    - [0, 8.838]
  - - [1856, 2880, 1, 256, 1856, 1856, 256, 256]
    - [0, 8.8]
  - - [1984, 2880, 1, 256, 1984, 1984, 256, 256]
    - [0, 8.587]
  - - [2112, 2880, 1, 256, 2112, 2112, 256, 256]
    - [0, 8.782]
  - - [2240, 2880, 1, 256, 2240, 2240, 256, 256]
    - [0, 8.67]
  - - [2368, 2880, 1, 256, 2368, 2368, 256, 256]
    - [0, 8.669]
  - - [2496, 2880, 1, 256, 2496, 2496, 256, 256]
    - [0, 8.707]
  - - [2624, 2880, 1, 256, 2624, 2624, 256, 256]
    - [0, 8.781]
  - - [2752, 2880, 1, 256, 2752, 2752, 256, 256]
    - [0, 8.772]
  - - [2880, 2880, 1, 256, 2880, 2880, 256, 256]
    - [0, 8.713]
  - - [3008, 2880, 1, 256, 3008, 3008, 256, 256]
    - [0, 8.793]
  - - [3136, 2880, 1, 256, 3136, 3136, 256, 256]
    - [0, 8.772]
  - - [3264, 2880, 1, 256, 3264, 3264, 256, 256]
    - [0, 8.823]
  - - [3392, 2880, 1, 256, 3392, 3392, 256, 256]
    - [0, 8.865]
  - - [3520, 2880, 1, 256, 3520, 3520, 256, 256]
    - [0, 8.834]
  - - [3648, 2880, 1, 256, 3648, 3648, 256, 256]
    - [0, 8.757]
  - - [3776, 2880, 1, 256, 3776, 3776, 256, 256]
    - [0, 8.801]
  - - [3904, 2880, 1, 256, 3904, 3904, 256, 256]
    - [0, 8.849]
  - - [4032, 2880, 1, 256, 4032, 4032, 256, 256]
    - [0, 8.841]
  - - [64, 3008, 1, 256, 64, 64, 256, 256]
    - [0, 6.268]
  - - [192, 3008, 1, 256, 192, 192, 256, 256]
    - [0, 7.921]
  - - [320, 3008, 1, 256, 320, 320, 256, 256]
    - [0, 7.981]
  - - [448, 3008, 1, 256, 448, 448, 256, 256]
    - [0, 8.331]
  - - [576, 3008, 1, 256, 576, 576, 256, 256]
    - [0, 8.398]
  - - [704, 3008, 1, 256, 704, 704, 256, 256]
    - [0, 8.556]
  - - [832, 3008, 1, 256, 832, 832, 256, 256]
    - [0, 8.589]
  - - [960, 3008, 1, 256, 960, 960, 256, 256]
    - [0, 8.652]
  - - [1088, 3008, 1, 256, 1088, 1088, 256, 256]
    - [0, 8.683]
  - - [1216, 3008, 1, 256, 1216, 1216, 256, 256]
    - [0, 8.718]
  - - [1344, 3008, 1, 256, 1344, 1344, 256, 256]
    - [0, 8.754]
  - - [1472, 3008, 1, 256, 1472, 1472, 256, 256]
    - [0, 8.743]
  - - [1600, 3008, 1, 256, 1600, 1600, 256, 256]
    - [0, 8.773]
  - - [1728, 3008, 1, 256, 1728, 1728, 256, 256]
    - [0, 8.838]
  - - [1856, 3008, 1, 256, 1856, 1856, 256, 256]
    - [0, 8.839]
  - - [1984, 3008, 1, 256, 1984, 1984, 256, 256]
    - [0, 8.639]
  - - [2112, 3008, 1, 256, 2112, 2112, 256, 256]
    - [0, 8.742]
  - - [2240, 3008, 1, 256, 2240, 2240, 256, 256]
    - [0, 8.754]
  - - [2368, 3008, 1, 256, 2368, 2368, 256, 256]
    - [0, 8.707]
  - - [2496, 3008, 1, 256, 2496, 2496, 256, 256]
    - [0, 8.693]
  - - [2624, 3008, 1, 256, 2624, 2624, 256, 256]
    - [0, 8.824]
  - - [2752, 3008, 1, 256, 2752, 2752, 256, 256]
    - [0, 8.717]
  - - [2880, 3008, 1, 256, 2880, 2880, 256, 256]
    - [0, 8.823]
  - - [3008, 3008, 1, 256, 3008, 3008, 256, 256]
    - [0, 8.751]
  - - [3136, 3008, 1, 256, 3136, 3136, 256, 256]
    - [0, 8.772]
  - - [3264, 3008, 1, 256, 3264, 3264, 256, 256]
    - [0, 8.83]
  - - [3392, 3008, 1, 256, 3392, 3392, 256, 256]
    - [0, 8.862]
  - - [3520, 3008, 1, 256, 3520, 3520, 256, 256]
    - [0, 8.847]
  - - [3648, 3008, 1, 256, 3648, 3648, 256, 256]
    - [0, 8.839]
  - - [3776, 3008, 1, 256, 3776, 3776, 256, 256]
    - [0, 8.832]
  - - [3904, 3008, 1, 256, 3904, 3904, 256, 256]
    - [0, 8.879]
  - - [4032, 3008, 1, 256, 4032, 4032, 256, 256]
    - [0, 8.788]
  - - [64, 3136, 1, 256, 64, 64, 256, 256]
    - [0, 6.516]
  - - [192, 3136, 1, 256, 192, 192, 256, 256]
    - [0, 7.986]
  - - [320, 3136, 1, 256, 320, 320, 256, 256]
    - [0, 7.94]
  - - [448, 3136, 1, 256, 448, 448, 256, 256]
    - [0, 8.312]
  - - [576, 3136, 1, 256, 576, 576, 256, 256]
    - [0, 8.412]
  - - [704, 3136, 1, 256, 704, 704, 256, 256]
    - [0, 8.573]
  - - [832, 3136, 1, 256, 832, 832, 256, 256]
    - [0, 8.591]
  - - [960, 3136, 1, 256, 960, 960, 256, 256]
    - [0, 8.641]
  - - [1088, 3136, 1, 256, 1088, 1088, 256, 256]
    - [0, 8.698]
  - - [1216, 3136, 1, 256, 1216, 1216, 256, 256]
    - [0, 8.657]
  - - [1344, 3136, 1, 256, 1344, 1344, 256, 256]
    - [0, 8.711]
  - - [1472, 3136, 1, 256, 1472, 1472, 256, 256]
    - [0, 8.715]
  - - [1600, 3136, 1, 256, 1600, 1600, 256, 256]
    - [0, 8.805]
  - - [1728, 3136, 1, 256, 1728, 1728, 256, 256]
    - [0, 8.829]
  - - [1856, 3136, 1, 256, 1856, 1856, 256, 256]
    - [0, 8.678]
  - - [1984, 3136, 1, 256, 1984, 1984, 256, 256]
    - [0, 8.673]
  - - [2112, 3136, 1, 256, 2112, 2112, 256, 256]
    - [0, 8.688]
  - - [2240, 3136, 1, 256, 2240, 2240, 256, 256]
    - [0, 8.735]
  - - [2368, 3136, 1, 256, 2368, 2368, 256, 256]
    - [0, 8.725]
  - - [2496, 3136, 1, 256, 2496, 2496, 256, 256]
    - [0, 8.768]
  - - [2624, 3136, 1, 256, 2624, 2624, 256, 256]
    - [0, 8.809]
  - - [2752, 3136, 1, 256, 2752, 2752, 256, 256]
    - [0, 8.84]
  - - [2880, 3136, 1, 256, 2880, 2880, 256, 256]
    - [0, 8.832]
  - - [3008, 3136, 1, 256, 3008, 3008, 256, 256]
    - [0, 8.804]
  - - [3136, 3136, 1, 256, 3136, 3136, 256, 256]
    - [0, 8.843]
  - - [3264, 3136, 1, 256, 3264, 3264, 256, 256]
    - [0, 8.803]
  - - [3392, 3136, 1, 256, 3392, 3392, 256, 256]
    - [0, 8.82]
  - - [3520, 3136, 1, 256, 3520, 3520, 256, 256]
    - [0, 8.8]
  - - [3648, 3136, 1, 256, 3648, 3648, 256, 256]
    - [0, 8.848]
  - - [3776, 3136, 1, 256, 3776, 3776, 256, 256]
    - [0, 8.792]
  - - [3904, 3136, 1, 256, 3904, 3904, 256, 256]
    - [0, 8.861]
  - - [4032, 3136, 1, 256, 4032, 4032, 256, 256]
    - [0, 8.842]
  - - [64, 3264, 1, 256, 64, 64, 256, 256]
    - [0, 6.769]
  - - [192, 3264, 1, 256, 192, 192, 256, 256]
    - [0, 8.017]
  - - [320, 3264, 1, 256, 320, 320, 256, 256]
    - [0, 8.018]
  - - [448, 3264, 1, 256, 448, 448, 256, 256]
    - [0, 8.332]
  - - [576, 3264, 1, 256, 576, 576, 256, 256]
    - [0, 8.489]
  - - [704, 3264, 1, 256, 704, 704, 256, 256]
    - [0, 8.584]
  - - [832, 3264, 1, 256, 832, 832, 256, 256]
    - [0, 8.639]
  - - [960, 3264, 1, 256, 960, 960, 256, 256]
    - [0, 8.684]
  - - [1088, 3264, 1, 256, 1088, 1088, 256, 256]
    - [0, 8.679]
  - - [1216, 3264, 1, 256, 1216, 1216, 256, 256]
    - [0, 8.743]
  - - [1344, 3264, 1, 256, 1344, 1344, 256, 256]
    - [0, 8.806]
  - - [1472, 3264, 1, 256, 1472, 1472, 256, 256]
    - [0, 8.771]
  - - [1600, 3264, 1, 256, 1600, 1600, 256, 256]
    - [0, 8.814]
  - - [1728, 3264, 1, 256, 1728, 1728, 256, 256]
    - [0, 8.818]
  - - [1856, 3264, 1, 256, 1856, 1856, 256, 256]
    - [0, 8.645]
  - - [1984, 3264, 1, 256, 1984, 1984, 256, 256]
    - [0, 8.704]
  - - [2112, 3264, 1, 256, 2112, 2112, 256, 256]
    - [0, 8.697]
  - - [2240, 3264, 1, 256, 2240, 2240, 256, 256]
    - [0, 8.756]
  - - [2368, 3264, 1, 256, 2368, 2368, 256, 256]
    - [0, 8.731]
  - - [2496, 3264, 1, 256, 2496, 2496, 256, 256]
    - [0, 8.822]
  - - [2624, 3264, 1, 256, 2624, 2624, 256, 256]
    - [0, 8.715]
  - - [2752, 3264, 1, 256, 2752, 2752, 256, 256]
    - [0, 8.79]
  - - [2880, 3264, 1, 256, 2880, 2880, 256, 256]
    - [0, 8.776]
  - - [3008, 3264, 1, 256, 3008, 3008, 256, 256]
    - [0, 8.836]
  - - [3136, 3264, 1, 256, 3136, 3136, 256, 256]
    - [0, 8.844]
  - - [3264, 3264, 1, 256, 3264, 3264, 256, 256]
    - [0, 8.828]
  - - [3392, 3264, 1, 256, 3392, 3392, 256, 256]
    - [0, 8.897]
  - - [3520, 3264, 1, 256, 3520, 3520, 256, 256]
    - [0, 8.829]
  - - [3648, 3264, 1, 256, 3648, 3648, 256, 256]
    - [0, 8.852]
  - - [3776, 3264, 1, 256, 3776, 3776, 256, 256]
    - [0, 8.861]
  - - [3904, 3264, 1, 256, 3904, 3904, 256, 256]
    - [0, 8.814]
  - - [4032, 3264, 1, 256, 4032, 4032, 256, 256]
    - [0, 8.795]
  - - [64, 3392, 1, 256, 64, 64, 256, 256]
    - [0, 6.374]
  - - [192, 3392, 1, 256, 192, 192, 256, 256]
    - [0, 7.999]
  - - [320, 3392, 1, 256, 320, 320, 256, 256]
    - [0, 8.082]
  - - [448, 3392, 1, 256, 448, 448, 256, 256]
    - [0, 8.327]
  - - [576, 3392, 1, 256, 576, 576, 256, 256]
    - [0, 8.504]
  - - [704, 3392, 1, 256, 704, 704, 256, 256]
    - [0, 8.56]
  - - [832, 3392, 1, 256, 832, 832, 256, 256]
    - [0, 8.674]
  - - [960, 3392, 1, 256, 960, 960, 256, 256]
    - [0, 8.661]
  - - [1088, 3392, 1, 256, 1088, 1088, 256, 256]
    - [0, 8.704]
  - - [1216, 3392, 1, 256, 1216, 1216, 256, 256]
    - [0, 8.639]
  - - [1344, 3392, 1, 256, 1344, 1344, 256, 256]
    - [0, 8.741]
  - - [1472, 3392, 1, 256, 1472, 1472, 256, 256]
    - [0, 8.792]
  - - [1600, 3392, 1, 256, 1600, 1600, 256, 256]
    - [0, 8.796]
  - - [1728, 3392, 1, 256, 1728, 1728, 256, 256]
    - [0, 8.703]
  - - [1856, 3392, 1, 256, 1856, 1856, 256, 256]
    - [0, 8.669]
  - - [1984, 3392, 1, 256, 1984, 1984, 256, 256]
    - [0, 8.667]
  - - [2112, 3392, 1, 256, 2112, 2112, 256, 256]
    - [0, 8.745]
  - - [2240, 3392, 1, 256, 2240, 2240, 256, 256]
    - [0, 8.717]
  - - [2368, 3392, 1, 256, 2368, 2368, 256, 256]
    - [0, 8.744]
  - - [2496, 3392, 1, 256, 2496, 2496, 256, 256]
    - [0, 8.747]
  - - [2624, 3392, 1, 256, 2624, 2624, 256, 256]
    - [0, 8.791]
  - - [2752, 3392, 1, 256, 2752, 2752, 256, 256]
    - [0, 8.829]
  - - [2880, 3392, 1, 256, 2880, 2880, 256, 256]
    - [0, 8.8]
  - - [3008, 3392, 1, 256, 3008, 3008, 256, 256]
    - [0, 8.832]
  - - [3136, 3392, 1, 256, 3136, 3136, 256, 256]
    - [0, 8.765]
  - - [3264, 3392, 1, 256, 3264, 3264, 256, 256]
    - [0, 8.838]
  - - [3392, 3392, 1, 256, 3392, 3392, 256, 256]
    - [0, 8.845]
  - - [3520, 3392, 1, 256, 3520, 3520, 256, 256]
    - [0, 8.965]
  - - [3648, 3392, 1, 256, 3648, 3648, 256, 256]
    - [0, 8.869]
  - - [3776, 3392, 1, 256, 3776, 3776, 256, 256]
    - [0, 8.895]
  - - [3904, 3392, 1, 256, 3904, 3904, 256, 256]
    - [0, 8.887]
  - - [4032, 3392, 1, 256, 4032, 4032, 256, 256]
    - [0, 8.86]
  - - [64, 3520, 1, 256, 64, 64, 256, 256]
    - [0, 6.553]
  - - [192, 3520, 1, 256, 192, 192, 256, 256]
    - [0, 8.01]
  - - [320, 3520, 1, 256, 320, 320, 256, 256]
    - [0, 8.154]
  - - [448, 3520, 1, 256, 448, 448, 256, 256]
    - [0, 8.337]
  - - [576, 3520, 1, 256, 576, 576, 256, 256]
    - [0, 8.489]
  - - [704, 3520, 1, 256, 704, 704, 256, 256]
    - [0, 8.617]
  - - [832, 3520, 1, 256, 832, 832, 256, 256]
    - [0, 8.627]
  - - [960, 3520, 1, 256, 960, 960, 256, 256]
    - [0, 8.644]
  - - [1088, 3520, 1, 256, 1088, 1088, 256, 256]
    - [0, 8.684]
  - - [1216, 3520, 1, 256, 1216, 1216, 256, 256]
    - [0, 8.732]
  - - [1344, 3520, 1, 256, 1344, 1344, 256, 256]
    - [0, 8.756]
  - - [1472, 3520, 1, 256, 1472, 1472, 256, 256]
    - [0, 8.832]
  - - [1600, 3520, 1, 256, 1600, 1600, 256, 256]
    - [0, 8.781]
  - - [1728, 3520, 1, 256, 1728, 1728, 256, 256]
    - [0, 8.671]
  - - [1856, 3520, 1, 256, 1856, 1856, 256, 256]
    - [0, 8.701]
  - - [1984, 3520, 1, 256, 1984, 1984, 256, 256]
    - [0, 8.734]
  - - [2112, 3520, 1, 256, 2112, 2112, 256, 256]
    - [0, 8.728]
  - - [2240, 3520, 1, 256, 2240, 2240, 256, 256]
    - [0, 8.748]
  - - [2368, 3520, 1, 256, 2368, 2368, 256, 256]
    - [0, 8.698]
  - - [2496, 3520, 1, 256, 2496, 2496, 256, 256]
    - [0, 8.803]
  - - [2624, 3520, 1, 256, 2624, 2624, 256, 256]
    - [0, 8.873]
  - - [2752, 3520, 1, 256, 2752, 2752, 256, 256]
    - [0, 8.772]
  - - [2880, 3520, 1, 256, 2880, 2880, 256, 256]
    - [0, 8.778]
  - - [3008, 3520, 1, 256, 3008, 3008, 256, 256]
    - [0, 8.853]
  - - [3136, 3520, 1, 256, 3136, 3136, 256, 256]
    - [0, 8.81]
  - - [3264, 3520, 1, 256, 3264, 3264, 256, 256]
    - [0, 8.885]
  - - [3392, 3520, 1, 256, 3392, 3392, 256, 256]
    - [0, 8.858]
  - - [3520, 3520, 1, 256, 3520, 3520, 256, 256]
    - [0, 8.852]
  - - [3648, 3520, 1, 256, 3648, 3648, 256, 256]
    - [0, 8.86]
  - - [3776, 3520, 1, 256, 3776, 3776, 256, 256]
    - [0, 8.945]
  - - [3904, 3520, 1, 256, 3904, 3904, 256, 256]
    - [0, 8.801]
  - - [4032, 3520, 1, 256, 4032, 4032, 256, 256]
    - [0, 8.922]
  - - [64, 3648, 1, 256, 64, 64, 256, 256]
    - [0, 6.793]
  - - [192, 3648, 1, 256, 192, 192, 256, 256]
    - [0, 8.08]
  - - [320, 3648, 1, 256, 320, 320, 256, 256]
    - [0, 8.245]
  - - [448, 3648, 1, 256, 448, 448, 256, 256]
    - [0, 8.367]
  - - [576, 3648, 1, 256, 576, 576, 256, 256]
    - [0, 8.512]
  - - [704, 3648, 1, 256, 704, 704, 256, 256]
    - [0, 8.533]
  - - [832, 3648, 1, 256, 832, 832, 256, 256]
    - [0, 8.633]
  - - [960, 3648, 1, 256, 960, 960, 256, 256]
    - [0, 8.695]
  - - [1088, 3648, 1, 256, 1088, 1088, 256, 256]
    - [0, 8.738]
  - - [1216, 3648, 1, 256, 1216, 1216, 256, 256]
    - [0, 8.78]
  - - [1344, 3648, 1, 256, 1344, 1344, 256, 256]
    - [0, 8.713]
  - - [1472, 3648, 1, 256, 1472, 1472, 256, 256]
    - [0, 8.771]
  - - [1600, 3648, 1, 256, 1600, 1600, 256, 256]
    - [0, 8.7]
  - - [1728, 3648, 1, 256, 1728, 1728, 256, 256]
    - [0, 8.744]
  - - [1856, 3648, 1, 256, 1856, 1856, 256, 256]
    - [0, 8.761]
  - - [1984, 3648, 1, 256, 1984, 1984, 256, 256]
    - [0, 8.718]
  - - [2112, 3648, 1, 256, 2112, 2112, 256, 256]
    - [0, 8.676]
  - - [2240, 3648, 1, 256, 2240, 2240, 256, 256]
    - [0, 8.761]
  - - [2368, 3648, 1, 256, 2368, 2368, 256, 256]
    - [0, 8.843]
  - - [2496, 3648, 1, 256, 2496, 2496, 256, 256]
    - [0, 8.754]
  - - [2624, 3648, 1, 256, 2624, 2624, 256, 256]
    - [0, 8.834]
  - - [2752, 3648, 1, 256, 2752, 2752, 256, 256]
    - [0, 8.822]
  - - [2880, 3648, 1, 256, 2880, 2880, 256, 256]
    - [0, 8.837]
  - - [3008, 3648, 1, 256, 3008, 3008, 256, 256]
    - [0, 8.814]
  - - [3136, 3648, 1, 256, 3136, 3136, 256, 256]
    - [0, 8.836]
  - - [3264, 3648, 1, 256, 3264, 3264, 256, 256]
    - [0, 8.85]
  - - [3392, 3648, 1, 256, 3392, 3392, 256, 256]
    - [0, 8.89]
  - - [3520, 3648, 1, 256, 3520, 3520, 256, 256]
    - [0, 8.85]
  - - [3648, 3648, 1, 256, 3648, 3648, 256, 256]
    - [0, 8.813]
  - - [3776, 3648, 1, 256, 3776, 3776, 256, 256]
    - [0, 8.873]
  - - [3904, 3648, 1, 256, 3904, 3904, 256, 256]
    - [0, 8.851]
  - - [4032, 3648, 1, 256, 4032, 4032, 256, 256]
    - [0, 8.833]
  - - [64, 3776, 1, 256, 64, 64, 256, 256]
    - [0, 7.046]
  - - [192, 3776, 1, 256, 192, 192, 256, 256]
    - [0, 7.763]
  - - [320, 3776, 1, 256, 320, 320, 256, 256]
    - [0, 8.164]
  - - [448, 3776, 1, 256, 448, 448, 256, 256]
    - [0, 8.375]
  - - [576, 3776, 1, 256, 576, 576, 256, 256]
    - [0, 8.466]
  - - [704, 3776, 1, 256, 704, 704, 256, 256]
    - [0, 8.66]
  - - [832, 3776, 1, 256, 832, 832, 256, 256]
    - [0, 8.691]
  - - [960, 3776, 1, 256, 960, 960, 256, 256]
    - [0, 8.716]
  - - [1088, 3776, 1, 256, 1088, 1088, 256, 256]
    - [0, 8.684]
  - - [1216, 3776, 1, 256, 1216, 1216, 256, 256]
    - [0, 8.776]
  - - [1344, 3776, 1, 256, 1344, 1344, 256, 256]
    - [0, 8.791]
  - - [1472, 3776, 1, 256, 1472, 1472, 256, 256]
    - [0, 8.77]
  - - [1600, 3776, 1, 256, 1600, 1600, 256, 256]
    - [0, 8.696]
  - - [1728, 3776, 1, 256, 1728, 1728, 256, 256]
    - [0, 8.771]
  - - [1856, 3776, 1, 256, 1856, 1856, 256, 256]
    - [0, 8.689]
  - - [1984, 3776, 1, 256, 1984, 1984, 256, 256]
    - [0, 8.762]
  - - [2112, 3776, 1, 256, 2112, 2112, 256, 256]
    - [0, 8.804]
  - - [2240, 3776, 1, 256, 2240, 2240, 256, 256]
    - [0, 8.785]
  - - [2368, 3776, 1, 256, 2368, 2368, 256, 256]
    - [0, 8.836]
  - - [2496, 3776, 1, 256, 2496, 2496, 256, 256]
    - [0, 8.839]
  - - [2624, 3776, 1, 256, 2624, 2624, 256, 256]
    - [0, 8.844]
  - - [2752, 3776, 1, 256, 2752, 2752, 256, 256]
    - [0, 8.86]
  - - [2880, 3776, 1, 256, 2880, 2880, 256, 256]
    - [0, 8.809]
  - - [3008, 3776, 1, 256, 3008, 3008, 256, 256]
    - [0, 8.851]
  - - [3136, 3776, 1, 256, 3136, 3136, 256, 256]
    - [0, 8.838]
  - - [3264, 3776, 1, 256, 3264, 3264, 256, 256]
    - [0, 8.819]
  - - [3392, 3776, 1, 256, 3392, 3392, 256, 256]
    - [0, 8.876]
  - - [3520, 3776, 1, 256, 3520, 3520, 256, 256]
    - [0, 8.827]
  - - [3648, 3776, 1, 256, 3648, 3648, 256, 256]
    - [0, 9.031]
  - - [3776, 3776, 1, 256, 3776, 3776, 256, 256]
    - [0, 8.835]
  - - [3904, 3776, 1, 256, 3904, 3904, 256, 256]
    - [0, 8.85]
  - - [4032, 3776, 1, 256, 4032, 4032, 256, 256]
    - [0, 8.892]
  - - [64, 3904, 1, 256, 64, 64, 256, 256]
    - [0, 6.713]
  - - [192, 3904, 1, 256, 192, 192, 256, 256]
    - [0, 7.537]
  - - [320, 3904, 1, 256, 320, 320, 256, 256]
    - [0, 8.113]
  - - [448, 3904, 1, 256, 448, 448, 256, 256]
    - [0, 8.373]
  - - [576, 3904, 1, 256, 576, 576, 256, 256]
    - [0, 8.506]
  - - [704, 3904, 1, 256, 704, 704, 256, 256]
    - [0, 8.587]
  - - [832, 3904, 1, 256, 832, 832, 256, 256]
    - [0, 8.677]
  - - [960, 3904, 1, 256, 960, 960, 256, 256]
    - [0, 8.678]
  - - [1088, 3904, 1, 256, 1088, 1088, 256, 256]
    - [0, 8.747]
  - - [1216, 3904, 1, 256, 1216, 1216, 256, 256]
    - [0, 8.766]
  - - [1344, 3904, 1, 256, 1344, 1344, 256, 256]
    - [0, 8.836]
  - - [1472, 3904, 1, 256, 1472, 1472, 256, 256]
    - [0, 8.617]
  - - [1600, 3904, 1, 256, 1600, 1600, 256, 256]
    - [0, 8.604]
  - - [1728, 3904, 1, 256, 1728, 1728, 256, 256]
    - [0, 8.747]
  - - [1856, 3904, 1, 256, 1856, 1856, 256, 256]
    - [0, 8.744]
  - - [1984, 3904, 1, 256, 1984, 1984, 256, 256]
    - [0, 8.74]
  - - [2112, 3904, 1, 256, 2112, 2112, 256, 256]
    - [0, 8.736]
  - - [2240, 3904, 1, 256, 2240, 2240, 256, 256]
    - [0, 8.773]
  - - [2368, 3904, 1, 256, 2368, 2368, 256, 256]
    - [0, 8.804]
  - - [2496, 3904, 1, 256, 2496, 2496, 256, 256]
    - [0, 8.79]
  - - [2624, 3904, 1, 256, 2624, 2624, 256, 256]
    - [0, 8.845]
  - - [2752, 3904, 1, 256, 2752, 2752, 256, 256]
    - [0, 8.817]
  - - [2880, 3904, 1, 256, 2880, 2880, 256, 256]
    - [0, 8.834]
  - - [3008, 3904, 1, 256, 3008, 3008, 256, 256]
    - [0, 8.896]
  - - [3136, 3904, 1, 256, 3136, 3136, 256, 256]
    - [0, 8.835]
  - - [3264, 3904, 1, 256, 3264, 3264, 256, 256]
    - [0, 8.868]
  - - [3392, 3904, 1, 256, 3392, 3392, 256, 256]
    - [0, 8.842]
  - - [3520, 3904, 1, 256, 3520, 3520, 256, 256]
    - [0, 8.898]
  - - [3648, 3904, 1, 256, 3648, 3648, 256, 256]
    - [0, 8.852]
  - - [3776, 3904, 1, 256, 3776, 3776, 256, 256]
    - [0, 8.844]
  - - [3904, 3904, 1, 256, 3904, 3904, 256, 256]
    - [0, 8.831]
  - - [4032, 3904, 1, 256, 4032, 4032, 256, 256]
    - [0, 8.889]
  - - [64, 4032, 1, 256, 64, 64, 256, 256]
    - [0, 6.913]
  - - [192, 4032, 1, 256, 192, 192, 256, 256]
    - [0, 7.756]
  - - [320, 4032, 1, 256, 320, 320, 256, 256]
    - [0, 8.233]
  - - [448, 4032, 1, 256, 448, 448, 256, 256]
    - [0, 8.423]
  - - [576, 4032, 1, 256, 576, 576, 256, 256]
    - [0, 8.559]
  - - [704, 4032, 1, 256, 704, 704, 256, 256]
    - [0, 8.595]
  - - [832, 4032, 1, 256, 832, 832, 256, 256]
    - [0, 8.683]
  - - [960, 4032, 1, 256, 960, 960, 256, 256]
    - [0, 8.726]
  - - [1088, 4032, 1, 256, 1088, 1088, 256, 256]
    - [0, 8.785]
  - - [1216, 4032, 1, 256, 1216, 1216, 256, 256]
    - [0, 8.732]
  - - [1344, 4032, 1, 256, 1344, 1344, 256, 256]
    - [0, 8.763]
  - - [1472, 4032, 1, 256, 1472, 1472, 256, 256]
    - [0, 8.639]
  - - [1600, 4032, 1, 256, 1600, 1600, 256, 256]
    - [0, 8.699]
  - - [1728, 4032, 1, 256, 1728, 1728, 256, 256]
    - [0, 8.749]
  - - [1856, 4032, 1, 256, 1856, 1856, 256, 256]
    - [0, 8.771]
  - - [1984, 4032, 1, 256, 1984, 1984, 256, 256]
    - [0, 8.71]
  - - [2112, 4032, 1, 256, 2112, 2112, 256, 256]
    - [0, 8.814]
  - - [2240, 4032, 1, 256, 2240, 2240, 256, 256]
    - [0, 8.784]
  - - [2368, 4032, 1, 256, 2368, 2368, 256, 256]
    - [0, 8.799]
  - - [2496, 4032, 1, 256, 2496, 2496, 256, 256]
    - [0, 8.855]
  - - [2624, 4032, 1, 256, 2624, 2624, 256, 256]
    - [0, 8.782]
  - - [2752, 4032, 1, 256, 2752, 2752, 256, 256]
    - [0, 8.809]
  - - [2880, 4032, 1, 256, 2880, 2880, 256, 256]
    - [0, 8.81]
  - - [3008, 4032, 1, 256, 3008, 3008, 256, 256]
    - [0, 8.912]
  - - [3136, 4032, 1, 256, 3136, 3136, 256, 256]
    - [0, 8.822]
  - - [3264, 4032, 1, 256, 3264, 3264, 256, 256]
    - [0, 8.819]
  - - [3392, 4032, 1, 256, 3392, 3392, 256, 256]
    - [0, 8.883]
  - - [3520, 4032, 1, 256, 3520, 3520, 256, 256]
    - [0, 8.868]
  - - [3648, 4032, 1, 256, 3648, 3648, 256, 256]
    - [0, 8.908]
  - - [3776, 4032, 1, 256, 3776, 3776, 256, 256]
    - [0, 8.845]
  - - [3904, 4032, 1, 256, 3904, 3904, 256, 256]
    - [0, 8.915]
  - - [4032, 4032, 1, 256, 4032, 4032, 256, 256]
    - [0, 8.936]
  - - [64, 64, 1, 512, 64, 64, 512, 512]
    - [1, 0.789]
  - - [192, 64, 1, 512, 192, 192, 512, 512]
    - [2, 2.084]
  - - [320, 64, 1, 512, 320, 320, 512, 512]
    - [0, 2.973]
  - - [448, 64, 1, 512, 448, 448, 512, 512]
    - [0, 4.149]
  - - [576, 64, 1, 512, 576, 576, 512, 512]
    - [0, 3.623]
  - - [704, 64, 1, 512, 704, 704, 512, 512]
    - [0, 4.413]
  - - [832, 64, 1, 512, 832, 832, 512, 512]
    - [0, 5.204]
  - - [960, 64, 1, 512, 960, 960, 512, 512]
    - [0, 5.984]
  - - [1088, 64, 1, 512, 1088, 1088, 512, 512]
    - [0, 5.087]
  - - [1216, 64, 1, 512, 1216, 1216, 512, 512]
    - [0, 5.671]
  - - [1344, 64, 1, 512, 1344, 1344, 512, 512]
    - [0, 6.257]
  - - [1472, 64, 1, 512, 1472, 1472, 512, 512]
    - [0, 5.528]
  - - [1600, 64, 1, 512, 1600, 1600, 512, 512]
    - [0, 5.969]
  - - [1728, 64, 1, 512, 1728, 1728, 512, 512]
    - [0, 6.435]
  - - [1856, 64, 1, 512, 1856, 1856, 512, 512]
    - [0, 6.91]
  - - [1984, 64, 1, 512, 1984, 1984, 512, 512]
    - [0, 6.196]
  - - [2112, 64, 1, 512, 2112, 2112, 512, 512]
    - [0, 6.543]
  - - [2240, 64, 1, 512, 2240, 2240, 512, 512]
    - [0, 6.928]
  - - [2368, 64, 1, 512, 2368, 2368, 512, 512]
    - [0, 7.318]
  - - [2496, 64, 1, 512, 2496, 2496, 512, 512]
    - [0, 6.639]
  - - [2624, 64, 1, 512, 2624, 2624, 512, 512]
    - [0, 6.966]
  - - [2752, 64, 1, 512, 2752, 2752, 512, 512]
    - [0, 7.294]
  - - [2880, 64, 1, 512, 2880, 2880, 512, 512]
    - [0, 7.624]
  - - [3008, 64, 1, 512, 3008, 3008, 512, 512]
    - [0, 7.003]
  - - [3136, 64, 1, 512, 3136, 3136, 512, 512]
    - [0, 7.275]
  - - [3264, 64, 1, 512, 3264, 3264, 512, 512]
    - [0, 7.561]
  - - [3392, 64, 1, 512, 3392, 3392, 512, 512]
    - [0, 7.052]
  - - [3520, 64, 1, 512, 3520, 3520, 512, 512]
    - [0, 7.297]
  - - [3648, 64, 1, 512, 3648, 3648, 512, 512]
    - [0, 7.524]
  - - [3776, 64, 1, 512, 3776, 3776, 512, 512]
    - [0, 7.792]
  - - [3904, 64, 1, 512, 3904, 3904, 512, 512]
    - [0, 7.327]
  - - [4032, 64, 1, 512, 4032, 4032, 512, 512]
    - [0, 7.516]
  - - [64, 192, 1, 512, 64, 64, 512, 512]
    - [2, 2.087]
  - - [192, 192, 1, 512, 192, 192, 512, 512]
    - [0, 3.626]
  - - [320, 192, 1, 512, 320, 320, 512, 512]
    - [0, 5.993]
  - - [448, 192, 1, 512, 448, 448, 512, 512]
    - [0, 6.278]
  - - [576, 192, 1, 512, 576, 576, 512, 512]
    - [0, 6.435]
  - - [704, 192, 1, 512, 704, 704, 512, 512]
    - [0, 6.572]
  - - [832, 192, 1, 512, 832, 832, 512, 512]
    - [0, 6.679]
  - - [960, 192, 1, 512, 960, 960, 512, 512]
    - [0, 7.666]
  - - [1088, 192, 1, 512, 1088, 1088, 512, 512]
    - [0, 7.592]
  - - [1216, 192, 1, 512, 1216, 1216, 512, 512]
    - [0, 7.539]
  - - [1344, 192, 1, 512, 1344, 1344, 512, 512]
    - [0, 7.533]
  - - [1472, 192, 1, 512, 1472, 1472, 512, 512]
    - [0, 7.533]
  - - [1600, 192, 1, 512, 1600, 1600, 512, 512]
    - [0, 8.125]
  - - [1728, 192, 1, 512, 1728, 1728, 512, 512]
    - [0, 8.043]
  - - [1856, 192, 1, 512, 1856, 1856, 512, 512]
    - [0, 8.001]
  - - [1984, 192, 1, 512, 1984, 1984, 512, 512]
    - [0, 7.59]
  - - [2112, 192, 1, 512, 2112, 2112, 512, 512]
    - [0, 7.572]
  - - [2240, 192, 1, 512, 2240, 2240, 512, 512]
    - [0, 7.959]
  - - [2368, 192, 1, 512, 2368, 2368, 512, 512]
    - [0, 7.937]
  - - [2496, 192, 1, 512, 2496, 2496, 512, 512]
    - [0, 7.9]
  - - [2624, 192, 1, 512, 2624, 2624, 512, 512]
    - [0, 7.873]
  - - [2752, 192, 1, 512, 2752, 2752, 512, 512]
    - [0, 7.878]
  - - [2880, 192, 1, 512, 2880, 2880, 512, 512]
    - [0, 8.163]
  - - [3008, 192, 1, 512, 3008, 3008, 512, 512]
    - [0, 8.148]
  - - [3136, 192, 1, 512, 3136, 3136, 512, 512]
    - [0, 8.118]
  - - [3264, 192, 1, 512, 3264, 3264, 512, 512]
    - [0, 8.082]
  - - [3392, 192, 1, 512, 3392, 3392, 512, 512]
    - [0, 8.079]
  - - [3520, 192, 1, 512, 3520, 3520, 512, 512]
    - [0, 8.319]
  - - [3648, 192, 1, 512, 3648, 3648, 512, 512]
    - [0, 8.298]
  - - [3776, 192, 1, 512, 3776, 3776, 512, 512]
    - [0, 8.258]
  - - [3904, 192, 1, 512, 3904, 3904, 512, 512]
    - [0, 8.236]
  - - [4032, 192, 1, 512, 4032, 4032, 512, 512]
    - [0, 8.284]
  - - [64, 320, 1, 512, 64, 64, 512, 512]
    - [0, 2.975]
  - - [192, 320, 1, 512, 192, 192, 512, 512]
    - [0, 5.996]
  - - [320, 320, 1, 512, 320, 320, 512, 512]
    - [0, 5.969]
  - - [448, 320, 1, 512, 448, 448, 512, 512]
    - [0, 6.952]
  - - [576, 320, 1, 512, 576, 576, 512, 512]
    - [0, 7.655]
  - - [704, 320, 1, 512, 704, 704, 512, 512]
    - [0, 7.32]
  - - [832, 320, 1, 512, 832, 832, 512, 512]
    - [0, 7.781]
  - - [960, 320, 1, 512, 960, 960, 512, 512]
    - [0, 8.121]
  - - [1088, 320, 1, 512, 1088, 1088, 512, 512]
    - [0, 7.789]
  - - [1216, 320, 1, 512, 1216, 1216, 512, 512]
    - [0, 7.726]
  - - [1344, 320, 1, 512, 1344, 1344, 512, 512]
    - [0, 7.953]
  - - [1472, 320, 1, 512, 1472, 1472, 512, 512]
    - [0, 7.795]
  - - [1600, 320, 1, 512, 1600, 1600, 512, 512]
    - [0, 7.996]
  - - [1728, 320, 1, 512, 1728, 1728, 512, 512]
    - [0, 8.182]
  - - [1856, 320, 1, 512, 1856, 1856, 512, 512]
    - [0, 8.018]
  - - [1984, 320, 1, 512, 1984, 1984, 512, 512]
    - [0, 8.167]
  - - [2112, 320, 1, 512, 2112, 2112, 512, 512]
    - [0, 8.319]
  - - [2240, 320, 1, 512, 2240, 2240, 512, 512]
    - [0, 8.185]
  - - [2368, 320, 1, 512, 2368, 2368, 512, 512]
    - [0, 8.303]
  - - [2496, 320, 1, 512, 2496, 2496, 512, 512]
    - [0, 8.42]
  - - [2624, 320, 1, 512, 2624, 2624, 512, 512]
    - [0, 8.303]
  - - [2752, 320, 1, 512, 2752, 2752, 512, 512]
    - [0, 8.399]
  - - [2880, 320, 1, 512, 2880, 2880, 512, 512]
    - [0, 8.503]
  - - [3008, 320, 1, 512, 3008, 3008, 512, 512]
    - [0, 8.413]
  - - [3136, 320, 1, 512, 3136, 3136, 512, 512]
    - [0, 8.484]
  - - [3264, 320, 1, 512, 3264, 3264, 512, 512]
    - [0, 8.559]
  - - [3392, 320, 1, 512, 3392, 3392, 512, 512]
    - [0, 8.465]
  - - [3520, 320, 1, 512, 3520, 3520, 512, 512]
    - [0, 8.53]
  - - [3648, 320, 1, 512, 3648, 3648, 512, 512]
    - [0, 8.592]
  - - [3776, 320, 1, 512, 3776, 3776, 512, 512]
    - [0, 8.529]
  - - [3904, 320, 1, 512, 3904, 3904, 512, 512]
    - [0, 8.586]
  - - [4032, 320, 1, 512, 4032, 4032, 512, 512]
    - [0, 8.638]
  - - [64, 448, 1, 512, 64, 64, 512, 512]
    - [0, 4.151]
  - - [192, 448, 1, 512, 192, 192, 512, 512]
    - [0, 6.265]
  - - [320, 448, 1, 512, 320, 320, 512, 512]
    - [0, 6.956]
  - - [448, 448, 1, 512, 448, 448, 512, 512]
    - [0, 7.316]
  - - [576, 448, 1, 512, 576, 576, 512, 512]
    - [0, 7.559]
  - - [704, 448, 1, 512, 704, 704, 512, 512]
    - [0, 7.7]
  - - [832, 448, 1, 512, 832, 832, 512, 512]
    - [0, 7.471]
  - - [960, 448, 1, 512, 960, 960, 512, 512]
    - [0, 7.952]
  - - [1088, 448, 1, 512, 1088, 1088, 512, 512]
    - [0, 8.009]
  - - [1216, 448, 1, 512, 1216, 1216, 512, 512]
    - [0, 8.073]
  - - [1344, 448, 1, 512, 1344, 1344, 512, 512]
    - [0, 8.125]
  - - [1472, 448, 1, 512, 1472, 1472, 512, 512]
    - [0, 8.145]
  - - [1600, 448, 1, 512, 1600, 1600, 512, 512]
    - [0, 8.183]
  - - [1728, 448, 1, 512, 1728, 1728, 512, 512]
    - [0, 8.224]
  - - [1856, 448, 1, 512, 1856, 1856, 512, 512]
    - [0, 8.264]
  - - [1984, 448, 1, 512, 1984, 1984, 512, 512]
    - [0, 8.459]
  - - [2112, 448, 1, 512, 2112, 2112, 512, 512]
    - [0, 8.489]
  - - [2240, 448, 1, 512, 2240, 2240, 512, 512]
    - [0, 8.483]
  - - [2368, 448, 1, 512, 2368, 2368, 512, 512]
    - [0, 8.484]
  - - [2496, 448, 1, 512, 2496, 2496, 512, 512]
    - [0, 8.495]
  - - [2624, 448, 1, 512, 2624, 2624, 512, 512]
    - [0, 8.643]
  - - [2752, 448, 1, 512, 2752, 2752, 512, 512]
    - [0, 8.64]
  - - [2880, 448, 1, 512, 2880, 2880, 512, 512]
    - [0, 8.627]
  - - [3008, 448, 1, 512, 3008, 3008, 512, 512]
    - [0, 8.645]
  - - [3136, 448, 1, 512, 3136, 3136, 512, 512]
    - [0, 8.643]
  - - [3264, 448, 1, 512, 3264, 3264, 512, 512]
    - [0, 8.63]
  - - [3392, 448, 1, 512, 3392, 3392, 512, 512]
    - [0, 8.661]
  - - [3520, 448, 1, 512, 3520, 3520, 512, 512]
    - [0, 8.634]
  - - [3648, 448, 1, 512, 3648, 3648, 512, 512]
    - [0, 8.642]
  - - [3776, 448, 1, 512, 3776, 3776, 512, 512]
    - [0, 8.691]
  - - [3904, 448, 1, 512, 3904, 3904, 512, 512]
    - [0, 8.735]
  - - [4032, 448, 1, 512, 4032, 4032, 512, 512]
    - [0, 8.739]
  - - [64, 576, 1, 512, 64, 64, 512, 512]
    - [0, 3.621]
  - - [192, 576, 1, 512, 192, 192, 512, 512]
    - [0, 6.44]
  - - [320, 576, 1, 512, 320, 320, 512, 512]
    - [0, 7.659]
  - - [448, 576, 1, 512, 448, 448, 512, 512]
    - [0, 7.554]
  - - [576, 576, 1, 512, 576, 576, 512, 512]
    - [0, 8.057]
  - - [704, 576, 1, 512, 704, 704, 512, 512]
    - [0, 7.561]
  - - [832, 576, 1, 512, 832, 832, 512, 512]
    - [0, 7.897]
  - - [960, 576, 1, 512, 960, 960, 512, 512]
    - [0, 8.164]
  - - [1088, 576, 1, 512, 1088, 1088, 512, 512]
    - [0, 8.097]
  - - [1216, 576, 1, 512, 1216, 1216, 512, 512]
    - [0, 8.275]
  - - [1344, 576, 1, 512, 1344, 1344, 512, 512]
    - [0, 8.219]
  - - [1472, 576, 1, 512, 1472, 1472, 512, 512]
    - [0, 8.362]
  - - [1600, 576, 1, 512, 1600, 1600, 512, 512]
    - [0, 8.481]
  - - [1728, 576, 1, 512, 1728, 1728, 512, 512]
    - [0, 8.425]
  - - [1856, 576, 1, 512, 1856, 1856, 512, 512]
    - [0, 8.518]
  - - [1984, 576, 1, 512, 1984, 1984, 512, 512]
    - [0, 8.492]
  - - [2112, 576, 1, 512, 2112, 2112, 512, 512]
    - [0, 8.552]
  - - [2240, 576, 1, 512, 2240, 2240, 512, 512]
    - [0, 8.627]
  - - [2368, 576, 1, 512, 2368, 2368, 512, 512]
    - [0, 8.572]
  - - [2496, 576, 1, 512, 2496, 2496, 512, 512]
    - [0, 8.656]
  - - [2624, 576, 1, 512, 2624, 2624, 512, 512]
    - [0, 8.71]
  - - [2752, 576, 1, 512, 2752, 2752, 512, 512]
    - [0, 8.669]
  - - [2880, 576, 1, 512, 2880, 2880, 512, 512]
    - [0, 8.724]
  - - [3008, 576, 1, 512, 3008, 3008, 512, 512]
    - [0, 8.699]
  - - [3136, 576, 1, 512, 3136, 3136, 512, 512]
    - [0, 8.768]
  - - [3264, 576, 1, 512, 3264, 3264, 512, 512]
    - [0, 8.7]
  - - [3392, 576, 1, 512, 3392, 3392, 512, 512]
    - [0, 8.765]
  - - [3520, 576, 1, 512, 3520, 3520, 512, 512]
    - [0, 8.758]
  - - [3648, 576, 1, 512, 3648, 3648, 512, 512]
    - [0, 8.767]
  - - [3776, 576, 1, 512, 3776, 3776, 512, 512]
    - [0, 8.797]
  - - [3904, 576, 1, 512, 3904, 3904, 512, 512]
    - [0, 8.743]
  - - [4032, 576, 1, 512, 4032, 4032, 512, 512]
    - [0, 8.894]
  - - [64, 704, 1, 512, 64, 64, 512, 512]
    - [0, 4.415]
  - - [192, 704, 1, 512, 192, 192, 512, 512]
    - [0, 6.569]
  - - [320, 704, 1, 512, 320, 320, 512, 512]
    - [0, 7.294]
  - - [448, 704, 1, 512, 448, 448, 512, 512]
    - [0, 7.695]
  - - [576, 704, 1, 512, 576, 576, 512, 512]
    - [0, 7.558]
  - - [704, 704, 1, 512, 704, 704, 512, 512]
    - [0, 7.78]
  - - [832, 704, 1, 512, 832, 832, 512, 512]
    - [0, 7.947]
  - - [960, 704, 1, 512, 960, 960, 512, 512]
    - [0, 8.305]
  - - [1088, 704, 1, 512, 1088, 1088, 512, 512]
    - [0, 8.37]
  - - [1216, 704, 1, 512, 1216, 1216, 512, 512]
    - [0, 8.426]
  - - [1344, 704, 1, 512, 1344, 1344, 512, 512]
    - [0, 8.471]
  - - [1472, 704, 1, 512, 1472, 1472, 512, 512]
    - [0, 8.509]
  - - [1600, 704, 1, 512, 1600, 1600, 512, 512]
    - [0, 8.548]
  - - [1728, 704, 1, 512, 1728, 1728, 512, 512]
    - [0, 8.557]
  - - [1856, 704, 1, 512, 1856, 1856, 512, 512]
    - [0, 8.594]
  - - [1984, 704, 1, 512, 1984, 1984, 512, 512]
    - [0, 8.606]
  - - [2112, 704, 1, 512, 2112, 2112, 512, 512]
    - [0, 8.623]
  - - [2240, 704, 1, 512, 2240, 2240, 512, 512]
    - [0, 8.647]
  - - [2368, 704, 1, 512, 2368, 2368, 512, 512]
    - [0, 8.669]
  - - [2496, 704, 1, 512, 2496, 2496, 512, 512]
    - [0, 8.771]
  - - [2624, 704, 1, 512, 2624, 2624, 512, 512]
    - [0, 8.696]
  - - [2752, 704, 1, 512, 2752, 2752, 512, 512]
    - [0, 8.736]
  - - [2880, 704, 1, 512, 2880, 2880, 512, 512]
    - [0, 8.806]
  - - [3008, 704, 1, 512, 3008, 3008, 512, 512]
    - [0, 8.797]
  - - [3136, 704, 1, 512, 3136, 3136, 512, 512]
    - [0, 8.807]
  - - [3264, 704, 1, 512, 3264, 3264, 512, 512]
    - [0, 8.791]
  - - [3392, 704, 1, 512, 3392, 3392, 512, 512]
    - [0, 8.828]
  - - [3520, 704, 1, 512, 3520, 3520, 512, 512]
    - [0, 8.795]
  - - [3648, 704, 1, 512, 3648, 3648, 512, 512]
    - [0, 8.819]
  - - [3776, 704, 1, 512, 3776, 3776, 512, 512]
    - [0, 8.84]
  - - [3904, 704, 1, 512, 3904, 3904, 512, 512]
    - [0, 8.866]
  - - [4032, 704, 1, 512, 4032, 4032, 512, 512]
    - [0, 8.907]
  - - [64, 832, 1, 512, 64, 64, 512, 512]
    - [0, 5.21]
  - - [192, 832, 1, 512, 192, 192, 512, 512]
    - [0, 6.674]
  - - [320, 832, 1, 512, 320, 320, 512, 512]
    - [0, 7.767]
  - - [448, 832, 1, 512, 448, 448, 512, 512]
    - [0, 7.479]
  - - [576, 832, 1, 512, 576, 576, 512, 512]
    - [0, 7.91]
  - - [704, 832, 1, 512, 704, 704, 512, 512]
    - [0, 7.953]
  - - [832, 832, 1, 512, 832, 832, 512, 512]
    - [0, 8.201]
  - - [960, 832, 1, 512, 960, 960, 512, 512]
    - [0, 8.418]
  - - [1088, 832, 1, 512, 1088, 1088, 512, 512]
    - [0, 8.374]
  - - [1216, 832, 1, 512, 1216, 1216, 512, 512]
    - [0, 8.536]
  - - [1344, 832, 1, 512, 1344, 1344, 512, 512]
    - [0, 8.506]
  - - [1472, 832, 1, 512, 1472, 1472, 512, 512]
    - [0, 8.606]
  - - [1600, 832, 1, 512, 1600, 1600, 512, 512]
    - [0, 8.566]
  - - [1728, 832, 1, 512, 1728, 1728, 512, 512]
    - [0, 8.804]
  - - [1856, 832, 1, 512, 1856, 1856, 512, 512]
    - [0, 8.619]
  - - [1984, 832, 1, 512, 1984, 1984, 512, 512]
    - [0, 8.719]
  - - [2112, 832, 1, 512, 2112, 2112, 512, 512]
    - [0, 8.661]
  - - [2240, 832, 1, 512, 2240, 2240, 512, 512]
    - [0, 8.738]
  - - [2368, 832, 1, 512, 2368, 2368, 512, 512]
    - [0, 8.761]
  - - [2496, 832, 1, 512, 2496, 2496, 512, 512]
    - [0, 8.751]
  - - [2624, 832, 1, 512, 2624, 2624, 512, 512]
    - [0, 8.758]
  - - [2752, 832, 1, 512, 2752, 2752, 512, 512]
    - [0, 8.778]
  - - [2880, 832, 1, 512, 2880, 2880, 512, 512]
    - [0, 8.81]
  - - [3008, 832, 1, 512, 3008, 3008, 512, 512]
    - [0, 8.79]
  - - [3136, 832, 1, 512, 3136, 3136, 512, 512]
    - [0, 8.846]
  - - [3264, 832, 1, 512, 3264, 3264, 512, 512]
    - [0, 8.843]
  - - [3392, 832, 1, 512, 3392, 3392, 512, 512]
    - [0, 8.846]
  - - [3520, 832, 1, 512, 3520, 3520, 512, 512]
    - [0, 8.752]
  - - [3648, 832, 1, 512, 3648, 3648, 512, 512]
    - [0, 8.711]
  - - [3776, 832, 1, 512, 3776, 3776, 512, 512]
    - [0, 8.714]
  - - [3904, 832, 1, 512, 3904, 3904, 512, 512]
    - [0, 8.795]
  - - [4032, 832, 1, 512, 4032, 4032, 512, 512]
    - [0, 8.798]
  - - [64, 960, 1, 512, 64, 64, 512, 512]
    - [0, 5.999]
  - - [192, 960, 1, 512, 192, 192, 512, 512]
    - [0, 7.656]
  - - [320, 960, 1, 512, 320, 320, 512, 512]
    - [0, 8.124]
  - - [448, 960, 1, 512, 448, 448, 512, 512]
    - [0, 7.956]
  - - [576, 960, 1, 512, 576, 576, 512, 512]
    - [0, 8.172]
  - - [704, 960, 1, 512, 704, 704, 512, 512]
    - [0, 8.318]
  - - [832, 960, 1, 512, 832, 832, 512, 512]
    - [0, 8.41]
  - - [960, 960, 1, 512, 960, 960, 512, 512]
    - [0, 8.49]
  - - [1088, 960, 1, 512, 1088, 1088, 512, 512]
    - [0, 8.545]
  - - [1216, 960, 1, 512, 1216, 1216, 512, 512]
    - [0, 8.628]
  - - [1344, 960, 1, 512, 1344, 1344, 512, 512]
    - [0, 8.628]
  - - [1472, 960, 1, 512, 1472, 1472, 512, 512]
    - [0, 8.691]
  - - [1600, 960, 1, 512, 1600, 1600, 512, 512]
    - [0, 8.728]
  - - [1728, 960, 1, 512, 1728, 1728, 512, 512]
    - [0, 8.761]
  - - [1856, 960, 1, 512, 1856, 1856, 512, 512]
    - [0, 8.758]
  - - [1984, 960, 1, 512, 1984, 1984, 512, 512]
    - [0, 8.784]
  - - [2112, 960, 1, 512, 2112, 2112, 512, 512]
    - [0, 8.781]
  - - [2240, 960, 1, 512, 2240, 2240, 512, 512]
    - [0, 8.815]
  - - [2368, 960, 1, 512, 2368, 2368, 512, 512]
    - [0, 8.798]
  - - [2496, 960, 1, 512, 2496, 2496, 512, 512]
    - [0, 8.816]
  - - [2624, 960, 1, 512, 2624, 2624, 512, 512]
    - [0, 8.922]
  - - [2752, 960, 1, 512, 2752, 2752, 512, 512]
    - [0, 8.847]
  - - [2880, 960, 1, 512, 2880, 2880, 512, 512]
    - [0, 8.87]
  - - [3008, 960, 1, 512, 3008, 3008, 512, 512]
    - [0, 8.911]
  - - [3136, 960, 1, 512, 3136, 3136, 512, 512]
    - [0, 8.715]
  - - [3264, 960, 1, 512, 3264, 3264, 512, 512]
    - [0, 8.73]
  - - [3392, 960, 1, 512, 3392, 3392, 512, 512]
    - [0, 8.744]
  - - [3520, 960, 1, 512, 3520, 3520, 512, 512]
    - [0, 8.794]
  - - [3648, 960, 1, 512, 3648, 3648, 512, 512]
    - [0, 8.821]
  - - [3776, 960, 1, 512, 3776, 3776, 512, 512]
    - [0, 8.773]
  - - [3904, 960, 1, 512, 3904, 3904, 512, 512]
    - [0, 8.858]
  - - [4032, 960, 1, 512, 4032, 4032, 512, 512]
    - [0, 8.896]
  - - [64, 1088, 1, 512, 64, 64, 512, 512]
    - [2, 4.645]
  - - [192, 1088, 1, 512, 192, 192, 512, 512]
    - [0, 7.584]
  - - [320, 1088, 1, 512, 320, 320, 512, 512]
    - [0, 7.796]
  - - [448, 1088, 1, 512, 448, 448, 512, 512]
    - [0, 8.022]
  - - [576, 1088, 1, 512, 576, 576, 512, 512]
    - [0, 8.097]
  - - [704, 1088, 1, 512, 704, 704, 512, 512]
    - [0, 8.379]
  - - [832, 1088, 1, 512, 832, 832, 512, 512]
    - [0, 8.375]
  - - [960, 1088, 1, 512, 960, 960, 512, 512]
    - [0, 8.54]
  - - [1088, 1088, 1, 512, 1088, 1088, 512, 512]
    - [0, 8.559]
  - - [1216, 1088, 1, 512, 1216, 1216, 512, 512]
    - [0, 8.538]
  - - [1344, 1088, 1, 512, 1344, 1344, 512, 512]
    - [0, 8.653]
  - - [1472, 1088, 1, 512, 1472, 1472, 512, 512]
    - [0, 8.693]
  - - [1600, 1088, 1, 512, 1600, 1600, 512, 512]
    - [0, 8.714]
  - - [1728, 1088, 1, 512, 1728, 1728, 512, 512]
    - [0, 8.695]
  - - [1856, 1088, 1, 512, 1856, 1856, 512, 512]
    - [0, 8.778]
  - - [1984, 1088, 1, 512, 1984, 1984, 512, 512]
    - [0, 8.839]
  - - [2112, 1088, 1, 512, 2112, 2112, 512, 512]
    - [0, 8.802]
  - - [2240, 1088, 1, 512, 2240, 2240, 512, 512]
    - [0, 8.78]
  - - [2368, 1088, 1, 512, 2368, 2368, 512, 512]
    - [0, 8.824]
  - - [2496, 1088, 1, 512, 2496, 2496, 512, 512]
    - [0, 8.813]
  - - [2624, 1088, 1, 512, 2624, 2624, 512, 512]
    - [0, 8.871]
  - - [2752, 1088, 1, 512, 2752, 2752, 512, 512]
    - [0, 8.782]
  - - [2880, 1088, 1, 512, 2880, 2880, 512, 512]
    - [0, 8.733]
  - - [3008, 1088, 1, 512, 3008, 3008, 512, 512]
    - [0, 8.745]
  - - [3136, 1088, 1, 512, 3136, 3136, 512, 512]
    - [0, 8.785]
  - - [3264, 1088, 1, 512, 3264, 3264, 512, 512]
    - [0, 8.763]
  - - [3392, 1088, 1, 512, 3392, 3392, 512, 512]
    - [0, 8.894]
  - - [3520, 1088, 1, 512, 3520, 3520, 512, 512]
    - [0, 8.873]
  - - [3648, 1088, 1, 512, 3648, 3648, 512, 512]
    - [0, 8.827]
  - - [3776, 1088, 1, 512, 3776, 3776, 512, 512]
    - [0, 8.823]
  - - [3904, 1088, 1, 512, 3904, 3904, 512, 512]
    - [0, 8.843]
  - - [4032, 1088, 1, 512, 4032, 4032, 512, 512]
    - [0, 8.84]
  - - [64, 1216, 1, 512, 64, 64, 512, 512]
    - [0, 5.677]
  - - [192, 1216, 1, 512, 192, 192, 512, 512]
    - [0, 7.556]
  - - [320, 1216, 1, 512, 320, 320, 512, 512]
    - [0, 7.731]
  - - [448, 1216, 1, 512, 448, 448, 512, 512]
    - [0, 8.066]
  - - [576, 1216, 1, 512, 576, 576, 512, 512]
    - [0, 8.281]
  - - [704, 1216, 1, 512, 704, 704, 512, 512]
    - [0, 8.437]
  - - [832, 1216, 1, 512, 832, 832, 512, 512]
    - [0, 8.541]
  - - [960, 1216, 1, 512, 960, 960, 512, 512]
    - [0, 8.611]
  - - [1088, 1216, 1, 512, 1088, 1088, 512, 512]
    - [0, 8.684]
  - - [1216, 1216, 1, 512, 1216, 1216, 512, 512]
    - [0, 8.616]
  - - [1344, 1216, 1, 512, 1344, 1344, 512, 512]
    - [0, 8.645]
  - - [1472, 1216, 1, 512, 1472, 1472, 512, 512]
    - [0, 8.696]
  - - [1600, 1216, 1, 512, 1600, 1600, 512, 512]
    - [0, 8.835]
  - - [1728, 1216, 1, 512, 1728, 1728, 512, 512]
    - [0, 8.748]
  - - [1856, 1216, 1, 512, 1856, 1856, 512, 512]
    - [0, 8.771]
  - - [1984, 1216, 1, 512, 1984, 1984, 512, 512]
    - [0, 8.793]
  - - [2112, 1216, 1, 512, 2112, 2112, 512, 512]
    - [0, 8.832]
  - - [2240, 1216, 1, 512, 2240, 2240, 512, 512]
    - [0, 8.821]
  - - [2368, 1216, 1, 512, 2368, 2368, 512, 512]
    - [0, 8.913]
  - - [2496, 1216, 1, 512, 2496, 2496, 512, 512]
    - [0, 8.733]
  - - [2624, 1216, 1, 512, 2624, 2624, 512, 512]
    - [0, 8.758]
  - - [2752, 1216, 1, 512, 2752, 2752, 512, 512]
    - [0, 8.752]
  - - [2880, 1216, 1, 512, 2880, 2880, 512, 512]
    - [0, 8.766]
  - - [3008, 1216, 1, 512, 3008, 3008, 512, 512]
    - [0, 8.806]
  - - [3136, 1216, 1, 512, 3136, 3136, 512, 512]
    - [0, 8.87]
  - - [3264, 1216, 1, 512, 3264, 3264, 512, 512]
    - [0, 8.847]
  - - [3392, 1216, 1, 512, 3392, 3392, 512, 512]
    - [0, 8.849]
  - - [3520, 1216, 1, 512, 3520, 3520, 512, 512]
    - [0, 8.832]
  - - [3648, 1216, 1, 512, 3648, 3648, 512, 512]
    - [0, 8.857]
  - - [3776, 1216, 1, 512, 3776, 3776, 512, 512]
    - [0, 8.815]
  - - [3904, 1216, 1, 512, 3904, 3904, 512, 512]
    - [0, 8.883]
  - - [4032, 1216, 1, 512, 4032, 4032, 512, 512]
    - [0, 8.875]
  - - [64, 1344, 1, 512, 64, 64, 512, 512]
    - [0, 6.258]
  - - [192, 1344, 1, 512, 192, 192, 512, 512]
    - [0, 7.548]
  - - [320, 1344, 1, 512, 320, 320, 512, 512]
    - [0, 7.959]
  - - [448, 1344, 1, 512, 448, 448, 512, 512]
    - [0, 8.101]
  - - [576, 1344, 1, 512, 576, 576, 512, 512]
    - [0, 8.211]
  - - [704, 1344, 1, 512, 704, 704, 512, 512]
    - [0, 8.471]
  - - [832, 1344, 1, 512, 832, 832, 512, 512]
    - [0, 8.523]
  - - [960, 1344, 1, 512, 960, 960, 512, 512]
    - [0, 8.639]
  - - [1088, 1344, 1, 512, 1088, 1088, 512, 512]
    - [0, 8.673]
  - - [1216, 1344, 1, 512, 1216, 1216, 512, 512]
    - [0, 8.773]
  - - [1344, 1344, 1, 512, 1344, 1344, 512, 512]
    - [0, 8.733]
  - - [1472, 1344, 1, 512, 1472, 1472, 512, 512]
    - [0, 8.753]
  - - [1600, 1344, 1, 512, 1600, 1600, 512, 512]
    - [0, 8.791]
  - - [1728, 1344, 1, 512, 1728, 1728, 512, 512]
    - [0, 8.822]
  - - [1856, 1344, 1, 512, 1856, 1856, 512, 512]
    - [0, 8.943]
  - - [1984, 1344, 1, 512, 1984, 1984, 512, 512]
    - [0, 8.85]
  - - [2112, 1344, 1, 512, 2112, 2112, 512, 512]
    - [0, 8.831]
  - - [2240, 1344, 1, 512, 2240, 2240, 512, 512]
    - [0, 8.734]
  - - [2368, 1344, 1, 512, 2368, 2368, 512, 512]
    - [0, 8.731]
  - - [2496, 1344, 1, 512, 2496, 2496, 512, 512]
    - [0, 8.831]
  - - [2624, 1344, 1, 512, 2624, 2624, 512, 512]
    - [0, 8.785]
  - - [2752, 1344, 1, 512, 2752, 2752, 512, 512]
    - [0, 8.919]
  - - [2880, 1344, 1, 512, 2880, 2880, 512, 512]
    - [0, 8.783]
  - - [3008, 1344, 1, 512, 3008, 3008, 512, 512]
    - [0, 8.838]
  - - [3136, 1344, 1, 512, 3136, 3136, 512, 512]
    - [0, 8.84]
  - - [3264, 1344, 1, 512, 3264, 3264, 512, 512]
    - [0, 8.863]
  - - [3392, 1344, 1, 512, 3392, 3392, 512, 512]
    - [0, 8.922]
  - - [3520, 1344, 1, 512, 3520, 3520, 512, 512]
    - [0, 8.867]
  - - [3648, 1344, 1, 512, 3648, 3648, 512, 512]
    - [0, 8.874]
  - - [3776, 1344, 1, 512, 3776, 3776, 512, 512]
    - [0, 8.87]
  - - [3904, 1344, 1, 512, 3904, 3904, 512, 512]
    - [0, 8.895]
  - - [4032, 1344, 1, 512, 4032, 4032, 512, 512]
    - [0, 8.943]
  - - [64, 1472, 1, 512, 64, 64, 512, 512]
    - [3, 4.586]
  - - [192, 1472, 1, 512, 192, 192, 512, 512]
    - [0, 7.517]
  - - [320, 1472, 1, 512, 320, 320, 512, 512]
    - [0, 7.798]
  - - [448, 1472, 1, 512, 448, 448, 512, 512]
    - [0, 8.16]
  - - [576, 1472, 1, 512, 576, 576, 512, 512]
    - [0, 8.368]
  - - [704, 1472, 1, 512, 704, 704, 512, 512]
    - [0, 8.515]
  - - [832, 1472, 1, 512, 832, 832, 512, 512]
    - [0, 8.591]
  - - [960, 1472, 1, 512, 960, 960, 512, 512]
    - [0, 8.658]
  - - [1088, 1472, 1, 512, 1088, 1088, 512, 512]
    - [0, 8.629]
  - - [1216, 1472, 1, 512, 1216, 1216, 512, 512]
    - [0, 8.731]
  - - [1344, 1472, 1, 512, 1344, 1344, 512, 512]
    - [0, 8.74]
  - - [1472, 1472, 1, 512, 1472, 1472, 512, 512]
    - [0, 8.767]
  - - [1600, 1472, 1, 512, 1600, 1600, 512, 512]
    - [0, 8.801]
  - - [1728, 1472, 1, 512, 1728, 1728, 512, 512]
    - [0, 8.816]
  - - [1856, 1472, 1, 512, 1856, 1856, 512, 512]
    - [0, 8.837]
  - - [1984, 1472, 1, 512, 1984, 1984, 512, 512]
    - [0, 8.908]
  - - [2112, 1472, 1, 512, 2112, 2112, 512, 512]
    - [0, 8.711]
  - - [2240, 1472, 1, 512, 2240, 2240, 512, 512]
    - [0, 8.78]
  - - [2368, 1472, 1, 512, 2368, 2368, 512, 512]
    - [0, 8.804]
  - - [2496, 1472, 1, 512, 2496, 2496, 512, 512]
    - [0, 8.794]
  - - [2624, 1472, 1, 512, 2624, 2624, 512, 512]
    - [0, 8.798]
  - - [2752, 1472, 1, 512, 2752, 2752, 512, 512]
    - [0, 8.82]
  - - [2880, 1472, 1, 512, 2880, 2880, 512, 512]
    - [0, 8.901]
  - - [3008, 1472, 1, 512, 3008, 3008, 512, 512]
    - [0, 8.854]
  - - [3136, 1472, 1, 512, 3136, 3136, 512, 512]
    - [0, 8.832]
  - - [3264, 1472, 1, 512, 3264, 3264, 512, 512]
    - [0, 8.876]
  - - [3392, 1472, 1, 512, 3392, 3392, 512, 512]
    - [0, 8.909]
  - - [3520, 1472, 1, 512, 3520, 3520, 512, 512]
    - [0, 8.92]
  - - [3648, 1472, 1, 512, 3648, 3648, 512, 512]
    - [0, 8.961]
  - - [3776, 1472, 1, 512, 3776, 3776, 512, 512]
    - [0, 8.899]
  - - [3904, 1472, 1, 512, 3904, 3904, 512, 512]
    - [0, 8.884]
  - - [4032, 1472, 1, 512, 4032, 4032, 512, 512]
    - [0, 9.008]
  - - [64, 1600, 1, 512, 64, 64, 512, 512]
    - [0, 5.99]
  - - [192, 1600, 1, 512, 192, 192, 512, 512]
    - [0, 8.115]
  - - [320, 1600, 1, 512, 320, 320, 512, 512]
    - [0, 7.997]
  - - [448, 1600, 1, 512, 448, 448, 512, 512]
    - [0, 8.189]
  - - [576, 1600, 1, 512, 576, 576, 512, 512]
    - [0, 8.489]
  - - [704, 1600, 1, 512, 704, 704, 512, 512]
    - [0, 8.535]
  - - [832, 1600, 1, 512, 832, 832, 512, 512]
    - [0, 8.575]
  - - [960, 1600, 1, 512, 960, 960, 512, 512]
    - [0, 8.681]
  - - [1088, 1600, 1, 512, 1088, 1088, 512, 512]
    - [0, 8.694]
  - - [1216, 1600, 1, 512, 1216, 1216, 512, 512]
    - [0, 8.79]
  - - [1344, 1600, 1, 512, 1344, 1344, 512, 512]
    - [0, 8.802]
  - - [1472, 1600, 1, 512, 1472, 1472, 512, 512]
    - [0, 8.806]
  - - [1600, 1600, 1, 512, 1600, 1600, 512, 512]
    - [0, 8.787]
  - - [1728, 1600, 1, 512, 1728, 1728, 512, 512]
    - [0, 8.852]
  - - [1856, 1600, 1, 512, 1856, 1856, 512, 512]
    - [0, 8.713]
  - - [1984, 1600, 1, 512, 1984, 1984, 512, 512]
    - [0, 8.759]
  - - [2112, 1600, 1, 512, 2112, 2112, 512, 512]
    - [0, 8.799]
  - - [2240, 1600, 1, 512, 2240, 2240, 512, 512]
    - [0, 8.789]
  - - [2368, 1600, 1, 512, 2368, 2368, 512, 512]
    - [0, 8.814]
  - - [2496, 1600, 1, 512, 2496, 2496, 512, 512]
    - [0, 8.791]
  - - [2624, 1600, 1, 512, 2624, 2624, 512, 512]
    - [0, 8.857]
  - - [2752, 1600, 1, 512, 2752, 2752, 512, 512]
    - [0, 8.813]
  - - [2880, 1600, 1, 512, 2880, 2880, 512, 512]
    - [0, 8.856]
  - - [3008, 1600, 1, 512, 3008, 3008, 512, 512]
    - [0, 8.941]
  - - [3136, 1600, 1, 512, 3136, 3136, 512, 512]
    - [0, 8.883]
  - - [3264, 1600, 1, 512, 3264, 3264, 512, 512]
    - [0, 8.935]
  - - [3392, 1600, 1, 512, 3392, 3392, 512, 512]
    - [0, 8.87]
  - - [3520, 1600, 1, 512, 3520, 3520, 512, 512]
    - [0, 8.928]
  - - [3648, 1600, 1, 512, 3648, 3648, 512, 512]
    - [0, 8.884]
  - - [3776, 1600, 1, 512, 3776, 3776, 512, 512]
    - [0, 8.962]
  - - [3904, 1600, 1, 512, 3904, 3904, 512, 512]
    - [0, 8.888]
  - - [4032, 1600, 1, 512, 4032, 4032, 512, 512]
    - [0, 8.908]
  - - [64, 1728, 1, 512, 64, 64, 512, 512]
    - [0, 5.081]
  - - [192, 1728, 1, 512, 192, 192, 512, 512]
    - [0, 8.048]
  - - [320, 1728, 1, 512, 320, 320, 512, 512]
    - [0, 8.164]
  - - [448, 1728, 1, 512, 448, 448, 512, 512]
    - [0, 8.279]
  - - [576, 1728, 1, 512, 576, 576, 512, 512]
    - [0, 8.426]
  - - [704, 1728, 1, 512, 704, 704, 512, 512]
    - [0, 8.581]
  - - [832, 1728, 1, 512, 832, 832, 512, 512]
    - [0, 8.653]
  - - [960, 1728, 1, 512, 960, 960, 512, 512]
    - [0, 8.734]
  - - [1088, 1728, 1, 512, 1088, 1088, 512, 512]
    - [0, 8.696]
  - - [1216, 1728, 1, 512, 1216, 1216, 512, 512]
    - [0, 8.781]
  - - [1344, 1728, 1, 512, 1344, 1344, 512, 512]
    - [0, 8.793]
  - - [1472, 1728, 1, 512, 1472, 1472, 512, 512]
    - [0, 8.819]
  - - [1600, 1728, 1, 512, 1600, 1600, 512, 512]
    - [0, 8.955]
  - - [1728, 1728, 1, 512, 1728, 1728, 512, 512]
    - [0, 8.704]
  - - [1856, 1728, 1, 512, 1856, 1856, 512, 512]
    - [0, 8.775]
  - - [1984, 1728, 1, 512, 1984, 1984, 512, 512]
    - [0, 8.8]
  - - [2112, 1728, 1, 512, 2112, 2112, 512, 512]
    - [0, 8.839]
  - - [2240, 1728, 1, 512, 2240, 2240, 512, 512]
    - [0, 8.878]
  - - [2368, 1728, 1, 512, 2368, 2368, 512, 512]
    - [0, 8.905]
  - - [2496, 1728, 1, 512, 2496, 2496, 512, 512]
    - [0, 8.877]
  - - [2624, 1728, 1, 512, 2624, 2624, 512, 512]
    - [0, 8.861]
  - - [2752, 1728, 1, 512, 2752, 2752, 512, 512]
    - [0, 8.922]
  - - [2880, 1728, 1, 512, 2880, 2880, 512, 512]
    - [0, 8.867]
  - - [3008, 1728, 1, 512, 3008, 3008, 512, 512]
    - [0, 8.889]
  - - [3136, 1728, 1, 512, 3136, 3136, 512, 512]
    - [0, 8.958]
  - - [3264, 1728, 1, 512, 3264, 3264, 512, 512]
    - [0, 8.884]
  - - [3392, 1728, 1, 512, 3392, 3392, 512, 512]
    - [0, 8.945]
  - - [3520, 1728, 1, 512, 3520, 3520, 512, 512]
    - [0, 9.001]
  - - [3648, 1728, 1, 512, 3648, 3648, 512, 512]
    - [0, 8.979]
  - - [3776, 1728, 1, 512, 3776, 3776, 512, 512]
    - [0, 8.971]
  - - [3904, 1728, 1, 512, 3904, 3904, 512, 512]
    - [0, 8.932]
  - - [4032, 1728, 1, 512, 4032, 4032, 512, 512]
    - [0, 8.961]
  - - [64, 1856, 1, 512, 64, 64, 512, 512]
    - [0, 5.454]
  - - [192, 1856, 1, 512, 192, 192, 512, 512]
    - [0, 7.95]
  - - [320, 1856, 1, 512, 320, 320, 512, 512]
    - [0, 8.049]
  - - [448, 1856, 1, 512, 448, 448, 512, 512]
    - [0, 8.316]
  - - [576, 1856, 1, 512, 576, 576, 512, 512]
    - [0, 8.538]
  - - [704, 1856, 1, 512, 704, 704, 512, 512]
    - [0, 8.577]
  - - [832, 1856, 1, 512, 832, 832, 512, 512]
    - [0, 8.642]
  - - [960, 1856, 1, 512, 960, 960, 512, 512]
    - [0, 8.736]
  - - [1088, 1856, 1, 512, 1088, 1088, 512, 512]
    - [0, 8.769]
  - - [1216, 1856, 1, 512, 1216, 1216, 512, 512]
    - [0, 8.772]
  - - [1344, 1856, 1, 512, 1344, 1344, 512, 512]
    - [0, 8.839]
  - - [1472, 1856, 1, 512, 1472, 1472, 512, 512]
    - [0, 8.828]
  - - [1600, 1856, 1, 512, 1600, 1600, 512, 512]
    - [0, 8.769]
  - - [1728, 1856, 1, 512, 1728, 1728, 512, 512]
    - [0, 8.715]
  - - [1856, 1856, 1, 512, 1856, 1856, 512, 512]
    - [0, 8.795]
  - - [1984, 1856, 1, 512, 1984, 1984, 512, 512]
    - [0, 8.769]
  - - [2112, 1856, 1, 512, 2112, 2112, 512, 512]
    - [0, 8.806]
  - - [2240, 1856, 1, 512, 2240, 2240, 512, 512]
    - [0, 8.973]
  - - [2368, 1856, 1, 512, 2368, 2368, 512, 512]
    - [0, 8.84]
  - - [2496, 1856, 1, 512, 2496, 2496, 512, 512]
    - [0, 8.895]
  - - [2624, 1856, 1, 512, 2624, 2624, 512, 512]
    - [0, 8.927]
  - - [2752, 1856, 1, 512, 2752, 2752, 512, 512]
    - [0, 8.926]
  - - [2880, 1856, 1, 512, 2880, 2880, 512, 512]
    - [0, 8.92]
  - - [3008, 1856, 1, 512, 3008, 3008, 512, 512]
    - [0, 8.922]
  - - [3136, 1856, 1, 512, 3136, 3136, 512, 512]
    - [0, 8.941]
  - - [3264, 1856, 1, 512, 3264, 3264, 512, 512]
    - [0, 8.929]
  - - [3392, 1856, 1, 512, 3392, 3392, 512, 512]
    - [0, 8.89]
  - - [3520, 1856, 1, 512, 3520, 3520, 512, 512]
    - [0, 8.957]
  - - [3648, 1856, 1, 512, 3648, 3648, 512, 512]
    - [0, 8.96]
  - - [3776, 1856, 1, 512, 3776, 3776, 512, 512]
    - [0, 8.936]
  - - [3904, 1856, 1, 512, 3904, 3904, 512, 512]
    - [0, 8.961]
  - - [4032, 1856, 1, 512, 4032, 4032, 512, 512]
    - [0, 8.914]
  - - [64, 1984, 1, 512, 64, 64, 512, 512]
    - [2, 4.982]
  - - [192, 1984, 1, 512, 192, 192, 512, 512]
    - [0, 7.585]
  - - [320, 1984, 1, 512, 320, 320, 512, 512]
    - [0, 8.186]
  - - [448, 1984, 1, 512, 448, 448, 512, 512]
    - [0, 8.465]
  - - [576, 1984, 1, 512, 576, 576, 512, 512]
    - [0, 8.551]
  - - [704, 1984, 1, 512, 704, 704, 512, 512]
    - [0, 8.632]
  - - [832, 1984, 1, 512, 832, 832, 512, 512]
    - [0, 8.684]
  - - [960, 1984, 1, 512, 960, 960, 512, 512]
    - [0, 8.756]
  - - [1088, 1984, 1, 512, 1088, 1088, 512, 512]
    - [0, 8.741]
  - - [1216, 1984, 1, 512, 1216, 1216, 512, 512]
    - [0, 8.801]
  - - [1344, 1984, 1, 512, 1344, 1344, 512, 512]
    - [0, 8.845]
  - - [1472, 1984, 1, 512, 1472, 1472, 512, 512]
    - [0, 8.697]
  - - [1600, 1984, 1, 512, 1600, 1600, 512, 512]
    - [0, 8.718]
  - - [1728, 1984, 1, 512, 1728, 1728, 512, 512]
    - [0, 8.777]
  - - [1856, 1984, 1, 512, 1856, 1856, 512, 512]
    - [0, 8.847]
  - - [1984, 1984, 1, 512, 1984, 1984, 512, 512]
    - [0, 8.85]
  - - [2112, 1984, 1, 512, 2112, 2112, 512, 512]
    - [0, 8.915]
  - - [2240, 1984, 1, 512, 2240, 2240, 512, 512]
    - [0, 8.826]
  - - [2368, 1984, 1, 512, 2368, 2368, 512, 512]
    - [0, 8.825]
  - - [2496, 1984, 1, 512, 2496, 2496, 512, 512]
    - [0, 8.836]
  - - [2624, 1984, 1, 512, 2624, 2624, 512, 512]
    - [0, 8.928]
  - - [2752, 1984, 1, 512, 2752, 2752, 512, 512]
    - [0, 8.976]
  - - [2880, 1984, 1, 512, 2880, 2880, 512, 512]
    - [0, 8.868]
  - - [3008, 1984, 1, 512, 3008, 3008, 512, 512]
    - [0, 8.924]
  - - [3136, 1984, 1, 512, 3136, 3136, 512, 512]
    - [0, 8.88]
  - - [3264, 1984, 1, 512, 3264, 3264, 512, 512]
    - [0, 9.032]
  - - [3392, 1984, 1, 512, 3392, 3392, 512, 512]
    - [0, 8.951]
  - - [3520, 1984, 1, 512, 3520, 3520, 512, 512]
    - [0, 8.927]
  - - [3648, 1984, 1, 512, 3648, 3648, 512, 512]
    - [0, 8.914]
  - - [3776, 1984, 1, 512, 3776, 3776, 512, 512]
    - [0, 8.98]
  - - [3904, 1984, 1, 512, 3904, 3904, 512, 512]
    - [0, 8.998]
  - - [4032, 1984, 1, 512, 4032, 4032, 512, 512]
    - [0, 8.953]
  - - [64, 2112, 1, 512, 64, 64, 512, 512]
    - [0, 6.554]
  - - [192, 2112, 1, 512, 192, 192, 512, 512]
    - [0, 7.569]
  - - [320, 2112, 1, 512, 320, 320, 512, 512]
    - [0, 8.304]
  - - [448, 2112, 1, 512, 448, 448, 512, 512]
    - [0, 8.472]
  - - [576, 2112, 1, 512, 576, 576, 512, 512]
    - [0, 8.559]
  - - [704, 2112, 1, 512, 704, 704, 512, 512]
    - [0, 8.638]
  - - [832, 2112, 1, 512, 832, 832, 512, 512]
    - [0, 8.807]
  - - [960, 2112, 1, 512, 960, 960, 512, 512]
    - [0, 8.777]
  - - [1088, 2112, 1, 512, 1088, 1088, 512, 512]
    - [0, 8.862]
  - - [1216, 2112, 1, 512, 1216, 1216, 512, 512]
    - [0, 8.817]
  - - [1344, 2112, 1, 512, 1344, 1344, 512, 512]
    - [0, 8.833]
  - - [1472, 2112, 1, 512, 1472, 1472, 512, 512]
    - [0, 8.713]
  - - [1600, 2112, 1, 512, 1600, 1600, 512, 512]
    - [0, 8.763]
  - - [1728, 2112, 1, 512, 1728, 1728, 512, 512]
    - [0, 8.776]
  - - [1856, 2112, 1, 512, 1856, 1856, 512, 512]
    - [0, 8.813]
  - - [1984, 2112, 1, 512, 1984, 1984, 512, 512]
    - [0, 8.852]
  - - [2112, 2112, 1, 512, 2112, 2112, 512, 512]
    - [0, 8.801]
  - - [2240, 2112, 1, 512, 2240, 2240, 512, 512]
    - [0, 8.84]
  - - [2368, 2112, 1, 512, 2368, 2368, 512, 512]
    - [0, 8.84]
  - - [2496, 2112, 1, 512, 2496, 2496, 512, 512]
    - [0, 8.93]
  - - [2624, 2112, 1, 512, 2624, 2624, 512, 512]
    - [0, 8.939]
  - - [2752, 2112, 1, 512, 2752, 2752, 512, 512]
    - [0, 9.023]
  - - [2880, 2112, 1, 512, 2880, 2880, 512, 512]
    - [0, 8.933]
  - - [3008, 2112, 1, 512, 3008, 3008, 512, 512]
    - [0, 8.987]
  - - [3136, 2112, 1, 512, 3136, 3136, 512, 512]
    - [0, 8.974]
  - - [3264, 2112, 1, 512, 3264, 3264, 512, 512]
    - [0, 8.906]
  - - [3392, 2112, 1, 512, 3392, 3392, 512, 512]
    - [0, 8.91]
  - - [3520, 2112, 1, 512, 3520, 3520, 512, 512]
    - [0, 8.983]
  - - [3648, 2112, 1, 512, 3648, 3648, 512, 512]
    - [0, 8.942]
  - - [3776, 2112, 1, 512, 3776, 3776, 512, 512]
    - [0, 8.934]
  - - [3904, 2112, 1, 512, 3904, 3904, 512, 512]
    - [0, 9.025]
  - - [4032, 2112, 1, 512, 4032, 4032, 512, 512]
    - [0, 8.994]
  - - [64, 2240, 1, 512, 64, 64, 512, 512]
    - [0, 6.941]
  - - [192, 2240, 1, 512, 192, 192, 512, 512]
    - [0, 7.96]
  - - [320, 2240, 1, 512, 320, 320, 512, 512]
    - [0, 8.193]
  - - [448, 2240, 1, 512, 448, 448, 512, 512]
    - [0, 8.474]
  - - [576, 2240, 1, 512, 576, 576, 512, 512]
    - [0, 8.63]
  - - [704, 2240, 1, 512, 704, 704, 512, 512]
    - [0, 8.685]
  - - [832, 2240, 1, 512, 832, 832, 512, 512]
    - [0, 8.727]
  - - [960, 2240, 1, 512, 960, 960, 512, 512]
    - [0, 8.814]
  - - [1088, 2240, 1, 512, 1088, 1088, 512, 512]
    - [0, 8.868]
  - - [1216, 2240, 1, 512, 1216, 1216, 512, 512]
    - [0, 8.824]
  - - [1344, 2240, 1, 512, 1344, 1344, 512, 512]
    - [0, 8.731]
  - - [1472, 2240, 1, 512, 1472, 1472, 512, 512]
    - [0, 8.736]
  - - [1600, 2240, 1, 512, 1600, 1600, 512, 512]
    - [0, 8.845]
  - - [1728, 2240, 1, 512, 1728, 1728, 512, 512]
    - [0, 8.787]
  - - [1856, 2240, 1, 512, 1856, 1856, 512, 512]
    - [0, 8.844]
  - - [1984, 2240, 1, 512, 1984, 1984, 512, 512]
    - [0, 8.862]
  - - [2112, 2240, 1, 512, 2112, 2112, 512, 512]
    - [0, 8.871]
  - - [2240, 2240, 1, 512, 2240, 2240, 512, 512]
    - [0, 8.885]
  - - [2368, 2240, 1, 512, 2368, 2368, 512, 512]
    - [0, 8.898]
  - - [2496, 2240, 1, 512, 2496, 2496, 512, 512]
    - [0, 8.964]
  - - [2624, 2240, 1, 512, 2624, 2624, 512, 512]
    - [0, 8.972]
  - - [2752, 2240, 1, 512, 2752, 2752, 512, 512]
    - [0, 8.879]
  - - [2880, 2240, 1, 512, 2880, 2880, 512, 512]
    - [0, 8.967]
  - - [3008, 2240, 1, 512, 3008, 3008, 512, 512]
    - [0, 8.971]
  - - [3136, 2240, 1, 512, 3136, 3136, 512, 512]
    - [0, 8.961]
  - - [3264, 2240, 1, 512, 3264, 3264, 512, 512]
    - [0, 8.913]
  - - [3392, 2240, 1, 512, 3392, 3392, 512, 512]
    - [0, 8.932]
  - - [3520, 2240, 1, 512, 3520, 3520, 512, 512]
    - [0, 8.989]
  - - [3648, 2240, 1, 512, 3648, 3648, 512, 512]
    - [0, 8.965]
  - - [3776, 2240, 1, 512, 3776, 3776, 512, 512]
    - [0, 8.968]
  - - [3904, 2240, 1, 512, 3904, 3904, 512, 512]
    - [0, 8.968]
  - - [4032, 2240, 1, 512, 4032, 4032, 512, 512]
    - [0, 9.064]
  - - [64, 2368, 1, 512, 64, 64, 512, 512]
    - [0, 5.431]
  - - [192, 2368, 1, 512, 192, 192, 512, 512]
    - [0, 7.93]
  - - [320, 2368, 1, 512, 320, 320, 512, 512]
    - [0, 8.301]
  - - [448, 2368, 1, 512, 448, 448, 512, 512]
    - [0, 8.489]
  - - [576, 2368, 1, 512, 576, 576, 512, 512]
    - [0, 8.589]
  - - [704, 2368, 1, 512, 704, 704, 512, 512]
    - [0, 8.768]
  - - [832, 2368, 1, 512, 832, 832, 512, 512]
    - [0, 8.721]
  - - [960, 2368, 1, 512, 960, 960, 512, 512]
    - [0, 8.791]
  - - [1088, 2368, 1, 512, 1088, 1088, 512, 512]
    - [0, 8.94]
  - - [1216, 2368, 1, 512, 1216, 1216, 512, 512]
    - [0, 8.849]
  - - [1344, 2368, 1, 512, 1344, 1344, 512, 512]
    - [0, 8.806]
  - - [1472, 2368, 1, 512, 1472, 1472, 512, 512]
    - [0, 8.806]
  - - [1600, 2368, 1, 512, 1600, 1600, 512, 512]
    - [0, 8.792]
  - - [1728, 2368, 1, 512, 1728, 1728, 512, 512]
    - [0, 8.859]
  - - [1856, 2368, 1, 512, 1856, 1856, 512, 512]
    - [0, 8.867]
  - - [1984, 2368, 1, 512, 1984, 1984, 512, 512]
    - [0, 8.863]
  - - [2112, 2368, 1, 512, 2112, 2112, 512, 512]
    - [0, 8.858]
  - - [2240, 2368, 1, 512, 2240, 2240, 512, 512]
    - [0, 8.969]
  - - [2368, 2368, 1, 512, 2368, 2368, 512, 512]
    - [0, 8.854]
  - - [2496, 2368, 1, 512, 2496, 2496, 512, 512]
    - [0, 8.942]
  - - [2624, 2368, 1, 512, 2624, 2624, 512, 512]
    - [0, 9.021]
  - - [2752, 2368, 1, 512, 2752, 2752, 512, 512]
    - [0, 8.938]
  - - [2880, 2368, 1, 512, 2880, 2880, 512, 512]
    - [0, 8.954]
  - - [3008, 2368, 1, 512, 3008, 3008, 512, 512]
    - [0, 8.984]
  - - [3136, 2368, 1, 512, 3136, 3136, 512, 512]
    - [0, 8.914]
  - - [3264, 2368, 1, 512, 3264, 3264, 512, 512]
    - [0, 8.936]
  - - [3392, 2368, 1, 512, 3392, 3392, 512, 512]
    - [0, 8.953]
  - - [3520, 2368, 1, 512, 3520, 3520, 512, 512]
    - [0, 8.996]
  - - [3648, 2368, 1, 512, 3648, 3648, 512, 512]
    - [0, 8.931]
  - - [3776, 2368, 1, 512, 3776, 3776, 512, 512]
    - [0, 9.03]
  - - [3904, 2368, 1, 512, 3904, 3904, 512, 512]
    - [0, 8.959]
  - - [4032, 2368, 1, 512, 4032, 4032, 512, 512]
    - [0, 8.969]
  - - [64, 2496, 1, 512, 64, 64, 512, 512]
    - [0, 5.429]
  - - [192, 2496, 1, 512, 192, 192, 512, 512]
    - [0, 7.904]
  - - [320, 2496, 1, 512, 320, 320, 512, 512]
    - [0, 8.413]
  - - [448, 2496, 1, 512, 448, 448, 512, 512]
    - [0, 8.496]
  - - [576, 2496, 1, 512, 576, 576, 512, 512]
    - [0, 8.649]
  - - [704, 2496, 1, 512, 704, 704, 512, 512]
    - [0, 8.668]
  - - [832, 2496, 1, 512, 832, 832, 512, 512]
    - [0, 8.868]
  - - [960, 2496, 1, 512, 960, 960, 512, 512]
    - [0, 8.844]
  - - [1088, 2496, 1, 512, 1088, 1088, 512, 512]
    - [0, 8.815]
  - - [1216, 2496, 1, 512, 1216, 1216, 512, 512]
    - [0, 8.749]
  - - [1344, 2496, 1, 512, 1344, 1344, 512, 512]
    - [0, 8.769]
  - - [1472, 2496, 1, 512, 1472, 1472, 512, 512]
    - [0, 8.793]
  - - [1600, 2496, 1, 512, 1600, 1600, 512, 512]
    - [0, 8.921]
  - - [1728, 2496, 1, 512, 1728, 1728, 512, 512]
    - [0, 8.863]
  - - [1856, 2496, 1, 512, 1856, 1856, 512, 512]
    - [0, 8.878]
  - - [1984, 2496, 1, 512, 1984, 1984, 512, 512]
    - [0, 8.842]
  - - [2112, 2496, 1, 512, 2112, 2112, 512, 512]
    - [0, 8.856]
  - - [2240, 2496, 1, 512, 2240, 2240, 512, 512]
    - [0, 8.978]
  - - [2368, 2496, 1, 512, 2368, 2368, 512, 512]
    - [0, 8.959]
  - - [2496, 2496, 1, 512, 2496, 2496, 512, 512]
    - [0, 8.95]
  - - [2624, 2496, 1, 512, 2624, 2624, 512, 512]
    - [0, 9.012]
  - - [2752, 2496, 1, 512, 2752, 2752, 512, 512]
    - [0, 8.993]
  - - [2880, 2496, 1, 512, 2880, 2880, 512, 512]
    - [0, 8.973]
  - - [3008, 2496, 1, 512, 3008, 3008, 512, 512]
    - [0, 8.938]
  - - [3136, 2496, 1, 512, 3136, 3136, 512, 512]
    - [0, 8.939]
  - - [3264, 2496, 1, 512, 3264, 3264, 512, 512]
    - [0, 9.004]
  - - [3392, 2496, 1, 512, 3392, 3392, 512, 512]
    - [0, 8.97]
  - - [3520, 2496, 1, 512, 3520, 3520, 512, 512]
    - [0, 9.01]
  - - [3648, 2496, 1, 512, 3648, 3648, 512, 512]
    - [0, 8.97]
  - - [3776, 2496, 1, 512, 3776, 3776, 512, 512]
    - [0, 9.019]
  - - [3904, 2496, 1, 512, 3904, 3904, 512, 512]
    - [0, 8.998]
  - - [4032, 2496, 1, 512, 4032, 4032, 512, 512]
    - [0, 8.98]
  - - [64, 2624, 1, 512, 64, 64, 512, 512]
    - [0, 6.976]
  - - [192, 2624, 1, 512, 192, 192, 512, 512]
    - [0, 7.886]
  - - [320, 2624, 1, 512, 320, 320, 512, 512]
    - [0, 8.306]
  - - [448, 2624, 1, 512, 448, 448, 512, 512]
    - [0, 8.599]
  - - [576, 2624, 1, 512, 576, 576, 512, 512]
    - [0, 8.612]
  - - [704, 2624, 1, 512, 704, 704, 512, 512]
    - [0, 8.765]
  - - [832, 2624, 1, 512, 832, 832, 512, 512]
    - [0, 8.861]
  - - [960, 2624, 1, 512, 960, 960, 512, 512]
    - [0, 8.807]
  - - [1088, 2624, 1, 512, 1088, 1088, 512, 512]
    - [0, 8.841]
  - - [1216, 2624, 1, 512, 1216, 1216, 512, 512]
    - [0, 8.762]
  - - [1344, 2624, 1, 512, 1344, 1344, 512, 512]
    - [0, 8.789]
  - - [1472, 2624, 1, 512, 1472, 1472, 512, 512]
    - [0, 8.783]
  - - [1600, 2624, 1, 512, 1600, 1600, 512, 512]
    - [0, 8.809]
  - - [1728, 2624, 1, 512, 1728, 1728, 512, 512]
    - [0, 8.846]
  - - [1856, 2624, 1, 512, 1856, 1856, 512, 512]
    - [0, 8.873]
  - - [1984, 2624, 1, 512, 1984, 1984, 512, 512]
    - [0, 8.881]
  - - [2112, 2624, 1, 512, 2112, 2112, 512, 512]
    - [0, 8.896]
  - - [2240, 2624, 1, 512, 2240, 2240, 512, 512]
    - [0, 8.927]
  - - [2368, 2624, 1, 512, 2368, 2368, 512, 512]
    - [0, 8.866]
  - - [2496, 2624, 1, 512, 2496, 2496, 512, 512]
    - [0, 8.935]
  - - [2624, 2624, 1, 512, 2624, 2624, 512, 512]
    - [0, 9.023]
  - - [2752, 2624, 1, 512, 2752, 2752, 512, 512]
    - [0, 8.964]
  - - [2880, 2624, 1, 512, 2880, 2880, 512, 512]
    - [0, 9.004]
  - - [3008, 2624, 1, 512, 3008, 3008, 512, 512]
    - [0, 9.003]
  - - [3136, 2624, 1, 512, 3136, 3136, 512, 512]
    - [0, 8.974]
  - - [3264, 2624, 1, 512, 3264, 3264, 512, 512]
    - [0, 8.924]
  - - [3392, 2624, 1, 512, 3392, 3392, 512, 512]
    - [0, 8.979]
  - - [3520, 2624, 1, 512, 3520, 3520, 512, 512]
    - [0, 8.979]
  - - [3648, 2624, 1, 512, 3648, 3648, 512, 512]
    - [0, 9.0]
  - - [3776, 2624, 1, 512, 3776, 3776, 512, 512]
    - [0, 9.011]
  - - [3904, 2624, 1, 512, 3904, 3904, 512, 512]
    - [0, 8.921]
  - - [4032, 2624, 1, 512, 4032, 4032, 512, 512]
    - [0, 8.953]
  - - [64, 2752, 1, 512, 64, 64, 512, 512]
    - [0, 7.305]
  - - [192, 2752, 1, 512, 192, 192, 512, 512]
    - [0, 7.87]
  - - [320, 2752, 1, 512, 320, 320, 512, 512]
    - [0, 8.398]
  - - [448, 2752, 1, 512, 448, 448, 512, 512]
    - [0, 8.513]
  - - [576, 2752, 1, 512, 576, 576, 512, 512]
    - [0, 8.681]
  - - [704, 2752, 1, 512, 704, 704, 512, 512]
    - [0, 8.789]
  - - [832, 2752, 1, 512, 832, 832, 512, 512]
    - [0, 8.78]
  - - [960, 2752, 1, 512, 960, 960, 512, 512]
    - [0, 8.84]
  - - [1088, 2752, 1, 512, 1088, 1088, 512, 512]
    - [0, 8.794]
  - - [1216, 2752, 1, 512, 1216, 1216, 512, 512]
    - [0, 8.78]
  - - [1344, 2752, 1, 512, 1344, 1344, 512, 512]
    - [0, 8.764]
  - - [1472, 2752, 1, 512, 1472, 1472, 512, 512]
    - [0, 8.797]
  - - [1600, 2752, 1, 512, 1600, 1600, 512, 512]
    - [0, 8.873]
  - - [1728, 2752, 1, 512, 1728, 1728, 512, 512]
    - [0, 8.839]
  - - [1856, 2752, 1, 512, 1856, 1856, 512, 512]
    - [0, 8.916]
  - - [1984, 2752, 1, 512, 1984, 1984, 512, 512]
    - [0, 8.939]
  - - [2112, 2752, 1, 512, 2112, 2112, 512, 512]
    - [0, 8.899]
  - - [2240, 2752, 1, 512, 2240, 2240, 512, 512]
    - [0, 8.912]
  - - [2368, 2752, 1, 512, 2368, 2368, 512, 512]
    - [0, 8.941]
  - - [2496, 2752, 1, 512, 2496, 2496, 512, 512]
    - [0, 8.909]
  - - [2624, 2752, 1, 512, 2624, 2624, 512, 512]
    - [0, 8.981]
  - - [2752, 2752, 1, 512, 2752, 2752, 512, 512]
    - [0, 8.916]
  - - [2880, 2752, 1, 512, 2880, 2880, 512, 512]
    - [0, 9.073]
  - - [3008, 2752, 1, 512, 3008, 3008, 512, 512]
    - [0, 8.928]
  - - [3136, 2752, 1, 512, 3136, 3136, 512, 512]
    - [0, 8.985]
  - - [3264, 2752, 1, 512, 3264, 3264, 512, 512]
    - [0, 8.997]
  - - [3392, 2752, 1, 512, 3392, 3392, 512, 512]
    - [0, 8.967]
  - - [3520, 2752, 1, 512, 3520, 3520, 512, 512]
    - [0, 8.947]
  - - [3648, 2752, 1, 512, 3648, 3648, 512, 512]
    - [0, 8.975]
  - - [3776, 2752, 1, 512, 3776, 3776, 512, 512]
    - [0, 8.996]
  - - [3904, 2752, 1, 512, 3904, 3904, 512, 512]
    - [0, 8.972]
  - - [4032, 2752, 1, 512, 4032, 4032, 512, 512]
    - [0, 9.043]
  - - [64, 2880, 1, 512, 64, 64, 512, 512]
    - [0, 7.633]
  - - [192, 2880, 1, 512, 192, 192, 512, 512]
    - [0, 8.166]
  - - [320, 2880, 1, 512, 320, 320, 512, 512]
    - [0, 8.481]
  - - [448, 2880, 1, 512, 448, 448, 512, 512]
    - [0, 8.686]
  - - [576, 2880, 1, 512, 576, 576, 512, 512]
    - [0, 8.731]
  - - [704, 2880, 1, 512, 704, 704, 512, 512]
    - [0, 8.783]
  - - [832, 2880, 1, 512, 832, 832, 512, 512]
    - [0, 8.845]
  - - [960, 2880, 1, 512, 960, 960, 512, 512]
    - [0, 8.848]
  - - [1088, 2880, 1, 512, 1088, 1088, 512, 512]
    - [0, 8.768]
  - - [1216, 2880, 1, 512, 1216, 1216, 512, 512]
    - [0, 8.77]
  - - [1344, 2880, 1, 512, 1344, 1344, 512, 512]
    - [0, 8.784]
  - - [1472, 2880, 1, 512, 1472, 1472, 512, 512]
    - [0, 8.855]
  - - [1600, 2880, 1, 512, 1600, 1600, 512, 512]
    - [0, 8.844]
  - - [1728, 2880, 1, 512, 1728, 1728, 512, 512]
    - [0, 8.844]
  - - [1856, 2880, 1, 512, 1856, 1856, 512, 512]
    - [0, 8.847]
  - - [1984, 2880, 1, 512, 1984, 1984, 512, 512]
    - [0, 8.876]
  - - [2112, 2880, 1, 512, 2112, 2112, 512, 512]
    - [0, 8.873]
  - - [2240, 2880, 1, 512, 2240, 2240, 512, 512]
    - [0, 8.913]
  - - [2368, 2880, 1, 512, 2368, 2368, 512, 512]
    - [0, 8.998]
  - - [2496, 2880, 1, 512, 2496, 2496, 512, 512]
    - [0, 9.014]
  - - [2624, 2880, 1, 512, 2624, 2624, 512, 512]
    - [0, 8.986]
  - - [2752, 2880, 1, 512, 2752, 2752, 512, 512]
    - [0, 8.983]
  - - [2880, 2880, 1, 512, 2880, 2880, 512, 512]
    - [0, 9.023]
  - - [3008, 2880, 1, 512, 3008, 3008, 512, 512]
    - [0, 8.935]
  - - [3136, 2880, 1, 512, 3136, 3136, 512, 512]
    - [0, 8.961]
  - - [3264, 2880, 1, 512, 3264, 3264, 512, 512]
    - [0, 8.964]
  - - [3392, 2880, 1, 512, 3392, 3392, 512, 512]
    - [0, 8.952]
  - - [3520, 2880, 1, 512, 3520, 3520, 512, 512]
    - [0, 8.96]
  - - [3648, 2880, 1, 512, 3648, 3648, 512, 512]
    - [0, 9.011]
  - - [3776, 2880, 1, 512, 3776, 3776, 512, 512]
    - [0, 8.991]
  - - [3904, 2880, 1, 512, 3904, 3904, 512, 512]
    - [0, 9.02]
  - - [4032, 2880, 1, 512, 4032, 4032, 512, 512]
    - [0, 9.01]
  - - [64, 3008, 1, 512, 64, 64, 512, 512]
    - [0, 6.986]
  - - [192, 3008, 1, 512, 192, 192, 512, 512]
    - [0, 8.143]
  - - [320, 3008, 1, 512, 320, 320, 512, 512]
    - [0, 8.376]
  - - [448, 3008, 1, 512, 448, 448, 512, 512]
    - [0, 8.643]
  - - [576, 3008, 1, 512, 576, 576, 512, 512]
    - [0, 8.709]
  - - [704, 3008, 1, 512, 704, 704, 512, 512]
    - [0, 8.785]
  - - [832, 3008, 1, 512, 832, 832, 512, 512]
    - [0, 8.843]
  - - [960, 3008, 1, 512, 960, 960, 512, 512]
    - [0, 8.668]
  - - [1088, 3008, 1, 512, 1088, 1088, 512, 512]
    - [0, 8.735]
  - - [1216, 3008, 1, 512, 1216, 1216, 512, 512]
    - [0, 8.801]
  - - [1344, 3008, 1, 512, 1344, 1344, 512, 512]
    - [0, 8.793]
  - - [1472, 3008, 1, 512, 1472, 1472, 512, 512]
    - [0, 8.896]
  - - [1600, 3008, 1, 512, 1600, 1600, 512, 512]
    - [0, 8.91]
  - - [1728, 3008, 1, 512, 1728, 1728, 512, 512]
    - [0, 8.986]
  - - [1856, 3008, 1, 512, 1856, 1856, 512, 512]
    - [0, 8.883]
  - - [1984, 3008, 1, 512, 1984, 1984, 512, 512]
    - [0, 8.915]
  - - [2112, 3008, 1, 512, 2112, 2112, 512, 512]
    - [0, 8.999]
  - - [2240, 3008, 1, 512, 2240, 2240, 512, 512]
    - [0, 8.954]
  - - [2368, 3008, 1, 512, 2368, 2368, 512, 512]
    - [0, 9.095]
  - - [2496, 3008, 1, 512, 2496, 2496, 512, 512]
    - [0, 8.989]
  - - [2624, 3008, 1, 512, 2624, 2624, 512, 512]
    - [0, 8.91]
  - - [2752, 3008, 1, 512, 2752, 2752, 512, 512]
    - [0, 9.097]
  - - [2880, 3008, 1, 512, 2880, 2880, 512, 512]
    - [0, 9.014]
  - - [3008, 3008, 1, 512, 3008, 3008, 512, 512]
    - [0, 9.014]
  - - [3136, 3008, 1, 512, 3136, 3136, 512, 512]
    - [0, 8.988]
  - - [3264, 3008, 1, 512, 3264, 3264, 512, 512]
    - [0, 9.039]
  - - [3392, 3008, 1, 512, 3392, 3392, 512, 512]
    - [0, 8.976]
  - - [3520, 3008, 1, 512, 3520, 3520, 512, 512]
    - [0, 8.948]
  - - [3648, 3008, 1, 512, 3648, 3648, 512, 512]
    - [0, 9.044]
  - - [3776, 3008, 1, 512, 3776, 3776, 512, 512]
    - [0, 9.017]
  - - [3904, 3008, 1, 512, 3904, 3904, 512, 512]
    - [0, 8.978]
  - - [4032, 3008, 1, 512, 4032, 4032, 512, 512]
    - [0, 8.971]
  - - [64, 3136, 1, 512, 64, 64, 512, 512]
    - [0, 6.196]
  - - [192, 3136, 1, 512, 192, 192, 512, 512]
    - [0, 8.113]
  - - [320, 3136, 1, 512, 320, 320, 512, 512]
    - [0, 8.468]
  - - [448, 3136, 1, 512, 448, 448, 512, 512]
    - [0, 8.654]
  - - [576, 3136, 1, 512, 576, 576, 512, 512]
    - [0, 8.738]
  - - [704, 3136, 1, 512, 704, 704, 512, 512]
    - [0, 8.784]
  - - [832, 3136, 1, 512, 832, 832, 512, 512]
    - [0, 8.851]
  - - [960, 3136, 1, 512, 960, 960, 512, 512]
    - [0, 8.722]
  - - [1088, 3136, 1, 512, 1088, 1088, 512, 512]
    - [0, 8.74]
  - - [1216, 3136, 1, 512, 1216, 1216, 512, 512]
    - [0, 8.85]
  - - [1344, 3136, 1, 512, 1344, 1344, 512, 512]
    - [0, 8.86]
  - - [1472, 3136, 1, 512, 1472, 1472, 512, 512]
    - [0, 8.89]
  - - [1600, 3136, 1, 512, 1600, 1600, 512, 512]
    - [0, 8.847]
  - - [1728, 3136, 1, 512, 1728, 1728, 512, 512]
    - [0, 8.914]
  - - [1856, 3136, 1, 512, 1856, 1856, 512, 512]
    - [0, 8.915]
  - - [1984, 3136, 1, 512, 1984, 1984, 512, 512]
    - [0, 8.951]
  - - [2112, 3136, 1, 512, 2112, 2112, 512, 512]
    - [0, 8.938]
  - - [2240, 3136, 1, 512, 2240, 2240, 512, 512]
    - [0, 8.899]
  - - [2368, 3136, 1, 512, 2368, 2368, 512, 512]
    - [0, 8.912]
  - - [2496, 3136, 1, 512, 2496, 2496, 512, 512]
    - [0, 8.964]
  - - [2624, 3136, 1, 512, 2624, 2624, 512, 512]
    - [0, 8.941]
  - - [2752, 3136, 1, 512, 2752, 2752, 512, 512]
    - [0, 9.044]
  - - [2880, 3136, 1, 512, 2880, 2880, 512, 512]
    - [0, 8.95]
  - - [3008, 3136, 1, 512, 3008, 3008, 512, 512]
    - [0, 8.945]
  - - [3136, 3136, 1, 512, 3136, 3136, 512, 512]
    - [0, 8.954]
  - - [3264, 3136, 1, 512, 3264, 3264, 512, 512]
    - [0, 8.988]
  - - [3392, 3136, 1, 512, 3392, 3392, 512, 512]
    - [0, 9.044]
  - - [3520, 3136, 1, 512, 3520, 3520, 512, 512]
    - [0, 8.973]
  - - [3648, 3136, 1, 512, 3648, 3648, 512, 512]
    - [0, 9.059]
  - - [3776, 3136, 1, 512, 3776, 3776, 512, 512]
    - [0, 9.033]
  - - [3904, 3136, 1, 512, 3904, 3904, 512, 512]
    - [0, 8.971]
  - - [4032, 3136, 1, 512, 4032, 4032, 512, 512]
    - [0, 9.0]
  - - [64, 3264, 1, 512, 64, 64, 512, 512]
    - [3, 5.89]
  - - [192, 3264, 1, 512, 192, 192, 512, 512]
    - [0, 8.082]
  - - [320, 3264, 1, 512, 320, 320, 512, 512]
    - [0, 8.562]
  - - [448, 3264, 1, 512, 448, 448, 512, 512]
    - [0, 8.666]
  - - [576, 3264, 1, 512, 576, 576, 512, 512]
    - [0, 8.781]
  - - [704, 3264, 1, 512, 704, 704, 512, 512]
    - [0, 8.839]
  - - [832, 3264, 1, 512, 832, 832, 512, 512]
    - [0, 8.826]
  - - [960, 3264, 1, 512, 960, 960, 512, 512]
    - [0, 8.758]
  - - [1088, 3264, 1, 512, 1088, 1088, 512, 512]
    - [0, 8.854]
  - - [1216, 3264, 1, 512, 1216, 1216, 512, 512]
    - [0, 8.825]
  - - [1344, 3264, 1, 512, 1344, 1344, 512, 512]
    - [0, 8.873]
  - - [1472, 3264, 1, 512, 1472, 1472, 512, 512]
    - [0, 8.954]
  - - [1600, 3264, 1, 512, 1600, 1600, 512, 512]
    - [0, 8.888]
  - - [1728, 3264, 1, 512, 1728, 1728, 512, 512]
    - [0, 8.906]
  - - [1856, 3264, 1, 512, 1856, 1856, 512, 512]
    - [0, 8.913]
  - - [1984, 3264, 1, 512, 1984, 1984, 512, 512]
    - [0, 8.906]
  - - [2112, 3264, 1, 512, 2112, 2112, 512, 512]
    - [0, 8.958]
  - - [2240, 3264, 1, 512, 2240, 2240, 512, 512]
    - [0, 8.916]
  - - [2368, 3264, 1, 512, 2368, 2368, 512, 512]
    - [0, 9.018]
  - - [2496, 3264, 1, 512, 2496, 2496, 512, 512]
    - [0, 8.988]
  - - [2624, 3264, 1, 512, 2624, 2624, 512, 512]
    - [0, 8.95]
  - - [2752, 3264, 1, 512, 2752, 2752, 512, 512]
    - [0, 8.978]
  - - [2880, 3264, 1, 512, 2880, 2880, 512, 512]
    - [0, 8.981]
  - - [3008, 3264, 1, 512, 3008, 3008, 512, 512]
    - [0, 8.96]
  - - [3136, 3264, 1, 512, 3136, 3136, 512, 512]
    - [0, 9.002]
  - - [3264, 3264, 1, 512, 3264, 3264, 512, 512]
    - [0, 9.05]
  - - [3392, 3264, 1, 512, 3392, 3392, 512, 512]
    - [0, 9.008]
  - - [3520, 3264, 1, 512, 3520, 3520, 512, 512]
    - [0, 8.987]
  - - [3648, 3264, 1, 512, 3648, 3648, 512, 512]
    - [0, 9.007]
  - - [3776, 3264, 1, 512, 3776, 3776, 512, 512]
    - [0, 9.038]
  - - [3904, 3264, 1, 512, 3904, 3904, 512, 512]
    - [0, 9.093]
  - - [4032, 3264, 1, 512, 4032, 4032, 512, 512]
    - [0, 8.986]
  - - [64, 3392, 1, 512, 64, 64, 512, 512]
    - [2, 5.968]
  - - [192, 3392, 1, 512, 192, 192, 512, 512]
    - [0, 8.065]
  - - [320, 3392, 1, 512, 320, 320, 512, 512]
    - [0, 8.518]
  - - [448, 3392, 1, 512, 448, 448, 512, 512]
    - [0, 8.655]
  - - [576, 3392, 1, 512, 576, 576, 512, 512]
    - [0, 8.754]
  - - [704, 3392, 1, 512, 704, 704, 512, 512]
    - [0, 8.818]
  - - [832, 3392, 1, 512, 832, 832, 512, 512]
    - [0, 8.861]
  - - [960, 3392, 1, 512, 960, 960, 512, 512]
    - [0, 8.84]
  - - [1088, 3392, 1, 512, 1088, 1088, 512, 512]
    - [0, 8.841]
  - - [1216, 3392, 1, 512, 1216, 1216, 512, 512]
    - [0, 8.895]
  - - [1344, 3392, 1, 512, 1344, 1344, 512, 512]
    - [0, 8.871]
  - - [1472, 3392, 1, 512, 1472, 1472, 512, 512]
    - [0, 8.895]
  - - [1600, 3392, 1, 512, 1600, 1600, 512, 512]
    - [0, 8.853]
  - - [1728, 3392, 1, 512, 1728, 1728, 512, 512]
    - [0, 8.874]
  - - [1856, 3392, 1, 512, 1856, 1856, 512, 512]
    - [0, 8.918]
  - - [1984, 3392, 1, 512, 1984, 1984, 512, 512]
    - [0, 8.926]
  - - [2112, 3392, 1, 512, 2112, 2112, 512, 512]
    - [0, 8.907]
  - - [2240, 3392, 1, 512, 2240, 2240, 512, 512]
    - [0, 8.985]
  - - [2368, 3392, 1, 512, 2368, 2368, 512, 512]
    - [0, 8.999]
  - - [2496, 3392, 1, 512, 2496, 2496, 512, 512]
    - [0, 8.943]
  - - [2624, 3392, 1, 512, 2624, 2624, 512, 512]
    - [0, 8.949]
  - - [2752, 3392, 1, 512, 2752, 2752, 512, 512]
    - [0, 8.97]
  - - [2880, 3392, 1, 512, 2880, 2880, 512, 512]
    - [0, 9.017]
  - - [3008, 3392, 1, 512, 3008, 3008, 512, 512]
    - [0, 8.986]
  - - [3136, 3392, 1, 512, 3136, 3136, 512, 512]
    - [0, 9.027]
  - - [3264, 3392, 1, 512, 3264, 3264, 512, 512]
    - [0, 8.998]
  - - [3392, 3392, 1, 512, 3392, 3392, 512, 512]
    - [0, 9.025]
  - - [3520, 3392, 1, 512, 3520, 3520, 512, 512]
    - [0, 9.006]
  - - [3648, 3392, 1, 512, 3648, 3648, 512, 512]
    - [0, 8.987]
  - - [3776, 3392, 1, 512, 3776, 3776, 512, 512]
    - [0, 8.989]
  - - [3904, 3392, 1, 512, 3904, 3904, 512, 512]
    - [0, 9.072]
  - - [4032, 3392, 1, 512, 4032, 4032, 512, 512]
    - [0, 9.052]
  - - [64, 3520, 1, 512, 64, 64, 512, 512]
    - [3, 6.118]
  - - [192, 3520, 1, 512, 192, 192, 512, 512]
    - [0, 8.304]
  - - [320, 3520, 1, 512, 320, 320, 512, 512]
    - [0, 8.538]
  - - [448, 3520, 1, 512, 448, 448, 512, 512]
    - [0, 8.638]
  - - [576, 3520, 1, 512, 576, 576, 512, 512]
    - [0, 8.76]
  - - [704, 3520, 1, 512, 704, 704, 512, 512]
    - [0, 8.817]
  - - [832, 3520, 1, 512, 832, 832, 512, 512]
    - [0, 8.761]
  - - [960, 3520, 1, 512, 960, 960, 512, 512]
    - [0, 8.844]
  - - [1088, 3520, 1, 512, 1088, 1088, 512, 512]
    - [0, 8.789]
  - - [1216, 3520, 1, 512, 1216, 1216, 512, 512]
    - [0, 8.851]
  - - [1344, 3520, 1, 512, 1344, 1344, 512, 512]
    - [0, 8.86]
  - - [1472, 3520, 1, 512, 1472, 1472, 512, 512]
    - [0, 8.861]
  - - [1600, 3520, 1, 512, 1600, 1600, 512, 512]
    - [0, 8.89]
  - - [1728, 3520, 1, 512, 1728, 1728, 512, 512]
    - [0, 8.953]
  - - [1856, 3520, 1, 512, 1856, 1856, 512, 512]
    - [0, 8.907]
  - - [1984, 3520, 1, 512, 1984, 1984, 512, 512]
    - [0, 8.898]
  - - [2112, 3520, 1, 512, 2112, 2112, 512, 512]
    - [0, 9.003]
  - - [2240, 3520, 1, 512, 2240, 2240, 512, 512]
    - [0, 9.004]
  - - [2368, 3520, 1, 512, 2368, 2368, 512, 512]
    - [0, 8.982]
  - - [2496, 3520, 1, 512, 2496, 2496, 512, 512]
    - [0, 9.066]
  - - [2624, 3520, 1, 512, 2624, 2624, 512, 512]
    - [0, 8.975]
  - - [2752, 3520, 1, 512, 2752, 2752, 512, 512]
    - [0, 9.06]
  - - [2880, 3520, 1, 512, 2880, 2880, 512, 512]
    - [0, 9.004]
  - - [3008, 3520, 1, 512, 3008, 3008, 512, 512]
    - [0, 8.95]
  - - [3136, 3520, 1, 512, 3136, 3136, 512, 512]
    - [0, 8.956]
  - - [3264, 3520, 1, 512, 3264, 3264, 512, 512]
    - [0, 9.067]
  - - [3392, 3520, 1, 512, 3392, 3392, 512, 512]
    - [0, 8.967]
  - - [3520, 3520, 1, 512, 3520, 3520, 512, 512]
    - [0, 8.97]
  - - [3648, 3520, 1, 512, 3648, 3648, 512, 512]
    - [0, 9.009]
  - - [3776, 3520, 1, 512, 3776, 3776, 512, 512]
    - [0, 9.077]
  - - [3904, 3520, 1, 512, 3904, 3904, 512, 512]
    - [0, 8.989]
  - - [4032, 3520, 1, 512, 4032, 4032, 512, 512]
    - [0, 9.126]
  - - [64, 3648, 1, 512, 64, 64, 512, 512]
    - [0, 7.55]
  - - [192, 3648, 1, 512, 192, 192, 512, 512]
    - [0, 8.282]
  - - [320, 3648, 1, 512, 320, 320, 512, 512]
    - [0, 8.588]
  - - [448, 3648, 1, 512, 448, 448, 512, 512]
    - [0, 8.732]
  - - [576, 3648, 1, 512, 576, 576, 512, 512]
    - [0, 8.795]
  - - [704, 3648, 1, 512, 704, 704, 512, 512]
    - [0, 8.811]
  - - [832, 3648, 1, 512, 832, 832, 512, 512]
    - [0, 8.722]
  - - [960, 3648, 1, 512, 960, 960, 512, 512]
    - [0, 8.775]
  - - [1088, 3648, 1, 512, 1088, 1088, 512, 512]
    - [0, 8.825]
  - - [1216, 3648, 1, 512, 1216, 1216, 512, 512]
    - [0, 8.926]
  - - [1344, 3648, 1, 512, 1344, 1344, 512, 512]
    - [0, 8.865]
  - - [1472, 3648, 1, 512, 1472, 1472, 512, 512]
    - [0, 8.887]
  - - [1600, 3648, 1, 512, 1600, 1600, 512, 512]
    - [0, 8.916]
  - - [1728, 3648, 1, 512, 1728, 1728, 512, 512]
    - [0, 8.878]
  - - [1856, 3648, 1, 512, 1856, 1856, 512, 512]
    - [0, 8.955]
  - - [1984, 3648, 1, 512, 1984, 1984, 512, 512]
    - [0, 8.947]
  - - [2112, 3648, 1, 512, 2112, 2112, 512, 512]
    - [0, 9.061]
  - - [2240, 3648, 1, 512, 2240, 2240, 512, 512]
    - [0, 9.035]
  - - [2368, 3648, 1, 512, 2368, 2368, 512, 512]
    - [0, 9.021]
  - - [2496, 3648, 1, 512, 2496, 2496, 512, 512]
    - [0, 8.973]
  - - [2624, 3648, 1, 512, 2624, 2624, 512, 512]
    - [0, 8.97]
  - - [2752, 3648, 1, 512, 2752, 2752, 512, 512]
    - [0, 8.992]
  - - [2880, 3648, 1, 512, 2880, 2880, 512, 512]
    - [0, 8.972]
  - - [3008, 3648, 1, 512, 3008, 3008, 512, 512]
    - [0, 9.003]
  - - [3136, 3648, 1, 512, 3136, 3136, 512, 512]
    - [0, 9.039]
  - - [3264, 3648, 1, 512, 3264, 3264, 512, 512]
    - [0, 9.038]
  - - [3392, 3648, 1, 512, 3392, 3392, 512, 512]
    - [0, 9.06]
  - - [3520, 3648, 1, 512, 3520, 3520, 512, 512]
    - [0, 9.013]
  - - [3648, 3648, 1, 512, 3648, 3648, 512, 512]
    - [0, 9.015]
  - - [3776, 3648, 1, 512, 3776, 3776, 512, 512]
    - [0, 9.008]
  - - [3904, 3648, 1, 512, 3904, 3904, 512, 512]
    - [0, 9.05]
  - - [4032, 3648, 1, 512, 4032, 4032, 512, 512]
    - [0, 9.009]
  - - [64, 3776, 1, 512, 64, 64, 512, 512]
    - [0, 6.472]
  - - [192, 3776, 1, 512, 192, 192, 512, 512]
    - [0, 8.255]
  - - [320, 3776, 1, 512, 320, 320, 512, 512]
    - [0, 8.511]
  - - [448, 3776, 1, 512, 448, 448, 512, 512]
    - [0, 8.648]
  - - [576, 3776, 1, 512, 576, 576, 512, 512]
    - [0, 8.828]
  - - [704, 3776, 1, 512, 704, 704, 512, 512]
    - [0, 8.834]
  - - [832, 3776, 1, 512, 832, 832, 512, 512]
    - [0, 8.746]
  - - [960, 3776, 1, 512, 960, 960, 512, 512]
    - [0, 8.807]
  - - [1088, 3776, 1, 512, 1088, 1088, 512, 512]
    - [0, 8.829]
  - - [1216, 3776, 1, 512, 1216, 1216, 512, 512]
    - [0, 8.92]
  - - [1344, 3776, 1, 512, 1344, 1344, 512, 512]
    - [0, 8.906]
  - - [1472, 3776, 1, 512, 1472, 1472, 512, 512]
    - [0, 8.872]
  - - [1600, 3776, 1, 512, 1600, 1600, 512, 512]
    - [0, 9.012]
  - - [1728, 3776, 1, 512, 1728, 1728, 512, 512]
    - [0, 8.92]
  - - [1856, 3776, 1, 512, 1856, 1856, 512, 512]
    - [0, 8.977]
  - - [1984, 3776, 1, 512, 1984, 1984, 512, 512]
    - [0, 8.943]
  - - [2112, 3776, 1, 512, 2112, 2112, 512, 512]
    - [0, 8.989]
  - - [2240, 3776, 1, 512, 2240, 2240, 512, 512]
    - [0, 8.989]
  - - [2368, 3776, 1, 512, 2368, 2368, 512, 512]
    - [0, 9.04]
  - - [2496, 3776, 1, 512, 2496, 2496, 512, 512]
    - [0, 8.99]
  - - [2624, 3776, 1, 512, 2624, 2624, 512, 512]
    - [0, 8.952]
  - - [2752, 3776, 1, 512, 2752, 2752, 512, 512]
    - [0, 8.959]
  - - [2880, 3776, 1, 512, 2880, 2880, 512, 512]
    - [0, 8.986]
  - - [3008, 3776, 1, 512, 3008, 3008, 512, 512]
    - [0, 9.009]
  - - [3136, 3776, 1, 512, 3136, 3136, 512, 512]
    - [0, 8.988]
  - - [3264, 3776, 1, 512, 3264, 3264, 512, 512]
    - [0, 9.035]
  - - [3392, 3776, 1, 512, 3392, 3392, 512, 512]
    - [0, 9.01]
  - - [3520, 3776, 1, 512, 3520, 3520, 512, 512]
    - [0, 8.997]
  - - [3648, 3776, 1, 512, 3648, 3648, 512, 512]
    - [0, 9.018]
  - - [3776, 3776, 1, 512, 3776, 3776, 512, 512]
    - [0, 9.022]
  - - [3904, 3776, 1, 512, 3904, 3904, 512, 512]
    - [0, 9.02]
  - - [4032, 3776, 1, 512, 4032, 4032, 512, 512]
    - [0, 9.084]
  - - [64, 3904, 1, 512, 64, 64, 512, 512]
    - [2, 5.974]
  - - [192, 3904, 1, 512, 192, 192, 512, 512]
    - [0, 8.227]
  - - [320, 3904, 1, 512, 320, 320, 512, 512]
    - [0, 8.602]
  - - [448, 3904, 1, 512, 448, 448, 512, 512]
    - [0, 8.75]
  - - [576, 3904, 1, 512, 576, 576, 512, 512]
    - [0, 8.815]
  - - [704, 3904, 1, 512, 704, 704, 512, 512]
    - [0, 8.903]
  - - [832, 3904, 1, 512, 832, 832, 512, 512]
    - [0, 8.747]
  - - [960, 3904, 1, 512, 960, 960, 512, 512]
    - [0, 8.773]
  - - [1088, 3904, 1, 512, 1088, 1088, 512, 512]
    - [0, 8.895]
  - - [1216, 3904, 1, 512, 1216, 1216, 512, 512]
    - [0, 8.893]
  - - [1344, 3904, 1, 512, 1344, 1344, 512, 512]
    - [0, 8.917]
  - - [1472, 3904, 1, 512, 1472, 1472, 512, 512]
    - [0, 8.962]
  - - [1600, 3904, 1, 512, 1600, 1600, 512, 512]
    - [0, 8.88]
  - - [1728, 3904, 1, 512, 1728, 1728, 512, 512]
    - [0, 8.997]
  - - [1856, 3904, 1, 512, 1856, 1856, 512, 512]
    - [0, 8.967]
  - - [1984, 3904, 1, 512, 1984, 1984, 512, 512]
    - [0, 8.946]
  - - [2112, 3904, 1, 512, 2112, 2112, 512, 512]
    - [0, 9.031]
  - - [2240, 3904, 1, 512, 2240, 2240, 512, 512]
    - [0, 8.962]
  - - [2368, 3904, 1, 512, 2368, 2368, 512, 512]
    - [0, 9.004]
  - - [2496, 3904, 1, 512, 2496, 2496, 512, 512]
    - [0, 9.085]
  - - [2624, 3904, 1, 512, 2624, 2624, 512, 512]
    - [0, 9.022]
  - - [2752, 3904, 1, 512, 2752, 2752, 512, 512]
    - [0, 8.987]
  - - [2880, 3904, 1, 512, 2880, 2880, 512, 512]
    - [0, 9.087]
  - - [3008, 3904, 1, 512, 3008, 3008, 512, 512]
    - [0, 8.978]
  - - [3136, 3904, 1, 512, 3136, 3136, 512, 512]
    - [0, 8.978]
  - - [3264, 3904, 1, 512, 3264, 3264, 512, 512]
    - [0, 9.008]
  - - [3392, 3904, 1, 512, 3392, 3392, 512, 512]
    - [0, 8.977]
  - - [3520, 3904, 1, 512, 3520, 3520, 512, 512]
    - [0, 9.001]
  - - [3648, 3904, 1, 512, 3648, 3648, 512, 512]
    - [0, 9.08]
  - - [3776, 3904, 1, 512, 3776, 3776, 512, 512]
    - [0, 9.047]
  - - [3904, 3904, 1, 512, 3904, 3904, 512, 512]
    - [0, 9.096]
  - - [4032, 3904, 1, 512, 4032, 4032, 512, 512]
    - [0, 9.018]
  - - [64, 4032, 1, 512, 64, 64, 512, 512]
    - [0, 7.549]
  - - [192, 4032, 1, 512, 192, 192, 512, 512]
    - [0, 8.217]
  - - [320, 4032, 1, 512, 320, 320, 512, 512]
    - [0, 8.633]
  - - [448, 4032, 1, 512, 448, 448, 512, 512]
    - [0, 8.728]
  - - [576, 4032, 1, 512, 576, 576, 512, 512]
    - [0, 8.797]
  - - [704, 4032, 1, 512, 704, 704, 512, 512]
    - [0, 8.848]
  - - [832, 4032, 1, 512, 832, 832, 512, 512]
    - [0, 8.79]
  - - [960, 4032, 1, 512, 960, 960, 512, 512]
    - [0, 8.788]
  - - [1088, 4032, 1, 512, 1088, 1088, 512, 512]
    - [0, 8.812]
  - - [1216, 4032, 1, 512, 1216, 1216, 512, 512]
    - [0, 8.834]
  - - [1344, 4032, 1, 512, 1344, 1344, 512, 512]
    - [0, 8.966]
  - - [1472, 4032, 1, 512, 1472, 1472, 512, 512]
    - [0, 8.903]
  - - [1600, 4032, 1, 512, 1600, 1600, 512, 512]
    - [0, 8.909]
  - - [1728, 4032, 1, 512, 1728, 1728, 512, 512]
    - [0, 8.945]
  - - [1856, 4032, 1, 512, 1856, 1856, 512, 512]
    - [0, 8.943]
  - - [1984, 4032, 1, 512, 1984, 1984, 512, 512]
    - [0, 9.009]
  - - [2112, 4032, 1, 512, 2112, 2112, 512, 512]
    - [0, 8.993]
  - - [2240, 4032, 1, 512, 2240, 2240, 512, 512]
    - [0, 9.007]
  - - [2368, 4032, 1, 512, 2368, 2368, 512, 512]
    - [0, 8.999]
  - - [2496, 4032, 1, 512, 2496, 2496, 512, 512]
    - [0, 8.986]
  - - [2624, 4032, 1, 512, 2624, 2624, 512, 512]
    - [0, 8.987]
  - - [2752, 4032, 1, 512, 2752, 2752, 512, 512]
    - [0, 8.986]
  - - [2880, 4032, 1, 512, 2880, 2880, 512, 512]
    - [0, 8.997]
  - - [3008, 4032, 1, 512, 3008, 3008, 512, 512]
    - [0, 9.019]
  - - [3136, 4032, 1, 512, 3136, 3136, 512, 512]
    - [0, 9.133]
  - - [3264, 4032, 1, 512, 3264, 3264, 512, 512]
    - [0, 8.98]
  - - [3392, 4032, 1, 512, 3392, 3392, 512, 512]
    - [0, 9.08]
  - - [3520, 4032, 1, 512, 3520, 3520, 512, 512]
    - [0, 9.017]
  - - [3648, 4032, 1, 512, 3648, 3648, 512, 512]
    - [0, 8.979]
  - - [3776, 4032, 1, 512, 3776, 3776, 512, 512]
    - [0, 9.084]
  - - [3904, 4032, 1, 512, 3904, 3904, 512, 512]
    - [0, 9.122]
  - - [4032, 4032, 1, 512, 4032, 4032, 512, 512]
    - [0, 8.979]
  - - [64, 64, 1, 1024, 64, 64, 1024, 1024]
    - [1, 1.115]
  - - [192, 64, 1, 1024, 192, 192, 1024, 1024]
    - [3, 2.813]
  - - [320, 64, 1, 1024, 320, 320, 1024, 1024]
    - [0, 3.822]
  - - [448, 64, 1, 1024, 448, 448, 1024, 1024]
    - [0, 5.321]
  - - [576, 64, 1, 1024, 576, 576, 1024, 1024]
    - [0, 4.261]
  - - [704, 64, 1, 1024, 704, 704, 1024, 1024]
    - [0, 5.191]
  - - [832, 64, 1, 1024, 832, 832, 1024, 1024]
    - [0, 6.119]
  - - [960, 64, 1, 1024, 960, 960, 1024, 1024]
    - [0, 7.05]
  - - [1088, 64, 1, 1024, 1088, 1088, 1024, 1024]
    - [0, 5.732]
  - - [1216, 64, 1, 1024, 1216, 1216, 1024, 1024]
    - [0, 6.392]
  - - [1344, 64, 1, 1024, 1344, 1344, 1024, 1024]
    - [0, 7.046]
  - - [1472, 64, 1, 1024, 1472, 1472, 1024, 1024]
    - [0, 6.081]
  - - [1600, 64, 1, 1024, 1600, 1600, 1024, 1024]
    - [0, 6.573]
  - - [1728, 64, 1, 1024, 1728, 1728, 1024, 1024]
    - [0, 7.079]
  - - [1856, 64, 1, 1024, 1856, 1856, 1024, 1024]
    - [0, 7.593]
  - - [1984, 64, 1, 1024, 1984, 1984, 1024, 1024]
    - [0, 6.687]
  - - [2112, 64, 1, 1024, 2112, 2112, 1024, 1024]
    - [0, 7.098]
  - - [2240, 64, 1, 1024, 2240, 2240, 1024, 1024]
    - [0, 7.517]
  - - [2368, 64, 1, 1024, 2368, 2368, 1024, 1024]
    - [0, 7.951]
  - - [2496, 64, 1, 1024, 2496, 2496, 1024, 1024]
    - [0, 6.647]
  - - [2624, 64, 1, 1024, 2624, 2624, 1024, 1024]
    - [0, 6.838]
  - - [2752, 64, 1, 1024, 2752, 2752, 1024, 1024]
    - [0, 7.131]
  - - [2880, 64, 1, 1024, 2880, 2880, 1024, 1024]
    - [0, 7.423]
  - - [3008, 64, 1, 1024, 3008, 3008, 1024, 1024]
    - [0, 7.103]
  - - [3136, 64, 1, 1024, 3136, 3136, 1024, 1024]
    - [0, 7.387]
  - - [3264, 64, 1, 1024, 3264, 3264, 1024, 1024]
    - [0, 7.683]
  - - [3392, 64, 1, 1024, 3392, 3392, 1024, 1024]
    - [0, 7.157]
  - - [3520, 64, 1, 1024, 3520, 3520, 1024, 1024]
    - [0, 7.374]
  - - [3648, 64, 1, 1024, 3648, 3648, 1024, 1024]
    - [0, 7.642]
  - - [3776, 64, 1, 1024, 3776, 3776, 1024, 1024]
    - [0, 7.912]
  - - [3904, 64, 1, 1024, 3904, 3904, 1024, 1024]
    - [0, 7.385]
  - - [4032, 64, 1, 1024, 4032, 4032, 1024, 1024]
    - [0, 7.598]
  - - [64, 192, 1, 1024, 64, 64, 1024, 1024]
    - [3, 2.82]
  - - [192, 192, 1, 1024, 192, 192, 1024, 1024]
    - [0, 4.245]
  - - [320, 192, 1, 1024, 320, 320, 1024, 1024]
    - [0, 7.029]
  - - [448, 192, 1, 1024, 448, 448, 1024, 1024]
    - [0, 7.087]
  - - [576, 192, 1, 1024, 576, 576, 1024, 1024]
    - [0, 7.102]
  - - [704, 192, 1, 1024, 704, 704, 1024, 1024]
    - [0, 7.123]
  - - [832, 192, 1, 1024, 832, 832, 1024, 1024]
    - [0, 6.76]
  - - [960, 192, 1, 1024, 960, 960, 1024, 1024]
    - [0, 7.462]
  - - [1088, 192, 1, 1024, 1088, 1088, 1024, 1024]
    - [0, 7.685]
  - - [1216, 192, 1, 1024, 1216, 1216, 1024, 1024]
    - [0, 7.637]
  - - [1344, 192, 1, 1024, 1344, 1344, 1024, 1024]
    - [0, 7.613]
  - - [1472, 192, 1, 1024, 1472, 1472, 1024, 1024]
    - [0, 7.579]
  - - [1600, 192, 1, 1024, 1600, 1600, 1024, 1024]
    - [0, 8.198]
  - - [1728, 192, 1, 1024, 1728, 1728, 1024, 1024]
    - [0, 8.139]
  - - [1856, 192, 1, 1024, 1856, 1856, 1024, 1024]
    - [0, 8.064]
  - - [1984, 192, 1, 1024, 1984, 1984, 1024, 1024]
    - [0, 8.026]
  - - [2112, 192, 1, 1024, 2112, 2112, 1024, 1024]
    - [0, 7.983]
  - - [2240, 192, 1, 1024, 2240, 2240, 1024, 1024]
    - [0, 8.427]
  - - [2368, 192, 1, 1024, 2368, 2368, 1024, 1024]
    - [0, 8.356]
  - - [2496, 192, 1, 1024, 2496, 2496, 1024, 1024]
    - [0, 8.293]
  - - [2624, 192, 1, 1024, 2624, 2624, 1024, 1024]
    - [0, 8.253]
  - - [2752, 192, 1, 1024, 2752, 2752, 1024, 1024]
    - [0, 8.213]
  - - [2880, 192, 1, 1024, 2880, 2880, 1024, 1024]
    - [0, 8.541]
  - - [3008, 192, 1, 1024, 3008, 3008, 1024, 1024]
    - [0, 8.488]
  - - [3136, 192, 1, 1024, 3136, 3136, 1024, 1024]
    - [0, 8.442]
  - - [3264, 192, 1, 1024, 3264, 3264, 1024, 1024]
    - [0, 8.409]
  - - [3392, 192, 1, 1024, 3392, 3392, 1024, 1024]
    - [0, 8.354]
  - - [3520, 192, 1, 1024, 3520, 3520, 1024, 1024]
    - [0, 8.632]
  - - [3648, 192, 1, 1024, 3648, 3648, 1024, 1024]
    - [0, 8.585]
  - - [3776, 192, 1, 1024, 3776, 3776, 1024, 1024]
    - [0, 8.537]
  - - [3904, 192, 1, 1024, 3904, 3904, 1024, 1024]
    - [0, 8.495]
  - - [4032, 192, 1, 1024, 4032, 4032, 1024, 1024]
    - [0, 8.461]
  - - [64, 320, 1, 1024, 64, 64, 1024, 1024]
    - [0, 3.829]
  - - [192, 320, 1, 1024, 192, 192, 1024, 1024]
    - [0, 7.03]
  - - [320, 320, 1, 1024, 320, 320, 1024, 1024]
    - [0, 6.573]
  - - [448, 320, 1, 1024, 448, 448, 1024, 1024]
    - [0, 7.54]
  - - [576, 320, 1, 1024, 576, 576, 1024, 1024]
    - [0, 7.421]
  - - [704, 320, 1, 1024, 704, 704, 1024, 1024]
    - [0, 7.384]
  - - [832, 320, 1, 1024, 832, 832, 1024, 1024]
    - [0, 7.838]
  - - [960, 320, 1, 1024, 960, 960, 1024, 1024]
    - [0, 8.204]
  - - [1088, 320, 1, 1024, 1088, 1088, 1024, 1024]
    - [0, 7.883]
  - - [1216, 320, 1, 1024, 1216, 1216, 1024, 1024]
    - [0, 8.171]
  - - [1344, 320, 1, 1024, 1344, 1344, 1024, 1024]
    - [0, 8.409]
  - - [1472, 320, 1, 1024, 1472, 1472, 1024, 1024]
    - [0, 8.158]
  - - [1600, 320, 1, 1024, 1600, 1600, 1024, 1024]
    - [0, 8.364]
  - - [1728, 320, 1, 1024, 1728, 1728, 1024, 1024]
    - [0, 8.551]
  - - [1856, 320, 1, 1024, 1856, 1856, 1024, 1024]
    - [0, 8.329]
  - - [1984, 320, 1, 1024, 1984, 1984, 1024, 1024]
    - [0, 8.491]
  - - [2112, 320, 1, 1024, 2112, 2112, 1024, 1024]
    - [0, 8.633]
  - - [2240, 320, 1, 1024, 2240, 2240, 1024, 1024]
    - [0, 8.459]
  - - [2368, 320, 1, 1024, 2368, 2368, 1024, 1024]
    - [0, 8.567]
  - - [2496, 320, 1, 1024, 2496, 2496, 1024, 1024]
    - [0, 8.687]
  - - [2624, 320, 1, 1024, 2624, 2624, 1024, 1024]
    - [0, 8.529]
  - - [2752, 320, 1, 1024, 2752, 2752, 1024, 1024]
    - [0, 8.637]
  - - [2880, 320, 1, 1024, 2880, 2880, 1024, 1024]
    - [0, 8.735]
  - - [3008, 320, 1, 1024, 3008, 3008, 1024, 1024]
    - [0, 8.61]
  - - [3136, 320, 1, 1024, 3136, 3136, 1024, 1024]
    - [0, 8.681]
  - - [3264, 320, 1, 1024, 3264, 3264, 1024, 1024]
    - [0, 8.767]
  - - [3392, 320, 1, 1024, 3392, 3392, 1024, 1024]
    - [0, 8.641]
  - - [3520, 320, 1, 1024, 3520, 3520, 1024, 1024]
    - [0, 8.732]
  - - [3648, 320, 1, 1024, 3648, 3648, 1024, 1024]
    - [0, 8.786]
  - - [3776, 320, 1, 1024, 3776, 3776, 1024, 1024]
    - [0, 8.704]
  - - [3904, 320, 1, 1024, 3904, 3904, 1024, 1024]
    - [0, 8.759]
  - - [4032, 320, 1, 1024, 4032, 4032, 1024, 1024]
    - [0, 8.815]
  - - [64, 448, 1, 1024, 64, 64, 1024, 1024]
    - [0, 5.325]
  - - [192, 448, 1, 1024, 192, 192, 1024, 1024]
    - [0, 7.082]
  - - [320, 448, 1, 1024, 320, 320, 1024, 1024]
    - [0, 7.535]
  - - [448, 448, 1, 1024, 448, 448, 1024, 1024]
    - [0, 7.406]
  - - [576, 448, 1, 1024, 576, 576, 1024, 1024]
    - [0, 7.635]
  - - [704, 448, 1, 1024, 704, 704, 1024, 1024]
    - [0, 7.75]
  - - [832, 448, 1, 1024, 832, 832, 1024, 1024]
    - [0, 7.854]
  - - [960, 448, 1, 1024, 960, 960, 1024, 1024]
    - [0, 8.417]
  - - [1088, 448, 1, 1024, 1088, 1088, 1024, 1024]
    - [0, 8.424]
  - - [1216, 448, 1, 1024, 1216, 1216, 1024, 1024]
    - [0, 8.432]
  - - [1344, 448, 1, 1024, 1344, 1344, 1024, 1024]
    - [0, 8.431]
  - - [1472, 448, 1, 1024, 1472, 1472, 1024, 1024]
    - [0, 8.44]
  - - [1600, 448, 1, 1024, 1600, 1600, 1024, 1024]
    - [0, 8.451]
  - - [1728, 448, 1, 1024, 1728, 1728, 1024, 1024]
    - [0, 8.463]
  - - [1856, 448, 1, 1024, 1856, 1856, 1024, 1024]
    - [0, 8.482]
  - - [1984, 448, 1, 1024, 1984, 1984, 1024, 1024]
    - [0, 8.707]
  - - [2112, 448, 1, 1024, 2112, 2112, 1024, 1024]
    - [0, 8.706]
  - - [2240, 448, 1, 1024, 2240, 2240, 1024, 1024]
    - [0, 8.683]
  - - [2368, 448, 1, 1024, 2368, 2368, 1024, 1024]
    - [0, 8.675]
  - - [2496, 448, 1, 1024, 2496, 2496, 1024, 1024]
    - [0, 8.537]
  - - [2624, 448, 1, 1024, 2624, 2624, 1024, 1024]
    - [0, 8.678]
  - - [2752, 448, 1, 1024, 2752, 2752, 1024, 1024]
    - [0, 8.671]
  - - [2880, 448, 1, 1024, 2880, 2880, 1024, 1024]
    - [0, 8.818]
  - - [3008, 448, 1, 1024, 3008, 3008, 1024, 1024]
    - [0, 8.808]
  - - [3136, 448, 1, 1024, 3136, 3136, 1024, 1024]
    - [0, 8.806]
  - - [3264, 448, 1, 1024, 3264, 3264, 1024, 1024]
    - [0, 8.547]
  - - [3392, 448, 1, 1024, 3392, 3392, 1024, 1024]
    - [0, 8.645]
  - - [3520, 448, 1, 1024, 3520, 3520, 1024, 1024]
    - [0, 8.672]
  - - [3648, 448, 1, 1024, 3648, 3648, 1024, 1024]
    - [0, 8.663]
  - - [3776, 448, 1, 1024, 3776, 3776, 1024, 1024]
    - [0, 8.654]
  - - [3904, 448, 1, 1024, 3904, 3904, 1024, 1024]
    - [0, 8.738]
  - - [4032, 448, 1, 1024, 4032, 4032, 1024, 1024]
    - [0, 8.737]
  - - [64, 576, 1, 1024, 64, 64, 1024, 1024]
    - [3, 4.507]
  - - [192, 576, 1, 1024, 192, 192, 1024, 1024]
    - [0, 7.101]
  - - [320, 576, 1, 1024, 320, 320, 1024, 1024]
    - [0, 7.422]
  - - [448, 576, 1, 1024, 448, 448, 1024, 1024]
    - [0, 7.62]
  - - [576, 576, 1, 1024, 576, 576, 1024, 1024]
    - [0, 8.133]
  - - [704, 576, 1, 1024, 704, 704, 1024, 1024]
    - [0, 7.975]
  - - [832, 576, 1, 1024, 832, 832, 1024, 1024]
    - [0, 8.293]
  - - [960, 576, 1, 1024, 960, 960, 1024, 1024]
    - [0, 8.545]
  - - [1088, 576, 1, 1024, 1088, 1088, 1024, 1024]
    - [0, 8.394]
  - - [1216, 576, 1, 1024, 1216, 1216, 1024, 1024]
    - [0, 8.574]
  - - [1344, 576, 1, 1024, 1344, 1344, 1024, 1024]
    - [0, 8.455]
  - - [1472, 576, 1, 1024, 1472, 1472, 1024, 1024]
    - [0, 8.608]
  - - [1600, 576, 1, 1024, 1600, 1600, 1024, 1024]
    - [0, 8.731]
  - - [1728, 576, 1, 1024, 1728, 1728, 1024, 1024]
    - [0, 8.635]
  - - [1856, 576, 1, 1024, 1856, 1856, 1024, 1024]
    - [0, 8.731]
  - - [1984, 576, 1, 1024, 1984, 1984, 1024, 1024]
    - [0, 8.65]
  - - [2112, 576, 1, 1024, 2112, 2112, 1024, 1024]
    - [0, 8.737]
  - - [2240, 576, 1, 1024, 2240, 2240, 1024, 1024]
    - [0, 8.806]
  - - [2368, 576, 1, 1024, 2368, 2368, 1024, 1024]
    - [0, 8.741]
  - - [2496, 576, 1, 1024, 2496, 2496, 1024, 1024]
    - [0, 8.632]
  - - [2624, 576, 1, 1024, 2624, 2624, 1024, 1024]
    - [0, 8.75]
  - - [2752, 576, 1, 1024, 2752, 2752, 1024, 1024]
    - [0, 8.674]
  - - [2880, 576, 1, 1024, 2880, 2880, 1024, 1024]
    - [0, 8.739]
  - - [3008, 576, 1, 1024, 3008, 3008, 1024, 1024]
    - [0, 8.658]
  - - [3136, 576, 1, 1024, 3136, 3136, 1024, 1024]
    - [0, 8.768]
  - - [3264, 576, 1, 1024, 3264, 3264, 1024, 1024]
    - [0, 8.707]
  - - [3392, 576, 1, 1024, 3392, 3392, 1024, 1024]
    - [0, 8.748]
  - - [3520, 576, 1, 1024, 3520, 3520, 1024, 1024]
    - [0, 8.8]
  - - [3648, 576, 1, 1024, 3648, 3648, 1024, 1024]
    - [0, 8.761]
  - - [3776, 576, 1, 1024, 3776, 3776, 1024, 1024]
    - [0, 8.794]
  - - [3904, 576, 1, 1024, 3904, 3904, 1024, 1024]
    - [0, 8.843]
  - - [4032, 576, 1, 1024, 4032, 4032, 1024, 1024]
    - [0, 8.801]
  - - [64, 704, 1, 1024, 64, 64, 1024, 1024]
    - [3, 4.935]
  - - [192, 704, 1, 1024, 192, 192, 1024, 1024]
    - [0, 7.114]
  - - [320, 704, 1, 1024, 320, 320, 1024, 1024]
    - [0, 7.385]
  - - [448, 704, 1, 1024, 448, 448, 1024, 1024]
    - [0, 7.751]
  - - [576, 704, 1, 1024, 576, 576, 1024, 1024]
    - [0, 7.98]
  - - [704, 704, 1, 1024, 704, 704, 1024, 1024]
    - [0, 8.147]
  - - [832, 704, 1, 1024, 832, 832, 1024, 1024]
    - [0, 8.255]
  - - [960, 704, 1, 1024, 960, 960, 1024, 1024]
    - [0, 8.617]
  - - [1088, 704, 1, 1024, 1088, 1088, 1024, 1024]
    - [0, 8.661]
  - - [1216, 704, 1, 1024, 1216, 1216, 1024, 1024]
    - [0, 8.673]
  - - [1344, 704, 1, 1024, 1344, 1344, 1024, 1024]
    - [0, 8.708]
  - - [1472, 704, 1, 1024, 1472, 1472, 1024, 1024]
    - [0, 8.72]
  - - [1600, 704, 1, 1024, 1600, 1600, 1024, 1024]
    - [0, 8.743]
  - - [1728, 704, 1, 1024, 1728, 1728, 1024, 1024]
    - [0, 8.737]
  - - [1856, 704, 1, 1024, 1856, 1856, 1024, 1024]
    - [0, 8.739]
  - - [1984, 704, 1, 1024, 1984, 1984, 1024, 1024]
    - [0, 8.752]
  - - [2112, 704, 1, 1024, 2112, 2112, 1024, 1024]
    - [0, 8.625]
  - - [2240, 704, 1, 1024, 2240, 2240, 1024, 1024]
    - [0, 8.646]
  - - [2368, 704, 1, 1024, 2368, 2368, 1024, 1024]
    - [0, 8.668]
  - - [2496, 704, 1, 1024, 2496, 2496, 1024, 1024]
    - [0, 8.676]
  - - [2624, 704, 1, 1024, 2624, 2624, 1024, 1024]
    - [0, 8.698]
  - - [2752, 704, 1, 1024, 2752, 2752, 1024, 1024]
    - [0, 8.742]
  - - [2880, 704, 1, 1024, 2880, 2880, 1024, 1024]
    - [0, 8.783]
  - - [3008, 704, 1, 1024, 3008, 3008, 1024, 1024]
    - [0, 8.8]
  - - [3136, 704, 1, 1024, 3136, 3136, 1024, 1024]
    - [0, 8.8]
  - - [3264, 704, 1, 1024, 3264, 3264, 1024, 1024]
    - [0, 8.806]
  - - [3392, 704, 1, 1024, 3392, 3392, 1024, 1024]
    - [0, 8.861]
  - - [3520, 704, 1, 1024, 3520, 3520, 1024, 1024]
    - [0, 8.834]
  - - [3648, 704, 1, 1024, 3648, 3648, 1024, 1024]
    - [0, 8.83]
  - - [3776, 704, 1, 1024, 3776, 3776, 1024, 1024]
    - [0, 8.821]
  - - [3904, 704, 1, 1024, 3904, 3904, 1024, 1024]
    - [0, 8.829]
  - - [4032, 704, 1, 1024, 4032, 4032, 1024, 1024]
    - [0, 8.911]
  - - [64, 832, 1, 1024, 64, 64, 1024, 1024]
    - [0, 6.111]
  - - [192, 832, 1, 1024, 192, 192, 1024, 1024]
    - [0, 6.643]
  - - [320, 832, 1, 1024, 320, 320, 1024, 1024]
    - [0, 7.831]
  - - [448, 832, 1, 1024, 448, 448, 1024, 1024]
    - [0, 7.876]
  - - [576, 832, 1, 1024, 576, 576, 1024, 1024]
    - [0, 8.292]
  - - [704, 832, 1, 1024, 704, 704, 1024, 1024]
    - [0, 8.251]
  - - [832, 832, 1, 1024, 832, 832, 1024, 1024]
    - [0, 8.49]
  - - [960, 832, 1, 1024, 960, 960, 1024, 1024]
    - [0, 8.692]
  - - [1088, 832, 1, 1024, 1088, 1088, 1024, 1024]
    - [0, 8.594]
  - - [1216, 832, 1, 1024, 1216, 1216, 1024, 1024]
    - [0, 8.743]
  - - [1344, 832, 1, 1024, 1344, 1344, 1024, 1024]
    - [0, 8.688]
  - - [1472, 832, 1, 1024, 1472, 1472, 1024, 1024]
    - [0, 8.788]
  - - [1600, 832, 1, 1024, 1600, 1600, 1024, 1024]
    - [0, 8.759]
  - - [1728, 832, 1, 1024, 1728, 1728, 1024, 1024]
    - [0, 8.664]
  - - [1856, 832, 1, 1024, 1856, 1856, 1024, 1024]
    - [0, 8.64]
  - - [1984, 832, 1, 1024, 1984, 1984, 1024, 1024]
    - [0, 8.709]
  - - [2112, 832, 1, 1024, 2112, 2112, 1024, 1024]
    - [0, 8.676]
  - - [2240, 832, 1, 1024, 2240, 2240, 1024, 1024]
    - [0, 8.744]
  - - [2368, 832, 1, 1024, 2368, 2368, 1024, 1024]
    - [0, 8.802]
  - - [2496, 832, 1, 1024, 2496, 2496, 1024, 1024]
    - [0, 8.765]
  - - [2624, 832, 1, 1024, 2624, 2624, 1024, 1024]
    - [0, 8.737]
  - - [2752, 832, 1, 1024, 2752, 2752, 1024, 1024]
    - [0, 8.79]
  - - [2880, 832, 1, 1024, 2880, 2880, 1024, 1024]
    - [0, 8.813]
  - - [3008, 832, 1, 1024, 3008, 3008, 1024, 1024]
    - [0, 8.781]
  - - [3136, 832, 1, 1024, 3136, 3136, 1024, 1024]
    - [0, 8.753]
  - - [3264, 832, 1, 1024, 3264, 3264, 1024, 1024]
    - [0, 8.856]
  - - [3392, 832, 1, 1024, 3392, 3392, 1024, 1024]
    - [0, 8.833]
  - - [3520, 832, 1, 1024, 3520, 3520, 1024, 1024]
    - [0, 8.846]
  - - [3648, 832, 1, 1024, 3648, 3648, 1024, 1024]
    - [0, 8.861]
  - - [3776, 832, 1, 1024, 3776, 3776, 1024, 1024]
    - [0, 8.907]
  - - [3904, 832, 1, 1024, 3904, 3904, 1024, 1024]
    - [0, 8.871]
  - - [4032, 832, 1, 1024, 4032, 4032, 1024, 1024]
    - [0, 8.893]
  - - [64, 960, 1, 1024, 64, 64, 1024, 1024]
    - [0, 5.673]
  - - [192, 960, 1, 1024, 192, 192, 1024, 1024]
    - [0, 7.421]
  - - [320, 960, 1, 1024, 320, 320, 1024, 1024]
    - [0, 8.211]
  - - [448, 960, 1, 1024, 448, 448, 1024, 1024]
    - [0, 8.419]
  - - [576, 960, 1, 1024, 576, 576, 1024, 1024]
    - [0, 8.548]
  - - [704, 960, 1, 1024, 704, 704, 1024, 1024]
    - [0, 8.632]
  - - [832, 960, 1, 1024, 832, 832, 1024, 1024]
    - [0, 8.695]
  - - [960, 960, 1, 1024, 960, 960, 1024, 1024]
    - [0, 8.725]
  - - [1088, 960, 1, 1024, 1088, 1088, 1024, 1024]
    - [0, 8.772]
  - - [1216, 960, 1, 1024, 1216, 1216, 1024, 1024]
    - [0, 8.652]
  - - [1344, 960, 1, 1024, 1344, 1344, 1024, 1024]
    - [0, 8.812]
  - - [1472, 960, 1, 1024, 1472, 1472, 1024, 1024]
    - [0, 8.832]
  - - [1600, 960, 1, 1024, 1600, 1600, 1024, 1024]
    - [0, 8.711]
  - - [1728, 960, 1, 1024, 1728, 1728, 1024, 1024]
    - [0, 8.753]
  - - [1856, 960, 1, 1024, 1856, 1856, 1024, 1024]
    - [0, 8.763]
  - - [1984, 960, 1, 1024, 1984, 1984, 1024, 1024]
    - [0, 8.78]
  - - [2112, 960, 1, 1024, 2112, 2112, 1024, 1024]
    - [0, 8.791]
  - - [2240, 960, 1, 1024, 2240, 2240, 1024, 1024]
    - [0, 8.797]
  - - [2368, 960, 1, 1024, 2368, 2368, 1024, 1024]
    - [0, 8.794]
  - - [2496, 960, 1, 1024, 2496, 2496, 1024, 1024]
    - [0, 8.841]
  - - [2624, 960, 1, 1024, 2624, 2624, 1024, 1024]
    - [0, 8.833]
  - - [2752, 960, 1, 1024, 2752, 2752, 1024, 1024]
    - [0, 8.845]
  - - [2880, 960, 1, 1024, 2880, 2880, 1024, 1024]
    - [0, 8.85]
  - - [3008, 960, 1, 1024, 3008, 3008, 1024, 1024]
    - [0, 8.846]
  - - [3136, 960, 1, 1024, 3136, 3136, 1024, 1024]
    - [0, 8.873]
  - - [3264, 960, 1, 1024, 3264, 3264, 1024, 1024]
    - [0, 8.864]
  - - [3392, 960, 1, 1024, 3392, 3392, 1024, 1024]
    - [0, 8.894]
  - - [3520, 960, 1, 1024, 3520, 3520, 1024, 1024]
    - [0, 8.89]
  - - [3648, 960, 1, 1024, 3648, 3648, 1024, 1024]
    - [0, 8.877]
  - - [3776, 960, 1, 1024, 3776, 3776, 1024, 1024]
    - [0, 8.885]
  - - [3904, 960, 1, 1024, 3904, 3904, 1024, 1024]
    - [0, 8.886]
  - - [4032, 960, 1, 1024, 4032, 4032, 1024, 1024]
    - [0, 8.924]
  - - [64, 1088, 1, 1024, 64, 64, 1024, 1024]
    - [0, 5.715]
  - - [192, 1088, 1, 1024, 192, 192, 1024, 1024]
    - [0, 7.691]
  - - [320, 1088, 1, 1024, 320, 320, 1024, 1024]
    - [0, 7.897]
  - - [448, 1088, 1, 1024, 448, 448, 1024, 1024]
    - [0, 8.43]
  - - [576, 1088, 1, 1024, 576, 576, 1024, 1024]
    - [0, 8.384]
  - - [704, 1088, 1, 1024, 704, 704, 1024, 1024]
    - [0, 8.653]
  - - [832, 1088, 1, 1024, 832, 832, 1024, 1024]
    - [0, 8.605]
  - - [960, 1088, 1, 1024, 960, 960, 1024, 1024]
    - [0, 8.765]
  - - [1088, 1088, 1, 1024, 1088, 1088, 1024, 1024]
    - [0, 8.724]
  - - [1216, 1088, 1, 1024, 1216, 1216, 1024, 1024]
    - [0, 8.793]
  - - [1344, 1088, 1, 1024, 1344, 1344, 1024, 1024]
    - [0, 8.638]
  - - [1472, 1088, 1, 1024, 1472, 1472, 1024, 1024]
    - [0, 8.746]
  - - [1600, 1088, 1, 1024, 1600, 1600, 1024, 1024]
    - [0, 8.731]
  - - [1728, 1088, 1, 1024, 1728, 1728, 1024, 1024]
    - [0, 8.778]
  - - [1856, 1088, 1, 1024, 1856, 1856, 1024, 1024]
    - [0, 8.764]
  - - [1984, 1088, 1, 1024, 1984, 1984, 1024, 1024]
    - [0, 8.741]
  - - [2112, 1088, 1, 1024, 2112, 2112, 1024, 1024]
    - [0, 8.805]
  - - [2240, 1088, 1, 1024, 2240, 2240, 1024, 1024]
    - [0, 8.806]
  - - [2368, 1088, 1, 1024, 2368, 2368, 1024, 1024]
    - [0, 8.841]
  - - [2496, 1088, 1, 1024, 2496, 2496, 1024, 1024]
    - [0, 8.811]
  - - [2624, 1088, 1, 1024, 2624, 2624, 1024, 1024]
    - [0, 8.848]
  - - [2752, 1088, 1, 1024, 2752, 2752, 1024, 1024]
    - [0, 8.84]
  - - [2880, 1088, 1, 1024, 2880, 2880, 1024, 1024]
    - [0, 8.858]
  - - [3008, 1088, 1, 1024, 3008, 3008, 1024, 1024]
    - [0, 8.87]
  - - [3136, 1088, 1, 1024, 3136, 3136, 1024, 1024]
    - [0, 8.89]
  - - [3264, 1088, 1, 1024, 3264, 3264, 1024, 1024]
    - [0, 8.919]
  - - [3392, 1088, 1, 1024, 3392, 3392, 1024, 1024]
    - [0, 8.916]
  - - [3520, 1088, 1, 1024, 3520, 3520, 1024, 1024]
    - [0, 8.86]
  - - [3648, 1088, 1, 1024, 3648, 3648, 1024, 1024]
    - [0, 8.914]
  - - [3776, 1088, 1, 1024, 3776, 3776, 1024, 1024]
    - [0, 8.904]
  - - [3904, 1088, 1, 1024, 3904, 3904, 1024, 1024]
    - [0, 8.881]
  - - [4032, 1088, 1, 1024, 4032, 4032, 1024, 1024]
    - [0, 8.912]
  - - [64, 1216, 1, 1024, 64, 64, 1024, 1024]
    - [0, 5.403]
  - - [192, 1216, 1, 1024, 192, 192, 1024, 1024]
    - [0, 7.661]
  - - [320, 1216, 1, 1024, 320, 320, 1024, 1024]
    - [0, 8.177]
  - - [448, 1216, 1, 1024, 448, 448, 1024, 1024]
    - [0, 8.434]
  - - [576, 1216, 1, 1024, 576, 576, 1024, 1024]
    - [0, 8.57]
  - - [704, 1216, 1, 1024, 704, 704, 1024, 1024]
    - [0, 8.679]
  - - [832, 1216, 1, 1024, 832, 832, 1024, 1024]
    - [0, 8.768]
  - - [960, 1216, 1, 1024, 960, 960, 1024, 1024]
    - [0, 8.798]
  - - [1088, 1216, 1, 1024, 1088, 1088, 1024, 1024]
    - [0, 8.847]
  - - [1216, 1216, 1, 1024, 1216, 1216, 1024, 1024]
    - [0, 8.624]
  - - [1344, 1216, 1, 1024, 1344, 1344, 1024, 1024]
    - [0, 8.654]
  - - [1472, 1216, 1, 1024, 1472, 1472, 1024, 1024]
    - [0, 8.709]
  - - [1600, 1216, 1, 1024, 1600, 1600, 1024, 1024]
    - [0, 8.736]
  - - [1728, 1216, 1, 1024, 1728, 1728, 1024, 1024]
    - [0, 8.764]
  - - [1856, 1216, 1, 1024, 1856, 1856, 1024, 1024]
    - [0, 8.787]
  - - [1984, 1216, 1, 1024, 1984, 1984, 1024, 1024]
    - [0, 8.796]
  - - [2112, 1216, 1, 1024, 2112, 2112, 1024, 1024]
    - [0, 8.807]
  - - [2240, 1216, 1, 1024, 2240, 2240, 1024, 1024]
    - [0, 8.854]
  - - [2368, 1216, 1, 1024, 2368, 2368, 1024, 1024]
    - [0, 8.757]
  - - [2496, 1216, 1, 1024, 2496, 2496, 1024, 1024]
    - [0, 8.867]
  - - [2624, 1216, 1, 1024, 2624, 2624, 1024, 1024]
    - [0, 8.875]
  - - [2752, 1216, 1, 1024, 2752, 2752, 1024, 1024]
    - [0, 8.876]
  - - [2880, 1216, 1, 1024, 2880, 2880, 1024, 1024]
    - [0, 8.907]
  - - [3008, 1216, 1, 1024, 3008, 3008, 1024, 1024]
    - [0, 8.911]
  - - [3136, 1216, 1, 1024, 3136, 3136, 1024, 1024]
    - [0, 8.935]
  - - [3264, 1216, 1, 1024, 3264, 3264, 1024, 1024]
    - [0, 8.874]
  - - [3392, 1216, 1, 1024, 3392, 3392, 1024, 1024]
    - [0, 8.892]
  - - [3520, 1216, 1, 1024, 3520, 3520, 1024, 1024]
    - [0, 8.894]
  - - [3648, 1216, 1, 1024, 3648, 3648, 1024, 1024]
    - [0, 8.909]
  - - [3776, 1216, 1, 1024, 3776, 3776, 1024, 1024]
    - [0, 8.946]
  - - [3904, 1216, 1, 1024, 3904, 3904, 1024, 1024]
    - [0, 8.933]
  - - [4032, 1216, 1, 1024, 4032, 4032, 1024, 1024]
    - [0, 8.918]
  - - [64, 1344, 1, 1024, 64, 64, 1024, 1024]
    - [0, 5.566]
  - - [192, 1344, 1, 1024, 192, 192, 1024, 1024]
    - [0, 7.616]
  - - [320, 1344, 1, 1024, 320, 320, 1024, 1024]
    - [0, 8.415]
  - - [448, 1344, 1, 1024, 448, 448, 1024, 1024]
    - [0, 8.432]
  - - [576, 1344, 1, 1024, 576, 576, 1024, 1024]
    - [0, 8.46]
  - - [704, 1344, 1, 1024, 704, 704, 1024, 1024]
    - [0, 8.695]
  - - [832, 1344, 1, 1024, 832, 832, 1024, 1024]
    - [0, 8.685]
  - - [960, 1344, 1, 1024, 960, 960, 1024, 1024]
    - [0, 8.818]
  - - [1088, 1344, 1, 1024, 1088, 1088, 1024, 1024]
    - [0, 8.647]
  - - [1216, 1344, 1, 1024, 1216, 1216, 1024, 1024]
    - [0, 8.652]
  - - [1344, 1344, 1, 1024, 1344, 1344, 1024, 1024]
    - [0, 8.747]
  - - [1472, 1344, 1, 1024, 1472, 1472, 1024, 1024]
    - [0, 8.73]
  - - [1600, 1344, 1, 1024, 1600, 1600, 1024, 1024]
    - [0, 8.826]
  - - [1728, 1344, 1, 1024, 1728, 1728, 1024, 1024]
    - [0, 8.788]
  - - [1856, 1344, 1, 1024, 1856, 1856, 1024, 1024]
    - [0, 8.8]
  - - [1984, 1344, 1, 1024, 1984, 1984, 1024, 1024]
    - [0, 8.823]
  - - [2112, 1344, 1, 1024, 2112, 2112, 1024, 1024]
    - [0, 8.826]
  - - [2240, 1344, 1, 1024, 2240, 2240, 1024, 1024]
    - [0, 8.859]
  - - [2368, 1344, 1, 1024, 2368, 2368, 1024, 1024]
    - [0, 8.858]
  - - [2496, 1344, 1, 1024, 2496, 2496, 1024, 1024]
    - [0, 8.897]
  - - [2624, 1344, 1, 1024, 2624, 2624, 1024, 1024]
    - [0, 8.873]
  - - [2752, 1344, 1, 1024, 2752, 2752, 1024, 1024]
    - [0, 8.876]
  - - [2880, 1344, 1, 1024, 2880, 2880, 1024, 1024]
    - [0, 8.962]
  - - [3008, 1344, 1, 1024, 3008, 3008, 1024, 1024]
    - [0, 8.902]
  - - [3136, 1344, 1, 1024, 3136, 3136, 1024, 1024]
    - [0, 8.906]
  - - [3264, 1344, 1, 1024, 3264, 3264, 1024, 1024]
    - [0, 8.973]
  - - [3392, 1344, 1, 1024, 3392, 3392, 1024, 1024]
    - [0, 8.974]
  - - [3520, 1344, 1, 1024, 3520, 3520, 1024, 1024]
    - [0, 8.886]
  - - [3648, 1344, 1, 1024, 3648, 3648, 1024, 1024]
    - [0, 8.979]
  - - [3776, 1344, 1, 1024, 3776, 3776, 1024, 1024]
    - [0, 8.975]
  - - [3904, 1344, 1, 1024, 3904, 3904, 1024, 1024]
    - [0, 8.942]
  - - [4032, 1344, 1, 1024, 4032, 4032, 1024, 1024]
    - [0, 8.926]
  - - [64, 1472, 1, 1024, 64, 64, 1024, 1024]
    - [3, 5.08]
  - - [192, 1472, 1, 1024, 192, 192, 1024, 1024]
    - [0, 7.587]
  - - [320, 1472, 1, 1024, 320, 320, 1024, 1024]
    - [0, 8.169]
  - - [448, 1472, 1, 1024, 448, 448, 1024, 1024]
    - [0, 8.45]
  - - [576, 1472, 1, 1024, 576, 576, 1024, 1024]
    - [0, 8.604]
  - - [704, 1472, 1, 1024, 704, 704, 1024, 1024]
    - [0, 8.712]
  - - [832, 1472, 1, 1024, 832, 832, 1024, 1024]
    - [0, 8.779]
  - - [960, 1472, 1, 1024, 960, 960, 1024, 1024]
    - [0, 8.829]
  - - [1088, 1472, 1, 1024, 1088, 1088, 1024, 1024]
    - [0, 8.642]
  - - [1216, 1472, 1, 1024, 1216, 1216, 1024, 1024]
    - [0, 8.693]
  - - [1344, 1472, 1, 1024, 1344, 1344, 1024, 1024]
    - [0, 8.743]
  - - [1472, 1472, 1, 1024, 1472, 1472, 1024, 1024]
    - [0, 8.781]
  - - [1600, 1472, 1, 1024, 1600, 1600, 1024, 1024]
    - [0, 8.815]
  - - [1728, 1472, 1, 1024, 1728, 1728, 1024, 1024]
    - [0, 8.835]
  - - [1856, 1472, 1, 1024, 1856, 1856, 1024, 1024]
    - [0, 8.887]
  - - [1984, 1472, 1, 1024, 1984, 1984, 1024, 1024]
    - [0, 8.887]
  - - [2112, 1472, 1, 1024, 2112, 2112, 1024, 1024]
    - [0, 8.863]
  - - [2240, 1472, 1, 1024, 2240, 2240, 1024, 1024]
    - [0, 8.942]
  - - [2368, 1472, 1, 1024, 2368, 2368, 1024, 1024]
    - [0, 8.876]
  - - [2496, 1472, 1, 1024, 2496, 2496, 1024, 1024]
    - [0, 8.932]
  - - [2624, 1472, 1, 1024, 2624, 2624, 1024, 1024]
    - [0, 8.899]
  - - [2752, 1472, 1, 1024, 2752, 2752, 1024, 1024]
    - [0, 8.892]
  - - [2880, 1472, 1, 1024, 2880, 2880, 1024, 1024]
    - [0, 8.91]
  - - [3008, 1472, 1, 1024, 3008, 3008, 1024, 1024]
    - [0, 8.958]
  - - [3136, 1472, 1, 1024, 3136, 3136, 1024, 1024]
    - [0, 8.944]
  - - [3264, 1472, 1, 1024, 3264, 3264, 1024, 1024]
    - [0, 8.913]
  - - [3392, 1472, 1, 1024, 3392, 3392, 1024, 1024]
    - [0, 8.897]
  - - [3520, 1472, 1, 1024, 3520, 3520, 1024, 1024]
    - [0, 8.916]
  - - [3648, 1472, 1, 1024, 3648, 3648, 1024, 1024]
    - [0, 8.923]
  - - [3776, 1472, 1, 1024, 3776, 3776, 1024, 1024]
    - [0, 8.935]
  - - [3904, 1472, 1, 1024, 3904, 3904, 1024, 1024]
    - [0, 8.942]
  - - [4032, 1472, 1, 1024, 4032, 4032, 1024, 1024]
    - [0, 9.025]
  - - [64, 1600, 1, 1024, 64, 64, 1024, 1024]
    - [0, 6.558]
  - - [192, 1600, 1, 1024, 192, 192, 1024, 1024]
    - [0, 8.206]
  - - [320, 1600, 1, 1024, 320, 320, 1024, 1024]
    - [0, 8.383]
  - - [448, 1600, 1, 1024, 448, 448, 1024, 1024]
    - [0, 8.452]
  - - [576, 1600, 1, 1024, 576, 576, 1024, 1024]
    - [0, 8.742]
  - - [704, 1600, 1, 1024, 704, 704, 1024, 1024]
    - [0, 8.738]
  - - [832, 1600, 1, 1024, 832, 832, 1024, 1024]
    - [0, 8.722]
  - - [960, 1600, 1, 1024, 960, 960, 1024, 1024]
    - [0, 8.711]
  - - [1088, 1600, 1, 1024, 1088, 1088, 1024, 1024]
    - [0, 8.724]
  - - [1216, 1600, 1, 1024, 1216, 1216, 1024, 1024]
    - [0, 8.796]
  - - [1344, 1600, 1, 1024, 1344, 1344, 1024, 1024]
    - [0, 8.789]
  - - [1472, 1600, 1, 1024, 1472, 1472, 1024, 1024]
    - [0, 8.802]
  - - [1600, 1600, 1, 1024, 1600, 1600, 1024, 1024]
    - [0, 8.808]
  - - [1728, 1600, 1, 1024, 1728, 1728, 1024, 1024]
    - [0, 8.843]
  - - [1856, 1600, 1, 1024, 1856, 1856, 1024, 1024]
    - [0, 8.873]
  - - [1984, 1600, 1, 1024, 1984, 1984, 1024, 1024]
    - [0, 8.981]
  - - [2112, 1600, 1, 1024, 2112, 2112, 1024, 1024]
    - [0, 8.918]
  - - [2240, 1600, 1, 1024, 2240, 2240, 1024, 1024]
    - [0, 8.955]
  - - [2368, 1600, 1, 1024, 2368, 2368, 1024, 1024]
    - [0, 8.883]
  - - [2496, 1600, 1, 1024, 2496, 2496, 1024, 1024]
    - [0, 8.986]
  - - [2624, 1600, 1, 1024, 2624, 2624, 1024, 1024]
    - [0, 8.904]
  - - [2752, 1600, 1, 1024, 2752, 2752, 1024, 1024]
    - [0, 8.893]
  - - [2880, 1600, 1, 1024, 2880, 2880, 1024, 1024]
    - [0, 8.991]
  - - [3008, 1600, 1, 1024, 3008, 3008, 1024, 1024]
    - [0, 8.919]
  - - [3136, 1600, 1, 1024, 3136, 3136, 1024, 1024]
    - [0, 8.978]
  - - [3264, 1600, 1, 1024, 3264, 3264, 1024, 1024]
    - [0, 9.007]
  - - [3392, 1600, 1, 1024, 3392, 3392, 1024, 1024]
    - [0, 8.946]
  - - [3520, 1600, 1, 1024, 3520, 3520, 1024, 1024]
    - [0, 8.935]
  - - [3648, 1600, 1, 1024, 3648, 3648, 1024, 1024]
    - [0, 8.931]
  - - [3776, 1600, 1, 1024, 3776, 3776, 1024, 1024]
    - [0, 8.977]
  - - [3904, 1600, 1, 1024, 3904, 3904, 1024, 1024]
    - [0, 8.941]
  - - [4032, 1600, 1, 1024, 4032, 4032, 1024, 1024]
    - [0, 7.975]
  - - [64, 1728, 1, 1024, 64, 64, 1024, 1024]
    - [0, 5.873]
  - - [192, 1728, 1, 1024, 192, 192, 1024, 1024]
    - [0, 8.135]
  - - [320, 1728, 1, 1024, 320, 320, 1024, 1024]
    - [0, 8.547]
  - - [448, 1728, 1, 1024, 448, 448, 1024, 1024]
    - [0, 8.496]
  - - [576, 1728, 1, 1024, 576, 576, 1024, 1024]
    - [0, 8.625]
  - - [704, 1728, 1, 1024, 704, 704, 1024, 1024]
    - [0, 8.735]
  - - [832, 1728, 1, 1024, 832, 832, 1024, 1024]
    - [0, 8.642]
  - - [960, 1728, 1, 1024, 960, 960, 1024, 1024]
    - [0, 8.741]
  - - [1088, 1728, 1, 1024, 1088, 1088, 1024, 1024]
    - [0, 8.699]
  - - [1216, 1728, 1, 1024, 1216, 1216, 1024, 1024]
    - [0, 8.757]
  - - [1344, 1728, 1, 1024, 1344, 1344, 1024, 1024]
    - [0, 8.799]
  - - [1472, 1728, 1, 1024, 1472, 1472, 1024, 1024]
    - [0, 8.818]
  - - [1600, 1728, 1, 1024, 1600, 1600, 1024, 1024]
    - [0, 8.836]
  - - [1728, 1728, 1, 1024, 1728, 1728, 1024, 1024]
    - [0, 8.877]
  - - [1856, 1728, 1, 1024, 1856, 1856, 1024, 1024]
    - [0, 8.917]
  - - [1984, 1728, 1, 1024, 1984, 1984, 1024, 1024]
    - [0, 8.883]
  - - [2112, 1728, 1, 1024, 2112, 2112, 1024, 1024]
    - [0, 8.934]
  - - [2240, 1728, 1, 1024, 2240, 2240, 1024, 1024]
    - [0, 8.87]
  - - [2368, 1728, 1, 1024, 2368, 2368, 1024, 1024]
    - [0, 8.906]
  - - [2496, 1728, 1, 1024, 2496, 2496, 1024, 1024]
    - [0, 8.953]
  - - [2624, 1728, 1, 1024, 2624, 2624, 1024, 1024]
    - [0, 8.976]
  - - [2752, 1728, 1, 1024, 2752, 2752, 1024, 1024]
    - [0, 8.914]
  - - [2880, 1728, 1, 1024, 2880, 2880, 1024, 1024]
    - [0, 8.937]
  - - [3008, 1728, 1, 1024, 3008, 3008, 1024, 1024]
    - [0, 8.943]
  - - [3136, 1728, 1, 1024, 3136, 3136, 1024, 1024]
    - [0, 8.936]
  - - [3264, 1728, 1, 1024, 3264, 3264, 1024, 1024]
    - [0, 8.938]
  - - [3392, 1728, 1, 1024, 3392, 3392, 1024, 1024]
    - [0, 8.959]
  - - [3520, 1728, 1, 1024, 3520, 3520, 1024, 1024]
    - [0, 8.976]
  - - [3648, 1728, 1, 1024, 3648, 3648, 1024, 1024]
    - [0, 9.02]
  - - [3776, 1728, 1, 1024, 3776, 3776, 1024, 1024]
    - [0, 8.022]
  - - [3904, 1728, 1, 1024, 3904, 3904, 1024, 1024]
    - [0, 8.961]
  - - [4032, 1728, 1, 1024, 4032, 4032, 1024, 1024]
    - [0, 8.959]
  - - [64, 1856, 1, 1024, 64, 64, 1024, 1024]
    - [0, 6.236]
  - - [192, 1856, 1, 1024, 192, 192, 1024, 1024]
    - [0, 8.078]
  - - [320, 1856, 1, 1024, 320, 320, 1024, 1024]
    - [0, 8.344]
  - - [448, 1856, 1, 1024, 448, 448, 1024, 1024]
    - [0, 8.564]
  - - [576, 1856, 1, 1024, 576, 576, 1024, 1024]
    - [0, 8.624]
  - - [704, 1856, 1, 1024, 704, 704, 1024, 1024]
    - [0, 8.742]
  - - [832, 1856, 1, 1024, 832, 832, 1024, 1024]
    - [0, 8.629]
  - - [960, 1856, 1, 1024, 960, 960, 1024, 1024]
    - [0, 8.76]
  - - [1088, 1856, 1, 1024, 1088, 1088, 1024, 1024]
    - [0, 8.895]
  - - [1216, 1856, 1, 1024, 1216, 1216, 1024, 1024]
    - [0, 8.784]
  - - [1344, 1856, 1, 1024, 1344, 1344, 1024, 1024]
    - [0, 8.742]
  - - [1472, 1856, 1, 1024, 1472, 1472, 1024, 1024]
    - [0, 8.827]
  - - [1600, 1856, 1, 1024, 1600, 1600, 1024, 1024]
    - [0, 8.862]
  - - [1728, 1856, 1, 1024, 1728, 1728, 1024, 1024]
    - [0, 8.919]
  - - [1856, 1856, 1, 1024, 1856, 1856, 1024, 1024]
    - [0, 8.909]
  - - [1984, 1856, 1, 1024, 1984, 1984, 1024, 1024]
    - [0, 8.911]
  - - [2112, 1856, 1, 1024, 2112, 2112, 1024, 1024]
    - [0, 8.898]
  - - [2240, 1856, 1, 1024, 2240, 2240, 1024, 1024]
    - [0, 8.93]
  - - [2368, 1856, 1, 1024, 2368, 2368, 1024, 1024]
    - [0, 8.936]
  - - [2496, 1856, 1, 1024, 2496, 2496, 1024, 1024]
    - [0, 8.903]
  - - [2624, 1856, 1, 1024, 2624, 2624, 1024, 1024]
    - [0, 8.918]
  - - [2752, 1856, 1, 1024, 2752, 2752, 1024, 1024]
    - [0, 8.917]
  - - [2880, 1856, 1, 1024, 2880, 2880, 1024, 1024]
    - [0, 8.981]
  - - [3008, 1856, 1, 1024, 3008, 3008, 1024, 1024]
    - [0, 8.926]
  - - [3136, 1856, 1, 1024, 3136, 3136, 1024, 1024]
    - [0, 8.978]
  - - [3264, 1856, 1, 1024, 3264, 3264, 1024, 1024]
    - [0, 8.978]
  - - [3392, 1856, 1, 1024, 3392, 3392, 1024, 1024]
    - [0, 8.946]
  - - [3520, 1856, 1, 1024, 3520, 3520, 1024, 1024]
    - [0, 8.965]
  - - [3648, 1856, 1, 1024, 3648, 3648, 1024, 1024]
    - [0, 8.974]
  - - [3776, 1856, 1, 1024, 3776, 3776, 1024, 1024]
    - [0, 8.974]
  - - [3904, 1856, 1, 1024, 3904, 3904, 1024, 1024]
    - [0, 9.003]
  - - [4032, 1856, 1, 1024, 4032, 4032, 1024, 1024]
    - [0, 8.969]
  - - [64, 1984, 1, 1024, 64, 64, 1024, 1024]
    - [0, 6.702]
  - - [192, 1984, 1, 1024, 192, 192, 1024, 1024]
    - [0, 8.008]
  - - [320, 1984, 1, 1024, 320, 320, 1024, 1024]
    - [0, 8.486]
  - - [448, 1984, 1, 1024, 448, 448, 1024, 1024]
    - [0, 8.708]
  - - [576, 1984, 1, 1024, 576, 576, 1024, 1024]
    - [0, 8.702]
  - - [704, 1984, 1, 1024, 704, 704, 1024, 1024]
    - [0, 8.784]
  - - [832, 1984, 1, 1024, 832, 832, 1024, 1024]
    - [0, 8.714]
  - - [960, 1984, 1, 1024, 960, 960, 1024, 1024]
    - [0, 8.765]
  - - [1088, 1984, 1, 1024, 1088, 1088, 1024, 1024]
    - [0, 8.761]
  - - [1216, 1984, 1, 1024, 1216, 1216, 1024, 1024]
    - [0, 8.811]
  - - [1344, 1984, 1, 1024, 1344, 1344, 1024, 1024]
    - [0, 8.823]
  - - [1472, 1984, 1, 1024, 1472, 1472, 1024, 1024]
    - [0, 8.877]
  - - [1600, 1984, 1, 1024, 1600, 1600, 1024, 1024]
    - [0, 8.895]
  - - [1728, 1984, 1, 1024, 1728, 1728, 1024, 1024]
    - [0, 8.897]
  - - [1856, 1984, 1, 1024, 1856, 1856, 1024, 1024]
    - [0, 8.894]
  - - [1984, 1984, 1, 1024, 1984, 1984, 1024, 1024]
    - [0, 8.879]
  - - [2112, 1984, 1, 1024, 2112, 2112, 1024, 1024]
    - [0, 8.898]
  - - [2240, 1984, 1, 1024, 2240, 2240, 1024, 1024]
    - [0, 8.928]
  - - [2368, 1984, 1, 1024, 2368, 2368, 1024, 1024]
    - [0, 8.928]
  - - [2496, 1984, 1, 1024, 2496, 2496, 1024, 1024]
    - [0, 8.889]
  - - [2624, 1984, 1, 1024, 2624, 2624, 1024, 1024]
    - [0, 8.944]
  - - [2752, 1984, 1, 1024, 2752, 2752, 1024, 1024]
    - [0, 8.964]
  - - [2880, 1984, 1, 1024, 2880, 2880, 1024, 1024]
    - [0, 8.962]
  - - [3008, 1984, 1, 1024, 3008, 3008, 1024, 1024]
    - [0, 8.937]
  - - [3136, 1984, 1, 1024, 3136, 3136, 1024, 1024]
    - [0, 8.952]
  - - [3264, 1984, 1, 1024, 3264, 3264, 1024, 1024]
    - [0, 8.978]
  - - [3392, 1984, 1, 1024, 3392, 3392, 1024, 1024]
    - [0, 8.941]
  - - [3520, 1984, 1, 1024, 3520, 3520, 1024, 1024]
    - [0, 8.989]
  - - [3648, 1984, 1, 1024, 3648, 3648, 1024, 1024]
    - [0, 8.982]
  - - [3776, 1984, 1, 1024, 3776, 3776, 1024, 1024]
    - [0, 8.986]
  - - [3904, 1984, 1, 1024, 3904, 3904, 1024, 1024]
    - [0, 8.967]
  - - [4032, 1984, 1, 1024, 4032, 4032, 1024, 1024]
    - [0, 8.978]
  - - [64, 2112, 1, 1024, 64, 64, 1024, 1024]
    - [0, 5.597]
  - - [192, 2112, 1, 1024, 192, 192, 1024, 1024]
    - [0, 7.974]
  - - [320, 2112, 1, 1024, 320, 320, 1024, 1024]
    - [0, 8.629]
  - - [448, 2112, 1, 1024, 448, 448, 1024, 1024]
    - [0, 8.708]
  - - [576, 2112, 1, 1024, 576, 576, 1024, 1024]
    - [0, 8.741]
  - - [704, 2112, 1, 1024, 704, 704, 1024, 1024]
    - [0, 8.627]
  - - [832, 2112, 1, 1024, 832, 832, 1024, 1024]
    - [0, 8.664]
  - - [960, 2112, 1, 1024, 960, 960, 1024, 1024]
    - [0, 8.713]
  - - [1088, 2112, 1, 1024, 1088, 1088, 1024, 1024]
    - [0, 8.825]
  - - [1216, 2112, 1, 1024, 1216, 1216, 1024, 1024]
    - [0, 8.892]
  - - [1344, 2112, 1, 1024, 1344, 1344, 1024, 1024]
    - [0, 8.819]
  - - [1472, 2112, 1, 1024, 1472, 1472, 1024, 1024]
    - [0, 8.874]
  - - [1600, 2112, 1, 1024, 1600, 1600, 1024, 1024]
    - [0, 8.911]
  - - [1728, 2112, 1, 1024, 1728, 1728, 1024, 1024]
    - [0, 8.891]
  - - [1856, 2112, 1, 1024, 1856, 1856, 1024, 1024]
    - [0, 8.883]
  - - [1984, 2112, 1, 1024, 1984, 1984, 1024, 1024]
    - [0, 8.907]
  - - [2112, 2112, 1, 1024, 2112, 2112, 1024, 1024]
    - [0, 8.931]
  - - [2240, 2112, 1, 1024, 2240, 2240, 1024, 1024]
    - [0, 8.944]
  - - [2368, 2112, 1, 1024, 2368, 2368, 1024, 1024]
    - [0, 8.983]
  - - [2496, 2112, 1, 1024, 2496, 2496, 1024, 1024]
    - [0, 8.966]
  - - [2624, 2112, 1, 1024, 2624, 2624, 1024, 1024]
    - [0, 8.941]
  - - [2752, 2112, 1, 1024, 2752, 2752, 1024, 1024]
    - [0, 8.939]
  - - [2880, 2112, 1, 1024, 2880, 2880, 1024, 1024]
    - [0, 8.955]
  - - [3008, 2112, 1, 1024, 3008, 3008, 1024, 1024]
    - [0, 8.949]
  - - [3136, 2112, 1, 1024, 3136, 3136, 1024, 1024]
    - [0, 9.025]
  - - [3264, 2112, 1, 1024, 3264, 3264, 1024, 1024]
    - [0, 8.974]
  - - [3392, 2112, 1, 1024, 3392, 3392, 1024, 1024]
    - [0, 8.954]
  - - [3520, 2112, 1, 1024, 3520, 3520, 1024, 1024]
    - [0, 8.996]
  - - [3648, 2112, 1, 1024, 3648, 3648, 1024, 1024]
    - [0, 9.033]
  - - [3776, 2112, 1, 1024, 3776, 3776, 1024, 1024]
    - [0, 8.987]
  - - [3904, 2112, 1, 1024, 3904, 3904, 1024, 1024]
    - [0, 8.974]
  - - [4032, 2112, 1, 1024, 4032, 4032, 1024, 1024]
    - [0, 9.042]
  - - [64, 2240, 1, 1024, 64, 64, 1024, 1024]
    - [0, 6.394]
  - - [192, 2240, 1, 1024, 192, 192, 1024, 1024]
    - [0, 8.426]
  - - [320, 2240, 1, 1024, 320, 320, 1024, 1024]
    - [0, 8.477]
  - - [448, 2240, 1, 1024, 448, 448, 1024, 1024]
    - [0, 8.696]
  - - [576, 2240, 1, 1024, 576, 576, 1024, 1024]
    - [0, 8.817]
  - - [704, 2240, 1, 1024, 704, 704, 1024, 1024]
    - [0, 8.638]
  - - [832, 2240, 1, 1024, 832, 832, 1024, 1024]
    - [0, 8.742]
  - - [960, 2240, 1, 1024, 960, 960, 1024, 1024]
    - [0, 8.799]
  - - [1088, 2240, 1, 1024, 1088, 1088, 1024, 1024]
    - [0, 8.8]
  - - [1216, 2240, 1, 1024, 1216, 1216, 1024, 1024]
    - [0, 8.809]
  - - [1344, 2240, 1, 1024, 1344, 1344, 1024, 1024]
    - [0, 8.871]
  - - [1472, 2240, 1, 1024, 1472, 1472, 1024, 1024]
    - [0, 8.854]
  - - [1600, 2240, 1, 1024, 1600, 1600, 1024, 1024]
    - [0, 8.876]
  - - [1728, 2240, 1, 1024, 1728, 1728, 1024, 1024]
    - [0, 8.889]
  - - [1856, 2240, 1, 1024, 1856, 1856, 1024, 1024]
    - [0, 8.903]
  - - [1984, 2240, 1, 1024, 1984, 1984, 1024, 1024]
    - [0, 8.95]
  - - [2112, 2240, 1, 1024, 2112, 2112, 1024, 1024]
    - [0, 8.981]
  - - [2240, 2240, 1, 1024, 2240, 2240, 1024, 1024]
    - [0, 8.981]
  - - [2368, 2240, 1, 1024, 2368, 2368, 1024, 1024]
    - [0, 8.991]
  - - [2496, 2240, 1, 1024, 2496, 2496, 1024, 1024]
    - [0, 8.941]
  - - [2624, 2240, 1, 1024, 2624, 2624, 1024, 1024]
    - [0, 8.938]
  - - [2752, 2240, 1, 1024, 2752, 2752, 1024, 1024]
    - [0, 8.975]
  - - [2880, 2240, 1, 1024, 2880, 2880, 1024, 1024]
    - [0, 8.969]
  - - [3008, 2240, 1, 1024, 3008, 3008, 1024, 1024]
    - [0, 8.983]
  - - [3136, 2240, 1, 1024, 3136, 3136, 1024, 1024]
    - [0, 8.936]
  - - [3264, 2240, 1, 1024, 3264, 3264, 1024, 1024]
    - [0, 8.965]
  - - [3392, 2240, 1, 1024, 3392, 3392, 1024, 1024]
    - [0, 8.986]
  - - [3520, 2240, 1, 1024, 3520, 3520, 1024, 1024]
    - [0, 8.954]
  - - [3648, 2240, 1, 1024, 3648, 3648, 1024, 1024]
    - [0, 9.002]
  - - [3776, 2240, 1, 1024, 3776, 3776, 1024, 1024]
    - [0, 8.995]
  - - [3904, 2240, 1, 1024, 3904, 3904, 1024, 1024]
    - [0, 8.965]
  - - [4032, 2240, 1, 1024, 4032, 4032, 1024, 1024]
    - [0, 9.019]
  - - [64, 2368, 1, 1024, 64, 64, 1024, 1024]
    - [0, 6.917]
  - - [192, 2368, 1, 1024, 192, 192, 1024, 1024]
    - [0, 8.354]
  - - [320, 2368, 1, 1024, 320, 320, 1024, 1024]
    - [0, 8.573]
  - - [448, 2368, 1, 1024, 448, 448, 1024, 1024]
    - [0, 8.69]
  - - [576, 2368, 1, 1024, 576, 576, 1024, 1024]
    - [0, 8.744]
  - - [704, 2368, 1, 1024, 704, 704, 1024, 1024]
    - [0, 8.743]
  - - [832, 2368, 1, 1024, 832, 832, 1024, 1024]
    - [0, 8.716]
  - - [960, 2368, 1, 1024, 960, 960, 1024, 1024]
    - [0, 8.82]
  - - [1088, 2368, 1, 1024, 1088, 1088, 1024, 1024]
    - [0, 8.856]
  - - [1216, 2368, 1, 1024, 1216, 1216, 1024, 1024]
    - [0, 8.843]
  - - [1344, 2368, 1, 1024, 1344, 1344, 1024, 1024]
    - [0, 8.851]
  - - [1472, 2368, 1, 1024, 1472, 1472, 1024, 1024]
    - [0, 8.853]
  - - [1600, 2368, 1, 1024, 1600, 1600, 1024, 1024]
    - [0, 8.902]
  - - [1728, 2368, 1, 1024, 1728, 1728, 1024, 1024]
    - [0, 8.839]
  - - [1856, 2368, 1, 1024, 1856, 1856, 1024, 1024]
    - [0, 8.904]
  - - [1984, 2368, 1, 1024, 1984, 1984, 1024, 1024]
    - [0, 8.911]
  - - [2112, 2368, 1, 1024, 2112, 2112, 1024, 1024]
    - [0, 8.93]
  - - [2240, 2368, 1, 1024, 2240, 2240, 1024, 1024]
    - [0, 8.925]
  - - [2368, 2368, 1, 1024, 2368, 2368, 1024, 1024]
    - [0, 8.979]
  - - [2496, 2368, 1, 1024, 2496, 2496, 1024, 1024]
    - [0, 8.94]
  - - [2624, 2368, 1, 1024, 2624, 2624, 1024, 1024]
    - [0, 8.974]
  - - [2752, 2368, 1, 1024, 2752, 2752, 1024, 1024]
    - [0, 8.943]
  - - [2880, 2368, 1, 1024, 2880, 2880, 1024, 1024]
    - [0, 8.329]
  - - [3008, 2368, 1, 1024, 3008, 3008, 1024, 1024]
    - [0, 8.954]
  - - [3136, 2368, 1, 1024, 3136, 3136, 1024, 1024]
    - [0, 9.005]
  - - [3264, 2368, 1, 1024, 3264, 3264, 1024, 1024]
    - [0, 9.039]
  - - [3392, 2368, 1, 1024, 3392, 3392, 1024, 1024]
    - [0, 9.004]
  - - [3520, 2368, 1, 1024, 3520, 3520, 1024, 1024]
    - [0, 9.048]
  - - [3648, 2368, 1, 1024, 3648, 3648, 1024, 1024]
    - [0, 8.998]
  - - [3776, 2368, 1, 1024, 3776, 3776, 1024, 1024]
    - [0, 9.054]
  - - [3904, 2368, 1, 1024, 3904, 3904, 1024, 1024]
    - [0, 9.027]
  - - [4032, 2368, 1, 1024, 4032, 4032, 1024, 1024]
    - [0, 8.987]
  - - [64, 2496, 1, 1024, 64, 64, 1024, 1024]
    - [2, 5.971]
  - - [192, 2496, 1, 1024, 192, 192, 1024, 1024]
    - [0, 8.298]
  - - [320, 2496, 1, 1024, 320, 320, 1024, 1024]
    - [0, 8.692]
  - - [448, 2496, 1, 1024, 448, 448, 1024, 1024]
    - [0, 8.677]
  - - [576, 2496, 1, 1024, 576, 576, 1024, 1024]
    - [0, 8.632]
  - - [704, 2496, 1, 1024, 704, 704, 1024, 1024]
    - [0, 8.795]
  - - [832, 2496, 1, 1024, 832, 832, 1024, 1024]
    - [0, 8.791]
  - - [960, 2496, 1, 1024, 960, 960, 1024, 1024]
    - [0, 8.819]
  - - [1088, 2496, 1, 1024, 1088, 1088, 1024, 1024]
    - [0, 8.923]
  - - [1216, 2496, 1, 1024, 1216, 1216, 1024, 1024]
    - [0, 8.871]
  - - [1344, 2496, 1, 1024, 1344, 1344, 1024, 1024]
    - [0, 8.84]
  - - [1472, 2496, 1, 1024, 1472, 1472, 1024, 1024]
    - [0, 8.889]
  - - [1600, 2496, 1, 1024, 1600, 1600, 1024, 1024]
    - [0, 8.917]
  - - [1728, 2496, 1, 1024, 1728, 1728, 1024, 1024]
    - [0, 8.918]
  - - [1856, 2496, 1, 1024, 1856, 1856, 1024, 1024]
    - [0, 8.913]
  - - [1984, 2496, 1, 1024, 1984, 1984, 1024, 1024]
    - [0, 8.952]
  - - [2112, 2496, 1, 1024, 2112, 2112, 1024, 1024]
    - [0, 8.942]
  - - [2240, 2496, 1, 1024, 2240, 2240, 1024, 1024]
    - [0, 8.922]
  - - [2368, 2496, 1, 1024, 2368, 2368, 1024, 1024]
    - [0, 8.978]
  - - [2496, 2496, 1, 1024, 2496, 2496, 1024, 1024]
    - [0, 8.982]
  - - [2624, 2496, 1, 1024, 2624, 2624, 1024, 1024]
    - [0, 8.995]
  - - [2752, 2496, 1, 1024, 2752, 2752, 1024, 1024]
    - [0, 8.959]
  - - [2880, 2496, 1, 1024, 2880, 2880, 1024, 1024]
    - [0, 8.987]
  - - [3008, 2496, 1, 1024, 3008, 3008, 1024, 1024]
    - [0, 8.975]
  - - [3136, 2496, 1, 1024, 3136, 3136, 1024, 1024]
    - [0, 9.022]
  - - [3264, 2496, 1, 1024, 3264, 3264, 1024, 1024]
    - [0, 8.983]
  - - [3392, 2496, 1, 1024, 3392, 3392, 1024, 1024]
    - [0, 9.016]
  - - [3520, 2496, 1, 1024, 3520, 3520, 1024, 1024]
    - [0, 8.992]
  - - [3648, 2496, 1, 1024, 3648, 3648, 1024, 1024]
    - [0, 8.986]
  - - [3776, 2496, 1, 1024, 3776, 3776, 1024, 1024]
    - [0, 9.003]
  - - [3904, 2496, 1, 1024, 3904, 3904, 1024, 1024]
    - [0, 9.014]
  - - [4032, 2496, 1, 1024, 4032, 4032, 1024, 1024]
    - [0, 9.015]
  - - [64, 2624, 1, 1024, 64, 64, 1024, 1024]
    - [2, 5.941]
  - - [192, 2624, 1, 1024, 192, 192, 1024, 1024]
    - [0, 8.239]
  - - [320, 2624, 1, 1024, 320, 320, 1024, 1024]
    - [0, 8.548]
  - - [448, 2624, 1, 1024, 448, 448, 1024, 1024]
    - [0, 8.719]
  - - [576, 2624, 1, 1024, 576, 576, 1024, 1024]
    - [0, 8.589]
  - - [704, 2624, 1, 1024, 704, 704, 1024, 1024]
    - [0, 8.68]
  - - [832, 2624, 1, 1024, 832, 832, 1024, 1024]
    - [0, 8.782]
  - - [960, 2624, 1, 1024, 960, 960, 1024, 1024]
    - [0, 8.867]
  - - [1088, 2624, 1, 1024, 1088, 1088, 1024, 1024]
    - [0, 8.844]
  - - [1216, 2624, 1, 1024, 1216, 1216, 1024, 1024]
    - [0, 8.921]
  - - [1344, 2624, 1, 1024, 1344, 1344, 1024, 1024]
    - [0, 8.768]
  - - [1472, 2624, 1, 1024, 1472, 1472, 1024, 1024]
    - [0, 8.941]
  - - [1600, 2624, 1, 1024, 1600, 1600, 1024, 1024]
    - [0, 8.888]
  - - [1728, 2624, 1, 1024, 1728, 1728, 1024, 1024]
    - [0, 8.965]
  - - [1856, 2624, 1, 1024, 1856, 1856, 1024, 1024]
    - [0, 8.902]
  - - [1984, 2624, 1, 1024, 1984, 1984, 1024, 1024]
    - [0, 8.923]
  - - [2112, 2624, 1, 1024, 2112, 2112, 1024, 1024]
    - [0, 8.966]
  - - [2240, 2624, 1, 1024, 2240, 2240, 1024, 1024]
    - [0, 8.966]
  - - [2368, 2624, 1, 1024, 2368, 2368, 1024, 1024]
    - [0, 8.988]
  - - [2496, 2624, 1, 1024, 2496, 2496, 1024, 1024]
    - [0, 8.988]
  - - [2624, 2624, 1, 1024, 2624, 2624, 1024, 1024]
    - [0, 8.945]
  - - [2752, 2624, 1, 1024, 2752, 2752, 1024, 1024]
    - [0, 8.957]
  - - [2880, 2624, 1, 1024, 2880, 2880, 1024, 1024]
    - [0, 8.979]
  - - [3008, 2624, 1, 1024, 3008, 3008, 1024, 1024]
    - [0, 9.024]
  - - [3136, 2624, 1, 1024, 3136, 3136, 1024, 1024]
    - [0, 9.005]
  - - [3264, 2624, 1, 1024, 3264, 3264, 1024, 1024]
    - [0, 9.005]
  - - [3392, 2624, 1, 1024, 3392, 3392, 1024, 1024]
    - [0, 8.995]
  - - [3520, 2624, 1, 1024, 3520, 3520, 1024, 1024]
    - [0, 9.04]
  - - [3648, 2624, 1, 1024, 3648, 3648, 1024, 1024]
    - [0, 9.05]
  - - [3776, 2624, 1, 1024, 3776, 3776, 1024, 1024]
    - [0, 8.984]
  - - [3904, 2624, 1, 1024, 3904, 3904, 1024, 1024]
    - [0, 8.999]
  - - [4032, 2624, 1, 1024, 4032, 4032, 1024, 1024]
    - [0, 9.06]
  - - [64, 2752, 1, 1024, 64, 64, 1024, 1024]
    - [0, 6.402]
  - - [192, 2752, 1, 1024, 192, 192, 1024, 1024]
    - [0, 8.206]
  - - [320, 2752, 1, 1024, 320, 320, 1024, 1024]
    - [0, 8.643]
  - - [448, 2752, 1, 1024, 448, 448, 1024, 1024]
    - [0, 8.669]
  - - [576, 2752, 1, 1024, 576, 576, 1024, 1024]
    - [0, 8.696]
  - - [704, 2752, 1, 1024, 704, 704, 1024, 1024]
    - [0, 8.77]
  - - [832, 2752, 1, 1024, 832, 832, 1024, 1024]
    - [0, 8.848]
  - - [960, 2752, 1, 1024, 960, 960, 1024, 1024]
    - [0, 8.854]
  - - [1088, 2752, 1, 1024, 1088, 1088, 1024, 1024]
    - [0, 8.887]
  - - [1216, 2752, 1, 1024, 1216, 1216, 1024, 1024]
    - [0, 8.893]
  - - [1344, 2752, 1, 1024, 1344, 1344, 1024, 1024]
    - [0, 8.884]
  - - [1472, 2752, 1, 1024, 1472, 1472, 1024, 1024]
    - [0, 8.899]
  - - [1600, 2752, 1, 1024, 1600, 1600, 1024, 1024]
    - [0, 8.938]
  - - [1728, 2752, 1, 1024, 1728, 1728, 1024, 1024]
    - [0, 8.935]
  - - [1856, 2752, 1, 1024, 1856, 1856, 1024, 1024]
    - [0, 8.917]
  - - [1984, 2752, 1, 1024, 1984, 1984, 1024, 1024]
    - [0, 8.928]
  - - [2112, 2752, 1, 1024, 2112, 2112, 1024, 1024]
    - [0, 8.995]
  - - [2240, 2752, 1, 1024, 2240, 2240, 1024, 1024]
    - [0, 8.953]
  - - [2368, 2752, 1, 1024, 2368, 2368, 1024, 1024]
    - [0, 8.943]
  - - [2496, 2752, 1, 1024, 2496, 2496, 1024, 1024]
    - [0, 8.99]
  - - [2624, 2752, 1, 1024, 2624, 2624, 1024, 1024]
    - [0, 8.995]
  - - [2752, 2752, 1, 1024, 2752, 2752, 1024, 1024]
    - [0, 8.999]
  - - [2880, 2752, 1, 1024, 2880, 2880, 1024, 1024]
    - [0, 8.98]
  - - [3008, 2752, 1, 1024, 3008, 3008, 1024, 1024]
    - [0, 8.974]
  - - [3136, 2752, 1, 1024, 3136, 3136, 1024, 1024]
    - [0, 8.978]
  - - [3264, 2752, 1, 1024, 3264, 3264, 1024, 1024]
    - [0, 8.972]
  - - [3392, 2752, 1, 1024, 3392, 3392, 1024, 1024]
    - [0, 9.028]
  - - [3520, 2752, 1, 1024, 3520, 3520, 1024, 1024]
    - [0, 9.109]
  - - [3648, 2752, 1, 1024, 3648, 3648, 1024, 1024]
    - [0, 9.024]
  - - [3776, 2752, 1, 1024, 3776, 3776, 1024, 1024]
    - [0, 9.027]
  - - [3904, 2752, 1, 1024, 3904, 3904, 1024, 1024]
    - [0, 9.062]
  - - [4032, 2752, 1, 1024, 4032, 4032, 1024, 1024]
    - [0, 9.012]
  - - [64, 2880, 1, 1024, 64, 64, 1024, 1024]
    - [0, 7.574]
  - - [192, 2880, 1, 1024, 192, 192, 1024, 1024]
    - [0, 8.555]
  - - [320, 2880, 1, 1024, 320, 320, 1024, 1024]
    - [0, 8.745]
  - - [448, 2880, 1, 1024, 448, 448, 1024, 1024]
    - [0, 8.822]
  - - [576, 2880, 1, 1024, 576, 576, 1024, 1024]
    - [0, 8.734]
  - - [704, 2880, 1, 1024, 704, 704, 1024, 1024]
    - [0, 8.783]
  - - [832, 2880, 1, 1024, 832, 832, 1024, 1024]
    - [0, 8.821]
  - - [960, 2880, 1, 1024, 960, 960, 1024, 1024]
    - [0, 8.789]
  - - [1088, 2880, 1, 1024, 1088, 1088, 1024, 1024]
    - [0, 8.852]
  - - [1216, 2880, 1, 1024, 1216, 1216, 1024, 1024]
    - [0, 8.882]
  - - [1344, 2880, 1, 1024, 1344, 1344, 1024, 1024]
    - [0, 8.914]
  - - [1472, 2880, 1, 1024, 1472, 1472, 1024, 1024]
    - [0, 8.935]
  - - [1600, 2880, 1, 1024, 1600, 1600, 1024, 1024]
    - [0, 8.927]
  - - [1728, 2880, 1, 1024, 1728, 1728, 1024, 1024]
    - [0, 8.93]
  - - [1856, 2880, 1, 1024, 1856, 1856, 1024, 1024]
    - [0, 8.948]
  - - [1984, 2880, 1, 1024, 1984, 1984, 1024, 1024]
    - [0, 8.97]
  - - [2112, 2880, 1, 1024, 2112, 2112, 1024, 1024]
    - [0, 8.958]
  - - [2240, 2880, 1, 1024, 2240, 2240, 1024, 1024]
    - [0, 8.964]
  - - [2368, 2880, 1, 1024, 2368, 2368, 1024, 1024]
    - [0, 8.984]
  - - [2496, 2880, 1, 1024, 2496, 2496, 1024, 1024]
    - [0, 8.954]
  - - [2624, 2880, 1, 1024, 2624, 2624, 1024, 1024]
    - [0, 9.051]
  - - [2752, 2880, 1, 1024, 2752, 2752, 1024, 1024]
    - [0, 9.008]
  - - [2880, 2880, 1, 1024, 2880, 2880, 1024, 1024]
    - [0, 8.968]
  - - [3008, 2880, 1, 1024, 3008, 3008, 1024, 1024]
    - [0, 8.973]
  - - [3136, 2880, 1, 1024, 3136, 3136, 1024, 1024]
    - [0, 9.041]
  - - [3264, 2880, 1, 1024, 3264, 3264, 1024, 1024]
    - [0, 9.005]
  - - [3392, 2880, 1, 1024, 3392, 3392, 1024, 1024]
    - [0, 9.03]
  - - [3520, 2880, 1, 1024, 3520, 3520, 1024, 1024]
    - [0, 9.008]
  - - [3648, 2880, 1, 1024, 3648, 3648, 1024, 1024]
    - [0, 9.004]
  - - [3776, 2880, 1, 1024, 3776, 3776, 1024, 1024]
    - [0, 8.994]
  - - [3904, 2880, 1, 1024, 3904, 3904, 1024, 1024]
    - [0, 8.976]
  - - [4032, 2880, 1, 1024, 4032, 4032, 1024, 1024]
    - [0, 9.013]
  - - [64, 3008, 1, 1024, 64, 64, 1024, 1024]
    - [0, 7.117]
  - - [192, 3008, 1, 1024, 192, 192, 1024, 1024]
    - [0, 8.486]
  - - [320, 3008, 1, 1024, 320, 320, 1024, 1024]
    - [0, 8.607]
  - - [448, 3008, 1, 1024, 448, 448, 1024, 1024]
    - [0, 8.658]
  - - [576, 3008, 1, 1024, 576, 576, 1024, 1024]
    - [0, 8.692]
  - - [704, 3008, 1, 1024, 704, 704, 1024, 1024]
    - [0, 8.797]
  - - [832, 3008, 1, 1024, 832, 832, 1024, 1024]
    - [0, 8.811]
  - - [960, 3008, 1, 1024, 960, 960, 1024, 1024]
    - [0, 8.846]
  - - [1088, 3008, 1, 1024, 1088, 1088, 1024, 1024]
    - [0, 8.872]
  - - [1216, 3008, 1, 1024, 1216, 1216, 1024, 1024]
    - [0, 8.825]
  - - [1344, 3008, 1, 1024, 1344, 1344, 1024, 1024]
    - [0, 8.925]
  - - [1472, 3008, 1, 1024, 1472, 1472, 1024, 1024]
    - [0, 8.97]
  - - [1600, 3008, 1, 1024, 1600, 1600, 1024, 1024]
    - [0, 8.887]
  - - [1728, 3008, 1, 1024, 1728, 1728, 1024, 1024]
    - [0, 8.928]
  - - [1856, 3008, 1, 1024, 1856, 1856, 1024, 1024]
    - [0, 8.955]
  - - [1984, 3008, 1, 1024, 1984, 1984, 1024, 1024]
    - [0, 8.992]
  - - [2112, 3008, 1, 1024, 2112, 2112, 1024, 1024]
    - [0, 9.019]
  - - [2240, 3008, 1, 1024, 2240, 2240, 1024, 1024]
    - [0, 8.967]
  - - [2368, 3008, 1, 1024, 2368, 2368, 1024, 1024]
    - [0, 9.03]
  - - [2496, 3008, 1, 1024, 2496, 2496, 1024, 1024]
    - [0, 8.998]
  - - [2624, 3008, 1, 1024, 2624, 2624, 1024, 1024]
    - [0, 9.017]
  - - [2752, 3008, 1, 1024, 2752, 2752, 1024, 1024]
    - [0, 9.021]
  - - [2880, 3008, 1, 1024, 2880, 2880, 1024, 1024]
    - [0, 8.959]
  - - [3008, 3008, 1, 1024, 3008, 3008, 1024, 1024]
    - [0, 8.977]
  - - [3136, 3008, 1, 1024, 3136, 3136, 1024, 1024]
    - [0, 9.019]
  - - [3264, 3008, 1, 1024, 3264, 3264, 1024, 1024]
    - [0, 8.99]
  - - [3392, 3008, 1, 1024, 3392, 3392, 1024, 1024]
    - [0, 9.027]
  - - [3520, 3008, 1, 1024, 3520, 3520, 1024, 1024]
    - [0, 9.03]
  - - [3648, 3008, 1, 1024, 3648, 3648, 1024, 1024]
    - [0, 9.004]
  - - [3776, 3008, 1, 1024, 3776, 3776, 1024, 1024]
    - [0, 8.996]
  - - [3904, 3008, 1, 1024, 3904, 3904, 1024, 1024]
    - [0, 9.014]
  - - [4032, 3008, 1, 1024, 4032, 4032, 1024, 1024]
    - [0, 9.001]
  - - [64, 3136, 1, 1024, 64, 64, 1024, 1024]
    - [0, 7.386]
  - - [192, 3136, 1, 1024, 192, 192, 1024, 1024]
    - [0, 8.433]
  - - [320, 3136, 1, 1024, 320, 320, 1024, 1024]
    - [0, 8.693]
  - - [448, 3136, 1, 1024, 448, 448, 1024, 1024]
    - [0, 8.798]
  - - [576, 3136, 1, 1024, 576, 576, 1024, 1024]
    - [0, 8.755]
  - - [704, 3136, 1, 1024, 704, 704, 1024, 1024]
    - [0, 8.818]
  - - [832, 3136, 1, 1024, 832, 832, 1024, 1024]
    - [0, 8.842]
  - - [960, 3136, 1, 1024, 960, 960, 1024, 1024]
    - [0, 8.855]
  - - [1088, 3136, 1, 1024, 1088, 1088, 1024, 1024]
    - [0, 8.859]
  - - [1216, 3136, 1, 1024, 1216, 1216, 1024, 1024]
    - [0, 8.939]
  - - [1344, 3136, 1, 1024, 1344, 1344, 1024, 1024]
    - [0, 8.891]
  - - [1472, 3136, 1, 1024, 1472, 1472, 1024, 1024]
    - [0, 8.931]
  - - [1600, 3136, 1, 1024, 1600, 1600, 1024, 1024]
    - [0, 8.938]
  - - [1728, 3136, 1, 1024, 1728, 1728, 1024, 1024]
    - [0, 8.924]
  - - [1856, 3136, 1, 1024, 1856, 1856, 1024, 1024]
    - [0, 8.969]
  - - [1984, 3136, 1, 1024, 1984, 1984, 1024, 1024]
    - [0, 8.966]
  - - [2112, 3136, 1, 1024, 2112, 2112, 1024, 1024]
    - [0, 8.98]
  - - [2240, 3136, 1, 1024, 2240, 2240, 1024, 1024]
    - [0, 9.029]
  - - [2368, 3136, 1, 1024, 2368, 2368, 1024, 1024]
    - [0, 8.987]
  - - [2496, 3136, 1, 1024, 2496, 2496, 1024, 1024]
    - [0, 8.994]
  - - [2624, 3136, 1, 1024, 2624, 2624, 1024, 1024]
    - [0, 8.988]
  - - [2752, 3136, 1, 1024, 2752, 2752, 1024, 1024]
    - [0, 9.044]
  - - [2880, 3136, 1, 1024, 2880, 2880, 1024, 1024]
    - [0, 9.014]
  - - [3008, 3136, 1, 1024, 3008, 3008, 1024, 1024]
    - [0, 8.996]
  - - [3136, 3136, 1, 1024, 3136, 3136, 1024, 1024]
    - [0, 9.005]
  - - [3264, 3136, 1, 1024, 3264, 3264, 1024, 1024]
    - [0, 9.047]
  - - [3392, 3136, 1, 1024, 3392, 3392, 1024, 1024]
    - [0, 8.986]
  - - [3520, 3136, 1, 1024, 3520, 3520, 1024, 1024]
    - [0, 8.998]
  - - [3648, 3136, 1, 1024, 3648, 3648, 1024, 1024]
    - [0, 9.023]
  - - [3776, 3136, 1, 1024, 3776, 3776, 1024, 1024]
    - [0, 8.99]
  - - [3904, 3136, 1, 1024, 3904, 3904, 1024, 1024]
    - [0, 9.06]
  - - [4032, 3136, 1, 1024, 4032, 4032, 1024, 1024]
    - [0, 9.076]
  - - [64, 3264, 1, 1024, 64, 64, 1024, 1024]
    - [0, 6.785]
  - - [192, 3264, 1, 1024, 192, 192, 1024, 1024]
    - [0, 8.388]
  - - [320, 3264, 1, 1024, 320, 320, 1024, 1024]
    - [0, 8.779]
  - - [448, 3264, 1, 1024, 448, 448, 1024, 1024]
    - [0, 8.595]
  - - [576, 3264, 1, 1024, 576, 576, 1024, 1024]
    - [0, 8.701]
  - - [704, 3264, 1, 1024, 704, 704, 1024, 1024]
    - [0, 8.811]
  - - [832, 3264, 1, 1024, 832, 832, 1024, 1024]
    - [0, 8.746]
  - - [960, 3264, 1, 1024, 960, 960, 1024, 1024]
    - [0, 8.859]
  - - [1088, 3264, 1, 1024, 1088, 1088, 1024, 1024]
    - [0, 8.866]
  - - [1216, 3264, 1, 1024, 1216, 1216, 1024, 1024]
    - [0, 8.877]
  - - [1344, 3264, 1, 1024, 1344, 1344, 1024, 1024]
    - [0, 8.902]
  - - [1472, 3264, 1, 1024, 1472, 1472, 1024, 1024]
    - [0, 8.874]
  - - [1600, 3264, 1, 1024, 1600, 1600, 1024, 1024]
    - [0, 8.917]
  - - [1728, 3264, 1, 1024, 1728, 1728, 1024, 1024]
    - [0, 8.948]
  - - [1856, 3264, 1, 1024, 1856, 1856, 1024, 1024]
    - [0, 9.034]
  - - [1984, 3264, 1, 1024, 1984, 1984, 1024, 1024]
    - [0, 8.95]
  - - [2112, 3264, 1, 1024, 2112, 2112, 1024, 1024]
    - [0, 8.949]
  - - [2240, 3264, 1, 1024, 2240, 2240, 1024, 1024]
    - [0, 8.973]
  - - [2368, 3264, 1, 1024, 2368, 2368, 1024, 1024]
    - [0, 9.019]
  - - [2496, 3264, 1, 1024, 2496, 2496, 1024, 1024]
    - [0, 9.03]
  - - [2624, 3264, 1, 1024, 2624, 2624, 1024, 1024]
    - [0, 9.022]
  - - [2752, 3264, 1, 1024, 2752, 2752, 1024, 1024]
    - [0, 9.003]
  - - [2880, 3264, 1, 1024, 2880, 2880, 1024, 1024]
    - [0, 9.051]
  - - [3008, 3264, 1, 1024, 3008, 3008, 1024, 1024]
    - [0, 9.035]
  - - [3136, 3264, 1, 1024, 3136, 3136, 1024, 1024]
    - [0, 8.988]
  - - [3264, 3264, 1, 1024, 3264, 3264, 1024, 1024]
    - [0, 9.045]
  - - [3392, 3264, 1, 1024, 3392, 3392, 1024, 1024]
    - [0, 8.992]
  - - [3520, 3264, 1, 1024, 3520, 3520, 1024, 1024]
    - [0, 9.059]
  - - [3648, 3264, 1, 1024, 3648, 3648, 1024, 1024]
    - [0, 9.042]
  - - [3776, 3264, 1, 1024, 3776, 3776, 1024, 1024]
    - [0, 9.002]
  - - [3904, 3264, 1, 1024, 3904, 3904, 1024, 1024]
    - [0, 9.044]
  - - [4032, 3264, 1, 1024, 4032, 4032, 1024, 1024]
    - [0, 9.01]
  - - [64, 3392, 1, 1024, 64, 64, 1024, 1024]
    - [0, 7.165]
  - - [192, 3392, 1, 1024, 192, 192, 1024, 1024]
    - [0, 8.354]
  - - [320, 3392, 1, 1024, 320, 320, 1024, 1024]
    - [0, 8.651]
  - - [448, 3392, 1, 1024, 448, 448, 1024, 1024]
    - [0, 8.658]
  - - [576, 3392, 1, 1024, 576, 576, 1024, 1024]
    - [0, 8.756]
  - - [704, 3392, 1, 1024, 704, 704, 1024, 1024]
    - [0, 8.799]
  - - [832, 3392, 1, 1024, 832, 832, 1024, 1024]
    - [0, 8.848]
  - - [960, 3392, 1, 1024, 960, 960, 1024, 1024]
    - [0, 8.885]
  - - [1088, 3392, 1, 1024, 1088, 1088, 1024, 1024]
    - [0, 8.931]
  - - [1216, 3392, 1, 1024, 1216, 1216, 1024, 1024]
    - [0, 8.903]
  - - [1344, 3392, 1, 1024, 1344, 1344, 1024, 1024]
    - [0, 8.904]
  - - [1472, 3392, 1, 1024, 1472, 1472, 1024, 1024]
    - [0, 8.921]
  - - [1600, 3392, 1, 1024, 1600, 1600, 1024, 1024]
    - [0, 8.937]
  - - [1728, 3392, 1, 1024, 1728, 1728, 1024, 1024]
    - [0, 8.947]
  - - [1856, 3392, 1, 1024, 1856, 1856, 1024, 1024]
    - [0, 8.984]
  - - [1984, 3392, 1, 1024, 1984, 1984, 1024, 1024]
    - [0, 8.964]
  - - [2112, 3392, 1, 1024, 2112, 2112, 1024, 1024]
    - [0, 8.962]
  - - [2240, 3392, 1, 1024, 2240, 2240, 1024, 1024]
    - [0, 9.016]
  - - [2368, 3392, 1, 1024, 2368, 2368, 1024, 1024]
    - [0, 9.003]
  - - [2496, 3392, 1, 1024, 2496, 2496, 1024, 1024]
    - [0, 9.027]
  - - [2624, 3392, 1, 1024, 2624, 2624, 1024, 1024]
    - [0, 8.99]
  - - [2752, 3392, 1, 1024, 2752, 2752, 1024, 1024]
    - [0, 9.001]
  - - [2880, 3392, 1, 1024, 2880, 2880, 1024, 1024]
    - [0, 9.04]
  - - [3008, 3392, 1, 1024, 3008, 3008, 1024, 1024]
    - [0, 9.06]
  - - [3136, 3392, 1, 1024, 3136, 3136, 1024, 1024]
    - [0, 9.012]
  - - [3264, 3392, 1, 1024, 3264, 3264, 1024, 1024]
    - [0, 9.0]
  - - [3392, 3392, 1, 1024, 3392, 3392, 1024, 1024]
    - [0, 9.117]
  - - [3520, 3392, 1, 1024, 3520, 3520, 1024, 1024]
    - [0, 9.095]
  - - [3648, 3392, 1, 1024, 3648, 3648, 1024, 1024]
    - [0, 9.006]
  - - [3776, 3392, 1, 1024, 3776, 3776, 1024, 1024]
    - [0, 8.995]
  - - [3904, 3392, 1, 1024, 3904, 3904, 1024, 1024]
    - [0, 9.033]
  - - [4032, 3392, 1, 1024, 4032, 4032, 1024, 1024]
    - [0, 9.005]
  - - [64, 3520, 1, 1024, 64, 64, 1024, 1024]
    - [0, 6.594]
  - - [192, 3520, 1, 1024, 192, 192, 1024, 1024]
    - [0, 8.629]
  - - [320, 3520, 1, 1024, 320, 320, 1024, 1024]
    - [0, 8.733]
  - - [448, 3520, 1, 1024, 448, 448, 1024, 1024]
    - [0, 8.66]
  - - [576, 3520, 1, 1024, 576, 576, 1024, 1024]
    - [0, 8.795]
  - - [704, 3520, 1, 1024, 704, 704, 1024, 1024]
    - [0, 8.818]
  - - [832, 3520, 1, 1024, 832, 832, 1024, 1024]
    - [0, 8.762]
  - - [960, 3520, 1, 1024, 960, 960, 1024, 1024]
    - [0, 8.88]
  - - [1088, 3520, 1, 1024, 1088, 1088, 1024, 1024]
    - [0, 8.96]
  - - [1216, 3520, 1, 1024, 1216, 1216, 1024, 1024]
    - [0, 8.991]
  - - [1344, 3520, 1, 1024, 1344, 1344, 1024, 1024]
    - [0, 8.921]
  - - [1472, 3520, 1, 1024, 1472, 1472, 1024, 1024]
    - [0, 8.992]
  - - [1600, 3520, 1, 1024, 1600, 1600, 1024, 1024]
    - [0, 8.929]
  - - [1728, 3520, 1, 1024, 1728, 1728, 1024, 1024]
    - [0, 8.971]
  - - [1856, 3520, 1, 1024, 1856, 1856, 1024, 1024]
    - [0, 8.947]
