library/src/amd_detail/rocblaslt/src/Tensile/Logic/asm_full/navi32/GridBased/navi32_Cijk_Ailk_Bjlk_BSS_BH_Bias_HAH.yaml
- {MinimumRequiredVersion: 4.33.0}
- navi32
- gfx1101
- [Device 73f0]
    SolutionIndex: 0
    SolutionNameMin: Cijk_Ailk_Bjlk_BSS_BH_Bias_HAH_MT32x32x64_MI16x16x16x1_SN_MIWT1_1_WG32_4_1
    SolutionIndex: 1
    SolutionNameMin: Cijk_Ailk_Bjlk_BSS_BH_Bias_HAH_MT16x16x64_MI16x16x16x1_SN_MIWT1_1_WG16_2_1
    SolutionIndex: 2
    SolutionNameMin: Cijk_Ailk_Bjlk_BSS_BH_Bias_HAH_MT32x16x64_MI16x16x16x1_SN_MIWT1_1_WG32_2_1
    SolutionIndex: 3
    SolutionNameMin: Cijk_Ailk_Bjlk_BSS_BH_Bias_HAH_MT16x32x64_MI16x16x16x1_SN_MIWT1_1_WG16_4_1
- - - [64, 64, 1, 64, 64, 64, 64, 64]
    - [2, 0.152]
  - - [192, 64, 1, 64, 192, 192, 192, 64]
    - [0, 0.449]
  - - [320, 64, 1, 64, 320, 320, 320, 64]
    - [0, 0.738]
  - - [448, 64, 1, 64, 448, 448, 448, 64]
    - [0, 1.031]
  - - [576, 64, 1, 64, 576, 576, 576, 64]
    - [2, 1.26]
  - - [704, 64, 1, 64, 704, 704, 704, 64]
    - [1, 0.825]
  - - [832, 64, 1, 64, 832, 832, 832, 64]
    - [0, 0.975]
  - - [960, 64, 1, 64, 960, 960, 960, 64]
    - [0, 1.13]
  - - [1088, 64, 1, 64, 1088, 1088, 1088, 64]
    - [3, 1.274]
  - - [1216, 64, 1, 64, 1216, 1216, 1216, 64]
    - [2, 1.427]
  - - [1344, 64, 1, 64, 1344, 1344, 1344, 64]
    - [0, 2.744]
  - - [1472, 64, 1, 64, 1472, 1472, 1472, 64]
    - [0, 2.891]
  - - [1600, 64, 1, 64, 1600, 1600, 1600, 64]
    - [0, 3.103]
  - - [1728, 64, 1, 64, 1728, 1728, 1728, 64]
    - [0, 3.34]
  - - [1856, 64, 1, 64, 1856, 1856, 1856, 64]
    - [0, 3.58]
  - - [1984, 64, 1, 64, 1984, 1984, 1984, 64]
    - [0, 3.673]
  - - [2112, 64, 1, 64, 2112, 2112, 2112, 64]
    - [0, 3.896]
  - - [2240, 64, 1, 64, 2240, 2240, 2240, 64]
    - [0, 4.13]
  - - [2368, 64, 1, 64, 2368, 2368, 2368, 64]
    - [0, 4.373]
  - - [2496, 64, 1, 64, 2496, 2496, 2496, 64]
    - [0, 3.863]
  - - [2624, 64, 1, 64, 2624, 2624, 2624, 64]
    - [0, 4.065]
  - - [2752, 64, 1, 64, 2752, 2752, 2752, 64]
    - [0, 3.216]
  - - [2880, 64, 1, 64, 2880, 2880, 2880, 64]
    - [2, 4.188]
  - - [3008, 64, 1, 64, 3008, 3008, 3008, 64]
    - [0, 4.439]
  - - [3136, 64, 1, 64, 3136, 3136, 3136, 64]
    - [0, 4.606]
  - - [3264, 64, 1, 64, 3264, 3264, 3264, 64]
    - [0, 4.66]
  - - [3392, 64, 1, 64, 3392, 3392, 3392, 64]
    - [0, 4.793]
  - - [3520, 64, 1, 64, 3520, 3520, 3520, 64]
    - [0, 4.974]
  - - [3648, 64, 1, 64, 3648, 3648, 3648, 64]
    - [0, 4.997]
  - - [3776, 64, 1, 64, 3776, 3776, 3776, 64]
    - [0, 5.114]
  - - [3904, 64, 1, 64, 3904, 3904, 3904, 64]
    - [0, 5.255]
  - - [4032, 64, 1, 64, 4032, 4032, 4032, 64]
    - [0, 5.331]
  - - [64, 192, 1, 64, 64, 64, 64, 192]
    - [2, 0.453]
  - - [192, 192, 1, 64, 192, 192, 192, 192]
    - [2, 1.259]
  - - [320, 192, 1, 64, 320, 320, 320, 192]
    - [0, 2.076]
  - - [448, 192, 1, 64, 448, 448, 448, 192]
    - [0, 2.746]
  - - [576, 192, 1, 64, 576, 576, 576, 192]
    - [0, 3.347]
  - - [704, 192, 1, 64, 704, 704, 704, 192]
    - [0, 3.92]
  - - [832, 192, 1, 64, 832, 832, 832, 192]
    - [0, 3.922]
  - - [960, 192, 1, 64, 960, 960, 960, 192]
    - [0, 4.42]
  - - [1088, 192, 1, 64, 1088, 1088, 1088, 192]
    - [0, 4.658]
  - - [1216, 192, 1, 64, 1216, 1216, 1216, 192]
    - [0, 5.081]
  - - [1344, 192, 1, 64, 1344, 1344, 1344, 192]
    - [0, 5.397]
  - - [1472, 192, 1, 64, 1472, 1472, 1472, 192]
    - [0, 5.675]
  - - [1600, 192, 1, 64, 1600, 1600, 1600, 192]
    - [0, 6.089]
  - - [1728, 192, 1, 64, 1728, 1728, 1728, 192]
    - [0, 6.012]
  - - [1856, 192, 1, 64, 1856, 1856, 1856, 192]
    - [0, 6.224]
  - - [1984, 192, 1, 64, 1984, 1984, 1984, 192]
    - [0, 6.379]
  - - [2112, 192, 1, 64, 2112, 2112, 2112, 192]
    - [0, 6.483]
  - - [2240, 192, 1, 64, 2240, 2240, 2240, 192]
    - [0, 6.625]
  - - [2368, 192, 1, 64, 2368, 2368, 2368, 192]
    - [0, 6.804]
  - - [2496, 192, 1, 64, 2496, 2496, 2496, 192]
    - [0, 6.803]
  - - [2624, 192, 1, 64, 2624, 2624, 2624, 192]
    - [0, 6.95]
  - - [2752, 192, 1, 64, 2752, 2752, 2752, 192]
    - [0, 7.049]
  - - [2880, 192, 1, 64, 2880, 2880, 2880, 192]
    - [0, 7.187]
  - - [3008, 192, 1, 64, 3008, 3008, 3008, 192]
    - [0, 7.351]
  - - [3136, 192, 1, 64, 3136, 3136, 3136, 192]
    - [0, 7.452]
  - - [3264, 192, 1, 64, 3264, 3264, 3264, 192]
    - [0, 7.521]
  - - [3392, 192, 1, 64, 3392, 3392, 3392, 192]
    - [0, 7.567]
  - - [3520, 192, 1, 64, 3520, 3520, 3520, 192]
    - [0, 7.656]
  - - [3648, 192, 1, 64, 3648, 3648, 3648, 192]
    - [0, 7.776]
  - - [3776, 192, 1, 64, 3776, 3776, 3776, 192]
    - [0, 7.828]
  - - [3904, 192, 1, 64, 3904, 3904, 3904, 192]
    - [0, 7.914]
  - - [4032, 192, 1, 64, 4032, 4032, 4032, 192]
    - [0, 7.978]
  - - [64, 320, 1, 64, 64, 64, 64, 320]
    - [0, 0.743]
  - - [192, 320, 1, 64, 192, 192, 192, 320]
    - [0, 2.07]
  - - [320, 320, 1, 64, 320, 320, 320, 320]
    - [0, 3.09]
  - - [448, 320, 1, 64, 448, 448, 448, 320]
    - [0, 4.145]
  - - [576, 320, 1, 64, 576, 576, 576, 320]
    - [0, 4.41]
  - - [704, 320, 1, 64, 704, 704, 704, 320]
    - [0, 4.942]
  - - [832, 320, 1, 64, 832, 832, 832, 320]
    - [0, 5.455]
  - - [960, 320, 1, 64, 960, 960, 960, 320]
    - [0, 6.024]
  - - [1088, 320, 1, 64, 1088, 1088, 1088, 320]
    - [0, 6.081]
  - - [1216, 320, 1, 64, 1216, 1216, 1216, 320]
    - [0, 6.439]
  - - [1344, 320, 1, 64, 1344, 1344, 1344, 320]
    - [0, 6.651]
  - - [1472, 320, 1, 64, 1472, 1472, 1472, 320]
    - [0, 6.797]
  - - [1600, 320, 1, 64, 1600, 1600, 1600, 320]
    - [0, 7.088]
  - - [1728, 320, 1, 64, 1728, 1728, 1728, 320]
    - [0, 7.222]
  - - [1856, 320, 1, 64, 1856, 1856, 1856, 320]
    - [0, 7.439]
  - - [1984, 320, 1, 64, 1984, 1984, 1984, 320]
    - [0, 7.527]
  - - [2112, 320, 1, 64, 2112, 2112, 2112, 320]
    - [0, 7.691]
  - - [2240, 320, 1, 64, 2240, 2240, 2240, 320]
    - [0, 7.783]
  - - [2368, 320, 1, 64, 2368, 2368, 2368, 320]
    - [0, 7.94]
  - - [2496, 320, 1, 64, 2496, 2496, 2496, 320]
    - [0, 8.062]
  - - [2624, 320, 1, 64, 2624, 2624, 2624, 320]
    - [0, 8.128]
  - - [2752, 320, 1, 64, 2752, 2752, 2752, 320]
    - [0, 8.254]
  - - [2880, 320, 1, 64, 2880, 2880, 2880, 320]
    - [0, 8.348]
  - - [3008, 320, 1, 64, 3008, 3008, 3008, 320]
    - [0, 8.419]
  - - [3136, 320, 1, 64, 3136, 3136, 3136, 320]
    - [0, 8.514]
  - - [3264, 320, 1, 64, 3264, 3264, 3264, 320]
    - [0, 8.61]
  - - [3392, 320, 1, 64, 3392, 3392, 3392, 320]
    - [0, 8.66]
  - - [3520, 320, 1, 64, 3520, 3520, 3520, 320]
    - [0, 8.721]
  - - [3648, 320, 1, 64, 3648, 3648, 3648, 320]
    - [0, 8.793]
  - - [3776, 320, 1, 64, 3776, 3776, 3776, 320]
    - [0, 8.833]
  - - [3904, 320, 1, 64, 3904, 3904, 3904, 320]
    - [0, 8.909]
  - - [4032, 320, 1, 64, 4032, 4032, 4032, 320]
    - [0, 8.954]
  - - [64, 448, 1, 64, 64, 64, 64, 448]
    - [0, 1.04]
  - - [192, 448, 1, 64, 192, 192, 192, 448]
    - [0, 2.74]
  - - [320, 448, 1, 64, 320, 320, 320, 448]
    - [0, 4.149]
  - - [448, 448, 1, 64, 448, 448, 448, 448]
    - [0, 4.607]
  - - [576, 448, 1, 64, 576, 576, 576, 448]
    - [0, 5.379]
  - - [704, 448, 1, 64, 704, 704, 704, 448]
    - [0, 5.756]
  - - [832, 448, 1, 64, 832, 832, 832, 448]
    - [0, 6.293]
  - - [960, 448, 1, 64, 960, 960, 960, 448]
    - [0, 6.658]
  - - [1088, 448, 1, 64, 1088, 1088, 1088, 448]
    - [0, 6.901]
  - - [1216, 448, 1, 64, 1216, 1216, 1216, 448]
    - [0, 7.204]
  - - [1344, 448, 1, 64, 1344, 1344, 1344, 448]
    - [0, 7.471]
  - - [1472, 448, 1, 64, 1472, 1472, 1472, 448]
    - [0, 7.65]
  - - [1600, 448, 1, 64, 1600, 1600, 1600, 448]
    - [0, 7.815]
  - - [1728, 448, 1, 64, 1728, 1728, 1728, 448]
    - [0, 8.0]
  - - [1856, 448, 1, 64, 1856, 1856, 1856, 448]
    - [0, 8.121]
  - - [1984, 448, 1, 64, 1984, 1984, 1984, 448]
    - [0, 8.267]
  - - [2112, 448, 1, 64, 2112, 2112, 2112, 448]
    - [0, 8.408]
  - - [2240, 448, 1, 64, 2240, 2240, 2240, 448]
    - [0, 8.498]
  - - [2368, 448, 1, 64, 2368, 2368, 2368, 448]
    - [0, 8.595]
  - - [2496, 448, 1, 64, 2496, 2496, 2496, 448]
    - [0, 8.736]
  - - [2624, 448, 1, 64, 2624, 2624, 2624, 448]
    - [0, 8.787]
  - - [2752, 448, 1, 64, 2752, 2752, 2752, 448]
    - [0, 8.896]
  - - [2880, 448, 1, 64, 2880, 2880, 2880, 448]
    - [0, 8.98]
  - - [3008, 448, 1, 64, 3008, 3008, 3008, 448]
    - [0, 9.033]
  - - [3136, 448, 1, 64, 3136, 3136, 3136, 448]
    - [0, 9.113]
  - - [3264, 448, 1, 64, 3264, 3264, 3264, 448]
    - [0, 9.187]
  - - [3392, 448, 1, 64, 3392, 3392, 3392, 448]
    - [0, 9.228]
  - - [3520, 448, 1, 64, 3520, 3520, 3520, 448]
    - [0, 9.284]
  - - [3648, 448, 1, 64, 3648, 3648, 3648, 448]
    - [0, 9.354]
  - - [3776, 448, 1, 64, 3776, 3776, 3776, 448]
    - [0, 9.383]
  - - [3904, 448, 1, 64, 3904, 3904, 3904, 448]
    - [0, 9.424]
  - - [4032, 448, 1, 64, 4032, 4032, 4032, 448]
    - [0, 9.487]
  - - [64, 576, 1, 64, 64, 64, 64, 576]
    - [0, 1.256]
  - - [192, 576, 1, 64, 192, 192, 192, 576]
    - [0, 3.333]
  - - [320, 576, 1, 64, 320, 320, 320, 576]
    - [0, 4.401]
  - - [448, 576, 1, 64, 448, 448, 448, 576]
    - [0, 5.346]
  - - [576, 576, 1, 64, 576, 576, 576, 576]
    - [0, 5.99]
  - - [704, 576, 1, 64, 704, 704, 704, 576]
    - [0, 6.469]
  - - [832, 576, 1, 64, 832, 832, 832, 576]
    - [0, 6.892]
  - - [960, 576, 1, 64, 960, 960, 960, 576]
    - [0, 7.314]
  - - [1088, 576, 1, 64, 1088, 1088, 1088, 576]
    - [0, 7.513]
  - - [1216, 576, 1, 64, 1216, 1216, 1216, 576]
    - [0, 7.756]
  - - [1344, 576, 1, 64, 1344, 1344, 1344, 576]
    - [0, 8.005]
  - - [1472, 576, 1, 64, 1472, 1472, 1472, 576]
    - [0, 8.192]
  - - [1600, 576, 1, 64, 1600, 1600, 1600, 576]
    - [0, 8.364]
  - - [1728, 576, 1, 64, 1728, 1728, 1728, 576]
    - [0, 8.539]
  - - [1856, 576, 1, 64, 1856, 1856, 1856, 576]
    - [0, 8.651]
  - - [1984, 576, 1, 64, 1984, 1984, 1984, 576]
    - [0, 8.736]
  - - [2112, 576, 1, 64, 2112, 2112, 2112, 576]
    - [0, 8.879]
  - - [2240, 576, 1, 64, 2240, 2240, 2240, 576]
    - [0, 8.965]
  - - [2368, 576, 1, 64, 2368, 2368, 2368, 576]
    - [0, 9.048]
  - - [2496, 576, 1, 64, 2496, 2496, 2496, 576]
    - [0, 9.165]
  - - [2624, 576, 1, 64, 2624, 2624, 2624, 576]
    - [0, 9.213]
  - - [2752, 576, 1, 64, 2752, 2752, 2752, 576]
    - [0, 9.278]
  - - [2880, 576, 1, 64, 2880, 2880, 2880, 576]
    - [0, 9.372]
  - - [3008, 576, 1, 64, 3008, 3008, 3008, 576]
    - [0, 9.417]
  - - [3136, 576, 1, 64, 3136, 3136, 3136, 576]
    - [0, 9.473]
  - - [3264, 576, 1, 64, 3264, 3264, 3264, 576]
    - [0, 9.556]
  - - [3392, 576, 1, 64, 3392, 3392, 3392, 576]
    - [0, 9.57]
  - - [3520, 576, 1, 64, 3520, 3520, 3520, 576]
    - [0, 9.624]
  - - [3648, 576, 1, 64, 3648, 3648, 3648, 576]
    - [0, 9.684]
  - - [3776, 576, 1, 64, 3776, 3776, 3776, 576]
    - [0, 9.695]
  - - [3904, 576, 1, 64, 3904, 3904, 3904, 576]
    - [0, 9.74]
  - - [4032, 576, 1, 64, 4032, 4032, 4032, 576]
    - [0, 9.797]
  - - [64, 704, 1, 64, 64, 64, 64, 704]
    - [0, 1.533]
  - - [192, 704, 1, 64, 192, 192, 192, 704]
    - [1, 3.131]
  - - [320, 704, 1, 64, 320, 320, 320, 704]
    - [0, 4.137]
  - - [448, 704, 1, 64, 448, 448, 448, 704]
    - [0, 5.787]
  - - [576, 704, 1, 64, 576, 576, 576, 704]
    - [0, 6.483]
  - - [704, 704, 1, 64, 704, 704, 704, 704]
    - [0, 6.985]
  - - [832, 704, 1, 64, 832, 832, 832, 704]
    - [0, 7.385]
  - - [960, 704, 1, 64, 960, 960, 960, 704]
    - [0, 7.715]
  - - [1088, 704, 1, 64, 1088, 1088, 1088, 704]
    - [0, 7.98]
  - - [1216, 704, 1, 64, 1216, 1216, 1216, 704]
    - [0, 8.204]
  - - [1344, 704, 1, 64, 1344, 1344, 1344, 704]
    - [0, 8.423]
  - - [1472, 704, 1, 64, 1472, 1472, 1472, 704]
    - [0, 8.607]
  - - [1600, 704, 1, 64, 1600, 1600, 1600, 704]
    - [0, 8.764]
  - - [1728, 704, 1, 64, 1728, 1728, 1728, 704]
    - [0, 8.9]
  - - [1856, 704, 1, 64, 1856, 1856, 1856, 704]
    - [0, 8.993]
  - - [1984, 704, 1, 64, 1984, 1984, 1984, 704]
    - [0, 9.105]
  - - [2112, 704, 1, 64, 2112, 2112, 2112, 704]
    - [0, 9.228]
  - - [2240, 704, 1, 64, 2240, 2240, 2240, 704]
    - [0, 9.283]
  - - [2368, 704, 1, 64, 2368, 2368, 2368, 704]
    - [0, 9.361]
  - - [2496, 704, 1, 64, 2496, 2496, 2496, 704]
    - [0, 9.449]
  - - [2624, 704, 1, 64, 2624, 2624, 2624, 704]
    - [0, 9.504]
  - - [2752, 704, 1, 64, 2752, 2752, 2752, 704]
    - [0, 9.574]
  - - [2880, 704, 1, 64, 2880, 2880, 2880, 704]
    - [0, 9.65]
  - - [3008, 704, 1, 64, 3008, 3008, 3008, 704]
    - [0, 9.689]
  - - [3136, 704, 1, 64, 3136, 3136, 3136, 704]
    - [0, 9.737]
  - - [3264, 704, 1, 64, 3264, 3264, 3264, 704]
    - [0, 9.79]
  - - [3392, 704, 1, 64, 3392, 3392, 3392, 704]
    - [0, 9.827]
  - - [3520, 704, 1, 64, 3520, 3520, 3520, 704]
    - [0, 9.853]
  - - [3648, 704, 1, 64, 3648, 3648, 3648, 704]
    - [0, 9.91]
  - - [3776, 704, 1, 64, 3776, 3776, 3776, 704]
    - [0, 9.922]
  - - [3904, 704, 1, 64, 3904, 3904, 3904, 704]
    - [0, 9.974]
  - - [4032, 704, 1, 64, 4032, 4032, 4032, 704]
    - [0, 10.006]
  - - [64, 832, 1, 64, 64, 64, 64, 832]
    - [3, 0.975]
  - - [192, 832, 1, 64, 192, 192, 192, 832]
    - [0, 2.936]
  - - [320, 832, 1, 64, 320, 320, 320, 832]
    - [3, 4.919]
  - - [448, 832, 1, 64, 448, 448, 448, 832]
    - [0, 6.316]
  - - [576, 832, 1, 64, 576, 576, 576, 832]
    - [0, 6.923]
  - - [704, 832, 1, 64, 704, 704, 704, 832]
    - [0, 7.413]
  - - [832, 832, 1, 64, 832, 832, 832, 832]
    - [0, 7.727]
  - - [960, 832, 1, 64, 960, 960, 960, 832]
    - [0, 8.076]
  - - [1088, 832, 1, 64, 1088, 1088, 1088, 832]
    - [0, 8.33]
  - - [1216, 832, 1, 64, 1216, 1216, 1216, 832]
    - [0, 8.562]
  - - [1344, 832, 1, 64, 1344, 1344, 1344, 832]
    - [0, 8.774]
  - - [1472, 832, 1, 64, 1472, 1472, 1472, 832]
    - [0, 8.899]
  - - [1600, 832, 1, 64, 1600, 1600, 1600, 832]
    - [0, 9.049]
  - - [1728, 832, 1, 64, 1728, 1728, 1728, 832]
    - [0, 9.171]
  - - [1856, 832, 1, 64, 1856, 1856, 1856, 832]
    - [0, 9.268]
  - - [1984, 832, 1, 64, 1984, 1984, 1984, 832]
    - [0, 9.357]
  - - [2112, 832, 1, 64, 2112, 2112, 2112, 832]
    - [0, 9.463]
  - - [2240, 832, 1, 64, 2240, 2240, 2240, 832]
    - [0, 9.525]
  - - [2368, 832, 1, 64, 2368, 2368, 2368, 832]
    - [0, 9.588]
  - - [2496, 832, 1, 64, 2496, 2496, 2496, 832]
    - [0, 9.659]
  - - [2624, 832, 1, 64, 2624, 2624, 2624, 832]
    - [0, 9.713]
  - - [2752, 832, 1, 64, 2752, 2752, 2752, 832]
    - [0, 9.768]
  - - [2880, 832, 1, 64, 2880, 2880, 2880, 832]
    - [0, 9.834]
  - - [3008, 832, 1, 64, 3008, 3008, 3008, 832]
    - [0, 9.85]
  - - [3136, 832, 1, 64, 3136, 3136, 3136, 832]
    - [0, 9.897]
  - - [3264, 832, 1, 64, 3264, 3264, 3264, 832]
    - [0, 9.961]
  - - [3392, 832, 1, 64, 3392, 3392, 3392, 832]
    - [0, 9.982]
  - - [3520, 832, 1, 64, 3520, 3520, 3520, 832]
    - [0, 10.004]
  - - [3648, 832, 1, 64, 3648, 3648, 3648, 832]
    - [0, 10.074]
  - - [3776, 832, 1, 64, 3776, 3776, 3776, 832]
    - [0, 10.068]
  - - [3904, 832, 1, 64, 3904, 3904, 3904, 832]
    - [0, 10.102]
  - - [4032, 832, 1, 64, 4032, 4032, 4032, 832]
    - [0, 10.151]
  - - [64, 960, 1, 64, 64, 64, 64, 960]
    - [0, 2.071]
  - - [192, 960, 1, 64, 192, 192, 192, 960]
    - [0, 4.299]
  - - [320, 960, 1, 64, 320, 320, 320, 960]
    - [0, 6.043]
  - - [448, 960, 1, 64, 448, 448, 448, 960]
    - [0, 6.669]
  - - [576, 960, 1, 64, 576, 576, 576, 960]
    - [0, 7.272]
  - - [704, 960, 1, 64, 704, 704, 704, 960]
    - [0, 7.667]
  - - [832, 960, 1, 64, 832, 832, 832, 960]
    - [0, 8.057]
  - - [960, 960, 1, 64, 960, 960, 960, 960]
    - [0, 8.383]
  - - [1088, 960, 1, 64, 1088, 1088, 1088, 960]
    - [0, 8.628]
  - - [1216, 960, 1, 64, 1216, 1216, 1216, 960]
    - [0, 8.812]
  - - [1344, 960, 1, 64, 1344, 1344, 1344, 960]
    - [0, 9.004]
  - - [1472, 960, 1, 64, 1472, 1472, 1472, 960]
    - [0, 9.149]
  - - [1600, 960, 1, 64, 1600, 1600, 1600, 960]
    - [0, 9.26]
  - - [1728, 960, 1, 64, 1728, 1728, 1728, 960]
    - [0, 9.381]
  - - [1856, 960, 1, 64, 1856, 1856, 1856, 960]
    - [0, 9.488]
  - - [1984, 960, 1, 64, 1984, 1984, 1984, 960]
    - [0, 9.553]
  - - [2112, 960, 1, 64, 2112, 2112, 2112, 960]
    - [0, 9.655]
  - - [2240, 960, 1, 64, 2240, 2240, 2240, 960]
    - [0, 9.698]
  - - [2368, 960, 1, 64, 2368, 2368, 2368, 960]
    - [0, 9.75]
  - - [2496, 960, 1, 64, 2496, 2496, 2496, 960]
    - [0, 9.828]
  - - [2624, 960, 1, 64, 2624, 2624, 2624, 960]
    - [0, 9.871]
  - - [2752, 960, 1, 64, 2752, 2752, 2752, 960]
    - [0, 9.919]
  - - [2880, 960, 1, 64, 2880, 2880, 2880, 960]
    - [0, 9.982]
  - - [3008, 960, 1, 64, 3008, 3008, 3008, 960]
    - [0, 10.01]
  - - [3136, 960, 1, 64, 3136, 3136, 3136, 960]
    - [0, 10.063]
  - - [3264, 960, 1, 64, 3264, 3264, 3264, 960]
    - [0, 10.107]
  - - [3392, 960, 1, 64, 3392, 3392, 3392, 960]
    - [0, 10.111]
  - - [3520, 960, 1, 64, 3520, 3520, 3520, 960]
    - [0, 10.142]
  - - [3648, 960, 1, 64, 3648, 3648, 3648, 960]
    - [0, 10.206]
  - - [3776, 960, 1, 64, 3776, 3776, 3776, 960]
    - [0, 10.2]
  - - [3904, 960, 1, 64, 3904, 3904, 3904, 960]
    - [0, 9.427]
  - - [4032, 960, 1, 64, 4032, 4032, 4032, 960]
    - [0, 9.722]
  - - [64, 1088, 1, 64, 64, 64, 64, 1088]
    - [0, 2.241]
  - - [192, 1088, 1, 64, 192, 192, 192, 1088]
    - [0, 4.662]
  - - [320, 1088, 1, 64, 320, 320, 320, 1088]
    - [0, 6.124]
  - - [448, 1088, 1, 64, 448, 448, 448, 1088]
    - [0, 6.967]
  - - [576, 1088, 1, 64, 576, 576, 576, 1088]
    - [0, 7.52]
  - - [704, 1088, 1, 64, 704, 704, 704, 1088]
    - [0, 7.969]
  - - [832, 1088, 1, 64, 832, 832, 832, 1088]
    - [0, 8.352]
  - - [960, 1088, 1, 64, 960, 960, 960, 1088]
    - [0, 8.624]
  - - [1088, 1088, 1, 64, 1088, 1088, 1088, 1088]
    - [0, 8.848]
  - - [1216, 1088, 1, 64, 1216, 1216, 1216, 1088]
    - [0, 9.035]
  - - [1344, 1088, 1, 64, 1344, 1344, 1344, 1088]
    - [0, 9.207]
  - - [1472, 1088, 1, 64, 1472, 1472, 1472, 1088]
    - [0, 9.334]
  - - [1600, 1088, 1, 64, 1600, 1600, 1600, 1088]
    - [0, 9.458]
  - - [1728, 1088, 1, 64, 1728, 1728, 1728, 1088]
    - [0, 9.567]
  - - [1856, 1088, 1, 64, 1856, 1856, 1856, 1088]
    - [0, 9.635]
  - - [1984, 1088, 1, 64, 1984, 1984, 1984, 1088]
    - [0, 9.712]
  - - [2112, 1088, 1, 64, 2112, 2112, 2112, 1088]
    - [0, 9.804]
  - - [2240, 1088, 1, 64, 2240, 2240, 2240, 1088]
    - [0, 9.837]
  - - [2368, 1088, 1, 64, 2368, 2368, 2368, 1088]
    - [0, 9.884]
  - - [2496, 1088, 1, 64, 2496, 2496, 2496, 1088]
    - [0, 9.963]
  - - [2624, 1088, 1, 64, 2624, 2624, 2624, 1088]
    - [0, 9.996]
  - - [2752, 1088, 1, 64, 2752, 2752, 2752, 1088]
    - [0, 10.037]
  - - [2880, 1088, 1, 64, 2880, 2880, 2880, 1088]
    - [0, 10.096]
  - - [3008, 1088, 1, 64, 3008, 3008, 3008, 1088]
    - [0, 10.107]
  - - [3136, 1088, 1, 64, 3136, 3136, 3136, 1088]
    - [0, 10.145]
  - - [3264, 1088, 1, 64, 3264, 3264, 3264, 1088]
    - [0, 10.205]
  - - [3392, 1088, 1, 64, 3392, 3392, 3392, 1088]
    - [0, 9.286]
  - - [3520, 1088, 1, 64, 3520, 3520, 3520, 1088]
    - [0, 9.62]
  - - [3648, 1088, 1, 64, 3648, 3648, 3648, 1088]
    - [0, 9.807]
  - - [3776, 1088, 1, 64, 3776, 3776, 3776, 1088]
    - [0, 9.771]
  - - [3904, 1088, 1, 64, 3904, 3904, 3904, 1088]
    - [0, 9.816]
  - - [4032, 1088, 1, 64, 4032, 4032, 4032, 1088]
    - [0, 9.876]
  - - [64, 1216, 1, 64, 64, 64, 64, 1216]
    - [0, 2.49]
  - - [192, 1216, 1, 64, 192, 192, 192, 1216]
    - [0, 5.088]
  - - [320, 1216, 1, 64, 320, 320, 320, 1216]
    - [0, 6.498]
  - - [448, 1216, 1, 64, 448, 448, 448, 1216]
    - [0, 7.235]
  - - [576, 1216, 1, 64, 576, 576, 576, 1216]
    - [0, 7.785]
  - - [704, 1216, 1, 64, 704, 704, 704, 1216]
    - [0, 8.196]
  - - [832, 1216, 1, 64, 832, 832, 832, 1216]
    - [0, 8.55]
  - - [960, 1216, 1, 64, 960, 960, 960, 1216]
    - [0, 8.843]
  - - [1088, 1216, 1, 64, 1088, 1088, 1088, 1216]
    - [0, 9.04]
  - - [1216, 1216, 1, 64, 1216, 1216, 1216, 1216]
    - [0, 9.224]
  - - [1344, 1216, 1, 64, 1344, 1344, 1344, 1216]
    - [0, 9.374]
  - - [1472, 1216, 1, 64, 1472, 1472, 1472, 1216]
    - [0, 9.486]
  - - [1600, 1216, 1, 64, 1600, 1600, 1600, 1216]
    - [0, 9.602]
  - - [1728, 1216, 1, 64, 1728, 1728, 1728, 1216]
    - [0, 9.707]
  - - [1856, 1216, 1, 64, 1856, 1856, 1856, 1216]
    - [0, 9.755]
  - - [1984, 1216, 1, 64, 1984, 1984, 1984, 1216]
    - [0, 9.819]
  - - [2112, 1216, 1, 64, 2112, 2112, 2112, 1216]
    - [0, 9.901]
  - - [2240, 1216, 1, 64, 2240, 2240, 2240, 1216]
    - [0, 9.944]
  - - [2368, 1216, 1, 64, 2368, 2368, 2368, 1216]
    - [0, 9.995]
  - - [2496, 1216, 1, 64, 2496, 2496, 2496, 1216]
    - [0, 10.07]
  - - [2624, 1216, 1, 64, 2624, 2624, 2624, 1216]
    - [0, 10.1]
  - - [2752, 1216, 1, 64, 2752, 2752, 2752, 1216]
    - [0, 10.147]
  - - [2880, 1216, 1, 64, 2880, 2880, 2880, 1216]
    - [0, 10.198]
  - - [3008, 1216, 1, 64, 3008, 3008, 3008, 1216]
    - [0, 9.405]
  - - [3136, 1216, 1, 64, 3136, 3136, 3136, 1216]
    - [0, 9.584]
  - - [3264, 1216, 1, 64, 3264, 3264, 3264, 1216]
    - [0, 9.809]
  - - [3392, 1216, 1, 64, 3392, 3392, 3392, 1216]
    - [0, 9.793]
  - - [3520, 1216, 1, 64, 3520, 3520, 3520, 1216]
    - [0, 9.842]
  - - [3648, 1216, 1, 64, 3648, 3648, 3648, 1216]
    - [0, 9.907]
  - - [3776, 1216, 1, 64, 3776, 3776, 3776, 1216]
    - [0, 9.908]
  - - [3904, 1216, 1, 64, 3904, 3904, 3904, 1216]
    - [0, 9.957]
  - - [4032, 1216, 1, 64, 4032, 4032, 4032, 1216]
    - [0, 9.998]
  - - [64, 1344, 1, 64, 64, 64, 64, 1344]
    - [0, 2.76]
  - - [192, 1344, 1, 64, 192, 192, 192, 1344]
    - [0, 5.35]
  - - [320, 1344, 1, 64, 320, 320, 320, 1344]
    - [0, 6.668]
  - - [448, 1344, 1, 64, 448, 448, 448, 1344]
    - [0, 7.507]
  - - [576, 1344, 1, 64, 576, 576, 576, 1344]
    - [0, 8.021]
  - - [704, 1344, 1, 64, 704, 704, 704, 1344]
    - [0, 8.428]
  - - [832, 1344, 1, 64, 832, 832, 832, 1344]
    - [0, 8.747]
  - - [960, 1344, 1, 64, 960, 960, 960, 1344]
    - [0, 9.021]
  - - [1088, 1344, 1, 64, 1088, 1088, 1088, 1344]
    - [0, 9.186]
  - - [1216, 1344, 1, 64, 1216, 1216, 1216, 1344]
    - [0, 9.369]
  - - [1344, 1344, 1, 64, 1344, 1344, 1344, 1344]
    - [0, 9.518]
  - - [1472, 1344, 1, 64, 1472, 1472, 1472, 1344]
    - [0, 9.626]
  - - [1600, 1344, 1, 64, 1600, 1600, 1600, 1344]
    - [0, 9.723]
  - - [1728, 1344, 1, 64, 1728, 1728, 1728, 1344]
    - [0, 9.815]
  - - [1856, 1344, 1, 64, 1856, 1856, 1856, 1344]
    - [0, 9.895]
  - - [1984, 1344, 1, 64, 1984, 1984, 1984, 1344]
    - [0, 9.948]
  - - [2112, 1344, 1, 64, 2112, 2112, 2112, 1344]
    - [0, 10.021]
  - - [2240, 1344, 1, 64, 2240, 2240, 2240, 1344]
    - [0, 10.061]
  - - [2368, 1344, 1, 64, 2368, 2368, 2368, 1344]
    - [0, 10.087]
  - - [2496, 1344, 1, 64, 2496, 2496, 2496, 1344]
    - [0, 10.161]
  - - [2624, 1344, 1, 64, 2624, 2624, 2624, 1344]
    - [0, 10.17]
  - - [2752, 1344, 1, 64, 2752, 2752, 2752, 1344]
    - [0, 9.309]
  - - [2880, 1344, 1, 64, 2880, 2880, 2880, 1344]
    - [0, 9.722]
  - - [3008, 1344, 1, 64, 3008, 3008, 3008, 1344]
    - [0, 9.792]
  - - [3136, 1344, 1, 64, 3136, 3136, 3136, 1344]
    - [0, 9.816]
  - - [3264, 1344, 1, 64, 3264, 3264, 3264, 1344]
    - [0, 9.894]
  - - [3392, 1344, 1, 64, 3392, 3392, 3392, 1344]
    - [0, 9.91]
  - - [3520, 1344, 1, 64, 3520, 3520, 3520, 1344]
    - [0, 9.945]
  - - [3648, 1344, 1, 64, 3648, 3648, 3648, 1344]
    - [0, 9.989]
  - - [3776, 1344, 1, 64, 3776, 3776, 3776, 1344]
    - [0, 10.003]
  - - [3904, 1344, 1, 64, 3904, 3904, 3904, 1344]
    - [0, 10.047]
  - - [4032, 1344, 1, 64, 4032, 4032, 4032, 1344]
    - [0, 10.088]
  - - [64, 1472, 1, 64, 64, 64, 64, 1472]
    - [0, 2.92]
  - - [192, 1472, 1, 64, 192, 192, 192, 1472]
    - [0, 5.651]
  - - [320, 1472, 1, 64, 320, 320, 320, 1472]
    - [0, 6.832]
  - - [448, 1472, 1, 64, 448, 448, 448, 1472]
    - [0, 7.664]
  - - [576, 1472, 1, 64, 576, 576, 576, 1472]
    - [0, 8.211]
  - - [704, 1472, 1, 64, 704, 704, 704, 1472]
    - [0, 8.602]
  - - [832, 1472, 1, 64, 832, 832, 832, 1472]
    - [0, 8.905]
  - - [960, 1472, 1, 64, 960, 960, 960, 1472]
    - [0, 9.174]
  - - [1088, 1472, 1, 64, 1088, 1088, 1088, 1472]
    - [0, 9.335]
  - - [1216, 1472, 1, 64, 1216, 1216, 1216, 1472]
    - [0, 9.497]
  - - [1344, 1472, 1, 64, 1344, 1344, 1344, 1472]
    - [0, 9.632]
  - - [1472, 1472, 1, 64, 1472, 1472, 1472, 1472]
    - [0, 9.733]
  - - [1600, 1472, 1, 64, 1600, 1600, 1600, 1472]
    - [0, 9.836]
  - - [1728, 1472, 1, 64, 1728, 1728, 1728, 1472]
    - [0, 9.902]
  - - [1856, 1472, 1, 64, 1856, 1856, 1856, 1472]
    - [0, 9.967]
  - - [1984, 1472, 1, 64, 1984, 1984, 1984, 1472]
    - [0, 10.026]
  - - [2112, 1472, 1, 64, 2112, 2112, 2112, 1472]
    - [0, 10.083]
  - - [2240, 1472, 1, 64, 2240, 2240, 2240, 1472]
    - [0, 10.125]
  - - [2368, 1472, 1, 64, 2368, 2368, 2368, 1472]
    - [0, 10.167]
  - - [2496, 1472, 1, 64, 2496, 2496, 2496, 1472]
    - [0, 9.248]
  - - [2624, 1472, 1, 64, 2624, 2624, 2624, 1472]
    - [0, 9.701]
  - - [2752, 1472, 1, 64, 2752, 2752, 2752, 1472]
    - [0, 9.743]
  - - [2880, 1472, 1, 64, 2880, 2880, 2880, 1472]
    - [0, 9.849]
  - - [3008, 1472, 1, 64, 3008, 3008, 3008, 1472]
    - [0, 9.882]
  - - [3136, 1472, 1, 64, 3136, 3136, 3136, 1472]
    - [0, 9.926]
  - - [3264, 1472, 1, 64, 3264, 3264, 3264, 1472]
    - [0, 9.981]
  - - [3392, 1472, 1, 64, 3392, 3392, 3392, 1472]
    - [0, 9.998]
  - - [3520, 1472, 1, 64, 3520, 3520, 3520, 1472]
    - [0, 10.033]
  - - [3648, 1472, 1, 64, 3648, 3648, 3648, 1472]
    - [0, 10.085]
  - - [3776, 1472, 1, 64, 3776, 3776, 3776, 1472]
    - [0, 10.084]
  - - [3904, 1472, 1, 64, 3904, 3904, 3904, 1472]
    - [0, 10.123]
  - - [4032, 1472, 1, 64, 4032, 4032, 4032, 1472]
    - [0, 10.164]
  - - [64, 1600, 1, 64, 64, 64, 64, 1600]
    - [0, 3.14]
  - - [192, 1600, 1, 64, 192, 192, 192, 1600]
    - [0, 6.038]
  - - [320, 1600, 1, 64, 320, 320, 320, 1600]
    - [0, 7.087]
  - - [448, 1600, 1, 64, 448, 448, 448, 1600]
    - [0, 7.825]
  - - [576, 1600, 1, 64, 576, 576, 576, 1600]
    - [0, 8.407]
  - - [704, 1600, 1, 64, 704, 704, 704, 1600]
    - [0, 8.753]
  - - [832, 1600, 1, 64, 832, 832, 832, 1600]
    - [0, 9.056]
  - - [960, 1600, 1, 64, 960, 960, 960, 1600]
    - [0, 9.306]
  - - [1088, 1600, 1, 64, 1088, 1088, 1088, 1600]
    - [0, 9.465]
  - - [1216, 1600, 1, 64, 1216, 1216, 1216, 1600]
    - [0, 9.61]
  - - [1344, 1600, 1, 64, 1344, 1344, 1344, 1600]
    - [0, 9.74]
  - - [1472, 1600, 1, 64, 1472, 1472, 1472, 1600]
    - [0, 9.833]
  - - [1600, 1600, 1, 64, 1600, 1600, 1600, 1600]
    - [0, 9.912]
  - - [1728, 1600, 1, 64, 1728, 1728, 1728, 1600]
    - [0, 10.006]
  - - [1856, 1600, 1, 64, 1856, 1856, 1856, 1600]
    - [0, 10.054]
  - - [1984, 1600, 1, 64, 1984, 1984, 1984, 1600]
    - [0, 10.114]
  - - [2112, 1600, 1, 64, 2112, 2112, 2112, 1600]
    - [0, 10.173]
  - - [2240, 1600, 1, 64, 2240, 2240, 2240, 1600]
    - [0, 10.197]
  - - [2368, 1600, 1, 64, 2368, 2368, 2368, 1600]
    - [0, 9.524]
  - - [2496, 1600, 1, 64, 2496, 2496, 2496, 1600]
    - [0, 9.8]
  - - [2624, 1600, 1, 64, 2624, 2624, 2624, 1600]
    - [0, 9.822]
  - - [2752, 1600, 1, 64, 2752, 2752, 2752, 1600]
    - [0, 9.861]
  - - [2880, 1600, 1, 64, 2880, 2880, 2880, 1600]
    - [0, 9.938]
  - - [3008, 1600, 1, 64, 3008, 3008, 3008, 1600]
    - [0, 9.953]
  - - [3136, 1600, 1, 64, 3136, 3136, 3136, 1600]
    - [0, 10.008]
  - - [3264, 1600, 1, 64, 3264, 3264, 3264, 1600]
    - [0, 10.067]
  - - [3392, 1600, 1, 64, 3392, 3392, 3392, 1600]
    - [0, 10.073]
  - - [3520, 1600, 1, 64, 3520, 3520, 3520, 1600]
    - [0, 10.1]
  - - [3648, 1600, 1, 64, 3648, 3648, 3648, 1600]
    - [0, 10.154]
  - - [3776, 1600, 1, 64, 3776, 3776, 3776, 1600]
    - [0, 10.157]
  - - [3904, 1600, 1, 64, 3904, 3904, 3904, 1600]
    - [0, 10.197]
  - - [4032, 1600, 1, 64, 4032, 4032, 4032, 1600]
    - [0, 10.23]
  - - [64, 1728, 1, 64, 64, 64, 64, 1728]
    - [0, 3.38]
  - - [192, 1728, 1, 64, 192, 192, 192, 1728]
    - [0, 6.0]
  - - [320, 1728, 1, 64, 320, 320, 320, 1728]
    - [0, 7.266]
  - - [448, 1728, 1, 64, 448, 448, 448, 1728]
    - [0, 7.971]
  - - [576, 1728, 1, 64, 576, 576, 576, 1728]
    - [0, 8.549]
  - - [704, 1728, 1, 64, 704, 704, 704, 1728]
    - [0, 8.899]
  - - [832, 1728, 1, 64, 832, 832, 832, 1728]
    - [0, 9.159]
  - - [960, 1728, 1, 64, 960, 960, 960, 1728]
    - [0, 9.417]
  - - [1088, 1728, 1, 64, 1088, 1088, 1088, 1728]
    - [0, 9.556]
  - - [1216, 1728, 1, 64, 1216, 1216, 1216, 1728]
    - [0, 9.691]
  - - [1344, 1728, 1, 64, 1344, 1344, 1344, 1728]
    - [0, 9.823]
  - - [1472, 1728, 1, 64, 1472, 1472, 1472, 1728]
    - [0, 9.908]
  - - [1600, 1728, 1, 64, 1600, 1600, 1600, 1728]
    - [0, 10.002]
  - - [1728, 1728, 1, 64, 1728, 1728, 1728, 1728]
    - [0, 10.082]
  - - [1856, 1728, 1, 64, 1856, 1856, 1856, 1728]
    - [0, 10.113]
  - - [1984, 1728, 1, 64, 1984, 1984, 1984, 1728]
    - [0, 10.166]
  - - [2112, 1728, 1, 64, 2112, 2112, 2112, 1728]
    - [0, 10.236]
  - - [2240, 1728, 1, 64, 2240, 2240, 2240, 1728]
    - [0, 9.72]
  - - [2368, 1728, 1, 64, 2368, 2368, 2368, 1728]
    - [0, 9.771]
  - - [2496, 1728, 1, 64, 2496, 2496, 2496, 1728]
    - [0, 9.865]
  - - [2624, 1728, 1, 64, 2624, 2624, 2624, 1728]
    - [0, 9.906]
  - - [2752, 1728, 1, 64, 2752, 2752, 2752, 1728]
    - [0, 9.956]
  - - [2880, 1728, 1, 64, 2880, 2880, 2880, 1728]
    - [0, 10.008]
  - - [3008, 1728, 1, 64, 3008, 3008, 3008, 1728]
    - [0, 10.027]
  - - [3136, 1728, 1, 64, 3136, 3136, 3136, 1728]
    - [0, 10.074]
  - - [3264, 1728, 1, 64, 3264, 3264, 3264, 1728]
    - [0, 10.128]
  - - [3392, 1728, 1, 64, 3392, 3392, 3392, 1728]
    - [0, 10.134]
  - - [3520, 1728, 1, 64, 3520, 3520, 3520, 1728]
    - [0, 10.16]
  - - [3648, 1728, 1, 64, 3648, 3648, 3648, 1728]
    - [0, 10.227]
  - - [3776, 1728, 1, 64, 3776, 3776, 3776, 1728]
    - [0, 10.227]
  - - [3904, 1728, 1, 64, 3904, 3904, 3904, 1728]
    - [0, 10.253]
  - - [4032, 1728, 1, 64, 4032, 4032, 4032, 1728]
    - [0, 10.295]
  - - [64, 1856, 1, 64, 64, 64, 64, 1856]
    - [0, 3.628]
  - - [192, 1856, 1, 64, 192, 192, 192, 1856]
    - [0, 6.234]
  - - [320, 1856, 1, 64, 320, 320, 320, 1856]
    - [0, 7.445]
  - - [448, 1856, 1, 64, 448, 448, 448, 1856]
    - [0, 8.141]
  - - [576, 1856, 1, 64, 576, 576, 576, 1856]
    - [0, 8.706]
  - - [704, 1856, 1, 64, 704, 704, 704, 1856]
    - [0, 9.024]
  - - [832, 1856, 1, 64, 832, 832, 832, 1856]
    - [0, 9.286]
  - - [960, 1856, 1, 64, 960, 960, 960, 1856]
    - [0, 9.498]
  - - [1088, 1856, 1, 64, 1088, 1088, 1088, 1856]
    - [0, 9.655]
  - - [1216, 1856, 1, 64, 1216, 1216, 1216, 1856]
    - [0, 9.781]
  - - [1344, 1856, 1, 64, 1344, 1344, 1344, 1856]
    - [0, 9.912]
  - - [1472, 1856, 1, 64, 1472, 1472, 1472, 1856]
    - [0, 9.985]
  - - [1600, 1856, 1, 64, 1600, 1600, 1600, 1856]
    - [0, 10.069]
  - - [1728, 1856, 1, 64, 1728, 1728, 1728, 1856]
    - [0, 10.13]
  - - [1856, 1856, 1, 64, 1856, 1856, 1856, 1856]
    - [0, 10.181]
  - - [1984, 1856, 1, 64, 1984, 1984, 1984, 1856]
    - [0, 9.267]
  - - [2112, 1856, 1, 64, 2112, 2112, 2112, 1856]
    - [0, 9.798]
  - - [2240, 1856, 1, 64, 2240, 2240, 2240, 1856]
    - [0, 9.811]
  - - [2368, 1856, 1, 64, 2368, 2368, 2368, 1856]
    - [0, 9.871]
  - - [2496, 1856, 1, 64, 2496, 2496, 2496, 1856]
    - [0, 9.947]
  - - [2624, 1856, 1, 64, 2624, 2624, 2624, 1856]
    - [0, 9.981]
  - - [2752, 1856, 1, 64, 2752, 2752, 2752, 1856]
    - [0, 10.018]
  - - [2880, 1856, 1, 64, 2880, 2880, 2880, 1856]
    - [0, 10.076]
  - - [3008, 1856, 1, 64, 3008, 3008, 3008, 1856]
    - [0, 10.097]
  - - [3136, 1856, 1, 64, 3136, 3136, 3136, 1856]
    - [0, 10.122]
  - - [3264, 1856, 1, 64, 3264, 3264, 3264, 1856]
    - [0, 10.194]
  - - [3392, 1856, 1, 64, 3392, 3392, 3392, 1856]
    - [0, 10.192]
  - - [3520, 1856, 1, 64, 3520, 3520, 3520, 1856]
    - [0, 10.222]
  - - [3648, 1856, 1, 64, 3648, 3648, 3648, 1856]
    - [0, 10.278]
  - - [3776, 1856, 1, 64, 3776, 3776, 3776, 1856]
    - [0, 10.27]
  - - [3904, 1856, 1, 64, 3904, 3904, 3904, 1856]
    - [0, 10.306]
  - - [4032, 1856, 1, 64, 4032, 4032, 4032, 1856]
    - [0, 10.333]
  - - [64, 1984, 1, 64, 64, 64, 64, 1984]
    - [0, 3.375]
  - - [192, 1984, 1, 64, 192, 192, 192, 1984]
    - [0, 6.396]
  - - [320, 1984, 1, 64, 320, 320, 320, 1984]
    - [0, 7.548]
  - - [448, 1984, 1, 64, 448, 448, 448, 1984]
    - [0, 8.31]
  - - [576, 1984, 1, 64, 576, 576, 576, 1984]
    - [0, 8.801]
  - - [704, 1984, 1, 64, 704, 704, 704, 1984]
    - [0, 9.135]
  - - [832, 1984, 1, 64, 832, 832, 832, 1984]
    - [0, 9.385]
  - - [960, 1984, 1, 64, 960, 960, 960, 1984]
    - [0, 9.595]
  - - [1088, 1984, 1, 64, 1088, 1088, 1088, 1984]
    - [0, 9.739]
  - - [1216, 1984, 1, 64, 1216, 1216, 1216, 1984]
    - [0, 9.854]
  - - [1344, 1984, 1, 64, 1344, 1344, 1344, 1984]
    - [0, 9.977]
  - - [1472, 1984, 1, 64, 1472, 1472, 1472, 1984]
    - [0, 10.052]
  - - [1600, 1984, 1, 64, 1600, 1600, 1600, 1984]
    - [0, 10.133]
  - - [1728, 1984, 1, 64, 1728, 1728, 1728, 1984]
    - [0, 10.191]
  - - [1856, 1984, 1, 64, 1856, 1856, 1856, 1984]
    - [0, 9.265]
  - - [1984, 1984, 1, 64, 1984, 1984, 1984, 1984]
    - [0, 9.783]
  - - [2112, 1984, 1, 64, 2112, 2112, 2112, 1984]
    - [0, 9.826]
  - - [2240, 1984, 1, 64, 2240, 2240, 2240, 1984]
    - [0, 9.882]
  - - [2368, 1984, 1, 64, 2368, 2368, 2368, 1984]
    - [0, 9.934]
  - - [2496, 1984, 1, 64, 2496, 2496, 2496, 1984]
    - [0, 10.015]
  - - [2624, 1984, 1, 64, 2624, 2624, 2624, 1984]
    - [0, 10.034]
  - - [2752, 1984, 1, 64, 2752, 2752, 2752, 1984]
    - [0, 10.077]
  - - [2880, 1984, 1, 64, 2880, 2880, 2880, 1984]
    - [0, 10.134]
  - - [3008, 1984, 1, 64, 3008, 3008, 3008, 1984]
    - [0, 10.145]
  - - [3136, 1984, 1, 64, 3136, 3136, 3136, 1984]
    - [0, 10.182]
  - - [3264, 1984, 1, 64, 3264, 3264, 3264, 1984]
    - [0, 10.244]
  - - [3392, 1984, 1, 64, 3392, 3392, 3392, 1984]
    - [0, 10.252]
  - - [3520, 1984, 1, 64, 3520, 3520, 3520, 1984]
    - [0, 10.282]
  - - [3648, 1984, 1, 64, 3648, 3648, 3648, 1984]
    - [0, 10.329]
  - - [3776, 1984, 1, 64, 3776, 3776, 3776, 1984]
    - [0, 10.323]
  - - [3904, 1984, 1, 64, 3904, 3904, 3904, 1984]
    - [0, 10.328]
  - - [4032, 1984, 1, 64, 4032, 4032, 4032, 1984]
    - [0, 10.383]
  - - [64, 2112, 1, 64, 64, 64, 64, 2112]
    - [0, 3.911]
  - - [192, 2112, 1, 64, 192, 192, 192, 2112]
    - [0, 6.478]
  - - [320, 2112, 1, 64, 320, 320, 320, 2112]
    - [0, 7.662]
  - - [448, 2112, 1, 64, 448, 448, 448, 2112]
    - [0, 8.414]
  - - [576, 2112, 1, 64, 576, 576, 576, 2112]
    - [0, 8.915]
  - - [704, 2112, 1, 64, 704, 704, 704, 2112]
    - [0, 9.225]
  - - [832, 2112, 1, 64, 832, 832, 832, 2112]
    - [0, 9.475]
  - - [960, 2112, 1, 64, 960, 960, 960, 2112]
    - [0, 9.683]
  - - [1088, 2112, 1, 64, 1088, 1088, 1088, 2112]
    - [0, 9.797]
  - - [1216, 2112, 1, 64, 1216, 1216, 1216, 2112]
    - [0, 9.916]
  - - [1344, 2112, 1, 64, 1344, 1344, 1344, 2112]
    - [0, 10.03]
  - - [1472, 2112, 1, 64, 1472, 1472, 1472, 2112]
    - [0, 10.108]
  - - [1600, 2112, 1, 64, 1600, 1600, 1600, 2112]
    - [0, 10.165]
  - - [1728, 2112, 1, 64, 1728, 1728, 1728, 2112]
    - [0, 10.246]
  - - [1856, 2112, 1, 64, 1856, 1856, 1856, 2112]
    - [0, 9.788]
  - - [1984, 2112, 1, 64, 1984, 1984, 1984, 2112]
    - [0, 9.829]
  - - [2112, 2112, 1, 64, 2112, 2112, 2112, 2112]
    - [0, 9.908]
  - - [2240, 2112, 1, 64, 2240, 2240, 2240, 2112]
    - [0, 9.958]
  - - [2368, 2112, 1, 64, 2368, 2368, 2368, 2112]
    - [0, 10.001]
  - - [2496, 2112, 1, 64, 2496, 2496, 2496, 2112]
    - [0, 10.066]
  - - [2624, 2112, 1, 64, 2624, 2624, 2624, 2112]
    - [0, 10.095]
  - - [2752, 2112, 1, 64, 2752, 2752, 2752, 2112]
    - [0, 10.126]
  - - [2880, 2112, 1, 64, 2880, 2880, 2880, 2112]
    - [0, 10.189]
  - - [3008, 2112, 1, 64, 3008, 3008, 3008, 2112]
    - [0, 10.202]
  - - [3136, 2112, 1, 64, 3136, 3136, 3136, 2112]
    - [0, 10.237]
  - - [3264, 2112, 1, 64, 3264, 3264, 3264, 2112]
    - [0, 10.288]
  - - [3392, 2112, 1, 64, 3392, 3392, 3392, 2112]
    - [0, 10.297]
  - - [3520, 2112, 1, 64, 3520, 3520, 3520, 2112]
    - [0, 10.314]
  - - [3648, 2112, 1, 64, 3648, 3648, 3648, 2112]
    - [0, 10.347]
  - - [3776, 2112, 1, 64, 3776, 3776, 3776, 2112]
    - [0, 10.348]
  - - [3904, 2112, 1, 64, 3904, 3904, 3904, 2112]
    - [0, 9.905]
  - - [4032, 2112, 1, 64, 4032, 4032, 4032, 2112]
    - [0, 9.634]
  - - [64, 2240, 1, 64, 64, 64, 64, 2240]
    - [0, 4.154]
  - - [192, 2240, 1, 64, 192, 192, 192, 2240]
    - [0, 6.668]
  - - [320, 2240, 1, 64, 320, 320, 320, 2240]
    - [0, 7.825]
  - - [448, 2240, 1, 64, 448, 448, 448, 2240]
    - [0, 8.545]
  - - [576, 2240, 1, 64, 576, 576, 576, 2240]
    - [0, 9.025]
  - - [704, 2240, 1, 64, 704, 704, 704, 2240]
    - [0, 9.331]
  - - [832, 2240, 1, 64, 832, 832, 832, 2240]
    - [0, 9.55]
  - - [960, 2240, 1, 64, 960, 960, 960, 2240]
    - [0, 9.756]
  - - [1088, 2240, 1, 64, 1088, 1088, 1088, 2240]
    - [0, 9.872]
  - - [1216, 2240, 1, 64, 1216, 1216, 1216, 2240]
    - [0, 9.991]
  - - [1344, 2240, 1, 64, 1344, 1344, 1344, 2240]
    - [0, 10.078]
  - - [1472, 2240, 1, 64, 1472, 1472, 1472, 2240]
    - [0, 10.164]
  - - [1600, 2240, 1, 64, 1600, 1600, 1600, 2240]
    - [0, 10.224]
  - - [1728, 2240, 1, 64, 1728, 1728, 1728, 2240]
    - [0, 9.722]
  - - [1856, 2240, 1, 64, 1856, 1856, 1856, 2240]
    - [0, 9.81]
  - - [1984, 2240, 1, 64, 1984, 1984, 1984, 2240]
    - [0, 9.906]
  - - [2112, 2240, 1, 64, 2112, 2112, 2112, 2240]
    - [0, 9.962]
  - - [2240, 2240, 1, 64, 2240, 2240, 2240, 2240]
    - [0, 10.011]
  - - [2368, 2240, 1, 64, 2368, 2368, 2368, 2240]
    - [0, 10.053]
  - - [2496, 2240, 1, 64, 2496, 2496, 2496, 2240]
    - [0, 10.124]
  - - [2624, 2240, 1, 64, 2624, 2624, 2624, 2240]
    - [0, 10.144]
  - - [2752, 2240, 1, 64, 2752, 2752, 2752, 2240]
    - [0, 10.185]
  - - [2880, 2240, 1, 64, 2880, 2880, 2880, 2240]
    - [0, 10.242]
  - - [3008, 2240, 1, 64, 3008, 3008, 3008, 2240]
    - [0, 10.249]
  - - [3136, 2240, 1, 64, 3136, 3136, 3136, 2240]
    - [0, 10.276]
  - - [3264, 2240, 1, 64, 3264, 3264, 3264, 2240]
    - [0, 10.342]
  - - [3392, 2240, 1, 64, 3392, 3392, 3392, 2240]
    - [0, 10.337]
  - - [3520, 2240, 1, 64, 3520, 3520, 3520, 2240]
    - [0, 10.348]
  - - [3648, 2240, 1, 64, 3648, 3648, 3648, 2240]
    - [0, 10.132]
  - - [3776, 2240, 1, 64, 3776, 3776, 3776, 2240]
    - [0, 9.608]
  - - [3904, 2240, 1, 64, 3904, 3904, 3904, 2240]
    - [0, 9.355]
  - - [4032, 2240, 1, 64, 4032, 4032, 4032, 2240]
    - [0, 9.107]
  - - [64, 2368, 1, 64, 64, 64, 64, 2368]
    - [0, 4.38]
  - - [192, 2368, 1, 64, 192, 192, 192, 2368]
    - [0, 6.835]
  - - [320, 2368, 1, 64, 320, 320, 320, 2368]
    - [0, 7.987]
  - - [448, 2368, 1, 64, 448, 448, 448, 2368]
    - [0, 8.679]
  - - [576, 2368, 1, 64, 576, 576, 576, 2368]
    - [0, 9.124]
  - - [704, 2368, 1, 64, 704, 704, 704, 2368]
    - [0, 9.413]
  - - [832, 2368, 1, 64, 832, 832, 832, 2368]
    - [0, 9.638]
  - - [960, 2368, 1, 64, 960, 960, 960, 2368]
    - [0, 9.82]
  - - [1088, 2368, 1, 64, 1088, 1088, 1088, 2368]
    - [0, 9.943]
  - - [1216, 2368, 1, 64, 1216, 1216, 1216, 2368]
    - [0, 10.045]
  - - [1344, 2368, 1, 64, 1344, 1344, 1344, 2368]
    - [0, 10.137]
  - - [1472, 2368, 1, 64, 1472, 1472, 1472, 2368]
    - [0, 10.216]
  - - [1600, 2368, 1, 64, 1600, 1600, 1600, 2368]
    - [0, 9.527]
  - - [1728, 2368, 1, 64, 1728, 1728, 1728, 2368]
    - [0, 9.807]
  - - [1856, 2368, 1, 64, 1856, 1856, 1856, 2368]
    - [0, 9.892]
  - - [1984, 2368, 1, 64, 1984, 1984, 1984, 2368]
    - [0, 9.956]
  - - [2112, 2368, 1, 64, 2112, 2112, 2112, 2368]
    - [0, 10.034]
  - - [2240, 2368, 1, 64, 2240, 2240, 2240, 2368]
    - [0, 10.07]
  - - [2368, 2368, 1, 64, 2368, 2368, 2368, 2368]
    - [0, 10.089]
  - - [2496, 2368, 1, 64, 2496, 2496, 2496, 2368]
    - [0, 10.169]
  - - [2624, 2368, 1, 64, 2624, 2624, 2624, 2368]
    - [0, 10.179]
  - - [2752, 2368, 1, 64, 2752, 2752, 2752, 2368]
    - [0, 10.226]
  - - [2880, 2368, 1, 64, 2880, 2880, 2880, 2368]
    - [0, 10.275]
  - - [3008, 2368, 1, 64, 3008, 3008, 3008, 2368]
    - [0, 10.291]
  - - [3136, 2368, 1, 64, 3136, 3136, 3136, 2368]
    - [0, 10.318]
  - - [3264, 2368, 1, 64, 3264, 3264, 3264, 2368]
    - [0, 10.357]
  - - [3392, 2368, 1, 64, 3392, 3392, 3392, 2368]
    - [0, 10.355]
  - - [3520, 2368, 1, 64, 3520, 3520, 3520, 2368]
    - [0, 9.767]
  - - [3648, 2368, 1, 64, 3648, 3648, 3648, 2368]
    - [0, 9.557]
  - - [3776, 2368, 1, 64, 3776, 3776, 3776, 2368]
    - [0, 9.055]
  - - [3904, 2368, 1, 64, 3904, 3904, 3904, 2368]
    - [0, 8.853]
  - - [4032, 2368, 1, 64, 4032, 4032, 4032, 2368]
    - [0, 8.647]
  - - [64, 2496, 1, 64, 64, 64, 64, 2496]
    - [0, 3.983]
  - - [192, 2496, 1, 64, 192, 192, 192, 2496]
    - [0, 6.897]
  - - [320, 2496, 1, 64, 320, 320, 320, 2496]
    - [0, 8.082]
  - - [448, 2496, 1, 64, 448, 448, 448, 2496]
    - [0, 8.752]
  - - [576, 2496, 1, 64, 576, 576, 576, 2496]
    - [0, 9.213]
  - - [704, 2496, 1, 64, 704, 704, 704, 2496]
    - [0, 9.478]
  - - [832, 2496, 1, 64, 832, 832, 832, 2496]
    - [0, 9.697]
  - - [960, 2496, 1, 64, 960, 960, 960, 2496]
    - [0, 9.88]
  - - [1088, 2496, 1, 64, 1088, 1088, 1088, 2496]
    - [0, 9.991]
  - - [1216, 2496, 1, 64, 1216, 1216, 1216, 2496]
    - [0, 10.102]
  - - [1344, 2496, 1, 64, 1344, 1344, 1344, 2496]
    - [0, 10.189]
  - - [1472, 2496, 1, 64, 1472, 1472, 1472, 2496]
    - [0, 9.55]
  - - [1600, 2496, 1, 64, 1600, 1600, 1600, 2496]
    - [0, 9.829]
  - - [1728, 2496, 1, 64, 1728, 1728, 1728, 2496]
    - [0, 9.884]
  - - [1856, 2496, 1, 64, 1856, 1856, 1856, 2496]
    - [0, 9.934]
  - - [1984, 2496, 1, 64, 1984, 1984, 1984, 2496]
    - [0, 9.998]
  - - [2112, 2496, 1, 64, 2112, 2112, 2112, 2496]
    - [0, 10.077]
  - - [2240, 2496, 1, 64, 2240, 2240, 2240, 2496]
    - [0, 10.1]
  - - [2368, 2496, 1, 64, 2368, 2368, 2368, 2496]
    - [0, 10.147]
  - - [2496, 2496, 1, 64, 2496, 2496, 2496, 2496]
    - [0, 10.21]
  - - [2624, 2496, 1, 64, 2624, 2624, 2624, 2496]
    - [0, 10.225]
  - - [2752, 2496, 1, 64, 2752, 2752, 2752, 2496]
    - [0, 10.269]
  - - [2880, 2496, 1, 64, 2880, 2880, 2880, 2496]
    - [0, 10.325]
  - - [3008, 2496, 1, 64, 3008, 3008, 3008, 2496]
    - [0, 10.331]
  - - [3136, 2496, 1, 64, 3136, 3136, 3136, 2496]
    - [0, 10.345]
  - - [3264, 2496, 1, 64, 3264, 3264, 3264, 2496]
    - [0, 10.391]
  - - [3392, 2496, 1, 64, 3392, 3392, 3392, 2496]
    - [0, 9.651]
  - - [3520, 2496, 1, 64, 3520, 3520, 3520, 2496]
    - [0, 9.355]
  - - [3648, 2496, 1, 64, 3648, 3648, 3648, 2496]
    - [0, 8.917]
  - - [3776, 2496, 1, 64, 3776, 3776, 3776, 2496]
    - [0, 8.537]
  - - [3904, 2496, 1, 64, 3904, 3904, 3904, 2496]
    - [0, 8.659]
  - - [4032, 2496, 1, 64, 4032, 4032, 4032, 2496]
    - [0, 8.669]
  - - [64, 2624, 1, 64, 64, 64, 64, 2624]
    - [0, 4.168]
  - - [192, 2624, 1, 64, 192, 192, 192, 2624]
    - [0, 7.018]
  - - [320, 2624, 1, 64, 320, 320, 320, 2624]
    - [0, 8.182]
  - - [448, 2624, 1, 64, 448, 448, 448, 2624]
    - [0, 8.853]
  - - [576, 2624, 1, 64, 576, 576, 576, 2624]
    - [0, 9.283]
  - - [704, 2624, 1, 64, 704, 704, 704, 2624]
    - [0, 9.543]
  - - [832, 2624, 1, 64, 832, 832, 832, 2624]
    - [0, 9.764]
  - - [960, 2624, 1, 64, 960, 960, 960, 2624]
    - [0, 9.933]
  - - [1088, 2624, 1, 64, 1088, 1088, 1088, 2624]
    - [0, 10.04]
  - - [1216, 2624, 1, 64, 1216, 1216, 1216, 2624]
    - [0, 10.137]
  - - [1344, 2624, 1, 64, 1344, 1344, 1344, 2624]
    - [0, 10.231]
  - - [1472, 2624, 1, 64, 1472, 1472, 1472, 2624]
    - [0, 9.705]
  - - [1600, 2624, 1, 64, 1600, 1600, 1600, 2624]
    - [0, 9.84]
  - - [1728, 2624, 1, 64, 1728, 1728, 1728, 2624]
    - [0, 9.944]
  - - [1856, 2624, 1, 64, 1856, 1856, 1856, 2624]
    - [0, 9.992]
  - - [1984, 2624, 1, 64, 1984, 1984, 1984, 2624]
    - [0, 10.042]
  - - [2112, 2624, 1, 64, 2112, 2112, 2112, 2624]
    - [0, 10.12]
  - - [2240, 2624, 1, 64, 2240, 2240, 2240, 2624]
    - [0, 10.146]
  - - [2368, 2624, 1, 64, 2368, 2368, 2368, 2624]
    - [0, 10.192]
  - - [2496, 2624, 1, 64, 2496, 2496, 2496, 2624]
    - [0, 10.228]
  - - [2624, 2624, 1, 64, 2624, 2624, 2624, 2624]
    - [0, 10.269]
  - - [2752, 2624, 1, 64, 2752, 2752, 2752, 2624]
    - [0, 10.315]
  - - [2880, 2624, 1, 64, 2880, 2880, 2880, 2624]
    - [0, 10.355]
  - - [3008, 2624, 1, 64, 3008, 3008, 3008, 2624]
    - [0, 10.345]
  - - [3136, 2624, 1, 64, 3136, 3136, 3136, 2624]
    - [0, 9.913]
  - - [3264, 2624, 1, 64, 3264, 3264, 3264, 2624]
    - [0, 9.529]
  - - [3392, 2624, 1, 64, 3392, 3392, 3392, 2624]
    - [0, 9.308]
  - - [3520, 2624, 1, 64, 3520, 3520, 3520, 2624]
    - [0, 8.823]
  - - [3648, 2624, 1, 64, 3648, 3648, 3648, 2624]
    - [0, 8.527]
  - - [3776, 2624, 1, 64, 3776, 3776, 3776, 2624]
    - [0, 8.545]
  - - [3904, 2624, 1, 64, 3904, 3904, 3904, 2624]
    - [0, 8.66]
  - - [4032, 2624, 1, 64, 4032, 4032, 4032, 2624]
    - [0, 8.67]
  - - [64, 2752, 1, 64, 64, 64, 64, 2752]
    - [0, 4.342]
  - - [192, 2752, 1, 64, 192, 192, 192, 2752]
    - [0, 7.162]
  - - [320, 2752, 1, 64, 320, 320, 320, 2752]
    - [0, 8.294]
  - - [448, 2752, 1, 64, 448, 448, 448, 2752]
    - [0, 8.925]
  - - [576, 2752, 1, 64, 576, 576, 576, 2752]
    - [0, 9.359]
  - - [704, 2752, 1, 64, 704, 704, 704, 2752]
    - [0, 9.611]
  - - [832, 2752, 1, 64, 832, 832, 832, 2752]
    - [0, 9.813]
  - - [960, 2752, 1, 64, 960, 960, 960, 2752]
    - [0, 9.987]
  - - [1088, 2752, 1, 64, 1088, 1088, 1088, 2752]
    - [0, 10.076]
  - - [1216, 2752, 1, 64, 1216, 1216, 1216, 2752]
    - [0, 10.173]
  - - [1344, 2752, 1, 64, 1344, 1344, 1344, 2752]
    - [0, 9.307]
  - - [1472, 2752, 1, 64, 1472, 1472, 1472, 2752]
    - [0, 9.838]
  - - [1600, 2752, 1, 64, 1600, 1600, 1600, 2752]
    - [0, 9.912]
  - - [1728, 2752, 1, 64, 1728, 1728, 1728, 2752]
    - [0, 9.98]
  - - [1856, 2752, 1, 64, 1856, 1856, 1856, 2752]
    - [0, 10.044]
  - - [1984, 2752, 1, 64, 1984, 1984, 1984, 2752]
    - [0, 10.098]
  - - [2112, 2752, 1, 64, 2112, 2112, 2112, 2752]
    - [0, 10.16]
  - - [2240, 2752, 1, 64, 2240, 2240, 2240, 2752]
    - [0, 10.188]
  - - [2368, 2752, 1, 64, 2368, 2368, 2368, 2752]
    - [0, 10.22]
  - - [2496, 2752, 1, 64, 2496, 2496, 2496, 2752]
    - [0, 10.285]
  - - [2624, 2752, 1, 64, 2624, 2624, 2624, 2752]
    - [0, 10.306]
  - - [2752, 2752, 1, 64, 2752, 2752, 2752, 2752]
    - [0, 10.35]
  - - [2880, 2752, 1, 64, 2880, 2880, 2880, 2752]
    - [0, 10.368]
  - - [3008, 2752, 1, 64, 3008, 3008, 3008, 2752]
    - [0, 9.858]
  - - [3136, 2752, 1, 64, 3136, 3136, 3136, 2752]
    - [0, 9.572]
  - - [3264, 2752, 1, 64, 3264, 3264, 3264, 2752]
    - [0, 9.09]
  - - [3392, 2752, 1, 64, 3392, 3392, 3392, 2752]
    - [0, 8.69]
  - - [3520, 2752, 1, 64, 3520, 3520, 3520, 2752]
    - [0, 8.605]
  - - [3648, 2752, 1, 64, 3648, 3648, 3648, 2752]
    - [0, 8.542]
  - - [3776, 2752, 1, 64, 3776, 3776, 3776, 2752]
    - [0, 8.543]
  - - [3904, 2752, 1, 64, 3904, 3904, 3904, 2752]
    - [0, 8.656]
  - - [4032, 2752, 1, 64, 4032, 4032, 4032, 2752]
    - [0, 8.647]
  - - [64, 2880, 1, 64, 64, 64, 64, 2880]
    - [0, 4.499]
  - - [192, 2880, 1, 64, 192, 192, 192, 2880]
    - [0, 7.234]
  - - [320, 2880, 1, 64, 320, 320, 320, 2880]
    - [0, 8.391]
  - - [448, 2880, 1, 64, 448, 448, 448, 2880]
    - [0, 9.008]
  - - [576, 2880, 1, 64, 576, 576, 576, 2880]
    - [0, 9.422]
  - - [704, 2880, 1, 64, 704, 704, 704, 2880]
    - [0, 9.661]
  - - [832, 2880, 1, 64, 832, 832, 832, 2880]
    - [0, 9.859]
  - - [960, 2880, 1, 64, 960, 960, 960, 2880]
    - [0, 10.031]
  - - [1088, 2880, 1, 64, 1088, 1088, 1088, 2880]
    - [0, 10.122]
  - - [1216, 2880, 1, 64, 1216, 1216, 1216, 2880]
    - [0, 10.217]
  - - [1344, 2880, 1, 64, 1344, 1344, 1344, 2880]
    - [0, 9.723]
  - - [1472, 2880, 1, 64, 1472, 1472, 1472, 2880]
    - [0, 9.866]
  - - [1600, 2880, 1, 64, 1600, 1600, 1600, 2880]
    - [0, 9.946]
  - - [1728, 2880, 1, 64, 1728, 1728, 1728, 2880]
    - [0, 10.024]
  - - [1856, 2880, 1, 64, 1856, 1856, 1856, 2880]
    - [0, 10.078]
  - - [1984, 2880, 1, 64, 1984, 1984, 1984, 2880]
    - [0, 10.138]
  - - [2112, 2880, 1, 64, 2112, 2112, 2112, 2880]
    - [0, 10.193]
  - - [2240, 2880, 1, 64, 2240, 2240, 2240, 2880]
    - [0, 10.222]
  - - [2368, 2880, 1, 64, 2368, 2368, 2368, 2880]
    - [0, 10.259]
  - - [2496, 2880, 1, 64, 2496, 2496, 2496, 2880]
    - [0, 10.315]
  - - [2624, 2880, 1, 64, 2624, 2624, 2624, 2880]
    - [0, 10.333]
  - - [2752, 2880, 1, 64, 2752, 2752, 2752, 2880]
    - [0, 10.356]
  - - [2880, 2880, 1, 64, 2880, 2880, 2880, 2880]
    - [0, 9.867]
  - - [3008, 2880, 1, 64, 3008, 3008, 3008, 2880]
    - [0, 9.53]
  - - [3136, 2880, 1, 64, 3136, 3136, 3136, 2880]
    - [0, 8.957]
  - - [3264, 2880, 1, 64, 3264, 3264, 3264, 2880]
    - [0, 8.636]
  - - [3392, 2880, 1, 64, 3392, 3392, 3392, 2880]
    - [0, 8.618]
  - - [3520, 2880, 1, 64, 3520, 3520, 3520, 2880]
    - [0, 8.631]
  - - [3648, 2880, 1, 64, 3648, 3648, 3648, 2880]
    - [0, 8.556]
  - - [3776, 2880, 1, 64, 3776, 3776, 3776, 2880]
    - [0, 8.579]
  - - [3904, 2880, 1, 64, 3904, 3904, 3904, 2880]
    - [0, 8.685]
  - - [4032, 2880, 1, 64, 4032, 4032, 4032, 2880]
    - [0, 8.681]
  - - [64, 3008, 1, 64, 64, 64, 64, 3008]
    - [0, 4.515]
  - - [192, 3008, 1, 64, 192, 192, 192, 3008]
    - [0, 7.383]
  - - [320, 3008, 1, 64, 320, 320, 320, 3008]
    - [0, 8.472]
  - - [448, 3008, 1, 64, 448, 448, 448, 3008]
    - [0, 9.078]
  - - [576, 3008, 1, 64, 576, 576, 576, 3008]
    - [0, 9.486]
  - - [704, 3008, 1, 64, 704, 704, 704, 3008]
    - [0, 9.719]
  - - [832, 3008, 1, 64, 832, 832, 832, 3008]
    - [0, 9.905]
  - - [960, 3008, 1, 64, 960, 960, 960, 3008]
    - [0, 10.067]
  - - [1088, 3008, 1, 64, 1088, 1088, 1088, 3008]
    - [0, 10.151]
  - - [1216, 3008, 1, 64, 1216, 1216, 1216, 3008]
    - [0, 10.183]
  - - [1344, 3008, 1, 64, 1344, 1344, 1344, 3008]
    - [0, 9.852]
  - - [1472, 3008, 1, 64, 1472, 1472, 1472, 3008]
    - [0, 9.907]
  - - [1600, 3008, 1, 64, 1600, 1600, 1600, 3008]
    - [0, 9.999]
  - - [1728, 3008, 1, 64, 1728, 1728, 1728, 3008]
    - [0, 10.073]
  - - [1856, 3008, 1, 64, 1856, 1856, 1856, 3008]
    - [0, 10.12]
  - - [1984, 3008, 1, 64, 1984, 1984, 1984, 3008]
    - [0, 10.171]
  - - [2112, 3008, 1, 64, 2112, 2112, 2112, 3008]
    - [0, 10.232]
  - - [2240, 3008, 1, 64, 2240, 2240, 2240, 3008]
    - [0, 10.268]
  - - [2368, 3008, 1, 64, 2368, 2368, 2368, 3008]
    - [0, 10.294]
  - - [2496, 3008, 1, 64, 2496, 2496, 2496, 3008]
    - [0, 10.35]
  - - [2624, 3008, 1, 64, 2624, 2624, 2624, 3008]
    - [0, 10.346]
  - - [2752, 3008, 1, 64, 2752, 2752, 2752, 3008]
    - [0, 9.835]
  - - [2880, 3008, 1, 64, 2880, 2880, 2880, 3008]
    - [0, 9.542]
  - - [3008, 3008, 1, 64, 3008, 3008, 3008, 3008]
    - [0, 8.897]
  - - [3136, 3008, 1, 64, 3136, 3136, 3136, 3008]
    - [0, 8.457]
  - - [3264, 3008, 1, 64, 3264, 3264, 3264, 3008]
    - [0, 8.641]
  - - [3392, 3008, 1, 64, 3392, 3392, 3392, 3008]
    - [0, 8.602]
  - - [3520, 3008, 1, 64, 3520, 3520, 3520, 3008]
    - [0, 8.621]
  - - [3648, 3008, 1, 64, 3648, 3648, 3648, 3008]
    - [0, 8.577]
  - - [3776, 3008, 1, 64, 3776, 3776, 3776, 3008]
    - [0, 8.597]
  - - [3904, 3008, 1, 64, 3904, 3904, 3904, 3008]
    - [0, 8.681]
  - - [4032, 3008, 1, 64, 4032, 4032, 4032, 3008]
    - [0, 8.652]
  - - [64, 3136, 1, 64, 64, 64, 64, 3136]
    - [0, 4.595]
  - - [192, 3136, 1, 64, 192, 192, 192, 3136]
    - [0, 7.493]
  - - [320, 3136, 1, 64, 320, 320, 320, 3136]
    - [0, 8.571]
  - - [448, 3136, 1, 64, 448, 448, 448, 3136]
    - [0, 9.161]
  - - [576, 3136, 1, 64, 576, 576, 576, 3136]
    - [0, 9.531]
  - - [704, 3136, 1, 64, 704, 704, 704, 3136]
    - [0, 9.778]
  - - [832, 3136, 1, 64, 832, 832, 832, 3136]
    - [0, 9.968]
  - - [960, 3136, 1, 64, 960, 960, 960, 3136]
    - [0, 10.108]
  - - [1088, 3136, 1, 64, 1088, 1088, 1088, 3136]
    - [0, 10.189]
  - - [1216, 3136, 1, 64, 1216, 1216, 1216, 3136]
    - [0, 9.584]
  - - [1344, 3136, 1, 64, 1344, 1344, 1344, 3136]
    - [0, 9.863]
  - - [1472, 3136, 1, 64, 1472, 1472, 1472, 3136]
    - [0, 9.956]
  - - [1600, 3136, 1, 64, 1600, 1600, 1600, 3136]
    - [0, 10.037]
  - - [1728, 3136, 1, 64, 1728, 1728, 1728, 3136]
    - [0, 10.091]
  - - [1856, 3136, 1, 64, 1856, 1856, 1856, 3136]
    - [0, 10.152]
  - - [1984, 3136, 1, 64, 1984, 1984, 1984, 3136]
    - [0, 10.199]
  - - [2112, 3136, 1, 64, 2112, 2112, 2112, 3136]
    - [0, 10.27]
  - - [2240, 3136, 1, 64, 2240, 2240, 2240, 3136]
    - [0, 10.279]
  - - [2368, 3136, 1, 64, 2368, 2368, 2368, 3136]
    - [0, 10.326]
  - - [2496, 3136, 1, 64, 2496, 2496, 2496, 3136]
    - [0, 10.344]
  - - [2624, 3136, 1, 64, 2624, 2624, 2624, 3136]
    - [0, 9.963]
  - - [2752, 3136, 1, 64, 2752, 2752, 2752, 3136]
    - [0, 9.639]
  - - [2880, 3136, 1, 64, 2880, 2880, 2880, 3136]
    - [0, 9.055]
  - - [3008, 3136, 1, 64, 3008, 3008, 3008, 3136]
    - [0, 8.472]
  - - [3136, 3136, 1, 64, 3136, 3136, 3136, 3136]
    - [0, 8.482]
  - - [3264, 3136, 1, 64, 3264, 3264, 3264, 3136]
    - [0, 8.653]
  - - [3392, 3136, 1, 64, 3392, 3392, 3392, 3136]
    - [0, 8.634]
  - - [3520, 3136, 1, 64, 3520, 3520, 3520, 3136]
    - [0, 8.635]
  - - [3648, 3136, 1, 64, 3648, 3648, 3648, 3136]
    - [0, 8.587]
  - - [3776, 3136, 1, 64, 3776, 3776, 3776, 3136]
    - [0, 8.597]
  - - [3904, 3136, 1, 64, 3904, 3904, 3904, 3136]
    - [0, 8.676]
  - - [4032, 3136, 1, 64, 4032, 4032, 4032, 3136]
    - [0, 8.633]
  - - [64, 3264, 1, 64, 64, 64, 64, 3264]
    - [0, 4.738]
  - - [192, 3264, 1, 64, 192, 192, 192, 3264]
    - [0, 7.553]
  - - [320, 3264, 1, 64, 320, 320, 320, 3264]
    - [0, 8.633]
  - - [448, 3264, 1, 64, 448, 448, 448, 3264]
    - [0, 9.213]
  - - [576, 3264, 1, 64, 576, 576, 576, 3264]
    - [0, 9.59]
  - - [704, 3264, 1, 64, 704, 704, 704, 3264]
    - [0, 9.819]
  - - [832, 3264, 1, 64, 832, 832, 832, 3264]
    - [0, 9.997]
  - - [960, 3264, 1, 64, 960, 960, 960, 3264]
    - [0, 10.138]
  - - [1088, 3264, 1, 64, 1088, 1088, 1088, 3264]
    - [0, 10.228]
  - - [1216, 3264, 1, 64, 1216, 1216, 1216, 3264]
    - [0, 9.81]
  - - [1344, 3264, 1, 64, 1344, 1344, 1344, 3264]
    - [0, 9.917]
  - - [1472, 3264, 1, 64, 1472, 1472, 1472, 3264]
    - [0, 9.995]
  - - [1600, 3264, 1, 64, 1600, 1600, 1600, 3264]
    - [0, 10.071]
  - - [1728, 3264, 1, 64, 1728, 1728, 1728, 3264]
    - [0, 10.149]
  - - [1856, 3264, 1, 64, 1856, 1856, 1856, 3264]
    - [0, 10.193]
  - - [1984, 3264, 1, 64, 1984, 1984, 1984, 3264]
    - [0, 10.244]
  - - [2112, 3264, 1, 64, 2112, 2112, 2112, 3264]
    - [0, 10.305]
  - - [2240, 3264, 1, 64, 2240, 2240, 2240, 3264]
    - [0, 10.318]
  - - [2368, 3264, 1, 64, 2368, 2368, 2368, 3264]
    - [0, 10.333]
  - - [2496, 3264, 1, 64, 2496, 2496, 2496, 3264]
    - [0, 10.381]
  - - [2624, 3264, 1, 64, 2624, 2624, 2624, 3264]
    - [0, 9.632]
  - - [2752, 3264, 1, 64, 2752, 2752, 2752, 3264]
    - [0, 9.137]
  - - [2880, 3264, 1, 64, 2880, 2880, 2880, 3264]
    - [0, 8.68]
  - - [3008, 3264, 1, 64, 3008, 3008, 3008, 3264]
    - [0, 8.459]
  - - [3136, 3264, 1, 64, 3136, 3136, 3136, 3264]
    - [0, 8.484]
  - - [3264, 3264, 1, 64, 3264, 3264, 3264, 3264]
    - [0, 8.675]
  - - [3392, 3264, 1, 64, 3392, 3392, 3392, 3264]
    - [0, 8.634]
  - - [3520, 3264, 1, 64, 3520, 3520, 3520, 3264]
    - [0, 8.642]
  - - [3648, 3264, 1, 64, 3648, 3648, 3648, 3264]
    - [0, 8.568]
  - - [3776, 3264, 1, 64, 3776, 3776, 3776, 3264]
    - [0, 8.569]
  - - [3904, 3264, 1, 64, 3904, 3904, 3904, 3264]
    - [0, 8.637]
  - - [4032, 3264, 1, 64, 4032, 4032, 4032, 3264]
    - [0, 8.648]
  - - [64, 3392, 1, 64, 64, 64, 64, 3392]
    - [0, 4.875]
  - - [192, 3392, 1, 64, 192, 192, 192, 3392]
    - [0, 7.625]
  - - [320, 3392, 1, 64, 320, 320, 320, 3392]
    - [0, 8.715]
  - - [448, 3392, 1, 64, 448, 448, 448, 3392]
    - [0, 9.268]
  - - [576, 3392, 1, 64, 576, 576, 576, 3392]
    - [0, 9.646]
  - - [704, 3392, 1, 64, 704, 704, 704, 3392]
    - [0, 9.85]
  - - [832, 3392, 1, 64, 832, 832, 832, 3392]
    - [0, 10.03]
  - - [960, 3392, 1, 64, 960, 960, 960, 3392]
    - [0, 10.169]
  - - [1088, 3392, 1, 64, 1088, 1088, 1088, 3392]
    - [0, 9.29]
  - - [1216, 3392, 1, 64, 1216, 1216, 1216, 3392]
    - [0, 9.82]
  - - [1344, 3392, 1, 64, 1344, 1344, 1344, 3392]
    - [0, 9.944]
  - - [1472, 3392, 1, 64, 1472, 1472, 1472, 3392]
    - [0, 10.029]
  - - [1600, 3392, 1, 64, 1600, 1600, 1600, 3392]
    - [0, 10.104]
  - - [1728, 3392, 1, 64, 1728, 1728, 1728, 3392]
    - [0, 10.178]
  - - [1856, 3392, 1, 64, 1856, 1856, 1856, 3392]
    - [0, 10.227]
  - - [1984, 3392, 1, 64, 1984, 1984, 1984, 3392]
    - [0, 10.262]
  - - [2112, 3392, 1, 64, 2112, 2112, 2112, 3392]
    - [0, 10.314]
  - - [2240, 3392, 1, 64, 2240, 2240, 2240, 3392]
    - [0, 10.342]
  - - [2368, 3392, 1, 64, 2368, 2368, 2368, 3392]
    - [0, 10.358]
  - - [2496, 3392, 1, 64, 2496, 2496, 2496, 3392]
    - [0, 9.728]
  - - [2624, 3392, 1, 64, 2624, 2624, 2624, 3392]
    - [0, 9.229]
  - - [2752, 3392, 1, 64, 2752, 2752, 2752, 3392]
    - [0, 8.766]
  - - [2880, 3392, 1, 64, 2880, 2880, 2880, 3392]
    - [0, 8.685]
  - - [3008, 3392, 1, 64, 3008, 3008, 3008, 3392]
    - [0, 8.478]
  - - [3136, 3392, 1, 64, 3136, 3136, 3136, 3392]
    - [0, 8.499]
  - - [3264, 3392, 1, 64, 3264, 3264, 3264, 3392]
    - [0, 8.666]
  - - [3392, 3392, 1, 64, 3392, 3392, 3392, 3392]
    - [0, 8.654]
  - - [3520, 3392, 1, 64, 3520, 3520, 3520, 3392]
    - [0, 8.646]
  - - [3648, 3392, 1, 64, 3648, 3648, 3648, 3392]
    - [0, 8.552]
  - - [3776, 3392, 1, 64, 3776, 3776, 3776, 3392]
    - [0, 8.591]
  - - [3904, 3392, 1, 64, 3904, 3904, 3904, 3392]
    - [0, 8.693]
  - - [4032, 3392, 1, 64, 4032, 4032, 4032, 3392]
    - [0, 8.692]
  - - [64, 3520, 1, 64, 64, 64, 64, 3520]
    - [0, 4.972]
  - - [192, 3520, 1, 64, 192, 192, 192, 3520]
    - [0, 7.746]
  - - [320, 3520, 1, 64, 320, 320, 320, 3520]
    - [0, 8.784]
  - - [448, 3520, 1, 64, 448, 448, 448, 3520]
    - [0, 9.343]
  - - [576, 3520, 1, 64, 576, 576, 576, 3520]
    - [0, 9.677]
  - - [704, 3520, 1, 64, 704, 704, 704, 3520]
    - [0, 9.891]
  - - [832, 3520, 1, 64, 832, 832, 832, 3520]
    - [0, 10.065]
  - - [960, 3520, 1, 64, 960, 960, 960, 3520]
    - [0, 10.215]
  - - [1088, 3520, 1, 64, 1088, 1088, 1088, 3520]
    - [0, 9.625]
  - - [1216, 3520, 1, 64, 1216, 1216, 1216, 3520]
    - [0, 9.868]
  - - [1344, 3520, 1, 64, 1344, 1344, 1344, 3520]
    - [0, 9.987]
  - - [1472, 3520, 1, 64, 1472, 1472, 1472, 3520]
    - [0, 10.062]
  - - [1600, 3520, 1, 64, 1600, 1600, 1600, 3520]
    - [0, 10.131]
  - - [1728, 3520, 1, 64, 1728, 1728, 1728, 3520]
    - [0, 10.206]
  - - [1856, 3520, 1, 64, 1856, 1856, 1856, 3520]
    - [0, 10.25]
  - - [1984, 3520, 1, 64, 1984, 1984, 1984, 3520]
    - [0, 10.299]
  - - [2112, 3520, 1, 64, 2112, 2112, 2112, 3520]
    - [0, 10.335]
  - - [2240, 3520, 1, 64, 2240, 2240, 2240, 3520]
    - [0, 10.351]
  - - [2368, 3520, 1, 64, 2368, 2368, 2368, 3520]
    - [0, 9.714]
  - - [2496, 3520, 1, 64, 2496, 2496, 2496, 3520]
    - [0, 9.453]
  - - [2624, 3520, 1, 64, 2624, 2624, 2624, 3520]
    - [0, 8.769]
  - - [2752, 3520, 1, 64, 2752, 2752, 2752, 3520]
    - [0, 8.66]
  - - [2880, 3520, 1, 64, 2880, 2880, 2880, 3520]
    - [0, 8.681]
  - - [3008, 3520, 1, 64, 3008, 3008, 3008, 3520]
    - [0, 8.463]
  - - [3136, 3520, 1, 64, 3136, 3136, 3136, 3520]
    - [0, 8.502]
  - - [3264, 3520, 1, 64, 3264, 3264, 3264, 3520]
    - [0, 8.69]
  - - [3392, 3520, 1, 64, 3392, 3392, 3392, 3520]
    - [0, 8.627]
  - - [3520, 3520, 1, 64, 3520, 3520, 3520, 3520]
    - [0, 8.626]
  - - [3648, 3520, 1, 64, 3648, 3648, 3648, 3520]
    - [0, 8.569]
  - - [3776, 3520, 1, 64, 3776, 3776, 3776, 3520]
    - [0, 8.62]
  - - [3904, 3520, 1, 64, 3904, 3904, 3904, 3520]
    - [0, 8.706]
  - - [4032, 3520, 1, 64, 4032, 4032, 4032, 3520]
    - [0, 8.712]
  - - [64, 3648, 1, 64, 64, 64, 64, 3648]
    - [0, 5.075]
  - - [192, 3648, 1, 64, 192, 192, 192, 3648]
    - [0, 7.808]
  - - [320, 3648, 1, 64, 320, 320, 320, 3648]
    - [0, 8.852]
  - - [448, 3648, 1, 64, 448, 448, 448, 3648]
    - [0, 9.385]
  - - [576, 3648, 1, 64, 576, 576, 576, 3648]
    - [0, 9.73]
  - - [704, 3648, 1, 64, 704, 704, 704, 3648]
    - [0, 9.928]
  - - [832, 3648, 1, 64, 832, 832, 832, 3648]
    - [0, 10.095]
  - - [960, 3648, 1, 64, 960, 960, 960, 3648]
    - [0, 10.231]
  - - [1088, 3648, 1, 64, 1088, 1088, 1088, 3648]
    - [0, 9.817]
  - - [1216, 3648, 1, 64, 1216, 1216, 1216, 3648]
    - [0, 9.91]
  - - [1344, 3648, 1, 64, 1344, 1344, 1344, 3648]
    - [0, 10.019]
  - - [1472, 3648, 1, 64, 1472, 1472, 1472, 3648]
    - [0, 10.1]
  - - [1600, 3648, 1, 64, 1600, 1600, 1600, 3648]
    - [0, 10.166]
  - - [1728, 3648, 1, 64, 1728, 1728, 1728, 3648]
    - [0, 10.238]
  - - [1856, 3648, 1, 64, 1856, 1856, 1856, 3648]
    - [0, 10.276]
  - - [1984, 3648, 1, 64, 1984, 1984, 1984, 3648]
    - [0, 10.316]
  - - [2112, 3648, 1, 64, 2112, 2112, 2112, 3648]
    - [0, 10.355]
  - - [2240, 3648, 1, 64, 2240, 2240, 2240, 3648]
    - [0, 10.137]
  - - [2368, 3648, 1, 64, 2368, 2368, 2368, 3648]
    - [0, 9.618]
  - - [2496, 3648, 1, 64, 2496, 2496, 2496, 3648]
    - [0, 8.974]
  - - [2624, 3648, 1, 64, 2624, 2624, 2624, 3648]
    - [2, 8.544]
  - - [2752, 3648, 1, 64, 2752, 2752, 2752, 3648]
    - [0, 8.678]
  - - [2880, 3648, 1, 64, 2880, 2880, 2880, 3648]
    - [0, 8.693]
  - - [3008, 3648, 1, 64, 3008, 3008, 3008, 3648]
    - [0, 8.483]
  - - [3136, 3648, 1, 64, 3136, 3136, 3136, 3648]
    - [0, 8.505]
  - - [3264, 3648, 1, 64, 3264, 3264, 3264, 3648]
    - [0, 8.681]
  - - [3392, 3648, 1, 64, 3392, 3392, 3392, 3648]
    - [0, 8.602]
  - - [3520, 3648, 1, 64, 3520, 3520, 3520, 3648]
    - [0, 8.632]
  - - [3648, 3648, 1, 64, 3648, 3648, 3648, 3648]
    - [0, 8.614]
  - - [3776, 3648, 1, 64, 3776, 3776, 3776, 3648]
    - [0, 8.636]
  - - [3904, 3648, 1, 64, 3904, 3904, 3904, 3648]
    - [0, 8.708]
  - - [4032, 3648, 1, 64, 4032, 4032, 4032, 3648]
    - [0, 8.727]
  - - [64, 3776, 1, 64, 64, 64, 64, 3776]
    - [0, 5.152]
  - - [192, 3776, 1, 64, 192, 192, 192, 3776]
    - [0, 7.905]
  - - [320, 3776, 1, 64, 320, 320, 320, 3776]
    - [0, 8.925]
  - - [448, 3776, 1, 64, 448, 448, 448, 3776]
    - [0, 9.435]
  - - [576, 3776, 1, 64, 576, 576, 576, 3776]
    - [0, 9.784]
  - - [704, 3776, 1, 64, 704, 704, 704, 3776]
    - [0, 9.977]
  - - [832, 3776, 1, 64, 832, 832, 832, 3776]
    - [0, 10.129]
  - - [960, 3776, 1, 64, 960, 960, 960, 3776]
    - [0, 10.255]
  - - [1088, 3776, 1, 64, 1088, 1088, 1088, 3776]
    - [0, 9.814]
  - - [1216, 3776, 1, 64, 1216, 1216, 1216, 3776]
    - [0, 9.949]
  - - [1344, 3776, 1, 64, 1344, 1344, 1344, 3776]
    - [0, 10.06]
  - - [1472, 3776, 1, 64, 1472, 1472, 1472, 3776]
    - [0, 10.13]
  - - [1600, 3776, 1, 64, 1600, 1600, 1600, 3776]
    - [0, 10.197]
  - - [1728, 3776, 1, 64, 1728, 1728, 1728, 3776]
    - [0, 10.258]
  - - [1856, 3776, 1, 64, 1856, 1856, 1856, 3776]
    - [0, 10.298]
  - - [1984, 3776, 1, 64, 1984, 1984, 1984, 3776]
    - [0, 10.343]
  - - [2112, 3776, 1, 64, 2112, 2112, 2112, 3776]
    - [0, 10.37]
  - - [2240, 3776, 1, 64, 2240, 2240, 2240, 3776]
    - [0, 9.728]
  - - [2368, 3776, 1, 64, 2368, 2368, 2368, 3776]
    - [0, 9.131]
  - - [2496, 3776, 1, 64, 2496, 2496, 2496, 3776]
    - [0, 8.638]
  - - [2624, 3776, 1, 64, 2624, 2624, 2624, 3776]
    - [2, 8.562]
  - - [2752, 3776, 1, 64, 2752, 2752, 2752, 3776]
    - [0, 8.682]
  - - [2880, 3776, 1, 64, 2880, 2880, 2880, 3776]
    - [0, 8.696]
  - - [3008, 3776, 1, 64, 3008, 3008, 3008, 3776]
    - [0, 8.48]
  - - [3136, 3776, 1, 64, 3136, 3136, 3136, 3776]
    - [0, 8.502]
  - - [3264, 3776, 1, 64, 3264, 3264, 3264, 3776]
    - [0, 8.658]
  - - [3392, 3776, 1, 64, 3392, 3392, 3392, 3776]
    - [0, 8.623]
  - - [3520, 3776, 1, 64, 3520, 3520, 3520, 3776]
    - [0, 8.652]
  - - [3648, 3776, 1, 64, 3648, 3648, 3648, 3776]
    - [0, 8.621]
  - - [3776, 3776, 1, 64, 3776, 3776, 3776, 3776]
    - [0, 8.635]
  - - [3904, 3776, 1, 64, 3904, 3904, 3904, 3776]
    - [0, 8.708]
  - - [4032, 3776, 1, 64, 4032, 4032, 4032, 3776]
    - [0, 8.736]
  - - [64, 3904, 1, 64, 64, 64, 64, 3904]
    - [0, 5.274]
  - - [192, 3904, 1, 64, 192, 192, 192, 3904]
    - [0, 7.99]
  - - [320, 3904, 1, 64, 320, 320, 320, 3904]
    - [0, 8.968]
  - - [448, 3904, 1, 64, 448, 448, 448, 3904]
    - [0, 9.479]
  - - [576, 3904, 1, 64, 576, 576, 576, 3904]
    - [0, 9.806]
  - - [704, 3904, 1, 64, 704, 704, 704, 3904]
    - [0, 10.02]
  - - [832, 3904, 1, 64, 832, 832, 832, 3904]
    - [0, 10.15]
  - - [960, 3904, 1, 64, 960, 960, 960, 3904]
    - [0, 9.426]
  - - [1088, 3904, 1, 64, 1088, 1088, 1088, 3904]
    - [0, 9.857]
  - - [1216, 3904, 1, 64, 1216, 1216, 1216, 3904]
    - [0, 9.972]
  - - [1344, 3904, 1, 64, 1344, 1344, 1344, 3904]
    - [0, 10.083]
  - - [1472, 3904, 1, 64, 1472, 1472, 1472, 3904]
    - [0, 10.153]
  - - [1600, 3904, 1, 64, 1600, 1600, 1600, 3904]
    - [0, 10.226]
  - - [1728, 3904, 1, 64, 1728, 1728, 1728, 3904]
    - [0, 10.277]
  - - [1856, 3904, 1, 64, 1856, 1856, 1856, 3904]
    - [0, 10.325]
  - - [1984, 3904, 1, 64, 1984, 1984, 1984, 3904]
    - [0, 10.346]
  - - [2112, 3904, 1, 64, 2112, 2112, 2112, 3904]
    - [0, 9.994]
  - - [2240, 3904, 1, 64, 2240, 2240, 2240, 3904]
    - [0, 9.503]
  - - [2368, 3904, 1, 64, 2368, 2368, 2368, 3904]
    - [0, 8.857]
  - - [2496, 3904, 1, 64, 2496, 2496, 2496, 3904]
    - [0, 8.649]
  - - [2624, 3904, 1, 64, 2624, 2624, 2624, 3904]
    - [2, 8.571]
  - - [2752, 3904, 1, 64, 2752, 2752, 2752, 3904]
    - [0, 8.709]
  - - [2880, 3904, 1, 64, 2880, 2880, 2880, 3904]
    - [0, 8.724]
  - - [3008, 3904, 1, 64, 3008, 3008, 3008, 3904]
    - [0, 8.498]
  - - [3136, 3904, 1, 64, 3136, 3136, 3136, 3904]
    - [0, 8.489]
  - - [3264, 3904, 1, 64, 3264, 3264, 3264, 3904]
    - [0, 8.661]
  - - [3392, 3904, 1, 64, 3392, 3392, 3392, 3904]
    - [0, 8.647]
  - - [3520, 3904, 1, 64, 3520, 3520, 3520, 3904]
    - [0, 8.678]
  - - [3648, 3904, 1, 64, 3648, 3648, 3648, 3904]
    - [0, 8.637]
  - - [3776, 3904, 1, 64, 3776, 3776, 3776, 3904]
    - [0, 8.631]
  - - [3904, 3904, 1, 64, 3904, 3904, 3904, 3904]
    - [0, 8.72]
  - - [4032, 3904, 1, 64, 4032, 4032, 4032, 3904]
    - [0, 8.736]
  - - [64, 4032, 1, 64, 64, 64, 64, 4032]
    - [0, 5.379]
  - - [192, 4032, 1, 64, 192, 192, 192, 4032]
    - [0, 8.022]
  - - [320, 4032, 1, 64, 320, 320, 320, 4032]
    - [0, 9.027]
  - - [448, 4032, 1, 64, 448, 448, 448, 4032]
    - [0, 9.523]
  - - [576, 4032, 1, 64, 576, 576, 576, 4032]
    - [0, 9.849]
  - - [704, 4032, 1, 64, 704, 704, 704, 4032]
    - [0, 10.044]
  - - [832, 4032, 1, 64, 832, 832, 832, 4032]
    - [0, 10.171]
  - - [960, 4032, 1, 64, 960, 960, 960, 4032]
    - [0, 9.721]
  - - [1088, 4032, 1, 64, 1088, 1088, 1088, 4032]
    - [0, 9.9]
  - - [1216, 4032, 1, 64, 1216, 1216, 1216, 4032]
    - [0, 10.015]
  - - [1344, 4032, 1, 64, 1344, 1344, 1344, 4032]
    - [0, 10.115]
  - - [1472, 4032, 1, 64, 1472, 1472, 1472, 4032]
    - [0, 10.183]
  - - [1600, 4032, 1, 64, 1600, 1600, 1600, 4032]
    - [0, 10.244]
  - - [1728, 4032, 1, 64, 1728, 1728, 1728, 4032]
    - [0, 10.304]
  - - [1856, 4032, 1, 64, 1856, 1856, 1856, 4032]
    - [0, 10.336]
  - - [1984, 4032, 1, 64, 1984, 1984, 1984, 4032]
    - [0, 10.371]
  - - [2112, 4032, 1, 64, 2112, 2112, 2112, 4032]
    - [0, 9.734]
  - - [2240, 4032, 1, 64, 2240, 2240, 2240, 4032]
    - [0, 9.073]
  - - [2368, 4032, 1, 64, 2368, 2368, 2368, 4032]
    - [0, 8.652]
  - - [2496, 4032, 1, 64, 2496, 2496, 2496, 4032]
    - [0, 8.672]
  - - [2624, 4032, 1, 64, 2624, 2624, 2624, 4032]
    - [2, 8.592]
  - - [2752, 4032, 1, 64, 2752, 2752, 2752, 4032]
    - [0, 8.707]
  - - [2880, 4032, 1, 64, 2880, 2880, 2880, 4032]
    - [0, 8.72]
  - - [3008, 4032, 1, 64, 3008, 3008, 3008, 4032]
    - [0, 8.469]
  - - [3136, 4032, 1, 64, 3136, 3136, 3136, 4032]
    - [0, 8.474]
  - - [3264, 4032, 1, 64, 3264, 3264, 3264, 4032]
    - [0, 8.676]
  - - [3392, 4032, 1, 64, 3392, 3392, 3392, 4032]
    - [0, 8.671]
  - - [3520, 4032, 1, 64, 3520, 3520, 3520, 4032]
    - [0, 8.669]
  - - [3648, 4032, 1, 64, 3648, 3648, 3648, 4032]
    - [0, 8.618]
  - - [3776, 4032, 1, 64, 3776, 3776, 3776, 4032]
    - [0, 8.634]
  - - [3904, 4032, 1, 64, 3904, 3904, 3904, 4032]
    - [0, 8.723]
  - - [4032, 4032, 1, 64, 4032, 4032, 4032, 4032]
    - [0, 8.705]
  - - [64, 64, 1, 256, 64, 64, 64, 64]
    - [2, 0.524]
  - - [192, 64, 1, 256, 192, 192, 192, 64]
    - [2, 1.554]
  - - [320, 64, 1, 256, 320, 320, 320, 64]
    - [0, 2.493]
  - - [448, 64, 1, 256, 448, 448, 448, 64]
    - [0, 3.479]
  - - [576, 64, 1, 256, 576, 576, 576, 64]
    - [2, 3.937]
  - - [704, 64, 1, 256, 704, 704, 704, 64]
    - [2, 4.785]
  - - [832, 64, 1, 256, 832, 832, 832, 64]
    - [0, 5.586]
  - - [960, 64, 1, 256, 960, 960, 960, 64]
    - [0, 6.423]
  - - [1088, 64, 1, 256, 1088, 1088, 1088, 64]
    - [0, 6.45]
  - - [1216, 64, 1, 256, 1216, 1216, 1216, 64]
    - [0, 7.154]
  - - [1344, 64, 1, 256, 1344, 1344, 1344, 64]
    - [0, 7.895]
  - - [1472, 64, 1, 256, 1472, 1472, 1472, 64]
    - [0, 7.777]
  - - [1600, 64, 1, 256, 1600, 1600, 1600, 64]
    - [0, 8.377]
  - - [1728, 64, 1, 256, 1728, 1728, 1728, 64]
    - [0, 9.033]
  - - [1856, 64, 1, 256, 1856, 1856, 1856, 64]
    - [0, 9.654]
  - - [1984, 64, 1, 256, 1984, 1984, 1984, 64]
    - [0, 9.458]
  - - [2112, 64, 1, 256, 2112, 2112, 2112, 64]
    - [0, 9.991]
  - - [2240, 64, 1, 256, 2240, 2240, 2240, 64]
    - [0, 10.442]
  - - [2368, 64, 1, 256, 2368, 2368, 2368, 64]
    - [0, 11.019]
  - - [2496, 64, 1, 256, 2496, 2496, 2496, 64]
    - [0, 10.413]
  - - [2624, 64, 1, 256, 2624, 2624, 2624, 64]
    - [0, 10.959]
  - - [2752, 64, 1, 256, 2752, 2752, 2752, 64]
    - [0, 11.582]
  - - [2880, 64, 1, 256, 2880, 2880, 2880, 64]
    - [0, 11.916]
  - - [3008, 64, 1, 256, 3008, 3008, 3008, 64]
    - [0, 11.647]
  - - [3136, 64, 1, 256, 3136, 3136, 3136, 64]
    - [0, 12.093]
  - - [3264, 64, 1, 256, 3264, 3264, 3264, 64]
    - [0, 12.397]
  - - [3392, 64, 1, 256, 3392, 3392, 3392, 64]
    - [0, 12.201]
  - - [3520, 64, 1, 256, 3520, 3520, 3520, 64]
    - [0, 12.615]
  - - [3648, 64, 1, 256, 3648, 3648, 3648, 64]
    - [0, 12.728]
  - - [3776, 64, 1, 256, 3776, 3776, 3776, 64]
    - [0, 13.085]
  - - [3904, 64, 1, 256, 3904, 3904, 3904, 64]
    - [0, 12.97]
  - - [4032, 64, 1, 256, 4032, 4032, 4032, 64]
    - [0, 13.171]
  - - [64, 192, 1, 256, 64, 64, 64, 192]
    - [1, 0.902]
  - - [192, 192, 1, 256, 192, 192, 192, 192]
    - [1, 2.72]
  - - [320, 192, 1, 256, 320, 320, 320, 192]
    - [0, 4.51]
  - - [448, 192, 1, 256, 448, 448, 448, 192]
    - [2, 7.583]
  - - [576, 192, 1, 256, 576, 576, 576, 192]
    - [3, 8.158]
  - - [704, 192, 1, 256, 704, 704, 704, 192]
    - [0, 9.996]
  - - [832, 192, 1, 256, 832, 832, 832, 192]
    - [0, 10.698]
  - - [960, 192, 1, 256, 960, 960, 960, 192]
    - [0, 12.178]
  - - [1088, 192, 1, 256, 1088, 1088, 1088, 192]
    - [0, 12.546]
  - - [1216, 192, 1, 256, 1216, 1216, 1216, 192]
    - [0, 13.072]
  - - [1344, 192, 1, 256, 1344, 1344, 1344, 192]
    - [0, 13.435]
  - - [1472, 192, 1, 256, 1472, 1472, 1472, 192]
    - [0, 13.779]
  - - [1600, 192, 1, 256, 1600, 1600, 1600, 192]
    - [0, 14.786]
  - - [1728, 192, 1, 256, 1728, 1728, 1728, 192]
    - [0, 15.007]
  - - [1856, 192, 1, 256, 1856, 1856, 1856, 192]
    - [0, 15.269]
  - - [1984, 192, 1, 256, 1984, 1984, 1984, 192]
    - [0, 15.468]
  - - [2112, 192, 1, 256, 2112, 2112, 2112, 192]
    - [0, 15.626]
  - - [2240, 192, 1, 256, 2240, 2240, 2240, 192]
    - [0, 16.172]
  - - [2368, 192, 1, 256, 2368, 2368, 2368, 192]
    - [0, 16.404]
  - - [2496, 192, 1, 256, 2496, 2496, 2496, 192]
    - [0, 16.528]
  - - [2624, 192, 1, 256, 2624, 2624, 2624, 192]
    - [0, 16.715]
  - - [2752, 192, 1, 256, 2752, 2752, 2752, 192]
    - [0, 16.834]
  - - [2880, 192, 1, 256, 2880, 2880, 2880, 192]
    - [0, 17.322]
  - - [3008, 192, 1, 256, 3008, 3008, 3008, 192]
    - [0, 17.298]
  - - [3136, 192, 1, 256, 3136, 3136, 3136, 192]
    - [0, 17.543]
  - - [3264, 192, 1, 256, 3264, 3264, 3264, 192]
    - [0, 17.6]
  - - [3392, 192, 1, 256, 3392, 3392, 3392, 192]
    - [0, 17.677]
  - - [3520, 192, 1, 256, 3520, 3520, 3520, 192]
    - [0, 17.965]
  - - [3648, 192, 1, 256, 3648, 3648, 3648, 192]
    - [0, 18.14]
  - - [3776, 192, 1, 256, 3776, 3776, 3776, 192]
    - [0, 18.217]
  - - [3904, 192, 1, 256, 3904, 3904, 3904, 192]
    - [0, 18.254]
  - - [4032, 192, 1, 256, 4032, 4032, 4032, 192]
    - [0, 18.396]
  - - [64, 320, 1, 256, 64, 64, 64, 320]
    - [0, 2.505]
  - - [192, 320, 1, 256, 192, 192, 192, 320]
    - [0, 6.391]
  - - [320, 320, 1, 256, 320, 320, 320, 320]
    - [0, 8.342]
  - - [448, 320, 1, 256, 448, 448, 448, 320]
    - [0, 10.496]
  - - [576, 320, 1, 256, 576, 576, 576, 320]
    - [0, 12.118]
  - - [704, 320, 1, 256, 704, 704, 704, 320]
    - [0, 12.673]
  - - [832, 320, 1, 256, 832, 832, 832, 320]
    - [0, 13.67]
  - - [960, 320, 1, 256, 960, 960, 960, 320]
    - [0, 14.762]
  - - [1088, 320, 1, 256, 1088, 1088, 1088, 320]
    - [0, 14.96]
  - - [1216, 320, 1, 256, 1216, 1216, 1216, 320]
    - [0, 15.68]
  - - [1344, 320, 1, 256, 1344, 1344, 1344, 320]
    - [0, 16.253]
  - - [1472, 320, 1, 256, 1472, 1472, 1472, 320]
    - [0, 16.244]
  - - [1600, 320, 1, 256, 1600, 1600, 1600, 320]
    - [0, 16.82]
  - - [1728, 320, 1, 256, 1728, 1728, 1728, 320]
    - [0, 17.184]
  - - [1856, 320, 1, 256, 1856, 1856, 1856, 320]
    - [0, 17.352]
  - - [1984, 320, 1, 256, 1984, 1984, 1984, 320]
    - [0, 17.641]
  - - [2112, 320, 1, 256, 2112, 2112, 2112, 320]
    - [0, 17.981]
  - - [2240, 320, 1, 256, 2240, 2240, 2240, 320]
    - [0, 18.022]
  - - [2368, 320, 1, 256, 2368, 2368, 2368, 320]
    - [0, 18.238]
  - - [2496, 320, 1, 256, 2496, 2496, 2496, 320]
    - [0, 18.542]
  - - [2624, 320, 1, 256, 2624, 2624, 2624, 320]
    - [0, 18.511]
  - - [2752, 320, 1, 256, 2752, 2752, 2752, 320]
    - [0, 18.77]
  - - [2880, 320, 1, 256, 2880, 2880, 2880, 320]
    - [0, 18.921]
  - - [3008, 320, 1, 256, 3008, 3008, 3008, 320]
    - [0, 18.934]
  - - [3136, 320, 1, 256, 3136, 3136, 3136, 320]
    - [0, 19.124]
  - - [3264, 320, 1, 256, 3264, 3264, 3264, 320]
    - [0, 19.261]
  - - [3392, 320, 1, 256, 3392, 3392, 3392, 320]
    - [0, 19.359]
  - - [3520, 320, 1, 256, 3520, 3520, 3520, 320]
    - [0, 19.481]
  - - [3648, 320, 1, 256, 3648, 3648, 3648, 320]
    - [0, 19.557]
  - - [3776, 320, 1, 256, 3776, 3776, 3776, 320]
    - [0, 19.606]
  - - [3904, 320, 1, 256, 3904, 3904, 3904, 320]
    - [0, 19.641]
  - - [4032, 320, 1, 256, 4032, 4032, 4032, 320]
    - [0, 19.85]
  - - [64, 448, 1, 256, 64, 64, 64, 448]
    - [0, 3.518]
  - - [192, 448, 1, 256, 192, 192, 192, 448]
    - [0, 7.862]
  - - [320, 448, 1, 256, 320, 320, 320, 448]
    - [0, 10.52]
  - - [448, 448, 1, 256, 448, 448, 448, 448]
    - [0, 12.203]
  - - [576, 448, 1, 256, 576, 576, 576, 448]
    - [0, 13.4]
  - - [704, 448, 1, 256, 704, 704, 704, 448]
    - [0, 14.465]
  - - [832, 448, 1, 256, 832, 832, 832, 448]
    - [0, 15.335]
  - - [960, 448, 1, 256, 960, 960, 960, 448]
    - [0, 16.226]
  - - [1088, 448, 1, 256, 1088, 1088, 1088, 448]
    - [0, 16.628]
  - - [1216, 448, 1, 256, 1216, 1216, 1216, 448]
    - [0, 17.03]
  - - [1344, 448, 1, 256, 1344, 1344, 1344, 448]
    - [0, 17.529]
  - - [1472, 448, 1, 256, 1472, 1472, 1472, 448]
    - [0, 17.769]
  - - [1600, 448, 1, 256, 1600, 1600, 1600, 448]
    - [0, 18.075]
  - - [1728, 448, 1, 256, 1728, 1728, 1728, 448]
    - [0, 18.513]
  - - [1856, 448, 1, 256, 1856, 1856, 1856, 448]
    - [0, 18.708]
  - - [1984, 448, 1, 256, 1984, 1984, 1984, 448]
    - [0, 18.783]
  - - [2112, 448, 1, 256, 2112, 2112, 2112, 448]
    - [0, 18.979]
  - - [2240, 448, 1, 256, 2240, 2240, 2240, 448]
    - [0, 19.154]
  - - [2368, 448, 1, 256, 2368, 2368, 2368, 448]
    - [0, 19.354]
  - - [2496, 448, 1, 256, 2496, 2496, 2496, 448]
    - [0, 19.565]
  - - [2624, 448, 1, 256, 2624, 2624, 2624, 448]
    - [0, 19.577]
  - - [2752, 448, 1, 256, 2752, 2752, 2752, 448]
    - [0, 19.729]
  - - [2880, 448, 1, 256, 2880, 2880, 2880, 448]
    - [0, 19.717]
  - - [3008, 448, 1, 256, 3008, 3008, 3008, 448]
    - [0, 19.851]
  - - [3136, 448, 1, 256, 3136, 3136, 3136, 448]
    - [0, 19.906]
  - - [3264, 448, 1, 256, 3264, 3264, 3264, 448]
    - [0, 20.161]
  - - [3392, 448, 1, 256, 3392, 3392, 3392, 448]
    - [0, 20.151]
  - - [3520, 448, 1, 256, 3520, 3520, 3520, 448]
    - [0, 20.182]
  - - [3648, 448, 1, 256, 3648, 3648, 3648, 448]
    - [0, 20.312]
  - - [3776, 448, 1, 256, 3776, 3776, 3776, 448]
    - [0, 20.319]
  - - [3904, 448, 1, 256, 3904, 3904, 3904, 448]
    - [0, 20.387]
  - - [4032, 448, 1, 256, 4032, 4032, 4032, 448]
    - [0, 20.467]
  - - [64, 576, 1, 256, 64, 64, 64, 576]
    - [2, 3.99]
  - - [192, 576, 1, 256, 192, 192, 192, 576]
    - [0, 9.019]
  - - [320, 576, 1, 256, 320, 320, 320, 576]
    - [0, 12.08]
  - - [448, 576, 1, 256, 448, 448, 448, 576]
    - [0, 13.326]
  - - [576, 576, 1, 256, 576, 576, 576, 576]
    - [0, 15.033]
  - - [704, 576, 1, 256, 704, 704, 704, 576]
    - [0, 15.703]
  - - [832, 576, 1, 256, 832, 832, 832, 576]
    - [0, 16.497]
  - - [960, 576, 1, 256, 960, 960, 960, 576]
    - [0, 17.225]
  - - [1088, 576, 1, 256, 1088, 1088, 1088, 576]
    - [0, 17.563]
  - - [1216, 576, 1, 256, 1216, 1216, 1216, 576]
    - [0, 18.059]
  - - [1344, 576, 1, 256, 1344, 1344, 1344, 576]
    - [0, 18.379]
  - - [1472, 576, 1, 256, 1472, 1472, 1472, 576]
    - [0, 18.625]
  - - [1600, 576, 1, 256, 1600, 1600, 1600, 576]
    - [0, 18.929]
  - - [1728, 576, 1, 256, 1728, 1728, 1728, 576]
    - [0, 19.103]
  - - [1856, 576, 1, 256, 1856, 1856, 1856, 576]
    - [0, 19.25]
  - - [1984, 576, 1, 256, 1984, 1984, 1984, 576]
    - [0, 19.54]
  - - [2112, 576, 1, 256, 2112, 2112, 2112, 576]
    - [0, 19.616]
  - - [2240, 576, 1, 256, 2240, 2240, 2240, 576]
    - [0, 19.772]
  - - [2368, 576, 1, 256, 2368, 2368, 2368, 576]
    - [0, 19.952]
  - - [2496, 576, 1, 256, 2496, 2496, 2496, 576]
    - [0, 19.987]
  - - [2624, 576, 1, 256, 2624, 2624, 2624, 576]
    - [0, 20.198]
  - - [2752, 576, 1, 256, 2752, 2752, 2752, 576]
    - [0, 20.089]
  - - [2880, 576, 1, 256, 2880, 2880, 2880, 576]
    - [0, 20.29]
  - - [3008, 576, 1, 256, 3008, 3008, 3008, 576]
    - [0, 20.404]
  - - [3136, 576, 1, 256, 3136, 3136, 3136, 576]
    - [0, 20.479]
  - - [3264, 576, 1, 256, 3264, 3264, 3264, 576]
    - [0, 18.906]
  - - [3392, 576, 1, 256, 3392, 3392, 3392, 576]
    - [0, 19.619]
  - - [3520, 576, 1, 256, 3520, 3520, 3520, 576]
    - [0, 19.504]
  - - [3648, 576, 1, 256, 3648, 3648, 3648, 576]
    - [0, 19.703]
  - - [3776, 576, 1, 256, 3776, 3776, 3776, 576]
    - [0, 19.886]
  - - [3904, 576, 1, 256, 3904, 3904, 3904, 576]
    - [0, 19.833]
  - - [4032, 576, 1, 256, 4032, 4032, 4032, 576]
    - [0, 19.932]
  - - [64, 704, 1, 256, 64, 64, 64, 704]
    - [2, 4.867]
  - - [192, 704, 1, 256, 192, 192, 192, 704]
    - [0, 9.961]
  - - [320, 704, 1, 256, 320, 320, 320, 704]
    - [0, 12.798]
  - - [448, 704, 1, 256, 448, 448, 448, 704]
    - [0, 14.425]
  - - [576, 704, 1, 256, 576, 576, 576, 704]
    - [0, 15.627]
  - - [704, 704, 1, 256, 704, 704, 704, 704]
    - [0, 16.681]
  - - [832, 704, 1, 256, 832, 832, 832, 704]
    - [0, 17.387]
  - - [960, 704, 1, 256, 960, 960, 960, 704]
    - [0, 17.932]
  - - [1088, 704, 1, 256, 1088, 1088, 1088, 704]
    - [0, 18.339]
  - - [1216, 704, 1, 256, 1216, 1216, 1216, 704]
    - [0, 18.748]
  - - [1344, 704, 1, 256, 1344, 1344, 1344, 704]
    - [0, 18.994]
  - - [1472, 704, 1, 256, 1472, 1472, 1472, 704]
    - [0, 19.255]
  - - [1600, 704, 1, 256, 1600, 1600, 1600, 704]
    - [0, 19.459]
  - - [1728, 704, 1, 256, 1728, 1728, 1728, 704]
    - [0, 19.596]
  - - [1856, 704, 1, 256, 1856, 1856, 1856, 704]
    - [0, 19.848]
  - - [1984, 704, 1, 256, 1984, 1984, 1984, 704]
    - [0, 19.98]
  - - [2112, 704, 1, 256, 2112, 2112, 2112, 704]
    - [0, 20.175]
  - - [2240, 704, 1, 256, 2240, 2240, 2240, 704]
    - [0, 20.268]
  - - [2368, 704, 1, 256, 2368, 2368, 2368, 704]
    - [0, 20.37]
  - - [2496, 704, 1, 256, 2496, 2496, 2496, 704]
    - [0, 20.435]
  - - [2624, 704, 1, 256, 2624, 2624, 2624, 704]
    - [0, 18.6]
  - - [2752, 704, 1, 256, 2752, 2752, 2752, 704]
    - [0, 19.466]
  - - [2880, 704, 1, 256, 2880, 2880, 2880, 704]
    - [0, 19.645]
  - - [3008, 704, 1, 256, 3008, 3008, 3008, 704]
    - [0, 19.721]
  - - [3136, 704, 1, 256, 3136, 3136, 3136, 704]
    - [0, 19.84]
  - - [3264, 704, 1, 256, 3264, 3264, 3264, 704]
    - [0, 19.931]
  - - [3392, 704, 1, 256, 3392, 3392, 3392, 704]
    - [0, 20.072]
  - - [3520, 704, 1, 256, 3520, 3520, 3520, 704]
    - [0, 20.086]
  - - [3648, 704, 1, 256, 3648, 3648, 3648, 704]
    - [0, 20.219]
  - - [3776, 704, 1, 256, 3776, 3776, 3776, 704]
    - [0, 20.316]
  - - [3904, 704, 1, 256, 3904, 3904, 3904, 704]
    - [0, 20.36]
  - - [4032, 704, 1, 256, 4032, 4032, 4032, 704]
    - [0, 20.395]
  - - [64, 832, 1, 256, 64, 64, 64, 832]
    - [2, 3.89]
  - - [192, 832, 1, 256, 192, 192, 192, 832]
    - [0, 10.818]
  - - [320, 832, 1, 256, 320, 320, 320, 832]
    - [0, 13.772]
  - - [448, 832, 1, 256, 448, 448, 448, 832]
    - [0, 15.343]
  - - [576, 832, 1, 256, 576, 576, 576, 832]
    - [0, 16.515]
  - - [704, 832, 1, 256, 704, 704, 704, 832]
    - [0, 17.279]
  - - [832, 832, 1, 256, 832, 832, 832, 832]
    - [0, 18.017]
  - - [960, 832, 1, 256, 960, 960, 960, 832]
    - [0, 18.493]
  - - [1088, 832, 1, 256, 1088, 1088, 1088, 832]
    - [0, 18.809]
  - - [1216, 832, 1, 256, 1216, 1216, 1216, 832]
    - [0, 19.185]
  - - [1344, 832, 1, 256, 1344, 1344, 1344, 832]
    - [0, 19.506]
  - - [1472, 832, 1, 256, 1472, 1472, 1472, 832]
    - [0, 19.636]
  - - [1600, 832, 1, 256, 1600, 1600, 1600, 832]
    - [0, 19.876]
  - - [1728, 832, 1, 256, 1728, 1728, 1728, 832]
    - [0, 20.061]
  - - [1856, 832, 1, 256, 1856, 1856, 1856, 832]
    - [0, 20.076]
  - - [1984, 832, 1, 256, 1984, 1984, 1984, 832]
    - [0, 20.252]
  - - [2112, 832, 1, 256, 2112, 2112, 2112, 832]
    - [0, 20.504]
  - - [2240, 832, 1, 256, 2240, 2240, 2240, 832]
    - [0, 18.753]
  - - [2368, 832, 1, 256, 2368, 2368, 2368, 832]
    - [0, 19.638]
  - - [2496, 832, 1, 256, 2496, 2496, 2496, 832]
    - [0, 19.666]
  - - [2624, 832, 1, 256, 2624, 2624, 2624, 832]
    - [0, 19.774]
  - - [2752, 832, 1, 256, 2752, 2752, 2752, 832]
    - [0, 19.965]
  - - [2880, 832, 1, 256, 2880, 2880, 2880, 832]
    - [0, 20.08]
  - - [3008, 832, 1, 256, 3008, 3008, 3008, 832]
    - [0, 20.101]
  - - [3136, 832, 1, 256, 3136, 3136, 3136, 832]
    - [0, 20.22]
  - - [3264, 832, 1, 256, 3264, 3264, 3264, 832]
    - [0, 20.278]
  - - [3392, 832, 1, 256, 3392, 3392, 3392, 832]
    - [0, 20.335]
  - - [3520, 832, 1, 256, 3520, 3520, 3520, 832]
    - [0, 20.397]
  - - [3648, 832, 1, 256, 3648, 3648, 3648, 832]
    - [0, 20.557]
  - - [3776, 832, 1, 256, 3776, 3776, 3776, 832]
    - [0, 20.577]
  - - [3904, 832, 1, 256, 3904, 3904, 3904, 832]
    - [0, 20.671]
  - - [4032, 832, 1, 256, 4032, 4032, 4032, 832]
    - [0, 20.642]
  - - [64, 960, 1, 256, 64, 64, 64, 960]
    - [0, 6.415]
  - - [192, 960, 1, 256, 192, 192, 192, 960]
    - [0, 12.063]
  - - [320, 960, 1, 256, 320, 320, 320, 960]
    - [0, 14.736]
  - - [448, 960, 1, 256, 448, 448, 448, 960]
    - [0, 16.172]
  - - [576, 960, 1, 256, 576, 576, 576, 960]
    - [0, 17.17]
  - - [704, 960, 1, 256, 704, 704, 704, 960]
    - [0, 17.951]
  - - [832, 960, 1, 256, 832, 832, 832, 960]
    - [0, 18.499]
  - - [960, 960, 1, 256, 960, 960, 960, 960]
    - [0, 18.967]
  - - [1088, 960, 1, 256, 1088, 1088, 1088, 960]
    - [0, 19.268]
  - - [1216, 960, 1, 256, 1216, 1216, 1216, 960]
    - [0, 19.682]
  - - [1344, 960, 1, 256, 1344, 1344, 1344, 960]
    - [0, 19.784]
  - - [1472, 960, 1, 256, 1472, 1472, 1472, 960]
    - [0, 19.94]
  - - [1600, 960, 1, 256, 1600, 1600, 1600, 960]
    - [0, 20.153]
  - - [1728, 960, 1, 256, 1728, 1728, 1728, 960]
    - [0, 20.29]
  - - [1856, 960, 1, 256, 1856, 1856, 1856, 960]
    - [0, 20.488]
  - - [1984, 960, 1, 256, 1984, 1984, 1984, 960]
    - [0, 19.151]
  - - [2112, 960, 1, 256, 2112, 2112, 2112, 960]
    - [0, 19.691]
  - - [2240, 960, 1, 256, 2240, 2240, 2240, 960]
    - [0, 19.8]
  - - [2368, 960, 1, 256, 2368, 2368, 2368, 960]
    - [0, 19.868]
  - - [2496, 960, 1, 256, 2496, 2496, 2496, 960]
    - [0, 20.033]
  - - [2624, 960, 1, 256, 2624, 2624, 2624, 960]
    - [0, 20.094]
  - - [2752, 960, 1, 256, 2752, 2752, 2752, 960]
    - [0, 20.202]
  - - [2880, 960, 1, 256, 2880, 2880, 2880, 960]
    - [0, 20.35]
  - - [3008, 960, 1, 256, 3008, 3008, 3008, 960]
    - [0, 20.348]
  - - [3136, 960, 1, 256, 3136, 3136, 3136, 960]
    - [0, 20.502]
  - - [3264, 960, 1, 256, 3264, 3264, 3264, 960]
    - [0, 20.559]
  - - [3392, 960, 1, 256, 3392, 3392, 3392, 960]
    - [0, 20.663]
  - - [3520, 960, 1, 256, 3520, 3520, 3520, 960]
    - [0, 20.693]
  - - [3648, 960, 1, 256, 3648, 3648, 3648, 960]
    - [0, 20.755]
  - - [3776, 960, 1, 256, 3776, 3776, 3776, 960]
    - [0, 20.747]
  - - [3904, 960, 1, 256, 3904, 3904, 3904, 960]
    - [0, 20.714]
  - - [4032, 960, 1, 256, 4032, 4032, 4032, 960]
    - [0, 20.799]
  - - [64, 1088, 1, 256, 64, 64, 64, 1088]
    - [0, 6.44]
  - - [192, 1088, 1, 256, 192, 192, 192, 1088]
    - [0, 12.645]
  - - [320, 1088, 1, 256, 320, 320, 320, 1088]
    - [0, 14.98]
  - - [448, 1088, 1, 256, 448, 448, 448, 1088]
    - [0, 16.632]
  - - [576, 1088, 1, 256, 576, 576, 576, 1088]
    - [0, 17.585]
  - - [704, 1088, 1, 256, 704, 704, 704, 1088]
    - [0, 18.451]
  - - [832, 1088, 1, 256, 832, 832, 832, 1088]
    - [0, 18.902]
  - - [960, 1088, 1, 256, 960, 960, 960, 1088]
    - [0, 19.299]
  - - [1088, 1088, 1, 256, 1088, 1088, 1088, 1088]
    - [0, 19.587]
  - - [1216, 1088, 1, 256, 1216, 1216, 1216, 1088]
    - [0, 19.83]
  - - [1344, 1088, 1, 256, 1344, 1344, 1344, 1088]
    - [0, 20.043]
  - - [1472, 1088, 1, 256, 1472, 1472, 1472, 1088]
    - [0, 20.198]
  - - [1600, 1088, 1, 256, 1600, 1600, 1600, 1088]
    - [0, 20.414]
  - - [1728, 1088, 1, 256, 1728, 1728, 1728, 1088]
    - [0, 18.915]
  - - [1856, 1088, 1, 256, 1856, 1856, 1856, 1088]
    - [0, 19.721]
  - - [1984, 1088, 1, 256, 1984, 1984, 1984, 1088]
    - [0, 19.83]
  - - [2112, 1088, 1, 256, 2112, 2112, 2112, 1088]
    - [0, 20.049]
  - - [2240, 1088, 1, 256, 2240, 2240, 2240, 1088]
    - [0, 20.127]
  - - [2368, 1088, 1, 256, 2368, 2368, 2368, 1088]
    - [0, 20.185]
  - - [2496, 1088, 1, 256, 2496, 2496, 2496, 1088]
    - [0, 20.297]
  - - [2624, 1088, 1, 256, 2624, 2624, 2624, 1088]
    - [0, 20.407]
  - - [2752, 1088, 1, 256, 2752, 2752, 2752, 1088]
    - [0, 20.513]
  - - [2880, 1088, 1, 256, 2880, 2880, 2880, 1088]
    - [0, 20.519]
  - - [3008, 1088, 1, 256, 3008, 3008, 3008, 1088]
    - [0, 20.541]
  - - [3136, 1088, 1, 256, 3136, 3136, 3136, 1088]
    - [0, 20.646]
  - - [3264, 1088, 1, 256, 3264, 3264, 3264, 1088]
    - [0, 20.815]
  - - [3392, 1088, 1, 256, 3392, 3392, 3392, 1088]
    - [0, 20.713]
  - - [3520, 1088, 1, 256, 3520, 3520, 3520, 1088]
    - [0, 20.897]
  - - [3648, 1088, 1, 256, 3648, 3648, 3648, 1088]
    - [0, 20.852]
  - - [3776, 1088, 1, 256, 3776, 3776, 3776, 1088]
    - [0, 20.968]
  - - [3904, 1088, 1, 256, 3904, 3904, 3904, 1088]
    - [0, 20.981]
  - - [4032, 1088, 1, 256, 4032, 4032, 4032, 1088]
    - [0, 20.994]
  - - [64, 1216, 1, 256, 64, 64, 64, 1216]
    - [0, 7.156]
  - - [192, 1216, 1, 256, 192, 192, 192, 1216]
    - [0, 13.127]
  - - [320, 1216, 1, 256, 320, 320, 320, 1216]
    - [0, 15.611]
  - - [448, 1216, 1, 256, 448, 448, 448, 1216]
    - [0, 17.051]
  - - [576, 1216, 1, 256, 576, 576, 576, 1216]
    - [0, 18.065]
  - - [704, 1216, 1, 256, 704, 704, 704, 1216]
    - [0, 18.702]
  - - [832, 1216, 1, 256, 832, 832, 832, 1216]
    - [0, 19.202]
  - - [960, 1216, 1, 256, 960, 960, 960, 1216]
    - [0, 19.526]
  - - [1088, 1216, 1, 256, 1088, 1088, 1088, 1216]
    - [0, 19.822]
  - - [1216, 1216, 1, 256, 1216, 1216, 1216, 1216]
    - [0, 20.039]
  - - [1344, 1216, 1, 256, 1344, 1344, 1344, 1216]
    - [0, 20.326]
  - - [1472, 1216, 1, 256, 1472, 1472, 1472, 1216]
    - [0, 20.353]
  - - [1600, 1216, 1, 256, 1600, 1600, 1600, 1216]
    - [0, 19.546]
  - - [1728, 1216, 1, 256, 1728, 1728, 1728, 1216]
    - [0, 19.69]
  - - [1856, 1216, 1, 256, 1856, 1856, 1856, 1216]
    - [0, 19.919]
  - - [1984, 1216, 1, 256, 1984, 1984, 1984, 1216]
    - [0, 20.076]
  - - [2112, 1216, 1, 256, 2112, 2112, 2112, 1216]
    - [0, 20.154]
  - - [2240, 1216, 1, 256, 2240, 2240, 2240, 1216]
    - [0, 20.267]
  - - [2368, 1216, 1, 256, 2368, 2368, 2368, 1216]
    - [0, 20.478]
  - - [2496, 1216, 1, 256, 2496, 2496, 2496, 1216]
    - [0, 20.48]
  - - [2624, 1216, 1, 256, 2624, 2624, 2624, 1216]
    - [0, 20.542]
  - - [2752, 1216, 1, 256, 2752, 2752, 2752, 1216]
    - [0, 20.636]
  - - [2880, 1216, 1, 256, 2880, 2880, 2880, 1216]
    - [0, 20.767]
  - - [3008, 1216, 1, 256, 3008, 3008, 3008, 1216]
    - [0, 20.78]
  - - [3136, 1216, 1, 256, 3136, 3136, 3136, 1216]
    - [0, 20.81]
  - - [3264, 1216, 1, 256, 3264, 3264, 3264, 1216]
    - [0, 20.898]
  - - [3392, 1216, 1, 256, 3392, 3392, 3392, 1216]
    - [0, 21.004]
  - - [3520, 1216, 1, 256, 3520, 3520, 3520, 1216]
    - [0, 21.026]
  - - [3648, 1216, 1, 256, 3648, 3648, 3648, 1216]
    - [0, 21.103]
  - - [3776, 1216, 1, 256, 3776, 3776, 3776, 1216]
    - [0, 21.15]
  - - [3904, 1216, 1, 256, 3904, 3904, 3904, 1216]
    - [0, 21.147]
  - - [4032, 1216, 1, 256, 4032, 4032, 4032, 1216]
    - [0, 21.21]
  - - [64, 1344, 1, 256, 64, 64, 64, 1344]
    - [3, 6.302]
  - - [192, 1344, 1, 256, 192, 192, 192, 1344]
    - [0, 13.45]
  - - [320, 1344, 1, 256, 320, 320, 320, 1344]
    - [0, 16.248]
  - - [448, 1344, 1, 256, 448, 448, 448, 1344]
    - [0, 17.495]
  - - [576, 1344, 1, 256, 576, 576, 576, 1344]
    - [0, 18.344]
  - - [704, 1344, 1, 256, 704, 704, 704, 1344]
    - [0, 18.993]
  - - [832, 1344, 1, 256, 832, 832, 832, 1344]
    - [0, 19.462]
  - - [960, 1344, 1, 256, 960, 960, 960, 1344]
    - [0, 19.871]
  - - [1088, 1344, 1, 256, 1088, 1088, 1088, 1344]
    - [0, 20.041]
  - - [1216, 1344, 1, 256, 1216, 1216, 1216, 1344]
    - [0, 20.283]
  - - [1344, 1344, 1, 256, 1344, 1344, 1344, 1344]
    - [0, 20.566]
  - - [1472, 1344, 1, 256, 1472, 1472, 1472, 1344]
    - [0, 19.686]
  - - [1600, 1344, 1, 256, 1600, 1600, 1600, 1344]
    - [0, 19.759]
  - - [1728, 1344, 1, 256, 1728, 1728, 1728, 1344]
    - [0, 19.969]
  - - [1856, 1344, 1, 256, 1856, 1856, 1856, 1344]
    - [0, 20.066]
  - - [1984, 1344, 1, 256, 1984, 1984, 1984, 1344]
    - [0, 20.18]
  - - [2112, 1344, 1, 256, 2112, 2112, 2112, 1344]
    - [0, 20.41]
  - - [2240, 1344, 1, 256, 2240, 2240, 2240, 1344]
    - [0, 20.581]
  - - [2368, 1344, 1, 256, 2368, 2368, 2368, 1344]
    - [0, 20.686]
  - - [2496, 1344, 1, 256, 2496, 2496, 2496, 1344]
    - [0, 20.636]
  - - [2624, 1344, 1, 256, 2624, 2624, 2624, 1344]
    - [0, 20.706]
  - - [2752, 1344, 1, 256, 2752, 2752, 2752, 1344]
    - [0, 20.832]
  - - [2880, 1344, 1, 256, 2880, 2880, 2880, 1344]
    - [0, 20.991]
  - - [3008, 1344, 1, 256, 3008, 3008, 3008, 1344]
    - [0, 20.96]
  - - [3136, 1344, 1, 256, 3136, 3136, 3136, 1344]
    - [0, 20.948]
  - - [3264, 1344, 1, 256, 3264, 3264, 3264, 1344]
    - [0, 21.017]
  - - [3392, 1344, 1, 256, 3392, 3392, 3392, 1344]
    - [0, 21.045]
  - - [3520, 1344, 1, 256, 3520, 3520, 3520, 1344]
    - [0, 21.115]
  - - [3648, 1344, 1, 256, 3648, 3648, 3648, 1344]
    - [0, 21.137]
  - - [3776, 1344, 1, 256, 3776, 3776, 3776, 1344]
    - [0, 21.198]
  - - [3904, 1344, 1, 256, 3904, 3904, 3904, 1344]
    - [0, 21.26]
  - - [4032, 1344, 1, 256, 4032, 4032, 4032, 1344]
    - [0, 21.273]
  - - [64, 1472, 1, 256, 64, 64, 64, 1472]
    - [0, 7.787]
  - - [192, 1472, 1, 256, 192, 192, 192, 1472]
    - [0, 13.803]
  - - [320, 1472, 1, 256, 320, 320, 320, 1472]
    - [0, 16.425]
  - - [448, 1472, 1, 256, 448, 448, 448, 1472]
    - [0, 17.763]
  - - [576, 1472, 1, 256, 576, 576, 576, 1472]
    - [0, 18.677]
  - - [704, 1472, 1, 256, 704, 704, 704, 1472]
    - [0, 19.426]
  - - [832, 1472, 1, 256, 832, 832, 832, 1472]
    - [0, 19.665]
  - - [960, 1472, 1, 256, 960, 960, 960, 1472]
    - [0, 19.999]
  - - [1088, 1472, 1, 256, 1088, 1088, 1088, 1472]
    - [0, 20.189]
  - - [1216, 1472, 1, 256, 1216, 1216, 1216, 1472]
    - [0, 20.439]
  - - [1344, 1472, 1, 256, 1344, 1344, 1344, 1472]
    - [0, 19.598]
  - - [1472, 1472, 1, 256, 1472, 1472, 1472, 1472]
    - [0, 19.809]
  - - [1600, 1472, 1, 256, 1600, 1600, 1600, 1472]
    - [0, 19.99]
  - - [1728, 1472, 1, 256, 1728, 1728, 1728, 1472]
    - [0, 20.162]
  - - [1856, 1472, 1, 256, 1856, 1856, 1856, 1472]
    - [0, 20.376]
  - - [1984, 1472, 1, 256, 1984, 1984, 1984, 1472]
    - [0, 20.459]
  - - [2112, 1472, 1, 256, 2112, 2112, 2112, 1472]
    - [0, 20.541]
  - - [2240, 1472, 1, 256, 2240, 2240, 2240, 1472]
    - [0, 20.669]
  - - [2368, 1472, 1, 256, 2368, 2368, 2368, 1472]
    - [0, 20.753]
  - - [2496, 1472, 1, 256, 2496, 2496, 2496, 1472]
    - [0, 20.828]
  - - [2624, 1472, 1, 256, 2624, 2624, 2624, 1472]
    - [0, 20.859]
  - - [2752, 1472, 1, 256, 2752, 2752, 2752, 1472]
    - [0, 20.97]
  - - [2880, 1472, 1, 256, 2880, 2880, 2880, 1472]
    - [0, 20.989]
  - - [3008, 1472, 1, 256, 3008, 3008, 3008, 1472]
    - [0, 21.061]
  - - [3136, 1472, 1, 256, 3136, 3136, 3136, 1472]
    - [0, 21.102]
  - - [3264, 1472, 1, 256, 3264, 3264, 3264, 1472]
    - [0, 21.12]
  - - [3392, 1472, 1, 256, 3392, 3392, 3392, 1472]
    - [0, 21.145]
  - - [3520, 1472, 1, 256, 3520, 3520, 3520, 1472]
    - [0, 21.283]
  - - [3648, 1472, 1, 256, 3648, 3648, 3648, 1472]
    - [0, 21.286]
  - - [3776, 1472, 1, 256, 3776, 3776, 3776, 1472]
    - [0, 21.372]
  - - [3904, 1472, 1, 256, 3904, 3904, 3904, 1472]
    - [0, 21.39]
  - - [4032, 1472, 1, 256, 4032, 4032, 4032, 1472]
    - [0, 21.406]
  - - [64, 1600, 1, 256, 64, 64, 64, 1600]
    - [0, 8.413]
  - - [192, 1600, 1, 256, 192, 192, 192, 1600]
    - [0, 14.661]
  - - [320, 1600, 1, 256, 320, 320, 320, 1600]
    - [0, 16.826]
  - - [448, 1600, 1, 256, 448, 448, 448, 1600]
    - [0, 18.17]
  - - [576, 1600, 1, 256, 576, 576, 576, 1600]
    - [0, 19.03]
  - - [704, 1600, 1, 256, 704, 704, 704, 1600]
    - [0, 19.455]
  - - [832, 1600, 1, 256, 832, 832, 832, 1600]
    - [0, 19.873]
  - - [960, 1600, 1, 256, 960, 960, 960, 1600]
    - [0, 20.202]
  - - [1088, 1600, 1, 256, 1088, 1088, 1088, 1600]
    - [0, 20.465]
  - - [1216, 1600, 1, 256, 1216, 1216, 1216, 1600]
    - [0, 19.55]
  - - [1344, 1600, 1, 256, 1344, 1344, 1344, 1600]
    - [0, 19.786]
  - - [1472, 1600, 1, 256, 1472, 1472, 1472, 1600]
    - [0, 20.001]
  - - [1600, 1600, 1, 256, 1600, 1600, 1600, 1600]
    - [0, 20.105]
  - - [1728, 1600, 1, 256, 1728, 1728, 1728, 1600]
    - [0, 20.291]
  - - [1856, 1600, 1, 256, 1856, 1856, 1856, 1600]
    - [0, 20.488]
  - - [1984, 1600, 1, 256, 1984, 1984, 1984, 1600]
    - [0, 20.549]
  - - [2112, 1600, 1, 256, 2112, 2112, 2112, 1600]
    - [0, 20.649]
  - - [2240, 1600, 1, 256, 2240, 2240, 2240, 1600]
    - [0, 20.776]
  - - [2368, 1600, 1, 256, 2368, 2368, 2368, 1600]
    - [0, 20.884]
  - - [2496, 1600, 1, 256, 2496, 2496, 2496, 1600]
    - [0, 20.917]
  - - [2624, 1600, 1, 256, 2624, 2624, 2624, 1600]
    - [0, 21.055]
  - - [2752, 1600, 1, 256, 2752, 2752, 2752, 1600]
    - [0, 21.113]
  - - [2880, 1600, 1, 256, 2880, 2880, 2880, 1600]
    - [0, 21.09]
  - - [3008, 1600, 1, 256, 3008, 3008, 3008, 1600]
    - [0, 21.133]
  - - [3136, 1600, 1, 256, 3136, 3136, 3136, 1600]
    - [0, 21.179]
  - - [3264, 1600, 1, 256, 3264, 3264, 3264, 1600]
    - [0, 21.231]
  - - [3392, 1600, 1, 256, 3392, 3392, 3392, 1600]
    - [0, 21.281]
  - - [3520, 1600, 1, 256, 3520, 3520, 3520, 1600]
    - [0, 21.329]
  - - [3648, 1600, 1, 256, 3648, 3648, 3648, 1600]
    - [0, 21.42]
  - - [3776, 1600, 1, 256, 3776, 3776, 3776, 1600]
    - [0, 21.374]
  - - [3904, 1600, 1, 256, 3904, 3904, 3904, 1600]
    - [0, 21.396]
  - - [4032, 1600, 1, 256, 4032, 4032, 4032, 1600]
    - [0, 21.383]
  - - [64, 1728, 1, 256, 64, 64, 64, 1728]
    - [0, 9.019]
  - - [192, 1728, 1, 256, 192, 192, 192, 1728]
    - [0, 14.971]
  - - [320, 1728, 1, 256, 320, 320, 320, 1728]
    - [0, 17.259]
  - - [448, 1728, 1, 256, 448, 448, 448, 1728]
    - [0, 18.371]
  - - [576, 1728, 1, 256, 576, 576, 576, 1728]
    - [0, 19.116]
  - - [704, 1728, 1, 256, 704, 704, 704, 1728]
    - [0, 19.589]
  - - [832, 1728, 1, 256, 832, 832, 832, 1728]
    - [0, 20.065]
  - - [960, 1728, 1, 256, 960, 960, 960, 1728]
    - [0, 20.408]
  - - [1088, 1728, 1, 256, 1088, 1088, 1088, 1728]
    - [0, 18.903]
  - - [1216, 1728, 1, 256, 1216, 1216, 1216, 1728]
    - [0, 19.733]
  - - [1344, 1728, 1, 256, 1344, 1344, 1344, 1728]
    - [0, 19.964]
  - - [1472, 1728, 1, 256, 1472, 1472, 1472, 1728]
    - [0, 20.199]
  - - [1600, 1728, 1, 256, 1600, 1600, 1600, 1728]
    - [0, 20.348]
  - - [1728, 1728, 1, 256, 1728, 1728, 1728, 1728]
    - [0, 20.463]
  - - [1856, 1728, 1, 256, 1856, 1856, 1856, 1728]
    - [0, 20.599]
  - - [1984, 1728, 1, 256, 1984, 1984, 1984, 1728]
    - [0, 20.787]
  - - [2112, 1728, 1, 256, 2112, 2112, 2112, 1728]
    - [0, 20.894]
  - - [2240, 1728, 1, 256, 2240, 2240, 2240, 1728]
    - [0, 20.869]
  - - [2368, 1728, 1, 256, 2368, 2368, 2368, 1728]
    - [0, 21.009]
  - - [2496, 1728, 1, 256, 2496, 2496, 2496, 1728]
    - [0, 21.081]
  - - [2624, 1728, 1, 256, 2624, 2624, 2624, 1728]
    - [0, 21.176]
  - - [2752, 1728, 1, 256, 2752, 2752, 2752, 1728]
    - [0, 21.169]
  - - [2880, 1728, 1, 256, 2880, 2880, 2880, 1728]
    - [0, 21.209]
  - - [3008, 1728, 1, 256, 3008, 3008, 3008, 1728]
    - [0, 21.284]
  - - [3136, 1728, 1, 256, 3136, 3136, 3136, 1728]
    - [0, 21.336]
  - - [3264, 1728, 1, 256, 3264, 3264, 3264, 1728]
    - [0, 21.342]
  - - [3392, 1728, 1, 256, 3392, 3392, 3392, 1728]
    - [0, 21.439]
  - - [3520, 1728, 1, 256, 3520, 3520, 3520, 1728]
    - [0, 21.463]
  - - [3648, 1728, 1, 256, 3648, 3648, 3648, 1728]
    - [0, 21.515]
  - - [3776, 1728, 1, 256, 3776, 3776, 3776, 1728]
    - [0, 21.57]
  - - [3904, 1728, 1, 256, 3904, 3904, 3904, 1728]
    - [0, 21.53]
  - - [4032, 1728, 1, 256, 4032, 4032, 4032, 1728]
    - [0, 21.592]
  - - [64, 1856, 1, 256, 64, 64, 64, 1856]
    - [0, 9.685]
  - - [192, 1856, 1, 256, 192, 192, 192, 1856]
    - [0, 15.206]
  - - [320, 1856, 1, 256, 320, 320, 320, 1856]
    - [0, 17.374]
  - - [448, 1856, 1, 256, 448, 448, 448, 1856]
    - [0, 18.583]
  - - [576, 1856, 1, 256, 576, 576, 576, 1856]
    - [0, 19.373]
  - - [704, 1856, 1, 256, 704, 704, 704, 1856]
    - [0, 19.942]
  - - [832, 1856, 1, 256, 832, 832, 832, 1856]
    - [0, 20.326]
  - - [960, 1856, 1, 256, 960, 960, 960, 1856]
    - [0, 20.501]
  - - [1088, 1856, 1, 256, 1088, 1088, 1088, 1856]
    - [0, 19.657]
  - - [1216, 1856, 1, 256, 1216, 1216, 1216, 1856]
    - [0, 19.918]
  - - [1344, 1856, 1, 256, 1344, 1344, 1344, 1856]
    - [0, 20.152]
  - - [1472, 1856, 1, 256, 1472, 1472, 1472, 1856]
    - [0, 20.284]
  - - [1600, 1856, 1, 256, 1600, 1600, 1600, 1856]
    - [0, 20.524]
  - - [1728, 1856, 1, 256, 1728, 1728, 1728, 1856]
    - [0, 20.534]
  - - [1856, 1856, 1, 256, 1856, 1856, 1856, 1856]
    - [0, 20.758]
  - - [1984, 1856, 1, 256, 1984, 1984, 1984, 1856]
    - [0, 20.877]
  - - [2112, 1856, 1, 256, 2112, 2112, 2112, 1856]
    - [0, 20.937]
  - - [2240, 1856, 1, 256, 2240, 2240, 2240, 1856]
    - [0, 21.043]
  - - [2368, 1856, 1, 256, 2368, 2368, 2368, 1856]
    - [0, 21.154]
  - - [2496, 1856, 1, 256, 2496, 2496, 2496, 1856]
    - [0, 21.231]
  - - [2624, 1856, 1, 256, 2624, 2624, 2624, 1856]
    - [0, 21.192]
  - - [2752, 1856, 1, 256, 2752, 2752, 2752, 1856]
    - [0, 21.246]
  - - [2880, 1856, 1, 256, 2880, 2880, 2880, 1856]
    - [0, 21.39]
  - - [3008, 1856, 1, 256, 3008, 3008, 3008, 1856]
    - [0, 21.328]
  - - [3136, 1856, 1, 256, 3136, 3136, 3136, 1856]
    - [0, 21.425]
  - - [3264, 1856, 1, 256, 3264, 3264, 3264, 1856]
    - [0, 21.436]
  - - [3392, 1856, 1, 256, 3392, 3392, 3392, 1856]
    - [0, 21.436]
  - - [3520, 1856, 1, 256, 3520, 3520, 3520, 1856]
    - [0, 21.544]
  - - [3648, 1856, 1, 256, 3648, 3648, 3648, 1856]
    - [0, 21.57]
  - - [3776, 1856, 1, 256, 3776, 3776, 3776, 1856]
    - [0, 21.553]
  - - [3904, 1856, 1, 256, 3904, 3904, 3904, 1856]
    - [0, 21.543]
  - - [4032, 1856, 1, 256, 4032, 4032, 4032, 1856]
    - [0, 21.611]
  - - [64, 1984, 1, 256, 64, 64, 64, 1984]
    - [0, 9.417]
  - - [192, 1984, 1, 256, 192, 192, 192, 1984]
    - [0, 15.531]
  - - [320, 1984, 1, 256, 320, 320, 320, 1984]
    - [0, 17.651]
  - - [448, 1984, 1, 256, 448, 448, 448, 1984]
    - [0, 18.832]
  - - [576, 1984, 1, 256, 576, 576, 576, 1984]
    - [0, 19.584]
  - - [704, 1984, 1, 256, 704, 704, 704, 1984]
    - [0, 19.842]
  - - [832, 1984, 1, 256, 832, 832, 832, 1984]
    - [0, 20.239]
  - - [960, 1984, 1, 256, 960, 960, 960, 1984]
    - [0, 19.154]
  - - [1088, 1984, 1, 256, 1088, 1088, 1088, 1984]
    - [0, 19.853]
  - - [1216, 1984, 1, 256, 1216, 1216, 1216, 1984]
    - [0, 20.046]
  - - [1344, 1984, 1, 256, 1344, 1344, 1344, 1984]
    - [0, 20.204]
  - - [1472, 1984, 1, 256, 1472, 1472, 1472, 1984]
    - [0, 20.461]
  - - [1600, 1984, 1, 256, 1600, 1600, 1600, 1984]
    - [0, 20.574]
  - - [1728, 1984, 1, 256, 1728, 1728, 1728, 1984]
    - [0, 20.652]
  - - [1856, 1984, 1, 256, 1856, 1856, 1856, 1984]
    - [0, 20.831]
  - - [1984, 1984, 1, 256, 1984, 1984, 1984, 1984]
    - [0, 20.85]
  - - [2112, 1984, 1, 256, 2112, 2112, 2112, 1984]
    - [0, 20.974]
  - - [2240, 1984, 1, 256, 2240, 2240, 2240, 1984]
    - [0, 21.005]
  - - [2368, 1984, 1, 256, 2368, 2368, 2368, 1984]
    - [0, 21.2]
  - - [2496, 1984, 1, 256, 2496, 2496, 2496, 1984]
    - [0, 21.27]
  - - [2624, 1984, 1, 256, 2624, 2624, 2624, 1984]
    - [0, 21.271]
  - - [2752, 1984, 1, 256, 2752, 2752, 2752, 1984]
    - [0, 21.325]
  - - [2880, 1984, 1, 256, 2880, 2880, 2880, 1984]
    - [0, 21.416]
  - - [3008, 1984, 1, 256, 3008, 3008, 3008, 1984]
    - [0, 21.356]
  - - [3136, 1984, 1, 256, 3136, 3136, 3136, 1984]
    - [0, 21.441]
  - - [3264, 1984, 1, 256, 3264, 3264, 3264, 1984]
    - [0, 21.488]
  - - [3392, 1984, 1, 256, 3392, 3392, 3392, 1984]
    - [0, 21.535]
  - - [3520, 1984, 1, 256, 3520, 3520, 3520, 1984]
    - [0, 21.491]
  - - [3648, 1984, 1, 256, 3648, 3648, 3648, 1984]
    - [0, 21.629]
  - - [3776, 1984, 1, 256, 3776, 3776, 3776, 1984]
    - [0, 21.559]
  - - [3904, 1984, 1, 256, 3904, 3904, 3904, 1984]
    - [0, 21.648]
  - - [4032, 1984, 1, 256, 4032, 4032, 4032, 1984]
    - [0, 21.595]
  - - [64, 2112, 1, 256, 64, 64, 64, 2112]
    - [0, 9.933]
  - - [192, 2112, 1, 256, 192, 192, 192, 2112]
    - [0, 15.737]
  - - [320, 2112, 1, 256, 320, 320, 320, 2112]
    - [0, 17.968]
  - - [448, 2112, 1, 256, 448, 448, 448, 2112]
    - [0, 18.906]
  - - [576, 2112, 1, 256, 576, 576, 576, 2112]
    - [0, 19.618]
  - - [704, 2112, 1, 256, 704, 704, 704, 2112]
    - [0, 20.138]
  - - [832, 2112, 1, 256, 832, 832, 832, 2112]
    - [0, 20.466]
  - - [960, 2112, 1, 256, 960, 960, 960, 2112]
    - [0, 19.677]
  - - [1088, 2112, 1, 256, 1088, 1088, 1088, 2112]
    - [0, 19.891]
  - - [1216, 2112, 1, 256, 1216, 1216, 1216, 2112]
    - [0, 20.12]
  - - [1344, 2112, 1, 256, 1344, 1344, 1344, 2112]
    - [0, 20.311]
  - - [1472, 2112, 1, 256, 1472, 1472, 1472, 2112]
    - [0, 20.498]
  - - [1600, 2112, 1, 256, 1600, 1600, 1600, 2112]
    - [0, 20.67]
  - - [1728, 2112, 1, 256, 1728, 1728, 1728, 2112]
    - [0, 20.776]
  - - [1856, 2112, 1, 256, 1856, 1856, 1856, 2112]
    - [0, 20.903]
  - - [1984, 2112, 1, 256, 1984, 1984, 1984, 2112]
    - [0, 20.924]
  - - [2112, 2112, 1, 256, 2112, 2112, 2112, 2112]
    - [0, 21.129]
  - - [2240, 2112, 1, 256, 2240, 2240, 2240, 2112]
    - [0, 21.225]
  - - [2368, 2112, 1, 256, 2368, 2368, 2368, 2112]
    - [0, 21.219]
  - - [2496, 2112, 1, 256, 2496, 2496, 2496, 2112]
    - [0, 21.371]
  - - [2624, 2112, 1, 256, 2624, 2624, 2624, 2112]
    - [0, 21.322]
  - - [2752, 2112, 1, 256, 2752, 2752, 2752, 2112]
    - [0, 21.362]
  - - [2880, 2112, 1, 256, 2880, 2880, 2880, 2112]
    - [0, 21.467]
  - - [3008, 2112, 1, 256, 3008, 3008, 3008, 2112]
    - [0, 21.481]
  - - [3136, 2112, 1, 256, 3136, 3136, 3136, 2112]
    - [0, 21.548]
  - - [3264, 2112, 1, 256, 3264, 3264, 3264, 2112]
    - [0, 21.522]
  - - [3392, 2112, 1, 256, 3392, 3392, 3392, 2112]
    - [0, 21.547]
  - - [3520, 2112, 1, 256, 3520, 3520, 3520, 2112]
    - [0, 21.576]
  - - [3648, 2112, 1, 256, 3648, 3648, 3648, 2112]
    - [0, 21.636]
  - - [3776, 2112, 1, 256, 3776, 3776, 3776, 2112]
    - [0, 21.679]
  - - [3904, 2112, 1, 256, 3904, 3904, 3904, 2112]
    - [0, 21.497]
  - - [4032, 2112, 1, 256, 4032, 4032, 4032, 2112]
    - [0, 21.663]
  - - [64, 2240, 1, 256, 64, 64, 64, 2240]
    - [0, 10.464]
  - - [192, 2240, 1, 256, 192, 192, 192, 2240]
    - [0, 16.148]
  - - [320, 2240, 1, 256, 320, 320, 320, 2240]
    - [0, 18.103]
  - - [448, 2240, 1, 256, 448, 448, 448, 2240]
    - [0, 19.169]
  - - [576, 2240, 1, 256, 576, 576, 576, 2240]
    - [0, 19.861]
  - - [704, 2240, 1, 256, 704, 704, 704, 2240]
    - [0, 20.292]
  - - [832, 2240, 1, 256, 832, 832, 832, 2240]
    - [0, 18.757]
  - - [960, 2240, 1, 256, 960, 960, 960, 2240]
    - [0, 19.781]
  - - [1088, 2240, 1, 256, 1088, 1088, 1088, 2240]
    - [0, 20.075]
  - - [1216, 2240, 1, 256, 1216, 1216, 1216, 2240]
    - [0, 20.385]
  - - [1344, 2240, 1, 256, 1344, 1344, 1344, 2240]
    - [0, 20.471]
  - - [1472, 2240, 1, 256, 1472, 1472, 1472, 2240]
    - [0, 20.587]
  - - [1600, 2240, 1, 256, 1600, 1600, 1600, 2240]
    - [0, 20.703]
  - - [1728, 2240, 1, 256, 1728, 1728, 1728, 2240]
    - [0, 20.938]
  - - [1856, 2240, 1, 256, 1856, 1856, 1856, 2240]
    - [0, 21.11]
  - - [1984, 2240, 1, 256, 1984, 1984, 1984, 2240]
    - [0, 21.066]
  - - [2112, 2240, 1, 256, 2112, 2112, 2112, 2240]
    - [0, 21.209]
  - - [2240, 2240, 1, 256, 2240, 2240, 2240, 2240]
    - [0, 21.398]
  - - [2368, 2240, 1, 256, 2368, 2368, 2368, 2240]
    - [0, 21.262]
  - - [2496, 2240, 1, 256, 2496, 2496, 2496, 2240]
    - [0, 21.412]
  - - [2624, 2240, 1, 256, 2624, 2624, 2624, 2240]
    - [0, 21.492]
  - - [2752, 2240, 1, 256, 2752, 2752, 2752, 2240]
    - [0, 21.44]
  - - [2880, 2240, 1, 256, 2880, 2880, 2880, 2240]
    - [0, 21.499]
  - - [3008, 2240, 1, 256, 3008, 3008, 3008, 2240]
    - [0, 21.547]
  - - [3136, 2240, 1, 256, 3136, 3136, 3136, 2240]
    - [0, 21.528]
  - - [3264, 2240, 1, 256, 3264, 3264, 3264, 2240]
    - [0, 21.62]
  - - [3392, 2240, 1, 256, 3392, 3392, 3392, 2240]
    - [0, 21.618]
  - - [3520, 2240, 1, 256, 3520, 3520, 3520, 2240]
    - [0, 21.679]
  - - [3648, 2240, 1, 256, 3648, 3648, 3648, 2240]
    - [0, 21.616]
  - - [3776, 2240, 1, 256, 3776, 3776, 3776, 2240]
    - [0, 21.624]
  - - [3904, 2240, 1, 256, 3904, 3904, 3904, 2240]
    - [0, 21.699]
  - - [4032, 2240, 1, 256, 4032, 4032, 4032, 2240]
    - [0, 21.771]
  - - [64, 2368, 1, 256, 64, 64, 64, 2368]
    - [0, 11.085]
  - - [192, 2368, 1, 256, 192, 192, 192, 2368]
    - [0, 16.358]
  - - [320, 2368, 1, 256, 320, 320, 320, 2368]
    - [0, 18.355]
  - - [448, 2368, 1, 256, 448, 448, 448, 2368]
    - [0, 19.241]
  - - [576, 2368, 1, 256, 576, 576, 576, 2368]
    - [0, 19.969]
  - - [704, 2368, 1, 256, 704, 704, 704, 2368]
    - [0, 20.371]
  - - [832, 2368, 1, 256, 832, 832, 832, 2368]
    - [0, 19.726]
  - - [960, 2368, 1, 256, 960, 960, 960, 2368]
    - [0, 19.943]
  - - [1088, 2368, 1, 256, 1088, 1088, 1088, 2368]
    - [0, 20.156]
  - - [1216, 2368, 1, 256, 1216, 1216, 1216, 2368]
    - [0, 20.403]
  - - [1344, 2368, 1, 256, 1344, 1344, 1344, 2368]
    - [0, 20.558]
  - - [1472, 2368, 1, 256, 1472, 1472, 1472, 2368]
    - [0, 20.659]
  - - [1600, 2368, 1, 256, 1600, 1600, 1600, 2368]
    - [0, 20.862]
  - - [1728, 2368, 1, 256, 1728, 1728, 1728, 2368]
    - [0, 21.018]
  - - [1856, 2368, 1, 256, 1856, 1856, 1856, 2368]
    - [0, 21.02]
  - - [1984, 2368, 1, 256, 1984, 1984, 1984, 2368]
    - [0, 21.172]
  - - [2112, 2368, 1, 256, 2112, 2112, 2112, 2368]
    - [0, 21.185]
  - - [2240, 2368, 1, 256, 2240, 2240, 2240, 2368]
    - [0, 21.245]
  - - [2368, 2368, 1, 256, 2368, 2368, 2368, 2368]
    - [0, 21.344]
  - - [2496, 2368, 1, 256, 2496, 2496, 2496, 2368]
    - [0, 21.364]
  - - [2624, 2368, 1, 256, 2624, 2624, 2624, 2368]
    - [0, 21.477]
  - - [2752, 2368, 1, 256, 2752, 2752, 2752, 2368]
    - [0, 21.426]
  - - [2880, 2368, 1, 256, 2880, 2880, 2880, 2368]
    - [0, 21.507]
  - - [3008, 2368, 1, 256, 3008, 3008, 3008, 2368]
    - [0, 21.637]
  - - [3136, 2368, 1, 256, 3136, 3136, 3136, 2368]
    - [0, 21.705]
  - - [3264, 2368, 1, 256, 3264, 3264, 3264, 2368]
    - [0, 21.715]
  - - [3392, 2368, 1, 256, 3392, 3392, 3392, 2368]
    - [0, 21.634]
  - - [3520, 2368, 1, 256, 3520, 3520, 3520, 2368]
    - [0, 21.585]
  - - [3648, 2368, 1, 256, 3648, 3648, 3648, 2368]
    - [0, 21.698]
  - - [3776, 2368, 1, 256, 3776, 3776, 3776, 2368]
    - [0, 21.673]
  - - [3904, 2368, 1, 256, 3904, 3904, 3904, 2368]
    - [0, 21.593]
  - - [4032, 2368, 1, 256, 4032, 4032, 4032, 2368]
    - [0, 21.651]
  - - [64, 2496, 1, 256, 64, 64, 64, 2496]
    - [0, 10.679]
  - - [192, 2496, 1, 256, 192, 192, 192, 2496]
    - [0, 16.564]
  - - [320, 2496, 1, 256, 320, 320, 320, 2496]
    - [0, 18.472]
  - - [448, 2496, 1, 256, 448, 448, 448, 2496]
    - [0, 19.452]
  - - [576, 2496, 1, 256, 576, 576, 576, 2496]
    - [0, 20.121]
  - - [704, 2496, 1, 256, 704, 704, 704, 2496]
    - [0, 20.444]
  - - [832, 2496, 1, 256, 832, 832, 832, 2496]
    - [0, 19.649]
  - - [960, 2496, 1, 256, 960, 960, 960, 2496]
    - [0, 20.017]
  - - [1088, 2496, 1, 256, 1088, 1088, 1088, 2496]
    - [0, 20.259]
  - - [1216, 2496, 1, 256, 1216, 1216, 1216, 2496]
    - [0, 20.434]
  - - [1344, 2496, 1, 256, 1344, 1344, 1344, 2496]
    - [0, 20.754]
  - - [1472, 2496, 1, 256, 1472, 1472, 1472, 2496]
    - [0, 20.807]
  - - [1600, 2496, 1, 256, 1600, 1600, 1600, 2496]
    - [0, 20.928]
  - - [1728, 2496, 1, 256, 1728, 1728, 1728, 2496]
    - [0, 21.034]
  - - [1856, 2496, 1, 256, 1856, 1856, 1856, 2496]
    - [0, 21.181]
  - - [1984, 2496, 1, 256, 1984, 1984, 1984, 2496]
    - [0, 21.239]
  - - [2112, 2496, 1, 256, 2112, 2112, 2112, 2496]
    - [0, 21.314]
  - - [2240, 2496, 1, 256, 2240, 2240, 2240, 2496]
    - [0, 21.361]
  - - [2368, 2496, 1, 256, 2368, 2368, 2368, 2496]
    - [0, 21.494]
  - - [2496, 2496, 1, 256, 2496, 2496, 2496, 2496]
    - [0, 21.449]
  - - [2624, 2496, 1, 256, 2624, 2624, 2624, 2496]
    - [0, 21.391]
  - - [2752, 2496, 1, 256, 2752, 2752, 2752, 2496]
    - [0, 21.532]
  - - [2880, 2496, 1, 256, 2880, 2880, 2880, 2496]
    - [0, 21.596]
  - - [3008, 2496, 1, 256, 3008, 3008, 3008, 2496]
    - [0, 21.649]
  - - [3136, 2496, 1, 256, 3136, 3136, 3136, 2496]
    - [0, 21.673]
  - - [3264, 2496, 1, 256, 3264, 3264, 3264, 2496]
    - [0, 21.588]
  - - [3392, 2496, 1, 256, 3392, 3392, 3392, 2496]
    - [0, 21.67]
  - - [3520, 2496, 1, 256, 3520, 3520, 3520, 2496]
    - [0, 21.653]
  - - [3648, 2496, 1, 256, 3648, 3648, 3648, 2496]
    - [0, 21.619]
  - - [3776, 2496, 1, 256, 3776, 3776, 3776, 2496]
    - [0, 21.653]
  - - [3904, 2496, 1, 256, 3904, 3904, 3904, 2496]
    - [0, 21.688]
  - - [4032, 2496, 1, 256, 4032, 4032, 4032, 2496]
    - [0, 21.728]
  - - [64, 2624, 1, 256, 64, 64, 64, 2624]
    - [0, 11.158]
  - - [192, 2624, 1, 256, 192, 192, 192, 2624]
    - [0, 16.741]
  - - [320, 2624, 1, 256, 320, 320, 320, 2624]
    - [0, 18.765]
  - - [448, 2624, 1, 256, 448, 448, 448, 2624]
    - [0, 19.671]
  - - [576, 2624, 1, 256, 576, 576, 576, 2624]
    - [0, 20.186]
  - - [704, 2624, 1, 256, 704, 704, 704, 2624]
    - [0, 19.631]
  - - [832, 2624, 1, 256, 832, 832, 832, 2624]
    - [0, 19.861]
  - - [960, 2624, 1, 256, 960, 960, 960, 2624]
    - [0, 20.152]
  - - [1088, 2624, 1, 256, 1088, 1088, 1088, 2624]
    - [0, 20.345]
  - - [1216, 2624, 1, 256, 1216, 1216, 1216, 2624]
    - [0, 20.587]
  - - [1344, 2624, 1, 256, 1344, 1344, 1344, 2624]
    - [0, 20.777]
  - - [1472, 2624, 1, 256, 1472, 1472, 1472, 2624]
    - [0, 20.888]
  - - [1600, 2624, 1, 256, 1600, 1600, 1600, 2624]
    - [0, 21.005]
  - - [1728, 2624, 1, 256, 1728, 1728, 1728, 2624]
    - [0, 21.083]
  - - [1856, 2624, 1, 256, 1856, 1856, 1856, 2624]
    - [0, 21.217]
  - - [1984, 2624, 1, 256, 1984, 1984, 1984, 2624]
    - [0, 21.217]
  - - [2112, 2624, 1, 256, 2112, 2112, 2112, 2624]
    - [0, 21.355]
  - - [2240, 2624, 1, 256, 2240, 2240, 2240, 2624]
    - [0, 21.363]
  - - [2368, 2624, 1, 256, 2368, 2368, 2368, 2624]
    - [0, 21.437]
  - - [2496, 2624, 1, 256, 2496, 2496, 2496, 2624]
    - [0, 21.6]
  - - [2624, 2624, 1, 256, 2624, 2624, 2624, 2624]
    - [0, 21.502]
  - - [2752, 2624, 1, 256, 2752, 2752, 2752, 2624]
    - [0, 21.608]
  - - [2880, 2624, 1, 256, 2880, 2880, 2880, 2624]
    - [0, 21.673]
  - - [3008, 2624, 1, 256, 3008, 3008, 3008, 2624]
    - [0, 21.683]
  - - [3136, 2624, 1, 256, 3136, 3136, 3136, 2624]
    - [0, 21.588]
  - - [3264, 2624, 1, 256, 3264, 3264, 3264, 2624]
    - [0, 21.596]
  - - [3392, 2624, 1, 256, 3392, 3392, 3392, 2624]
    - [0, 21.76]
  - - [3520, 2624, 1, 256, 3520, 3520, 3520, 2624]
    - [0, 21.69]
  - - [3648, 2624, 1, 256, 3648, 3648, 3648, 2624]
    - [0, 21.603]
  - - [3776, 2624, 1, 256, 3776, 3776, 3776, 2624]
    - [0, 21.647]
  - - [3904, 2624, 1, 256, 3904, 3904, 3904, 2624]
    - [0, 21.709]
  - - [4032, 2624, 1, 256, 4032, 4032, 4032, 2624]
    - [0, 21.812]
  - - [64, 2752, 1, 256, 64, 64, 64, 2752]
    - [0, 11.667]
  - - [192, 2752, 1, 256, 192, 192, 192, 2752]
    - [0, 16.882]
  - - [320, 2752, 1, 256, 320, 320, 320, 2752]
    - [0, 18.743]
  - - [448, 2752, 1, 256, 448, 448, 448, 2752]
    - [0, 19.736]
  - - [576, 2752, 1, 256, 576, 576, 576, 2752]
    - [0, 20.188]
  - - [704, 2752, 1, 256, 704, 704, 704, 2752]
    - [0, 19.461]
  - - [832, 2752, 1, 256, 832, 832, 832, 2752]
    - [0, 19.886]
  - - [960, 2752, 1, 256, 960, 960, 960, 2752]
    - [0, 20.178]
  - - [1088, 2752, 1, 256, 1088, 1088, 1088, 2752]
    - [0, 20.43]
  - - [1216, 2752, 1, 256, 1216, 1216, 1216, 2752]
    - [0, 20.701]
  - - [1344, 2752, 1, 256, 1344, 1344, 1344, 2752]
    - [0, 20.748]
  - - [1472, 2752, 1, 256, 1472, 1472, 1472, 2752]
    - [0, 21.028]
  - - [1600, 2752, 1, 256, 1600, 1600, 1600, 2752]
    - [0, 20.991]
  - - [1728, 2752, 1, 256, 1728, 1728, 1728, 2752]
    - [0, 21.165]
  - - [1856, 2752, 1, 256, 1856, 1856, 1856, 2752]
    - [0, 21.258]
  - - [1984, 2752, 1, 256, 1984, 1984, 1984, 2752]
    - [0, 21.329]
  - - [2112, 2752, 1, 256, 2112, 2112, 2112, 2752]
    - [0, 21.438]
  - - [2240, 2752, 1, 256, 2240, 2240, 2240, 2752]
    - [0, 21.4]
  - - [2368, 2752, 1, 256, 2368, 2368, 2368, 2752]
    - [0, 21.529]
  - - [2496, 2752, 1, 256, 2496, 2496, 2496, 2752]
    - [0, 21.536]
  - - [2624, 2752, 1, 256, 2624, 2624, 2624, 2752]
    - [0, 21.663]
  - - [2752, 2752, 1, 256, 2752, 2752, 2752, 2752]
    - [0, 21.65]
  - - [2880, 2752, 1, 256, 2880, 2880, 2880, 2752]
    - [0, 21.685]
  - - [3008, 2752, 1, 256, 3008, 3008, 3008, 2752]
    - [0, 21.641]
  - - [3136, 2752, 1, 256, 3136, 3136, 3136, 2752]
    - [0, 21.686]
  - - [3264, 2752, 1, 256, 3264, 3264, 3264, 2752]
    - [0, 21.668]
  - - [3392, 2752, 1, 256, 3392, 3392, 3392, 2752]
    - [0, 21.702]
  - - [3520, 2752, 1, 256, 3520, 3520, 3520, 2752]
    - [0, 21.692]
  - - [3648, 2752, 1, 256, 3648, 3648, 3648, 2752]
    - [0, 21.676]
  - - [3776, 2752, 1, 256, 3776, 3776, 3776, 2752]
    - [0, 21.645]
  - - [3904, 2752, 1, 256, 3904, 3904, 3904, 2752]
    - [0, 21.643]
  - - [4032, 2752, 1, 256, 4032, 4032, 4032, 2752]
    - [0, 21.758]
  - - [64, 2880, 1, 256, 64, 64, 64, 2880]
    - [0, 12.192]
  - - [192, 2880, 1, 256, 192, 192, 192, 2880]
    - [0, 17.219]
  - - [320, 2880, 1, 256, 320, 320, 320, 2880]
    - [0, 18.949]
  - - [448, 2880, 1, 256, 448, 448, 448, 2880]
    - [0, 19.736]
  - - [576, 2880, 1, 256, 576, 576, 576, 2880]
    - [0, 20.396]
  - - [704, 2880, 1, 256, 704, 704, 704, 2880]
    - [0, 19.721]
  - - [832, 2880, 1, 256, 832, 832, 832, 2880]
    - [0, 20.093]
  - - [960, 2880, 1, 256, 960, 960, 960, 2880]
    - [0, 20.337]
  - - [1088, 2880, 1, 256, 1088, 1088, 1088, 2880]
    - [0, 20.507]
  - - [1216, 2880, 1, 256, 1216, 1216, 1216, 2880]
    - [0, 20.791]
  - - [1344, 2880, 1, 256, 1344, 1344, 1344, 2880]
    - [0, 20.933]
  - - [1472, 2880, 1, 256, 1472, 1472, 1472, 2880]
    - [0, 21.03]
  - - [1600, 2880, 1, 256, 1600, 1600, 1600, 2880]
    - [0, 21.083]
  - - [1728, 2880, 1, 256, 1728, 1728, 1728, 2880]
    - [0, 21.222]
  - - [1856, 2880, 1, 256, 1856, 1856, 1856, 2880]
    - [0, 21.292]
  - - [1984, 2880, 1, 256, 1984, 1984, 1984, 2880]
    - [0, 21.381]
  - - [2112, 2880, 1, 256, 2112, 2112, 2112, 2880]
    - [0, 21.441]
  - - [2240, 2880, 1, 256, 2240, 2240, 2240, 2880]
    - [0, 21.486]
  - - [2368, 2880, 1, 256, 2368, 2368, 2368, 2880]
    - [0, 21.48]
  - - [2496, 2880, 1, 256, 2496, 2496, 2496, 2880]
    - [0, 21.569]
  - - [2624, 2880, 1, 256, 2624, 2624, 2624, 2880]
    - [0, 21.63]
  - - [2752, 2880, 1, 256, 2752, 2752, 2752, 2880]
    - [0, 21.613]
  - - [2880, 2880, 1, 256, 2880, 2880, 2880, 2880]
    - [0, 21.497]
  - - [3008, 2880, 1, 256, 3008, 3008, 3008, 2880]
    - [0, 21.524]
  - - [3136, 2880, 1, 256, 3136, 3136, 3136, 2880]
    - [0, 21.606]
  - - [3264, 2880, 1, 256, 3264, 3264, 3264, 2880]
    - [0, 21.641]
  - - [3392, 2880, 1, 256, 3392, 3392, 3392, 2880]
    - [0, 21.661]
  - - [3520, 2880, 1, 256, 3520, 3520, 3520, 2880]
    - [0, 21.679]
  - - [3648, 2880, 1, 256, 3648, 3648, 3648, 2880]
    - [0, 21.706]
  - - [3776, 2880, 1, 256, 3776, 3776, 3776, 2880]
    - [0, 21.691]
  - - [3904, 2880, 1, 256, 3904, 3904, 3904, 2880]
    - [0, 21.75]
  - - [4032, 2880, 1, 256, 4032, 4032, 4032, 2880]
    - [0, 21.803]
  - - [64, 3008, 1, 256, 64, 64, 64, 3008]
    - [0, 11.828]
  - - [192, 3008, 1, 256, 192, 192, 192, 3008]
    - [0, 17.375]
  - - [320, 3008, 1, 256, 320, 320, 320, 3008]
    - [0, 19.107]
  - - [448, 3008, 1, 256, 448, 448, 448, 3008]
    - [0, 19.864]
  - - [576, 3008, 1, 256, 576, 576, 576, 3008]
    - [0, 20.297]
  - - [704, 3008, 1, 256, 704, 704, 704, 3008]
    - [0, 19.765]
  - - [832, 3008, 1, 256, 832, 832, 832, 3008]
    - [0, 20.111]
  - - [960, 3008, 1, 256, 960, 960, 960, 3008]
    - [0, 20.346]
  - - [1088, 3008, 1, 256, 1088, 1088, 1088, 3008]
    - [0, 20.594]
  - - [1216, 3008, 1, 256, 1216, 1216, 1216, 3008]
    - [0, 20.729]
  - - [1344, 3008, 1, 256, 1344, 1344, 1344, 3008]
    - [0, 21.019]
  - - [1472, 3008, 1, 256, 1472, 1472, 1472, 3008]
    - [0, 21.019]
  - - [1600, 3008, 1, 256, 1600, 1600, 1600, 3008]
    - [0, 21.232]
  - - [1728, 3008, 1, 256, 1728, 1728, 1728, 3008]
    - [0, 21.199]
  - - [1856, 3008, 1, 256, 1856, 1856, 1856, 3008]
    - [0, 21.313]
  - - [1984, 3008, 1, 256, 1984, 1984, 1984, 3008]
    - [0, 21.503]
  - - [2112, 3008, 1, 256, 2112, 2112, 2112, 3008]
    - [0, 21.499]
  - - [2240, 3008, 1, 256, 2240, 2240, 2240, 3008]
    - [0, 21.442]
  - - [2368, 3008, 1, 256, 2368, 2368, 2368, 3008]
    - [0, 21.611]
  - - [2496, 3008, 1, 256, 2496, 2496, 2496, 3008]
    - [0, 21.619]
  - - [2624, 3008, 1, 256, 2624, 2624, 2624, 3008]
    - [0, 21.708]
  - - [2752, 3008, 1, 256, 2752, 2752, 2752, 3008]
    - [0, 21.603]
  - - [2880, 3008, 1, 256, 2880, 2880, 2880, 3008]
    - [0, 21.725]
  - - [3008, 3008, 1, 256, 3008, 3008, 3008, 3008]
    - [0, 21.582]
  - - [3136, 3008, 1, 256, 3136, 3136, 3136, 3008]
    - [0, 21.589]
  - - [3264, 3008, 1, 256, 3264, 3264, 3264, 3008]
    - [0, 21.636]
  - - [3392, 3008, 1, 256, 3392, 3392, 3392, 3008]
    - [0, 21.762]
  - - [3520, 3008, 1, 256, 3520, 3520, 3520, 3008]
    - [0, 21.664]
  - - [3648, 3008, 1, 256, 3648, 3648, 3648, 3008]
    - [0, 21.715]
  - - [3776, 3008, 1, 256, 3776, 3776, 3776, 3008]
    - [0, 21.772]
  - - [3904, 3008, 1, 256, 3904, 3904, 3904, 3008]
    - [0, 21.743]
  - - [4032, 3008, 1, 256, 4032, 4032, 4032, 3008]
    - [0, 21.84]
  - - [64, 3136, 1, 256, 64, 64, 64, 3136]
    - [0, 12.167]
  - - [192, 3136, 1, 256, 192, 192, 192, 3136]
    - [0, 17.457]
  - - [320, 3136, 1, 256, 320, 320, 320, 3136]
    - [0, 19.122]
  - - [448, 3136, 1, 256, 448, 448, 448, 3136]
    - [0, 20.033]
  - - [576, 3136, 1, 256, 576, 576, 576, 3136]
    - [0, 20.535]
  - - [704, 3136, 1, 256, 704, 704, 704, 3136]
    - [0, 19.923]
  - - [832, 3136, 1, 256, 832, 832, 832, 3136]
    - [0, 20.316]
  - - [960, 3136, 1, 256, 960, 960, 960, 3136]
    - [0, 20.54]
  - - [1088, 3136, 1, 256, 1088, 1088, 1088, 3136]
    - [0, 20.693]
  - - [1216, 3136, 1, 256, 1216, 1216, 1216, 3136]
    - [0, 20.84]
  - - [1344, 3136, 1, 256, 1344, 1344, 1344, 3136]
    - [0, 21.041]
  - - [1472, 3136, 1, 256, 1472, 1472, 1472, 3136]
    - [0, 21.104]
  - - [1600, 3136, 1, 256, 1600, 1600, 1600, 3136]
    - [0, 21.189]
  - - [1728, 3136, 1, 256, 1728, 1728, 1728, 3136]
    - [0, 21.251]
  - - [1856, 3136, 1, 256, 1856, 1856, 1856, 3136]
    - [0, 21.432]
  - - [1984, 3136, 1, 256, 1984, 1984, 1984, 3136]
    - [0, 21.408]
  - - [2112, 3136, 1, 256, 2112, 2112, 2112, 3136]
    - [0, 21.521]
  - - [2240, 3136, 1, 256, 2240, 2240, 2240, 3136]
    - [0, 21.615]
  - - [2368, 3136, 1, 256, 2368, 2368, 2368, 3136]
    - [0, 21.731]
  - - [2496, 3136, 1, 256, 2496, 2496, 2496, 3136]
    - [0, 21.63]
  - - [2624, 3136, 1, 256, 2624, 2624, 2624, 3136]
    - [0, 21.673]
  - - [2752, 3136, 1, 256, 2752, 2752, 2752, 3136]
    - [0, 21.673]
  - - [2880, 3136, 1, 256, 2880, 2880, 2880, 3136]
    - [0, 21.621]
  - - [3008, 3136, 1, 256, 3008, 3008, 3008, 3136]
    - [0, 21.586]
  - - [3136, 3136, 1, 256, 3136, 3136, 3136, 3136]
    - [0, 21.63]
  - - [3264, 3136, 1, 256, 3264, 3264, 3264, 3136]
    - [0, 21.7]
  - - [3392, 3136, 1, 256, 3392, 3392, 3392, 3136]
    - [0, 21.711]
  - - [3520, 3136, 1, 256, 3520, 3520, 3520, 3136]
    - [0, 21.674]
  - - [3648, 3136, 1, 256, 3648, 3648, 3648, 3136]
    - [0, 21.749]
  - - [3776, 3136, 1, 256, 3776, 3776, 3776, 3136]
    - [0, 21.691]
  - - [3904, 3136, 1, 256, 3904, 3904, 3904, 3136]
    - [0, 21.691]
  - - [4032, 3136, 1, 256, 4032, 4032, 4032, 3136]
    - [0, 21.804]
  - - [64, 3264, 1, 256, 64, 64, 64, 3264]
    - [0, 12.667]
  - - [192, 3264, 1, 256, 192, 192, 192, 3264]
    - [0, 17.586]
  - - [320, 3264, 1, 256, 320, 320, 320, 3264]
    - [0, 19.272]
  - - [448, 3264, 1, 256, 448, 448, 448, 3264]
    - [0, 20.089]
  - - [576, 3264, 1, 256, 576, 576, 576, 3264]
    - [0, 18.91]
  - - [704, 3264, 1, 256, 704, 704, 704, 3264]
    - [0, 20.002]
  - - [832, 3264, 1, 256, 832, 832, 832, 3264]
    - [0, 20.289]
  - - [960, 3264, 1, 256, 960, 960, 960, 3264]
    - [0, 20.591]
  - - [1088, 3264, 1, 256, 1088, 1088, 1088, 3264]
    - [0, 20.746]
  - - [1216, 3264, 1, 256, 1216, 1216, 1216, 3264]
    - [0, 20.932]
  - - [1344, 3264, 1, 256, 1344, 1344, 1344, 3264]
    - [0, 21.086]
  - - [1472, 3264, 1, 256, 1472, 1472, 1472, 3264]
    - [0, 21.15]
  - - [1600, 3264, 1, 256, 1600, 1600, 1600, 3264]
    - [0, 21.253]
  - - [1728, 3264, 1, 256, 1728, 1728, 1728, 3264]
    - [0, 21.348]
  - - [1856, 3264, 1, 256, 1856, 1856, 1856, 3264]
    - [0, 21.423]
  - - [1984, 3264, 1, 256, 1984, 1984, 1984, 3264]
    - [0, 21.429]
  - - [2112, 3264, 1, 256, 2112, 2112, 2112, 3264]
    - [0, 21.587]
  - - [2240, 3264, 1, 256, 2240, 2240, 2240, 3264]
    - [0, 21.643]
  - - [2368, 3264, 1, 256, 2368, 2368, 2368, 3264]
    - [0, 21.68]
  - - [2496, 3264, 1, 256, 2496, 2496, 2496, 3264]
    - [0, 21.584]
  - - [2624, 3264, 1, 256, 2624, 2624, 2624, 3264]
    - [0, 21.636]
  - - [2752, 3264, 1, 256, 2752, 2752, 2752, 3264]
    - [0, 21.691]
  - - [2880, 3264, 1, 256, 2880, 2880, 2880, 3264]
    - [0, 21.62]
  - - [3008, 3264, 1, 256, 3008, 3008, 3008, 3264]
    - [0, 21.664]
  - - [3136, 3264, 1, 256, 3136, 3136, 3136, 3264]
    - [0, 21.662]
  - - [3264, 3264, 1, 256, 3264, 3264, 3264, 3264]
    - [0, 21.71]
  - - [3392, 3264, 1, 256, 3392, 3392, 3392, 3264]
    - [0, 21.739]
  - - [3520, 3264, 1, 256, 3520, 3520, 3520, 3264]
    - [0, 21.772]
  - - [3648, 3264, 1, 256, 3648, 3648, 3648, 3264]
    - [0, 21.711]
  - - [3776, 3264, 1, 256, 3776, 3776, 3776, 3264]
    - [0, 21.722]
  - - [3904, 3264, 1, 256, 3904, 3904, 3904, 3264]
    - [0, 21.77]
  - - [4032, 3264, 1, 256, 4032, 4032, 4032, 3264]
    - [0, 21.887]
  - - [64, 3392, 1, 256, 64, 64, 64, 3392]
    - [0, 12.365]
  - - [192, 3392, 1, 256, 192, 192, 192, 3392]
    - [0, 17.729]
  - - [320, 3392, 1, 256, 320, 320, 320, 3392]
    - [0, 19.419]
  - - [448, 3392, 1, 256, 448, 448, 448, 3392]
    - [0, 20.19]
  - - [576, 3392, 1, 256, 576, 576, 576, 3392]
    - [0, 19.634]
  - - [704, 3392, 1, 256, 704, 704, 704, 3392]
    - [0, 20.023]
  - - [832, 3392, 1, 256, 832, 832, 832, 3392]
    - [0, 20.287]
  - - [960, 3392, 1, 256, 960, 960, 960, 3392]
    - [0, 20.677]
  - - [1088, 3392, 1, 256, 1088, 1088, 1088, 3392]
    - [0, 20.762]
  - - [1216, 3392, 1, 256, 1216, 1216, 1216, 3392]
    - [0, 20.981]
  - - [1344, 3392, 1, 256, 1344, 1344, 1344, 3392]
    - [0, 21.095]
  - - [1472, 3392, 1, 256, 1472, 1472, 1472, 3392]
    - [0, 21.192]
  - - [1600, 3392, 1, 256, 1600, 1600, 1600, 3392]
    - [0, 21.266]
  - - [1728, 3392, 1, 256, 1728, 1728, 1728, 3392]
    - [0, 21.4]
  - - [1856, 3392, 1, 256, 1856, 1856, 1856, 3392]
    - [0, 21.435]
  - - [1984, 3392, 1, 256, 1984, 1984, 1984, 3392]
    - [0, 21.474]
  - - [2112, 3392, 1, 256, 2112, 2112, 2112, 3392]
    - [0, 21.66]
  - - [2240, 3392, 1, 256, 2240, 2240, 2240, 3392]
    - [0, 21.626]
  - - [2368, 3392, 1, 256, 2368, 2368, 2368, 3392]
    - [0, 21.651]
  - - [2496, 3392, 1, 256, 2496, 2496, 2496, 3392]
    - [0, 21.612]
  - - [2624, 3392, 1, 256, 2624, 2624, 2624, 3392]
    - [0, 21.663]
  - - [2752, 3392, 1, 256, 2752, 2752, 2752, 3392]
    - [0, 21.6]
  - - [2880, 3392, 1, 256, 2880, 2880, 2880, 3392]
    - [0, 21.624]
  - - [3008, 3392, 1, 256, 3008, 3008, 3008, 3392]
    - [0, 21.679]
  - - [3136, 3392, 1, 256, 3136, 3136, 3136, 3392]
    - [0, 21.679]
  - - [3264, 3392, 1, 256, 3264, 3264, 3264, 3392]
    - [0, 21.754]
  - - [3392, 3392, 1, 256, 3392, 3392, 3392, 3392]
    - [0, 21.786]
  - - [3520, 3392, 1, 256, 3520, 3520, 3520, 3392]
    - [0, 21.745]
  - - [3648, 3392, 1, 256, 3648, 3648, 3648, 3392]
    - [0, 21.809]
  - - [3776, 3392, 1, 256, 3776, 3776, 3776, 3392]
    - [0, 21.804]
  - - [3904, 3392, 1, 256, 3904, 3904, 3904, 3392]
    - [0, 21.789]
  - - [4032, 3392, 1, 256, 4032, 4032, 4032, 3392]
    - [0, 21.892]
  - - [64, 3520, 1, 256, 64, 64, 64, 3520]
    - [0, 12.654]
  - - [192, 3520, 1, 256, 192, 192, 192, 3520]
    - [0, 18.001]
  - - [320, 3520, 1, 256, 320, 320, 320, 3520]
    - [0, 19.475]
  - - [448, 3520, 1, 256, 448, 448, 448, 3520]
    - [0, 20.176]
  - - [576, 3520, 1, 256, 576, 576, 576, 3520]
    - [0, 19.755]
  - - [704, 3520, 1, 256, 704, 704, 704, 3520]
    - [0, 20.09]
  - - [832, 3520, 1, 256, 832, 832, 832, 3520]
    - [0, 20.449]
  - - [960, 3520, 1, 256, 960, 960, 960, 3520]
    - [0, 20.722]
  - - [1088, 3520, 1, 256, 1088, 1088, 1088, 3520]
    - [0, 20.931]
  - - [1216, 3520, 1, 256, 1216, 1216, 1216, 3520]
    - [0, 21.012]
  - - [1344, 3520, 1, 256, 1344, 1344, 1344, 3520]
    - [0, 21.183]
  - - [1472, 3520, 1, 256, 1472, 1472, 1472, 3520]
    - [0, 21.298]
  - - [1600, 3520, 1, 256, 1600, 1600, 1600, 3520]
    - [0, 21.378]
  - - [1728, 3520, 1, 256, 1728, 1728, 1728, 3520]
    - [0, 21.478]
  - - [1856, 3520, 1, 256, 1856, 1856, 1856, 3520]
    - [0, 21.523]
  - - [1984, 3520, 1, 256, 1984, 1984, 1984, 3520]
    - [0, 21.589]
  - - [2112, 3520, 1, 256, 2112, 2112, 2112, 3520]
    - [0, 21.673]
  - - [2240, 3520, 1, 256, 2240, 2240, 2240, 3520]
    - [0, 21.615]
  - - [2368, 3520, 1, 256, 2368, 2368, 2368, 3520]
    - [0, 21.626]
  - - [2496, 3520, 1, 256, 2496, 2496, 2496, 3520]
    - [0, 21.676]
  - - [2624, 3520, 1, 256, 2624, 2624, 2624, 3520]
    - [0, 21.7]
  - - [2752, 3520, 1, 256, 2752, 2752, 2752, 3520]
    - [0, 21.639]
  - - [2880, 3520, 1, 256, 2880, 2880, 2880, 3520]
    - [0, 21.686]
  - - [3008, 3520, 1, 256, 3008, 3008, 3008, 3520]
    - [0, 21.638]
  - - [3136, 3520, 1, 256, 3136, 3136, 3136, 3520]
    - [0, 21.704]
  - - [3264, 3520, 1, 256, 3264, 3264, 3264, 3520]
    - [0, 21.737]
  - - [3392, 3520, 1, 256, 3392, 3392, 3392, 3520]
    - [0, 21.774]
  - - [3520, 3520, 1, 256, 3520, 3520, 3520, 3520]
    - [0, 21.807]
  - - [3648, 3520, 1, 256, 3648, 3648, 3648, 3520]
    - [0, 21.72]
  - - [3776, 3520, 1, 256, 3776, 3776, 3776, 3520]
    - [0, 21.792]
  - - [3904, 3520, 1, 256, 3904, 3904, 3904, 3520]
    - [0, 21.801]
  - - [4032, 3520, 1, 256, 4032, 4032, 4032, 3520]
    - [0, 21.805]
  - - [64, 3648, 1, 256, 64, 64, 64, 3648]
    - [0, 13.102]
  - - [192, 3648, 1, 256, 192, 192, 192, 3648]
    - [0, 18.044]
  - - [320, 3648, 1, 256, 320, 320, 320, 3648]
    - [0, 19.664]
  - - [448, 3648, 1, 256, 448, 448, 448, 3648]
    - [0, 20.301]
  - - [576, 3648, 1, 256, 576, 576, 576, 3648]
    - [0, 19.72]
  - - [704, 3648, 1, 256, 704, 704, 704, 3648]
    - [0, 20.238]
  - - [832, 3648, 1, 256, 832, 832, 832, 3648]
    - [0, 20.552]
  - - [960, 3648, 1, 256, 960, 960, 960, 3648]
    - [0, 20.727]
  - - [1088, 3648, 1, 256, 1088, 1088, 1088, 3648]
    - [0, 20.86]
  - - [1216, 3648, 1, 256, 1216, 1216, 1216, 3648]
    - [0, 21.02]
  - - [1344, 3648, 1, 256, 1344, 1344, 1344, 3648]
    - [0, 21.216]
  - - [1472, 3648, 1, 256, 1472, 1472, 1472, 3648]
    - [0, 21.3]
  - - [1600, 3648, 1, 256, 1600, 1600, 1600, 3648]
    - [0, 21.344]
  - - [1728, 3648, 1, 256, 1728, 1728, 1728, 3648]
    - [0, 21.492]
  - - [1856, 3648, 1, 256, 1856, 1856, 1856, 3648]
    - [0, 21.528]
  - - [1984, 3648, 1, 256, 1984, 1984, 1984, 3648]
    - [0, 21.492]
  - - [2112, 3648, 1, 256, 2112, 2112, 2112, 3648]
    - [0, 21.661]
  - - [2240, 3648, 1, 256, 2240, 2240, 2240, 3648]
    - [0, 21.592]
  - - [2368, 3648, 1, 256, 2368, 2368, 2368, 3648]
    - [0, 21.698]
  - - [2496, 3648, 1, 256, 2496, 2496, 2496, 3648]
    - [0, 21.703]
  - - [2624, 3648, 1, 256, 2624, 2624, 2624, 3648]
    - [0, 21.669]
  - - [2752, 3648, 1, 256, 2752, 2752, 2752, 3648]
    - [0, 21.705]
  - - [2880, 3648, 1, 256, 2880, 2880, 2880, 3648]
    - [0, 21.745]
  - - [3008, 3648, 1, 256, 3008, 3008, 3008, 3648]
    - [0, 21.732]
  - - [3136, 3648, 1, 256, 3136, 3136, 3136, 3648]
    - [0, 21.716]
  - - [3264, 3648, 1, 256, 3264, 3264, 3264, 3648]
    - [0, 21.822]
  - - [3392, 3648, 1, 256, 3392, 3392, 3392, 3648]
    - [0, 21.824]
  - - [3520, 3648, 1, 256, 3520, 3520, 3520, 3648]
    - [0, 21.77]
  - - [3648, 3648, 1, 256, 3648, 3648, 3648, 3648]
    - [0, 21.782]
  - - [3776, 3648, 1, 256, 3776, 3776, 3776, 3648]
    - [0, 21.798]
  - - [3904, 3648, 1, 256, 3904, 3904, 3904, 3648]
    - [0, 21.879]
  - - [4032, 3648, 1, 256, 4032, 4032, 4032, 3648]
    - [0, 21.563]
  - - [64, 3776, 1, 256, 64, 64, 64, 3776]
    - [0, 13.454]
  - - [192, 3776, 1, 256, 192, 192, 192, 3776]
    - [0, 18.104]
  - - [320, 3776, 1, 256, 320, 320, 320, 3776]
    - [0, 19.694]
  - - [448, 3776, 1, 256, 448, 448, 448, 3776]
    - [0, 20.365]
  - - [576, 3776, 1, 256, 576, 576, 576, 3776]
    - [0, 19.848]
  - - [704, 3776, 1, 256, 704, 704, 704, 3776]
    - [0, 20.272]
  - - [832, 3776, 1, 256, 832, 832, 832, 3776]
    - [0, 20.586]
  - - [960, 3776, 1, 256, 960, 960, 960, 3776]
    - [0, 20.787]
  - - [1088, 3776, 1, 256, 1088, 1088, 1088, 3776]
    - [0, 20.933]
  - - [1216, 3776, 1, 256, 1216, 1216, 1216, 3776]
    - [0, 21.19]
  - - [1344, 3776, 1, 256, 1344, 1344, 1344, 3776]
    - [0, 21.239]
  - - [1472, 3776, 1, 256, 1472, 1472, 1472, 3776]
    - [0, 21.35]
  - - [1600, 3776, 1, 256, 1600, 1600, 1600, 3776]
    - [0, 21.365]
  - - [1728, 3776, 1, 256, 1728, 1728, 1728, 3776]
    - [0, 21.549]
  - - [1856, 3776, 1, 256, 1856, 1856, 1856, 3776]
    - [0, 21.575]
  - - [1984, 3776, 1, 256, 1984, 1984, 1984, 3776]
    - [0, 21.631]
  - - [2112, 3776, 1, 256, 2112, 2112, 2112, 3776]
    - [0, 21.636]
  - - [2240, 3776, 1, 256, 2240, 2240, 2240, 3776]
    - [0, 21.704]
  - - [2368, 3776, 1, 256, 2368, 2368, 2368, 3776]
    - [0, 21.729]
  - - [2496, 3776, 1, 256, 2496, 2496, 2496, 3776]
    - [0, 21.595]
  - - [2624, 3776, 1, 256, 2624, 2624, 2624, 3776]
    - [0, 21.611]
  - - [2752, 3776, 1, 256, 2752, 2752, 2752, 3776]
    - [0, 21.721]
  - - [2880, 3776, 1, 256, 2880, 2880, 2880, 3776]
    - [0, 21.717]
  - - [3008, 3776, 1, 256, 3008, 3008, 3008, 3776]
    - [0, 21.73]
  - - [3136, 3776, 1, 256, 3136, 3136, 3136, 3776]
    - [0, 21.775]
  - - [3264, 3776, 1, 256, 3264, 3264, 3264, 3776]
    - [0, 21.764]
  - - [3392, 3776, 1, 256, 3392, 3392, 3392, 3776]
    - [0, 21.861]
  - - [3520, 3776, 1, 256, 3520, 3520, 3520, 3776]
    - [0, 21.784]
  - - [3648, 3776, 1, 256, 3648, 3648, 3648, 3776]
    - [0, 21.854]
  - - [3776, 3776, 1, 256, 3776, 3776, 3776, 3776]
    - [0, 21.401]
  - - [3904, 3776, 1, 256, 3904, 3904, 3904, 3776]
    - [0, 21.584]
  - - [4032, 3776, 1, 256, 4032, 4032, 4032, 3776]
    - [0, 21.618]
  - - [64, 3904, 1, 256, 64, 64, 64, 3904]
    - [0, 13.04]
  - - [192, 3904, 1, 256, 192, 192, 192, 3904]
    - [0, 18.316]
  - - [320, 3904, 1, 256, 320, 320, 320, 3904]
    - [0, 19.735]
  - - [448, 3904, 1, 256, 448, 448, 448, 3904]
    - [0, 20.385]
  - - [576, 3904, 1, 256, 576, 576, 576, 3904]
    - [0, 19.944]
  - - [704, 3904, 1, 256, 704, 704, 704, 3904]
    - [0, 20.345]
  - - [832, 3904, 1, 256, 832, 832, 832, 3904]
    - [0, 20.745]
  - - [960, 3904, 1, 256, 960, 960, 960, 3904]
    - [0, 20.87]
  - - [1088, 3904, 1, 256, 1088, 1088, 1088, 3904]
    - [0, 20.994]
  - - [1216, 3904, 1, 256, 1216, 1216, 1216, 3904]
    - [0, 21.208]
  - - [1344, 3904, 1, 256, 1344, 1344, 1344, 3904]
    - [0, 21.248]
  - - [1472, 3904, 1, 256, 1472, 1472, 1472, 3904]
    - [0, 21.375]
  - - [1600, 3904, 1, 256, 1600, 1600, 1600, 3904]
    - [0, 21.498]
  - - [1728, 3904, 1, 256, 1728, 1728, 1728, 3904]
    - [0, 21.504]
  - - [1856, 3904, 1, 256, 1856, 1856, 1856, 3904]
    - [0, 21.641]
  - - [1984, 3904, 1, 256, 1984, 1984, 1984, 3904]
    - [0, 21.662]
  - - [2112, 3904, 1, 256, 2112, 2112, 2112, 3904]
    - [0, 21.625]
  - - [2240, 3904, 1, 256, 2240, 2240, 2240, 3904]
    - [0, 21.704]
  - - [2368, 3904, 1, 256, 2368, 2368, 2368, 3904]
    - [0, 21.631]
  - - [2496, 3904, 1, 256, 2496, 2496, 2496, 3904]
    - [0, 21.715]
  - - [2624, 3904, 1, 256, 2624, 2624, 2624, 3904]
    - [0, 21.701]
  - - [2752, 3904, 1, 256, 2752, 2752, 2752, 3904]
    - [0, 21.777]
  - - [2880, 3904, 1, 256, 2880, 2880, 2880, 3904]
    - [0, 21.759]
  - - [3008, 3904, 1, 256, 3008, 3008, 3008, 3904]
    - [0, 21.741]
  - - [3136, 3904, 1, 256, 3136, 3136, 3136, 3904]
    - [0, 21.834]
  - - [3264, 3904, 1, 256, 3264, 3264, 3264, 3904]
    - [0, 21.817]
  - - [3392, 3904, 1, 256, 3392, 3392, 3392, 3904]
    - [0, 21.906]
  - - [3520, 3904, 1, 256, 3520, 3520, 3520, 3904]
    - [0, 21.834]
  - - [3648, 3904, 1, 256, 3648, 3648, 3648, 3904]
    - [0, 21.854]
  - - [3776, 3904, 1, 256, 3776, 3776, 3776, 3904]
    - [0, 21.52]
  - - [3904, 3904, 1, 256, 3904, 3904, 3904, 3904]
    - [0, 21.591]
  - - [4032, 3904, 1, 256, 4032, 4032, 4032, 3904]
    - [0, 21.614]
  - - [64, 4032, 1, 256, 64, 64, 64, 4032]
    - [0, 13.365]
  - - [192, 4032, 1, 256, 192, 192, 192, 4032]
    - [0, 18.395]
  - - [320, 4032, 1, 256, 320, 320, 320, 4032]
    - [0, 19.78]
  - - [448, 4032, 1, 256, 448, 448, 448, 4032]
    - [0, 20.518]
  - - [576, 4032, 1, 256, 576, 576, 576, 4032]
    - [0, 19.988]
  - - [704, 4032, 1, 256, 704, 704, 704, 4032]
    - [0, 20.333]
  - - [832, 4032, 1, 256, 832, 832, 832, 4032]
    - [0, 20.658]
  - - [960, 4032, 1, 256, 960, 960, 960, 4032]
    - [0, 20.901]
  - - [1088, 4032, 1, 256, 1088, 1088, 1088, 4032]
    - [0, 21.04]
  - - [1216, 4032, 1, 256, 1216, 1216, 1216, 4032]
    - [0, 21.155]
  - - [1344, 4032, 1, 256, 1344, 1344, 1344, 4032]
    - [0, 21.296]
  - - [1472, 4032, 1, 256, 1472, 1472, 1472, 4032]
    - [0, 21.393]
  - - [1600, 4032, 1, 256, 1600, 1600, 1600, 4032]
    - [0, 21.461]
  - - [1728, 4032, 1, 256, 1728, 1728, 1728, 4032]
    - [0, 21.56]
  - - [1856, 4032, 1, 256, 1856, 1856, 1856, 4032]
    - [0, 21.571]
  - - [1984, 4032, 1, 256, 1984, 1984, 1984, 4032]
    - [0, 21.663]
  - - [2112, 4032, 1, 256, 2112, 2112, 2112, 4032]
    - [0, 21.735]
  - - [2240, 4032, 1, 256, 2240, 2240, 2240, 4032]
    - [0, 21.67]
  - - [2368, 4032, 1, 256, 2368, 2368, 2368, 4032]
    - [0, 21.67]
  - - [2496, 4032, 1, 256, 2496, 2496, 2496, 4032]
    - [0, 21.61]
  - - [2624, 4032, 1, 256, 2624, 2624, 2624, 4032]
    - [0, 21.645]
  - - [2752, 4032, 1, 256, 2752, 2752, 2752, 4032]
    - [0, 21.724]
  - - [2880, 4032, 1, 256, 2880, 2880, 2880, 4032]
    - [0, 21.769]
  - - [3008, 4032, 1, 256, 3008, 3008, 3008, 4032]
    - [0, 21.698]
  - - [3136, 4032, 1, 256, 3136, 3136, 3136, 4032]
    - [0, 21.755]
  - - [3264, 4032, 1, 256, 3264, 3264, 3264, 4032]
    - [0, 21.806]
  - - [3392, 4032, 1, 256, 3392, 3392, 3392, 4032]
    - [0, 21.828]
  - - [3520, 4032, 1, 256, 3520, 3520, 3520, 4032]
    - [0, 21.823]
  - - [3648, 4032, 1, 256, 3648, 3648, 3648, 4032]
    - [0, 21.513]
  - - [3776, 4032, 1, 256, 3776, 3776, 3776, 4032]
    - [0, 21.606]
  - - [3904, 4032, 1, 256, 3904, 3904, 3904, 4032]
    - [0, 21.552]
  - - [4032, 4032, 1, 256, 4032, 4032, 4032, 4032]
    - [0, 21.687]
  - - [64, 64, 1, 512, 64, 64, 64, 64]
    - [2, 0.877]
  - - [192, 64, 1, 512, 192, 192, 192, 64]
    - [2, 2.603]
  - - [320, 64, 1, 512, 320, 320, 320, 64]
    - [2, 4.146]
  - - [448, 64, 1, 512, 448, 448, 448, 64]
    - [0, 5.748]
  - - [576, 64, 1, 512, 576, 576, 576, 64]
    - [2, 6.202]
  - - [704, 64, 1, 512, 704, 704, 704, 64]
    - [2, 7.439]
  - - [832, 64, 1, 512, 832, 832, 832, 64]
    - [0, 8.457]
  - - [960, 64, 1, 512, 960, 960, 960, 64]
    - [0, 9.713]
  - - [1088, 64, 1, 512, 1088, 1088, 1088, 64]
    - [2, 9.284]
  - - [1216, 64, 1, 512, 1216, 1216, 1216, 64]
    - [0, 10.261]
  - - [1344, 64, 1, 512, 1344, 1344, 1344, 64]
    - [0, 11.314]
  - - [1472, 64, 1, 512, 1472, 1472, 1472, 64]
    - [2, 10.698]
  - - [1600, 64, 1, 512, 1600, 1600, 1600, 64]
    - [0, 11.515]
  - - [1728, 64, 1, 512, 1728, 1728, 1728, 64]
    - [0, 12.4]
  - - [1856, 64, 1, 512, 1856, 1856, 1856, 64]
    - [0, 13.31]
  - - [1984, 64, 1, 512, 1984, 1984, 1984, 64]
    - [0, 12.494]
  - - [2112, 64, 1, 512, 2112, 2112, 2112, 64]
    - [0, 13.133]
  - - [2240, 64, 1, 512, 2240, 2240, 2240, 64]
    - [0, 13.951]
  - - [2368, 64, 1, 512, 2368, 2368, 2368, 64]
    - [0, 14.715]
  - - [2496, 64, 1, 512, 2496, 2496, 2496, 64]
    - [0, 13.709]
  - - [2624, 64, 1, 512, 2624, 2624, 2624, 64]
    - [0, 14.334]
  - - [2752, 64, 1, 512, 2752, 2752, 2752, 64]
    - [0, 15.002]
  - - [2880, 64, 1, 512, 2880, 2880, 2880, 64]
    - [0, 15.658]
  - - [3008, 64, 1, 512, 3008, 3008, 3008, 64]
    - [0, 14.793]
  - - [3136, 64, 1, 512, 3136, 3136, 3136, 64]
    - [0, 15.402]
  - - [3264, 64, 1, 512, 3264, 3264, 3264, 64]
    - [0, 15.984]
  - - [3392, 64, 1, 512, 3392, 3392, 3392, 64]
    - [0, 15.303]
  - - [3520, 64, 1, 512, 3520, 3520, 3520, 64]
    - [0, 15.712]
  - - [3648, 64, 1, 512, 3648, 3648, 3648, 64]
    - [0, 16.173]
  - - [3776, 64, 1, 512, 3776, 3776, 3776, 64]
    - [0, 16.745]
  - - [3904, 64, 1, 512, 3904, 3904, 3904, 64]
    - [0, 16.124]
  - - [4032, 64, 1, 512, 4032, 4032, 4032, 64]
    - [0, 16.401]
  - - [64, 192, 1, 512, 64, 64, 64, 192]
    - [2, 2.626]
  - - [192, 192, 1, 512, 192, 192, 192, 192]
    - [2, 6.247]
  - - [320, 192, 1, 512, 320, 320, 320, 192]
    - [0, 9.75]
  - - [448, 192, 1, 512, 448, 448, 448, 192]
    - [0, 11.345]
  - - [576, 192, 1, 512, 576, 576, 576, 192]
    - [0, 12.399]
  - - [704, 192, 1, 512, 704, 704, 704, 192]
    - [0, 13.24]
  - - [832, 192, 1, 512, 832, 832, 832, 192]
    - [0, 13.808]
  - - [960, 192, 1, 512, 960, 960, 960, 192]
    - [0, 15.797]
  - - [1088, 192, 1, 512, 1088, 1088, 1088, 192]
    - [0, 16.07]
  - - [1216, 192, 1, 512, 1216, 1216, 1216, 192]
    - [0, 16.351]
  - - [1344, 192, 1, 512, 1344, 1344, 1344, 192]
    - [0, 16.609]
  - - [1472, 192, 1, 512, 1472, 1472, 1472, 192]
    - [0, 16.837]
  - - [1600, 192, 1, 512, 1600, 1600, 1600, 192]
    - [0, 18.062]
  - - [1728, 192, 1, 512, 1728, 1728, 1728, 192]
    - [0, 18.118]
  - - [1856, 192, 1, 512, 1856, 1856, 1856, 192]
    - [0, 18.131]
  - - [1984, 192, 1, 512, 1984, 1984, 1984, 192]
    - [0, 18.224]
  - - [2112, 192, 1, 512, 2112, 2112, 2112, 192]
    - [0, 18.376]
  - - [2240, 192, 1, 512, 2240, 2240, 2240, 192]
    - [0, 19.207]
  - - [2368, 192, 1, 512, 2368, 2368, 2368, 192]
    - [0, 19.286]
  - - [2496, 192, 1, 512, 2496, 2496, 2496, 192]
    - [0, 19.21]
  - - [2624, 192, 1, 512, 2624, 2624, 2624, 192]
    - [0, 19.29]
  - - [2752, 192, 1, 512, 2752, 2752, 2752, 192]
    - [0, 19.368]
  - - [2880, 192, 1, 512, 2880, 2880, 2880, 192]
    - [0, 19.936]
  - - [3008, 192, 1, 512, 3008, 3008, 3008, 192]
    - [0, 19.9]
  - - [3136, 192, 1, 512, 3136, 3136, 3136, 192]
    - [0, 19.958]
  - - [3264, 192, 1, 512, 3264, 3264, 3264, 192]
    - [0, 20.002]
  - - [3392, 192, 1, 512, 3392, 3392, 3392, 192]
    - [0, 20.016]
  - - [3520, 192, 1, 512, 3520, 3520, 3520, 192]
    - [0, 20.411]
  - - [3648, 192, 1, 512, 3648, 3648, 3648, 192]
    - [0, 20.41]
  - - [3776, 192, 1, 512, 3776, 3776, 3776, 192]
    - [0, 20.47]
  - - [3904, 192, 1, 512, 3904, 3904, 3904, 192]
    - [0, 20.557]
  - - [4032, 192, 1, 512, 4032, 4032, 4032, 192]
    - [0, 20.559]
  - - [64, 320, 1, 512, 64, 64, 64, 320]
    - [0, 4.151]
  - - [192, 320, 1, 512, 192, 192, 192, 320]
    - [0, 9.743]
  - - [320, 320, 1, 512, 320, 320, 320, 320]
    - [0, 11.476]
  - - [448, 320, 1, 512, 448, 448, 448, 320]
    - [0, 13.954]
  - - [576, 320, 1, 512, 576, 576, 576, 320]
    - [0, 15.782]
  - - [704, 320, 1, 512, 704, 704, 704, 320]
    - [0, 15.857]
  - - [832, 320, 1, 512, 832, 832, 832, 320]
    - [0, 16.999]
  - - [960, 320, 1, 512, 960, 960, 960, 320]
    - [0, 17.979]
  - - [1088, 320, 1, 512, 1088, 1088, 1088, 320]
    - [0, 17.738]
  - - [1216, 320, 1, 512, 1216, 1216, 1216, 320]
    - [0, 18.521]
  - - [1344, 320, 1, 512, 1344, 1344, 1344, 320]
    - [0, 19.138]
  - - [1472, 320, 1, 512, 1472, 1472, 1472, 320]
    - [0, 19.022]
  - - [1600, 320, 1, 512, 1600, 1600, 1600, 320]
    - [0, 19.517]
  - - [1728, 320, 1, 512, 1728, 1728, 1728, 320]
    - [0, 19.876]
  - - [1856, 320, 1, 512, 1856, 1856, 1856, 320]
    - [0, 19.843]
  - - [1984, 320, 1, 512, 1984, 1984, 1984, 320]
    - [0, 20.138]
  - - [2112, 320, 1, 512, 2112, 2112, 2112, 320]
    - [0, 20.399]
  - - [2240, 320, 1, 512, 2240, 2240, 2240, 320]
    - [0, 20.308]
  - - [2368, 320, 1, 512, 2368, 2368, 2368, 320]
    - [0, 20.594]
  - - [2496, 320, 1, 512, 2496, 2496, 2496, 320]
    - [0, 20.763]
  - - [2624, 320, 1, 512, 2624, 2624, 2624, 320]
    - [0, 20.778]
  - - [2752, 320, 1, 512, 2752, 2752, 2752, 320]
    - [0, 20.972]
  - - [2880, 320, 1, 512, 2880, 2880, 2880, 320]
    - [0, 20.997]
  - - [3008, 320, 1, 512, 3008, 3008, 3008, 320]
    - [0, 19.375]
  - - [3136, 320, 1, 512, 3136, 3136, 3136, 320]
    - [0, 20.167]
  - - [3264, 320, 1, 512, 3264, 3264, 3264, 320]
    - [0, 20.267]
  - - [3392, 320, 1, 512, 3392, 3392, 3392, 320]
    - [0, 20.31]
  - - [3520, 320, 1, 512, 3520, 3520, 3520, 320]
    - [0, 20.372]
  - - [3648, 320, 1, 512, 3648, 3648, 3648, 320]
    - [0, 20.469]
  - - [3776, 320, 1, 512, 3776, 3776, 3776, 320]
    - [0, 20.652]
  - - [3904, 320, 1, 512, 3904, 3904, 3904, 320]
    - [0, 20.717]
  - - [4032, 320, 1, 512, 4032, 4032, 4032, 320]
    - [0, 20.743]
  - - [64, 448, 1, 512, 64, 64, 64, 448]
    - [2, 5.685]
  - - [192, 448, 1, 512, 192, 192, 192, 448]
    - [0, 11.328]
  - - [320, 448, 1, 512, 320, 320, 320, 448]
    - [0, 13.975]
  - - [448, 448, 1, 512, 448, 448, 448, 448]
    - [0, 15.452]
  - - [576, 448, 1, 512, 576, 576, 576, 448]
    - [0, 16.646]
  - - [704, 448, 1, 512, 704, 704, 704, 448]
    - [0, 17.38]
  - - [832, 448, 1, 512, 832, 832, 832, 448]
    - [0, 17.998]
  - - [960, 448, 1, 512, 960, 960, 960, 448]
    - [0, 19.202]
  - - [1088, 448, 1, 512, 1088, 1088, 1088, 448]
    - [0, 19.389]
  - - [1216, 448, 1, 512, 1216, 1216, 1216, 448]
    - [0, 19.695]
  - - [1344, 448, 1, 512, 1344, 1344, 1344, 448]
    - [0, 20.035]
  - - [1472, 448, 1, 512, 1472, 1472, 1472, 448]
    - [0, 20.187]
  - - [1600, 448, 1, 512, 1600, 1600, 1600, 448]
    - [0, 20.416]
  - - [1728, 448, 1, 512, 1728, 1728, 1728, 448]
    - [0, 20.571]
  - - [1856, 448, 1, 512, 1856, 1856, 1856, 448]
    - [0, 20.839]
  - - [1984, 448, 1, 512, 1984, 1984, 1984, 448]
    - [0, 20.958]
  - - [2112, 448, 1, 512, 2112, 2112, 2112, 448]
    - [2, 19.238]
  - - [2240, 448, 1, 512, 2240, 2240, 2240, 448]
    - [0, 20.15]
  - - [2368, 448, 1, 512, 2368, 2368, 2368, 448]
    - [0, 20.159]
  - - [2496, 448, 1, 512, 2496, 2496, 2496, 448]
    - [0, 20.436]
  - - [2624, 448, 1, 512, 2624, 2624, 2624, 448]
    - [0, 20.573]
  - - [2752, 448, 1, 512, 2752, 2752, 2752, 448]
    - [0, 20.696]
  - - [2880, 448, 1, 512, 2880, 2880, 2880, 448]
    - [0, 20.812]
  - - [3008, 448, 1, 512, 3008, 3008, 3008, 448]
    - [0, 20.87]
  - - [3136, 448, 1, 512, 3136, 3136, 3136, 448]
    - [0, 20.988]
  - - [3264, 448, 1, 512, 3264, 3264, 3264, 448]
    - [0, 21.085]
  - - [3392, 448, 1, 512, 3392, 3392, 3392, 448]
    - [0, 21.206]
  - - [3520, 448, 1, 512, 3520, 3520, 3520, 448]
    - [0, 21.199]
  - - [3648, 448, 1, 512, 3648, 3648, 3648, 448]
    - [0, 21.31]
  - - [3776, 448, 1, 512, 3776, 3776, 3776, 448]
    - [0, 21.405]
  - - [3904, 448, 1, 512, 3904, 3904, 3904, 448]
    - [0, 21.37]
  - - [4032, 448, 1, 512, 4032, 4032, 4032, 448]
    - [0, 21.479]
  - - [64, 576, 1, 512, 64, 64, 64, 576]
    - [2, 6.283]
  - - [192, 576, 1, 512, 192, 192, 192, 576]
    - [0, 12.387]
  - - [320, 576, 1, 512, 320, 320, 320, 576]
    - [0, 15.724]
  - - [448, 576, 1, 512, 448, 448, 448, 576]
    - [0, 16.566]
  - - [576, 576, 1, 512, 576, 576, 576, 576]
    - [0, 18.103]
  - - [704, 576, 1, 512, 704, 704, 704, 576]
    - [0, 18.468]
  - - [832, 576, 1, 512, 832, 832, 832, 576]
    - [0, 19.151]
  - - [960, 576, 1, 512, 960, 960, 960, 576]
    - [0, 19.857]
  - - [1088, 576, 1, 512, 1088, 1088, 1088, 576]
    - [0, 19.893]
  - - [1216, 576, 1, 512, 1216, 1216, 1216, 576]
    - [0, 20.481]
  - - [1344, 576, 1, 512, 1344, 1344, 1344, 576]
    - [0, 20.537]
  - - [1472, 576, 1, 512, 1472, 1472, 1472, 576]
    - [0, 20.901]
  - - [1600, 576, 1, 512, 1600, 1600, 1600, 576]
    - [0, 21.022]
  - - [1728, 576, 1, 512, 1728, 1728, 1728, 576]
    - [0, 20.007]
  - - [1856, 576, 1, 512, 1856, 1856, 1856, 576]
    - [0, 20.302]
  - - [1984, 576, 1, 512, 1984, 1984, 1984, 576]
    - [0, 20.447]
  - - [2112, 576, 1, 512, 2112, 2112, 2112, 576]
    - [0, 20.665]
  - - [2240, 576, 1, 512, 2240, 2240, 2240, 576]
    - [0, 20.696]
  - - [2368, 576, 1, 512, 2368, 2368, 2368, 576]
    - [0, 20.95]
  - - [2496, 576, 1, 512, 2496, 2496, 2496, 576]
    - [0, 21.061]
  - - [2624, 576, 1, 512, 2624, 2624, 2624, 576]
    - [0, 21.178]
  - - [2752, 576, 1, 512, 2752, 2752, 2752, 576]
    - [0, 21.245]
  - - [2880, 576, 1, 512, 2880, 2880, 2880, 576]
    - [0, 21.324]
  - - [3008, 576, 1, 512, 3008, 3008, 3008, 576]
    - [0, 21.306]
  - - [3136, 576, 1, 512, 3136, 3136, 3136, 576]
    - [0, 21.484]
  - - [3264, 576, 1, 512, 3264, 3264, 3264, 576]
    - [0, 21.555]
  - - [3392, 576, 1, 512, 3392, 3392, 3392, 576]
    - [0, 21.652]
  - - [3520, 576, 1, 512, 3520, 3520, 3520, 576]
    - [0, 21.629]
  - - [3648, 576, 1, 512, 3648, 3648, 3648, 576]
    - [0, 21.678]
  - - [3776, 576, 1, 512, 3776, 3776, 3776, 576]
    - [0, 21.795]
  - - [3904, 576, 1, 512, 3904, 3904, 3904, 576]
    - [0, 21.796]
  - - [4032, 576, 1, 512, 4032, 4032, 4032, 576]
    - [0, 21.836]
  - - [64, 704, 1, 512, 64, 64, 64, 704]
    - [2, 7.519]
  - - [192, 704, 1, 512, 192, 192, 192, 704]
    - [0, 13.225]
  - - [320, 704, 1, 512, 320, 320, 320, 704]
    - [0, 15.911]
  - - [448, 704, 1, 512, 448, 448, 448, 704]
    - [0, 17.403]
  - - [576, 704, 1, 512, 576, 576, 576, 704]
    - [0, 18.448]
  - - [704, 704, 1, 512, 704, 704, 704, 704]
    - [0, 19.114]
  - - [832, 704, 1, 512, 832, 832, 832, 704]
    - [2, 19.638]
  - - [960, 704, 1, 512, 960, 960, 960, 704]
    - [0, 20.385]
  - - [1088, 704, 1, 512, 1088, 1088, 1088, 704]
    - [0, 20.641]
  - - [1216, 704, 1, 512, 1216, 1216, 1216, 704]
    - [0, 20.958]
  - - [1344, 704, 1, 512, 1344, 1344, 1344, 704]
    - [2, 19.738]
  - - [1472, 704, 1, 512, 1472, 1472, 1472, 704]
    - [0, 20.185]
  - - [1600, 704, 1, 512, 1600, 1600, 1600, 704]
    - [2, 20.362]
  - - [1728, 704, 1, 512, 1728, 1728, 1728, 704]
    - [0, 20.587]
  - - [1856, 704, 1, 512, 1856, 1856, 1856, 704]
    - [0, 20.838]
  - - [1984, 704, 1, 512, 1984, 1984, 1984, 704]
    - [0, 21.021]
  - - [2112, 704, 1, 512, 2112, 2112, 2112, 704]
    - [0, 21.22]
  - - [2240, 704, 1, 512, 2240, 2240, 2240, 704]
    - [0, 21.212]
  - - [2368, 704, 1, 512, 2368, 2368, 2368, 704]
    - [0, 21.337]
  - - [2496, 704, 1, 512, 2496, 2496, 2496, 704]
    - [0, 21.445]
  - - [2624, 704, 1, 512, 2624, 2624, 2624, 704]
    - [0, 21.502]
  - - [2752, 704, 1, 512, 2752, 2752, 2752, 704]
    - [0, 21.588]
  - - [2880, 704, 1, 512, 2880, 2880, 2880, 704]
    - [0, 21.673]
  - - [3008, 704, 1, 512, 3008, 3008, 3008, 704]
    - [0, 21.719]
  - - [3136, 704, 1, 512, 3136, 3136, 3136, 704]
    - [0, 21.788]
  - - [3264, 704, 1, 512, 3264, 3264, 3264, 704]
    - [0, 21.849]
  - - [3392, 704, 1, 512, 3392, 3392, 3392, 704]
    - [0, 21.898]
  - - [3520, 704, 1, 512, 3520, 3520, 3520, 704]
    - [2, 21.946]
  - - [3648, 704, 1, 512, 3648, 3648, 3648, 704]
    - [0, 22.012]
  - - [3776, 704, 1, 512, 3776, 3776, 3776, 704]
    - [0, 21.988]
  - - [3904, 704, 1, 512, 3904, 3904, 3904, 704]
    - [0, 22.107]
  - - [4032, 704, 1, 512, 4032, 4032, 4032, 704]
    - [0, 22.095]
  - - [64, 832, 1, 512, 64, 64, 64, 832]
    - [0, 8.522]
  - - [192, 832, 1, 512, 192, 192, 192, 832]
    - [2, 13.788]
  - - [320, 832, 1, 512, 320, 320, 320, 832]
    - [0, 17.061]
  - - [448, 832, 1, 512, 448, 448, 448, 832]
    - [0, 18.007]
  - - [576, 832, 1, 512, 576, 576, 576, 832]
    - [0, 19.204]
  - - [704, 832, 1, 512, 704, 704, 704, 832]
    - [0, 19.672]
  - - [832, 832, 1, 512, 832, 832, 832, 832]
    - [0, 20.284]
  - - [960, 832, 1, 512, 960, 960, 960, 832]
    - [0, 20.778]
  - - [1088, 832, 1, 512, 1088, 1088, 1088, 832]
    - [0, 21.009]
  - - [1216, 832, 1, 512, 1216, 1216, 1216, 832]
    - [0, 20.156]
  - - [1344, 832, 1, 512, 1344, 1344, 1344, 832]
    - [0, 20.395]
  - - [1472, 832, 1, 512, 1472, 1472, 1472, 832]
    - [0, 20.63]
  - - [1600, 832, 1, 512, 1600, 1600, 1600, 832]
    - [0, 20.828]
  - - [1728, 832, 1, 512, 1728, 1728, 1728, 832]
    - [0, 21.002]
  - - [1856, 832, 1, 512, 1856, 1856, 1856, 832]
    - [0, 21.176]
  - - [1984, 832, 1, 512, 1984, 1984, 1984, 832]
    - [0, 21.322]
  - - [2112, 832, 1, 512, 2112, 2112, 2112, 832]
    - [0, 21.483]
  - - [2240, 832, 1, 512, 2240, 2240, 2240, 832]
    - [0, 21.423]
  - - [2368, 832, 1, 512, 2368, 2368, 2368, 832]
    - [0, 21.677]
  - - [2496, 832, 1, 512, 2496, 2496, 2496, 832]
    - [0, 21.772]
  - - [2624, 832, 1, 512, 2624, 2624, 2624, 832]
    - [0, 21.782]
  - - [2752, 832, 1, 512, 2752, 2752, 2752, 832]
    - [0, 21.898]
  - - [2880, 832, 1, 512, 2880, 2880, 2880, 832]
    - [0, 21.956]
  - - [3008, 832, 1, 512, 3008, 3008, 3008, 832]
    - [0, 21.955]
  - - [3136, 832, 1, 512, 3136, 3136, 3136, 832]
    - [0, 22.036]
  - - [3264, 832, 1, 512, 3264, 3264, 3264, 832]
    - [0, 22.085]
  - - [3392, 832, 1, 512, 3392, 3392, 3392, 832]
    - [0, 22.133]
  - - [3520, 832, 1, 512, 3520, 3520, 3520, 832]
    - [0, 22.217]
  - - [3648, 832, 1, 512, 3648, 3648, 3648, 832]
    - [0, 22.192]
  - - [3776, 832, 1, 512, 3776, 3776, 3776, 832]
    - [0, 22.252]
  - - [3904, 832, 1, 512, 3904, 3904, 3904, 832]
    - [0, 22.28]
  - - [4032, 832, 1, 512, 4032, 4032, 4032, 832]
    - [2, 22.253]
  - - [64, 960, 1, 512, 64, 64, 64, 960]
    - [0, 9.822]
  - - [192, 960, 1, 512, 192, 192, 192, 960]
    - [0, 15.766]
  - - [320, 960, 1, 512, 320, 320, 320, 960]
    - [0, 17.937]
  - - [448, 960, 1, 512, 448, 448, 448, 960]
    - [0, 19.117]
  - - [576, 960, 1, 512, 576, 576, 576, 960]
    - [0, 19.848]
  - - [704, 960, 1, 512, 704, 704, 704, 960]
    - [0, 20.401]
  - - [832, 960, 1, 512, 832, 832, 832, 960]
    - [0, 20.697]
  - - [960, 960, 1, 512, 960, 960, 960, 960]
    - [0, 21.103]
  - - [1088, 960, 1, 512, 1088, 1088, 1088, 960]
    - [0, 20.131]
  - - [1216, 960, 1, 512, 1216, 1216, 1216, 960]
    - [0, 20.486]
  - - [1344, 960, 1, 512, 1344, 1344, 1344, 960]
    - [0, 20.777]
  - - [1472, 960, 1, 512, 1472, 1472, 1472, 960]
    - [0, 20.971]
  - - [1600, 960, 1, 512, 1600, 1600, 1600, 960]
    - [0, 21.147]
  - - [1728, 960, 1, 512, 1728, 1728, 1728, 960]
    - [0, 21.347]
  - - [1856, 960, 1, 512, 1856, 1856, 1856, 960]
    - [0, 21.452]
  - - [1984, 960, 1, 512, 1984, 1984, 1984, 960]
    - [0, 21.558]
  - - [2112, 960, 1, 512, 2112, 2112, 2112, 960]
    - [0, 21.746]
  - - [2240, 960, 1, 512, 2240, 2240, 2240, 960]
    - [0, 21.724]
  - - [2368, 960, 1, 512, 2368, 2368, 2368, 960]
    - [0, 21.863]
  - - [2496, 960, 1, 512, 2496, 2496, 2496, 960]
    - [0, 21.93]
  - - [2624, 960, 1, 512, 2624, 2624, 2624, 960]
    - [0, 21.946]
  - - [2752, 960, 1, 512, 2752, 2752, 2752, 960]
    - [0, 22.058]
  - - [2880, 960, 1, 512, 2880, 2880, 2880, 960]
    - [0, 22.135]
  - - [3008, 960, 1, 512, 3008, 3008, 3008, 960]
    - [0, 22.085]
  - - [3136, 960, 1, 512, 3136, 3136, 3136, 960]
    - [0, 22.255]
  - - [3264, 960, 1, 512, 3264, 3264, 3264, 960]
    - [0, 22.274]
  - - [3392, 960, 1, 512, 3392, 3392, 3392, 960]
    - [0, 22.306]
  - - [3520, 960, 1, 512, 3520, 3520, 3520, 960]
    - [0, 22.327]
  - - [3648, 960, 1, 512, 3648, 3648, 3648, 960]
    - [0, 22.427]
  - - [3776, 960, 1, 512, 3776, 3776, 3776, 960]
    - [0, 22.49]
  - - [3904, 960, 1, 512, 3904, 3904, 3904, 960]
    - [0, 22.386]
  - - [4032, 960, 1, 512, 4032, 4032, 4032, 960]
    - [2, 22.458]
  - - [64, 1088, 1, 512, 64, 64, 64, 1088]
    - [2, 9.292]
  - - [192, 1088, 1, 512, 192, 192, 192, 1088]
    - [0, 15.981]
  - - [320, 1088, 1, 512, 320, 320, 320, 1088]
    - [0, 17.805]
  - - [448, 1088, 1, 512, 448, 448, 448, 1088]
    - [0, 19.36]
  - - [576, 1088, 1, 512, 576, 576, 576, 1088]
    - [0, 19.963]
  - - [704, 1088, 1, 512, 704, 704, 704, 1088]
    - [0, 20.593]
  - - [832, 1088, 1, 512, 832, 832, 832, 1088]
    - [0, 20.961]
  - - [960, 1088, 1, 512, 960, 960, 960, 1088]
    - [0, 20.267]
  - - [1088, 1088, 1, 512, 1088, 1088, 1088, 1088]
    - [0, 20.541]
  - - [1216, 1088, 1, 512, 1216, 1216, 1216, 1088]
    - [0, 20.833]
  - - [1344, 1088, 1, 512, 1344, 1344, 1344, 1088]
    - [0, 21.059]
  - - [1472, 1088, 1, 512, 1472, 1472, 1472, 1088]
    - [0, 21.175]
  - - [1600, 1088, 1, 512, 1600, 1600, 1600, 1088]
    - [0, 21.454]
  - - [1728, 1088, 1, 512, 1728, 1728, 1728, 1088]
    - [0, 21.559]
  - - [1856, 1088, 1, 512, 1856, 1856, 1856, 1088]
    - [0, 21.621]
  - - [1984, 1088, 1, 512, 1984, 1984, 1984, 1088]
    - [0, 21.774]
  - - [2112, 1088, 1, 512, 2112, 2112, 2112, 1088]
    - [0, 21.879]
  - - [2240, 1088, 1, 512, 2240, 2240, 2240, 1088]
    - [0, 21.916]
  - - [2368, 1088, 1, 512, 2368, 2368, 2368, 1088]
    - [0, 21.921]
  - - [2496, 1088, 1, 512, 2496, 2496, 2496, 1088]
    - [0, 22.11]
  - - [2624, 1088, 1, 512, 2624, 2624, 2624, 1088]
    - [0, 22.066]
  - - [2752, 1088, 1, 512, 2752, 2752, 2752, 1088]
    - [0, 22.203]
  - - [2880, 1088, 1, 512, 2880, 2880, 2880, 1088]
    - [0, 22.324]
  - - [3008, 1088, 1, 512, 3008, 3008, 3008, 1088]
    - [0, 22.342]
  - - [3136, 1088, 1, 512, 3136, 3136, 3136, 1088]
    - [0, 22.332]
  - - [3264, 1088, 1, 512, 3264, 3264, 3264, 1088]
    - [0, 22.318]
  - - [3392, 1088, 1, 512, 3392, 3392, 3392, 1088]
    - [0, 22.385]
  - - [3520, 1088, 1, 512, 3520, 3520, 3520, 1088]
    - [0, 22.456]
  - - [3648, 1088, 1, 512, 3648, 3648, 3648, 1088]
    - [0, 22.505]
  - - [3776, 1088, 1, 512, 3776, 3776, 3776, 1088]
    - [0, 22.514]
  - - [3904, 1088, 1, 512, 3904, 3904, 3904, 1088]
    - [0, 22.574]
  - - [4032, 1088, 1, 512, 4032, 4032, 4032, 1088]
    - [0, 22.598]
  - - [64, 1216, 1, 512, 64, 64, 64, 1216]
    - [0, 10.353]
  - - [192, 1216, 1, 512, 192, 192, 192, 1216]
    - [0, 16.226]
  - - [320, 1216, 1, 512, 320, 320, 320, 1216]
    - [0, 18.494]
  - - [448, 1216, 1, 512, 448, 448, 448, 1216]
    - [0, 19.621]
  - - [576, 1216, 1, 512, 576, 576, 576, 1216]
    - [0, 20.387]
  - - [704, 1216, 1, 512, 704, 704, 704, 1216]
    - [0, 20.845]
  - - [832, 1216, 1, 512, 832, 832, 832, 1216]
    - [0, 20.154]
  - - [960, 1216, 1, 512, 960, 960, 960, 1216]
    - [0, 20.532]
  - - [1088, 1216, 1, 512, 1088, 1088, 1088, 1216]
    - [0, 20.781]
  - - [1216, 1216, 1, 512, 1216, 1216, 1216, 1216]
    - [0, 21.095]
  - - [1344, 1216, 1, 512, 1344, 1344, 1344, 1216]
    - [0, 21.256]
  - - [1472, 1216, 1, 512, 1472, 1472, 1472, 1216]
    - [0, 21.447]
  - - [1600, 1216, 1, 512, 1600, 1600, 1600, 1216]
    - [0, 21.611]
  - - [1728, 1216, 1, 512, 1728, 1728, 1728, 1216]
    - [0, 21.764]
  - - [1856, 1216, 1, 512, 1856, 1856, 1856, 1216]
    - [0, 21.892]
  - - [1984, 1216, 1, 512, 1984, 1984, 1984, 1216]
    - [0, 21.906]
  - - [2112, 1216, 1, 512, 2112, 2112, 2112, 1216]
    - [0, 22.04]
  - - [2240, 1216, 1, 512, 2240, 2240, 2240, 1216]
    - [0, 22.013]
  - - [2368, 1216, 1, 512, 2368, 2368, 2368, 1216]
    - [0, 22.16]
  - - [2496, 1216, 1, 512, 2496, 2496, 2496, 1216]
    - [0, 22.237]
  - - [2624, 1216, 1, 512, 2624, 2624, 2624, 1216]
    - [0, 22.246]
  - - [2752, 1216, 1, 512, 2752, 2752, 2752, 1216]
    - [0, 22.35]
  - - [2880, 1216, 1, 512, 2880, 2880, 2880, 1216]
    - [0, 22.311]
  - - [3008, 1216, 1, 512, 3008, 3008, 3008, 1216]
    - [0, 22.453]
  - - [3136, 1216, 1, 512, 3136, 3136, 3136, 1216]
    - [0, 22.42]
  - - [3264, 1216, 1, 512, 3264, 3264, 3264, 1216]
    - [0, 22.564]
  - - [3392, 1216, 1, 512, 3392, 3392, 3392, 1216]
    - [0, 22.517]
  - - [3520, 1216, 1, 512, 3520, 3520, 3520, 1216]
    - [0, 22.567]
  - - [3648, 1216, 1, 512, 3648, 3648, 3648, 1216]
    - [0, 22.593]
  - - [3776, 1216, 1, 512, 3776, 3776, 3776, 1216]
    - [0, 22.618]
  - - [3904, 1216, 1, 512, 3904, 3904, 3904, 1216]
    - [0, 22.693]
  - - [4032, 1216, 1, 512, 4032, 4032, 4032, 1216]
    - [0, 22.681]
  - - [64, 1344, 1, 512, 64, 64, 64, 1344]
    - [0, 11.443]
  - - [192, 1344, 1, 512, 192, 192, 192, 1344]
    - [0, 16.478]
  - - [320, 1344, 1, 512, 320, 320, 320, 1344]
    - [0, 19.164]
  - - [448, 1344, 1, 512, 448, 448, 448, 1344]
    - [0, 19.905]
  - - [576, 1344, 1, 512, 576, 576, 576, 1344]
    - [0, 20.546]
  - - [704, 1344, 1, 512, 704, 704, 704, 1344]
    - [0, 20.222]
  - - [832, 1344, 1, 512, 832, 832, 832, 1344]
    - [0, 20.427]
  - - [960, 1344, 1, 512, 960, 960, 960, 1344]
    - [0, 20.748]
  - - [1088, 1344, 1, 512, 1088, 1088, 1088, 1344]
    - [0, 21.034]
  - - [1216, 1344, 1, 512, 1216, 1216, 1216, 1344]
    - [0, 21.291]
  - - [1344, 1344, 1, 512, 1344, 1344, 1344, 1344]
    - [0, 21.413]
  - - [1472, 1344, 1, 512, 1472, 1472, 1472, 1344]
    - [0, 21.497]
  - - [1600, 1344, 1, 512, 1600, 1600, 1600, 1344]
    - [0, 21.688]
  - - [1728, 1344, 1, 512, 1728, 1728, 1728, 1344]
    - [0, 21.859]
  - - [1856, 1344, 1, 512, 1856, 1856, 1856, 1344]
    - [0, 21.929]
  - - [1984, 1344, 1, 512, 1984, 1984, 1984, 1344]
    - [0, 22.03]
  - - [2112, 1344, 1, 512, 2112, 2112, 2112, 1344]
    - [0, 22.18]
  - - [2240, 1344, 1, 512, 2240, 2240, 2240, 1344]
    - [0, 22.208]
  - - [2368, 1344, 1, 512, 2368, 2368, 2368, 1344]
    - [0, 22.307]
  - - [2496, 1344, 1, 512, 2496, 2496, 2496, 1344]
    - [0, 22.277]
  - - [2624, 1344, 1, 512, 2624, 2624, 2624, 1344]
    - [0, 22.375]
  - - [2752, 1344, 1, 512, 2752, 2752, 2752, 1344]
    - [0, 22.419]
  - - [2880, 1344, 1, 512, 2880, 2880, 2880, 1344]
    - [0, 22.459]
  - - [3008, 1344, 1, 512, 3008, 3008, 3008, 1344]
    - [2, 22.452]
  - - [3136, 1344, 1, 512, 3136, 3136, 3136, 1344]
    - [0, 22.53]
  - - [3264, 1344, 1, 512, 3264, 3264, 3264, 1344]
    - [0, 22.582]
  - - [3392, 1344, 1, 512, 3392, 3392, 3392, 1344]
    - [0, 22.545]
  - - [3520, 1344, 1, 512, 3520, 3520, 3520, 1344]
    - [0, 22.652]
  - - [3648, 1344, 1, 512, 3648, 3648, 3648, 1344]
    - [0, 22.691]
  - - [3776, 1344, 1, 512, 3776, 3776, 3776, 1344]
    - [0, 22.711]
  - - [3904, 1344, 1, 512, 3904, 3904, 3904, 1344]
    - [2, 22.701]
  - - [4032, 1344, 1, 512, 4032, 4032, 4032, 1344]
    - [0, 22.832]
  - - [64, 1472, 1, 512, 64, 64, 64, 1472]
    - [0, 10.761]
  - - [192, 1472, 1, 512, 192, 192, 192, 1472]
    - [0, 16.6]
  - - [320, 1472, 1, 512, 320, 320, 320, 1472]
    - [0, 18.945]
  - - [448, 1472, 1, 512, 448, 448, 448, 1472]
    - [0, 20.01]
  - - [576, 1472, 1, 512, 576, 576, 576, 1472]
    - [0, 20.868]
  - - [704, 1472, 1, 512, 704, 704, 704, 1472]
    - [0, 20.297]
  - - [832, 1472, 1, 512, 832, 832, 832, 1472]
    - [0, 20.6]
  - - [960, 1472, 1, 512, 960, 960, 960, 1472]
    - [0, 20.936]
  - - [1088, 1472, 1, 512, 1088, 1088, 1088, 1472]
    - [0, 21.244]
  - - [1216, 1472, 1, 512, 1216, 1216, 1216, 1472]
    - [0, 21.456]
  - - [1344, 1472, 1, 512, 1344, 1344, 1344, 1472]
    - [0, 21.634]
  - - [1472, 1472, 1, 512, 1472, 1472, 1472, 1472]
    - [0, 21.684]
  - - [1600, 1472, 1, 512, 1600, 1600, 1600, 1472]
    - [0, 21.874]
  - - [1728, 1472, 1, 512, 1728, 1728, 1728, 1472]
    - [0, 22.05]
  - - [1856, 1472, 1, 512, 1856, 1856, 1856, 1472]
    - [0, 22.067]
  - - [1984, 1472, 1, 512, 1984, 1984, 1984, 1472]
    - [0, 22.153]
  - - [2112, 1472, 1, 512, 2112, 2112, 2112, 1472]
    - [0, 22.295]
  - - [2240, 1472, 1, 512, 2240, 2240, 2240, 1472]
    - [0, 22.295]
  - - [2368, 1472, 1, 512, 2368, 2368, 2368, 1472]
    - [0, 22.39]
  - - [2496, 1472, 1, 512, 2496, 2496, 2496, 1472]
    - [0, 22.454]
  - - [2624, 1472, 1, 512, 2624, 2624, 2624, 1472]
    - [0, 22.47]
  - - [2752, 1472, 1, 512, 2752, 2752, 2752, 1472]
    - [0, 22.537]
  - - [2880, 1472, 1, 512, 2880, 2880, 2880, 1472]
    - [0, 22.608]
  - - [3008, 1472, 1, 512, 3008, 3008, 3008, 1472]
    - [0, 22.593]
  - - [3136, 1472, 1, 512, 3136, 3136, 3136, 1472]
    - [0, 22.609]
  - - [3264, 1472, 1, 512, 3264, 3264, 3264, 1472]
    - [0, 22.654]
  - - [3392, 1472, 1, 512, 3392, 3392, 3392, 1472]
    - [0, 22.719]
  - - [3520, 1472, 1, 512, 3520, 3520, 3520, 1472]
    - [0, 22.749]
  - - [3648, 1472, 1, 512, 3648, 3648, 3648, 1472]
    - [0, 22.694]
  - - [3776, 1472, 1, 512, 3776, 3776, 3776, 1472]
    - [0, 22.804]
  - - [3904, 1472, 1, 512, 3904, 3904, 3904, 1472]
    - [0, 22.846]
  - - [4032, 1472, 1, 512, 4032, 4032, 4032, 1472]
    - [0, 22.799]
  - - [64, 1600, 1, 512, 64, 64, 64, 1600]
    - [0, 11.654]
  - - [192, 1600, 1, 512, 192, 192, 192, 1600]
    - [0, 17.898]
  - - [320, 1600, 1, 512, 320, 320, 320, 1600]
    - [0, 19.371]
  - - [448, 1600, 1, 512, 448, 448, 448, 1600]
    - [0, 20.258]
  - - [576, 1600, 1, 512, 576, 576, 576, 1600]
    - [0, 21.052]
  - - [704, 1600, 1, 512, 704, 704, 704, 1600]
    - [0, 20.57]
  - - [832, 1600, 1, 512, 832, 832, 832, 1600]
    - [0, 20.824]
  - - [960, 1600, 1, 512, 960, 960, 960, 1600]
    - [0, 21.157]
  - - [1088, 1600, 1, 512, 1088, 1088, 1088, 1600]
    - [0, 21.353]
  - - [1216, 1600, 1, 512, 1216, 1216, 1216, 1600]
    - [0, 21.573]
  - - [1344, 1600, 1, 512, 1344, 1344, 1344, 1600]
    - [0, 21.767]
  - - [1472, 1600, 1, 512, 1472, 1472, 1472, 1600]
    - [0, 21.912]
  - - [1600, 1600, 1, 512, 1600, 1600, 1600, 1600]
    - [0, 22.03]
  - - [1728, 1600, 1, 512, 1728, 1728, 1728, 1600]
    - [0, 22.1]
  - - [1856, 1600, 1, 512, 1856, 1856, 1856, 1600]
    - [0, 22.176]
  - - [1984, 1600, 1, 512, 1984, 1984, 1984, 1600]
    - [0, 22.301]
  - - [2112, 1600, 1, 512, 2112, 2112, 2112, 1600]
    - [0, 22.366]
  - - [2240, 1600, 1, 512, 2240, 2240, 2240, 1600]
    - [0, 22.375]
  - - [2368, 1600, 1, 512, 2368, 2368, 2368, 1600]
    - [0, 22.475]
  - - [2496, 1600, 1, 512, 2496, 2496, 2496, 1600]
    - [0, 22.49]
  - - [2624, 1600, 1, 512, 2624, 2624, 2624, 1600]
    - [0, 22.491]
  - - [2752, 1600, 1, 512, 2752, 2752, 2752, 1600]
    - [0, 22.572]
  - - [2880, 1600, 1, 512, 2880, 2880, 2880, 1600]
    - [0, 22.603]
  - - [3008, 1600, 1, 512, 3008, 3008, 3008, 1600]
    - [0, 22.682]
  - - [3136, 1600, 1, 512, 3136, 3136, 3136, 1600]
    - [0, 22.675]
  - - [3264, 1600, 1, 512, 3264, 3264, 3264, 1600]
    - [0, 22.754]
  - - [3392, 1600, 1, 512, 3392, 3392, 3392, 1600]
    - [0, 22.732]
  - - [3520, 1600, 1, 512, 3520, 3520, 3520, 1600]
    - [0, 22.739]
  - - [3648, 1600, 1, 512, 3648, 3648, 3648, 1600]
    - [0, 22.79]
  - - [3776, 1600, 1, 512, 3776, 3776, 3776, 1600]
    - [0, 22.835]
  - - [3904, 1600, 1, 512, 3904, 3904, 3904, 1600]
    - [0, 22.8]
  - - [4032, 1600, 1, 512, 4032, 4032, 4032, 1600]
    - [0, 22.913]
  - - [64, 1728, 1, 512, 64, 64, 64, 1728]
    - [0, 12.536]
  - - [192, 1728, 1, 512, 192, 192, 192, 1728]
    - [0, 17.938]
  - - [320, 1728, 1, 512, 320, 320, 320, 1728]
    - [0, 19.82]
  - - [448, 1728, 1, 512, 448, 448, 448, 1728]
    - [0, 20.493]
  - - [576, 1728, 1, 512, 576, 576, 576, 1728]
    - [0, 20.007]
  - - [704, 1728, 1, 512, 704, 704, 704, 1728]
    - [0, 20.632]
  - - [832, 1728, 1, 512, 832, 832, 832, 1728]
    - [0, 20.94]
  - - [960, 1728, 1, 512, 960, 960, 960, 1728]
    - [0, 21.313]
  - - [1088, 1728, 1, 512, 1088, 1088, 1088, 1728]
    - [0, 21.545]
  - - [1216, 1728, 1, 512, 1216, 1216, 1216, 1728]
    - [0, 21.696]
  - - [1344, 1728, 1, 512, 1344, 1344, 1344, 1728]
    - [0, 21.882]
  - - [1472, 1728, 1, 512, 1472, 1472, 1472, 1728]
    - [0, 21.984]
  - - [1600, 1728, 1, 512, 1600, 1600, 1600, 1728]
    - [0, 22.114]
  - - [1728, 1728, 1, 512, 1728, 1728, 1728, 1728]
    - [0, 22.208]
  - - [1856, 1728, 1, 512, 1856, 1856, 1856, 1728]
    - [0, 22.266]
  - - [1984, 1728, 1, 512, 1984, 1984, 1984, 1728]
    - [0, 22.323]
  - - [2112, 1728, 1, 512, 2112, 2112, 2112, 1728]
    - [0, 22.441]
  - - [2240, 1728, 1, 512, 2240, 2240, 2240, 1728]
    - [0, 22.519]
  - - [2368, 1728, 1, 512, 2368, 2368, 2368, 1728]
    - [0, 22.5]
  - - [2496, 1728, 1, 512, 2496, 2496, 2496, 1728]
    - [0, 22.541]
  - - [2624, 1728, 1, 512, 2624, 2624, 2624, 1728]
    - [0, 22.63]
  - - [2752, 1728, 1, 512, 2752, 2752, 2752, 1728]
    - [0, 22.669]
  - - [2880, 1728, 1, 512, 2880, 2880, 2880, 1728]
    - [0, 22.729]
  - - [3008, 1728, 1, 512, 3008, 3008, 3008, 1728]
    - [0, 22.746]
  - - [3136, 1728, 1, 512, 3136, 3136, 3136, 1728]
    - [0, 22.781]
  - - [3264, 1728, 1, 512, 3264, 3264, 3264, 1728]
    - [0, 22.773]
  - - [3392, 1728, 1, 512, 3392, 3392, 3392, 1728]
    - [0, 22.78]
  - - [3520, 1728, 1, 512, 3520, 3520, 3520, 1728]
    - [0, 22.818]
  - - [3648, 1728, 1, 512, 3648, 3648, 3648, 1728]
    - [0, 22.816]
  - - [3776, 1728, 1, 512, 3776, 3776, 3776, 1728]
    - [0, 22.851]
  - - [3904, 1728, 1, 512, 3904, 3904, 3904, 1728]
    - [0, 22.932]
  - - [4032, 1728, 1, 512, 4032, 4032, 4032, 1728]
    - [0, 22.869]
  - - [64, 1856, 1, 512, 64, 64, 64, 1856]
    - [0, 13.476]
  - - [192, 1856, 1, 512, 192, 192, 192, 1856]
    - [0, 18.017]
  - - [320, 1856, 1, 512, 320, 320, 320, 1856]
    - [0, 19.847]
  - - [448, 1856, 1, 512, 448, 448, 448, 1856]
    - [0, 20.643]
  - - [576, 1856, 1, 512, 576, 576, 576, 1856]
    - [0, 20.232]
  - - [704, 1856, 1, 512, 704, 704, 704, 1856]
    - [0, 20.846]
  - - [832, 1856, 1, 512, 832, 832, 832, 1856]
    - [0, 21.148]
  - - [960, 1856, 1, 512, 960, 960, 960, 1856]
    - [0, 21.387]
  - - [1088, 1856, 1, 512, 1088, 1088, 1088, 1856]
    - [0, 21.703]
  - - [1216, 1856, 1, 512, 1216, 1216, 1216, 1856]
    - [0, 21.799]
  - - [1344, 1856, 1, 512, 1344, 1344, 1344, 1856]
    - [0, 22.036]
  - - [1472, 1856, 1, 512, 1472, 1472, 1472, 1856]
    - [0, 22.116]
  - - [1600, 1856, 1, 512, 1600, 1600, 1600, 1856]
    - [0, 22.201]
  - - [1728, 1856, 1, 512, 1728, 1728, 1728, 1856]
    - [0, 22.313]
  - - [1856, 1856, 1, 512, 1856, 1856, 1856, 1856]
    - [0, 22.339]
  - - [1984, 1856, 1, 512, 1984, 1984, 1984, 1856]
    - [0, 22.423]
  - - [2112, 1856, 1, 512, 2112, 2112, 2112, 1856]
    - [0, 22.515]
  - - [2240, 1856, 1, 512, 2240, 2240, 2240, 1856]
    - [0, 22.58]
  - - [2368, 1856, 1, 512, 2368, 2368, 2368, 1856]
    - [0, 22.532]
  - - [2496, 1856, 1, 512, 2496, 2496, 2496, 1856]
    - [0, 22.635]
  - - [2624, 1856, 1, 512, 2624, 2624, 2624, 1856]
    - [0, 22.7]
  - - [2752, 1856, 1, 512, 2752, 2752, 2752, 1856]
    - [0, 22.732]
  - - [2880, 1856, 1, 512, 2880, 2880, 2880, 1856]
    - [0, 22.757]
  - - [3008, 1856, 1, 512, 3008, 3008, 3008, 1856]
    - [0, 22.79]
  - - [3136, 1856, 1, 512, 3136, 3136, 3136, 1856]
    - [0, 22.726]
  - - [3264, 1856, 1, 512, 3264, 3264, 3264, 1856]
    - [0, 22.837]
  - - [3392, 1856, 1, 512, 3392, 3392, 3392, 1856]
    - [0, 22.87]
  - - [3520, 1856, 1, 512, 3520, 3520, 3520, 1856]
    - [0, 22.845]
  - - [3648, 1856, 1, 512, 3648, 3648, 3648, 1856]
    - [0, 22.923]
  - - [3776, 1856, 1, 512, 3776, 3776, 3776, 1856]
    - [0, 22.897]
  - - [3904, 1856, 1, 512, 3904, 3904, 3904, 1856]
    - [0, 22.913]
  - - [4032, 1856, 1, 512, 4032, 4032, 4032, 1856]
    - [0, 23.013]
  - - [64, 1984, 1, 512, 64, 64, 64, 1984]
    - [0, 12.593]
  - - [192, 1984, 1, 512, 192, 192, 192, 1984]
    - [0, 18.171]
  - - [320, 1984, 1, 512, 320, 320, 320, 1984]
    - [0, 20.065]
  - - [448, 1984, 1, 512, 448, 448, 448, 1984]
    - [0, 20.875]
  - - [576, 1984, 1, 512, 576, 576, 576, 1984]
    - [0, 20.475]
  - - [704, 1984, 1, 512, 704, 704, 704, 1984]
    - [0, 20.837]
  - - [832, 1984, 1, 512, 832, 832, 832, 1984]
    - [0, 21.387]
  - - [960, 1984, 1, 512, 960, 960, 960, 1984]
    - [0, 21.592]
  - - [1088, 1984, 1, 512, 1088, 1088, 1088, 1984]
    - [0, 21.789]
  - - [1216, 1984, 1, 512, 1216, 1216, 1216, 1984]
    - [0, 21.947]
  - - [1344, 1984, 1, 512, 1344, 1344, 1344, 1984]
    - [0, 22.068]
  - - [1472, 1984, 1, 512, 1472, 1472, 1472, 1984]
    - [0, 22.22]
  - - [1600, 1984, 1, 512, 1600, 1600, 1600, 1984]
    - [0, 22.313]
  - - [1728, 1984, 1, 512, 1728, 1728, 1728, 1984]
    - [0, 22.352]
  - - [1856, 1984, 1, 512, 1856, 1856, 1856, 1984]
    - [0, 22.445]
  - - [1984, 1984, 1, 512, 1984, 1984, 1984, 1984]
    - [0, 22.505]
  - - [2112, 1984, 1, 512, 2112, 2112, 2112, 1984]
    - [0, 22.491]
  - - [2240, 1984, 1, 512, 2240, 2240, 2240, 1984]
    - [0, 22.594]
  - - [2368, 1984, 1, 512, 2368, 2368, 2368, 1984]
    - [0, 22.629]
  - - [2496, 1984, 1, 512, 2496, 2496, 2496, 1984]
    - [0, 22.752]
  - - [2624, 1984, 1, 512, 2624, 2624, 2624, 1984]
    - [0, 22.712]
  - - [2752, 1984, 1, 512, 2752, 2752, 2752, 1984]
    - [0, 22.801]
  - - [2880, 1984, 1, 512, 2880, 2880, 2880, 1984]
    - [0, 22.86]
  - - [3008, 1984, 1, 512, 3008, 3008, 3008, 1984]
    - [2, 22.75]
  - - [3136, 1984, 1, 512, 3136, 3136, 3136, 1984]
    - [0, 22.814]
  - - [3264, 1984, 1, 512, 3264, 3264, 3264, 1984]
    - [0, 22.794]
  - - [3392, 1984, 1, 512, 3392, 3392, 3392, 1984]
    - [0, 22.932]
  - - [3520, 1984, 1, 512, 3520, 3520, 3520, 1984]
    - [0, 22.885]
  - - [3648, 1984, 1, 512, 3648, 3648, 3648, 1984]
    - [0, 22.912]
  - - [3776, 1984, 1, 512, 3776, 3776, 3776, 1984]
    - [2, 22.49]
  - - [3904, 1984, 1, 512, 3904, 3904, 3904, 1984]
    - [2, 22.533]
  - - [4032, 1984, 1, 512, 4032, 4032, 4032, 1984]
    - [0, 22.625]
  - - [64, 2112, 1, 512, 64, 64, 64, 2112]
    - [0, 13.303]
  - - [192, 2112, 1, 512, 192, 192, 192, 2112]
    - [0, 18.422]
  - - [320, 2112, 1, 512, 320, 320, 320, 2112]
    - [0, 20.358]
  - - [448, 2112, 1, 512, 448, 448, 448, 2112]
    - [2, 19.279]
  - - [576, 2112, 1, 512, 576, 576, 576, 2112]
    - [0, 20.606]
  - - [704, 2112, 1, 512, 704, 704, 704, 2112]
    - [0, 21.144]
  - - [832, 2112, 1, 512, 832, 832, 832, 2112]
    - [0, 21.416]
  - - [960, 2112, 1, 512, 960, 960, 960, 2112]
    - [0, 21.638]
  - - [1088, 2112, 1, 512, 1088, 1088, 1088, 2112]
    - [0, 21.858]
  - - [1216, 2112, 1, 512, 1216, 1216, 1216, 2112]
    - [0, 22.013]
  - - [1344, 2112, 1, 512, 1344, 1344, 1344, 2112]
    - [0, 22.163]
  - - [1472, 2112, 1, 512, 1472, 1472, 1472, 2112]
    - [0, 22.222]
  - - [1600, 2112, 1, 512, 1600, 1600, 1600, 2112]
    - [0, 22.376]
  - - [1728, 2112, 1, 512, 1728, 1728, 1728, 2112]
    - [0, 22.415]
  - - [1856, 2112, 1, 512, 1856, 1856, 1856, 2112]
    - [0, 22.489]
  - - [1984, 2112, 1, 512, 1984, 1984, 1984, 2112]
    - [0, 22.561]
  - - [2112, 2112, 1, 512, 2112, 2112, 2112, 2112]
    - [0, 22.576]
  - - [2240, 2112, 1, 512, 2240, 2240, 2240, 2112]
    - [0, 22.59]
  - - [2368, 2112, 1, 512, 2368, 2368, 2368, 2112]
    - [0, 22.672]
  - - [2496, 2112, 1, 512, 2496, 2496, 2496, 2112]
    - [0, 22.743]
  - - [2624, 2112, 1, 512, 2624, 2624, 2624, 2112]
    - [0, 22.739]
  - - [2752, 2112, 1, 512, 2752, 2752, 2752, 2112]
    - [0, 22.794]
  - - [2880, 2112, 1, 512, 2880, 2880, 2880, 2112]
    - [0, 22.85]
  - - [3008, 2112, 1, 512, 3008, 3008, 3008, 2112]
    - [0, 22.885]
  - - [3136, 2112, 1, 512, 3136, 3136, 3136, 2112]
    - [0, 22.878]
  - - [3264, 2112, 1, 512, 3264, 3264, 3264, 2112]
    - [0, 22.97]
  - - [3392, 2112, 1, 512, 3392, 3392, 3392, 2112]
    - [0, 22.987]
  - - [3520, 2112, 1, 512, 3520, 3520, 3520, 2112]
    - [0, 22.983]
  - - [3648, 2112, 1, 512, 3648, 3648, 3648, 2112]
    - [0, 22.634]
  - - [3776, 2112, 1, 512, 3776, 3776, 3776, 2112]
    - [0, 22.561]
  - - [3904, 2112, 1, 512, 3904, 3904, 3904, 2112]
    - [0, 22.603]
  - - [4032, 2112, 1, 512, 4032, 4032, 4032, 2112]
    - [0, 22.686]
  - - [64, 2240, 1, 512, 64, 64, 64, 2240]
    - [0, 13.985]
  - - [192, 2240, 1, 512, 192, 192, 192, 2240]
    - [0, 19.116]
  - - [320, 2240, 1, 512, 320, 320, 320, 2240]
    - [0, 20.36]
  - - [448, 2240, 1, 512, 448, 448, 448, 2240]
    - [0, 20.156]
  - - [576, 2240, 1, 512, 576, 576, 576, 2240]
    - [0, 20.718]
  - - [704, 2240, 1, 512, 704, 704, 704, 2240]
    - [0, 21.223]
  - - [832, 2240, 1, 512, 832, 832, 832, 2240]
    - [0, 21.515]
  - - [960, 2240, 1, 512, 960, 960, 960, 2240]
    - [0, 21.722]
  - - [1088, 2240, 1, 512, 1088, 1088, 1088, 2240]
    - [0, 21.924]
  - - [1216, 2240, 1, 512, 1216, 1216, 1216, 2240]
    - [0, 22.126]
  - - [1344, 2240, 1, 512, 1344, 1344, 1344, 2240]
    - [0, 22.2]
  - - [1472, 2240, 1, 512, 1472, 1472, 1472, 2240]
    - [0, 22.357]
  - - [1600, 2240, 1, 512, 1600, 1600, 1600, 2240]
    - [0, 22.384]
  - - [1728, 2240, 1, 512, 1728, 1728, 1728, 2240]
    - [0, 22.477]
  - - [1856, 2240, 1, 512, 1856, 1856, 1856, 2240]
    - [0, 22.563]
  - - [1984, 2240, 1, 512, 1984, 1984, 1984, 2240]
    - [0, 22.619]
  - - [2112, 2240, 1, 512, 2112, 2112, 2112, 2240]
    - [0, 22.635]
  - - [2240, 2240, 1, 512, 2240, 2240, 2240, 2240]
    - [0, 22.768]
  - - [2368, 2240, 1, 512, 2368, 2368, 2368, 2240]
    - [0, 22.765]
  - - [2496, 2240, 1, 512, 2496, 2496, 2496, 2240]
    - [0, 22.792]
  - - [2624, 2240, 1, 512, 2624, 2624, 2624, 2240]
    - [0, 22.838]
  - - [2752, 2240, 1, 512, 2752, 2752, 2752, 2240]
    - [0, 22.865]
  - - [2880, 2240, 1, 512, 2880, 2880, 2880, 2240]
    - [0, 22.913]
  - - [3008, 2240, 1, 512, 3008, 3008, 3008, 2240]
    - [0, 22.915]
  - - [3136, 2240, 1, 512, 3136, 3136, 3136, 2240]
    - [0, 22.894]
  - - [3264, 2240, 1, 512, 3264, 3264, 3264, 2240]
    - [0, 22.946]
  - - [3392, 2240, 1, 512, 3392, 3392, 3392, 2240]
    - [0, 22.671]
  - - [3520, 2240, 1, 512, 3520, 3520, 3520, 2240]
    - [0, 22.606]
  - - [3648, 2240, 1, 512, 3648, 3648, 3648, 2240]
    - [0, 22.597]
  - - [3776, 2240, 1, 512, 3776, 3776, 3776, 2240]
    - [0, 22.658]
  - - [3904, 2240, 1, 512, 3904, 3904, 3904, 2240]
    - [0, 22.62]
  - - [4032, 2240, 1, 512, 4032, 4032, 4032, 2240]
    - [0, 22.665]
  - - [64, 2368, 1, 512, 64, 64, 64, 2368]
    - [0, 14.814]
  - - [192, 2368, 1, 512, 192, 192, 192, 2368]
    - [0, 19.122]
  - - [320, 2368, 1, 512, 320, 320, 320, 2368]
    - [0, 20.549]
  - - [448, 2368, 1, 512, 448, 448, 448, 2368]
    - [0, 20.156]
  - - [576, 2368, 1, 512, 576, 576, 576, 2368]
    - [0, 20.862]
  - - [704, 2368, 1, 512, 704, 704, 704, 2368]
    - [0, 21.314]
  - - [832, 2368, 1, 512, 832, 832, 832, 2368]
    - [0, 21.565]
  - - [960, 2368, 1, 512, 960, 960, 960, 2368]
    - [0, 21.837]
  - - [1088, 2368, 1, 512, 1088, 1088, 1088, 2368]
    - [0, 22.031]
  - - [1216, 2368, 1, 512, 1216, 1216, 1216, 2368]
    - [0, 22.129]
  - - [1344, 2368, 1, 512, 1344, 1344, 1344, 2368]
    - [0, 22.275]
  - - [1472, 2368, 1, 512, 1472, 1472, 1472, 2368]
    - [0, 22.333]
  - - [1600, 2368, 1, 512, 1600, 1600, 1600, 2368]
    - [0, 22.471]
  - - [1728, 2368, 1, 512, 1728, 1728, 1728, 2368]
    - [0, 22.536]
  - - [1856, 2368, 1, 512, 1856, 1856, 1856, 2368]
    - [0, 22.604]
  - - [1984, 2368, 1, 512, 1984, 1984, 1984, 2368]
    - [2, 22.632]
  - - [2112, 2368, 1, 512, 2112, 2112, 2112, 2368]
    - [0, 22.745]
  - - [2240, 2368, 1, 512, 2240, 2240, 2240, 2368]
    - [0, 22.733]
  - - [2368, 2368, 1, 512, 2368, 2368, 2368, 2368]
    - [0, 22.822]
  - - [2496, 2368, 1, 512, 2496, 2496, 2496, 2368]
    - [0, 22.831]
  - - [2624, 2368, 1, 512, 2624, 2624, 2624, 2368]
    - [0, 22.863]
  - - [2752, 2368, 1, 512, 2752, 2752, 2752, 2368]
    - [0, 22.895]
  - - [2880, 2368, 1, 512, 2880, 2880, 2880, 2368]
    - [0, 22.844]
  - - [3008, 2368, 1, 512, 3008, 3008, 3008, 2368]
    - [0, 22.939]
  - - [3136, 2368, 1, 512, 3136, 3136, 3136, 2368]
    - [0, 22.924]
  - - [3264, 2368, 1, 512, 3264, 3264, 3264, 2368]
    - [0, 22.607]
  - - [3392, 2368, 1, 512, 3392, 3392, 3392, 2368]
    - [0, 22.598]
  - - [3520, 2368, 1, 512, 3520, 3520, 3520, 2368]
    - [0, 22.608]
  - - [3648, 2368, 1, 512, 3648, 3648, 3648, 2368]
    - [0, 22.701]
  - - [3776, 2368, 1, 512, 3776, 3776, 3776, 2368]
    - [0, 22.699]
  - - [3904, 2368, 1, 512, 3904, 3904, 3904, 2368]
    - [0, 22.69]
  - - [4032, 2368, 1, 512, 4032, 4032, 4032, 2368]
    - [0, 22.752]
  - - [64, 2496, 1, 512, 64, 64, 64, 2496]
    - [2, 14.142]
  - - [192, 2496, 1, 512, 192, 192, 192, 2496]
    - [0, 19.149]
  - - [320, 2496, 1, 512, 320, 320, 320, 2496]
    - [0, 20.722]
  - - [448, 2496, 1, 512, 448, 448, 448, 2496]
    - [0, 20.402]
  - - [576, 2496, 1, 512, 576, 576, 576, 2496]
    - [0, 20.944]
  - - [704, 2496, 1, 512, 704, 704, 704, 2496]
    - [0, 21.428]
  - - [832, 2496, 1, 512, 832, 832, 832, 2496]
    - [0, 21.714]
  - - [960, 2496, 1, 512, 960, 960, 960, 2496]
    - [0, 21.943]
  - - [1088, 2496, 1, 512, 1088, 1088, 1088, 2496]
    - [0, 22.086]
  - - [1216, 2496, 1, 512, 1216, 1216, 1216, 2496]
    - [0, 22.22]
  - - [1344, 2496, 1, 512, 1344, 1344, 1344, 2496]
    - [2, 22.267]
  - - [1472, 2496, 1, 512, 1472, 1472, 1472, 2496]
    - [0, 22.438]
  - - [1600, 2496, 1, 512, 1600, 1600, 1600, 2496]
    - [0, 22.52]
  - - [1728, 2496, 1, 512, 1728, 1728, 1728, 2496]
    - [0, 22.622]
  - - [1856, 2496, 1, 512, 1856, 1856, 1856, 2496]
    - [0, 22.633]
  - - [1984, 2496, 1, 512, 1984, 1984, 1984, 2496]
    - [0, 22.745]
  - - [2112, 2496, 1, 512, 2112, 2112, 2112, 2496]
    - [2, 22.719]
  - - [2240, 2496, 1, 512, 2240, 2240, 2240, 2496]
    - [0, 22.8]
  - - [2368, 2496, 1, 512, 2368, 2368, 2368, 2496]
    - [0, 22.801]
  - - [2496, 2496, 1, 512, 2496, 2496, 2496, 2496]
    - [0, 22.871]
  - - [2624, 2496, 1, 512, 2624, 2624, 2624, 2496]
    - [0, 22.856]
  - - [2752, 2496, 1, 512, 2752, 2752, 2752, 2496]
    - [0, 22.948]
  - - [2880, 2496, 1, 512, 2880, 2880, 2880, 2496]
    - [0, 22.881]
  - - [3008, 2496, 1, 512, 3008, 3008, 3008, 2496]
    - [0, 22.536]
  - - [3136, 2496, 1, 512, 3136, 3136, 3136, 2496]
    - [0, 22.594]
  - - [3264, 2496, 1, 512, 3264, 3264, 3264, 2496]
    - [0, 22.665]
  - - [3392, 2496, 1, 512, 3392, 3392, 3392, 2496]
    - [0, 22.582]
  - - [3520, 2496, 1, 512, 3520, 3520, 3520, 2496]
    - [0, 22.66]
  - - [3648, 2496, 1, 512, 3648, 3648, 3648, 2496]
    - [0, 22.654]
  - - [3776, 2496, 1, 512, 3776, 3776, 3776, 2496]
    - [0, 22.689]
  - - [3904, 2496, 1, 512, 3904, 3904, 3904, 2496]
    - [0, 22.768]
  - - [4032, 2496, 1, 512, 4032, 4032, 4032, 2496]
    - [0, 22.761]
  - - [64, 2624, 1, 512, 64, 64, 64, 2624]
    - [0, 14.507]
  - - [192, 2624, 1, 512, 192, 192, 192, 2624]
    - [0, 19.225]
  - - [320, 2624, 1, 512, 320, 320, 320, 2624]
    - [0, 20.743]
  - - [448, 2624, 1, 512, 448, 448, 448, 2624]
    - [0, 20.591]
  - - [576, 2624, 1, 512, 576, 576, 576, 2624]
    - [0, 21.114]
  - - [704, 2624, 1, 512, 704, 704, 704, 2624]
    - [0, 21.497]
  - - [832, 2624, 1, 512, 832, 832, 832, 2624]
    - [0, 21.755]
  - - [960, 2624, 1, 512, 960, 960, 960, 2624]
    - [0, 22.024]
  - - [1088, 2624, 1, 512, 1088, 1088, 1088, 2624]
    - [0, 22.034]
  - - [1216, 2624, 1, 512, 1216, 1216, 1216, 2624]
    - [0, 22.314]
  - - [1344, 2624, 1, 512, 1344, 1344, 1344, 2624]
    - [0, 22.436]
  - - [1472, 2624, 1, 512, 1472, 1472, 1472, 2624]
    - [0, 22.386]
  - - [1600, 2624, 1, 512, 1600, 1600, 1600, 2624]
    - [0, 22.49]
  - - [1728, 2624, 1, 512, 1728, 1728, 1728, 2624]
    - [0, 22.644]
  - - [1856, 2624, 1, 512, 1856, 1856, 1856, 2624]
    - [0, 22.695]
  - - [1984, 2624, 1, 512, 1984, 1984, 1984, 2624]
    - [0, 22.696]
  - - [2112, 2624, 1, 512, 2112, 2112, 2112, 2624]
    - [0, 22.771]
  - - [2240, 2624, 1, 512, 2240, 2240, 2240, 2624]
    - [0, 22.807]
  - - [2368, 2624, 1, 512, 2368, 2368, 2368, 2624]
    - [0, 22.862]
  - - [2496, 2624, 1, 512, 2496, 2496, 2496, 2624]
    - [0, 22.901]
  - - [2624, 2624, 1, 512, 2624, 2624, 2624, 2624]
    - [0, 22.83]
  - - [2752, 2624, 1, 512, 2752, 2752, 2752, 2624]
    - [0, 23.027]
  - - [2880, 2624, 1, 512, 2880, 2880, 2880, 2624]
    - [0, 22.54]
  - - [3008, 2624, 1, 512, 3008, 3008, 3008, 2624]
    - [0, 22.581]
  - - [3136, 2624, 1, 512, 3136, 3136, 3136, 2624]
    - [0, 22.63]
  - - [3264, 2624, 1, 512, 3264, 3264, 3264, 2624]
    - [0, 22.642]
  - - [3392, 2624, 1, 512, 3392, 3392, 3392, 2624]
    - [0, 22.576]
  - - [3520, 2624, 1, 512, 3520, 3520, 3520, 2624]
    - [0, 22.757]
  - - [3648, 2624, 1, 512, 3648, 3648, 3648, 2624]
    - [0, 22.751]
  - - [3776, 2624, 1, 512, 3776, 3776, 3776, 2624]
    - [0, 22.733]
  - - [3904, 2624, 1, 512, 3904, 3904, 3904, 2624]
    - [0, 22.716]
  - - [4032, 2624, 1, 512, 4032, 4032, 4032, 2624]
    - [0, 22.755]
  - - [64, 2752, 1, 512, 64, 64, 64, 2752]
    - [0, 15.184]
  - - [192, 2752, 1, 512, 192, 192, 192, 2752]
    - [0, 19.236]
  - - [320, 2752, 1, 512, 320, 320, 320, 2752]
    - [0, 20.816]
  - - [448, 2752, 1, 512, 448, 448, 448, 2752]
    - [0, 20.626]
  - - [576, 2752, 1, 512, 576, 576, 576, 2752]
    - [0, 21.179]
  - - [704, 2752, 1, 512, 704, 704, 704, 2752]
    - [0, 21.519]
  - - [832, 2752, 1, 512, 832, 832, 832, 2752]
    - [0, 21.825]
  - - [960, 2752, 1, 512, 960, 960, 960, 2752]
    - [0, 21.935]
  - - [1088, 2752, 1, 512, 1088, 1088, 1088, 2752]
    - [0, 22.227]
  - - [1216, 2752, 1, 512, 1216, 1216, 1216, 2752]
    - [0, 22.329]
  - - [1344, 2752, 1, 512, 1344, 1344, 1344, 2752]
    - [0, 22.406]
  - - [1472, 2752, 1, 512, 1472, 1472, 1472, 2752]
    - [0, 22.553]
  - - [1600, 2752, 1, 512, 1600, 1600, 1600, 2752]
    - [0, 22.595]
  - - [1728, 2752, 1, 512, 1728, 1728, 1728, 2752]
    - [0, 22.688]
  - - [1856, 2752, 1, 512, 1856, 1856, 1856, 2752]
    - [0, 22.757]
  - - [1984, 2752, 1, 512, 1984, 1984, 1984, 2752]
    - [0, 22.746]
  - - [2112, 2752, 1, 512, 2112, 2112, 2112, 2752]
    - [0, 22.788]
  - - [2240, 2752, 1, 512, 2240, 2240, 2240, 2752]
    - [0, 22.797]
  - - [2368, 2752, 1, 512, 2368, 2368, 2368, 2752]
    - [0, 22.915]
  - - [2496, 2752, 1, 512, 2496, 2496, 2496, 2752]
    - [0, 22.962]
  - - [2624, 2752, 1, 512, 2624, 2624, 2624, 2752]
    - [0, 22.91]
  - - [2752, 2752, 1, 512, 2752, 2752, 2752, 2752]
    - [0, 22.662]
  - - [2880, 2752, 1, 512, 2880, 2880, 2880, 2752]
    - [0, 22.595]
  - - [3008, 2752, 1, 512, 3008, 3008, 3008, 2752]
    - [0, 22.641]
  - - [3136, 2752, 1, 512, 3136, 3136, 3136, 2752]
    - [0, 22.668]
  - - [3264, 2752, 1, 512, 3264, 3264, 3264, 2752]
    - [0, 22.636]
  - - [3392, 2752, 1, 512, 3392, 3392, 3392, 2752]
    - [0, 22.688]
  - - [3520, 2752, 1, 512, 3520, 3520, 3520, 2752]
    - [0, 22.686]
  - - [3648, 2752, 1, 512, 3648, 3648, 3648, 2752]
    - [0, 22.741]
  - - [3776, 2752, 1, 512, 3776, 3776, 3776, 2752]
    - [0, 22.777]
  - - [3904, 2752, 1, 512, 3904, 3904, 3904, 2752]
    - [0, 22.811]
  - - [4032, 2752, 1, 512, 4032, 4032, 4032, 2752]
    - [0, 22.834]
  - - [64, 2880, 1, 512, 64, 64, 64, 2880]
    - [0, 15.813]
  - - [192, 2880, 1, 512, 192, 192, 192, 2880]
    - [0, 19.829]
  - - [320, 2880, 1, 512, 320, 320, 320, 2880]
    - [0, 21.012]
  - - [448, 2880, 1, 512, 448, 448, 448, 2880]
    - [0, 20.78]
  - - [576, 2880, 1, 512, 576, 576, 576, 2880]
    - [0, 21.235]
  - - [704, 2880, 1, 512, 704, 704, 704, 2880]
    - [0, 21.665]
  - - [832, 2880, 1, 512, 832, 832, 832, 2880]
    - [0, 22.006]
  - - [960, 2880, 1, 512, 960, 960, 960, 2880]
    - [0, 22.082]
  - - [1088, 2880, 1, 512, 1088, 1088, 1088, 2880]
    - [0, 22.27]
  - - [1216, 2880, 1, 512, 1216, 1216, 1216, 2880]
    - [0, 22.38]
  - - [1344, 2880, 1, 512, 1344, 1344, 1344, 2880]
    - [0, 22.503]
  - - [1472, 2880, 1, 512, 1472, 1472, 1472, 2880]
    - [0, 22.576]
  - - [1600, 2880, 1, 512, 1600, 1600, 1600, 2880]
    - [0, 22.618]
  - - [1728, 2880, 1, 512, 1728, 1728, 1728, 2880]
    - [0, 22.752]
  - - [1856, 2880, 1, 512, 1856, 1856, 1856, 2880]
    - [0, 22.733]
  - - [1984, 2880, 1, 512, 1984, 1984, 1984, 2880]
    - [0, 22.815]
  - - [2112, 2880, 1, 512, 2112, 2112, 2112, 2880]
    - [0, 22.836]
  - - [2240, 2880, 1, 512, 2240, 2240, 2240, 2880]
    - [0, 22.881]
  - - [2368, 2880, 1, 512, 2368, 2368, 2368, 2880]
    - [0, 22.848]
  - - [2496, 2880, 1, 512, 2496, 2496, 2496, 2880]
    - [0, 22.966]
  - - [2624, 2880, 1, 512, 2624, 2624, 2624, 2880]
    - [0, 22.605]
  - - [2752, 2880, 1, 512, 2752, 2752, 2752, 2880]
    - [0, 22.596]
  - - [2880, 2880, 1, 512, 2880, 2880, 2880, 2880]
    - [0, 22.635]
  - - [3008, 2880, 1, 512, 3008, 3008, 3008, 2880]
    - [0, 22.633]
  - - [3136, 2880, 1, 512, 3136, 3136, 3136, 2880]
    - [0, 22.694]
  - - [3264, 2880, 1, 512, 3264, 3264, 3264, 2880]
    - [0, 22.689]
  - - [3392, 2880, 1, 512, 3392, 3392, 3392, 2880]
    - [0, 22.76]
  - - [3520, 2880, 1, 512, 3520, 3520, 3520, 2880]
    - [0, 22.775]
  - - [3648, 2880, 1, 512, 3648, 3648, 3648, 2880]
    - [0, 22.803]
  - - [3776, 2880, 1, 512, 3776, 3776, 3776, 2880]
    - [0, 22.791]
  - - [3904, 2880, 1, 512, 3904, 3904, 3904, 2880]
    - [0, 22.82]
  - - [4032, 2880, 1, 512, 4032, 4032, 4032, 2880]
    - [0, 22.836]
  - - [64, 3008, 1, 512, 64, 64, 64, 3008]
    - [0, 14.99]
  - - [192, 3008, 1, 512, 192, 192, 192, 3008]
    - [0, 19.827]
  - - [320, 3008, 1, 512, 320, 320, 320, 3008]
    - [0, 19.363]
  - - [448, 3008, 1, 512, 448, 448, 448, 3008]
    - [0, 20.821]
  - - [576, 3008, 1, 512, 576, 576, 576, 3008]
    - [0, 21.431]
  - - [704, 3008, 1, 512, 704, 704, 704, 3008]
    - [0, 21.73]
  - - [832, 3008, 1, 512, 832, 832, 832, 3008]
    - [0, 21.903]
  - - [960, 3008, 1, 512, 960, 960, 960, 3008]
    - [0, 22.127]
  - - [1088, 3008, 1, 512, 1088, 1088, 1088, 3008]
    - [0, 22.276]
  - - [1216, 3008, 1, 512, 1216, 1216, 1216, 3008]
    - [0, 22.412]
  - - [1344, 3008, 1, 512, 1344, 1344, 1344, 3008]
    - [0, 22.456]
  - - [1472, 3008, 1, 512, 1472, 1472, 1472, 3008]
    - [0, 22.56]
  - - [1600, 3008, 1, 512, 1600, 1600, 1600, 3008]
    - [0, 22.63]
  - - [1728, 3008, 1, 512, 1728, 1728, 1728, 3008]
    - [0, 22.67]
  - - [1856, 3008, 1, 512, 1856, 1856, 1856, 3008]
    - [0, 22.815]
  - - [1984, 3008, 1, 512, 1984, 1984, 1984, 3008]
    - [0, 22.88]
  - - [2112, 3008, 1, 512, 2112, 2112, 2112, 3008]
    - [0, 22.919]
  - - [2240, 3008, 1, 512, 2240, 2240, 2240, 3008]
    - [0, 22.892]
  - - [2368, 3008, 1, 512, 2368, 2368, 2368, 3008]
    - [0, 22.882]
  - - [2496, 3008, 1, 512, 2496, 2496, 2496, 3008]
    - [0, 22.534]
  - - [2624, 3008, 1, 512, 2624, 2624, 2624, 3008]
    - [0, 22.577]
  - - [2752, 3008, 1, 512, 2752, 2752, 2752, 3008]
    - [0, 22.588]
  - - [2880, 3008, 1, 512, 2880, 2880, 2880, 3008]
    - [0, 22.672]
  - - [3008, 3008, 1, 512, 3008, 3008, 3008, 3008]
    - [0, 22.629]
  - - [3136, 3008, 1, 512, 3136, 3136, 3136, 3008]
    - [0, 22.705]
  - - [3264, 3008, 1, 512, 3264, 3264, 3264, 3008]
    - [0, 22.676]
  - - [3392, 3008, 1, 512, 3392, 3392, 3392, 3008]
    - [0, 22.728]
  - - [3520, 3008, 1, 512, 3520, 3520, 3520, 3008]
    - [0, 22.774]
  - - [3648, 3008, 1, 512, 3648, 3648, 3648, 3008]
    - [0, 22.755]
  - - [3776, 3008, 1, 512, 3776, 3776, 3776, 3008]
    - [0, 22.868]
  - - [3904, 3008, 1, 512, 3904, 3904, 3904, 3008]
    - [0, 22.825]
  - - [4032, 3008, 1, 512, 4032, 4032, 4032, 3008]
    - [2, 22.85]
  - - [64, 3136, 1, 512, 64, 64, 64, 3136]
    - [0, 15.581]
  - - [192, 3136, 1, 512, 192, 192, 192, 3136]
    - [0, 19.899]
  - - [320, 3136, 1, 512, 320, 320, 320, 3136]
    - [0, 20.048]
  - - [448, 3136, 1, 512, 448, 448, 448, 3136]
    - [0, 20.965]
  - - [576, 3136, 1, 512, 576, 576, 576, 3136]
    - [0, 21.35]
  - - [704, 3136, 1, 512, 704, 704, 704, 3136]
    - [0, 21.798]
  - - [832, 3136, 1, 512, 832, 832, 832, 3136]
    - [0, 22.07]
  - - [960, 3136, 1, 512, 960, 960, 960, 3136]
    - [0, 22.258]
  - - [1088, 3136, 1, 512, 1088, 1088, 1088, 3136]
    - [0, 22.381]
  - - [1216, 3136, 1, 512, 1216, 1216, 1216, 3136]
    - [0, 22.445]
  - - [1344, 3136, 1, 512, 1344, 1344, 1344, 3136]
    - [2, 22.512]
  - - [1472, 3136, 1, 512, 1472, 1472, 1472, 3136]
    - [0, 22.483]
  - - [1600, 3136, 1, 512, 1600, 1600, 1600, 3136]
    - [0, 22.716]
  - - [1728, 3136, 1, 512, 1728, 1728, 1728, 3136]
    - [0, 22.737]
  - - [1856, 3136, 1, 512, 1856, 1856, 1856, 3136]
    - [0, 22.79]
  - - [1984, 3136, 1, 512, 1984, 1984, 1984, 3136]
    - [2, 22.855]
  - - [2112, 3136, 1, 512, 2112, 2112, 2112, 3136]
    - [0, 22.851]
  - - [2240, 3136, 1, 512, 2240, 2240, 2240, 3136]
    - [0, 22.905]
  - - [2368, 3136, 1, 512, 2368, 2368, 2368, 3136]
    - [0, 22.98]
  - - [2496, 3136, 1, 512, 2496, 2496, 2496, 3136]
    - [0, 22.591]
  - - [2624, 3136, 1, 512, 2624, 2624, 2624, 3136]
    - [0, 22.66]
  - - [2752, 3136, 1, 512, 2752, 2752, 2752, 3136]
    - [0, 22.655]
  - - [2880, 3136, 1, 512, 2880, 2880, 2880, 3136]
    - [0, 22.731]
  - - [3008, 3136, 1, 512, 3008, 3008, 3008, 3136]
    - [0, 22.71]
  - - [3136, 3136, 1, 512, 3136, 3136, 3136, 3136]
    - [0, 22.728]
  - - [3264, 3136, 1, 512, 3264, 3264, 3264, 3136]
    - [0, 22.764]
  - - [3392, 3136, 1, 512, 3392, 3392, 3392, 3136]
    - [0, 22.86]
  - - [3520, 3136, 1, 512, 3520, 3520, 3520, 3136]
    - [0, 22.794]
  - - [3648, 3136, 1, 512, 3648, 3648, 3648, 3136]
    - [0, 22.828]
  - - [3776, 3136, 1, 512, 3776, 3776, 3776, 3136]
    - [0, 22.869]
  - - [3904, 3136, 1, 512, 3904, 3904, 3904, 3136]
    - [0, 22.831]
  - - [4032, 3136, 1, 512, 4032, 4032, 4032, 3136]
    - [0, 22.93]
  - - [64, 3264, 1, 512, 64, 64, 64, 3264]
    - [0, 16.14]
  - - [192, 3264, 1, 512, 192, 192, 192, 3264]
    - [0, 19.929]
  - - [320, 3264, 1, 512, 320, 320, 320, 3264]
    - [0, 20.223]
  - - [448, 3264, 1, 512, 448, 448, 448, 3264]
    - [0, 20.993]
  - - [576, 3264, 1, 512, 576, 576, 576, 3264]
    - [0, 21.593]
  - - [704, 3264, 1, 512, 704, 704, 704, 3264]
    - [0, 21.887]
  - - [832, 3264, 1, 512, 832, 832, 832, 3264]
    - [0, 22.108]
  - - [960, 3264, 1, 512, 960, 960, 960, 3264]
    - [0, 22.226]
  - - [1088, 3264, 1, 512, 1088, 1088, 1088, 3264]
    - [0, 22.396]
  - - [1216, 3264, 1, 512, 1216, 1216, 1216, 3264]
    - [0, 22.488]
  - - [1344, 3264, 1, 512, 1344, 1344, 1344, 3264]
    - [2, 22.55]
  - - [1472, 3264, 1, 512, 1472, 1472, 1472, 3264]
    - [0, 22.686]
  - - [1600, 3264, 1, 512, 1600, 1600, 1600, 3264]
    - [0, 22.723]
  - - [1728, 3264, 1, 512, 1728, 1728, 1728, 3264]
    - [0, 22.774]
  - - [1856, 3264, 1, 512, 1856, 1856, 1856, 3264]
    - [0, 22.88]
  - - [1984, 3264, 1, 512, 1984, 1984, 1984, 3264]
    - [0, 22.887]
  - - [2112, 3264, 1, 512, 2112, 2112, 2112, 3264]
    - [0, 22.88]
  - - [2240, 3264, 1, 512, 2240, 2240, 2240, 3264]
    - [0, 22.985]
  - - [2368, 3264, 1, 512, 2368, 2368, 2368, 3264]
    - [0, 22.618]
  - - [2496, 3264, 1, 512, 2496, 2496, 2496, 3264]
    - [0, 22.609]
  - - [2624, 3264, 1, 512, 2624, 2624, 2624, 3264]
    - [0, 22.651]
  - - [2752, 3264, 1, 512, 2752, 2752, 2752, 3264]
    - [0, 22.68]
  - - [2880, 3264, 1, 512, 2880, 2880, 2880, 3264]
    - [0, 22.743]
  - - [3008, 3264, 1, 512, 3008, 3008, 3008, 3264]
    - [0, 22.729]
  - - [3136, 3264, 1, 512, 3136, 3136, 3136, 3264]
    - [0, 22.742]
  - - [3264, 3264, 1, 512, 3264, 3264, 3264, 3264]
    - [0, 22.777]
  - - [3392, 3264, 1, 512, 3392, 3392, 3392, 3264]
    - [0, 22.77]
  - - [3520, 3264, 1, 512, 3520, 3520, 3520, 3264]
    - [0, 22.814]
  - - [3648, 3264, 1, 512, 3648, 3648, 3648, 3264]
    - [0, 22.906]
  - - [3776, 3264, 1, 512, 3776, 3776, 3776, 3264]
    - [0, 22.796]
  - - [3904, 3264, 1, 512, 3904, 3904, 3904, 3264]
    - [0, 22.886]
  - - [4032, 3264, 1, 512, 4032, 4032, 4032, 3264]
    - [0, 22.934]
  - - [64, 3392, 1, 512, 64, 64, 64, 3392]
    - [0, 15.466]
  - - [192, 3392, 1, 512, 192, 192, 192, 3392]
    - [0, 19.936]
  - - [320, 3392, 1, 512, 320, 320, 320, 3392]
    - [0, 20.24]
  - - [448, 3392, 1, 512, 448, 448, 448, 3392]
    - [0, 21.097]
  - - [576, 3392, 1, 512, 576, 576, 576, 3392]
    - [0, 21.631]
  - - [704, 3392, 1, 512, 704, 704, 704, 3392]
    - [0, 21.981]
  - - [832, 3392, 1, 512, 832, 832, 832, 3392]
    - [0, 22.166]
  - - [960, 3392, 1, 512, 960, 960, 960, 3392]
    - [0, 22.237]
  - - [1088, 3392, 1, 512, 1088, 1088, 1088, 3392]
    - [0, 22.425]
  - - [1216, 3392, 1, 512, 1216, 1216, 1216, 3392]
    - [0, 22.573]
  - - [1344, 3392, 1, 512, 1344, 1344, 1344, 3392]
    - [0, 22.626]
  - - [1472, 3392, 1, 512, 1472, 1472, 1472, 3392]
    - [0, 22.696]
  - - [1600, 3392, 1, 512, 1600, 1600, 1600, 3392]
    - [0, 22.733]
  - - [1728, 3392, 1, 512, 1728, 1728, 1728, 3392]
    - [0, 22.841]
  - - [1856, 3392, 1, 512, 1856, 1856, 1856, 3392]
    - [0, 22.872]
  - - [1984, 3392, 1, 512, 1984, 1984, 1984, 3392]
    - [0, 22.867]
  - - [2112, 3392, 1, 512, 2112, 2112, 2112, 3392]
    - [0, 22.993]
  - - [2240, 3392, 1, 512, 2240, 2240, 2240, 3392]
    - [0, 22.53]
  - - [2368, 3392, 1, 512, 2368, 2368, 2368, 3392]
    - [0, 22.622]
  - - [2496, 3392, 1, 512, 2496, 2496, 2496, 3392]
    - [0, 22.627]
  - - [2624, 3392, 1, 512, 2624, 2624, 2624, 3392]
    - [0, 22.715]
  - - [2752, 3392, 1, 512, 2752, 2752, 2752, 3392]
    - [0, 22.709]
  - - [2880, 3392, 1, 512, 2880, 2880, 2880, 3392]
    - [0, 22.722]
  - - [3008, 3392, 1, 512, 3008, 3008, 3008, 3392]
    - [0, 22.798]
  - - [3136, 3392, 1, 512, 3136, 3136, 3136, 3392]
    - [0, 22.807]
  - - [3264, 3392, 1, 512, 3264, 3264, 3264, 3392]
    - [0, 22.778]
  - - [3392, 3392, 1, 512, 3392, 3392, 3392, 3392]
    - [0, 22.843]
  - - [3520, 3392, 1, 512, 3520, 3520, 3520, 3392]
    - [0, 22.92]
  - - [3648, 3392, 1, 512, 3648, 3648, 3648, 3392]
    - [0, 22.781]
  - - [3776, 3392, 1, 512, 3776, 3776, 3776, 3392]
    - [0, 22.878]
  - - [3904, 3392, 1, 512, 3904, 3904, 3904, 3392]
    - [0, 22.848]
  - - [4032, 3392, 1, 512, 4032, 4032, 4032, 3392]
    - [0, 22.951]
  - - [64, 3520, 1, 512, 64, 64, 64, 3520]
    - [0, 15.859]
  - - [192, 3520, 1, 512, 192, 192, 192, 3520]
    - [0, 20.337]
  - - [320, 3520, 1, 512, 320, 320, 320, 3520]
    - [0, 20.36]
  - - [448, 3520, 1, 512, 448, 448, 448, 3520]
    - [0, 21.172]
  - - [576, 3520, 1, 512, 576, 576, 576, 3520]
    - [0, 21.675]
  - - [704, 3520, 1, 512, 704, 704, 704, 3520]
    - [0, 21.993]
  - - [832, 3520, 1, 512, 832, 832, 832, 3520]
    - [0, 22.161]
  - - [960, 3520, 1, 512, 960, 960, 960, 3520]
    - [0, 22.343]
  - - [1088, 3520, 1, 512, 1088, 1088, 1088, 3520]
    - [0, 22.408]
  - - [1216, 3520, 1, 512, 1216, 1216, 1216, 3520]
    - [0, 22.558]
  - - [1344, 3520, 1, 512, 1344, 1344, 1344, 3520]
    - [0, 22.677]
  - - [1472, 3520, 1, 512, 1472, 1472, 1472, 3520]
    - [0, 22.629]
  - - [1600, 3520, 1, 512, 1600, 1600, 1600, 3520]
    - [0, 22.714]
  - - [1728, 3520, 1, 512, 1728, 1728, 1728, 3520]
    - [0, 22.861]
  - - [1856, 3520, 1, 512, 1856, 1856, 1856, 3520]
    - [0, 22.933]
  - - [1984, 3520, 1, 512, 1984, 1984, 1984, 3520]
    - [0, 22.934]
  - - [2112, 3520, 1, 512, 2112, 2112, 2112, 3520]
    - [0, 23.012]
  - - [2240, 3520, 1, 512, 2240, 2240, 2240, 3520]
    - [0, 22.639]
  - - [2368, 3520, 1, 512, 2368, 2368, 2368, 3520]
    - [0, 22.61]
  - - [2496, 3520, 1, 512, 2496, 2496, 2496, 3520]
    - [0, 22.673]
  - - [2624, 3520, 1, 512, 2624, 2624, 2624, 3520]
    - [0, 22.676]
  - - [2752, 3520, 1, 512, 2752, 2752, 2752, 3520]
    - [0, 22.76]
  - - [2880, 3520, 1, 512, 2880, 2880, 2880, 3520]
    - [0, 22.729]
  - - [3008, 3520, 1, 512, 3008, 3008, 3008, 3520]
    - [0, 22.786]
  - - [3136, 3520, 1, 512, 3136, 3136, 3136, 3520]
    - [0, 22.81]
  - - [3264, 3520, 1, 512, 3264, 3264, 3264, 3520]
    - [0, 22.774]
  - - [3392, 3520, 1, 512, 3392, 3392, 3392, 3520]
    - [0, 22.819]
  - - [3520, 3520, 1, 512, 3520, 3520, 3520, 3520]
    - [0, 22.902]
  - - [3648, 3520, 1, 512, 3648, 3648, 3648, 3520]
    - [0, 22.898]
  - - [3776, 3520, 1, 512, 3776, 3776, 3776, 3520]
    - [0, 22.933]
  - - [3904, 3520, 1, 512, 3904, 3904, 3904, 3520]
    - [0, 22.855]
  - - [4032, 3520, 1, 512, 4032, 4032, 4032, 3520]
    - [0, 22.99]
  - - [64, 3648, 1, 512, 64, 64, 64, 3648]
    - [0, 16.426]
  - - [192, 3648, 1, 512, 192, 192, 192, 3648]
    - [0, 20.36]
  - - [320, 3648, 1, 512, 320, 320, 320, 3648]
    - [0, 20.477]
  - - [448, 3648, 1, 512, 448, 448, 448, 3648]
    - [0, 21.157]
  - - [576, 3648, 1, 512, 576, 576, 576, 3648]
    - [0, 21.729]
  - - [704, 3648, 1, 512, 704, 704, 704, 3648]
    - [0, 21.991]
  - - [832, 3648, 1, 512, 832, 832, 832, 3648]
    - [0, 22.201]
  - - [960, 3648, 1, 512, 960, 960, 960, 3648]
    - [0, 22.315]
  - - [1088, 3648, 1, 512, 1088, 1088, 1088, 3648]
    - [0, 22.458]
  - - [1216, 3648, 1, 512, 1216, 1216, 1216, 3648]
    - [0, 22.59]
  - - [1344, 3648, 1, 512, 1344, 1344, 1344, 3648]
    - [0, 22.722]
  - - [1472, 3648, 1, 512, 1472, 1472, 1472, 3648]
    - [0, 22.655]
  - - [1600, 3648, 1, 512, 1600, 1600, 1600, 3648]
    - [0, 22.795]
  - - [1728, 3648, 1, 512, 1728, 1728, 1728, 3648]
    - [0, 22.879]
  - - [1856, 3648, 1, 512, 1856, 1856, 1856, 3648]
    - [0, 22.913]
  - - [1984, 3648, 1, 512, 1984, 1984, 1984, 3648]
    - [0, 22.94]
  - - [2112, 3648, 1, 512, 2112, 2112, 2112, 3648]
    - [2, 22.588]
  - - [2240, 3648, 1, 512, 2240, 2240, 2240, 3648]
    - [0, 22.643]
  - - [2368, 3648, 1, 512, 2368, 2368, 2368, 3648]
    - [0, 22.644]
  - - [2496, 3648, 1, 512, 2496, 2496, 2496, 3648]
    - [0, 22.69]
  - - [2624, 3648, 1, 512, 2624, 2624, 2624, 3648]
    - [0, 22.704]
  - - [2752, 3648, 1, 512, 2752, 2752, 2752, 3648]
    - [0, 22.748]
  - - [2880, 3648, 1, 512, 2880, 2880, 2880, 3648]
    - [0, 22.762]
  - - [3008, 3648, 1, 512, 3008, 3008, 3008, 3648]
    - [0, 22.826]
  - - [3136, 3648, 1, 512, 3136, 3136, 3136, 3648]
    - [0, 22.876]
  - - [3264, 3648, 1, 512, 3264, 3264, 3264, 3648]
    - [0, 22.861]
  - - [3392, 3648, 1, 512, 3392, 3392, 3392, 3648]
    - [0, 22.864]
  - - [3520, 3648, 1, 512, 3520, 3520, 3520, 3648]
    - [0, 22.886]
  - - [3648, 3648, 1, 512, 3648, 3648, 3648, 3648]
    - [0, 22.909]
  - - [3776, 3648, 1, 512, 3776, 3776, 3776, 3648]
    - [0, 22.984]
  - - [3904, 3648, 1, 512, 3904, 3904, 3904, 3648]
    - [0, 23.005]
  - - [4032, 3648, 1, 512, 4032, 4032, 4032, 3648]
    - [0, 22.968]
  - - [64, 3776, 1, 512, 64, 64, 64, 3776]
    - [0, 16.927]
  - - [192, 3776, 1, 512, 192, 192, 192, 3776]
    - [0, 20.331]
  - - [320, 3776, 1, 512, 320, 320, 320, 3776]
    - [0, 20.57]
  - - [448, 3776, 1, 512, 448, 448, 448, 3776]
    - [0, 21.324]
  - - [576, 3776, 1, 512, 576, 576, 576, 3776]
    - [0, 21.757]
  - - [704, 3776, 1, 512, 704, 704, 704, 3776]
    - [0, 21.981]
  - - [832, 3776, 1, 512, 832, 832, 832, 3776]
    - [0, 22.206]
  - - [960, 3776, 1, 512, 960, 960, 960, 3776]
    - [0, 22.408]
  - - [1088, 3776, 1, 512, 1088, 1088, 1088, 3776]
    - [0, 22.524]
  - - [1216, 3776, 1, 512, 1216, 1216, 1216, 3776]
    - [0, 22.676]
  - - [1344, 3776, 1, 512, 1344, 1344, 1344, 3776]
    - [0, 22.715]
  - - [1472, 3776, 1, 512, 1472, 1472, 1472, 3776]
    - [0, 22.709]
  - - [1600, 3776, 1, 512, 1600, 1600, 1600, 3776]
    - [0, 22.895]
  - - [1728, 3776, 1, 512, 1728, 1728, 1728, 3776]
    - [0, 22.918]
  - - [1856, 3776, 1, 512, 1856, 1856, 1856, 3776]
    - [0, 22.942]
  - - [1984, 3776, 1, 512, 1984, 1984, 1984, 3776]
    - [2, 22.617]
  - - [2112, 3776, 1, 512, 2112, 2112, 2112, 3776]
    - [0, 22.621]
  - - [2240, 3776, 1, 512, 2240, 2240, 2240, 3776]
    - [0, 22.685]
  - - [2368, 3776, 1, 512, 2368, 2368, 2368, 3776]
    - [0, 22.625]
  - - [2496, 3776, 1, 512, 2496, 2496, 2496, 3776]
    - [0, 22.723]
  - - [2624, 3776, 1, 512, 2624, 2624, 2624, 3776]
    - [0, 22.696]
  - - [2752, 3776, 1, 512, 2752, 2752, 2752, 3776]
    - [0, 22.77]
  - - [2880, 3776, 1, 512, 2880, 2880, 2880, 3776]
    - [0, 22.794]
  - - [3008, 3776, 1, 512, 3008, 3008, 3008, 3776]
    - [0, 22.824]
  - - [3136, 3776, 1, 512, 3136, 3136, 3136, 3776]
    - [0, 22.859]
  - - [3264, 3776, 1, 512, 3264, 3264, 3264, 3776]
    - [0, 22.864]
  - - [3392, 3776, 1, 512, 3392, 3392, 3392, 3776]
    - [0, 22.857]
  - - [3520, 3776, 1, 512, 3520, 3520, 3520, 3776]
    - [0, 22.875]
  - - [3648, 3776, 1, 512, 3648, 3648, 3648, 3776]
    - [0, 22.895]
  - - [3776, 3776, 1, 512, 3776, 3776, 3776, 3776]
    - [0, 22.898]
  - - [3904, 3776, 1, 512, 3904, 3904, 3904, 3776]
    - [0, 22.949]
  - - [4032, 3776, 1, 512, 4032, 4032, 4032, 3776]
    - [0, 23.041]
  - - [64, 3904, 1, 512, 64, 64, 64, 3904]
    - [0, 16.232]
  - - [192, 3904, 1, 512, 192, 192, 192, 3904]
    - [0, 20.449]
  - - [320, 3904, 1, 512, 320, 320, 320, 3904]
    - [0, 20.61]
  - - [448, 3904, 1, 512, 448, 448, 448, 3904]
    - [0, 21.306]
  - - [576, 3904, 1, 512, 576, 576, 576, 3904]
    - [0, 21.845]
  - - [704, 3904, 1, 512, 704, 704, 704, 3904]
    - [0, 22.127]
  - - [832, 3904, 1, 512, 832, 832, 832, 3904]
    - [0, 22.247]
  - - [960, 3904, 1, 512, 960, 960, 960, 3904]
    - [0, 22.349]
  - - [1088, 3904, 1, 512, 1088, 1088, 1088, 3904]
    - [0, 22.538]
  - - [1216, 3904, 1, 512, 1216, 1216, 1216, 3904]
    - [0, 22.717]
  - - [1344, 3904, 1, 512, 1344, 1344, 1344, 3904]
    - [0, 22.762]
  - - [1472, 3904, 1, 512, 1472, 1472, 1472, 3904]
    - [0, 22.781]
  - - [1600, 3904, 1, 512, 1600, 1600, 1600, 3904]
    - [0, 22.865]
  - - [1728, 3904, 1, 512, 1728, 1728, 1728, 3904]
    - [0, 22.898]
  - - [1856, 3904, 1, 512, 1856, 1856, 1856, 3904]
    - [0, 22.942]
  - - [1984, 3904, 1, 512, 1984, 1984, 1984, 3904]
    - [0, 22.615]
  - - [2112, 3904, 1, 512, 2112, 2112, 2112, 3904]
    - [0, 22.637]
  - - [2240, 3904, 1, 512, 2240, 2240, 2240, 3904]
    - [0, 22.647]
  - - [2368, 3904, 1, 512, 2368, 2368, 2368, 3904]
    - [0, 22.703]
  - - [2496, 3904, 1, 512, 2496, 2496, 2496, 3904]
    - [0, 22.758]
  - - [2624, 3904, 1, 512, 2624, 2624, 2624, 3904]
    - [0, 22.766]
  - - [2752, 3904, 1, 512, 2752, 2752, 2752, 3904]
    - [0, 22.835]
  - - [2880, 3904, 1, 512, 2880, 2880, 2880, 3904]
    - [0, 22.792]
  - - [3008, 3904, 1, 512, 3008, 3008, 3008, 3904]
    - [0, 22.836]
  - - [3136, 3904, 1, 512, 3136, 3136, 3136, 3904]
    - [0, 22.858]
  - - [3264, 3904, 1, 512, 3264, 3264, 3264, 3904]
    - [0, 22.92]
  - - [3392, 3904, 1, 512, 3392, 3392, 3392, 3904]
    - [0, 22.864]
  - - [3520, 3904, 1, 512, 3520, 3520, 3520, 3904]
    - [0, 22.892]
  - - [3648, 3904, 1, 512, 3648, 3648, 3648, 3904]
    - [0, 22.955]
  - - [3776, 3904, 1, 512, 3776, 3776, 3776, 3904]
    - [0, 22.967]
  - - [3904, 3904, 1, 512, 3904, 3904, 3904, 3904]
    - [0, 23.011]
  - - [4032, 3904, 1, 512, 4032, 4032, 4032, 3904]
    - [0, 22.998]
  - - [64, 4032, 1, 512, 64, 64, 64, 4032]
    - [0, 16.638]
  - - [192, 4032, 1, 512, 192, 192, 192, 4032]
    - [0, 20.457]
  - - [320, 4032, 1, 512, 320, 320, 320, 4032]
    - [0, 20.713]
  - - [448, 4032, 1, 512, 448, 448, 448, 4032]
    - [0, 21.515]
  - - [576, 4032, 1, 512, 576, 576, 576, 4032]
    - [0, 21.975]
  - - [704, 4032, 1, 512, 704, 704, 704, 4032]
    - [0, 22.064]
  - - [832, 4032, 1, 512, 832, 832, 832, 4032]
    - [0, 22.305]
  - - [960, 4032, 1, 512, 960, 960, 960, 4032]
    - [2, 22.396]
  - - [1088, 4032, 1, 512, 1088, 1088, 1088, 4032]
    - [2, 22.571]
  - - [1216, 4032, 1, 512, 1216, 1216, 1216, 4032]
    - [0, 22.696]
  - - [1344, 4032, 1, 512, 1344, 1344, 1344, 4032]
    - [2, 22.707]
  - - [1472, 4032, 1, 512, 1472, 1472, 1472, 4032]
    - [0, 22.824]
  - - [1600, 4032, 1, 512, 1600, 1600, 1600, 4032]
    - [2, 22.833]
  - - [1728, 4032, 1, 512, 1728, 1728, 1728, 4032]
    - [0, 22.879]
  - - [1856, 4032, 1, 512, 1856, 1856, 1856, 4032]
    - [0, 22.688]
  - - [1984, 4032, 1, 512, 1984, 1984, 1984, 4032]
    - [2, 22.594]
  - - [2112, 4032, 1, 512, 2112, 2112, 2112, 4032]
    - [0, 22.6]
  - - [2240, 4032, 1, 512, 2240, 2240, 2240, 4032]
    - [0, 22.677]
  - - [2368, 4032, 1, 512, 2368, 2368, 2368, 4032]
    - [0, 22.758]
  - - [2496, 4032, 1, 512, 2496, 2496, 2496, 4032]
    - [0, 22.752]
  - - [2624, 4032, 1, 512, 2624, 2624, 2624, 4032]
    - [0, 22.769]
  - - [2752, 4032, 1, 512, 2752, 2752, 2752, 4032]
    - [2, 22.805]
  - - [2880, 4032, 1, 512, 2880, 2880, 2880, 4032]
    - [0, 22.85]
  - - [3008, 4032, 1, 512, 3008, 3008, 3008, 4032]
    - [0, 22.888]
  - - [3136, 4032, 1, 512, 3136, 3136, 3136, 4032]
    - [0, 22.917]
  - - [3264, 4032, 1, 512, 3264, 3264, 3264, 4032]
    - [0, 22.967]
  - - [3392, 4032, 1, 512, 3392, 3392, 3392, 4032]
    - [0, 22.943]
  - - [3520, 4032, 1, 512, 3520, 3520, 3520, 4032]
    - [0, 22.926]
  - - [3648, 4032, 1, 512, 3648, 3648, 3648, 4032]
    - [0, 22.982]
  - - [3776, 4032, 1, 512, 3776, 3776, 3776, 4032]
    - [0, 23.011]
  - - [3904, 4032, 1, 512, 3904, 3904, 3904, 4032]
    - [2, 22.981]
  - - [4032, 4032, 1, 512, 4032, 4032, 4032, 4032]
    - [2, 22.981]
  - - [64, 64, 1, 1024, 64, 64, 64, 64]
    - [2, 1.323]
  - - [192, 64, 1, 1024, 192, 192, 192, 64]
    - [2, 3.937]
  - - [320, 64, 1, 1024, 320, 320, 320, 64]
    - [2, 6.172]
  - - [448, 64, 1, 1024, 448, 448, 448, 64]
    - [0, 8.521]
  - - [576, 64, 1, 1024, 576, 576, 576, 64]
    - [2, 8.638]
  - - [704, 64, 1, 1024, 704, 704, 704, 64]
    - [2, 10.291]
  - - [832, 64, 1, 1024, 832, 832, 832, 64]
    - [0, 11.458]
  - - [960, 64, 1, 1024, 960, 960, 960, 64]
    - [0, 13.188]
  - - [1088, 64, 1, 1024, 1088, 1088, 1088, 64]
    - [2, 12.216]
  - - [1216, 64, 1, 1024, 1216, 1216, 1216, 64]
    - [0, 13.085]
  - - [1344, 64, 1, 1024, 1344, 1344, 1344, 64]
    - [0, 14.368]
  - - [1472, 64, 1, 1024, 1472, 1472, 1472, 64]
    - [2, 13.243]
  - - [1600, 64, 1, 1024, 1600, 1600, 1600, 64]
    - [0, 14.123]
  - - [1728, 64, 1, 1024, 1728, 1728, 1728, 64]
    - [0, 15.191]
  - - [1856, 64, 1, 1024, 1856, 1856, 1856, 64]
    - [0, 16.28]
  - - [1984, 64, 1, 1024, 1984, 1984, 1984, 64]
    - [2, 14.875]
  - - [2112, 64, 1, 1024, 2112, 2112, 2112, 64]
    - [0, 15.775]
  - - [2240, 64, 1, 1024, 2240, 2240, 2240, 64]
    - [0, 16.793]
  - - [2368, 64, 1, 1024, 2368, 2368, 2368, 64]
    - [0, 17.733]
  - - [2496, 64, 1, 1024, 2496, 2496, 2496, 64]
    - [2, 16.267]
  - - [2624, 64, 1, 1024, 2624, 2624, 2624, 64]
    - [0, 16.946]
  - - [2752, 64, 1, 1024, 2752, 2752, 2752, 64]
    - [0, 17.739]
  - - [2880, 64, 1, 1024, 2880, 2880, 2880, 64]
    - [0, 18.423]
  - - [3008, 64, 1, 1024, 3008, 3008, 3008, 64]
    - [2, 17.273]
  - - [3136, 64, 1, 1024, 3136, 3136, 3136, 64]
    - [0, 17.954]
  - - [3264, 64, 1, 1024, 3264, 3264, 3264, 64]
    - [0, 18.55]
  - - [3392, 64, 1, 1024, 3392, 3392, 3392, 64]
    - [2, 17.686]
  - - [3520, 64, 1, 1024, 3520, 3520, 3520, 64]
    - [0, 18.071]
  - - [3648, 64, 1, 1024, 3648, 3648, 3648, 64]
    - [0, 18.641]
  - - [3776, 64, 1, 1024, 3776, 3776, 3776, 64]
    - [0, 19.242]
  - - [3904, 64, 1, 1024, 3904, 3904, 3904, 64]
    - [0, 18.254]
  - - [4032, 64, 1, 1024, 4032, 4032, 4032, 64]
    - [0, 18.642]
  - - [64, 192, 1, 1024, 64, 64, 64, 192]
    - [0, 3.616]
  - - [192, 192, 1, 1024, 192, 192, 192, 192]
    - [1, 8.567]
  - - [320, 192, 1, 1024, 320, 320, 320, 192]
    - [0, 13.233]
  - - [448, 192, 1, 1024, 448, 448, 448, 192]
    - [0, 14.545]
  - - [576, 192, 1, 1024, 576, 576, 576, 192]
    - [0, 15.309]
  - - [704, 192, 1, 1024, 704, 704, 704, 192]
    - [0, 15.87]
  - - [832, 192, 1, 1024, 832, 832, 832, 192]
    - [3, 16.539]
  - - [960, 192, 1, 1024, 960, 960, 960, 192]
    - [0, 18.548]
  - - [1088, 192, 1, 1024, 1088, 1088, 1088, 192]
    - [0, 18.641]
  - - [1216, 192, 1, 1024, 1216, 1216, 1216, 192]
    - [0, 18.724]
  - - [1344, 192, 1, 1024, 1344, 1344, 1344, 192]
    - [0, 18.783]
  - - [1472, 192, 1, 1024, 1472, 1472, 1472, 192]
    - [0, 18.825]
  - - [1600, 192, 1, 1024, 1600, 1600, 1600, 192]
    - [0, 20.221]
  - - [1728, 192, 1, 1024, 1728, 1728, 1728, 192]
    - [0, 20.175]
  - - [1856, 192, 1, 1024, 1856, 1856, 1856, 192]
    - [0, 20.151]
  - - [1984, 192, 1, 1024, 1984, 1984, 1984, 192]
    - [0, 20.047]
  - - [2112, 192, 1, 1024, 2112, 2112, 2112, 192]
    - [0, 20.147]
  - - [2240, 192, 1, 1024, 2240, 2240, 2240, 192]
    - [0, 21.016]
  - - [2368, 192, 1, 1024, 2368, 2368, 2368, 192]
    - [0, 21.029]
  - - [2496, 192, 1, 1024, 2496, 2496, 2496, 192]
    - [0, 19.281]
  - - [2624, 192, 1, 1024, 2624, 2624, 2624, 192]
    - [0, 19.88]
  - - [2752, 192, 1, 1024, 2752, 2752, 2752, 192]
    - [0, 19.83]
  - - [2880, 192, 1, 1024, 2880, 2880, 2880, 192]
    - [0, 20.467]
  - - [3008, 192, 1, 1024, 3008, 3008, 3008, 192]
    - [0, 20.538]
  - - [3136, 192, 1, 1024, 3136, 3136, 3136, 192]
    - [0, 20.502]
  - - [3264, 192, 1, 1024, 3264, 3264, 3264, 192]
    - [0, 20.456]
  - - [3392, 192, 1, 1024, 3392, 3392, 3392, 192]
    - [0, 20.484]
  - - [3520, 192, 1, 1024, 3520, 3520, 3520, 192]
    - [0, 20.907]
  - - [3648, 192, 1, 1024, 3648, 3648, 3648, 192]
    - [0, 20.923]
  - - [3776, 192, 1, 1024, 3776, 3776, 3776, 192]
    - [0, 20.984]
  - - [3904, 192, 1, 1024, 3904, 3904, 3904, 192]
    - [0, 20.929]
  - - [4032, 192, 1, 1024, 4032, 4032, 4032, 192]
    - [0, 21.034]
  - - [64, 320, 1, 1024, 64, 64, 64, 320]
    - [0, 6.035]
  - - [192, 320, 1, 1024, 192, 192, 192, 320]
    - [0, 13.176]
  - - [320, 320, 1, 1024, 320, 320, 320, 320]
    - [0, 14.14]
  - - [448, 320, 1, 1024, 448, 448, 448, 320]
    - [0, 16.664]
  - - [576, 320, 1, 1024, 576, 576, 576, 320]
    - [0, 18.541]
  - - [704, 320, 1, 1024, 704, 704, 704, 320]
    - [0, 18.1]
  - - [832, 320, 1, 1024, 832, 832, 832, 320]
    - [0, 19.253]
  - - [960, 320, 1, 1024, 960, 960, 960, 320]
    - [0, 20.237]
  - - [1088, 320, 1, 1024, 1088, 1088, 1088, 320]
    - [0, 19.68]
  - - [1216, 320, 1, 1024, 1216, 1216, 1216, 320]
    - [0, 20.399]
  - - [1344, 320, 1, 1024, 1344, 1344, 1344, 320]
    - [0, 21.004]
  - - [1472, 320, 1, 1024, 1472, 1472, 1472, 320]
    - [0, 18.957]
  - - [1600, 320, 1, 1024, 1600, 1600, 1600, 320]
    - [0, 20.113]
  - - [1728, 320, 1, 1024, 1728, 1728, 1728, 320]
    - [0, 20.469]
  - - [1856, 320, 1, 1024, 1856, 1856, 1856, 320]
    - [0, 20.289]
  - - [1984, 320, 1, 1024, 1984, 1984, 1984, 320]
    - [0, 20.657]
  - - [2112, 320, 1, 1024, 2112, 2112, 2112, 320]
    - [0, 20.95]
  - - [2240, 320, 1, 1024, 2240, 2240, 2240, 320]
    - [0, 20.829]
  - - [2368, 320, 1, 1024, 2368, 2368, 2368, 320]
    - [0, 21.132]
  - - [2496, 320, 1, 1024, 2496, 2496, 2496, 320]
    - [0, 21.3]
  - - [2624, 320, 1, 1024, 2624, 2624, 2624, 320]
    - [0, 21.156]
  - - [2752, 320, 1, 1024, 2752, 2752, 2752, 320]
    - [0, 21.341]
  - - [2880, 320, 1, 1024, 2880, 2880, 2880, 320]
    - [0, 21.585]
  - - [3008, 320, 1, 1024, 3008, 3008, 3008, 320]
    - [0, 21.483]
  - - [3136, 320, 1, 1024, 3136, 3136, 3136, 320]
    - [0, 21.701]
  - - [3264, 320, 1, 1024, 3264, 3264, 3264, 320]
    - [0, 21.746]
  - - [3392, 320, 1, 1024, 3392, 3392, 3392, 320]
    - [0, 21.695]
  - - [3520, 320, 1, 1024, 3520, 3520, 3520, 320]
    - [0, 21.87]
  - - [3648, 320, 1, 1024, 3648, 3648, 3648, 320]
    - [0, 21.93]
  - - [3776, 320, 1, 1024, 3776, 3776, 3776, 320]
    - [0, 21.841]
  - - [3904, 320, 1, 1024, 3904, 3904, 3904, 320]
    - [0, 22.019]
  - - [4032, 320, 1, 1024, 4032, 4032, 4032, 320]
    - [0, 21.99]
  - - [64, 448, 1, 1024, 64, 64, 64, 448]
    - [0, 8.6]
  - - [192, 448, 1, 1024, 192, 192, 192, 448]
    - [0, 14.535]
  - - [320, 448, 1, 1024, 320, 320, 320, 448]
    - [0, 16.7]
  - - [448, 448, 1, 1024, 448, 448, 448, 448]
    - [0, 17.893]
  - - [576, 448, 1, 1024, 576, 576, 576, 448]
    - [0, 18.809]
  - - [704, 448, 1, 1024, 704, 704, 704, 448]
    - [0, 19.269]
  - - [832, 448, 1, 1024, 832, 832, 832, 448]
    - [0, 19.754]
  - - [960, 448, 1, 1024, 960, 960, 960, 448]
    - [0, 21.074]
  - - [1088, 448, 1, 1024, 1088, 1088, 1088, 448]
    - [0, 19.61]
  - - [1216, 448, 1, 1024, 1216, 1216, 1216, 448]
    - [0, 20.303]
  - - [1344, 448, 1, 1024, 1344, 1344, 1344, 448]
    - [0, 20.562]
  - - [1472, 448, 1, 1024, 1472, 1472, 1472, 448]
    - [0, 20.707]
  - - [1600, 448, 1, 1024, 1600, 1600, 1600, 448]
    - [0, 20.814]
  - - [1728, 448, 1, 1024, 1728, 1728, 1728, 448]
    - [0, 21.009]
  - - [1856, 448, 1, 1024, 1856, 1856, 1856, 448]
    - [0, 21.197]
  - - [1984, 448, 1, 1024, 1984, 1984, 1984, 448]
    - [0, 21.449]
  - - [2112, 448, 1, 1024, 2112, 2112, 2112, 448]
    - [0, 21.596]
  - - [2240, 448, 1, 1024, 2240, 2240, 2240, 448]
    - [0, 21.689]
  - - [2368, 448, 1, 1024, 2368, 2368, 2368, 448]
    - [0, 21.752]
  - - [2496, 448, 1, 1024, 2496, 2496, 2496, 448]
    - [0, 21.819]
  - - [2624, 448, 1, 1024, 2624, 2624, 2624, 448]
    - [0, 21.934]
  - - [2752, 448, 1, 1024, 2752, 2752, 2752, 448]
    - [0, 21.975]
  - - [2880, 448, 1, 1024, 2880, 2880, 2880, 448]
    - [0, 22.027]
  - - [3008, 448, 1, 1024, 3008, 3008, 3008, 448]
    - [0, 22.14]
  - - [3136, 448, 1, 1024, 3136, 3136, 3136, 448]
    - [0, 22.193]
  - - [3264, 448, 1, 1024, 3264, 3264, 3264, 448]
    - [0, 22.257]
  - - [3392, 448, 1, 1024, 3392, 3392, 3392, 448]
    - [0, 22.298]
  - - [3520, 448, 1, 1024, 3520, 3520, 3520, 448]
    - [0, 22.309]
  - - [3648, 448, 1, 1024, 3648, 3648, 3648, 448]
    - [0, 22.308]
  - - [3776, 448, 1, 1024, 3776, 3776, 3776, 448]
    - [0, 22.389]
  - - [3904, 448, 1, 1024, 3904, 3904, 3904, 448]
    - [0, 22.434]
  - - [4032, 448, 1, 1024, 4032, 4032, 4032, 448]
    - [0, 22.497]
  - - [64, 576, 1, 1024, 64, 64, 64, 576]
    - [1, 8.619]
  - - [192, 576, 1, 1024, 192, 192, 192, 576]
    - [0, 15.286]
  - - [320, 576, 1, 1024, 320, 320, 320, 576]
    - [0, 18.422]
  - - [448, 576, 1, 1024, 448, 448, 448, 576]
    - [0, 18.825]
  - - [576, 576, 1, 1024, 576, 576, 576, 576]
    - [0, 20.123]
  - - [704, 576, 1, 1024, 704, 704, 704, 576]
    - [0, 20.132]
  - - [832, 576, 1, 1024, 832, 832, 832, 576]
    - [0, 19.281]
  - - [960, 576, 1, 1024, 960, 960, 960, 576]
    - [0, 20.497]
  - - [1088, 576, 1, 1024, 1088, 1088, 1088, 576]
    - [0, 20.462]
  - - [1216, 576, 1, 1024, 1216, 1216, 1216, 576]
    - [0, 20.957]
  - - [1344, 576, 1, 1024, 1344, 1344, 1344, 576]
    - [0, 20.999]
  - - [1472, 576, 1, 1024, 1472, 1472, 1472, 576]
    - [0, 21.36]
  - - [1600, 576, 1, 1024, 1600, 1600, 1600, 576]
    - [0, 21.513]
  - - [1728, 576, 1, 1024, 1728, 1728, 1728, 576]
    - [0, 21.579]
  - - [1856, 576, 1, 1024, 1856, 1856, 1856, 576]
    - [0, 21.823]
  - - [1984, 576, 1, 1024, 1984, 1984, 1984, 576]
    - [0, 21.793]
  - - [2112, 576, 1, 1024, 2112, 2112, 2112, 576]
    - [0, 21.894]
  - - [2240, 576, 1, 1024, 2240, 2240, 2240, 576]
    - [0, 22.072]
  - - [2368, 576, 1, 1024, 2368, 2368, 2368, 576]
    - [0, 22.117]
  - - [2496, 576, 1, 1024, 2496, 2496, 2496, 576]
    - [0, 22.237]
  - - [2624, 576, 1, 1024, 2624, 2624, 2624, 576]
    - [0, 22.274]
  - - [2752, 576, 1, 1024, 2752, 2752, 2752, 576]
    - [0, 22.448]
  - - [2880, 576, 1, 1024, 2880, 2880, 2880, 576]
    - [0, 22.416]
  - - [3008, 576, 1, 1024, 3008, 3008, 3008, 576]
    - [0, 22.419]
  - - [3136, 576, 1, 1024, 3136, 3136, 3136, 576]
    - [0, 22.442]
  - - [3264, 576, 1, 1024, 3264, 3264, 3264, 576]
    - [0, 22.597]
  - - [3392, 576, 1, 1024, 3392, 3392, 3392, 576]
    - [0, 22.604]
  - - [3520, 576, 1, 1024, 3520, 3520, 3520, 576]
    - [0, 22.639]
  - - [3648, 576, 1, 1024, 3648, 3648, 3648, 576]
    - [0, 22.71]
  - - [3776, 576, 1, 1024, 3776, 3776, 3776, 576]
    - [0, 22.637]
  - - [3904, 576, 1, 1024, 3904, 3904, 3904, 576]
    - [0, 22.743]
  - - [4032, 576, 1, 1024, 4032, 4032, 4032, 576]
    - [0, 22.722]
  - - [64, 704, 1, 1024, 64, 64, 64, 704]
    - [2, 10.338]
  - - [192, 704, 1, 1024, 192, 192, 192, 704]
    - [0, 15.805]
  - - [320, 704, 1, 1024, 320, 320, 320, 704]
    - [0, 18.111]
  - - [448, 704, 1, 1024, 448, 448, 448, 704]
    - [0, 19.252]
  - - [576, 704, 1, 1024, 576, 576, 576, 704]
    - [0, 20.132]
  - - [704, 704, 1, 1024, 704, 704, 704, 704]
    - [0, 19.672]
  - - [832, 704, 1, 1024, 832, 832, 832, 704]
    - [2, 20.135]
  - - [960, 704, 1, 1024, 960, 960, 960, 704]
    - [0, 21.008]
  - - [1088, 704, 1, 1024, 1088, 1088, 1088, 704]
    - [0, 21.24]
  - - [1216, 704, 1, 1024, 1216, 1216, 1216, 704]
    - [0, 21.45]
  - - [1344, 704, 1, 1024, 1344, 1344, 1344, 704]
    - [0, 21.585]
  - - [1472, 704, 1, 1024, 1472, 1472, 1472, 704]
    - [0, 21.708]
  - - [1600, 704, 1, 1024, 1600, 1600, 1600, 704]
    - [0, 21.776]
  - - [1728, 704, 1, 1024, 1728, 1728, 1728, 704]
    - [0, 22.025]
  - - [1856, 704, 1, 1024, 1856, 1856, 1856, 704]
    - [0, 22.088]
  - - [1984, 704, 1, 1024, 1984, 1984, 1984, 704]
    - [0, 22.15]
  - - [2112, 704, 1, 1024, 2112, 2112, 2112, 704]
    - [0, 22.272]
  - - [2240, 704, 1, 1024, 2240, 2240, 2240, 704]
    - [0, 22.3]
  - - [2368, 704, 1, 1024, 2368, 2368, 2368, 704]
    - [0, 22.335]
  - - [2496, 704, 1, 1024, 2496, 2496, 2496, 704]
    - [0, 22.464]
  - - [2624, 704, 1, 1024, 2624, 2624, 2624, 704]
    - [0, 22.45]
  - - [2752, 704, 1, 1024, 2752, 2752, 2752, 704]
    - [0, 22.525]
  - - [2880, 704, 1, 1024, 2880, 2880, 2880, 704]
    - [0, 22.581]
  - - [3008, 704, 1, 1024, 3008, 3008, 3008, 704]
    - [0, 22.648]
  - - [3136, 704, 1, 1024, 3136, 3136, 3136, 704]
    - [0, 22.682]
  - - [3264, 704, 1, 1024, 3264, 3264, 3264, 704]
    - [0, 22.764]
  - - [3392, 704, 1, 1024, 3392, 3392, 3392, 704]
    - [0, 22.768]
  - - [3520, 704, 1, 1024, 3520, 3520, 3520, 704]
    - [0, 22.802]
  - - [3648, 704, 1, 1024, 3648, 3648, 3648, 704]
    - [0, 22.834]
  - - [3776, 704, 1, 1024, 3776, 3776, 3776, 704]
    - [0, 22.833]
  - - [3904, 704, 1, 1024, 3904, 3904, 3904, 704]
    - [0, 22.877]
  - - [4032, 704, 1, 1024, 4032, 4032, 4032, 704]
    - [0, 23.026]
  - - [64, 832, 1, 1024, 64, 64, 64, 832]
    - [0, 11.537]
  - - [192, 832, 1, 1024, 192, 192, 192, 832]
    - [2, 16.945]
  - - [320, 832, 1, 1024, 320, 320, 320, 832]
    - [0, 19.282]
  - - [448, 832, 1, 1024, 448, 448, 448, 832]
    - [0, 19.796]
  - - [576, 832, 1, 1024, 576, 576, 576, 832]
    - [0, 19.287]
  - - [704, 832, 1, 1024, 704, 704, 704, 832]
    - [0, 20.196]
  - - [832, 832, 1, 1024, 832, 832, 832, 832]
    - [0, 20.813]
  - - [960, 832, 1, 1024, 960, 960, 960, 832]
    - [0, 21.306]
  - - [1088, 832, 1, 1024, 1088, 1088, 1088, 832]
    - [0, 21.401]
  - - [1216, 832, 1, 1024, 1216, 1216, 1216, 832]
    - [0, 21.666]
  - - [1344, 832, 1, 1024, 1344, 1344, 1344, 832]
    - [0, 21.793]
  - - [1472, 832, 1, 1024, 1472, 1472, 1472, 832]
    - [0, 21.917]
  - - [1600, 832, 1, 1024, 1600, 1600, 1600, 832]
    - [0, 22.02]
  - - [1728, 832, 1, 1024, 1728, 1728, 1728, 832]
    - [0, 22.228]
  - - [1856, 832, 1, 1024, 1856, 1856, 1856, 832]
    - [0, 22.264]
  - - [1984, 832, 1, 1024, 1984, 1984, 1984, 832]
    - [0, 22.396]
  - - [2112, 832, 1, 1024, 2112, 2112, 2112, 832]
    - [0, 22.489]
  - - [2240, 832, 1, 1024, 2240, 2240, 2240, 832]
    - [0, 22.569]
  - - [2368, 832, 1, 1024, 2368, 2368, 2368, 832]
    - [0, 22.606]
  - - [2496, 832, 1, 1024, 2496, 2496, 2496, 832]
    - [0, 22.629]
  - - [2624, 832, 1, 1024, 2624, 2624, 2624, 832]
    - [0, 22.706]
  - - [2752, 832, 1, 1024, 2752, 2752, 2752, 832]
    - [0, 22.699]
  - - [2880, 832, 1, 1024, 2880, 2880, 2880, 832]
    - [0, 22.733]
  - - [3008, 832, 1, 1024, 3008, 3008, 3008, 832]
    - [0, 22.872]
  - - [3136, 832, 1, 1024, 3136, 3136, 3136, 832]
    - [0, 22.828]
  - - [3264, 832, 1, 1024, 3264, 3264, 3264, 832]
    - [0, 22.848]
  - - [3392, 832, 1, 1024, 3392, 3392, 3392, 832]
    - [0, 22.889]
  - - [3520, 832, 1, 1024, 3520, 3520, 3520, 832]
    - [0, 22.891]
  - - [3648, 832, 1, 1024, 3648, 3648, 3648, 832]
    - [0, 22.974]
  - - [3776, 832, 1, 1024, 3776, 3776, 3776, 832]
    - [0, 22.965]
  - - [3904, 832, 1, 1024, 3904, 3904, 3904, 832]
    - [0, 23.04]
  - - [4032, 832, 1, 1024, 4032, 4032, 4032, 832]
    - [0, 23.092]
  - - [64, 960, 1, 1024, 64, 64, 64, 960]
    - [0, 13.269]
  - - [192, 960, 1, 1024, 192, 192, 192, 960]
    - [0, 18.445]
  - - [320, 960, 1, 1024, 320, 320, 320, 960]
    - [0, 20.172]
  - - [448, 960, 1, 1024, 448, 448, 448, 960]
    - [0, 20.864]
  - - [576, 960, 1, 1024, 576, 576, 576, 960]
    - [0, 20.461]
  - - [704, 960, 1, 1024, 704, 704, 704, 960]
    - [0, 20.892]
  - - [832, 960, 1, 1024, 832, 832, 832, 960]
    - [0, 21.232]
  - - [960, 960, 1, 1024, 960, 960, 960, 960]
    - [0, 21.535]
  - - [1088, 960, 1, 1024, 1088, 1088, 1088, 960]
    - [0, 21.73]
  - - [1216, 960, 1, 1024, 1216, 1216, 1216, 960]
    - [0, 21.915]
  - - [1344, 960, 1, 1024, 1344, 1344, 1344, 960]
    - [0, 22.101]
  - - [1472, 960, 1, 1024, 1472, 1472, 1472, 960]
    - [0, 22.14]
  - - [1600, 960, 1, 1024, 1600, 1600, 1600, 960]
    - [0, 22.244]
  - - [1728, 960, 1, 1024, 1728, 1728, 1728, 960]
    - [0, 22.368]
  - - [1856, 960, 1, 1024, 1856, 1856, 1856, 960]
    - [0, 22.471]
  - - [1984, 960, 1, 1024, 1984, 1984, 1984, 960]
    - [0, 22.585]
  - - [2112, 960, 1, 1024, 2112, 2112, 2112, 960]
    - [0, 22.66]
  - - [2240, 960, 1, 1024, 2240, 2240, 2240, 960]
    - [0, 22.635]
  - - [2368, 960, 1, 1024, 2368, 2368, 2368, 960]
    - [0, 22.708]
  - - [2496, 960, 1, 1024, 2496, 2496, 2496, 960]
    - [0, 22.771]
  - - [2624, 960, 1, 1024, 2624, 2624, 2624, 960]
    - [0, 22.867]
  - - [2752, 960, 1, 1024, 2752, 2752, 2752, 960]
    - [0, 22.86]
  - - [2880, 960, 1, 1024, 2880, 2880, 2880, 960]
    - [0, 22.963]
  - - [3008, 960, 1, 1024, 3008, 3008, 3008, 960]
    - [0, 22.833]
  - - [3136, 960, 1, 1024, 3136, 3136, 3136, 960]
    - [0, 22.956]
  - - [3264, 960, 1, 1024, 3264, 3264, 3264, 960]
    - [0, 23.008]
  - - [3392, 960, 1, 1024, 3392, 3392, 3392, 960]
    - [0, 22.941]
  - - [3520, 960, 1, 1024, 3520, 3520, 3520, 960]
    - [0, 23.079]
  - - [3648, 960, 1, 1024, 3648, 3648, 3648, 960]
    - [0, 23.115]
  - - [3776, 960, 1, 1024, 3776, 3776, 3776, 960]
    - [0, 23.045]
  - - [3904, 960, 1, 1024, 3904, 3904, 3904, 960]
    - [0, 23.085]
  - - [4032, 960, 1, 1024, 4032, 4032, 4032, 960]
    - [0, 22.806]
  - - [64, 1088, 1, 1024, 64, 64, 64, 1088]
    - [2, 11.932]
  - - [192, 1088, 1, 1024, 192, 192, 192, 1088]
    - [0, 18.476]
  - - [320, 1088, 1, 1024, 320, 320, 320, 1088]
    - [0, 19.767]
  - - [448, 1088, 1, 1024, 448, 448, 448, 1088]
    - [0, 19.606]
  - - [576, 1088, 1, 1024, 576, 576, 576, 1088]
    - [0, 20.455]
  - - [704, 1088, 1, 1024, 704, 704, 704, 1088]
    - [0, 21.194]
  - - [832, 1088, 1, 1024, 832, 832, 832, 1088]
    - [0, 21.421]
  - - [960, 1088, 1, 1024, 960, 960, 960, 1088]
    - [0, 21.766]
  - - [1088, 1088, 1, 1024, 1088, 1088, 1088, 1088]
    - [0, 21.931]
  - - [1216, 1088, 1, 1024, 1216, 1216, 1216, 1088]
    - [0, 22.074]
  - - [1344, 1088, 1, 1024, 1344, 1344, 1344, 1088]
    - [0, 22.298]
  - - [1472, 1088, 1, 1024, 1472, 1472, 1472, 1088]
    - [0, 22.307]
  - - [1600, 1088, 1, 1024, 1600, 1600, 1600, 1088]
    - [0, 22.548]
  - - [1728, 1088, 1, 1024, 1728, 1728, 1728, 1088]
    - [0, 22.549]
  - - [1856, 1088, 1, 1024, 1856, 1856, 1856, 1088]
    - [0, 22.667]
  - - [1984, 1088, 1, 1024, 1984, 1984, 1984, 1088]
    - [0, 22.669]
  - - [2112, 1088, 1, 1024, 2112, 2112, 2112, 1088]
    - [0, 22.655]
  - - [2240, 1088, 1, 1024, 2240, 2240, 2240, 1088]
    - [0, 22.807]
  - - [2368, 1088, 1, 1024, 2368, 2368, 2368, 1088]
    - [0, 22.807]
  - - [2496, 1088, 1, 1024, 2496, 2496, 2496, 1088]
    - [0, 22.838]
  - - [2624, 1088, 1, 1024, 2624, 2624, 2624, 1088]
    - [0, 22.985]
  - - [2752, 1088, 1, 1024, 2752, 2752, 2752, 1088]
    - [0, 22.973]
  - - [2880, 1088, 1, 1024, 2880, 2880, 2880, 1088]
    - [0, 23.0]
  - - [3008, 1088, 1, 1024, 3008, 3008, 3008, 1088]
    - [0, 23.086]
  - - [3136, 1088, 1, 1024, 3136, 3136, 3136, 1088]
    - [0, 23.079]
  - - [3264, 1088, 1, 1024, 3264, 3264, 3264, 1088]
    - [0, 23.029]
  - - [3392, 1088, 1, 1024, 3392, 3392, 3392, 1088]
    - [0, 23.099]
  - - [3520, 1088, 1, 1024, 3520, 3520, 3520, 1088]
    - [0, 22.735]
  - - [3648, 1088, 1, 1024, 3648, 3648, 3648, 1088]
    - [0, 22.781]
  - - [3776, 1088, 1, 1024, 3776, 3776, 3776, 1088]
    - [0, 22.815]
  - - [3904, 1088, 1, 1024, 3904, 3904, 3904, 1088]
    - [0, 22.854]
  - - [4032, 1088, 1, 1024, 4032, 4032, 4032, 1088]
    - [0, 22.916]
  - - [64, 1216, 1, 1024, 64, 64, 64, 1216]
    - [0, 13.176]
  - - [192, 1216, 1, 1024, 192, 192, 192, 1216]
    - [0, 18.504]
  - - [320, 1216, 1, 1024, 320, 320, 320, 1216]
    - [0, 20.466]
  - - [448, 1216, 1, 1024, 448, 448, 448, 1216]
    - [0, 20.219]
  - - [576, 1216, 1, 1024, 576, 576, 576, 1216]
    - [0, 20.961]
  - - [704, 1216, 1, 1024, 704, 704, 704, 1216]
    - [0, 21.39]
  - - [832, 1216, 1, 1024, 832, 832, 832, 1216]
    - [0, 21.705]
  - - [960, 1216, 1, 1024, 960, 960, 960, 1216]
    - [0, 21.906]
  - - [1088, 1216, 1, 1024, 1088, 1088, 1088, 1216]
    - [0, 22.072]
  - - [1216, 1216, 1, 1024, 1216, 1216, 1216, 1216]
    - [0, 22.186]
  - - [1344, 1216, 1, 1024, 1344, 1344, 1344, 1216]
    - [0, 22.408]
  - - [1472, 1216, 1, 1024, 1472, 1472, 1472, 1216]
    - [0, 22.451]
  - - [1600, 1216, 1, 1024, 1600, 1600, 1600, 1216]
    - [0, 22.584]
  - - [1728, 1216, 1, 1024, 1728, 1728, 1728, 1216]
    - [0, 22.639]
  - - [1856, 1216, 1, 1024, 1856, 1856, 1856, 1216]
    - [0, 22.759]
  - - [1984, 1216, 1, 1024, 1984, 1984, 1984, 1216]
    - [0, 22.746]
  - - [2112, 1216, 1, 1024, 2112, 2112, 2112, 1216]
    - [0, 22.827]
  - - [2240, 1216, 1, 1024, 2240, 2240, 2240, 1216]
    - [0, 22.88]
  - - [2368, 1216, 1, 1024, 2368, 2368, 2368, 1216]
    - [0, 22.931]
  - - [2496, 1216, 1, 1024, 2496, 2496, 2496, 1216]
    - [0, 23.003]
  - - [2624, 1216, 1, 1024, 2624, 2624, 2624, 1216]
    - [0, 22.973]
  - - [2752, 1216, 1, 1024, 2752, 2752, 2752, 1216]
    - [0, 23.029]
  - - [2880, 1216, 1, 1024, 2880, 2880, 2880, 1216]
    - [0, 23.069]
  - - [3008, 1216, 1, 1024, 3008, 3008, 3008, 1216]
    - [0, 23.096]
  - - [3136, 1216, 1, 1024, 3136, 3136, 3136, 1216]
    - [0, 22.725]
  - - [3264, 1216, 1, 1024, 3264, 3264, 3264, 1216]
    - [0, 22.716]
  - - [3392, 1216, 1, 1024, 3392, 3392, 3392, 1216]
    - [0, 22.827]
  - - [3520, 1216, 1, 1024, 3520, 3520, 3520, 1216]
    - [0, 22.848]
  - - [3648, 1216, 1, 1024, 3648, 3648, 3648, 1216]
    - [0, 22.891]
  - - [3776, 1216, 1, 1024, 3776, 3776, 3776, 1216]
    - [0, 22.895]
  - - [3904, 1216, 1, 1024, 3904, 3904, 3904, 1216]
    - [0, 22.921]
  - - [4032, 1216, 1, 1024, 4032, 4032, 4032, 1216]
    - [0, 22.914]
  - - [64, 1344, 1, 1024, 64, 64, 64, 1344]
    - [0, 14.534]
  - - [192, 1344, 1, 1024, 192, 192, 192, 1344]
    - [0, 18.554]
  - - [320, 1344, 1, 1024, 320, 320, 320, 1344]
    - [0, 20.966]
  - - [448, 1344, 1, 1024, 448, 448, 448, 1344]
    - [0, 20.459]
  - - [576, 1344, 1, 1024, 576, 576, 576, 1344]
    - [0, 20.996]
  - - [704, 1344, 1, 1024, 704, 704, 704, 1344]
    - [0, 21.558]
  - - [832, 1344, 1, 1024, 832, 832, 832, 1344]
    - [0, 21.765]
  - - [960, 1344, 1, 1024, 960, 960, 960, 1344]
    - [0, 22.01]
  - - [1088, 1344, 1, 1024, 1088, 1088, 1088, 1344]
    - [0, 22.243]
  - - [1216, 1344, 1, 1024, 1216, 1216, 1216, 1344]
    - [0, 22.349]
  - - [1344, 1344, 1, 1024, 1344, 1344, 1344, 1344]
    - [0, 22.582]
  - - [1472, 1344, 1, 1024, 1472, 1472, 1472, 1344]
    - [0, 22.472]
  - - [1600, 1344, 1, 1024, 1600, 1600, 1600, 1344]
    - [0, 22.647]
  - - [1728, 1344, 1, 1024, 1728, 1728, 1728, 1344]
    - [0, 22.669]
  - - [1856, 1344, 1, 1024, 1856, 1856, 1856, 1344]
    - [0, 22.829]
  - - [1984, 1344, 1, 1024, 1984, 1984, 1984, 1344]
    - [0, 22.867]
  - - [2112, 1344, 1, 1024, 2112, 2112, 2112, 1344]
    - [0, 22.923]
  - - [2240, 1344, 1, 1024, 2240, 2240, 2240, 1344]
    - [0, 22.968]
  - - [2368, 1344, 1, 1024, 2368, 2368, 2368, 1344]
    - [0, 23.02]
  - - [2496, 1344, 1, 1024, 2496, 2496, 2496, 1344]
    - [0, 23.064]
  - - [2624, 1344, 1, 1024, 2624, 2624, 2624, 1344]
    - [0, 23.087]
  - - [2752, 1344, 1, 1024, 2752, 2752, 2752, 1344]
    - [0, 23.123]
  - - [2880, 1344, 1, 1024, 2880, 2880, 2880, 1344]
    - [0, 22.748]
  - - [3008, 1344, 1, 1024, 3008, 3008, 3008, 1344]
    - [0, 22.819]
  - - [3136, 1344, 1, 1024, 3136, 3136, 3136, 1344]
    - [0, 22.823]
  - - [3264, 1344, 1, 1024, 3264, 3264, 3264, 1344]
    - [0, 22.842]
  - - [3392, 1344, 1, 1024, 3392, 3392, 3392, 1344]
    - [0, 22.887]
  - - [3520, 1344, 1, 1024, 3520, 3520, 3520, 1344]
    - [0, 22.917]
  - - [3648, 1344, 1, 1024, 3648, 3648, 3648, 1344]
    - [0, 22.969]
  - - [3776, 1344, 1, 1024, 3776, 3776, 3776, 1344]
    - [0, 22.976]
  - - [3904, 1344, 1, 1024, 3904, 3904, 3904, 1344]
    - [0, 22.993]
  - - [4032, 1344, 1, 1024, 4032, 4032, 4032, 1344]
    - [2, 23.032]
  - - [64, 1472, 1, 1024, 64, 64, 64, 1472]
    - [0, 13.191]
  - - [192, 1472, 1, 1024, 192, 192, 192, 1472]
    - [0, 18.572]
  - - [320, 1472, 1, 1024, 320, 320, 320, 1472]
    - [0, 18.962]
  - - [448, 1472, 1, 1024, 448, 448, 448, 1472]
    - [0, 20.679]
  - - [576, 1472, 1, 1024, 576, 576, 576, 1472]
    - [0, 21.366]
  - - [704, 1472, 1, 1024, 704, 704, 704, 1472]
    - [0, 21.734]
  - - [832, 1472, 1, 1024, 832, 832, 832, 1472]
    - [0, 21.939]
  - - [960, 1472, 1, 1024, 960, 960, 960, 1472]
    - [0, 22.206]
  - - [1088, 1472, 1, 1024, 1088, 1088, 1088, 1472]
    - [0, 22.323]
  - - [1216, 1472, 1, 1024, 1216, 1216, 1216, 1472]
    - [0, 22.459]
  - - [1344, 1472, 1, 1024, 1344, 1344, 1344, 1472]
    - [0, 22.553]
  - - [1472, 1472, 1, 1024, 1472, 1472, 1472, 1472]
    - [0, 22.72]
  - - [1600, 1472, 1, 1024, 1600, 1600, 1600, 1472]
    - [0, 22.828]
  - - [1728, 1472, 1, 1024, 1728, 1728, 1728, 1472]
    - [0, 22.857]
  - - [1856, 1472, 1, 1024, 1856, 1856, 1856, 1472]
    - [0, 22.917]
  - - [1984, 1472, 1, 1024, 1984, 1984, 1984, 1472]
    - [0, 22.961]
  - - [2112, 1472, 1, 1024, 2112, 2112, 2112, 1472]
    - [0, 23.046]
  - - [2240, 1472, 1, 1024, 2240, 2240, 2240, 1472]
    - [0, 23.034]
  - - [2368, 1472, 1, 1024, 2368, 2368, 2368, 1472]
    - [0, 23.008]
  - - [2496, 1472, 1, 1024, 2496, 2496, 2496, 1472]
    - [0, 23.123]
  - - [2624, 1472, 1, 1024, 2624, 2624, 2624, 1472]
    - [0, 22.768]
  - - [2752, 1472, 1, 1024, 2752, 2752, 2752, 1472]
    - [0, 22.735]
  - - [2880, 1472, 1, 1024, 2880, 2880, 2880, 1472]
    - [0, 22.833]
  - - [3008, 1472, 1, 1024, 3008, 3008, 3008, 1472]
    - [0, 22.902]
  - - [3136, 1472, 1, 1024, 3136, 3136, 3136, 1472]
    - [0, 22.978]
  - - [3264, 1472, 1, 1024, 3264, 3264, 3264, 1472]
    - [0, 23.001]
  - - [3392, 1472, 1, 1024, 3392, 3392, 3392, 1472]
    - [0, 22.997]
  - - [3520, 1472, 1, 1024, 3520, 3520, 3520, 1472]
    - [0, 22.993]
  - - [3648, 1472, 1, 1024, 3648, 3648, 3648, 1472]
    - [0, 23.02]
  - - [3776, 1472, 1, 1024, 3776, 3776, 3776, 1472]
    - [0, 23.083]
  - - [3904, 1472, 1, 1024, 3904, 3904, 3904, 1472]
    - [0, 23.047]
  - - [4032, 1472, 1, 1024, 4032, 4032, 4032, 1472]
    - [2, 23.111]
  - - [64, 1600, 1, 1024, 64, 64, 64, 1600]
    - [0, 14.285]
  - - [192, 1600, 1, 1024, 192, 192, 192, 1600]
    - [0, 20.12]
  - - [320, 1600, 1, 1024, 320, 320, 320, 1600]
    - [0, 20.181]
  - - [448, 1600, 1, 1024, 448, 448, 448, 1600]
    - [0, 20.825]
  - - [576, 1600, 1, 1024, 576, 576, 576, 1600]
    - [0, 21.473]
  - - [704, 1600, 1, 1024, 704, 704, 704, 1600]
    - [0, 21.886]
  - - [832, 1600, 1, 1024, 832, 832, 832, 1600]
    - [0, 22.048]
  - - [960, 1600, 1, 1024, 960, 960, 960, 1600]
    - [0, 22.333]
  - - [1088, 1600, 1, 1024, 1088, 1088, 1088, 1600]
    - [0, 22.456]
  - - [1216, 1600, 1, 1024, 1216, 1216, 1216, 1600]
    - [0, 22.546]
  - - [1344, 1600, 1, 1024, 1344, 1344, 1344, 1600]
    - [0, 22.676]
  - - [1472, 1600, 1, 1024, 1472, 1472, 1472, 1600]
    - [0, 22.815]
  - - [1600, 1600, 1, 1024, 1600, 1600, 1600, 1600]
    - [0, 22.806]
  - - [1728, 1600, 1, 1024, 1728, 1728, 1728, 1600]
    - [0, 22.982]
  - - [1856, 1600, 1, 1024, 1856, 1856, 1856, 1600]
    - [0, 23.007]
  - - [1984, 1600, 1, 1024, 1984, 1984, 1984, 1600]
    - [0, 23.025]
  - - [2112, 1600, 1, 1024, 2112, 2112, 2112, 1600]
    - [0, 23.025]
  - - [2240, 1600, 1, 1024, 2240, 2240, 2240, 1600]
    - [0, 23.111]
  - - [2368, 1600, 1, 1024, 2368, 2368, 2368, 1600]
    - [0, 22.742]
  - - [2496, 1600, 1, 1024, 2496, 2496, 2496, 1600]
    - [0, 22.786]
  - - [2624, 1600, 1, 1024, 2624, 2624, 2624, 1600]
    - [0, 22.856]
  - - [2752, 1600, 1, 1024, 2752, 2752, 2752, 1600]
    - [0, 22.888]
  - - [2880, 1600, 1, 1024, 2880, 2880, 2880, 1600]
    - [0, 22.894]
  - - [3008, 1600, 1, 1024, 3008, 3008, 3008, 1600]
    - [0, 22.912]
  - - [3136, 1600, 1, 1024, 3136, 3136, 3136, 1600]
    - [0, 23.001]
  - - [3264, 1600, 1, 1024, 3264, 3264, 3264, 1600]
    - [0, 22.998]
  - - [3392, 1600, 1, 1024, 3392, 3392, 3392, 1600]
    - [0, 22.992]
  - - [3520, 1600, 1, 1024, 3520, 3520, 3520, 1600]
    - [0, 23.029]
  - - [3648, 1600, 1, 1024, 3648, 3648, 3648, 1600]
    - [0, 23.035]
  - - [3776, 1600, 1, 1024, 3776, 3776, 3776, 1600]
    - [0, 23.158]
  - - [3904, 1600, 1, 1024, 3904, 3904, 3904, 1600]
    - [0, 23.072]
  - - [4032, 1600, 1, 1024, 4032, 4032, 4032, 1600]
    - [2, 23.111]
  - - [64, 1728, 1, 1024, 64, 64, 64, 1728]
    - [0, 15.295]
  - - [192, 1728, 1, 1024, 192, 192, 192, 1728]
    - [0, 19.963]
  - - [320, 1728, 1, 1024, 320, 320, 320, 1728]
    - [0, 20.448]
  - - [448, 1728, 1, 1024, 448, 448, 448, 1728]
    - [0, 20.987]
  - - [576, 1728, 1, 1024, 576, 576, 576, 1728]
    - [0, 21.559]
  - - [704, 1728, 1, 1024, 704, 704, 704, 1728]
    - [0, 21.986]
  - - [832, 1728, 1, 1024, 832, 832, 832, 1728]
    - [0, 22.229]
  - - [960, 1728, 1, 1024, 960, 960, 960, 1728]
    - [0, 22.385]
  - - [1088, 1728, 1, 1024, 1088, 1088, 1088, 1728]
    - [0, 22.56]
  - - [1216, 1728, 1, 1024, 1216, 1216, 1216, 1728]
    - [0, 22.699]
  - - [1344, 1728, 1, 1024, 1344, 1344, 1344, 1728]
    - [0, 22.786]
  - - [1472, 1728, 1, 1024, 1472, 1472, 1472, 1728]
    - [0, 22.866]
  - - [1600, 1728, 1, 1024, 1600, 1600, 1600, 1728]
    - [0, 22.897]
  - - [1728, 1728, 1, 1024, 1728, 1728, 1728, 1728]
    - [0, 22.945]
  - - [1856, 1728, 1, 1024, 1856, 1856, 1856, 1728]
    - [0, 23.021]
  - - [1984, 1728, 1, 1024, 1984, 1984, 1984, 1728]
    - [0, 23.122]
  - - [2112, 1728, 1, 1024, 2112, 2112, 2112, 1728]
    - [0, 23.174]
  - - [2240, 1728, 1, 1024, 2240, 2240, 2240, 1728]
    - [0, 22.796]
  - - [2368, 1728, 1, 1024, 2368, 2368, 2368, 1728]
    - [0, 22.818]
  - - [2496, 1728, 1, 1024, 2496, 2496, 2496, 1728]
    - [0, 22.863]
  - - [2624, 1728, 1, 1024, 2624, 2624, 2624, 1728]
    - [0, 22.898]
  - - [2752, 1728, 1, 1024, 2752, 2752, 2752, 1728]
    - [0, 22.939]
  - - [2880, 1728, 1, 1024, 2880, 2880, 2880, 1728]
    - [0, 22.973]
  - - [3008, 1728, 1, 1024, 3008, 3008, 3008, 1728]
    - [0, 23.005]
  - - [3136, 1728, 1, 1024, 3136, 3136, 3136, 1728]
    - [0, 23.058]
  - - [3264, 1728, 1, 1024, 3264, 3264, 3264, 1728]
    - [0, 23.036]
  - - [3392, 1728, 1, 1024, 3392, 3392, 3392, 1728]
    - [0, 23.037]
  - - [3520, 1728, 1, 1024, 3520, 3520, 3520, 1728]
    - [0, 23.117]
  - - [3648, 1728, 1, 1024, 3648, 3648, 3648, 1728]
    - [0, 23.114]
  - - [3776, 1728, 1, 1024, 3776, 3776, 3776, 1728]
    - [0, 23.1]
  - - [3904, 1728, 1, 1024, 3904, 3904, 3904, 1728]
    - [0, 23.214]
  - - [4032, 1728, 1, 1024, 4032, 4032, 4032, 1728]
    - [2, 23.115]
  - - [64, 1856, 1, 1024, 64, 64, 64, 1856]
    - [0, 16.409]
  - - [192, 1856, 1, 1024, 192, 192, 192, 1856]
    - [0, 19.968]
  - - [320, 1856, 1, 1024, 320, 320, 320, 1856]
    - [0, 20.333]
  - - [448, 1856, 1, 1024, 448, 448, 448, 1856]
    - [0, 21.117]
  - - [576, 1856, 1, 1024, 576, 576, 576, 1856]
    - [0, 21.829]
  - - [704, 1856, 1, 1024, 704, 704, 704, 1856]
    - [0, 22.103]
  - - [832, 1856, 1, 1024, 832, 832, 832, 1856]
    - [0, 22.273]
  - - [960, 1856, 1, 1024, 960, 960, 960, 1856]
    - [0, 22.429]
  - - [1088, 1856, 1, 1024, 1088, 1088, 1088, 1856]
    - [0, 22.625]
  - - [1216, 1856, 1, 1024, 1216, 1216, 1216, 1856]
    - [0, 22.683]
  - - [1344, 1856, 1, 1024, 1344, 1344, 1344, 1856]
    - [0, 22.792]
  - - [1472, 1856, 1, 1024, 1472, 1472, 1472, 1856]
    - [0, 22.949]
  - - [1600, 1856, 1, 1024, 1600, 1600, 1600, 1856]
    - [0, 22.987]
  - - [1728, 1856, 1, 1024, 1728, 1728, 1728, 1856]
    - [0, 23.039]
  - - [1856, 1856, 1, 1024, 1856, 1856, 1856, 1856]
    - [0, 23.039]
  - - [1984, 1856, 1, 1024, 1984, 1984, 1984, 1856]
    - [0, 23.071]
  - - [2112, 1856, 1, 1024, 2112, 2112, 2112, 1856]
    - [0, 22.74]
  - - [2240, 1856, 1, 1024, 2240, 2240, 2240, 1856]
    - [0, 22.842]
  - - [2368, 1856, 1, 1024, 2368, 2368, 2368, 1856]
    - [0, 22.854]
  - - [2496, 1856, 1, 1024, 2496, 2496, 2496, 1856]
    - [0, 22.919]
  - - [2624, 1856, 1, 1024, 2624, 2624, 2624, 1856]
    - [0, 22.99]
  - - [2752, 1856, 1, 1024, 2752, 2752, 2752, 1856]
    - [0, 23.02]
  - - [2880, 1856, 1, 1024, 2880, 2880, 2880, 1856]
    - [0, 23.046]
  - - [3008, 1856, 1, 1024, 3008, 3008, 3008, 1856]
    - [0, 22.975]
  - - [3136, 1856, 1, 1024, 3136, 3136, 3136, 1856]
    - [0, 23.085]
  - - [3264, 1856, 1, 1024, 3264, 3264, 3264, 1856]
    - [0, 23.165]
  - - [3392, 1856, 1, 1024, 3392, 3392, 3392, 1856]
    - [0, 23.077]
  - - [3520, 1856, 1, 1024, 3520, 3520, 3520, 1856]
    - [0, 23.164]
  - - [3648, 1856, 1, 1024, 3648, 3648, 3648, 1856]
    - [0, 23.218]
  - - [3776, 1856, 1, 1024, 3776, 3776, 3776, 1856]
    - [0, 23.188]
  - - [3904, 1856, 1, 1024, 3904, 3904, 3904, 1856]
    - [0, 23.254]
  - - [4032, 1856, 1, 1024, 4032, 4032, 4032, 1856]
    - [2, 23.224]
  - - [64, 1984, 1, 1024, 64, 64, 64, 1984]
    - [2, 11.633]
  - - [192, 1984, 1, 1024, 192, 192, 192, 1984]
    - [0, 20.08]
  - - [320, 1984, 1, 1024, 320, 320, 320, 1984]
    - [0, 20.683]
  - - [448, 1984, 1, 1024, 448, 448, 448, 1984]
    - [0, 21.413]
  - - [576, 1984, 1, 1024, 576, 576, 576, 1984]
    - [0, 21.805]
  - - [704, 1984, 1, 1024, 704, 704, 704, 1984]
    - [0, 22.117]
  - - [832, 1984, 1, 1024, 832, 832, 832, 1984]
    - [0, 22.353]
  - - [960, 1984, 1, 1024, 960, 960, 960, 1984]
    - [0, 22.571]
  - - [1088, 1984, 1, 1024, 1088, 1088, 1088, 1984]
    - [0, 22.648]
  - - [1216, 1984, 1, 1024, 1216, 1216, 1216, 1984]
    - [0, 22.786]
  - - [1344, 1984, 1, 1024, 1344, 1344, 1344, 1984]
    - [0, 22.842]
  - - [1472, 1984, 1, 1024, 1472, 1472, 1472, 1984]
    - [0, 22.977]
  - - [1600, 1984, 1, 1024, 1600, 1600, 1600, 1984]
    - [0, 23.015]
  - - [1728, 1984, 1, 1024, 1728, 1728, 1728, 1984]
    - [0, 23.019]
  - - [1856, 1984, 1, 1024, 1856, 1856, 1856, 1984]
    - [0, 23.098]
  - - [1984, 1984, 1, 1024, 1984, 1984, 1984, 1984]
    - [0, 22.762]
  - - [2112, 1984, 1, 1024, 2112, 2112, 2112, 1984]
    - [0, 22.856]
  - - [2240, 1984, 1, 1024, 2240, 2240, 2240, 1984]
    - [0, 22.888]
  - - [2368, 1984, 1, 1024, 2368, 2368, 2368, 1984]
    - [0, 22.957]
  - - [2496, 1984, 1, 1024, 2496, 2496, 2496, 1984]
    - [0, 22.928]
  - - [2624, 1984, 1, 1024, 2624, 2624, 2624, 1984]
    - [0, 22.94]
  - - [2752, 1984, 1, 1024, 2752, 2752, 2752, 1984]
    - [0, 23.052]
  - - [2880, 1984, 1, 1024, 2880, 2880, 2880, 1984]
    - [0, 23.078]
  - - [3008, 1984, 1, 1024, 3008, 3008, 3008, 1984]
    - [0, 23.1]
  - - [3136, 1984, 1, 1024, 3136, 3136, 3136, 1984]
    - [0, 23.142]
  - - [3264, 1984, 1, 1024, 3264, 3264, 3264, 1984]
    - [0, 23.139]
  - - [3392, 1984, 1, 1024, 3392, 3392, 3392, 1984]
    - [0, 23.071]
  - - [3520, 1984, 1, 1024, 3520, 3520, 3520, 1984]
    - [0, 23.216]
  - - [3648, 1984, 1, 1024, 3648, 3648, 3648, 1984]
    - [0, 23.196]
  - - [3776, 1984, 1, 1024, 3776, 3776, 3776, 1984]
    - [0, 23.26]
  - - [3904, 1984, 1, 1024, 3904, 3904, 3904, 1984]
    - [0, 23.231]
  - - [4032, 1984, 1, 1024, 4032, 4032, 4032, 1984]
    - [0, 23.26]
  - - [64, 2112, 1, 1024, 64, 64, 64, 2112]
    - [2, 15.283]
  - - [192, 2112, 1, 1024, 192, 192, 192, 2112]
    - [0, 20.117]
  - - [320, 2112, 1, 1024, 320, 320, 320, 2112]
    - [0, 21.113]
  - - [448, 2112, 1, 1024, 448, 448, 448, 2112]
    - [0, 21.627]
  - - [576, 2112, 1, 1024, 576, 576, 576, 2112]
    - [0, 21.974]
  - - [704, 2112, 1, 1024, 704, 704, 704, 2112]
    - [0, 22.289]
  - - [832, 2112, 1, 1024, 832, 832, 832, 2112]
    - [0, 22.362]
  - - [960, 2112, 1, 1024, 960, 960, 960, 2112]
    - [0, 22.603]
  - - [1088, 2112, 1, 1024, 1088, 1088, 1088, 2112]
    - [0, 22.733]
  - - [1216, 2112, 1, 1024, 1216, 1216, 1216, 2112]
    - [0, 22.858]
  - - [1344, 2112, 1, 1024, 1344, 1344, 1344, 2112]
    - [0, 22.955]
  - - [1472, 2112, 1, 1024, 1472, 1472, 1472, 2112]
    - [0, 22.919]
  - - [1600, 2112, 1, 1024, 1600, 1600, 1600, 2112]
    - [0, 23.084]
  - - [1728, 2112, 1, 1024, 1728, 1728, 1728, 2112]
    - [0, 23.04]
  - - [1856, 2112, 1, 1024, 1856, 1856, 1856, 2112]
    - [0, 22.81]
  - - [1984, 2112, 1, 1024, 1984, 1984, 1984, 2112]
    - [0, 22.722]
  - - [2112, 2112, 1, 1024, 2112, 2112, 2112, 2112]
    - [0, 22.92]
  - - [2240, 2112, 1, 1024, 2240, 2240, 2240, 2112]
    - [0, 22.968]
  - - [2368, 2112, 1, 1024, 2368, 2368, 2368, 2112]
    - [0, 23.047]
  - - [2496, 2112, 1, 1024, 2496, 2496, 2496, 2112]
    - [0, 23.057]
  - - [2624, 2112, 1, 1024, 2624, 2624, 2624, 2112]
    - [0, 23.01]
  - - [2752, 2112, 1, 1024, 2752, 2752, 2752, 2112]
    - [0, 23.046]
  - - [2880, 2112, 1, 1024, 2880, 2880, 2880, 2112]
    - [0, 23.077]
  - - [3008, 2112, 1, 1024, 3008, 3008, 3008, 2112]
    - [0, 23.174]
  - - [3136, 2112, 1, 1024, 3136, 3136, 3136, 2112]
    - [0, 23.187]
  - - [3264, 2112, 1, 1024, 3264, 3264, 3264, 2112]
    - [0, 23.183]
  - - [3392, 2112, 1, 1024, 3392, 3392, 3392, 2112]
    - [0, 23.214]
  - - [3520, 2112, 1, 1024, 3520, 3520, 3520, 2112]
    - [0, 23.243]
  - - [3648, 2112, 1, 1024, 3648, 3648, 3648, 2112]
    - [0, 23.188]
  - - [3776, 2112, 1, 1024, 3776, 3776, 3776, 2112]
    - [0, 23.33]
  - - [3904, 2112, 1, 1024, 3904, 3904, 3904, 2112]
    - [0, 23.283]
  - - [4032, 2112, 1, 1024, 4032, 4032, 4032, 2112]
    - [0, 23.377]
  - - [64, 2240, 1, 1024, 64, 64, 64, 2240]
    - [0, 16.853]
  - - [192, 2240, 1, 1024, 192, 192, 192, 2240]
    - [0, 21.014]
  - - [320, 2240, 1, 1024, 320, 320, 320, 2240]
    - [0, 20.816]
  - - [448, 2240, 1, 1024, 448, 448, 448, 2240]
    - [0, 21.692]
  - - [576, 2240, 1, 1024, 576, 576, 576, 2240]
    - [0, 21.973]
  - - [704, 2240, 1, 1024, 704, 704, 704, 2240]
    - [0, 22.348]
  - - [832, 2240, 1, 1024, 832, 832, 832, 2240]
    - [0, 22.509]
  - - [960, 2240, 1, 1024, 960, 960, 960, 2240]
    - [0, 22.65]
  - - [1088, 2240, 1, 1024, 1088, 1088, 1088, 2240]
    - [0, 22.789]
  - - [1216, 2240, 1, 1024, 1216, 1216, 1216, 2240]
    - [0, 22.85]
  - - [1344, 2240, 1, 1024, 1344, 1344, 1344, 2240]
    - [0, 22.972]
  - - [1472, 2240, 1, 1024, 1472, 1472, 1472, 2240]
    - [0, 23.03]
  - - [1600, 2240, 1, 1024, 1600, 1600, 1600, 2240]
    - [0, 23.021]
  - - [1728, 2240, 1, 1024, 1728, 1728, 1728, 2240]
    - [0, 22.71]
  - - [1856, 2240, 1, 1024, 1856, 1856, 1856, 2240]
    - [0, 22.824]
  - - [1984, 2240, 1, 1024, 1984, 1984, 1984, 2240]
    - [0, 22.903]
  - - [2112, 2240, 1, 1024, 2112, 2112, 2112, 2240]
    - [0, 22.966]
  - - [2240, 2240, 1, 1024, 2240, 2240, 2240, 2240]
    - [0, 23.018]
  - - [2368, 2240, 1, 1024, 2368, 2368, 2368, 2240]
    - [0, 22.976]
  - - [2496, 2240, 1, 1024, 2496, 2496, 2496, 2240]
    - [0, 23.165]
  - - [2624, 2240, 1, 1024, 2624, 2624, 2624, 2240]
    - [0, 23.071]
  - - [2752, 2240, 1, 1024, 2752, 2752, 2752, 2240]
    - [0, 23.098]
  - - [2880, 2240, 1, 1024, 2880, 2880, 2880, 2240]
    - [0, 23.112]
  - - [3008, 2240, 1, 1024, 3008, 3008, 3008, 2240]
    - [0, 23.11]
  - - [3136, 2240, 1, 1024, 3136, 3136, 3136, 2240]
    - [0, 23.088]
  - - [3264, 2240, 1, 1024, 3264, 3264, 3264, 2240]
    - [0, 23.24]
  - - [3392, 2240, 1, 1024, 3392, 3392, 3392, 2240]
    - [0, 23.205]
  - - [3520, 2240, 1, 1024, 3520, 3520, 3520, 2240]
    - [0, 23.218]
  - - [3648, 2240, 1, 1024, 3648, 3648, 3648, 2240]
    - [0, 23.269]
  - - [3776, 2240, 1, 1024, 3776, 3776, 3776, 2240]
    - [0, 23.305]
  - - [3904, 2240, 1, 1024, 3904, 3904, 3904, 2240]
    - [0, 23.328]
  - - [4032, 2240, 1, 1024, 4032, 4032, 4032, 2240]
    - [0, 23.368]
  - - [64, 2368, 1, 1024, 64, 64, 64, 2368]
    - [0, 17.79]
  - - [192, 2368, 1, 1024, 192, 192, 192, 2368]
    - [0, 20.982]
  - - [320, 2368, 1, 1024, 320, 320, 320, 2368]
    - [0, 21.107]
  - - [448, 2368, 1, 1024, 448, 448, 448, 2368]
    - [0, 21.753]
  - - [576, 2368, 1, 1024, 576, 576, 576, 2368]
    - [0, 22.153]
  - - [704, 2368, 1, 1024, 704, 704, 704, 2368]
    - [0, 22.341]
  - - [832, 2368, 1, 1024, 832, 832, 832, 2368]
    - [0, 22.551]
  - - [960, 2368, 1, 1024, 960, 960, 960, 2368]
    - [0, 22.786]
  - - [1088, 2368, 1, 1024, 1088, 1088, 1088, 2368]
    - [0, 22.77]
  - - [1216, 2368, 1, 1024, 1216, 1216, 1216, 2368]
    - [0, 22.911]
  - - [1344, 2368, 1, 1024, 1344, 1344, 1344, 2368]
    - [0, 23.03]
  - - [1472, 2368, 1, 1024, 1472, 1472, 1472, 2368]
    - [0, 23.041]
  - - [1600, 2368, 1, 1024, 1600, 1600, 1600, 2368]
    - [0, 22.742]
  - - [1728, 2368, 1, 1024, 1728, 1728, 1728, 2368]
    - [0, 22.851]
  - - [1856, 2368, 1, 1024, 1856, 1856, 1856, 2368]
    - [0, 22.935]
  - - [1984, 2368, 1, 1024, 1984, 1984, 1984, 2368]
    - [0, 22.987]
  - - [2112, 2368, 1, 1024, 2112, 2112, 2112, 2368]
    - [0, 23.01]
  - - [2240, 2368, 1, 1024, 2240, 2240, 2240, 2368]
    - [0, 23.082]
  - - [2368, 2368, 1, 1024, 2368, 2368, 2368, 2368]
    - [0, 23.124]
  - - [2496, 2368, 1, 1024, 2496, 2496, 2496, 2368]
    - [0, 23.115]
  - - [2624, 2368, 1, 1024, 2624, 2624, 2624, 2368]
    - [0, 23.086]
  - - [2752, 2368, 1, 1024, 2752, 2752, 2752, 2368]
    - [0, 23.166]
  - - [2880, 2368, 1, 1024, 2880, 2880, 2880, 2368]
    - [0, 23.173]
  - - [3008, 2368, 1, 1024, 3008, 3008, 3008, 2368]
    - [0, 23.194]
  - - [3136, 2368, 1, 1024, 3136, 3136, 3136, 2368]
    - [0, 23.218]
  - - [3264, 2368, 1, 1024, 3264, 3264, 3264, 2368]
    - [0, 23.228]
  - - [3392, 2368, 1, 1024, 3392, 3392, 3392, 2368]
    - [0, 23.291]
  - - [3520, 2368, 1, 1024, 3520, 3520, 3520, 2368]
    - [0, 23.265]
  - - [3648, 2368, 1, 1024, 3648, 3648, 3648, 2368]
    - [0, 23.297]
  - - [3776, 2368, 1, 1024, 3776, 3776, 3776, 2368]
    - [0, 23.298]
  - - [3904, 2368, 1, 1024, 3904, 3904, 3904, 2368]
    - [0, 23.385]
  - - [4032, 2368, 1, 1024, 4032, 4032, 4032, 2368]
    - [0, 23.334]
  - - [64, 2496, 1, 1024, 64, 64, 64, 2496]
    - [2, 16.265]
  - - [192, 2496, 1, 1024, 192, 192, 192, 2496]
    - [0, 19.288]
  - - [320, 2496, 1, 1024, 320, 320, 320, 2496]
    - [0, 21.412]
  - - [448, 2496, 1, 1024, 448, 448, 448, 2496]
    - [0, 21.828]
  - - [576, 2496, 1, 1024, 576, 576, 576, 2496]
    - [0, 22.174]
  - - [704, 2496, 1, 1024, 704, 704, 704, 2496]
    - [0, 22.369]
  - - [832, 2496, 1, 1024, 832, 832, 832, 2496]
    - [0, 22.589]
  - - [960, 2496, 1, 1024, 960, 960, 960, 2496]
    - [0, 22.773]
  - - [1088, 2496, 1, 1024, 1088, 1088, 1088, 2496]
    - [0, 22.95]
  - - [1216, 2496, 1, 1024, 1216, 1216, 1216, 2496]
    - [0, 22.988]
  - - [1344, 2496, 1, 1024, 1344, 1344, 1344, 2496]
    - [0, 23.011]
  - - [1472, 2496, 1, 1024, 1472, 1472, 1472, 2496]
    - [0, 23.052]
  - - [1600, 2496, 1, 1024, 1600, 1600, 1600, 2496]
    - [0, 22.757]
  - - [1728, 2496, 1, 1024, 1728, 1728, 1728, 2496]
    - [0, 22.843]
  - - [1856, 2496, 1, 1024, 1856, 1856, 1856, 2496]
    - [0, 22.888]
  - - [1984, 2496, 1, 1024, 1984, 1984, 1984, 2496]
    - [0, 22.959]
  - - [2112, 2496, 1, 1024, 2112, 2112, 2112, 2496]
    - [0, 23.06]
  - - [2240, 2496, 1, 1024, 2240, 2240, 2240, 2496]
    - [0, 23.017]
  - - [2368, 2496, 1, 1024, 2368, 2368, 2368, 2496]
    - [0, 23.11]
  - - [2496, 2496, 1, 1024, 2496, 2496, 2496, 2496]
    - [0, 23.11]
  - - [2624, 2496, 1, 1024, 2624, 2624, 2624, 2496]
    - [0, 23.148]
  - - [2752, 2496, 1, 1024, 2752, 2752, 2752, 2496]
    - [0, 23.131]
  - - [2880, 2496, 1, 1024, 2880, 2880, 2880, 2496]
    - [0, 23.159]
  - - [3008, 2496, 1, 1024, 3008, 3008, 3008, 2496]
    - [0, 23.18]
  - - [3136, 2496, 1, 1024, 3136, 3136, 3136, 2496]
    - [0, 23.269]
  - - [3264, 2496, 1, 1024, 3264, 3264, 3264, 2496]
    - [0, 23.295]
  - - [3392, 2496, 1, 1024, 3392, 3392, 3392, 2496]
    - [0, 23.263]
  - - [3520, 2496, 1, 1024, 3520, 3520, 3520, 2496]
    - [0, 23.32]
  - - [3648, 2496, 1, 1024, 3648, 3648, 3648, 2496]
    - [0, 23.256]
  - - [3776, 2496, 1, 1024, 3776, 3776, 3776, 2496]
    - [0, 23.336]
  - - [3904, 2496, 1, 1024, 3904, 3904, 3904, 2496]
    - [0, 23.409]
  - - [4032, 2496, 1, 1024, 4032, 4032, 4032, 2496]
    - [0, 23.434]
  - - [64, 2624, 1, 1024, 64, 64, 64, 2624]
    - [0, 17.059]
  - - [192, 2624, 1, 1024, 192, 192, 192, 2624]
    - [0, 19.898]
  - - [320, 2624, 1, 1024, 320, 320, 320, 2624]
    - [0, 21.209]
  - - [448, 2624, 1, 1024, 448, 448, 448, 2624]
    - [0, 21.922]
  - - [576, 2624, 1, 1024, 576, 576, 576, 2624]
    - [0, 22.186]
  - - [704, 2624, 1, 1024, 704, 704, 704, 2624]
    - [0, 22.543]
  - - [832, 2624, 1, 1024, 832, 832, 832, 2624]
    - [0, 22.682]
  - - [960, 2624, 1, 1024, 960, 960, 960, 2624]
    - [0, 22.857]
  - - [1088, 2624, 1, 1024, 1088, 1088, 1088, 2624]
    - [0, 22.897]
  - - [1216, 2624, 1, 1024, 1216, 1216, 1216, 2624]
    - [0, 23.005]
  - - [1344, 2624, 1, 1024, 1344, 1344, 1344, 2624]
    - [0, 23.003]
  - - [1472, 2624, 1, 1024, 1472, 1472, 1472, 2624]
    - [0, 22.735]
  - - [1600, 2624, 1, 1024, 1600, 1600, 1600, 2624]
    - [0, 22.852]
  - - [1728, 2624, 1, 1024, 1728, 1728, 1728, 2624]
    - [0, 22.974]
  - - [1856, 2624, 1, 1024, 1856, 1856, 1856, 2624]
    - [0, 22.9]
  - - [1984, 2624, 1, 1024, 1984, 1984, 1984, 2624]
    - [0, 22.986]
  - - [2112, 2624, 1, 1024, 2112, 2112, 2112, 2624]
    - [0, 23.037]
  - - [2240, 2624, 1, 1024, 2240, 2240, 2240, 2624]
    - [0, 23.1]
  - - [2368, 2624, 1, 1024, 2368, 2368, 2368, 2624]
    - [0, 23.099]
  - - [2496, 2624, 1, 1024, 2496, 2496, 2496, 2624]
    - [0, 23.216]
  - - [2624, 2624, 1, 1024, 2624, 2624, 2624, 2624]
    - [0, 23.119]
  - - [2752, 2624, 1, 1024, 2752, 2752, 2752, 2624]
    - [0, 23.173]
  - - [2880, 2624, 1, 1024, 2880, 2880, 2880, 2624]
    - [0, 23.187]
  - - [3008, 2624, 1, 1024, 3008, 3008, 3008, 2624]
    - [0, 23.239]
  - - [3136, 2624, 1, 1024, 3136, 3136, 3136, 2624]
    - [0, 23.274]
  - - [3264, 2624, 1, 1024, 3264, 3264, 3264, 2624]
    - [0, 23.244]
  - - [3392, 2624, 1, 1024, 3392, 3392, 3392, 2624]
    - [0, 23.318]
  - - [3520, 2624, 1, 1024, 3520, 3520, 3520, 2624]
    - [0, 23.346]
  - - [3648, 2624, 1, 1024, 3648, 3648, 3648, 2624]
    - [0, 23.31]
  - - [3776, 2624, 1, 1024, 3776, 3776, 3776, 2624]
    - [0, 23.333]
  - - [3904, 2624, 1, 1024, 3904, 3904, 3904, 2624]
    - [0, 23.337]
  - - [4032, 2624, 1, 1024, 4032, 4032, 4032, 2624]
    - [0, 23.461]
  - - [64, 2752, 1, 1024, 64, 64, 64, 2752]
    - [0, 17.808]
  - - [192, 2752, 1, 1024, 192, 192, 192, 2752]
    - [0, 19.816]
  - - [320, 2752, 1, 1024, 320, 320, 320, 2752]
    - [0, 21.439]
  - - [448, 2752, 1, 1024, 448, 448, 448, 2752]
    - [0, 21.967]
  - - [576, 2752, 1, 1024, 576, 576, 576, 2752]
    - [0, 22.442]
  - - [704, 2752, 1, 1024, 704, 704, 704, 2752]
    - [0, 22.581]
  - - [832, 2752, 1, 1024, 832, 832, 832, 2752]
    - [0, 22.711]
  - - [960, 2752, 1, 1024, 960, 960, 960, 2752]
    - [0, 22.93]
  - - [1088, 2752, 1, 1024, 1088, 1088, 1088, 2752]
    - [0, 22.883]
  - - [1216, 2752, 1, 1024, 1216, 1216, 1216, 2752]
    - [0, 23.008]
  - - [1344, 2752, 1, 1024, 1344, 1344, 1344, 2752]
    - [0, 23.1]
  - - [1472, 2752, 1, 1024, 1472, 1472, 1472, 2752]
    - [0, 22.738]
  - - [1600, 2752, 1, 1024, 1600, 1600, 1600, 2752]
    - [0, 22.845]
  - - [1728, 2752, 1, 1024, 1728, 1728, 1728, 2752]
    - [0, 22.919]
  - - [1856, 2752, 1, 1024, 1856, 1856, 1856, 2752]
    - [0, 23.024]
  - - [1984, 2752, 1, 1024, 1984, 1984, 1984, 2752]
    - [0, 22.968]
  - - [2112, 2752, 1, 1024, 2112, 2112, 2112, 2752]
    - [0, 23.036]
  - - [2240, 2752, 1, 1024, 2240, 2240, 2240, 2752]
    - [0, 23.07]
  - - [2368, 2752, 1, 1024, 2368, 2368, 2368, 2752]
    - [0, 23.148]
  - - [2496, 2752, 1, 1024, 2496, 2496, 2496, 2752]
    - [0, 23.173]
  - - [2624, 2752, 1, 1024, 2624, 2624, 2624, 2752]
    - [0, 23.233]
  - - [2752, 2752, 1, 1024, 2752, 2752, 2752, 2752]
    - [0, 23.29]
  - - [2880, 2752, 1, 1024, 2880, 2880, 2880, 2752]
    - [0, 23.242]
  - - [3008, 2752, 1, 1024, 3008, 3008, 3008, 2752]
    - [0, 23.343]
  - - [3136, 2752, 1, 1024, 3136, 3136, 3136, 2752]
    - [0, 23.316]
  - - [3264, 2752, 1, 1024, 3264, 3264, 3264, 2752]
    - [0, 23.346]
  - - [3392, 2752, 1, 1024, 3392, 3392, 3392, 2752]
    - [0, 23.292]
  - - [3520, 2752, 1, 1024, 3520, 3520, 3520, 2752]
    - [0, 23.364]
  - - [3648, 2752, 1, 1024, 3648, 3648, 3648, 2752]
    - [0, 23.368]
  - - [3776, 2752, 1, 1024, 3776, 3776, 3776, 2752]
    - [0, 23.385]
  - - [3904, 2752, 1, 1024, 3904, 3904, 3904, 2752]
    - [0, 23.431]
  - - [4032, 2752, 1, 1024, 4032, 4032, 4032, 2752]
    - [0, 23.38]
  - - [64, 2880, 1, 1024, 64, 64, 64, 2880]
    - [3, 16.606]
  - - [192, 2880, 1, 1024, 192, 192, 192, 2880]
    - [0, 20.553]
  - - [320, 2880, 1, 1024, 320, 320, 320, 2880]
    - [0, 21.645]
  - - [448, 2880, 1, 1024, 448, 448, 448, 2880]
    - [0, 22.007]
  - - [576, 2880, 1, 1024, 576, 576, 576, 2880]
    - [0, 22.376]
  - - [704, 2880, 1, 1024, 704, 704, 704, 2880]
    - [0, 22.602]
  - - [832, 2880, 1, 1024, 832, 832, 832, 2880]
    - [0, 22.797]
  - - [960, 2880, 1, 1024, 960, 960, 960, 2880]
    - [0, 22.924]
  - - [1088, 2880, 1, 1024, 1088, 1088, 1088, 2880]
    - [0, 22.942]
  - - [1216, 2880, 1, 1024, 1216, 1216, 1216, 2880]
    - [0, 23.002]
  - - [1344, 2880, 1, 1024, 1344, 1344, 1344, 2880]
    - [0, 22.775]
  - - [1472, 2880, 1, 1024, 1472, 1472, 1472, 2880]
    - [0, 22.835]
  - - [1600, 2880, 1, 1024, 1600, 1600, 1600, 2880]
    - [0, 22.93]
  - - [1728, 2880, 1, 1024, 1728, 1728, 1728, 2880]
    - [0, 22.971]
  - - [1856, 2880, 1, 1024, 1856, 1856, 1856, 2880]
    - [0, 22.987]
  - - [1984, 2880, 1, 1024, 1984, 1984, 1984, 2880]
    - [0, 23.112]
  - - [2112, 2880, 1, 1024, 2112, 2112, 2112, 2880]
    - [0, 23.101]
  - - [2240, 2880, 1, 1024, 2240, 2240, 2240, 2880]
    - [0, 23.168]
  - - [2368, 2880, 1, 1024, 2368, 2368, 2368, 2880]
    - [0, 23.156]
  - - [2496, 2880, 1, 1024, 2496, 2496, 2496, 2880]
    - [0, 23.119]
  - - [2624, 2880, 1, 1024, 2624, 2624, 2624, 2880]
    - [0, 23.19]
  - - [2752, 2880, 1, 1024, 2752, 2752, 2752, 2880]
    - [0, 23.217]
  - - [2880, 2880, 1, 1024, 2880, 2880, 2880, 2880]
    - [0, 23.195]
  - - [3008, 2880, 1, 1024, 3008, 3008, 3008, 2880]
    - [0, 23.339]
  - - [3136, 2880, 1, 1024, 3136, 3136, 3136, 2880]
    - [0, 23.325]
  - - [3264, 2880, 1, 1024, 3264, 3264, 3264, 2880]
    - [0, 23.366]
  - - [3392, 2880, 1, 1024, 3392, 3392, 3392, 2880]
    - [0, 23.37]
  - - [3520, 2880, 1, 1024, 3520, 3520, 3520, 2880]
    - [0, 23.33]
  - - [3648, 2880, 1, 1024, 3648, 3648, 3648, 2880]
    - [0, 23.396]
  - - [3776, 2880, 1, 1024, 3776, 3776, 3776, 2880]
    - [0, 23.39]
  - - [3904, 2880, 1, 1024, 3904, 3904, 3904, 2880]
    - [0, 23.388]
  - - [4032, 2880, 1, 1024, 4032, 4032, 4032, 2880]
    - [2, 23.385]
  - - [64, 3008, 1, 1024, 64, 64, 64, 3008]
    - [0, 17.301]
  - - [192, 3008, 1, 1024, 192, 192, 192, 3008]
    - [0, 20.493]
  - - [320, 3008, 1, 1024, 320, 320, 320, 3008]
    - [0, 21.519]
  - - [448, 3008, 1, 1024, 448, 448, 448, 3008]
    - [0, 22.059]
  - - [576, 3008, 1, 1024, 576, 576, 576, 3008]
    - [0, 22.386]
  - - [704, 3008, 1, 1024, 704, 704, 704, 3008]
    - [0, 22.666]
  - - [832, 3008, 1, 1024, 832, 832, 832, 3008]
    - [0, 22.854]
  - - [960, 3008, 1, 1024, 960, 960, 960, 3008]
    - [0, 22.912]
  - - [1088, 3008, 1, 1024, 1088, 1088, 1088, 3008]
    - [0, 22.993]
  - - [1216, 3008, 1, 1024, 1216, 1216, 1216, 3008]
    - [0, 23.055]
  - - [1344, 3008, 1, 1024, 1344, 1344, 1344, 3008]
    - [0, 22.803]
  - - [1472, 3008, 1, 1024, 1472, 1472, 1472, 3008]
    - [0, 22.903]
  - - [1600, 3008, 1, 1024, 1600, 1600, 1600, 3008]
    - [0, 22.961]
