library/src/amd_detail/rocblaslt/src/Tensile/Logic/asm_full/navi32/GridBased/navi32_Cijk_Ailk_Bljk_BSS_BH_Bias_HAS_SAV_UserArgs.yaml
- {MinimumRequiredVersion: 4.33.0}
- navi32
- gfx1101
- [Device 73f0]
    SolutionIndex: 0
    SolutionNameMin: Cijk_Ailk_Bljk_BSS_BH_Bias_HAS_SAV_UserArgs_MT32x32x32_MI16x16x1_SN_LDSB0_GRVWA8_GRVWB8_GSU1_LBSPPA1024_LBSPPB128_MIWT1_1_NLCA1_SS1_SU32_SUM0_SUS256_TLDS1_WG32_4_1_WGM8
    SolutionIndex: 1
    SolutionNameMin: Cijk_Ailk_Bljk_BSS_BH_Bias_HAS_SAV_UserArgs_MT64x48x32_MI16x16x1_SN_LDSB0_GRVWA8_GRVWB4_GSU1_LBSPPA2048_LBSPPB128_MIWT1_3_NLCA1_SS1_SU32_SUM0_SUS256_TLDS1_WG64_2_1_WGM8
    SolutionIndex: 2
    SolutionNameMin: Cijk_Ailk_Bljk_BSS_BH_Bias_HAS_SAV_UserArgs_MT128x48x32_MI16x16x1_SN_LDSB0_GRVWA8_GRVWB4_GSU1_LBSPPA4096_LBSPPB128_MIWT2_3_NLCA1_SS1_SU32_SUM0_SUS256_TLDS1_WG64_2_1_WGM8
    SolutionIndex: 3
    SolutionNameMin: Cijk_Ailk_Bljk_BSS_BH_Bias_HAS_SAV_UserArgs_MT64x96x32_MI16x16x1_SN_LDSB0_GRVWA8_GRVWB8_GSU1_LBSPPA2048_LBSPPB128_MIWT2_3_NLCA1_SS1_SU32_SUM0_SUS256_TLDS1_WG32_4_1_WGM8
    SolutionIndex: 4
    SolutionNameMin: Cijk_Ailk_Bljk_BSS_BH_Bias_HAS_SAV_UserArgs_MT96x96x32_MI16x16x1_SN_LDSB0_GRVWA8_GRVWB8_GSU1_LBSPPA3072_LBSPPB128_MIWT3_3_NLCA3_SS1_SU32_SUM0_SUS256_TLDS1_WG32_4_1_WGM8
    SolutionIndex: 5
    SolutionNameMin: Cijk_Ailk_Bljk_BSS_BH_Bias_HAS_SAV_UserArgs_MT64x16x64_MI16x16x1_SN_LDSB0_GRVWA8_GRVWB8_GSU1_LBSPPA2048_LBSPPB128_MIWT1_1_NLCA1_SS1_SU32_SUM0_SUS256_TLDS1_WG64_2_1_WGM8
- - - [64, 64, 1, 64, 64, 64, 64, 64]
    - [5, 92.7241]
  - - [128, 128, 1, 128, 128, 128, 128, 128]
    - [5, 724.068]
  - - [256, 256, 1, 256, 256, 256, 256, 256]
    - [0, 5305.25]
  - - [512, 512, 1, 512, 512, 512, 512, 512]
    - [1, 22141.6]
  - - [1024, 1024, 1, 1024, 1024, 1024, 1024, 1024]
    - [3, 58849.8]
  - - [1536, 1536, 1, 1536, 1536, 1536, 1536, 1536]
    - [2, 66014.4]
  - - [2048, 2048, 1, 2048, 2048, 2048, 2048, 2048]
    - [4, 73758.7]
  - - [2560, 2560, 1, 2560, 2560, 2560, 2560, 2560]
    - [4, 78651.0]
  - - [3072, 3072, 1, 3072, 3072, 3072, 3072, 3072]
    - [4, 82373.3]
  - - [3584, 3584, 1, 3584, 3584, 3584, 3584, 3584]
    - [4, 80016.0]
  - - [4096, 4096, 1, 4096, 4096, 4096, 4096, 4096]
    - [4, 83087.0]
- null
- null
- DeviceEfficiency
- GridBased
