library/src/amd_detail/rocblaslt/src/Tensile/Logic/asm_full/navi32/GridBased/navi32_Cijk_Ailk_Bjlk_BBS_BH_Bias_HAS_SAV_UserArgs.yaml
- {MinimumRequiredVersion: 4.33.0}
- navi32
- gfx1101
- [Device 73f0]
    SolutionIndex: 0
    SolutionNameMin: Cijk_Ailk_Bjlk_BBS_BH_Bias_AuxB_HAS_SAV_UserArgs_MT32x32x32_MI16x16x1_SN_LDSB0_GRVWA2_GRVWB8_GSU1_LBSPPA1024_LBSPPB1024_MIWT1_1_NLCA1_NLCB1_SS0_SU32_SUM0_SUS256_WG32_4_1_WGM8
    SolutionIndex: 1
    SolutionNameMin: Cijk_Ailk_Bjlk_BBS_BH_Bias_AuxB_HAS_SAV_UserArgs_MT32x32x32_MI16x16x1_SN_LDSB0_GRVWA2_GRVWB1_GSU4_LBSPPA1024_LBSPPB1024_MIWT1_1_NLCA1_NLCB1_SS0_SU32_SUM0_SUS256_WG32_4_1_WGM8
    SolutionIndex: 2
    SolutionNameMin: Cijk_Ailk_Bjlk_BBS_BH_Bias_AuxB_HAS_SAV_UserArgs_MT16x64x32_MI16x16x1_SN_LDSB0_GRVWA2_GRVWB8_GSU1_LBSPPA512_LBSPPB2048_MIWT1_1_NLCA1_NLCB1_SS0_SU32_SUM0_SUS256_WG16_8_1_WGM8
    SolutionIndex: 3
    SolutionNameMin: Cijk_Ailk_Bjlk_BBS_BH_Bias_AuxB_HAS_SAV_UserArgs_MT16x64x32_MI16x16x1_SN_LDSB0_GRVWA2_GRVWB8_GSU4_LBSPPA512_LBSPPB2048_MIWT1_1_NLCA1_NLCB1_SS0_SU32_SUM0_SUS256_WG16_8_1_WGM8
    SolutionIndex: 4
    SolutionNameMin: Cijk_Ailk_Bjlk_BBS_BH_Bias_AuxB_HAS_SAV_UserArgs_MT64x16x64_MI16x16x1_SN_LDSB0_GRVWA1_GRVWB8_GSU1_LBSPPA2048_LBSPPB512_MIWT1_1_NLCA1_NLCB1_SS0_SU32_SUM0_SUS256_WG64_2_1_WGM8
    SolutionIndex: 5
    SolutionNameMin: Cijk_Ailk_Bjlk_BBS_BH_Bias_AuxB_HAS_SAV_UserArgs_MT16x64x64_MI16x16x1_SN_LDSB0_GRVWA2_GRVWB8_GSU1_LBSPPA512_LBSPPB2048_MIWT1_1_NLCA1_NLCB1_SS0_SU32_SUM0_SUS256_WG16_8_1_WGM8
    SolutionIndex: 6
    SolutionNameMin: Cijk_Ailk_Bjlk_BBS_BH_Bias_AuxB_HAS_SAV_UserArgs_MT64x16x32_MI16x16x1_SN_LDSB0_GRVWA8_GRVWB2_GSU1_LBSPPA2048_LBSPPB512_MIWT1_1_NLCA1_NLCB1_SS1_SU32_SUM0_SUS256_WG64_2_1_WGM8
    SolutionIndex: 7
    SolutionNameMin: Cijk_Ailk_Bjlk_BBS_BH_Bias_AuxB_HAS_SAV_UserArgs_MT64x16x32_MI16x16x1_SN_LDSB0_GRVWA8_GRVWB1_GSU1_LBSPPA2048_LBSPPB512_MIWT1_1_NLCA1_NLCB1_SS1_SU32_SUM0_SUS256_WG64_2_1_WGM8
    SolutionIndex: 8
    SolutionNameMin: Cijk_Ailk_Bjlk_BBS_BH_Bias_AuxB_HAS_SAV_UserArgs_MT64x16x32_MI16x16x1_SN_LDSB0_GRVWA1_GRVWB1_GSU1_LBSPPA2048_LBSPPB512_MIWT1_1_NLCA1_NLCB1_SS1_SU32_SUM0_SUS256_WG64_2_1_WGM8
    SolutionIndex: 9
    SolutionNameMin: Cijk_Ailk_Bjlk_BBS_BH_Bias_AuxB_HAS_SAV_UserArgs_MT64x16x32_MI16x16x1_SN_LDSB0_GRVWA8_GRVWB2_GSU4_LBSPPA2048_LBSPPB512_MIWT1_1_NLCA1_NLCB1_SS1_SU32_SUM0_SUS256_WG64_2_1_WGM8
    SolutionIndex: 10
    SolutionNameMin: Cijk_Ailk_Bjlk_BBS_BH_Bias_AuxB_HAS_SAV_UserArgs_MT64x16x32_MI16x16x1_SN_LDSB0_GRVWA8_GRVWB1_GSU4_LBSPPA2048_LBSPPB512_MIWT1_1_NLCA1_NLCB1_SS1_SU32_SUM0_SUS256_WG64_2_1_WGM8
    SolutionIndex: 11
    SolutionNameMin: Cijk_Ailk_Bjlk_BBS_BH_Bias_AuxB_HAS_SAV_UserArgs_MT256x16x32_MI16x16x1_SN_LDSB1_GRVWA8_GRVWB2_GSU1_LBSPPA8192_LBSPPB512_MIWT4_1_NLCA1_NLCB1_SS1_SU32_SUM0_SUS256_WG64_2_1_WGM8
    SolutionIndex: 12
    SolutionNameMin: Cijk_Ailk_Bjlk_BBS_BH_Bias_AuxB_HAS_SAV_UserArgs_MT256x16x32_MI16x16x1_SN_LDSB1_GRVWA8_GRVWB1_GSU1_LBSPPA8192_LBSPPB512_MIWT4_1_NLCA1_NLCB1_SS1_SU32_SUM0_SUS256_WG64_2_1_WGM8
    SolutionIndex: 13
    SolutionNameMin: Cijk_Ailk_Bjlk_BBS_BH_Bias_AuxB_HAS_SAV_UserArgs_MT32x32x32_MI16x16x1_SN_LDSB0_GRVWA8_GRVWB2_GSU1_LBSPPA1024_LBSPPB1024_MIWT1_1_NLCA1_NLCB1_SS1_SU32_SUM0_SUS256_WG32_4_1_WGM8
    SolutionIndex: 14
    SolutionNameMin: Cijk_Ailk_Bjlk_BBS_BH_Bias_AuxB_HAS_SAV_UserArgs_MT32x32x32_MI16x16x1_SN_LDSB0_GRVWA8_GRVWB1_GSU1_LBSPPA1024_LBSPPB1024_MIWT1_1_NLCA1_NLCB1_SS1_SU32_SUM0_SUS256_WG32_4_1_WGM8
    SolutionIndex: 15
    SolutionNameMin: Cijk_Ailk_Bjlk_BBS_BH_Bias_AuxB_HAS_SAV_UserArgs_MT32x32x32_MI16x16x1_SN_LDSB0_GRVWA1_GRVWB1_GSU1_LBSPPA1024_LBSPPB1024_MIWT1_1_NLCA1_NLCB1_SS1_SU32_SUM0_SUS256_WG32_4_1_WGM8
    SolutionIndex: 16
    SolutionNameMin: Cijk_Ailk_Bjlk_BBS_BH_Bias_AuxB_HAS_SAV_UserArgs_MT32x32x32_MI16x16x1_SN_LDSB0_GRVWA8_GRVWB2_GSU4_LBSPPA1024_LBSPPB1024_MIWT1_1_NLCA1_NLCB1_SS1_SU32_SUM0_SUS256_WG32_4_1_WGM8
    SolutionIndex: 17
    SolutionNameMin: Cijk_Ailk_Bjlk_BBS_BH_Bias_AuxB_HAS_SAV_UserArgs_MT64x32x32_MI16x16x1_SN_LDSB0_GRVWA8_GRVWB2_GSU1_LBSPPA2048_LBSPPB1024_MIWT2_1_NLCA1_NLCB1_SS1_SU32_SUM0_SUS256_WG32_4_1_WGM8
    SolutionIndex: 18
    SolutionNameMin: Cijk_Ailk_Bjlk_BBS_BH_Bias_AuxB_HAS_SAV_UserArgs_MT64x32x32_MI16x16x1_SN_LDSB0_GRVWA8_GRVWB1_GSU1_LBSPPA2048_LBSPPB1024_MIWT2_1_NLCA1_NLCB1_SS1_SU32_SUM0_SUS256_WG32_4_1_WGM8
    SolutionIndex: 19
    SolutionNameMin: Cijk_Ailk_Bjlk_BBS_BH_Bias_AuxB_HAS_SAV_UserArgs_MT64x32x32_MI16x16x1_SN_LDSB0_GRVWA1_GRVWB1_GSU1_LBSPPA2048_LBSPPB1024_MIWT2_1_NLCA1_NLCB1_SS1_SU32_SUM0_SUS256_WG32_4_1_WGM8
    SolutionIndex: 20
    SolutionNameMin: Cijk_Ailk_Bjlk_BBS_BH_Bias_AuxB_HAS_SAV_UserArgs_MT96x32x32_MI16x16x1_SN_LDSB0_GRVWA8_GRVWB2_GSU1_LBSPPA3072_LBSPPB1024_MIWT3_1_NLCA3_NLCB1_SS1_SU32_SUM0_SUS256_WG32_4_1_WGM8
    SolutionIndex: 21
    SolutionNameMin: Cijk_Ailk_Bjlk_BBS_BH_Bias_AuxB_HAS_SAV_UserArgs_MT96x32x32_MI16x16x1_SN_LDSB0_GRVWA8_GRVWB1_GSU1_LBSPPA3072_LBSPPB1024_MIWT3_1_NLCA3_NLCB1_SS1_SU32_SUM0_SUS256_WG32_4_1_WGM8
    SolutionIndex: 22
    SolutionNameMin: Cijk_Ailk_Bjlk_BBS_BH_Bias_AuxB_HAS_SAV_UserArgs_MT96x32x32_MI16x16x1_SN_LDSB0_GRVWA8_GRVWB2_GSU4_LBSPPA3072_LBSPPB1024_MIWT3_1_NLCA3_NLCB1_SS1_SU32_SUM0_SUS256_WG32_4_1_WGM8
    SolutionIndex: 23
    SolutionNameMin: Cijk_Ailk_Bjlk_BBS_BH_Bias_AuxB_HAS_SAV_UserArgs_MT64x48x32_MI16x16x1_SN_LDSB0_GRVWA8_GRVWB2_GSU1_LBSPPA2048_LBSPPB1536_MIWT1_3_NLCA1_NLCB3_SS1_SU32_SUM0_SUS256_WG64_2_1_WGM8
    SolutionIndex: 24
    SolutionNameMin: Cijk_Ailk_Bjlk_BBS_BH_Bias_AuxB_HAS_SAV_UserArgs_MT64x48x32_MI16x16x1_SN_LDSB0_GRVWA8_GRVWB1_GSU1_LBSPPA2048_LBSPPB1536_MIWT1_3_NLCA1_NLCB3_SS1_SU32_SUM0_SUS256_WG64_2_1_WGM8
    SolutionIndex: 25
    SolutionNameMin: Cijk_Ailk_Bjlk_BBS_BH_Bias_AuxB_HAS_SAV_UserArgs_MT128x48x32_MI16x16x1_SN_LDSB0_GRVWA8_GRVWB2_GSU1_LBSPPA4096_LBSPPB1536_MIWT2_3_NLCA1_NLCB3_SS1_SU32_SUM0_SUS256_WG64_2_1_WGM8
    SolutionIndex: 26
    SolutionNameMin: Cijk_Ailk_Bjlk_BBS_BH_Bias_AuxB_HAS_SAV_UserArgs_MT128x48x32_MI16x16x1_SN_LDSB0_GRVWA8_GRVWB1_GSU1_LBSPPA4096_LBSPPB1536_MIWT2_3_NLCA1_NLCB3_SS1_SU32_SUM0_SUS256_WG64_2_1_WGM8
    SolutionIndex: 27
    SolutionNameMin: Cijk_Ailk_Bjlk_BBS_BH_Bias_AuxB_HAS_SAV_UserArgs_MT128x48x32_MI16x16x1_SN_LDSB0_GRVWA8_GRVWB2_GSU4_LBSPPA4096_LBSPPB1536_MIWT2_3_NLCA1_NLCB3_SS1_SU32_SUM0_SUS256_WG64_2_1_WGM8
    SolutionIndex: 28
    SolutionNameMin: Cijk_Ailk_Bjlk_BBS_BH_Bias_AuxB_HAS_SAV_UserArgs_MT16x64x32_MI16x16x1_SN_LDSB0_GRVWA4_GRVWB2_GSU1_LBSPPA512_LBSPPB2048_MIWT1_1_NLCA1_NLCB1_SS1_SU32_SUM0_SUS256_WG16_8_1_WGM8
    SolutionIndex: 29
    SolutionNameMin: Cijk_Ailk_Bjlk_BBS_BH_Bias_AuxB_HAS_SAV_UserArgs_MT16x64x32_MI16x16x1_SN_LDSB0_GRVWA1_GRVWB2_GSU1_LBSPPA512_LBSPPB2048_MIWT1_1_NLCA1_NLCB1_SS1_SU32_SUM0_SUS256_WG16_8_1_WGM8
    SolutionIndex: 30
    SolutionNameMin: Cijk_Ailk_Bjlk_BBS_BH_Bias_AuxB_HAS_SAV_UserArgs_MT16x64x32_MI16x16x1_SN_LDSB0_GRVWA1_GRVWB1_GSU1_LBSPPA512_LBSPPB2048_MIWT1_1_NLCA1_NLCB1_SS1_SU32_SUM0_SUS256_WG16_8_1_WGM8
    SolutionIndex: 31
    SolutionNameMin: Cijk_Ailk_Bjlk_BBS_BH_Bias_AuxB_HAS_SAV_UserArgs_MT32x64x32_MI16x16x1_SN_LDSB0_GRVWA8_GRVWB2_GSU1_LBSPPA1024_LBSPPB2048_MIWT2_1_NLCA1_NLCB1_SS1_SU32_SUM0_SUS256_WG16_8_1_WGM8
    SolutionIndex: 32
    SolutionNameMin: Cijk_Ailk_Bjlk_BBS_BH_Bias_AuxB_HAS_SAV_UserArgs_MT32x64x32_MI16x16x1_SN_LDSB0_GRVWA8_GRVWB1_GSU1_LBSPPA1024_LBSPPB2048_MIWT2_1_NLCA1_NLCB1_SS1_SU32_SUM0_SUS256_WG16_8_1_WGM8
    SolutionIndex: 33
    SolutionNameMin: Cijk_Ailk_Bjlk_BBS_BH_Bias_AuxB_HAS_SAV_UserArgs_MT32x64x32_MI16x16x1_SN_LDSB0_GRVWA1_GRVWB1_GSU1_LBSPPA1024_LBSPPB2048_MIWT2_1_NLCA1_NLCB1_SS1_SU32_SUM0_SUS256_WG16_8_1_WGM8
    SolutionIndex: 34
    SolutionNameMin: Cijk_Ailk_Bjlk_BBS_BH_Bias_AuxB_HAS_SAV_UserArgs_MT48x64x32_MI16x16x1_SN_LDSB0_GRVWA4_GRVWB2_GSU1_LBSPPA1536_LBSPPB2048_MIWT3_1_NLCA3_NLCB1_SS1_SU32_SUM0_SUS256_WG16_8_1_WGM8
    SolutionIndex: 35
    SolutionNameMin: Cijk_Ailk_Bjlk_BBS_BH_Bias_AuxB_HAS_SAV_UserArgs_MT48x64x32_MI16x16x1_SN_LDSB0_GRVWA4_GRVWB2_GSU4_LBSPPA1536_LBSPPB2048_MIWT3_1_NLCA3_NLCB1_SS1_SU32_SUM0_SUS256_WG16_8_1_WGM8
    SolutionIndex: 36
    SolutionNameMin: Cijk_Ailk_Bjlk_BBS_BH_Bias_AuxB_HAS_SAV_UserArgs_MT64x96x32_MI16x16x1_SN_LDSB0_GRVWA8_GRVWB2_GSU1_LBSPPA2048_LBSPPB3072_MIWT2_3_NLCA1_NLCB3_SS1_SU32_SUM0_SUS256_WG32_4_1_WGM8
    SolutionIndex: 37
    SolutionNameMin: Cijk_Ailk_Bjlk_BBS_BH_Bias_AuxB_HAS_SAV_UserArgs_MT64x96x32_MI16x16x1_SN_LDSB0_GRVWA8_GRVWB2_GSU2_LBSPPA2048_LBSPPB3072_MIWT2_3_NLCA1_NLCB3_SS1_SU32_SUM0_SUS256_WG32_4_1_WGM8
    SolutionIndex: 38
    SolutionNameMin: Cijk_Ailk_Bjlk_BBS_BH_Bias_AuxB_HAS_SAV_UserArgs_MT64x96x32_MI16x16x1_SN_LDSB0_GRVWA8_GRVWB2_GSU4_LBSPPA2048_LBSPPB3072_MIWT2_3_NLCA1_NLCB3_SS1_SU32_SUM0_SUS256_WG32_4_1_WGM8
    SolutionIndex: 39
    SolutionNameMin: Cijk_Ailk_Bjlk_BBS_BH_Bias_AuxB_HAS_SAV_UserArgs_MT16x192x32_MI16x16x1_SN_LDSB0_GRVWA1_GRVWB2_GSU1_LBSPPA512_LBSPPB6144_MIWT1_3_NLCA1_NLCB3_SS1_SU32_SUM0_SUS256_WG16_8_1_WGM8
    SolutionIndex: 40
    SolutionNameMin: Cijk_Ailk_Bjlk_BBS_BH_Bias_AuxB_HAS_SAV_UserArgs_MT64x16x64_MI16x16x1_SN_LDSB0_GRVWA8_GRVWB2_GSU1_LBSPPA2048_LBSPPB512_MIWT1_1_NLCA1_NLCB1_SS1_SU32_SUM0_SUS256_WG64_2_1_WGM8
    SolutionIndex: 41
    SolutionNameMin: Cijk_Ailk_Bjlk_BBS_BH_Bias_AuxB_HAS_SAV_UserArgs_MT64x16x64_MI16x16x1_SN_LDSB0_GRVWA8_GRVWB1_GSU1_LBSPPA2048_LBSPPB512_MIWT1_1_NLCA1_NLCB1_SS1_SU32_SUM0_SUS256_WG64_2_1_WGM8
    SolutionIndex: 42
    SolutionNameMin: Cijk_Ailk_Bjlk_BBS_BH_Bias_AuxB_HAS_SAV_UserArgs_MT64x16x64_MI16x16x1_SN_LDSB0_GRVWA8_GRVWB2_GSU4_LBSPPA2048_LBSPPB512_MIWT1_1_NLCA1_NLCB1_SS1_SU32_SUM0_SUS256_WG64_2_1_WGM8
    SolutionIndex: 43
    SolutionNameMin: Cijk_Ailk_Bjlk_BBS_BH_Bias_AuxB_HAS_SAV_UserArgs_MT32x32x64_MI16x16x1_SN_LDSB0_GRVWA8_GRVWB2_GSU1_LBSPPA1024_LBSPPB1024_MIWT1_1_NLCA1_NLCB1_SS1_SU32_SUM0_SUS256_WG32_4_1_WGM8
    SolutionIndex: 44
    SolutionNameMin: Cijk_Ailk_Bjlk_BBS_BH_Bias_AuxB_HAS_SAV_UserArgs_MT32x32x64_MI16x16x1_SN_LDSB0_GRVWA8_GRVWB1_GSU1_LBSPPA1024_LBSPPB1024_MIWT1_1_NLCA1_NLCB1_SS1_SU32_SUM0_SUS256_WG32_4_1_WGM8
    SolutionIndex: 45
    SolutionNameMin: Cijk_Ailk_Bjlk_BBS_BH_Bias_AuxB_HAS_SAV_UserArgs_MT32x32x64_MI16x16x1_SN_LDSB0_GRVWA1_GRVWB1_GSU1_LBSPPA1024_LBSPPB1024_MIWT1_1_NLCA1_NLCB1_SS1_SU32_SUM0_SUS256_WG32_4_1_WGM8
    SolutionIndex: 46
    SolutionNameMin: Cijk_Ailk_Bjlk_BBS_BH_Bias_AuxB_HAS_SAV_UserArgs_MT32x32x64_MI16x16x1_SN_LDSB0_GRVWA8_GRVWB2_GSU4_LBSPPA1024_LBSPPB1024_MIWT1_1_NLCA1_NLCB1_SS1_SU32_SUM0_SUS256_WG32_4_1_WGM8
    SolutionIndex: 47
    SolutionNameMin: Cijk_Ailk_Bjlk_BBS_BH_Bias_AuxB_HAS_SAV_UserArgs_MT64x32x64_MI16x16x1_SN_LDSB0_GRVWA8_GRVWB2_GSU1_LBSPPA2048_LBSPPB1024_MIWT2_1_NLCA1_NLCB1_SS1_SU32_SUM0_SUS256_WG32_4_1_WGM8
    SolutionIndex: 48
    SolutionNameMin: Cijk_Ailk_Bjlk_BBS_BH_Bias_AuxB_HAS_SAV_UserArgs_MT64x32x64_MI16x16x1_SN_LDSB0_GRVWA8_GRVWB2_GSU4_LBSPPA2048_LBSPPB1024_MIWT2_1_NLCA1_NLCB1_SS1_SU32_SUM0_SUS256_WG32_4_1_WGM8
    SolutionIndex: 49
    SolutionNameMin: Cijk_Ailk_Bjlk_BBS_BH_Bias_AuxB_HAS_SAV_UserArgs_MT16x64x64_MI16x16x1_SN_LDSB0_GRVWA8_GRVWB2_GSU1_LBSPPA512_LBSPPB2048_MIWT1_1_NLCA1_NLCB1_SS1_SU32_SUM0_SUS256_WG16_8_1_WGM8
    SolutionIndex: 50
    SolutionNameMin: Cijk_Ailk_Bjlk_BBS_BH_Bias_AuxB_HAS_SAV_UserArgs_MT16x64x64_MI16x16x1_SN_LDSB0_GRVWA8_GRVWB1_GSU1_LBSPPA512_LBSPPB2048_MIWT1_1_NLCA1_NLCB1_SS1_SU32_SUM0_SUS256_WG16_8_1_WGM8
- - - [64, 64, 1, 64, 64, 64, 64, 64]
    - [6, 17.123]
  - - [192, 64, 1, 64, 192, 192, 192, 64]
    - [6, 52.0661]
  - - [320, 64, 1, 64, 320, 320, 320, 64]
    - [6, 89.1677]
  - - [448, 64, 1, 64, 448, 448, 448, 64]
    - [6, 127.791]
  - - [576, 64, 1, 64, 576, 576, 576, 64]
    - [6, 173.414]
  - - [704, 64, 1, 64, 704, 704, 704, 64]
    - [6, 210.258]
  - - [832, 64, 1, 64, 832, 832, 832, 64]
    - [6, 250.68]
  - - [960, 64, 1, 64, 960, 960, 960, 64]
    - [45, 294.997]
  - - [64, 192, 1, 64, 64, 64, 64, 192]
    - [6, 51.571]
  - - [192, 192, 1, 64, 192, 192, 192, 192]
    - [6, 173.861]
  - - [320, 192, 1, 64, 320, 320, 320, 192]
    - [50, 288.609]
  - - [448, 192, 1, 64, 448, 448, 448, 192]
    - [6, 401.548]
  - - [576, 192, 1, 64, 576, 576, 576, 192]
    - [49, 511.427]
  - - [704, 192, 1, 64, 704, 704, 704, 192]
    - [39, 617.029]
  - - [832, 192, 1, 64, 832, 832, 832, 192]
    - [6, 705.588]
  - - [960, 192, 1, 64, 960, 960, 960, 192]
    - [6, 813.298]
  - - [64, 320, 1, 64, 64, 64, 64, 320]
    - [44, 93.1935]
  - - [192, 320, 1, 64, 192, 192, 192, 320]
    - [14, 294.765]
  - - [320, 320, 1, 64, 320, 320, 320, 320]
    - [49, 473.201]
  - - [448, 320, 1, 64, 448, 448, 448, 320]
    - [6, 653.749]
  - - [576, 320, 1, 64, 576, 576, 576, 320]
    - [6, 786.72]
  - - [704, 320, 1, 64, 704, 704, 704, 320]
    - [18, 987.563]
  - - [832, 320, 1, 64, 832, 832, 832, 320]
    - [17, 1107.57]
  - - [960, 320, 1, 64, 960, 960, 960, 320]
    - [17, 1287.16]
  - - [64, 448, 1, 64, 64, 64, 64, 448]
    - [13, 122.829]
  - - [192, 448, 1, 64, 192, 192, 192, 448]
    - [6, 386.996]
  - - [320, 448, 1, 64, 320, 320, 320, 448]
    - [6, 644.79]
  - - [448, 448, 1, 64, 448, 448, 448, 448]
    - [6, 881.64]
  - - [576, 448, 1, 64, 576, 576, 576, 448]
    - [21, 1102.14]
  - - [704, 448, 1, 64, 704, 704, 704, 448]
    - [17, 1264.33]
  - - [832, 448, 1, 64, 832, 832, 832, 448]
    - [31, 1497.54]
  - - [960, 448, 1, 64, 960, 960, 960, 448]
    - [18, 1704.92]
  - - [64, 576, 1, 64, 64, 64, 64, 576]
    - [44, 172.406]
  - - [192, 576, 1, 64, 192, 192, 192, 576]
    - [7, 518.166]
  - - [320, 576, 1, 64, 320, 320, 320, 576]
    - [6, 812.99]
  - - [448, 576, 1, 64, 448, 448, 448, 576]
    - [24, 1103.25]
  - - [576, 576, 1, 64, 576, 576, 576, 576]
    - [24, 1368.19]
  - - [704, 576, 1, 64, 704, 704, 704, 576]
    - [23, 1574.34]
  - - [832, 576, 1, 64, 832, 832, 832, 576]
    - [18, 1846.58]
  - - [960, 576, 1, 64, 960, 960, 960, 576]
    - [36, 2064.19]
  - - [64, 704, 1, 64, 64, 64, 64, 704]
    - [28, 216.169]
  - - [192, 704, 1, 64, 192, 192, 192, 704]
    - [6, 606.241]
  - - [320, 704, 1, 64, 320, 320, 320, 704]
    - [6, 970.577]
  - - [448, 704, 1, 64, 448, 448, 448, 704]
    - [19, 1293.96]
  - - [576, 704, 1, 64, 576, 576, 576, 704]
    - [32, 1612.49]
  - - [704, 704, 1, 64, 704, 704, 704, 704]
    - [33, 1813.63]
  - - [832, 704, 1, 64, 832, 832, 832, 704]
    - [18, 2035.71]
  - - [960, 704, 1, 64, 960, 960, 960, 704]
    - [31, 2366.24]
  - - [64, 832, 1, 64, 64, 64, 64, 832]
    - [6, 251.318]
  - - [192, 832, 1, 64, 192, 192, 192, 832]
    - [47, 709.259]
  - - [320, 832, 1, 64, 320, 320, 320, 832]
    - [6, 1136.75]
  - - [448, 832, 1, 64, 448, 448, 448, 832]
    - [17, 1493.32]
  - - [576, 832, 1, 64, 576, 576, 576, 832]
    - [19, 1852.72]
  - - [704, 832, 1, 64, 704, 704, 704, 832]
    - [17, 2050.18]
  - - [832, 832, 1, 64, 832, 832, 832, 832]
    - [31, 2396.08]
  - - [960, 832, 1, 64, 960, 960, 960, 832]
    - [17, 2708.31]
  - - [64, 960, 1, 64, 64, 64, 64, 960]
    - [15, 280.879]
  - - [192, 960, 1, 64, 192, 192, 192, 960]
    - [6, 811.033]
  - - [320, 960, 1, 64, 320, 320, 320, 960]
    - [18, 1290.12]
  - - [448, 960, 1, 64, 448, 448, 448, 960]
    - [17, 1666.72]
  - - [576, 960, 1, 64, 576, 576, 576, 960]
    - [36, 2055.79]
  - - [704, 960, 1, 64, 704, 704, 704, 960]
    - [36, 2433.47]
  - - [832, 960, 1, 64, 832, 832, 832, 960]
    - [17, 2684.84]
  - - [960, 960, 1, 64, 960, 960, 960, 960]
    - [19, 2949.19]
  - - [64, 64, 1, 256, 64, 64, 64, 64]
    - [28, 67.5433]
  - - [192, 64, 1, 256, 192, 192, 192, 64]
    - [6, 197.602]
  - - [320, 64, 1, 256, 320, 320, 320, 64]
    - [7, 349.77]
  - - [448, 64, 1, 256, 448, 448, 448, 64]
    - [6, 484.507]
  - - [576, 64, 1, 256, 576, 576, 576, 64]
    - [15, 670.516]
  - - [704, 64, 1, 256, 704, 704, 704, 64]
    - [41, 773.364]
  - - [832, 64, 1, 256, 832, 832, 832, 64]
    - [41, 938.162]
  - - [960, 64, 1, 256, 960, 960, 960, 64]
    - [6, 1063.11]
  - - [64, 192, 1, 256, 64, 64, 64, 192]
    - [6, 201.397]
  - - [192, 192, 1, 256, 192, 192, 192, 192]
    - [43, 659.274]
  - - [320, 192, 1, 256, 320, 320, 320, 192]
    - [13, 1125.93]
  - - [448, 192, 1, 256, 448, 448, 448, 192]
    - [40, 1544.24]
  - - [576, 192, 1, 256, 576, 576, 576, 192]
    - [31, 1840.26]
  - - [704, 192, 1, 256, 704, 704, 704, 192]
    - [6, 2165.46]
  - - [832, 192, 1, 256, 832, 832, 832, 192]
    - [47, 2507.4]
  - - [960, 192, 1, 256, 960, 960, 960, 192]
    - [14, 2812.96]
  - - [64, 320, 1, 256, 64, 64, 64, 320]
    - [13, 350.355]
  - - [192, 320, 1, 256, 192, 192, 192, 320]
    - [30, 1076.57]
  - - [320, 320, 1, 256, 320, 320, 320, 320]
    - [43, 1678.8]
  - - [448, 320, 1, 256, 448, 448, 448, 320]
    - [6, 2297.42]
  - - [576, 320, 1, 256, 576, 576, 576, 320]
    - [17, 2794.63]
  - - [704, 320, 1, 256, 704, 704, 704, 320]
    - [31, 3344.35]
  - - [832, 320, 1, 256, 832, 832, 832, 320]
    - [17, 3801.41]
  - - [960, 320, 1, 256, 960, 960, 960, 320]
    - [17, 4352.38]
  - - [64, 448, 1, 256, 64, 64, 64, 448]
    - [0, 488.196]
  - - [192, 448, 1, 256, 192, 192, 192, 448]
    - [13, 1468.06]
  - - [320, 448, 1, 256, 320, 320, 320, 448]
    - [18, 2261.32]
  - - [448, 448, 1, 256, 448, 448, 448, 448]
    - [13, 3097.15]
  - - [576, 448, 1, 256, 576, 576, 576, 448]
    - [21, 3607.98]
  - - [704, 448, 1, 256, 704, 704, 704, 448]
    - [17, 4168.43]
  - - [832, 448, 1, 256, 832, 832, 832, 448]
    - [17, 4880.96]
  - - [960, 448, 1, 256, 960, 960, 960, 448]
    - [17, 5509.29]
  - - [64, 576, 1, 256, 64, 64, 64, 576]
    - [41, 668.616]
  - - [192, 576, 1, 256, 192, 192, 192, 576]
    - [13, 1761.82]
  - - [320, 576, 1, 256, 320, 320, 320, 576]
    - [23, 2895.82]
  - - [448, 576, 1, 256, 448, 448, 448, 576]
    - [23, 3713.44]
  - - [576, 576, 1, 256, 576, 576, 576, 576]
    - [36, 4642.63]
  - - [704, 576, 1, 256, 704, 704, 704, 576]
    - [17, 5316.86]
  - - [832, 576, 1, 256, 832, 832, 832, 576]
    - [36, 5973.05]
  - - [960, 576, 1, 256, 960, 960, 960, 576]
    - [36, 7011.45]
  - - [64, 704, 1, 256, 64, 64, 64, 704]
    - [43, 802.137]
  - - [192, 704, 1, 256, 192, 192, 192, 704]
    - [44, 2210.42]
  - - [320, 704, 1, 256, 320, 320, 320, 704]
    - [17, 3361.9]
  - - [448, 704, 1, 256, 448, 448, 448, 704]
    - [31, 4302.82]
  - - [576, 704, 1, 256, 576, 576, 576, 704]
    - [17, 5319.58]
  - - [704, 704, 1, 256, 704, 704, 704, 704]
    - [17, 5997.67]
  - - [832, 704, 1, 256, 832, 832, 832, 704]
    - [17, 6786.59]
  - - [960, 704, 1, 256, 960, 960, 960, 704]
    - [17, 7563.66]
  - - [64, 832, 1, 256, 64, 64, 64, 832]
    - [28, 931.144]
  - - [192, 832, 1, 256, 192, 192, 192, 832]
    - [7, 2568.83]
  - - [320, 832, 1, 256, 320, 320, 320, 832]
    - [23, 3908.11]
  - - [448, 832, 1, 256, 448, 448, 448, 832]
    - [31, 4916.17]
  - - [576, 832, 1, 256, 576, 576, 576, 832]
    - [17, 5996.4]
  - - [704, 832, 1, 256, 704, 704, 704, 832]
    - [17, 6769.74]
  - - [832, 832, 1, 256, 832, 832, 832, 832]
    - [17, 7545.96]
  - - [960, 832, 1, 256, 960, 960, 960, 832]
    - [17, 8402.57]
  - - [64, 960, 1, 256, 64, 64, 64, 960]
    - [40, 1077.34]
  - - [192, 960, 1, 256, 192, 192, 192, 960]
    - [23, 2924.54]
  - - [320, 960, 1, 256, 320, 320, 320, 960]
    - [17, 4366.76]
  - - [448, 960, 1, 256, 448, 448, 448, 960]
    - [23, 5443.92]
  - - [576, 960, 1, 256, 576, 576, 576, 960]
    - [36, 7013.37]
  - - [704, 960, 1, 256, 704, 704, 704, 960]
    - [36, 7909.62]
  - - [832, 960, 1, 256, 832, 832, 832, 960]
    - [17, 8225.12]
  - - [960, 960, 1, 256, 960, 960, 960, 960]
    - [23, 9001.85]
  - - [64, 64, 1, 512, 64, 64, 64, 64]
    - [6, 123.802]
  - - [192, 64, 1, 512, 192, 192, 192, 64]
    - [6, 399.47]
  - - [320, 64, 1, 512, 320, 320, 320, 64]
    - [7, 664.729]
  - - [448, 64, 1, 512, 448, 448, 448, 64]
    - [6, 916.673]
  - - [576, 64, 1, 512, 576, 576, 576, 64]
    - [49, 1237.3]
  - - [704, 64, 1, 512, 704, 704, 704, 64]
    - [40, 1438.24]
  - - [832, 64, 1, 512, 832, 832, 832, 64]
    - [13, 1748.24]
  - - [960, 64, 1, 512, 960, 960, 960, 64]
    - [43, 2019.79]
  - - [64, 192, 1, 512, 64, 64, 64, 192]
    - [16, 384.105]
  - - [192, 192, 1, 512, 192, 192, 192, 192]
    - [13, 1217.7]
  - - [320, 192, 1, 512, 320, 320, 320, 192]
    - [7, 2075.77]
  - - [448, 192, 1, 512, 448, 448, 448, 192]
    - [6, 2567.27]
  - - [576, 192, 1, 512, 576, 576, 576, 192]
    - [47, 3301.73]
  - - [704, 192, 1, 512, 704, 704, 704, 192]
    - [13, 3690.1]
  - - [832, 192, 1, 512, 832, 832, 832, 192]
    - [23, 4344.7]
  - - [960, 192, 1, 512, 960, 960, 960, 192]
    - [23, 5075.26]
  - - [64, 320, 1, 512, 64, 64, 64, 320]
    - [13, 669.183]
  - - [192, 320, 1, 512, 192, 192, 192, 320]
    - [6, 2026.3]
  - - [320, 320, 1, 512, 320, 320, 320, 320]
    - [47, 3038.56]
  - - [448, 320, 1, 512, 448, 448, 448, 320]
    - [13, 3845.06]
  - - [576, 320, 1, 512, 576, 576, 576, 320]
    - [34, 4934.73]
  - - [704, 320, 1, 512, 704, 704, 704, 320]
    - [47, 5479.62]
  - - [832, 320, 1, 512, 832, 832, 832, 320]
    - [20, 6541.18]
  - - [960, 320, 1, 512, 960, 960, 960, 320]
    - [17, 7118.8]
  - - [64, 448, 1, 512, 64, 64, 64, 448]
    - [13, 925.632]
  - - [192, 448, 1, 512, 192, 192, 192, 448]
    - [43, 2647.52]
  - - [320, 448, 1, 512, 320, 320, 320, 448]
    - [13, 3891.95]
  - - [448, 448, 1, 512, 448, 448, 448, 448]
    - [17, 5064.71]
  - - [576, 448, 1, 512, 576, 576, 576, 448]
    - [34, 6329.28]
  - - [704, 448, 1, 512, 704, 704, 704, 448]
    - [36, 7231.72]
  - - [832, 448, 1, 512, 832, 832, 832, 448]
    - [17, 7598.83]
  - - [960, 448, 1, 512, 960, 960, 960, 448]
    - [17, 8792.39]
  - - [64, 576, 1, 512, 64, 64, 64, 576]
    - [40, 1232.85]
  - - [192, 576, 1, 512, 192, 192, 192, 576]
    - [47, 3232.93]
  - - [320, 576, 1, 512, 320, 320, 320, 576]
    - [23, 4859.64]
  - - [448, 576, 1, 512, 448, 448, 448, 576]
    - [23, 6388.96]
  - - [576, 576, 1, 512, 576, 576, 576, 576]
    - [36, 7943.76]
  - - [704, 576, 1, 512, 704, 704, 704, 576]
    - [36, 8462.29]
  - - [832, 576, 1, 512, 832, 832, 832, 576]
    - [36, 10160.3]
  - - [960, 576, 1, 512, 960, 960, 960, 576]
    - [36, 11434.6]
  - - [64, 704, 1, 512, 64, 64, 64, 704]
    - [13, 1495.54]
  - - [192, 704, 1, 512, 192, 192, 192, 704]
    - [13, 3613.04]
  - - [320, 704, 1, 512, 320, 320, 320, 704]
    - [31, 5417.85]
  - - [448, 704, 1, 512, 448, 448, 448, 704]
    - [25, 7089.02]
  - - [576, 704, 1, 512, 576, 576, 576, 704]
    - [34, 8265.21]
  - - [704, 704, 1, 512, 704, 704, 704, 704]
    - [25, 10069.9]
  - - [832, 704, 1, 512, 832, 832, 832, 704]
    - [36, 10537.7]
  - - [960, 704, 1, 512, 960, 960, 960, 704]
    - [25, 12180.1]
  - - [64, 832, 1, 512, 64, 64, 64, 832]
    - [40, 1702.39]
  - - [192, 832, 1, 512, 192, 192, 192, 832]
    - [47, 4244.48]
  - - [320, 832, 1, 512, 320, 320, 320, 832]
    - [23, 6431.62]
  - - [448, 832, 1, 512, 448, 448, 448, 832]
    - [31, 7583.73]
  - - [576, 832, 1, 512, 576, 576, 576, 832]
    - [25, 9554.97]
  - - [704, 832, 1, 512, 704, 704, 704, 832]
    - [17, 9860.35]
  - - [832, 832, 1, 512, 832, 832, 832, 832]
    - [36, 11175.5]
  - - [960, 832, 1, 512, 960, 960, 960, 832]
    - [20, 12120.6]
  - - [64, 960, 1, 512, 64, 64, 64, 960]
    - [6, 1949.09]
  - - [192, 960, 1, 512, 192, 192, 192, 960]
    - [20, 5058.93]
  - - [320, 960, 1, 512, 320, 320, 320, 960]
    - [36, 7382.95]
  - - [448, 960, 1, 512, 448, 448, 448, 960]
    - [36, 8935.1]
  - - [576, 960, 1, 512, 576, 576, 576, 960]
    - [36, 11631.9]
  - - [704, 960, 1, 512, 704, 704, 704, 960]
    - [36, 12825.9]
  - - [832, 960, 1, 512, 832, 832, 832, 960]
    - [23, 12070.7]
  - - [960, 960, 1, 512, 960, 960, 960, 960]
    - [36, 14665.9]
  - - [64, 64, 1, 1024, 64, 64, 64, 64]
    - [1, 246.007]
  - - [192, 64, 1, 1024, 192, 192, 192, 64]
    - [3, 697.907]
  - - [320, 64, 1, 1024, 320, 320, 320, 64]
    - [2, 1188.56]
  - - [448, 64, 1, 1024, 448, 448, 448, 64]
    - [13, 1651.81]
  - - [576, 64, 1, 1024, 576, 576, 576, 64]
    - [43, 2103.7]
  - - [704, 64, 1, 1024, 704, 704, 704, 64]
    - [40, 2564.68]
  - - [832, 64, 1, 1024, 832, 832, 832, 64]
    - [43, 3021.75]
  - - [960, 64, 1, 1024, 960, 960, 960, 64]
    - [43, 3475.08]
  - - [64, 192, 1, 1024, 64, 64, 64, 192]
    - [9, 713.337]
  - - [192, 192, 1, 1024, 192, 192, 192, 192]
    - [43, 2095.46]
  - - [320, 192, 1, 1024, 320, 320, 320, 192]
    - [43, 3530.66]
  - - [448, 192, 1, 1024, 448, 448, 448, 192]
    - [43, 4398.63]
  - - [576, 192, 1, 1024, 576, 576, 576, 192]
    - [47, 5482.88]
  - - [704, 192, 1, 1024, 704, 704, 704, 192]
    - [38, 6108.34]
  - - [832, 192, 1, 1024, 832, 832, 832, 192]
    - [23, 7016.14]
  - - [960, 192, 1, 1024, 960, 960, 960, 192]
    - [23, 8047.4]
  - - [64, 320, 1, 1024, 64, 64, 64, 320]
    - [2, 1223.9]
  - - [192, 320, 1, 1024, 192, 192, 192, 320]
    - [40, 3530.66]
  - - [320, 320, 1, 1024, 320, 320, 320, 320]
    - [47, 5054.72]
  - - [448, 320, 1, 1024, 448, 448, 448, 320]
    - [47, 6132.15]
  - - [576, 320, 1, 1024, 576, 576, 576, 320]
    - [20, 7849.93]
  - - [704, 320, 1, 1024, 704, 704, 704, 320]
    - [47, 8484.4]
  - - [832, 320, 1, 1024, 832, 832, 832, 320]
    - [34, 9779.04]
  - - [960, 320, 1, 1024, 960, 960, 960, 320]
    - [36, 10862.7]
  - - [64, 448, 1, 1024, 64, 64, 64, 448]
    - [6, 1688.87]
  - - [192, 448, 1, 1024, 192, 192, 192, 448]
    - [40, 4314.6]
  - - [320, 448, 1, 1024, 320, 320, 320, 448]
    - [47, 6183.81]
  - - [448, 448, 1, 1024, 448, 448, 448, 448]
    - [47, 7540.81]
  - - [576, 448, 1, 1024, 576, 576, 576, 448]
    - [20, 9527.7]
  - - [704, 448, 1, 1024, 704, 704, 704, 448]
    - [36, 11481.2]
  - - [832, 448, 1, 1024, 832, 832, 832, 448]
    - [36, 11405.7]
  - - [960, 448, 1, 1024, 960, 960, 960, 448]
    - [36, 13039.7]
  - - [64, 576, 1, 1024, 64, 64, 64, 576]
    - [5, 2092.56]
  - - [192, 576, 1, 1024, 192, 192, 192, 576]
    - [47, 5444.66]
  - - [320, 576, 1, 1024, 320, 320, 320, 576]
    - [23, 7897.39]
  - - [448, 576, 1, 1024, 448, 448, 448, 576]
    - [36, 9707.79]
  - - [576, 576, 1, 1024, 576, 576, 576, 576]
    - [36, 12465.6]
  - - [704, 576, 1, 1024, 704, 704, 704, 576]
    - [36, 12865.8]
  - - [832, 576, 1, 1024, 832, 832, 832, 576]
    - [36, 14833.0]
  - - [960, 576, 1, 1024, 960, 960, 960, 576]
    - [36, 17206.0]
  - - [64, 704, 1, 1024, 64, 64, 64, 704]
    - [40, 2602.29]
  - - [192, 704, 1, 1024, 192, 192, 192, 704]
    - [20, 5925.3]
  - - [320, 704, 1, 1024, 320, 320, 320, 704]
    - [47, 8507.87]
  - - [448, 704, 1, 1024, 448, 448, 448, 704]
    - [25, 11376.3]
  - - [576, 704, 1, 1024, 576, 576, 576, 704]
    - [36, 12269.1]
  - - [704, 704, 1, 1024, 704, 704, 704, 704]
    - [25, 15006.7]
  - - [832, 704, 1, 1024, 832, 832, 832, 704]
    - [36, 15464.8]
  - - [960, 704, 1, 1024, 960, 960, 960, 704]
    - [25, 17734.2]
  - - [64, 832, 1, 1024, 64, 64, 64, 832]
    - [40, 3004.27]
  - - [192, 832, 1, 1024, 192, 192, 192, 832]
    - [34, 6922.61]
  - - [320, 832, 1, 1024, 320, 320, 320, 832]
    - [23, 9572.84]
  - - [448, 832, 1, 1024, 448, 448, 448, 832]
    - [38, 11076.4]
  - - [576, 832, 1, 1024, 576, 576, 576, 832]
    - [25, 14433.8]
  - - [704, 832, 1, 1024, 704, 704, 704, 832]
    - [36, 14253.8]
  - - [832, 832, 1, 1024, 832, 832, 832, 832]
    - [36, 16769.7]
  - - [960, 832, 1, 1024, 960, 960, 960, 832]
    - [25, 16979.8]
  - - [64, 960, 1, 1024, 64, 64, 64, 960]
    - [43, 3399.96]
  - - [192, 960, 1, 1024, 192, 192, 192, 960]
    - [23, 7875.97]
  - - [320, 960, 1, 1024, 320, 320, 320, 960]
    - [36, 11531.7]
  - - [448, 960, 1, 1024, 448, 448, 448, 960]
    - [36, 13359.9]
  - - [576, 960, 1, 1024, 576, 576, 576, 960]
    - [36, 17300.6]
  - - [704, 960, 1, 1024, 704, 704, 704, 960]
    - [36, 18313.8]
  - - [832, 960, 1, 1024, 832, 832, 832, 960]
    - [37, 16612.5]
  - - [960, 960, 1, 1024, 960, 960, 960, 960]
    - [36, 20617.1]
  - - [64, 64, 1, 2048, 64, 64, 64, 64]
    - [1, 466.565]
  - - [192, 64, 1, 2048, 192, 192, 192, 64]
    - [16, 1353.04]
  - - [320, 64, 1, 2048, 320, 320, 320, 64]
    - [42, 2093.02]
  - - [448, 64, 1, 2048, 448, 448, 448, 64]
    - [6, 2889.14]
  - - [576, 64, 1, 2048, 576, 576, 576, 64]
    - [22, 3411.62]
  - - [704, 64, 1, 2048, 704, 704, 704, 64]
    - [35, 4139.83]
  - - [832, 64, 1, 2048, 832, 832, 832, 64]
    - [43, 4735.31]
  - - [960, 64, 1, 2048, 960, 960, 960, 64]
    - [40, 5559.17]
  - - [64, 64, 1, 4096, 64, 64, 64, 64]
    - [10, 854.912]
  - - [192, 64, 1, 4096, 192, 192, 192, 64]
    - [46, 2395.72]
  - - [320, 64, 1, 4096, 320, 320, 320, 64]
    - [46, 3565.22]
  - - [448, 64, 1, 4096, 448, 448, 448, 64]
    - [48, 4814.22]
  - - [576, 64, 1, 4096, 576, 576, 576, 64]
    - [22, 5646.99]
  - - [704, 64, 1, 4096, 704, 704, 704, 64]
    - [35, 6783.78]
  - - [832, 64, 1, 4096, 832, 832, 832, 64]
    - [27, 7261.78]
  - - [960, 64, 1, 4096, 960, 960, 960, 64]
    - [38, 8267.63]
  - - [1280, 1280, 1, 64, 1280, 1280, 1280, 1280]
    - [19, 4253.17]
  - - [1536, 1280, 1, 64, 1536, 1536, 1536, 1280]
    - [19, 4669.94]
  - - [1792, 1280, 1, 64, 1792, 1792, 1792, 1280]
    - [33, 5039.59]
  - - [2048, 1280, 1, 64, 2048, 2048, 2048, 1280]
    - [12, 5253.72]
  - - [1280, 1536, 1, 64, 1280, 1280, 1280, 1536]
    - [26, 4761.93]
  - - [1536, 1536, 1, 64, 1536, 1536, 1536, 1536]
    - [19, 5116.04]
  - - [1792, 1536, 1, 64, 1792, 1792, 1792, 1536]
    - [25, 5601.39]
  - - [2048, 1536, 1, 64, 2048, 2048, 2048, 1536]
    - [25, 5665.75]
  - - [1280, 1792, 1, 64, 1280, 1280, 1280, 1792]
    - [12, 4957.89]
  - - [1536, 1792, 1, 64, 1536, 1536, 1536, 1792]
    - [33, 5464.13]
  - - [1792, 1792, 1, 64, 1792, 1792, 1792, 1792]
    - [19, 5823.94]
  - - [2048, 1792, 1, 64, 2048, 2048, 2048, 1792]
    - [11, 5995.84]
  - - [1280, 2048, 1, 64, 1280, 1280, 1280, 2048]
    - [19, 5374.9]
  - - [1536, 2048, 1, 64, 1536, 1536, 1536, 2048]
    - [33, 5776.28]
  - - [1792, 2048, 1, 64, 1792, 1792, 1792, 2048]
    - [19, 6039.0]
  - - [2048, 2048, 1, 64, 2048, 2048, 2048, 2048]
    - [11, 6351.47]
  - - [1280, 1280, 1, 256, 1280, 1280, 1280, 1280]
    - [25, 12171.9]
  - - [1536, 1280, 1, 256, 1536, 1536, 1536, 1280]
    - [25, 13093.9]
  - - [1792, 1280, 1, 256, 1792, 1792, 1792, 1280]
    - [23, 13263.1]
  - - [2048, 1280, 1, 256, 2048, 2048, 2048, 1280]
    - [25, 14592.5]
  - - [1280, 1536, 1, 256, 1280, 1280, 1280, 1536]
    - [25, 13887.1]
  - - [1536, 1536, 1, 256, 1536, 1536, 1536, 1536]
    - [25, 14552.3]
  - - [1792, 1536, 1, 256, 1792, 1792, 1792, 1536]
    - [36, 15574.3]
  - - [2048, 1536, 1, 256, 2048, 2048, 2048, 1536]
    - [25, 15470.7]
  - - [1280, 1792, 1, 256, 1280, 1280, 1280, 1792]
    - [36, 13844.7]
  - - [1536, 1792, 1, 256, 1536, 1536, 1536, 1792]
    - [36, 14813.1]
  - - [1792, 1792, 1, 256, 1792, 1792, 1792, 1792]
    - [36, 15189.0]
  - - [2048, 1792, 1, 256, 2048, 2048, 2048, 1792]
    - [25, 15929.9]
  - - [1280, 2048, 1, 256, 1280, 1280, 1280, 2048]
    - [36, 14454.1]
  - - [1536, 2048, 1, 256, 1536, 1536, 1536, 2048]
    - [25, 15225.2]
  - - [1792, 2048, 1, 256, 1792, 1792, 1792, 2048]
    - [25, 15617.6]
  - - [2048, 2048, 1, 256, 2048, 2048, 2048, 2048]
    - [25, 16373.5]
  - - [1280, 1280, 1, 512, 1280, 1280, 1280, 1280]
    - [25, 18702.4]
  - - [1536, 1280, 1, 512, 1536, 1536, 1536, 1280]
    - [25, 19680.6]
  - - [1792, 1280, 1, 512, 1792, 1792, 1792, 1280]
    - [25, 19256.5]
  - - [2048, 1280, 1, 512, 2048, 2048, 2048, 1280]
    - [25, 20529.5]
  - - [1280, 1536, 1, 512, 1280, 1280, 1280, 1536]
    - [25, 20450.3]
  - - [1536, 1536, 1, 512, 1536, 1536, 1536, 1536]
    - [25, 21078.4]
  - - [1792, 1536, 1, 512, 1792, 1792, 1792, 1536]
    - [25, 22140.3]
  - - [2048, 1536, 1, 512, 2048, 2048, 2048, 1536]
    - [25, 22217.6]
  - - [1280, 1792, 1, 512, 1280, 1280, 1280, 1792]
    - [36, 19603.5]
  - - [1536, 1792, 1, 512, 1536, 1536, 1536, 1792]
    - [25, 20956.7]
  - - [1792, 1792, 1, 512, 1792, 1792, 1792, 1792]
    - [25, 22231.2]
  - - [2048, 1792, 1, 512, 2048, 2048, 2048, 1792]
    - [25, 22789.3]
  - - [1280, 2048, 1, 512, 1280, 1280, 1280, 2048]
    - [36, 20583.0]
  - - [1536, 2048, 1, 512, 1536, 1536, 1536, 2048]
    - [25, 22086.5]
  - - [1792, 2048, 1, 512, 1792, 1792, 1792, 2048]
    - [25, 22768.8]
  - - [2048, 2048, 1, 512, 2048, 2048, 2048, 2048]
    - [25, 23364.4]
  - - [1280, 1280, 1, 1024, 1280, 1280, 1280, 1280]
    - [25, 23915.2]
  - - [1536, 1280, 1, 1024, 1536, 1536, 1536, 1280]
    - [25, 24733.8]
  - - [1792, 1280, 1, 1024, 1792, 1792, 1792, 1280]
    - [25, 25564.6]
  - - [2048, 1280, 1, 1024, 2048, 2048, 2048, 1280]
    - [25, 26179.4]
  - - [1280, 1536, 1, 1024, 1280, 1280, 1280, 1536]
    - [25, 25657.3]
  - - [1536, 1536, 1, 1024, 1536, 1536, 1536, 1536]
    - [25, 26834.0]
  - - [1792, 1536, 1, 1024, 1792, 1792, 1792, 1536]
    - [36, 27287.4]
  - - [2048, 1536, 1, 1024, 2048, 2048, 2048, 1536]
    - [25, 27210.4]
  - - [1280, 1792, 1, 1024, 1280, 1280, 1280, 1792]
    - [36, 25473.2]
  - - [1536, 1792, 1, 1024, 1536, 1536, 1536, 1792]
    - [25, 26360.0]
  - - [1792, 1792, 1, 1024, 1792, 1792, 1792, 1792]
    - [25, 27852.7]
  - - [2048, 1792, 1, 1024, 2048, 2048, 2048, 1792]
    - [25, 27862.5]
  - - [1280, 2048, 1, 1024, 1280, 1280, 1280, 2048]
    - [36, 26026.1]
  - - [1536, 2048, 1, 1024, 1536, 1536, 1536, 2048]
    - [25, 27231.5]
  - - [1792, 2048, 1, 1024, 1792, 1792, 1792, 2048]
    - [25, 28053.6]
  - - [2048, 2048, 1, 1024, 2048, 2048, 2048, 2048]
    - [25, 28058.8]
  - - [1280, 1280, 1, 2048, 1280, 1280, 1280, 1280]
    - [25, 28012.1]
  - - [1536, 1280, 1, 2048, 1536, 1536, 1536, 1280]
    - [25, 29023.0]
  - - [1792, 1280, 1, 2048, 1792, 1792, 1792, 1280]
    - [25, 29277.8]
  - - [2048, 1280, 1, 2048, 2048, 2048, 2048, 1280]
    - [25, 29483.1]
  - - [1280, 1536, 1, 2048, 1280, 1280, 1280, 1536]
    - [36, 29293.2]
  - - [1536, 1536, 1, 2048, 1536, 1536, 1536, 1536]
    - [25, 30087.0]
  - - [1792, 1536, 1, 2048, 1792, 1792, 1792, 1536]
    - [25, 30697.0]
  - - [2048, 1536, 1, 2048, 2048, 2048, 2048, 1536]
    - [25, 30463.3]
  - - [1280, 1792, 1, 2048, 1280, 1280, 1280, 1792]
    - [36, 29099.1]
  - - [1536, 1792, 1, 2048, 1536, 1536, 1536, 1792]
    - [25, 29474.0]
  - - [1792, 1792, 1, 2048, 1792, 1792, 1792, 1792]
    - [25, 30967.4]
  - - [2048, 1792, 1, 2048, 2048, 2048, 2048, 1792]
    - [25, 30471.1]
  - - [1280, 2048, 1, 2048, 1280, 1280, 1280, 2048]
    - [25, 29315.6]
  - - [1536, 2048, 1, 2048, 1536, 1536, 1536, 2048]
    - [36, 30253.7]
  - - [1792, 2048, 1, 2048, 1792, 1792, 1792, 2048]
    - [36, 30596.8]
  - - [2048, 2048, 1, 2048, 2048, 2048, 2048, 2048]
    - [36, 29644.5]
  - - [1280, 1280, 1, 4096, 1280, 1280, 1280, 1280]
    - [25, 31031.6]
  - - [1536, 1280, 1, 4096, 1536, 1536, 1536, 1280]
    - [25, 31058.6]
  - - [1792, 1280, 1, 4096, 1792, 1792, 1792, 1280]
    - [25, 31290.8]
  - - [2048, 1280, 1, 4096, 2048, 2048, 2048, 1280]
    - [25, 31501.6]
  - - [1280, 1536, 1, 4096, 1280, 1280, 1280, 1536]
    - [25, 31540.1]
  - - [1536, 1536, 1, 4096, 1536, 1536, 1536, 1536]
    - [25, 32416.4]
  - - [1792, 1536, 1, 4096, 1792, 1792, 1792, 1536]
    - [25, 32598.0]
  - - [2048, 1536, 1, 4096, 2048, 2048, 2048, 1536]
    - [36, 31795.7]
  - - [1280, 1792, 1, 4096, 1280, 1280, 1280, 1792]
    - [25, 31352.4]
  - - [1536, 1792, 1, 4096, 1536, 1536, 1536, 1792]
    - [36, 31186.0]
  - - [1792, 1792, 1, 4096, 1792, 1792, 1792, 1792]
    - [36, 32512.6]
  - - [2048, 1792, 1, 4096, 2048, 2048, 2048, 1792]
    - [25, 31769.3]
  - - [1280, 2048, 1, 4096, 1280, 1280, 1280, 2048]
    - [36, 31590.5]
  - - [1536, 2048, 1, 4096, 1536, 1536, 1536, 2048]
    - [36, 31655.4]
  - - [1792, 2048, 1, 4096, 1792, 1792, 1792, 2048]
    - [36, 31773.6]
  - - [2048, 2048, 1, 4096, 2048, 2048, 2048, 2048]
    - [36, 29161.9]
  - - [2560, 2560, 1, 64, 2560, 2560, 2560, 2560]
    - [11, 7070.88]
  - - [3072, 2560, 1, 64, 3072, 3072, 3072, 2560]
    - [19, 7294.71]
  - - [3584, 2560, 1, 64, 3584, 3584, 3584, 2560]
    - [19, 7622.39]
  - - [4096, 2560, 1, 64, 4096, 4096, 4096, 2560]
    - [11, 7834.6]
  - - [2560, 3072, 1, 64, 2560, 2560, 2560, 3072]
    - [25, 7568.33]
  - - [3072, 3072, 1, 64, 3072, 3072, 3072, 3072]
    - [25, 7895.93]
  - - [3584, 3072, 1, 64, 3584, 3584, 3584, 3072]
    - [25, 8078.82]
  - - [4096, 3072, 1, 64, 4096, 4096, 4096, 3072]
    - [25, 8325.6]
  - - [2560, 3584, 1, 64, 2560, 2560, 2560, 3584]
    - [25, 7719.59]
  - - [3072, 3584, 1, 64, 3072, 3072, 3072, 3584]
    - [25, 7929.19]
  - - [3584, 3584, 1, 64, 3584, 3584, 3584, 3584]
    - [25, 8210.86]
  - - [4096, 3584, 1, 64, 4096, 4096, 4096, 3584]
    - [25, 8418.56]
  - - [2560, 4096, 1, 64, 2560, 2560, 2560, 4096]
    - [11, 7857.12]
  - - [3072, 4096, 1, 64, 3072, 3072, 3072, 4096]
    - [25, 8136.01]
  - - [3584, 4096, 1, 64, 3584, 3584, 3584, 4096]
    - [25, 8238.84]
  - - [4096, 4096, 1, 64, 4096, 4096, 4096, 4096]
    - [12, 8343.27]
  - - [2560, 2560, 1, 256, 2560, 2560, 2560, 2560]
    - [25, 19129.7]
  - - [3072, 2560, 1, 256, 3072, 3072, 3072, 2560]
    - [25, 20010.5]
  - - [3584, 2560, 1, 256, 3584, 3584, 3584, 2560]
    - [25, 20517.2]
  - - [4096, 2560, 1, 256, 4096, 4096, 4096, 2560]
    - [25, 20926.7]
  - - [2560, 3072, 1, 256, 2560, 2560, 2560, 3072]
    - [25, 20504.6]
  - - [3072, 3072, 1, 256, 3072, 3072, 3072, 3072]
    - [25, 21160.7]
  - - [3584, 3072, 1, 256, 3584, 3584, 3584, 3072]
    - [25, 21658.1]
  - - [4096, 3072, 1, 256, 4096, 4096, 4096, 3072]
    - [25, 21946.7]
  - - [2560, 3584, 1, 256, 2560, 2560, 2560, 3584]
    - [25, 20657.8]
  - - [3072, 3584, 1, 256, 3072, 3072, 3072, 3584]
    - [25, 21298.9]
  - - [3584, 3584, 1, 256, 3584, 3584, 3584, 3584]
    - [25, 21857.6]
  - - [4096, 3584, 1, 256, 4096, 4096, 4096, 3584]
    - [25, 22229.4]
  - - [2560, 4096, 1, 256, 2560, 2560, 2560, 4096]
    - [25, 21010.2]
  - - [3072, 4096, 1, 256, 3072, 3072, 3072, 4096]
    - [25, 21675.2]
  - - [3584, 4096, 1, 256, 3584, 3584, 3584, 4096]
    - [25, 21809.5]
  - - [4096, 4096, 1, 256, 4096, 4096, 4096, 4096]
    - [25, 21722.1]
  - - [2560, 2560, 1, 512, 2560, 2560, 2560, 2560]
    - [25, 26268.7]
  - - [3072, 2560, 1, 512, 3072, 3072, 3072, 2560]
    - [25, 27073.9]
  - - [3584, 2560, 1, 512, 3584, 3584, 3584, 2560]
    - [25, 27523.9]
  - - [4096, 2560, 1, 512, 4096, 4096, 4096, 2560]
    - [25, 27822.4]
  - - [2560, 3072, 1, 512, 2560, 2560, 2560, 3072]
    - [25, 27558.5]
  - - [3072, 3072, 1, 512, 3072, 3072, 3072, 3072]
    - [25, 28107.9]
  - - [3584, 3072, 1, 512, 3584, 3584, 3584, 3072]
    - [25, 28715.2]
  - - [4096, 3072, 1, 512, 4096, 4096, 4096, 3072]
    - [25, 28794.7]
  - - [2560, 3584, 1, 512, 2560, 2560, 2560, 3584]
    - [25, 27881.6]
  - - [3072, 3584, 1, 512, 3072, 3072, 3072, 3584]
    - [25, 28632.6]
  - - [3584, 3584, 1, 512, 3584, 3584, 3584, 3584]
    - [25, 28884.2]
  - - [4096, 3584, 1, 512, 4096, 4096, 4096, 3584]
    - [25, 28961.7]
  - - [2560, 4096, 1, 512, 2560, 2560, 2560, 4096]
    - [36, 27820.5]
  - - [3072, 4096, 1, 512, 3072, 3072, 3072, 4096]
    - [36, 28220.2]
  - - [3584, 4096, 1, 512, 3584, 3584, 3584, 4096]
    - [36, 28727.0]
  - - [4096, 4096, 1, 512, 4096, 4096, 4096, 4096]
    - [25, 28260.5]
  - - [2560, 2560, 1, 1024, 2560, 2560, 2560, 2560]
    - [25, 30802.0]
  - - [3072, 2560, 1, 1024, 3072, 3072, 3072, 2560]
    - [25, 31142.3]
  - - [3584, 2560, 1, 1024, 3584, 3584, 3584, 2560]
    - [25, 31521.0]
  - - [4096, 2560, 1, 1024, 4096, 4096, 4096, 2560]
    - [25, 31820.7]
  - - [2560, 3072, 1, 1024, 2560, 2560, 2560, 3072]
    - [25, 31729.8]
  - - [3072, 3072, 1, 1024, 3072, 3072, 3072, 3072]
    - [25, 31971.9]
  - - [3584, 3072, 1, 1024, 3584, 3584, 3584, 3072]
    - [25, 32501.6]
  - - [4096, 3072, 1, 1024, 4096, 4096, 4096, 3072]
    - [25, 32119.2]
  - - [2560, 3584, 1, 1024, 2560, 2560, 2560, 3584]
    - [25, 31903.4]
  - - [3072, 3584, 1, 1024, 3072, 3072, 3072, 3584]
    - [25, 32395.4]
  - - [3584, 3584, 1, 1024, 3584, 3584, 3584, 3584]
    - [25, 32446.2]
  - - [4096, 3584, 1, 1024, 4096, 4096, 4096, 3584]
    - [25, 32717.1]
  - - [2560, 4096, 1, 1024, 2560, 2560, 2560, 4096]
    - [36, 31983.1]
  - - [3072, 4096, 1, 1024, 3072, 3072, 3072, 4096]
    - [36, 31465.0]
  - - [3584, 4096, 1, 1024, 3584, 3584, 3584, 4096]
    - [36, 31795.1]
  - - [4096, 4096, 1, 1024, 4096, 4096, 4096, 4096]
    - [36, 31133.5]
  - - [2560, 2560, 1, 2048, 2560, 2560, 2560, 2560]
    - [36, 32968.3]
  - - [3072, 2560, 1, 2048, 3072, 3072, 3072, 2560]
    - [36, 32594.0]
  - - [3584, 2560, 1, 2048, 3584, 3584, 3584, 2560]
    - [36, 33075.3]
  - - [4096, 2560, 1, 2048, 4096, 4096, 4096, 2560]
    - [25, 33224.0]
  - - [2560, 3072, 1, 2048, 2560, 2560, 2560, 3072]
    - [36, 33345.2]
  - - [3072, 3072, 1, 2048, 3072, 3072, 3072, 3072]
    - [36, 33447.2]
  - - [3584, 3072, 1, 2048, 3584, 3584, 3584, 3072]
    - [25, 33814.4]
  - - [4096, 3072, 1, 2048, 4096, 4096, 4096, 3072]
    - [25, 33841.5]
  - - [2560, 3584, 1, 2048, 2560, 2560, 2560, 3584]
    - [25, 33424.1]
  - - [3072, 3584, 1, 2048, 3072, 3072, 3072, 3584]
    - [25, 33690.8]
  - - [3584, 3584, 1, 2048, 3584, 3584, 3584, 3584]
    - [25, 33714.8]
  - - [4096, 3584, 1, 2048, 4096, 4096, 4096, 3584]
    - [25, 33844.7]
  - - [2560, 4096, 1, 2048, 2560, 2560, 2560, 4096]
    - [36, 32894.0]
  - - [3072, 4096, 1, 2048, 3072, 3072, 3072, 4096]
    - [36, 32815.7]
  - - [3584, 4096, 1, 2048, 3584, 3584, 3584, 4096]
    - [36, 33077.2]
  - - [4096, 4096, 1, 2048, 4096, 4096, 4096, 4096]
    - [36, 31020.0]
  - - [2560, 2560, 1, 4096, 2560, 2560, 2560, 2560]
    - [25, 33918.2]
  - - [3072, 2560, 1, 4096, 3072, 3072, 3072, 2560]
    - [36, 33823.1]
  - - [3584, 2560, 1, 4096, 3584, 3584, 3584, 2560]
    - [36, 34125.1]
  - - [4096, 2560, 1, 4096, 4096, 4096, 4096, 2560]
    - [25, 34181.9]
  - - [2560, 3072, 1, 4096, 2560, 2560, 2560, 3072]
    - [36, 34565.8]
  - - [3072, 3072, 1, 4096, 3072, 3072, 3072, 3072]
    - [36, 34461.8]
  - - [3584, 3072, 1, 4096, 3584, 3584, 3584, 3072]
    - [36, 34859.7]
  - - [4096, 3072, 1, 4096, 4096, 4096, 4096, 3072]
    - [36, 34718.7]
  - - [2560, 3584, 1, 4096, 2560, 2560, 2560, 3584]
    - [25, 34458.4]
  - - [3072, 3584, 1, 4096, 3072, 3072, 3072, 3584]
    - [25, 34648.0]
  - - [3584, 3584, 1, 4096, 3584, 3584, 3584, 3584]
    - [25, 34508.2]
  - - [4096, 3584, 1, 4096, 4096, 4096, 4096, 3584]
    - [25, 34429.5]
  - - [2560, 4096, 1, 4096, 2560, 2560, 2560, 4096]
    - [36, 33058.3]
  - - [3072, 4096, 1, 4096, 3072, 3072, 3072, 4096]
    - [36, 32905.5]
  - - [3584, 4096, 1, 4096, 3584, 3584, 3584, 4096]
    - [36, 31580.0]
  - - [4096, 4096, 1, 4096, 4096, 4096, 4096, 4096]
    - [36, 28956.8]
  - - [1, 1, 1, 1, 1, 1, 1, 1]
    - [45, 6.39202e-05]
  - - [1, 1, 1, 64, 1, 1, 1, 1]
    - [8, 0.0042484]
  - - [1, 64, 1, 1, 1, 1, 1, 64]
    - [29, 0.00421191]
  - - [64, 1, 1, 1, 64, 64, 64, 1]
    - [15, 0.00414132]
  - - [64, 64, 1, 1, 64, 64, 64, 64]
    - [45, 0.27827]
  - - [64, 1, 1, 64, 64, 64, 64, 1]
    - [15, 0.25778]
  - - [1, 64, 1, 64, 1, 1, 1, 64]
    - [4, 0.259907]
- null
- null
- DeviceEfficiency
- GridBased
