library/src/amd_detail/rocblaslt/src/Tensile/Logic/asm_full/navi32/GridBased/navi32_Cijk_Ailk_Bljk_BSS_BH_Bias_HAH.yaml
- {MinimumRequiredVersion: 4.33.0}
- navi32
- gfx1101
- [Device 73f0]
    SolutionIndex: 0
    SolutionNameMin: Cijk_Ailk_Bljk_BSS_BH_Bias_HAH_MT32x32x64_MI16x16x16x1_SN_MIWT1_1_WG32_4_1
    SolutionIndex: 1
    SolutionNameMin: Cijk_Ailk_Bljk_BSS_BH_Bias_HAH_MT16x16x64_MI16x16x16x1_SN_MIWT1_1_WG16_2_1
    SolutionIndex: 2
    SolutionNameMin: Cijk_Ailk_Bljk_BSS_BH_Bias_HAH_MT32x16x64_MI16x16x16x1_SN_MIWT1_1_WG32_2_1
- - - [64, 64, 1, 64, 64, 64, 64, 64]
    - [2, 0.153]
  - - [192, 64, 1, 64, 192, 192, 192, 64]
    - [2, 0.452]
  - - [320, 64, 1, 64, 320, 320, 320, 64]
    - [0, 0.732]
  - - [448, 64, 1, 64, 448, 448, 448, 64]
    - [0, 1.014]
  - - [576, 64, 1, 64, 576, 576, 576, 64]
    - [2, 1.225]
  - - [704, 64, 1, 64, 704, 704, 704, 64]
    - [2, 1.49]
  - - [832, 64, 1, 64, 832, 832, 832, 64]
    - [0, 1.732]
  - - [960, 64, 1, 64, 960, 960, 960, 64]
    - [0, 1.994]
  - - [1088, 64, 1, 64, 1088, 1088, 1088, 64]
    - [2, 2.112]
  - - [1216, 64, 1, 64, 1216, 1216, 1216, 64]
    - [0, 2.32]
  - - [1344, 64, 1, 64, 1344, 1344, 1344, 64]
    - [0, 2.563]
  - - [1472, 64, 1, 64, 1472, 1472, 1472, 64]
    - [2, 2.648]
  - - [1600, 64, 1, 64, 1600, 1600, 1600, 64]
    - [2, 2.863]
  - - [1728, 64, 1, 64, 1728, 1728, 1728, 64]
    - [0, 3.041]
  - - [1856, 64, 1, 64, 1856, 1856, 1856, 64]
    - [0, 3.264]
  - - [1984, 64, 1, 64, 1984, 1984, 1984, 64]
    - [0, 3.319]
  - - [2112, 64, 1, 64, 2112, 2112, 2112, 64]
    - [2, 3.517]
  - - [2240, 64, 1, 64, 2240, 2240, 2240, 64]
    - [0, 3.729]
  - - [2368, 64, 1, 64, 2368, 2368, 2368, 64]
    - [0, 3.938]
  - - [2496, 64, 1, 64, 2496, 2496, 2496, 64]
    - [0, 3.967]
  - - [2624, 64, 1, 64, 2624, 2624, 2624, 64]
    - [0, 4.146]
  - - [2752, 64, 1, 64, 2752, 2752, 2752, 64]
    - [0, 4.315]
  - - [2880, 64, 1, 64, 2880, 2880, 2880, 64]
    - [0, 4.518]
  - - [3008, 64, 1, 64, 3008, 3008, 3008, 64]
    - [0, 4.497]
  - - [3136, 64, 1, 64, 3136, 3136, 3136, 64]
    - [0, 4.677]
  - - [3264, 64, 1, 64, 3264, 3264, 3264, 64]
    - [0, 4.873]
  - - [3392, 64, 1, 64, 3392, 3392, 3392, 64]
    - [0, 4.878]
  - - [3520, 64, 1, 64, 3520, 3520, 3520, 64]
    - [0, 4.982]
  - - [3648, 64, 1, 64, 3648, 3648, 3648, 64]
    - [0, 5.165]
  - - [3776, 64, 1, 64, 3776, 3776, 3776, 64]
    - [0, 5.299]
  - - [3904, 64, 1, 64, 3904, 3904, 3904, 64]
    - [0, 5.282]
  - - [4032, 64, 1, 64, 4032, 4032, 4032, 64]
    - [0, 5.386]
  - - [64, 192, 1, 64, 64, 64, 64, 64]
    - [2, 0.457]
  - - [192, 192, 1, 64, 192, 192, 192, 64]
    - [2, 1.247]
  - - [320, 192, 1, 64, 320, 320, 320, 64]
    - [0, 2.016]
  - - [448, 192, 1, 64, 448, 448, 448, 64]
    - [0, 2.58]
  - - [576, 192, 1, 64, 576, 576, 576, 64]
    - [0, 3.085]
  - - [704, 192, 1, 64, 704, 704, 704, 64]
    - [0, 3.558]
  - - [832, 192, 1, 64, 832, 832, 832, 64]
    - [0, 3.973]
  - - [960, 192, 1, 64, 960, 960, 960, 64]
    - [0, 4.514]
  - - [1088, 192, 1, 64, 1088, 1088, 1088, 64]
    - [0, 4.86]
  - - [1216, 192, 1, 64, 1216, 1216, 1216, 64]
    - [0, 5.16]
  - - [1344, 192, 1, 64, 1344, 1344, 1344, 64]
    - [0, 5.417]
  - - [1472, 192, 1, 64, 1472, 1472, 1472, 64]
    - [0, 5.665]
  - - [1600, 192, 1, 64, 1600, 1600, 1600, 64]
    - [0, 5.864]
  - - [1728, 192, 1, 64, 1728, 1728, 1728, 64]
    - [0, 6.217]
  - - [1856, 192, 1, 64, 1856, 1856, 1856, 64]
    - [0, 6.433]
  - - [1984, 192, 1, 64, 1984, 1984, 1984, 64]
    - [0, 6.622]
  - - [2112, 192, 1, 64, 2112, 2112, 2112, 64]
    - [0, 6.73]
  - - [2240, 192, 1, 64, 2240, 2240, 2240, 64]
    - [0, 6.895]
  - - [2368, 192, 1, 64, 2368, 2368, 2368, 64]
    - [0, 7.0]
  - - [2496, 192, 1, 64, 2496, 2496, 2496, 64]
    - [0, 7.217]
  - - [2624, 192, 1, 64, 2624, 2624, 2624, 64]
    - [0, 7.402]
  - - [2752, 192, 1, 64, 2752, 2752, 2752, 64]
    - [0, 7.541]
  - - [2880, 192, 1, 64, 2880, 2880, 2880, 64]
    - [0, 7.699]
  - - [3008, 192, 1, 64, 3008, 3008, 3008, 64]
    - [0, 7.845]
  - - [3136, 192, 1, 64, 3136, 3136, 3136, 64]
    - [0, 7.977]
  - - [3264, 192, 1, 64, 3264, 3264, 3264, 64]
    - [0, 8.072]
  - - [3392, 192, 1, 64, 3392, 3392, 3392, 64]
    - [0, 8.198]
  - - [3520, 192, 1, 64, 3520, 3520, 3520, 64]
    - [0, 8.293]
  - - [3648, 192, 1, 64, 3648, 3648, 3648, 64]
    - [0, 8.408]
  - - [3776, 192, 1, 64, 3776, 3776, 3776, 64]
    - [0, 8.499]
  - - [3904, 192, 1, 64, 3904, 3904, 3904, 64]
    - [0, 8.579]
  - - [4032, 192, 1, 64, 4032, 4032, 4032, 64]
    - [0, 8.628]
  - - [64, 320, 1, 64, 64, 64, 64, 64]
    - [0, 0.74]
  - - [192, 320, 1, 64, 192, 192, 192, 64]
    - [0, 2.011]
  - - [320, 320, 1, 64, 320, 320, 320, 64]
    - [2, 2.876]
  - - [448, 320, 1, 64, 448, 448, 448, 64]
    - [0, 3.761]
  - - [576, 320, 1, 64, 576, 576, 576, 64]
    - [0, 4.535]
  - - [704, 320, 1, 64, 704, 704, 704, 64]
    - [0, 4.977]
  - - [832, 320, 1, 64, 832, 832, 832, 64]
    - [0, 5.411]
  - - [960, 320, 1, 64, 960, 960, 960, 64]
    - [0, 5.908]
  - - [1088, 320, 1, 64, 1088, 1088, 1088, 64]
    - [0, 6.317]
  - - [1216, 320, 1, 64, 1216, 1216, 1216, 64]
    - [0, 6.708]
  - - [1344, 320, 1, 64, 1344, 1344, 1344, 64]
    - [0, 6.833]
  - - [1472, 320, 1, 64, 1472, 1472, 1472, 64]
    - [0, 7.121]
  - - [1600, 320, 1, 64, 1600, 1600, 1600, 64]
    - [0, 7.49]
  - - [1728, 320, 1, 64, 1728, 1728, 1728, 64]
    - [0, 7.741]
  - - [1856, 320, 1, 64, 1856, 1856, 1856, 64]
    - [0, 7.985]
  - - [1984, 320, 1, 64, 1984, 1984, 1984, 64]
    - [0, 8.163]
  - - [2112, 320, 1, 64, 2112, 2112, 2112, 64]
    - [0, 8.37]
  - - [2240, 320, 1, 64, 2240, 2240, 2240, 64]
    - [0, 8.402]
  - - [2368, 320, 1, 64, 2368, 2368, 2368, 64]
    - [0, 8.563]
  - - [2496, 320, 1, 64, 2496, 2496, 2496, 64]
    - [0, 8.743]
  - - [2624, 320, 1, 64, 2624, 2624, 2624, 64]
    - [0, 8.837]
  - - [2752, 320, 1, 64, 2752, 2752, 2752, 64]
    - [0, 9.075]
  - - [2880, 320, 1, 64, 2880, 2880, 2880, 64]
    - [0, 9.163]
  - - [3008, 320, 1, 64, 3008, 3008, 3008, 64]
    - [0, 9.319]
  - - [3136, 320, 1, 64, 3136, 3136, 3136, 64]
    - [0, 9.443]
  - - [3264, 320, 1, 64, 3264, 3264, 3264, 64]
    - [0, 9.49]
  - - [3392, 320, 1, 64, 3392, 3392, 3392, 64]
    - [0, 9.62]
  - - [3520, 320, 1, 64, 3520, 3520, 3520, 64]
    - [0, 9.665]
  - - [3648, 320, 1, 64, 3648, 3648, 3648, 64]
    - [0, 9.754]
  - - [3776, 320, 1, 64, 3776, 3776, 3776, 64]
    - [0, 9.88]
  - - [3904, 320, 1, 64, 3904, 3904, 3904, 64]
    - [0, 9.976]
  - - [4032, 320, 1, 64, 4032, 4032, 4032, 64]
    - [0, 10.122]
  - - [64, 448, 1, 64, 64, 64, 64, 64]
    - [0, 1.028]
  - - [192, 448, 1, 64, 192, 192, 192, 64]
    - [0, 2.59]
  - - [320, 448, 1, 64, 320, 320, 320, 64]
    - [0, 3.754]
  - - [448, 448, 1, 64, 448, 448, 448, 64]
    - [0, 4.696]
  - - [576, 448, 1, 64, 576, 576, 576, 64]
    - [0, 5.374]
  - - [704, 448, 1, 64, 704, 704, 704, 64]
    - [0, 6.025]
  - - [832, 448, 1, 64, 832, 832, 832, 64]
    - [0, 6.57]
  - - [960, 448, 1, 64, 960, 960, 960, 64]
    - [0, 6.865]
  - - [1088, 448, 1, 64, 1088, 1088, 1088, 64]
    - [0, 7.296]
  - - [1216, 448, 1, 64, 1216, 1216, 1216, 64]
    - [0, 7.732]
  - - [1344, 448, 1, 64, 1344, 1344, 1344, 64]
    - [0, 8.033]
  - - [1472, 448, 1, 64, 1472, 1472, 1472, 64]
    - [0, 8.289]
  - - [1600, 448, 1, 64, 1600, 1600, 1600, 64]
    - [0, 8.524]
  - - [1728, 448, 1, 64, 1728, 1728, 1728, 64]
    - [0, 8.739]
  - - [1856, 448, 1, 64, 1856, 1856, 1856, 64]
    - [0, 8.909]
  - - [1984, 448, 1, 64, 1984, 1984, 1984, 64]
    - [0, 9.006]
  - - [2112, 448, 1, 64, 2112, 2112, 2112, 64]
    - [0, 9.295]
  - - [2240, 448, 1, 64, 2240, 2240, 2240, 64]
    - [0, 9.399]
  - - [2368, 448, 1, 64, 2368, 2368, 2368, 64]
    - [0, 9.587]
  - - [2496, 448, 1, 64, 2496, 2496, 2496, 64]
    - [0, 9.659]
  - - [2624, 448, 1, 64, 2624, 2624, 2624, 64]
    - [0, 9.675]
  - - [2752, 448, 1, 64, 2752, 2752, 2752, 64]
    - [0, 9.883]
  - - [2880, 448, 1, 64, 2880, 2880, 2880, 64]
    - [0, 10.016]
  - - [3008, 448, 1, 64, 3008, 3008, 3008, 64]
    - [0, 10.104]
  - - [3136, 448, 1, 64, 3136, 3136, 3136, 64]
    - [0, 10.186]
  - - [3264, 448, 1, 64, 3264, 3264, 3264, 64]
    - [0, 10.271]
  - - [3392, 448, 1, 64, 3392, 3392, 3392, 64]
    - [0, 10.348]
  - - [3520, 448, 1, 64, 3520, 3520, 3520, 64]
    - [0, 10.473]
  - - [3648, 448, 1, 64, 3648, 3648, 3648, 64]
    - [0, 10.535]
  - - [3776, 448, 1, 64, 3776, 3776, 3776, 64]
    - [0, 10.565]
  - - [3904, 448, 1, 64, 3904, 3904, 3904, 64]
    - [0, 10.694]
  - - [4032, 448, 1, 64, 4032, 4032, 4032, 64]
    - [0, 10.751]
  - - [64, 576, 1, 64, 64, 64, 64, 64]
    - [2, 1.245]
  - - [192, 576, 1, 64, 192, 192, 192, 64]
    - [0, 3.097]
  - - [320, 576, 1, 64, 320, 320, 320, 64]
    - [0, 4.557]
  - - [448, 576, 1, 64, 448, 448, 448, 64]
    - [2, 4.937]
  - - [576, 576, 1, 64, 576, 576, 576, 64]
    - [0, 6.205]
  - - [704, 576, 1, 64, 704, 704, 704, 64]
    - [0, 6.78]
  - - [832, 576, 1, 64, 832, 832, 832, 64]
    - [0, 7.341]
  - - [960, 576, 1, 64, 960, 960, 960, 64]
    - [0, 7.764]
  - - [1088, 576, 1, 64, 1088, 1088, 1088, 64]
    - [0, 8.131]
  - - [1216, 576, 1, 64, 1216, 1216, 1216, 64]
    - [0, 8.457]
  - - [1344, 576, 1, 64, 1344, 1344, 1344, 64]
    - [0, 8.614]
  - - [1472, 576, 1, 64, 1472, 1472, 1472, 64]
    - [0, 8.931]
  - - [1600, 576, 1, 64, 1600, 1600, 1600, 64]
    - [0, 9.241]
  - - [1728, 576, 1, 64, 1728, 1728, 1728, 64]
    - [0, 9.394]
  - - [1856, 576, 1, 64, 1856, 1856, 1856, 64]
    - [0, 9.606]
  - - [1984, 576, 1, 64, 1984, 1984, 1984, 64]
    - [0, 9.678]
  - - [2112, 576, 1, 64, 2112, 2112, 2112, 64]
    - [0, 9.863]
  - - [2240, 576, 1, 64, 2240, 2240, 2240, 64]
    - [0, 10.078]
  - - [2368, 576, 1, 64, 2368, 2368, 2368, 64]
    - [0, 10.16]
  - - [2496, 576, 1, 64, 2496, 2496, 2496, 64]
    - [0, 10.201]
  - - [2624, 576, 1, 64, 2624, 2624, 2624, 64]
    - [0, 10.344]
  - - [2752, 576, 1, 64, 2752, 2752, 2752, 64]
    - [0, 10.486]
  - - [2880, 576, 1, 64, 2880, 2880, 2880, 64]
    - [0, 10.579]
  - - [3008, 576, 1, 64, 3008, 3008, 3008, 64]
    - [0, 10.651]
  - - [3136, 576, 1, 64, 3136, 3136, 3136, 64]
    - [0, 10.694]
  - - [3264, 576, 1, 64, 3264, 3264, 3264, 64]
    - [0, 10.823]
  - - [3392, 576, 1, 64, 3392, 3392, 3392, 64]
    - [0, 10.807]
  - - [3520, 576, 1, 64, 3520, 3520, 3520, 64]
    - [0, 10.956]
  - - [3648, 576, 1, 64, 3648, 3648, 3648, 64]
    - [0, 10.994]
  - - [3776, 576, 1, 64, 3776, 3776, 3776, 64]
    - [0, 10.986]
  - - [3904, 576, 1, 64, 3904, 3904, 3904, 64]
    - [0, 11.096]
  - - [4032, 576, 1, 64, 4032, 4032, 4032, 64]
    - [0, 11.127]
  - - [64, 704, 1, 64, 64, 64, 64, 64]
    - [2, 1.513]
  - - [192, 704, 1, 64, 192, 192, 192, 64]
    - [0, 3.56]
  - - [320, 704, 1, 64, 320, 320, 320, 64]
    - [0, 5.005]
  - - [448, 704, 1, 64, 448, 448, 448, 64]
    - [0, 6.015]
  - - [576, 704, 1, 64, 576, 576, 576, 64]
    - [0, 6.754]
  - - [704, 704, 1, 64, 704, 704, 704, 64]
    - [0, 7.38]
  - - [832, 704, 1, 64, 832, 832, 832, 64]
    - [0, 7.889]
  - - [960, 704, 1, 64, 960, 960, 960, 64]
    - [0, 8.356]
  - - [1088, 704, 1, 64, 1088, 1088, 1088, 64]
    - [0, 8.658]
  - - [1216, 704, 1, 64, 1216, 1216, 1216, 64]
    - [0, 8.974]
  - - [1344, 704, 1, 64, 1344, 1344, 1344, 64]
    - [0, 9.291]
  - - [1472, 704, 1, 64, 1472, 1472, 1472, 64]
    - [0, 9.49]
  - - [1600, 704, 1, 64, 1600, 1600, 1600, 64]
    - [0, 9.7]
  - - [1728, 704, 1, 64, 1728, 1728, 1728, 64]
    - [0, 9.851]
  - - [1856, 704, 1, 64, 1856, 1856, 1856, 64]
    - [0, 10.061]
  - - [1984, 704, 1, 64, 1984, 1984, 1984, 64]
    - [0, 10.149]
  - - [2112, 704, 1, 64, 2112, 2112, 2112, 64]
    - [0, 10.325]
  - - [2240, 704, 1, 64, 2240, 2240, 2240, 64]
    - [0, 10.483]
  - - [2368, 704, 1, 64, 2368, 2368, 2368, 64]
    - [0, 10.565]
  - - [2496, 704, 1, 64, 2496, 2496, 2496, 64]
    - [0, 10.687]
  - - [2624, 704, 1, 64, 2624, 2624, 2624, 64]
    - [0, 10.772]
  - - [2752, 704, 1, 64, 2752, 2752, 2752, 64]
    - [0, 10.85]
  - - [2880, 704, 1, 64, 2880, 2880, 2880, 64]
    - [0, 10.94]
  - - [3008, 704, 1, 64, 3008, 3008, 3008, 64]
    - [0, 11.052]
  - - [3136, 704, 1, 64, 3136, 3136, 3136, 64]
    - [0, 11.104]
  - - [3264, 704, 1, 64, 3264, 3264, 3264, 64]
    - [0, 11.123]
  - - [3392, 704, 1, 64, 3392, 3392, 3392, 64]
    - [0, 11.125]
  - - [3520, 704, 1, 64, 3520, 3520, 3520, 64]
    - [0, 11.308]
  - - [3648, 704, 1, 64, 3648, 3648, 3648, 64]
    - [0, 11.297]
  - - [3776, 704, 1, 64, 3776, 3776, 3776, 64]
    - [0, 11.389]
  - - [3904, 704, 1, 64, 3904, 3904, 3904, 64]
    - [0, 11.366]
  - - [4032, 704, 1, 64, 4032, 4032, 4032, 64]
    - [0, 11.486]
  - - [64, 832, 1, 64, 64, 64, 64, 64]
    - [0, 0.979]
  - - [192, 832, 1, 64, 192, 192, 192, 64]
    - [0, 2.939]
  - - [320, 832, 1, 64, 320, 320, 320, 64]
    - [0, 4.878]
  - - [448, 832, 1, 64, 448, 448, 448, 64]
    - [0, 6.545]
  - - [576, 832, 1, 64, 576, 576, 576, 64]
    - [0, 7.221]
  - - [704, 832, 1, 64, 704, 704, 704, 64]
    - [0, 7.911]
  - - [832, 832, 1, 64, 832, 832, 832, 64]
    - [0, 8.383]
  - - [960, 832, 1, 64, 960, 960, 960, 64]
    - [0, 8.74]
  - - [1088, 832, 1, 64, 1088, 1088, 1088, 64]
    - [0, 9.12]
  - - [1216, 832, 1, 64, 1216, 1216, 1216, 64]
    - [0, 9.43]
  - - [1344, 832, 1, 64, 1344, 1344, 1344, 64]
    - [0, 9.716]
  - - [1472, 832, 1, 64, 1472, 1472, 1472, 64]
    - [0, 9.872]
  - - [1600, 832, 1, 64, 1600, 1600, 1600, 64]
    - [0, 10.133]
  - - [1728, 832, 1, 64, 1728, 1728, 1728, 64]
    - [0, 10.242]
  - - [1856, 832, 1, 64, 1856, 1856, 1856, 64]
    - [0, 10.451]
  - - [1984, 832, 1, 64, 1984, 1984, 1984, 64]
    - [0, 10.512]
  - - [2112, 832, 1, 64, 2112, 2112, 2112, 64]
    - [0, 10.629]
  - - [2240, 832, 1, 64, 2240, 2240, 2240, 64]
    - [0, 10.725]
  - - [2368, 832, 1, 64, 2368, 2368, 2368, 64]
    - [0, 10.846]
  - - [2496, 832, 1, 64, 2496, 2496, 2496, 64]
    - [0, 10.989]
  - - [2624, 832, 1, 64, 2624, 2624, 2624, 64]
    - [0, 10.986]
  - - [2752, 832, 1, 64, 2752, 2752, 2752, 64]
    - [0, 11.164]
  - - [2880, 832, 1, 64, 2880, 2880, 2880, 64]
    - [0, 11.164]
  - - [3008, 832, 1, 64, 3008, 3008, 3008, 64]
    - [0, 11.256]
  - - [3136, 832, 1, 64, 3136, 3136, 3136, 64]
    - [0, 11.339]
  - - [3264, 832, 1, 64, 3264, 3264, 3264, 64]
    - [0, 11.427]
  - - [3392, 832, 1, 64, 3392, 3392, 3392, 64]
    - [0, 11.492]
  - - [3520, 832, 1, 64, 3520, 3520, 3520, 64]
    - [0, 11.489]
  - - [3648, 832, 1, 64, 3648, 3648, 3648, 64]
    - [0, 11.528]
  - - [3776, 832, 1, 64, 3776, 3776, 3776, 64]
    - [0, 11.574]
  - - [3904, 832, 1, 64, 3904, 3904, 3904, 64]
    - [0, 11.649]
  - - [4032, 832, 1, 64, 4032, 4032, 4032, 64]
    - [0, 11.616]
  - - [64, 960, 1, 64, 64, 64, 64, 64]
    - [0, 2.004]
  - - [192, 960, 1, 64, 192, 192, 192, 64]
    - [0, 4.546]
  - - [320, 960, 1, 64, 320, 320, 320, 64]
    - [0, 5.867]
  - - [448, 960, 1, 64, 448, 448, 448, 64]
    - [0, 6.86]
  - - [576, 960, 1, 64, 576, 576, 576, 64]
    - [0, 7.765]
  - - [704, 960, 1, 64, 704, 704, 704, 64]
    - [0, 8.299]
  - - [832, 960, 1, 64, 832, 832, 832, 64]
    - [0, 8.783]
  - - [960, 960, 1, 64, 960, 960, 960, 64]
    - [0, 9.188]
  - - [1088, 960, 1, 64, 1088, 1088, 1088, 64]
    - [0, 9.56]
  - - [1216, 960, 1, 64, 1216, 1216, 1216, 64]
    - [0, 9.774]
  - - [1344, 960, 1, 64, 1344, 1344, 1344, 64]
    - [0, 10.084]
  - - [1472, 960, 1, 64, 1472, 1472, 1472, 64]
    - [0, 10.257]
  - - [1600, 960, 1, 64, 1600, 1600, 1600, 64]
    - [0, 10.388]
  - - [1728, 960, 1, 64, 1728, 1728, 1728, 64]
    - [0, 10.572]
  - - [1856, 960, 1, 64, 1856, 1856, 1856, 64]
    - [0, 10.745]
  - - [1984, 960, 1, 64, 1984, 1984, 1984, 64]
    - [0, 10.774]
  - - [2112, 960, 1, 64, 2112, 2112, 2112, 64]
    - [0, 10.96]
  - - [2240, 960, 1, 64, 2240, 2240, 2240, 64]
    - [0, 11.084]
  - - [2368, 960, 1, 64, 2368, 2368, 2368, 64]
    - [0, 11.043]
  - - [2496, 960, 1, 64, 2496, 2496, 2496, 64]
    - [0, 11.253]
  - - [2624, 960, 1, 64, 2624, 2624, 2624, 64]
    - [0, 11.235]
  - - [2752, 960, 1, 64, 2752, 2752, 2752, 64]
    - [0, 11.325]
  - - [2880, 960, 1, 64, 2880, 2880, 2880, 64]
    - [0, 11.455]
  - - [3008, 960, 1, 64, 3008, 3008, 3008, 64]
    - [0, 11.554]
  - - [3136, 960, 1, 64, 3136, 3136, 3136, 64]
    - [0, 11.575]
  - - [3264, 960, 1, 64, 3264, 3264, 3264, 64]
    - [0, 11.53]
  - - [3392, 960, 1, 64, 3392, 3392, 3392, 64]
    - [0, 11.658]
  - - [3520, 960, 1, 64, 3520, 3520, 3520, 64]
    - [0, 11.651]
  - - [3648, 960, 1, 64, 3648, 3648, 3648, 64]
    - [0, 11.64]
  - - [3776, 960, 1, 64, 3776, 3776, 3776, 64]
    - [0, 11.81]
  - - [3904, 960, 1, 64, 3904, 3904, 3904, 64]
    - [0, 11.766]
  - - [4032, 960, 1, 64, 4032, 4032, 4032, 64]
    - [0, 11.825]
  - - [64, 1088, 1, 64, 64, 64, 64, 64]
    - [2, 2.117]
  - - [192, 1088, 1, 64, 192, 192, 192, 64]
    - [0, 4.901]
  - - [320, 1088, 1, 64, 320, 320, 320, 64]
    - [0, 6.339]
  - - [448, 1088, 1, 64, 448, 448, 448, 64]
    - [0, 7.371]
  - - [576, 1088, 1, 64, 576, 576, 576, 64]
    - [0, 8.128]
  - - [704, 1088, 1, 64, 704, 704, 704, 64]
    - [0, 8.653]
  - - [832, 1088, 1, 64, 832, 832, 832, 64]
    - [0, 9.178]
  - - [960, 1088, 1, 64, 960, 960, 960, 64]
    - [0, 9.522]
  - - [1088, 1088, 1, 64, 1088, 1088, 1088, 64]
    - [0, 9.849]
  - - [1216, 1088, 1, 64, 1216, 1216, 1216, 64]
    - [0, 10.118]
  - - [1344, 1088, 1, 64, 1344, 1344, 1344, 64]
    - [0, 10.229]
  - - [1472, 1088, 1, 64, 1472, 1472, 1472, 64]
    - [0, 10.508]
  - - [1600, 1088, 1, 64, 1600, 1600, 1600, 64]
    - [0, 10.684]
  - - [1728, 1088, 1, 64, 1728, 1728, 1728, 64]
    - [0, 10.742]
  - - [1856, 1088, 1, 64, 1856, 1856, 1856, 64]
    - [0, 10.952]
  - - [1984, 1088, 1, 64, 1984, 1984, 1984, 64]
    - [0, 10.965]
  - - [2112, 1088, 1, 64, 2112, 2112, 2112, 64]
    - [0, 11.113]
  - - [2240, 1088, 1, 64, 2240, 2240, 2240, 64]
    - [0, 11.238]
  - - [2368, 1088, 1, 64, 2368, 2368, 2368, 64]
    - [0, 11.316]
  - - [2496, 1088, 1, 64, 2496, 2496, 2496, 64]
    - [0, 11.379]
  - - [2624, 1088, 1, 64, 2624, 2624, 2624, 64]
    - [0, 11.463]
  - - [2752, 1088, 1, 64, 2752, 2752, 2752, 64]
    - [0, 11.548]
  - - [2880, 1088, 1, 64, 2880, 2880, 2880, 64]
    - [0, 11.565]
  - - [3008, 1088, 1, 64, 3008, 3008, 3008, 64]
    - [0, 11.704]
  - - [3136, 1088, 1, 64, 3136, 3136, 3136, 64]
    - [0, 11.616]
  - - [3264, 1088, 1, 64, 3264, 3264, 3264, 64]
    - [0, 11.699]
  - - [3392, 1088, 1, 64, 3392, 3392, 3392, 64]
    - [0, 11.718]
  - - [3520, 1088, 1, 64, 3520, 3520, 3520, 64]
    - [0, 11.804]
  - - [3648, 1088, 1, 64, 3648, 3648, 3648, 64]
    - [0, 11.804]
  - - [3776, 1088, 1, 64, 3776, 3776, 3776, 64]
    - [0, 11.875]
  - - [3904, 1088, 1, 64, 3904, 3904, 3904, 64]
    - [0, 11.962]
  - - [4032, 1088, 1, 64, 4032, 4032, 4032, 64]
    - [0, 11.03]
  - - [64, 1216, 1, 64, 64, 64, 64, 64]
    - [0, 2.345]
  - - [192, 1216, 1, 64, 192, 192, 192, 64]
    - [0, 5.171]
  - - [320, 1216, 1, 64, 320, 320, 320, 64]
    - [0, 6.683]
  - - [448, 1216, 1, 64, 448, 448, 448, 64]
    - [0, 7.714]
  - - [576, 1216, 1, 64, 576, 576, 576, 64]
    - [0, 8.452]
  - - [704, 1216, 1, 64, 704, 704, 704, 64]
    - [0, 8.908]
  - - [832, 1216, 1, 64, 832, 832, 832, 64]
    - [0, 9.461]
  - - [960, 1216, 1, 64, 960, 960, 960, 64]
    - [0, 9.795]
  - - [1088, 1216, 1, 64, 1088, 1088, 1088, 64]
    - [0, 10.117]
  - - [1216, 1216, 1, 64, 1216, 1216, 1216, 64]
    - [0, 10.378]
  - - [1344, 1216, 1, 64, 1344, 1344, 1344, 64]
    - [0, 10.534]
  - - [1472, 1216, 1, 64, 1472, 1472, 1472, 64]
    - [0, 10.749]
  - - [1600, 1216, 1, 64, 1600, 1600, 1600, 64]
    - [0, 10.837]
  - - [1728, 1216, 1, 64, 1728, 1728, 1728, 64]
    - [0, 10.89]
  - - [1856, 1216, 1, 64, 1856, 1856, 1856, 64]
    - [0, 11.081]
  - - [1984, 1216, 1, 64, 1984, 1984, 1984, 64]
    - [0, 11.108]
  - - [2112, 1216, 1, 64, 2112, 2112, 2112, 64]
    - [0, 11.362]
  - - [2240, 1216, 1, 64, 2240, 2240, 2240, 64]
    - [0, 11.424]
  - - [2368, 1216, 1, 64, 2368, 2368, 2368, 64]
    - [0, 11.465]
  - - [2496, 1216, 1, 64, 2496, 2496, 2496, 64]
    - [0, 11.562]
  - - [2624, 1216, 1, 64, 2624, 2624, 2624, 64]
    - [0, 11.568]
  - - [2752, 1216, 1, 64, 2752, 2752, 2752, 64]
    - [0, 11.693]
  - - [2880, 1216, 1, 64, 2880, 2880, 2880, 64]
    - [0, 11.701]
  - - [3008, 1216, 1, 64, 3008, 3008, 3008, 64]
    - [0, 11.779]
  - - [3136, 1216, 1, 64, 3136, 3136, 3136, 64]
    - [0, 11.733]
  - - [3264, 1216, 1, 64, 3264, 3264, 3264, 64]
    - [0, 11.805]
  - - [3392, 1216, 1, 64, 3392, 3392, 3392, 64]
    - [0, 11.882]
  - - [3520, 1216, 1, 64, 3520, 3520, 3520, 64]
    - [0, 10.77]
  - - [3648, 1216, 1, 64, 3648, 3648, 3648, 64]
    - [0, 11.144]
  - - [3776, 1216, 1, 64, 3776, 3776, 3776, 64]
    - [0, 11.415]
  - - [3904, 1216, 1, 64, 3904, 3904, 3904, 64]
    - [0, 11.359]
  - - [4032, 1216, 1, 64, 4032, 4032, 4032, 64]
    - [0, 11.482]
  - - [64, 1344, 1, 64, 64, 64, 64, 64]
    - [0, 2.601]
  - - [192, 1344, 1, 64, 192, 192, 192, 64]
    - [0, 5.435]
  - - [320, 1344, 1, 64, 320, 320, 320, 64]
    - [0, 6.857]
  - - [448, 1344, 1, 64, 448, 448, 448, 64]
    - [0, 8.009]
  - - [576, 1344, 1, 64, 576, 576, 576, 64]
    - [0, 8.691]
  - - [704, 1344, 1, 64, 704, 704, 704, 64]
    - [0, 9.322]
  - - [832, 1344, 1, 64, 832, 832, 832, 64]
    - [0, 9.677]
  - - [960, 1344, 1, 64, 960, 960, 960, 64]
    - [0, 10.033]
  - - [1088, 1344, 1, 64, 1088, 1088, 1088, 64]
    - [0, 10.322]
  - - [1216, 1344, 1, 64, 1216, 1216, 1216, 64]
    - [0, 10.539]
  - - [1344, 1344, 1, 64, 1344, 1344, 1344, 64]
    - [0, 10.776]
  - - [1472, 1344, 1, 64, 1472, 1472, 1472, 64]
    - [0, 10.872]
  - - [1600, 1344, 1, 64, 1600, 1600, 1600, 64]
    - [0, 11.023]
  - - [1728, 1344, 1, 64, 1728, 1728, 1728, 64]
    - [0, 11.135]
  - - [1856, 1344, 1, 64, 1856, 1856, 1856, 64]
    - [0, 11.331]
  - - [1984, 1344, 1, 64, 1984, 1984, 1984, 64]
    - [0, 11.372]
  - - [2112, 1344, 1, 64, 2112, 2112, 2112, 64]
    - [0, 11.477]
  - - [2240, 1344, 1, 64, 2240, 2240, 2240, 64]
    - [0, 11.548]
  - - [2368, 1344, 1, 64, 2368, 2368, 2368, 64]
    - [0, 11.67]
  - - [2496, 1344, 1, 64, 2496, 2496, 2496, 64]
    - [0, 11.659]
  - - [2624, 1344, 1, 64, 2624, 2624, 2624, 64]
    - [0, 11.728]
  - - [2752, 1344, 1, 64, 2752, 2752, 2752, 64]
    - [0, 11.763]
  - - [2880, 1344, 1, 64, 2880, 2880, 2880, 64]
    - [0, 11.857]
  - - [3008, 1344, 1, 64, 3008, 3008, 3008, 64]
    - [0, 11.914]
  - - [3136, 1344, 1, 64, 3136, 3136, 3136, 64]
    - [0, 11.84]
  - - [3264, 1344, 1, 64, 3264, 3264, 3264, 64]
    - [0, 11.035]
  - - [3392, 1344, 1, 64, 3392, 3392, 3392, 64]
    - [0, 11.368]
  - - [3520, 1344, 1, 64, 3520, 3520, 3520, 64]
    - [0, 11.487]
  - - [3648, 1344, 1, 64, 3648, 3648, 3648, 64]
    - [0, 11.483]
  - - [3776, 1344, 1, 64, 3776, 3776, 3776, 64]
    - [0, 11.596]
  - - [3904, 1344, 1, 64, 3904, 3904, 3904, 64]
    - [0, 11.596]
  - - [4032, 1344, 1, 64, 4032, 4032, 4032, 64]
    - [0, 11.632]
  - - [64, 1472, 1, 64, 64, 64, 64, 64]
    - [2, 2.666]
  - - [192, 1472, 1, 64, 192, 192, 192, 64]
    - [0, 5.66]
  - - [320, 1472, 1, 64, 320, 320, 320, 64]
    - [0, 7.176]
  - - [448, 1472, 1, 64, 448, 448, 448, 64]
    - [0, 8.246]
  - - [576, 1472, 1, 64, 576, 576, 576, 64]
    - [0, 8.955]
  - - [704, 1472, 1, 64, 704, 704, 704, 64]
    - [0, 9.514]
  - - [832, 1472, 1, 64, 832, 832, 832, 64]
    - [0, 9.847]
  - - [960, 1472, 1, 64, 960, 960, 960, 64]
    - [0, 10.237]
  - - [1088, 1472, 1, 64, 1088, 1088, 1088, 64]
    - [0, 10.437]
  - - [1216, 1472, 1, 64, 1216, 1216, 1216, 64]
    - [0, 10.702]
  - - [1344, 1472, 1, 64, 1344, 1344, 1344, 64]
    - [0, 10.928]
  - - [1472, 1472, 1, 64, 1472, 1472, 1472, 64]
    - [0, 11.086]
  - - [1600, 1472, 1, 64, 1600, 1600, 1600, 64]
    - [0, 11.168]
  - - [1728, 1472, 1, 64, 1728, 1728, 1728, 64]
    - [0, 11.327]
  - - [1856, 1472, 1, 64, 1856, 1856, 1856, 64]
    - [0, 11.451]
  - - [1984, 1472, 1, 64, 1984, 1984, 1984, 64]
    - [0, 11.56]
  - - [2112, 1472, 1, 64, 2112, 2112, 2112, 64]
    - [0, 11.549]
  - - [2240, 1472, 1, 64, 2240, 2240, 2240, 64]
    - [0, 11.633]
  - - [2368, 1472, 1, 64, 2368, 2368, 2368, 64]
    - [0, 11.712]
  - - [2496, 1472, 1, 64, 2496, 2496, 2496, 64]
    - [0, 11.759]
  - - [2624, 1472, 1, 64, 2624, 2624, 2624, 64]
    - [0, 11.823]
  - - [2752, 1472, 1, 64, 2752, 2752, 2752, 64]
    - [0, 11.88]
  - - [2880, 1472, 1, 64, 2880, 2880, 2880, 64]
    - [0, 11.971]
  - - [3008, 1472, 1, 64, 3008, 3008, 3008, 64]
    - [0, 11.133]
  - - [3136, 1472, 1, 64, 3136, 3136, 3136, 64]
    - [0, 11.493]
  - - [3264, 1472, 1, 64, 3264, 3264, 3264, 64]
    - [0, 11.471]
  - - [3392, 1472, 1, 64, 3392, 3392, 3392, 64]
    - [0, 11.524]
  - - [3520, 1472, 1, 64, 3520, 3520, 3520, 64]
    - [0, 11.623]
  - - [3648, 1472, 1, 64, 3648, 3648, 3648, 64]
    - [0, 11.615]
  - - [3776, 1472, 1, 64, 3776, 3776, 3776, 64]
    - [0, 11.616]
  - - [3904, 1472, 1, 64, 3904, 3904, 3904, 64]
    - [0, 11.676]
  - - [4032, 1472, 1, 64, 4032, 4032, 4032, 64]
    - [0, 11.713]
  - - [64, 1600, 1, 64, 64, 64, 64, 64]
    - [2, 2.875]
  - - [192, 1600, 1, 64, 192, 192, 192, 64]
    - [0, 5.894]
  - - [320, 1600, 1, 64, 320, 320, 320, 64]
    - [0, 7.54]
  - - [448, 1600, 1, 64, 448, 448, 448, 64]
    - [0, 8.486]
  - - [576, 1600, 1, 64, 576, 576, 576, 64]
    - [0, 9.201]
  - - [704, 1600, 1, 64, 704, 704, 704, 64]
    - [0, 9.657]
  - - [832, 1600, 1, 64, 832, 832, 832, 64]
    - [0, 10.082]
  - - [960, 1600, 1, 64, 960, 960, 960, 64]
    - [0, 10.439]
  - - [1088, 1600, 1, 64, 1088, 1088, 1088, 64]
    - [0, 10.689]
  - - [1216, 1600, 1, 64, 1216, 1216, 1216, 64]
    - [0, 10.86]
  - - [1344, 1600, 1, 64, 1344, 1344, 1344, 64]
    - [0, 11.077]
  - - [1472, 1600, 1, 64, 1472, 1472, 1472, 64]
    - [0, 11.204]
  - - [1600, 1600, 1, 64, 1600, 1600, 1600, 64]
    - [0, 11.375]
  - - [1728, 1600, 1, 64, 1728, 1728, 1728, 64]
    - [0, 11.409]
  - - [1856, 1600, 1, 64, 1856, 1856, 1856, 64]
    - [0, 11.589]
  - - [1984, 1600, 1, 64, 1984, 1984, 1984, 64]
    - [0, 11.519]
  - - [2112, 1600, 1, 64, 2112, 2112, 2112, 64]
    - [0, 11.672]
  - - [2240, 1600, 1, 64, 2240, 2240, 2240, 64]
    - [0, 11.784]
  - - [2368, 1600, 1, 64, 2368, 2368, 2368, 64]
    - [0, 11.785]
  - - [2496, 1600, 1, 64, 2496, 2496, 2496, 64]
    - [0, 11.894]
  - - [2624, 1600, 1, 64, 2624, 2624, 2624, 64]
    - [0, 11.82]
  - - [2752, 1600, 1, 64, 2752, 2752, 2752, 64]
    - [0, 11.073]
  - - [2880, 1600, 1, 64, 2880, 2880, 2880, 64]
    - [0, 11.485]
  - - [3008, 1600, 1, 64, 3008, 3008, 3008, 64]
    - [0, 11.439]
  - - [3136, 1600, 1, 64, 3136, 3136, 3136, 64]
    - [0, 11.501]
  - - [3264, 1600, 1, 64, 3264, 3264, 3264, 64]
    - [0, 11.548]
  - - [3392, 1600, 1, 64, 3392, 3392, 3392, 64]
    - [0, 11.533]
  - - [3520, 1600, 1, 64, 3520, 3520, 3520, 64]
    - [0, 11.702]
  - - [3648, 1600, 1, 64, 3648, 3648, 3648, 64]
    - [0, 11.682]
  - - [3776, 1600, 1, 64, 3776, 3776, 3776, 64]
    - [0, 11.766]
  - - [3904, 1600, 1, 64, 3904, 3904, 3904, 64]
    - [0, 11.826]
  - - [4032, 1600, 1, 64, 4032, 4032, 4032, 64]
    - [0, 11.863]
  - - [64, 1728, 1, 64, 64, 64, 64, 64]
    - [0, 3.098]
  - - [192, 1728, 1, 64, 192, 192, 192, 64]
    - [0, 6.231]
  - - [320, 1728, 1, 64, 320, 320, 320, 64]
    - [0, 7.759]
  - - [448, 1728, 1, 64, 448, 448, 448, 64]
    - [0, 8.667]
  - - [576, 1728, 1, 64, 576, 576, 576, 64]
    - [0, 9.464]
  - - [704, 1728, 1, 64, 704, 704, 704, 64]
    - [0, 9.895]
  - - [832, 1728, 1, 64, 832, 832, 832, 64]
    - [0, 10.281]
  - - [960, 1728, 1, 64, 960, 960, 960, 64]
    - [0, 10.609]
  - - [1088, 1728, 1, 64, 1088, 1088, 1088, 64]
    - [0, 10.783]
  - - [1216, 1728, 1, 64, 1216, 1216, 1216, 64]
    - [0, 11.015]
  - - [1344, 1728, 1, 64, 1344, 1344, 1344, 64]
    - [0, 11.135]
  - - [1472, 1728, 1, 64, 1472, 1472, 1472, 64]
    - [0, 11.324]
  - - [1600, 1728, 1, 64, 1600, 1600, 1600, 64]
    - [0, 11.336]
  - - [1728, 1728, 1, 64, 1728, 1728, 1728, 64]
    - [0, 11.576]
  - - [1856, 1728, 1, 64, 1856, 1856, 1856, 64]
    - [0, 11.616]
  - - [1984, 1728, 1, 64, 1984, 1984, 1984, 64]
    - [0, 11.727]
  - - [2112, 1728, 1, 64, 2112, 2112, 2112, 64]
    - [0, 11.789]
  - - [2240, 1728, 1, 64, 2240, 2240, 2240, 64]
    - [0, 11.834]
  - - [2368, 1728, 1, 64, 2368, 2368, 2368, 64]
    - [0, 11.89]
  - - [2496, 1728, 1, 64, 2496, 2496, 2496, 64]
    - [0, 11.275]
  - - [2624, 1728, 1, 64, 2624, 2624, 2624, 64]
    - [0, 11.388]
  - - [2752, 1728, 1, 64, 2752, 2752, 2752, 64]
    - [0, 11.372]
  - - [2880, 1728, 1, 64, 2880, 2880, 2880, 64]
    - [0, 11.486]
  - - [3008, 1728, 1, 64, 3008, 3008, 3008, 64]
    - [0, 11.58]
  - - [3136, 1728, 1, 64, 3136, 3136, 3136, 64]
    - [0, 11.578]
  - - [3264, 1728, 1, 64, 3264, 3264, 3264, 64]
    - [0, 11.553]
  - - [3392, 1728, 1, 64, 3392, 3392, 3392, 64]
    - [0, 11.682]
  - - [3520, 1728, 1, 64, 3520, 3520, 3520, 64]
    - [0, 11.841]
  - - [3648, 1728, 1, 64, 3648, 3648, 3648, 64]
    - [0, 11.829]
  - - [3776, 1728, 1, 64, 3776, 3776, 3776, 64]
    - [0, 11.905]
  - - [3904, 1728, 1, 64, 3904, 3904, 3904, 64]
    - [0, 11.932]
  - - [4032, 1728, 1, 64, 4032, 4032, 4032, 64]
    - [0, 11.942]
  - - [64, 1856, 1, 64, 64, 64, 64, 64]
    - [0, 3.315]
  - - [192, 1856, 1, 64, 192, 192, 192, 64]
    - [0, 6.479]
  - - [320, 1856, 1, 64, 320, 320, 320, 64]
    - [0, 7.959]
  - - [448, 1856, 1, 64, 448, 448, 448, 64]
    - [0, 8.864]
  - - [576, 1856, 1, 64, 576, 576, 576, 64]
    - [0, 9.513]
  - - [704, 1856, 1, 64, 704, 704, 704, 64]
    - [0, 10.041]
  - - [832, 1856, 1, 64, 832, 832, 832, 64]
    - [0, 10.44]
  - - [960, 1856, 1, 64, 960, 960, 960, 64]
    - [0, 10.75]
  - - [1088, 1856, 1, 64, 1088, 1088, 1088, 64]
    - [0, 11.003]
  - - [1216, 1856, 1, 64, 1216, 1216, 1216, 64]
    - [0, 11.178]
  - - [1344, 1856, 1, 64, 1344, 1344, 1344, 64]
    - [0, 11.294]
  - - [1472, 1856, 1, 64, 1472, 1472, 1472, 64]
    - [0, 11.382]
  - - [1600, 1856, 1, 64, 1600, 1600, 1600, 64]
    - [0, 11.54]
  - - [1728, 1856, 1, 64, 1728, 1728, 1728, 64]
    - [0, 11.619]
  - - [1856, 1856, 1, 64, 1856, 1856, 1856, 64]
    - [0, 11.735]
  - - [1984, 1856, 1, 64, 1984, 1984, 1984, 64]
    - [0, 11.782]
  - - [2112, 1856, 1, 64, 2112, 2112, 2112, 64]
    - [0, 11.838]
  - - [2240, 1856, 1, 64, 2240, 2240, 2240, 64]
    - [0, 11.903]
  - - [2368, 1856, 1, 64, 2368, 2368, 2368, 64]
    - [0, 11.049]
  - - [2496, 1856, 1, 64, 2496, 2496, 2496, 64]
    - [0, 11.395]
  - - [2624, 1856, 1, 64, 2624, 2624, 2624, 64]
    - [0, 11.42]
  - - [2752, 1856, 1, 64, 2752, 2752, 2752, 64]
    - [0, 11.598]
  - - [2880, 1856, 1, 64, 2880, 2880, 2880, 64]
    - [0, 11.629]
  - - [3008, 1856, 1, 64, 3008, 3008, 3008, 64]
    - [0, 11.67]
  - - [3136, 1856, 1, 64, 3136, 3136, 3136, 64]
    - [0, 11.747]
  - - [3264, 1856, 1, 64, 3264, 3264, 3264, 64]
    - [0, 11.792]
  - - [3392, 1856, 1, 64, 3392, 3392, 3392, 64]
    - [0, 11.739]
  - - [3520, 1856, 1, 64, 3520, 3520, 3520, 64]
    - [0, 11.801]
  - - [3648, 1856, 1, 64, 3648, 3648, 3648, 64]
    - [0, 11.926]
  - - [3776, 1856, 1, 64, 3776, 3776, 3776, 64]
    - [0, 11.917]
  - - [3904, 1856, 1, 64, 3904, 3904, 3904, 64]
    - [0, 11.919]
  - - [4032, 1856, 1, 64, 4032, 4032, 4032, 64]
    - [0, 11.963]
  - - [64, 1984, 1, 64, 64, 64, 64, 64]
    - [0, 3.387]
  - - [192, 1984, 1, 64, 192, 192, 192, 64]
    - [0, 6.678]
  - - [320, 1984, 1, 64, 320, 320, 320, 64]
    - [0, 8.15]
  - - [448, 1984, 1, 64, 448, 448, 448, 64]
    - [0, 9.081]
  - - [576, 1984, 1, 64, 576, 576, 576, 64]
    - [0, 9.818]
  - - [704, 1984, 1, 64, 704, 704, 704, 64]
    - [0, 10.165]
  - - [832, 1984, 1, 64, 832, 832, 832, 64]
    - [0, 10.554]
  - - [960, 1984, 1, 64, 960, 960, 960, 64]
    - [0, 10.802]
  - - [1088, 1984, 1, 64, 1088, 1088, 1088, 64]
    - [0, 11.058]
  - - [1216, 1984, 1, 64, 1216, 1216, 1216, 64]
    - [0, 11.302]
  - - [1344, 1984, 1, 64, 1344, 1344, 1344, 64]
    - [0, 11.429]
  - - [1472, 1984, 1, 64, 1472, 1472, 1472, 64]
    - [0, 11.532]
  - - [1600, 1984, 1, 64, 1600, 1600, 1600, 64]
    - [0, 11.623]
  - - [1728, 1984, 1, 64, 1728, 1728, 1728, 64]
    - [0, 11.692]
  - - [1856, 1984, 1, 64, 1856, 1856, 1856, 64]
    - [0, 11.817]
  - - [1984, 1984, 1, 64, 1984, 1984, 1984, 64]
    - [0, 11.813]
  - - [2112, 1984, 1, 64, 2112, 2112, 2112, 64]
    - [0, 11.925]
  - - [2240, 1984, 1, 64, 2240, 2240, 2240, 64]
    - [0, 11.174]
  - - [2368, 1984, 1, 64, 2368, 2368, 2368, 64]
    - [0, 11.509]
  - - [2496, 1984, 1, 64, 2496, 2496, 2496, 64]
    - [0, 11.469]
  - - [2624, 1984, 1, 64, 2624, 2624, 2624, 64]
    - [0, 11.588]
  - - [2752, 1984, 1, 64, 2752, 2752, 2752, 64]
    - [0, 11.628]
  - - [2880, 1984, 1, 64, 2880, 2880, 2880, 64]
    - [0, 11.726]
  - - [3008, 1984, 1, 64, 3008, 3008, 3008, 64]
    - [0, 11.708]
  - - [3136, 1984, 1, 64, 3136, 3136, 3136, 64]
    - [0, 11.744]
  - - [3264, 1984, 1, 64, 3264, 3264, 3264, 64]
    - [0, 11.892]
  - - [3392, 1984, 1, 64, 3392, 3392, 3392, 64]
    - [0, 11.839]
  - - [3520, 1984, 1, 64, 3520, 3520, 3520, 64]
    - [0, 11.903]
  - - [3648, 1984, 1, 64, 3648, 3648, 3648, 64]
    - [0, 11.975]
  - - [3776, 1984, 1, 64, 3776, 3776, 3776, 64]
    - [0, 11.88]
  - - [3904, 1984, 1, 64, 3904, 3904, 3904, 64]
    - [0, 11.97]
  - - [4032, 1984, 1, 64, 4032, 4032, 4032, 64]
    - [0, 12.058]
  - - [64, 2112, 1, 64, 64, 64, 64, 64]
    - [0, 3.572]
  - - [192, 2112, 1, 64, 192, 192, 192, 64]
    - [0, 6.702]
  - - [320, 2112, 1, 64, 320, 320, 320, 64]
    - [0, 8.346]
  - - [448, 2112, 1, 64, 448, 448, 448, 64]
    - [0, 9.266]
  - - [576, 2112, 1, 64, 576, 576, 576, 64]
    - [0, 9.923]
  - - [704, 2112, 1, 64, 704, 704, 704, 64]
    - [0, 10.394]
  - - [832, 2112, 1, 64, 832, 832, 832, 64]
    - [0, 10.706]
  - - [960, 2112, 1, 64, 960, 960, 960, 64]
    - [0, 10.946]
  - - [1088, 2112, 1, 64, 1088, 1088, 1088, 64]
    - [0, 11.236]
  - - [1216, 2112, 1, 64, 1216, 1216, 1216, 64]
    - [0, 11.393]
  - - [1344, 2112, 1, 64, 1344, 1344, 1344, 64]
    - [0, 11.461]
  - - [1472, 2112, 1, 64, 1472, 1472, 1472, 64]
    - [0, 11.518]
  - - [1600, 2112, 1, 64, 1600, 1600, 1600, 64]
    - [0, 11.768]
  - - [1728, 2112, 1, 64, 1728, 1728, 1728, 64]
    - [0, 11.754]
  - - [1856, 2112, 1, 64, 1856, 1856, 1856, 64]
    - [0, 11.84]
  - - [1984, 2112, 1, 64, 1984, 1984, 1984, 64]
    - [0, 11.892]
  - - [2112, 2112, 1, 64, 2112, 2112, 2112, 64]
    - [0, 11.215]
  - - [2240, 2112, 1, 64, 2240, 2240, 2240, 64]
    - [0, 11.419]
  - - [2368, 2112, 1, 64, 2368, 2368, 2368, 64]
    - [0, 11.539]
  - - [2496, 2112, 1, 64, 2496, 2496, 2496, 64]
    - [0, 11.591]
  - - [2624, 2112, 1, 64, 2624, 2624, 2624, 64]
    - [0, 11.64]
  - - [2752, 2112, 1, 64, 2752, 2752, 2752, 64]
    - [0, 11.724]
  - - [2880, 2112, 1, 64, 2880, 2880, 2880, 64]
    - [0, 11.65]
  - - [3008, 2112, 1, 64, 3008, 3008, 3008, 64]
    - [0, 11.873]
  - - [3136, 2112, 1, 64, 3136, 3136, 3136, 64]
    - [0, 11.889]
  - - [3264, 2112, 1, 64, 3264, 3264, 3264, 64]
    - [0, 11.843]
  - - [3392, 2112, 1, 64, 3392, 3392, 3392, 64]
    - [0, 11.992]
  - - [3520, 2112, 1, 64, 3520, 3520, 3520, 64]
    - [0, 12.042]
  - - [3648, 2112, 1, 64, 3648, 3648, 3648, 64]
    - [0, 12.027]
  - - [3776, 2112, 1, 64, 3776, 3776, 3776, 64]
    - [0, 11.948]
  - - [3904, 2112, 1, 64, 3904, 3904, 3904, 64]
    - [0, 11.753]
  - - [4032, 2112, 1, 64, 4032, 4032, 4032, 64]
    - [0, 11.439]
  - - [64, 2240, 1, 64, 64, 64, 64, 64]
    - [0, 3.717]
  - - [192, 2240, 1, 64, 192, 192, 192, 64]
    - [2, 5.999]
  - - [320, 2240, 1, 64, 320, 320, 320, 64]
    - [0, 8.519]
  - - [448, 2240, 1, 64, 448, 448, 448, 64]
    - [0, 9.469]
  - - [576, 2240, 1, 64, 576, 576, 576, 64]
    - [0, 10.094]
  - - [704, 2240, 1, 64, 704, 704, 704, 64]
    - [0, 10.462]
  - - [832, 2240, 1, 64, 832, 832, 832, 64]
    - [0, 10.83]
  - - [960, 2240, 1, 64, 960, 960, 960, 64]
    - [0, 11.009]
  - - [1088, 2240, 1, 64, 1088, 1088, 1088, 64]
    - [0, 11.263]
  - - [1216, 2240, 1, 64, 1216, 1216, 1216, 64]
    - [0, 11.417]
  - - [1344, 2240, 1, 64, 1344, 1344, 1344, 64]
    - [0, 11.556]
  - - [1472, 2240, 1, 64, 1472, 1472, 1472, 64]
    - [0, 11.585]
  - - [1600, 2240, 1, 64, 1600, 1600, 1600, 64]
    - [0, 11.774]
  - - [1728, 2240, 1, 64, 1728, 1728, 1728, 64]
    - [0, 11.809]
  - - [1856, 2240, 1, 64, 1856, 1856, 1856, 64]
    - [0, 11.848]
  - - [1984, 2240, 1, 64, 1984, 1984, 1984, 64]
    - [0, 11.166]
  - - [2112, 2240, 1, 64, 2112, 2112, 2112, 64]
    - [0, 11.452]
  - - [2240, 2240, 1, 64, 2240, 2240, 2240, 64]
    - [0, 11.484]
  - - [2368, 2240, 1, 64, 2368, 2368, 2368, 64]
    - [0, 11.56]
  - - [2496, 2240, 1, 64, 2496, 2496, 2496, 64]
    - [0, 11.654]
  - - [2624, 2240, 1, 64, 2624, 2624, 2624, 64]
    - [0, 11.769]
  - - [2752, 2240, 1, 64, 2752, 2752, 2752, 64]
    - [0, 11.828]
  - - [2880, 2240, 1, 64, 2880, 2880, 2880, 64]
    - [0, 11.86]
  - - [3008, 2240, 1, 64, 3008, 3008, 3008, 64]
    - [0, 11.924]
  - - [3136, 2240, 1, 64, 3136, 3136, 3136, 64]
    - [0, 11.875]
  - - [3264, 2240, 1, 64, 3264, 3264, 3264, 64]
    - [0, 11.911]
  - - [3392, 2240, 1, 64, 3392, 3392, 3392, 64]
    - [0, 12.001]
  - - [3520, 2240, 1, 64, 3520, 3520, 3520, 64]
    - [0, 12.011]
  - - [3648, 2240, 1, 64, 3648, 3648, 3648, 64]
    - [0, 11.829]
  - - [3776, 2240, 1, 64, 3776, 3776, 3776, 64]
    - [0, 11.406]
  - - [3904, 2240, 1, 64, 3904, 3904, 3904, 64]
    - [0, 11.207]
  - - [4032, 2240, 1, 64, 4032, 4032, 4032, 64]
    - [0, 11.034]
  - - [64, 2368, 1, 64, 64, 64, 64, 64]
    - [1, 2.8]
  - - [192, 2368, 1, 64, 192, 192, 192, 64]
    - [0, 6.973]
  - - [320, 2368, 1, 64, 320, 320, 320, 64]
    - [0, 8.574]
  - - [448, 2368, 1, 64, 448, 448, 448, 64]
    - [0, 9.591]
  - - [576, 2368, 1, 64, 576, 576, 576, 64]
    - [0, 10.195]
  - - [704, 2368, 1, 64, 704, 704, 704, 64]
    - [0, 10.56]
  - - [832, 2368, 1, 64, 832, 832, 832, 64]
    - [0, 10.929]
  - - [960, 2368, 1, 64, 960, 960, 960, 64]
    - [0, 11.179]
  - - [1088, 2368, 1, 64, 1088, 1088, 1088, 64]
    - [0, 11.365]
  - - [1216, 2368, 1, 64, 1216, 1216, 1216, 64]
    - [0, 11.523]
  - - [1344, 2368, 1, 64, 1344, 1344, 1344, 64]
    - [0, 11.543]
  - - [1472, 2368, 1, 64, 1472, 1472, 1472, 64]
    - [0, 11.793]
  - - [1600, 2368, 1, 64, 1600, 1600, 1600, 64]
    - [0, 11.824]
  - - [1728, 2368, 1, 64, 1728, 1728, 1728, 64]
    - [0, 11.844]
  - - [1856, 2368, 1, 64, 1856, 1856, 1856, 64]
    - [0, 11.055]
  - - [1984, 2368, 1, 64, 1984, 1984, 1984, 64]
    - [0, 11.462]
  - - [2112, 2368, 1, 64, 2112, 2112, 2112, 64]
    - [0, 11.558]
  - - [2240, 2368, 1, 64, 2240, 2240, 2240, 64]
    - [0, 11.636]
  - - [2368, 2368, 1, 64, 2368, 2368, 2368, 64]
    - [0, 11.715]
  - - [2496, 2368, 1, 64, 2496, 2496, 2496, 64]
    - [0, 11.735]
  - - [2624, 2368, 1, 64, 2624, 2624, 2624, 64]
    - [0, 11.761]
  - - [2752, 2368, 1, 64, 2752, 2752, 2752, 64]
    - [0, 11.834]
  - - [2880, 2368, 1, 64, 2880, 2880, 2880, 64]
    - [0, 11.836]
  - - [3008, 2368, 1, 64, 3008, 3008, 3008, 64]
    - [0, 11.99]
  - - [3136, 2368, 1, 64, 3136, 3136, 3136, 64]
    - [0, 11.942]
  - - [3264, 2368, 1, 64, 3264, 3264, 3264, 64]
    - [0, 12.046]
  - - [3392, 2368, 1, 64, 3392, 3392, 3392, 64]
    - [0, 12.064]
  - - [3520, 2368, 1, 64, 3520, 3520, 3520, 64]
    - [0, 11.662]
  - - [3648, 2368, 1, 64, 3648, 3648, 3648, 64]
    - [0, 11.465]
  - - [3776, 2368, 1, 64, 3776, 3776, 3776, 64]
    - [0, 10.835]
  - - [3904, 2368, 1, 64, 3904, 3904, 3904, 64]
    - [0, 10.575]
  - - [4032, 2368, 1, 64, 4032, 4032, 4032, 64]
    - [0, 9.708]
  - - [64, 2496, 1, 64, 64, 64, 64, 64]
    - [0, 3.971]
  - - [192, 2496, 1, 64, 192, 192, 192, 64]
    - [0, 7.184]
  - - [320, 2496, 1, 64, 320, 320, 320, 64]
    - [0, 8.764]
  - - [448, 2496, 1, 64, 448, 448, 448, 64]
    - [0, 9.65]
  - - [576, 2496, 1, 64, 576, 576, 576, 64]
    - [0, 10.309]
  - - [704, 2496, 1, 64, 704, 704, 704, 64]
    - [0, 10.673]
  - - [832, 2496, 1, 64, 832, 832, 832, 64]
    - [0, 10.977]
  - - [960, 2496, 1, 64, 960, 960, 960, 64]
    - [0, 11.256]
  - - [1088, 2496, 1, 64, 1088, 1088, 1088, 64]
    - [0, 11.323]
  - - [1216, 2496, 1, 64, 1216, 1216, 1216, 64]
    - [0, 11.589]
  - - [1344, 2496, 1, 64, 1344, 1344, 1344, 64]
    - [0, 11.657]
  - - [1472, 2496, 1, 64, 1472, 1472, 1472, 64]
    - [0, 11.748]
  - - [1600, 2496, 1, 64, 1600, 1600, 1600, 64]
    - [0, 11.838]
  - - [1728, 2496, 1, 64, 1728, 1728, 1728, 64]
    - [0, 10.853]
  - - [1856, 2496, 1, 64, 1856, 1856, 1856, 64]
    - [0, 11.426]
  - - [1984, 2496, 1, 64, 1984, 1984, 1984, 64]
    - [0, 11.394]
  - - [2112, 2496, 1, 64, 2112, 2112, 2112, 64]
    - [0, 11.66]
  - - [2240, 2496, 1, 64, 2240, 2240, 2240, 64]
    - [0, 11.642]
  - - [2368, 2496, 1, 64, 2368, 2368, 2368, 64]
    - [0, 11.761]
  - - [2496, 2496, 1, 64, 2496, 2496, 2496, 64]
    - [0, 11.791]
  - - [2624, 2496, 1, 64, 2624, 2624, 2624, 64]
    - [0, 11.806]
  - - [2752, 2496, 1, 64, 2752, 2752, 2752, 64]
    - [0, 11.92]
  - - [2880, 2496, 1, 64, 2880, 2880, 2880, 64]
    - [0, 11.938]
  - - [3008, 2496, 1, 64, 3008, 3008, 3008, 64]
    - [0, 11.903]
  - - [3136, 2496, 1, 64, 3136, 3136, 3136, 64]
    - [0, 12.014]
  - - [3264, 2496, 1, 64, 3264, 3264, 3264, 64]
    - [0, 12.097]
  - - [3392, 2496, 1, 64, 3392, 3392, 3392, 64]
    - [0, 11.486]
  - - [3520, 2496, 1, 64, 3520, 3520, 3520, 64]
    - [0, 11.284]
  - - [3648, 2496, 1, 64, 3648, 3648, 3648, 64]
    - [0, 10.767]
  - - [3776, 2496, 1, 64, 3776, 3776, 3776, 64]
    - [0, 9.703]
  - - [3904, 2496, 1, 64, 3904, 3904, 3904, 64]
    - [0, 9.711]
  - - [4032, 2496, 1, 64, 4032, 4032, 4032, 64]
    - [0, 9.75]
  - - [64, 2624, 1, 64, 64, 64, 64, 64]
    - [0, 4.16]
  - - [192, 2624, 1, 64, 192, 192, 192, 64]
    - [0, 7.372]
  - - [320, 2624, 1, 64, 320, 320, 320, 64]
    - [0, 8.91]
  - - [448, 2624, 1, 64, 448, 448, 448, 64]
    - [0, 9.761]
  - - [576, 2624, 1, 64, 576, 576, 576, 64]
    - [0, 10.437]
  - - [704, 2624, 1, 64, 704, 704, 704, 64]
    - [0, 10.744]
  - - [832, 2624, 1, 64, 832, 832, 832, 64]
    - [0, 11.156]
  - - [960, 2624, 1, 64, 960, 960, 960, 64]
    - [0, 11.233]
  - - [1088, 2624, 1, 64, 1088, 1088, 1088, 64]
    - [0, 11.496]
  - - [1216, 2624, 1, 64, 1216, 1216, 1216, 64]
    - [0, 11.584]
  - - [1344, 2624, 1, 64, 1344, 1344, 1344, 64]
    - [0, 11.734]
  - - [1472, 2624, 1, 64, 1472, 1472, 1472, 64]
    - [0, 11.852]
  - - [1600, 2624, 1, 64, 1600, 1600, 1600, 64]
    - [0, 12.002]
  - - [1728, 2624, 1, 64, 1728, 1728, 1728, 64]
    - [0, 11.362]
  - - [1856, 2624, 1, 64, 1856, 1856, 1856, 64]
    - [0, 11.454]
  - - [1984, 2624, 1, 64, 1984, 1984, 1984, 64]
    - [0, 11.585]
  - - [2112, 2624, 1, 64, 2112, 2112, 2112, 64]
    - [0, 11.637]
  - - [2240, 2624, 1, 64, 2240, 2240, 2240, 64]
    - [0, 11.751]
  - - [2368, 2624, 1, 64, 2368, 2368, 2368, 64]
    - [0, 11.857]
  - - [2496, 2624, 1, 64, 2496, 2496, 2496, 64]
    - [0, 11.777]
  - - [2624, 2624, 1, 64, 2624, 2624, 2624, 64]
    - [0, 11.926]
  - - [2752, 2624, 1, 64, 2752, 2752, 2752, 64]
    - [0, 11.984]
  - - [2880, 2624, 1, 64, 2880, 2880, 2880, 64]
    - [0, 12.054]
  - - [3008, 2624, 1, 64, 3008, 3008, 3008, 64]
    - [0, 11.957]
  - - [3136, 2624, 1, 64, 3136, 3136, 3136, 64]
    - [0, 11.75]
  - - [3264, 2624, 1, 64, 3264, 3264, 3264, 64]
    - [0, 11.289]
  - - [3392, 2624, 1, 64, 3392, 3392, 3392, 64]
    - [0, 11.108]
  - - [3520, 2624, 1, 64, 3520, 3520, 3520, 64]
    - [0, 10.468]
  - - [3648, 2624, 1, 64, 3648, 3648, 3648, 64]
    - [0, 9.584]
  - - [3776, 2624, 1, 64, 3776, 3776, 3776, 64]
    - [0, 9.716]
  - - [3904, 2624, 1, 64, 3904, 3904, 3904, 64]
    - [0, 9.726]
  - - [4032, 2624, 1, 64, 4032, 4032, 4032, 64]
    - [0, 9.747]
  - - [64, 2752, 1, 64, 64, 64, 64, 64]
    - [0, 4.383]
  - - [192, 2752, 1, 64, 192, 192, 192, 64]
    - [0, 7.56]
  - - [320, 2752, 1, 64, 320, 320, 320, 64]
    - [0, 9.04]
  - - [448, 2752, 1, 64, 448, 448, 448, 64]
    - [0, 9.922]
  - - [576, 2752, 1, 64, 576, 576, 576, 64]
    - [0, 10.561]
  - - [704, 2752, 1, 64, 704, 704, 704, 64]
    - [0, 10.834]
  - - [832, 2752, 1, 64, 832, 832, 832, 64]
    - [0, 11.165]
  - - [960, 2752, 1, 64, 960, 960, 960, 64]
    - [0, 11.385]
  - - [1088, 2752, 1, 64, 1088, 1088, 1088, 64]
    - [0, 11.506]
  - - [1216, 2752, 1, 64, 1216, 1216, 1216, 64]
    - [0, 11.689]
  - - [1344, 2752, 1, 64, 1344, 1344, 1344, 64]
    - [0, 11.802]
  - - [1472, 2752, 1, 64, 1472, 1472, 1472, 64]
    - [0, 11.905]
  - - [1600, 2752, 1, 64, 1600, 1600, 1600, 64]
    - [0, 11.077]
  - - [1728, 2752, 1, 64, 1728, 1728, 1728, 64]
    - [0, 11.555]
  - - [1856, 2752, 1, 64, 1856, 1856, 1856, 64]
    - [0, 11.567]
  - - [1984, 2752, 1, 64, 1984, 1984, 1984, 64]
    - [0, 11.683]
  - - [2112, 2752, 1, 64, 2112, 2112, 2112, 64]
    - [0, 11.746]
  - - [2240, 2752, 1, 64, 2240, 2240, 2240, 64]
    - [0, 11.707]
  - - [2368, 2752, 1, 64, 2368, 2368, 2368, 64]
    - [0, 11.843]
  - - [2496, 2752, 1, 64, 2496, 2496, 2496, 64]
    - [0, 11.934]
  - - [2624, 2752, 1, 64, 2624, 2624, 2624, 64]
    - [0, 11.899]
  - - [2752, 2752, 1, 64, 2752, 2752, 2752, 64]
    - [0, 12.056]
  - - [2880, 2752, 1, 64, 2880, 2880, 2880, 64]
    - [0, 11.975]
  - - [3008, 2752, 1, 64, 3008, 3008, 3008, 64]
    - [0, 11.748]
  - - [3136, 2752, 1, 64, 3136, 3136, 3136, 64]
    - [0, 11.382]
  - - [3264, 2752, 1, 64, 3264, 3264, 3264, 64]
    - [0, 10.924]
  - - [3392, 2752, 1, 64, 3392, 3392, 3392, 64]
    - [0, 10.048]
  - - [3520, 2752, 1, 64, 3520, 3520, 3520, 64]
    - [0, 9.758]
  - - [3648, 2752, 1, 64, 3648, 3648, 3648, 64]
    - [0, 9.623]
  - - [3776, 2752, 1, 64, 3776, 3776, 3776, 64]
    - [0, 9.696]
  - - [3904, 2752, 1, 64, 3904, 3904, 3904, 64]
    - [0, 9.731]
  - - [4032, 2752, 1, 64, 4032, 4032, 4032, 64]
    - [0, 9.72]
  - - [64, 2880, 1, 64, 64, 64, 64, 64]
    - [0, 4.554]
  - - [192, 2880, 1, 64, 192, 192, 192, 64]
    - [0, 7.676]
  - - [320, 2880, 1, 64, 320, 320, 320, 64]
    - [0, 9.223]
  - - [448, 2880, 1, 64, 448, 448, 448, 64]
    - [0, 10.019]
  - - [576, 2880, 1, 64, 576, 576, 576, 64]
    - [0, 10.602]
  - - [704, 2880, 1, 64, 704, 704, 704, 64]
    - [0, 10.984]
  - - [832, 2880, 1, 64, 832, 832, 832, 64]
    - [0, 11.216]
  - - [960, 2880, 1, 64, 960, 960, 960, 64]
    - [0, 11.52]
  - - [1088, 2880, 1, 64, 1088, 1088, 1088, 64]
    - [0, 11.661]
  - - [1216, 2880, 1, 64, 1216, 1216, 1216, 64]
    - [0, 11.77]
  - - [1344, 2880, 1, 64, 1344, 1344, 1344, 64]
    - [0, 11.862]
  - - [1472, 2880, 1, 64, 1472, 1472, 1472, 64]
    - [0, 11.92]
  - - [1600, 2880, 1, 64, 1600, 1600, 1600, 64]
    - [0, 11.459]
  - - [1728, 2880, 1, 64, 1728, 1728, 1728, 64]
    - [0, 11.467]
  - - [1856, 2880, 1, 64, 1856, 1856, 1856, 64]
    - [0, 11.545]
  - - [1984, 2880, 1, 64, 1984, 1984, 1984, 64]
    - [0, 11.739]
  - - [2112, 2880, 1, 64, 2112, 2112, 2112, 64]
    - [0, 11.787]
  - - [2240, 2880, 1, 64, 2240, 2240, 2240, 64]
    - [0, 11.808]
  - - [2368, 2880, 1, 64, 2368, 2368, 2368, 64]
    - [0, 12.006]
  - - [2496, 2880, 1, 64, 2496, 2496, 2496, 64]
    - [0, 11.942]
  - - [2624, 2880, 1, 64, 2624, 2624, 2624, 64]
    - [0, 12.027]
  - - [2752, 2880, 1, 64, 2752, 2752, 2752, 64]
    - [0, 11.944]
  - - [2880, 2880, 1, 64, 2880, 2880, 2880, 64]
    - [0, 11.726]
  - - [3008, 2880, 1, 64, 3008, 3008, 3008, 64]
    - [0, 11.418]
  - - [3136, 2880, 1, 64, 3136, 3136, 3136, 64]
    - [0, 10.805]
  - - [3264, 2880, 1, 64, 3264, 3264, 3264, 64]
    - [0, 9.83]
  - - [3392, 2880, 1, 64, 3392, 3392, 3392, 64]
    - [0, 9.749]
  - - [3520, 2880, 1, 64, 3520, 3520, 3520, 64]
    - [0, 9.72]
  - - [3648, 2880, 1, 64, 3648, 3648, 3648, 64]
    - [0, 9.565]
  - - [3776, 2880, 1, 64, 3776, 3776, 3776, 64]
    - [0, 9.698]
  - - [3904, 2880, 1, 64, 3904, 3904, 3904, 64]
    - [0, 9.781]
  - - [4032, 2880, 1, 64, 4032, 4032, 4032, 64]
    - [0, 9.741]
  - - [64, 3008, 1, 64, 64, 64, 64, 64]
    - [0, 4.512]
  - - [192, 3008, 1, 64, 192, 192, 192, 64]
    - [0, 7.837]
  - - [320, 3008, 1, 64, 320, 320, 320, 64]
    - [0, 9.335]
  - - [448, 3008, 1, 64, 448, 448, 448, 64]
    - [0, 10.174]
  - - [576, 3008, 1, 64, 576, 576, 576, 64]
    - [0, 10.679]
  - - [704, 3008, 1, 64, 704, 704, 704, 64]
    - [0, 10.935]
  - - [832, 3008, 1, 64, 832, 832, 832, 64]
    - [0, 11.335]
  - - [960, 3008, 1, 64, 960, 960, 960, 64]
    - [0, 11.452]
  - - [1088, 3008, 1, 64, 1088, 1088, 1088, 64]
    - [0, 11.665]
  - - [1216, 3008, 1, 64, 1216, 1216, 1216, 64]
    - [0, 11.735]
  - - [1344, 3008, 1, 64, 1344, 1344, 1344, 64]
    - [0, 11.857]
  - - [1472, 3008, 1, 64, 1472, 1472, 1472, 64]
    - [0, 11.132]
  - - [1600, 3008, 1, 64, 1600, 1600, 1600, 64]
    - [0, 11.411]
  - - [1728, 3008, 1, 64, 1728, 1728, 1728, 64]
    - [0, 11.577]
  - - [1856, 3008, 1, 64, 1856, 1856, 1856, 64]
    - [0, 11.762]
  - - [1984, 3008, 1, 64, 1984, 1984, 1984, 64]
    - [0, 11.782]
  - - [2112, 3008, 1, 64, 2112, 2112, 2112, 64]
    - [0, 11.743]
  - - [2240, 3008, 1, 64, 2240, 2240, 2240, 64]
    - [0, 11.884]
  - - [2368, 3008, 1, 64, 2368, 2368, 2368, 64]
    - [0, 11.852]
  - - [2496, 3008, 1, 64, 2496, 2496, 2496, 64]
    - [0, 11.971]
  - - [2624, 3008, 1, 64, 2624, 2624, 2624, 64]
    - [0, 11.974]
  - - [2752, 3008, 1, 64, 2752, 2752, 2752, 64]
    - [0, 11.743]
  - - [2880, 3008, 1, 64, 2880, 2880, 2880, 64]
    - [0, 11.36]
  - - [3008, 3008, 1, 64, 3008, 3008, 3008, 64]
    - [0, 10.701]
  - - [3136, 3008, 1, 64, 3136, 3136, 3136, 64]
    - [0, 9.68]
  - - [3264, 3008, 1, 64, 3264, 3264, 3264, 64]
    - [0, 9.793]
  - - [3392, 3008, 1, 64, 3392, 3392, 3392, 64]
    - [0, 9.74]
  - - [3520, 3008, 1, 64, 3520, 3520, 3520, 64]
    - [0, 9.688]
  - - [3648, 3008, 1, 64, 3648, 3648, 3648, 64]
    - [0, 9.621]
  - - [3776, 3008, 1, 64, 3776, 3776, 3776, 64]
    - [0, 9.722]
  - - [3904, 3008, 1, 64, 3904, 3904, 3904, 64]
    - [0, 9.72]
  - - [4032, 3008, 1, 64, 4032, 4032, 4032, 64]
    - [0, 9.721]
  - - [64, 3136, 1, 64, 64, 64, 64, 64]
    - [0, 4.685]
  - - [192, 3136, 1, 64, 192, 192, 192, 64]
    - [0, 8.038]
  - - [320, 3136, 1, 64, 320, 320, 320, 64]
    - [0, 9.446]
  - - [448, 3136, 1, 64, 448, 448, 448, 64]
    - [0, 10.196]
  - - [576, 3136, 1, 64, 576, 576, 576, 64]
    - [0, 10.754]
  - - [704, 3136, 1, 64, 704, 704, 704, 64]
    - [0, 11.035]
  - - [832, 3136, 1, 64, 832, 832, 832, 64]
    - [0, 11.347]
  - - [960, 3136, 1, 64, 960, 960, 960, 64]
    - [0, 11.514]
  - - [1088, 3136, 1, 64, 1088, 1088, 1088, 64]
    - [0, 11.706]
  - - [1216, 3136, 1, 64, 1216, 1216, 1216, 64]
    - [0, 11.905]
  - - [1344, 3136, 1, 64, 1344, 1344, 1344, 64]
    - [0, 11.931]
  - - [1472, 3136, 1, 64, 1472, 1472, 1472, 64]
    - [0, 11.368]
  - - [1600, 3136, 1, 64, 1600, 1600, 1600, 64]
    - [0, 11.526]
  - - [1728, 3136, 1, 64, 1728, 1728, 1728, 64]
    - [0, 11.644]
  - - [1856, 3136, 1, 64, 1856, 1856, 1856, 64]
    - [0, 11.812]
  - - [1984, 3136, 1, 64, 1984, 1984, 1984, 64]
    - [0, 11.757]
  - - [2112, 3136, 1, 64, 2112, 2112, 2112, 64]
    - [0, 11.909]
  - - [2240, 3136, 1, 64, 2240, 2240, 2240, 64]
    - [0, 11.9]
  - - [2368, 3136, 1, 64, 2368, 2368, 2368, 64]
    - [0, 11.96]
  - - [2496, 3136, 1, 64, 2496, 2496, 2496, 64]
    - [0, 12.001]
  - - [2624, 3136, 1, 64, 2624, 2624, 2624, 64]
    - [0, 11.694]
  - - [2752, 3136, 1, 64, 2752, 2752, 2752, 64]
    - [0, 11.523]
  - - [2880, 3136, 1, 64, 2880, 2880, 2880, 64]
    - [0, 10.774]
  - - [3008, 3136, 1, 64, 3008, 3008, 3008, 64]
    - [0, 9.64]
  - - [3136, 3136, 1, 64, 3136, 3136, 3136, 64]
    - [0, 9.62]
  - - [3264, 3136, 1, 64, 3264, 3264, 3264, 64]
    - [0, 9.788]
  - - [3392, 3136, 1, 64, 3392, 3392, 3392, 64]
    - [0, 9.742]
  - - [3520, 3136, 1, 64, 3520, 3520, 3520, 64]
    - [0, 9.754]
  - - [3648, 3136, 1, 64, 3648, 3648, 3648, 64]
    - [0, 9.62]
  - - [3776, 3136, 1, 64, 3776, 3776, 3776, 64]
    - [0, 9.72]
  - - [3904, 3136, 1, 64, 3904, 3904, 3904, 64]
    - [0, 9.749]
  - - [4032, 3136, 1, 64, 4032, 4032, 4032, 64]
    - [0, 9.687]
  - - [64, 3264, 1, 64, 64, 64, 64, 64]
    - [0, 4.886]
  - - [192, 3264, 1, 64, 192, 192, 192, 64]
    - [0, 8.094]
  - - [320, 3264, 1, 64, 320, 320, 320, 64]
    - [0, 9.545]
  - - [448, 3264, 1, 64, 448, 448, 448, 64]
    - [0, 10.333]
  - - [576, 3264, 1, 64, 576, 576, 576, 64]
    - [0, 10.834]
  - - [704, 3264, 1, 64, 704, 704, 704, 64]
    - [0, 11.202]
  - - [832, 3264, 1, 64, 832, 832, 832, 64]
    - [0, 11.365]
  - - [960, 3264, 1, 64, 960, 960, 960, 64]
    - [0, 11.545]
  - - [1088, 3264, 1, 64, 1088, 1088, 1088, 64]
    - [0, 11.681]
  - - [1216, 3264, 1, 64, 1216, 1216, 1216, 64]
    - [0, 11.889]
  - - [1344, 3264, 1, 64, 1344, 1344, 1344, 64]
    - [0, 11.031]
  - - [1472, 3264, 1, 64, 1472, 1472, 1472, 64]
    - [0, 11.421]
  - - [1600, 3264, 1, 64, 1600, 1600, 1600, 64]
    - [0, 11.603]
  - - [1728, 3264, 1, 64, 1728, 1728, 1728, 64]
    - [0, 11.727]
  - - [1856, 3264, 1, 64, 1856, 1856, 1856, 64]
    - [0, 11.736]
  - - [1984, 3264, 1, 64, 1984, 1984, 1984, 64]
    - [0, 11.813]
  - - [2112, 3264, 1, 64, 2112, 2112, 2112, 64]
    - [0, 11.979]
  - - [2240, 3264, 1, 64, 2240, 2240, 2240, 64]
    - [0, 12.011]
  - - [2368, 3264, 1, 64, 2368, 2368, 2368, 64]
    - [0, 11.956]
  - - [2496, 3264, 1, 64, 2496, 2496, 2496, 64]
    - [0, 12.016]
  - - [2624, 3264, 1, 64, 2624, 2624, 2624, 64]
    - [0, 11.512]
  - - [2752, 3264, 1, 64, 2752, 2752, 2752, 64]
    - [0, 11.069]
  - - [2880, 3264, 1, 64, 2880, 2880, 2880, 64]
    - [0, 9.804]
  - - [3008, 3264, 1, 64, 3008, 3008, 3008, 64]
    - [0, 9.587]
  - - [3136, 3264, 1, 64, 3136, 3136, 3136, 64]
    - [0, 9.63]
  - - [3264, 3264, 1, 64, 3264, 3264, 3264, 64]
    - [0, 9.784]
  - - [3392, 3264, 1, 64, 3392, 3392, 3392, 64]
    - [0, 9.784]
  - - [3520, 3264, 1, 64, 3520, 3520, 3520, 64]
    - [0, 9.743]
  - - [3648, 3264, 1, 64, 3648, 3648, 3648, 64]
    - [0, 9.588]
  - - [3776, 3264, 1, 64, 3776, 3776, 3776, 64]
    - [0, 9.673]
  - - [3904, 3264, 1, 64, 3904, 3904, 3904, 64]
    - [0, 9.708]
  - - [4032, 3264, 1, 64, 4032, 4032, 4032, 64]
    - [0, 9.723]
  - - [64, 3392, 1, 64, 64, 64, 64, 64]
    - [0, 4.915]
  - - [192, 3392, 1, 64, 192, 192, 192, 64]
    - [0, 8.247]
  - - [320, 3392, 1, 64, 320, 320, 320, 64]
    - [0, 9.611]
  - - [448, 3392, 1, 64, 448, 448, 448, 64]
    - [0, 10.424]
  - - [576, 3392, 1, 64, 576, 576, 576, 64]
    - [0, 10.92]
  - - [704, 3392, 1, 64, 704, 704, 704, 64]
    - [0, 11.255]
  - - [832, 3392, 1, 64, 832, 832, 832, 64]
    - [0, 11.426]
  - - [960, 3392, 1, 64, 960, 960, 960, 64]
    - [0, 11.678]
  - - [1088, 3392, 1, 64, 1088, 1088, 1088, 64]
    - [0, 11.848]
  - - [1216, 3392, 1, 64, 1216, 1216, 1216, 64]
    - [0, 11.907]
  - - [1344, 3392, 1, 64, 1344, 1344, 1344, 64]
    - [0, 11.427]
  - - [1472, 3392, 1, 64, 1472, 1472, 1472, 64]
    - [0, 11.612]
  - - [1600, 3392, 1, 64, 1600, 1600, 1600, 64]
    - [0, 11.733]
  - - [1728, 3392, 1, 64, 1728, 1728, 1728, 64]
    - [0, 11.778]
  - - [1856, 3392, 1, 64, 1856, 1856, 1856, 64]
    - [0, 11.777]
  - - [1984, 3392, 1, 64, 1984, 1984, 1984, 64]
    - [0, 11.961]
  - - [2112, 3392, 1, 64, 2112, 2112, 2112, 64]
    - [0, 11.963]
  - - [2240, 3392, 1, 64, 2240, 2240, 2240, 64]
    - [0, 11.924]
  - - [2368, 3392, 1, 64, 2368, 2368, 2368, 64]
    - [0, 12.049]
  - - [2496, 3392, 1, 64, 2496, 2496, 2496, 64]
    - [0, 11.521]
  - - [2624, 3392, 1, 64, 2624, 2624, 2624, 64]
    - [0, 11.052]
  - - [2752, 3392, 1, 64, 2752, 2752, 2752, 64]
    - [0, 10.122]
  - - [2880, 3392, 1, 64, 2880, 2880, 2880, 64]
    - [0, 9.715]
  - - [3008, 3392, 1, 64, 3008, 3008, 3008, 64]
    - [0, 9.631]
  - - [3136, 3392, 1, 64, 3136, 3136, 3136, 64]
    - [0, 9.643]
  - - [3264, 3392, 1, 64, 3264, 3264, 3264, 64]
    - [0, 9.807]
  - - [3392, 3392, 1, 64, 3392, 3392, 3392, 64]
    - [0, 9.803]
  - - [3520, 3392, 1, 64, 3520, 3520, 3520, 64]
    - [0, 9.72]
  - - [3648, 3392, 1, 64, 3648, 3648, 3648, 64]
    - [0, 9.586]
  - - [3776, 3392, 1, 64, 3776, 3776, 3776, 64]
    - [0, 9.703]
  - - [3904, 3392, 1, 64, 3904, 3904, 3904, 64]
    - [0, 9.756]
  - - [4032, 3392, 1, 64, 4032, 4032, 4032, 64]
    - [0, 9.813]
  - - [64, 3520, 1, 64, 64, 64, 64, 64]
    - [0, 5.028]
  - - [192, 3520, 1, 64, 192, 192, 192, 64]
    - [0, 8.324]
  - - [320, 3520, 1, 64, 320, 320, 320, 64]
    - [0, 9.748]
  - - [448, 3520, 1, 64, 448, 448, 448, 64]
    - [0, 10.473]
  - - [576, 3520, 1, 64, 576, 576, 576, 64]
    - [0, 10.975]
  - - [704, 3520, 1, 64, 704, 704, 704, 64]
    - [0, 11.304]
  - - [832, 3520, 1, 64, 832, 832, 832, 64]
    - [0, 11.56]
  - - [960, 3520, 1, 64, 960, 960, 960, 64]
    - [0, 11.671]
  - - [1088, 3520, 1, 64, 1088, 1088, 1088, 64]
    - [0, 11.775]
  - - [1216, 3520, 1, 64, 1216, 1216, 1216, 64]
    - [0, 10.836]
  - - [1344, 3520, 1, 64, 1344, 1344, 1344, 64]
    - [0, 11.406]
  - - [1472, 3520, 1, 64, 1472, 1472, 1472, 64]
    - [0, 11.57]
  - - [1600, 3520, 1, 64, 1600, 1600, 1600, 64]
    - [0, 11.682]
  - - [1728, 3520, 1, 64, 1728, 1728, 1728, 64]
    - [0, 11.742]
  - - [1856, 3520, 1, 64, 1856, 1856, 1856, 64]
    - [0, 11.866]
  - - [1984, 3520, 1, 64, 1984, 1984, 1984, 64]
    - [0, 11.992]
  - - [2112, 3520, 1, 64, 2112, 2112, 2112, 64]
    - [0, 11.934]
  - - [2240, 3520, 1, 64, 2240, 2240, 2240, 64]
    - [0, 12.044]
  - - [2368, 3520, 1, 64, 2368, 2368, 2368, 64]
    - [0, 11.634]
  - - [2496, 3520, 1, 64, 2496, 2496, 2496, 64]
    - [0, 11.398]
  - - [2624, 3520, 1, 64, 2624, 2624, 2624, 64]
    - [0, 10.429]
  - - [2752, 3520, 1, 64, 2752, 2752, 2752, 64]
    - [0, 9.809]
  - - [2880, 3520, 1, 64, 2880, 2880, 2880, 64]
    - [0, 9.725]
  - - [3008, 3520, 1, 64, 3008, 3008, 3008, 64]
    - [0, 9.611]
  - - [3136, 3520, 1, 64, 3136, 3136, 3136, 64]
    - [0, 9.614]
  - - [3264, 3520, 1, 64, 3264, 3264, 3264, 64]
    - [0, 9.816]
  - - [3392, 3520, 1, 64, 3392, 3392, 3392, 64]
    - [0, 9.752]
  - - [3520, 3520, 1, 64, 3520, 3520, 3520, 64]
    - [0, 9.72]
  - - [3648, 3520, 1, 64, 3648, 3648, 3648, 64]
    - [0, 9.62]
  - - [3776, 3520, 1, 64, 3776, 3776, 3776, 64]
    - [0, 9.731]
  - - [3904, 3520, 1, 64, 3904, 3904, 3904, 64]
    - [0, 9.765]
  - - [4032, 3520, 1, 64, 4032, 4032, 4032, 64]
    - [0, 9.8]
  - - [64, 3648, 1, 64, 64, 64, 64, 64]
    - [0, 5.192]
  - - [192, 3648, 1, 64, 192, 192, 192, 64]
    - [0, 8.442]
  - - [320, 3648, 1, 64, 320, 320, 320, 64]
    - [0, 9.827]
  - - [448, 3648, 1, 64, 448, 448, 448, 64]
    - [0, 10.579]
  - - [576, 3648, 1, 64, 576, 576, 576, 64]
    - [0, 10.959]
  - - [704, 3648, 1, 64, 704, 704, 704, 64]
    - [0, 11.341]
  - - [832, 3648, 1, 64, 832, 832, 832, 64]
    - [0, 11.602]
  - - [960, 3648, 1, 64, 960, 960, 960, 64]
    - [0, 11.743]
  - - [1088, 3648, 1, 64, 1088, 1088, 1088, 64]
    - [0, 11.858]
  - - [1216, 3648, 1, 64, 1216, 1216, 1216, 64]
    - [0, 11.155]
  - - [1344, 3648, 1, 64, 1344, 1344, 1344, 64]
    - [0, 11.572]
  - - [1472, 3648, 1, 64, 1472, 1472, 1472, 64]
    - [0, 11.68]
  - - [1600, 3648, 1, 64, 1600, 1600, 1600, 64]
    - [0, 11.787]
  - - [1728, 3648, 1, 64, 1728, 1728, 1728, 64]
    - [0, 11.826]
  - - [1856, 3648, 1, 64, 1856, 1856, 1856, 64]
    - [0, 11.893]
  - - [1984, 3648, 1, 64, 1984, 1984, 1984, 64]
    - [0, 11.816]
  - - [2112, 3648, 1, 64, 2112, 2112, 2112, 64]
    - [0, 12.037]
  - - [2240, 3648, 1, 64, 2240, 2240, 2240, 64]
    - [0, 11.913]
  - - [2368, 3648, 1, 64, 2368, 2368, 2368, 64]
    - [0, 11.54]
  - - [2496, 3648, 1, 64, 2496, 2496, 2496, 64]
    - [0, 10.689]
  - - [2624, 3648, 1, 64, 2624, 2624, 2624, 64]
    - [0, 9.658]
  - - [2752, 3648, 1, 64, 2752, 2752, 2752, 64]
    - [0, 9.828]
  - - [2880, 3648, 1, 64, 2880, 2880, 2880, 64]
    - [0, 9.746]
  - - [3008, 3648, 1, 64, 3008, 3008, 3008, 64]
    - [0, 9.657]
  - - [3136, 3648, 1, 64, 3136, 3136, 3136, 64]
    - [0, 9.648]
  - - [3264, 3648, 1, 64, 3264, 3264, 3264, 64]
    - [0, 9.784]
  - - [3392, 3648, 1, 64, 3392, 3392, 3392, 64]
    - [0, 9.72]
  - - [3520, 3648, 1, 64, 3520, 3520, 3520, 64]
    - [0, 9.736]
  - - [3648, 3648, 1, 64, 3648, 3648, 3648, 64]
    - [0, 9.652]
  - - [3776, 3648, 1, 64, 3776, 3776, 3776, 64]
    - [0, 9.784]
  - - [3904, 3648, 1, 64, 3904, 3904, 3904, 64]
    - [0, 9.777]
  - - [4032, 3648, 1, 64, 4032, 4032, 4032, 64]
    - [0, 9.841]
  - - [64, 3776, 1, 64, 64, 64, 64, 64]
    - [0, 5.357]
  - - [192, 3776, 1, 64, 192, 192, 192, 64]
    - [0, 8.612]
  - - [320, 3776, 1, 64, 320, 320, 320, 64]
    - [0, 9.873]
  - - [448, 3776, 1, 64, 448, 448, 448, 64]
    - [0, 10.671]
  - - [576, 3776, 1, 64, 576, 576, 576, 64]
    - [0, 11.12]
  - - [704, 3776, 1, 64, 704, 704, 704, 64]
    - [0, 11.345]
  - - [832, 3776, 1, 64, 832, 832, 832, 64]
    - [0, 11.565]
  - - [960, 3776, 1, 64, 960, 960, 960, 64]
    - [0, 11.779]
  - - [1088, 3776, 1, 64, 1088, 1088, 1088, 64]
    - [0, 11.989]
  - - [1216, 3776, 1, 64, 1216, 1216, 1216, 64]
    - [0, 11.481]
  - - [1344, 3776, 1, 64, 1344, 1344, 1344, 64]
    - [0, 11.63]
  - - [1472, 3776, 1, 64, 1472, 1472, 1472, 64]
    - [0, 11.671]
  - - [1600, 3776, 1, 64, 1600, 1600, 1600, 64]
    - [0, 11.799]
  - - [1728, 3776, 1, 64, 1728, 1728, 1728, 64]
    - [0, 11.813]
  - - [1856, 3776, 1, 64, 1856, 1856, 1856, 64]
    - [0, 11.894]
  - - [1984, 3776, 1, 64, 1984, 1984, 1984, 64]
    - [0, 11.965]
  - - [2112, 3776, 1, 64, 2112, 2112, 2112, 64]
    - [0, 12.044]
  - - [2240, 3776, 1, 64, 2240, 2240, 2240, 64]
    - [0, 11.582]
  - - [2368, 3776, 1, 64, 2368, 2368, 2368, 64]
    - [0, 10.873]
  - - [2496, 3776, 1, 64, 2496, 2496, 2496, 64]
    - [0, 9.828]
  - - [2624, 3776, 1, 64, 2624, 2624, 2624, 64]
    - [0, 9.67]
  - - [2752, 3776, 1, 64, 2752, 2752, 2752, 64]
    - [0, 9.796]
  - - [2880, 3776, 1, 64, 2880, 2880, 2880, 64]
    - [0, 9.743]
  - - [3008, 3776, 1, 64, 3008, 3008, 3008, 64]
    - [0, 9.66]
  - - [3136, 3776, 1, 64, 3136, 3136, 3136, 64]
    - [0, 9.629]
  - - [3264, 3776, 1, 64, 3264, 3264, 3264, 64]
    - [0, 9.766]
  - - [3392, 3776, 1, 64, 3392, 3392, 3392, 64]
    - [0, 9.734]
  - - [3520, 3776, 1, 64, 3520, 3520, 3520, 64]
    - [0, 9.765]
  - - [3648, 3776, 1, 64, 3648, 3648, 3648, 64]
    - [0, 9.654]
  - - [3776, 3776, 1, 64, 3776, 3776, 3776, 64]
    - [0, 9.787]
  - - [3904, 3776, 1, 64, 3904, 3904, 3904, 64]
    - [0, 9.818]
  - - [4032, 3776, 1, 64, 4032, 4032, 4032, 64]
    - [0, 9.817]
  - - [64, 3904, 1, 64, 64, 64, 64, 64]
    - [0, 5.346]
  - - [192, 3904, 1, 64, 192, 192, 192, 64]
    - [0, 8.612]
  - - [320, 3904, 1, 64, 320, 320, 320, 64]
    - [0, 9.954]
  - - [448, 3904, 1, 64, 448, 448, 448, 64]
    - [0, 10.662]
  - - [576, 3904, 1, 64, 576, 576, 576, 64]
    - [0, 11.074]
  - - [704, 3904, 1, 64, 704, 704, 704, 64]
    - [0, 11.433]
  - - [832, 3904, 1, 64, 832, 832, 832, 64]
    - [0, 11.659]
  - - [960, 3904, 1, 64, 960, 960, 960, 64]
    - [0, 11.751]
  - - [1088, 3904, 1, 64, 1088, 1088, 1088, 64]
    - [0, 11.948]
  - - [1216, 3904, 1, 64, 1216, 1216, 1216, 64]
    - [0, 11.509]
  - - [1344, 3904, 1, 64, 1344, 1344, 1344, 64]
    - [0, 11.588]
  - - [1472, 3904, 1, 64, 1472, 1472, 1472, 64]
    - [0, 11.708]
  - - [1600, 3904, 1, 64, 1600, 1600, 1600, 64]
    - [0, 11.821]
  - - [1728, 3904, 1, 64, 1728, 1728, 1728, 64]
    - [0, 11.891]
  - - [1856, 3904, 1, 64, 1856, 1856, 1856, 64]
    - [0, 11.895]
  - - [1984, 3904, 1, 64, 1984, 1984, 1984, 64]
    - [0, 12.006]
  - - [2112, 3904, 1, 64, 2112, 2112, 2112, 64]
    - [0, 11.818]
  - - [2240, 3904, 1, 64, 2240, 2240, 2240, 64]
    - [0, 11.368]
  - - [2368, 3904, 1, 64, 2368, 2368, 2368, 64]
    - [0, 10.544]
  - - [2496, 3904, 1, 64, 2496, 2496, 2496, 64]
    - [0, 9.769]
  - - [2624, 3904, 1, 64, 2624, 2624, 2624, 64]
    - [0, 9.685]
  - - [2752, 3904, 1, 64, 2752, 2752, 2752, 64]
    - [0, 9.831]
  - - [2880, 3904, 1, 64, 2880, 2880, 2880, 64]
    - [0, 9.729]
  - - [3008, 3904, 1, 64, 3008, 3008, 3008, 64]
    - [0, 9.616]
  - - [3136, 3904, 1, 64, 3136, 3136, 3136, 64]
    - [0, 9.602]
  - - [3264, 3904, 1, 64, 3264, 3264, 3264, 64]
    - [0, 9.784]
  - - [3392, 3904, 1, 64, 3392, 3392, 3392, 64]
    - [0, 9.78]
  - - [3520, 3904, 1, 64, 3520, 3520, 3520, 64]
    - [0, 9.762]
  - - [3648, 3904, 1, 64, 3648, 3648, 3648, 64]
    - [0, 9.692]
  - - [3776, 3904, 1, 64, 3776, 3776, 3776, 64]
    - [0, 9.753]
  - - [3904, 3904, 1, 64, 3904, 3904, 3904, 64]
    - [0, 9.817]
  - - [4032, 3904, 1, 64, 4032, 4032, 4032, 64]
    - [0, 9.833]
  - - [64, 4032, 1, 64, 64, 64, 64, 64]
    - [0, 5.393]
  - - [192, 4032, 1, 64, 192, 192, 192, 64]
    - [0, 8.661]
  - - [320, 4032, 1, 64, 320, 320, 320, 64]
    - [0, 10.052]
  - - [448, 4032, 1, 64, 448, 448, 448, 64]
    - [0, 10.781]
  - - [576, 4032, 1, 64, 576, 576, 576, 64]
    - [0, 11.201]
  - - [704, 4032, 1, 64, 704, 704, 704, 64]
    - [0, 11.44]
  - - [832, 4032, 1, 64, 832, 832, 832, 64]
    - [0, 11.703]
  - - [960, 4032, 1, 64, 960, 960, 960, 64]
    - [0, 11.82]
  - - [1088, 4032, 1, 64, 1088, 1088, 1088, 64]
    - [0, 11.03]
  - - [1216, 4032, 1, 64, 1216, 1216, 1216, 64]
    - [0, 11.483]
  - - [1344, 4032, 1, 64, 1344, 1344, 1344, 64]
    - [0, 11.683]
  - - [1472, 4032, 1, 64, 1472, 1472, 1472, 64]
    - [0, 11.76]
  - - [1600, 4032, 1, 64, 1600, 1600, 1600, 64]
    - [0, 11.826]
  - - [1728, 4032, 1, 64, 1728, 1728, 1728, 64]
    - [0, 11.878]
  - - [1856, 4032, 1, 64, 1856, 1856, 1856, 64]
    - [0, 11.983]
  - - [1984, 4032, 1, 64, 1984, 1984, 1984, 64]
    - [0, 12.11]
  - - [2112, 4032, 1, 64, 2112, 2112, 2112, 64]
    - [0, 11.575]
  - - [2240, 4032, 1, 64, 2240, 2240, 2240, 64]
    - [0, 10.757]
  - - [2368, 4032, 1, 64, 2368, 2368, 2368, 64]
    - [0, 9.851]
  - - [2496, 4032, 1, 64, 2496, 2496, 2496, 64]
    - [0, 9.807]
  - - [2624, 4032, 1, 64, 2624, 2624, 2624, 64]
    - [0, 9.701]
  - - [2752, 4032, 1, 64, 2752, 2752, 2752, 64]
    - [0, 9.843]
  - - [2880, 4032, 1, 64, 2880, 2880, 2880, 64]
    - [0, 9.794]
  - - [3008, 4032, 1, 64, 3008, 3008, 3008, 64]
    - [0, 9.64]
  - - [3136, 4032, 1, 64, 3136, 3136, 3136, 64]
    - [0, 9.683]
  - - [3264, 4032, 1, 64, 3264, 3264, 3264, 64]
    - [0, 9.804]
  - - [3392, 4032, 1, 64, 3392, 3392, 3392, 64]
    - [0, 9.836]
  - - [3520, 4032, 1, 64, 3520, 3520, 3520, 64]
    - [0, 9.826]
  - - [3648, 4032, 1, 64, 3648, 3648, 3648, 64]
    - [0, 9.651]
  - - [3776, 4032, 1, 64, 3776, 3776, 3776, 64]
    - [0, 9.752]
  - - [3904, 4032, 1, 64, 3904, 3904, 3904, 64]
    - [0, 9.795]
  - - [4032, 4032, 1, 64, 4032, 4032, 4032, 64]
    - [0, 9.789]
  - - [64, 64, 1, 256, 64, 64, 64, 256]
    - [1, 0.515]
  - - [192, 64, 1, 256, 192, 192, 192, 256]
    - [2, 1.508]
  - - [320, 64, 1, 256, 320, 320, 320, 256]
    - [0, 2.258]
  - - [448, 64, 1, 256, 448, 448, 448, 256]
    - [0, 3.144]
  - - [576, 64, 1, 256, 576, 576, 576, 256]
    - [2, 3.421]
  - - [704, 64, 1, 256, 704, 704, 704, 256]
    - [2, 4.173]
  - - [832, 64, 1, 256, 832, 832, 832, 256]
    - [0, 4.72]
  - - [960, 64, 1, 256, 960, 960, 960, 256]
    - [0, 5.392]
  - - [1088, 64, 1, 256, 1088, 1088, 1088, 256]
    - [2, 5.177]
  - - [1216, 64, 1, 256, 1216, 1216, 1216, 256]
    - [0, 5.684]
  - - [1344, 64, 1, 256, 1344, 1344, 1344, 256]
    - [0, 6.274]
  - - [1472, 64, 1, 256, 1472, 1472, 1472, 256]
    - [0, 5.975]
  - - [1600, 64, 1, 256, 1600, 1600, 1600, 256]
    - [0, 6.4]
  - - [1728, 64, 1, 256, 1728, 1728, 1728, 256]
    - [0, 6.903]
  - - [1856, 64, 1, 256, 1856, 1856, 1856, 256]
    - [0, 7.394]
  - - [1984, 64, 1, 256, 1984, 1984, 1984, 256]
    - [2, 7.015]
  - - [2112, 64, 1, 256, 2112, 2112, 2112, 256]
    - [0, 7.335]
  - - [2240, 64, 1, 256, 2240, 2240, 2240, 256]
    - [0, 7.727]
  - - [2368, 64, 1, 256, 2368, 2368, 2368, 256]
    - [0, 8.17]
  - - [2496, 64, 1, 256, 2496, 2496, 2496, 256]
    - [2, 7.679]
  - - [2624, 64, 1, 256, 2624, 2624, 2624, 256]
    - [0, 8.013]
  - - [2752, 64, 1, 256, 2752, 2752, 2752, 256]
    - [0, 8.433]
  - - [2880, 64, 1, 256, 2880, 2880, 2880, 256]
    - [0, 8.827]
  - - [3008, 64, 1, 256, 3008, 3008, 3008, 256]
    - [2, 8.471]
  - - [3136, 64, 1, 256, 3136, 3136, 3136, 256]
    - [0, 8.637]
  - - [3264, 64, 1, 256, 3264, 3264, 3264, 256]
    - [0, 8.982]
  - - [3392, 64, 1, 256, 3392, 3392, 3392, 256]
    - [2, 8.762]
  - - [3520, 64, 1, 256, 3520, 3520, 3520, 256]
    - [2, 8.857]
  - - [3648, 64, 1, 256, 3648, 3648, 3648, 256]
    - [0, 9.13]
  - - [3776, 64, 1, 256, 3776, 3776, 3776, 256]
    - [0, 9.443]
  - - [3904, 64, 1, 256, 3904, 3904, 3904, 256]
    - [2, 9.135]
  - - [4032, 64, 1, 256, 4032, 4032, 4032, 256]
    - [0, 9.317]
  - - [64, 192, 1, 256, 64, 64, 64, 256]
    - [2, 1.53]
  - - [192, 192, 1, 256, 192, 192, 192, 256]
    - [2, 3.475]
  - - [320, 192, 1, 256, 320, 320, 320, 256]
    - [0, 5.484]
  - - [448, 192, 1, 256, 448, 448, 448, 256]
    - [0, 6.297]
  - - [576, 192, 1, 256, 576, 576, 576, 256]
    - [0, 6.928]
  - - [704, 192, 1, 256, 704, 704, 704, 256]
    - [0, 7.391]
  - - [832, 192, 1, 256, 832, 832, 832, 256]
    - [2, 7.966]
  - - [960, 192, 1, 256, 960, 960, 960, 256]
    - [0, 8.915]
  - - [1088, 192, 1, 256, 1088, 1088, 1088, 256]
    - [0, 9.052]
  - - [1216, 192, 1, 256, 1216, 1216, 1216, 256]
    - [0, 9.206]
  - - [1344, 192, 1, 256, 1344, 1344, 1344, 256]
    - [2, 9.409]
  - - [1472, 192, 1, 256, 1472, 1472, 1472, 256]
    - [0, 9.454]
  - - [1600, 192, 1, 256, 1600, 1600, 1600, 256]
    - [0, 10.112]
  - - [1728, 192, 1, 256, 1728, 1728, 1728, 256]
    - [0, 10.187]
  - - [1856, 192, 1, 256, 1856, 1856, 1856, 256]
    - [0, 10.236]
  - - [1984, 192, 1, 256, 1984, 1984, 1984, 256]
    - [2, 10.279]
  - - [2112, 192, 1, 256, 2112, 2112, 2112, 256]
    - [2, 10.453]
  - - [2240, 192, 1, 256, 2240, 2240, 2240, 256]
    - [0, 10.743]
  - - [2368, 192, 1, 256, 2368, 2368, 2368, 256]
    - [0, 10.85]
  - - [2496, 192, 1, 256, 2496, 2496, 2496, 256]
    - [0, 10.824]
  - - [2624, 192, 1, 256, 2624, 2624, 2624, 256]
    - [0, 10.815]
  - - [2752, 192, 1, 256, 2752, 2752, 2752, 256]
    - [2, 11.009]
  - - [2880, 192, 1, 256, 2880, 2880, 2880, 256]
    - [0, 11.126]
  - - [3008, 192, 1, 256, 3008, 3008, 3008, 256]
    - [0, 11.244]
  - - [3136, 192, 1, 256, 3136, 3136, 3136, 256]
    - [2, 11.285]
  - - [3264, 192, 1, 256, 3264, 3264, 3264, 256]
    - [0, 11.261]
  - - [3392, 192, 1, 256, 3392, 3392, 3392, 256]
    - [2, 11.415]
  - - [3520, 192, 1, 256, 3520, 3520, 3520, 256]
    - [0, 11.531]
  - - [3648, 192, 1, 256, 3648, 3648, 3648, 256]
    - [0, 11.579]
  - - [3776, 192, 1, 256, 3776, 3776, 3776, 256]
    - [2, 11.575]
  - - [3904, 192, 1, 256, 3904, 3904, 3904, 256]
    - [0, 11.552]
  - - [4032, 192, 1, 256, 4032, 4032, 4032, 256]
    - [2, 11.75]
  - - [64, 320, 1, 256, 64, 64, 64, 256]
    - [0, 2.294]
  - - [192, 320, 1, 256, 192, 192, 192, 256]
    - [0, 5.49]
  - - [320, 320, 1, 256, 320, 320, 320, 256]
    - [0, 6.458]
  - - [448, 320, 1, 256, 448, 448, 448, 256]
    - [0, 7.832]
  - - [576, 320, 1, 256, 576, 576, 576, 256]
    - [0, 8.9]
  - - [704, 320, 1, 256, 704, 704, 704, 256]
    - [0, 8.915]
  - - [832, 320, 1, 256, 832, 832, 832, 256]
    - [2, 9.63]
  - - [960, 320, 1, 256, 960, 960, 960, 256]
    - [0, 10.087]
  - - [1088, 320, 1, 256, 1088, 1088, 1088, 256]
    - [2, 10.103]
  - - [1216, 320, 1, 256, 1216, 1216, 1216, 256]
    - [0, 10.528]
  - - [1344, 320, 1, 256, 1344, 1344, 1344, 256]
    - [0, 10.77]
  - - [1472, 320, 1, 256, 1472, 1472, 1472, 256]
    - [2, 10.687]
  - - [1600, 320, 1, 256, 1600, 1600, 1600, 256]
    - [0, 11.0]
  - - [1728, 320, 1, 256, 1728, 1728, 1728, 256]
    - [0, 11.17]
  - - [1856, 320, 1, 256, 1856, 1856, 1856, 256]
    - [2, 11.217]
  - - [1984, 320, 1, 256, 1984, 1984, 1984, 256]
    - [0, 11.362]
  - - [2112, 320, 1, 256, 2112, 2112, 2112, 256]
    - [0, 11.464]
  - - [2240, 320, 1, 256, 2240, 2240, 2240, 256]
    - [0, 11.443]
  - - [2368, 320, 1, 256, 2368, 2368, 2368, 256]
    - [0, 11.626]
  - - [2496, 320, 1, 256, 2496, 2496, 2496, 256]
    - [0, 11.783]
  - - [2624, 320, 1, 256, 2624, 2624, 2624, 256]
    - [0, 11.754]
  - - [2752, 320, 1, 256, 2752, 2752, 2752, 256]
    - [0, 11.824]
  - - [2880, 320, 1, 256, 2880, 2880, 2880, 256]
    - [0, 11.9]
  - - [3008, 320, 1, 256, 3008, 3008, 3008, 256]
    - [2, 12.006]
  - - [3136, 320, 1, 256, 3136, 3136, 3136, 256]
    - [2, 12.029]
  - - [3264, 320, 1, 256, 3264, 3264, 3264, 256]
    - [0, 12.047]
  - - [3392, 320, 1, 256, 3392, 3392, 3392, 256]
    - [0, 11.765]
  - - [3520, 320, 1, 256, 3520, 3520, 3520, 256]
    - [0, 11.319]
  - - [3648, 320, 1, 256, 3648, 3648, 3648, 256]
    - [0, 11.578]
  - - [3776, 320, 1, 256, 3776, 3776, 3776, 256]
    - [2, 11.649]
  - - [3904, 320, 1, 256, 3904, 3904, 3904, 256]
    - [2, 11.823]
  - - [4032, 320, 1, 256, 4032, 4032, 4032, 256]
    - [2, 11.807]
  - - [64, 448, 1, 256, 64, 64, 64, 256]
    - [0, 3.195]
  - - [192, 448, 1, 256, 192, 192, 192, 256]
    - [0, 6.316]
  - - [320, 448, 1, 256, 320, 320, 320, 256]
    - [0, 7.836]
  - - [448, 448, 1, 256, 448, 448, 448, 256]
    - [2, 8.766]
  - - [576, 448, 1, 256, 576, 576, 576, 256]
    - [0, 9.398]
  - - [704, 448, 1, 256, 704, 704, 704, 256]
    - [2, 9.803]
  - - [832, 448, 1, 256, 832, 832, 832, 256]
    - [2, 10.229]
  - - [960, 448, 1, 256, 960, 960, 960, 256]
    - [0, 10.768]
  - - [1088, 448, 1, 256, 1088, 1088, 1088, 256]
    - [0, 11.049]
  - - [1216, 448, 1, 256, 1216, 1216, 1216, 256]
    - [0, 11.134]
  - - [1344, 448, 1, 256, 1344, 1344, 1344, 256]
    - [2, 11.366]
  - - [1472, 448, 1, 256, 1472, 1472, 1472, 256]
    - [0, 11.354]
  - - [1600, 448, 1, 256, 1600, 1600, 1600, 256]
    - [0, 11.452]
  - - [1728, 448, 1, 256, 1728, 1728, 1728, 256]
    - [2, 11.633]
  - - [1856, 448, 1, 256, 1856, 1856, 1856, 256]
    - [0, 11.657]
  - - [1984, 448, 1, 256, 1984, 1984, 1984, 256]
    - [2, 11.873]
  - - [2112, 448, 1, 256, 2112, 2112, 2112, 256]
    - [0, 11.925]
  - - [2240, 448, 1, 256, 2240, 2240, 2240, 256]
    - [2, 12.06]
  - - [2368, 448, 1, 256, 2368, 2368, 2368, 256]
    - [0, 11.989]
  - - [2496, 448, 1, 256, 2496, 2496, 2496, 256]
    - [2, 11.313]
  - - [2624, 448, 1, 256, 2624, 2624, 2624, 256]
    - [0, 11.613]
  - - [2752, 448, 1, 256, 2752, 2752, 2752, 256]
    - [2, 11.685]
  - - [2880, 448, 1, 256, 2880, 2880, 2880, 256]
    - [0, 11.748]
  - - [3008, 448, 1, 256, 3008, 3008, 3008, 256]
    - [2, 11.812]
  - - [3136, 448, 1, 256, 3136, 3136, 3136, 256]
    - [2, 11.832]
  - - [3264, 448, 1, 256, 3264, 3264, 3264, 256]
    - [2, 11.937]
  - - [3392, 448, 1, 256, 3392, 3392, 3392, 256]
    - [2, 11.946]
  - - [3520, 448, 1, 256, 3520, 3520, 3520, 256]
    - [2, 12.042]
  - - [3648, 448, 1, 256, 3648, 3648, 3648, 256]
    - [0, 12.07]
  - - [3776, 448, 1, 256, 3776, 3776, 3776, 256]
    - [2, 12.17]
  - - [3904, 448, 1, 256, 3904, 3904, 3904, 256]
    - [2, 12.166]
  - - [4032, 448, 1, 256, 4032, 4032, 4032, 256]
    - [2, 12.159]
  - - [64, 576, 1, 256, 64, 64, 64, 256]
    - [2, 3.488]
  - - [192, 576, 1, 256, 192, 192, 192, 256]
    - [0, 6.957]
  - - [320, 576, 1, 256, 320, 320, 320, 256]
    - [0, 8.897]
  - - [448, 576, 1, 256, 448, 448, 448, 256]
    - [0, 9.34]
  - - [576, 576, 1, 256, 576, 576, 576, 256]
    - [0, 10.24]
  - - [704, 576, 1, 256, 704, 704, 704, 256]
    - [0, 10.326]
  - - [832, 576, 1, 256, 832, 832, 832, 256]
    - [0, 10.883]
  - - [960, 576, 1, 256, 960, 960, 960, 256]
    - [0, 11.235]
  - - [1088, 576, 1, 256, 1088, 1088, 1088, 256]
    - [0, 11.248]
  - - [1216, 576, 1, 256, 1216, 1216, 1216, 256]
    - [0, 11.531]
  - - [1344, 576, 1, 256, 1344, 1344, 1344, 256]
    - [2, 11.667]
  - - [1472, 576, 1, 256, 1472, 1472, 1472, 256]
    - [2, 11.786]
  - - [1600, 576, 1, 256, 1600, 1600, 1600, 256]
    - [0, 11.849]
  - - [1728, 576, 1, 256, 1728, 1728, 1728, 256]
    - [2, 11.945]
  - - [1856, 576, 1, 256, 1856, 1856, 1856, 256]
    - [0, 12.031]
  - - [1984, 576, 1, 256, 1984, 1984, 1984, 256]
    - [0, 11.475]
  - - [2112, 576, 1, 256, 2112, 2112, 2112, 256]
    - [2, 11.788]
  - - [2240, 576, 1, 256, 2240, 2240, 2240, 256]
    - [2, 11.7]
  - - [2368, 576, 1, 256, 2368, 2368, 2368, 256]
    - [2, 11.785]
  - - [2496, 576, 1, 256, 2496, 2496, 2496, 256]
    - [2, 11.845]
  - - [2624, 576, 1, 256, 2624, 2624, 2624, 256]
    - [2, 11.939]
  - - [2752, 576, 1, 256, 2752, 2752, 2752, 256]
    - [2, 12.016]
  - - [2880, 576, 1, 256, 2880, 2880, 2880, 256]
    - [2, 12.115]
  - - [3008, 576, 1, 256, 3008, 3008, 3008, 256]
    - [2, 12.104]
  - - [3136, 576, 1, 256, 3136, 3136, 3136, 256]
    - [2, 12.233]
  - - [3264, 576, 1, 256, 3264, 3264, 3264, 256]
    - [2, 12.16]
  - - [3392, 576, 1, 256, 3392, 3392, 3392, 256]
    - [2, 12.275]
  - - [3520, 576, 1, 256, 3520, 3520, 3520, 256]
    - [2, 12.337]
  - - [3648, 576, 1, 256, 3648, 3648, 3648, 256]
    - [2, 12.349]
  - - [3776, 576, 1, 256, 3776, 3776, 3776, 256]
    - [2, 12.363]
  - - [3904, 576, 1, 256, 3904, 3904, 3904, 256]
    - [2, 12.406]
  - - [4032, 576, 1, 256, 4032, 4032, 4032, 256]
    - [2, 12.416]
  - - [64, 704, 1, 256, 64, 64, 64, 256]
    - [2, 4.244]
  - - [192, 704, 1, 256, 192, 192, 192, 256]
    - [0, 7.427]
  - - [320, 704, 1, 256, 320, 320, 320, 256]
    - [2, 9.009]
  - - [448, 704, 1, 256, 448, 448, 448, 256]
    - [0, 9.801]
  - - [576, 704, 1, 256, 576, 576, 576, 256]
    - [2, 10.383]
  - - [704, 704, 1, 256, 704, 704, 704, 256]
    - [2, 10.861]
  - - [832, 704, 1, 256, 832, 832, 832, 256]
    - [0, 11.212]
  - - [960, 704, 1, 256, 960, 960, 960, 256]
    - [0, 11.444]
  - - [1088, 704, 1, 256, 1088, 1088, 1088, 256]
    - [0, 11.697]
  - - [1216, 704, 1, 256, 1216, 1216, 1216, 256]
    - [0, 11.791]
  - - [1344, 704, 1, 256, 1344, 1344, 1344, 256]
    - [2, 12.085]
  - - [1472, 704, 1, 256, 1472, 1472, 1472, 256]
    - [0, 12.03]
  - - [1600, 704, 1, 256, 1600, 1600, 1600, 256]
    - [0, 11.321]
  - - [1728, 704, 1, 256, 1728, 1728, 1728, 256]
    - [2, 11.609]
  - - [1856, 704, 1, 256, 1856, 1856, 1856, 256]
    - [2, 11.824]
  - - [1984, 704, 1, 256, 1984, 1984, 1984, 256]
    - [2, 11.937]
  - - [2112, 704, 1, 256, 2112, 2112, 2112, 256]
    - [2, 11.932]
  - - [2240, 704, 1, 256, 2240, 2240, 2240, 256]
    - [2, 12.037]
  - - [2368, 704, 1, 256, 2368, 2368, 2368, 256]
    - [2, 12.166]
  - - [2496, 704, 1, 256, 2496, 2496, 2496, 256]
    - [2, 12.126]
  - - [2624, 704, 1, 256, 2624, 2624, 2624, 256]
    - [2, 12.192]
  - - [2752, 704, 1, 256, 2752, 2752, 2752, 256]
    - [2, 12.214]
  - - [2880, 704, 1, 256, 2880, 2880, 2880, 256]
    - [2, 12.304]
  - - [3008, 704, 1, 256, 3008, 3008, 3008, 256]
    - [2, 12.326]
  - - [3136, 704, 1, 256, 3136, 3136, 3136, 256]
    - [2, 12.415]
  - - [3264, 704, 1, 256, 3264, 3264, 3264, 256]
    - [2, 12.452]
  - - [3392, 704, 1, 256, 3392, 3392, 3392, 256]
    - [2, 12.47]
  - - [3520, 704, 1, 256, 3520, 3520, 3520, 256]
    - [2, 12.46]
  - - [3648, 704, 1, 256, 3648, 3648, 3648, 256]
    - [2, 12.541]
  - - [3776, 704, 1, 256, 3776, 3776, 3776, 256]
    - [2, 12.58]
  - - [3904, 704, 1, 256, 3904, 3904, 3904, 256]
    - [2, 12.549]
  - - [4032, 704, 1, 256, 4032, 4032, 4032, 256]
    - [2, 12.597]
  - - [64, 832, 1, 256, 64, 64, 64, 256]
    - [0, 4.754]
  - - [192, 832, 1, 256, 192, 192, 192, 256]
    - [2, 8.09]
  - - [320, 832, 1, 256, 320, 320, 320, 256]
    - [0, 9.65]
  - - [448, 832, 1, 256, 448, 448, 448, 256]
    - [2, 10.259]
  - - [576, 832, 1, 256, 576, 576, 576, 256]
    - [0, 10.844]
  - - [704, 832, 1, 256, 704, 704, 704, 256]
    - [2, 11.136]
  - - [832, 832, 1, 256, 832, 832, 832, 256]
    - [0, 11.459]
  - - [960, 832, 1, 256, 960, 960, 960, 256]
    - [0, 11.76]
  - - [1088, 832, 1, 256, 1088, 1088, 1088, 256]
    - [2, 11.86]
  - - [1216, 832, 1, 256, 1216, 1216, 1216, 256]
    - [2, 12.039]
  - - [1344, 832, 1, 256, 1344, 1344, 1344, 256]
    - [2, 11.293]
  - - [1472, 832, 1, 256, 1472, 1472, 1472, 256]
    - [2, 11.619]
  - - [1600, 832, 1, 256, 1600, 1600, 1600, 256]
    - [0, 11.77]
  - - [1728, 832, 1, 256, 1728, 1728, 1728, 256]
    - [2, 11.855]
  - - [1856, 832, 1, 256, 1856, 1856, 1856, 256]
    - [2, 12.036]
  - - [1984, 832, 1, 256, 1984, 1984, 1984, 256]
    - [2, 12.019]
  - - [2112, 832, 1, 256, 2112, 2112, 2112, 256]
    - [2, 12.181]
  - - [2240, 832, 1, 256, 2240, 2240, 2240, 256]
    - [2, 12.144]
  - - [2368, 832, 1, 256, 2368, 2368, 2368, 256]
    - [2, 12.252]
  - - [2496, 832, 1, 256, 2496, 2496, 2496, 256]
    - [2, 12.272]
  - - [2624, 832, 1, 256, 2624, 2624, 2624, 256]
    - [2, 12.359]
  - - [2752, 832, 1, 256, 2752, 2752, 2752, 256]
    - [2, 12.422]
  - - [2880, 832, 1, 256, 2880, 2880, 2880, 256]
    - [2, 12.445]
  - - [3008, 832, 1, 256, 3008, 3008, 3008, 256]
    - [2, 12.512]
  - - [3136, 832, 1, 256, 3136, 3136, 3136, 256]
    - [2, 12.544]
  - - [3264, 832, 1, 256, 3264, 3264, 3264, 256]
    - [2, 12.611]
  - - [3392, 832, 1, 256, 3392, 3392, 3392, 256]
    - [2, 12.575]
  - - [3520, 832, 1, 256, 3520, 3520, 3520, 256]
    - [2, 12.609]
  - - [3648, 832, 1, 256, 3648, 3648, 3648, 256]
    - [2, 12.69]
  - - [3776, 832, 1, 256, 3776, 3776, 3776, 256]
    - [2, 12.716]
  - - [3904, 832, 1, 256, 3904, 3904, 3904, 256]
    - [2, 12.729]
  - - [4032, 832, 1, 256, 4032, 4032, 4032, 256]
    - [2, 12.728]
  - - [64, 960, 1, 256, 64, 64, 64, 256]
    - [0, 5.467]
  - - [192, 960, 1, 256, 192, 192, 192, 256]
    - [0, 8.912]
  - - [320, 960, 1, 256, 320, 320, 320, 256]
    - [0, 10.038]
  - - [448, 960, 1, 256, 448, 448, 448, 256]
    - [0, 10.768]
  - - [576, 960, 1, 256, 576, 576, 576, 256]
    - [0, 11.238]
  - - [704, 960, 1, 256, 704, 704, 704, 256]
    - [0, 11.53]
  - - [832, 960, 1, 256, 832, 832, 832, 256]
    - [0, 11.728]
  - - [960, 960, 1, 256, 960, 960, 960, 256]
    - [0, 11.918]
  - - [1088, 960, 1, 256, 1088, 1088, 1088, 256]
    - [0, 12.05]
  - - [1216, 960, 1, 256, 1216, 1216, 1216, 256]
    - [0, 11.582]
  - - [1344, 960, 1, 256, 1344, 1344, 1344, 256]
    - [0, 11.771]
  - - [1472, 960, 1, 256, 1472, 1472, 1472, 256]
    - [0, 11.852]
  - - [1600, 960, 1, 256, 1600, 1600, 1600, 256]
    - [2, 11.955]
  - - [1728, 960, 1, 256, 1728, 1728, 1728, 256]
    - [2, 12.082]
  - - [1856, 960, 1, 256, 1856, 1856, 1856, 256]
    - [2, 12.215]
  - - [1984, 960, 1, 256, 1984, 1984, 1984, 256]
    - [2, 12.293]
  - - [2112, 960, 1, 256, 2112, 2112, 2112, 256]
    - [2, 12.285]
  - - [2240, 960, 1, 256, 2240, 2240, 2240, 256]
    - [2, 12.386]
  - - [2368, 960, 1, 256, 2368, 2368, 2368, 256]
    - [2, 12.461]
  - - [2496, 960, 1, 256, 2496, 2496, 2496, 256]
    - [2, 12.454]
  - - [2624, 960, 1, 256, 2624, 2624, 2624, 256]
    - [2, 12.543]
  - - [2752, 960, 1, 256, 2752, 2752, 2752, 256]
    - [2, 12.533]
  - - [2880, 960, 1, 256, 2880, 2880, 2880, 256]
    - [2, 12.601]
  - - [3008, 960, 1, 256, 3008, 3008, 3008, 256]
    - [2, 12.642]
  - - [3136, 960, 1, 256, 3136, 3136, 3136, 256]
    - [2, 12.625]
  - - [3264, 960, 1, 256, 3264, 3264, 3264, 256]
    - [2, 12.693]
  - - [3392, 960, 1, 256, 3392, 3392, 3392, 256]
    - [2, 12.739]
  - - [3520, 960, 1, 256, 3520, 3520, 3520, 256]
    - [2, 12.706]
  - - [3648, 960, 1, 256, 3648, 3648, 3648, 256]
    - [2, 12.767]
  - - [3776, 960, 1, 256, 3776, 3776, 3776, 256]
    - [2, 12.794]
  - - [3904, 960, 1, 256, 3904, 3904, 3904, 256]
    - [2, 12.822]
  - - [4032, 960, 1, 256, 4032, 4032, 4032, 256]
    - [2, 12.83]
  - - [64, 1088, 1, 256, 64, 64, 64, 256]
    - [2, 5.252]
  - - [192, 1088, 1, 256, 192, 192, 192, 256]
    - [0, 9.07]
  - - [320, 1088, 1, 256, 320, 320, 320, 256]
    - [0, 10.074]
  - - [448, 1088, 1, 256, 448, 448, 448, 256]
    - [0, 10.96]
  - - [576, 1088, 1, 256, 576, 576, 576, 256]
    - [2, 11.422]
  - - [704, 1088, 1, 256, 704, 704, 704, 256]
    - [0, 11.685]
  - - [832, 1088, 1, 256, 832, 832, 832, 256]
    - [2, 11.84]
  - - [960, 1088, 1, 256, 960, 960, 960, 256]
    - [2, 12.142]
  - - [1088, 1088, 1, 256, 1088, 1088, 1088, 256]
    - [0, 11.594]
  - - [1216, 1088, 1, 256, 1216, 1216, 1216, 256]
    - [2, 11.771]
  - - [1344, 1088, 1, 256, 1344, 1344, 1344, 256]
    - [2, 11.868]
  - - [1472, 1088, 1, 256, 1472, 1472, 1472, 256]
    - [2, 12.025]
  - - [1600, 1088, 1, 256, 1600, 1600, 1600, 256]
    - [2, 12.111]
  - - [1728, 1088, 1, 256, 1728, 1728, 1728, 256]
    - [2, 12.178]
  - - [1856, 1088, 1, 256, 1856, 1856, 1856, 256]
    - [2, 12.389]
  - - [1984, 1088, 1, 256, 1984, 1984, 1984, 256]
    - [2, 12.451]
  - - [2112, 1088, 1, 256, 2112, 2112, 2112, 256]
    - [2, 12.468]
  - - [2240, 1088, 1, 256, 2240, 2240, 2240, 256]
    - [2, 12.504]
  - - [2368, 1088, 1, 256, 2368, 2368, 2368, 256]
    - [2, 12.528]
  - - [2496, 1088, 1, 256, 2496, 2496, 2496, 256]
    - [2, 12.588]
  - - [2624, 1088, 1, 256, 2624, 2624, 2624, 256]
    - [2, 12.637]
  - - [2752, 1088, 1, 256, 2752, 2752, 2752, 256]
    - [2, 12.621]
  - - [2880, 1088, 1, 256, 2880, 2880, 2880, 256]
    - [2, 12.692]
  - - [3008, 1088, 1, 256, 3008, 3008, 3008, 256]
    - [2, 12.744]
  - - [3136, 1088, 1, 256, 3136, 3136, 3136, 256]
    - [2, 12.743]
  - - [3264, 1088, 1, 256, 3264, 3264, 3264, 256]
    - [2, 12.773]
  - - [3392, 1088, 1, 256, 3392, 3392, 3392, 256]
    - [2, 12.818]
  - - [3520, 1088, 1, 256, 3520, 3520, 3520, 256]
    - [2, 12.857]
  - - [3648, 1088, 1, 256, 3648, 3648, 3648, 256]
    - [2, 12.83]
  - - [3776, 1088, 1, 256, 3776, 3776, 3776, 256]
    - [0, 12.823]
  - - [3904, 1088, 1, 256, 3904, 3904, 3904, 256]
    - [2, 12.851]
  - - [4032, 1088, 1, 256, 4032, 4032, 4032, 256]
    - [2, 12.935]
  - - [64, 1216, 1, 256, 64, 64, 64, 256]
    - [0, 5.727]
  - - [192, 1216, 1, 256, 192, 192, 192, 256]
    - [0, 9.222]
  - - [320, 1216, 1, 256, 320, 320, 320, 256]
    - [0, 10.466]
  - - [448, 1216, 1, 256, 448, 448, 448, 256]
    - [0, 11.146]
  - - [576, 1216, 1, 256, 576, 576, 576, 256]
    - [0, 11.554]
  - - [704, 1216, 1, 256, 704, 704, 704, 256]
    - [0, 11.812]
  - - [832, 1216, 1, 256, 832, 832, 832, 256]
    - [0, 12.024]
  - - [960, 1216, 1, 256, 960, 960, 960, 256]
    - [0, 11.645]
  - - [1088, 1216, 1, 256, 1088, 1088, 1088, 256]
    - [2, 11.86]
  - - [1216, 1216, 1, 256, 1216, 1216, 1216, 256]
    - [2, 11.964]
  - - [1344, 1216, 1, 256, 1344, 1344, 1344, 256]
    - [2, 12.081]
  - - [1472, 1216, 1, 256, 1472, 1472, 1472, 256]
    - [2, 12.199]
  - - [1600, 1216, 1, 256, 1600, 1600, 1600, 256]
    - [2, 12.318]
  - - [1728, 1216, 1, 256, 1728, 1728, 1728, 256]
    - [2, 12.372]
  - - [1856, 1216, 1, 256, 1856, 1856, 1856, 256]
    - [2, 12.416]
  - - [1984, 1216, 1, 256, 1984, 1984, 1984, 256]
    - [2, 12.489]
  - - [2112, 1216, 1, 256, 2112, 2112, 2112, 256]
    - [2, 12.507]
  - - [2240, 1216, 1, 256, 2240, 2240, 2240, 256]
    - [2, 12.562]
  - - [2368, 1216, 1, 256, 2368, 2368, 2368, 256]
    - [2, 12.602]
  - - [2496, 1216, 1, 256, 2496, 2496, 2496, 256]
    - [2, 12.71]
  - - [2624, 1216, 1, 256, 2624, 2624, 2624, 256]
    - [2, 12.673]
  - - [2752, 1216, 1, 256, 2752, 2752, 2752, 256]
    - [2, 12.74]
  - - [2880, 1216, 1, 256, 2880, 2880, 2880, 256]
    - [2, 12.778]
  - - [3008, 1216, 1, 256, 3008, 3008, 3008, 256]
    - [2, 12.745]
  - - [3136, 1216, 1, 256, 3136, 3136, 3136, 256]
    - [2, 12.846]
  - - [3264, 1216, 1, 256, 3264, 3264, 3264, 256]
    - [2, 12.856]
  - - [3392, 1216, 1, 256, 3392, 3392, 3392, 256]
    - [2, 12.874]
  - - [3520, 1216, 1, 256, 3520, 3520, 3520, 256]
    - [2, 12.942]
  - - [3648, 1216, 1, 256, 3648, 3648, 3648, 256]
    - [2, 12.897]
  - - [3776, 1216, 1, 256, 3776, 3776, 3776, 256]
    - [2, 12.948]
  - - [3904, 1216, 1, 256, 3904, 3904, 3904, 256]
    - [2, 12.925]
  - - [4032, 1216, 1, 256, 4032, 4032, 4032, 256]
    - [2, 12.956]
  - - [64, 1344, 1, 256, 64, 64, 64, 256]
    - [0, 6.314]
  - - [192, 1344, 1, 256, 192, 192, 192, 256]
    - [0, 9.351]
  - - [320, 1344, 1, 256, 320, 320, 320, 256]
    - [0, 10.785]
  - - [448, 1344, 1, 256, 448, 448, 448, 256]
    - [2, 11.249]
  - - [576, 1344, 1, 256, 576, 576, 576, 256]
    - [2, 11.677]
  - - [704, 1344, 1, 256, 704, 704, 704, 256]
    - [0, 11.941]
  - - [832, 1344, 1, 256, 832, 832, 832, 256]
    - [2, 11.46]
  - - [960, 1344, 1, 256, 960, 960, 960, 256]
    - [2, 11.792]
  - - [1088, 1344, 1, 256, 1088, 1088, 1088, 256]
    - [2, 11.893]
  - - [1216, 1344, 1, 256, 1216, 1216, 1216, 256]
    - [0, 12.071]
  - - [1344, 1344, 1, 256, 1344, 1344, 1344, 256]
    - [2, 12.193]
  - - [1472, 1344, 1, 256, 1472, 1472, 1472, 256]
    - [2, 12.302]
  - - [1600, 1344, 1, 256, 1600, 1600, 1600, 256]
    - [2, 12.392]
  - - [1728, 1344, 1, 256, 1728, 1728, 1728, 256]
    - [2, 12.454]
  - - [1856, 1344, 1, 256, 1856, 1856, 1856, 256]
    - [2, 12.523]
  - - [1984, 1344, 1, 256, 1984, 1984, 1984, 256]
    - [2, 12.586]
  - - [2112, 1344, 1, 256, 2112, 2112, 2112, 256]
    - [2, 12.583]
  - - [2240, 1344, 1, 256, 2240, 2240, 2240, 256]
    - [2, 12.698]
  - - [2368, 1344, 1, 256, 2368, 2368, 2368, 256]
    - [2, 12.743]
  - - [2496, 1344, 1, 256, 2496, 2496, 2496, 256]
    - [2, 12.688]
  - - [2624, 1344, 1, 256, 2624, 2624, 2624, 256]
    - [2, 12.791]
  - - [2752, 1344, 1, 256, 2752, 2752, 2752, 256]
    - [2, 12.829]
  - - [2880, 1344, 1, 256, 2880, 2880, 2880, 256]
    - [2, 12.835]
  - - [3008, 1344, 1, 256, 3008, 3008, 3008, 256]
    - [2, 12.886]
  - - [3136, 1344, 1, 256, 3136, 3136, 3136, 256]
    - [2, 12.852]
  - - [3264, 1344, 1, 256, 3264, 3264, 3264, 256]
    - [2, 12.912]
  - - [3392, 1344, 1, 256, 3392, 3392, 3392, 256]
    - [2, 12.928]
  - - [3520, 1344, 1, 256, 3520, 3520, 3520, 256]
    - [2, 12.92]
  - - [3648, 1344, 1, 256, 3648, 3648, 3648, 256]
    - [2, 12.999]
  - - [3776, 1344, 1, 256, 3776, 3776, 3776, 256]
    - [2, 12.987]
  - - [3904, 1344, 1, 256, 3904, 3904, 3904, 256]
    - [2, 12.995]
  - - [4032, 1344, 1, 256, 4032, 4032, 4032, 256]
    - [2, 12.992]
  - - [64, 1472, 1, 256, 64, 64, 64, 256]
    - [0, 6.012]
  - - [192, 1472, 1, 256, 192, 192, 192, 256]
    - [2, 9.61]
  - - [320, 1472, 1, 256, 320, 320, 320, 256]
    - [2, 10.718]
  - - [448, 1472, 1, 256, 448, 448, 448, 256]
    - [2, 11.369]
  - - [576, 1472, 1, 256, 576, 576, 576, 256]
    - [2, 11.823]
  - - [704, 1472, 1, 256, 704, 704, 704, 256]
    - [0, 12.036]
  - - [832, 1472, 1, 256, 832, 832, 832, 256]
    - [2, 11.65]
  - - [960, 1472, 1, 256, 960, 960, 960, 256]
    - [0, 11.846]
  - - [1088, 1472, 1, 256, 1088, 1088, 1088, 256]
    - [2, 12.048]
  - - [1216, 1472, 1, 256, 1216, 1216, 1216, 256]
    - [2, 12.107]
  - - [1344, 1472, 1, 256, 1344, 1344, 1344, 256]
    - [2, 12.328]
  - - [1472, 1472, 1, 256, 1472, 1472, 1472, 256]
    - [2, 12.425]
  - - [1600, 1472, 1, 256, 1600, 1600, 1600, 256]
    - [2, 12.485]
  - - [1728, 1472, 1, 256, 1728, 1728, 1728, 256]
    - [2, 12.508]
  - - [1856, 1472, 1, 256, 1856, 1856, 1856, 256]
    - [2, 12.628]
  - - [1984, 1472, 1, 256, 1984, 1984, 1984, 256]
    - [2, 12.63]
  - - [2112, 1472, 1, 256, 2112, 2112, 2112, 256]
    - [2, 12.702]
  - - [2240, 1472, 1, 256, 2240, 2240, 2240, 256]
    - [2, 12.721]
  - - [2368, 1472, 1, 256, 2368, 2368, 2368, 256]
    - [2, 12.78]
  - - [2496, 1472, 1, 256, 2496, 2496, 2496, 256]
    - [2, 12.836]
  - - [2624, 1472, 1, 256, 2624, 2624, 2624, 256]
    - [2, 12.848]
  - - [2752, 1472, 1, 256, 2752, 2752, 2752, 256]
    - [2, 12.848]
  - - [2880, 1472, 1, 256, 2880, 2880, 2880, 256]
    - [2, 12.911]
  - - [3008, 1472, 1, 256, 3008, 3008, 3008, 256]
    - [2, 12.941]
  - - [3136, 1472, 1, 256, 3136, 3136, 3136, 256]
    - [2, 12.946]
  - - [3264, 1472, 1, 256, 3264, 3264, 3264, 256]
    - [2, 12.958]
  - - [3392, 1472, 1, 256, 3392, 3392, 3392, 256]
    - [2, 12.945]
  - - [3520, 1472, 1, 256, 3520, 3520, 3520, 256]
    - [2, 13.003]
  - - [3648, 1472, 1, 256, 3648, 3648, 3648, 256]
    - [2, 12.985]
  - - [3776, 1472, 1, 256, 3776, 3776, 3776, 256]
    - [2, 13.064]
  - - [3904, 1472, 1, 256, 3904, 3904, 3904, 256]
    - [2, 13.038]
  - - [4032, 1472, 1, 256, 4032, 4032, 4032, 256]
    - [2, 13.052]
  - - [64, 1600, 1, 256, 64, 64, 64, 256]
    - [0, 6.462]
  - - [192, 1600, 1, 256, 192, 192, 192, 256]
    - [0, 10.009]
  - - [320, 1600, 1, 256, 320, 320, 320, 256]
    - [0, 11.026]
  - - [448, 1600, 1, 256, 448, 448, 448, 256]
    - [2, 11.485]
  - - [576, 1600, 1, 256, 576, 576, 576, 256]
    - [0, 11.953]
  - - [704, 1600, 1, 256, 704, 704, 704, 256]
    - [2, 11.374]
  - - [832, 1600, 1, 256, 832, 832, 832, 256]
    - [2, 11.856]
  - - [960, 1600, 1, 256, 960, 960, 960, 256]
    - [2, 12.032]
  - - [1088, 1600, 1, 256, 1088, 1088, 1088, 256]
    - [2, 12.163]
  - - [1216, 1600, 1, 256, 1216, 1216, 1216, 256]
    - [2, 12.274]
  - - [1344, 1600, 1, 256, 1344, 1344, 1344, 256]
    - [2, 12.377]
  - - [1472, 1600, 1, 256, 1472, 1472, 1472, 256]
    - [2, 12.5]
  - - [1600, 1600, 1, 256, 1600, 1600, 1600, 256]
    - [2, 12.577]
  - - [1728, 1600, 1, 256, 1728, 1728, 1728, 256]
    - [2, 12.571]
  - - [1856, 1600, 1, 256, 1856, 1856, 1856, 256]
    - [2, 12.724]
  - - [1984, 1600, 1, 256, 1984, 1984, 1984, 256]
    - [2, 12.723]
  - - [2112, 1600, 1, 256, 2112, 2112, 2112, 256]
    - [2, 12.709]
  - - [2240, 1600, 1, 256, 2240, 2240, 2240, 256]
    - [2, 12.779]
  - - [2368, 1600, 1, 256, 2368, 2368, 2368, 256]
    - [2, 12.861]
  - - [2496, 1600, 1, 256, 2496, 2496, 2496, 256]
    - [2, 12.877]
  - - [2624, 1600, 1, 256, 2624, 2624, 2624, 256]
    - [2, 12.911]
  - - [2752, 1600, 1, 256, 2752, 2752, 2752, 256]
    - [2, 12.868]
  - - [2880, 1600, 1, 256, 2880, 2880, 2880, 256]
    - [2, 12.898]
  - - [3008, 1600, 1, 256, 3008, 3008, 3008, 256]
    - [2, 12.976]
  - - [3136, 1600, 1, 256, 3136, 3136, 3136, 256]
    - [2, 12.968]
  - - [3264, 1600, 1, 256, 3264, 3264, 3264, 256]
    - [2, 13.002]
  - - [3392, 1600, 1, 256, 3392, 3392, 3392, 256]
    - [2, 13.02]
  - - [3520, 1600, 1, 256, 3520, 3520, 3520, 256]
    - [2, 13.011]
  - - [3648, 1600, 1, 256, 3648, 3648, 3648, 256]
    - [2, 13.048]
  - - [3776, 1600, 1, 256, 3776, 3776, 3776, 256]
    - [2, 13.078]
  - - [3904, 1600, 1, 256, 3904, 3904, 3904, 256]
    - [2, 13.095]
  - - [4032, 1600, 1, 256, 4032, 4032, 4032, 256]
    - [2, 13.09]
  - - [64, 1728, 1, 256, 64, 64, 64, 256]
    - [0, 6.965]
  - - [192, 1728, 1, 256, 192, 192, 192, 256]
    - [0, 10.256]
  - - [320, 1728, 1, 256, 320, 320, 320, 256]
    - [0, 11.179]
  - - [448, 1728, 1, 256, 448, 448, 448, 256]
    - [2, 11.67]
  - - [576, 1728, 1, 256, 576, 576, 576, 256]
    - [2, 11.939]
  - - [704, 1728, 1, 256, 704, 704, 704, 256]
    - [2, 11.634]
  - - [832, 1728, 1, 256, 832, 832, 832, 256]
    - [2, 11.951]
  - - [960, 1728, 1, 256, 960, 960, 960, 256]
    - [2, 12.126]
  - - [1088, 1728, 1, 256, 1088, 1088, 1088, 256]
    - [2, 12.206]
  - - [1216, 1728, 1, 256, 1216, 1216, 1216, 256]
    - [0, 12.327]
  - - [1344, 1728, 1, 256, 1344, 1344, 1344, 256]
    - [2, 12.424]
  - - [1472, 1728, 1, 256, 1472, 1472, 1472, 256]
    - [2, 12.543]
  - - [1600, 1728, 1, 256, 1600, 1600, 1600, 256]
    - [2, 12.634]
  - - [1728, 1728, 1, 256, 1728, 1728, 1728, 256]
    - [2, 12.634]
  - - [1856, 1728, 1, 256, 1856, 1856, 1856, 256]
    - [2, 12.737]
  - - [1984, 1728, 1, 256, 1984, 1984, 1984, 256]
    - [2, 12.804]
  - - [2112, 1728, 1, 256, 2112, 2112, 2112, 256]
    - [2, 12.782]
  - - [2240, 1728, 1, 256, 2240, 2240, 2240, 256]
    - [2, 12.843]
  - - [2368, 1728, 1, 256, 2368, 2368, 2368, 256]
    - [2, 12.922]
  - - [2496, 1728, 1, 256, 2496, 2496, 2496, 256]
    - [2, 12.923]
  - - [2624, 1728, 1, 256, 2624, 2624, 2624, 256]
    - [2, 12.923]
  - - [2752, 1728, 1, 256, 2752, 2752, 2752, 256]
    - [2, 12.982]
  - - [2880, 1728, 1, 256, 2880, 2880, 2880, 256]
    - [2, 12.971]
  - - [3008, 1728, 1, 256, 3008, 3008, 3008, 256]
    - [2, 13.05]
  - - [3136, 1728, 1, 256, 3136, 3136, 3136, 256]
    - [2, 13.049]
  - - [3264, 1728, 1, 256, 3264, 3264, 3264, 256]
    - [2, 13.016]
  - - [3392, 1728, 1, 256, 3392, 3392, 3392, 256]
    - [2, 13.015]
  - - [3520, 1728, 1, 256, 3520, 3520, 3520, 256]
    - [2, 13.077]
  - - [3648, 1728, 1, 256, 3648, 3648, 3648, 256]
    - [2, 13.071]
  - - [3776, 1728, 1, 256, 3776, 3776, 3776, 256]
    - [2, 13.099]
  - - [3904, 1728, 1, 256, 3904, 3904, 3904, 256]
    - [2, 13.137]
  - - [4032, 1728, 1, 256, 4032, 4032, 4032, 256]
    - [2, 13.109]
  - - [64, 1856, 1, 256, 64, 64, 64, 256]
    - [0, 7.463]
  - - [192, 1856, 1, 256, 192, 192, 192, 256]
    - [0, 10.272]
  - - [320, 1856, 1, 256, 320, 320, 320, 256]
    - [2, 11.147]
  - - [448, 1856, 1, 256, 448, 448, 448, 256]
    - [0, 11.826]
  - - [576, 1856, 1, 256, 576, 576, 576, 256]
    - [0, 12.052]
  - - [704, 1856, 1, 256, 704, 704, 704, 256]
    - [2, 11.754]
  - - [832, 1856, 1, 256, 832, 832, 832, 256]
    - [2, 11.966]
  - - [960, 1856, 1, 256, 960, 960, 960, 256]
    - [2, 12.196]
  - - [1088, 1856, 1, 256, 1088, 1088, 1088, 256]
    - [2, 12.306]
  - - [1216, 1856, 1, 256, 1216, 1216, 1216, 256]
    - [2, 12.457]
  - - [1344, 1856, 1, 256, 1344, 1344, 1344, 256]
    - [2, 12.483]
  - - [1472, 1856, 1, 256, 1472, 1472, 1472, 256]
    - [2, 12.592]
  - - [1600, 1856, 1, 256, 1600, 1600, 1600, 256]
    - [2, 12.604]
  - - [1728, 1856, 1, 256, 1728, 1728, 1728, 256]
    - [2, 12.723]
  - - [1856, 1856, 1, 256, 1856, 1856, 1856, 256]
    - [2, 12.782]
  - - [1984, 1856, 1, 256, 1984, 1984, 1984, 256]
    - [2, 12.798]
  - - [2112, 1856, 1, 256, 2112, 2112, 2112, 256]
    - [2, 12.851]
  - - [2240, 1856, 1, 256, 2240, 2240, 2240, 256]
    - [2, 12.925]
  - - [2368, 1856, 1, 256, 2368, 2368, 2368, 256]
    - [2, 12.906]
  - - [2496, 1856, 1, 256, 2496, 2496, 2496, 256]
    - [2, 12.946]
  - - [2624, 1856, 1, 256, 2624, 2624, 2624, 256]
    - [2, 12.983]
  - - [2752, 1856, 1, 256, 2752, 2752, 2752, 256]
    - [2, 12.964]
  - - [2880, 1856, 1, 256, 2880, 2880, 2880, 256]
    - [2, 12.997]
  - - [3008, 1856, 1, 256, 3008, 3008, 3008, 256]
    - [2, 13.008]
  - - [3136, 1856, 1, 256, 3136, 3136, 3136, 256]
    - [2, 13.085]
  - - [3264, 1856, 1, 256, 3264, 3264, 3264, 256]
    - [2, 13.05]
  - - [3392, 1856, 1, 256, 3392, 3392, 3392, 256]
    - [2, 13.076]
  - - [3520, 1856, 1, 256, 3520, 3520, 3520, 256]
    - [2, 13.085]
  - - [3648, 1856, 1, 256, 3648, 3648, 3648, 256]
    - [2, 13.081]
  - - [3776, 1856, 1, 256, 3776, 3776, 3776, 256]
    - [2, 13.128]
  - - [3904, 1856, 1, 256, 3904, 3904, 3904, 256]
    - [2, 13.12]
  - - [4032, 1856, 1, 256, 4032, 4032, 4032, 256]
    - [2, 13.145]
  - - [64, 1984, 1, 256, 64, 64, 64, 256]
    - [0, 7.016]
  - - [192, 1984, 1, 256, 192, 192, 192, 256]
    - [0, 10.286]
  - - [320, 1984, 1, 256, 320, 320, 320, 256]
    - [2, 11.413]
  - - [448, 1984, 1, 256, 448, 448, 448, 256]
    - [0, 11.912]
  - - [576, 1984, 1, 256, 576, 576, 576, 256]
    - [0, 11.485]
  - - [704, 1984, 1, 256, 704, 704, 704, 256]
    - [2, 11.843]
  - - [832, 1984, 1, 256, 832, 832, 832, 256]
    - [2, 12.143]
  - - [960, 1984, 1, 256, 960, 960, 960, 256]
    - [2, 12.25]
  - - [1088, 1984, 1, 256, 1088, 1088, 1088, 256]
    - [2, 12.324]
  - - [1216, 1984, 1, 256, 1216, 1216, 1216, 256]
    - [2, 12.5]
  - - [1344, 1984, 1, 256, 1344, 1344, 1344, 256]
    - [2, 12.587]
  - - [1472, 1984, 1, 256, 1472, 1472, 1472, 256]
    - [2, 12.582]
  - - [1600, 1984, 1, 256, 1600, 1600, 1600, 256]
    - [2, 12.693]
  - - [1728, 1984, 1, 256, 1728, 1728, 1728, 256]
    - [2, 12.744]
  - - [1856, 1984, 1, 256, 1856, 1856, 1856, 256]
    - [2, 12.868]
  - - [1984, 1984, 1, 256, 1984, 1984, 1984, 256]
    - [2, 12.864]
  - - [2112, 1984, 1, 256, 2112, 2112, 2112, 256]
    - [2, 12.902]
  - - [2240, 1984, 1, 256, 2240, 2240, 2240, 256]
    - [2, 12.914]
  - - [2368, 1984, 1, 256, 2368, 2368, 2368, 256]
    - [2, 12.962]
  - - [2496, 1984, 1, 256, 2496, 2496, 2496, 256]
    - [2, 12.952]
  - - [2624, 1984, 1, 256, 2624, 2624, 2624, 256]
    - [2, 12.982]
  - - [2752, 1984, 1, 256, 2752, 2752, 2752, 256]
    - [2, 13.024]
  - - [2880, 1984, 1, 256, 2880, 2880, 2880, 256]
    - [2, 13.004]
  - - [3008, 1984, 1, 256, 3008, 3008, 3008, 256]
    - [2, 13.03]
  - - [3136, 1984, 1, 256, 3136, 3136, 3136, 256]
    - [2, 13.097]
  - - [3264, 1984, 1, 256, 3264, 3264, 3264, 256]
    - [2, 13.105]
  - - [3392, 1984, 1, 256, 3392, 3392, 3392, 256]
    - [2, 13.102]
  - - [3520, 1984, 1, 256, 3520, 3520, 3520, 256]
    - [2, 13.119]
  - - [3648, 1984, 1, 256, 3648, 3648, 3648, 256]
    - [2, 13.157]
  - - [3776, 1984, 1, 256, 3776, 3776, 3776, 256]
    - [2, 13.151]
  - - [3904, 1984, 1, 256, 3904, 3904, 3904, 256]
    - [2, 13.182]
  - - [4032, 1984, 1, 256, 4032, 4032, 4032, 256]
    - [2, 13.169]
  - - [64, 2112, 1, 256, 64, 64, 64, 256]
    - [0, 7.384]
  - - [192, 2112, 1, 256, 192, 192, 192, 256]
    - [2, 10.453]
  - - [320, 2112, 1, 256, 320, 320, 320, 256]
    - [0, 11.473]
  - - [448, 2112, 1, 256, 448, 448, 448, 256]
    - [2, 11.91]
  - - [576, 2112, 1, 256, 576, 576, 576, 256]
    - [2, 11.657]
  - - [704, 2112, 1, 256, 704, 704, 704, 256]
    - [2, 12.057]
  - - [832, 2112, 1, 256, 832, 832, 832, 256]
    - [2, 12.166]
  - - [960, 2112, 1, 256, 960, 960, 960, 256]
    - [2, 12.278]
  - - [1088, 2112, 1, 256, 1088, 1088, 1088, 256]
    - [2, 12.447]
  - - [1216, 2112, 1, 256, 1216, 1216, 1216, 256]
    - [2, 12.547]
  - - [1344, 2112, 1, 256, 1344, 1344, 1344, 256]
    - [2, 12.63]
  - - [1472, 2112, 1, 256, 1472, 1472, 1472, 256]
    - [2, 12.696]
  - - [1600, 2112, 1, 256, 1600, 1600, 1600, 256]
    - [2, 12.78]
  - - [1728, 2112, 1, 256, 1728, 1728, 1728, 256]
    - [2, 12.777]
  - - [1856, 2112, 1, 256, 1856, 1856, 1856, 256]
    - [2, 12.871]
  - - [1984, 2112, 1, 256, 1984, 1984, 1984, 256]
    - [2, 12.917]
  - - [2112, 2112, 1, 256, 2112, 2112, 2112, 256]
    - [2, 12.957]
  - - [2240, 2112, 1, 256, 2240, 2240, 2240, 256]
    - [2, 12.915]
  - - [2368, 2112, 1, 256, 2368, 2368, 2368, 256]
    - [2, 12.972]
  - - [2496, 2112, 1, 256, 2496, 2496, 2496, 256]
    - [2, 12.978]
  - - [2624, 2112, 1, 256, 2624, 2624, 2624, 256]
    - [2, 13.033]
  - - [2752, 2112, 1, 256, 2752, 2752, 2752, 256]
    - [2, 13.049]
  - - [2880, 2112, 1, 256, 2880, 2880, 2880, 256]
    - [2, 13.079]
  - - [3008, 2112, 1, 256, 3008, 3008, 3008, 256]
    - [2, 13.084]
  - - [3136, 2112, 1, 256, 3136, 3136, 3136, 256]
    - [2, 13.089]
  - - [3264, 2112, 1, 256, 3264, 3264, 3264, 256]
    - [2, 13.109]
  - - [3392, 2112, 1, 256, 3392, 3392, 3392, 256]
    - [2, 13.149]
  - - [3520, 2112, 1, 256, 3520, 3520, 3520, 256]
    - [2, 13.139]
  - - [3648, 2112, 1, 256, 3648, 3648, 3648, 256]
    - [2, 13.168]
  - - [3776, 2112, 1, 256, 3776, 3776, 3776, 256]
    - [2, 13.145]
  - - [3904, 2112, 1, 256, 3904, 3904, 3904, 256]
    - [2, 13.177]
  - - [4032, 2112, 1, 256, 4032, 4032, 4032, 256]
    - [2, 13.194]
  - - [64, 2240, 1, 256, 64, 64, 64, 256]
    - [0, 7.782]
  - - [192, 2240, 1, 256, 192, 192, 192, 256]
    - [0, 10.678]
  - - [320, 2240, 1, 256, 320, 320, 320, 256]
    - [2, 11.581]
  - - [448, 2240, 1, 256, 448, 448, 448, 256]
    - [2, 12.149]
  - - [576, 2240, 1, 256, 576, 576, 576, 256]
    - [2, 11.726]
  - - [704, 2240, 1, 256, 704, 704, 704, 256]
    - [2, 12.072]
  - - [832, 2240, 1, 256, 832, 832, 832, 256]
    - [2, 12.23]
  - - [960, 2240, 1, 256, 960, 960, 960, 256]
    - [2, 12.372]
  - - [1088, 2240, 1, 256, 1088, 1088, 1088, 256]
    - [2, 12.523]
  - - [1216, 2240, 1, 256, 1216, 1216, 1216, 256]
    - [2, 12.574]
  - - [1344, 2240, 1, 256, 1344, 1344, 1344, 256]
    - [2, 12.624]
  - - [1472, 2240, 1, 256, 1472, 1472, 1472, 256]
    - [2, 12.738]
  - - [1600, 2240, 1, 256, 1600, 1600, 1600, 256]
    - [2, 12.795]
  - - [1728, 2240, 1, 256, 1728, 1728, 1728, 256]
    - [2, 12.848]
  - - [1856, 2240, 1, 256, 1856, 1856, 1856, 256]
    - [2, 12.89]
  - - [1984, 2240, 1, 256, 1984, 1984, 1984, 256]
    - [2, 12.931]
  - - [2112, 2240, 1, 256, 2112, 2112, 2112, 256]
    - [2, 12.937]
  - - [2240, 2240, 1, 256, 2240, 2240, 2240, 256]
    - [2, 12.999]
  - - [2368, 2240, 1, 256, 2368, 2368, 2368, 256]
    - [2, 12.989]
  - - [2496, 2240, 1, 256, 2496, 2496, 2496, 256]
    - [2, 13.058]
  - - [2624, 2240, 1, 256, 2624, 2624, 2624, 256]
    - [2, 13.044]
  - - [2752, 2240, 1, 256, 2752, 2752, 2752, 256]
    - [2, 13.085]
  - - [2880, 2240, 1, 256, 2880, 2880, 2880, 256]
    - [2, 13.089]
  - - [3008, 2240, 1, 256, 3008, 3008, 3008, 256]
    - [2, 13.098]
  - - [3136, 2240, 1, 256, 3136, 3136, 3136, 256]
    - [2, 13.113]
  - - [3264, 2240, 1, 256, 3264, 3264, 3264, 256]
    - [2, 13.155]
  - - [3392, 2240, 1, 256, 3392, 3392, 3392, 256]
    - [2, 13.148]
  - - [3520, 2240, 1, 256, 3520, 3520, 3520, 256]
    - [2, 13.139]
  - - [3648, 2240, 1, 256, 3648, 3648, 3648, 256]
    - [2, 13.136]
  - - [3776, 2240, 1, 256, 3776, 3776, 3776, 256]
    - [2, 13.148]
  - - [3904, 2240, 1, 256, 3904, 3904, 3904, 256]
    - [2, 12.962]
  - - [4032, 2240, 1, 256, 4032, 4032, 4032, 256]
    - [2, 12.996]
  - - [64, 2368, 1, 256, 64, 64, 64, 256]
    - [0, 8.197]
  - - [192, 2368, 1, 256, 192, 192, 192, 256]
    - [0, 10.845]
  - - [320, 2368, 1, 256, 320, 320, 320, 256]
    - [0, 11.628]
  - - [448, 2368, 1, 256, 448, 448, 448, 256]
    - [0, 12.022]
  - - [576, 2368, 1, 256, 576, 576, 576, 256]
    - [2, 11.796]
  - - [704, 2368, 1, 256, 704, 704, 704, 256]
    - [2, 12.08]
  - - [832, 2368, 1, 256, 832, 832, 832, 256]
    - [2, 12.27]
  - - [960, 2368, 1, 256, 960, 960, 960, 256]
    - [2, 12.436]
  - - [1088, 2368, 1, 256, 1088, 1088, 1088, 256]
    - [2, 12.551]
  - - [1216, 2368, 1, 256, 1216, 1216, 1216, 256]
    - [2, 12.628]
  - - [1344, 2368, 1, 256, 1344, 1344, 1344, 256]
    - [2, 12.725]
  - - [1472, 2368, 1, 256, 1472, 1472, 1472, 256]
    - [2, 12.758]
  - - [1600, 2368, 1, 256, 1600, 1600, 1600, 256]
    - [2, 12.828]
  - - [1728, 2368, 1, 256, 1728, 1728, 1728, 256]
    - [2, 12.888]
  - - [1856, 2368, 1, 256, 1856, 1856, 1856, 256]
    - [2, 12.923]
  - - [1984, 2368, 1, 256, 1984, 1984, 1984, 256]
    - [2, 12.939]
  - - [2112, 2368, 1, 256, 2112, 2112, 2112, 256]
    - [2, 12.98]
  - - [2240, 2368, 1, 256, 2240, 2240, 2240, 256]
    - [2, 12.984]
  - - [2368, 2368, 1, 256, 2368, 2368, 2368, 256]
    - [2, 13.038]
  - - [2496, 2368, 1, 256, 2496, 2496, 2496, 256]
    - [2, 13.061]
  - - [2624, 2368, 1, 256, 2624, 2624, 2624, 256]
    - [2, 13.041]
  - - [2752, 2368, 1, 256, 2752, 2752, 2752, 256]
    - [2, 13.085]
  - - [2880, 2368, 1, 256, 2880, 2880, 2880, 256]
    - [2, 13.091]
  - - [3008, 2368, 1, 256, 3008, 3008, 3008, 256]
    - [2, 13.125]
  - - [3136, 2368, 1, 256, 3136, 3136, 3136, 256]
    - [2, 13.16]
  - - [3264, 2368, 1, 256, 3264, 3264, 3264, 256]
    - [2, 13.144]
  - - [3392, 2368, 1, 256, 3392, 3392, 3392, 256]
    - [2, 13.144]
  - - [3520, 2368, 1, 256, 3520, 3520, 3520, 256]
    - [2, 13.186]
  - - [3648, 2368, 1, 256, 3648, 3648, 3648, 256]
    - [2, 13.001]
  - - [3776, 2368, 1, 256, 3776, 3776, 3776, 256]
    - [2, 12.985]
  - - [3904, 2368, 1, 256, 3904, 3904, 3904, 256]
    - [2, 12.999]
  - - [4032, 2368, 1, 256, 4032, 4032, 4032, 256]
    - [2, 13.009]
  - - [64, 2496, 1, 256, 64, 64, 64, 256]
    - [2, 7.894]
  - - [192, 2496, 1, 256, 192, 192, 192, 256]
    - [0, 10.836]
  - - [320, 2496, 1, 256, 320, 320, 320, 256]
    - [0, 11.731]
  - - [448, 2496, 1, 256, 448, 448, 448, 256]
    - [2, 11.426]
  - - [576, 2496, 1, 256, 576, 576, 576, 256]
    - [2, 11.881]
  - - [704, 2496, 1, 256, 704, 704, 704, 256]
    - [2, 12.146]
  - - [832, 2496, 1, 256, 832, 832, 832, 256]
    - [2, 12.272]
  - - [960, 2496, 1, 256, 960, 960, 960, 256]
    - [2, 12.487]
  - - [1088, 2496, 1, 256, 1088, 1088, 1088, 256]
    - [2, 12.556]
  - - [1216, 2496, 1, 256, 1216, 1216, 1216, 256]
    - [2, 12.661]
  - - [1344, 2496, 1, 256, 1344, 1344, 1344, 256]
    - [2, 12.713]
  - - [1472, 2496, 1, 256, 1472, 1472, 1472, 256]
    - [2, 12.771]
  - - [1600, 2496, 1, 256, 1600, 1600, 1600, 256]
    - [2, 12.874]
  - - [1728, 2496, 1, 256, 1728, 1728, 1728, 256]
    - [2, 12.894]
  - - [1856, 2496, 1, 256, 1856, 1856, 1856, 256]
    - [2, 12.945]
  - - [1984, 2496, 1, 256, 1984, 1984, 1984, 256]
    - [2, 12.942]
  - - [2112, 2496, 1, 256, 2112, 2112, 2112, 256]
    - [2, 12.992]
  - - [2240, 2496, 1, 256, 2240, 2240, 2240, 256]
    - [2, 13.013]
  - - [2368, 2496, 1, 256, 2368, 2368, 2368, 256]
    - [2, 13.05]
  - - [2496, 2496, 1, 256, 2496, 2496, 2496, 256]
    - [2, 13.083]
  - - [2624, 2496, 1, 256, 2624, 2624, 2624, 256]
    - [2, 13.062]
  - - [2752, 2496, 1, 256, 2752, 2752, 2752, 256]
    - [2, 13.133]
  - - [2880, 2496, 1, 256, 2880, 2880, 2880, 256]
    - [2, 13.122]
  - - [3008, 2496, 1, 256, 3008, 3008, 3008, 256]
    - [2, 13.143]
  - - [3136, 2496, 1, 256, 3136, 3136, 3136, 256]
    - [2, 13.168]
  - - [3264, 2496, 1, 256, 3264, 3264, 3264, 256]
    - [2, 13.159]
  - - [3392, 2496, 1, 256, 3392, 3392, 3392, 256]
    - [2, 13.161]
  - - [3520, 2496, 1, 256, 3520, 3520, 3520, 256]
    - [2, 12.97]
  - - [3648, 2496, 1, 256, 3648, 3648, 3648, 256]
    - [2, 12.967]
  - - [3776, 2496, 1, 256, 3776, 3776, 3776, 256]
    - [2, 12.99]
  - - [3904, 2496, 1, 256, 3904, 3904, 3904, 256]
    - [2, 13.013]
  - - [4032, 2496, 1, 256, 4032, 4032, 4032, 256]
    - [2, 13.064]
  - - [64, 2624, 1, 256, 64, 64, 64, 256]
    - [0, 8.1]
  - - [192, 2624, 1, 256, 192, 192, 192, 256]
    - [2, 10.912]
  - - [320, 2624, 1, 256, 320, 320, 320, 256]
    - [2, 11.787]
  - - [448, 2624, 1, 256, 448, 448, 448, 256]
    - [0, 11.691]
  - - [576, 2624, 1, 256, 576, 576, 576, 256]
    - [0, 11.946]
  - - [704, 2624, 1, 256, 704, 704, 704, 256]
    - [0, 12.19]
  - - [832, 2624, 1, 256, 832, 832, 832, 256]
    - [2, 12.39]
  - - [960, 2624, 1, 256, 960, 960, 960, 256]
    - [2, 12.476]
  - - [1088, 2624, 1, 256, 1088, 1088, 1088, 256]
    - [2, 12.662]
  - - [1216, 2624, 1, 256, 1216, 1216, 1216, 256]
    - [2, 12.739]
  - - [1344, 2624, 1, 256, 1344, 1344, 1344, 256]
    - [2, 12.758]
  - - [1472, 2624, 1, 256, 1472, 1472, 1472, 256]
    - [2, 12.811]
  - - [1600, 2624, 1, 256, 1600, 1600, 1600, 256]
    - [2, 12.882]
  - - [1728, 2624, 1, 256, 1728, 1728, 1728, 256]
    - [2, 12.947]
  - - [1856, 2624, 1, 256, 1856, 1856, 1856, 256]
    - [2, 12.995]
  - - [1984, 2624, 1, 256, 1984, 1984, 1984, 256]
    - [2, 12.994]
  - - [2112, 2624, 1, 256, 2112, 2112, 2112, 256]
    - [2, 13.0]
  - - [2240, 2624, 1, 256, 2240, 2240, 2240, 256]
    - [2, 13.053]
  - - [2368, 2624, 1, 256, 2368, 2368, 2368, 256]
    - [2, 13.065]
  - - [2496, 2624, 1, 256, 2496, 2496, 2496, 256]
    - [2, 13.143]
  - - [2624, 2624, 1, 256, 2624, 2624, 2624, 256]
    - [2, 13.09]
  - - [2752, 2624, 1, 256, 2752, 2752, 2752, 256]
    - [2, 13.096]
  - - [2880, 2624, 1, 256, 2880, 2880, 2880, 256]
    - [2, 13.159]
  - - [3008, 2624, 1, 256, 3008, 3008, 3008, 256]
    - [2, 13.143]
  - - [3136, 2624, 1, 256, 3136, 3136, 3136, 256]
    - [2, 13.154]
  - - [3264, 2624, 1, 256, 3264, 3264, 3264, 256]
    - [2, 13.117]
  - - [3392, 2624, 1, 256, 3392, 3392, 3392, 256]
    - [2, 12.967]
  - - [3520, 2624, 1, 256, 3520, 3520, 3520, 256]
    - [2, 13.013]
  - - [3648, 2624, 1, 256, 3648, 3648, 3648, 256]
    - [2, 13.018]
  - - [3776, 2624, 1, 256, 3776, 3776, 3776, 256]
    - [2, 13.016]
  - - [3904, 2624, 1, 256, 3904, 3904, 3904, 256]
    - [2, 13.049]
  - - [4032, 2624, 1, 256, 4032, 4032, 4032, 256]
    - [2, 13.05]
  - - [64, 2752, 1, 256, 64, 64, 64, 256]
    - [0, 8.438]
  - - [192, 2752, 1, 256, 192, 192, 192, 256]
    - [0, 10.868]
  - - [320, 2752, 1, 256, 320, 320, 320, 256]
    - [0, 11.792]
  - - [448, 2752, 1, 256, 448, 448, 448, 256]
    - [0, 11.629]
  - - [576, 2752, 1, 256, 576, 576, 576, 256]
    - [2, 11.961]
  - - [704, 2752, 1, 256, 704, 704, 704, 256]
    - [2, 12.271]
  - - [832, 2752, 1, 256, 832, 832, 832, 256]
    - [2, 12.426]
  - - [960, 2752, 1, 256, 960, 960, 960, 256]
    - [2, 12.619]
  - - [1088, 2752, 1, 256, 1088, 1088, 1088, 256]
    - [2, 12.721]
  - - [1216, 2752, 1, 256, 1216, 1216, 1216, 256]
    - [2, 12.706]
  - - [1344, 2752, 1, 256, 1344, 1344, 1344, 256]
    - [2, 12.819]
  - - [1472, 2752, 1, 256, 1472, 1472, 1472, 256]
    - [2, 12.893]
  - - [1600, 2752, 1, 256, 1600, 1600, 1600, 256]
    - [2, 12.898]
  - - [1728, 2752, 1, 256, 1728, 1728, 1728, 256]
    - [2, 12.944]
  - - [1856, 2752, 1, 256, 1856, 1856, 1856, 256]
    - [2, 12.96]
  - - [1984, 2752, 1, 256, 1984, 1984, 1984, 256]
    - [2, 13.013]
  - - [2112, 2752, 1, 256, 2112, 2112, 2112, 256]
    - [2, 13.025]
  - - [2240, 2752, 1, 256, 2240, 2240, 2240, 256]
    - [2, 13.064]
  - - [2368, 2752, 1, 256, 2368, 2368, 2368, 256]
    - [2, 13.076]
  - - [2496, 2752, 1, 256, 2496, 2496, 2496, 256]
    - [2, 13.134]
  - - [2624, 2752, 1, 256, 2624, 2624, 2624, 256]
    - [2, 13.147]
  - - [2752, 2752, 1, 256, 2752, 2752, 2752, 256]
    - [2, 13.148]
  - - [2880, 2752, 1, 256, 2880, 2880, 2880, 256]
    - [2, 13.152]
  - - [3008, 2752, 1, 256, 3008, 3008, 3008, 256]
    - [2, 13.188]
  - - [3136, 2752, 1, 256, 3136, 3136, 3136, 256]
    - [2, 12.979]
  - - [3264, 2752, 1, 256, 3264, 3264, 3264, 256]
    - [2, 12.981]
  - - [3392, 2752, 1, 256, 3392, 3392, 3392, 256]
    - [2, 13.009]
  - - [3520, 2752, 1, 256, 3520, 3520, 3520, 256]
    - [2, 13.027]
  - - [3648, 2752, 1, 256, 3648, 3648, 3648, 256]
    - [2, 13.05]
  - - [3776, 2752, 1, 256, 3776, 3776, 3776, 256]
    - [2, 13.044]
  - - [3904, 2752, 1, 256, 3904, 3904, 3904, 256]
    - [2, 13.081]
  - - [4032, 2752, 1, 256, 4032, 4032, 4032, 256]
    - [2, 13.069]
  - - [64, 2880, 1, 256, 64, 64, 64, 256]
    - [0, 8.856]
  - - [192, 2880, 1, 256, 192, 192, 192, 256]
    - [0, 11.183]
  - - [320, 2880, 1, 256, 320, 320, 320, 256]
    - [2, 11.937]
  - - [448, 2880, 1, 256, 448, 448, 448, 256]
    - [2, 11.729]
  - - [576, 2880, 1, 256, 576, 576, 576, 256]
    - [2, 12.101]
  - - [704, 2880, 1, 256, 704, 704, 704, 256]
    - [2, 12.31]
  - - [832, 2880, 1, 256, 832, 832, 832, 256]
    - [2, 12.501]
  - - [960, 2880, 1, 256, 960, 960, 960, 256]
    - [2, 12.575]
  - - [1088, 2880, 1, 256, 1088, 1088, 1088, 256]
    - [2, 12.69]
  - - [1216, 2880, 1, 256, 1216, 1216, 1216, 256]
    - [2, 12.796]
  - - [1344, 2880, 1, 256, 1344, 1344, 1344, 256]
    - [2, 12.83]
  - - [1472, 2880, 1, 256, 1472, 1472, 1472, 256]
    - [2, 12.875]
  - - [1600, 2880, 1, 256, 1600, 1600, 1600, 256]
    - [2, 12.931]
  - - [1728, 2880, 1, 256, 1728, 1728, 1728, 256]
    - [2, 12.991]
  - - [1856, 2880, 1, 256, 1856, 1856, 1856, 256]
    - [2, 13.006]
  - - [1984, 2880, 1, 256, 1984, 1984, 1984, 256]
    - [2, 13.046]
  - - [2112, 2880, 1, 256, 2112, 2112, 2112, 256]
    - [2, 13.057]
  - - [2240, 2880, 1, 256, 2240, 2240, 2240, 256]
    - [2, 13.145]
  - - [2368, 2880, 1, 256, 2368, 2368, 2368, 256]
    - [2, 13.118]
  - - [2496, 2880, 1, 256, 2496, 2496, 2496, 256]
    - [2, 13.115]
  - - [2624, 2880, 1, 256, 2624, 2624, 2624, 256]
    - [2, 13.163]
  - - [2752, 2880, 1, 256, 2752, 2752, 2752, 256]
    - [2, 13.151]
  - - [2880, 2880, 1, 256, 2880, 2880, 2880, 256]
    - [2, 13.169]
  - - [3008, 2880, 1, 256, 3008, 3008, 3008, 256]
    - [2, 12.951]
  - - [3136, 2880, 1, 256, 3136, 3136, 3136, 256]
    - [2, 12.992]
  - - [3264, 2880, 1, 256, 3264, 3264, 3264, 256]
    - [2, 12.998]
  - - [3392, 2880, 1, 256, 3392, 3392, 3392, 256]
    - [2, 13.017]
  - - [3520, 2880, 1, 256, 3520, 3520, 3520, 256]
    - [2, 13.051]
  - - [3648, 2880, 1, 256, 3648, 3648, 3648, 256]
    - [2, 13.072]
  - - [3776, 2880, 1, 256, 3776, 3776, 3776, 256]
    - [2, 13.056]
  - - [3904, 2880, 1, 256, 3904, 3904, 3904, 256]
    - [2, 13.096]
  - - [4032, 2880, 1, 256, 4032, 4032, 4032, 256]
    - [2, 13.088]
  - - [64, 3008, 1, 256, 64, 64, 64, 256]
    - [2, 8.64]
  - - [192, 3008, 1, 256, 192, 192, 192, 256]
    - [0, 11.233]
  - - [320, 3008, 1, 256, 320, 320, 320, 256]
    - [2, 12.005]
  - - [448, 3008, 1, 256, 448, 448, 448, 256]
    - [2, 11.87]
  - - [576, 3008, 1, 256, 576, 576, 576, 256]
    - [2, 12.164]
  - - [704, 3008, 1, 256, 704, 704, 704, 256]
    - [2, 12.34]
  - - [832, 3008, 1, 256, 832, 832, 832, 256]
    - [2, 12.55]
  - - [960, 3008, 1, 256, 960, 960, 960, 256]
    - [2, 12.624]
  - - [1088, 3008, 1, 256, 1088, 1088, 1088, 256]
    - [2, 12.677]
  - - [1216, 3008, 1, 256, 1216, 1216, 1216, 256]
    - [2, 12.828]
  - - [1344, 3008, 1, 256, 1344, 1344, 1344, 256]
    - [2, 12.855]
  - - [1472, 3008, 1, 256, 1472, 1472, 1472, 256]
    - [2, 12.914]
  - - [1600, 3008, 1, 256, 1600, 1600, 1600, 256]
    - [2, 12.931]
  - - [1728, 3008, 1, 256, 1728, 1728, 1728, 256]
    - [2, 12.975]
  - - [1856, 3008, 1, 256, 1856, 1856, 1856, 256]
    - [2, 13.01]
  - - [1984, 3008, 1, 256, 1984, 1984, 1984, 256]
    - [2, 13.044]
  - - [2112, 3008, 1, 256, 2112, 2112, 2112, 256]
    - [2, 13.07]
  - - [2240, 3008, 1, 256, 2240, 2240, 2240, 256]
    - [2, 13.099]
  - - [2368, 3008, 1, 256, 2368, 2368, 2368, 256]
    - [2, 13.126]
  - - [2496, 3008, 1, 256, 2496, 2496, 2496, 256]
    - [2, 13.149]
  - - [2624, 3008, 1, 256, 2624, 2624, 2624, 256]
    - [2, 13.168]
  - - [2752, 3008, 1, 256, 2752, 2752, 2752, 256]
    - [2, 13.135]
  - - [2880, 3008, 1, 256, 2880, 2880, 2880, 256]
    - [2, 12.993]
  - - [3008, 3008, 1, 256, 3008, 3008, 3008, 256]
    - [2, 12.98]
  - - [3136, 3008, 1, 256, 3136, 3136, 3136, 256]
    - [2, 12.988]
  - - [3264, 3008, 1, 256, 3264, 3264, 3264, 256]
    - [2, 13.032]
  - - [3392, 3008, 1, 256, 3392, 3392, 3392, 256]
    - [2, 13.059]
  - - [3520, 3008, 1, 256, 3520, 3520, 3520, 256]
    - [2, 13.061]
  - - [3648, 3008, 1, 256, 3648, 3648, 3648, 256]
    - [2, 13.068]
  - - [3776, 3008, 1, 256, 3776, 3776, 3776, 256]
    - [2, 13.093]
  - - [3904, 3008, 1, 256, 3904, 3904, 3904, 256]
    - [2, 13.067]
  - - [4032, 3008, 1, 256, 4032, 4032, 4032, 256]
    - [2, 13.091]
  - - [64, 3136, 1, 256, 64, 64, 64, 256]
    - [2, 8.742]
  - - [192, 3136, 1, 256, 192, 192, 192, 256]
    - [2, 11.352]
  - - [320, 3136, 1, 256, 320, 320, 320, 256]
    - [2, 12.108]
  - - [448, 3136, 1, 256, 448, 448, 448, 256]
    - [2, 11.921]
  - - [576, 3136, 1, 256, 576, 576, 576, 256]
    - [2, 12.191]
  - - [704, 3136, 1, 256, 704, 704, 704, 256]
    - [2, 12.347]
  - - [832, 3136, 1, 256, 832, 832, 832, 256]
    - [2, 12.561]
  - - [960, 3136, 1, 256, 960, 960, 960, 256]
    - [2, 12.637]
  - - [1088, 3136, 1, 256, 1088, 1088, 1088, 256]
    - [2, 12.79]
  - - [1216, 3136, 1, 256, 1216, 1216, 1216, 256]
    - [2, 12.855]
  - - [1344, 3136, 1, 256, 1344, 1344, 1344, 256]
    - [2, 12.883]
  - - [1472, 3136, 1, 256, 1472, 1472, 1472, 256]
    - [2, 12.918]
  - - [1600, 3136, 1, 256, 1600, 1600, 1600, 256]
    - [2, 13.007]
  - - [1728, 3136, 1, 256, 1728, 1728, 1728, 256]
    - [2, 13.024]
  - - [1856, 3136, 1, 256, 1856, 1856, 1856, 256]
    - [2, 13.071]
  - - [1984, 3136, 1, 256, 1984, 1984, 1984, 256]
    - [2, 13.077]
  - - [2112, 3136, 1, 256, 2112, 2112, 2112, 256]
    - [2, 13.117]
  - - [2240, 3136, 1, 256, 2240, 2240, 2240, 256]
    - [2, 13.161]
  - - [2368, 3136, 1, 256, 2368, 2368, 2368, 256]
    - [2, 13.17]
  - - [2496, 3136, 1, 256, 2496, 2496, 2496, 256]
    - [2, 13.161]
  - - [2624, 3136, 1, 256, 2624, 2624, 2624, 256]
    - [2, 13.147]
  - - [2752, 3136, 1, 256, 2752, 2752, 2752, 256]
    - [2, 12.974]
  - - [2880, 3136, 1, 256, 2880, 2880, 2880, 256]
    - [2, 13.015]
  - - [3008, 3136, 1, 256, 3008, 3008, 3008, 256]
    - [2, 13.024]
  - - [3136, 3136, 1, 256, 3136, 3136, 3136, 256]
    - [2, 13.035]
  - - [3264, 3136, 1, 256, 3264, 3264, 3264, 256]
    - [2, 13.032]
  - - [3392, 3136, 1, 256, 3392, 3392, 3392, 256]
    - [2, 13.082]
  - - [3520, 3136, 1, 256, 3520, 3520, 3520, 256]
    - [2, 13.079]
  - - [3648, 3136, 1, 256, 3648, 3648, 3648, 256]
    - [2, 13.113]
  - - [3776, 3136, 1, 256, 3776, 3776, 3776, 256]
    - [2, 13.093]
  - - [3904, 3136, 1, 256, 3904, 3904, 3904, 256]
    - [2, 13.111]
  - - [4032, 3136, 1, 256, 4032, 4032, 4032, 256]
    - [2, 13.133]
  - - [64, 3264, 1, 256, 64, 64, 64, 256]
    - [0, 9.057]
  - - [192, 3264, 1, 256, 192, 192, 192, 256]
    - [0, 11.26]
  - - [320, 3264, 1, 256, 320, 320, 320, 256]
    - [0, 12.074]
  - - [448, 3264, 1, 256, 448, 448, 448, 256]
    - [2, 11.84]
  - - [576, 3264, 1, 256, 576, 576, 576, 256]
    - [2, 12.273]
  - - [704, 3264, 1, 256, 704, 704, 704, 256]
    - [2, 12.449]
  - - [832, 3264, 1, 256, 832, 832, 832, 256]
    - [2, 12.572]
  - - [960, 3264, 1, 256, 960, 960, 960, 256]
    - [2, 12.7]
  - - [1088, 3264, 1, 256, 1088, 1088, 1088, 256]
    - [2, 12.767]
  - - [1216, 3264, 1, 256, 1216, 1216, 1216, 256]
    - [2, 12.906]
  - - [1344, 3264, 1, 256, 1344, 1344, 1344, 256]
    - [2, 12.901]
  - - [1472, 3264, 1, 256, 1472, 1472, 1472, 256]
    - [2, 12.941]
  - - [1600, 3264, 1, 256, 1600, 1600, 1600, 256]
    - [2, 12.978]
  - - [1728, 3264, 1, 256, 1728, 1728, 1728, 256]
    - [2, 13.038]
  - - [1856, 3264, 1, 256, 1856, 1856, 1856, 256]
    - [2, 13.065]
  - - [1984, 3264, 1, 256, 1984, 1984, 1984, 256]
    - [2, 13.065]
  - - [2112, 3264, 1, 256, 2112, 2112, 2112, 256]
    - [2, 13.114]
  - - [2240, 3264, 1, 256, 2240, 2240, 2240, 256]
    - [2, 13.108]
  - - [2368, 3264, 1, 256, 2368, 2368, 2368, 256]
    - [2, 13.161]
  - - [2496, 3264, 1, 256, 2496, 2496, 2496, 256]
    - [2, 13.156]
  - - [2624, 3264, 1, 256, 2624, 2624, 2624, 256]
    - [2, 13.101]
  - - [2752, 3264, 1, 256, 2752, 2752, 2752, 256]
    - [2, 12.991]
  - - [2880, 3264, 1, 256, 2880, 2880, 2880, 256]
    - [2, 13.006]
  - - [3008, 3264, 1, 256, 3008, 3008, 3008, 256]
    - [2, 13.012]
  - - [3136, 3264, 1, 256, 3136, 3136, 3136, 256]
    - [2, 13.049]
  - - [3264, 3264, 1, 256, 3264, 3264, 3264, 256]
    - [2, 13.064]
  - - [3392, 3264, 1, 256, 3392, 3392, 3392, 256]
    - [2, 13.077]
  - - [3520, 3264, 1, 256, 3520, 3520, 3520, 256]
    - [2, 13.092]
  - - [3648, 3264, 1, 256, 3648, 3648, 3648, 256]
    - [2, 13.099]
  - - [3776, 3264, 1, 256, 3776, 3776, 3776, 256]
    - [2, 13.117]
  - - [3904, 3264, 1, 256, 3904, 3904, 3904, 256]
    - [2, 13.13]
  - - [4032, 3264, 1, 256, 4032, 4032, 4032, 256]
    - [2, 13.119]
  - - [64, 3392, 1, 256, 64, 64, 64, 256]
    - [2, 8.917]
  - - [192, 3392, 1, 256, 192, 192, 192, 256]
    - [2, 11.371]
  - - [320, 3392, 1, 256, 320, 320, 320, 256]
    - [2, 11.389]
  - - [448, 3392, 1, 256, 448, 448, 448, 256]
    - [2, 11.956]
  - - [576, 3392, 1, 256, 576, 576, 576, 256]
    - [2, 12.366]
  - - [704, 3392, 1, 256, 704, 704, 704, 256]
    - [2, 12.473]
  - - [832, 3392, 1, 256, 832, 832, 832, 256]
    - [2, 12.663]
  - - [960, 3392, 1, 256, 960, 960, 960, 256]
    - [2, 12.771]
  - - [1088, 3392, 1, 256, 1088, 1088, 1088, 256]
    - [2, 12.851]
  - - [1216, 3392, 1, 256, 1216, 1216, 1216, 256]
    - [2, 12.89]
  - - [1344, 3392, 1, 256, 1344, 1344, 1344, 256]
    - [2, 12.944]
  - - [1472, 3392, 1, 256, 1472, 1472, 1472, 256]
    - [2, 13.005]
  - - [1600, 3392, 1, 256, 1600, 1600, 1600, 256]
    - [2, 13.053]
  - - [1728, 3392, 1, 256, 1728, 1728, 1728, 256]
    - [2, 13.062]
  - - [1856, 3392, 1, 256, 1856, 1856, 1856, 256]
    - [2, 13.066]
  - - [1984, 3392, 1, 256, 1984, 1984, 1984, 256]
    - [2, 13.125]
  - - [2112, 3392, 1, 256, 2112, 2112, 2112, 256]
    - [2, 13.106]
  - - [2240, 3392, 1, 256, 2240, 2240, 2240, 256]
    - [2, 13.14]
  - - [2368, 3392, 1, 256, 2368, 2368, 2368, 256]
    - [2, 13.175]
  - - [2496, 3392, 1, 256, 2496, 2496, 2496, 256]
    - [2, 13.175]
  - - [2624, 3392, 1, 256, 2624, 2624, 2624, 256]
    - [2, 12.981]
  - - [2752, 3392, 1, 256, 2752, 2752, 2752, 256]
    - [2, 13.012]
  - - [2880, 3392, 1, 256, 2880, 2880, 2880, 256]
    - [2, 13.055]
  - - [3008, 3392, 1, 256, 3008, 3008, 3008, 256]
    - [2, 13.036]
  - - [3136, 3392, 1, 256, 3136, 3136, 3136, 256]
    - [2, 13.063]
  - - [3264, 3392, 1, 256, 3264, 3264, 3264, 256]
    - [2, 13.07]
  - - [3392, 3392, 1, 256, 3392, 3392, 3392, 256]
    - [2, 13.09]
  - - [3520, 3392, 1, 256, 3520, 3520, 3520, 256]
    - [2, 13.101]
  - - [3648, 3392, 1, 256, 3648, 3648, 3648, 256]
    - [2, 13.116]
  - - [3776, 3392, 1, 256, 3776, 3776, 3776, 256]
    - [2, 13.137]
  - - [3904, 3392, 1, 256, 3904, 3904, 3904, 256]
    - [2, 13.151]
  - - [4032, 3392, 1, 256, 4032, 4032, 4032, 256]
    - [2, 13.169]
  - - [64, 3520, 1, 256, 64, 64, 64, 256]
    - [0, 8.84]
  - - [192, 3520, 1, 256, 192, 192, 192, 256]
    - [0, 11.544]
  - - [320, 3520, 1, 256, 320, 320, 320, 256]
    - [2, 11.463]
  - - [448, 3520, 1, 256, 448, 448, 448, 256]
    - [2, 11.982]
  - - [576, 3520, 1, 256, 576, 576, 576, 256]
    - [2, 12.357]
  - - [704, 3520, 1, 256, 704, 704, 704, 256]
    - [2, 12.529]
  - - [832, 3520, 1, 256, 832, 832, 832, 256]
    - [2, 12.682]
  - - [960, 3520, 1, 256, 960, 960, 960, 256]
    - [2, 12.716]
  - - [1088, 3520, 1, 256, 1088, 1088, 1088, 256]
    - [2, 12.849]
  - - [1216, 3520, 1, 256, 1216, 1216, 1216, 256]
    - [2, 12.875]
  - - [1344, 3520, 1, 256, 1344, 1344, 1344, 256]
    - [2, 12.995]
  - - [1472, 3520, 1, 256, 1472, 1472, 1472, 256]
    - [2, 13.026]
  - - [1600, 3520, 1, 256, 1600, 1600, 1600, 256]
    - [2, 13.043]
  - - [1728, 3520, 1, 256, 1728, 1728, 1728, 256]
    - [2, 13.089]
  - - [1856, 3520, 1, 256, 1856, 1856, 1856, 256]
    - [2, 13.102]
  - - [1984, 3520, 1, 256, 1984, 1984, 1984, 256]
    - [2, 13.108]
  - - [2112, 3520, 1, 256, 2112, 2112, 2112, 256]
    - [2, 13.176]
  - - [2240, 3520, 1, 256, 2240, 2240, 2240, 256]
    - [2, 13.171]
  - - [2368, 3520, 1, 256, 2368, 2368, 2368, 256]
    - [2, 13.153]
  - - [2496, 3520, 1, 256, 2496, 2496, 2496, 256]
    - [2, 12.979]
  - - [2624, 3520, 1, 256, 2624, 2624, 2624, 256]
    - [2, 12.997]
  - - [2752, 3520, 1, 256, 2752, 2752, 2752, 256]
    - [2, 13.024]
  - - [2880, 3520, 1, 256, 2880, 2880, 2880, 256]
    - [2, 13.052]
  - - [3008, 3520, 1, 256, 3008, 3008, 3008, 256]
    - [2, 13.056]
  - - [3136, 3520, 1, 256, 3136, 3136, 3136, 256]
    - [2, 13.096]
  - - [3264, 3520, 1, 256, 3264, 3264, 3264, 256]
    - [2, 13.12]
  - - [3392, 3520, 1, 256, 3392, 3392, 3392, 256]
    - [2, 13.093]
  - - [3520, 3520, 1, 256, 3520, 3520, 3520, 256]
    - [2, 13.123]
  - - [3648, 3520, 1, 256, 3648, 3648, 3648, 256]
    - [2, 13.137]
  - - [3776, 3520, 1, 256, 3776, 3776, 3776, 256]
    - [2, 13.152]
  - - [3904, 3520, 1, 256, 3904, 3904, 3904, 256]
    - [2, 13.166]
  - - [4032, 3520, 1, 256, 4032, 4032, 4032, 256]
    - [2, 13.154]
  - - [64, 3648, 1, 256, 64, 64, 64, 256]
    - [0, 9.171]
  - - [192, 3648, 1, 256, 192, 192, 192, 256]
    - [0, 11.531]
  - - [320, 3648, 1, 256, 320, 320, 320, 256]
    - [0, 11.654]
  - - [448, 3648, 1, 256, 448, 448, 448, 256]
    - [2, 12.051]
  - - [576, 3648, 1, 256, 576, 576, 576, 256]
    - [2, 12.325]
  - - [704, 3648, 1, 256, 704, 704, 704, 256]
    - [2, 12.523]
  - - [832, 3648, 1, 256, 832, 832, 832, 256]
    - [2, 12.673]
  - - [960, 3648, 1, 256, 960, 960, 960, 256]
    - [2, 12.775]
  - - [1088, 3648, 1, 256, 1088, 1088, 1088, 256]
    - [2, 12.832]
  - - [1216, 3648, 1, 256, 1216, 1216, 1216, 256]
    - [2, 12.915]
  - - [1344, 3648, 1, 256, 1344, 1344, 1344, 256]
    - [2, 12.953]
  - - [1472, 3648, 1, 256, 1472, 1472, 1472, 256]
    - [2, 13.05]
  - - [1600, 3648, 1, 256, 1600, 1600, 1600, 256]
    - [2, 13.084]
  - - [1728, 3648, 1, 256, 1728, 1728, 1728, 256]
    - [2, 13.087]
  - - [1856, 3648, 1, 256, 1856, 1856, 1856, 256]
    - [2, 13.087]
  - - [1984, 3648, 1, 256, 1984, 1984, 1984, 256]
    - [2, 13.134]
  - - [2112, 3648, 1, 256, 2112, 2112, 2112, 256]
    - [2, 13.161]
  - - [2240, 3648, 1, 256, 2240, 2240, 2240, 256]
    - [2, 13.155]
  - - [2368, 3648, 1, 256, 2368, 2368, 2368, 256]
    - [2, 12.969]
  - - [2496, 3648, 1, 256, 2496, 2496, 2496, 256]
    - [2, 13.024]
  - - [2624, 3648, 1, 256, 2624, 2624, 2624, 256]
    - [2, 13.014]
  - - [2752, 3648, 1, 256, 2752, 2752, 2752, 256]
    - [2, 13.037]
  - - [2880, 3648, 1, 256, 2880, 2880, 2880, 256]
    - [2, 13.062]
  - - [3008, 3648, 1, 256, 3008, 3008, 3008, 256]
    - [2, 13.083]
  - - [3136, 3648, 1, 256, 3136, 3136, 3136, 256]
    - [2, 13.087]
  - - [3264, 3648, 1, 256, 3264, 3264, 3264, 256]
    - [2, 13.113]
  - - [3392, 3648, 1, 256, 3392, 3392, 3392, 256]
    - [2, 13.108]
  - - [3520, 3648, 1, 256, 3520, 3520, 3520, 256]
    - [2, 13.15]
  - - [3648, 3648, 1, 256, 3648, 3648, 3648, 256]
    - [2, 13.128]
  - - [3776, 3648, 1, 256, 3776, 3776, 3776, 256]
    - [2, 13.149]
  - - [3904, 3648, 1, 256, 3904, 3904, 3904, 256]
    - [2, 13.174]
  - - [4032, 3648, 1, 256, 4032, 4032, 4032, 256]
    - [2, 13.174]
  - - [64, 3776, 1, 256, 64, 64, 64, 256]
    - [0, 9.487]
  - - [192, 3776, 1, 256, 192, 192, 192, 256]
    - [0, 11.565]
  - - [320, 3776, 1, 256, 320, 320, 320, 256]
    - [2, 11.778]
  - - [448, 3776, 1, 256, 448, 448, 448, 256]
    - [2, 12.105]
  - - [576, 3776, 1, 256, 576, 576, 576, 256]
    - [2, 12.407]
  - - [704, 3776, 1, 256, 704, 704, 704, 256]
    - [2, 12.635]
  - - [832, 3776, 1, 256, 832, 832, 832, 256]
    - [2, 12.717]
  - - [960, 3776, 1, 256, 960, 960, 960, 256]
    - [2, 12.79]
  - - [1088, 3776, 1, 256, 1088, 1088, 1088, 256]
    - [2, 12.852]
  - - [1216, 3776, 1, 256, 1216, 1216, 1216, 256]
    - [2, 12.93]
  - - [1344, 3776, 1, 256, 1344, 1344, 1344, 256]
    - [2, 12.99]
  - - [1472, 3776, 1, 256, 1472, 1472, 1472, 256]
    - [2, 12.98]
  - - [1600, 3776, 1, 256, 1600, 1600, 1600, 256]
    - [2, 13.065]
  - - [1728, 3776, 1, 256, 1728, 1728, 1728, 256]
    - [2, 13.086]
  - - [1856, 3776, 1, 256, 1856, 1856, 1856, 256]
    - [2, 13.142]
  - - [1984, 3776, 1, 256, 1984, 1984, 1984, 256]
    - [2, 13.159]
  - - [2112, 3776, 1, 256, 2112, 2112, 2112, 256]
    - [2, 13.166]
  - - [2240, 3776, 1, 256, 2240, 2240, 2240, 256]
    - [2, 13.171]
  - - [2368, 3776, 1, 256, 2368, 2368, 2368, 256]
    - [2, 13.0]
  - - [2496, 3776, 1, 256, 2496, 2496, 2496, 256]
    - [2, 13.018]
  - - [2624, 3776, 1, 256, 2624, 2624, 2624, 256]
    - [2, 13.043]
  - - [2752, 3776, 1, 256, 2752, 2752, 2752, 256]
    - [2, 13.051]
  - - [2880, 3776, 1, 256, 2880, 2880, 2880, 256]
    - [2, 13.073]
  - - [3008, 3776, 1, 256, 3008, 3008, 3008, 256]
    - [2, 13.089]
  - - [3136, 3776, 1, 256, 3136, 3136, 3136, 256]
    - [2, 13.103]
  - - [3264, 3776, 1, 256, 3264, 3264, 3264, 256]
    - [2, 13.133]
  - - [3392, 3776, 1, 256, 3392, 3392, 3392, 256]
    - [2, 13.142]
  - - [3520, 3776, 1, 256, 3520, 3520, 3520, 256]
    - [2, 13.149]
  - - [3648, 3776, 1, 256, 3648, 3648, 3648, 256]
    - [2, 13.165]
  - - [3776, 3776, 1, 256, 3776, 3776, 3776, 256]
    - [2, 13.155]
  - - [3904, 3776, 1, 256, 3904, 3904, 3904, 256]
    - [2, 13.188]
  - - [4032, 3776, 1, 256, 4032, 4032, 4032, 256]
    - [2, 13.189]
  - - [64, 3904, 1, 256, 64, 64, 64, 256]
    - [2, 9.174]
  - - [192, 3904, 1, 256, 192, 192, 192, 256]
    - [2, 11.671]
  - - [320, 3904, 1, 256, 320, 320, 320, 256]
    - [2, 11.687]
  - - [448, 3904, 1, 256, 448, 448, 448, 256]
    - [2, 12.241]
  - - [576, 3904, 1, 256, 576, 576, 576, 256]
    - [2, 12.391]
  - - [704, 3904, 1, 256, 704, 704, 704, 256]
    - [2, 12.646]
  - - [832, 3904, 1, 256, 832, 832, 832, 256]
    - [2, 12.751]
  - - [960, 3904, 1, 256, 960, 960, 960, 256]
    - [2, 12.85]
  - - [1088, 3904, 1, 256, 1088, 1088, 1088, 256]
    - [2, 12.893]
  - - [1216, 3904, 1, 256, 1216, 1216, 1216, 256]
    - [2, 12.959]
  - - [1344, 3904, 1, 256, 1344, 1344, 1344, 256]
    - [2, 13.014]
  - - [1472, 3904, 1, 256, 1472, 1472, 1472, 256]
    - [2, 13.068]
  - - [1600, 3904, 1, 256, 1600, 1600, 1600, 256]
    - [2, 13.08]
  - - [1728, 3904, 1, 256, 1728, 1728, 1728, 256]
    - [2, 13.131]
  - - [1856, 3904, 1, 256, 1856, 1856, 1856, 256]
    - [2, 13.135]
  - - [1984, 3904, 1, 256, 1984, 1984, 1984, 256]
    - [2, 13.159]
  - - [2112, 3904, 1, 256, 2112, 2112, 2112, 256]
    - [2, 13.185]
  - - [2240, 3904, 1, 256, 2240, 2240, 2240, 256]
    - [2, 12.965]
  - - [2368, 3904, 1, 256, 2368, 2368, 2368, 256]
    - [2, 13.041]
  - - [2496, 3904, 1, 256, 2496, 2496, 2496, 256]
    - [2, 13.001]
  - - [2624, 3904, 1, 256, 2624, 2624, 2624, 256]
    - [2, 13.034]
  - - [2752, 3904, 1, 256, 2752, 2752, 2752, 256]
    - [2, 13.081]
  - - [2880, 3904, 1, 256, 2880, 2880, 2880, 256]
    - [2, 13.087]
  - - [3008, 3904, 1, 256, 3008, 3008, 3008, 256]
    - [2, 13.109]
  - - [3136, 3904, 1, 256, 3136, 3136, 3136, 256]
    - [2, 13.127]
  - - [3264, 3904, 1, 256, 3264, 3264, 3264, 256]
    - [2, 13.127]
  - - [3392, 3904, 1, 256, 3392, 3392, 3392, 256]
    - [2, 13.157]
  - - [3520, 3904, 1, 256, 3520, 3520, 3520, 256]
    - [2, 13.151]
  - - [3648, 3904, 1, 256, 3648, 3648, 3648, 256]
    - [2, 13.152]
  - - [3776, 3904, 1, 256, 3776, 3776, 3776, 256]
    - [2, 13.168]
  - - [3904, 3904, 1, 256, 3904, 3904, 3904, 256]
    - [2, 13.19]
  - - [4032, 3904, 1, 256, 4032, 4032, 4032, 256]
    - [2, 13.196]
  - - [64, 4032, 1, 256, 64, 64, 64, 256]
    - [0, 9.448]
  - - [192, 4032, 1, 256, 192, 192, 192, 256]
    - [2, 11.704]
  - - [320, 4032, 1, 256, 320, 320, 320, 256]
    - [2, 11.759]
  - - [448, 4032, 1, 256, 448, 448, 448, 256]
    - [2, 12.176]
  - - [576, 4032, 1, 256, 576, 576, 576, 256]
    - [2, 12.499]
  - - [704, 4032, 1, 256, 704, 704, 704, 256]
    - [2, 12.6]
  - - [832, 4032, 1, 256, 832, 832, 832, 256]
    - [2, 12.776]
  - - [960, 4032, 1, 256, 960, 960, 960, 256]
    - [2, 12.849]
  - - [1088, 4032, 1, 256, 1088, 1088, 1088, 256]
    - [2, 12.933]
  - - [1216, 4032, 1, 256, 1216, 1216, 1216, 256]
    - [2, 12.942]
  - - [1344, 4032, 1, 256, 1344, 1344, 1344, 256]
    - [2, 13.007]
  - - [1472, 4032, 1, 256, 1472, 1472, 1472, 256]
    - [2, 13.044]
  - - [1600, 4032, 1, 256, 1600, 1600, 1600, 256]
    - [2, 13.073]
  - - [1728, 4032, 1, 256, 1728, 1728, 1728, 256]
    - [2, 13.101]
  - - [1856, 4032, 1, 256, 1856, 1856, 1856, 256]
    - [2, 13.157]
  - - [1984, 4032, 1, 256, 1984, 1984, 1984, 256]
    - [2, 13.162]
  - - [2112, 4032, 1, 256, 2112, 2112, 2112, 256]
    - [2, 13.16]
  - - [2240, 4032, 1, 256, 2240, 2240, 2240, 256]
    - [2, 12.986]
  - - [2368, 4032, 1, 256, 2368, 2368, 2368, 256]
    - [2, 13.021]
  - - [2496, 4032, 1, 256, 2496, 2496, 2496, 256]
    - [2, 13.034]
  - - [2624, 4032, 1, 256, 2624, 2624, 2624, 256]
    - [2, 13.084]
  - - [2752, 4032, 1, 256, 2752, 2752, 2752, 256]
    - [2, 13.09]
  - - [2880, 4032, 1, 256, 2880, 2880, 2880, 256]
    - [2, 13.096]
  - - [3008, 4032, 1, 256, 3008, 3008, 3008, 256]
    - [2, 13.107]
  - - [3136, 4032, 1, 256, 3136, 3136, 3136, 256]
    - [2, 13.115]
  - - [3264, 4032, 1, 256, 3264, 3264, 3264, 256]
    - [2, 13.115]
  - - [3392, 4032, 1, 256, 3392, 3392, 3392, 256]
    - [2, 13.135]
  - - [3520, 4032, 1, 256, 3520, 3520, 3520, 256]
    - [2, 13.17]
  - - [3648, 4032, 1, 256, 3648, 3648, 3648, 256]
    - [2, 13.189]
  - - [3776, 4032, 1, 256, 3776, 3776, 3776, 256]
    - [2, 13.183]
  - - [3904, 4032, 1, 256, 3904, 3904, 3904, 256]
    - [2, 13.203]
  - - [4032, 4032, 1, 256, 4032, 4032, 4032, 256]
    - [2, 13.207]
  - - [64, 64, 1, 512, 64, 64, 64, 512]
    - [1, 0.843]
  - - [192, 64, 1, 512, 192, 192, 192, 512]
    - [2, 2.492]
  - - [320, 64, 1, 512, 320, 320, 320, 512]
    - [0, 3.499]
  - - [448, 64, 1, 512, 448, 448, 448, 512]
    - [0, 4.867]
  - - [576, 64, 1, 512, 576, 576, 576, 512]
    - [2, 4.948]
  - - [704, 64, 1, 512, 704, 704, 704, 512]
    - [2, 6.046]
  - - [832, 64, 1, 512, 832, 832, 832, 512]
    - [0, 6.57]
  - - [960, 64, 1, 512, 960, 960, 960, 512]
    - [0, 7.496]
  - - [1088, 64, 1, 512, 1088, 1088, 1088, 512]
    - [2, 6.825]
  - - [1216, 64, 1, 512, 1216, 1216, 1216, 512]
    - [0, 7.402]
  - - [1344, 64, 1, 512, 1344, 1344, 1344, 512]
    - [0, 8.179]
  - - [1472, 64, 1, 512, 1472, 1472, 1472, 512]
    - [2, 7.419]
  - - [1600, 64, 1, 512, 1600, 1600, 1600, 512]
    - [2, 7.972]
  - - [1728, 64, 1, 512, 1728, 1728, 1728, 512]
    - [0, 8.593]
  - - [1856, 64, 1, 512, 1856, 1856, 1856, 512]
    - [0, 9.187]
  - - [1984, 64, 1, 512, 1984, 1984, 1984, 512]
    - [0, 8.421]
  - - [2112, 64, 1, 512, 2112, 2112, 2112, 512]
    - [0, 8.886]
  - - [2240, 64, 1, 512, 2240, 2240, 2240, 512]
    - [0, 9.384]
  - - [2368, 64, 1, 512, 2368, 2368, 2368, 512]
    - [0, 9.906]
  - - [2496, 64, 1, 512, 2496, 2496, 2496, 512]
    - [2, 9.254]
  - - [2624, 64, 1, 512, 2624, 2624, 2624, 512]
    - [2, 9.595]
  - - [2752, 64, 1, 512, 2752, 2752, 2752, 512]
    - [0, 10.0]
  - - [2880, 64, 1, 512, 2880, 2880, 2880, 512]
    - [0, 10.429]
  - - [3008, 64, 1, 512, 3008, 3008, 3008, 512]
    - [0, 9.674]
  - - [3136, 64, 1, 512, 3136, 3136, 3136, 512]
    - [0, 10.054]
  - - [3264, 64, 1, 512, 3264, 3264, 3264, 512]
    - [0, 10.461]
  - - [3392, 64, 1, 512, 3392, 3392, 3392, 512]
    - [2, 10.166]
  - - [3520, 64, 1, 512, 3520, 3520, 3520, 512]
    - [2, 10.315]
  - - [3648, 64, 1, 512, 3648, 3648, 3648, 512]
    - [0, 10.468]
  - - [3776, 64, 1, 512, 3776, 3776, 3776, 512]
    - [0, 10.852]
  - - [3904, 64, 1, 512, 3904, 3904, 3904, 512]
    - [2, 10.338]
  - - [4032, 64, 1, 512, 4032, 4032, 4032, 512]
    - [2, 10.494]
  - - [64, 192, 1, 512, 64, 64, 64, 512]
    - [1, 1.799]
  - - [192, 192, 1, 512, 192, 192, 192, 512]
    - [0, 4.605]
  - - [320, 192, 1, 512, 320, 320, 320, 512]
    - [0, 7.604]
  - - [448, 192, 1, 512, 448, 448, 448, 512]
    - [0, 8.213]
  - - [576, 192, 1, 512, 576, 576, 576, 512]
    - [0, 8.628]
  - - [704, 192, 1, 512, 704, 704, 704, 512]
    - [0, 8.937]
  - - [832, 192, 1, 512, 832, 832, 832, 512]
    - [2, 9.746]
  - - [960, 192, 1, 512, 960, 960, 960, 512]
    - [0, 10.514]
  - - [1088, 192, 1, 512, 1088, 1088, 1088, 512]
    - [0, 10.463]
  - - [1216, 192, 1, 512, 1216, 1216, 1216, 512]
    - [0, 10.506]
  - - [1344, 192, 1, 512, 1344, 1344, 1344, 512]
    - [0, 10.533]
  - - [1472, 192, 1, 512, 1472, 1472, 1472, 512]
    - [2, 10.711]
  - - [1600, 192, 1, 512, 1600, 1600, 1600, 512]
    - [0, 11.392]
  - - [1728, 192, 1, 512, 1728, 1728, 1728, 512]
    - [0, 11.347]
  - - [1856, 192, 1, 512, 1856, 1856, 1856, 512]
    - [2, 11.306]
  - - [1984, 192, 1, 512, 1984, 1984, 1984, 512]
    - [0, 11.259]
  - - [2112, 192, 1, 512, 2112, 2112, 2112, 512]
    - [2, 11.394]
  - - [2240, 192, 1, 512, 2240, 2240, 2240, 512]
    - [0, 11.841]
  - - [2368, 192, 1, 512, 2368, 2368, 2368, 512]
    - [0, 11.779]
  - - [2496, 192, 1, 512, 2496, 2496, 2496, 512]
    - [0, 11.718]
  - - [2624, 192, 1, 512, 2624, 2624, 2624, 512]
    - [0, 11.66]
  - - [2752, 192, 1, 512, 2752, 2752, 2752, 512]
    - [2, 11.062]
  - - [2880, 192, 1, 512, 2880, 2880, 2880, 512]
    - [2, 11.278]
  - - [3008, 192, 1, 512, 3008, 3008, 3008, 512]
    - [0, 11.484]
  - - [3136, 192, 1, 512, 3136, 3136, 3136, 512]
    - [0, 11.403]
  - - [3264, 192, 1, 512, 3264, 3264, 3264, 512]
    - [2, 11.583]
  - - [3392, 192, 1, 512, 3392, 3392, 3392, 512]
    - [2, 11.511]
  - - [3520, 192, 1, 512, 3520, 3520, 3520, 512]
    - [0, 11.737]
  - - [3648, 192, 1, 512, 3648, 3648, 3648, 512]
    - [2, 11.843]
  - - [3776, 192, 1, 512, 3776, 3776, 3776, 512]
    - [0, 11.694]
  - - [3904, 192, 1, 512, 3904, 3904, 3904, 512]
    - [2, 11.749]
  - - [4032, 192, 1, 512, 4032, 4032, 4032, 512]
    - [2, 11.868]
  - - [64, 320, 1, 512, 64, 64, 64, 512]
    - [2, 3.68]
  - - [192, 320, 1, 512, 192, 192, 192, 512]
    - [0, 7.6]
  - - [320, 320, 1, 512, 320, 320, 320, 512]
    - [2, 8.06]
  - - [448, 320, 1, 512, 448, 448, 448, 512]
    - [0, 9.463]
  - - [576, 320, 1, 512, 576, 576, 576, 512]
    - [0, 10.51]
  - - [704, 320, 1, 512, 704, 704, 704, 512]
    - [2, 10.426]
  - - [832, 320, 1, 512, 832, 832, 832, 512]
    - [0, 10.846]
  - - [960, 320, 1, 512, 960, 960, 960, 512]
    - [0, 11.383]
  - - [1088, 320, 1, 512, 1088, 1088, 1088, 512]
    - [2, 11.17]
  - - [1216, 320, 1, 512, 1216, 1216, 1216, 512]
    - [0, 11.477]
  - - [1344, 320, 1, 512, 1344, 1344, 1344, 512]
    - [0, 11.828]
  - - [1472, 320, 1, 512, 1472, 1472, 1472, 512]
    - [2, 11.726]
  - - [1600, 320, 1, 512, 1600, 1600, 1600, 512]
    - [0, 11.822]
  - - [1728, 320, 1, 512, 1728, 1728, 1728, 512]
    - [0, 11.124]
  - - [1856, 320, 1, 512, 1856, 1856, 1856, 512]
    - [2, 11.352]
  - - [1984, 320, 1, 512, 1984, 1984, 1984, 512]
    - [0, 11.531]
  - - [2112, 320, 1, 512, 2112, 2112, 2112, 512]
    - [0, 11.74]
  - - [2240, 320, 1, 512, 2240, 2240, 2240, 512]
    - [2, 11.634]
  - - [2368, 320, 1, 512, 2368, 2368, 2368, 512]
    - [2, 11.894]
  - - [2496, 320, 1, 512, 2496, 2496, 2496, 512]
    - [0, 11.943]
  - - [2624, 320, 1, 512, 2624, 2624, 2624, 512]
    - [2, 11.902]
  - - [2752, 320, 1, 512, 2752, 2752, 2752, 512]
    - [2, 11.971]
  - - [2880, 320, 1, 512, 2880, 2880, 2880, 512]
    - [2, 12.221]
  - - [3008, 320, 1, 512, 3008, 3008, 3008, 512]
    - [2, 12.025]
  - - [3136, 320, 1, 512, 3136, 3136, 3136, 512]
    - [2, 12.191]
  - - [3264, 320, 1, 512, 3264, 3264, 3264, 512]
    - [0, 12.201]
  - - [3392, 320, 1, 512, 3392, 3392, 3392, 512]
    - [2, 12.203]
  - - [3520, 320, 1, 512, 3520, 3520, 3520, 512]
    - [2, 12.485]
  - - [3648, 320, 1, 512, 3648, 3648, 3648, 512]
    - [2, 12.437]
  - - [3776, 320, 1, 512, 3776, 3776, 3776, 512]
    - [2, 12.316]
  - - [3904, 320, 1, 512, 3904, 3904, 3904, 512]
    - [2, 12.441]
  - - [4032, 320, 1, 512, 4032, 4032, 4032, 512]
    - [2, 12.445]
  - - [64, 448, 1, 512, 64, 64, 64, 512]
    - [0, 4.926]
  - - [192, 448, 1, 512, 192, 192, 192, 512]
    - [0, 8.205]
  - - [320, 448, 1, 512, 320, 320, 320, 512]
    - [0, 9.46]
  - - [448, 448, 1, 512, 448, 448, 448, 512]
    - [2, 10.215]
  - - [576, 448, 1, 512, 576, 576, 576, 512]
    - [0, 10.559]
  - - [704, 448, 1, 512, 704, 704, 704, 512]
    - [2, 10.99]
  - - [832, 448, 1, 512, 832, 832, 832, 512]
    - [2, 11.276]
  - - [960, 448, 1, 512, 960, 960, 960, 512]
    - [0, 11.844]
  - - [1088, 448, 1, 512, 1088, 1088, 1088, 512]
    - [0, 11.887]
  - - [1216, 448, 1, 512, 1216, 1216, 1216, 512]
    - [2, 11.308]
  - - [1344, 448, 1, 512, 1344, 1344, 1344, 512]
    - [2, 11.561]
  - - [1472, 448, 1, 512, 1472, 1472, 1472, 512]
    - [0, 11.49]
  - - [1600, 448, 1, 512, 1600, 1600, 1600, 512]
    - [2, 11.647]
  - - [1728, 448, 1, 512, 1728, 1728, 1728, 512]
    - [2, 11.946]
  - - [1856, 448, 1, 512, 1856, 1856, 1856, 512]
    - [2, 11.921]
  - - [1984, 448, 1, 512, 1984, 1984, 1984, 512]
    - [0, 12.022]
  - - [2112, 448, 1, 512, 2112, 2112, 2112, 512]
    - [2, 12.054]
  - - [2240, 448, 1, 512, 2240, 2240, 2240, 512]
    - [2, 12.144]
  - - [2368, 448, 1, 512, 2368, 2368, 2368, 512]
    - [2, 12.265]
  - - [2496, 448, 1, 512, 2496, 2496, 2496, 512]
    - [2, 12.27]
  - - [2624, 448, 1, 512, 2624, 2624, 2624, 512]
    - [2, 12.257]
  - - [2752, 448, 1, 512, 2752, 2752, 2752, 512]
    - [2, 12.308]
  - - [2880, 448, 1, 512, 2880, 2880, 2880, 512]
    - [2, 12.443]
  - - [3008, 448, 1, 512, 3008, 3008, 3008, 512]
    - [2, 12.435]
  - - [3136, 448, 1, 512, 3136, 3136, 3136, 512]
    - [2, 12.518]
  - - [3264, 448, 1, 512, 3264, 3264, 3264, 512]
    - [2, 12.5]
  - - [3392, 448, 1, 512, 3392, 3392, 3392, 512]
    - [2, 12.496]
  - - [3520, 448, 1, 512, 3520, 3520, 3520, 512]
    - [2, 12.674]
  - - [3648, 448, 1, 512, 3648, 3648, 3648, 512]
    - [0, 12.58]
  - - [3776, 448, 1, 512, 3776, 3776, 3776, 512]
    - [2, 12.667]
  - - [3904, 448, 1, 512, 3904, 3904, 3904, 512]
    - [2, 12.776]
  - - [4032, 448, 1, 512, 4032, 4032, 4032, 512]
    - [2, 12.737]
  - - [64, 576, 1, 512, 64, 64, 64, 512]
    - [2, 5.0]
  - - [192, 576, 1, 512, 192, 192, 192, 512]
    - [0, 8.622]
  - - [320, 576, 1, 512, 320, 320, 320, 512]
    - [0, 10.519]
  - - [448, 576, 1, 512, 448, 448, 448, 512]
    - [2, 10.559]
  - - [576, 576, 1, 512, 576, 576, 576, 512]
    - [0, 11.344]
  - - [704, 576, 1, 512, 704, 704, 704, 512]
    - [2, 11.463]
  - - [832, 576, 1, 512, 832, 832, 832, 512]
    - [0, 11.715]
  - - [960, 576, 1, 512, 960, 960, 960, 512]
    - [2, 11.383]
  - - [1088, 576, 1, 512, 1088, 1088, 1088, 512]
    - [2, 11.467]
  - - [1216, 576, 1, 512, 1216, 1216, 1216, 512]
    - [0, 11.7]
  - - [1344, 576, 1, 512, 1344, 1344, 1344, 512]
    - [2, 11.832]
  - - [1472, 576, 1, 512, 1472, 1472, 1472, 512]
    - [2, 11.913]
  - - [1600, 576, 1, 512, 1600, 1600, 1600, 512]
    - [2, 12.174]
  - - [1728, 576, 1, 512, 1728, 1728, 1728, 512]
    - [2, 12.063]
  - - [1856, 576, 1, 512, 1856, 1856, 1856, 512]
    - [2, 12.218]
  - - [1984, 576, 1, 512, 1984, 1984, 1984, 512]
    - [0, 12.332]
  - - [2112, 576, 1, 512, 2112, 2112, 2112, 512]
    - [2, 12.361]
  - - [2240, 576, 1, 512, 2240, 2240, 2240, 512]
    - [0, 12.38]
  - - [2368, 576, 1, 512, 2368, 2368, 2368, 512]
    - [2, 12.504]
  - - [2496, 576, 1, 512, 2496, 2496, 2496, 512]
    - [2, 12.685]
  - - [2624, 576, 1, 512, 2624, 2624, 2624, 512]
    - [2, 12.671]
  - - [2752, 576, 1, 512, 2752, 2752, 2752, 512]
    - [2, 12.587]
  - - [2880, 576, 1, 512, 2880, 2880, 2880, 512]
    - [2, 12.655]
  - - [3008, 576, 1, 512, 3008, 3008, 3008, 512]
    - [2, 12.635]
  - - [3136, 576, 1, 512, 3136, 3136, 3136, 512]
    - [2, 12.686]
  - - [3264, 576, 1, 512, 3264, 3264, 3264, 512]
    - [2, 12.721]
  - - [3392, 576, 1, 512, 3392, 3392, 3392, 512]
    - [2, 12.742]
  - - [3520, 576, 1, 512, 3520, 3520, 3520, 512]
    - [2, 12.78]
  - - [3648, 576, 1, 512, 3648, 3648, 3648, 512]
    - [2, 12.781]
  - - [3776, 576, 1, 512, 3776, 3776, 3776, 512]
    - [2, 12.869]
  - - [3904, 576, 1, 512, 3904, 3904, 3904, 512]
    - [2, 12.987]
  - - [4032, 576, 1, 512, 4032, 4032, 4032, 512]
    - [2, 12.863]
  - - [64, 704, 1, 512, 64, 64, 64, 512]
    - [2, 6.104]
  - - [192, 704, 1, 512, 192, 192, 192, 512]
    - [0, 8.95]
  - - [320, 704, 1, 512, 320, 320, 320, 512]
    - [2, 10.502]
  - - [448, 704, 1, 512, 448, 448, 448, 512]
    - [0, 10.849]
  - - [576, 704, 1, 512, 576, 576, 576, 512]
    - [2, 11.717]
  - - [704, 704, 1, 512, 704, 704, 704, 512]
    - [0, 11.898]
  - - [832, 704, 1, 512, 832, 832, 832, 512]
    - [0, 11.284]
  - - [960, 704, 1, 512, 960, 960, 960, 512]
    - [0, 11.735]
  - - [1088, 704, 1, 512, 1088, 1088, 1088, 512]
    - [0, 11.858]
  - - [1216, 704, 1, 512, 1216, 1216, 1216, 512]
    - [0, 11.953]
  - - [1344, 704, 1, 512, 1344, 1344, 1344, 512]
    - [0, 12.077]
  - - [1472, 704, 1, 512, 1472, 1472, 1472, 512]
    - [0, 12.136]
  - - [1600, 704, 1, 512, 1600, 1600, 1600, 512]
    - [2, 12.309]
  - - [1728, 704, 1, 512, 1728, 1728, 1728, 512]
    - [2, 12.331]
  - - [1856, 704, 1, 512, 1856, 1856, 1856, 512]
    - [2, 12.443]
  - - [1984, 704, 1, 512, 1984, 1984, 1984, 512]
    - [2, 12.433]
  - - [2112, 704, 1, 512, 2112, 2112, 2112, 512]
    - [2, 12.515]
  - - [2240, 704, 1, 512, 2240, 2240, 2240, 512]
    - [2, 12.564]
  - - [2368, 704, 1, 512, 2368, 2368, 2368, 512]
    - [2, 12.7]
  - - [2496, 704, 1, 512, 2496, 2496, 2496, 512]
    - [2, 12.721]
  - - [2624, 704, 1, 512, 2624, 2624, 2624, 512]
    - [2, 12.754]
  - - [2752, 704, 1, 512, 2752, 2752, 2752, 512]
    - [2, 12.753]
  - - [2880, 704, 1, 512, 2880, 2880, 2880, 512]
    - [2, 12.791]
  - - [3008, 704, 1, 512, 3008, 3008, 3008, 512]
    - [2, 12.838]
  - - [3136, 704, 1, 512, 3136, 3136, 3136, 512]
    - [0, 12.856]
  - - [3264, 704, 1, 512, 3264, 3264, 3264, 512]
    - [2, 12.733]
  - - [3392, 704, 1, 512, 3392, 3392, 3392, 512]
    - [2, 12.888]
  - - [3520, 704, 1, 512, 3520, 3520, 3520, 512]
    - [2, 12.958]
  - - [3648, 704, 1, 512, 3648, 3648, 3648, 512]
    - [2, 12.921]
  - - [3776, 704, 1, 512, 3776, 3776, 3776, 512]
    - [2, 12.933]
  - - [3904, 704, 1, 512, 3904, 3904, 3904, 512]
    - [2, 13.007]
  - - [4032, 704, 1, 512, 4032, 4032, 4032, 512]
    - [2, 12.993]
  - - [64, 832, 1, 512, 64, 64, 64, 512]
    - [0, 6.636]
  - - [192, 832, 1, 512, 192, 192, 192, 512]
    - [2, 9.746]
  - - [320, 832, 1, 512, 320, 320, 320, 512]
    - [0, 10.856]
  - - [448, 832, 1, 512, 448, 448, 448, 512]
    - [2, 11.365]
  - - [576, 832, 1, 512, 576, 576, 576, 512]
    - [0, 11.714]
  - - [704, 832, 1, 512, 704, 704, 704, 512]
    - [2, 11.471]
  - - [832, 832, 1, 512, 832, 832, 832, 512]
    - [2, 11.619]
  - - [960, 832, 1, 512, 960, 960, 960, 512]
    - [0, 11.939]
  - - [1088, 832, 1, 512, 1088, 1088, 1088, 512]
    - [2, 12.069]
  - - [1216, 832, 1, 512, 1216, 1216, 1216, 512]
    - [0, 12.154]
  - - [1344, 832, 1, 512, 1344, 1344, 1344, 512]
    - [2, 12.267]
  - - [1472, 832, 1, 512, 1472, 1472, 1472, 512]
    - [2, 12.411]
  - - [1600, 832, 1, 512, 1600, 1600, 1600, 512]
    - [2, 12.484]
  - - [1728, 832, 1, 512, 1728, 1728, 1728, 512]
    - [2, 12.495]
  - - [1856, 832, 1, 512, 1856, 1856, 1856, 512]
    - [2, 12.613]
  - - [1984, 832, 1, 512, 1984, 1984, 1984, 512]
    - [2, 12.682]
  - - [2112, 832, 1, 512, 2112, 2112, 2112, 512]
    - [2, 12.636]
  - - [2240, 832, 1, 512, 2240, 2240, 2240, 512]
    - [2, 12.785]
  - - [2368, 832, 1, 512, 2368, 2368, 2368, 512]
    - [0, 12.732]
  - - [2496, 832, 1, 512, 2496, 2496, 2496, 512]
    - [2, 12.865]
  - - [2624, 832, 1, 512, 2624, 2624, 2624, 512]
    - [2, 12.819]
  - - [2752, 832, 1, 512, 2752, 2752, 2752, 512]
    - [2, 12.872]
  - - [2880, 832, 1, 512, 2880, 2880, 2880, 512]
    - [2, 12.93]
  - - [3008, 832, 1, 512, 3008, 3008, 3008, 512]
    - [2, 12.919]
  - - [3136, 832, 1, 512, 3136, 3136, 3136, 512]
    - [2, 12.96]
  - - [3264, 832, 1, 512, 3264, 3264, 3264, 512]
    - [2, 12.954]
  - - [3392, 832, 1, 512, 3392, 3392, 3392, 512]
    - [2, 12.963]
  - - [3520, 832, 1, 512, 3520, 3520, 3520, 512]
    - [2, 12.961]
  - - [3648, 832, 1, 512, 3648, 3648, 3648, 512]
    - [2, 12.984]
  - - [3776, 832, 1, 512, 3776, 3776, 3776, 512]
    - [2, 13.048]
  - - [3904, 832, 1, 512, 3904, 3904, 3904, 512]
    - [2, 13.011]
  - - [4032, 832, 1, 512, 4032, 4032, 4032, 512]
    - [2, 13.088]
  - - [64, 960, 1, 512, 64, 64, 64, 512]
    - [0, 7.621]
  - - [192, 960, 1, 512, 192, 192, 192, 512]
    - [0, 10.537]
  - - [320, 960, 1, 512, 320, 320, 320, 512]
    - [0, 11.399]
  - - [448, 960, 1, 512, 448, 448, 448, 512]
    - [0, 11.842]
  - - [576, 960, 1, 512, 576, 576, 576, 512]
    - [0, 11.127]
  - - [704, 960, 1, 512, 704, 704, 704, 512]
    - [0, 11.731]
  - - [832, 960, 1, 512, 832, 832, 832, 512]
    - [0, 11.921]
  - - [960, 960, 1, 512, 960, 960, 960, 512]
    - [0, 12.094]
  - - [1088, 960, 1, 512, 1088, 1088, 1088, 512]
    - [0, 12.208]
  - - [1216, 960, 1, 512, 1216, 1216, 1216, 512]
    - [2, 12.302]
  - - [1344, 960, 1, 512, 1344, 1344, 1344, 512]
    - [0, 12.396]
  - - [1472, 960, 1, 512, 1472, 1472, 1472, 512]
    - [2, 12.512]
  - - [1600, 960, 1, 512, 1600, 1600, 1600, 512]
    - [2, 12.567]
  - - [1728, 960, 1, 512, 1728, 1728, 1728, 512]
    - [2, 12.65]
  - - [1856, 960, 1, 512, 1856, 1856, 1856, 512]
    - [2, 12.645]
  - - [1984, 960, 1, 512, 1984, 1984, 1984, 512]
    - [2, 12.699]
  - - [2112, 960, 1, 512, 2112, 2112, 2112, 512]
    - [2, 12.788]
  - - [2240, 960, 1, 512, 2240, 2240, 2240, 512]
    - [2, 12.897]
  - - [2368, 960, 1, 512, 2368, 2368, 2368, 512]
    - [2, 12.832]
  - - [2496, 960, 1, 512, 2496, 2496, 2496, 512]
    - [2, 12.877]
  - - [2624, 960, 1, 512, 2624, 2624, 2624, 512]
    - [2, 12.882]
  - - [2752, 960, 1, 512, 2752, 2752, 2752, 512]
    - [2, 12.919]
  - - [2880, 960, 1, 512, 2880, 2880, 2880, 512]
    - [2, 12.996]
  - - [3008, 960, 1, 512, 3008, 3008, 3008, 512]
    - [2, 12.972]
  - - [3136, 960, 1, 512, 3136, 3136, 3136, 512]
    - [2, 13.045]
  - - [3264, 960, 1, 512, 3264, 3264, 3264, 512]
    - [2, 13.062]
  - - [3392, 960, 1, 512, 3392, 3392, 3392, 512]
    - [2, 13.044]
  - - [3520, 960, 1, 512, 3520, 3520, 3520, 512]
    - [2, 13.034]
  - - [3648, 960, 1, 512, 3648, 3648, 3648, 512]
    - [2, 13.044]
  - - [3776, 960, 1, 512, 3776, 3776, 3776, 512]
    - [2, 13.081]
  - - [3904, 960, 1, 512, 3904, 3904, 3904, 512]
    - [2, 13.098]
  - - [4032, 960, 1, 512, 4032, 4032, 4032, 512]
    - [2, 13.109]
  - - [64, 1088, 1, 512, 64, 64, 64, 512]
    - [2, 6.907]
  - - [192, 1088, 1, 512, 192, 192, 192, 512]
    - [0, 10.475]
  - - [320, 1088, 1, 512, 320, 320, 320, 512]
    - [2, 11.12]
  - - [448, 1088, 1, 512, 448, 448, 448, 512]
    - [0, 11.87]
  - - [576, 1088, 1, 512, 576, 576, 576, 512]
    - [2, 11.492]
  - - [704, 1088, 1, 512, 704, 704, 704, 512]
    - [0, 11.861]
  - - [832, 1088, 1, 512, 832, 832, 832, 512]
    - [2, 11.913]
  - - [960, 1088, 1, 512, 960, 960, 960, 512]
    - [2, 12.22]
  - - [1088, 1088, 1, 512, 1088, 1088, 1088, 512]
    - [2, 12.342]
  - - [1216, 1088, 1, 512, 1216, 1216, 1216, 512]
    - [2, 12.458]
  - - [1344, 1088, 1, 512, 1344, 1344, 1344, 512]
    - [2, 12.474]
  - - [1472, 1088, 1, 512, 1472, 1472, 1472, 512]
    - [2, 12.589]
  - - [1600, 1088, 1, 512, 1600, 1600, 1600, 512]
    - [2, 12.654]
  - - [1728, 1088, 1, 512, 1728, 1728, 1728, 512]
    - [2, 12.766]
  - - [1856, 1088, 1, 512, 1856, 1856, 1856, 512]
    - [2, 12.851]
  - - [1984, 1088, 1, 512, 1984, 1984, 1984, 512]
    - [2, 12.835]
  - - [2112, 1088, 1, 512, 2112, 2112, 2112, 512]
    - [2, 12.856]
  - - [2240, 1088, 1, 512, 2240, 2240, 2240, 512]
    - [2, 12.995]
  - - [2368, 1088, 1, 512, 2368, 2368, 2368, 512]
    - [2, 12.934]
  - - [2496, 1088, 1, 512, 2496, 2496, 2496, 512]
    - [2, 12.937]
  - - [2624, 1088, 1, 512, 2624, 2624, 2624, 512]
    - [2, 12.943]
  - - [2752, 1088, 1, 512, 2752, 2752, 2752, 512]
    - [2, 12.998]
  - - [2880, 1088, 1, 512, 2880, 2880, 2880, 512]
    - [2, 13.012]
  - - [3008, 1088, 1, 512, 3008, 3008, 3008, 512]
    - [2, 13.036]
  - - [3136, 1088, 1, 512, 3136, 3136, 3136, 512]
    - [2, 13.072]
  - - [3264, 1088, 1, 512, 3264, 3264, 3264, 512]
    - [2, 13.098]
  - - [3392, 1088, 1, 512, 3392, 3392, 3392, 512]
    - [2, 13.07]
  - - [3520, 1088, 1, 512, 3520, 3520, 3520, 512]
    - [2, 13.115]
  - - [3648, 1088, 1, 512, 3648, 3648, 3648, 512]
    - [2, 13.142]
  - - [3776, 1088, 1, 512, 3776, 3776, 3776, 512]
    - [2, 13.12]
  - - [3904, 1088, 1, 512, 3904, 3904, 3904, 512]
    - [2, 13.048]
  - - [4032, 1088, 1, 512, 4032, 4032, 4032, 512]
    - [2, 12.981]
  - - [64, 1216, 1, 512, 64, 64, 64, 512]
    - [0, 7.456]
  - - [192, 1216, 1, 512, 192, 192, 192, 512]
    - [0, 10.491]
  - - [320, 1216, 1, 512, 320, 320, 320, 512]
    - [0, 11.461]
  - - [448, 1216, 1, 512, 448, 448, 448, 512]
    - [2, 10.993]
  - - [576, 1216, 1, 512, 576, 576, 576, 512]
    - [2, 11.715]
  - - [704, 1216, 1, 512, 704, 704, 704, 512]
    - [2, 11.983]
  - - [832, 1216, 1, 512, 832, 832, 832, 512]
    - [2, 12.202]
  - - [960, 1216, 1, 512, 960, 960, 960, 512]
    - [2, 12.354]
  - - [1088, 1216, 1, 512, 1088, 1088, 1088, 512]
    - [2, 12.485]
  - - [1216, 1216, 1, 512, 1216, 1216, 1216, 512]
    - [0, 12.522]
  - - [1344, 1216, 1, 512, 1344, 1344, 1344, 512]
    - [2, 12.584]
  - - [1472, 1216, 1, 512, 1472, 1472, 1472, 512]
    - [2, 12.702]
  - - [1600, 1216, 1, 512, 1600, 1600, 1600, 512]
    - [2, 12.701]
  - - [1728, 1216, 1, 512, 1728, 1728, 1728, 512]
    - [2, 12.865]
  - - [1856, 1216, 1, 512, 1856, 1856, 1856, 512]
    - [2, 12.874]
  - - [1984, 1216, 1, 512, 1984, 1984, 1984, 512]
    - [2, 12.883]
  - - [2112, 1216, 1, 512, 2112, 2112, 2112, 512]
    - [2, 12.909]
  - - [2240, 1216, 1, 512, 2240, 2240, 2240, 512]
    - [2, 13.003]
  - - [2368, 1216, 1, 512, 2368, 2368, 2368, 512]
    - [2, 13.021]
  - - [2496, 1216, 1, 512, 2496, 2496, 2496, 512]
    - [2, 13.025]
  - - [2624, 1216, 1, 512, 2624, 2624, 2624, 512]
    - [2, 13.066]
  - - [2752, 1216, 1, 512, 2752, 2752, 2752, 512]
    - [2, 13.06]
  - - [2880, 1216, 1, 512, 2880, 2880, 2880, 512]
    - [2, 13.076]
  - - [3008, 1216, 1, 512, 3008, 3008, 3008, 512]
    - [2, 13.109]
  - - [3136, 1216, 1, 512, 3136, 3136, 3136, 512]
    - [2, 13.114]
  - - [3264, 1216, 1, 512, 3264, 3264, 3264, 512]
    - [2, 13.129]
  - - [3392, 1216, 1, 512, 3392, 3392, 3392, 512]
    - [2, 13.172]
  - - [3520, 1216, 1, 512, 3520, 3520, 3520, 512]
    - [2, 12.97]
  - - [3648, 1216, 1, 512, 3648, 3648, 3648, 512]
    - [2, 12.971]
  - - [3776, 1216, 1, 512, 3776, 3776, 3776, 512]
    - [2, 12.993]
  - - [3904, 1216, 1, 512, 3904, 3904, 3904, 512]
    - [2, 12.998]
  - - [4032, 1216, 1, 512, 4032, 4032, 4032, 512]
    - [2, 12.993]
  - - [64, 1344, 1, 512, 64, 64, 64, 512]
    - [2, 7.765]
  - - [192, 1344, 1, 512, 192, 192, 192, 512]
    - [0, 10.525]
  - - [320, 1344, 1, 512, 320, 320, 320, 512]
    - [0, 11.826]
  - - [448, 1344, 1, 512, 448, 448, 448, 512]
    - [2, 11.479]
  - - [576, 1344, 1, 512, 576, 576, 576, 512]
    - [0, 11.83]
  - - [704, 1344, 1, 512, 704, 704, 704, 512]
    - [2, 12.113]
  - - [832, 1344, 1, 512, 832, 832, 832, 512]
    - [2, 12.258]
  - - [960, 1344, 1, 512, 960, 960, 960, 512]
    - [2, 12.418]
  - - [1088, 1344, 1, 512, 1088, 1088, 1088, 512]
    - [2, 12.432]
  - - [1216, 1344, 1, 512, 1216, 1216, 1216, 512]
    - [2, 12.583]
  - - [1344, 1344, 1, 512, 1344, 1344, 1344, 512]
    - [2, 12.707]
  - - [1472, 1344, 1, 512, 1472, 1472, 1472, 512]
    - [2, 12.83]
  - - [1600, 1344, 1, 512, 1600, 1600, 1600, 512]
    - [2, 12.868]
  - - [1728, 1344, 1, 512, 1728, 1728, 1728, 512]
    - [2, 12.878]
  - - [1856, 1344, 1, 512, 1856, 1856, 1856, 512]
    - [2, 12.862]
  - - [1984, 1344, 1, 512, 1984, 1984, 1984, 512]
    - [2, 12.949]
  - - [2112, 1344, 1, 512, 2112, 2112, 2112, 512]
    - [2, 13.009]
  - - [2240, 1344, 1, 512, 2240, 2240, 2240, 512]
    - [2, 13.062]
  - - [2368, 1344, 1, 512, 2368, 2368, 2368, 512]
    - [2, 13.015]
  - - [2496, 1344, 1, 512, 2496, 2496, 2496, 512]
    - [2, 13.055]
  - - [2624, 1344, 1, 512, 2624, 2624, 2624, 512]
    - [2, 13.086]
  - - [2752, 1344, 1, 512, 2752, 2752, 2752, 512]
    - [2, 13.104]
  - - [2880, 1344, 1, 512, 2880, 2880, 2880, 512]
    - [2, 13.117]
  - - [3008, 1344, 1, 512, 3008, 3008, 3008, 512]
    - [2, 13.133]
  - - [3136, 1344, 1, 512, 3136, 3136, 3136, 512]
    - [2, 13.118]
  - - [3264, 1344, 1, 512, 3264, 3264, 3264, 512]
    - [2, 12.934]
  - - [3392, 1344, 1, 512, 3392, 3392, 3392, 512]
    - [2, 13.003]
  - - [3520, 1344, 1, 512, 3520, 3520, 3520, 512]
    - [2, 13.005]
  - - [3648, 1344, 1, 512, 3648, 3648, 3648, 512]
    - [2, 13.014]
  - - [3776, 1344, 1, 512, 3776, 3776, 3776, 512]
    - [2, 13.02]
  - - [3904, 1344, 1, 512, 3904, 3904, 3904, 512]
    - [2, 13.048]
  - - [4032, 1344, 1, 512, 4032, 4032, 4032, 512]
    - [2, 13.058]
  - - [64, 1472, 1, 512, 64, 64, 64, 512]
    - [2, 7.628]
  - - [192, 1472, 1, 512, 192, 192, 192, 512]
    - [2, 10.948]
  - - [320, 1472, 1, 512, 320, 320, 320, 512]
    - [2, 11.636]
  - - [448, 1472, 1, 512, 448, 448, 448, 512]
    - [2, 11.535]
  - - [576, 1472, 1, 512, 576, 576, 576, 512]
    - [0, 11.861]
  - - [704, 1472, 1, 512, 704, 704, 704, 512]
    - [0, 12.133]
  - - [832, 1472, 1, 512, 832, 832, 832, 512]
    - [0, 12.307]
  - - [960, 1472, 1, 512, 960, 960, 960, 512]
    - [2, 12.456]
  - - [1088, 1472, 1, 512, 1088, 1088, 1088, 512]
    - [2, 12.56]
  - - [1216, 1472, 1, 512, 1216, 1216, 1216, 512]
    - [2, 12.801]
  - - [1344, 1472, 1, 512, 1344, 1344, 1344, 512]
    - [2, 12.826]
  - - [1472, 1472, 1, 512, 1472, 1472, 1472, 512]
    - [2, 12.802]
  - - [1600, 1472, 1, 512, 1600, 1600, 1600, 512]
    - [2, 12.886]
  - - [1728, 1472, 1, 512, 1728, 1728, 1728, 512]
    - [2, 12.915]
  - - [1856, 1472, 1, 512, 1856, 1856, 1856, 512]
    - [2, 13.018]
  - - [1984, 1472, 1, 512, 1984, 1984, 1984, 512]
    - [2, 13.027]
  - - [2112, 1472, 1, 512, 2112, 2112, 2112, 512]
    - [2, 12.954]
  - - [2240, 1472, 1, 512, 2240, 2240, 2240, 512]
    - [2, 13.08]
  - - [2368, 1472, 1, 512, 2368, 2368, 2368, 512]
    - [2, 13.005]
  - - [2496, 1472, 1, 512, 2496, 2496, 2496, 512]
    - [2, 13.093]
  - - [2624, 1472, 1, 512, 2624, 2624, 2624, 512]
    - [2, 13.103]
  - - [2752, 1472, 1, 512, 2752, 2752, 2752, 512]
    - [2, 13.12]
  - - [2880, 1472, 1, 512, 2880, 2880, 2880, 512]
    - [2, 13.144]
  - - [3008, 1472, 1, 512, 3008, 3008, 3008, 512]
    - [2, 12.965]
  - - [3136, 1472, 1, 512, 3136, 3136, 3136, 512]
    - [2, 12.978]
  - - [3264, 1472, 1, 512, 3264, 3264, 3264, 512]
    - [2, 12.994]
  - - [3392, 1472, 1, 512, 3392, 3392, 3392, 512]
    - [2, 13.028]
  - - [3520, 1472, 1, 512, 3520, 3520, 3520, 512]
    - [2, 13.031]
  - - [3648, 1472, 1, 512, 3648, 3648, 3648, 512]
    - [2, 13.037]
  - - [3776, 1472, 1, 512, 3776, 3776, 3776, 512]
    - [2, 13.101]
  - - [3904, 1472, 1, 512, 3904, 3904, 3904, 512]
    - [2, 13.084]
  - - [4032, 1472, 1, 512, 4032, 4032, 4032, 512]
    - [2, 13.111]
  - - [64, 1600, 1, 512, 64, 64, 64, 512]
    - [0, 8.081]
  - - [192, 1600, 1, 512, 192, 192, 192, 512]
    - [0, 11.367]
  - - [320, 1600, 1, 512, 320, 320, 320, 512]
    - [0, 11.831]
  - - [448, 1600, 1, 512, 448, 448, 448, 512]
    - [2, 11.86]
  - - [576, 1600, 1, 512, 576, 576, 576, 512]
    - [0, 12.104]
  - - [704, 1600, 1, 512, 704, 704, 704, 512]
    - [2, 12.313]
  - - [832, 1600, 1, 512, 832, 832, 832, 512]
    - [2, 12.454]
  - - [960, 1600, 1, 512, 960, 960, 960, 512]
    - [0, 12.514]
  - - [1088, 1600, 1, 512, 1088, 1088, 1088, 512]
    - [2, 12.673]
  - - [1216, 1600, 1, 512, 1216, 1216, 1216, 512]
    - [2, 12.745]
  - - [1344, 1600, 1, 512, 1344, 1344, 1344, 512]
    - [2, 12.806]
  - - [1472, 1600, 1, 512, 1472, 1472, 1472, 512]
    - [2, 12.908]
  - - [1600, 1600, 1, 512, 1600, 1600, 1600, 512]
    - [2, 12.872]
  - - [1728, 1600, 1, 512, 1728, 1728, 1728, 512]
    - [2, 13.004]
  - - [1856, 1600, 1, 512, 1856, 1856, 1856, 512]
    - [2, 12.944]
  - - [1984, 1600, 1, 512, 1984, 1984, 1984, 512]
    - [2, 12.992]
  - - [2112, 1600, 1, 512, 2112, 2112, 2112, 512]
    - [2, 13.085]
  - - [2240, 1600, 1, 512, 2240, 2240, 2240, 512]
    - [2, 13.073]
  - - [2368, 1600, 1, 512, 2368, 2368, 2368, 512]
    - [2, 13.091]
  - - [2496, 1600, 1, 512, 2496, 2496, 2496, 512]
    - [2, 13.121]
  - - [2624, 1600, 1, 512, 2624, 2624, 2624, 512]
    - [2, 13.12]
  - - [2752, 1600, 1, 512, 2752, 2752, 2752, 512]
    - [2, 12.907]
  - - [2880, 1600, 1, 512, 2880, 2880, 2880, 512]
    - [2, 13.003]
  - - [3008, 1600, 1, 512, 3008, 3008, 3008, 512]
    - [2, 13.004]
  - - [3136, 1600, 1, 512, 3136, 3136, 3136, 512]
    - [2, 13.022]
  - - [3264, 1600, 1, 512, 3264, 3264, 3264, 512]
    - [2, 13.059]
  - - [3392, 1600, 1, 512, 3392, 3392, 3392, 512]
    - [2, 13.046]
  - - [3520, 1600, 1, 512, 3520, 3520, 3520, 512]
    - [2, 13.111]
  - - [3648, 1600, 1, 512, 3648, 3648, 3648, 512]
    - [2, 13.057]
  - - [3776, 1600, 1, 512, 3776, 3776, 3776, 512]
    - [2, 13.107]
  - - [3904, 1600, 1, 512, 3904, 3904, 3904, 512]
    - [2, 13.114]
  - - [4032, 1600, 1, 512, 4032, 4032, 4032, 512]
    - [2, 13.143]
  - - [64, 1728, 1, 512, 64, 64, 64, 512]
    - [0, 5.877]
  - - [192, 1728, 1, 512, 192, 192, 192, 512]
    - [0, 11.309]
  - - [320, 1728, 1, 512, 320, 320, 320, 512]
    - [2, 11.379]
  - - [448, 1728, 1, 512, 448, 448, 448, 512]
    - [2, 11.78]
  - - [576, 1728, 1, 512, 576, 576, 576, 512]
    - [2, 12.112]
  - - [704, 1728, 1, 512, 704, 704, 704, 512]
    - [2, 12.329]
  - - [832, 1728, 1, 512, 832, 832, 832, 512]
    - [2, 12.497]
  - - [960, 1728, 1, 512, 960, 960, 960, 512]
    - [2, 12.679]
  - - [1088, 1728, 1, 512, 1088, 1088, 1088, 512]
    - [2, 12.703]
  - - [1216, 1728, 1, 512, 1216, 1216, 1216, 512]
    - [2, 12.836]
  - - [1344, 1728, 1, 512, 1344, 1344, 1344, 512]
    - [2, 12.848]
  - - [1472, 1728, 1, 512, 1472, 1472, 1472, 512]
    - [2, 12.9]
  - - [1600, 1728, 1, 512, 1600, 1600, 1600, 512]
    - [2, 12.945]
  - - [1728, 1728, 1, 512, 1728, 1728, 1728, 512]
    - [2, 12.995]
  - - [1856, 1728, 1, 512, 1856, 1856, 1856, 512]
    - [2, 13.076]
  - - [1984, 1728, 1, 512, 1984, 1984, 1984, 512]
    - [2, 13.076]
  - - [2112, 1728, 1, 512, 2112, 2112, 2112, 512]
    - [2, 13.088]
  - - [2240, 1728, 1, 512, 2240, 2240, 2240, 512]
    - [2, 13.068]
  - - [2368, 1728, 1, 512, 2368, 2368, 2368, 512]
    - [2, 13.11]
  - - [2496, 1728, 1, 512, 2496, 2496, 2496, 512]
    - [2, 12.961]
  - - [2624, 1728, 1, 512, 2624, 2624, 2624, 512]
    - [2, 12.943]
  - - [2752, 1728, 1, 512, 2752, 2752, 2752, 512]
    - [2, 12.994]
  - - [2880, 1728, 1, 512, 2880, 2880, 2880, 512]
    - [2, 13.026]
  - - [3008, 1728, 1, 512, 3008, 3008, 3008, 512]
    - [2, 13.067]
  - - [3136, 1728, 1, 512, 3136, 3136, 3136, 512]
    - [2, 13.077]
  - - [3264, 1728, 1, 512, 3264, 3264, 3264, 512]
    - [2, 13.069]
  - - [3392, 1728, 1, 512, 3392, 3392, 3392, 512]
    - [2, 13.078]
  - - [3520, 1728, 1, 512, 3520, 3520, 3520, 512]
    - [2, 13.145]
  - - [3648, 1728, 1, 512, 3648, 3648, 3648, 512]
    - [2, 13.132]
  - - [3776, 1728, 1, 512, 3776, 3776, 3776, 512]
    - [2, 13.099]
  - - [3904, 1728, 1, 512, 3904, 3904, 3904, 512]
    - [2, 13.131]
  - - [4032, 1728, 1, 512, 4032, 4032, 4032, 512]
    - [2, 13.161]
  - - [64, 1856, 1, 512, 64, 64, 64, 512]
    - [2, 8.661]
  - - [192, 1856, 1, 512, 192, 192, 192, 512]
    - [2, 11.317]
  - - [320, 1856, 1, 512, 320, 320, 320, 512]
    - [2, 11.274]
  - - [448, 1856, 1, 512, 448, 448, 448, 512]
    - [0, 11.993]
  - - [576, 1856, 1, 512, 576, 576, 576, 512]
    - [2, 12.31]
  - - [704, 1856, 1, 512, 704, 704, 704, 512]
    - [2, 12.506]
  - - [832, 1856, 1, 512, 832, 832, 832, 512]
    - [2, 12.62]
  - - [960, 1856, 1, 512, 960, 960, 960, 512]
    - [2, 12.738]
  - - [1088, 1856, 1, 512, 1088, 1088, 1088, 512]
    - [2, 12.753]
  - - [1216, 1856, 1, 512, 1216, 1216, 1216, 512]
    - [2, 12.889]
  - - [1344, 1856, 1, 512, 1344, 1344, 1344, 512]
    - [2, 12.848]
  - - [1472, 1856, 1, 512, 1472, 1472, 1472, 512]
    - [2, 12.94]
  - - [1600, 1856, 1, 512, 1600, 1600, 1600, 512]
    - [2, 12.985]
  - - [1728, 1856, 1, 512, 1728, 1728, 1728, 512]
    - [2, 13.061]
  - - [1856, 1856, 1, 512, 1856, 1856, 1856, 512]
    - [2, 13.093]
  - - [1984, 1856, 1, 512, 1984, 1984, 1984, 512]
    - [2, 13.125]
  - - [2112, 1856, 1, 512, 2112, 2112, 2112, 512]
    - [2, 13.148]
  - - [2240, 1856, 1, 512, 2240, 2240, 2240, 512]
    - [2, 13.138]
  - - [2368, 1856, 1, 512, 2368, 2368, 2368, 512]
    - [2, 12.968]
  - - [2496, 1856, 1, 512, 2496, 2496, 2496, 512]
    - [2, 13.005]
  - - [2624, 1856, 1, 512, 2624, 2624, 2624, 512]
    - [2, 12.982]
  - - [2752, 1856, 1, 512, 2752, 2752, 2752, 512]
    - [2, 13.023]
  - - [2880, 1856, 1, 512, 2880, 2880, 2880, 512]
    - [2, 13.067]
  - - [3008, 1856, 1, 512, 3008, 3008, 3008, 512]
    - [2, 13.068]
  - - [3136, 1856, 1, 512, 3136, 3136, 3136, 512]
    - [2, 13.093]
  - - [3264, 1856, 1, 512, 3264, 3264, 3264, 512]
    - [2, 13.129]
  - - [3392, 1856, 1, 512, 3392, 3392, 3392, 512]
    - [0, 13.079]
  - - [3520, 1856, 1, 512, 3520, 3520, 3520, 512]
    - [2, 13.101]
  - - [3648, 1856, 1, 512, 3648, 3648, 3648, 512]
    - [2, 13.111]
  - - [3776, 1856, 1, 512, 3776, 3776, 3776, 512]
    - [2, 13.185]
  - - [3904, 1856, 1, 512, 3904, 3904, 3904, 512]
    - [2, 13.205]
  - - [4032, 1856, 1, 512, 4032, 4032, 4032, 512]
    - [2, 13.195]
  - - [64, 1984, 1, 512, 64, 64, 64, 512]
    - [2, 8.534]
  - - [192, 1984, 1, 512, 192, 192, 192, 512]
    - [2, 11.451]
  - - [320, 1984, 1, 512, 320, 320, 320, 512]
    - [2, 11.653]
  - - [448, 1984, 1, 512, 448, 448, 448, 512]
    - [0, 12.034]
  - - [576, 1984, 1, 512, 576, 576, 576, 512]
    - [2, 12.422]
  - - [704, 1984, 1, 512, 704, 704, 704, 512]
    - [2, 12.426]
  - - [832, 1984, 1, 512, 832, 832, 832, 512]
    - [2, 12.569]
  - - [960, 1984, 1, 512, 960, 960, 960, 512]
    - [2, 12.77]
  - - [1088, 1984, 1, 512, 1088, 1088, 1088, 512]
    - [2, 12.796]
  - - [1216, 1984, 1, 512, 1216, 1216, 1216, 512]
    - [2, 12.891]
  - - [1344, 1984, 1, 512, 1344, 1344, 1344, 512]
    - [2, 12.981]
  - - [1472, 1984, 1, 512, 1472, 1472, 1472, 512]
    - [2, 13.045]
  - - [1600, 1984, 1, 512, 1600, 1600, 1600, 512]
    - [2, 13.088]
  - - [1728, 1984, 1, 512, 1728, 1728, 1728, 512]
    - [2, 13.087]
  - - [1856, 1984, 1, 512, 1856, 1856, 1856, 512]
    - [2, 13.021]
  - - [1984, 1984, 1, 512, 1984, 1984, 1984, 512]
    - [2, 13.121]
  - - [2112, 1984, 1, 512, 2112, 2112, 2112, 512]
    - [2, 13.171]
  - - [2240, 1984, 1, 512, 2240, 2240, 2240, 512]
    - [2, 12.948]
  - - [2368, 1984, 1, 512, 2368, 2368, 2368, 512]
    - [2, 12.954]
  - - [2496, 1984, 1, 512, 2496, 2496, 2496, 512]
    - [2, 13.011]
  - - [2624, 1984, 1, 512, 2624, 2624, 2624, 512]
    - [2, 13.039]
  - - [2752, 1984, 1, 512, 2752, 2752, 2752, 512]
    - [2, 13.054]
  - - [2880, 1984, 1, 512, 2880, 2880, 2880, 512]
    - [2, 13.079]
  - - [3008, 1984, 1, 512, 3008, 3008, 3008, 512]
    - [2, 13.107]
  - - [3136, 1984, 1, 512, 3136, 3136, 3136, 512]
    - [0, 13.124]
  - - [3264, 1984, 1, 512, 3264, 3264, 3264, 512]
    - [2, 13.093]
  - - [3392, 1984, 1, 512, 3392, 3392, 3392, 512]
    - [2, 13.122]
  - - [3520, 1984, 1, 512, 3520, 3520, 3520, 512]
    - [2, 13.155]
  - - [3648, 1984, 1, 512, 3648, 3648, 3648, 512]
    - [2, 13.167]
  - - [3776, 1984, 1, 512, 3776, 3776, 3776, 512]
    - [2, 13.178]
  - - [3904, 1984, 1, 512, 3904, 3904, 3904, 512]
    - [2, 13.211]
  - - [4032, 1984, 1, 512, 4032, 4032, 4032, 512]
    - [2, 13.201]
  - - [64, 2112, 1, 512, 64, 64, 64, 512]
    - [0, 8.92]
  - - [192, 2112, 1, 512, 192, 192, 192, 512]
    - [2, 11.376]
  - - [320, 2112, 1, 512, 320, 320, 320, 512]
    - [0, 11.722]
  - - [448, 2112, 1, 512, 448, 448, 448, 512]
    - [2, 12.155]
  - - [576, 2112, 1, 512, 576, 576, 576, 512]
    - [2, 12.315]
  - - [704, 2112, 1, 512, 704, 704, 704, 512]
    - [2, 12.641]
  - - [832, 2112, 1, 512, 832, 832, 832, 512]
    - [2, 12.68]
  - - [960, 2112, 1, 512, 960, 960, 960, 512]
    - [2, 12.828]
  - - [1088, 2112, 1, 512, 1088, 1088, 1088, 512]
    - [2, 12.803]
  - - [1216, 2112, 1, 512, 1216, 1216, 1216, 512]
    - [2, 12.968]
  - - [1344, 2112, 1, 512, 1344, 1344, 1344, 512]
    - [2, 12.983]
  - - [1472, 2112, 1, 512, 1472, 1472, 1472, 512]
    - [2, 12.954]
  - - [1600, 2112, 1, 512, 1600, 1600, 1600, 512]
    - [2, 13.092]
  - - [1728, 2112, 1, 512, 1728, 1728, 1728, 512]
    - [2, 13.088]
  - - [1856, 2112, 1, 512, 1856, 1856, 1856, 512]
    - [2, 13.138]
  - - [1984, 2112, 1, 512, 1984, 1984, 1984, 512]
    - [2, 13.159]
  - - [2112, 2112, 1, 512, 2112, 2112, 2112, 512]
    - [2, 12.96]
  - - [2240, 2112, 1, 512, 2240, 2240, 2240, 512]
    - [2, 13.017]
  - - [2368, 2112, 1, 512, 2368, 2368, 2368, 512]
    - [2, 13.032]
  - - [2496, 2112, 1, 512, 2496, 2496, 2496, 512]
    - [2, 13.067]
  - - [2624, 2112, 1, 512, 2624, 2624, 2624, 512]
    - [2, 13.112]
  - - [2752, 2112, 1, 512, 2752, 2752, 2752, 512]
    - [0, 13.063]
  - - [2880, 2112, 1, 512, 2880, 2880, 2880, 512]
    - [2, 13.081]
  - - [3008, 2112, 1, 512, 3008, 3008, 3008, 512]
    - [2, 13.15]
  - - [3136, 2112, 1, 512, 3136, 3136, 3136, 512]
    - [2, 13.147]
  - - [3264, 2112, 1, 512, 3264, 3264, 3264, 512]
    - [2, 13.186]
  - - [3392, 2112, 1, 512, 3392, 3392, 3392, 512]
    - [2, 13.187]
  - - [3520, 2112, 1, 512, 3520, 3520, 3520, 512]
    - [0, 13.223]
  - - [3648, 2112, 1, 512, 3648, 3648, 3648, 512]
    - [2, 13.157]
  - - [3776, 2112, 1, 512, 3776, 3776, 3776, 512]
    - [2, 13.235]
  - - [3904, 2112, 1, 512, 3904, 3904, 3904, 512]
    - [2, 13.193]
  - - [4032, 2112, 1, 512, 4032, 4032, 4032, 512]
    - [2, 13.246]
  - - [64, 2240, 1, 512, 64, 64, 64, 512]
    - [2, 9.326]
  - - [192, 2240, 1, 512, 192, 192, 192, 512]
    - [0, 11.818]
  - - [320, 2240, 1, 512, 320, 320, 320, 512]
    - [0, 11.572]
  - - [448, 2240, 1, 512, 448, 448, 448, 512]
    - [2, 12.264]
  - - [576, 2240, 1, 512, 576, 576, 576, 512]
    - [2, 12.466]
  - - [704, 2240, 1, 512, 704, 704, 704, 512]
    - [2, 12.624]
  - - [832, 2240, 1, 512, 832, 832, 832, 512]
    - [2, 12.679]
  - - [960, 2240, 1, 512, 960, 960, 960, 512]
    - [2, 12.838]
  - - [1088, 2240, 1, 512, 1088, 1088, 1088, 512]
    - [2, 12.881]
  - - [1216, 2240, 1, 512, 1216, 1216, 1216, 512]
    - [2, 12.965]
  - - [1344, 2240, 1, 512, 1344, 1344, 1344, 512]
    - [2, 13.045]
  - - [1472, 2240, 1, 512, 1472, 1472, 1472, 512]
    - [2, 13.058]
  - - [1600, 2240, 1, 512, 1600, 1600, 1600, 512]
    - [2, 13.082]
  - - [1728, 2240, 1, 512, 1728, 1728, 1728, 512]
    - [2, 13.098]
  - - [1856, 2240, 1, 512, 1856, 1856, 1856, 512]
    - [2, 13.171]
  - - [1984, 2240, 1, 512, 1984, 1984, 1984, 512]
    - [2, 12.981]
  - - [2112, 2240, 1, 512, 2112, 2112, 2112, 512]
    - [2, 12.99]
  - - [2240, 2240, 1, 512, 2240, 2240, 2240, 512]
    - [2, 13.007]
  - - [2368, 2240, 1, 512, 2368, 2368, 2368, 512]
    - [2, 13.092]
  - - [2496, 2240, 1, 512, 2496, 2496, 2496, 512]
    - [2, 13.043]
  - - [2624, 2240, 1, 512, 2624, 2624, 2624, 512]
    - [2, 13.072]
  - - [2752, 2240, 1, 512, 2752, 2752, 2752, 512]
    - [2, 13.113]
  - - [2880, 2240, 1, 512, 2880, 2880, 2880, 512]
    - [2, 13.13]
  - - [3008, 2240, 1, 512, 3008, 3008, 3008, 512]
    - [2, 13.141]
  - - [3136, 2240, 1, 512, 3136, 3136, 3136, 512]
    - [2, 13.165]
  - - [3264, 2240, 1, 512, 3264, 3264, 3264, 512]
    - [2, 13.18]
  - - [3392, 2240, 1, 512, 3392, 3392, 3392, 512]
    - [2, 13.16]
  - - [3520, 2240, 1, 512, 3520, 3520, 3520, 512]
    - [2, 13.19]
  - - [3648, 2240, 1, 512, 3648, 3648, 3648, 512]
    - [2, 13.248]
  - - [3776, 2240, 1, 512, 3776, 3776, 3776, 512]
    - [2, 13.225]
  - - [3904, 2240, 1, 512, 3904, 3904, 3904, 512]
    - [2, 13.243]
  - - [4032, 2240, 1, 512, 4032, 4032, 4032, 512]
    - [2, 13.213]
  - - [64, 2368, 1, 512, 64, 64, 64, 512]
    - [0, 9.936]
  - - [192, 2368, 1, 512, 192, 192, 192, 512]
    - [0, 11.746]
  - - [320, 2368, 1, 512, 320, 320, 320, 512]
    - [2, 11.841]
  - - [448, 2368, 1, 512, 448, 448, 448, 512]
    - [2, 12.157]
  - - [576, 2368, 1, 512, 576, 576, 576, 512]
    - [2, 12.482]
  - - [704, 2368, 1, 512, 704, 704, 704, 512]
    - [2, 12.653]
  - - [832, 2368, 1, 512, 832, 832, 832, 512]
    - [2, 12.762]
  - - [960, 2368, 1, 512, 960, 960, 960, 512]
    - [2, 12.82]
  - - [1088, 2368, 1, 512, 1088, 1088, 1088, 512]
    - [2, 12.908]
  - - [1216, 2368, 1, 512, 1216, 1216, 1216, 512]
    - [2, 13.0]
  - - [1344, 2368, 1, 512, 1344, 1344, 1344, 512]
    - [0, 12.987]
  - - [1472, 2368, 1, 512, 1472, 1472, 1472, 512]
    - [2, 13.105]
  - - [1600, 2368, 1, 512, 1600, 1600, 1600, 512]
    - [2, 13.147]
  - - [1728, 2368, 1, 512, 1728, 1728, 1728, 512]
    - [2, 13.122]
  - - [1856, 2368, 1, 512, 1856, 1856, 1856, 512]
    - [2, 12.942]
  - - [1984, 2368, 1, 512, 1984, 1984, 1984, 512]
    - [2, 13.002]
  - - [2112, 2368, 1, 512, 2112, 2112, 2112, 512]
    - [2, 13.023]
  - - [2240, 2368, 1, 512, 2240, 2240, 2240, 512]
    - [2, 13.051]
  - - [2368, 2368, 1, 512, 2368, 2368, 2368, 512]
    - [2, 13.073]
  - - [2496, 2368, 1, 512, 2496, 2496, 2496, 512]
    - [2, 13.117]
  - - [2624, 2368, 1, 512, 2624, 2624, 2624, 512]
    - [2, 13.117]
  - - [2752, 2368, 1, 512, 2752, 2752, 2752, 512]
    - [2, 13.103]
  - - [2880, 2368, 1, 512, 2880, 2880, 2880, 512]
    - [2, 13.145]
  - - [3008, 2368, 1, 512, 3008, 3008, 3008, 512]
    - [2, 13.163]
  - - [3136, 2368, 1, 512, 3136, 3136, 3136, 512]
    - [2, 13.149]
  - - [3264, 2368, 1, 512, 3264, 3264, 3264, 512]
    - [2, 13.197]
  - - [3392, 2368, 1, 512, 3392, 3392, 3392, 512]
    - [2, 13.195]
  - - [3520, 2368, 1, 512, 3520, 3520, 3520, 512]
    - [2, 13.246]
  - - [3648, 2368, 1, 512, 3648, 3648, 3648, 512]
    - [2, 13.266]
  - - [3776, 2368, 1, 512, 3776, 3776, 3776, 512]
    - [2, 13.256]
  - - [3904, 2368, 1, 512, 3904, 3904, 3904, 512]
    - [2, 13.248]
  - - [4032, 2368, 1, 512, 4032, 4032, 4032, 512]
    - [2, 13.277]
  - - [64, 2496, 1, 512, 64, 64, 64, 512]
    - [2, 9.644]
  - - [192, 2496, 1, 512, 192, 192, 192, 512]
    - [0, 11.705]
  - - [320, 2496, 1, 512, 320, 320, 320, 512]
    - [2, 11.97]
  - - [448, 2496, 1, 512, 448, 448, 448, 512]
    - [2, 12.205]
  - - [576, 2496, 1, 512, 576, 576, 576, 512]
    - [2, 12.498]
  - - [704, 2496, 1, 512, 704, 704, 704, 512]
    - [2, 12.677]
  - - [832, 2496, 1, 512, 832, 832, 832, 512]
    - [2, 12.808]
  - - [960, 2496, 1, 512, 960, 960, 960, 512]
    - [2, 12.894]
  - - [1088, 2496, 1, 512, 1088, 1088, 1088, 512]
    - [2, 12.909]
  - - [1216, 2496, 1, 512, 1216, 1216, 1216, 512]
    - [2, 13.017]
  - - [1344, 2496, 1, 512, 1344, 1344, 1344, 512]
    - [2, 13.049]
  - - [1472, 2496, 1, 512, 1472, 1472, 1472, 512]
    - [2, 13.015]
  - - [1600, 2496, 1, 512, 1600, 1600, 1600, 512]
    - [2, 13.11]
  - - [1728, 2496, 1, 512, 1728, 1728, 1728, 512]
    - [2, 12.933]
  - - [1856, 2496, 1, 512, 1856, 1856, 1856, 512]
    - [2, 12.95]
  - - [1984, 2496, 1, 512, 1984, 1984, 1984, 512]
    - [2, 13.043]
  - - [2112, 2496, 1, 512, 2112, 2112, 2112, 512]
    - [2, 13.034]
  - - [2240, 2496, 1, 512, 2240, 2240, 2240, 512]
    - [2, 13.046]
  - - [2368, 2496, 1, 512, 2368, 2368, 2368, 512]
    - [2, 13.074]
  - - [2496, 2496, 1, 512, 2496, 2496, 2496, 512]
    - [2, 13.09]
  - - [2624, 2496, 1, 512, 2624, 2624, 2624, 512]
    - [2, 13.182]
  - - [2752, 2496, 1, 512, 2752, 2752, 2752, 512]
    - [2, 13.129]
  - - [2880, 2496, 1, 512, 2880, 2880, 2880, 512]
    - [2, 13.169]
  - - [3008, 2496, 1, 512, 3008, 3008, 3008, 512]
    - [2, 13.19]
  - - [3136, 2496, 1, 512, 3136, 3136, 3136, 512]
    - [2, 13.192]
  - - [3264, 2496, 1, 512, 3264, 3264, 3264, 512]
    - [2, 13.25]
  - - [3392, 2496, 1, 512, 3392, 3392, 3392, 512]
    - [2, 13.226]
  - - [3520, 2496, 1, 512, 3520, 3520, 3520, 512]
    - [2, 13.243]
  - - [3648, 2496, 1, 512, 3648, 3648, 3648, 512]
    - [2, 13.246]
  - - [3776, 2496, 1, 512, 3776, 3776, 3776, 512]
    - [2, 13.27]
  - - [3904, 2496, 1, 512, 3904, 3904, 3904, 512]
    - [2, 13.244]
  - - [4032, 2496, 1, 512, 4032, 4032, 4032, 512]
    - [2, 13.263]
  - - [64, 2624, 1, 512, 64, 64, 64, 512]
    - [2, 10.063]
  - - [192, 2624, 1, 512, 192, 192, 192, 512]
    - [2, 11.736]
  - - [320, 2624, 1, 512, 320, 320, 320, 512]
    - [2, 11.884]
  - - [448, 2624, 1, 512, 448, 448, 448, 512]
    - [2, 12.375]
  - - [576, 2624, 1, 512, 576, 576, 576, 512]
    - [2, 12.634]
  - - [704, 2624, 1, 512, 704, 704, 704, 512]
    - [2, 12.735]
  - - [832, 2624, 1, 512, 832, 832, 832, 512]
    - [2, 12.882]
  - - [960, 2624, 1, 512, 960, 960, 960, 512]
    - [2, 12.936]
  - - [1088, 2624, 1, 512, 1088, 1088, 1088, 512]
    - [2, 12.976]
  - - [1216, 2624, 1, 512, 1216, 1216, 1216, 512]
    - [2, 13.026]
  - - [1344, 2624, 1, 512, 1344, 1344, 1344, 512]
    - [2, 13.048]
  - - [1472, 2624, 1, 512, 1472, 1472, 1472, 512]
    - [2, 13.11]
  - - [1600, 2624, 1, 512, 1600, 1600, 1600, 512]
    - [2, 13.133]
  - - [1728, 2624, 1, 512, 1728, 1728, 1728, 512]
    - [2, 12.973]
  - - [1856, 2624, 1, 512, 1856, 1856, 1856, 512]
    - [2, 12.989]
  - - [1984, 2624, 1, 512, 1984, 1984, 1984, 512]
    - [2, 13.025]
  - - [2112, 2624, 1, 512, 2112, 2112, 2112, 512]
    - [2, 13.077]
  - - [2240, 2624, 1, 512, 2240, 2240, 2240, 512]
    - [2, 13.118]
  - - [2368, 2624, 1, 512, 2368, 2368, 2368, 512]
    - [2, 13.125]
  - - [2496, 2624, 1, 512, 2496, 2496, 2496, 512]
    - [2, 13.118]
  - - [2624, 2624, 1, 512, 2624, 2624, 2624, 512]
    - [2, 13.144]
  - - [2752, 2624, 1, 512, 2752, 2752, 2752, 512]
    - [2, 13.178]
  - - [2880, 2624, 1, 512, 2880, 2880, 2880, 512]
    - [2, 13.179]
  - - [3008, 2624, 1, 512, 3008, 3008, 3008, 512]
    - [2, 13.188]
  - - [3136, 2624, 1, 512, 3136, 3136, 3136, 512]
    - [2, 13.222]
  - - [3264, 2624, 1, 512, 3264, 3264, 3264, 512]
    - [2, 13.217]
  - - [3392, 2624, 1, 512, 3392, 3392, 3392, 512]
    - [2, 13.221]
  - - [3520, 2624, 1, 512, 3520, 3520, 3520, 512]
    - [2, 13.276]
  - - [3648, 2624, 1, 512, 3648, 3648, 3648, 512]
    - [2, 13.267]
  - - [3776, 2624, 1, 512, 3776, 3776, 3776, 512]
    - [2, 13.272]
  - - [3904, 2624, 1, 512, 3904, 3904, 3904, 512]
    - [2, 13.279]
  - - [4032, 2624, 1, 512, 4032, 4032, 4032, 512]
    - [2, 13.284]
  - - [64, 2752, 1, 512, 64, 64, 64, 512]
    - [2, 9.994]
  - - [192, 2752, 1, 512, 192, 192, 192, 512]
    - [2, 11.039]
  - - [320, 2752, 1, 512, 320, 320, 320, 512]
    - [2, 12.122]
  - - [448, 2752, 1, 512, 448, 448, 448, 512]
    - [0, 12.383]
  - - [576, 2752, 1, 512, 576, 576, 576, 512]
    - [2, 12.601]
  - - [704, 2752, 1, 512, 704, 704, 704, 512]
    - [2, 12.792]
  - - [832, 2752, 1, 512, 832, 832, 832, 512]
    - [2, 12.848]
  - - [960, 2752, 1, 512, 960, 960, 960, 512]
    - [2, 12.953]
  - - [1088, 2752, 1, 512, 1088, 1088, 1088, 512]
    - [2, 13.033]
  - - [1216, 2752, 1, 512, 1216, 1216, 1216, 512]
    - [2, 13.033]
  - - [1344, 2752, 1, 512, 1344, 1344, 1344, 512]
    - [2, 13.058]
  - - [1472, 2752, 1, 512, 1472, 1472, 1472, 512]
    - [2, 13.144]
  - - [1600, 2752, 1, 512, 1600, 1600, 1600, 512]
    - [2, 12.951]
  - - [1728, 2752, 1, 512, 1728, 1728, 1728, 512]
    - [2, 12.992]
  - - [1856, 2752, 1, 512, 1856, 1856, 1856, 512]
    - [2, 13.033]
  - - [1984, 2752, 1, 512, 1984, 1984, 1984, 512]
    - [2, 13.061]
  - - [2112, 2752, 1, 512, 2112, 2112, 2112, 512]
    - [2, 13.071]
  - - [2240, 2752, 1, 512, 2240, 2240, 2240, 512]
    - [2, 13.127]
  - - [2368, 2752, 1, 512, 2368, 2368, 2368, 512]
    - [2, 13.148]
  - - [2496, 2752, 1, 512, 2496, 2496, 2496, 512]
    - [2, 13.13]
  - - [2624, 2752, 1, 512, 2624, 2624, 2624, 512]
    - [2, 13.184]
  - - [2752, 2752, 1, 512, 2752, 2752, 2752, 512]
    - [2, 13.167]
  - - [2880, 2752, 1, 512, 2880, 2880, 2880, 512]
    - [2, 13.236]
  - - [3008, 2752, 1, 512, 3008, 3008, 3008, 512]
    - [2, 13.217]
  - - [3136, 2752, 1, 512, 3136, 3136, 3136, 512]
    - [2, 13.238]
  - - [3264, 2752, 1, 512, 3264, 3264, 3264, 512]
    - [2, 13.264]
  - - [3392, 2752, 1, 512, 3392, 3392, 3392, 512]
    - [2, 13.255]
  - - [3520, 2752, 1, 512, 3520, 3520, 3520, 512]
    - [2, 13.278]
  - - [3648, 2752, 1, 512, 3648, 3648, 3648, 512]
    - [2, 13.261]
  - - [3776, 2752, 1, 512, 3776, 3776, 3776, 512]
    - [2, 13.294]
  - - [3904, 2752, 1, 512, 3904, 3904, 3904, 512]
    - [2, 13.302]
  - - [4032, 2752, 1, 512, 4032, 4032, 4032, 512]
    - [2, 13.302]
  - - [64, 2880, 1, 512, 64, 64, 64, 512]
    - [0, 10.485]
  - - [192, 2880, 1, 512, 192, 192, 192, 512]
    - [2, 11.348]
  - - [320, 2880, 1, 512, 320, 320, 320, 512]
    - [0, 12.078]
  - - [448, 2880, 1, 512, 448, 448, 448, 512]
    - [2, 12.512]
  - - [576, 2880, 1, 512, 576, 576, 576, 512]
    - [2, 12.596]
  - - [704, 2880, 1, 512, 704, 704, 704, 512]
    - [2, 12.793]
  - - [832, 2880, 1, 512, 832, 832, 832, 512]
    - [0, 12.901]
  - - [960, 2880, 1, 512, 960, 960, 960, 512]
    - [2, 12.972]
  - - [1088, 2880, 1, 512, 1088, 1088, 1088, 512]
    - [2, 13.017]
  - - [1216, 2880, 1, 512, 1216, 1216, 1216, 512]
    - [2, 13.059]
  - - [1344, 2880, 1, 512, 1344, 1344, 1344, 512]
    - [2, 13.142]
  - - [1472, 2880, 1, 512, 1472, 1472, 1472, 512]
    - [2, 13.144]
  - - [1600, 2880, 1, 512, 1600, 1600, 1600, 512]
    - [2, 12.953]
  - - [1728, 2880, 1, 512, 1728, 1728, 1728, 512]
    - [0, 12.997]
  - - [1856, 2880, 1, 512, 1856, 1856, 1856, 512]
    - [2, 13.084]
  - - [1984, 2880, 1, 512, 1984, 1984, 1984, 512]
    - [2, 13.094]
  - - [2112, 2880, 1, 512, 2112, 2112, 2112, 512]
    - [2, 13.085]
  - - [2240, 2880, 1, 512, 2240, 2240, 2240, 512]
    - [2, 13.15]
  - - [2368, 2880, 1, 512, 2368, 2368, 2368, 512]
    - [2, 13.104]
  - - [2496, 2880, 1, 512, 2496, 2496, 2496, 512]
    - [2, 13.173]
  - - [2624, 2880, 1, 512, 2624, 2624, 2624, 512]
    - [2, 13.176]
  - - [2752, 2880, 1, 512, 2752, 2752, 2752, 512]
    - [2, 13.2]
  - - [2880, 2880, 1, 512, 2880, 2880, 2880, 512]
    - [2, 13.219]
  - - [3008, 2880, 1, 512, 3008, 3008, 3008, 512]
    - [2, 13.223]
  - - [3136, 2880, 1, 512, 3136, 3136, 3136, 512]
    - [2, 13.266]
  - - [3264, 2880, 1, 512, 3264, 3264, 3264, 512]
    - [2, 13.261]
  - - [3392, 2880, 1, 512, 3392, 3392, 3392, 512]
    - [2, 13.255]
  - - [3520, 2880, 1, 512, 3520, 3520, 3520, 512]
    - [2, 13.261]
  - - [3648, 2880, 1, 512, 3648, 3648, 3648, 512]
    - [2, 13.281]
  - - [3776, 2880, 1, 512, 3776, 3776, 3776, 512]
    - [2, 13.321]
  - - [3904, 2880, 1, 512, 3904, 3904, 3904, 512]
    - [2, 13.308]
  - - [4032, 2880, 1, 512, 4032, 4032, 4032, 512]
    - [2, 13.301]
  - - [64, 3008, 1, 512, 64, 64, 64, 512]
    - [2, 10.017]
  - - [192, 3008, 1, 512, 192, 192, 192, 512]
    - [2, 11.46]
  - - [320, 3008, 1, 512, 320, 320, 320, 512]
    - [2, 12.048]
  - - [448, 3008, 1, 512, 448, 448, 448, 512]
    - [2, 12.559]
  - - [576, 3008, 1, 512, 576, 576, 576, 512]
    - [2, 12.662]
  - - [704, 3008, 1, 512, 704, 704, 704, 512]
    - [2, 12.834]
  - - [832, 3008, 1, 512, 832, 832, 832, 512]
    - [2, 12.861]
  - - [960, 3008, 1, 512, 960, 960, 960, 512]
    - [2, 13.008]
  - - [1088, 3008, 1, 512, 1088, 1088, 1088, 512]
    - [2, 13.066]
  - - [1216, 3008, 1, 512, 1216, 1216, 1216, 512]
    - [2, 13.067]
  - - [1344, 3008, 1, 512, 1344, 1344, 1344, 512]
    - [2, 13.15]
  - - [1472, 3008, 1, 512, 1472, 1472, 1472, 512]
    - [2, 12.93]
  - - [1600, 3008, 1, 512, 1600, 1600, 1600, 512]
    - [2, 12.983]
  - - [1728, 3008, 1, 512, 1728, 1728, 1728, 512]
    - [2, 13.062]
  - - [1856, 3008, 1, 512, 1856, 1856, 1856, 512]
    - [2, 13.083]
  - - [1984, 3008, 1, 512, 1984, 1984, 1984, 512]
    - [2, 13.1]
  - - [2112, 3008, 1, 512, 2112, 2112, 2112, 512]
    - [2, 13.092]
  - - [2240, 3008, 1, 512, 2240, 2240, 2240, 512]
    - [2, 13.116]
  - - [2368, 3008, 1, 512, 2368, 2368, 2368, 512]
    - [2, 13.166]
  - - [2496, 3008, 1, 512, 2496, 2496, 2496, 512]
    - [2, 13.182]
  - - [2624, 3008, 1, 512, 2624, 2624, 2624, 512]
    - [2, 13.186]
  - - [2752, 3008, 1, 512, 2752, 2752, 2752, 512]
    - [2, 13.207]
  - - [2880, 3008, 1, 512, 2880, 2880, 2880, 512]
    - [2, 13.259]
  - - [3008, 3008, 1, 512, 3008, 3008, 3008, 512]
    - [2, 13.26]
  - - [3136, 3008, 1, 512, 3136, 3136, 3136, 512]
    - [2, 13.268]
  - - [3264, 3008, 1, 512, 3264, 3264, 3264, 512]
    - [2, 13.287]
  - - [3392, 3008, 1, 512, 3392, 3392, 3392, 512]
    - [2, 13.281]
  - - [3520, 3008, 1, 512, 3520, 3520, 3520, 512]
    - [2, 13.299]
  - - [3648, 3008, 1, 512, 3648, 3648, 3648, 512]
    - [2, 13.32]
  - - [3776, 3008, 1, 512, 3776, 3776, 3776, 512]
    - [2, 13.323]
  - - [3904, 3008, 1, 512, 3904, 3904, 3904, 512]
    - [2, 13.324]
  - - [4032, 3008, 1, 512, 4032, 4032, 4032, 512]
    - [2, 13.32]
  - - [64, 3136, 1, 512, 64, 64, 64, 512]
    - [2, 10.156]
  - - [192, 3136, 1, 512, 192, 192, 192, 512]
    - [2, 11.513]
  - - [320, 3136, 1, 512, 320, 320, 320, 512]
    - [2, 12.23]
  - - [448, 3136, 1, 512, 448, 448, 448, 512]
    - [2, 12.463]
  - - [576, 3136, 1, 512, 576, 576, 576, 512]
    - [2, 12.749]
  - - [704, 3136, 1, 512, 704, 704, 704, 512]
    - [2, 12.801]
  - - [832, 3136, 1, 512, 832, 832, 832, 512]
    - [2, 12.969]
  - - [960, 3136, 1, 512, 960, 960, 960, 512]
    - [2, 12.995]
  - - [1088, 3136, 1, 512, 1088, 1088, 1088, 512]
    - [2, 13.107]
  - - [1216, 3136, 1, 512, 1216, 1216, 1216, 512]
    - [2, 13.116]
  - - [1344, 3136, 1, 512, 1344, 1344, 1344, 512]
    - [2, 13.187]
  - - [1472, 3136, 1, 512, 1472, 1472, 1472, 512]
    - [2, 13.001]
  - - [1600, 3136, 1, 512, 1600, 1600, 1600, 512]
    - [2, 13.043]
  - - [1728, 3136, 1, 512, 1728, 1728, 1728, 512]
    - [2, 13.031]
  - - [1856, 3136, 1, 512, 1856, 1856, 1856, 512]
    - [2, 13.082]
  - - [1984, 3136, 1, 512, 1984, 1984, 1984, 512]
    - [2, 13.132]
  - - [2112, 3136, 1, 512, 2112, 2112, 2112, 512]
    - [2, 13.151]
  - - [2240, 3136, 1, 512, 2240, 2240, 2240, 512]
    - [2, 13.142]
  - - [2368, 3136, 1, 512, 2368, 2368, 2368, 512]
    - [2, 13.154]
  - - [2496, 3136, 1, 512, 2496, 2496, 2496, 512]
    - [2, 13.201]
  - - [2624, 3136, 1, 512, 2624, 2624, 2624, 512]
    - [2, 13.232]
  - - [2752, 3136, 1, 512, 2752, 2752, 2752, 512]
    - [2, 13.243]
  - - [2880, 3136, 1, 512, 2880, 2880, 2880, 512]
    - [0, 13.246]
  - - [3008, 3136, 1, 512, 3008, 3008, 3008, 512]
    - [2, 13.26]
  - - [3136, 3136, 1, 512, 3136, 3136, 3136, 512]
    - [2, 13.256]
  - - [3264, 3136, 1, 512, 3264, 3264, 3264, 512]
    - [2, 13.271]
  - - [3392, 3136, 1, 512, 3392, 3392, 3392, 512]
    - [2, 13.291]
  - - [3520, 3136, 1, 512, 3520, 3520, 3520, 512]
    - [2, 13.293]
  - - [3648, 3136, 1, 512, 3648, 3648, 3648, 512]
    - [2, 13.339]
  - - [3776, 3136, 1, 512, 3776, 3776, 3776, 512]
    - [2, 13.336]
  - - [3904, 3136, 1, 512, 3904, 3904, 3904, 512]
    - [2, 13.316]
  - - [4032, 3136, 1, 512, 4032, 4032, 4032, 512]
    - [2, 13.352]
  - - [64, 3264, 1, 512, 64, 64, 64, 512]
    - [0, 10.516]
  - - [192, 3264, 1, 512, 192, 192, 192, 512]
    - [2, 11.487]
  - - [320, 3264, 1, 512, 320, 320, 320, 512]
    - [0, 12.202]
  - - [448, 3264, 1, 512, 448, 448, 448, 512]
    - [2, 12.472]
  - - [576, 3264, 1, 512, 576, 576, 576, 512]
    - [2, 12.72]
  - - [704, 3264, 1, 512, 704, 704, 704, 512]
    - [2, 12.849]
  - - [832, 3264, 1, 512, 832, 832, 832, 512]
    - [2, 12.996]
  - - [960, 3264, 1, 512, 960, 960, 960, 512]
    - [2, 12.98]
  - - [1088, 3264, 1, 512, 1088, 1088, 1088, 512]
    - [2, 13.106]
  - - [1216, 3264, 1, 512, 1216, 1216, 1216, 512]
    - [2, 13.131]
  - - [1344, 3264, 1, 512, 1344, 1344, 1344, 512]
    - [2, 12.99]
  - - [1472, 3264, 1, 512, 1472, 1472, 1472, 512]
    - [2, 12.98]
  - - [1600, 3264, 1, 512, 1600, 1600, 1600, 512]
    - [2, 13.063]
  - - [1728, 3264, 1, 512, 1728, 1728, 1728, 512]
    - [2, 13.049]
  - - [1856, 3264, 1, 512, 1856, 1856, 1856, 512]
    - [2, 13.103]
  - - [1984, 3264, 1, 512, 1984, 1984, 1984, 512]
    - [2, 13.156]
  - - [2112, 3264, 1, 512, 2112, 2112, 2112, 512]
    - [2, 13.161]
  - - [2240, 3264, 1, 512, 2240, 2240, 2240, 512]
    - [2, 13.145]
  - - [2368, 3264, 1, 512, 2368, 2368, 2368, 512]
    - [2, 13.15]
  - - [2496, 3264, 1, 512, 2496, 2496, 2496, 512]
    - [2, 13.224]
  - - [2624, 3264, 1, 512, 2624, 2624, 2624, 512]
    - [2, 13.232]
  - - [2752, 3264, 1, 512, 2752, 2752, 2752, 512]
    - [2, 13.246]
  - - [2880, 3264, 1, 512, 2880, 2880, 2880, 512]
    - [2, 13.265]
  - - [3008, 3264, 1, 512, 3008, 3008, 3008, 512]
    - [2, 13.283]
  - - [3136, 3264, 1, 512, 3136, 3136, 3136, 512]
    - [2, 13.286]
  - - [3264, 3264, 1, 512, 3264, 3264, 3264, 512]
    - [2, 13.294]
  - - [3392, 3264, 1, 512, 3392, 3392, 3392, 512]
    - [2, 13.304]
  - - [3520, 3264, 1, 512, 3520, 3520, 3520, 512]
    - [2, 13.298]
  - - [3648, 3264, 1, 512, 3648, 3648, 3648, 512]
    - [2, 13.328]
  - - [3776, 3264, 1, 512, 3776, 3776, 3776, 512]
    - [2, 13.345]
  - - [3904, 3264, 1, 512, 3904, 3904, 3904, 512]
    - [2, 13.319]
  - - [4032, 3264, 1, 512, 4032, 4032, 4032, 512]
    - [2, 13.334]
  - - [64, 3392, 1, 512, 64, 64, 64, 512]
    - [2, 10.343]
  - - [192, 3392, 1, 512, 192, 192, 192, 512]
    - [2, 11.634]
  - - [320, 3392, 1, 512, 320, 320, 320, 512]
    - [2, 12.42]
  - - [448, 3392, 1, 512, 448, 448, 448, 512]
    - [2, 12.542]
  - - [576, 3392, 1, 512, 576, 576, 576, 512]
    - [2, 12.815]
  - - [704, 3392, 1, 512, 704, 704, 704, 512]
    - [2, 12.879]
  - - [832, 3392, 1, 512, 832, 832, 832, 512]
    - [2, 12.964]
  - - [960, 3392, 1, 512, 960, 960, 960, 512]
    - [2, 13.031]
  - - [1088, 3392, 1, 512, 1088, 1088, 1088, 512]
    - [2, 13.112]
  - - [1216, 3392, 1, 512, 1216, 1216, 1216, 512]
    - [2, 13.11]
  - - [1344, 3392, 1, 512, 1344, 1344, 1344, 512]
    - [2, 12.984]
  - - [1472, 3392, 1, 512, 1472, 1472, 1472, 512]
    - [2, 13.049]
  - - [1600, 3392, 1, 512, 1600, 1600, 1600, 512]
    - [2, 13.035]
  - - [1728, 3392, 1, 512, 1728, 1728, 1728, 512]
    - [2, 13.113]
  - - [1856, 3392, 1, 512, 1856, 1856, 1856, 512]
    - [2, 13.058]
  - - [1984, 3392, 1, 512, 1984, 1984, 1984, 512]
    - [2, 13.132]
  - - [2112, 3392, 1, 512, 2112, 2112, 2112, 512]
    - [2, 13.14]
  - - [2240, 3392, 1, 512, 2240, 2240, 2240, 512]
    - [2, 13.202]
  - - [2368, 3392, 1, 512, 2368, 2368, 2368, 512]
    - [2, 13.222]
  - - [2496, 3392, 1, 512, 2496, 2496, 2496, 512]
    - [2, 13.247]
  - - [2624, 3392, 1, 512, 2624, 2624, 2624, 512]
    - [2, 13.223]
  - - [2752, 3392, 1, 512, 2752, 2752, 2752, 512]
    - [2, 13.238]
  - - [2880, 3392, 1, 512, 2880, 2880, 2880, 512]
    - [2, 13.273]
  - - [3008, 3392, 1, 512, 3008, 3008, 3008, 512]
    - [2, 13.279]
  - - [3136, 3392, 1, 512, 3136, 3136, 3136, 512]
    - [2, 13.289]
  - - [3264, 3392, 1, 512, 3264, 3264, 3264, 512]
    - [2, 13.318]
  - - [3392, 3392, 1, 512, 3392, 3392, 3392, 512]
    - [2, 13.331]
  - - [3520, 3392, 1, 512, 3520, 3520, 3520, 512]
    - [2, 13.317]
  - - [3648, 3392, 1, 512, 3648, 3648, 3648, 512]
    - [2, 13.326]
  - - [3776, 3392, 1, 512, 3776, 3776, 3776, 512]
    - [2, 13.326]
  - - [3904, 3392, 1, 512, 3904, 3904, 3904, 512]
    - [2, 13.336]
  - - [4032, 3392, 1, 512, 4032, 4032, 4032, 512]
    - [2, 13.348]
  - - [64, 3520, 1, 512, 64, 64, 64, 512]
    - [2, 10.318]
  - - [192, 3520, 1, 512, 192, 192, 192, 512]
    - [0, 11.73]
  - - [320, 3520, 1, 512, 320, 320, 320, 512]
    - [2, 12.248]
  - - [448, 3520, 1, 512, 448, 448, 448, 512]
    - [2, 12.614]
  - - [576, 3520, 1, 512, 576, 576, 576, 512]
    - [2, 12.775]
  - - [704, 3520, 1, 512, 704, 704, 704, 512]
    - [2, 12.899]
  - - [832, 3520, 1, 512, 832, 832, 832, 512]
    - [2, 12.988]
  - - [960, 3520, 1, 512, 960, 960, 960, 512]
    - [2, 13.042]
  - - [1088, 3520, 1, 512, 1088, 1088, 1088, 512]
    - [2, 13.156]
  - - [1216, 3520, 1, 512, 1216, 1216, 1216, 512]
    - [2, 13.053]
  - - [1344, 3520, 1, 512, 1344, 1344, 1344, 512]
    - [2, 12.997]
  - - [1472, 3520, 1, 512, 1472, 1472, 1472, 512]
    - [2, 13.043]
  - - [1600, 3520, 1, 512, 1600, 1600, 1600, 512]
    - [2, 13.108]
  - - [1728, 3520, 1, 512, 1728, 1728, 1728, 512]
    - [2, 13.115]
  - - [1856, 3520, 1, 512, 1856, 1856, 1856, 512]
    - [2, 13.129]
  - - [1984, 3520, 1, 512, 1984, 1984, 1984, 512]
    - [2, 13.181]
  - - [2112, 3520, 1, 512, 2112, 2112, 2112, 512]
    - [2, 13.181]
  - - [2240, 3520, 1, 512, 2240, 2240, 2240, 512]
    - [2, 13.214]
  - - [2368, 3520, 1, 512, 2368, 2368, 2368, 512]
    - [2, 13.206]
  - - [2496, 3520, 1, 512, 2496, 2496, 2496, 512]
    - [2, 13.242]
  - - [2624, 3520, 1, 512, 2624, 2624, 2624, 512]
    - [2, 13.278]
  - - [2752, 3520, 1, 512, 2752, 2752, 2752, 512]
    - [2, 13.279]
  - - [2880, 3520, 1, 512, 2880, 2880, 2880, 512]
    - [2, 13.264]
  - - [3008, 3520, 1, 512, 3008, 3008, 3008, 512]
    - [2, 13.299]
  - - [3136, 3520, 1, 512, 3136, 3136, 3136, 512]
    - [2, 13.3]
  - - [3264, 3520, 1, 512, 3264, 3264, 3264, 512]
    - [2, 13.317]
  - - [3392, 3520, 1, 512, 3392, 3392, 3392, 512]
    - [2, 13.306]
  - - [3520, 3520, 1, 512, 3520, 3520, 3520, 512]
    - [2, 13.309]
  - - [3648, 3520, 1, 512, 3648, 3648, 3648, 512]
    - [2, 13.348]
  - - [3776, 3520, 1, 512, 3776, 3776, 3776, 512]
    - [2, 13.322]
  - - [3904, 3520, 1, 512, 3904, 3904, 3904, 512]
    - [2, 13.332]
  - - [4032, 3520, 1, 512, 4032, 4032, 4032, 512]
    - [2, 13.345]
  - - [64, 3648, 1, 512, 64, 64, 64, 512]
    - [0, 10.505]
  - - [192, 3648, 1, 512, 192, 192, 192, 512]
    - [2, 11.715]
  - - [320, 3648, 1, 512, 320, 320, 320, 512]
    - [2, 12.338]
  - - [448, 3648, 1, 512, 448, 448, 448, 512]
    - [2, 12.631]
  - - [576, 3648, 1, 512, 576, 576, 576, 512]
    - [2, 12.854]
  - - [704, 3648, 1, 512, 704, 704, 704, 512]
    - [2, 12.957]
  - - [832, 3648, 1, 512, 832, 832, 832, 512]
    - [2, 12.982]
  - - [960, 3648, 1, 512, 960, 960, 960, 512]
    - [2, 13.053]
  - - [1088, 3648, 1, 512, 1088, 1088, 1088, 512]
    - [2, 13.136]
  - - [1216, 3648, 1, 512, 1216, 1216, 1216, 512]
    - [2, 12.959]
  - - [1344, 3648, 1, 512, 1344, 1344, 1344, 512]
    - [2, 13.019]
  - - [1472, 3648, 1, 512, 1472, 1472, 1472, 512]
    - [2, 13.024]
  - - [1600, 3648, 1, 512, 1600, 1600, 1600, 512]
    - [2, 13.091]
  - - [1728, 3648, 1, 512, 1728, 1728, 1728, 512]
    - [2, 13.103]
  - - [1856, 3648, 1, 512, 1856, 1856, 1856, 512]
    - [2, 13.159]
  - - [1984, 3648, 1, 512, 1984, 1984, 1984, 512]
    - [2, 13.163]
  - - [2112, 3648, 1, 512, 2112, 2112, 2112, 512]
    - [2, 13.204]
  - - [2240, 3648, 1, 512, 2240, 2240, 2240, 512]
    - [2, 13.228]
  - - [2368, 3648, 1, 512, 2368, 2368, 2368, 512]
    - [2, 13.236]
  - - [2496, 3648, 1, 512, 2496, 2496, 2496, 512]
    - [2, 13.258]
  - - [2624, 3648, 1, 512, 2624, 2624, 2624, 512]
    - [2, 13.271]
  - - [2752, 3648, 1, 512, 2752, 2752, 2752, 512]
    - [2, 13.265]
  - - [2880, 3648, 1, 512, 2880, 2880, 2880, 512]
    - [2, 13.272]
  - - [3008, 3648, 1, 512, 3008, 3008, 3008, 512]
    - [2, 13.312]
  - - [3136, 3648, 1, 512, 3136, 3136, 3136, 512]
    - [2, 13.279]
  - - [3264, 3648, 1, 512, 3264, 3264, 3264, 512]
    - [2, 13.315]
  - - [3392, 3648, 1, 512, 3392, 3392, 3392, 512]
    - [2, 13.332]
  - - [3520, 3648, 1, 512, 3520, 3520, 3520, 512]
    - [2, 13.341]
  - - [3648, 3648, 1, 512, 3648, 3648, 3648, 512]
    - [2, 13.303]
  - - [3776, 3648, 1, 512, 3776, 3776, 3776, 512]
    - [2, 13.352]
  - - [3904, 3648, 1, 512, 3904, 3904, 3904, 512]
    - [2, 13.357]
  - - [4032, 3648, 1, 512, 4032, 4032, 4032, 512]
    - [2, 13.345]
  - - [64, 3776, 1, 512, 64, 64, 64, 512]
    - [0, 10.829]
  - - [192, 3776, 1, 512, 192, 192, 192, 512]
    - [2, 11.795]
  - - [320, 3776, 1, 512, 320, 320, 320, 512]
    - [2, 12.38]
  - - [448, 3776, 1, 512, 448, 448, 448, 512]
    - [2, 12.686]
  - - [576, 3776, 1, 512, 576, 576, 576, 512]
    - [2, 12.852]
  - - [704, 3776, 1, 512, 704, 704, 704, 512]
    - [2, 12.96]
  - - [832, 3776, 1, 512, 832, 832, 832, 512]
    - [2, 13.108]
  - - [960, 3776, 1, 512, 960, 960, 960, 512]
    - [2, 13.093]
  - - [1088, 3776, 1, 512, 1088, 1088, 1088, 512]
    - [2, 13.143]
  - - [1216, 3776, 1, 512, 1216, 1216, 1216, 512]
    - [2, 12.981]
  - - [1344, 3776, 1, 512, 1344, 1344, 1344, 512]
    - [2, 13.013]
  - - [1472, 3776, 1, 512, 1472, 1472, 1472, 512]
    - [2, 13.042]
  - - [1600, 3776, 1, 512, 1600, 1600, 1600, 512]
    - [2, 13.078]
  - - [1728, 3776, 1, 512, 1728, 1728, 1728, 512]
    - [2, 13.137]
  - - [1856, 3776, 1, 512, 1856, 1856, 1856, 512]
    - [2, 13.144]
  - - [1984, 3776, 1, 512, 1984, 1984, 1984, 512]
    - [2, 13.205]
  - - [2112, 3776, 1, 512, 2112, 2112, 2112, 512]
    - [2, 13.188]
  - - [2240, 3776, 1, 512, 2240, 2240, 2240, 512]
    - [2, 13.251]
  - - [2368, 3776, 1, 512, 2368, 2368, 2368, 512]
    - [2, 13.269]
  - - [2496, 3776, 1, 512, 2496, 2496, 2496, 512]
    - [2, 13.251]
  - - [2624, 3776, 1, 512, 2624, 2624, 2624, 512]
    - [2, 13.282]
  - - [2752, 3776, 1, 512, 2752, 2752, 2752, 512]
    - [2, 13.273]
  - - [2880, 3776, 1, 512, 2880, 2880, 2880, 512]
    - [2, 13.291]
  - - [3008, 3776, 1, 512, 3008, 3008, 3008, 512]
    - [2, 13.278]
  - - [3136, 3776, 1, 512, 3136, 3136, 3136, 512]
    - [2, 13.313]
  - - [3264, 3776, 1, 512, 3264, 3264, 3264, 512]
    - [2, 13.332]
  - - [3392, 3776, 1, 512, 3392, 3392, 3392, 512]
    - [2, 13.33]
  - - [3520, 3776, 1, 512, 3520, 3520, 3520, 512]
    - [2, 13.34]
  - - [3648, 3776, 1, 512, 3648, 3648, 3648, 512]
    - [2, 13.354]
  - - [3776, 3776, 1, 512, 3776, 3776, 3776, 512]
    - [2, 13.346]
  - - [3904, 3776, 1, 512, 3904, 3904, 3904, 512]
    - [2, 13.372]
  - - [4032, 3776, 1, 512, 4032, 4032, 4032, 512]
    - [2, 13.37]
  - - [64, 3904, 1, 512, 64, 64, 64, 512]
    - [2, 10.626]
  - - [192, 3904, 1, 512, 192, 192, 192, 512]
    - [2, 11.699]
  - - [320, 3904, 1, 512, 320, 320, 320, 512]
    - [2, 12.408]
  - - [448, 3904, 1, 512, 448, 448, 448, 512]
    - [2, 12.641]
  - - [576, 3904, 1, 512, 576, 576, 576, 512]
    - [2, 12.861]
  - - [704, 3904, 1, 512, 704, 704, 704, 512]
    - [2, 12.947]
  - - [832, 3904, 1, 512, 832, 832, 832, 512]
    - [2, 12.975]
  - - [960, 3904, 1, 512, 960, 960, 960, 512]
    - [2, 13.131]
  - - [1088, 3904, 1, 512, 1088, 1088, 1088, 512]
    - [2, 13.119]
  - - [1216, 3904, 1, 512, 1216, 1216, 1216, 512]
    - [2, 12.964]
  - - [1344, 3904, 1, 512, 1344, 1344, 1344, 512]
    - [2, 13.033]
  - - [1472, 3904, 1, 512, 1472, 1472, 1472, 512]
    - [2, 13.057]
  - - [1600, 3904, 1, 512, 1600, 1600, 1600, 512]
    - [2, 13.118]
  - - [1728, 3904, 1, 512, 1728, 1728, 1728, 512]
    - [2, 13.165]
  - - [1856, 3904, 1, 512, 1856, 1856, 1856, 512]
    - [2, 13.182]
  - - [1984, 3904, 1, 512, 1984, 1984, 1984, 512]
    - [2, 13.204]
  - - [2112, 3904, 1, 512, 2112, 2112, 2112, 512]
    - [2, 13.241]
  - - [2240, 3904, 1, 512, 2240, 2240, 2240, 512]
    - [2, 13.243]
  - - [2368, 3904, 1, 512, 2368, 2368, 2368, 512]
    - [2, 13.281]
  - - [2496, 3904, 1, 512, 2496, 2496, 2496, 512]
    - [2, 13.253]
  - - [2624, 3904, 1, 512, 2624, 2624, 2624, 512]
    - [2, 13.278]
  - - [2752, 3904, 1, 512, 2752, 2752, 2752, 512]
    - [2, 13.303]
  - - [2880, 3904, 1, 512, 2880, 2880, 2880, 512]
    - [2, 13.305]
  - - [3008, 3904, 1, 512, 3008, 3008, 3008, 512]
    - [2, 13.324]
  - - [3136, 3904, 1, 512, 3136, 3136, 3136, 512]
    - [2, 13.343]
  - - [3264, 3904, 1, 512, 3264, 3264, 3264, 512]
    - [2, 13.34]
  - - [3392, 3904, 1, 512, 3392, 3392, 3392, 512]
    - [2, 13.321]
  - - [3520, 3904, 1, 512, 3520, 3520, 3520, 512]
    - [2, 13.332]
  - - [3648, 3904, 1, 512, 3648, 3648, 3648, 512]
    - [2, 13.333]
  - - [3776, 3904, 1, 512, 3776, 3776, 3776, 512]
    - [2, 13.368]
  - - [3904, 3904, 1, 512, 3904, 3904, 3904, 512]
    - [2, 13.37]
  - - [4032, 3904, 1, 512, 4032, 4032, 4032, 512]
    - [2, 13.368]
  - - [64, 4032, 1, 512, 64, 64, 64, 512]
    - [2, 10.79]
  - - [192, 4032, 1, 512, 192, 192, 192, 512]
    - [2, 11.71]
  - - [320, 4032, 1, 512, 320, 320, 320, 512]
    - [0, 12.39]
  - - [448, 4032, 1, 512, 448, 448, 448, 512]
    - [2, 12.707]
  - - [576, 4032, 1, 512, 576, 576, 576, 512]
    - [2, 12.849]
  - - [704, 4032, 1, 512, 704, 704, 704, 512]
    - [2, 12.995]
  - - [832, 4032, 1, 512, 832, 832, 832, 512]
    - [2, 13.03]
  - - [960, 4032, 1, 512, 960, 960, 960, 512]
    - [2, 13.099]
  - - [1088, 4032, 1, 512, 1088, 1088, 1088, 512]
    - [2, 12.917]
  - - [1216, 4032, 1, 512, 1216, 1216, 1216, 512]
    - [2, 13.016]
  - - [1344, 4032, 1, 512, 1344, 1344, 1344, 512]
    - [2, 13.063]
  - - [1472, 4032, 1, 512, 1472, 1472, 1472, 512]
    - [2, 13.043]
  - - [1600, 4032, 1, 512, 1600, 1600, 1600, 512]
    - [2, 13.124]
  - - [1728, 4032, 1, 512, 1728, 1728, 1728, 512]
    - [2, 13.141]
  - - [1856, 4032, 1, 512, 1856, 1856, 1856, 512]
    - [2, 13.165]
  - - [1984, 4032, 1, 512, 1984, 1984, 1984, 512]
    - [2, 13.192]
  - - [2112, 4032, 1, 512, 2112, 2112, 2112, 512]
    - [2, 13.215]
  - - [2240, 4032, 1, 512, 2240, 2240, 2240, 512]
    - [2, 13.264]
  - - [2368, 4032, 1, 512, 2368, 2368, 2368, 512]
    - [2, 13.279]
  - - [2496, 4032, 1, 512, 2496, 2496, 2496, 512]
    - [2, 13.278]
  - - [2624, 4032, 1, 512, 2624, 2624, 2624, 512]
    - [2, 13.316]
  - - [2752, 4032, 1, 512, 2752, 2752, 2752, 512]
    - [2, 13.317]
  - - [2880, 4032, 1, 512, 2880, 2880, 2880, 512]
    - [2, 13.309]
  - - [3008, 4032, 1, 512, 3008, 3008, 3008, 512]
    - [2, 13.316]
  - - [3136, 4032, 1, 512, 3136, 3136, 3136, 512]
    - [2, 13.336]
  - - [3264, 4032, 1, 512, 3264, 3264, 3264, 512]
    - [2, 13.323]
  - - [3392, 4032, 1, 512, 3392, 3392, 3392, 512]
    - [2, 13.358]
  - - [3520, 4032, 1, 512, 3520, 3520, 3520, 512]
    - [2, 13.344]
  - - [3648, 4032, 1, 512, 3648, 3648, 3648, 512]
    - [2, 13.336]
  - - [3776, 4032, 1, 512, 3776, 3776, 3776, 512]
    - [2, 13.362]
  - - [3904, 4032, 1, 512, 3904, 3904, 3904, 512]
    - [2, 13.369]
  - - [4032, 4032, 1, 512, 4032, 4032, 4032, 512]
    - [2, 13.396]
  - - [64, 64, 1, 1024, 64, 64, 64, 1024]
    - [1, 1.244]
  - - [192, 64, 1, 1024, 192, 192, 192, 1024]
    - [2, 3.661]
  - - [320, 64, 1, 1024, 320, 320, 320, 1024]
    - [0, 4.82]
  - - [448, 64, 1, 1024, 448, 448, 448, 1024]
    - [0, 6.727]
  - - [576, 64, 1, 1024, 576, 576, 576, 1024]
    - [2, 6.338]
  - - [704, 64, 1, 1024, 704, 704, 704, 1024]
    - [2, 7.739]
  - - [832, 64, 1, 1024, 832, 832, 832, 1024]
    - [0, 8.195]
  - - [960, 64, 1, 1024, 960, 960, 960, 1024]
    - [0, 9.406]
  - - [1088, 64, 1, 1024, 1088, 1088, 1088, 1024]
    - [2, 8.185]
  - - [1216, 64, 1, 1024, 1216, 1216, 1216, 1024]
    - [0, 8.749]
  - - [1344, 64, 1, 1024, 1344, 1344, 1344, 1024]
    - [0, 9.656]
  - - [1472, 64, 1, 1024, 1472, 1472, 1472, 1024]
    - [2, 8.699]
  - - [1600, 64, 1, 1024, 1600, 1600, 1600, 1024]
    - [2, 9.172]
  - - [1728, 64, 1, 1024, 1728, 1728, 1728, 1024]
    - [0, 9.82]
  - - [1856, 64, 1, 1024, 1856, 1856, 1856, 1024]
    - [0, 10.516]
  - - [1984, 64, 1, 1024, 1984, 1984, 1984, 1024]
    - [0, 9.373]
  - - [2112, 64, 1, 1024, 2112, 2112, 2112, 1024]
    - [0, 9.974]
  - - [2240, 64, 1, 1024, 2240, 2240, 2240, 1024]
    - [0, 10.557]
  - - [2368, 64, 1, 1024, 2368, 2368, 2368, 1024]
    - [0, 11.128]
  - - [2496, 64, 1, 1024, 2496, 2496, 2496, 1024]
    - [2, 10.193]
  - - [2624, 64, 1, 1024, 2624, 2624, 2624, 1024]
    - [2, 10.92]
  - - [2752, 64, 1, 1024, 2752, 2752, 2752, 1024]
    - [0, 11.057]
  - - [2880, 64, 1, 1024, 2880, 2880, 2880, 1024]
    - [0, 11.548]
  - - [3008, 64, 1, 1024, 3008, 3008, 3008, 1024]
    - [2, 11.317]
  - - [3136, 64, 1, 1024, 3136, 3136, 3136, 1024]
    - [2, 11.143]
  - - [3264, 64, 1, 1024, 3264, 3264, 3264, 1024]
    - [0, 11.43]
  - - [3392, 64, 1, 1024, 3392, 3392, 3392, 1024]
    - [2, 11.112]
  - - [3520, 64, 1, 1024, 3520, 3520, 3520, 1024]
    - [2, 11.079]
  - - [3648, 64, 1, 1024, 3648, 3648, 3648, 1024]
    - [2, 11.533]
  - - [3776, 64, 1, 1024, 3776, 3776, 3776, 1024]
    - [0, 11.719]
  - - [3904, 64, 1, 1024, 3904, 3904, 3904, 1024]
    - [2, 10.734]
  - - [4032, 64, 1, 1024, 4032, 4032, 4032, 1024]
    - [2, 10.962]
  - - [64, 192, 1, 1024, 64, 64, 64, 1024]
    - [2, 3.682]
  - - [192, 192, 1, 1024, 192, 192, 192, 1024]
    - [2, 6.364]
  - - [320, 192, 1, 1024, 320, 320, 320, 1024]
    - [0, 9.47]
  - - [448, 192, 1, 1024, 448, 448, 448, 1024]
    - [0, 9.709]
  - - [576, 192, 1, 1024, 576, 576, 576, 1024]
    - [0, 9.873]
  - - [704, 192, 1, 1024, 704, 704, 704, 1024]
    - [0, 9.997]
  - - [832, 192, 1, 1024, 832, 832, 832, 1024]
    - [2, 10.951]
  - - [960, 192, 1, 1024, 960, 960, 960, 1024]
    - [0, 11.577]
  - - [1088, 192, 1, 1024, 1088, 1088, 1088, 1024]
    - [0, 11.453]
  - - [1216, 192, 1, 1024, 1216, 1216, 1216, 1024]
    - [0, 11.355]
  - - [1344, 192, 1, 1024, 1344, 1344, 1344, 1024]
    - [2, 10.796]
  - - [1472, 192, 1, 1024, 1472, 1472, 1472, 1024]
    - [2, 10.804]
  - - [1600, 192, 1, 1024, 1600, 1600, 1600, 1024]
    - [0, 11.554]
  - - [1728, 192, 1, 1024, 1728, 1728, 1728, 1024]
    - [0, 11.503]
  - - [1856, 192, 1, 1024, 1856, 1856, 1856, 1024]
    - [2, 11.496]
  - - [1984, 192, 1, 1024, 1984, 1984, 1984, 1024]
    - [2, 11.502]
  - - [2112, 192, 1, 1024, 2112, 2112, 2112, 1024]
    - [2, 11.601]
  - - [2240, 192, 1, 1024, 2240, 2240, 2240, 1024]
    - [0, 11.999]
  - - [2368, 192, 1, 1024, 2368, 2368, 2368, 1024]
    - [0, 11.929]
  - - [2496, 192, 1, 1024, 2496, 2496, 2496, 1024]
    - [0, 11.875]
  - - [2624, 192, 1, 1024, 2624, 2624, 2624, 1024]
    - [2, 11.9]
  - - [2752, 192, 1, 1024, 2752, 2752, 2752, 1024]
    - [2, 11.98]
  - - [2880, 192, 1, 1024, 2880, 2880, 2880, 1024]
    - [0, 12.246]
  - - [3008, 192, 1, 1024, 3008, 3008, 3008, 1024]
    - [0, 12.189]
  - - [3136, 192, 1, 1024, 3136, 3136, 3136, 1024]
    - [0, 12.113]
  - - [3264, 192, 1, 1024, 3264, 3264, 3264, 1024]
    - [2, 12.093]
  - - [3392, 192, 1, 1024, 3392, 3392, 3392, 1024]
    - [2, 12.106]
  - - [3520, 192, 1, 1024, 3520, 3520, 3520, 1024]
    - [0, 12.392]
  - - [3648, 192, 1, 1024, 3648, 3648, 3648, 1024]
    - [0, 12.354]
  - - [3776, 192, 1, 1024, 3776, 3776, 3776, 1024]
    - [0, 12.302]
  - - [3904, 192, 1, 1024, 3904, 3904, 3904, 1024]
    - [2, 12.31]
  - - [4032, 192, 1, 1024, 4032, 4032, 4032, 1024]
    - [2, 12.275]
  - - [64, 320, 1, 1024, 64, 64, 64, 1024]
    - [0, 4.832]
  - - [192, 320, 1, 1024, 192, 192, 192, 1024]
    - [0, 9.457]
  - - [320, 320, 1, 1024, 320, 320, 320, 1024]
    - [2, 9.236]
  - - [448, 320, 1, 1024, 448, 448, 448, 1024]
    - [0, 10.548]
  - - [576, 320, 1, 1024, 576, 576, 576, 1024]
    - [0, 11.556]
  - - [704, 320, 1, 1024, 704, 704, 704, 1024]
    - [2, 11.166]
  - - [832, 320, 1, 1024, 832, 832, 832, 1024]
    - [2, 10.979]
  - - [960, 320, 1, 1024, 960, 960, 960, 1024]
    - [0, 11.576]
  - - [1088, 320, 1, 1024, 1088, 1088, 1088, 1024]
    - [2, 11.372]
  - - [1216, 320, 1, 1024, 1216, 1216, 1216, 1024]
    - [0, 11.632]
  - - [1344, 320, 1, 1024, 1344, 1344, 1344, 1024]
    - [0, 12.01]
  - - [1472, 320, 1, 1024, 1472, 1472, 1472, 1024]
    - [2, 11.891]
  - - [1600, 320, 1, 1024, 1600, 1600, 1600, 1024]
    - [2, 12.142]
  - - [1728, 320, 1, 1024, 1728, 1728, 1728, 1024]
    - [0, 12.241]
  - - [1856, 320, 1, 1024, 1856, 1856, 1856, 1024]
    - [2, 12.246]
  - - [1984, 320, 1, 1024, 1984, 1984, 1984, 1024]
    - [2, 12.228]
  - - [2112, 320, 1, 1024, 2112, 2112, 2112, 1024]
    - [0, 12.402]
  - - [2240, 320, 1, 1024, 2240, 2240, 2240, 1024]
    - [2, 12.346]
  - - [2368, 320, 1, 1024, 2368, 2368, 2368, 1024]
    - [0, 12.373]
  - - [2496, 320, 1, 1024, 2496, 2496, 2496, 1024]
    - [0, 12.522]
  - - [2624, 320, 1, 1024, 2624, 2624, 2624, 1024]
    - [2, 12.576]
  - - [2752, 320, 1, 1024, 2752, 2752, 2752, 1024]
    - [2, 12.512]
  - - [2880, 320, 1, 1024, 2880, 2880, 2880, 1024]
    - [0, 12.605]
  - - [3008, 320, 1, 1024, 3008, 3008, 3008, 1024]
    - [2, 12.635]
  - - [3136, 320, 1, 1024, 3136, 3136, 3136, 1024]
    - [2, 12.712]
  - - [3264, 320, 1, 1024, 3264, 3264, 3264, 1024]
    - [0, 12.675]
  - - [3392, 320, 1, 1024, 3392, 3392, 3392, 1024]
    - [2, 12.714]
  - - [3520, 320, 1, 1024, 3520, 3520, 3520, 1024]
    - [2, 12.722]
  - - [3648, 320, 1, 1024, 3648, 3648, 3648, 1024]
    - [0, 12.713]
  - - [3776, 320, 1, 1024, 3776, 3776, 3776, 1024]
    - [2, 12.952]
  - - [3904, 320, 1, 1024, 3904, 3904, 3904, 1024]
    - [2, 12.822]
  - - [4032, 320, 1, 1024, 4032, 4032, 4032, 1024]
    - [0, 12.787]
  - - [64, 448, 1, 1024, 64, 64, 64, 1024]
    - [0, 6.739]
  - - [192, 448, 1, 1024, 192, 192, 192, 1024]
    - [0, 9.705]
  - - [320, 448, 1, 1024, 320, 320, 320, 1024]
    - [0, 10.554]
  - - [448, 448, 1, 1024, 448, 448, 448, 1024]
    - [0, 11.025]
  - - [576, 448, 1, 1024, 576, 576, 576, 1024]
    - [2, 11.187]
  - - [704, 448, 1, 1024, 704, 704, 704, 1024]
    - [2, 11.124]
  - - [832, 448, 1, 1024, 832, 832, 832, 1024]
    - [2, 11.564]
  - - [960, 448, 1, 1024, 960, 960, 960, 1024]
    - [0, 11.998]
  - - [1088, 448, 1, 1024, 1088, 1088, 1088, 1024]
    - [0, 12.055]
  - - [1216, 448, 1, 1024, 1216, 1216, 1216, 1024]
    - [0, 12.094]
  - - [1344, 448, 1, 1024, 1344, 1344, 1344, 1024]
    - [0, 12.113]
  - - [1472, 448, 1, 1024, 1472, 1472, 1472, 1024]
    - [0, 12.143]
  - - [1600, 448, 1, 1024, 1600, 1600, 1600, 1024]
    - [2, 12.277]
  - - [1728, 448, 1, 1024, 1728, 1728, 1728, 1024]
    - [2, 12.441]
  - - [1856, 448, 1, 1024, 1856, 1856, 1856, 1024]
    - [0, 12.57]
  - - [1984, 448, 1, 1024, 1984, 1984, 1984, 1024]
    - [2, 12.614]
  - - [2112, 448, 1, 1024, 2112, 2112, 2112, 1024]
    - [2, 12.645]
  - - [2240, 448, 1, 1024, 2240, 2240, 2240, 1024]
    - [2, 12.625]
  - - [2368, 448, 1, 1024, 2368, 2368, 2368, 1024]
    - [2, 12.674]
  - - [2496, 448, 1, 1024, 2496, 2496, 2496, 1024]
    - [2, 12.813]
  - - [2624, 448, 1, 1024, 2624, 2624, 2624, 1024]
    - [2, 12.817]
  - - [2752, 448, 1, 1024, 2752, 2752, 2752, 1024]
    - [2, 12.835]
  - - [2880, 448, 1, 1024, 2880, 2880, 2880, 1024]
    - [0, 12.758]
  - - [3008, 448, 1, 1024, 3008, 3008, 3008, 1024]
    - [2, 12.931]
  - - [3136, 448, 1, 1024, 3136, 3136, 3136, 1024]
    - [2, 12.851]
  - - [3264, 448, 1, 1024, 3264, 3264, 3264, 1024]
    - [2, 12.841]
  - - [3392, 448, 1, 1024, 3392, 3392, 3392, 1024]
    - [2, 12.934]
  - - [3520, 448, 1, 1024, 3520, 3520, 3520, 1024]
    - [2, 12.983]
  - - [3648, 448, 1, 1024, 3648, 3648, 3648, 1024]
    - [2, 12.885]
  - - [3776, 448, 1, 1024, 3776, 3776, 3776, 1024]
    - [2, 12.913]
  - - [3904, 448, 1, 1024, 3904, 3904, 3904, 1024]
    - [2, 12.939]
  - - [4032, 448, 1, 1024, 4032, 4032, 4032, 1024]
    - [2, 13.034]
  - - [64, 576, 1, 1024, 64, 64, 64, 1024]
    - [2, 6.37]
  - - [192, 576, 1, 1024, 192, 192, 192, 1024]
    - [0, 9.877]
  - - [320, 576, 1, 1024, 320, 320, 320, 1024]
    - [0, 11.563]
  - - [448, 576, 1, 1024, 448, 448, 448, 1024]
    - [2, 11.128]
  - - [576, 576, 1, 1024, 576, 576, 576, 1024]
    - [0, 11.505]
  - - [704, 576, 1, 1024, 704, 704, 704, 1024]
    - [2, 11.517]
  - - [832, 576, 1, 1024, 832, 832, 832, 1024]
    - [0, 11.873]
  - - [960, 576, 1, 1024, 960, 960, 960, 1024]
    - [0, 12.243]
  - - [1088, 576, 1, 1024, 1088, 1088, 1088, 1024]
    - [2, 12.144]
  - - [1216, 576, 1, 1024, 1216, 1216, 1216, 1024]
    - [2, 12.403]
  - - [1344, 576, 1, 1024, 1344, 1344, 1344, 1024]
    - [2, 12.423]
  - - [1472, 576, 1, 1024, 1472, 1472, 1472, 1024]
    - [0, 12.419]
  - - [1600, 576, 1, 1024, 1600, 1600, 1600, 1024]
    - [0, 12.6]
  - - [1728, 576, 1, 1024, 1728, 1728, 1728, 1024]
    - [2, 12.565]
  - - [1856, 576, 1, 1024, 1856, 1856, 1856, 1024]
    - [0, 12.631]
  - - [1984, 576, 1, 1024, 1984, 1984, 1984, 1024]
    - [2, 12.731]
  - - [2112, 576, 1, 1024, 2112, 2112, 2112, 1024]
    - [2, 12.813]
  - - [2240, 576, 1, 1024, 2240, 2240, 2240, 1024]
    - [2, 12.839]
  - - [2368, 576, 1, 1024, 2368, 2368, 2368, 1024]
    - [2, 12.797]
  - - [2496, 576, 1, 1024, 2496, 2496, 2496, 1024]
    - [2, 12.852]
  - - [2624, 576, 1, 1024, 2624, 2624, 2624, 1024]
    - [2, 12.968]
  - - [2752, 576, 1, 1024, 2752, 2752, 2752, 1024]
    - [2, 12.971]
  - - [2880, 576, 1, 1024, 2880, 2880, 2880, 1024]
    - [2, 12.891]
  - - [3008, 576, 1, 1024, 3008, 3008, 3008, 1024]
    - [2, 13.042]
  - - [3136, 576, 1, 1024, 3136, 3136, 3136, 1024]
    - [2, 12.956]
  - - [3264, 576, 1, 1024, 3264, 3264, 3264, 1024]
    - [2, 12.971]
  - - [3392, 576, 1, 1024, 3392, 3392, 3392, 1024]
    - [2, 13.137]
  - - [3520, 576, 1, 1024, 3520, 3520, 3520, 1024]
    - [2, 13.075]
  - - [3648, 576, 1, 1024, 3648, 3648, 3648, 1024]
    - [2, 12.917]
  - - [3776, 576, 1, 1024, 3776, 3776, 3776, 1024]
    - [2, 12.92]
  - - [3904, 576, 1, 1024, 3904, 3904, 3904, 1024]
    - [2, 12.883]
  - - [4032, 576, 1, 1024, 4032, 4032, 4032, 1024]
    - [2, 12.92]
  - - [64, 704, 1, 1024, 64, 64, 64, 1024]
    - [2, 7.753]
  - - [192, 704, 1, 1024, 192, 192, 192, 1024]
    - [0, 9.998]
  - - [320, 704, 1, 1024, 320, 320, 320, 1024]
    - [2, 11.24]
  - - [448, 704, 1, 1024, 448, 448, 448, 1024]
    - [2, 11.0]
  - - [576, 704, 1, 1024, 576, 576, 576, 1024]
    - [0, 11.37]
  - - [704, 704, 1, 1024, 704, 704, 704, 1024]
    - [2, 12.121]
  - - [832, 704, 1, 1024, 832, 832, 832, 1024]
    - [0, 12.138]
  - - [960, 704, 1, 1024, 960, 960, 960, 1024]
    - [0, 12.418]
  - - [1088, 704, 1, 1024, 1088, 1088, 1088, 1024]
    - [0, 12.478]
  - - [1216, 704, 1, 1024, 1216, 1216, 1216, 1024]
    - [0, 12.523]
  - - [1344, 704, 1, 1024, 1344, 1344, 1344, 1024]
    - [2, 12.591]
  - - [1472, 704, 1, 1024, 1472, 1472, 1472, 1024]
    - [2, 12.659]
  - - [1600, 704, 1, 1024, 1600, 1600, 1600, 1024]
    - [2, 12.747]
  - - [1728, 704, 1, 1024, 1728, 1728, 1728, 1024]
    - [0, 12.683]
  - - [1856, 704, 1, 1024, 1856, 1856, 1856, 1024]
    - [2, 12.877]
  - - [1984, 704, 1, 1024, 1984, 1984, 1984, 1024]
    - [2, 12.859]
  - - [2112, 704, 1, 1024, 2112, 2112, 2112, 1024]
    - [2, 12.85]
  - - [2240, 704, 1, 1024, 2240, 2240, 2240, 1024]
    - [2, 13.064]
  - - [2368, 704, 1, 1024, 2368, 2368, 2368, 1024]
    - [2, 12.927]
  - - [2496, 704, 1, 1024, 2496, 2496, 2496, 1024]
    - [2, 12.92]
  - - [2624, 704, 1, 1024, 2624, 2624, 2624, 1024]
    - [2, 13.005]
  - - [2752, 704, 1, 1024, 2752, 2752, 2752, 1024]
    - [2, 13.04]
  - - [2880, 704, 1, 1024, 2880, 2880, 2880, 1024]
    - [2, 13.054]
  - - [3008, 704, 1, 1024, 3008, 3008, 3008, 1024]
    - [2, 12.967]
  - - [3136, 704, 1, 1024, 3136, 3136, 3136, 1024]
    - [2, 12.884]
  - - [3264, 704, 1, 1024, 3264, 3264, 3264, 1024]
    - [2, 12.874]
  - - [3392, 704, 1, 1024, 3392, 3392, 3392, 1024]
    - [2, 12.898]
  - - [3520, 704, 1, 1024, 3520, 3520, 3520, 1024]
    - [2, 12.941]
  - - [3648, 704, 1, 1024, 3648, 3648, 3648, 1024]
    - [2, 12.942]
  - - [3776, 704, 1, 1024, 3776, 3776, 3776, 1024]
    - [2, 13.039]
  - - [3904, 704, 1, 1024, 3904, 3904, 3904, 1024]
    - [2, 12.984]
  - - [4032, 704, 1, 1024, 4032, 4032, 4032, 1024]
    - [2, 12.992]
  - - [64, 832, 1, 1024, 64, 64, 64, 1024]
    - [2, 5.589]
  - - [192, 832, 1, 1024, 192, 192, 192, 1024]
    - [2, 10.414]
  - - [320, 832, 1, 1024, 320, 320, 320, 1024]
    - [2, 10.798]
  - - [448, 832, 1, 1024, 448, 448, 448, 1024]
    - [2, 11.319]
  - - [576, 832, 1, 1024, 576, 576, 576, 1024]
    - [0, 11.853]
  - - [704, 832, 1, 1024, 704, 704, 704, 1024]
    - [2, 12.04]
  - - [832, 832, 1, 1024, 832, 832, 832, 1024]
    - [2, 12.28]
  - - [960, 832, 1, 1024, 960, 960, 960, 1024]
    - [0, 12.515]
  - - [1088, 832, 1, 1024, 1088, 1088, 1088, 1024]
    - [2, 12.478]
  - - [1216, 832, 1, 1024, 1216, 1216, 1216, 1024]
    - [2, 12.753]
  - - [1344, 832, 1, 1024, 1344, 1344, 1344, 1024]
    - [2, 12.715]
  - - [1472, 832, 1, 1024, 1472, 1472, 1472, 1024]
    - [2, 12.82]
  - - [1600, 832, 1, 1024, 1600, 1600, 1600, 1024]
    - [2, 12.847]
  - - [1728, 832, 1, 1024, 1728, 1728, 1728, 1024]
    - [2, 12.911]
  - - [1856, 832, 1, 1024, 1856, 1856, 1856, 1024]
    - [2, 12.971]
  - - [1984, 832, 1, 1024, 1984, 1984, 1984, 1024]
    - [2, 12.932]
  - - [2112, 832, 1, 1024, 2112, 2112, 2112, 1024]
    - [2, 13.003]
  - - [2240, 832, 1, 1024, 2240, 2240, 2240, 1024]
    - [2, 13.031]
  - - [2368, 832, 1, 1024, 2368, 2368, 2368, 1024]
    - [2, 13.047]
  - - [2496, 832, 1, 1024, 2496, 2496, 2496, 1024]
    - [2, 13.08]
  - - [2624, 832, 1, 1024, 2624, 2624, 2624, 1024]
    - [2, 12.852]
  - - [2752, 832, 1, 1024, 2752, 2752, 2752, 1024]
    - [2, 12.925]
  - - [2880, 832, 1, 1024, 2880, 2880, 2880, 1024]
    - [2, 12.917]
  - - [3008, 832, 1, 1024, 3008, 3008, 3008, 1024]
    - [2, 12.961]
  - - [3136, 832, 1, 1024, 3136, 3136, 3136, 1024]
    - [2, 12.989]
  - - [3264, 832, 1, 1024, 3264, 3264, 3264, 1024]
    - [2, 13.012]
  - - [3392, 832, 1, 1024, 3392, 3392, 3392, 1024]
    - [2, 13.07]
  - - [3520, 832, 1, 1024, 3520, 3520, 3520, 1024]
    - [2, 12.981]
  - - [3648, 832, 1, 1024, 3648, 3648, 3648, 1024]
    - [2, 13.011]
  - - [3776, 832, 1, 1024, 3776, 3776, 3776, 1024]
    - [2, 13.068]
  - - [3904, 832, 1, 1024, 3904, 3904, 3904, 1024]
    - [2, 13.061]
  - - [4032, 832, 1, 1024, 4032, 4032, 4032, 1024]
    - [2, 13.15]
  - - [64, 960, 1, 1024, 64, 64, 64, 1024]
    - [0, 9.374]
  - - [192, 960, 1, 1024, 192, 192, 192, 1024]
    - [0, 11.555]
  - - [320, 960, 1, 1024, 320, 320, 320, 1024]
    - [0, 11.558]
  - - [448, 960, 1, 1024, 448, 448, 448, 1024]
    - [0, 12.001]
  - - [576, 960, 1, 1024, 576, 576, 576, 1024]
    - [0, 12.236]
  - - [704, 960, 1, 1024, 704, 704, 704, 1024]
    - [0, 12.408]
  - - [832, 960, 1, 1024, 832, 832, 832, 1024]
    - [0, 12.513]
  - - [960, 960, 1, 1024, 960, 960, 960, 1024]
    - [0, 12.613]
  - - [1088, 960, 1, 1024, 1088, 1088, 1088, 1024]
    - [0, 12.682]
  - - [1216, 960, 1, 1024, 1216, 1216, 1216, 1024]
    - [0, 12.73]
  - - [1344, 960, 1, 1024, 1344, 1344, 1344, 1024]
    - [2, 12.806]
  - - [1472, 960, 1, 1024, 1472, 1472, 1472, 1024]
    - [2, 12.942]
  - - [1600, 960, 1, 1024, 1600, 1600, 1600, 1024]
    - [2, 13.035]
  - - [1728, 960, 1, 1024, 1728, 1728, 1728, 1024]
    - [2, 12.913]
  - - [1856, 960, 1, 1024, 1856, 1856, 1856, 1024]
    - [2, 13.056]
  - - [1984, 960, 1, 1024, 1984, 1984, 1984, 1024]
    - [2, 12.974]
  - - [2112, 960, 1, 1024, 2112, 2112, 2112, 1024]
    - [2, 13.036]
  - - [2240, 960, 1, 1024, 2240, 2240, 2240, 1024]
    - [2, 12.926]
  - - [2368, 960, 1, 1024, 2368, 2368, 2368, 1024]
    - [2, 12.902]
  - - [2496, 960, 1, 1024, 2496, 2496, 2496, 1024]
    - [2, 12.953]
  - - [2624, 960, 1, 1024, 2624, 2624, 2624, 1024]
    - [2, 12.903]
  - - [2752, 960, 1, 1024, 2752, 2752, 2752, 1024]
    - [2, 13.046]
  - - [2880, 960, 1, 1024, 2880, 2880, 2880, 1024]
    - [2, 13.009]
  - - [3008, 960, 1, 1024, 3008, 3008, 3008, 1024]
    - [2, 12.993]
  - - [3136, 960, 1, 1024, 3136, 3136, 3136, 1024]
    - [2, 13.023]
  - - [3264, 960, 1, 1024, 3264, 3264, 3264, 1024]
    - [2, 13.015]
  - - [3392, 960, 1, 1024, 3392, 3392, 3392, 1024]
    - [2, 13.095]
  - - [3520, 960, 1, 1024, 3520, 3520, 3520, 1024]
    - [2, 13.089]
  - - [3648, 960, 1, 1024, 3648, 3648, 3648, 1024]
    - [2, 13.107]
  - - [3776, 960, 1, 1024, 3776, 3776, 3776, 1024]
    - [2, 13.142]
  - - [3904, 960, 1, 1024, 3904, 3904, 3904, 1024]
    - [2, 13.106]
  - - [4032, 960, 1, 1024, 4032, 4032, 4032, 1024]
    - [2, 13.159]
  - - [64, 1088, 1, 1024, 64, 64, 64, 1024]
    - [0, 7.853]
  - - [192, 1088, 1, 1024, 192, 192, 192, 1024]
    - [2, 11.156]
  - - [320, 1088, 1, 1024, 320, 320, 320, 1024]
    - [2, 11.441]
  - - [448, 1088, 1, 1024, 448, 448, 448, 1024]
    - [0, 12.048]
  - - [576, 1088, 1, 1024, 576, 576, 576, 1024]
    - [2, 12.194]
  - - [704, 1088, 1, 1024, 704, 704, 704, 1024]
    - [2, 12.545]
  - - [832, 1088, 1, 1024, 832, 832, 832, 1024]
    - [0, 12.427]
  - - [960, 1088, 1, 1024, 960, 960, 960, 1024]
    - [0, 12.683]
  - - [1088, 1088, 1, 1024, 1088, 1088, 1088, 1024]
    - [2, 12.721]
  - - [1216, 1088, 1, 1024, 1216, 1216, 1216, 1024]
    - [2, 12.776]
  - - [1344, 1088, 1, 1024, 1344, 1344, 1344, 1024]
    - [2, 12.829]
  - - [1472, 1088, 1, 1024, 1472, 1472, 1472, 1024]
    - [2, 12.923]
  - - [1600, 1088, 1, 1024, 1600, 1600, 1600, 1024]
    - [2, 12.929]
  - - [1728, 1088, 1, 1024, 1728, 1728, 1728, 1024]
    - [2, 13.007]
  - - [1856, 1088, 1, 1024, 1856, 1856, 1856, 1024]
    - [2, 13.09]
  - - [1984, 1088, 1, 1024, 1984, 1984, 1984, 1024]
    - [2, 12.945]
  - - [2112, 1088, 1, 1024, 2112, 2112, 2112, 1024]
    - [2, 12.878]
  - - [2240, 1088, 1, 1024, 2240, 2240, 2240, 1024]
    - [2, 12.969]
  - - [2368, 1088, 1, 1024, 2368, 2368, 2368, 1024]
    - [2, 13.003]
  - - [2496, 1088, 1, 1024, 2496, 2496, 2496, 1024]
    - [2, 13.011]
  - - [2624, 1088, 1, 1024, 2624, 2624, 2624, 1024]
    - [2, 13.03]
  - - [2752, 1088, 1, 1024, 2752, 2752, 2752, 1024]
    - [2, 13.011]
  - - [2880, 1088, 1, 1024, 2880, 2880, 2880, 1024]
    - [2, 13.057]
  - - [3008, 1088, 1, 1024, 3008, 3008, 3008, 1024]
    - [2, 13.106]
  - - [3136, 1088, 1, 1024, 3136, 3136, 3136, 1024]
    - [2, 13.079]
  - - [3264, 1088, 1, 1024, 3264, 3264, 3264, 1024]
    - [2, 13.106]
  - - [3392, 1088, 1, 1024, 3392, 3392, 3392, 1024]
    - [2, 13.131]
  - - [3520, 1088, 1, 1024, 3520, 3520, 3520, 1024]
    - [2, 13.149]
  - - [3648, 1088, 1, 1024, 3648, 3648, 3648, 1024]
    - [2, 13.136]
  - - [3776, 1088, 1, 1024, 3776, 3776, 3776, 1024]
    - [2, 13.199]
  - - [3904, 1088, 1, 1024, 3904, 3904, 3904, 1024]
    - [2, 13.205]
  - - [4032, 1088, 1, 1024, 4032, 4032, 4032, 1024]
    - [2, 13.175]
  - - [64, 1216, 1, 1024, 64, 64, 64, 1024]
    - [0, 7.138]
  - - [192, 1216, 1, 1024, 192, 192, 192, 1024]
    - [0, 11.346]
  - - [320, 1216, 1, 1024, 320, 320, 320, 1024]
    - [2, 11.631]
  - - [448, 1216, 1, 1024, 448, 448, 448, 1024]
    - [2, 12.148]
  - - [576, 1216, 1, 1024, 576, 576, 576, 1024]
    - [0, 12.351]
  - - [704, 1216, 1, 1024, 704, 704, 704, 1024]
    - [0, 12.53]
  - - [832, 1216, 1, 1024, 832, 832, 832, 1024]
    - [2, 12.682]
  - - [960, 1216, 1, 1024, 960, 960, 960, 1024]
    - [2, 12.736]
  - - [1088, 1216, 1, 1024, 1088, 1088, 1088, 1024]
    - [2, 12.839]
  - - [1216, 1216, 1, 1024, 1216, 1216, 1216, 1024]
    - [2, 12.827]
  - - [1344, 1216, 1, 1024, 1344, 1344, 1344, 1024]
    - [2, 12.937]
  - - [1472, 1216, 1, 1024, 1472, 1472, 1472, 1024]
    - [2, 13.039]
  - - [1600, 1216, 1, 1024, 1600, 1600, 1600, 1024]
    - [2, 13.113]
  - - [1728, 1216, 1, 1024, 1728, 1728, 1728, 1024]
    - [2, 12.998]
  - - [1856, 1216, 1, 1024, 1856, 1856, 1856, 1024]
    - [2, 12.908]
  - - [1984, 1216, 1, 1024, 1984, 1984, 1984, 1024]
    - [2, 12.937]
  - - [2112, 1216, 1, 1024, 2112, 2112, 2112, 1024]
    - [2, 12.956]
  - - [2240, 1216, 1, 1024, 2240, 2240, 2240, 1024]
    - [2, 13.005]
  - - [2368, 1216, 1, 1024, 2368, 2368, 2368, 1024]
    - [2, 13.006]
  - - [2496, 1216, 1, 1024, 2496, 2496, 2496, 1024]
    - [2, 13.066]
  - - [2624, 1216, 1, 1024, 2624, 2624, 2624, 1024]
    - [2, 13.043]
  - - [2752, 1216, 1, 1024, 2752, 2752, 2752, 1024]
    - [2, 13.099]
  - - [2880, 1216, 1, 1024, 2880, 2880, 2880, 1024]
    - [2, 13.097]
  - - [3008, 1216, 1, 1024, 3008, 3008, 3008, 1024]
    - [2, 13.122]
  - - [3136, 1216, 1, 1024, 3136, 3136, 3136, 1024]
    - [2, 13.138]
  - - [3264, 1216, 1, 1024, 3264, 3264, 3264, 1024]
    - [2, 13.151]
  - - [3392, 1216, 1, 1024, 3392, 3392, 3392, 1024]
    - [2, 13.114]
  - - [3520, 1216, 1, 1024, 3520, 3520, 3520, 1024]
    - [2, 13.151]
  - - [3648, 1216, 1, 1024, 3648, 3648, 3648, 1024]
    - [2, 13.188]
  - - [3776, 1216, 1, 1024, 3776, 3776, 3776, 1024]
    - [2, 13.199]
  - - [3904, 1216, 1, 1024, 3904, 3904, 3904, 1024]
    - [2, 13.176]
  - - [4032, 1216, 1, 1024, 4032, 4032, 4032, 1024]
    - [2, 13.246]
  - - [64, 1344, 1, 1024, 64, 64, 64, 1024]
    - [2, 9.037]
  - - [192, 1344, 1, 1024, 192, 192, 192, 1024]
    - [2, 10.783]
  - - [320, 1344, 1, 1024, 320, 320, 320, 1024]
    - [0, 11.986]
  - - [448, 1344, 1, 1024, 448, 448, 448, 1024]
    - [2, 12.142]
  - - [576, 1344, 1, 1024, 576, 576, 576, 1024]
    - [2, 12.214]
  - - [704, 1344, 1, 1024, 704, 704, 704, 1024]
    - [0, 12.573]
  - - [832, 1344, 1, 1024, 832, 832, 832, 1024]
    - [2, 12.651]
  - - [960, 1344, 1, 1024, 960, 960, 960, 1024]
    - [2, 12.819]
  - - [1088, 1344, 1, 1024, 1088, 1088, 1088, 1024]
    - [2, 12.794]
  - - [1216, 1344, 1, 1024, 1216, 1216, 1216, 1024]
    - [2, 12.929]
  - - [1344, 1344, 1, 1024, 1344, 1344, 1344, 1024]
    - [2, 13.031]
  - - [1472, 1344, 1, 1024, 1472, 1472, 1472, 1024]
    - [2, 13.001]
  - - [1600, 1344, 1, 1024, 1600, 1600, 1600, 1024]
    - [2, 12.862]
  - - [1728, 1344, 1, 1024, 1728, 1728, 1728, 1024]
    - [2, 12.902]
  - - [1856, 1344, 1, 1024, 1856, 1856, 1856, 1024]
    - [2, 13.007]
  - - [1984, 1344, 1, 1024, 1984, 1984, 1984, 1024]
    - [2, 12.996]
  - - [2112, 1344, 1, 1024, 2112, 2112, 2112, 1024]
    - [2, 13.039]
  - - [2240, 1344, 1, 1024, 2240, 2240, 2240, 1024]
    - [2, 13.087]
  - - [2368, 1344, 1, 1024, 2368, 2368, 2368, 1024]
    - [2, 12.997]
  - - [2496, 1344, 1, 1024, 2496, 2496, 2496, 1024]
    - [2, 13.088]
  - - [2624, 1344, 1, 1024, 2624, 2624, 2624, 1024]
    - [2, 13.091]
  - - [2752, 1344, 1, 1024, 2752, 2752, 2752, 1024]
    - [2, 13.122]
  - - [2880, 1344, 1, 1024, 2880, 2880, 2880, 1024]
    - [2, 13.141]
  - - [3008, 1344, 1, 1024, 3008, 3008, 3008, 1024]
    - [2, 13.178]
  - - [3136, 1344, 1, 1024, 3136, 3136, 3136, 1024]
    - [2, 13.167]
  - - [3264, 1344, 1, 1024, 3264, 3264, 3264, 1024]
    - [2, 13.205]
  - - [3392, 1344, 1, 1024, 3392, 3392, 3392, 1024]
    - [2, 13.189]
  - - [3520, 1344, 1, 1024, 3520, 3520, 3520, 1024]
    - [2, 13.213]
  - - [3648, 1344, 1, 1024, 3648, 3648, 3648, 1024]
    - [2, 13.204]
  - - [3776, 1344, 1, 1024, 3776, 3776, 3776, 1024]
    - [2, 13.204]
  - - [3904, 1344, 1, 1024, 3904, 3904, 3904, 1024]
    - [2, 13.233]
  - - [4032, 1344, 1, 1024, 4032, 4032, 4032, 1024]
    - [2, 13.281]
  - - [64, 1472, 1, 1024, 64, 64, 64, 1024]
    - [2, 8.665]
  - - [192, 1472, 1, 1024, 192, 192, 192, 1024]
    - [2, 10.879]
  - - [320, 1472, 1, 1024, 320, 320, 320, 1024]
    - [2, 11.903]
  - - [448, 1472, 1, 1024, 448, 448, 448, 1024]
    - [0, 12.14]
  - - [576, 1472, 1, 1024, 576, 576, 576, 1024]
    - [2, 12.578]
  - - [704, 1472, 1, 1024, 704, 704, 704, 1024]
    - [0, 12.601]
  - - [832, 1472, 1, 1024, 832, 832, 832, 1024]
    - [2, 12.77]
  - - [960, 1472, 1, 1024, 960, 960, 960, 1024]
    - [2, 12.906]
  - - [1088, 1472, 1, 1024, 1088, 1088, 1088, 1024]
    - [2, 12.948]
  - - [1216, 1472, 1, 1024, 1216, 1216, 1216, 1024]
    - [2, 12.942]
  - - [1344, 1472, 1, 1024, 1344, 1344, 1344, 1024]
    - [2, 12.975]
  - - [1472, 1472, 1, 1024, 1472, 1472, 1472, 1024]
    - [2, 12.888]
  - - [1600, 1472, 1, 1024, 1600, 1600, 1600, 1024]
    - [2, 12.924]
  - - [1728, 1472, 1, 1024, 1728, 1728, 1728, 1024]
    - [2, 12.958]
  - - [1856, 1472, 1, 1024, 1856, 1856, 1856, 1024]
    - [2, 13.004]
  - - [1984, 1472, 1, 1024, 1984, 1984, 1984, 1024]
    - [2, 12.976]
  - - [2112, 1472, 1, 1024, 2112, 2112, 2112, 1024]
    - [2, 13.036]
  - - [2240, 1472, 1, 1024, 2240, 2240, 2240, 1024]
    - [2, 13.113]
  - - [2368, 1472, 1, 1024, 2368, 2368, 2368, 1024]
    - [2, 13.119]
  - - [2496, 1472, 1, 1024, 2496, 2496, 2496, 1024]
    - [2, 13.135]
  - - [2624, 1472, 1, 1024, 2624, 2624, 2624, 1024]
    - [2, 13.136]
  - - [2752, 1472, 1, 1024, 2752, 2752, 2752, 1024]
    - [2, 13.108]
  - - [2880, 1472, 1, 1024, 2880, 2880, 2880, 1024]
    - [2, 13.192]
  - - [3008, 1472, 1, 1024, 3008, 3008, 3008, 1024]
    - [2, 13.149]
  - - [3136, 1472, 1, 1024, 3136, 3136, 3136, 1024]
    - [2, 13.227]
  - - [3264, 1472, 1, 1024, 3264, 3264, 3264, 1024]
    - [2, 13.186]
  - - [3392, 1472, 1, 1024, 3392, 3392, 3392, 1024]
    - [2, 13.242]
  - - [3520, 1472, 1, 1024, 3520, 3520, 3520, 1024]
    - [2, 13.202]
  - - [3648, 1472, 1, 1024, 3648, 3648, 3648, 1024]
    - [2, 13.254]
  - - [3776, 1472, 1, 1024, 3776, 3776, 3776, 1024]
    - [2, 13.259]
  - - [3904, 1472, 1, 1024, 3904, 3904, 3904, 1024]
    - [2, 13.295]
  - - [4032, 1472, 1, 1024, 4032, 4032, 4032, 1024]
    - [2, 13.25]
  - - [64, 1600, 1, 1024, 64, 64, 64, 1024]
    - [2, 9.2]
  - - [192, 1600, 1, 1024, 192, 192, 192, 1024]
    - [0, 11.566]
  - - [320, 1600, 1, 1024, 320, 320, 320, 1024]
    - [0, 11.97]
  - - [448, 1600, 1, 1024, 448, 448, 448, 1024]
    - [2, 12.206]
  - - [576, 1600, 1, 1024, 576, 576, 576, 1024]
    - [2, 12.785]
  - - [704, 1600, 1, 1024, 704, 704, 704, 1024]
    - [2, 12.681]
  - - [832, 1600, 1, 1024, 832, 832, 832, 1024]
    - [2, 12.974]
  - - [960, 1600, 1, 1024, 960, 960, 960, 1024]
    - [2, 12.918]
  - - [1088, 1600, 1, 1024, 1088, 1088, 1088, 1024]
    - [2, 12.994]
  - - [1216, 1600, 1, 1024, 1216, 1216, 1216, 1024]
    - [2, 13.061]
  - - [1344, 1600, 1, 1024, 1344, 1344, 1344, 1024]
    - [2, 12.903]
  - - [1472, 1600, 1, 1024, 1472, 1472, 1472, 1024]
    - [2, 12.933]
  - - [1600, 1600, 1, 1024, 1600, 1600, 1600, 1024]
    - [2, 12.934]
  - - [1728, 1600, 1, 1024, 1728, 1728, 1728, 1024]
    - [2, 13.01]
  - - [1856, 1600, 1, 1024, 1856, 1856, 1856, 1024]
    - [2, 13.036]
  - - [1984, 1600, 1, 1024, 1984, 1984, 1984, 1024]
    - [2, 13.045]
  - - [2112, 1600, 1, 1024, 2112, 2112, 2112, 1024]
    - [2, 13.09]
  - - [2240, 1600, 1, 1024, 2240, 2240, 2240, 1024]
    - [2, 13.148]
  - - [2368, 1600, 1, 1024, 2368, 2368, 2368, 1024]
    - [2, 13.155]
  - - [2496, 1600, 1, 1024, 2496, 2496, 2496, 1024]
    - [2, 13.185]
  - - [2624, 1600, 1, 1024, 2624, 2624, 2624, 1024]
    - [2, 13.179]
  - - [2752, 1600, 1, 1024, 2752, 2752, 2752, 1024]
    - [2, 13.166]
  - - [2880, 1600, 1, 1024, 2880, 2880, 2880, 1024]
    - [2, 13.175]
  - - [3008, 1600, 1, 1024, 3008, 3008, 3008, 1024]
    - [2, 13.211]
  - - [3136, 1600, 1, 1024, 3136, 3136, 3136, 1024]
    - [2, 13.232]
  - - [3264, 1600, 1, 1024, 3264, 3264, 3264, 1024]
    - [2, 13.203]
  - - [3392, 1600, 1, 1024, 3392, 3392, 3392, 1024]
    - [2, 13.247]
  - - [3520, 1600, 1, 1024, 3520, 3520, 3520, 1024]
    - [2, 13.277]
  - - [3648, 1600, 1, 1024, 3648, 3648, 3648, 1024]
    - [2, 13.244]
  - - [3776, 1600, 1, 1024, 3776, 3776, 3776, 1024]
    - [2, 13.259]
  - - [3904, 1600, 1, 1024, 3904, 3904, 3904, 1024]
    - [2, 13.27]
  - - [4032, 1600, 1, 1024, 4032, 4032, 4032, 1024]
    - [2, 13.308]
  - - [64, 1728, 1, 1024, 64, 64, 64, 1024]
    - [0, 9.827]
  - - [192, 1728, 1, 1024, 192, 192, 192, 1024]
    - [0, 11.508]
  - - [320, 1728, 1, 1024, 320, 320, 320, 1024]
    - [0, 12.238]
  - - [448, 1728, 1, 1024, 448, 448, 448, 1024]
    - [2, 12.333]
  - - [576, 1728, 1, 1024, 576, 576, 576, 1024]
    - [2, 12.696]
  - - [704, 1728, 1, 1024, 704, 704, 704, 1024]
    - [2, 12.826]
  - - [832, 1728, 1, 1024, 832, 832, 832, 1024]
    - [2, 12.861]
  - - [960, 1728, 1, 1024, 960, 960, 960, 1024]
    - [2, 12.938]
  - - [1088, 1728, 1, 1024, 1088, 1088, 1088, 1024]
    - [2, 12.881]
  - - [1216, 1728, 1, 1024, 1216, 1216, 1216, 1024]
    - [2, 12.954]
  - - [1344, 1728, 1, 1024, 1344, 1344, 1344, 1024]
    - [2, 12.884]
  - - [1472, 1728, 1, 1024, 1472, 1472, 1472, 1024]
    - [2, 12.995]
  - - [1600, 1728, 1, 1024, 1600, 1600, 1600, 1024]
    - [2, 13.014]
  - - [1728, 1728, 1, 1024, 1728, 1728, 1728, 1024]
    - [2, 13.052]
  - - [1856, 1728, 1, 1024, 1856, 1856, 1856, 1024]
    - [2, 13.14]
  - - [1984, 1728, 1, 1024, 1984, 1984, 1984, 1024]
    - [2, 13.076]
  - - [2112, 1728, 1, 1024, 2112, 2112, 2112, 1024]
    - [2, 13.138]
  - - [2240, 1728, 1, 1024, 2240, 2240, 2240, 1024]
    - [2, 13.145]
  - - [2368, 1728, 1, 1024, 2368, 2368, 2368, 1024]
    - [2, 13.17]
  - - [2496, 1728, 1, 1024, 2496, 2496, 2496, 1024]
    - [2, 13.198]
  - - [2624, 1728, 1, 1024, 2624, 2624, 2624, 1024]
    - [2, 13.225]
  - - [2752, 1728, 1, 1024, 2752, 2752, 2752, 1024]
    - [2, 13.242]
  - - [2880, 1728, 1, 1024, 2880, 2880, 2880, 1024]
    - [2, 13.216]
  - - [3008, 1728, 1, 1024, 3008, 3008, 3008, 1024]
    - [2, 13.216]
  - - [3136, 1728, 1, 1024, 3136, 3136, 3136, 1024]
    - [2, 13.289]
  - - [3264, 1728, 1, 1024, 3264, 3264, 3264, 1024]
    - [2, 13.261]
  - - [3392, 1728, 1, 1024, 3392, 3392, 3392, 1024]
    - [2, 13.255]
  - - [3520, 1728, 1, 1024, 3520, 3520, 3520, 1024]
    - [2, 13.276]
  - - [3648, 1728, 1, 1024, 3648, 3648, 3648, 1024]
    - [2, 13.285]
  - - [3776, 1728, 1, 1024, 3776, 3776, 3776, 1024]
    - [2, 13.273]
  - - [3904, 1728, 1, 1024, 3904, 3904, 3904, 1024]
    - [2, 13.292]
  - - [4032, 1728, 1, 1024, 4032, 4032, 4032, 1024]
    - [2, 13.299]
  - - [64, 1856, 1, 1024, 64, 64, 64, 1024]
    - [2, 9.741]
  - - [192, 1856, 1, 1024, 192, 192, 192, 1024]
    - [2, 11.509]
  - - [320, 1856, 1, 1024, 320, 320, 320, 1024]
    - [2, 11.99]
  - - [448, 1856, 1, 1024, 448, 448, 448, 1024]
    - [2, 12.381]
  - - [576, 1856, 1, 1024, 576, 576, 576, 1024]
    - [2, 12.695]
  - - [704, 1856, 1, 1024, 704, 704, 704, 1024]
    - [2, 12.87]
  - - [832, 1856, 1, 1024, 832, 832, 832, 1024]
    - [2, 12.993]
  - - [960, 1856, 1, 1024, 960, 960, 960, 1024]
    - [2, 13.042]
  - - [1088, 1856, 1, 1024, 1088, 1088, 1088, 1024]
    - [2, 13.035]
  - - [1216, 1856, 1, 1024, 1216, 1216, 1216, 1024]
    - [2, 12.894]
  - - [1344, 1856, 1, 1024, 1344, 1344, 1344, 1024]
    - [2, 13.026]
  - - [1472, 1856, 1, 1024, 1472, 1472, 1472, 1024]
    - [2, 13.032]
  - - [1600, 1856, 1, 1024, 1600, 1600, 1600, 1024]
    - [2, 13.077]
  - - [1728, 1856, 1, 1024, 1728, 1728, 1728, 1024]
    - [2, 13.068]
  - - [1856, 1856, 1, 1024, 1856, 1856, 1856, 1024]
    - [2, 13.068]
  - - [1984, 1856, 1, 1024, 1984, 1984, 1984, 1024]
    - [2, 13.11]
  - - [2112, 1856, 1, 1024, 2112, 2112, 2112, 1024]
    - [2, 13.129]
  - - [2240, 1856, 1, 1024, 2240, 2240, 2240, 1024]
    - [2, 13.119]
  - - [2368, 1856, 1, 1024, 2368, 2368, 2368, 1024]
    - [2, 13.151]
  - - [2496, 1856, 1, 1024, 2496, 2496, 2496, 1024]
    - [2, 13.225]
  - - [2624, 1856, 1, 1024, 2624, 2624, 2624, 1024]
    - [2, 13.207]
  - - [2752, 1856, 1, 1024, 2752, 2752, 2752, 1024]
    - [2, 13.254]
  - - [2880, 1856, 1, 1024, 2880, 2880, 2880, 1024]
    - [2, 13.274]
  - - [3008, 1856, 1, 1024, 3008, 3008, 3008, 1024]
    - [2, 13.239]
  - - [3136, 1856, 1, 1024, 3136, 3136, 3136, 1024]
    - [2, 13.26]
  - - [3264, 1856, 1, 1024, 3264, 3264, 3264, 1024]
    - [2, 13.294]
  - - [3392, 1856, 1, 1024, 3392, 3392, 3392, 1024]
    - [2, 13.265]
  - - [3520, 1856, 1, 1024, 3520, 3520, 3520, 1024]
    - [2, 13.245]
  - - [3648, 1856, 1, 1024, 3648, 3648, 3648, 1024]
    - [2, 13.253]
  - - [3776, 1856, 1, 1024, 3776, 3776, 3776, 1024]
    - [2, 13.281]
  - - [3904, 1856, 1, 1024, 3904, 3904, 3904, 1024]
    - [2, 13.304]
  - - [4032, 1856, 1, 1024, 4032, 4032, 4032, 1024]
    - [2, 13.323]
  - - [64, 1984, 1, 1024, 64, 64, 64, 1024]
    - [2, 9.23]
  - - [192, 1984, 1, 1024, 192, 192, 192, 1024]
    - [2, 11.719]
  - - [320, 1984, 1, 1024, 320, 320, 320, 1024]
    - [2, 12.309]
  - - [448, 1984, 1, 1024, 448, 448, 448, 1024]
    - [0, 12.562]
  - - [576, 1984, 1, 1024, 576, 576, 576, 1024]
    - [2, 12.624]
  - - [704, 1984, 1, 1024, 704, 704, 704, 1024]
    - [2, 12.942]
  - - [832, 1984, 1, 1024, 832, 832, 832, 1024]
    - [2, 12.951]
  - - [960, 1984, 1, 1024, 960, 960, 960, 1024]
    - [2, 12.977]
  - - [1088, 1984, 1, 1024, 1088, 1088, 1088, 1024]
    - [2, 12.878]
  - - [1216, 1984, 1, 1024, 1216, 1216, 1216, 1024]
    - [2, 12.992]
  - - [1344, 1984, 1, 1024, 1344, 1344, 1344, 1024]
    - [2, 12.977]
  - - [1472, 1984, 1, 1024, 1472, 1472, 1472, 1024]
    - [2, 12.973]
  - - [1600, 1984, 1, 1024, 1600, 1600, 1600, 1024]
    - [2, 13.092]
  - - [1728, 1984, 1, 1024, 1728, 1728, 1728, 1024]
    - [2, 13.119]
  - - [1856, 1984, 1, 1024, 1856, 1856, 1856, 1024]
    - [2, 13.137]
  - - [1984, 1984, 1, 1024, 1984, 1984, 1984, 1024]
    - [2, 13.173]
  - - [2112, 1984, 1, 1024, 2112, 2112, 2112, 1024]
    - [2, 13.229]
  - - [2240, 1984, 1, 1024, 2240, 2240, 2240, 1024]
    - [2, 13.142]
  - - [2368, 1984, 1, 1024, 2368, 2368, 2368, 1024]
    - [2, 13.194]
  - - [2496, 1984, 1, 1024, 2496, 2496, 2496, 1024]
    - [2, 13.24]
  - - [2624, 1984, 1, 1024, 2624, 2624, 2624, 1024]
    - [2, 13.224]
  - - [2752, 1984, 1, 1024, 2752, 2752, 2752, 1024]
    - [2, 13.256]
  - - [2880, 1984, 1, 1024, 2880, 2880, 2880, 1024]
    - [2, 13.212]
  - - [3008, 1984, 1, 1024, 3008, 3008, 3008, 1024]
    - [2, 13.266]
  - - [3136, 1984, 1, 1024, 3136, 3136, 3136, 1024]
    - [2, 13.272]
  - - [3264, 1984, 1, 1024, 3264, 3264, 3264, 1024]
    - [2, 13.294]
  - - [3392, 1984, 1, 1024, 3392, 3392, 3392, 1024]
    - [2, 13.326]
  - - [3520, 1984, 1, 1024, 3520, 3520, 3520, 1024]
    - [2, 13.324]
  - - [3648, 1984, 1, 1024, 3648, 3648, 3648, 1024]
    - [2, 13.267]
  - - [3776, 1984, 1, 1024, 3776, 3776, 3776, 1024]
    - [2, 13.305]
  - - [3904, 1984, 1, 1024, 3904, 3904, 3904, 1024]
    - [2, 13.345]
  - - [4032, 1984, 1, 1024, 4032, 4032, 4032, 1024]
    - [2, 13.323]
  - - [64, 2112, 1, 1024, 64, 64, 64, 1024]
    - [2, 9.797]
  - - [192, 2112, 1, 1024, 192, 192, 192, 1024]
    - [2, 11.464]
  - - [320, 2112, 1, 1024, 320, 320, 320, 1024]
    - [0, 12.406]
  - - [448, 2112, 1, 1024, 448, 448, 448, 1024]
    - [0, 12.561]
  - - [576, 2112, 1, 1024, 576, 576, 576, 1024]
    - [2, 12.795]
  - - [704, 2112, 1, 1024, 704, 704, 704, 1024]
    - [2, 12.872]
  - - [832, 2112, 1, 1024, 832, 832, 832, 1024]
    - [2, 12.995]
  - - [960, 2112, 1, 1024, 960, 960, 960, 1024]
    - [2, 13.05]
  - - [1088, 2112, 1, 1024, 1088, 1088, 1088, 1024]
    - [2, 12.914]
  - - [1216, 2112, 1, 1024, 1216, 1216, 1216, 1024]
    - [2, 12.995]
  - - [1344, 2112, 1, 1024, 1344, 1344, 1344, 1024]
    - [2, 13.0]
  - - [1472, 2112, 1, 1024, 1472, 1472, 1472, 1024]
    - [2, 13.069]
  - - [1600, 2112, 1, 1024, 1600, 1600, 1600, 1024]
    - [2, 13.092]
  - - [1728, 2112, 1, 1024, 1728, 1728, 1728, 1024]
    - [2, 13.104]
  - - [1856, 2112, 1, 1024, 1856, 1856, 1856, 1024]
    - [2, 13.176]
  - - [1984, 2112, 1, 1024, 1984, 1984, 1984, 1024]
    - [2, 13.148]
  - - [2112, 2112, 1, 1024, 2112, 2112, 2112, 1024]
    - [2, 13.19]
  - - [2240, 2112, 1, 1024, 2240, 2240, 2240, 1024]
    - [2, 13.172]
  - - [2368, 2112, 1, 1024, 2368, 2368, 2368, 1024]
    - [2, 13.232]
  - - [2496, 2112, 1, 1024, 2496, 2496, 2496, 1024]
    - [2, 13.229]
  - - [2624, 2112, 1, 1024, 2624, 2624, 2624, 1024]
    - [2, 13.244]
  - - [2752, 2112, 1, 1024, 2752, 2752, 2752, 1024]
    - [2, 13.271]
  - - [2880, 2112, 1, 1024, 2880, 2880, 2880, 1024]
    - [2, 13.314]
  - - [3008, 2112, 1, 1024, 3008, 3008, 3008, 1024]
    - [2, 13.309]
  - - [3136, 2112, 1, 1024, 3136, 3136, 3136, 1024]
    - [2, 13.293]
  - - [3264, 2112, 1, 1024, 3264, 3264, 3264, 1024]
    - [2, 13.258]
  - - [3392, 2112, 1, 1024, 3392, 3392, 3392, 1024]
    - [2, 13.324]
  - - [3520, 2112, 1, 1024, 3520, 3520, 3520, 1024]
    - [2, 13.308]
  - - [3648, 2112, 1, 1024, 3648, 3648, 3648, 1024]
    - [2, 13.271]
  - - [3776, 2112, 1, 1024, 3776, 3776, 3776, 1024]
    - [2, 13.329]
  - - [3904, 2112, 1, 1024, 3904, 3904, 3904, 1024]
    - [2, 13.327]
  - - [4032, 2112, 1, 1024, 4032, 4032, 4032, 1024]
    - [2, 13.375]
  - - [64, 2240, 1, 1024, 64, 64, 64, 1024]
    - [2, 10.385]
  - - [192, 2240, 1, 1024, 192, 192, 192, 1024]
    - [0, 12.001]
  - - [320, 2240, 1, 1024, 320, 320, 320, 1024]
    - [2, 12.245]
  - - [448, 2240, 1, 1024, 448, 448, 448, 1024]
    - [0, 12.57]
  - - [576, 2240, 1, 1024, 576, 576, 576, 1024]
    - [0, 12.783]
  - - [704, 2240, 1, 1024, 704, 704, 704, 1024]
    - [2, 12.91]
  - - [832, 2240, 1, 1024, 832, 832, 832, 1024]
    - [2, 13.026]
  - - [960, 2240, 1, 1024, 960, 960, 960, 1024]
    - [2, 12.912]
  - - [1088, 2240, 1, 1024, 1088, 1088, 1088, 1024]
    - [2, 12.918]
  - - [1216, 2240, 1, 1024, 1216, 1216, 1216, 1024]
    - [2, 12.978]
  - - [1344, 2240, 1, 1024, 1344, 1344, 1344, 1024]
    - [2, 13.084]
  - - [1472, 2240, 1, 1024, 1472, 1472, 1472, 1024]
    - [2, 13.12]
  - - [1600, 2240, 1, 1024, 1600, 1600, 1600, 1024]
    - [2, 13.129]
  - - [1728, 2240, 1, 1024, 1728, 1728, 1728, 1024]
    - [2, 13.141]
  - - [1856, 2240, 1, 1024, 1856, 1856, 1856, 1024]
    - [2, 13.213]
  - - [1984, 2240, 1, 1024, 1984, 1984, 1984, 1024]
    - [2, 13.164]
  - - [2112, 2240, 1, 1024, 2112, 2112, 2112, 1024]
    - [2, 13.19]
  - - [2240, 2240, 1, 1024, 2240, 2240, 2240, 1024]
    - [2, 13.264]
  - - [2368, 2240, 1, 1024, 2368, 2368, 2368, 1024]
    - [2, 13.232]
  - - [2496, 2240, 1, 1024, 2496, 2496, 2496, 1024]
    - [2, 13.272]
  - - [2624, 2240, 1, 1024, 2624, 2624, 2624, 1024]
    - [2, 13.241]
  - - [2752, 2240, 1, 1024, 2752, 2752, 2752, 1024]
    - [2, 13.264]
  - - [2880, 2240, 1, 1024, 2880, 2880, 2880, 1024]
    - [2, 13.279]
  - - [3008, 2240, 1, 1024, 3008, 3008, 3008, 1024]
    - [2, 13.267]
  - - [3136, 2240, 1, 1024, 3136, 3136, 3136, 1024]
    - [2, 13.269]
  - - [3264, 2240, 1, 1024, 3264, 3264, 3264, 1024]
    - [2, 13.312]
  - - [3392, 2240, 1, 1024, 3392, 3392, 3392, 1024]
    - [2, 13.295]
  - - [3520, 2240, 1, 1024, 3520, 3520, 3520, 1024]
    - [2, 13.291]
  - - [3648, 2240, 1, 1024, 3648, 3648, 3648, 1024]
    - [2, 13.342]
  - - [3776, 2240, 1, 1024, 3776, 3776, 3776, 1024]
    - [2, 13.347]
  - - [3904, 2240, 1, 1024, 3904, 3904, 3904, 1024]
    - [2, 13.313]
  - - [4032, 2240, 1, 1024, 4032, 4032, 4032, 1024]
    - [2, 13.343]
  - - [64, 2368, 1, 1024, 64, 64, 64, 1024]
    - [2, 10.597]
  - - [192, 2368, 1, 1024, 192, 192, 192, 1024]
    - [2, 11.92]
  - - [320, 2368, 1, 1024, 320, 320, 320, 1024]
    - [0, 12.36]
  - - [448, 2368, 1, 1024, 448, 448, 448, 1024]
    - [2, 12.621]
  - - [576, 2368, 1, 1024, 576, 576, 576, 1024]
    - [2, 12.83]
  - - [704, 2368, 1, 1024, 704, 704, 704, 1024]
    - [2, 12.991]
  - - [832, 2368, 1, 1024, 832, 832, 832, 1024]
    - [2, 13.044]
  - - [960, 2368, 1, 1024, 960, 960, 960, 1024]
    - [2, 12.913]
  - - [1088, 2368, 1, 1024, 1088, 1088, 1088, 1024]
    - [2, 12.972]
  - - [1216, 2368, 1, 1024, 1216, 1216, 1216, 1024]
    - [2, 13.012]
  - - [1344, 2368, 1, 1024, 1344, 1344, 1344, 1024]
    - [2, 13.055]
  - - [1472, 2368, 1, 1024, 1472, 1472, 1472, 1024]
    - [2, 13.132]
  - - [1600, 2368, 1, 1024, 1600, 1600, 1600, 1024]
    - [2, 13.127]
  - - [1728, 2368, 1, 1024, 1728, 1728, 1728, 1024]
    - [2, 13.149]
  - - [1856, 2368, 1, 1024, 1856, 1856, 1856, 1024]
    - [2, 13.149]
  - - [1984, 2368, 1, 1024, 1984, 1984, 1984, 1024]
    - [2, 13.199]
  - - [2112, 2368, 1, 1024, 2112, 2112, 2112, 1024]
    - [2, 13.251]
  - - [2240, 2368, 1, 1024, 2240, 2240, 2240, 1024]
    - [2, 13.222]
  - - [2368, 2368, 1, 1024, 2368, 2368, 2368, 1024]
    - [2, 13.27]
  - - [2496, 2368, 1, 1024, 2496, 2496, 2496, 1024]
    - [2, 13.246]
  - - [2624, 2368, 1, 1024, 2624, 2624, 2624, 1024]
    - [2, 13.292]
  - - [2752, 2368, 1, 1024, 2752, 2752, 2752, 1024]
    - [2, 13.29]
  - - [2880, 2368, 1, 1024, 2880, 2880, 2880, 1024]
    - [2, 13.294]
  - - [3008, 2368, 1, 1024, 3008, 3008, 3008, 1024]
    - [2, 13.311]
  - - [3136, 2368, 1, 1024, 3136, 3136, 3136, 1024]
    - [2, 13.327]
  - - [3264, 2368, 1, 1024, 3264, 3264, 3264, 1024]
    - [2, 13.284]
  - - [3392, 2368, 1, 1024, 3392, 3392, 3392, 1024]
    - [2, 13.344]
  - - [3520, 2368, 1, 1024, 3520, 3520, 3520, 1024]
    - [2, 13.352]
  - - [3648, 2368, 1, 1024, 3648, 3648, 3648, 1024]
    - [2, 13.325]
  - - [3776, 2368, 1, 1024, 3776, 3776, 3776, 1024]
    - [2, 13.355]
  - - [3904, 2368, 1, 1024, 3904, 3904, 3904, 1024]
    - [2, 13.337]
  - - [4032, 2368, 1, 1024, 4032, 4032, 4032, 1024]
    - [2, 13.365]
  - - [64, 2496, 1, 1024, 64, 64, 64, 1024]
    - [2, 10.485]
  - - [192, 2496, 1, 1024, 192, 192, 192, 1024]
    - [2, 11.872]
  - - [320, 2496, 1, 1024, 320, 320, 320, 1024]
    - [0, 12.524]
  - - [448, 2496, 1, 1024, 448, 448, 448, 1024]
    - [2, 12.72]
  - - [576, 2496, 1, 1024, 576, 576, 576, 1024]
    - [2, 12.942]
  - - [704, 2496, 1, 1024, 704, 704, 704, 1024]
    - [2, 13.062]
  - - [832, 2496, 1, 1024, 832, 832, 832, 1024]
    - [2, 13.077]
  - - [960, 2496, 1, 1024, 960, 960, 960, 1024]
    - [2, 12.88]
  - - [1088, 2496, 1, 1024, 1088, 1088, 1088, 1024]
    - [2, 13.067]
  - - [1216, 2496, 1, 1024, 1216, 1216, 1216, 1024]
    - [2, 13.026]
  - - [1344, 2496, 1, 1024, 1344, 1344, 1344, 1024]
    - [2, 13.129]
  - - [1472, 2496, 1, 1024, 1472, 1472, 1472, 1024]
    - [2, 13.132]
  - - [1600, 2496, 1, 1024, 1600, 1600, 1600, 1024]
    - [2, 13.134]
  - - [1728, 2496, 1, 1024, 1728, 1728, 1728, 1024]
    - [2, 13.168]
  - - [1856, 2496, 1, 1024, 1856, 1856, 1856, 1024]
    - [2, 13.137]
  - - [1984, 2496, 1, 1024, 1984, 1984, 1984, 1024]
    - [2, 13.198]
  - - [2112, 2496, 1, 1024, 2112, 2112, 2112, 1024]
    - [2, 13.237]
  - - [2240, 2496, 1, 1024, 2240, 2240, 2240, 1024]
    - [2, 13.288]
  - - [2368, 2496, 1, 1024, 2368, 2368, 2368, 1024]
    - [2, 13.269]
  - - [2496, 2496, 1, 1024, 2496, 2496, 2496, 1024]
    - [2, 13.306]
  - - [2624, 2496, 1, 1024, 2624, 2624, 2624, 1024]
    - [2, 13.262]
  - - [2752, 2496, 1, 1024, 2752, 2752, 2752, 1024]
    - [2, 13.296]
  - - [2880, 2496, 1, 1024, 2880, 2880, 2880, 1024]
    - [2, 13.306]
  - - [3008, 2496, 1, 1024, 3008, 3008, 3008, 1024]
    - [2, 13.336]
  - - [3136, 2496, 1, 1024, 3136, 3136, 3136, 1024]
    - [2, 13.283]
  - - [3264, 2496, 1, 1024, 3264, 3264, 3264, 1024]
    - [2, 13.348]
  - - [3392, 2496, 1, 1024, 3392, 3392, 3392, 1024]
    - [2, 13.337]
  - - [3520, 2496, 1, 1024, 3520, 3520, 3520, 1024]
    - [2, 13.32]
  - - [3648, 2496, 1, 1024, 3648, 3648, 3648, 1024]
    - [2, 13.356]
  - - [3776, 2496, 1, 1024, 3776, 3776, 3776, 1024]
    - [2, 13.335]
  - - [3904, 2496, 1, 1024, 3904, 3904, 3904, 1024]
    - [2, 13.398]
  - - [4032, 2496, 1, 1024, 4032, 4032, 4032, 1024]
    - [2, 13.381]
  - - [64, 2624, 1, 1024, 64, 64, 64, 1024]
    - [2, 9.024]
  - - [192, 2624, 1, 1024, 192, 192, 192, 1024]
    - [2, 11.82]
  - - [320, 2624, 1, 1024, 320, 320, 320, 1024]
    - [2, 12.38]
  - - [448, 2624, 1, 1024, 448, 448, 448, 1024]
    - [2, 12.593]
  - - [576, 2624, 1, 1024, 576, 576, 576, 1024]
    - [2, 12.925]
  - - [704, 2624, 1, 1024, 704, 704, 704, 1024]
    - [2, 12.977]
  - - [832, 2624, 1, 1024, 832, 832, 832, 1024]
    - [2, 12.884]
  - - [960, 2624, 1, 1024, 960, 960, 960, 1024]
    - [2, 12.892]
  - - [1088, 2624, 1, 1024, 1088, 1088, 1088, 1024]
    - [2, 12.984]
  - - [1216, 2624, 1, 1024, 1216, 1216, 1216, 1024]
    - [2, 13.098]
  - - [1344, 2624, 1, 1024, 1344, 1344, 1344, 1024]
    - [2, 13.117]
  - - [1472, 2624, 1, 1024, 1472, 1472, 1472, 1024]
    - [2, 13.186]
  - - [1600, 2624, 1, 1024, 1600, 1600, 1600, 1024]
    - [2, 13.17]
  - - [1728, 2624, 1, 1024, 1728, 1728, 1728, 1024]
    - [2, 13.208]
  - - [1856, 2624, 1, 1024, 1856, 1856, 1856, 1024]
    - [2, 13.22]
  - - [1984, 2624, 1, 1024, 1984, 1984, 1984, 1024]
    - [2, 13.269]
  - - [2112, 2624, 1, 1024, 2112, 2112, 2112, 1024]
    - [2, 13.26]
  - - [2240, 2624, 1, 1024, 2240, 2240, 2240, 1024]
    - [2, 13.276]
  - - [2368, 2624, 1, 1024, 2368, 2368, 2368, 1024]
    - [2, 13.265]
  - - [2496, 2624, 1, 1024, 2496, 2496, 2496, 1024]
    - [2, 13.299]
  - - [2624, 2624, 1, 1024, 2624, 2624, 2624, 1024]
    - [2, 13.287]
  - - [2752, 2624, 1, 1024, 2752, 2752, 2752, 1024]
    - [2, 13.343]
  - - [2880, 2624, 1, 1024, 2880, 2880, 2880, 1024]
    - [2, 13.305]
  - - [3008, 2624, 1, 1024, 3008, 3008, 3008, 1024]
    - [2, 13.321]
  - - [3136, 2624, 1, 1024, 3136, 3136, 3136, 1024]
    - [2, 13.332]
  - - [3264, 2624, 1, 1024, 3264, 3264, 3264, 1024]
    - [2, 13.331]
  - - [3392, 2624, 1, 1024, 3392, 3392, 3392, 1024]
    - [2, 13.35]
  - - [3520, 2624, 1, 1024, 3520, 3520, 3520, 1024]
    - [2, 13.318]
  - - [3648, 2624, 1, 1024, 3648, 3648, 3648, 1024]
    - [2, 13.381]
  - - [3776, 2624, 1, 1024, 3776, 3776, 3776, 1024]
    - [2, 13.358]
  - - [3904, 2624, 1, 1024, 3904, 3904, 3904, 1024]
    - [2, 13.379]
  - - [4032, 2624, 1, 1024, 4032, 4032, 4032, 1024]
    - [2, 13.375]
  - - [64, 2752, 1, 1024, 64, 64, 64, 1024]
    - [2, 11.274]
  - - [192, 2752, 1, 1024, 192, 192, 192, 1024]
    - [2, 11.808]
  - - [320, 2752, 1, 1024, 320, 320, 320, 1024]
    - [2, 12.504]
  - - [448, 2752, 1, 1024, 448, 448, 448, 1024]
    - [2, 12.76]
  - - [576, 2752, 1, 1024, 576, 576, 576, 1024]
    - [2, 12.895]
  - - [704, 2752, 1, 1024, 704, 704, 704, 1024]
    - [2, 12.946]
  - - [832, 2752, 1, 1024, 832, 832, 832, 1024]
    - [2, 12.929]
  - - [960, 2752, 1, 1024, 960, 960, 960, 1024]
    - [2, 13.04]
  - - [1088, 2752, 1, 1024, 1088, 1088, 1088, 1024]
    - [2, 13.001]
  - - [1216, 2752, 1, 1024, 1216, 1216, 1216, 1024]
    - [2, 13.081]
  - - [1344, 2752, 1, 1024, 1344, 1344, 1344, 1024]
    - [2, 13.116]
  - - [1472, 2752, 1, 1024, 1472, 1472, 1472, 1024]
    - [2, 13.11]
  - - [1600, 2752, 1, 1024, 1600, 1600, 1600, 1024]
    - [2, 13.153]
  - - [1728, 2752, 1, 1024, 1728, 1728, 1728, 1024]
    - [2, 13.199]
  - - [1856, 2752, 1, 1024, 1856, 1856, 1856, 1024]
    - [2, 13.223]
  - - [1984, 2752, 1, 1024, 1984, 1984, 1984, 1024]
    - [2, 13.256]
  - - [2112, 2752, 1, 1024, 2112, 2112, 2112, 1024]
    - [2, 13.291]
  - - [2240, 2752, 1, 1024, 2240, 2240, 2240, 1024]
    - [2, 13.257]
  - - [2368, 2752, 1, 1024, 2368, 2368, 2368, 1024]
    - [2, 13.303]
  - - [2496, 2752, 1, 1024, 2496, 2496, 2496, 1024]
    - [2, 13.291]
  - - [2624, 2752, 1, 1024, 2624, 2624, 2624, 1024]
    - [2, 13.307]
  - - [2752, 2752, 1, 1024, 2752, 2752, 2752, 1024]
    - [2, 13.3]
  - - [2880, 2752, 1, 1024, 2880, 2880, 2880, 1024]
    - [2, 13.325]
  - - [3008, 2752, 1, 1024, 3008, 3008, 3008, 1024]
    - [2, 13.327]
  - - [3136, 2752, 1, 1024, 3136, 3136, 3136, 1024]
    - [2, 13.339]
  - - [3264, 2752, 1, 1024, 3264, 3264, 3264, 1024]
    - [2, 13.366]
  - - [3392, 2752, 1, 1024, 3392, 3392, 3392, 1024]
    - [2, 13.36]
  - - [3520, 2752, 1, 1024, 3520, 3520, 3520, 1024]
    - [2, 13.356]
  - - [3648, 2752, 1, 1024, 3648, 3648, 3648, 1024]
    - [2, 13.375]
  - - [3776, 2752, 1, 1024, 3776, 3776, 3776, 1024]
    - [2, 13.362]
  - - [3904, 2752, 1, 1024, 3904, 3904, 3904, 1024]
    - [2, 13.385]
  - - [4032, 2752, 1, 1024, 4032, 4032, 4032, 1024]
    - [2, 13.348]
  - - [64, 2880, 1, 1024, 64, 64, 64, 1024]
    - [2, 10.742]
  - - [192, 2880, 1, 1024, 192, 192, 192, 1024]
    - [0, 12.241]
  - - [320, 2880, 1, 1024, 320, 320, 320, 1024]
    - [0, 12.615]
  - - [448, 2880, 1, 1024, 448, 448, 448, 1024]
    - [0, 12.773]
  - - [576, 2880, 1, 1024, 576, 576, 576, 1024]
    - [2, 12.929]
  - - [704, 2880, 1, 1024, 704, 704, 704, 1024]
    - [2, 13.07]
  - - [832, 2880, 1, 1024, 832, 832, 832, 1024]
    - [2, 12.939]
  - - [960, 2880, 1, 1024, 960, 960, 960, 1024]
    - [2, 13.002]
  - - [1088, 2880, 1, 1024, 1088, 1088, 1088, 1024]
    - [2, 13.055]
  - - [1216, 2880, 1, 1024, 1216, 1216, 1216, 1024]
    - [2, 13.138]
  - - [1344, 2880, 1, 1024, 1344, 1344, 1344, 1024]
    - [2, 13.203]
  - - [1472, 2880, 1, 1024, 1472, 1472, 1472, 1024]
    - [2, 13.195]
  - - [1600, 2880, 1, 1024, 1600, 1600, 1600, 1024]
    - [2, 13.181]
  - - [1728, 2880, 1, 1024, 1728, 1728, 1728, 1024]
    - [2, 13.219]
  - - [1856, 2880, 1, 1024, 1856, 1856, 1856, 1024]
    - [2, 13.251]
  - - [1984, 2880, 1, 1024, 1984, 1984, 1984, 1024]
    - [2, 13.261]
  - - [2112, 2880, 1, 1024, 2112, 2112, 2112, 1024]
    - [2, 13.25]
  - - [2240, 2880, 1, 1024, 2240, 2240, 2240, 1024]
    - [2, 13.251]
  - - [2368, 2880, 1, 1024, 2368, 2368, 2368, 1024]
    - [2, 13.29]
  - - [2496, 2880, 1, 1024, 2496, 2496, 2496, 1024]
    - [2, 13.316]
  - - [2624, 2880, 1, 1024, 2624, 2624, 2624, 1024]
    - [2, 13.341]
  - - [2752, 2880, 1, 1024, 2752, 2752, 2752, 1024]
    - [2, 13.317]
  - - [2880, 2880, 1, 1024, 2880, 2880, 2880, 1024]
    - [2, 13.315]
  - - [3008, 2880, 1, 1024, 3008, 3008, 3008, 1024]
    - [2, 13.359]
  - - [3136, 2880, 1, 1024, 3136, 3136, 3136, 1024]
    - [2, 13.34]
  - - [3264, 2880, 1, 1024, 3264, 3264, 3264, 1024]
    - [2, 13.361]
  - - [3392, 2880, 1, 1024, 3392, 3392, 3392, 1024]
    - [2, 13.4]
  - - [3520, 2880, 1, 1024, 3520, 3520, 3520, 1024]
    - [2, 13.37]
  - - [3648, 2880, 1, 1024, 3648, 3648, 3648, 1024]
    - [2, 13.374]
  - - [3776, 2880, 1, 1024, 3776, 3776, 3776, 1024]
    - [2, 13.368]
  - - [3904, 2880, 1, 1024, 3904, 3904, 3904, 1024]
    - [2, 13.369]
  - - [4032, 2880, 1, 1024, 4032, 4032, 4032, 1024]
    - [2, 13.388]
  - - [64, 3008, 1, 1024, 64, 64, 64, 1024]
    - [2, 10.731]
  - - [192, 3008, 1, 1024, 192, 192, 192, 1024]
    - [0, 12.181]
  - - [320, 3008, 1, 1024, 320, 320, 320, 1024]
    - [2, 12.613]
  - - [448, 3008, 1, 1024, 448, 448, 448, 1024]
    - [2, 12.878]
  - - [576, 3008, 1, 1024, 576, 576, 576, 1024]
    - [2, 12.981]
  - - [704, 3008, 1, 1024, 704, 704, 704, 1024]
    - [2, 13.009]
  - - [832, 3008, 1, 1024, 832, 832, 832, 1024]
    - [2, 12.927]
  - - [960, 3008, 1, 1024, 960, 960, 960, 1024]
    - [2, 13.1]
  - - [1088, 3008, 1, 1024, 1088, 1088, 1088, 1024]
    - [2, 13.107]
  - - [1216, 3008, 1, 1024, 1216, 1216, 1216, 1024]
    - [2, 13.128]
  - - [1344, 3008, 1, 1024, 1344, 1344, 1344, 1024]
    - [2, 13.127]
  - - [1472, 3008, 1, 1024, 1472, 1472, 1472, 1024]
    - [2, 13.212]
  - - [1600, 3008, 1, 1024, 1600, 1600, 1600, 1024]
    - [2, 13.203]
  - - [1728, 3008, 1, 1024, 1728, 1728, 1728, 1024]
    - [2, 13.211]
  - - [1856, 3008, 1, 1024, 1856, 1856, 1856, 1024]
    - [2, 13.287]
  - - [1984, 3008, 1, 1024, 1984, 1984, 1984, 1024]
    - [2, 13.27]
  - - [2112, 3008, 1, 1024, 2112, 2112, 2112, 1024]
    - [2, 13.265]
  - - [2240, 3008, 1, 1024, 2240, 2240, 2240, 1024]
    - [2, 13.3]
  - - [2368, 3008, 1, 1024, 2368, 2368, 2368, 1024]
    - [2, 13.311]
  - - [2496, 3008, 1, 1024, 2496, 2496, 2496, 1024]
    - [2, 13.339]
  - - [2624, 3008, 1, 1024, 2624, 2624, 2624, 1024]
    - [2, 13.319]
  - - [2752, 3008, 1, 1024, 2752, 2752, 2752, 1024]
    - [2, 13.335]
  - - [2880, 3008, 1, 1024, 2880, 2880, 2880, 1024]
    - [2, 13.336]
  - - [3008, 3008, 1, 1024, 3008, 3008, 3008, 1024]
    - [2, 13.342]
  - - [3136, 3008, 1, 1024, 3136, 3136, 3136, 1024]
    - [2, 13.359]
  - - [3264, 3008, 1, 1024, 3264, 3264, 3264, 1024]
    - [2, 13.363]
  - - [3392, 3008, 1, 1024, 3392, 3392, 3392, 1024]
    - [2, 13.326]
  - - [3520, 3008, 1, 1024, 3520, 3520, 3520, 1024]
    - [2, 13.351]
  - - [3648, 3008, 1, 1024, 3648, 3648, 3648, 1024]
    - [2, 13.405]
  - - [3776, 3008, 1, 1024, 3776, 3776, 3776, 1024]
    - [2, 13.347]
  - - [3904, 3008, 1, 1024, 3904, 3904, 3904, 1024]
    - [2, 13.388]
  - - [4032, 3008, 1, 1024, 4032, 4032, 4032, 1024]
    - [2, 13.391]
  - - [64, 3136, 1, 1024, 64, 64, 64, 1024]
    - [2, 11.188]
  - - [192, 3136, 1, 1024, 192, 192, 192, 1024]
    - [0, 12.126]
  - - [320, 3136, 1, 1024, 320, 320, 320, 1024]
    - [2, 12.592]
  - - [448, 3136, 1, 1024, 448, 448, 448, 1024]
    - [2, 12.956]
  - - [576, 3136, 1, 1024, 576, 576, 576, 1024]
    - [2, 13.033]
  - - [704, 3136, 1, 1024, 704, 704, 704, 1024]
    - [2, 12.874]
  - - [832, 3136, 1, 1024, 832, 832, 832, 1024]
    - [2, 12.974]
  - - [960, 3136, 1, 1024, 960, 960, 960, 1024]
    - [2, 13.04]
  - - [1088, 3136, 1, 1024, 1088, 1088, 1088, 1024]
    - [2, 13.119]
  - - [1216, 3136, 1, 1024, 1216, 1216, 1216, 1024]
    - [2, 13.18]
  - - [1344, 3136, 1, 1024, 1344, 1344, 1344, 1024]
    - [2, 13.188]
  - - [1472, 3136, 1, 1024, 1472, 1472, 1472, 1024]
    - [2, 13.168]
  - - [1600, 3136, 1, 1024, 1600, 1600, 1600, 1024]
    - [2, 13.221]
  - - [1728, 3136, 1, 1024, 1728, 1728, 1728, 1024]
    - [2, 13.214]
  - - [1856, 3136, 1, 1024, 1856, 1856, 1856, 1024]
    - [2, 13.215]
  - - [1984, 3136, 1, 1024, 1984, 1984, 1984, 1024]
    - [2, 13.297]
  - - [2112, 3136, 1, 1024, 2112, 2112, 2112, 1024]
    - [2, 13.256]
  - - [2240, 3136, 1, 1024, 2240, 2240, 2240, 1024]
    - [2, 13.306]
  - - [2368, 3136, 1, 1024, 2368, 2368, 2368, 1024]
    - [2, 13.306]
  - - [2496, 3136, 1, 1024, 2496, 2496, 2496, 1024]
    - [2, 13.341]
  - - [2624, 3136, 1, 1024, 2624, 2624, 2624, 1024]
    - [2, 13.335]
