library/src/amd_detail/rocblaslt/src/Tensile/Logic/asm_full/navi32/GridBased/navi32_Cijk_Alik_Bjlk_HHS_BH_Bias_HAS_SAV_UserArgs.yaml
- {MinimumRequiredVersion: 4.33.0}
- navi32
- gfx1101
- [Device 73f0]
    SolutionIndex: 0
    SolutionNameMin: Cijk_Alik_Bjlk_HHS_BH_Bias_AuxH_HAS_SAV_UserArgs_MT32x32x32_MI16x16x1_SN_LDSB0_GRVWA8_GRVWB8_GSU1_LBSPPA128_LBSPPB1024_MIWT1_1_NLCB1_SS0_SU32_SUM0_SUS256_TLDS1_WG32_4_1_WGM8
    SolutionIndex: 1
    SolutionNameMin: Cijk_Alik_Bjlk_HHS_BH_Bias_AuxH_HAS_SAV_UserArgs_MT32x32x32_MI16x16x1_SN_LDSB0_GRVWA8_GRVWB1_GSU1_LBSPPA128_LBSPPB1024_MIWT1_1_NLCB1_SS0_SU32_SUM0_SUS256_TLDS1_WG32_4_1_WGM8
    SolutionIndex: 2
    SolutionNameMin: Cijk_Alik_Bjlk_HHS_BH_Bias_AuxH_HAS_SAV_UserArgs_MT16x64x32_MI16x16x1_SN_LDSB0_GRVWA4_GRVWB8_GSU1_LBSPPA128_LBSPPB2048_MIWT1_1_NLCB1_SS0_SU32_SUM0_SUS256_TLDS1_WG16_8_1_WGM8
    SolutionIndex: 3
    SolutionNameMin: Cijk_Alik_Bjlk_HHS_BH_Bias_AuxH_HAS_SAV_UserArgs_MT96x96x32_MI16x16x1_SN_LDSB0_GRVWA8_GRVWB8_GSU1_LBSPPA128_LBSPPB3072_MIWT3_3_NLCB3_SS0_SU32_SUM0_SUS256_TLDS1_WG32_4_1_WGM8
    SolutionIndex: 4
    SolutionNameMin: Cijk_Alik_Bjlk_HHS_BH_Bias_AuxH_HAS_SAV_UserArgs_MT16x64x64_MI16x16x1_SN_LDSB0_GRVWA8_GRVWB8_GSU1_LBSPPA512_LBSPPB2048_MIWT1_1_NLCB1_SS0_SU32_SUM0_SUS256_TLDS0_WG16_8_1_WGM8
    SolutionIndex: 5
    SolutionNameMin: Cijk_Alik_Bjlk_HHS_BH_Bias_AuxH_HAS_SAV_UserArgs_MT16x64x64_MI16x16x1_SN_LDSB0_GRVWA8_GRVWB8_GSU1_LBSPPA128_LBSPPB2048_MIWT1_1_NLCB1_SS0_SU32_SUM0_SUS256_TLDS1_WG16_8_1_WGM8
    SolutionIndex: 6
    SolutionNameMin: Cijk_Alik_Bjlk_HHS_BH_Bias_AuxH_HAS_SAV_UserArgs_MT16x64x64_MI16x16x1_SN_LDSB0_GRVWA8_GRVWB8_GSU4_LBSPPA128_LBSPPB2048_MIWT1_1_NLCB1_SS0_SU32_SUM0_SUS256_TLDS1_WG16_8_1_WGM8
    SolutionIndex: 7
    SolutionNameMin: Cijk_Alik_Bjlk_HHS_BH_Bias_AuxH_HAS_SAV_UserArgs_MT48x64x64_MI16x16x1_SN_LDSB0_GRVWA8_GRVWB8_GSU4_LBSPPA128_LBSPPB2048_MIWT3_1_NLCB1_SS0_SU32_SUM0_SUS256_TLDS1_WG16_8_1_WGM8
    SolutionIndex: 8
    SolutionNameMin: Cijk_Alik_Bjlk_HHS_BH_Bias_AuxH_HAS_SAV_UserArgs_MT64x16x32_MI16x16x1_SN_LDSB0_GRVWA8_GRVWB1_GSU1_LBSPPA2048_LBSPPB512_MIWT1_1_NLCB1_SS1_SU32_SUM0_SUS256_TLDS0_WG64_2_1_WGM8
    SolutionIndex: 9
    SolutionNameMin: Cijk_Alik_Bjlk_HHS_BH_Bias_AuxH_HAS_SAV_UserArgs_MT64x16x32_MI16x16x1_SN_LDSB0_GRVWA1_GRVWB1_GSU1_LBSPPA128_LBSPPB512_MIWT1_1_NLCB1_SS1_SU32_SUM0_SUS256_TLDS1_WG64_2_1_WGM8
    SolutionIndex: 10
    SolutionNameMin: Cijk_Alik_Bjlk_HHS_BH_Bias_AuxH_HAS_SAV_UserArgs_MT256x16x32_MI16x16x1_SN_LDSB1_GRVWA8_GRVWB1_GSU1_LBSPPA8192_LBSPPB512_MIWT4_1_NLCB1_SS1_SU32_SUM0_SUS256_TLDS0_WG64_2_1_WGM8
    SolutionIndex: 11
    SolutionNameMin: Cijk_Alik_Bjlk_HHS_BH_Bias_AuxH_HAS_SAV_UserArgs_MT32x32x32_MI16x16x1_SN_LDSB0_GRVWA8_GRVWB2_GSU1_LBSPPA1024_LBSPPB1024_MIWT1_1_NLCB1_SS1_SU32_SUM0_SUS256_TLDS0_WG32_4_1_WGM8
    SolutionIndex: 12
    SolutionNameMin: Cijk_Alik_Bjlk_HHS_BH_Bias_AuxH_HAS_SAV_UserArgs_MT32x32x32_MI16x16x1_SN_LDSB0_GRVWA8_GRVWB2_GSU1_LBSPPA128_LBSPPB1024_MIWT1_1_NLCB1_SS1_SU32_SUM0_SUS256_TLDS1_WG32_4_1_WGM8
    SolutionIndex: 13
    SolutionNameMin: Cijk_Alik_Bjlk_HHS_BH_Bias_AuxH_HAS_SAV_UserArgs_MT32x32x32_MI16x16x1_SN_LDSB0_GRVWA1_GRVWB2_GSU1_LBSPPA1024_LBSPPB1024_MIWT1_1_NLCB1_SS1_SU32_SUM0_SUS256_TLDS0_WG32_4_1_WGM8
    SolutionIndex: 14
    SolutionNameMin: Cijk_Alik_Bjlk_HHS_BH_Bias_AuxH_HAS_SAV_UserArgs_MT32x32x32_MI16x16x1_SN_LDSB0_GRVWA1_GRVWB2_GSU1_LBSPPA128_LBSPPB1024_MIWT1_1_NLCB1_SS1_SU32_SUM0_SUS256_TLDS1_WG32_4_1_WGM8
    SolutionIndex: 15
    SolutionNameMin: Cijk_Alik_Bjlk_HHS_BH_Bias_AuxH_HAS_SAV_UserArgs_MT32x32x32_MI16x16x1_SN_LDSB0_GRVWA8_GRVWB1_GSU1_LBSPPA128_LBSPPB1024_MIWT1_1_NLCB1_SS1_SU32_SUM0_SUS256_TLDS1_WG32_4_1_WGM8
    SolutionIndex: 16
    SolutionNameMin: Cijk_Alik_Bjlk_HHS_BH_Bias_AuxH_HAS_SAV_UserArgs_MT32x32x32_MI16x16x1_SN_LDSB0_GRVWA1_GRVWB1_GSU1_LBSPPA1024_LBSPPB1024_MIWT1_1_NLCB1_SS1_SU32_SUM0_SUS256_TLDS0_WG32_4_1_WGM8
    SolutionIndex: 17
    SolutionNameMin: Cijk_Alik_Bjlk_HHS_BH_Bias_AuxH_HAS_SAV_UserArgs_MT32x32x32_MI16x16x1_SN_LDSB0_GRVWA1_GRVWB1_GSU1_LBSPPA128_LBSPPB1024_MIWT1_1_NLCB1_SS1_SU32_SUM0_SUS256_TLDS1_WG32_4_1_WGM8
    SolutionIndex: 18
    SolutionNameMin: Cijk_Alik_Bjlk_HHS_BH_Bias_AuxH_HAS_SAV_UserArgs_MT32x32x32_MI16x16x1_SN_LDSB0_GRVWA8_GRVWB2_GSU4_LBSPPA128_LBSPPB1024_MIWT1_1_NLCB1_SS1_SU32_SUM0_SUS256_TLDS1_WG32_4_1_WGM8
    SolutionIndex: 19
    SolutionNameMin: Cijk_Alik_Bjlk_HHS_BH_Bias_AuxH_HAS_SAV_UserArgs_MT32x32x32_MI16x16x1_SN_LDSB0_GRVWA8_GRVWB1_GSU4_LBSPPA128_LBSPPB1024_MIWT1_1_NLCB1_SS1_SU32_SUM0_SUS256_TLDS1_WG32_4_1_WGM8
    SolutionIndex: 20
    SolutionNameMin: Cijk_Alik_Bjlk_HHS_BH_Bias_AuxH_HAS_SAV_UserArgs_MT64x32x32_MI16x16x1_SN_LDSB0_GRVWA8_GRVWB2_GSU1_LBSPPA2048_LBSPPB1024_MIWT2_1_NLCB1_SS1_SU32_SUM0_SUS256_TLDS0_WG32_4_1_WGM8
    SolutionIndex: 21
    SolutionNameMin: Cijk_Alik_Bjlk_HHS_BH_Bias_AuxH_HAS_SAV_UserArgs_MT64x32x32_MI16x16x1_SN_LDSB0_GRVWA8_GRVWB1_GSU1_LBSPPA2048_LBSPPB1024_MIWT2_1_NLCB1_SS1_SU32_SUM0_SUS256_TLDS0_WG32_4_1_WGM8
    SolutionIndex: 22
    SolutionNameMin: Cijk_Alik_Bjlk_HHS_BH_Bias_AuxH_HAS_SAV_UserArgs_MT64x32x32_MI16x16x1_SN_LDSB0_GRVWA1_GRVWB1_GSU1_LBSPPA128_LBSPPB1024_MIWT2_1_NLCB1_SS1_SU32_SUM0_SUS256_TLDS1_WG32_4_1_WGM8
    SolutionIndex: 23
    SolutionNameMin: Cijk_Alik_Bjlk_HHS_BH_Bias_AuxH_HAS_SAV_UserArgs_MT96x32x32_MI16x16x1_SN_LDSB0_GRVWA8_GRVWB2_GSU1_LBSPPA128_LBSPPB1024_MIWT3_1_NLCB1_SS1_SU32_SUM0_SUS256_TLDS1_WG32_4_1_WGM8
    SolutionIndex: 24
    SolutionNameMin: Cijk_Alik_Bjlk_HHS_BH_Bias_AuxH_HAS_SAV_UserArgs_MT96x32x32_MI16x16x1_SN_LDSB0_GRVWA8_GRVWB1_GSU1_LBSPPA128_LBSPPB1024_MIWT3_1_NLCB1_SS1_SU32_SUM0_SUS256_TLDS1_WG32_4_1_WGM8
    SolutionIndex: 25
    SolutionNameMin: Cijk_Alik_Bjlk_HHS_BH_Bias_AuxH_HAS_SAV_UserArgs_MT160x32x32_MI16x16x1_SN_LDSB0_GRVWA8_GRVWB2_GSU1_LBSPPA128_LBSPPB1024_MIWT5_1_NLCB1_SS1_SU32_SUM0_SUS256_TLDS1_WG32_4_1_WGM8
    SolutionIndex: 26
    SolutionNameMin: Cijk_Alik_Bjlk_HHS_BH_Bias_AuxH_HAS_SAV_UserArgs_MT224x32x32_MI16x16x1_SN_LDSB1_GRVWA8_GRVWB2_GSU1_LBSPPA128_LBSPPB1024_MIWT7_1_NLCB1_SS1_SU32_SUM0_SUS256_TLDS1_WG32_4_1_WGM8
    SolutionIndex: 27
    SolutionNameMin: Cijk_Alik_Bjlk_HHS_BH_Bias_AuxH_HAS_SAV_UserArgs_MT224x32x32_MI16x16x1_SN_LDSB1_GRVWA8_GRVWB1_GSU1_LBSPPA128_LBSPPB1024_MIWT7_1_NLCB1_SS1_SU32_SUM0_SUS256_TLDS1_WG32_4_1_WGM8
    SolutionIndex: 28
    SolutionNameMin: Cijk_Alik_Bjlk_HHS_BH_Bias_AuxH_HAS_SAV_UserArgs_MT128x48x32_MI16x16x1_SN_LDSB0_GRVWA8_GRVWB2_GSU1_LBSPPA4096_LBSPPB1536_MIWT2_3_NLCB3_SS1_SU32_SUM0_SUS256_TLDS0_WG64_2_1_WGM8
    SolutionIndex: 29
    SolutionNameMin: Cijk_Alik_Bjlk_HHS_BH_Bias_AuxH_HAS_SAV_UserArgs_MT16x64x32_MI16x16x1_SN_LDSB0_GRVWA4_GRVWB2_GSU1_LBSPPA512_LBSPPB2048_MIWT1_1_NLCB1_SS1_SU32_SUM0_SUS256_TLDS0_WG16_8_1_WGM8
    SolutionIndex: 30
    SolutionNameMin: Cijk_Alik_Bjlk_HHS_BH_Bias_AuxH_HAS_SAV_UserArgs_MT16x64x32_MI16x16x1_SN_LDSB0_GRVWA4_GRVWB2_GSU1_LBSPPA128_LBSPPB2048_MIWT1_1_NLCB1_SS1_SU32_SUM0_SUS256_TLDS1_WG16_8_1_WGM8
    SolutionIndex: 31
    SolutionNameMin: Cijk_Alik_Bjlk_HHS_BH_Bias_AuxH_HAS_SAV_UserArgs_MT16x64x32_MI16x16x1_SN_LDSB0_GRVWA1_GRVWB2_GSU1_LBSPPA128_LBSPPB2048_MIWT1_1_NLCB1_SS1_SU32_SUM0_SUS256_TLDS1_WG16_8_1_WGM8
    SolutionIndex: 32
    SolutionNameMin: Cijk_Alik_Bjlk_HHS_BH_Bias_AuxH_HAS_SAV_UserArgs_MT16x64x32_MI16x16x1_SN_LDSB0_GRVWA4_GRVWB1_GSU1_LBSPPA512_LBSPPB2048_MIWT1_1_NLCB1_SS1_SU32_SUM0_SUS256_TLDS0_WG16_8_1_WGM8
    SolutionIndex: 33
    SolutionNameMin: Cijk_Alik_Bjlk_HHS_BH_Bias_AuxH_HAS_SAV_UserArgs_MT16x64x32_MI16x16x1_SN_LDSB0_GRVWA4_GRVWB1_GSU1_LBSPPA128_LBSPPB2048_MIWT1_1_NLCB1_SS1_SU32_SUM0_SUS256_TLDS1_WG16_8_1_WGM8
    SolutionIndex: 34
    SolutionNameMin: Cijk_Alik_Bjlk_HHS_BH_Bias_AuxH_HAS_SAV_UserArgs_MT16x64x32_MI16x16x1_SN_LDSB0_GRVWA1_GRVWB1_GSU1_LBSPPA128_LBSPPB2048_MIWT1_1_NLCB1_SS1_SU32_SUM0_SUS256_TLDS1_WG16_8_1_WGM8
    SolutionIndex: 35
    SolutionNameMin: Cijk_Alik_Bjlk_HHS_BH_Bias_AuxH_HAS_SAV_UserArgs_MT16x64x32_MI16x16x1_SN_LDSB0_GRVWA4_GRVWB2_GSU4_LBSPPA128_LBSPPB2048_MIWT1_1_NLCB1_SS1_SU32_SUM0_SUS256_TLDS1_WG16_8_1_WGM8
    SolutionIndex: 36
    SolutionNameMin: Cijk_Alik_Bjlk_HHS_BH_Bias_AuxH_HAS_SAV_UserArgs_MT32x64x32_MI16x16x1_SN_LDSB0_GRVWA8_GRVWB2_GSU1_LBSPPA128_LBSPPB2048_MIWT2_1_NLCB1_SS1_SU32_SUM0_SUS256_TLDS1_WG16_8_1_WGM8
    SolutionIndex: 37
    SolutionNameMin: Cijk_Alik_Bjlk_HHS_BH_Bias_AuxH_HAS_SAV_UserArgs_MT32x64x32_MI16x16x1_SN_LDSB0_GRVWA8_GRVWB1_GSU1_LBSPPA1024_LBSPPB2048_MIWT2_1_NLCB1_SS1_SU32_SUM0_SUS256_TLDS0_WG16_8_1_WGM8
    SolutionIndex: 38
    SolutionNameMin: Cijk_Alik_Bjlk_HHS_BH_Bias_AuxH_HAS_SAV_UserArgs_MT32x64x32_MI16x16x1_SN_LDSB0_GRVWA8_GRVWB1_GSU1_LBSPPA128_LBSPPB2048_MIWT2_1_NLCB1_SS1_SU32_SUM0_SUS256_TLDS1_WG16_8_1_WGM8
    SolutionIndex: 39
    SolutionNameMin: Cijk_Alik_Bjlk_HHS_BH_Bias_AuxH_HAS_SAV_UserArgs_MT32x64x32_MI16x16x1_SN_LDSB0_GRVWA1_GRVWB1_GSU1_LBSPPA128_LBSPPB2048_MIWT2_1_NLCB1_SS1_SU32_SUM0_SUS256_TLDS1_WG16_8_1_WGM8
    SolutionIndex: 40
    SolutionNameMin: Cijk_Alik_Bjlk_HHS_BH_Bias_AuxH_HAS_SAV_UserArgs_MT32x64x32_MI16x16x1_SN_LDSB0_GRVWA8_GRVWB2_GSU4_LBSPPA128_LBSPPB2048_MIWT2_1_NLCB1_SS1_SU32_SUM0_SUS256_TLDS1_WG16_8_1_WGM8
    SolutionIndex: 41
    SolutionNameMin: Cijk_Alik_Bjlk_HHS_BH_Bias_AuxH_HAS_SAV_UserArgs_MT32x64x32_MI16x16x1_SN_LDSB0_GRVWA1_GRVWB2_GSU4_LBSPPA128_LBSPPB2048_MIWT2_1_NLCB1_SS1_SU32_SUM0_SUS256_TLDS1_WG16_8_1_WGM8
    SolutionIndex: 42
    SolutionNameMin: Cijk_Alik_Bjlk_HHS_BH_Bias_AuxH_HAS_SAV_UserArgs_MT48x64x32_MI16x16x1_SN_LDSB0_GRVWA4_GRVWB2_GSU1_LBSPPA128_LBSPPB2048_MIWT3_1_NLCB1_SS1_SU32_SUM0_SUS256_TLDS1_WG16_8_1_WGM8
    SolutionIndex: 43
    SolutionNameMin: Cijk_Alik_Bjlk_HHS_BH_Bias_AuxH_HAS_SAV_UserArgs_MT48x64x32_MI16x16x1_SN_LDSB0_GRVWA4_GRVWB1_GSU1_LBSPPA1536_LBSPPB2048_MIWT3_1_NLCB1_SS1_SU32_SUM0_SUS256_TLDS0_WG16_8_1_WGM8
    SolutionIndex: 44
    SolutionNameMin: Cijk_Alik_Bjlk_HHS_BH_Bias_AuxH_HAS_SAV_UserArgs_MT48x64x32_MI16x16x1_SN_LDSB0_GRVWA4_GRVWB1_GSU1_LBSPPA128_LBSPPB2048_MIWT3_1_NLCB1_SS1_SU32_SUM0_SUS256_TLDS1_WG16_8_1_WGM8
    SolutionIndex: 45
    SolutionNameMin: Cijk_Alik_Bjlk_HHS_BH_Bias_AuxH_HAS_SAV_UserArgs_MT48x64x32_MI16x16x1_SN_LDSB0_GRVWA1_GRVWB1_GSU1_LBSPPA128_LBSPPB2048_MIWT3_1_NLCB1_SS1_SU32_SUM0_SUS256_TLDS1_WG16_8_1_WGM8
    SolutionIndex: 46
    SolutionNameMin: Cijk_Alik_Bjlk_HHS_BH_Bias_AuxH_HAS_SAV_UserArgs_MT48x64x32_MI16x16x1_SN_LDSB0_GRVWA4_GRVWB2_GSU4_LBSPPA128_LBSPPB2048_MIWT3_1_NLCB1_SS1_SU32_SUM0_SUS256_TLDS1_WG16_8_1_WGM8
    SolutionIndex: 47
    SolutionNameMin: Cijk_Alik_Bjlk_HHS_BH_Bias_AuxH_HAS_SAV_UserArgs_MT80x64x32_MI16x16x1_SN_LDSB0_GRVWA4_GRVWB2_GSU1_LBSPPA128_LBSPPB2048_MIWT5_1_NLCB1_SS1_SU32_SUM0_SUS256_TLDS1_WG16_8_1_WGM8
    SolutionIndex: 48
    SolutionNameMin: Cijk_Alik_Bjlk_HHS_BH_Bias_AuxH_HAS_SAV_UserArgs_MT80x64x32_MI16x16x1_SN_LDSB0_GRVWA4_GRVWB2_GSU2_LBSPPA128_LBSPPB2048_MIWT5_1_NLCB1_SS1_SU32_SUM0_SUS256_TLDS1_WG16_8_1_WGM8
    SolutionIndex: 49
    SolutionNameMin: Cijk_Alik_Bjlk_HHS_BH_Bias_AuxH_HAS_SAV_UserArgs_MT112x64x32_MI16x16x1_SN_LDSB0_GRVWA4_GRVWB2_GSU1_LBSPPA128_LBSPPB2048_MIWT7_1_NLCB1_SS1_SU32_SUM0_SUS256_TLDS1_WG16_8_1_WGM8
    SolutionIndex: 50
    SolutionNameMin: Cijk_Alik_Bjlk_HHS_BH_Bias_AuxH_HAS_SAV_UserArgs_MT32x96x32_MI16x16x1_SN_LDSB0_GRVWA8_GRVWB2_GSU1_LBSPPA128_LBSPPB3072_MIWT1_3_NLCB3_SS1_SU32_SUM0_SUS256_TLDS1_WG32_4_1_WGM8
    SolutionIndex: 51
    SolutionNameMin: Cijk_Alik_Bjlk_HHS_BH_Bias_AuxH_HAS_SAV_UserArgs_MT32x96x32_MI16x16x1_SN_LDSB0_GRVWA1_GRVWB2_GSU1_LBSPPA128_LBSPPB3072_MIWT1_3_NLCB3_SS1_SU32_SUM0_SUS256_TLDS1_WG32_4_1_WGM8
    SolutionIndex: 52
    SolutionNameMin: Cijk_Alik_Bjlk_HHS_BH_Bias_AuxH_HAS_SAV_UserArgs_MT32x96x32_MI16x16x1_SN_LDSB0_GRVWA8_GRVWB1_GSU1_LBSPPA128_LBSPPB3072_MIWT1_3_NLCB3_SS1_SU32_SUM0_SUS256_TLDS1_WG32_4_1_WGM8
    SolutionIndex: 53
    SolutionNameMin: Cijk_Alik_Bjlk_HHS_BH_Bias_AuxH_HAS_SAV_UserArgs_MT32x96x32_MI16x16x1_SN_LDSB0_GRVWA1_GRVWB1_GSU1_LBSPPA128_LBSPPB3072_MIWT1_3_NLCB3_SS1_SU32_SUM0_SUS256_TLDS1_WG32_4_1_WGM8
    SolutionIndex: 54
    SolutionNameMin: Cijk_Alik_Bjlk_HHS_BH_Bias_AuxH_HAS_SAV_UserArgs_MT64x96x32_MI16x16x1_SN_LDSB0_GRVWA8_GRVWB2_GSU1_LBSPPA2048_LBSPPB3072_MIWT2_3_NLCB3_SS1_SU32_SUM0_SUS256_TLDS0_WG32_4_1_WGM8
    SolutionIndex: 55
    SolutionNameMin: Cijk_Alik_Bjlk_HHS_BH_Bias_AuxH_HAS_SAV_UserArgs_MT64x96x32_MI16x16x1_SN_LDSB0_GRVWA1_GRVWB2_GSU1_LBSPPA128_LBSPPB3072_MIWT2_3_NLCB3_SS1_SU32_SUM0_SUS256_TLDS1_WG32_4_1_WGM8
    SolutionIndex: 56
    SolutionNameMin: Cijk_Alik_Bjlk_HHS_BH_Bias_AuxH_HAS_SAV_UserArgs_MT64x96x32_MI16x16x1_SN_LDSB0_GRVWA8_GRVWB1_GSU1_LBSPPA2048_LBSPPB3072_MIWT2_3_NLCB3_SS1_SU32_SUM0_SUS256_TLDS0_WG32_4_1_WGM8
    SolutionIndex: 57
    SolutionNameMin: Cijk_Alik_Bjlk_HHS_BH_Bias_AuxH_HAS_SAV_UserArgs_MT64x96x32_MI16x16x1_SN_LDSB0_GRVWA1_GRVWB2_GSU2_LBSPPA128_LBSPPB3072_MIWT2_3_NLCB3_SS1_SU32_SUM0_SUS256_TLDS1_WG32_4_1_WGM8
    SolutionIndex: 58
    SolutionNameMin: Cijk_Alik_Bjlk_HHS_BH_Bias_AuxH_HAS_SAV_UserArgs_MT64x96x32_MI16x16x1_SN_LDSB0_GRVWA8_GRVWB2_GSU4_LBSPPA2048_LBSPPB3072_MIWT2_3_NLCB3_SS1_SU32_SUM0_SUS256_TLDS0_WG32_4_1_WGM8
    SolutionIndex: 59
    SolutionNameMin: Cijk_Alik_Bjlk_HHS_BH_Bias_AuxH_HAS_SAV_UserArgs_MT64x96x32_MI16x16x1_SN_LDSB0_GRVWA1_GRVWB2_GSU4_LBSPPA128_LBSPPB3072_MIWT2_3_NLCB3_SS1_SU32_SUM0_SUS256_TLDS1_WG32_4_1_WGM8
    SolutionIndex: 60
    SolutionNameMin: Cijk_Alik_Bjlk_HHS_BH_Bias_AuxH_HAS_SAV_UserArgs_MT96x96x32_MI16x16x1_SN_LDSB0_GRVWA8_GRVWB1_GSU1_LBSPPA128_LBSPPB3072_MIWT3_3_NLCB3_SS1_SU32_SUM0_SUS256_TLDS1_WG32_4_1_WGM8
    SolutionIndex: 61
    SolutionNameMin: Cijk_Alik_Bjlk_HHS_BH_Bias_AuxH_HAS_SAV_UserArgs_MT96x96x32_MI16x16x1_SN_LDSB0_GRVWA8_GRVWB1_GSU2_LBSPPA128_LBSPPB3072_MIWT3_3_NLCB3_SS1_SU32_SUM0_SUS256_TLDS1_WG32_4_1_WGM8
    SolutionIndex: 62
    SolutionNameMin: Cijk_Alik_Bjlk_HHS_BH_Bias_AuxH_HAS_SAV_UserArgs_MT96x96x32_MI16x16x1_SN_LDSB0_GRVWA8_GRVWB1_GSU4_LBSPPA128_LBSPPB3072_MIWT3_3_NLCB3_SS1_SU32_SUM0_SUS256_TLDS1_WG32_4_1_WGM8
    SolutionIndex: 63
    SolutionNameMin: Cijk_Alik_Bjlk_HHS_BH_Bias_AuxH_HAS_SAV_UserArgs_MT48x128x32_MI16x16x1_SN_LDSB0_GRVWA4_GRVWB2_GSU1_LBSPPA128_LBSPPB4096_MIWT3_2_NLCB1_SS1_SU32_SUM0_SUS256_TLDS1_WG16_8_1_WGM8
    SolutionIndex: 64
    SolutionNameMin: Cijk_Alik_Bjlk_HHS_BH_Bias_AuxH_HAS_SAV_UserArgs_MT48x128x32_MI16x16x1_SN_LDSB0_GRVWA4_GRVWB2_GSU2_LBSPPA128_LBSPPB4096_MIWT3_2_NLCB1_SS1_SU32_SUM0_SUS256_TLDS1_WG16_8_1_WGM8
    SolutionIndex: 65
    SolutionNameMin: Cijk_Alik_Bjlk_HHS_BH_Bias_AuxH_HAS_SAV_UserArgs_MT48x128x32_MI16x16x1_SN_LDSB0_GRVWA4_GRVWB2_GSU4_LBSPPA128_LBSPPB4096_MIWT3_2_NLCB1_SS1_SU32_SUM0_SUS256_TLDS1_WG16_8_1_WGM8
    SolutionIndex: 66
    SolutionNameMin: Cijk_Alik_Bjlk_HHS_BH_Bias_AuxH_HAS_SAV_UserArgs_MT32x192x32_MI16x16x1_SN_LDSB0_GRVWA8_GRVWB2_GSU1_LBSPPA128_LBSPPB6144_MIWT2_3_NLCB3_SS1_SU32_SUM0_SUS256_TLDS1_WG16_8_1_WGM8
    SolutionIndex: 67
    SolutionNameMin: Cijk_Alik_Bjlk_HHS_BH_Bias_AuxH_HAS_SAV_UserArgs_MT32x192x32_MI16x16x1_SN_LDSB0_GRVWA1_GRVWB2_GSU4_LBSPPA128_LBSPPB6144_MIWT2_3_NLCB3_SS1_SU32_SUM0_SUS256_TLDS1_WG16_8_1_WGM8
    SolutionIndex: 68
    SolutionNameMin: Cijk_Alik_Bjlk_HHS_BH_Bias_AuxH_HAS_SAV_UserArgs_MT32x32x64_MI16x16x1_SN_LDSB0_GRVWA8_GRVWB2_GSU1_LBSPPA1024_LBSPPB1024_MIWT1_1_NLCB1_SS1_SU32_SUM0_SUS256_TLDS0_WG32_4_1_WGM8
    SolutionIndex: 69
    SolutionNameMin: Cijk_Alik_Bjlk_HHS_BH_Bias_AuxH_HAS_SAV_UserArgs_MT32x32x64_MI16x16x1_SN_LDSB0_GRVWA8_GRVWB1_GSU1_LBSPPA1024_LBSPPB1024_MIWT1_1_NLCB1_SS1_SU32_SUM0_SUS256_TLDS0_WG32_4_1_WGM8
    SolutionIndex: 70
    SolutionNameMin: Cijk_Alik_Bjlk_HHS_BH_Bias_AuxH_HAS_SAV_UserArgs_MT32x32x64_MI16x16x1_SN_LDSB0_GRVWA1_GRVWB1_GSU1_LBSPPA1024_LBSPPB1024_MIWT1_1_NLCB1_SS1_SU32_SUM0_SUS256_TLDS0_WG32_4_1_WGM8
    SolutionIndex: 71
    SolutionNameMin: Cijk_Alik_Bjlk_HHS_BH_Bias_AuxH_HAS_SAV_UserArgs_MT32x32x64_MI16x16x1_SN_LDSB0_GRVWA8_GRVWB1_GSU4_LBSPPA1024_LBSPPB1024_MIWT1_1_NLCB1_SS1_SU32_SUM0_SUS256_TLDS0_WG32_4_1_WGM8
    SolutionIndex: 72
    SolutionNameMin: Cijk_Alik_Bjlk_HHS_BH_Bias_AuxH_HAS_SAV_UserArgs_MT32x32x64_MI16x16x1_SN_LDSB0_GRVWA1_GRVWB1_GSU4_LBSPPA128_LBSPPB1024_MIWT1_1_NLCB1_SS1_SU32_SUM0_SUS256_TLDS1_WG32_4_1_WGM8
    SolutionIndex: 73
    SolutionNameMin: Cijk_Alik_Bjlk_HHS_BH_Bias_AuxH_HAS_SAV_UserArgs_MT64x32x64_MI16x16x1_SN_LDSB0_GRVWA8_GRVWB2_GSU1_LBSPPA2048_LBSPPB1024_MIWT2_1_NLCB1_SS1_SU32_SUM0_SUS256_TLDS0_WG32_4_1_WGM8
    SolutionIndex: 74
    SolutionNameMin: Cijk_Alik_Bjlk_HHS_BH_Bias_AuxH_HAS_SAV_UserArgs_MT64x32x64_MI16x16x1_SN_LDSB0_GRVWA8_GRVWB1_GSU1_LBSPPA2048_LBSPPB1024_MIWT2_1_NLCB1_SS1_SU32_SUM0_SUS256_TLDS0_WG32_4_1_WGM8
    SolutionIndex: 75
    SolutionNameMin: Cijk_Alik_Bjlk_HHS_BH_Bias_AuxH_HAS_SAV_UserArgs_MT16x64x64_MI16x16x1_SN_LDSB0_GRVWA8_GRVWB2_GSU1_LBSPPA512_LBSPPB2048_MIWT1_1_NLCB1_SS1_SU32_SUM0_SUS256_TLDS0_WG16_8_1_WGM8
    SolutionIndex: 76
    SolutionNameMin: Cijk_Alik_Bjlk_HHS_BH_Bias_AuxH_HAS_SAV_UserArgs_MT16x64x64_MI16x16x1_SN_LDSB0_GRVWA8_GRVWB2_GSU1_LBSPPA128_LBSPPB2048_MIWT1_1_NLCB1_SS1_SU32_SUM0_SUS256_TLDS1_WG16_8_1_WGM8
    SolutionIndex: 77
    SolutionNameMin: Cijk_Alik_Bjlk_HHS_BH_Bias_AuxH_HAS_SAV_UserArgs_MT16x64x64_MI16x16x1_SN_LDSB0_GRVWA8_GRVWB1_GSU1_LBSPPA128_LBSPPB2048_MIWT1_1_NLCB1_SS1_SU32_SUM0_SUS256_TLDS1_WG16_8_1_WGM8
    SolutionIndex: 78
    SolutionNameMin: Cijk_Alik_Bjlk_HHS_BH_Bias_AuxH_HAS_SAV_UserArgs_MT16x64x64_MI16x16x1_SN_LDSB0_GRVWA8_GRVWB2_GSU4_LBSPPA512_LBSPPB2048_MIWT1_1_NLCB1_SS1_SU32_SUM0_SUS256_TLDS0_WG16_8_1_WGM8
    SolutionIndex: 79
    SolutionNameMin: Cijk_Alik_Bjlk_HHS_BH_Bias_AuxH_HAS_SAV_UserArgs_MT32x64x64_MI16x16x1_SN_LDSB0_GRVWA1_GRVWB2_GSU1_LBSPPA128_LBSPPB2048_MIWT2_1_NLCB1_SS1_SU32_SUM0_SUS256_TLDS1_WG16_8_1_WGM8
    SolutionIndex: 80
    SolutionNameMin: Cijk_Alik_Bjlk_HHS_BH_Bias_AuxH_HAS_SAV_UserArgs_MT48x64x64_MI16x16x1_SN_LDSB0_GRVWA8_GRVWB2_GSU1_LBSPPA128_LBSPPB2048_MIWT3_1_NLCB1_SS1_SU32_SUM0_SUS256_TLDS1_WG16_8_1_WGM8
    SolutionIndex: 81
    SolutionNameMin: Cijk_Alik_Bjlk_HHS_BH_Bias_AuxH_HAS_SAV_UserArgs_MT48x64x64_MI16x16x1_SN_LDSB0_GRVWA8_GRVWB2_GSU4_LBSPPA128_LBSPPB2048_MIWT3_1_NLCB1_SS1_SU32_SUM0_SUS256_TLDS1_WG16_8_1_WGM8
- - - [64, 64, 1, 64, 64, 64, 64, 64]
    - [68, 17.4362]
  - - [192, 64, 1, 64, 192, 192, 64, 64]
    - [15, 53.3192]
  - - [320, 64, 1, 64, 320, 320, 64, 64]
    - [2, 90.1799]
  - - [448, 64, 1, 64, 448, 448, 64, 64]
    - [17, 124.83]
  - - [576, 64, 1, 64, 576, 576, 64, 64]
    - [68, 171.841]
  - - [704, 64, 1, 64, 704, 704, 64, 64]
    - [68, 210.25]
  - - [832, 64, 1, 64, 832, 832, 64, 64]
    - [68, 249.396]
  - - [960, 64, 1, 64, 960, 960, 64, 64]
    - [9, 285.57]
  - - [64, 192, 1, 64, 64, 64, 64, 192]
    - [2, 53.2831]
  - - [192, 192, 1, 64, 192, 192, 64, 192]
    - [77, 168.889]
  - - [320, 192, 1, 64, 320, 320, 64, 192]
    - [68, 288.609]
  - - [448, 192, 1, 64, 448, 448, 64, 192]
    - [34, 400.511]
  - - [576, 192, 1, 64, 576, 576, 64, 192]
    - [68, 510.302]
  - - [704, 192, 1, 64, 704, 704, 64, 192]
    - [33, 613.986]
  - - [832, 192, 1, 64, 832, 832, 64, 192]
    - [51, 732.639]
  - - [960, 192, 1, 64, 960, 960, 64, 192]
    - [73, 825.246]
  - - [64, 320, 1, 64, 64, 64, 64, 320]
    - [2, 90.3664]
  - - [192, 320, 1, 64, 192, 192, 64, 320]
    - [68, 283.511]
  - - [320, 320, 1, 64, 320, 320, 64, 320]
    - [68, 465.636]
  - - [448, 320, 1, 64, 448, 448, 64, 320]
    - [68, 643.434]
  - - [576, 320, 1, 64, 576, 576, 64, 320]
    - [38, 820.368]
  - - [704, 320, 1, 64, 704, 704, 64, 320]
    - [74, 996.091]
  - - [832, 320, 1, 64, 832, 832, 64, 320]
    - [15, 1131.47]
  - - [960, 320, 1, 64, 960, 960, 64, 320]
    - [38, 1270.49]
  - - [64, 448, 1, 64, 64, 64, 64, 448]
    - [9, 127.88]
  - - [192, 448, 1, 64, 192, 192, 64, 448]
    - [21, 401.241]
  - - [320, 448, 1, 64, 320, 320, 64, 448]
    - [68, 647.749]
  - - [448, 448, 1, 64, 448, 448, 64, 448]
    - [17, 884.676]
  - - [576, 448, 1, 64, 576, 576, 64, 448]
    - [80, 1118.19]
  - - [704, 448, 1, 64, 704, 704, 64, 448]
    - [20, 1309.49]
  - - [832, 448, 1, 64, 832, 832, 64, 448]
    - [38, 1534.14]
  - - [960, 448, 1, 64, 960, 960, 64, 448]
    - [21, 1713.41]
  - - [64, 576, 1, 64, 64, 64, 64, 576]
    - [32, 172.469]
  - - [192, 576, 1, 64, 192, 192, 64, 576]
    - [13, 519.879]
  - - [320, 576, 1, 64, 320, 320, 64, 576]
    - [31, 819.228]
  - - [448, 576, 1, 64, 448, 448, 64, 576]
    - [43, 1101.78]
  - - [576, 576, 1, 64, 576, 576, 64, 576]
    - [52, 1342.25]
  - - [704, 576, 1, 64, 704, 704, 64, 576]
    - [53, 1621.51]
  - - [832, 576, 1, 64, 832, 832, 64, 576]
    - [39, 1914.53]
  - - [960, 576, 1, 64, 960, 960, 64, 576]
    - [54, 2113.5]
  - - [64, 704, 1, 64, 64, 64, 64, 704]
    - [70, 205.831]
  - - [192, 704, 1, 64, 192, 192, 64, 704]
    - [29, 609.015]
  - - [320, 704, 1, 64, 320, 320, 64, 704]
    - [34, 987.563]
  - - [448, 704, 1, 64, 448, 448, 64, 704]
    - [22, 1318.47]
  - - [576, 704, 1, 64, 576, 576, 64, 704]
    - [21, 1621.51]
  - - [704, 704, 1, 64, 704, 704, 64, 704]
    - [36, 1880.28]
  - - [832, 704, 1, 64, 832, 832, 64, 704]
    - [20, 2106.64]
  - - [960, 704, 1, 64, 960, 960, 64, 704]
    - [22, 2472.42]
  - - [64, 832, 1, 64, 64, 64, 64, 832]
    - [68, 243.602]
  - - [192, 832, 1, 64, 192, 192, 64, 832]
    - [9, 721.752]
  - - [320, 832, 1, 64, 320, 320, 64, 832]
    - [38, 1134.44]
  - - [448, 832, 1, 64, 448, 448, 64, 832]
    - [38, 1520.93]
  - - [576, 832, 1, 64, 576, 576, 64, 832]
    - [22, 1897.42]
  - - [704, 832, 1, 64, 704, 704, 64, 832]
    - [38, 2093.11]
  - - [832, 832, 1, 64, 832, 832, 64, 832]
    - [22, 2484.78]
  - - [960, 832, 1, 64, 960, 960, 64, 832]
    - [38, 2814.95]
  - - [64, 960, 1, 64, 64, 64, 64, 960]
    - [30, 294.776]
  - - [192, 960, 1, 64, 192, 192, 64, 960]
    - [15, 829.891]
  - - [320, 960, 1, 64, 320, 320, 64, 960]
    - [22, 1299.93]
  - - [448, 960, 1, 64, 448, 448, 64, 960]
    - [50, 1748.79]
  - - [576, 960, 1, 64, 576, 576, 64, 960]
    - [54, 2053.41]
  - - [704, 960, 1, 64, 704, 704, 64, 960]
    - [66, 2500.29]
  - - [832, 960, 1, 64, 832, 832, 64, 960]
    - [37, 2837.61]
  - - [960, 960, 1, 64, 960, 960, 64, 960]
    - [42, 3134.94]
  - - [64, 64, 1, 256, 64, 64, 256, 64]
    - [1, 68.0695]
  - - [192, 64, 1, 256, 192, 192, 256, 64]
    - [14, 207.646]
  - - [320, 64, 1, 256, 320, 320, 256, 64]
    - [5, 344.813]
  - - [448, 64, 1, 256, 448, 448, 256, 64]
    - [0, 488.863]
  - - [576, 64, 1, 256, 576, 576, 256, 64]
    - [17, 662.491]
  - - [704, 64, 1, 256, 704, 704, 256, 64]
    - [12, 787.085]
  - - [832, 64, 1, 256, 832, 832, 256, 64]
    - [30, 980.013]
  - - [960, 64, 1, 256, 960, 960, 256, 64]
    - [68, 1079.93]
  - - [64, 192, 1, 256, 64, 64, 256, 192]
    - [5, 210.142]
  - - [192, 192, 1, 256, 192, 192, 256, 192]
    - [12, 656.066]
  - - [320, 192, 1, 256, 320, 320, 256, 192]
    - [11, 1058.13]
  - - [448, 192, 1, 256, 448, 448, 256, 192]
    - [75, 1439.74]
  - - [576, 192, 1, 256, 576, 576, 256, 192]
    - [36, 1855.34]
  - - [704, 192, 1, 256, 704, 704, 256, 192]
    - [12, 2174.31]
  - - [832, 192, 1, 256, 832, 832, 256, 192]
    - [36, 2528.33]
  - - [960, 192, 1, 256, 960, 960, 256, 192]
    - [80, 2846.9]
  - - [64, 320, 1, 256, 64, 64, 256, 320]
    - [0, 352.463]
  - - [192, 320, 1, 256, 192, 192, 256, 320]
    - [11, 1060.63]
  - - [320, 320, 1, 256, 320, 320, 256, 320]
    - [36, 1625.25]
  - - [448, 320, 1, 256, 448, 448, 256, 320]
    - [12, 2271.12]
  - - [576, 320, 1, 256, 576, 576, 256, 320]
    - [80, 2907.42]
  - - [704, 320, 1, 256, 704, 704, 256, 320]
    - [79, 3313.61]
  - - [832, 320, 1, 256, 832, 832, 256, 320]
    - [80, 3913.83]
  - - [960, 320, 1, 256, 960, 960, 256, 320]
    - [36, 4419.52]
  - - [64, 448, 1, 256, 64, 64, 256, 448]
    - [0, 478.349]
  - - [192, 448, 1, 256, 192, 192, 256, 448]
    - [12, 1483.38]
  - - [320, 448, 1, 256, 320, 320, 256, 448]
    - [12, 2241.98]
  - - [448, 448, 1, 256, 448, 448, 256, 448]
    - [36, 2947.04]
  - - [576, 448, 1, 256, 576, 576, 256, 448]
    - [23, 3771.75]
  - - [704, 448, 1, 256, 704, 704, 256, 448]
    - [36, 4267.57]
  - - [832, 448, 1, 256, 832, 832, 256, 448]
    - [36, 4766.37]
  - - [960, 448, 1, 256, 960, 960, 256, 448]
    - [42, 5524.64]
  - - [64, 576, 1, 256, 64, 64, 256, 576]
    - [68, 650.638]
  - - [192, 576, 1, 256, 192, 192, 256, 576]
    - [36, 1799.9]
  - - [320, 576, 1, 256, 320, 320, 256, 576]
    - [36, 2911.0]
  - - [448, 576, 1, 256, 448, 448, 256, 576]
    - [42, 3884.87]
  - - [576, 576, 1, 256, 576, 576, 256, 576]
    - [54, 4741.11]
  - - [704, 576, 1, 256, 704, 704, 256, 576]
    - [66, 5265.62]
  - - [832, 576, 1, 256, 832, 832, 256, 576]
    - [66, 6211.97]
  - - [960, 576, 1, 256, 960, 960, 256, 576]
    - [54, 7001.05]
  - - [64, 704, 1, 256, 64, 64, 256, 704]
    - [15, 799.081]
  - - [192, 704, 1, 256, 192, 192, 256, 704]
    - [80, 2128.76]
  - - [320, 704, 1, 256, 320, 320, 256, 704]
    - [36, 3346.29]
  - - [448, 704, 1, 256, 448, 448, 256, 704]
    - [63, 4360.93]
  - - [576, 704, 1, 256, 576, 576, 256, 704]
    - [42, 5194.48]
  - - [704, 704, 1, 256, 704, 704, 256, 704]
    - [63, 6177.25]
  - - [832, 704, 1, 256, 832, 832, 256, 704]
    - [36, 6775.86]
  - - [960, 704, 1, 256, 960, 960, 256, 704]
    - [63, 7779.63]
  - - [64, 832, 1, 256, 64, 64, 256, 832]
    - [29, 945.679]
  - - [192, 832, 1, 256, 192, 192, 256, 832]
    - [23, 2551.2]
  - - [320, 832, 1, 256, 320, 320, 256, 832]
    - [50, 3830.25]
  - - [448, 832, 1, 256, 448, 448, 256, 832]
    - [36, 4875.98]
  - - [576, 832, 1, 256, 576, 576, 256, 832]
    - [36, 5796.66]
  - - [704, 832, 1, 256, 704, 704, 256, 832]
    - [42, 6800.44]
  - - [832, 832, 1, 256, 832, 832, 256, 832]
    - [42, 7477.35]
  - - [960, 832, 1, 256, 960, 960, 256, 832]
    - [60, 8546.74]
  - - [64, 960, 1, 256, 64, 64, 256, 960]
    - [8, 1063.5]
  - - [192, 960, 1, 256, 192, 192, 256, 960]
    - [24, 2826.44]
  - - [320, 960, 1, 256, 320, 320, 256, 960]
    - [36, 4301.09]
  - - [448, 960, 1, 256, 448, 448, 256, 960]
    - [66, 5465.54]
  - - [576, 960, 1, 256, 576, 576, 256, 960]
    - [54, 7051.8]
  - - [704, 960, 1, 256, 704, 704, 256, 960]
    - [66, 7821.83]
  - - [832, 960, 1, 256, 832, 832, 256, 960]
    - [60, 8465.19]
  - - [960, 960, 1, 256, 960, 960, 256, 960]
    - [60, 9841.06]
  - - [64, 64, 1, 512, 64, 64, 512, 64]
    - [0, 131.117]
  - - [192, 64, 1, 512, 192, 192, 512, 64]
    - [72, 394.325]
  - - [320, 64, 1, 512, 320, 320, 512, 64]
    - [5, 667.67]
  - - [448, 64, 1, 512, 448, 448, 512, 64]
    - [0, 938.653]
  - - [576, 64, 1, 512, 576, 576, 512, 64]
    - [12, 1205.64]
  - - [704, 64, 1, 512, 704, 704, 512, 64]
    - [12, 1412.7]
  - - [832, 64, 1, 512, 832, 832, 512, 64]
    - [12, 1743.21]
  - - [960, 64, 1, 512, 960, 960, 512, 64]
    - [12, 1958.13]
  - - [64, 192, 1, 512, 64, 64, 512, 192]
    - [78, 401.766]
  - - [192, 192, 1, 512, 192, 192, 512, 192]
    - [12, 1257.08]
  - - [320, 192, 1, 512, 320, 320, 512, 192]
    - [69, 2032.19]
  - - [448, 192, 1, 512, 448, 448, 512, 192]
    - [15, 2595.26]
  - - [576, 192, 1, 512, 576, 576, 512, 192]
    - [36, 3245.9]
  - - [704, 192, 1, 512, 704, 704, 512, 192]
    - [12, 3631.05]
  - - [832, 192, 1, 512, 832, 832, 512, 192]
    - [50, 4281.13]
  - - [960, 192, 1, 512, 960, 960, 512, 192]
    - [80, 5122.08]
  - - [64, 320, 1, 512, 64, 64, 512, 320]
    - [0, 669.824]
  - - [192, 320, 1, 512, 192, 192, 512, 320]
    - [30, 1977.26]
  - - [320, 320, 1, 512, 320, 320, 512, 320]
    - [36, 2956.32]
  - - [448, 320, 1, 512, 448, 448, 512, 320]
    - [12, 3852.13]
  - - [576, 320, 1, 512, 576, 576, 512, 320]
    - [80, 5086.2]
  - - [704, 320, 1, 512, 704, 704, 512, 320]
    - [36, 5589.83]
  - - [832, 320, 1, 512, 832, 832, 512, 320]
    - [80, 6588.6]
  - - [960, 320, 1, 512, 960, 960, 512, 320]
    - [47, 7339.89]
  - - [64, 448, 1, 512, 64, 64, 512, 448]
    - [0, 934.143]
  - - [192, 448, 1, 512, 192, 192, 512, 448]
    - [76, 2602.93]
  - - [320, 448, 1, 512, 320, 320, 512, 448]
    - [12, 3901.26]
  - - [448, 448, 1, 512, 448, 448, 512, 448]
    - [36, 4988.49]
  - - [576, 448, 1, 512, 576, 576, 512, 448]
    - [23, 6367.41]
  - - [704, 448, 1, 512, 704, 704, 512, 448]
    - [63, 7293.95]
  - - [832, 448, 1, 512, 832, 832, 512, 448]
    - [61, 7469.45]
  - - [960, 448, 1, 512, 960, 960, 512, 448]
    - [47, 8962.37]
  - - [64, 576, 1, 512, 64, 64, 512, 576]
    - [12, 1212.27]
  - - [192, 576, 1, 512, 192, 192, 512, 576]
    - [12, 3255.23]
  - - [320, 576, 1, 512, 320, 320, 512, 576]
    - [50, 4963.15]
  - - [448, 576, 1, 512, 448, 448, 512, 576]
    - [80, 6379.71]
  - - [576, 576, 1, 512, 576, 576, 512, 576]
    - [66, 7888.24]
  - - [704, 576, 1, 512, 704, 704, 512, 576]
    - [66, 8604.5]
  - - [832, 576, 1, 512, 832, 832, 512, 576]
    - [66, 10050.0]
  - - [960, 576, 1, 512, 960, 960, 512, 576]
    - [60, 11591.7]
  - - [64, 704, 1, 512, 64, 64, 512, 704]
    - [0, 1444.09]
  - - [192, 704, 1, 512, 192, 192, 512, 704]
    - [80, 3782.89]
  - - [320, 704, 1, 512, 320, 320, 512, 704]
    - [36, 5600.69]
  - - [448, 704, 1, 512, 448, 448, 512, 704]
    - [63, 7164.34]
  - - [576, 704, 1, 512, 576, 576, 512, 704]
    - [63, 8383.87]
  - - [704, 704, 1, 512, 704, 704, 512, 704]
    - [63, 10142.3]
  - - [832, 704, 1, 512, 832, 832, 512, 704]
    - [66, 10663.2]
  - - [960, 704, 1, 512, 960, 960, 512, 704]
    - [63, 12347.6]
  - - [64, 832, 1, 512, 64, 64, 512, 832]
    - [15, 1739.88]
  - - [192, 832, 1, 512, 192, 192, 512, 832]
    - [80, 4506.4]
  - - [320, 832, 1, 512, 320, 320, 512, 832]
    - [25, 6268.94]
  - - [448, 832, 1, 512, 448, 448, 512, 832]
    - [49, 7935.33]
  - - [576, 832, 1, 512, 576, 576, 512, 832]
    - [66, 9647.2]
  - - [704, 832, 1, 512, 704, 704, 512, 832]
    - [66, 10617.7]
  - - [832, 832, 1, 512, 832, 832, 512, 832]
    - [55, 11483.2]
  - - [960, 832, 1, 512, 960, 960, 512, 832]
    - [60, 13582.1]
  - - [64, 960, 1, 512, 64, 64, 512, 960]
    - [12, 1973.54]
  - - [192, 960, 1, 512, 192, 192, 512, 960]
    - [80, 5061.64]
  - - [320, 960, 1, 512, 320, 320, 512, 960]
    - [47, 7253.4]
  - - [448, 960, 1, 512, 448, 448, 512, 960]
    - [49, 9013.92]
  - - [576, 960, 1, 512, 576, 576, 512, 960]
    - [60, 11497.3]
  - - [704, 960, 1, 512, 704, 704, 512, 960]
    - [66, 12861.4]
  - - [832, 960, 1, 512, 832, 832, 512, 960]
    - [60, 13564.1]
  - - [960, 960, 1, 512, 960, 960, 512, 960]
    - [60, 15234.0]
  - - [64, 64, 1, 1024, 64, 64, 1024, 64]
    - [35, 249.372]
  - - [192, 64, 1, 1024, 192, 192, 1024, 64]
    - [35, 778.911]
  - - [320, 64, 1, 1024, 320, 320, 1024, 64]
    - [5, 1226.44]
  - - [448, 64, 1, 1024, 448, 448, 1024, 64]
    - [0, 1707.03]
  - - [576, 64, 1, 1024, 576, 576, 1024, 64]
    - [41, 2098.96]
  - - [704, 64, 1, 1024, 704, 704, 1024, 64]
    - [12, 2531.61]
  - - [832, 64, 1, 1024, 832, 832, 1024, 64]
    - [12, 3017.57]
  - - [960, 64, 1, 1024, 960, 960, 1024, 64]
    - [12, 3460.74]
  - - [64, 192, 1, 1024, 64, 64, 1024, 192]
    - [19, 757.322]
  - - [192, 192, 1, 1024, 192, 192, 1024, 192]
    - [81, 2105.4]
  - - [320, 192, 1, 1024, 320, 320, 1024, 192]
    - [12, 3476.04]
  - - [448, 192, 1, 1024, 448, 448, 1024, 192]
    - [58, 4466.66]
  - - [576, 192, 1, 1024, 576, 576, 1024, 192]
    - [62, 5447.28]
  - - [704, 192, 1, 1024, 704, 704, 1024, 192]
    - [59, 6074.83]
  - - [832, 192, 1, 1024, 832, 832, 1024, 192]
    - [67, 7005.78]
  - - [960, 192, 1, 1024, 960, 960, 1024, 192]
    - [80, 8146.21]
  - - [64, 320, 1, 1024, 64, 64, 1024, 320]
    - [71, 1237.29]
  - - [192, 320, 1, 1024, 192, 192, 1024, 320]
    - [12, 3382.59]
  - - [320, 320, 1, 1024, 320, 320, 1024, 320]
    - [36, 4969.67]
  - - [448, 320, 1, 1024, 448, 448, 1024, 320]
    - [65, 6233.71]
  - - [576, 320, 1, 1024, 576, 576, 1024, 320]
    - [80, 8158.71]
  - - [704, 320, 1, 1024, 704, 704, 1024, 320]
    - [64, 8526.74]
  - - [832, 320, 1, 1024, 832, 832, 1024, 320]
    - [80, 10036.4]
  - - [960, 320, 1, 1024, 960, 960, 1024, 320]
    - [47, 10862.7]
  - - [64, 448, 1, 1024, 64, 64, 1024, 448]
    - [12, 1690.33]
  - - [192, 448, 1, 1024, 192, 192, 1024, 448]
    - [0, 4185.43]
  - - [320, 448, 1, 1024, 320, 320, 1024, 448]
    - [65, 6269.65]
  - - [448, 448, 1, 1024, 448, 448, 1024, 448]
    - [62, 8044.19]
  - - [576, 448, 1, 1024, 576, 576, 1024, 448]
    - [62, 9998.15]
  - - [704, 448, 1, 1024, 704, 704, 1024, 448]
    - [63, 11426.4]
  - - [832, 448, 1, 1024, 832, 832, 1024, 448]
    - [61, 12204.4]
  - - [960, 448, 1, 1024, 960, 960, 1024, 448]
    - [63, 13057.1]
  - - [64, 576, 1, 1024, 64, 64, 1024, 576]
    - [0, 2038.32]
  - - [192, 576, 1, 1024, 192, 192, 1024, 576]
    - [62, 5449.9]
  - - [320, 576, 1, 1024, 320, 320, 1024, 576]
    - [59, 8099.02]
  - - [448, 576, 1, 1024, 448, 448, 1024, 576]
    - [62, 9943.41]
  - - [576, 576, 1, 1024, 576, 576, 1024, 576]
    - [66, 11780.5]
  - - [704, 576, 1, 1024, 704, 704, 1024, 576]
    - [66, 12272.7]
  - - [832, 576, 1, 1024, 832, 832, 1024, 576]
    - [66, 14557.9]
  - - [960, 576, 1, 1024, 960, 960, 1024, 576]
    - [60, 17372.0]
  - - [64, 704, 1, 1024, 64, 64, 1024, 704]
    - [40, 2609.65]
  - - [192, 704, 1, 1024, 192, 192, 1024, 704]
    - [80, 6066.84]
  - - [320, 704, 1, 1024, 320, 320, 1024, 704]
    - [48, 8459.51]
  - - [448, 704, 1, 1024, 448, 448, 1024, 704]
    - [63, 11394.1]
  - - [576, 704, 1, 1024, 576, 576, 1024, 704]
    - [61, 12440.0]
  - - [704, 704, 1, 1024, 704, 704, 1024, 704]
    - [63, 14818.3]
  - - [832, 704, 1, 1024, 832, 832, 1024, 704]
    - [66, 15068.5]
  - - [960, 704, 1, 1024, 960, 960, 1024, 704]
    - [63, 17713.8]
  - - [64, 832, 1, 1024, 64, 64, 1024, 832]
    - [76, 3069.38]
  - - [192, 832, 1, 1024, 192, 192, 1024, 832]
    - [80, 7087.58]
  - - [320, 832, 1, 1024, 320, 320, 1024, 832]
    - [57, 9764.85]
  - - [448, 832, 1, 1024, 448, 448, 1024, 832]
    - [61, 12451.3]
  - - [576, 832, 1, 1024, 576, 576, 1024, 832]
    - [61, 14230.8]
  - - [704, 832, 1, 1024, 704, 704, 1024, 832]
    - [63, 15161.8]
  - - [832, 832, 1, 1024, 832, 832, 1024, 832]
    - [55, 16895.6]
  - - [960, 832, 1, 1024, 960, 960, 1024, 832]
    - [60, 20047.0]
  - - [64, 960, 1, 1024, 64, 64, 1024, 960]
    - [12, 3341.28]
  - - [192, 960, 1, 1024, 192, 192, 1024, 960]
    - [80, 8185.07]
  - - [320, 960, 1, 1024, 320, 320, 1024, 960]
    - [54, 11183.2]
  - - [448, 960, 1, 1024, 448, 448, 1024, 960]
    - [49, 13337.6]
  - - [576, 960, 1, 1024, 576, 576, 1024, 960]
    - [60, 17030.0]
  - - [704, 960, 1, 1024, 704, 704, 1024, 960]
    - [63, 17950.4]
  - - [832, 960, 1, 1024, 832, 832, 1024, 960]
    - [60, 20160.4]
  - - [960, 960, 1, 1024, 960, 960, 1024, 960]
    - [60, 21167.2]
  - - [64, 64, 1, 2048, 64, 64, 2048, 64]
    - [18, 467.475]
  - - [192, 64, 1, 2048, 192, 192, 2048, 64]
    - [35, 1402.03]
  - - [320, 64, 1, 2048, 320, 320, 2048, 64]
    - [81, 2221.62]
  - - [448, 64, 1, 2048, 448, 448, 2048, 64]
    - [40, 3037.86]
  - - [576, 64, 1, 2048, 576, 576, 2048, 64]
    - [81, 3658.8]
  - - [704, 64, 1, 2048, 704, 704, 2048, 64]
    - [46, 4242.61]
  - - [832, 64, 1, 2048, 832, 832, 2048, 64]
    - [81, 4738.4]
  - - [960, 64, 1, 2048, 960, 960, 2048, 64]
    - [81, 5406.31]
  - - [64, 64, 1, 4096, 64, 64, 4096, 64]
    - [6, 882.106]
  - - [192, 64, 1, 4096, 192, 192, 4096, 64]
    - [35, 2470.93]
  - - [320, 64, 1, 4096, 320, 320, 4096, 64]
    - [7, 3788.98]
  - - [448, 64, 1, 4096, 448, 448, 4096, 64]
    - [40, 4954.46]
  - - [576, 64, 1, 4096, 576, 576, 4096, 64]
    - [81, 5857.28]
  - - [704, 64, 1, 4096, 704, 704, 4096, 64]
    - [81, 7042.66]
  - - [832, 64, 1, 4096, 832, 832, 4096, 64]
    - [46, 7234.08]
  - - [960, 64, 1, 4096, 960, 960, 4096, 64]
    - [81, 8483.48]
  - - [1280, 1280, 1, 64, 1280, 1280, 64, 1280]
    - [45, 4580.13]
  - - [1536, 1280, 1, 64, 1536, 1536, 64, 1280]
    - [44, 5235.46]
  - - [1792, 1280, 1, 64, 1792, 1792, 64, 1280]
    - [45, 5777.51]
  - - [2048, 1280, 1, 64, 2048, 2048, 64, 1280]
    - [10, 5638.64]
  - - [1280, 1536, 1, 64, 1280, 1280, 64, 1536]
    - [38, 5118.33]
  - - [1536, 1536, 1, 64, 1536, 1536, 64, 1536]
    - [42, 5929.63]
  - - [1792, 1536, 1, 64, 1792, 1792, 64, 1536]
    - [44, 6216.09]
  - - [2048, 1536, 1, 64, 2048, 2048, 64, 1536]
    - [10, 6190.09]
  - - [1280, 1792, 1, 64, 1280, 1280, 64, 1792]
    - [45, 5743.6]
  - - [1536, 1792, 1, 64, 1536, 1536, 64, 1792]
    - [42, 6684.4]
  - - [1792, 1792, 1, 64, 1792, 1792, 64, 1792]
    - [44, 7186.3]
  - - [2048, 1792, 1, 64, 2048, 2048, 64, 1792]
    - [10, 6640.87]
  - - [1280, 2048, 1, 64, 1280, 1280, 64, 2048]
    - [21, 6192.23]
  - - [1536, 2048, 1, 64, 1536, 1536, 64, 2048]
    - [42, 6759.44]
  - - [1792, 2048, 1, 64, 1792, 1792, 64, 2048]
    - [45, 7347.15]
  - - [2048, 2048, 1, 64, 2048, 2048, 64, 2048]
    - [10, 6993.42]
  - - [1280, 1280, 1, 256, 1280, 1280, 256, 1280]
    - [28, 12789.9]
  - - [1536, 1280, 1, 256, 1536, 1536, 256, 1280]
    - [60, 13429.3]
  - - [1792, 1280, 1, 256, 1792, 1792, 256, 1280]
    - [28, 14456.5]
  - - [2048, 1280, 1, 256, 2048, 2048, 256, 1280]
    - [28, 14373.6]
  - - [1280, 1536, 1, 256, 1280, 1280, 256, 1536]
    - [54, 14160.4]
  - - [1536, 1536, 1, 256, 1536, 1536, 256, 1536]
    - [54, 14933.7]
  - - [1792, 1536, 1, 256, 1792, 1792, 256, 1536]
    - [54, 16315.5]
  - - [2048, 1536, 1, 256, 2048, 2048, 256, 1536]
    - [28, 15317.7]
  - - [1280, 1792, 1, 256, 1280, 1280, 256, 1792]
    - [54, 14688.3]
  - - [1536, 1792, 1, 256, 1536, 1536, 256, 1792]
    - [54, 15782.4]
  - - [1792, 1792, 1, 256, 1792, 1792, 256, 1792]
    - [56, 15892.3]
  - - [2048, 1792, 1, 256, 2048, 2048, 256, 1792]
    - [28, 16053.9]
  - - [1280, 2048, 1, 256, 1280, 1280, 256, 2048]
    - [60, 15162.8]
  - - [1536, 2048, 1, 256, 1536, 1536, 256, 2048]
    - [60, 16252.9]
  - - [1792, 2048, 1, 256, 1792, 1792, 256, 2048]
    - [54, 16550.1]
  - - [2048, 2048, 1, 256, 2048, 2048, 256, 2048]
    - [28, 16551.3]
  - - [1280, 1280, 1, 512, 1280, 1280, 512, 1280]
    - [63, 17464.1]
  - - [1536, 1280, 1, 512, 1536, 1536, 512, 1280]
    - [60, 20045.1]
  - - [1792, 1280, 1, 512, 1792, 1792, 512, 1280]
    - [54, 18867.0]
  - - [2048, 1280, 1, 512, 2048, 2048, 512, 1280]
    - [60, 18912.4]
  - - [1280, 1536, 1, 512, 1280, 1280, 512, 1536]
    - [54, 19752.0]
  - - [1536, 1536, 1, 512, 1536, 1536, 512, 1536]
    - [54, 20523.6]
  - - [1792, 1536, 1, 512, 1792, 1792, 512, 1536]
    - [54, 21115.7]
  - - [2048, 1536, 1, 512, 2048, 2048, 512, 1536]
    - [60, 21912.2]
  - - [1280, 1792, 1, 512, 1280, 1280, 512, 1792]
    - [54, 19968.3]
  - - [1536, 1792, 1, 512, 1536, 1536, 512, 1792]
    - [60, 20826.9]
  - - [1792, 1792, 1, 512, 1792, 1792, 512, 1792]
    - [54, 21811.4]
  - - [2048, 1792, 1, 512, 2048, 2048, 512, 1792]
    - [60, 21744.3]
  - - [1280, 2048, 1, 512, 1280, 1280, 512, 2048]
    - [60, 20100.6]
  - - [1536, 2048, 1, 512, 1536, 1536, 512, 2048]
    - [60, 22626.8]
  - - [1792, 2048, 1, 512, 1792, 1792, 512, 2048]
    - [60, 22710.8]
  - - [2048, 2048, 1, 512, 2048, 2048, 512, 2048]
    - [60, 22202.0]
  - - [1280, 1280, 1, 1024, 1280, 1280, 1024, 1280]
    - [60, 22039.8]
  - - [1536, 1280, 1, 1024, 1536, 1536, 1024, 1280]
    - [60, 25053.9]
  - - [1792, 1280, 1, 1024, 1792, 1792, 1024, 1280]
    - [60, 24213.9]
  - - [2048, 1280, 1, 1024, 2048, 2048, 1024, 1280]
    - [60, 24515.3]
  - - [1280, 1536, 1, 1024, 1280, 1280, 1024, 1536]
    - [60, 24713.0]
  - - [1536, 1536, 1, 1024, 1536, 1536, 1024, 1536]
    - [63, 25050.9]
  - - [1792, 1536, 1, 1024, 1792, 1792, 1024, 1536]
    - [60, 26737.5]
  - - [2048, 1536, 1, 1024, 2048, 2048, 1024, 1536]
    - [60, 28389.1]
  - - [1280, 1792, 1, 1024, 1280, 1280, 1024, 1792]
    - [54, 24152.2]
  - - [1536, 1792, 1, 1024, 1536, 1536, 1024, 1792]
    - [60, 26446.8]
  - - [1792, 1792, 1, 1024, 1792, 1792, 1024, 1792]
    - [60, 26843.2]
  - - [2048, 1792, 1, 1024, 2048, 2048, 1024, 1792]
    - [60, 27521.6]
  - - [1280, 2048, 1, 1024, 1280, 1280, 1024, 2048]
    - [60, 25988.5]
  - - [1536, 2048, 1, 1024, 1536, 1536, 1024, 2048]
    - [60, 28857.0]
  - - [1792, 2048, 1, 1024, 1792, 1792, 1024, 2048]
    - [60, 28129.7]
  - - [2048, 2048, 1, 1024, 2048, 2048, 1024, 2048]
    - [60, 27756.8]
  - - [1280, 1280, 1, 2048, 1280, 1280, 2048, 1280]
    - [63, 25995.9]
  - - [1536, 1280, 1, 2048, 1536, 1536, 2048, 1280]
    - [60, 29761.9]
  - - [1792, 1280, 1, 2048, 1792, 1792, 2048, 1280]
    - [61, 27146.0]
  - - [2048, 1280, 1, 2048, 2048, 2048, 2048, 1280]
    - [60, 28242.3]
  - - [1280, 1536, 1, 2048, 1280, 1280, 2048, 1536]
    - [60, 29385.2]
  - - [1536, 1536, 1, 2048, 1536, 1536, 2048, 1536]
    - [61, 28169.9]
  - - [1792, 1536, 1, 2048, 1792, 1792, 2048, 1536]
    - [60, 30658.4]
  - - [2048, 1536, 1, 2048, 2048, 2048, 2048, 1536]
    - [60, 32767.8]
  - - [1280, 1792, 1, 2048, 1280, 1280, 2048, 1792]
    - [61, 27220.7]
  - - [1536, 1792, 1, 2048, 1536, 1536, 2048, 1792]
    - [60, 30065.3]
  - - [1792, 1792, 1, 2048, 1792, 1792, 2048, 1792]
    - [60, 30085.3]
  - - [2048, 1792, 1, 2048, 2048, 2048, 2048, 1792]
    - [60, 31414.6]
  - - [1280, 2048, 1, 2048, 1280, 1280, 2048, 2048]
    - [60, 29714.4]
  - - [1536, 2048, 1, 2048, 1536, 1536, 2048, 2048]
    - [60, 32958.9]
  - - [1792, 2048, 1, 2048, 1792, 1792, 2048, 2048]
    - [60, 31360.9]
  - - [2048, 2048, 1, 2048, 2048, 2048, 2048, 2048]
    - [60, 30888.2]
  - - [1280, 1280, 1, 4096, 1280, 1280, 4096, 1280]
    - [62, 29559.0]
  - - [1536, 1280, 1, 4096, 1536, 1536, 4096, 1280]
    - [60, 32400.5]
  - - [1792, 1280, 1, 4096, 1792, 1792, 4096, 1280]
    - [3, 31567.7]
  - - [2048, 1280, 1, 4096, 2048, 2048, 4096, 1280]
    - [60, 30345.4]
  - - [1280, 1536, 1, 4096, 1280, 1280, 4096, 1536]
    - [60, 32395.9]
  - - [1536, 1536, 1, 4096, 1536, 1536, 4096, 1536]
    - [61, 31619.2]
  - - [1792, 1536, 1, 4096, 1792, 1792, 4096, 1536]
    - [3, 34192.9]
  - - [2048, 1536, 1, 4096, 2048, 2048, 4096, 1536]
    - [60, 35355.4]
  - - [1280, 1792, 1, 4096, 1280, 1280, 4096, 1792]
    - [61, 31693.9]
  - - [1536, 1792, 1, 4096, 1536, 1536, 4096, 1792]
    - [3, 32135.1]
  - - [1792, 1792, 1, 4096, 1792, 1792, 4096, 1792]
    - [3, 33490.5]
  - - [2048, 1792, 1, 4096, 2048, 2048, 4096, 1792]
    - [60, 33502.7]
  - - [1280, 2048, 1, 4096, 1280, 1280, 4096, 2048]
    - [60, 32172.0]
  - - [1536, 2048, 1, 4096, 1536, 1536, 4096, 2048]
    - [60, 35547.0]
  - - [1792, 2048, 1, 4096, 1792, 1792, 4096, 2048]
    - [3, 33982.4]
  - - [2048, 2048, 1, 4096, 2048, 2048, 4096, 2048]
    - [60, 32596.3]
  - - [2560, 2560, 1, 64, 2560, 2560, 64, 2560]
    - [44, 9393.95]
  - - [3072, 2560, 1, 64, 3072, 3072, 64, 2560]
    - [44, 9242.2]
  - - [3584, 2560, 1, 64, 3584, 3584, 64, 2560]
    - [44, 9997.75]
  - - [4096, 2560, 1, 64, 4096, 4096, 64, 2560]
    - [27, 8829.3]
  - - [2560, 3072, 1, 64, 2560, 2560, 64, 3072]
    - [44, 9479.81]
  - - [3072, 3072, 1, 64, 3072, 3072, 64, 3072]
    - [44, 9891.9]
  - - [3584, 3072, 1, 64, 3584, 3584, 64, 3072]
    - [44, 10808.7]
  - - [4096, 3072, 1, 64, 4096, 4096, 64, 3072]
    - [28, 9505.22]
  - - [2560, 3584, 1, 64, 2560, 2560, 64, 3584]
    - [44, 10153.3]
  - - [3072, 3584, 1, 64, 3072, 3072, 64, 3584]
    - [44, 10369.6]
  - - [3584, 3584, 1, 64, 3584, 3584, 64, 3584]
    - [44, 11286.5]
  - - [4096, 3584, 1, 64, 4096, 4096, 64, 3584]
    - [27, 9686.07]
  - - [2560, 4096, 1, 64, 2560, 2560, 64, 4096]
    - [44, 10548.8]
  - - [3072, 4096, 1, 64, 3072, 3072, 64, 4096]
    - [44, 10682.9]
  - - [3584, 4096, 1, 64, 3584, 3584, 64, 4096]
    - [44, 11585.8]
  - - [4096, 4096, 1, 64, 4096, 4096, 64, 4096]
    - [26, 9762.49]
  - - [2560, 2560, 1, 256, 2560, 2560, 256, 2560]
    - [54, 20272.7]
  - - [3072, 2560, 1, 256, 3072, 3072, 256, 2560]
    - [54, 20513.0]
  - - [3584, 2560, 1, 256, 3584, 3584, 256, 2560]
    - [54, 21741.8]
  - - [4096, 2560, 1, 256, 4096, 4096, 256, 2560]
    - [60, 20963.9]
  - - [2560, 3072, 1, 256, 2560, 2560, 256, 3072]
    - [54, 21488.2]
  - - [3072, 3072, 1, 256, 3072, 3072, 256, 3072]
    - [54, 21606.1]
  - - [3584, 3072, 1, 256, 3584, 3584, 256, 3072]
    - [54, 22880.5]
  - - [4096, 3072, 1, 256, 4096, 4096, 256, 3072]
    - [60, 21975.2]
  - - [2560, 3584, 1, 256, 2560, 2560, 256, 3584]
    - [54, 21492.1]
  - - [3072, 3584, 1, 256, 3072, 3072, 256, 3584]
    - [54, 22001.2]
  - - [3584, 3584, 1, 256, 3584, 3584, 256, 3584]
    - [54, 22685.1]
  - - [4096, 3584, 1, 256, 4096, 4096, 256, 3584]
    - [60, 22235.3]
  - - [2560, 4096, 1, 256, 2560, 2560, 256, 4096]
    - [54, 22223.2]
  - - [3072, 4096, 1, 256, 3072, 3072, 256, 4096]
    - [60, 22924.5]
  - - [3584, 4096, 1, 256, 3584, 3584, 256, 4096]
    - [60, 23367.1]
  - - [4096, 4096, 1, 256, 4096, 4096, 256, 4096]
    - [60, 22606.6]
  - - [2560, 2560, 1, 512, 2560, 2560, 512, 2560]
    - [60, 26123.3]
  - - [3072, 2560, 1, 512, 3072, 3072, 512, 2560]
    - [60, 27155.0]
  - - [3584, 2560, 1, 512, 3584, 3584, 512, 2560]
    - [60, 27725.4]
  - - [4096, 2560, 1, 512, 4096, 4096, 512, 2560]
    - [60, 28104.8]
  - - [2560, 3072, 1, 512, 2560, 2560, 512, 3072]
    - [60, 27480.0]
  - - [3072, 3072, 1, 512, 3072, 3072, 512, 3072]
    - [60, 29058.4]
  - - [3584, 3072, 1, 512, 3584, 3584, 512, 3072]
    - [60, 29243.2]
  - - [4096, 3072, 1, 512, 4096, 4096, 512, 3072]
    - [60, 29281.6]
  - - [2560, 3584, 1, 512, 2560, 2560, 512, 3584]
    - [60, 27748.1]
  - - [3072, 3584, 1, 512, 3072, 3072, 512, 3584]
    - [60, 29327.4]
  - - [3584, 3584, 1, 512, 3584, 3584, 512, 3584]
    - [60, 29563.1]
  - - [4096, 3584, 1, 512, 4096, 4096, 512, 3584]
    - [60, 29194.1]
  - - [2560, 4096, 1, 512, 2560, 2560, 512, 4096]
    - [60, 28870.5]
  - - [3072, 4096, 1, 512, 3072, 3072, 512, 4096]
    - [60, 29757.0]
  - - [3584, 4096, 1, 512, 3584, 3584, 512, 4096]
    - [60, 30196.4]
  - - [4096, 4096, 1, 512, 4096, 4096, 512, 4096]
    - [60, 29604.7]
  - - [2560, 2560, 1, 1024, 2560, 2560, 1024, 2560]
    - [60, 31591.9]
  - - [3072, 2560, 1, 1024, 3072, 3072, 1024, 2560]
    - [60, 32953.3]
  - - [3584, 2560, 1, 1024, 3584, 3584, 1024, 2560]
    - [60, 33127.1]
  - - [4096, 2560, 1, 1024, 4096, 4096, 1024, 2560]
    - [60, 33033.8]
  - - [2560, 3072, 1, 1024, 2560, 2560, 1024, 3072]
    - [60, 33021.1]
  - - [3072, 3072, 1, 1024, 3072, 3072, 1024, 3072]
    - [60, 34267.6]
  - - [3584, 3072, 1, 1024, 3584, 3584, 1024, 3072]
    - [60, 33961.5]
  - - [4096, 3072, 1, 1024, 4096, 4096, 1024, 3072]
    - [60, 33958.2]
  - - [2560, 3584, 1, 1024, 2560, 2560, 1024, 3584]
    - [60, 33118.4]
  - - [3072, 3584, 1, 1024, 3072, 3072, 1024, 3584]
    - [60, 34115.4]
  - - [3584, 3584, 1, 1024, 3584, 3584, 1024, 3584]
    - [60, 33913.8]
  - - [4096, 3584, 1, 1024, 4096, 4096, 1024, 3584]
    - [60, 34012.0]
  - - [2560, 4096, 1, 1024, 2560, 2560, 1024, 4096]
    - [60, 34088.0]
  - - [3072, 4096, 1, 1024, 3072, 3072, 1024, 4096]
    - [60, 34707.8]
  - - [3584, 4096, 1, 1024, 3584, 3584, 1024, 4096]
    - [60, 34171.0]
  - - [4096, 4096, 1, 1024, 4096, 4096, 1024, 4096]
    - [60, 34009.6]
  - - [2560, 2560, 1, 2048, 2560, 2560, 2048, 2560]
    - [60, 33760.0]
  - - [3072, 2560, 1, 2048, 3072, 3072, 2048, 2560]
    - [60, 35091.4]
  - - [3584, 2560, 1, 2048, 3584, 3584, 2048, 2560]
    - [60, 34863.1]
  - - [4096, 2560, 1, 2048, 4096, 4096, 2048, 2560]
    - [60, 36136.0]
  - - [2560, 3072, 1, 2048, 2560, 2560, 2048, 3072]
    - [60, 33992.2]
  - - [3072, 3072, 1, 2048, 3072, 3072, 2048, 3072]
    - [60, 36224.1]
  - - [3584, 3072, 1, 2048, 3584, 3584, 2048, 3072]
    - [60, 36033.8]
  - - [4096, 3072, 1, 2048, 4096, 4096, 2048, 3072]
    - [60, 36661.6]
  - - [2560, 3584, 1, 2048, 2560, 2560, 2048, 3584]
    - [60, 35304.8]
  - - [3072, 3584, 1, 2048, 3072, 3072, 2048, 3584]
    - [60, 35455.6]
  - - [3584, 3584, 1, 2048, 3584, 3584, 2048, 3584]
    - [60, 35706.7]
  - - [4096, 3584, 1, 2048, 4096, 4096, 2048, 3584]
    - [60, 36445.0]
  - - [2560, 4096, 1, 2048, 2560, 2560, 2048, 4096]
    - [60, 36305.4]
  - - [3072, 4096, 1, 2048, 3072, 3072, 2048, 4096]
    - [60, 36073.7]
  - - [3584, 4096, 1, 2048, 3584, 3584, 2048, 4096]
    - [60, 35946.3]
  - - [4096, 4096, 1, 2048, 4096, 4096, 2048, 4096]
    - [60, 36245.7]
  - - [2560, 2560, 1, 4096, 2560, 2560, 4096, 2560]
    - [3, 35378.0]
  - - [3072, 2560, 1, 4096, 3072, 3072, 4096, 2560]
    - [60, 36212.9]
  - - [3584, 2560, 1, 4096, 3584, 3584, 4096, 2560]
    - [60, 36894.2]
  - - [4096, 2560, 1, 4096, 4096, 4096, 4096, 2560]
    - [60, 37579.5]
  - - [2560, 3072, 1, 4096, 2560, 2560, 4096, 3072]
    - [60, 36396.6]
  - - [3072, 3072, 1, 4096, 3072, 3072, 4096, 3072]
    - [60, 38091.9]
  - - [3584, 3072, 1, 4096, 3584, 3584, 4096, 3072]
    - [60, 37170.4]
  - - [4096, 3072, 1, 4096, 4096, 4096, 4096, 3072]
    - [60, 38162.8]
  - - [2560, 3584, 1, 4096, 2560, 2560, 4096, 3584]
    - [60, 37091.3]
  - - [3072, 3584, 1, 4096, 3072, 3072, 4096, 3584]
    - [60, 37655.3]
  - - [3584, 3584, 1, 4096, 3584, 3584, 4096, 3584]
    - [60, 37062.1]
  - - [4096, 3584, 1, 4096, 4096, 4096, 4096, 3584]
    - [60, 37725.2]
  - - [2560, 4096, 1, 4096, 2560, 2560, 4096, 4096]
    - [60, 37174.7]
  - - [3072, 4096, 1, 4096, 3072, 3072, 4096, 4096]
    - [60, 36856.9]
  - - [3584, 4096, 1, 4096, 3584, 3584, 4096, 4096]
    - [60, 36141.4]
  - - [4096, 4096, 1, 4096, 4096, 4096, 4096, 4096]
    - [60, 36293.4]
  - - [1, 1, 1, 1, 1, 1, 1, 1]
    - [16, 7.09975e-05]
  - - [1, 1, 1, 64, 1, 1, 64, 1]
    - [15, 0.00433472]
  - - [1, 64, 1, 1, 1, 1, 1, 64]
    - [0, 0.00417224]
  - - [64, 1, 1, 1, 64, 64, 1, 1]
    - [8, 0.00414253]
  - - [64, 64, 1, 1, 64, 64, 1, 64]
    - [4, 0.279887]
  - - [64, 1, 1, 64, 64, 64, 64, 1]
    - [17, 0.275278]
  - - [1, 64, 1, 64, 1, 1, 64, 64]
    - [68, 0.272259]
- null
- null
- DeviceEfficiency
- GridBased
