library/src/amd_detail/rocblaslt/src/Tensile/Logic/asm_full/navi32/GridBased/navi32_Cijk_Ailk_Bjlk_HHS_BH_Bias_HAS_SAV_UserArgs.yaml
- {MinimumRequiredVersion: 4.33.0}
- navi32
- gfx1101
- [Device 73f0]
    SolutionIndex: 0
    SolutionNameMin: Cijk_Ailk_Bjlk_HHS_BH_Bias_AuxH_HAS_SAV_UserArgs_MT32x32x32_MI16x16x1_SN_LDSB0_GRVWA2_GRVWB1_GSU4_LBSPPA1024_LBSPPB1024_MIWT1_1_NLCA1_NLCB1_SS0_SU32_SUM0_SUS256_WG32_4_1_WGM8
    SolutionIndex: 1
    SolutionNameMin: Cijk_Ailk_Bjlk_HHS_BH_Bias_AuxH_HAS_SAV_UserArgs_MT16x64x32_MI16x16x1_SN_LDSB0_GRVWA2_GRVWB8_GSU1_LBSPPA512_LBSPPB2048_MIWT1_1_NLCA1_NLCB1_SS0_SU32_SUM0_SUS256_WG16_8_1_WGM8
    SolutionIndex: 2
    SolutionNameMin: Cijk_Ailk_Bjlk_HHS_BH_Bias_AuxH_HAS_SAV_UserArgs_MT64x16x64_MI16x16x1_SN_LDSB0_GRVWA1_GRVWB8_GSU1_LBSPPA2048_LBSPPB512_MIWT1_1_NLCA1_NLCB1_SS0_SU32_SUM0_SUS256_WG64_2_1_WGM8
    SolutionIndex: 3
    SolutionNameMin: Cijk_Ailk_Bjlk_HHS_BH_Bias_AuxH_HAS_SAV_UserArgs_MT32x32x64_MI16x16x1_SN_LDSB0_GRVWA1_GRVWB8_GSU4_LBSPPA1024_LBSPPB1024_MIWT1_1_NLCA1_NLCB1_SS0_SU32_SUM0_SUS256_WG32_4_1_WGM8
    SolutionIndex: 4
    SolutionNameMin: Cijk_Ailk_Bjlk_HHS_BH_Bias_AuxH_HAS_SAV_UserArgs_MT64x16x32_MI16x16x1_SN_LDSB0_GRVWA8_GRVWB2_GSU1_LBSPPA2048_LBSPPB512_MIWT1_1_NLCA1_NLCB1_SS1_SU32_SUM0_SUS256_WG64_2_1_WGM8
    SolutionIndex: 5
    SolutionNameMin: Cijk_Ailk_Bjlk_HHS_BH_Bias_AuxH_HAS_SAV_UserArgs_MT64x16x32_MI16x16x1_SN_LDSB0_GRVWA8_GRVWB1_GSU1_LBSPPA2048_LBSPPB512_MIWT1_1_NLCA1_NLCB1_SS1_SU32_SUM0_SUS256_WG64_2_1_WGM8
    SolutionIndex: 6
    SolutionNameMin: Cijk_Ailk_Bjlk_HHS_BH_Bias_AuxH_HAS_SAV_UserArgs_MT64x16x32_MI16x16x1_SN_LDSB0_GRVWA1_GRVWB1_GSU1_LBSPPA2048_LBSPPB512_MIWT1_1_NLCA1_NLCB1_SS1_SU32_SUM0_SUS256_WG64_2_1_WGM8
    SolutionIndex: 7
    SolutionNameMin: Cijk_Ailk_Bjlk_HHS_BH_Bias_AuxH_HAS_SAV_UserArgs_MT64x16x32_MI16x16x1_SN_LDSB0_GRVWA8_GRVWB2_GSU4_LBSPPA2048_LBSPPB512_MIWT1_1_NLCA1_NLCB1_SS1_SU32_SUM0_SUS256_WG64_2_1_WGM8
    SolutionIndex: 8
    SolutionNameMin: Cijk_Ailk_Bjlk_HHS_BH_Bias_AuxH_HAS_SAV_UserArgs_MT64x16x32_MI16x16x1_SN_LDSB0_GRVWA8_GRVWB1_GSU4_LBSPPA2048_LBSPPB512_MIWT1_1_NLCA1_NLCB1_SS1_SU32_SUM0_SUS256_WG64_2_1_WGM8
    SolutionIndex: 9
    SolutionNameMin: Cijk_Ailk_Bjlk_HHS_BH_Bias_AuxH_HAS_SAV_UserArgs_MT256x16x32_MI16x16x1_SN_LDSB1_GRVWA8_GRVWB1_GSU1_LBSPPA8192_LBSPPB512_MIWT4_1_NLCA1_NLCB1_SS1_SU32_SUM0_SUS256_WG64_2_1_WGM8
    SolutionIndex: 10
    SolutionNameMin: Cijk_Ailk_Bjlk_HHS_BH_Bias_AuxH_HAS_SAV_UserArgs_MT32x32x32_MI16x16x1_SN_LDSB0_GRVWA8_GRVWB2_GSU1_LBSPPA1024_LBSPPB1024_MIWT1_1_NLCA1_NLCB1_SS1_SU32_SUM0_SUS256_WG32_4_1_WGM8
    SolutionIndex: 11
    SolutionNameMin: Cijk_Ailk_Bjlk_HHS_BH_Bias_AuxH_HAS_SAV_UserArgs_MT32x32x32_MI16x16x1_SN_LDSB0_GRVWA8_GRVWB1_GSU1_LBSPPA1024_LBSPPB1024_MIWT1_1_NLCA1_NLCB1_SS1_SU32_SUM0_SUS256_WG32_4_1_WGM8
    SolutionIndex: 12
    SolutionNameMin: Cijk_Ailk_Bjlk_HHS_BH_Bias_AuxH_HAS_SAV_UserArgs_MT32x32x32_MI16x16x1_SN_LDSB0_GRVWA1_GRVWB1_GSU1_LBSPPA1024_LBSPPB1024_MIWT1_1_NLCA1_NLCB1_SS1_SU32_SUM0_SUS256_WG32_4_1_WGM8
    SolutionIndex: 13
    SolutionNameMin: Cijk_Ailk_Bjlk_HHS_BH_Bias_AuxH_HAS_SAV_UserArgs_MT32x32x32_MI16x16x1_SN_LDSB0_GRVWA1_GRVWB2_GSU4_LBSPPA1024_LBSPPB1024_MIWT1_1_NLCA1_NLCB1_SS1_SU32_SUM0_SUS256_WG32_4_1_WGM8
    SolutionIndex: 14
    SolutionNameMin: Cijk_Ailk_Bjlk_HHS_BH_Bias_AuxH_HAS_SAV_UserArgs_MT64x32x32_MI16x16x1_SN_LDSB0_GRVWA8_GRVWB2_GSU1_LBSPPA2048_LBSPPB1024_MIWT2_1_NLCA1_NLCB1_SS1_SU32_SUM0_SUS256_WG32_4_1_WGM8
    SolutionIndex: 15
    SolutionNameMin: Cijk_Ailk_Bjlk_HHS_BH_Bias_AuxH_HAS_SAV_UserArgs_MT64x32x32_MI16x16x1_SN_LDSB0_GRVWA1_GRVWB2_GSU1_LBSPPA2048_LBSPPB1024_MIWT2_1_NLCA1_NLCB1_SS1_SU32_SUM0_SUS256_WG32_4_1_WGM8
    SolutionIndex: 16
    SolutionNameMin: Cijk_Ailk_Bjlk_HHS_BH_Bias_AuxH_HAS_SAV_UserArgs_MT64x32x32_MI16x16x1_SN_LDSB0_GRVWA8_GRVWB1_GSU1_LBSPPA2048_LBSPPB1024_MIWT2_1_NLCA1_NLCB1_SS1_SU32_SUM0_SUS256_WG32_4_1_WGM8
    SolutionIndex: 17
    SolutionNameMin: Cijk_Ailk_Bjlk_HHS_BH_Bias_AuxH_HAS_SAV_UserArgs_MT64x32x32_MI16x16x1_SN_LDSB0_GRVWA1_GRVWB1_GSU1_LBSPPA2048_LBSPPB1024_MIWT2_1_NLCA1_NLCB1_SS1_SU32_SUM0_SUS256_WG32_4_1_WGM8
    SolutionIndex: 18
    SolutionNameMin: Cijk_Ailk_Bjlk_HHS_BH_Bias_AuxH_HAS_SAV_UserArgs_MT64x32x32_MI16x16x1_SN_LDSB0_GRVWA8_GRVWB2_GSU4_LBSPPA2048_LBSPPB1024_MIWT2_1_NLCA1_NLCB1_SS1_SU32_SUM0_SUS256_WG32_4_1_WGM8
    SolutionIndex: 19
    SolutionNameMin: Cijk_Ailk_Bjlk_HHS_BH_Bias_AuxH_HAS_SAV_UserArgs_MT96x32x32_MI16x16x1_SN_LDSB0_GRVWA8_GRVWB2_GSU1_LBSPPA3072_LBSPPB1024_MIWT3_1_NLCA3_NLCB1_SS1_SU32_SUM0_SUS256_WG32_4_1_WGM8
    SolutionIndex: 20
    SolutionNameMin: Cijk_Ailk_Bjlk_HHS_BH_Bias_AuxH_HAS_SAV_UserArgs_MT96x32x32_MI16x16x1_SN_LDSB0_GRVWA8_GRVWB1_GSU1_LBSPPA3072_LBSPPB1024_MIWT3_1_NLCA3_NLCB1_SS1_SU32_SUM0_SUS256_WG32_4_1_WGM8
    SolutionIndex: 21
    SolutionNameMin: Cijk_Ailk_Bjlk_HHS_BH_Bias_AuxH_HAS_SAV_UserArgs_MT96x32x32_MI16x16x1_SN_LDSB0_GRVWA8_GRVWB2_GSU4_LBSPPA3072_LBSPPB1024_MIWT3_1_NLCA3_NLCB1_SS1_SU32_SUM0_SUS256_WG32_4_1_WGM8
    SolutionIndex: 22
    SolutionNameMin: Cijk_Ailk_Bjlk_HHS_BH_Bias_AuxH_HAS_SAV_UserArgs_MT64x48x32_MI16x16x1_SN_LDSB0_GRVWA8_GRVWB2_GSU1_LBSPPA2048_LBSPPB1536_MIWT1_3_NLCA1_NLCB3_SS1_SU32_SUM0_SUS256_WG64_2_1_WGM8
    SolutionIndex: 23
    SolutionNameMin: Cijk_Ailk_Bjlk_HHS_BH_Bias_AuxH_HAS_SAV_UserArgs_MT64x48x32_MI16x16x1_SN_LDSB0_GRVWA8_GRVWB1_GSU1_LBSPPA2048_LBSPPB1536_MIWT1_3_NLCA1_NLCB3_SS1_SU32_SUM0_SUS256_WG64_2_1_WGM8
    SolutionIndex: 24
    SolutionNameMin: Cijk_Ailk_Bjlk_HHS_BH_Bias_AuxH_HAS_SAV_UserArgs_MT128x48x32_MI16x16x1_SN_LDSB0_GRVWA8_GRVWB2_GSU1_LBSPPA4096_LBSPPB1536_MIWT2_3_NLCA1_NLCB3_SS1_SU32_SUM0_SUS256_WG64_2_1_WGM8
    SolutionIndex: 25
    SolutionNameMin: Cijk_Ailk_Bjlk_HHS_BH_Bias_AuxH_HAS_SAV_UserArgs_MT128x48x32_MI16x16x1_SN_LDSB0_GRVWA8_GRVWB1_GSU1_LBSPPA4096_LBSPPB1536_MIWT2_3_NLCA1_NLCB3_SS1_SU32_SUM0_SUS256_WG64_2_1_WGM8
    SolutionIndex: 26
    SolutionNameMin: Cijk_Ailk_Bjlk_HHS_BH_Bias_AuxH_HAS_SAV_UserArgs_MT128x48x32_MI16x16x1_SN_LDSB0_GRVWA8_GRVWB1_GSU4_LBSPPA4096_LBSPPB1536_MIWT2_3_NLCA1_NLCB3_SS1_SU32_SUM0_SUS256_WG64_2_1_WGM8
    SolutionIndex: 27
    SolutionNameMin: Cijk_Ailk_Bjlk_HHS_BH_Bias_AuxH_HAS_SAV_UserArgs_MT16x64x32_MI16x16x1_SN_LDSB0_GRVWA4_GRVWB2_GSU1_LBSPPA512_LBSPPB2048_MIWT1_1_NLCA1_NLCB1_SS1_SU32_SUM0_SUS256_WG16_8_1_WGM8
    SolutionIndex: 28
    SolutionNameMin: Cijk_Ailk_Bjlk_HHS_BH_Bias_AuxH_HAS_SAV_UserArgs_MT16x64x32_MI16x16x1_SN_LDSB0_GRVWA1_GRVWB2_GSU1_LBSPPA512_LBSPPB2048_MIWT1_1_NLCA1_NLCB1_SS1_SU32_SUM0_SUS256_WG16_8_1_WGM8
    SolutionIndex: 29
    SolutionNameMin: Cijk_Ailk_Bjlk_HHS_BH_Bias_AuxH_HAS_SAV_UserArgs_MT16x64x32_MI16x16x1_SN_LDSB0_GRVWA4_GRVWB1_GSU1_LBSPPA512_LBSPPB2048_MIWT1_1_NLCA1_NLCB1_SS1_SU32_SUM0_SUS256_WG16_8_1_WGM8
    SolutionIndex: 30
    SolutionNameMin: Cijk_Ailk_Bjlk_HHS_BH_Bias_AuxH_HAS_SAV_UserArgs_MT16x64x32_MI16x16x1_SN_LDSB0_GRVWA4_GRVWB2_GSU4_LBSPPA512_LBSPPB2048_MIWT1_1_NLCA1_NLCB1_SS1_SU32_SUM0_SUS256_WG16_8_1_WGM8
    SolutionIndex: 31
    SolutionNameMin: Cijk_Ailk_Bjlk_HHS_BH_Bias_AuxH_HAS_SAV_UserArgs_MT32x64x32_MI16x16x1_SN_LDSB0_GRVWA8_GRVWB2_GSU1_LBSPPA1024_LBSPPB2048_MIWT2_1_NLCA1_NLCB1_SS1_SU32_SUM0_SUS256_WG16_8_1_WGM8
    SolutionIndex: 32
    SolutionNameMin: Cijk_Ailk_Bjlk_HHS_BH_Bias_AuxH_HAS_SAV_UserArgs_MT32x64x32_MI16x16x1_SN_LDSB0_GRVWA1_GRVWB1_GSU1_LBSPPA1024_LBSPPB2048_MIWT2_1_NLCA1_NLCB1_SS1_SU32_SUM0_SUS256_WG16_8_1_WGM8
    SolutionIndex: 33
    SolutionNameMin: Cijk_Ailk_Bjlk_HHS_BH_Bias_AuxH_HAS_SAV_UserArgs_MT48x64x32_MI16x16x1_SN_LDSB0_GRVWA4_GRVWB2_GSU1_LBSPPA1536_LBSPPB2048_MIWT3_1_NLCA3_NLCB1_SS1_SU32_SUM0_SUS256_WG16_8_1_WGM8
    SolutionIndex: 34
    SolutionNameMin: Cijk_Ailk_Bjlk_HHS_BH_Bias_AuxH_HAS_SAV_UserArgs_MT48x64x32_MI16x16x1_SN_LDSB0_GRVWA4_GRVWB2_GSU4_LBSPPA1536_LBSPPB2048_MIWT3_1_NLCA3_NLCB1_SS1_SU32_SUM0_SUS256_WG16_8_1_WGM8
    SolutionIndex: 35
    SolutionNameMin: Cijk_Ailk_Bjlk_HHS_BH_Bias_AuxH_HAS_SAV_UserArgs_MT32x96x32_MI16x16x1_SN_LDSB0_GRVWA8_GRVWB2_GSU1_LBSPPA1024_LBSPPB3072_MIWT1_3_NLCA1_NLCB3_SS1_SU32_SUM0_SUS256_WG32_4_1_WGM8
    SolutionIndex: 36
    SolutionNameMin: Cijk_Ailk_Bjlk_HHS_BH_Bias_AuxH_HAS_SAV_UserArgs_MT64x96x32_MI16x16x1_SN_LDSB0_GRVWA8_GRVWB2_GSU1_LBSPPA2048_LBSPPB3072_MIWT2_3_NLCA1_NLCB3_SS1_SU32_SUM0_SUS256_WG32_4_1_WGM8
    SolutionIndex: 37
    SolutionNameMin: Cijk_Ailk_Bjlk_HHS_BH_Bias_AuxH_HAS_SAV_UserArgs_MT64x96x32_MI16x16x1_SN_LDSB0_GRVWA8_GRVWB2_GSU2_LBSPPA2048_LBSPPB3072_MIWT2_3_NLCA1_NLCB3_SS1_SU32_SUM0_SUS256_WG32_4_1_WGM8
    SolutionIndex: 38
    SolutionNameMin: Cijk_Ailk_Bjlk_HHS_BH_Bias_AuxH_HAS_SAV_UserArgs_MT64x96x32_MI16x16x1_SN_LDSB0_GRVWA8_GRVWB2_GSU4_LBSPPA2048_LBSPPB3072_MIWT2_3_NLCA1_NLCB3_SS1_SU32_SUM0_SUS256_WG32_4_1_WGM8
    SolutionIndex: 39
    SolutionNameMin: Cijk_Ailk_Bjlk_HHS_BH_Bias_AuxH_HAS_SAV_UserArgs_MT64x16x64_MI16x16x1_SN_LDSB0_GRVWA8_GRVWB2_GSU1_LBSPPA2048_LBSPPB512_MIWT1_1_NLCA1_NLCB1_SS1_SU32_SUM0_SUS256_WG64_2_1_WGM8
    SolutionIndex: 40
    SolutionNameMin: Cijk_Ailk_Bjlk_HHS_BH_Bias_AuxH_HAS_SAV_UserArgs_MT64x16x64_MI16x16x1_SN_LDSB0_GRVWA8_GRVWB1_GSU1_LBSPPA2048_LBSPPB512_MIWT1_1_NLCA1_NLCB1_SS1_SU32_SUM0_SUS256_WG64_2_1_WGM8
    SolutionIndex: 41
    SolutionNameMin: Cijk_Ailk_Bjlk_HHS_BH_Bias_AuxH_HAS_SAV_UserArgs_MT64x16x64_MI16x16x1_SN_LDSB0_GRVWA8_GRVWB2_GSU4_LBSPPA2048_LBSPPB512_MIWT1_1_NLCA1_NLCB1_SS1_SU32_SUM0_SUS256_WG64_2_1_WGM8
    SolutionIndex: 42
    SolutionNameMin: Cijk_Ailk_Bjlk_HHS_BH_Bias_AuxH_HAS_SAV_UserArgs_MT64x16x64_MI16x16x1_SN_LDSB0_GRVWA8_GRVWB1_GSU4_LBSPPA2048_LBSPPB512_MIWT1_1_NLCA1_NLCB1_SS1_SU32_SUM0_SUS256_WG64_2_1_WGM8
    SolutionIndex: 43
    SolutionNameMin: Cijk_Ailk_Bjlk_HHS_BH_Bias_AuxH_HAS_SAV_UserArgs_MT32x32x64_MI16x16x1_SN_LDSB0_GRVWA8_GRVWB2_GSU1_LBSPPA1024_LBSPPB1024_MIWT1_1_NLCA1_NLCB1_SS1_SU32_SUM0_SUS256_WG32_4_1_WGM8
    SolutionIndex: 44
    SolutionNameMin: Cijk_Ailk_Bjlk_HHS_BH_Bias_AuxH_HAS_SAV_UserArgs_MT32x32x64_MI16x16x1_SN_LDSB0_GRVWA8_GRVWB1_GSU1_LBSPPA1024_LBSPPB1024_MIWT1_1_NLCA1_NLCB1_SS1_SU32_SUM0_SUS256_WG32_4_1_WGM8
    SolutionIndex: 45
    SolutionNameMin: Cijk_Ailk_Bjlk_HHS_BH_Bias_AuxH_HAS_SAV_UserArgs_MT32x32x64_MI16x16x1_SN_LDSB0_GRVWA1_GRVWB1_GSU1_LBSPPA1024_LBSPPB1024_MIWT1_1_NLCA1_NLCB1_SS1_SU32_SUM0_SUS256_WG32_4_1_WGM8
    SolutionIndex: 46
    SolutionNameMin: Cijk_Ailk_Bjlk_HHS_BH_Bias_AuxH_HAS_SAV_UserArgs_MT32x32x64_MI16x16x1_SN_LDSB0_GRVWA8_GRVWB2_GSU4_LBSPPA1024_LBSPPB1024_MIWT1_1_NLCA1_NLCB1_SS1_SU32_SUM0_SUS256_WG32_4_1_WGM8
    SolutionIndex: 47
    SolutionNameMin: Cijk_Ailk_Bjlk_HHS_BH_Bias_AuxH_HAS_SAV_UserArgs_MT64x32x64_MI16x16x1_SN_LDSB0_GRVWA8_GRVWB2_GSU1_LBSPPA2048_LBSPPB1024_MIWT2_1_NLCA1_NLCB1_SS1_SU32_SUM0_SUS256_WG32_4_1_WGM8
    SolutionIndex: 48
    SolutionNameMin: Cijk_Ailk_Bjlk_HHS_BH_Bias_AuxH_HAS_SAV_UserArgs_MT64x32x64_MI16x16x1_SN_LDSB0_GRVWA8_GRVWB2_GSU4_LBSPPA2048_LBSPPB1024_MIWT2_1_NLCA1_NLCB1_SS1_SU32_SUM0_SUS256_WG32_4_1_WGM8
    SolutionIndex: 49
    SolutionNameMin: Cijk_Ailk_Bjlk_HHS_BH_Bias_AuxH_HAS_SAV_UserArgs_MT16x64x64_MI16x16x1_SN_LDSB0_GRVWA8_GRVWB2_GSU1_LBSPPA512_LBSPPB2048_MIWT1_1_NLCA1_NLCB1_SS1_SU32_SUM0_SUS256_WG16_8_1_WGM8
    SolutionIndex: 50
    SolutionNameMin: Cijk_Ailk_Bjlk_HHS_BH_Bias_AuxH_HAS_SAV_UserArgs_MT16x64x64_MI16x16x1_SN_LDSB0_GRVWA1_GRVWB1_GSU1_LBSPPA512_LBSPPB2048_MIWT1_1_NLCA1_NLCB1_SS1_SU32_SUM0_SUS256_WG16_8_1_WGM8
- - - [64, 64, 1, 64, 64, 64, 64, 64]
    - [5, 17.5582]
  - - [192, 64, 1, 64, 192, 192, 192, 64]
    - [49, 51.8601]
  - - [320, 64, 1, 64, 320, 320, 320, 64]
    - [28, 88.682]
  - - [448, 64, 1, 64, 448, 448, 448, 64]
    - [4, 126.165]
  - - [576, 64, 1, 64, 576, 576, 576, 64]
    - [4, 171.404]
  - - [704, 64, 1, 64, 704, 704, 704, 64]
    - [27, 211.725]
  - - [832, 64, 1, 64, 832, 832, 832, 64]
    - [4, 238.238]
  - - [960, 64, 1, 64, 960, 960, 960, 64]
    - [49, 286.298]
  - - [64, 192, 1, 64, 64, 64, 64, 192]
    - [4, 53.4461]
  - - [192, 192, 1, 64, 192, 192, 192, 192]
    - [4, 173.548]
  - - [320, 192, 1, 64, 320, 320, 320, 192]
    - [4, 286.183]
  - - [448, 192, 1, 64, 448, 448, 448, 192]
    - [4, 398.64]
  - - [576, 192, 1, 64, 576, 576, 576, 192]
    - [4, 504.321]
  - - [704, 192, 1, 64, 704, 704, 704, 192]
    - [6, 617.911]
  - - [832, 192, 1, 64, 832, 832, 832, 192]
    - [4, 699.553]
  - - [960, 192, 1, 64, 960, 960, 960, 192]
    - [47, 827.272]
  - - [64, 320, 1, 64, 64, 64, 64, 320]
    - [4, 91.0886]
  - - [192, 320, 1, 64, 192, 192, 192, 320]
    - [39, 281.774]
  - - [320, 320, 1, 64, 320, 320, 320, 320]
    - [43, 472.843]
  - - [448, 320, 1, 64, 448, 448, 448, 320]
    - [4, 651.405]
  - - [576, 320, 1, 64, 576, 576, 576, 320]
    - [4, 801.664]
  - - [704, 320, 1, 64, 704, 704, 704, 320]
    - [17, 954.861]
  - - [832, 320, 1, 64, 832, 832, 832, 320]
    - [29, 1146.7]
  - - [960, 320, 1, 64, 960, 960, 960, 320]
    - [15, 1312.03]
  - - [64, 448, 1, 64, 64, 64, 64, 448]
    - [4, 126.165]
  - - [192, 448, 1, 64, 192, 192, 192, 448]
    - [4, 385.25]
  - - [320, 448, 1, 64, 320, 320, 320, 448]
    - [27, 660.312]
  - - [448, 448, 1, 64, 448, 448, 448, 448]
    - [4, 883.459]
  - - [576, 448, 1, 64, 576, 576, 576, 448]
    - [20, 1109.18]
  - - [704, 448, 1, 64, 704, 704, 704, 448]
    - [14, 1260.03]
  - - [832, 448, 1, 64, 832, 832, 832, 448]
    - [16, 1499.43]
  - - [960, 448, 1, 64, 960, 960, 960, 448]
    - [22, 1692.86]
  - - [64, 576, 1, 64, 64, 64, 64, 576]
    - [4, 166.918]
  - - [192, 576, 1, 64, 192, 192, 192, 576]
    - [4, 500.399]
  - - [320, 576, 1, 64, 320, 320, 320, 576]
    - [4, 816.111]
  - - [448, 576, 1, 64, 448, 448, 448, 576]
    - [23, 1113.66]
  - - [576, 576, 1, 64, 576, 576, 576, 576]
    - [35, 1375.73]
  - - [704, 576, 1, 64, 704, 704, 704, 576]
    - [22, 1640.52]
  - - [832, 576, 1, 64, 832, 832, 832, 576]
    - [31, 1900.95]
  - - [960, 576, 1, 64, 960, 960, 960, 576]
    - [16, 2044.51]
  - - [64, 704, 1, 64, 64, 64, 64, 704]
    - [6, 210.796]
  - - [192, 704, 1, 64, 192, 192, 192, 704]
    - [27, 589.911]
  - - [320, 704, 1, 64, 320, 320, 320, 704]
    - [4, 973.888]
  - - [448, 704, 1, 64, 448, 448, 448, 704]
    - [14, 1306.1]
  - - [576, 704, 1, 64, 576, 576, 576, 704]
    - [14, 1605.01]
  - - [704, 704, 1, 64, 704, 704, 704, 704]
    - [31, 1842.6]
  - - [832, 704, 1, 64, 832, 832, 832, 704]
    - [14, 2172.57]
  - - [960, 704, 1, 64, 960, 960, 960, 704]
    - [14, 2419.18]
  - - [64, 832, 1, 64, 64, 64, 64, 832]
    - [4, 246.51]
  - - [192, 832, 1, 64, 192, 192, 192, 832]
    - [11, 690.808]
  - - [320, 832, 1, 64, 320, 320, 320, 832]
    - [4, 1149.41]
  - - [448, 832, 1, 64, 448, 448, 448, 832]
    - [16, 1513.22]
  - - [576, 832, 1, 64, 576, 576, 576, 832]
    - [16, 1861.72]
  - - [704, 832, 1, 64, 704, 704, 704, 832]
    - [14, 2160.05]
  - - [832, 832, 1, 64, 832, 832, 832, 832]
    - [14, 2401.28]
  - - [960, 832, 1, 64, 960, 960, 960, 832]
    - [17, 2794.94]
  - - [64, 960, 1, 64, 64, 64, 64, 960]
    - [4, 281.482]
  - - [192, 960, 1, 64, 192, 192, 192, 960]
    - [4, 815.829]
  - - [320, 960, 1, 64, 320, 320, 320, 960]
    - [16, 1306.37]
  - - [448, 960, 1, 64, 448, 448, 448, 960]
    - [16, 1716.62]
  - - [576, 960, 1, 64, 576, 576, 576, 960]
    - [36, 2015.4]
  - - [704, 960, 1, 64, 704, 704, 704, 960]
    - [36, 2417.83]
  - - [832, 960, 1, 64, 832, 832, 832, 960]
    - [14, 2810.31]
  - - [960, 960, 1, 64, 960, 960, 960, 960]
    - [14, 3108.51]
  - - [64, 64, 1, 256, 64, 64, 64, 64]
    - [1, 68.378]
  - - [192, 64, 1, 256, 192, 192, 192, 64]
    - [10, 200.563]
  - - [320, 64, 1, 256, 320, 320, 320, 64]
    - [5, 343.019]
  - - [448, 64, 1, 256, 448, 448, 448, 64]
    - [44, 470.379]
  - - [576, 64, 1, 256, 576, 576, 576, 64]
    - [4, 655.383]
  - - [704, 64, 1, 256, 704, 704, 704, 64]
    - [40, 790.321]
  - - [832, 64, 1, 256, 832, 832, 832, 64]
    - [43, 940.784]
  - - [960, 64, 1, 256, 960, 960, 960, 64]
    - [39, 1074.4]
  - - [64, 192, 1, 256, 64, 64, 64, 192]
    - [10, 197.726]
  - - [192, 192, 1, 256, 192, 192, 192, 192]
    - [39, 653.115]
  - - [320, 192, 1, 256, 320, 320, 320, 192]
    - [5, 1080.67]
  - - [448, 192, 1, 256, 448, 448, 448, 192]
    - [39, 1447.79]
  - - [576, 192, 1, 256, 576, 576, 576, 192]
    - [47, 1799.33]
  - - [704, 192, 1, 256, 704, 704, 704, 192]
    - [47, 2111.29]
  - - [832, 192, 1, 256, 832, 832, 832, 192]
    - [23, 2512.02]
  - - [960, 192, 1, 256, 960, 960, 960, 192]
    - [22, 2923.63]
  - - [64, 320, 1, 256, 64, 64, 64, 320]
    - [5, 342.347]
  - - [192, 320, 1, 256, 192, 192, 192, 320]
    - [39, 1057.78]
  - - [320, 320, 1, 256, 320, 320, 320, 320]
    - [47, 1664.99]
  - - [448, 320, 1, 256, 448, 448, 448, 320]
    - [4, 2271.12]
  - - [576, 320, 1, 256, 576, 576, 576, 320]
    - [47, 2895.82]
  - - [704, 320, 1, 256, 704, 704, 704, 320]
    - [31, 3377.65]
  - - [832, 320, 1, 256, 832, 832, 832, 320]
    - [19, 3833.48]
  - - [960, 320, 1, 256, 960, 960, 960, 320]
    - [14, 4388.69]
  - - [64, 448, 1, 256, 64, 64, 64, 448]
    - [5, 478.817]
  - - [192, 448, 1, 256, 192, 192, 192, 448]
    - [43, 1431.78]
  - - [320, 448, 1, 256, 320, 320, 320, 448]
    - [10, 2265.51]
  - - [448, 448, 1, 256, 448, 448, 448, 448]
    - [10, 2898.01]
  - - [576, 448, 1, 256, 576, 576, 576, 448]
    - [19, 3721.81]
  - - [704, 448, 1, 256, 704, 704, 704, 448]
    - [14, 4328.2]
  - - [832, 448, 1, 256, 832, 832, 832, 448]
    - [31, 4872.24]
  - - [960, 448, 1, 256, 960, 960, 960, 448]
    - [14, 5517.58]
  - - [64, 576, 1, 256, 64, 64, 64, 576]
    - [43, 620.276]
  - - [192, 576, 1, 256, 192, 192, 192, 576]
    - [31, 1765.11]
  - - [320, 576, 1, 256, 320, 320, 320, 576]
    - [47, 2856.38]
  - - [448, 576, 1, 256, 448, 448, 448, 576]
    - [22, 3716.58]
  - - [576, 576, 1, 256, 576, 576, 576, 576]
    - [36, 4755.71]
  - - [704, 576, 1, 256, 704, 704, 704, 576]
    - [14, 5373.28]
  - - [832, 576, 1, 256, 832, 832, 832, 576]
    - [36, 6227.74]
  - - [960, 576, 1, 256, 960, 960, 960, 576]
    - [36, 7042.85]
  - - [64, 704, 1, 256, 64, 64, 64, 704]
    - [40, 793.31]
  - - [192, 704, 1, 256, 192, 192, 192, 704]
    - [10, 2096.58]
  - - [320, 704, 1, 256, 320, 320, 320, 704]
    - [14, 3332.76]
  - - [448, 704, 1, 256, 448, 448, 448, 704]
    - [14, 4334.01]
  - - [576, 704, 1, 256, 576, 576, 576, 704]
    - [14, 5329.28]
  - - [704, 704, 1, 256, 704, 704, 704, 704]
    - [24, 6183.27]
  - - [832, 704, 1, 256, 832, 832, 832, 704]
    - [31, 6728.73]
  - - [960, 704, 1, 256, 960, 960, 960, 704]
    - [36, 7744.8]
  - - [64, 832, 1, 256, 64, 64, 64, 832]
    - [5, 936.904]
  - - [192, 832, 1, 256, 192, 192, 192, 832]
    - [19, 2520.54]
  - - [320, 832, 1, 256, 320, 320, 320, 832]
    - [22, 3817.38]
  - - [448, 832, 1, 256, 448, 448, 448, 832]
    - [14, 4809.62]
  - - [576, 832, 1, 256, 576, 576, 576, 832]
    - [24, 6012.57]
  - - [704, 832, 1, 256, 704, 704, 704, 832]
    - [14, 6822.1]
  - - [832, 832, 1, 256, 832, 832, 832, 832]
    - [14, 7560.29]
  - - [960, 832, 1, 256, 960, 960, 960, 832]
    - [14, 8387.06]
  - - [64, 960, 1, 256, 64, 64, 64, 960]
    - [39, 1056.36]
  - - [192, 960, 1, 256, 192, 192, 192, 960]
    - [47, 2872.02]
  - - [320, 960, 1, 256, 320, 320, 320, 960]
    - [31, 4479.95]
  - - [448, 960, 1, 256, 448, 448, 448, 960]
    - [22, 5624.69]
  - - [576, 960, 1, 256, 576, 576, 576, 960]
    - [36, 6990.68]
  - - [704, 960, 1, 256, 704, 704, 704, 960]
    - [36, 8260.84]
  - - [832, 960, 1, 256, 832, 832, 832, 960]
    - [14, 8332.38]
  - - [960, 960, 1, 256, 960, 960, 960, 960]
    - [22, 9381.09]
  - - [64, 64, 1, 512, 64, 64, 64, 64]
    - [5, 127.22]
  - - [192, 64, 1, 512, 192, 192, 192, 64]
    - [41, 385.624]
  - - [320, 64, 1, 512, 320, 320, 320, 64]
    - [10, 649.092]
  - - [448, 64, 1, 512, 448, 448, 448, 64]
    - [4, 914.674]
  - - [576, 64, 1, 512, 576, 576, 576, 64]
    - [39, 1173.78]
  - - [704, 64, 1, 512, 704, 704, 704, 64]
    - [39, 1428.44]
  - - [832, 64, 1, 512, 832, 832, 832, 64]
    - [4, 1732.69]
  - - [960, 64, 1, 512, 960, 960, 960, 64]
    - [10, 1999.89]
  - - [64, 192, 1, 512, 64, 64, 64, 192]
    - [13, 376.07]
  - - [192, 192, 1, 512, 192, 192, 192, 192]
    - [43, 1218.53]
  - - [320, 192, 1, 512, 320, 320, 320, 192]
    - [43, 2022.33]
  - - [448, 192, 1, 512, 448, 448, 448, 192]
    - [4, 2624.64]
  - - [576, 192, 1, 512, 576, 576, 576, 192]
    - [47, 3269.33]
  - - [704, 192, 1, 512, 704, 704, 704, 192]
    - [22, 3715.86]
  - - [832, 192, 1, 512, 832, 832, 832, 192]
    - [22, 4343.66]
  - - [960, 192, 1, 512, 960, 960, 960, 192]
    - [22, 5098.56]
  - - [64, 320, 1, 512, 64, 64, 64, 320]
    - [4, 654.767]
  - - [192, 320, 1, 512, 192, 192, 192, 320]
    - [43, 2005.63]
  - - [320, 320, 1, 512, 320, 320, 320, 320]
    - [14, 3047.39]
  - - [448, 320, 1, 512, 448, 448, 448, 320]
    - [10, 3862.26]
  - - [576, 320, 1, 512, 576, 576, 576, 320]
    - [33, 4947.54]
  - - [704, 320, 1, 512, 704, 704, 704, 320]
    - [47, 5556.17]
  - - [832, 320, 1, 512, 832, 832, 832, 320]
    - [33, 6416.48]
  - - [960, 320, 1, 512, 960, 960, 960, 320]
    - [36, 7221.76]
  - - [64, 448, 1, 512, 64, 64, 64, 448]
    - [40, 918.394]
  - - [192, 448, 1, 512, 192, 192, 192, 448]
    - [10, 2634.85]
  - - [320, 448, 1, 512, 320, 320, 320, 448]
    - [47, 3911.76]
  - - [448, 448, 1, 512, 448, 448, 448, 448]
    - [14, 5004.28]
  - - [576, 448, 1, 512, 576, 576, 576, 448]
    - [19, 6156.88]
  - - [704, 448, 1, 512, 704, 704, 704, 448]
    - [24, 7244.7]
  - - [832, 448, 1, 512, 832, 832, 832, 448]
    - [36, 7718.69]
  - - [960, 448, 1, 512, 960, 960, 960, 448]
    - [36, 8863.35]
  - - [64, 576, 1, 512, 64, 64, 64, 576]
    - [39, 1213.43]
  - - [192, 576, 1, 512, 192, 192, 192, 576]
    - [47, 3187.43]
  - - [320, 576, 1, 512, 320, 320, 320, 576]
    - [22, 5071.16]
  - - [448, 576, 1, 512, 448, 448, 448, 576]
    - [22, 6384.33]
  - - [576, 576, 1, 512, 576, 576, 576, 576]
    - [36, 8091.33]
  - - [704, 576, 1, 512, 704, 704, 704, 576]
    - [36, 8760.44]
  - - [832, 576, 1, 512, 832, 832, 832, 576]
    - [36, 10594.9]
  - - [960, 576, 1, 512, 960, 960, 960, 576]
    - [36, 11757.5]
  - - [64, 704, 1, 512, 64, 64, 64, 704]
    - [10, 1482.13]
  - - [192, 704, 1, 512, 192, 192, 192, 704]
    - [19, 3695.03]
  - - [320, 704, 1, 512, 320, 320, 320, 704]
    - [14, 5665.33]
  - - [448, 704, 1, 512, 448, 448, 448, 704]
    - [24, 7460.59]
  - - [576, 704, 1, 512, 576, 576, 576, 704]
    - [14, 8281.86]
  - - [704, 704, 1, 512, 704, 704, 704, 704]
    - [24, 10244.7]
  - - [832, 704, 1, 512, 832, 832, 832, 704]
    - [36, 11060.4]
  - - [960, 704, 1, 512, 960, 960, 960, 704]
    - [36, 12750.3]
  - - [64, 832, 1, 512, 64, 64, 64, 832]
    - [10, 1742.6]
  - - [192, 832, 1, 512, 192, 192, 192, 832]
    - [20, 4373.97]
  - - [320, 832, 1, 512, 320, 320, 320, 832]
    - [22, 6409.09]
  - - [448, 832, 1, 512, 448, 448, 448, 832]
    - [14, 7659.98]
  - - [576, 832, 1, 512, 576, 576, 576, 832]
    - [25, 10077.1]
  - - [704, 832, 1, 512, 704, 704, 704, 832]
    - [33, 10065.4]
  - - [832, 832, 1, 512, 832, 832, 832, 832]
    - [36, 11798.6]
  - - [960, 832, 1, 512, 960, 960, 960, 832]
    - [24, 12355.0]
  - - [64, 960, 1, 512, 64, 64, 64, 960]
    - [4, 2001.8]
  - - [192, 960, 1, 512, 192, 192, 192, 960]
    - [22, 5080.72]
  - - [320, 960, 1, 512, 320, 320, 320, 960]
    - [36, 7250.23]
  - - [448, 960, 1, 512, 448, 448, 448, 960]
    - [36, 9159.96]
  - - [576, 960, 1, 512, 576, 576, 576, 960]
    - [36, 11858.7]
  - - [704, 960, 1, 512, 704, 704, 704, 960]
    - [36, 13073.0]
  - - [832, 960, 1, 512, 832, 832, 832, 960]
    - [22, 12323.7]
  - - [960, 960, 1, 512, 960, 960, 960, 960]
    - [36, 15202.1]
  - - [64, 64, 1, 1024, 64, 64, 64, 64]
    - [0, 242.459]
  - - [192, 64, 1, 1024, 192, 192, 192, 64]
    - [42, 744.793]
  - - [320, 64, 1, 1024, 320, 320, 320, 64]
    - [10, 1194.31]
  - - [448, 64, 1, 1024, 448, 448, 448, 64]
    - [4, 1676.81]
  - - [576, 64, 1, 1024, 576, 576, 576, 64]
    - [39, 2024.66]
  - - [704, 64, 1, 1024, 704, 704, 704, 64]
    - [10, 2556.86]
  - - [832, 64, 1, 1024, 832, 832, 832, 64]
    - [40, 2988.71]
  - - [960, 64, 1, 1024, 960, 960, 960, 64]
    - [43, 3408.25]
  - - [64, 192, 1, 1024, 64, 64, 64, 192]
    - [30, 718.839]
  - - [192, 192, 1, 1024, 192, 192, 192, 192]
    - [39, 2116.02]
  - - [320, 192, 1, 1024, 320, 320, 320, 192]
    - [39, 3495.35]
  - - [448, 192, 1, 1024, 448, 448, 448, 192]
    - [38, 4527.51]
  - - [576, 192, 1, 1024, 576, 576, 576, 192]
    - [47, 5477.58]
  - - [704, 192, 1, 1024, 704, 704, 704, 192]
    - [38, 6154.52]
  - - [832, 192, 1, 1024, 832, 832, 832, 192]
    - [38, 7185.81]
  - - [960, 192, 1, 1024, 960, 960, 960, 192]
    - [38, 8256.68]
  - - [64, 320, 1, 1024, 64, 64, 64, 320]
    - [4, 1199.43]
  - - [192, 320, 1, 1024, 192, 192, 192, 320]
    - [39, 3473.16]
  - - [320, 320, 1, 1024, 320, 320, 320, 320]
    - [47, 4999.41]
  - - [448, 320, 1, 1024, 448, 448, 448, 320]
    - [37, 6263.09]
  - - [576, 320, 1, 1024, 576, 576, 576, 320]
    - [33, 8006.43]
  - - [704, 320, 1, 1024, 704, 704, 704, 320]
    - [37, 8612.69]
  - - [832, 320, 1, 1024, 832, 832, 832, 320]
    - [33, 9603.36]
  - - [960, 320, 1, 1024, 960, 960, 960, 320]
    - [36, 11330.2]
  - - [64, 448, 1, 1024, 64, 64, 64, 448]
    - [10, 1688.87]
  - - [192, 448, 1, 1024, 192, 192, 192, 448]
    - [10, 4363.87]
  - - [320, 448, 1, 1024, 320, 320, 320, 448]
    - [26, 6283.06]
  - - [448, 448, 1, 1024, 448, 448, 448, 448]
    - [37, 7591.08]
  - - [576, 448, 1, 1024, 576, 576, 576, 448]
    - [37, 9718.68]
  - - [704, 448, 1, 1024, 704, 704, 704, 448]
    - [36, 11491.7]
  - - [832, 448, 1, 1024, 832, 832, 832, 448]
    - [36, 11402.3]
  - - [960, 448, 1, 1024, 960, 960, 960, 448]
    - [36, 13313.6]
  - - [64, 576, 1, 1024, 64, 64, 64, 576]
    - [39, 2114.24]
  - - [192, 576, 1, 1024, 192, 192, 192, 576]
    - [47, 5451.21]
  - - [320, 576, 1, 1024, 320, 320, 320, 576]
    - [38, 8102.5]
  - - [448, 576, 1, 1024, 448, 448, 448, 576]
    - [37, 9787.07]
  - - [576, 576, 1, 1024, 576, 576, 576, 576]
    - [36, 12562.4]
  - - [704, 576, 1, 1024, 704, 704, 704, 576]
    - [36, 12936.1]
  - - [832, 576, 1, 1024, 832, 832, 832, 576]
    - [36, 14841.9]
  - - [960, 576, 1, 1024, 960, 960, 960, 576]
    - [36, 17086.5]
  - - [64, 704, 1, 1024, 64, 64, 64, 704]
    - [43, 2586.25]
  - - [192, 704, 1, 1024, 192, 192, 192, 704]
    - [38, 5984.22]
  - - [320, 704, 1, 1024, 320, 320, 320, 704]
    - [37, 8674.39]
  - - [448, 704, 1, 1024, 448, 448, 448, 704]
    - [24, 11461.1]
  - - [576, 704, 1, 1024, 576, 576, 576, 704]
    - [36, 12636.9]
  - - [704, 704, 1, 1024, 704, 704, 704, 704]
    - [24, 15452.2]
  - - [832, 704, 1, 1024, 832, 832, 832, 704]
    - [36, 15990.7]
  - - [960, 704, 1, 1024, 960, 960, 960, 704]
    - [36, 18284.8]
  - - [64, 832, 1, 1024, 64, 64, 64, 832]
    - [39, 3036.9]
  - - [192, 832, 1, 1024, 192, 192, 192, 832]
    - [33, 6943.33]
  - - [320, 832, 1, 1024, 320, 320, 320, 832]
    - [37, 9635.6]
  - - [448, 832, 1, 1024, 448, 448, 448, 832]
    - [38, 11087.7]
  - - [576, 832, 1, 1024, 576, 576, 576, 832]
    - [24, 14893.7]
  - - [704, 832, 1, 1024, 704, 704, 704, 832]
    - [36, 14748.2]
  - - [832, 832, 1, 1024, 832, 832, 832, 832]
    - [36, 17386.9]
  - - [960, 832, 1, 1024, 960, 960, 960, 832]
    - [24, 17336.1]
  - - [64, 960, 1, 1024, 64, 64, 64, 960]
    - [39, 3508.02]
  - - [192, 960, 1, 1024, 192, 192, 192, 960]
    - [38, 8271.16]
  - - [320, 960, 1, 1024, 320, 320, 320, 960]
    - [36, 11649.1]
  - - [448, 960, 1, 1024, 448, 448, 448, 960]
    - [36, 13472.5]
  - - [576, 960, 1, 1024, 576, 576, 576, 960]
    - [36, 17356.3]
  - - [704, 960, 1, 1024, 704, 704, 704, 960]
    - [36, 18589.3]
  - - [832, 960, 1, 1024, 832, 832, 832, 960]
    - [37, 17070.1]
  - - [960, 960, 1, 1024, 960, 960, 960, 960]
    - [36, 20895.6]
  - - [64, 64, 1, 2048, 64, 64, 64, 64]
    - [3, 476.504]
  - - [192, 64, 1, 2048, 192, 192, 192, 64]
    - [41, 1402.43]
  - - [320, 64, 1, 2048, 320, 320, 320, 64]
    - [7, 2131.9]
  - - [448, 64, 1, 2048, 448, 448, 448, 64]
    - [18, 2990.67]
  - - [576, 64, 1, 2048, 576, 576, 576, 64]
    - [34, 3591.87]
  - - [704, 64, 1, 2048, 704, 704, 704, 64]
    - [34, 4283.98]
  - - [832, 64, 1, 2048, 832, 832, 832, 64]
    - [38, 4753.89]
  - - [960, 64, 1, 2048, 960, 960, 960, 64]
    - [43, 5542.16]
  - - [64, 64, 1, 4096, 64, 64, 64, 64]
    - [8, 873.381]
  - - [192, 64, 1, 4096, 192, 192, 192, 64]
    - [46, 2391.73]
  - - [320, 64, 1, 4096, 320, 320, 320, 64]
    - [46, 3716.79]
  - - [448, 64, 1, 4096, 448, 448, 448, 64]
    - [48, 5079.72]
  - - [576, 64, 1, 4096, 576, 576, 576, 64]
    - [21, 6026.66]
  - - [704, 64, 1, 4096, 704, 704, 704, 64]
    - [34, 7174.21]
  - - [832, 64, 1, 4096, 832, 832, 832, 64]
    - [38, 7620.94]
  - - [960, 64, 1, 4096, 960, 960, 960, 64]
    - [38, 8791.86]
  - - [1280, 1280, 1, 64, 1280, 1280, 1280, 1280]
    - [14, 4493.67]
  - - [1536, 1280, 1, 64, 1536, 1536, 1536, 1280]
    - [17, 5036.29]
  - - [1792, 1280, 1, 64, 1792, 1792, 1792, 1280]
    - [17, 5587.19]
  - - [2048, 1280, 1, 64, 2048, 2048, 2048, 1280]
    - [9, 5650.89]
  - - [1280, 1536, 1, 64, 1280, 1280, 1280, 1536]
    - [14, 5175.07]
  - - [1536, 1536, 1, 64, 1536, 1536, 1536, 1536]
    - [17, 5557.62]
  - - [1792, 1536, 1, 64, 1792, 1792, 1792, 1536]
    - [17, 6091.52]
  - - [2048, 1536, 1, 64, 2048, 2048, 2048, 1536]
    - [9, 6164.51]
  - - [1280, 1792, 1, 64, 1280, 1280, 1280, 1792]
    - [17, 5486.03]
  - - [1536, 1792, 1, 64, 1536, 1536, 1536, 1792]
    - [17, 6001.25]
  - - [1792, 1792, 1, 64, 1792, 1792, 1792, 1792]
    - [17, 6680.56]
  - - [2048, 1792, 1, 64, 2048, 2048, 2048, 1792]
    - [9, 6682.44]
  - - [1280, 2048, 1, 64, 1280, 1280, 1280, 2048]
    - [17, 5994.22]
  - - [1536, 2048, 1, 64, 1536, 1536, 1536, 2048]
    - [17, 6535.73]
  - - [1792, 2048, 1, 64, 1792, 1792, 1792, 2048]
    - [32, 6992.8]
  - - [2048, 2048, 1, 64, 2048, 2048, 2048, 2048]
    - [9, 6878.82]
  - - [1280, 1280, 1, 256, 1280, 1280, 1280, 1280]
    - [24, 13138.4]
  - - [1536, 1280, 1, 256, 1536, 1536, 1536, 1280]
    - [24, 13636.7]
  - - [1792, 1280, 1, 256, 1792, 1792, 1792, 1280]
    - [25, 14623.8]
  - - [2048, 1280, 1, 256, 2048, 2048, 2048, 1280]
    - [24, 15603.6]
  - - [1280, 1536, 1, 256, 1280, 1280, 1280, 1536]
    - [24, 14561.9]
  - - [1536, 1536, 1, 256, 1536, 1536, 1536, 1536]
    - [24, 15275.7]
  - - [1792, 1536, 1, 256, 1792, 1792, 1792, 1536]
    - [24, 17105.7]
  - - [2048, 1536, 1, 256, 2048, 2048, 2048, 1536]
    - [24, 17185.9]
  - - [1280, 1792, 1, 256, 1280, 1280, 1280, 1792]
    - [36, 14825.2]
  - - [1536, 1792, 1, 256, 1536, 1536, 1536, 1792]
    - [36, 15895.9]
  - - [1792, 1792, 1, 256, 1792, 1792, 1792, 1792]
    - [24, 15776.4]
  - - [2048, 1792, 1, 256, 2048, 2048, 2048, 1792]
    - [24, 16947.1]
  - - [1280, 2048, 1, 256, 1280, 1280, 1280, 2048]
    - [36, 15504.3]
  - - [1536, 2048, 1, 256, 1536, 1536, 1536, 2048]
    - [24, 17000.9]
  - - [1792, 2048, 1, 256, 1792, 1792, 1792, 2048]
    - [24, 17154.5]
  - - [2048, 2048, 1, 256, 2048, 2048, 2048, 2048]
    - [24, 17302.2]
  - - [1280, 1280, 1, 512, 1280, 1280, 1280, 1280]
    - [24, 19623.2]
  - - [1536, 1280, 1, 512, 1536, 1536, 1536, 1280]
    - [24, 20777.4]
  - - [1792, 1280, 1, 512, 1792, 1792, 1792, 1280]
    - [24, 20878.9]
  - - [2048, 1280, 1, 512, 2048, 2048, 2048, 1280]
    - [24, 21417.3]
  - - [1280, 1536, 1, 512, 1280, 1280, 1280, 1536]
    - [24, 21146.2]
  - - [1536, 1536, 1, 512, 1536, 1536, 1536, 1536]
    - [24, 21685.7]
  - - [1792, 1536, 1, 512, 1792, 1792, 1792, 1536]
    - [24, 23009.5]
  - - [2048, 1536, 1, 512, 2048, 2048, 2048, 1536]
    - [24, 23190.0]
  - - [1280, 1792, 1, 512, 1280, 1280, 1280, 1792]
    - [36, 20517.7]
  - - [1536, 1792, 1, 512, 1536, 1536, 1536, 1792]
    - [24, 22194.2]
  - - [1792, 1792, 1, 512, 1792, 1792, 1792, 1792]
    - [24, 23050.8]
  - - [2048, 1792, 1, 512, 2048, 2048, 2048, 1792]
    - [24, 23348.7]
  - - [1280, 2048, 1, 512, 1280, 1280, 1280, 2048]
    - [36, 21300.0]
  - - [1536, 2048, 1, 512, 1536, 1536, 1536, 2048]
    - [24, 22898.2]
  - - [1792, 2048, 1, 512, 1792, 1792, 1792, 2048]
    - [24, 23688.7]
  - - [2048, 2048, 1, 512, 2048, 2048, 2048, 2048]
    - [24, 24402.5]
  - - [1280, 1280, 1, 1024, 1280, 1280, 1280, 1280]
    - [24, 24266.3]
  - - [1536, 1280, 1, 1024, 1536, 1536, 1536, 1280]
    - [24, 25623.0]
  - - [1792, 1280, 1, 1024, 1792, 1792, 1792, 1280]
    - [24, 26121.8]
  - - [2048, 1280, 1, 1024, 2048, 2048, 2048, 1280]
    - [24, 26616.8]
  - - [1280, 1536, 1, 1024, 1280, 1280, 1280, 1536]
    - [24, 25670.4]
  - - [1536, 1536, 1, 1024, 1536, 1536, 1536, 1536]
    - [24, 27103.4]
  - - [1792, 1536, 1, 1024, 1792, 1792, 1792, 1536]
    - [24, 28110.7]
  - - [2048, 1536, 1, 1024, 2048, 2048, 2048, 1536]
    - [24, 27617.8]
  - - [1280, 1792, 1, 1024, 1280, 1280, 1280, 1792]
    - [36, 26158.2]
  - - [1536, 1792, 1, 1024, 1536, 1536, 1536, 1792]
    - [24, 26796.0]
  - - [1792, 1792, 1, 1024, 1792, 1792, 1792, 1792]
    - [24, 28049.9]
  - - [2048, 1792, 1, 1024, 2048, 2048, 2048, 1792]
    - [24, 27992.0]
  - - [1280, 2048, 1, 1024, 1280, 1280, 1280, 2048]
    - [36, 26639.2]
  - - [1536, 2048, 1, 1024, 1536, 1536, 1536, 2048]
    - [24, 27618.8]
  - - [1792, 2048, 1, 1024, 1792, 1792, 1792, 2048]
    - [24, 28418.5]
  - - [2048, 2048, 1, 1024, 2048, 2048, 2048, 2048]
    - [24, 28941.7]
  - - [1280, 1280, 1, 2048, 1280, 1280, 1280, 1280]
    - [24, 28646.8]
  - - [1536, 1280, 1, 2048, 1536, 1536, 1536, 1280]
    - [24, 29209.3]
  - - [1792, 1280, 1, 2048, 1792, 1792, 1792, 1280]
    - [24, 29621.2]
  - - [2048, 1280, 1, 2048, 2048, 2048, 2048, 1280]
    - [24, 29904.3]
  - - [1280, 1536, 1, 2048, 1280, 1280, 1280, 1536]
    - [36, 29522.1]
  - - [1536, 1536, 1, 2048, 1536, 1536, 1536, 1536]
    - [24, 30247.2]
  - - [1792, 1536, 1, 2048, 1792, 1792, 1792, 1536]
    - [24, 30775.6]
  - - [2048, 1536, 1, 2048, 2048, 2048, 2048, 1536]
    - [24, 30372.7]
  - - [1280, 1792, 1, 2048, 1280, 1280, 1280, 1792]
    - [36, 29284.2]
  - - [1536, 1792, 1, 2048, 1536, 1536, 1536, 1792]
    - [24, 29557.3]
  - - [1792, 1792, 1, 2048, 1792, 1792, 1792, 1792]
    - [36, 30891.0]
  - - [2048, 1792, 1, 2048, 2048, 2048, 2048, 1792]
    - [24, 30898.7]
  - - [1280, 2048, 1, 2048, 1280, 1280, 1280, 2048]
    - [24, 29661.5]
  - - [1536, 2048, 1, 2048, 1536, 1536, 1536, 2048]
    - [24, 30340.5]
  - - [1792, 2048, 1, 2048, 1792, 1792, 1792, 2048]
    - [36, 30648.6]
  - - [2048, 2048, 1, 2048, 2048, 2048, 2048, 2048]
    - [36, 29665.9]
  - - [1280, 1280, 1, 4096, 1280, 1280, 1280, 1280]
    - [24, 31109.5]
  - - [1536, 1280, 1, 4096, 1536, 1536, 1536, 1280]
    - [24, 31468.7]
  - - [1792, 1280, 1, 4096, 1792, 1792, 1792, 1280]
    - [24, 31498.5]
  - - [2048, 1280, 1, 4096, 2048, 2048, 2048, 1280]
    - [24, 31586.7]
  - - [1280, 1536, 1, 4096, 1280, 1280, 1280, 1536]
    - [36, 31724.6]
  - - [1536, 1536, 1, 4096, 1536, 1536, 1536, 1536]
    - [24, 32323.7]
  - - [1792, 1536, 1, 4096, 1792, 1792, 1792, 1536]
    - [24, 32652.1]
  - - [2048, 1536, 1, 4096, 2048, 2048, 2048, 1536]
    - [24, 31855.2]
  - - [1280, 1792, 1, 4096, 1280, 1280, 1280, 1792]
    - [24, 31445.2]
  - - [1536, 1792, 1, 4096, 1536, 1536, 1536, 1792]
    - [24, 31406.5]
  - - [1792, 1792, 1, 4096, 1792, 1792, 1792, 1792]
    - [24, 32374.0]
  - - [2048, 1792, 1, 4096, 2048, 2048, 2048, 1792]
    - [24, 32212.0]
  - - [1280, 2048, 1, 4096, 1280, 1280, 1280, 2048]
    - [36, 31623.0]
  - - [1536, 2048, 1, 4096, 1536, 1536, 1536, 2048]
    - [36, 32023.5]
  - - [1792, 2048, 1, 4096, 1792, 1792, 1792, 2048]
    - [36, 30500.3]
  - - [2048, 2048, 1, 4096, 2048, 2048, 2048, 2048]
    - [36, 28975.4]
  - - [2560, 2560, 1, 64, 2560, 2560, 2560, 2560]
    - [17, 8282.02]
  - - [3072, 2560, 1, 64, 3072, 3072, 3072, 2560]
    - [17, 8652.06]
  - - [3584, 2560, 1, 64, 3584, 3584, 3584, 2560]
    - [17, 9057.16]
  - - [4096, 2560, 1, 64, 4096, 4096, 4096, 2560]
    - [9, 8999.75]
  - - [2560, 3072, 1, 64, 2560, 2560, 2560, 3072]
    - [17, 8805.63]
  - - [3072, 3072, 1, 64, 3072, 3072, 3072, 3072]
    - [17, 9212.91]
  - - [3584, 3072, 1, 64, 3584, 3584, 3584, 3072]
    - [17, 9489.12]
  - - [4096, 3072, 1, 64, 4096, 4096, 4096, 3072]
    - [24, 9541.26]
  - - [2560, 3584, 1, 64, 2560, 2560, 2560, 3584]
    - [17, 9206.98]
  - - [3072, 3584, 1, 64, 3072, 3072, 3072, 3584]
    - [17, 9556.04]
  - - [3584, 3584, 1, 64, 3584, 3584, 3584, 3584]
    - [17, 9894.19]
  - - [4096, 3584, 1, 64, 4096, 4096, 4096, 3584]
    - [24, 9679.08]
  - - [2560, 4096, 1, 64, 2560, 2560, 2560, 4096]
    - [17, 9513.25]
  - - [3072, 4096, 1, 64, 3072, 3072, 3072, 4096]
    - [17, 9642.37]
  - - [3584, 4096, 1, 64, 3584, 3584, 3584, 4096]
    - [17, 10132.2]
  - - [4096, 4096, 1, 64, 4096, 4096, 4096, 4096]
    - [9, 9782.01]
  - - [2560, 2560, 1, 256, 2560, 2560, 2560, 2560]
    - [24, 21066.8]
  - - [3072, 2560, 1, 256, 3072, 3072, 3072, 2560]
    - [24, 21755.2]
  - - [3584, 2560, 1, 256, 3584, 3584, 3584, 2560]
    - [24, 22651.8]
  - - [4096, 2560, 1, 256, 4096, 4096, 4096, 2560]
    - [24, 22818.1]
  - - [2560, 3072, 1, 256, 2560, 2560, 2560, 3072]
    - [24, 22258.9]
  - - [3072, 3072, 1, 256, 3072, 3072, 3072, 3072]
    - [24, 23235.1]
  - - [3584, 3072, 1, 256, 3584, 3584, 3584, 3072]
    - [24, 23746.0]
  - - [4096, 3072, 1, 256, 4096, 4096, 4096, 3072]
    - [24, 24035.2]
  - - [2560, 3584, 1, 256, 2560, 2560, 2560, 3584]
    - [24, 22934.9]
  - - [3072, 3584, 1, 256, 3072, 3072, 3072, 3584]
    - [24, 23600.9]
  - - [3584, 3584, 1, 256, 3584, 3584, 3584, 3584]
    - [24, 24201.9]
  - - [4096, 3584, 1, 256, 4096, 4096, 4096, 3584]
    - [24, 24344.7]
  - - [2560, 4096, 1, 256, 2560, 2560, 2560, 4096]
    - [24, 22940.0]
  - - [3072, 4096, 1, 256, 3072, 3072, 3072, 4096]
    - [24, 23539.9]
  - - [3584, 4096, 1, 256, 3584, 3584, 3584, 4096]
    - [24, 24188.7]
  - - [4096, 4096, 1, 256, 4096, 4096, 4096, 4096]
    - [24, 23354.9]
  - - [2560, 2560, 1, 512, 2560, 2560, 2560, 2560]
    - [24, 27647.2]
  - - [3072, 2560, 1, 512, 3072, 3072, 3072, 2560]
    - [24, 28008.6]
  - - [3584, 2560, 1, 512, 3584, 3584, 3584, 2560]
    - [24, 28598.6]
  - - [4096, 2560, 1, 512, 4096, 4096, 4096, 2560]
    - [24, 28934.9]
  - - [2560, 3072, 1, 512, 2560, 2560, 2560, 3072]
    - [24, 28520.4]
  - - [3072, 3072, 1, 512, 3072, 3072, 3072, 3072]
    - [24, 29238.7]
  - - [3584, 3072, 1, 512, 3584, 3584, 3584, 3072]
    - [24, 29758.5]
  - - [4096, 3072, 1, 512, 4096, 4096, 4096, 3072]
    - [24, 29620.7]
  - - [2560, 3584, 1, 512, 2560, 2560, 2560, 3584]
    - [24, 28977.1]
  - - [3072, 3584, 1, 512, 3072, 3072, 3072, 3584]
    - [24, 29688.8]
  - - [3584, 3584, 1, 512, 3584, 3584, 3584, 3584]
    - [24, 29973.9]
  - - [4096, 3584, 1, 512, 4096, 4096, 4096, 3584]
    - [24, 30014.0]
  - - [2560, 4096, 1, 512, 2560, 2560, 2560, 4096]
    - [36, 28881.2]
  - - [3072, 4096, 1, 512, 3072, 3072, 3072, 4096]
    - [36, 28958.3]
  - - [3584, 4096, 1, 512, 3584, 3584, 3584, 4096]
    - [36, 29783.9]
  - - [4096, 4096, 1, 512, 4096, 4096, 4096, 4096]
    - [24, 29254.6]
  - - [2560, 2560, 1, 1024, 2560, 2560, 2560, 2560]
    - [24, 31176.6]
  - - [3072, 2560, 1, 1024, 3072, 3072, 3072, 2560]
    - [24, 31277.4]
  - - [3584, 2560, 1, 1024, 3584, 3584, 3584, 2560]
    - [24, 31868.1]
  - - [4096, 2560, 1, 1024, 4096, 4096, 4096, 2560]
    - [24, 31986.1]
  - - [2560, 3072, 1, 1024, 2560, 2560, 2560, 3072]
    - [36, 31986.7]
  - - [3072, 3072, 1, 1024, 3072, 3072, 3072, 3072]
    - [24, 32234.2]
  - - [3584, 3072, 1, 1024, 3584, 3584, 3584, 3072]
    - [24, 32766.9]
  - - [4096, 3072, 1, 1024, 4096, 4096, 4096, 3072]
    - [24, 32728.7]
  - - [2560, 3584, 1, 1024, 2560, 2560, 2560, 3584]
    - [24, 32203.4]
  - - [3072, 3584, 1, 1024, 3072, 3072, 3072, 3584]
    - [24, 32614.3]
  - - [3584, 3584, 1, 1024, 3584, 3584, 3584, 3584]
    - [24, 32397.1]
  - - [4096, 3584, 1, 1024, 4096, 4096, 4096, 3584]
    - [24, 32825.6]
  - - [2560, 4096, 1, 1024, 2560, 2560, 2560, 4096]
    - [36, 31964.2]
  - - [3072, 4096, 1, 1024, 3072, 3072, 3072, 4096]
    - [36, 31501.7]
  - - [3584, 4096, 1, 1024, 3584, 3584, 3584, 4096]
    - [36, 32309.2]
  - - [4096, 4096, 1, 1024, 4096, 4096, 4096, 4096]
    - [24, 31281.1]
  - - [2560, 2560, 1, 2048, 2560, 2560, 2560, 2560]
    - [24, 32962.1]
  - - [3072, 2560, 1, 2048, 3072, 3072, 3072, 2560]
    - [24, 32916.0]
  - - [3584, 2560, 1, 2048, 3584, 3584, 3584, 2560]
    - [36, 33163.3]
  - - [4096, 2560, 1, 2048, 4096, 4096, 4096, 2560]
    - [24, 33290.7]
  - - [2560, 3072, 1, 2048, 2560, 2560, 2560, 3072]
    - [36, 33432.8]
  - - [3072, 3072, 1, 2048, 3072, 3072, 3072, 3072]
    - [36, 33555.4]
  - - [3584, 3072, 1, 2048, 3584, 3584, 3584, 3072]
    - [24, 33983.0]
  - - [4096, 3072, 1, 2048, 4096, 4096, 4096, 3072]
    - [24, 33975.2]
  - - [2560, 3584, 1, 2048, 2560, 2560, 2560, 3584]
    - [24, 33584.5]
  - - [3072, 3584, 1, 2048, 3072, 3072, 3072, 3584]
    - [24, 33735.4]
  - - [3584, 3584, 1, 2048, 3584, 3584, 3584, 3584]
    - [24, 33857.9]
  - - [4096, 3584, 1, 2048, 4096, 4096, 4096, 3584]
    - [24, 33856.2]
  - - [2560, 4096, 1, 2048, 2560, 2560, 2560, 4096]
    - [36, 32946.1]
  - - [3072, 4096, 1, 2048, 3072, 3072, 3072, 4096]
    - [36, 32804.7]
  - - [3584, 4096, 1, 2048, 3584, 3584, 3584, 4096]
    - [36, 33009.8]
  - - [4096, 4096, 1, 2048, 4096, 4096, 4096, 4096]
    - [36, 30829.2]
  - - [2560, 2560, 1, 4096, 2560, 2560, 2560, 2560]
    - [24, 33900.8]
  - - [3072, 2560, 1, 4096, 3072, 3072, 3072, 2560]
    - [36, 33893.6]
  - - [3584, 2560, 1, 4096, 3584, 3584, 3584, 2560]
    - [24, 34143.3]
  - - [4096, 2560, 1, 4096, 4096, 4096, 4096, 2560]
    - [24, 34272.7]
  - - [2560, 3072, 1, 4096, 2560, 2560, 2560, 3072]
    - [36, 34549.4]
  - - [3072, 3072, 1, 4096, 3072, 3072, 3072, 3072]
    - [36, 34589.0]
  - - [3584, 3072, 1, 4096, 3584, 3584, 3584, 3072]
    - [36, 34869.6]
  - - [4096, 3072, 1, 4096, 4096, 4096, 4096, 3072]
    - [36, 34828.0]
  - - [2560, 3584, 1, 4096, 2560, 2560, 2560, 3584]
    - [24, 34467.9]
  - - [3072, 3584, 1, 4096, 3072, 3072, 3072, 3584]
    - [24, 34580.2]
  - - [3584, 3584, 1, 4096, 3584, 3584, 3584, 3584]
    - [24, 34619.7]
  - - [4096, 3584, 1, 4096, 4096, 4096, 4096, 3584]
    - [24, 34397.9]
  - - [2560, 4096, 1, 4096, 2560, 2560, 2560, 4096]
    - [36, 31968.1]
  - - [3072, 4096, 1, 4096, 3072, 3072, 3072, 4096]
    - [36, 31815.0]
  - - [3584, 4096, 1, 4096, 3584, 3584, 3584, 4096]
    - [36, 31190.4]
  - - [4096, 4096, 1, 4096, 4096, 4096, 4096, 4096]
    - [36, 28933.1]
  - - [1, 1, 1, 1, 1, 1, 1, 1]
    - [50, 6.57484e-05]
  - - [1, 1, 1, 64, 1, 1, 1, 1]
    - [45, 0.00434945]
  - - [1, 64, 1, 1, 1, 1, 1, 64]
    - [12, 0.00421469]
  - - [64, 1, 1, 1, 64, 64, 64, 1]
    - [12, 0.00409875]
  - - [64, 64, 1, 1, 64, 64, 64, 64]
    - [12, 0.275556]
  - - [64, 1, 1, 64, 64, 64, 64, 1]
    - [40, 0.259824]
  - - [1, 64, 1, 64, 1, 1, 1, 64]
    - [2, 0.253316]
- null
- null
- DeviceEfficiency
- GridBased
