library/src/amd_detail/rocblaslt/src/Tensile/Logic/asm_full/navi32/GridBased/navi32_Cijk_Ailk_Bljk_HSS_BH_Bias_HAH.yaml
- {MinimumRequiredVersion: 4.33.0}
- navi32
- gfx1101
- [Device 73f0]
    SolutionIndex: 0
    SolutionNameMin: Cijk_Ailk_Bljk_HSS_BH_Bias_HAH_MT32x32x64_MI16x16x16x1_SN_MIWT1_1_WG32_4_1
    SolutionIndex: 1
    SolutionNameMin: Cijk_Ailk_Bljk_HSS_BH_Bias_HAH_MT16x16x64_MI16x16x16x1_SN_MIWT1_1_WG16_2_1
    SolutionIndex: 2
    SolutionNameMin: Cijk_Ailk_Bljk_HSS_BH_Bias_HAH_MT32x16x64_MI16x16x16x1_SN_MIWT1_1_WG32_2_1
    SolutionIndex: 3
    SolutionNameMin: Cijk_Ailk_Bljk_HSS_BH_Bias_HAH_MT16x32x64_MI16x16x16x1_SN_MIWT1_1_WG16_4_1
- - - [64, 64, 1, 64, 64, 64, 64, 64]
    - [2, 0.153]
  - - [192, 64, 1, 64, 192, 192, 192, 64]
    - [2, 0.454]
  - - [320, 64, 1, 64, 320, 320, 320, 64]
    - [2, 0.731]
  - - [448, 64, 1, 64, 448, 448, 448, 64]
    - [0, 1.015]
  - - [576, 64, 1, 64, 576, 576, 576, 64]
    - [2, 1.227]
  - - [704, 64, 1, 64, 704, 704, 704, 64]
    - [2, 1.493]
  - - [832, 64, 1, 64, 832, 832, 832, 64]
    - [0, 1.737]
  - - [960, 64, 1, 64, 960, 960, 960, 64]
    - [0, 1.999]
  - - [1088, 64, 1, 64, 1088, 1088, 1088, 64]
    - [2, 2.108]
  - - [1216, 64, 1, 64, 1216, 1216, 1216, 64]
    - [0, 2.324]
  - - [1344, 64, 1, 64, 1344, 1344, 1344, 64]
    - [0, 2.571]
  - - [1472, 64, 1, 64, 1472, 1472, 1472, 64]
    - [2, 2.653]
  - - [1600, 64, 1, 64, 1600, 1600, 1600, 64]
    - [2, 2.864]
  - - [1728, 64, 1, 64, 1728, 1728, 1728, 64]
    - [0, 3.058]
  - - [1856, 64, 1, 64, 1856, 1856, 1856, 64]
    - [0, 3.279]
  - - [1984, 64, 1, 64, 1984, 1984, 1984, 64]
    - [0, 3.338]
  - - [2112, 64, 1, 64, 2112, 2112, 2112, 64]
    - [0, 3.537]
  - - [2240, 64, 1, 64, 2240, 2240, 2240, 64]
    - [0, 3.741]
  - - [2368, 64, 1, 64, 2368, 2368, 2368, 64]
    - [0, 3.959]
  - - [2496, 64, 1, 64, 2496, 2496, 2496, 64]
    - [0, 3.989]
  - - [2624, 64, 1, 64, 2624, 2624, 2624, 64]
    - [0, 4.145]
  - - [2752, 64, 1, 64, 2752, 2752, 2752, 64]
    - [0, 4.355]
  - - [2880, 64, 1, 64, 2880, 2880, 2880, 64]
    - [0, 4.554]
  - - [3008, 64, 1, 64, 3008, 3008, 3008, 64]
    - [0, 4.524]
  - - [3136, 64, 1, 64, 3136, 3136, 3136, 64]
    - [0, 4.688]
  - - [3264, 64, 1, 64, 3264, 3264, 3264, 64]
    - [0, 4.871]
  - - [3392, 64, 1, 64, 3392, 3392, 3392, 64]
    - [0, 4.88]
  - - [3520, 64, 1, 64, 3520, 3520, 3520, 64]
    - [0, 5.01]
  - - [3648, 64, 1, 64, 3648, 3648, 3648, 64]
    - [0, 5.185]
  - - [3776, 64, 1, 64, 3776, 3776, 3776, 64]
    - [0, 5.379]
  - - [3904, 64, 1, 64, 3904, 3904, 3904, 64]
    - [0, 5.332]
  - - [4032, 64, 1, 64, 4032, 4032, 4032, 64]
    - [0, 5.444]
  - - [64, 192, 1, 64, 64, 64, 64, 64]
    - [2, 0.458]
  - - [192, 192, 1, 64, 192, 192, 192, 64]
    - [2, 1.238]
  - - [320, 192, 1, 64, 320, 320, 320, 64]
    - [0, 2.011]
  - - [448, 192, 1, 64, 448, 448, 448, 64]
    - [0, 2.587]
  - - [576, 192, 1, 64, 576, 576, 576, 64]
    - [0, 3.081]
  - - [704, 192, 1, 64, 704, 704, 704, 64]
    - [0, 3.556]
  - - [832, 192, 1, 64, 832, 832, 832, 64]
    - [0, 3.988]
  - - [960, 192, 1, 64, 960, 960, 960, 64]
    - [0, 4.56]
  - - [1088, 192, 1, 64, 1088, 1088, 1088, 64]
    - [0, 4.894]
  - - [1216, 192, 1, 64, 1216, 1216, 1216, 64]
    - [0, 5.149]
  - - [1344, 192, 1, 64, 1344, 1344, 1344, 64]
    - [0, 5.502]
  - - [1472, 192, 1, 64, 1472, 1472, 1472, 64]
    - [0, 5.683]
  - - [1600, 192, 1, 64, 1600, 1600, 1600, 64]
    - [0, 5.945]
  - - [1728, 192, 1, 64, 1728, 1728, 1728, 64]
    - [0, 6.186]
  - - [1856, 192, 1, 64, 1856, 1856, 1856, 64]
    - [0, 6.419]
  - - [1984, 192, 1, 64, 1984, 1984, 1984, 64]
    - [0, 6.508]
  - - [2112, 192, 1, 64, 2112, 2112, 2112, 64]
    - [0, 6.776]
  - - [2240, 192, 1, 64, 2240, 2240, 2240, 64]
    - [0, 6.866]
  - - [2368, 192, 1, 64, 2368, 2368, 2368, 64]
    - [0, 6.927]
  - - [2496, 192, 1, 64, 2496, 2496, 2496, 64]
    - [0, 7.182]
  - - [2624, 192, 1, 64, 2624, 2624, 2624, 64]
    - [0, 7.337]
  - - [2752, 192, 1, 64, 2752, 2752, 2752, 64]
    - [0, 7.523]
  - - [2880, 192, 1, 64, 2880, 2880, 2880, 64]
    - [0, 7.725]
  - - [3008, 192, 1, 64, 3008, 3008, 3008, 64]
    - [0, 7.836]
  - - [3136, 192, 1, 64, 3136, 3136, 3136, 64]
    - [0, 8.125]
  - - [3264, 192, 1, 64, 3264, 3264, 3264, 64]
    - [0, 8.112]
  - - [3392, 192, 1, 64, 3392, 3392, 3392, 64]
    - [0, 8.204]
  - - [3520, 192, 1, 64, 3520, 3520, 3520, 64]
    - [0, 8.334]
  - - [3648, 192, 1, 64, 3648, 3648, 3648, 64]
    - [0, 8.458]
  - - [3776, 192, 1, 64, 3776, 3776, 3776, 64]
    - [0, 8.486]
  - - [3904, 192, 1, 64, 3904, 3904, 3904, 64]
    - [0, 8.656]
  - - [4032, 192, 1, 64, 4032, 4032, 4032, 64]
    - [0, 8.683]
  - - [64, 320, 1, 64, 64, 64, 64, 64]
    - [0, 0.739]
  - - [192, 320, 1, 64, 192, 192, 192, 64]
    - [0, 2.022]
  - - [320, 320, 1, 64, 320, 320, 320, 64]
    - [0, 2.882]
  - - [448, 320, 1, 64, 448, 448, 448, 64]
    - [0, 3.77]
  - - [576, 320, 1, 64, 576, 576, 576, 64]
    - [0, 4.53]
  - - [704, 320, 1, 64, 704, 704, 704, 64]
    - [0, 4.976]
  - - [832, 320, 1, 64, 832, 832, 832, 64]
    - [0, 5.411]
  - - [960, 320, 1, 64, 960, 960, 960, 64]
    - [0, 5.912]
  - - [1088, 320, 1, 64, 1088, 1088, 1088, 64]
    - [0, 6.354]
  - - [1216, 320, 1, 64, 1216, 1216, 1216, 64]
    - [0, 6.733]
  - - [1344, 320, 1, 64, 1344, 1344, 1344, 64]
    - [0, 6.854]
  - - [1472, 320, 1, 64, 1472, 1472, 1472, 64]
    - [0, 7.085]
  - - [1600, 320, 1, 64, 1600, 1600, 1600, 64]
    - [0, 7.542]
  - - [1728, 320, 1, 64, 1728, 1728, 1728, 64]
    - [0, 7.758]
  - - [1856, 320, 1, 64, 1856, 1856, 1856, 64]
    - [0, 7.96]
  - - [1984, 320, 1, 64, 1984, 1984, 1984, 64]
    - [0, 8.164]
  - - [2112, 320, 1, 64, 2112, 2112, 2112, 64]
    - [0, 8.331]
  - - [2240, 320, 1, 64, 2240, 2240, 2240, 64]
    - [0, 8.436]
  - - [2368, 320, 1, 64, 2368, 2368, 2368, 64]
    - [0, 8.595]
  - - [2496, 320, 1, 64, 2496, 2496, 2496, 64]
    - [0, 8.722]
  - - [2624, 320, 1, 64, 2624, 2624, 2624, 64]
    - [0, 8.893]
  - - [2752, 320, 1, 64, 2752, 2752, 2752, 64]
    - [0, 9.095]
  - - [2880, 320, 1, 64, 2880, 2880, 2880, 64]
    - [0, 9.189]
  - - [3008, 320, 1, 64, 3008, 3008, 3008, 64]
    - [0, 9.3]
  - - [3136, 320, 1, 64, 3136, 3136, 3136, 64]
    - [0, 9.374]
  - - [3264, 320, 1, 64, 3264, 3264, 3264, 64]
    - [0, 9.551]
  - - [3392, 320, 1, 64, 3392, 3392, 3392, 64]
    - [0, 9.603]
  - - [3520, 320, 1, 64, 3520, 3520, 3520, 64]
    - [0, 9.653]
  - - [3648, 320, 1, 64, 3648, 3648, 3648, 64]
    - [0, 9.817]
  - - [3776, 320, 1, 64, 3776, 3776, 3776, 64]
    - [0, 9.891]
  - - [3904, 320, 1, 64, 3904, 3904, 3904, 64]
    - [0, 9.89]
  - - [4032, 320, 1, 64, 4032, 4032, 4032, 64]
    - [0, 10.061]
  - - [64, 448, 1, 64, 64, 64, 64, 64]
    - [0, 1.032]
  - - [192, 448, 1, 64, 192, 192, 192, 64]
    - [0, 2.584]
  - - [320, 448, 1, 64, 320, 320, 320, 64]
    - [0, 3.755]
  - - [448, 448, 1, 64, 448, 448, 448, 64]
    - [0, 4.678]
  - - [576, 448, 1, 64, 576, 576, 576, 64]
    - [0, 5.484]
  - - [704, 448, 1, 64, 704, 704, 704, 64]
    - [0, 6.029]
  - - [832, 448, 1, 64, 832, 832, 832, 64]
    - [0, 6.514]
  - - [960, 448, 1, 64, 960, 960, 960, 64]
    - [0, 6.872]
  - - [1088, 448, 1, 64, 1088, 1088, 1088, 64]
    - [0, 7.357]
  - - [1216, 448, 1, 64, 1216, 1216, 1216, 64]
    - [0, 7.737]
  - - [1344, 448, 1, 64, 1344, 1344, 1344, 64]
    - [0, 8.038]
  - - [1472, 448, 1, 64, 1472, 1472, 1472, 64]
    - [0, 8.261]
  - - [1600, 448, 1, 64, 1600, 1600, 1600, 64]
    - [0, 8.533]
  - - [1728, 448, 1, 64, 1728, 1728, 1728, 64]
    - [0, 8.696]
  - - [1856, 448, 1, 64, 1856, 1856, 1856, 64]
    - [0, 8.895]
  - - [1984, 448, 1, 64, 1984, 1984, 1984, 64]
    - [0, 9.041]
  - - [2112, 448, 1, 64, 2112, 2112, 2112, 64]
    - [0, 9.307]
  - - [2240, 448, 1, 64, 2240, 2240, 2240, 64]
    - [0, 9.503]
  - - [2368, 448, 1, 64, 2368, 2368, 2368, 64]
    - [0, 9.53]
  - - [2496, 448, 1, 64, 2496, 2496, 2496, 64]
    - [0, 9.664]
  - - [2624, 448, 1, 64, 2624, 2624, 2624, 64]
    - [0, 9.753]
  - - [2752, 448, 1, 64, 2752, 2752, 2752, 64]
    - [0, 9.886]
  - - [2880, 448, 1, 64, 2880, 2880, 2880, 64]
    - [0, 10.05]
  - - [3008, 448, 1, 64, 3008, 3008, 3008, 64]
    - [0, 10.16]
  - - [3136, 448, 1, 64, 3136, 3136, 3136, 64]
    - [0, 10.265]
  - - [3264, 448, 1, 64, 3264, 3264, 3264, 64]
    - [0, 10.298]
  - - [3392, 448, 1, 64, 3392, 3392, 3392, 64]
    - [0, 10.357]
  - - [3520, 448, 1, 64, 3520, 3520, 3520, 64]
    - [0, 10.479]
  - - [3648, 448, 1, 64, 3648, 3648, 3648, 64]
    - [0, 10.491]
  - - [3776, 448, 1, 64, 3776, 3776, 3776, 64]
    - [0, 10.606]
  - - [3904, 448, 1, 64, 3904, 3904, 3904, 64]
    - [0, 10.671]
  - - [4032, 448, 1, 64, 4032, 4032, 4032, 64]
    - [0, 10.766]
  - - [64, 576, 1, 64, 64, 64, 64, 64]
    - [2, 1.241]
  - - [192, 576, 1, 64, 192, 192, 192, 64]
    - [0, 3.089]
  - - [320, 576, 1, 64, 320, 320, 320, 64]
    - [0, 4.521]
  - - [448, 576, 1, 64, 448, 448, 448, 64]
    - [0, 5.449]
  - - [576, 576, 1, 64, 576, 576, 576, 64]
    - [0, 6.221]
  - - [704, 576, 1, 64, 704, 704, 704, 64]
    - [0, 6.729]
  - - [832, 576, 1, 64, 832, 832, 832, 64]
    - [0, 7.278]
  - - [960, 576, 1, 64, 960, 960, 960, 64]
    - [0, 7.789]
  - - [1088, 576, 1, 64, 1088, 1088, 1088, 64]
    - [0, 8.079]
  - - [1216, 576, 1, 64, 1216, 1216, 1216, 64]
    - [0, 8.463]
  - - [1344, 576, 1, 64, 1344, 1344, 1344, 64]
    - [0, 8.672]
  - - [1472, 576, 1, 64, 1472, 1472, 1472, 64]
    - [0, 8.952]
  - - [1600, 576, 1, 64, 1600, 1600, 1600, 64]
    - [0, 9.243]
  - - [1728, 576, 1, 64, 1728, 1728, 1728, 64]
    - [0, 9.425]
  - - [1856, 576, 1, 64, 1856, 1856, 1856, 64]
    - [0, 9.591]
  - - [1984, 576, 1, 64, 1984, 1984, 1984, 64]
    - [0, 9.697]
  - - [2112, 576, 1, 64, 2112, 2112, 2112, 64]
    - [0, 9.865]
  - - [2240, 576, 1, 64, 2240, 2240, 2240, 64]
    - [0, 10.051]
  - - [2368, 576, 1, 64, 2368, 2368, 2368, 64]
    - [0, 10.139]
  - - [2496, 576, 1, 64, 2496, 2496, 2496, 64]
    - [0, 10.269]
  - - [2624, 576, 1, 64, 2624, 2624, 2624, 64]
    - [0, 10.369]
  - - [2752, 576, 1, 64, 2752, 2752, 2752, 64]
    - [0, 10.504]
  - - [2880, 576, 1, 64, 2880, 2880, 2880, 64]
    - [0, 10.64]
  - - [3008, 576, 1, 64, 3008, 3008, 3008, 64]
    - [0, 10.748]
  - - [3136, 576, 1, 64, 3136, 3136, 3136, 64]
    - [0, 10.829]
  - - [3264, 576, 1, 64, 3264, 3264, 3264, 64]
    - [0, 10.822]
  - - [3392, 576, 1, 64, 3392, 3392, 3392, 64]
    - [0, 10.901]
  - - [3520, 576, 1, 64, 3520, 3520, 3520, 64]
    - [0, 10.932]
  - - [3648, 576, 1, 64, 3648, 3648, 3648, 64]
    - [0, 10.971]
  - - [3776, 576, 1, 64, 3776, 3776, 3776, 64]
    - [0, 10.926]
  - - [3904, 576, 1, 64, 3904, 3904, 3904, 64]
    - [0, 11.129]
  - - [4032, 576, 1, 64, 4032, 4032, 4032, 64]
    - [0, 11.157]
  - - [64, 704, 1, 64, 64, 64, 64, 64]
    - [2, 1.514]
  - - [192, 704, 1, 64, 192, 192, 192, 64]
    - [0, 3.545]
  - - [320, 704, 1, 64, 320, 320, 320, 64]
    - [0, 5.031]
  - - [448, 704, 1, 64, 448, 448, 448, 64]
    - [0, 6.032]
  - - [576, 704, 1, 64, 576, 576, 576, 64]
    - [0, 6.793]
  - - [704, 704, 1, 64, 704, 704, 704, 64]
    - [0, 7.371]
  - - [832, 704, 1, 64, 832, 832, 832, 64]
    - [0, 7.898]
  - - [960, 704, 1, 64, 960, 960, 960, 64]
    - [0, 8.372]
  - - [1088, 704, 1, 64, 1088, 1088, 1088, 64]
    - [0, 8.595]
  - - [1216, 704, 1, 64, 1216, 1216, 1216, 64]
    - [0, 9.03]
  - - [1344, 704, 1, 64, 1344, 1344, 1344, 64]
    - [0, 9.268]
  - - [1472, 704, 1, 64, 1472, 1472, 1472, 64]
    - [0, 9.542]
  - - [1600, 704, 1, 64, 1600, 1600, 1600, 64]
    - [0, 9.749]
  - - [1728, 704, 1, 64, 1728, 1728, 1728, 64]
    - [0, 9.845]
  - - [1856, 704, 1, 64, 1856, 1856, 1856, 64]
    - [0, 10.124]
  - - [1984, 704, 1, 64, 1984, 1984, 1984, 64]
    - [0, 10.132]
  - - [2112, 704, 1, 64, 2112, 2112, 2112, 64]
    - [0, 10.312]
  - - [2240, 704, 1, 64, 2240, 2240, 2240, 64]
    - [0, 10.495]
  - - [2368, 704, 1, 64, 2368, 2368, 2368, 64]
    - [0, 10.506]
  - - [2496, 704, 1, 64, 2496, 2496, 2496, 64]
    - [0, 10.661]
  - - [2624, 704, 1, 64, 2624, 2624, 2624, 64]
    - [0, 10.789]
  - - [2752, 704, 1, 64, 2752, 2752, 2752, 64]
    - [0, 10.825]
  - - [2880, 704, 1, 64, 2880, 2880, 2880, 64]
    - [0, 10.935]
  - - [3008, 704, 1, 64, 3008, 3008, 3008, 64]
    - [0, 10.919]
  - - [3136, 704, 1, 64, 3136, 3136, 3136, 64]
    - [0, 11.155]
  - - [3264, 704, 1, 64, 3264, 3264, 3264, 64]
    - [0, 11.245]
  - - [3392, 704, 1, 64, 3392, 3392, 3392, 64]
    - [0, 11.221]
  - - [3520, 704, 1, 64, 3520, 3520, 3520, 64]
    - [0, 11.24]
  - - [3648, 704, 1, 64, 3648, 3648, 3648, 64]
    - [0, 11.291]
  - - [3776, 704, 1, 64, 3776, 3776, 3776, 64]
    - [0, 11.39]
  - - [3904, 704, 1, 64, 3904, 3904, 3904, 64]
    - [0, 11.396]
  - - [4032, 704, 1, 64, 4032, 4032, 4032, 64]
    - [0, 11.462]
  - - [64, 832, 1, 64, 64, 64, 64, 64]
    - [1, 0.982]
  - - [192, 832, 1, 64, 192, 192, 192, 64]
    - [0, 2.942]
  - - [320, 832, 1, 64, 320, 320, 320, 64]
    - [2, 4.986]
  - - [448, 832, 1, 64, 448, 448, 448, 64]
    - [0, 6.54]
  - - [576, 832, 1, 64, 576, 576, 576, 64]
    - [0, 7.261]
  - - [704, 832, 1, 64, 704, 704, 704, 64]
    - [0, 7.935]
  - - [832, 832, 1, 64, 832, 832, 832, 64]
    - [0, 8.42]
  - - [960, 832, 1, 64, 960, 960, 960, 64]
    - [0, 8.783]
  - - [1088, 832, 1, 64, 1088, 1088, 1088, 64]
    - [0, 9.189]
  - - [1216, 832, 1, 64, 1216, 1216, 1216, 64]
    - [0, 9.401]
  - - [1344, 832, 1, 64, 1344, 1344, 1344, 64]
    - [0, 9.709]
  - - [1472, 832, 1, 64, 1472, 1472, 1472, 64]
    - [0, 9.94]
  - - [1600, 832, 1, 64, 1600, 1600, 1600, 64]
    - [0, 10.159]
  - - [1728, 832, 1, 64, 1728, 1728, 1728, 64]
    - [0, 10.271]
  - - [1856, 832, 1, 64, 1856, 1856, 1856, 64]
    - [0, 10.407]
  - - [1984, 832, 1, 64, 1984, 1984, 1984, 64]
    - [0, 10.563]
  - - [2112, 832, 1, 64, 2112, 2112, 2112, 64]
    - [0, 10.669]
  - - [2240, 832, 1, 64, 2240, 2240, 2240, 64]
    - [0, 10.759]
  - - [2368, 832, 1, 64, 2368, 2368, 2368, 64]
    - [0, 10.89]
  - - [2496, 832, 1, 64, 2496, 2496, 2496, 64]
    - [0, 10.994]
  - - [2624, 832, 1, 64, 2624, 2624, 2624, 64]
    - [0, 11.132]
  - - [2752, 832, 1, 64, 2752, 2752, 2752, 64]
    - [0, 11.145]
  - - [2880, 832, 1, 64, 2880, 2880, 2880, 64]
    - [0, 11.222]
  - - [3008, 832, 1, 64, 3008, 3008, 3008, 64]
    - [0, 11.299]
  - - [3136, 832, 1, 64, 3136, 3136, 3136, 64]
    - [0, 11.342]
  - - [3264, 832, 1, 64, 3264, 3264, 3264, 64]
    - [0, 11.388]
  - - [3392, 832, 1, 64, 3392, 3392, 3392, 64]
    - [0, 11.457]
  - - [3520, 832, 1, 64, 3520, 3520, 3520, 64]
    - [0, 11.46]
  - - [3648, 832, 1, 64, 3648, 3648, 3648, 64]
    - [0, 11.547]
  - - [3776, 832, 1, 64, 3776, 3776, 3776, 64]
    - [0, 11.59]
  - - [3904, 832, 1, 64, 3904, 3904, 3904, 64]
    - [0, 11.607]
  - - [4032, 832, 1, 64, 4032, 4032, 4032, 64]
    - [0, 11.69]
  - - [64, 960, 1, 64, 64, 64, 64, 64]
    - [0, 2.015]
  - - [192, 960, 1, 64, 192, 192, 192, 64]
    - [0, 4.521]
  - - [320, 960, 1, 64, 320, 320, 320, 64]
    - [0, 5.882]
  - - [448, 960, 1, 64, 448, 448, 448, 64]
    - [0, 6.899]
  - - [576, 960, 1, 64, 576, 576, 576, 64]
    - [0, 7.794]
  - - [704, 960, 1, 64, 704, 704, 704, 64]
    - [0, 8.35]
  - - [832, 960, 1, 64, 832, 832, 832, 64]
    - [0, 8.714]
  - - [960, 960, 1, 64, 960, 960, 960, 64]
    - [0, 9.203]
  - - [1088, 960, 1, 64, 1088, 1088, 1088, 64]
    - [0, 9.568]
  - - [1216, 960, 1, 64, 1216, 1216, 1216, 64]
    - [0, 9.765]
  - - [1344, 960, 1, 64, 1344, 1344, 1344, 64]
    - [0, 10.0]
  - - [1472, 960, 1, 64, 1472, 1472, 1472, 64]
    - [0, 10.266]
  - - [1600, 960, 1, 64, 1600, 1600, 1600, 64]
    - [0, 10.438]
  - - [1728, 960, 1, 64, 1728, 1728, 1728, 64]
    - [0, 10.55]
  - - [1856, 960, 1, 64, 1856, 1856, 1856, 64]
    - [0, 10.674]
  - - [1984, 960, 1, 64, 1984, 1984, 1984, 64]
    - [0, 10.86]
  - - [2112, 960, 1, 64, 2112, 2112, 2112, 64]
    - [0, 10.963]
  - - [2240, 960, 1, 64, 2240, 2240, 2240, 64]
    - [0, 10.997]
  - - [2368, 960, 1, 64, 2368, 2368, 2368, 64]
    - [0, 11.102]
  - - [2496, 960, 1, 64, 2496, 2496, 2496, 64]
    - [0, 11.23]
  - - [2624, 960, 1, 64, 2624, 2624, 2624, 64]
    - [0, 11.31]
  - - [2752, 960, 1, 64, 2752, 2752, 2752, 64]
    - [0, 11.343]
  - - [2880, 960, 1, 64, 2880, 2880, 2880, 64]
    - [0, 11.478]
  - - [3008, 960, 1, 64, 3008, 3008, 3008, 64]
    - [0, 11.421]
  - - [3136, 960, 1, 64, 3136, 3136, 3136, 64]
    - [0, 11.466]
  - - [3264, 960, 1, 64, 3264, 3264, 3264, 64]
    - [0, 11.58]
  - - [3392, 960, 1, 64, 3392, 3392, 3392, 64]
    - [0, 11.591]
  - - [3520, 960, 1, 64, 3520, 3520, 3520, 64]
    - [0, 11.712]
  - - [3648, 960, 1, 64, 3648, 3648, 3648, 64]
    - [0, 11.753]
  - - [3776, 960, 1, 64, 3776, 3776, 3776, 64]
    - [0, 11.713]
  - - [3904, 960, 1, 64, 3904, 3904, 3904, 64]
    - [0, 11.855]
  - - [4032, 960, 1, 64, 4032, 4032, 4032, 64]
    - [0, 11.878]
  - - [64, 1088, 1, 64, 64, 64, 64, 64]
    - [2, 2.115]
  - - [192, 1088, 1, 64, 192, 192, 192, 64]
    - [0, 4.859]
  - - [320, 1088, 1, 64, 320, 320, 320, 64]
    - [0, 6.376]
  - - [448, 1088, 1, 64, 448, 448, 448, 64]
    - [0, 7.345]
  - - [576, 1088, 1, 64, 576, 576, 576, 64]
    - [0, 8.081]
  - - [704, 1088, 1, 64, 704, 704, 704, 64]
    - [0, 8.73]
  - - [832, 1088, 1, 64, 832, 832, 832, 64]
    - [0, 9.12]
  - - [960, 1088, 1, 64, 960, 960, 960, 64]
    - [0, 9.505]
  - - [1088, 1088, 1, 64, 1088, 1088, 1088, 64]
    - [0, 9.836]
  - - [1216, 1088, 1, 64, 1216, 1216, 1216, 64]
    - [0, 10.138]
  - - [1344, 1088, 1, 64, 1344, 1344, 1344, 64]
    - [0, 10.31]
  - - [1472, 1088, 1, 64, 1472, 1472, 1472, 64]
    - [0, 10.494]
  - - [1600, 1088, 1, 64, 1600, 1600, 1600, 64]
    - [0, 10.667]
  - - [1728, 1088, 1, 64, 1728, 1728, 1728, 64]
    - [0, 10.779]
  - - [1856, 1088, 1, 64, 1856, 1856, 1856, 64]
    - [0, 10.898]
  - - [1984, 1088, 1, 64, 1984, 1984, 1984, 64]
    - [0, 11.02]
  - - [2112, 1088, 1, 64, 2112, 2112, 2112, 64]
    - [0, 11.239]
  - - [2240, 1088, 1, 64, 2240, 2240, 2240, 64]
    - [0, 11.161]
  - - [2368, 1088, 1, 64, 2368, 2368, 2368, 64]
    - [0, 11.276]
  - - [2496, 1088, 1, 64, 2496, 2496, 2496, 64]
    - [0, 11.337]
  - - [2624, 1088, 1, 64, 2624, 2624, 2624, 64]
    - [0, 11.415]
  - - [2752, 1088, 1, 64, 2752, 2752, 2752, 64]
    - [0, 11.559]
  - - [2880, 1088, 1, 64, 2880, 2880, 2880, 64]
    - [0, 11.616]
  - - [3008, 1088, 1, 64, 3008, 3008, 3008, 64]
    - [0, 11.643]
  - - [3136, 1088, 1, 64, 3136, 3136, 3136, 64]
    - [0, 11.734]
  - - [3264, 1088, 1, 64, 3264, 3264, 3264, 64]
    - [0, 11.707]
  - - [3392, 1088, 1, 64, 3392, 3392, 3392, 64]
    - [0, 11.768]
  - - [3520, 1088, 1, 64, 3520, 3520, 3520, 64]
    - [0, 11.79]
  - - [3648, 1088, 1, 64, 3648, 3648, 3648, 64]
    - [0, 11.851]
  - - [3776, 1088, 1, 64, 3776, 3776, 3776, 64]
    - [0, 11.812]
  - - [3904, 1088, 1, 64, 3904, 3904, 3904, 64]
    - [0, 11.972]
  - - [4032, 1088, 1, 64, 4032, 4032, 4032, 64]
    - [0, 11.029]
  - - [64, 1216, 1, 64, 64, 64, 64, 64]
    - [0, 2.352]
  - - [192, 1216, 1, 64, 192, 192, 192, 64]
    - [0, 5.155]
  - - [320, 1216, 1, 64, 320, 320, 320, 64]
    - [0, 6.747]
  - - [448, 1216, 1, 64, 448, 448, 448, 64]
    - [0, 7.71]
  - - [576, 1216, 1, 64, 576, 576, 576, 64]
    - [0, 8.436]
  - - [704, 1216, 1, 64, 704, 704, 704, 64]
    - [0, 8.969]
  - - [832, 1216, 1, 64, 832, 832, 832, 64]
    - [0, 9.468]
  - - [960, 1216, 1, 64, 960, 960, 960, 64]
    - [0, 9.802]
  - - [1088, 1216, 1, 64, 1088, 1088, 1088, 64]
    - [0, 10.062]
  - - [1216, 1216, 1, 64, 1216, 1216, 1216, 64]
    - [0, 10.422]
  - - [1344, 1216, 1, 64, 1344, 1344, 1344, 64]
    - [0, 10.553]
  - - [1472, 1216, 1, 64, 1472, 1472, 1472, 64]
    - [0, 10.715]
  - - [1600, 1216, 1, 64, 1600, 1600, 1600, 64]
    - [0, 10.892]
  - - [1728, 1216, 1, 64, 1728, 1728, 1728, 64]
    - [0, 11.036]
  - - [1856, 1216, 1, 64, 1856, 1856, 1856, 64]
    - [0, 11.074]
  - - [1984, 1216, 1, 64, 1984, 1984, 1984, 64]
    - [0, 11.213]
  - - [2112, 1216, 1, 64, 2112, 2112, 2112, 64]
    - [0, 11.34]
  - - [2240, 1216, 1, 64, 2240, 2240, 2240, 64]
    - [0, 11.326]
  - - [2368, 1216, 1, 64, 2368, 2368, 2368, 64]
    - [0, 11.474]
  - - [2496, 1216, 1, 64, 2496, 2496, 2496, 64]
    - [0, 11.492]
  - - [2624, 1216, 1, 64, 2624, 2624, 2624, 64]
    - [0, 11.655]
  - - [2752, 1216, 1, 64, 2752, 2752, 2752, 64]
    - [0, 11.684]
  - - [2880, 1216, 1, 64, 2880, 2880, 2880, 64]
    - [0, 11.707]
  - - [3008, 1216, 1, 64, 3008, 3008, 3008, 64]
    - [0, 11.785]
  - - [3136, 1216, 1, 64, 3136, 3136, 3136, 64]
    - [0, 11.825]
  - - [3264, 1216, 1, 64, 3264, 3264, 3264, 64]
    - [0, 11.809]
  - - [3392, 1216, 1, 64, 3392, 3392, 3392, 64]
    - [0, 11.861]
  - - [3520, 1216, 1, 64, 3520, 3520, 3520, 64]
    - [0, 10.83]
  - - [3648, 1216, 1, 64, 3648, 3648, 3648, 64]
    - [0, 11.147]
  - - [3776, 1216, 1, 64, 3776, 3776, 3776, 64]
    - [0, 11.453]
  - - [3904, 1216, 1, 64, 3904, 3904, 3904, 64]
    - [0, 11.488]
  - - [4032, 1216, 1, 64, 4032, 4032, 4032, 64]
    - [0, 11.529]
  - - [64, 1344, 1, 64, 64, 64, 64, 64]
    - [0, 2.608]
  - - [192, 1344, 1, 64, 192, 192, 192, 64]
    - [0, 5.427]
  - - [320, 1344, 1, 64, 320, 320, 320, 64]
    - [0, 6.857]
  - - [448, 1344, 1, 64, 448, 448, 448, 64]
    - [0, 8.037]
  - - [576, 1344, 1, 64, 576, 576, 576, 64]
    - [0, 8.73]
  - - [704, 1344, 1, 64, 704, 704, 704, 64]
    - [0, 9.322]
  - - [832, 1344, 1, 64, 832, 832, 832, 64]
    - [0, 9.713]
  - - [960, 1344, 1, 64, 960, 960, 960, 64]
    - [0, 10.055]
  - - [1088, 1344, 1, 64, 1088, 1088, 1088, 64]
    - [0, 10.326]
  - - [1216, 1344, 1, 64, 1216, 1216, 1216, 64]
    - [0, 10.602]
  - - [1344, 1344, 1, 64, 1344, 1344, 1344, 64]
    - [0, 10.742]
  - - [1472, 1344, 1, 64, 1472, 1472, 1472, 64]
    - [0, 10.839]
  - - [1600, 1344, 1, 64, 1600, 1600, 1600, 64]
    - [0, 11.073]
  - - [1728, 1344, 1, 64, 1728, 1728, 1728, 64]
    - [0, 11.268]
  - - [1856, 1344, 1, 64, 1856, 1856, 1856, 64]
    - [0, 11.206]
  - - [1984, 1344, 1, 64, 1984, 1984, 1984, 64]
    - [0, 11.352]
  - - [2112, 1344, 1, 64, 2112, 2112, 2112, 64]
    - [0, 11.493]
  - - [2240, 1344, 1, 64, 2240, 2240, 2240, 64]
    - [0, 11.54]
  - - [2368, 1344, 1, 64, 2368, 2368, 2368, 64]
    - [0, 11.613]
  - - [2496, 1344, 1, 64, 2496, 2496, 2496, 64]
    - [0, 11.715]
  - - [2624, 1344, 1, 64, 2624, 2624, 2624, 64]
    - [0, 11.7]
  - - [2752, 1344, 1, 64, 2752, 2752, 2752, 64]
    - [0, 11.82]
  - - [2880, 1344, 1, 64, 2880, 2880, 2880, 64]
    - [0, 11.827]
  - - [3008, 1344, 1, 64, 3008, 3008, 3008, 64]
    - [0, 11.839]
  - - [3136, 1344, 1, 64, 3136, 3136, 3136, 64]
    - [0, 11.986]
  - - [3264, 1344, 1, 64, 3264, 3264, 3264, 64]
    - [0, 11.027]
  - - [3392, 1344, 1, 64, 3392, 3392, 3392, 64]
    - [0, 11.444]
  - - [3520, 1344, 1, 64, 3520, 3520, 3520, 64]
    - [0, 11.536]
  - - [3648, 1344, 1, 64, 3648, 3648, 3648, 64]
    - [0, 11.483]
  - - [3776, 1344, 1, 64, 3776, 3776, 3776, 64]
    - [0, 11.502]
  - - [3904, 1344, 1, 64, 3904, 3904, 3904, 64]
    - [0, 11.669]
  - - [4032, 1344, 1, 64, 4032, 4032, 4032, 64]
    - [0, 11.639]
  - - [64, 1472, 1, 64, 64, 64, 64, 64]
    - [0, 2.682]
  - - [192, 1472, 1, 64, 192, 192, 192, 64]
    - [0, 5.709]
  - - [320, 1472, 1, 64, 320, 320, 320, 64]
    - [0, 7.169]
  - - [448, 1472, 1, 64, 448, 448, 448, 64]
    - [0, 8.275]
  - - [576, 1472, 1, 64, 576, 576, 576, 64]
    - [0, 8.917]
  - - [704, 1472, 1, 64, 704, 704, 704, 64]
    - [0, 9.507]
  - - [832, 1472, 1, 64, 832, 832, 832, 64]
    - [0, 9.898]
  - - [960, 1472, 1, 64, 960, 960, 960, 64]
    - [0, 10.269]
  - - [1088, 1472, 1, 64, 1088, 1088, 1088, 64]
    - [0, 10.499]
  - - [1216, 1472, 1, 64, 1216, 1216, 1216, 64]
    - [0, 10.759]
  - - [1344, 1472, 1, 64, 1344, 1344, 1344, 64]
    - [0, 10.902]
  - - [1472, 1472, 1, 64, 1472, 1472, 1472, 64]
    - [0, 11.095]
  - - [1600, 1472, 1, 64, 1600, 1600, 1600, 64]
    - [0, 11.211]
  - - [1728, 1472, 1, 64, 1728, 1728, 1728, 64]
    - [0, 11.332]
  - - [1856, 1472, 1, 64, 1856, 1856, 1856, 64]
    - [0, 11.311]
  - - [1984, 1472, 1, 64, 1984, 1984, 1984, 64]
    - [0, 11.507]
  - - [2112, 1472, 1, 64, 2112, 2112, 2112, 64]
    - [0, 11.621]
  - - [2240, 1472, 1, 64, 2240, 2240, 2240, 64]
    - [0, 11.68]
  - - [2368, 1472, 1, 64, 2368, 2368, 2368, 64]
    - [0, 11.746]
  - - [2496, 1472, 1, 64, 2496, 2496, 2496, 64]
    - [0, 11.711]
  - - [2624, 1472, 1, 64, 2624, 2624, 2624, 64]
    - [0, 11.858]
  - - [2752, 1472, 1, 64, 2752, 2752, 2752, 64]
    - [0, 11.924]
  - - [2880, 1472, 1, 64, 2880, 2880, 2880, 64]
    - [0, 11.983]
  - - [3008, 1472, 1, 64, 3008, 3008, 3008, 64]
    - [0, 11.128]
  - - [3136, 1472, 1, 64, 3136, 3136, 3136, 64]
    - [0, 11.376]
  - - [3264, 1472, 1, 64, 3264, 3264, 3264, 64]
    - [0, 11.462]
  - - [3392, 1472, 1, 64, 3392, 3392, 3392, 64]
    - [0, 11.485]
  - - [3520, 1472, 1, 64, 3520, 3520, 3520, 64]
    - [0, 11.558]
  - - [3648, 1472, 1, 64, 3648, 3648, 3648, 64]
    - [0, 11.554]
  - - [3776, 1472, 1, 64, 3776, 3776, 3776, 64]
    - [0, 11.702]
  - - [3904, 1472, 1, 64, 3904, 3904, 3904, 64]
    - [0, 11.725]
  - - [4032, 1472, 1, 64, 4032, 4032, 4032, 64]
    - [0, 11.788]
  - - [64, 1600, 1, 64, 64, 64, 64, 64]
    - [0, 2.876]
  - - [192, 1600, 1, 64, 192, 192, 192, 64]
    - [0, 5.868]
  - - [320, 1600, 1, 64, 320, 320, 320, 64]
    - [0, 7.554]
  - - [448, 1600, 1, 64, 448, 448, 448, 64]
    - [0, 8.467]
  - - [576, 1600, 1, 64, 576, 576, 576, 64]
    - [0, 9.236]
  - - [704, 1600, 1, 64, 704, 704, 704, 64]
    - [0, 9.794]
  - - [832, 1600, 1, 64, 832, 832, 832, 64]
    - [0, 10.122]
  - - [960, 1600, 1, 64, 960, 960, 960, 64]
    - [0, 10.432]
  - - [1088, 1600, 1, 64, 1088, 1088, 1088, 64]
    - [0, 10.728]
  - - [1216, 1600, 1, 64, 1216, 1216, 1216, 64]
    - [0, 10.919]
  - - [1344, 1600, 1, 64, 1344, 1344, 1344, 64]
    - [0, 11.009]
  - - [1472, 1600, 1, 64, 1472, 1472, 1472, 64]
    - [0, 11.219]
  - - [1600, 1600, 1, 64, 1600, 1600, 1600, 64]
    - [0, 11.276]
  - - [1728, 1600, 1, 64, 1728, 1728, 1728, 64]
    - [0, 11.459]
  - - [1856, 1600, 1, 64, 1856, 1856, 1856, 64]
    - [0, 11.524]
  - - [1984, 1600, 1, 64, 1984, 1984, 1984, 64]
    - [0, 11.577]
  - - [2112, 1600, 1, 64, 2112, 2112, 2112, 64]
    - [0, 11.626]
  - - [2240, 1600, 1, 64, 2240, 2240, 2240, 64]
    - [0, 11.728]
  - - [2368, 1600, 1, 64, 2368, 2368, 2368, 64]
    - [0, 11.901]
  - - [2496, 1600, 1, 64, 2496, 2496, 2496, 64]
    - [0, 11.851]
  - - [2624, 1600, 1, 64, 2624, 2624, 2624, 64]
    - [0, 11.975]
  - - [2752, 1600, 1, 64, 2752, 2752, 2752, 64]
    - [0, 11.071]
  - - [2880, 1600, 1, 64, 2880, 2880, 2880, 64]
    - [0, 11.434]
  - - [3008, 1600, 1, 64, 3008, 3008, 3008, 64]
    - [0, 11.397]
  - - [3136, 1600, 1, 64, 3136, 3136, 3136, 64]
    - [0, 11.475]
  - - [3264, 1600, 1, 64, 3264, 3264, 3264, 64]
    - [0, 11.581]
  - - [3392, 1600, 1, 64, 3392, 3392, 3392, 64]
    - [0, 11.647]
  - - [3520, 1600, 1, 64, 3520, 3520, 3520, 64]
    - [0, 11.646]
  - - [3648, 1600, 1, 64, 3648, 3648, 3648, 64]
    - [0, 11.686]
  - - [3776, 1600, 1, 64, 3776, 3776, 3776, 64]
    - [0, 11.674]
  - - [3904, 1600, 1, 64, 3904, 3904, 3904, 64]
    - [0, 11.87]
  - - [4032, 1600, 1, 64, 4032, 4032, 4032, 64]
    - [0, 11.849]
  - - [64, 1728, 1, 64, 64, 64, 64, 64]
    - [0, 3.097]
  - - [192, 1728, 1, 64, 192, 192, 192, 64]
    - [0, 6.131]
  - - [320, 1728, 1, 64, 320, 320, 320, 64]
    - [0, 7.759]
  - - [448, 1728, 1, 64, 448, 448, 448, 64]
    - [0, 8.691]
  - - [576, 1728, 1, 64, 576, 576, 576, 64]
    - [0, 9.404]
  - - [704, 1728, 1, 64, 704, 704, 704, 64]
    - [0, 9.943]
  - - [832, 1728, 1, 64, 832, 832, 832, 64]
    - [0, 10.322]
  - - [960, 1728, 1, 64, 960, 960, 960, 64]
    - [0, 10.608]
  - - [1088, 1728, 1, 64, 1088, 1088, 1088, 64]
    - [0, 10.877]
  - - [1216, 1728, 1, 64, 1216, 1216, 1216, 64]
    - [0, 11.023]
  - - [1344, 1728, 1, 64, 1344, 1344, 1344, 64]
    - [0, 11.227]
  - - [1472, 1728, 1, 64, 1472, 1472, 1472, 64]
    - [0, 11.352]
  - - [1600, 1728, 1, 64, 1600, 1600, 1600, 64]
    - [0, 11.445]
  - - [1728, 1728, 1, 64, 1728, 1728, 1728, 64]
    - [0, 11.527]
  - - [1856, 1728, 1, 64, 1856, 1856, 1856, 64]
    - [0, 11.735]
  - - [1984, 1728, 1, 64, 1984, 1984, 1984, 64]
    - [0, 11.715]
  - - [2112, 1728, 1, 64, 2112, 2112, 2112, 64]
    - [0, 11.811]
  - - [2240, 1728, 1, 64, 2240, 2240, 2240, 64]
    - [0, 11.809]
  - - [2368, 1728, 1, 64, 2368, 2368, 2368, 64]
    - [0, 11.903]
  - - [2496, 1728, 1, 64, 2496, 2496, 2496, 64]
    - [0, 10.852]
  - - [2624, 1728, 1, 64, 2624, 2624, 2624, 64]
    - [0, 11.37]
  - - [2752, 1728, 1, 64, 2752, 2752, 2752, 64]
    - [0, 11.395]
  - - [2880, 1728, 1, 64, 2880, 2880, 2880, 64]
    - [0, 11.509]
  - - [3008, 1728, 1, 64, 3008, 3008, 3008, 64]
    - [0, 11.52]
  - - [3136, 1728, 1, 64, 3136, 3136, 3136, 64]
    - [0, 11.666]
  - - [3264, 1728, 1, 64, 3264, 3264, 3264, 64]
    - [0, 11.64]
  - - [3392, 1728, 1, 64, 3392, 3392, 3392, 64]
    - [0, 11.742]
  - - [3520, 1728, 1, 64, 3520, 3520, 3520, 64]
    - [0, 11.812]
  - - [3648, 1728, 1, 64, 3648, 3648, 3648, 64]
    - [0, 11.807]
  - - [3776, 1728, 1, 64, 3776, 3776, 3776, 64]
    - [0, 11.9]
  - - [3904, 1728, 1, 64, 3904, 3904, 3904, 64]
    - [0, 11.859]
  - - [4032, 1728, 1, 64, 4032, 4032, 4032, 64]
    - [0, 11.879]
  - - [64, 1856, 1, 64, 64, 64, 64, 64]
    - [0, 3.32]
  - - [192, 1856, 1, 64, 192, 192, 192, 64]
    - [0, 6.474]
  - - [320, 1856, 1, 64, 320, 320, 320, 64]
    - [0, 7.942]
  - - [448, 1856, 1, 64, 448, 448, 448, 64]
    - [0, 8.903]
  - - [576, 1856, 1, 64, 576, 576, 576, 64]
    - [0, 9.562]
  - - [704, 1856, 1, 64, 704, 704, 704, 64]
    - [0, 10.004]
  - - [832, 1856, 1, 64, 832, 832, 832, 64]
    - [0, 10.472]
  - - [960, 1856, 1, 64, 960, 960, 960, 64]
    - [0, 10.728]
  - - [1088, 1856, 1, 64, 1088, 1088, 1088, 64]
    - [0, 11.005]
  - - [1216, 1856, 1, 64, 1216, 1216, 1216, 64]
    - [0, 11.143]
  - - [1344, 1856, 1, 64, 1344, 1344, 1344, 64]
    - [0, 11.307]
  - - [1472, 1856, 1, 64, 1472, 1472, 1472, 64]
    - [0, 11.448]
  - - [1600, 1856, 1, 64, 1600, 1600, 1600, 64]
    - [0, 11.459]
  - - [1728, 1856, 1, 64, 1728, 1728, 1728, 64]
    - [0, 11.619]
  - - [1856, 1856, 1, 64, 1856, 1856, 1856, 64]
    - [0, 11.668]
  - - [1984, 1856, 1, 64, 1984, 1984, 1984, 64]
    - [0, 11.858]
  - - [2112, 1856, 1, 64, 2112, 2112, 2112, 64]
    - [0, 11.932]
  - - [2240, 1856, 1, 64, 2240, 2240, 2240, 64]
    - [0, 11.897]
  - - [2368, 1856, 1, 64, 2368, 2368, 2368, 64]
    - [0, 11.049]
  - - [2496, 1856, 1, 64, 2496, 2496, 2496, 64]
    - [0, 11.497]
  - - [2624, 1856, 1, 64, 2624, 2624, 2624, 64]
    - [0, 11.523]
  - - [2752, 1856, 1, 64, 2752, 2752, 2752, 64]
    - [0, 11.536]
  - - [2880, 1856, 1, 64, 2880, 2880, 2880, 64]
    - [0, 11.588]
  - - [3008, 1856, 1, 64, 3008, 3008, 3008, 64]
    - [0, 11.651]
  - - [3136, 1856, 1, 64, 3136, 3136, 3136, 64]
    - [0, 11.742]
  - - [3264, 1856, 1, 64, 3264, 3264, 3264, 64]
    - [0, 11.735]
  - - [3392, 1856, 1, 64, 3392, 3392, 3392, 64]
    - [0, 11.773]
  - - [3520, 1856, 1, 64, 3520, 3520, 3520, 64]
    - [0, 11.797]
  - - [3648, 1856, 1, 64, 3648, 3648, 3648, 64]
    - [0, 11.906]
  - - [3776, 1856, 1, 64, 3776, 3776, 3776, 64]
    - [0, 11.896]
  - - [3904, 1856, 1, 64, 3904, 3904, 3904, 64]
    - [0, 11.946]
  - - [4032, 1856, 1, 64, 4032, 4032, 4032, 64]
    - [0, 11.968]
  - - [64, 1984, 1, 64, 64, 64, 64, 64]
    - [0, 2.338]
  - - [192, 1984, 1, 64, 192, 192, 192, 64]
    - [0, 6.665]
  - - [320, 1984, 1, 64, 320, 320, 320, 64]
    - [0, 8.137]
  - - [448, 1984, 1, 64, 448, 448, 448, 64]
    - [0, 9.083]
  - - [576, 1984, 1, 64, 576, 576, 576, 64]
    - [0, 9.808]
  - - [704, 1984, 1, 64, 704, 704, 704, 64]
    - [0, 10.276]
  - - [832, 1984, 1, 64, 832, 832, 832, 64]
    - [0, 10.573]
  - - [960, 1984, 1, 64, 960, 960, 960, 64]
    - [0, 10.833]
  - - [1088, 1984, 1, 64, 1088, 1088, 1088, 64]
    - [0, 11.092]
  - - [1216, 1984, 1, 64, 1216, 1216, 1216, 64]
    - [0, 11.337]
  - - [1344, 1984, 1, 64, 1344, 1344, 1344, 64]
    - [0, 11.41]
  - - [1472, 1984, 1, 64, 1472, 1472, 1472, 64]
    - [0, 11.491]
  - - [1600, 1984, 1, 64, 1600, 1600, 1600, 64]
    - [0, 11.64]
  - - [1728, 1984, 1, 64, 1728, 1728, 1728, 64]
    - [0, 11.717]
  - - [1856, 1984, 1, 64, 1856, 1856, 1856, 64]
    - [0, 11.855]
  - - [1984, 1984, 1, 64, 1984, 1984, 1984, 64]
    - [0, 11.874]
  - - [2112, 1984, 1, 64, 2112, 2112, 2112, 64]
    - [0, 11.868]
  - - [2240, 1984, 1, 64, 2240, 2240, 2240, 64]
    - [0, 11.168]
  - - [2368, 1984, 1, 64, 2368, 2368, 2368, 64]
    - [0, 11.522]
  - - [2496, 1984, 1, 64, 2496, 2496, 2496, 64]
    - [0, 11.517]
  - - [2624, 1984, 1, 64, 2624, 2624, 2624, 64]
    - [0, 11.615]
  - - [2752, 1984, 1, 64, 2752, 2752, 2752, 64]
    - [0, 11.682]
  - - [2880, 1984, 1, 64, 2880, 2880, 2880, 64]
    - [0, 11.692]
  - - [3008, 1984, 1, 64, 3008, 3008, 3008, 64]
    - [0, 11.819]
  - - [3136, 1984, 1, 64, 3136, 3136, 3136, 64]
    - [0, 11.773]
  - - [3264, 1984, 1, 64, 3264, 3264, 3264, 64]
    - [0, 11.8]
  - - [3392, 1984, 1, 64, 3392, 3392, 3392, 64]
    - [0, 11.879]
  - - [3520, 1984, 1, 64, 3520, 3520, 3520, 64]
    - [0, 11.91]
  - - [3648, 1984, 1, 64, 3648, 3648, 3648, 64]
    - [0, 11.946]
  - - [3776, 1984, 1, 64, 3776, 3776, 3776, 64]
    - [0, 11.988]
  - - [3904, 1984, 1, 64, 3904, 3904, 3904, 64]
    - [0, 11.96]
  - - [4032, 1984, 1, 64, 4032, 4032, 4032, 64]
    - [0, 12.008]
  - - [64, 2112, 1, 64, 64, 64, 64, 64]
    - [0, 3.575]
  - - [192, 2112, 1, 64, 192, 192, 192, 64]
    - [0, 6.753]
  - - [320, 2112, 1, 64, 320, 320, 320, 64]
    - [0, 8.352]
  - - [448, 2112, 1, 64, 448, 448, 448, 64]
    - [0, 9.271]
  - - [576, 2112, 1, 64, 576, 576, 576, 64]
    - [0, 9.888]
  - - [704, 2112, 1, 64, 704, 704, 704, 64]
    - [0, 10.319]
  - - [832, 2112, 1, 64, 832, 832, 832, 64]
    - [0, 10.725]
  - - [960, 2112, 1, 64, 960, 960, 960, 64]
    - [0, 10.935]
  - - [1088, 2112, 1, 64, 1088, 1088, 1088, 64]
    - [0, 11.177]
  - - [1216, 2112, 1, 64, 1216, 1216, 1216, 64]
    - [0, 11.305]
  - - [1344, 2112, 1, 64, 1344, 1344, 1344, 64]
    - [0, 11.486]
  - - [1472, 2112, 1, 64, 1472, 1472, 1472, 64]
    - [0, 11.627]
  - - [1600, 2112, 1, 64, 1600, 1600, 1600, 64]
    - [0, 11.756]
  - - [1728, 2112, 1, 64, 1728, 1728, 1728, 64]
    - [0, 11.773]
  - - [1856, 2112, 1, 64, 1856, 1856, 1856, 64]
    - [0, 11.849]
  - - [1984, 2112, 1, 64, 1984, 1984, 1984, 64]
    - [0, 11.908]
  - - [2112, 2112, 1, 64, 2112, 2112, 2112, 64]
    - [0, 11.206]
  - - [2240, 2112, 1, 64, 2240, 2240, 2240, 64]
    - [0, 11.469]
  - - [2368, 2112, 1, 64, 2368, 2368, 2368, 64]
    - [0, 11.507]
  - - [2496, 2112, 1, 64, 2496, 2496, 2496, 64]
    - [0, 11.567]
  - - [2624, 2112, 1, 64, 2624, 2624, 2624, 64]
    - [0, 11.625]
  - - [2752, 2112, 1, 64, 2752, 2752, 2752, 64]
    - [0, 11.69]
  - - [2880, 2112, 1, 64, 2880, 2880, 2880, 64]
    - [0, 11.814]
  - - [3008, 2112, 1, 64, 3008, 3008, 3008, 64]
    - [0, 11.778]
  - - [3136, 2112, 1, 64, 3136, 3136, 3136, 64]
    - [0, 11.879]
  - - [3264, 2112, 1, 64, 3264, 3264, 3264, 64]
    - [0, 11.863]
  - - [3392, 2112, 1, 64, 3392, 3392, 3392, 64]
    - [0, 12.0]
  - - [3520, 2112, 1, 64, 3520, 3520, 3520, 64]
    - [0, 12.04]
  - - [3648, 2112, 1, 64, 3648, 3648, 3648, 64]
    - [0, 11.953]
  - - [3776, 2112, 1, 64, 3776, 3776, 3776, 64]
    - [0, 11.958]
  - - [3904, 2112, 1, 64, 3904, 3904, 3904, 64]
    - [0, 11.789]
  - - [4032, 2112, 1, 64, 4032, 4032, 4032, 64]
    - [0, 11.496]
  - - [64, 2240, 1, 64, 64, 64, 64, 64]
    - [0, 3.766]
  - - [192, 2240, 1, 64, 192, 192, 192, 64]
    - [0, 6.883]
  - - [320, 2240, 1, 64, 320, 320, 320, 64]
    - [0, 8.464]
  - - [448, 2240, 1, 64, 448, 448, 448, 64]
    - [0, 9.455]
  - - [576, 2240, 1, 64, 576, 576, 576, 64]
    - [0, 10.053]
  - - [704, 2240, 1, 64, 704, 704, 704, 64]
    - [0, 10.524]
  - - [832, 2240, 1, 64, 832, 832, 832, 64]
    - [0, 10.873]
  - - [960, 2240, 1, 64, 960, 960, 960, 64]
    - [0, 11.015]
  - - [1088, 2240, 1, 64, 1088, 1088, 1088, 64]
    - [0, 11.216]
  - - [1216, 2240, 1, 64, 1216, 1216, 1216, 64]
    - [0, 11.403]
  - - [1344, 2240, 1, 64, 1344, 1344, 1344, 64]
    - [0, 11.552]
  - - [1472, 2240, 1, 64, 1472, 1472, 1472, 64]
    - [0, 11.63]
  - - [1600, 2240, 1, 64, 1600, 1600, 1600, 64]
    - [0, 11.818]
  - - [1728, 2240, 1, 64, 1728, 1728, 1728, 64]
    - [0, 11.824]
  - - [1856, 2240, 1, 64, 1856, 1856, 1856, 64]
    - [0, 11.825]
  - - [1984, 2240, 1, 64, 1984, 1984, 1984, 64]
    - [0, 11.166]
  - - [2112, 2240, 1, 64, 2112, 2112, 2112, 64]
    - [0, 11.422]
  - - [2240, 2240, 1, 64, 2240, 2240, 2240, 64]
    - [0, 11.603]
  - - [2368, 2240, 1, 64, 2368, 2368, 2368, 64]
    - [0, 11.562]
  - - [2496, 2240, 1, 64, 2496, 2496, 2496, 64]
    - [0, 11.629]
  - - [2624, 2240, 1, 64, 2624, 2624, 2624, 64]
    - [0, 11.759]
  - - [2752, 2240, 1, 64, 2752, 2752, 2752, 64]
    - [0, 11.777]
  - - [2880, 2240, 1, 64, 2880, 2880, 2880, 64]
    - [0, 11.879]
  - - [3008, 2240, 1, 64, 3008, 3008, 3008, 64]
    - [0, 11.885]
  - - [3136, 2240, 1, 64, 3136, 3136, 3136, 64]
    - [0, 11.87]
  - - [3264, 2240, 1, 64, 3264, 3264, 3264, 64]
    - [0, 11.972]
  - - [3392, 2240, 1, 64, 3392, 3392, 3392, 64]
    - [0, 11.984]
  - - [3520, 2240, 1, 64, 3520, 3520, 3520, 64]
    - [0, 12.05]
  - - [3648, 2240, 1, 64, 3648, 3648, 3648, 64]
    - [0, 11.847]
  - - [3776, 2240, 1, 64, 3776, 3776, 3776, 64]
    - [0, 11.517]
  - - [3904, 2240, 1, 64, 3904, 3904, 3904, 64]
    - [0, 11.209]
  - - [4032, 2240, 1, 64, 4032, 4032, 4032, 64]
    - [0, 11.052]
  - - [64, 2368, 1, 64, 64, 64, 64, 64]
    - [0, 3.992]
  - - [192, 2368, 1, 64, 192, 192, 192, 64]
    - [0, 6.968]
  - - [320, 2368, 1, 64, 320, 320, 320, 64]
    - [0, 8.592]
  - - [448, 2368, 1, 64, 448, 448, 448, 64]
    - [0, 9.617]
  - - [576, 2368, 1, 64, 576, 576, 576, 64]
    - [0, 10.162]
  - - [704, 2368, 1, 64, 704, 704, 704, 64]
    - [0, 10.648]
  - - [832, 2368, 1, 64, 832, 832, 832, 64]
    - [0, 10.865]
  - - [960, 2368, 1, 64, 960, 960, 960, 64]
    - [0, 11.146]
  - - [1088, 2368, 1, 64, 1088, 1088, 1088, 64]
    - [0, 11.316]
  - - [1216, 2368, 1, 64, 1216, 1216, 1216, 64]
    - [0, 11.471]
  - - [1344, 2368, 1, 64, 1344, 1344, 1344, 64]
    - [0, 11.638]
  - - [1472, 2368, 1, 64, 1472, 1472, 1472, 64]
    - [0, 11.72]
  - - [1600, 2368, 1, 64, 1600, 1600, 1600, 64]
    - [0, 11.824]
  - - [1728, 2368, 1, 64, 1728, 1728, 1728, 64]
    - [0, 11.984]
  - - [1856, 2368, 1, 64, 1856, 1856, 1856, 64]
    - [0, 11.051]
  - - [1984, 2368, 1, 64, 1984, 1984, 1984, 64]
    - [0, 11.474]
  - - [2112, 2368, 1, 64, 2112, 2112, 2112, 64]
    - [0, 11.548]
  - - [2240, 2368, 1, 64, 2240, 2240, 2240, 64]
    - [0, 11.601]
  - - [2368, 2368, 1, 64, 2368, 2368, 2368, 64]
    - [0, 11.608]
  - - [2496, 2368, 1, 64, 2496, 2496, 2496, 64]
    - [0, 11.653]
  - - [2624, 2368, 1, 64, 2624, 2624, 2624, 64]
    - [0, 11.791]
  - - [2752, 2368, 1, 64, 2752, 2752, 2752, 64]
    - [0, 11.776]
  - - [2880, 2368, 1, 64, 2880, 2880, 2880, 64]
    - [0, 11.933]
  - - [3008, 2368, 1, 64, 3008, 3008, 3008, 64]
    - [0, 11.948]
  - - [3136, 2368, 1, 64, 3136, 3136, 3136, 64]
    - [0, 11.875]
  - - [3264, 2368, 1, 64, 3264, 3264, 3264, 64]
    - [0, 12.024]
  - - [3392, 2368, 1, 64, 3392, 3392, 3392, 64]
    - [0, 11.95]
  - - [3520, 2368, 1, 64, 3520, 3520, 3520, 64]
    - [0, 11.647]
  - - [3648, 2368, 1, 64, 3648, 3648, 3648, 64]
    - [0, 11.386]
  - - [3776, 2368, 1, 64, 3776, 3776, 3776, 64]
    - [0, 10.843]
  - - [3904, 2368, 1, 64, 3904, 3904, 3904, 64]
    - [0, 10.521]
  - - [4032, 2368, 1, 64, 4032, 4032, 4032, 64]
    - [0, 9.717]
  - - [64, 2496, 1, 64, 64, 64, 64, 64]
    - [0, 3.994]
  - - [192, 2496, 1, 64, 192, 192, 192, 64]
    - [0, 7.201]
  - - [320, 2496, 1, 64, 320, 320, 320, 64]
    - [0, 8.725]
  - - [448, 2496, 1, 64, 448, 448, 448, 64]
    - [0, 9.719]
  - - [576, 2496, 1, 64, 576, 576, 576, 64]
    - [0, 10.287]
  - - [704, 2496, 1, 64, 704, 704, 704, 64]
    - [0, 10.679]
  - - [832, 2496, 1, 64, 832, 832, 832, 64]
    - [0, 10.997]
  - - [960, 2496, 1, 64, 960, 960, 960, 64]
    - [0, 11.224]
  - - [1088, 2496, 1, 64, 1088, 1088, 1088, 64]
    - [0, 11.421]
  - - [1216, 2496, 1, 64, 1216, 1216, 1216, 64]
    - [0, 11.575]
  - - [1344, 2496, 1, 64, 1344, 1344, 1344, 64]
    - [0, 11.676]
  - - [1472, 2496, 1, 64, 1472, 1472, 1472, 64]
    - [0, 11.811]
  - - [1600, 2496, 1, 64, 1600, 1600, 1600, 64]
    - [0, 11.856]
  - - [1728, 2496, 1, 64, 1728, 1728, 1728, 64]
    - [0, 11.456]
  - - [1856, 2496, 1, 64, 1856, 1856, 1856, 64]
    - [0, 11.475]
  - - [1984, 2496, 1, 64, 1984, 1984, 1984, 64]
    - [0, 11.516]
  - - [2112, 2496, 1, 64, 2112, 2112, 2112, 64]
    - [0, 11.537]
  - - [2240, 2496, 1, 64, 2240, 2240, 2240, 64]
    - [0, 11.66]
  - - [2368, 2496, 1, 64, 2368, 2368, 2368, 64]
    - [0, 11.732]
  - - [2496, 2496, 1, 64, 2496, 2496, 2496, 64]
    - [0, 11.848]
  - - [2624, 2496, 1, 64, 2624, 2624, 2624, 64]
    - [0, 11.807]
  - - [2752, 2496, 1, 64, 2752, 2752, 2752, 64]
    - [0, 11.92]
  - - [2880, 2496, 1, 64, 2880, 2880, 2880, 64]
    - [0, 11.943]
  - - [3008, 2496, 1, 64, 3008, 3008, 3008, 64]
    - [0, 11.982]
  - - [3136, 2496, 1, 64, 3136, 3136, 3136, 64]
    - [0, 11.976]
  - - [3264, 2496, 1, 64, 3264, 3264, 3264, 64]
    - [0, 12.009]
  - - [3392, 2496, 1, 64, 3392, 3392, 3392, 64]
    - [0, 11.569]
  - - [3520, 2496, 1, 64, 3520, 3520, 3520, 64]
    - [0, 11.282]
  - - [3648, 2496, 1, 64, 3648, 3648, 3648, 64]
    - [0, 10.728]
  - - [3776, 2496, 1, 64, 3776, 3776, 3776, 64]
    - [0, 9.738]
  - - [3904, 2496, 1, 64, 3904, 3904, 3904, 64]
    - [0, 9.681]
  - - [4032, 2496, 1, 64, 4032, 4032, 4032, 64]
    - [0, 9.734]
  - - [64, 2624, 1, 64, 64, 64, 64, 64]
    - [0, 4.174]
  - - [192, 2624, 1, 64, 192, 192, 192, 64]
    - [0, 7.38]
  - - [320, 2624, 1, 64, 320, 320, 320, 64]
    - [0, 8.961]
  - - [448, 2624, 1, 64, 448, 448, 448, 64]
    - [0, 9.777]
  - - [576, 2624, 1, 64, 576, 576, 576, 64]
    - [0, 10.456]
  - - [704, 2624, 1, 64, 704, 704, 704, 64]
    - [0, 10.778]
  - - [832, 2624, 1, 64, 832, 832, 832, 64]
    - [0, 11.054]
  - - [960, 2624, 1, 64, 960, 960, 960, 64]
    - [0, 11.267]
  - - [1088, 2624, 1, 64, 1088, 1088, 1088, 64]
    - [0, 11.557]
  - - [1216, 2624, 1, 64, 1216, 1216, 1216, 64]
    - [0, 11.61]
  - - [1344, 2624, 1, 64, 1344, 1344, 1344, 64]
    - [0, 11.736]
  - - [1472, 2624, 1, 64, 1472, 1472, 1472, 64]
    - [0, 11.864]
  - - [1600, 2624, 1, 64, 1600, 1600, 1600, 64]
    - [0, 11.97]
  - - [1728, 2624, 1, 64, 1728, 1728, 1728, 64]
    - [0, 11.386]
  - - [1856, 2624, 1, 64, 1856, 1856, 1856, 64]
    - [0, 11.474]
  - - [1984, 2624, 1, 64, 1984, 1984, 1984, 64]
    - [0, 11.6]
  - - [2112, 2624, 1, 64, 2112, 2112, 2112, 64]
    - [0, 11.681]
  - - [2240, 2624, 1, 64, 2240, 2240, 2240, 64]
    - [0, 11.768]
  - - [2368, 2624, 1, 64, 2368, 2368, 2368, 64]
    - [0, 11.776]
  - - [2496, 2624, 1, 64, 2496, 2496, 2496, 64]
    - [0, 11.878]
  - - [2624, 2624, 1, 64, 2624, 2624, 2624, 64]
    - [0, 11.884]
  - - [2752, 2624, 1, 64, 2752, 2752, 2752, 64]
    - [0, 11.95]
  - - [2880, 2624, 1, 64, 2880, 2880, 2880, 64]
    - [0, 11.912]
  - - [3008, 2624, 1, 64, 3008, 3008, 3008, 64]
    - [0, 11.982]
  - - [3136, 2624, 1, 64, 3136, 3136, 3136, 64]
    - [0, 11.713]
  - - [3264, 2624, 1, 64, 3264, 3264, 3264, 64]
    - [0, 11.369]
  - - [3392, 2624, 1, 64, 3392, 3392, 3392, 64]
    - [0, 11.091]
  - - [3520, 2624, 1, 64, 3520, 3520, 3520, 64]
    - [0, 10.441]
  - - [3648, 2624, 1, 64, 3648, 3648, 3648, 64]
    - [0, 9.627]
  - - [3776, 2624, 1, 64, 3776, 3776, 3776, 64]
    - [0, 9.698]
  - - [3904, 2624, 1, 64, 3904, 3904, 3904, 64]
    - [0, 9.757]
  - - [4032, 2624, 1, 64, 4032, 4032, 4032, 64]
    - [0, 9.737]
  - - [64, 2752, 1, 64, 64, 64, 64, 64]
    - [0, 4.358]
  - - [192, 2752, 1, 64, 192, 192, 192, 64]
    - [0, 7.561]
  - - [320, 2752, 1, 64, 320, 320, 320, 64]
    - [0, 9.113]
  - - [448, 2752, 1, 64, 448, 448, 448, 64]
    - [0, 9.951]
  - - [576, 2752, 1, 64, 576, 576, 576, 64]
    - [0, 10.492]
  - - [704, 2752, 1, 64, 704, 704, 704, 64]
    - [0, 10.832]
  - - [832, 2752, 1, 64, 832, 832, 832, 64]
    - [0, 11.083]
  - - [960, 2752, 1, 64, 960, 960, 960, 64]
    - [0, 11.426]
  - - [1088, 2752, 1, 64, 1088, 1088, 1088, 64]
    - [0, 11.525]
  - - [1216, 2752, 1, 64, 1216, 1216, 1216, 64]
    - [0, 11.765]
  - - [1344, 2752, 1, 64, 1344, 1344, 1344, 64]
    - [0, 11.69]
  - - [1472, 2752, 1, 64, 1472, 1472, 1472, 64]
    - [0, 11.831]
  - - [1600, 2752, 1, 64, 1600, 1600, 1600, 64]
    - [0, 11.074]
  - - [1728, 2752, 1, 64, 1728, 1728, 1728, 64]
    - [0, 11.499]
  - - [1856, 2752, 1, 64, 1856, 1856, 1856, 64]
    - [0, 11.579]
  - - [1984, 2752, 1, 64, 1984, 1984, 1984, 64]
    - [0, 11.642]
  - - [2112, 2752, 1, 64, 2112, 2112, 2112, 64]
    - [0, 11.714]
  - - [2240, 2752, 1, 64, 2240, 2240, 2240, 64]
    - [0, 11.759]
  - - [2368, 2752, 1, 64, 2368, 2368, 2368, 64]
    - [0, 11.781]
  - - [2496, 2752, 1, 64, 2496, 2496, 2496, 64]
    - [0, 11.884]
  - - [2624, 2752, 1, 64, 2624, 2624, 2624, 64]
    - [0, 12.004]
  - - [2752, 2752, 1, 64, 2752, 2752, 2752, 64]
    - [0, 11.949]
  - - [2880, 2752, 1, 64, 2880, 2880, 2880, 64]
    - [0, 12.057]
  - - [3008, 2752, 1, 64, 3008, 3008, 3008, 64]
    - [0, 11.717]
  - - [3136, 2752, 1, 64, 3136, 3136, 3136, 64]
    - [0, 11.479]
  - - [3264, 2752, 1, 64, 3264, 3264, 3264, 64]
    - [0, 10.824]
  - - [3392, 2752, 1, 64, 3392, 3392, 3392, 64]
    - [0, 10.082]
  - - [3520, 2752, 1, 64, 3520, 3520, 3520, 64]
    - [0, 9.742]
  - - [3648, 2752, 1, 64, 3648, 3648, 3648, 64]
    - [0, 9.559]
  - - [3776, 2752, 1, 64, 3776, 3776, 3776, 64]
    - [0, 9.673]
  - - [3904, 2752, 1, 64, 3904, 3904, 3904, 64]
    - [0, 9.744]
  - - [4032, 2752, 1, 64, 4032, 4032, 4032, 64]
    - [0, 9.735]
  - - [64, 2880, 1, 64, 64, 64, 64, 64]
    - [0, 4.557]
  - - [192, 2880, 1, 64, 192, 192, 192, 64]
    - [0, 7.673]
  - - [320, 2880, 1, 64, 320, 320, 320, 64]
    - [0, 9.134]
  - - [448, 2880, 1, 64, 448, 448, 448, 64]
    - [0, 10.023]
  - - [576, 2880, 1, 64, 576, 576, 576, 64]
    - [0, 10.566]
  - - [704, 2880, 1, 64, 704, 704, 704, 64]
    - [0, 10.959]
  - - [832, 2880, 1, 64, 832, 832, 832, 64]
    - [0, 11.265]
  - - [960, 2880, 1, 64, 960, 960, 960, 64]
    - [0, 11.429]
  - - [1088, 2880, 1, 64, 1088, 1088, 1088, 64]
    - [0, 11.605]
  - - [1216, 2880, 1, 64, 1216, 1216, 1216, 64]
    - [0, 11.757]
  - - [1344, 2880, 1, 64, 1344, 1344, 1344, 64]
    - [0, 11.86]
  - - [1472, 2880, 1, 64, 1472, 1472, 1472, 64]
    - [0, 11.843]
  - - [1600, 2880, 1, 64, 1600, 1600, 1600, 64]
    - [0, 11.506]
  - - [1728, 2880, 1, 64, 1728, 1728, 1728, 64]
    - [0, 11.468]
  - - [1856, 2880, 1, 64, 1856, 1856, 1856, 64]
    - [0, 11.64]
  - - [1984, 2880, 1, 64, 1984, 1984, 1984, 64]
    - [0, 11.603]
  - - [2112, 2880, 1, 64, 2112, 2112, 2112, 64]
    - [0, 11.781]
  - - [2240, 2880, 1, 64, 2240, 2240, 2240, 64]
    - [0, 11.805]
  - - [2368, 2880, 1, 64, 2368, 2368, 2368, 64]
    - [0, 11.876]
  - - [2496, 2880, 1, 64, 2496, 2496, 2496, 64]
    - [0, 12.046]
  - - [2624, 2880, 1, 64, 2624, 2624, 2624, 64]
    - [0, 11.903]
  - - [2752, 2880, 1, 64, 2752, 2752, 2752, 64]
    - [0, 12.06]
  - - [2880, 2880, 1, 64, 2880, 2880, 2880, 64]
    - [0, 11.644]
  - - [3008, 2880, 1, 64, 3008, 3008, 3008, 64]
    - [0, 11.38]
  - - [3136, 2880, 1, 64, 3136, 3136, 3136, 64]
    - [0, 10.745]
  - - [3264, 2880, 1, 64, 3264, 3264, 3264, 64]
    - [0, 9.828]
  - - [3392, 2880, 1, 64, 3392, 3392, 3392, 64]
    - [0, 9.777]
  - - [3520, 2880, 1, 64, 3520, 3520, 3520, 64]
    - [0, 9.765]
  - - [3648, 2880, 1, 64, 3648, 3648, 3648, 64]
    - [0, 9.585]
  - - [3776, 2880, 1, 64, 3776, 3776, 3776, 64]
    - [0, 9.699]
  - - [3904, 2880, 1, 64, 3904, 3904, 3904, 64]
    - [0, 9.757]
  - - [4032, 2880, 1, 64, 4032, 4032, 4032, 64]
    - [0, 9.765]
  - - [64, 3008, 1, 64, 64, 64, 64, 64]
    - [0, 4.517]
  - - [192, 3008, 1, 64, 192, 192, 192, 64]
    - [0, 7.83]
  - - [320, 3008, 1, 64, 320, 320, 320, 64]
    - [0, 9.351]
  - - [448, 3008, 1, 64, 448, 448, 448, 64]
    - [0, 10.123]
  - - [576, 3008, 1, 64, 576, 576, 576, 64]
    - [0, 10.641]
  - - [704, 3008, 1, 64, 704, 704, 704, 64]
    - [0, 11.015]
  - - [832, 3008, 1, 64, 832, 832, 832, 64]
    - [0, 11.292]
  - - [960, 3008, 1, 64, 960, 960, 960, 64]
    - [0, 11.514]
  - - [1088, 3008, 1, 64, 1088, 1088, 1088, 64]
    - [0, 11.703]
  - - [1216, 3008, 1, 64, 1216, 1216, 1216, 64]
    - [0, 11.83]
  - - [1344, 3008, 1, 64, 1344, 1344, 1344, 64]
    - [0, 11.819]
  - - [1472, 3008, 1, 64, 1472, 1472, 1472, 64]
    - [0, 11.135]
  - - [1600, 3008, 1, 64, 1600, 1600, 1600, 64]
    - [0, 11.486]
  - - [1728, 3008, 1, 64, 1728, 1728, 1728, 64]
    - [0, 11.608]
  - - [1856, 3008, 1, 64, 1856, 1856, 1856, 64]
    - [0, 11.671]
  - - [1984, 3008, 1, 64, 1984, 1984, 1984, 64]
    - [0, 11.757]
  - - [2112, 3008, 1, 64, 2112, 2112, 2112, 64]
    - [0, 11.833]
  - - [2240, 3008, 1, 64, 2240, 2240, 2240, 64]
    - [0, 11.92]
  - - [2368, 3008, 1, 64, 2368, 2368, 2368, 64]
    - [0, 11.927]
  - - [2496, 3008, 1, 64, 2496, 2496, 2496, 64]
    - [0, 11.925]
  - - [2624, 3008, 1, 64, 2624, 2624, 2624, 64]
    - [0, 12.027]
  - - [2752, 3008, 1, 64, 2752, 2752, 2752, 64]
    - [0, 11.693]
  - - [2880, 3008, 1, 64, 2880, 2880, 2880, 64]
    - [0, 11.42]
  - - [3008, 3008, 1, 64, 3008, 3008, 3008, 64]
    - [0, 10.701]
  - - [3136, 3008, 1, 64, 3136, 3136, 3136, 64]
    - [0, 9.686]
  - - [3264, 3008, 1, 64, 3264, 3264, 3264, 64]
    - [0, 9.756]
  - - [3392, 3008, 1, 64, 3392, 3392, 3392, 64]
    - [0, 9.732]
  - - [3520, 3008, 1, 64, 3520, 3520, 3520, 64]
    - [0, 9.726]
  - - [3648, 3008, 1, 64, 3648, 3648, 3648, 64]
    - [0, 9.618]
  - - [3776, 3008, 1, 64, 3776, 3776, 3776, 64]
    - [0, 9.717]
  - - [3904, 3008, 1, 64, 3904, 3904, 3904, 64]
    - [0, 9.685]
  - - [4032, 3008, 1, 64, 4032, 4032, 4032, 64]
    - [0, 9.704]
  - - [64, 3136, 1, 64, 64, 64, 64, 64]
    - [0, 4.716]
  - - [192, 3136, 1, 64, 192, 192, 192, 64]
    - [0, 7.959]
  - - [320, 3136, 1, 64, 320, 320, 320, 64]
    - [0, 9.443]
  - - [448, 3136, 1, 64, 448, 448, 448, 64]
    - [0, 10.248]
  - - [576, 3136, 1, 64, 576, 576, 576, 64]
    - [0, 10.788]
  - - [704, 3136, 1, 64, 704, 704, 704, 64]
    - [0, 11.108]
  - - [832, 3136, 1, 64, 832, 832, 832, 64]
    - [0, 11.312]
  - - [960, 3136, 1, 64, 960, 960, 960, 64]
    - [0, 11.524]
  - - [1088, 3136, 1, 64, 1088, 1088, 1088, 64]
    - [0, 11.688]
  - - [1216, 3136, 1, 64, 1216, 1216, 1216, 64]
    - [0, 11.809]
  - - [1344, 3136, 1, 64, 1344, 1344, 1344, 64]
    - [0, 11.921]
  - - [1472, 3136, 1, 64, 1472, 1472, 1472, 64]
    - [0, 11.469]
  - - [1600, 3136, 1, 64, 1600, 1600, 1600, 64]
    - [0, 11.504]
  - - [1728, 3136, 1, 64, 1728, 1728, 1728, 64]
    - [0, 11.541]
  - - [1856, 3136, 1, 64, 1856, 1856, 1856, 64]
    - [0, 11.642]
  - - [1984, 3136, 1, 64, 1984, 1984, 1984, 64]
    - [0, 11.684]
  - - [2112, 3136, 1, 64, 2112, 2112, 2112, 64]
    - [0, 11.812]
  - - [2240, 3136, 1, 64, 2240, 2240, 2240, 64]
    - [0, 11.907]
  - - [2368, 3136, 1, 64, 2368, 2368, 2368, 64]
    - [0, 12.006]
  - - [2496, 3136, 1, 64, 2496, 2496, 2496, 64]
    - [0, 11.939]
  - - [2624, 3136, 1, 64, 2624, 2624, 2624, 64]
    - [0, 11.838]
  - - [2752, 3136, 1, 64, 2752, 2752, 2752, 64]
    - [0, 11.517]
  - - [2880, 3136, 1, 64, 2880, 2880, 2880, 64]
    - [0, 10.849]
  - - [3008, 3136, 1, 64, 3008, 3008, 3008, 64]
    - [0, 9.628]
  - - [3136, 3136, 1, 64, 3136, 3136, 3136, 64]
    - [0, 9.698]
  - - [3264, 3136, 1, 64, 3264, 3264, 3264, 64]
    - [0, 9.786]
  - - [3392, 3136, 1, 64, 3392, 3392, 3392, 64]
    - [0, 9.738]
  - - [3520, 3136, 1, 64, 3520, 3520, 3520, 64]
    - [0, 9.726]
  - - [3648, 3136, 1, 64, 3648, 3648, 3648, 64]
    - [0, 9.605]
  - - [3776, 3136, 1, 64, 3776, 3776, 3776, 64]
    - [0, 9.667]
  - - [3904, 3136, 1, 64, 3904, 3904, 3904, 64]
    - [0, 9.672]
  - - [4032, 3136, 1, 64, 4032, 4032, 4032, 64]
    - [0, 9.705]
  - - [64, 3264, 1, 64, 64, 64, 64, 64]
    - [0, 4.889]
  - - [192, 3264, 1, 64, 192, 192, 192, 64]
    - [0, 8.1]
  - - [320, 3264, 1, 64, 320, 320, 320, 64]
    - [0, 9.602]
  - - [448, 3264, 1, 64, 448, 448, 448, 64]
    - [0, 10.43]
  - - [576, 3264, 1, 64, 576, 576, 576, 64]
    - [0, 10.788]
  - - [704, 3264, 1, 64, 704, 704, 704, 64]
    - [0, 11.014]
  - - [832, 3264, 1, 64, 832, 832, 832, 64]
    - [0, 11.441]
  - - [960, 3264, 1, 64, 960, 960, 960, 64]
    - [0, 11.573]
  - - [1088, 3264, 1, 64, 1088, 1088, 1088, 64]
    - [0, 11.758]
  - - [1216, 3264, 1, 64, 1216, 1216, 1216, 64]
    - [0, 11.866]
  - - [1344, 3264, 1, 64, 1344, 1344, 1344, 64]
    - [0, 11.031]
  - - [1472, 3264, 1, 64, 1472, 1472, 1472, 64]
    - [0, 11.451]
  - - [1600, 3264, 1, 64, 1600, 1600, 1600, 64]
    - [0, 11.624]
  - - [1728, 3264, 1, 64, 1728, 1728, 1728, 64]
    - [0, 11.762]
  - - [1856, 3264, 1, 64, 1856, 1856, 1856, 64]
    - [0, 11.756]
  - - [1984, 3264, 1, 64, 1984, 1984, 1984, 64]
    - [0, 11.81]
  - - [2112, 3264, 1, 64, 2112, 2112, 2112, 64]
    - [0, 11.863]
  - - [2240, 3264, 1, 64, 2240, 2240, 2240, 64]
    - [0, 11.911]
  - - [2368, 3264, 1, 64, 2368, 2368, 2368, 64]
    - [0, 11.987]
  - - [2496, 3264, 1, 64, 2496, 2496, 2496, 64]
    - [0, 12.106]
  - - [2624, 3264, 1, 64, 2624, 2624, 2624, 64]
    - [0, 11.501]
  - - [2752, 3264, 1, 64, 2752, 2752, 2752, 64]
    - [0, 11.019]
  - - [2880, 3264, 1, 64, 2880, 2880, 2880, 64]
    - [0, 9.824]
  - - [3008, 3264, 1, 64, 3008, 3008, 3008, 64]
    - [0, 9.575]
  - - [3136, 3264, 1, 64, 3136, 3136, 3136, 64]
    - [0, 9.659]
  - - [3264, 3264, 1, 64, 3264, 3264, 3264, 64]
    - [0, 9.793]
  - - [3392, 3264, 1, 64, 3392, 3392, 3392, 64]
    - [0, 9.764]
  - - [3520, 3264, 1, 64, 3520, 3520, 3520, 64]
    - [0, 9.777]
  - - [3648, 3264, 1, 64, 3648, 3648, 3648, 64]
    - [0, 9.618]
  - - [3776, 3264, 1, 64, 3776, 3776, 3776, 64]
    - [0, 9.67]
  - - [3904, 3264, 1, 64, 3904, 3904, 3904, 64]
    - [0, 9.726]
  - - [4032, 3264, 1, 64, 4032, 4032, 4032, 64]
    - [0, 9.727]
  - - [64, 3392, 1, 64, 64, 64, 64, 64]
    - [0, 4.914]
  - - [192, 3392, 1, 64, 192, 192, 192, 64]
    - [0, 8.243]
  - - [320, 3392, 1, 64, 320, 320, 320, 64]
    - [0, 9.643]
  - - [448, 3392, 1, 64, 448, 448, 448, 64]
    - [0, 10.355]
  - - [576, 3392, 1, 64, 576, 576, 576, 64]
    - [0, 10.845]
  - - [704, 3392, 1, 64, 704, 704, 704, 64]
    - [0, 11.19]
  - - [832, 3392, 1, 64, 832, 832, 832, 64]
    - [0, 11.512]
  - - [960, 3392, 1, 64, 960, 960, 960, 64]
    - [0, 11.76]
  - - [1088, 3392, 1, 64, 1088, 1088, 1088, 64]
    - [0, 11.82]
  - - [1216, 3392, 1, 64, 1216, 1216, 1216, 64]
    - [0, 11.842]
  - - [1344, 3392, 1, 64, 1344, 1344, 1344, 64]
    - [0, 11.447]
  - - [1472, 3392, 1, 64, 1472, 1472, 1472, 64]
    - [0, 11.512]
  - - [1600, 3392, 1, 64, 1600, 1600, 1600, 64]
    - [0, 11.657]
  - - [1728, 3392, 1, 64, 1728, 1728, 1728, 64]
    - [0, 11.667]
  - - [1856, 3392, 1, 64, 1856, 1856, 1856, 64]
    - [0, 11.797]
  - - [1984, 3392, 1, 64, 1984, 1984, 1984, 64]
    - [0, 11.928]
  - - [2112, 3392, 1, 64, 2112, 2112, 2112, 64]
    - [0, 11.946]
  - - [2240, 3392, 1, 64, 2240, 2240, 2240, 64]
    - [0, 11.953]
  - - [2368, 3392, 1, 64, 2368, 2368, 2368, 64]
    - [0, 11.994]
  - - [2496, 3392, 1, 64, 2496, 2496, 2496, 64]
    - [0, 11.607]
  - - [2624, 3392, 1, 64, 2624, 2624, 2624, 64]
    - [0, 11.048]
  - - [2752, 3392, 1, 64, 2752, 2752, 2752, 64]
    - [0, 10.124]
  - - [2880, 3392, 1, 64, 2880, 2880, 2880, 64]
    - [0, 9.78]
  - - [3008, 3392, 1, 64, 3008, 3008, 3008, 64]
    - [0, 9.694]
  - - [3136, 3392, 1, 64, 3136, 3136, 3136, 64]
    - [0, 9.618]
  - - [3264, 3392, 1, 64, 3264, 3264, 3264, 64]
    - [0, 9.813]
  - - [3392, 3392, 1, 64, 3392, 3392, 3392, 64]
    - [0, 9.794]
  - - [3520, 3392, 1, 64, 3520, 3520, 3520, 64]
    - [0, 9.782]
  - - [3648, 3392, 1, 64, 3648, 3648, 3648, 64]
    - [0, 9.617]
  - - [3776, 3392, 1, 64, 3776, 3776, 3776, 64]
    - [0, 9.731]
  - - [3904, 3392, 1, 64, 3904, 3904, 3904, 64]
    - [0, 9.758]
  - - [4032, 3392, 1, 64, 4032, 4032, 4032, 64]
    - [0, 9.814]
  - - [64, 3520, 1, 64, 64, 64, 64, 64]
    - [0, 5.032]
  - - [192, 3520, 1, 64, 192, 192, 192, 64]
    - [0, 8.367]
  - - [320, 3520, 1, 64, 320, 320, 320, 64]
    - [0, 9.741]
  - - [448, 3520, 1, 64, 448, 448, 448, 64]
    - [0, 10.54]
  - - [576, 3520, 1, 64, 576, 576, 576, 64]
    - [0, 10.891]
  - - [704, 3520, 1, 64, 704, 704, 704, 64]
    - [0, 11.356]
  - - [832, 3520, 1, 64, 832, 832, 832, 64]
    - [0, 11.461]
  - - [960, 3520, 1, 64, 960, 960, 960, 64]
    - [0, 11.716]
  - - [1088, 3520, 1, 64, 1088, 1088, 1088, 64]
    - [0, 11.868]
  - - [1216, 3520, 1, 64, 1216, 1216, 1216, 64]
    - [0, 11.066]
  - - [1344, 3520, 1, 64, 1344, 1344, 1344, 64]
    - [0, 11.536]
  - - [1472, 3520, 1, 64, 1472, 1472, 1472, 64]
    - [0, 11.648]
  - - [1600, 3520, 1, 64, 1600, 1600, 1600, 64]
    - [0, 11.624]
  - - [1728, 3520, 1, 64, 1728, 1728, 1728, 64]
    - [0, 11.756]
  - - [1856, 3520, 1, 64, 1856, 1856, 1856, 64]
    - [0, 11.882]
  - - [1984, 3520, 1, 64, 1984, 1984, 1984, 64]
    - [0, 11.949]
  - - [2112, 3520, 1, 64, 2112, 2112, 2112, 64]
    - [0, 11.981]
  - - [2240, 3520, 1, 64, 2240, 2240, 2240, 64]
    - [0, 12.053]
  - - [2368, 3520, 1, 64, 2368, 2368, 2368, 64]
    - [0, 11.616]
  - - [2496, 3520, 1, 64, 2496, 2496, 2496, 64]
    - [0, 11.338]
  - - [2624, 3520, 1, 64, 2624, 2624, 2624, 64]
    - [0, 10.556]
  - - [2752, 3520, 1, 64, 2752, 2752, 2752, 64]
    - [0, 9.83]
  - - [2880, 3520, 1, 64, 2880, 2880, 2880, 64]
    - [0, 9.696]
  - - [3008, 3520, 1, 64, 3008, 3008, 3008, 64]
    - [0, 9.63]
  - - [3136, 3520, 1, 64, 3136, 3136, 3136, 64]
    - [0, 9.675]
  - - [3264, 3520, 1, 64, 3264, 3264, 3264, 64]
    - [0, 9.796]
  - - [3392, 3520, 1, 64, 3392, 3392, 3392, 64]
    - [0, 9.749]
  - - [3520, 3520, 1, 64, 3520, 3520, 3520, 64]
    - [0, 9.72]
  - - [3648, 3520, 1, 64, 3648, 3648, 3648, 64]
    - [0, 9.595]
  - - [3776, 3520, 1, 64, 3776, 3776, 3776, 64]
    - [0, 9.758]
  - - [3904, 3520, 1, 64, 3904, 3904, 3904, 64]
    - [0, 9.763]
  - - [4032, 3520, 1, 64, 4032, 4032, 4032, 64]
    - [0, 9.808]
  - - [64, 3648, 1, 64, 64, 64, 64, 64]
    - [0, 5.182]
  - - [192, 3648, 1, 64, 192, 192, 192, 64]
    - [0, 8.484]
  - - [320, 3648, 1, 64, 320, 320, 320, 64]
    - [0, 9.79]
  - - [448, 3648, 1, 64, 448, 448, 448, 64]
    - [0, 10.568]
  - - [576, 3648, 1, 64, 576, 576, 576, 64]
    - [0, 11.013]
  - - [704, 3648, 1, 64, 704, 704, 704, 64]
    - [0, 11.288]
  - - [832, 3648, 1, 64, 832, 832, 832, 64]
    - [0, 11.56]
  - - [960, 3648, 1, 64, 960, 960, 960, 64]
    - [0, 11.805]
  - - [1088, 3648, 1, 64, 1088, 1088, 1088, 64]
    - [0, 11.867]
  - - [1216, 3648, 1, 64, 1216, 1216, 1216, 64]
    - [0, 11.149]
  - - [1344, 3648, 1, 64, 1344, 1344, 1344, 64]
    - [0, 11.498]
  - - [1472, 3648, 1, 64, 1472, 1472, 1472, 64]
    - [0, 11.55]
  - - [1600, 3648, 1, 64, 1600, 1600, 1600, 64]
    - [0, 11.749]
  - - [1728, 3648, 1, 64, 1728, 1728, 1728, 64]
    - [0, 11.842]
  - - [1856, 3648, 1, 64, 1856, 1856, 1856, 64]
    - [0, 11.859]
  - - [1984, 3648, 1, 64, 1984, 1984, 1984, 64]
    - [0, 11.973]
  - - [2112, 3648, 1, 64, 2112, 2112, 2112, 64]
    - [0, 12.024]
  - - [2240, 3648, 1, 64, 2240, 2240, 2240, 64]
    - [0, 11.899]
  - - [2368, 3648, 1, 64, 2368, 2368, 2368, 64]
    - [0, 11.561]
  - - [2496, 3648, 1, 64, 2496, 2496, 2496, 64]
    - [0, 10.714]
  - - [2624, 3648, 1, 64, 2624, 2624, 2624, 64]
    - [0, 9.64]
  - - [2752, 3648, 1, 64, 2752, 2752, 2752, 64]
    - [0, 9.827]
  - - [2880, 3648, 1, 64, 2880, 2880, 2880, 64]
    - [0, 9.788]
  - - [3008, 3648, 1, 64, 3008, 3008, 3008, 64]
    - [0, 9.654]
  - - [3136, 3648, 1, 64, 3136, 3136, 3136, 64]
    - [0, 9.634]
  - - [3264, 3648, 1, 64, 3264, 3264, 3264, 64]
    - [0, 9.79]
  - - [3392, 3648, 1, 64, 3392, 3392, 3392, 64]
    - [0, 9.728]
  - - [3520, 3648, 1, 64, 3520, 3520, 3520, 64]
    - [0, 9.732]
  - - [3648, 3648, 1, 64, 3648, 3648, 3648, 64]
    - [0, 9.612]
  - - [3776, 3648, 1, 64, 3776, 3776, 3776, 64]
    - [0, 9.781]
  - - [3904, 3648, 1, 64, 3904, 3904, 3904, 64]
    - [0, 9.843]
  - - [4032, 3648, 1, 64, 4032, 4032, 4032, 64]
    - [0, 9.821]
  - - [64, 3776, 1, 64, 64, 64, 64, 64]
    - [0, 5.36]
  - - [192, 3776, 1, 64, 192, 192, 192, 64]
    - [0, 8.458]
  - - [320, 3776, 1, 64, 320, 320, 320, 64]
    - [0, 9.88]
  - - [448, 3776, 1, 64, 448, 448, 448, 64]
    - [0, 10.616]
  - - [576, 3776, 1, 64, 576, 576, 576, 64]
    - [0, 11.151]
  - - [704, 3776, 1, 64, 704, 704, 704, 64]
    - [0, 11.414]
  - - [832, 3776, 1, 64, 832, 832, 832, 64]
    - [0, 11.595]
  - - [960, 3776, 1, 64, 960, 960, 960, 64]
    - [0, 11.797]
  - - [1088, 3776, 1, 64, 1088, 1088, 1088, 64]
    - [0, 11.955]
  - - [1216, 3776, 1, 64, 1216, 1216, 1216, 64]
    - [0, 11.455]
  - - [1344, 3776, 1, 64, 1344, 1344, 1344, 64]
    - [0, 11.567]
  - - [1472, 3776, 1, 64, 1472, 1472, 1472, 64]
    - [0, 11.68]
  - - [1600, 3776, 1, 64, 1600, 1600, 1600, 64]
    - [0, 11.763]
  - - [1728, 3776, 1, 64, 1728, 1728, 1728, 64]
    - [0, 11.796]
  - - [1856, 3776, 1, 64, 1856, 1856, 1856, 64]
    - [0, 11.904]
  - - [1984, 3776, 1, 64, 1984, 1984, 1984, 64]
    - [0, 11.997]
  - - [2112, 3776, 1, 64, 2112, 2112, 2112, 64]
    - [0, 11.969]
  - - [2240, 3776, 1, 64, 2240, 2240, 2240, 64]
    - [0, 11.601]
  - - [2368, 3776, 1, 64, 2368, 2368, 2368, 64]
    - [0, 10.976]
  - - [2496, 3776, 1, 64, 2496, 2496, 2496, 64]
    - [0, 9.818]
  - - [2624, 3776, 1, 64, 2624, 2624, 2624, 64]
    - [0, 9.687]
  - - [2752, 3776, 1, 64, 2752, 2752, 2752, 64]
    - [0, 9.842]
  - - [2880, 3776, 1, 64, 2880, 2880, 2880, 64]
    - [0, 9.761]
  - - [3008, 3776, 1, 64, 3008, 3008, 3008, 64]
    - [0, 9.672]
  - - [3136, 3776, 1, 64, 3136, 3136, 3136, 64]
    - [0, 9.606]
  - - [3264, 3776, 1, 64, 3264, 3264, 3264, 64]
    - [0, 9.814]
  - - [3392, 3776, 1, 64, 3392, 3392, 3392, 64]
    - [0, 9.708]
  - - [3520, 3776, 1, 64, 3520, 3520, 3520, 64]
    - [0, 9.785]
  - - [3648, 3776, 1, 64, 3648, 3648, 3648, 64]
    - [0, 9.667]
  - - [3776, 3776, 1, 64, 3776, 3776, 3776, 64]
    - [0, 9.783]
  - - [3904, 3776, 1, 64, 3904, 3904, 3904, 64]
    - [0, 9.802]
  - - [4032, 3776, 1, 64, 4032, 4032, 4032, 64]
    - [0, 9.787]
  - - [64, 3904, 1, 64, 64, 64, 64, 64]
    - [0, 5.323]
  - - [192, 3904, 1, 64, 192, 192, 192, 64]
    - [0, 8.562]
  - - [320, 3904, 1, 64, 320, 320, 320, 64]
    - [0, 9.934]
  - - [448, 3904, 1, 64, 448, 448, 448, 64]
    - [0, 10.653]
  - - [576, 3904, 1, 64, 576, 576, 576, 64]
    - [0, 11.189]
  - - [704, 3904, 1, 64, 704, 704, 704, 64]
    - [0, 11.498]
  - - [832, 3904, 1, 64, 832, 832, 832, 64]
    - [0, 11.724]
  - - [960, 3904, 1, 64, 960, 960, 960, 64]
    - [0, 11.807]
  - - [1088, 3904, 1, 64, 1088, 1088, 1088, 64]
    - [0, 11.931]
  - - [1216, 3904, 1, 64, 1216, 1216, 1216, 64]
    - [0, 11.523]
  - - [1344, 3904, 1, 64, 1344, 1344, 1344, 64]
    - [0, 11.513]
  - - [1472, 3904, 1, 64, 1472, 1472, 1472, 64]
    - [0, 11.649]
  - - [1600, 3904, 1, 64, 1600, 1600, 1600, 64]
    - [0, 11.859]
  - - [1728, 3904, 1, 64, 1728, 1728, 1728, 64]
    - [0, 11.85]
  - - [1856, 3904, 1, 64, 1856, 1856, 1856, 64]
    - [0, 11.899]
  - - [1984, 3904, 1, 64, 1984, 1984, 1984, 64]
    - [0, 12.013]
  - - [2112, 3904, 1, 64, 2112, 2112, 2112, 64]
    - [0, 11.815]
  - - [2240, 3904, 1, 64, 2240, 2240, 2240, 64]
    - [0, 11.432]
  - - [2368, 3904, 1, 64, 2368, 2368, 2368, 64]
    - [0, 10.576]
  - - [2496, 3904, 1, 64, 2496, 2496, 2496, 64]
    - [0, 9.8]
  - - [2624, 3904, 1, 64, 2624, 2624, 2624, 64]
    - [0, 9.682]
  - - [2752, 3904, 1, 64, 2752, 2752, 2752, 64]
    - [0, 9.832]
  - - [2880, 3904, 1, 64, 2880, 2880, 2880, 64]
    - [0, 9.786]
  - - [3008, 3904, 1, 64, 3008, 3008, 3008, 64]
    - [0, 9.654]
  - - [3136, 3904, 1, 64, 3136, 3136, 3136, 64]
    - [0, 9.639]
  - - [3264, 3904, 1, 64, 3264, 3264, 3264, 64]
    - [0, 9.764]
  - - [3392, 3904, 1, 64, 3392, 3392, 3392, 64]
    - [0, 9.793]
  - - [3520, 3904, 1, 64, 3520, 3520, 3520, 64]
    - [0, 9.785]
  - - [3648, 3904, 1, 64, 3648, 3648, 3648, 64]
    - [0, 9.64]
  - - [3776, 3904, 1, 64, 3776, 3776, 3776, 64]
    - [0, 9.814]
  - - [3904, 3904, 1, 64, 3904, 3904, 3904, 64]
    - [0, 9.813]
  - - [4032, 3904, 1, 64, 4032, 4032, 4032, 64]
    - [0, 9.854]
  - - [64, 4032, 1, 64, 64, 64, 64, 64]
    - [0, 5.458]
  - - [192, 4032, 1, 64, 192, 192, 192, 64]
    - [0, 8.734]
  - - [320, 4032, 1, 64, 320, 320, 320, 64]
    - [0, 10.05]
  - - [448, 4032, 1, 64, 448, 448, 448, 64]
    - [0, 10.693]
  - - [576, 4032, 1, 64, 576, 576, 576, 64]
    - [0, 11.188]
  - - [704, 4032, 1, 64, 704, 704, 704, 64]
    - [0, 11.462]
  - - [832, 4032, 1, 64, 832, 832, 832, 64]
    - [0, 11.645]
  - - [960, 4032, 1, 64, 960, 960, 960, 64]
    - [0, 11.852]
  - - [1088, 4032, 1, 64, 1088, 1088, 1088, 64]
    - [0, 11.035]
  - - [1216, 4032, 1, 64, 1216, 1216, 1216, 64]
    - [0, 11.542]
  - - [1344, 4032, 1, 64, 1344, 1344, 1344, 64]
    - [0, 11.664]
  - - [1472, 4032, 1, 64, 1472, 1472, 1472, 64]
    - [0, 11.683]
  - - [1600, 4032, 1, 64, 1600, 1600, 1600, 64]
    - [0, 11.829]
  - - [1728, 4032, 1, 64, 1728, 1728, 1728, 64]
    - [0, 11.936]
  - - [1856, 4032, 1, 64, 1856, 1856, 1856, 64]
    - [0, 11.979]
  - - [1984, 4032, 1, 64, 1984, 1984, 1984, 64]
    - [0, 12.047]
  - - [2112, 4032, 1, 64, 2112, 2112, 2112, 64]
    - [0, 11.552]
  - - [2240, 4032, 1, 64, 2240, 2240, 2240, 64]
    - [0, 10.802]
  - - [2368, 4032, 1, 64, 2368, 2368, 2368, 64]
    - [0, 9.875]
  - - [2496, 4032, 1, 64, 2496, 2496, 2496, 64]
    - [0, 9.795]
  - - [2624, 4032, 1, 64, 2624, 2624, 2624, 64]
    - [0, 9.683]
  - - [2752, 4032, 1, 64, 2752, 2752, 2752, 64]
    - [0, 9.85]
  - - [2880, 4032, 1, 64, 2880, 2880, 2880, 64]
    - [0, 9.796]
  - - [3008, 4032, 1, 64, 3008, 3008, 3008, 64]
    - [0, 9.653]
  - - [3136, 4032, 1, 64, 3136, 3136, 3136, 64]
    - [0, 9.605]
  - - [3264, 4032, 1, 64, 3264, 3264, 3264, 64]
    - [0, 9.816]
  - - [3392, 4032, 1, 64, 3392, 3392, 3392, 64]
    - [0, 9.808]
  - - [3520, 4032, 1, 64, 3520, 3520, 3520, 64]
    - [0, 9.805]
  - - [3648, 4032, 1, 64, 3648, 3648, 3648, 64]
    - [0, 9.693]
  - - [3776, 4032, 1, 64, 3776, 3776, 3776, 64]
    - [0, 9.833]
  - - [3904, 4032, 1, 64, 3904, 3904, 3904, 64]
    - [0, 9.859]
  - - [4032, 4032, 1, 64, 4032, 4032, 4032, 64]
    - [0, 9.779]
  - - [64, 64, 1, 256, 64, 64, 64, 256]
    - [1, 0.514]
  - - [192, 64, 1, 256, 192, 192, 192, 256]
    - [2, 1.517]
  - - [320, 64, 1, 256, 320, 320, 320, 256]
    - [0, 2.262]
  - - [448, 64, 1, 256, 448, 448, 448, 256]
    - [0, 3.158]
  - - [576, 64, 1, 256, 576, 576, 576, 256]
    - [2, 3.436]
  - - [704, 64, 1, 256, 704, 704, 704, 256]
    - [2, 4.196]
  - - [832, 64, 1, 256, 832, 832, 832, 256]
    - [0, 4.717]
  - - [960, 64, 1, 256, 960, 960, 960, 256]
    - [0, 5.422]
  - - [1088, 64, 1, 256, 1088, 1088, 1088, 256]
    - [2, 5.175]
  - - [1216, 64, 1, 256, 1216, 1216, 1216, 256]
    - [0, 5.701]
  - - [1344, 64, 1, 256, 1344, 1344, 1344, 256]
    - [0, 6.272]
  - - [1472, 64, 1, 256, 1472, 1472, 1472, 256]
    - [0, 5.983]
  - - [1600, 64, 1, 256, 1600, 1600, 1600, 256]
    - [0, 6.402]
  - - [1728, 64, 1, 256, 1728, 1728, 1728, 256]
    - [0, 6.908]
  - - [1856, 64, 1, 256, 1856, 1856, 1856, 256]
    - [0, 7.409]
  - - [1984, 64, 1, 256, 1984, 1984, 1984, 256]
    - [0, 6.991]
  - - [2112, 64, 1, 256, 2112, 2112, 2112, 256]
    - [0, 7.354]
  - - [2240, 64, 1, 256, 2240, 2240, 2240, 256]
    - [0, 7.745]
  - - [2368, 64, 1, 256, 2368, 2368, 2368, 256]
    - [0, 8.173]
  - - [2496, 64, 1, 256, 2496, 2496, 2496, 256]
    - [0, 7.715]
  - - [2624, 64, 1, 256, 2624, 2624, 2624, 256]
    - [0, 8.071]
  - - [2752, 64, 1, 256, 2752, 2752, 2752, 256]
    - [0, 8.456]
  - - [2880, 64, 1, 256, 2880, 2880, 2880, 256]
    - [0, 8.811]
  - - [3008, 64, 1, 256, 3008, 3008, 3008, 256]
    - [0, 8.35]
  - - [3136, 64, 1, 256, 3136, 3136, 3136, 256]
    - [0, 8.636]
  - - [3264, 64, 1, 256, 3264, 3264, 3264, 256]
    - [0, 9.028]
  - - [3392, 64, 1, 256, 3392, 3392, 3392, 256]
    - [0, 8.625]
  - - [3520, 64, 1, 256, 3520, 3520, 3520, 256]
    - [0, 8.862]
  - - [3648, 64, 1, 256, 3648, 3648, 3648, 256]
    - [0, 9.151]
  - - [3776, 64, 1, 256, 3776, 3776, 3776, 256]
    - [0, 9.446]
  - - [3904, 64, 1, 256, 3904, 3904, 3904, 256]
    - [2, 9.224]
  - - [4032, 64, 1, 256, 4032, 4032, 4032, 256]
    - [2, 9.326]
  - - [64, 192, 1, 256, 64, 64, 64, 256]
    - [2, 1.529]
  - - [192, 192, 1, 256, 192, 192, 192, 256]
    - [2, 3.459]
  - - [320, 192, 1, 256, 320, 320, 320, 256]
    - [0, 5.472]
  - - [448, 192, 1, 256, 448, 448, 448, 256]
    - [0, 6.322]
  - - [576, 192, 1, 256, 576, 576, 576, 256]
    - [0, 6.933]
  - - [704, 192, 1, 256, 704, 704, 704, 256]
    - [0, 7.418]
  - - [832, 192, 1, 256, 832, 832, 832, 256]
    - [2, 7.873]
  - - [960, 192, 1, 256, 960, 960, 960, 256]
    - [0, 8.951]
  - - [1088, 192, 1, 256, 1088, 1088, 1088, 256]
    - [0, 9.08]
  - - [1216, 192, 1, 256, 1216, 1216, 1216, 256]
    - [0, 9.203]
  - - [1344, 192, 1, 256, 1344, 1344, 1344, 256]
    - [0, 9.357]
  - - [1472, 192, 1, 256, 1472, 1472, 1472, 256]
    - [2, 9.487]
  - - [1600, 192, 1, 256, 1600, 1600, 1600, 256]
    - [0, 10.127]
  - - [1728, 192, 1, 256, 1728, 1728, 1728, 256]
    - [0, 10.236]
  - - [1856, 192, 1, 256, 1856, 1856, 1856, 256]
    - [0, 10.243]
  - - [1984, 192, 1, 256, 1984, 1984, 1984, 256]
    - [0, 10.289]
  - - [2112, 192, 1, 256, 2112, 2112, 2112, 256]
    - [0, 10.326]
  - - [2240, 192, 1, 256, 2240, 2240, 2240, 256]
    - [0, 10.734]
  - - [2368, 192, 1, 256, 2368, 2368, 2368, 256]
    - [0, 10.839]
  - - [2496, 192, 1, 256, 2496, 2496, 2496, 256]
    - [0, 10.842]
  - - [2624, 192, 1, 256, 2624, 2624, 2624, 256]
    - [2, 10.929]
  - - [2752, 192, 1, 256, 2752, 2752, 2752, 256]
    - [2, 10.957]
  - - [2880, 192, 1, 256, 2880, 2880, 2880, 256]
    - [0, 11.213]
  - - [3008, 192, 1, 256, 3008, 3008, 3008, 256]
    - [0, 11.26]
  - - [3136, 192, 1, 256, 3136, 3136, 3136, 256]
    - [0, 11.266]
  - - [3264, 192, 1, 256, 3264, 3264, 3264, 256]
    - [2, 11.287]
  - - [3392, 192, 1, 256, 3392, 3392, 3392, 256]
    - [2, 11.426]
  - - [3520, 192, 1, 256, 3520, 3520, 3520, 256]
    - [0, 11.493]
  - - [3648, 192, 1, 256, 3648, 3648, 3648, 256]
    - [0, 11.538]
  - - [3776, 192, 1, 256, 3776, 3776, 3776, 256]
    - [0, 11.543]
  - - [3904, 192, 1, 256, 3904, 3904, 3904, 256]
    - [0, 11.584]
  - - [4032, 192, 1, 256, 4032, 4032, 4032, 256]
    - [2, 11.761]
  - - [64, 320, 1, 256, 64, 64, 64, 256]
    - [0, 1.499]
  - - [192, 320, 1, 256, 192, 192, 192, 256]
    - [0, 4.493]
  - - [320, 320, 1, 256, 320, 320, 320, 256]
    - [0, 6.457]
  - - [448, 320, 1, 256, 448, 448, 448, 256]
    - [0, 7.841]
  - - [576, 320, 1, 256, 576, 576, 576, 256]
    - [0, 8.903]
  - - [704, 320, 1, 256, 704, 704, 704, 256]
    - [0, 8.928]
  - - [832, 320, 1, 256, 832, 832, 832, 256]
    - [0, 9.626]
  - - [960, 320, 1, 256, 960, 960, 960, 256]
    - [0, 10.166]
  - - [1088, 320, 1, 256, 1088, 1088, 1088, 256]
    - [0, 10.056]
  - - [1216, 320, 1, 256, 1216, 1216, 1216, 256]
    - [0, 10.521]
  - - [1344, 320, 1, 256, 1344, 1344, 1344, 256]
    - [0, 10.672]
  - - [1472, 320, 1, 256, 1472, 1472, 1472, 256]
    - [2, 10.915]
  - - [1600, 320, 1, 256, 1600, 1600, 1600, 256]
    - [0, 11.027]
  - - [1728, 320, 1, 256, 1728, 1728, 1728, 256]
    - [0, 11.198]
  - - [1856, 320, 1, 256, 1856, 1856, 1856, 256]
    - [2, 11.312]
  - - [1984, 320, 1, 256, 1984, 1984, 1984, 256]
    - [0, 11.379]
  - - [2112, 320, 1, 256, 2112, 2112, 2112, 256]
    - [0, 11.553]
  - - [2240, 320, 1, 256, 2240, 2240, 2240, 256]
    - [2, 11.542]
  - - [2368, 320, 1, 256, 2368, 2368, 2368, 256]
    - [0, 11.653]
  - - [2496, 320, 1, 256, 2496, 2496, 2496, 256]
    - [0, 11.742]
  - - [2624, 320, 1, 256, 2624, 2624, 2624, 256]
    - [0, 11.673]
  - - [2752, 320, 1, 256, 2752, 2752, 2752, 256]
    - [0, 11.8]
  - - [2880, 320, 1, 256, 2880, 2880, 2880, 256]
    - [0, 11.971]
  - - [3008, 320, 1, 256, 3008, 3008, 3008, 256]
    - [2, 11.912]
  - - [3136, 320, 1, 256, 3136, 3136, 3136, 256]
    - [2, 12.112]
  - - [3264, 320, 1, 256, 3264, 3264, 3264, 256]
    - [0, 12.045]
  - - [3392, 320, 1, 256, 3392, 3392, 3392, 256]
    - [2, 11.565]
  - - [3520, 320, 1, 256, 3520, 3520, 3520, 256]
    - [2, 11.382]
  - - [3648, 320, 1, 256, 3648, 3648, 3648, 256]
    - [0, 11.603]
  - - [3776, 320, 1, 256, 3776, 3776, 3776, 256]
    - [0, 11.675]
  - - [3904, 320, 1, 256, 3904, 3904, 3904, 256]
    - [0, 11.615]
  - - [4032, 320, 1, 256, 4032, 4032, 4032, 256]
    - [2, 11.724]
  - - [64, 448, 1, 256, 64, 64, 64, 256]
    - [0, 3.196]
  - - [192, 448, 1, 256, 192, 192, 192, 256]
    - [0, 6.324]
  - - [320, 448, 1, 256, 320, 320, 320, 256]
    - [0, 7.833]
  - - [448, 448, 1, 256, 448, 448, 448, 256]
    - [2, 8.812]
  - - [576, 448, 1, 256, 576, 576, 576, 256]
    - [2, 9.439]
  - - [704, 448, 1, 256, 704, 704, 704, 256]
    - [0, 9.787]
  - - [832, 448, 1, 256, 832, 832, 832, 256]
    - [2, 10.168]
  - - [960, 448, 1, 256, 960, 960, 960, 256]
    - [0, 10.847]
  - - [1088, 448, 1, 256, 1088, 1088, 1088, 256]
    - [2, 11.036]
  - - [1216, 448, 1, 256, 1216, 1216, 1216, 256]
    - [0, 11.136]
  - - [1344, 448, 1, 256, 1344, 1344, 1344, 256]
    - [0, 11.268]
  - - [1472, 448, 1, 256, 1472, 1472, 1472, 256]
    - [0, 11.361]
  - - [1600, 448, 1, 256, 1600, 1600, 1600, 256]
    - [2, 11.53]
  - - [1728, 448, 1, 256, 1728, 1728, 1728, 256]
    - [0, 11.562]
  - - [1856, 448, 1, 256, 1856, 1856, 1856, 256]
    - [2, 11.805]
  - - [1984, 448, 1, 256, 1984, 1984, 1984, 256]
    - [0, 11.911]
  - - [2112, 448, 1, 256, 2112, 2112, 2112, 256]
    - [0, 11.937]
  - - [2240, 448, 1, 256, 2240, 2240, 2240, 256]
    - [2, 12.023]
  - - [2368, 448, 1, 256, 2368, 2368, 2368, 256]
    - [0, 11.964]
  - - [2496, 448, 1, 256, 2496, 2496, 2496, 256]
    - [2, 11.38]
  - - [2624, 448, 1, 256, 2624, 2624, 2624, 256]
    - [0, 11.62]
  - - [2752, 448, 1, 256, 2752, 2752, 2752, 256]
    - [0, 11.64]
  - - [2880, 448, 1, 256, 2880, 2880, 2880, 256]
    - [2, 11.751]
  - - [3008, 448, 1, 256, 3008, 3008, 3008, 256]
    - [0, 11.768]
  - - [3136, 448, 1, 256, 3136, 3136, 3136, 256]
    - [2, 11.886]
  - - [3264, 448, 1, 256, 3264, 3264, 3264, 256]
    - [2, 11.929]
  - - [3392, 448, 1, 256, 3392, 3392, 3392, 256]
    - [0, 11.927]
  - - [3520, 448, 1, 256, 3520, 3520, 3520, 256]
    - [2, 12.041]
  - - [3648, 448, 1, 256, 3648, 3648, 3648, 256]
    - [2, 12.048]
  - - [3776, 448, 1, 256, 3776, 3776, 3776, 256]
    - [2, 12.181]
  - - [3904, 448, 1, 256, 3904, 3904, 3904, 256]
    - [2, 12.154]
  - - [4032, 448, 1, 256, 4032, 4032, 4032, 256]
    - [2, 12.226]
  - - [64, 576, 1, 256, 64, 64, 64, 256]
    - [2, 3.473]
  - - [192, 576, 1, 256, 192, 192, 192, 256]
    - [0, 6.935]
  - - [320, 576, 1, 256, 320, 320, 320, 256]
    - [0, 8.917]
  - - [448, 576, 1, 256, 448, 448, 448, 256]
    - [0, 9.414]
  - - [576, 576, 1, 256, 576, 576, 576, 256]
    - [0, 10.25]
  - - [704, 576, 1, 256, 704, 704, 704, 256]
    - [0, 10.367]
  - - [832, 576, 1, 256, 832, 832, 832, 256]
    - [0, 10.85]
  - - [960, 576, 1, 256, 960, 960, 960, 256]
    - [0, 11.14]
  - - [1088, 576, 1, 256, 1088, 1088, 1088, 256]
    - [0, 11.216]
  - - [1216, 576, 1, 256, 1216, 1216, 1216, 256]
    - [0, 11.563]
  - - [1344, 576, 1, 256, 1344, 1344, 1344, 256]
    - [2, 11.687]
  - - [1472, 576, 1, 256, 1472, 1472, 1472, 256]
    - [2, 11.845]
  - - [1600, 576, 1, 256, 1600, 1600, 1600, 256]
    - [0, 11.946]
  - - [1728, 576, 1, 256, 1728, 1728, 1728, 256]
    - [2, 11.926]
  - - [1856, 576, 1, 256, 1856, 1856, 1856, 256]
    - [0, 12.049]
  - - [1984, 576, 1, 256, 1984, 1984, 1984, 256]
    - [0, 11.468]
  - - [2112, 576, 1, 256, 2112, 2112, 2112, 256]
    - [2, 11.655]
  - - [2240, 576, 1, 256, 2240, 2240, 2240, 256]
    - [2, 11.755]
  - - [2368, 576, 1, 256, 2368, 2368, 2368, 256]
    - [2, 11.824]
  - - [2496, 576, 1, 256, 2496, 2496, 2496, 256]
    - [2, 11.964]
  - - [2624, 576, 1, 256, 2624, 2624, 2624, 256]
    - [2, 11.927]
  - - [2752, 576, 1, 256, 2752, 2752, 2752, 256]
    - [2, 12.064]
  - - [2880, 576, 1, 256, 2880, 2880, 2880, 256]
    - [0, 12.053]
  - - [3008, 576, 1, 256, 3008, 3008, 3008, 256]
    - [2, 12.142]
  - - [3136, 576, 1, 256, 3136, 3136, 3136, 256]
    - [2, 12.21]
  - - [3264, 576, 1, 256, 3264, 3264, 3264, 256]
    - [2, 12.219]
  - - [3392, 576, 1, 256, 3392, 3392, 3392, 256]
    - [2, 12.237]
  - - [3520, 576, 1, 256, 3520, 3520, 3520, 256]
    - [2, 12.352]
  - - [3648, 576, 1, 256, 3648, 3648, 3648, 256]
    - [2, 12.346]
  - - [3776, 576, 1, 256, 3776, 3776, 3776, 256]
    - [2, 12.406]
  - - [3904, 576, 1, 256, 3904, 3904, 3904, 256]
    - [2, 12.392]
  - - [4032, 576, 1, 256, 4032, 4032, 4032, 256]
    - [2, 12.433]
  - - [64, 704, 1, 256, 64, 64, 64, 256]
    - [2, 3.302]
  - - [192, 704, 1, 256, 192, 192, 192, 256]
    - [0, 7.398]
  - - [320, 704, 1, 256, 320, 320, 320, 256]
    - [2, 9.007]
  - - [448, 704, 1, 256, 448, 448, 448, 256]
    - [2, 9.837]
  - - [576, 704, 1, 256, 576, 576, 576, 256]
    - [2, 10.504]
  - - [704, 704, 1, 256, 704, 704, 704, 256]
    - [2, 10.729]
  - - [832, 704, 1, 256, 832, 832, 832, 256]
    - [2, 11.13]
  - - [960, 704, 1, 256, 960, 960, 960, 256]
    - [2, 11.452]
  - - [1088, 704, 1, 256, 1088, 1088, 1088, 256]
    - [0, 11.74]
  - - [1216, 704, 1, 256, 1216, 1216, 1216, 256]
    - [0, 11.811]
  - - [1344, 704, 1, 256, 1344, 1344, 1344, 256]
    - [0, 11.974]
  - - [1472, 704, 1, 256, 1472, 1472, 1472, 256]
    - [2, 12.075]
  - - [1600, 704, 1, 256, 1600, 1600, 1600, 256]
    - [2, 11.508]
  - - [1728, 704, 1, 256, 1728, 1728, 1728, 256]
    - [2, 11.657]
  - - [1856, 704, 1, 256, 1856, 1856, 1856, 256]
    - [2, 11.734]
  - - [1984, 704, 1, 256, 1984, 1984, 1984, 256]
    - [2, 11.915]
  - - [2112, 704, 1, 256, 2112, 2112, 2112, 256]
    - [2, 11.968]
  - - [2240, 704, 1, 256, 2240, 2240, 2240, 256]
    - [2, 11.988]
  - - [2368, 704, 1, 256, 2368, 2368, 2368, 256]
    - [2, 12.052]
  - - [2496, 704, 1, 256, 2496, 2496, 2496, 256]
    - [2, 12.22]
  - - [2624, 704, 1, 256, 2624, 2624, 2624, 256]
    - [2, 12.185]
  - - [2752, 704, 1, 256, 2752, 2752, 2752, 256]
    - [2, 12.301]
  - - [2880, 704, 1, 256, 2880, 2880, 2880, 256]
    - [2, 12.298]
  - - [3008, 704, 1, 256, 3008, 3008, 3008, 256]
    - [2, 12.385]
  - - [3136, 704, 1, 256, 3136, 3136, 3136, 256]
    - [2, 12.379]
  - - [3264, 704, 1, 256, 3264, 3264, 3264, 256]
    - [2, 12.504]
  - - [3392, 704, 1, 256, 3392, 3392, 3392, 256]
    - [2, 12.533]
  - - [3520, 704, 1, 256, 3520, 3520, 3520, 256]
    - [2, 12.473]
  - - [3648, 704, 1, 256, 3648, 3648, 3648, 256]
    - [2, 12.563]
  - - [3776, 704, 1, 256, 3776, 3776, 3776, 256]
    - [2, 12.545]
  - - [3904, 704, 1, 256, 3904, 3904, 3904, 256]
    - [2, 12.574]
  - - [4032, 704, 1, 256, 4032, 4032, 4032, 256]
    - [2, 12.715]
  - - [64, 832, 1, 256, 64, 64, 64, 256]
    - [0, 3.898]
  - - [192, 832, 1, 256, 192, 192, 192, 256]
    - [2, 7.841]
  - - [320, 832, 1, 256, 320, 320, 320, 256]
    - [0, 9.632]
  - - [448, 832, 1, 256, 448, 448, 448, 256]
    - [0, 10.148]
  - - [576, 832, 1, 256, 576, 576, 576, 256]
    - [0, 10.896]
  - - [704, 832, 1, 256, 704, 704, 704, 256]
    - [2, 11.099]
  - - [832, 832, 1, 256, 832, 832, 832, 256]
    - [2, 11.516]
  - - [960, 832, 1, 256, 960, 960, 960, 256]
    - [2, 11.772]
  - - [1088, 832, 1, 256, 1088, 1088, 1088, 256]
    - [2, 11.941]
  - - [1216, 832, 1, 256, 1216, 1216, 1216, 256]
    - [0, 12.006]
  - - [1344, 832, 1, 256, 1344, 1344, 1344, 256]
    - [2, 11.724]
  - - [1472, 832, 1, 256, 1472, 1472, 1472, 256]
    - [2, 11.65]
  - - [1600, 832, 1, 256, 1600, 1600, 1600, 256]
    - [2, 11.781]
  - - [1728, 832, 1, 256, 1728, 1728, 1728, 256]
    - [2, 11.866]
  - - [1856, 832, 1, 256, 1856, 1856, 1856, 256]
    - [2, 11.945]
  - - [1984, 832, 1, 256, 1984, 1984, 1984, 256]
    - [2, 12.017]
  - - [2112, 832, 1, 256, 2112, 2112, 2112, 256]
    - [2, 12.193]
  - - [2240, 832, 1, 256, 2240, 2240, 2240, 256]
    - [2, 12.216]
  - - [2368, 832, 1, 256, 2368, 2368, 2368, 256]
    - [2, 12.315]
  - - [2496, 832, 1, 256, 2496, 2496, 2496, 256]
    - [2, 12.375]
  - - [2624, 832, 1, 256, 2624, 2624, 2624, 256]
    - [2, 12.387]
  - - [2752, 832, 1, 256, 2752, 2752, 2752, 256]
    - [2, 12.444]
  - - [2880, 832, 1, 256, 2880, 2880, 2880, 256]
    - [2, 12.492]
  - - [3008, 832, 1, 256, 3008, 3008, 3008, 256]
    - [2, 12.514]
  - - [3136, 832, 1, 256, 3136, 3136, 3136, 256]
    - [0, 12.477]
  - - [3264, 832, 1, 256, 3264, 3264, 3264, 256]
    - [2, 12.618]
  - - [3392, 832, 1, 256, 3392, 3392, 3392, 256]
    - [2, 12.619]
  - - [3520, 832, 1, 256, 3520, 3520, 3520, 256]
    - [2, 12.652]
  - - [3648, 832, 1, 256, 3648, 3648, 3648, 256]
    - [2, 12.691]
  - - [3776, 832, 1, 256, 3776, 3776, 3776, 256]
    - [2, 12.722]
  - - [3904, 832, 1, 256, 3904, 3904, 3904, 256]
    - [2, 12.723]
  - - [4032, 832, 1, 256, 4032, 4032, 4032, 256]
    - [2, 12.767]
  - - [64, 960, 1, 256, 64, 64, 64, 256]
    - [0, 5.483]
  - - [192, 960, 1, 256, 192, 192, 192, 256]
    - [0, 8.94]
  - - [320, 960, 1, 256, 320, 320, 320, 256]
    - [0, 9.897]
  - - [448, 960, 1, 256, 448, 448, 448, 256]
    - [0, 10.788]
  - - [576, 960, 1, 256, 576, 576, 576, 256]
    - [0, 11.187]
  - - [704, 960, 1, 256, 704, 704, 704, 256]
    - [0, 11.51]
  - - [832, 960, 1, 256, 832, 832, 832, 256]
    - [0, 11.746]
  - - [960, 960, 1, 256, 960, 960, 960, 256]
    - [0, 11.939]
  - - [1088, 960, 1, 256, 1088, 1088, 1088, 256]
    - [0, 12.075]
  - - [1216, 960, 1, 256, 1216, 1216, 1216, 256]
    - [2, 11.528]
  - - [1344, 960, 1, 256, 1344, 1344, 1344, 256]
    - [2, 11.77]
  - - [1472, 960, 1, 256, 1472, 1472, 1472, 256]
    - [2, 11.836]
  - - [1600, 960, 1, 256, 1600, 1600, 1600, 256]
    - [2, 11.953]
  - - [1728, 960, 1, 256, 1728, 1728, 1728, 256]
    - [2, 12.088]
  - - [1856, 960, 1, 256, 1856, 1856, 1856, 256]
    - [2, 12.18]
  - - [1984, 960, 1, 256, 1984, 1984, 1984, 256]
    - [2, 12.226]
  - - [2112, 960, 1, 256, 2112, 2112, 2112, 256]
    - [2, 12.316]
  - - [2240, 960, 1, 256, 2240, 2240, 2240, 256]
    - [2, 12.359]
  - - [2368, 960, 1, 256, 2368, 2368, 2368, 256]
    - [2, 12.47]
  - - [2496, 960, 1, 256, 2496, 2496, 2496, 256]
    - [2, 12.532]
  - - [2624, 960, 1, 256, 2624, 2624, 2624, 256]
    - [2, 12.526]
  - - [2752, 960, 1, 256, 2752, 2752, 2752, 256]
    - [2, 12.527]
  - - [2880, 960, 1, 256, 2880, 2880, 2880, 256]
    - [2, 12.58]
  - - [3008, 960, 1, 256, 3008, 3008, 3008, 256]
    - [2, 12.659]
  - - [3136, 960, 1, 256, 3136, 3136, 3136, 256]
    - [2, 12.681]
  - - [3264, 960, 1, 256, 3264, 3264, 3264, 256]
    - [2, 12.737]
  - - [3392, 960, 1, 256, 3392, 3392, 3392, 256]
    - [2, 12.696]
  - - [3520, 960, 1, 256, 3520, 3520, 3520, 256]
    - [2, 12.736]
  - - [3648, 960, 1, 256, 3648, 3648, 3648, 256]
    - [2, 12.8]
  - - [3776, 960, 1, 256, 3776, 3776, 3776, 256]
    - [2, 12.784]
  - - [3904, 960, 1, 256, 3904, 3904, 3904, 256]
    - [2, 12.87]
  - - [4032, 960, 1, 256, 4032, 4032, 4032, 256]
    - [2, 12.845]
  - - [64, 1088, 1, 256, 64, 64, 64, 256]
    - [2, 5.251]
  - - [192, 1088, 1, 256, 192, 192, 192, 256]
    - [0, 9.101]
  - - [320, 1088, 1, 256, 320, 320, 320, 256]
    - [0, 10.055]
  - - [448, 1088, 1, 256, 448, 448, 448, 256]
    - [0, 10.989]
  - - [576, 1088, 1, 256, 576, 576, 576, 256]
    - [2, 11.382]
  - - [704, 1088, 1, 256, 704, 704, 704, 256]
    - [0, 11.657]
  - - [832, 1088, 1, 256, 832, 832, 832, 256]
    - [2, 11.887]
  - - [960, 1088, 1, 256, 960, 960, 960, 256]
    - [0, 12.089]
  - - [1088, 1088, 1, 256, 1088, 1088, 1088, 256]
    - [0, 11.569]
  - - [1216, 1088, 1, 256, 1216, 1216, 1216, 256]
    - [2, 11.811]
  - - [1344, 1088, 1, 256, 1344, 1344, 1344, 256]
    - [2, 11.944]
  - - [1472, 1088, 1, 256, 1472, 1472, 1472, 256]
    - [2, 12.05]
  - - [1600, 1088, 1, 256, 1600, 1600, 1600, 256]
    - [2, 12.146]
  - - [1728, 1088, 1, 256, 1728, 1728, 1728, 256]
    - [2, 12.247]
  - - [1856, 1088, 1, 256, 1856, 1856, 1856, 256]
    - [2, 12.305]
  - - [1984, 1088, 1, 256, 1984, 1984, 1984, 256]
    - [2, 12.361]
  - - [2112, 1088, 1, 256, 2112, 2112, 2112, 256]
    - [2, 12.501]
  - - [2240, 1088, 1, 256, 2240, 2240, 2240, 256]
    - [2, 12.483]
  - - [2368, 1088, 1, 256, 2368, 2368, 2368, 256]
    - [2, 12.594]
  - - [2496, 1088, 1, 256, 2496, 2496, 2496, 256]
    - [2, 12.596]
  - - [2624, 1088, 1, 256, 2624, 2624, 2624, 256]
    - [2, 12.596]
  - - [2752, 1088, 1, 256, 2752, 2752, 2752, 256]
    - [2, 12.633]
  - - [2880, 1088, 1, 256, 2880, 2880, 2880, 256]
    - [2, 12.715]
  - - [3008, 1088, 1, 256, 3008, 3008, 3008, 256]
    - [2, 12.763]
  - - [3136, 1088, 1, 256, 3136, 3136, 3136, 256]
    - [2, 12.794]
  - - [3264, 1088, 1, 256, 3264, 3264, 3264, 256]
    - [2, 12.818]
  - - [3392, 1088, 1, 256, 3392, 3392, 3392, 256]
    - [2, 12.854]
  - - [3520, 1088, 1, 256, 3520, 3520, 3520, 256]
    - [2, 12.843]
  - - [3648, 1088, 1, 256, 3648, 3648, 3648, 256]
    - [2, 12.876]
  - - [3776, 1088, 1, 256, 3776, 3776, 3776, 256]
    - [2, 12.877]
  - - [3904, 1088, 1, 256, 3904, 3904, 3904, 256]
    - [2, 12.941]
  - - [4032, 1088, 1, 256, 4032, 4032, 4032, 256]
    - [2, 12.905]
  - - [64, 1216, 1, 256, 64, 64, 64, 256]
    - [0, 5.744]
  - - [192, 1216, 1, 256, 192, 192, 192, 256]
    - [0, 9.218]
  - - [320, 1216, 1, 256, 320, 320, 320, 256]
    - [0, 10.522]
  - - [448, 1216, 1, 256, 448, 448, 448, 256]
    - [0, 11.142]
  - - [576, 1216, 1, 256, 576, 576, 576, 256]
    - [0, 11.558]
  - - [704, 1216, 1, 256, 704, 704, 704, 256]
    - [2, 11.886]
  - - [832, 1216, 1, 256, 832, 832, 832, 256]
    - [2, 12.042]
  - - [960, 1216, 1, 256, 960, 960, 960, 256]
    - [0, 11.653]
  - - [1088, 1216, 1, 256, 1088, 1088, 1088, 256]
    - [0, 11.809]
  - - [1216, 1216, 1, 256, 1216, 1216, 1216, 256]
    - [2, 11.879]
  - - [1344, 1216, 1, 256, 1344, 1344, 1344, 256]
    - [2, 12.024]
  - - [1472, 1216, 1, 256, 1472, 1472, 1472, 256]
    - [2, 12.126]
  - - [1600, 1216, 1, 256, 1600, 1600, 1600, 256]
    - [2, 12.277]
  - - [1728, 1216, 1, 256, 1728, 1728, 1728, 256]
    - [2, 12.382]
  - - [1856, 1216, 1, 256, 1856, 1856, 1856, 256]
    - [2, 12.427]
  - - [1984, 1216, 1, 256, 1984, 1984, 1984, 256]
    - [2, 12.512]
  - - [2112, 1216, 1, 256, 2112, 2112, 2112, 256]
    - [2, 12.562]
  - - [2240, 1216, 1, 256, 2240, 2240, 2240, 256]
    - [2, 12.613]
  - - [2368, 1216, 1, 256, 2368, 2368, 2368, 256]
    - [2, 12.62]
  - - [2496, 1216, 1, 256, 2496, 2496, 2496, 256]
    - [2, 12.651]
  - - [2624, 1216, 1, 256, 2624, 2624, 2624, 256]
    - [2, 12.719]
  - - [2752, 1216, 1, 256, 2752, 2752, 2752, 256]
    - [2, 12.728]
  - - [2880, 1216, 1, 256, 2880, 2880, 2880, 256]
    - [2, 12.761]
  - - [3008, 1216, 1, 256, 3008, 3008, 3008, 256]
    - [2, 12.878]
  - - [3136, 1216, 1, 256, 3136, 3136, 3136, 256]
    - [2, 12.857]
  - - [3264, 1216, 1, 256, 3264, 3264, 3264, 256]
    - [2, 12.881]
  - - [3392, 1216, 1, 256, 3392, 3392, 3392, 256]
    - [2, 12.905]
  - - [3520, 1216, 1, 256, 3520, 3520, 3520, 256]
    - [2, 12.933]
  - - [3648, 1216, 1, 256, 3648, 3648, 3648, 256]
    - [2, 12.936]
  - - [3776, 1216, 1, 256, 3776, 3776, 3776, 256]
    - [2, 12.977]
  - - [3904, 1216, 1, 256, 3904, 3904, 3904, 256]
    - [2, 12.966]
  - - [4032, 1216, 1, 256, 4032, 4032, 4032, 256]
    - [2, 12.987]
  - - [64, 1344, 1, 256, 64, 64, 64, 256]
    - [0, 6.343]
  - - [192, 1344, 1, 256, 192, 192, 192, 256]
    - [2, 9.394]
  - - [320, 1344, 1, 256, 320, 320, 320, 256]
    - [0, 10.772]
  - - [448, 1344, 1, 256, 448, 448, 448, 256]
    - [0, 11.291]
  - - [576, 1344, 1, 256, 576, 576, 576, 256]
    - [2, 11.719]
  - - [704, 1344, 1, 256, 704, 704, 704, 256]
    - [0, 11.929]
  - - [832, 1344, 1, 256, 832, 832, 832, 256]
    - [2, 11.431]
  - - [960, 1344, 1, 256, 960, 960, 960, 256]
    - [2, 11.776]
  - - [1088, 1344, 1, 256, 1088, 1088, 1088, 256]
    - [2, 11.971]
  - - [1216, 1344, 1, 256, 1216, 1216, 1216, 256]
    - [2, 12.098]
  - - [1344, 1344, 1, 256, 1344, 1344, 1344, 256]
    - [0, 12.142]
  - - [1472, 1344, 1, 256, 1472, 1472, 1472, 256]
    - [2, 12.379]
  - - [1600, 1344, 1, 256, 1600, 1600, 1600, 256]
    - [2, 12.398]
  - - [1728, 1344, 1, 256, 1728, 1728, 1728, 256]
    - [2, 12.557]
  - - [1856, 1344, 1, 256, 1856, 1856, 1856, 256]
    - [2, 12.507]
  - - [1984, 1344, 1, 256, 1984, 1984, 1984, 256]
    - [2, 12.59]
  - - [2112, 1344, 1, 256, 2112, 2112, 2112, 256]
    - [2, 12.604]
  - - [2240, 1344, 1, 256, 2240, 2240, 2240, 256]
    - [2, 12.679]
  - - [2368, 1344, 1, 256, 2368, 2368, 2368, 256]
    - [2, 12.722]
  - - [2496, 1344, 1, 256, 2496, 2496, 2496, 256]
    - [2, 12.752]
  - - [2624, 1344, 1, 256, 2624, 2624, 2624, 256]
    - [2, 12.81]
  - - [2752, 1344, 1, 256, 2752, 2752, 2752, 256]
    - [2, 12.809]
  - - [2880, 1344, 1, 256, 2880, 2880, 2880, 256]
    - [2, 12.885]
  - - [3008, 1344, 1, 256, 3008, 3008, 3008, 256]
    - [2, 12.887]
  - - [3136, 1344, 1, 256, 3136, 3136, 3136, 256]
    - [2, 12.9]
  - - [3264, 1344, 1, 256, 3264, 3264, 3264, 256]
    - [2, 12.907]
  - - [3392, 1344, 1, 256, 3392, 3392, 3392, 256]
    - [2, 12.943]
  - - [3520, 1344, 1, 256, 3520, 3520, 3520, 256]
    - [2, 12.964]
  - - [3648, 1344, 1, 256, 3648, 3648, 3648, 256]
    - [2, 12.954]
  - - [3776, 1344, 1, 256, 3776, 3776, 3776, 256]
    - [2, 12.989]
  - - [3904, 1344, 1, 256, 3904, 3904, 3904, 256]
    - [2, 13.011]
  - - [4032, 1344, 1, 256, 4032, 4032, 4032, 256]
    - [2, 12.999]
  - - [64, 1472, 1, 256, 64, 64, 64, 256]
    - [0, 6.013]
  - - [192, 1472, 1, 256, 192, 192, 192, 256]
    - [2, 9.652]
  - - [320, 1472, 1, 256, 320, 320, 320, 256]
    - [0, 10.735]
  - - [448, 1472, 1, 256, 448, 448, 448, 256]
    - [2, 11.403]
  - - [576, 1472, 1, 256, 576, 576, 576, 256]
    - [0, 11.727]
  - - [704, 1472, 1, 256, 704, 704, 704, 256]
    - [2, 12.083]
  - - [832, 1472, 1, 256, 832, 832, 832, 256]
    - [2, 11.738]
  - - [960, 1472, 1, 256, 960, 960, 960, 256]
    - [2, 11.975]
  - - [1088, 1472, 1, 256, 1088, 1088, 1088, 256]
    - [2, 12.082]
  - - [1216, 1472, 1, 256, 1216, 1216, 1216, 256]
    - [2, 12.216]
  - - [1344, 1472, 1, 256, 1344, 1344, 1344, 256]
    - [2, 12.256]
  - - [1472, 1472, 1, 256, 1472, 1472, 1472, 256]
    - [2, 12.405]
  - - [1600, 1472, 1, 256, 1600, 1600, 1600, 256]
    - [2, 12.46]
  - - [1728, 1472, 1, 256, 1728, 1728, 1728, 256]
    - [2, 12.56]
  - - [1856, 1472, 1, 256, 1856, 1856, 1856, 256]
    - [2, 12.574]
  - - [1984, 1472, 1, 256, 1984, 1984, 1984, 256]
    - [2, 12.606]
  - - [2112, 1472, 1, 256, 2112, 2112, 2112, 256]
    - [2, 12.699]
  - - [2240, 1472, 1, 256, 2240, 2240, 2240, 256]
    - [2, 12.727]
  - - [2368, 1472, 1, 256, 2368, 2368, 2368, 256]
    - [2, 12.75]
  - - [2496, 1472, 1, 256, 2496, 2496, 2496, 256]
    - [2, 12.811]
  - - [2624, 1472, 1, 256, 2624, 2624, 2624, 256]
    - [2, 12.829]
  - - [2752, 1472, 1, 256, 2752, 2752, 2752, 256]
    - [2, 12.884]
  - - [2880, 1472, 1, 256, 2880, 2880, 2880, 256]
    - [2, 12.894]
  - - [3008, 1472, 1, 256, 3008, 3008, 3008, 256]
    - [2, 12.898]
  - - [3136, 1472, 1, 256, 3136, 3136, 3136, 256]
    - [2, 12.917]
  - - [3264, 1472, 1, 256, 3264, 3264, 3264, 256]
    - [2, 12.96]
  - - [3392, 1472, 1, 256, 3392, 3392, 3392, 256]
    - [2, 12.975]
  - - [3520, 1472, 1, 256, 3520, 3520, 3520, 256]
    - [2, 12.976]
  - - [3648, 1472, 1, 256, 3648, 3648, 3648, 256]
    - [2, 13.017]
  - - [3776, 1472, 1, 256, 3776, 3776, 3776, 256]
    - [2, 13.005]
  - - [3904, 1472, 1, 256, 3904, 3904, 3904, 256]
    - [2, 13.052]
  - - [4032, 1472, 1, 256, 4032, 4032, 4032, 256]
    - [2, 13.074]
  - - [64, 1600, 1, 256, 64, 64, 64, 256]
    - [0, 6.484]
  - - [192, 1600, 1, 256, 192, 192, 192, 256]
    - [0, 10.135]
  - - [320, 1600, 1, 256, 320, 320, 320, 256]
    - [0, 11.03]
  - - [448, 1600, 1, 256, 448, 448, 448, 256]
    - [2, 11.619]
  - - [576, 1600, 1, 256, 576, 576, 576, 256]
    - [0, 11.874]
  - - [704, 1600, 1, 256, 704, 704, 704, 256]
    - [2, 11.367]
  - - [832, 1600, 1, 256, 832, 832, 832, 256]
    - [2, 11.773]
  - - [960, 1600, 1, 256, 960, 960, 960, 256]
    - [2, 11.972]
  - - [1088, 1600, 1, 256, 1088, 1088, 1088, 256]
    - [2, 12.128]
  - - [1216, 1600, 1, 256, 1216, 1216, 1216, 256]
    - [2, 12.263]
  - - [1344, 1600, 1, 256, 1344, 1344, 1344, 256]
    - [2, 12.377]
  - - [1472, 1600, 1, 256, 1472, 1472, 1472, 256]
    - [2, 12.486]
  - - [1600, 1600, 1, 256, 1600, 1600, 1600, 256]
    - [2, 12.561]
  - - [1728, 1600, 1, 256, 1728, 1728, 1728, 256]
    - [2, 12.632]
  - - [1856, 1600, 1, 256, 1856, 1856, 1856, 256]
    - [2, 12.695]
  - - [1984, 1600, 1, 256, 1984, 1984, 1984, 256]
    - [2, 12.702]
  - - [2112, 1600, 1, 256, 2112, 2112, 2112, 256]
    - [2, 12.796]
  - - [2240, 1600, 1, 256, 2240, 2240, 2240, 256]
    - [2, 12.806]
  - - [2368, 1600, 1, 256, 2368, 2368, 2368, 256]
    - [2, 12.837]
  - - [2496, 1600, 1, 256, 2496, 2496, 2496, 256]
    - [2, 12.819]
  - - [2624, 1600, 1, 256, 2624, 2624, 2624, 256]
    - [2, 12.867]
  - - [2752, 1600, 1, 256, 2752, 2752, 2752, 256]
    - [2, 12.924]
  - - [2880, 1600, 1, 256, 2880, 2880, 2880, 256]
    - [2, 12.937]
  - - [3008, 1600, 1, 256, 3008, 3008, 3008, 256]
    - [2, 12.99]
  - - [3136, 1600, 1, 256, 3136, 3136, 3136, 256]
    - [2, 13.001]
  - - [3264, 1600, 1, 256, 3264, 3264, 3264, 256]
    - [2, 13.026]
  - - [3392, 1600, 1, 256, 3392, 3392, 3392, 256]
    - [2, 13.039]
  - - [3520, 1600, 1, 256, 3520, 3520, 3520, 256]
    - [2, 13.016]
  - - [3648, 1600, 1, 256, 3648, 3648, 3648, 256]
    - [2, 13.058]
  - - [3776, 1600, 1, 256, 3776, 3776, 3776, 256]
    - [2, 13.025]
  - - [3904, 1600, 1, 256, 3904, 3904, 3904, 256]
    - [2, 13.109]
  - - [4032, 1600, 1, 256, 4032, 4032, 4032, 256]
    - [2, 13.128]
  - - [64, 1728, 1, 256, 64, 64, 64, 256]
    - [0, 6.954]
  - - [192, 1728, 1, 256, 192, 192, 192, 256]
    - [0, 10.217]
  - - [320, 1728, 1, 256, 320, 320, 320, 256]
    - [0, 11.205]
  - - [448, 1728, 1, 256, 448, 448, 448, 256]
    - [2, 11.654]
  - - [576, 1728, 1, 256, 576, 576, 576, 256]
    - [0, 11.947]
  - - [704, 1728, 1, 256, 704, 704, 704, 256]
    - [2, 11.637]
  - - [832, 1728, 1, 256, 832, 832, 832, 256]
    - [2, 11.936]
  - - [960, 1728, 1, 256, 960, 960, 960, 256]
    - [2, 12.046]
  - - [1088, 1728, 1, 256, 1088, 1088, 1088, 256]
    - [2, 12.238]
  - - [1216, 1728, 1, 256, 1216, 1216, 1216, 256]
    - [2, 12.353]
  - - [1344, 1728, 1, 256, 1344, 1344, 1344, 256]
    - [2, 12.424]
  - - [1472, 1728, 1, 256, 1472, 1472, 1472, 256]
    - [2, 12.504]
  - - [1600, 1728, 1, 256, 1600, 1600, 1600, 256]
    - [2, 12.565]
  - - [1728, 1728, 1, 256, 1728, 1728, 1728, 256]
    - [2, 12.648]
  - - [1856, 1728, 1, 256, 1856, 1856, 1856, 256]
    - [2, 12.699]
  - - [1984, 1728, 1, 256, 1984, 1984, 1984, 256]
    - [2, 12.731]
  - - [2112, 1728, 1, 256, 2112, 2112, 2112, 256]
    - [2, 12.8]
  - - [2240, 1728, 1, 256, 2240, 2240, 2240, 256]
    - [2, 12.854]
  - - [2368, 1728, 1, 256, 2368, 2368, 2368, 256]
    - [2, 12.863]
  - - [2496, 1728, 1, 256, 2496, 2496, 2496, 256]
    - [2, 12.885]
  - - [2624, 1728, 1, 256, 2624, 2624, 2624, 256]
    - [2, 12.867]
  - - [2752, 1728, 1, 256, 2752, 2752, 2752, 256]
    - [2, 12.982]
  - - [2880, 1728, 1, 256, 2880, 2880, 2880, 256]
    - [2, 13.002]
  - - [3008, 1728, 1, 256, 3008, 3008, 3008, 256]
    - [2, 13.009]
  - - [3136, 1728, 1, 256, 3136, 3136, 3136, 256]
    - [2, 13.015]
  - - [3264, 1728, 1, 256, 3264, 3264, 3264, 256]
    - [2, 13.027]
  - - [3392, 1728, 1, 256, 3392, 3392, 3392, 256]
    - [2, 13.068]
  - - [3520, 1728, 1, 256, 3520, 3520, 3520, 256]
    - [2, 13.062]
  - - [3648, 1728, 1, 256, 3648, 3648, 3648, 256]
    - [2, 13.105]
  - - [3776, 1728, 1, 256, 3776, 3776, 3776, 256]
    - [2, 13.087]
  - - [3904, 1728, 1, 256, 3904, 3904, 3904, 256]
    - [2, 13.091]
  - - [4032, 1728, 1, 256, 4032, 4032, 4032, 256]
    - [2, 13.105]
  - - [64, 1856, 1, 256, 64, 64, 64, 256]
    - [0, 7.444]
  - - [192, 1856, 1, 256, 192, 192, 192, 256]
    - [0, 10.25]
  - - [320, 1856, 1, 256, 320, 320, 320, 256]
    - [2, 11.367]
  - - [448, 1856, 1, 256, 448, 448, 448, 256]
    - [0, 11.806]
  - - [576, 1856, 1, 256, 576, 576, 576, 256]
    - [0, 12.075]
  - - [704, 1856, 1, 256, 704, 704, 704, 256]
    - [2, 11.802]
  - - [832, 1856, 1, 256, 832, 832, 832, 256]
    - [0, 12.007]
  - - [960, 1856, 1, 256, 960, 960, 960, 256]
    - [2, 12.178]
  - - [1088, 1856, 1, 256, 1088, 1088, 1088, 256]
    - [2, 12.342]
  - - [1216, 1856, 1, 256, 1216, 1216, 1216, 256]
    - [2, 12.464]
  - - [1344, 1856, 1, 256, 1344, 1344, 1344, 256]
    - [2, 12.555]
  - - [1472, 1856, 1, 256, 1472, 1472, 1472, 256]
    - [2, 12.604]
  - - [1600, 1856, 1, 256, 1600, 1600, 1600, 256]
    - [2, 12.673]
  - - [1728, 1856, 1, 256, 1728, 1728, 1728, 256]
    - [2, 12.752]
  - - [1856, 1856, 1, 256, 1856, 1856, 1856, 256]
    - [2, 12.793]
  - - [1984, 1856, 1, 256, 1984, 1984, 1984, 256]
    - [2, 12.835]
  - - [2112, 1856, 1, 256, 2112, 2112, 2112, 256]
    - [2, 12.878]
  - - [2240, 1856, 1, 256, 2240, 2240, 2240, 256]
    - [2, 12.897]
  - - [2368, 1856, 1, 256, 2368, 2368, 2368, 256]
    - [2, 12.906]
  - - [2496, 1856, 1, 256, 2496, 2496, 2496, 256]
    - [2, 12.944]
  - - [2624, 1856, 1, 256, 2624, 2624, 2624, 256]
    - [2, 12.971]
  - - [2752, 1856, 1, 256, 2752, 2752, 2752, 256]
    - [2, 12.996]
  - - [2880, 1856, 1, 256, 2880, 2880, 2880, 256]
    - [2, 13.022]
  - - [3008, 1856, 1, 256, 3008, 3008, 3008, 256]
    - [2, 13.071]
  - - [3136, 1856, 1, 256, 3136, 3136, 3136, 256]
    - [2, 13.032]
  - - [3264, 1856, 1, 256, 3264, 3264, 3264, 256]
    - [2, 13.082]
  - - [3392, 1856, 1, 256, 3392, 3392, 3392, 256]
    - [2, 13.12]
  - - [3520, 1856, 1, 256, 3520, 3520, 3520, 256]
    - [2, 13.093]
  - - [3648, 1856, 1, 256, 3648, 3648, 3648, 256]
    - [2, 13.093]
  - - [3776, 1856, 1, 256, 3776, 3776, 3776, 256]
    - [2, 13.147]
  - - [3904, 1856, 1, 256, 3904, 3904, 3904, 256]
    - [2, 13.162]
  - - [4032, 1856, 1, 256, 4032, 4032, 4032, 256]
    - [2, 13.113]
  - - [64, 1984, 1, 256, 64, 64, 64, 256]
    - [0, 7.022]
  - - [192, 1984, 1, 256, 192, 192, 192, 256]
    - [0, 10.302]
  - - [320, 1984, 1, 256, 320, 320, 320, 256]
    - [0, 11.364]
  - - [448, 1984, 1, 256, 448, 448, 448, 256]
    - [2, 11.876]
  - - [576, 1984, 1, 256, 576, 576, 576, 256]
    - [2, 11.57]
  - - [704, 1984, 1, 256, 704, 704, 704, 256]
    - [2, 11.935]
  - - [832, 1984, 1, 256, 832, 832, 832, 256]
    - [2, 12.134]
  - - [960, 1984, 1, 256, 960, 960, 960, 256]
    - [2, 12.256]
  - - [1088, 1984, 1, 256, 1088, 1088, 1088, 256]
    - [2, 12.42]
  - - [1216, 1984, 1, 256, 1216, 1216, 1216, 256]
    - [2, 12.542]
  - - [1344, 1984, 1, 256, 1344, 1344, 1344, 256]
    - [2, 12.527]
  - - [1472, 1984, 1, 256, 1472, 1472, 1472, 256]
    - [2, 12.665]
  - - [1600, 1984, 1, 256, 1600, 1600, 1600, 256]
    - [2, 12.714]
  - - [1728, 1984, 1, 256, 1728, 1728, 1728, 256]
    - [2, 12.786]
  - - [1856, 1984, 1, 256, 1856, 1856, 1856, 256]
    - [2, 12.819]
  - - [1984, 1984, 1, 256, 1984, 1984, 1984, 256]
    - [2, 12.863]
  - - [2112, 1984, 1, 256, 2112, 2112, 2112, 256]
    - [2, 12.926]
  - - [2240, 1984, 1, 256, 2240, 2240, 2240, 256]
    - [2, 12.926]
  - - [2368, 1984, 1, 256, 2368, 2368, 2368, 256]
    - [2, 12.956]
  - - [2496, 1984, 1, 256, 2496, 2496, 2496, 256]
    - [2, 12.973]
  - - [2624, 1984, 1, 256, 2624, 2624, 2624, 256]
    - [2, 12.98]
  - - [2752, 1984, 1, 256, 2752, 2752, 2752, 256]
    - [2, 13.025]
  - - [2880, 1984, 1, 256, 2880, 2880, 2880, 256]
    - [2, 13.036]
  - - [3008, 1984, 1, 256, 3008, 3008, 3008, 256]
    - [2, 13.052]
  - - [3136, 1984, 1, 256, 3136, 3136, 3136, 256]
    - [2, 13.078]
  - - [3264, 1984, 1, 256, 3264, 3264, 3264, 256]
    - [2, 13.115]
  - - [3392, 1984, 1, 256, 3392, 3392, 3392, 256]
    - [2, 13.109]
  - - [3520, 1984, 1, 256, 3520, 3520, 3520, 256]
    - [2, 13.103]
  - - [3648, 1984, 1, 256, 3648, 3648, 3648, 256]
    - [2, 13.145]
  - - [3776, 1984, 1, 256, 3776, 3776, 3776, 256]
    - [2, 13.142]
  - - [3904, 1984, 1, 256, 3904, 3904, 3904, 256]
    - [2, 13.175]
  - - [4032, 1984, 1, 256, 4032, 4032, 4032, 256]
    - [2, 13.196]
  - - [64, 2112, 1, 256, 64, 64, 64, 256]
    - [0, 7.397]
  - - [192, 2112, 1, 256, 192, 192, 192, 256]
    - [0, 10.327]
  - - [320, 2112, 1, 256, 320, 320, 320, 256]
    - [0, 11.536]
  - - [448, 2112, 1, 256, 448, 448, 448, 256]
    - [2, 11.987]
  - - [576, 2112, 1, 256, 576, 576, 576, 256]
    - [2, 11.664]
  - - [704, 2112, 1, 256, 704, 704, 704, 256]
    - [2, 11.959]
  - - [832, 2112, 1, 256, 832, 832, 832, 256]
    - [2, 12.162]
  - - [960, 2112, 1, 256, 960, 960, 960, 256]
    - [2, 12.309]
  - - [1088, 2112, 1, 256, 1088, 1088, 1088, 256]
    - [2, 12.433]
  - - [1216, 2112, 1, 256, 1216, 1216, 1216, 256]
    - [2, 12.537]
  - - [1344, 2112, 1, 256, 1344, 1344, 1344, 256]
    - [2, 12.65]
  - - [1472, 2112, 1, 256, 1472, 1472, 1472, 256]
    - [2, 12.683]
  - - [1600, 2112, 1, 256, 1600, 1600, 1600, 256]
    - [2, 12.754]
  - - [1728, 2112, 1, 256, 1728, 1728, 1728, 256]
    - [2, 12.77]
  - - [1856, 2112, 1, 256, 1856, 1856, 1856, 256]
    - [2, 12.825]
  - - [1984, 2112, 1, 256, 1984, 1984, 1984, 256]
    - [2, 12.888]
  - - [2112, 2112, 1, 256, 2112, 2112, 2112, 256]
    - [2, 12.957]
  - - [2240, 2112, 1, 256, 2240, 2240, 2240, 256]
    - [2, 12.931]
  - - [2368, 2112, 1, 256, 2368, 2368, 2368, 256]
    - [2, 12.983]
  - - [2496, 2112, 1, 256, 2496, 2496, 2496, 256]
    - [2, 13.025]
  - - [2624, 2112, 1, 256, 2624, 2624, 2624, 256]
    - [2, 13.007]
  - - [2752, 2112, 1, 256, 2752, 2752, 2752, 256]
    - [2, 13.051]
  - - [2880, 2112, 1, 256, 2880, 2880, 2880, 256]
    - [2, 13.062]
  - - [3008, 2112, 1, 256, 3008, 3008, 3008, 256]
    - [2, 13.079]
  - - [3136, 2112, 1, 256, 3136, 3136, 3136, 256]
    - [2, 13.084]
  - - [3264, 2112, 1, 256, 3264, 3264, 3264, 256]
    - [2, 13.105]
  - - [3392, 2112, 1, 256, 3392, 3392, 3392, 256]
    - [2, 13.12]
  - - [3520, 2112, 1, 256, 3520, 3520, 3520, 256]
    - [2, 13.135]
  - - [3648, 2112, 1, 256, 3648, 3648, 3648, 256]
    - [2, 13.141]
  - - [3776, 2112, 1, 256, 3776, 3776, 3776, 256]
    - [2, 13.207]
  - - [3904, 2112, 1, 256, 3904, 3904, 3904, 256]
    - [2, 13.189]
  - - [4032, 2112, 1, 256, 4032, 4032, 4032, 256]
    - [2, 13.191]
  - - [64, 2240, 1, 256, 64, 64, 64, 256]
    - [0, 7.796]
  - - [192, 2240, 1, 256, 192, 192, 192, 256]
    - [0, 10.744]
  - - [320, 2240, 1, 256, 320, 320, 320, 256]
    - [2, 11.435]
  - - [448, 2240, 1, 256, 448, 448, 448, 256]
    - [2, 12.076]
  - - [576, 2240, 1, 256, 576, 576, 576, 256]
    - [0, 11.758]
  - - [704, 2240, 1, 256, 704, 704, 704, 256]
    - [0, 11.999]
  - - [832, 2240, 1, 256, 832, 832, 832, 256]
    - [2, 12.199]
  - - [960, 2240, 1, 256, 960, 960, 960, 256]
    - [2, 12.328]
  - - [1088, 2240, 1, 256, 1088, 1088, 1088, 256]
    - [2, 12.508]
  - - [1216, 2240, 1, 256, 1216, 1216, 1216, 256]
    - [2, 12.588]
  - - [1344, 2240, 1, 256, 1344, 1344, 1344, 256]
    - [2, 12.705]
  - - [1472, 2240, 1, 256, 1472, 1472, 1472, 256]
    - [2, 12.776]
  - - [1600, 2240, 1, 256, 1600, 1600, 1600, 256]
    - [2, 12.8]
  - - [1728, 2240, 1, 256, 1728, 1728, 1728, 256]
    - [2, 12.844]
  - - [1856, 2240, 1, 256, 1856, 1856, 1856, 256]
    - [2, 12.925]
  - - [1984, 2240, 1, 256, 1984, 1984, 1984, 256]
    - [2, 12.948]
  - - [2112, 2240, 1, 256, 2112, 2112, 2112, 256]
    - [2, 12.924]
  - - [2240, 2240, 1, 256, 2240, 2240, 2240, 256]
    - [2, 12.99]
  - - [2368, 2240, 1, 256, 2368, 2368, 2368, 256]
    - [2, 13.013]
  - - [2496, 2240, 1, 256, 2496, 2496, 2496, 256]
    - [2, 13.043]
  - - [2624, 2240, 1, 256, 2624, 2624, 2624, 256]
    - [2, 13.091]
  - - [2752, 2240, 1, 256, 2752, 2752, 2752, 256]
    - [2, 13.074]
  - - [2880, 2240, 1, 256, 2880, 2880, 2880, 256]
    - [2, 13.105]
  - - [3008, 2240, 1, 256, 3008, 3008, 3008, 256]
    - [2, 13.107]
  - - [3136, 2240, 1, 256, 3136, 3136, 3136, 256]
    - [2, 13.125]
  - - [3264, 2240, 1, 256, 3264, 3264, 3264, 256]
    - [2, 13.114]
  - - [3392, 2240, 1, 256, 3392, 3392, 3392, 256]
    - [2, 13.168]
  - - [3520, 2240, 1, 256, 3520, 3520, 3520, 256]
    - [2, 13.154]
  - - [3648, 2240, 1, 256, 3648, 3648, 3648, 256]
    - [2, 13.168]
  - - [3776, 2240, 1, 256, 3776, 3776, 3776, 256]
    - [2, 13.208]
  - - [3904, 2240, 1, 256, 3904, 3904, 3904, 256]
    - [2, 12.998]
  - - [4032, 2240, 1, 256, 4032, 4032, 4032, 256]
    - [2, 12.987]
  - - [64, 2368, 1, 256, 64, 64, 64, 256]
    - [0, 8.248]
  - - [192, 2368, 1, 256, 192, 192, 192, 256]
    - [0, 10.877]
  - - [320, 2368, 1, 256, 320, 320, 320, 256]
    - [0, 11.658]
  - - [448, 2368, 1, 256, 448, 448, 448, 256]
    - [0, 12.031]
  - - [576, 2368, 1, 256, 576, 576, 576, 256]
    - [2, 11.8]
  - - [704, 2368, 1, 256, 704, 704, 704, 256]
    - [2, 12.108]
  - - [832, 2368, 1, 256, 832, 832, 832, 256]
    - [2, 12.32]
  - - [960, 2368, 1, 256, 960, 960, 960, 256]
    - [2, 12.418]
  - - [1088, 2368, 1, 256, 1088, 1088, 1088, 256]
    - [2, 12.511]
  - - [1216, 2368, 1, 256, 1216, 1216, 1216, 256]
    - [2, 12.625]
  - - [1344, 2368, 1, 256, 1344, 1344, 1344, 256]
    - [2, 12.757]
  - - [1472, 2368, 1, 256, 1472, 1472, 1472, 256]
    - [2, 12.797]
  - - [1600, 2368, 1, 256, 1600, 1600, 1600, 256]
    - [2, 12.832]
  - - [1728, 2368, 1, 256, 1728, 1728, 1728, 256]
    - [2, 12.85]
  - - [1856, 2368, 1, 256, 1856, 1856, 1856, 256]
    - [2, 12.94]
  - - [1984, 2368, 1, 256, 1984, 1984, 1984, 256]
    - [2, 12.956]
  - - [2112, 2368, 1, 256, 2112, 2112, 2112, 256]
    - [2, 12.98]
  - - [2240, 2368, 1, 256, 2240, 2240, 2240, 256]
    - [2, 12.974]
  - - [2368, 2368, 1, 256, 2368, 2368, 2368, 256]
    - [2, 13.086]
  - - [2496, 2368, 1, 256, 2496, 2496, 2496, 256]
    - [2, 13.05]
  - - [2624, 2368, 1, 256, 2624, 2624, 2624, 256]
    - [2, 13.088]
  - - [2752, 2368, 1, 256, 2752, 2752, 2752, 256]
    - [2, 13.107]
  - - [2880, 2368, 1, 256, 2880, 2880, 2880, 256]
    - [2, 13.116]
  - - [3008, 2368, 1, 256, 3008, 3008, 3008, 256]
    - [2, 13.157]
  - - [3136, 2368, 1, 256, 3136, 3136, 3136, 256]
    - [2, 13.153]
  - - [3264, 2368, 1, 256, 3264, 3264, 3264, 256]
    - [2, 13.162]
  - - [3392, 2368, 1, 256, 3392, 3392, 3392, 256]
    - [2, 13.157]
  - - [3520, 2368, 1, 256, 3520, 3520, 3520, 256]
    - [2, 13.164]
  - - [3648, 2368, 1, 256, 3648, 3648, 3648, 256]
    - [2, 12.935]
  - - [3776, 2368, 1, 256, 3776, 3776, 3776, 256]
    - [2, 12.99]
  - - [3904, 2368, 1, 256, 3904, 3904, 3904, 256]
    - [2, 12.995]
  - - [4032, 2368, 1, 256, 4032, 4032, 4032, 256]
    - [2, 13.022]
  - - [64, 2496, 1, 256, 64, 64, 64, 256]
    - [2, 8.259]
  - - [192, 2496, 1, 256, 192, 192, 192, 256]
    - [0, 10.855]
  - - [320, 2496, 1, 256, 320, 320, 320, 256]
    - [0, 11.763]
  - - [448, 2496, 1, 256, 448, 448, 448, 256]
    - [2, 11.385]
  - - [576, 2496, 1, 256, 576, 576, 576, 256]
    - [2, 11.942]
  - - [704, 2496, 1, 256, 704, 704, 704, 256]
    - [2, 12.167]
  - - [832, 2496, 1, 256, 832, 832, 832, 256]
    - [2, 12.331]
  - - [960, 2496, 1, 256, 960, 960, 960, 256]
    - [2, 12.529]
  - - [1088, 2496, 1, 256, 1088, 1088, 1088, 256]
    - [2, 12.604]
  - - [1216, 2496, 1, 256, 1216, 1216, 1216, 256]
    - [2, 12.712]
  - - [1344, 2496, 1, 256, 1344, 1344, 1344, 256]
    - [2, 12.788]
  - - [1472, 2496, 1, 256, 1472, 1472, 1472, 256]
    - [2, 12.823]
  - - [1600, 2496, 1, 256, 1600, 1600, 1600, 256]
    - [2, 12.825]
  - - [1728, 2496, 1, 256, 1728, 1728, 1728, 256]
    - [2, 12.913]
  - - [1856, 2496, 1, 256, 1856, 1856, 1856, 256]
    - [2, 12.905]
  - - [1984, 2496, 1, 256, 1984, 1984, 1984, 256]
    - [2, 12.991]
  - - [2112, 2496, 1, 256, 2112, 2112, 2112, 256]
    - [2, 13.031]
  - - [2240, 2496, 1, 256, 2240, 2240, 2240, 256]
    - [2, 13.082]
  - - [2368, 2496, 1, 256, 2368, 2368, 2368, 256]
    - [2, 13.055]
  - - [2496, 2496, 1, 256, 2496, 2496, 2496, 256]
    - [2, 13.084]
  - - [2624, 2496, 1, 256, 2624, 2624, 2624, 256]
    - [2, 13.104]
  - - [2752, 2496, 1, 256, 2752, 2752, 2752, 256]
    - [2, 13.128]
  - - [2880, 2496, 1, 256, 2880, 2880, 2880, 256]
    - [2, 13.097]
  - - [3008, 2496, 1, 256, 3008, 3008, 3008, 256]
    - [2, 13.158]
  - - [3136, 2496, 1, 256, 3136, 3136, 3136, 256]
    - [2, 13.161]
  - - [3264, 2496, 1, 256, 3264, 3264, 3264, 256]
    - [2, 13.174]
  - - [3392, 2496, 1, 256, 3392, 3392, 3392, 256]
    - [2, 13.2]
  - - [3520, 2496, 1, 256, 3520, 3520, 3520, 256]
    - [2, 12.969]
  - - [3648, 2496, 1, 256, 3648, 3648, 3648, 256]
    - [2, 13.006]
  - - [3776, 2496, 1, 256, 3776, 3776, 3776, 256]
    - [2, 13.029]
  - - [3904, 2496, 1, 256, 3904, 3904, 3904, 256]
    - [2, 13.027]
  - - [4032, 2496, 1, 256, 4032, 4032, 4032, 256]
    - [2, 13.045]
  - - [64, 2624, 1, 256, 64, 64, 64, 256]
    - [2, 8.176]
  - - [192, 2624, 1, 256, 192, 192, 192, 256]
    - [2, 10.962]
  - - [320, 2624, 1, 256, 320, 320, 320, 256]
    - [2, 11.741]
  - - [448, 2624, 1, 256, 448, 448, 448, 256]
    - [2, 11.627]
  - - [576, 2624, 1, 256, 576, 576, 576, 256]
    - [2, 12.025]
  - - [704, 2624, 1, 256, 704, 704, 704, 256]
    - [2, 12.252]
  - - [832, 2624, 1, 256, 832, 832, 832, 256]
    - [2, 12.402]
  - - [960, 2624, 1, 256, 960, 960, 960, 256]
    - [2, 12.608]
  - - [1088, 2624, 1, 256, 1088, 1088, 1088, 256]
    - [2, 12.615]
  - - [1216, 2624, 1, 256, 1216, 1216, 1216, 256]
    - [2, 12.727]
  - - [1344, 2624, 1, 256, 1344, 1344, 1344, 256]
    - [2, 12.777]
  - - [1472, 2624, 1, 256, 1472, 1472, 1472, 256]
    - [2, 12.824]
  - - [1600, 2624, 1, 256, 1600, 1600, 1600, 256]
    - [2, 12.893]
  - - [1728, 2624, 1, 256, 1728, 1728, 1728, 256]
    - [2, 12.951]
  - - [1856, 2624, 1, 256, 1856, 1856, 1856, 256]
    - [2, 12.919]
  - - [1984, 2624, 1, 256, 1984, 1984, 1984, 256]
    - [2, 13.021]
  - - [2112, 2624, 1, 256, 2112, 2112, 2112, 256]
    - [2, 12.998]
  - - [2240, 2624, 1, 256, 2240, 2240, 2240, 256]
    - [2, 13.065]
  - - [2368, 2624, 1, 256, 2368, 2368, 2368, 256]
    - [2, 13.115]
  - - [2496, 2624, 1, 256, 2496, 2496, 2496, 256]
    - [2, 13.107]
  - - [2624, 2624, 1, 256, 2624, 2624, 2624, 256]
    - [2, 13.151]
  - - [2752, 2624, 1, 256, 2752, 2752, 2752, 256]
    - [2, 13.163]
  - - [2880, 2624, 1, 256, 2880, 2880, 2880, 256]
    - [2, 13.139]
  - - [3008, 2624, 1, 256, 3008, 3008, 3008, 256]
    - [2, 13.162]
  - - [3136, 2624, 1, 256, 3136, 3136, 3136, 256]
    - [2, 13.161]
  - - [3264, 2624, 1, 256, 3264, 3264, 3264, 256]
    - [2, 13.077]
  - - [3392, 2624, 1, 256, 3392, 3392, 3392, 256]
    - [2, 12.997]
  - - [3520, 2624, 1, 256, 3520, 3520, 3520, 256]
    - [2, 13.002]
  - - [3648, 2624, 1, 256, 3648, 3648, 3648, 256]
    - [2, 13.028]
  - - [3776, 2624, 1, 256, 3776, 3776, 3776, 256]
    - [2, 13.043]
  - - [3904, 2624, 1, 256, 3904, 3904, 3904, 256]
    - [2, 13.07]
  - - [4032, 2624, 1, 256, 4032, 4032, 4032, 256]
    - [2, 13.071]
  - - [64, 2752, 1, 256, 64, 64, 64, 256]
    - [0, 8.487]
  - - [192, 2752, 1, 256, 192, 192, 192, 256]
    - [2, 11.028]
  - - [320, 2752, 1, 256, 320, 320, 320, 256]
    - [0, 11.808]
  - - [448, 2752, 1, 256, 448, 448, 448, 256]
    - [2, 11.702]
  - - [576, 2752, 1, 256, 576, 576, 576, 256]
    - [2, 12.043]
  - - [704, 2752, 1, 256, 704, 704, 704, 256]
    - [2, 12.265]
  - - [832, 2752, 1, 256, 832, 832, 832, 256]
    - [2, 12.479]
  - - [960, 2752, 1, 256, 960, 960, 960, 256]
    - [2, 12.569]
  - - [1088, 2752, 1, 256, 1088, 1088, 1088, 256]
    - [2, 12.649]
  - - [1216, 2752, 1, 256, 1216, 1216, 1216, 256]
    - [2, 12.715]
  - - [1344, 2752, 1, 256, 1344, 1344, 1344, 256]
    - [2, 12.815]
  - - [1472, 2752, 1, 256, 1472, 1472, 1472, 256]
    - [2, 12.888]
  - - [1600, 2752, 1, 256, 1600, 1600, 1600, 256]
    - [2, 12.95]
  - - [1728, 2752, 1, 256, 1728, 1728, 1728, 256]
    - [2, 12.946]
  - - [1856, 2752, 1, 256, 1856, 1856, 1856, 256]
    - [2, 13.0]
  - - [1984, 2752, 1, 256, 1984, 1984, 1984, 256]
    - [2, 13.007]
  - - [2112, 2752, 1, 256, 2112, 2112, 2112, 256]
    - [2, 13.059]
  - - [2240, 2752, 1, 256, 2240, 2240, 2240, 256]
    - [2, 13.081]
  - - [2368, 2752, 1, 256, 2368, 2368, 2368, 256]
    - [2, 13.11]
  - - [2496, 2752, 1, 256, 2496, 2496, 2496, 256]
    - [2, 13.109]
  - - [2624, 2752, 1, 256, 2624, 2624, 2624, 256]
    - [2, 13.147]
  - - [2752, 2752, 1, 256, 2752, 2752, 2752, 256]
    - [2, 13.144]
  - - [2880, 2752, 1, 256, 2880, 2880, 2880, 256]
    - [2, 13.161]
  - - [3008, 2752, 1, 256, 3008, 3008, 3008, 256]
    - [2, 13.17]
  - - [3136, 2752, 1, 256, 3136, 3136, 3136, 256]
    - [2, 12.949]
  - - [3264, 2752, 1, 256, 3264, 3264, 3264, 256]
    - [2, 13.015]
  - - [3392, 2752, 1, 256, 3392, 3392, 3392, 256]
    - [2, 12.993]
  - - [3520, 2752, 1, 256, 3520, 3520, 3520, 256]
    - [2, 13.008]
  - - [3648, 2752, 1, 256, 3648, 3648, 3648, 256]
    - [2, 13.022]
  - - [3776, 2752, 1, 256, 3776, 3776, 3776, 256]
    - [2, 13.066]
  - - [3904, 2752, 1, 256, 3904, 3904, 3904, 256]
    - [2, 13.067]
  - - [4032, 2752, 1, 256, 4032, 4032, 4032, 256]
    - [2, 13.1]
  - - [64, 2880, 1, 256, 64, 64, 64, 256]
    - [0, 8.858]
  - - [192, 2880, 1, 256, 192, 192, 192, 256]
    - [0, 11.206]
  - - [320, 2880, 1, 256, 320, 320, 320, 256]
    - [2, 11.998]
  - - [448, 2880, 1, 256, 448, 448, 448, 256]
    - [2, 11.876]
  - - [576, 2880, 1, 256, 576, 576, 576, 256]
    - [0, 12.031]
  - - [704, 2880, 1, 256, 704, 704, 704, 256]
    - [2, 12.355]
  - - [832, 2880, 1, 256, 832, 832, 832, 256]
    - [2, 12.453]
  - - [960, 2880, 1, 256, 960, 960, 960, 256]
    - [2, 12.634]
  - - [1088, 2880, 1, 256, 1088, 1088, 1088, 256]
    - [2, 12.684]
  - - [1216, 2880, 1, 256, 1216, 1216, 1216, 256]
    - [2, 12.8]
  - - [1344, 2880, 1, 256, 1344, 1344, 1344, 256]
    - [2, 12.86]
  - - [1472, 2880, 1, 256, 1472, 1472, 1472, 256]
    - [2, 12.909]
  - - [1600, 2880, 1, 256, 1600, 1600, 1600, 256]
    - [2, 12.963]
  - - [1728, 2880, 1, 256, 1728, 1728, 1728, 256]
    - [2, 12.964]
  - - [1856, 2880, 1, 256, 1856, 1856, 1856, 256]
    - [2, 13.029]
  - - [1984, 2880, 1, 256, 1984, 1984, 1984, 256]
    - [2, 13.056]
  - - [2112, 2880, 1, 256, 2112, 2112, 2112, 256]
    - [2, 13.1]
  - - [2240, 2880, 1, 256, 2240, 2240, 2240, 256]
    - [2, 13.086]
  - - [2368, 2880, 1, 256, 2368, 2368, 2368, 256]
    - [2, 13.126]
  - - [2496, 2880, 1, 256, 2496, 2496, 2496, 256]
    - [2, 13.124]
  - - [2624, 2880, 1, 256, 2624, 2624, 2624, 256]
    - [2, 13.166]
  - - [2752, 2880, 1, 256, 2752, 2752, 2752, 256]
    - [2, 13.152]
  - - [2880, 2880, 1, 256, 2880, 2880, 2880, 256]
    - [2, 13.158]
  - - [3008, 2880, 1, 256, 3008, 3008, 3008, 256]
    - [2, 12.955]
  - - [3136, 2880, 1, 256, 3136, 3136, 3136, 256]
    - [2, 12.998]
  - - [3264, 2880, 1, 256, 3264, 3264, 3264, 256]
    - [2, 13.0]
  - - [3392, 2880, 1, 256, 3392, 3392, 3392, 256]
    - [2, 13.058]
  - - [3520, 2880, 1, 256, 3520, 3520, 3520, 256]
    - [2, 13.051]
  - - [3648, 2880, 1, 256, 3648, 3648, 3648, 256]
    - [2, 13.036]
  - - [3776, 2880, 1, 256, 3776, 3776, 3776, 256]
    - [2, 13.08]
  - - [3904, 2880, 1, 256, 3904, 3904, 3904, 256]
    - [2, 13.081]
  - - [4032, 2880, 1, 256, 4032, 4032, 4032, 256]
    - [2, 13.084]
  - - [64, 3008, 1, 256, 64, 64, 64, 256]
    - [2, 8.522]
  - - [192, 3008, 1, 256, 192, 192, 192, 256]
    - [0, 11.279]
  - - [320, 3008, 1, 256, 320, 320, 320, 256]
    - [2, 11.967]
  - - [448, 3008, 1, 256, 448, 448, 448, 256]
    - [2, 11.871]
  - - [576, 3008, 1, 256, 576, 576, 576, 256]
    - [2, 12.155]
  - - [704, 3008, 1, 256, 704, 704, 704, 256]
    - [2, 12.428]
  - - [832, 3008, 1, 256, 832, 832, 832, 256]
    - [2, 12.498]
  - - [960, 3008, 1, 256, 960, 960, 960, 256]
    - [2, 12.657]
  - - [1088, 3008, 1, 256, 1088, 1088, 1088, 256]
    - [2, 12.717]
  - - [1216, 3008, 1, 256, 1216, 1216, 1216, 256]
    - [2, 12.788]
  - - [1344, 3008, 1, 256, 1344, 1344, 1344, 256]
    - [2, 12.857]
  - - [1472, 3008, 1, 256, 1472, 1472, 1472, 256]
    - [2, 12.926]
  - - [1600, 3008, 1, 256, 1600, 1600, 1600, 256]
    - [2, 12.966]
  - - [1728, 3008, 1, 256, 1728, 1728, 1728, 256]
    - [2, 12.996]
  - - [1856, 3008, 1, 256, 1856, 1856, 1856, 256]
    - [2, 13.014]
  - - [1984, 3008, 1, 256, 1984, 1984, 1984, 256]
    - [2, 13.056]
  - - [2112, 3008, 1, 256, 2112, 2112, 2112, 256]
    - [2, 13.084]
  - - [2240, 3008, 1, 256, 2240, 2240, 2240, 256]
    - [2, 13.115]
  - - [2368, 3008, 1, 256, 2368, 2368, 2368, 256]
    - [2, 13.158]
  - - [2496, 3008, 1, 256, 2496, 2496, 2496, 256]
    - [2, 13.176]
  - - [2624, 3008, 1, 256, 2624, 2624, 2624, 256]
    - [2, 13.164]
  - - [2752, 3008, 1, 256, 2752, 2752, 2752, 256]
    - [2, 13.184]
  - - [2880, 3008, 1, 256, 2880, 2880, 2880, 256]
    - [2, 12.986]
  - - [3008, 3008, 1, 256, 3008, 3008, 3008, 256]
    - [2, 13.008]
  - - [3136, 3008, 1, 256, 3136, 3136, 3136, 256]
    - [2, 13.01]
  - - [3264, 3008, 1, 256, 3264, 3264, 3264, 256]
    - [2, 13.032]
  - - [3392, 3008, 1, 256, 3392, 3392, 3392, 256]
    - [2, 13.052]
  - - [3520, 3008, 1, 256, 3520, 3520, 3520, 256]
    - [2, 13.052]
  - - [3648, 3008, 1, 256, 3648, 3648, 3648, 256]
    - [2, 13.093]
  - - [3776, 3008, 1, 256, 3776, 3776, 3776, 256]
    - [2, 13.121]
  - - [3904, 3008, 1, 256, 3904, 3904, 3904, 256]
    - [2, 13.116]
  - - [4032, 3008, 1, 256, 4032, 4032, 4032, 256]
    - [2, 13.129]
  - - [64, 3136, 1, 256, 64, 64, 64, 256]
    - [0, 8.646]
  - - [192, 3136, 1, 256, 192, 192, 192, 256]
    - [0, 11.282]
  - - [320, 3136, 1, 256, 320, 320, 320, 256]
    - [0, 11.995]
  - - [448, 3136, 1, 256, 448, 448, 448, 256]
    - [2, 11.862]
  - - [576, 3136, 1, 256, 576, 576, 576, 256]
    - [2, 12.169]
  - - [704, 3136, 1, 256, 704, 704, 704, 256]
    - [2, 12.371]
  - - [832, 3136, 1, 256, 832, 832, 832, 256]
    - [2, 12.607]
  - - [960, 3136, 1, 256, 960, 960, 960, 256]
    - [2, 12.68]
  - - [1088, 3136, 1, 256, 1088, 1088, 1088, 256]
    - [2, 12.722]
  - - [1216, 3136, 1, 256, 1216, 1216, 1216, 256]
    - [2, 12.857]
  - - [1344, 3136, 1, 256, 1344, 1344, 1344, 256]
    - [2, 12.92]
  - - [1472, 3136, 1, 256, 1472, 1472, 1472, 256]
    - [2, 12.926]
  - - [1600, 3136, 1, 256, 1600, 1600, 1600, 256]
    - [2, 12.999]
  - - [1728, 3136, 1, 256, 1728, 1728, 1728, 256]
    - [2, 13.036]
  - - [1856, 3136, 1, 256, 1856, 1856, 1856, 256]
    - [2, 13.09]
  - - [1984, 3136, 1, 256, 1984, 1984, 1984, 256]
    - [2, 13.094]
  - - [2112, 3136, 1, 256, 2112, 2112, 2112, 256]
    - [2, 13.12]
  - - [2240, 3136, 1, 256, 2240, 2240, 2240, 256]
    - [2, 13.1]
  - - [2368, 3136, 1, 256, 2368, 2368, 2368, 256]
    - [2, 13.137]
  - - [2496, 3136, 1, 256, 2496, 2496, 2496, 256]
    - [2, 13.133]
  - - [2624, 3136, 1, 256, 2624, 2624, 2624, 256]
    - [2, 13.186]
  - - [2752, 3136, 1, 256, 2752, 2752, 2752, 256]
    - [2, 12.995]
  - - [2880, 3136, 1, 256, 2880, 2880, 2880, 256]
    - [2, 12.98]
  - - [3008, 3136, 1, 256, 3008, 3008, 3008, 256]
    - [2, 13.027]
  - - [3136, 3136, 1, 256, 3136, 3136, 3136, 256]
    - [2, 13.053]
  - - [3264, 3136, 1, 256, 3264, 3264, 3264, 256]
    - [2, 13.063]
  - - [3392, 3136, 1, 256, 3392, 3392, 3392, 256]
    - [2, 13.091]
  - - [3520, 3136, 1, 256, 3520, 3520, 3520, 256]
    - [2, 13.07]
  - - [3648, 3136, 1, 256, 3648, 3648, 3648, 256]
    - [2, 13.105]
  - - [3776, 3136, 1, 256, 3776, 3776, 3776, 256]
    - [2, 13.112]
  - - [3904, 3136, 1, 256, 3904, 3904, 3904, 256]
    - [2, 13.146]
  - - [4032, 3136, 1, 256, 4032, 4032, 4032, 256]
    - [2, 13.126]
  - - [64, 3264, 1, 256, 64, 64, 64, 256]
    - [0, 9.028]
  - - [192, 3264, 1, 256, 192, 192, 192, 256]
    - [2, 11.307]
  - - [320, 3264, 1, 256, 320, 320, 320, 256]
    - [0, 12.086]
  - - [448, 3264, 1, 256, 448, 448, 448, 256]
    - [2, 11.9]
  - - [576, 3264, 1, 256, 576, 576, 576, 256]
    - [2, 12.179]
  - - [704, 3264, 1, 256, 704, 704, 704, 256]
    - [2, 12.462]
  - - [832, 3264, 1, 256, 832, 832, 832, 256]
    - [2, 12.606]
  - - [960, 3264, 1, 256, 960, 960, 960, 256]
    - [2, 12.74]
  - - [1088, 3264, 1, 256, 1088, 1088, 1088, 256]
    - [2, 12.784]
  - - [1216, 3264, 1, 256, 1216, 1216, 1216, 256]
    - [2, 12.856]
  - - [1344, 3264, 1, 256, 1344, 1344, 1344, 256]
    - [2, 12.92]
  - - [1472, 3264, 1, 256, 1472, 1472, 1472, 256]
    - [2, 12.981]
  - - [1600, 3264, 1, 256, 1600, 1600, 1600, 256]
    - [2, 12.998]
  - - [1728, 3264, 1, 256, 1728, 1728, 1728, 256]
    - [2, 13.04]
  - - [1856, 3264, 1, 256, 1856, 1856, 1856, 256]
    - [2, 13.093]
  - - [1984, 3264, 1, 256, 1984, 1984, 1984, 256]
    - [2, 13.093]
  - - [2112, 3264, 1, 256, 2112, 2112, 2112, 256]
    - [2, 13.144]
  - - [2240, 3264, 1, 256, 2240, 2240, 2240, 256]
    - [2, 13.13]
  - - [2368, 3264, 1, 256, 2368, 2368, 2368, 256]
    - [2, 13.174]
  - - [2496, 3264, 1, 256, 2496, 2496, 2496, 256]
    - [2, 13.188]
  - - [2624, 3264, 1, 256, 2624, 2624, 2624, 256]
    - [2, 13.123]
  - - [2752, 3264, 1, 256, 2752, 2752, 2752, 256]
    - [2, 12.987]
  - - [2880, 3264, 1, 256, 2880, 2880, 2880, 256]
    - [2, 13.033]
  - - [3008, 3264, 1, 256, 3008, 3008, 3008, 256]
    - [2, 13.046]
  - - [3136, 3264, 1, 256, 3136, 3136, 3136, 256]
    - [2, 13.055]
  - - [3264, 3264, 1, 256, 3264, 3264, 3264, 256]
    - [2, 13.093]
  - - [3392, 3264, 1, 256, 3392, 3392, 3392, 256]
    - [2, 13.06]
  - - [3520, 3264, 1, 256, 3520, 3520, 3520, 256]
    - [2, 13.094]
  - - [3648, 3264, 1, 256, 3648, 3648, 3648, 256]
    - [2, 13.112]
  - - [3776, 3264, 1, 256, 3776, 3776, 3776, 256]
    - [2, 13.142]
  - - [3904, 3264, 1, 256, 3904, 3904, 3904, 256]
    - [2, 13.144]
  - - [4032, 3264, 1, 256, 4032, 4032, 4032, 256]
    - [2, 13.146]
  - - [64, 3392, 1, 256, 64, 64, 64, 256]
    - [2, 8.756]
  - - [192, 3392, 1, 256, 192, 192, 192, 256]
    - [2, 11.293]
  - - [320, 3392, 1, 256, 320, 320, 320, 256]
    - [2, 11.457]
  - - [448, 3392, 1, 256, 448, 448, 448, 256]
    - [2, 11.983]
  - - [576, 3392, 1, 256, 576, 576, 576, 256]
    - [2, 12.287]
  - - [704, 3392, 1, 256, 704, 704, 704, 256]
    - [2, 12.476]
  - - [832, 3392, 1, 256, 832, 832, 832, 256]
    - [2, 12.677]
  - - [960, 3392, 1, 256, 960, 960, 960, 256]
    - [2, 12.764]
  - - [1088, 3392, 1, 256, 1088, 1088, 1088, 256]
    - [2, 12.825]
  - - [1216, 3392, 1, 256, 1216, 1216, 1216, 256]
    - [2, 12.906]
  - - [1344, 3392, 1, 256, 1344, 1344, 1344, 256]
    - [2, 12.949]
  - - [1472, 3392, 1, 256, 1472, 1472, 1472, 256]
    - [2, 12.966]
  - - [1600, 3392, 1, 256, 1600, 1600, 1600, 256]
    - [2, 13.048]
  - - [1728, 3392, 1, 256, 1728, 1728, 1728, 256]
    - [2, 13.032]
  - - [1856, 3392, 1, 256, 1856, 1856, 1856, 256]
    - [2, 13.094]
  - - [1984, 3392, 1, 256, 1984, 1984, 1984, 256]
    - [2, 13.099]
  - - [2112, 3392, 1, 256, 2112, 2112, 2112, 256]
    - [2, 13.161]
  - - [2240, 3392, 1, 256, 2240, 2240, 2240, 256]
    - [2, 13.168]
  - - [2368, 3392, 1, 256, 2368, 2368, 2368, 256]
    - [2, 13.135]
  - - [2496, 3392, 1, 256, 2496, 2496, 2496, 256]
    - [2, 13.197]
  - - [2624, 3392, 1, 256, 2624, 2624, 2624, 256]
    - [2, 12.972]
  - - [2752, 3392, 1, 256, 2752, 2752, 2752, 256]
    - [2, 13.011]
  - - [2880, 3392, 1, 256, 2880, 2880, 2880, 256]
    - [2, 13.04]
  - - [3008, 3392, 1, 256, 3008, 3008, 3008, 256]
    - [2, 13.054]
  - - [3136, 3392, 1, 256, 3136, 3136, 3136, 256]
    - [2, 13.083]
  - - [3264, 3392, 1, 256, 3264, 3264, 3264, 256]
    - [2, 13.096]
  - - [3392, 3392, 1, 256, 3392, 3392, 3392, 256]
    - [2, 13.074]
  - - [3520, 3392, 1, 256, 3520, 3520, 3520, 256]
    - [2, 13.125]
  - - [3648, 3392, 1, 256, 3648, 3648, 3648, 256]
    - [2, 13.129]
  - - [3776, 3392, 1, 256, 3776, 3776, 3776, 256]
    - [2, 13.145]
  - - [3904, 3392, 1, 256, 3904, 3904, 3904, 256]
    - [2, 13.149]
  - - [4032, 3392, 1, 256, 4032, 4032, 4032, 256]
    - [2, 13.161]
  - - [64, 3520, 1, 256, 64, 64, 64, 256]
    - [2, 9.16]
  - - [192, 3520, 1, 256, 192, 192, 192, 256]
    - [0, 11.5]
  - - [320, 3520, 1, 256, 320, 320, 320, 256]
    - [2, 11.378]
  - - [448, 3520, 1, 256, 448, 448, 448, 256]
    - [2, 12.005]
  - - [576, 3520, 1, 256, 576, 576, 576, 256]
    - [2, 12.333]
  - - [704, 3520, 1, 256, 704, 704, 704, 256]
    - [2, 12.536]
  - - [832, 3520, 1, 256, 832, 832, 832, 256]
    - [2, 12.635]
  - - [960, 3520, 1, 256, 960, 960, 960, 256]
    - [2, 12.717]
  - - [1088, 3520, 1, 256, 1088, 1088, 1088, 256]
    - [2, 12.835]
  - - [1216, 3520, 1, 256, 1216, 1216, 1216, 256]
    - [2, 12.929]
  - - [1344, 3520, 1, 256, 1344, 1344, 1344, 256]
    - [2, 12.977]
  - - [1472, 3520, 1, 256, 1472, 1472, 1472, 256]
    - [2, 13.024]
  - - [1600, 3520, 1, 256, 1600, 1600, 1600, 256]
    - [2, 13.062]
  - - [1728, 3520, 1, 256, 1728, 1728, 1728, 256]
    - [2, 13.055]
  - - [1856, 3520, 1, 256, 1856, 1856, 1856, 256]
    - [2, 13.134]
  - - [1984, 3520, 1, 256, 1984, 1984, 1984, 256]
    - [2, 13.131]
  - - [2112, 3520, 1, 256, 2112, 2112, 2112, 256]
    - [2, 13.17]
  - - [2240, 3520, 1, 256, 2240, 2240, 2240, 256]
    - [2, 13.197]
  - - [2368, 3520, 1, 256, 2368, 2368, 2368, 256]
    - [2, 13.156]
  - - [2496, 3520, 1, 256, 2496, 2496, 2496, 256]
    - [2, 12.959]
  - - [2624, 3520, 1, 256, 2624, 2624, 2624, 256]
    - [2, 13.013]
  - - [2752, 3520, 1, 256, 2752, 2752, 2752, 256]
    - [2, 13.035]
  - - [2880, 3520, 1, 256, 2880, 2880, 2880, 256]
    - [2, 13.049]
  - - [3008, 3520, 1, 256, 3008, 3008, 3008, 256]
    - [2, 13.068]
  - - [3136, 3520, 1, 256, 3136, 3136, 3136, 256]
    - [2, 13.087]
  - - [3264, 3520, 1, 256, 3264, 3264, 3264, 256]
    - [2, 13.104]
  - - [3392, 3520, 1, 256, 3392, 3392, 3392, 256]
    - [2, 13.109]
  - - [3520, 3520, 1, 256, 3520, 3520, 3520, 256]
    - [2, 13.138]
  - - [3648, 3520, 1, 256, 3648, 3648, 3648, 256]
    - [2, 13.133]
  - - [3776, 3520, 1, 256, 3776, 3776, 3776, 256]
    - [2, 13.148]
  - - [3904, 3520, 1, 256, 3904, 3904, 3904, 256]
    - [2, 13.155]
  - - [4032, 3520, 1, 256, 4032, 4032, 4032, 256]
    - [2, 13.188]
  - - [64, 3648, 1, 256, 64, 64, 64, 256]
    - [0, 9.239]
  - - [192, 3648, 1, 256, 192, 192, 192, 256]
    - [0, 11.582]
  - - [320, 3648, 1, 256, 320, 320, 320, 256]
    - [2, 11.587]
  - - [448, 3648, 1, 256, 448, 448, 448, 256]
    - [2, 12.121]
  - - [576, 3648, 1, 256, 576, 576, 576, 256]
    - [2, 12.388]
  - - [704, 3648, 1, 256, 704, 704, 704, 256]
    - [2, 12.484]
  - - [832, 3648, 1, 256, 832, 832, 832, 256]
    - [2, 12.668]
  - - [960, 3648, 1, 256, 960, 960, 960, 256]
    - [2, 12.776]
  - - [1088, 3648, 1, 256, 1088, 1088, 1088, 256]
    - [2, 12.856]
  - - [1216, 3648, 1, 256, 1216, 1216, 1216, 256]
    - [2, 12.905]
  - - [1344, 3648, 1, 256, 1344, 1344, 1344, 256]
    - [2, 12.961]
  - - [1472, 3648, 1, 256, 1472, 1472, 1472, 256]
    - [2, 13.039]
  - - [1600, 3648, 1, 256, 1600, 1600, 1600, 256]
    - [2, 13.05]
  - - [1728, 3648, 1, 256, 1728, 1728, 1728, 256]
    - [2, 13.095]
  - - [1856, 3648, 1, 256, 1856, 1856, 1856, 256]
    - [2, 13.127]
  - - [1984, 3648, 1, 256, 1984, 1984, 1984, 256]
    - [2, 13.143]
  - - [2112, 3648, 1, 256, 2112, 2112, 2112, 256]
    - [2, 13.159]
  - - [2240, 3648, 1, 256, 2240, 2240, 2240, 256]
    - [2, 13.185]
  - - [2368, 3648, 1, 256, 2368, 2368, 2368, 256]
    - [2, 13.004]
  - - [2496, 3648, 1, 256, 2496, 2496, 2496, 256]
    - [2, 13.011]
  - - [2624, 3648, 1, 256, 2624, 2624, 2624, 256]
    - [2, 13.029]
  - - [2752, 3648, 1, 256, 2752, 2752, 2752, 256]
    - [2, 13.038]
  - - [2880, 3648, 1, 256, 2880, 2880, 2880, 256]
    - [2, 13.047]
  - - [3008, 3648, 1, 256, 3008, 3008, 3008, 256]
    - [2, 13.07]
  - - [3136, 3648, 1, 256, 3136, 3136, 3136, 256]
    - [2, 13.103]
  - - [3264, 3648, 1, 256, 3264, 3264, 3264, 256]
    - [2, 13.105]
  - - [3392, 3648, 1, 256, 3392, 3392, 3392, 256]
    - [2, 13.12]
  - - [3520, 3648, 1, 256, 3520, 3520, 3520, 256]
    - [2, 13.148]
  - - [3648, 3648, 1, 256, 3648, 3648, 3648, 256]
    - [2, 13.17]
  - - [3776, 3648, 1, 256, 3776, 3776, 3776, 256]
    - [2, 13.156]
  - - [3904, 3648, 1, 256, 3904, 3904, 3904, 256]
    - [2, 13.168]
  - - [4032, 3648, 1, 256, 4032, 4032, 4032, 256]
    - [2, 13.176]
  - - [64, 3776, 1, 256, 64, 64, 64, 256]
    - [0, 9.481]
  - - [192, 3776, 1, 256, 192, 192, 192, 256]
    - [2, 11.695]
  - - [320, 3776, 1, 256, 320, 320, 320, 256]
    - [2, 11.704]
  - - [448, 3776, 1, 256, 448, 448, 448, 256]
    - [2, 12.106]
  - - [576, 3776, 1, 256, 576, 576, 576, 256]
    - [2, 12.371]
  - - [704, 3776, 1, 256, 704, 704, 704, 256]
    - [2, 12.61]
  - - [832, 3776, 1, 256, 832, 832, 832, 256]
    - [2, 12.683]
  - - [960, 3776, 1, 256, 960, 960, 960, 256]
    - [2, 12.812]
  - - [1088, 3776, 1, 256, 1088, 1088, 1088, 256]
    - [2, 12.882]
  - - [1216, 3776, 1, 256, 1216, 1216, 1216, 256]
    - [2, 12.986]
  - - [1344, 3776, 1, 256, 1344, 1344, 1344, 256]
    - [2, 13.017]
  - - [1472, 3776, 1, 256, 1472, 1472, 1472, 256]
    - [2, 13.02]
  - - [1600, 3776, 1, 256, 1600, 1600, 1600, 256]
    - [2, 13.079]
  - - [1728, 3776, 1, 256, 1728, 1728, 1728, 256]
    - [2, 13.122]
  - - [1856, 3776, 1, 256, 1856, 1856, 1856, 256]
    - [2, 13.11]
  - - [1984, 3776, 1, 256, 1984, 1984, 1984, 256]
    - [2, 13.157]
  - - [2112, 3776, 1, 256, 2112, 2112, 2112, 256]
    - [2, 13.155]
  - - [2240, 3776, 1, 256, 2240, 2240, 2240, 256]
    - [2, 13.133]
  - - [2368, 3776, 1, 256, 2368, 2368, 2368, 256]
    - [2, 12.994]
  - - [2496, 3776, 1, 256, 2496, 2496, 2496, 256]
    - [2, 13.007]
  - - [2624, 3776, 1, 256, 2624, 2624, 2624, 256]
    - [2, 13.052]
  - - [2752, 3776, 1, 256, 2752, 2752, 2752, 256]
    - [2, 13.06]
  - - [2880, 3776, 1, 256, 2880, 2880, 2880, 256]
    - [2, 13.096]
  - - [3008, 3776, 1, 256, 3008, 3008, 3008, 256]
    - [2, 13.094]
  - - [3136, 3776, 1, 256, 3136, 3136, 3136, 256]
    - [2, 13.09]
  - - [3264, 3776, 1, 256, 3264, 3264, 3264, 256]
    - [2, 13.157]
  - - [3392, 3776, 1, 256, 3392, 3392, 3392, 256]
    - [2, 13.158]
  - - [3520, 3776, 1, 256, 3520, 3520, 3520, 256]
    - [2, 13.166]
  - - [3648, 3776, 1, 256, 3648, 3648, 3648, 256]
    - [2, 13.166]
  - - [3776, 3776, 1, 256, 3776, 3776, 3776, 256]
    - [2, 13.171]
  - - [3904, 3776, 1, 256, 3904, 3904, 3904, 256]
    - [2, 13.183]
  - - [4032, 3776, 1, 256, 4032, 4032, 4032, 256]
    - [2, 13.212]
  - - [64, 3904, 1, 256, 64, 64, 64, 256]
    - [0, 9.112]
  - - [192, 3904, 1, 256, 192, 192, 192, 256]
    - [2, 11.623]
  - - [320, 3904, 1, 256, 320, 320, 320, 256]
    - [0, 11.647]
  - - [448, 3904, 1, 256, 448, 448, 448, 256]
    - [2, 12.169]
  - - [576, 3904, 1, 256, 576, 576, 576, 256]
    - [2, 12.456]
  - - [704, 3904, 1, 256, 704, 704, 704, 256]
    - [2, 12.605]
  - - [832, 3904, 1, 256, 832, 832, 832, 256]
    - [2, 12.767]
  - - [960, 3904, 1, 256, 960, 960, 960, 256]
    - [2, 12.87]
  - - [1088, 3904, 1, 256, 1088, 1088, 1088, 256]
    - [2, 12.883]
  - - [1216, 3904, 1, 256, 1216, 1216, 1216, 256]
    - [2, 12.926]
  - - [1344, 3904, 1, 256, 1344, 1344, 1344, 256]
    - [2, 13.031]
  - - [1472, 3904, 1, 256, 1472, 1472, 1472, 256]
    - [2, 13.065]
  - - [1600, 3904, 1, 256, 1600, 1600, 1600, 256]
    - [2, 13.08]
  - - [1728, 3904, 1, 256, 1728, 1728, 1728, 256]
    - [2, 13.119]
  - - [1856, 3904, 1, 256, 1856, 1856, 1856, 256]
    - [2, 13.131]
  - - [1984, 3904, 1, 256, 1984, 1984, 1984, 256]
    - [2, 13.14]
  - - [2112, 3904, 1, 256, 2112, 2112, 2112, 256]
    - [2, 13.163]
  - - [2240, 3904, 1, 256, 2240, 2240, 2240, 256]
    - [2, 12.97]
  - - [2368, 3904, 1, 256, 2368, 2368, 2368, 256]
    - [2, 13.017]
  - - [2496, 3904, 1, 256, 2496, 2496, 2496, 256]
    - [2, 13.01]
  - - [2624, 3904, 1, 256, 2624, 2624, 2624, 256]
    - [2, 13.029]
  - - [2752, 3904, 1, 256, 2752, 2752, 2752, 256]
    - [2, 13.081]
  - - [2880, 3904, 1, 256, 2880, 2880, 2880, 256]
    - [2, 13.095]
  - - [3008, 3904, 1, 256, 3008, 3008, 3008, 256]
    - [2, 13.106]
  - - [3136, 3904, 1, 256, 3136, 3136, 3136, 256]
    - [2, 13.121]
  - - [3264, 3904, 1, 256, 3264, 3264, 3264, 256]
    - [2, 13.153]
  - - [3392, 3904, 1, 256, 3392, 3392, 3392, 256]
    - [2, 13.163]
  - - [3520, 3904, 1, 256, 3520, 3520, 3520, 256]
    - [2, 13.174]
  - - [3648, 3904, 1, 256, 3648, 3648, 3648, 256]
    - [2, 13.172]
  - - [3776, 3904, 1, 256, 3776, 3776, 3776, 256]
    - [2, 13.185]
  - - [3904, 3904, 1, 256, 3904, 3904, 3904, 256]
    - [2, 13.185]
  - - [4032, 3904, 1, 256, 4032, 4032, 4032, 256]
    - [2, 13.201]
  - - [64, 4032, 1, 256, 64, 64, 64, 256]
    - [0, 9.385]
  - - [192, 4032, 1, 256, 192, 192, 192, 256]
    - [2, 11.71]
  - - [320, 4032, 1, 256, 320, 320, 320, 256]
    - [2, 11.797]
  - - [448, 4032, 1, 256, 448, 448, 448, 256]
    - [2, 12.29]
  - - [576, 4032, 1, 256, 576, 576, 576, 256]
    - [2, 12.495]
  - - [704, 4032, 1, 256, 704, 704, 704, 256]
    - [2, 12.6]
  - - [832, 4032, 1, 256, 832, 832, 832, 256]
    - [2, 12.724]
  - - [960, 4032, 1, 256, 960, 960, 960, 256]
    - [2, 12.874]
  - - [1088, 4032, 1, 256, 1088, 1088, 1088, 256]
    - [2, 12.92]
  - - [1216, 4032, 1, 256, 1216, 1216, 1216, 256]
    - [2, 12.997]
  - - [1344, 4032, 1, 256, 1344, 1344, 1344, 256]
    - [2, 13.052]
  - - [1472, 4032, 1, 256, 1472, 1472, 1472, 256]
    - [2, 13.117]
  - - [1600, 4032, 1, 256, 1600, 1600, 1600, 256]
    - [2, 13.12]
  - - [1728, 4032, 1, 256, 1728, 1728, 1728, 256]
    - [2, 13.137]
  - - [1856, 4032, 1, 256, 1856, 1856, 1856, 256]
    - [2, 13.175]
  - - [1984, 4032, 1, 256, 1984, 1984, 1984, 256]
    - [2, 13.188]
  - - [2112, 4032, 1, 256, 2112, 2112, 2112, 256]
    - [2, 13.211]
  - - [2240, 4032, 1, 256, 2240, 2240, 2240, 256]
    - [2, 12.993]
  - - [2368, 4032, 1, 256, 2368, 2368, 2368, 256]
    - [2, 13.041]
  - - [2496, 4032, 1, 256, 2496, 2496, 2496, 256]
    - [2, 13.054]
  - - [2624, 4032, 1, 256, 2624, 2624, 2624, 256]
    - [2, 13.063]
  - - [2752, 4032, 1, 256, 2752, 2752, 2752, 256]
    - [2, 13.096]
  - - [2880, 4032, 1, 256, 2880, 2880, 2880, 256]
    - [2, 13.129]
  - - [3008, 4032, 1, 256, 3008, 3008, 3008, 256]
    - [2, 13.12]
  - - [3136, 4032, 1, 256, 3136, 3136, 3136, 256]
    - [2, 13.144]
  - - [3264, 4032, 1, 256, 3264, 3264, 3264, 256]
    - [2, 13.164]
  - - [3392, 4032, 1, 256, 3392, 3392, 3392, 256]
    - [2, 13.157]
  - - [3520, 4032, 1, 256, 3520, 3520, 3520, 256]
    - [2, 13.173]
  - - [3648, 4032, 1, 256, 3648, 3648, 3648, 256]
    - [2, 13.218]
  - - [3776, 4032, 1, 256, 3776, 3776, 3776, 256]
    - [2, 13.216]
  - - [3904, 4032, 1, 256, 3904, 3904, 3904, 256]
    - [2, 13.21]
  - - [4032, 4032, 1, 256, 4032, 4032, 4032, 256]
    - [2, 13.219]
  - - [64, 64, 1, 512, 64, 64, 64, 512]
    - [1, 0.845]
  - - [192, 64, 1, 512, 192, 192, 192, 512]
    - [2, 2.49]
  - - [320, 64, 1, 512, 320, 320, 320, 512]
    - [0, 3.499]
  - - [448, 64, 1, 512, 448, 448, 448, 512]
    - [0, 4.877]
  - - [576, 64, 1, 512, 576, 576, 576, 512]
    - [2, 4.957]
  - - [704, 64, 1, 512, 704, 704, 704, 512]
    - [2, 6.054]
  - - [832, 64, 1, 512, 832, 832, 832, 512]
    - [0, 6.578]
  - - [960, 64, 1, 512, 960, 960, 960, 512]
    - [0, 7.492]
  - - [1088, 64, 1, 512, 1088, 1088, 1088, 512]
    - [2, 6.818]
  - - [1216, 64, 1, 512, 1216, 1216, 1216, 512]
    - [0, 7.396]
  - - [1344, 64, 1, 512, 1344, 1344, 1344, 512]
    - [0, 8.193]
  - - [1472, 64, 1, 512, 1472, 1472, 1472, 512]
    - [2, 7.511]
  - - [1600, 64, 1, 512, 1600, 1600, 1600, 512]
    - [0, 7.985]
  - - [1728, 64, 1, 512, 1728, 1728, 1728, 512]
    - [0, 8.619]
  - - [1856, 64, 1, 512, 1856, 1856, 1856, 512]
    - [0, 9.22]
  - - [1984, 64, 1, 512, 1984, 1984, 1984, 512]
    - [0, 8.422]
  - - [2112, 64, 1, 512, 2112, 2112, 2112, 512]
    - [0, 8.87]
  - - [2240, 64, 1, 512, 2240, 2240, 2240, 512]
    - [0, 9.389]
  - - [2368, 64, 1, 512, 2368, 2368, 2368, 512]
    - [0, 9.925]
  - - [2496, 64, 1, 512, 2496, 2496, 2496, 512]
    - [2, 9.291]
  - - [2624, 64, 1, 512, 2624, 2624, 2624, 512]
    - [0, 9.564]
  - - [2752, 64, 1, 512, 2752, 2752, 2752, 512]
    - [0, 10.016]
  - - [2880, 64, 1, 512, 2880, 2880, 2880, 512]
    - [0, 10.452]
  - - [3008, 64, 1, 512, 3008, 3008, 3008, 512]
    - [2, 9.785]
  - - [3136, 64, 1, 512, 3136, 3136, 3136, 512]
    - [0, 10.064]
  - - [3264, 64, 1, 512, 3264, 3264, 3264, 512]
    - [0, 10.458]
  - - [3392, 64, 1, 512, 3392, 3392, 3392, 512]
    - [2, 10.222]
  - - [3520, 64, 1, 512, 3520, 3520, 3520, 512]
    - [2, 10.228]
  - - [3648, 64, 1, 512, 3648, 3648, 3648, 512]
    - [0, 10.489]
  - - [3776, 64, 1, 512, 3776, 3776, 3776, 512]
    - [0, 10.846]
  - - [3904, 64, 1, 512, 3904, 3904, 3904, 512]
    - [2, 10.455]
  - - [4032, 64, 1, 512, 4032, 4032, 4032, 512]
    - [2, 10.536]
  - - [64, 192, 1, 512, 64, 64, 64, 512]
    - [2, 2.508]
  - - [192, 192, 1, 512, 192, 192, 192, 512]
    - [2, 4.999]
  - - [320, 192, 1, 512, 320, 320, 320, 512]
    - [0, 7.609]
  - - [448, 192, 1, 512, 448, 448, 448, 512]
    - [0, 8.228]
  - - [576, 192, 1, 512, 576, 576, 576, 512]
    - [0, 8.639]
  - - [704, 192, 1, 512, 704, 704, 704, 512]
    - [0, 8.958]
  - - [832, 192, 1, 512, 832, 832, 832, 512]
    - [2, 9.482]
  - - [960, 192, 1, 512, 960, 960, 960, 512]
    - [0, 10.533]
  - - [1088, 192, 1, 512, 1088, 1088, 1088, 512]
    - [0, 10.478]
  - - [1216, 192, 1, 512, 1216, 1216, 1216, 512]
    - [0, 10.497]
  - - [1344, 192, 1, 512, 1344, 1344, 1344, 512]
    - [2, 10.79]
  - - [1472, 192, 1, 512, 1472, 1472, 1472, 512]
    - [2, 11.021]
  - - [1600, 192, 1, 512, 1600, 1600, 1600, 512]
    - [0, 11.395]
  - - [1728, 192, 1, 512, 1728, 1728, 1728, 512]
    - [0, 11.339]
  - - [1856, 192, 1, 512, 1856, 1856, 1856, 512]
    - [0, 11.302]
  - - [1984, 192, 1, 512, 1984, 1984, 1984, 512]
    - [2, 11.345]
  - - [2112, 192, 1, 512, 2112, 2112, 2112, 512]
    - [0, 11.264]
  - - [2240, 192, 1, 512, 2240, 2240, 2240, 512]
    - [0, 11.844]
  - - [2368, 192, 1, 512, 2368, 2368, 2368, 512]
    - [0, 11.774]
  - - [2496, 192, 1, 512, 2496, 2496, 2496, 512]
    - [0, 11.71]
  - - [2624, 192, 1, 512, 2624, 2624, 2624, 512]
    - [0, 11.656]
  - - [2752, 192, 1, 512, 2752, 2752, 2752, 512]
    - [0, 11.865]
  - - [2880, 192, 1, 512, 2880, 2880, 2880, 512]
    - [2, 11.304]
  - - [3008, 192, 1, 512, 3008, 3008, 3008, 512]
    - [0, 11.482]
  - - [3136, 192, 1, 512, 3136, 3136, 3136, 512]
    - [0, 11.394]
  - - [3264, 192, 1, 512, 3264, 3264, 3264, 512]
    - [2, 11.453]
  - - [3392, 192, 1, 512, 3392, 3392, 3392, 512]
    - [2, 11.502]
  - - [3520, 192, 1, 512, 3520, 3520, 3520, 512]
    - [0, 11.737]
  - - [3648, 192, 1, 512, 3648, 3648, 3648, 512]
    - [0, 11.724]
  - - [3776, 192, 1, 512, 3776, 3776, 3776, 512]
    - [2, 11.795]
  - - [3904, 192, 1, 512, 3904, 3904, 3904, 512]
    - [2, 11.755]
  - - [4032, 192, 1, 512, 4032, 4032, 4032, 512]
    - [2, 11.714]
  - - [64, 320, 1, 512, 64, 64, 64, 512]
    - [3, 3.035]
  - - [192, 320, 1, 512, 192, 192, 192, 512]
    - [2, 7.241]
  - - [320, 320, 1, 512, 320, 320, 320, 512]
    - [2, 8.063]
  - - [448, 320, 1, 512, 448, 448, 448, 512]
    - [0, 9.455]
  - - [576, 320, 1, 512, 576, 576, 576, 512]
    - [0, 10.506]
  - - [704, 320, 1, 512, 704, 704, 704, 512]
    - [2, 10.475]
  - - [832, 320, 1, 512, 832, 832, 832, 512]
    - [0, 10.851]
  - - [960, 320, 1, 512, 960, 960, 960, 512]
    - [0, 11.391]
  - - [1088, 320, 1, 512, 1088, 1088, 1088, 512]
    - [0, 11.038]
  - - [1216, 320, 1, 512, 1216, 1216, 1216, 512]
    - [0, 11.469]
  - - [1344, 320, 1, 512, 1344, 1344, 1344, 512]
    - [0, 11.846]
  - - [1472, 320, 1, 512, 1472, 1472, 1472, 512]
    - [0, 11.536]
  - - [1600, 320, 1, 512, 1600, 1600, 1600, 512]
    - [0, 11.844]
  - - [1728, 320, 1, 512, 1728, 1728, 1728, 512]
    - [2, 11.441]
  - - [1856, 320, 1, 512, 1856, 1856, 1856, 512]
    - [2, 11.315]
  - - [1984, 320, 1, 512, 1984, 1984, 1984, 512]
    - [0, 11.524]
  - - [2112, 320, 1, 512, 2112, 2112, 2112, 512]
    - [0, 11.743]
  - - [2240, 320, 1, 512, 2240, 2240, 2240, 512]
    - [2, 11.782]
  - - [2368, 320, 1, 512, 2368, 2368, 2368, 512]
    - [0, 11.754]
  - - [2496, 320, 1, 512, 2496, 2496, 2496, 512]
    - [0, 11.949]
  - - [2624, 320, 1, 512, 2624, 2624, 2624, 512]
    - [2, 11.899]
  - - [2752, 320, 1, 512, 2752, 2752, 2752, 512]
    - [2, 12.12]
  - - [2880, 320, 1, 512, 2880, 2880, 2880, 512]
    - [0, 12.084]
  - - [3008, 320, 1, 512, 3008, 3008, 3008, 512]
    - [2, 12.17]
  - - [3136, 320, 1, 512, 3136, 3136, 3136, 512]
    - [2, 12.243]
  - - [3264, 320, 1, 512, 3264, 3264, 3264, 512]
    - [0, 12.204]
  - - [3392, 320, 1, 512, 3392, 3392, 3392, 512]
    - [2, 12.46]
  - - [3520, 320, 1, 512, 3520, 3520, 3520, 512]
    - [2, 12.199]
  - - [3648, 320, 1, 512, 3648, 3648, 3648, 512]
    - [2, 12.299]
  - - [3776, 320, 1, 512, 3776, 3776, 3776, 512]
    - [2, 12.317]
  - - [3904, 320, 1, 512, 3904, 3904, 3904, 512]
    - [2, 12.396]
  - - [4032, 320, 1, 512, 4032, 4032, 4032, 512]
    - [2, 12.412]
  - - [64, 448, 1, 512, 64, 64, 64, 512]
    - [0, 4.918]
  - - [192, 448, 1, 512, 192, 192, 192, 512]
    - [0, 8.222]
  - - [320, 448, 1, 512, 320, 320, 320, 512]
    - [0, 9.473]
  - - [448, 448, 1, 512, 448, 448, 448, 512]
    - [0, 10.123]
  - - [576, 448, 1, 512, 576, 576, 576, 512]
    - [2, 10.585]
  - - [704, 448, 1, 512, 704, 704, 704, 512]
    - [2, 10.861]
  - - [832, 448, 1, 512, 832, 832, 832, 512]
    - [2, 11.24]
  - - [960, 448, 1, 512, 960, 960, 960, 512]
    - [0, 11.833]
  - - [1088, 448, 1, 512, 1088, 1088, 1088, 512]
    - [2, 11.935]
  - - [1216, 448, 1, 512, 1216, 1216, 1216, 512]
    - [2, 11.061]
  - - [1344, 448, 1, 512, 1344, 1344, 1344, 512]
    - [0, 11.398]
  - - [1472, 448, 1, 512, 1472, 1472, 1472, 512]
    - [0, 11.519]
  - - [1600, 448, 1, 512, 1600, 1600, 1600, 512]
    - [2, 11.749]
  - - [1728, 448, 1, 512, 1728, 1728, 1728, 512]
    - [2, 11.799]
  - - [1856, 448, 1, 512, 1856, 1856, 1856, 512]
    - [2, 12.02]
  - - [1984, 448, 1, 512, 1984, 1984, 1984, 512]
    - [0, 12.056]
  - - [2112, 448, 1, 512, 2112, 2112, 2112, 512]
    - [2, 12.077]
  - - [2240, 448, 1, 512, 2240, 2240, 2240, 512]
    - [2, 12.093]
  - - [2368, 448, 1, 512, 2368, 2368, 2368, 512]
    - [2, 12.246]
  - - [2496, 448, 1, 512, 2496, 2496, 2496, 512]
    - [2, 12.384]
  - - [2624, 448, 1, 512, 2624, 2624, 2624, 512]
    - [2, 12.333]
  - - [2752, 448, 1, 512, 2752, 2752, 2752, 512]
    - [2, 12.375]
  - - [2880, 448, 1, 512, 2880, 2880, 2880, 512]
    - [0, 12.399]
  - - [3008, 448, 1, 512, 3008, 3008, 3008, 512]
    - [2, 12.539]
  - - [3136, 448, 1, 512, 3136, 3136, 3136, 512]
    - [2, 12.552]
  - - [3264, 448, 1, 512, 3264, 3264, 3264, 512]
    - [2, 12.57]
  - - [3392, 448, 1, 512, 3392, 3392, 3392, 512]
    - [2, 12.565]
  - - [3520, 448, 1, 512, 3520, 3520, 3520, 512]
    - [2, 12.64]
  - - [3648, 448, 1, 512, 3648, 3648, 3648, 512]
    - [2, 12.679]
  - - [3776, 448, 1, 512, 3776, 3776, 3776, 512]
    - [0, 12.585]
  - - [3904, 448, 1, 512, 3904, 3904, 3904, 512]
    - [2, 12.627]
  - - [4032, 448, 1, 512, 4032, 4032, 4032, 512]
    - [2, 12.76]
  - - [64, 576, 1, 512, 64, 64, 64, 512]
    - [2, 5.002]
  - - [192, 576, 1, 512, 192, 192, 192, 512]
    - [0, 8.616]
  - - [320, 576, 1, 512, 320, 320, 320, 512]
    - [0, 10.534]
  - - [448, 576, 1, 512, 448, 448, 448, 512]
    - [2, 10.584]
  - - [576, 576, 1, 512, 576, 576, 576, 512]
    - [0, 11.341]
  - - [704, 576, 1, 512, 704, 704, 704, 512]
    - [2, 11.381]
  - - [832, 576, 1, 512, 832, 832, 832, 512]
    - [0, 11.72]
  - - [960, 576, 1, 512, 960, 960, 960, 512]
    - [0, 11.126]
  - - [1088, 576, 1, 512, 1088, 1088, 1088, 512]
    - [0, 11.511]
  - - [1216, 576, 1, 512, 1216, 1216, 1216, 512]
    - [0, 11.715]
  - - [1344, 576, 1, 512, 1344, 1344, 1344, 512]
    - [2, 11.94]
  - - [1472, 576, 1, 512, 1472, 1472, 1472, 512]
    - [2, 12.025]
  - - [1600, 576, 1, 512, 1600, 1600, 1600, 512]
    - [0, 12.087]
  - - [1728, 576, 1, 512, 1728, 1728, 1728, 512]
    - [2, 12.037]
  - - [1856, 576, 1, 512, 1856, 1856, 1856, 512]
    - [0, 12.187]
  - - [1984, 576, 1, 512, 1984, 1984, 1984, 512]
    - [2, 12.327]
  - - [2112, 576, 1, 512, 2112, 2112, 2112, 512]
    - [2, 12.332]
  - - [2240, 576, 1, 512, 2240, 2240, 2240, 512]
    - [2, 12.581]
  - - [2368, 576, 1, 512, 2368, 2368, 2368, 512]
    - [2, 12.457]
  - - [2496, 576, 1, 512, 2496, 2496, 2496, 512]
    - [2, 12.542]
  - - [2624, 576, 1, 512, 2624, 2624, 2624, 512]
    - [2, 12.61]
  - - [2752, 576, 1, 512, 2752, 2752, 2752, 512]
    - [2, 12.607]
  - - [2880, 576, 1, 512, 2880, 2880, 2880, 512]
    - [2, 12.652]
  - - [3008, 576, 1, 512, 3008, 3008, 3008, 512]
    - [2, 12.675]
  - - [3136, 576, 1, 512, 3136, 3136, 3136, 512]
    - [2, 12.665]
  - - [3264, 576, 1, 512, 3264, 3264, 3264, 512]
    - [2, 12.755]
  - - [3392, 576, 1, 512, 3392, 3392, 3392, 512]
    - [2, 12.724]
  - - [3520, 576, 1, 512, 3520, 3520, 3520, 512]
    - [2, 12.769]
  - - [3648, 576, 1, 512, 3648, 3648, 3648, 512]
    - [2, 12.913]
  - - [3776, 576, 1, 512, 3776, 3776, 3776, 512]
    - [2, 12.906]
  - - [3904, 576, 1, 512, 3904, 3904, 3904, 512]
    - [2, 12.86]
  - - [4032, 576, 1, 512, 4032, 4032, 4032, 512]
    - [2, 12.865]
  - - [64, 704, 1, 512, 64, 64, 64, 512]
    - [2, 6.104]
  - - [192, 704, 1, 512, 192, 192, 192, 512]
    - [0, 8.935]
  - - [320, 704, 1, 512, 320, 320, 320, 512]
    - [0, 10.204]
  - - [448, 704, 1, 512, 448, 448, 448, 512]
    - [2, 11.255]
  - - [576, 704, 1, 512, 576, 576, 576, 512]
    - [2, 11.471]
  - - [704, 704, 1, 512, 704, 704, 704, 512]
    - [0, 11.535]
  - - [832, 704, 1, 512, 832, 832, 832, 512]
    - [0, 11.481]
  - - [960, 704, 1, 512, 960, 960, 960, 512]
    - [0, 11.739]
  - - [1088, 704, 1, 512, 1088, 1088, 1088, 512]
    - [0, 11.882]
  - - [1216, 704, 1, 512, 1216, 1216, 1216, 512]
    - [0, 11.977]
  - - [1344, 704, 1, 512, 1344, 1344, 1344, 512]
    - [2, 12.138]
  - - [1472, 704, 1, 512, 1472, 1472, 1472, 512]
    - [0, 12.147]
  - - [1600, 704, 1, 512, 1600, 1600, 1600, 512]
    - [2, 12.267]
  - - [1728, 704, 1, 512, 1728, 1728, 1728, 512]
    - [2, 12.386]
  - - [1856, 704, 1, 512, 1856, 1856, 1856, 512]
    - [2, 12.49]
  - - [1984, 704, 1, 512, 1984, 1984, 1984, 512]
    - [2, 12.499]
  - - [2112, 704, 1, 512, 2112, 2112, 2112, 512]
    - [2, 12.581]
  - - [2240, 704, 1, 512, 2240, 2240, 2240, 512]
    - [2, 12.651]
  - - [2368, 704, 1, 512, 2368, 2368, 2368, 512]
    - [2, 12.681]
  - - [2496, 704, 1, 512, 2496, 2496, 2496, 512]
    - [2, 12.653]
  - - [2624, 704, 1, 512, 2624, 2624, 2624, 512]
    - [2, 12.72]
  - - [2752, 704, 1, 512, 2752, 2752, 2752, 512]
    - [2, 12.863]
  - - [2880, 704, 1, 512, 2880, 2880, 2880, 512]
    - [2, 12.795]
  - - [3008, 704, 1, 512, 3008, 3008, 3008, 512]
    - [2, 12.803]
  - - [3136, 704, 1, 512, 3136, 3136, 3136, 512]
    - [2, 12.875]
  - - [3264, 704, 1, 512, 3264, 3264, 3264, 512]
    - [2, 12.851]
  - - [3392, 704, 1, 512, 3392, 3392, 3392, 512]
    - [2, 12.904]
  - - [3520, 704, 1, 512, 3520, 3520, 3520, 512]
    - [2, 12.882]
  - - [3648, 704, 1, 512, 3648, 3648, 3648, 512]
    - [2, 12.934]
  - - [3776, 704, 1, 512, 3776, 3776, 3776, 512]
    - [2, 13.003]
  - - [3904, 704, 1, 512, 3904, 3904, 3904, 512]
    - [2, 13.023]
  - - [4032, 704, 1, 512, 4032, 4032, 4032, 512]
    - [2, 12.974]
  - - [64, 832, 1, 512, 64, 64, 64, 512]
    - [0, 6.63]
  - - [192, 832, 1, 512, 192, 192, 192, 512]
    - [2, 9.557]
  - - [320, 832, 1, 512, 320, 320, 320, 512]
    - [0, 10.863]
  - - [448, 832, 1, 512, 448, 448, 448, 512]
    - [2, 11.166]
  - - [576, 832, 1, 512, 576, 576, 576, 512]
    - [2, 11.764]
  - - [704, 832, 1, 512, 704, 704, 704, 512]
    - [2, 11.406]
  - - [832, 832, 1, 512, 832, 832, 832, 512]
    - [2, 11.664]
  - - [960, 832, 1, 512, 960, 960, 960, 512]
    - [0, 11.934]
  - - [1088, 832, 1, 512, 1088, 1088, 1088, 512]
    - [0, 11.962]
  - - [1216, 832, 1, 512, 1216, 1216, 1216, 512]
    - [0, 12.193]
  - - [1344, 832, 1, 512, 1344, 1344, 1344, 512]
    - [2, 12.228]
  - - [1472, 832, 1, 512, 1472, 1472, 1472, 512]
    - [2, 12.364]
  - - [1600, 832, 1, 512, 1600, 1600, 1600, 512]
    - [2, 12.513]
  - - [1728, 832, 1, 512, 1728, 1728, 1728, 512]
    - [2, 12.586]
  - - [1856, 832, 1, 512, 1856, 1856, 1856, 512]
    - [2, 12.577]
  - - [1984, 832, 1, 512, 1984, 1984, 1984, 512]
    - [2, 12.701]
  - - [2112, 832, 1, 512, 2112, 2112, 2112, 512]
    - [2, 12.743]
  - - [2240, 832, 1, 512, 2240, 2240, 2240, 512]
    - [2, 12.704]
  - - [2368, 832, 1, 512, 2368, 2368, 2368, 512]
    - [2, 12.819]
  - - [2496, 832, 1, 512, 2496, 2496, 2496, 512]
    - [0, 12.82]
  - - [2624, 832, 1, 512, 2624, 2624, 2624, 512]
    - [2, 12.855]
  - - [2752, 832, 1, 512, 2752, 2752, 2752, 512]
    - [2, 12.857]
  - - [2880, 832, 1, 512, 2880, 2880, 2880, 512]
    - [2, 12.916]
  - - [3008, 832, 1, 512, 3008, 3008, 3008, 512]
    - [2, 12.926]
  - - [3136, 832, 1, 512, 3136, 3136, 3136, 512]
    - [2, 12.987]
  - - [3264, 832, 1, 512, 3264, 3264, 3264, 512]
    - [2, 12.93]
  - - [3392, 832, 1, 512, 3392, 3392, 3392, 512]
    - [2, 12.999]
  - - [3520, 832, 1, 512, 3520, 3520, 3520, 512]
    - [2, 13.013]
  - - [3648, 832, 1, 512, 3648, 3648, 3648, 512]
    - [2, 12.998]
  - - [3776, 832, 1, 512, 3776, 3776, 3776, 512]
    - [2, 13.022]
  - - [3904, 832, 1, 512, 3904, 3904, 3904, 512]
    - [2, 13.06]
  - - [4032, 832, 1, 512, 4032, 4032, 4032, 512]
    - [2, 13.059]
  - - [64, 960, 1, 512, 64, 64, 64, 512]
    - [0, 7.622]
  - - [192, 960, 1, 512, 192, 192, 192, 512]
    - [0, 10.539]
  - - [320, 960, 1, 512, 320, 320, 320, 512]
    - [0, 11.402]
  - - [448, 960, 1, 512, 448, 448, 448, 512]
    - [0, 11.853]
  - - [576, 960, 1, 512, 576, 576, 576, 512]
    - [2, 11.48]
  - - [704, 960, 1, 512, 704, 704, 704, 512]
    - [0, 11.728]
  - - [832, 960, 1, 512, 832, 832, 832, 512]
    - [0, 11.935]
  - - [960, 960, 1, 512, 960, 960, 960, 512]
    - [0, 12.095]
  - - [1088, 960, 1, 512, 1088, 1088, 1088, 512]
    - [0, 12.22]
  - - [1216, 960, 1, 512, 1216, 1216, 1216, 512]
    - [0, 12.313]
  - - [1344, 960, 1, 512, 1344, 1344, 1344, 512]
    - [2, 12.416]
  - - [1472, 960, 1, 512, 1472, 1472, 1472, 512]
    - [2, 12.551]
  - - [1600, 960, 1, 512, 1600, 1600, 1600, 512]
    - [2, 12.567]
  - - [1728, 960, 1, 512, 1728, 1728, 1728, 512]
    - [2, 12.564]
  - - [1856, 960, 1, 512, 1856, 1856, 1856, 512]
    - [2, 12.728]
  - - [1984, 960, 1, 512, 1984, 1984, 1984, 512]
    - [2, 12.793]
  - - [2112, 960, 1, 512, 2112, 2112, 2112, 512]
    - [2, 12.81]
  - - [2240, 960, 1, 512, 2240, 2240, 2240, 512]
    - [2, 12.911]
  - - [2368, 960, 1, 512, 2368, 2368, 2368, 512]
    - [2, 12.802]
  - - [2496, 960, 1, 512, 2496, 2496, 2496, 512]
    - [2, 12.922]
  - - [2624, 960, 1, 512, 2624, 2624, 2624, 512]
    - [2, 12.952]
  - - [2752, 960, 1, 512, 2752, 2752, 2752, 512]
    - [2, 13.011]
  - - [2880, 960, 1, 512, 2880, 2880, 2880, 512]
    - [2, 12.928]
  - - [3008, 960, 1, 512, 3008, 3008, 3008, 512]
    - [2, 12.975]
  - - [3136, 960, 1, 512, 3136, 3136, 3136, 512]
    - [2, 13.047]
  - - [3264, 960, 1, 512, 3264, 3264, 3264, 512]
    - [2, 12.986]
  - - [3392, 960, 1, 512, 3392, 3392, 3392, 512]
    - [2, 13.065]
  - - [3520, 960, 1, 512, 3520, 3520, 3520, 512]
    - [2, 13.082]
  - - [3648, 960, 1, 512, 3648, 3648, 3648, 512]
    - [2, 13.131]
  - - [3776, 960, 1, 512, 3776, 3776, 3776, 512]
    - [2, 13.135]
  - - [3904, 960, 1, 512, 3904, 3904, 3904, 512]
    - [2, 13.111]
  - - [4032, 960, 1, 512, 4032, 4032, 4032, 512]
    - [2, 13.187]
  - - [64, 1088, 1, 512, 64, 64, 64, 512]
    - [2, 6.92]
  - - [192, 1088, 1, 512, 192, 192, 192, 512]
    - [0, 10.489]
  - - [320, 1088, 1, 512, 320, 320, 320, 512]
    - [2, 11.215]
  - - [448, 1088, 1, 512, 448, 448, 448, 512]
    - [0, 11.884]
  - - [576, 1088, 1, 512, 576, 576, 576, 512]
    - [2, 11.482]
  - - [704, 1088, 1, 512, 704, 704, 704, 512]
    - [0, 11.865]
  - - [832, 1088, 1, 512, 832, 832, 832, 512]
    - [2, 12.048]
  - - [960, 1088, 1, 512, 960, 960, 960, 512]
    - [2, 12.241]
  - - [1088, 1088, 1, 512, 1088, 1088, 1088, 512]
    - [2, 12.411]
  - - [1216, 1088, 1, 512, 1216, 1216, 1216, 512]
    - [2, 12.449]
  - - [1344, 1088, 1, 512, 1344, 1344, 1344, 512]
    - [2, 12.591]
  - - [1472, 1088, 1, 512, 1472, 1472, 1472, 512]
    - [2, 12.646]
  - - [1600, 1088, 1, 512, 1600, 1600, 1600, 512]
    - [2, 12.786]
  - - [1728, 1088, 1, 512, 1728, 1728, 1728, 512]
    - [2, 12.775]
  - - [1856, 1088, 1, 512, 1856, 1856, 1856, 512]
    - [2, 12.779]
  - - [1984, 1088, 1, 512, 1984, 1984, 1984, 512]
    - [2, 12.926]
  - - [2112, 1088, 1, 512, 2112, 2112, 2112, 512]
    - [2, 12.908]
  - - [2240, 1088, 1, 512, 2240, 2240, 2240, 512]
    - [2, 12.863]
  - - [2368, 1088, 1, 512, 2368, 2368, 2368, 512]
    - [2, 12.995]
  - - [2496, 1088, 1, 512, 2496, 2496, 2496, 512]
    - [2, 13.011]
  - - [2624, 1088, 1, 512, 2624, 2624, 2624, 512]
    - [2, 13.013]
  - - [2752, 1088, 1, 512, 2752, 2752, 2752, 512]
    - [2, 13.099]
  - - [2880, 1088, 1, 512, 2880, 2880, 2880, 512]
    - [2, 13.023]
  - - [3008, 1088, 1, 512, 3008, 3008, 3008, 512]
    - [2, 13.037]
  - - [3136, 1088, 1, 512, 3136, 3136, 3136, 512]
    - [2, 13.029]
  - - [3264, 1088, 1, 512, 3264, 3264, 3264, 512]
    - [2, 13.047]
  - - [3392, 1088, 1, 512, 3392, 3392, 3392, 512]
    - [2, 13.14]
  - - [3520, 1088, 1, 512, 3520, 3520, 3520, 512]
    - [2, 13.147]
  - - [3648, 1088, 1, 512, 3648, 3648, 3648, 512]
    - [2, 13.188]
  - - [3776, 1088, 1, 512, 3776, 3776, 3776, 512]
    - [2, 13.104]
  - - [3904, 1088, 1, 512, 3904, 3904, 3904, 512]
    - [0, 13.119]
  - - [4032, 1088, 1, 512, 4032, 4032, 4032, 512]
    - [2, 12.966]
  - - [64, 1216, 1, 512, 64, 64, 64, 512]
    - [0, 7.446]
  - - [192, 1216, 1, 512, 192, 192, 192, 512]
    - [0, 10.492]
  - - [320, 1216, 1, 512, 320, 320, 320, 512]
    - [0, 11.472]
  - - [448, 1216, 1, 512, 448, 448, 448, 512]
    - [2, 11.444]
  - - [576, 1216, 1, 512, 576, 576, 576, 512]
    - [0, 11.705]
  - - [704, 1216, 1, 512, 704, 704, 704, 512]
    - [2, 12.008]
  - - [832, 1216, 1, 512, 832, 832, 832, 512]
    - [2, 12.184]
  - - [960, 1216, 1, 512, 960, 960, 960, 512]
    - [0, 12.315]
  - - [1088, 1216, 1, 512, 1088, 1088, 1088, 512]
    - [2, 12.542]
  - - [1216, 1216, 1, 512, 1216, 1216, 1216, 512]
    - [2, 12.55]
  - - [1344, 1216, 1, 512, 1344, 1344, 1344, 512]
    - [2, 12.674]
  - - [1472, 1216, 1, 512, 1472, 1472, 1472, 512]
    - [2, 12.698]
  - - [1600, 1216, 1, 512, 1600, 1600, 1600, 512]
    - [2, 12.804]
  - - [1728, 1216, 1, 512, 1728, 1728, 1728, 512]
    - [2, 12.841]
  - - [1856, 1216, 1, 512, 1856, 1856, 1856, 512]
    - [2, 12.873]
  - - [1984, 1216, 1, 512, 1984, 1984, 1984, 512]
    - [2, 12.86]
  - - [2112, 1216, 1, 512, 2112, 2112, 2112, 512]
    - [2, 12.92]
  - - [2240, 1216, 1, 512, 2240, 2240, 2240, 512]
    - [2, 12.955]
  - - [2368, 1216, 1, 512, 2368, 2368, 2368, 512]
    - [2, 12.966]
  - - [2496, 1216, 1, 512, 2496, 2496, 2496, 512]
    - [2, 13.079]
  - - [2624, 1216, 1, 512, 2624, 2624, 2624, 512]
    - [2, 13.047]
  - - [2752, 1216, 1, 512, 2752, 2752, 2752, 512]
    - [2, 13.012]
  - - [2880, 1216, 1, 512, 2880, 2880, 2880, 512]
    - [2, 13.093]
  - - [3008, 1216, 1, 512, 3008, 3008, 3008, 512]
    - [2, 13.094]
  - - [3136, 1216, 1, 512, 3136, 3136, 3136, 512]
    - [2, 13.147]
  - - [3264, 1216, 1, 512, 3264, 3264, 3264, 512]
    - [2, 13.158]
  - - [3392, 1216, 1, 512, 3392, 3392, 3392, 512]
    - [2, 13.094]
  - - [3520, 1216, 1, 512, 3520, 3520, 3520, 512]
    - [2, 13.022]
  - - [3648, 1216, 1, 512, 3648, 3648, 3648, 512]
    - [2, 12.985]
  - - [3776, 1216, 1, 512, 3776, 3776, 3776, 512]
    - [2, 12.973]
  - - [3904, 1216, 1, 512, 3904, 3904, 3904, 512]
    - [2, 12.986]
  - - [4032, 1216, 1, 512, 4032, 4032, 4032, 512]
    - [2, 13.017]
  - - [64, 1344, 1, 512, 64, 64, 64, 512]
    - [0, 8.236]
  - - [192, 1344, 1, 512, 192, 192, 192, 512]
    - [0, 10.536]
  - - [320, 1344, 1, 512, 320, 320, 320, 512]
    - [0, 11.839]
  - - [448, 1344, 1, 512, 448, 448, 448, 512]
    - [2, 11.43]
  - - [576, 1344, 1, 512, 576, 576, 576, 512]
    - [2, 11.962]
  - - [704, 1344, 1, 512, 704, 704, 704, 512]
    - [0, 12.064]
  - - [832, 1344, 1, 512, 832, 832, 832, 512]
    - [2, 12.213]
  - - [960, 1344, 1, 512, 960, 960, 960, 512]
    - [0, 12.414]
  - - [1088, 1344, 1, 512, 1088, 1088, 1088, 512]
    - [2, 12.494]
  - - [1216, 1344, 1, 512, 1216, 1216, 1216, 512]
    - [2, 12.615]
  - - [1344, 1344, 1, 512, 1344, 1344, 1344, 512]
    - [2, 12.765]
  - - [1472, 1344, 1, 512, 1472, 1472, 1472, 512]
    - [2, 12.788]
  - - [1600, 1344, 1, 512, 1600, 1600, 1600, 512]
    - [2, 12.844]
  - - [1728, 1344, 1, 512, 1728, 1728, 1728, 512]
    - [2, 12.812]
  - - [1856, 1344, 1, 512, 1856, 1856, 1856, 512]
    - [2, 12.939]
  - - [1984, 1344, 1, 512, 1984, 1984, 1984, 512]
    - [2, 12.997]
  - - [2112, 1344, 1, 512, 2112, 2112, 2112, 512]
    - [2, 13.006]
  - - [2240, 1344, 1, 512, 2240, 2240, 2240, 512]
    - [2, 13.018]
  - - [2368, 1344, 1, 512, 2368, 2368, 2368, 512]
    - [2, 13.075]
  - - [2496, 1344, 1, 512, 2496, 2496, 2496, 512]
    - [2, 13.039]
  - - [2624, 1344, 1, 512, 2624, 2624, 2624, 512]
    - [2, 13.143]
  - - [2752, 1344, 1, 512, 2752, 2752, 2752, 512]
    - [2, 13.148]
  - - [2880, 1344, 1, 512, 2880, 2880, 2880, 512]
    - [2, 13.097]
  - - [3008, 1344, 1, 512, 3008, 3008, 3008, 512]
    - [2, 13.175]
  - - [3136, 1344, 1, 512, 3136, 3136, 3136, 512]
    - [2, 13.173]
  - - [3264, 1344, 1, 512, 3264, 3264, 3264, 512]
    - [2, 12.977]
  - - [3392, 1344, 1, 512, 3392, 3392, 3392, 512]
    - [2, 13.0]
  - - [3520, 1344, 1, 512, 3520, 3520, 3520, 512]
    - [2, 12.996]
  - - [3648, 1344, 1, 512, 3648, 3648, 3648, 512]
    - [2, 13.044]
  - - [3776, 1344, 1, 512, 3776, 3776, 3776, 512]
    - [2, 13.031]
  - - [3904, 1344, 1, 512, 3904, 3904, 3904, 512]
    - [2, 13.052]
  - - [4032, 1344, 1, 512, 4032, 4032, 4032, 512]
    - [2, 13.097]
  - - [64, 1472, 1, 512, 64, 64, 64, 512]
    - [2, 7.493]
  - - [192, 1472, 1, 512, 192, 192, 192, 512]
    - [2, 10.847]
  - - [320, 1472, 1, 512, 320, 320, 320, 512]
    - [2, 11.617]
  - - [448, 1472, 1, 512, 448, 448, 448, 512]
    - [2, 11.587]
  - - [576, 1472, 1, 512, 576, 576, 576, 512]
    - [2, 11.899]
  - - [704, 1472, 1, 512, 704, 704, 704, 512]
    - [2, 12.147]
  - - [832, 1472, 1, 512, 832, 832, 832, 512]
    - [2, 12.34]
  - - [960, 1472, 1, 512, 960, 960, 960, 512]
    - [2, 12.575]
  - - [1088, 1472, 1, 512, 1088, 1088, 1088, 512]
    - [2, 12.636]
  - - [1216, 1472, 1, 512, 1216, 1216, 1216, 512]
    - [2, 12.721]
  - - [1344, 1472, 1, 512, 1344, 1344, 1344, 512]
    - [2, 12.755]
  - - [1472, 1472, 1, 512, 1472, 1472, 1472, 512]
    - [2, 12.834]
  - - [1600, 1472, 1, 512, 1600, 1600, 1600, 512]
    - [2, 12.869]
  - - [1728, 1472, 1, 512, 1728, 1728, 1728, 512]
    - [2, 12.898]
  - - [1856, 1472, 1, 512, 1856, 1856, 1856, 512]
    - [2, 12.931]
  - - [1984, 1472, 1, 512, 1984, 1984, 1984, 512]
    - [0, 12.98]
  - - [2112, 1472, 1, 512, 2112, 2112, 2112, 512]
    - [2, 13.052]
  - - [2240, 1472, 1, 512, 2240, 2240, 2240, 512]
    - [2, 13.102]
  - - [2368, 1472, 1, 512, 2368, 2368, 2368, 512]
    - [2, 13.1]
  - - [2496, 1472, 1, 512, 2496, 2496, 2496, 512]
    - [2, 13.159]
  - - [2624, 1472, 1, 512, 2624, 2624, 2624, 512]
    - [2, 13.15]
  - - [2752, 1472, 1, 512, 2752, 2752, 2752, 512]
    - [2, 13.13]
  - - [2880, 1472, 1, 512, 2880, 2880, 2880, 512]
    - [2, 13.1]
  - - [3008, 1472, 1, 512, 3008, 3008, 3008, 512]
    - [2, 12.978]
  - - [3136, 1472, 1, 512, 3136, 3136, 3136, 512]
    - [2, 12.969]
  - - [3264, 1472, 1, 512, 3264, 3264, 3264, 512]
    - [2, 13.032]
  - - [3392, 1472, 1, 512, 3392, 3392, 3392, 512]
    - [2, 13.002]
  - - [3520, 1472, 1, 512, 3520, 3520, 3520, 512]
    - [2, 13.059]
  - - [3648, 1472, 1, 512, 3648, 3648, 3648, 512]
    - [2, 13.025]
  - - [3776, 1472, 1, 512, 3776, 3776, 3776, 512]
    - [2, 13.082]
  - - [3904, 1472, 1, 512, 3904, 3904, 3904, 512]
    - [2, 13.073]
  - - [4032, 1472, 1, 512, 4032, 4032, 4032, 512]
    - [2, 13.091]
  - - [64, 1600, 1, 512, 64, 64, 64, 512]
    - [2, 8.079]
  - - [192, 1600, 1, 512, 192, 192, 192, 512]
    - [0, 11.397]
  - - [320, 1600, 1, 512, 320, 320, 320, 512]
    - [0, 11.841]
  - - [448, 1600, 1, 512, 448, 448, 448, 512]
    - [2, 11.638]
  - - [576, 1600, 1, 512, 576, 576, 576, 512]
    - [0, 12.09]
  - - [704, 1600, 1, 512, 704, 704, 704, 512]
    - [2, 12.235]
  - - [832, 1600, 1, 512, 832, 832, 832, 512]
    - [2, 12.527]
  - - [960, 1600, 1, 512, 960, 960, 960, 512]
    - [2, 12.568]
  - - [1088, 1600, 1, 512, 1088, 1088, 1088, 512]
    - [2, 12.724]
  - - [1216, 1600, 1, 512, 1216, 1216, 1216, 512]
    - [2, 12.797]
  - - [1344, 1600, 1, 512, 1344, 1344, 1344, 512]
    - [2, 12.91]
  - - [1472, 1600, 1, 512, 1472, 1472, 1472, 512]
    - [2, 12.931]
  - - [1600, 1600, 1, 512, 1600, 1600, 1600, 512]
    - [2, 12.97]
  - - [1728, 1600, 1, 512, 1728, 1728, 1728, 512]
    - [2, 12.968]
  - - [1856, 1600, 1, 512, 1856, 1856, 1856, 512]
    - [2, 13.047]
  - - [1984, 1600, 1, 512, 1984, 1984, 1984, 512]
    - [2, 13.038]
  - - [2112, 1600, 1, 512, 2112, 2112, 2112, 512]
    - [2, 13.068]
  - - [2240, 1600, 1, 512, 2240, 2240, 2240, 512]
    - [2, 13.094]
  - - [2368, 1600, 1, 512, 2368, 2368, 2368, 512]
    - [2, 13.108]
  - - [2496, 1600, 1, 512, 2496, 2496, 2496, 512]
    - [2, 13.181]
  - - [2624, 1600, 1, 512, 2624, 2624, 2624, 512]
    - [2, 13.167]
  - - [2752, 1600, 1, 512, 2752, 2752, 2752, 512]
    - [2, 12.986]
  - - [2880, 1600, 1, 512, 2880, 2880, 2880, 512]
    - [2, 12.988]
  - - [3008, 1600, 1, 512, 3008, 3008, 3008, 512]
    - [2, 13.013]
  - - [3136, 1600, 1, 512, 3136, 3136, 3136, 512]
    - [2, 13.029]
  - - [3264, 1600, 1, 512, 3264, 3264, 3264, 512]
    - [2, 13.051]
  - - [3392, 1600, 1, 512, 3392, 3392, 3392, 512]
    - [2, 13.122]
  - - [3520, 1600, 1, 512, 3520, 3520, 3520, 512]
    - [2, 13.07]
  - - [3648, 1600, 1, 512, 3648, 3648, 3648, 512]
    - [2, 13.108]
  - - [3776, 1600, 1, 512, 3776, 3776, 3776, 512]
    - [2, 13.108]
  - - [3904, 1600, 1, 512, 3904, 3904, 3904, 512]
    - [2, 13.148]
  - - [4032, 1600, 1, 512, 4032, 4032, 4032, 512]
    - [2, 13.166]
  - - [64, 1728, 1, 512, 64, 64, 64, 512]
    - [0, 8.673]
  - - [192, 1728, 1, 512, 192, 192, 192, 512]
    - [0, 11.336]
  - - [320, 1728, 1, 512, 320, 320, 320, 512]
    - [2, 11.33]
  - - [448, 1728, 1, 512, 448, 448, 448, 512]
    - [0, 11.949]
  - - [576, 1728, 1, 512, 576, 576, 576, 512]
    - [2, 12.176]
  - - [704, 1728, 1, 512, 704, 704, 704, 512]
    - [2, 12.313]
  - - [832, 1728, 1, 512, 832, 832, 832, 512]
    - [2, 12.467]
  - - [960, 1728, 1, 512, 960, 960, 960, 512]
    - [2, 12.627]
  - - [1088, 1728, 1, 512, 1088, 1088, 1088, 512]
    - [2, 12.762]
  - - [1216, 1728, 1, 512, 1216, 1216, 1216, 512]
    - [2, 12.837]
  - - [1344, 1728, 1, 512, 1344, 1344, 1344, 512]
    - [2, 12.857]
  - - [1472, 1728, 1, 512, 1472, 1472, 1472, 512]
    - [2, 12.944]
  - - [1600, 1728, 1, 512, 1600, 1600, 1600, 512]
    - [2, 12.952]
  - - [1728, 1728, 1, 512, 1728, 1728, 1728, 512]
    - [2, 13.022]
  - - [1856, 1728, 1, 512, 1856, 1856, 1856, 512]
    - [2, 13.031]
  - - [1984, 1728, 1, 512, 1984, 1984, 1984, 512]
    - [2, 13.063]
  - - [2112, 1728, 1, 512, 2112, 2112, 2112, 512]
    - [2, 13.085]
  - - [2240, 1728, 1, 512, 2240, 2240, 2240, 512]
    - [2, 13.179]
  - - [2368, 1728, 1, 512, 2368, 2368, 2368, 512]
    - [2, 13.169]
  - - [2496, 1728, 1, 512, 2496, 2496, 2496, 512]
    - [2, 12.972]
  - - [2624, 1728, 1, 512, 2624, 2624, 2624, 512]
    - [2, 12.981]
  - - [2752, 1728, 1, 512, 2752, 2752, 2752, 512]
    - [2, 13.012]
  - - [2880, 1728, 1, 512, 2880, 2880, 2880, 512]
    - [2, 13.004]
  - - [3008, 1728, 1, 512, 3008, 3008, 3008, 512]
    - [2, 13.024]
  - - [3136, 1728, 1, 512, 3136, 3136, 3136, 512]
    - [2, 13.09]
  - - [3264, 1728, 1, 512, 3264, 3264, 3264, 512]
    - [2, 13.072]
  - - [3392, 1728, 1, 512, 3392, 3392, 3392, 512]
    - [2, 13.122]
  - - [3520, 1728, 1, 512, 3520, 3520, 3520, 512]
    - [2, 13.129]
  - - [3648, 1728, 1, 512, 3648, 3648, 3648, 512]
    - [2, 13.151]
  - - [3776, 1728, 1, 512, 3776, 3776, 3776, 512]
    - [2, 13.137]
  - - [3904, 1728, 1, 512, 3904, 3904, 3904, 512]
    - [2, 13.192]
  - - [4032, 1728, 1, 512, 4032, 4032, 4032, 512]
    - [2, 13.17]
  - - [64, 1856, 1, 512, 64, 64, 64, 512]
    - [0, 9.296]
  - - [192, 1856, 1, 512, 192, 192, 192, 512]
    - [0, 11.272]
  - - [320, 1856, 1, 512, 320, 320, 320, 512]
    - [2, 11.284]
  - - [448, 1856, 1, 512, 448, 448, 448, 512]
    - [2, 11.991]
  - - [576, 1856, 1, 512, 576, 576, 576, 512]
    - [2, 12.273]
  - - [704, 1856, 1, 512, 704, 704, 704, 512]
    - [0, 12.517]
  - - [832, 1856, 1, 512, 832, 832, 832, 512]
    - [2, 12.692]
  - - [960, 1856, 1, 512, 960, 960, 960, 512]
    - [2, 12.629]
  - - [1088, 1856, 1, 512, 1088, 1088, 1088, 512]
    - [2, 12.776]
  - - [1216, 1856, 1, 512, 1216, 1216, 1216, 512]
    - [2, 12.753]
  - - [1344, 1856, 1, 512, 1344, 1344, 1344, 512]
    - [2, 12.88]
  - - [1472, 1856, 1, 512, 1472, 1472, 1472, 512]
    - [2, 12.947]
  - - [1600, 1856, 1, 512, 1600, 1600, 1600, 512]
    - [2, 12.946]
  - - [1728, 1856, 1, 512, 1728, 1728, 1728, 512]
    - [2, 12.956]
  - - [1856, 1856, 1, 512, 1856, 1856, 1856, 512]
    - [2, 13.031]
  - - [1984, 1856, 1, 512, 1984, 1984, 1984, 512]
    - [2, 13.095]
  - - [2112, 1856, 1, 512, 2112, 2112, 2112, 512]
    - [2, 13.122]
  - - [2240, 1856, 1, 512, 2240, 2240, 2240, 512]
    - [2, 13.122]
  - - [2368, 1856, 1, 512, 2368, 2368, 2368, 512]
    - [2, 12.955]
  - - [2496, 1856, 1, 512, 2496, 2496, 2496, 512]
    - [2, 13.009]
  - - [2624, 1856, 1, 512, 2624, 2624, 2624, 512]
    - [2, 13.052]
  - - [2752, 1856, 1, 512, 2752, 2752, 2752, 512]
    - [2, 13.018]
  - - [2880, 1856, 1, 512, 2880, 2880, 2880, 512]
    - [2, 13.072]
  - - [3008, 1856, 1, 512, 3008, 3008, 3008, 512]
    - [2, 13.066]
  - - [3136, 1856, 1, 512, 3136, 3136, 3136, 512]
    - [2, 13.123]
  - - [3264, 1856, 1, 512, 3264, 3264, 3264, 512]
    - [2, 13.115]
  - - [3392, 1856, 1, 512, 3392, 3392, 3392, 512]
    - [2, 13.114]
  - - [3520, 1856, 1, 512, 3520, 3520, 3520, 512]
    - [2, 13.156]
  - - [3648, 1856, 1, 512, 3648, 3648, 3648, 512]
    - [2, 13.17]
  - - [3776, 1856, 1, 512, 3776, 3776, 3776, 512]
    - [2, 13.173]
  - - [3904, 1856, 1, 512, 3904, 3904, 3904, 512]
    - [0, 13.184]
  - - [4032, 1856, 1, 512, 4032, 4032, 4032, 512]
    - [2, 13.19]
  - - [64, 1984, 1, 512, 64, 64, 64, 512]
    - [0, 8.455]
  - - [192, 1984, 1, 512, 192, 192, 192, 512]
    - [2, 11.282]
  - - [320, 1984, 1, 512, 320, 320, 320, 512]
    - [0, 11.507]
  - - [448, 1984, 1, 512, 448, 448, 448, 512]
    - [0, 12.041]
  - - [576, 1984, 1, 512, 576, 576, 576, 512]
    - [2, 12.325]
  - - [704, 1984, 1, 512, 704, 704, 704, 512]
    - [2, 12.497]
  - - [832, 1984, 1, 512, 832, 832, 832, 512]
    - [2, 12.676]
  - - [960, 1984, 1, 512, 960, 960, 960, 512]
    - [2, 12.748]
  - - [1088, 1984, 1, 512, 1088, 1088, 1088, 512]
    - [2, 12.796]
  - - [1216, 1984, 1, 512, 1216, 1216, 1216, 512]
    - [2, 12.928]
  - - [1344, 1984, 1, 512, 1344, 1344, 1344, 512]
    - [2, 12.934]
  - - [1472, 1984, 1, 512, 1472, 1472, 1472, 512]
    - [2, 13.0]
  - - [1600, 1984, 1, 512, 1600, 1600, 1600, 512]
    - [2, 13.043]
  - - [1728, 1984, 1, 512, 1728, 1728, 1728, 512]
    - [2, 13.1]
  - - [1856, 1984, 1, 512, 1856, 1856, 1856, 512]
    - [2, 13.06]
  - - [1984, 1984, 1, 512, 1984, 1984, 1984, 512]
    - [2, 13.126]
  - - [2112, 1984, 1, 512, 2112, 2112, 2112, 512]
    - [2, 13.157]
  - - [2240, 1984, 1, 512, 2240, 2240, 2240, 512]
    - [2, 12.935]
  - - [2368, 1984, 1, 512, 2368, 2368, 2368, 512]
    - [2, 12.93]
  - - [2496, 1984, 1, 512, 2496, 2496, 2496, 512]
    - [2, 13.045]
  - - [2624, 1984, 1, 512, 2624, 2624, 2624, 512]
    - [2, 13.035]
  - - [2752, 1984, 1, 512, 2752, 2752, 2752, 512]
    - [2, 13.1]
  - - [2880, 1984, 1, 512, 2880, 2880, 2880, 512]
    - [2, 13.057]
  - - [3008, 1984, 1, 512, 3008, 3008, 3008, 512]
    - [2, 13.097]
  - - [3136, 1984, 1, 512, 3136, 3136, 3136, 512]
    - [2, 13.116]
  - - [3264, 1984, 1, 512, 3264, 3264, 3264, 512]
    - [2, 13.134]
  - - [3392, 1984, 1, 512, 3392, 3392, 3392, 512]
    - [2, 13.173]
  - - [3520, 1984, 1, 512, 3520, 3520, 3520, 512]
    - [2, 13.146]
  - - [3648, 1984, 1, 512, 3648, 3648, 3648, 512]
    - [2, 13.222]
  - - [3776, 1984, 1, 512, 3776, 3776, 3776, 512]
    - [2, 13.187]
  - - [3904, 1984, 1, 512, 3904, 3904, 3904, 512]
    - [2, 13.227]
  - - [4032, 1984, 1, 512, 4032, 4032, 4032, 512]
    - [2, 13.206]
  - - [64, 2112, 1, 512, 64, 64, 64, 512]
    - [0, 8.904]
  - - [192, 2112, 1, 512, 192, 192, 192, 512]
    - [2, 11.568]
  - - [320, 2112, 1, 512, 320, 320, 320, 512]
    - [0, 11.734]
  - - [448, 2112, 1, 512, 448, 448, 448, 512]
    - [2, 12.117]
  - - [576, 2112, 1, 512, 576, 576, 576, 512]
    - [2, 12.382]
  - - [704, 2112, 1, 512, 704, 704, 704, 512]
    - [2, 12.547]
  - - [832, 2112, 1, 512, 832, 832, 832, 512]
    - [2, 12.614]
  - - [960, 2112, 1, 512, 960, 960, 960, 512]
    - [2, 12.773]
  - - [1088, 2112, 1, 512, 1088, 1088, 1088, 512]
    - [2, 12.877]
  - - [1216, 2112, 1, 512, 1216, 1216, 1216, 512]
    - [2, 12.877]
  - - [1344, 2112, 1, 512, 1344, 1344, 1344, 512]
    - [2, 12.96]
  - - [1472, 2112, 1, 512, 1472, 1472, 1472, 512]
    - [2, 12.994]
  - - [1600, 2112, 1, 512, 1600, 1600, 1600, 512]
    - [2, 13.132]
  - - [1728, 2112, 1, 512, 1728, 1728, 1728, 512]
    - [2, 13.085]
  - - [1856, 2112, 1, 512, 1856, 1856, 1856, 512]
    - [2, 13.129]
  - - [1984, 2112, 1, 512, 1984, 1984, 1984, 512]
    - [2, 13.17]
  - - [2112, 2112, 1, 512, 2112, 2112, 2112, 512]
    - [2, 12.993]
  - - [2240, 2112, 1, 512, 2240, 2240, 2240, 512]
    - [2, 12.977]
  - - [2368, 2112, 1, 512, 2368, 2368, 2368, 512]
    - [2, 13.073]
  - - [2496, 2112, 1, 512, 2496, 2496, 2496, 512]
    - [2, 13.053]
  - - [2624, 2112, 1, 512, 2624, 2624, 2624, 512]
    - [2, 13.108]
  - - [2752, 2112, 1, 512, 2752, 2752, 2752, 512]
    - [2, 13.13]
  - - [2880, 2112, 1, 512, 2880, 2880, 2880, 512]
    - [2, 13.129]
  - - [3008, 2112, 1, 512, 3008, 3008, 3008, 512]
    - [2, 13.139]
  - - [3136, 2112, 1, 512, 3136, 3136, 3136, 512]
    - [2, 13.163]
  - - [3264, 2112, 1, 512, 3264, 3264, 3264, 512]
    - [2, 13.175]
  - - [3392, 2112, 1, 512, 3392, 3392, 3392, 512]
    - [2, 13.2]
  - - [3520, 2112, 1, 512, 3520, 3520, 3520, 512]
    - [2, 13.195]
  - - [3648, 2112, 1, 512, 3648, 3648, 3648, 512]
    - [2, 13.22]
  - - [3776, 2112, 1, 512, 3776, 3776, 3776, 512]
    - [2, 13.228]
  - - [3904, 2112, 1, 512, 3904, 3904, 3904, 512]
    - [2, 13.267]
  - - [4032, 2112, 1, 512, 4032, 4032, 4032, 512]
    - [2, 13.267]
  - - [64, 2240, 1, 512, 64, 64, 64, 512]
    - [0, 9.407]
  - - [192, 2240, 1, 512, 192, 192, 192, 512]
    - [0, 11.821]
  - - [320, 2240, 1, 512, 320, 320, 320, 512]
    - [2, 11.737]
  - - [448, 2240, 1, 512, 448, 448, 448, 512]
    - [2, 12.153]
  - - [576, 2240, 1, 512, 576, 576, 576, 512]
    - [2, 12.516]
  - - [704, 2240, 1, 512, 704, 704, 704, 512]
    - [2, 12.606]
  - - [832, 2240, 1, 512, 832, 832, 832, 512]
    - [2, 12.797]
  - - [960, 2240, 1, 512, 960, 960, 960, 512]
    - [2, 12.807]
  - - [1088, 2240, 1, 512, 1088, 1088, 1088, 512]
    - [2, 12.978]
  - - [1216, 2240, 1, 512, 1216, 1216, 1216, 512]
    - [2, 12.96]
  - - [1344, 2240, 1, 512, 1344, 1344, 1344, 512]
    - [2, 12.958]
  - - [1472, 2240, 1, 512, 1472, 1472, 1472, 512]
    - [2, 13.023]
  - - [1600, 2240, 1, 512, 1600, 1600, 1600, 512]
    - [2, 13.068]
  - - [1728, 2240, 1, 512, 1728, 1728, 1728, 512]
    - [2, 13.125]
  - - [1856, 2240, 1, 512, 1856, 1856, 1856, 512]
    - [2, 13.135]
  - - [1984, 2240, 1, 512, 1984, 1984, 1984, 512]
    - [2, 12.97]
  - - [2112, 2240, 1, 512, 2112, 2112, 2112, 512]
    - [2, 13.042]
  - - [2240, 2240, 1, 512, 2240, 2240, 2240, 512]
    - [2, 13.014]
  - - [2368, 2240, 1, 512, 2368, 2368, 2368, 512]
    - [2, 13.064]
  - - [2496, 2240, 1, 512, 2496, 2496, 2496, 512]
    - [2, 13.106]
  - - [2624, 2240, 1, 512, 2624, 2624, 2624, 512]
    - [2, 13.095]
  - - [2752, 2240, 1, 512, 2752, 2752, 2752, 512]
    - [2, 13.123]
  - - [2880, 2240, 1, 512, 2880, 2880, 2880, 512]
    - [2, 13.118]
  - - [3008, 2240, 1, 512, 3008, 3008, 3008, 512]
    - [2, 13.135]
  - - [3136, 2240, 1, 512, 3136, 3136, 3136, 512]
    - [2, 13.154]
  - - [3264, 2240, 1, 512, 3264, 3264, 3264, 512]
    - [2, 13.18]
  - - [3392, 2240, 1, 512, 3392, 3392, 3392, 512]
    - [2, 13.21]
  - - [3520, 2240, 1, 512, 3520, 3520, 3520, 512]
    - [2, 13.212]
  - - [3648, 2240, 1, 512, 3648, 3648, 3648, 512]
    - [2, 13.221]
  - - [3776, 2240, 1, 512, 3776, 3776, 3776, 512]
    - [2, 13.225]
  - - [3904, 2240, 1, 512, 3904, 3904, 3904, 512]
    - [2, 13.263]
  - - [4032, 2240, 1, 512, 4032, 4032, 4032, 512]
    - [2, 13.279]
  - - [64, 2368, 1, 512, 64, 64, 64, 512]
    - [2, 7.21]
  - - [192, 2368, 1, 512, 192, 192, 192, 512]
    - [0, 11.763]
  - - [320, 2368, 1, 512, 320, 320, 320, 512]
    - [2, 11.84]
  - - [448, 2368, 1, 512, 448, 448, 448, 512]
    - [2, 12.249]
  - - [576, 2368, 1, 512, 576, 576, 576, 512]
    - [2, 12.483]
  - - [704, 2368, 1, 512, 704, 704, 704, 512]
    - [2, 12.653]
  - - [832, 2368, 1, 512, 832, 832, 832, 512]
    - [2, 12.75]
  - - [960, 2368, 1, 512, 960, 960, 960, 512]
    - [2, 12.879]
  - - [1088, 2368, 1, 512, 1088, 1088, 1088, 512]
    - [2, 12.952]
  - - [1216, 2368, 1, 512, 1216, 1216, 1216, 512]
    - [2, 12.962]
  - - [1344, 2368, 1, 512, 1344, 1344, 1344, 512]
    - [2, 13.09]
  - - [1472, 2368, 1, 512, 1472, 1472, 1472, 512]
    - [2, 13.121]
  - - [1600, 2368, 1, 512, 1600, 1600, 1600, 512]
    - [0, 13.09]
  - - [1728, 2368, 1, 512, 1728, 1728, 1728, 512]
    - [2, 13.172]
  - - [1856, 2368, 1, 512, 1856, 1856, 1856, 512]
    - [2, 12.969]
  - - [1984, 2368, 1, 512, 1984, 1984, 1984, 512]
    - [2, 12.974]
  - - [2112, 2368, 1, 512, 2112, 2112, 2112, 512]
    - [2, 13.003]
  - - [2240, 2368, 1, 512, 2240, 2240, 2240, 512]
    - [2, 13.066]
  - - [2368, 2368, 1, 512, 2368, 2368, 2368, 512]
    - [2, 13.098]
  - - [2496, 2368, 1, 512, 2496, 2496, 2496, 512]
    - [2, 13.068]
  - - [2624, 2368, 1, 512, 2624, 2624, 2624, 512]
    - [2, 13.102]
  - - [2752, 2368, 1, 512, 2752, 2752, 2752, 512]
    - [2, 13.159]
  - - [2880, 2368, 1, 512, 2880, 2880, 2880, 512]
    - [2, 13.157]
  - - [3008, 2368, 1, 512, 3008, 3008, 3008, 512]
    - [2, 13.169]
  - - [3136, 2368, 1, 512, 3136, 3136, 3136, 512]
    - [2, 13.207]
  - - [3264, 2368, 1, 512, 3264, 3264, 3264, 512]
    - [2, 13.21]
  - - [3392, 2368, 1, 512, 3392, 3392, 3392, 512]
    - [2, 13.233]
  - - [3520, 2368, 1, 512, 3520, 3520, 3520, 512]
    - [2, 13.238]
  - - [3648, 2368, 1, 512, 3648, 3648, 3648, 512]
    - [2, 13.247]
  - - [3776, 2368, 1, 512, 3776, 3776, 3776, 512]
    - [2, 13.244]
  - - [3904, 2368, 1, 512, 3904, 3904, 3904, 512]
    - [2, 13.284]
  - - [4032, 2368, 1, 512, 4032, 4032, 4032, 512]
    - [2, 13.282]
  - - [64, 2496, 1, 512, 64, 64, 64, 512]
    - [3, 7.016]
  - - [192, 2496, 1, 512, 192, 192, 192, 512]
    - [2, 11.722]
  - - [320, 2496, 1, 512, 320, 320, 320, 512]
    - [0, 11.937]
  - - [448, 2496, 1, 512, 448, 448, 448, 512]
    - [2, 12.298]
  - - [576, 2496, 1, 512, 576, 576, 576, 512]
    - [2, 12.577]
  - - [704, 2496, 1, 512, 704, 704, 704, 512]
    - [2, 12.699]
  - - [832, 2496, 1, 512, 832, 832, 832, 512]
    - [2, 12.78]
  - - [960, 2496, 1, 512, 960, 960, 960, 512]
    - [2, 12.903]
  - - [1088, 2496, 1, 512, 1088, 1088, 1088, 512]
    - [2, 12.969]
  - - [1216, 2496, 1, 512, 1216, 1216, 1216, 512]
    - [2, 12.913]
  - - [1344, 2496, 1, 512, 1344, 1344, 1344, 512]
    - [2, 13.06]
  - - [1472, 2496, 1, 512, 1472, 1472, 1472, 512]
    - [2, 13.098]
  - - [1600, 2496, 1, 512, 1600, 1600, 1600, 512]
    - [2, 13.142]
  - - [1728, 2496, 1, 512, 1728, 1728, 1728, 512]
    - [2, 12.98]
  - - [1856, 2496, 1, 512, 1856, 1856, 1856, 512]
    - [2, 13.003]
  - - [1984, 2496, 1, 512, 1984, 1984, 1984, 512]
    - [2, 13.029]
  - - [2112, 2496, 1, 512, 2112, 2112, 2112, 512]
    - [2, 13.017]
  - - [2240, 2496, 1, 512, 2240, 2240, 2240, 512]
    - [2, 13.096]
  - - [2368, 2496, 1, 512, 2368, 2368, 2368, 512]
    - [2, 13.107]
  - - [2496, 2496, 1, 512, 2496, 2496, 2496, 512]
    - [2, 13.129]
  - - [2624, 2496, 1, 512, 2624, 2624, 2624, 512]
    - [2, 13.128]
  - - [2752, 2496, 1, 512, 2752, 2752, 2752, 512]
    - [2, 13.159]
  - - [2880, 2496, 1, 512, 2880, 2880, 2880, 512]
    - [2, 13.151]
  - - [3008, 2496, 1, 512, 3008, 3008, 3008, 512]
    - [2, 13.217]
  - - [3136, 2496, 1, 512, 3136, 3136, 3136, 512]
    - [2, 13.216]
  - - [3264, 2496, 1, 512, 3264, 3264, 3264, 512]
    - [2, 13.227]
  - - [3392, 2496, 1, 512, 3392, 3392, 3392, 512]
    - [2, 13.236]
  - - [3520, 2496, 1, 512, 3520, 3520, 3520, 512]
    - [2, 13.25]
  - - [3648, 2496, 1, 512, 3648, 3648, 3648, 512]
    - [2, 13.247]
  - - [3776, 2496, 1, 512, 3776, 3776, 3776, 512]
    - [2, 13.264]
  - - [3904, 2496, 1, 512, 3904, 3904, 3904, 512]
    - [2, 13.278]
  - - [4032, 2496, 1, 512, 4032, 4032, 4032, 512]
    - [2, 13.296]
  - - [64, 2624, 1, 512, 64, 64, 64, 512]
    - [2, 9.678]
  - - [192, 2624, 1, 512, 192, 192, 192, 512]
    - [0, 11.651]
  - - [320, 2624, 1, 512, 320, 320, 320, 512]
    - [2, 11.872]
  - - [448, 2624, 1, 512, 448, 448, 448, 512]
    - [2, 12.337]
  - - [576, 2624, 1, 512, 576, 576, 576, 512]
    - [2, 12.638]
  - - [704, 2624, 1, 512, 704, 704, 704, 512]
    - [2, 12.771]
  - - [832, 2624, 1, 512, 832, 832, 832, 512]
    - [2, 12.849]
  - - [960, 2624, 1, 512, 960, 960, 960, 512]
    - [2, 12.915]
  - - [1088, 2624, 1, 512, 1088, 1088, 1088, 512]
    - [2, 12.981]
  - - [1216, 2624, 1, 512, 1216, 1216, 1216, 512]
    - [2, 13.042]
  - - [1344, 2624, 1, 512, 1344, 1344, 1344, 512]
    - [2, 13.085]
  - - [1472, 2624, 1, 512, 1472, 1472, 1472, 512]
    - [2, 13.158]
  - - [1600, 2624, 1, 512, 1600, 1600, 1600, 512]
    - [2, 13.132]
  - - [1728, 2624, 1, 512, 1728, 1728, 1728, 512]
    - [2, 12.981]
  - - [1856, 2624, 1, 512, 1856, 1856, 1856, 512]
    - [2, 12.991]
  - - [1984, 2624, 1, 512, 1984, 1984, 1984, 512]
    - [2, 13.082]
  - - [2112, 2624, 1, 512, 2112, 2112, 2112, 512]
    - [2, 13.123]
  - - [2240, 2624, 1, 512, 2240, 2240, 2240, 512]
    - [2, 13.096]
  - - [2368, 2624, 1, 512, 2368, 2368, 2368, 512]
    - [2, 13.13]
  - - [2496, 2624, 1, 512, 2496, 2496, 2496, 512]
    - [2, 13.158]
  - - [2624, 2624, 1, 512, 2624, 2624, 2624, 512]
    - [2, 13.197]
  - - [2752, 2624, 1, 512, 2752, 2752, 2752, 512]
    - [2, 13.179]
  - - [2880, 2624, 1, 512, 2880, 2880, 2880, 512]
    - [2, 13.192]
  - - [3008, 2624, 1, 512, 3008, 3008, 3008, 512]
    - [2, 13.223]
  - - [3136, 2624, 1, 512, 3136, 3136, 3136, 512]
    - [2, 13.24]
  - - [3264, 2624, 1, 512, 3264, 3264, 3264, 512]
    - [2, 13.237]
  - - [3392, 2624, 1, 512, 3392, 3392, 3392, 512]
    - [2, 13.243]
  - - [3520, 2624, 1, 512, 3520, 3520, 3520, 512]
    - [2, 13.271]
  - - [3648, 2624, 1, 512, 3648, 3648, 3648, 512]
    - [0, 13.285]
  - - [3776, 2624, 1, 512, 3776, 3776, 3776, 512]
    - [2, 13.274]
  - - [3904, 2624, 1, 512, 3904, 3904, 3904, 512]
    - [2, 13.297]
  - - [4032, 2624, 1, 512, 4032, 4032, 4032, 512]
    - [2, 13.305]
  - - [64, 2752, 1, 512, 64, 64, 64, 512]
    - [0, 10.041]
  - - [192, 2752, 1, 512, 192, 192, 192, 512]
    - [2, 11.378]
  - - [320, 2752, 1, 512, 320, 320, 320, 512]
    - [2, 12.049]
  - - [448, 2752, 1, 512, 448, 448, 448, 512]
    - [2, 12.434]
  - - [576, 2752, 1, 512, 576, 576, 576, 512]
    - [2, 12.667]
  - - [704, 2752, 1, 512, 704, 704, 704, 512]
    - [2, 12.747]
  - - [832, 2752, 1, 512, 832, 832, 832, 512]
    - [2, 12.835]
  - - [960, 2752, 1, 512, 960, 960, 960, 512]
    - [2, 12.937]
  - - [1088, 2752, 1, 512, 1088, 1088, 1088, 512]
    - [2, 13.012]
  - - [1216, 2752, 1, 512, 1216, 1216, 1216, 512]
    - [2, 13.031]
  - - [1344, 2752, 1, 512, 1344, 1344, 1344, 512]
    - [2, 13.151]
  - - [1472, 2752, 1, 512, 1472, 1472, 1472, 512]
    - [2, 13.144]
  - - [1600, 2752, 1, 512, 1600, 1600, 1600, 512]
    - [2, 12.981]
  - - [1728, 2752, 1, 512, 1728, 1728, 1728, 512]
    - [0, 13.056]
  - - [1856, 2752, 1, 512, 1856, 1856, 1856, 512]
    - [2, 13.073]
  - - [1984, 2752, 1, 512, 1984, 1984, 1984, 512]
    - [2, 13.101]
  - - [2112, 2752, 1, 512, 2112, 2112, 2112, 512]
    - [2, 13.105]
  - - [2240, 2752, 1, 512, 2240, 2240, 2240, 512]
    - [2, 13.118]
  - - [2368, 2752, 1, 512, 2368, 2368, 2368, 512]
    - [2, 13.142]
  - - [2496, 2752, 1, 512, 2496, 2496, 2496, 512]
    - [2, 13.148]
  - - [2624, 2752, 1, 512, 2624, 2624, 2624, 512]
    - [2, 13.152]
  - - [2752, 2752, 1, 512, 2752, 2752, 2752, 512]
    - [2, 13.178]
  - - [2880, 2752, 1, 512, 2880, 2880, 2880, 512]
    - [2, 13.195]
  - - [3008, 2752, 1, 512, 3008, 3008, 3008, 512]
    - [2, 13.209]
  - - [3136, 2752, 1, 512, 3136, 3136, 3136, 512]
    - [2, 13.251]
  - - [3264, 2752, 1, 512, 3264, 3264, 3264, 512]
    - [2, 13.264]
  - - [3392, 2752, 1, 512, 3392, 3392, 3392, 512]
    - [2, 13.256]
  - - [3520, 2752, 1, 512, 3520, 3520, 3520, 512]
    - [2, 13.266]
  - - [3648, 2752, 1, 512, 3648, 3648, 3648, 512]
    - [2, 13.285]
  - - [3776, 2752, 1, 512, 3776, 3776, 3776, 512]
    - [2, 13.288]
  - - [3904, 2752, 1, 512, 3904, 3904, 3904, 512]
    - [2, 13.309]
  - - [4032, 2752, 1, 512, 4032, 4032, 4032, 512]
    - [2, 13.316]
  - - [64, 2880, 1, 512, 64, 64, 64, 512]
    - [0, 10.47]
  - - [192, 2880, 1, 512, 192, 192, 192, 512]
    - [0, 11.127]
  - - [320, 2880, 1, 512, 320, 320, 320, 512]
    - [0, 12.091]
  - - [448, 2880, 1, 512, 448, 448, 448, 512]
    - [2, 12.459]
  - - [576, 2880, 1, 512, 576, 576, 576, 512]
    - [2, 12.592]
  - - [704, 2880, 1, 512, 704, 704, 704, 512]
    - [2, 12.82]
  - - [832, 2880, 1, 512, 832, 832, 832, 512]
    - [2, 12.909]
  - - [960, 2880, 1, 512, 960, 960, 960, 512]
    - [2, 12.964]
  - - [1088, 2880, 1, 512, 1088, 1088, 1088, 512]
    - [2, 13.018]
  - - [1216, 2880, 1, 512, 1216, 1216, 1216, 512]
    - [2, 13.106]
  - - [1344, 2880, 1, 512, 1344, 1344, 1344, 512]
    - [2, 13.093]
  - - [1472, 2880, 1, 512, 1472, 1472, 1472, 512]
    - [2, 13.141]
  - - [1600, 2880, 1, 512, 1600, 1600, 1600, 512]
    - [2, 12.983]
  - - [1728, 2880, 1, 512, 1728, 1728, 1728, 512]
    - [2, 13.042]
  - - [1856, 2880, 1, 512, 1856, 1856, 1856, 512]
    - [2, 13.019]
  - - [1984, 2880, 1, 512, 1984, 1984, 1984, 512]
    - [2, 13.084]
  - - [2112, 2880, 1, 512, 2112, 2112, 2112, 512]
    - [2, 13.104]
  - - [2240, 2880, 1, 512, 2240, 2240, 2240, 512]
    - [2, 13.114]
  - - [2368, 2880, 1, 512, 2368, 2368, 2368, 512]
    - [2, 13.169]
  - - [2496, 2880, 1, 512, 2496, 2496, 2496, 512]
    - [2, 13.164]
  - - [2624, 2880, 1, 512, 2624, 2624, 2624, 512]
    - [2, 13.195]
  - - [2752, 2880, 1, 512, 2752, 2752, 2752, 512]
    - [2, 13.21]
  - - [2880, 2880, 1, 512, 2880, 2880, 2880, 512]
    - [2, 13.191]
  - - [3008, 2880, 1, 512, 3008, 3008, 3008, 512]
    - [2, 13.234]
  - - [3136, 2880, 1, 512, 3136, 3136, 3136, 512]
    - [2, 13.261]
  - - [3264, 2880, 1, 512, 3264, 3264, 3264, 512]
    - [2, 13.267]
  - - [3392, 2880, 1, 512, 3392, 3392, 3392, 512]
    - [2, 13.282]
  - - [3520, 2880, 1, 512, 3520, 3520, 3520, 512]
    - [2, 13.284]
  - - [3648, 2880, 1, 512, 3648, 3648, 3648, 512]
    - [2, 13.274]
  - - [3776, 2880, 1, 512, 3776, 3776, 3776, 512]
    - [2, 13.279]
  - - [3904, 2880, 1, 512, 3904, 3904, 3904, 512]
    - [2, 13.303]
  - - [4032, 2880, 1, 512, 4032, 4032, 4032, 512]
    - [2, 13.336]
  - - [64, 3008, 1, 512, 64, 64, 64, 512]
    - [2, 9.993]
  - - [192, 3008, 1, 512, 192, 192, 192, 512]
    - [0, 11.461]
  - - [320, 3008, 1, 512, 320, 320, 320, 512]
    - [2, 12.057]
  - - [448, 3008, 1, 512, 448, 448, 448, 512]
    - [2, 12.549]
  - - [576, 3008, 1, 512, 576, 576, 576, 512]
    - [2, 12.737]
  - - [704, 3008, 1, 512, 704, 704, 704, 512]
    - [2, 12.766]
  - - [832, 3008, 1, 512, 832, 832, 832, 512]
    - [2, 12.862]
  - - [960, 3008, 1, 512, 960, 960, 960, 512]
    - [2, 12.971]
  - - [1088, 3008, 1, 512, 1088, 1088, 1088, 512]
    - [2, 13.04]
  - - [1216, 3008, 1, 512, 1216, 1216, 1216, 512]
    - [2, 13.073]
  - - [1344, 3008, 1, 512, 1344, 1344, 1344, 512]
    - [2, 13.126]
  - - [1472, 3008, 1, 512, 1472, 1472, 1472, 512]
    - [2, 12.943]
  - - [1600, 3008, 1, 512, 1600, 1600, 1600, 512]
    - [2, 13.019]
  - - [1728, 3008, 1, 512, 1728, 1728, 1728, 512]
    - [2, 13.049]
  - - [1856, 3008, 1, 512, 1856, 1856, 1856, 512]
    - [2, 13.074]
  - - [1984, 3008, 1, 512, 1984, 1984, 1984, 512]
    - [2, 13.155]
  - - [2112, 3008, 1, 512, 2112, 2112, 2112, 512]
    - [2, 13.154]
  - - [2240, 3008, 1, 512, 2240, 2240, 2240, 512]
    - [2, 13.093]
  - - [2368, 3008, 1, 512, 2368, 2368, 2368, 512]
    - [2, 13.119]
  - - [2496, 3008, 1, 512, 2496, 2496, 2496, 512]
    - [2, 13.17]
  - - [2624, 3008, 1, 512, 2624, 2624, 2624, 512]
    - [2, 13.209]
  - - [2752, 3008, 1, 512, 2752, 2752, 2752, 512]
    - [2, 13.234]
  - - [2880, 3008, 1, 512, 2880, 2880, 2880, 512]
    - [2, 13.221]
  - - [3008, 3008, 1, 512, 3008, 3008, 3008, 512]
    - [2, 13.255]
  - - [3136, 3008, 1, 512, 3136, 3136, 3136, 512]
    - [2, 13.243]
  - - [3264, 3008, 1, 512, 3264, 3264, 3264, 512]
    - [2, 13.302]
  - - [3392, 3008, 1, 512, 3392, 3392, 3392, 512]
    - [2, 13.286]
  - - [3520, 3008, 1, 512, 3520, 3520, 3520, 512]
    - [2, 13.289]
  - - [3648, 3008, 1, 512, 3648, 3648, 3648, 512]
    - [2, 13.307]
  - - [3776, 3008, 1, 512, 3776, 3776, 3776, 512]
    - [2, 13.337]
  - - [3904, 3008, 1, 512, 3904, 3904, 3904, 512]
    - [2, 13.338]
  - - [4032, 3008, 1, 512, 4032, 4032, 4032, 512]
    - [2, 13.337]
  - - [64, 3136, 1, 512, 64, 64, 64, 512]
    - [2, 10.11]
  - - [192, 3136, 1, 512, 192, 192, 192, 512]
    - [2, 11.467]
  - - [320, 3136, 1, 512, 320, 320, 320, 512]
    - [2, 12.086]
  - - [448, 3136, 1, 512, 448, 448, 448, 512]
    - [2, 12.476]
  - - [576, 3136, 1, 512, 576, 576, 576, 512]
    - [2, 12.718]
  - - [704, 3136, 1, 512, 704, 704, 704, 512]
    - [2, 12.816]
  - - [832, 3136, 1, 512, 832, 832, 832, 512]
    - [2, 12.962]
  - - [960, 3136, 1, 512, 960, 960, 960, 512]
    - [2, 12.996]
  - - [1088, 3136, 1, 512, 1088, 1088, 1088, 512]
    - [2, 13.043]
  - - [1216, 3136, 1, 512, 1216, 1216, 1216, 512]
    - [2, 13.139]
  - - [1344, 3136, 1, 512, 1344, 1344, 1344, 512]
    - [2, 13.172]
  - - [1472, 3136, 1, 512, 1472, 1472, 1472, 512]
    - [2, 13.003]
  - - [1600, 3136, 1, 512, 1600, 1600, 1600, 512]
    - [2, 13.011]
  - - [1728, 3136, 1, 512, 1728, 1728, 1728, 512]
    - [2, 13.052]
  - - [1856, 3136, 1, 512, 1856, 1856, 1856, 512]
    - [2, 13.073]
  - - [1984, 3136, 1, 512, 1984, 1984, 1984, 512]
    - [2, 13.132]
  - - [2112, 3136, 1, 512, 2112, 2112, 2112, 512]
    - [2, 13.157]
  - - [2240, 3136, 1, 512, 2240, 2240, 2240, 512]
    - [2, 13.176]
  - - [2368, 3136, 1, 512, 2368, 2368, 2368, 512]
    - [2, 13.196]
  - - [2496, 3136, 1, 512, 2496, 2496, 2496, 512]
    - [2, 13.182]
  - - [2624, 3136, 1, 512, 2624, 2624, 2624, 512]
    - [2, 13.233]
  - - [2752, 3136, 1, 512, 2752, 2752, 2752, 512]
    - [2, 13.242]
  - - [2880, 3136, 1, 512, 2880, 2880, 2880, 512]
    - [2, 13.247]
  - - [3008, 3136, 1, 512, 3008, 3008, 3008, 512]
    - [2, 13.238]
  - - [3136, 3136, 1, 512, 3136, 3136, 3136, 512]
    - [2, 13.28]
  - - [3264, 3136, 1, 512, 3264, 3264, 3264, 512]
    - [2, 13.285]
  - - [3392, 3136, 1, 512, 3392, 3392, 3392, 512]
    - [2, 13.303]
  - - [3520, 3136, 1, 512, 3520, 3520, 3520, 512]
    - [2, 13.285]
  - - [3648, 3136, 1, 512, 3648, 3648, 3648, 512]
    - [2, 13.329]
  - - [3776, 3136, 1, 512, 3776, 3776, 3776, 512]
    - [2, 13.348]
  - - [3904, 3136, 1, 512, 3904, 3904, 3904, 512]
    - [2, 13.346]
  - - [4032, 3136, 1, 512, 4032, 4032, 4032, 512]
    - [2, 13.35]
  - - [64, 3264, 1, 512, 64, 64, 64, 512]
    - [0, 10.458]
  - - [192, 3264, 1, 512, 192, 192, 192, 512]
    - [2, 11.613]
  - - [320, 3264, 1, 512, 320, 320, 320, 512]
    - [0, 12.207]
  - - [448, 3264, 1, 512, 448, 448, 448, 512]
    - [2, 12.537]
  - - [576, 3264, 1, 512, 576, 576, 576, 512]
    - [2, 12.817]
  - - [704, 3264, 1, 512, 704, 704, 704, 512]
    - [2, 12.859]
  - - [832, 3264, 1, 512, 832, 832, 832, 512]
    - [2, 13.028]
  - - [960, 3264, 1, 512, 960, 960, 960, 512]
    - [2, 13.057]
  - - [1088, 3264, 1, 512, 1088, 1088, 1088, 512]
    - [2, 13.128]
  - - [1216, 3264, 1, 512, 1216, 1216, 1216, 512]
    - [2, 13.156]
  - - [1344, 3264, 1, 512, 1344, 1344, 1344, 512]
    - [2, 12.967]
  - - [1472, 3264, 1, 512, 1472, 1472, 1472, 512]
    - [2, 13.015]
  - - [1600, 3264, 1, 512, 1600, 1600, 1600, 512]
    - [2, 13.082]
  - - [1728, 3264, 1, 512, 1728, 1728, 1728, 512]
    - [2, 13.091]
  - - [1856, 3264, 1, 512, 1856, 1856, 1856, 512]
    - [2, 13.134]
  - - [1984, 3264, 1, 512, 1984, 1984, 1984, 512]
    - [2, 13.116]
  - - [2112, 3264, 1, 512, 2112, 2112, 2112, 512]
    - [2, 13.156]
  - - [2240, 3264, 1, 512, 2240, 2240, 2240, 512]
    - [2, 13.173]
  - - [2368, 3264, 1, 512, 2368, 2368, 2368, 512]
    - [2, 13.21]
  - - [2496, 3264, 1, 512, 2496, 2496, 2496, 512]
    - [2, 13.235]
  - - [2624, 3264, 1, 512, 2624, 2624, 2624, 512]
    - [2, 13.227]
  - - [2752, 3264, 1, 512, 2752, 2752, 2752, 512]
    - [2, 13.261]
  - - [2880, 3264, 1, 512, 2880, 2880, 2880, 512]
    - [2, 13.266]
  - - [3008, 3264, 1, 512, 3008, 3008, 3008, 512]
    - [2, 13.277]
  - - [3136, 3264, 1, 512, 3136, 3136, 3136, 512]
    - [2, 13.307]
  - - [3264, 3264, 1, 512, 3264, 3264, 3264, 512]
    - [2, 13.291]
  - - [3392, 3264, 1, 512, 3392, 3392, 3392, 512]
    - [2, 13.324]
  - - [3520, 3264, 1, 512, 3520, 3520, 3520, 512]
    - [2, 13.299]
  - - [3648, 3264, 1, 512, 3648, 3648, 3648, 512]
    - [2, 13.335]
  - - [3776, 3264, 1, 512, 3776, 3776, 3776, 512]
    - [2, 13.324]
  - - [3904, 3264, 1, 512, 3904, 3904, 3904, 512]
    - [2, 13.341]
  - - [4032, 3264, 1, 512, 4032, 4032, 4032, 512]
    - [2, 13.333]
  - - [64, 3392, 1, 512, 64, 64, 64, 512]
    - [2, 10.251]
  - - [192, 3392, 1, 512, 192, 192, 192, 512]
    - [2, 11.586]
  - - [320, 3392, 1, 512, 320, 320, 320, 512]
    - [2, 12.331]
  - - [448, 3392, 1, 512, 448, 448, 448, 512]
    - [0, 12.605]
  - - [576, 3392, 1, 512, 576, 576, 576, 512]
    - [2, 12.768]
  - - [704, 3392, 1, 512, 704, 704, 704, 512]
    - [2, 12.882]
  - - [832, 3392, 1, 512, 832, 832, 832, 512]
    - [2, 12.959]
  - - [960, 3392, 1, 512, 960, 960, 960, 512]
    - [2, 13.054]
  - - [1088, 3392, 1, 512, 1088, 1088, 1088, 512]
    - [2, 13.143]
  - - [1216, 3392, 1, 512, 1216, 1216, 1216, 512]
    - [2, 13.119]
  - - [1344, 3392, 1, 512, 1344, 1344, 1344, 512]
    - [2, 12.996]
  - - [1472, 3392, 1, 512, 1472, 1472, 1472, 512]
    - [2, 13.026]
  - - [1600, 3392, 1, 512, 1600, 1600, 1600, 512]
    - [2, 13.031]
  - - [1728, 3392, 1, 512, 1728, 1728, 1728, 512]
    - [2, 13.077]
  - - [1856, 3392, 1, 512, 1856, 1856, 1856, 512]
    - [2, 13.132]
  - - [1984, 3392, 1, 512, 1984, 1984, 1984, 512]
    - [2, 13.149]
  - - [2112, 3392, 1, 512, 2112, 2112, 2112, 512]
    - [2, 13.162]
  - - [2240, 3392, 1, 512, 2240, 2240, 2240, 512]
    - [2, 13.191]
  - - [2368, 3392, 1, 512, 2368, 2368, 2368, 512]
    - [2, 13.216]
  - - [2496, 3392, 1, 512, 2496, 2496, 2496, 512]
    - [2, 13.23]
  - - [2624, 3392, 1, 512, 2624, 2624, 2624, 512]
    - [2, 13.247]
  - - [2752, 3392, 1, 512, 2752, 2752, 2752, 512]
    - [2, 13.282]
  - - [2880, 3392, 1, 512, 2880, 2880, 2880, 512]
    - [2, 13.288]
  - - [3008, 3392, 1, 512, 3008, 3008, 3008, 512]
    - [2, 13.271]
  - - [3136, 3392, 1, 512, 3136, 3136, 3136, 512]
    - [2, 13.297]
  - - [3264, 3392, 1, 512, 3264, 3264, 3264, 512]
    - [2, 13.328]
  - - [3392, 3392, 1, 512, 3392, 3392, 3392, 512]
    - [2, 13.314]
  - - [3520, 3392, 1, 512, 3520, 3520, 3520, 512]
    - [2, 13.349]
  - - [3648, 3392, 1, 512, 3648, 3648, 3648, 512]
    - [2, 13.321]
  - - [3776, 3392, 1, 512, 3776, 3776, 3776, 512]
    - [0, 13.327]
  - - [3904, 3392, 1, 512, 3904, 3904, 3904, 512]
    - [2, 13.35]
  - - [4032, 3392, 1, 512, 4032, 4032, 4032, 512]
    - [2, 13.336]
  - - [64, 3520, 1, 512, 64, 64, 64, 512]
    - [2, 10.398]
  - - [192, 3520, 1, 512, 192, 192, 192, 512]
    - [0, 11.743]
  - - [320, 3520, 1, 512, 320, 320, 320, 512]
    - [2, 12.415]
  - - [448, 3520, 1, 512, 448, 448, 448, 512]
    - [2, 12.627]
  - - [576, 3520, 1, 512, 576, 576, 576, 512]
    - [2, 12.82]
  - - [704, 3520, 1, 512, 704, 704, 704, 512]
    - [2, 12.946]
  - - [832, 3520, 1, 512, 832, 832, 832, 512]
    - [2, 13.038]
  - - [960, 3520, 1, 512, 960, 960, 960, 512]
    - [2, 13.098]
  - - [1088, 3520, 1, 512, 1088, 1088, 1088, 512]
    - [2, 13.102]
  - - [1216, 3520, 1, 512, 1216, 1216, 1216, 512]
    - [2, 13.081]
  - - [1344, 3520, 1, 512, 1344, 1344, 1344, 512]
    - [2, 12.963]
  - - [1472, 3520, 1, 512, 1472, 1472, 1472, 512]
    - [2, 13.027]
  - - [1600, 3520, 1, 512, 1600, 1600, 1600, 512]
    - [2, 13.077]
  - - [1728, 3520, 1, 512, 1728, 1728, 1728, 512]
    - [2, 13.113]
  - - [1856, 3520, 1, 512, 1856, 1856, 1856, 512]
    - [2, 13.142]
  - - [1984, 3520, 1, 512, 1984, 1984, 1984, 512]
    - [2, 13.165]
  - - [2112, 3520, 1, 512, 2112, 2112, 2112, 512]
    - [2, 13.205]
  - - [2240, 3520, 1, 512, 2240, 2240, 2240, 512]
    - [2, 13.201]
  - - [2368, 3520, 1, 512, 2368, 2368, 2368, 512]
    - [2, 13.214]
  - - [2496, 3520, 1, 512, 2496, 2496, 2496, 512]
    - [2, 13.281]
  - - [2624, 3520, 1, 512, 2624, 2624, 2624, 512]
    - [2, 13.284]
  - - [2752, 3520, 1, 512, 2752, 2752, 2752, 512]
    - [2, 13.3]
  - - [2880, 3520, 1, 512, 2880, 2880, 2880, 512]
    - [2, 13.291]
  - - [3008, 3520, 1, 512, 3008, 3008, 3008, 512]
    - [2, 13.294]
  - - [3136, 3520, 1, 512, 3136, 3136, 3136, 512]
    - [2, 13.319]
  - - [3264, 3520, 1, 512, 3264, 3264, 3264, 512]
    - [2, 13.304]
  - - [3392, 3520, 1, 512, 3392, 3392, 3392, 512]
    - [2, 13.32]
  - - [3520, 3520, 1, 512, 3520, 3520, 3520, 512]
    - [2, 13.33]
  - - [3648, 3520, 1, 512, 3648, 3648, 3648, 512]
    - [2, 13.322]
  - - [3776, 3520, 1, 512, 3776, 3776, 3776, 512]
    - [2, 13.343]
  - - [3904, 3520, 1, 512, 3904, 3904, 3904, 512]
    - [2, 13.337]
  - - [4032, 3520, 1, 512, 4032, 4032, 4032, 512]
    - [2, 13.38]
  - - [64, 3648, 1, 512, 64, 64, 64, 512]
    - [2, 10.72]
  - - [192, 3648, 1, 512, 192, 192, 192, 512]
    - [0, 11.71]
  - - [320, 3648, 1, 512, 320, 320, 320, 512]
    - [2, 12.36]
  - - [448, 3648, 1, 512, 448, 448, 448, 512]
    - [2, 12.645]
  - - [576, 3648, 1, 512, 576, 576, 576, 512]
    - [2, 12.833]
  - - [704, 3648, 1, 512, 704, 704, 704, 512]
    - [2, 12.967]
  - - [832, 3648, 1, 512, 832, 832, 832, 512]
    - [2, 13.025]
  - - [960, 3648, 1, 512, 960, 960, 960, 512]
    - [2, 13.064]
  - - [1088, 3648, 1, 512, 1088, 1088, 1088, 512]
    - [2, 13.155]
  - - [1216, 3648, 1, 512, 1216, 1216, 1216, 512]
    - [2, 12.974]
  - - [1344, 3648, 1, 512, 1344, 1344, 1344, 512]
    - [2, 13.016]
  - - [1472, 3648, 1, 512, 1472, 1472, 1472, 512]
    - [2, 13.076]
  - - [1600, 3648, 1, 512, 1600, 1600, 1600, 512]
    - [2, 13.11]
  - - [1728, 3648, 1, 512, 1728, 1728, 1728, 512]
    - [2, 13.131]
  - - [1856, 3648, 1, 512, 1856, 1856, 1856, 512]
    - [2, 13.156]
  - - [1984, 3648, 1, 512, 1984, 1984, 1984, 512]
    - [2, 13.16]
  - - [2112, 3648, 1, 512, 2112, 2112, 2112, 512]
    - [2, 13.204]
  - - [2240, 3648, 1, 512, 2240, 2240, 2240, 512]
    - [2, 13.222]
  - - [2368, 3648, 1, 512, 2368, 2368, 2368, 512]
    - [2, 13.248]
  - - [2496, 3648, 1, 512, 2496, 2496, 2496, 512]
    - [2, 13.277]
  - - [2624, 3648, 1, 512, 2624, 2624, 2624, 512]
    - [2, 13.283]
  - - [2752, 3648, 1, 512, 2752, 2752, 2752, 512]
    - [2, 13.305]
  - - [2880, 3648, 1, 512, 2880, 2880, 2880, 512]
    - [2, 13.303]
  - - [3008, 3648, 1, 512, 3008, 3008, 3008, 512]
    - [2, 13.307]
  - - [3136, 3648, 1, 512, 3136, 3136, 3136, 512]
    - [2, 13.324]
  - - [3264, 3648, 1, 512, 3264, 3264, 3264, 512]
    - [2, 13.305]
  - - [3392, 3648, 1, 512, 3392, 3392, 3392, 512]
    - [2, 13.343]
  - - [3520, 3648, 1, 512, 3520, 3520, 3520, 512]
    - [2, 13.358]
  - - [3648, 3648, 1, 512, 3648, 3648, 3648, 512]
    - [2, 13.36]
  - - [3776, 3648, 1, 512, 3776, 3776, 3776, 512]
    - [2, 13.338]
  - - [3904, 3648, 1, 512, 3904, 3904, 3904, 512]
    - [2, 13.358]
  - - [4032, 3648, 1, 512, 4032, 4032, 4032, 512]
    - [2, 13.335]
  - - [64, 3776, 1, 512, 64, 64, 64, 512]
    - [0, 10.849]
  - - [192, 3776, 1, 512, 192, 192, 192, 512]
    - [2, 11.706]
  - - [320, 3776, 1, 512, 320, 320, 320, 512]
    - [2, 12.343]
  - - [448, 3776, 1, 512, 448, 448, 448, 512]
    - [2, 12.675]
  - - [576, 3776, 1, 512, 576, 576, 576, 512]
    - [2, 12.829]
  - - [704, 3776, 1, 512, 704, 704, 704, 512]
    - [2, 12.949]
  - - [832, 3776, 1, 512, 832, 832, 832, 512]
    - [2, 13.059]
  - - [960, 3776, 1, 512, 960, 960, 960, 512]
    - [2, 13.103]
  - - [1088, 3776, 1, 512, 1088, 1088, 1088, 512]
    - [2, 13.135]
  - - [1216, 3776, 1, 512, 1216, 1216, 1216, 512]
    - [2, 13.01]
  - - [1344, 3776, 1, 512, 1344, 1344, 1344, 512]
    - [2, 13.021]
  - - [1472, 3776, 1, 512, 1472, 1472, 1472, 512]
    - [2, 13.082]
  - - [1600, 3776, 1, 512, 1600, 1600, 1600, 512]
    - [2, 13.099]
  - - [1728, 3776, 1, 512, 1728, 1728, 1728, 512]
    - [2, 13.166]
  - - [1856, 3776, 1, 512, 1856, 1856, 1856, 512]
    - [2, 13.151]
  - - [1984, 3776, 1, 512, 1984, 1984, 1984, 512]
    - [2, 13.211]
  - - [2112, 3776, 1, 512, 2112, 2112, 2112, 512]
    - [2, 13.209]
  - - [2240, 3776, 1, 512, 2240, 2240, 2240, 512]
    - [2, 13.252]
  - - [2368, 3776, 1, 512, 2368, 2368, 2368, 512]
    - [2, 13.249]
  - - [2496, 3776, 1, 512, 2496, 2496, 2496, 512]
    - [2, 13.289]
  - - [2624, 3776, 1, 512, 2624, 2624, 2624, 512]
    - [2, 13.278]
  - - [2752, 3776, 1, 512, 2752, 2752, 2752, 512]
    - [2, 13.288]
  - - [2880, 3776, 1, 512, 2880, 2880, 2880, 512]
    - [2, 13.297]
  - - [3008, 3776, 1, 512, 3008, 3008, 3008, 512]
    - [0, 13.344]
  - - [3136, 3776, 1, 512, 3136, 3136, 3136, 512]
    - [2, 13.321]
  - - [3264, 3776, 1, 512, 3264, 3264, 3264, 512]
    - [2, 13.355]
  - - [3392, 3776, 1, 512, 3392, 3392, 3392, 512]
    - [2, 13.363]
  - - [3520, 3776, 1, 512, 3520, 3520, 3520, 512]
    - [2, 13.335]
  - - [3648, 3776, 1, 512, 3648, 3648, 3648, 512]
    - [2, 13.349]
  - - [3776, 3776, 1, 512, 3776, 3776, 3776, 512]
    - [2, 13.353]
  - - [3904, 3776, 1, 512, 3904, 3904, 3904, 512]
    - [2, 13.368]
  - - [4032, 3776, 1, 512, 4032, 4032, 4032, 512]
    - [2, 13.379]
  - - [64, 3904, 1, 512, 64, 64, 64, 512]
    - [2, 10.586]
  - - [192, 3904, 1, 512, 192, 192, 192, 512]
    - [2, 11.671]
  - - [320, 3904, 1, 512, 320, 320, 320, 512]
    - [2, 12.402]
  - - [448, 3904, 1, 512, 448, 448, 448, 512]
    - [2, 12.785]
  - - [576, 3904, 1, 512, 576, 576, 576, 512]
    - [2, 12.853]
  - - [704, 3904, 1, 512, 704, 704, 704, 512]
    - [2, 12.979]
  - - [832, 3904, 1, 512, 832, 832, 832, 512]
    - [2, 13.026]
  - - [960, 3904, 1, 512, 960, 960, 960, 512]
    - [2, 13.127]
  - - [1088, 3904, 1, 512, 1088, 1088, 1088, 512]
    - [2, 13.124]
  - - [1216, 3904, 1, 512, 1216, 1216, 1216, 512]
    - [2, 12.995]
  - - [1344, 3904, 1, 512, 1344, 1344, 1344, 512]
    - [2, 13.06]
  - - [1472, 3904, 1, 512, 1472, 1472, 1472, 512]
    - [2, 13.048]
  - - [1600, 3904, 1, 512, 1600, 1600, 1600, 512]
    - [2, 13.107]
  - - [1728, 3904, 1, 512, 1728, 1728, 1728, 512]
    - [2, 13.167]
  - - [1856, 3904, 1, 512, 1856, 1856, 1856, 512]
    - [2, 13.191]
  - - [1984, 3904, 1, 512, 1984, 1984, 1984, 512]
    - [2, 13.192]
  - - [2112, 3904, 1, 512, 2112, 2112, 2112, 512]
    - [2, 13.239]
  - - [2240, 3904, 1, 512, 2240, 2240, 2240, 512]
    - [2, 13.242]
  - - [2368, 3904, 1, 512, 2368, 2368, 2368, 512]
    - [2, 13.248]
  - - [2496, 3904, 1, 512, 2496, 2496, 2496, 512]
    - [2, 13.297]
  - - [2624, 3904, 1, 512, 2624, 2624, 2624, 512]
    - [2, 13.314]
  - - [2752, 3904, 1, 512, 2752, 2752, 2752, 512]
    - [2, 13.304]
  - - [2880, 3904, 1, 512, 2880, 2880, 2880, 512]
    - [2, 13.309]
  - - [3008, 3904, 1, 512, 3008, 3008, 3008, 512]
    - [2, 13.335]
  - - [3136, 3904, 1, 512, 3136, 3136, 3136, 512]
    - [2, 13.343]
  - - [3264, 3904, 1, 512, 3264, 3264, 3264, 512]
    - [2, 13.348]
  - - [3392, 3904, 1, 512, 3392, 3392, 3392, 512]
    - [2, 13.35]
  - - [3520, 3904, 1, 512, 3520, 3520, 3520, 512]
    - [2, 13.367]
  - - [3648, 3904, 1, 512, 3648, 3648, 3648, 512]
    - [2, 13.352]
  - - [3776, 3904, 1, 512, 3776, 3776, 3776, 512]
    - [2, 13.356]
  - - [3904, 3904, 1, 512, 3904, 3904, 3904, 512]
    - [2, 13.362]
  - - [4032, 3904, 1, 512, 4032, 4032, 4032, 512]
    - [2, 13.377]
  - - [64, 4032, 1, 512, 64, 64, 64, 512]
    - [0, 10.56]
  - - [192, 4032, 1, 512, 192, 192, 192, 512]
    - [2, 11.754]
  - - [320, 4032, 1, 512, 320, 320, 320, 512]
    - [2, 12.41]
  - - [448, 4032, 1, 512, 448, 448, 448, 512]
    - [2, 12.76]
  - - [576, 4032, 1, 512, 576, 576, 576, 512]
    - [2, 12.86]
  - - [704, 4032, 1, 512, 704, 704, 704, 512]
    - [2, 13.037]
  - - [832, 4032, 1, 512, 832, 832, 832, 512]
    - [2, 13.061]
  - - [960, 4032, 1, 512, 960, 960, 960, 512]
    - [2, 13.107]
  - - [1088, 4032, 1, 512, 1088, 1088, 1088, 512]
    - [2, 12.944]
  - - [1216, 4032, 1, 512, 1216, 1216, 1216, 512]
    - [2, 12.989]
  - - [1344, 4032, 1, 512, 1344, 1344, 1344, 512]
    - [2, 13.064]
  - - [1472, 4032, 1, 512, 1472, 1472, 1472, 512]
    - [2, 13.129]
  - - [1600, 4032, 1, 512, 1600, 1600, 1600, 512]
    - [2, 13.107]
  - - [1728, 4032, 1, 512, 1728, 1728, 1728, 512]
    - [2, 13.164]
  - - [1856, 4032, 1, 512, 1856, 1856, 1856, 512]
    - [2, 13.195]
  - - [1984, 4032, 1, 512, 1984, 1984, 1984, 512]
    - [2, 13.227]
  - - [2112, 4032, 1, 512, 2112, 2112, 2112, 512]
    - [2, 13.26]
  - - [2240, 4032, 1, 512, 2240, 2240, 2240, 512]
    - [2, 13.262]
  - - [2368, 4032, 1, 512, 2368, 2368, 2368, 512]
    - [2, 13.289]
  - - [2496, 4032, 1, 512, 2496, 2496, 2496, 512]
    - [2, 13.283]
  - - [2624, 4032, 1, 512, 2624, 2624, 2624, 512]
    - [2, 13.286]
  - - [2752, 4032, 1, 512, 2752, 2752, 2752, 512]
    - [2, 13.306]
  - - [2880, 4032, 1, 512, 2880, 2880, 2880, 512]
    - [2, 13.325]
  - - [3008, 4032, 1, 512, 3008, 3008, 3008, 512]
    - [2, 13.349]
  - - [3136, 4032, 1, 512, 3136, 3136, 3136, 512]
    - [2, 13.34]
  - - [3264, 4032, 1, 512, 3264, 3264, 3264, 512]
    - [2, 13.344]
  - - [3392, 4032, 1, 512, 3392, 3392, 3392, 512]
    - [2, 13.361]
  - - [3520, 4032, 1, 512, 3520, 3520, 3520, 512]
    - [2, 13.377]
  - - [3648, 4032, 1, 512, 3648, 3648, 3648, 512]
    - [2, 13.367]
  - - [3776, 4032, 1, 512, 3776, 3776, 3776, 512]
    - [2, 13.383]
  - - [3904, 4032, 1, 512, 3904, 3904, 3904, 512]
    - [2, 13.349]
  - - [4032, 4032, 1, 512, 4032, 4032, 4032, 512]
    - [2, 13.39]
  - - [64, 64, 1, 1024, 64, 64, 64, 1024]
    - [2, 1.22]
  - - [192, 64, 1, 1024, 192, 192, 192, 1024]
    - [2, 3.664]
  - - [320, 64, 1, 1024, 320, 320, 320, 1024]
    - [0, 4.826]
  - - [448, 64, 1, 1024, 448, 448, 448, 1024]
    - [0, 6.731]
  - - [576, 64, 1, 1024, 576, 576, 576, 1024]
    - [2, 6.353]
  - - [704, 64, 1, 1024, 704, 704, 704, 1024]
    - [2, 7.77]
  - - [832, 64, 1, 1024, 832, 832, 832, 1024]
    - [0, 8.193]
  - - [960, 64, 1, 1024, 960, 960, 960, 1024]
    - [0, 9.424]
  - - [1088, 64, 1, 1024, 1088, 1088, 1088, 1024]
    - [2, 8.194]
  - - [1216, 64, 1, 1024, 1216, 1216, 1216, 1024]
    - [0, 8.759]
  - - [1344, 64, 1, 1024, 1344, 1344, 1344, 1024]
    - [0, 9.651]
  - - [1472, 64, 1, 1024, 1472, 1472, 1472, 1024]
    - [2, 8.583]
  - - [1600, 64, 1, 1024, 1600, 1600, 1600, 1024]
    - [2, 9.183]
  - - [1728, 64, 1, 1024, 1728, 1728, 1728, 1024]
    - [0, 9.844]
  - - [1856, 64, 1, 1024, 1856, 1856, 1856, 1024]
    - [0, 10.531]
  - - [1984, 64, 1, 1024, 1984, 1984, 1984, 1024]
    - [0, 9.396]
  - - [2112, 64, 1, 1024, 2112, 2112, 2112, 1024]
    - [0, 9.965]
  - - [2240, 64, 1, 1024, 2240, 2240, 2240, 1024]
    - [0, 10.561]
  - - [2368, 64, 1, 1024, 2368, 2368, 2368, 1024]
    - [0, 11.145]
  - - [2496, 64, 1, 1024, 2496, 2496, 2496, 1024]
    - [2, 10.436]
  - - [2624, 64, 1, 1024, 2624, 2624, 2624, 1024]
    - [2, 10.549]
  - - [2752, 64, 1, 1024, 2752, 2752, 2752, 1024]
    - [0, 11.059]
  - - [2880, 64, 1, 1024, 2880, 2880, 2880, 1024]
    - [0, 11.567]
  - - [3008, 64, 1, 1024, 3008, 3008, 3008, 1024]
    - [2, 10.883]
  - - [3136, 64, 1, 1024, 3136, 3136, 3136, 1024]
    - [2, 11.083]
  - - [3264, 64, 1, 1024, 3264, 3264, 3264, 1024]
    - [0, 11.435]
  - - [3392, 64, 1, 1024, 3392, 3392, 3392, 1024]
    - [2, 11.087]
  - - [3520, 64, 1, 1024, 3520, 3520, 3520, 1024]
    - [2, 11.125]
  - - [3648, 64, 1, 1024, 3648, 3648, 3648, 1024]
    - [0, 11.352]
  - - [3776, 64, 1, 1024, 3776, 3776, 3776, 1024]
    - [0, 11.736]
  - - [3904, 64, 1, 1024, 3904, 3904, 3904, 1024]
    - [2, 11.007]
  - - [4032, 64, 1, 1024, 4032, 4032, 4032, 1024]
    - [2, 10.579]
  - - [64, 192, 1, 1024, 64, 64, 64, 1024]
    - [2, 3.672]
  - - [192, 192, 1, 1024, 192, 192, 192, 1024]
    - [2, 6.367]
  - - [320, 192, 1, 1024, 320, 320, 320, 1024]
    - [0, 9.456]
  - - [448, 192, 1, 1024, 448, 448, 448, 1024]
    - [0, 9.708]
  - - [576, 192, 1, 1024, 576, 576, 576, 1024]
    - [0, 9.892]
  - - [704, 192, 1, 1024, 704, 704, 704, 1024]
    - [0, 10.02]
  - - [832, 192, 1, 1024, 832, 832, 832, 1024]
    - [2, 10.801]
  - - [960, 192, 1, 1024, 960, 960, 960, 1024]
    - [0, 11.569]
  - - [1088, 192, 1, 1024, 1088, 1088, 1088, 1024]
    - [0, 11.439]
  - - [1216, 192, 1, 1024, 1216, 1216, 1216, 1024]
    - [0, 11.343]
  - - [1344, 192, 1, 1024, 1344, 1344, 1344, 1024]
    - [2, 10.872]
  - - [1472, 192, 1, 1024, 1472, 1472, 1472, 1024]
    - [2, 10.814]
  - - [1600, 192, 1, 1024, 1600, 1600, 1600, 1024]
    - [0, 11.573]
  - - [1728, 192, 1, 1024, 1728, 1728, 1728, 1024]
    - [0, 11.511]
  - - [1856, 192, 1, 1024, 1856, 1856, 1856, 1024]
    - [0, 11.456]
  - - [1984, 192, 1, 1024, 1984, 1984, 1984, 1024]
    - [2, 11.734]
  - - [2112, 192, 1, 1024, 2112, 2112, 2112, 1024]
    - [2, 11.604]
  - - [2240, 192, 1, 1024, 2240, 2240, 2240, 1024]
    - [0, 12.006]
  - - [2368, 192, 1, 1024, 2368, 2368, 2368, 1024]
    - [0, 11.933]
  - - [2496, 192, 1, 1024, 2496, 2496, 2496, 1024]
    - [0, 11.873]
  - - [2624, 192, 1, 1024, 2624, 2624, 2624, 1024]
    - [2, 11.918]
  - - [2752, 192, 1, 1024, 2752, 2752, 2752, 1024]
    - [2, 12.086]
  - - [2880, 192, 1, 1024, 2880, 2880, 2880, 1024]
    - [0, 12.251]
  - - [3008, 192, 1, 1024, 3008, 3008, 3008, 1024]
    - [0, 12.193]
  - - [3136, 192, 1, 1024, 3136, 3136, 3136, 1024]
    - [2, 12.2]
  - - [3264, 192, 1, 1024, 3264, 3264, 3264, 1024]
    - [2, 12.205]
  - - [3392, 192, 1, 1024, 3392, 3392, 3392, 1024]
    - [2, 12.029]
  - - [3520, 192, 1, 1024, 3520, 3520, 3520, 1024]
    - [0, 12.429]
  - - [3648, 192, 1, 1024, 3648, 3648, 3648, 1024]
    - [0, 12.364]
  - - [3776, 192, 1, 1024, 3776, 3776, 3776, 1024]
    - [2, 12.395]
  - - [3904, 192, 1, 1024, 3904, 3904, 3904, 1024]
    - [2, 12.342]
  - - [4032, 192, 1, 1024, 4032, 4032, 4032, 1024]
    - [2, 12.414]
  - - [64, 320, 1, 1024, 64, 64, 64, 1024]
    - [0, 4.842]
  - - [192, 320, 1, 1024, 192, 192, 192, 1024]
    - [0, 9.441]
  - - [320, 320, 1, 1024, 320, 320, 320, 1024]
    - [2, 9.238]
  - - [448, 320, 1, 1024, 448, 448, 448, 1024]
    - [0, 10.565]
  - - [576, 320, 1, 1024, 576, 576, 576, 1024]
    - [0, 11.582]
  - - [704, 320, 1, 1024, 704, 704, 704, 1024]
    - [2, 11.485]
  - - [832, 320, 1, 1024, 832, 832, 832, 1024]
    - [2, 10.857]
  - - [960, 320, 1, 1024, 960, 960, 960, 1024]
    - [0, 11.563]
  - - [1088, 320, 1, 1024, 1088, 1088, 1088, 1024]
    - [0, 11.218]
  - - [1216, 320, 1, 1024, 1216, 1216, 1216, 1024]
    - [2, 11.664]
  - - [1344, 320, 1, 1024, 1344, 1344, 1344, 1024]
    - [0, 12.004]
  - - [1472, 320, 1, 1024, 1472, 1472, 1472, 1024]
    - [2, 11.87]
  - - [1600, 320, 1, 1024, 1600, 1600, 1600, 1024]
    - [0, 11.986]
  - - [1728, 320, 1, 1024, 1728, 1728, 1728, 1024]
    - [0, 12.251]
  - - [1856, 320, 1, 1024, 1856, 1856, 1856, 1024]
    - [2, 12.02]
  - - [1984, 320, 1, 1024, 1984, 1984, 1984, 1024]
    - [0, 12.203]
  - - [2112, 320, 1, 1024, 2112, 2112, 2112, 1024]
    - [0, 12.416]
  - - [2240, 320, 1, 1024, 2240, 2240, 2240, 1024]
    - [2, 12.238]
  - - [2368, 320, 1, 1024, 2368, 2368, 2368, 1024]
    - [2, 12.358]
  - - [2496, 320, 1, 1024, 2496, 2496, 2496, 1024]
    - [0, 12.52]
  - - [2624, 320, 1, 1024, 2624, 2624, 2624, 1024]
    - [2, 12.498]
  - - [2752, 320, 1, 1024, 2752, 2752, 2752, 1024]
    - [2, 12.585]
  - - [2880, 320, 1, 1024, 2880, 2880, 2880, 1024]
    - [0, 12.608]
  - - [3008, 320, 1, 1024, 3008, 3008, 3008, 1024]
    - [2, 12.682]
  - - [3136, 320, 1, 1024, 3136, 3136, 3136, 1024]
    - [2, 12.623]
  - - [3264, 320, 1, 1024, 3264, 3264, 3264, 1024]
    - [0, 12.693]
  - - [3392, 320, 1, 1024, 3392, 3392, 3392, 1024]
    - [2, 12.758]
  - - [3520, 320, 1, 1024, 3520, 3520, 3520, 1024]
    - [2, 12.761]
  - - [3648, 320, 1, 1024, 3648, 3648, 3648, 1024]
    - [2, 12.784]
  - - [3776, 320, 1, 1024, 3776, 3776, 3776, 1024]
    - [2, 12.833]
  - - [3904, 320, 1, 1024, 3904, 3904, 3904, 1024]
    - [2, 12.856]
  - - [4032, 320, 1, 1024, 4032, 4032, 4032, 1024]
    - [0, 12.795]
  - - [64, 448, 1, 1024, 64, 64, 64, 1024]
    - [0, 6.759]
  - - [192, 448, 1, 1024, 192, 192, 192, 1024]
    - [0, 9.714]
  - - [320, 448, 1, 1024, 320, 320, 320, 1024]
    - [0, 10.57]
  - - [448, 448, 1, 1024, 448, 448, 448, 1024]
    - [2, 11.043]
  - - [576, 448, 1, 1024, 576, 576, 576, 1024]
    - [2, 10.903]
  - - [704, 448, 1, 1024, 704, 704, 704, 1024]
    - [2, 11.208]
  - - [832, 448, 1, 1024, 832, 832, 832, 1024]
    - [2, 11.571]
  - - [960, 448, 1, 1024, 960, 960, 960, 1024]
    - [0, 12.003]
  - - [1088, 448, 1, 1024, 1088, 1088, 1088, 1024]
    - [0, 12.047]
  - - [1216, 448, 1, 1024, 1216, 1216, 1216, 1024]
    - [0, 12.104]
  - - [1344, 448, 1, 1024, 1344, 1344, 1344, 1024]
    - [0, 12.139]
  - - [1472, 448, 1, 1024, 1472, 1472, 1472, 1024]
    - [2, 12.451]
  - - [1600, 448, 1, 1024, 1600, 1600, 1600, 1024]
    - [2, 12.418]
  - - [1728, 448, 1, 1024, 1728, 1728, 1728, 1024]
    - [2, 12.483]
  - - [1856, 448, 1, 1024, 1856, 1856, 1856, 1024]
    - [0, 12.507]
  - - [1984, 448, 1, 1024, 1984, 1984, 1984, 1024]
    - [0, 12.581]
  - - [2112, 448, 1, 1024, 2112, 2112, 2112, 1024]
    - [2, 12.667]
  - - [2240, 448, 1, 1024, 2240, 2240, 2240, 1024]
    - [2, 12.602]
  - - [2368, 448, 1, 1024, 2368, 2368, 2368, 1024]
    - [2, 12.667]
  - - [2496, 448, 1, 1024, 2496, 2496, 2496, 1024]
    - [2, 12.728]
  - - [2624, 448, 1, 1024, 2624, 2624, 2624, 1024]
    - [2, 12.72]
  - - [2752, 448, 1, 1024, 2752, 2752, 2752, 1024]
    - [2, 12.805]
  - - [2880, 448, 1, 1024, 2880, 2880, 2880, 1024]
    - [2, 12.876]
  - - [3008, 448, 1, 1024, 3008, 3008, 3008, 1024]
    - [2, 12.821]
  - - [3136, 448, 1, 1024, 3136, 3136, 3136, 1024]
    - [2, 12.857]
  - - [3264, 448, 1, 1024, 3264, 3264, 3264, 1024]
    - [2, 12.78]
  - - [3392, 448, 1, 1024, 3392, 3392, 3392, 1024]
    - [2, 12.989]
  - - [3520, 448, 1, 1024, 3520, 3520, 3520, 1024]
    - [0, 12.737]
  - - [3648, 448, 1, 1024, 3648, 3648, 3648, 1024]
    - [2, 12.999]
  - - [3776, 448, 1, 1024, 3776, 3776, 3776, 1024]
    - [2, 12.927]
  - - [3904, 448, 1, 1024, 3904, 3904, 3904, 1024]
    - [2, 12.937]
  - - [4032, 448, 1, 1024, 4032, 4032, 4032, 1024]
    - [2, 12.902]
  - - [64, 576, 1, 1024, 64, 64, 64, 1024]
    - [2, 6.641]
  - - [192, 576, 1, 1024, 192, 192, 192, 1024]
    - [0, 9.873]
  - - [320, 576, 1, 1024, 320, 320, 320, 1024]
    - [0, 11.577]
  - - [448, 576, 1, 1024, 448, 448, 448, 1024]
    - [2, 11.511]
  - - [576, 576, 1, 1024, 576, 576, 576, 1024]
    - [0, 11.507]
  - - [704, 576, 1, 1024, 704, 704, 704, 1024]
    - [2, 11.688]
  - - [832, 576, 1, 1024, 832, 832, 832, 1024]
    - [0, 11.858]
  - - [960, 576, 1, 1024, 960, 960, 960, 1024]
    - [0, 12.245]
  - - [1088, 576, 1, 1024, 1088, 1088, 1088, 1024]
    - [0, 12.073]
  - - [1216, 576, 1, 1024, 1216, 1216, 1216, 1024]
    - [0, 12.35]
  - - [1344, 576, 1, 1024, 1344, 1344, 1344, 1024]
    - [2, 12.431]
  - - [1472, 576, 1, 1024, 1472, 1472, 1472, 1024]
    - [2, 12.524]
  - - [1600, 576, 1, 1024, 1600, 1600, 1600, 1024]
    - [0, 12.614]
  - - [1728, 576, 1, 1024, 1728, 1728, 1728, 1024]
    - [2, 12.527]
  - - [1856, 576, 1, 1024, 1856, 1856, 1856, 1024]
    - [0, 12.652]
  - - [1984, 576, 1, 1024, 1984, 1984, 1984, 1024]
    - [2, 12.827]
  - - [2112, 576, 1, 1024, 2112, 2112, 2112, 1024]
    - [2, 12.785]
  - - [2240, 576, 1, 1024, 2240, 2240, 2240, 1024]
    - [0, 12.78]
  - - [2368, 576, 1, 1024, 2368, 2368, 2368, 1024]
    - [2, 12.825]
  - - [2496, 576, 1, 1024, 2496, 2496, 2496, 1024]
    - [2, 12.88]
  - - [2624, 576, 1, 1024, 2624, 2624, 2624, 1024]
    - [2, 12.958]
  - - [2752, 576, 1, 1024, 2752, 2752, 2752, 1024]
    - [2, 12.924]
  - - [2880, 576, 1, 1024, 2880, 2880, 2880, 1024]
    - [2, 12.937]
  - - [3008, 576, 1, 1024, 3008, 3008, 3008, 1024]
    - [2, 12.945]
  - - [3136, 576, 1, 1024, 3136, 3136, 3136, 1024]
    - [2, 13.04]
  - - [3264, 576, 1, 1024, 3264, 3264, 3264, 1024]
    - [2, 12.979]
  - - [3392, 576, 1, 1024, 3392, 3392, 3392, 1024]
    - [2, 13.026]
  - - [3520, 576, 1, 1024, 3520, 3520, 3520, 1024]
    - [2, 13.04]
  - - [3648, 576, 1, 1024, 3648, 3648, 3648, 1024]
    - [2, 13.049]
  - - [3776, 576, 1, 1024, 3776, 3776, 3776, 1024]
    - [2, 12.914]
  - - [3904, 576, 1, 1024, 3904, 3904, 3904, 1024]
    - [2, 12.938]
  - - [4032, 576, 1, 1024, 4032, 4032, 4032, 1024]
    - [2, 12.833]
  - - [64, 704, 1, 1024, 64, 64, 64, 1024]
    - [2, 7.764]
  - - [192, 704, 1, 1024, 192, 192, 192, 1024]
    - [0, 9.995]
  - - [320, 704, 1, 1024, 320, 320, 320, 1024]
    - [2, 11.476]
  - - [448, 704, 1, 1024, 448, 448, 448, 1024]
    - [2, 11.097]
  - - [576, 704, 1, 1024, 576, 576, 576, 1024]
    - [2, 11.765]
  - - [704, 704, 1, 1024, 704, 704, 704, 1024]
    - [2, 12.026]
  - - [832, 704, 1, 1024, 832, 832, 832, 1024]
    - [2, 12.061]
  - - [960, 704, 1, 1024, 960, 960, 960, 1024]
    - [0, 12.413]
  - - [1088, 704, 1, 1024, 1088, 1088, 1088, 1024]
    - [2, 12.533]
  - - [1216, 704, 1, 1024, 1216, 1216, 1216, 1024]
    - [2, 12.563]
  - - [1344, 704, 1, 1024, 1344, 1344, 1344, 1024]
    - [0, 12.572]
  - - [1472, 704, 1, 1024, 1472, 1472, 1472, 1024]
    - [0, 12.617]
  - - [1600, 704, 1, 1024, 1600, 1600, 1600, 1024]
    - [2, 12.656]
  - - [1728, 704, 1, 1024, 1728, 1728, 1728, 1024]
    - [2, 12.879]
  - - [1856, 704, 1, 1024, 1856, 1856, 1856, 1024]
    - [2, 12.852]
  - - [1984, 704, 1, 1024, 1984, 1984, 1984, 1024]
    - [2, 12.882]
  - - [2112, 704, 1, 1024, 2112, 2112, 2112, 1024]
    - [2, 12.901]
  - - [2240, 704, 1, 1024, 2240, 2240, 2240, 1024]
    - [2, 13.035]
  - - [2368, 704, 1, 1024, 2368, 2368, 2368, 1024]
    - [2, 12.928]
  - - [2496, 704, 1, 1024, 2496, 2496, 2496, 1024]
    - [2, 12.885]
  - - [2624, 704, 1, 1024, 2624, 2624, 2624, 1024]
    - [2, 13.104]
  - - [2752, 704, 1, 1024, 2752, 2752, 2752, 1024]
    - [2, 13.028]
  - - [2880, 704, 1, 1024, 2880, 2880, 2880, 1024]
    - [2, 13.047]
  - - [3008, 704, 1, 1024, 3008, 3008, 3008, 1024]
    - [2, 13.102]
  - - [3136, 704, 1, 1024, 3136, 3136, 3136, 1024]
    - [2, 12.921]
  - - [3264, 704, 1, 1024, 3264, 3264, 3264, 1024]
    - [2, 12.927]
  - - [3392, 704, 1, 1024, 3392, 3392, 3392, 1024]
    - [2, 12.969]
  - - [3520, 704, 1, 1024, 3520, 3520, 3520, 1024]
    - [2, 12.992]
  - - [3648, 704, 1, 1024, 3648, 3648, 3648, 1024]
    - [2, 12.937]
  - - [3776, 704, 1, 1024, 3776, 3776, 3776, 1024]
    - [2, 13.018]
  - - [3904, 704, 1, 1024, 3904, 3904, 3904, 1024]
    - [2, 12.966]
  - - [4032, 704, 1, 1024, 4032, 4032, 4032, 1024]
    - [2, 13.05]
  - - [64, 832, 1, 1024, 64, 64, 64, 1024]
    - [0, 8.192]
  - - [192, 832, 1, 1024, 192, 192, 192, 1024]
    - [2, 10.572]
  - - [320, 832, 1, 1024, 320, 320, 320, 1024]
    - [2, 11.787]
  - - [448, 832, 1, 1024, 448, 448, 448, 1024]
    - [2, 11.386]
  - - [576, 832, 1, 1024, 576, 576, 576, 1024]
    - [0, 11.871]
  - - [704, 832, 1, 1024, 704, 704, 704, 1024]
    - [2, 12.095]
  - - [832, 832, 1, 1024, 832, 832, 832, 1024]
    - [2, 12.277]
  - - [960, 832, 1, 1024, 960, 960, 960, 1024]
    - [0, 12.536]
  - - [1088, 832, 1, 1024, 1088, 1088, 1088, 1024]
    - [2, 12.708]
  - - [1216, 832, 1, 1024, 1216, 1216, 1216, 1024]
    - [0, 12.652]
  - - [1344, 832, 1, 1024, 1344, 1344, 1344, 1024]
    - [2, 12.73]
  - - [1472, 832, 1, 1024, 1472, 1472, 1472, 1024]
    - [2, 12.768]
  - - [1600, 832, 1, 1024, 1600, 1600, 1600, 1024]
    - [2, 12.811]
  - - [1728, 832, 1, 1024, 1728, 1728, 1728, 1024]
    - [2, 12.966]
  - - [1856, 832, 1, 1024, 1856, 1856, 1856, 1024]
    - [2, 12.986]
  - - [1984, 832, 1, 1024, 1984, 1984, 1984, 1024]
    - [2, 12.892]
  - - [2112, 832, 1, 1024, 2112, 2112, 2112, 1024]
    - [2, 12.863]
  - - [2240, 832, 1, 1024, 2240, 2240, 2240, 1024]
    - [2, 13.044]
  - - [2368, 832, 1, 1024, 2368, 2368, 2368, 1024]
    - [2, 13.108]
  - - [2496, 832, 1, 1024, 2496, 2496, 2496, 1024]
    - [2, 13.007]
  - - [2624, 832, 1, 1024, 2624, 2624, 2624, 1024]
    - [2, 12.82]
  - - [2752, 832, 1, 1024, 2752, 2752, 2752, 1024]
    - [2, 12.909]
  - - [2880, 832, 1, 1024, 2880, 2880, 2880, 1024]
    - [2, 12.879]
  - - [3008, 832, 1, 1024, 3008, 3008, 3008, 1024]
    - [2, 12.942]
  - - [3136, 832, 1, 1024, 3136, 3136, 3136, 1024]
    - [2, 12.948]
  - - [3264, 832, 1, 1024, 3264, 3264, 3264, 1024]
    - [2, 13.002]
  - - [3392, 832, 1, 1024, 3392, 3392, 3392, 1024]
    - [2, 13.049]
  - - [3520, 832, 1, 1024, 3520, 3520, 3520, 1024]
    - [2, 13.043]
  - - [3648, 832, 1, 1024, 3648, 3648, 3648, 1024]
    - [2, 13.057]
  - - [3776, 832, 1, 1024, 3776, 3776, 3776, 1024]
    - [2, 13.096]
  - - [3904, 832, 1, 1024, 3904, 3904, 3904, 1024]
    - [2, 13.076]
  - - [4032, 832, 1, 1024, 4032, 4032, 4032, 1024]
    - [2, 13.136]
  - - [64, 960, 1, 1024, 64, 64, 64, 1024]
    - [2, 8.93]
  - - [192, 960, 1, 1024, 192, 192, 192, 1024]
    - [0, 11.587]
  - - [320, 960, 1, 1024, 320, 320, 320, 1024]
    - [0, 11.587]
  - - [448, 960, 1, 1024, 448, 448, 448, 1024]
    - [0, 12.008]
  - - [576, 960, 1, 1024, 576, 576, 576, 1024]
    - [0, 12.249]
  - - [704, 960, 1, 1024, 704, 704, 704, 1024]
    - [0, 12.428]
  - - [832, 960, 1, 1024, 832, 832, 832, 1024]
    - [0, 12.535]
  - - [960, 960, 1, 1024, 960, 960, 960, 1024]
    - [0, 12.615]
  - - [1088, 960, 1, 1024, 1088, 1088, 1088, 1024]
    - [0, 12.684]
  - - [1216, 960, 1, 1024, 1216, 1216, 1216, 1024]
    - [2, 12.76]
  - - [1344, 960, 1, 1024, 1344, 1344, 1344, 1024]
    - [2, 12.829]
  - - [1472, 960, 1, 1024, 1472, 1472, 1472, 1024]
    - [2, 12.836]
  - - [1600, 960, 1, 1024, 1600, 1600, 1600, 1024]
    - [2, 12.915]
  - - [1728, 960, 1, 1024, 1728, 1728, 1728, 1024]
    - [2, 13.032]
  - - [1856, 960, 1, 1024, 1856, 1856, 1856, 1024]
    - [2, 13.083]
  - - [1984, 960, 1, 1024, 1984, 1984, 1984, 1024]
    - [2, 13.095]
  - - [2112, 960, 1, 1024, 2112, 2112, 2112, 1024]
    - [2, 13.067]
  - - [2240, 960, 1, 1024, 2240, 2240, 2240, 1024]
    - [2, 12.909]
  - - [2368, 960, 1, 1024, 2368, 2368, 2368, 1024]
    - [2, 12.933]
  - - [2496, 960, 1, 1024, 2496, 2496, 2496, 1024]
    - [2, 12.945]
  - - [2624, 960, 1, 1024, 2624, 2624, 2624, 1024]
    - [2, 12.958]
  - - [2752, 960, 1, 1024, 2752, 2752, 2752, 1024]
    - [2, 13.003]
  - - [2880, 960, 1, 1024, 2880, 2880, 2880, 1024]
    - [2, 12.98]
  - - [3008, 960, 1, 1024, 3008, 3008, 3008, 1024]
    - [2, 13.126]
  - - [3136, 960, 1, 1024, 3136, 3136, 3136, 1024]
    - [2, 13.048]
  - - [3264, 960, 1, 1024, 3264, 3264, 3264, 1024]
    - [2, 13.058]
  - - [3392, 960, 1, 1024, 3392, 3392, 3392, 1024]
    - [2, 13.113]
  - - [3520, 960, 1, 1024, 3520, 3520, 3520, 1024]
    - [2, 13.071]
  - - [3648, 960, 1, 1024, 3648, 3648, 3648, 1024]
    - [2, 13.144]
  - - [3776, 960, 1, 1024, 3776, 3776, 3776, 1024]
    - [2, 13.125]
  - - [3904, 960, 1, 1024, 3904, 3904, 3904, 1024]
    - [2, 13.078]
  - - [4032, 960, 1, 1024, 4032, 4032, 4032, 1024]
    - [2, 13.132]
  - - [64, 1088, 1, 1024, 64, 64, 64, 1024]
    - [0, 7.842]
  - - [192, 1088, 1, 1024, 192, 192, 192, 1024]
    - [0, 11.452]
  - - [320, 1088, 1, 1024, 320, 320, 320, 1024]
    - [2, 11.319]
  - - [448, 1088, 1, 1024, 448, 448, 448, 1024]
    - [0, 12.061]
  - - [576, 1088, 1, 1024, 576, 576, 576, 1024]
    - [0, 12.07]
  - - [704, 1088, 1, 1024, 704, 704, 704, 1024]
    - [0, 12.47]
  - - [832, 1088, 1, 1024, 832, 832, 832, 1024]
    - [2, 12.521]
  - - [960, 1088, 1, 1024, 960, 960, 960, 1024]
    - [2, 12.712]
  - - [1088, 1088, 1, 1024, 1088, 1088, 1088, 1024]
    - [2, 12.822]
  - - [1216, 1088, 1, 1024, 1216, 1216, 1216, 1024]
    - [2, 12.902]
  - - [1344, 1088, 1, 1024, 1344, 1344, 1344, 1024]
    - [2, 12.932]
  - - [1472, 1088, 1, 1024, 1472, 1472, 1472, 1024]
    - [2, 12.966]
  - - [1600, 1088, 1, 1024, 1600, 1600, 1600, 1024]
    - [2, 12.953]
  - - [1728, 1088, 1, 1024, 1728, 1728, 1728, 1024]
    - [2, 12.972]
  - - [1856, 1088, 1, 1024, 1856, 1856, 1856, 1024]
    - [2, 13.015]
  - - [1984, 1088, 1, 1024, 1984, 1984, 1984, 1024]
    - [2, 12.931]
  - - [2112, 1088, 1, 1024, 2112, 2112, 2112, 1024]
    - [2, 12.895]
  - - [2240, 1088, 1, 1024, 2240, 2240, 2240, 1024]
    - [2, 12.887]
  - - [2368, 1088, 1, 1024, 2368, 2368, 2368, 1024]
    - [2, 12.959]
  - - [2496, 1088, 1, 1024, 2496, 2496, 2496, 1024]
    - [2, 12.949]
  - - [2624, 1088, 1, 1024, 2624, 2624, 2624, 1024]
    - [2, 13.045]
  - - [2752, 1088, 1, 1024, 2752, 2752, 2752, 1024]
    - [2, 13.034]
  - - [2880, 1088, 1, 1024, 2880, 2880, 2880, 1024]
    - [2, 13.065]
  - - [3008, 1088, 1, 1024, 3008, 3008, 3008, 1024]
    - [2, 13.158]
  - - [3136, 1088, 1, 1024, 3136, 3136, 3136, 1024]
    - [2, 13.114]
  - - [3264, 1088, 1, 1024, 3264, 3264, 3264, 1024]
    - [2, 13.118]
  - - [3392, 1088, 1, 1024, 3392, 3392, 3392, 1024]
    - [2, 13.15]
  - - [3520, 1088, 1, 1024, 3520, 3520, 3520, 1024]
    - [2, 13.094]
  - - [3648, 1088, 1, 1024, 3648, 3648, 3648, 1024]
    - [2, 13.158]
  - - [3776, 1088, 1, 1024, 3776, 3776, 3776, 1024]
    - [2, 13.178]
  - - [3904, 1088, 1, 1024, 3904, 3904, 3904, 1024]
    - [2, 13.156]
  - - [4032, 1088, 1, 1024, 4032, 4032, 4032, 1024]
    - [2, 13.199]
  - - [64, 1216, 1, 1024, 64, 64, 64, 1024]
    - [0, 8.746]
  - - [192, 1216, 1, 1024, 192, 192, 192, 1024]
    - [0, 11.342]
  - - [320, 1216, 1, 1024, 320, 320, 320, 1024]
    - [0, 11.63]
  - - [448, 1216, 1, 1024, 448, 448, 448, 1024]
    - [0, 12.089]
  - - [576, 1216, 1, 1024, 576, 576, 576, 1024]
    - [0, 12.356]
  - - [704, 1216, 1, 1024, 704, 704, 704, 1024]
    - [2, 12.628]
  - - [832, 1216, 1, 1024, 832, 832, 832, 1024]
    - [0, 12.65]
  - - [960, 1216, 1, 1024, 960, 960, 960, 1024]
    - [2, 12.755]
  - - [1088, 1216, 1, 1024, 1088, 1088, 1088, 1024]
    - [0, 12.796]
  - - [1216, 1216, 1, 1024, 1216, 1216, 1216, 1024]
    - [0, 12.807]
  - - [1344, 1216, 1, 1024, 1344, 1344, 1344, 1024]
    - [2, 12.951]
  - - [1472, 1216, 1, 1024, 1472, 1472, 1472, 1024]
    - [2, 13.021]
  - - [1600, 1216, 1, 1024, 1600, 1600, 1600, 1024]
    - [2, 13.007]
  - - [1728, 1216, 1, 1024, 1728, 1728, 1728, 1024]
    - [2, 13.057]
  - - [1856, 1216, 1, 1024, 1856, 1856, 1856, 1024]
    - [2, 12.898]
  - - [1984, 1216, 1, 1024, 1984, 1984, 1984, 1024]
    - [2, 12.929]
  - - [2112, 1216, 1, 1024, 2112, 2112, 2112, 1024]
    - [2, 13.016]
  - - [2240, 1216, 1, 1024, 2240, 2240, 2240, 1024]
    - [2, 12.96]
  - - [2368, 1216, 1, 1024, 2368, 2368, 2368, 1024]
    - [2, 13.072]
  - - [2496, 1216, 1, 1024, 2496, 2496, 2496, 1024]
    - [2, 13.106]
  - - [2624, 1216, 1, 1024, 2624, 2624, 2624, 1024]
    - [2, 13.052]
  - - [2752, 1216, 1, 1024, 2752, 2752, 2752, 1024]
    - [2, 13.044]
  - - [2880, 1216, 1, 1024, 2880, 2880, 2880, 1024]
    - [2, 13.155]
  - - [3008, 1216, 1, 1024, 3008, 3008, 3008, 1024]
    - [2, 13.183]
  - - [3136, 1216, 1, 1024, 3136, 3136, 3136, 1024]
    - [2, 13.158]
  - - [3264, 1216, 1, 1024, 3264, 3264, 3264, 1024]
    - [2, 13.252]
  - - [3392, 1216, 1, 1024, 3392, 3392, 3392, 1024]
    - [2, 13.154]
  - - [3520, 1216, 1, 1024, 3520, 3520, 3520, 1024]
    - [2, 13.188]
  - - [3648, 1216, 1, 1024, 3648, 3648, 3648, 1024]
    - [2, 13.203]
  - - [3776, 1216, 1, 1024, 3776, 3776, 3776, 1024]
    - [2, 13.17]
  - - [3904, 1216, 1, 1024, 3904, 3904, 3904, 1024]
    - [2, 13.213]
  - - [4032, 1216, 1, 1024, 4032, 4032, 4032, 1024]
    - [2, 13.218]
  - - [64, 1344, 1, 1024, 64, 64, 64, 1024]
    - [0, 9.647]
  - - [192, 1344, 1, 1024, 192, 192, 192, 1024]
    - [2, 11.04]
  - - [320, 1344, 1, 1024, 320, 320, 320, 1024]
    - [0, 12.011]
  - - [448, 1344, 1, 1024, 448, 448, 448, 1024]
    - [0, 12.123]
  - - [576, 1344, 1, 1024, 576, 576, 576, 1024]
    - [2, 12.561]
  - - [704, 1344, 1, 1024, 704, 704, 704, 1024]
    - [2, 12.656]
  - - [832, 1344, 1, 1024, 832, 832, 832, 1024]
    - [2, 12.64]
  - - [960, 1344, 1, 1024, 960, 960, 960, 1024]
    - [2, 12.77]
  - - [1088, 1344, 1, 1024, 1088, 1088, 1088, 1024]
    - [2, 12.866]
  - - [1216, 1344, 1, 1024, 1216, 1216, 1216, 1024]
    - [2, 12.99]
  - - [1344, 1344, 1, 1024, 1344, 1344, 1344, 1024]
    - [2, 13.028]
  - - [1472, 1344, 1, 1024, 1472, 1472, 1472, 1024]
    - [2, 13.027]
  - - [1600, 1344, 1, 1024, 1600, 1600, 1600, 1024]
    - [2, 12.851]
  - - [1728, 1344, 1, 1024, 1728, 1728, 1728, 1024]
    - [2, 12.951]
  - - [1856, 1344, 1, 1024, 1856, 1856, 1856, 1024]
    - [2, 12.928]
  - - [1984, 1344, 1, 1024, 1984, 1984, 1984, 1024]
    - [2, 12.968]
  - - [2112, 1344, 1, 1024, 2112, 2112, 2112, 1024]
    - [2, 13.037]
  - - [2240, 1344, 1, 1024, 2240, 2240, 2240, 1024]
    - [2, 13.008]
  - - [2368, 1344, 1, 1024, 2368, 2368, 2368, 1024]
    - [2, 13.003]
  - - [2496, 1344, 1, 1024, 2496, 2496, 2496, 1024]
    - [2, 13.18]
  - - [2624, 1344, 1, 1024, 2624, 2624, 2624, 1024]
    - [2, 13.177]
  - - [2752, 1344, 1, 1024, 2752, 2752, 2752, 1024]
    - [2, 13.174]
  - - [2880, 1344, 1, 1024, 2880, 2880, 2880, 1024]
    - [2, 13.106]
  - - [3008, 1344, 1, 1024, 3008, 3008, 3008, 1024]
    - [2, 13.18]
  - - [3136, 1344, 1, 1024, 3136, 3136, 3136, 1024]
    - [2, 13.142]
  - - [3264, 1344, 1, 1024, 3264, 3264, 3264, 1024]
    - [2, 13.218]
  - - [3392, 1344, 1, 1024, 3392, 3392, 3392, 1024]
    - [2, 13.206]
  - - [3520, 1344, 1, 1024, 3520, 3520, 3520, 1024]
    - [2, 13.197]
  - - [3648, 1344, 1, 1024, 3648, 3648, 3648, 1024]
    - [2, 13.236]
  - - [3776, 1344, 1, 1024, 3776, 3776, 3776, 1024]
    - [2, 13.232]
  - - [3904, 1344, 1, 1024, 3904, 3904, 3904, 1024]
    - [2, 13.266]
  - - [4032, 1344, 1, 1024, 4032, 4032, 4032, 1024]
    - [2, 13.289]
  - - [64, 1472, 1, 1024, 64, 64, 64, 1024]
    - [2, 8.486]
  - - [192, 1472, 1, 1024, 192, 192, 192, 1024]
    - [0, 10.681]
  - - [320, 1472, 1, 1024, 320, 320, 320, 1024]
    - [2, 11.861]
  - - [448, 1472, 1, 1024, 448, 448, 448, 1024]
    - [2, 12.359]
  - - [576, 1472, 1, 1024, 576, 576, 576, 1024]
    - [2, 12.462]
  - - [704, 1472, 1, 1024, 704, 704, 704, 1024]
    - [0, 12.608]
  - - [832, 1472, 1, 1024, 832, 832, 832, 1024]
    - [2, 12.757]
  - - [960, 1472, 1, 1024, 960, 960, 960, 1024]
    - [2, 12.885]
  - - [1088, 1472, 1, 1024, 1088, 1088, 1088, 1024]
    - [2, 12.947]
  - - [1216, 1472, 1, 1024, 1216, 1216, 1216, 1024]
    - [2, 13.106]
  - - [1344, 1472, 1, 1024, 1344, 1344, 1344, 1024]
    - [2, 13.058]
  - - [1472, 1472, 1, 1024, 1472, 1472, 1472, 1024]
    - [2, 12.906]
  - - [1600, 1472, 1, 1024, 1600, 1600, 1600, 1024]
    - [2, 12.929]
  - - [1728, 1472, 1, 1024, 1728, 1728, 1728, 1024]
    - [2, 12.986]
  - - [1856, 1472, 1, 1024, 1856, 1856, 1856, 1024]
    - [2, 12.991]
  - - [1984, 1472, 1, 1024, 1984, 1984, 1984, 1024]
    - [2, 13.011]
  - - [2112, 1472, 1, 1024, 2112, 2112, 2112, 1024]
    - [2, 13.009]
  - - [2240, 1472, 1, 1024, 2240, 2240, 2240, 1024]
    - [2, 13.051]
  - - [2368, 1472, 1, 1024, 2368, 2368, 2368, 1024]
    - [2, 13.089]
  - - [2496, 1472, 1, 1024, 2496, 2496, 2496, 1024]
    - [2, 13.151]
  - - [2624, 1472, 1, 1024, 2624, 2624, 2624, 1024]
    - [2, 13.117]
  - - [2752, 1472, 1, 1024, 2752, 2752, 2752, 1024]
    - [2, 13.143]
  - - [2880, 1472, 1, 1024, 2880, 2880, 2880, 1024]
    - [2, 13.188]
  - - [3008, 1472, 1, 1024, 3008, 3008, 3008, 1024]
    - [2, 13.158]
  - - [3136, 1472, 1, 1024, 3136, 3136, 3136, 1024]
    - [2, 13.182]
  - - [3264, 1472, 1, 1024, 3264, 3264, 3264, 1024]
    - [2, 13.198]
  - - [3392, 1472, 1, 1024, 3392, 3392, 3392, 1024]
    - [2, 13.242]
  - - [3520, 1472, 1, 1024, 3520, 3520, 3520, 1024]
    - [2, 13.259]
  - - [3648, 1472, 1, 1024, 3648, 3648, 3648, 1024]
    - [2, 13.273]
  - - [3776, 1472, 1, 1024, 3776, 3776, 3776, 1024]
    - [2, 13.272]
  - - [3904, 1472, 1, 1024, 3904, 3904, 3904, 1024]
    - [2, 13.247]
  - - [4032, 1472, 1, 1024, 4032, 4032, 4032, 1024]
    - [2, 13.254]
  - - [64, 1600, 1, 1024, 64, 64, 64, 1024]
    - [0, 6.973]
  - - [192, 1600, 1, 1024, 192, 192, 192, 1024]
    - [0, 11.576]
  - - [320, 1600, 1, 1024, 320, 320, 320, 1024]
    - [2, 12.033]
  - - [448, 1600, 1, 1024, 448, 448, 448, 1024]
    - [2, 12.296]
  - - [576, 1600, 1, 1024, 576, 576, 576, 1024]
    - [0, 12.614]
  - - [704, 1600, 1, 1024, 704, 704, 704, 1024]
    - [2, 12.703]
  - - [832, 1600, 1, 1024, 832, 832, 832, 1024]
    - [2, 12.788]
  - - [960, 1600, 1, 1024, 960, 960, 960, 1024]
    - [2, 12.904]
  - - [1088, 1600, 1, 1024, 1088, 1088, 1088, 1024]
    - [2, 12.943]
  - - [1216, 1600, 1, 1024, 1216, 1216, 1216, 1024]
    - [2, 13.046]
  - - [1344, 1600, 1, 1024, 1344, 1344, 1344, 1024]
    - [2, 12.838]
  - - [1472, 1600, 1, 1024, 1472, 1472, 1472, 1024]
    - [2, 12.872]
  - - [1600, 1600, 1, 1024, 1600, 1600, 1600, 1024]
    - [2, 13.012]
  - - [1728, 1600, 1, 1024, 1728, 1728, 1728, 1024]
    - [2, 12.964]
  - - [1856, 1600, 1, 1024, 1856, 1856, 1856, 1024]
    - [2, 13.026]
  - - [1984, 1600, 1, 1024, 1984, 1984, 1984, 1024]
    - [2, 13.1]
  - - [2112, 1600, 1, 1024, 2112, 2112, 2112, 1024]
    - [2, 13.126]
  - - [2240, 1600, 1, 1024, 2240, 2240, 2240, 1024]
    - [2, 13.116]
  - - [2368, 1600, 1, 1024, 2368, 2368, 2368, 1024]
    - [2, 13.137]
  - - [2496, 1600, 1, 1024, 2496, 2496, 2496, 1024]
    - [2, 13.138]
  - - [2624, 1600, 1, 1024, 2624, 2624, 2624, 1024]
    - [2, 13.224]
  - - [2752, 1600, 1, 1024, 2752, 2752, 2752, 1024]
    - [2, 13.201]
  - - [2880, 1600, 1, 1024, 2880, 2880, 2880, 1024]
    - [2, 13.24]
  - - [3008, 1600, 1, 1024, 3008, 3008, 3008, 1024]
    - [2, 13.251]
  - - [3136, 1600, 1, 1024, 3136, 3136, 3136, 1024]
    - [2, 13.238]
  - - [3264, 1600, 1, 1024, 3264, 3264, 3264, 1024]
    - [2, 13.206]
  - - [3392, 1600, 1, 1024, 3392, 3392, 3392, 1024]
    - [2, 13.237]
  - - [3520, 1600, 1, 1024, 3520, 3520, 3520, 1024]
    - [2, 13.298]
  - - [3648, 1600, 1, 1024, 3648, 3648, 3648, 1024]
    - [2, 13.24]
  - - [3776, 1600, 1, 1024, 3776, 3776, 3776, 1024]
    - [2, 13.286]
  - - [3904, 1600, 1, 1024, 3904, 3904, 3904, 1024]
    - [2, 13.266]
  - - [4032, 1600, 1, 1024, 4032, 4032, 4032, 1024]
    - [2, 13.307]
  - - [64, 1728, 1, 1024, 64, 64, 64, 1024]
    - [2, 9.091]
  - - [192, 1728, 1, 1024, 192, 192, 192, 1024]
    - [0, 11.505]
  - - [320, 1728, 1, 1024, 320, 320, 320, 1024]
    - [0, 12.248]
  - - [448, 1728, 1, 1024, 448, 448, 448, 1024]
    - [2, 12.367]
  - - [576, 1728, 1, 1024, 576, 576, 576, 1024]
    - [2, 12.61]
  - - [704, 1728, 1, 1024, 704, 704, 704, 1024]
    - [2, 12.844]
  - - [832, 1728, 1, 1024, 832, 832, 832, 1024]
    - [2, 12.858]
  - - [960, 1728, 1, 1024, 960, 960, 960, 1024]
    - [0, 12.929]
  - - [1088, 1728, 1, 1024, 1088, 1088, 1088, 1024]
    - [2, 13.032]
  - - [1216, 1728, 1, 1024, 1216, 1216, 1216, 1024]
    - [0, 13.032]
  - - [1344, 1728, 1, 1024, 1344, 1344, 1344, 1024]
    - [2, 12.92]
  - - [1472, 1728, 1, 1024, 1472, 1472, 1472, 1024]
    - [2, 12.953]
  - - [1600, 1728, 1, 1024, 1600, 1600, 1600, 1024]
    - [2, 12.978]
  - - [1728, 1728, 1, 1024, 1728, 1728, 1728, 1024]
    - [2, 13.041]
  - - [1856, 1728, 1, 1024, 1856, 1856, 1856, 1024]
    - [2, 13.073]
  - - [1984, 1728, 1, 1024, 1984, 1984, 1984, 1024]
    - [2, 13.101]
  - - [2112, 1728, 1, 1024, 2112, 2112, 2112, 1024]
    - [2, 13.109]
  - - [2240, 1728, 1, 1024, 2240, 2240, 2240, 1024]
    - [2, 13.146]
  - - [2368, 1728, 1, 1024, 2368, 2368, 2368, 1024]
    - [2, 13.154]
  - - [2496, 1728, 1, 1024, 2496, 2496, 2496, 1024]
    - [2, 13.179]
  - - [2624, 1728, 1, 1024, 2624, 2624, 2624, 1024]
    - [2, 13.209]
  - - [2752, 1728, 1, 1024, 2752, 2752, 2752, 1024]
    - [2, 13.232]
  - - [2880, 1728, 1, 1024, 2880, 2880, 2880, 1024]
    - [2, 13.228]
  - - [3008, 1728, 1, 1024, 3008, 3008, 3008, 1024]
    - [2, 13.237]
  - - [3136, 1728, 1, 1024, 3136, 3136, 3136, 1024]
    - [2, 13.211]
  - - [3264, 1728, 1, 1024, 3264, 3264, 3264, 1024]
    - [2, 13.261]
  - - [3392, 1728, 1, 1024, 3392, 3392, 3392, 1024]
    - [2, 13.288]
  - - [3520, 1728, 1, 1024, 3520, 3520, 3520, 1024]
    - [2, 13.277]
  - - [3648, 1728, 1, 1024, 3648, 3648, 3648, 1024]
    - [2, 13.273]
  - - [3776, 1728, 1, 1024, 3776, 3776, 3776, 1024]
    - [2, 13.284]
  - - [3904, 1728, 1, 1024, 3904, 3904, 3904, 1024]
    - [2, 13.269]
  - - [4032, 1728, 1, 1024, 4032, 4032, 4032, 1024]
    - [2, 13.345]
  - - [64, 1856, 1, 1024, 64, 64, 64, 1024]
    - [0, 10.518]
  - - [192, 1856, 1, 1024, 192, 192, 192, 1024]
    - [0, 11.466]
  - - [320, 1856, 1, 1024, 320, 320, 320, 1024]
    - [2, 12.142]
  - - [448, 1856, 1, 1024, 448, 448, 448, 1024]
    - [0, 12.528]
  - - [576, 1856, 1, 1024, 576, 576, 576, 1024]
    - [0, 12.662]
  - - [704, 1856, 1, 1024, 704, 704, 704, 1024]
    - [2, 12.899]
  - - [832, 1856, 1, 1024, 832, 832, 832, 1024]
    - [2, 12.93]
  - - [960, 1856, 1, 1024, 960, 960, 960, 1024]
    - [2, 13.016]
  - - [1088, 1856, 1, 1024, 1088, 1088, 1088, 1024]
    - [2, 13.047]
  - - [1216, 1856, 1, 1024, 1216, 1216, 1216, 1024]
    - [2, 12.883]
  - - [1344, 1856, 1, 1024, 1344, 1344, 1344, 1024]
    - [2, 12.968]
  - - [1472, 1856, 1, 1024, 1472, 1472, 1472, 1024]
    - [2, 13.007]
  - - [1600, 1856, 1, 1024, 1600, 1600, 1600, 1024]
    - [2, 13.06]
  - - [1728, 1856, 1, 1024, 1728, 1728, 1728, 1024]
    - [2, 13.054]
  - - [1856, 1856, 1, 1024, 1856, 1856, 1856, 1024]
    - [2, 13.051]
  - - [1984, 1856, 1, 1024, 1984, 1984, 1984, 1024]
    - [2, 13.182]
  - - [2112, 1856, 1, 1024, 2112, 2112, 2112, 1024]
    - [2, 13.117]
  - - [2240, 1856, 1, 1024, 2240, 2240, 2240, 1024]
    - [2, 13.193]
  - - [2368, 1856, 1, 1024, 2368, 2368, 2368, 1024]
    - [2, 13.235]
  - - [2496, 1856, 1, 1024, 2496, 2496, 2496, 1024]
    - [2, 13.195]
  - - [2624, 1856, 1, 1024, 2624, 2624, 2624, 1024]
    - [2, 13.214]
  - - [2752, 1856, 1, 1024, 2752, 2752, 2752, 1024]
    - [2, 13.227]
  - - [2880, 1856, 1, 1024, 2880, 2880, 2880, 1024]
    - [2, 13.281]
  - - [3008, 1856, 1, 1024, 3008, 3008, 3008, 1024]
    - [2, 13.283]
  - - [3136, 1856, 1, 1024, 3136, 3136, 3136, 1024]
    - [2, 13.297]
  - - [3264, 1856, 1, 1024, 3264, 3264, 3264, 1024]
    - [2, 13.277]
  - - [3392, 1856, 1, 1024, 3392, 3392, 3392, 1024]
    - [2, 13.303]
  - - [3520, 1856, 1, 1024, 3520, 3520, 3520, 1024]
    - [2, 13.278]
  - - [3648, 1856, 1, 1024, 3648, 3648, 3648, 1024]
    - [2, 13.309]
  - - [3776, 1856, 1, 1024, 3776, 3776, 3776, 1024]
    - [2, 13.328]
  - - [3904, 1856, 1, 1024, 3904, 3904, 3904, 1024]
    - [2, 13.329]
  - - [4032, 1856, 1, 1024, 4032, 4032, 4032, 1024]
    - [2, 13.373]
  - - [64, 1984, 1, 1024, 64, 64, 64, 1024]
    - [0, 9.402]
  - - [192, 1984, 1, 1024, 192, 192, 192, 1024]
    - [0, 11.417]
  - - [320, 1984, 1, 1024, 320, 320, 320, 1024]
    - [0, 12.205]
  - - [448, 1984, 1, 1024, 448, 448, 448, 1024]
    - [0, 12.567]
  - - [576, 1984, 1, 1024, 576, 576, 576, 1024]
    - [2, 12.755]
  - - [704, 1984, 1, 1024, 704, 704, 704, 1024]
    - [2, 12.816]
  - - [832, 1984, 1, 1024, 832, 832, 832, 1024]
    - [2, 13.009]
  - - [960, 1984, 1, 1024, 960, 960, 960, 1024]
    - [2, 13.097]
  - - [1088, 1984, 1, 1024, 1088, 1088, 1088, 1024]
    - [2, 12.946]
  - - [1216, 1984, 1, 1024, 1216, 1216, 1216, 1024]
    - [2, 12.924]
  - - [1344, 1984, 1, 1024, 1344, 1344, 1344, 1024]
    - [2, 13.042]
  - - [1472, 1984, 1, 1024, 1472, 1472, 1472, 1024]
    - [2, 13.03]
  - - [1600, 1984, 1, 1024, 1600, 1600, 1600, 1024]
    - [2, 13.086]
  - - [1728, 1984, 1, 1024, 1728, 1728, 1728, 1024]
    - [2, 13.081]
  - - [1856, 1984, 1, 1024, 1856, 1856, 1856, 1024]
    - [2, 13.111]
  - - [1984, 1984, 1, 1024, 1984, 1984, 1984, 1024]
    - [2, 13.155]
  - - [2112, 1984, 1, 1024, 2112, 2112, 2112, 1024]
    - [2, 13.141]
  - - [2240, 1984, 1, 1024, 2240, 2240, 2240, 1024]
    - [2, 13.173]
  - - [2368, 1984, 1, 1024, 2368, 2368, 2368, 1024]
    - [2, 13.243]
  - - [2496, 1984, 1, 1024, 2496, 2496, 2496, 1024]
    - [2, 13.235]
  - - [2624, 1984, 1, 1024, 2624, 2624, 2624, 1024]
    - [2, 13.291]
  - - [2752, 1984, 1, 1024, 2752, 2752, 2752, 1024]
    - [2, 13.189]
  - - [2880, 1984, 1, 1024, 2880, 2880, 2880, 1024]
    - [2, 13.233]
  - - [3008, 1984, 1, 1024, 3008, 3008, 3008, 1024]
    - [2, 13.263]
  - - [3136, 1984, 1, 1024, 3136, 3136, 3136, 1024]
    - [2, 13.307]
  - - [3264, 1984, 1, 1024, 3264, 3264, 3264, 1024]
    - [2, 13.24]
  - - [3392, 1984, 1, 1024, 3392, 3392, 3392, 1024]
    - [2, 13.291]
  - - [3520, 1984, 1, 1024, 3520, 3520, 3520, 1024]
    - [2, 13.304]
  - - [3648, 1984, 1, 1024, 3648, 3648, 3648, 1024]
    - [2, 13.317]
  - - [3776, 1984, 1, 1024, 3776, 3776, 3776, 1024]
    - [2, 13.35]
  - - [3904, 1984, 1, 1024, 3904, 3904, 3904, 1024]
    - [2, 13.349]
  - - [4032, 1984, 1, 1024, 4032, 4032, 4032, 1024]
    - [2, 13.352]
  - - [64, 2112, 1, 1024, 64, 64, 64, 1024]
    - [0, 9.924]
  - - [192, 2112, 1, 1024, 192, 192, 192, 1024]
    - [2, 11.551]
  - - [320, 2112, 1, 1024, 320, 320, 320, 1024]
    - [0, 12.425]
  - - [448, 2112, 1, 1024, 448, 448, 448, 1024]
    - [2, 12.665]
  - - [576, 2112, 1, 1024, 576, 576, 576, 1024]
    - [2, 12.789]
  - - [704, 2112, 1, 1024, 704, 704, 704, 1024]
    - [2, 12.862]
  - - [832, 2112, 1, 1024, 832, 832, 832, 1024]
    - [2, 13.036]
  - - [960, 2112, 1, 1024, 960, 960, 960, 1024]
    - [2, 13.023]
  - - [1088, 2112, 1, 1024, 1088, 1088, 1088, 1024]
    - [2, 12.909]
  - - [1216, 2112, 1, 1024, 1216, 1216, 1216, 1024]
    - [2, 12.944]
  - - [1344, 2112, 1, 1024, 1344, 1344, 1344, 1024]
    - [2, 13.082]
  - - [1472, 2112, 1, 1024, 1472, 1472, 1472, 1024]
    - [2, 13.079]
  - - [1600, 2112, 1, 1024, 1600, 1600, 1600, 1024]
    - [2, 13.132]
  - - [1728, 2112, 1, 1024, 1728, 1728, 1728, 1024]
    - [2, 13.164]
  - - [1856, 2112, 1, 1024, 1856, 1856, 1856, 1024]
    - [2, 13.164]
  - - [1984, 2112, 1, 1024, 1984, 1984, 1984, 1024]
    - [2, 13.202]
  - - [2112, 2112, 1, 1024, 2112, 2112, 2112, 1024]
    - [2, 13.113]
  - - [2240, 2112, 1, 1024, 2240, 2240, 2240, 1024]
    - [2, 13.178]
  - - [2368, 2112, 1, 1024, 2368, 2368, 2368, 1024]
    - [2, 13.226]
  - - [2496, 2112, 1, 1024, 2496, 2496, 2496, 1024]
    - [2, 13.239]
  - - [2624, 2112, 1, 1024, 2624, 2624, 2624, 1024]
    - [2, 13.262]
  - - [2752, 2112, 1, 1024, 2752, 2752, 2752, 1024]
    - [2, 13.239]
  - - [2880, 2112, 1, 1024, 2880, 2880, 2880, 1024]
    - [2, 13.278]
  - - [3008, 2112, 1, 1024, 3008, 3008, 3008, 1024]
    - [2, 13.247]
  - - [3136, 2112, 1, 1024, 3136, 3136, 3136, 1024]
    - [2, 13.299]
  - - [3264, 2112, 1, 1024, 3264, 3264, 3264, 1024]
    - [2, 13.284]
  - - [3392, 2112, 1, 1024, 3392, 3392, 3392, 1024]
    - [2, 13.268]
  - - [3520, 2112, 1, 1024, 3520, 3520, 3520, 1024]
    - [2, 13.316]
  - - [3648, 2112, 1, 1024, 3648, 3648, 3648, 1024]
    - [2, 13.338]
  - - [3776, 2112, 1, 1024, 3776, 3776, 3776, 1024]
    - [2, 13.285]
  - - [3904, 2112, 1, 1024, 3904, 3904, 3904, 1024]
    - [2, 13.369]
  - - [4032, 2112, 1, 1024, 4032, 4032, 4032, 1024]
    - [2, 13.364]
  - - [64, 2240, 1, 1024, 64, 64, 64, 1024]
    - [2, 10.399]
  - - [192, 2240, 1, 1024, 192, 192, 192, 1024]
    - [0, 12.004]
  - - [320, 2240, 1, 1024, 320, 320, 320, 1024]
    - [2, 12.25]
  - - [448, 2240, 1, 1024, 448, 448, 448, 1024]
    - [2, 12.691]
  - - [576, 2240, 1, 1024, 576, 576, 576, 1024]
    - [2, 12.779]
  - - [704, 2240, 1, 1024, 704, 704, 704, 1024]
    - [2, 12.9]
  - - [832, 2240, 1, 1024, 832, 832, 832, 1024]
    - [2, 12.992]
  - - [960, 2240, 1, 1024, 960, 960, 960, 1024]
    - [2, 12.938]
  - - [1088, 2240, 1, 1024, 1088, 1088, 1088, 1024]
    - [2, 12.937]
  - - [1216, 2240, 1, 1024, 1216, 1216, 1216, 1024]
    - [2, 13.035]
  - - [1344, 2240, 1, 1024, 1344, 1344, 1344, 1024]
    - [2, 13.057]
  - - [1472, 2240, 1, 1024, 1472, 1472, 1472, 1024]
    - [2, 13.081]
  - - [1600, 2240, 1, 1024, 1600, 1600, 1600, 1024]
    - [2, 13.083]
  - - [1728, 2240, 1, 1024, 1728, 1728, 1728, 1024]
    - [2, 13.157]
  - - [1856, 2240, 1, 1024, 1856, 1856, 1856, 1024]
    - [2, 13.169]
  - - [1984, 2240, 1, 1024, 1984, 1984, 1984, 1024]
    - [2, 13.165]
  - - [2112, 2240, 1, 1024, 2112, 2112, 2112, 1024]
    - [2, 13.218]
  - - [2240, 2240, 1, 1024, 2240, 2240, 2240, 1024]
    - [2, 13.253]
  - - [2368, 2240, 1, 1024, 2368, 2368, 2368, 1024]
    - [2, 13.238]
  - - [2496, 2240, 1, 1024, 2496, 2496, 2496, 1024]
    - [2, 13.295]
  - - [2624, 2240, 1, 1024, 2624, 2624, 2624, 1024]
    - [2, 13.282]
  - - [2752, 2240, 1, 1024, 2752, 2752, 2752, 1024]
    - [2, 13.296]
  - - [2880, 2240, 1, 1024, 2880, 2880, 2880, 1024]
    - [2, 13.297]
  - - [3008, 2240, 1, 1024, 3008, 3008, 3008, 1024]
    - [2, 13.318]
  - - [3136, 2240, 1, 1024, 3136, 3136, 3136, 1024]
    - [2, 13.315]
  - - [3264, 2240, 1, 1024, 3264, 3264, 3264, 1024]
    - [2, 13.332]
  - - [3392, 2240, 1, 1024, 3392, 3392, 3392, 1024]
    - [2, 13.317]
  - - [3520, 2240, 1, 1024, 3520, 3520, 3520, 1024]
    - [2, 13.338]
  - - [3648, 2240, 1, 1024, 3648, 3648, 3648, 1024]
    - [2, 13.318]
  - - [3776, 2240, 1, 1024, 3776, 3776, 3776, 1024]
    - [2, 13.357]
  - - [3904, 2240, 1, 1024, 3904, 3904, 3904, 1024]
    - [2, 13.346]
  - - [4032, 2240, 1, 1024, 4032, 4032, 4032, 1024]
    - [2, 13.324]
  - - [64, 2368, 1, 1024, 64, 64, 64, 1024]
    - [2, 10.162]
  - - [192, 2368, 1, 1024, 192, 192, 192, 1024]
    - [0, 11.931]
  - - [320, 2368, 1, 1024, 320, 320, 320, 1024]
    - [2, 12.403]
  - - [448, 2368, 1, 1024, 448, 448, 448, 1024]
    - [2, 12.663]
  - - [576, 2368, 1, 1024, 576, 576, 576, 1024]
    - [2, 12.808]
  - - [704, 2368, 1, 1024, 704, 704, 704, 1024]
    - [2, 12.992]
  - - [832, 2368, 1, 1024, 832, 832, 832, 1024]
    - [2, 13.047]
  - - [960, 2368, 1, 1024, 960, 960, 960, 1024]
    - [2, 12.92]
  - - [1088, 2368, 1, 1024, 1088, 1088, 1088, 1024]
    - [2, 12.945]
  - - [1216, 2368, 1, 1024, 1216, 1216, 1216, 1024]
    - [2, 12.994]
  - - [1344, 2368, 1, 1024, 1344, 1344, 1344, 1024]
    - [2, 13.044]
  - - [1472, 2368, 1, 1024, 1472, 1472, 1472, 1024]
    - [2, 13.111]
  - - [1600, 2368, 1, 1024, 1600, 1600, 1600, 1024]
    - [2, 13.129]
  - - [1728, 2368, 1, 1024, 1728, 1728, 1728, 1024]
    - [2, 13.187]
  - - [1856, 2368, 1, 1024, 1856, 1856, 1856, 1024]
    - [2, 13.173]
  - - [1984, 2368, 1, 1024, 1984, 1984, 1984, 1024]
    - [2, 13.211]
  - - [2112, 2368, 1, 1024, 2112, 2112, 2112, 1024]
    - [2, 13.205]
  - - [2240, 2368, 1, 1024, 2240, 2240, 2240, 1024]
    - [2, 13.298]
  - - [2368, 2368, 1, 1024, 2368, 2368, 2368, 1024]
    - [2, 13.243]
  - - [2496, 2368, 1, 1024, 2496, 2496, 2496, 1024]
    - [2, 13.253]
  - - [2624, 2368, 1, 1024, 2624, 2624, 2624, 1024]
    - [2, 13.279]
  - - [2752, 2368, 1, 1024, 2752, 2752, 2752, 1024]
    - [2, 13.31]
  - - [2880, 2368, 1, 1024, 2880, 2880, 2880, 1024]
    - [2, 13.273]
  - - [3008, 2368, 1, 1024, 3008, 3008, 3008, 1024]
    - [2, 13.294]
  - - [3136, 2368, 1, 1024, 3136, 3136, 3136, 1024]
    - [2, 13.314]
  - - [3264, 2368, 1, 1024, 3264, 3264, 3264, 1024]
    - [2, 13.342]
  - - [3392, 2368, 1, 1024, 3392, 3392, 3392, 1024]
    - [2, 13.333]
  - - [3520, 2368, 1, 1024, 3520, 3520, 3520, 1024]
    - [2, 13.365]
  - - [3648, 2368, 1, 1024, 3648, 3648, 3648, 1024]
    - [2, 13.369]
  - - [3776, 2368, 1, 1024, 3776, 3776, 3776, 1024]
    - [2, 13.327]
  - - [3904, 2368, 1, 1024, 3904, 3904, 3904, 1024]
    - [2, 13.372]
  - - [4032, 2368, 1, 1024, 4032, 4032, 4032, 1024]
    - [2, 13.353]
  - - [64, 2496, 1, 1024, 64, 64, 64, 1024]
    - [2, 10.312]
  - - [192, 2496, 1, 1024, 192, 192, 192, 1024]
    - [0, 11.865]
  - - [320, 2496, 1, 1024, 320, 320, 320, 1024]
    - [0, 12.53]
  - - [448, 2496, 1, 1024, 448, 448, 448, 1024]
    - [2, 12.914]
  - - [576, 2496, 1, 1024, 576, 576, 576, 1024]
    - [2, 12.892]
  - - [704, 2496, 1, 1024, 704, 704, 704, 1024]
    - [2, 12.954]
  - - [832, 2496, 1, 1024, 832, 832, 832, 1024]
    - [2, 13.044]
  - - [960, 2496, 1, 1024, 960, 960, 960, 1024]
    - [2, 12.919]
  - - [1088, 2496, 1, 1024, 1088, 1088, 1088, 1024]
    - [2, 13.048]
  - - [1216, 2496, 1, 1024, 1216, 1216, 1216, 1024]
    - [2, 13.045]
  - - [1344, 2496, 1, 1024, 1344, 1344, 1344, 1024]
    - [2, 13.104]
  - - [1472, 2496, 1, 1024, 1472, 1472, 1472, 1024]
    - [2, 13.103]
  - - [1600, 2496, 1, 1024, 1600, 1600, 1600, 1024]
    - [2, 13.175]
  - - [1728, 2496, 1, 1024, 1728, 1728, 1728, 1024]
    - [2, 13.163]
  - - [1856, 2496, 1, 1024, 1856, 1856, 1856, 1024]
    - [2, 13.174]
  - - [1984, 2496, 1, 1024, 1984, 1984, 1984, 1024]
    - [2, 13.245]
  - - [2112, 2496, 1, 1024, 2112, 2112, 2112, 1024]
    - [2, 13.225]
  - - [2240, 2496, 1, 1024, 2240, 2240, 2240, 1024]
    - [2, 13.245]
  - - [2368, 2496, 1, 1024, 2368, 2368, 2368, 1024]
    - [2, 13.244]
  - - [2496, 2496, 1, 1024, 2496, 2496, 2496, 1024]
    - [2, 13.288]
  - - [2624, 2496, 1, 1024, 2624, 2624, 2624, 1024]
    - [2, 13.31]
  - - [2752, 2496, 1, 1024, 2752, 2752, 2752, 1024]
    - [2, 13.278]
  - - [2880, 2496, 1, 1024, 2880, 2880, 2880, 1024]
    - [2, 13.324]
  - - [3008, 2496, 1, 1024, 3008, 3008, 3008, 1024]
    - [2, 13.337]
  - - [3136, 2496, 1, 1024, 3136, 3136, 3136, 1024]
    - [2, 13.335]
  - - [3264, 2496, 1, 1024, 3264, 3264, 3264, 1024]
    - [2, 13.319]
  - - [3392, 2496, 1, 1024, 3392, 3392, 3392, 1024]
    - [2, 13.378]
  - - [3520, 2496, 1, 1024, 3520, 3520, 3520, 1024]
    - [2, 13.346]
  - - [3648, 2496, 1, 1024, 3648, 3648, 3648, 1024]
    - [2, 13.358]
  - - [3776, 2496, 1, 1024, 3776, 3776, 3776, 1024]
    - [2, 13.331]
  - - [3904, 2496, 1, 1024, 3904, 3904, 3904, 1024]
    - [2, 13.339]
  - - [4032, 2496, 1, 1024, 4032, 4032, 4032, 1024]
    - [2, 13.365]
  - - [64, 2624, 1, 1024, 64, 64, 64, 1024]
    - [2, 10.621]
  - - [192, 2624, 1, 1024, 192, 192, 192, 1024]
    - [2, 12.025]
  - - [320, 2624, 1, 1024, 320, 320, 320, 1024]
    - [2, 12.493]
  - - [448, 2624, 1, 1024, 448, 448, 448, 1024]
    - [2, 12.808]
  - - [576, 2624, 1, 1024, 576, 576, 576, 1024]
    - [2, 12.844]
  - - [704, 2624, 1, 1024, 704, 704, 704, 1024]
    - [2, 13.012]
  - - [832, 2624, 1, 1024, 832, 832, 832, 1024]
    - [2, 12.923]
  - - [960, 2624, 1, 1024, 960, 960, 960, 1024]
    - [2, 13.018]
  - - [1088, 2624, 1, 1024, 1088, 1088, 1088, 1024]
    - [2, 13.051]
  - - [1216, 2624, 1, 1024, 1216, 1216, 1216, 1024]
    - [2, 13.032]
  - - [1344, 2624, 1, 1024, 1344, 1344, 1344, 1024]
    - [2, 13.119]
  - - [1472, 2624, 1, 1024, 1472, 1472, 1472, 1024]
    - [2, 13.188]
  - - [1600, 2624, 1, 1024, 1600, 1600, 1600, 1024]
    - [2, 13.175]
  - - [1728, 2624, 1, 1024, 1728, 1728, 1728, 1024]
    - [2, 13.183]
  - - [1856, 2624, 1, 1024, 1856, 1856, 1856, 1024]
    - [2, 13.207]
  - - [1984, 2624, 1, 1024, 1984, 1984, 1984, 1024]
    - [2, 13.247]
  - - [2112, 2624, 1, 1024, 2112, 2112, 2112, 1024]
    - [2, 13.26]
  - - [2240, 2624, 1, 1024, 2240, 2240, 2240, 1024]
    - [2, 13.282]
  - - [2368, 2624, 1, 1024, 2368, 2368, 2368, 1024]
    - [2, 13.253]
  - - [2496, 2624, 1, 1024, 2496, 2496, 2496, 1024]
    - [2, 13.312]
  - - [2624, 2624, 1, 1024, 2624, 2624, 2624, 1024]
    - [2, 13.304]
  - - [2752, 2624, 1, 1024, 2752, 2752, 2752, 1024]
    - [2, 13.314]
  - - [2880, 2624, 1, 1024, 2880, 2880, 2880, 1024]
    - [2, 13.339]
  - - [3008, 2624, 1, 1024, 3008, 3008, 3008, 1024]
    - [2, 13.319]
  - - [3136, 2624, 1, 1024, 3136, 3136, 3136, 1024]
    - [2, 13.328]
  - - [3264, 2624, 1, 1024, 3264, 3264, 3264, 1024]
    - [2, 13.332]
  - - [3392, 2624, 1, 1024, 3392, 3392, 3392, 1024]
    - [2, 13.383]
  - - [3520, 2624, 1, 1024, 3520, 3520, 3520, 1024]
    - [2, 13.361]
  - - [3648, 2624, 1, 1024, 3648, 3648, 3648, 1024]
    - [2, 13.338]
  - - [3776, 2624, 1, 1024, 3776, 3776, 3776, 1024]
    - [2, 13.369]
  - - [3904, 2624, 1, 1024, 3904, 3904, 3904, 1024]
    - [2, 13.393]
  - - [4032, 2624, 1, 1024, 4032, 4032, 4032, 1024]
    - [2, 13.349]
  - - [64, 2752, 1, 1024, 64, 64, 64, 1024]
    - [2, 11.229]
  - - [192, 2752, 1, 1024, 192, 192, 192, 1024]
    - [2, 11.931]
  - - [320, 2752, 1, 1024, 320, 320, 320, 1024]
    - [2, 12.476]
  - - [448, 2752, 1, 1024, 448, 448, 448, 1024]
    - [2, 12.819]
  - - [576, 2752, 1, 1024, 576, 576, 576, 1024]
    - [2, 12.879]
  - - [704, 2752, 1, 1024, 704, 704, 704, 1024]
    - [2, 13.058]
  - - [832, 2752, 1, 1024, 832, 832, 832, 1024]
    - [2, 12.867]
  - - [960, 2752, 1, 1024, 960, 960, 960, 1024]
    - [2, 12.962]
  - - [1088, 2752, 1, 1024, 1088, 1088, 1088, 1024]
    - [2, 13.018]
  - - [1216, 2752, 1, 1024, 1216, 1216, 1216, 1024]
    - [2, 13.095]
  - - [1344, 2752, 1, 1024, 1344, 1344, 1344, 1024]
    - [2, 13.126]
  - - [1472, 2752, 1, 1024, 1472, 1472, 1472, 1024]
    - [2, 13.173]
  - - [1600, 2752, 1, 1024, 1600, 1600, 1600, 1024]
    - [2, 13.168]
  - - [1728, 2752, 1, 1024, 1728, 1728, 1728, 1024]
    - [2, 13.212]
  - - [1856, 2752, 1, 1024, 1856, 1856, 1856, 1024]
    - [2, 13.244]
  - - [1984, 2752, 1, 1024, 1984, 1984, 1984, 1024]
    - [2, 13.226]
  - - [2112, 2752, 1, 1024, 2112, 2112, 2112, 1024]
    - [2, 13.281]
  - - [2240, 2752, 1, 1024, 2240, 2240, 2240, 1024]
    - [2, 13.284]
  - - [2368, 2752, 1, 1024, 2368, 2368, 2368, 1024]
    - [2, 13.3]
  - - [2496, 2752, 1, 1024, 2496, 2496, 2496, 1024]
    - [2, 13.302]
  - - [2624, 2752, 1, 1024, 2624, 2624, 2624, 1024]
    - [2, 13.315]
  - - [2752, 2752, 1, 1024, 2752, 2752, 2752, 1024]
    - [2, 13.337]
  - - [2880, 2752, 1, 1024, 2880, 2880, 2880, 1024]
    - [2, 13.344]
  - - [3008, 2752, 1, 1024, 3008, 3008, 3008, 1024]
    - [2, 13.335]
  - - [3136, 2752, 1, 1024, 3136, 3136, 3136, 1024]
    - [2, 13.363]
  - - [3264, 2752, 1, 1024, 3264, 3264, 3264, 1024]
    - [2, 13.32]
  - - [3392, 2752, 1, 1024, 3392, 3392, 3392, 1024]
    - [2, 13.357]
  - - [3520, 2752, 1, 1024, 3520, 3520, 3520, 1024]
    - [2, 13.386]
  - - [3648, 2752, 1, 1024, 3648, 3648, 3648, 1024]
    - [2, 13.372]
  - - [3776, 2752, 1, 1024, 3776, 3776, 3776, 1024]
    - [2, 13.371]
  - - [3904, 2752, 1, 1024, 3904, 3904, 3904, 1024]
    - [2, 13.377]
  - - [4032, 2752, 1, 1024, 4032, 4032, 4032, 1024]
    - [2, 13.376]
  - - [64, 2880, 1, 1024, 64, 64, 64, 1024]
    - [2, 10.863]
  - - [192, 2880, 1, 1024, 192, 192, 192, 1024]
    - [0, 12.249]
  - - [320, 2880, 1, 1024, 320, 320, 320, 1024]
    - [0, 12.604]
  - - [448, 2880, 1, 1024, 448, 448, 448, 1024]
    - [0, 12.776]
  - - [576, 2880, 1, 1024, 576, 576, 576, 1024]
    - [2, 12.939]
  - - [704, 2880, 1, 1024, 704, 704, 704, 1024]
    - [2, 13.027]
  - - [832, 2880, 1, 1024, 832, 832, 832, 1024]
    - [2, 12.969]
  - - [960, 2880, 1, 1024, 960, 960, 960, 1024]
    - [2, 13.029]
  - - [1088, 2880, 1, 1024, 1088, 1088, 1088, 1024]
    - [2, 13.041]
  - - [1216, 2880, 1, 1024, 1216, 1216, 1216, 1024]
    - [2, 13.12]
  - - [1344, 2880, 1, 1024, 1344, 1344, 1344, 1024]
    - [2, 13.16]
  - - [1472, 2880, 1, 1024, 1472, 1472, 1472, 1024]
    - [2, 13.228]
  - - [1600, 2880, 1, 1024, 1600, 1600, 1600, 1024]
    - [2, 13.19]
  - - [1728, 2880, 1, 1024, 1728, 1728, 1728, 1024]
    - [2, 13.225]
  - - [1856, 2880, 1, 1024, 1856, 1856, 1856, 1024]
    - [2, 13.226]
  - - [1984, 2880, 1, 1024, 1984, 1984, 1984, 1024]
    - [2, 13.295]
  - - [2112, 2880, 1, 1024, 2112, 2112, 2112, 1024]
    - [2, 13.216]
  - - [2240, 2880, 1, 1024, 2240, 2240, 2240, 1024]
    - [2, 13.286]
  - - [2368, 2880, 1, 1024, 2368, 2368, 2368, 1024]
    - [2, 13.275]
  - - [2496, 2880, 1, 1024, 2496, 2496, 2496, 1024]
    - [2, 13.299]
  - - [2624, 2880, 1, 1024, 2624, 2624, 2624, 1024]
    - [2, 13.302]
  - - [2752, 2880, 1, 1024, 2752, 2752, 2752, 1024]
    - [2, 13.37]
  - - [2880, 2880, 1, 1024, 2880, 2880, 2880, 1024]
    - [2, 13.348]
  - - [3008, 2880, 1, 1024, 3008, 3008, 3008, 1024]
    - [2, 13.363]
  - - [3136, 2880, 1, 1024, 3136, 3136, 3136, 1024]
    - [2, 13.347]
  - - [3264, 2880, 1, 1024, 3264, 3264, 3264, 1024]
    - [2, 13.369]
  - - [3392, 2880, 1, 1024, 3392, 3392, 3392, 1024]
    - [2, 13.371]
  - - [3520, 2880, 1, 1024, 3520, 3520, 3520, 1024]
    - [2, 13.372]
  - - [3648, 2880, 1, 1024, 3648, 3648, 3648, 1024]
    - [2, 13.412]
  - - [3776, 2880, 1, 1024, 3776, 3776, 3776, 1024]
    - [2, 13.359]
  - - [3904, 2880, 1, 1024, 3904, 3904, 3904, 1024]
    - [2, 13.387]
  - - [4032, 2880, 1, 1024, 4032, 4032, 4032, 1024]
    - [2, 13.41]
  - - [64, 3008, 1, 1024, 64, 64, 64, 1024]
    - [2, 10.724]
  - - [192, 3008, 1, 1024, 192, 192, 192, 1024]
    - [0, 12.189]
  - - [320, 3008, 1, 1024, 320, 320, 320, 1024]
    - [2, 12.563]
  - - [448, 3008, 1, 1024, 448, 448, 448, 1024]
    - [2, 12.843]
  - - [576, 3008, 1, 1024, 576, 576, 576, 1024]
    - [2, 13.021]
  - - [704, 3008, 1, 1024, 704, 704, 704, 1024]
    - [2, 13.098]
  - - [832, 3008, 1, 1024, 832, 832, 832, 1024]
    - [2, 12.963]
  - - [960, 3008, 1, 1024, 960, 960, 960, 1024]
    - [2, 12.997]
  - - [1088, 3008, 1, 1024, 1088, 1088, 1088, 1024]
    - [2, 13.094]
  - - [1216, 3008, 1, 1024, 1216, 1216, 1216, 1024]
    - [2, 13.093]
  - - [1344, 3008, 1, 1024, 1344, 1344, 1344, 1024]
    - [2, 13.167]
  - - [1472, 3008, 1, 1024, 1472, 1472, 1472, 1024]
    - [2, 13.212]
  - - [1600, 3008, 1, 1024, 1600, 1600, 1600, 1024]
    - [2, 13.252]
  - - [1728, 3008, 1, 1024, 1728, 1728, 1728, 1024]
    - [2, 13.237]
  - - [1856, 3008, 1, 1024, 1856, 1856, 1856, 1024]
    - [2, 13.225]
  - - [1984, 3008, 1, 1024, 1984, 1984, 1984, 1024]
    - [2, 13.299]
  - - [2112, 3008, 1, 1024, 2112, 2112, 2112, 1024]
    - [2, 13.244]
  - - [2240, 3008, 1, 1024, 2240, 2240, 2240, 1024]
    - [2, 13.288]
  - - [2368, 3008, 1, 1024, 2368, 2368, 2368, 1024]
    - [2, 13.318]
  - - [2496, 3008, 1, 1024, 2496, 2496, 2496, 1024]
    - [2, 13.329]
  - - [2624, 3008, 1, 1024, 2624, 2624, 2624, 1024]
    - [2, 13.356]
  - - [2752, 3008, 1, 1024, 2752, 2752, 2752, 1024]
    - [2, 13.324]
  - - [2880, 3008, 1, 1024, 2880, 2880, 2880, 1024]
    - [2, 13.364]
  - - [3008, 3008, 1, 1024, 3008, 3008, 3008, 1024]
    - [2, 13.334]
  - - [3136, 3008, 1, 1024, 3136, 3136, 3136, 1024]
    - [2, 13.37]
  - - [3264, 3008, 1, 1024, 3264, 3264, 3264, 1024]
    - [2, 13.331]
  - - [3392, 3008, 1, 1024, 3392, 3392, 3392, 1024]
    - [2, 13.34]
  - - [3520, 3008, 1, 1024, 3520, 3520, 3520, 1024]
    - [2, 13.373]
  - - [3648, 3008, 1, 1024, 3648, 3648, 3648, 1024]
    - [2, 13.394]
  - - [3776, 3008, 1, 1024, 3776, 3776, 3776, 1024]
    - [2, 13.37]
  - - [3904, 3008, 1, 1024, 3904, 3904, 3904, 1024]
    - [2, 13.379]
  - - [4032, 3008, 1, 1024, 4032, 4032, 4032, 1024]
    - [2, 13.4]
  - - [64, 3136, 1, 1024, 64, 64, 64, 1024]
    - [2, 11.124]
  - - [192, 3136, 1, 1024, 192, 192, 192, 1024]
    - [2, 12.14]
  - - [320, 3136, 1, 1024, 320, 320, 320, 1024]
    - [2, 12.623]
  - - [448, 3136, 1, 1024, 448, 448, 448, 1024]
    - [2, 12.902]
  - - [576, 3136, 1, 1024, 576, 576, 576, 1024]
    - [2, 13.038]
  - - [704, 3136, 1, 1024, 704, 704, 704, 1024]
    - [2, 12.907]
  - - [832, 3136, 1, 1024, 832, 832, 832, 1024]
    - [2, 12.987]
  - - [960, 3136, 1, 1024, 960, 960, 960, 1024]
    - [2, 13.049]
  - - [1088, 3136, 1, 1024, 1088, 1088, 1088, 1024]
    - [2, 13.107]
  - - [1216, 3136, 1, 1024, 1216, 1216, 1216, 1024]
    - [2, 13.105]
  - - [1344, 3136, 1, 1024, 1344, 1344, 1344, 1024]
    - [2, 13.219]
  - - [1472, 3136, 1, 1024, 1472, 1472, 1472, 1024]
    - [2, 13.163]
  - - [1600, 3136, 1, 1024, 1600, 1600, 1600, 1024]
    - [2, 13.198]
  - - [1728, 3136, 1, 1024, 1728, 1728, 1728, 1024]
    - [2, 13.257]
  - - [1856, 3136, 1, 1024, 1856, 1856, 1856, 1024]
    - [2, 13.249]
  - - [1984, 3136, 1, 1024, 1984, 1984, 1984, 1024]
    - [2, 13.268]
  - - [2112, 3136, 1, 1024, 2112, 2112, 2112, 1024]
    - [2, 13.276]
  - - [2240, 3136, 1, 1024, 2240, 2240, 2240, 1024]
    - [2, 13.31]
  - - [2368, 3136, 1, 1024, 2368, 2368, 2368, 1024]
    - [2, 13.316]
