library/src/amd_detail/rocblaslt/src/Tensile/Logic/asm_full/navi32/GridBased/navi32_Cijk_Alik_Bljk_HSS_BH_Bias_HAH.yaml
- {MinimumRequiredVersion: 4.33.0}
- navi32
- gfx1101
- [Device 73f0]
    SolutionIndex: 0
    SolutionNameMin: Cijk_Alik_Bljk_HSS_BH_Bias_HAH_MT32x32x64_MI16x16x16x1_SN_MIWT1_1_WG32_4_1
    SolutionIndex: 1
    SolutionNameMin: Cijk_Alik_Bljk_HSS_BH_Bias_HAH_MT16x16x64_MI16x16x16x1_SN_MIWT1_1_WG16_2_1
    SolutionIndex: 2
    SolutionNameMin: Cijk_Alik_Bljk_HSS_BH_Bias_HAH_MT32x16x64_MI16x16x16x1_SN_MIWT1_1_WG32_2_1
    SolutionIndex: 3
    SolutionNameMin: Cijk_Alik_Bljk_HSS_BH_Bias_HAH_MT16x32x64_MI16x16x16x1_SN_MIWT1_1_WG16_4_1
- - - [64, 64, 1, 64, 64, 64, 64, 64]
    - [1, 0.155]
  - - [192, 64, 1, 64, 192, 192, 64, 64]
    - [2, 0.448]
  - - [320, 64, 1, 64, 320, 320, 64, 64]
    - [0, 0.705]
  - - [448, 64, 1, 64, 448, 448, 64, 64]
    - [0, 1.005]
  - - [576, 64, 1, 64, 576, 576, 64, 64]
    - [0, 1.144]
  - - [704, 64, 1, 64, 704, 704, 64, 64]
    - [0, 1.396]
  - - [832, 64, 1, 64, 832, 832, 64, 64]
    - [0, 1.644]
  - - [960, 64, 1, 64, 960, 960, 64, 64]
    - [0, 1.897]
  - - [1088, 64, 1, 64, 1088, 1088, 64, 64]
    - [0, 1.929]
  - - [1216, 64, 1, 64, 1216, 1216, 64, 64]
    - [0, 2.157]
  - - [1344, 64, 1, 64, 1344, 1344, 64, 64]
    - [0, 2.374]
  - - [1472, 64, 1, 64, 1472, 1472, 64, 64]
    - [0, 2.386]
  - - [1600, 64, 1, 64, 1600, 1600, 64, 64]
    - [0, 2.582]
  - - [1728, 64, 1, 64, 1728, 1728, 64, 64]
    - [0, 2.778]
  - - [1856, 64, 1, 64, 1856, 1856, 64, 64]
    - [0, 2.978]
  - - [1984, 64, 1, 64, 1984, 1984, 64, 64]
    - [0, 2.948]
  - - [2112, 64, 1, 64, 2112, 2112, 64, 64]
    - [0, 3.121]
  - - [2240, 64, 1, 64, 2240, 2240, 64, 64]
    - [0, 3.319]
  - - [2368, 64, 1, 64, 2368, 2368, 64, 64]
    - [0, 3.512]
  - - [2496, 64, 1, 64, 2496, 2496, 64, 64]
    - [0, 3.468]
  - - [2624, 64, 1, 64, 2624, 2624, 64, 64]
    - [0, 3.604]
  - - [2752, 64, 1, 64, 2752, 2752, 64, 64]
    - [0, 3.785]
  - - [2880, 64, 1, 64, 2880, 2880, 64, 64]
    - [0, 3.948]
  - - [3008, 64, 1, 64, 3008, 3008, 64, 64]
    - [0, 3.878]
  - - [3136, 64, 1, 64, 3136, 3136, 64, 64]
    - [0, 4.066]
  - - [3264, 64, 1, 64, 3264, 3264, 64, 64]
    - [0, 4.215]
  - - [3392, 64, 1, 64, 3392, 3392, 64, 64]
    - [0, 4.148]
  - - [3520, 64, 1, 64, 3520, 3520, 64, 64]
    - [0, 4.203]
  - - [3648, 64, 1, 64, 3648, 3648, 64, 64]
    - [0, 4.432]
  - - [3776, 64, 1, 64, 3776, 3776, 64, 64]
    - [0, 4.518]
  - - [3904, 64, 1, 64, 3904, 3904, 64, 64]
    - [0, 4.453]
  - - [4032, 64, 1, 64, 4032, 4032, 64, 64]
    - [0, 4.38]
  - - [64, 192, 1, 64, 64, 64, 64, 64]
    - [3, 0.453]
  - - [192, 192, 1, 64, 192, 192, 64, 64]
    - [0, 1.15]
  - - [320, 192, 1, 64, 320, 320, 64, 64]
    - [0, 1.904]
  - - [448, 192, 1, 64, 448, 448, 64, 64]
    - [0, 2.385]
  - - [576, 192, 1, 64, 576, 576, 64, 64]
    - [0, 2.802]
  - - [704, 192, 1, 64, 704, 704, 64, 64]
    - [0, 3.156]
  - - [832, 192, 1, 64, 832, 832, 64, 64]
    - [0, 3.458]
  - - [960, 192, 1, 64, 960, 960, 64, 64]
    - [0, 3.934]
  - - [1088, 192, 1, 64, 1088, 1088, 64, 64]
    - [0, 4.193]
  - - [1216, 192, 1, 64, 1216, 1216, 64, 64]
    - [0, 4.382]
  - - [1344, 192, 1, 64, 1344, 1344, 64, 64]
    - [0, 4.371]
  - - [1472, 192, 1, 64, 1472, 1472, 64, 64]
    - [0, 4.662]
  - - [1600, 192, 1, 64, 1600, 1600, 64, 64]
    - [0, 4.843]
  - - [1728, 192, 1, 64, 1728, 1728, 64, 64]
    - [0, 4.961]
  - - [1856, 192, 1, 64, 1856, 1856, 64, 64]
    - [0, 5.257]
  - - [1984, 192, 1, 64, 1984, 1984, 64, 64]
    - [0, 5.34]
  - - [2112, 192, 1, 64, 2112, 2112, 64, 64]
    - [0, 5.475]
  - - [2240, 192, 1, 64, 2240, 2240, 64, 64]
    - [0, 5.593]
  - - [2368, 192, 1, 64, 2368, 2368, 64, 64]
    - [0, 5.631]
  - - [2496, 192, 1, 64, 2496, 2496, 64, 64]
    - [0, 5.826]
  - - [2624, 192, 1, 64, 2624, 2624, 64, 64]
    - [0, 5.832]
  - - [2752, 192, 1, 64, 2752, 2752, 64, 64]
    - [0, 5.97]
  - - [2880, 192, 1, 64, 2880, 2880, 64, 64]
    - [0, 6.055]
  - - [3008, 192, 1, 64, 3008, 3008, 64, 64]
    - [0, 6.108]
  - - [3136, 192, 1, 64, 3136, 3136, 64, 64]
    - [0, 6.292]
  - - [3264, 192, 1, 64, 3264, 3264, 64, 64]
    - [0, 6.338]
  - - [3392, 192, 1, 64, 3392, 3392, 64, 64]
    - [0, 6.374]
  - - [3520, 192, 1, 64, 3520, 3520, 64, 64]
    - [0, 6.434]
  - - [3648, 192, 1, 64, 3648, 3648, 64, 64]
    - [0, 6.458]
  - - [3776, 192, 1, 64, 3776, 3776, 64, 64]
    - [0, 6.636]
  - - [3904, 192, 1, 64, 3904, 3904, 64, 64]
    - [0, 6.652]
  - - [4032, 192, 1, 64, 4032, 4032, 64, 64]
    - [0, 6.688]
  - - [64, 320, 1, 64, 64, 64, 64, 64]
    - [0, 0.725]
  - - [192, 320, 1, 64, 192, 192, 64, 64]
    - [0, 1.901]
  - - [320, 320, 1, 64, 320, 320, 64, 64]
    - [0, 2.593]
  - - [448, 320, 1, 64, 448, 448, 64, 64]
    - [0, 3.316]
  - - [576, 320, 1, 64, 576, 576, 64, 64]
    - [0, 3.973]
  - - [704, 320, 1, 64, 704, 704, 64, 64]
    - [0, 4.259]
  - - [832, 320, 1, 64, 832, 832, 64, 64]
    - [0, 4.489]
  - - [960, 320, 1, 64, 960, 960, 64, 64]
    - [0, 4.885]
  - - [1088, 320, 1, 64, 1088, 1088, 64, 64]
    - [0, 5.204]
  - - [1216, 320, 1, 64, 1216, 1216, 64, 64]
    - [0, 5.32]
  - - [1344, 320, 1, 64, 1344, 1344, 64, 64]
    - [0, 5.59]
  - - [1472, 320, 1, 64, 1472, 1472, 64, 64]
    - [0, 5.787]
  - - [1600, 320, 1, 64, 1600, 1600, 64, 64]
    - [0, 5.884]
  - - [1728, 320, 1, 64, 1728, 1728, 64, 64]
    - [0, 6.083]
  - - [1856, 320, 1, 64, 1856, 1856, 64, 64]
    - [0, 6.217]
  - - [1984, 320, 1, 64, 1984, 1984, 64, 64]
    - [0, 6.324]
  - - [2112, 320, 1, 64, 2112, 2112, 64, 64]
    - [0, 6.501]
  - - [2240, 320, 1, 64, 2240, 2240, 64, 64]
    - [0, 6.545]
  - - [2368, 320, 1, 64, 2368, 2368, 64, 64]
    - [0, 6.587]
  - - [2496, 320, 1, 64, 2496, 2496, 64, 64]
    - [0, 6.857]
  - - [2624, 320, 1, 64, 2624, 2624, 64, 64]
    - [0, 6.859]
  - - [2752, 320, 1, 64, 2752, 2752, 64, 64]
    - [0, 6.947]
  - - [2880, 320, 1, 64, 2880, 2880, 64, 64]
    - [0, 6.979]
  - - [3008, 320, 1, 64, 3008, 3008, 64, 64]
    - [0, 7.092]
  - - [3136, 320, 1, 64, 3136, 3136, 64, 64]
    - [0, 7.128]
  - - [3264, 320, 1, 64, 3264, 3264, 64, 64]
    - [0, 7.189]
  - - [3392, 320, 1, 64, 3392, 3392, 64, 64]
    - [0, 7.349]
  - - [3520, 320, 1, 64, 3520, 3520, 64, 64]
    - [0, 7.399]
  - - [3648, 320, 1, 64, 3648, 3648, 64, 64]
    - [0, 7.39]
  - - [3776, 320, 1, 64, 3776, 3776, 64, 64]
    - [0, 7.393]
  - - [3904, 320, 1, 64, 3904, 3904, 64, 64]
    - [0, 7.465]
  - - [4032, 320, 1, 64, 4032, 4032, 64, 64]
    - [0, 7.523]
  - - [64, 448, 1, 64, 64, 64, 64, 64]
    - [0, 1.015]
  - - [192, 448, 1, 64, 192, 192, 64, 64]
    - [0, 2.386]
  - - [320, 448, 1, 64, 320, 320, 64, 64]
    - [0, 3.332]
  - - [448, 448, 1, 64, 448, 448, 64, 64]
    - [0, 4.018]
  - - [576, 448, 1, 64, 576, 576, 64, 64]
    - [0, 4.442]
  - - [704, 448, 1, 64, 704, 704, 64, 64]
    - [0, 4.981]
  - - [832, 448, 1, 64, 832, 832, 64, 64]
    - [0, 5.343]
  - - [960, 448, 1, 64, 960, 960, 64, 64]
    - [0, 5.658]
  - - [1088, 448, 1, 64, 1088, 1088, 64, 64]
    - [0, 5.91]
  - - [1216, 448, 1, 64, 1216, 1216, 64, 64]
    - [0, 6.153]
  - - [1344, 448, 1, 64, 1344, 1344, 64, 64]
    - [0, 6.275]
  - - [1472, 448, 1, 64, 1472, 1472, 64, 64]
    - [0, 6.558]
  - - [1600, 448, 1, 64, 1600, 1600, 64, 64]
    - [0, 6.6]
  - - [1728, 448, 1, 64, 1728, 1728, 64, 64]
    - [0, 6.675]
  - - [1856, 448, 1, 64, 1856, 1856, 64, 64]
    - [0, 6.789]
  - - [1984, 448, 1, 64, 1984, 1984, 64, 64]
    - [0, 6.96]
  - - [2112, 448, 1, 64, 2112, 2112, 64, 64]
    - [0, 7.001]
  - - [2240, 448, 1, 64, 2240, 2240, 64, 64]
    - [0, 7.216]
  - - [2368, 448, 1, 64, 2368, 2368, 64, 64]
    - [0, 7.27]
  - - [2496, 448, 1, 64, 2496, 2496, 64, 64]
    - [0, 7.286]
  - - [2624, 448, 1, 64, 2624, 2624, 64, 64]
    - [0, 7.438]
  - - [2752, 448, 1, 64, 2752, 2752, 64, 64]
    - [0, 7.387]
  - - [2880, 448, 1, 64, 2880, 2880, 64, 64]
    - [0, 7.491]
  - - [3008, 448, 1, 64, 3008, 3008, 64, 64]
    - [0, 7.624]
  - - [3136, 448, 1, 64, 3136, 3136, 64, 64]
    - [0, 7.638]
  - - [3264, 448, 1, 64, 3264, 3264, 64, 64]
    - [0, 7.657]
  - - [3392, 448, 1, 64, 3392, 3392, 64, 64]
    - [0, 7.724]
  - - [3520, 448, 1, 64, 3520, 3520, 64, 64]
    - [0, 7.765]
  - - [3648, 448, 1, 64, 3648, 3648, 64, 64]
    - [0, 7.811]
  - - [3776, 448, 1, 64, 3776, 3776, 64, 64]
    - [0, 7.864]
  - - [3904, 448, 1, 64, 3904, 3904, 64, 64]
    - [0, 7.881]
  - - [4032, 448, 1, 64, 4032, 4032, 64, 64]
    - [0, 7.871]
  - - [64, 576, 1, 64, 64, 64, 64, 64]
    - [0, 1.15]
  - - [192, 576, 1, 64, 192, 192, 64, 64]
    - [0, 2.799]
  - - [320, 576, 1, 64, 320, 320, 64, 64]
    - [0, 3.985]
  - - [448, 576, 1, 64, 448, 448, 64, 64]
    - [0, 4.367]
  - - [576, 576, 1, 64, 576, 576, 64, 64]
    - [0, 5.07]
  - - [704, 576, 1, 64, 704, 704, 64, 64]
    - [0, 5.454]
  - - [832, 576, 1, 64, 832, 832, 64, 64]
    - [0, 5.937]
  - - [960, 576, 1, 64, 960, 960, 64, 64]
    - [0, 6.187]
  - - [1088, 576, 1, 64, 1088, 1088, 64, 64]
    - [0, 6.358]
  - - [1216, 576, 1, 64, 1216, 1216, 64, 64]
    - [0, 6.481]
  - - [1344, 576, 1, 64, 1344, 1344, 64, 64]
    - [0, 6.685]
  - - [1472, 576, 1, 64, 1472, 1472, 64, 64]
    - [0, 6.849]
  - - [1600, 576, 1, 64, 1600, 1600, 64, 64]
    - [0, 6.974]
  - - [1728, 576, 1, 64, 1728, 1728, 64, 64]
    - [0, 7.098]
  - - [1856, 576, 1, 64, 1856, 1856, 64, 64]
    - [0, 7.298]
  - - [1984, 576, 1, 64, 1984, 1984, 64, 64]
    - [0, 7.337]
  - - [2112, 576, 1, 64, 2112, 2112, 64, 64]
    - [0, 7.469]
  - - [2240, 576, 1, 64, 2240, 2240, 64, 64]
    - [0, 7.563]
  - - [2368, 576, 1, 64, 2368, 2368, 64, 64]
    - [0, 7.618]
  - - [2496, 576, 1, 64, 2496, 2496, 64, 64]
    - [0, 7.659]
  - - [2624, 576, 1, 64, 2624, 2624, 64, 64]
    - [0, 7.788]
  - - [2752, 576, 1, 64, 2752, 2752, 64, 64]
    - [0, 7.809]
  - - [2880, 576, 1, 64, 2880, 2880, 64, 64]
    - [0, 7.851]
  - - [3008, 576, 1, 64, 3008, 3008, 64, 64]
    - [0, 7.907]
  - - [3136, 576, 1, 64, 3136, 3136, 64, 64]
    - [0, 7.938]
  - - [3264, 576, 1, 64, 3264, 3264, 64, 64]
    - [0, 8.023]
  - - [3392, 576, 1, 64, 3392, 3392, 64, 64]
    - [0, 7.999]
  - - [3520, 576, 1, 64, 3520, 3520, 64, 64]
    - [0, 8.062]
  - - [3648, 576, 1, 64, 3648, 3648, 64, 64]
    - [0, 8.176]
  - - [3776, 576, 1, 64, 3776, 3776, 64, 64]
    - [0, 8.197]
  - - [3904, 576, 1, 64, 3904, 3904, 64, 64]
    - [0, 8.099]
  - - [4032, 576, 1, 64, 4032, 4032, 64, 64]
    - [0, 8.169]
  - - [64, 704, 1, 64, 64, 64, 64, 64]
    - [0, 1.397]
  - - [192, 704, 1, 64, 192, 192, 64, 64]
    - [0, 3.151]
  - - [320, 704, 1, 64, 320, 320, 64, 64]
    - [0, 4.232]
  - - [448, 704, 1, 64, 448, 448, 64, 64]
    - [0, 4.987]
  - - [576, 704, 1, 64, 576, 576, 64, 64]
    - [0, 5.484]
  - - [704, 704, 1, 64, 704, 704, 64, 64]
    - [0, 5.95]
  - - [832, 704, 1, 64, 832, 832, 64, 64]
    - [0, 6.171]
  - - [960, 704, 1, 64, 960, 960, 64, 64]
    - [0, 6.571]
  - - [1088, 704, 1, 64, 1088, 1088, 64, 64]
    - [0, 6.743]
  - - [1216, 704, 1, 64, 1216, 1216, 64, 64]
    - [0, 6.882]
  - - [1344, 704, 1, 64, 1344, 1344, 64, 64]
    - [0, 7.102]
  - - [1472, 704, 1, 64, 1472, 1472, 64, 64]
    - [0, 7.217]
  - - [1600, 704, 1, 64, 1600, 1600, 64, 64]
    - [0, 7.431]
  - - [1728, 704, 1, 64, 1728, 1728, 64, 64]
    - [0, 7.417]
  - - [1856, 704, 1, 64, 1856, 1856, 64, 64]
    - [0, 7.527]
  - - [1984, 704, 1, 64, 1984, 1984, 64, 64]
    - [0, 7.666]
  - - [2112, 704, 1, 64, 2112, 2112, 64, 64]
    - [0, 7.762]
  - - [2240, 704, 1, 64, 2240, 2240, 64, 64]
    - [0, 7.798]
  - - [2368, 704, 1, 64, 2368, 2368, 64, 64]
    - [0, 7.872]
  - - [2496, 704, 1, 64, 2496, 2496, 64, 64]
    - [0, 7.837]
  - - [2624, 704, 1, 64, 2624, 2624, 64, 64]
    - [0, 7.963]
  - - [2752, 704, 1, 64, 2752, 2752, 64, 64]
    - [0, 8.082]
  - - [2880, 704, 1, 64, 2880, 2880, 64, 64]
    - [0, 8.013]
  - - [3008, 704, 1, 64, 3008, 3008, 64, 64]
    - [0, 8.152]
  - - [3136, 704, 1, 64, 3136, 3136, 64, 64]
    - [0, 8.114]
  - - [3264, 704, 1, 64, 3264, 3264, 64, 64]
    - [0, 8.25]
  - - [3392, 704, 1, 64, 3392, 3392, 64, 64]
    - [0, 8.256]
  - - [3520, 704, 1, 64, 3520, 3520, 64, 64]
    - [0, 8.314]
  - - [3648, 704, 1, 64, 3648, 3648, 64, 64]
    - [0, 8.267]
  - - [3776, 704, 1, 64, 3776, 3776, 64, 64]
    - [0, 8.272]
  - - [3904, 704, 1, 64, 3904, 3904, 64, 64]
    - [0, 8.327]
  - - [4032, 704, 1, 64, 4032, 4032, 64, 64]
    - [0, 8.313]
  - - [64, 832, 1, 64, 64, 64, 64, 64]
    - [0, 1.651]
  - - [192, 832, 1, 64, 192, 192, 64, 64]
    - [0, 3.481]
  - - [320, 832, 1, 64, 320, 320, 64, 64]
    - [0, 4.467]
  - - [448, 832, 1, 64, 448, 448, 64, 64]
    - [0, 5.346]
  - - [576, 832, 1, 64, 576, 576, 64, 64]
    - [0, 5.877]
  - - [704, 832, 1, 64, 704, 704, 64, 64]
    - [0, 6.151]
  - - [832, 832, 1, 64, 832, 832, 64, 64]
    - [0, 6.528]
  - - [960, 832, 1, 64, 960, 960, 64, 64]
    - [0, 6.8]
  - - [1088, 832, 1, 64, 1088, 1088, 64, 64]
    - [0, 7.037]
  - - [1216, 832, 1, 64, 1216, 1216, 64, 64]
    - [0, 7.233]
  - - [1344, 832, 1, 64, 1344, 1344, 64, 64]
    - [0, 7.35]
  - - [1472, 832, 1, 64, 1472, 1472, 64, 64]
    - [0, 7.458]
  - - [1600, 832, 1, 64, 1600, 1600, 64, 64]
    - [0, 7.604]
  - - [1728, 832, 1, 64, 1728, 1728, 64, 64]
    - [0, 7.693]
  - - [1856, 832, 1, 64, 1856, 1856, 64, 64]
    - [0, 7.783]
  - - [1984, 832, 1, 64, 1984, 1984, 64, 64]
    - [0, 7.936]
  - - [2112, 832, 1, 64, 2112, 2112, 64, 64]
    - [0, 7.93]
  - - [2240, 832, 1, 64, 2240, 2240, 64, 64]
    - [0, 8.018]
  - - [2368, 832, 1, 64, 2368, 2368, 64, 64]
    - [0, 8.026]
  - - [2496, 832, 1, 64, 2496, 2496, 64, 64]
    - [0, 8.115]
  - - [2624, 832, 1, 64, 2624, 2624, 64, 64]
    - [0, 8.106]
  - - [2752, 832, 1, 64, 2752, 2752, 64, 64]
    - [0, 8.287]
  - - [2880, 832, 1, 64, 2880, 2880, 64, 64]
    - [0, 8.238]
  - - [3008, 832, 1, 64, 3008, 3008, 64, 64]
    - [0, 8.263]
  - - [3136, 832, 1, 64, 3136, 3136, 64, 64]
    - [0, 8.345]
  - - [3264, 832, 1, 64, 3264, 3264, 64, 64]
    - [0, 8.348]
  - - [3392, 832, 1, 64, 3392, 3392, 64, 64]
    - [0, 8.335]
  - - [3520, 832, 1, 64, 3520, 3520, 64, 64]
    - [0, 8.399]
  - - [3648, 832, 1, 64, 3648, 3648, 64, 64]
    - [0, 7.637]
  - - [3776, 832, 1, 64, 3776, 3776, 64, 64]
    - [0, 7.892]
  - - [3904, 832, 1, 64, 3904, 3904, 64, 64]
    - [0, 7.959]
  - - [4032, 832, 1, 64, 4032, 4032, 64, 64]
    - [0, 8.019]
  - - [64, 960, 1, 64, 64, 64, 64, 64]
    - [0, 1.899]
  - - [192, 960, 1, 64, 192, 192, 64, 64]
    - [0, 3.955]
  - - [320, 960, 1, 64, 320, 320, 64, 64]
    - [0, 4.843]
  - - [448, 960, 1, 64, 448, 448, 64, 64]
    - [0, 5.658]
  - - [576, 960, 1, 64, 576, 576, 64, 64]
    - [0, 6.07]
  - - [704, 960, 1, 64, 704, 704, 64, 64]
    - [0, 6.48]
  - - [832, 960, 1, 64, 832, 832, 64, 64]
    - [0, 6.773]
  - - [960, 960, 1, 64, 960, 960, 64, 64]
    - [0, 7.074]
  - - [1088, 960, 1, 64, 1088, 1088, 64, 64]
    - [0, 7.292]
  - - [1216, 960, 1, 64, 1216, 1216, 64, 64]
    - [0, 7.438]
  - - [1344, 960, 1, 64, 1344, 1344, 64, 64]
    - [0, 7.528]
  - - [1472, 960, 1, 64, 1472, 1472, 64, 64]
    - [0, 7.648]
  - - [1600, 960, 1, 64, 1600, 1600, 64, 64]
    - [0, 7.748]
  - - [1728, 960, 1, 64, 1728, 1728, 64, 64]
    - [0, 7.842]
  - - [1856, 960, 1, 64, 1856, 1856, 64, 64]
    - [0, 7.924]
  - - [1984, 960, 1, 64, 1984, 1984, 64, 64]
    - [0, 8.032]
  - - [2112, 960, 1, 64, 2112, 2112, 64, 64]
    - [0, 8.059]
  - - [2240, 960, 1, 64, 2240, 2240, 64, 64]
    - [0, 8.199]
  - - [2368, 960, 1, 64, 2368, 2368, 64, 64]
    - [0, 8.148]
  - - [2496, 960, 1, 64, 2496, 2496, 64, 64]
    - [0, 8.206]
  - - [2624, 960, 1, 64, 2624, 2624, 64, 64]
    - [0, 8.243]
  - - [2752, 960, 1, 64, 2752, 2752, 64, 64]
    - [0, 8.287]
  - - [2880, 960, 1, 64, 2880, 2880, 64, 64]
    - [0, 8.358]
  - - [3008, 960, 1, 64, 3008, 3008, 64, 64]
    - [0, 8.444]
  - - [3136, 960, 1, 64, 3136, 3136, 64, 64]
    - [0, 8.448]
  - - [3264, 960, 1, 64, 3264, 3264, 64, 64]
    - [0, 7.874]
  - - [3392, 960, 1, 64, 3392, 3392, 64, 64]
    - [0, 8.078]
  - - [3520, 960, 1, 64, 3520, 3520, 64, 64]
    - [0, 8.02]
  - - [3648, 960, 1, 64, 3648, 3648, 64, 64]
    - [0, 8.118]
  - - [3776, 960, 1, 64, 3776, 3776, 64, 64]
    - [0, 8.178]
  - - [3904, 960, 1, 64, 3904, 3904, 64, 64]
    - [0, 8.179]
  - - [4032, 960, 1, 64, 4032, 4032, 64, 64]
    - [0, 8.181]
  - - [64, 1088, 1, 64, 64, 64, 64, 64]
    - [0, 1.947]
  - - [192, 1088, 1, 64, 192, 192, 64, 64]
    - [0, 4.227]
  - - [320, 1088, 1, 64, 320, 320, 64, 64]
    - [0, 5.244]
  - - [448, 1088, 1, 64, 448, 448, 64, 64]
    - [0, 5.942]
  - - [576, 1088, 1, 64, 576, 576, 64, 64]
    - [0, 6.376]
  - - [704, 1088, 1, 64, 704, 704, 64, 64]
    - [0, 6.72]
  - - [832, 1088, 1, 64, 832, 832, 64, 64]
    - [0, 7.04]
  - - [960, 1088, 1, 64, 960, 960, 64, 64]
    - [0, 7.24]
  - - [1088, 1088, 1, 64, 1088, 1088, 64, 64]
    - [0, 7.513]
  - - [1216, 1088, 1, 64, 1216, 1216, 64, 64]
    - [0, 7.582]
  - - [1344, 1088, 1, 64, 1344, 1344, 64, 64]
    - [0, 7.713]
  - - [1472, 1088, 1, 64, 1472, 1472, 64, 64]
    - [0, 7.805]
  - - [1600, 1088, 1, 64, 1600, 1600, 64, 64]
    - [0, 7.882]
  - - [1728, 1088, 1, 64, 1728, 1728, 64, 64]
    - [0, 8.053]
  - - [1856, 1088, 1, 64, 1856, 1856, 64, 64]
    - [0, 8.064]
  - - [1984, 1088, 1, 64, 1984, 1984, 64, 64]
    - [0, 8.106]
  - - [2112, 1088, 1, 64, 2112, 2112, 64, 64]
    - [0, 8.227]
  - - [2240, 1088, 1, 64, 2240, 2240, 64, 64]
    - [0, 8.262]
  - - [2368, 1088, 1, 64, 2368, 2368, 64, 64]
    - [0, 8.287]
  - - [2496, 1088, 1, 64, 2496, 2496, 64, 64]
    - [0, 8.311]
  - - [2624, 1088, 1, 64, 2624, 2624, 64, 64]
    - [0, 8.321]
  - - [2752, 1088, 1, 64, 2752, 2752, 64, 64]
    - [0, 8.413]
  - - [2880, 1088, 1, 64, 2880, 2880, 64, 64]
    - [0, 7.878]
  - - [3008, 1088, 1, 64, 3008, 3008, 64, 64]
    - [0, 8.138]
  - - [3136, 1088, 1, 64, 3136, 3136, 64, 64]
    - [0, 8.077]
  - - [3264, 1088, 1, 64, 3264, 3264, 64, 64]
    - [0, 8.069]
  - - [3392, 1088, 1, 64, 3392, 3392, 64, 64]
    - [0, 8.144]
  - - [3520, 1088, 1, 64, 3520, 3520, 64, 64]
    - [0, 8.143]
  - - [3648, 1088, 1, 64, 3648, 3648, 64, 64]
    - [0, 8.126]
  - - [3776, 1088, 1, 64, 3776, 3776, 64, 64]
    - [0, 8.163]
  - - [3904, 1088, 1, 64, 3904, 3904, 64, 64]
    - [0, 8.278]
  - - [4032, 1088, 1, 64, 4032, 4032, 64, 64]
    - [0, 8.232]
  - - [64, 1216, 1, 64, 64, 64, 64, 64]
    - [1, 1.429]
  - - [192, 1216, 1, 64, 192, 192, 64, 64]
    - [0, 4.313]
  - - [320, 1216, 1, 64, 320, 320, 64, 64]
    - [0, 5.407]
  - - [448, 1216, 1, 64, 448, 448, 64, 64]
    - [0, 6.098]
  - - [576, 1216, 1, 64, 576, 576, 64, 64]
    - [0, 6.501]
  - - [704, 1216, 1, 64, 704, 704, 64, 64]
    - [0, 6.944]
  - - [832, 1216, 1, 64, 832, 832, 64, 64]
    - [0, 7.157]
  - - [960, 1216, 1, 64, 960, 960, 64, 64]
    - [0, 7.4]
  - - [1088, 1216, 1, 64, 1088, 1088, 64, 64]
    - [0, 7.562]
  - - [1216, 1216, 1, 64, 1216, 1216, 64, 64]
    - [0, 7.7]
  - - [1344, 1216, 1, 64, 1344, 1344, 64, 64]
    - [0, 7.808]
  - - [1472, 1216, 1, 64, 1472, 1472, 64, 64]
    - [0, 7.933]
  - - [1600, 1216, 1, 64, 1600, 1600, 64, 64]
    - [0, 7.992]
  - - [1728, 1216, 1, 64, 1728, 1728, 64, 64]
    - [0, 8.106]
  - - [1856, 1216, 1, 64, 1856, 1856, 64, 64]
    - [0, 8.101]
  - - [1984, 1216, 1, 64, 1984, 1984, 64, 64]
    - [0, 8.182]
  - - [2112, 1216, 1, 64, 2112, 2112, 64, 64]
    - [0, 8.291]
  - - [2240, 1216, 1, 64, 2240, 2240, 64, 64]
    - [0, 8.348]
  - - [2368, 1216, 1, 64, 2368, 2368, 64, 64]
    - [0, 8.322]
  - - [2496, 1216, 1, 64, 2496, 2496, 64, 64]
    - [0, 7.636]
  - - [2624, 1216, 1, 64, 2624, 2624, 64, 64]
    - [0, 7.977]
  - - [2752, 1216, 1, 64, 2752, 2752, 64, 64]
    - [0, 8.026]
  - - [2880, 1216, 1, 64, 2880, 2880, 64, 64]
    - [0, 8.096]
  - - [3008, 1216, 1, 64, 3008, 3008, 64, 64]
    - [0, 8.097]
  - - [3136, 1216, 1, 64, 3136, 3136, 64, 64]
    - [0, 8.174]
  - - [3264, 1216, 1, 64, 3264, 3264, 64, 64]
    - [0, 8.177]
  - - [3392, 1216, 1, 64, 3392, 3392, 64, 64]
    - [0, 8.275]
  - - [3520, 1216, 1, 64, 3520, 3520, 64, 64]
    - [0, 8.304]
  - - [3648, 1216, 1, 64, 3648, 3648, 64, 64]
    - [0, 8.223]
  - - [3776, 1216, 1, 64, 3776, 3776, 64, 64]
    - [0, 8.354]
  - - [3904, 1216, 1, 64, 3904, 3904, 64, 64]
    - [0, 8.365]
  - - [4032, 1216, 1, 64, 4032, 4032, 64, 64]
    - [0, 8.328]
  - - [64, 1344, 1, 64, 64, 64, 64, 64]
    - [0, 2.395]
  - - [192, 1344, 1, 64, 192, 192, 64, 64]
    - [0, 4.589]
  - - [320, 1344, 1, 64, 320, 320, 64, 64]
    - [0, 5.599]
  - - [448, 1344, 1, 64, 448, 448, 64, 64]
    - [0, 6.266]
  - - [576, 1344, 1, 64, 576, 576, 64, 64]
    - [0, 6.744]
  - - [704, 1344, 1, 64, 704, 704, 64, 64]
    - [0, 7.078]
  - - [832, 1344, 1, 64, 832, 832, 64, 64]
    - [0, 7.343]
  - - [960, 1344, 1, 64, 960, 960, 64, 64]
    - [0, 7.593]
  - - [1088, 1344, 1, 64, 1088, 1088, 64, 64]
    - [0, 7.727]
  - - [1216, 1344, 1, 64, 1216, 1216, 64, 64]
    - [0, 7.763]
  - - [1344, 1344, 1, 64, 1344, 1344, 64, 64]
    - [0, 7.977]
  - - [1472, 1344, 1, 64, 1472, 1472, 64, 64]
    - [0, 8.096]
  - - [1600, 1344, 1, 64, 1600, 1600, 64, 64]
    - [0, 8.05]
  - - [1728, 1344, 1, 64, 1728, 1728, 64, 64]
    - [0, 8.166]
  - - [1856, 1344, 1, 64, 1856, 1856, 64, 64]
    - [0, 8.203]
  - - [1984, 1344, 1, 64, 1984, 1984, 64, 64]
    - [0, 8.249]
  - - [2112, 1344, 1, 64, 2112, 2112, 64, 64]
    - [0, 8.342]
  - - [2240, 1344, 1, 64, 2240, 2240, 64, 64]
    - [0, 7.579]
  - - [2368, 1344, 1, 64, 2368, 2368, 64, 64]
    - [0, 7.991]
  - - [2496, 1344, 1, 64, 2496, 2496, 64, 64]
    - [0, 8.05]
  - - [2624, 1344, 1, 64, 2624, 2624, 64, 64]
    - [0, 8.116]
  - - [2752, 1344, 1, 64, 2752, 2752, 64, 64]
    - [0, 8.165]
  - - [2880, 1344, 1, 64, 2880, 2880, 64, 64]
    - [0, 8.151]
  - - [3008, 1344, 1, 64, 3008, 3008, 64, 64]
    - [0, 8.189]
  - - [3136, 1344, 1, 64, 3136, 3136, 64, 64]
    - [0, 8.223]
  - - [3264, 1344, 1, 64, 3264, 3264, 64, 64]
    - [0, 8.266]
  - - [3392, 1344, 1, 64, 3392, 3392, 64, 64]
    - [0, 8.316]
  - - [3520, 1344, 1, 64, 3520, 3520, 64, 64]
    - [0, 8.271]
  - - [3648, 1344, 1, 64, 3648, 3648, 64, 64]
    - [0, 8.354]
  - - [3776, 1344, 1, 64, 3776, 3776, 64, 64]
    - [0, 8.327]
  - - [3904, 1344, 1, 64, 3904, 3904, 64, 64]
    - [0, 8.504]
  - - [4032, 1344, 1, 64, 4032, 4032, 64, 64]
    - [0, 8.496]
  - - [64, 1472, 1, 64, 64, 64, 64, 64]
    - [0, 2.436]
  - - [192, 1472, 1, 64, 192, 192, 64, 64]
    - [0, 4.621]
  - - [320, 1472, 1, 64, 320, 320, 64, 64]
    - [0, 5.786]
  - - [448, 1472, 1, 64, 448, 448, 64, 64]
    - [0, 6.459]
  - - [576, 1472, 1, 64, 576, 576, 64, 64]
    - [0, 6.902]
  - - [704, 1472, 1, 64, 704, 704, 64, 64]
    - [0, 7.164]
  - - [832, 1472, 1, 64, 832, 832, 64, 64]
    - [0, 7.428]
  - - [960, 1472, 1, 64, 960, 960, 64, 64]
    - [0, 7.615]
  - - [1088, 1472, 1, 64, 1088, 1088, 64, 64]
    - [0, 7.78]
  - - [1216, 1472, 1, 64, 1216, 1216, 64, 64]
    - [0, 7.882]
  - - [1344, 1472, 1, 64, 1344, 1344, 64, 64]
    - [0, 7.977]
  - - [1472, 1472, 1, 64, 1472, 1472, 64, 64]
    - [0, 8.089]
  - - [1600, 1472, 1, 64, 1600, 1600, 64, 64]
    - [0, 8.204]
  - - [1728, 1472, 1, 64, 1728, 1728, 64, 64]
    - [0, 8.226]
  - - [1856, 1472, 1, 64, 1856, 1856, 64, 64]
    - [0, 8.308]
  - - [1984, 1472, 1, 64, 1984, 1984, 64, 64]
    - [0, 8.374]
  - - [2112, 1472, 1, 64, 2112, 2112, 64, 64]
    - [0, 7.815]
  - - [2240, 1472, 1, 64, 2240, 2240, 64, 64]
    - [0, 7.965]
  - - [2368, 1472, 1, 64, 2368, 2368, 64, 64]
    - [0, 8.021]
  - - [2496, 1472, 1, 64, 2496, 2496, 64, 64]
    - [0, 8.099]
  - - [2624, 1472, 1, 64, 2624, 2624, 64, 64]
    - [0, 8.169]
  - - [2752, 1472, 1, 64, 2752, 2752, 64, 64]
    - [0, 8.287]
  - - [2880, 1472, 1, 64, 2880, 2880, 64, 64]
    - [0, 8.284]
  - - [3008, 1472, 1, 64, 3008, 3008, 64, 64]
    - [0, 8.308]
  - - [3136, 1472, 1, 64, 3136, 3136, 64, 64]
    - [0, 8.304]
  - - [3264, 1472, 1, 64, 3264, 3264, 64, 64]
    - [0, 8.353]
  - - [3392, 1472, 1, 64, 3392, 3392, 64, 64]
    - [0, 8.367]
  - - [3520, 1472, 1, 64, 3520, 3520, 64, 64]
    - [0, 8.358]
  - - [3648, 1472, 1, 64, 3648, 3648, 64, 64]
    - [0, 8.438]
  - - [3776, 1472, 1, 64, 3776, 3776, 64, 64]
    - [0, 8.454]
  - - [3904, 1472, 1, 64, 3904, 3904, 64, 64]
    - [0, 8.484]
  - - [4032, 1472, 1, 64, 4032, 4032, 64, 64]
    - [0, 8.482]
  - - [64, 1600, 1, 64, 64, 64, 64, 64]
    - [3, 1.876]
  - - [192, 1600, 1, 64, 192, 192, 64, 64]
    - [0, 4.868]
  - - [320, 1600, 1, 64, 320, 320, 64, 64]
    - [0, 5.976]
  - - [448, 1600, 1, 64, 448, 448, 64, 64]
    - [0, 6.573]
  - - [576, 1600, 1, 64, 576, 576, 64, 64]
    - [0, 7.072]
  - - [704, 1600, 1, 64, 704, 704, 64, 64]
    - [0, 7.318]
  - - [832, 1600, 1, 64, 832, 832, 64, 64]
    - [0, 7.554]
  - - [960, 1600, 1, 64, 960, 960, 64, 64]
    - [0, 7.797]
  - - [1088, 1600, 1, 64, 1088, 1088, 64, 64]
    - [0, 7.946]
  - - [1216, 1600, 1, 64, 1216, 1216, 64, 64]
    - [0, 8.002]
  - - [1344, 1600, 1, 64, 1344, 1344, 64, 64]
    - [0, 8.12]
  - - [1472, 1600, 1, 64, 1472, 1472, 64, 64]
    - [0, 8.168]
  - - [1600, 1600, 1, 64, 1600, 1600, 64, 64]
    - [0, 8.225]
  - - [1728, 1600, 1, 64, 1728, 1728, 64, 64]
    - [0, 8.279]
  - - [1856, 1600, 1, 64, 1856, 1856, 64, 64]
    - [0, 8.371]
  - - [1984, 1600, 1, 64, 1984, 1984, 64, 64]
    - [0, 7.967]
  - - [2112, 1600, 1, 64, 2112, 2112, 64, 64]
    - [0, 8.019]
  - - [2240, 1600, 1, 64, 2240, 2240, 64, 64]
    - [0, 8.079]
  - - [2368, 1600, 1, 64, 2368, 2368, 64, 64]
    - [0, 8.197]
  - - [2496, 1600, 1, 64, 2496, 2496, 64, 64]
    - [0, 8.154]
  - - [2624, 1600, 1, 64, 2624, 2624, 64, 64]
    - [0, 8.22]
  - - [2752, 1600, 1, 64, 2752, 2752, 64, 64]
    - [0, 8.227]
  - - [2880, 1600, 1, 64, 2880, 2880, 64, 64]
    - [0, 8.27]
  - - [3008, 1600, 1, 64, 3008, 3008, 64, 64]
    - [0, 8.295]
  - - [3136, 1600, 1, 64, 3136, 3136, 64, 64]
    - [0, 8.31]
  - - [3264, 1600, 1, 64, 3264, 3264, 64, 64]
    - [0, 8.38]
  - - [3392, 1600, 1, 64, 3392, 3392, 64, 64]
    - [0, 8.454]
  - - [3520, 1600, 1, 64, 3520, 3520, 64, 64]
    - [0, 8.415]
  - - [3648, 1600, 1, 64, 3648, 3648, 64, 64]
    - [0, 8.456]
  - - [3776, 1600, 1, 64, 3776, 3776, 64, 64]
    - [0, 8.447]
  - - [3904, 1600, 1, 64, 3904, 3904, 64, 64]
    - [0, 8.44]
  - - [4032, 1600, 1, 64, 4032, 4032, 64, 64]
    - [0, 8.59]
  - - [64, 1728, 1, 64, 64, 64, 64, 64]
    - [3, 2.041]
  - - [192, 1728, 1, 64, 192, 192, 64, 64]
    - [0, 5.058]
  - - [320, 1728, 1, 64, 320, 320, 64, 64]
    - [0, 6.075]
  - - [448, 1728, 1, 64, 448, 448, 64, 64]
    - [0, 6.737]
  - - [576, 1728, 1, 64, 576, 576, 64, 64]
    - [0, 7.167]
  - - [704, 1728, 1, 64, 704, 704, 64, 64]
    - [0, 7.432]
  - - [832, 1728, 1, 64, 832, 832, 64, 64]
    - [0, 7.582]
  - - [960, 1728, 1, 64, 960, 960, 64, 64]
    - [0, 7.847]
  - - [1088, 1728, 1, 64, 1088, 1088, 64, 64]
    - [0, 7.958]
  - - [1216, 1728, 1, 64, 1216, 1216, 64, 64]
    - [0, 8.108]
  - - [1344, 1728, 1, 64, 1344, 1344, 64, 64]
    - [0, 8.228]
  - - [1472, 1728, 1, 64, 1472, 1472, 64, 64]
    - [0, 8.231]
  - - [1600, 1728, 1, 64, 1600, 1600, 64, 64]
    - [0, 8.345]
  - - [1728, 1728, 1, 64, 1728, 1728, 64, 64]
    - [0, 7.515]
  - - [1856, 1728, 1, 64, 1856, 1856, 64, 64]
    - [0, 7.984]
  - - [1984, 1728, 1, 64, 1984, 1984, 64, 64]
    - [0, 8.045]
  - - [2112, 1728, 1, 64, 2112, 2112, 64, 64]
    - [0, 8.062]
  - - [2240, 1728, 1, 64, 2240, 2240, 64, 64]
    - [0, 8.187]
  - - [2368, 1728, 1, 64, 2368, 2368, 64, 64]
    - [0, 8.241]
  - - [2496, 1728, 1, 64, 2496, 2496, 64, 64]
    - [0, 8.264]
  - - [2624, 1728, 1, 64, 2624, 2624, 64, 64]
    - [0, 8.324]
  - - [2752, 1728, 1, 64, 2752, 2752, 64, 64]
    - [0, 8.345]
  - - [2880, 1728, 1, 64, 2880, 2880, 64, 64]
    - [0, 8.343]
  - - [3008, 1728, 1, 64, 3008, 3008, 64, 64]
    - [0, 8.395]
  - - [3136, 1728, 1, 64, 3136, 3136, 64, 64]
    - [0, 8.389]
  - - [3264, 1728, 1, 64, 3264, 3264, 64, 64]
    - [0, 8.401]
  - - [3392, 1728, 1, 64, 3392, 3392, 64, 64]
    - [0, 8.411]
  - - [3520, 1728, 1, 64, 3520, 3520, 64, 64]
    - [0, 8.481]
  - - [3648, 1728, 1, 64, 3648, 3648, 64, 64]
    - [0, 8.411]
  - - [3776, 1728, 1, 64, 3776, 3776, 64, 64]
    - [0, 8.532]
  - - [3904, 1728, 1, 64, 3904, 3904, 64, 64]
    - [0, 8.513]
  - - [4032, 1728, 1, 64, 4032, 4032, 64, 64]
    - [0, 8.542]
  - - [64, 1856, 1, 64, 64, 64, 64, 64]
    - [0, 3.004]
  - - [192, 1856, 1, 64, 192, 192, 64, 64]
    - [0, 5.249]
  - - [320, 1856, 1, 64, 320, 320, 64, 64]
    - [0, 6.179]
  - - [448, 1856, 1, 64, 448, 448, 64, 64]
    - [0, 6.893]
  - - [576, 1856, 1, 64, 576, 576, 64, 64]
    - [0, 7.191]
  - - [704, 1856, 1, 64, 704, 704, 64, 64]
    - [0, 7.575]
  - - [832, 1856, 1, 64, 832, 832, 64, 64]
    - [0, 7.776]
  - - [960, 1856, 1, 64, 960, 960, 64, 64]
    - [0, 7.914]
  - - [1088, 1856, 1, 64, 1088, 1088, 64, 64]
    - [0, 8.084]
  - - [1216, 1856, 1, 64, 1216, 1216, 64, 64]
    - [0, 8.146]
  - - [1344, 1856, 1, 64, 1344, 1344, 64, 64]
    - [0, 8.209]
  - - [1472, 1856, 1, 64, 1472, 1472, 64, 64]
    - [0, 8.291]
  - - [1600, 1856, 1, 64, 1600, 1600, 64, 64]
    - [0, 8.39]
  - - [1728, 1856, 1, 64, 1728, 1728, 64, 64]
    - [0, 7.953]
  - - [1856, 1856, 1, 64, 1856, 1856, 64, 64]
    - [0, 8.089]
  - - [1984, 1856, 1, 64, 1984, 1984, 64, 64]
    - [0, 8.102]
  - - [2112, 1856, 1, 64, 2112, 2112, 64, 64]
    - [0, 8.18]
  - - [2240, 1856, 1, 64, 2240, 2240, 64, 64]
    - [0, 8.222]
  - - [2368, 1856, 1, 64, 2368, 2368, 64, 64]
    - [0, 8.258]
  - - [2496, 1856, 1, 64, 2496, 2496, 64, 64]
    - [0, 8.31]
  - - [2624, 1856, 1, 64, 2624, 2624, 64, 64]
    - [0, 8.377]
  - - [2752, 1856, 1, 64, 2752, 2752, 64, 64]
    - [0, 8.369]
  - - [2880, 1856, 1, 64, 2880, 2880, 64, 64]
    - [0, 8.39]
  - - [3008, 1856, 1, 64, 3008, 3008, 64, 64]
    - [0, 8.412]
  - - [3136, 1856, 1, 64, 3136, 3136, 64, 64]
    - [0, 8.46]
  - - [3264, 1856, 1, 64, 3264, 3264, 64, 64]
    - [0, 8.43]
  - - [3392, 1856, 1, 64, 3392, 3392, 64, 64]
    - [0, 8.515]
  - - [3520, 1856, 1, 64, 3520, 3520, 64, 64]
    - [0, 8.582]
  - - [3648, 1856, 1, 64, 3648, 3648, 64, 64]
    - [0, 8.61]
  - - [3776, 1856, 1, 64, 3776, 3776, 64, 64]
    - [0, 8.568]
  - - [3904, 1856, 1, 64, 3904, 3904, 64, 64]
    - [0, 8.587]
  - - [4032, 1856, 1, 64, 4032, 4032, 64, 64]
    - [0, 8.574]
  - - [64, 1984, 1, 64, 64, 64, 64, 64]
    - [0, 2.99]
  - - [192, 1984, 1, 64, 192, 192, 64, 64]
    - [0, 5.397]
  - - [320, 1984, 1, 64, 320, 320, 64, 64]
    - [0, 6.398]
  - - [448, 1984, 1, 64, 448, 448, 64, 64]
    - [0, 6.975]
  - - [576, 1984, 1, 64, 576, 576, 64, 64]
    - [0, 7.365]
  - - [704, 1984, 1, 64, 704, 704, 64, 64]
    - [0, 7.608]
  - - [832, 1984, 1, 64, 832, 832, 64, 64]
    - [0, 7.797]
  - - [960, 1984, 1, 64, 960, 960, 64, 64]
    - [0, 8.023]
  - - [1088, 1984, 1, 64, 1088, 1088, 64, 64]
    - [0, 8.072]
  - - [1216, 1984, 1, 64, 1216, 1216, 64, 64]
    - [0, 8.228]
  - - [1344, 1984, 1, 64, 1344, 1344, 64, 64]
    - [0, 8.302]
  - - [1472, 1984, 1, 64, 1472, 1472, 64, 64]
    - [0, 8.287]
  - - [1600, 1984, 1, 64, 1600, 1600, 64, 64]
    - [0, 7.971]
  - - [1728, 1984, 1, 64, 1728, 1728, 64, 64]
    - [0, 8.044]
  - - [1856, 1984, 1, 64, 1856, 1856, 64, 64]
    - [0, 8.132]
  - - [1984, 1984, 1, 64, 1984, 1984, 64, 64]
    - [0, 8.138]
  - - [2112, 1984, 1, 64, 2112, 2112, 64, 64]
    - [0, 8.203]
  - - [2240, 1984, 1, 64, 2240, 2240, 64, 64]
    - [0, 8.126]
  - - [2368, 1984, 1, 64, 2368, 2368, 64, 64]
    - [0, 8.331]
  - - [2496, 1984, 1, 64, 2496, 2496, 64, 64]
    - [0, 8.367]
  - - [2624, 1984, 1, 64, 2624, 2624, 64, 64]
    - [0, 8.379]
  - - [2752, 1984, 1, 64, 2752, 2752, 64, 64]
    - [0, 8.357]
  - - [2880, 1984, 1, 64, 2880, 2880, 64, 64]
    - [0, 8.432]
  - - [3008, 1984, 1, 64, 3008, 3008, 64, 64]
    - [0, 8.483]
  - - [3136, 1984, 1, 64, 3136, 3136, 64, 64]
    - [0, 8.444]
  - - [3264, 1984, 1, 64, 3264, 3264, 64, 64]
    - [0, 8.537]
  - - [3392, 1984, 1, 64, 3392, 3392, 64, 64]
    - [0, 8.551]
  - - [3520, 1984, 1, 64, 3520, 3520, 64, 64]
    - [0, 8.603]
  - - [3648, 1984, 1, 64, 3648, 3648, 64, 64]
    - [0, 8.583]
  - - [3776, 1984, 1, 64, 3776, 3776, 64, 64]
    - [0, 8.598]
  - - [3904, 1984, 1, 64, 3904, 3904, 64, 64]
    - [0, 8.546]
  - - [4032, 1984, 1, 64, 4032, 4032, 64, 64]
    - [0, 8.568]
  - - [64, 2112, 1, 64, 64, 64, 64, 64]
    - [0, 3.17]
  - - [192, 2112, 1, 64, 192, 192, 64, 64]
    - [0, 5.497]
  - - [320, 2112, 1, 64, 320, 320, 64, 64]
    - [0, 6.496]
  - - [448, 2112, 1, 64, 448, 448, 64, 64]
    - [0, 7.033]
  - - [576, 2112, 1, 64, 576, 576, 64, 64]
    - [0, 7.38]
  - - [704, 2112, 1, 64, 704, 704, 64, 64]
    - [0, 7.672]
  - - [832, 2112, 1, 64, 832, 832, 64, 64]
    - [0, 7.913]
  - - [960, 2112, 1, 64, 960, 960, 64, 64]
    - [0, 7.975]
  - - [1088, 2112, 1, 64, 1088, 1088, 64, 64]
    - [0, 8.082]
  - - [1216, 2112, 1, 64, 1216, 1216, 64, 64]
    - [0, 8.28]
  - - [1344, 2112, 1, 64, 1344, 1344, 64, 64]
    - [0, 8.369]
  - - [1472, 2112, 1, 64, 1472, 1472, 64, 64]
    - [0, 7.813]
  - - [1600, 2112, 1, 64, 1600, 1600, 64, 64]
    - [0, 7.996]
  - - [1728, 2112, 1, 64, 1728, 1728, 64, 64]
    - [0, 8.129]
  - - [1856, 2112, 1, 64, 1856, 1856, 64, 64]
    - [0, 8.175]
  - - [1984, 2112, 1, 64, 1984, 1984, 64, 64]
    - [0, 8.165]
  - - [2112, 2112, 1, 64, 2112, 2112, 64, 64]
    - [0, 8.253]
  - - [2240, 2112, 1, 64, 2240, 2240, 64, 64]
    - [0, 8.202]
  - - [2368, 2112, 1, 64, 2368, 2368, 64, 64]
    - [0, 8.335]
  - - [2496, 2112, 1, 64, 2496, 2496, 64, 64]
    - [0, 8.417]
  - - [2624, 2112, 1, 64, 2624, 2624, 64, 64]
    - [0, 8.435]
  - - [2752, 2112, 1, 64, 2752, 2752, 64, 64]
    - [0, 8.434]
  - - [2880, 2112, 1, 64, 2880, 2880, 64, 64]
    - [0, 8.448]
  - - [3008, 2112, 1, 64, 3008, 3008, 64, 64]
    - [0, 8.411]
  - - [3136, 2112, 1, 64, 3136, 3136, 64, 64]
    - [0, 8.452]
  - - [3264, 2112, 1, 64, 3264, 3264, 64, 64]
    - [0, 8.5]
  - - [3392, 2112, 1, 64, 3392, 3392, 64, 64]
    - [0, 8.597]
  - - [3520, 2112, 1, 64, 3520, 3520, 64, 64]
    - [0, 8.593]
  - - [3648, 2112, 1, 64, 3648, 3648, 64, 64]
    - [0, 8.519]
  - - [3776, 2112, 1, 64, 3776, 3776, 64, 64]
    - [0, 8.577]
  - - [3904, 2112, 1, 64, 3904, 3904, 64, 64]
    - [0, 8.62]
  - - [4032, 2112, 1, 64, 4032, 4032, 64, 64]
    - [0, 8.598]
  - - [64, 2240, 1, 64, 64, 64, 64, 64]
    - [0, 3.34]
  - - [192, 2240, 1, 64, 192, 192, 64, 64]
    - [0, 5.666]
  - - [320, 2240, 1, 64, 320, 320, 64, 64]
    - [0, 6.554]
  - - [448, 2240, 1, 64, 448, 448, 64, 64]
    - [0, 7.191]
  - - [576, 2240, 1, 64, 576, 576, 64, 64]
    - [0, 7.495]
  - - [704, 2240, 1, 64, 704, 704, 64, 64]
    - [0, 7.792]
  - - [832, 2240, 1, 64, 832, 832, 64, 64]
    - [0, 7.956]
  - - [960, 2240, 1, 64, 960, 960, 64, 64]
    - [0, 8.063]
  - - [1088, 2240, 1, 64, 1088, 1088, 64, 64]
    - [0, 8.172]
  - - [1216, 2240, 1, 64, 1216, 1216, 64, 64]
    - [0, 8.235]
  - - [1344, 2240, 1, 64, 1344, 1344, 64, 64]
    - [0, 7.577]
  - - [1472, 2240, 1, 64, 1472, 1472, 64, 64]
    - [0, 7.914]
  - - [1600, 2240, 1, 64, 1600, 1600, 64, 64]
    - [0, 8.026]
  - - [1728, 2240, 1, 64, 1728, 1728, 64, 64]
    - [0, 8.226]
  - - [1856, 2240, 1, 64, 1856, 1856, 64, 64]
    - [0, 8.155]
  - - [1984, 2240, 1, 64, 1984, 1984, 64, 64]
    - [0, 8.304]
  - - [2112, 2240, 1, 64, 2112, 2112, 64, 64]
    - [0, 8.29]
  - - [2240, 2240, 1, 64, 2240, 2240, 64, 64]
    - [0, 8.369]
  - - [2368, 2240, 1, 64, 2368, 2368, 64, 64]
    - [0, 8.371]
  - - [2496, 2240, 1, 64, 2496, 2496, 64, 64]
    - [0, 8.324]
  - - [2624, 2240, 1, 64, 2624, 2624, 64, 64]
    - [0, 8.355]
  - - [2752, 2240, 1, 64, 2752, 2752, 64, 64]
    - [0, 8.405]
  - - [2880, 2240, 1, 64, 2880, 2880, 64, 64]
    - [0, 8.48]
  - - [3008, 2240, 1, 64, 3008, 3008, 64, 64]
    - [0, 8.577]
  - - [3136, 2240, 1, 64, 3136, 3136, 64, 64]
    - [0, 8.517]
  - - [3264, 2240, 1, 64, 3264, 3264, 64, 64]
    - [0, 8.547]
  - - [3392, 2240, 1, 64, 3392, 3392, 64, 64]
    - [0, 8.462]
  - - [3520, 2240, 1, 64, 3520, 3520, 64, 64]
    - [0, 8.57]
  - - [3648, 2240, 1, 64, 3648, 3648, 64, 64]
    - [0, 8.637]
  - - [3776, 2240, 1, 64, 3776, 3776, 64, 64]
    - [0, 8.601]
  - - [3904, 2240, 1, 64, 3904, 3904, 64, 64]
    - [0, 8.59]
  - - [4032, 2240, 1, 64, 4032, 4032, 64, 64]
    - [0, 8.68]
  - - [64, 2368, 1, 64, 64, 64, 64, 64]
    - [0, 3.54]
  - - [192, 2368, 1, 64, 192, 192, 64, 64]
    - [0, 5.723]
  - - [320, 2368, 1, 64, 320, 320, 64, 64]
    - [0, 6.651]
  - - [448, 2368, 1, 64, 448, 448, 64, 64]
    - [0, 7.265]
  - - [576, 2368, 1, 64, 576, 576, 64, 64]
    - [0, 7.644]
  - - [704, 2368, 1, 64, 704, 704, 64, 64]
    - [0, 7.765]
  - - [832, 2368, 1, 64, 832, 832, 64, 64]
    - [0, 7.979]
  - - [960, 2368, 1, 64, 960, 960, 64, 64]
    - [0, 8.08]
  - - [1088, 2368, 1, 64, 1088, 1088, 64, 64]
    - [0, 8.195]
  - - [1216, 2368, 1, 64, 1216, 1216, 64, 64]
    - [0, 8.229]
  - - [1344, 2368, 1, 64, 1344, 1344, 64, 64]
    - [0, 7.893]
  - - [1472, 2368, 1, 64, 1472, 1472, 64, 64]
    - [0, 8.015]
  - - [1600, 2368, 1, 64, 1600, 1600, 64, 64]
    - [0, 8.152]
  - - [1728, 2368, 1, 64, 1728, 1728, 64, 64]
    - [0, 8.115]
  - - [1856, 2368, 1, 64, 1856, 1856, 64, 64]
    - [0, 8.242]
  - - [1984, 2368, 1, 64, 1984, 1984, 64, 64]
    - [0, 8.261]
  - - [2112, 2368, 1, 64, 2112, 2112, 64, 64]
    - [0, 8.271]
  - - [2240, 2368, 1, 64, 2240, 2240, 64, 64]
    - [0, 8.358]
  - - [2368, 2368, 1, 64, 2368, 2368, 64, 64]
    - [0, 8.346]
  - - [2496, 2368, 1, 64, 2496, 2496, 64, 64]
    - [0, 8.505]
  - - [2624, 2368, 1, 64, 2624, 2624, 64, 64]
    - [0, 8.407]
  - - [2752, 2368, 1, 64, 2752, 2752, 64, 64]
    - [0, 8.484]
  - - [2880, 2368, 1, 64, 2880, 2880, 64, 64]
    - [0, 8.541]
  - - [3008, 2368, 1, 64, 3008, 3008, 64, 64]
    - [0, 8.545]
  - - [3136, 2368, 1, 64, 3136, 3136, 64, 64]
    - [0, 8.458]
  - - [3264, 2368, 1, 64, 3264, 3264, 64, 64]
    - [0, 8.629]
  - - [3392, 2368, 1, 64, 3392, 3392, 64, 64]
    - [0, 8.572]
  - - [3520, 2368, 1, 64, 3520, 3520, 64, 64]
    - [0, 8.596]
  - - [3648, 2368, 1, 64, 3648, 3648, 64, 64]
    - [0, 8.558]
  - - [3776, 2368, 1, 64, 3776, 3776, 64, 64]
    - [0, 8.605]
  - - [3904, 2368, 1, 64, 3904, 3904, 64, 64]
    - [0, 8.637]
  - - [4032, 2368, 1, 64, 4032, 4032, 64, 64]
    - [0, 8.673]
  - - [64, 2496, 1, 64, 64, 64, 64, 64]
    - [0, 3.467]
  - - [192, 2496, 1, 64, 192, 192, 64, 64]
    - [0, 5.778]
  - - [320, 2496, 1, 64, 320, 320, 64, 64]
    - [0, 6.776]
  - - [448, 2496, 1, 64, 448, 448, 64, 64]
    - [0, 7.289]
  - - [576, 2496, 1, 64, 576, 576, 64, 64]
    - [0, 7.6]
  - - [704, 2496, 1, 64, 704, 704, 64, 64]
    - [0, 7.887]
  - - [832, 2496, 1, 64, 832, 832, 64, 64]
    - [0, 8.026]
  - - [960, 2496, 1, 64, 960, 960, 64, 64]
    - [0, 8.196]
  - - [1088, 2496, 1, 64, 1088, 1088, 64, 64]
    - [0, 8.271]
  - - [1216, 2496, 1, 64, 1216, 1216, 64, 64]
    - [0, 7.634]
  - - [1344, 2496, 1, 64, 1344, 1344, 64, 64]
    - [0, 7.986]
  - - [1472, 2496, 1, 64, 1472, 1472, 64, 64]
    - [0, 8.036]
  - - [1600, 2496, 1, 64, 1600, 1600, 64, 64]
    - [0, 8.231]
  - - [1728, 2496, 1, 64, 1728, 1728, 64, 64]
    - [0, 8.22]
  - - [1856, 2496, 1, 64, 1856, 1856, 64, 64]
    - [0, 8.297]
  - - [1984, 2496, 1, 64, 1984, 1984, 64, 64]
    - [0, 8.357]
  - - [2112, 2496, 1, 64, 2112, 2112, 64, 64]
    - [0, 8.316]
  - - [2240, 2496, 1, 64, 2240, 2240, 64, 64]
    - [0, 8.46]
  - - [2368, 2496, 1, 64, 2368, 2368, 64, 64]
    - [0, 8.476]
  - - [2496, 2496, 1, 64, 2496, 2496, 64, 64]
    - [0, 8.465]
  - - [2624, 2496, 1, 64, 2624, 2624, 64, 64]
    - [0, 8.585]
  - - [2752, 2496, 1, 64, 2752, 2752, 64, 64]
    - [0, 8.427]
  - - [2880, 2496, 1, 64, 2880, 2880, 64, 64]
    - [0, 8.532]
  - - [3008, 2496, 1, 64, 3008, 3008, 64, 64]
    - [0, 8.567]
  - - [3136, 2496, 1, 64, 3136, 3136, 64, 64]
    - [0, 8.624]
  - - [3264, 2496, 1, 64, 3264, 3264, 64, 64]
    - [0, 8.511]
  - - [3392, 2496, 1, 64, 3392, 3392, 64, 64]
    - [0, 8.568]
  - - [3520, 2496, 1, 64, 3520, 3520, 64, 64]
    - [0, 8.598]
  - - [3648, 2496, 1, 64, 3648, 3648, 64, 64]
    - [0, 8.59]
  - - [3776, 2496, 1, 64, 3776, 3776, 64, 64]
    - [0, 8.649]
  - - [3904, 2496, 1, 64, 3904, 3904, 64, 64]
    - [0, 8.601]
  - - [4032, 2496, 1, 64, 4032, 4032, 64, 64]
    - [0, 8.672]
  - - [64, 2624, 1, 64, 64, 64, 64, 64]
    - [0, 3.626]
  - - [192, 2624, 1, 64, 192, 192, 64, 64]
    - [0, 5.916]
  - - [320, 2624, 1, 64, 320, 320, 64, 64]
    - [0, 6.752]
  - - [448, 2624, 1, 64, 448, 448, 64, 64]
    - [0, 7.349]
  - - [576, 2624, 1, 64, 576, 576, 64, 64]
    - [0, 7.713]
  - - [704, 2624, 1, 64, 704, 704, 64, 64]
    - [0, 7.962]
  - - [832, 2624, 1, 64, 832, 832, 64, 64]
    - [0, 8.067]
  - - [960, 2624, 1, 64, 960, 960, 64, 64]
    - [0, 8.269]
  - - [1088, 2624, 1, 64, 1088, 1088, 64, 64]
    - [0, 8.314]
  - - [1216, 2624, 1, 64, 1216, 1216, 64, 64]
    - [0, 7.929]
  - - [1344, 2624, 1, 64, 1344, 1344, 64, 64]
    - [0, 8.117]
  - - [1472, 2624, 1, 64, 1472, 1472, 64, 64]
    - [0, 8.131]
  - - [1600, 2624, 1, 64, 1600, 1600, 64, 64]
    - [0, 8.215]
  - - [1728, 2624, 1, 64, 1728, 1728, 64, 64]
    - [0, 8.249]
  - - [1856, 2624, 1, 64, 1856, 1856, 64, 64]
    - [0, 8.249]
  - - [1984, 2624, 1, 64, 1984, 1984, 64, 64]
    - [0, 8.346]
  - - [2112, 2624, 1, 64, 2112, 2112, 64, 64]
    - [0, 8.481]
  - - [2240, 2624, 1, 64, 2240, 2240, 64, 64]
    - [0, 8.462]
  - - [2368, 2624, 1, 64, 2368, 2368, 64, 64]
    - [0, 8.429]
  - - [2496, 2624, 1, 64, 2496, 2496, 64, 64]
    - [0, 8.483]
  - - [2624, 2624, 1, 64, 2624, 2624, 64, 64]
    - [0, 8.571]
  - - [2752, 2624, 1, 64, 2752, 2752, 64, 64]
    - [0, 8.464]
  - - [2880, 2624, 1, 64, 2880, 2880, 64, 64]
    - [0, 8.542]
  - - [3008, 2624, 1, 64, 3008, 3008, 64, 64]
    - [0, 8.52]
  - - [3136, 2624, 1, 64, 3136, 3136, 64, 64]
    - [0, 8.633]
  - - [3264, 2624, 1, 64, 3264, 3264, 64, 64]
    - [0, 8.626]
  - - [3392, 2624, 1, 64, 3392, 3392, 64, 64]
    - [0, 8.65]
  - - [3520, 2624, 1, 64, 3520, 3520, 64, 64]
    - [0, 8.646]
  - - [3648, 2624, 1, 64, 3648, 3648, 64, 64]
    - [0, 8.651]
  - - [3776, 2624, 1, 64, 3776, 3776, 64, 64]
    - [0, 8.651]
  - - [3904, 2624, 1, 64, 3904, 3904, 64, 64]
    - [0, 8.682]
  - - [4032, 2624, 1, 64, 4032, 4032, 64, 64]
    - [0, 8.659]
  - - [64, 2752, 1, 64, 64, 64, 64, 64]
    - [0, 3.786]
  - - [192, 2752, 1, 64, 192, 192, 64, 64]
    - [0, 5.935]
  - - [320, 2752, 1, 64, 320, 320, 64, 64]
    - [0, 6.907]
  - - [448, 2752, 1, 64, 448, 448, 64, 64]
    - [0, 7.406]
  - - [576, 2752, 1, 64, 576, 576, 64, 64]
    - [0, 7.794]
  - - [704, 2752, 1, 64, 704, 704, 64, 64]
    - [0, 8.0]
  - - [832, 2752, 1, 64, 832, 832, 64, 64]
    - [0, 8.112]
  - - [960, 2752, 1, 64, 960, 960, 64, 64]
    - [0, 8.197]
  - - [1088, 2752, 1, 64, 1088, 1088, 64, 64]
    - [0, 7.956]
  - - [1216, 2752, 1, 64, 1216, 1216, 64, 64]
    - [0, 8.036]
  - - [1344, 2752, 1, 64, 1344, 1344, 64, 64]
    - [0, 8.085]
  - - [1472, 2752, 1, 64, 1472, 1472, 64, 64]
    - [0, 8.188]
  - - [1600, 2752, 1, 64, 1600, 1600, 64, 64]
    - [0, 8.177]
  - - [1728, 2752, 1, 64, 1728, 1728, 64, 64]
    - [0, 8.247]
  - - [1856, 2752, 1, 64, 1856, 1856, 64, 64]
    - [0, 8.369]
  - - [1984, 2752, 1, 64, 1984, 1984, 64, 64]
    - [0, 8.432]
  - - [2112, 2752, 1, 64, 2112, 2112, 64, 64]
    - [0, 8.409]
  - - [2240, 2752, 1, 64, 2240, 2240, 64, 64]
    - [0, 8.465]
  - - [2368, 2752, 1, 64, 2368, 2368, 64, 64]
    - [0, 8.498]
  - - [2496, 2752, 1, 64, 2496, 2496, 64, 64]
    - [0, 8.497]
  - - [2624, 2752, 1, 64, 2624, 2624, 64, 64]
    - [0, 8.573]
  - - [2752, 2752, 1, 64, 2752, 2752, 64, 64]
    - [0, 8.502]
  - - [2880, 2752, 1, 64, 2880, 2880, 64, 64]
    - [0, 8.63]
  - - [3008, 2752, 1, 64, 3008, 3008, 64, 64]
    - [0, 8.583]
  - - [3136, 2752, 1, 64, 3136, 3136, 64, 64]
    - [0, 8.632]
  - - [3264, 2752, 1, 64, 3264, 3264, 64, 64]
    - [0, 8.622]
  - - [3392, 2752, 1, 64, 3392, 3392, 64, 64]
    - [0, 8.669]
  - - [3520, 2752, 1, 64, 3520, 3520, 64, 64]
    - [0, 8.591]
  - - [3648, 2752, 1, 64, 3648, 3648, 64, 64]
    - [0, 8.646]
  - - [3776, 2752, 1, 64, 3776, 3776, 64, 64]
    - [0, 8.71]
  - - [3904, 2752, 1, 64, 3904, 3904, 64, 64]
    - [0, 8.707]
  - - [4032, 2752, 1, 64, 4032, 4032, 64, 64]
    - [0, 8.672]
  - - [64, 2880, 1, 64, 64, 64, 64, 64]
    - [0, 3.954]
  - - [192, 2880, 1, 64, 192, 192, 64, 64]
    - [0, 6.107]
  - - [320, 2880, 1, 64, 320, 320, 64, 64]
    - [0, 7.038]
  - - [448, 2880, 1, 64, 448, 448, 64, 64]
    - [0, 7.462]
  - - [576, 2880, 1, 64, 576, 576, 64, 64]
    - [0, 7.744]
  - - [704, 2880, 1, 64, 704, 704, 64, 64]
    - [0, 8.003]
  - - [832, 2880, 1, 64, 832, 832, 64, 64]
    - [0, 8.142]
  - - [960, 2880, 1, 64, 960, 960, 64, 64]
    - [0, 8.275]
  - - [1088, 2880, 1, 64, 1088, 1088, 64, 64]
    - [0, 7.871]
  - - [1216, 2880, 1, 64, 1216, 1216, 64, 64]
    - [0, 8.026]
  - - [1344, 2880, 1, 64, 1344, 1344, 64, 64]
    - [0, 8.149]
  - - [1472, 2880, 1, 64, 1472, 1472, 64, 64]
    - [0, 8.243]
  - - [1600, 2880, 1, 64, 1600, 1600, 64, 64]
    - [0, 8.33]
  - - [1728, 2880, 1, 64, 1728, 1728, 64, 64]
    - [0, 8.326]
  - - [1856, 2880, 1, 64, 1856, 1856, 64, 64]
    - [0, 8.331]
  - - [1984, 2880, 1, 64, 1984, 1984, 64, 64]
    - [0, 8.422]
  - - [2112, 2880, 1, 64, 2112, 2112, 64, 64]
    - [0, 8.337]
  - - [2240, 2880, 1, 64, 2240, 2240, 64, 64]
    - [0, 8.386]
  - - [2368, 2880, 1, 64, 2368, 2368, 64, 64]
    - [0, 8.526]
  - - [2496, 2880, 1, 64, 2496, 2496, 64, 64]
    - [0, 8.609]
  - - [2624, 2880, 1, 64, 2624, 2624, 64, 64]
    - [0, 8.601]
  - - [2752, 2880, 1, 64, 2752, 2752, 64, 64]
    - [0, 8.607]
  - - [2880, 2880, 1, 64, 2880, 2880, 64, 64]
    - [0, 8.605]
  - - [3008, 2880, 1, 64, 3008, 3008, 64, 64]
    - [0, 8.616]
  - - [3136, 2880, 1, 64, 3136, 3136, 64, 64]
    - [0, 8.63]
  - - [3264, 2880, 1, 64, 3264, 3264, 64, 64]
    - [0, 8.603]
  - - [3392, 2880, 1, 64, 3392, 3392, 64, 64]
    - [0, 8.65]
  - - [3520, 2880, 1, 64, 3520, 3520, 64, 64]
    - [0, 8.659]
  - - [3648, 2880, 1, 64, 3648, 3648, 64, 64]
    - [0, 8.685]
  - - [3776, 2880, 1, 64, 3776, 3776, 64, 64]
    - [0, 8.649]
  - - [3904, 2880, 1, 64, 3904, 3904, 64, 64]
    - [0, 8.693]
  - - [4032, 2880, 1, 64, 4032, 4032, 64, 64]
    - [0, 8.737]
  - - [64, 3008, 1, 64, 64, 64, 64, 64]
    - [0, 3.877]
  - - [192, 3008, 1, 64, 192, 192, 64, 64]
    - [0, 6.153]
  - - [320, 3008, 1, 64, 320, 320, 64, 64]
    - [0, 7.07]
  - - [448, 3008, 1, 64, 448, 448, 64, 64]
    - [0, 7.535]
  - - [576, 3008, 1, 64, 576, 576, 64, 64]
    - [0, 7.85]
  - - [704, 3008, 1, 64, 704, 704, 64, 64]
    - [0, 8.103]
  - - [832, 3008, 1, 64, 832, 832, 64, 64]
    - [0, 8.182]
  - - [960, 3008, 1, 64, 960, 960, 64, 64]
    - [0, 8.268]
  - - [1088, 3008, 1, 64, 1088, 1088, 64, 64]
    - [0, 7.953]
  - - [1216, 3008, 1, 64, 1216, 1216, 64, 64]
    - [0, 8.02]
  - - [1344, 3008, 1, 64, 1344, 1344, 64, 64]
    - [0, 8.222]
  - - [1472, 3008, 1, 64, 1472, 1472, 64, 64]
    - [0, 8.214]
  - - [1600, 3008, 1, 64, 1600, 1600, 64, 64]
    - [0, 8.278]
  - - [1728, 3008, 1, 64, 1728, 1728, 64, 64]
    - [0, 8.287]
  - - [1856, 3008, 1, 64, 1856, 1856, 64, 64]
    - [0, 8.346]
  - - [1984, 3008, 1, 64, 1984, 1984, 64, 64]
    - [0, 8.367]
  - - [2112, 3008, 1, 64, 2112, 2112, 64, 64]
    - [0, 8.429]
  - - [2240, 3008, 1, 64, 2240, 2240, 64, 64]
    - [0, 8.475]
  - - [2368, 3008, 1, 64, 2368, 2368, 64, 64]
    - [0, 8.486]
  - - [2496, 3008, 1, 64, 2496, 2496, 64, 64]
    - [0, 8.568]
  - - [2624, 3008, 1, 64, 2624, 2624, 64, 64]
    - [0, 8.593]
  - - [2752, 3008, 1, 64, 2752, 2752, 64, 64]
    - [0, 8.638]
  - - [2880, 3008, 1, 64, 2880, 2880, 64, 64]
    - [0, 8.586]
  - - [3008, 3008, 1, 64, 3008, 3008, 64, 64]
    - [0, 8.65]
  - - [3136, 3008, 1, 64, 3136, 3136, 64, 64]
    - [0, 8.652]
  - - [3264, 3008, 1, 64, 3264, 3264, 64, 64]
    - [0, 8.628]
  - - [3392, 3008, 1, 64, 3392, 3392, 64, 64]
    - [0, 8.632]
  - - [3520, 3008, 1, 64, 3520, 3520, 64, 64]
    - [0, 8.674]
  - - [3648, 3008, 1, 64, 3648, 3648, 64, 64]
    - [0, 8.637]
  - - [3776, 3008, 1, 64, 3776, 3776, 64, 64]
    - [0, 8.69]
  - - [3904, 3008, 1, 64, 3904, 3904, 64, 64]
    - [0, 8.648]
  - - [4032, 3008, 1, 64, 4032, 4032, 64, 64]
    - [0, 8.67]
  - - [64, 3136, 1, 64, 64, 64, 64, 64]
    - [0, 3.996]
  - - [192, 3136, 1, 64, 192, 192, 64, 64]
    - [0, 6.204]
  - - [320, 3136, 1, 64, 320, 320, 64, 64]
    - [0, 7.14]
  - - [448, 3136, 1, 64, 448, 448, 64, 64]
    - [0, 7.546]
  - - [576, 3136, 1, 64, 576, 576, 64, 64]
    - [0, 7.868]
  - - [704, 3136, 1, 64, 704, 704, 64, 64]
    - [0, 7.992]
  - - [832, 3136, 1, 64, 832, 832, 64, 64]
    - [0, 8.171]
  - - [960, 3136, 1, 64, 960, 960, 64, 64]
    - [0, 7.573]
  - - [1088, 3136, 1, 64, 1088, 1088, 64, 64]
    - [0, 8.008]
  - - [1216, 3136, 1, 64, 1216, 1216, 64, 64]
    - [0, 8.03]
  - - [1344, 3136, 1, 64, 1344, 1344, 64, 64]
    - [0, 8.088]
  - - [1472, 3136, 1, 64, 1472, 1472, 64, 64]
    - [0, 8.233]
  - - [1600, 3136, 1, 64, 1600, 1600, 64, 64]
    - [0, 8.244]
  - - [1728, 3136, 1, 64, 1728, 1728, 64, 64]
    - [0, 8.328]
  - - [1856, 3136, 1, 64, 1856, 1856, 64, 64]
    - [0, 8.3]
  - - [1984, 3136, 1, 64, 1984, 1984, 64, 64]
    - [0, 8.392]
  - - [2112, 3136, 1, 64, 2112, 2112, 64, 64]
    - [0, 8.457]
  - - [2240, 3136, 1, 64, 2240, 2240, 64, 64]
    - [0, 8.501]
  - - [2368, 3136, 1, 64, 2368, 2368, 64, 64]
    - [0, 8.555]
  - - [2496, 3136, 1, 64, 2496, 2496, 64, 64]
    - [0, 8.5]
  - - [2624, 3136, 1, 64, 2624, 2624, 64, 64]
    - [0, 8.575]
  - - [2752, 3136, 1, 64, 2752, 2752, 64, 64]
    - [0, 8.571]
  - - [2880, 3136, 1, 64, 2880, 2880, 64, 64]
    - [0, 8.576]
  - - [3008, 3136, 1, 64, 3008, 3008, 64, 64]
    - [0, 8.628]
  - - [3136, 3136, 1, 64, 3136, 3136, 64, 64]
    - [0, 8.645]
  - - [3264, 3136, 1, 64, 3264, 3264, 64, 64]
    - [0, 8.627]
  - - [3392, 3136, 1, 64, 3392, 3392, 64, 64]
    - [0, 8.729]
  - - [3520, 3136, 1, 64, 3520, 3520, 64, 64]
    - [0, 8.668]
  - - [3648, 3136, 1, 64, 3648, 3648, 64, 64]
    - [0, 8.664]
  - - [3776, 3136, 1, 64, 3776, 3776, 64, 64]
    - [0, 8.671]
  - - [3904, 3136, 1, 64, 3904, 3904, 64, 64]
    - [0, 8.685]
  - - [4032, 3136, 1, 64, 4032, 4032, 64, 64]
    - [0, 8.756]
  - - [64, 3264, 1, 64, 64, 64, 64, 64]
    - [0, 4.13]
  - - [192, 3264, 1, 64, 192, 192, 64, 64]
    - [0, 6.306]
  - - [320, 3264, 1, 64, 320, 320, 64, 64]
    - [0, 7.215]
  - - [448, 3264, 1, 64, 448, 448, 64, 64]
    - [0, 7.558]
  - - [576, 3264, 1, 64, 576, 576, 64, 64]
    - [0, 7.943]
  - - [704, 3264, 1, 64, 704, 704, 64, 64]
    - [0, 8.064]
  - - [832, 3264, 1, 64, 832, 832, 64, 64]
    - [0, 8.259]
  - - [960, 3264, 1, 64, 960, 960, 64, 64]
    - [0, 7.869]
  - - [1088, 3264, 1, 64, 1088, 1088, 64, 64]
    - [0, 7.986]
  - - [1216, 3264, 1, 64, 1216, 1216, 64, 64]
    - [0, 8.132]
  - - [1344, 3264, 1, 64, 1344, 1344, 64, 64]
    - [0, 8.21]
  - - [1472, 3264, 1, 64, 1472, 1472, 64, 64]
    - [0, 8.214]
  - - [1600, 3264, 1, 64, 1600, 1600, 64, 64]
    - [0, 8.394]
  - - [1728, 3264, 1, 64, 1728, 1728, 64, 64]
    - [0, 8.377]
  - - [1856, 3264, 1, 64, 1856, 1856, 64, 64]
    - [0, 8.393]
  - - [1984, 3264, 1, 64, 1984, 1984, 64, 64]
    - [0, 8.444]
  - - [2112, 3264, 1, 64, 2112, 2112, 64, 64]
    - [0, 8.497]
  - - [2240, 3264, 1, 64, 2240, 2240, 64, 64]
    - [0, 8.48]
  - - [2368, 3264, 1, 64, 2368, 2368, 64, 64]
    - [0, 8.571]
  - - [2496, 3264, 1, 64, 2496, 2496, 64, 64]
    - [0, 8.558]
  - - [2624, 3264, 1, 64, 2624, 2624, 64, 64]
    - [0, 8.55]
  - - [2752, 3264, 1, 64, 2752, 2752, 64, 64]
    - [0, 8.579]
  - - [2880, 3264, 1, 64, 2880, 2880, 64, 64]
    - [0, 8.578]
  - - [3008, 3264, 1, 64, 3008, 3008, 64, 64]
    - [0, 8.645]
  - - [3136, 3264, 1, 64, 3136, 3136, 64, 64]
    - [0, 8.638]
  - - [3264, 3264, 1, 64, 3264, 3264, 64, 64]
    - [0, 8.661]
  - - [3392, 3264, 1, 64, 3392, 3392, 64, 64]
    - [0, 8.73]
  - - [3520, 3264, 1, 64, 3520, 3520, 64, 64]
    - [0, 8.657]
  - - [3648, 3264, 1, 64, 3648, 3648, 64, 64]
    - [0, 8.677]
  - - [3776, 3264, 1, 64, 3776, 3776, 64, 64]
    - [0, 8.705]
  - - [3904, 3264, 1, 64, 3904, 3904, 64, 64]
    - [0, 8.755]
  - - [4032, 3264, 1, 64, 4032, 4032, 64, 64]
    - [0, 8.671]
  - - [64, 3392, 1, 64, 64, 64, 64, 64]
    - [0, 4.152]
  - - [192, 3392, 1, 64, 192, 192, 64, 64]
    - [0, 6.341]
  - - [320, 3392, 1, 64, 320, 320, 64, 64]
    - [0, 7.23]
  - - [448, 3392, 1, 64, 448, 448, 64, 64]
    - [0, 7.645]
  - - [576, 3392, 1, 64, 576, 576, 64, 64]
    - [0, 7.898]
  - - [704, 3392, 1, 64, 704, 704, 64, 64]
    - [0, 8.108]
  - - [832, 3392, 1, 64, 832, 832, 64, 64]
    - [0, 8.256]
  - - [960, 3392, 1, 64, 960, 960, 64, 64]
    - [0, 7.905]
  - - [1088, 3392, 1, 64, 1088, 1088, 64, 64]
    - [0, 7.98]
  - - [1216, 3392, 1, 64, 1216, 1216, 64, 64]
    - [0, 8.155]
  - - [1344, 3392, 1, 64, 1344, 1344, 64, 64]
    - [0, 8.271]
  - - [1472, 3392, 1, 64, 1472, 1472, 64, 64]
    - [0, 8.256]
  - - [1600, 3392, 1, 64, 1600, 1600, 64, 64]
    - [0, 8.301]
  - - [1728, 3392, 1, 64, 1728, 1728, 64, 64]
    - [0, 8.474]
  - - [1856, 3392, 1, 64, 1856, 1856, 64, 64]
    - [0, 8.413]
  - - [1984, 3392, 1, 64, 1984, 1984, 64, 64]
    - [0, 8.48]
  - - [2112, 3392, 1, 64, 2112, 2112, 64, 64]
    - [0, 8.513]
  - - [2240, 3392, 1, 64, 2240, 2240, 64, 64]
    - [0, 8.547]
  - - [2368, 3392, 1, 64, 2368, 2368, 64, 64]
    - [0, 8.575]
  - - [2496, 3392, 1, 64, 2496, 2496, 64, 64]
    - [0, 8.541]
  - - [2624, 3392, 1, 64, 2624, 2624, 64, 64]
    - [0, 8.588]
  - - [2752, 3392, 1, 64, 2752, 2752, 64, 64]
    - [0, 8.651]
  - - [2880, 3392, 1, 64, 2880, 2880, 64, 64]
    - [0, 8.651]
  - - [3008, 3392, 1, 64, 3008, 3008, 64, 64]
    - [0, 8.635]
  - - [3136, 3392, 1, 64, 3136, 3136, 64, 64]
    - [0, 8.682]
  - - [3264, 3392, 1, 64, 3264, 3264, 64, 64]
    - [0, 8.634]
  - - [3392, 3392, 1, 64, 3392, 3392, 64, 64]
    - [0, 8.672]
  - - [3520, 3392, 1, 64, 3520, 3520, 64, 64]
    - [0, 8.696]
  - - [3648, 3392, 1, 64, 3648, 3648, 64, 64]
    - [0, 8.682]
  - - [3776, 3392, 1, 64, 3776, 3776, 64, 64]
    - [0, 8.714]
  - - [3904, 3392, 1, 64, 3904, 3904, 64, 64]
    - [0, 8.74]
  - - [4032, 3392, 1, 64, 4032, 4032, 64, 64]
    - [0, 8.719]
  - - [64, 3520, 1, 64, 64, 64, 64, 64]
    - [0, 4.238]
  - - [192, 3520, 1, 64, 192, 192, 64, 64]
    - [0, 6.448]
  - - [320, 3520, 1, 64, 320, 320, 64, 64]
    - [0, 7.246]
  - - [448, 3520, 1, 64, 448, 448, 64, 64]
    - [0, 7.673]
  - - [576, 3520, 1, 64, 576, 576, 64, 64]
    - [0, 8.034]
  - - [704, 3520, 1, 64, 704, 704, 64, 64]
    - [0, 8.179]
  - - [832, 3520, 1, 64, 832, 832, 64, 64]
    - [0, 8.241]
  - - [960, 3520, 1, 64, 960, 960, 64, 64]
    - [0, 7.952]
  - - [1088, 3520, 1, 64, 1088, 1088, 64, 64]
    - [0, 8.103]
  - - [1216, 3520, 1, 64, 1216, 1216, 64, 64]
    - [0, 8.128]
  - - [1344, 3520, 1, 64, 1344, 1344, 64, 64]
    - [0, 8.194]
  - - [1472, 3520, 1, 64, 1472, 1472, 64, 64]
    - [0, 8.224]
  - - [1600, 3520, 1, 64, 1600, 1600, 64, 64]
    - [0, 8.337]
  - - [1728, 3520, 1, 64, 1728, 1728, 64, 64]
    - [0, 8.389]
  - - [1856, 3520, 1, 64, 1856, 1856, 64, 64]
    - [0, 8.347]
  - - [1984, 3520, 1, 64, 1984, 1984, 64, 64]
    - [0, 8.452]
  - - [2112, 3520, 1, 64, 2112, 2112, 64, 64]
    - [0, 8.467]
  - - [2240, 3520, 1, 64, 2240, 2240, 64, 64]
    - [0, 8.513]
  - - [2368, 3520, 1, 64, 2368, 2368, 64, 64]
    - [0, 8.515]
  - - [2496, 3520, 1, 64, 2496, 2496, 64, 64]
    - [0, 8.569]
  - - [2624, 3520, 1, 64, 2624, 2624, 64, 64]
    - [0, 8.579]
  - - [2752, 3520, 1, 64, 2752, 2752, 64, 64]
    - [0, 8.565]
  - - [2880, 3520, 1, 64, 2880, 2880, 64, 64]
    - [0, 8.612]
  - - [3008, 3520, 1, 64, 3008, 3008, 64, 64]
    - [0, 8.628]
  - - [3136, 3520, 1, 64, 3136, 3136, 64, 64]
    - [0, 8.645]
  - - [3264, 3520, 1, 64, 3264, 3264, 64, 64]
    - [0, 8.682]
  - - [3392, 3520, 1, 64, 3392, 3392, 64, 64]
    - [0, 8.668]
  - - [3520, 3520, 1, 64, 3520, 3520, 64, 64]
    - [0, 8.669]
  - - [3648, 3520, 1, 64, 3648, 3648, 64, 64]
    - [0, 8.71]
  - - [3776, 3520, 1, 64, 3776, 3776, 64, 64]
    - [0, 8.733]
  - - [3904, 3520, 1, 64, 3904, 3904, 64, 64]
    - [0, 8.73]
  - - [4032, 3520, 1, 64, 4032, 4032, 64, 64]
    - [0, 8.729]
  - - [64, 3648, 1, 64, 64, 64, 64, 64]
    - [0, 4.347]
  - - [192, 3648, 1, 64, 192, 192, 64, 64]
    - [0, 6.496]
  - - [320, 3648, 1, 64, 320, 320, 64, 64]
    - [0, 7.358]
  - - [448, 3648, 1, 64, 448, 448, 64, 64]
    - [0, 7.726]
  - - [576, 3648, 1, 64, 576, 576, 64, 64]
    - [0, 7.954]
  - - [704, 3648, 1, 64, 704, 704, 64, 64]
    - [0, 8.157]
  - - [832, 3648, 1, 64, 832, 832, 64, 64]
    - [0, 7.628]
  - - [960, 3648, 1, 64, 960, 960, 64, 64]
    - [0, 7.92]
  - - [1088, 3648, 1, 64, 1088, 1088, 64, 64]
    - [0, 8.047]
  - - [1216, 3648, 1, 64, 1216, 1216, 64, 64]
    - [0, 8.184]
  - - [1344, 3648, 1, 64, 1344, 1344, 64, 64]
    - [0, 8.233]
  - - [1472, 3648, 1, 64, 1472, 1472, 64, 64]
    - [0, 8.332]
  - - [1600, 3648, 1, 64, 1600, 1600, 64, 64]
    - [0, 8.318]
  - - [1728, 3648, 1, 64, 1728, 1728, 64, 64]
    - [0, 8.333]
  - - [1856, 3648, 1, 64, 1856, 1856, 64, 64]
    - [0, 8.484]
  - - [1984, 3648, 1, 64, 1984, 1984, 64, 64]
    - [0, 8.365]
  - - [2112, 3648, 1, 64, 2112, 2112, 64, 64]
    - [0, 8.362]
  - - [2240, 3648, 1, 64, 2240, 2240, 64, 64]
    - [0, 8.511]
  - - [2368, 3648, 1, 64, 2368, 2368, 64, 64]
    - [0, 8.523]
  - - [2496, 3648, 1, 64, 2496, 2496, 64, 64]
    - [0, 8.524]
  - - [2624, 3648, 1, 64, 2624, 2624, 64, 64]
    - [0, 8.644]
  - - [2752, 3648, 1, 64, 2752, 2752, 64, 64]
    - [0, 8.638]
  - - [2880, 3648, 1, 64, 2880, 2880, 64, 64]
    - [0, 8.625]
  - - [3008, 3648, 1, 64, 3008, 3008, 64, 64]
    - [0, 8.683]
  - - [3136, 3648, 1, 64, 3136, 3136, 64, 64]
    - [0, 8.643]
  - - [3264, 3648, 1, 64, 3264, 3264, 64, 64]
    - [0, 8.667]
  - - [3392, 3648, 1, 64, 3392, 3392, 64, 64]
    - [0, 8.724]
  - - [3520, 3648, 1, 64, 3520, 3520, 64, 64]
    - [0, 8.709]
  - - [3648, 3648, 1, 64, 3648, 3648, 64, 64]
    - [0, 8.711]
  - - [3776, 3648, 1, 64, 3776, 3776, 64, 64]
    - [0, 8.728]
  - - [3904, 3648, 1, 64, 3904, 3904, 64, 64]
    - [0, 8.692]
  - - [4032, 3648, 1, 64, 4032, 4032, 64, 64]
    - [0, 8.755]
  - - [64, 3776, 1, 64, 64, 64, 64, 64]
    - [0, 4.49]
  - - [192, 3776, 1, 64, 192, 192, 64, 64]
    - [0, 6.541]
  - - [320, 3776, 1, 64, 320, 320, 64, 64]
    - [0, 7.4]
  - - [448, 3776, 1, 64, 448, 448, 64, 64]
    - [0, 7.751]
  - - [576, 3776, 1, 64, 576, 576, 64, 64]
    - [0, 7.946]
  - - [704, 3776, 1, 64, 704, 704, 64, 64]
    - [0, 8.238]
  - - [832, 3776, 1, 64, 832, 832, 64, 64]
    - [0, 7.867]
  - - [960, 3776, 1, 64, 960, 960, 64, 64]
    - [0, 8.022]
  - - [1088, 3776, 1, 64, 1088, 1088, 64, 64]
    - [0, 8.126]
  - - [1216, 3776, 1, 64, 1216, 1216, 64, 64]
    - [0, 8.254]
  - - [1344, 3776, 1, 64, 1344, 1344, 64, 64]
    - [0, 8.195]
  - - [1472, 3776, 1, 64, 1472, 1472, 64, 64]
    - [0, 8.374]
  - - [1600, 3776, 1, 64, 1600, 1600, 64, 64]
    - [0, 8.333]
  - - [1728, 3776, 1, 64, 1728, 1728, 64, 64]
    - [0, 8.372]
  - - [1856, 3776, 1, 64, 1856, 1856, 64, 64]
    - [0, 8.405]
  - - [1984, 3776, 1, 64, 1984, 1984, 64, 64]
    - [0, 8.518]
  - - [2112, 3776, 1, 64, 2112, 2112, 64, 64]
    - [0, 8.522]
  - - [2240, 3776, 1, 64, 2240, 2240, 64, 64]
    - [0, 8.521]
  - - [2368, 3776, 1, 64, 2368, 2368, 64, 64]
    - [0, 8.523]
  - - [2496, 3776, 1, 64, 2496, 2496, 64, 64]
    - [0, 8.618]
  - - [2624, 3776, 1, 64, 2624, 2624, 64, 64]
    - [0, 8.571]
  - - [2752, 3776, 1, 64, 2752, 2752, 64, 64]
    - [0, 8.633]
  - - [2880, 3776, 1, 64, 2880, 2880, 64, 64]
    - [0, 8.654]
  - - [3008, 3776, 1, 64, 3008, 3008, 64, 64]
    - [0, 8.727]
  - - [3136, 3776, 1, 64, 3136, 3136, 64, 64]
    - [0, 8.757]
  - - [3264, 3776, 1, 64, 3264, 3264, 64, 64]
    - [0, 8.702]
  - - [3392, 3776, 1, 64, 3392, 3392, 64, 64]
    - [0, 8.692]
  - - [3520, 3776, 1, 64, 3520, 3520, 64, 64]
    - [0, 8.649]
  - - [3648, 3776, 1, 64, 3648, 3648, 64, 64]
    - [0, 8.723]
  - - [3776, 3776, 1, 64, 3776, 3776, 64, 64]
    - [0, 8.74]
  - - [3904, 3776, 1, 64, 3904, 3904, 64, 64]
    - [0, 8.772]
  - - [4032, 3776, 1, 64, 4032, 4032, 64, 64]
    - [0, 8.795]
  - - [64, 3904, 1, 64, 64, 64, 64, 64]
    - [0, 4.417]
  - - [192, 3904, 1, 64, 192, 192, 64, 64]
    - [0, 6.613]
  - - [320, 3904, 1, 64, 320, 320, 64, 64]
    - [0, 7.482]
  - - [448, 3904, 1, 64, 448, 448, 64, 64]
    - [0, 7.834]
  - - [576, 3904, 1, 64, 576, 576, 64, 64]
    - [0, 8.052]
  - - [704, 3904, 1, 64, 704, 704, 64, 64]
    - [0, 8.24]
  - - [832, 3904, 1, 64, 832, 832, 64, 64]
    - [0, 7.8]
  - - [960, 3904, 1, 64, 960, 960, 64, 64]
    - [0, 8.091]
  - - [1088, 3904, 1, 64, 1088, 1088, 64, 64]
    - [0, 8.111]
  - - [1216, 3904, 1, 64, 1216, 1216, 64, 64]
    - [0, 8.238]
  - - [1344, 3904, 1, 64, 1344, 1344, 64, 64]
    - [0, 8.332]
  - - [1472, 3904, 1, 64, 1472, 1472, 64, 64]
    - [0, 8.389]
  - - [1600, 3904, 1, 64, 1600, 1600, 64, 64]
    - [0, 8.49]
  - - [1728, 3904, 1, 64, 1728, 1728, 64, 64]
    - [0, 8.457]
  - - [1856, 3904, 1, 64, 1856, 1856, 64, 64]
    - [0, 8.527]
  - - [1984, 3904, 1, 64, 1984, 1984, 64, 64]
    - [0, 8.516]
  - - [2112, 3904, 1, 64, 2112, 2112, 64, 64]
    - [0, 8.577]
  - - [2240, 3904, 1, 64, 2240, 2240, 64, 64]
    - [0, 8.557]
  - - [2368, 3904, 1, 64, 2368, 2368, 64, 64]
    - [0, 8.545]
  - - [2496, 3904, 1, 64, 2496, 2496, 64, 64]
    - [0, 8.663]
  - - [2624, 3904, 1, 64, 2624, 2624, 64, 64]
    - [0, 8.674]
  - - [2752, 3904, 1, 64, 2752, 2752, 64, 64]
    - [0, 8.68]
  - - [2880, 3904, 1, 64, 2880, 2880, 64, 64]
    - [0, 8.666]
  - - [3008, 3904, 1, 64, 3008, 3008, 64, 64]
    - [0, 8.632]
  - - [3136, 3904, 1, 64, 3136, 3136, 64, 64]
    - [0, 8.707]
  - - [3264, 3904, 1, 64, 3264, 3264, 64, 64]
    - [0, 8.732]
  - - [3392, 3904, 1, 64, 3392, 3392, 64, 64]
    - [0, 8.709]
  - - [3520, 3904, 1, 64, 3520, 3520, 64, 64]
    - [0, 8.771]
  - - [3648, 3904, 1, 64, 3648, 3648, 64, 64]
    - [0, 8.691]
  - - [3776, 3904, 1, 64, 3776, 3776, 64, 64]
    - [0, 8.802]
  - - [3904, 3904, 1, 64, 3904, 3904, 64, 64]
    - [0, 8.693]
  - - [4032, 3904, 1, 64, 4032, 4032, 64, 64]
    - [0, 8.764]
  - - [64, 4032, 1, 64, 64, 64, 64, 64]
    - [0, 4.519]
  - - [192, 4032, 1, 64, 192, 192, 64, 64]
    - [0, 6.684]
  - - [320, 4032, 1, 64, 320, 320, 64, 64]
    - [0, 7.453]
  - - [448, 4032, 1, 64, 448, 448, 64, 64]
    - [0, 7.846]
  - - [576, 4032, 1, 64, 576, 576, 64, 64]
    - [0, 7.992]
  - - [704, 4032, 1, 64, 704, 704, 64, 64]
    - [0, 8.259]
  - - [832, 4032, 1, 64, 832, 832, 64, 64]
    - [0, 7.961]
  - - [960, 4032, 1, 64, 960, 960, 64, 64]
    - [0, 7.977]
  - - [1088, 4032, 1, 64, 1088, 1088, 64, 64]
    - [0, 8.217]
  - - [1216, 4032, 1, 64, 1216, 1216, 64, 64]
    - [0, 8.208]
  - - [1344, 4032, 1, 64, 1344, 1344, 64, 64]
    - [0, 8.306]
  - - [1472, 4032, 1, 64, 1472, 1472, 64, 64]
    - [0, 8.424]
  - - [1600, 4032, 1, 64, 1600, 1600, 64, 64]
    - [0, 8.41]
  - - [1728, 4032, 1, 64, 1728, 1728, 64, 64]
    - [0, 8.421]
  - - [1856, 4032, 1, 64, 1856, 1856, 64, 64]
    - [0, 8.459]
  - - [1984, 4032, 1, 64, 1984, 1984, 64, 64]
    - [0, 8.543]
  - - [2112, 4032, 1, 64, 2112, 2112, 64, 64]
    - [0, 8.517]
  - - [2240, 4032, 1, 64, 2240, 2240, 64, 64]
    - [0, 8.645]
  - - [2368, 4032, 1, 64, 2368, 2368, 64, 64]
    - [0, 8.544]
  - - [2496, 4032, 1, 64, 2496, 2496, 64, 64]
    - [0, 8.639]
  - - [2624, 4032, 1, 64, 2624, 2624, 64, 64]
    - [0, 8.606]
  - - [2752, 4032, 1, 64, 2752, 2752, 64, 64]
    - [0, 8.644]
  - - [2880, 4032, 1, 64, 2880, 2880, 64, 64]
    - [0, 8.688]
  - - [3008, 4032, 1, 64, 3008, 3008, 64, 64]
    - [0, 8.707]
  - - [3136, 4032, 1, 64, 3136, 3136, 64, 64]
    - [0, 8.728]
  - - [3264, 4032, 1, 64, 3264, 3264, 64, 64]
    - [0, 8.732]
  - - [3392, 4032, 1, 64, 3392, 3392, 64, 64]
    - [0, 8.656]
  - - [3520, 4032, 1, 64, 3520, 3520, 64, 64]
    - [0, 8.682]
  - - [3648, 4032, 1, 64, 3648, 3648, 64, 64]
    - [0, 8.728]
  - - [3776, 4032, 1, 64, 3776, 3776, 64, 64]
    - [0, 8.766]
  - - [3904, 4032, 1, 64, 3904, 3904, 64, 64]
    - [0, 8.73]
  - - [4032, 4032, 1, 64, 4032, 4032, 64, 64]
    - [0, 8.81]
  - - [64, 64, 1, 256, 64, 64, 256, 256]
    - [1, 0.499]
  - - [192, 64, 1, 256, 192, 192, 256, 256]
    - [2, 1.369]
  - - [320, 64, 1, 256, 320, 320, 256, 256]
    - [0, 2.05]
  - - [448, 64, 1, 256, 448, 448, 256, 256]
    - [0, 2.86]
  - - [576, 64, 1, 256, 576, 576, 256, 256]
    - [0, 2.785]
  - - [704, 64, 1, 256, 704, 704, 256, 256]
    - [0, 3.382]
  - - [832, 64, 1, 256, 832, 832, 256, 256]
    - [0, 3.999]
  - - [960, 64, 1, 256, 960, 960, 256, 256]
    - [0, 4.512]
  - - [1088, 64, 1, 256, 1088, 1088, 256, 256]
    - [0, 4.138]
  - - [1216, 64, 1, 256, 1216, 1216, 256, 256]
    - [0, 4.597]
  - - [1344, 64, 1, 256, 1344, 1344, 256, 256]
    - [0, 5.094]
  - - [1472, 64, 1, 256, 1472, 1472, 256, 256]
    - [0, 4.702]
  - - [1600, 64, 1, 256, 1600, 1600, 256, 256]
    - [0, 5.044]
  - - [1728, 64, 1, 256, 1728, 1728, 256, 256]
    - [0, 5.443]
  - - [1856, 64, 1, 256, 1856, 1856, 256, 256]
    - [0, 5.852]
  - - [1984, 64, 1, 256, 1984, 1984, 256, 256]
    - [0, 5.407]
  - - [2112, 64, 1, 256, 2112, 2112, 256, 256]
    - [0, 5.719]
  - - [2240, 64, 1, 256, 2240, 2240, 256, 256]
    - [0, 6.004]
  - - [2368, 64, 1, 256, 2368, 2368, 256, 256]
    - [0, 6.333]
  - - [2496, 64, 1, 256, 2496, 2496, 256, 256]
    - [0, 5.918]
  - - [2624, 64, 1, 256, 2624, 2624, 256, 256]
    - [0, 6.142]
  - - [2752, 64, 1, 256, 2752, 2752, 256, 256]
    - [0, 6.441]
  - - [2880, 64, 1, 256, 2880, 2880, 256, 256]
    - [0, 6.707]
  - - [3008, 64, 1, 256, 3008, 3008, 256, 256]
    - [0, 6.273]
  - - [3136, 64, 1, 256, 3136, 3136, 256, 256]
    - [0, 6.507]
  - - [3264, 64, 1, 256, 3264, 3264, 256, 256]
    - [0, 6.767]
  - - [3392, 64, 1, 256, 3392, 3392, 256, 256]
    - [0, 6.423]
  - - [3520, 64, 1, 256, 3520, 3520, 256, 256]
    - [0, 6.585]
  - - [3648, 64, 1, 256, 3648, 3648, 256, 256]
    - [0, 6.805]
  - - [3776, 64, 1, 256, 3776, 3776, 256, 256]
    - [0, 7.023]
  - - [3904, 64, 1, 256, 3904, 3904, 256, 256]
    - [0, 6.759]
  - - [4032, 64, 1, 256, 4032, 4032, 256, 256]
    - [0, 6.913]
  - - [64, 192, 1, 256, 64, 64, 256, 256]
    - [2, 1.379]
  - - [192, 192, 1, 256, 192, 192, 256, 256]
    - [0, 2.802]
  - - [320, 192, 1, 256, 320, 320, 256, 256]
    - [0, 4.625]
  - - [448, 192, 1, 256, 448, 448, 256, 256]
    - [0, 5.102]
  - - [576, 192, 1, 256, 576, 576, 256, 256]
    - [0, 5.453]
  - - [704, 192, 1, 256, 704, 704, 256, 256]
    - [0, 5.717]
  - - [832, 192, 1, 256, 832, 832, 256, 256]
    - [0, 5.908]
  - - [960, 192, 1, 256, 960, 960, 256, 256]
    - [0, 6.746]
  - - [1088, 192, 1, 256, 1088, 1088, 256, 256]
    - [0, 6.808]
  - - [1216, 192, 1, 256, 1216, 1216, 256, 256]
    - [0, 6.836]
  - - [1344, 192, 1, 256, 1344, 1344, 256, 256]
    - [0, 6.91]
  - - [1472, 192, 1, 256, 1472, 1472, 256, 256]
    - [0, 6.954]
  - - [1600, 192, 1, 256, 1600, 1600, 256, 256]
    - [0, 7.442]
  - - [1728, 192, 1, 256, 1728, 1728, 256, 256]
    - [0, 7.445]
  - - [1856, 192, 1, 256, 1856, 1856, 256, 256]
    - [0, 7.441]
  - - [1984, 192, 1, 256, 1984, 1984, 256, 256]
    - [0, 7.497]
  - - [2112, 192, 1, 256, 2112, 2112, 256, 256]
    - [0, 7.471]
  - - [2240, 192, 1, 256, 2240, 2240, 256, 256]
    - [0, 7.544]
  - - [2368, 192, 1, 256, 2368, 2368, 256, 256]
    - [0, 7.724]
  - - [2496, 192, 1, 256, 2496, 2496, 256, 256]
    - [0, 7.736]
  - - [2624, 192, 1, 256, 2624, 2624, 256, 256]
    - [0, 7.826]
  - - [2752, 192, 1, 256, 2752, 2752, 256, 256]
    - [0, 7.771]
  - - [2880, 192, 1, 256, 2880, 2880, 256, 256]
    - [0, 7.784]
  - - [3008, 192, 1, 256, 3008, 3008, 256, 256]
    - [0, 7.911]
  - - [3136, 192, 1, 256, 3136, 3136, 256, 256]
    - [0, 7.949]
  - - [3264, 192, 1, 256, 3264, 3264, 256, 256]
    - [0, 8.016]
  - - [3392, 192, 1, 256, 3392, 3392, 256, 256]
    - [0, 7.942]
  - - [3520, 192, 1, 256, 3520, 3520, 256, 256]
    - [0, 7.984]
  - - [3648, 192, 1, 256, 3648, 3648, 256, 256]
    - [0, 8.075]
  - - [3776, 192, 1, 256, 3776, 3776, 256, 256]
    - [0, 8.188]
  - - [3904, 192, 1, 256, 3904, 3904, 256, 256]
    - [0, 7.542]
  - - [4032, 192, 1, 256, 4032, 4032, 256, 256]
    - [0, 7.751]
  - - [64, 320, 1, 256, 64, 64, 256, 256]
    - [0, 2.068]
  - - [192, 320, 1, 256, 192, 192, 256, 256]
    - [0, 4.629]
  - - [320, 320, 1, 256, 320, 320, 256, 256]
    - [0, 5.059]
  - - [448, 320, 1, 256, 448, 448, 256, 256]
    - [0, 6.033]
  - - [576, 320, 1, 256, 576, 576, 256, 256]
    - [0, 6.752]
  - - [704, 320, 1, 256, 704, 704, 256, 256]
    - [0, 6.657]
  - - [832, 320, 1, 256, 832, 832, 256, 256]
    - [0, 7.121]
  - - [960, 320, 1, 256, 960, 960, 256, 256]
    - [0, 7.375]
  - - [1088, 320, 1, 256, 1088, 1088, 256, 256]
    - [0, 7.318]
  - - [1216, 320, 1, 256, 1216, 1216, 256, 256]
    - [0, 7.619]
  - - [1344, 320, 1, 256, 1344, 1344, 256, 256]
    - [0, 7.609]
  - - [1472, 320, 1, 256, 1472, 1472, 256, 256]
    - [0, 7.705]
  - - [1600, 320, 1, 256, 1600, 1600, 256, 256]
    - [0, 7.804]
  - - [1728, 320, 1, 256, 1728, 1728, 256, 256]
    - [0, 7.856]
  - - [1856, 320, 1, 256, 1856, 1856, 256, 256]
    - [0, 7.939]
  - - [1984, 320, 1, 256, 1984, 1984, 256, 256]
    - [0, 8.092]
  - - [2112, 320, 1, 256, 2112, 2112, 256, 256]
    - [0, 7.987]
  - - [2240, 320, 1, 256, 2240, 2240, 256, 256]
    - [0, 8.107]
  - - [2368, 320, 1, 256, 2368, 2368, 256, 256]
    - [0, 7.623]
  - - [2496, 320, 1, 256, 2496, 2496, 256, 256]
    - [0, 7.751]
  - - [2624, 320, 1, 256, 2624, 2624, 256, 256]
    - [0, 7.846]
  - - [2752, 320, 1, 256, 2752, 2752, 256, 256]
    - [0, 7.959]
  - - [2880, 320, 1, 256, 2880, 2880, 256, 256]
    - [0, 7.902]
  - - [3008, 320, 1, 256, 3008, 3008, 256, 256]
    - [0, 7.96]
  - - [3136, 320, 1, 256, 3136, 3136, 256, 256]
    - [0, 7.961]
  - - [3264, 320, 1, 256, 3264, 3264, 256, 256]
    - [0, 8.049]
  - - [3392, 320, 1, 256, 3392, 3392, 256, 256]
    - [0, 8.079]
  - - [3520, 320, 1, 256, 3520, 3520, 256, 256]
    - [0, 8.14]
  - - [3648, 320, 1, 256, 3648, 3648, 256, 256]
    - [0, 8.218]
  - - [3776, 320, 1, 256, 3776, 3776, 256, 256]
    - [0, 8.175]
  - - [3904, 320, 1, 256, 3904, 3904, 256, 256]
    - [0, 8.249]
  - - [4032, 320, 1, 256, 4032, 4032, 256, 256]
    - [0, 8.181]
  - - [64, 448, 1, 256, 64, 64, 256, 256]
    - [0, 2.096]
  - - [192, 448, 1, 256, 192, 192, 256, 256]
    - [0, 5.141]
  - - [320, 448, 1, 256, 320, 320, 256, 256]
    - [0, 6.048]
  - - [448, 448, 1, 256, 448, 448, 256, 256]
    - [0, 6.551]
  - - [576, 448, 1, 256, 576, 576, 256, 256]
    - [0, 6.945]
  - - [704, 448, 1, 256, 704, 704, 256, 256]
    - [0, 7.183]
  - - [832, 448, 1, 256, 832, 832, 256, 256]
    - [0, 7.363]
  - - [960, 448, 1, 256, 960, 960, 256, 256]
    - [0, 7.508]
  - - [1088, 448, 1, 256, 1088, 1088, 256, 256]
    - [0, 7.749]
  - - [1216, 448, 1, 256, 1216, 1216, 256, 256]
    - [0, 7.876]
  - - [1344, 448, 1, 256, 1344, 1344, 256, 256]
    - [0, 7.957]
  - - [1472, 448, 1, 256, 1472, 1472, 256, 256]
    - [0, 8.079]
  - - [1600, 448, 1, 256, 1600, 1600, 256, 256]
    - [0, 8.119]
  - - [1728, 448, 1, 256, 1728, 1728, 256, 256]
    - [0, 7.757]
  - - [1856, 448, 1, 256, 1856, 1856, 256, 256]
    - [0, 7.852]
  - - [1984, 448, 1, 256, 1984, 1984, 256, 256]
    - [0, 7.852]
  - - [2112, 448, 1, 256, 2112, 2112, 256, 256]
    - [0, 7.938]
  - - [2240, 448, 1, 256, 2240, 2240, 256, 256]
    - [0, 8.039]
  - - [2368, 448, 1, 256, 2368, 2368, 256, 256]
    - [0, 7.97]
  - - [2496, 448, 1, 256, 2496, 2496, 256, 256]
    - [0, 8.118]
  - - [2624, 448, 1, 256, 2624, 2624, 256, 256]
    - [0, 8.152]
  - - [2752, 448, 1, 256, 2752, 2752, 256, 256]
    - [0, 8.152]
  - - [2880, 448, 1, 256, 2880, 2880, 256, 256]
    - [0, 8.182]
  - - [3008, 448, 1, 256, 3008, 3008, 256, 256]
    - [0, 8.205]
  - - [3136, 448, 1, 256, 3136, 3136, 256, 256]
    - [0, 8.233]
  - - [3264, 448, 1, 256, 3264, 3264, 256, 256]
    - [0, 8.349]
  - - [3392, 448, 1, 256, 3392, 3392, 256, 256]
    - [0, 8.344]
  - - [3520, 448, 1, 256, 3520, 3520, 256, 256]
    - [0, 8.36]
  - - [3648, 448, 1, 256, 3648, 3648, 256, 256]
    - [0, 8.368]
  - - [3776, 448, 1, 256, 3776, 3776, 256, 256]
    - [0, 8.386]
  - - [3904, 448, 1, 256, 3904, 3904, 256, 256]
    - [0, 8.493]
  - - [4032, 448, 1, 256, 4032, 4032, 256, 256]
    - [0, 8.398]
  - - [64, 576, 1, 256, 64, 64, 256, 256]
    - [0, 2.711]
  - - [192, 576, 1, 256, 192, 192, 256, 256]
    - [0, 5.444]
  - - [320, 576, 1, 256, 320, 320, 256, 256]
    - [0, 6.756]
  - - [448, 576, 1, 256, 448, 448, 256, 256]
    - [0, 6.937]
  - - [576, 576, 1, 256, 576, 576, 256, 256]
    - [0, 7.391]
  - - [704, 576, 1, 256, 704, 704, 256, 256]
    - [0, 7.513]
  - - [832, 576, 1, 256, 832, 832, 256, 256]
    - [0, 7.802]
  - - [960, 576, 1, 256, 960, 960, 256, 256]
    - [0, 7.83]
  - - [1088, 576, 1, 256, 1088, 1088, 256, 256]
    - [0, 8.024]
  - - [1216, 576, 1, 256, 1216, 1216, 256, 256]
    - [0, 8.062]
  - - [1344, 576, 1, 256, 1344, 1344, 256, 256]
    - [0, 7.736]
  - - [1472, 576, 1, 256, 1472, 1472, 256, 256]
    - [0, 7.83]
  - - [1600, 576, 1, 256, 1600, 1600, 256, 256]
    - [0, 7.868]
  - - [1728, 576, 1, 256, 1728, 1728, 256, 256]
    - [0, 8.014]
  - - [1856, 576, 1, 256, 1856, 1856, 256, 256]
    - [0, 8.154]
  - - [1984, 576, 1, 256, 1984, 1984, 256, 256]
    - [0, 8.116]
  - - [2112, 576, 1, 256, 2112, 2112, 256, 256]
    - [0, 8.226]
  - - [2240, 576, 1, 256, 2240, 2240, 256, 256]
    - [0, 8.181]
  - - [2368, 576, 1, 256, 2368, 2368, 256, 256]
    - [0, 8.277]
  - - [2496, 576, 1, 256, 2496, 2496, 256, 256]
    - [0, 8.354]
  - - [2624, 576, 1, 256, 2624, 2624, 256, 256]
    - [0, 8.304]
  - - [2752, 576, 1, 256, 2752, 2752, 256, 256]
    - [0, 8.279]
  - - [2880, 576, 1, 256, 2880, 2880, 256, 256]
    - [0, 8.332]
  - - [3008, 576, 1, 256, 3008, 3008, 256, 256]
    - [0, 8.414]
  - - [3136, 576, 1, 256, 3136, 3136, 256, 256]
    - [0, 8.381]
  - - [3264, 576, 1, 256, 3264, 3264, 256, 256]
    - [0, 8.445]
  - - [3392, 576, 1, 256, 3392, 3392, 256, 256]
    - [0, 8.461]
  - - [3520, 576, 1, 256, 3520, 3520, 256, 256]
    - [0, 8.528]
  - - [3648, 576, 1, 256, 3648, 3648, 256, 256]
    - [0, 8.506]
  - - [3776, 576, 1, 256, 3776, 3776, 256, 256]
    - [0, 8.557]
  - - [3904, 576, 1, 256, 3904, 3904, 256, 256]
    - [0, 8.543]
  - - [4032, 576, 1, 256, 4032, 4032, 256, 256]
    - [0, 8.544]
  - - [64, 704, 1, 256, 64, 64, 256, 256]
    - [0, 3.396]
  - - [192, 704, 1, 256, 192, 192, 256, 256]
    - [0, 5.704]
  - - [320, 704, 1, 256, 320, 320, 256, 256]
    - [0, 6.643]
  - - [448, 704, 1, 256, 448, 448, 256, 256]
    - [0, 7.162]
  - - [576, 704, 1, 256, 576, 576, 256, 256]
    - [0, 7.465]
  - - [704, 704, 1, 256, 704, 704, 256, 256]
    - [0, 7.711]
  - - [832, 704, 1, 256, 832, 832, 256, 256]
    - [0, 7.904]
  - - [960, 704, 1, 256, 960, 960, 256, 256]
    - [0, 7.99]
  - - [1088, 704, 1, 256, 1088, 1088, 256, 256]
    - [0, 7.682]
  - - [1216, 704, 1, 256, 1216, 1216, 256, 256]
    - [0, 7.823]
  - - [1344, 704, 1, 256, 1344, 1344, 256, 256]
    - [0, 7.891]
  - - [1472, 704, 1, 256, 1472, 1472, 256, 256]
    - [0, 7.98]
  - - [1600, 704, 1, 256, 1600, 1600, 256, 256]
    - [0, 8.027]
  - - [1728, 704, 1, 256, 1728, 1728, 256, 256]
    - [0, 8.212]
  - - [1856, 704, 1, 256, 1856, 1856, 256, 256]
    - [0, 8.25]
  - - [1984, 704, 1, 256, 1984, 1984, 256, 256]
    - [0, 8.295]
  - - [2112, 704, 1, 256, 2112, 2112, 256, 256]
    - [0, 8.319]
  - - [2240, 704, 1, 256, 2240, 2240, 256, 256]
    - [0, 8.354]
  - - [2368, 704, 1, 256, 2368, 2368, 256, 256]
    - [0, 8.379]
  - - [2496, 704, 1, 256, 2496, 2496, 256, 256]
    - [0, 8.372]
  - - [2624, 704, 1, 256, 2624, 2624, 256, 256]
    - [0, 8.487]
  - - [2752, 704, 1, 256, 2752, 2752, 256, 256]
    - [0, 8.448]
  - - [2880, 704, 1, 256, 2880, 2880, 256, 256]
    - [0, 8.555]
  - - [3008, 704, 1, 256, 3008, 3008, 256, 256]
    - [0, 8.454]
  - - [3136, 704, 1, 256, 3136, 3136, 256, 256]
    - [0, 8.488]
  - - [3264, 704, 1, 256, 3264, 3264, 256, 256]
    - [0, 8.5]
  - - [3392, 704, 1, 256, 3392, 3392, 256, 256]
    - [0, 8.563]
  - - [3520, 704, 1, 256, 3520, 3520, 256, 256]
    - [0, 8.589]
  - - [3648, 704, 1, 256, 3648, 3648, 256, 256]
    - [0, 8.536]
  - - [3776, 704, 1, 256, 3776, 3776, 256, 256]
    - [0, 8.628]
  - - [3904, 704, 1, 256, 3904, 3904, 256, 256]
    - [0, 8.644]
  - - [4032, 704, 1, 256, 4032, 4032, 256, 256]
    - [0, 8.644]
  - - [64, 832, 1, 256, 64, 64, 256, 256]
    - [0, 4.028]
  - - [192, 832, 1, 256, 192, 192, 256, 256]
    - [0, 5.927]
  - - [320, 832, 1, 256, 320, 320, 256, 256]
    - [0, 7.116]
  - - [448, 832, 1, 256, 448, 448, 256, 256]
    - [0, 7.38]
  - - [576, 832, 1, 256, 576, 576, 256, 256]
    - [0, 7.783]
  - - [704, 832, 1, 256, 704, 704, 256, 256]
    - [0, 7.856]
  - - [832, 832, 1, 256, 832, 832, 256, 256]
    - [0, 8.171]
  - - [960, 832, 1, 256, 960, 960, 256, 256]
    - [0, 7.701]
  - - [1088, 832, 1, 256, 1088, 1088, 256, 256]
    - [0, 7.943]
  - - [1216, 832, 1, 256, 1216, 1216, 256, 256]
    - [0, 7.991]
  - - [1344, 832, 1, 256, 1344, 1344, 256, 256]
    - [0, 8.109]
  - - [1472, 832, 1, 256, 1472, 1472, 256, 256]
    - [0, 8.275]
  - - [1600, 832, 1, 256, 1600, 1600, 256, 256]
    - [0, 8.262]
  - - [1728, 832, 1, 256, 1728, 1728, 256, 256]
    - [0, 8.247]
  - - [1856, 832, 1, 256, 1856, 1856, 256, 256]
    - [0, 8.266]
  - - [1984, 832, 1, 256, 1984, 1984, 256, 256]
    - [0, 8.343]
  - - [2112, 832, 1, 256, 2112, 2112, 256, 256]
    - [0, 8.441]
  - - [2240, 832, 1, 256, 2240, 2240, 256, 256]
    - [0, 8.484]
  - - [2368, 832, 1, 256, 2368, 2368, 256, 256]
    - [0, 8.449]
  - - [2496, 832, 1, 256, 2496, 2496, 256, 256]
    - [0, 8.451]
  - - [2624, 832, 1, 256, 2624, 2624, 256, 256]
    - [0, 8.574]
  - - [2752, 832, 1, 256, 2752, 2752, 256, 256]
    - [0, 8.578]
  - - [2880, 832, 1, 256, 2880, 2880, 256, 256]
    - [0, 8.604]
  - - [3008, 832, 1, 256, 3008, 3008, 256, 256]
    - [0, 8.557]
  - - [3136, 832, 1, 256, 3136, 3136, 256, 256]
    - [0, 8.6]
  - - [3264, 832, 1, 256, 3264, 3264, 256, 256]
    - [0, 8.579]
  - - [3392, 832, 1, 256, 3392, 3392, 256, 256]
    - [0, 8.631]
  - - [3520, 832, 1, 256, 3520, 3520, 256, 256]
    - [0, 8.687]
  - - [3648, 832, 1, 256, 3648, 3648, 256, 256]
    - [0, 8.627]
  - - [3776, 832, 1, 256, 3776, 3776, 256, 256]
    - [0, 8.677]
  - - [3904, 832, 1, 256, 3904, 3904, 256, 256]
    - [0, 8.661]
  - - [4032, 832, 1, 256, 4032, 4032, 256, 256]
    - [0, 8.624]
  - - [64, 960, 1, 256, 64, 64, 256, 256]
    - [0, 4.624]
  - - [192, 960, 1, 256, 192, 192, 256, 256]
    - [0, 6.746]
  - - [320, 960, 1, 256, 320, 320, 256, 256]
    - [0, 7.451]
  - - [448, 960, 1, 256, 448, 448, 256, 256]
    - [0, 7.575]
  - - [576, 960, 1, 256, 576, 576, 256, 256]
    - [0, 7.845]
  - - [704, 960, 1, 256, 704, 704, 256, 256]
    - [0, 8.006]
  - - [832, 960, 1, 256, 832, 832, 256, 256]
    - [0, 7.809]
  - - [960, 960, 1, 256, 960, 960, 256, 256]
    - [0, 7.881]
  - - [1088, 960, 1, 256, 1088, 1088, 256, 256]
    - [0, 7.986]
  - - [1216, 960, 1, 256, 1216, 1216, 256, 256]
    - [0, 8.113]
  - - [1344, 960, 1, 256, 1344, 1344, 256, 256]
    - [0, 8.221]
  - - [1472, 960, 1, 256, 1472, 1472, 256, 256]
    - [0, 8.236]
  - - [1600, 960, 1, 256, 1600, 1600, 256, 256]
    - [0, 8.334]
  - - [1728, 960, 1, 256, 1728, 1728, 256, 256]
    - [0, 8.347]
  - - [1856, 960, 1, 256, 1856, 1856, 256, 256]
    - [0, 8.411]
  - - [1984, 960, 1, 256, 1984, 1984, 256, 256]
    - [0, 8.42]
  - - [2112, 960, 1, 256, 2112, 2112, 256, 256]
    - [0, 8.416]
  - - [2240, 960, 1, 256, 2240, 2240, 256, 256]
    - [0, 8.542]
  - - [2368, 960, 1, 256, 2368, 2368, 256, 256]
    - [0, 8.418]
  - - [2496, 960, 1, 256, 2496, 2496, 256, 256]
    - [0, 8.553]
  - - [2624, 960, 1, 256, 2624, 2624, 256, 256]
    - [0, 8.561]
  - - [2752, 960, 1, 256, 2752, 2752, 256, 256]
    - [0, 8.589]
  - - [2880, 960, 1, 256, 2880, 2880, 256, 256]
    - [0, 8.634]
  - - [3008, 960, 1, 256, 3008, 3008, 256, 256]
    - [0, 8.628]
  - - [3136, 960, 1, 256, 3136, 3136, 256, 256]
    - [0, 8.682]
  - - [3264, 960, 1, 256, 3264, 3264, 256, 256]
    - [0, 8.716]
  - - [3392, 960, 1, 256, 3392, 3392, 256, 256]
    - [0, 8.661]
  - - [3520, 960, 1, 256, 3520, 3520, 256, 256]
    - [0, 8.684]
  - - [3648, 960, 1, 256, 3648, 3648, 256, 256]
    - [0, 8.67]
  - - [3776, 960, 1, 256, 3776, 3776, 256, 256]
    - [0, 8.698]
  - - [3904, 960, 1, 256, 3904, 3904, 256, 256]
    - [0, 8.687]
  - - [4032, 960, 1, 256, 4032, 4032, 256, 256]
    - [0, 8.797]
  - - [64, 1088, 1, 256, 64, 64, 256, 256]
    - [0, 4.162]
  - - [192, 1088, 1, 256, 192, 192, 256, 256]
    - [0, 6.712]
  - - [320, 1088, 1, 256, 320, 320, 256, 256]
    - [0, 7.342]
  - - [448, 1088, 1, 256, 448, 448, 256, 256]
    - [0, 7.659]
  - - [576, 1088, 1, 256, 576, 576, 256, 256]
    - [0, 8.021]
  - - [704, 1088, 1, 256, 704, 704, 256, 256]
    - [0, 7.68]
  - - [832, 1088, 1, 256, 832, 832, 256, 256]
    - [0, 7.946]
  - - [960, 1088, 1, 256, 960, 960, 256, 256]
    - [0, 8.012]
  - - [1088, 1088, 1, 256, 1088, 1088, 256, 256]
    - [0, 8.188]
  - - [1216, 1088, 1, 256, 1216, 1216, 256, 256]
    - [0, 8.221]
  - - [1344, 1088, 1, 256, 1344, 1344, 256, 256]
    - [0, 8.337]
  - - [1472, 1088, 1, 256, 1472, 1472, 256, 256]
    - [0, 8.339]
  - - [1600, 1088, 1, 256, 1600, 1600, 256, 256]
    - [0, 8.365]
  - - [1728, 1088, 1, 256, 1728, 1728, 256, 256]
    - [0, 8.47]
  - - [1856, 1088, 1, 256, 1856, 1856, 256, 256]
    - [0, 8.51]
  - - [1984, 1088, 1, 256, 1984, 1984, 256, 256]
    - [0, 8.568]
  - - [2112, 1088, 1, 256, 2112, 2112, 256, 256]
    - [0, 8.538]
  - - [2240, 1088, 1, 256, 2240, 2240, 256, 256]
    - [0, 8.523]
  - - [2368, 1088, 1, 256, 2368, 2368, 256, 256]
    - [0, 8.579]
  - - [2496, 1088, 1, 256, 2496, 2496, 256, 256]
    - [0, 8.612]
  - - [2624, 1088, 1, 256, 2624, 2624, 256, 256]
    - [0, 8.604]
  - - [2752, 1088, 1, 256, 2752, 2752, 256, 256]
    - [0, 8.658]
  - - [2880, 1088, 1, 256, 2880, 2880, 256, 256]
    - [0, 8.67]
  - - [3008, 1088, 1, 256, 3008, 3008, 256, 256]
    - [0, 8.702]
  - - [3136, 1088, 1, 256, 3136, 3136, 256, 256]
    - [0, 8.693]
  - - [3264, 1088, 1, 256, 3264, 3264, 256, 256]
    - [0, 8.732]
  - - [3392, 1088, 1, 256, 3392, 3392, 256, 256]
    - [0, 8.773]
  - - [3520, 1088, 1, 256, 3520, 3520, 256, 256]
    - [0, 8.861]
  - - [3648, 1088, 1, 256, 3648, 3648, 256, 256]
    - [0, 8.663]
  - - [3776, 1088, 1, 256, 3776, 3776, 256, 256]
    - [0, 8.78]
  - - [3904, 1088, 1, 256, 3904, 3904, 256, 256]
    - [0, 8.734]
  - - [4032, 1088, 1, 256, 4032, 4032, 256, 256]
    - [0, 8.808]
  - - [64, 1216, 1, 256, 64, 64, 256, 256]
    - [0, 4.656]
  - - [192, 1216, 1, 256, 192, 192, 256, 256]
    - [0, 6.856]
  - - [320, 1216, 1, 256, 320, 320, 256, 256]
    - [0, 7.565]
  - - [448, 1216, 1, 256, 448, 448, 256, 256]
    - [0, 7.915]
  - - [576, 1216, 1, 256, 576, 576, 256, 256]
    - [0, 8.034]
  - - [704, 1216, 1, 256, 704, 704, 256, 256]
    - [0, 7.814]
  - - [832, 1216, 1, 256, 832, 832, 256, 256]
    - [0, 7.964]
  - - [960, 1216, 1, 256, 960, 960, 256, 256]
    - [0, 8.101]
  - - [1088, 1216, 1, 256, 1088, 1088, 256, 256]
    - [0, 8.294]
  - - [1216, 1216, 1, 256, 1216, 1216, 256, 256]
    - [0, 8.273]
  - - [1344, 1216, 1, 256, 1344, 1344, 256, 256]
    - [0, 8.351]
  - - [1472, 1216, 1, 256, 1472, 1472, 256, 256]
    - [0, 8.417]
  - - [1600, 1216, 1, 256, 1600, 1600, 256, 256]
    - [0, 8.427]
  - - [1728, 1216, 1, 256, 1728, 1728, 256, 256]
    - [0, 8.547]
  - - [1856, 1216, 1, 256, 1856, 1856, 256, 256]
    - [0, 8.559]
  - - [1984, 1216, 1, 256, 1984, 1984, 256, 256]
    - [0, 8.55]
  - - [2112, 1216, 1, 256, 2112, 2112, 256, 256]
    - [0, 8.523]
  - - [2240, 1216, 1, 256, 2240, 2240, 256, 256]
    - [0, 8.599]
  - - [2368, 1216, 1, 256, 2368, 2368, 256, 256]
    - [0, 8.652]
  - - [2496, 1216, 1, 256, 2496, 2496, 256, 256]
    - [0, 8.661]
  - - [2624, 1216, 1, 256, 2624, 2624, 256, 256]
    - [0, 8.569]
  - - [2752, 1216, 1, 256, 2752, 2752, 256, 256]
    - [0, 8.76]
  - - [2880, 1216, 1, 256, 2880, 2880, 256, 256]
    - [0, 8.712]
  - - [3008, 1216, 1, 256, 3008, 3008, 256, 256]
    - [0, 8.714]
  - - [3136, 1216, 1, 256, 3136, 3136, 256, 256]
    - [0, 8.739]
  - - [3264, 1216, 1, 256, 3264, 3264, 256, 256]
    - [0, 8.695]
  - - [3392, 1216, 1, 256, 3392, 3392, 256, 256]
    - [0, 8.769]
  - - [3520, 1216, 1, 256, 3520, 3520, 256, 256]
    - [0, 8.797]
  - - [3648, 1216, 1, 256, 3648, 3648, 256, 256]
    - [0, 8.665]
  - - [3776, 1216, 1, 256, 3776, 3776, 256, 256]
    - [0, 8.703]
  - - [3904, 1216, 1, 256, 3904, 3904, 256, 256]
    - [0, 8.781]
  - - [4032, 1216, 1, 256, 4032, 4032, 256, 256]
    - [0, 8.848]
  - - [64, 1344, 1, 256, 64, 64, 256, 256]
    - [0, 5.102]
  - - [192, 1344, 1, 256, 192, 192, 256, 256]
    - [0, 6.948]
  - - [320, 1344, 1, 256, 320, 320, 256, 256]
    - [0, 7.642]
  - - [448, 1344, 1, 256, 448, 448, 256, 256]
    - [0, 7.92]
  - - [576, 1344, 1, 256, 576, 576, 256, 256]
    - [0, 7.755]
  - - [704, 1344, 1, 256, 704, 704, 256, 256]
    - [0, 7.901]
  - - [832, 1344, 1, 256, 832, 832, 256, 256]
    - [0, 8.095]
  - - [960, 1344, 1, 256, 960, 960, 256, 256]
    - [0, 8.194]
  - - [1088, 1344, 1, 256, 1088, 1088, 256, 256]
    - [0, 8.213]
  - - [1216, 1344, 1, 256, 1216, 1216, 256, 256]
    - [0, 8.346]
  - - [1344, 1344, 1, 256, 1344, 1344, 256, 256]
    - [0, 8.391]
  - - [1472, 1344, 1, 256, 1472, 1472, 256, 256]
    - [0, 8.429]
  - - [1600, 1344, 1, 256, 1600, 1600, 256, 256]
    - [0, 8.557]
  - - [1728, 1344, 1, 256, 1728, 1728, 256, 256]
    - [0, 8.589]
  - - [1856, 1344, 1, 256, 1856, 1856, 256, 256]
    - [0, 8.594]
  - - [1984, 1344, 1, 256, 1984, 1984, 256, 256]
    - [0, 8.693]
  - - [2112, 1344, 1, 256, 2112, 2112, 256, 256]
    - [0, 8.652]
  - - [2240, 1344, 1, 256, 2240, 2240, 256, 256]
    - [0, 8.639]
  - - [2368, 1344, 1, 256, 2368, 2368, 256, 256]
    - [0, 8.653]
  - - [2496, 1344, 1, 256, 2496, 2496, 256, 256]
    - [0, 8.625]
  - - [2624, 1344, 1, 256, 2624, 2624, 256, 256]
    - [0, 8.718]
  - - [2752, 1344, 1, 256, 2752, 2752, 256, 256]
    - [0, 8.691]
  - - [2880, 1344, 1, 256, 2880, 2880, 256, 256]
    - [0, 8.724]
  - - [3008, 1344, 1, 256, 3008, 3008, 256, 256]
    - [0, 8.782]
  - - [3136, 1344, 1, 256, 3136, 3136, 256, 256]
    - [0, 8.757]
  - - [3264, 1344, 1, 256, 3264, 3264, 256, 256]
    - [0, 8.683]
  - - [3392, 1344, 1, 256, 3392, 3392, 256, 256]
    - [0, 8.788]
  - - [3520, 1344, 1, 256, 3520, 3520, 256, 256]
    - [0, 8.767]
  - - [3648, 1344, 1, 256, 3648, 3648, 256, 256]
    - [0, 8.762]
  - - [3776, 1344, 1, 256, 3776, 3776, 256, 256]
    - [0, 8.818]
  - - [3904, 1344, 1, 256, 3904, 3904, 256, 256]
    - [0, 8.889]
  - - [4032, 1344, 1, 256, 4032, 4032, 256, 256]
    - [0, 8.761]
  - - [64, 1472, 1, 256, 64, 64, 256, 256]
    - [0, 4.692]
  - - [192, 1472, 1, 256, 192, 192, 256, 256]
    - [0, 6.97]
  - - [320, 1472, 1, 256, 320, 320, 256, 256]
    - [0, 7.701]
  - - [448, 1472, 1, 256, 448, 448, 256, 256]
    - [0, 8.071]
  - - [576, 1472, 1, 256, 576, 576, 256, 256]
    - [0, 7.814]
  - - [704, 1472, 1, 256, 704, 704, 256, 256]
    - [0, 8.024]
  - - [832, 1472, 1, 256, 832, 832, 256, 256]
    - [0, 8.22]
  - - [960, 1472, 1, 256, 960, 960, 256, 256]
    - [0, 8.289]
  - - [1088, 1472, 1, 256, 1088, 1088, 256, 256]
    - [0, 8.332]
  - - [1216, 1472, 1, 256, 1216, 1216, 256, 256]
    - [0, 8.43]
  - - [1344, 1472, 1, 256, 1344, 1344, 256, 256]
    - [0, 8.469]
  - - [1472, 1472, 1, 256, 1472, 1472, 256, 256]
    - [0, 8.532]
  - - [1600, 1472, 1, 256, 1600, 1600, 256, 256]
    - [0, 8.53]
  - - [1728, 1472, 1, 256, 1728, 1728, 256, 256]
    - [0, 8.588]
  - - [1856, 1472, 1, 256, 1856, 1856, 256, 256]
    - [0, 8.608]
  - - [1984, 1472, 1, 256, 1984, 1984, 256, 256]
    - [0, 8.646]
  - - [2112, 1472, 1, 256, 2112, 2112, 256, 256]
    - [0, 8.595]
  - - [2240, 1472, 1, 256, 2240, 2240, 256, 256]
    - [0, 8.662]
  - - [2368, 1472, 1, 256, 2368, 2368, 256, 256]
    - [0, 8.666]
  - - [2496, 1472, 1, 256, 2496, 2496, 256, 256]
    - [0, 8.71]
  - - [2624, 1472, 1, 256, 2624, 2624, 256, 256]
    - [0, 8.724]
  - - [2752, 1472, 1, 256, 2752, 2752, 256, 256]
    - [0, 8.783]
  - - [2880, 1472, 1, 256, 2880, 2880, 256, 256]
    - [0, 8.821]
  - - [3008, 1472, 1, 256, 3008, 3008, 256, 256]
    - [0, 8.733]
  - - [3136, 1472, 1, 256, 3136, 3136, 256, 256]
    - [0, 8.785]
  - - [3264, 1472, 1, 256, 3264, 3264, 256, 256]
    - [0, 8.835]
  - - [3392, 1472, 1, 256, 3392, 3392, 256, 256]
    - [0, 8.833]
  - - [3520, 1472, 1, 256, 3520, 3520, 256, 256]
    - [0, 8.792]
  - - [3648, 1472, 1, 256, 3648, 3648, 256, 256]
    - [0, 8.82]
  - - [3776, 1472, 1, 256, 3776, 3776, 256, 256]
    - [0, 8.811]
  - - [3904, 1472, 1, 256, 3904, 3904, 256, 256]
    - [0, 8.625]
  - - [4032, 1472, 1, 256, 4032, 4032, 256, 256]
    - [0, 8.743]
  - - [64, 1600, 1, 256, 64, 64, 256, 256]
    - [0, 5.085]
  - - [192, 1600, 1, 256, 192, 192, 256, 256]
    - [0, 7.431]
  - - [320, 1600, 1, 256, 320, 320, 256, 256]
    - [0, 7.856]
  - - [448, 1600, 1, 256, 448, 448, 256, 256]
    - [0, 7.912]
  - - [576, 1600, 1, 256, 576, 576, 256, 256]
    - [0, 7.879]
  - - [704, 1600, 1, 256, 704, 704, 256, 256]
    - [0, 8.169]
  - - [832, 1600, 1, 256, 832, 832, 256, 256]
    - [0, 8.23]
  - - [960, 1600, 1, 256, 960, 960, 256, 256]
    - [0, 8.303]
  - - [1088, 1600, 1, 256, 1088, 1088, 256, 256]
    - [0, 8.464]
  - - [1216, 1600, 1, 256, 1216, 1216, 256, 256]
    - [0, 8.482]
  - - [1344, 1600, 1, 256, 1344, 1344, 256, 256]
    - [0, 8.556]
  - - [1472, 1600, 1, 256, 1472, 1472, 256, 256]
    - [0, 8.522]
  - - [1600, 1600, 1, 256, 1600, 1600, 256, 256]
    - [0, 8.622]
  - - [1728, 1600, 1, 256, 1728, 1728, 256, 256]
    - [0, 8.639]
  - - [1856, 1600, 1, 256, 1856, 1856, 256, 256]
    - [0, 8.593]
  - - [1984, 1600, 1, 256, 1984, 1984, 256, 256]
    - [0, 8.693]
  - - [2112, 1600, 1, 256, 2112, 2112, 256, 256]
    - [0, 8.713]
  - - [2240, 1600, 1, 256, 2240, 2240, 256, 256]
    - [0, 8.656]
  - - [2368, 1600, 1, 256, 2368, 2368, 256, 256]
    - [0, 8.817]
  - - [2496, 1600, 1, 256, 2496, 2496, 256, 256]
    - [0, 8.821]
  - - [2624, 1600, 1, 256, 2624, 2624, 256, 256]
    - [0, 8.754]
  - - [2752, 1600, 1, 256, 2752, 2752, 256, 256]
    - [0, 8.744]
  - - [2880, 1600, 1, 256, 2880, 2880, 256, 256]
    - [0, 8.817]
  - - [3008, 1600, 1, 256, 3008, 3008, 256, 256]
    - [0, 8.708]
  - - [3136, 1600, 1, 256, 3136, 3136, 256, 256]
    - [0, 8.736]
  - - [3264, 1600, 1, 256, 3264, 3264, 256, 256]
    - [0, 8.774]
  - - [3392, 1600, 1, 256, 3392, 3392, 256, 256]
    - [0, 8.819]
  - - [3520, 1600, 1, 256, 3520, 3520, 256, 256]
    - [0, 8.803]
  - - [3648, 1600, 1, 256, 3648, 3648, 256, 256]
    - [0, 8.706]
  - - [3776, 1600, 1, 256, 3776, 3776, 256, 256]
    - [0, 8.713]
  - - [3904, 1600, 1, 256, 3904, 3904, 256, 256]
    - [0, 8.691]
  - - [4032, 1600, 1, 256, 4032, 4032, 256, 256]
    - [0, 8.693]
  - - [64, 1728, 1, 256, 64, 64, 256, 256]
    - [0, 5.457]
  - - [192, 1728, 1, 256, 192, 192, 256, 256]
    - [0, 7.408]
  - - [320, 1728, 1, 256, 320, 320, 256, 256]
    - [0, 7.837]
  - - [448, 1728, 1, 256, 448, 448, 256, 256]
    - [0, 7.763]
  - - [576, 1728, 1, 256, 576, 576, 256, 256]
    - [0, 8.017]
  - - [704, 1728, 1, 256, 704, 704, 256, 256]
    - [0, 8.066]
  - - [832, 1728, 1, 256, 832, 832, 256, 256]
    - [0, 8.236]
  - - [960, 1728, 1, 256, 960, 960, 256, 256]
    - [0, 8.328]
  - - [1088, 1728, 1, 256, 1088, 1088, 256, 256]
    - [0, 8.448]
  - - [1216, 1728, 1, 256, 1216, 1216, 256, 256]
    - [0, 8.505]
  - - [1344, 1728, 1, 256, 1344, 1344, 256, 256]
    - [0, 8.55]
  - - [1472, 1728, 1, 256, 1472, 1472, 256, 256]
    - [0, 8.571]
  - - [1600, 1728, 1, 256, 1600, 1600, 256, 256]
    - [0, 8.635]
  - - [1728, 1728, 1, 256, 1728, 1728, 256, 256]
    - [0, 8.64]
  - - [1856, 1728, 1, 256, 1856, 1856, 256, 256]
    - [0, 8.665]
  - - [1984, 1728, 1, 256, 1984, 1984, 256, 256]
    - [0, 8.652]
  - - [2112, 1728, 1, 256, 2112, 2112, 256, 256]
    - [0, 8.738]
  - - [2240, 1728, 1, 256, 2240, 2240, 256, 256]
    - [0, 8.628]
  - - [2368, 1728, 1, 256, 2368, 2368, 256, 256]
    - [0, 8.701]
  - - [2496, 1728, 1, 256, 2496, 2496, 256, 256]
    - [0, 8.751]
  - - [2624, 1728, 1, 256, 2624, 2624, 256, 256]
    - [0, 8.738]
  - - [2752, 1728, 1, 256, 2752, 2752, 256, 256]
    - [0, 8.776]
  - - [2880, 1728, 1, 256, 2880, 2880, 256, 256]
    - [0, 8.782]
  - - [3008, 1728, 1, 256, 3008, 3008, 256, 256]
    - [0, 8.79]
  - - [3136, 1728, 1, 256, 3136, 3136, 256, 256]
    - [0, 8.785]
  - - [3264, 1728, 1, 256, 3264, 3264, 256, 256]
    - [0, 8.829]
  - - [3392, 1728, 1, 256, 3392, 3392, 256, 256]
    - [0, 8.677]
  - - [3520, 1728, 1, 256, 3520, 3520, 256, 256]
    - [0, 8.692]
  - - [3648, 1728, 1, 256, 3648, 3648, 256, 256]
    - [0, 8.753]
  - - [3776, 1728, 1, 256, 3776, 3776, 256, 256]
    - [0, 8.733]
  - - [3904, 1728, 1, 256, 3904, 3904, 256, 256]
    - [0, 8.763]
  - - [4032, 1728, 1, 256, 4032, 4032, 256, 256]
    - [0, 8.725]
  - - [64, 1856, 1, 256, 64, 64, 256, 256]
    - [0, 5.846]
  - - [192, 1856, 1, 256, 192, 192, 256, 256]
    - [0, 7.478]
  - - [320, 1856, 1, 256, 320, 320, 256, 256]
    - [0, 7.941]
  - - [448, 1856, 1, 256, 448, 448, 256, 256]
    - [0, 7.795]
  - - [576, 1856, 1, 256, 576, 576, 256, 256]
    - [0, 8.018]
  - - [704, 1856, 1, 256, 704, 704, 256, 256]
    - [0, 8.212]
  - - [832, 1856, 1, 256, 832, 832, 256, 256]
    - [0, 8.326]
  - - [960, 1856, 1, 256, 960, 960, 256, 256]
    - [0, 8.457]
  - - [1088, 1856, 1, 256, 1088, 1088, 256, 256]
    - [0, 8.534]
  - - [1216, 1856, 1, 256, 1216, 1216, 256, 256]
    - [0, 8.521]
  - - [1344, 1856, 1, 256, 1344, 1344, 256, 256]
    - [0, 8.637]
  - - [1472, 1856, 1, 256, 1472, 1472, 256, 256]
    - [0, 8.655]
  - - [1600, 1856, 1, 256, 1600, 1600, 256, 256]
    - [0, 8.66]
  - - [1728, 1856, 1, 256, 1728, 1728, 256, 256]
    - [0, 8.72]
  - - [1856, 1856, 1, 256, 1856, 1856, 256, 256]
    - [0, 8.723]
  - - [1984, 1856, 1, 256, 1984, 1984, 256, 256]
    - [0, 8.741]
  - - [2112, 1856, 1, 256, 2112, 2112, 256, 256]
    - [0, 8.671]
  - - [2240, 1856, 1, 256, 2240, 2240, 256, 256]
    - [0, 8.721]
  - - [2368, 1856, 1, 256, 2368, 2368, 256, 256]
    - [0, 8.789]
  - - [2496, 1856, 1, 256, 2496, 2496, 256, 256]
    - [0, 8.788]
  - - [2624, 1856, 1, 256, 2624, 2624, 256, 256]
    - [0, 8.795]
  - - [2752, 1856, 1, 256, 2752, 2752, 256, 256]
    - [0, 8.756]
  - - [2880, 1856, 1, 256, 2880, 2880, 256, 256]
    - [0, 8.816]
  - - [3008, 1856, 1, 256, 3008, 3008, 256, 256]
    - [0, 8.801]
  - - [3136, 1856, 1, 256, 3136, 3136, 256, 256]
    - [0, 8.702]
  - - [3264, 1856, 1, 256, 3264, 3264, 256, 256]
    - [0, 8.701]
  - - [3392, 1856, 1, 256, 3392, 3392, 256, 256]
    - [0, 8.738]
  - - [3520, 1856, 1, 256, 3520, 3520, 256, 256]
    - [0, 8.771]
  - - [3648, 1856, 1, 256, 3648, 3648, 256, 256]
    - [0, 8.672]
  - - [3776, 1856, 1, 256, 3776, 3776, 256, 256]
    - [0, 8.767]
  - - [3904, 1856, 1, 256, 3904, 3904, 256, 256]
    - [0, 8.806]
  - - [4032, 1856, 1, 256, 4032, 4032, 256, 256]
    - [0, 8.734]
  - - [64, 1984, 1, 256, 64, 64, 256, 256]
    - [0, 5.391]
  - - [192, 1984, 1, 256, 192, 192, 256, 256]
    - [0, 7.479]
  - - [320, 1984, 1, 256, 320, 320, 256, 256]
    - [0, 8.067]
  - - [448, 1984, 1, 256, 448, 448, 256, 256]
    - [0, 7.88]
  - - [576, 1984, 1, 256, 576, 576, 256, 256]
    - [0, 8.104]
  - - [704, 1984, 1, 256, 704, 704, 256, 256]
    - [0, 8.217]
  - - [832, 1984, 1, 256, 832, 832, 256, 256]
    - [0, 8.407]
  - - [960, 1984, 1, 256, 960, 960, 256, 256]
    - [0, 8.436]
  - - [1088, 1984, 1, 256, 1088, 1088, 256, 256]
    - [0, 8.495]
  - - [1216, 1984, 1, 256, 1216, 1216, 256, 256]
    - [0, 8.581]
  - - [1344, 1984, 1, 256, 1344, 1344, 256, 256]
    - [0, 8.642]
  - - [1472, 1984, 1, 256, 1472, 1472, 256, 256]
    - [0, 8.695]
  - - [1600, 1984, 1, 256, 1600, 1600, 256, 256]
    - [0, 8.61]
  - - [1728, 1984, 1, 256, 1728, 1728, 256, 256]
    - [0, 8.704]
  - - [1856, 1984, 1, 256, 1856, 1856, 256, 256]
    - [0, 8.712]
  - - [1984, 1984, 1, 256, 1984, 1984, 256, 256]
    - [0, 8.722]
  - - [2112, 1984, 1, 256, 2112, 2112, 256, 256]
    - [0, 8.757]
  - - [2240, 1984, 1, 256, 2240, 2240, 256, 256]
    - [0, 8.759]
  - - [2368, 1984, 1, 256, 2368, 2368, 256, 256]
    - [0, 8.798]
  - - [2496, 1984, 1, 256, 2496, 2496, 256, 256]
    - [0, 8.779]
  - - [2624, 1984, 1, 256, 2624, 2624, 256, 256]
    - [0, 8.762]
  - - [2752, 1984, 1, 256, 2752, 2752, 256, 256]
    - [0, 8.783]
  - - [2880, 1984, 1, 256, 2880, 2880, 256, 256]
    - [0, 8.867]
  - - [3008, 1984, 1, 256, 3008, 3008, 256, 256]
    - [0, 8.718]
  - - [3136, 1984, 1, 256, 3136, 3136, 256, 256]
    - [0, 8.688]
  - - [3264, 1984, 1, 256, 3264, 3264, 256, 256]
    - [0, 8.731]
  - - [3392, 1984, 1, 256, 3392, 3392, 256, 256]
    - [0, 8.667]
  - - [3520, 1984, 1, 256, 3520, 3520, 256, 256]
    - [0, 8.722]
  - - [3648, 1984, 1, 256, 3648, 3648, 256, 256]
    - [0, 8.755]
  - - [3776, 1984, 1, 256, 3776, 3776, 256, 256]
    - [0, 8.762]
  - - [3904, 1984, 1, 256, 3904, 3904, 256, 256]
    - [0, 8.715]
  - - [4032, 1984, 1, 256, 4032, 4032, 256, 256]
    - [0, 8.75]
  - - [64, 2112, 1, 256, 64, 64, 256, 256]
    - [0, 5.69]
  - - [192, 2112, 1, 256, 192, 192, 256, 256]
    - [0, 7.478]
  - - [320, 2112, 1, 256, 320, 320, 256, 256]
    - [0, 8.009]
  - - [448, 2112, 1, 256, 448, 448, 256, 256]
    - [0, 7.937]
  - - [576, 2112, 1, 256, 576, 576, 256, 256]
    - [0, 8.101]
  - - [704, 2112, 1, 256, 704, 704, 256, 256]
    - [0, 8.3]
  - - [832, 2112, 1, 256, 832, 832, 256, 256]
    - [0, 8.414]
  - - [960, 2112, 1, 256, 960, 960, 256, 256]
    - [0, 8.463]
  - - [1088, 2112, 1, 256, 1088, 1088, 256, 256]
    - [0, 8.573]
  - - [1216, 2112, 1, 256, 1216, 1216, 256, 256]
    - [0, 8.534]
  - - [1344, 2112, 1, 256, 1344, 1344, 256, 256]
    - [0, 8.636]
  - - [1472, 2112, 1, 256, 1472, 1472, 256, 256]
    - [0, 8.701]
  - - [1600, 2112, 1, 256, 1600, 1600, 256, 256]
    - [0, 8.643]
  - - [1728, 2112, 1, 256, 1728, 1728, 256, 256]
    - [0, 8.756]
  - - [1856, 2112, 1, 256, 1856, 1856, 256, 256]
    - [0, 8.762]
  - - [1984, 2112, 1, 256, 1984, 1984, 256, 256]
    - [0, 8.794]
  - - [2112, 2112, 1, 256, 2112, 2112, 256, 256]
    - [0, 8.744]
  - - [2240, 2112, 1, 256, 2240, 2240, 256, 256]
    - [0, 8.799]
  - - [2368, 2112, 1, 256, 2368, 2368, 256, 256]
    - [0, 8.724]
  - - [2496, 2112, 1, 256, 2496, 2496, 256, 256]
    - [0, 8.789]
  - - [2624, 2112, 1, 256, 2624, 2624, 256, 256]
    - [0, 8.878]
  - - [2752, 2112, 1, 256, 2752, 2752, 256, 256]
    - [0, 8.669]
  - - [2880, 2112, 1, 256, 2880, 2880, 256, 256]
    - [0, 8.703]
  - - [3008, 2112, 1, 256, 3008, 3008, 256, 256]
    - [0, 8.703]
  - - [3136, 2112, 1, 256, 3136, 3136, 256, 256]
    - [0, 8.803]
  - - [3264, 2112, 1, 256, 3264, 3264, 256, 256]
    - [0, 8.677]
  - - [3392, 2112, 1, 256, 3392, 3392, 256, 256]
    - [0, 8.771]
  - - [3520, 2112, 1, 256, 3520, 3520, 256, 256]
    - [0, 8.759]
  - - [3648, 2112, 1, 256, 3648, 3648, 256, 256]
    - [0, 8.704]
  - - [3776, 2112, 1, 256, 3776, 3776, 256, 256]
    - [0, 8.764]
  - - [3904, 2112, 1, 256, 3904, 3904, 256, 256]
    - [0, 8.761]
  - - [4032, 2112, 1, 256, 4032, 4032, 256, 256]
    - [0, 8.78]
  - - [64, 2240, 1, 256, 64, 64, 256, 256]
    - [0, 6.048]
  - - [192, 2240, 1, 256, 192, 192, 256, 256]
    - [0, 7.517]
  - - [320, 2240, 1, 256, 320, 320, 256, 256]
    - [0, 8.091]
  - - [448, 2240, 1, 256, 448, 448, 256, 256]
    - [0, 8.066]
  - - [576, 2240, 1, 256, 576, 576, 256, 256]
    - [0, 8.182]
  - - [704, 2240, 1, 256, 704, 704, 256, 256]
    - [0, 8.334]
  - - [832, 2240, 1, 256, 832, 832, 256, 256]
    - [0, 8.424]
  - - [960, 2240, 1, 256, 960, 960, 256, 256]
    - [0, 8.511]
  - - [1088, 2240, 1, 256, 1088, 1088, 256, 256]
    - [0, 8.527]
  - - [1216, 2240, 1, 256, 1216, 1216, 256, 256]
    - [0, 8.636]
  - - [1344, 2240, 1, 256, 1344, 1344, 256, 256]
    - [0, 8.714]
  - - [1472, 2240, 1, 256, 1472, 1472, 256, 256]
    - [0, 8.707]
  - - [1600, 2240, 1, 256, 1600, 1600, 256, 256]
    - [0, 8.724]
  - - [1728, 2240, 1, 256, 1728, 1728, 256, 256]
    - [0, 8.771]
  - - [1856, 2240, 1, 256, 1856, 1856, 256, 256]
    - [0, 8.721]
  - - [1984, 2240, 1, 256, 1984, 1984, 256, 256]
    - [0, 8.692]
  - - [2112, 2240, 1, 256, 2112, 2112, 256, 256]
    - [0, 8.782]
  - - [2240, 2240, 1, 256, 2240, 2240, 256, 256]
    - [0, 8.805]
  - - [2368, 2240, 1, 256, 2368, 2368, 256, 256]
    - [0, 8.869]
  - - [2496, 2240, 1, 256, 2496, 2496, 256, 256]
    - [0, 8.821]
  - - [2624, 2240, 1, 256, 2624, 2624, 256, 256]
    - [0, 8.637]
  - - [2752, 2240, 1, 256, 2752, 2752, 256, 256]
    - [0, 8.671]
  - - [2880, 2240, 1, 256, 2880, 2880, 256, 256]
    - [0, 8.673]
  - - [3008, 2240, 1, 256, 3008, 3008, 256, 256]
    - [0, 8.801]
  - - [3136, 2240, 1, 256, 3136, 3136, 256, 256]
    - [0, 8.746]
  - - [3264, 2240, 1, 256, 3264, 3264, 256, 256]
    - [0, 8.697]
  - - [3392, 2240, 1, 256, 3392, 3392, 256, 256]
    - [0, 8.745]
  - - [3520, 2240, 1, 256, 3520, 3520, 256, 256]
    - [0, 8.726]
  - - [3648, 2240, 1, 256, 3648, 3648, 256, 256]
    - [0, 8.757]
  - - [3776, 2240, 1, 256, 3776, 3776, 256, 256]
    - [0, 8.816]
  - - [3904, 2240, 1, 256, 3904, 3904, 256, 256]
    - [0, 8.749]
  - - [4032, 2240, 1, 256, 4032, 4032, 256, 256]
    - [0, 8.898]
  - - [64, 2368, 1, 256, 64, 64, 256, 256]
    - [0, 6.35]
  - - [192, 2368, 1, 256, 192, 192, 256, 256]
    - [0, 7.786]
  - - [320, 2368, 1, 256, 320, 320, 256, 256]
    - [0, 7.62]
  - - [448, 2368, 1, 256, 448, 448, 256, 256]
    - [0, 8.101]
  - - [576, 2368, 1, 256, 576, 576, 256, 256]
    - [0, 8.282]
  - - [704, 2368, 1, 256, 704, 704, 256, 256]
    - [0, 8.363]
  - - [832, 2368, 1, 256, 832, 832, 256, 256]
    - [0, 8.474]
  - - [960, 2368, 1, 256, 960, 960, 256, 256]
    - [0, 8.546]
  - - [1088, 2368, 1, 256, 1088, 1088, 256, 256]
    - [0, 8.591]
  - - [1216, 2368, 1, 256, 1216, 1216, 256, 256]
    - [0, 8.688]
  - - [1344, 2368, 1, 256, 1344, 1344, 256, 256]
    - [0, 8.625]
  - - [1472, 2368, 1, 256, 1472, 1472, 256, 256]
    - [0, 8.691]
  - - [1600, 2368, 1, 256, 1600, 1600, 256, 256]
    - [0, 8.696]
  - - [1728, 2368, 1, 256, 1728, 1728, 256, 256]
    - [0, 8.776]
  - - [1856, 2368, 1, 256, 1856, 1856, 256, 256]
    - [0, 8.721]
  - - [1984, 2368, 1, 256, 1984, 1984, 256, 256]
    - [0, 8.772]
  - - [2112, 2368, 1, 256, 2112, 2112, 256, 256]
    - [0, 8.77]
  - - [2240, 2368, 1, 256, 2240, 2240, 256, 256]
    - [0, 8.821]
  - - [2368, 2368, 1, 256, 2368, 2368, 256, 256]
    - [0, 8.817]
  - - [2496, 2368, 1, 256, 2496, 2496, 256, 256]
    - [0, 8.671]
  - - [2624, 2368, 1, 256, 2624, 2624, 256, 256]
    - [0, 8.68]
  - - [2752, 2368, 1, 256, 2752, 2752, 256, 256]
    - [0, 8.662]
  - - [2880, 2368, 1, 256, 2880, 2880, 256, 256]
    - [0, 8.707]
  - - [3008, 2368, 1, 256, 3008, 3008, 256, 256]
    - [0, 8.755]
  - - [3136, 2368, 1, 256, 3136, 3136, 256, 256]
    - [0, 8.723]
  - - [3264, 2368, 1, 256, 3264, 3264, 256, 256]
    - [0, 8.8]
  - - [3392, 2368, 1, 256, 3392, 3392, 256, 256]
    - [0, 8.856]
  - - [3520, 2368, 1, 256, 3520, 3520, 256, 256]
    - [0, 8.801]
  - - [3648, 2368, 1, 256, 3648, 3648, 256, 256]
    - [0, 8.768]
  - - [3776, 2368, 1, 256, 3776, 3776, 256, 256]
    - [0, 8.79]
  - - [3904, 2368, 1, 256, 3904, 3904, 256, 256]
    - [0, 8.814]
  - - [4032, 2368, 1, 256, 4032, 4032, 256, 256]
    - [0, 8.819]
  - - [64, 2496, 1, 256, 64, 64, 256, 256]
    - [0, 4.002]
  - - [192, 2496, 1, 256, 192, 192, 256, 256]
    - [0, 7.835]
  - - [320, 2496, 1, 256, 320, 320, 256, 256]
    - [0, 7.783]
  - - [448, 2496, 1, 256, 448, 448, 256, 256]
    - [0, 8.125]
  - - [576, 2496, 1, 256, 576, 576, 256, 256]
    - [0, 8.232]
  - - [704, 2496, 1, 256, 704, 704, 256, 256]
    - [0, 8.4]
  - - [832, 2496, 1, 256, 832, 832, 256, 256]
    - [0, 8.531]
  - - [960, 2496, 1, 256, 960, 960, 256, 256]
    - [0, 8.582]
  - - [1088, 2496, 1, 256, 1088, 1088, 256, 256]
    - [0, 8.659]
  - - [1216, 2496, 1, 256, 1216, 1216, 256, 256]
    - [0, 8.72]
  - - [1344, 2496, 1, 256, 1344, 1344, 256, 256]
    - [0, 8.712]
  - - [1472, 2496, 1, 256, 1472, 1472, 256, 256]
    - [0, 8.712]
  - - [1600, 2496, 1, 256, 1600, 1600, 256, 256]
    - [0, 8.742]
  - - [1728, 2496, 1, 256, 1728, 1728, 256, 256]
    - [0, 8.834]
  - - [1856, 2496, 1, 256, 1856, 1856, 256, 256]
    - [0, 8.702]
  - - [1984, 2496, 1, 256, 1984, 1984, 256, 256]
    - [0, 8.805]
  - - [2112, 2496, 1, 256, 2112, 2112, 256, 256]
    - [0, 8.809]
  - - [2240, 2496, 1, 256, 2240, 2240, 256, 256]
    - [0, 8.873]
  - - [2368, 2496, 1, 256, 2368, 2368, 256, 256]
    - [0, 8.604]
  - - [2496, 2496, 1, 256, 2496, 2496, 256, 256]
    - [0, 8.742]
  - - [2624, 2496, 1, 256, 2624, 2624, 256, 256]
    - [0, 8.71]
  - - [2752, 2496, 1, 256, 2752, 2752, 256, 256]
    - [0, 8.735]
  - - [2880, 2496, 1, 256, 2880, 2880, 256, 256]
    - [0, 8.836]
  - - [3008, 2496, 1, 256, 3008, 3008, 256, 256]
    - [0, 8.773]
  - - [3136, 2496, 1, 256, 3136, 3136, 256, 256]
    - [0, 8.702]
  - - [3264, 2496, 1, 256, 3264, 3264, 256, 256]
    - [0, 8.805]
  - - [3392, 2496, 1, 256, 3392, 3392, 256, 256]
    - [0, 8.778]
  - - [3520, 2496, 1, 256, 3520, 3520, 256, 256]
    - [0, 8.773]
  - - [3648, 2496, 1, 256, 3648, 3648, 256, 256]
    - [0, 8.738]
  - - [3776, 2496, 1, 256, 3776, 3776, 256, 256]
    - [0, 8.764]
  - - [3904, 2496, 1, 256, 3904, 3904, 256, 256]
    - [0, 8.787]
  - - [4032, 2496, 1, 256, 4032, 4032, 256, 256]
    - [0, 8.848]
  - - [64, 2624, 1, 256, 64, 64, 256, 256]
    - [0, 6.19]
  - - [192, 2624, 1, 256, 192, 192, 256, 256]
    - [0, 7.792]
  - - [320, 2624, 1, 256, 320, 320, 256, 256]
    - [0, 7.841]
  - - [448, 2624, 1, 256, 448, 448, 256, 256]
    - [0, 8.143]
  - - [576, 2624, 1, 256, 576, 576, 256, 256]
    - [0, 8.3]
  - - [704, 2624, 1, 256, 704, 704, 256, 256]
    - [0, 8.403]
  - - [832, 2624, 1, 256, 832, 832, 256, 256]
    - [0, 8.52]
  - - [960, 2624, 1, 256, 960, 960, 256, 256]
    - [0, 8.585]
  - - [1088, 2624, 1, 256, 1088, 1088, 256, 256]
    - [0, 8.567]
  - - [1216, 2624, 1, 256, 1216, 1216, 256, 256]
    - [0, 8.641]
  - - [1344, 2624, 1, 256, 1344, 1344, 256, 256]
    - [0, 8.695]
  - - [1472, 2624, 1, 256, 1472, 1472, 256, 256]
    - [0, 8.743]
  - - [1600, 2624, 1, 256, 1600, 1600, 256, 256]
    - [0, 8.828]
  - - [1728, 2624, 1, 256, 1728, 1728, 256, 256]
    - [0, 8.739]
  - - [1856, 2624, 1, 256, 1856, 1856, 256, 256]
    - [0, 8.755]
  - - [1984, 2624, 1, 256, 1984, 1984, 256, 256]
    - [0, 8.775]
  - - [2112, 2624, 1, 256, 2112, 2112, 256, 256]
    - [0, 8.825]
  - - [2240, 2624, 1, 256, 2240, 2240, 256, 256]
    - [0, 8.686]
  - - [2368, 2624, 1, 256, 2368, 2368, 256, 256]
    - [0, 8.783]
  - - [2496, 2624, 1, 256, 2496, 2496, 256, 256]
    - [0, 8.702]
  - - [2624, 2624, 1, 256, 2624, 2624, 256, 256]
    - [0, 8.715]
  - - [2752, 2624, 1, 256, 2752, 2752, 256, 256]
    - [0, 8.681]
  - - [2880, 2624, 1, 256, 2880, 2880, 256, 256]
    - [0, 8.715]
  - - [3008, 2624, 1, 256, 3008, 3008, 256, 256]
    - [0, 8.793]
  - - [3136, 2624, 1, 256, 3136, 3136, 256, 256]
    - [0, 8.741]
  - - [3264, 2624, 1, 256, 3264, 3264, 256, 256]
    - [0, 8.818]
  - - [3392, 2624, 1, 256, 3392, 3392, 256, 256]
    - [0, 8.811]
  - - [3520, 2624, 1, 256, 3520, 3520, 256, 256]
    - [0, 8.797]
  - - [3648, 2624, 1, 256, 3648, 3648, 256, 256]
    - [0, 8.848]
  - - [3776, 2624, 1, 256, 3776, 3776, 256, 256]
    - [0, 8.911]
  - - [3904, 2624, 1, 256, 3904, 3904, 256, 256]
    - [0, 8.875]
  - - [4032, 2624, 1, 256, 4032, 4032, 256, 256]
    - [0, 8.868]
  - - [64, 2752, 1, 256, 64, 64, 256, 256]
    - [0, 6.431]
  - - [192, 2752, 1, 256, 192, 192, 256, 256]
    - [0, 7.785]
  - - [320, 2752, 1, 256, 320, 320, 256, 256]
    - [0, 7.785]
  - - [448, 2752, 1, 256, 448, 448, 256, 256]
    - [0, 8.16]
  - - [576, 2752, 1, 256, 576, 576, 256, 256]
    - [0, 8.424]
  - - [704, 2752, 1, 256, 704, 704, 256, 256]
    - [0, 8.545]
  - - [832, 2752, 1, 256, 832, 832, 256, 256]
    - [0, 8.533]
  - - [960, 2752, 1, 256, 960, 960, 256, 256]
    - [0, 8.677]
  - - [1088, 2752, 1, 256, 1088, 1088, 256, 256]
    - [0, 8.68]
  - - [1216, 2752, 1, 256, 1216, 1216, 256, 256]
    - [0, 8.685]
  - - [1344, 2752, 1, 256, 1344, 1344, 256, 256]
    - [0, 8.668]
  - - [1472, 2752, 1, 256, 1472, 1472, 256, 256]
    - [0, 8.759]
  - - [1600, 2752, 1, 256, 1600, 1600, 256, 256]
    - [0, 8.794]
  - - [1728, 2752, 1, 256, 1728, 1728, 256, 256]
    - [0, 8.753]
  - - [1856, 2752, 1, 256, 1856, 1856, 256, 256]
    - [0, 8.807]
  - - [1984, 2752, 1, 256, 1984, 1984, 256, 256]
    - [0, 8.858]
  - - [2112, 2752, 1, 256, 2112, 2112, 256, 256]
    - [0, 8.676]
  - - [2240, 2752, 1, 256, 2240, 2240, 256, 256]
    - [0, 8.671]
  - - [2368, 2752, 1, 256, 2368, 2368, 256, 256]
    - [0, 8.702]
  - - [2496, 2752, 1, 256, 2496, 2496, 256, 256]
    - [0, 8.733]
  - - [2624, 2752, 1, 256, 2624, 2624, 256, 256]
    - [0, 8.785]
  - - [2752, 2752, 1, 256, 2752, 2752, 256, 256]
    - [0, 8.736]
  - - [2880, 2752, 1, 256, 2880, 2880, 256, 256]
    - [0, 8.807]
  - - [3008, 2752, 1, 256, 3008, 3008, 256, 256]
    - [0, 8.792]
  - - [3136, 2752, 1, 256, 3136, 3136, 256, 256]
    - [0, 8.819]
  - - [3264, 2752, 1, 256, 3264, 3264, 256, 256]
    - [0, 8.796]
  - - [3392, 2752, 1, 256, 3392, 3392, 256, 256]
    - [0, 8.814]
  - - [3520, 2752, 1, 256, 3520, 3520, 256, 256]
    - [0, 8.864]
  - - [3648, 2752, 1, 256, 3648, 3648, 256, 256]
    - [0, 8.866]
  - - [3776, 2752, 1, 256, 3776, 3776, 256, 256]
    - [0, 8.754]
  - - [3904, 2752, 1, 256, 3904, 3904, 256, 256]
    - [0, 8.837]
  - - [4032, 2752, 1, 256, 4032, 4032, 256, 256]
    - [0, 8.918]
  - - [64, 2880, 1, 256, 64, 64, 256, 256]
    - [0, 6.749]
  - - [192, 2880, 1, 256, 192, 192, 256, 256]
    - [0, 7.82]
  - - [320, 2880, 1, 256, 320, 320, 256, 256]
    - [0, 7.896]
  - - [448, 2880, 1, 256, 448, 448, 256, 256]
    - [0, 8.186]
  - - [576, 2880, 1, 256, 576, 576, 256, 256]
    - [0, 8.384]
  - - [704, 2880, 1, 256, 704, 704, 256, 256]
    - [0, 8.479]
  - - [832, 2880, 1, 256, 832, 832, 256, 256]
    - [0, 8.574]
  - - [960, 2880, 1, 256, 960, 960, 256, 256]
    - [0, 8.601]
  - - [1088, 2880, 1, 256, 1088, 1088, 256, 256]
    - [0, 8.569]
  - - [1216, 2880, 1, 256, 1216, 1216, 256, 256]
    - [0, 8.694]
  - - [1344, 2880, 1, 256, 1344, 1344, 256, 256]
    - [0, 8.782]
  - - [1472, 2880, 1, 256, 1472, 1472, 256, 256]
    - [0, 8.756]
  - - [1600, 2880, 1, 256, 1600, 1600, 256, 256]
    - [0, 8.738]
  - - [1728, 2880, 1, 256, 1728, 1728, 256, 256]
    - [0, 8.79]
  - - [1856, 2880, 1, 256, 1856, 1856, 256, 256]
    - [0, 8.799]
  - - [1984, 2880, 1, 256, 1984, 1984, 256, 256]
    - [0, 8.874]
  - - [2112, 2880, 1, 256, 2112, 2112, 256, 256]
    - [0, 8.647]
  - - [2240, 2880, 1, 256, 2240, 2240, 256, 256]
    - [0, 8.676]
  - - [2368, 2880, 1, 256, 2368, 2368, 256, 256]
    - [0, 8.74]
  - - [2496, 2880, 1, 256, 2496, 2496, 256, 256]
    - [0, 8.79]
  - - [2624, 2880, 1, 256, 2624, 2624, 256, 256]
    - [0, 8.728]
  - - [2752, 2880, 1, 256, 2752, 2752, 256, 256]
    - [0, 8.706]
  - - [2880, 2880, 1, 256, 2880, 2880, 256, 256]
    - [0, 8.757]
  - - [3008, 2880, 1, 256, 3008, 3008, 256, 256]
    - [0, 8.798]
  - - [3136, 2880, 1, 256, 3136, 3136, 256, 256]
    - [0, 8.807]
  - - [3264, 2880, 1, 256, 3264, 3264, 256, 256]
    - [0, 8.808]
  - - [3392, 2880, 1, 256, 3392, 3392, 256, 256]
    - [0, 8.816]
  - - [3520, 2880, 1, 256, 3520, 3520, 256, 256]
    - [0, 8.835]
  - - [3648, 2880, 1, 256, 3648, 3648, 256, 256]
    - [0, 8.832]
  - - [3776, 2880, 1, 256, 3776, 3776, 256, 256]
    - [0, 8.909]
  - - [3904, 2880, 1, 256, 3904, 3904, 256, 256]
    - [0, 8.834]
  - - [4032, 2880, 1, 256, 4032, 4032, 256, 256]
    - [0, 8.875]
  - - [64, 3008, 1, 256, 64, 64, 256, 256]
    - [0, 6.237]
  - - [192, 3008, 1, 256, 192, 192, 256, 256]
    - [0, 7.89]
  - - [320, 3008, 1, 256, 320, 320, 256, 256]
    - [0, 7.976]
  - - [448, 3008, 1, 256, 448, 448, 256, 256]
    - [0, 8.192]
  - - [576, 3008, 1, 256, 576, 576, 256, 256]
    - [0, 8.473]
  - - [704, 3008, 1, 256, 704, 704, 256, 256]
    - [0, 8.529]
  - - [832, 3008, 1, 256, 832, 832, 256, 256]
    - [0, 8.618]
  - - [960, 3008, 1, 256, 960, 960, 256, 256]
    - [0, 8.657]
  - - [1088, 3008, 1, 256, 1088, 1088, 256, 256]
    - [0, 8.642]
  - - [1216, 3008, 1, 256, 1216, 1216, 256, 256]
    - [0, 8.758]
  - - [1344, 3008, 1, 256, 1344, 1344, 256, 256]
    - [0, 8.752]
  - - [1472, 3008, 1, 256, 1472, 1472, 256, 256]
    - [0, 8.813]
  - - [1600, 3008, 1, 256, 1600, 1600, 256, 256]
    - [0, 8.747]
  - - [1728, 3008, 1, 256, 1728, 1728, 256, 256]
    - [0, 8.863]
  - - [1856, 3008, 1, 256, 1856, 1856, 256, 256]
    - [0, 8.866]
  - - [1984, 3008, 1, 256, 1984, 1984, 256, 256]
    - [0, 8.7]
  - - [2112, 3008, 1, 256, 2112, 2112, 256, 256]
    - [0, 8.654]
  - - [2240, 3008, 1, 256, 2240, 2240, 256, 256]
    - [0, 8.809]
  - - [2368, 3008, 1, 256, 2368, 2368, 256, 256]
    - [0, 8.779]
  - - [2496, 3008, 1, 256, 2496, 2496, 256, 256]
    - [0, 8.732]
  - - [2624, 3008, 1, 256, 2624, 2624, 256, 256]
    - [0, 8.74]
  - - [2752, 3008, 1, 256, 2752, 2752, 256, 256]
    - [0, 8.836]
  - - [2880, 3008, 1, 256, 2880, 2880, 256, 256]
    - [0, 8.749]
  - - [3008, 3008, 1, 256, 3008, 3008, 256, 256]
    - [0, 8.77]
  - - [3136, 3008, 1, 256, 3136, 3136, 256, 256]
    - [0, 8.86]
  - - [3264, 3008, 1, 256, 3264, 3264, 256, 256]
    - [0, 8.854]
  - - [3392, 3008, 1, 256, 3392, 3392, 256, 256]
    - [0, 8.806]
  - - [3520, 3008, 1, 256, 3520, 3520, 256, 256]
    - [0, 8.822]
  - - [3648, 3008, 1, 256, 3648, 3648, 256, 256]
    - [0, 8.828]
  - - [3776, 3008, 1, 256, 3776, 3776, 256, 256]
    - [0, 8.872]
  - - [3904, 3008, 1, 256, 3904, 3904, 256, 256]
    - [0, 8.908]
  - - [4032, 3008, 1, 256, 4032, 4032, 256, 256]
    - [0, 8.896]
  - - [64, 3136, 1, 256, 64, 64, 256, 256]
    - [0, 6.479]
  - - [192, 3136, 1, 256, 192, 192, 256, 256]
    - [0, 7.944]
  - - [320, 3136, 1, 256, 320, 320, 256, 256]
    - [0, 7.928]
  - - [448, 3136, 1, 256, 448, 448, 256, 256]
    - [0, 8.202]
  - - [576, 3136, 1, 256, 576, 576, 256, 256]
    - [0, 8.46]
  - - [704, 3136, 1, 256, 704, 704, 256, 256]
    - [0, 8.525]
  - - [832, 3136, 1, 256, 832, 832, 256, 256]
    - [0, 8.564]
  - - [960, 3136, 1, 256, 960, 960, 256, 256]
    - [0, 8.619]
  - - [1088, 3136, 1, 256, 1088, 1088, 256, 256]
    - [0, 8.661]
  - - [1216, 3136, 1, 256, 1216, 1216, 256, 256]
    - [0, 8.764]
  - - [1344, 3136, 1, 256, 1344, 1344, 256, 256]
    - [0, 8.748]
  - - [1472, 3136, 1, 256, 1472, 1472, 256, 256]
    - [0, 8.784]
  - - [1600, 3136, 1, 256, 1600, 1600, 256, 256]
    - [0, 8.809]
  - - [1728, 3136, 1, 256, 1728, 1728, 256, 256]
    - [0, 8.803]
  - - [1856, 3136, 1, 256, 1856, 1856, 256, 256]
    - [0, 8.688]
  - - [1984, 3136, 1, 256, 1984, 1984, 256, 256]
    - [0, 8.69]
  - - [2112, 3136, 1, 256, 2112, 2112, 256, 256]
    - [0, 8.709]
  - - [2240, 3136, 1, 256, 2240, 2240, 256, 256]
    - [0, 8.749]
  - - [2368, 3136, 1, 256, 2368, 2368, 256, 256]
    - [0, 8.746]
  - - [2496, 3136, 1, 256, 2496, 2496, 256, 256]
    - [0, 8.716]
  - - [2624, 3136, 1, 256, 2624, 2624, 256, 256]
    - [0, 8.734]
  - - [2752, 3136, 1, 256, 2752, 2752, 256, 256]
    - [0, 8.812]
  - - [2880, 3136, 1, 256, 2880, 2880, 256, 256]
    - [0, 8.849]
  - - [3008, 3136, 1, 256, 3008, 3008, 256, 256]
    - [0, 8.752]
  - - [3136, 3136, 1, 256, 3136, 3136, 256, 256]
    - [0, 8.814]
  - - [3264, 3136, 1, 256, 3264, 3264, 256, 256]
    - [0, 8.815]
  - - [3392, 3136, 1, 256, 3392, 3392, 256, 256]
    - [0, 8.868]
  - - [3520, 3136, 1, 256, 3520, 3520, 256, 256]
    - [0, 8.793]
  - - [3648, 3136, 1, 256, 3648, 3648, 256, 256]
    - [0, 8.847]
  - - [3776, 3136, 1, 256, 3776, 3776, 256, 256]
    - [0, 8.884]
  - - [3904, 3136, 1, 256, 3904, 3904, 256, 256]
    - [0, 8.879]
  - - [4032, 3136, 1, 256, 4032, 4032, 256, 256]
    - [0, 8.906]
  - - [64, 3264, 1, 256, 64, 64, 256, 256]
    - [0, 6.773]
  - - [192, 3264, 1, 256, 192, 192, 256, 256]
    - [0, 7.961]
  - - [320, 3264, 1, 256, 320, 320, 256, 256]
    - [0, 8.025]
  - - [448, 3264, 1, 256, 448, 448, 256, 256]
    - [0, 8.264]
  - - [576, 3264, 1, 256, 576, 576, 256, 256]
    - [0, 8.469]
  - - [704, 3264, 1, 256, 704, 704, 256, 256]
    - [0, 8.528]
  - - [832, 3264, 1, 256, 832, 832, 256, 256]
    - [0, 8.594]
  - - [960, 3264, 1, 256, 960, 960, 256, 256]
    - [0, 8.668]
  - - [1088, 3264, 1, 256, 1088, 1088, 256, 256]
    - [0, 8.755]
  - - [1216, 3264, 1, 256, 1216, 1216, 256, 256]
    - [0, 8.737]
  - - [1344, 3264, 1, 256, 1344, 1344, 256, 256]
    - [0, 8.707]
  - - [1472, 3264, 1, 256, 1472, 1472, 256, 256]
    - [0, 8.744]
  - - [1600, 3264, 1, 256, 1600, 1600, 256, 256]
    - [0, 8.749]
  - - [1728, 3264, 1, 256, 1728, 1728, 256, 256]
    - [0, 8.81]
  - - [1856, 3264, 1, 256, 1856, 1856, 256, 256]
    - [0, 8.616]
  - - [1984, 3264, 1, 256, 1984, 1984, 256, 256]
    - [0, 8.689]
  - - [2112, 3264, 1, 256, 2112, 2112, 256, 256]
    - [0, 8.705]
  - - [2240, 3264, 1, 256, 2240, 2240, 256, 256]
    - [0, 8.749]
  - - [2368, 3264, 1, 256, 2368, 2368, 256, 256]
    - [0, 8.733]
  - - [2496, 3264, 1, 256, 2496, 2496, 256, 256]
    - [0, 8.738]
  - - [2624, 3264, 1, 256, 2624, 2624, 256, 256]
    - [0, 8.82]
  - - [2752, 3264, 1, 256, 2752, 2752, 256, 256]
    - [0, 8.78]
  - - [2880, 3264, 1, 256, 2880, 2880, 256, 256]
    - [0, 8.777]
  - - [3008, 3264, 1, 256, 3008, 3008, 256, 256]
    - [0, 8.818]
  - - [3136, 3264, 1, 256, 3136, 3136, 256, 256]
    - [0, 8.831]
  - - [3264, 3264, 1, 256, 3264, 3264, 256, 256]
    - [0, 8.881]
  - - [3392, 3264, 1, 256, 3392, 3392, 256, 256]
    - [0, 8.833]
  - - [3520, 3264, 1, 256, 3520, 3520, 256, 256]
    - [0, 8.91]
  - - [3648, 3264, 1, 256, 3648, 3648, 256, 256]
    - [0, 8.893]
  - - [3776, 3264, 1, 256, 3776, 3776, 256, 256]
    - [0, 8.834]
  - - [3904, 3264, 1, 256, 3904, 3904, 256, 256]
    - [0, 8.856]
  - - [4032, 3264, 1, 256, 4032, 4032, 256, 256]
    - [0, 8.853]
  - - [64, 3392, 1, 256, 64, 64, 256, 256]
    - [0, 6.39]
  - - [192, 3392, 1, 256, 192, 192, 256, 256]
    - [0, 7.996]
  - - [320, 3392, 1, 256, 320, 320, 256, 256]
    - [0, 8.097]
  - - [448, 3392, 1, 256, 448, 448, 256, 256]
    - [0, 8.361]
  - - [576, 3392, 1, 256, 576, 576, 256, 256]
    - [0, 8.46]
  - - [704, 3392, 1, 256, 704, 704, 256, 256]
    - [0, 8.613]
  - - [832, 3392, 1, 256, 832, 832, 256, 256]
    - [0, 8.592]
  - - [960, 3392, 1, 256, 960, 960, 256, 256]
    - [0, 8.784]
  - - [1088, 3392, 1, 256, 1088, 1088, 256, 256]
    - [0, 8.723]
  - - [1216, 3392, 1, 256, 1216, 1216, 256, 256]
    - [0, 8.75]
  - - [1344, 3392, 1, 256, 1344, 1344, 256, 256]
    - [0, 8.794]
  - - [1472, 3392, 1, 256, 1472, 1472, 256, 256]
    - [0, 8.714]
  - - [1600, 3392, 1, 256, 1600, 1600, 256, 256]
    - [0, 8.803]
  - - [1728, 3392, 1, 256, 1728, 1728, 256, 256]
    - [0, 8.68]
  - - [1856, 3392, 1, 256, 1856, 1856, 256, 256]
    - [0, 8.711]
  - - [1984, 3392, 1, 256, 1984, 1984, 256, 256]
    - [0, 8.752]
  - - [2112, 3392, 1, 256, 2112, 2112, 256, 256]
    - [0, 8.742]
  - - [2240, 3392, 1, 256, 2240, 2240, 256, 256]
    - [0, 8.791]
  - - [2368, 3392, 1, 256, 2368, 2368, 256, 256]
    - [0, 8.774]
  - - [2496, 3392, 1, 256, 2496, 2496, 256, 256]
    - [0, 8.821]
  - - [2624, 3392, 1, 256, 2624, 2624, 256, 256]
    - [0, 8.862]
  - - [2752, 3392, 1, 256, 2752, 2752, 256, 256]
    - [0, 8.819]
  - - [2880, 3392, 1, 256, 2880, 2880, 256, 256]
    - [0, 8.804]
  - - [3008, 3392, 1, 256, 3008, 3008, 256, 256]
    - [0, 8.813]
  - - [3136, 3392, 1, 256, 3136, 3136, 256, 256]
    - [0, 8.811]
  - - [3264, 3392, 1, 256, 3264, 3264, 256, 256]
    - [0, 8.821]
  - - [3392, 3392, 1, 256, 3392, 3392, 256, 256]
    - [0, 8.826]
  - - [3520, 3392, 1, 256, 3520, 3520, 256, 256]
    - [0, 8.803]
  - - [3648, 3392, 1, 256, 3648, 3648, 256, 256]
    - [0, 8.886]
  - - [3776, 3392, 1, 256, 3776, 3776, 256, 256]
    - [0, 8.866]
  - - [3904, 3392, 1, 256, 3904, 3904, 256, 256]
    - [0, 8.825]
  - - [4032, 3392, 1, 256, 4032, 4032, 256, 256]
    - [0, 8.917]
  - - [64, 3520, 1, 256, 64, 64, 256, 256]
    - [0, 6.595]
  - - [192, 3520, 1, 256, 192, 192, 256, 256]
    - [0, 7.997]
  - - [320, 3520, 1, 256, 320, 320, 256, 256]
    - [0, 8.181]
  - - [448, 3520, 1, 256, 448, 448, 256, 256]
    - [0, 8.354]
  - - [576, 3520, 1, 256, 576, 576, 256, 256]
    - [0, 8.498]
  - - [704, 3520, 1, 256, 704, 704, 256, 256]
    - [0, 8.517]
  - - [832, 3520, 1, 256, 832, 832, 256, 256]
    - [0, 8.654]
  - - [960, 3520, 1, 256, 960, 960, 256, 256]
    - [0, 8.677]
  - - [1088, 3520, 1, 256, 1088, 1088, 256, 256]
    - [0, 8.717]
  - - [1216, 3520, 1, 256, 1216, 1216, 256, 256]
    - [0, 8.757]
  - - [1344, 3520, 1, 256, 1344, 1344, 256, 256]
    - [0, 8.8]
  - - [1472, 3520, 1, 256, 1472, 1472, 256, 256]
    - [0, 8.757]
  - - [1600, 3520, 1, 256, 1600, 1600, 256, 256]
    - [0, 8.848]
  - - [1728, 3520, 1, 256, 1728, 1728, 256, 256]
    - [0, 8.719]
  - - [1856, 3520, 1, 256, 1856, 1856, 256, 256]
    - [0, 8.715]
  - - [1984, 3520, 1, 256, 1984, 1984, 256, 256]
    - [0, 8.747]
  - - [2112, 3520, 1, 256, 2112, 2112, 256, 256]
    - [0, 8.743]
  - - [2240, 3520, 1, 256, 2240, 2240, 256, 256]
    - [0, 8.755]
  - - [2368, 3520, 1, 256, 2368, 2368, 256, 256]
    - [0, 8.77]
  - - [2496, 3520, 1, 256, 2496, 2496, 256, 256]
    - [0, 8.791]
  - - [2624, 3520, 1, 256, 2624, 2624, 256, 256]
    - [0, 8.846]
  - - [2752, 3520, 1, 256, 2752, 2752, 256, 256]
    - [0, 8.87]
  - - [2880, 3520, 1, 256, 2880, 2880, 256, 256]
    - [0, 8.85]
  - - [3008, 3520, 1, 256, 3008, 3008, 256, 256]
    - [0, 8.832]
  - - [3136, 3520, 1, 256, 3136, 3136, 256, 256]
    - [0, 8.823]
  - - [3264, 3520, 1, 256, 3264, 3264, 256, 256]
    - [0, 8.868]
  - - [3392, 3520, 1, 256, 3392, 3392, 256, 256]
    - [0, 8.87]
  - - [3520, 3520, 1, 256, 3520, 3520, 256, 256]
    - [0, 8.879]
  - - [3648, 3520, 1, 256, 3648, 3648, 256, 256]
    - [0, 8.863]
  - - [3776, 3520, 1, 256, 3776, 3776, 256, 256]
    - [0, 8.899]
  - - [3904, 3520, 1, 256, 3904, 3904, 256, 256]
    - [0, 8.929]
  - - [4032, 3520, 1, 256, 4032, 4032, 256, 256]
    - [0, 8.866]
  - - [64, 3648, 1, 256, 64, 64, 256, 256]
    - [0, 6.794]
  - - [192, 3648, 1, 256, 192, 192, 256, 256]
    - [0, 8.008]
  - - [320, 3648, 1, 256, 320, 320, 256, 256]
    - [0, 8.076]
  - - [448, 3648, 1, 256, 448, 448, 256, 256]
    - [0, 8.377]
  - - [576, 3648, 1, 256, 576, 576, 256, 256]
    - [0, 8.543]
  - - [704, 3648, 1, 256, 704, 704, 256, 256]
    - [0, 8.542]
  - - [832, 3648, 1, 256, 832, 832, 256, 256]
    - [0, 8.649]
  - - [960, 3648, 1, 256, 960, 960, 256, 256]
    - [0, 8.721]
  - - [1088, 3648, 1, 256, 1088, 1088, 256, 256]
    - [0, 8.715]
  - - [1216, 3648, 1, 256, 1216, 1216, 256, 256]
    - [0, 8.808]
  - - [1344, 3648, 1, 256, 1344, 1344, 256, 256]
    - [0, 8.853]
  - - [1472, 3648, 1, 256, 1472, 1472, 256, 256]
    - [0, 8.764]
  - - [1600, 3648, 1, 256, 1600, 1600, 256, 256]
    - [0, 8.717]
  - - [1728, 3648, 1, 256, 1728, 1728, 256, 256]
    - [0, 8.691]
  - - [1856, 3648, 1, 256, 1856, 1856, 256, 256]
    - [0, 8.758]
  - - [1984, 3648, 1, 256, 1984, 1984, 256, 256]
    - [0, 8.748]
  - - [2112, 3648, 1, 256, 2112, 2112, 256, 256]
    - [0, 8.695]
  - - [2240, 3648, 1, 256, 2240, 2240, 256, 256]
    - [0, 8.715]
  - - [2368, 3648, 1, 256, 2368, 2368, 256, 256]
    - [0, 8.74]
  - - [2496, 3648, 1, 256, 2496, 2496, 256, 256]
    - [0, 8.83]
  - - [2624, 3648, 1, 256, 2624, 2624, 256, 256]
    - [0, 8.749]
  - - [2752, 3648, 1, 256, 2752, 2752, 256, 256]
    - [0, 8.816]
  - - [2880, 3648, 1, 256, 2880, 2880, 256, 256]
    - [0, 8.888]
  - - [3008, 3648, 1, 256, 3008, 3008, 256, 256]
    - [0, 8.77]
  - - [3136, 3648, 1, 256, 3136, 3136, 256, 256]
    - [0, 8.824]
  - - [3264, 3648, 1, 256, 3264, 3264, 256, 256]
    - [0, 8.879]
  - - [3392, 3648, 1, 256, 3392, 3392, 256, 256]
    - [0, 8.869]
  - - [3520, 3648, 1, 256, 3520, 3520, 256, 256]
    - [0, 8.908]
  - - [3648, 3648, 1, 256, 3648, 3648, 256, 256]
    - [0, 8.869]
  - - [3776, 3648, 1, 256, 3776, 3776, 256, 256]
    - [0, 8.893]
  - - [3904, 3648, 1, 256, 3904, 3904, 256, 256]
    - [0, 8.954]
  - - [4032, 3648, 1, 256, 4032, 4032, 256, 256]
    - [0, 8.834]
  - - [64, 3776, 1, 256, 64, 64, 256, 256]
    - [0, 7.027]
  - - [192, 3776, 1, 256, 192, 192, 256, 256]
    - [0, 7.704]
  - - [320, 3776, 1, 256, 320, 320, 256, 256]
    - [0, 8.17]
  - - [448, 3776, 1, 256, 448, 448, 256, 256]
    - [0, 8.405]
  - - [576, 3776, 1, 256, 576, 576, 256, 256]
    - [0, 8.483]
  - - [704, 3776, 1, 256, 704, 704, 256, 256]
    - [0, 8.654]
  - - [832, 3776, 1, 256, 832, 832, 256, 256]
    - [0, 8.584]
  - - [960, 3776, 1, 256, 960, 960, 256, 256]
    - [0, 8.697]
  - - [1088, 3776, 1, 256, 1088, 1088, 256, 256]
    - [0, 8.744]
  - - [1216, 3776, 1, 256, 1216, 1216, 256, 256]
    - [0, 8.742]
  - - [1344, 3776, 1, 256, 1344, 1344, 256, 256]
    - [0, 8.907]
  - - [1472, 3776, 1, 256, 1472, 1472, 256, 256]
    - [0, 8.817]
  - - [1600, 3776, 1, 256, 1600, 1600, 256, 256]
    - [0, 8.707]
  - - [1728, 3776, 1, 256, 1728, 1728, 256, 256]
    - [0, 8.757]
  - - [1856, 3776, 1, 256, 1856, 1856, 256, 256]
    - [0, 8.712]
  - - [1984, 3776, 1, 256, 1984, 1984, 256, 256]
    - [0, 8.794]
  - - [2112, 3776, 1, 256, 2112, 2112, 256, 256]
    - [0, 8.739]
  - - [2240, 3776, 1, 256, 2240, 2240, 256, 256]
    - [0, 8.748]
  - - [2368, 3776, 1, 256, 2368, 2368, 256, 256]
    - [0, 8.792]
  - - [2496, 3776, 1, 256, 2496, 2496, 256, 256]
    - [0, 8.757]
  - - [2624, 3776, 1, 256, 2624, 2624, 256, 256]
    - [0, 8.778]
  - - [2752, 3776, 1, 256, 2752, 2752, 256, 256]
    - [0, 8.759]
  - - [2880, 3776, 1, 256, 2880, 2880, 256, 256]
    - [0, 8.828]
  - - [3008, 3776, 1, 256, 3008, 3008, 256, 256]
    - [0, 8.961]
  - - [3136, 3776, 1, 256, 3136, 3136, 256, 256]
    - [0, 8.835]
  - - [3264, 3776, 1, 256, 3264, 3264, 256, 256]
    - [0, 8.827]
  - - [3392, 3776, 1, 256, 3392, 3392, 256, 256]
    - [0, 8.834]
  - - [3520, 3776, 1, 256, 3520, 3520, 256, 256]
    - [0, 8.871]
  - - [3648, 3776, 1, 256, 3648, 3648, 256, 256]
    - [0, 8.779]
  - - [3776, 3776, 1, 256, 3776, 3776, 256, 256]
    - [0, 8.864]
  - - [3904, 3776, 1, 256, 3904, 3904, 256, 256]
    - [0, 8.841]
  - - [4032, 3776, 1, 256, 4032, 4032, 256, 256]
    - [0, 8.835]
  - - [64, 3904, 1, 256, 64, 64, 256, 256]
    - [0, 6.744]
  - - [192, 3904, 1, 256, 192, 192, 256, 256]
    - [0, 7.542]
  - - [320, 3904, 1, 256, 320, 320, 256, 256]
    - [0, 8.27]
  - - [448, 3904, 1, 256, 448, 448, 256, 256]
    - [0, 8.355]
  - - [576, 3904, 1, 256, 576, 576, 256, 256]
    - [0, 8.545]
  - - [704, 3904, 1, 256, 704, 704, 256, 256]
    - [0, 8.592]
  - - [832, 3904, 1, 256, 832, 832, 256, 256]
    - [0, 8.637]
  - - [960, 3904, 1, 256, 960, 960, 256, 256]
    - [0, 8.658]
  - - [1088, 3904, 1, 256, 1088, 1088, 256, 256]
    - [0, 8.719]
  - - [1216, 3904, 1, 256, 1216, 1216, 256, 256]
    - [0, 8.763]
  - - [1344, 3904, 1, 256, 1344, 1344, 256, 256]
    - [0, 8.779]
  - - [1472, 3904, 1, 256, 1472, 1472, 256, 256]
    - [0, 8.679]
  - - [1600, 3904, 1, 256, 1600, 1600, 256, 256]
    - [0, 8.716]
  - - [1728, 3904, 1, 256, 1728, 1728, 256, 256]
    - [0, 8.712]
  - - [1856, 3904, 1, 256, 1856, 1856, 256, 256]
    - [0, 8.727]
  - - [1984, 3904, 1, 256, 1984, 1984, 256, 256]
    - [0, 8.767]
  - - [2112, 3904, 1, 256, 2112, 2112, 256, 256]
    - [0, 8.721]
  - - [2240, 3904, 1, 256, 2240, 2240, 256, 256]
    - [0, 8.772]
  - - [2368, 3904, 1, 256, 2368, 2368, 256, 256]
    - [0, 8.809]
  - - [2496, 3904, 1, 256, 2496, 2496, 256, 256]
    - [0, 8.868]
  - - [2624, 3904, 1, 256, 2624, 2624, 256, 256]
    - [0, 8.843]
  - - [2752, 3904, 1, 256, 2752, 2752, 256, 256]
    - [0, 8.803]
  - - [2880, 3904, 1, 256, 2880, 2880, 256, 256]
    - [0, 8.821]
  - - [3008, 3904, 1, 256, 3008, 3008, 256, 256]
    - [0, 8.843]
  - - [3136, 3904, 1, 256, 3136, 3136, 256, 256]
    - [0, 8.883]
  - - [3264, 3904, 1, 256, 3264, 3264, 256, 256]
    - [0, 8.795]
  - - [3392, 3904, 1, 256, 3392, 3392, 256, 256]
    - [0, 8.877]
  - - [3520, 3904, 1, 256, 3520, 3520, 256, 256]
    - [0, 8.89]
  - - [3648, 3904, 1, 256, 3648, 3648, 256, 256]
    - [0, 8.841]
  - - [3776, 3904, 1, 256, 3776, 3776, 256, 256]
    - [0, 8.883]
  - - [3904, 3904, 1, 256, 3904, 3904, 256, 256]
    - [0, 8.856]
  - - [4032, 3904, 1, 256, 4032, 4032, 256, 256]
    - [0, 8.899]
  - - [64, 4032, 1, 256, 64, 64, 256, 256]
    - [0, 6.915]
  - - [192, 4032, 1, 256, 192, 192, 256, 256]
    - [0, 7.767]
  - - [320, 4032, 1, 256, 320, 320, 256, 256]
    - [0, 8.25]
  - - [448, 4032, 1, 256, 448, 448, 256, 256]
    - [0, 8.407]
  - - [576, 4032, 1, 256, 576, 576, 256, 256]
    - [0, 8.589]
  - - [704, 4032, 1, 256, 704, 704, 256, 256]
    - [0, 8.603]
  - - [832, 4032, 1, 256, 832, 832, 256, 256]
    - [0, 8.612]
  - - [960, 4032, 1, 256, 960, 960, 256, 256]
    - [0, 8.752]
  - - [1088, 4032, 1, 256, 1088, 1088, 256, 256]
    - [0, 8.73]
  - - [1216, 4032, 1, 256, 1216, 1216, 256, 256]
    - [0, 8.775]
  - - [1344, 4032, 1, 256, 1344, 1344, 256, 256]
    - [0, 8.838]
  - - [1472, 4032, 1, 256, 1472, 1472, 256, 256]
    - [0, 8.682]
  - - [1600, 4032, 1, 256, 1600, 1600, 256, 256]
    - [0, 8.714]
  - - [1728, 4032, 1, 256, 1728, 1728, 256, 256]
    - [0, 8.77]
  - - [1856, 4032, 1, 256, 1856, 1856, 256, 256]
    - [0, 8.773]
  - - [1984, 4032, 1, 256, 1984, 1984, 256, 256]
    - [0, 8.816]
  - - [2112, 4032, 1, 256, 2112, 2112, 256, 256]
    - [0, 8.742]
  - - [2240, 4032, 1, 256, 2240, 2240, 256, 256]
    - [0, 8.806]
  - - [2368, 4032, 1, 256, 2368, 2368, 256, 256]
    - [0, 8.819]
  - - [2496, 4032, 1, 256, 2496, 2496, 256, 256]
    - [0, 8.858]
  - - [2624, 4032, 1, 256, 2624, 2624, 256, 256]
    - [0, 8.797]
  - - [2752, 4032, 1, 256, 2752, 2752, 256, 256]
    - [0, 8.832]
  - - [2880, 4032, 1, 256, 2880, 2880, 256, 256]
    - [0, 8.822]
  - - [3008, 4032, 1, 256, 3008, 3008, 256, 256]
    - [0, 8.864]
  - - [3136, 4032, 1, 256, 3136, 3136, 256, 256]
    - [0, 8.874]
  - - [3264, 4032, 1, 256, 3264, 3264, 256, 256]
    - [0, 8.85]
  - - [3392, 4032, 1, 256, 3392, 3392, 256, 256]
    - [0, 8.802]
  - - [3520, 4032, 1, 256, 3520, 3520, 256, 256]
    - [0, 8.928]
  - - [3648, 4032, 1, 256, 3648, 3648, 256, 256]
    - [0, 8.866]
  - - [3776, 4032, 1, 256, 3776, 3776, 256, 256]
    - [0, 8.887]
  - - [3904, 4032, 1, 256, 3904, 3904, 256, 256]
    - [0, 8.881]
  - - [4032, 4032, 1, 256, 4032, 4032, 256, 256]
    - [0, 8.898]
  - - [64, 64, 1, 512, 64, 64, 512, 512]
    - [1, 0.789]
  - - [192, 64, 1, 512, 192, 192, 512, 512]
    - [3, 2.087]
  - - [320, 64, 1, 512, 320, 320, 512, 512]
    - [0, 2.978]
  - - [448, 64, 1, 512, 448, 448, 512, 512]
    - [0, 4.153]
  - - [576, 64, 1, 512, 576, 576, 512, 512]
    - [0, 3.629]
  - - [704, 64, 1, 512, 704, 704, 512, 512]
    - [0, 4.404]
  - - [832, 64, 1, 512, 832, 832, 512, 512]
    - [0, 5.206]
  - - [960, 64, 1, 512, 960, 960, 512, 512]
    - [0, 5.993]
  - - [1088, 64, 1, 512, 1088, 1088, 512, 512]
    - [0, 5.088]
  - - [1216, 64, 1, 512, 1216, 1216, 512, 512]
    - [0, 5.679]
  - - [1344, 64, 1, 512, 1344, 1344, 512, 512]
    - [0, 6.272]
  - - [1472, 64, 1, 512, 1472, 1472, 512, 512]
    - [0, 5.544]
  - - [1600, 64, 1, 512, 1600, 1600, 512, 512]
    - [0, 5.974]
  - - [1728, 64, 1, 512, 1728, 1728, 512, 512]
    - [0, 6.446]
  - - [1856, 64, 1, 512, 1856, 1856, 512, 512]
    - [0, 6.913]
  - - [1984, 64, 1, 512, 1984, 1984, 512, 512]
    - [0, 6.199]
  - - [2112, 64, 1, 512, 2112, 2112, 512, 512]
    - [0, 6.553]
  - - [2240, 64, 1, 512, 2240, 2240, 512, 512]
    - [0, 6.943]
  - - [2368, 64, 1, 512, 2368, 2368, 512, 512]
    - [0, 7.314]
  - - [2496, 64, 1, 512, 2496, 2496, 512, 512]
    - [0, 6.657]
  - - [2624, 64, 1, 512, 2624, 2624, 512, 512]
    - [0, 6.972]
  - - [2752, 64, 1, 512, 2752, 2752, 512, 512]
    - [0, 7.285]
  - - [2880, 64, 1, 512, 2880, 2880, 512, 512]
    - [0, 7.616]
  - - [3008, 64, 1, 512, 3008, 3008, 512, 512]
    - [0, 7.007]
  - - [3136, 64, 1, 512, 3136, 3136, 512, 512]
    - [0, 7.277]
  - - [3264, 64, 1, 512, 3264, 3264, 512, 512]
    - [0, 7.575]
  - - [3392, 64, 1, 512, 3392, 3392, 512, 512]
    - [0, 7.084]
  - - [3520, 64, 1, 512, 3520, 3520, 512, 512]
    - [0, 7.275]
  - - [3648, 64, 1, 512, 3648, 3648, 512, 512]
    - [0, 7.536]
  - - [3776, 64, 1, 512, 3776, 3776, 512, 512]
    - [0, 7.797]
  - - [3904, 64, 1, 512, 3904, 3904, 512, 512]
    - [0, 7.338]
  - - [4032, 64, 1, 512, 4032, 4032, 512, 512]
    - [0, 7.529]
  - - [64, 192, 1, 512, 64, 64, 512, 512]
    - [3, 2.091]
  - - [192, 192, 1, 512, 192, 192, 512, 512]
    - [0, 3.641]
  - - [320, 192, 1, 512, 320, 320, 512, 512]
    - [0, 5.993]
  - - [448, 192, 1, 512, 448, 448, 512, 512]
    - [0, 6.251]
  - - [576, 192, 1, 512, 576, 576, 512, 512]
    - [0, 6.436]
  - - [704, 192, 1, 512, 704, 704, 512, 512]
    - [0, 6.568]
  - - [832, 192, 1, 512, 832, 832, 512, 512]
    - [0, 6.674]
  - - [960, 192, 1, 512, 960, 960, 512, 512]
    - [0, 7.665]
  - - [1088, 192, 1, 512, 1088, 1088, 512, 512]
    - [0, 7.587]
  - - [1216, 192, 1, 512, 1216, 1216, 512, 512]
    - [0, 7.561]
  - - [1344, 192, 1, 512, 1344, 1344, 512, 512]
    - [0, 7.554]
  - - [1472, 192, 1, 512, 1472, 1472, 512, 512]
    - [0, 7.529]
  - - [1600, 192, 1, 512, 1600, 1600, 512, 512]
    - [0, 8.129]
  - - [1728, 192, 1, 512, 1728, 1728, 512, 512]
    - [0, 8.048]
  - - [1856, 192, 1, 512, 1856, 1856, 512, 512]
    - [0, 8.017]
  - - [1984, 192, 1, 512, 1984, 1984, 512, 512]
    - [0, 7.608]
  - - [2112, 192, 1, 512, 2112, 2112, 512, 512]
    - [0, 7.582]
  - - [2240, 192, 1, 512, 2240, 2240, 512, 512]
    - [0, 7.966]
  - - [2368, 192, 1, 512, 2368, 2368, 512, 512]
    - [0, 7.933]
  - - [2496, 192, 1, 512, 2496, 2496, 512, 512]
    - [0, 7.901]
  - - [2624, 192, 1, 512, 2624, 2624, 512, 512]
    - [0, 7.905]
  - - [2752, 192, 1, 512, 2752, 2752, 512, 512]
    - [0, 7.89]
  - - [2880, 192, 1, 512, 2880, 2880, 512, 512]
    - [0, 8.171]
  - - [3008, 192, 1, 512, 3008, 3008, 512, 512]
    - [0, 8.143]
  - - [3136, 192, 1, 512, 3136, 3136, 512, 512]
    - [0, 8.138]
  - - [3264, 192, 1, 512, 3264, 3264, 512, 512]
    - [0, 8.106]
  - - [3392, 192, 1, 512, 3392, 3392, 512, 512]
    - [0, 8.123]
  - - [3520, 192, 1, 512, 3520, 3520, 512, 512]
    - [0, 8.318]
  - - [3648, 192, 1, 512, 3648, 3648, 512, 512]
    - [0, 8.294]
  - - [3776, 192, 1, 512, 3776, 3776, 512, 512]
    - [0, 8.285]
  - - [3904, 192, 1, 512, 3904, 3904, 512, 512]
    - [0, 8.263]
  - - [4032, 192, 1, 512, 4032, 4032, 512, 512]
    - [0, 8.409]
  - - [64, 320, 1, 512, 64, 64, 512, 512]
    - [0, 2.923]
  - - [192, 320, 1, 512, 192, 192, 512, 512]
    - [0, 5.999]
  - - [320, 320, 1, 512, 320, 320, 512, 512]
    - [0, 5.982]
  - - [448, 320, 1, 512, 448, 448, 512, 512]
    - [0, 6.953]
  - - [576, 320, 1, 512, 576, 576, 512, 512]
    - [0, 7.674]
  - - [704, 320, 1, 512, 704, 704, 512, 512]
    - [0, 7.31]
  - - [832, 320, 1, 512, 832, 832, 512, 512]
    - [0, 7.77]
  - - [960, 320, 1, 512, 960, 960, 512, 512]
    - [0, 8.129]
  - - [1088, 320, 1, 512, 1088, 1088, 512, 512]
    - [0, 7.859]
  - - [1216, 320, 1, 512, 1216, 1216, 512, 512]
    - [0, 7.726]
  - - [1344, 320, 1, 512, 1344, 1344, 512, 512]
    - [0, 7.961]
  - - [1472, 320, 1, 512, 1472, 1472, 512, 512]
    - [0, 7.796]
  - - [1600, 320, 1, 512, 1600, 1600, 512, 512]
    - [0, 7.991]
  - - [1728, 320, 1, 512, 1728, 1728, 512, 512]
    - [0, 8.172]
  - - [1856, 320, 1, 512, 1856, 1856, 512, 512]
    - [0, 8.045]
  - - [1984, 320, 1, 512, 1984, 1984, 512, 512]
    - [0, 8.172]
  - - [2112, 320, 1, 512, 2112, 2112, 512, 512]
    - [0, 8.313]
  - - [2240, 320, 1, 512, 2240, 2240, 512, 512]
    - [0, 8.181]
  - - [2368, 320, 1, 512, 2368, 2368, 512, 512]
    - [0, 8.31]
  - - [2496, 320, 1, 512, 2496, 2496, 512, 512]
    - [0, 8.42]
  - - [2624, 320, 1, 512, 2624, 2624, 512, 512]
    - [0, 8.306]
  - - [2752, 320, 1, 512, 2752, 2752, 512, 512]
    - [0, 8.406]
  - - [2880, 320, 1, 512, 2880, 2880, 512, 512]
    - [0, 8.5]
  - - [3008, 320, 1, 512, 3008, 3008, 512, 512]
    - [0, 8.423]
  - - [3136, 320, 1, 512, 3136, 3136, 512, 512]
    - [0, 8.484]
  - - [3264, 320, 1, 512, 3264, 3264, 512, 512]
    - [0, 8.546]
  - - [3392, 320, 1, 512, 3392, 3392, 512, 512]
    - [0, 8.468]
  - - [3520, 320, 1, 512, 3520, 3520, 512, 512]
    - [0, 8.562]
  - - [3648, 320, 1, 512, 3648, 3648, 512, 512]
    - [0, 8.597]
  - - [3776, 320, 1, 512, 3776, 3776, 512, 512]
    - [0, 8.562]
  - - [3904, 320, 1, 512, 3904, 3904, 512, 512]
    - [0, 8.596]
  - - [4032, 320, 1, 512, 4032, 4032, 512, 512]
    - [0, 8.664]
  - - [64, 448, 1, 512, 64, 64, 512, 512]
    - [0, 4.16]
  - - [192, 448, 1, 512, 192, 192, 512, 512]
    - [0, 6.28]
  - - [320, 448, 1, 512, 320, 320, 512, 512]
    - [0, 6.971]
  - - [448, 448, 1, 512, 448, 448, 512, 512]
    - [0, 7.324]
  - - [576, 448, 1, 512, 576, 576, 512, 512]
    - [0, 7.57]
  - - [704, 448, 1, 512, 704, 704, 512, 512]
    - [0, 7.706]
  - - [832, 448, 1, 512, 832, 832, 512, 512]
    - [0, 7.456]
  - - [960, 448, 1, 512, 960, 960, 512, 512]
    - [0, 7.96]
  - - [1088, 448, 1, 512, 1088, 1088, 512, 512]
    - [0, 8.038]
  - - [1216, 448, 1, 512, 1216, 1216, 512, 512]
    - [0, 8.087]
  - - [1344, 448, 1, 512, 1344, 1344, 512, 512]
    - [0, 8.115]
  - - [1472, 448, 1, 512, 1472, 1472, 512, 512]
    - [0, 8.158]
  - - [1600, 448, 1, 512, 1600, 1600, 512, 512]
    - [0, 8.211]
  - - [1728, 448, 1, 512, 1728, 1728, 512, 512]
    - [0, 8.289]
  - - [1856, 448, 1, 512, 1856, 1856, 512, 512]
    - [0, 8.475]
  - - [1984, 448, 1, 512, 1984, 1984, 512, 512]
    - [0, 8.457]
  - - [2112, 448, 1, 512, 2112, 2112, 512, 512]
    - [0, 8.479]
  - - [2240, 448, 1, 512, 2240, 2240, 512, 512]
    - [0, 8.494]
  - - [2368, 448, 1, 512, 2368, 2368, 512, 512]
    - [0, 8.495]
  - - [2496, 448, 1, 512, 2496, 2496, 512, 512]
    - [0, 8.493]
  - - [2624, 448, 1, 512, 2624, 2624, 512, 512]
    - [0, 8.51]
  - - [2752, 448, 1, 512, 2752, 2752, 512, 512]
    - [0, 8.539]
  - - [2880, 448, 1, 512, 2880, 2880, 512, 512]
    - [0, 8.659]
  - - [3008, 448, 1, 512, 3008, 3008, 512, 512]
    - [0, 8.65]
  - - [3136, 448, 1, 512, 3136, 3136, 512, 512]
    - [0, 8.674]
  - - [3264, 448, 1, 512, 3264, 3264, 512, 512]
    - [0, 8.693]
  - - [3392, 448, 1, 512, 3392, 3392, 512, 512]
    - [0, 8.653]
  - - [3520, 448, 1, 512, 3520, 3520, 512, 512]
    - [0, 8.656]
  - - [3648, 448, 1, 512, 3648, 3648, 512, 512]
    - [0, 8.666]
  - - [3776, 448, 1, 512, 3776, 3776, 512, 512]
    - [0, 8.761]
  - - [3904, 448, 1, 512, 3904, 3904, 512, 512]
    - [0, 8.765]
  - - [4032, 448, 1, 512, 4032, 4032, 512, 512]
    - [0, 8.726]
  - - [64, 576, 1, 512, 64, 64, 512, 512]
    - [0, 3.625]
  - - [192, 576, 1, 512, 192, 192, 512, 512]
    - [0, 6.439]
  - - [320, 576, 1, 512, 320, 320, 512, 512]
    - [0, 7.671]
  - - [448, 576, 1, 512, 448, 448, 512, 512]
    - [0, 7.563]
  - - [576, 576, 1, 512, 576, 576, 512, 512]
    - [0, 8.065]
  - - [704, 576, 1, 512, 704, 704, 512, 512]
    - [0, 7.579]
  - - [832, 576, 1, 512, 832, 832, 512, 512]
    - [0, 7.92]
  - - [960, 576, 1, 512, 960, 960, 512, 512]
    - [0, 8.17]
  - - [1088, 576, 1, 512, 1088, 1088, 512, 512]
    - [0, 8.09]
  - - [1216, 576, 1, 512, 1216, 1216, 512, 512]
    - [0, 8.281]
  - - [1344, 576, 1, 512, 1344, 1344, 512, 512]
    - [0, 8.235]
  - - [1472, 576, 1, 512, 1472, 1472, 512, 512]
    - [0, 8.437]
  - - [1600, 576, 1, 512, 1600, 1600, 512, 512]
    - [0, 8.503]
  - - [1728, 576, 1, 512, 1728, 1728, 512, 512]
    - [0, 8.415]
  - - [1856, 576, 1, 512, 1856, 1856, 512, 512]
    - [0, 8.551]
  - - [1984, 576, 1, 512, 1984, 1984, 512, 512]
    - [0, 8.494]
  - - [2112, 576, 1, 512, 2112, 2112, 512, 512]
    - [0, 8.588]
  - - [2240, 576, 1, 512, 2240, 2240, 512, 512]
    - [0, 8.662]
  - - [2368, 576, 1, 512, 2368, 2368, 512, 512]
    - [0, 8.626]
  - - [2496, 576, 1, 512, 2496, 2496, 512, 512]
    - [0, 8.656]
  - - [2624, 576, 1, 512, 2624, 2624, 512, 512]
    - [0, 8.716]
  - - [2752, 576, 1, 512, 2752, 2752, 512, 512]
    - [0, 8.664]
  - - [2880, 576, 1, 512, 2880, 2880, 512, 512]
    - [0, 8.74]
  - - [3008, 576, 1, 512, 3008, 3008, 512, 512]
    - [0, 8.703]
  - - [3136, 576, 1, 512, 3136, 3136, 512, 512]
    - [0, 8.738]
  - - [3264, 576, 1, 512, 3264, 3264, 512, 512]
    - [0, 8.803]
  - - [3392, 576, 1, 512, 3392, 3392, 512, 512]
    - [0, 8.768]
  - - [3520, 576, 1, 512, 3520, 3520, 512, 512]
    - [0, 8.846]
  - - [3648, 576, 1, 512, 3648, 3648, 512, 512]
    - [0, 8.742]
  - - [3776, 576, 1, 512, 3776, 3776, 512, 512]
    - [0, 8.774]
  - - [3904, 576, 1, 512, 3904, 3904, 512, 512]
    - [0, 8.769]
  - - [4032, 576, 1, 512, 4032, 4032, 512, 512]
    - [0, 8.803]
  - - [64, 704, 1, 512, 64, 64, 512, 512]
    - [0, 4.422]
  - - [192, 704, 1, 512, 192, 192, 512, 512]
    - [0, 6.584]
  - - [320, 704, 1, 512, 320, 320, 512, 512]
    - [0, 7.318]
  - - [448, 704, 1, 512, 448, 448, 512, 512]
    - [0, 7.693]
  - - [576, 704, 1, 512, 576, 576, 512, 512]
    - [0, 7.577]
  - - [704, 704, 1, 512, 704, 704, 512, 512]
    - [0, 7.785]
  - - [832, 704, 1, 512, 832, 832, 512, 512]
    - [0, 8.098]
  - - [960, 704, 1, 512, 960, 960, 512, 512]
    - [0, 8.306]
  - - [1088, 704, 1, 512, 1088, 1088, 512, 512]
    - [0, 8.379]
  - - [1216, 704, 1, 512, 1216, 1216, 512, 512]
    - [0, 8.442]
  - - [1344, 704, 1, 512, 1344, 1344, 512, 512]
    - [0, 8.473]
  - - [1472, 704, 1, 512, 1472, 1472, 512, 512]
    - [0, 8.523]
  - - [1600, 704, 1, 512, 1600, 1600, 512, 512]
    - [0, 8.547]
  - - [1728, 704, 1, 512, 1728, 1728, 512, 512]
    - [0, 8.567]
  - - [1856, 704, 1, 512, 1856, 1856, 512, 512]
    - [0, 8.694]
  - - [1984, 704, 1, 512, 1984, 1984, 512, 512]
    - [0, 8.608]
  - - [2112, 704, 1, 512, 2112, 2112, 512, 512]
    - [0, 8.634]
  - - [2240, 704, 1, 512, 2240, 2240, 512, 512]
    - [0, 8.639]
  - - [2368, 704, 1, 512, 2368, 2368, 512, 512]
    - [0, 8.779]
  - - [2496, 704, 1, 512, 2496, 2496, 512, 512]
    - [0, 8.801]
  - - [2624, 704, 1, 512, 2624, 2624, 512, 512]
    - [0, 8.711]
  - - [2752, 704, 1, 512, 2752, 2752, 512, 512]
    - [0, 8.836]
  - - [2880, 704, 1, 512, 2880, 2880, 512, 512]
    - [0, 8.807]
  - - [3008, 704, 1, 512, 3008, 3008, 512, 512]
    - [0, 8.813]
  - - [3136, 704, 1, 512, 3136, 3136, 512, 512]
    - [0, 8.81]
  - - [3264, 704, 1, 512, 3264, 3264, 512, 512]
    - [0, 8.792]
  - - [3392, 704, 1, 512, 3392, 3392, 512, 512]
    - [0, 8.808]
  - - [3520, 704, 1, 512, 3520, 3520, 512, 512]
    - [0, 8.89]
  - - [3648, 704, 1, 512, 3648, 3648, 512, 512]
    - [0, 8.852]
  - - [3776, 704, 1, 512, 3776, 3776, 512, 512]
    - [0, 8.906]
  - - [3904, 704, 1, 512, 3904, 3904, 512, 512]
    - [0, 8.821]
  - - [4032, 704, 1, 512, 4032, 4032, 512, 512]
    - [0, 8.915]
  - - [64, 832, 1, 512, 64, 64, 512, 512]
    - [0, 5.205]
  - - [192, 832, 1, 512, 192, 192, 512, 512]
    - [0, 6.684]
  - - [320, 832, 1, 512, 320, 320, 512, 512]
    - [0, 7.772]
  - - [448, 832, 1, 512, 448, 448, 512, 512]
    - [0, 7.485]
  - - [576, 832, 1, 512, 576, 576, 512, 512]
    - [0, 7.913]
  - - [704, 832, 1, 512, 704, 704, 512, 512]
    - [0, 7.976]
  - - [832, 832, 1, 512, 832, 832, 512, 512]
    - [0, 8.202]
  - - [960, 832, 1, 512, 960, 960, 512, 512]
    - [0, 8.405]
  - - [1088, 832, 1, 512, 1088, 1088, 512, 512]
    - [0, 8.381]
  - - [1216, 832, 1, 512, 1216, 1216, 512, 512]
    - [0, 8.535]
  - - [1344, 832, 1, 512, 1344, 1344, 512, 512]
    - [0, 8.485]
  - - [1472, 832, 1, 512, 1472, 1472, 512, 512]
    - [0, 8.61]
  - - [1600, 832, 1, 512, 1600, 1600, 512, 512]
    - [0, 8.576]
  - - [1728, 832, 1, 512, 1728, 1728, 512, 512]
    - [0, 8.676]
  - - [1856, 832, 1, 512, 1856, 1856, 512, 512]
    - [0, 8.681]
  - - [1984, 832, 1, 512, 1984, 1984, 512, 512]
    - [0, 8.703]
  - - [2112, 832, 1, 512, 2112, 2112, 512, 512]
    - [0, 8.831]
  - - [2240, 832, 1, 512, 2240, 2240, 512, 512]
    - [0, 8.759]
  - - [2368, 832, 1, 512, 2368, 2368, 512, 512]
    - [0, 8.797]
  - - [2496, 832, 1, 512, 2496, 2496, 512, 512]
    - [0, 8.759]
  - - [2624, 832, 1, 512, 2624, 2624, 512, 512]
    - [0, 8.851]
  - - [2752, 832, 1, 512, 2752, 2752, 512, 512]
    - [0, 8.796]
  - - [2880, 832, 1, 512, 2880, 2880, 512, 512]
    - [0, 8.857]
  - - [3008, 832, 1, 512, 3008, 3008, 512, 512]
    - [0, 8.85]
  - - [3136, 832, 1, 512, 3136, 3136, 512, 512]
    - [0, 8.822]
  - - [3264, 832, 1, 512, 3264, 3264, 512, 512]
    - [0, 8.892]
  - - [3392, 832, 1, 512, 3392, 3392, 512, 512]
    - [0, 8.864]
  - - [3520, 832, 1, 512, 3520, 3520, 512, 512]
    - [0, 8.679]
  - - [3648, 832, 1, 512, 3648, 3648, 512, 512]
    - [0, 8.832]
  - - [3776, 832, 1, 512, 3776, 3776, 512, 512]
    - [0, 8.811]
  - - [3904, 832, 1, 512, 3904, 3904, 512, 512]
    - [0, 8.758]
  - - [4032, 832, 1, 512, 4032, 4032, 512, 512]
    - [0, 8.778]
  - - [64, 960, 1, 512, 64, 64, 512, 512]
    - [0, 5.994]
  - - [192, 960, 1, 512, 192, 192, 512, 512]
    - [0, 7.675]
  - - [320, 960, 1, 512, 320, 320, 512, 512]
    - [0, 8.122]
  - - [448, 960, 1, 512, 448, 448, 512, 512]
    - [0, 7.966]
  - - [576, 960, 1, 512, 576, 576, 512, 512]
    - [0, 8.165]
  - - [704, 960, 1, 512, 704, 704, 512, 512]
    - [0, 8.31]
  - - [832, 960, 1, 512, 832, 832, 512, 512]
    - [0, 8.421]
  - - [960, 960, 1, 512, 960, 960, 512, 512]
    - [0, 8.49]
  - - [1088, 960, 1, 512, 1088, 1088, 512, 512]
    - [0, 8.553]
  - - [1216, 960, 1, 512, 1216, 1216, 512, 512]
    - [0, 8.596]
  - - [1344, 960, 1, 512, 1344, 1344, 512, 512]
    - [0, 8.627]
  - - [1472, 960, 1, 512, 1472, 1472, 512, 512]
    - [0, 8.662]
  - - [1600, 960, 1, 512, 1600, 1600, 512, 512]
    - [0, 8.695]
  - - [1728, 960, 1, 512, 1728, 1728, 512, 512]
    - [0, 8.705]
  - - [1856, 960, 1, 512, 1856, 1856, 512, 512]
    - [0, 8.734]
  - - [1984, 960, 1, 512, 1984, 1984, 512, 512]
    - [0, 8.796]
  - - [2112, 960, 1, 512, 2112, 2112, 512, 512]
    - [0, 8.776]
  - - [2240, 960, 1, 512, 2240, 2240, 512, 512]
    - [0, 8.79]
  - - [2368, 960, 1, 512, 2368, 2368, 512, 512]
    - [0, 8.83]
  - - [2496, 960, 1, 512, 2496, 2496, 512, 512]
    - [0, 8.827]
  - - [2624, 960, 1, 512, 2624, 2624, 512, 512]
    - [0, 8.841]
  - - [2752, 960, 1, 512, 2752, 2752, 512, 512]
    - [0, 8.88]
  - - [2880, 960, 1, 512, 2880, 2880, 512, 512]
    - [0, 8.85]
  - - [3008, 960, 1, 512, 3008, 3008, 512, 512]
    - [0, 8.669]
  - - [3136, 960, 1, 512, 3136, 3136, 512, 512]
    - [0, 8.723]
  - - [3264, 960, 1, 512, 3264, 3264, 512, 512]
    - [0, 8.749]
  - - [3392, 960, 1, 512, 3392, 3392, 512, 512]
    - [0, 8.851]
  - - [3520, 960, 1, 512, 3520, 3520, 512, 512]
    - [0, 8.771]
  - - [3648, 960, 1, 512, 3648, 3648, 512, 512]
    - [0, 8.804]
  - - [3776, 960, 1, 512, 3776, 3776, 512, 512]
    - [0, 8.829]
  - - [3904, 960, 1, 512, 3904, 3904, 512, 512]
    - [0, 8.794]
  - - [4032, 960, 1, 512, 4032, 4032, 512, 512]
    - [0, 8.911]
  - - [64, 1088, 1, 512, 64, 64, 512, 512]
    - [3, 4.444]
  - - [192, 1088, 1, 512, 192, 192, 512, 512]
    - [0, 7.585]
  - - [320, 1088, 1, 512, 320, 320, 512, 512]
    - [0, 7.849]
  - - [448, 1088, 1, 512, 448, 448, 512, 512]
    - [0, 8.031]
  - - [576, 1088, 1, 512, 576, 576, 512, 512]
    - [0, 8.089]
  - - [704, 1088, 1, 512, 704, 704, 512, 512]
    - [0, 8.376]
  - - [832, 1088, 1, 512, 832, 832, 512, 512]
    - [0, 8.388]
  - - [960, 1088, 1, 512, 960, 960, 512, 512]
    - [0, 8.544]
  - - [1088, 1088, 1, 512, 1088, 1088, 512, 512]
    - [0, 8.541]
  - - [1216, 1088, 1, 512, 1216, 1216, 512, 512]
    - [0, 8.571]
  - - [1344, 1088, 1, 512, 1344, 1344, 512, 512]
    - [0, 8.641]
  - - [1472, 1088, 1, 512, 1472, 1472, 512, 512]
    - [0, 8.764]
  - - [1600, 1088, 1, 512, 1600, 1600, 512, 512]
    - [0, 8.711]
  - - [1728, 1088, 1, 512, 1728, 1728, 512, 512]
    - [0, 8.714]
  - - [1856, 1088, 1, 512, 1856, 1856, 512, 512]
    - [0, 8.826]
  - - [1984, 1088, 1, 512, 1984, 1984, 512, 512]
    - [0, 8.82]
  - - [2112, 1088, 1, 512, 2112, 2112, 512, 512]
    - [0, 8.81]
  - - [2240, 1088, 1, 512, 2240, 2240, 512, 512]
    - [0, 8.904]
  - - [2368, 1088, 1, 512, 2368, 2368, 512, 512]
    - [0, 8.91]
  - - [2496, 1088, 1, 512, 2496, 2496, 512, 512]
    - [0, 8.847]
  - - [2624, 1088, 1, 512, 2624, 2624, 512, 512]
    - [0, 8.859]
  - - [2752, 1088, 1, 512, 2752, 2752, 512, 512]
    - [0, 8.723]
  - - [2880, 1088, 1, 512, 2880, 2880, 512, 512]
    - [0, 8.746]
  - - [3008, 1088, 1, 512, 3008, 3008, 512, 512]
    - [0, 8.836]
  - - [3136, 1088, 1, 512, 3136, 3136, 512, 512]
    - [0, 8.753]
  - - [3264, 1088, 1, 512, 3264, 3264, 512, 512]
    - [0, 8.777]
  - - [3392, 1088, 1, 512, 3392, 3392, 512, 512]
    - [0, 8.819]
  - - [3520, 1088, 1, 512, 3520, 3520, 512, 512]
    - [0, 8.834]
  - - [3648, 1088, 1, 512, 3648, 3648, 512, 512]
    - [0, 8.785]
  - - [3776, 1088, 1, 512, 3776, 3776, 512, 512]
    - [0, 8.832]
  - - [3904, 1088, 1, 512, 3904, 3904, 512, 512]
    - [0, 8.802]
  - - [4032, 1088, 1, 512, 4032, 4032, 512, 512]
    - [0, 8.909]
  - - [64, 1216, 1, 512, 64, 64, 512, 512]
    - [0, 5.68]
  - - [192, 1216, 1, 512, 192, 192, 512, 512]
    - [0, 7.548]
  - - [320, 1216, 1, 512, 320, 320, 512, 512]
    - [0, 7.736]
  - - [448, 1216, 1, 512, 448, 448, 512, 512]
    - [0, 8.077]
  - - [576, 1216, 1, 512, 576, 576, 512, 512]
    - [0, 8.292]
  - - [704, 1216, 1, 512, 704, 704, 512, 512]
    - [0, 8.425]
  - - [832, 1216, 1, 512, 832, 832, 512, 512]
    - [0, 8.544]
  - - [960, 1216, 1, 512, 960, 960, 512, 512]
    - [0, 8.598]
  - - [1088, 1216, 1, 512, 1088, 1088, 512, 512]
    - [0, 8.583]
  - - [1216, 1216, 1, 512, 1216, 1216, 512, 512]
    - [0, 8.614]
  - - [1344, 1216, 1, 512, 1344, 1344, 512, 512]
    - [0, 8.641]
  - - [1472, 1216, 1, 512, 1472, 1472, 512, 512]
    - [0, 8.705]
  - - [1600, 1216, 1, 512, 1600, 1600, 512, 512]
    - [0, 8.717]
  - - [1728, 1216, 1, 512, 1728, 1728, 512, 512]
    - [0, 8.877]
  - - [1856, 1216, 1, 512, 1856, 1856, 512, 512]
    - [0, 8.794]
  - - [1984, 1216, 1, 512, 1984, 1984, 512, 512]
    - [0, 8.83]
  - - [2112, 1216, 1, 512, 2112, 2112, 512, 512]
    - [0, 8.817]
  - - [2240, 1216, 1, 512, 2240, 2240, 512, 512]
    - [0, 8.853]
  - - [2368, 1216, 1, 512, 2368, 2368, 512, 512]
    - [0, 8.874]
  - - [2496, 1216, 1, 512, 2496, 2496, 512, 512]
    - [0, 8.763]
  - - [2624, 1216, 1, 512, 2624, 2624, 512, 512]
    - [0, 8.763]
  - - [2752, 1216, 1, 512, 2752, 2752, 512, 512]
    - [0, 8.76]
  - - [2880, 1216, 1, 512, 2880, 2880, 512, 512]
    - [0, 8.788]
  - - [3008, 1216, 1, 512, 3008, 3008, 512, 512]
    - [0, 8.807]
  - - [3136, 1216, 1, 512, 3136, 3136, 512, 512]
    - [0, 8.819]
  - - [3264, 1216, 1, 512, 3264, 3264, 512, 512]
    - [0, 8.806]
  - - [3392, 1216, 1, 512, 3392, 3392, 512, 512]
    - [0, 8.868]
  - - [3520, 1216, 1, 512, 3520, 3520, 512, 512]
    - [0, 8.87]
  - - [3648, 1216, 1, 512, 3648, 3648, 512, 512]
    - [0, 8.81]
  - - [3776, 1216, 1, 512, 3776, 3776, 512, 512]
    - [0, 8.938]
  - - [3904, 1216, 1, 512, 3904, 3904, 512, 512]
    - [0, 8.924]
  - - [4032, 1216, 1, 512, 4032, 4032, 512, 512]
    - [0, 8.894]
  - - [64, 1344, 1, 512, 64, 64, 512, 512]
    - [3, 4.806]
  - - [192, 1344, 1, 512, 192, 192, 512, 512]
    - [0, 7.554]
  - - [320, 1344, 1, 512, 320, 320, 512, 512]
    - [0, 7.95]
  - - [448, 1344, 1, 512, 448, 448, 512, 512]
    - [0, 8.113]
  - - [576, 1344, 1, 512, 576, 576, 512, 512]
    - [0, 8.234]
  - - [704, 1344, 1, 512, 704, 704, 512, 512]
    - [0, 8.48]
  - - [832, 1344, 1, 512, 832, 832, 512, 512]
    - [0, 8.488]
  - - [960, 1344, 1, 512, 960, 960, 512, 512]
    - [0, 8.629]
  - - [1088, 1344, 1, 512, 1088, 1088, 512, 512]
    - [0, 8.651]
  - - [1216, 1344, 1, 512, 1216, 1216, 512, 512]
    - [0, 8.799]
  - - [1344, 1344, 1, 512, 1344, 1344, 512, 512]
    - [0, 8.761]
  - - [1472, 1344, 1, 512, 1472, 1472, 512, 512]
    - [0, 8.743]
  - - [1600, 1344, 1, 512, 1600, 1600, 512, 512]
    - [0, 8.788]
  - - [1728, 1344, 1, 512, 1728, 1728, 512, 512]
    - [0, 8.824]
  - - [1856, 1344, 1, 512, 1856, 1856, 512, 512]
    - [0, 8.803]
  - - [1984, 1344, 1, 512, 1984, 1984, 512, 512]
    - [0, 8.909]
  - - [2112, 1344, 1, 512, 2112, 2112, 512, 512]
    - [0, 8.94]
  - - [2240, 1344, 1, 512, 2240, 2240, 512, 512]
    - [0, 8.731]
  - - [2368, 1344, 1, 512, 2368, 2368, 512, 512]
    - [0, 8.728]
  - - [2496, 1344, 1, 512, 2496, 2496, 512, 512]
    - [0, 8.735]
  - - [2624, 1344, 1, 512, 2624, 2624, 512, 512]
    - [0, 8.751]
  - - [2752, 1344, 1, 512, 2752, 2752, 512, 512]
    - [0, 8.872]
  - - [2880, 1344, 1, 512, 2880, 2880, 512, 512]
    - [0, 8.782]
  - - [3008, 1344, 1, 512, 3008, 3008, 512, 512]
    - [0, 8.814]
  - - [3136, 1344, 1, 512, 3136, 3136, 512, 512]
    - [0, 8.916]
  - - [3264, 1344, 1, 512, 3264, 3264, 512, 512]
    - [0, 8.837]
  - - [3392, 1344, 1, 512, 3392, 3392, 512, 512]
    - [0, 8.861]
  - - [3520, 1344, 1, 512, 3520, 3520, 512, 512]
    - [0, 8.846]
  - - [3648, 1344, 1, 512, 3648, 3648, 512, 512]
    - [0, 8.874]
  - - [3776, 1344, 1, 512, 3776, 3776, 512, 512]
    - [0, 8.909]
  - - [3904, 1344, 1, 512, 3904, 3904, 512, 512]
    - [0, 8.906]
  - - [4032, 1344, 1, 512, 4032, 4032, 512, 512]
    - [0, 8.913]
  - - [64, 1472, 1, 512, 64, 64, 512, 512]
    - [0, 5.548]
  - - [192, 1472, 1, 512, 192, 192, 512, 512]
    - [0, 7.53]
  - - [320, 1472, 1, 512, 320, 320, 512, 512]
    - [0, 7.798]
  - - [448, 1472, 1, 512, 448, 448, 512, 512]
    - [0, 8.155]
  - - [576, 1472, 1, 512, 576, 576, 512, 512]
    - [0, 8.356]
  - - [704, 1472, 1, 512, 704, 704, 512, 512]
    - [0, 8.51]
  - - [832, 1472, 1, 512, 832, 832, 512, 512]
    - [0, 8.608]
  - - [960, 1472, 1, 512, 960, 960, 512, 512]
    - [0, 8.683]
  - - [1088, 1472, 1, 512, 1088, 1088, 512, 512]
    - [0, 8.698]
  - - [1216, 1472, 1, 512, 1216, 1216, 512, 512]
    - [0, 8.771]
  - - [1344, 1472, 1, 512, 1344, 1344, 512, 512]
    - [0, 8.833]
  - - [1472, 1472, 1, 512, 1472, 1472, 512, 512]
    - [0, 8.872]
  - - [1600, 1472, 1, 512, 1600, 1600, 512, 512]
    - [0, 8.833]
  - - [1728, 1472, 1, 512, 1728, 1728, 512, 512]
    - [0, 8.827]
  - - [1856, 1472, 1, 512, 1856, 1856, 512, 512]
    - [0, 8.957]
  - - [1984, 1472, 1, 512, 1984, 1984, 512, 512]
    - [0, 8.723]
  - - [2112, 1472, 1, 512, 2112, 2112, 512, 512]
    - [0, 8.734]
  - - [2240, 1472, 1, 512, 2240, 2240, 512, 512]
    - [0, 8.82]
  - - [2368, 1472, 1, 512, 2368, 2368, 512, 512]
    - [0, 8.784]
  - - [2496, 1472, 1, 512, 2496, 2496, 512, 512]
    - [0, 8.805]
  - - [2624, 1472, 1, 512, 2624, 2624, 512, 512]
    - [0, 8.87]
  - - [2752, 1472, 1, 512, 2752, 2752, 512, 512]
    - [0, 8.839]
  - - [2880, 1472, 1, 512, 2880, 2880, 512, 512]
    - [0, 8.871]
  - - [3008, 1472, 1, 512, 3008, 3008, 512, 512]
    - [0, 8.866]
  - - [3136, 1472, 1, 512, 3136, 3136, 512, 512]
    - [0, 8.944]
  - - [3264, 1472, 1, 512, 3264, 3264, 512, 512]
    - [0, 8.877]
  - - [3392, 1472, 1, 512, 3392, 3392, 512, 512]
    - [0, 8.985]
  - - [3520, 1472, 1, 512, 3520, 3520, 512, 512]
    - [0, 8.845]
  - - [3648, 1472, 1, 512, 3648, 3648, 512, 512]
    - [0, 8.962]
  - - [3776, 1472, 1, 512, 3776, 3776, 512, 512]
    - [0, 8.954]
  - - [3904, 1472, 1, 512, 3904, 3904, 512, 512]
    - [0, 8.892]
  - - [4032, 1472, 1, 512, 4032, 4032, 512, 512]
    - [0, 8.933]
  - - [64, 1600, 1, 512, 64, 64, 512, 512]
    - [0, 5.984]
  - - [192, 1600, 1, 512, 192, 192, 512, 512]
    - [0, 8.117]
  - - [320, 1600, 1, 512, 320, 320, 512, 512]
    - [0, 7.991]
  - - [448, 1600, 1, 512, 448, 448, 512, 512]
    - [0, 8.188]
  - - [576, 1600, 1, 512, 576, 576, 512, 512]
    - [0, 8.486]
  - - [704, 1600, 1, 512, 704, 704, 512, 512]
    - [0, 8.543]
  - - [832, 1600, 1, 512, 832, 832, 512, 512]
    - [0, 8.603]
  - - [960, 1600, 1, 512, 960, 960, 512, 512]
    - [0, 8.715]
  - - [1088, 1600, 1, 512, 1088, 1088, 512, 512]
    - [0, 8.7]
  - - [1216, 1600, 1, 512, 1216, 1216, 512, 512]
    - [0, 8.745]
  - - [1344, 1600, 1, 512, 1344, 1344, 512, 512]
    - [0, 8.826]
  - - [1472, 1600, 1, 512, 1472, 1472, 512, 512]
    - [0, 8.793]
  - - [1600, 1600, 1, 512, 1600, 1600, 512, 512]
    - [0, 8.907]
  - - [1728, 1600, 1, 512, 1728, 1728, 512, 512]
    - [0, 8.842]
  - - [1856, 1600, 1, 512, 1856, 1856, 512, 512]
    - [0, 8.703]
  - - [1984, 1600, 1, 512, 1984, 1984, 512, 512]
    - [0, 8.74]
  - - [2112, 1600, 1, 512, 2112, 2112, 512, 512]
    - [0, 8.748]
  - - [2240, 1600, 1, 512, 2240, 2240, 512, 512]
    - [0, 8.775]
  - - [2368, 1600, 1, 512, 2368, 2368, 512, 512]
    - [0, 8.828]
  - - [2496, 1600, 1, 512, 2496, 2496, 512, 512]
    - [0, 8.791]
  - - [2624, 1600, 1, 512, 2624, 2624, 512, 512]
    - [0, 8.893]
  - - [2752, 1600, 1, 512, 2752, 2752, 512, 512]
    - [0, 8.883]
  - - [2880, 1600, 1, 512, 2880, 2880, 512, 512]
    - [0, 8.835]
  - - [3008, 1600, 1, 512, 3008, 3008, 512, 512]
    - [0, 8.894]
  - - [3136, 1600, 1, 512, 3136, 3136, 512, 512]
    - [0, 8.918]
  - - [3264, 1600, 1, 512, 3264, 3264, 512, 512]
    - [0, 8.901]
  - - [3392, 1600, 1, 512, 3392, 3392, 512, 512]
    - [0, 8.961]
  - - [3520, 1600, 1, 512, 3520, 3520, 512, 512]
    - [0, 8.966]
  - - [3648, 1600, 1, 512, 3648, 3648, 512, 512]
    - [0, 8.931]
  - - [3776, 1600, 1, 512, 3776, 3776, 512, 512]
    - [0, 8.932]
  - - [3904, 1600, 1, 512, 3904, 3904, 512, 512]
    - [0, 8.95]
  - - [4032, 1600, 1, 512, 4032, 4032, 512, 512]
    - [0, 8.944]
  - - [64, 1728, 1, 512, 64, 64, 512, 512]
    - [0, 6.443]
  - - [192, 1728, 1, 512, 192, 192, 512, 512]
    - [0, 8.053]
  - - [320, 1728, 1, 512, 320, 320, 512, 512]
    - [0, 8.18]
  - - [448, 1728, 1, 512, 448, 448, 512, 512]
    - [0, 8.235]
  - - [576, 1728, 1, 512, 576, 576, 512, 512]
    - [0, 8.436]
  - - [704, 1728, 1, 512, 704, 704, 512, 512]
    - [0, 8.579]
  - - [832, 1728, 1, 512, 832, 832, 512, 512]
    - [0, 8.668]
  - - [960, 1728, 1, 512, 960, 960, 512, 512]
    - [0, 8.719]
  - - [1088, 1728, 1, 512, 1088, 1088, 512, 512]
    - [0, 8.771]
  - - [1216, 1728, 1, 512, 1216, 1216, 512, 512]
    - [0, 8.739]
  - - [1344, 1728, 1, 512, 1344, 1344, 512, 512]
    - [0, 8.893]
  - - [1472, 1728, 1, 512, 1472, 1472, 512, 512]
    - [0, 8.805]
  - - [1600, 1728, 1, 512, 1600, 1600, 512, 512]
    - [0, 8.894]
  - - [1728, 1728, 1, 512, 1728, 1728, 512, 512]
    - [0, 8.772]
  - - [1856, 1728, 1, 512, 1856, 1856, 512, 512]
    - [0, 8.765]
  - - [1984, 1728, 1, 512, 1984, 1984, 512, 512]
    - [0, 8.848]
  - - [2112, 1728, 1, 512, 2112, 2112, 512, 512]
    - [0, 8.809]
  - - [2240, 1728, 1, 512, 2240, 2240, 512, 512]
    - [0, 8.827]
  - - [2368, 1728, 1, 512, 2368, 2368, 512, 512]
    - [0, 8.957]
  - - [2496, 1728, 1, 512, 2496, 2496, 512, 512]
    - [0, 8.871]
  - - [2624, 1728, 1, 512, 2624, 2624, 512, 512]
    - [0, 8.881]
  - - [2752, 1728, 1, 512, 2752, 2752, 512, 512]
    - [0, 8.859]
  - - [2880, 1728, 1, 512, 2880, 2880, 512, 512]
    - [0, 8.912]
  - - [3008, 1728, 1, 512, 3008, 3008, 512, 512]
    - [0, 8.888]
  - - [3136, 1728, 1, 512, 3136, 3136, 512, 512]
    - [0, 8.9]
  - - [3264, 1728, 1, 512, 3264, 3264, 512, 512]
    - [0, 8.965]
  - - [3392, 1728, 1, 512, 3392, 3392, 512, 512]
    - [0, 8.935]
  - - [3520, 1728, 1, 512, 3520, 3520, 512, 512]
    - [0, 8.921]
  - - [3648, 1728, 1, 512, 3648, 3648, 512, 512]
    - [0, 9.012]
  - - [3776, 1728, 1, 512, 3776, 3776, 512, 512]
    - [0, 8.912]
  - - [3904, 1728, 1, 512, 3904, 3904, 512, 512]
    - [0, 8.915]
  - - [4032, 1728, 1, 512, 4032, 4032, 512, 512]
    - [0, 8.942]
  - - [64, 1856, 1, 512, 64, 64, 512, 512]
    - [0, 6.928]
  - - [192, 1856, 1, 512, 192, 192, 512, 512]
    - [0, 7.954]
  - - [320, 1856, 1, 512, 320, 320, 512, 512]
    - [0, 8.032]
  - - [448, 1856, 1, 512, 448, 448, 512, 512]
    - [0, 8.308]
  - - [576, 1856, 1, 512, 576, 576, 512, 512]
    - [0, 8.545]
  - - [704, 1856, 1, 512, 704, 704, 512, 512]
    - [0, 8.582]
  - - [832, 1856, 1, 512, 832, 832, 512, 512]
    - [0, 8.742]
  - - [960, 1856, 1, 512, 960, 960, 512, 512]
    - [0, 8.774]
  - - [1088, 1856, 1, 512, 1088, 1088, 512, 512]
    - [0, 8.748]
  - - [1216, 1856, 1, 512, 1216, 1216, 512, 512]
    - [0, 8.855]
  - - [1344, 1856, 1, 512, 1344, 1344, 512, 512]
    - [0, 8.804]
  - - [1472, 1856, 1, 512, 1472, 1472, 512, 512]
    - [0, 8.86]
  - - [1600, 1856, 1, 512, 1600, 1600, 512, 512]
    - [0, 8.71]
  - - [1728, 1856, 1, 512, 1728, 1728, 512, 512]
    - [0, 8.711]
  - - [1856, 1856, 1, 512, 1856, 1856, 512, 512]
    - [0, 8.803]
  - - [1984, 1856, 1, 512, 1984, 1984, 512, 512]
    - [0, 8.765]
  - - [2112, 1856, 1, 512, 2112, 2112, 512, 512]
    - [0, 8.79]
  - - [2240, 1856, 1, 512, 2240, 2240, 512, 512]
    - [0, 8.902]
  - - [2368, 1856, 1, 512, 2368, 2368, 512, 512]
    - [0, 8.887]
  - - [2496, 1856, 1, 512, 2496, 2496, 512, 512]
    - [0, 8.821]
  - - [2624, 1856, 1, 512, 2624, 2624, 512, 512]
    - [0, 8.853]
  - - [2752, 1856, 1, 512, 2752, 2752, 512, 512]
    - [0, 8.896]
  - - [2880, 1856, 1, 512, 2880, 2880, 512, 512]
    - [0, 8.936]
  - - [3008, 1856, 1, 512, 3008, 3008, 512, 512]
    - [0, 8.906]
  - - [3136, 1856, 1, 512, 3136, 3136, 512, 512]
    - [0, 8.872]
  - - [3264, 1856, 1, 512, 3264, 3264, 512, 512]
    - [0, 8.898]
  - - [3392, 1856, 1, 512, 3392, 3392, 512, 512]
    - [0, 8.908]
  - - [3520, 1856, 1, 512, 3520, 3520, 512, 512]
    - [0, 8.976]
  - - [3648, 1856, 1, 512, 3648, 3648, 512, 512]
    - [0, 9.003]
  - - [3776, 1856, 1, 512, 3776, 3776, 512, 512]
    - [0, 8.894]
  - - [3904, 1856, 1, 512, 3904, 3904, 512, 512]
    - [0, 9.027]
  - - [4032, 1856, 1, 512, 4032, 4032, 512, 512]
    - [0, 8.998]
  - - [64, 1984, 1, 512, 64, 64, 512, 512]
    - [0, 6.246]
  - - [192, 1984, 1, 512, 192, 192, 512, 512]
    - [0, 7.598]
  - - [320, 1984, 1, 512, 320, 320, 512, 512]
    - [0, 8.188]
  - - [448, 1984, 1, 512, 448, 448, 512, 512]
    - [0, 8.449]
  - - [576, 1984, 1, 512, 576, 576, 512, 512]
    - [0, 8.63]
  - - [704, 1984, 1, 512, 704, 704, 512, 512]
    - [0, 8.602]
  - - [832, 1984, 1, 512, 832, 832, 512, 512]
    - [0, 8.721]
  - - [960, 1984, 1, 512, 960, 960, 512, 512]
    - [0, 8.751]
  - - [1088, 1984, 1, 512, 1088, 1088, 512, 512]
    - [0, 8.761]
  - - [1216, 1984, 1, 512, 1216, 1216, 512, 512]
    - [0, 8.79]
  - - [1344, 1984, 1, 512, 1344, 1344, 512, 512]
    - [0, 8.865]
  - - [1472, 1984, 1, 512, 1472, 1472, 512, 512]
    - [0, 8.765]
  - - [1600, 1984, 1, 512, 1600, 1600, 512, 512]
    - [0, 8.732]
  - - [1728, 1984, 1, 512, 1728, 1728, 512, 512]
    - [0, 8.765]
  - - [1856, 1984, 1, 512, 1856, 1856, 512, 512]
    - [0, 8.898]
  - - [1984, 1984, 1, 512, 1984, 1984, 512, 512]
    - [0, 8.845]
  - - [2112, 1984, 1, 512, 2112, 2112, 512, 512]
    - [0, 8.816]
  - - [2240, 1984, 1, 512, 2240, 2240, 512, 512]
    - [0, 8.842]
  - - [2368, 1984, 1, 512, 2368, 2368, 512, 512]
    - [0, 8.915]
  - - [2496, 1984, 1, 512, 2496, 2496, 512, 512]
    - [0, 8.884]
  - - [2624, 1984, 1, 512, 2624, 2624, 512, 512]
    - [0, 8.904]
  - - [2752, 1984, 1, 512, 2752, 2752, 512, 512]
    - [0, 8.923]
  - - [2880, 1984, 1, 512, 2880, 2880, 512, 512]
    - [0, 8.897]
  - - [3008, 1984, 1, 512, 3008, 3008, 512, 512]
    - [0, 8.896]
  - - [3136, 1984, 1, 512, 3136, 3136, 512, 512]
    - [0, 8.897]
  - - [3264, 1984, 1, 512, 3264, 3264, 512, 512]
    - [0, 8.943]
  - - [3392, 1984, 1, 512, 3392, 3392, 512, 512]
    - [0, 8.978]
  - - [3520, 1984, 1, 512, 3520, 3520, 512, 512]
    - [0, 8.957]
  - - [3648, 1984, 1, 512, 3648, 3648, 512, 512]
    - [0, 8.967]
  - - [3776, 1984, 1, 512, 3776, 3776, 512, 512]
    - [0, 8.949]
  - - [3904, 1984, 1, 512, 3904, 3904, 512, 512]
    - [0, 8.935]
  - - [4032, 1984, 1, 512, 4032, 4032, 512, 512]
    - [0, 8.954]
  - - [64, 2112, 1, 512, 64, 64, 512, 512]
    - [0, 6.547]
  - - [192, 2112, 1, 512, 192, 192, 512, 512]
    - [0, 7.553]
  - - [320, 2112, 1, 512, 320, 320, 512, 512]
    - [0, 8.306]
  - - [448, 2112, 1, 512, 448, 448, 512, 512]
    - [0, 8.459]
  - - [576, 2112, 1, 512, 576, 576, 512, 512]
    - [0, 8.566]
  - - [704, 2112, 1, 512, 704, 704, 512, 512]
    - [0, 8.644]
  - - [832, 2112, 1, 512, 832, 832, 512, 512]
    - [0, 8.771]
  - - [960, 2112, 1, 512, 960, 960, 512, 512]
    - [0, 8.805]
  - - [1088, 2112, 1, 512, 1088, 1088, 512, 512]
    - [0, 8.8]
  - - [1216, 2112, 1, 512, 1216, 1216, 512, 512]
    - [0, 8.821]
  - - [1344, 2112, 1, 512, 1344, 1344, 512, 512]
    - [0, 8.892]
  - - [1472, 2112, 1, 512, 1472, 1472, 512, 512]
    - [0, 8.725]
  - - [1600, 2112, 1, 512, 1600, 1600, 512, 512]
    - [0, 8.788]
  - - [1728, 2112, 1, 512, 1728, 1728, 512, 512]
    - [0, 8.871]
  - - [1856, 2112, 1, 512, 1856, 1856, 512, 512]
    - [0, 8.82]
  - - [1984, 2112, 1, 512, 1984, 1984, 512, 512]
    - [0, 8.819]
  - - [2112, 2112, 1, 512, 2112, 2112, 512, 512]
    - [0, 8.85]
  - - [2240, 2112, 1, 512, 2240, 2240, 512, 512]
    - [0, 8.943]
  - - [2368, 2112, 1, 512, 2368, 2368, 512, 512]
    - [0, 8.925]
  - - [2496, 2112, 1, 512, 2496, 2496, 512, 512]
    - [0, 8.92]
  - - [2624, 2112, 1, 512, 2624, 2624, 512, 512]
    - [0, 8.948]
  - - [2752, 2112, 1, 512, 2752, 2752, 512, 512]
    - [0, 8.902]
  - - [2880, 2112, 1, 512, 2880, 2880, 512, 512]
    - [0, 8.965]
  - - [3008, 2112, 1, 512, 3008, 3008, 512, 512]
    - [0, 8.989]
  - - [3136, 2112, 1, 512, 3136, 3136, 512, 512]
    - [0, 8.906]
  - - [3264, 2112, 1, 512, 3264, 3264, 512, 512]
    - [0, 8.936]
  - - [3392, 2112, 1, 512, 3392, 3392, 512, 512]
    - [0, 8.924]
  - - [3520, 2112, 1, 512, 3520, 3520, 512, 512]
    - [0, 8.933]
  - - [3648, 2112, 1, 512, 3648, 3648, 512, 512]
    - [0, 9.019]
  - - [3776, 2112, 1, 512, 3776, 3776, 512, 512]
    - [0, 8.984]
  - - [3904, 2112, 1, 512, 3904, 3904, 512, 512]
    - [0, 9.022]
  - - [4032, 2112, 1, 512, 4032, 4032, 512, 512]
    - [0, 8.932]
  - - [64, 2240, 1, 512, 64, 64, 512, 512]
    - [0, 6.923]
  - - [192, 2240, 1, 512, 192, 192, 512, 512]
    - [0, 7.961]
  - - [320, 2240, 1, 512, 320, 320, 512, 512]
    - [0, 8.182]
  - - [448, 2240, 1, 512, 448, 448, 512, 512]
    - [0, 8.486]
  - - [576, 2240, 1, 512, 576, 576, 512, 512]
    - [0, 8.661]
  - - [704, 2240, 1, 512, 704, 704, 512, 512]
    - [0, 8.659]
  - - [832, 2240, 1, 512, 832, 832, 512, 512]
    - [0, 8.727]
  - - [960, 2240, 1, 512, 960, 960, 512, 512]
    - [0, 8.807]
  - - [1088, 2240, 1, 512, 1088, 1088, 512, 512]
    - [0, 8.781]
  - - [1216, 2240, 1, 512, 1216, 1216, 512, 512]
    - [0, 8.848]
  - - [1344, 2240, 1, 512, 1344, 1344, 512, 512]
    - [0, 8.834]
  - - [1472, 2240, 1, 512, 1472, 1472, 512, 512]
    - [0, 8.797]
  - - [1600, 2240, 1, 512, 1600, 1600, 512, 512]
    - [0, 8.841]
  - - [1728, 2240, 1, 512, 1728, 1728, 512, 512]
    - [0, 8.817]
  - - [1856, 2240, 1, 512, 1856, 1856, 512, 512]
    - [0, 8.932]
  - - [1984, 2240, 1, 512, 1984, 1984, 512, 512]
    - [0, 8.835]
  - - [2112, 2240, 1, 512, 2112, 2112, 512, 512]
    - [0, 8.894]
  - - [2240, 2240, 1, 512, 2240, 2240, 512, 512]
    - [0, 8.862]
  - - [2368, 2240, 1, 512, 2368, 2368, 512, 512]
    - [0, 8.935]
  - - [2496, 2240, 1, 512, 2496, 2496, 512, 512]
    - [0, 8.961]
  - - [2624, 2240, 1, 512, 2624, 2624, 512, 512]
    - [0, 8.938]
  - - [2752, 2240, 1, 512, 2752, 2752, 512, 512]
    - [0, 8.887]
  - - [2880, 2240, 1, 512, 2880, 2880, 512, 512]
    - [0, 8.937]
  - - [3008, 2240, 1, 512, 3008, 3008, 512, 512]
    - [0, 8.898]
  - - [3136, 2240, 1, 512, 3136, 3136, 512, 512]
    - [0, 8.94]
  - - [3264, 2240, 1, 512, 3264, 3264, 512, 512]
    - [0, 8.96]
  - - [3392, 2240, 1, 512, 3392, 3392, 512, 512]
    - [0, 8.969]
  - - [3520, 2240, 1, 512, 3520, 3520, 512, 512]
    - [0, 8.926]
  - - [3648, 2240, 1, 512, 3648, 3648, 512, 512]
    - [0, 9.009]
  - - [3776, 2240, 1, 512, 3776, 3776, 512, 512]
    - [0, 9.01]
  - - [3904, 2240, 1, 512, 3904, 3904, 512, 512]
    - [0, 8.961]
  - - [4032, 2240, 1, 512, 4032, 4032, 512, 512]
    - [0, 8.978]
  - - [64, 2368, 1, 512, 64, 64, 512, 512]
    - [0, 5.129]
  - - [192, 2368, 1, 512, 192, 192, 512, 512]
    - [0, 7.923]
  - - [320, 2368, 1, 512, 320, 320, 512, 512]
    - [0, 8.313]
  - - [448, 2368, 1, 512, 448, 448, 512, 512]
    - [0, 8.482]
  - - [576, 2368, 1, 512, 576, 576, 512, 512]
    - [0, 8.6]
  - - [704, 2368, 1, 512, 704, 704, 512, 512]
    - [0, 8.681]
  - - [832, 2368, 1, 512, 832, 832, 512, 512]
    - [0, 8.772]
  - - [960, 2368, 1, 512, 960, 960, 512, 512]
    - [0, 8.855]
  - - [1088, 2368, 1, 512, 1088, 1088, 512, 512]
    - [0, 8.882]
  - - [1216, 2368, 1, 512, 1216, 1216, 512, 512]
    - [0, 8.919]
  - - [1344, 2368, 1, 512, 1344, 1344, 512, 512]
    - [0, 8.787]
  - - [1472, 2368, 1, 512, 1472, 1472, 512, 512]
    - [0, 8.819]
  - - [1600, 2368, 1, 512, 1600, 1600, 512, 512]
    - [0, 8.804]
  - - [1728, 2368, 1, 512, 1728, 1728, 512, 512]
    - [0, 8.781]
  - - [1856, 2368, 1, 512, 1856, 1856, 512, 512]
    - [0, 8.807]
  - - [1984, 2368, 1, 512, 1984, 1984, 512, 512]
    - [0, 8.879]
  - - [2112, 2368, 1, 512, 2112, 2112, 512, 512]
    - [0, 8.912]
  - - [2240, 2368, 1, 512, 2240, 2240, 512, 512]
    - [0, 8.941]
  - - [2368, 2368, 1, 512, 2368, 2368, 512, 512]
    - [0, 8.966]
  - - [2496, 2368, 1, 512, 2496, 2496, 512, 512]
    - [0, 8.872]
  - - [2624, 2368, 1, 512, 2624, 2624, 512, 512]
    - [0, 9.047]
  - - [2752, 2368, 1, 512, 2752, 2752, 512, 512]
    - [0, 9.001]
  - - [2880, 2368, 1, 512, 2880, 2880, 512, 512]
    - [0, 8.887]
  - - [3008, 2368, 1, 512, 3008, 3008, 512, 512]
    - [0, 8.985]
  - - [3136, 2368, 1, 512, 3136, 3136, 512, 512]
    - [0, 9.011]
  - - [3264, 2368, 1, 512, 3264, 3264, 512, 512]
    - [0, 8.94]
  - - [3392, 2368, 1, 512, 3392, 3392, 512, 512]
    - [0, 8.925]
  - - [3520, 2368, 1, 512, 3520, 3520, 512, 512]
    - [0, 8.966]
  - - [3648, 2368, 1, 512, 3648, 3648, 512, 512]
    - [0, 8.961]
  - - [3776, 2368, 1, 512, 3776, 3776, 512, 512]
    - [0, 9.005]
  - - [3904, 2368, 1, 512, 3904, 3904, 512, 512]
    - [0, 9.012]
  - - [4032, 2368, 1, 512, 4032, 4032, 512, 512]
    - [0, 8.965]
  - - [64, 2496, 1, 512, 64, 64, 512, 512]
    - [0, 6.657]
  - - [192, 2496, 1, 512, 192, 192, 512, 512]
    - [0, 7.907]
  - - [320, 2496, 1, 512, 320, 320, 512, 512]
    - [0, 8.414]
  - - [448, 2496, 1, 512, 448, 448, 512, 512]
    - [0, 8.502]
  - - [576, 2496, 1, 512, 576, 576, 512, 512]
    - [0, 8.657]
  - - [704, 2496, 1, 512, 704, 704, 512, 512]
    - [0, 8.684]
  - - [832, 2496, 1, 512, 832, 832, 512, 512]
    - [0, 8.756]
  - - [960, 2496, 1, 512, 960, 960, 512, 512]
    - [0, 8.853]
  - - [1088, 2496, 1, 512, 1088, 1088, 512, 512]
    - [0, 8.825]
  - - [1216, 2496, 1, 512, 1216, 1216, 512, 512]
    - [0, 8.735]
  - - [1344, 2496, 1, 512, 1344, 1344, 512, 512]
    - [0, 8.792]
  - - [1472, 2496, 1, 512, 1472, 1472, 512, 512]
    - [0, 8.774]
  - - [1600, 2496, 1, 512, 1600, 1600, 512, 512]
    - [0, 8.926]
  - - [1728, 2496, 1, 512, 1728, 1728, 512, 512]
    - [0, 8.881]
  - - [1856, 2496, 1, 512, 1856, 1856, 512, 512]
    - [0, 8.933]
  - - [1984, 2496, 1, 512, 1984, 1984, 512, 512]
    - [0, 8.859]
  - - [2112, 2496, 1, 512, 2112, 2112, 512, 512]
    - [0, 8.925]
  - - [2240, 2496, 1, 512, 2240, 2240, 512, 512]
    - [0, 8.992]
  - - [2368, 2496, 1, 512, 2368, 2368, 512, 512]
    - [0, 8.858]
  - - [2496, 2496, 1, 512, 2496, 2496, 512, 512]
    - [0, 8.901]
  - - [2624, 2496, 1, 512, 2624, 2624, 512, 512]
    - [0, 8.929]
  - - [2752, 2496, 1, 512, 2752, 2752, 512, 512]
    - [0, 9.018]
  - - [2880, 2496, 1, 512, 2880, 2880, 512, 512]
    - [0, 8.978]
  - - [3008, 2496, 1, 512, 3008, 3008, 512, 512]
    - [0, 8.932]
  - - [3136, 2496, 1, 512, 3136, 3136, 512, 512]
    - [0, 9.006]
  - - [3264, 2496, 1, 512, 3264, 3264, 512, 512]
    - [0, 8.96]
  - - [3392, 2496, 1, 512, 3392, 3392, 512, 512]
    - [0, 8.99]
  - - [3520, 2496, 1, 512, 3520, 3520, 512, 512]
    - [0, 9.008]
  - - [3648, 2496, 1, 512, 3648, 3648, 512, 512]
    - [0, 8.971]
  - - [3776, 2496, 1, 512, 3776, 3776, 512, 512]
    - [0, 8.938]
  - - [3904, 2496, 1, 512, 3904, 3904, 512, 512]
    - [0, 8.962]
  - - [4032, 2496, 1, 512, 4032, 4032, 512, 512]
    - [0, 9.003]
  - - [64, 2624, 1, 512, 64, 64, 512, 512]
    - [0, 6.963]
  - - [192, 2624, 1, 512, 192, 192, 512, 512]
    - [0, 7.887]
  - - [320, 2624, 1, 512, 320, 320, 512, 512]
    - [0, 8.333]
  - - [448, 2624, 1, 512, 448, 448, 512, 512]
    - [0, 8.514]
  - - [576, 2624, 1, 512, 576, 576, 512, 512]
    - [0, 8.624]
  - - [704, 2624, 1, 512, 704, 704, 512, 512]
    - [0, 8.785]
  - - [832, 2624, 1, 512, 832, 832, 512, 512]
    - [0, 8.84]
  - - [960, 2624, 1, 512, 960, 960, 512, 512]
    - [0, 8.864]
  - - [1088, 2624, 1, 512, 1088, 1088, 512, 512]
    - [0, 8.899]
  - - [1216, 2624, 1, 512, 1216, 1216, 512, 512]
    - [0, 8.754]
  - - [1344, 2624, 1, 512, 1344, 1344, 512, 512]
    - [0, 8.842]
  - - [1472, 2624, 1, 512, 1472, 1472, 512, 512]
    - [0, 8.84]
  - - [1600, 2624, 1, 512, 1600, 1600, 512, 512]
    - [0, 8.855]
  - - [1728, 2624, 1, 512, 1728, 1728, 512, 512]
    - [0, 8.928]
  - - [1856, 2624, 1, 512, 1856, 1856, 512, 512]
    - [0, 8.823]
  - - [1984, 2624, 1, 512, 1984, 1984, 512, 512]
    - [0, 8.884]
  - - [2112, 2624, 1, 512, 2112, 2112, 512, 512]
    - [0, 8.933]
  - - [2240, 2624, 1, 512, 2240, 2240, 512, 512]
    - [0, 8.957]
  - - [2368, 2624, 1, 512, 2368, 2368, 512, 512]
    - [0, 8.95]
  - - [2496, 2624, 1, 512, 2496, 2496, 512, 512]
    - [0, 8.904]
  - - [2624, 2624, 1, 512, 2624, 2624, 512, 512]
    - [0, 8.968]
  - - [2752, 2624, 1, 512, 2752, 2752, 512, 512]
    - [0, 8.971]
  - - [2880, 2624, 1, 512, 2880, 2880, 512, 512]
    - [0, 8.936]
  - - [3008, 2624, 1, 512, 3008, 3008, 512, 512]
    - [0, 8.94]
  - - [3136, 2624, 1, 512, 3136, 3136, 512, 512]
    - [0, 9.008]
  - - [3264, 2624, 1, 512, 3264, 3264, 512, 512]
    - [0, 8.966]
  - - [3392, 2624, 1, 512, 3392, 3392, 512, 512]
    - [0, 8.961]
  - - [3520, 2624, 1, 512, 3520, 3520, 512, 512]
    - [0, 8.974]
  - - [3648, 2624, 1, 512, 3648, 3648, 512, 512]
    - [0, 9.038]
  - - [3776, 2624, 1, 512, 3776, 3776, 512, 512]
    - [0, 8.946]
  - - [3904, 2624, 1, 512, 3904, 3904, 512, 512]
    - [0, 8.979]
  - - [4032, 2624, 1, 512, 4032, 4032, 512, 512]
    - [0, 9.069]
  - - [64, 2752, 1, 512, 64, 64, 512, 512]
    - [0, 7.293]
  - - [192, 2752, 1, 512, 192, 192, 512, 512]
    - [0, 7.864]
  - - [320, 2752, 1, 512, 320, 320, 512, 512]
    - [0, 8.407]
  - - [448, 2752, 1, 512, 448, 448, 512, 512]
    - [0, 8.529]
  - - [576, 2752, 1, 512, 576, 576, 512, 512]
    - [0, 8.708]
  - - [704, 2752, 1, 512, 704, 704, 512, 512]
    - [0, 8.76]
  - - [832, 2752, 1, 512, 832, 832, 512, 512]
    - [0, 8.872]
  - - [960, 2752, 1, 512, 960, 960, 512, 512]
    - [0, 8.843]
  - - [1088, 2752, 1, 512, 1088, 1088, 512, 512]
    - [0, 8.732]
  - - [1216, 2752, 1, 512, 1216, 1216, 512, 512]
    - [0, 8.819]
  - - [1344, 2752, 1, 512, 1344, 1344, 512, 512]
    - [0, 8.761]
  - - [1472, 2752, 1, 512, 1472, 1472, 512, 512]
    - [0, 8.804]
  - - [1600, 2752, 1, 512, 1600, 1600, 512, 512]
    - [0, 8.866]
  - - [1728, 2752, 1, 512, 1728, 1728, 512, 512]
    - [0, 8.848]
  - - [1856, 2752, 1, 512, 1856, 1856, 512, 512]
    - [0, 8.858]
  - - [1984, 2752, 1, 512, 1984, 1984, 512, 512]
    - [0, 8.91]
  - - [2112, 2752, 1, 512, 2112, 2112, 512, 512]
    - [0, 8.899]
  - - [2240, 2752, 1, 512, 2240, 2240, 512, 512]
    - [0, 8.915]
  - - [2368, 2752, 1, 512, 2368, 2368, 512, 512]
    - [0, 9.01]
  - - [2496, 2752, 1, 512, 2496, 2496, 512, 512]
    - [0, 8.962]
  - - [2624, 2752, 1, 512, 2624, 2624, 512, 512]
    - [0, 8.946]
  - - [2752, 2752, 1, 512, 2752, 2752, 512, 512]
    - [0, 8.899]
  - - [2880, 2752, 1, 512, 2880, 2880, 512, 512]
    - [0, 8.907]
  - - [3008, 2752, 1, 512, 3008, 3008, 512, 512]
    - [0, 9.027]
  - - [3136, 2752, 1, 512, 3136, 3136, 512, 512]
    - [0, 9.024]
  - - [3264, 2752, 1, 512, 3264, 3264, 512, 512]
    - [0, 8.944]
  - - [3392, 2752, 1, 512, 3392, 3392, 512, 512]
    - [0, 9.037]
  - - [3520, 2752, 1, 512, 3520, 3520, 512, 512]
    - [0, 8.99]
  - - [3648, 2752, 1, 512, 3648, 3648, 512, 512]
    - [0, 8.982]
  - - [3776, 2752, 1, 512, 3776, 3776, 512, 512]
    - [0, 8.991]
  - - [3904, 2752, 1, 512, 3904, 3904, 512, 512]
    - [0, 8.948]
  - - [4032, 2752, 1, 512, 4032, 4032, 512, 512]
    - [0, 8.984]
  - - [64, 2880, 1, 512, 64, 64, 512, 512]
    - [0, 6.434]
  - - [192, 2880, 1, 512, 192, 192, 512, 512]
    - [0, 8.169]
  - - [320, 2880, 1, 512, 320, 320, 512, 512]
    - [0, 8.494]
  - - [448, 2880, 1, 512, 448, 448, 512, 512]
    - [0, 8.623]
  - - [576, 2880, 1, 512, 576, 576, 512, 512]
    - [0, 8.79]
  - - [704, 2880, 1, 512, 704, 704, 512, 512]
    - [0, 8.81]
  - - [832, 2880, 1, 512, 832, 832, 512, 512]
    - [0, 8.84]
  - - [960, 2880, 1, 512, 960, 960, 512, 512]
    - [0, 8.9]
  - - [1088, 2880, 1, 512, 1088, 1088, 512, 512]
    - [0, 8.834]
  - - [1216, 2880, 1, 512, 1216, 1216, 512, 512]
    - [0, 8.784]
  - - [1344, 2880, 1, 512, 1344, 1344, 512, 512]
    - [0, 8.779]
  - - [1472, 2880, 1, 512, 1472, 1472, 512, 512]
    - [0, 8.904]
  - - [1600, 2880, 1, 512, 1600, 1600, 512, 512]
    - [0, 8.887]
  - - [1728, 2880, 1, 512, 1728, 1728, 512, 512]
    - [0, 8.871]
  - - [1856, 2880, 1, 512, 1856, 1856, 512, 512]
    - [0, 8.915]
  - - [1984, 2880, 1, 512, 1984, 1984, 512, 512]
    - [0, 9.029]
  - - [2112, 2880, 1, 512, 2112, 2112, 512, 512]
    - [0, 8.891]
  - - [2240, 2880, 1, 512, 2240, 2240, 512, 512]
    - [0, 8.946]
  - - [2368, 2880, 1, 512, 2368, 2368, 512, 512]
    - [0, 8.946]
  - - [2496, 2880, 1, 512, 2496, 2496, 512, 512]
    - [0, 9.009]
  - - [2624, 2880, 1, 512, 2624, 2624, 512, 512]
    - [0, 8.998]
  - - [2752, 2880, 1, 512, 2752, 2752, 512, 512]
    - [0, 8.936]
  - - [2880, 2880, 1, 512, 2880, 2880, 512, 512]
    - [0, 9.012]
  - - [3008, 2880, 1, 512, 3008, 3008, 512, 512]
    - [0, 8.936]
  - - [3136, 2880, 1, 512, 3136, 3136, 512, 512]
    - [0, 8.993]
  - - [3264, 2880, 1, 512, 3264, 3264, 512, 512]
    - [0, 8.932]
  - - [3392, 2880, 1, 512, 3392, 3392, 512, 512]
    - [0, 9.035]
  - - [3520, 2880, 1, 512, 3520, 3520, 512, 512]
    - [0, 9.001]
  - - [3648, 2880, 1, 512, 3648, 3648, 512, 512]
    - [0, 9.055]
  - - [3776, 2880, 1, 512, 3776, 3776, 512, 512]
    - [0, 8.954]
  - - [3904, 2880, 1, 512, 3904, 3904, 512, 512]
    - [0, 9.03]
  - - [4032, 2880, 1, 512, 4032, 4032, 512, 512]
    - [0, 9.012]
  - - [64, 3008, 1, 512, 64, 64, 512, 512]
    - [0, 5.948]
  - - [192, 3008, 1, 512, 192, 192, 512, 512]
    - [0, 8.14]
  - - [320, 3008, 1, 512, 320, 320, 512, 512]
    - [0, 8.422]
  - - [448, 3008, 1, 512, 448, 448, 512, 512]
    - [0, 8.651]
  - - [576, 3008, 1, 512, 576, 576, 512, 512]
    - [0, 8.773]
  - - [704, 3008, 1, 512, 704, 704, 512, 512]
    - [0, 8.797]
  - - [832, 3008, 1, 512, 832, 832, 512, 512]
    - [0, 8.888]
  - - [960, 3008, 1, 512, 960, 960, 512, 512]
    - [0, 8.745]
  - - [1088, 3008, 1, 512, 1088, 1088, 512, 512]
    - [0, 8.796]
  - - [1216, 3008, 1, 512, 1216, 1216, 512, 512]
    - [0, 8.78]
  - - [1344, 3008, 1, 512, 1344, 1344, 512, 512]
    - [0, 8.905]
  - - [1472, 3008, 1, 512, 1472, 1472, 512, 512]
    - [0, 8.871]
  - - [1600, 3008, 1, 512, 1600, 1600, 512, 512]
    - [0, 8.851]
  - - [1728, 3008, 1, 512, 1728, 1728, 512, 512]
    - [0, 8.865]
  - - [1856, 3008, 1, 512, 1856, 1856, 512, 512]
    - [0, 8.892]
  - - [1984, 3008, 1, 512, 1984, 1984, 512, 512]
    - [0, 8.867]
  - - [2112, 3008, 1, 512, 2112, 2112, 512, 512]
    - [0, 8.914]
  - - [2240, 3008, 1, 512, 2240, 2240, 512, 512]
    - [0, 9.027]
  - - [2368, 3008, 1, 512, 2368, 2368, 512, 512]
    - [0, 8.988]
  - - [2496, 3008, 1, 512, 2496, 2496, 512, 512]
    - [0, 8.921]
  - - [2624, 3008, 1, 512, 2624, 2624, 512, 512]
    - [0, 8.972]
  - - [2752, 3008, 1, 512, 2752, 2752, 512, 512]
    - [0, 8.962]
  - - [2880, 3008, 1, 512, 2880, 2880, 512, 512]
    - [0, 8.995]
  - - [3008, 3008, 1, 512, 3008, 3008, 512, 512]
    - [0, 8.986]
  - - [3136, 3008, 1, 512, 3136, 3136, 512, 512]
    - [0, 9.015]
  - - [3264, 3008, 1, 512, 3264, 3264, 512, 512]
    - [0, 8.969]
  - - [3392, 3008, 1, 512, 3392, 3392, 512, 512]
    - [0, 9.039]
  - - [3520, 3008, 1, 512, 3520, 3520, 512, 512]
    - [0, 8.987]
  - - [3648, 3008, 1, 512, 3648, 3648, 512, 512]
    - [0, 9.029]
  - - [3776, 3008, 1, 512, 3776, 3776, 512, 512]
    - [0, 8.988]
  - - [3904, 3008, 1, 512, 3904, 3904, 512, 512]
    - [0, 9.003]
  - - [4032, 3008, 1, 512, 4032, 4032, 512, 512]
    - [0, 9.064]
  - - [64, 3136, 1, 512, 64, 64, 512, 512]
    - [0, 7.29]
  - - [192, 3136, 1, 512, 192, 192, 512, 512]
    - [0, 8.123]
  - - [320, 3136, 1, 512, 320, 320, 512, 512]
    - [0, 8.477]
  - - [448, 3136, 1, 512, 448, 448, 512, 512]
    - [0, 8.649]
  - - [576, 3136, 1, 512, 576, 576, 512, 512]
    - [0, 8.814]
  - - [704, 3136, 1, 512, 704, 704, 512, 512]
    - [0, 8.802]
  - - [832, 3136, 1, 512, 832, 832, 512, 512]
    - [0, 8.836]
  - - [960, 3136, 1, 512, 960, 960, 512, 512]
    - [0, 8.773]
  - - [1088, 3136, 1, 512, 1088, 1088, 512, 512]
    - [0, 8.821]
  - - [1216, 3136, 1, 512, 1216, 1216, 512, 512]
    - [0, 8.827]
  - - [1344, 3136, 1, 512, 1344, 1344, 512, 512]
    - [0, 8.868]
  - - [1472, 3136, 1, 512, 1472, 1472, 512, 512]
    - [0, 8.877]
  - - [1600, 3136, 1, 512, 1600, 1600, 512, 512]
    - [0, 8.84]
  - - [1728, 3136, 1, 512, 1728, 1728, 512, 512]
    - [0, 8.852]
  - - [1856, 3136, 1, 512, 1856, 1856, 512, 512]
    - [0, 8.932]
  - - [1984, 3136, 1, 512, 1984, 1984, 512, 512]
    - [0, 8.973]
  - - [2112, 3136, 1, 512, 2112, 2112, 512, 512]
    - [0, 9.002]
  - - [2240, 3136, 1, 512, 2240, 2240, 512, 512]
    - [0, 8.917]
  - - [2368, 3136, 1, 512, 2368, 2368, 512, 512]
    - [0, 8.979]
  - - [2496, 3136, 1, 512, 2496, 2496, 512, 512]
    - [0, 8.976]
  - - [2624, 3136, 1, 512, 2624, 2624, 512, 512]
    - [0, 8.958]
  - - [2752, 3136, 1, 512, 2752, 2752, 512, 512]
    - [0, 8.992]
  - - [2880, 3136, 1, 512, 2880, 2880, 512, 512]
    - [0, 8.989]
  - - [3008, 3136, 1, 512, 3008, 3008, 512, 512]
    - [0, 9.015]
  - - [3136, 3136, 1, 512, 3136, 3136, 512, 512]
    - [0, 8.965]
  - - [3264, 3136, 1, 512, 3264, 3264, 512, 512]
    - [0, 9.056]
  - - [3392, 3136, 1, 512, 3392, 3392, 512, 512]
    - [0, 8.986]
  - - [3520, 3136, 1, 512, 3520, 3520, 512, 512]
    - [0, 9.019]
  - - [3648, 3136, 1, 512, 3648, 3648, 512, 512]
    - [0, 9.045]
  - - [3776, 3136, 1, 512, 3776, 3776, 512, 512]
    - [0, 9.012]
  - - [3904, 3136, 1, 512, 3904, 3904, 512, 512]
    - [0, 9.045]
  - - [4032, 3136, 1, 512, 4032, 4032, 512, 512]
    - [0, 9.063]
  - - [64, 3264, 1, 512, 64, 64, 512, 512]
    - [0, 6.786]
  - - [192, 3264, 1, 512, 192, 192, 512, 512]
    - [0, 8.095]
  - - [320, 3264, 1, 512, 320, 320, 512, 512]
    - [0, 8.542]
  - - [448, 3264, 1, 512, 448, 448, 512, 512]
    - [0, 8.659]
  - - [576, 3264, 1, 512, 576, 576, 512, 512]
    - [0, 8.776]
  - - [704, 3264, 1, 512, 704, 704, 512, 512]
    - [0, 8.804]
  - - [832, 3264, 1, 512, 832, 832, 512, 512]
    - [0, 8.869]
  - - [960, 3264, 1, 512, 960, 960, 512, 512]
    - [0, 8.787]
  - - [1088, 3264, 1, 512, 1088, 1088, 512, 512]
    - [0, 8.85]
  - - [1216, 3264, 1, 512, 1216, 1216, 512, 512]
    - [0, 8.798]
  - - [1344, 3264, 1, 512, 1344, 1344, 512, 512]
    - [0, 8.823]
  - - [1472, 3264, 1, 512, 1472, 1472, 512, 512]
    - [0, 8.853]
  - - [1600, 3264, 1, 512, 1600, 1600, 512, 512]
    - [0, 8.926]
  - - [1728, 3264, 1, 512, 1728, 1728, 512, 512]
    - [0, 8.966]
  - - [1856, 3264, 1, 512, 1856, 1856, 512, 512]
    - [0, 9.0]
  - - [1984, 3264, 1, 512, 1984, 1984, 512, 512]
    - [0, 8.912]
  - - [2112, 3264, 1, 512, 2112, 2112, 512, 512]
    - [0, 8.887]
  - - [2240, 3264, 1, 512, 2240, 2240, 512, 512]
    - [0, 8.942]
  - - [2368, 3264, 1, 512, 2368, 2368, 512, 512]
    - [0, 8.975]
  - - [2496, 3264, 1, 512, 2496, 2496, 512, 512]
    - [0, 8.997]
  - - [2624, 3264, 1, 512, 2624, 2624, 512, 512]
    - [0, 8.988]
  - - [2752, 3264, 1, 512, 2752, 2752, 512, 512]
    - [0, 8.961]
  - - [2880, 3264, 1, 512, 2880, 2880, 512, 512]
    - [0, 8.955]
  - - [3008, 3264, 1, 512, 3008, 3008, 512, 512]
    - [0, 9.011]
  - - [3136, 3264, 1, 512, 3136, 3136, 512, 512]
    - [0, 8.987]
  - - [3264, 3264, 1, 512, 3264, 3264, 512, 512]
    - [0, 9.003]
  - - [3392, 3264, 1, 512, 3392, 3392, 512, 512]
    - [0, 8.989]
  - - [3520, 3264, 1, 512, 3520, 3520, 512, 512]
    - [0, 9.062]
  - - [3648, 3264, 1, 512, 3648, 3648, 512, 512]
    - [0, 9.013]
  - - [3776, 3264, 1, 512, 3776, 3776, 512, 512]
    - [0, 9.01]
  - - [3904, 3264, 1, 512, 3904, 3904, 512, 512]
    - [0, 9.051]
  - - [4032, 3264, 1, 512, 4032, 4032, 512, 512]
    - [0, 9.115]
  - - [64, 3392, 1, 512, 64, 64, 512, 512]
    - [0, 7.147]
  - - [192, 3392, 1, 512, 192, 192, 512, 512]
    - [0, 8.079]
  - - [320, 3392, 1, 512, 320, 320, 512, 512]
    - [0, 8.52]
  - - [448, 3392, 1, 512, 448, 448, 512, 512]
    - [0, 8.64]
  - - [576, 3392, 1, 512, 576, 576, 512, 512]
    - [0, 8.76]
  - - [704, 3392, 1, 512, 704, 704, 512, 512]
    - [0, 8.807]
  - - [832, 3392, 1, 512, 832, 832, 512, 512]
    - [0, 8.921]
  - - [960, 3392, 1, 512, 960, 960, 512, 512]
    - [0, 8.745]
  - - [1088, 3392, 1, 512, 1088, 1088, 512, 512]
    - [0, 8.776]
  - - [1216, 3392, 1, 512, 1216, 1216, 512, 512]
    - [0, 8.897]
  - - [1344, 3392, 1, 512, 1344, 1344, 512, 512]
    - [0, 8.92]
  - - [1472, 3392, 1, 512, 1472, 1472, 512, 512]
    - [0, 8.87]
  - - [1600, 3392, 1, 512, 1600, 1600, 512, 512]
    - [0, 8.866]
  - - [1728, 3392, 1, 512, 1728, 1728, 512, 512]
    - [0, 9.009]
  - - [1856, 3392, 1, 512, 1856, 1856, 512, 512]
    - [0, 8.881]
  - - [1984, 3392, 1, 512, 1984, 1984, 512, 512]
    - [0, 8.936]
  - - [2112, 3392, 1, 512, 2112, 2112, 512, 512]
    - [0, 8.937]
  - - [2240, 3392, 1, 512, 2240, 2240, 512, 512]
    - [0, 8.919]
  - - [2368, 3392, 1, 512, 2368, 2368, 512, 512]
    - [0, 8.977]
  - - [2496, 3392, 1, 512, 2496, 2496, 512, 512]
    - [0, 8.967]
  - - [2624, 3392, 1, 512, 2624, 2624, 512, 512]
    - [0, 8.993]
  - - [2752, 3392, 1, 512, 2752, 2752, 512, 512]
    - [0, 8.972]
  - - [2880, 3392, 1, 512, 2880, 2880, 512, 512]
    - [0, 9.029]
  - - [3008, 3392, 1, 512, 3008, 3008, 512, 512]
    - [0, 9.052]
  - - [3136, 3392, 1, 512, 3136, 3136, 512, 512]
    - [0, 8.981]
  - - [3264, 3392, 1, 512, 3264, 3264, 512, 512]
    - [0, 8.987]
  - - [3392, 3392, 1, 512, 3392, 3392, 512, 512]
    - [0, 9.0]
  - - [3520, 3392, 1, 512, 3520, 3520, 512, 512]
    - [0, 9.062]
  - - [3648, 3392, 1, 512, 3648, 3648, 512, 512]
    - [0, 9.069]
  - - [3776, 3392, 1, 512, 3776, 3776, 512, 512]
    - [0, 9.041]
  - - [3904, 3392, 1, 512, 3904, 3904, 512, 512]
    - [0, 9.071]
  - - [4032, 3392, 1, 512, 4032, 4032, 512, 512]
    - [0, 9.104]
  - - [64, 3520, 1, 512, 64, 64, 512, 512]
    - [0, 6.355]
  - - [192, 3520, 1, 512, 192, 192, 512, 512]
    - [0, 8.316]
  - - [320, 3520, 1, 512, 320, 320, 512, 512]
    - [0, 8.546]
  - - [448, 3520, 1, 512, 448, 448, 512, 512]
    - [0, 8.642]
  - - [576, 3520, 1, 512, 576, 576, 512, 512]
    - [0, 8.765]
  - - [704, 3520, 1, 512, 704, 704, 512, 512]
    - [0, 8.897]
  - - [832, 3520, 1, 512, 832, 832, 512, 512]
    - [0, 8.746]
  - - [960, 3520, 1, 512, 960, 960, 512, 512]
    - [0, 8.79]
  - - [1088, 3520, 1, 512, 1088, 1088, 512, 512]
    - [0, 8.783]
  - - [1216, 3520, 1, 512, 1216, 1216, 512, 512]
    - [0, 8.821]
  - - [1344, 3520, 1, 512, 1344, 1344, 512, 512]
    - [0, 8.886]
  - - [1472, 3520, 1, 512, 1472, 1472, 512, 512]
    - [0, 8.912]
  - - [1600, 3520, 1, 512, 1600, 1600, 512, 512]
    - [0, 8.995]
  - - [1728, 3520, 1, 512, 1728, 1728, 512, 512]
    - [0, 8.886]
  - - [1856, 3520, 1, 512, 1856, 1856, 512, 512]
    - [0, 9.002]
  - - [1984, 3520, 1, 512, 1984, 1984, 512, 512]
    - [0, 8.947]
  - - [2112, 3520, 1, 512, 2112, 2112, 512, 512]
    - [0, 8.948]
  - - [2240, 3520, 1, 512, 2240, 2240, 512, 512]
    - [0, 9.026]
  - - [2368, 3520, 1, 512, 2368, 2368, 512, 512]
    - [0, 8.988]
  - - [2496, 3520, 1, 512, 2496, 2496, 512, 512]
    - [0, 8.947]
  - - [2624, 3520, 1, 512, 2624, 2624, 512, 512]
    - [0, 9.013]
  - - [2752, 3520, 1, 512, 2752, 2752, 512, 512]
    - [0, 8.998]
  - - [2880, 3520, 1, 512, 2880, 2880, 512, 512]
    - [0, 9.024]
  - - [3008, 3520, 1, 512, 3008, 3008, 512, 512]
    - [0, 8.984]
  - - [3136, 3520, 1, 512, 3136, 3136, 512, 512]
    - [0, 9.055]
  - - [3264, 3520, 1, 512, 3264, 3264, 512, 512]
    - [0, 8.993]
  - - [3392, 3520, 1, 512, 3392, 3392, 512, 512]
    - [0, 9.051]
  - - [3520, 3520, 1, 512, 3520, 3520, 512, 512]
    - [0, 9.045]
  - - [3648, 3520, 1, 512, 3648, 3648, 512, 512]
    - [0, 9.127]
  - - [3776, 3520, 1, 512, 3776, 3776, 512, 512]
    - [0, 9.042]
  - - [3904, 3520, 1, 512, 3904, 3904, 512, 512]
    - [0, 9.051]
  - - [4032, 3520, 1, 512, 4032, 4032, 512, 512]
    - [0, 9.001]
  - - [64, 3648, 1, 512, 64, 64, 512, 512]
    - [0, 7.539]
  - - [192, 3648, 1, 512, 192, 192, 512, 512]
    - [0, 8.298]
  - - [320, 3648, 1, 512, 320, 320, 512, 512]
    - [0, 8.604]
  - - [448, 3648, 1, 512, 448, 448, 512, 512]
    - [0, 8.769]
  - - [576, 3648, 1, 512, 576, 576, 512, 512]
    - [0, 8.75]
  - - [704, 3648, 1, 512, 704, 704, 512, 512]
    - [0, 8.849]
  - - [832, 3648, 1, 512, 832, 832, 512, 512]
    - [0, 8.829]
  - - [960, 3648, 1, 512, 960, 960, 512, 512]
    - [0, 8.761]
  - - [1088, 3648, 1, 512, 1088, 1088, 512, 512]
    - [0, 8.8]
  - - [1216, 3648, 1, 512, 1216, 1216, 512, 512]
    - [0, 8.886]
  - - [1344, 3648, 1, 512, 1344, 1344, 512, 512]
    - [0, 8.847]
  - - [1472, 3648, 1, 512, 1472, 1472, 512, 512]
    - [0, 8.932]
  - - [1600, 3648, 1, 512, 1600, 1600, 512, 512]
    - [0, 8.95]
  - - [1728, 3648, 1, 512, 1728, 1728, 512, 512]
    - [0, 8.996]
  - - [1856, 3648, 1, 512, 1856, 1856, 512, 512]
    - [0, 8.931]
  - - [1984, 3648, 1, 512, 1984, 1984, 512, 512]
    - [0, 8.925]
  - - [2112, 3648, 1, 512, 2112, 2112, 512, 512]
    - [0, 9.016]
  - - [2240, 3648, 1, 512, 2240, 2240, 512, 512]
    - [0, 9.021]
  - - [2368, 3648, 1, 512, 2368, 2368, 512, 512]
    - [0, 9.015]
  - - [2496, 3648, 1, 512, 2496, 2496, 512, 512]
    - [0, 9.027]
  - - [2624, 3648, 1, 512, 2624, 2624, 512, 512]
    - [0, 9.023]
  - - [2752, 3648, 1, 512, 2752, 2752, 512, 512]
    - [0, 9.0]
  - - [2880, 3648, 1, 512, 2880, 2880, 512, 512]
    - [0, 8.97]
  - - [3008, 3648, 1, 512, 3008, 3008, 512, 512]
    - [0, 9.026]
  - - [3136, 3648, 1, 512, 3136, 3136, 512, 512]
    - [0, 9.04]
  - - [3264, 3648, 1, 512, 3264, 3264, 512, 512]
    - [0, 9.009]
  - - [3392, 3648, 1, 512, 3392, 3392, 512, 512]
    - [0, 8.978]
  - - [3520, 3648, 1, 512, 3520, 3520, 512, 512]
    - [0, 8.969]
  - - [3648, 3648, 1, 512, 3648, 3648, 512, 512]
    - [0, 9.007]
  - - [3776, 3648, 1, 512, 3776, 3776, 512, 512]
    - [0, 8.977]
  - - [3904, 3648, 1, 512, 3904, 3904, 512, 512]
    - [0, 9.018]
  - - [4032, 3648, 1, 512, 4032, 4032, 512, 512]
    - [0, 9.016]
  - - [64, 3776, 1, 512, 64, 64, 512, 512]
    - [0, 7.812]
  - - [192, 3776, 1, 512, 192, 192, 512, 512]
    - [0, 8.251]
  - - [320, 3776, 1, 512, 320, 320, 512, 512]
    - [0, 8.516]
  - - [448, 3776, 1, 512, 448, 448, 512, 512]
    - [0, 8.734]
  - - [576, 3776, 1, 512, 576, 576, 512, 512]
    - [0, 8.806]
  - - [704, 3776, 1, 512, 704, 704, 512, 512]
    - [0, 8.84]
  - - [832, 3776, 1, 512, 832, 832, 512, 512]
    - [0, 8.775]
  - - [960, 3776, 1, 512, 960, 960, 512, 512]
    - [0, 8.86]
  - - [1088, 3776, 1, 512, 1088, 1088, 512, 512]
    - [0, 8.834]
  - - [1216, 3776, 1, 512, 1216, 1216, 512, 512]
    - [0, 8.936]
  - - [1344, 3776, 1, 512, 1344, 1344, 512, 512]
    - [0, 8.893]
  - - [1472, 3776, 1, 512, 1472, 1472, 512, 512]
    - [0, 8.919]
  - - [1600, 3776, 1, 512, 1600, 1600, 512, 512]
    - [0, 8.961]
  - - [1728, 3776, 1, 512, 1728, 1728, 512, 512]
    - [0, 8.936]
  - - [1856, 3776, 1, 512, 1856, 1856, 512, 512]
    - [0, 8.955]
  - - [1984, 3776, 1, 512, 1984, 1984, 512, 512]
    - [0, 8.96]
  - - [2112, 3776, 1, 512, 2112, 2112, 512, 512]
    - [0, 8.907]
  - - [2240, 3776, 1, 512, 2240, 2240, 512, 512]
    - [0, 8.956]
  - - [2368, 3776, 1, 512, 2368, 2368, 512, 512]
    - [0, 8.969]
  - - [2496, 3776, 1, 512, 2496, 2496, 512, 512]
    - [0, 8.987]
  - - [2624, 3776, 1, 512, 2624, 2624, 512, 512]
    - [0, 9.008]
  - - [2752, 3776, 1, 512, 2752, 2752, 512, 512]
    - [0, 9.031]
  - - [2880, 3776, 1, 512, 2880, 2880, 512, 512]
    - [0, 8.969]
  - - [3008, 3776, 1, 512, 3008, 3008, 512, 512]
    - [0, 8.985]
  - - [3136, 3776, 1, 512, 3136, 3136, 512, 512]
    - [0, 8.985]
  - - [3264, 3776, 1, 512, 3264, 3264, 512, 512]
    - [0, 9.022]
  - - [3392, 3776, 1, 512, 3392, 3392, 512, 512]
    - [0, 9.008]
  - - [3520, 3776, 1, 512, 3520, 3520, 512, 512]
    - [0, 9.107]
  - - [3648, 3776, 1, 512, 3648, 3648, 512, 512]
    - [0, 9.003]
  - - [3776, 3776, 1, 512, 3776, 3776, 512, 512]
    - [0, 8.995]
  - - [3904, 3776, 1, 512, 3904, 3904, 512, 512]
    - [0, 9.002]
  - - [4032, 3776, 1, 512, 4032, 4032, 512, 512]
    - [0, 9.076]
  - - [64, 3904, 1, 512, 64, 64, 512, 512]
    - [0, 7.404]
  - - [192, 3904, 1, 512, 192, 192, 512, 512]
    - [0, 8.237]
  - - [320, 3904, 1, 512, 320, 320, 512, 512]
    - [0, 8.595]
  - - [448, 3904, 1, 512, 448, 448, 512, 512]
    - [0, 8.766]
  - - [576, 3904, 1, 512, 576, 576, 512, 512]
    - [0, 8.83]
  - - [704, 3904, 1, 512, 704, 704, 512, 512]
    - [0, 8.833]
  - - [832, 3904, 1, 512, 832, 832, 512, 512]
    - [0, 8.731]
  - - [960, 3904, 1, 512, 960, 960, 512, 512]
    - [0, 8.84]
  - - [1088, 3904, 1, 512, 1088, 1088, 512, 512]
    - [0, 8.811]
  - - [1216, 3904, 1, 512, 1216, 1216, 512, 512]
    - [0, 8.871]
  - - [1344, 3904, 1, 512, 1344, 1344, 512, 512]
    - [0, 8.926]
  - - [1472, 3904, 1, 512, 1472, 1472, 512, 512]
    - [0, 8.906]
  - - [1600, 3904, 1, 512, 1600, 1600, 512, 512]
    - [0, 8.934]
  - - [1728, 3904, 1, 512, 1728, 1728, 512, 512]
    - [0, 8.891]
  - - [1856, 3904, 1, 512, 1856, 1856, 512, 512]
    - [0, 8.969]
  - - [1984, 3904, 1, 512, 1984, 1984, 512, 512]
    - [0, 9.002]
  - - [2112, 3904, 1, 512, 2112, 2112, 512, 512]
    - [0, 8.966]
  - - [2240, 3904, 1, 512, 2240, 2240, 512, 512]
    - [0, 9.027]
  - - [2368, 3904, 1, 512, 2368, 2368, 512, 512]
    - [0, 8.966]
  - - [2496, 3904, 1, 512, 2496, 2496, 512, 512]
    - [0, 9.078]
  - - [2624, 3904, 1, 512, 2624, 2624, 512, 512]
    - [0, 8.978]
  - - [2752, 3904, 1, 512, 2752, 2752, 512, 512]
    - [0, 9.099]
  - - [2880, 3904, 1, 512, 2880, 2880, 512, 512]
    - [0, 8.957]
  - - [3008, 3904, 1, 512, 3008, 3008, 512, 512]
    - [0, 8.993]
  - - [3136, 3904, 1, 512, 3136, 3136, 512, 512]
    - [0, 9.042]
  - - [3264, 3904, 1, 512, 3264, 3264, 512, 512]
    - [0, 9.044]
  - - [3392, 3904, 1, 512, 3392, 3392, 512, 512]
    - [0, 9.014]
  - - [3520, 3904, 1, 512, 3520, 3520, 512, 512]
    - [0, 9.066]
  - - [3648, 3904, 1, 512, 3648, 3648, 512, 512]
    - [0, 9.035]
  - - [3776, 3904, 1, 512, 3776, 3776, 512, 512]
    - [0, 9.045]
  - - [3904, 3904, 1, 512, 3904, 3904, 512, 512]
    - [0, 9.06]
  - - [4032, 3904, 1, 512, 4032, 4032, 512, 512]
    - [0, 9.06]
  - - [64, 4032, 1, 512, 64, 64, 512, 512]
    - [0, 7.565]
  - - [192, 4032, 1, 512, 192, 192, 512, 512]
    - [0, 8.225]
  - - [320, 4032, 1, 512, 320, 320, 512, 512]
    - [0, 8.642]
  - - [448, 4032, 1, 512, 448, 448, 512, 512]
    - [0, 8.738]
  - - [576, 4032, 1, 512, 576, 576, 512, 512]
    - [0, 8.822]
  - - [704, 4032, 1, 512, 704, 704, 512, 512]
    - [0, 8.821]
  - - [832, 4032, 1, 512, 832, 832, 512, 512]
    - [0, 8.798]
  - - [960, 4032, 1, 512, 960, 960, 512, 512]
    - [0, 8.885]
  - - [1088, 4032, 1, 512, 1088, 1088, 512, 512]
    - [0, 8.861]
  - - [1216, 4032, 1, 512, 1216, 1216, 512, 512]
    - [0, 8.947]
  - - [1344, 4032, 1, 512, 1344, 1344, 512, 512]
    - [0, 8.883]
  - - [1472, 4032, 1, 512, 1472, 1472, 512, 512]
    - [0, 8.974]
  - - [1600, 4032, 1, 512, 1600, 1600, 512, 512]
    - [0, 8.921]
  - - [1728, 4032, 1, 512, 1728, 1728, 512, 512]
    - [0, 8.94]
  - - [1856, 4032, 1, 512, 1856, 1856, 512, 512]
    - [0, 8.953]
  - - [1984, 4032, 1, 512, 1984, 1984, 512, 512]
    - [0, 8.971]
  - - [2112, 4032, 1, 512, 2112, 2112, 512, 512]
    - [0, 8.987]
  - - [2240, 4032, 1, 512, 2240, 2240, 512, 512]
    - [0, 9.02]
  - - [2368, 4032, 1, 512, 2368, 2368, 512, 512]
    - [0, 8.958]
  - - [2496, 4032, 1, 512, 2496, 2496, 512, 512]
    - [0, 9.004]
  - - [2624, 4032, 1, 512, 2624, 2624, 512, 512]
    - [0, 8.985]
  - - [2752, 4032, 1, 512, 2752, 2752, 512, 512]
    - [0, 9.024]
  - - [2880, 4032, 1, 512, 2880, 2880, 512, 512]
    - [0, 8.998]
  - - [3008, 4032, 1, 512, 3008, 3008, 512, 512]
    - [0, 9.038]
  - - [3136, 4032, 1, 512, 3136, 3136, 512, 512]
    - [0, 9.001]
  - - [3264, 4032, 1, 512, 3264, 3264, 512, 512]
    - [0, 9.079]
  - - [3392, 4032, 1, 512, 3392, 3392, 512, 512]
    - [0, 9.011]
  - - [3520, 4032, 1, 512, 3520, 3520, 512, 512]
    - [0, 9.026]
  - - [3648, 4032, 1, 512, 3648, 3648, 512, 512]
    - [0, 9.041]
  - - [3776, 4032, 1, 512, 3776, 3776, 512, 512]
    - [0, 8.985]
  - - [3904, 4032, 1, 512, 3904, 3904, 512, 512]
    - [0, 9.07]
  - - [4032, 4032, 1, 512, 4032, 4032, 512, 512]
    - [0, 8.99]
  - - [64, 64, 1, 1024, 64, 64, 1024, 1024]
    - [1, 1.117]
  - - [192, 64, 1, 1024, 192, 192, 1024, 1024]
    - [3, 2.815]
  - - [320, 64, 1, 1024, 320, 320, 1024, 1024]
    - [0, 3.828]
  - - [448, 64, 1, 1024, 448, 448, 1024, 1024]
    - [0, 5.34]
  - - [576, 64, 1, 1024, 576, 576, 1024, 1024]
    - [0, 4.278]
  - - [704, 64, 1, 1024, 704, 704, 1024, 1024]
    - [0, 5.193]
  - - [832, 64, 1, 1024, 832, 832, 1024, 1024]
    - [0, 6.12]
  - - [960, 64, 1, 1024, 960, 960, 1024, 1024]
    - [0, 7.04]
  - - [1088, 64, 1, 1024, 1088, 1088, 1024, 1024]
    - [0, 5.73]
  - - [1216, 64, 1, 1024, 1216, 1216, 1024, 1024]
    - [0, 6.396]
  - - [1344, 64, 1, 1024, 1344, 1344, 1024, 1024]
    - [0, 7.052]
  - - [1472, 64, 1, 1024, 1472, 1472, 1024, 1024]
    - [0, 6.091]
  - - [1600, 64, 1, 1024, 1600, 1600, 1024, 1024]
    - [0, 6.581]
  - - [1728, 64, 1, 1024, 1728, 1728, 1024, 1024]
    - [0, 7.089]
  - - [1856, 64, 1, 1024, 1856, 1856, 1024, 1024]
    - [0, 7.588]
  - - [1984, 64, 1, 1024, 1984, 1984, 1024, 1024]
    - [0, 6.706]
  - - [2112, 64, 1, 1024, 2112, 2112, 1024, 1024]
    - [0, 7.114]
  - - [2240, 64, 1, 1024, 2240, 2240, 1024, 1024]
    - [0, 7.527]
  - - [2368, 64, 1, 1024, 2368, 2368, 1024, 1024]
    - [0, 7.946]
  - - [2496, 64, 1, 1024, 2496, 2496, 1024, 1024]
    - [0, 6.611]
  - - [2624, 64, 1, 1024, 2624, 2624, 1024, 1024]
    - [0, 6.837]
  - - [2752, 64, 1, 1024, 2752, 2752, 1024, 1024]
    - [0, 7.133]
  - - [2880, 64, 1, 1024, 2880, 2880, 1024, 1024]
    - [0, 7.505]
  - - [3008, 64, 1, 1024, 3008, 3008, 1024, 1024]
    - [0, 7.112]
  - - [3136, 64, 1, 1024, 3136, 3136, 1024, 1024]
    - [0, 7.394]
  - - [3264, 64, 1, 1024, 3264, 3264, 1024, 1024]
    - [0, 7.699]
  - - [3392, 64, 1, 1024, 3392, 3392, 1024, 1024]
    - [0, 7.158]
  - - [3520, 64, 1, 1024, 3520, 3520, 1024, 1024]
    - [0, 7.394]
  - - [3648, 64, 1, 1024, 3648, 3648, 1024, 1024]
    - [0, 7.655]
  - - [3776, 64, 1, 1024, 3776, 3776, 1024, 1024]
    - [0, 7.909]
  - - [3904, 64, 1, 1024, 3904, 3904, 1024, 1024]
    - [0, 7.387]
  - - [4032, 64, 1, 1024, 4032, 4032, 1024, 1024]
    - [0, 7.615]
  - - [64, 192, 1, 1024, 64, 64, 1024, 1024]
    - [3, 2.826]
  - - [192, 192, 1, 1024, 192, 192, 1024, 1024]
    - [0, 4.26]
  - - [320, 192, 1, 1024, 320, 320, 1024, 1024]
    - [0, 7.04]
  - - [448, 192, 1, 1024, 448, 448, 1024, 1024]
    - [0, 7.084]
  - - [576, 192, 1, 1024, 576, 576, 1024, 1024]
    - [0, 7.103]
  - - [704, 192, 1, 1024, 704, 704, 1024, 1024]
    - [0, 7.134]
  - - [832, 192, 1, 1024, 832, 832, 1024, 1024]
    - [0, 6.955]
  - - [960, 192, 1, 1024, 960, 960, 1024, 1024]
    - [0, 7.463]
  - - [1088, 192, 1, 1024, 1088, 1088, 1024, 1024]
    - [0, 7.694]
  - - [1216, 192, 1, 1024, 1216, 1216, 1024, 1024]
    - [0, 7.651]
  - - [1344, 192, 1, 1024, 1344, 1344, 1024, 1024]
    - [0, 7.624]
  - - [1472, 192, 1, 1024, 1472, 1472, 1024, 1024]
    - [0, 7.592]
  - - [1600, 192, 1, 1024, 1600, 1600, 1024, 1024]
    - [0, 8.216]
  - - [1728, 192, 1, 1024, 1728, 1728, 1024, 1024]
    - [0, 8.133]
  - - [1856, 192, 1, 1024, 1856, 1856, 1024, 1024]
    - [0, 8.074]
  - - [1984, 192, 1, 1024, 1984, 1984, 1024, 1024]
    - [0, 8.022]
  - - [2112, 192, 1, 1024, 2112, 2112, 1024, 1024]
    - [0, 8.014]
  - - [2240, 192, 1, 1024, 2240, 2240, 1024, 1024]
    - [0, 8.445]
  - - [2368, 192, 1, 1024, 2368, 2368, 1024, 1024]
    - [0, 8.349]
  - - [2496, 192, 1, 1024, 2496, 2496, 1024, 1024]
    - [0, 8.3]
  - - [2624, 192, 1, 1024, 2624, 2624, 1024, 1024]
    - [0, 8.253]
  - - [2752, 192, 1, 1024, 2752, 2752, 1024, 1024]
    - [0, 8.241]
  - - [2880, 192, 1, 1024, 2880, 2880, 1024, 1024]
    - [0, 8.562]
  - - [3008, 192, 1, 1024, 3008, 3008, 1024, 1024]
    - [0, 8.489]
  - - [3136, 192, 1, 1024, 3136, 3136, 1024, 1024]
    - [0, 8.453]
  - - [3264, 192, 1, 1024, 3264, 3264, 1024, 1024]
    - [0, 8.395]
  - - [3392, 192, 1, 1024, 3392, 3392, 1024, 1024]
    - [0, 8.362]
  - - [3520, 192, 1, 1024, 3520, 3520, 1024, 1024]
    - [0, 8.644]
  - - [3648, 192, 1, 1024, 3648, 3648, 1024, 1024]
    - [0, 8.588]
  - - [3776, 192, 1, 1024, 3776, 3776, 1024, 1024]
    - [0, 8.539]
  - - [3904, 192, 1, 1024, 3904, 3904, 1024, 1024]
    - [0, 8.501]
  - - [4032, 192, 1, 1024, 4032, 4032, 1024, 1024]
    - [0, 8.464]
  - - [64, 320, 1, 1024, 64, 64, 1024, 1024]
    - [0, 3.825]
  - - [192, 320, 1, 1024, 192, 192, 1024, 1024]
    - [0, 7.039]
  - - [320, 320, 1, 1024, 320, 320, 1024, 1024]
    - [0, 6.587]
  - - [448, 320, 1, 1024, 448, 448, 1024, 1024]
    - [0, 7.543]
  - - [576, 320, 1, 1024, 576, 576, 1024, 1024]
    - [0, 7.46]
  - - [704, 320, 1, 1024, 704, 704, 1024, 1024]
    - [0, 7.394]
  - - [832, 320, 1, 1024, 832, 832, 1024, 1024]
    - [0, 7.853]
  - - [960, 320, 1, 1024, 960, 960, 1024, 1024]
    - [0, 8.228]
  - - [1088, 320, 1, 1024, 1088, 1088, 1024, 1024]
    - [0, 7.904]
  - - [1216, 320, 1, 1024, 1216, 1216, 1024, 1024]
    - [0, 8.181]
  - - [1344, 320, 1, 1024, 1344, 1344, 1024, 1024]
    - [0, 8.441]
  - - [1472, 320, 1, 1024, 1472, 1472, 1024, 1024]
    - [0, 8.167]
  - - [1600, 320, 1, 1024, 1600, 1600, 1024, 1024]
    - [0, 8.385]
  - - [1728, 320, 1, 1024, 1728, 1728, 1024, 1024]
    - [0, 8.56]
  - - [1856, 320, 1, 1024, 1856, 1856, 1024, 1024]
    - [0, 8.349]
  - - [1984, 320, 1, 1024, 1984, 1984, 1024, 1024]
    - [0, 8.497]
  - - [2112, 320, 1, 1024, 2112, 2112, 1024, 1024]
    - [0, 8.631]
  - - [2240, 320, 1, 1024, 2240, 2240, 1024, 1024]
    - [0, 8.461]
  - - [2368, 320, 1, 1024, 2368, 2368, 1024, 1024]
    - [0, 8.579]
  - - [2496, 320, 1, 1024, 2496, 2496, 1024, 1024]
    - [0, 8.695]
  - - [2624, 320, 1, 1024, 2624, 2624, 1024, 1024]
    - [0, 8.536]
  - - [2752, 320, 1, 1024, 2752, 2752, 1024, 1024]
    - [0, 8.665]
  - - [2880, 320, 1, 1024, 2880, 2880, 1024, 1024]
    - [0, 8.755]
  - - [3008, 320, 1, 1024, 3008, 3008, 1024, 1024]
    - [0, 8.601]
  - - [3136, 320, 1, 1024, 3136, 3136, 1024, 1024]
    - [0, 8.66]
  - - [3264, 320, 1, 1024, 3264, 3264, 1024, 1024]
    - [0, 8.781]
  - - [3392, 320, 1, 1024, 3392, 3392, 1024, 1024]
    - [0, 8.656]
  - - [3520, 320, 1, 1024, 3520, 3520, 1024, 1024]
    - [0, 8.748]
  - - [3648, 320, 1, 1024, 3648, 3648, 1024, 1024]
    - [0, 8.797]
  - - [3776, 320, 1, 1024, 3776, 3776, 1024, 1024]
    - [0, 8.854]
  - - [3904, 320, 1, 1024, 3904, 3904, 1024, 1024]
    - [0, 8.769]
  - - [4032, 320, 1, 1024, 4032, 4032, 1024, 1024]
    - [0, 8.819]
  - - [64, 448, 1, 1024, 64, 64, 1024, 1024]
    - [0, 5.328]
  - - [192, 448, 1, 1024, 192, 192, 1024, 1024]
    - [0, 7.083]
  - - [320, 448, 1, 1024, 320, 320, 1024, 1024]
    - [0, 7.541]
  - - [448, 448, 1, 1024, 448, 448, 1024, 1024]
    - [0, 7.402]
  - - [576, 448, 1, 1024, 576, 576, 1024, 1024]
    - [0, 7.617]
  - - [704, 448, 1, 1024, 704, 704, 1024, 1024]
    - [0, 7.762]
  - - [832, 448, 1, 1024, 832, 832, 1024, 1024]
    - [0, 7.877]
  - - [960, 448, 1, 1024, 960, 960, 1024, 1024]
    - [0, 8.419]
  - - [1088, 448, 1, 1024, 1088, 1088, 1024, 1024]
    - [0, 8.436]
  - - [1216, 448, 1, 1024, 1216, 1216, 1024, 1024]
    - [0, 8.433]
  - - [1344, 448, 1, 1024, 1344, 1344, 1024, 1024]
    - [0, 8.438]
  - - [1472, 448, 1, 1024, 1472, 1472, 1024, 1024]
    - [0, 8.462]
  - - [1600, 448, 1, 1024, 1600, 1600, 1024, 1024]
    - [0, 8.457]
  - - [1728, 448, 1, 1024, 1728, 1728, 1024, 1024]
    - [0, 8.463]
  - - [1856, 448, 1, 1024, 1856, 1856, 1024, 1024]
    - [0, 8.5]
  - - [1984, 448, 1, 1024, 1984, 1984, 1024, 1024]
    - [0, 8.715]
  - - [2112, 448, 1, 1024, 2112, 2112, 1024, 1024]
    - [0, 8.704]
  - - [2240, 448, 1, 1024, 2240, 2240, 1024, 1024]
    - [0, 8.71]
  - - [2368, 448, 1, 1024, 2368, 2368, 1024, 1024]
    - [0, 8.686]
  - - [2496, 448, 1, 1024, 2496, 2496, 1024, 1024]
    - [0, 8.705]
  - - [2624, 448, 1, 1024, 2624, 2624, 1024, 1024]
    - [0, 8.684]
  - - [2752, 448, 1, 1024, 2752, 2752, 1024, 1024]
    - [0, 8.674]
  - - [2880, 448, 1, 1024, 2880, 2880, 1024, 1024]
    - [0, 8.831]
  - - [3008, 448, 1, 1024, 3008, 3008, 1024, 1024]
    - [0, 8.726]
  - - [3136, 448, 1, 1024, 3136, 3136, 1024, 1024]
    - [0, 8.805]
  - - [3264, 448, 1, 1024, 3264, 3264, 1024, 1024]
    - [0, 8.66]
  - - [3392, 448, 1, 1024, 3392, 3392, 1024, 1024]
    - [0, 8.652]
  - - [3520, 448, 1, 1024, 3520, 3520, 1024, 1024]
    - [0, 8.653]
  - - [3648, 448, 1, 1024, 3648, 3648, 1024, 1024]
    - [0, 8.653]
  - - [3776, 448, 1, 1024, 3776, 3776, 1024, 1024]
    - [0, 8.672]
  - - [3904, 448, 1, 1024, 3904, 3904, 1024, 1024]
    - [0, 8.772]
  - - [4032, 448, 1, 1024, 4032, 4032, 1024, 1024]
    - [0, 8.753]
  - - [64, 576, 1, 1024, 64, 64, 1024, 1024]
    - [0, 4.26]
  - - [192, 576, 1, 1024, 192, 192, 1024, 1024]
    - [0, 7.116]
  - - [320, 576, 1, 1024, 320, 320, 1024, 1024]
    - [0, 7.461]
  - - [448, 576, 1, 1024, 448, 448, 1024, 1024]
    - [0, 7.625]
  - - [576, 576, 1, 1024, 576, 576, 1024, 1024]
    - [0, 8.134]
  - - [704, 576, 1, 1024, 704, 704, 1024, 1024]
    - [0, 8.001]
  - - [832, 576, 1, 1024, 832, 832, 1024, 1024]
    - [0, 8.297]
  - - [960, 576, 1, 1024, 960, 960, 1024, 1024]
    - [0, 8.558]
  - - [1088, 576, 1, 1024, 1088, 1088, 1024, 1024]
    - [0, 8.396]
  - - [1216, 576, 1, 1024, 1216, 1216, 1024, 1024]
    - [0, 8.582]
  - - [1344, 576, 1, 1024, 1344, 1344, 1024, 1024]
    - [0, 8.499]
  - - [1472, 576, 1, 1024, 1472, 1472, 1024, 1024]
    - [0, 8.605]
  - - [1600, 576, 1, 1024, 1600, 1600, 1024, 1024]
    - [0, 8.708]
  - - [1728, 576, 1, 1024, 1728, 1728, 1024, 1024]
    - [0, 8.648]
  - - [1856, 576, 1, 1024, 1856, 1856, 1024, 1024]
    - [0, 8.779]
  - - [1984, 576, 1, 1024, 1984, 1984, 1024, 1024]
    - [0, 8.668]
  - - [2112, 576, 1, 1024, 2112, 2112, 1024, 1024]
    - [0, 8.74]
  - - [2240, 576, 1, 1024, 2240, 2240, 1024, 1024]
    - [0, 8.814]
  - - [2368, 576, 1, 1024, 2368, 2368, 1024, 1024]
    - [0, 8.746]
  - - [2496, 576, 1, 1024, 2496, 2496, 1024, 1024]
    - [0, 8.653]
  - - [2624, 576, 1, 1024, 2624, 2624, 1024, 1024]
    - [0, 8.641]
  - - [2752, 576, 1, 1024, 2752, 2752, 1024, 1024]
    - [0, 8.685]
  - - [2880, 576, 1, 1024, 2880, 2880, 1024, 1024]
    - [0, 8.751]
  - - [3008, 576, 1, 1024, 3008, 3008, 1024, 1024]
    - [0, 8.692]
  - - [3136, 576, 1, 1024, 3136, 3136, 1024, 1024]
    - [0, 8.758]
  - - [3264, 576, 1, 1024, 3264, 3264, 1024, 1024]
    - [0, 8.702]
  - - [3392, 576, 1, 1024, 3392, 3392, 1024, 1024]
    - [0, 8.775]
  - - [3520, 576, 1, 1024, 3520, 3520, 1024, 1024]
    - [0, 8.807]
  - - [3648, 576, 1, 1024, 3648, 3648, 1024, 1024]
    - [0, 8.756]
  - - [3776, 576, 1, 1024, 3776, 3776, 1024, 1024]
    - [0, 8.798]
  - - [3904, 576, 1, 1024, 3904, 3904, 1024, 1024]
    - [0, 8.866]
  - - [4032, 576, 1, 1024, 4032, 4032, 1024, 1024]
    - [0, 8.867]
  - - [64, 704, 1, 1024, 64, 64, 1024, 1024]
    - [0, 4.2]
  - - [192, 704, 1, 1024, 192, 192, 1024, 1024]
    - [0, 7.139]
  - - [320, 704, 1, 1024, 320, 320, 1024, 1024]
    - [0, 7.394]
  - - [448, 704, 1, 1024, 448, 448, 1024, 1024]
    - [0, 7.767]
  - - [576, 704, 1, 1024, 576, 576, 1024, 1024]
    - [0, 7.999]
  - - [704, 704, 1, 1024, 704, 704, 1024, 1024]
    - [0, 8.143]
  - - [832, 704, 1, 1024, 832, 832, 1024, 1024]
    - [0, 8.26]
  - - [960, 704, 1, 1024, 960, 960, 1024, 1024]
    - [0, 8.627]
  - - [1088, 704, 1, 1024, 1088, 1088, 1024, 1024]
    - [0, 8.655]
  - - [1216, 704, 1, 1024, 1216, 1216, 1024, 1024]
    - [0, 8.681]
  - - [1344, 704, 1, 1024, 1344, 1344, 1024, 1024]
    - [0, 8.696]
  - - [1472, 704, 1, 1024, 1472, 1472, 1024, 1024]
    - [0, 8.719]
  - - [1600, 704, 1, 1024, 1600, 1600, 1024, 1024]
    - [0, 8.732]
  - - [1728, 704, 1, 1024, 1728, 1728, 1024, 1024]
    - [0, 8.75]
  - - [1856, 704, 1, 1024, 1856, 1856, 1024, 1024]
    - [0, 8.763]
  - - [1984, 704, 1, 1024, 1984, 1984, 1024, 1024]
    - [0, 8.795]
  - - [2112, 704, 1, 1024, 2112, 2112, 1024, 1024]
    - [0, 8.635]
  - - [2240, 704, 1, 1024, 2240, 2240, 1024, 1024]
    - [0, 8.452]
  - - [2368, 704, 1, 1024, 2368, 2368, 1024, 1024]
    - [0, 8.719]
  - - [2496, 704, 1, 1024, 2496, 2496, 1024, 1024]
    - [0, 8.788]
  - - [2624, 704, 1, 1024, 2624, 2624, 1024, 1024]
    - [0, 8.788]
  - - [2752, 704, 1, 1024, 2752, 2752, 1024, 1024]
    - [0, 8.73]
  - - [2880, 704, 1, 1024, 2880, 2880, 1024, 1024]
    - [0, 8.797]
  - - [3008, 704, 1, 1024, 3008, 3008, 1024, 1024]
    - [0, 8.801]
  - - [3136, 704, 1, 1024, 3136, 3136, 1024, 1024]
    - [0, 8.81]
  - - [3264, 704, 1, 1024, 3264, 3264, 1024, 1024]
    - [0, 8.807]
  - - [3392, 704, 1, 1024, 3392, 3392, 1024, 1024]
    - [0, 8.818]
  - - [3520, 704, 1, 1024, 3520, 3520, 1024, 1024]
    - [0, 8.827]
  - - [3648, 704, 1, 1024, 3648, 3648, 1024, 1024]
    - [0, 8.86]
  - - [3776, 704, 1, 1024, 3776, 3776, 1024, 1024]
    - [0, 8.822]
  - - [3904, 704, 1, 1024, 3904, 3904, 1024, 1024]
    - [0, 8.737]
  - - [4032, 704, 1, 1024, 4032, 4032, 1024, 1024]
    - [0, 8.922]
  - - [64, 832, 1, 1024, 64, 64, 1024, 1024]
    - [0, 6.055]
  - - [192, 832, 1, 1024, 192, 192, 1024, 1024]
    - [0, 6.466]
  - - [320, 832, 1, 1024, 320, 320, 1024, 1024]
    - [0, 7.845]
  - - [448, 832, 1, 1024, 448, 448, 1024, 1024]
    - [0, 7.865]
  - - [576, 832, 1, 1024, 576, 576, 1024, 1024]
    - [0, 8.299]
  - - [704, 832, 1, 1024, 704, 704, 1024, 1024]
    - [0, 8.355]
  - - [832, 832, 1, 1024, 832, 832, 1024, 1024]
    - [0, 8.492]
  - - [960, 832, 1, 1024, 960, 960, 1024, 1024]
    - [0, 8.684]
  - - [1088, 832, 1, 1024, 1088, 1088, 1024, 1024]
    - [0, 8.609]
  - - [1216, 832, 1, 1024, 1216, 1216, 1024, 1024]
    - [0, 8.747]
  - - [1344, 832, 1, 1024, 1344, 1344, 1024, 1024]
    - [0, 8.688]
  - - [1472, 832, 1, 1024, 1472, 1472, 1024, 1024]
    - [0, 8.801]
  - - [1600, 832, 1, 1024, 1600, 1600, 1024, 1024]
    - [0, 8.734]
  - - [1728, 832, 1, 1024, 1728, 1728, 1024, 1024]
    - [0, 8.72]
  - - [1856, 832, 1, 1024, 1856, 1856, 1024, 1024]
    - [0, 8.642]
  - - [1984, 832, 1, 1024, 1984, 1984, 1024, 1024]
    - [0, 8.709]
  - - [2112, 832, 1, 1024, 2112, 2112, 1024, 1024]
    - [0, 8.795]
  - - [2240, 832, 1, 1024, 2240, 2240, 1024, 1024]
    - [0, 8.747]
  - - [2368, 832, 1, 1024, 2368, 2368, 1024, 1024]
    - [0, 8.716]
  - - [2496, 832, 1, 1024, 2496, 2496, 1024, 1024]
    - [0, 8.768]
  - - [2624, 832, 1, 1024, 2624, 2624, 1024, 1024]
    - [0, 8.827]
  - - [2752, 832, 1, 1024, 2752, 2752, 1024, 1024]
    - [0, 8.726]
  - - [2880, 832, 1, 1024, 2880, 2880, 1024, 1024]
    - [0, 8.823]
  - - [3008, 832, 1, 1024, 3008, 3008, 1024, 1024]
    - [0, 8.876]
  - - [3136, 832, 1, 1024, 3136, 3136, 1024, 1024]
    - [0, 8.847]
  - - [3264, 832, 1, 1024, 3264, 3264, 1024, 1024]
    - [0, 8.821]
  - - [3392, 832, 1, 1024, 3392, 3392, 1024, 1024]
    - [0, 8.869]
  - - [3520, 832, 1, 1024, 3520, 3520, 1024, 1024]
    - [0, 8.869]
  - - [3648, 832, 1, 1024, 3648, 3648, 1024, 1024]
    - [0, 8.825]
  - - [3776, 832, 1, 1024, 3776, 3776, 1024, 1024]
    - [0, 8.859]
  - - [3904, 832, 1, 1024, 3904, 3904, 1024, 1024]
    - [0, 8.898]
  - - [4032, 832, 1, 1024, 4032, 4032, 1024, 1024]
    - [0, 8.921]
  - - [64, 960, 1, 1024, 64, 64, 1024, 1024]
    - [0, 7.031]
  - - [192, 960, 1, 1024, 192, 192, 1024, 1024]
    - [0, 7.46]
  - - [320, 960, 1, 1024, 320, 320, 1024, 1024]
    - [0, 8.215]
  - - [448, 960, 1, 1024, 448, 448, 1024, 1024]
    - [0, 8.435]
  - - [576, 960, 1, 1024, 576, 576, 1024, 1024]
    - [0, 8.556]
  - - [704, 960, 1, 1024, 704, 704, 1024, 1024]
    - [0, 8.627]
  - - [832, 960, 1, 1024, 832, 832, 1024, 1024]
    - [0, 8.692]
  - - [960, 960, 1, 1024, 960, 960, 1024, 1024]
    - [0, 8.745]
  - - [1088, 960, 1, 1024, 1088, 1088, 1024, 1024]
    - [0, 8.475]
  - - [1216, 960, 1, 1024, 1216, 1216, 1024, 1024]
    - [0, 8.791]
  - - [1344, 960, 1, 1024, 1344, 1344, 1024, 1024]
    - [0, 8.84]
  - - [1472, 960, 1, 1024, 1472, 1472, 1024, 1024]
    - [0, 8.861]
  - - [1600, 960, 1, 1024, 1600, 1600, 1024, 1024]
    - [0, 8.736]
  - - [1728, 960, 1, 1024, 1728, 1728, 1024, 1024]
    - [0, 8.738]
  - - [1856, 960, 1, 1024, 1856, 1856, 1024, 1024]
    - [0, 8.765]
  - - [1984, 960, 1, 1024, 1984, 1984, 1024, 1024]
    - [0, 8.779]
  - - [2112, 960, 1, 1024, 2112, 2112, 1024, 1024]
    - [0, 8.79]
  - - [2240, 960, 1, 1024, 2240, 2240, 1024, 1024]
    - [0, 8.812]
  - - [2368, 960, 1, 1024, 2368, 2368, 1024, 1024]
    - [0, 8.821]
  - - [2496, 960, 1, 1024, 2496, 2496, 1024, 1024]
    - [0, 8.836]
  - - [2624, 960, 1, 1024, 2624, 2624, 1024, 1024]
    - [0, 8.842]
  - - [2752, 960, 1, 1024, 2752, 2752, 1024, 1024]
    - [0, 8.857]
  - - [2880, 960, 1, 1024, 2880, 2880, 1024, 1024]
    - [0, 8.821]
  - - [3008, 960, 1, 1024, 3008, 3008, 1024, 1024]
    - [0, 8.857]
  - - [3136, 960, 1, 1024, 3136, 3136, 1024, 1024]
    - [0, 8.87]
  - - [3264, 960, 1, 1024, 3264, 3264, 1024, 1024]
    - [0, 8.877]
  - - [3392, 960, 1, 1024, 3392, 3392, 1024, 1024]
    - [0, 8.871]
  - - [3520, 960, 1, 1024, 3520, 3520, 1024, 1024]
    - [0, 8.898]
  - - [3648, 960, 1, 1024, 3648, 3648, 1024, 1024]
    - [0, 8.959]
  - - [3776, 960, 1, 1024, 3776, 3776, 1024, 1024]
    - [0, 8.892]
  - - [3904, 960, 1, 1024, 3904, 3904, 1024, 1024]
    - [0, 8.907]
  - - [4032, 960, 1, 1024, 4032, 4032, 1024, 1024]
    - [0, 8.897]
  - - [64, 1088, 1, 1024, 64, 64, 1024, 1024]
    - [0, 5.728]
  - - [192, 1088, 1, 1024, 192, 192, 1024, 1024]
    - [0, 7.691]
  - - [320, 1088, 1, 1024, 320, 320, 1024, 1024]
    - [0, 7.898]
  - - [448, 1088, 1, 1024, 448, 448, 1024, 1024]
    - [0, 8.444]
  - - [576, 1088, 1, 1024, 576, 576, 1024, 1024]
    - [0, 8.402]
  - - [704, 1088, 1, 1024, 704, 704, 1024, 1024]
    - [0, 8.66]
  - - [832, 1088, 1, 1024, 832, 832, 1024, 1024]
    - [0, 8.606]
  - - [960, 1088, 1, 1024, 960, 960, 1024, 1024]
    - [0, 8.769]
  - - [1088, 1088, 1, 1024, 1088, 1088, 1024, 1024]
    - [0, 8.612]
  - - [1216, 1088, 1, 1024, 1216, 1216, 1024, 1024]
    - [0, 8.835]
  - - [1344, 1088, 1, 1024, 1344, 1344, 1024, 1024]
    - [0, 8.655]
  - - [1472, 1088, 1, 1024, 1472, 1472, 1024, 1024]
    - [0, 8.722]
  - - [1600, 1088, 1, 1024, 1600, 1600, 1024, 1024]
    - [0, 8.72]
  - - [1728, 1088, 1, 1024, 1728, 1728, 1024, 1024]
    - [0, 8.704]
  - - [1856, 1088, 1, 1024, 1856, 1856, 1024, 1024]
    - [0, 8.772]
  - - [1984, 1088, 1, 1024, 1984, 1984, 1024, 1024]
    - [0, 8.755]
  - - [2112, 1088, 1, 1024, 2112, 2112, 1024, 1024]
    - [0, 8.821]
  - - [2240, 1088, 1, 1024, 2240, 2240, 1024, 1024]
    - [0, 8.786]
  - - [2368, 1088, 1, 1024, 2368, 2368, 1024, 1024]
    - [0, 8.831]
  - - [2496, 1088, 1, 1024, 2496, 2496, 1024, 1024]
    - [0, 8.836]
  - - [2624, 1088, 1, 1024, 2624, 2624, 1024, 1024]
    - [0, 8.871]
  - - [2752, 1088, 1, 1024, 2752, 2752, 1024, 1024]
    - [0, 8.862]
  - - [2880, 1088, 1, 1024, 2880, 2880, 1024, 1024]
    - [0, 8.927]
  - - [3008, 1088, 1, 1024, 3008, 3008, 1024, 1024]
    - [0, 8.865]
  - - [3136, 1088, 1, 1024, 3136, 3136, 1024, 1024]
    - [0, 8.828]
  - - [3264, 1088, 1, 1024, 3264, 3264, 1024, 1024]
    - [0, 8.883]
  - - [3392, 1088, 1, 1024, 3392, 3392, 1024, 1024]
    - [0, 8.88]
  - - [3520, 1088, 1, 1024, 3520, 3520, 1024, 1024]
    - [0, 8.872]
  - - [3648, 1088, 1, 1024, 3648, 3648, 1024, 1024]
    - [0, 8.941]
  - - [3776, 1088, 1, 1024, 3776, 3776, 1024, 1024]
    - [0, 8.913]
  - - [3904, 1088, 1, 1024, 3904, 3904, 1024, 1024]
    - [0, 8.94]
  - - [4032, 1088, 1, 1024, 4032, 4032, 1024, 1024]
    - [0, 8.906]
  - - [64, 1216, 1, 1024, 64, 64, 1024, 1024]
    - [0, 6.385]
  - - [192, 1216, 1, 1024, 192, 192, 1024, 1024]
    - [0, 7.644]
  - - [320, 1216, 1, 1024, 320, 320, 1024, 1024]
    - [0, 8.177]
  - - [448, 1216, 1, 1024, 448, 448, 1024, 1024]
    - [0, 8.43]
  - - [576, 1216, 1, 1024, 576, 576, 1024, 1024]
    - [0, 8.593]
  - - [704, 1216, 1, 1024, 704, 704, 1024, 1024]
    - [0, 8.687]
  - - [832, 1216, 1, 1024, 832, 832, 1024, 1024]
    - [0, 8.762]
  - - [960, 1216, 1, 1024, 960, 960, 1024, 1024]
    - [0, 8.804]
  - - [1088, 1216, 1, 1024, 1088, 1088, 1024, 1024]
    - [0, 8.761]
  - - [1216, 1216, 1, 1024, 1216, 1216, 1024, 1024]
    - [0, 8.614]
  - - [1344, 1216, 1, 1024, 1344, 1344, 1024, 1024]
    - [0, 8.785]
  - - [1472, 1216, 1, 1024, 1472, 1472, 1024, 1024]
    - [0, 8.685]
  - - [1600, 1216, 1, 1024, 1600, 1600, 1024, 1024]
    - [0, 8.803]
  - - [1728, 1216, 1, 1024, 1728, 1728, 1024, 1024]
    - [0, 8.764]
  - - [1856, 1216, 1, 1024, 1856, 1856, 1024, 1024]
    - [0, 8.8]
  - - [1984, 1216, 1, 1024, 1984, 1984, 1024, 1024]
    - [0, 8.802]
  - - [2112, 1216, 1, 1024, 2112, 2112, 1024, 1024]
    - [0, 8.816]
  - - [2240, 1216, 1, 1024, 2240, 2240, 1024, 1024]
    - [0, 8.857]
  - - [2368, 1216, 1, 1024, 2368, 2368, 1024, 1024]
    - [0, 8.806]
  - - [2496, 1216, 1, 1024, 2496, 2496, 1024, 1024]
    - [0, 8.892]
  - - [2624, 1216, 1, 1024, 2624, 2624, 1024, 1024]
    - [0, 8.887]
  - - [2752, 1216, 1, 1024, 2752, 2752, 1024, 1024]
    - [0, 8.925]
  - - [2880, 1216, 1, 1024, 2880, 2880, 1024, 1024]
    - [0, 8.886]
  - - [3008, 1216, 1, 1024, 3008, 3008, 1024, 1024]
    - [0, 8.879]
  - - [3136, 1216, 1, 1024, 3136, 3136, 1024, 1024]
    - [0, 8.871]
  - - [3264, 1216, 1, 1024, 3264, 3264, 1024, 1024]
    - [0, 8.929]
  - - [3392, 1216, 1, 1024, 3392, 3392, 1024, 1024]
    - [0, 8.907]
  - - [3520, 1216, 1, 1024, 3520, 3520, 1024, 1024]
    - [0, 8.93]
  - - [3648, 1216, 1, 1024, 3648, 3648, 1024, 1024]
    - [0, 8.915]
  - - [3776, 1216, 1, 1024, 3776, 3776, 1024, 1024]
    - [0, 8.918]
  - - [3904, 1216, 1, 1024, 3904, 3904, 1024, 1024]
    - [0, 8.88]
  - - [4032, 1216, 1, 1024, 4032, 4032, 1024, 1024]
    - [0, 8.939]
  - - [64, 1344, 1, 1024, 64, 64, 1024, 1024]
    - [0, 5.977]
  - - [192, 1344, 1, 1024, 192, 192, 1024, 1024]
    - [0, 7.611]
  - - [320, 1344, 1, 1024, 320, 320, 1024, 1024]
    - [0, 8.427]
  - - [448, 1344, 1, 1024, 448, 448, 1024, 1024]
    - [0, 8.449]
  - - [576, 1344, 1, 1024, 576, 576, 1024, 1024]
    - [0, 8.463]
  - - [704, 1344, 1, 1024, 704, 704, 1024, 1024]
    - [0, 8.702]
  - - [832, 1344, 1, 1024, 832, 832, 1024, 1024]
    - [0, 8.684]
  - - [960, 1344, 1, 1024, 960, 960, 1024, 1024]
    - [0, 8.809]
  - - [1088, 1344, 1, 1024, 1088, 1088, 1024, 1024]
    - [0, 8.659]
  - - [1216, 1344, 1, 1024, 1216, 1216, 1024, 1024]
    - [0, 8.772]
  - - [1344, 1344, 1, 1024, 1344, 1344, 1024, 1024]
    - [0, 8.747]
  - - [1472, 1344, 1, 1024, 1472, 1472, 1024, 1024]
    - [0, 8.758]
  - - [1600, 1344, 1, 1024, 1600, 1600, 1024, 1024]
    - [0, 8.815]
  - - [1728, 1344, 1, 1024, 1728, 1728, 1024, 1024]
    - [0, 8.816]
  - - [1856, 1344, 1, 1024, 1856, 1856, 1024, 1024]
    - [0, 8.785]
  - - [1984, 1344, 1, 1024, 1984, 1984, 1024, 1024]
    - [0, 8.843]
  - - [2112, 1344, 1, 1024, 2112, 2112, 1024, 1024]
    - [0, 8.905]
  - - [2240, 1344, 1, 1024, 2240, 2240, 1024, 1024]
    - [0, 8.883]
  - - [2368, 1344, 1, 1024, 2368, 2368, 1024, 1024]
    - [0, 8.907]
  - - [2496, 1344, 1, 1024, 2496, 2496, 1024, 1024]
    - [0, 8.867]
  - - [2624, 1344, 1, 1024, 2624, 2624, 1024, 1024]
    - [0, 8.903]
  - - [2752, 1344, 1, 1024, 2752, 2752, 1024, 1024]
    - [0, 8.875]
  - - [2880, 1344, 1, 1024, 2880, 2880, 1024, 1024]
    - [0, 8.905]
  - - [3008, 1344, 1, 1024, 3008, 3008, 1024, 1024]
    - [0, 8.909]
  - - [3136, 1344, 1, 1024, 3136, 3136, 1024, 1024]
    - [0, 8.929]
  - - [3264, 1344, 1, 1024, 3264, 3264, 1024, 1024]
    - [0, 8.952]
  - - [3392, 1344, 1, 1024, 3392, 3392, 1024, 1024]
    - [0, 8.894]
  - - [3520, 1344, 1, 1024, 3520, 3520, 1024, 1024]
    - [0, 8.886]
  - - [3648, 1344, 1, 1024, 3648, 3648, 1024, 1024]
    - [0, 8.999]
  - - [3776, 1344, 1, 1024, 3776, 3776, 1024, 1024]
    - [0, 8.921]
  - - [3904, 1344, 1, 1024, 3904, 3904, 1024, 1024]
    - [0, 8.944]
  - - [4032, 1344, 1, 1024, 4032, 4032, 1024, 1024]
    - [0, 9.034]
  - - [64, 1472, 1, 1024, 64, 64, 1024, 1024]
    - [0, 6.095]
  - - [192, 1472, 1, 1024, 192, 192, 1024, 1024]
    - [0, 7.58]
  - - [320, 1472, 1, 1024, 320, 320, 1024, 1024]
    - [0, 8.175]
  - - [448, 1472, 1, 1024, 448, 448, 1024, 1024]
    - [0, 8.452]
  - - [576, 1472, 1, 1024, 576, 576, 1024, 1024]
    - [0, 8.616]
  - - [704, 1472, 1, 1024, 704, 704, 1024, 1024]
    - [0, 8.404]
  - - [832, 1472, 1, 1024, 832, 832, 1024, 1024]
    - [0, 8.787]
  - - [960, 1472, 1, 1024, 960, 960, 1024, 1024]
    - [0, 8.842]
  - - [1088, 1472, 1, 1024, 1088, 1088, 1024, 1024]
    - [0, 8.548]
  - - [1216, 1472, 1, 1024, 1216, 1216, 1024, 1024]
    - [0, 8.735]
  - - [1344, 1472, 1, 1024, 1344, 1344, 1024, 1024]
    - [0, 8.744]
  - - [1472, 1472, 1, 1024, 1472, 1472, 1024, 1024]
    - [0, 8.793]
  - - [1600, 1472, 1, 1024, 1600, 1600, 1024, 1024]
    - [0, 8.802]
  - - [1728, 1472, 1, 1024, 1728, 1728, 1024, 1024]
    - [0, 8.848]
  - - [1856, 1472, 1, 1024, 1856, 1856, 1024, 1024]
    - [0, 8.843]
  - - [1984, 1472, 1, 1024, 1984, 1984, 1024, 1024]
    - [0, 8.934]
  - - [2112, 1472, 1, 1024, 2112, 2112, 1024, 1024]
    - [0, 8.902]
  - - [2240, 1472, 1, 1024, 2240, 2240, 1024, 1024]
    - [0, 8.846]
  - - [2368, 1472, 1, 1024, 2368, 2368, 1024, 1024]
    - [0, 8.921]
  - - [2496, 1472, 1, 1024, 2496, 2496, 1024, 1024]
    - [0, 8.893]
  - - [2624, 1472, 1, 1024, 2624, 2624, 1024, 1024]
    - [0, 8.896]
  - - [2752, 1472, 1, 1024, 2752, 2752, 1024, 1024]
    - [0, 8.922]
  - - [2880, 1472, 1, 1024, 2880, 2880, 1024, 1024]
    - [0, 9.001]
  - - [3008, 1472, 1, 1024, 3008, 3008, 1024, 1024]
    - [0, 8.939]
  - - [3136, 1472, 1, 1024, 3136, 3136, 1024, 1024]
    - [0, 8.924]
  - - [3264, 1472, 1, 1024, 3264, 3264, 1024, 1024]
    - [0, 8.933]
  - - [3392, 1472, 1, 1024, 3392, 3392, 1024, 1024]
    - [0, 8.973]
  - - [3520, 1472, 1, 1024, 3520, 3520, 1024, 1024]
    - [0, 8.947]
  - - [3648, 1472, 1, 1024, 3648, 3648, 1024, 1024]
    - [0, 8.959]
  - - [3776, 1472, 1, 1024, 3776, 3776, 1024, 1024]
    - [0, 8.947]
  - - [3904, 1472, 1, 1024, 3904, 3904, 1024, 1024]
    - [0, 8.962]
  - - [4032, 1472, 1, 1024, 4032, 4032, 1024, 1024]
    - [0, 8.937]
  - - [64, 1600, 1, 1024, 64, 64, 1024, 1024]
    - [0, 5.783]
  - - [192, 1600, 1, 1024, 192, 192, 1024, 1024]
    - [0, 8.222]
  - - [320, 1600, 1, 1024, 320, 320, 1024, 1024]
    - [0, 8.373]
  - - [448, 1600, 1, 1024, 448, 448, 1024, 1024]
    - [0, 8.459]
  - - [576, 1600, 1, 1024, 576, 576, 1024, 1024]
    - [0, 8.753]
  - - [704, 1600, 1, 1024, 704, 704, 1024, 1024]
    - [0, 8.724]
  - - [832, 1600, 1, 1024, 832, 832, 1024, 1024]
    - [0, 8.736]
  - - [960, 1600, 1, 1024, 960, 960, 1024, 1024]
    - [0, 8.734]
  - - [1088, 1600, 1, 1024, 1088, 1088, 1024, 1024]
    - [0, 8.74]
  - - [1216, 1600, 1, 1024, 1216, 1216, 1024, 1024]
    - [0, 8.728]
  - - [1344, 1600, 1, 1024, 1344, 1344, 1024, 1024]
    - [0, 8.799]
  - - [1472, 1600, 1, 1024, 1472, 1472, 1024, 1024]
    - [0, 8.824]
  - - [1600, 1600, 1, 1024, 1600, 1600, 1024, 1024]
    - [0, 8.798]
  - - [1728, 1600, 1, 1024, 1728, 1728, 1024, 1024]
    - [0, 8.87]
  - - [1856, 1600, 1, 1024, 1856, 1856, 1024, 1024]
    - [0, 8.853]
  - - [1984, 1600, 1, 1024, 1984, 1984, 1024, 1024]
    - [0, 8.902]
  - - [2112, 1600, 1, 1024, 2112, 2112, 1024, 1024]
    - [0, 8.966]
  - - [2240, 1600, 1, 1024, 2240, 2240, 1024, 1024]
    - [0, 8.883]
  - - [2368, 1600, 1, 1024, 2368, 2368, 1024, 1024]
    - [0, 8.87]
  - - [2496, 1600, 1, 1024, 2496, 2496, 1024, 1024]
    - [0, 8.842]
  - - [2624, 1600, 1, 1024, 2624, 2624, 1024, 1024]
    - [0, 8.965]
  - - [2752, 1600, 1, 1024, 2752, 2752, 1024, 1024]
    - [0, 8.935]
  - - [2880, 1600, 1, 1024, 2880, 2880, 1024, 1024]
    - [0, 8.923]
  - - [3008, 1600, 1, 1024, 3008, 3008, 1024, 1024]
    - [0, 8.971]
  - - [3136, 1600, 1, 1024, 3136, 3136, 1024, 1024]
    - [0, 8.955]
  - - [3264, 1600, 1, 1024, 3264, 3264, 1024, 1024]
    - [0, 9.034]
  - - [3392, 1600, 1, 1024, 3392, 3392, 1024, 1024]
    - [0, 8.946]
  - - [3520, 1600, 1, 1024, 3520, 3520, 1024, 1024]
    - [0, 8.95]
  - - [3648, 1600, 1, 1024, 3648, 3648, 1024, 1024]
    - [0, 8.949]
  - - [3776, 1600, 1, 1024, 3776, 3776, 1024, 1024]
    - [0, 9.015]
  - - [3904, 1600, 1, 1024, 3904, 3904, 1024, 1024]
    - [0, 8.945]
  - - [4032, 1600, 1, 1024, 4032, 4032, 1024, 1024]
    - [0, 9.001]
  - - [64, 1728, 1, 1024, 64, 64, 1024, 1024]
    - [3, 5.295]
  - - [192, 1728, 1, 1024, 192, 192, 1024, 1024]
    - [0, 8.131]
  - - [320, 1728, 1, 1024, 320, 320, 1024, 1024]
    - [0, 8.555]
  - - [448, 1728, 1, 1024, 448, 448, 1024, 1024]
    - [0, 8.47]
  - - [576, 1728, 1, 1024, 576, 576, 1024, 1024]
    - [0, 8.635]
  - - [704, 1728, 1, 1024, 704, 704, 1024, 1024]
    - [0, 8.743]
  - - [832, 1728, 1, 1024, 832, 832, 1024, 1024]
    - [0, 8.665]
  - - [960, 1728, 1, 1024, 960, 960, 1024, 1024]
    - [0, 8.75]
  - - [1088, 1728, 1, 1024, 1088, 1088, 1024, 1024]
    - [0, 8.824]
  - - [1216, 1728, 1, 1024, 1216, 1216, 1024, 1024]
    - [0, 8.755]
  - - [1344, 1728, 1, 1024, 1344, 1344, 1024, 1024]
    - [0, 8.816]
  - - [1472, 1728, 1, 1024, 1472, 1472, 1024, 1024]
    - [0, 8.819]
  - - [1600, 1728, 1, 1024, 1600, 1600, 1024, 1024]
    - [0, 8.747]
  - - [1728, 1728, 1, 1024, 1728, 1728, 1024, 1024]
    - [0, 8.759]
  - - [1856, 1728, 1, 1024, 1856, 1856, 1024, 1024]
    - [0, 8.848]
  - - [1984, 1728, 1, 1024, 1984, 1984, 1024, 1024]
    - [0, 8.898]
  - - [2112, 1728, 1, 1024, 2112, 2112, 1024, 1024]
    - [0, 8.92]
  - - [2240, 1728, 1, 1024, 2240, 2240, 1024, 1024]
    - [0, 8.92]
  - - [2368, 1728, 1, 1024, 2368, 2368, 1024, 1024]
    - [0, 8.943]
  - - [2496, 1728, 1, 1024, 2496, 2496, 1024, 1024]
    - [0, 8.913]
  - - [2624, 1728, 1, 1024, 2624, 2624, 1024, 1024]
    - [0, 8.904]
  - - [2752, 1728, 1, 1024, 2752, 2752, 1024, 1024]
    - [0, 8.932]
  - - [2880, 1728, 1, 1024, 2880, 2880, 1024, 1024]
    - [0, 9.004]
  - - [3008, 1728, 1, 1024, 3008, 3008, 1024, 1024]
    - [0, 8.941]
  - - [3136, 1728, 1, 1024, 3136, 3136, 1024, 1024]
    - [0, 8.981]
  - - [3264, 1728, 1, 1024, 3264, 3264, 1024, 1024]
    - [0, 8.956]
  - - [3392, 1728, 1, 1024, 3392, 3392, 1024, 1024]
    - [0, 8.952]
  - - [3520, 1728, 1, 1024, 3520, 3520, 1024, 1024]
    - [0, 8.952]
  - - [3648, 1728, 1, 1024, 3648, 3648, 1024, 1024]
    - [0, 9.013]
  - - [3776, 1728, 1, 1024, 3776, 3776, 1024, 1024]
    - [0, 8.981]
  - - [3904, 1728, 1, 1024, 3904, 3904, 1024, 1024]
    - [0, 9.008]
  - - [4032, 1728, 1, 1024, 4032, 4032, 1024, 1024]
    - [0, 9.016]
  - - [64, 1856, 1, 1024, 64, 64, 1024, 1024]
    - [0, 6.409]
  - - [192, 1856, 1, 1024, 192, 192, 1024, 1024]
    - [0, 8.074]
  - - [320, 1856, 1, 1024, 320, 320, 1024, 1024]
    - [0, 8.342]
  - - [448, 1856, 1, 1024, 448, 448, 1024, 1024]
    - [0, 8.502]
  - - [576, 1856, 1, 1024, 576, 576, 1024, 1024]
    - [0, 8.739]
  - - [704, 1856, 1, 1024, 704, 704, 1024, 1024]
    - [0, 8.761]
  - - [832, 1856, 1, 1024, 832, 832, 1024, 1024]
    - [0, 8.645]
  - - [960, 1856, 1, 1024, 960, 960, 1024, 1024]
    - [0, 8.765]
  - - [1088, 1856, 1, 1024, 1088, 1088, 1024, 1024]
    - [0, 8.793]
  - - [1216, 1856, 1, 1024, 1216, 1216, 1024, 1024]
    - [0, 8.817]
  - - [1344, 1856, 1, 1024, 1344, 1344, 1024, 1024]
    - [0, 8.839]
  - - [1472, 1856, 1, 1024, 1472, 1472, 1024, 1024]
    - [0, 8.858]
  - - [1600, 1856, 1, 1024, 1600, 1600, 1024, 1024]
    - [0, 8.861]
  - - [1728, 1856, 1, 1024, 1728, 1728, 1024, 1024]
    - [0, 8.92]
  - - [1856, 1856, 1, 1024, 1856, 1856, 1024, 1024]
    - [0, 8.96]
  - - [1984, 1856, 1, 1024, 1984, 1984, 1024, 1024]
    - [0, 8.88]
  - - [2112, 1856, 1, 1024, 2112, 2112, 1024, 1024]
    - [0, 8.954]
  - - [2240, 1856, 1, 1024, 2240, 2240, 1024, 1024]
    - [0, 8.905]
  - - [2368, 1856, 1, 1024, 2368, 2368, 1024, 1024]
    - [0, 8.921]
  - - [2496, 1856, 1, 1024, 2496, 2496, 1024, 1024]
    - [0, 8.918]
  - - [2624, 1856, 1, 1024, 2624, 2624, 1024, 1024]
    - [0, 8.887]
  - - [2752, 1856, 1, 1024, 2752, 2752, 1024, 1024]
    - [0, 8.915]
  - - [2880, 1856, 1, 1024, 2880, 2880, 1024, 1024]
    - [0, 8.923]
  - - [3008, 1856, 1, 1024, 3008, 3008, 1024, 1024]
    - [0, 9.026]
  - - [3136, 1856, 1, 1024, 3136, 3136, 1024, 1024]
    - [0, 8.955]
  - - [3264, 1856, 1, 1024, 3264, 3264, 1024, 1024]
    - [0, 8.942]
  - - [3392, 1856, 1, 1024, 3392, 3392, 1024, 1024]
    - [0, 8.959]
  - - [3520, 1856, 1, 1024, 3520, 3520, 1024, 1024]
    - [0, 8.977]
  - - [3648, 1856, 1, 1024, 3648, 3648, 1024, 1024]
    - [0, 8.965]
  - - [3776, 1856, 1, 1024, 3776, 3776, 1024, 1024]
    - [0, 8.96]
  - - [3904, 1856, 1, 1024, 3904, 3904, 1024, 1024]
    - [0, 8.997]
  - - [4032, 1856, 1, 1024, 4032, 4032, 1024, 1024]
    - [0, 9.015]
  - - [64, 1984, 1, 1024, 64, 64, 1024, 1024]
    - [0, 5.388]
  - - [192, 1984, 1, 1024, 192, 192, 1024, 1024]
    - [0, 8.017]
  - - [320, 1984, 1, 1024, 320, 320, 1024, 1024]
    - [0, 8.501]
  - - [448, 1984, 1, 1024, 448, 448, 1024, 1024]
    - [0, 8.717]
  - - [576, 1984, 1, 1024, 576, 576, 1024, 1024]
    - [0, 8.651]
  - - [704, 1984, 1, 1024, 704, 704, 1024, 1024]
    - [0, 8.76]
  - - [832, 1984, 1, 1024, 832, 832, 1024, 1024]
    - [0, 8.734]
  - - [960, 1984, 1, 1024, 960, 960, 1024, 1024]
    - [0, 8.781]
  - - [1088, 1984, 1, 1024, 1088, 1088, 1024, 1024]
    - [0, 8.801]
  - - [1216, 1984, 1, 1024, 1216, 1216, 1024, 1024]
    - [0, 8.787]
  - - [1344, 1984, 1, 1024, 1344, 1344, 1024, 1024]
    - [0, 8.823]
  - - [1472, 1984, 1, 1024, 1472, 1472, 1024, 1024]
    - [0, 8.826]
  - - [1600, 1984, 1, 1024, 1600, 1600, 1024, 1024]
    - [0, 8.843]
  - - [1728, 1984, 1, 1024, 1728, 1728, 1024, 1024]
    - [0, 8.871]
  - - [1856, 1984, 1, 1024, 1856, 1856, 1024, 1024]
    - [0, 8.918]
  - - [1984, 1984, 1, 1024, 1984, 1984, 1024, 1024]
    - [0, 8.858]
  - - [2112, 1984, 1, 1024, 2112, 2112, 1024, 1024]
    - [0, 8.897]
  - - [2240, 1984, 1, 1024, 2240, 2240, 1024, 1024]
    - [0, 8.923]
  - - [2368, 1984, 1, 1024, 2368, 2368, 1024, 1024]
    - [0, 8.977]
  - - [2496, 1984, 1, 1024, 2496, 2496, 1024, 1024]
    - [0, 8.954]
  - - [2624, 1984, 1, 1024, 2624, 2624, 1024, 1024]
    - [0, 8.931]
  - - [2752, 1984, 1, 1024, 2752, 2752, 1024, 1024]
    - [0, 8.985]
  - - [2880, 1984, 1, 1024, 2880, 2880, 1024, 1024]
    - [0, 8.952]
  - - [3008, 1984, 1, 1024, 3008, 3008, 1024, 1024]
    - [0, 8.941]
  - - [3136, 1984, 1, 1024, 3136, 3136, 1024, 1024]
    - [0, 9.002]
  - - [3264, 1984, 1, 1024, 3264, 3264, 1024, 1024]
    - [0, 8.956]
  - - [3392, 1984, 1, 1024, 3392, 3392, 1024, 1024]
    - [0, 7.184]
  - - [3520, 1984, 1, 1024, 3520, 3520, 1024, 1024]
    - [0, 9.021]
  - - [3648, 1984, 1, 1024, 3648, 3648, 1024, 1024]
    - [0, 8.968]
  - - [3776, 1984, 1, 1024, 3776, 3776, 1024, 1024]
    - [0, 8.97]
  - - [3904, 1984, 1, 1024, 3904, 3904, 1024, 1024]
    - [0, 9.029]
  - - [4032, 1984, 1, 1024, 4032, 4032, 1024, 1024]
    - [0, 9.013]
  - - [64, 2112, 1, 1024, 64, 64, 1024, 1024]
    - [0, 7.117]
  - - [192, 2112, 1, 1024, 192, 192, 1024, 1024]
    - [0, 7.992]
  - - [320, 2112, 1, 1024, 320, 320, 1024, 1024]
    - [0, 8.645]
  - - [448, 2112, 1, 1024, 448, 448, 1024, 1024]
    - [0, 8.706]
  - - [576, 2112, 1, 1024, 576, 576, 1024, 1024]
    - [0, 8.762]
  - - [704, 2112, 1, 1024, 704, 704, 1024, 1024]
    - [0, 8.65]
  - - [832, 2112, 1, 1024, 832, 832, 1024, 1024]
    - [0, 8.681]
  - - [960, 2112, 1, 1024, 960, 960, 1024, 1024]
    - [0, 8.79]
  - - [1088, 2112, 1, 1024, 1088, 1088, 1024, 1024]
    - [0, 8.836]
  - - [1216, 2112, 1, 1024, 1216, 1216, 1024, 1024]
    - [0, 8.837]
  - - [1344, 2112, 1, 1024, 1344, 1344, 1024, 1024]
    - [0, 8.899]
  - - [1472, 2112, 1, 1024, 1472, 1472, 1024, 1024]
    - [0, 8.849]
  - - [1600, 2112, 1, 1024, 1600, 1600, 1024, 1024]
    - [0, 8.894]
  - - [1728, 2112, 1, 1024, 1728, 1728, 1024, 1024]
    - [0, 8.904]
  - - [1856, 2112, 1, 1024, 1856, 1856, 1024, 1024]
    - [0, 8.884]
  - - [1984, 2112, 1, 1024, 1984, 1984, 1024, 1024]
    - [0, 8.901]
  - - [2112, 2112, 1, 1024, 2112, 2112, 1024, 1024]
    - [0, 8.925]
  - - [2240, 2112, 1, 1024, 2240, 2240, 1024, 1024]
    - [0, 8.932]
  - - [2368, 2112, 1, 1024, 2368, 2368, 1024, 1024]
    - [0, 8.983]
  - - [2496, 2112, 1, 1024, 2496, 2496, 1024, 1024]
    - [0, 8.933]
  - - [2624, 2112, 1, 1024, 2624, 2624, 1024, 1024]
    - [0, 8.934]
  - - [2752, 2112, 1, 1024, 2752, 2752, 1024, 1024]
    - [0, 8.918]
  - - [2880, 2112, 1, 1024, 2880, 2880, 1024, 1024]
    - [0, 8.995]
  - - [3008, 2112, 1, 1024, 3008, 3008, 1024, 1024]
    - [0, 8.979]
  - - [3136, 2112, 1, 1024, 3136, 3136, 1024, 1024]
    - [0, 8.977]
  - - [3264, 2112, 1, 1024, 3264, 3264, 1024, 1024]
    - [0, 8.957]
  - - [3392, 2112, 1, 1024, 3392, 3392, 1024, 1024]
    - [0, 8.968]
  - - [3520, 2112, 1, 1024, 3520, 3520, 1024, 1024]
    - [0, 9.057]
  - - [3648, 2112, 1, 1024, 3648, 3648, 1024, 1024]
    - [0, 9.008]
  - - [3776, 2112, 1, 1024, 3776, 3776, 1024, 1024]
    - [0, 9.035]
  - - [3904, 2112, 1, 1024, 3904, 3904, 1024, 1024]
    - [0, 8.982]
  - - [4032, 2112, 1, 1024, 4032, 4032, 1024, 1024]
    - [0, 9.024]
  - - [64, 2240, 1, 1024, 64, 64, 1024, 1024]
    - [0, 7.52]
  - - [192, 2240, 1, 1024, 192, 192, 1024, 1024]
    - [0, 8.427]
  - - [320, 2240, 1, 1024, 320, 320, 1024, 1024]
    - [0, 8.467]
  - - [448, 2240, 1, 1024, 448, 448, 1024, 1024]
    - [0, 8.68]
  - - [576, 2240, 1, 1024, 576, 576, 1024, 1024]
    - [0, 8.808]
  - - [704, 2240, 1, 1024, 704, 704, 1024, 1024]
    - [0, 8.673]
  - - [832, 2240, 1, 1024, 832, 832, 1024, 1024]
    - [0, 8.755]
  - - [960, 2240, 1, 1024, 960, 960, 1024, 1024]
    - [0, 8.812]
  - - [1088, 2240, 1, 1024, 1088, 1088, 1024, 1024]
    - [0, 8.799]
  - - [1216, 2240, 1, 1024, 1216, 1216, 1024, 1024]
    - [0, 8.897]
  - - [1344, 2240, 1, 1024, 1344, 1344, 1024, 1024]
    - [0, 8.85]
  - - [1472, 2240, 1, 1024, 1472, 1472, 1024, 1024]
    - [0, 8.9]
  - - [1600, 2240, 1, 1024, 1600, 1600, 1024, 1024]
    - [0, 8.902]
  - - [1728, 2240, 1, 1024, 1728, 1728, 1024, 1024]
    - [0, 8.868]
  - - [1856, 2240, 1, 1024, 1856, 1856, 1024, 1024]
    - [0, 8.805]
  - - [1984, 2240, 1, 1024, 1984, 1984, 1024, 1024]
    - [0, 8.93]
  - - [2112, 2240, 1, 1024, 2112, 2112, 1024, 1024]
    - [0, 8.952]
  - - [2240, 2240, 1, 1024, 2240, 2240, 1024, 1024]
    - [0, 8.912]
  - - [2368, 2240, 1, 1024, 2368, 2368, 1024, 1024]
    - [0, 8.966]
  - - [2496, 2240, 1, 1024, 2496, 2496, 1024, 1024]
    - [0, 8.929]
  - - [2624, 2240, 1, 1024, 2624, 2624, 1024, 1024]
    - [0, 8.996]
  - - [2752, 2240, 1, 1024, 2752, 2752, 1024, 1024]
    - [0, 8.984]
  - - [2880, 2240, 1, 1024, 2880, 2880, 1024, 1024]
    - [0, 8.963]
  - - [3008, 2240, 1, 1024, 3008, 3008, 1024, 1024]
    - [0, 8.985]
  - - [3136, 2240, 1, 1024, 3136, 3136, 1024, 1024]
    - [0, 9.002]
  - - [3264, 2240, 1, 1024, 3264, 3264, 1024, 1024]
    - [0, 8.982]
  - - [3392, 2240, 1, 1024, 3392, 3392, 1024, 1024]
    - [0, 8.96]
  - - [3520, 2240, 1, 1024, 3520, 3520, 1024, 1024]
    - [0, 9.044]
  - - [3648, 2240, 1, 1024, 3648, 3648, 1024, 1024]
    - [0, 9.056]
  - - [3776, 2240, 1, 1024, 3776, 3776, 1024, 1024]
    - [0, 8.993]
  - - [3904, 2240, 1, 1024, 3904, 3904, 1024, 1024]
    - [0, 8.994]
  - - [4032, 2240, 1, 1024, 4032, 4032, 1024, 1024]
    - [0, 9.058]
  - - [64, 2368, 1, 1024, 64, 64, 1024, 1024]
    - [0, 6.284]
  - - [192, 2368, 1, 1024, 192, 192, 1024, 1024]
    - [0, 8.366]
  - - [320, 2368, 1, 1024, 320, 320, 1024, 1024]
    - [0, 8.588]
  - - [448, 2368, 1, 1024, 448, 448, 1024, 1024]
    - [0, 8.694]
  - - [576, 2368, 1, 1024, 576, 576, 1024, 1024]
    - [0, 8.767]
  - - [704, 2368, 1, 1024, 704, 704, 1024, 1024]
    - [0, 8.623]
  - - [832, 2368, 1, 1024, 832, 832, 1024, 1024]
    - [0, 8.748]
  - - [960, 2368, 1, 1024, 960, 960, 1024, 1024]
    - [0, 8.829]
  - - [1088, 2368, 1, 1024, 1088, 1088, 1024, 1024]
    - [0, 8.833]
  - - [1216, 2368, 1, 1024, 1216, 1216, 1024, 1024]
    - [0, 8.801]
  - - [1344, 2368, 1, 1024, 1344, 1344, 1024, 1024]
    - [0, 8.902]
  - - [1472, 2368, 1, 1024, 1472, 1472, 1024, 1024]
    - [0, 8.868]
  - - [1600, 2368, 1, 1024, 1600, 1600, 1024, 1024]
    - [0, 8.89]
  - - [1728, 2368, 1, 1024, 1728, 1728, 1024, 1024]
    - [0, 8.88]
  - - [1856, 2368, 1, 1024, 1856, 1856, 1024, 1024]
    - [0, 8.908]
  - - [1984, 2368, 1, 1024, 1984, 1984, 1024, 1024]
    - [0, 8.936]
  - - [2112, 2368, 1, 1024, 2112, 2112, 1024, 1024]
    - [0, 8.883]
  - - [2240, 2368, 1, 1024, 2240, 2240, 1024, 1024]
    - [0, 8.963]
  - - [2368, 2368, 1, 1024, 2368, 2368, 1024, 1024]
    - [0, 8.945]
  - - [2496, 2368, 1, 1024, 2496, 2496, 1024, 1024]
    - [0, 8.935]
  - - [2624, 2368, 1, 1024, 2624, 2624, 1024, 1024]
    - [0, 8.936]
  - - [2752, 2368, 1, 1024, 2752, 2752, 1024, 1024]
    - [0, 8.994]
  - - [2880, 2368, 1, 1024, 2880, 2880, 1024, 1024]
    - [0, 8.314]
  - - [3008, 2368, 1, 1024, 3008, 3008, 1024, 1024]
    - [0, 8.978]
  - - [3136, 2368, 1, 1024, 3136, 3136, 1024, 1024]
    - [0, 8.979]
  - - [3264, 2368, 1, 1024, 3264, 3264, 1024, 1024]
    - [0, 9.02]
  - - [3392, 2368, 1, 1024, 3392, 3392, 1024, 1024]
    - [0, 9.026]
  - - [3520, 2368, 1, 1024, 3520, 3520, 1024, 1024]
    - [0, 9.07]
  - - [3648, 2368, 1, 1024, 3648, 3648, 1024, 1024]
    - [0, 8.994]
  - - [3776, 2368, 1, 1024, 3776, 3776, 1024, 1024]
    - [0, 9.026]
  - - [3904, 2368, 1, 1024, 3904, 3904, 1024, 1024]
    - [0, 9.033]
  - - [4032, 2368, 1, 1024, 4032, 4032, 1024, 1024]
    - [0, 8.992]
  - - [64, 2496, 1, 1024, 64, 64, 1024, 1024]
    - [0, 6.633]
  - - [192, 2496, 1, 1024, 192, 192, 1024, 1024]
    - [0, 8.312]
  - - [320, 2496, 1, 1024, 320, 320, 1024, 1024]
    - [0, 8.692]
  - - [448, 2496, 1, 1024, 448, 448, 1024, 1024]
    - [0, 8.69]
  - - [576, 2496, 1, 1024, 576, 576, 1024, 1024]
    - [0, 8.718]
  - - [704, 2496, 1, 1024, 704, 704, 1024, 1024]
    - [0, 8.68]
  - - [832, 2496, 1, 1024, 832, 832, 1024, 1024]
    - [0, 8.783]
  - - [960, 2496, 1, 1024, 960, 960, 1024, 1024]
    - [0, 8.862]
  - - [1088, 2496, 1, 1024, 1088, 1088, 1024, 1024]
    - [0, 8.822]
  - - [1216, 2496, 1, 1024, 1216, 1216, 1024, 1024]
    - [0, 8.902]
  - - [1344, 2496, 1, 1024, 1344, 1344, 1024, 1024]
    - [0, 8.919]
  - - [1472, 2496, 1, 1024, 1472, 1472, 1024, 1024]
    - [0, 8.909]
  - - [1600, 2496, 1, 1024, 1600, 1600, 1024, 1024]
    - [0, 8.966]
  - - [1728, 2496, 1, 1024, 1728, 1728, 1024, 1024]
    - [0, 8.942]
  - - [1856, 2496, 1, 1024, 1856, 1856, 1024, 1024]
    - [0, 8.968]
  - - [1984, 2496, 1, 1024, 1984, 1984, 1024, 1024]
    - [0, 8.932]
  - - [2112, 2496, 1, 1024, 2112, 2112, 1024, 1024]
    - [0, 8.992]
  - - [2240, 2496, 1, 1024, 2240, 2240, 1024, 1024]
    - [0, 8.946]
  - - [2368, 2496, 1, 1024, 2368, 2368, 1024, 1024]
    - [0, 8.953]
  - - [2496, 2496, 1, 1024, 2496, 2496, 1024, 1024]
    - [0, 8.993]
  - - [2624, 2496, 1, 1024, 2624, 2624, 1024, 1024]
    - [0, 8.99]
  - - [2752, 2496, 1, 1024, 2752, 2752, 1024, 1024]
    - [0, 9.002]
  - - [2880, 2496, 1, 1024, 2880, 2880, 1024, 1024]
    - [0, 8.999]
  - - [3008, 2496, 1, 1024, 3008, 3008, 1024, 1024]
    - [0, 9.009]
  - - [3136, 2496, 1, 1024, 3136, 3136, 1024, 1024]
    - [0, 8.989]
  - - [3264, 2496, 1, 1024, 3264, 3264, 1024, 1024]
    - [0, 9.01]
  - - [3392, 2496, 1, 1024, 3392, 3392, 1024, 1024]
    - [0, 8.988]
  - - [3520, 2496, 1, 1024, 3520, 3520, 1024, 1024]
    - [0, 8.994]
  - - [3648, 2496, 1, 1024, 3648, 3648, 1024, 1024]
    - [0, 9.038]
  - - [3776, 2496, 1, 1024, 3776, 3776, 1024, 1024]
    - [0, 9.029]
  - - [3904, 2496, 1, 1024, 3904, 3904, 1024, 1024]
    - [0, 9.018]
  - - [4032, 2496, 1, 1024, 4032, 4032, 1024, 1024]
    - [0, 9.102]
  - - [64, 2624, 1, 1024, 64, 64, 1024, 1024]
    - [0, 7.066]
  - - [192, 2624, 1, 1024, 192, 192, 1024, 1024]
    - [0, 8.254]
  - - [320, 2624, 1, 1024, 320, 320, 1024, 1024]
    - [0, 8.546]
  - - [448, 2624, 1, 1024, 448, 448, 1024, 1024]
    - [0, 8.675]
  - - [576, 2624, 1, 1024, 576, 576, 1024, 1024]
    - [0, 8.76]
  - - [704, 2624, 1, 1024, 704, 704, 1024, 1024]
    - [0, 8.798]
  - - [832, 2624, 1, 1024, 832, 832, 1024, 1024]
    - [0, 8.848]
  - - [960, 2624, 1, 1024, 960, 960, 1024, 1024]
    - [0, 8.858]
  - - [1088, 2624, 1, 1024, 1088, 1088, 1024, 1024]
    - [0, 8.86]
  - - [1216, 2624, 1, 1024, 1216, 1216, 1024, 1024]
    - [0, 8.873]
  - - [1344, 2624, 1, 1024, 1344, 1344, 1024, 1024]
    - [0, 8.885]
  - - [1472, 2624, 1, 1024, 1472, 1472, 1024, 1024]
    - [0, 8.905]
  - - [1600, 2624, 1, 1024, 1600, 1600, 1024, 1024]
    - [0, 8.912]
  - - [1728, 2624, 1, 1024, 1728, 1728, 1024, 1024]
    - [0, 8.906]
  - - [1856, 2624, 1, 1024, 1856, 1856, 1024, 1024]
    - [0, 8.883]
  - - [1984, 2624, 1, 1024, 1984, 1984, 1024, 1024]
    - [0, 8.97]
  - - [2112, 2624, 1, 1024, 2112, 2112, 1024, 1024]
    - [0, 8.909]
  - - [2240, 2624, 1, 1024, 2240, 2240, 1024, 1024]
    - [0, 8.961]
  - - [2368, 2624, 1, 1024, 2368, 2368, 1024, 1024]
    - [0, 8.965]
  - - [2496, 2624, 1, 1024, 2496, 2496, 1024, 1024]
    - [0, 8.962]
  - - [2624, 2624, 1, 1024, 2624, 2624, 1024, 1024]
    - [0, 8.994]
  - - [2752, 2624, 1, 1024, 2752, 2752, 1024, 1024]
    - [0, 9.003]
  - - [2880, 2624, 1, 1024, 2880, 2880, 1024, 1024]
    - [0, 9.075]
  - - [3008, 2624, 1, 1024, 3008, 3008, 1024, 1024]
    - [0, 8.975]
  - - [3136, 2624, 1, 1024, 3136, 3136, 1024, 1024]
    - [0, 8.985]
  - - [3264, 2624, 1, 1024, 3264, 3264, 1024, 1024]
    - [0, 8.994]
  - - [3392, 2624, 1, 1024, 3392, 3392, 1024, 1024]
    - [0, 9.002]
  - - [3520, 2624, 1, 1024, 3520, 3520, 1024, 1024]
    - [0, 9.051]
  - - [3648, 2624, 1, 1024, 3648, 3648, 1024, 1024]
    - [0, 9.041]
  - - [3776, 2624, 1, 1024, 3776, 3776, 1024, 1024]
    - [0, 8.995]
  - - [3904, 2624, 1, 1024, 3904, 3904, 1024, 1024]
    - [0, 9.033]
  - - [4032, 2624, 1, 1024, 4032, 4032, 1024, 1024]
    - [0, 9.024]
  - - [64, 2752, 1, 1024, 64, 64, 1024, 1024]
    - [0, 6.189]
  - - [192, 2752, 1, 1024, 192, 192, 1024, 1024]
    - [0, 8.221]
  - - [320, 2752, 1, 1024, 320, 320, 1024, 1024]
    - [0, 8.644]
  - - [448, 2752, 1, 1024, 448, 448, 1024, 1024]
    - [0, 8.751]
  - - [576, 2752, 1, 1024, 576, 576, 1024, 1024]
    - [0, 8.689]
  - - [704, 2752, 1, 1024, 704, 704, 1024, 1024]
    - [0, 8.796]
  - - [832, 2752, 1, 1024, 832, 832, 1024, 1024]
    - [0, 8.804]
  - - [960, 2752, 1, 1024, 960, 960, 1024, 1024]
    - [0, 8.815]
  - - [1088, 2752, 1, 1024, 1088, 1088, 1024, 1024]
    - [0, 8.837]
  - - [1216, 2752, 1, 1024, 1216, 1216, 1024, 1024]
    - [0, 8.893]
  - - [1344, 2752, 1, 1024, 1344, 1344, 1024, 1024]
    - [0, 8.873]
  - - [1472, 2752, 1, 1024, 1472, 1472, 1024, 1024]
    - [0, 8.941]
  - - [1600, 2752, 1, 1024, 1600, 1600, 1024, 1024]
    - [0, 8.936]
  - - [1728, 2752, 1, 1024, 1728, 1728, 1024, 1024]
    - [0, 8.956]
  - - [1856, 2752, 1, 1024, 1856, 1856, 1024, 1024]
    - [0, 8.984]
  - - [1984, 2752, 1, 1024, 1984, 1984, 1024, 1024]
    - [0, 8.927]
  - - [2112, 2752, 1, 1024, 2112, 2112, 1024, 1024]
    - [0, 9.031]
  - - [2240, 2752, 1, 1024, 2240, 2240, 1024, 1024]
    - [0, 8.934]
  - - [2368, 2752, 1, 1024, 2368, 2368, 1024, 1024]
    - [0, 8.987]
  - - [2496, 2752, 1, 1024, 2496, 2496, 1024, 1024]
    - [0, 8.997]
  - - [2624, 2752, 1, 1024, 2624, 2624, 1024, 1024]
    - [0, 9.008]
  - - [2752, 2752, 1, 1024, 2752, 2752, 1024, 1024]
    - [0, 8.995]
  - - [2880, 2752, 1, 1024, 2880, 2880, 1024, 1024]
    - [0, 8.995]
  - - [3008, 2752, 1, 1024, 3008, 3008, 1024, 1024]
    - [0, 8.99]
  - - [3136, 2752, 1, 1024, 3136, 3136, 1024, 1024]
    - [0, 9.006]
  - - [3264, 2752, 1, 1024, 3264, 3264, 1024, 1024]
    - [0, 9.008]
  - - [3392, 2752, 1, 1024, 3392, 3392, 1024, 1024]
    - [0, 8.992]
  - - [3520, 2752, 1, 1024, 3520, 3520, 1024, 1024]
    - [0, 9.032]
  - - [3648, 2752, 1, 1024, 3648, 3648, 1024, 1024]
    - [0, 8.976]
  - - [3776, 2752, 1, 1024, 3776, 3776, 1024, 1024]
    - [0, 9.004]
  - - [3904, 2752, 1, 1024, 3904, 3904, 1024, 1024]
    - [0, 9.035]
  - - [4032, 2752, 1, 1024, 4032, 4032, 1024, 1024]
    - [0, 9.023]
  - - [64, 2880, 1, 1024, 64, 64, 1024, 1024]
    - [0, 6.551]
  - - [192, 2880, 1, 1024, 192, 192, 1024, 1024]
    - [0, 8.552]
  - - [320, 2880, 1, 1024, 320, 320, 1024, 1024]
    - [0, 8.742]
  - - [448, 2880, 1, 1024, 448, 448, 1024, 1024]
    - [0, 8.82]
  - - [576, 2880, 1, 1024, 576, 576, 1024, 1024]
    - [0, 8.751]
  - - [704, 2880, 1, 1024, 704, 704, 1024, 1024]
    - [0, 8.807]
  - - [832, 2880, 1, 1024, 832, 832, 1024, 1024]
    - [0, 8.869]
  - - [960, 2880, 1, 1024, 960, 960, 1024, 1024]
    - [0, 8.862]
  - - [1088, 2880, 1, 1024, 1088, 1088, 1024, 1024]
    - [0, 8.895]
  - - [1216, 2880, 1, 1024, 1216, 1216, 1024, 1024]
    - [0, 8.905]
  - - [1344, 2880, 1, 1024, 1344, 1344, 1024, 1024]
    - [0, 8.897]
  - - [1472, 2880, 1, 1024, 1472, 1472, 1024, 1024]
    - [0, 8.907]
  - - [1600, 2880, 1, 1024, 1600, 1600, 1024, 1024]
    - [0, 8.961]
  - - [1728, 2880, 1, 1024, 1728, 1728, 1024, 1024]
    - [0, 8.931]
  - - [1856, 2880, 1, 1024, 1856, 1856, 1024, 1024]
    - [0, 8.957]
  - - [1984, 2880, 1, 1024, 1984, 1984, 1024, 1024]
    - [0, 8.955]
  - - [2112, 2880, 1, 1024, 2112, 2112, 1024, 1024]
    - [0, 8.958]
  - - [2240, 2880, 1, 1024, 2240, 2240, 1024, 1024]
    - [0, 8.999]
  - - [2368, 2880, 1, 1024, 2368, 2368, 1024, 1024]
    - [0, 8.97]
  - - [2496, 2880, 1, 1024, 2496, 2496, 1024, 1024]
    - [0, 9.041]
  - - [2624, 2880, 1, 1024, 2624, 2624, 1024, 1024]
    - [0, 9.008]
  - - [2752, 2880, 1, 1024, 2752, 2752, 1024, 1024]
    - [0, 9.041]
  - - [2880, 2880, 1, 1024, 2880, 2880, 1024, 1024]
    - [0, 9.007]
  - - [3008, 2880, 1, 1024, 3008, 3008, 1024, 1024]
    - [0, 8.987]
  - - [3136, 2880, 1, 1024, 3136, 3136, 1024, 1024]
    - [0, 8.985]
  - - [3264, 2880, 1, 1024, 3264, 3264, 1024, 1024]
    - [0, 9.046]
  - - [3392, 2880, 1, 1024, 3392, 3392, 1024, 1024]
    - [0, 9.032]
  - - [3520, 2880, 1, 1024, 3520, 3520, 1024, 1024]
    - [0, 9.002]
  - - [3648, 2880, 1, 1024, 3648, 3648, 1024, 1024]
    - [0, 9.023]
  - - [3776, 2880, 1, 1024, 3776, 3776, 1024, 1024]
    - [0, 9.0]
  - - [3904, 2880, 1, 1024, 3904, 3904, 1024, 1024]
    - [0, 9.027]
  - - [4032, 2880, 1, 1024, 4032, 4032, 1024, 1024]
    - [0, 9.019]
  - - [64, 3008, 1, 1024, 64, 64, 1024, 1024]
    - [0, 6.46]
  - - [192, 3008, 1, 1024, 192, 192, 1024, 1024]
    - [0, 8.505]
  - - [320, 3008, 1, 1024, 320, 320, 1024, 1024]
    - [0, 8.607]
  - - [448, 3008, 1, 1024, 448, 448, 1024, 1024]
    - [0, 8.812]
  - - [576, 3008, 1, 1024, 576, 576, 1024, 1024]
    - [0, 8.707]
  - - [704, 3008, 1, 1024, 704, 704, 1024, 1024]
    - [0, 8.801]
  - - [832, 3008, 1, 1024, 832, 832, 1024, 1024]
    - [0, 8.77]
  - - [960, 3008, 1, 1024, 960, 960, 1024, 1024]
    - [0, 8.856]
  - - [1088, 3008, 1, 1024, 1088, 1088, 1024, 1024]
    - [0, 8.87]
  - - [1216, 3008, 1, 1024, 1216, 1216, 1024, 1024]
    - [0, 8.918]
  - - [1344, 3008, 1, 1024, 1344, 1344, 1024, 1024]
    - [0, 8.906]
  - - [1472, 3008, 1, 1024, 1472, 1472, 1024, 1024]
    - [0, 8.948]
  - - [1600, 3008, 1, 1024, 1600, 1600, 1024, 1024]
    - [0, 8.809]
  - - [1728, 3008, 1, 1024, 1728, 1728, 1024, 1024]
    - [0, 8.929]
  - - [1856, 3008, 1, 1024, 1856, 1856, 1024, 1024]
    - [0, 8.907]
  - - [1984, 3008, 1, 1024, 1984, 1984, 1024, 1024]
    - [0, 8.94]
  - - [2112, 3008, 1, 1024, 2112, 2112, 1024, 1024]
    - [0, 8.908]
  - - [2240, 3008, 1, 1024, 2240, 2240, 1024, 1024]
    - [0, 8.95]
  - - [2368, 3008, 1, 1024, 2368, 2368, 1024, 1024]
    - [0, 9.036]
  - - [2496, 3008, 1, 1024, 2496, 2496, 1024, 1024]
    - [0, 8.99]
  - - [2624, 3008, 1, 1024, 2624, 2624, 1024, 1024]
    - [0, 9.058]
  - - [2752, 3008, 1, 1024, 2752, 2752, 1024, 1024]
    - [0, 9.023]
  - - [2880, 3008, 1, 1024, 2880, 2880, 1024, 1024]
    - [0, 8.988]
  - - [3008, 3008, 1, 1024, 3008, 3008, 1024, 1024]
    - [0, 9.084]
  - - [3136, 3008, 1, 1024, 3136, 3136, 1024, 1024]
    - [0, 9.036]
  - - [3264, 3008, 1, 1024, 3264, 3264, 1024, 1024]
    - [0, 9.017]
  - - [3392, 3008, 1, 1024, 3392, 3392, 1024, 1024]
    - [0, 9.061]
  - - [3520, 3008, 1, 1024, 3520, 3520, 1024, 1024]
    - [0, 9.034]
  - - [3648, 3008, 1, 1024, 3648, 3648, 1024, 1024]
    - [0, 9.043]
  - - [3776, 3008, 1, 1024, 3776, 3776, 1024, 1024]
    - [0, 9.03]
  - - [3904, 3008, 1, 1024, 3904, 3904, 1024, 1024]
    - [0, 9.078]
  - - [4032, 3008, 1, 1024, 4032, 4032, 1024, 1024]
    - [0, 9.005]
  - - [64, 3136, 1, 1024, 64, 64, 1024, 1024]
    - [0, 6.525]
  - - [192, 3136, 1, 1024, 192, 192, 1024, 1024]
    - [0, 8.452]
  - - [320, 3136, 1, 1024, 320, 320, 1024, 1024]
    - [0, 8.696]
  - - [448, 3136, 1, 1024, 448, 448, 1024, 1024]
    - [0, 8.805]
  - - [576, 3136, 1, 1024, 576, 576, 1024, 1024]
    - [0, 8.743]
  - - [704, 3136, 1, 1024, 704, 704, 1024, 1024]
    - [0, 8.807]
  - - [832, 3136, 1, 1024, 832, 832, 1024, 1024]
    - [0, 8.841]
  - - [960, 3136, 1, 1024, 960, 960, 1024, 1024]
    - [0, 8.874]
  - - [1088, 3136, 1, 1024, 1088, 1088, 1024, 1024]
    - [0, 8.858]
  - - [1216, 3136, 1, 1024, 1216, 1216, 1024, 1024]
    - [0, 8.894]
  - - [1344, 3136, 1, 1024, 1344, 1344, 1024, 1024]
    - [0, 8.892]
  - - [1472, 3136, 1, 1024, 1472, 1472, 1024, 1024]
    - [0, 8.993]
  - - [1600, 3136, 1, 1024, 1600, 1600, 1024, 1024]
    - [0, 8.917]
  - - [1728, 3136, 1, 1024, 1728, 1728, 1024, 1024]
    - [0, 8.962]
  - - [1856, 3136, 1, 1024, 1856, 1856, 1024, 1024]
    - [0, 9.019]
  - - [1984, 3136, 1, 1024, 1984, 1984, 1024, 1024]
    - [0, 8.965]
  - - [2112, 3136, 1, 1024, 2112, 2112, 1024, 1024]
    - [0, 8.975]
  - - [2240, 3136, 1, 1024, 2240, 2240, 1024, 1024]
    - [0, 8.972]
  - - [2368, 3136, 1, 1024, 2368, 2368, 1024, 1024]
    - [0, 9.011]
  - - [2496, 3136, 1, 1024, 2496, 2496, 1024, 1024]
    - [0, 9.007]
  - - [2624, 3136, 1, 1024, 2624, 2624, 1024, 1024]
    - [0, 9.057]
  - - [2752, 3136, 1, 1024, 2752, 2752, 1024, 1024]
    - [0, 9.001]
  - - [2880, 3136, 1, 1024, 2880, 2880, 1024, 1024]
    - [0, 9.045]
  - - [3008, 3136, 1, 1024, 3008, 3008, 1024, 1024]
    - [0, 9.021]
  - - [3136, 3136, 1, 1024, 3136, 3136, 1024, 1024]
    - [0, 8.99]
  - - [3264, 3136, 1, 1024, 3264, 3264, 1024, 1024]
    - [0, 9.091]
  - - [3392, 3136, 1, 1024, 3392, 3392, 1024, 1024]
    - [0, 9.025]
  - - [3520, 3136, 1, 1024, 3520, 3520, 1024, 1024]
    - [0, 9.035]
  - - [3648, 3136, 1, 1024, 3648, 3648, 1024, 1024]
    - [0, 9.058]
  - - [3776, 3136, 1, 1024, 3776, 3776, 1024, 1024]
    - [0, 9.048]
  - - [3904, 3136, 1, 1024, 3904, 3904, 1024, 1024]
    - [0, 9.039]
  - - [4032, 3136, 1, 1024, 4032, 4032, 1024, 1024]
    - [0, 9.007]
  - - [64, 3264, 1, 1024, 64, 64, 1024, 1024]
    - [0, 6.75]
  - - [192, 3264, 1, 1024, 192, 192, 1024, 1024]
    - [0, 8.399]
  - - [320, 3264, 1, 1024, 320, 320, 1024, 1024]
    - [0, 8.77]
  - - [448, 3264, 1, 1024, 448, 448, 1024, 1024]
    - [0, 8.657]
  - - [576, 3264, 1, 1024, 576, 576, 1024, 1024]
    - [0, 8.725]
  - - [704, 3264, 1, 1024, 704, 704, 1024, 1024]
    - [0, 8.832]
  - - [832, 3264, 1, 1024, 832, 832, 1024, 1024]
    - [0, 8.837]
  - - [960, 3264, 1, 1024, 960, 960, 1024, 1024]
    - [0, 8.919]
  - - [1088, 3264, 1, 1024, 1088, 1088, 1024, 1024]
    - [0, 8.907]
  - - [1216, 3264, 1, 1024, 1216, 1216, 1024, 1024]
    - [0, 8.882]
  - - [1344, 3264, 1, 1024, 1344, 1344, 1024, 1024]
    - [0, 8.899]
  - - [1472, 3264, 1, 1024, 1472, 1472, 1024, 1024]
    - [0, 8.927]
  - - [1600, 3264, 1, 1024, 1600, 1600, 1024, 1024]
    - [0, 8.938]
  - - [1728, 3264, 1, 1024, 1728, 1728, 1024, 1024]
    - [0, 8.967]
  - - [1856, 3264, 1, 1024, 1856, 1856, 1024, 1024]
    - [0, 9.017]
  - - [1984, 3264, 1, 1024, 1984, 1984, 1024, 1024]
    - [0, 8.978]
  - - [2112, 3264, 1, 1024, 2112, 2112, 1024, 1024]
    - [0, 9.038]
  - - [2240, 3264, 1, 1024, 2240, 2240, 1024, 1024]
    - [0, 9.054]
  - - [2368, 3264, 1, 1024, 2368, 2368, 1024, 1024]
    - [0, 9.024]
  - - [2496, 3264, 1, 1024, 2496, 2496, 1024, 1024]
    - [0, 9.009]
  - - [2624, 3264, 1, 1024, 2624, 2624, 1024, 1024]
    - [0, 9.033]
  - - [2752, 3264, 1, 1024, 2752, 2752, 1024, 1024]
    - [0, 9.09]
  - - [2880, 3264, 1, 1024, 2880, 2880, 1024, 1024]
    - [0, 8.975]
  - - [3008, 3264, 1, 1024, 3008, 3008, 1024, 1024]
    - [0, 9.005]
  - - [3136, 3264, 1, 1024, 3136, 3136, 1024, 1024]
    - [0, 8.99]
  - - [3264, 3264, 1, 1024, 3264, 3264, 1024, 1024]
    - [0, 8.987]
  - - [3392, 3264, 1, 1024, 3392, 3392, 1024, 1024]
    - [0, 9.025]
  - - [3520, 3264, 1, 1024, 3520, 3520, 1024, 1024]
    - [0, 9.061]
  - - [3648, 3264, 1, 1024, 3648, 3648, 1024, 1024]
    - [0, 9.007]
  - - [3776, 3264, 1, 1024, 3776, 3776, 1024, 1024]
    - [0, 9.072]
  - - [3904, 3264, 1, 1024, 3904, 3904, 1024, 1024]
    - [0, 9.032]
  - - [4032, 3264, 1, 1024, 4032, 4032, 1024, 1024]
    - [0, 9.027]
  - - [64, 3392, 1, 1024, 64, 64, 1024, 1024]
    - [0, 7.181]
  - - [192, 3392, 1, 1024, 192, 192, 1024, 1024]
    - [0, 8.355]
  - - [320, 3392, 1, 1024, 320, 320, 1024, 1024]
    - [0, 8.665]
  - - [448, 3392, 1, 1024, 448, 448, 1024, 1024]
    - [0, 8.679]
  - - [576, 3392, 1, 1024, 576, 576, 1024, 1024]
    - [0, 8.769]
  - - [704, 3392, 1, 1024, 704, 704, 1024, 1024]
    - [0, 8.852]
  - - [832, 3392, 1, 1024, 832, 832, 1024, 1024]
    - [0, 8.862]
  - - [960, 3392, 1, 1024, 960, 960, 1024, 1024]
    - [0, 8.899]
  - - [1088, 3392, 1, 1024, 1088, 1088, 1024, 1024]
    - [0, 8.887]
  - - [1216, 3392, 1, 1024, 1216, 1216, 1024, 1024]
    - [0, 8.976]
  - - [1344, 3392, 1, 1024, 1344, 1344, 1024, 1024]
    - [0, 8.945]
  - - [1472, 3392, 1, 1024, 1472, 1472, 1024, 1024]
    - [0, 8.944]
  - - [1600, 3392, 1, 1024, 1600, 1600, 1024, 1024]
    - [0, 8.993]
  - - [1728, 3392, 1, 1024, 1728, 1728, 1024, 1024]
    - [0, 8.943]
  - - [1856, 3392, 1, 1024, 1856, 1856, 1024, 1024]
    - [0, 8.989]
  - - [1984, 3392, 1, 1024, 1984, 1984, 1024, 1024]
    - [0, 8.971]
  - - [2112, 3392, 1, 1024, 2112, 2112, 1024, 1024]
    - [0, 9.026]
  - - [2240, 3392, 1, 1024, 2240, 2240, 1024, 1024]
    - [0, 8.994]
  - - [2368, 3392, 1, 1024, 2368, 2368, 1024, 1024]
    - [0, 9.034]
  - - [2496, 3392, 1, 1024, 2496, 2496, 1024, 1024]
    - [0, 9.031]
  - - [2624, 3392, 1, 1024, 2624, 2624, 1024, 1024]
    - [0, 9.072]
  - - [2752, 3392, 1, 1024, 2752, 2752, 1024, 1024]
    - [0, 9.007]
  - - [2880, 3392, 1, 1024, 2880, 2880, 1024, 1024]
    - [0, 9.038]
  - - [3008, 3392, 1, 1024, 3008, 3008, 1024, 1024]
    - [0, 9.0]
  - - [3136, 3392, 1, 1024, 3136, 3136, 1024, 1024]
    - [0, 9.058]
  - - [3264, 3392, 1, 1024, 3264, 3264, 1024, 1024]
    - [0, 8.998]
  - - [3392, 3392, 1, 1024, 3392, 3392, 1024, 1024]
    - [0, 9.064]
  - - [3520, 3392, 1, 1024, 3520, 3520, 1024, 1024]
    - [0, 9.014]
  - - [3648, 3392, 1, 1024, 3648, 3648, 1024, 1024]
    - [0, 9.044]
  - - [3776, 3392, 1, 1024, 3776, 3776, 1024, 1024]
    - [0, 9.041]
  - - [3904, 3392, 1, 1024, 3904, 3904, 1024, 1024]
    - [0, 9.058]
  - - [4032, 3392, 1, 1024, 4032, 4032, 1024, 1024]
    - [0, 9.037]
  - - [64, 3520, 1, 1024, 64, 64, 1024, 1024]
    - [0, 6.409]
  - - [192, 3520, 1, 1024, 192, 192, 1024, 1024]
    - [0, 8.635]
  - - [320, 3520, 1, 1024, 320, 320, 1024, 1024]
    - [0, 8.724]
  - - [448, 3520, 1, 1024, 448, 448, 1024, 1024]
    - [0, 8.666]
  - - [576, 3520, 1, 1024, 576, 576, 1024, 1024]
    - [0, 8.782]
  - - [704, 3520, 1, 1024, 704, 704, 1024, 1024]
    - [0, 8.819]
  - - [832, 3520, 1, 1024, 832, 832, 1024, 1024]
    - [0, 8.859]
  - - [960, 3520, 1, 1024, 960, 960, 1024, 1024]
    - [0, 8.868]
  - - [1088, 3520, 1, 1024, 1088, 1088, 1024, 1024]
    - [0, 8.902]
  - - [1216, 3520, 1, 1024, 1216, 1216, 1024, 1024]
    - [0, 8.968]
  - - [1344, 3520, 1, 1024, 1344, 1344, 1024, 1024]
    - [0, 8.886]
  - - [1472, 3520, 1, 1024, 1472, 1472, 1024, 1024]
    - [0, 8.92]
  - - [1600, 3520, 1, 1024, 1600, 1600, 1024, 1024]
    - [0, 8.928]
  - - [1728, 3520, 1, 1024, 1728, 1728, 1024, 1024]
    - [0, 8.979]
  - - [1856, 3520, 1, 1024, 1856, 1856, 1024, 1024]
    - [0, 8.958]
