library/src/amd_detail/rocblaslt/src/Tensile/Logic/asm_full/navi32/GridBased/navi32_Cijk_Alik_Bljk_HHS_BH_Bias_AuxH_HAS_SAV_UserArgs.yaml
- {MinimumRequiredVersion: 4.33.0}
- navi32
- gfx1101
- [Device 73f0]
    SolutionIndex: 0
    SolutionNameMin: Cijk_Alik_Bljk_HHS_BH_Bias_AuxH_HAS_SAV_UserArgs_MT32x32x32_MI16x16x1_SN_LDSB0_GRVWA8_GRVWB8_GSU1_LBSPPA128_LBSPPB128_MIWT1_1_SS0_SU32_SUM0_SUS256_TLDS1_WG32_4_1_WGM8
    SolutionIndex: 1
    SolutionNameMin: Cijk_Alik_Bljk_HHS_BH_Bias_AuxH_HAS_SAV_UserArgs_MT32x32x32_MI16x16x1_SN_LDSB0_GRVWA1_GRVWB8_GSU1_LBSPPA1024_LBSPPB1024_MIWT1_1_SS0_SU32_SUM0_SUS256_TLDS0_WG32_4_1_WGM8
    SolutionIndex: 2
    SolutionNameMin: Cijk_Alik_Bljk_HHS_BH_Bias_AuxH_HAS_SAV_UserArgs_MT32x32x32_MI16x16x1_SN_LDSB0_GRVWA1_GRVWB8_GSU1_LBSPPA128_LBSPPB128_MIWT1_1_SS0_SU32_SUM0_SUS256_TLDS1_WG32_4_1_WGM8
    SolutionIndex: 3
    SolutionNameMin: Cijk_Alik_Bljk_HHS_BH_Bias_AuxH_HAS_SAV_UserArgs_MT32x32x32_MI16x16x1_SN_LDSB0_GRVWA8_GRVWB1_GSU1_LBSPPA128_LBSPPB128_MIWT1_1_SS0_SU32_SUM0_SUS256_TLDS1_WG32_4_1_WGM8
    SolutionIndex: 4
    SolutionNameMin: Cijk_Alik_Bljk_HHS_BH_Bias_AuxH_HAS_SAV_UserArgs_MT32x32x32_MI16x16x1_SN_LDSB0_GRVWA1_GRVWB1_GSU1_LBSPPA128_LBSPPB128_MIWT1_1_SS0_SU32_SUM0_SUS256_TLDS1_WG32_4_1_WGM8
    SolutionIndex: 5
    SolutionNameMin: Cijk_Alik_Bljk_HHS_BH_Bias_AuxH_HAS_SAV_UserArgs_MT32x32x32_MI16x16x1_SN_LDSB0_GRVWA8_GRVWB8_GSU4_LBSPPA128_LBSPPB128_MIWT1_1_SS0_SU32_SUM0_SUS256_TLDS1_WG32_4_1_WGM8
    SolutionIndex: 6
    SolutionNameMin: Cijk_Alik_Bljk_HHS_BH_Bias_AuxH_HAS_SAV_UserArgs_MT32x32x32_MI16x16x1_SN_LDSB0_GRVWA1_GRVWB8_GSU4_LBSPPA128_LBSPPB128_MIWT1_1_SS0_SU32_SUM0_SUS256_TLDS1_WG32_4_1_WGM8
    SolutionIndex: 7
    SolutionNameMin: Cijk_Alik_Bljk_HHS_BH_Bias_AuxH_HAS_SAV_UserArgs_MT32x32x32_MI16x16x1_SN_LDSB0_GRVWA8_GRVWB1_GSU4_LBSPPA128_LBSPPB128_MIWT1_1_SS0_SU32_SUM0_SUS256_TLDS1_WG32_4_1_WGM8
    SolutionIndex: 8
    SolutionNameMin: Cijk_Alik_Bljk_HHS_BH_Bias_AuxH_HAS_SAV_UserArgs_MT16x64x32_MI16x16x1_SN_LDSB0_GRVWA4_GRVWB1_GSU1_LBSPPA128_LBSPPB128_MIWT1_1_SS0_SU32_SUM0_SUS256_TLDS1_WG16_8_1_WGM8
    SolutionIndex: 9
    SolutionNameMin: Cijk_Alik_Bljk_HHS_BH_Bias_AuxH_HAS_SAV_UserArgs_MT64x16x64_MI16x16x1_SN_LDSB0_GRVWA1_GRVWB8_GSU1_LBSPPA128_LBSPPB128_MIWT1_1_SS0_SU32_SUM0_SUS256_TLDS1_WG64_2_1_WGM8
    SolutionIndex: 10
    SolutionNameMin: Cijk_Alik_Bljk_HHS_BH_Bias_AuxH_HAS_SAV_UserArgs_MT64x16x32_MI16x16x1_SN_LDSB0_GRVWA8_GRVWB4_GSU1_LBSPPA2048_LBSPPB512_MIWT1_1_SS1_SU32_SUM0_SUS256_TLDS0_WG64_2_1_WGM8
    SolutionIndex: 11
    SolutionNameMin: Cijk_Alik_Bljk_HHS_BH_Bias_AuxH_HAS_SAV_UserArgs_MT64x16x32_MI16x16x1_SN_LDSB0_GRVWA1_GRVWB4_GSU1_LBSPPA128_LBSPPB128_MIWT1_1_SS1_SU32_SUM0_SUS256_TLDS1_WG64_2_1_WGM8
    SolutionIndex: 12
    SolutionNameMin: Cijk_Alik_Bljk_HHS_BH_Bias_AuxH_HAS_SAV_UserArgs_MT64x16x32_MI16x16x1_SN_LDSB0_GRVWA1_GRVWB1_GSU1_LBSPPA128_LBSPPB128_MIWT1_1_SS1_SU32_SUM0_SUS256_TLDS1_WG64_2_1_WGM8
    SolutionIndex: 13
    SolutionNameMin: Cijk_Alik_Bljk_HHS_BH_Bias_AuxH_HAS_SAV_UserArgs_MT256x16x32_MI16x16x1_SN_LDSB1_GRVWA8_GRVWB4_GSU1_LBSPPA8192_LBSPPB512_MIWT4_1_SS1_SU32_SUM0_SUS256_TLDS0_WG64_2_1_WGM8
    SolutionIndex: 14
    SolutionNameMin: Cijk_Alik_Bljk_HHS_BH_Bias_AuxH_HAS_SAV_UserArgs_MT32x32x32_MI16x16x1_SN_LDSB0_GRVWA8_GRVWB8_GSU1_LBSPPA1024_LBSPPB1024_MIWT1_1_SS1_SU32_SUM0_SUS256_TLDS0_WG32_4_1_WGM8
    SolutionIndex: 15
    SolutionNameMin: Cijk_Alik_Bljk_HHS_BH_Bias_AuxH_HAS_SAV_UserArgs_MT32x32x32_MI16x16x1_SN_LDSB0_GRVWA8_GRVWB8_GSU1_LBSPPA128_LBSPPB128_MIWT1_1_SS1_SU32_SUM0_SUS256_TLDS1_WG32_4_1_WGM8
    SolutionIndex: 16
    SolutionNameMin: Cijk_Alik_Bljk_HHS_BH_Bias_AuxH_HAS_SAV_UserArgs_MT32x32x32_MI16x16x1_SN_LDSB0_GRVWA1_GRVWB8_GSU1_LBSPPA1024_LBSPPB1024_MIWT1_1_SS1_SU32_SUM0_SUS256_TLDS0_WG32_4_1_WGM8
    SolutionIndex: 17
    SolutionNameMin: Cijk_Alik_Bljk_HHS_BH_Bias_AuxH_HAS_SAV_UserArgs_MT32x32x32_MI16x16x1_SN_LDSB0_GRVWA1_GRVWB8_GSU1_LBSPPA128_LBSPPB128_MIWT1_1_SS1_SU32_SUM0_SUS256_TLDS1_WG32_4_1_WGM8
    SolutionIndex: 18
    SolutionNameMin: Cijk_Alik_Bljk_HHS_BH_Bias_AuxH_HAS_SAV_UserArgs_MT32x32x32_MI16x16x1_SN_LDSB0_GRVWA8_GRVWB1_GSU1_LBSPPA128_LBSPPB128_MIWT1_1_SS1_SU32_SUM0_SUS256_TLDS1_WG32_4_1_WGM8
    SolutionIndex: 19
    SolutionNameMin: Cijk_Alik_Bljk_HHS_BH_Bias_AuxH_HAS_SAV_UserArgs_MT32x32x32_MI16x16x1_SN_LDSB0_GRVWA1_GRVWB1_GSU1_LBSPPA128_LBSPPB128_MIWT1_1_SS1_SU32_SUM0_SUS256_TLDS1_WG32_4_1_WGM8
    SolutionIndex: 20
    SolutionNameMin: Cijk_Alik_Bljk_HHS_BH_Bias_AuxH_HAS_SAV_UserArgs_MT32x32x32_MI16x16x1_SN_LDSB0_GRVWA8_GRVWB8_GSU4_LBSPPA128_LBSPPB128_MIWT1_1_SS1_SU32_SUM0_SUS256_TLDS1_WG32_4_1_WGM8
    SolutionIndex: 21
    SolutionNameMin: Cijk_Alik_Bljk_HHS_BH_Bias_AuxH_HAS_SAV_UserArgs_MT32x32x32_MI16x16x1_SN_LDSB0_GRVWA1_GRVWB8_GSU4_LBSPPA128_LBSPPB128_MIWT1_1_SS1_SU32_SUM0_SUS256_TLDS1_WG32_4_1_WGM8
    SolutionIndex: 22
    SolutionNameMin: Cijk_Alik_Bljk_HHS_BH_Bias_AuxH_HAS_SAV_UserArgs_MT64x32x32_MI16x16x1_SN_LDSB0_GRVWA8_GRVWB8_GSU1_LBSPPA2048_LBSPPB1024_MIWT2_1_SS1_SU32_SUM0_SUS256_TLDS0_WG32_4_1_WGM8
    SolutionIndex: 23
    SolutionNameMin: Cijk_Alik_Bljk_HHS_BH_Bias_AuxH_HAS_SAV_UserArgs_MT64x32x32_MI16x16x1_SN_LDSB0_GRVWA1_GRVWB8_GSU1_LBSPPA128_LBSPPB128_MIWT2_1_SS1_SU32_SUM0_SUS256_TLDS1_WG32_4_1_WGM8
    SolutionIndex: 24
    SolutionNameMin: Cijk_Alik_Bljk_HHS_BH_Bias_AuxH_HAS_SAV_UserArgs_MT64x32x32_MI16x16x1_SN_LDSB0_GRVWA1_GRVWB1_GSU1_LBSPPA128_LBSPPB128_MIWT2_1_SS1_SU32_SUM0_SUS256_TLDS1_WG32_4_1_WGM8
    SolutionIndex: 25
    SolutionNameMin: Cijk_Alik_Bljk_HHS_BH_Bias_AuxH_HAS_SAV_UserArgs_MT96x32x32_MI16x16x1_SN_LDSB0_GRVWA8_GRVWB8_GSU1_LBSPPA128_LBSPPB128_MIWT3_1_SS1_SU32_SUM0_SUS256_TLDS1_WG32_4_1_WGM8
    SolutionIndex: 26
    SolutionNameMin: Cijk_Alik_Bljk_HHS_BH_Bias_AuxH_HAS_SAV_UserArgs_MT96x32x32_MI16x16x1_SN_LDSB0_GRVWA8_GRVWB1_GSU1_LBSPPA128_LBSPPB128_MIWT3_1_SS1_SU32_SUM0_SUS256_TLDS1_WG32_4_1_WGM8
    SolutionIndex: 27
    SolutionNameMin: Cijk_Alik_Bljk_HHS_BH_Bias_AuxH_HAS_SAV_UserArgs_MT96x32x32_MI16x16x1_SN_LDSB0_GRVWA8_GRVWB8_GSU4_LBSPPA128_LBSPPB128_MIWT3_1_SS1_SU32_SUM0_SUS256_TLDS1_WG32_4_1_WGM8
    SolutionIndex: 28
    SolutionNameMin: Cijk_Alik_Bljk_HHS_BH_Bias_AuxH_HAS_SAV_UserArgs_MT160x32x32_MI16x16x1_SN_LDSB0_GRVWA8_GRVWB8_GSU1_LBSPPA128_LBSPPB128_MIWT5_1_SS1_SU32_SUM0_SUS256_TLDS1_WG32_4_1_WGM8
    SolutionIndex: 29
    SolutionNameMin: Cijk_Alik_Bljk_HHS_BH_Bias_AuxH_HAS_SAV_UserArgs_MT224x32x32_MI16x16x1_SN_LDSB1_GRVWA8_GRVWB8_GSU1_LBSPPA128_LBSPPB128_MIWT7_1_SS1_SU32_SUM0_SUS256_TLDS1_WG32_4_1_WGM8
    SolutionIndex: 30
    SolutionNameMin: Cijk_Alik_Bljk_HHS_BH_Bias_AuxH_HAS_SAV_UserArgs_MT224x32x32_MI16x16x1_SN_LDSB1_GRVWA8_GRVWB1_GSU1_LBSPPA128_LBSPPB128_MIWT7_1_SS1_SU32_SUM0_SUS256_TLDS1_WG32_4_1_WGM8
    SolutionIndex: 31
    SolutionNameMin: Cijk_Alik_Bljk_HHS_BH_Bias_AuxH_HAS_SAV_UserArgs_MT64x48x32_MI16x16x1_SN_LDSB0_GRVWA1_GRVWB4_GSU1_LBSPPA128_LBSPPB128_MIWT1_3_SS1_SU32_SUM0_SUS256_TLDS1_WG64_2_1_WGM8
    SolutionIndex: 32
    SolutionNameMin: Cijk_Alik_Bljk_HHS_BH_Bias_AuxH_HAS_SAV_UserArgs_MT64x48x32_MI16x16x1_SN_LDSB0_GRVWA1_GRVWB1_GSU1_LBSPPA128_LBSPPB128_MIWT1_3_SS1_SU32_SUM0_SUS256_TLDS1_WG64_2_1_WGM8
    SolutionIndex: 33
    SolutionNameMin: Cijk_Alik_Bljk_HHS_BH_Bias_AuxH_HAS_SAV_UserArgs_MT128x48x32_MI16x16x1_SN_LDSB0_GRVWA8_GRVWB4_GSU1_LBSPPA4096_LBSPPB1536_MIWT2_3_SS1_SU32_SUM0_SUS256_TLDS0_WG64_2_1_WGM8
    SolutionIndex: 34
    SolutionNameMin: Cijk_Alik_Bljk_HHS_BH_Bias_AuxH_HAS_SAV_UserArgs_MT128x48x32_MI16x16x1_SN_LDSB0_GRVWA1_GRVWB1_GSU1_LBSPPA128_LBSPPB128_MIWT2_3_SS1_SU32_SUM0_SUS256_TLDS1_WG64_2_1_WGM8
    SolutionIndex: 35
    SolutionNameMin: Cijk_Alik_Bljk_HHS_BH_Bias_AuxH_HAS_SAV_UserArgs_MT16x64x32_MI16x16x1_SN_LDSB0_GRVWA4_GRVWB8_GSU1_LBSPPA512_LBSPPB2048_MIWT1_1_SS1_SU32_SUM0_SUS256_TLDS0_WG16_8_1_WGM8
    SolutionIndex: 36
    SolutionNameMin: Cijk_Alik_Bljk_HHS_BH_Bias_AuxH_HAS_SAV_UserArgs_MT16x64x32_MI16x16x1_SN_LDSB0_GRVWA4_GRVWB1_GSU1_LBSPPA128_LBSPPB128_MIWT1_1_SS1_SU32_SUM0_SUS256_TLDS1_WG16_8_1_WGM8
    SolutionIndex: 37
    SolutionNameMin: Cijk_Alik_Bljk_HHS_BH_Bias_AuxH_HAS_SAV_UserArgs_MT32x64x32_MI16x16x1_SN_LDSB0_GRVWA8_GRVWB8_GSU1_LBSPPA1024_LBSPPB2048_MIWT2_1_SS1_SU32_SUM0_SUS256_TLDS0_WG16_8_1_WGM8
    SolutionIndex: 38
    SolutionNameMin: Cijk_Alik_Bljk_HHS_BH_Bias_AuxH_HAS_SAV_UserArgs_MT32x64x32_MI16x16x1_SN_LDSB0_GRVWA8_GRVWB1_GSU1_LBSPPA128_LBSPPB128_MIWT2_1_SS1_SU32_SUM0_SUS256_TLDS1_WG16_8_1_WGM8
    SolutionIndex: 39
    SolutionNameMin: Cijk_Alik_Bljk_HHS_BH_Bias_AuxH_HAS_SAV_UserArgs_MT32x64x32_MI16x16x1_SN_LDSB0_GRVWA1_GRVWB1_GSU1_LBSPPA128_LBSPPB128_MIWT2_1_SS1_SU32_SUM0_SUS256_TLDS1_WG16_8_1_WGM8
    SolutionIndex: 40
    SolutionNameMin: Cijk_Alik_Bljk_HHS_BH_Bias_AuxH_HAS_SAV_UserArgs_MT48x64x32_MI16x16x1_SN_LDSB0_GRVWA4_GRVWB1_GSU4_LBSPPA128_LBSPPB128_MIWT3_1_SS1_SU32_SUM0_SUS256_TLDS1_WG16_8_1_WGM8
    SolutionIndex: 41
    SolutionNameMin: Cijk_Alik_Bljk_HHS_BH_Bias_AuxH_HAS_SAV_UserArgs_MT80x64x32_MI16x16x1_SN_LDSB0_GRVWA4_GRVWB1_GSU1_LBSPPA128_LBSPPB128_MIWT5_1_SS1_SU32_SUM0_SUS256_TLDS1_WG16_8_1_WGM8
    SolutionIndex: 42
    SolutionNameMin: Cijk_Alik_Bljk_HHS_BH_Bias_AuxH_HAS_SAV_UserArgs_MT96x64x32_MI16x16x1_SN_LDSB0_GRVWA8_GRVWB1_GSU1_LBSPPA128_LBSPPB128_MIWT6_1_SS1_SU32_SUM0_SUS256_TLDS1_WG16_8_1_WGM8
    SolutionIndex: 43
    SolutionNameMin: Cijk_Alik_Bljk_HHS_BH_Bias_AuxH_HAS_SAV_UserArgs_MT112x64x32_MI16x16x1_SN_LDSB0_GRVWA4_GRVWB1_GSU1_LBSPPA128_LBSPPB128_MIWT7_1_SS1_SU32_SUM0_SUS256_TLDS1_WG16_8_1_WGM8
    SolutionIndex: 44
    SolutionNameMin: Cijk_Alik_Bljk_HHS_BH_Bias_AuxH_HAS_SAV_UserArgs_MT64x80x32_MI16x16x1_SN_LDSB0_GRVWA1_GRVWB4_GSU1_LBSPPA128_LBSPPB128_MIWT1_5_SS1_SU32_SUM0_SUS256_TLDS1_WG64_2_1_WGM8
    SolutionIndex: 45
    SolutionNameMin: Cijk_Alik_Bljk_HHS_BH_Bias_AuxH_HAS_SAV_UserArgs_MT32x96x32_MI16x16x1_SN_LDSB0_GRVWA8_GRVWB8_GSU1_LBSPPA128_LBSPPB128_MIWT1_3_SS1_SU32_SUM0_SUS256_TLDS1_WG32_4_1_WGM8
    SolutionIndex: 46
    SolutionNameMin: Cijk_Alik_Bljk_HHS_BH_Bias_AuxH_HAS_SAV_UserArgs_MT32x96x32_MI16x16x1_SN_LDSB0_GRVWA1_GRVWB8_GSU1_LBSPPA128_LBSPPB128_MIWT1_3_SS1_SU32_SUM0_SUS256_TLDS1_WG32_4_1_WGM8
    SolutionIndex: 47
    SolutionNameMin: Cijk_Alik_Bljk_HHS_BH_Bias_AuxH_HAS_SAV_UserArgs_MT32x96x32_MI16x16x1_SN_LDSB0_GRVWA1_GRVWB8_GSU4_LBSPPA128_LBSPPB128_MIWT1_3_SS1_SU32_SUM0_SUS256_TLDS1_WG32_4_1_WGM8
    SolutionIndex: 48
    SolutionNameMin: Cijk_Alik_Bljk_HHS_BH_Bias_AuxH_HAS_SAV_UserArgs_MT64x96x32_MI16x16x1_SN_LDSB0_GRVWA8_GRVWB8_GSU1_LBSPPA2048_LBSPPB3072_MIWT2_3_SS1_SU32_SUM0_SUS256_TLDS0_WG32_4_1_WGM8
    SolutionIndex: 49
    SolutionNameMin: Cijk_Alik_Bljk_HHS_BH_Bias_AuxH_HAS_SAV_UserArgs_MT64x96x32_MI16x16x1_SN_LDSB0_GRVWA1_GRVWB8_GSU1_LBSPPA128_LBSPPB128_MIWT2_3_SS1_SU32_SUM0_SUS256_TLDS1_WG32_4_1_WGM8
    SolutionIndex: 50
    SolutionNameMin: Cijk_Alik_Bljk_HHS_BH_Bias_AuxH_HAS_SAV_UserArgs_MT64x96x32_MI16x16x1_SN_LDSB0_GRVWA1_GRVWB8_GSU2_LBSPPA128_LBSPPB128_MIWT2_3_SS1_SU32_SUM0_SUS256_TLDS1_WG32_4_1_WGM8
    SolutionIndex: 51
    SolutionNameMin: Cijk_Alik_Bljk_HHS_BH_Bias_AuxH_HAS_SAV_UserArgs_MT64x96x32_MI16x16x1_SN_LDSB0_GRVWA1_GRVWB8_GSU4_LBSPPA128_LBSPPB128_MIWT2_3_SS1_SU32_SUM0_SUS256_TLDS1_WG32_4_1_WGM8
    SolutionIndex: 52
    SolutionNameMin: Cijk_Alik_Bljk_HHS_BH_Bias_AuxH_HAS_SAV_UserArgs_MT64x96x32_MI16x16x1_SN_LDSB0_GRVWA1_GRVWB1_GSU4_LBSPPA128_LBSPPB128_MIWT2_3_SS1_SU32_SUM0_SUS256_TLDS1_WG32_4_1_WGM8
    SolutionIndex: 53
    SolutionNameMin: Cijk_Alik_Bljk_HHS_BH_Bias_AuxH_HAS_SAV_UserArgs_MT96x96x32_MI16x16x1_SN_LDSB0_GRVWA8_GRVWB8_GSU1_LBSPPA128_LBSPPB128_MIWT3_3_SS1_SU32_SUM0_SUS256_TLDS1_WG32_4_1_WGM8
    SolutionIndex: 54
    SolutionNameMin: Cijk_Alik_Bljk_HHS_BH_Bias_AuxH_HAS_SAV_UserArgs_MT96x96x32_MI16x16x1_SN_LDSB0_GRVWA1_GRVWB8_GSU1_LBSPPA128_LBSPPB128_MIWT3_3_SS1_SU32_SUM0_SUS256_TLDS1_WG32_4_1_WGM8
    SolutionIndex: 55
    SolutionNameMin: Cijk_Alik_Bljk_HHS_BH_Bias_AuxH_HAS_SAV_UserArgs_MT96x96x32_MI16x16x1_SN_LDSB0_GRVWA8_GRVWB1_GSU1_LBSPPA128_LBSPPB128_MIWT3_3_SS1_SU32_SUM0_SUS256_TLDS1_WG32_4_1_WGM8
    SolutionIndex: 56
    SolutionNameMin: Cijk_Alik_Bljk_HHS_BH_Bias_AuxH_HAS_SAV_UserArgs_MT96x96x32_MI16x16x1_SN_LDSB0_GRVWA8_GRVWB8_GSU2_LBSPPA128_LBSPPB128_MIWT3_3_SS1_SU32_SUM0_SUS256_TLDS1_WG32_4_1_WGM8
    SolutionIndex: 57
    SolutionNameMin: Cijk_Alik_Bljk_HHS_BH_Bias_AuxH_HAS_SAV_UserArgs_MT96x96x32_MI16x16x1_SN_LDSB0_GRVWA8_GRVWB8_GSU4_LBSPPA128_LBSPPB128_MIWT3_3_SS1_SU32_SUM0_SUS256_TLDS1_WG32_4_1_WGM8
    SolutionIndex: 58
    SolutionNameMin: Cijk_Alik_Bljk_HHS_BH_Bias_AuxH_HAS_SAV_UserArgs_MT64x112x32_MI16x16x1_SN_LDSB0_GRVWA1_GRVWB4_GSU1_LBSPPA128_LBSPPB128_MIWT1_7_SS1_SU32_SUM0_SUS256_TLDS1_WG64_2_1_WGM8
    SolutionIndex: 59
    SolutionNameMin: Cijk_Alik_Bljk_HHS_BH_Bias_AuxH_HAS_SAV_UserArgs_MT48x128x32_MI16x16x1_SN_LDSB0_GRVWA1_GRVWB1_GSU1_LBSPPA128_LBSPPB128_MIWT3_2_SS1_SU32_SUM0_SUS256_TLDS1_WG16_8_1_WGM8
    SolutionIndex: 60
    SolutionNameMin: Cijk_Alik_Bljk_HHS_BH_Bias_AuxH_HAS_SAV_UserArgs_MT32x160x32_MI16x16x1_SN_LDSB0_GRVWA8_GRVWB8_GSU1_LBSPPA128_LBSPPB128_MIWT1_5_SS1_SU32_SUM0_SUS256_TLDS1_WG32_4_1_WGM8
    SolutionIndex: 61
    SolutionNameMin: Cijk_Alik_Bljk_HHS_BH_Bias_AuxH_HAS_SAV_UserArgs_MT32x160x32_MI16x16x1_SN_LDSB0_GRVWA1_GRVWB8_GSU1_LBSPPA128_LBSPPB128_MIWT1_5_SS1_SU32_SUM0_SUS256_TLDS1_WG32_4_1_WGM8
    SolutionIndex: 62
    SolutionNameMin: Cijk_Alik_Bljk_HHS_BH_Bias_AuxH_HAS_SAV_UserArgs_MT64x160x32_MI16x16x1_SN_LDSB1_GRVWA1_GRVWB8_GSU1_LBSPPA128_LBSPPB128_MIWT2_5_SS1_SU32_SUM0_SUS256_TLDS1_WG32_4_1_WGM8
    SolutionIndex: 63
    SolutionNameMin: Cijk_Alik_Bljk_HHS_BH_Bias_AuxH_HAS_SAV_UserArgs_MT64x160x32_MI16x16x1_SN_LDSB1_GRVWA1_GRVWB8_GSU2_LBSPPA128_LBSPPB128_MIWT2_5_SS1_SU32_SUM0_SUS256_TLDS1_WG32_4_1_WGM8
    SolutionIndex: 64
    SolutionNameMin: Cijk_Alik_Bljk_HHS_BH_Bias_AuxH_HAS_SAV_UserArgs_MT64x160x32_MI16x16x1_SN_LDSB1_GRVWA1_GRVWB8_GSU4_LBSPPA128_LBSPPB128_MIWT2_5_SS1_SU32_SUM0_SUS256_TLDS1_WG32_4_1_WGM8
    SolutionIndex: 65
    SolutionNameMin: Cijk_Alik_Bljk_HHS_BH_Bias_AuxH_HAS_SAV_UserArgs_MT64x16x64_MI16x16x1_SN_LDSB0_GRVWA8_GRVWB8_GSU1_LBSPPA2048_LBSPPB512_MIWT1_1_SS1_SU32_SUM0_SUS256_TLDS0_WG64_2_1_WGM8
    SolutionIndex: 66
    SolutionNameMin: Cijk_Alik_Bljk_HHS_BH_Bias_AuxH_HAS_SAV_UserArgs_MT64x16x64_MI16x16x1_SN_LDSB0_GRVWA1_GRVWB8_GSU1_LBSPPA128_LBSPPB128_MIWT1_1_SS1_SU32_SUM0_SUS256_TLDS1_WG64_2_1_WGM8
    SolutionIndex: 67
    SolutionNameMin: Cijk_Alik_Bljk_HHS_BH_Bias_AuxH_HAS_SAV_UserArgs_MT32x32x64_MI16x16x1_SN_LDSB0_GRVWA8_GRVWB8_GSU1_LBSPPA1024_LBSPPB1024_MIWT1_1_SS1_SU32_SUM0_SUS256_TLDS0_WG32_4_1_WGM8
    SolutionIndex: 68
    SolutionNameMin: Cijk_Alik_Bljk_HHS_BH_Bias_AuxH_HAS_SAV_UserArgs_MT32x32x64_MI16x16x1_SN_LDSB0_GRVWA1_GRVWB1_GSU1_LBSPPA128_LBSPPB128_MIWT1_1_SS1_SU32_SUM0_SUS256_TLDS1_WG32_4_1_WGM8
    SolutionIndex: 69
    SolutionNameMin: Cijk_Alik_Bljk_HHS_BH_Bias_AuxH_HAS_SAV_UserArgs_MT64x32x64_MI16x16x1_SN_LDSB0_GRVWA8_GRVWB8_GSU1_LBSPPA2048_LBSPPB1024_MIWT2_1_SS1_SU32_SUM0_SUS256_TLDS0_WG32_4_1_WGM8
    SolutionIndex: 70
    SolutionNameMin: Cijk_Alik_Bljk_HHS_BH_Bias_AuxH_HAS_SAV_UserArgs_MT64x32x64_MI16x16x1_SN_LDSB0_GRVWA1_GRVWB1_GSU4_LBSPPA128_LBSPPB128_MIWT2_1_SS1_SU32_SUM0_SUS256_TLDS1_WG32_4_1_WGM8
    SolutionIndex: 71
    SolutionNameMin: Cijk_Alik_Bljk_HHS_BH_Bias_AuxH_HAS_SAV_UserArgs_MT16x64x64_MI16x16x1_SN_LDSB0_GRVWA8_GRVWB8_GSU1_LBSPPA512_LBSPPB2048_MIWT1_1_SS1_SU32_SUM0_SUS256_TLDS0_WG16_8_1_WGM8
    SolutionIndex: 72
    SolutionNameMin: Cijk_Alik_Bljk_HHS_BH_Bias_AuxH_HAS_SAV_UserArgs_MT16x64x64_MI16x16x1_SN_LDSB0_GRVWA8_GRVWB1_GSU1_LBSPPA128_LBSPPB128_MIWT1_1_SS1_SU32_SUM0_SUS256_TLDS1_WG16_8_1_WGM8
- - - [64, 64, 1, 64, 64, 64, 64, 64]
    - [4, 17.6939]
  - - [192, 64, 1, 64, 192, 192, 64, 64]
    - [3, 52.5866]
  - - [320, 64, 1, 64, 320, 320, 64, 64]
    - [9, 92.1452]
  - - [448, 64, 1, 64, 448, 448, 64, 64]
    - [15, 128.588]
  - - [576, 64, 1, 64, 576, 576, 64, 64]
    - [10, 175.217]
  - - [704, 64, 1, 64, 704, 704, 64, 64]
    - [35, 211.562]
  - - [832, 64, 1, 64, 832, 832, 64, 64]
    - [71, 249.67]
  - - [960, 64, 1, 64, 960, 960, 64, 64]
    - [71, 287.544]
  - - [64, 192, 1, 64, 64, 64, 64, 64]
    - [18, 52.5866]
  - - [192, 192, 1, 64, 192, 192, 64, 64]
    - [36, 176.601]
  - - [320, 192, 1, 64, 320, 320, 64, 64]
    - [67, 292.887]
  - - [448, 192, 1, 64, 448, 448, 64, 64]
    - [71, 401.372]
  - - [576, 192, 1, 64, 576, 576, 64, 64]
    - [71, 507.758]
  - - [704, 192, 1, 64, 704, 704, 64, 64]
    - [12, 614.182]
  - - [832, 192, 1, 64, 832, 832, 64, 64]
    - [18, 719.441]
  - - [960, 192, 1, 64, 960, 960, 64, 64]
    - [15, 824.929]
  - - [64, 320, 1, 64, 64, 64, 64, 64]
    - [71, 89.3196]
  - - [192, 320, 1, 64, 192, 192, 64, 64]
    - [35, 278.482]
  - - [320, 320, 1, 64, 320, 320, 64, 64]
    - [10, 455.586]
  - - [448, 320, 1, 64, 448, 448, 64, 64]
    - [15, 639.844]
  - - [576, 320, 1, 64, 576, 576, 64, 64]
    - [39, 837.848]
  - - [704, 320, 1, 64, 704, 704, 64, 64]
    - [19, 1036.51]
  - - [832, 320, 1, 64, 832, 832, 64, 64]
    - [17, 1136.75]
  - - [960, 320, 1, 64, 960, 960, 64, 64]
    - [23, 1296.5]
  - - [64, 448, 1, 64, 64, 64, 64, 64]
    - [65, 126.334]
  - - [192, 448, 1, 64, 192, 192, 64, 64]
    - [16, 393.371]
  - - [320, 448, 1, 64, 320, 320, 64, 64]
    - [15, 650.251]
  - - [448, 448, 1, 64, 448, 448, 64, 64]
    - [17, 889.27]
  - - [576, 448, 1, 64, 576, 576, 64, 64]
    - [14, 1077.3]
  - - [704, 448, 1, 64, 704, 704, 64, 64]
    - [23, 1326.22]
  - - [832, 448, 1, 64, 832, 832, 64, 64]
    - [39, 1538.05]
  - - [960, 448, 1, 64, 960, 960, 64, 64]
    - [24, 1733.87]
  - - [64, 576, 1, 64, 64, 64, 64, 64]
    - [35, 171.835]
  - - [192, 576, 1, 64, 192, 192, 64, 64]
    - [71, 511.057]
  - - [320, 576, 1, 64, 320, 320, 64, 64]
    - [15, 828.143]
  - - [448, 576, 1, 64, 448, 448, 64, 64]
    - [32, 1128.89]
  - - [576, 576, 1, 64, 576, 576, 64, 64]
    - [31, 1429.92]
  - - [704, 576, 1, 64, 704, 704, 64, 64]
    - [31, 1639.38]
  - - [832, 576, 1, 64, 832, 832, 64, 64]
    - [22, 1947.36]
  - - [960, 576, 1, 64, 960, 960, 64, 64]
    - [49, 2124.85]
  - - [64, 704, 1, 64, 64, 64, 64, 64]
    - [14, 204.51]
  - - [192, 704, 1, 64, 192, 192, 64, 64]
    - [69, 614.4]
  - - [320, 704, 1, 64, 320, 320, 64, 64]
    - [17, 992.628]
  - - [448, 704, 1, 64, 448, 448, 64, 64]
    - [23, 1325.39]
  - - [576, 704, 1, 64, 576, 576, 64, 64]
    - [22, 1637.42]
  - - [704, 704, 1, 64, 704, 704, 64, 64]
    - [22, 1893.75]
  - - [832, 704, 1, 64, 832, 832, 64, 64]
    - [37, 2147.67]
  - - [960, 704, 1, 64, 960, 960, 64, 64]
    - [37, 2447.86]
  - - [64, 832, 1, 64, 64, 64, 64, 64]
    - [11, 241.103]
  - - [192, 832, 1, 64, 192, 192, 64, 64]
    - [35, 735.274]
  - - [320, 832, 1, 64, 320, 320, 64, 64]
    - [17, 1152.48]
  - - [448, 832, 1, 64, 448, 448, 64, 64]
    - [23, 1529.71]
  - - [576, 832, 1, 64, 576, 576, 64, 64]
    - [39, 1885.17]
  - - [704, 832, 1, 64, 704, 704, 64, 64]
    - [22, 2122.14]
  - - [832, 832, 1, 64, 832, 832, 64, 64]
    - [23, 2520.76]
  - - [960, 832, 1, 64, 960, 960, 64, 64]
    - [37, 2769.2]
  - - [64, 960, 1, 64, 64, 64, 64, 64]
    - [71, 279.969]
  - - [192, 960, 1, 64, 192, 192, 64, 64]
    - [18, 832.82]
  - - [320, 960, 1, 64, 320, 320, 64, 64]
    - [24, 1364.43]
  - - [448, 960, 1, 64, 448, 448, 64, 64]
    - [44, 1709.16]
  - - [576, 960, 1, 64, 576, 576, 64, 64]
    - [49, 2110.91]
  - - [704, 960, 1, 64, 704, 704, 64, 64]
    - [49, 2472.42]
  - - [832, 960, 1, 64, 832, 832, 64, 64]
    - [37, 2807.22]
  - - [960, 960, 1, 64, 960, 960, 64, 64]
    - [62, 3230.23]
  - - [64, 64, 1, 256, 64, 64, 256, 256]
    - [0, 67.6959]
  - - [192, 64, 1, 256, 192, 192, 256, 256]
    - [15, 205.268]
  - - [320, 64, 1, 256, 320, 320, 256, 256]
    - [2, 351.635]
  - - [448, 64, 1, 256, 448, 448, 256, 256]
    - [15, 496.451]
  - - [576, 64, 1, 256, 576, 576, 256, 256]
    - [15, 681.656]
  - - [704, 64, 1, 256, 704, 704, 256, 256]
    - [66, 807.19]
  - - [832, 64, 1, 256, 832, 832, 256, 256]
    - [15, 943.356]
  - - [960, 64, 1, 256, 960, 960, 256, 256]
    - [18, 1072.57]
  - - [64, 192, 1, 256, 64, 64, 256, 256]
    - [15, 205.469]
  - - [192, 192, 1, 256, 192, 192, 256, 256]
    - [15, 657.414]
  - - [320, 192, 1, 256, 320, 320, 256, 256]
    - [72, 1070.38]
  - - [448, 192, 1, 256, 448, 448, 256, 256]
    - [68, 1445.84]
  - - [576, 192, 1, 256, 576, 576, 256, 256]
    - [18, 1830.09]
  - - [704, 192, 1, 256, 704, 704, 256, 256]
    - [45, 2104.87]
  - - [832, 192, 1, 256, 832, 832, 256, 256]
    - [45, 2557.58]
  - - [960, 192, 1, 256, 960, 960, 256, 256]
    - [45, 2918.21]
  - - [64, 320, 1, 256, 64, 64, 256, 256]
    - [8, 358.978]
  - - [192, 320, 1, 256, 192, 192, 256, 256]
    - [67, 1070.38]
  - - [320, 320, 1, 256, 320, 320, 256, 256]
    - [23, 1700.63]
  - - [448, 320, 1, 256, 448, 448, 256, 256]
    - [15, 2284.48]
  - - [576, 320, 1, 256, 576, 576, 256, 256]
    - [25, 2890.41]
  - - [704, 320, 1, 256, 704, 704, 256, 256]
    - [23, 3359.94]
  - - [832, 320, 1, 256, 832, 832, 256, 256]
    - [60, 3919.57]
  - - [960, 320, 1, 256, 960, 960, 256, 256]
    - [61, 4397.41]
  - - [64, 448, 1, 256, 64, 64, 256, 256]
    - [15, 502.054]
  - - [192, 448, 1, 256, 192, 192, 256, 256]
    - [17, 1472.52]
  - - [320, 448, 1, 256, 320, 320, 256, 256]
    - [18, 2264.88]
  - - [448, 448, 1, 256, 448, 448, 256, 256]
    - [23, 2937.69]
  - - [576, 448, 1, 256, 576, 576, 256, 256]
    - [25, 3795.7]
  - - [704, 448, 1, 256, 704, 704, 256, 256]
    - [38, 4361.04]
  - - [832, 448, 1, 256, 832, 832, 256, 256]
    - [58, 4848.84]
  - - [960, 448, 1, 256, 960, 960, 256, 256]
    - [28, 5539.93]
  - - [64, 576, 1, 256, 64, 64, 256, 256]
    - [17, 660.914]
  - - [192, 576, 1, 256, 192, 192, 256, 256]
    - [23, 1821.97]
  - - [320, 576, 1, 256, 320, 320, 256, 256]
    - [45, 2835.69]
  - - [448, 576, 1, 256, 448, 448, 256, 256]
    - [45, 3863.4]
  - - [576, 576, 1, 256, 576, 576, 256, 256]
    - [49, 4769.06]
  - - [704, 576, 1, 256, 704, 704, 256, 256]
    - [49, 5385.68]
  - - [832, 576, 1, 256, 832, 832, 256, 256]
    - [49, 6332.05]
  - - [960, 576, 1, 256, 960, 960, 256, 256]
    - [53, 7171.29]
  - - [64, 704, 1, 256, 64, 64, 256, 256]
    - [15, 779.373]
  - - [192, 704, 1, 256, 192, 192, 256, 256]
    - [15, 2183.22]
  - - [320, 704, 1, 256, 320, 320, 256, 256]
    - [38, 3357.98]
  - - [448, 704, 1, 256, 448, 448, 256, 256]
    - [38, 4267.69]
  - - [576, 704, 1, 256, 576, 576, 256, 256]
    - [38, 5171.19]
  - - [704, 704, 1, 256, 704, 704, 256, 256]
    - [59, 5776.49]
  - - [832, 704, 1, 256, 832, 832, 256, 256]
    - [49, 6629.37]
  - - [960, 704, 1, 256, 960, 960, 256, 256]
    - [49, 7904.38]
  - - [64, 832, 1, 256, 64, 64, 256, 256]
    - [18, 949.963]
  - - [192, 832, 1, 256, 192, 192, 256, 256]
    - [25, 2530.68]
  - - [320, 832, 1, 256, 320, 320, 256, 256]
    - [41, 3808.74]
  - - [448, 832, 1, 256, 448, 448, 256, 256]
    - [43, 4807.19]
  - - [576, 832, 1, 256, 576, 576, 256, 256]
    - [42, 5828.33]
  - - [704, 832, 1, 256, 704, 704, 256, 256]
    - [23, 6425.95]
  - - [832, 832, 1, 256, 832, 832, 256, 256]
    - [49, 7348.82]
  - - [960, 832, 1, 256, 960, 960, 256, 256]
    - [53, 9049.65]
  - - [64, 960, 1, 256, 64, 64, 256, 256]
    - [18, 1058.85]
  - - [192, 960, 1, 256, 192, 192, 256, 256]
    - [45, 2916.4]
  - - [320, 960, 1, 256, 320, 320, 256, 256]
    - [49, 4429.48]
  - - [448, 960, 1, 256, 448, 448, 256, 256]
    - [44, 5614.65]
  - - [576, 960, 1, 256, 576, 576, 256, 256]
    - [49, 7169.48]
  - - [704, 960, 1, 256, 704, 704, 256, 256]
    - [49, 8065.97]
  - - [832, 960, 1, 256, 832, 832, 256, 256]
    - [55, 8966.31]
  - - [960, 960, 1, 256, 960, 960, 256, 256]
    - [62, 10298.3]
  - - [64, 64, 1, 512, 64, 64, 512, 512]
    - [0, 132.609]
  - - [192, 64, 1, 512, 192, 192, 512, 512]
    - [15, 375.957]
  - - [320, 64, 1, 512, 320, 320, 512, 512]
    - [17, 671.325]
  - - [448, 64, 1, 512, 448, 448, 512, 512]
    - [15, 954.491]
  - - [576, 64, 1, 512, 576, 576, 512, 512]
    - [15, 1165.84]
  - - [704, 64, 1, 512, 704, 704, 512, 512]
    - [18, 1473.14]
  - - [832, 64, 1, 512, 832, 832, 512, 512]
    - [15, 1737.16]
  - - [960, 64, 1, 512, 960, 960, 512, 512]
    - [15, 1975.4]
  - - [64, 192, 1, 512, 64, 64, 512, 512]
    - [0, 398.319]
  - - [192, 192, 1, 512, 192, 192, 512, 512]
    - [17, 1204.53]
  - - [320, 192, 1, 512, 320, 320, 512, 512]
    - [15, 2011.34]
  - - [448, 192, 1, 512, 448, 448, 512, 512]
    - [15, 2631.7]
  - - [576, 192, 1, 512, 576, 576, 512, 512]
    - [23, 3201.85]
  - - [704, 192, 1, 512, 704, 704, 512, 512]
    - [45, 3756.2]
  - - [832, 192, 1, 512, 832, 832, 512, 512]
    - [45, 4377.37]
  - - [960, 192, 1, 512, 960, 960, 512, 512]
    - [25, 5141.62]
  - - [64, 320, 1, 512, 64, 64, 512, 512]
    - [0, 672.38]
  - - [192, 320, 1, 512, 192, 192, 512, 512]
    - [15, 1952.72]
  - - [320, 320, 1, 512, 320, 320, 512, 512]
    - [23, 2968.03]
  - - [448, 320, 1, 512, 448, 448, 512, 512]
    - [15, 3758.43]
  - - [576, 320, 1, 512, 576, 576, 512, 512]
    - [25, 4977.42]
  - - [704, 320, 1, 512, 704, 704, 512, 512]
    - [46, 5513.81]
  - - [832, 320, 1, 512, 832, 832, 512, 512]
    - [26, 6549.19]
  - - [960, 320, 1, 512, 960, 960, 512, 512]
    - [60, 7470.62]
  - - [64, 448, 1, 512, 64, 64, 512, 512]
    - [15, 958.886]
  - - [192, 448, 1, 512, 192, 192, 512, 512]
    - [15, 2530.39]
  - - [320, 448, 1, 512, 320, 320, 512, 512]
    - [15, 3947.42]
  - - [448, 448, 1, 512, 448, 448, 512, 512]
    - [39, 4977.62]
  - - [576, 448, 1, 512, 576, 576, 512, 512]
    - [45, 6398.25]
  - - [704, 448, 1, 512, 704, 704, 512, 512]
    - [49, 7443.39]
  - - [832, 448, 1, 512, 832, 832, 512, 512]
    - [58, 7835.96]
  - - [960, 448, 1, 512, 960, 960, 512, 512]
    - [53, 9114.47]
  - - [64, 576, 1, 512, 64, 64, 512, 512]
    - [15, 1191.19]
  - - [192, 576, 1, 512, 192, 192, 512, 512]
    - [39, 3152.82]
  - - [320, 576, 1, 512, 320, 320, 512, 512]
    - [45, 4950.13]
  - - [448, 576, 1, 512, 448, 448, 512, 512]
    - [45, 6440.35]
  - - [576, 576, 1, 512, 576, 576, 512, 512]
    - [49, 8166.79]
  - - [704, 576, 1, 512, 704, 704, 512, 512]
    - [49, 8831.43]
  - - [832, 576, 1, 512, 832, 832, 512, 512]
    - [49, 10122.6]
  - - [960, 576, 1, 512, 960, 960, 512, 512]
    - [53, 12307.0]
  - - [64, 704, 1, 512, 64, 64, 512, 512]
    - [15, 1458.24]
  - - [192, 704, 1, 512, 192, 192, 512, 512]
    - [25, 3726.86]
  - - [320, 704, 1, 512, 320, 320, 512, 512]
    - [38, 5416.58]
  - - [448, 704, 1, 512, 448, 448, 512, 512]
    - [34, 6921.89]
  - - [576, 704, 1, 512, 576, 576, 512, 512]
    - [49, 8077.27]
  - - [704, 704, 1, 512, 704, 704, 512, 512]
    - [49, 9630.55]
  - - [832, 704, 1, 512, 832, 832, 512, 512]
    - [49, 10858.0]
  - - [960, 704, 1, 512, 960, 960, 512, 512]
    - [49, 12701.1]
  - - [64, 832, 1, 512, 64, 64, 512, 512]
    - [15, 1753.3]
  - - [192, 832, 1, 512, 192, 192, 512, 512]
    - [25, 4479.13]
  - - [320, 832, 1, 512, 320, 320, 512, 512]
    - [45, 6422.68]
  - - [448, 832, 1, 512, 448, 448, 512, 512]
    - [29, 7728.23]
  - - [576, 832, 1, 512, 576, 576, 512, 512]
    - [34, 9181.34]
  - - [704, 832, 1, 512, 704, 704, 512, 512]
    - [49, 10219.7]
  - - [832, 832, 1, 512, 832, 832, 512, 512]
    - [49, 12171.2]
  - - [960, 832, 1, 512, 960, 960, 512, 512]
    - [53, 14448.3]
  - - [64, 960, 1, 512, 64, 64, 512, 512]
    - [18, 1937.68]
  - - [192, 960, 1, 512, 192, 192, 512, 512]
    - [45, 5199.84]
  - - [320, 960, 1, 512, 320, 320, 512, 512]
    - [49, 7611.43]
  - - [448, 960, 1, 512, 448, 448, 512, 512]
    - [49, 9032.4]
  - - [576, 960, 1, 512, 576, 576, 512, 512]
    - [53, 12114.7]
  - - [704, 960, 1, 512, 704, 704, 512, 512]
    - [49, 12909.6]
  - - [832, 960, 1, 512, 832, 832, 512, 512]
    - [53, 14865.8]
  - - [960, 960, 1, 512, 960, 960, 512, 512]
    - [62, 16102.2]
  - - [64, 64, 1, 1024, 64, 64, 1024, 1024]
    - [7, 245.496]
  - - [192, 64, 1, 1024, 192, 192, 1024, 1024]
    - [6, 735.649]
  - - [320, 64, 1, 1024, 320, 320, 1024, 1024]
    - [15, 1251.32]
  - - [448, 64, 1, 1024, 448, 448, 1024, 1024]
    - [15, 1753.42]
  - - [576, 64, 1, 1024, 576, 576, 1024, 1024]
    - [27, 2004.23]
  - - [704, 64, 1, 1024, 704, 704, 1024, 1024]
    - [15, 2456.14]
  - - [832, 64, 1, 1024, 832, 832, 1024, 1024]
    - [15, 2926.94]
  - - [960, 64, 1, 1024, 960, 960, 1024, 1024]
    - [15, 3407.33]
  - - [64, 192, 1, 1024, 64, 64, 1024, 1024]
    - [5, 735.434]
  - - [192, 192, 1, 1024, 192, 192, 1024, 1024]
    - [47, 2125.55]
  - - [320, 192, 1, 1024, 320, 320, 1024, 1024]
    - [15, 3476.04]
  - - [448, 192, 1, 1024, 448, 448, 1024, 1024]
    - [51, 4357.29]
  - - [576, 192, 1, 1024, 576, 576, 1024, 1024]
    - [57, 5301.91]
  - - [704, 192, 1, 1024, 704, 704, 1024, 1024]
    - [52, 6101.61]
  - - [832, 192, 1, 1024, 832, 832, 1024, 1024]
    - [45, 7196.72]
  - - [960, 192, 1, 1024, 960, 960, 1024, 1024]
    - [25, 8245.86]
  - - [64, 320, 1, 1024, 64, 64, 1024, 1024]
    - [15, 1265.29]
  - - [192, 320, 1, 1024, 192, 192, 1024, 1024]
    - [15, 3447.47]
  - - [320, 320, 1, 1024, 320, 320, 1024, 1024]
    - [64, 4797.0]
  - - [448, 320, 1, 1024, 448, 448, 1024, 1024]
    - [64, 6540.61]
  - - [576, 320, 1, 1024, 576, 576, 1024, 1024]
    - [25, 8247.66]
  - - [704, 320, 1, 1024, 704, 704, 1024, 1024]
    - [64, 9351.09]
  - - [832, 320, 1, 1024, 832, 832, 1024, 1024]
    - [64, 9955.8]
  - - [960, 320, 1, 1024, 960, 960, 1024, 1024]
    - [49, 11447.8]
  - - [64, 448, 1, 1024, 64, 64, 1024, 1024]
    - [15, 1730.68]
  - - [192, 448, 1, 1024, 192, 192, 1024, 1024]
    - [15, 4378.95]
  - - [320, 448, 1, 1024, 320, 320, 1024, 1024]
    - [45, 6388.33]
  - - [448, 448, 1, 1024, 448, 448, 1024, 1024]
    - [64, 8254.02]
  - - [576, 448, 1, 1024, 576, 576, 1024, 1024]
    - [56, 9834.24]
  - - [704, 448, 1, 1024, 704, 704, 1024, 1024]
    - [49, 11657.6]
  - - [832, 448, 1, 1024, 832, 832, 1024, 1024]
    - [56, 12689.1]
  - - [960, 448, 1, 1024, 960, 960, 1024, 1024]
    - [53, 14461.0]
  - - [64, 576, 1, 1024, 64, 64, 1024, 1024]
    - [51, 2127.35]
  - - [192, 576, 1, 1024, 192, 192, 1024, 1024]
    - [57, 5439.43]
  - - [320, 576, 1, 1024, 320, 320, 1024, 1024]
    - [45, 8294.78]
  - - [448, 576, 1, 1024, 448, 448, 1024, 1024]
    - [56, 10202.8]
  - - [576, 576, 1, 1024, 576, 576, 1024, 1024]
    - [49, 12543.9]
  - - [704, 576, 1, 1024, 704, 704, 1024, 1024]
    - [49, 12704.6]
  - - [832, 576, 1, 1024, 832, 832, 1024, 1024]
    - [49, 14884.7]
  - - [960, 576, 1, 1024, 960, 960, 1024, 1024]
    - [53, 18623.3]
  - - [64, 704, 1, 1024, 64, 64, 1024, 1024]
    - [15, 2563.97]
  - - [192, 704, 1, 1024, 192, 192, 1024, 1024]
    - [25, 6074.83]
  - - [320, 704, 1, 1024, 320, 320, 1024, 1024]
    - [64, 8703.85]
  - - [448, 704, 1, 1024, 448, 448, 1024, 1024]
    - [56, 11206.4]
  - - [576, 704, 1, 1024, 576, 576, 1024, 1024]
    - [63, 12982.4]
  - - [704, 704, 1, 1024, 704, 704, 1024, 1024]
    - [49, 14592.2]
  - - [832, 704, 1, 1024, 832, 832, 1024, 1024]
    - [53, 15786.3]
  - - [960, 704, 1, 1024, 960, 960, 1024, 1024]
    - [53, 18188.7]
  - - [64, 832, 1, 1024, 64, 64, 1024, 1024]
    - [15, 2960.23]
  - - [192, 832, 1, 1024, 192, 192, 1024, 1024]
    - [25, 7148.13]
  - - [320, 832, 1, 1024, 320, 320, 1024, 1024]
    - [50, 9977.48]
  - - [448, 832, 1, 1024, 448, 448, 1024, 1024]
    - [56, 12557.6]
  - - [576, 832, 1, 1024, 576, 576, 1024, 1024]
    - [56, 14739.4]
  - - [704, 832, 1, 1024, 704, 704, 1024, 1024]
    - [53, 15125.5]
  - - [832, 832, 1, 1024, 832, 832, 1024, 1024]
    - [53, 17777.4]
  - - [960, 832, 1, 1024, 960, 960, 1024, 1024]
    - [53, 21896.2]
  - - [64, 960, 1, 1024, 64, 64, 1024, 1024]
    - [15, 3423.18]
  - - [192, 960, 1, 1024, 192, 192, 1024, 1024]
    - [45, 8220.9]
  - - [320, 960, 1, 1024, 320, 320, 1024, 1024]
    - [49, 11533.8]
  - - [448, 960, 1, 1024, 448, 448, 1024, 1024]
    - [63, 13858.3]
  - - [576, 960, 1, 1024, 576, 576, 1024, 1024]
    - [53, 18611.6]
  - - [704, 960, 1, 1024, 704, 704, 1024, 1024]
    - [49, 18522.6]
  - - [832, 960, 1, 1024, 832, 832, 1024, 1024]
    - [53, 21518.6]
  - - [960, 960, 1, 1024, 960, 960, 1024, 1024]
    - [62, 22725.1]
  - - [64, 64, 1, 2048, 64, 64, 2048, 2048]
    - [20, 485.466]
  - - [192, 64, 1, 2048, 192, 192, 2048, 2048]
    - [20, 1425.91]
  - - [320, 64, 1, 2048, 320, 320, 2048, 2048]
    - [20, 2191.5]
  - - [448, 64, 1, 2048, 448, 448, 2048, 2048]
    - [15, 2898.41]
  - - [576, 64, 1, 2048, 576, 576, 2048, 2048]
    - [27, 3631.61]
  - - [704, 64, 1, 2048, 704, 704, 2048, 2048]
    - [70, 4156.7]
  - - [832, 64, 1, 2048, 832, 832, 2048, 2048]
    - [27, 4658.55]
  - - [960, 64, 1, 2048, 960, 960, 2048, 2048]
    - [27, 5238.62]
  - - [64, 64, 1, 4096, 64, 64, 4096, 4096]
    - [5, 898.643]
  - - [192, 64, 1, 4096, 192, 192, 4096, 4096]
    - [21, 2491.79]
  - - [320, 64, 1, 4096, 320, 320, 4096, 4096]
    - [20, 3692.41]
  - - [448, 64, 1, 4096, 448, 448, 4096, 4096]
    - [20, 4759.69]
  - - [576, 64, 1, 4096, 576, 576, 4096, 4096]
    - [27, 6047.42]
  - - [704, 64, 1, 4096, 704, 704, 4096, 4096]
    - [40, 6743.01]
  - - [832, 64, 1, 4096, 832, 832, 4096, 4096]
    - [51, 7363.65]
  - - [960, 64, 1, 4096, 960, 960, 4096, 4096]
    - [27, 8159.07]
  - - [1280, 1280, 1, 64, 1280, 1280, 64, 64]
    - [39, 4658.47]
  - - [1536, 1280, 1, 64, 1536, 1536, 64, 64]
    - [22, 4939.41]
  - - [1792, 1280, 1, 64, 1792, 1792, 64, 64]
    - [37, 5569.28]
  - - [2048, 1280, 1, 64, 2048, 2048, 64, 64]
    - [13, 5537.31]
  - - [1280, 1536, 1, 64, 1280, 1280, 64, 64]
    - [37, 5185.84]
  - - [1536, 1536, 1, 64, 1536, 1536, 64, 64]
    - [22, 5638.45]
  - - [1792, 1536, 1, 64, 1792, 1792, 64, 64]
    - [38, 6279.46]
  - - [2048, 1536, 1, 64, 2048, 2048, 64, 64]
    - [13, 6022.51]
  - - [1280, 1792, 1, 64, 1280, 1280, 64, 64]
    - [38, 5651.83]
  - - [1536, 1792, 1, 64, 1536, 1536, 64, 64]
    - [22, 6170.47]
  - - [1792, 1792, 1, 64, 1792, 1792, 64, 64]
    - [38, 6741.93]
  - - [2048, 1792, 1, 64, 2048, 2048, 64, 64]
    - [13, 6557.63]
  - - [1280, 2048, 1, 64, 1280, 1280, 64, 64]
    - [38, 6069.03]
  - - [1536, 2048, 1, 64, 1536, 1536, 64, 64]
    - [22, 6527.25]
  - - [1792, 2048, 1, 64, 1792, 1792, 64, 64]
    - [38, 7096.32]
  - - [2048, 2048, 1, 64, 2048, 2048, 64, 64]
    - [13, 6894.81]
  - - [1280, 1280, 1, 256, 1280, 1280, 256, 256]
    - [33, 11880.7]
  - - [1536, 1280, 1, 256, 1536, 1536, 256, 256]
    - [53, 13058.4]
  - - [1792, 1280, 1, 256, 1792, 1792, 256, 256]
    - [48, 13605.7]
  - - [2048, 1280, 1, 256, 2048, 2048, 256, 256]
    - [53, 14347.6]
  - - [1280, 1536, 1, 256, 1280, 1280, 256, 256]
    - [48, 14010.8]
  - - [1536, 1536, 1, 256, 1536, 1536, 256, 256]
    - [48, 15081.0]
  - - [1792, 1536, 1, 256, 1792, 1792, 256, 256]
    - [48, 16173.2]
  - - [2048, 1536, 1, 256, 2048, 2048, 256, 256]
    - [53, 16272.8]
  - - [1280, 1792, 1, 256, 1280, 1280, 256, 256]
    - [48, 14242.6]
  - - [1536, 1792, 1, 256, 1536, 1536, 256, 256]
    - [48, 15362.4]
  - - [1792, 1792, 1, 256, 1792, 1792, 256, 256]
    - [53, 16836.3]
  - - [2048, 1792, 1, 256, 2048, 2048, 256, 256]
    - [53, 15634.5]
  - - [1280, 2048, 1, 256, 1280, 1280, 256, 256]
    - [48, 15320.4]
  - - [1536, 2048, 1, 256, 1536, 1536, 256, 256]
    - [53, 16692.7]
  - - [1792, 2048, 1, 256, 1792, 1792, 256, 256]
    - [53, 16428.8]
  - - [2048, 2048, 1, 256, 2048, 2048, 256, 256]
    - [53, 16870.1]
  - - [1280, 1280, 1, 512, 1280, 1280, 512, 512]
    - [53, 17368.3]
  - - [1536, 1280, 1, 512, 1536, 1536, 512, 512]
    - [53, 20429.5]
  - - [1792, 1280, 1, 512, 1792, 1792, 512, 512]
    - [62, 18306.5]
  - - [2048, 1280, 1, 512, 2048, 2048, 512, 512]
    - [62, 19884.8]
  - - [1280, 1536, 1, 512, 1280, 1280, 512, 512]
    - [53, 20732.4]
  - - [1536, 1536, 1, 512, 1536, 1536, 512, 512]
    - [48, 19061.3]
  - - [1792, 1536, 1, 512, 1792, 1792, 512, 512]
    - [62, 20684.5]
  - - [2048, 1536, 1, 512, 2048, 2048, 512, 512]
    - [54, 21860.5]
  - - [1280, 1792, 1, 512, 1280, 1280, 512, 512]
    - [48, 18340.8]
  - - [1536, 1792, 1, 512, 1536, 1536, 512, 512]
    - [62, 20112.0]
  - - [1792, 1792, 1, 512, 1792, 1792, 512, 512]
    - [55, 21321.7]
  - - [2048, 1792, 1, 512, 2048, 2048, 512, 512]
    - [53, 21164.7]
  - - [1280, 2048, 1, 512, 1280, 1280, 512, 512]
    - [53, 20614.8]
  - - [1536, 2048, 1, 512, 1536, 1536, 512, 512]
    - [53, 22911.4]
  - - [1792, 2048, 1, 512, 1792, 1792, 512, 512]
    - [54, 21177.9]
  - - [2048, 2048, 1, 512, 2048, 2048, 512, 512]
    - [62, 22672.9]
  - - [1280, 1280, 1, 1024, 1280, 1280, 1024, 1024]
    - [53, 22322.9]
  - - [1536, 1280, 1, 1024, 1536, 1536, 1024, 1024]
    - [53, 26534.9]
  - - [1792, 1280, 1, 1024, 1792, 1792, 1024, 1024]
    - [63, 23036.2]
  - - [2048, 1280, 1, 1024, 2048, 2048, 1024, 1024]
    - [53, 25627.2]
  - - [1280, 1536, 1, 1024, 1280, 1280, 1024, 1024]
    - [53, 26194.8]
  - - [1536, 1536, 1, 1024, 1536, 1536, 1024, 1024]
    - [53, 24067.5]
  - - [1792, 1536, 1, 1024, 1792, 1792, 1024, 1024]
    - [53, 27044.1]
  - - [2048, 1536, 1, 1024, 2048, 2048, 1024, 1024]
    - [53, 29674.8]
  - - [1280, 1792, 1, 1024, 1280, 1280, 1024, 1024]
    - [53, 24311.9]
  - - [1536, 1792, 1, 1024, 1536, 1536, 1024, 1024]
    - [53, 27009.1]
  - - [1792, 1792, 1, 1024, 1792, 1792, 1024, 1024]
    - [53, 28730.1]
  - - [2048, 1792, 1, 1024, 2048, 2048, 1024, 1024]
    - [53, 28155.7]
  - - [1280, 2048, 1, 1024, 1280, 1280, 1024, 1024]
    - [53, 25773.6]
  - - [1536, 2048, 1, 1024, 1536, 1536, 1024, 1024]
    - [53, 30424.5]
  - - [1792, 2048, 1, 1024, 1792, 1792, 1024, 1024]
    - [53, 28250.9]
  - - [2048, 2048, 1, 1024, 2048, 2048, 1024, 1024]
    - [53, 29609.2]
  - - [1280, 1280, 1, 2048, 1280, 1280, 2048, 2048]
    - [53, 26691.7]
  - - [1536, 1280, 1, 2048, 1536, 1536, 2048, 2048]
    - [53, 31951.4]
  - - [1792, 1280, 1, 2048, 1792, 1792, 2048, 2048]
    - [63, 29041.8]
  - - [2048, 1280, 1, 2048, 2048, 2048, 2048, 2048]
    - [53, 29862.8]
  - - [1280, 1536, 1, 2048, 1280, 1280, 2048, 2048]
    - [53, 31761.0]
  - - [1536, 1536, 1, 2048, 1536, 1536, 2048, 2048]
    - [56, 29450.8]
  - - [1792, 1536, 1, 2048, 1792, 1792, 2048, 2048]
    - [53, 31040.9]
  - - [2048, 1536, 1, 2048, 2048, 2048, 2048, 2048]
    - [53, 35062.1]
  - - [1280, 1792, 1, 2048, 1280, 1280, 2048, 2048]
    - [56, 28358.8]
  - - [1536, 1792, 1, 2048, 1536, 1536, 2048, 2048]
    - [53, 31261.3]
  - - [1792, 1792, 1, 2048, 1792, 1792, 2048, 2048]
    - [53, 32659.9]
  - - [2048, 1792, 1, 2048, 2048, 2048, 2048, 2048]
    - [53, 32108.5]
  - - [1280, 2048, 1, 2048, 1280, 1280, 2048, 2048]
    - [53, 29985.4]
  - - [1536, 2048, 1, 2048, 1536, 1536, 2048, 2048]
    - [53, 35319.7]
  - - [1792, 2048, 1, 2048, 1792, 1792, 2048, 2048]
    - [56, 32384.5]
  - - [2048, 2048, 1, 2048, 2048, 2048, 2048, 2048]
    - [53, 33664.7]
  - - [1280, 1280, 1, 4096, 1280, 1280, 4096, 4096]
    - [57, 30628.3]
  - - [1536, 1280, 1, 4096, 1536, 1536, 4096, 4096]
    - [53, 35478.0]
  - - [1792, 1280, 1, 4096, 1792, 1792, 4096, 4096]
    - [63, 33790.3]
  - - [2048, 1280, 1, 4096, 2048, 2048, 4096, 4096]
    - [53, 32601.9]
  - - [1280, 1536, 1, 4096, 1280, 1280, 4096, 4096]
    - [53, 35635.0]
  - - [1536, 1536, 1, 4096, 1536, 1536, 4096, 4096]
    - [56, 33471.9]
  - - [1792, 1536, 1, 4096, 1792, 1792, 4096, 4096]
    - [53, 34313.3]
  - - [2048, 1536, 1, 4096, 2048, 2048, 4096, 4096]
    - [53, 38567.9]
  - - [1280, 1792, 1, 4096, 1280, 1280, 4096, 4096]
    - [56, 32408.5]
  - - [1536, 1792, 1, 4096, 1536, 1536, 4096, 4096]
    - [53, 34191.0]
  - - [1792, 1792, 1, 4096, 1792, 1792, 4096, 4096]
    - [53, 35821.4]
  - - [2048, 1792, 1, 4096, 2048, 2048, 4096, 4096]
    - [56, 35479.6]
  - - [1280, 2048, 1, 4096, 1280, 1280, 4096, 4096]
    - [53, 32601.9]
  - - [1536, 2048, 1, 4096, 1536, 1536, 4096, 4096]
    - [53, 38769.2]
  - - [1792, 2048, 1, 4096, 1792, 1792, 4096, 4096]
    - [56, 35928.2]
  - - [2048, 2048, 1, 4096, 2048, 2048, 4096, 4096]
    - [53, 35920.2]
  - - [2560, 2560, 1, 64, 2560, 2560, 64, 64]
    - [22, 8407.36]
  - - [3072, 2560, 1, 64, 3072, 3072, 64, 64]
    - [22, 8856.06]
  - - [3584, 2560, 1, 64, 3584, 3584, 64, 64]
    - [62, 9304.72]
  - - [4096, 2560, 1, 64, 4096, 4096, 64, 64]
    - [13, 8902.45]
  - - [2560, 3072, 1, 64, 2560, 2560, 64, 64]
    - [22, 8903.84]
  - - [3072, 3072, 1, 64, 3072, 3072, 64, 64]
    - [22, 9258.81]
  - - [3584, 3072, 1, 64, 3584, 3584, 64, 64]
    - [62, 9758.59]
  - - [4096, 3072, 1, 64, 4096, 4096, 64, 64]
    - [33, 9303.18]
  - - [2560, 3584, 1, 64, 2560, 2560, 64, 64]
    - [22, 9264.35]
  - - [3072, 3584, 1, 64, 3072, 3072, 64, 64]
    - [62, 9676.84]
  - - [3584, 3584, 1, 64, 3584, 3584, 64, 64]
    - [62, 10191.6]
  - - [4096, 3584, 1, 64, 4096, 4096, 64, 64]
    - [13, 9595.16]
  - - [2560, 4096, 1, 64, 2560, 2560, 64, 64]
    - [22, 9599.6]
  - - [3072, 4096, 1, 64, 3072, 3072, 64, 64]
    - [22, 9960.19]
  - - [3584, 4096, 1, 64, 3584, 3584, 64, 64]
    - [30, 10621.9]
  - - [4096, 4096, 1, 64, 4096, 4096, 64, 64]
    - [13, 9766.93]
  - - [2560, 2560, 1, 256, 2560, 2560, 256, 256]
    - [53, 19868.3]
  - - [3072, 2560, 1, 256, 3072, 3072, 256, 256]
    - [62, 21003.9]
  - - [3584, 2560, 1, 256, 3584, 3584, 256, 256]
    - [62, 21553.4]
  - - [4096, 2560, 1, 256, 4096, 4096, 256, 256]
    - [53, 21367.0]
  - - [2560, 3072, 1, 256, 2560, 2560, 256, 256]
    - [48, 20887.3]
  - - [3072, 3072, 1, 256, 3072, 3072, 256, 256]
    - [53, 22051.8]
  - - [3584, 3072, 1, 256, 3584, 3584, 256, 256]
    - [53, 22382.0]
  - - [4096, 3072, 1, 256, 4096, 4096, 256, 256]
    - [53, 22641.6]
  - - [2560, 3584, 1, 256, 2560, 2560, 256, 256]
    - [62, 21527.7]
  - - [3072, 3584, 1, 256, 3072, 3072, 256, 256]
    - [53, 22374.8]
  - - [3584, 3584, 1, 256, 3584, 3584, 256, 256]
    - [62, 22869.7]
  - - [4096, 3584, 1, 256, 4096, 4096, 256, 256]
    - [53, 22501.6]
  - - [2560, 4096, 1, 256, 2560, 2560, 256, 256]
    - [53, 22509.2]
  - - [3072, 4096, 1, 256, 3072, 3072, 256, 256]
    - [53, 23116.0]
  - - [3584, 4096, 1, 256, 3584, 3584, 256, 256]
    - [62, 23689.4]
  - - [4096, 4096, 1, 256, 4096, 4096, 256, 256]
    - [53, 23319.5]
  - - [2560, 2560, 1, 512, 2560, 2560, 512, 512]
    - [62, 25191.9]
  - - [3072, 2560, 1, 512, 3072, 3072, 512, 512]
    - [62, 27406.2]
  - - [3584, 2560, 1, 512, 3584, 3584, 512, 512]
    - [62, 28197.8]
  - - [4096, 2560, 1, 512, 4096, 4096, 512, 512]
    - [53, 27561.0]
  - - [2560, 3072, 1, 512, 2560, 2560, 512, 512]
    - [53, 26001.9]
  - - [3072, 3072, 1, 512, 3072, 3072, 512, 512]
    - [53, 27814.8]
  - - [3584, 3072, 1, 512, 3584, 3584, 512, 512]
    - [53, 28444.8]
  - - [4096, 3072, 1, 512, 4096, 4096, 512, 512]
    - [53, 28024.9]
  - - [2560, 3584, 1, 512, 2560, 2560, 512, 512]
    - [62, 27699.9]
  - - [3072, 3584, 1, 512, 3072, 3072, 512, 512]
    - [53, 28489.3]
  - - [3584, 3584, 1, 512, 3584, 3584, 512, 512]
    - [62, 28657.5]
  - - [4096, 3584, 1, 512, 4096, 4096, 512, 512]
    - [53, 28901.5]
  - - [2560, 4096, 1, 512, 2560, 2560, 512, 512]
    - [62, 28554.1]
  - - [3072, 4096, 1, 512, 3072, 3072, 512, 512]
    - [53, 28771.5]
  - - [3584, 4096, 1, 512, 3584, 3584, 512, 512]
    - [53, 29795.2]
  - - [4096, 4096, 1, 512, 4096, 4096, 512, 512]
    - [53, 28703.4]
  - - [2560, 2560, 1, 1024, 2560, 2560, 1024, 1024]
    - [53, 32478.9]
  - - [3072, 2560, 1, 1024, 3072, 3072, 1024, 1024]
    - [53, 33010.8]
  - - [3584, 2560, 1, 1024, 3584, 3584, 1024, 1024]
    - [53, 33851.1]
  - - [4096, 2560, 1, 1024, 4096, 4096, 1024, 1024]
    - [53, 34364.1]
  - - [2560, 3072, 1, 1024, 2560, 2560, 1024, 1024]
    - [53, 32871.3]
  - - [3072, 3072, 1, 1024, 3072, 3072, 1024, 1024]
    - [53, 34568.6]
  - - [3584, 3072, 1, 1024, 3584, 3584, 1024, 1024]
    - [53, 34830.5]
  - - [4096, 3072, 1, 1024, 4096, 4096, 1024, 1024]
    - [53, 34697.2]
  - - [2560, 3584, 1, 1024, 2560, 2560, 1024, 1024]
    - [53, 34070.2]
  - - [3072, 3584, 1, 1024, 3072, 3072, 1024, 1024]
    - [53, 34497.5]
  - - [3584, 3584, 1, 1024, 3584, 3584, 1024, 1024]
    - [53, 35395.2]
  - - [4096, 3584, 1, 1024, 4096, 4096, 1024, 1024]
    - [53, 35348.2]
  - - [2560, 4096, 1, 1024, 2560, 2560, 1024, 1024]
    - [53, 35129.8]
  - - [3072, 4096, 1, 1024, 3072, 3072, 1024, 1024]
    - [53, 35282.4]
  - - [3584, 4096, 1, 1024, 3584, 3584, 1024, 1024]
    - [53, 35233.4]
  - - [4096, 4096, 1, 1024, 4096, 4096, 1024, 1024]
    - [53, 35431.7]
  - - [2560, 2560, 1, 2048, 2560, 2560, 2048, 2048]
    - [53, 34127.5]
  - - [3072, 2560, 1, 2048, 3072, 3072, 2048, 2048]
    - [53, 35266.7]
  - - [3584, 2560, 1, 2048, 3584, 3584, 2048, 2048]
    - [53, 36559.3]
  - - [4096, 2560, 1, 2048, 4096, 4096, 2048, 2048]
    - [53, 37584.9]
  - - [2560, 3072, 1, 2048, 2560, 2560, 2048, 2048]
    - [53, 35632.6]
  - - [3072, 3072, 1, 2048, 3072, 3072, 2048, 2048]
    - [53, 37786.4]
  - - [3584, 3072, 1, 2048, 3584, 3584, 2048, 2048]
    - [53, 37359.0]
  - - [4096, 3072, 1, 2048, 4096, 4096, 2048, 2048]
    - [53, 38104.4]
  - - [2560, 3584, 1, 2048, 2560, 2560, 2048, 2048]
    - [53, 36875.9]
  - - [3072, 3584, 1, 2048, 3072, 3072, 2048, 2048]
    - [53, 37290.0]
  - - [3584, 3584, 1, 2048, 3584, 3584, 2048, 2048]
    - [53, 37590.0]
  - - [4096, 3584, 1, 2048, 4096, 4096, 2048, 2048]
    - [53, 38121.0]
  - - [2560, 4096, 1, 2048, 2560, 2560, 2048, 2048]
    - [53, 37737.3]
  - - [3072, 4096, 1, 2048, 3072, 3072, 2048, 2048]
    - [53, 38313.5]
  - - [3584, 4096, 1, 2048, 3584, 3584, 2048, 2048]
    - [53, 38334.5]
  - - [4096, 4096, 1, 2048, 4096, 4096, 2048, 2048]
    - [53, 38642.6]
  - - [2560, 2560, 1, 4096, 2560, 2560, 4096, 4096]
    - [53, 35883.7]
  - - [3072, 2560, 1, 4096, 3072, 3072, 4096, 4096]
    - [53, 37442.8]
  - - [3584, 2560, 1, 4096, 3584, 3584, 4096, 4096]
    - [53, 38554.0]
  - - [4096, 2560, 1, 4096, 4096, 4096, 4096, 4096]
    - [53, 39498.6]
  - - [2560, 3072, 1, 4096, 2560, 2560, 4096, 4096]
    - [53, 37755.7]
  - - [3072, 3072, 1, 4096, 3072, 3072, 4096, 4096]
    - [53, 40044.4]
  - - [3584, 3072, 1, 4096, 3584, 3584, 4096, 4096]
    - [53, 39887.7]
  - - [4096, 3072, 1, 4096, 4096, 4096, 4096, 4096]
    - [53, 39669.3]
  - - [2560, 3584, 1, 4096, 2560, 2560, 4096, 4096]
    - [53, 38934.7]
  - - [3072, 3584, 1, 4096, 3072, 3072, 4096, 4096]
    - [53, 39223.4]
  - - [3584, 3584, 1, 4096, 3584, 3584, 4096, 4096]
    - [53, 39653.8]
  - - [4096, 3584, 1, 4096, 4096, 4096, 4096, 4096]
    - [53, 39874.3]
  - - [2560, 4096, 1, 4096, 2560, 2560, 4096, 4096]
    - [53, 40073.5]
  - - [3072, 4096, 1, 4096, 3072, 3072, 4096, 4096]
    - [53, 40398.9]
  - - [3584, 4096, 1, 4096, 3584, 3584, 4096, 4096]
    - [53, 39754.9]
  - - [4096, 4096, 1, 4096, 4096, 4096, 4096, 4096]
    - [53, 40480.0]
  - - [1, 1, 1, 1, 1, 1, 1, 1]
    - [2, 6.77759e-05]
  - - [1, 1, 1, 64, 1, 1, 64, 64]
    - [11, 0.00434487]
  - - [1, 64, 1, 1, 1, 1, 1, 1]
    - [17, 0.00422721]
  - - [64, 1, 1, 1, 64, 64, 1, 1]
    - [35, 0.00438341]
  - - [64, 64, 1, 1, 64, 64, 1, 1]
    - [1, 0.278829]
  - - [64, 1, 1, 64, 64, 64, 64, 64]
    - [3, 0.261734]
  - - [1, 64, 1, 64, 1, 1, 64, 64]
    - [65, 0.268934]
- null
- null
- DeviceEfficiency
- GridBased
