library/src/amd_detail/rocblaslt/src/Tensile/Logic/asm_full/navi32/GridBased/navi32_Cijk_Ailk_Bjlk_HSS_BH_Bias_HAH.yaml
- {MinimumRequiredVersion: 4.33.0}
- navi32
- gfx1101
- [Device 73f0]
    SolutionIndex: 0
    SolutionNameMin: Cijk_Ailk_Bjlk_HSS_BH_Bias_HAH_MT32x32x64_MI16x16x16x1_SN_MIWT1_1_WG32_4_1
    SolutionIndex: 1
    SolutionNameMin: Cijk_Ailk_Bjlk_HSS_BH_Bias_HAH_MT16x16x64_MI16x16x16x1_SN_MIWT1_1_WG16_2_1
    SolutionIndex: 2
    SolutionNameMin: Cijk_Ailk_Bjlk_HSS_BH_Bias_HAH_MT32x16x64_MI16x16x16x1_SN_MIWT1_1_WG32_2_1
    SolutionIndex: 3
    SolutionNameMin: Cijk_Ailk_Bjlk_HSS_BH_Bias_HAH_MT16x32x64_MI16x16x16x1_SN_MIWT1_1_WG16_4_1
- - - [64, 64, 1, 64, 64, 64, 64, 64]
    - [2, 0.075]
  - - [192, 64, 1, 64, 192, 192, 192, 64]
    - [2, 0.452]
  - - [320, 64, 1, 64, 320, 320, 320, 64]
    - [0, 0.738]
  - - [448, 64, 1, 64, 448, 448, 448, 64]
    - [0, 1.029]
  - - [576, 64, 1, 64, 576, 576, 576, 64]
    - [2, 1.254]
  - - [704, 64, 1, 64, 704, 704, 704, 64]
    - [2, 1.52]
  - - [832, 64, 1, 64, 832, 832, 832, 64]
    - [0, 1.793]
  - - [960, 64, 1, 64, 960, 960, 960, 64]
    - [0, 2.072]
  - - [1088, 64, 1, 64, 1088, 1088, 1088, 64]
    - [0, 2.213]
  - - [1216, 64, 1, 64, 1216, 1216, 1216, 64]
    - [0, 2.477]
  - - [1344, 64, 1, 64, 1344, 1344, 1344, 64]
    - [0, 2.733]
  - - [1472, 64, 1, 64, 1472, 1472, 1472, 64]
    - [0, 2.882]
  - - [1600, 64, 1, 64, 1600, 1600, 1600, 64]
    - [0, 3.105]
  - - [1728, 64, 1, 64, 1728, 1728, 1728, 64]
    - [0, 3.333]
  - - [1856, 64, 1, 64, 1856, 1856, 1856, 64]
    - [0, 3.579]
  - - [1984, 64, 1, 64, 1984, 1984, 1984, 64]
    - [0, 3.68]
  - - [2112, 64, 1, 64, 2112, 2112, 2112, 64]
    - [0, 3.902]
  - - [2240, 64, 1, 64, 2240, 2240, 2240, 64]
    - [0, 4.14]
  - - [2368, 64, 1, 64, 2368, 2368, 2368, 64]
    - [0, 4.362]
  - - [2496, 64, 1, 64, 2496, 2496, 2496, 64]
    - [0, 3.859]
  - - [2624, 64, 1, 64, 2624, 2624, 2624, 64]
    - [0, 4.074]
  - - [2752, 64, 1, 64, 2752, 2752, 2752, 64]
    - [0, 4.305]
  - - [2880, 64, 1, 64, 2880, 2880, 2880, 64]
    - [0, 4.385]
  - - [3008, 64, 1, 64, 3008, 3008, 3008, 64]
    - [0, 4.446]
  - - [3136, 64, 1, 64, 3136, 3136, 3136, 64]
    - [0, 4.592]
  - - [3264, 64, 1, 64, 3264, 3264, 3264, 64]
    - [0, 4.69]
  - - [3392, 64, 1, 64, 3392, 3392, 3392, 64]
    - [0, 4.803]
  - - [3520, 64, 1, 64, 3520, 3520, 3520, 64]
    - [0, 4.955]
  - - [3648, 64, 1, 64, 3648, 3648, 3648, 64]
    - [0, 4.988]
  - - [3776, 64, 1, 64, 3776, 3776, 3776, 64]
    - [0, 5.108]
  - - [3904, 64, 1, 64, 3904, 3904, 3904, 64]
    - [0, 5.235]
  - - [4032, 64, 1, 64, 4032, 4032, 4032, 64]
    - [0, 5.334]
  - - [64, 192, 1, 64, 64, 64, 64, 192]
    - [2, 0.452]
  - - [192, 192, 1, 64, 192, 192, 192, 192]
    - [0, 1.252]
  - - [320, 192, 1, 64, 320, 320, 320, 192]
    - [0, 2.074]
  - - [448, 192, 1, 64, 448, 448, 448, 192]
    - [0, 2.746]
  - - [576, 192, 1, 64, 576, 576, 576, 192]
    - [0, 3.349]
  - - [704, 192, 1, 64, 704, 704, 704, 192]
    - [0, 3.928]
  - - [832, 192, 1, 64, 832, 832, 832, 192]
    - [0, 3.857]
  - - [960, 192, 1, 64, 960, 960, 960, 192]
    - [0, 4.466]
  - - [1088, 192, 1, 64, 1088, 1088, 1088, 192]
    - [0, 4.675]
  - - [1216, 192, 1, 64, 1216, 1216, 1216, 192]
    - [0, 5.018]
  - - [1344, 192, 1, 64, 1344, 1344, 1344, 192]
    - [0, 5.388]
  - - [1472, 192, 1, 64, 1472, 1472, 1472, 192]
    - [0, 5.659]
  - - [1600, 192, 1, 64, 1600, 1600, 1600, 192]
    - [0, 6.073]
  - - [1728, 192, 1, 64, 1728, 1728, 1728, 192]
    - [0, 6.012]
  - - [1856, 192, 1, 64, 1856, 1856, 1856, 192]
    - [0, 6.223]
  - - [1984, 192, 1, 64, 1984, 1984, 1984, 192]
    - [0, 6.356]
  - - [2112, 192, 1, 64, 2112, 2112, 2112, 192]
    - [0, 6.482]
  - - [2240, 192, 1, 64, 2240, 2240, 2240, 192]
    - [0, 6.656]
  - - [2368, 192, 1, 64, 2368, 2368, 2368, 192]
    - [0, 6.808]
  - - [2496, 192, 1, 64, 2496, 2496, 2496, 192]
    - [0, 6.794]
  - - [2624, 192, 1, 64, 2624, 2624, 2624, 192]
    - [0, 6.976]
  - - [2752, 192, 1, 64, 2752, 2752, 2752, 192]
    - [0, 7.051]
  - - [2880, 192, 1, 64, 2880, 2880, 2880, 192]
    - [0, 7.214]
  - - [3008, 192, 1, 64, 3008, 3008, 3008, 192]
    - [0, 7.316]
  - - [3136, 192, 1, 64, 3136, 3136, 3136, 192]
    - [0, 7.461]
  - - [3264, 192, 1, 64, 3264, 3264, 3264, 192]
    - [0, 7.477]
  - - [3392, 192, 1, 64, 3392, 3392, 3392, 192]
    - [0, 7.588]
  - - [3520, 192, 1, 64, 3520, 3520, 3520, 192]
    - [0, 7.665]
  - - [3648, 192, 1, 64, 3648, 3648, 3648, 192]
    - [0, 7.76]
  - - [3776, 192, 1, 64, 3776, 3776, 3776, 192]
    - [0, 7.836]
  - - [3904, 192, 1, 64, 3904, 3904, 3904, 192]
    - [0, 7.93]
  - - [4032, 192, 1, 64, 4032, 4032, 4032, 192]
    - [0, 7.973]
  - - [64, 320, 1, 64, 64, 64, 64, 320]
    - [0, 0.746]
  - - [192, 320, 1, 64, 192, 192, 192, 320]
    - [0, 2.078]
  - - [320, 320, 1, 64, 320, 320, 320, 320]
    - [0, 3.093]
  - - [448, 320, 1, 64, 448, 448, 448, 320]
    - [0, 4.147]
  - - [576, 320, 1, 64, 576, 576, 576, 320]
    - [0, 4.379]
  - - [704, 320, 1, 64, 704, 704, 704, 320]
    - [0, 4.956]
  - - [832, 320, 1, 64, 832, 832, 832, 320]
    - [0, 5.418]
  - - [960, 320, 1, 64, 960, 960, 960, 320]
    - [0, 6.032]
  - - [1088, 320, 1, 64, 1088, 1088, 1088, 320]
    - [0, 6.053]
  - - [1216, 320, 1, 64, 1216, 1216, 1216, 320]
    - [0, 6.436]
  - - [1344, 320, 1, 64, 1344, 1344, 1344, 320]
    - [0, 6.669]
  - - [1472, 320, 1, 64, 1472, 1472, 1472, 320]
    - [0, 6.787]
  - - [1600, 320, 1, 64, 1600, 1600, 1600, 320]
    - [0, 7.066]
  - - [1728, 320, 1, 64, 1728, 1728, 1728, 320]
    - [0, 7.247]
  - - [1856, 320, 1, 64, 1856, 1856, 1856, 320]
    - [0, 7.427]
  - - [1984, 320, 1, 64, 1984, 1984, 1984, 320]
    - [0, 7.508]
  - - [2112, 320, 1, 64, 2112, 2112, 2112, 320]
    - [0, 7.673]
  - - [2240, 320, 1, 64, 2240, 2240, 2240, 320]
    - [0, 7.816]
  - - [2368, 320, 1, 64, 2368, 2368, 2368, 320]
    - [0, 7.961]
  - - [2496, 320, 1, 64, 2496, 2496, 2496, 320]
    - [0, 8.049]
  - - [2624, 320, 1, 64, 2624, 2624, 2624, 320]
    - [0, 8.11]
  - - [2752, 320, 1, 64, 2752, 2752, 2752, 320]
    - [0, 8.254]
  - - [2880, 320, 1, 64, 2880, 2880, 2880, 320]
    - [0, 8.361]
  - - [3008, 320, 1, 64, 3008, 3008, 3008, 320]
    - [0, 8.429]
  - - [3136, 320, 1, 64, 3136, 3136, 3136, 320]
    - [0, 8.498]
  - - [3264, 320, 1, 64, 3264, 3264, 3264, 320]
    - [0, 8.616]
  - - [3392, 320, 1, 64, 3392, 3392, 3392, 320]
    - [0, 8.664]
  - - [3520, 320, 1, 64, 3520, 3520, 3520, 320]
    - [0, 8.729]
  - - [3648, 320, 1, 64, 3648, 3648, 3648, 320]
    - [0, 8.804]
  - - [3776, 320, 1, 64, 3776, 3776, 3776, 320]
    - [0, 8.848]
  - - [3904, 320, 1, 64, 3904, 3904, 3904, 320]
    - [0, 8.907]
  - - [4032, 320, 1, 64, 4032, 4032, 4032, 320]
    - [0, 8.96]
  - - [64, 448, 1, 64, 64, 64, 64, 448]
    - [0, 1.041]
  - - [192, 448, 1, 64, 192, 192, 192, 448]
    - [0, 2.737]
  - - [320, 448, 1, 64, 320, 320, 320, 448]
    - [0, 4.147]
  - - [448, 448, 1, 64, 448, 448, 448, 448]
    - [0, 4.583]
  - - [576, 448, 1, 64, 576, 576, 576, 448]
    - [0, 5.373]
  - - [704, 448, 1, 64, 704, 704, 704, 448]
    - [0, 5.773]
  - - [832, 448, 1, 64, 832, 832, 832, 448]
    - [0, 6.279]
  - - [960, 448, 1, 64, 960, 960, 960, 448]
    - [0, 6.644]
  - - [1088, 448, 1, 64, 1088, 1088, 1088, 448]
    - [0, 6.936]
  - - [1216, 448, 1, 64, 1216, 1216, 1216, 448]
    - [2, 6.875]
  - - [1344, 448, 1, 64, 1344, 1344, 1344, 448]
    - [2, 7.002]
  - - [1472, 448, 1, 64, 1472, 1472, 1472, 448]
    - [0, 7.638]
  - - [1600, 448, 1, 64, 1600, 1600, 1600, 448]
    - [0, 7.819]
  - - [1728, 448, 1, 64, 1728, 1728, 1728, 448]
    - [0, 7.986]
  - - [1856, 448, 1, 64, 1856, 1856, 1856, 448]
    - [0, 8.133]
  - - [1984, 448, 1, 64, 1984, 1984, 1984, 448]
    - [0, 8.263]
  - - [2112, 448, 1, 64, 2112, 2112, 2112, 448]
    - [0, 8.371]
  - - [2240, 448, 1, 64, 2240, 2240, 2240, 448]
    - [0, 8.519]
  - - [2368, 448, 1, 64, 2368, 2368, 2368, 448]
    - [0, 8.631]
  - - [2496, 448, 1, 64, 2496, 2496, 2496, 448]
    - [0, 8.746]
  - - [2624, 448, 1, 64, 2624, 2624, 2624, 448]
    - [0, 8.82]
  - - [2752, 448, 1, 64, 2752, 2752, 2752, 448]
    - [0, 8.915]
  - - [2880, 448, 1, 64, 2880, 2880, 2880, 448]
    - [0, 8.99]
  - - [3008, 448, 1, 64, 3008, 3008, 3008, 448]
    - [0, 9.03]
  - - [3136, 448, 1, 64, 3136, 3136, 3136, 448]
    - [0, 9.124]
  - - [3264, 448, 1, 64, 3264, 3264, 3264, 448]
    - [0, 9.193]
  - - [3392, 448, 1, 64, 3392, 3392, 3392, 448]
    - [0, 9.235]
  - - [3520, 448, 1, 64, 3520, 3520, 3520, 448]
    - [0, 9.287]
  - - [3648, 448, 1, 64, 3648, 3648, 3648, 448]
    - [0, 9.363]
  - - [3776, 448, 1, 64, 3776, 3776, 3776, 448]
    - [0, 9.371]
  - - [3904, 448, 1, 64, 3904, 3904, 3904, 448]
    - [0, 9.428]
  - - [4032, 448, 1, 64, 4032, 4032, 4032, 448]
    - [0, 9.483]
  - - [64, 576, 1, 64, 64, 64, 64, 576]
    - [0, 1.256]
  - - [192, 576, 1, 64, 192, 192, 192, 576]
    - [0, 3.338]
  - - [320, 576, 1, 64, 320, 320, 320, 576]
    - [0, 4.406]
  - - [448, 576, 1, 64, 448, 448, 448, 576]
    - [0, 5.341]
  - - [576, 576, 1, 64, 576, 576, 576, 576]
    - [0, 5.997]
  - - [704, 576, 1, 64, 704, 704, 704, 576]
    - [0, 6.479]
  - - [832, 576, 1, 64, 832, 832, 832, 576]
    - [0, 6.888]
  - - [960, 576, 1, 64, 960, 960, 960, 576]
    - [0, 7.299]
  - - [1088, 576, 1, 64, 1088, 1088, 1088, 576]
    - [0, 7.489]
  - - [1216, 576, 1, 64, 1216, 1216, 1216, 576]
    - [0, 7.738]
  - - [1344, 576, 1, 64, 1344, 1344, 1344, 576]
    - [0, 7.997]
  - - [1472, 576, 1, 64, 1472, 1472, 1472, 576]
    - [0, 8.183]
  - - [1600, 576, 1, 64, 1600, 1600, 1600, 576]
    - [0, 8.387]
  - - [1728, 576, 1, 64, 1728, 1728, 1728, 576]
    - [0, 8.518]
  - - [1856, 576, 1, 64, 1856, 1856, 1856, 576]
    - [0, 8.656]
  - - [1984, 576, 1, 64, 1984, 1984, 1984, 576]
    - [0, 8.736]
  - - [2112, 576, 1, 64, 2112, 2112, 2112, 576]
    - [0, 8.886]
  - - [2240, 576, 1, 64, 2240, 2240, 2240, 576]
    - [0, 8.974]
  - - [2368, 576, 1, 64, 2368, 2368, 2368, 576]
    - [0, 9.043]
  - - [2496, 576, 1, 64, 2496, 2496, 2496, 576]
    - [0, 9.169]
  - - [2624, 576, 1, 64, 2624, 2624, 2624, 576]
    - [0, 9.207]
  - - [2752, 576, 1, 64, 2752, 2752, 2752, 576]
    - [0, 9.281]
  - - [2880, 576, 1, 64, 2880, 2880, 2880, 576]
    - [0, 9.382]
  - - [3008, 576, 1, 64, 3008, 3008, 3008, 576]
    - [0, 9.414]
  - - [3136, 576, 1, 64, 3136, 3136, 3136, 576]
    - [0, 9.468]
  - - [3264, 576, 1, 64, 3264, 3264, 3264, 576]
    - [0, 9.549]
  - - [3392, 576, 1, 64, 3392, 3392, 3392, 576]
    - [0, 9.573]
  - - [3520, 576, 1, 64, 3520, 3520, 3520, 576]
    - [0, 9.62]
  - - [3648, 576, 1, 64, 3648, 3648, 3648, 576]
    - [0, 9.681]
  - - [3776, 576, 1, 64, 3776, 3776, 3776, 576]
    - [0, 9.704]
  - - [3904, 576, 1, 64, 3904, 3904, 3904, 576]
    - [0, 9.739]
  - - [4032, 576, 1, 64, 4032, 4032, 4032, 576]
    - [0, 9.8]
  - - [64, 704, 1, 64, 64, 64, 64, 704]
    - [0, 1.532]
  - - [192, 704, 1, 64, 192, 192, 192, 704]
    - [0, 3.932]
  - - [320, 704, 1, 64, 320, 320, 320, 704]
    - [0, 4.959]
  - - [448, 704, 1, 64, 448, 448, 448, 704]
    - [0, 5.789]
  - - [576, 704, 1, 64, 576, 576, 576, 704]
    - [0, 6.471]
  - - [704, 704, 1, 64, 704, 704, 704, 704]
    - [0, 6.987]
  - - [832, 704, 1, 64, 832, 832, 832, 704]
    - [0, 7.425]
  - - [960, 704, 1, 64, 960, 960, 960, 704]
    - [0, 7.69]
  - - [1088, 704, 1, 64, 1088, 1088, 1088, 704]
    - [0, 7.986]
  - - [1216, 704, 1, 64, 1216, 1216, 1216, 704]
    - [0, 8.21]
  - - [1344, 704, 1, 64, 1344, 1344, 1344, 704]
    - [0, 8.43]
  - - [1472, 704, 1, 64, 1472, 1472, 1472, 704]
    - [0, 8.64]
  - - [1600, 704, 1, 64, 1600, 1600, 1600, 704]
    - [0, 8.761]
  - - [1728, 704, 1, 64, 1728, 1728, 1728, 704]
    - [0, 8.893]
  - - [1856, 704, 1, 64, 1856, 1856, 1856, 704]
    - [0, 9.001]
  - - [1984, 704, 1, 64, 1984, 1984, 1984, 704]
    - [0, 9.092]
  - - [2112, 704, 1, 64, 2112, 2112, 2112, 704]
    - [0, 9.229]
  - - [2240, 704, 1, 64, 2240, 2240, 2240, 704]
    - [0, 9.303]
  - - [2368, 704, 1, 64, 2368, 2368, 2368, 704]
    - [0, 9.366]
  - - [2496, 704, 1, 64, 2496, 2496, 2496, 704]
    - [0, 9.471]
  - - [2624, 704, 1, 64, 2624, 2624, 2624, 704]
    - [0, 9.518]
  - - [2752, 704, 1, 64, 2752, 2752, 2752, 704]
    - [0, 9.575]
  - - [2880, 704, 1, 64, 2880, 2880, 2880, 704]
    - [0, 9.656]
  - - [3008, 704, 1, 64, 3008, 3008, 3008, 704]
    - [0, 9.682]
  - - [3136, 704, 1, 64, 3136, 3136, 3136, 704]
    - [0, 9.723]
  - - [3264, 704, 1, 64, 3264, 3264, 3264, 704]
    - [0, 9.81]
  - - [3392, 704, 1, 64, 3392, 3392, 3392, 704]
    - [0, 9.814]
  - - [3520, 704, 1, 64, 3520, 3520, 3520, 704]
    - [0, 9.857]
  - - [3648, 704, 1, 64, 3648, 3648, 3648, 704]
    - [0, 9.923]
  - - [3776, 704, 1, 64, 3776, 3776, 3776, 704]
    - [0, 9.933]
  - - [3904, 704, 1, 64, 3904, 3904, 3904, 704]
    - [0, 9.956]
  - - [4032, 704, 1, 64, 4032, 4032, 4032, 704]
    - [0, 10.004]
  - - [64, 832, 1, 64, 64, 64, 64, 832]
    - [0, 1.803]
  - - [192, 832, 1, 64, 192, 192, 192, 832]
    - [0, 3.975]
  - - [320, 832, 1, 64, 320, 320, 320, 832]
    - [0, 5.48]
  - - [448, 832, 1, 64, 448, 448, 448, 832]
    - [0, 6.322]
  - - [576, 832, 1, 64, 576, 576, 576, 832]
    - [0, 6.945]
  - - [704, 832, 1, 64, 704, 704, 704, 832]
    - [0, 7.405]
  - - [832, 832, 1, 64, 832, 832, 832, 832]
    - [0, 7.743]
  - - [960, 832, 1, 64, 960, 960, 960, 832]
    - [0, 8.115]
  - - [1088, 832, 1, 64, 1088, 1088, 1088, 832]
    - [0, 8.35]
  - - [1216, 832, 1, 64, 1216, 1216, 1216, 832]
    - [0, 8.549]
  - - [1344, 832, 1, 64, 1344, 1344, 1344, 832]
    - [0, 8.772]
  - - [1472, 832, 1, 64, 1472, 1472, 1472, 832]
    - [0, 8.91]
  - - [1600, 832, 1, 64, 1600, 1600, 1600, 832]
    - [0, 9.071]
  - - [1728, 832, 1, 64, 1728, 1728, 1728, 832]
    - [0, 9.196]
  - - [1856, 832, 1, 64, 1856, 1856, 1856, 832]
    - [0, 9.282]
  - - [1984, 832, 1, 64, 1984, 1984, 1984, 832]
    - [0, 9.368]
  - - [2112, 832, 1, 64, 2112, 2112, 2112, 832]
    - [0, 9.47]
  - - [2240, 832, 1, 64, 2240, 2240, 2240, 832]
    - [0, 9.539]
  - - [2368, 832, 1, 64, 2368, 2368, 2368, 832]
    - [0, 9.595]
  - - [2496, 832, 1, 64, 2496, 2496, 2496, 832]
    - [0, 9.683]
  - - [2624, 832, 1, 64, 2624, 2624, 2624, 832]
    - [0, 9.724]
  - - [2752, 832, 1, 64, 2752, 2752, 2752, 832]
    - [0, 9.766]
  - - [2880, 832, 1, 64, 2880, 2880, 2880, 832]
    - [0, 9.834]
  - - [3008, 832, 1, 64, 3008, 3008, 3008, 832]
    - [0, 9.872]
  - - [3136, 832, 1, 64, 3136, 3136, 3136, 832]
    - [0, 9.905]
  - - [3264, 832, 1, 64, 3264, 3264, 3264, 832]
    - [0, 9.976]
  - - [3392, 832, 1, 64, 3392, 3392, 3392, 832]
    - [0, 9.985]
  - - [3520, 832, 1, 64, 3520, 3520, 3520, 832]
    - [0, 10.027]
  - - [3648, 832, 1, 64, 3648, 3648, 3648, 832]
    - [0, 10.076]
  - - [3776, 832, 1, 64, 3776, 3776, 3776, 832]
    - [0, 10.075]
  - - [3904, 832, 1, 64, 3904, 3904, 3904, 832]
    - [0, 10.101]
  - - [4032, 832, 1, 64, 4032, 4032, 4032, 832]
    - [0, 10.155]
  - - [64, 960, 1, 64, 64, 64, 64, 960]
    - [0, 2.071]
  - - [192, 960, 1, 64, 192, 192, 192, 960]
    - [0, 4.388]
  - - [320, 960, 1, 64, 320, 320, 320, 960]
    - [0, 6.064]
  - - [448, 960, 1, 64, 448, 448, 448, 960]
    - [0, 6.693]
  - - [576, 960, 1, 64, 576, 576, 576, 960]
    - [0, 7.296]
  - - [704, 960, 1, 64, 704, 704, 704, 960]
    - [0, 7.688]
  - - [832, 960, 1, 64, 832, 832, 832, 960]
    - [0, 8.06]
  - - [960, 960, 1, 64, 960, 960, 960, 960]
    - [0, 8.41]
  - - [1088, 960, 1, 64, 1088, 1088, 1088, 960]
    - [0, 8.63]
  - - [1216, 960, 1, 64, 1216, 1216, 1216, 960]
    - [0, 8.822]
  - - [1344, 960, 1, 64, 1344, 1344, 1344, 960]
    - [0, 9.007]
  - - [1472, 960, 1, 64, 1472, 1472, 1472, 960]
    - [0, 9.155]
  - - [1600, 960, 1, 64, 1600, 1600, 1600, 960]
    - [0, 9.274]
  - - [1728, 960, 1, 64, 1728, 1728, 1728, 960]
    - [0, 9.38]
  - - [1856, 960, 1, 64, 1856, 1856, 1856, 960]
    - [0, 9.484]
  - - [1984, 960, 1, 64, 1984, 1984, 1984, 960]
    - [0, 9.561]
  - - [2112, 960, 1, 64, 2112, 2112, 2112, 960]
    - [0, 9.633]
  - - [2240, 960, 1, 64, 2240, 2240, 2240, 960]
    - [0, 9.71]
  - - [2368, 960, 1, 64, 2368, 2368, 2368, 960]
    - [0, 9.763]
  - - [2496, 960, 1, 64, 2496, 2496, 2496, 960]
    - [0, 9.835]
  - - [2624, 960, 1, 64, 2624, 2624, 2624, 960]
    - [0, 9.891]
  - - [2752, 960, 1, 64, 2752, 2752, 2752, 960]
    - [0, 9.94]
  - - [2880, 960, 1, 64, 2880, 2880, 2880, 960]
    - [0, 9.992]
  - - [3008, 960, 1, 64, 3008, 3008, 3008, 960]
    - [0, 10.023]
  - - [3136, 960, 1, 64, 3136, 3136, 3136, 960]
    - [0, 10.052]
  - - [3264, 960, 1, 64, 3264, 3264, 3264, 960]
    - [0, 10.124]
  - - [3392, 960, 1, 64, 3392, 3392, 3392, 960]
    - [0, 10.128]
  - - [3520, 960, 1, 64, 3520, 3520, 3520, 960]
    - [0, 10.149]
  - - [3648, 960, 1, 64, 3648, 3648, 3648, 960]
    - [0, 10.2]
  - - [3776, 960, 1, 64, 3776, 3776, 3776, 960]
    - [0, 10.199]
  - - [3904, 960, 1, 64, 3904, 3904, 3904, 960]
    - [0, 9.427]
  - - [4032, 960, 1, 64, 4032, 4032, 4032, 960]
    - [0, 9.723]
  - - [64, 1088, 1, 64, 64, 64, 64, 1088]
    - [0, 2.243]
  - - [192, 1088, 1, 64, 192, 192, 192, 1088]
    - [0, 4.659]
  - - [320, 1088, 1, 64, 320, 320, 320, 1088]
    - [0, 6.147]
  - - [448, 1088, 1, 64, 448, 448, 448, 1088]
    - [0, 6.957]
  - - [576, 1088, 1, 64, 576, 576, 576, 1088]
    - [0, 7.508]
  - - [704, 1088, 1, 64, 704, 704, 704, 1088]
    - [0, 7.989]
  - - [832, 1088, 1, 64, 832, 832, 832, 1088]
    - [0, 8.345]
  - - [960, 1088, 1, 64, 960, 960, 960, 1088]
    - [0, 8.649]
  - - [1088, 1088, 1, 64, 1088, 1088, 1088, 1088]
    - [0, 8.852]
  - - [1216, 1088, 1, 64, 1216, 1216, 1216, 1088]
    - [0, 9.039]
  - - [1344, 1088, 1, 64, 1344, 1344, 1344, 1088]
    - [0, 9.206]
  - - [1472, 1088, 1, 64, 1472, 1472, 1472, 1088]
    - [0, 9.345]
  - - [1600, 1088, 1, 64, 1600, 1600, 1600, 1088]
    - [0, 9.46]
  - - [1728, 1088, 1, 64, 1728, 1728, 1728, 1088]
    - [0, 9.561]
  - - [1856, 1088, 1, 64, 1856, 1856, 1856, 1088]
    - [0, 9.636]
  - - [1984, 1088, 1, 64, 1984, 1984, 1984, 1088]
    - [0, 9.711]
  - - [2112, 1088, 1, 64, 2112, 2112, 2112, 1088]
    - [0, 9.807]
  - - [2240, 1088, 1, 64, 2240, 2240, 2240, 1088]
    - [0, 9.845]
  - - [2368, 1088, 1, 64, 2368, 2368, 2368, 1088]
    - [0, 9.893]
  - - [2496, 1088, 1, 64, 2496, 2496, 2496, 1088]
    - [0, 9.982]
  - - [2624, 1088, 1, 64, 2624, 2624, 2624, 1088]
    - [0, 9.994]
  - - [2752, 1088, 1, 64, 2752, 2752, 2752, 1088]
    - [0, 10.043]
  - - [2880, 1088, 1, 64, 2880, 2880, 2880, 1088]
    - [0, 10.095]
  - - [3008, 1088, 1, 64, 3008, 3008, 3008, 1088]
    - [0, 10.114]
  - - [3136, 1088, 1, 64, 3136, 3136, 3136, 1088]
    - [0, 10.164]
  - - [3264, 1088, 1, 64, 3264, 3264, 3264, 1088]
    - [0, 10.217]
  - - [3392, 1088, 1, 64, 3392, 3392, 3392, 1088]
    - [0, 9.29]
  - - [3520, 1088, 1, 64, 3520, 3520, 3520, 1088]
    - [0, 9.625]
  - - [3648, 1088, 1, 64, 3648, 3648, 3648, 1088]
    - [0, 9.803]
  - - [3776, 1088, 1, 64, 3776, 3776, 3776, 1088]
    - [0, 9.774]
  - - [3904, 1088, 1, 64, 3904, 3904, 3904, 1088]
    - [0, 9.832]
  - - [4032, 1088, 1, 64, 4032, 4032, 4032, 1088]
    - [0, 9.889]
  - - [64, 1216, 1, 64, 64, 64, 64, 1216]
    - [3, 1.429]
  - - [192, 1216, 1, 64, 192, 192, 192, 1216]
    - [1, 4.3]
  - - [320, 1216, 1, 64, 320, 320, 320, 1216]
    - [0, 6.528]
  - - [448, 1216, 1, 64, 448, 448, 448, 1216]
    - [0, 7.246]
  - - [576, 1216, 1, 64, 576, 576, 576, 1216]
    - [0, 7.784]
  - - [704, 1216, 1, 64, 704, 704, 704, 1216]
    - [0, 8.221]
  - - [832, 1216, 1, 64, 832, 832, 832, 1216]
    - [0, 8.555]
  - - [960, 1216, 1, 64, 960, 960, 960, 1216]
    - [0, 8.845]
  - - [1088, 1216, 1, 64, 1088, 1088, 1088, 1216]
    - [0, 9.03]
  - - [1216, 1216, 1, 64, 1216, 1216, 1216, 1216]
    - [0, 9.236]
  - - [1344, 1216, 1, 64, 1344, 1344, 1344, 1216]
    - [0, 9.372]
  - - [1472, 1216, 1, 64, 1472, 1472, 1472, 1216]
    - [0, 9.5]
  - - [1600, 1216, 1, 64, 1600, 1600, 1600, 1216]
    - [0, 9.612]
  - - [1728, 1216, 1, 64, 1728, 1728, 1728, 1216]
    - [0, 9.709]
  - - [1856, 1216, 1, 64, 1856, 1856, 1856, 1216]
    - [0, 9.771]
  - - [1984, 1216, 1, 64, 1984, 1984, 1984, 1216]
    - [0, 9.824]
  - - [2112, 1216, 1, 64, 2112, 2112, 2112, 1216]
    - [0, 9.914]
  - - [2240, 1216, 1, 64, 2240, 2240, 2240, 1216]
    - [0, 9.965]
  - - [2368, 1216, 1, 64, 2368, 2368, 2368, 1216]
    - [0, 10.012]
  - - [2496, 1216, 1, 64, 2496, 2496, 2496, 1216]
    - [0, 10.086]
  - - [2624, 1216, 1, 64, 2624, 2624, 2624, 1216]
    - [0, 10.094]
  - - [2752, 1216, 1, 64, 2752, 2752, 2752, 1216]
    - [0, 10.144]
  - - [2880, 1216, 1, 64, 2880, 2880, 2880, 1216]
    - [0, 10.206]
  - - [3008, 1216, 1, 64, 3008, 3008, 3008, 1216]
    - [0, 9.717]
  - - [3136, 1216, 1, 64, 3136, 3136, 3136, 1216]
    - [0, 9.584]
  - - [3264, 1216, 1, 64, 3264, 3264, 3264, 1216]
    - [0, 9.808]
  - - [3392, 1216, 1, 64, 3392, 3392, 3392, 1216]
    - [0, 9.797]
  - - [3520, 1216, 1, 64, 3520, 3520, 3520, 1216]
    - [0, 9.853]
  - - [3648, 1216, 1, 64, 3648, 3648, 3648, 1216]
    - [0, 9.91]
  - - [3776, 1216, 1, 64, 3776, 3776, 3776, 1216]
    - [0, 9.925]
  - - [3904, 1216, 1, 64, 3904, 3904, 3904, 1216]
    - [0, 9.957]
  - - [4032, 1216, 1, 64, 4032, 4032, 4032, 1216]
    - [0, 10.005]
  - - [64, 1344, 1, 64, 64, 64, 64, 1344]
    - [0, 2.758]
  - - [192, 1344, 1, 64, 192, 192, 192, 1344]
    - [0, 5.388]
  - - [320, 1344, 1, 64, 320, 320, 320, 1344]
    - [0, 6.664]
  - - [448, 1344, 1, 64, 448, 448, 448, 1344]
    - [0, 7.489]
  - - [576, 1344, 1, 64, 576, 576, 576, 1344]
    - [0, 8.015]
  - - [704, 1344, 1, 64, 704, 704, 704, 1344]
    - [0, 8.446]
  - - [832, 1344, 1, 64, 832, 832, 832, 1344]
    - [0, 8.76]
  - - [960, 1344, 1, 64, 960, 960, 960, 1344]
    - [0, 9.033]
  - - [1088, 1344, 1, 64, 1088, 1088, 1088, 1344]
    - [0, 9.205]
  - - [1216, 1344, 1, 64, 1216, 1216, 1216, 1344]
    - [0, 9.365]
  - - [1344, 1344, 1, 64, 1344, 1344, 1344, 1344]
    - [0, 9.528]
  - - [1472, 1344, 1, 64, 1472, 1472, 1472, 1344]
    - [0, 9.637]
  - - [1600, 1344, 1, 64, 1600, 1600, 1600, 1344]
    - [0, 9.739]
  - - [1728, 1344, 1, 64, 1728, 1728, 1728, 1344]
    - [0, 9.82]
  - - [1856, 1344, 1, 64, 1856, 1856, 1856, 1344]
    - [0, 9.881]
  - - [1984, 1344, 1, 64, 1984, 1984, 1984, 1344]
    - [0, 9.952]
  - - [2112, 1344, 1, 64, 2112, 2112, 2112, 1344]
    - [0, 10.026]
  - - [2240, 1344, 1, 64, 2240, 2240, 2240, 1344]
    - [0, 10.053]
  - - [2368, 1344, 1, 64, 2368, 2368, 2368, 1344]
    - [0, 10.101]
  - - [2496, 1344, 1, 64, 2496, 2496, 2496, 1344]
    - [0, 10.167]
  - - [2624, 1344, 1, 64, 2624, 2624, 2624, 1344]
    - [0, 10.192]
  - - [2752, 1344, 1, 64, 2752, 2752, 2752, 1344]
    - [0, 9.309]
  - - [2880, 1344, 1, 64, 2880, 2880, 2880, 1344]
    - [0, 9.725]
  - - [3008, 1344, 1, 64, 3008, 3008, 3008, 1344]
    - [0, 9.813]
  - - [3136, 1344, 1, 64, 3136, 3136, 3136, 1344]
    - [0, 9.823]
  - - [3264, 1344, 1, 64, 3264, 3264, 3264, 1344]
    - [0, 9.895]
  - - [3392, 1344, 1, 64, 3392, 3392, 3392, 1344]
    - [0, 9.916]
  - - [3520, 1344, 1, 64, 3520, 3520, 3520, 1344]
    - [0, 9.953]
  - - [3648, 1344, 1, 64, 3648, 3648, 3648, 1344]
    - [0, 9.999]
  - - [3776, 1344, 1, 64, 3776, 3776, 3776, 1344]
    - [0, 10.009]
  - - [3904, 1344, 1, 64, 3904, 3904, 3904, 1344]
    - [0, 10.05]
  - - [4032, 1344, 1, 64, 4032, 4032, 4032, 1344]
    - [0, 10.097]
  - - [64, 1472, 1, 64, 64, 64, 64, 1472]
    - [0, 2.912]
  - - [192, 1472, 1, 64, 192, 192, 192, 1472]
    - [0, 5.625]
  - - [320, 1472, 1, 64, 320, 320, 320, 1472]
    - [0, 6.849]
  - - [448, 1472, 1, 64, 448, 448, 448, 1472]
    - [0, 7.634]
  - - [576, 1472, 1, 64, 576, 576, 576, 1472]
    - [0, 8.223]
  - - [704, 1472, 1, 64, 704, 704, 704, 1472]
    - [0, 8.602]
  - - [832, 1472, 1, 64, 832, 832, 832, 1472]
    - [0, 8.908]
  - - [960, 1472, 1, 64, 960, 960, 960, 1472]
    - [0, 9.175]
  - - [1088, 1472, 1, 64, 1088, 1088, 1088, 1472]
    - [0, 9.341]
  - - [1216, 1472, 1, 64, 1216, 1216, 1216, 1472]
    - [0, 9.494]
  - - [1344, 1472, 1, 64, 1344, 1344, 1344, 1472]
    - [0, 9.64]
  - - [1472, 1472, 1, 64, 1472, 1472, 1472, 1472]
    - [0, 9.737]
  - - [1600, 1472, 1, 64, 1600, 1600, 1600, 1472]
    - [0, 9.836]
  - - [1728, 1472, 1, 64, 1728, 1728, 1728, 1472]
    - [0, 9.914]
  - - [1856, 1472, 1, 64, 1856, 1856, 1856, 1472]
    - [0, 9.968]
  - - [1984, 1472, 1, 64, 1984, 1984, 1984, 1472]
    - [0, 10.031]
  - - [2112, 1472, 1, 64, 2112, 2112, 2112, 1472]
    - [0, 10.109]
  - - [2240, 1472, 1, 64, 2240, 2240, 2240, 1472]
    - [0, 10.142]
  - - [2368, 1472, 1, 64, 2368, 2368, 2368, 1472]
    - [0, 10.177]
  - - [2496, 1472, 1, 64, 2496, 2496, 2496, 1472]
    - [0, 9.297]
  - - [2624, 1472, 1, 64, 2624, 2624, 2624, 1472]
    - [0, 9.704]
  - - [2752, 1472, 1, 64, 2752, 2752, 2752, 1472]
    - [0, 9.803]
  - - [2880, 1472, 1, 64, 2880, 2880, 2880, 1472]
    - [0, 9.855]
  - - [3008, 1472, 1, 64, 3008, 3008, 3008, 1472]
    - [0, 9.877]
  - - [3136, 1472, 1, 64, 3136, 3136, 3136, 1472]
    - [0, 9.932]
  - - [3264, 1472, 1, 64, 3264, 3264, 3264, 1472]
    - [0, 9.994]
  - - [3392, 1472, 1, 64, 3392, 3392, 3392, 1472]
    - [0, 10.006]
  - - [3520, 1472, 1, 64, 3520, 3520, 3520, 1472]
    - [0, 10.034]
  - - [3648, 1472, 1, 64, 3648, 3648, 3648, 1472]
    - [0, 10.095]
  - - [3776, 1472, 1, 64, 3776, 3776, 3776, 1472]
    - [0, 10.099]
  - - [3904, 1472, 1, 64, 3904, 3904, 3904, 1472]
    - [0, 10.119]
  - - [4032, 1472, 1, 64, 4032, 4032, 4032, 1472]
    - [0, 10.18]
  - - [64, 1600, 1, 64, 64, 64, 64, 1600]
    - [0, 3.137]
  - - [192, 1600, 1, 64, 192, 192, 192, 1600]
    - [0, 6.043]
  - - [320, 1600, 1, 64, 320, 320, 320, 1600]
    - [0, 7.109]
  - - [448, 1600, 1, 64, 448, 448, 448, 1600]
    - [0, 7.84]
  - - [576, 1600, 1, 64, 576, 576, 576, 1600]
    - [0, 8.423]
  - - [704, 1600, 1, 64, 704, 704, 704, 1600]
    - [0, 8.766]
  - - [832, 1600, 1, 64, 832, 832, 832, 1600]
    - [0, 9.055]
  - - [960, 1600, 1, 64, 960, 960, 960, 1600]
    - [0, 9.293]
  - - [1088, 1600, 1, 64, 1088, 1088, 1088, 1600]
    - [0, 9.465]
  - - [1216, 1600, 1, 64, 1216, 1216, 1216, 1600]
    - [0, 9.61]
  - - [1344, 1600, 1, 64, 1344, 1344, 1344, 1600]
    - [0, 9.745]
  - - [1472, 1600, 1, 64, 1472, 1472, 1472, 1600]
    - [0, 9.846]
  - - [1600, 1600, 1, 64, 1600, 1600, 1600, 1600]
    - [0, 9.918]
  - - [1728, 1600, 1, 64, 1728, 1728, 1728, 1600]
    - [0, 10.005]
  - - [1856, 1600, 1, 64, 1856, 1856, 1856, 1600]
    - [0, 10.054]
  - - [1984, 1600, 1, 64, 1984, 1984, 1984, 1600]
    - [0, 10.11]
  - - [2112, 1600, 1, 64, 2112, 2112, 2112, 1600]
    - [0, 10.192]
  - - [2240, 1600, 1, 64, 2240, 2240, 2240, 1600]
    - [0, 10.206]
  - - [2368, 1600, 1, 64, 2368, 2368, 2368, 1600]
    - [0, 9.524]
  - - [2496, 1600, 1, 64, 2496, 2496, 2496, 1600]
    - [0, 9.814]
  - - [2624, 1600, 1, 64, 2624, 2624, 2624, 1600]
    - [0, 9.81]
  - - [2752, 1600, 1, 64, 2752, 2752, 2752, 1600]
    - [0, 9.88]
  - - [2880, 1600, 1, 64, 2880, 2880, 2880, 1600]
    - [0, 9.95]
  - - [3008, 1600, 1, 64, 3008, 3008, 3008, 1600]
    - [0, 9.972]
  - - [3136, 1600, 1, 64, 3136, 3136, 3136, 1600]
    - [0, 10.004]
  - - [3264, 1600, 1, 64, 3264, 3264, 3264, 1600]
    - [0, 10.069]
  - - [3392, 1600, 1, 64, 3392, 3392, 3392, 1600]
    - [0, 10.088]
  - - [3520, 1600, 1, 64, 3520, 3520, 3520, 1600]
    - [0, 10.109]
  - - [3648, 1600, 1, 64, 3648, 3648, 3648, 1600]
    - [0, 10.158]
  - - [3776, 1600, 1, 64, 3776, 3776, 3776, 1600]
    - [0, 10.166]
  - - [3904, 1600, 1, 64, 3904, 3904, 3904, 1600]
    - [0, 10.197]
  - - [4032, 1600, 1, 64, 4032, 4032, 4032, 1600]
    - [0, 10.244]
  - - [64, 1728, 1, 64, 64, 64, 64, 1728]
    - [0, 3.387]
  - - [192, 1728, 1, 64, 192, 192, 192, 1728]
    - [0, 6.026]
  - - [320, 1728, 1, 64, 320, 320, 320, 1728]
    - [0, 7.284]
  - - [448, 1728, 1, 64, 448, 448, 448, 1728]
    - [0, 7.967]
  - - [576, 1728, 1, 64, 576, 576, 576, 1728]
    - [0, 8.562]
  - - [704, 1728, 1, 64, 704, 704, 704, 1728]
    - [0, 8.911]
  - - [832, 1728, 1, 64, 832, 832, 832, 1728]
    - [0, 9.174]
  - - [960, 1728, 1, 64, 960, 960, 960, 1728]
    - [0, 9.418]
  - - [1088, 1728, 1, 64, 1088, 1088, 1088, 1728]
    - [0, 9.556]
  - - [1216, 1728, 1, 64, 1216, 1216, 1216, 1728]
    - [0, 9.701]
  - - [1344, 1728, 1, 64, 1344, 1344, 1344, 1728]
    - [0, 9.829]
  - - [1472, 1728, 1, 64, 1472, 1472, 1472, 1728]
    - [0, 9.912]
  - - [1600, 1728, 1, 64, 1600, 1600, 1600, 1728]
    - [0, 10.002]
  - - [1728, 1728, 1, 64, 1728, 1728, 1728, 1728]
    - [0, 10.076]
  - - [1856, 1728, 1, 64, 1856, 1856, 1856, 1728]
    - [0, 10.124]
  - - [1984, 1728, 1, 64, 1984, 1984, 1984, 1728]
    - [0, 10.175]
  - - [2112, 1728, 1, 64, 2112, 2112, 2112, 1728]
    - [0, 10.245]
  - - [2240, 1728, 1, 64, 2240, 2240, 2240, 1728]
    - [0, 9.722]
  - - [2368, 1728, 1, 64, 2368, 2368, 2368, 1728]
    - [0, 9.773]
  - - [2496, 1728, 1, 64, 2496, 2496, 2496, 1728]
    - [0, 9.878]
  - - [2624, 1728, 1, 64, 2624, 2624, 2624, 1728]
    - [0, 9.922]
  - - [2752, 1728, 1, 64, 2752, 2752, 2752, 1728]
    - [0, 9.962]
  - - [2880, 1728, 1, 64, 2880, 2880, 2880, 1728]
    - [0, 10.022]
  - - [3008, 1728, 1, 64, 3008, 3008, 3008, 1728]
    - [0, 10.034]
  - - [3136, 1728, 1, 64, 3136, 3136, 3136, 1728]
    - [0, 10.086]
  - - [3264, 1728, 1, 64, 3264, 3264, 3264, 1728]
    - [0, 10.146]
  - - [3392, 1728, 1, 64, 3392, 3392, 3392, 1728]
    - [0, 10.142]
  - - [3520, 1728, 1, 64, 3520, 3520, 3520, 1728]
    - [0, 10.181]
  - - [3648, 1728, 1, 64, 3648, 3648, 3648, 1728]
    - [0, 10.227]
  - - [3776, 1728, 1, 64, 3776, 3776, 3776, 1728]
    - [0, 10.23]
  - - [3904, 1728, 1, 64, 3904, 3904, 3904, 1728]
    - [0, 10.247]
  - - [4032, 1728, 1, 64, 4032, 4032, 4032, 1728]
    - [0, 10.306]
  - - [64, 1856, 1, 64, 64, 64, 64, 1856]
    - [0, 3.62]
  - - [192, 1856, 1, 64, 192, 192, 192, 1856]
    - [0, 6.239]
  - - [320, 1856, 1, 64, 320, 320, 320, 1856]
    - [0, 7.421]
  - - [448, 1856, 1, 64, 448, 448, 448, 1856]
    - [0, 8.167]
  - - [576, 1856, 1, 64, 576, 576, 576, 1856]
    - [0, 8.697]
  - - [704, 1856, 1, 64, 704, 704, 704, 1856]
    - [0, 9.023]
  - - [832, 1856, 1, 64, 832, 832, 832, 1856]
    - [0, 9.294]
  - - [960, 1856, 1, 64, 960, 960, 960, 1856]
    - [0, 9.522]
  - - [1088, 1856, 1, 64, 1088, 1088, 1088, 1856]
    - [0, 9.654]
  - - [1216, 1856, 1, 64, 1216, 1216, 1216, 1856]
    - [0, 9.775]
  - - [1344, 1856, 1, 64, 1344, 1344, 1344, 1856]
    - [0, 9.909]
  - - [1472, 1856, 1, 64, 1472, 1472, 1472, 1856]
    - [0, 9.989]
  - - [1600, 1856, 1, 64, 1600, 1600, 1600, 1856]
    - [0, 10.079]
  - - [1728, 1856, 1, 64, 1728, 1728, 1728, 1856]
    - [0, 10.141]
  - - [1856, 1856, 1, 64, 1856, 1856, 1856, 1856]
    - [0, 10.186]
  - - [1984, 1856, 1, 64, 1984, 1984, 1984, 1856]
    - [0, 9.27]
  - - [2112, 1856, 1, 64, 2112, 2112, 2112, 1856]
    - [0, 9.804]
  - - [2240, 1856, 1, 64, 2240, 2240, 2240, 1856]
    - [0, 9.817]
  - - [2368, 1856, 1, 64, 2368, 2368, 2368, 1856]
    - [0, 9.876]
  - - [2496, 1856, 1, 64, 2496, 2496, 2496, 1856]
    - [0, 9.953]
  - - [2624, 1856, 1, 64, 2624, 2624, 2624, 1856]
    - [0, 9.984]
  - - [2752, 1856, 1, 64, 2752, 2752, 2752, 1856]
    - [0, 10.036]
  - - [2880, 1856, 1, 64, 2880, 2880, 2880, 1856]
    - [0, 10.088]
  - - [3008, 1856, 1, 64, 3008, 3008, 3008, 1856]
    - [0, 10.104]
  - - [3136, 1856, 1, 64, 3136, 3136, 3136, 1856]
    - [0, 10.141]
  - - [3264, 1856, 1, 64, 3264, 3264, 3264, 1856]
    - [0, 10.205]
  - - [3392, 1856, 1, 64, 3392, 3392, 3392, 1856]
    - [0, 10.201]
  - - [3520, 1856, 1, 64, 3520, 3520, 3520, 1856]
    - [0, 10.218]
  - - [3648, 1856, 1, 64, 3648, 3648, 3648, 1856]
    - [0, 10.279]
  - - [3776, 1856, 1, 64, 3776, 3776, 3776, 1856]
    - [0, 10.27]
  - - [3904, 1856, 1, 64, 3904, 3904, 3904, 1856]
    - [0, 10.311]
  - - [4032, 1856, 1, 64, 4032, 4032, 4032, 1856]
    - [0, 10.343]
  - - [64, 1984, 1, 64, 64, 64, 64, 1984]
    - [2, 2.333]
  - - [192, 1984, 1, 64, 192, 192, 192, 1984]
    - [0, 6.373]
  - - [320, 1984, 1, 64, 320, 320, 320, 1984]
    - [0, 7.542]
  - - [448, 1984, 1, 64, 448, 448, 448, 1984]
    - [0, 8.299]
  - - [576, 1984, 1, 64, 576, 576, 576, 1984]
    - [0, 8.82]
  - - [704, 1984, 1, 64, 704, 704, 704, 1984]
    - [0, 9.136]
  - - [832, 1984, 1, 64, 832, 832, 832, 1984]
    - [0, 9.395]
  - - [960, 1984, 1, 64, 960, 960, 960, 1984]
    - [0, 9.618]
  - - [1088, 1984, 1, 64, 1088, 1088, 1088, 1984]
    - [0, 9.741]
  - - [1216, 1984, 1, 64, 1216, 1216, 1216, 1984]
    - [0, 9.864]
  - - [1344, 1984, 1, 64, 1344, 1344, 1344, 1984]
    - [0, 9.972]
  - - [1472, 1984, 1, 64, 1472, 1472, 1472, 1984]
    - [0, 10.06]
  - - [1600, 1984, 1, 64, 1600, 1600, 1600, 1984]
    - [0, 10.145]
  - - [1728, 1984, 1, 64, 1728, 1728, 1728, 1984]
    - [0, 10.195]
  - - [1856, 1984, 1, 64, 1856, 1856, 1856, 1984]
    - [0, 9.268]
  - - [1984, 1984, 1, 64, 1984, 1984, 1984, 1984]
    - [0, 9.805]
  - - [2112, 1984, 1, 64, 2112, 2112, 2112, 1984]
    - [0, 9.845]
  - - [2240, 1984, 1, 64, 2240, 2240, 2240, 1984]
    - [0, 9.9]
  - - [2368, 1984, 1, 64, 2368, 2368, 2368, 1984]
    - [0, 9.937]
  - - [2496, 1984, 1, 64, 2496, 2496, 2496, 1984]
    - [0, 10.019]
  - - [2624, 1984, 1, 64, 2624, 2624, 2624, 1984]
    - [0, 10.057]
  - - [2752, 1984, 1, 64, 2752, 2752, 2752, 1984]
    - [0, 10.088]
  - - [2880, 1984, 1, 64, 2880, 2880, 2880, 1984]
    - [0, 10.157]
  - - [3008, 1984, 1, 64, 3008, 3008, 3008, 1984]
    - [0, 10.156]
  - - [3136, 1984, 1, 64, 3136, 3136, 3136, 1984]
    - [0, 10.199]
  - - [3264, 1984, 1, 64, 3264, 3264, 3264, 1984]
    - [0, 10.255]
  - - [3392, 1984, 1, 64, 3392, 3392, 3392, 1984]
    - [0, 10.268]
  - - [3520, 1984, 1, 64, 3520, 3520, 3520, 1984]
    - [0, 10.281]
  - - [3648, 1984, 1, 64, 3648, 3648, 3648, 1984]
    - [0, 10.329]
  - - [3776, 1984, 1, 64, 3776, 3776, 3776, 1984]
    - [0, 10.329]
  - - [3904, 1984, 1, 64, 3904, 3904, 3904, 1984]
    - [0, 10.336]
  - - [4032, 1984, 1, 64, 4032, 4032, 4032, 1984]
    - [0, 10.384]
  - - [64, 2112, 1, 64, 64, 64, 64, 2112]
    - [0, 3.934]
  - - [192, 2112, 1, 64, 192, 192, 192, 2112]
    - [0, 6.5]
  - - [320, 2112, 1, 64, 320, 320, 320, 2112]
    - [0, 7.722]
  - - [448, 2112, 1, 64, 448, 448, 448, 2112]
    - [0, 8.446]
  - - [576, 2112, 1, 64, 576, 576, 576, 2112]
    - [0, 8.929]
  - - [704, 2112, 1, 64, 704, 704, 704, 2112]
    - [0, 9.228]
  - - [832, 2112, 1, 64, 832, 832, 832, 2112]
    - [0, 9.482]
  - - [960, 2112, 1, 64, 960, 960, 960, 2112]
    - [0, 9.688]
  - - [1088, 2112, 1, 64, 1088, 1088, 1088, 2112]
    - [0, 9.798]
  - - [1216, 2112, 1, 64, 1216, 1216, 1216, 2112]
    - [0, 9.92]
  - - [1344, 2112, 1, 64, 1344, 1344, 1344, 2112]
    - [0, 10.045]
  - - [1472, 2112, 1, 64, 1472, 1472, 1472, 2112]
    - [0, 10.117]
  - - [1600, 2112, 1, 64, 1600, 1600, 1600, 2112]
    - [0, 10.194]
  - - [1728, 2112, 1, 64, 1728, 1728, 1728, 2112]
    - [0, 10.238]
  - - [1856, 2112, 1, 64, 1856, 1856, 1856, 2112]
    - [0, 9.786]
  - - [1984, 2112, 1, 64, 1984, 1984, 1984, 2112]
    - [0, 9.829]
  - - [2112, 2112, 1, 64, 2112, 2112, 2112, 2112]
    - [0, 9.922]
  - - [2240, 2112, 1, 64, 2240, 2240, 2240, 2112]
    - [0, 9.966]
  - - [2368, 2112, 1, 64, 2368, 2368, 2368, 2112]
    - [0, 10.003]
  - - [2496, 2112, 1, 64, 2496, 2496, 2496, 2112]
    - [0, 10.076]
  - - [2624, 2112, 1, 64, 2624, 2624, 2624, 2112]
    - [0, 10.101]
  - - [2752, 2112, 1, 64, 2752, 2752, 2752, 2112]
    - [0, 10.143]
  - - [2880, 2112, 1, 64, 2880, 2880, 2880, 2112]
    - [0, 10.197]
  - - [3008, 2112, 1, 64, 3008, 3008, 3008, 2112]
    - [0, 10.209]
  - - [3136, 2112, 1, 64, 3136, 3136, 3136, 2112]
    - [0, 10.238]
  - - [3264, 2112, 1, 64, 3264, 3264, 3264, 2112]
    - [0, 10.302]
  - - [3392, 2112, 1, 64, 3392, 3392, 3392, 2112]
    - [0, 10.298]
  - - [3520, 2112, 1, 64, 3520, 3520, 3520, 2112]
    - [0, 10.319]
  - - [3648, 2112, 1, 64, 3648, 3648, 3648, 2112]
    - [0, 10.36]
  - - [3776, 2112, 1, 64, 3776, 3776, 3776, 2112]
    - [0, 10.346]
  - - [3904, 2112, 1, 64, 3904, 3904, 3904, 2112]
    - [0, 9.901]
  - - [4032, 2112, 1, 64, 4032, 4032, 4032, 2112]
    - [0, 9.643]
  - - [64, 2240, 1, 64, 64, 64, 64, 2240]
    - [0, 4.149]
  - - [192, 2240, 1, 64, 192, 192, 192, 2240]
    - [0, 6.681]
  - - [320, 2240, 1, 64, 320, 320, 320, 2240]
    - [0, 7.837]
  - - [448, 2240, 1, 64, 448, 448, 448, 2240]
    - [0, 8.547]
  - - [576, 2240, 1, 64, 576, 576, 576, 2240]
    - [0, 9.038]
  - - [704, 2240, 1, 64, 704, 704, 704, 2240]
    - [0, 9.325]
  - - [832, 2240, 1, 64, 832, 832, 832, 2240]
    - [0, 9.568]
  - - [960, 2240, 1, 64, 960, 960, 960, 2240]
    - [0, 9.764]
  - - [1088, 2240, 1, 64, 1088, 1088, 1088, 2240]
    - [0, 9.879]
  - - [1216, 2240, 1, 64, 1216, 1216, 1216, 2240]
    - [0, 9.988]
  - - [1344, 2240, 1, 64, 1344, 1344, 1344, 2240]
    - [0, 10.088]
  - - [1472, 2240, 1, 64, 1472, 1472, 1472, 2240]
    - [0, 10.165]
  - - [1600, 2240, 1, 64, 1600, 1600, 1600, 2240]
    - [0, 10.233]
  - - [1728, 2240, 1, 64, 1728, 1728, 1728, 2240]
    - [0, 9.724]
  - - [1856, 2240, 1, 64, 1856, 1856, 1856, 2240]
    - [0, 9.813]
  - - [1984, 2240, 1, 64, 1984, 1984, 1984, 2240]
    - [0, 9.895]
  - - [2112, 2240, 1, 64, 2112, 2112, 2112, 2240]
    - [0, 9.986]
  - - [2240, 2240, 1, 64, 2240, 2240, 2240, 2240]
    - [0, 10.02]
  - - [2368, 2240, 1, 64, 2368, 2368, 2368, 2240]
    - [0, 10.054]
  - - [2496, 2240, 1, 64, 2496, 2496, 2496, 2240]
    - [0, 10.126]
  - - [2624, 2240, 1, 64, 2624, 2624, 2624, 2240]
    - [0, 10.163]
  - - [2752, 2240, 1, 64, 2752, 2752, 2752, 2240]
    - [0, 10.197]
  - - [2880, 2240, 1, 64, 2880, 2880, 2880, 2240]
    - [0, 10.233]
  - - [3008, 2240, 1, 64, 3008, 3008, 3008, 2240]
    - [0, 10.261]
  - - [3136, 2240, 1, 64, 3136, 3136, 3136, 2240]
    - [0, 10.29]
  - - [3264, 2240, 1, 64, 3264, 3264, 3264, 2240]
    - [0, 10.346]
  - - [3392, 2240, 1, 64, 3392, 3392, 3392, 2240]
    - [0, 10.342]
  - - [3520, 2240, 1, 64, 3520, 3520, 3520, 2240]
    - [0, 10.352]
  - - [3648, 2240, 1, 64, 3648, 3648, 3648, 2240]
    - [0, 10.13]
  - - [3776, 2240, 1, 64, 3776, 3776, 3776, 2240]
    - [0, 9.608]
  - - [3904, 2240, 1, 64, 3904, 3904, 3904, 2240]
    - [0, 9.354]
  - - [4032, 2240, 1, 64, 4032, 4032, 4032, 2240]
    - [0, 9.135]
  - - [64, 2368, 1, 64, 64, 64, 64, 2368]
    - [0, 4.401]
  - - [192, 2368, 1, 64, 192, 192, 192, 2368]
    - [0, 6.847]
  - - [320, 2368, 1, 64, 320, 320, 320, 2368]
    - [0, 7.998]
  - - [448, 2368, 1, 64, 448, 448, 448, 2368]
    - [0, 8.678]
  - - [576, 2368, 1, 64, 576, 576, 576, 2368]
    - [0, 9.124]
  - - [704, 2368, 1, 64, 704, 704, 704, 2368]
    - [0, 9.417]
  - - [832, 2368, 1, 64, 832, 832, 832, 2368]
    - [0, 9.631]
  - - [960, 2368, 1, 64, 960, 960, 960, 2368]
    - [0, 9.822]
  - - [1088, 2368, 1, 64, 1088, 1088, 1088, 2368]
    - [0, 9.933]
  - - [1216, 2368, 1, 64, 1216, 1216, 1216, 2368]
    - [0, 10.042]
  - - [1344, 2368, 1, 64, 1344, 1344, 1344, 2368]
    - [0, 10.148]
  - - [1472, 2368, 1, 64, 1472, 1472, 1472, 2368]
    - [0, 10.216]
  - - [1600, 2368, 1, 64, 1600, 1600, 1600, 2368]
    - [0, 9.524]
  - - [1728, 2368, 1, 64, 1728, 1728, 1728, 2368]
    - [0, 9.803]
  - - [1856, 2368, 1, 64, 1856, 1856, 1856, 2368]
    - [0, 9.896]
  - - [1984, 2368, 1, 64, 1984, 1984, 1984, 2368]
    - [0, 9.962]
  - - [2112, 2368, 1, 64, 2112, 2112, 2112, 2368]
    - [0, 10.031]
  - - [2240, 2368, 1, 64, 2240, 2240, 2240, 2368]
    - [0, 10.07]
  - - [2368, 2368, 1, 64, 2368, 2368, 2368, 2368]
    - [0, 10.106]
  - - [2496, 2368, 1, 64, 2496, 2496, 2496, 2368]
    - [0, 10.168]
  - - [2624, 2368, 1, 64, 2624, 2624, 2624, 2368]
    - [0, 10.183]
  - - [2752, 2368, 1, 64, 2752, 2752, 2752, 2368]
    - [0, 10.226]
  - - [2880, 2368, 1, 64, 2880, 2880, 2880, 2368]
    - [0, 10.288]
  - - [3008, 2368, 1, 64, 3008, 3008, 3008, 2368]
    - [0, 10.299]
  - - [3136, 2368, 1, 64, 3136, 3136, 3136, 2368]
    - [0, 10.326]
  - - [3264, 2368, 1, 64, 3264, 3264, 3264, 2368]
    - [0, 10.363]
  - - [3392, 2368, 1, 64, 3392, 3392, 3392, 2368]
    - [0, 10.371]
  - - [3520, 2368, 1, 64, 3520, 3520, 3520, 2368]
    - [0, 9.771]
  - - [3648, 2368, 1, 64, 3648, 3648, 3648, 2368]
    - [0, 9.567]
  - - [3776, 2368, 1, 64, 3776, 3776, 3776, 2368]
    - [0, 9.053]
  - - [3904, 2368, 1, 64, 3904, 3904, 3904, 2368]
    - [0, 8.855]
  - - [4032, 2368, 1, 64, 4032, 4032, 4032, 2368]
    - [0, 8.637]
  - - [64, 2496, 1, 64, 64, 64, 64, 2496]
    - [0, 3.998]
  - - [192, 2496, 1, 64, 192, 192, 192, 2496]
    - [0, 6.871]
  - - [320, 2496, 1, 64, 320, 320, 320, 2496]
    - [0, 8.077]
  - - [448, 2496, 1, 64, 448, 448, 448, 2496]
    - [0, 8.772]
  - - [576, 2496, 1, 64, 576, 576, 576, 2496]
    - [0, 9.211]
  - - [704, 2496, 1, 64, 704, 704, 704, 2496]
    - [0, 9.475]
  - - [832, 2496, 1, 64, 832, 832, 832, 2496]
    - [0, 9.703]
  - - [960, 2496, 1, 64, 960, 960, 960, 2496]
    - [0, 9.889]
  - - [1088, 2496, 1, 64, 1088, 1088, 1088, 2496]
    - [0, 9.999]
  - - [1216, 2496, 1, 64, 1216, 1216, 1216, 2496]
    - [0, 10.081]
  - - [1344, 2496, 1, 64, 1344, 1344, 1344, 2496]
    - [0, 10.185]
  - - [1472, 2496, 1, 64, 1472, 1472, 1472, 2496]
    - [0, 9.926]
  - - [1600, 2496, 1, 64, 1600, 1600, 1600, 2496]
    - [0, 9.833]
  - - [1728, 2496, 1, 64, 1728, 1728, 1728, 2496]
    - [0, 9.888]
  - - [1856, 2496, 1, 64, 1856, 1856, 1856, 2496]
    - [0, 9.944]
  - - [1984, 2496, 1, 64, 1984, 1984, 1984, 2496]
    - [0, 9.996]
  - - [2112, 2496, 1, 64, 2112, 2112, 2112, 2496]
    - [0, 10.072]
  - - [2240, 2496, 1, 64, 2240, 2240, 2240, 2496]
    - [0, 10.115]
  - - [2368, 2496, 1, 64, 2368, 2368, 2368, 2496]
    - [0, 10.157]
  - - [2496, 2496, 1, 64, 2496, 2496, 2496, 2496]
    - [0, 10.217]
  - - [2624, 2496, 1, 64, 2624, 2624, 2624, 2496]
    - [0, 10.231]
  - - [2752, 2496, 1, 64, 2752, 2752, 2752, 2496]
    - [0, 10.274]
  - - [2880, 2496, 1, 64, 2880, 2880, 2880, 2496]
    - [0, 10.319]
  - - [3008, 2496, 1, 64, 3008, 3008, 3008, 2496]
    - [0, 10.326]
  - - [3136, 2496, 1, 64, 3136, 3136, 3136, 2496]
    - [0, 10.357]
  - - [3264, 2496, 1, 64, 3264, 3264, 3264, 2496]
    - [0, 10.399]
  - - [3392, 2496, 1, 64, 3392, 3392, 3392, 2496]
    - [0, 9.644]
  - - [3520, 2496, 1, 64, 3520, 3520, 3520, 2496]
    - [0, 9.358]
  - - [3648, 2496, 1, 64, 3648, 3648, 3648, 2496]
    - [0, 8.926]
  - - [3776, 2496, 1, 64, 3776, 3776, 3776, 2496]
    - [0, 8.543]
  - - [3904, 2496, 1, 64, 3904, 3904, 3904, 2496]
    - [0, 8.633]
  - - [4032, 2496, 1, 64, 4032, 4032, 4032, 2496]
    - [0, 8.652]
  - - [64, 2624, 1, 64, 64, 64, 64, 2624]
    - [0, 4.168]
  - - [192, 2624, 1, 64, 192, 192, 192, 2624]
    - [0, 7.033]
  - - [320, 2624, 1, 64, 320, 320, 320, 2624]
    - [0, 8.178]
  - - [448, 2624, 1, 64, 448, 448, 448, 2624]
    - [0, 8.854]
  - - [576, 2624, 1, 64, 576, 576, 576, 2624]
    - [0, 9.3]
  - - [704, 2624, 1, 64, 704, 704, 704, 2624]
    - [0, 9.547]
  - - [832, 2624, 1, 64, 832, 832, 832, 2624]
    - [0, 9.763]
  - - [960, 2624, 1, 64, 960, 960, 960, 2624]
    - [0, 9.936]
  - - [1088, 2624, 1, 64, 1088, 1088, 1088, 2624]
    - [0, 10.035]
  - - [1216, 2624, 1, 64, 1216, 1216, 1216, 2624]
    - [0, 10.128]
  - - [1344, 2624, 1, 64, 1344, 1344, 1344, 2624]
    - [0, 10.236]
  - - [1472, 2624, 1, 64, 1472, 1472, 1472, 2624]
    - [0, 9.704]
  - - [1600, 2624, 1, 64, 1600, 1600, 1600, 2624]
    - [0, 9.849]
  - - [1728, 2624, 1, 64, 1728, 1728, 1728, 2624]
    - [0, 9.946]
  - - [1856, 2624, 1, 64, 1856, 1856, 1856, 2624]
    - [0, 9.998]
  - - [1984, 2624, 1, 64, 1984, 1984, 1984, 2624]
    - [0, 10.06]
  - - [2112, 2624, 1, 64, 2112, 2112, 2112, 2624]
    - [0, 10.123]
  - - [2240, 2624, 1, 64, 2240, 2240, 2240, 2624]
    - [0, 10.159]
  - - [2368, 2624, 1, 64, 2368, 2368, 2368, 2624]
    - [0, 10.199]
  - - [2496, 2624, 1, 64, 2496, 2496, 2496, 2624]
    - [0, 10.262]
  - - [2624, 2624, 1, 64, 2624, 2624, 2624, 2624]
    - [0, 10.274]
  - - [2752, 2624, 1, 64, 2752, 2752, 2752, 2624]
    - [0, 10.309]
  - - [2880, 2624, 1, 64, 2880, 2880, 2880, 2624]
    - [0, 10.349]
  - - [3008, 2624, 1, 64, 3008, 3008, 3008, 2624]
    - [0, 10.35]
  - - [3136, 2624, 1, 64, 3136, 3136, 3136, 2624]
    - [0, 9.931]
  - - [3264, 2624, 1, 64, 3264, 3264, 3264, 2624]
    - [0, 9.534]
  - - [3392, 2624, 1, 64, 3392, 3392, 3392, 2624]
    - [0, 9.301]
  - - [3520, 2624, 1, 64, 3520, 3520, 3520, 2624]
    - [0, 8.832]
  - - [3648, 2624, 1, 64, 3648, 3648, 3648, 2624]
    - [0, 8.536]
  - - [3776, 2624, 1, 64, 3776, 3776, 3776, 2624]
    - [0, 8.556]
  - - [3904, 2624, 1, 64, 3904, 3904, 3904, 2624]
    - [0, 8.678]
  - - [4032, 2624, 1, 64, 4032, 4032, 4032, 2624]
    - [0, 8.68]
  - - [64, 2752, 1, 64, 64, 64, 64, 2752]
    - [0, 4.343]
  - - [192, 2752, 1, 64, 192, 192, 192, 2752]
    - [0, 7.178]
  - - [320, 2752, 1, 64, 320, 320, 320, 2752]
    - [0, 8.299]
  - - [448, 2752, 1, 64, 448, 448, 448, 2752]
    - [0, 8.925]
  - - [576, 2752, 1, 64, 576, 576, 576, 2752]
    - [0, 9.351]
  - - [704, 2752, 1, 64, 704, 704, 704, 2752]
    - [0, 9.615]
  - - [832, 2752, 1, 64, 832, 832, 832, 2752]
    - [0, 9.809]
  - - [960, 2752, 1, 64, 960, 960, 960, 2752]
    - [0, 9.978]
  - - [1088, 2752, 1, 64, 1088, 1088, 1088, 2752]
    - [0, 10.084]
  - - [1216, 2752, 1, 64, 1216, 1216, 1216, 2752]
    - [0, 10.167]
  - - [1344, 2752, 1, 64, 1344, 1344, 1344, 2752]
    - [0, 9.31]
  - - [1472, 2752, 1, 64, 1472, 1472, 1472, 2752]
    - [0, 9.841]
  - - [1600, 2752, 1, 64, 1600, 1600, 1600, 2752]
    - [0, 9.905]
  - - [1728, 2752, 1, 64, 1728, 1728, 1728, 2752]
    - [0, 9.993]
  - - [1856, 2752, 1, 64, 1856, 1856, 1856, 2752]
    - [0, 10.046]
  - - [1984, 2752, 1, 64, 1984, 1984, 1984, 2752]
    - [0, 10.095]
  - - [2112, 2752, 1, 64, 2112, 2112, 2112, 2752]
    - [0, 10.172]
  - - [2240, 2752, 1, 64, 2240, 2240, 2240, 2752]
    - [0, 10.195]
  - - [2368, 2752, 1, 64, 2368, 2368, 2368, 2752]
    - [0, 10.234]
  - - [2496, 2752, 1, 64, 2496, 2496, 2496, 2752]
    - [0, 10.294]
  - - [2624, 2752, 1, 64, 2624, 2624, 2624, 2752]
    - [0, 10.3]
  - - [2752, 2752, 1, 64, 2752, 2752, 2752, 2752]
    - [0, 10.34]
  - - [2880, 2752, 1, 64, 2880, 2880, 2880, 2752]
    - [0, 10.364]
  - - [3008, 2752, 1, 64, 3008, 3008, 3008, 2752]
    - [0, 9.834]
  - - [3136, 2752, 1, 64, 3136, 3136, 3136, 2752]
    - [0, 9.569]
  - - [3264, 2752, 1, 64, 3264, 3264, 3264, 2752]
    - [0, 9.101]
  - - [3392, 2752, 1, 64, 3392, 3392, 3392, 2752]
    - [0, 8.699]
  - - [3520, 2752, 1, 64, 3520, 3520, 3520, 2752]
    - [0, 8.617]
  - - [3648, 2752, 1, 64, 3648, 3648, 3648, 2752]
    - [0, 8.535]
  - - [3776, 2752, 1, 64, 3776, 3776, 3776, 2752]
    - [0, 8.543]
  - - [3904, 2752, 1, 64, 3904, 3904, 3904, 2752]
    - [0, 8.659]
  - - [4032, 2752, 1, 64, 4032, 4032, 4032, 2752]
    - [0, 8.659]
  - - [64, 2880, 1, 64, 64, 64, 64, 2880]
    - [0, 4.506]
  - - [192, 2880, 1, 64, 192, 192, 192, 2880]
    - [0, 7.259]
  - - [320, 2880, 1, 64, 320, 320, 320, 2880]
    - [0, 8.406]
  - - [448, 2880, 1, 64, 448, 448, 448, 2880]
    - [0, 9.009]
  - - [576, 2880, 1, 64, 576, 576, 576, 2880]
    - [0, 9.428]
  - - [704, 2880, 1, 64, 704, 704, 704, 2880]
    - [0, 9.666]
  - - [832, 2880, 1, 64, 832, 832, 832, 2880]
    - [0, 9.867]
  - - [960, 2880, 1, 64, 960, 960, 960, 2880]
    - [0, 10.033]
  - - [1088, 2880, 1, 64, 1088, 1088, 1088, 2880]
    - [0, 10.12]
  - - [1216, 2880, 1, 64, 1216, 1216, 1216, 2880]
    - [0, 10.22]
  - - [1344, 2880, 1, 64, 1344, 1344, 1344, 2880]
    - [0, 9.724]
  - - [1472, 2880, 1, 64, 1472, 1472, 1472, 2880]
    - [0, 9.867]
  - - [1600, 2880, 1, 64, 1600, 1600, 1600, 2880]
    - [0, 9.953]
  - - [1728, 2880, 1, 64, 1728, 1728, 1728, 2880]
    - [0, 10.029]
  - - [1856, 2880, 1, 64, 1856, 1856, 1856, 2880]
    - [0, 10.089]
  - - [1984, 2880, 1, 64, 1984, 1984, 1984, 2880]
    - [0, 10.148]
  - - [2112, 2880, 1, 64, 2112, 2112, 2112, 2880]
    - [0, 10.199]
  - - [2240, 2880, 1, 64, 2240, 2240, 2240, 2880]
    - [0, 10.231]
  - - [2368, 2880, 1, 64, 2368, 2368, 2368, 2880]
    - [0, 10.267]
  - - [2496, 2880, 1, 64, 2496, 2496, 2496, 2880]
    - [0, 10.317]
  - - [2624, 2880, 1, 64, 2624, 2624, 2624, 2880]
    - [0, 10.331]
  - - [2752, 2880, 1, 64, 2752, 2752, 2752, 2880]
    - [0, 10.344]
  - - [2880, 2880, 1, 64, 2880, 2880, 2880, 2880]
    - [0, 9.869]
  - - [3008, 2880, 1, 64, 3008, 3008, 3008, 2880]
    - [0, 9.537]
  - - [3136, 2880, 1, 64, 3136, 3136, 3136, 2880]
    - [0, 8.961]
  - - [3264, 2880, 1, 64, 3264, 3264, 3264, 2880]
    - [0, 8.648]
  - - [3392, 2880, 1, 64, 3392, 3392, 3392, 2880]
    - [0, 8.603]
  - - [3520, 2880, 1, 64, 3520, 3520, 3520, 2880]
    - [0, 8.638]
  - - [3648, 2880, 1, 64, 3648, 3648, 3648, 2880]
    - [0, 8.563]
  - - [3776, 2880, 1, 64, 3776, 3776, 3776, 2880]
    - [0, 8.563]
  - - [3904, 2880, 1, 64, 3904, 3904, 3904, 2880]
    - [0, 8.696]
  - - [4032, 2880, 1, 64, 4032, 4032, 4032, 2880]
    - [0, 8.68]
  - - [64, 3008, 1, 64, 64, 64, 64, 3008]
    - [0, 4.501]
  - - [192, 3008, 1, 64, 192, 192, 192, 3008]
    - [0, 7.38]
  - - [320, 3008, 1, 64, 320, 320, 320, 3008]
    - [0, 8.463]
  - - [448, 3008, 1, 64, 448, 448, 448, 3008]
    - [0, 9.076]
  - - [576, 3008, 1, 64, 576, 576, 576, 3008]
    - [0, 9.489]
  - - [704, 3008, 1, 64, 704, 704, 704, 3008]
    - [0, 9.714]
  - - [832, 3008, 1, 64, 832, 832, 832, 3008]
    - [0, 9.91]
  - - [960, 3008, 1, 64, 960, 960, 960, 3008]
    - [0, 10.071]
  - - [1088, 3008, 1, 64, 1088, 1088, 1088, 3008]
    - [0, 10.159]
  - - [1216, 3008, 1, 64, 1216, 1216, 1216, 3008]
    - [0, 10.244]
  - - [1344, 3008, 1, 64, 1344, 1344, 1344, 3008]
    - [0, 9.841]
  - - [1472, 3008, 1, 64, 1472, 1472, 1472, 3008]
    - [0, 9.913]
  - - [1600, 3008, 1, 64, 1600, 1600, 1600, 3008]
    - [0, 10.004]
  - - [1728, 3008, 1, 64, 1728, 1728, 1728, 3008]
    - [0, 10.077]
  - - [1856, 3008, 1, 64, 1856, 1856, 1856, 3008]
    - [0, 10.117]
  - - [1984, 3008, 1, 64, 1984, 1984, 1984, 3008]
    - [0, 10.178]
  - - [2112, 3008, 1, 64, 2112, 2112, 2112, 3008]
    - [0, 10.225]
  - - [2240, 3008, 1, 64, 2240, 2240, 2240, 3008]
    - [0, 10.266]
  - - [2368, 3008, 1, 64, 2368, 2368, 2368, 3008]
    - [0, 10.303]
  - - [2496, 3008, 1, 64, 2496, 2496, 2496, 3008]
    - [0, 10.352]
  - - [2624, 3008, 1, 64, 2624, 2624, 2624, 3008]
    - [0, 10.352]
  - - [2752, 3008, 1, 64, 2752, 2752, 2752, 3008]
    - [0, 9.827]
  - - [2880, 3008, 1, 64, 2880, 2880, 2880, 3008]
    - [0, 9.536]
  - - [3008, 3008, 1, 64, 3008, 3008, 3008, 3008]
    - [0, 8.914]
  - - [3136, 3008, 1, 64, 3136, 3136, 3136, 3008]
    - [0, 8.451]
  - - [3264, 3008, 1, 64, 3264, 3264, 3264, 3008]
    - [0, 8.632]
  - - [3392, 3008, 1, 64, 3392, 3392, 3392, 3008]
    - [0, 8.606]
  - - [3520, 3008, 1, 64, 3520, 3520, 3520, 3008]
    - [0, 8.625]
  - - [3648, 3008, 1, 64, 3648, 3648, 3648, 3008]
    - [0, 8.58]
  - - [3776, 3008, 1, 64, 3776, 3776, 3776, 3008]
    - [0, 8.596]
  - - [3904, 3008, 1, 64, 3904, 3904, 3904, 3008]
    - [0, 8.673]
  - - [4032, 3008, 1, 64, 4032, 4032, 4032, 3008]
    - [0, 8.663]
  - - [64, 3136, 1, 64, 64, 64, 64, 3136]
    - [0, 4.615]
  - - [192, 3136, 1, 64, 192, 192, 192, 3136]
    - [0, 7.495]
  - - [320, 3136, 1, 64, 320, 320, 320, 3136]
    - [0, 8.564]
  - - [448, 3136, 1, 64, 448, 448, 448, 3136]
    - [0, 9.142]
  - - [576, 3136, 1, 64, 576, 576, 576, 3136]
    - [0, 9.558]
  - - [704, 3136, 1, 64, 704, 704, 704, 3136]
    - [0, 9.77]
  - - [832, 3136, 1, 64, 832, 832, 832, 3136]
    - [0, 9.959]
  - - [960, 3136, 1, 64, 960, 960, 960, 3136]
    - [0, 10.119]
  - - [1088, 3136, 1, 64, 1088, 1088, 1088, 3136]
    - [0, 10.197]
  - - [1216, 3136, 1, 64, 1216, 1216, 1216, 3136]
    - [0, 9.586]
  - - [1344, 3136, 1, 64, 1344, 1344, 1344, 3136]
    - [0, 9.863]
  - - [1472, 3136, 1, 64, 1472, 1472, 1472, 3136]
    - [0, 9.961]
  - - [1600, 3136, 1, 64, 1600, 1600, 1600, 3136]
    - [0, 10.04]
  - - [1728, 3136, 1, 64, 1728, 1728, 1728, 3136]
    - [0, 10.117]
  - - [1856, 3136, 1, 64, 1856, 1856, 1856, 3136]
    - [0, 10.153]
  - - [1984, 3136, 1, 64, 1984, 1984, 1984, 3136]
    - [0, 10.206]
  - - [2112, 3136, 1, 64, 2112, 2112, 2112, 3136]
    - [0, 10.263]
  - - [2240, 3136, 1, 64, 2240, 2240, 2240, 3136]
    - [0, 10.293]
  - - [2368, 3136, 1, 64, 2368, 2368, 2368, 3136]
    - [0, 10.321]
  - - [2496, 3136, 1, 64, 2496, 2496, 2496, 3136]
    - [0, 10.359]
  - - [2624, 3136, 1, 64, 2624, 2624, 2624, 3136]
    - [0, 9.973]
  - - [2752, 3136, 1, 64, 2752, 2752, 2752, 3136]
    - [0, 9.638]
  - - [2880, 3136, 1, 64, 2880, 2880, 2880, 3136]
    - [0, 9.049]
  - - [3008, 3136, 1, 64, 3008, 3008, 3008, 3136]
    - [0, 8.452]
  - - [3136, 3136, 1, 64, 3136, 3136, 3136, 3136]
    - [0, 8.474]
  - - [3264, 3136, 1, 64, 3264, 3264, 3264, 3136]
    - [0, 8.662]
  - - [3392, 3136, 1, 64, 3392, 3392, 3392, 3136]
    - [0, 8.615]
  - - [3520, 3136, 1, 64, 3520, 3520, 3520, 3136]
    - [0, 8.635]
  - - [3648, 3136, 1, 64, 3648, 3648, 3648, 3136]
    - [0, 8.582]
  - - [3776, 3136, 1, 64, 3776, 3776, 3776, 3136]
    - [0, 8.606]
  - - [3904, 3136, 1, 64, 3904, 3904, 3904, 3136]
    - [0, 8.664]
  - - [4032, 3136, 1, 64, 4032, 4032, 4032, 3136]
    - [0, 8.645]
  - - [64, 3264, 1, 64, 64, 64, 64, 3264]
    - [0, 4.739]
  - - [192, 3264, 1, 64, 192, 192, 192, 3264]
    - [0, 7.543]
  - - [320, 3264, 1, 64, 320, 320, 320, 3264]
    - [0, 8.626]
  - - [448, 3264, 1, 64, 448, 448, 448, 3264]
    - [0, 9.207]
  - - [576, 3264, 1, 64, 576, 576, 576, 3264]
    - [0, 9.597]
  - - [704, 3264, 1, 64, 704, 704, 704, 3264]
    - [0, 9.823]
  - - [832, 3264, 1, 64, 832, 832, 832, 3264]
    - [0, 9.998]
  - - [960, 3264, 1, 64, 960, 960, 960, 3264]
    - [0, 10.148]
  - - [1088, 3264, 1, 64, 1088, 1088, 1088, 3264]
    - [0, 10.226]
  - - [1216, 3264, 1, 64, 1216, 1216, 1216, 3264]
    - [0, 9.826]
  - - [1344, 3264, 1, 64, 1344, 1344, 1344, 3264]
    - [0, 9.917]
  - - [1472, 3264, 1, 64, 1472, 1472, 1472, 3264]
    - [0, 9.991]
  - - [1600, 3264, 1, 64, 1600, 1600, 1600, 3264]
    - [0, 10.071]
  - - [1728, 3264, 1, 64, 1728, 1728, 1728, 3264]
    - [0, 10.139]
  - - [1856, 3264, 1, 64, 1856, 1856, 1856, 3264]
    - [0, 10.196]
  - - [1984, 3264, 1, 64, 1984, 1984, 1984, 3264]
    - [0, 10.243]
  - - [2112, 3264, 1, 64, 2112, 2112, 2112, 3264]
    - [0, 10.302]
  - - [2240, 3264, 1, 64, 2240, 2240, 2240, 3264]
    - [0, 10.319]
  - - [2368, 3264, 1, 64, 2368, 2368, 2368, 3264]
    - [0, 10.338]
  - - [2496, 3264, 1, 64, 2496, 2496, 2496, 3264]
    - [0, 10.392]
  - - [2624, 3264, 1, 64, 2624, 2624, 2624, 3264]
    - [0, 9.632]
  - - [2752, 3264, 1, 64, 2752, 2752, 2752, 3264]
    - [0, 9.153]
  - - [2880, 3264, 1, 64, 2880, 2880, 2880, 3264]
    - [0, 8.678]
  - - [3008, 3264, 1, 64, 3008, 3008, 3008, 3264]
    - [0, 8.461]
  - - [3136, 3264, 1, 64, 3136, 3136, 3136, 3264]
    - [0, 8.466]
  - - [3264, 3264, 1, 64, 3264, 3264, 3264, 3264]
    - [0, 8.667]
  - - [3392, 3264, 1, 64, 3392, 3392, 3392, 3264]
    - [0, 8.661]
  - - [3520, 3264, 1, 64, 3520, 3520, 3520, 3264]
    - [0, 8.645]
  - - [3648, 3264, 1, 64, 3648, 3648, 3648, 3264]
    - [0, 8.563]
  - - [3776, 3264, 1, 64, 3776, 3776, 3776, 3264]
    - [0, 8.582]
  - - [3904, 3264, 1, 64, 3904, 3904, 3904, 3264]
    - [0, 8.648]
  - - [4032, 3264, 1, 64, 4032, 4032, 4032, 3264]
    - [0, 8.664]
  - - [64, 3392, 1, 64, 64, 64, 64, 3392]
    - [0, 4.856]
  - - [192, 3392, 1, 64, 192, 192, 192, 3392]
    - [0, 7.633]
  - - [320, 3392, 1, 64, 320, 320, 320, 3392]
    - [0, 8.737]
  - - [448, 3392, 1, 64, 448, 448, 448, 3392]
    - [0, 9.277]
  - - [576, 3392, 1, 64, 576, 576, 576, 3392]
    - [0, 9.639]
  - - [704, 3392, 1, 64, 704, 704, 704, 3392]
    - [0, 9.867]
  - - [832, 3392, 1, 64, 832, 832, 832, 3392]
    - [0, 10.039]
  - - [960, 3392, 1, 64, 960, 960, 960, 3392]
    - [0, 10.184]
  - - [1088, 3392, 1, 64, 1088, 1088, 1088, 3392]
    - [0, 9.288]
  - - [1216, 3392, 1, 64, 1216, 1216, 1216, 3392]
    - [0, 9.821]
  - - [1344, 3392, 1, 64, 1344, 1344, 1344, 3392]
    - [0, 9.945]
  - - [1472, 3392, 1, 64, 1472, 1472, 1472, 3392]
    - [0, 10.036]
  - - [1600, 3392, 1, 64, 1600, 1600, 1600, 3392]
    - [0, 10.112]
  - - [1728, 3392, 1, 64, 1728, 1728, 1728, 3392]
    - [0, 10.176]
  - - [1856, 3392, 1, 64, 1856, 1856, 1856, 3392]
    - [0, 10.218]
  - - [1984, 3392, 1, 64, 1984, 1984, 1984, 3392]
    - [0, 10.264]
  - - [2112, 3392, 1, 64, 2112, 2112, 2112, 3392]
    - [0, 10.317]
  - - [2240, 3392, 1, 64, 2240, 2240, 2240, 3392]
    - [0, 10.346]
  - - [2368, 3392, 1, 64, 2368, 2368, 2368, 3392]
    - [0, 10.359]
  - - [2496, 3392, 1, 64, 2496, 2496, 2496, 3392]
    - [0, 9.729]
  - - [2624, 3392, 1, 64, 2624, 2624, 2624, 3392]
    - [0, 9.226]
  - - [2752, 3392, 1, 64, 2752, 2752, 2752, 3392]
    - [0, 8.781]
  - - [2880, 3392, 1, 64, 2880, 2880, 2880, 3392]
    - [0, 8.683]
  - - [3008, 3392, 1, 64, 3008, 3008, 3008, 3392]
    - [0, 8.461]
  - - [3136, 3392, 1, 64, 3136, 3136, 3136, 3392]
    - [0, 8.486]
  - - [3264, 3392, 1, 64, 3264, 3264, 3264, 3392]
    - [0, 8.677]
  - - [3392, 3392, 1, 64, 3392, 3392, 3392, 3392]
    - [0, 8.66]
  - - [3520, 3392, 1, 64, 3520, 3520, 3520, 3392]
    - [0, 8.643]
  - - [3648, 3392, 1, 64, 3648, 3648, 3648, 3392]
    - [0, 8.564]
  - - [3776, 3392, 1, 64, 3776, 3776, 3776, 3392]
    - [0, 8.582]
  - - [3904, 3392, 1, 64, 3904, 3904, 3904, 3392]
    - [0, 8.686]
  - - [4032, 3392, 1, 64, 4032, 4032, 4032, 3392]
    - [0, 8.693]
  - - [64, 3520, 1, 64, 64, 64, 64, 3520]
    - [0, 4.968]
  - - [192, 3520, 1, 64, 192, 192, 192, 3520]
    - [0, 7.755]
  - - [320, 3520, 1, 64, 320, 320, 320, 3520]
    - [0, 8.768]
  - - [448, 3520, 1, 64, 448, 448, 448, 3520]
    - [0, 9.325]
  - - [576, 3520, 1, 64, 576, 576, 576, 3520]
    - [0, 9.7]
  - - [704, 3520, 1, 64, 704, 704, 704, 3520]
    - [0, 9.902]
  - - [832, 3520, 1, 64, 832, 832, 832, 3520]
    - [0, 10.067]
  - - [960, 3520, 1, 64, 960, 960, 960, 3520]
    - [0, 10.207]
  - - [1088, 3520, 1, 64, 1088, 1088, 1088, 3520]
    - [0, 9.623]
  - - [1216, 3520, 1, 64, 1216, 1216, 1216, 3520]
    - [0, 9.878]
  - - [1344, 3520, 1, 64, 1344, 1344, 1344, 3520]
    - [0, 9.991]
  - - [1472, 3520, 1, 64, 1472, 1472, 1472, 3520]
    - [0, 10.073]
  - - [1600, 3520, 1, 64, 1600, 1600, 1600, 3520]
    - [0, 10.141]
  - - [1728, 3520, 1, 64, 1728, 1728, 1728, 3520]
    - [0, 10.209]
  - - [1856, 3520, 1, 64, 1856, 1856, 1856, 3520]
    - [0, 10.247]
  - - [1984, 3520, 1, 64, 1984, 1984, 1984, 3520]
    - [0, 10.298]
  - - [2112, 3520, 1, 64, 2112, 2112, 2112, 3520]
    - [0, 10.343]
  - - [2240, 3520, 1, 64, 2240, 2240, 2240, 3520]
    - [0, 10.355]
  - - [2368, 3520, 1, 64, 2368, 2368, 2368, 3520]
    - [0, 9.708]
  - - [2496, 3520, 1, 64, 2496, 2496, 2496, 3520]
    - [0, 9.455]
  - - [2624, 3520, 1, 64, 2624, 2624, 2624, 3520]
    - [0, 8.766]
  - - [2752, 3520, 1, 64, 2752, 2752, 2752, 3520]
    - [0, 8.665]
  - - [2880, 3520, 1, 64, 2880, 2880, 2880, 3520]
    - [0, 8.689]
  - - [3008, 3520, 1, 64, 3008, 3008, 3008, 3520]
    - [0, 8.483]
  - - [3136, 3520, 1, 64, 3136, 3136, 3136, 3520]
    - [0, 8.484]
  - - [3264, 3520, 1, 64, 3264, 3264, 3264, 3520]
    - [0, 8.687]
  - - [3392, 3520, 1, 64, 3392, 3392, 3392, 3520]
    - [0, 8.632]
  - - [3520, 3520, 1, 64, 3520, 3520, 3520, 3520]
    - [0, 8.606]
  - - [3648, 3520, 1, 64, 3648, 3648, 3648, 3520]
    - [0, 8.548]
  - - [3776, 3520, 1, 64, 3776, 3776, 3776, 3520]
    - [0, 8.616]
  - - [3904, 3520, 1, 64, 3904, 3904, 3904, 3520]
    - [0, 8.696]
  - - [4032, 3520, 1, 64, 4032, 4032, 4032, 3520]
    - [0, 8.714]
  - - [64, 3648, 1, 64, 64, 64, 64, 3648]
    - [0, 5.022]
  - - [192, 3648, 1, 64, 192, 192, 192, 3648]
    - [0, 7.805]
  - - [320, 3648, 1, 64, 320, 320, 320, 3648]
    - [0, 8.847]
  - - [448, 3648, 1, 64, 448, 448, 448, 3648]
    - [0, 9.391]
  - - [576, 3648, 1, 64, 576, 576, 576, 3648]
    - [0, 9.744]
  - - [704, 3648, 1, 64, 704, 704, 704, 3648]
    - [0, 9.931]
  - - [832, 3648, 1, 64, 832, 832, 832, 3648]
    - [0, 10.095]
  - - [960, 3648, 1, 64, 960, 960, 960, 3648]
    - [0, 10.231]
  - - [1088, 3648, 1, 64, 1088, 1088, 1088, 3648]
    - [0, 9.825]
  - - [1216, 3648, 1, 64, 1216, 1216, 1216, 3648]
    - [0, 9.912]
  - - [1344, 3648, 1, 64, 1344, 1344, 1344, 3648]
    - [0, 10.026]
  - - [1472, 3648, 1, 64, 1472, 1472, 1472, 3648]
    - [0, 10.098]
  - - [1600, 3648, 1, 64, 1600, 1600, 1600, 3648]
    - [0, 10.175]
  - - [1728, 3648, 1, 64, 1728, 1728, 1728, 3648]
    - [0, 10.241]
  - - [1856, 3648, 1, 64, 1856, 1856, 1856, 3648]
    - [0, 10.282]
  - - [1984, 3648, 1, 64, 1984, 1984, 1984, 3648]
    - [0, 10.334]
  - - [2112, 3648, 1, 64, 2112, 2112, 2112, 3648]
    - [0, 10.365]
  - - [2240, 3648, 1, 64, 2240, 2240, 2240, 3648]
    - [0, 10.147]
  - - [2368, 3648, 1, 64, 2368, 2368, 2368, 3648]
    - [0, 9.631]
  - - [2496, 3648, 1, 64, 2496, 2496, 2496, 3648]
    - [0, 8.985]
  - - [2624, 3648, 1, 64, 2624, 2624, 2624, 3648]
    - [2, 8.544]
  - - [2752, 3648, 1, 64, 2752, 2752, 2752, 3648]
    - [0, 8.692]
  - - [2880, 3648, 1, 64, 2880, 2880, 2880, 3648]
    - [0, 8.701]
  - - [3008, 3648, 1, 64, 3008, 3008, 3008, 3648]
    - [0, 8.486]
  - - [3136, 3648, 1, 64, 3136, 3136, 3136, 3648]
    - [0, 8.501]
  - - [3264, 3648, 1, 64, 3264, 3264, 3264, 3648]
    - [0, 8.661]
  - - [3392, 3648, 1, 64, 3392, 3392, 3392, 3648]
    - [0, 8.62]
  - - [3520, 3648, 1, 64, 3520, 3520, 3520, 3648]
    - [0, 8.636]
  - - [3648, 3648, 1, 64, 3648, 3648, 3648, 3648]
    - [0, 8.606]
  - - [3776, 3648, 1, 64, 3776, 3776, 3776, 3648]
    - [0, 8.648]
  - - [3904, 3648, 1, 64, 3904, 3904, 3904, 3648]
    - [0, 8.718]
  - - [4032, 3648, 1, 64, 4032, 4032, 4032, 3648]
    - [0, 8.73]
  - - [64, 3776, 1, 64, 64, 64, 64, 3776]
    - [0, 5.124]
  - - [192, 3776, 1, 64, 192, 192, 192, 3776]
    - [0, 7.902]
  - - [320, 3776, 1, 64, 320, 320, 320, 3776]
    - [0, 8.908]
  - - [448, 3776, 1, 64, 448, 448, 448, 3776]
    - [0, 9.436]
  - - [576, 3776, 1, 64, 576, 576, 576, 3776]
    - [0, 9.781]
  - - [704, 3776, 1, 64, 704, 704, 704, 3776]
    - [0, 9.96]
  - - [832, 3776, 1, 64, 832, 832, 832, 3776]
    - [0, 10.146]
  - - [960, 3776, 1, 64, 960, 960, 960, 3776]
    - [0, 10.264]
  - - [1088, 3776, 1, 64, 1088, 1088, 1088, 3776]
    - [0, 9.808]
  - - [1216, 3776, 1, 64, 1216, 1216, 1216, 3776]
    - [0, 9.948]
  - - [1344, 3776, 1, 64, 1344, 1344, 1344, 3776]
    - [0, 10.055]
  - - [1472, 3776, 1, 64, 1472, 1472, 1472, 3776]
    - [0, 10.136]
  - - [1600, 3776, 1, 64, 1600, 1600, 1600, 3776]
    - [0, 10.201]
  - - [1728, 3776, 1, 64, 1728, 1728, 1728, 3776]
    - [0, 10.262]
  - - [1856, 3776, 1, 64, 1856, 1856, 1856, 3776]
    - [0, 10.305]
  - - [1984, 3776, 1, 64, 1984, 1984, 1984, 3776]
    - [0, 10.336]
  - - [2112, 3776, 1, 64, 2112, 2112, 2112, 3776]
    - [0, 10.374]
  - - [2240, 3776, 1, 64, 2240, 2240, 2240, 3776]
    - [0, 9.719]
  - - [2368, 3776, 1, 64, 2368, 2368, 2368, 3776]
    - [0, 9.135]
  - - [2496, 3776, 1, 64, 2496, 2496, 2496, 3776]
    - [0, 8.641]
  - - [2624, 3776, 1, 64, 2624, 2624, 2624, 3776]
    - [2, 8.558]
  - - [2752, 3776, 1, 64, 2752, 2752, 2752, 3776]
    - [0, 8.688]
  - - [2880, 3776, 1, 64, 2880, 2880, 2880, 3776]
    - [0, 8.695]
  - - [3008, 3776, 1, 64, 3008, 3008, 3008, 3776]
    - [0, 8.495]
  - - [3136, 3776, 1, 64, 3136, 3136, 3136, 3776]
    - [0, 8.497]
  - - [3264, 3776, 1, 64, 3264, 3264, 3264, 3776]
    - [0, 8.633]
  - - [3392, 3776, 1, 64, 3392, 3392, 3392, 3776]
    - [0, 8.616]
  - - [3520, 3776, 1, 64, 3520, 3520, 3520, 3776]
    - [0, 8.671]
  - - [3648, 3776, 1, 64, 3648, 3648, 3648, 3776]
    - [0, 8.614]
  - - [3776, 3776, 1, 64, 3776, 3776, 3776, 3776]
    - [0, 8.643]
  - - [3904, 3776, 1, 64, 3904, 3904, 3904, 3776]
    - [0, 8.712]
  - - [4032, 3776, 1, 64, 4032, 4032, 4032, 3776]
    - [0, 8.724]
  - - [64, 3904, 1, 64, 64, 64, 64, 3904]
    - [0, 5.263]
  - - [192, 3904, 1, 64, 192, 192, 192, 3904]
    - [0, 7.981]
  - - [320, 3904, 1, 64, 320, 320, 320, 3904]
    - [0, 8.98]
  - - [448, 3904, 1, 64, 448, 448, 448, 3904]
    - [0, 9.485]
  - - [576, 3904, 1, 64, 576, 576, 576, 3904]
    - [0, 9.808]
  - - [704, 3904, 1, 64, 704, 704, 704, 3904]
    - [0, 10.004]
  - - [832, 3904, 1, 64, 832, 832, 832, 3904]
    - [0, 10.159]
  - - [960, 3904, 1, 64, 960, 960, 960, 3904]
    - [0, 9.429]
  - - [1088, 3904, 1, 64, 1088, 1088, 1088, 3904]
    - [0, 9.863]
  - - [1216, 3904, 1, 64, 1216, 1216, 1216, 3904]
    - [0, 9.975]
  - - [1344, 3904, 1, 64, 1344, 1344, 1344, 3904]
    - [0, 10.084]
  - - [1472, 3904, 1, 64, 1472, 1472, 1472, 3904]
    - [0, 10.158]
  - - [1600, 3904, 1, 64, 1600, 1600, 1600, 3904]
    - [0, 10.236]
  - - [1728, 3904, 1, 64, 1728, 1728, 1728, 3904]
    - [0, 10.279]
  - - [1856, 3904, 1, 64, 1856, 1856, 1856, 3904]
    - [0, 10.328]
  - - [1984, 3904, 1, 64, 1984, 1984, 1984, 3904]
    - [0, 10.347]
  - - [2112, 3904, 1, 64, 2112, 2112, 2112, 3904]
    - [0, 9.989]
  - - [2240, 3904, 1, 64, 2240, 2240, 2240, 3904]
    - [0, 9.516]
  - - [2368, 3904, 1, 64, 2368, 2368, 2368, 3904]
    - [0, 8.859]
  - - [2496, 3904, 1, 64, 2496, 2496, 2496, 3904]
    - [0, 8.672]
  - - [2624, 3904, 1, 64, 2624, 2624, 2624, 3904]
    - [2, 8.574]
  - - [2752, 3904, 1, 64, 2752, 2752, 2752, 3904]
    - [0, 8.7]
  - - [2880, 3904, 1, 64, 2880, 2880, 2880, 3904]
    - [0, 8.717]
  - - [3008, 3904, 1, 64, 3008, 3008, 3008, 3904]
    - [0, 8.507]
  - - [3136, 3904, 1, 64, 3136, 3136, 3136, 3904]
    - [0, 8.485]
  - - [3264, 3904, 1, 64, 3264, 3264, 3264, 3904]
    - [0, 8.664]
  - - [3392, 3904, 1, 64, 3392, 3392, 3392, 3904]
    - [0, 8.663]
  - - [3520, 3904, 1, 64, 3520, 3520, 3520, 3904]
    - [0, 8.689]
  - - [3648, 3904, 1, 64, 3648, 3648, 3648, 3904]
    - [0, 8.625]
  - - [3776, 3904, 1, 64, 3776, 3776, 3776, 3904]
    - [0, 8.645]
  - - [3904, 3904, 1, 64, 3904, 3904, 3904, 3904]
    - [0, 8.717]
  - - [4032, 3904, 1, 64, 4032, 4032, 4032, 3904]
    - [0, 8.754]
  - - [64, 4032, 1, 64, 64, 64, 64, 4032]
    - [0, 5.376]
  - - [192, 4032, 1, 64, 192, 192, 192, 4032]
    - [0, 8.037]
  - - [320, 4032, 1, 64, 320, 320, 320, 4032]
    - [0, 9.018]
  - - [448, 4032, 1, 64, 448, 448, 448, 4032]
    - [0, 9.531]
  - - [576, 4032, 1, 64, 576, 576, 576, 4032]
    - [0, 9.847]
  - - [704, 4032, 1, 64, 704, 704, 704, 4032]
    - [0, 10.03]
  - - [832, 4032, 1, 64, 832, 832, 832, 4032]
    - [0, 10.182]
  - - [960, 4032, 1, 64, 960, 960, 960, 4032]
    - [0, 9.722]
  - - [1088, 4032, 1, 64, 1088, 1088, 1088, 4032]
    - [0, 9.904]
  - - [1216, 4032, 1, 64, 1216, 1216, 1216, 4032]
    - [0, 10.014]
  - - [1344, 4032, 1, 64, 1344, 1344, 1344, 4032]
    - [0, 10.117]
  - - [1472, 4032, 1, 64, 1472, 1472, 1472, 4032]
    - [0, 10.191]
  - - [1600, 4032, 1, 64, 1600, 1600, 1600, 4032]
    - [0, 10.26]
  - - [1728, 4032, 1, 64, 1728, 1728, 1728, 4032]
    - [0, 10.31]
  - - [1856, 4032, 1, 64, 1856, 1856, 1856, 4032]
    - [0, 10.347]
  - - [1984, 4032, 1, 64, 1984, 1984, 1984, 4032]
    - [0, 10.38]
  - - [2112, 4032, 1, 64, 2112, 2112, 2112, 4032]
    - [0, 9.742]
  - - [2240, 4032, 1, 64, 2240, 2240, 2240, 4032]
    - [0, 9.069]
  - - [2368, 4032, 1, 64, 2368, 2368, 2368, 4032]
    - [0, 8.637]
  - - [2496, 4032, 1, 64, 2496, 2496, 2496, 4032]
    - [0, 8.657]
  - - [2624, 4032, 1, 64, 2624, 2624, 2624, 4032]
    - [2, 8.598]
  - - [2752, 4032, 1, 64, 2752, 2752, 2752, 4032]
    - [0, 8.711]
  - - [2880, 4032, 1, 64, 2880, 2880, 2880, 4032]
    - [0, 8.723]
  - - [3008, 4032, 1, 64, 3008, 3008, 3008, 4032]
    - [0, 8.461]
  - - [3136, 4032, 1, 64, 3136, 3136, 3136, 4032]
    - [0, 8.468]
  - - [3264, 4032, 1, 64, 3264, 3264, 3264, 4032]
    - [0, 8.689]
  - - [3392, 4032, 1, 64, 3392, 3392, 3392, 4032]
    - [0, 8.693]
  - - [3520, 4032, 1, 64, 3520, 3520, 3520, 4032]
    - [0, 8.689]
  - - [3648, 4032, 1, 64, 3648, 3648, 3648, 4032]
    - [0, 8.612]
  - - [3776, 4032, 1, 64, 3776, 3776, 3776, 4032]
    - [0, 8.643]
  - - [3904, 4032, 1, 64, 3904, 3904, 3904, 4032]
    - [0, 8.745]
  - - [4032, 4032, 1, 64, 4032, 4032, 4032, 4032]
    - [0, 8.704]
  - - [64, 64, 1, 256, 64, 64, 64, 64]
    - [2, 0.523]
  - - [192, 64, 1, 256, 192, 192, 192, 64]
    - [2, 1.555]
  - - [320, 64, 1, 256, 320, 320, 320, 64]
    - [0, 2.497]
  - - [448, 64, 1, 256, 448, 448, 448, 64]
    - [0, 3.48]
  - - [576, 64, 1, 256, 576, 576, 576, 64]
    - [2, 3.941]
  - - [704, 64, 1, 256, 704, 704, 704, 64]
    - [2, 4.782]
  - - [832, 64, 1, 256, 832, 832, 832, 64]
    - [0, 5.558]
  - - [960, 64, 1, 256, 960, 960, 960, 64]
    - [0, 6.416]
  - - [1088, 64, 1, 256, 1088, 1088, 1088, 64]
    - [0, 6.414]
  - - [1216, 64, 1, 256, 1216, 1216, 1216, 64]
    - [0, 7.121]
  - - [1344, 64, 1, 256, 1344, 1344, 1344, 64]
    - [0, 7.865]
  - - [1472, 64, 1, 256, 1472, 1472, 1472, 64]
    - [0, 7.794]
  - - [1600, 64, 1, 256, 1600, 1600, 1600, 64]
    - [0, 8.365]
  - - [1728, 64, 1, 256, 1728, 1728, 1728, 64]
    - [0, 8.997]
  - - [1856, 64, 1, 256, 1856, 1856, 1856, 64]
    - [0, 9.649]
  - - [1984, 64, 1, 256, 1984, 1984, 1984, 64]
    - [0, 9.448]
  - - [2112, 64, 1, 256, 2112, 2112, 2112, 64]
    - [0, 9.982]
  - - [2240, 64, 1, 256, 2240, 2240, 2240, 64]
    - [0, 10.444]
  - - [2368, 64, 1, 256, 2368, 2368, 2368, 64]
    - [0, 11.033]
  - - [2496, 64, 1, 256, 2496, 2496, 2496, 64]
    - [2, 10.23]
  - - [2624, 64, 1, 256, 2624, 2624, 2624, 64]
    - [0, 11.011]
  - - [2752, 64, 1, 256, 2752, 2752, 2752, 64]
    - [0, 11.582]
  - - [2880, 64, 1, 256, 2880, 2880, 2880, 64]
    - [0, 11.833]
  - - [3008, 64, 1, 256, 3008, 3008, 3008, 64]
    - [0, 11.664]
  - - [3136, 64, 1, 256, 3136, 3136, 3136, 64]
    - [0, 12.098]
  - - [3264, 64, 1, 256, 3264, 3264, 3264, 64]
    - [0, 12.356]
  - - [3392, 64, 1, 256, 3392, 3392, 3392, 64]
    - [0, 12.247]
  - - [3520, 64, 1, 256, 3520, 3520, 3520, 64]
    - [0, 12.589]
  - - [3648, 64, 1, 256, 3648, 3648, 3648, 64]
    - [0, 12.691]
  - - [3776, 64, 1, 256, 3776, 3776, 3776, 64]
    - [0, 13.065]
  - - [3904, 64, 1, 256, 3904, 3904, 3904, 64]
    - [0, 12.96]
  - - [4032, 64, 1, 256, 4032, 4032, 4032, 64]
    - [0, 13.061]
  - - [64, 192, 1, 256, 64, 64, 64, 192]
    - [2, 1.562]
  - - [192, 192, 1, 256, 192, 192, 192, 192]
    - [2, 3.958]
  - - [320, 192, 1, 256, 320, 320, 320, 192]
    - [0, 6.402]
  - - [448, 192, 1, 256, 448, 448, 448, 192]
    - [0, 7.867]
  - - [576, 192, 1, 256, 576, 576, 576, 192]
    - [0, 8.981]
  - - [704, 192, 1, 256, 704, 704, 704, 192]
    - [0, 9.966]
  - - [832, 192, 1, 256, 832, 832, 832, 192]
    - [0, 10.568]
  - - [960, 192, 1, 256, 960, 960, 960, 192]
    - [0, 12.209]
  - - [1088, 192, 1, 256, 1088, 1088, 1088, 192]
    - [3, 11.439]
  - - [1216, 192, 1, 256, 1216, 1216, 1216, 192]
    - [0, 13.033]
  - - [1344, 192, 1, 256, 1344, 1344, 1344, 192]
    - [0, 13.437]
  - - [1472, 192, 1, 256, 1472, 1472, 1472, 192]
    - [0, 13.745]
  - - [1600, 192, 1, 256, 1600, 1600, 1600, 192]
    - [0, 14.791]
  - - [1728, 192, 1, 256, 1728, 1728, 1728, 192]
    - [0, 15.025]
  - - [1856, 192, 1, 256, 1856, 1856, 1856, 192]
    - [0, 15.277]
  - - [1984, 192, 1, 256, 1984, 1984, 1984, 192]
    - [0, 15.468]
  - - [2112, 192, 1, 256, 2112, 2112, 2112, 192]
    - [0, 15.728]
  - - [2240, 192, 1, 256, 2240, 2240, 2240, 192]
    - [0, 16.139]
  - - [2368, 192, 1, 256, 2368, 2368, 2368, 192]
    - [0, 16.339]
  - - [2496, 192, 1, 256, 2496, 2496, 2496, 192]
    - [0, 16.512]
  - - [2624, 192, 1, 256, 2624, 2624, 2624, 192]
    - [0, 16.673]
  - - [2752, 192, 1, 256, 2752, 2752, 2752, 192]
    - [0, 16.865]
  - - [2880, 192, 1, 256, 2880, 2880, 2880, 192]
    - [0, 17.247]
  - - [3008, 192, 1, 256, 3008, 3008, 3008, 192]
    - [0, 17.37]
  - - [3136, 192, 1, 256, 3136, 3136, 3136, 192]
    - [0, 17.562]
  - - [3264, 192, 1, 256, 3264, 3264, 3264, 192]
    - [0, 17.614]
  - - [3392, 192, 1, 256, 3392, 3392, 3392, 192]
    - [0, 17.718]
  - - [3520, 192, 1, 256, 3520, 3520, 3520, 192]
    - [0, 17.914]
  - - [3648, 192, 1, 256, 3648, 3648, 3648, 192]
    - [0, 18.056]
  - - [3776, 192, 1, 256, 3776, 3776, 3776, 192]
    - [0, 18.246]
  - - [3904, 192, 1, 256, 3904, 3904, 3904, 192]
    - [0, 18.271]
  - - [4032, 192, 1, 256, 4032, 4032, 4032, 192]
    - [0, 18.388]
  - - [64, 320, 1, 256, 64, 64, 64, 320]
    - [2, 1.507]
  - - [192, 320, 1, 256, 192, 192, 192, 320]
    - [1, 4.508]
  - - [320, 320, 1, 256, 320, 320, 320, 320]
    - [3, 7.494]
  - - [448, 320, 1, 256, 448, 448, 448, 320]
    - [0, 10.317]
  - - [576, 320, 1, 256, 576, 576, 576, 320]
    - [0, 12.13]
  - - [704, 320, 1, 256, 704, 704, 704, 320]
    - [0, 12.692]
  - - [832, 320, 1, 256, 832, 832, 832, 320]
    - [0, 13.683]
  - - [960, 320, 1, 256, 960, 960, 960, 320]
    - [0, 14.712]
  - - [1088, 320, 1, 256, 1088, 1088, 1088, 320]
    - [0, 14.919]
  - - [1216, 320, 1, 256, 1216, 1216, 1216, 320]
    - [0, 15.62]
  - - [1344, 320, 1, 256, 1344, 1344, 1344, 320]
    - [0, 16.235]
  - - [1472, 320, 1, 256, 1472, 1472, 1472, 320]
    - [0, 16.411]
  - - [1600, 320, 1, 256, 1600, 1600, 1600, 320]
    - [0, 16.816]
  - - [1728, 320, 1, 256, 1728, 1728, 1728, 320]
    - [0, 17.234]
  - - [1856, 320, 1, 256, 1856, 1856, 1856, 320]
    - [0, 17.475]
  - - [1984, 320, 1, 256, 1984, 1984, 1984, 320]
    - [0, 17.656]
  - - [2112, 320, 1, 256, 2112, 2112, 2112, 320]
    - [0, 17.975]
  - - [2240, 320, 1, 256, 2240, 2240, 2240, 320]
    - [0, 18.073]
  - - [2368, 320, 1, 256, 2368, 2368, 2368, 320]
    - [0, 18.217]
  - - [2496, 320, 1, 256, 2496, 2496, 2496, 320]
    - [0, 18.532]
  - - [2624, 320, 1, 256, 2624, 2624, 2624, 320]
    - [0, 18.589]
  - - [2752, 320, 1, 256, 2752, 2752, 2752, 320]
    - [0, 18.744]
  - - [2880, 320, 1, 256, 2880, 2880, 2880, 320]
    - [0, 18.988]
  - - [3008, 320, 1, 256, 3008, 3008, 3008, 320]
    - [0, 18.977]
  - - [3136, 320, 1, 256, 3136, 3136, 3136, 320]
    - [0, 19.152]
  - - [3264, 320, 1, 256, 3264, 3264, 3264, 320]
    - [0, 19.27]
  - - [3392, 320, 1, 256, 3392, 3392, 3392, 320]
    - [0, 19.329]
  - - [3520, 320, 1, 256, 3520, 3520, 3520, 320]
    - [0, 19.393]
  - - [3648, 320, 1, 256, 3648, 3648, 3648, 320]
    - [0, 19.541]
  - - [3776, 320, 1, 256, 3776, 3776, 3776, 320]
    - [0, 19.637]
  - - [3904, 320, 1, 256, 3904, 3904, 3904, 320]
    - [0, 19.608]
  - - [4032, 320, 1, 256, 4032, 4032, 4032, 320]
    - [0, 19.827]
  - - [64, 448, 1, 256, 64, 64, 64, 448]
    - [0, 3.499]
  - - [192, 448, 1, 256, 192, 192, 192, 448]
    - [0, 7.848]
  - - [320, 448, 1, 256, 320, 320, 320, 448]
    - [0, 10.473]
  - - [448, 448, 1, 256, 448, 448, 448, 448]
    - [0, 12.128]
  - - [576, 448, 1, 256, 576, 576, 576, 448]
    - [0, 13.445]
  - - [704, 448, 1, 256, 704, 704, 704, 448]
    - [0, 14.41]
  - - [832, 448, 1, 256, 832, 832, 832, 448]
    - [0, 15.188]
  - - [960, 448, 1, 256, 960, 960, 960, 448]
    - [0, 16.207]
  - - [1088, 448, 1, 256, 1088, 1088, 1088, 448]
    - [0, 16.624]
  - - [1216, 448, 1, 256, 1216, 1216, 1216, 448]
    - [0, 17.027]
  - - [1344, 448, 1, 256, 1344, 1344, 1344, 448]
    - [0, 17.418]
  - - [1472, 448, 1, 256, 1472, 1472, 1472, 448]
    - [0, 17.831]
  - - [1600, 448, 1, 256, 1600, 1600, 1600, 448]
    - [0, 18.153]
  - - [1728, 448, 1, 256, 1728, 1728, 1728, 448]
    - [0, 18.309]
  - - [1856, 448, 1, 256, 1856, 1856, 1856, 448]
    - [0, 18.651]
  - - [1984, 448, 1, 256, 1984, 1984, 1984, 448]
    - [0, 18.789]
  - - [2112, 448, 1, 256, 2112, 2112, 2112, 448]
    - [0, 19.083]
  - - [2240, 448, 1, 256, 2240, 2240, 2240, 448]
    - [0, 19.131]
  - - [2368, 448, 1, 256, 2368, 2368, 2368, 448]
    - [0, 19.332]
  - - [2496, 448, 1, 256, 2496, 2496, 2496, 448]
    - [0, 19.346]
  - - [2624, 448, 1, 256, 2624, 2624, 2624, 448]
    - [0, 19.603]
  - - [2752, 448, 1, 256, 2752, 2752, 2752, 448]
    - [0, 19.704]
  - - [2880, 448, 1, 256, 2880, 2880, 2880, 448]
    - [0, 19.835]
  - - [3008, 448, 1, 256, 3008, 3008, 3008, 448]
    - [0, 19.888]
  - - [3136, 448, 1, 256, 3136, 3136, 3136, 448]
    - [0, 19.896]
  - - [3264, 448, 1, 256, 3264, 3264, 3264, 448]
    - [0, 20.19]
  - - [3392, 448, 1, 256, 3392, 3392, 3392, 448]
    - [0, 20.219]
  - - [3520, 448, 1, 256, 3520, 3520, 3520, 448]
    - [0, 20.191]
  - - [3648, 448, 1, 256, 3648, 3648, 3648, 448]
    - [0, 20.31]
  - - [3776, 448, 1, 256, 3776, 3776, 3776, 448]
    - [0, 20.328]
  - - [3904, 448, 1, 256, 3904, 3904, 3904, 448]
    - [0, 20.334]
  - - [4032, 448, 1, 256, 4032, 4032, 4032, 448]
    - [0, 20.459]
  - - [64, 576, 1, 256, 64, 64, 64, 576]
    - [2, 3.989]
  - - [192, 576, 1, 256, 192, 192, 192, 576]
    - [0, 8.962]
  - - [320, 576, 1, 256, 320, 320, 320, 576]
    - [0, 12.038]
  - - [448, 576, 1, 256, 448, 448, 448, 576]
    - [0, 13.255]
  - - [576, 576, 1, 256, 576, 576, 576, 576]
    - [0, 14.943]
  - - [704, 576, 1, 256, 704, 704, 704, 576]
    - [0, 15.674]
  - - [832, 576, 1, 256, 832, 832, 832, 576]
    - [0, 16.502]
  - - [960, 576, 1, 256, 960, 960, 960, 576]
    - [0, 17.267]
  - - [1088, 576, 1, 256, 1088, 1088, 1088, 576]
    - [0, 17.428]
  - - [1216, 576, 1, 256, 1216, 1216, 1216, 576]
    - [0, 18.05]
  - - [1344, 576, 1, 256, 1344, 1344, 1344, 576]
    - [0, 18.351]
  - - [1472, 576, 1, 256, 1472, 1472, 1472, 576]
    - [0, 18.657]
  - - [1600, 576, 1, 256, 1600, 1600, 1600, 576]
    - [0, 18.94]
  - - [1728, 576, 1, 256, 1728, 1728, 1728, 576]
    - [0, 19.079]
  - - [1856, 576, 1, 256, 1856, 1856, 1856, 576]
    - [0, 19.244]
  - - [1984, 576, 1, 256, 1984, 1984, 1984, 576]
    - [0, 19.497]
  - - [2112, 576, 1, 256, 2112, 2112, 2112, 576]
    - [0, 19.702]
  - - [2240, 576, 1, 256, 2240, 2240, 2240, 576]
    - [0, 19.769]
  - - [2368, 576, 1, 256, 2368, 2368, 2368, 576]
    - [0, 19.915]
  - - [2496, 576, 1, 256, 2496, 2496, 2496, 576]
    - [0, 20.167]
  - - [2624, 576, 1, 256, 2624, 2624, 2624, 576]
    - [0, 20.115]
  - - [2752, 576, 1, 256, 2752, 2752, 2752, 576]
    - [0, 20.284]
  - - [2880, 576, 1, 256, 2880, 2880, 2880, 576]
    - [0, 20.284]
  - - [3008, 576, 1, 256, 3008, 3008, 3008, 576]
    - [0, 20.442]
  - - [3136, 576, 1, 256, 3136, 3136, 3136, 576]
    - [0, 20.497]
  - - [3264, 576, 1, 256, 3264, 3264, 3264, 576]
    - [0, 18.915]
  - - [3392, 576, 1, 256, 3392, 3392, 3392, 576]
    - [0, 19.566]
  - - [3520, 576, 1, 256, 3520, 3520, 3520, 576]
    - [0, 19.748]
  - - [3648, 576, 1, 256, 3648, 3648, 3648, 576]
    - [0, 19.72]
  - - [3776, 576, 1, 256, 3776, 3776, 3776, 576]
    - [0, 19.799]
  - - [3904, 576, 1, 256, 3904, 3904, 3904, 576]
    - [0, 19.947]
  - - [4032, 576, 1, 256, 4032, 4032, 4032, 576]
    - [0, 19.964]
  - - [64, 704, 1, 256, 64, 64, 64, 704]
    - [3, 3.307]
  - - [192, 704, 1, 256, 192, 192, 192, 704]
    - [0, 9.823]
  - - [320, 704, 1, 256, 320, 320, 320, 704]
    - [0, 12.784]
  - - [448, 704, 1, 256, 448, 448, 448, 704]
    - [0, 14.406]
  - - [576, 704, 1, 256, 576, 576, 576, 704]
    - [0, 15.799]
  - - [704, 704, 1, 256, 704, 704, 704, 704]
    - [0, 16.647]
  - - [832, 704, 1, 256, 832, 832, 832, 704]
    - [0, 17.416]
  - - [960, 704, 1, 256, 960, 960, 960, 704]
    - [0, 17.984]
  - - [1088, 704, 1, 256, 1088, 1088, 1088, 704]
    - [0, 18.373]
  - - [1216, 704, 1, 256, 1216, 1216, 1216, 704]
    - [0, 18.738]
  - - [1344, 704, 1, 256, 1344, 1344, 1344, 704]
    - [0, 19.076]
  - - [1472, 704, 1, 256, 1472, 1472, 1472, 704]
    - [0, 19.281]
  - - [1600, 704, 1, 256, 1600, 1600, 1600, 704]
    - [0, 19.541]
  - - [1728, 704, 1, 256, 1728, 1728, 1728, 704]
    - [0, 19.644]
  - - [1856, 704, 1, 256, 1856, 1856, 1856, 704]
    - [0, 19.945]
  - - [1984, 704, 1, 256, 1984, 1984, 1984, 704]
    - [0, 19.84]
  - - [2112, 704, 1, 256, 2112, 2112, 2112, 704]
    - [0, 20.132]
  - - [2240, 704, 1, 256, 2240, 2240, 2240, 704]
    - [0, 20.174]
  - - [2368, 704, 1, 256, 2368, 2368, 2368, 704]
    - [0, 20.282]
  - - [2496, 704, 1, 256, 2496, 2496, 2496, 704]
    - [0, 20.442]
  - - [2624, 704, 1, 256, 2624, 2624, 2624, 704]
    - [0, 18.595]
  - - [2752, 704, 1, 256, 2752, 2752, 2752, 704]
    - [0, 19.466]
  - - [2880, 704, 1, 256, 2880, 2880, 2880, 704]
    - [0, 19.718]
  - - [3008, 704, 1, 256, 3008, 3008, 3008, 704]
    - [0, 19.856]
  - - [3136, 704, 1, 256, 3136, 3136, 3136, 704]
    - [0, 19.927]
  - - [3264, 704, 1, 256, 3264, 3264, 3264, 704]
    - [0, 20.05]
  - - [3392, 704, 1, 256, 3392, 3392, 3392, 704]
    - [0, 20.001]
  - - [3520, 704, 1, 256, 3520, 3520, 3520, 704]
    - [0, 20.107]
  - - [3648, 704, 1, 256, 3648, 3648, 3648, 704]
    - [0, 20.178]
  - - [3776, 704, 1, 256, 3776, 3776, 3776, 704]
    - [0, 20.295]
  - - [3904, 704, 1, 256, 3904, 3904, 3904, 704]
    - [0, 20.424]
  - - [4032, 704, 1, 256, 4032, 4032, 4032, 704]
    - [0, 20.408]
  - - [64, 832, 1, 256, 64, 64, 64, 832]
    - [0, 5.592]
  - - [192, 832, 1, 256, 192, 192, 192, 832]
    - [0, 10.779]
  - - [320, 832, 1, 256, 320, 320, 320, 832]
    - [0, 13.768]
  - - [448, 832, 1, 256, 448, 448, 448, 832]
    - [0, 15.264]
  - - [576, 832, 1, 256, 576, 576, 576, 832]
    - [0, 16.506]
  - - [704, 832, 1, 256, 704, 704, 704, 832]
    - [0, 17.341]
  - - [832, 832, 1, 256, 832, 832, 832, 832]
    - [0, 18.057]
  - - [960, 832, 1, 256, 960, 960, 960, 832]
    - [0, 18.467]
  - - [1088, 832, 1, 256, 1088, 1088, 1088, 832]
    - [0, 18.886]
  - - [1216, 832, 1, 256, 1216, 1216, 1216, 832]
    - [0, 19.189]
  - - [1344, 832, 1, 256, 1344, 1344, 1344, 832]
    - [0, 19.452]
  - - [1472, 832, 1, 256, 1472, 1472, 1472, 832]
    - [0, 19.619]
  - - [1600, 832, 1, 256, 1600, 1600, 1600, 832]
    - [0, 19.887]
  - - [1728, 832, 1, 256, 1728, 1728, 1728, 832]
    - [0, 19.979]
  - - [1856, 832, 1, 256, 1856, 1856, 1856, 832]
    - [0, 20.29]
  - - [1984, 832, 1, 256, 1984, 1984, 1984, 832]
    - [0, 20.393]
  - - [2112, 832, 1, 256, 2112, 2112, 2112, 832]
    - [0, 20.41]
  - - [2240, 832, 1, 256, 2240, 2240, 2240, 832]
    - [0, 18.75]
  - - [2368, 832, 1, 256, 2368, 2368, 2368, 832]
    - [0, 19.604]
  - - [2496, 832, 1, 256, 2496, 2496, 2496, 832]
    - [0, 19.735]
  - - [2624, 832, 1, 256, 2624, 2624, 2624, 832]
    - [0, 19.804]
  - - [2752, 832, 1, 256, 2752, 2752, 2752, 832]
    - [0, 19.95]
  - - [2880, 832, 1, 256, 2880, 2880, 2880, 832]
    - [0, 20.017]
  - - [3008, 832, 1, 256, 3008, 3008, 3008, 832]
    - [0, 20.036]
  - - [3136, 832, 1, 256, 3136, 3136, 3136, 832]
    - [0, 20.17]
  - - [3264, 832, 1, 256, 3264, 3264, 3264, 832]
    - [0, 20.397]
  - - [3392, 832, 1, 256, 3392, 3392, 3392, 832]
    - [0, 20.273]
  - - [3520, 832, 1, 256, 3520, 3520, 3520, 832]
    - [0, 20.476]
  - - [3648, 832, 1, 256, 3648, 3648, 3648, 832]
    - [0, 20.509]
  - - [3776, 832, 1, 256, 3776, 3776, 3776, 832]
    - [0, 20.546]
  - - [3904, 832, 1, 256, 3904, 3904, 3904, 832]
    - [0, 20.576]
  - - [4032, 832, 1, 256, 4032, 4032, 4032, 832]
    - [0, 20.669]
  - - [64, 960, 1, 256, 64, 64, 64, 960]
    - [0, 6.457]
  - - [192, 960, 1, 256, 192, 192, 192, 960]
    - [0, 12.086]
  - - [320, 960, 1, 256, 320, 320, 320, 960]
    - [0, 14.774]
  - - [448, 960, 1, 256, 448, 448, 448, 960]
    - [0, 16.129]
  - - [576, 960, 1, 256, 576, 576, 576, 960]
    - [0, 17.228]
  - - [704, 960, 1, 256, 704, 704, 704, 960]
    - [0, 17.961]
  - - [832, 960, 1, 256, 832, 832, 832, 960]
    - [0, 18.451]
  - - [960, 960, 1, 256, 960, 960, 960, 960]
    - [0, 18.927]
  - - [1088, 960, 1, 256, 1088, 1088, 1088, 960]
    - [0, 19.311]
  - - [1216, 960, 1, 256, 1216, 1216, 1216, 960]
    - [0, 19.574]
  - - [1344, 960, 1, 256, 1344, 1344, 1344, 960]
    - [0, 19.845]
  - - [1472, 960, 1, 256, 1472, 1472, 1472, 960]
    - [0, 19.976]
  - - [1600, 960, 1, 256, 1600, 1600, 1600, 960]
    - [0, 20.193]
  - - [1728, 960, 1, 256, 1728, 1728, 1728, 960]
    - [0, 20.373]
  - - [1856, 960, 1, 256, 1856, 1856, 1856, 960]
    - [0, 20.423]
  - - [1984, 960, 1, 256, 1984, 1984, 1984, 960]
    - [0, 19.152]
  - - [2112, 960, 1, 256, 2112, 2112, 2112, 960]
    - [0, 19.716]
  - - [2240, 960, 1, 256, 2240, 2240, 2240, 960]
    - [0, 19.85]
  - - [2368, 960, 1, 256, 2368, 2368, 2368, 960]
    - [0, 19.955]
  - - [2496, 960, 1, 256, 2496, 2496, 2496, 960]
    - [0, 19.956]
  - - [2624, 960, 1, 256, 2624, 2624, 2624, 960]
    - [0, 20.158]
  - - [2752, 960, 1, 256, 2752, 2752, 2752, 960]
    - [0, 20.161]
  - - [2880, 960, 1, 256, 2880, 2880, 2880, 960]
    - [0, 20.251]
  - - [3008, 960, 1, 256, 3008, 3008, 3008, 960]
    - [0, 20.426]
  - - [3136, 960, 1, 256, 3136, 3136, 3136, 960]
    - [0, 20.492]
  - - [3264, 960, 1, 256, 3264, 3264, 3264, 960]
    - [0, 20.543]
  - - [3392, 960, 1, 256, 3392, 3392, 3392, 960]
    - [0, 20.531]
  - - [3520, 960, 1, 256, 3520, 3520, 3520, 960]
    - [0, 20.696]
  - - [3648, 960, 1, 256, 3648, 3648, 3648, 960]
    - [0, 20.74]
  - - [3776, 960, 1, 256, 3776, 3776, 3776, 960]
    - [0, 20.801]
  - - [3904, 960, 1, 256, 3904, 3904, 3904, 960]
    - [0, 20.858]
  - - [4032, 960, 1, 256, 4032, 4032, 4032, 960]
    - [0, 20.914]
  - - [64, 1088, 1, 256, 64, 64, 64, 1088]
    - [3, 5.112]
  - - [192, 1088, 1, 256, 192, 192, 192, 1088]
    - [0, 12.649]
  - - [320, 1088, 1, 256, 320, 320, 320, 1088]
    - [0, 14.95]
  - - [448, 1088, 1, 256, 448, 448, 448, 1088]
    - [0, 16.619]
  - - [576, 1088, 1, 256, 576, 576, 576, 1088]
    - [0, 17.561]
  - - [704, 1088, 1, 256, 704, 704, 704, 1088]
    - [0, 18.363]
  - - [832, 1088, 1, 256, 832, 832, 832, 1088]
    - [0, 18.91]
  - - [960, 1088, 1, 256, 960, 960, 960, 1088]
    - [0, 19.285]
  - - [1088, 1088, 1, 256, 1088, 1088, 1088, 1088]
    - [0, 19.524]
  - - [1216, 1088, 1, 256, 1216, 1216, 1216, 1088]
    - [0, 19.863]
  - - [1344, 1088, 1, 256, 1344, 1344, 1344, 1088]
    - [0, 19.99]
  - - [1472, 1088, 1, 256, 1472, 1472, 1472, 1088]
    - [0, 20.312]
  - - [1600, 1088, 1, 256, 1600, 1600, 1600, 1088]
    - [0, 20.372]
  - - [1728, 1088, 1, 256, 1728, 1728, 1728, 1088]
    - [0, 18.914]
  - - [1856, 1088, 1, 256, 1856, 1856, 1856, 1088]
    - [0, 19.675]
  - - [1984, 1088, 1, 256, 1984, 1984, 1984, 1088]
    - [0, 19.828]
  - - [2112, 1088, 1, 256, 2112, 2112, 2112, 1088]
    - [0, 19.944]
  - - [2240, 1088, 1, 256, 2240, 2240, 2240, 1088]
    - [0, 20.096]
  - - [2368, 1088, 1, 256, 2368, 2368, 2368, 1088]
    - [0, 20.222]
  - - [2496, 1088, 1, 256, 2496, 2496, 2496, 1088]
    - [0, 20.24]
  - - [2624, 1088, 1, 256, 2624, 2624, 2624, 1088]
    - [0, 20.408]
  - - [2752, 1088, 1, 256, 2752, 2752, 2752, 1088]
    - [0, 20.523]
  - - [2880, 1088, 1, 256, 2880, 2880, 2880, 1088]
    - [0, 20.55]
  - - [3008, 1088, 1, 256, 3008, 3008, 3008, 1088]
    - [0, 20.638]
  - - [3136, 1088, 1, 256, 3136, 3136, 3136, 1088]
    - [0, 20.676]
  - - [3264, 1088, 1, 256, 3264, 3264, 3264, 1088]
    - [0, 20.78]
  - - [3392, 1088, 1, 256, 3392, 3392, 3392, 1088]
    - [0, 20.821]
  - - [3520, 1088, 1, 256, 3520, 3520, 3520, 1088]
    - [0, 20.872]
  - - [3648, 1088, 1, 256, 3648, 3648, 3648, 1088]
    - [0, 20.9]
  - - [3776, 1088, 1, 256, 3776, 3776, 3776, 1088]
    - [0, 21.025]
  - - [3904, 1088, 1, 256, 3904, 3904, 3904, 1088]
    - [0, 20.989]
  - - [4032, 1088, 1, 256, 4032, 4032, 4032, 1088]
    - [0, 21.09]
  - - [64, 1216, 1, 256, 64, 64, 64, 1216]
    - [0, 7.176]
  - - [192, 1216, 1, 256, 192, 192, 192, 1216]
    - [0, 13.08]
  - - [320, 1216, 1, 256, 320, 320, 320, 1216]
    - [0, 15.715]
  - - [448, 1216, 1, 256, 448, 448, 448, 1216]
    - [0, 17.078]
  - - [576, 1216, 1, 256, 576, 576, 576, 1216]
    - [0, 18.131]
  - - [704, 1216, 1, 256, 704, 704, 704, 1216]
    - [0, 18.719]
  - - [832, 1216, 1, 256, 832, 832, 832, 1216]
    - [0, 19.21]
  - - [960, 1216, 1, 256, 960, 960, 960, 1216]
    - [0, 19.629]
  - - [1088, 1216, 1, 256, 1088, 1088, 1088, 1216]
    - [0, 19.817]
  - - [1216, 1216, 1, 256, 1216, 1216, 1216, 1216]
    - [0, 20.137]
  - - [1344, 1216, 1, 256, 1344, 1344, 1344, 1216]
    - [0, 20.356]
  - - [1472, 1216, 1, 256, 1472, 1472, 1472, 1216]
    - [0, 20.476]
  - - [1600, 1216, 1, 256, 1600, 1600, 1600, 1216]
    - [0, 19.545]
  - - [1728, 1216, 1, 256, 1728, 1728, 1728, 1216]
    - [0, 19.735]
  - - [1856, 1216, 1, 256, 1856, 1856, 1856, 1216]
    - [0, 19.894]
  - - [1984, 1216, 1, 256, 1984, 1984, 1984, 1216]
    - [0, 20.021]
  - - [2112, 1216, 1, 256, 2112, 2112, 2112, 1216]
    - [0, 20.257]
  - - [2240, 1216, 1, 256, 2240, 2240, 2240, 1216]
    - [0, 20.313]
  - - [2368, 1216, 1, 256, 2368, 2368, 2368, 1216]
    - [0, 20.394]
  - - [2496, 1216, 1, 256, 2496, 2496, 2496, 1216]
    - [0, 20.588]
  - - [2624, 1216, 1, 256, 2624, 2624, 2624, 1216]
    - [0, 20.658]
  - - [2752, 1216, 1, 256, 2752, 2752, 2752, 1216]
    - [0, 20.677]
  - - [2880, 1216, 1, 256, 2880, 2880, 2880, 1216]
    - [0, 20.671]
  - - [3008, 1216, 1, 256, 3008, 3008, 3008, 1216]
    - [0, 20.827]
  - - [3136, 1216, 1, 256, 3136, 3136, 3136, 1216]
    - [0, 20.896]
  - - [3264, 1216, 1, 256, 3264, 3264, 3264, 1216]
    - [0, 21.031]
  - - [3392, 1216, 1, 256, 3392, 3392, 3392, 1216]
    - [0, 20.992]
  - - [3520, 1216, 1, 256, 3520, 3520, 3520, 1216]
    - [0, 21.071]
  - - [3648, 1216, 1, 256, 3648, 3648, 3648, 1216]
    - [0, 21.086]
  - - [3776, 1216, 1, 256, 3776, 3776, 3776, 1216]
    - [0, 21.188]
  - - [3904, 1216, 1, 256, 3904, 3904, 3904, 1216]
    - [0, 21.136]
  - - [4032, 1216, 1, 256, 4032, 4032, 4032, 1216]
    - [0, 21.2]
  - - [64, 1344, 1, 256, 64, 64, 64, 1344]
    - [0, 7.921]
  - - [192, 1344, 1, 256, 192, 192, 192, 1344]
    - [0, 13.587]
  - - [320, 1344, 1, 256, 320, 320, 320, 1344]
    - [0, 16.185]
  - - [448, 1344, 1, 256, 448, 448, 448, 1344]
    - [0, 17.476]
  - - [576, 1344, 1, 256, 576, 576, 576, 1344]
    - [0, 18.453]
  - - [704, 1344, 1, 256, 704, 704, 704, 1344]
    - [0, 19.005]
  - - [832, 1344, 1, 256, 832, 832, 832, 1344]
    - [0, 19.468]
  - - [960, 1344, 1, 256, 960, 960, 960, 1344]
    - [0, 19.831]
  - - [1088, 1344, 1, 256, 1088, 1088, 1088, 1344]
    - [0, 20.086]
  - - [1216, 1344, 1, 256, 1216, 1216, 1216, 1344]
    - [0, 20.351]
  - - [1344, 1344, 1, 256, 1344, 1344, 1344, 1344]
    - [0, 20.481]
  - - [1472, 1344, 1, 256, 1472, 1472, 1472, 1344]
    - [0, 19.732]
  - - [1600, 1344, 1, 256, 1600, 1600, 1600, 1344]
    - [0, 19.747]
  - - [1728, 1344, 1, 256, 1728, 1728, 1728, 1344]
    - [0, 20.044]
  - - [1856, 1344, 1, 256, 1856, 1856, 1856, 1344]
    - [0, 20.133]
  - - [1984, 1344, 1, 256, 1984, 1984, 1984, 1344]
    - [0, 20.251]
  - - [2112, 1344, 1, 256, 2112, 2112, 2112, 1344]
    - [0, 20.367]
  - - [2240, 1344, 1, 256, 2240, 2240, 2240, 1344]
    - [0, 20.474]
  - - [2368, 1344, 1, 256, 2368, 2368, 2368, 1344]
    - [0, 20.703]
  - - [2496, 1344, 1, 256, 2496, 2496, 2496, 1344]
    - [0, 20.693]
  - - [2624, 1344, 1, 256, 2624, 2624, 2624, 1344]
    - [0, 20.811]
  - - [2752, 1344, 1, 256, 2752, 2752, 2752, 1344]
    - [0, 20.826]
  - - [2880, 1344, 1, 256, 2880, 2880, 2880, 1344]
    - [0, 20.88]
  - - [3008, 1344, 1, 256, 3008, 3008, 3008, 1344]
    - [0, 20.933]
  - - [3136, 1344, 1, 256, 3136, 3136, 3136, 1344]
    - [0, 20.983]
  - - [3264, 1344, 1, 256, 3264, 3264, 3264, 1344]
    - [0, 21.108]
  - - [3392, 1344, 1, 256, 3392, 3392, 3392, 1344]
    - [0, 21.154]
  - - [3520, 1344, 1, 256, 3520, 3520, 3520, 1344]
    - [0, 21.13]
  - - [3648, 1344, 1, 256, 3648, 3648, 3648, 1344]
    - [0, 21.176]
  - - [3776, 1344, 1, 256, 3776, 3776, 3776, 1344]
    - [0, 21.224]
  - - [3904, 1344, 1, 256, 3904, 3904, 3904, 1344]
    - [0, 21.219]
  - - [4032, 1344, 1, 256, 4032, 4032, 4032, 1344]
    - [0, 21.278]
  - - [64, 1472, 1, 256, 64, 64, 64, 1472]
    - [0, 7.763]
  - - [192, 1472, 1, 256, 192, 192, 192, 1472]
    - [0, 13.877]
  - - [320, 1472, 1, 256, 320, 320, 320, 1472]
    - [0, 16.415]
  - - [448, 1472, 1, 256, 448, 448, 448, 1472]
    - [0, 17.725]
  - - [576, 1472, 1, 256, 576, 576, 576, 1472]
    - [0, 18.594]
  - - [704, 1472, 1, 256, 704, 704, 704, 1472]
    - [0, 19.254]
  - - [832, 1472, 1, 256, 832, 832, 832, 1472]
    - [0, 19.677]
  - - [960, 1472, 1, 256, 960, 960, 960, 1472]
    - [0, 19.971]
  - - [1088, 1472, 1, 256, 1088, 1088, 1088, 1472]
    - [0, 20.268]
  - - [1216, 1472, 1, 256, 1216, 1216, 1216, 1472]
    - [0, 20.471]
  - - [1344, 1472, 1, 256, 1344, 1344, 1344, 1472]
    - [0, 19.693]
  - - [1472, 1472, 1, 256, 1472, 1472, 1472, 1472]
    - [0, 19.802]
  - - [1600, 1472, 1, 256, 1600, 1600, 1600, 1472]
    - [0, 20.023]
  - - [1728, 1472, 1, 256, 1728, 1728, 1728, 1472]
    - [0, 20.124]
  - - [1856, 1472, 1, 256, 1856, 1856, 1856, 1472]
    - [0, 20.303]
  - - [1984, 1472, 1, 256, 1984, 1984, 1984, 1472]
    - [0, 20.414]
  - - [2112, 1472, 1, 256, 2112, 2112, 2112, 1472]
    - [0, 20.555]
  - - [2240, 1472, 1, 256, 2240, 2240, 2240, 1472]
    - [0, 20.607]
  - - [2368, 1472, 1, 256, 2368, 2368, 2368, 1472]
    - [0, 20.733]
  - - [2496, 1472, 1, 256, 2496, 2496, 2496, 1472]
    - [0, 20.806]
  - - [2624, 1472, 1, 256, 2624, 2624, 2624, 1472]
    - [0, 20.932]
  - - [2752, 1472, 1, 256, 2752, 2752, 2752, 1472]
    - [0, 21.016]
  - - [2880, 1472, 1, 256, 2880, 2880, 2880, 1472]
    - [0, 21.004]
  - - [3008, 1472, 1, 256, 3008, 3008, 3008, 1472]
    - [0, 21.048]
  - - [3136, 1472, 1, 256, 3136, 3136, 3136, 1472]
    - [0, 21.128]
  - - [3264, 1472, 1, 256, 3264, 3264, 3264, 1472]
    - [0, 21.133]
  - - [3392, 1472, 1, 256, 3392, 3392, 3392, 1472]
    - [0, 21.256]
  - - [3520, 1472, 1, 256, 3520, 3520, 3520, 1472]
    - [0, 21.242]
  - - [3648, 1472, 1, 256, 3648, 3648, 3648, 1472]
    - [0, 21.301]
  - - [3776, 1472, 1, 256, 3776, 3776, 3776, 1472]
    - [0, 21.395]
  - - [3904, 1472, 1, 256, 3904, 3904, 3904, 1472]
    - [0, 21.39]
  - - [4032, 1472, 1, 256, 4032, 4032, 4032, 1472]
    - [0, 21.394]
  - - [64, 1600, 1, 256, 64, 64, 64, 1600]
    - [0, 8.403]
  - - [192, 1600, 1, 256, 192, 192, 192, 1600]
    - [0, 14.746]
  - - [320, 1600, 1, 256, 320, 320, 320, 1600]
    - [0, 16.764]
  - - [448, 1600, 1, 256, 448, 448, 448, 1600]
    - [0, 18.215]
  - - [576, 1600, 1, 256, 576, 576, 576, 1600]
    - [0, 19.038]
  - - [704, 1600, 1, 256, 704, 704, 704, 1600]
    - [0, 19.486]
  - - [832, 1600, 1, 256, 832, 832, 832, 1600]
    - [0, 19.784]
  - - [960, 1600, 1, 256, 960, 960, 960, 1600]
    - [0, 20.196]
  - - [1088, 1600, 1, 256, 1088, 1088, 1088, 1600]
    - [0, 20.376]
  - - [1216, 1600, 1, 256, 1216, 1216, 1216, 1600]
    - [0, 19.547]
  - - [1344, 1600, 1, 256, 1344, 1344, 1344, 1600]
    - [0, 19.813]
  - - [1472, 1600, 1, 256, 1472, 1472, 1472, 1600]
    - [0, 20.05]
  - - [1600, 1600, 1, 256, 1600, 1600, 1600, 1600]
    - [0, 20.163]
  - - [1728, 1600, 1, 256, 1728, 1728, 1728, 1600]
    - [0, 20.28]
  - - [1856, 1600, 1, 256, 1856, 1856, 1856, 1600]
    - [0, 20.469]
  - - [1984, 1600, 1, 256, 1984, 1984, 1984, 1600]
    - [0, 20.654]
  - - [2112, 1600, 1, 256, 2112, 2112, 2112, 1600]
    - [0, 20.698]
  - - [2240, 1600, 1, 256, 2240, 2240, 2240, 1600]
    - [0, 20.805]
  - - [2368, 1600, 1, 256, 2368, 2368, 2368, 1600]
    - [0, 20.939]
  - - [2496, 1600, 1, 256, 2496, 2496, 2496, 1600]
    - [0, 20.936]
  - - [2624, 1600, 1, 256, 2624, 2624, 2624, 1600]
    - [0, 21.006]
  - - [2752, 1600, 1, 256, 2752, 2752, 2752, 1600]
    - [0, 21.089]
  - - [2880, 1600, 1, 256, 2880, 2880, 2880, 1600]
    - [0, 21.131]
  - - [3008, 1600, 1, 256, 3008, 3008, 3008, 1600]
    - [0, 21.106]
  - - [3136, 1600, 1, 256, 3136, 3136, 3136, 1600]
    - [0, 21.225]
  - - [3264, 1600, 1, 256, 3264, 3264, 3264, 1600]
    - [0, 21.231]
  - - [3392, 1600, 1, 256, 3392, 3392, 3392, 1600]
    - [0, 21.368]
  - - [3520, 1600, 1, 256, 3520, 3520, 3520, 1600]
    - [0, 21.257]
  - - [3648, 1600, 1, 256, 3648, 3648, 3648, 1600]
    - [0, 21.378]
  - - [3776, 1600, 1, 256, 3776, 3776, 3776, 1600]
    - [0, 21.401]
  - - [3904, 1600, 1, 256, 3904, 3904, 3904, 1600]
    - [0, 21.453]
  - - [4032, 1600, 1, 256, 4032, 4032, 4032, 1600]
    - [0, 21.477]
  - - [64, 1728, 1, 256, 64, 64, 64, 1728]
    - [0, 9.04]
  - - [192, 1728, 1, 256, 192, 192, 192, 1728]
    - [0, 14.972]
  - - [320, 1728, 1, 256, 320, 320, 320, 1728]
    - [0, 17.16]
  - - [448, 1728, 1, 256, 448, 448, 448, 1728]
    - [0, 18.339]
  - - [576, 1728, 1, 256, 576, 576, 576, 1728]
    - [0, 19.149]
  - - [704, 1728, 1, 256, 704, 704, 704, 1728]
    - [0, 19.69]
  - - [832, 1728, 1, 256, 832, 832, 832, 1728]
    - [0, 20.017]
  - - [960, 1728, 1, 256, 960, 960, 960, 1728]
    - [0, 20.316]
  - - [1088, 1728, 1, 256, 1088, 1088, 1088, 1728]
    - [0, 18.914]
  - - [1216, 1728, 1, 256, 1216, 1216, 1216, 1728]
    - [0, 19.722]
  - - [1344, 1728, 1, 256, 1344, 1344, 1344, 1728]
    - [0, 20.025]
  - - [1472, 1728, 1, 256, 1472, 1472, 1472, 1728]
    - [0, 20.121]
  - - [1600, 1728, 1, 256, 1600, 1600, 1600, 1728]
    - [0, 20.285]
  - - [1728, 1728, 1, 256, 1728, 1728, 1728, 1728]
    - [0, 20.466]
  - - [1856, 1728, 1, 256, 1856, 1856, 1856, 1728]
    - [0, 20.554]
  - - [1984, 1728, 1, 256, 1984, 1984, 1984, 1728]
    - [0, 20.699]
  - - [2112, 1728, 1, 256, 2112, 2112, 2112, 1728]
    - [0, 20.838]
  - - [2240, 1728, 1, 256, 2240, 2240, 2240, 1728]
    - [0, 20.882]
  - - [2368, 1728, 1, 256, 2368, 2368, 2368, 1728]
    - [0, 21.021]
  - - [2496, 1728, 1, 256, 2496, 2496, 2496, 1728]
    - [0, 21.168]
  - - [2624, 1728, 1, 256, 2624, 2624, 2624, 1728]
    - [0, 21.151]
  - - [2752, 1728, 1, 256, 2752, 2752, 2752, 1728]
    - [0, 21.163]
  - - [2880, 1728, 1, 256, 2880, 2880, 2880, 1728]
    - [0, 21.188]
  - - [3008, 1728, 1, 256, 3008, 3008, 3008, 1728]
    - [0, 21.166]
  - - [3136, 1728, 1, 256, 3136, 3136, 3136, 1728]
    - [0, 21.304]
  - - [3264, 1728, 1, 256, 3264, 3264, 3264, 1728]
    - [0, 21.404]
  - - [3392, 1728, 1, 256, 3392, 3392, 3392, 1728]
    - [0, 21.477]
  - - [3520, 1728, 1, 256, 3520, 3520, 3520, 1728]
    - [0, 21.381]
  - - [3648, 1728, 1, 256, 3648, 3648, 3648, 1728]
    - [0, 21.537]
  - - [3776, 1728, 1, 256, 3776, 3776, 3776, 1728]
    - [0, 21.521]
  - - [3904, 1728, 1, 256, 3904, 3904, 3904, 1728]
    - [0, 21.578]
  - - [4032, 1728, 1, 256, 4032, 4032, 4032, 1728]
    - [0, 21.567]
  - - [64, 1856, 1, 256, 64, 64, 64, 1856]
    - [0, 9.71]
  - - [192, 1856, 1, 256, 192, 192, 192, 1856]
    - [0, 15.248]
  - - [320, 1856, 1, 256, 320, 320, 320, 1856]
    - [0, 17.376]
  - - [448, 1856, 1, 256, 448, 448, 448, 1856]
    - [0, 18.583]
  - - [576, 1856, 1, 256, 576, 576, 576, 1856]
    - [0, 19.346]
  - - [704, 1856, 1, 256, 704, 704, 704, 1856]
    - [0, 19.93]
  - - [832, 1856, 1, 256, 832, 832, 832, 1856]
    - [0, 20.256]
  - - [960, 1856, 1, 256, 960, 960, 960, 1856]
    - [0, 20.414]
  - - [1088, 1856, 1, 256, 1088, 1088, 1088, 1856]
    - [0, 19.695]
  - - [1216, 1856, 1, 256, 1216, 1216, 1216, 1856]
    - [0, 19.915]
  - - [1344, 1856, 1, 256, 1344, 1344, 1344, 1856]
    - [0, 20.129]
  - - [1472, 1856, 1, 256, 1472, 1472, 1472, 1856]
    - [0, 20.384]
  - - [1600, 1856, 1, 256, 1600, 1600, 1600, 1856]
    - [0, 20.464]
  - - [1728, 1856, 1, 256, 1728, 1728, 1728, 1856]
    - [0, 20.674]
  - - [1856, 1856, 1, 256, 1856, 1856, 1856, 1856]
    - [0, 20.832]
  - - [1984, 1856, 1, 256, 1984, 1984, 1984, 1856]
    - [0, 20.86]
  - - [2112, 1856, 1, 256, 2112, 2112, 2112, 1856]
    - [0, 20.984]
  - - [2240, 1856, 1, 256, 2240, 2240, 2240, 1856]
    - [0, 21.091]
  - - [2368, 1856, 1, 256, 2368, 2368, 2368, 1856]
    - [0, 21.175]
  - - [2496, 1856, 1, 256, 2496, 2496, 2496, 1856]
    - [0, 21.154]
  - - [2624, 1856, 1, 256, 2624, 2624, 2624, 1856]
    - [0, 21.322]
  - - [2752, 1856, 1, 256, 2752, 2752, 2752, 1856]
    - [0, 21.307]
  - - [2880, 1856, 1, 256, 2880, 2880, 2880, 1856]
    - [0, 21.268]
  - - [3008, 1856, 1, 256, 3008, 3008, 3008, 1856]
    - [0, 21.403]
  - - [3136, 1856, 1, 256, 3136, 3136, 3136, 1856]
    - [0, 21.429]
  - - [3264, 1856, 1, 256, 3264, 3264, 3264, 1856]
    - [0, 21.41]
  - - [3392, 1856, 1, 256, 3392, 3392, 3392, 1856]
    - [0, 21.424]
  - - [3520, 1856, 1, 256, 3520, 3520, 3520, 1856]
    - [0, 21.592]
  - - [3648, 1856, 1, 256, 3648, 3648, 3648, 1856]
    - [0, 21.494]
  - - [3776, 1856, 1, 256, 3776, 3776, 3776, 1856]
    - [0, 21.522]
  - - [3904, 1856, 1, 256, 3904, 3904, 3904, 1856]
    - [0, 21.535]
  - - [4032, 1856, 1, 256, 4032, 4032, 4032, 1856]
    - [0, 21.646]
  - - [64, 1984, 1, 256, 64, 64, 64, 1984]
    - [0, 9.448]
  - - [192, 1984, 1, 256, 192, 192, 192, 1984]
    - [0, 15.486]
  - - [320, 1984, 1, 256, 320, 320, 320, 1984]
    - [0, 17.768]
  - - [448, 1984, 1, 256, 448, 448, 448, 1984]
    - [0, 18.816]
  - - [576, 1984, 1, 256, 576, 576, 576, 1984]
    - [0, 19.561]
  - - [704, 1984, 1, 256, 704, 704, 704, 1984]
    - [0, 20.055]
  - - [832, 1984, 1, 256, 832, 832, 832, 1984]
    - [0, 20.376]
  - - [960, 1984, 1, 256, 960, 960, 960, 1984]
    - [0, 19.151]
  - - [1088, 1984, 1, 256, 1088, 1088, 1088, 1984]
    - [0, 19.775]
  - - [1216, 1984, 1, 256, 1216, 1216, 1216, 1984]
    - [0, 19.966]
  - - [1344, 1984, 1, 256, 1344, 1344, 1344, 1984]
    - [0, 20.201]
  - - [1472, 1984, 1, 256, 1472, 1472, 1472, 1984]
    - [0, 20.467]
  - - [1600, 1984, 1, 256, 1600, 1600, 1600, 1984]
    - [0, 20.56]
  - - [1728, 1984, 1, 256, 1728, 1728, 1728, 1984]
    - [0, 20.719]
  - - [1856, 1984, 1, 256, 1856, 1856, 1856, 1984]
    - [0, 20.872]
  - - [1984, 1984, 1, 256, 1984, 1984, 1984, 1984]
    - [0, 20.917]
  - - [2112, 1984, 1, 256, 2112, 2112, 2112, 1984]
    - [0, 21.053]
  - - [2240, 1984, 1, 256, 2240, 2240, 2240, 1984]
    - [0, 21.059]
  - - [2368, 1984, 1, 256, 2368, 2368, 2368, 1984]
    - [0, 21.297]
  - - [2496, 1984, 1, 256, 2496, 2496, 2496, 1984]
    - [0, 21.348]
  - - [2624, 1984, 1, 256, 2624, 2624, 2624, 1984]
    - [0, 21.232]
  - - [2752, 1984, 1, 256, 2752, 2752, 2752, 1984]
    - [0, 21.351]
  - - [2880, 1984, 1, 256, 2880, 2880, 2880, 1984]
    - [0, 21.317]
  - - [3008, 1984, 1, 256, 3008, 3008, 3008, 1984]
    - [0, 21.393]
  - - [3136, 1984, 1, 256, 3136, 3136, 3136, 1984]
    - [0, 21.476]
  - - [3264, 1984, 1, 256, 3264, 3264, 3264, 1984]
    - [0, 21.424]
  - - [3392, 1984, 1, 256, 3392, 3392, 3392, 1984]
    - [0, 21.537]
  - - [3520, 1984, 1, 256, 3520, 3520, 3520, 1984]
    - [0, 21.571]
  - - [3648, 1984, 1, 256, 3648, 3648, 3648, 1984]
    - [0, 21.584]
  - - [3776, 1984, 1, 256, 3776, 3776, 3776, 1984]
    - [0, 21.623]
  - - [3904, 1984, 1, 256, 3904, 3904, 3904, 1984]
    - [0, 21.615]
  - - [4032, 1984, 1, 256, 4032, 4032, 4032, 1984]
    - [0, 21.615]
  - - [64, 2112, 1, 256, 64, 64, 64, 2112]
    - [0, 9.957]
  - - [192, 2112, 1, 256, 192, 192, 192, 2112]
    - [0, 15.686]
  - - [320, 2112, 1, 256, 320, 320, 320, 2112]
    - [0, 17.99]
  - - [448, 2112, 1, 256, 448, 448, 448, 2112]
    - [0, 19.03]
  - - [576, 2112, 1, 256, 576, 576, 576, 2112]
    - [0, 19.617]
  - - [704, 2112, 1, 256, 704, 704, 704, 2112]
    - [0, 20.177]
  - - [832, 2112, 1, 256, 832, 832, 832, 2112]
    - [0, 20.444]
  - - [960, 2112, 1, 256, 960, 960, 960, 2112]
    - [0, 19.789]
  - - [1088, 2112, 1, 256, 1088, 1088, 1088, 2112]
    - [0, 19.975]
  - - [1216, 2112, 1, 256, 1216, 1216, 1216, 2112]
    - [0, 20.322]
  - - [1344, 2112, 1, 256, 1344, 1344, 1344, 2112]
    - [0, 20.352]
  - - [1472, 2112, 1, 256, 1472, 1472, 1472, 2112]
    - [0, 20.6]
  - - [1600, 2112, 1, 256, 1600, 1600, 1600, 2112]
    - [0, 20.614]
  - - [1728, 2112, 1, 256, 1728, 1728, 1728, 2112]
    - [0, 20.833]
  - - [1856, 2112, 1, 256, 1856, 1856, 1856, 2112]
    - [0, 20.877]
  - - [1984, 2112, 1, 256, 1984, 1984, 1984, 2112]
    - [0, 20.986]
  - - [2112, 2112, 1, 256, 2112, 2112, 2112, 2112]
    - [0, 21.01]
  - - [2240, 2112, 1, 256, 2240, 2240, 2240, 2112]
    - [0, 21.056]
  - - [2368, 2112, 1, 256, 2368, 2368, 2368, 2112]
    - [0, 21.284]
  - - [2496, 2112, 1, 256, 2496, 2496, 2496, 2112]
    - [0, 21.301]
  - - [2624, 2112, 1, 256, 2624, 2624, 2624, 2112]
    - [0, 21.343]
  - - [2752, 2112, 1, 256, 2752, 2752, 2752, 2112]
    - [0, 21.426]
  - - [2880, 2112, 1, 256, 2880, 2880, 2880, 2112]
    - [0, 21.406]
  - - [3008, 2112, 1, 256, 3008, 3008, 3008, 2112]
    - [0, 21.532]
  - - [3136, 2112, 1, 256, 3136, 3136, 3136, 2112]
    - [0, 21.548]
  - - [3264, 2112, 1, 256, 3264, 3264, 3264, 2112]
    - [0, 21.646]
  - - [3392, 2112, 1, 256, 3392, 3392, 3392, 2112]
    - [0, 21.623]
  - - [3520, 2112, 1, 256, 3520, 3520, 3520, 2112]
    - [0, 21.536]
  - - [3648, 2112, 1, 256, 3648, 3648, 3648, 2112]
    - [0, 21.593]
  - - [3776, 2112, 1, 256, 3776, 3776, 3776, 2112]
    - [0, 21.649]
  - - [3904, 2112, 1, 256, 3904, 3904, 3904, 2112]
    - [0, 21.61]
  - - [4032, 2112, 1, 256, 4032, 4032, 4032, 2112]
    - [0, 21.727]
  - - [64, 2240, 1, 256, 64, 64, 64, 2240]
    - [0, 10.477]
  - - [192, 2240, 1, 256, 192, 192, 192, 2240]
    - [0, 16.205]
  - - [320, 2240, 1, 256, 320, 320, 320, 2240]
    - [0, 18.049]
  - - [448, 2240, 1, 256, 448, 448, 448, 2240]
    - [0, 19.125]
  - - [576, 2240, 1, 256, 576, 576, 576, 2240]
    - [0, 19.912]
  - - [704, 2240, 1, 256, 704, 704, 704, 2240]
    - [0, 20.159]
  - - [832, 2240, 1, 256, 832, 832, 832, 2240]
    - [0, 18.761]
  - - [960, 2240, 1, 256, 960, 960, 960, 2240]
    - [0, 19.758]
  - - [1088, 2240, 1, 256, 1088, 1088, 1088, 2240]
    - [0, 20.124]
  - - [1216, 2240, 1, 256, 1216, 1216, 1216, 2240]
    - [0, 20.29]
  - - [1344, 2240, 1, 256, 1344, 1344, 1344, 2240]
    - [0, 20.572]
  - - [1472, 2240, 1, 256, 1472, 1472, 1472, 2240]
    - [0, 20.636]
  - - [1600, 2240, 1, 256, 1600, 1600, 1600, 2240]
    - [0, 20.764]
  - - [1728, 2240, 1, 256, 1728, 1728, 1728, 2240]
    - [0, 20.975]
  - - [1856, 2240, 1, 256, 1856, 1856, 1856, 2240]
    - [0, 21.029]
  - - [1984, 2240, 1, 256, 1984, 1984, 1984, 2240]
    - [0, 21.109]
  - - [2112, 2240, 1, 256, 2112, 2112, 2112, 2240]
    - [0, 21.163]
  - - [2240, 2240, 1, 256, 2240, 2240, 2240, 2240]
    - [0, 21.217]
  - - [2368, 2240, 1, 256, 2368, 2368, 2368, 2240]
    - [0, 21.325]
  - - [2496, 2240, 1, 256, 2496, 2496, 2496, 2240]
    - [0, 21.433]
  - - [2624, 2240, 1, 256, 2624, 2624, 2624, 2240]
    - [0, 21.368]
  - - [2752, 2240, 1, 256, 2752, 2752, 2752, 2240]
    - [0, 21.52]
  - - [2880, 2240, 1, 256, 2880, 2880, 2880, 2240]
    - [0, 21.546]
  - - [3008, 2240, 1, 256, 3008, 3008, 3008, 2240]
    - [0, 21.55]
  - - [3136, 2240, 1, 256, 3136, 3136, 3136, 2240]
    - [0, 21.535]
  - - [3264, 2240, 1, 256, 3264, 3264, 3264, 2240]
    - [0, 21.681]
  - - [3392, 2240, 1, 256, 3392, 3392, 3392, 2240]
    - [0, 21.621]
  - - [3520, 2240, 1, 256, 3520, 3520, 3520, 2240]
    - [0, 21.619]
  - - [3648, 2240, 1, 256, 3648, 3648, 3648, 2240]
    - [0, 21.66]
  - - [3776, 2240, 1, 256, 3776, 3776, 3776, 2240]
    - [0, 21.54]
  - - [3904, 2240, 1, 256, 3904, 3904, 3904, 2240]
    - [0, 21.676]
  - - [4032, 2240, 1, 256, 4032, 4032, 4032, 2240]
    - [0, 21.719]
  - - [64, 2368, 1, 256, 64, 64, 64, 2368]
    - [0, 11.068]
  - - [192, 2368, 1, 256, 192, 192, 192, 2368]
    - [0, 16.351]
  - - [320, 2368, 1, 256, 320, 320, 320, 2368]
    - [0, 18.272]
  - - [448, 2368, 1, 256, 448, 448, 448, 2368]
    - [0, 19.249]
  - - [576, 2368, 1, 256, 576, 576, 576, 2368]
    - [0, 19.912]
  - - [704, 2368, 1, 256, 704, 704, 704, 2368]
    - [0, 20.35]
  - - [832, 2368, 1, 256, 832, 832, 832, 2368]
    - [0, 19.754]
  - - [960, 2368, 1, 256, 960, 960, 960, 2368]
    - [0, 19.96]
  - - [1088, 2368, 1, 256, 1088, 1088, 1088, 2368]
    - [0, 20.25]
  - - [1216, 2368, 1, 256, 1216, 1216, 1216, 2368]
    - [0, 20.442]
  - - [1344, 2368, 1, 256, 1344, 1344, 1344, 2368]
    - [0, 20.574]
  - - [1472, 2368, 1, 256, 1472, 1472, 1472, 2368]
    - [0, 20.702]
  - - [1600, 2368, 1, 256, 1600, 1600, 1600, 2368]
    - [0, 20.909]
  - - [1728, 2368, 1, 256, 1728, 1728, 1728, 2368]
    - [0, 21.072]
  - - [1856, 2368, 1, 256, 1856, 1856, 1856, 2368]
    - [0, 21.156]
  - - [1984, 2368, 1, 256, 1984, 1984, 1984, 2368]
    - [0, 21.11]
  - - [2112, 2368, 1, 256, 2112, 2112, 2112, 2368]
    - [0, 21.305]
  - - [2240, 2368, 1, 256, 2240, 2240, 2240, 2368]
    - [0, 21.336]
  - - [2368, 2368, 1, 256, 2368, 2368, 2368, 2368]
    - [0, 21.4]
  - - [2496, 2368, 1, 256, 2496, 2496, 2496, 2368]
    - [0, 21.367]
  - - [2624, 2368, 1, 256, 2624, 2624, 2624, 2368]
    - [0, 21.539]
  - - [2752, 2368, 1, 256, 2752, 2752, 2752, 2368]
    - [0, 21.589]
  - - [2880, 2368, 1, 256, 2880, 2880, 2880, 2368]
    - [0, 21.51]
  - - [3008, 2368, 1, 256, 3008, 3008, 3008, 2368]
    - [0, 21.614]
  - - [3136, 2368, 1, 256, 3136, 3136, 3136, 2368]
    - [0, 21.541]
  - - [3264, 2368, 1, 256, 3264, 3264, 3264, 2368]
    - [0, 21.648]
  - - [3392, 2368, 1, 256, 3392, 3392, 3392, 2368]
    - [0, 21.556]
  - - [3520, 2368, 1, 256, 3520, 3520, 3520, 2368]
    - [0, 21.661]
  - - [3648, 2368, 1, 256, 3648, 3648, 3648, 2368]
    - [0, 21.735]
  - - [3776, 2368, 1, 256, 3776, 3776, 3776, 2368]
    - [0, 21.689]
  - - [3904, 2368, 1, 256, 3904, 3904, 3904, 2368]
    - [0, 21.614]
  - - [4032, 2368, 1, 256, 4032, 4032, 4032, 2368]
    - [0, 21.65]
  - - [64, 2496, 1, 256, 64, 64, 64, 2496]
    - [0, 10.687]
  - - [192, 2496, 1, 256, 192, 192, 192, 2496]
    - [0, 16.499]
  - - [320, 2496, 1, 256, 320, 320, 320, 2496]
    - [0, 18.516]
  - - [448, 2496, 1, 256, 448, 448, 448, 2496]
    - [0, 19.438]
  - - [576, 2496, 1, 256, 576, 576, 576, 2496]
    - [0, 20.159]
  - - [704, 2496, 1, 256, 704, 704, 704, 2496]
    - [0, 20.504]
  - - [832, 2496, 1, 256, 832, 832, 832, 2496]
    - [0, 19.72]
  - - [960, 2496, 1, 256, 960, 960, 960, 2496]
    - [0, 20.064]
  - - [1088, 2496, 1, 256, 1088, 1088, 1088, 2496]
    - [0, 20.268]
  - - [1216, 2496, 1, 256, 1216, 1216, 1216, 2496]
    - [0, 20.504]
  - - [1344, 2496, 1, 256, 1344, 1344, 1344, 2496]
    - [0, 20.704]
  - - [1472, 2496, 1, 256, 1472, 1472, 1472, 2496]
    - [0, 20.817]
  - - [1600, 2496, 1, 256, 1600, 1600, 1600, 2496]
    - [0, 20.91]
  - - [1728, 2496, 1, 256, 1728, 1728, 1728, 2496]
    - [0, 21.013]
  - - [1856, 2496, 1, 256, 1856, 1856, 1856, 2496]
    - [0, 21.183]
  - - [1984, 2496, 1, 256, 1984, 1984, 1984, 2496]
    - [0, 21.223]
  - - [2112, 2496, 1, 256, 2112, 2112, 2112, 2496]
    - [0, 21.364]
  - - [2240, 2496, 1, 256, 2240, 2240, 2240, 2496]
    - [0, 21.304]
  - - [2368, 2496, 1, 256, 2368, 2368, 2368, 2496]
    - [0, 21.427]
  - - [2496, 2496, 1, 256, 2496, 2496, 2496, 2496]
    - [0, 21.551]
  - - [2624, 2496, 1, 256, 2624, 2624, 2624, 2496]
    - [0, 21.592]
  - - [2752, 2496, 1, 256, 2752, 2752, 2752, 2496]
    - [0, 21.559]
  - - [2880, 2496, 1, 256, 2880, 2880, 2880, 2496]
    - [0, 21.564]
  - - [3008, 2496, 1, 256, 3008, 3008, 3008, 2496]
    - [0, 21.691]
  - - [3136, 2496, 1, 256, 3136, 3136, 3136, 2496]
    - [0, 21.662]
  - - [3264, 2496, 1, 256, 3264, 3264, 3264, 2496]
    - [0, 21.526]
  - - [3392, 2496, 1, 256, 3392, 3392, 3392, 2496]
    - [0, 21.582]
  - - [3520, 2496, 1, 256, 3520, 3520, 3520, 2496]
    - [0, 21.726]
  - - [3648, 2496, 1, 256, 3648, 3648, 3648, 2496]
    - [0, 21.657]
  - - [3776, 2496, 1, 256, 3776, 3776, 3776, 2496]
    - [0, 21.625]
  - - [3904, 2496, 1, 256, 3904, 3904, 3904, 2496]
    - [0, 21.671]
  - - [4032, 2496, 1, 256, 4032, 4032, 4032, 2496]
    - [0, 21.751]
  - - [64, 2624, 1, 256, 64, 64, 64, 2624]
    - [0, 11.17]
  - - [192, 2624, 1, 256, 192, 192, 192, 2624]
    - [0, 16.639]
  - - [320, 2624, 1, 256, 320, 320, 320, 2624]
    - [0, 18.659]
  - - [448, 2624, 1, 256, 448, 448, 448, 2624]
    - [0, 19.673]
  - - [576, 2624, 1, 256, 576, 576, 576, 2624]
    - [0, 20.252]
  - - [704, 2624, 1, 256, 704, 704, 704, 2624]
    - [0, 18.6]
  - - [832, 2624, 1, 256, 832, 832, 832, 2624]
    - [0, 19.862]
  - - [960, 2624, 1, 256, 960, 960, 960, 2624]
    - [0, 20.193]
  - - [1088, 2624, 1, 256, 1088, 1088, 1088, 2624]
    - [0, 20.397]
  - - [1216, 2624, 1, 256, 1216, 1216, 1216, 2624]
    - [0, 20.598]
  - - [1344, 2624, 1, 256, 1344, 1344, 1344, 2624]
    - [0, 20.916]
  - - [1472, 2624, 1, 256, 1472, 1472, 1472, 2624]
    - [0, 20.823]
  - - [1600, 2624, 1, 256, 1600, 1600, 1600, 2624]
    - [0, 21.067]
  - - [1728, 2624, 1, 256, 1728, 1728, 1728, 2624]
    - [0, 21.179]
  - - [1856, 2624, 1, 256, 1856, 1856, 1856, 2624]
    - [0, 21.217]
  - - [1984, 2624, 1, 256, 1984, 1984, 1984, 2624]
    - [0, 21.325]
  - - [2112, 2624, 1, 256, 2112, 2112, 2112, 2624]
    - [0, 21.38]
  - - [2240, 2624, 1, 256, 2240, 2240, 2240, 2624]
    - [0, 21.406]
  - - [2368, 2624, 1, 256, 2368, 2368, 2368, 2624]
    - [0, 21.437]
  - - [2496, 2624, 1, 256, 2496, 2496, 2496, 2624]
    - [0, 21.519]
  - - [2624, 2624, 1, 256, 2624, 2624, 2624, 2624]
    - [0, 21.582]
  - - [2752, 2624, 1, 256, 2752, 2752, 2752, 2624]
    - [0, 21.658]
  - - [2880, 2624, 1, 256, 2880, 2880, 2880, 2624]
    - [0, 21.563]
  - - [3008, 2624, 1, 256, 3008, 3008, 3008, 2624]
    - [0, 21.675]
  - - [3136, 2624, 1, 256, 3136, 3136, 3136, 2624]
    - [0, 21.642]
  - - [3264, 2624, 1, 256, 3264, 3264, 3264, 2624]
    - [0, 21.793]
  - - [3392, 2624, 1, 256, 3392, 3392, 3392, 2624]
    - [0, 21.714]
  - - [3520, 2624, 1, 256, 3520, 3520, 3520, 2624]
    - [0, 21.574]
  - - [3648, 2624, 1, 256, 3648, 3648, 3648, 2624]
    - [0, 21.655]
  - - [3776, 2624, 1, 256, 3776, 3776, 3776, 2624]
    - [0, 21.673]
  - - [3904, 2624, 1, 256, 3904, 3904, 3904, 2624]
    - [0, 21.747]
  - - [4032, 2624, 1, 256, 4032, 4032, 4032, 2624]
    - [0, 21.742]
  - - [64, 2752, 1, 256, 64, 64, 64, 2752]
    - [0, 11.669]
  - - [192, 2752, 1, 256, 192, 192, 192, 2752]
    - [0, 16.912]
  - - [320, 2752, 1, 256, 320, 320, 320, 2752]
    - [0, 18.899]
  - - [448, 2752, 1, 256, 448, 448, 448, 2752]
    - [0, 19.748]
  - - [576, 2752, 1, 256, 576, 576, 576, 2752]
    - [0, 20.336]
  - - [704, 2752, 1, 256, 704, 704, 704, 2752]
    - [0, 19.466]
  - - [832, 2752, 1, 256, 832, 832, 832, 2752]
    - [0, 19.976]
  - - [960, 2752, 1, 256, 960, 960, 960, 2752]
    - [0, 20.282]
  - - [1088, 2752, 1, 256, 1088, 1088, 1088, 2752]
    - [0, 20.5]
  - - [1216, 2752, 1, 256, 1216, 1216, 1216, 2752]
    - [0, 20.646]
  - - [1344, 2752, 1, 256, 1344, 1344, 1344, 2752]
    - [0, 20.843]
  - - [1472, 2752, 1, 256, 1472, 1472, 1472, 2752]
    - [0, 20.908]
  - - [1600, 2752, 1, 256, 1600, 1600, 1600, 2752]
    - [0, 21.142]
  - - [1728, 2752, 1, 256, 1728, 1728, 1728, 2752]
    - [0, 21.197]
  - - [1856, 2752, 1, 256, 1856, 1856, 1856, 2752]
    - [0, 21.207]
  - - [1984, 2752, 1, 256, 1984, 1984, 1984, 2752]
    - [0, 21.382]
  - - [2112, 2752, 1, 256, 2112, 2112, 2112, 2752]
    - [0, 21.47]
  - - [2240, 2752, 1, 256, 2240, 2240, 2240, 2752]
    - [0, 21.416]
  - - [2368, 2752, 1, 256, 2368, 2368, 2368, 2752]
    - [0, 21.537]
  - - [2496, 2752, 1, 256, 2496, 2496, 2496, 2752]
    - [0, 21.606]
  - - [2624, 2752, 1, 256, 2624, 2624, 2624, 2752]
    - [0, 21.633]
  - - [2752, 2752, 1, 256, 2752, 2752, 2752, 2752]
    - [0, 21.681]
  - - [2880, 2752, 1, 256, 2880, 2880, 2880, 2752]
    - [0, 21.773]
  - - [3008, 2752, 1, 256, 3008, 3008, 3008, 2752]
    - [0, 21.65]
  - - [3136, 2752, 1, 256, 3136, 3136, 3136, 2752]
    - [0, 21.629]
  - - [3264, 2752, 1, 256, 3264, 3264, 3264, 2752]
    - [0, 21.702]
  - - [3392, 2752, 1, 256, 3392, 3392, 3392, 2752]
    - [0, 21.594]
  - - [3520, 2752, 1, 256, 3520, 3520, 3520, 2752]
    - [0, 21.609]
  - - [3648, 2752, 1, 256, 3648, 3648, 3648, 2752]
    - [0, 21.68]
  - - [3776, 2752, 1, 256, 3776, 3776, 3776, 2752]
    - [0, 21.68]
  - - [3904, 2752, 1, 256, 3904, 3904, 3904, 2752]
    - [0, 21.763]
  - - [4032, 2752, 1, 256, 4032, 4032, 4032, 2752]
    - [0, 21.795]
  - - [64, 2880, 1, 256, 64, 64, 64, 2880]
    - [0, 12.17]
  - - [192, 2880, 1, 256, 192, 192, 192, 2880]
    - [0, 17.216]
  - - [320, 2880, 1, 256, 320, 320, 320, 2880]
    - [0, 18.893]
  - - [448, 2880, 1, 256, 448, 448, 448, 2880]
    - [0, 19.794]
  - - [576, 2880, 1, 256, 576, 576, 576, 2880]
    - [0, 20.371]
  - - [704, 2880, 1, 256, 704, 704, 704, 2880]
    - [0, 19.79]
  - - [832, 2880, 1, 256, 832, 832, 832, 2880]
    - [0, 20.087]
  - - [960, 2880, 1, 256, 960, 960, 960, 2880]
    - [0, 20.426]
  - - [1088, 2880, 1, 256, 1088, 1088, 1088, 2880]
    - [0, 20.548]
  - - [1216, 2880, 1, 256, 1216, 1216, 1216, 2880]
    - [0, 20.762]
  - - [1344, 2880, 1, 256, 1344, 1344, 1344, 2880]
    - [0, 20.906]
  - - [1472, 2880, 1, 256, 1472, 1472, 1472, 2880]
    - [0, 21.033]
  - - [1600, 2880, 1, 256, 1600, 1600, 1600, 2880]
    - [0, 21.057]
  - - [1728, 2880, 1, 256, 1728, 1728, 1728, 2880]
    - [0, 21.236]
  - - [1856, 2880, 1, 256, 1856, 1856, 1856, 2880]
    - [0, 21.251]
  - - [1984, 2880, 1, 256, 1984, 1984, 1984, 2880]
    - [0, 21.313]
  - - [2112, 2880, 1, 256, 2112, 2112, 2112, 2880]
    - [0, 21.366]
  - - [2240, 2880, 1, 256, 2240, 2240, 2240, 2880]
    - [0, 21.463]
  - - [2368, 2880, 1, 256, 2368, 2368, 2368, 2880]
    - [0, 21.578]
  - - [2496, 2880, 1, 256, 2496, 2496, 2496, 2880]
    - [0, 21.597]
  - - [2624, 2880, 1, 256, 2624, 2624, 2624, 2880]
    - [0, 21.669]
  - - [2752, 2880, 1, 256, 2752, 2752, 2752, 2880]
    - [0, 21.646]
  - - [2880, 2880, 1, 256, 2880, 2880, 2880, 2880]
    - [0, 21.692]
  - - [3008, 2880, 1, 256, 3008, 3008, 3008, 2880]
    - [0, 21.691]
  - - [3136, 2880, 1, 256, 3136, 3136, 3136, 2880]
    - [0, 21.661]
  - - [3264, 2880, 1, 256, 3264, 3264, 3264, 2880]
    - [0, 21.627]
  - - [3392, 2880, 1, 256, 3392, 3392, 3392, 2880]
    - [0, 21.723]
  - - [3520, 2880, 1, 256, 3520, 3520, 3520, 2880]
    - [0, 21.635]
  - - [3648, 2880, 1, 256, 3648, 3648, 3648, 2880]
    - [0, 21.724]
  - - [3776, 2880, 1, 256, 3776, 3776, 3776, 2880]
    - [0, 21.695]
  - - [3904, 2880, 1, 256, 3904, 3904, 3904, 2880]
    - [0, 21.743]
  - - [4032, 2880, 1, 256, 4032, 4032, 4032, 2880]
    - [0, 21.819]
  - - [64, 3008, 1, 256, 64, 64, 64, 3008]
    - [0, 11.823]
  - - [192, 3008, 1, 256, 192, 192, 192, 3008]
    - [0, 17.39]
  - - [320, 3008, 1, 256, 320, 320, 320, 3008]
    - [0, 19.082]
  - - [448, 3008, 1, 256, 448, 448, 448, 3008]
    - [0, 19.946]
  - - [576, 3008, 1, 256, 576, 576, 576, 3008]
    - [0, 20.425]
  - - [704, 3008, 1, 256, 704, 704, 704, 3008]
    - [0, 19.833]
  - - [832, 3008, 1, 256, 832, 832, 832, 3008]
    - [0, 20.141]
  - - [960, 3008, 1, 256, 960, 960, 960, 3008]
    - [0, 20.471]
  - - [1088, 3008, 1, 256, 1088, 1088, 1088, 3008]
    - [0, 20.673]
  - - [1216, 3008, 1, 256, 1216, 1216, 1216, 3008]
    - [0, 20.825]
  - - [1344, 3008, 1, 256, 1344, 1344, 1344, 3008]
    - [0, 20.917]
  - - [1472, 3008, 1, 256, 1472, 1472, 1472, 3008]
    - [0, 21.132]
  - - [1600, 3008, 1, 256, 1600, 1600, 1600, 3008]
    - [0, 21.253]
  - - [1728, 3008, 1, 256, 1728, 1728, 1728, 3008]
    - [0, 21.247]
  - - [1856, 3008, 1, 256, 1856, 1856, 1856, 3008]
    - [0, 21.385]
  - - [1984, 3008, 1, 256, 1984, 1984, 1984, 3008]
    - [0, 21.382]
  - - [2112, 3008, 1, 256, 2112, 2112, 2112, 3008]
    - [0, 21.449]
  - - [2240, 3008, 1, 256, 2240, 2240, 2240, 3008]
    - [0, 21.537]
  - - [2368, 3008, 1, 256, 2368, 2368, 2368, 3008]
    - [0, 21.587]
  - - [2496, 3008, 1, 256, 2496, 2496, 2496, 3008]
    - [0, 21.625]
  - - [2624, 3008, 1, 256, 2624, 2624, 2624, 3008]
    - [0, 21.779]
  - - [2752, 3008, 1, 256, 2752, 2752, 2752, 3008]
    - [0, 21.584]
  - - [2880, 3008, 1, 256, 2880, 2880, 2880, 3008]
    - [0, 21.667]
  - - [3008, 3008, 1, 256, 3008, 3008, 3008, 3008]
    - [0, 21.643]
  - - [3136, 3008, 1, 256, 3136, 3136, 3136, 3008]
    - [0, 21.667]
  - - [3264, 3008, 1, 256, 3264, 3264, 3264, 3008]
    - [0, 21.636]
  - - [3392, 3008, 1, 256, 3392, 3392, 3392, 3008]
    - [0, 21.622]
  - - [3520, 3008, 1, 256, 3520, 3520, 3520, 3008]
    - [0, 21.73]
  - - [3648, 3008, 1, 256, 3648, 3648, 3648, 3008]
    - [0, 21.717]
  - - [3776, 3008, 1, 256, 3776, 3776, 3776, 3008]
    - [0, 21.769]
  - - [3904, 3008, 1, 256, 3904, 3904, 3904, 3008]
    - [0, 21.752]
  - - [4032, 3008, 1, 256, 4032, 4032, 4032, 3008]
    - [0, 21.847]
  - - [64, 3136, 1, 256, 64, 64, 64, 3136]
    - [0, 12.228]
  - - [192, 3136, 1, 256, 192, 192, 192, 3136]
    - [0, 17.497]
  - - [320, 3136, 1, 256, 320, 320, 320, 3136]
    - [0, 19.223]
  - - [448, 3136, 1, 256, 448, 448, 448, 3136]
    - [0, 19.953]
  - - [576, 3136, 1, 256, 576, 576, 576, 3136]
    - [0, 20.512]
  - - [704, 3136, 1, 256, 704, 704, 704, 3136]
    - [0, 19.945]
  - - [832, 3136, 1, 256, 832, 832, 832, 3136]
    - [0, 20.292]
  - - [960, 3136, 1, 256, 960, 960, 960, 3136]
    - [0, 20.553]
  - - [1088, 3136, 1, 256, 1088, 1088, 1088, 3136]
    - [0, 20.681]
  - - [1216, 3136, 1, 256, 1216, 1216, 1216, 3136]
    - [0, 20.841]
  - - [1344, 3136, 1, 256, 1344, 1344, 1344, 3136]
    - [0, 21.057]
  - - [1472, 3136, 1, 256, 1472, 1472, 1472, 3136]
    - [0, 21.179]
  - - [1600, 3136, 1, 256, 1600, 1600, 1600, 3136]
    - [0, 21.214]
  - - [1728, 3136, 1, 256, 1728, 1728, 1728, 3136]
    - [0, 21.275]
  - - [1856, 3136, 1, 256, 1856, 1856, 1856, 3136]
    - [0, 21.495]
  - - [1984, 3136, 1, 256, 1984, 1984, 1984, 3136]
    - [0, 21.544]
  - - [2112, 3136, 1, 256, 2112, 2112, 2112, 3136]
    - [0, 21.493]
  - - [2240, 3136, 1, 256, 2240, 2240, 2240, 3136]
    - [0, 21.629]
  - - [2368, 3136, 1, 256, 2368, 2368, 2368, 3136]
    - [0, 21.747]
  - - [2496, 3136, 1, 256, 2496, 2496, 2496, 3136]
    - [0, 21.691]
  - - [2624, 3136, 1, 256, 2624, 2624, 2624, 3136]
    - [0, 21.502]
  - - [2752, 3136, 1, 256, 2752, 2752, 2752, 3136]
    - [0, 21.739]
  - - [2880, 3136, 1, 256, 2880, 2880, 2880, 3136]
    - [0, 21.686]
  - - [3008, 3136, 1, 256, 3008, 3008, 3008, 3136]
    - [0, 21.586]
  - - [3136, 3136, 1, 256, 3136, 3136, 3136, 3136]
    - [0, 21.682]
  - - [3264, 3136, 1, 256, 3264, 3264, 3264, 3136]
    - [0, 21.732]
  - - [3392, 3136, 1, 256, 3392, 3392, 3392, 3136]
    - [0, 21.793]
  - - [3520, 3136, 1, 256, 3520, 3520, 3520, 3136]
    - [0, 21.703]
  - - [3648, 3136, 1, 256, 3648, 3648, 3648, 3136]
    - [0, 21.718]
  - - [3776, 3136, 1, 256, 3776, 3776, 3776, 3136]
    - [0, 21.724]
  - - [3904, 3136, 1, 256, 3904, 3904, 3904, 3136]
    - [0, 21.783]
  - - [4032, 3136, 1, 256, 4032, 4032, 4032, 3136]
    - [0, 21.854]
  - - [64, 3264, 1, 256, 64, 64, 64, 3264]
    - [0, 12.682]
  - - [192, 3264, 1, 256, 192, 192, 192, 3264]
    - [0, 17.548]
  - - [320, 3264, 1, 256, 320, 320, 320, 3264]
    - [0, 19.273]
  - - [448, 3264, 1, 256, 448, 448, 448, 3264]
    - [0, 19.954]
  - - [576, 3264, 1, 256, 576, 576, 576, 3264]
    - [0, 18.916]
  - - [704, 3264, 1, 256, 704, 704, 704, 3264]
    - [0, 19.976]
  - - [832, 3264, 1, 256, 832, 832, 832, 3264]
    - [0, 20.302]
  - - [960, 3264, 1, 256, 960, 960, 960, 3264]
    - [0, 20.657]
  - - [1088, 3264, 1, 256, 1088, 1088, 1088, 3264]
    - [0, 20.735]
  - - [1216, 3264, 1, 256, 1216, 1216, 1216, 3264]
    - [0, 20.946]
  - - [1344, 3264, 1, 256, 1344, 1344, 1344, 3264]
    - [0, 21.062]
  - - [1472, 3264, 1, 256, 1472, 1472, 1472, 3264]
    - [0, 21.263]
  - - [1600, 3264, 1, 256, 1600, 1600, 1600, 3264]
    - [0, 21.241]
  - - [1728, 3264, 1, 256, 1728, 1728, 1728, 3264]
    - [0, 21.36]
  - - [1856, 3264, 1, 256, 1856, 1856, 1856, 3264]
    - [0, 21.453]
  - - [1984, 3264, 1, 256, 1984, 1984, 1984, 3264]
    - [0, 21.485]
  - - [2112, 3264, 1, 256, 2112, 2112, 2112, 3264]
    - [0, 21.64]
  - - [2240, 3264, 1, 256, 2240, 2240, 2240, 3264]
    - [0, 21.68]
  - - [2368, 3264, 1, 256, 2368, 2368, 2368, 3264]
    - [0, 21.614]
  - - [2496, 3264, 1, 256, 2496, 2496, 2496, 3264]
    - [0, 21.638]
  - - [2624, 3264, 1, 256, 2624, 2624, 2624, 3264]
    - [0, 21.706]
  - - [2752, 3264, 1, 256, 2752, 2752, 2752, 3264]
    - [0, 21.652]
  - - [2880, 3264, 1, 256, 2880, 2880, 2880, 3264]
    - [0, 21.601]
  - - [3008, 3264, 1, 256, 3008, 3008, 3008, 3264]
    - [0, 21.652]
  - - [3136, 3264, 1, 256, 3136, 3136, 3136, 3264]
    - [0, 21.594]
  - - [3264, 3264, 1, 256, 3264, 3264, 3264, 3264]
    - [0, 21.728]
  - - [3392, 3264, 1, 256, 3392, 3392, 3392, 3264]
    - [0, 21.731]
  - - [3520, 3264, 1, 256, 3520, 3520, 3520, 3264]
    - [0, 21.777]
  - - [3648, 3264, 1, 256, 3648, 3648, 3648, 3264]
    - [0, 21.779]
  - - [3776, 3264, 1, 256, 3776, 3776, 3776, 3264]
    - [0, 21.725]
  - - [3904, 3264, 1, 256, 3904, 3904, 3904, 3264]
    - [0, 21.797]
  - - [4032, 3264, 1, 256, 4032, 4032, 4032, 3264]
    - [0, 21.876]
  - - [64, 3392, 1, 256, 64, 64, 64, 3392]
    - [0, 12.307]
  - - [192, 3392, 1, 256, 192, 192, 192, 3392]
    - [0, 17.577]
  - - [320, 3392, 1, 256, 320, 320, 320, 3392]
    - [0, 19.384]
  - - [448, 3392, 1, 256, 448, 448, 448, 3392]
    - [0, 20.216]
  - - [576, 3392, 1, 256, 576, 576, 576, 3392]
    - [0, 19.63]
  - - [704, 3392, 1, 256, 704, 704, 704, 3392]
    - [0, 20.04]
  - - [832, 3392, 1, 256, 832, 832, 832, 3392]
    - [0, 20.423]
  - - [960, 3392, 1, 256, 960, 960, 960, 3392]
    - [0, 20.698]
  - - [1088, 3392, 1, 256, 1088, 1088, 1088, 3392]
    - [0, 20.756]
  - - [1216, 3392, 1, 256, 1216, 1216, 1216, 3392]
    - [0, 20.987]
  - - [1344, 3392, 1, 256, 1344, 1344, 1344, 3392]
    - [0, 21.176]
  - - [1472, 3392, 1, 256, 1472, 1472, 1472, 3392]
    - [0, 21.187]
  - - [1600, 3392, 1, 256, 1600, 1600, 1600, 3392]
    - [0, 21.365]
  - - [1728, 3392, 1, 256, 1728, 1728, 1728, 3392]
    - [0, 21.374]
  - - [1856, 3392, 1, 256, 1856, 1856, 1856, 3392]
    - [0, 21.5]
  - - [1984, 3392, 1, 256, 1984, 1984, 1984, 3392]
    - [0, 21.527]
  - - [2112, 3392, 1, 256, 2112, 2112, 2112, 3392]
    - [0, 21.61]
  - - [2240, 3392, 1, 256, 2240, 2240, 2240, 3392]
    - [0, 21.633]
  - - [2368, 3392, 1, 256, 2368, 2368, 2368, 3392]
    - [0, 21.612]
  - - [2496, 3392, 1, 256, 2496, 2496, 2496, 3392]
    - [0, 21.631]
  - - [2624, 3392, 1, 256, 2624, 2624, 2624, 3392]
    - [0, 21.777]
  - - [2752, 3392, 1, 256, 2752, 2752, 2752, 3392]
    - [0, 21.729]
  - - [2880, 3392, 1, 256, 2880, 2880, 2880, 3392]
    - [0, 21.594]
  - - [3008, 3392, 1, 256, 3008, 3008, 3008, 3392]
    - [0, 21.678]
  - - [3136, 3392, 1, 256, 3136, 3136, 3136, 3392]
    - [0, 21.636]
  - - [3264, 3392, 1, 256, 3264, 3264, 3264, 3392]
    - [0, 21.764]
  - - [3392, 3392, 1, 256, 3392, 3392, 3392, 3392]
    - [0, 21.811]
  - - [3520, 3392, 1, 256, 3520, 3520, 3520, 3392]
    - [0, 21.74]
  - - [3648, 3392, 1, 256, 3648, 3648, 3648, 3392]
    - [0, 21.786]
  - - [3776, 3392, 1, 256, 3776, 3776, 3776, 3392]
    - [0, 21.749]
  - - [3904, 3392, 1, 256, 3904, 3904, 3904, 3392]
    - [0, 21.839]
  - - [4032, 3392, 1, 256, 4032, 4032, 4032, 3392]
    - [0, 21.862]
  - - [64, 3520, 1, 256, 64, 64, 64, 3520]
    - [0, 12.694]
  - - [192, 3520, 1, 256, 192, 192, 192, 3520]
    - [0, 17.926]
  - - [320, 3520, 1, 256, 320, 320, 320, 3520]
    - [0, 19.453]
  - - [448, 3520, 1, 256, 448, 448, 448, 3520]
    - [0, 20.308]
  - - [576, 3520, 1, 256, 576, 576, 576, 3520]
    - [0, 19.743]
  - - [704, 3520, 1, 256, 704, 704, 704, 3520]
    - [0, 20.159]
  - - [832, 3520, 1, 256, 832, 832, 832, 3520]
    - [0, 20.46]
  - - [960, 3520, 1, 256, 960, 960, 960, 3520]
    - [0, 20.776]
  - - [1088, 3520, 1, 256, 1088, 1088, 1088, 3520]
    - [0, 20.89]
  - - [1216, 3520, 1, 256, 1216, 1216, 1216, 3520]
    - [0, 20.969]
  - - [1344, 3520, 1, 256, 1344, 1344, 1344, 3520]
    - [0, 21.13]
  - - [1472, 3520, 1, 256, 1472, 1472, 1472, 3520]
    - [0, 21.311]
  - - [1600, 3520, 1, 256, 1600, 1600, 1600, 3520]
    - [0, 21.346]
  - - [1728, 3520, 1, 256, 1728, 1728, 1728, 3520]
    - [0, 21.388]
  - - [1856, 3520, 1, 256, 1856, 1856, 1856, 3520]
    - [0, 21.603]
  - - [1984, 3520, 1, 256, 1984, 1984, 1984, 3520]
    - [0, 21.549]
  - - [2112, 3520, 1, 256, 2112, 2112, 2112, 3520]
    - [0, 21.737]
  - - [2240, 3520, 1, 256, 2240, 2240, 2240, 3520]
    - [0, 21.688]
  - - [2368, 3520, 1, 256, 2368, 2368, 2368, 3520]
    - [0, 21.656]
  - - [2496, 3520, 1, 256, 2496, 2496, 2496, 3520]
    - [0, 21.655]
  - - [2624, 3520, 1, 256, 2624, 2624, 2624, 3520]
    - [0, 21.682]
  - - [2752, 3520, 1, 256, 2752, 2752, 2752, 3520]
    - [0, 21.71]
  - - [2880, 3520, 1, 256, 2880, 2880, 2880, 3520]
    - [0, 21.7]
  - - [3008, 3520, 1, 256, 3008, 3008, 3008, 3520]
    - [0, 21.652]
  - - [3136, 3520, 1, 256, 3136, 3136, 3136, 3520]
    - [0, 21.758]
  - - [3264, 3520, 1, 256, 3264, 3264, 3264, 3520]
    - [0, 21.818]
  - - [3392, 3520, 1, 256, 3392, 3392, 3392, 3520]
    - [0, 21.787]
  - - [3520, 3520, 1, 256, 3520, 3520, 3520, 3520]
    - [0, 21.777]
  - - [3648, 3520, 1, 256, 3648, 3648, 3648, 3520]
    - [0, 21.821]
  - - [3776, 3520, 1, 256, 3776, 3776, 3776, 3520]
    - [0, 21.791]
  - - [3904, 3520, 1, 256, 3904, 3904, 3904, 3520]
    - [0, 21.881]
  - - [4032, 3520, 1, 256, 4032, 4032, 4032, 3520]
    - [0, 21.923]
  - - [64, 3648, 1, 256, 64, 64, 64, 3648]
    - [0, 13.089]
  - - [192, 3648, 1, 256, 192, 192, 192, 3648]
    - [0, 18.079]
  - - [320, 3648, 1, 256, 320, 320, 320, 3648]
    - [0, 19.606]
  - - [448, 3648, 1, 256, 448, 448, 448, 3648]
    - [0, 20.269]
  - - [576, 3648, 1, 256, 576, 576, 576, 3648]
    - [0, 19.873]
  - - [704, 3648, 1, 256, 704, 704, 704, 3648]
    - [0, 20.222]
  - - [832, 3648, 1, 256, 832, 832, 832, 3648]
    - [0, 20.534]
  - - [960, 3648, 1, 256, 960, 960, 960, 3648]
    - [0, 20.804]
  - - [1088, 3648, 1, 256, 1088, 1088, 1088, 3648]
    - [0, 20.935]
  - - [1216, 3648, 1, 256, 1216, 1216, 1216, 3648]
    - [0, 20.951]
  - - [1344, 3648, 1, 256, 1344, 1344, 1344, 3648]
    - [0, 21.295]
  - - [1472, 3648, 1, 256, 1472, 1472, 1472, 3648]
    - [0, 21.272]
  - - [1600, 3648, 1, 256, 1600, 1600, 1600, 3648]
    - [0, 21.39]
  - - [1728, 3648, 1, 256, 1728, 1728, 1728, 3648]
    - [0, 21.512]
  - - [1856, 3648, 1, 256, 1856, 1856, 1856, 3648]
    - [0, 21.522]
  - - [1984, 3648, 1, 256, 1984, 1984, 1984, 3648]
    - [0, 21.613]
  - - [2112, 3648, 1, 256, 2112, 2112, 2112, 3648]
    - [0, 21.596]
  - - [2240, 3648, 1, 256, 2240, 2240, 2240, 3648]
    - [0, 21.585]
  - - [2368, 3648, 1, 256, 2368, 2368, 2368, 3648]
    - [0, 21.69]
  - - [2496, 3648, 1, 256, 2496, 2496, 2496, 3648]
    - [0, 21.727]
  - - [2624, 3648, 1, 256, 2624, 2624, 2624, 3648]
    - [0, 21.635]
  - - [2752, 3648, 1, 256, 2752, 2752, 2752, 3648]
    - [0, 21.735]
  - - [2880, 3648, 1, 256, 2880, 2880, 2880, 3648]
    - [0, 21.726]
  - - [3008, 3648, 1, 256, 3008, 3008, 3008, 3648]
    - [0, 21.7]
  - - [3136, 3648, 1, 256, 3136, 3136, 3136, 3648]
    - [0, 21.778]
  - - [3264, 3648, 1, 256, 3264, 3264, 3264, 3648]
    - [0, 21.742]
  - - [3392, 3648, 1, 256, 3392, 3392, 3392, 3648]
    - [0, 21.832]
  - - [3520, 3648, 1, 256, 3520, 3520, 3520, 3648]
    - [0, 21.785]
  - - [3648, 3648, 1, 256, 3648, 3648, 3648, 3648]
    - [0, 21.757]
  - - [3776, 3648, 1, 256, 3776, 3776, 3776, 3648]
    - [0, 21.761]
  - - [3904, 3648, 1, 256, 3904, 3904, 3904, 3648]
    - [0, 21.898]
  - - [4032, 3648, 1, 256, 4032, 4032, 4032, 3648]
    - [0, 21.639]
  - - [64, 3776, 1, 256, 64, 64, 64, 3776]
    - [0, 13.494]
  - - [192, 3776, 1, 256, 192, 192, 192, 3776]
    - [0, 18.169]
  - - [320, 3776, 1, 256, 320, 320, 320, 3776]
    - [0, 19.7]
  - - [448, 3776, 1, 256, 448, 448, 448, 3776]
    - [0, 20.392]
  - - [576, 3776, 1, 256, 576, 576, 576, 3776]
    - [0, 19.83]
  - - [704, 3776, 1, 256, 704, 704, 704, 3776]
    - [0, 20.229]
  - - [832, 3776, 1, 256, 832, 832, 832, 3776]
    - [0, 20.521]
  - - [960, 3776, 1, 256, 960, 960, 960, 3776]
    - [0, 20.862]
  - - [1088, 3776, 1, 256, 1088, 1088, 1088, 3776]
    - [0, 20.976]
  - - [1216, 3776, 1, 256, 1216, 1216, 1216, 3776]
    - [0, 21.134]
  - - [1344, 3776, 1, 256, 1344, 1344, 1344, 3776]
    - [0, 21.231]
  - - [1472, 3776, 1, 256, 1472, 1472, 1472, 3776]
    - [0, 21.318]
  - - [1600, 3776, 1, 256, 1600, 1600, 1600, 3776]
    - [0, 21.349]
  - - [1728, 3776, 1, 256, 1728, 1728, 1728, 3776]
    - [0, 21.513]
  - - [1856, 3776, 1, 256, 1856, 1856, 1856, 3776]
    - [0, 21.651]
  - - [1984, 3776, 1, 256, 1984, 1984, 1984, 3776]
    - [0, 21.71]
  - - [2112, 3776, 1, 256, 2112, 2112, 2112, 3776]
    - [0, 21.681]
  - - [2240, 3776, 1, 256, 2240, 2240, 2240, 3776]
    - [0, 21.674]
  - - [2368, 3776, 1, 256, 2368, 2368, 2368, 3776]
    - [0, 21.646]
  - - [2496, 3776, 1, 256, 2496, 2496, 2496, 3776]
    - [0, 21.609]
  - - [2624, 3776, 1, 256, 2624, 2624, 2624, 3776]
    - [0, 21.672]
  - - [2752, 3776, 1, 256, 2752, 2752, 2752, 3776]
    - [0, 21.771]
  - - [2880, 3776, 1, 256, 2880, 2880, 2880, 3776]
    - [0, 21.713]
  - - [3008, 3776, 1, 256, 3008, 3008, 3008, 3776]
    - [0, 21.686]
  - - [3136, 3776, 1, 256, 3136, 3136, 3136, 3776]
    - [0, 21.764]
  - - [3264, 3776, 1, 256, 3264, 3264, 3264, 3776]
    - [0, 21.809]
  - - [3392, 3776, 1, 256, 3392, 3392, 3392, 3776]
    - [0, 21.883]
  - - [3520, 3776, 1, 256, 3520, 3520, 3520, 3776]
    - [0, 21.842]
  - - [3648, 3776, 1, 256, 3648, 3648, 3648, 3776]
    - [0, 21.836]
  - - [3776, 3776, 1, 256, 3776, 3776, 3776, 3776]
    - [0, 21.426]
  - - [3904, 3776, 1, 256, 3904, 3904, 3904, 3776]
    - [0, 21.586]
  - - [4032, 3776, 1, 256, 4032, 4032, 4032, 3776]
    - [0, 21.699]
  - - [64, 3904, 1, 256, 64, 64, 64, 3904]
    - [0, 13.041]
  - - [192, 3904, 1, 256, 192, 192, 192, 3904]
    - [0, 18.327]
  - - [320, 3904, 1, 256, 320, 320, 320, 3904]
    - [0, 19.787]
  - - [448, 3904, 1, 256, 448, 448, 448, 3904]
    - [0, 20.413]
  - - [576, 3904, 1, 256, 576, 576, 576, 3904]
    - [0, 19.895]
  - - [704, 3904, 1, 256, 704, 704, 704, 3904]
    - [0, 20.31]
  - - [832, 3904, 1, 256, 832, 832, 832, 3904]
    - [0, 20.577]
  - - [960, 3904, 1, 256, 960, 960, 960, 3904]
    - [0, 20.874]
  - - [1088, 3904, 1, 256, 1088, 1088, 1088, 3904]
    - [0, 20.998]
  - - [1216, 3904, 1, 256, 1216, 1216, 1216, 3904]
    - [0, 21.169]
  - - [1344, 3904, 1, 256, 1344, 1344, 1344, 3904]
    - [0, 21.331]
  - - [1472, 3904, 1, 256, 1472, 1472, 1472, 3904]
    - [0, 21.351]
  - - [1600, 3904, 1, 256, 1600, 1600, 1600, 3904]
    - [0, 21.44]
  - - [1728, 3904, 1, 256, 1728, 1728, 1728, 3904]
    - [0, 21.572]
  - - [1856, 3904, 1, 256, 1856, 1856, 1856, 3904]
    - [0, 21.643]
  - - [1984, 3904, 1, 256, 1984, 1984, 1984, 3904]
    - [0, 21.552]
  - - [2112, 3904, 1, 256, 2112, 2112, 2112, 3904]
    - [0, 21.605]
  - - [2240, 3904, 1, 256, 2240, 2240, 2240, 3904]
    - [0, 21.676]
  - - [2368, 3904, 1, 256, 2368, 2368, 2368, 3904]
    - [0, 21.648]
  - - [2496, 3904, 1, 256, 2496, 2496, 2496, 3904]
    - [0, 21.676]
  - - [2624, 3904, 1, 256, 2624, 2624, 2624, 3904]
    - [0, 21.657]
  - - [2752, 3904, 1, 256, 2752, 2752, 2752, 3904]
    - [0, 21.738]
  - - [2880, 3904, 1, 256, 2880, 2880, 2880, 3904]
    - [0, 21.794]
  - - [3008, 3904, 1, 256, 3008, 3008, 3008, 3904]
    - [0, 21.767]
  - - [3136, 3904, 1, 256, 3136, 3136, 3136, 3904]
    - [0, 21.779]
  - - [3264, 3904, 1, 256, 3264, 3264, 3264, 3904]
    - [0, 21.898]
  - - [3392, 3904, 1, 256, 3392, 3392, 3392, 3904]
    - [0, 21.819]
  - - [3520, 3904, 1, 256, 3520, 3520, 3520, 3904]
    - [0, 21.826]
  - - [3648, 3904, 1, 256, 3648, 3648, 3648, 3904]
    - [0, 21.376]
  - - [3776, 3904, 1, 256, 3776, 3776, 3776, 3904]
    - [0, 21.549]
  - - [3904, 3904, 1, 256, 3904, 3904, 3904, 3904]
    - [0, 21.549]
  - - [4032, 3904, 1, 256, 4032, 4032, 4032, 3904]
    - [0, 21.598]
  - - [64, 4032, 1, 256, 64, 64, 64, 4032]
    - [0, 13.353]
  - - [192, 4032, 1, 256, 192, 192, 192, 4032]
    - [0, 18.46]
  - - [320, 4032, 1, 256, 320, 320, 320, 4032]
    - [0, 19.847]
  - - [448, 4032, 1, 256, 448, 448, 448, 4032]
    - [0, 20.464]
  - - [576, 4032, 1, 256, 576, 576, 576, 4032]
    - [0, 20.022]
  - - [704, 4032, 1, 256, 704, 704, 704, 4032]
    - [0, 20.473]
  - - [832, 4032, 1, 256, 832, 832, 832, 4032]
    - [0, 20.685]
  - - [960, 4032, 1, 256, 960, 960, 960, 4032]
    - [0, 20.898]
  - - [1088, 4032, 1, 256, 1088, 1088, 1088, 4032]
    - [0, 21.139]
  - - [1216, 4032, 1, 256, 1216, 1216, 1216, 4032]
    - [0, 21.195]
  - - [1344, 4032, 1, 256, 1344, 1344, 1344, 4032]
    - [0, 21.323]
  - - [1472, 4032, 1, 256, 1472, 1472, 1472, 4032]
    - [0, 21.363]
  - - [1600, 4032, 1, 256, 1600, 1600, 1600, 4032]
    - [0, 21.418]
  - - [1728, 4032, 1, 256, 1728, 1728, 1728, 4032]
    - [0, 21.647]
  - - [1856, 4032, 1, 256, 1856, 1856, 1856, 4032]
    - [0, 21.574]
  - - [1984, 4032, 1, 256, 1984, 1984, 1984, 4032]
    - [0, 21.597]
  - - [2112, 4032, 1, 256, 2112, 2112, 2112, 4032]
    - [0, 21.754]
  - - [2240, 4032, 1, 256, 2240, 2240, 2240, 4032]
    - [0, 21.659]
  - - [2368, 4032, 1, 256, 2368, 2368, 2368, 4032]
    - [0, 21.682]
  - - [2496, 4032, 1, 256, 2496, 2496, 2496, 4032]
    - [0, 21.662]
  - - [2624, 4032, 1, 256, 2624, 2624, 2624, 4032]
    - [0, 21.814]
  - - [2752, 4032, 1, 256, 2752, 2752, 2752, 4032]
    - [0, 21.743]
  - - [2880, 4032, 1, 256, 2880, 2880, 2880, 4032]
    - [0, 21.785]
  - - [3008, 4032, 1, 256, 3008, 3008, 3008, 4032]
    - [0, 21.71]
  - - [3136, 4032, 1, 256, 3136, 3136, 3136, 4032]
    - [0, 21.756]
  - - [3264, 4032, 1, 256, 3264, 3264, 3264, 4032]
    - [0, 21.876]
  - - [3392, 4032, 1, 256, 3392, 3392, 3392, 4032]
    - [0, 21.858]
  - - [3520, 4032, 1, 256, 3520, 3520, 3520, 4032]
    - [0, 21.834]
  - - [3648, 4032, 1, 256, 3648, 3648, 3648, 4032]
    - [0, 21.519]
  - - [3776, 4032, 1, 256, 3776, 3776, 3776, 4032]
    - [0, 21.594]
  - - [3904, 4032, 1, 256, 3904, 3904, 3904, 4032]
    - [0, 21.616]
  - - [4032, 4032, 1, 256, 4032, 4032, 4032, 4032]
    - [0, 21.706]
  - - [64, 64, 1, 512, 64, 64, 64, 64]
    - [2, 0.879]
  - - [192, 64, 1, 512, 192, 192, 192, 64]
    - [2, 2.607]
  - - [320, 64, 1, 512, 320, 320, 320, 64]
    - [2, 4.129]
  - - [448, 64, 1, 512, 448, 448, 448, 64]
    - [0, 5.757]
  - - [576, 64, 1, 512, 576, 576, 576, 64]
    - [2, 6.212]
  - - [704, 64, 1, 512, 704, 704, 704, 64]
    - [2, 7.426]
  - - [832, 64, 1, 512, 832, 832, 832, 64]
    - [0, 8.453]
  - - [960, 64, 1, 512, 960, 960, 960, 64]
    - [0, 9.73]
  - - [1088, 64, 1, 512, 1088, 1088, 1088, 64]
    - [2, 9.355]
  - - [1216, 64, 1, 512, 1216, 1216, 1216, 64]
    - [0, 10.276]
  - - [1344, 64, 1, 512, 1344, 1344, 1344, 64]
    - [0, 11.312]
  - - [1472, 64, 1, 512, 1472, 1472, 1472, 64]
    - [2, 10.739]
  - - [1600, 64, 1, 512, 1600, 1600, 1600, 64]
    - [0, 11.501]
  - - [1728, 64, 1, 512, 1728, 1728, 1728, 64]
    - [0, 12.416]
  - - [1856, 64, 1, 512, 1856, 1856, 1856, 64]
    - [0, 13.308]
  - - [1984, 64, 1, 512, 1984, 1984, 1984, 64]
    - [0, 12.491]
  - - [2112, 64, 1, 512, 2112, 2112, 2112, 64]
    - [0, 13.17]
  - - [2240, 64, 1, 512, 2240, 2240, 2240, 64]
    - [0, 13.947]
  - - [2368, 64, 1, 512, 2368, 2368, 2368, 64]
    - [0, 14.725]
  - - [2496, 64, 1, 512, 2496, 2496, 2496, 64]
    - [2, 13.842]
  - - [2624, 64, 1, 512, 2624, 2624, 2624, 64]
    - [0, 14.338]
  - - [2752, 64, 1, 512, 2752, 2752, 2752, 64]
    - [0, 15.008]
  - - [2880, 64, 1, 512, 2880, 2880, 2880, 64]
    - [0, 15.64]
  - - [3008, 64, 1, 512, 3008, 3008, 3008, 64]
    - [0, 14.845]
  - - [3136, 64, 1, 512, 3136, 3136, 3136, 64]
    - [0, 15.412]
  - - [3264, 64, 1, 512, 3264, 3264, 3264, 64]
    - [0, 15.983]
  - - [3392, 64, 1, 512, 3392, 3392, 3392, 64]
    - [0, 15.32]
  - - [3520, 64, 1, 512, 3520, 3520, 3520, 64]
    - [0, 15.756]
  - - [3648, 64, 1, 512, 3648, 3648, 3648, 64]
    - [0, 16.15]
  - - [3776, 64, 1, 512, 3776, 3776, 3776, 64]
    - [0, 16.706]
  - - [3904, 64, 1, 512, 3904, 3904, 3904, 64]
    - [0, 16.14]
  - - [4032, 64, 1, 512, 4032, 4032, 4032, 64]
    - [0, 16.441]
  - - [64, 192, 1, 512, 64, 64, 64, 192]
    - [2, 2.622]
  - - [192, 192, 1, 512, 192, 192, 192, 192]
    - [1, 6.136]
  - - [320, 192, 1, 512, 320, 320, 320, 192]
    - [0, 9.745]
  - - [448, 192, 1, 512, 448, 448, 448, 192]
    - [0, 11.343]
  - - [576, 192, 1, 512, 576, 576, 576, 192]
    - [0, 12.424]
  - - [704, 192, 1, 512, 704, 704, 704, 192]
    - [0, 13.247]
  - - [832, 192, 1, 512, 832, 832, 832, 192]
    - [0, 13.801]
  - - [960, 192, 1, 512, 960, 960, 960, 192]
    - [0, 15.853]
  - - [1088, 192, 1, 512, 1088, 1088, 1088, 192]
    - [0, 16.058]
  - - [1216, 192, 1, 512, 1216, 1216, 1216, 192]
    - [0, 16.352]
  - - [1344, 192, 1, 512, 1344, 1344, 1344, 192]
    - [0, 16.642]
  - - [1472, 192, 1, 512, 1472, 1472, 1472, 192]
    - [0, 16.869]
  - - [1600, 192, 1, 512, 1600, 1600, 1600, 192]
    - [0, 18.034]
  - - [1728, 192, 1, 512, 1728, 1728, 1728, 192]
    - [0, 18.054]
  - - [1856, 192, 1, 512, 1856, 1856, 1856, 192]
    - [0, 18.182]
  - - [1984, 192, 1, 512, 1984, 1984, 1984, 192]
    - [0, 18.236]
  - - [2112, 192, 1, 512, 2112, 2112, 2112, 192]
    - [0, 18.362]
  - - [2240, 192, 1, 512, 2240, 2240, 2240, 192]
    - [0, 19.138]
  - - [2368, 192, 1, 512, 2368, 2368, 2368, 192]
    - [0, 19.253]
  - - [2496, 192, 1, 512, 2496, 2496, 2496, 192]
    - [0, 19.277]
  - - [2624, 192, 1, 512, 2624, 2624, 2624, 192]
    - [0, 19.313]
  - - [2752, 192, 1, 512, 2752, 2752, 2752, 192]
    - [0, 19.379]
  - - [2880, 192, 1, 512, 2880, 2880, 2880, 192]
    - [0, 19.939]
  - - [3008, 192, 1, 512, 3008, 3008, 3008, 192]
    - [0, 19.904]
  - - [3136, 192, 1, 512, 3136, 3136, 3136, 192]
    - [0, 19.985]
  - - [3264, 192, 1, 512, 3264, 3264, 3264, 192]
    - [0, 19.957]
  - - [3392, 192, 1, 512, 3392, 3392, 3392, 192]
    - [0, 20.018]
  - - [3520, 192, 1, 512, 3520, 3520, 3520, 192]
    - [0, 20.353]
  - - [3648, 192, 1, 512, 3648, 3648, 3648, 192]
    - [0, 20.421]
  - - [3776, 192, 1, 512, 3776, 3776, 3776, 192]
    - [0, 20.523]
  - - [3904, 192, 1, 512, 3904, 3904, 3904, 192]
    - [0, 20.549]
  - - [4032, 192, 1, 512, 4032, 4032, 4032, 192]
    - [0, 20.527]
  - - [64, 320, 1, 512, 64, 64, 64, 320]
    - [0, 4.156]
  - - [192, 320, 1, 512, 192, 192, 192, 320]
    - [0, 9.773]
  - - [320, 320, 1, 512, 320, 320, 320, 320]
    - [0, 11.49]
  - - [448, 320, 1, 512, 448, 448, 448, 320]
    - [0, 13.97]
  - - [576, 320, 1, 512, 576, 576, 576, 320]
    - [0, 15.786]
  - - [704, 320, 1, 512, 704, 704, 704, 320]
    - [0, 15.89]
  - - [832, 320, 1, 512, 832, 832, 832, 320]
    - [0, 17.021]
  - - [960, 320, 1, 512, 960, 960, 960, 320]
    - [0, 17.98]
  - - [1088, 320, 1, 512, 1088, 1088, 1088, 320]
    - [0, 17.836]
  - - [1216, 320, 1, 512, 1216, 1216, 1216, 320]
    - [0, 18.49]
  - - [1344, 320, 1, 512, 1344, 1344, 1344, 320]
    - [0, 19.156]
  - - [1472, 320, 1, 512, 1472, 1472, 1472, 320]
    - [0, 18.964]
  - - [1600, 320, 1, 512, 1600, 1600, 1600, 320]
    - [0, 19.436]
  - - [1728, 320, 1, 512, 1728, 1728, 1728, 320]
    - [0, 19.887]
  - - [1856, 320, 1, 512, 1856, 1856, 1856, 320]
    - [0, 19.81]
  - - [1984, 320, 1, 512, 1984, 1984, 1984, 320]
    - [0, 20.122]
  - - [2112, 320, 1, 512, 2112, 2112, 2112, 320]
    - [0, 20.426]
  - - [2240, 320, 1, 512, 2240, 2240, 2240, 320]
    - [0, 20.36]
  - - [2368, 320, 1, 512, 2368, 2368, 2368, 320]
    - [0, 20.531]
  - - [2496, 320, 1, 512, 2496, 2496, 2496, 320]
    - [0, 20.703]
  - - [2624, 320, 1, 512, 2624, 2624, 2624, 320]
    - [0, 20.813]
  - - [2752, 320, 1, 512, 2752, 2752, 2752, 320]
    - [0, 20.921]
  - - [2880, 320, 1, 512, 2880, 2880, 2880, 320]
    - [0, 21.054]
  - - [3008, 320, 1, 512, 3008, 3008, 3008, 320]
    - [0, 19.37]
  - - [3136, 320, 1, 512, 3136, 3136, 3136, 320]
    - [0, 20.15]
  - - [3264, 320, 1, 512, 3264, 3264, 3264, 320]
    - [0, 20.329]
  - - [3392, 320, 1, 512, 3392, 3392, 3392, 320]
    - [0, 20.287]
  - - [3520, 320, 1, 512, 3520, 3520, 3520, 320]
    - [0, 20.413]
  - - [3648, 320, 1, 512, 3648, 3648, 3648, 320]
    - [0, 20.511]
  - - [3776, 320, 1, 512, 3776, 3776, 3776, 320]
    - [0, 20.617]
  - - [3904, 320, 1, 512, 3904, 3904, 3904, 320]
    - [0, 20.708]
  - - [4032, 320, 1, 512, 4032, 4032, 4032, 320]
    - [0, 20.762]
  - - [64, 448, 1, 512, 64, 64, 64, 448]
    - [0, 5.797]
  - - [192, 448, 1, 512, 192, 192, 192, 448]
    - [0, 11.321]
  - - [320, 448, 1, 512, 320, 320, 320, 448]
    - [0, 13.95]
  - - [448, 448, 1, 512, 448, 448, 448, 448]
    - [0, 15.519]
  - - [576, 448, 1, 512, 576, 576, 576, 448]
    - [0, 16.689]
  - - [704, 448, 1, 512, 704, 704, 704, 448]
    - [0, 17.363]
  - - [832, 448, 1, 512, 832, 832, 832, 448]
    - [0, 18.033]
  - - [960, 448, 1, 512, 960, 960, 960, 448]
    - [0, 19.16]
  - - [1088, 448, 1, 512, 1088, 1088, 1088, 448]
    - [0, 19.422]
  - - [1216, 448, 1, 512, 1216, 1216, 1216, 448]
    - [0, 19.766]
  - - [1344, 448, 1, 512, 1344, 1344, 1344, 448]
    - [0, 19.958]
  - - [1472, 448, 1, 512, 1472, 1472, 1472, 448]
    - [0, 20.204]
  - - [1600, 448, 1, 512, 1600, 1600, 1600, 448]
    - [0, 20.427]
  - - [1728, 448, 1, 512, 1728, 1728, 1728, 448]
    - [0, 20.504]
  - - [1856, 448, 1, 512, 1856, 1856, 1856, 448]
    - [0, 20.701]
  - - [1984, 448, 1, 512, 1984, 1984, 1984, 448]
    - [0, 20.956]
  - - [2112, 448, 1, 512, 2112, 2112, 2112, 448]
    - [2, 19.369]
  - - [2240, 448, 1, 512, 2240, 2240, 2240, 448]
    - [0, 20.132]
  - - [2368, 448, 1, 512, 2368, 2368, 2368, 448]
    - [0, 20.228]
  - - [2496, 448, 1, 512, 2496, 2496, 2496, 448]
    - [0, 20.423]
  - - [2624, 448, 1, 512, 2624, 2624, 2624, 448]
    - [0, 20.502]
  - - [2752, 448, 1, 512, 2752, 2752, 2752, 448]
    - [0, 20.633]
  - - [2880, 448, 1, 512, 2880, 2880, 2880, 448]
    - [0, 20.762]
  - - [3008, 448, 1, 512, 3008, 3008, 3008, 448]
    - [0, 20.812]
  - - [3136, 448, 1, 512, 3136, 3136, 3136, 448]
    - [0, 20.992]
  - - [3264, 448, 1, 512, 3264, 3264, 3264, 448]
    - [0, 21.062]
  - - [3392, 448, 1, 512, 3392, 3392, 3392, 448]
    - [0, 21.168]
  - - [3520, 448, 1, 512, 3520, 3520, 3520, 448]
    - [0, 21.284]
  - - [3648, 448, 1, 512, 3648, 3648, 3648, 448]
    - [0, 21.295]
  - - [3776, 448, 1, 512, 3776, 3776, 3776, 448]
    - [0, 21.393]
  - - [3904, 448, 1, 512, 3904, 3904, 3904, 448]
    - [0, 21.389]
  - - [4032, 448, 1, 512, 4032, 4032, 4032, 448]
    - [0, 21.464]
  - - [64, 576, 1, 512, 64, 64, 64, 576]
    - [2, 6.171]
  - - [192, 576, 1, 512, 192, 192, 192, 576]
    - [0, 12.387]
  - - [320, 576, 1, 512, 320, 320, 320, 576]
    - [0, 15.721]
  - - [448, 576, 1, 512, 448, 448, 448, 576]
    - [0, 16.569]
  - - [576, 576, 1, 512, 576, 576, 576, 576]
    - [0, 18.048]
  - - [704, 576, 1, 512, 704, 704, 704, 576]
    - [0, 18.377]
  - - [832, 576, 1, 512, 832, 832, 832, 576]
    - [0, 19.201]
  - - [960, 576, 1, 512, 960, 960, 960, 576]
    - [0, 19.857]
  - - [1088, 576, 1, 512, 1088, 1088, 1088, 576]
    - [0, 19.995]
  - - [1216, 576, 1, 512, 1216, 1216, 1216, 576]
    - [0, 20.397]
  - - [1344, 576, 1, 512, 1344, 1344, 1344, 576]
    - [0, 20.498]
  - - [1472, 576, 1, 512, 1472, 1472, 1472, 576]
    - [0, 20.794]
  - - [1600, 576, 1, 512, 1600, 1600, 1600, 576]
    - [0, 20.998]
  - - [1728, 576, 1, 512, 1728, 1728, 1728, 576]
    - [0, 19.999]
  - - [1856, 576, 1, 512, 1856, 1856, 1856, 576]
    - [0, 20.359]
  - - [1984, 576, 1, 512, 1984, 1984, 1984, 576]
    - [0, 20.482]
  - - [2112, 576, 1, 512, 2112, 2112, 2112, 576]
    - [0, 20.714]
  - - [2240, 576, 1, 512, 2240, 2240, 2240, 576]
    - [0, 20.754]
  - - [2368, 576, 1, 512, 2368, 2368, 2368, 576]
    - [0, 20.905]
  - - [2496, 576, 1, 512, 2496, 2496, 2496, 576]
    - [0, 21.034]
  - - [2624, 576, 1, 512, 2624, 2624, 2624, 576]
    - [0, 21.129]
  - - [2752, 576, 1, 512, 2752, 2752, 2752, 576]
    - [0, 21.187]
  - - [2880, 576, 1, 512, 2880, 2880, 2880, 576]
    - [0, 21.272]
  - - [3008, 576, 1, 512, 3008, 3008, 3008, 576]
    - [0, 21.366]
  - - [3136, 576, 1, 512, 3136, 3136, 3136, 576]
    - [0, 21.435]
  - - [3264, 576, 1, 512, 3264, 3264, 3264, 576]
    - [0, 21.515]
  - - [3392, 576, 1, 512, 3392, 3392, 3392, 576]
    - [0, 21.611]
  - - [3520, 576, 1, 512, 3520, 3520, 3520, 576]
    - [0, 21.616]
  - - [3648, 576, 1, 512, 3648, 3648, 3648, 576]
    - [0, 21.717]
  - - [3776, 576, 1, 512, 3776, 3776, 3776, 576]
    - [0, 21.755]
  - - [3904, 576, 1, 512, 3904, 3904, 3904, 576]
    - [0, 21.832]
  - - [4032, 576, 1, 512, 4032, 4032, 4032, 576]
    - [0, 21.9]
  - - [64, 704, 1, 512, 64, 64, 64, 704]
    - [2, 7.519]
  - - [192, 704, 1, 512, 192, 192, 192, 704]
    - [0, 13.215]
  - - [320, 704, 1, 512, 320, 320, 320, 704]
    - [0, 15.945]
  - - [448, 704, 1, 512, 448, 448, 448, 704]
    - [0, 17.332]
  - - [576, 704, 1, 512, 576, 576, 576, 704]
    - [0, 18.419]
  - - [704, 704, 1, 512, 704, 704, 704, 704]
    - [0, 19.104]
  - - [832, 704, 1, 512, 832, 832, 832, 704]
    - [0, 19.654]
  - - [960, 704, 1, 512, 960, 960, 960, 704]
    - [0, 20.424]
  - - [1088, 704, 1, 512, 1088, 1088, 1088, 704]
    - [0, 20.609]
  - - [1216, 704, 1, 512, 1216, 1216, 1216, 704]
    - [0, 20.854]
  - - [1344, 704, 1, 512, 1344, 1344, 1344, 704]
    - [0, 20.465]
  - - [1472, 704, 1, 512, 1472, 1472, 1472, 704]
    - [0, 20.283]
  - - [1600, 704, 1, 512, 1600, 1600, 1600, 704]
    - [0, 20.515]
  - - [1728, 704, 1, 512, 1728, 1728, 1728, 704]
    - [0, 20.583]
  - - [1856, 704, 1, 512, 1856, 1856, 1856, 704]
    - [0, 20.817]
  - - [1984, 704, 1, 512, 1984, 1984, 1984, 704]
    - [0, 20.976]
  - - [2112, 704, 1, 512, 2112, 2112, 2112, 704]
    - [0, 21.16]
  - - [2240, 704, 1, 512, 2240, 2240, 2240, 704]
    - [0, 21.217]
  - - [2368, 704, 1, 512, 2368, 2368, 2368, 704]
    - [0, 21.356]
  - - [2496, 704, 1, 512, 2496, 2496, 2496, 704]
    - [0, 21.4]
  - - [2624, 704, 1, 512, 2624, 2624, 2624, 704]
    - [0, 21.435]
  - - [2752, 704, 1, 512, 2752, 2752, 2752, 704]
    - [0, 21.63]
  - - [2880, 704, 1, 512, 2880, 2880, 2880, 704]
    - [0, 21.655]
  - - [3008, 704, 1, 512, 3008, 3008, 3008, 704]
    - [0, 21.701]
  - - [3136, 704, 1, 512, 3136, 3136, 3136, 704]
    - [0, 21.779]
  - - [3264, 704, 1, 512, 3264, 3264, 3264, 704]
    - [0, 21.878]
  - - [3392, 704, 1, 512, 3392, 3392, 3392, 704]
    - [0, 21.894]
  - - [3520, 704, 1, 512, 3520, 3520, 3520, 704]
    - [0, 21.984]
  - - [3648, 704, 1, 512, 3648, 3648, 3648, 704]
    - [0, 22.023]
  - - [3776, 704, 1, 512, 3776, 3776, 3776, 704]
    - [0, 22.023]
  - - [3904, 704, 1, 512, 3904, 3904, 3904, 704]
    - [0, 22.098]
  - - [4032, 704, 1, 512, 4032, 4032, 4032, 704]
    - [0, 22.137]
  - - [64, 832, 1, 512, 64, 64, 64, 832]
    - [3, 7.845]
  - - [192, 832, 1, 512, 192, 192, 192, 832]
    - [2, 13.829]
  - - [320, 832, 1, 512, 320, 320, 320, 832]
    - [0, 17.066]
  - - [448, 832, 1, 512, 448, 448, 448, 832]
    - [0, 18.056]
  - - [576, 832, 1, 512, 576, 576, 576, 832]
    - [0, 19.225]
  - - [704, 832, 1, 512, 704, 704, 704, 832]
    - [0, 19.715]
  - - [832, 832, 1, 512, 832, 832, 832, 832]
    - [0, 20.159]
  - - [960, 832, 1, 512, 960, 960, 960, 832]
    - [0, 20.765]
  - - [1088, 832, 1, 512, 1088, 1088, 1088, 832]
    - [0, 20.995]
  - - [1216, 832, 1, 512, 1216, 1216, 1216, 832]
    - [0, 20.197]
  - - [1344, 832, 1, 512, 1344, 1344, 1344, 832]
    - [0, 20.456]
  - - [1472, 832, 1, 512, 1472, 1472, 1472, 832]
    - [0, 20.579]
  - - [1600, 832, 1, 512, 1600, 1600, 1600, 832]
    - [0, 20.886]
  - - [1728, 832, 1, 512, 1728, 1728, 1728, 832]
    - [0, 21.038]
  - - [1856, 832, 1, 512, 1856, 1856, 1856, 832]
    - [0, 21.153]
  - - [1984, 832, 1, 512, 1984, 1984, 1984, 832]
    - [0, 21.284]
  - - [2112, 832, 1, 512, 2112, 2112, 2112, 832]
    - [0, 21.417]
  - - [2240, 832, 1, 512, 2240, 2240, 2240, 832]
    - [0, 21.521]
  - - [2368, 832, 1, 512, 2368, 2368, 2368, 832]
    - [0, 21.62]
  - - [2496, 832, 1, 512, 2496, 2496, 2496, 832]
    - [0, 21.739]
  - - [2624, 832, 1, 512, 2624, 2624, 2624, 832]
    - [0, 21.729]
  - - [2752, 832, 1, 512, 2752, 2752, 2752, 832]
    - [0, 21.843]
  - - [2880, 832, 1, 512, 2880, 2880, 2880, 832]
    - [0, 21.927]
  - - [3008, 832, 1, 512, 3008, 3008, 3008, 832]
    - [0, 22.018]
  - - [3136, 832, 1, 512, 3136, 3136, 3136, 832]
    - [0, 21.968]
  - - [3264, 832, 1, 512, 3264, 3264, 3264, 832]
    - [0, 22.149]
  - - [3392, 832, 1, 512, 3392, 3392, 3392, 832]
    - [0, 22.148]
  - - [3520, 832, 1, 512, 3520, 3520, 3520, 832]
    - [0, 22.222]
  - - [3648, 832, 1, 512, 3648, 3648, 3648, 832]
    - [0, 22.168]
  - - [3776, 832, 1, 512, 3776, 3776, 3776, 832]
    - [0, 22.234]
  - - [3904, 832, 1, 512, 3904, 3904, 3904, 832]
    - [0, 22.321]
  - - [4032, 832, 1, 512, 4032, 4032, 4032, 832]
    - [0, 22.393]
  - - [64, 960, 1, 512, 64, 64, 64, 960]
    - [0, 9.778]
  - - [192, 960, 1, 512, 192, 192, 192, 960]
    - [0, 15.769]
  - - [320, 960, 1, 512, 320, 320, 320, 960]
    - [0, 17.959]
  - - [448, 960, 1, 512, 448, 448, 448, 960]
    - [0, 19.093]
  - - [576, 960, 1, 512, 576, 576, 576, 960]
    - [0, 19.878]
  - - [704, 960, 1, 512, 704, 704, 704, 960]
    - [0, 20.365]
  - - [832, 960, 1, 512, 832, 832, 832, 960]
    - [0, 20.719]
  - - [960, 960, 1, 512, 960, 960, 960, 960]
    - [0, 21.088]
  - - [1088, 960, 1, 512, 1088, 1088, 1088, 960]
    - [0, 20.376]
  - - [1216, 960, 1, 512, 1216, 1216, 1216, 960]
    - [0, 20.567]
  - - [1344, 960, 1, 512, 1344, 1344, 1344, 960]
    - [0, 20.796]
  - - [1472, 960, 1, 512, 1472, 1472, 1472, 960]
    - [0, 20.922]
  - - [1600, 960, 1, 512, 1600, 1600, 1600, 960]
    - [0, 21.116]
  - - [1728, 960, 1, 512, 1728, 1728, 1728, 960]
    - [0, 21.31]
  - - [1856, 960, 1, 512, 1856, 1856, 1856, 960]
    - [0, 21.519]
  - - [1984, 960, 1, 512, 1984, 1984, 1984, 960]
    - [0, 21.514]
  - - [2112, 960, 1, 512, 2112, 2112, 2112, 960]
    - [0, 21.675]
  - - [2240, 960, 1, 512, 2240, 2240, 2240, 960]
    - [0, 21.724]
  - - [2368, 960, 1, 512, 2368, 2368, 2368, 960]
    - [0, 21.893]
  - - [2496, 960, 1, 512, 2496, 2496, 2496, 960]
    - [0, 21.934]
  - - [2624, 960, 1, 512, 2624, 2624, 2624, 960]
    - [0, 22.0]
  - - [2752, 960, 1, 512, 2752, 2752, 2752, 960]
    - [0, 22.033]
  - - [2880, 960, 1, 512, 2880, 2880, 2880, 960]
    - [0, 22.118]
  - - [3008, 960, 1, 512, 3008, 3008, 3008, 960]
    - [0, 22.105]
  - - [3136, 960, 1, 512, 3136, 3136, 3136, 960]
    - [0, 22.282]
  - - [3264, 960, 1, 512, 3264, 3264, 3264, 960]
    - [0, 22.27]
  - - [3392, 960, 1, 512, 3392, 3392, 3392, 960]
    - [0, 22.279]
  - - [3520, 960, 1, 512, 3520, 3520, 3520, 960]
    - [0, 22.341]
  - - [3648, 960, 1, 512, 3648, 3648, 3648, 960]
    - [0, 22.384]
  - - [3776, 960, 1, 512, 3776, 3776, 3776, 960]
    - [0, 22.39]
  - - [3904, 960, 1, 512, 3904, 3904, 3904, 960]
    - [0, 22.471]
  - - [4032, 960, 1, 512, 4032, 4032, 4032, 960]
    - [0, 22.455]
  - - [64, 1088, 1, 512, 64, 64, 64, 1088]
    - [2, 9.305]
  - - [192, 1088, 1, 512, 192, 192, 192, 1088]
    - [0, 15.994]
  - - [320, 1088, 1, 512, 320, 320, 320, 1088]
    - [0, 17.791]
  - - [448, 1088, 1, 512, 448, 448, 448, 1088]
    - [0, 19.361]
  - - [576, 1088, 1, 512, 576, 576, 576, 1088]
    - [0, 19.948]
  - - [704, 1088, 1, 512, 704, 704, 704, 1088]
    - [0, 20.607]
  - - [832, 1088, 1, 512, 832, 832, 832, 1088]
    - [0, 20.904]
  - - [960, 1088, 1, 512, 960, 960, 960, 1088]
    - [0, 20.279]
  - - [1088, 1088, 1, 512, 1088, 1088, 1088, 1088]
    - [0, 20.614]
  - - [1216, 1088, 1, 512, 1216, 1216, 1216, 1088]
    - [0, 20.854]
  - - [1344, 1088, 1, 512, 1344, 1344, 1344, 1088]
    - [0, 21.052]
  - - [1472, 1088, 1, 512, 1472, 1472, 1472, 1088]
    - [0, 21.188]
  - - [1600, 1088, 1, 512, 1600, 1600, 1600, 1088]
    - [0, 21.362]
  - - [1728, 1088, 1, 512, 1728, 1728, 1728, 1088]
    - [0, 21.507]
  - - [1856, 1088, 1, 512, 1856, 1856, 1856, 1088]
    - [0, 21.601]
  - - [1984, 1088, 1, 512, 1984, 1984, 1984, 1088]
    - [0, 21.775]
  - - [2112, 1088, 1, 512, 2112, 2112, 2112, 1088]
    - [0, 21.871]
  - - [2240, 1088, 1, 512, 2240, 2240, 2240, 1088]
    - [0, 21.905]
  - - [2368, 1088, 1, 512, 2368, 2368, 2368, 1088]
    - [0, 21.986]
  - - [2496, 1088, 1, 512, 2496, 2496, 2496, 1088]
    - [0, 22.088]
  - - [2624, 1088, 1, 512, 2624, 2624, 2624, 1088]
    - [0, 22.186]
  - - [2752, 1088, 1, 512, 2752, 2752, 2752, 1088]
    - [0, 22.175]
  - - [2880, 1088, 1, 512, 2880, 2880, 2880, 1088]
    - [0, 22.262]
  - - [3008, 1088, 1, 512, 3008, 3008, 3008, 1088]
    - [0, 22.285]
  - - [3136, 1088, 1, 512, 3136, 3136, 3136, 1088]
    - [0, 22.317]
  - - [3264, 1088, 1, 512, 3264, 3264, 3264, 1088]
    - [0, 22.378]
  - - [3392, 1088, 1, 512, 3392, 3392, 3392, 1088]
    - [0, 22.387]
  - - [3520, 1088, 1, 512, 3520, 3520, 3520, 1088]
    - [0, 22.416]
  - - [3648, 1088, 1, 512, 3648, 3648, 3648, 1088]
    - [0, 22.563]
  - - [3776, 1088, 1, 512, 3776, 3776, 3776, 1088]
    - [0, 22.549]
  - - [3904, 1088, 1, 512, 3904, 3904, 3904, 1088]
    - [0, 22.544]
  - - [4032, 1088, 1, 512, 4032, 4032, 4032, 1088]
    - [0, 22.591]
  - - [64, 1216, 1, 512, 64, 64, 64, 1216]
    - [0, 10.366]
  - - [192, 1216, 1, 512, 192, 192, 192, 1216]
    - [0, 16.246]
  - - [320, 1216, 1, 512, 320, 320, 320, 1216]
    - [0, 18.558]
  - - [448, 1216, 1, 512, 448, 448, 448, 1216]
    - [0, 19.605]
  - - [576, 1216, 1, 512, 576, 576, 576, 1216]
    - [0, 20.509]
  - - [704, 1216, 1, 512, 704, 704, 704, 1216]
    - [0, 20.875]
  - - [832, 1216, 1, 512, 832, 832, 832, 1216]
    - [0, 20.15]
  - - [960, 1216, 1, 512, 960, 960, 960, 1216]
    - [0, 20.478]
  - - [1088, 1216, 1, 512, 1088, 1088, 1088, 1216]
    - [0, 20.79]
  - - [1216, 1216, 1, 512, 1216, 1216, 1216, 1216]
    - [0, 21.159]
  - - [1344, 1216, 1, 512, 1344, 1344, 1344, 1216]
    - [0, 21.252]
  - - [1472, 1216, 1, 512, 1472, 1472, 1472, 1216]
    - [0, 21.469]
  - - [1600, 1216, 1, 512, 1600, 1600, 1600, 1216]
    - [0, 21.578]
  - - [1728, 1216, 1, 512, 1728, 1728, 1728, 1216]
    - [0, 21.783]
  - - [1856, 1216, 1, 512, 1856, 1856, 1856, 1216]
    - [0, 21.86]
  - - [1984, 1216, 1, 512, 1984, 1984, 1984, 1216]
    - [0, 21.947]
  - - [2112, 1216, 1, 512, 2112, 2112, 2112, 1216]
    - [0, 22.024]
  - - [2240, 1216, 1, 512, 2240, 2240, 2240, 1216]
    - [0, 22.013]
  - - [2368, 1216, 1, 512, 2368, 2368, 2368, 1216]
    - [0, 22.156]
  - - [2496, 1216, 1, 512, 2496, 2496, 2496, 1216]
    - [0, 22.209]
  - - [2624, 1216, 1, 512, 2624, 2624, 2624, 1216]
    - [0, 22.221]
  - - [2752, 1216, 1, 512, 2752, 2752, 2752, 1216]
    - [0, 22.272]
  - - [2880, 1216, 1, 512, 2880, 2880, 2880, 1216]
    - [0, 22.4]
  - - [3008, 1216, 1, 512, 3008, 3008, 3008, 1216]
    - [0, 22.441]
  - - [3136, 1216, 1, 512, 3136, 3136, 3136, 1216]
    - [0, 22.504]
  - - [3264, 1216, 1, 512, 3264, 3264, 3264, 1216]
    - [0, 22.475]
  - - [3392, 1216, 1, 512, 3392, 3392, 3392, 1216]
    - [0, 22.542]
  - - [3520, 1216, 1, 512, 3520, 3520, 3520, 1216]
    - [0, 22.641]
  - - [3648, 1216, 1, 512, 3648, 3648, 3648, 1216]
    - [0, 22.597]
  - - [3776, 1216, 1, 512, 3776, 3776, 3776, 1216]
    - [0, 22.605]
  - - [3904, 1216, 1, 512, 3904, 3904, 3904, 1216]
    - [0, 22.609]
  - - [4032, 1216, 1, 512, 4032, 4032, 4032, 1216]
    - [0, 22.651]
  - - [64, 1344, 1, 512, 64, 64, 64, 1344]
    - [0, 11.432]
  - - [192, 1344, 1, 512, 192, 192, 192, 1344]
    - [0, 16.473]
  - - [320, 1344, 1, 512, 320, 320, 320, 1344]
    - [0, 19.141]
  - - [448, 1344, 1, 512, 448, 448, 448, 1344]
    - [0, 19.919]
  - - [576, 1344, 1, 512, 576, 576, 576, 1344]
    - [0, 20.496]
  - - [704, 1344, 1, 512, 704, 704, 704, 1344]
    - [2, 19.376]
  - - [832, 1344, 1, 512, 832, 832, 832, 1344]
    - [0, 20.422]
  - - [960, 1344, 1, 512, 960, 960, 960, 1344]
    - [0, 20.712]
  - - [1088, 1344, 1, 512, 1088, 1088, 1088, 1344]
    - [0, 21.068]
  - - [1216, 1344, 1, 512, 1216, 1216, 1216, 1344]
    - [0, 21.315]
  - - [1344, 1344, 1, 512, 1344, 1344, 1344, 1344]
    - [0, 21.469]
  - - [1472, 1344, 1, 512, 1472, 1472, 1472, 1344]
    - [0, 21.631]
  - - [1600, 1344, 1, 512, 1600, 1600, 1600, 1344]
    - [0, 21.723]
  - - [1728, 1344, 1, 512, 1728, 1728, 1728, 1344]
    - [0, 21.862]
  - - [1856, 1344, 1, 512, 1856, 1856, 1856, 1344]
    - [0, 21.989]
  - - [1984, 1344, 1, 512, 1984, 1984, 1984, 1344]
    - [0, 22.065]
  - - [2112, 1344, 1, 512, 2112, 2112, 2112, 1344]
    - [0, 22.118]
  - - [2240, 1344, 1, 512, 2240, 2240, 2240, 1344]
    - [0, 22.186]
  - - [2368, 1344, 1, 512, 2368, 2368, 2368, 1344]
    - [0, 22.238]
  - - [2496, 1344, 1, 512, 2496, 2496, 2496, 1344]
    - [0, 22.337]
  - - [2624, 1344, 1, 512, 2624, 2624, 2624, 1344]
    - [0, 22.378]
  - - [2752, 1344, 1, 512, 2752, 2752, 2752, 1344]
    - [0, 22.427]
  - - [2880, 1344, 1, 512, 2880, 2880, 2880, 1344]
    - [0, 22.438]
  - - [3008, 1344, 1, 512, 3008, 3008, 3008, 1344]
    - [0, 22.529]
  - - [3136, 1344, 1, 512, 3136, 3136, 3136, 1344]
    - [2, 22.501]
  - - [3264, 1344, 1, 512, 3264, 3264, 3264, 1344]
    - [0, 22.555]
  - - [3392, 1344, 1, 512, 3392, 3392, 3392, 1344]
    - [0, 22.579]
  - - [3520, 1344, 1, 512, 3520, 3520, 3520, 1344]
    - [0, 22.681]
  - - [3648, 1344, 1, 512, 3648, 3648, 3648, 1344]
    - [0, 22.668]
  - - [3776, 1344, 1, 512, 3776, 3776, 3776, 1344]
    - [0, 22.692]
  - - [3904, 1344, 1, 512, 3904, 3904, 3904, 1344]
    - [0, 22.673]
  - - [4032, 1344, 1, 512, 4032, 4032, 4032, 1344]
    - [2, 22.674]
  - - [64, 1472, 1, 512, 64, 64, 64, 1472]
    - [0, 10.786]
  - - [192, 1472, 1, 512, 192, 192, 192, 1472]
    - [0, 16.605]
  - - [320, 1472, 1, 512, 320, 320, 320, 1472]
    - [0, 18.98]
  - - [448, 1472, 1, 512, 448, 448, 448, 1472]
    - [0, 20.214]
  - - [576, 1472, 1, 512, 576, 576, 576, 1472]
    - [0, 20.793]
  - - [704, 1472, 1, 512, 704, 704, 704, 1472]
    - [0, 20.204]
  - - [832, 1472, 1, 512, 832, 832, 832, 1472]
    - [0, 20.672]
  - - [960, 1472, 1, 512, 960, 960, 960, 1472]
    - [0, 20.918]
  - - [1088, 1472, 1, 512, 1088, 1088, 1088, 1472]
    - [0, 21.186]
  - - [1216, 1472, 1, 512, 1216, 1216, 1216, 1472]
    - [0, 21.472]
  - - [1344, 1472, 1, 512, 1344, 1344, 1344, 1472]
    - [0, 21.586]
  - - [1472, 1472, 1, 512, 1472, 1472, 1472, 1472]
    - [0, 21.719]
  - - [1600, 1472, 1, 512, 1600, 1600, 1600, 1472]
    - [0, 21.97]
  - - [1728, 1472, 1, 512, 1728, 1728, 1728, 1472]
    - [0, 21.995]
  - - [1856, 1472, 1, 512, 1856, 1856, 1856, 1472]
    - [0, 22.092]
  - - [1984, 1472, 1, 512, 1984, 1984, 1984, 1472]
    - [0, 22.2]
  - - [2112, 1472, 1, 512, 2112, 2112, 2112, 1472]
    - [0, 22.267]
  - - [2240, 1472, 1, 512, 2240, 2240, 2240, 1472]
    - [0, 22.315]
  - - [2368, 1472, 1, 512, 2368, 2368, 2368, 1472]
    - [0, 22.399]
  - - [2496, 1472, 1, 512, 2496, 2496, 2496, 1472]
    - [0, 22.432]
  - - [2624, 1472, 1, 512, 2624, 2624, 2624, 1472]
    - [0, 22.478]
  - - [2752, 1472, 1, 512, 2752, 2752, 2752, 1472]
    - [0, 22.554]
  - - [2880, 1472, 1, 512, 2880, 2880, 2880, 1472]
    - [0, 22.513]
  - - [3008, 1472, 1, 512, 3008, 3008, 3008, 1472]
    - [0, 22.57]
  - - [3136, 1472, 1, 512, 3136, 3136, 3136, 1472]
    - [0, 22.684]
  - - [3264, 1472, 1, 512, 3264, 3264, 3264, 1472]
    - [0, 22.633]
  - - [3392, 1472, 1, 512, 3392, 3392, 3392, 1472]
    - [0, 22.639]
  - - [3520, 1472, 1, 512, 3520, 3520, 3520, 1472]
    - [0, 22.682]
  - - [3648, 1472, 1, 512, 3648, 3648, 3648, 1472]
    - [0, 22.841]
  - - [3776, 1472, 1, 512, 3776, 3776, 3776, 1472]
    - [0, 22.792]
  - - [3904, 1472, 1, 512, 3904, 3904, 3904, 1472]
    - [0, 22.806]
  - - [4032, 1472, 1, 512, 4032, 4032, 4032, 1472]
    - [0, 22.843]
  - - [64, 1600, 1, 512, 64, 64, 64, 1600]
    - [0, 11.639]
  - - [192, 1600, 1, 512, 192, 192, 192, 1600]
    - [0, 17.907]
  - - [320, 1600, 1, 512, 320, 320, 320, 1600]
    - [0, 19.418]
  - - [448, 1600, 1, 512, 448, 448, 448, 1600]
    - [0, 20.32]
  - - [576, 1600, 1, 512, 576, 576, 576, 1600]
    - [0, 20.976]
  - - [704, 1600, 1, 512, 704, 704, 704, 1600]
    - [0, 20.491]
  - - [832, 1600, 1, 512, 832, 832, 832, 1600]
    - [0, 20.879]
  - - [960, 1600, 1, 512, 960, 960, 960, 1600]
    - [0, 21.141]
  - - [1088, 1600, 1, 512, 1088, 1088, 1088, 1600]
    - [0, 21.351]
  - - [1216, 1600, 1, 512, 1216, 1216, 1216, 1600]
    - [0, 21.597]
  - - [1344, 1600, 1, 512, 1344, 1344, 1344, 1600]
    - [0, 21.758]
  - - [1472, 1600, 1, 512, 1472, 1472, 1472, 1600]
    - [0, 21.875]
  - - [1600, 1600, 1, 512, 1600, 1600, 1600, 1600]
    - [0, 22.003]
  - - [1728, 1600, 1, 512, 1728, 1728, 1728, 1600]
    - [0, 22.085]
  - - [1856, 1600, 1, 512, 1856, 1856, 1856, 1600]
    - [0, 22.139]
  - - [1984, 1600, 1, 512, 1984, 1984, 1984, 1600]
    - [0, 22.233]
  - - [2112, 1600, 1, 512, 2112, 2112, 2112, 1600]
    - [0, 22.344]
  - - [2240, 1600, 1, 512, 2240, 2240, 2240, 1600]
    - [0, 22.398]
  - - [2368, 1600, 1, 512, 2368, 2368, 2368, 1600]
    - [0, 22.425]
  - - [2496, 1600, 1, 512, 2496, 2496, 2496, 1600]
    - [0, 22.509]
  - - [2624, 1600, 1, 512, 2624, 2624, 2624, 1600]
    - [0, 22.538]
  - - [2752, 1600, 1, 512, 2752, 2752, 2752, 1600]
    - [0, 22.587]
  - - [2880, 1600, 1, 512, 2880, 2880, 2880, 1600]
    - [0, 22.646]
  - - [3008, 1600, 1, 512, 3008, 3008, 3008, 1600]
    - [0, 22.71]
  - - [3136, 1600, 1, 512, 3136, 3136, 3136, 1600]
    - [0, 22.666]
  - - [3264, 1600, 1, 512, 3264, 3264, 3264, 1600]
    - [0, 22.686]
  - - [3392, 1600, 1, 512, 3392, 3392, 3392, 1600]
    - [0, 22.706]
  - - [3520, 1600, 1, 512, 3520, 3520, 3520, 1600]
    - [0, 22.807]
  - - [3648, 1600, 1, 512, 3648, 3648, 3648, 1600]
    - [0, 22.818]
  - - [3776, 1600, 1, 512, 3776, 3776, 3776, 1600]
    - [0, 22.858]
  - - [3904, 1600, 1, 512, 3904, 3904, 3904, 1600]
    - [0, 22.789]
  - - [4032, 1600, 1, 512, 4032, 4032, 4032, 1600]
    - [0, 22.844]
  - - [64, 1728, 1, 512, 64, 64, 64, 1728]
    - [0, 12.551]
  - - [192, 1728, 1, 512, 192, 192, 192, 1728]
    - [0, 17.93]
  - - [320, 1728, 1, 512, 320, 320, 320, 1728]
    - [0, 19.86]
  - - [448, 1728, 1, 512, 448, 448, 448, 1728]
    - [0, 20.508]
  - - [576, 1728, 1, 512, 576, 576, 576, 1728]
    - [0, 19.993]
  - - [704, 1728, 1, 512, 704, 704, 704, 1728]
    - [0, 20.65]
  - - [832, 1728, 1, 512, 832, 832, 832, 1728]
    - [0, 20.998]
  - - [960, 1728, 1, 512, 960, 960, 960, 1728]
    - [0, 21.292]
  - - [1088, 1728, 1, 512, 1088, 1088, 1088, 1728]
    - [0, 21.517]
  - - [1216, 1728, 1, 512, 1216, 1216, 1216, 1728]
    - [0, 21.744]
  - - [1344, 1728, 1, 512, 1344, 1344, 1344, 1728]
    - [0, 21.85]
  - - [1472, 1728, 1, 512, 1472, 1472, 1472, 1728]
    - [0, 22.034]
  - - [1600, 1728, 1, 512, 1600, 1600, 1600, 1728]
    - [0, 22.072]
  - - [1728, 1728, 1, 512, 1728, 1728, 1728, 1728]
    - [0, 22.191]
  - - [1856, 1728, 1, 512, 1856, 1856, 1856, 1728]
    - [0, 22.274]
  - - [1984, 1728, 1, 512, 1984, 1984, 1984, 1728]
    - [0, 22.333]
  - - [2112, 1728, 1, 512, 2112, 2112, 2112, 1728]
    - [0, 22.442]
  - - [2240, 1728, 1, 512, 2240, 2240, 2240, 1728]
    - [0, 22.461]
  - - [2368, 1728, 1, 512, 2368, 2368, 2368, 1728]
    - [0, 22.47]
  - - [2496, 1728, 1, 512, 2496, 2496, 2496, 1728]
    - [0, 22.552]
  - - [2624, 1728, 1, 512, 2624, 2624, 2624, 1728]
    - [0, 22.616]
  - - [2752, 1728, 1, 512, 2752, 2752, 2752, 1728]
    - [0, 22.708]
  - - [2880, 1728, 1, 512, 2880, 2880, 2880, 1728]
    - [0, 22.7]
  - - [3008, 1728, 1, 512, 3008, 3008, 3008, 1728]
    - [0, 22.74]
  - - [3136, 1728, 1, 512, 3136, 3136, 3136, 1728]
    - [0, 22.738]
  - - [3264, 1728, 1, 512, 3264, 3264, 3264, 1728]
    - [0, 22.848]
  - - [3392, 1728, 1, 512, 3392, 3392, 3392, 1728]
    - [0, 22.835]
  - - [3520, 1728, 1, 512, 3520, 3520, 3520, 1728]
    - [0, 22.791]
  - - [3648, 1728, 1, 512, 3648, 3648, 3648, 1728]
    - [0, 22.838]
  - - [3776, 1728, 1, 512, 3776, 3776, 3776, 1728]
    - [0, 22.903]
  - - [3904, 1728, 1, 512, 3904, 3904, 3904, 1728]
    - [0, 22.902]
  - - [4032, 1728, 1, 512, 4032, 4032, 4032, 1728]
    - [0, 22.916]
  - - [64, 1856, 1, 512, 64, 64, 64, 1856]
    - [0, 13.463]
  - - [192, 1856, 1, 512, 192, 192, 192, 1856]
    - [0, 18.013]
  - - [320, 1856, 1, 512, 320, 320, 320, 1856]
    - [0, 19.728]
  - - [448, 1856, 1, 512, 448, 448, 448, 1856]
    - [0, 20.555]
  - - [576, 1856, 1, 512, 576, 576, 576, 1856]
    - [0, 20.204]
  - - [704, 1856, 1, 512, 704, 704, 704, 1856]
    - [0, 20.771]
  - - [832, 1856, 1, 512, 832, 832, 832, 1856]
    - [0, 21.162]
  - - [960, 1856, 1, 512, 960, 960, 960, 1856]
    - [0, 21.395]
  - - [1088, 1856, 1, 512, 1088, 1088, 1088, 1856]
    - [0, 21.592]
  - - [1216, 1856, 1, 512, 1216, 1216, 1216, 1856]
    - [0, 21.812]
  - - [1344, 1856, 1, 512, 1344, 1344, 1344, 1856]
    - [0, 21.99]
  - - [1472, 1856, 1, 512, 1472, 1472, 1472, 1856]
    - [0, 22.101]
  - - [1600, 1856, 1, 512, 1600, 1600, 1600, 1856]
    - [0, 22.19]
  - - [1728, 1856, 1, 512, 1728, 1728, 1728, 1856]
    - [0, 22.189]
  - - [1856, 1856, 1, 512, 1856, 1856, 1856, 1856]
    - [0, 22.35]
  - - [1984, 1856, 1, 512, 1984, 1984, 1984, 1856]
    - [0, 22.487]
  - - [2112, 1856, 1, 512, 2112, 2112, 2112, 1856]
    - [0, 22.506]
  - - [2240, 1856, 1, 512, 2240, 2240, 2240, 1856]
    - [0, 22.562]
  - - [2368, 1856, 1, 512, 2368, 2368, 2368, 1856]
    - [0, 22.575]
  - - [2496, 1856, 1, 512, 2496, 2496, 2496, 1856]
    - [0, 22.627]
  - - [2624, 1856, 1, 512, 2624, 2624, 2624, 1856]
    - [0, 22.727]
  - - [2752, 1856, 1, 512, 2752, 2752, 2752, 1856]
    - [0, 22.669]
  - - [2880, 1856, 1, 512, 2880, 2880, 2880, 1856]
    - [0, 22.684]
  - - [3008, 1856, 1, 512, 3008, 3008, 3008, 1856]
    - [0, 22.796]
  - - [3136, 1856, 1, 512, 3136, 3136, 3136, 1856]
    - [0, 22.803]
  - - [3264, 1856, 1, 512, 3264, 3264, 3264, 1856]
    - [0, 22.908]
  - - [3392, 1856, 1, 512, 3392, 3392, 3392, 1856]
    - [0, 22.848]
  - - [3520, 1856, 1, 512, 3520, 3520, 3520, 1856]
    - [0, 22.852]
  - - [3648, 1856, 1, 512, 3648, 3648, 3648, 1856]
    - [0, 22.888]
  - - [3776, 1856, 1, 512, 3776, 3776, 3776, 1856]
    - [0, 22.946]
  - - [3904, 1856, 1, 512, 3904, 3904, 3904, 1856]
    - [0, 22.976]
  - - [4032, 1856, 1, 512, 4032, 4032, 4032, 1856]
    - [2, 22.506]
  - - [64, 1984, 1, 512, 64, 64, 64, 1984]
    - [0, 12.594]
  - - [192, 1984, 1, 512, 192, 192, 192, 1984]
    - [0, 18.16]
  - - [320, 1984, 1, 512, 320, 320, 320, 1984]
    - [0, 20.127]
  - - [448, 1984, 1, 512, 448, 448, 448, 1984]
    - [0, 20.912]
  - - [576, 1984, 1, 512, 576, 576, 576, 1984]
    - [0, 20.525]
  - - [704, 1984, 1, 512, 704, 704, 704, 1984]
    - [0, 21.027]
  - - [832, 1984, 1, 512, 832, 832, 832, 1984]
    - [0, 21.257]
  - - [960, 1984, 1, 512, 960, 960, 960, 1984]
    - [0, 21.572]
  - - [1088, 1984, 1, 512, 1088, 1088, 1088, 1984]
    - [0, 21.725]
  - - [1216, 1984, 1, 512, 1216, 1216, 1216, 1984]
    - [0, 21.876]
  - - [1344, 1984, 1, 512, 1344, 1344, 1344, 1984]
    - [0, 22.061]
  - - [1472, 1984, 1, 512, 1472, 1472, 1472, 1984]
    - [0, 22.243]
  - - [1600, 1984, 1, 512, 1600, 1600, 1600, 1984]
    - [0, 22.282]
  - - [1728, 1984, 1, 512, 1728, 1728, 1728, 1984]
    - [0, 22.283]
  - - [1856, 1984, 1, 512, 1856, 1856, 1856, 1984]
    - [0, 22.4]
  - - [1984, 1984, 1, 512, 1984, 1984, 1984, 1984]
    - [0, 22.497]
  - - [2112, 1984, 1, 512, 2112, 2112, 2112, 1984]
    - [0, 22.551]
  - - [2240, 1984, 1, 512, 2240, 2240, 2240, 1984]
    - [0, 22.607]
  - - [2368, 1984, 1, 512, 2368, 2368, 2368, 1984]
    - [0, 22.642]
  - - [2496, 1984, 1, 512, 2496, 2496, 2496, 1984]
    - [0, 22.719]
  - - [2624, 1984, 1, 512, 2624, 2624, 2624, 1984]
    - [0, 22.781]
  - - [2752, 1984, 1, 512, 2752, 2752, 2752, 1984]
    - [0, 22.811]
  - - [2880, 1984, 1, 512, 2880, 2880, 2880, 1984]
    - [0, 22.784]
  - - [3008, 1984, 1, 512, 3008, 3008, 3008, 1984]
    - [0, 22.808]
  - - [3136, 1984, 1, 512, 3136, 3136, 3136, 1984]
    - [0, 22.776]
  - - [3264, 1984, 1, 512, 3264, 3264, 3264, 1984]
    - [0, 22.914]
  - - [3392, 1984, 1, 512, 3392, 3392, 3392, 1984]
    - [0, 22.915]
  - - [3520, 1984, 1, 512, 3520, 3520, 3520, 1984]
    - [0, 22.957]
  - - [3648, 1984, 1, 512, 3648, 3648, 3648, 1984]
    - [0, 22.933]
  - - [3776, 1984, 1, 512, 3776, 3776, 3776, 1984]
    - [0, 22.489]
  - - [3904, 1984, 1, 512, 3904, 3904, 3904, 1984]
    - [2, 22.541]
  - - [4032, 1984, 1, 512, 4032, 4032, 4032, 1984]
    - [0, 22.609]
  - - [64, 2112, 1, 512, 64, 64, 64, 2112]
    - [0, 13.242]
  - - [192, 2112, 1, 512, 192, 192, 192, 2112]
    - [0, 18.384]
  - - [320, 2112, 1, 512, 320, 320, 320, 2112]
    - [0, 20.382]
  - - [448, 2112, 1, 512, 448, 448, 448, 2112]
    - [2, 19.574]
  - - [576, 2112, 1, 512, 576, 576, 576, 2112]
    - [0, 20.699]
  - - [704, 2112, 1, 512, 704, 704, 704, 2112]
    - [0, 21.11]
  - - [832, 2112, 1, 512, 832, 832, 832, 2112]
    - [0, 21.353]
  - - [960, 2112, 1, 512, 960, 960, 960, 2112]
    - [0, 21.685]
  - - [1088, 2112, 1, 512, 1088, 1088, 1088, 2112]
    - [0, 21.87]
  - - [1216, 2112, 1, 512, 1216, 1216, 1216, 2112]
    - [0, 22.007]
  - - [1344, 2112, 1, 512, 1344, 1344, 1344, 2112]
    - [0, 22.142]
  - - [1472, 2112, 1, 512, 1472, 1472, 1472, 2112]
    - [0, 22.224]
  - - [1600, 2112, 1, 512, 1600, 1600, 1600, 2112]
    - [2, 22.24]
  - - [1728, 2112, 1, 512, 1728, 1728, 1728, 2112]
    - [0, 22.387]
  - - [1856, 2112, 1, 512, 1856, 1856, 1856, 2112]
    - [0, 22.539]
  - - [1984, 2112, 1, 512, 1984, 1984, 1984, 2112]
    - [0, 22.463]
  - - [2112, 2112, 1, 512, 2112, 2112, 2112, 2112]
    - [0, 22.637]
  - - [2240, 2112, 1, 512, 2240, 2240, 2240, 2112]
    - [0, 22.672]
  - - [2368, 2112, 1, 512, 2368, 2368, 2368, 2112]
    - [0, 22.678]
  - - [2496, 2112, 1, 512, 2496, 2496, 2496, 2112]
    - [0, 22.756]
  - - [2624, 2112, 1, 512, 2624, 2624, 2624, 2112]
    - [0, 22.705]
  - - [2752, 2112, 1, 512, 2752, 2752, 2752, 2112]
    - [0, 22.816]
  - - [2880, 2112, 1, 512, 2880, 2880, 2880, 2112]
    - [0, 22.8]
  - - [3008, 2112, 1, 512, 3008, 3008, 3008, 2112]
    - [0, 22.856]
  - - [3136, 2112, 1, 512, 3136, 3136, 3136, 2112]
    - [0, 22.882]
  - - [3264, 2112, 1, 512, 3264, 3264, 3264, 2112]
    - [0, 22.947]
  - - [3392, 2112, 1, 512, 3392, 3392, 3392, 2112]
    - [0, 22.866]
  - - [3520, 2112, 1, 512, 3520, 3520, 3520, 2112]
    - [0, 22.931]
  - - [3648, 2112, 1, 512, 3648, 3648, 3648, 2112]
    - [2, 22.53]
  - - [3776, 2112, 1, 512, 3776, 3776, 3776, 2112]
    - [0, 22.56]
  - - [3904, 2112, 1, 512, 3904, 3904, 3904, 2112]
    - [0, 22.638]
  - - [4032, 2112, 1, 512, 4032, 4032, 4032, 2112]
    - [0, 22.678]
  - - [64, 2240, 1, 512, 64, 64, 64, 2240]
    - [0, 14.021]
  - - [192, 2240, 1, 512, 192, 192, 192, 2240]
    - [0, 19.138]
  - - [320, 2240, 1, 512, 320, 320, 320, 2240]
    - [0, 20.254]
  - - [448, 2240, 1, 512, 448, 448, 448, 2240]
    - [0, 20.101]
  - - [576, 2240, 1, 512, 576, 576, 576, 2240]
    - [0, 20.773]
  - - [704, 2240, 1, 512, 704, 704, 704, 2240]
    - [0, 21.214]
  - - [832, 2240, 1, 512, 832, 832, 832, 2240]
    - [0, 21.557]
  - - [960, 2240, 1, 512, 960, 960, 960, 2240]
    - [0, 21.808]
  - - [1088, 2240, 1, 512, 1088, 1088, 1088, 2240]
    - [0, 21.951]
  - - [1216, 2240, 1, 512, 1216, 1216, 1216, 2240]
    - [0, 22.158]
  - - [1344, 2240, 1, 512, 1344, 1344, 1344, 2240]
    - [0, 22.215]
  - - [1472, 2240, 1, 512, 1472, 1472, 1472, 2240]
    - [0, 22.253]
  - - [1600, 2240, 1, 512, 1600, 1600, 1600, 2240]
    - [0, 22.413]
  - - [1728, 2240, 1, 512, 1728, 1728, 1728, 2240]
    - [0, 22.503]
  - - [1856, 2240, 1, 512, 1856, 1856, 1856, 2240]
    - [0, 22.54]
  - - [1984, 2240, 1, 512, 1984, 1984, 1984, 2240]
    - [0, 22.591]
  - - [2112, 2240, 1, 512, 2112, 2112, 2112, 2240]
    - [0, 22.729]
  - - [2240, 2240, 1, 512, 2240, 2240, 2240, 2240]
    - [0, 22.779]
  - - [2368, 2240, 1, 512, 2368, 2368, 2368, 2240]
    - [0, 22.844]
  - - [2496, 2240, 1, 512, 2496, 2496, 2496, 2240]
    - [0, 22.858]
  - - [2624, 2240, 1, 512, 2624, 2624, 2624, 2240]
    - [0, 22.837]
  - - [2752, 2240, 1, 512, 2752, 2752, 2752, 2240]
    - [0, 22.848]
  - - [2880, 2240, 1, 512, 2880, 2880, 2880, 2240]
    - [0, 22.924]
  - - [3008, 2240, 1, 512, 3008, 3008, 3008, 2240]
    - [0, 22.953]
  - - [3136, 2240, 1, 512, 3136, 3136, 3136, 2240]
    - [0, 22.925]
  - - [3264, 2240, 1, 512, 3264, 3264, 3264, 2240]
    - [0, 22.962]
  - - [3392, 2240, 1, 512, 3392, 3392, 3392, 2240]
    - [0, 22.585]
  - - [3520, 2240, 1, 512, 3520, 3520, 3520, 2240]
    - [0, 22.636]
  - - [3648, 2240, 1, 512, 3648, 3648, 3648, 2240]
    - [0, 22.603]
  - - [3776, 2240, 1, 512, 3776, 3776, 3776, 2240]
    - [0, 22.688]
  - - [3904, 2240, 1, 512, 3904, 3904, 3904, 2240]
    - [0, 22.678]
  - - [4032, 2240, 1, 512, 4032, 4032, 4032, 2240]
    - [2, 22.667]
  - - [64, 2368, 1, 512, 64, 64, 64, 2368]
    - [0, 14.784]
  - - [192, 2368, 1, 512, 192, 192, 192, 2368]
    - [0, 19.133]
  - - [320, 2368, 1, 512, 320, 320, 320, 2368]
    - [0, 20.525]
  - - [448, 2368, 1, 512, 448, 448, 448, 2368]
    - [0, 20.227]
  - - [576, 2368, 1, 512, 576, 576, 576, 2368]
    - [0, 20.935]
  - - [704, 2368, 1, 512, 704, 704, 704, 2368]
    - [0, 21.368]
  - - [832, 2368, 1, 512, 832, 832, 832, 2368]
    - [0, 21.656]
  - - [960, 2368, 1, 512, 960, 960, 960, 2368]
    - [0, 21.793]
  - - [1088, 2368, 1, 512, 1088, 1088, 1088, 2368]
    - [0, 22.03]
  - - [1216, 2368, 1, 512, 1216, 1216, 1216, 2368]
    - [0, 22.123]
  - - [1344, 2368, 1, 512, 1344, 1344, 1344, 2368]
    - [0, 22.33]
  - - [1472, 2368, 1, 512, 1472, 1472, 1472, 2368]
    - [0, 22.429]
  - - [1600, 2368, 1, 512, 1600, 1600, 1600, 2368]
    - [0, 22.386]
  - - [1728, 2368, 1, 512, 1728, 1728, 1728, 2368]
    - [0, 22.55]
  - - [1856, 2368, 1, 512, 1856, 1856, 1856, 2368]
    - [0, 22.574]
  - - [1984, 2368, 1, 512, 1984, 1984, 1984, 2368]
    - [0, 22.686]
  - - [2112, 2368, 1, 512, 2112, 2112, 2112, 2368]
    - [0, 22.748]
  - - [2240, 2368, 1, 512, 2240, 2240, 2240, 2368]
    - [0, 22.727]
  - - [2368, 2368, 1, 512, 2368, 2368, 2368, 2368]
    - [0, 22.791]
  - - [2496, 2368, 1, 512, 2496, 2496, 2496, 2368]
    - [0, 22.806]
  - - [2624, 2368, 1, 512, 2624, 2624, 2624, 2368]
    - [0, 22.82]
  - - [2752, 2368, 1, 512, 2752, 2752, 2752, 2368]
    - [0, 22.868]
  - - [2880, 2368, 1, 512, 2880, 2880, 2880, 2368]
    - [0, 22.885]
  - - [3008, 2368, 1, 512, 3008, 3008, 3008, 2368]
    - [0, 22.929]
  - - [3136, 2368, 1, 512, 3136, 3136, 3136, 2368]
    - [0, 22.971]
  - - [3264, 2368, 1, 512, 3264, 3264, 3264, 2368]
    - [0, 22.598]
  - - [3392, 2368, 1, 512, 3392, 3392, 3392, 2368]
    - [0, 22.652]
  - - [3520, 2368, 1, 512, 3520, 3520, 3520, 2368]
    - [0, 22.598]
  - - [3648, 2368, 1, 512, 3648, 3648, 3648, 2368]
    - [0, 22.621]
  - - [3776, 2368, 1, 512, 3776, 3776, 3776, 2368]
    - [0, 22.736]
  - - [3904, 2368, 1, 512, 3904, 3904, 3904, 2368]
    - [0, 22.761]
  - - [4032, 2368, 1, 512, 4032, 4032, 4032, 2368]
    - [2, 22.725]
  - - [64, 2496, 1, 512, 64, 64, 64, 2496]
    - [2, 14.099]
  - - [192, 2496, 1, 512, 192, 192, 192, 2496]
    - [0, 19.081]
  - - [320, 2496, 1, 512, 320, 320, 320, 2496]
    - [0, 20.755]
  - - [448, 2496, 1, 512, 448, 448, 448, 2496]
    - [0, 20.417]
  - - [576, 2496, 1, 512, 576, 576, 576, 2496]
    - [0, 21.021]
  - - [704, 2496, 1, 512, 704, 704, 704, 2496]
    - [0, 21.427]
  - - [832, 2496, 1, 512, 832, 832, 832, 2496]
    - [0, 21.74]
  - - [960, 2496, 1, 512, 960, 960, 960, 2496]
    - [0, 21.905]
  - - [1088, 2496, 1, 512, 1088, 1088, 1088, 2496]
    - [0, 22.025]
  - - [1216, 2496, 1, 512, 1216, 1216, 1216, 2496]
    - [0, 22.186]
  - - [1344, 2496, 1, 512, 1344, 1344, 1344, 2496]
    - [0, 22.299]
  - - [1472, 2496, 1, 512, 1472, 1472, 1472, 2496]
    - [0, 22.429]
  - - [1600, 2496, 1, 512, 1600, 1600, 1600, 2496]
    - [0, 22.482]
  - - [1728, 2496, 1, 512, 1728, 1728, 1728, 2496]
    - [0, 22.567]
  - - [1856, 2496, 1, 512, 1856, 1856, 1856, 2496]
    - [0, 22.612]
  - - [1984, 2496, 1, 512, 1984, 1984, 1984, 2496]
    - [0, 22.707]
  - - [2112, 2496, 1, 512, 2112, 2112, 2112, 2496]
    - [0, 22.782]
  - - [2240, 2496, 1, 512, 2240, 2240, 2240, 2496]
    - [0, 22.841]
  - - [2368, 2496, 1, 512, 2368, 2368, 2368, 2496]
    - [0, 22.869]
  - - [2496, 2496, 1, 512, 2496, 2496, 2496, 2496]
    - [0, 22.842]
  - - [2624, 2496, 1, 512, 2624, 2624, 2624, 2496]
    - [0, 22.937]
  - - [2752, 2496, 1, 512, 2752, 2752, 2752, 2496]
    - [0, 22.93]
  - - [2880, 2496, 1, 512, 2880, 2880, 2880, 2496]
    - [0, 22.911]
  - - [3008, 2496, 1, 512, 3008, 3008, 3008, 2496]
    - [0, 22.535]
  - - [3136, 2496, 1, 512, 3136, 3136, 3136, 2496]
    - [0, 22.597]
  - - [3264, 2496, 1, 512, 3264, 3264, 3264, 2496]
    - [0, 22.605]
  - - [3392, 2496, 1, 512, 3392, 3392, 3392, 2496]
    - [0, 22.642]
  - - [3520, 2496, 1, 512, 3520, 3520, 3520, 2496]
    - [0, 22.65]
  - - [3648, 2496, 1, 512, 3648, 3648, 3648, 2496]
    - [0, 22.679]
  - - [3776, 2496, 1, 512, 3776, 3776, 3776, 2496]
    - [0, 22.689]
  - - [3904, 2496, 1, 512, 3904, 3904, 3904, 2496]
    - [0, 22.702]
  - - [4032, 2496, 1, 512, 4032, 4032, 4032, 2496]
    - [2, 22.745]
  - - [64, 2624, 1, 512, 64, 64, 64, 2624]
    - [0, 14.507]
  - - [192, 2624, 1, 512, 192, 192, 192, 2624]
    - [0, 19.249]
  - - [320, 2624, 1, 512, 320, 320, 320, 2624]
    - [0, 20.716]
  - - [448, 2624, 1, 512, 448, 448, 448, 2624]
    - [0, 20.516]
  - - [576, 2624, 1, 512, 576, 576, 576, 2624]
    - [0, 21.165]
  - - [704, 2624, 1, 512, 704, 704, 704, 2624]
    - [0, 21.538]
  - - [832, 2624, 1, 512, 832, 832, 832, 2624]
    - [0, 21.842]
  - - [960, 2624, 1, 512, 960, 960, 960, 2624]
    - [0, 22.011]
  - - [1088, 2624, 1, 512, 1088, 1088, 1088, 2624]
    - [0, 22.185]
  - - [1216, 2624, 1, 512, 1216, 1216, 1216, 2624]
    - [0, 22.255]
  - - [1344, 2624, 1, 512, 1344, 1344, 1344, 2624]
    - [0, 22.36]
  - - [1472, 2624, 1, 512, 1472, 1472, 1472, 2624]
    - [0, 22.456]
  - - [1600, 2624, 1, 512, 1600, 1600, 1600, 2624]
    - [0, 22.583]
  - - [1728, 2624, 1, 512, 1728, 1728, 1728, 2624]
    - [0, 22.619]
  - - [1856, 2624, 1, 512, 1856, 1856, 1856, 2624]
    - [0, 22.642]
  - - [1984, 2624, 1, 512, 1984, 1984, 1984, 2624]
    - [0, 22.756]
  - - [2112, 2624, 1, 512, 2112, 2112, 2112, 2624]
    - [0, 22.835]
  - - [2240, 2624, 1, 512, 2240, 2240, 2240, 2624]
    - [0, 22.808]
  - - [2368, 2624, 1, 512, 2368, 2368, 2368, 2624]
    - [0, 22.817]
  - - [2496, 2624, 1, 512, 2496, 2496, 2496, 2624]
    - [0, 22.896]
  - - [2624, 2624, 1, 512, 2624, 2624, 2624, 2624]
    - [0, 22.938]
  - - [2752, 2624, 1, 512, 2752, 2752, 2752, 2624]
    - [0, 22.907]
  - - [2880, 2624, 1, 512, 2880, 2880, 2880, 2624]
    - [0, 22.616]
  - - [3008, 2624, 1, 512, 3008, 3008, 3008, 2624]
    - [0, 22.598]
  - - [3136, 2624, 1, 512, 3136, 3136, 3136, 2624]
    - [0, 22.676]
  - - [3264, 2624, 1, 512, 3264, 3264, 3264, 2624]
    - [0, 22.676]
  - - [3392, 2624, 1, 512, 3392, 3392, 3392, 2624]
    - [0, 22.685]
  - - [3520, 2624, 1, 512, 3520, 3520, 3520, 2624]
    - [0, 22.734]
  - - [3648, 2624, 1, 512, 3648, 3648, 3648, 2624]
    - [0, 22.744]
  - - [3776, 2624, 1, 512, 3776, 3776, 3776, 2624]
    - [0, 22.742]
  - - [3904, 2624, 1, 512, 3904, 3904, 3904, 2624]
    - [0, 22.748]
  - - [4032, 2624, 1, 512, 4032, 4032, 4032, 2624]
    - [2, 22.782]
  - - [64, 2752, 1, 512, 64, 64, 64, 2752]
    - [0, 15.159]
  - - [192, 2752, 1, 512, 192, 192, 192, 2752]
    - [0, 19.325]
  - - [320, 2752, 1, 512, 320, 320, 320, 2752]
    - [0, 20.869]
  - - [448, 2752, 1, 512, 448, 448, 448, 2752]
    - [0, 20.568]
  - - [576, 2752, 1, 512, 576, 576, 576, 2752]
    - [0, 21.29]
  - - [704, 2752, 1, 512, 704, 704, 704, 2752]
    - [0, 21.558]
  - - [832, 2752, 1, 512, 832, 832, 832, 2752]
    - [0, 21.887]
  - - [960, 2752, 1, 512, 960, 960, 960, 2752]
    - [0, 22.069]
  - - [1088, 2752, 1, 512, 1088, 1088, 1088, 2752]
    - [0, 22.215]
  - - [1216, 2752, 1, 512, 1216, 1216, 1216, 2752]
    - [0, 22.304]
  - - [1344, 2752, 1, 512, 1344, 1344, 1344, 2752]
    - [0, 22.415]
  - - [1472, 2752, 1, 512, 1472, 1472, 1472, 2752]
    - [0, 22.466]
  - - [1600, 2752, 1, 512, 1600, 1600, 1600, 2752]
    - [0, 22.668]
  - - [1728, 2752, 1, 512, 1728, 1728, 1728, 2752]
    - [0, 22.643]
  - - [1856, 2752, 1, 512, 1856, 1856, 1856, 2752]
    - [0, 22.715]
  - - [1984, 2752, 1, 512, 1984, 1984, 1984, 2752]
    - [0, 22.749]
  - - [2112, 2752, 1, 512, 2112, 2112, 2112, 2752]
    - [0, 22.831]
  - - [2240, 2752, 1, 512, 2240, 2240, 2240, 2752]
    - [0, 22.77]
  - - [2368, 2752, 1, 512, 2368, 2368, 2368, 2752]
    - [0, 22.871]
  - - [2496, 2752, 1, 512, 2496, 2496, 2496, 2752]
    - [0, 22.942]
  - - [2624, 2752, 1, 512, 2624, 2624, 2624, 2752]
    - [0, 22.919]
  - - [2752, 2752, 1, 512, 2752, 2752, 2752, 2752]
    - [0, 22.573]
  - - [2880, 2752, 1, 512, 2880, 2880, 2880, 2752]
    - [0, 22.628]
  - - [3008, 2752, 1, 512, 3008, 3008, 3008, 2752]
    - [0, 22.633]
  - - [3136, 2752, 1, 512, 3136, 3136, 3136, 2752]
    - [0, 22.705]
  - - [3264, 2752, 1, 512, 3264, 3264, 3264, 2752]
    - [0, 22.663]
  - - [3392, 2752, 1, 512, 3392, 3392, 3392, 2752]
    - [0, 22.648]
  - - [3520, 2752, 1, 512, 3520, 3520, 3520, 2752]
    - [0, 22.701]
  - - [3648, 2752, 1, 512, 3648, 3648, 3648, 2752]
    - [0, 22.791]
  - - [3776, 2752, 1, 512, 3776, 3776, 3776, 2752]
    - [0, 22.738]
  - - [3904, 2752, 1, 512, 3904, 3904, 3904, 2752]
    - [0, 22.725]
  - - [4032, 2752, 1, 512, 4032, 4032, 4032, 2752]
    - [2, 22.785]
  - - [64, 2880, 1, 512, 64, 64, 64, 2880]
    - [0, 15.768]
  - - [192, 2880, 1, 512, 192, 192, 192, 2880]
    - [0, 19.837]
  - - [320, 2880, 1, 512, 320, 320, 320, 2880]
    - [0, 20.966]
  - - [448, 2880, 1, 512, 448, 448, 448, 2880]
    - [0, 20.75]
  - - [576, 2880, 1, 512, 576, 576, 576, 2880]
    - [0, 21.334]
  - - [704, 2880, 1, 512, 704, 704, 704, 2880]
    - [0, 21.679]
  - - [832, 2880, 1, 512, 832, 832, 832, 2880]
    - [0, 21.917]
  - - [960, 2880, 1, 512, 960, 960, 960, 2880]
    - [0, 22.132]
  - - [1088, 2880, 1, 512, 1088, 1088, 1088, 2880]
    - [0, 22.209]
  - - [1216, 2880, 1, 512, 1216, 1216, 1216, 2880]
    - [0, 22.36]
  - - [1344, 2880, 1, 512, 1344, 1344, 1344, 2880]
    - [0, 22.497]
  - - [1472, 2880, 1, 512, 1472, 1472, 1472, 2880]
    - [0, 22.488]
  - - [1600, 2880, 1, 512, 1600, 1600, 1600, 2880]
    - [0, 22.65]
  - - [1728, 2880, 1, 512, 1728, 1728, 1728, 2880]
    - [0, 22.734]
  - - [1856, 2880, 1, 512, 1856, 1856, 1856, 2880]
    - [0, 22.762]
  - - [1984, 2880, 1, 512, 1984, 1984, 1984, 2880]
    - [0, 22.821]
  - - [2112, 2880, 1, 512, 2112, 2112, 2112, 2880]
    - [0, 22.903]
  - - [2240, 2880, 1, 512, 2240, 2240, 2240, 2880]
    - [0, 22.841]
  - - [2368, 2880, 1, 512, 2368, 2368, 2368, 2880]
    - [0, 22.909]
  - - [2496, 2880, 1, 512, 2496, 2496, 2496, 2880]
    - [0, 22.946]
  - - [2624, 2880, 1, 512, 2624, 2624, 2624, 2880]
    - [0, 22.638]
  - - [2752, 2880, 1, 512, 2752, 2752, 2752, 2880]
    - [0, 22.665]
  - - [2880, 2880, 1, 512, 2880, 2880, 2880, 2880]
    - [0, 22.607]
  - - [3008, 2880, 1, 512, 3008, 3008, 3008, 2880]
    - [0, 22.713]
  - - [3136, 2880, 1, 512, 3136, 3136, 3136, 2880]
    - [0, 22.641]
  - - [3264, 2880, 1, 512, 3264, 3264, 3264, 2880]
    - [0, 22.726]
  - - [3392, 2880, 1, 512, 3392, 3392, 3392, 2880]
    - [0, 22.779]
  - - [3520, 2880, 1, 512, 3520, 3520, 3520, 2880]
    - [0, 22.73]
  - - [3648, 2880, 1, 512, 3648, 3648, 3648, 2880]
    - [0, 22.804]
  - - [3776, 2880, 1, 512, 3776, 3776, 3776, 2880]
    - [0, 22.805]
  - - [3904, 2880, 1, 512, 3904, 3904, 3904, 2880]
    - [0, 22.822]
  - - [4032, 2880, 1, 512, 4032, 4032, 4032, 2880]
    - [0, 22.867]
  - - [64, 3008, 1, 512, 64, 64, 64, 3008]
    - [0, 14.996]
  - - [192, 3008, 1, 512, 192, 192, 192, 3008]
    - [0, 19.887]
  - - [320, 3008, 1, 512, 320, 320, 320, 3008]
    - [0, 19.361]
  - - [448, 3008, 1, 512, 448, 448, 448, 3008]
    - [0, 20.821]
  - - [576, 3008, 1, 512, 576, 576, 576, 3008]
    - [0, 21.423]
  - - [704, 3008, 1, 512, 704, 704, 704, 3008]
    - [0, 21.748]
  - - [832, 3008, 1, 512, 832, 832, 832, 3008]
    - [0, 21.984]
  - - [960, 3008, 1, 512, 960, 960, 960, 3008]
    - [0, 22.181]
  - - [1088, 3008, 1, 512, 1088, 1088, 1088, 3008]
    - [0, 22.306]
  - - [1216, 3008, 1, 512, 1216, 1216, 1216, 3008]
    - [0, 22.369]
  - - [1344, 3008, 1, 512, 1344, 1344, 1344, 3008]
    - [0, 22.468]
  - - [1472, 3008, 1, 512, 1472, 1472, 1472, 3008]
    - [0, 22.646]
  - - [1600, 3008, 1, 512, 1600, 1600, 1600, 3008]
    - [0, 22.645]
  - - [1728, 3008, 1, 512, 1728, 1728, 1728, 3008]
    - [0, 22.781]
  - - [1856, 3008, 1, 512, 1856, 1856, 1856, 3008]
    - [0, 22.784]
  - - [1984, 3008, 1, 512, 1984, 1984, 1984, 3008]
    - [0, 22.807]
  - - [2112, 3008, 1, 512, 2112, 2112, 2112, 3008]
    - [0, 22.932]
  - - [2240, 3008, 1, 512, 2240, 2240, 2240, 3008]
    - [0, 22.884]
  - - [2368, 3008, 1, 512, 2368, 2368, 2368, 3008]
    - [0, 22.938]
  - - [2496, 3008, 1, 512, 2496, 2496, 2496, 3008]
    - [0, 22.535]
  - - [2624, 3008, 1, 512, 2624, 2624, 2624, 3008]
    - [0, 22.638]
  - - [2752, 3008, 1, 512, 2752, 2752, 2752, 3008]
    - [0, 22.632]
  - - [2880, 3008, 1, 512, 2880, 2880, 2880, 3008]
    - [0, 22.677]
  - - [3008, 3008, 1, 512, 3008, 3008, 3008, 3008]
    - [0, 22.685]
  - - [3136, 3008, 1, 512, 3136, 3136, 3136, 3008]
    - [0, 22.658]
  - - [3264, 3008, 1, 512, 3264, 3264, 3264, 3008]
    - [0, 22.727]
  - - [3392, 3008, 1, 512, 3392, 3392, 3392, 3008]
    - [0, 22.772]
  - - [3520, 3008, 1, 512, 3520, 3520, 3520, 3008]
    - [0, 22.789]
  - - [3648, 3008, 1, 512, 3648, 3648, 3648, 3008]
    - [0, 22.798]
  - - [3776, 3008, 1, 512, 3776, 3776, 3776, 3008]
    - [0, 22.816]
  - - [3904, 3008, 1, 512, 3904, 3904, 3904, 3008]
    - [0, 22.839]
  - - [4032, 3008, 1, 512, 4032, 4032, 4032, 3008]
    - [2, 22.898]
  - - [64, 3136, 1, 512, 64, 64, 64, 3136]
    - [0, 15.529]
  - - [192, 3136, 1, 512, 192, 192, 192, 3136]
    - [0, 19.84]
  - - [320, 3136, 1, 512, 320, 320, 320, 3136]
    - [0, 20.135]
  - - [448, 3136, 1, 512, 448, 448, 448, 3136]
    - [0, 20.994]
  - - [576, 3136, 1, 512, 576, 576, 576, 3136]
    - [0, 21.503]
  - - [704, 3136, 1, 512, 704, 704, 704, 3136]
    - [0, 21.785]
  - - [832, 3136, 1, 512, 832, 832, 832, 3136]
    - [0, 22.055]
  - - [960, 3136, 1, 512, 960, 960, 960, 3136]
    - [0, 22.251]
  - - [1088, 3136, 1, 512, 1088, 1088, 1088, 3136]
    - [0, 22.341]
  - - [1216, 3136, 1, 512, 1216, 1216, 1216, 3136]
    - [0, 22.471]
  - - [1344, 3136, 1, 512, 1344, 1344, 1344, 3136]
    - [0, 22.498]
  - - [1472, 3136, 1, 512, 1472, 1472, 1472, 3136]
    - [0, 22.587]
  - - [1600, 3136, 1, 512, 1600, 1600, 1600, 3136]
    - [0, 22.667]
  - - [1728, 3136, 1, 512, 1728, 1728, 1728, 3136]
    - [0, 22.815]
  - - [1856, 3136, 1, 512, 1856, 1856, 1856, 3136]
    - [0, 22.771]
  - - [1984, 3136, 1, 512, 1984, 1984, 1984, 3136]
    - [0, 22.862]
  - - [2112, 3136, 1, 512, 2112, 2112, 2112, 3136]
    - [0, 22.918]
  - - [2240, 3136, 1, 512, 2240, 2240, 2240, 3136]
    - [0, 22.921]
  - - [2368, 3136, 1, 512, 2368, 2368, 2368, 3136]
    - [0, 22.927]
  - - [2496, 3136, 1, 512, 2496, 2496, 2496, 3136]
    - [0, 22.592]
  - - [2624, 3136, 1, 512, 2624, 2624, 2624, 3136]
    - [0, 22.635]
  - - [2752, 3136, 1, 512, 2752, 2752, 2752, 3136]
    - [0, 22.638]
  - - [2880, 3136, 1, 512, 2880, 2880, 2880, 3136]
    - [0, 22.678]
  - - [3008, 3136, 1, 512, 3008, 3008, 3008, 3136]
    - [0, 22.788]
  - - [3136, 3136, 1, 512, 3136, 3136, 3136, 3136]
    - [0, 22.708]
  - - [3264, 3136, 1, 512, 3264, 3264, 3264, 3136]
    - [0, 22.775]
  - - [3392, 3136, 1, 512, 3392, 3392, 3392, 3136]
    - [0, 22.793]
  - - [3520, 3136, 1, 512, 3520, 3520, 3520, 3136]
    - [0, 22.769]
  - - [3648, 3136, 1, 512, 3648, 3648, 3648, 3136]
    - [0, 22.887]
  - - [3776, 3136, 1, 512, 3776, 3776, 3776, 3136]
    - [0, 22.888]
  - - [3904, 3136, 1, 512, 3904, 3904, 3904, 3136]
    - [0, 22.884]
  - - [4032, 3136, 1, 512, 4032, 4032, 4032, 3136]
    - [0, 22.892]
  - - [64, 3264, 1, 512, 64, 64, 64, 3264]
    - [0, 16.132]
  - - [192, 3264, 1, 512, 192, 192, 192, 3264]
    - [0, 19.856]
  - - [320, 3264, 1, 512, 320, 320, 320, 3264]
    - [0, 20.252]
  - - [448, 3264, 1, 512, 448, 448, 448, 3264]
    - [0, 21.063]
  - - [576, 3264, 1, 512, 576, 576, 576, 3264]
    - [0, 21.512]
  - - [704, 3264, 1, 512, 704, 704, 704, 3264]
    - [0, 21.881]
  - - [832, 3264, 1, 512, 832, 832, 832, 3264]
    - [0, 22.07]
  - - [960, 3264, 1, 512, 960, 960, 960, 3264]
    - [0, 22.293]
  - - [1088, 3264, 1, 512, 1088, 1088, 1088, 3264]
    - [0, 22.364]
  - - [1216, 3264, 1, 512, 1216, 1216, 1216, 3264]
    - [0, 22.521]
  - - [1344, 3264, 1, 512, 1344, 1344, 1344, 3264]
    - [0, 22.533]
  - - [1472, 3264, 1, 512, 1472, 1472, 1472, 3264]
    - [0, 22.641]
  - - [1600, 3264, 1, 512, 1600, 1600, 1600, 3264]
    - [0, 22.703]
  - - [1728, 3264, 1, 512, 1728, 1728, 1728, 3264]
    - [0, 22.757]
  - - [1856, 3264, 1, 512, 1856, 1856, 1856, 3264]
    - [0, 22.855]
  - - [1984, 3264, 1, 512, 1984, 1984, 1984, 3264]
    - [2, 22.842]
  - - [2112, 3264, 1, 512, 2112, 2112, 2112, 3264]
    - [0, 22.949]
  - - [2240, 3264, 1, 512, 2240, 2240, 2240, 3264]
    - [0, 22.96]
  - - [2368, 3264, 1, 512, 2368, 2368, 2368, 3264]
    - [0, 22.586]
  - - [2496, 3264, 1, 512, 2496, 2496, 2496, 3264]
    - [0, 22.635]
  - - [2624, 3264, 1, 512, 2624, 2624, 2624, 3264]
    - [0, 22.635]
  - - [2752, 3264, 1, 512, 2752, 2752, 2752, 3264]
    - [0, 22.647]
  - - [2880, 3264, 1, 512, 2880, 2880, 2880, 3264]
    - [0, 22.717]
  - - [3008, 3264, 1, 512, 3008, 3008, 3008, 3264]
    - [0, 22.759]
  - - [3136, 3264, 1, 512, 3136, 3136, 3136, 3264]
    - [0, 22.746]
  - - [3264, 3264, 1, 512, 3264, 3264, 3264, 3264]
    - [0, 22.813]
  - - [3392, 3264, 1, 512, 3392, 3392, 3392, 3264]
    - [0, 22.842]
  - - [3520, 3264, 1, 512, 3520, 3520, 3520, 3264]
    - [0, 22.862]
  - - [3648, 3264, 1, 512, 3648, 3648, 3648, 3264]
    - [0, 22.817]
  - - [3776, 3264, 1, 512, 3776, 3776, 3776, 3264]
    - [0, 22.866]
  - - [3904, 3264, 1, 512, 3904, 3904, 3904, 3264]
    - [0, 22.939]
  - - [4032, 3264, 1, 512, 4032, 4032, 4032, 3264]
    - [0, 22.91]
  - - [64, 3392, 1, 512, 64, 64, 64, 3392]
    - [0, 15.406]
  - - [192, 3392, 1, 512, 192, 192, 192, 3392]
    - [0, 19.996]
  - - [320, 3392, 1, 512, 320, 320, 320, 3392]
    - [0, 20.312]
  - - [448, 3392, 1, 512, 448, 448, 448, 3392]
    - [0, 21.086]
  - - [576, 3392, 1, 512, 576, 576, 576, 3392]
    - [0, 21.529]
  - - [704, 3392, 1, 512, 704, 704, 704, 3392]
    - [0, 21.882]
  - - [832, 3392, 1, 512, 832, 832, 832, 3392]
    - [0, 22.139]
  - - [960, 3392, 1, 512, 960, 960, 960, 3392]
    - [0, 22.303]
  - - [1088, 3392, 1, 512, 1088, 1088, 1088, 3392]
    - [0, 22.399]
  - - [1216, 3392, 1, 512, 1216, 1216, 1216, 3392]
    - [0, 22.537]
  - - [1344, 3392, 1, 512, 1344, 1344, 1344, 3392]
    - [0, 22.61]
  - - [1472, 3392, 1, 512, 1472, 1472, 1472, 3392]
    - [0, 22.676]
  - - [1600, 3392, 1, 512, 1600, 1600, 1600, 3392]
    - [0, 22.772]
  - - [1728, 3392, 1, 512, 1728, 1728, 1728, 3392]
    - [0, 22.786]
  - - [1856, 3392, 1, 512, 1856, 1856, 1856, 3392]
    - [0, 22.819]
  - - [1984, 3392, 1, 512, 1984, 1984, 1984, 3392]
    - [0, 22.949]
  - - [2112, 3392, 1, 512, 2112, 2112, 2112, 3392]
    - [0, 22.966]
  - - [2240, 3392, 1, 512, 2240, 2240, 2240, 3392]
    - [0, 22.61]
  - - [2368, 3392, 1, 512, 2368, 2368, 2368, 3392]
    - [0, 22.552]
  - - [2496, 3392, 1, 512, 2496, 2496, 2496, 3392]
    - [0, 22.59]
  - - [2624, 3392, 1, 512, 2624, 2624, 2624, 3392]
    - [0, 22.702]
  - - [2752, 3392, 1, 512, 2752, 2752, 2752, 3392]
    - [0, 22.657]
  - - [2880, 3392, 1, 512, 2880, 2880, 2880, 3392]
    - [0, 22.76]
  - - [3008, 3392, 1, 512, 3008, 3008, 3008, 3392]
    - [0, 22.784]
  - - [3136, 3392, 1, 512, 3136, 3136, 3136, 3392]
    - [0, 22.759]
  - - [3264, 3392, 1, 512, 3264, 3264, 3264, 3392]
    - [0, 22.837]
  - - [3392, 3392, 1, 512, 3392, 3392, 3392, 3392]
    - [0, 22.805]
  - - [3520, 3392, 1, 512, 3520, 3520, 3520, 3392]
    - [0, 22.861]
  - - [3648, 3392, 1, 512, 3648, 3648, 3648, 3392]
    - [0, 22.893]
  - - [3776, 3392, 1, 512, 3776, 3776, 3776, 3392]
    - [0, 22.859]
  - - [3904, 3392, 1, 512, 3904, 3904, 3904, 3392]
    - [0, 22.935]
  - - [4032, 3392, 1, 512, 4032, 4032, 4032, 3392]
    - [0, 22.971]
  - - [64, 3520, 1, 512, 64, 64, 64, 3520]
    - [0, 15.882]
  - - [192, 3520, 1, 512, 192, 192, 192, 3520]
    - [0, 20.363]
  - - [320, 3520, 1, 512, 320, 320, 320, 3520]
    - [0, 20.442]
  - - [448, 3520, 1, 512, 448, 448, 448, 3520]
    - [0, 21.195]
  - - [576, 3520, 1, 512, 576, 576, 576, 3520]
    - [0, 21.659]
  - - [704, 3520, 1, 512, 704, 704, 704, 3520]
    - [0, 21.951]
  - - [832, 3520, 1, 512, 832, 832, 832, 3520]
    - [0, 22.121]
  - - [960, 3520, 1, 512, 960, 960, 960, 3520]
    - [0, 22.298]
  - - [1088, 3520, 1, 512, 1088, 1088, 1088, 3520]
    - [0, 22.446]
  - - [1216, 3520, 1, 512, 1216, 1216, 1216, 3520]
    - [0, 22.508]
  - - [1344, 3520, 1, 512, 1344, 1344, 1344, 3520]
    - [0, 22.677]
  - - [1472, 3520, 1, 512, 1472, 1472, 1472, 3520]
    - [0, 22.675]
  - - [1600, 3520, 1, 512, 1600, 1600, 1600, 3520]
    - [0, 22.756]
  - - [1728, 3520, 1, 512, 1728, 1728, 1728, 3520]
    - [0, 22.847]
  - - [1856, 3520, 1, 512, 1856, 1856, 1856, 3520]
    - [0, 22.876]
  - - [1984, 3520, 1, 512, 1984, 1984, 1984, 3520]
    - [0, 22.928]
  - - [2112, 3520, 1, 512, 2112, 2112, 2112, 3520]
    - [0, 22.83]
  - - [2240, 3520, 1, 512, 2240, 2240, 2240, 3520]
    - [0, 22.593]
  - - [2368, 3520, 1, 512, 2368, 2368, 2368, 3520]
    - [0, 22.665]
  - - [2496, 3520, 1, 512, 2496, 2496, 2496, 3520]
    - [0, 22.672]
  - - [2624, 3520, 1, 512, 2624, 2624, 2624, 3520]
    - [0, 22.709]
  - - [2752, 3520, 1, 512, 2752, 2752, 2752, 3520]
    - [0, 22.761]
  - - [2880, 3520, 1, 512, 2880, 2880, 2880, 3520]
    - [0, 22.764]
  - - [3008, 3520, 1, 512, 3008, 3008, 3008, 3520]
    - [0, 22.752]
  - - [3136, 3520, 1, 512, 3136, 3136, 3136, 3520]
    - [0, 22.79]
  - - [3264, 3520, 1, 512, 3264, 3264, 3264, 3520]
    - [0, 22.824]
  - - [3392, 3520, 1, 512, 3392, 3392, 3392, 3520]
    - [0, 22.873]
  - - [3520, 3520, 1, 512, 3520, 3520, 3520, 3520]
    - [0, 22.905]
  - - [3648, 3520, 1, 512, 3648, 3648, 3648, 3520]
    - [0, 22.937]
  - - [3776, 3520, 1, 512, 3776, 3776, 3776, 3520]
    - [0, 22.94]
  - - [3904, 3520, 1, 512, 3904, 3904, 3904, 3520]
    - [0, 22.998]
  - - [4032, 3520, 1, 512, 4032, 4032, 4032, 3520]
    - [0, 22.976]
  - - [64, 3648, 1, 512, 64, 64, 64, 3648]
    - [0, 16.454]
  - - [192, 3648, 1, 512, 192, 192, 192, 3648]
    - [0, 20.324]
  - - [320, 3648, 1, 512, 320, 320, 320, 3648]
    - [0, 20.504]
  - - [448, 3648, 1, 512, 448, 448, 448, 3648]
    - [0, 21.229]
  - - [576, 3648, 1, 512, 576, 576, 576, 3648]
    - [0, 21.729]
  - - [704, 3648, 1, 512, 704, 704, 704, 3648]
    - [0, 22.036]
  - - [832, 3648, 1, 512, 832, 832, 832, 3648]
    - [0, 22.177]
  - - [960, 3648, 1, 512, 960, 960, 960, 3648]
    - [0, 22.376]
  - - [1088, 3648, 1, 512, 1088, 1088, 1088, 3648]
    - [0, 22.481]
  - - [1216, 3648, 1, 512, 1216, 1216, 1216, 3648]
    - [0, 22.643]
  - - [1344, 3648, 1, 512, 1344, 1344, 1344, 3648]
    - [0, 22.673]
  - - [1472, 3648, 1, 512, 1472, 1472, 1472, 3648]
    - [0, 22.666]
  - - [1600, 3648, 1, 512, 1600, 1600, 1600, 3648]
    - [0, 22.812]
  - - [1728, 3648, 1, 512, 1728, 1728, 1728, 3648]
    - [0, 22.853]
  - - [1856, 3648, 1, 512, 1856, 1856, 1856, 3648]
    - [0, 22.884]
  - - [1984, 3648, 1, 512, 1984, 1984, 1984, 3648]
    - [0, 22.983]
  - - [2112, 3648, 1, 512, 2112, 2112, 2112, 3648]
    - [0, 22.642]
  - - [2240, 3648, 1, 512, 2240, 2240, 2240, 3648]
    - [0, 22.617]
  - - [2368, 3648, 1, 512, 2368, 2368, 2368, 3648]
    - [0, 22.657]
  - - [2496, 3648, 1, 512, 2496, 2496, 2496, 3648]
    - [0, 22.728]
  - - [2624, 3648, 1, 512, 2624, 2624, 2624, 3648]
    - [0, 22.751]
  - - [2752, 3648, 1, 512, 2752, 2752, 2752, 3648]
    - [0, 22.787]
  - - [2880, 3648, 1, 512, 2880, 2880, 2880, 3648]
    - [0, 22.832]
  - - [3008, 3648, 1, 512, 3008, 3008, 3008, 3648]
    - [0, 22.875]
  - - [3136, 3648, 1, 512, 3136, 3136, 3136, 3648]
    - [0, 22.778]
  - - [3264, 3648, 1, 512, 3264, 3264, 3264, 3648]
    - [0, 22.92]
  - - [3392, 3648, 1, 512, 3392, 3392, 3392, 3648]
    - [0, 22.894]
  - - [3520, 3648, 1, 512, 3520, 3520, 3520, 3648]
    - [0, 22.927]
  - - [3648, 3648, 1, 512, 3648, 3648, 3648, 3648]
    - [0, 22.903]
  - - [3776, 3648, 1, 512, 3776, 3776, 3776, 3648]
    - [0, 23.005]
  - - [3904, 3648, 1, 512, 3904, 3904, 3904, 3648]
    - [0, 22.923]
  - - [4032, 3648, 1, 512, 4032, 4032, 4032, 3648]
    - [0, 22.982]
  - - [64, 3776, 1, 512, 64, 64, 64, 3776]
    - [0, 16.943]
  - - [192, 3776, 1, 512, 192, 192, 192, 3776]
    - [0, 20.401]
  - - [320, 3776, 1, 512, 320, 320, 320, 3776]
    - [0, 20.61]
  - - [448, 3776, 1, 512, 448, 448, 448, 3776]
    - [0, 21.338]
  - - [576, 3776, 1, 512, 576, 576, 576, 3776]
    - [0, 21.755]
  - - [704, 3776, 1, 512, 704, 704, 704, 3776]
    - [0, 22.052]
  - - [832, 3776, 1, 512, 832, 832, 832, 3776]
    - [0, 22.325]
  - - [960, 3776, 1, 512, 960, 960, 960, 3776]
    - [0, 22.441]
  - - [1088, 3776, 1, 512, 1088, 1088, 1088, 3776]
    - [0, 22.504]
  - - [1216, 3776, 1, 512, 1216, 1216, 1216, 3776]
    - [0, 22.626]
  - - [1344, 3776, 1, 512, 1344, 1344, 1344, 3776]
    - [0, 22.705]
  - - [1472, 3776, 1, 512, 1472, 1472, 1472, 3776]
    - [0, 22.714]
  - - [1600, 3776, 1, 512, 1600, 1600, 1600, 3776]
    - [0, 22.827]
  - - [1728, 3776, 1, 512, 1728, 1728, 1728, 3776]
    - [0, 22.882]
  - - [1856, 3776, 1, 512, 1856, 1856, 1856, 3776]
    - [0, 22.911]
  - - [1984, 3776, 1, 512, 1984, 1984, 1984, 3776]
    - [0, 22.488]
  - - [2112, 3776, 1, 512, 2112, 2112, 2112, 3776]
    - [0, 22.589]
  - - [2240, 3776, 1, 512, 2240, 2240, 2240, 3776]
    - [0, 22.675]
  - - [2368, 3776, 1, 512, 2368, 2368, 2368, 3776]
    - [0, 22.718]
  - - [2496, 3776, 1, 512, 2496, 2496, 2496, 3776]
    - [0, 22.694]
  - - [2624, 3776, 1, 512, 2624, 2624, 2624, 3776]
    - [0, 22.744]
  - - [2752, 3776, 1, 512, 2752, 2752, 2752, 3776]
    - [0, 22.747]
  - - [2880, 3776, 1, 512, 2880, 2880, 2880, 3776]
    - [0, 22.826]
  - - [3008, 3776, 1, 512, 3008, 3008, 3008, 3776]
    - [0, 22.844]
  - - [3136, 3776, 1, 512, 3136, 3136, 3136, 3776]
    - [0, 22.855]
  - - [3264, 3776, 1, 512, 3264, 3264, 3264, 3776]
    - [0, 22.889]
  - - [3392, 3776, 1, 512, 3392, 3392, 3392, 3776]
    - [0, 22.879]
  - - [3520, 3776, 1, 512, 3520, 3520, 3520, 3776]
    - [0, 22.923]
  - - [3648, 3776, 1, 512, 3648, 3648, 3648, 3776]
    - [0, 22.948]
  - - [3776, 3776, 1, 512, 3776, 3776, 3776, 3776]
    - [0, 22.987]
  - - [3904, 3776, 1, 512, 3904, 3904, 3904, 3776]
    - [0, 22.974]
  - - [4032, 3776, 1, 512, 4032, 4032, 4032, 3776]
    - [0, 22.977]
  - - [64, 3904, 1, 512, 64, 64, 64, 3904]
    - [0, 16.234]
  - - [192, 3904, 1, 512, 192, 192, 192, 3904]
    - [0, 20.344]
  - - [320, 3904, 1, 512, 320, 320, 320, 3904]
    - [0, 20.635]
  - - [448, 3904, 1, 512, 448, 448, 448, 3904]
    - [0, 21.331]
  - - [576, 3904, 1, 512, 576, 576, 576, 3904]
    - [0, 21.829]
  - - [704, 3904, 1, 512, 704, 704, 704, 3904]
    - [0, 22.077]
  - - [832, 3904, 1, 512, 832, 832, 832, 3904]
    - [0, 22.261]
  - - [960, 3904, 1, 512, 960, 960, 960, 3904]
    - [0, 22.438]
  - - [1088, 3904, 1, 512, 1088, 1088, 1088, 3904]
    - [0, 22.499]
  - - [1216, 3904, 1, 512, 1216, 1216, 1216, 3904]
    - [0, 22.63]
  - - [1344, 3904, 1, 512, 1344, 1344, 1344, 3904]
    - [0, 22.746]
  - - [1472, 3904, 1, 512, 1472, 1472, 1472, 3904]
    - [0, 22.755]
  - - [1600, 3904, 1, 512, 1600, 1600, 1600, 3904]
    - [0, 22.869]
  - - [1728, 3904, 1, 512, 1728, 1728, 1728, 3904]
    - [0, 22.814]
  - - [1856, 3904, 1, 512, 1856, 1856, 1856, 3904]
    - [0, 22.957]
  - - [1984, 3904, 1, 512, 1984, 1984, 1984, 3904]
    - [2, 22.534]
  - - [2112, 3904, 1, 512, 2112, 2112, 2112, 3904]
    - [0, 22.687]
  - - [2240, 3904, 1, 512, 2240, 2240, 2240, 3904]
    - [0, 22.651]
  - - [2368, 3904, 1, 512, 2368, 2368, 2368, 3904]
    - [0, 22.682]
  - - [2496, 3904, 1, 512, 2496, 2496, 2496, 3904]
    - [0, 22.702]
  - - [2624, 3904, 1, 512, 2624, 2624, 2624, 3904]
    - [0, 22.778]
  - - [2752, 3904, 1, 512, 2752, 2752, 2752, 3904]
    - [0, 22.829]
  - - [2880, 3904, 1, 512, 2880, 2880, 2880, 3904]
    - [0, 22.833]
  - - [3008, 3904, 1, 512, 3008, 3008, 3008, 3904]
    - [0, 22.874]
  - - [3136, 3904, 1, 512, 3136, 3136, 3136, 3904]
    - [0, 22.846]
  - - [3264, 3904, 1, 512, 3264, 3264, 3264, 3904]
    - [0, 22.904]
  - - [3392, 3904, 1, 512, 3392, 3392, 3392, 3904]
    - [0, 22.869]
  - - [3520, 3904, 1, 512, 3520, 3520, 3520, 3904]
    - [0, 22.958]
  - - [3648, 3904, 1, 512, 3648, 3648, 3648, 3904]
    - [0, 23.003]
  - - [3776, 3904, 1, 512, 3776, 3776, 3776, 3904]
    - [0, 22.926]
  - - [3904, 3904, 1, 512, 3904, 3904, 3904, 3904]
    - [0, 23.016]
  - - [4032, 3904, 1, 512, 4032, 4032, 4032, 3904]
    - [2, 23.005]
  - - [64, 4032, 1, 512, 64, 64, 64, 4032]
    - [0, 16.655]
  - - [192, 4032, 1, 512, 192, 192, 192, 4032]
    - [0, 20.519]
  - - [320, 4032, 1, 512, 320, 320, 320, 4032]
    - [0, 20.742]
  - - [448, 4032, 1, 512, 448, 448, 448, 4032]
    - [0, 21.424]
  - - [576, 4032, 1, 512, 576, 576, 576, 4032]
    - [0, 21.861]
  - - [704, 4032, 1, 512, 704, 704, 704, 4032]
    - [0, 22.09]
  - - [832, 4032, 1, 512, 832, 832, 832, 4032]
    - [0, 22.321]
  - - [960, 4032, 1, 512, 960, 960, 960, 4032]
    - [0, 22.45]
  - - [1088, 4032, 1, 512, 1088, 1088, 1088, 4032]
    - [2, 22.517]
  - - [1216, 4032, 1, 512, 1216, 1216, 1216, 4032]
    - [2, 22.655]
  - - [1344, 4032, 1, 512, 1344, 1344, 1344, 4032]
    - [0, 22.773]
  - - [1472, 4032, 1, 512, 1472, 1472, 1472, 4032]
    - [0, 22.799]
  - - [1600, 4032, 1, 512, 1600, 1600, 1600, 4032]
    - [2, 22.803]
  - - [1728, 4032, 1, 512, 1728, 1728, 1728, 4032]
    - [2, 22.876]
  - - [1856, 4032, 1, 512, 1856, 1856, 1856, 4032]
    - [2, 22.514]
  - - [1984, 4032, 1, 512, 1984, 1984, 1984, 4032]
    - [0, 22.591]
  - - [2112, 4032, 1, 512, 2112, 2112, 2112, 4032]
    - [0, 22.65]
  - - [2240, 4032, 1, 512, 2240, 2240, 2240, 4032]
    - [0, 22.737]
  - - [2368, 4032, 1, 512, 2368, 2368, 2368, 4032]
    - [0, 22.737]
  - - [2496, 4032, 1, 512, 2496, 2496, 2496, 4032]
    - [0, 22.758]
  - - [2624, 4032, 1, 512, 2624, 2624, 2624, 4032]
    - [0, 22.79]
  - - [2752, 4032, 1, 512, 2752, 2752, 2752, 4032]
    - [0, 22.809]
  - - [2880, 4032, 1, 512, 2880, 2880, 2880, 4032]
    - [0, 22.91]
  - - [3008, 4032, 1, 512, 3008, 3008, 3008, 4032]
    - [2, 22.87]
  - - [3136, 4032, 1, 512, 3136, 3136, 3136, 4032]
    - [2, 22.902]
  - - [3264, 4032, 1, 512, 3264, 3264, 3264, 4032]
    - [0, 22.932]
  - - [3392, 4032, 1, 512, 3392, 3392, 3392, 4032]
    - [2, 22.94]
  - - [3520, 4032, 1, 512, 3520, 3520, 3520, 4032]
    - [2, 22.936]
  - - [3648, 4032, 1, 512, 3648, 3648, 3648, 4032]
    - [0, 22.951]
  - - [3776, 4032, 1, 512, 3776, 3776, 3776, 4032]
    - [0, 23.019]
  - - [3904, 4032, 1, 512, 3904, 3904, 3904, 4032]
    - [0, 23.03]
  - - [4032, 4032, 1, 512, 4032, 4032, 4032, 4032]
    - [0, 23.031]
  - - [64, 64, 1, 1024, 64, 64, 64, 64]
    - [2, 1.328]
  - - [192, 64, 1, 1024, 192, 192, 192, 64]
    - [2, 3.942]
  - - [320, 64, 1, 1024, 320, 320, 320, 64]
    - [2, 6.188]
  - - [448, 64, 1, 1024, 448, 448, 448, 64]
    - [0, 8.52]
  - - [576, 64, 1, 1024, 576, 576, 576, 64]
    - [1, 8.523]
  - - [704, 64, 1, 1024, 704, 704, 704, 64]
    - [2, 10.31]
  - - [832, 64, 1, 1024, 832, 832, 832, 64]
    - [0, 11.473]
  - - [960, 64, 1, 1024, 960, 960, 960, 64]
    - [0, 13.219]
  - - [1088, 64, 1, 1024, 1088, 1088, 1088, 64]
    - [2, 11.911]
  - - [1216, 64, 1, 1024, 1216, 1216, 1216, 64]
    - [0, 13.067]
  - - [1344, 64, 1, 1024, 1344, 1344, 1344, 64]
    - [0, 14.416]
  - - [1472, 64, 1, 1024, 1472, 1472, 1472, 64]
    - [2, 13.096]
  - - [1600, 64, 1, 1024, 1600, 1600, 1600, 64]
    - [0, 14.114]
  - - [1728, 64, 1, 1024, 1728, 1728, 1728, 64]
    - [0, 15.211]
  - - [1856, 64, 1, 1024, 1856, 1856, 1856, 64]
    - [0, 16.319]
  - - [1984, 64, 1, 1024, 1984, 1984, 1984, 64]
    - [0, 14.886]
  - - [2112, 64, 1, 1024, 2112, 2112, 2112, 64]
    - [0, 15.832]
  - - [2240, 64, 1, 1024, 2240, 2240, 2240, 64]
    - [0, 16.843]
  - - [2368, 64, 1, 1024, 2368, 2368, 2368, 64]
    - [0, 17.787]
  - - [2496, 64, 1, 1024, 2496, 2496, 2496, 64]
    - [2, 16.773]
  - - [2624, 64, 1, 1024, 2624, 2624, 2624, 64]
    - [0, 16.879]
  - - [2752, 64, 1, 1024, 2752, 2752, 2752, 64]
    - [0, 17.686]
  - - [2880, 64, 1, 1024, 2880, 2880, 2880, 64]
    - [0, 18.394]
  - - [3008, 64, 1, 1024, 3008, 3008, 3008, 64]
    - [0, 17.226]
  - - [3136, 64, 1, 1024, 3136, 3136, 3136, 64]
    - [0, 17.932]
  - - [3264, 64, 1, 1024, 3264, 3264, 3264, 64]
    - [0, 18.643]
  - - [3392, 64, 1, 1024, 3392, 3392, 3392, 64]
    - [2, 17.637]
  - - [3520, 64, 1, 1024, 3520, 3520, 3520, 64]
    - [0, 18.131]
  - - [3648, 64, 1, 1024, 3648, 3648, 3648, 64]
    - [0, 18.598]
  - - [3776, 64, 1, 1024, 3776, 3776, 3776, 64]
    - [0, 19.255]
  - - [3904, 64, 1, 1024, 3904, 3904, 3904, 64]
    - [2, 18.342]
  - - [4032, 64, 1, 1024, 4032, 4032, 4032, 64]
    - [0, 18.713]
  - - [64, 192, 1, 1024, 64, 64, 64, 192]
    - [2, 3.968]
  - - [192, 192, 1, 1024, 192, 192, 192, 192]
    - [2, 8.672]
  - - [320, 192, 1, 1024, 320, 320, 320, 192]
    - [0, 13.229]
  - - [448, 192, 1, 1024, 448, 448, 448, 192]
    - [0, 14.538]
  - - [576, 192, 1, 1024, 576, 576, 576, 192]
    - [0, 15.324]
  - - [704, 192, 1, 1024, 704, 704, 704, 192]
    - [0, 15.872]
  - - [832, 192, 1, 1024, 832, 832, 832, 192]
    - [2, 16.819]
  - - [960, 192, 1, 1024, 960, 960, 960, 192]
    - [0, 18.63]
  - - [1088, 192, 1, 1024, 1088, 1088, 1088, 192]
    - [0, 18.658]
  - - [1216, 192, 1, 1024, 1216, 1216, 1216, 192]
    - [0, 18.745]
  - - [1344, 192, 1, 1024, 1344, 1344, 1344, 192]
    - [0, 18.83]
  - - [1472, 192, 1, 1024, 1472, 1472, 1472, 192]
    - [0, 18.882]
  - - [1600, 192, 1, 1024, 1600, 1600, 1600, 192]
    - [0, 20.226]
  - - [1728, 192, 1, 1024, 1728, 1728, 1728, 192]
    - [0, 20.175]
  - - [1856, 192, 1, 1024, 1856, 1856, 1856, 192]
    - [0, 20.125]
  - - [1984, 192, 1, 1024, 1984, 1984, 1984, 192]
    - [0, 20.064]
  - - [2112, 192, 1, 1024, 2112, 2112, 2112, 192]
    - [0, 20.124]
  - - [2240, 192, 1, 1024, 2240, 2240, 2240, 192]
    - [0, 21.017]
  - - [2368, 192, 1, 1024, 2368, 2368, 2368, 192]
    - [0, 21.039]
  - - [2496, 192, 1, 1024, 2496, 2496, 2496, 192]
    - [0, 19.289]
  - - [2624, 192, 1, 1024, 2624, 2624, 2624, 192]
    - [0, 19.893]
  - - [2752, 192, 1, 1024, 2752, 2752, 2752, 192]
    - [0, 19.878]
  - - [2880, 192, 1, 1024, 2880, 2880, 2880, 192]
    - [0, 20.548]
  - - [3008, 192, 1, 1024, 3008, 3008, 3008, 192]
    - [0, 20.508]
  - - [3136, 192, 1, 1024, 3136, 3136, 3136, 192]
    - [0, 20.547]
  - - [3264, 192, 1, 1024, 3264, 3264, 3264, 192]
    - [0, 20.412]
  - - [3392, 192, 1, 1024, 3392, 3392, 3392, 192]
    - [0, 20.538]
  - - [3520, 192, 1, 1024, 3520, 3520, 3520, 192]
    - [0, 20.945]
  - - [3648, 192, 1, 1024, 3648, 3648, 3648, 192]
    - [0, 20.999]
  - - [3776, 192, 1, 1024, 3776, 3776, 3776, 192]
    - [0, 21.062]
  - - [3904, 192, 1, 1024, 3904, 3904, 3904, 192]
    - [0, 20.998]
  - - [4032, 192, 1, 1024, 4032, 4032, 4032, 192]
    - [0, 20.987]
  - - [64, 320, 1, 1024, 64, 64, 64, 320]
    - [0, 6.158]
  - - [192, 320, 1, 1024, 192, 192, 192, 320]
    - [0, 13.217]
  - - [320, 320, 1, 1024, 320, 320, 320, 320]
    - [0, 14.208]
  - - [448, 320, 1, 1024, 448, 448, 448, 320]
    - [0, 16.7]
  - - [576, 320, 1, 1024, 576, 576, 576, 320]
    - [0, 18.492]
  - - [704, 320, 1, 1024, 704, 704, 704, 320]
    - [0, 18.185]
  - - [832, 320, 1, 1024, 832, 832, 832, 320]
    - [0, 19.291]
  - - [960, 320, 1, 1024, 960, 960, 960, 320]
    - [0, 20.3]
  - - [1088, 320, 1, 1024, 1088, 1088, 1088, 320]
    - [0, 19.697]
  - - [1216, 320, 1, 1024, 1216, 1216, 1216, 320]
    - [0, 20.441]
  - - [1344, 320, 1, 1024, 1344, 1344, 1344, 320]
    - [0, 20.977]
  - - [1472, 320, 1, 1024, 1472, 1472, 1472, 320]
    - [0, 18.959]
  - - [1600, 320, 1, 1024, 1600, 1600, 1600, 320]
    - [0, 20.1]
  - - [1728, 320, 1, 1024, 1728, 1728, 1728, 320]
    - [0, 20.484]
  - - [1856, 320, 1, 1024, 1856, 1856, 1856, 320]
    - [0, 20.339]
  - - [1984, 320, 1, 1024, 1984, 1984, 1984, 320]
    - [0, 20.696]
  - - [2112, 320, 1, 1024, 2112, 2112, 2112, 320]
    - [0, 21.024]
  - - [2240, 320, 1, 1024, 2240, 2240, 2240, 320]
    - [0, 20.856]
  - - [2368, 320, 1, 1024, 2368, 2368, 2368, 320]
    - [0, 21.079]
  - - [2496, 320, 1, 1024, 2496, 2496, 2496, 320]
    - [0, 21.234]
  - - [2624, 320, 1, 1024, 2624, 2624, 2624, 320]
    - [0, 21.157]
  - - [2752, 320, 1, 1024, 2752, 2752, 2752, 320]
    - [0, 21.429]
  - - [2880, 320, 1, 1024, 2880, 2880, 2880, 320]
    - [0, 21.552]
  - - [3008, 320, 1, 1024, 3008, 3008, 3008, 320]
    - [0, 21.482]
  - - [3136, 320, 1, 1024, 3136, 3136, 3136, 320]
    - [0, 21.676]
  - - [3264, 320, 1, 1024, 3264, 3264, 3264, 320]
    - [0, 21.715]
  - - [3392, 320, 1, 1024, 3392, 3392, 3392, 320]
    - [0, 21.686]
  - - [3520, 320, 1, 1024, 3520, 3520, 3520, 320]
    - [0, 21.926]
  - - [3648, 320, 1, 1024, 3648, 3648, 3648, 320]
    - [0, 21.934]
  - - [3776, 320, 1, 1024, 3776, 3776, 3776, 320]
    - [0, 21.948]
  - - [3904, 320, 1, 1024, 3904, 3904, 3904, 320]
    - [0, 22.013]
  - - [4032, 320, 1, 1024, 4032, 4032, 4032, 320]
    - [0, 22.023]
  - - [64, 448, 1, 1024, 64, 64, 64, 448]
    - [0, 8.594]
  - - [192, 448, 1, 1024, 192, 192, 192, 448]
    - [0, 14.532]
  - - [320, 448, 1, 1024, 320, 320, 320, 448]
    - [0, 16.702]
  - - [448, 448, 1, 1024, 448, 448, 448, 448]
    - [0, 17.943]
  - - [576, 448, 1, 1024, 576, 576, 576, 448]
    - [0, 18.84]
  - - [704, 448, 1, 1024, 704, 704, 704, 448]
    - [0, 19.341]
  - - [832, 448, 1, 1024, 832, 832, 832, 448]
    - [0, 19.764]
  - - [960, 448, 1, 1024, 960, 960, 960, 448]
    - [0, 21.026]
  - - [1088, 448, 1, 1024, 1088, 1088, 1088, 448]
    - [0, 19.611]
  - - [1216, 448, 1, 1024, 1216, 1216, 1216, 448]
    - [0, 20.309]
  - - [1344, 448, 1, 1024, 1344, 1344, 1344, 448]
    - [0, 20.581]
  - - [1472, 448, 1, 1024, 1472, 1472, 1472, 448]
    - [0, 20.691]
  - - [1600, 448, 1, 1024, 1600, 1600, 1600, 448]
    - [0, 20.828]
  - - [1728, 448, 1, 1024, 1728, 1728, 1728, 448]
    - [0, 20.962]
  - - [1856, 448, 1, 1024, 1856, 1856, 1856, 448]
    - [0, 21.073]
  - - [1984, 448, 1, 1024, 1984, 1984, 1984, 448]
    - [0, 21.472]
  - - [2112, 448, 1, 1024, 2112, 2112, 2112, 448]
    - [0, 21.592]
  - - [2240, 448, 1, 1024, 2240, 2240, 2240, 448]
    - [0, 21.691]
  - - [2368, 448, 1, 1024, 2368, 2368, 2368, 448]
    - [0, 21.751]
  - - [2496, 448, 1, 1024, 2496, 2496, 2496, 448]
    - [0, 21.828]
  - - [2624, 448, 1, 1024, 2624, 2624, 2624, 448]
    - [0, 21.802]
  - - [2752, 448, 1, 1024, 2752, 2752, 2752, 448]
    - [0, 21.915]
  - - [2880, 448, 1, 1024, 2880, 2880, 2880, 448]
    - [0, 22.102]
  - - [3008, 448, 1, 1024, 3008, 3008, 3008, 448]
    - [0, 22.096]
  - - [3136, 448, 1, 1024, 3136, 3136, 3136, 448]
    - [0, 22.223]
  - - [3264, 448, 1, 1024, 3264, 3264, 3264, 448]
    - [0, 22.238]
  - - [3392, 448, 1, 1024, 3392, 3392, 3392, 448]
    - [0, 22.222]
  - - [3520, 448, 1, 1024, 3520, 3520, 3520, 448]
    - [0, 22.372]
  - - [3648, 448, 1, 1024, 3648, 3648, 3648, 448]
    - [0, 22.301]
  - - [3776, 448, 1, 1024, 3776, 3776, 3776, 448]
    - [0, 22.404]
  - - [3904, 448, 1, 1024, 3904, 3904, 3904, 448]
    - [0, 22.47]
  - - [4032, 448, 1, 1024, 4032, 4032, 4032, 448]
    - [0, 22.498]
  - - [64, 576, 1, 1024, 64, 64, 64, 576]
    - [1, 8.603]
  - - [192, 576, 1, 1024, 192, 192, 192, 576]
    - [0, 15.281]
  - - [320, 576, 1, 1024, 320, 320, 320, 576]
    - [0, 18.438]
  - - [448, 576, 1, 1024, 448, 448, 448, 576]
    - [0, 18.712]
  - - [576, 576, 1, 1024, 576, 576, 576, 576]
    - [0, 20.17]
  - - [704, 576, 1, 1024, 704, 704, 704, 576]
    - [0, 20.105]
  - - [832, 576, 1, 1024, 832, 832, 832, 576]
    - [0, 19.274]
  - - [960, 576, 1, 1024, 960, 960, 960, 576]
    - [0, 20.469]
  - - [1088, 576, 1, 1024, 1088, 1088, 1088, 576]
    - [0, 20.556]
  - - [1216, 576, 1, 1024, 1216, 1216, 1216, 576]
    - [0, 20.963]
  - - [1344, 576, 1, 1024, 1344, 1344, 1344, 576]
    - [2, 20.877]
  - - [1472, 576, 1, 1024, 1472, 1472, 1472, 576]
    - [0, 21.36]
  - - [1600, 576, 1, 1024, 1600, 1600, 1600, 576]
    - [0, 21.452]
  - - [1728, 576, 1, 1024, 1728, 1728, 1728, 576]
    - [0, 21.593]
  - - [1856, 576, 1, 1024, 1856, 1856, 1856, 576]
    - [0, 21.803]
  - - [1984, 576, 1, 1024, 1984, 1984, 1984, 576]
    - [0, 21.781]
  - - [2112, 576, 1, 1024, 2112, 2112, 2112, 576]
    - [0, 21.937]
  - - [2240, 576, 1, 1024, 2240, 2240, 2240, 576]
    - [0, 22.07]
  - - [2368, 576, 1, 1024, 2368, 2368, 2368, 576]
    - [0, 22.113]
  - - [2496, 576, 1, 1024, 2496, 2496, 2496, 576]
    - [0, 22.21]
  - - [2624, 576, 1, 1024, 2624, 2624, 2624, 576]
    - [0, 22.28]
  - - [2752, 576, 1, 1024, 2752, 2752, 2752, 576]
    - [0, 22.418]
  - - [2880, 576, 1, 1024, 2880, 2880, 2880, 576]
    - [0, 22.406]
  - - [3008, 576, 1, 1024, 3008, 3008, 3008, 576]
    - [0, 22.442]
  - - [3136, 576, 1, 1024, 3136, 3136, 3136, 576]
    - [0, 22.508]
  - - [3264, 576, 1, 1024, 3264, 3264, 3264, 576]
    - [0, 22.527]
  - - [3392, 576, 1, 1024, 3392, 3392, 3392, 576]
    - [0, 22.587]
  - - [3520, 576, 1, 1024, 3520, 3520, 3520, 576]
    - [0, 22.629]
  - - [3648, 576, 1, 1024, 3648, 3648, 3648, 576]
    - [0, 22.668]
  - - [3776, 576, 1, 1024, 3776, 3776, 3776, 576]
    - [0, 22.701]
  - - [3904, 576, 1, 1024, 3904, 3904, 3904, 576]
    - [0, 22.732]
  - - [4032, 576, 1, 1024, 4032, 4032, 4032, 576]
    - [0, 22.756]
  - - [64, 704, 1, 1024, 64, 64, 64, 704]
    - [2, 10.352]
  - - [192, 704, 1, 1024, 192, 192, 192, 704]
    - [0, 15.816]
  - - [320, 704, 1, 1024, 320, 320, 320, 704]
    - [0, 18.181]
  - - [448, 704, 1, 1024, 448, 448, 448, 704]
    - [0, 19.295]
  - - [576, 704, 1, 1024, 576, 576, 576, 704]
    - [0, 20.06]
  - - [704, 704, 1, 1024, 704, 704, 704, 704]
    - [0, 19.719]
  - - [832, 704, 1, 1024, 832, 832, 832, 704]
    - [0, 20.189]
  - - [960, 704, 1, 1024, 960, 960, 960, 704]
    - [0, 20.954]
  - - [1088, 704, 1, 1024, 1088, 1088, 1088, 704]
    - [0, 21.224]
  - - [1216, 704, 1, 1024, 1216, 1216, 1216, 704]
    - [0, 21.426]
  - - [1344, 704, 1, 1024, 1344, 1344, 1344, 704]
    - [0, 21.686]
  - - [1472, 704, 1, 1024, 1472, 1472, 1472, 704]
    - [0, 21.745]
  - - [1600, 704, 1, 1024, 1600, 1600, 1600, 704]
    - [0, 21.881]
  - - [1728, 704, 1, 1024, 1728, 1728, 1728, 704]
    - [0, 21.955]
  - - [1856, 704, 1, 1024, 1856, 1856, 1856, 704]
    - [0, 22.071]
  - - [1984, 704, 1, 1024, 1984, 1984, 1984, 704]
    - [0, 22.171]
  - - [2112, 704, 1, 1024, 2112, 2112, 2112, 704]
    - [0, 22.261]
  - - [2240, 704, 1, 1024, 2240, 2240, 2240, 704]
    - [0, 22.311]
  - - [2368, 704, 1, 1024, 2368, 2368, 2368, 704]
    - [0, 22.442]
  - - [2496, 704, 1, 1024, 2496, 2496, 2496, 704]
    - [0, 22.413]
  - - [2624, 704, 1, 1024, 2624, 2624, 2624, 704]
    - [0, 22.545]
  - - [2752, 704, 1, 1024, 2752, 2752, 2752, 704]
    - [0, 22.601]
  - - [2880, 704, 1, 1024, 2880, 2880, 2880, 704]
    - [0, 22.562]
  - - [3008, 704, 1, 1024, 3008, 3008, 3008, 704]
    - [0, 22.651]
  - - [3136, 704, 1, 1024, 3136, 3136, 3136, 704]
    - [0, 22.721]
  - - [3264, 704, 1, 1024, 3264, 3264, 3264, 704]
    - [0, 22.755]
  - - [3392, 704, 1, 1024, 3392, 3392, 3392, 704]
    - [0, 22.775]
  - - [3520, 704, 1, 1024, 3520, 3520, 3520, 704]
    - [0, 22.815]
  - - [3648, 704, 1, 1024, 3648, 3648, 3648, 704]
    - [0, 22.851]
  - - [3776, 704, 1, 1024, 3776, 3776, 3776, 704]
    - [0, 22.83]
  - - [3904, 704, 1, 1024, 3904, 3904, 3904, 704]
    - [0, 22.908]
  - - [4032, 704, 1, 1024, 4032, 4032, 4032, 704]
    - [2, 22.886]
  - - [64, 832, 1, 1024, 64, 64, 64, 832]
    - [0, 11.548]
  - - [192, 832, 1, 1024, 192, 192, 192, 832]
    - [2, 17.089]
  - - [320, 832, 1, 1024, 320, 320, 320, 832]
    - [0, 19.273]
  - - [448, 832, 1, 1024, 448, 448, 448, 832]
    - [0, 19.818]
  - - [576, 832, 1, 1024, 576, 576, 576, 832]
    - [0, 19.29]
  - - [704, 832, 1, 1024, 704, 704, 704, 832]
    - [0, 20.173]
  - - [832, 832, 1, 1024, 832, 832, 832, 832]
    - [0, 20.782]
  - - [960, 832, 1, 1024, 960, 960, 960, 832]
    - [0, 21.356]
  - - [1088, 832, 1, 1024, 1088, 1088, 1088, 832]
    - [0, 21.463]
  - - [1216, 832, 1, 1024, 1216, 1216, 1216, 832]
    - [0, 21.67]
  - - [1344, 832, 1, 1024, 1344, 1344, 1344, 832]
    - [0, 21.855]
  - - [1472, 832, 1, 1024, 1472, 1472, 1472, 832]
    - [0, 22.041]
  - - [1600, 832, 1, 1024, 1600, 1600, 1600, 832]
    - [0, 22.007]
  - - [1728, 832, 1, 1024, 1728, 1728, 1728, 832]
    - [0, 22.211]
  - - [1856, 832, 1, 1024, 1856, 1856, 1856, 832]
    - [0, 22.289]
  - - [1984, 832, 1, 1024, 1984, 1984, 1984, 832]
    - [0, 22.415]
  - - [2112, 832, 1, 1024, 2112, 2112, 2112, 832]
    - [0, 22.468]
  - - [2240, 832, 1, 1024, 2240, 2240, 2240, 832]
    - [0, 22.55]
  - - [2368, 832, 1, 1024, 2368, 2368, 2368, 832]
    - [0, 22.638]
  - - [2496, 832, 1, 1024, 2496, 2496, 2496, 832]
    - [0, 22.689]
  - - [2624, 832, 1, 1024, 2624, 2624, 2624, 832]
    - [0, 22.657]
  - - [2752, 832, 1, 1024, 2752, 2752, 2752, 832]
    - [0, 22.711]
  - - [2880, 832, 1, 1024, 2880, 2880, 2880, 832]
    - [0, 22.775]
  - - [3008, 832, 1, 1024, 3008, 3008, 3008, 832]
    - [0, 22.769]
  - - [3136, 832, 1, 1024, 3136, 3136, 3136, 832]
    - [0, 22.827]
  - - [3264, 832, 1, 1024, 3264, 3264, 3264, 832]
    - [0, 22.888]
  - - [3392, 832, 1, 1024, 3392, 3392, 3392, 832]
    - [0, 22.953]
  - - [3520, 832, 1, 1024, 3520, 3520, 3520, 832]
    - [0, 22.959]
  - - [3648, 832, 1, 1024, 3648, 3648, 3648, 832]
    - [0, 22.979]
  - - [3776, 832, 1, 1024, 3776, 3776, 3776, 832]
    - [0, 23.034]
  - - [3904, 832, 1, 1024, 3904, 3904, 3904, 832]
    - [0, 22.991]
  - - [4032, 832, 1, 1024, 4032, 4032, 4032, 832]
    - [2, 22.99]
  - - [64, 960, 1, 1024, 64, 64, 64, 960]
    - [0, 13.276]
  - - [192, 960, 1, 1024, 192, 192, 192, 960]
    - [0, 18.485]
  - - [320, 960, 1, 1024, 320, 320, 320, 960]
    - [0, 20.261]
  - - [448, 960, 1, 1024, 448, 448, 448, 960]
    - [0, 20.926]
  - - [576, 960, 1, 1024, 576, 576, 576, 960]
    - [0, 20.435]
  - - [704, 960, 1, 1024, 704, 704, 704, 960]
    - [0, 20.99]
  - - [832, 960, 1, 1024, 832, 832, 832, 960]
    - [0, 21.204]
  - - [960, 960, 1, 1024, 960, 960, 960, 960]
    - [0, 21.528]
  - - [1088, 960, 1, 1024, 1088, 1088, 1088, 960]
    - [0, 21.688]
  - - [1216, 960, 1, 1024, 1216, 1216, 1216, 960]
    - [0, 21.88]
  - - [1344, 960, 1, 1024, 1344, 1344, 1344, 960]
    - [0, 22.046]
  - - [1472, 960, 1, 1024, 1472, 1472, 1472, 960]
    - [0, 22.22]
  - - [1600, 960, 1, 1024, 1600, 1600, 1600, 960]
    - [0, 22.236]
  - - [1728, 960, 1, 1024, 1728, 1728, 1728, 960]
    - [0, 22.414]
  - - [1856, 960, 1, 1024, 1856, 1856, 1856, 960]
    - [0, 22.498]
  - - [1984, 960, 1, 1024, 1984, 1984, 1984, 960]
    - [0, 22.545]
  - - [2112, 960, 1, 1024, 2112, 2112, 2112, 960]
    - [0, 22.677]
  - - [2240, 960, 1, 1024, 2240, 2240, 2240, 960]
    - [0, 22.681]
  - - [2368, 960, 1, 1024, 2368, 2368, 2368, 960]
    - [0, 22.721]
  - - [2496, 960, 1, 1024, 2496, 2496, 2496, 960]
    - [0, 22.812]
  - - [2624, 960, 1, 1024, 2624, 2624, 2624, 960]
    - [0, 22.829]
  - - [2752, 960, 1, 1024, 2752, 2752, 2752, 960]
    - [0, 22.872]
  - - [2880, 960, 1, 1024, 2880, 2880, 2880, 960]
    - [0, 22.865]
  - - [3008, 960, 1, 1024, 3008, 3008, 3008, 960]
    - [0, 22.948]
  - - [3136, 960, 1, 1024, 3136, 3136, 3136, 960]
    - [0, 23.007]
  - - [3264, 960, 1, 1024, 3264, 3264, 3264, 960]
    - [0, 23.036]
  - - [3392, 960, 1, 1024, 3392, 3392, 3392, 960]
    - [0, 22.995]
  - - [3520, 960, 1, 1024, 3520, 3520, 3520, 960]
    - [0, 23.022]
  - - [3648, 960, 1, 1024, 3648, 3648, 3648, 960]
    - [0, 23.054]
  - - [3776, 960, 1, 1024, 3776, 3776, 3776, 960]
    - [0, 23.101]
  - - [3904, 960, 1, 1024, 3904, 3904, 3904, 960]
    - [0, 23.143]
  - - [4032, 960, 1, 1024, 4032, 4032, 4032, 960]
    - [0, 22.793]
  - - [64, 1088, 1, 1024, 64, 64, 64, 1088]
    - [2, 11.919]
  - - [192, 1088, 1, 1024, 192, 192, 192, 1088]
    - [0, 18.495]
  - - [320, 1088, 1, 1024, 320, 320, 320, 1088]
    - [0, 19.76]
  - - [448, 1088, 1, 1024, 448, 448, 448, 1088]
    - [0, 19.614]
  - - [576, 1088, 1, 1024, 576, 576, 576, 1088]
    - [0, 20.52]
  - - [704, 1088, 1, 1024, 704, 704, 704, 1088]
    - [0, 21.222]
  - - [832, 1088, 1, 1024, 832, 832, 832, 1088]
    - [0, 21.418]
  - - [960, 1088, 1, 1024, 960, 960, 960, 1088]
    - [0, 21.73]
  - - [1088, 1088, 1, 1024, 1088, 1088, 1088, 1088]
    - [0, 21.915]
  - - [1216, 1088, 1, 1024, 1216, 1216, 1216, 1088]
    - [0, 22.097]
  - - [1344, 1088, 1, 1024, 1344, 1344, 1344, 1088]
    - [0, 22.202]
  - - [1472, 1088, 1, 1024, 1472, 1472, 1472, 1088]
    - [0, 22.369]
  - - [1600, 1088, 1, 1024, 1600, 1600, 1600, 1088]
    - [0, 22.482]
  - - [1728, 1088, 1, 1024, 1728, 1728, 1728, 1088]
    - [0, 22.496]
  - - [1856, 1088, 1, 1024, 1856, 1856, 1856, 1088]
    - [0, 22.644]
  - - [1984, 1088, 1, 1024, 1984, 1984, 1984, 1088]
    - [0, 22.669]
  - - [2112, 1088, 1, 1024, 2112, 2112, 2112, 1088]
    - [0, 22.774]
  - - [2240, 1088, 1, 1024, 2240, 2240, 2240, 1088]
    - [0, 22.852]
  - - [2368, 1088, 1, 1024, 2368, 2368, 2368, 1088]
    - [0, 22.888]
  - - [2496, 1088, 1, 1024, 2496, 2496, 2496, 1088]
    - [0, 22.856]
  - - [2624, 1088, 1, 1024, 2624, 2624, 2624, 1088]
    - [0, 22.852]
  - - [2752, 1088, 1, 1024, 2752, 2752, 2752, 1088]
    - [0, 22.908]
  - - [2880, 1088, 1, 1024, 2880, 2880, 2880, 1088]
    - [0, 23.011]
  - - [3008, 1088, 1, 1024, 3008, 3008, 3008, 1088]
    - [0, 23.029]
  - - [3136, 1088, 1, 1024, 3136, 3136, 3136, 1088]
    - [0, 23.038]
  - - [3264, 1088, 1, 1024, 3264, 3264, 3264, 1088]
    - [0, 23.084]
  - - [3392, 1088, 1, 1024, 3392, 3392, 3392, 1088]
    - [0, 23.108]
  - - [3520, 1088, 1, 1024, 3520, 3520, 3520, 1088]
    - [0, 22.774]
  - - [3648, 1088, 1, 1024, 3648, 3648, 3648, 1088]
    - [0, 22.785]
  - - [3776, 1088, 1, 1024, 3776, 3776, 3776, 1088]
    - [0, 22.815]
  - - [3904, 1088, 1, 1024, 3904, 3904, 3904, 1088]
    - [0, 22.899]
  - - [4032, 1088, 1, 1024, 4032, 4032, 4032, 1088]
    - [0, 22.869]
  - - [64, 1216, 1, 1024, 64, 64, 64, 1216]
    - [0, 13.161]
  - - [192, 1216, 1, 1024, 192, 192, 192, 1216]
    - [0, 18.485]
  - - [320, 1216, 1, 1024, 320, 320, 320, 1216]
    - [0, 20.49]
  - - [448, 1216, 1, 1024, 448, 448, 448, 1216]
    - [0, 20.217]
  - - [576, 1216, 1, 1024, 576, 576, 576, 1216]
    - [0, 21.022]
  - - [704, 1216, 1, 1024, 704, 704, 704, 1216]
    - [0, 21.382]
  - - [832, 1216, 1, 1024, 832, 832, 832, 1216]
    - [0, 21.69]
  - - [960, 1216, 1, 1024, 960, 960, 960, 1216]
    - [0, 22.008]
  - - [1088, 1216, 1, 1024, 1088, 1088, 1088, 1216]
    - [0, 22.091]
  - - [1216, 1216, 1, 1024, 1216, 1216, 1216, 1216]
    - [0, 22.26]
  - - [1344, 1216, 1, 1024, 1344, 1344, 1344, 1216]
    - [0, 22.333]
  - - [1472, 1216, 1, 1024, 1472, 1472, 1472, 1216]
    - [0, 22.512]
  - - [1600, 1216, 1, 1024, 1600, 1600, 1600, 1216]
    - [0, 22.596]
  - - [1728, 1216, 1, 1024, 1728, 1728, 1728, 1216]
    - [0, 22.704]
  - - [1856, 1216, 1, 1024, 1856, 1856, 1856, 1216]
    - [0, 22.735]
  - - [1984, 1216, 1, 1024, 1984, 1984, 1984, 1216]
    - [0, 22.864]
  - - [2112, 1216, 1, 1024, 2112, 2112, 2112, 1216]
    - [0, 22.793]
  - - [2240, 1216, 1, 1024, 2240, 2240, 2240, 1216]
    - [0, 22.875]
  - - [2368, 1216, 1, 1024, 2368, 2368, 2368, 1216]
    - [0, 22.921]
  - - [2496, 1216, 1, 1024, 2496, 2496, 2496, 1216]
    - [0, 22.91]
  - - [2624, 1216, 1, 1024, 2624, 2624, 2624, 1216]
    - [0, 23.008]
  - - [2752, 1216, 1, 1024, 2752, 2752, 2752, 1216]
    - [0, 23.076]
  - - [2880, 1216, 1, 1024, 2880, 2880, 2880, 1216]
    - [0, 23.022]
  - - [3008, 1216, 1, 1024, 3008, 3008, 3008, 1216]
    - [0, 23.071]
  - - [3136, 1216, 1, 1024, 3136, 3136, 3136, 1216]
    - [0, 22.795]
  - - [3264, 1216, 1, 1024, 3264, 3264, 3264, 1216]
    - [0, 22.797]
  - - [3392, 1216, 1, 1024, 3392, 3392, 3392, 1216]
    - [0, 22.833]
  - - [3520, 1216, 1, 1024, 3520, 3520, 3520, 1216]
    - [0, 22.872]
  - - [3648, 1216, 1, 1024, 3648, 3648, 3648, 1216]
    - [0, 22.927]
  - - [3776, 1216, 1, 1024, 3776, 3776, 3776, 1216]
    - [0, 22.903]
  - - [3904, 1216, 1, 1024, 3904, 3904, 3904, 1216]
    - [0, 22.914]
  - - [4032, 1216, 1, 1024, 4032, 4032, 4032, 1216]
    - [0, 22.921]
  - - [64, 1344, 1, 1024, 64, 64, 64, 1344]
    - [0, 14.534]
  - - [192, 1344, 1, 1024, 192, 192, 192, 1344]
    - [0, 18.552]
  - - [320, 1344, 1, 1024, 320, 320, 320, 1344]
    - [0, 20.982]
  - - [448, 1344, 1, 1024, 448, 448, 448, 1344]
    - [0, 20.53]
  - - [576, 1344, 1, 1024, 576, 576, 576, 1344]
    - [0, 20.997]
  - - [704, 1344, 1, 1024, 704, 704, 704, 1344]
    - [0, 21.584]
  - - [832, 1344, 1, 1024, 832, 832, 832, 1344]
    - [0, 21.794]
  - - [960, 1344, 1, 1024, 960, 960, 960, 1344]
    - [0, 22.106]
  - - [1088, 1344, 1, 1024, 1088, 1088, 1088, 1344]
    - [0, 22.275]
  - - [1216, 1344, 1, 1024, 1216, 1216, 1216, 1344]
    - [0, 22.388]
  - - [1344, 1344, 1, 1024, 1344, 1344, 1344, 1344]
    - [0, 22.495]
  - - [1472, 1344, 1, 1024, 1472, 1472, 1472, 1344]
    - [0, 22.606]
  - - [1600, 1344, 1, 1024, 1600, 1600, 1600, 1344]
    - [0, 22.733]
  - - [1728, 1344, 1, 1024, 1728, 1728, 1728, 1344]
    - [0, 22.791]
  - - [1856, 1344, 1, 1024, 1856, 1856, 1856, 1344]
    - [0, 22.838]
  - - [1984, 1344, 1, 1024, 1984, 1984, 1984, 1344]
    - [0, 22.849]
  - - [2112, 1344, 1, 1024, 2112, 2112, 2112, 1344]
    - [0, 22.958]
  - - [2240, 1344, 1, 1024, 2240, 2240, 2240, 1344]
    - [0, 22.994]
  - - [2368, 1344, 1, 1024, 2368, 2368, 2368, 1344]
    - [0, 23.011]
  - - [2496, 1344, 1, 1024, 2496, 2496, 2496, 1344]
    - [0, 23.035]
  - - [2624, 1344, 1, 1024, 2624, 2624, 2624, 1344]
    - [0, 23.103]
  - - [2752, 1344, 1, 1024, 2752, 2752, 2752, 1344]
    - [0, 23.009]
  - - [2880, 1344, 1, 1024, 2880, 2880, 2880, 1344]
    - [0, 22.796]
  - - [3008, 1344, 1, 1024, 3008, 3008, 3008, 1344]
    - [0, 22.838]
  - - [3136, 1344, 1, 1024, 3136, 3136, 3136, 1344]
    - [0, 22.859]
  - - [3264, 1344, 1, 1024, 3264, 3264, 3264, 1344]
    - [0, 22.865]
  - - [3392, 1344, 1, 1024, 3392, 3392, 3392, 1344]
    - [0, 22.906]
  - - [3520, 1344, 1, 1024, 3520, 3520, 3520, 1344]
    - [0, 22.913]
  - - [3648, 1344, 1, 1024, 3648, 3648, 3648, 1344]
    - [0, 23.004]
  - - [3776, 1344, 1, 1024, 3776, 3776, 3776, 1344]
    - [0, 22.955]
  - - [3904, 1344, 1, 1024, 3904, 3904, 3904, 1344]
    - [0, 22.967]
  - - [4032, 1344, 1, 1024, 4032, 4032, 4032, 1344]
    - [0, 23.08]
  - - [64, 1472, 1, 1024, 64, 64, 64, 1472]
    - [0, 13.213]
  - - [192, 1472, 1, 1024, 192, 192, 192, 1472]
    - [0, 18.646]
  - - [320, 1472, 1, 1024, 320, 320, 320, 1472]
    - [0, 18.959]
  - - [448, 1472, 1, 1024, 448, 448, 448, 1472]
    - [0, 20.702]
  - - [576, 1472, 1, 1024, 576, 576, 576, 1472]
    - [0, 21.346]
  - - [704, 1472, 1, 1024, 704, 704, 704, 1472]
    - [0, 21.813]
  - - [832, 1472, 1, 1024, 832, 832, 832, 1472]
    - [0, 22.042]
  - - [960, 1472, 1, 1024, 960, 960, 960, 1472]
    - [0, 22.247]
  - - [1088, 1472, 1, 1024, 1088, 1088, 1088, 1472]
    - [0, 22.371]
  - - [1216, 1472, 1, 1024, 1216, 1216, 1216, 1472]
    - [0, 22.494]
  - - [1344, 1472, 1, 1024, 1344, 1344, 1344, 1472]
    - [0, 22.648]
  - - [1472, 1472, 1, 1024, 1472, 1472, 1472, 1472]
    - [0, 22.667]
  - - [1600, 1472, 1, 1024, 1600, 1600, 1600, 1472]
    - [0, 22.789]
  - - [1728, 1472, 1, 1024, 1728, 1728, 1728, 1472]
    - [0, 22.86]
  - - [1856, 1472, 1, 1024, 1856, 1856, 1856, 1472]
    - [0, 22.969]
  - - [1984, 1472, 1, 1024, 1984, 1984, 1984, 1472]
    - [0, 23.007]
  - - [2112, 1472, 1, 1024, 2112, 2112, 2112, 1472]
    - [0, 22.986]
  - - [2240, 1472, 1, 1024, 2240, 2240, 2240, 1472]
    - [0, 23.051]
  - - [2368, 1472, 1, 1024, 2368, 2368, 2368, 1472]
    - [0, 23.084]
  - - [2496, 1472, 1, 1024, 2496, 2496, 2496, 1472]
    - [0, 23.118]
  - - [2624, 1472, 1, 1024, 2624, 2624, 2624, 1472]
    - [0, 22.756]
  - - [2752, 1472, 1, 1024, 2752, 2752, 2752, 1472]
    - [0, 22.881]
  - - [2880, 1472, 1, 1024, 2880, 2880, 2880, 1472]
    - [0, 22.84]
  - - [3008, 1472, 1, 1024, 3008, 3008, 3008, 1472]
    - [0, 22.903]
  - - [3136, 1472, 1, 1024, 3136, 3136, 3136, 1472]
    - [0, 23.011]
  - - [3264, 1472, 1, 1024, 3264, 3264, 3264, 1472]
    - [0, 22.985]
  - - [3392, 1472, 1, 1024, 3392, 3392, 3392, 1472]
    - [0, 22.955]
  - - [3520, 1472, 1, 1024, 3520, 3520, 3520, 1472]
    - [0, 22.977]
  - - [3648, 1472, 1, 1024, 3648, 3648, 3648, 1472]
    - [0, 22.999]
  - - [3776, 1472, 1, 1024, 3776, 3776, 3776, 1472]
    - [0, 23.071]
  - - [3904, 1472, 1, 1024, 3904, 3904, 3904, 1472]
    - [0, 23.057]
  - - [4032, 1472, 1, 1024, 4032, 4032, 4032, 1472]
    - [0, 23.127]
  - - [64, 1600, 1, 1024, 64, 64, 64, 1600]
    - [0, 14.25]
  - - [192, 1600, 1, 1024, 192, 192, 192, 1600]
    - [0, 20.118]
  - - [320, 1600, 1, 1024, 320, 320, 320, 1600]
    - [0, 20.157]
  - - [448, 1600, 1, 1024, 448, 448, 448, 1600]
    - [0, 20.849]
  - - [576, 1600, 1, 1024, 576, 576, 576, 1600]
    - [0, 21.519]
  - - [704, 1600, 1, 1024, 704, 704, 704, 1600]
    - [0, 21.846]
  - - [832, 1600, 1, 1024, 832, 832, 832, 1600]
    - [0, 22.094]
  - - [960, 1600, 1, 1024, 960, 960, 960, 1600]
    - [0, 22.32]
  - - [1088, 1600, 1, 1024, 1088, 1088, 1088, 1600]
    - [0, 22.433]
  - - [1216, 1600, 1, 1024, 1216, 1216, 1216, 1600]
    - [0, 22.507]
  - - [1344, 1600, 1, 1024, 1344, 1344, 1344, 1600]
    - [0, 22.726]
  - - [1472, 1600, 1, 1024, 1472, 1472, 1472, 1600]
    - [0, 22.783]
  - - [1600, 1600, 1, 1024, 1600, 1600, 1600, 1600]
    - [0, 22.828]
  - - [1728, 1600, 1, 1024, 1728, 1728, 1728, 1600]
    - [0, 22.914]
  - - [1856, 1600, 1, 1024, 1856, 1856, 1856, 1600]
    - [0, 22.968]
  - - [1984, 1600, 1, 1024, 1984, 1984, 1984, 1600]
    - [0, 22.966]
  - - [2112, 1600, 1, 1024, 2112, 2112, 2112, 1600]
    - [0, 23.106]
  - - [2240, 1600, 1, 1024, 2240, 2240, 2240, 1600]
    - [0, 23.106]
  - - [2368, 1600, 1, 1024, 2368, 2368, 2368, 1600]
    - [0, 22.742]
  - - [2496, 1600, 1, 1024, 2496, 2496, 2496, 1600]
    - [0, 22.849]
  - - [2624, 1600, 1, 1024, 2624, 2624, 2624, 1600]
    - [0, 22.874]
  - - [2752, 1600, 1, 1024, 2752, 2752, 2752, 1600]
    - [0, 22.912]
  - - [2880, 1600, 1, 1024, 2880, 2880, 2880, 1600]
    - [0, 22.989]
  - - [3008, 1600, 1, 1024, 3008, 3008, 3008, 1600]
    - [0, 22.977]
  - - [3136, 1600, 1, 1024, 3136, 3136, 3136, 1600]
    - [0, 23.01]
  - - [3264, 1600, 1, 1024, 3264, 3264, 3264, 1600]
    - [0, 23.006]
  - - [3392, 1600, 1, 1024, 3392, 3392, 3392, 1600]
    - [0, 23.027]
  - - [3520, 1600, 1, 1024, 3520, 3520, 3520, 1600]
    - [0, 23.1]
  - - [3648, 1600, 1, 1024, 3648, 3648, 3648, 1600]
    - [0, 23.098]
  - - [3776, 1600, 1, 1024, 3776, 3776, 3776, 1600]
    - [0, 23.126]
  - - [3904, 1600, 1, 1024, 3904, 3904, 3904, 1600]
    - [0, 23.088]
  - - [4032, 1600, 1, 1024, 4032, 4032, 4032, 1600]
    - [0, 23.124]
  - - [64, 1728, 1, 1024, 64, 64, 64, 1728]
    - [2, 14.274]
  - - [192, 1728, 1, 1024, 192, 192, 192, 1728]
    - [0, 20.029]
  - - [320, 1728, 1, 1024, 320, 320, 320, 1728]
    - [0, 20.479]
  - - [448, 1728, 1, 1024, 448, 448, 448, 1728]
    - [0, 20.975]
  - - [576, 1728, 1, 1024, 576, 576, 576, 1728]
    - [0, 21.612]
  - - [704, 1728, 1, 1024, 704, 704, 704, 1728]
    - [0, 22.012]
  - - [832, 1728, 1, 1024, 832, 832, 832, 1728]
    - [0, 22.247]
  - - [960, 1728, 1, 1024, 960, 960, 960, 1728]
    - [0, 22.392]
  - - [1088, 1728, 1, 1024, 1088, 1088, 1088, 1728]
    - [0, 22.593]
  - - [1216, 1728, 1, 1024, 1216, 1216, 1216, 1728]
    - [0, 22.695]
  - - [1344, 1728, 1, 1024, 1344, 1344, 1344, 1728]
    - [0, 22.756]
  - - [1472, 1728, 1, 1024, 1472, 1472, 1472, 1728]
    - [0, 22.793]
  - - [1600, 1728, 1, 1024, 1600, 1600, 1600, 1728]
    - [0, 22.931]
  - - [1728, 1728, 1, 1024, 1728, 1728, 1728, 1728]
    - [0, 23.0]
  - - [1856, 1728, 1, 1024, 1856, 1856, 1856, 1728]
    - [0, 23.064]
  - - [1984, 1728, 1, 1024, 1984, 1984, 1984, 1728]
    - [0, 23.025]
  - - [2112, 1728, 1, 1024, 2112, 2112, 2112, 1728]
    - [0, 23.116]
  - - [2240, 1728, 1, 1024, 2240, 2240, 2240, 1728]
    - [0, 22.81]
  - - [2368, 1728, 1, 1024, 2368, 2368, 2368, 1728]
    - [0, 22.775]
  - - [2496, 1728, 1, 1024, 2496, 2496, 2496, 1728]
    - [0, 22.867]
  - - [2624, 1728, 1, 1024, 2624, 2624, 2624, 1728]
    - [0, 22.901]
  - - [2752, 1728, 1, 1024, 2752, 2752, 2752, 1728]
    - [0, 22.957]
  - - [2880, 1728, 1, 1024, 2880, 2880, 2880, 1728]
    - [0, 22.977]
  - - [3008, 1728, 1, 1024, 3008, 3008, 3008, 1728]
    - [0, 23.021]
  - - [3136, 1728, 1, 1024, 3136, 3136, 3136, 1728]
    - [0, 23.008]
  - - [3264, 1728, 1, 1024, 3264, 3264, 3264, 1728]
    - [0, 23.015]
  - - [3392, 1728, 1, 1024, 3392, 3392, 3392, 1728]
    - [0, 23.077]
  - - [3520, 1728, 1, 1024, 3520, 3520, 3520, 1728]
    - [0, 23.1]
  - - [3648, 1728, 1, 1024, 3648, 3648, 3648, 1728]
    - [0, 23.116]
  - - [3776, 1728, 1, 1024, 3776, 3776, 3776, 1728]
    - [0, 23.201]
  - - [3904, 1728, 1, 1024, 3904, 3904, 3904, 1728]
    - [0, 23.217]
  - - [4032, 1728, 1, 1024, 4032, 4032, 4032, 1728]
    - [0, 23.202]
  - - [64, 1856, 1, 1024, 64, 64, 64, 1856]
    - [0, 16.386]
  - - [192, 1856, 1, 1024, 192, 192, 192, 1856]
    - [0, 20.007]
  - - [320, 1856, 1, 1024, 320, 320, 320, 1856]
    - [0, 20.332]
  - - [448, 1856, 1, 1024, 448, 448, 448, 1856]
    - [0, 21.194]
  - - [576, 1856, 1, 1024, 576, 576, 576, 1856]
    - [0, 21.86]
  - - [704, 1856, 1, 1024, 704, 704, 704, 1856]
    - [0, 22.124]
  - - [832, 1856, 1, 1024, 832, 832, 832, 1856]
    - [0, 22.248]
  - - [960, 1856, 1, 1024, 960, 960, 960, 1856]
    - [0, 22.491]
  - - [1088, 1856, 1, 1024, 1088, 1088, 1088, 1856]
    - [0, 22.607]
  - - [1216, 1856, 1, 1024, 1216, 1216, 1216, 1856]
    - [0, 22.732]
  - - [1344, 1856, 1, 1024, 1344, 1344, 1344, 1856]
    - [0, 22.82]
  - - [1472, 1856, 1, 1024, 1472, 1472, 1472, 1856]
    - [0, 22.978]
  - - [1600, 1856, 1, 1024, 1600, 1600, 1600, 1856]
    - [0, 22.968]
  - - [1728, 1856, 1, 1024, 1728, 1728, 1728, 1856]
    - [0, 23.024]
  - - [1856, 1856, 1, 1024, 1856, 1856, 1856, 1856]
    - [0, 23.102]
  - - [1984, 1856, 1, 1024, 1984, 1984, 1984, 1856]
    - [0, 23.114]
  - - [2112, 1856, 1, 1024, 2112, 2112, 2112, 1856]
    - [0, 22.849]
  - - [2240, 1856, 1, 1024, 2240, 2240, 2240, 1856]
    - [0, 22.893]
  - - [2368, 1856, 1, 1024, 2368, 2368, 2368, 1856]
    - [0, 22.883]
  - - [2496, 1856, 1, 1024, 2496, 2496, 2496, 1856]
    - [0, 22.977]
  - - [2624, 1856, 1, 1024, 2624, 2624, 2624, 1856]
    - [0, 22.995]
  - - [2752, 1856, 1, 1024, 2752, 2752, 2752, 1856]
    - [0, 22.979]
  - - [2880, 1856, 1, 1024, 2880, 2880, 2880, 1856]
    - [0, 23.021]
  - - [3008, 1856, 1, 1024, 3008, 3008, 3008, 1856]
    - [0, 23.005]
  - - [3136, 1856, 1, 1024, 3136, 3136, 3136, 1856]
    - [0, 23.104]
  - - [3264, 1856, 1, 1024, 3264, 3264, 3264, 1856]
    - [0, 23.09]
  - - [3392, 1856, 1, 1024, 3392, 3392, 3392, 1856]
    - [0, 23.12]
  - - [3520, 1856, 1, 1024, 3520, 3520, 3520, 1856]
    - [0, 23.194]
  - - [3648, 1856, 1, 1024, 3648, 3648, 3648, 1856]
    - [0, 23.169]
  - - [3776, 1856, 1, 1024, 3776, 3776, 3776, 1856]
    - [0, 23.156]
  - - [3904, 1856, 1, 1024, 3904, 3904, 3904, 1856]
    - [0, 23.176]
  - - [4032, 1856, 1, 1024, 4032, 4032, 4032, 1856]
    - [0, 23.271]
  - - [64, 1984, 1, 1024, 64, 64, 64, 1984]
    - [3, 14.141]
  - - [192, 1984, 1, 1024, 192, 192, 192, 1984]
    - [0, 20.158]
  - - [320, 1984, 1, 1024, 320, 320, 320, 1984]
    - [0, 20.702]
  - - [448, 1984, 1, 1024, 448, 448, 448, 1984]
    - [0, 21.478]
  - - [576, 1984, 1, 1024, 576, 576, 576, 1984]
    - [0, 21.85]
  - - [704, 1984, 1, 1024, 704, 704, 704, 1984]
    - [0, 22.179]
  - - [832, 1984, 1, 1024, 832, 832, 832, 1984]
    - [0, 22.333]
  - - [960, 1984, 1, 1024, 960, 960, 960, 1984]
    - [0, 22.547]
  - - [1088, 1984, 1, 1024, 1088, 1088, 1088, 1984]
    - [0, 22.601]
  - - [1216, 1984, 1, 1024, 1216, 1216, 1216, 1984]
    - [0, 22.815]
  - - [1344, 1984, 1, 1024, 1344, 1344, 1344, 1984]
    - [0, 22.876]
  - - [1472, 1984, 1, 1024, 1472, 1472, 1472, 1984]
    - [0, 22.944]
  - - [1600, 1984, 1, 1024, 1600, 1600, 1600, 1984]
    - [0, 22.966]
  - - [1728, 1984, 1, 1024, 1728, 1728, 1728, 1984]
    - [0, 23.066]
  - - [1856, 1984, 1, 1024, 1856, 1856, 1856, 1984]
    - [0, 23.079]
  - - [1984, 1984, 1, 1024, 1984, 1984, 1984, 1984]
    - [0, 22.825]
  - - [2112, 1984, 1, 1024, 2112, 2112, 2112, 1984]
    - [0, 22.883]
  - - [2240, 1984, 1, 1024, 2240, 2240, 2240, 1984]
    - [0, 22.944]
  - - [2368, 1984, 1, 1024, 2368, 2368, 2368, 1984]
    - [0, 22.916]
  - - [2496, 1984, 1, 1024, 2496, 2496, 2496, 1984]
    - [0, 22.977]
  - - [2624, 1984, 1, 1024, 2624, 2624, 2624, 1984]
    - [0, 22.976]
  - - [2752, 1984, 1, 1024, 2752, 2752, 2752, 1984]
    - [0, 23.05]
  - - [2880, 1984, 1, 1024, 2880, 2880, 2880, 1984]
    - [0, 23.079]
  - - [3008, 1984, 1, 1024, 3008, 3008, 3008, 1984]
    - [0, 23.099]
  - - [3136, 1984, 1, 1024, 3136, 3136, 3136, 1984]
    - [0, 23.144]
  - - [3264, 1984, 1, 1024, 3264, 3264, 3264, 1984]
    - [0, 23.072]
  - - [3392, 1984, 1, 1024, 3392, 3392, 3392, 1984]
    - [0, 23.196]
  - - [3520, 1984, 1, 1024, 3520, 3520, 3520, 1984]
    - [0, 23.201]
  - - [3648, 1984, 1, 1024, 3648, 3648, 3648, 1984]
    - [0, 23.179]
  - - [3776, 1984, 1, 1024, 3776, 3776, 3776, 1984]
    - [0, 23.29]
  - - [3904, 1984, 1, 1024, 3904, 3904, 3904, 1984]
    - [0, 23.262]
  - - [4032, 1984, 1, 1024, 4032, 4032, 4032, 1984]
    - [0, 23.277]
  - - [64, 2112, 1, 1024, 64, 64, 64, 2112]
    - [2, 15.259]
  - - [192, 2112, 1, 1024, 192, 192, 192, 2112]
    - [0, 20.144]
  - - [320, 2112, 1, 1024, 320, 320, 320, 2112]
    - [0, 20.972]
  - - [448, 2112, 1, 1024, 448, 448, 448, 2112]
    - [0, 21.61]
  - - [576, 2112, 1, 1024, 576, 576, 576, 2112]
    - [0, 21.939]
  - - [704, 2112, 1, 1024, 704, 704, 704, 2112]
    - [0, 22.297]
  - - [832, 2112, 1, 1024, 832, 832, 832, 2112]
    - [0, 22.451]
  - - [960, 2112, 1, 1024, 960, 960, 960, 2112]
    - [0, 22.606]
  - - [1088, 2112, 1, 1024, 1088, 1088, 1088, 2112]
    - [0, 22.786]
  - - [1216, 2112, 1, 1024, 1216, 1216, 1216, 2112]
    - [0, 22.859]
  - - [1344, 2112, 1, 1024, 1344, 1344, 1344, 2112]
    - [0, 22.975]
  - - [1472, 2112, 1, 1024, 1472, 1472, 1472, 2112]
    - [0, 23.024]
  - - [1600, 2112, 1, 1024, 1600, 1600, 1600, 2112]
    - [0, 23.029]
  - - [1728, 2112, 1, 1024, 1728, 1728, 1728, 2112]
    - [0, 23.055]
  - - [1856, 2112, 1, 1024, 1856, 1856, 1856, 2112]
    - [0, 22.759]
  - - [1984, 2112, 1, 1024, 1984, 1984, 1984, 2112]
    - [0, 22.794]
  - - [2112, 2112, 1, 1024, 2112, 2112, 2112, 2112]
    - [0, 22.897]
  - - [2240, 2112, 1, 1024, 2240, 2240, 2240, 2112]
    - [0, 22.903]
  - - [2368, 2112, 1, 1024, 2368, 2368, 2368, 2112]
    - [0, 22.986]
  - - [2496, 2112, 1, 1024, 2496, 2496, 2496, 2112]
    - [0, 22.949]
  - - [2624, 2112, 1, 1024, 2624, 2624, 2624, 2112]
    - [0, 23.07]
  - - [2752, 2112, 1, 1024, 2752, 2752, 2752, 2112]
    - [0, 23.127]
  - - [2880, 2112, 1, 1024, 2880, 2880, 2880, 2112]
    - [0, 23.068]
  - - [3008, 2112, 1, 1024, 3008, 3008, 3008, 2112]
    - [0, 23.122]
  - - [3136, 2112, 1, 1024, 3136, 3136, 3136, 2112]
    - [0, 23.189]
  - - [3264, 2112, 1, 1024, 3264, 3264, 3264, 2112]
    - [0, 23.183]
  - - [3392, 2112, 1, 1024, 3392, 3392, 3392, 2112]
    - [0, 23.252]
  - - [3520, 2112, 1, 1024, 3520, 3520, 3520, 2112]
    - [0, 23.194]
  - - [3648, 2112, 1, 1024, 3648, 3648, 3648, 2112]
    - [0, 23.272]
  - - [3776, 2112, 1, 1024, 3776, 3776, 3776, 2112]
    - [0, 23.306]
  - - [3904, 2112, 1, 1024, 3904, 3904, 3904, 2112]
    - [0, 23.332]
  - - [4032, 2112, 1, 1024, 4032, 4032, 4032, 2112]
    - [0, 23.3]
  - - [64, 2240, 1, 1024, 64, 64, 64, 2240]
    - [0, 16.823]
  - - [192, 2240, 1, 1024, 192, 192, 192, 2240]
    - [0, 21.015]
  - - [320, 2240, 1, 1024, 320, 320, 320, 2240]
    - [0, 20.858]
  - - [448, 2240, 1, 1024, 448, 448, 448, 2240]
    - [0, 21.675]
  - - [576, 2240, 1, 1024, 576, 576, 576, 2240]
    - [0, 22.036]
  - - [704, 2240, 1, 1024, 704, 704, 704, 2240]
    - [0, 22.293]
  - - [832, 2240, 1, 1024, 832, 832, 832, 2240]
    - [0, 22.505]
  - - [960, 2240, 1, 1024, 960, 960, 960, 2240]
    - [0, 22.7]
  - - [1088, 2240, 1, 1024, 1088, 1088, 1088, 2240]
    - [0, 22.784]
  - - [1216, 2240, 1, 1024, 1216, 1216, 1216, 2240]
    - [0, 22.923]
  - - [1344, 2240, 1, 1024, 1344, 1344, 1344, 2240]
    - [0, 22.941]
  - - [1472, 2240, 1, 1024, 1472, 1472, 1472, 2240]
    - [0, 23.066]
  - - [1600, 2240, 1, 1024, 1600, 1600, 1600, 2240]
    - [0, 23.037]
  - - [1728, 2240, 1, 1024, 1728, 1728, 1728, 2240]
    - [0, 22.814]
  - - [1856, 2240, 1, 1024, 1856, 1856, 1856, 2240]
    - [0, 22.861]
  - - [1984, 2240, 1, 1024, 1984, 1984, 1984, 2240]
    - [0, 22.848]
  - - [2112, 2240, 1, 1024, 2112, 2112, 2112, 2240]
    - [0, 22.955]
  - - [2240, 2240, 1, 1024, 2240, 2240, 2240, 2240]
    - [0, 23.057]
  - - [2368, 2240, 1, 1024, 2368, 2368, 2368, 2240]
    - [0, 22.986]
  - - [2496, 2240, 1, 1024, 2496, 2496, 2496, 2240]
    - [0, 23.082]
  - - [2624, 2240, 1, 1024, 2624, 2624, 2624, 2240]
    - [0, 23.096]
  - - [2752, 2240, 1, 1024, 2752, 2752, 2752, 2240]
    - [0, 23.126]
  - - [2880, 2240, 1, 1024, 2880, 2880, 2880, 2240]
    - [0, 23.142]
  - - [3008, 2240, 1, 1024, 3008, 3008, 3008, 2240]
    - [0, 23.177]
  - - [3136, 2240, 1, 1024, 3136, 3136, 3136, 2240]
    - [0, 23.22]
  - - [3264, 2240, 1, 1024, 3264, 3264, 3264, 2240]
    - [0, 23.155]
  - - [3392, 2240, 1, 1024, 3392, 3392, 3392, 2240]
    - [0, 23.216]
  - - [3520, 2240, 1, 1024, 3520, 3520, 3520, 2240]
    - [0, 23.276]
  - - [3648, 2240, 1, 1024, 3648, 3648, 3648, 2240]
    - [0, 23.272]
  - - [3776, 2240, 1, 1024, 3776, 3776, 3776, 2240]
    - [0, 23.282]
  - - [3904, 2240, 1, 1024, 3904, 3904, 3904, 2240]
    - [0, 23.341]
  - - [4032, 2240, 1, 1024, 4032, 4032, 4032, 2240]
    - [0, 23.375]
  - - [64, 2368, 1, 1024, 64, 64, 64, 2368]
    - [0, 17.788]
  - - [192, 2368, 1, 1024, 192, 192, 192, 2368]
    - [0, 21.007]
  - - [320, 2368, 1, 1024, 320, 320, 320, 2368]
    - [0, 21.159]
  - - [448, 2368, 1, 1024, 448, 448, 448, 2368]
    - [0, 21.794]
  - - [576, 2368, 1, 1024, 576, 576, 576, 2368]
    - [0, 22.19]
  - - [704, 2368, 1, 1024, 704, 704, 704, 2368]
    - [0, 22.417]
  - - [832, 2368, 1, 1024, 832, 832, 832, 2368]
    - [0, 22.562]
  - - [960, 2368, 1, 1024, 960, 960, 960, 2368]
    - [0, 22.769]
  - - [1088, 2368, 1, 1024, 1088, 1088, 1088, 2368]
    - [0, 22.804]
  - - [1216, 2368, 1, 1024, 1216, 1216, 1216, 2368]
    - [0, 22.954]
  - - [1344, 2368, 1, 1024, 1344, 1344, 1344, 2368]
    - [0, 23.003]
  - - [1472, 2368, 1, 1024, 1472, 1472, 1472, 2368]
    - [0, 23.101]
  - - [1600, 2368, 1, 1024, 1600, 1600, 1600, 2368]
    - [0, 22.744]
  - - [1728, 2368, 1, 1024, 1728, 1728, 1728, 2368]
    - [0, 22.803]
  - - [1856, 2368, 1, 1024, 1856, 1856, 1856, 2368]
    - [0, 22.788]
  - - [1984, 2368, 1, 1024, 1984, 1984, 1984, 2368]
    - [0, 22.95]
  - - [2112, 2368, 1, 1024, 2112, 2112, 2112, 2368]
    - [0, 22.969]
  - - [2240, 2368, 1, 1024, 2240, 2240, 2240, 2368]
    - [0, 23.046]
  - - [2368, 2368, 1, 1024, 2368, 2368, 2368, 2368]
    - [0, 23.057]
  - - [2496, 2368, 1, 1024, 2496, 2496, 2496, 2368]
    - [0, 23.132]
  - - [2624, 2368, 1, 1024, 2624, 2624, 2624, 2368]
    - [0, 23.129]
  - - [2752, 2368, 1, 1024, 2752, 2752, 2752, 2368]
    - [0, 23.16]
  - - [2880, 2368, 1, 1024, 2880, 2880, 2880, 2368]
    - [0, 23.205]
  - - [3008, 2368, 1, 1024, 3008, 3008, 3008, 2368]
    - [0, 23.127]
  - - [3136, 2368, 1, 1024, 3136, 3136, 3136, 2368]
    - [0, 23.199]
  - - [3264, 2368, 1, 1024, 3264, 3264, 3264, 2368]
    - [0, 23.239]
  - - [3392, 2368, 1, 1024, 3392, 3392, 3392, 2368]
    - [0, 23.277]
  - - [3520, 2368, 1, 1024, 3520, 3520, 3520, 2368]
    - [0, 23.197]
  - - [3648, 2368, 1, 1024, 3648, 3648, 3648, 2368]
    - [0, 23.221]
  - - [3776, 2368, 1, 1024, 3776, 3776, 3776, 2368]
    - [0, 23.319]
  - - [3904, 2368, 1, 1024, 3904, 3904, 3904, 2368]
    - [0, 23.294]
  - - [4032, 2368, 1, 1024, 4032, 4032, 4032, 2368]
    - [0, 23.312]
  - - [64, 2496, 1, 1024, 64, 64, 64, 2496]
    - [2, 16.597]
  - - [192, 2496, 1, 1024, 192, 192, 192, 2496]
    - [0, 19.289]
  - - [320, 2496, 1, 1024, 320, 320, 320, 2496]
    - [0, 21.229]
  - - [448, 2496, 1, 1024, 448, 448, 448, 2496]
    - [0, 21.88]
  - - [576, 2496, 1, 1024, 576, 576, 576, 2496]
    - [0, 22.215]
  - - [704, 2496, 1, 1024, 704, 704, 704, 2496]
    - [0, 22.421]
  - - [832, 2496, 1, 1024, 832, 832, 832, 2496]
    - [0, 22.666]
  - - [960, 2496, 1, 1024, 960, 960, 960, 2496]
    - [0, 22.761]
  - - [1088, 2496, 1, 1024, 1088, 1088, 1088, 2496]
    - [0, 22.88]
  - - [1216, 2496, 1, 1024, 1216, 1216, 1216, 2496]
    - [0, 22.99]
  - - [1344, 2496, 1, 1024, 1344, 1344, 1344, 2496]
    - [0, 23.076]
  - - [1472, 2496, 1, 1024, 1472, 1472, 1472, 2496]
    - [0, 23.142]
  - - [1600, 2496, 1, 1024, 1600, 1600, 1600, 2496]
    - [0, 22.774]
  - - [1728, 2496, 1, 1024, 1728, 1728, 1728, 2496]
    - [0, 22.891]
  - - [1856, 2496, 1, 1024, 1856, 1856, 1856, 2496]
    - [0, 22.931]
  - - [1984, 2496, 1, 1024, 1984, 1984, 1984, 2496]
    - [0, 22.964]
  - - [2112, 2496, 1, 1024, 2112, 2112, 2112, 2496]
    - [0, 23.018]
  - - [2240, 2496, 1, 1024, 2240, 2240, 2240, 2496]
    - [0, 23.107]
  - - [2368, 2496, 1, 1024, 2368, 2368, 2368, 2496]
    - [0, 23.075]
  - - [2496, 2496, 1, 1024, 2496, 2496, 2496, 2496]
    - [0, 23.17]
  - - [2624, 2496, 1, 1024, 2624, 2624, 2624, 2496]
    - [0, 23.183]
  - - [2752, 2496, 1, 1024, 2752, 2752, 2752, 2496]
    - [0, 23.208]
  - - [2880, 2496, 1, 1024, 2880, 2880, 2880, 2496]
    - [0, 23.194]
  - - [3008, 2496, 1, 1024, 3008, 3008, 3008, 2496]
    - [0, 23.248]
  - - [3136, 2496, 1, 1024, 3136, 3136, 3136, 2496]
    - [0, 23.239]
  - - [3264, 2496, 1, 1024, 3264, 3264, 3264, 2496]
    - [0, 23.316]
  - - [3392, 2496, 1, 1024, 3392, 3392, 3392, 2496]
    - [0, 23.333]
  - - [3520, 2496, 1, 1024, 3520, 3520, 3520, 2496]
    - [0, 23.338]
  - - [3648, 2496, 1, 1024, 3648, 3648, 3648, 2496]
    - [0, 23.375]
  - - [3776, 2496, 1, 1024, 3776, 3776, 3776, 2496]
    - [0, 23.344]
  - - [3904, 2496, 1, 1024, 3904, 3904, 3904, 2496]
    - [0, 23.309]
  - - [4032, 2496, 1, 1024, 4032, 4032, 4032, 2496]
    - [2, 23.343]
  - - [64, 2624, 1, 1024, 64, 64, 64, 2624]
    - [2, 16.907]
  - - [192, 2624, 1, 1024, 192, 192, 192, 2624]
    - [0, 19.907]
  - - [320, 2624, 1, 1024, 320, 320, 320, 2624]
    - [0, 21.252]
  - - [448, 2624, 1, 1024, 448, 448, 448, 2624]
    - [0, 21.912]
  - - [576, 2624, 1, 1024, 576, 576, 576, 2624]
    - [0, 22.295]
  - - [704, 2624, 1, 1024, 704, 704, 704, 2624]
    - [0, 22.55]
  - - [832, 2624, 1, 1024, 832, 832, 832, 2624]
    - [0, 22.702]
  - - [960, 2624, 1, 1024, 960, 960, 960, 2624]
    - [0, 22.715]
  - - [1088, 2624, 1, 1024, 1088, 1088, 1088, 2624]
    - [0, 22.932]
  - - [1216, 2624, 1, 1024, 1216, 1216, 1216, 2624]
    - [0, 22.995]
  - - [1344, 2624, 1, 1024, 1344, 1344, 1344, 2624]
    - [0, 23.016]
  - - [1472, 2624, 1, 1024, 1472, 1472, 1472, 2624]
    - [0, 22.811]
  - - [1600, 2624, 1, 1024, 1600, 1600, 1600, 2624]
    - [0, 22.868]
  - - [1728, 2624, 1, 1024, 1728, 1728, 1728, 2624]
    - [0, 22.876]
  - - [1856, 2624, 1, 1024, 1856, 1856, 1856, 2624]
    - [0, 22.988]
  - - [1984, 2624, 1, 1024, 1984, 1984, 1984, 2624]
    - [0, 22.972]
  - - [2112, 2624, 1, 1024, 2112, 2112, 2112, 2624]
    - [0, 23.088]
  - - [2240, 2624, 1, 1024, 2240, 2240, 2240, 2624]
    - [0, 23.083]
  - - [2368, 2624, 1, 1024, 2368, 2368, 2368, 2624]
    - [0, 23.136]
  - - [2496, 2624, 1, 1024, 2496, 2496, 2496, 2624]
    - [0, 23.138]
  - - [2624, 2624, 1, 1024, 2624, 2624, 2624, 2624]
    - [0, 23.127]
  - - [2752, 2624, 1, 1024, 2752, 2752, 2752, 2624]
    - [0, 23.177]
  - - [2880, 2624, 1, 1024, 2880, 2880, 2880, 2624]
    - [0, 23.206]
  - - [3008, 2624, 1, 1024, 3008, 3008, 3008, 2624]
    - [0, 23.3]
  - - [3136, 2624, 1, 1024, 3136, 3136, 3136, 2624]
    - [0, 23.289]
  - - [3264, 2624, 1, 1024, 3264, 3264, 3264, 2624]
    - [0, 23.317]
  - - [3392, 2624, 1, 1024, 3392, 3392, 3392, 2624]
    - [0, 23.335]
  - - [3520, 2624, 1, 1024, 3520, 3520, 3520, 2624]
    - [0, 23.346]
  - - [3648, 2624, 1, 1024, 3648, 3648, 3648, 2624]
    - [0, 23.369]
  - - [3776, 2624, 1, 1024, 3776, 3776, 3776, 2624]
    - [0, 23.406]
  - - [3904, 2624, 1, 1024, 3904, 3904, 3904, 2624]
    - [0, 23.393]
  - - [4032, 2624, 1, 1024, 4032, 4032, 4032, 2624]
    - [0, 23.416]
  - - [64, 2752, 1, 1024, 64, 64, 64, 2752]
    - [0, 17.797]
  - - [192, 2752, 1, 1024, 192, 192, 192, 2752]
    - [0, 19.861]
  - - [320, 2752, 1, 1024, 320, 320, 320, 2752]
    - [0, 21.464]
  - - [448, 2752, 1, 1024, 448, 448, 448, 2752]
    - [0, 21.938]
  - - [576, 2752, 1, 1024, 576, 576, 576, 2752]
    - [0, 22.309]
  - - [704, 2752, 1, 1024, 704, 704, 704, 2752]
    - [0, 22.512]
  - - [832, 2752, 1, 1024, 832, 832, 832, 2752]
    - [0, 22.788]
  - - [960, 2752, 1, 1024, 960, 960, 960, 2752]
    - [0, 22.878]
  - - [1088, 2752, 1, 1024, 1088, 1088, 1088, 2752]
    - [0, 22.985]
  - - [1216, 2752, 1, 1024, 1216, 1216, 1216, 2752]
    - [0, 22.984]
  - - [1344, 2752, 1, 1024, 1344, 1344, 1344, 2752]
    - [0, 23.102]
  - - [1472, 2752, 1, 1024, 1472, 1472, 1472, 2752]
    - [0, 22.872]
  - - [1600, 2752, 1, 1024, 1600, 1600, 1600, 2752]
    - [0, 22.948]
  - - [1728, 2752, 1, 1024, 1728, 1728, 1728, 2752]
    - [0, 22.924]
  - - [1856, 2752, 1, 1024, 1856, 1856, 1856, 2752]
    - [0, 22.952]
  - - [1984, 2752, 1, 1024, 1984, 1984, 1984, 2752]
    - [0, 23.025]
  - - [2112, 2752, 1, 1024, 2112, 2112, 2112, 2752]
    - [0, 23.121]
  - - [2240, 2752, 1, 1024, 2240, 2240, 2240, 2752]
    - [0, 23.083]
  - - [2368, 2752, 1, 1024, 2368, 2368, 2368, 2752]
    - [0, 23.164]
  - - [2496, 2752, 1, 1024, 2496, 2496, 2496, 2752]
    - [0, 23.136]
  - - [2624, 2752, 1, 1024, 2624, 2624, 2624, 2752]
    - [0, 23.231]
  - - [2752, 2752, 1, 1024, 2752, 2752, 2752, 2752]
    - [0, 23.233]
  - - [2880, 2752, 1, 1024, 2880, 2880, 2880, 2752]
    - [0, 23.281]
  - - [3008, 2752, 1, 1024, 3008, 3008, 3008, 2752]
    - [0, 23.297]
  - - [3136, 2752, 1, 1024, 3136, 3136, 3136, 2752]
    - [0, 23.329]
  - - [3264, 2752, 1, 1024, 3264, 3264, 3264, 2752]
    - [0, 23.355]
  - - [3392, 2752, 1, 1024, 3392, 3392, 3392, 2752]
    - [0, 23.252]
  - - [3520, 2752, 1, 1024, 3520, 3520, 3520, 2752]
    - [0, 23.384]
  - - [3648, 2752, 1, 1024, 3648, 3648, 3648, 2752]
    - [0, 23.341]
  - - [3776, 2752, 1, 1024, 3776, 3776, 3776, 2752]
    - [0, 23.414]
  - - [3904, 2752, 1, 1024, 3904, 3904, 3904, 2752]
    - [0, 23.294]
  - - [4032, 2752, 1, 1024, 4032, 4032, 4032, 2752]
    - [2, 23.37]
  - - [64, 2880, 1, 1024, 64, 64, 64, 2880]
    - [0, 18.619]
  - - [192, 2880, 1, 1024, 192, 192, 192, 2880]
    - [0, 20.495]
  - - [320, 2880, 1, 1024, 320, 320, 320, 2880]
    - [0, 21.556]
  - - [448, 2880, 1, 1024, 448, 448, 448, 2880]
    - [0, 22.008]
  - - [576, 2880, 1, 1024, 576, 576, 576, 2880]
    - [0, 22.379]
  - - [704, 2880, 1, 1024, 704, 704, 704, 2880]
    - [0, 22.589]
  - - [832, 2880, 1, 1024, 832, 832, 832, 2880]
    - [0, 22.814]
  - - [960, 2880, 1, 1024, 960, 960, 960, 2880]
    - [0, 22.921]
  - - [1088, 2880, 1, 1024, 1088, 1088, 1088, 2880]
    - [0, 23.068]
  - - [1216, 2880, 1, 1024, 1216, 1216, 1216, 2880]
    - [0, 23.08]
  - - [1344, 2880, 1, 1024, 1344, 1344, 1344, 2880]
    - [0, 22.733]
  - - [1472, 2880, 1, 1024, 1472, 1472, 1472, 2880]
    - [0, 22.817]
  - - [1600, 2880, 1, 1024, 1600, 1600, 1600, 2880]
    - [0, 22.933]
  - - [1728, 2880, 1, 1024, 1728, 1728, 1728, 2880]
    - [0, 23.017]
  - - [1856, 2880, 1, 1024, 1856, 1856, 1856, 2880]
    - [0, 23.081]
  - - [1984, 2880, 1, 1024, 1984, 1984, 1984, 2880]
    - [0, 23.068]
  - - [2112, 2880, 1, 1024, 2112, 2112, 2112, 2880]
    - [0, 23.091]
  - - [2240, 2880, 1, 1024, 2240, 2240, 2240, 2880]
    - [0, 23.179]
  - - [2368, 2880, 1, 1024, 2368, 2368, 2368, 2880]
    - [0, 23.208]
  - - [2496, 2880, 1, 1024, 2496, 2496, 2496, 2880]
    - [0, 23.188]
  - - [2624, 2880, 1, 1024, 2624, 2624, 2624, 2880]
    - [0, 23.261]
  - - [2752, 2880, 1, 1024, 2752, 2752, 2752, 2880]
    - [0, 23.199]
  - - [2880, 2880, 1, 1024, 2880, 2880, 2880, 2880]
    - [0, 23.315]
  - - [3008, 2880, 1, 1024, 3008, 3008, 3008, 2880]
    - [0, 23.312]
  - - [3136, 2880, 1, 1024, 3136, 3136, 3136, 2880]
    - [0, 23.354]
  - - [3264, 2880, 1, 1024, 3264, 3264, 3264, 2880]
    - [0, 23.297]
  - - [3392, 2880, 1, 1024, 3392, 3392, 3392, 2880]
    - [0, 23.376]
  - - [3520, 2880, 1, 1024, 3520, 3520, 3520, 2880]
    - [0, 23.407]
  - - [3648, 2880, 1, 1024, 3648, 3648, 3648, 2880]
    - [0, 23.353]
  - - [3776, 2880, 1, 1024, 3776, 3776, 3776, 2880]
    - [0, 23.279]
  - - [3904, 2880, 1, 1024, 3904, 3904, 3904, 2880]
    - [0, 23.356]
  - - [4032, 2880, 1, 1024, 4032, 4032, 4032, 2880]
    - [2, 23.397]
  - - [64, 3008, 1, 1024, 64, 64, 64, 3008]
    - [0, 17.354]
  - - [192, 3008, 1, 1024, 192, 192, 192, 3008]
    - [0, 20.539]
  - - [320, 3008, 1, 1024, 320, 320, 320, 3008]
    - [0, 21.528]
  - - [448, 3008, 1, 1024, 448, 448, 448, 3008]
    - [0, 22.046]
  - - [576, 3008, 1, 1024, 576, 576, 576, 3008]
    - [0, 22.461]
  - - [704, 3008, 1, 1024, 704, 704, 704, 3008]
    - [0, 22.694]
  - - [832, 3008, 1, 1024, 832, 832, 832, 3008]
    - [0, 22.808]
  - - [960, 3008, 1, 1024, 960, 960, 960, 3008]
    - [0, 22.945]
  - - [1088, 3008, 1, 1024, 1088, 1088, 1088, 3008]
    - [0, 22.982]
  - - [1216, 3008, 1, 1024, 1216, 1216, 1216, 3008]
    - [0, 23.114]
  - - [1344, 3008, 1, 1024, 1344, 1344, 1344, 3008]
    - [0, 22.825]
