library/src/amd_detail/rocblaslt/src/Tensile/Logic/asm_full/aquavanjaram/gfx941/Equality/aquavanjaram_Cijk_Ailk_Bljk_HHS_BH_Bias_AH_SDV_SAV.yaml
- {MinimumRequiredVersion: 4.33.0}
- aquavanjaram
- gfx941
- [Device 0049]
    SolutionIndex: 0
    SolutionNameMin: Cijk_Ailk_Bljk_HHS_BH_Bias_AH_SDV_SAV_MT64x16x128_MI16x16x1_SN_GSU8_MIWT1_1_NT3_NTA3_NTB3_NTC3_NTD3_NTM3_SU0_SUS0_WSGRA1_WSGRB0_WGM1
    SolutionIndex: 1
    SolutionNameMin: Cijk_Ailk_Bljk_HHS_BH_Bias_AH_SDV_SAV_MT32x16x128_MI16x16x1_SN_GSU64_MIWT1_1_NT0_NTA0_NTB0_NTC0_NTD0_NTM0_SU0_SUS0_WSGRA0_WSGRB1_WGM4
    SolutionIndex: 2
    SolutionNameMin: Cijk_Ailk_Bljk_HHS_BH_Bias_AH_SDV_SAV_MT16x16x128_MI16x16x1_SN_GSU303_MIWT1_1_NT3_NTA3_NTB3_NTC3_NTD3_NTM3_SU0_SUS0_WSGRA1_WSGRB0_WGM1
    SolutionIndex: 3
    SolutionNameMin: Cijk_Ailk_Bljk_HHS_BH_Bias_AH_SDV_SAV_MT16x64x128_MI16x16x1_SN_GSU4_MIWT1_1_NT0_NTA0_NTB0_NTC0_NTD0_NTM0_SU4_SUS256_WSGRA1_WSGRB1_WGM1
    SolutionIndex: 4
    SolutionNameMin: Cijk_Ailk_Bljk_HHS_BH_Bias_AH_SDV_SAV_MT16x64x128_MI16x16x1_SN_GSU5_MIWT1_1_NT0_NTA0_NTB0_NTC0_NTD0_NTM0_SU0_SUS0_WSGRA0_WSGRB1_WGM110
    SolutionIndex: 5
    SolutionNameMin: Cijk_Ailk_Bljk_HHS_BH_Bias_AH_SDV_SAV_MT16x128x64_MI16x16x1_SN_GSU18_MIWT1_2_NT0_NTA0_NTB0_NTC0_NTD0_NTM0_SU0_SUS0_WSGRA0_WSGRB0_WGM1
    SolutionIndex: 6
    SolutionNameMin: Cijk_Ailk_Bljk_HHS_BH_Bias_AH_SDV_SAV_MT16x64x128_MI16x16x1_SN_GSU1_MIWT1_1_NT0_NTA0_NTB0_NTC0_NTD0_NTM0_SU0_SUS0_WSGRA0_WSGRB0_WGM32
    SolutionIndex: 7
    SolutionNameMin: Cijk_Ailk_Bljk_HHS_BH_Bias_AH_SDV_SAV_MT16x64x64_MI16x16x1_SN_GSU7_MIWT1_1_NT0_NTA0_NTB0_NTC0_NTD0_NTM0_SU0_SUS0_WSGRA1_WSGRB0_WGM16
    SolutionIndex: 8
    SolutionNameMin: Cijk_Ailk_Bljk_HHS_BH_Bias_AH_SDV_SAV_MT16x32x64_MI16x16x1_SN_GSU9_MIWT1_1_NT0_NTA0_NTB0_NTC0_NTD0_NTM0_SU0_SUS0_WSGRA1_WSGRB0_WGM16
    SolutionIndex: 9
    SolutionNameMin: Cijk_Ailk_Bljk_HHS_BH_Bias_AH_SDV_SAV_MT64x16x128_MI16x16x1_SN_GSU2_MIWT1_1_NT0_NTA0_NTB0_NTC0_NTD0_NTM0_SU0_SUS0_WSGRA1_WSGRB0_WGM8
    SolutionIndex: 10
    SolutionNameMin: Cijk_Ailk_Bljk_HHS_BH_Bias_AH_SDV_SAV_MT128x16x64_MI16x16x1_SN_GSU10_MIWT2_1_NT0_NTA0_NTB0_NTC0_NTD0_NTM0_SU0_SUS0_WSGRA0_WSGRB0_WGM8
    SolutionIndex: 11
    SolutionNameMin: Cijk_Ailk_Bljk_HHS_BH_Bias_AH_SDV_SAV_MT128x16x64_MI16x16x1_SN_GSU19_MIWT2_1_NT0_NTA0_NTB0_NTC0_NTD0_NTM0_SU4_SUS128_WSGRA0_WSGRB1_WGM4
    SolutionIndex: 12
    SolutionNameMin: Cijk_Ailk_Bljk_HHS_BH_Bias_AH_SDV_SAV_MT128x64x64_MI16x16x1_SN_GSU1_MIWT4_2_NT0_NTA0_NTB0_NTC0_NTD0_NTM0_SU0_SUS0_WSGRA1_WSGRB1_WGM1
    SolutionIndex: 13
    SolutionNameMin: Cijk_Ailk_Bljk_HHS_BH_Bias_AH_SDV_SAV_MT128x128x64_MI16x16x1_SN_GSU1_MIWT4_4_NT0_NTA0_NTB0_NTC0_NTD0_NTM0_SU0_SUS0_WSGRA1_WSGRB0_WGM8
    SolutionIndex: 14
    SolutionNameMin: Cijk_Ailk_Bljk_HHS_BH_Bias_AH_SDV_SAV_MT128x128x64_MI16x16x1_SN_GSU1_MIWT4_4_NT0_NTA0_NTB0_NTC0_NTD0_NTM0_SU4_SUS256_WSGRA1_WSGRB1_WGM32
    SolutionIndex: 15
    SolutionNameMin: Cijk_Ailk_Bljk_HHS_BH_Bias_AH_SDV_SAV_MT256x64x32_MI16x16x1_SN_GSU1_MIWT4_4_NT0_NTA0_NTB0_NTC0_NTD0_NTM0_SU32_SUS128_WSGRA1_WSGRB0_WGM16
    SolutionIndex: 16
    SolutionNameMin: Cijk_Ailk_Bljk_HHS_BH_Bias_AH_SDV_SAV_MT128x96x64_MI16x16x1_SN_GSU1_MIWT4_3_NT0_NTA0_NTB0_NTC0_NTD0_NTM0_SU4_SUS256_WSGRA1_WSGRB1_WGM1
    SolutionIndex: 17
    SolutionNameMin: Cijk_Ailk_Bljk_HHS_BH_Bias_AH_SDV_SAV_MT128x128x64_MI16x16x1_SN_GSU1_MIWT4_4_NT0_NTA0_NTB0_NTC0_NTD0_NTM0_SU32_SUS256_WSGRA1_WSGRB0_WGM32
    SolutionIndex: 18
    SolutionNameMin: Cijk_Ailk_Bljk_HHS_BH_Bias_AH_SDV_SAV_MT64x16x128_MI16x16x1_SN_GSU1_MIWT1_1_NT0_NTA0_NTB0_NTC0_NTD0_NTM0_SU0_SUS0_WSGRA1_WSGRB1_WGM16
    SolutionIndex: 19
    SolutionNameMin: Cijk_Ailk_Bljk_HHS_BH_Bias_AH_SDV_SAV_MT64x16x128_MI16x16x1_SN_GSU2_MIWT1_1_NT0_NTA0_NTB0_NTC0_NTD0_NTM0_SU0_SUS0_WSGRA0_WSGRB1_WGM1
    SolutionIndex: 20
    SolutionNameMin: Cijk_Ailk_Bljk_HHS_BH_Bias_AH_SDV_SAV_MT128x16x32_MI16x16x1_SN_GSU9_MIWT2_1_NT0_NTA0_NTB0_NTC0_NTD0_NTM0_SU4_SUS128_WSGRA1_WSGRB0_WGM4
    SolutionIndex: 21
    SolutionNameMin: Cijk_Ailk_Bljk_HHS_BH_Bias_AH_SDV_SAV_MT128x128x32_MI16x16x1_SN_GSU1_MIWT4_4_NT0_NTA0_NTB0_NTC0_NTD0_NTM0_SU0_SUS0_WSGRA1_WSGRB1_WGM1
    SolutionIndex: 22
    SolutionNameMin: Cijk_Ailk_Bljk_HHS_BH_Bias_AH_SDV_SAV_MT64x128x64_MI16x16x1_SN_GSU1_MIWT4_2_NT0_NTA0_NTB0_NTC0_NTD0_NTM0_SU0_SUS0_WSGRA0_WSGRB0_WGM32
    SolutionIndex: 23
    SolutionNameMin: Cijk_Ailk_Bljk_HHS_BH_Bias_AH_SDV_SAV_MT128x96x128_MI16x16x1_SN_GSU1_MIWT4_3_NT0_NTA0_NTB0_NTC0_NTD0_NTM0_SU32_SUS256_WSGRA0_WSGRB1_WGM64
    SolutionIndex: 24
    SolutionNameMin: Cijk_Ailk_Bljk_HHS_BH_Bias_AH_SDV_SAV_MT128x128x32_MI16x16x1_SN_GSU1_MIWT4_4_NT0_NTA0_NTB0_NTC0_NTD0_NTM0_SU4_SUS128_WSGRA0_WSGRB0_WGM110
    SolutionIndex: 25
    SolutionNameMin: Cijk_Ailk_Bljk_HHS_BH_Bias_AH_SDV_SAV_MT128x128x64_MI16x16x1_SN_GSU1_MIWT4_4_NT0_NTA0_NTB0_NTC0_NTD0_NTM0_SU4_SUS128_WSGRA0_WSGRB0_WGM1
    SolutionIndex: 26
    SolutionNameMin: Cijk_Ailk_Bljk_HHS_BH_Bias_AH_SDV_SAV_MT128x128x64_MI16x16x1_SN_GSU1_MIWT4_4_NT0_NTA0_NTB0_NTC0_NTD0_NTM0_SU32_SUS128_WSGRA0_WSGRB0_WGM32
    SolutionIndex: 27
    SolutionNameMin: Cijk_Ailk_Bljk_HHS_BH_Bias_AH_SDV_SAV_MT64x32x32_MI32x32x1_SN_GSU8_MIWT1_1_NT3_NTA3_NTB3_NTC3_NTD3_NTM3_SU0_SUS0_WSGRA1_WSGRB1_WGM64
    SolutionIndex: 28
    SolutionNameMin: Cijk_Ailk_Bljk_HHS_BH_Bias_AH_SDV_SAV_MT32x32x128_MI32x32x1_SN_GSU64_MIWT1_1_NT0_NTA0_NTB0_NTC0_NTD0_NTM0_SU0_SUS0_WSGRA0_WSGRB0_WGM16
    SolutionIndex: 29
    SolutionNameMin: Cijk_Ailk_Bljk_HHS_BH_Bias_AH_SDV_SAV_MT32x32x128_MI32x32x1_SN_GSU305_MIWT1_1_NT0_NTA0_NTB0_NTC0_NTD0_NTM0_SU0_SUS0_WSGRA1_WSGRB0_WGM110
    SolutionIndex: 30
    SolutionNameMin: Cijk_Ailk_Bljk_HHS_BH_Bias_AH_SDV_SAV_MT32x64x128_MI32x32x1_SN_GSU3_MIWT1_1_NT3_NTA3_NTB3_NTC3_NTD3_NTM3_SU0_SUS0_WSGRA1_WSGRB0_WGM1
    SolutionIndex: 31
    SolutionNameMin: Cijk_Ailk_Bljk_HHS_BH_Bias_AH_SDV_SAV_MT32x128x64_MI32x32x1_SN_GSU10_MIWT1_1_NT3_NTA3_NTB3_NTC3_NTD3_NTM3_SU0_SUS0_WSGRA1_WSGRB0_WGM8
    SolutionIndex: 32
    SolutionNameMin: Cijk_Ailk_Bljk_HHS_BH_Bias_AH_SDV_SAV_MT32x128x64_MI32x32x1_SN_GSU19_MIWT1_1_NT0_NTA0_NTB0_NTC0_NTD0_NTM0_SU32_SUS128_WSGRA1_WSGRB0_WGM16
    SolutionIndex: 33
    SolutionNameMin: Cijk_Ailk_Bljk_HHS_BH_Bias_AH_SDV_SAV_MT32x64x128_MI32x32x1_SN_GSU1_MIWT1_1_NT0_NTA0_NTB0_NTC0_NTD0_NTM0_SU0_SUS0_WSGRA0_WSGRB0_WGM16
    SolutionIndex: 34
    SolutionNameMin: Cijk_Ailk_Bljk_HHS_BH_Bias_AH_SDV_SAV_MT32x256x64_MI32x32x1_SN_GSU7_MIWT1_2_NT0_NTA0_NTB0_NTC0_NTD0_NTM0_SU0_SUS0_WSGRA0_WSGRB1_WGM110
    SolutionIndex: 35
    SolutionNameMin: Cijk_Ailk_Bljk_HHS_BH_Bias_AH_SDV_SAV_MT32x128x128_MI32x32x1_SN_GSU4_MIWT1_1_NT0_NTA0_NTB0_NTC0_NTD0_NTM0_SU0_SUS0_WSGRA1_WSGRB0_WGM16
    SolutionIndex: 36
    SolutionNameMin: Cijk_Ailk_Bljk_HHS_BH_Bias_AH_SDV_SAV_MT64x32x128_MI32x32x1_SN_GSU3_MIWT1_1_NT0_NTA0_NTB0_NTC0_NTD0_NTM0_SU0_SUS0_WSGRA1_WSGRB1_WGM1
    SolutionIndex: 37
    SolutionNameMin: Cijk_Ailk_Bljk_HHS_BH_Bias_AH_SDV_SAV_MT64x32x64_MI32x32x1_SN_GSU19_MIWT1_1_NT0_NTA0_NTB0_NTC0_NTD0_NTM0_SU0_SUS0_WSGRA0_WSGRB1_WGM110
    SolutionIndex: 38
    SolutionNameMin: Cijk_Ailk_Bljk_HHS_BH_Bias_AH_SDV_SAV_MT128x32x64_MI32x32x1_SN_GSU19_MIWT1_1_NT0_NTA0_NTB0_NTC0_NTD0_NTM0_SU0_SUS0_WSGRA1_WSGRB1_WGM16
    SolutionIndex: 39
    SolutionNameMin: Cijk_Ailk_Bljk_HHS_BH_Bias_AH_SDV_SAV_MT128x128x64_MI32x32x1_SN_GSU1_MIWT2_2_NT0_NTA0_NTB0_NTC0_NTD0_NTM0_SU0_SUS0_WSGRA0_WSGRB0_WGM32
    SolutionIndex: 40
    SolutionNameMin: Cijk_Ailk_Bljk_HHS_BH_Bias_AH_SDV_SAV_MT128x128x64_MI32x32x1_SN_GSU1_MIWT2_2_NT0_NTA0_NTB0_NTC0_NTD0_NTM0_SU4_SUS128_WSGRA0_WSGRB0_WGM8
    SolutionIndex: 41
    SolutionNameMin: Cijk_Ailk_Bljk_HHS_BH_Bias_AH_SDV_SAV_MT128x128x64_MI32x32x1_SN_GSU1_MIWT2_2_NT0_NTA0_NTB0_NTC0_NTD0_NTM0_SU32_SUS256_WSGRA1_WSGRB1_WGM32
    SolutionIndex: 42
    SolutionNameMin: Cijk_Ailk_Bljk_HHS_BH_Bias_AH_SDV_SAV_MT256x128x32_MI32x32x1_SN_GSU1_MIWT4_2_NT0_NTA0_NTB0_NTC0_NTD0_NTM0_SU4_SUS256_WSGRA0_WSGRB0_WGM16
    SolutionIndex: 43
    SolutionNameMin: Cijk_Ailk_Bljk_HHS_BH_Bias_AH_SDV_SAV_MT256x128x32_MI32x32x1_SN_GSU1_MIWT4_2_NT0_NTA0_NTB0_NTC0_NTD0_NTM0_SU4_SUS128_WSGRA0_WSGRB0_WGM32
    SolutionIndex: 44
    SolutionNameMin: Cijk_Ailk_Bljk_HHS_BH_Bias_AH_SDV_SAV_MT256x128x32_MI32x32x1_SN_GSU1_MIWT4_4_NT0_NTA0_NTB0_NTC0_NTD0_NTM0_SU0_SUS0_WSGRA0_WSGRB0_WGM8
    SolutionIndex: 45
    SolutionNameMin: Cijk_Ailk_Bljk_HHS_BH_Bias_AH_SDV_SAV_MT64x32x128_MI32x32x1_SN_GSU1_MIWT1_1_NT0_NTA0_NTB0_NTC0_NTD0_NTM0_SU0_SUS0_WSGRA1_WSGRB1_WGM1
    SolutionIndex: 46
    SolutionNameMin: Cijk_Ailk_Bljk_HHS_BH_Bias_AH_SDV_SAV_MT128x32x64_MI32x32x1_SN_GSU4_MIWT1_1_NT0_NTA0_NTB0_NTC0_NTD0_NTM0_SU0_SUS0_WSGRA0_WSGRB0_WGM64
    SolutionIndex: 47
    SolutionNameMin: Cijk_Ailk_Bljk_HHS_BH_Bias_AH_SDV_SAV_MT128x32x32_MI32x32x1_SN_GSU14_MIWT1_1_NT0_NTA0_NTB0_NTC0_NTD0_NTM0_SU4_SUS256_WSGRA0_WSGRB1_WGM8
    SolutionIndex: 48
    SolutionNameMin: Cijk_Ailk_Bljk_HHS_BH_Bias_AH_SDV_SAV_MT256x128x32_MI32x32x1_SN_GSU1_MIWT4_2_NT0_NTA0_NTB0_NTC0_NTD0_NTM0_SU32_SUS128_WSGRA0_WSGRB0_WGM16
    SolutionIndex: 49
    SolutionNameMin: Cijk_Ailk_Bljk_HHS_BH_Bias_AH_SDV_SAV_MT128x256x32_MI32x32x1_SN_GSU1_MIWT2_4_NT0_NTA0_NTB0_NTC0_NTD0_NTM0_SU32_SUS128_WSGRA0_WSGRB0_WGM8
    SolutionIndex: 50
    SolutionNameMin: Cijk_Ailk_Bljk_HHS_BH_Bias_AH_SDV_SAV_MT256x128x32_MI32x32x1_SN_GSU1_MIWT4_4_NT0_NTA0_NTB0_NTC0_NTD0_NTM0_SU0_SUS0_WSGRA1_WSGRB1_WGM1
    SolutionIndex: 51
    SolutionNameMin: Cijk_Ailk_Bljk_HHS_BH_Bias_AH_SDV_SAV_MT256x128x32_MI32x32x1_SN_GSU1_MIWT4_2_NT0_NTA0_NTB0_NTC0_NTD0_NTM0_SU4_SUS256_WSGRA0_WSGRB0_WGM64
    SolutionIndex: 52
    SolutionNameMin: Cijk_Ailk_Bljk_HHS_BH_Bias_AH_SDV_SAV_MT128x256x32_MI32x32x1_SN_GSU1_MIWT4_2_NT0_NTA0_NTB0_NTC0_NTD0_NTM0_SU4_SUS128_WSGRA0_WSGRB0_WGM8
    SolutionIndex: 53
    SolutionNameMin: Cijk_Ailk_Bljk_HHS_BH_Bias_AH_SDV_SAV_MT256x192x64_MI32x32x1_SN_GSU1_MIWT4_3_NT0_NTA0_NTB0_NTC0_NTD0_NTM0_SU4_SUS256_WSGRA0_WSGRB1_WGM1
- - - [16, 16, 1, 1024]
    # - [27, 31.966]
    - [0, 35.0239]
  - - [16, 16, 1, 8192]
    # - [28, 237.242]
    - [1, 250.715]
  - - [16, 16, 1, 65536]
    # - [29, 1102.5]
    - [2, 1169.51]
  - - [16, 2048, 1, 1024]
    # - [30, 2886.02]
    - [3, 3116.24]
  - - [16, 2048, 1, 8192]
    # - [31, 16126.7]
    - [4, 16743.3]
  - - [16, 2048, 1, 65536]
    # - [32, 45144.2]
    - [5, 46331.5]
  - - [16, 8192, 1, 1024]
    # - [33, 11780.1]
    - [6, 14044.5]
  - - [16, 8192, 1, 8192]
    - [34, 32630.7]
    # - [7, 31810.0]
  - - [16, 8192, 1, 65536]
    # - [35, 47746.2]
    - [8, 49039.0]
  - - [2048, 16, 1, 1024]
    # - [36, 2854.11]
    - [9, 3149.89]
  - - [2048, 16, 1, 8192]
    # - [37, 15734.4]
    - [10, 16922.7]
  - - [2048, 16, 1, 65536]
    - [38, 45836.0]
    # - [11, 45795.0]
  - - [2048, 2048, 1, 1024]
    # - [39, 190075.0]
    - [12, 201110.0]
  - - [2048, 2048, 1, 8192]
    - [40, 333757.0]
    # - [13, 315339.0]
  - - [2048, 2048, 1, 65536]
    - [41, 297807.0]
    # - [14, 287624.0]
  - - [2048, 8192, 1, 1024]
    - [42, 333407.0]
    # - [15, 293571.0]
  - - [2048, 8192, 1, 8192]
    - [43, 441572.0]
    # - [16, 401810.0]
  - - [2048, 8192, 1, 65536]
    - [44, 439069.0]
    # - [17, 313580.0]
  - - [8192, 16, 1, 1024]
    # - [45, 11259.3]
    - [18, 13464.0]
  - - [8192, 16, 1, 8192]
    - [46, 32843.3]
    # - [19, 32623.8]
  - - [8192, 16, 1, 65536]
    - [47, 51368.5]
    # - [20, 48024.6]
  - - [8192, 2048, 1, 1024]
    - [48, 333401.0]
    # - [21, 290427.0]
  - - [8192, 2048, 1, 8192]
    - [49, 433151.0]
    # - [22, 357444.0]
  - - [8192, 2048, 1, 65536]
    - [50, 438425.0]
    # - [23, 304254.0]
  - - [8192, 8192, 1, 1024]
    - [51, 412857.0]
    # - [24, 389204.0]
  - - [8192, 8192, 1, 8192]
    - [52, 436638.0]
    # - [25, 347170.0]
  - - [8192, 8192, 1, 65536]
    - [53, 447710.0]
    # - [26, 336013.0]
- null
- null
- DeviceEfficiency
- null
- Equality
