library/src/amd_detail/rocblaslt/src/Tensile/Logic/asm_full/aquavanjaram/gfx941/Equality/aquavanjaram_Cijk_Ailk_Bljk_F8H_HHS_BH.yaml
- {MinimumRequiredVersion: 4.33.0}
- aquavanjaram
- gfx941
- [Device 0049]
    SolutionIndex: 0
    SolutionNameMin: Cijk_Ailk_Bljk_HHS_BH_MT32x16x64_MI16x16x16x1_SN_GRVW8_GSU6_MIWT1_1_SU0_SUS0_SRVW0_SVW4_VW8_WG32_4_1_WGM1
    SolutionIndex: 1
    SolutionNameMin: Cijk_Ailk_Bljk_HHS_BH_MT64x16x64_MI16x16x16x1_SN_GRVW2_GSU6_MIWT1_1_SU0_SUS0_SRVW0_SVW4_VW2_WG64_4_1_WGM1
    SolutionIndex: 2
    SolutionNameMin: Cijk_Ailk_Bljk_HHS_BH_MT128x128x32_MI32x32x8x1_SN_1LDSB0_GRVW8_LPB8_LRVW8_MIWT2_2_NEPBS0_NLCA1_PLR5_SS0_SU4_SUS128_SRVW4_SVW4_VW1_WG64_4_1_WGM21
    SolutionIndex: 3
    SolutionNameMin: Cijk_Ailk_Bljk_HHS_BH_MT128x128x32_MI32x32x8x1_SN_1LDSB0_GRVW8_LPB8_LRVW8_MIWT2_2_NEPBS2_NLCA1_PLR5_SS0_SU4_SUS256_SRVW4_SVW4_VW2_WG64_4_1_WGM15
    SolutionIndex: 4
    SolutionNameMin: Cijk_Ailk_Bljk_HHS_BH_MT64x16x64_MI16x16x16x1_SN_GRVW8_GSU1_LPB16_LRVW8_MIWT1_1_PLR5_SU0_SUS0_SVW4_VW2_WG64_4_1_WGM1
    SolutionIndex: 5
    SolutionNameMin: Cijk_Ailk_Bljk_HHS_BH_MT64x16x64_MI16x16x16x1_SN_GRVW4_GSU1_LPB16_LRVW8_MIWT1_1_PLR5_SU0_SUS0_SVW4_VW8_WG64_4_1_WGM1
    SolutionIndex: 6
    SolutionNameMin: Cijk_Ailk_Bljk_HHS_BH_MT256x128x32_MI32x32x8x1_SN_1LDSB1_GRVW8_LPB8_LRVW8_MIWT4_2_NEPBS2_NLCA1_PLR5_SS1_SU0_SUS0_SRVW0_SVW4_VW4_WG64_4_1_WGM1
    SolutionIndex: 7
    SolutionNameMin: Cijk_Ailk_Bljk_HHS_BH_MT256x128x32_MI32x32x8x1_SN_1LDSB1_GRVW8_LPB8_LRVW8_MIWT4_2_NEPBS2_NLCA1_PLR5_SS1_SU0_SUS0_SRVW0_SVW2_VW2_WG64_4_1_WGM1
    SolutionIndex: 8
    SolutionNameMin: Cijk_Ailk_Bljk_HHS_BH_MT32x16x64_MI16x16x16x1_SN_GRVW8_GSU12_LPB16_LRVW8_MIWT1_1_PLR5_SU0_SUS0_SVW2_VW8_WG32_4_1_WGM8
    SolutionIndex: 9
    SolutionNameMin: Cijk_Ailk_Bljk_HHS_BH_MT16x16x64_MI16x16x16x1_SN_GRVW8_GSU12_LPB16_LRVW8_MIWT1_1_PLR5_SU0_SUS0_SVW4_VW8_WG16_4_1_WGM1
    SolutionIndex: 10
    SolutionNameMin: Cijk_Ailk_Bljk_HHS_BH_MT16x32x64_MI16x16x16x1_SN_GRVW2_GSU7_LPB4_LRVW4_MIWT1_1_PLR5_SU32_SUS128_SVW4_VW2_WG16_8_1_WGM1
    SolutionIndex: 11
    SolutionNameMin: Cijk_Ailk_Bljk_HHS_BH_MT16x32x64_MI16x16x16x1_SN_GRVW2_GSU7_LPB4_LRVW4_MIWT1_1_PLR5_SU0_SUS0_SVW2_VW2_WG16_8_1_WGM1
    SolutionIndex: 12
    SolutionNameMin: Cijk_Ailk_Bljk_HHS_BH_MT64x16x64_MI16x16x16x1_SN_GRVW8_GSU9_LPB16_LRVW8_MIWT1_1_PLR5_SU0_SUS0_SVW4_VW4_WG64_4_1_WGM8
    SolutionIndex: 13
    SolutionNameMin: Cijk_Ailk_Bljk_HHS_BH_MT64x16x64_MI16x16x16x1_SN_GRVW2_GSU9_MIWT1_1_SU0_SUS0_SRVW0_SVW4_VW4_WG64_4_1_WGM15
    SolutionIndex: 14
    SolutionNameMin: Cijk_Ailk_Bljk_HHS_BH_MT128x96x64_MI32x32x8x1_SN_1LDSB0_GRVW8_LPB8_LRVW8_MIWT1_3_NEPBS0_NLCA1_PLR9_SS0_SU4_SUS128_SRVW4_SVW4_VW1_WG128_2_1_WGM21
    SolutionIndex: 15
    SolutionNameMin: Cijk_Ailk_Bljk_HHS_BH_MT128x96x64_MI32x32x8x1_SE_1LDSB0_AF0EM8_EPS0_GRVW8_GSU1_GSUAMB_LBSPP128_LPB8_LRVW8_NLCA1_PGR2_PLR9_SU0_SUS0_SRVW4_TT1_96_TLDS1_VAW2_WSGRA1_WSGRB1_WG128_2_1_WGM15
    SolutionIndex: 16
    SolutionNameMin: Cijk_Ailk_Bljk_HHS_BH_MT64x16x64_MI16x16x16x1_SN_GRVW2_GSU1_LPB16_LRVW8_MIWT1_1_PLR5_SU0_SUS0_SVW4_VW2_WG64_4_1_WGM1
    SolutionIndex: 17
    SolutionNameMin: Cijk_Ailk_Bljk_HHS_BH_MT256x128x32_MI32x32x8x1_SN_1LDSB1_GRVW8_LPB8_LRVW8_MIWT4_2_NEPBS2_NLCA1_PLR5_SS1_SU0_SUS0_SRVW0_SVW2_VW2_WG64_4_1_WGM15
    SolutionIndex: 18
    SolutionNameMin: Cijk_Ailk_Bljk_HHS_BH_MT256x128x32_MI32x32x8x1_SN_1LDSB1_GRVW8_LPB8_LRVW8_MIWT4_2_NEPBS2_NLCA1_PLR5_SS1_SU0_SUS0_SRVW0_SVW1_VW1_WG64_4_1_WGM1
    SolutionIndex: 19
    SolutionNameMin: Cijk_Ailk_Bljk_HHS_BH_MT64x16x64_MI16x16x16x1_SN_GRVW8_GSU9_MIWT2_1_NEPBS0_SPO1_VW2_WGM1
    SolutionIndex: 20
    SolutionNameMin: Cijk_Ailk_Bljk_HHS_BH_MT64x16x64_MI16x16x16x1_SN_GRVW8_GSU9_MIWT2_1_NEPBS2_SPO0_VW8_WGM21
    SolutionIndex: 21
    SolutionNameMin: Cijk_Ailk_Bljk_HHS_BH_MT64x48x64_MI16x16x16x1_SN_1LDSB1_GRVW8_GSU1_MIWT2_3_NEPBS0_SPO1_VW8_WGM1
    SolutionIndex: 22
    SolutionNameMin: Cijk_Ailk_Bljk_HHS_BH_MT64x64x64_MI16x16x16x1_SN_1LDSB1_GRVW8_GSU1_MIWT2_4_NEPBS0_SPO1_VW1_WGM1
    SolutionIndex: 23
    SolutionNameMin: Cijk_Ailk_Bljk_HHS_BH_MT96x16x64_MI16x16x16x1_SN_GRVW8_GSU6_MIWT3_1_NEPBS0_SU0_SUS0_SPO0_VW4_WGM1
    SolutionIndex: 24
    SolutionNameMin: Cijk_Ailk_Bljk_HHS_BH_MT64x16x64_MI16x16x16x1_SN_GRVW8_GSU6_MIWT2_1_NEPBS0_SU0_SUS0_SPO0_VW1_WGM1
    SolutionIndex: 25
    SolutionNameMin: Cijk_Ailk_Bljk_HHS_BH_MT128x64x32_MI32x32x8x1_SN_1LDSB0_GRVW8_GSU1_MIWT2_2_NEPBS0_SU4_SUS128_SPO1_VW8_WGM1
    SolutionIndex: 26
    SolutionNameMin: Cijk_Ailk_Bljk_HHS_BH_MT128x64x32_MI32x32x8x1_SN_1LDSB0_GRVW8_GSU1_MIWT2_2_NEPBS0_SU4_SUS256_SPO1_VW4_WGM1
    SolutionIndex: 27
    SolutionNameMin: Cijk_Ailk_Bljk_HHS_BH_MT32x16x64_MI16x16x16x1_SN_GRVW8_GSU1_MIWT1_1_NEPBS0_SPO1_VW1_WG32_4_1_WGM15
    SolutionIndex: 28
    SolutionNameMin: Cijk_Ailk_Bljk_HHS_BH_MT64x16x64_MI16x16x16x1_SN_GRVW8_GSU1_MIWT2_1_NEPBS2_SPO0_VW1_WG32_4_1_WGM1
    SolutionIndex: 29
    SolutionNameMin: Cijk_Ailk_Bljk_HHS_BH_MT32x16x64_MI16x16x16x1_SN_GRVW2_GSU1_MIWT1_1_NEPBS2_SPO1_VW4_WG32_4_1_WGM19
    SolutionIndex: 30
    SolutionNameMin: Cijk_Ailk_Bljk_HHS_BH_MT64x16x64_MI16x16x16x1_SN_GRVW8_GSU1_MIWT2_1_NEPBS0_SPO1_VW4_WG32_4_1_WGM15
    SolutionIndex: 31
    SolutionNameMin: Cijk_Ailk_Bljk_HHS_BH_MT16x16x64_MI16x16x16x1_SN_GRVW8_GSU8_MIWT1_1_NEPBS2_SU0_SUS0_SPO1_VW8_WGM1
    SolutionIndex: 32
    SolutionNameMin: Cijk_Ailk_Bljk_HHS_BH_MT16x16x64_MI16x16x16x1_SN_GRVW8_GSU8_MIWT1_1_NEPBS0_SU0_SUS0_SPO0_VW4_WGM1
    SolutionIndex: 33
    SolutionNameMin: Cijk_Ailk_Bljk_HHS_BH_MT32x16x64_MI16x16x16x1_SN_GRVW4_GSU8_MIWT1_1_NEPBS2_SU0_SUS0_SPO0_VW8_WGM1
    SolutionIndex: 34
    SolutionNameMin: Cijk_Ailk_Bljk_HHS_BH_MT32x48x64_MI16x16x16x1_SN_1LDSB0_GRVW8_GSU12_MIWT2_3_NEPBS2_SU32_SUS256_SPO1_VW2_WG16_4_1_WGM8
    SolutionIndex: 35
    SolutionNameMin: Cijk_Ailk_Bljk_HHS_BH_MT256x128x32_MI32x32x8x1_SN_1LDSB1_AF0EM8_GRVW8_LPB8_LRVW8_MIWT4_2_NEPBS0_NLCA1_PLR5_SS1_SU0_SUS0_SPO1_SVW2_WSGRA1_WSGRB0
    SolutionIndex: 36
    SolutionNameMin: Cijk_Ailk_Bljk_HHS_BH_MT256x128x32_MI32x32x8x1_SN_1LDSB1_AF0EM8_GRVW8_LPB8_LRVW8_MIWT4_2_NEPBS2_NLCA1_PLR5_SS1_SU0_SUS0_SPO1_SVW2_WSGRA1_WSGRB0
    SolutionIndex: 37
    SolutionNameMin: Cijk_Ailk_Bljk_HHS_BH_MT64x16x128_MI16x16x1_SN_GSU1_MIWT1_1_NTA2_NTB1_SU0_SUS0_WSGRA0_WSGRB1_WGM16
    SolutionIndex: 38
    SolutionNameMin: Cijk_Ailk_Bljk_HHS_BH_MT128x32x16_MI32x32x1_SN_GSU14_MIWT1_1_NTA0_NTB1_SU0_SUS0_WSGRA0_WSGRB0_WGM56
    SolutionIndex: 39
    SolutionNameMin: Cijk_Ailk_Bljk_HHS_BH_MT64x16x64_MI16x16x1_SN_GSU4_MIWT1_1_NTA0_NTB1_SU0_SUS0_WSGRA0_WSGRB1_WGM1
    SolutionIndex: 40
    SolutionNameMin: Cijk_Ailk_Bljk_HHS_BH_MT128x16x64_MI16x16x1_SN_GSU19_MIWT2_1_NTA1_NTB0_SU4_SUS256_WSGRA1_WSGRB1_WGM1
    SolutionIndex: 41
    SolutionNameMin: Cijk_Ailk_Bljk_HHS_BH_MT32x16x128_MI16x16x1_SN_GSU8_MIWT1_1_NT0_NTA0_NTB0_NTC0_NTD0_NTM0_SU0_SUS0_WSGRA1_WSGRB1_WGM110
    SolutionIndex: 42
    SolutionNameMin: Cijk_Ailk_Bljk_HHS_BH_MT16x64x128_MI16x16x1_SN_GSU2_MIWT1_1_NTA0_NTB0_SU0_SUS0_WSGRA1_WSGRB1_WGM1
    SolutionIndex: 43
    SolutionNameMin: Cijk_Ailk_Bljk_HHS_BH_MT16x64x128_MI16x16x1_SN_GSU1_MIWT1_1_NTA1_NTB2_SU0_SUS0_WSGRA0_WSGRB1_WGM1
    SolutionIndex: 44
    SolutionNameMin: Cijk_Ailk_Bljk_HHS_BH_MT128x128x64_MI32x32x1_SN_GSU1_MIWT2_2_NT0_NTA0_NTB0_NTC0_NTD0_NTM0_SU0_SUS0_WSGRA1_WSGRB0_WGM4
    SolutionIndex: 45
    SolutionNameMin: Cijk_Ailk_Bljk_HHS_BH_MT256x128x32_MI32x32x1_SN_GSU1_MIWT4_2_NTA1_NTB1_SU0_SUS0_WSGRA0_WSGRB1_WGM24
    SolutionIndex: 46
    SolutionNameMin: Cijk_Ailk_Bljk_HHS_BH_MT256x128x32_MI32x32x1_SN_GSU1_MIWT4_4_NTA0_NTB1_SU0_SUS0_WSGRA1_WSGRB1_WGM1
    SolutionIndex: 47
    SolutionNameMin: Cijk_Ailk_Bljk_HHS_BH_MT16x32x128_MI16x16x1_SN_LDSB0_GSU24_LBSPPB256_LWPM0p40_MIWT1_1_NTB1_NEPBS0_SPO0_SSO0_WSGRB1_WG16_8_1
    SolutionIndex: 48
    SolutionNameMin: Cijk_Ailk_Bljk_HHS_BH_MT16x16x128_MI16x16x1_SN_LDSB0_GSU62_LBSPPB256_LWPM0p40_MIWT1_1_NTB0_NEPBS16_SPO0_SSO2_WSGRB1_WG16_4_1
    SolutionIndex: 49
    SolutionNameMin: Cijk_Ailk_Bljk_HHS_BH_MT16x128x128_MI16x16x1_SN_LDSB1_GSU8_LBSPPB256_LWPM0p40_MIWT1_4_NTB0_NEPBS0_SPO1_SSO2_WSGRB1_WG16_8_1
    SolutionIndex: 50
    SolutionNameMin: Cijk_Ailk_Bljk_HHS_BH_MT16x64x128_MI16x16x1_SN_LDSB0_GSU8_LBSPPB256_LWPMn1_MIWT1_1_NTB1_NEPBS16_SPO1_SSO2_WSGRB1_WG16_16_1
    SolutionIndex: 51
    SolutionNameMin: Cijk_Ailk_Bljk_HHS_BH_MT16x16x64_MI16x16x1_SN_LDSB0_GSU1_LBSPPB128_LWPMn1_MIWT1_1_NTB0_NEPBS0_SPO0_SSO0_WSGRB0_WG16_4_1
    SolutionIndex: 52
    SolutionNameMin: Cijk_Ailk_Bljk_HHS_BH_MT16x128x128_MI16x16x1_SN_LDSB1_GSU9_LBSPPB256_LWPM0p40_MIWT1_4_NTB1_NEPBS16_SPO1_SSO2_WSGRB1_WG16_8_1
    SolutionIndex: 53
    SolutionNameMin: Cijk_Ailk_Bljk_HHS_BH_MT64x16x64_MI16x16x1_SN_GRVWB4_GSU7_LBSPPA512_LPB4_LRVW4_LWPM0p45_MIWT1_1_NTA0_NEPBS0_SPO0_SSO0_SVW1_VWA1_WG64_4_1
    SolutionIndex: 54
    SolutionNameMin: Cijk_Ailk_Bljk_HHS_BH_MT64x16x64_MI16x16x1_SN_GRVWB4_GSU1_LBSPPA512_LPB4_LRVW4_LWPMn1_MIWT1_1_NTA0_NEPBS0_SPO0_SSO0_SVW1_VWA1_WG64_4_1
    SolutionIndex: 55
    SolutionNameMin: Cijk_Ailk_Bljk_HHS_BH_MT256x128x64_MI32x32x1_SN_GSU1_LWPM0p45_MIWT2_4_NTD1_SUS256_SPO0_SSO2_SVW2_VWA2_WSGRB0_WG128_2_1_WGM1
    SolutionIndex: 56
    SolutionNameMin: Cijk_Ailk_Bljk_HHS_BH_MT256x128x32_MI32x32x1_SN_GSU1_LWPM0p40_MIWT2_4_NTD1_SUS128_SPO0_SSO2_SVW2_VWA2_WSGRB1_WG128_2_1_WGM1
    SolutionIndex: 57
    SolutionNameMin: Cijk_Ailk_Bljk_HHS_BH_MT128x128x64_MI32x32x1_SN_GRVWB8_GSU1_LBSPPA0_LPA0_LPB8_LWPMn1_MIWT2_2_NTD1_NEPBS0_SU4_SUS256_SPO0_SSO0
    SolutionIndex: 58
    SolutionNameMin: Cijk_Ailk_Bljk_HHS_BH_MT256x128x64_MI32x32x1_SN_GSU2_LWPM0p40_MIAV0_MIWT2_4_NEPBS0_SUS256_SPO1_SSO0_WSGRB1_WGM32
    SolutionIndex: 59
    SolutionNameMin: Cijk_Ailk_Bljk_HHS_BH_MT256x128x64_MI32x32x1_SN_GSU1_LWPM0p40_MIAV0_MIWT2_4_NEPBS0_SUS512_SPO1_SSO2_WSGRB0_WGM32
    SolutionIndex: 60
    SolutionNameMin: Cijk_Ailk_Bljk_HHS_BH_MT256x240x32_MI16x16x1_SN_GRVWA2_GSU1_LWPMn1_MIWT4_15_NEPBS0_NLCA2_SUS256_SPO0_SSO0_WSGRB1_WGM32
    SolutionIndex: 61
    SolutionNameMin: Cijk_Ailk_Bljk_HHS_BH_MT256x128x64_MI32x32x1_SN_GSU1_LWPMn1_MIAV0_MIWT2_4_NEPBS0_SUS512_SPO1_SSO0_WSGRB1_WGM1
    SolutionIndex: 62
    SolutionNameMin: Cijk_Ailk_Bljk_HHS_BH_MT256x144x64_MI16x16x1_SN_LDSB1_GRVWB4_GSU1_LWPMn1_MIAV0_MIWT4_9_NEPBS0_SUS256_SPO0_SSO2_WSGRB0_WGM1
    SolutionIndex: 63
    SolutionNameMin: Cijk_Ailk_Bljk_HHS_BH_MT256x144x64_MI16x16x1_SN_LDSB1_GRVWB2_GSU1_LWPMn1_MIAV0_MIWT4_9_NEPBS0_SUS256_SPO0_SSO0_WSGRB1_WGM1
- - - [1104, 1, 1, 4608]
    - [0, 675.057]
  - - [1104, 16, 1, 4608]
    - [1, 7016.87]
  - - [1104, 1335, 1, 4608]
    - [2, 110165.0]
  - - [1104, 1408, 1, 4608]
    - [3, 112807.0]
  - - [4608, 1, 1, 320]
    - [4, 526.629]
  - - [4608, 16, 1, 320]
    - [5, 8307.38]
  - - [4608, 1335, 1, 320]
    - [6, 100109.0]
  - - [4608, 1408, 1, 320]
    - [7, 108315.0]
  - - [16, 1, 1, 4608]
    - [8, 15.3855]
  - - [16, 16, 1, 4608]
    - [9, 240.548]
  - - [16, 1335, 1, 4608]
    - [10, 7694.41]
  - - [16, 1408, 1, 4608]
    - [11, 7774.79]
  - - [768, 1, 1, 4608]
    - [12, 564.966]
  - - [768, 16, 1, 4608]
    - [13, 6325.19]
  - - [768, 1335, 1, 4608]
    - [14, 110261.0]
  - - [768, 1408, 1, 4608]
    - [15, 97011.9]
  - - [4608, 1, 1, 768]
    - [4, 739.746]
  - - [4608, 16, 1, 768]
    - [16, 11452.9]
  - - [4608, 1335, 1, 768]
    - [17, 118018.0]
  - - [4608, 1408, 1, 768]
    - [18, 125931.0]
  - - [1536, 1, 1, 4608]
    - [19, 889.853]
  - - [1536, 16, 1, 4608]
    - [20, 10020.0]
  - - [1536, 1335, 1, 4608]
    - [21, 197586.0]
  - - [1536, 1408, 1, 4608]
    - [22, 185561.0]
  - - [2208, 1, 1, 4608]
    - [23, 1011.58]
  - - [2208, 16, 1, 4608]
    - [24, 11407.9]
  - - [2208, 1335, 1, 4608]
    - [25, 226457.0]
  - - [2208, 1408, 1, 4608]
    - [26, 239760.0]
  - - [9216, 1, 1, 320]
    - [27, 829.476]
  - - [9216, 1, 1, 768]
    - [28, 1285.39]
  - - [9216, 16, 1, 320]
    - [29, 12111.5]
  - - [9216, 16, 1, 768]
    - [30, 19963.5]
  - - [9216, 1335, 1, 320]
    - [35, 264761.0]
  - - [9216, 1408, 1, 320]
    - [36, 301046.0]
  - - [9216, 1335, 1, 768]
    - [35, 334475.0]
  - - [32, 1, 1, 4608]
    - [31, 22.2404]
  - - [32, 16, 1, 4608]
    - [32, 339.048]
  - - [32, 1335, 1, 4608]
    - [33, 14994.9]
  - - [32, 1408, 1, 4608]
    - [34, 14729.4]
  - - [9216, 1408, 1, 768]
    - [36, 368290.0]
  - - [16, 16, 1, 1024]
    - [41, 0.0]
  - - [16, 16, 1, 8192]
    - [47, 0.0]
  - - [16, 16, 1, 65536]
    - [48, 0.0]
  - - [16, 2048, 1, 1024]
    - [42, 0.0]
  - - [16, 2048, 1, 8192]
    - [49, 0.0]
  - - [16, 2048, 1, 65536]
    - [50, 0.0]
  - - [16, 8192, 1, 1024]
    - [43, 0.0]
  - - [16, 8192, 1, 8192]
    - [51, 0.0]
  - - [16, 8192, 1, 65536]
    - [52, 0.0]
  - - [2048, 16, 1, 1024]
    - [39, 0.0]
  - - [2048, 16, 1, 8192]
    - [53, 0.0]
  - - [2048, 16, 1, 65536]
    - [40, 0.0]
  - - [2048, 2048, 1, 1024]
    - [57, 0.0]
  - - [2048, 2048, 1, 8192]
    - [44, 0.0]
  - - [2048, 2048, 1, 65536]
    - [58, 0.0]
  - - [2048, 8192, 1, 1024]
    - [45, 0.0]
  - - [2048, 8192, 1, 8192]
    - [59, 0.0]
  - - [2048, 8192, 1, 65536]
    - [60, 0.0]
  - - [8192, 16, 1, 1024]
    - [37, 0.0]
  - - [8192, 16, 1, 8192]
    - [54, 0.0]
  - - [8192, 16, 1, 65536]
    - [38, 0.0]
  - - [8192, 2048, 1, 1024]
    - [61, 0.0]
  - - [8192, 2048, 1, 8192]
    - [55, 0.0]
  - - [8192, 2048, 1, 65536]
    - [46, 0.0]
  - - [8192, 8192, 1, 1024]
    - [56, 0.0]
  - - [8192, 8192, 1, 8192]
    - [62, 0.0]
  - - [8192, 8192, 1, 65536]
    - [63, 0.0]
- null
- null
- DeviceEfficiency
- null
- Equality
