library/src/amd_detail/rocblaslt/src/Tensile/Logic/asm_full/aquavanjaram/gfx941/Equality/aquavanjaram_Cijk_Ailk_Bljk_HHS_BH.yaml
- {MinimumRequiredVersion: 4.33.0}
- aquavanjaram
- gfx941
- [Device 0049]
    SolutionIndex: 0
    SolutionNameMin: Cijk_Ailk_Bljk_HHS_BH_MT32x16x128_MI16x16x1_SN_GSU8_MIWT1_1_NT0_NTA0_NTB0_NTC0_NTD0_NTM0_SU0_SUS0_WSGRA1_WSGRB1_WGM110
    SolutionIndex: 1
    SolutionNameMin: Cijk_Ailk_Bljk_HHS_BH_MT16x16x128_MI16x16x1_SN_GSU64_MIWT1_1_NT0_NTA0_NTB0_NTC0_NTD0_NTM0_SU0_SUS0_WSGRA1_WSGRB0_WGM32
    SolutionIndex: 2
    SolutionNameMin: Cijk_Ailk_Bljk_HHS_BH_MT32x16x128_MI16x16x1_SN_GSU304_MIWT1_1_NT3_NTA3_NTB3_NTC3_NTD3_NTM3_SU0_SUS0_WSGRA1_WSGRB1_WGM1
    SolutionIndex: 3
    SolutionNameMin: Cijk_Ailk_Bljk_HHS_BH_MT64x48x64_MI16x16x1_SN_GSU7_MIWT1_3_NT0_NTA0_NTB0_NTC0_NTD0_NTM0_SU0_SUS0_WSGRA0_WSGRB0_WGM110
    SolutionIndex: 4
    SolutionNameMin: Cijk_Ailk_Bljk_HHS_BH_MT16x64x64_MI16x16x1_SN_GSU19_MIWT1_2_NT0_NTA0_NTB0_NTC0_NTD0_NTM0_SU0_SUS0_WSGRA1_WSGRB1_WGM1
    SolutionIndex: 5
    SolutionNameMin: Cijk_Ailk_Bljk_HHS_BH_MT16x128x64_MI16x16x1_SN_GSU19_MIWT1_2_NT0_NTA0_NTB0_NTC0_NTD0_NTM0_SU4_SUS256_WSGRA1_WSGRB0_WGM64
    SolutionIndex: 6
    SolutionNameMin: Cijk_Ailk_Bljk_HHS_BH_MT16x96x64_MI16x16x1_SN_GSU7_MIWT1_3_NT0_NTA0_NTB0_NTC0_NTD0_NTM0_SU0_SUS0_WSGRA1_WSGRB0_WGM110
    SolutionIndex: 7
    SolutionNameMin: Cijk_Ailk_Bljk_HHS_BH_MT32x128x64_MI16x16x1_SN_GSU19_MIWT2_2_NT0_NTA0_NTB0_NTC0_NTD0_NTM0_SU32_SUS128_WSGRA1_WSGRB0_WGM1
    SolutionIndex: 8
    SolutionNameMin: Cijk_Ailk_Bljk_HHS_BH_MT16x128x64_MI16x16x1_SN_GSU19_MIWT1_4_NT0_NTA0_NTB0_NTC0_NTD0_NTM0_SU4_SUS128_WSGRA1_WSGRB0_WGM110
    SolutionIndex: 9
    SolutionNameMin: Cijk_Ailk_Bljk_HHS_BH_MT48x16x64_MI16x16x1_SN_GSU7_MIWT3_1_NT0_NTA0_NTB0_NTC0_NTD0_NTM0_SU0_SUS0_WSGRA0_WSGRB1_WGM1
    SolutionIndex: 10
    SolutionNameMin: Cijk_Ailk_Bljk_HHS_BH_MT64x32x64_MI16x16x1_SN_GSU19_MIWT1_2_NT0_NTA0_NTB0_NTC0_NTD0_NTM0_SU0_SUS0_WSGRA0_WSGRB1_WGM1
    SolutionIndex: 11
    SolutionNameMin: Cijk_Ailk_Bljk_HHS_BH_MT64x16x128_MI16x16x1_SN_GSU19_MIWT1_1_NT0_NTA0_NTB0_NTC0_NTD0_NTM0_SU0_SUS0_WSGRA0_WSGRB0_WGM110
    SolutionIndex: 12
    SolutionNameMin: Cijk_Ailk_Bljk_HHS_BH_MT128x96x64_MI16x16x1_SN_GSU1_MIWT4_3_NT0_NTA0_NTB0_NTC0_NTD0_NTM0_SU4_SUS128_WSGRA1_WSGRB0_WGM32
    SolutionIndex: 13
    SolutionNameMin: Cijk_Ailk_Bljk_HHS_BH_MT128x96x64_MI16x16x1_SN_GSU1_MIWT4_3_NT0_NTA0_NTB0_NTC0_NTD0_NTM0_SU4_SUS256_WSGRA1_WSGRB0_WGM1
    SolutionIndex: 14
    SolutionNameMin: Cijk_Ailk_Bljk_HHS_BH_MT128x96x64_MI16x16x1_SN_GSU1_MIWT4_3_NT0_NTA0_NTB0_NTC0_NTD0_NTM0_SU0_SUS0_WSGRA0_WSGRB1_WGM4
    SolutionIndex: 15
    SolutionNameMin: Cijk_Ailk_Bljk_HHS_BH_MT192x16x64_MI16x16x1_SN_GSU7_MIWT3_1_NT0_NTA0_NTB0_NTC0_NTD0_NTM0_SU4_SUS128_WSGRA1_WSGRB0_WGM4
    SolutionIndex: 16
    SolutionNameMin: Cijk_Ailk_Bljk_HHS_BH_MT128x16x32_MI16x16x1_SN_GSU19_MIWT4_1_NT0_NTA0_NTB0_NTC0_NTD0_NTM0_SU0_SUS0_WSGRA1_WSGRB0_WGM1
    SolutionIndex: 17
    SolutionNameMin: Cijk_Ailk_Bljk_HHS_BH_MT256x16x32_MI16x16x1_SN_GSU19_MIWT4_1_NT0_NTA0_NTB0_NTC0_NTD0_NTM0_NLCA2_SU0_SUS0_WSGRA1_WSGRB1_WGM110
    SolutionIndex: 18
    SolutionNameMin: Cijk_Ailk_Bljk_HHS_BH_MT32x64x32_MI32x32x1_SN_GSU8_MIWT1_1_NT0_NTA0_NTB0_NTC0_NTD0_NTM0_SU0_SUS0_WSGRA0_WSGRB0_WGM4
    SolutionIndex: 19
    SolutionNameMin: Cijk_Ailk_Bljk_HHS_BH_MT32x32x64_MI32x32x1_SN_GSU64_MIWT1_1_NT0_NTA0_NTB0_NTC0_NTD0_NTM0_SU0_SUS0_WSGRA1_WSGRB1_WGM4
    SolutionIndex: 20
    SolutionNameMin: Cijk_Ailk_Bljk_HHS_BH_MT64x32x64_MI32x32x1_SN_GSU304_MIWT1_1_NT0_NTA0_NTB0_NTC0_NTD0_NTM0_SU0_SUS0_WSGRA1_WSGRB1_WGM1
    SolutionIndex: 21
    SolutionNameMin: Cijk_Ailk_Bljk_HHS_BH_MT64x32x64_MI32x32x1_SN_GSU5_MIWT1_1_NT0_NTA0_NTB0_NTC0_NTD0_NTM0_SU0_SUS0_WSGRA0_WSGRB1_WGM1
    SolutionIndex: 22
    SolutionNameMin: Cijk_Ailk_Bljk_HHS_BH_MT32x128x64_MI32x32x1_SN_GSU19_MIWT1_1_NT0_NTA0_NTB0_NTC0_NTD0_NTM0_SU4_SUS128_WSGRA1_WSGRB1_WGM110
    SolutionIndex: 23
    SolutionNameMin: Cijk_Ailk_Bljk_HHS_BH_MT32x128x64_MI32x32x1_SN_GSU19_MIWT1_1_NT0_NTA0_NTB0_NTC0_NTD0_NTM0_SU0_SUS0_WSGRA0_WSGRB0_WGM1
    SolutionIndex: 24
    SolutionNameMin: Cijk_Ailk_Bljk_HHS_BH_MT32x96x64_MI32x32x1_SN_GSU7_MIWT1_3_NT0_NTA0_NTB0_NTC0_NTD0_NTM0_SU0_SUS0_WSGRA0_WSGRB0_WGM1
    SolutionIndex: 25
    SolutionNameMin: Cijk_Ailk_Bljk_HHS_BH_MT32x128x64_MI32x32x1_SN_GSU19_MIWT1_2_NT0_NTA0_NTB0_NTC0_NTD0_NTM0_SU0_SUS0_WSGRA1_WSGRB1_WGM8
    SolutionIndex: 26
    SolutionNameMin: Cijk_Ailk_Bljk_HHS_BH_MT32x128x64_MI32x32x1_SN_GSU19_MIWT1_2_NT0_NTA0_NTB0_NTC0_NTD0_NTM0_SU0_SUS0_WSGRA0_WSGRB1_WGM16
    SolutionIndex: 27
    SolutionNameMin: Cijk_Ailk_Bljk_HHS_BH_MT32x64x64_MI32x32x1_SN_GSU5_MIWT1_1_NT0_NTA0_NTB0_NTC0_NTD0_NTM0_SU4_SUS128_WSGRA1_WSGRB0_WGM64
    SolutionIndex: 28
    SolutionNameMin: Cijk_Ailk_Bljk_HHS_BH_MT128x32x64_MI32x32x1_SN_GSU19_MIWT1_1_NT0_NTA0_NTB0_NTC0_NTD0_NTM0_SU0_SUS0_WSGRA1_WSGRB0_WGM32
    SolutionIndex: 29
    SolutionNameMin: Cijk_Ailk_Bljk_HHS_BH_MT128x32x64_MI32x32x1_SN_GSU19_MIWT1_1_NT0_NTA0_NTB0_NTC0_NTD0_NTM0_SU0_SUS0_WSGRA1_WSGRB0_WGM1
    SolutionIndex: 30
    SolutionNameMin: Cijk_Ailk_Bljk_HHS_BH_MT128x128x64_MI32x32x1_SN_GSU1_MIWT2_2_NT0_NTA0_NTB0_NTC0_NTD0_NTM0_SU0_SUS0_WSGRA1_WSGRB0_WGM4
    SolutionIndex: 31
    SolutionNameMin: Cijk_Ailk_Bljk_HHS_BH_MT128x128x64_MI32x32x1_SN_GSU1_MIWT2_2_NT0_NTA0_NTB0_NTC0_NTD0_NTM0_SU0_SUS0_WSGRA1_WSGRB1_WGM110
    SolutionIndex: 32
    SolutionNameMin: Cijk_Ailk_Bljk_HHS_BH_MT192x32x32_MI32x32x1_SN_GSU7_MIWT3_1_NT0_NTA0_NTB0_NTC0_NTD0_NTM0_SU0_SUS0_WSGRA1_WSGRB0_WGM1
    SolutionIndex: 33
    SolutionNameMin: Cijk_Ailk_Bljk_HHS_BH_MT128x32x16_MI32x32x1_SN_GSU19_MIWT1_1_NT0_NTA0_NTB0_NTC0_NTD0_NTM0_SU0_SUS0_WSGRA0_WSGRB1_WGM1
    SolutionIndex: 34
    SolutionNameMin: Cijk_Ailk_Bljk_HHS_BH_MT256x32x32_MI32x32x1_SN_GSU19_MIWT2_1_NT0_NTA0_NTB0_NTC0_NTD0_NTM0_SU0_SUS0_WSGRA1_WSGRB0_WGM110
- - - [16, 16, 1, 1024]
    # - [18, 34.4441]
    - [0, 39.2035]
  - - [16, 16, 1, 8192]
    # - [19, 268.052]
    - [1, 282.152]
  - - [16, 16, 1, 65536]
    # - [20, 1195.09]
    - [2, 1247.7]
  - - [16, 2048, 1, 1024]
    - [21, 2675.24]
    - [3, 2683.6]
  - - [16, 2048, 1, 8192]
    # - [22, 16874.9]
    - [4, 17421.3]
  - - [16, 2048, 1, 65536]
    # - [23, 46385.4]
    - [5, 46608.0]
  - - [16, 8192, 1, 1024]
    # - [24, 7267.46]
    - [6, 7969.05]
  - - [16, 8192, 1, 8192]
    # - [25, 30405.7]
    - [7, 30984.0]
  - - [16, 8192, 1, 65536]
    # - [26, 48468.5]
    - [8, 48774.9]
  - - [2048, 16, 1, 1024]
    # - [27, 2658.28]
    - [9, 2690.06]
  - - [2048, 16, 1, 8192]
    # - [28, 16945.1]
    - [10, 17083.2]
  - - [2048, 16, 1, 65536]
    # - [29, 47172.1]
    - [11, 45988.1]
  - - [2048, 2048, 1, 1024]
    - [30, 222407.0]
    # - [12, 194270.0]
  - - [2048, 2048, 1, 8192]
    - [30, 344747.0]
    # - [13, 274923.0]
  - - [2048, 2048, 1, 65536]
    - [31, 297751.0]
    # - [14, 236012.0]
  - - [8192, 16, 1, 1024]
    # - [32, 7240.03]
    - [15, 7977.11]
  - - [8192, 16, 1, 8192]
    # - [33, 31065.5]
    - [16, 31278.2]
  - - [8192, 16, 1, 65536]
    - [34, 48429.4]
    # - [17, 46485.4]
- null
- null
- DeviceEfficiency
- null
- Equality
