library/src/amd_detail/rocblaslt/src/Tensile/Logic/asm_full/aquavanjaram/gfx941/Equality/aquavanjaram_Cijk_Alik_Bljk_HHS_BH.yaml
- {MinimumRequiredVersion: 4.33.0}
- aquavanjaram
- gfx941
- [Device 0049, Device 0050]
    SolutionIndex: 0
    SolutionNameMin: Cijk_Alik_Bljk_HHS_BH_MT128x128x64_MI32x32x1_SN_LDSB1_GRVWB8_GSU1_LBSPPA256_LBSPPB128_LPA8_LPB8_LRVW8_MIWT2_2_SVW2_VWA2_WG64_4_1
    SolutionIndex: 1
    SolutionNameMin: Cijk_Alik_Bljk_HHS_BH_MT128x64x64_MI16x16x1_SN_LDSB1_GRVWB8_GSU1_LBSPPA256_LBSPPB128_LPA16_LPB16_LRVW8_MIWT2_4_SVW2_VWA2_WG64_4_1
    SolutionIndex: 2
    SolutionNameMin: Cijk_Alik_Bljk_HHS_BH_MT256x224x64_MI16x16x1_SN_LDSB1_GRVWB4_GSU1_LBSPPA512_LBSPPB128_LPA8_LPB4_LRVW4_MIWT4_14_SVW4_VWA4_WG64_4_1
    SolutionIndex: 3
    SolutionNameMin: Cijk_Alik_Bljk_HHS_BH_MT128x64x128_MI16x16x1_SN_LDSB1_GRVWB8_GSU1_LBSPPA512_LBSPPB256_LPA16_LPB16_LRVW8_MIWT2_4_SVW2_VWA2_WG64_4_1
    SolutionIndex: 4
    SolutionNameMin: Cijk_Alik_Bljk_HHS_BH_MT256x256x32_MI32x32x1_SN_GSU1_LBSPPA256_LBSPPB256_MIWT4_4_VWA4_VWB4_WSGRA1_WSGRB1_WG64_4_1_WGM8
    SolutionIndex: 5
    SolutionNameMin: Cijk_Alik_Bljk_HHS_BH_MT256x192x64_MI16x16x1_SN_GSU1_LBSPPA512_LBSPPB128_LPA16_LPB8_MIWT8_6_SVW4_VWA4_VWB2_WG32_8_1_WGM1
    SolutionIndex: 6
    SolutionNameMin: Cijk_Alik_Bljk_HHS_BH_MT192x256x64_MI16x16x1_SN_GSU1_LBSPPA256_LBSPPB256_LPA16_LPB8_MIWT6_8_SVW2_VWA2_VWB4_WG32_8_1_WGM8
    SolutionIndex: 7
    SolutionNameMin: Cijk_Alik_Bljk_HHS_BH_MT192x256x64_MI16x16x1_SN_GSU1_LBSPPA256_LBSPPB256_LPA16_LPB8_MIWT6_8_SVW2_VWA2_VWB4_WG32_8_1_WGM1
    SolutionIndex: 8
    SolutionNameMin: Cijk_Alik_Bljk_HHS_BH_MT192x256x64_MI16x16x1_SN_GSU1_LBSPPA128_LBSPPB512_LPA8_LPB16_MIWT6_8_SVW2_VWA2_VWB4_WG32_8_1_WGM8
    SolutionIndex: 9
    SolutionNameMin: Cijk_Alik_Bljk_HHS_BH_MT192x256x64_MI16x16x1_SN_GRVWA4_GRVWB8_GSU1_LBSPPA512_LBSPPB128_LPA4_LPB8_LRVW4_MIWT12_4_MO40_SVW4_VWA4_VWB1_WG16_16_1_WGM8
- - - [512, 512, 1, 512, 512, 512, 512, 512]
    - [1, 0.0]
  - - [1024, 1024, 1, 1024, 1024, 1024, 1024, 1024]
    - [3, 0.0]
  - - [2048, 2048, 1, 2048, 2048, 2048, 2048, 2048]
    - [0, 0.0]
  - - [4096, 4096, 1, 4096, 4096, 4096, 4096, 4096]
    - [2, 0.0]
  - - [4096, 4096, 1, 8192, 4096, 4096, 8192, 8192]
    - [2, 0.0]
  - - [8192, 8192, 1, 8192, 8192, 8192, 8192, 8192]
    - [2, 0.0]
  - - [4864, 4096, 1, 8192, 4864, 4864, 8192, 8192]
    - [4, 0.0]
  - - [7168, 65536, 1, 7168, 7168, 7168, 7168, 7168]
    - [5, 0.0]
  - - [7168, 65536, 1, 28672, 7168, 7168, 28672, 28672]
    - [6, 0.0]
  - - [21504, 65536, 1, 7168, 21504, 21504, 7168, 7168]
    - [7, 0.0]
  - - [28672, 65536, 1, 7168, 28672, 28672, 7168, 7168]
    - [8, 0.0]
  - - [50432, 65536, 1, 7168, 50432, 50432, 7168, 7168]
    - [9, 0.0]
- null
- null
- DeviceEfficiency
- null
- Equality
