library/src/amd_detail/rocblaslt/src/Tensile/Logic/asm_full/navi33/Equality/navi33_Cijk_Ailk_Bljk_SB_Bias_HAS_SAV_UserArgs.yaml
- {MinimumRequiredVersion: 4.33.0}
- navi33
- gfx1102
- [Device 73f0]
    SolutionIndex: 0
    SolutionNameMin: Cijk_Ailk_Bljk_SB_Bias_HAS_SAV_UserArgs_MT8x8x8_SN_GSU1_SU32_SUM0_SUS256_TT1_1_WGM1
    SolutionIndex: 1
    SolutionNameMin: Cijk_Ailk_Bljk_SB_Bias_HAS_SAV_UserArgs_MT16x16x8_SN_GSU1_SU32_SUM0_SUS256_TT2_2_WGM1
    SolutionIndex: 2
    SolutionNameMin: Cijk_Ailk_Bljk_SB_Bias_HAS_SAV_UserArgs_MT8x8x16_SN_GSU1_SU32_SUM0_SUS256_TT1_1_WGM1
    SolutionIndex: 3
    SolutionNameMin: Cijk_Ailk_Bljk_SB_Bias_HAS_SAV_UserArgs_MT16x16x16_SN_GSU1_SU32_SUM0_SUS256_TT2_2_WGM1
- - - [64, 64, 1, 32, 64, 64, 64, 32]
    - [3, 0.550501]
  - - [128, 64, 1, 32, 128, 128, 128, 32]
    - [1, 0.749569]
  - - [192, 64, 1, 32, 192, 192, 192, 32]
    - [1, 1.09827]
  - - [256, 64, 1, 32, 256, 256, 256, 32]
    - [3, 1.46999]
  - - [320, 64, 1, 32, 320, 320, 320, 32]
    - [3, 2.11593]
  - - [384, 64, 1, 32, 384, 384, 384, 32]
    - [2, 3.53467]
  - - [448, 64, 1, 32, 448, 448, 448, 32]
    - [2, 4.05892]
  - - [512, 64, 1, 32, 512, 512, 512, 32]
    - [2, 4.95123]
  - - [576, 64, 1, 32, 576, 576, 576, 32]
    - [1, 5.69106]
  - - [640, 64, 1, 32, 640, 640, 640, 32]
    - [1, 5.9424]
  - - [704, 64, 1, 32, 704, 704, 704, 32]
    - [0, 6.05613]
  - - [768, 64, 1, 32, 768, 768, 768, 32]
    - [3, 4.30607]
  - - [832, 64, 1, 32, 832, 832, 832, 32]
    - [0, 6.63872]
  - - [896, 64, 1, 32, 896, 896, 896, 32]
    - [0, 12.9235]
  - - [960, 64, 1, 32, 960, 960, 960, 32]
    - [2, 7.4485]
  - - [1024, 64, 1, 32, 1024, 1024, 1024, 32]
    - [2, 11.8222]
  - - [64, 128, 1, 32, 64, 64, 64, 32]
    - [3, 1.10406]
  - - [128, 128, 1, 32, 128, 128, 128, 32]
    - [1, 2.97517]
  - - [192, 128, 1, 32, 192, 192, 192, 32]
    - [1, 4.23142]
  - - [256, 128, 1, 32, 256, 256, 256, 32]
    - [2, 3.29206]
  - - [320, 128, 1, 32, 320, 320, 320, 32]
    - [2, 4.09514]
  - - [384, 128, 1, 32, 384, 384, 384, 32]
    - [0, 5.59238]
  - - [448, 128, 1, 32, 448, 448, 448, 32]
    - [2, 10.4119]
  - - [512, 128, 1, 32, 512, 512, 512, 32]
    - [1, 11.2517]
  - - [576, 128, 1, 32, 576, 576, 576, 32]
    - [3, 12.5752]
  - - [640, 128, 1, 32, 640, 640, 640, 32]
    - [2, 42.5831]
  - - [704, 128, 1, 32, 704, 704, 704, 32]
    - [2, 11.9319]
  - - [768, 128, 1, 32, 768, 768, 768, 32]
    - [3, 19.3935]
  - - [832, 128, 1, 32, 832, 832, 832, 32]
    - [1, 20.4756]
  - - [896, 128, 1, 32, 896, 896, 896, 32]
    - [2, 22.534]
  - - [960, 128, 1, 32, 960, 960, 960, 32]
    - [2, 23.6534]
  - - [1024, 128, 1, 32, 1024, 1024, 1024, 32]
    - [3, 25.6163]
  - - [64, 192, 1, 32, 64, 64, 64, 32]
    - [3, 2.43394]
  - - [128, 192, 1, 32, 128, 128, 128, 32]
    - [0, 4.1878]
  - - [192, 192, 1, 32, 192, 192, 192, 32]
    - [2, 6.38991]
  - - [256, 192, 1, 32, 256, 256, 256, 32]
    - [0, 10.0035]
  - - [320, 192, 1, 32, 320, 320, 320, 32]
    - [0, 23.4516]
  - - [384, 192, 1, 32, 384, 384, 384, 32]
    - [3, 24.4549]
  - - [448, 192, 1, 32, 448, 448, 448, 32]
    - [2, 38.5182]
  - - [512, 192, 1, 32, 512, 512, 512, 32]
    - [2, 48.8126]
  - - [576, 192, 1, 32, 576, 576, 576, 32]
    - [1, 47.4994]
  - - [640, 192, 1, 32, 640, 640, 640, 32]
    - [3, 23.5725]
  - - [704, 192, 1, 32, 704, 704, 704, 32]
    - [1, 36.4333]
  - - [768, 192, 1, 32, 768, 768, 768, 32]
    - [2, 33.1593]
  - - [832, 192, 1, 32, 832, 832, 832, 32]
    - [2, 34.7457]
  - - [896, 192, 1, 32, 896, 896, 896, 32]
    - [3, 35.9722]
  - - [960, 192, 1, 32, 960, 960, 960, 32]
    - [2, 44.246]
  - - [1024, 192, 1, 32, 1024, 1024, 1024, 32]
    - [3, 39.5923]
  - - [64, 256, 1, 32, 64, 64, 64, 32]
    - [3, 4.59416]
  - - [128, 256, 1, 32, 128, 128, 128, 32]
    - [3, 9.46535]
  - - [192, 256, 1, 32, 192, 192, 192, 32]
    - [3, 13.9685]
  - - [256, 256, 1, 32, 256, 256, 256, 32]
    - [3, 32.3084]
  - - [320, 256, 1, 32, 320, 320, 320, 32]
    - [2, 37.0729]
  - - [384, 256, 1, 32, 384, 384, 384, 32]
    - [2, 42.2841]
  - - [448, 256, 1, 32, 448, 448, 448, 32]
    - [2, 57.5594]
  - - [512, 256, 1, 32, 512, 512, 512, 32]
    - [2, 62.2573]
  - - [576, 256, 1, 32, 576, 576, 576, 32]
    - [3, 58.1104]
  - - [640, 256, 1, 32, 640, 640, 640, 32]
    - [3, 81.0462]
  - - [704, 256, 1, 32, 704, 704, 704, 32]
    - [1, 150.579]
  - - [768, 256, 1, 32, 768, 768, 768, 32]
    - [2, 57.2885]
  - - [832, 256, 1, 32, 832, 832, 832, 32]
    - [3, 40.8187]
  - - [896, 256, 1, 32, 896, 896, 896, 32]
    - [1, 64.1412]
  - - [960, 256, 1, 32, 960, 960, 960, 32]
    - [3, 27.8269]
  - - [1024, 256, 1, 32, 1024, 1024, 1024, 32]
    - [1, 25.8643]
  - - [64, 320, 1, 32, 64, 64, 64, 32]
    - [0, 2.34403]
  - - [128, 320, 1, 32, 128, 128, 128, 32]
    - [1, 4.2372]
  - - [192, 320, 1, 32, 192, 192, 192, 32]
    - [2, 13.2271]
  - - [256, 320, 1, 32, 256, 256, 256, 32]
    - [2, 14.4467]
  - - [320, 320, 1, 32, 320, 320, 320, 32]
    - [1, 19.4128]
  - - [384, 320, 1, 32, 384, 384, 384, 32]
    - [1, 22.3761]
  - - [448, 320, 1, 32, 448, 448, 448, 32]
    - [3, 16.3079]
  - - [512, 320, 1, 32, 512, 512, 512, 32]
    - [1, 18.4261]
  - - [576, 320, 1, 32, 576, 576, 576, 32]
    - [0, 33.1574]
  - - [640, 320, 1, 32, 640, 640, 640, 32]
    - [0, 34.9962]
  - - [704, 320, 1, 32, 704, 704, 704, 32]
    - [1, 25.5377]
  - - [768, 320, 1, 32, 768, 768, 768, 32]
    - [3, 27.6051]
  - - [832, 320, 1, 32, 832, 832, 832, 32]
    - [1, 45.118]
  - - [896, 320, 1, 32, 896, 896, 896, 32]
    - [3, 244.114]
  - - [960, 320, 1, 32, 960, 960, 960, 32]
    - [0, 65.3897]
  - - [1024, 320, 1, 32, 1024, 1024, 1024, 32]
    - [0, 71.9528]
  - - [64, 384, 1, 32, 64, 64, 64, 32]
    - [3, 11.4198]
  - - [128, 384, 1, 32, 128, 128, 128, 32]
    - [1, 23.2226]
  - - [192, 384, 1, 32, 192, 192, 192, 32]
    - [1, 100.204]
  - - [256, 384, 1, 32, 256, 256, 256, 32]
    - [2, 141.251]
  - - [320, 384, 1, 32, 320, 320, 320, 32]
    - [3, 180.914]
  - - [384, 384, 1, 32, 384, 384, 384, 32]
    - [1, 177.792]
  - - [448, 384, 1, 32, 448, 448, 448, 32]
    - [1, 258.149]
  - - [512, 384, 1, 32, 512, 512, 512, 32]
    - [0, 215.645]
  - - [576, 384, 1, 32, 576, 576, 576, 32]
    - [0, 53.3474]
  - - [640, 384, 1, 32, 640, 640, 640, 32]
    - [2, 59.3733]
  - - [704, 384, 1, 32, 704, 704, 704, 32]
    - [3, 58.0605]
  - - [768, 384, 1, 32, 768, 768, 768, 32]
    - [1, 48.1917]
  - - [832, 384, 1, 32, 832, 832, 832, 32]
    - [3, 54.4603]
  - - [896, 384, 1, 32, 896, 896, 896, 32]
    - [2, 58.6308]
  - - [960, 384, 1, 32, 960, 960, 960, 32]
    - [3, 40.3662]
  - - [1024, 384, 1, 32, 1024, 1024, 1024, 32]
    - [3, 44.1527]
  - - [64, 448, 1, 32, 64, 64, 64, 32]
    - [1, 2.96935]
  - - [128, 448, 1, 32, 128, 128, 128, 32]
    - [2, 6.54201]
  - - [192, 448, 1, 32, 192, 192, 192, 32]
    - [2, 8.7331]
  - - [256, 448, 1, 32, 256, 256, 256, 32]
    - [0, 12.9771]
  - - [320, 448, 1, 32, 320, 320, 320, 32]
    - [0, 59.9163]
  - - [384, 448, 1, 32, 384, 384, 384, 32]
    - [3, 19.523]
  - - [448, 448, 1, 32, 448, 448, 448, 32]
    - [3, 20.4877]
  - - [512, 448, 1, 32, 512, 512, 512, 32]
    - [3, 24.4138]
  - - [576, 448, 1, 32, 576, 576, 576, 32]
    - [2, 28.1054]
  - - [640, 448, 1, 32, 640, 640, 640, 32]
    - [1, 32.444]
  - - [704, 448, 1, 32, 704, 704, 704, 32]
    - [0, 255.831]
  - - [768, 448, 1, 32, 768, 768, 768, 32]
    - [2, 33.0923]
  - - [832, 448, 1, 32, 832, 832, 832, 32]
    - [3, 124.765]
  - - [896, 448, 1, 32, 896, 896, 896, 32]
    - [1, 967.248]
  - - [960, 448, 1, 32, 960, 960, 960, 32]
    - [0, 50.5453]
  - - [1024, 448, 1, 32, 1024, 1024, 1024, 32]
    - [2, 145.124]
  - - [64, 512, 1, 32, 64, 64, 64, 32]
    - [0, 8.31507]
  - - [128, 512, 1, 32, 128, 128, 128, 32]
    - [0, 17.2477]
  - - [192, 512, 1, 32, 192, 192, 192, 32]
    - [3, 37.4511]
  - - [256, 512, 1, 32, 256, 256, 256, 32]
    - [0, 65.7409]
  - - [320, 512, 1, 32, 320, 320, 320, 32]
    - [2, 61.4564]
  - - [384, 512, 1, 32, 384, 384, 384, 32]
    - [2, 122.307]
  - - [448, 512, 1, 32, 448, 448, 448, 32]
    - [1, 43.2069]
  - - [512, 512, 1, 32, 512, 512, 512, 32]
    - [3, 27.7106]
  - - [576, 512, 1, 32, 576, 576, 576, 32]
    - [0, 54.2006]
  - - [640, 512, 1, 32, 640, 640, 640, 32]
    - [2, 118.798]
  - - [704, 512, 1, 32, 704, 704, 704, 32]
    - [2, 84.4323]
  - - [768, 512, 1, 32, 768, 768, 768, 32]
    - [2, 238.717]
  - - [832, 512, 1, 32, 832, 832, 832, 32]
    - [3, 205.307]
  - - [896, 512, 1, 32, 896, 896, 896, 32]
    - [1, 225.518]
  - - [960, 512, 1, 32, 960, 960, 960, 32]
    - [1, 221.685]
  - - [1024, 512, 1, 32, 1024, 1024, 1024, 32]
    - [2, 84.7865]
  - - [64, 576, 1, 32, 64, 64, 64, 32]
    - [2, 11.2128]
  - - [128, 576, 1, 32, 128, 128, 128, 32]
    - [0, 31.5138]
  - - [192, 576, 1, 32, 192, 192, 192, 32]
    - [1, 39.9067]
  - - [256, 576, 1, 32, 256, 256, 256, 32]
    - [3, 47.9749]
  - - [320, 576, 1, 32, 320, 320, 320, 32]
    - [1, 53.9413]
  - - [384, 576, 1, 32, 384, 384, 384, 32]
    - [1, 76.9875]
  - - [448, 576, 1, 32, 448, 448, 448, 32]
    - [2, 57.7751]
  - - [512, 576, 1, 32, 512, 512, 512, 32]
    - [1, 49.3484]
  - - [576, 576, 1, 32, 576, 576, 576, 32]
    - [2, 60.4996]
  - - [640, 576, 1, 32, 640, 640, 640, 32]
    - [1, 41.0474]
  - - [704, 576, 1, 32, 704, 704, 704, 32]
    - [1, 45.5972]
  - - [768, 576, 1, 32, 768, 768, 768, 32]
    - [3, 90.8875]
  - - [832, 576, 1, 32, 832, 832, 832, 32]
    - [1, 50.781]
  - - [896, 576, 1, 32, 896, 896, 896, 32]
    - [3, 52.2974]
  - - [960, 576, 1, 32, 960, 960, 960, 32]
    - [2, 60.6064]
  - - [1024, 576, 1, 32, 1024, 1024, 1024, 32]
    - [2, 67.5057]
  - - [64, 640, 1, 32, 64, 64, 64, 32]
    - [0, 6.1867]
  - - [128, 640, 1, 32, 128, 128, 128, 32]
    - [1, 8.90945]
  - - [192, 640, 1, 32, 192, 192, 192, 32]
    - [3, 18.2153]
  - - [256, 640, 1, 32, 256, 256, 256, 32]
    - [1, 16.5625]
  - - [320, 640, 1, 32, 320, 320, 320, 32]
    - [0, 21.4899]
  - - [384, 640, 1, 32, 384, 384, 384, 32]
    - [3, 26.8438]
  - - [448, 640, 1, 32, 448, 448, 448, 32]
    - [1, 46.628]
  - - [512, 640, 1, 32, 512, 512, 512, 32]
    - [1, 42.4496]
  - - [576, 640, 1, 32, 576, 576, 576, 32]
    - [3, 62.6288]
  - - [640, 640, 1, 32, 640, 640, 640, 32]
    - [0, 45.1799]
  - - [704, 640, 1, 32, 704, 704, 704, 32]
    - [2, 49.3948]
  - - [768, 640, 1, 32, 768, 768, 768, 32]
    - [1, 49.1341]
  - - [832, 640, 1, 32, 832, 832, 832, 32]
    - [1, 52.6822]
  - - [896, 640, 1, 32, 896, 896, 896, 32]
    - [3, 102.015]
  - - [960, 640, 1, 32, 960, 960, 960, 32]
    - [0, 132.618]
  - - [1024, 640, 1, 32, 1024, 1024, 1024, 32]
    - [1, 108.279]
  - - [64, 704, 1, 32, 64, 64, 64, 32]
    - [1, 4.69392]
  - - [128, 704, 1, 32, 128, 128, 128, 32]
    - [1, 10.6405]
  - - [192, 704, 1, 32, 192, 192, 192, 32]
    - [0, 25.6667]
  - - [256, 704, 1, 32, 256, 256, 256, 32]
    - [3, 29.819]
  - - [320, 704, 1, 32, 320, 320, 320, 32]
    - [3, 104.085]
  - - [384, 704, 1, 32, 384, 384, 384, 32]
    - [0, 136.458]
  - - [448, 704, 1, 32, 448, 448, 448, 32]
    - [3, 53.3516]
  - - [512, 704, 1, 32, 512, 512, 512, 32]
    - [2, 81.7803]
  - - [576, 704, 1, 32, 576, 576, 576, 32]
    - [1, 74.1701]
  - - [640, 704, 1, 32, 640, 640, 640, 32]
    - [2, 101.011]
  - - [704, 704, 1, 32, 704, 704, 704, 32]
    - [2, 87.4146]
  - - [768, 704, 1, 32, 768, 768, 768, 32]
    - [1, 95.2092]
  - - [832, 704, 1, 32, 832, 832, 832, 32]
    - [1, 59.1941]
  - - [896, 704, 1, 32, 896, 896, 896, 32]
    - [1, 70.3544]
  - - [960, 704, 1, 32, 960, 960, 960, 32]
    - [1, 74.9511]
  - - [1024, 704, 1, 32, 1024, 1024, 1024, 32]
    - [3, 200.092]
  - - [64, 768, 1, 32, 64, 64, 64, 32]
    - [2, 163.84]
  - - [128, 768, 1, 32, 128, 128, 128, 32]
    - [1, 20.8243]
  - - [192, 768, 1, 32, 192, 192, 192, 32]
    - [3, 31.1704]
  - - [256, 768, 1, 32, 256, 256, 256, 32]
    - [1, 51.3165]
  - - [320, 768, 1, 32, 320, 320, 320, 32]
    - [1, 219.827]
  - - [384, 768, 1, 32, 384, 384, 384, 32]
    - [1, 60.5703]
  - - [448, 768, 1, 32, 448, 448, 448, 32]
    - [3, 58.8502]
  - - [512, 768, 1, 32, 512, 512, 512, 32]
    - [3, 72.4192]
  - - [576, 768, 1, 32, 576, 576, 576, 32]
    - [2, 84.1499]
  - - [640, 768, 1, 32, 640, 640, 640, 32]
    - [1, 55.0864]
  - - [704, 768, 1, 32, 704, 704, 704, 32]
    - [2, 92.3138]
  - - [768, 768, 1, 32, 768, 768, 768, 32]
    - [3, 108.974]
  - - [832, 768, 1, 32, 832, 832, 832, 32]
    - [2, 105.032]
  - - [896, 768, 1, 32, 896, 896, 896, 32]
    - [1, 76.4943]
  - - [960, 768, 1, 32, 960, 960, 960, 32]
    - [1, 81.4895]
  - - [1024, 768, 1, 32, 1024, 1024, 1024, 32]
    - [1, 86.9191]
  - - [64, 832, 1, 32, 64, 64, 64, 32]
    - [2, 12.3715]
  - - [128, 832, 1, 32, 128, 128, 128, 32]
    - [0, 21.7692]
  - - [192, 832, 1, 32, 192, 192, 192, 32]
    - [1, 31.2734]
  - - [256, 832, 1, 32, 256, 256, 256, 32]
    - [0, 40.3153]
  - - [320, 832, 1, 32, 320, 320, 320, 32]
    - [3, 61.0771]
  - - [384, 832, 1, 32, 384, 384, 384, 32]
    - [2, 61.5638]
  - - [448, 832, 1, 32, 448, 448, 448, 32]
    - [0, 64.5374]
  - - [512, 832, 1, 32, 512, 512, 512, 32]
    - [3, 47.4987]
  - - [576, 832, 1, 32, 576, 576, 576, 32]
    - [1, 53.5032]
  - - [640, 832, 1, 32, 640, 640, 640, 32]
    - [3, 177.087]
  - - [704, 832, 1, 32, 704, 704, 704, 32]
    - [3, 315.461]
  - - [768, 832, 1, 32, 768, 768, 768, 32]
    - [1, 275.697]
  - - [832, 832, 1, 32, 832, 832, 832, 32]
    - [3, 121.339]
  - - [896, 832, 1, 32, 896, 896, 896, 32]
    - [0, 122.073]
  - - [960, 832, 1, 32, 960, 960, 960, 32]
    - [1, 88.4422]
  - - [1024, 832, 1, 32, 1024, 1024, 1024, 32]
    - [1, 93.8028]
  - - [64, 896, 1, 32, 64, 64, 64, 32]
    - [2, 11.0903]
  - - [128, 896, 1, 32, 128, 128, 128, 32]
    - [3, 27.034]
  - - [192, 896, 1, 32, 192, 192, 192, 32]
    - [0, 72.3626]
  - - [256, 896, 1, 32, 256, 256, 256, 32]
    - [3, 60.5611]
  - - [320, 896, 1, 32, 320, 320, 320, 32]
    - [3, 32.4102]
  - - [384, 896, 1, 32, 384, 384, 384, 32]
    - [2, 57.7498]
  - - [448, 896, 1, 32, 448, 448, 448, 32]
    - [0, 141.022]
  - - [512, 896, 1, 32, 512, 512, 512, 32]
    - [3, 51.273]
  - - [576, 896, 1, 32, 576, 576, 576, 32]
    - [1, 96.0229]
  - - [640, 896, 1, 32, 640, 640, 640, 32]
    - [3, 177.957]
  - - [704, 896, 1, 32, 704, 704, 704, 32]
    - [0, 216.229]
  - - [768, 896, 1, 32, 768, 768, 768, 32]
    - [1, 87.5251]
  - - [832, 896, 1, 32, 832, 832, 832, 32]
    - [2, 141.514]
  - - [896, 896, 1, 32, 896, 896, 896, 32]
    - [3, 130.599]
  - - [960, 896, 1, 32, 960, 960, 960, 32]
    - [1, 95.2043]
  - - [1024, 896, 1, 32, 1024, 1024, 1024, 32]
    - [1, 101.32]
  - - [64, 960, 1, 32, 64, 64, 64, 32]
    - [3, 10.7786]
  - - [128, 960, 1, 32, 128, 128, 128, 32]
    - [2, 21.1622]
  - - [192, 960, 1, 32, 192, 192, 192, 32]
    - [1, 31.1753]
  - - [256, 960, 1, 32, 256, 256, 256, 32]
    - [1, 44.0787]
  - - [320, 960, 1, 32, 320, 320, 320, 32]
    - [1, 34.7338]
  - - [384, 960, 1, 32, 384, 384, 384, 32]
    - [3, 41.4863]
  - - [448, 960, 1, 32, 448, 448, 448, 32]
    - [2, 70.5244]
  - - [512, 960, 1, 32, 512, 512, 512, 32]
    - [1, 55.0046]
  - - [576, 960, 1, 32, 576, 576, 576, 32]
    - [3, 91.4002]
  - - [640, 960, 1, 32, 640, 640, 640, 32]
    - [1, 68.34]
  - - [704, 960, 1, 32, 704, 704, 704, 32]
    - [1, 74.8629]
  - - [768, 960, 1, 32, 768, 768, 768, 32]
    - [3, 81.5176]
  - - [832, 960, 1, 32, 832, 832, 832, 32]
    - [3, 103.444]
  - - [896, 960, 1, 32, 896, 896, 896, 32]
    - [2, 151.269]
  - - [960, 960, 1, 32, 960, 960, 960, 32]
    - [0, 107.777]
  - - [1024, 960, 1, 32, 1024, 1024, 1024, 32]
    - [2, 159.361]
  - - [64, 1024, 1, 32, 64, 64, 64, 32]
    - [0, 13.1248]
  - - [128, 1024, 1, 32, 128, 128, 128, 32]
    - [3, 11.4704]
  - - [192, 1024, 1, 32, 192, 192, 192, 32]
    - [2, 34.674]
  - - [256, 1024, 1, 32, 256, 256, 256, 32]
    - [1, 33.1525]
  - - [320, 1024, 1, 32, 320, 320, 320, 32]
    - [2, 677.375]
  - - [384, 1024, 1, 32, 384, 384, 384, 32]
    - [2, 53.1214]
  - - [448, 1024, 1, 32, 448, 448, 448, 32]
    - [1, 36.4232]
  - - [512, 1024, 1, 32, 512, 512, 512, 32]
    - [0, 52.7193]
  - - [576, 1024, 1, 32, 576, 576, 576, 32]
    - [2, 43.1245]
  - - [640, 1024, 1, 32, 640, 640, 640, 32]
    - [3, 51.7819]
  - - [704, 1024, 1, 32, 704, 704, 704, 32]
    - [0, 84.8656]
  - - [768, 1024, 1, 32, 768, 768, 768, 32]
    - [2, 81.9676]
  - - [832, 1024, 1, 32, 832, 832, 832, 32]
    - [0, 71.2977]
  - - [896, 1024, 1, 32, 896, 896, 896, 32]
    - [1, 72.1943]
  - - [960, 1024, 1, 32, 960, 960, 960, 32]
    - [0, 87.987]
  - - [1024, 1024, 1, 32, 1024, 1024, 1024, 32]
    - [2, 80.5363]
- null
- null
- DeviceEfficiency
- GridBased
