library/src/amd_detail/rocblaslt/src/Tensile/Logic/asm_full/navi33/Equality/navi33_Cijk_Alik_Bjlk_DB_UserArgs.yaml
- {MinimumRequiredVersion: 4.33.0}
- navi33
- gfx1102
- [Device 73f0]
    SolutionIndex: 0
    SolutionNameMin: Cijk_Alik_Bjlk_DB_UserArgs_MT8x8x8_SN_GSU1_SU32_SUM0_SUS256_TT1_1_WGM1
    SolutionIndex: 1
    SolutionNameMin: Cijk_Alik_Bjlk_DB_UserArgs_MT16x16x8_SN_GSU1_SU32_SUM0_SUS256_TT2_2_WGM1
    SolutionIndex: 2
    SolutionNameMin: Cijk_Alik_Bjlk_DB_UserArgs_MT8x8x16_SN_GSU1_SU32_SUM0_SUS256_TT1_1_WGM1
    SolutionIndex: 3
    SolutionNameMin: Cijk_Alik_Bjlk_DB_UserArgs_MT16x16x16_SN_GSU1_SU32_SUM0_SUS256_TT2_2_WGM1
- - - [64, 64, 1, 32, 64, 64, 32, 64]
    - [1, 1.15726]
  - - [128, 64, 1, 32, 128, 128, 32, 64]
    - [3, 2.31821]
  - - [192, 64, 1, 32, 192, 192, 32, 64]
    - [2, 3.47424]
  - - [256, 64, 1, 32, 256, 256, 32, 64]
    - [2, 4.63209]
  - - [320, 64, 1, 32, 320, 320, 32, 64]
    - [2, 5.79552]
  - - [384, 64, 1, 32, 384, 384, 32, 64]
    - [3, 6.95431]
  - - [448, 64, 1, 32, 448, 448, 32, 64]
    - [3, 76.2046]
  - - [512, 64, 1, 32, 512, 512, 32, 64]
    - [1, 9.2716]
  - - [576, 64, 1, 32, 576, 576, 32, 64]
    - [0, 102.578]
  - - [640, 64, 1, 32, 640, 640, 32, 64]
    - [3, 11.5757]
  - - [704, 64, 1, 32, 704, 704, 32, 64]
    - [2, 12.7349]
  - - [768, 64, 1, 32, 768, 768, 32, 64]
    - [2, 13.8773]
  - - [832, 64, 1, 32, 832, 832, 32, 64]
    - [2, 14.9677]
  - - [896, 64, 1, 32, 896, 896, 32, 64]
    - [0, 16.1127]
  - - [960, 64, 1, 32, 960, 960, 32, 64]
    - [3, 17.2894]
  - - [1024, 64, 1, 32, 1024, 1024, 32, 64]
    - [2, 18.451]
  - - [64, 128, 1, 32, 64, 64, 32, 128]
    - [3, 24.1385]
  - - [128, 128, 1, 32, 128, 128, 32, 128]
    - [0, 55.8942]
  - - [192, 128, 1, 32, 192, 192, 32, 128]
    - [2, 77.5536]
  - - [256, 128, 1, 32, 256, 256, 32, 128]
    - [3, 3.71372]
  - - [320, 128, 1, 32, 320, 320, 32, 128]
    - [3, 4.61828]
  - - [384, 128, 1, 32, 384, 384, 32, 128]
    - [1, 5.23804]
  - - [448, 128, 1, 32, 448, 448, 32, 128]
    - [3, 6.42685]
  - - [512, 128, 1, 32, 512, 512, 32, 128]
    - [1, 6.90462]
  - - [576, 128, 1, 32, 576, 576, 32, 128]
    - [3, 7.89334]
  - - [640, 128, 1, 32, 640, 640, 32, 128]
    - [2, 8.75149]
  - - [704, 128, 1, 32, 704, 704, 32, 128]
    - [3, 9.61092]
  - - [768, 128, 1, 32, 768, 768, 32, 128]
    - [3, 10.4859]
  - - [832, 128, 1, 32, 832, 832, 32, 128]
    - [1, 11.2858]
  - - [896, 128, 1, 32, 896, 896, 32, 128]
    - [1, 213.125]
  - - [960, 128, 1, 32, 960, 960, 32, 128]
    - [2, 13.1457]
  - - [1024, 128, 1, 32, 1024, 1024, 32, 128]
    - [2, 14.0183]
  - - [64, 192, 1, 32, 64, 64, 32, 192]
    - [3, 1.32088]
  - - [128, 192, 1, 32, 128, 128, 32, 192]
    - [2, 2.64208]
  - - [192, 192, 1, 32, 192, 192, 32, 192]
    - [2, 3.91608]
  - - [256, 192, 1, 32, 256, 256, 32, 192]
    - [3, 5.28406]
  - - [320, 192, 1, 32, 320, 320, 32, 192]
    - [2, 6.54701]
  - - [384, 192, 1, 32, 384, 384, 32, 192]
    - [1, 7.81296]
  - - [448, 192, 1, 32, 448, 448, 32, 192]
    - [2, 9.13691]
  - - [512, 192, 1, 32, 512, 512, 32, 192]
    - [1, 10.4083]
  - - [576, 192, 1, 32, 576, 576, 32, 192]
    - [2, 11.7711]
  - - [640, 192, 1, 32, 640, 640, 32, 192]
    - [3, 13.14]
  - - [704, 192, 1, 32, 704, 704, 32, 192]
    - [1, 14.2987]
  - - [768, 192, 1, 32, 768, 768, 32, 192]
    - [2, 15.7448]
  - - [832, 192, 1, 32, 832, 832, 32, 192]
    - [2, 17.0191]
  - - [896, 192, 1, 32, 896, 896, 32, 192]
    - [2, 18.3705]
  - - [960, 192, 1, 32, 960, 960, 32, 192]
    - [1, 19.4195]
  - - [1024, 192, 1, 32, 1024, 1024, 32, 192]
    - [3, 20.9334]
  - - [64, 256, 1, 32, 64, 64, 32, 256]
    - [2, 1.73956]
  - - [128, 256, 1, 32, 128, 128, 32, 256]
    - [1, 3.50886]
  - - [192, 256, 1, 32, 192, 192, 32, 256]
    - [3, 5.30402]
  - - [256, 256, 1, 32, 256, 256, 32, 256]
    - [3, 7.03596]
  - - [320, 256, 1, 32, 320, 320, 32, 256]
    - [3, 8.79437]
  - - [384, 256, 1, 32, 384, 384, 32, 256]
    - [2, 10.3936]
  - - [448, 256, 1, 32, 448, 448, 32, 256]
    - [2, 12.1206]
  - - [512, 256, 1, 32, 512, 512, 32, 256]
    - [3, 14.0427]
  - - [576, 256, 1, 32, 576, 576, 32, 256]
    - [3, 15.7864]
  - - [640, 256, 1, 32, 640, 640, 32, 256]
    - [3, 17.4744]
  - - [704, 256, 1, 32, 704, 704, 32, 256]
    - [1, 247.513]
  - - [768, 256, 1, 32, 768, 768, 32, 256]
    - [2, 20.6236]
  - - [832, 256, 1, 32, 832, 832, 32, 256]
    - [3, 22.6944]
  - - [896, 256, 1, 32, 896, 896, 32, 256]
    - [3, 24.3493]
  - - [960, 256, 1, 32, 960, 960, 32, 256]
    - [2, 25.8264]
  - - [1024, 256, 1, 32, 1024, 1024, 32, 256]
    - [1, 24.3747]
  - - [64, 320, 1, 32, 64, 64, 32, 320]
    - [2, 1.92099]
  - - [128, 320, 1, 32, 128, 128, 32, 320]
    - [2, 112.993]
  - - [192, 320, 1, 32, 192, 192, 32, 320]
    - [2, 15.7677]
  - - [256, 320, 1, 32, 256, 256, 32, 320]
    - [2, 170.445]
  - - [320, 320, 1, 32, 320, 320, 32, 320]
    - [2, 10.8445]
  - - [384, 320, 1, 32, 384, 384, 32, 320]
    - [1, 12.7485]
  - - [448, 320, 1, 32, 448, 448, 32, 320]
    - [1, 15.127]
  - - [512, 320, 1, 32, 512, 512, 32, 320]
    - [2, 17.4663]
  - - [576, 320, 1, 32, 576, 576, 32, 320]
    - [2, 14.4937]
  - - [640, 320, 1, 32, 640, 640, 32, 320]
    - [3, 21.761]
  - - [704, 320, 1, 32, 704, 704, 32, 320]
    - [3, 24.1234]
  - - [768, 320, 1, 32, 768, 768, 32, 320]
    - [1, 26.199]
  - - [832, 320, 1, 32, 832, 832, 32, 320]
    - [2, 28.1632]
  - - [896, 320, 1, 32, 896, 896, 32, 320]
    - [2, 30.1531]
  - - [960, 320, 1, 32, 960, 960, 32, 320]
    - [3, 31.8247]
  - - [1024, 320, 1, 32, 1024, 1024, 32, 320]
    - [2, 34.0556]
  - - [64, 384, 1, 32, 64, 64, 32, 384]
    - [3, 2.66269]
  - - [128, 384, 1, 32, 128, 128, 32, 384]
    - [1, 5.26381]
  - - [192, 384, 1, 32, 192, 192, 32, 384]
    - [3, 7.91506]
  - - [256, 384, 1, 32, 256, 256, 32, 384]
    - [2, 10.4834]
  - - [320, 384, 1, 32, 320, 320, 32, 384]
    - [3, 13.1668]
  - - [384, 384, 1, 32, 384, 384, 32, 384]
    - [2, 15.7136]
  - - [448, 384, 1, 32, 448, 448, 32, 384]
    - [3, 18.5612]
  - - [512, 384, 1, 32, 512, 512, 32, 384]
    - [3, 21.012]
  - - [576, 384, 1, 32, 576, 576, 32, 384]
    - [2, 23.57]
  - - [640, 384, 1, 32, 640, 640, 32, 384]
    - [1, 26.1267]
  - - [704, 384, 1, 32, 704, 704, 32, 384]
    - [2, 25.9286]
  - - [768, 384, 1, 32, 768, 768, 32, 384]
    - [3, 30.459]
  - - [832, 384, 1, 32, 832, 832, 32, 384]
    - [3, 32.9458]
  - - [896, 384, 1, 32, 896, 896, 32, 384]
    - [2, 35.4332]
  - - [960, 384, 1, 32, 960, 960, 32, 384]
    - [1, 321.255]
  - - [1024, 384, 1, 32, 1024, 1024, 32, 384]
    - [3, 35.291]
  - - [64, 448, 1, 32, 64, 64, 32, 448]
    - [1, 3.08144]
  - - [128, 448, 1, 32, 128, 128, 32, 448]
    - [1, 6.12932]
  - - [192, 448, 1, 32, 192, 192, 32, 448]
    - [1, 9.12646]
  - - [256, 448, 1, 32, 256, 256, 32, 448]
    - [2, 12.2539]
  - - [320, 448, 1, 32, 320, 320, 32, 448]
    - [2, 15.2543]
  - - [384, 448, 1, 32, 384, 384, 32, 448]
    - [2, 18.3503]
  - - [448, 448, 1, 32, 448, 448, 32, 448]
    - [2, 21.3375]
  - - [512, 448, 1, 32, 512, 512, 32, 448]
    - [2, 250.342]
  - - [576, 448, 1, 32, 576, 576, 32, 448]
    - [3, 27.1378]
  - - [640, 448, 1, 32, 640, 640, 32, 448]
    - [3, 29.9288]
  - - [704, 448, 1, 32, 704, 704, 32, 448]
    - [3, 30.1579]
  - - [768, 448, 1, 32, 768, 768, 32, 448]
    - [2, 31.8502]
  - - [832, 448, 1, 32, 832, 832, 32, 448]
    - [3, 35.3894]
  - - [896, 448, 1, 32, 896, 896, 32, 448]
    - [1, 37.6614]
  - - [960, 448, 1, 32, 960, 960, 32, 448]
    - [2, 41.1963]
  - - [1024, 448, 1, 32, 1024, 1024, 32, 448]
    - [2, 44.0087]
  - - [64, 512, 1, 32, 64, 64, 32, 512]
    - [1, 3.52295]
  - - [128, 512, 1, 32, 128, 128, 32, 512]
    - [1, 6.94911]
  - - [192, 512, 1, 32, 192, 192, 32, 512]
    - [3, 10.5167]
  - - [256, 512, 1, 32, 256, 256, 32, 512]
    - [2, 14.0604]
  - - [320, 512, 1, 32, 320, 320, 32, 512]
    - [2, 17.2647]
  - - [384, 512, 1, 32, 384, 384, 32, 512]
    - [3, 18.5058]
  - - [448, 512, 1, 32, 448, 448, 32, 512]
    - [2, 24.1574]
  - - [512, 512, 1, 32, 512, 512, 32, 512]
    - [3, 23.8816]
  - - [576, 512, 1, 32, 576, 576, 32, 512]
    - [1, 30.8791]
  - - [640, 512, 1, 32, 640, 640, 32, 512]
    - [1, 30.8095]
  - - [704, 512, 1, 32, 704, 704, 32, 512]
    - [1, 31.2565]
  - - [768, 512, 1, 32, 768, 768, 32, 512]
    - [3, 37.0819]
  - - [832, 512, 1, 32, 832, 832, 32, 512]
    - [0, 38.4813]
  - - [896, 512, 1, 32, 896, 896, 32, 512]
    - [3, 272.76]
  - - [960, 512, 1, 32, 960, 960, 32, 512]
    - [2, 285.143]
  - - [1024, 512, 1, 32, 1024, 1024, 32, 512]
    - [2, 300.344]
  - - [64, 576, 1, 32, 64, 64, 32, 576]
    - [1, 3.94252]
  - - [128, 576, 1, 32, 128, 128, 32, 576]
    - [2, 7.85877]
  - - [192, 576, 1, 32, 192, 192, 32, 576]
    - [1, 11.7529]
  - - [256, 576, 1, 32, 256, 256, 32, 576]
    - [2, 15.6784]
  - - [320, 576, 1, 32, 320, 320, 32, 576]
    - [2, 19.6958]
  - - [384, 576, 1, 32, 384, 384, 32, 576]
    - [3, 23.6192]
  - - [448, 576, 1, 32, 448, 448, 32, 576]
    - [2, 27.2277]
  - - [512, 576, 1, 32, 512, 512, 32, 576]
    - [1, 303.057]
  - - [576, 576, 1, 32, 576, 576, 32, 576]
    - [2, 56.6076]
  - - [640, 576, 1, 32, 640, 640, 32, 576]
    - [3, 37.3097]
  - - [704, 576, 1, 32, 704, 704, 32, 576]
    - [3, 40.4755]
  - - [768, 576, 1, 32, 768, 768, 32, 576]
    - [3, 42.0593]
  - - [832, 576, 1, 32, 832, 832, 32, 576]
    - [3, 45.7279]
  - - [896, 576, 1, 32, 896, 896, 32, 576]
    - [1, 48.5906]
  - - [960, 576, 1, 32, 960, 960, 32, 576]
    - [2, 52.451]
  - - [1024, 576, 1, 32, 1024, 1024, 32, 576]
    - [1, 52.4547]
  - - [64, 640, 1, 32, 64, 64, 32, 640]
    - [2, 4.36809]
  - - [128, 640, 1, 32, 128, 128, 32, 640]
    - [1, 8.54343]
  - - [192, 640, 1, 32, 192, 192, 32, 640]
    - [2, 13.0236]
  - - [256, 640, 1, 32, 256, 256, 32, 640]
    - [3, 17.4794]
  - - [320, 640, 1, 32, 320, 320, 32, 640]
    - [2, 21.473]
  - - [384, 640, 1, 32, 384, 384, 32, 640]
    - [1, 25.7238]
  - - [448, 640, 1, 32, 448, 448, 32, 640]
    - [1, 28.8571]
  - - [512, 640, 1, 32, 512, 512, 32, 640]
    - [3, 31.1338]
  - - [576, 640, 1, 32, 576, 576, 32, 640]
    - [3, 37.6695]
  - - [640, 640, 1, 32, 640, 640, 32, 640]
    - [3, 41.3063]
  - - [704, 640, 1, 32, 704, 704, 32, 640]
    - [2, 282.038]
  - - [768, 640, 1, 32, 768, 768, 32, 640]
    - [1, 44.3651]
  - - [832, 640, 1, 32, 832, 832, 32, 640]
    - [1, 339.561]
  - - [896, 640, 1, 32, 896, 896, 32, 640]
    - [1, 342.221]
  - - [960, 640, 1, 32, 960, 960, 32, 640]
    - [2, 54.8507]
  - - [1024, 640, 1, 32, 1024, 1024, 32, 640]
    - [1, 60.763]
  - - [64, 704, 1, 32, 64, 64, 32, 704]
    - [2, 4.83657]
  - - [128, 704, 1, 32, 128, 128, 32, 704]
    - [2, 9.51187]
  - - [192, 704, 1, 32, 192, 192, 32, 704]
    - [3, 14.5053]
  - - [256, 704, 1, 32, 256, 256, 32, 704]
    - [1, 19.0363]
  - - [320, 704, 1, 32, 320, 320, 32, 704]
    - [1, 267.593]
  - - [384, 704, 1, 32, 384, 384, 32, 704]
    - [2, 28.4469]
  - - [448, 704, 1, 32, 448, 448, 32, 704]
    - [2, 32.8767]
  - - [512, 704, 1, 32, 512, 512, 32, 704]
    - [1, 32.7986]
  - - [576, 704, 1, 32, 576, 576, 32, 704]
    - [1, 319.605]
  - - [640, 704, 1, 32, 640, 640, 32, 704]
    - [3, 44.8045]
  - - [704, 704, 1, 32, 704, 704, 32, 704]
    - [3, 46.3515]
  - - [768, 704, 1, 32, 768, 768, 32, 704]
    - [1, 50.2597]
  - - [832, 704, 1, 32, 832, 832, 32, 704]
    - [2, 54.9452]
  - - [896, 704, 1, 32, 896, 896, 32, 704]
    - [1, 58.9238]
  - - [960, 704, 1, 32, 960, 960, 32, 704]
    - [3, 57.3889]
  - - [1024, 704, 1, 32, 1024, 1024, 32, 704]
    - [1, 67.3308]
  - - [64, 768, 1, 32, 64, 64, 32, 768]
    - [2, 5.13066]
  - - [128, 768, 1, 32, 128, 128, 32, 768]
    - [3, 10.4063]
  - - [192, 768, 1, 32, 192, 192, 32, 768]
    - [3, 15.5295]
  - - [256, 768, 1, 32, 256, 256, 32, 768]
    - [2, 235.635]
  - - [320, 768, 1, 32, 320, 320, 32, 768]
    - [3, 25.7752]
  - - [384, 768, 1, 32, 384, 384, 32, 768]
    - [2, 27.6193]
  - - [448, 768, 1, 32, 448, 448, 32, 768]
    - [2, 35.5029]
  - - [512, 768, 1, 32, 512, 512, 32, 768]
    - [0, 283.396]
  - - [576, 768, 1, 32, 576, 576, 32, 768]
    - [3, 41.5159]
  - - [640, 768, 1, 32, 640, 640, 32, 768]
    - [1, 318.394]
  - - [704, 768, 1, 32, 704, 704, 32, 768]
    - [1, 151.018]
  - - [768, 768, 1, 32, 768, 768, 32, 768]
    - [2, 54.769]
  - - [832, 768, 1, 32, 832, 832, 32, 768]
    - [3, 59.8533]
  - - [896, 768, 1, 32, 896, 896, 32, 768]
    - [3, 64.697]
  - - [960, 768, 1, 32, 960, 960, 32, 768]
    - [3, 272.639]
  - - [1024, 768, 1, 32, 1024, 1024, 32, 768]
    - [0, 158.739]
  - - [64, 832, 1, 32, 64, 64, 32, 832]
    - [3, 5.6198]
  - - [128, 832, 1, 32, 128, 128, 32, 832]
    - [3, 11.2135]
  - - [192, 832, 1, 32, 192, 192, 32, 832]
    - [1, 12.6673]
  - - [256, 832, 1, 32, 256, 256, 32, 832]
    - [2, 21.8459]
  - - [320, 832, 1, 32, 320, 320, 32, 832]
    - [2, 27.6993]
  - - [384, 832, 1, 32, 384, 384, 32, 832]
    - [2, 33.2084]
  - - [448, 832, 1, 32, 448, 448, 32, 832]
    - [1, 34.47]
  - - [512, 832, 1, 32, 512, 512, 32, 832]
    - [3, 38.4699]
  - - [576, 832, 1, 32, 576, 576, 32, 832]
    - [3, 44.7355]
  - - [640, 832, 1, 32, 640, 640, 32, 832]
    - [2, 49.7729]
  - - [704, 832, 1, 32, 704, 704, 32, 832]
    - [0, 51.9778]
  - - [768, 832, 1, 32, 768, 768, 32, 832]
    - [2, 60.0476]
  - - [832, 832, 1, 32, 832, 832, 32, 832]
    - [3, 61.0171]
  - - [896, 832, 1, 32, 896, 896, 32, 832]
    - [3, 68.7008]
  - - [960, 832, 1, 32, 960, 960, 32, 832]
    - [1, 73.7301]
  - - [1024, 832, 1, 32, 1024, 1024, 32, 832]
    - [2, 76.7188]
  - - [64, 896, 1, 32, 64, 64, 32, 896]
    - [3, 6.0638]
  - - [128, 896, 1, 32, 128, 128, 32, 896]
    - [1, 11.8097]
  - - [192, 896, 1, 32, 192, 192, 32, 896]
    - [1, 260.408]
  - - [256, 896, 1, 32, 256, 256, 32, 896]
    - [1, 112.061]
  - - [320, 896, 1, 32, 320, 320, 32, 896]
    - [1, 21.646]
  - - [384, 896, 1, 32, 384, 384, 32, 896]
    - [3, 35.1622]
  - - [448, 896, 1, 32, 448, 448, 32, 896]
    - [2, 40.6641]
  - - [512, 896, 1, 32, 512, 512, 32, 896]
    - [2, 42.9101]
  - - [576, 896, 1, 32, 576, 576, 32, 896]
    - [0, 43.0245]
  - - [640, 896, 1, 32, 640, 640, 32, 896]
    - [3, 79.8571]
  - - [704, 896, 1, 32, 704, 704, 32, 896]
    - [1, 49.3707]
  - - [768, 896, 1, 32, 768, 768, 32, 896]
    - [3, 63.6994]
  - - [832, 896, 1, 32, 832, 832, 32, 896]
    - [2, 61.6821]
  - - [896, 896, 1, 32, 896, 896, 32, 896]
    - [2, 72.8566]
  - - [960, 896, 1, 32, 960, 960, 32, 896]
    - [1, 354.886]
  - - [1024, 896, 1, 32, 1024, 1024, 32, 896]
    - [0, 317.886]
  - - [64, 960, 1, 32, 64, 64, 32, 960]
    - [1, 53.3971]
  - - [128, 960, 1, 32, 128, 128, 32, 960]
    - [3, 90.4142]
  - - [192, 960, 1, 32, 192, 192, 32, 960]
    - [2, 122.611]
  - - [256, 960, 1, 32, 256, 256, 32, 960]
    - [3, 183.744]
  - - [320, 960, 1, 32, 320, 320, 32, 960]
    - [3, 223.215]
  - - [384, 960, 1, 32, 384, 384, 32, 960]
    - [3, 254.894]
  - - [448, 960, 1, 32, 448, 448, 32, 960]
    - [1, 281.213]
  - - [512, 960, 1, 32, 512, 512, 32, 960]
    - [1, 112.761]
  - - [576, 960, 1, 32, 576, 576, 32, 960]
    - [3, 48.9911]
  - - [640, 960, 1, 32, 640, 640, 32, 960]
    - [3, 55.7371]
  - - [704, 960, 1, 32, 704, 704, 32, 960]
    - [2, 63.3231]
  - - [768, 960, 1, 32, 768, 768, 32, 960]
    - [3, 68.2938]
  - - [832, 960, 1, 32, 832, 832, 32, 960]
    - [2, 72.4314]
  - - [896, 960, 1, 32, 896, 896, 32, 960]
    - [1, 77.3032]
  - - [960, 960, 1, 32, 960, 960, 32, 960]
    - [1, 81.6484]
  - - [1024, 960, 1, 32, 1024, 1024, 32, 960]
    - [1, 88.853]
  - - [64, 1024, 1, 32, 64, 64, 32, 1024]
    - [1, 6.85587]
  - - [128, 1024, 1, 32, 128, 128, 32, 1024]
    - [2, 13.7617]
  - - [192, 1024, 1, 32, 192, 192, 32, 1024]
    - [3, 20.7908]
  - - [256, 1024, 1, 32, 256, 256, 32, 1024]
    - [2, 264.621]
  - - [320, 1024, 1, 32, 320, 320, 32, 1024]
    - [0, 110.725]
  - - [384, 1024, 1, 32, 384, 384, 32, 1024]
    - [1, 34.0459]
  - - [448, 1024, 1, 32, 448, 448, 32, 1024]
    - [1, 329.589]
  - - [512, 1024, 1, 32, 512, 512, 32, 1024]
    - [1, 49.0545]
  - - [576, 1024, 1, 32, 576, 576, 32, 1024]
    - [3, 51.7861]
  - - [640, 1024, 1, 32, 640, 640, 32, 1024]
    - [3, 60.799]
  - - [704, 1024, 1, 32, 704, 704, 32, 1024]
    - [3, 66.7098]
  - - [768, 1024, 1, 32, 768, 768, 32, 1024]
    - [1, 73.2018]
  - - [832, 1024, 1, 32, 832, 832, 32, 1024]
    - [0, 76.422]
  - - [896, 1024, 1, 32, 896, 896, 32, 1024]
    - [1, 83.9504]
  - - [960, 1024, 1, 32, 960, 960, 32, 1024]
    - [1, 88.6428]
  - - [1024, 1024, 1, 32, 1024, 1024, 32, 1024]
    - [0, 89.8096]
- null
- null
- DeviceEfficiency
- Equality
