library/src/amd_detail/rocblaslt/src/Tensile/Logic/asm_full/aquavanjaram/gfx942/Equality/aquavanjaram_Cijk_Alik_Bljk_BBS_BH_UserArgs.yaml
- {MinimumRequiredVersion: 4.33.0}
- aquavanjaram
- gfx942
- [Device 0049, Device 0050]
    SolutionIndex: 0
    SolutionNameMin: Cijk_Alik_Bljk_BBS_BH_MT128x128x64_MI32x32x1_SN_LDSB1_GRVWB8_GSU1_LBSPPA256_LBSPPB128_LPA8_LPB8_LRVW8_MIWT2_2_SVW2_VWA2_WG64_4_1
    SolutionIndex: 1
    SolutionNameMin: Cijk_Alik_Bljk_BBS_BH_MT128x64x64_MI16x16x1_SN_LDSB1_GRVWB8_GSU1_LBSPPA256_LBSPPB128_LPA16_LPB16_LRVW8_MIWT2_4_SVW2_VWA2_WG64_4_1
    SolutionIndex: 2
    SolutionNameMin: Cijk_Alik_Bljk_BBS_BH_MT256x224x64_MI16x16x1_SN_LDSB1_GRVWB4_GSU1_LBSPPA512_LBSPPB128_LPA8_LPB4_LRVW4_MIWT4_14_SVW4_VWA4_WG64_4_1
    SolutionIndex: 3
    SolutionNameMin: Cijk_Alik_Bljk_BBS_BH_MT16x128x64_MI16x16x1_SN_LDSB1_GSU10_LBSPPA128_LBSPPB128_MIWT1_2_NTB0_NLCA1_SU0_SUM0_SUS0_SPO1_WG16_16_1
    SolutionIndex: 4
    SolutionNameMin: Cijk_Alik_Bljk_BBS_BH_MT16x32x64_MI16x16x1_SN_LDSB0_GSU8_LBSPPA128_LBSPPB128_MIWT1_1_NTB0_NLCA1_SU4_SUM2_SUS512_SPO1_WG16_8_1
    SolutionIndex: 5
    SolutionNameMin: Cijk_Alik_Bljk_BBS_BH_MT16x32x64_MI16x16x1_SN_LDSB0_GSU15_LBSPPA128_LBSPPB128_MIWT1_1_NTB1_NLCA1_SU4_SUM2_SUS256_SPO1_WG16_8_1
    SolutionIndex: 6
    SolutionNameMin: Cijk_Alik_Bljk_BBS_BH_MT256x224x64_MI16x16x1_SN_LDSB1_GRVWB4_GSU1_LBSPPA1024_LBSPPB128_MIWT8_7_SU0_SUM0_SUS0_SVW8_VWA8_WG32_8_1
    SolutionIndex: 7
    SolutionNameMin: Cijk_Alik_Bljk_BBS_BH_MT256x224x64_MI16x16x1_SN_LDSB1_GRVWB4_GSU1_LBSPPA1024_LBSPPB128_MIWT8_7_SU4_SUM2_SUS256_SVW8_VWA8_WG32_8_1
    SolutionIndex: 8
    SolutionNameMin: Cijk_Alik_Bljk_BBS_BH_MT256x144x64_MI16x16x1_SN_LDSB1_GRVWB4_GSU1_LBSPPA512_LBSPPB128_MIWT4_9_SU0_SUM0_SUS0_SVW4_VWA4_WG64_4_1
    SolutionIndex: 9
    SolutionNameMin: Cijk_Alik_Bljk_BBS_BH_MT256x192x64_MI16x16x1_SN_LDSB1_GRVWA4_GRVWB4_GSU1_LBSPPA1024_LPA4_LPB4_LRVW4_MIWT8_6_SU4_SUS512_SVW8_VWA8_WSGRB0_WG32_8_1_WGM1
    SolutionIndex: 10
    SolutionNameMin: Cijk_Alik_Bljk_BBS_BH_MT256x192x64_MI16x16x1_SN_LDSB1_GRVWA4_GRVWB4_GSU1_LBSPPA1024_LPA4_LPB4_LRVW4_MIWT8_6_SU8_SUS256_SVW8_VWA8_WSGRB0_WG32_8_1_WGM40
    SolutionIndex: 11
    SolutionNameMin: Cijk_Alik_Bljk_BBS_BH_MT256x144x64_MI16x16x1_SN_LDSB1_GRVWA8_GRVWB4_GSU1_LBSPPA512_LPA16_LPB16_LRVW8_MIWT4_9_SU8_SUS512_SVW4_VWA4_WSGRB0_WG64_4_1_WGM40
    SolutionIndex: 12
    SolutionNameMin: Cijk_Alik_Bljk_BBS_BH_MT128x256x64_MI16x16x1_SN_LDSB1_GRVWA8_GRVWB8_GSU1_LBSPPA512_LPA16_LPB16_LRVW8_MIWT4_8_SU8_SUS256_SVW4_VWA4_WSGRB1_WG32_8_1_WGM40
    SolutionIndex: 13
    SolutionNameMin: Cijk_Alik_Bljk_BBS_BH_MT128x16x128_MI16x16x1_SN_GSU4_MIWT2_1_WGM1
    SolutionIndex: 14
    SolutionNameMin: Cijk_Alik_Bljk_BBS_BH_MT16x16x128_MI16x16x1_SN_GSU7_MIWT1_1_WGM1
    SolutionIndex: 15
    SolutionNameMin: Cijk_Alik_Bljk_BBS_BH_MT16x16x128_MI16x16x1_SN_GSU7_MIWT1_1_WGM1
    SolutionIndex: 16
    SolutionNameMin: Cijk_Alik_Bljk_BBS_BH_MT64x16x128_MI16x16x1_SN_GRVWA8_GRVWB8_GSU1_LBSPPA256_LBSPPB256_LPA16_LPB16_LRVW8_MIWT1_1_PKA1_SU8_SUM0_SUS256_SVW1_VWA1_WG64_4_1_WGM0
    SolutionIndex: 17
    SolutionNameMin: Cijk_Alik_Bljk_BBS_BH_MT32x16x128_MI16x16x1_SN_GRVWA8_GRVWB8_GSU1_LBSPPA256_LBSPPB256_LPA16_LPB16_LRVW8_MIWT1_1_PKA1_SU8_SUM0_SUS256_SVW1_VWA1_WG32_4_1_WGM0
- - - [512, 512, 1, 512]
    - [1, 0.0]
  - - [1024, 1024, 1, 1024]
    - [1, 0.0]
  - - [2048, 2048, 1, 2048]
    - [0, 0.0]
  - - [4096, 4096, 1, 4096]
    - [2, 0.0]
  - - [4096, 4096, 1, 8192]
    - [2, 0.0]
  - - [8192, 8192, 1, 8192]
    - [2, 0.0]
  - - [2, 7168, 1, 8192]
    - [3, 0.0]
  - - [2, 3584, 1, 8192]
    - [4, 0.0]
  - - [2, 1280, 1, 8192]
    - [5, 0.0]
  - - [8192, 7168, 1, 8192]
    - [6, 0.0]
  - - [8192, 3584, 1, 8192]
    - [7, 0.0]
  - - [8192, 1280, 1, 8192]
    - [8, 0.0]
  - - [7168, 2, 1, 8192]
    - [13, 0.0]
  - - [3584, 2, 1, 8192]
    - [13, 0.0]
  - - [1280, 2, 1, 8192]
    - [14, 0.0]
  - - [1024, 2, 1, 8192]
    - [15, 0.0]
  - - [7168, 8192, 1, 8192]
    - [9, 0.0]
  - - [3584, 8192, 1, 8192]
    - [10, 0.0]
  - - [1280, 8192, 1, 8192]
    - [11, 0.0]
  - - [1024, 8192, 1, 8192]
    - [12, 0.0]
  - - [8192, 2, 1, 1024]
    - [16, 0.0]
  - - [8192, 2, 1, 3584]
    - [17, 0.0]
- null
- null
- DeviceEfficiency
- Equality
