library/src/amd_detail/rocblaslt/src/Tensile/Logic/asm_full/aquavanjaram/gfx942/Equality/aquavanjaram_Cijk_Ailk_Bjlk_HHS_BH_Bias_HAS_SAV_UserArgs.yaml
- {MinimumRequiredVersion: 4.33.0}
- aquavanjaram
- gfx942
- [Device 0049, Device 0050]
    SolutionIndex: 0
    SolutionNameMin: Cijk_Ailk_Bjlk_HHS_BH_Bias_HAS_SAV_UserArgs_MT16x128x32_MI16x16x1_SN_GSU1_GSUC0_GSUWGMRR1_K1_MIWT1_2_SU8_SUM0_SUS256_WGM8_WGMXCC1_WGMXCCGn1
    SolutionIndex: 1
    SolutionNameMin: Cijk_Ailk_Bjlk_HHS_BH_Bias_HAS_SAV_UserArgs_MT64x192x32_MI16x16x1_SN_GSU1_GSUC1_GSUWGMRR1_K1_LBSPPA512_LBSPPB1536_LPA32_LPB32_MIWT2_6_SU0_SUM0_SUS0_SVW2_VWA2_VWB2_WG32_8_1_WGM1_WGMXCC1_WGMXCCG0
    SolutionIndex: 2
    SolutionNameMin: Cijk_Ailk_Bjlk_HHS_BH_Bias_HAS_SAV_UserArgs_MT32x128x64_MI16x16x1_SN_GSU1_GSUC0_GSUWGMRR1_K1_MIWT2_2_SU8_SUM0_SUS256_WGM8_WGMXCC1_WGMXCCGn1
    SolutionIndex: 3
    SolutionNameMin: Cijk_Ailk_Bjlk_HHS_BH_Bias_HAS_SAV_UserArgs_MT32x128x32_MI16x16x1_SN_GSU1_GSUC0_GSUWGMRR1_K1_MIWT2_2_SU8_SUM0_SUS256_WGM1_WGMXCC1_WGMXCCGn1
    SolutionIndex: 4
    SolutionNameMin: Cijk_Ailk_Bjlk_HHS_BH_Bias_HAS_SAV_UserArgs_MT64x192x32_MI16x16x1_SN_GSU1_GSUC0_GSUWGMRR0_K1_LBSPPA512_LBSPPB1536_LPA0_LPB16_MIWT4_3_SU0_SUM0_SUS0_SVW4_VWA4_VWB1_WG16_16_1_WGM1_WGMXCC1_WGMXCCGn1
    SolutionIndex: 5
    SolutionNameMin: Cijk_Ailk_Bjlk_HHS_BH_Bias_HAS_SAV_UserArgs_MT16x128x32_MI16x16x1_SN_GSU1_GSUC0_GSUWGMRR0_K1_MIWT1_2_SU8_SUM0_SUS256_WGM8_WGMXCC1_WGMXCCGn1
    SolutionIndex: 6
    SolutionNameMin: Cijk_Ailk_Bjlk_HHS_BH_Bias_HAS_SAV_UserArgs_MT32x64x32_MI16x16x1_SN_GSU1_GSUC0_GSUWGMRR0_K1_MIWT2_1_SU8_SUM0_SUS256_WGM8_WGMXCC1_WGMXCCGn1
    SolutionIndex: 7
    SolutionNameMin: Cijk_Ailk_Bjlk_HHS_BH_Bias_HAS_SAV_UserArgs_MT32x128x32_MI16x16x1_SN_GSU1_GSUC0_GSUWGMRR0_K1_MIWT2_2_SU8_SUM0_SUS256_WGM1_WGMXCC1_WGMXCCGn1
    SolutionIndex: 8
    SolutionNameMin: Cijk_Ailk_Bjlk_HHS_BH_Bias_HAS_SAV_UserArgs_MT48x256x32_MI16x16x1_SN_GSU1_GSUC1_GSUWGMRR0_K1_MIWT3_4_SU8_SUM0_SUS256_WGM8_WGMXCC1_WGMXCCGn1
    SolutionIndex: 9
    SolutionNameMin: Cijk_Ailk_Bjlk_HHS_BH_Bias_HAS_SAV_UserArgs_MT16x128x64_MI16x16x1_SN_GSU1_GSUC0_GSUWGMRR1_K1_MIWT1_2_SU8_SUM0_SUS256_WGM8_WGMXCC1_WGMXCCGn1
    SolutionIndex: 10
    SolutionNameMin: Cijk_Ailk_Bjlk_HHS_BH_Bias_HAS_SAV_UserArgs_MT32x256x32_MI16x16x1_SN_GSU1_GSUC0_GSUWGMRR0_K1_MIWT2_4_SU8_SUM0_SUS256_WGM8_WGMXCC1_WGMXCCGn1
    SolutionIndex: 11
    SolutionNameMin: Cijk_Ailk_Bjlk_HHS_BH_Bias_HAS_SAV_UserArgs_MT32x192x32_MI16x16x1_SN_GSU1_GSUC0_GSUWGMRR0_K1_MIWT2_3_SU8_SUM0_SUS256_WGM1_WGMXCC1_WGMXCCGn1
    SolutionIndex: 12
    SolutionNameMin: Cijk_Ailk_Bjlk_HHS_BH_Bias_HAS_SAV_UserArgs_MT64x192x32_MI16x16x1_SN_GSU1_GSUC0_GSUWGMRR0_K1_LBSPPA512_LBSPPB1536_LPA32_LPB32_MIWT2_6_SU0_SUM0_SUS0_SVW2_VWA2_VWB2_WG32_8_1_WGM1_WGMXCC1_WGMXCCG0
    SolutionIndex: 13
    SolutionNameMin: Cijk_Ailk_Bjlk_HHS_BH_Bias_HAS_SAV_UserArgs_MT16x256x32_MI16x16x1_SN_GSU1_GSUC0_GSUWGMRR0_K1_MIWT1_4_SU8_SUM0_SUS256_WGM8_WGMXCC1_WGMXCCGn1
    SolutionIndex: 14
    SolutionNameMin: Cijk_Ailk_Bjlk_HHS_BH_Bias_HAS_SAV_UserArgs_MT32x128x32_MI16x16x1_SN_GSU1_GSUC0_GSUWGMRR1_K1_MIWT2_2_SU8_SUM0_SUS256_WGM8_WGMXCC1_WGMXCCGn1
    SolutionIndex: 15
    SolutionNameMin: Cijk_Ailk_Bjlk_HHS_BH_Bias_HAS_SAV_UserArgs_MT16x256x32_MI16x16x1_SN_GSU1_GSUC1_GSUWGMRR0_K1_MIWT1_4_SU8_SUM0_SUS256_WGM1_WGMXCC1_WGMXCCGn1
- - - [16, 160, 2048, 488]
    - [15, 0.0]
  - - [16, 96, 2048, 103]
    - [0, 0.0]
  - - [64, 160, 2048, 1274]
    - [1, 0.0]
  - - [32, 128, 2048, 607]
    - [2, 0.0]
  - - [32, 128, 2048, 94]
    - [3, 0.0]
  - - [64, 160, 2048, 99]
    - [4, 0.0]
  - - [15, 96, 2048, 29]
    - [5, 0.0]
  - - [24, 128, 2048, 73]
    - [6, 0.0]
  - - [32, 96, 2048, 89]
    - [7, 0.0]
  - - [10, 96, 2048, 27]
    - [0, 0.0]
  - - [40, 160, 2048, 1060]
    - [8, 0.0]
  - - [8, 80, 2048, 90]
    - [5, 0.0]
  - - [15, 96, 2048, 407]
    - [9, 0.0]
  - - [15, 96, 2048, 33]
    - [0, 0.0]
  - - [32, 160, 2048, 466]
    - [10, 0.0]
  - - [18, 180, 2048, 358]
    - [11, 0.0]
  - - [24, 96, 2048, 81]
    - [3, 0.0]
  - - [32, 160, 2048, 70]
    - [11, 0.0]
  - - [40, 160, 2048, 105]
    - [12, 0.0]
  - - [32, 96, 2048, 623]
    - [3, 0.0]
  - - [32, 96, 2048, 81]
    - [3, 0.0]
  - - [16, 160, 2048, 36]
    - [13, 0.0]
  - - [24, 128, 2048, 699]
    - [14, 0.0]
  - - [16, 96, 2048, 33]
    - [5, 0.0]
- null
- null
- DeviceEfficiency
- Equality
