library/src/amd_detail/rocblaslt/src/Tensile/Logic/asm_full/aquavanjaram/gfx942/Equality/aquavanjaram_Cijk_Ailk_Bljk_F8B8HS_BH_UserArgs.yaml
- {MinimumRequiredVersion: 4.33.0}
- aquavanjaram
- gfx942
- [Device 0049, Device 0050]
    SolutionIndex: 0
    SolutionNameMin: Cijk_Ailk_Bljk_F8B8HS_BH_UserArgs_MT256x256x64_MI16x16x1_SN_LDSB1_CLR1_GRVWB4_GSU1_GSUC0_GSUWGMRR0_GLS0_K1_LBSPPA2048_LBSPPB512_LPA32_LPB8_LRVW8_MIAV0_MIWT8_8_NTC4_NTD4_SU8_SUM0_SUS256_SPO1_SSO4_SVW8_VWA8_VWB8_WG32_8_1_WGM32_WGMXCC1_WGMXCCGn1
    SolutionIndex: 1
    SolutionNameMin: Cijk_Ailk_Bljk_F8B8HS_BH_UserArgs_MT256x256x64_MI16x16x1_SN_LDSB1_CLR1_GRVWB4_GSU1_GSUC0_GSUWGMRR0_GLS0_K1_LBSPPA2048_LBSPPB512_LPA0_LPB48_LRVW8_MIAV0_MIWT8_8_NTC4_NTD4_SU8_SUM0_SUS256_SPO1_SSO4_SVW8_VWA8_VWB8_WG32_8_1_WGM32_WGMXCC1_WGMXCCGn1
    SolutionIndex: 2
    SolutionNameMin: Cijk_Ailk_Bljk_F8B8HS_BH_UserArgs_MT128x96x256_MI16x16x1_SN_LDSB1_CLR1_GRVWB16_GSU1_GSUC0_GSUWGMRR0_GLS0_K1_LBSPPA2048_LBSPPB256_LPA32_LPB32_LRVW16_MIAV1_MIWT4_3_NTC3_NTD3_SU0_SUM0_SUS0_SPO0_SSO0_SVW4_VWA4_VWB1_WG32_8_1_WGM1_WGMXCC1_WGMXCCGn1
    SolutionIndex: 3
    SolutionNameMin: Cijk_Ailk_Bljk_F8B8HS_BH_UserArgs_MT256x256x64_MI16x16x1_SN_LDSB1_CLR1_GRVWB4_GSU1_GSUC0_GSUWGMRR0_GLS0_K1_LBSPPA2048_LBSPPB1024_LPA64_LPB8_LRVW8_MIAV0_MIWT4_16_NTC4_NTD4_SU8_SUM0_SUS256_SPO1_SSO4_SVW4_VWA4_VWB16_WG64_4_1_WGM32_WGMXCC1_WGMXCCGn1
    SolutionIndex: 4
    SolutionNameMin: Cijk_Ailk_Bljk_F8B8HS_BH_UserArgs_MT256x256x64_MI16x16x1_SN_LDSB1_CLR1_GRVWB4_GSU1_GSUC0_GSUWGMRR0_GLS0_K1_LBSPPA2048_LBSPPB1024_LPA0_LPB8_LRVW8_MIAV0_MIWT4_16_NTC4_NTD4_SU8_SUM0_SUS256_SPO1_SSO4_SVW4_VWA4_VWB16_WG64_4_1_WGM32_WGMXCC1_WGMXCCGn1
    SolutionIndex: 5
    SolutionNameMin: Cijk_Ailk_Bljk_F8B8HS_BH_UserArgs_MT256x256x64_MI16x16x1_SN_LDSB1_CLR1_GRVWB4_GSU1_GSUC0_GSUWGMRR0_GLS0_K1_LBSPPA2048_LBSPPB1024_LPA16_LPB8_LRVW8_MIAV0_MIWT4_16_NTC4_NTD4_SU8_SUM0_SUS256_SPO1_SSO4_SVW4_VWA4_VWB16_WG64_4_1_WGM32_WGMXCC1_WGMXCCGn1
    SolutionIndex: 6
    SolutionNameMin: Cijk_Ailk_Bljk_F8B8HS_BH_UserArgs_MT256x256x64_MI16x16x1_SN_LDSB1_CLR1_GRVWB4_GSU1_GSUC0_GSUWGMRR0_GLS0_K1_LBSPPA2048_LBSPPB1024_LPA32_LPB8_LRVW8_MIAV0_MIWT4_16_NTC4_NTD4_SU8_SUM0_SUS256_SPO1_SSO4_SVW4_VWA4_VWB16_WG64_4_1_WGM32_WGMXCC1_WGMXCCGn1
    SolutionIndex: 7
    SolutionNameMin: Cijk_Ailk_Bljk_F8B8HS_BH_UserArgs_MT256x256x64_MI16x16x1_SN_LDSB1_CLR1_GRVWB4_GSU1_GSUC0_GSUWGMRR0_GLS0_K1_LBSPPA2048_LBSPPB1024_LPA48_LPB8_LRVW8_MIAV0_MIWT4_16_NTC4_NTD4_SU8_SUM0_SUS256_SPO1_SSO4_SVW4_VWA4_VWB16_WG64_4_1_WGM32_WGMXCC1_WGMXCCGn1
    SolutionIndex: 8
    SolutionNameMin: Cijk_Ailk_Bljk_F8B8HS_BH_UserArgs_MT256x240x64_MI16x16x1_SN_LDSB1_CLR1_GRVWB4_GSU1_GSUC0_GSUWGMRR0_GLS0_K1_LBSPPA2048_LBSPPB128_LPA48_LPB8_LRVW8_MIAV0_MIWT4_15_NTC4_NTD4_SU8_SUM0_SUS256_SPO1_SSO4_SVW4_VWA4_VWB1_WG64_4_1_WGM48_WGMXCC1_WGMXCCGn1
    SolutionIndex: 9
    SolutionNameMin: Cijk_Ailk_Bljk_F8B8HS_BH_UserArgs_MT256x224x64_MI16x16x1_SN_LDSB1_CLR1_GRVWB4_GSU1_GSUC0_GSUWGMRR0_GLS0_K1_LBSPPA2048_LBSPPB128_LPA32_LPB8_LRVW8_MIAV0_MIWT4_14_NTC4_NTD4_SU8_SUM0_SUS256_SPO1_SSO4_SVW4_VWA4_VWB2_WG64_4_1_WGM48_WGMXCC1_WGMXCCGn1
    SolutionIndex: 10
    SolutionNameMin: Cijk_Ailk_Bljk_F8B8HS_BH_UserArgs_MT256x224x64_MI16x16x1_SN_LDSB1_CLR1_GRVWB4_GSU1_GSUC0_GSUWGMRR0_GLS0_K1_LBSPPA2048_LBSPPB128_LPA48_LPB8_LRVW8_MIAV0_MIWT4_14_NTC4_NTD4_SU8_SUM0_SUS256_SPO1_SSO4_SVW4_VWA4_VWB2_WG64_4_1_WGM48_WGMXCC1_WGMXCCGn1
    SolutionIndex: 11
    SolutionNameMin: Cijk_Ailk_Bljk_F8B8HS_BH_UserArgs_MT64x64x128_MI16x16x1_SN_LDSB1_CLR1_GRVWB16_GSU1_GSUC0_GSUWGMRR0_GLS0_K1_LBSPPA1024_LBSPPB512_LPA32_LPB32_LRVW16_MIAV1_MIWT2_4_NTC0_NTD0_SU0_SUM0_SUS0_SPO0_SSO0_SVW2_VWA2_VWB4_WG32_4_2_WGM1_WGMXCC1_WGMXCCGn1
    SolutionIndex: 12
    SolutionNameMin: Cijk_Ailk_Bljk_F8B8HS_BH_UserArgs_MT64x64x128_MI16x16x1_SN_LDSB1_CLR1_GRVWB16_GSU1_GSUC0_GSUWGMRR0_GLS0_K1_LBSPPA1024_LBSPPB512_LPA48_LPB32_LRVW16_MIAV1_MIWT2_4_NTC0_NTD0_SU0_SUM0_SUS0_SPO0_SSO0_SVW2_VWA2_VWB4_WG32_4_2_WGM1_WGMXCC1_WGMXCCGn1
    SolutionIndex: 13
    SolutionNameMin: Cijk_Ailk_Bljk_F8B8HS_BH_UserArgs_MT128x256x128_MI16x16x1_SN_LDSB1_CLR1_GRVWB16_GSU1_GSUC0_GSUWGMRR0_GLS0_K1_LBSPPA2048_LBSPPB1024_LPA32_LPB32_LRVW16_MIAV0_MIWT4_8_NTC4_NTD4_SU8_SUM0_SUS256_SPO1_SSO4_SVW4_VWA4_VWB8_WG32_8_1_WGM1_WGMXCC1_WGMXCCGn1
    SolutionIndex: 14
    SolutionNameMin: Cijk_Ailk_Bljk_F8B8HS_BH_UserArgs_MT256x128x128_MI16x16x1_SN_LDSB1_CLR1_GRVWB16_GSU3_GSUC0_GSUWGMRR0_GLS0_K1_LBSPPA4096_LBSPPB1024_LPA0_LPB32_LRVW16_MIAV0_MIWT4_8_NTC0_NTD0_SU0_SUM0_SUS0_SPO0_SSO0_SVW4_VWA4_VWB8_WG64_4_1_WGM1_WGMXCC1_WGMXCCGn1
    SolutionIndex: 15
    SolutionNameMin: Cijk_Ailk_Bljk_F8B8HS_BH_UserArgs_MT256x128x128_MI16x16x1_SN_LDSB1_CLR1_GRVWB16_GSU3_GSUC0_GSUWGMRR0_GLS0_K1_LBSPPA4096_LBSPPB1024_LPA16_LPB32_LRVW16_MIAV0_MIWT4_8_NTC0_NTD0_SU0_SUM0_SUS0_SPO0_SSO0_SVW4_VWA4_VWB8_WG64_4_1_WGM1_WGMXCC1_WGMXCCGn1
    SolutionIndex: 16
    SolutionNameMin: Cijk_Ailk_Bljk_F8B8HS_BH_UserArgs_MT256x96x128_MI16x16x1_SN_LDSB1_CLR1_GRVWB4_GSU6_GSUC0_GSUWGMRR0_GLS0_K1_LBSPPA4096_LBSPPB256_LPA64_LPB32_LRVW16_MIAV0_MIWT4_6_NTC3_NTD3_SU0_SUM0_SUS0_SPO0_SSO0_SVW4_VWA4_VWB2_WG64_4_1_WGM1_WGMXCC1_WGMXCCGn1
    SolutionIndex: 17
    SolutionNameMin: Cijk_Ailk_Bljk_F8B8HS_BH_UserArgs_MT256x256x64_MI16x16x1_SN_LDSB1_CLR1_GRVWB4_GSU1_GSUC0_GSUWGMRR0_GLS0_K1_LBSPPA2048_LBSPPB1024_LPA64_LPB8_LRVW8_MIAV0_MIWT4_16_NTC4_NTD4_SU8_SUM0_SUS256_SPO1_SSO4_SVW4_VWA4_VWB16_WG64_4_1_WGM48_WGMXCC1_WGMXCCGn1
    SolutionIndex: 18
    SolutionNameMin: Cijk_Ailk_Bljk_F8B8HS_BH_UserArgs_MT256x256x64_MI16x16x1_SN_LDSB1_CLR1_GRVWB4_GSU1_GSUC0_GSUWGMRR0_GLS0_K1_LBSPPA2048_LBSPPB1024_LPA8_LPB8_LRVW8_MIAV0_MIWT4_16_NTC4_NTD4_SU8_SUM0_SUS256_SPO1_SSO4_SVW4_VWA4_VWB16_WG64_4_1_WGM48_WGMXCC1_WGMXCCGn1
    SolutionIndex: 19
    SolutionNameMin: Cijk_Ailk_Bljk_F8B8HS_BH_UserArgs_MT256x256x64_MI16x16x1_SN_LDSB1_CLR1_GRVWB4_GSU1_GSUC0_GSUWGMRR0_GLS0_K1_LBSPPA2048_LBSPPB1024_LPA16_LPB8_LRVW8_MIAV0_MIWT4_16_NTC4_NTD4_SU8_SUM0_SUS256_SPO1_SSO4_SVW4_VWA4_VWB16_WG64_4_1_WGM48_WGMXCC1_WGMXCCGn1
    SolutionIndex: 20
    SolutionNameMin: Cijk_Ailk_Bljk_F8B8HS_BH_UserArgs_MT256x256x64_MI16x16x1_SN_LDSB1_CLR1_GRVWB4_GSU1_GSUC0_GSUWGMRR0_GLS0_K1_LBSPPA2048_LBSPPB1024_LPA32_LPB8_LRVW8_MIAV0_MIWT4_16_NTC4_NTD4_SU8_SUM0_SUS256_SPO1_SSO4_SVW4_VWA4_VWB16_WG64_4_1_WGM48_WGMXCC1_WGMXCCGn1
    SolutionIndex: 21
    SolutionNameMin: Cijk_Ailk_Bljk_F8B8HS_BH_UserArgs_MT256x256x64_MI16x16x1_SN_LDSB1_CLR1_GRVWB4_GSU1_GSUC0_GSUWGMRR0_GLS0_K1_LBSPPA2048_LBSPPB1024_LPA48_LPB8_LRVW8_MIAV0_MIWT4_16_NTC4_NTD4_SU8_SUM0_SUS256_SPO1_SSO4_SVW4_VWA4_VWB16_WG64_4_1_WGM48_WGMXCC1_WGMXCCGn1
    SolutionIndex: 22
    SolutionNameMin: Cijk_Ailk_Bljk_F8B8HS_BH_UserArgs_MT256x256x64_MI16x16x1_SN_LDSB1_CLR1_GRVWB4_GSU1_GSUC0_GSUWGMRR0_GLS0_K1_LBSPPA2048_LBSPPB1024_LPA48_LPB8_LRVW8_MIAV0_MIWT4_16_NTC4_NTD4_SU8_SUM0_SUS256_SPO1_SSO4_SVW4_VWA4_VWB16_WG64_4_1_WGM16_WGMXCC1_WGMXCCGn1
    SolutionIndex: 23
    SolutionNameMin: Cijk_Ailk_Bljk_F8B8HS_BH_UserArgs_MT256x224x64_MI16x16x1_SN_LDSB1_CLR1_GRVWB4_GSU1_GSUC0_GSUWGMRR0_GLS0_K1_LBSPPA2048_LBSPPB128_LPA16_LPB8_LRVW8_MIAV0_MIWT4_14_NTC4_NTD4_SU8_SUM0_SUS256_SPO1_SSO4_SVW4_VWA4_VWB2_WG64_4_1_WGM16_WGMXCC1_WGMXCCGn1
    SolutionIndex: 24
    SolutionNameMin: Cijk_Ailk_Bljk_F8B8HS_BH_UserArgs_MT256x176x128_MI16x16x1_SN_LDSB1_CLR1_GRVWB4_GSU3_GSUC0_GSUWGMRR0_GLS0_K1_LBSPPA4096_LBSPPB128_LPA64_LPB32_LRVW16_MIAV0_MIWT4_11_NTC4_NTD4_SU8_SUM0_SUS256_SPO1_SSO4_SVW4_VWA4_VWB1_WG64_4_1_WGM16_WGMXCC1_WGMXCCGn1
    SolutionIndex: 25
    SolutionNameMin: Cijk_Ailk_Bljk_F8B8HS_BH_UserArgs_MT256x176x128_MI16x16x1_SN_LDSB1_CLR1_GRVWB4_GSU1_GSUC0_GSUWGMRR0_GLS0_K1_LBSPPA2048_LBSPPB128_LPA64_LPB8_LRVW8_MIAV0_MIWT4_11_NTC4_NTD4_SU8_SUM0_SUS256_SPO1_SSO4_SVW4_VWA4_VWB1_WG64_4_1_WGM16_WGMXCC1_WGMXCCGn1
    SolutionIndex: 26
    SolutionNameMin: Cijk_Ailk_Bljk_F8B8HS_BH_UserArgs_MT256x176x128_MI16x16x1_SN_LDSB1_CLR1_GRVWB4_GSU1_GSUC0_GSUWGMRR0_GLS0_K1_LBSPPA2048_LBSPPB128_LPA32_LPB8_LRVW8_MIAV0_MIWT4_11_NTC4_NTD4_SU8_SUM0_SUS256_SPO1_SSO4_SVW4_VWA4_VWB1_WG64_4_1_WGM16_WGMXCC1_WGMXCCGn1
    SolutionIndex: 27
    SolutionNameMin: Cijk_Ailk_Bljk_F8B8HS_BH_UserArgs_MT256x176x128_MI16x16x1_SN_LDSB1_CLR1_GRVWB4_GSU1_GSUC0_GSUWGMRR0_GLS0_K1_LBSPPA2048_LBSPPB128_LPA64_LPB8_LRVW8_MIAV0_MIWT4_11_NTC4_NTD4_SU8_SUM0_SUS1024_SPO1_SSO4_SVW4_VWA4_VWB1_WG64_4_1_WGM16_WGMXCC1_WGMXCCGn1
    SolutionIndex: 28
    SolutionNameMin: Cijk_Ailk_Bljk_F8B8HS_BH_UserArgs_MT256x224x64_MI16x16x1_SN_LDSB0_CLR0_GRVWB4_GSU1_GSUC0_GSUWGMRR0_GLS0_K1_LBSPPA2048_LBSPPB128_LPA32_LPB8_LRVW8_MIAV0_MIWT4_14_NTC4_NTD4_SU8_SUM0_SUS2048_SPO1_SSO4_SVW4_VWA4_VWB2_WG64_4_1_WGM32_WGMXCC1_WGMXCCGn1
    SolutionIndex: 29
    SolutionNameMin: Cijk_Ailk_Bljk_F8B8HS_BH_UserArgs_MT128x128x64_MI16x16x1_SN_LDSB0_CLR1_GRVWB16_GSU1_GSUC0_GSUWGMRR0_GLS0_K1_LBSPPA1024_LBSPPB128_LPA64_LPB16_LRVW8_MIAV1_MIWT4_4_NTC4_NTD4_SU8_SUM0_SUS256_SPO1_SSO4_SVW4_VWA4_VWB1_WG32_8_1_WGMn16_WGMXCC1_WGMXCCGn1
    SolutionIndex: 30
    SolutionNameMin: Cijk_Ailk_Bljk_F8B8HS_BH_UserArgs_MT128x128x64_MI16x16x1_SN_LDSB0_CLR1_GRVWB16_GSU1_GSUC0_GSUWGMRR0_GLS0_K1_LBSPPA1024_LBSPPB128_LPA0_LPB32_LRVW8_MIAV1_MIWT4_4_NTC4_NTD4_SU8_SUM0_SUS256_SPO1_SSO4_SVW4_VWA4_VWB1_WG32_8_1_WGMn16_WGMXCC1_WGMXCCGn1
    SolutionIndex: 31
    SolutionNameMin: Cijk_Ailk_Bljk_F8B8HS_BH_UserArgs_MT128x128x64_MI16x16x1_SN_LDSB0_CLR1_GRVWB16_GSU1_GSUC0_GSUWGMRR0_GLS0_K1_LBSPPA1024_LBSPPB128_LPA0_LPB32_LRVW8_MIAV1_MIWT4_4_NTC4_NTD4_SU8_SUM0_SUS64_SPO1_SSO4_SVW4_VWA4_VWB2_WG32_8_1_WGMn16_WGMXCC1_WGMXCCGn1
    SolutionIndex: 32
    SolutionNameMin: Cijk_Ailk_Bljk_F8B8HS_BH_UserArgs_MT128x128x64_MI16x16x1_SN_LDSB0_CLR1_GRVWB16_GSU1_GSUC0_GSUWGMRR0_GLS0_K1_LBSPPA1024_LBSPPB128_LPA64_LPB48_LRVW8_MIAV1_MIWT4_4_NTC4_NTD4_SU8_SUM0_SUS64_SPO1_SSO4_SVW4_VWA4_VWB2_WG32_8_1_WGMn16_WGMXCC1_WGMXCCGn1
    SolutionIndex: 33
    SolutionNameMin: Cijk_Ailk_Bljk_F8B8HS_BH_UserArgs_MT128x128x64_MI16x16x1_SN_LDSB0_CLR1_GRVWB16_GSU1_GSUC0_GSUWGMRR0_GLS0_K1_LBSPPA1024_LBSPPB128_LPA8_LPB48_LRVW8_MIAV1_MIWT4_4_NTC4_NTD4_SU8_SUM0_SUS64_SPO1_SSO4_SVW4_VWA4_VWB2_WG32_8_1_WGMn16_WGMXCC1_WGMXCCGn1
    SolutionIndex: 34
    SolutionNameMin: Cijk_Ailk_Bljk_F8B8HS_BH_UserArgs_MT128x128x64_MI16x16x1_SN_LDSB0_CLR1_GRVWB16_GSU1_GSUC0_GSUWGMRR0_GLS0_K1_LBSPPA1024_LBSPPB128_LPA48_LPB48_LRVW8_MIAV1_MIWT4_4_NTC4_NTD4_SU8_SUM0_SUS64_SPO1_SSO4_SVW4_VWA4_VWB2_WG32_8_1_WGMn16_WGMXCC1_WGMXCCGn1
    SolutionIndex: 35
    SolutionNameMin: Cijk_Ailk_Bljk_F8B8HS_BH_UserArgs_MT128x128x64_MI16x16x1_SN_LDSB0_CLR1_GRVWB16_GSU1_GSUC0_GSUWGMRR0_GLS1_K1_LBSPPA1024_LBSPPB128_LPA16_LPB16_LRVW8_MIAV1_MIWT4_4_NTC4_NTD4_SU8_SUM0_SUS512_SPO1_SSO4_SVW4_VWA4_VWB2_WG32_8_1_WGMn16_WGMXCC1_WGMXCCGn1
    SolutionIndex: 36
    SolutionNameMin: Cijk_Ailk_Bljk_F8B8HS_BH_UserArgs_MT256x176x128_MI16x16x1_SN_LDSB1_CLR1_GRVWB4_GSU1_GSUC0_GSUWGMRR0_GLS0_K1_LBSPPA2048_LBSPPB128_LPA64_LPB8_LRVW8_MIAV0_MIWT4_11_NTC4_NTD4_SU8_SUM0_SUS128_SPO1_SSO4_SVW4_VWA4_VWB1_WG64_4_1_WGMn16_WGMXCC1_WGMXCCGn1
    SolutionIndex: 37
    SolutionNameMin: Cijk_Ailk_Bljk_F8B8HS_BH_UserArgs_MT256x176x128_MI16x16x1_SN_LDSB1_CLR1_GRVWB4_GSU1_GSUC0_GSUWGMRR0_GLS0_K1_LBSPPA2048_LBSPPB128_LPA16_LPB8_LRVW8_MIAV0_MIWT4_11_NTC4_NTD4_SU8_SUM0_SUS128_SPO1_SSO4_SVW4_VWA4_VWB1_WG64_4_1_WGMn16_WGMXCC1_WGMXCCGn1
    SolutionIndex: 38
    SolutionNameMin: Cijk_Ailk_Bljk_F8B8HS_BH_UserArgs_MT256x176x128_MI16x16x1_SN_LDSB1_CLR1_GRVWB4_GSU1_GSUC0_GSUWGMRR0_GLS0_K1_LBSPPA2048_LBSPPB128_LPA48_LPB8_LRVW8_MIAV0_MIWT4_11_NTC4_NTD4_SU8_SUM0_SUS128_SPO1_SSO4_SVW4_VWA4_VWB1_WG64_4_1_WGMn16_WGMXCC1_WGMXCCGn1
    SolutionIndex: 39
    SolutionNameMin: Cijk_Ailk_Bljk_F8B8HS_BH_UserArgs_MT256x192x128_MI16x16x1_SN_LDSB1_CLR1_GRVWB16_GSU1_GSUC0_GSUWGMRR0_GLS0_K1_LBSPPA4096_LBSPPB128_LPA64_LPB32_LRVW16_MIAV0_MIWT4_12_NTC4_NTD4_SU8_SUM0_SUS128_SPO1_SSO4_SVW4_VWA4_VWB1_WG64_4_1_WGMn16_WGMXCC1_WGMXCCGn1
    SolutionIndex: 40
    SolutionNameMin: Cijk_Ailk_Bljk_F8B8HS_BH_UserArgs_MT256x192x128_MI16x16x1_SN_LDSB1_CLR1_GRVWB16_GSU1_GSUC0_GSUWGMRR0_GLS0_K1_LBSPPA4096_LBSPPB128_LPA16_LPB32_LRVW16_MIAV0_MIWT4_12_NTC4_NTD4_SU8_SUM0_SUS128_SPO1_SSO4_SVW4_VWA4_VWB1_WG64_4_1_WGMn16_WGMXCC1_WGMXCCGn1
    SolutionIndex: 41
    SolutionNameMin: Cijk_Ailk_Bljk_F8B8HS_BH_UserArgs_MT256x192x128_MI16x16x1_SN_LDSB1_CLR1_GRVWB16_GSU1_GSUC0_GSUWGMRR0_GLS0_K1_LBSPPA4096_LBSPPB256_LPA32_LPB32_LRVW16_MIAV0_MIWT4_12_NTC4_NTD4_SU8_SUM0_SUS512_SPO1_SSO4_SVW2_VWA2_VWB2_WG64_4_1_WGMn16_WGMXCC1_WGMXCCGn1
    SolutionIndex: 42
    SolutionNameMin: Cijk_Ailk_Bljk_F8B8HS_BH_UserArgs_MT256x192x128_MI16x16x1_SN_LDSB1_CLR1_GRVWB16_GSU1_GSUC0_GSUWGMRR0_GLS0_K1_LBSPPA4096_LBSPPB256_LPA48_LPB32_LRVW16_MIAV0_MIWT4_12_NTC4_NTD4_SU8_SUM0_SUS512_SPO1_SSO4_SVW2_VWA2_VWB2_WG64_4_1_WGMn16_WGMXCC1_WGMXCCGn1
    SolutionIndex: 43
    SolutionNameMin: Cijk_Ailk_Bljk_F8B8HS_BH_UserArgs_MT256x192x128_MI16x16x1_SN_LDSB1_CLR1_GRVWB16_GSU1_GSUC0_GSUWGMRR0_GLS0_K1_LBSPPA4096_LBSPPB256_LPA64_LPB32_LRVW16_MIAV0_MIWT4_12_NTC4_NTD4_SU8_SUM0_SUS512_SPO1_SSO4_SVW2_VWA2_VWB2_WG64_4_1_WGMn16_WGMXCC1_WGMXCCGn1
    SolutionIndex: 44
    SolutionNameMin: Cijk_Ailk_Bljk_F8B8HS_BH_UserArgs_MT256x192x128_MI16x16x1_SN_LDSB1_CLR1_GRVWB16_GSU1_GSUC0_GSUWGMRR0_GLS1_K1_LBSPPA4096_LBSPPB256_LPA64_LPB32_LRVW16_MIAV0_MIWT4_12_NTC4_NTD4_SU8_SUM0_SUS128_SPO1_SSO4_SVW4_VWA4_VWB2_WG64_4_1_WGMn16_WGMXCC1_WGMXCCGn1
    SolutionIndex: 45
    SolutionNameMin: Cijk_Ailk_Bljk_F8B8HS_BH_UserArgs_MT256x192x128_MI16x16x1_SN_LDSB1_CLR1_GRVWB16_GSU1_GSUC0_GSUWGMRR0_GLS1_K1_LBSPPA4096_LBSPPB256_LPA0_LPB32_LRVW16_MIAV0_MIWT4_12_NTC4_NTD4_SU8_SUM0_SUS128_SPO1_SSO4_SVW4_VWA4_VWB2_WG64_4_1_WGMn16_WGMXCC1_WGMXCCGn1
    SolutionIndex: 46
    SolutionNameMin: Cijk_Ailk_Bljk_F8B8HS_BH_UserArgs_MT256x128x128_MI16x16x1_SN_LDSB1_CLR1_GRVWB16_GSU1_GSUC0_GSUWGMRR0_GLS0_K1_LBSPPA4096_LBSPPB256_LPA0_LPB32_LRVW16_MIAV0_MIWT4_8_NTC4_NTD4_SU8_SUM0_SUS2048_SPO1_SSO4_SVW4_VWA4_VWB2_WG64_4_1_WGM1_WGMXCC1_WGMXCCGn1
    SolutionIndex: 47
    SolutionNameMin: Cijk_Ailk_Bljk_F8B8HS_BH_UserArgs_MT256x128x128_MI16x16x1_SN_LDSB1_CLR1_GRVWB16_GSU1_GSUC0_GSUWGMRR0_GLS0_K1_LBSPPA4096_LBSPPB256_LPA32_LPB32_LRVW16_MIAV0_MIWT4_8_NTC4_NTD4_SU8_SUM0_SUS2048_SPO1_SSO4_SVW4_VWA4_VWB2_WG64_4_1_WGM1_WGMXCC1_WGMXCCGn1
    SolutionIndex: 48
    SolutionNameMin: Cijk_Ailk_Bljk_F8B8HS_BH_UserArgs_MT256x128x128_MI16x16x1_SN_LDSB1_CLR1_GRVWB16_GSU1_GSUC0_GSUWGMRR0_GLS0_K1_LBSPPA4096_LBSPPB256_LPA0_LPB48_LRVW16_MIAV0_MIWT4_8_NTC4_NTD4_SU8_SUM0_SUS2048_SPO1_SSO4_SVW4_VWA4_VWB2_WG64_4_1_WGM1_WGMXCC1_WGMXCCGn1
    SolutionIndex: 49
    SolutionNameMin: Cijk_Ailk_Bljk_F8B8HS_BH_UserArgs_MT256x128x128_MI16x16x1_SN_LDSB1_CLR1_GRVWB16_GSU1_GSUC0_GSUWGMRR0_GLS0_K1_LBSPPA4096_LBSPPB1024_LPA64_LPB32_LRVW16_MIAV0_MIWT4_8_NTC4_NTD4_SU8_SUM0_SUS128_SPO1_SSO4_SVW4_VWA4_VWB8_WG64_4_1_WGM1_WGMXCC1_WGMXCCGn1
    SolutionIndex: 50
    SolutionNameMin: Cijk_Ailk_Bljk_F8B8HS_BH_UserArgs_MT256x128x128_MI16x16x1_SN_LDSB1_CLR1_GRVWB16_GSU1_GSUC0_GSUWGMRR0_GLS0_K1_LBSPPA4096_LBSPPB1024_LPA48_LPB32_LRVW16_MIAV0_MIWT4_8_NTC4_NTD4_SU8_SUM0_SUS128_SPO1_SSO4_SVW4_VWA4_VWB8_WG64_4_1_WGM1_WGMXCC1_WGMXCCGn1
    SolutionIndex: 51
    SolutionNameMin: Cijk_Ailk_Bljk_F8B8HS_BH_UserArgs_MT64x64x128_MI32x32x1_SN_LDSB1_CLR1_GRVWB16_GSU1_GSUC0_GSUWGMRR0_GLS1_K1_LBSPPA0_LBSPPB128_LPA0_LPB48_LRVW16_MIAV1_MIWT2_1_NTC3_NTD3_SU0_SUM0_SUS0_SPO0_SSO0_SVW2_VWA2_VWB1_WG32_4_2_WGM1_WGMXCC1_WGMXCCGn1
    SolutionIndex: 52
    SolutionNameMin: Cijk_Ailk_Bljk_F8B8HS_BH_UserArgs_MT256x112x64_MI16x16x1_SN_LDSB1_CLR0_GRVWB4_GSU1_GSUC0_GSUWGMRR0_GLS0_K1_LBSPPA2048_LBSPPB128_LPA16_LPB8_LRVW8_MIAV0_MIWT4_7_NTC4_NTD4_SU8_SUM0_SUS128_SPO1_SSO4_SVW4_VWA4_VWB1_WG64_4_1_WGM16_WGMXCC1_WGMXCCGn1
    SolutionIndex: 53
    SolutionNameMin: Cijk_Ailk_Bljk_F8B8HS_BH_UserArgs_MT256x224x64_MI16x16x1_SN_LDSB0_CLR1_GRVWB4_GSU1_GSUC0_GSUWGMRR0_GLS0_K1_LBSPPA2048_LBSPPB128_LPA32_LPB8_LRVW8_MIAV0_MIWT4_14_NTC4_NTD4_SU8_SUM0_SUS128_SPO1_SSO4_SVW4_VWA4_VWB2_WG64_4_1_WGM16_WGMXCC1_WGMXCCGn1
    SolutionIndex: 54
    SolutionNameMin: Cijk_Ailk_Bljk_F8B8HS_BH_UserArgs_MT256x224x64_MI16x16x1_SN_LDSB0_CLR1_GRVWB4_GSU1_GSUC0_GSUWGMRR0_GLS0_K1_LBSPPA2048_LBSPPB128_LPA48_LPB8_LRVW8_MIAV0_MIWT4_14_NTC4_NTD4_SU8_SUM0_SUS128_SPO1_SSO4_SVW4_VWA4_VWB2_WG64_4_1_WGM16_WGMXCC1_WGMXCCGn1
    SolutionIndex: 55
    SolutionNameMin: Cijk_Ailk_Bljk_F8B8HS_BH_UserArgs_MT256x256x64_MI16x16x1_SN_LDSB1_CLR1_GRVWB4_GSU4_GSUC0_GSUWGMRR0_GLS1_K1_LBSPPA2048_LBSPPB128_LPA64_LPB8_LRVW8_MIAV0_MIWT4_16_NTC4_NTD4_SU8_SUM0_SUS64_SPO1_SSO4_SVW4_VWA4_VWB2_WG64_4_1_WGMn32_WGMXCC1_WGMXCCGn1
    SolutionIndex: 56
    SolutionNameMin: Cijk_Ailk_Bljk_F8B8HS_BH_UserArgs_MT256x176x64_MI16x16x1_SN_LDSB0_CLR0_GRVWB4_GSU1_GSUC0_GSUWGMRR0_GLS0_K1_LBSPPA2048_LBSPPB128_LPA64_LPB8_LRVW8_MIAV0_MIWT4_11_NTC4_NTD4_SU8_SUM0_SUS2048_SPO1_SSO4_SVW4_VWA4_VWB1_WG64_4_1_WGM1_WGMXCC1_WGMXCCGn1
    SolutionIndex: 57
    SolutionNameMin: Cijk_Ailk_Bljk_F8B8HS_BH_UserArgs_MT256x128x64_MI16x16x1_SN_LDSB1_CLR0_GRVWB16_GSU1_GSUC0_GSUWGMRR0_GLS0_K1_LBSPPA2048_LBSPPB128_LPA64_LPB16_LRVW8_MIAV0_MIWT4_8_NTC4_NTD4_SU8_SUM0_SUS64_SPO1_SSO4_SVW4_VWA4_VWB1_WG64_4_1_WGM16_WGMXCC1_WGMXCCGn1
    SolutionIndex: 58
    SolutionNameMin: Cijk_Ailk_Bljk_F8B8HS_BH_UserArgs_MT256x128x64_MI16x16x1_SN_LDSB1_CLR0_GRVWB16_GSU1_GSUC0_GSUWGMRR0_GLS0_K1_LBSPPA2048_LBSPPB128_LPA64_LPB8_LRVW8_MIAV0_MIWT4_8_NTC4_NTD4_SU8_SUM0_SUS64_SPO1_SSO4_SVW4_VWA4_VWB1_WG64_4_1_WGM16_WGMXCC1_WGMXCCGn1
    SolutionIndex: 59
    SolutionNameMin: Cijk_Ailk_Bljk_F8B8HS_BH_UserArgs_MT256x128x64_MI16x16x1_SN_LDSB1_CLR0_GRVWB16_GSU1_GSUC0_GSUWGMRR0_GLS0_K1_LBSPPA2048_LBSPPB128_LPA4_LPB8_LRVW8_MIAV0_MIWT4_8_NTC4_NTD4_SU8_SUM0_SUS64_SPO1_SSO4_SVW4_VWA4_VWB1_WG64_4_1_WGM16_WGMXCC1_WGMXCCGn1
    SolutionIndex: 60
    SolutionNameMin: Cijk_Ailk_Bljk_F8B8HS_BH_UserArgs_MT256x128x64_MI16x16x1_SN_LDSB1_CLR0_GRVWB16_GSU1_GSUC0_GSUWGMRR0_GLS0_K1_LBSPPA2048_LBSPPB128_LPA64_LPB48_LRVW8_MIAV0_MIWT4_8_NTC4_NTD4_SU8_SUM0_SUS64_SPO1_SSO4_SVW4_VWA4_VWB1_WG64_4_1_WGM16_WGMXCC1_WGMXCCGn1
    SolutionIndex: 61
    SolutionNameMin: Cijk_Ailk_Bljk_F8B8HS_BH_UserArgs_MT256x128x64_MI16x16x1_SN_LDSB1_CLR1_GRVWB16_GSU1_GSUC0_GSUWGMRR0_GLS0_K1_LBSPPA2048_LBSPPB128_LPA64_LPB16_LRVW8_MIAV0_MIWT4_8_NTC4_NTD4_SU8_SUM0_SUS512_SPO1_SSO4_SVW4_VWA4_VWB1_WG64_4_1_WGM16_WGMXCC1_WGMXCCGn1
    SolutionIndex: 62
    SolutionNameMin: Cijk_Ailk_Bljk_F8B8HS_BH_UserArgs_MT256x128x64_MI16x16x1_SN_LDSB1_CLR1_GRVWB16_GSU1_GSUC0_GSUWGMRR0_GLS0_K1_LBSPPA2048_LBSPPB128_LPA64_LPB48_LRVW8_MIAV0_MIWT4_8_NTC4_NTD4_SU8_SUM0_SUS512_SPO1_SSO4_SVW4_VWA4_VWB1_WG64_4_1_WGM16_WGMXCC1_WGMXCCGn1
    SolutionIndex: 63
    SolutionNameMin: Cijk_Ailk_Bljk_F8B8HS_BH_UserArgs_MT256x128x64_MI16x16x1_SN_LDSB0_CLR0_GRVWB16_GSU1_GSUC0_GSUWGMRR0_GLS0_K1_LBSPPA2048_LBSPPB256_LPA32_LPB16_LRVW8_MIAV0_MIWT4_8_NTC4_NTD4_SU8_SUM0_SUS64_SPO1_SSO4_SVW4_VWA4_VWB4_WG64_4_1_WGM16_WGMXCC1_WGMXCCGn1
    SolutionIndex: 64
    SolutionNameMin: Cijk_Ailk_Bljk_F8B8HS_BH_UserArgs_MT256x128x64_MI16x16x1_SN_LDSB0_CLR0_GRVWB16_GSU1_GSUC0_GSUWGMRR0_GLS0_K1_LBSPPA2048_LBSPPB256_LPA64_LPB48_LRVW8_MIAV0_MIWT4_8_NTC4_NTD4_SU8_SUM0_SUS64_SPO1_SSO4_SVW4_VWA4_VWB4_WG64_4_1_WGM16_WGMXCC1_WGMXCCGn1
    SolutionIndex: 65
    SolutionNameMin: Cijk_Ailk_Bljk_F8B8HS_BH_UserArgs_MT256x128x64_MI16x16x1_SN_LDSB0_CLR0_GRVWB16_GSU1_GSUC0_GSUWGMRR0_GLS0_K1_LBSPPA2048_LBSPPB256_LPA16_LPB48_LRVW8_MIAV0_MIWT4_8_NTC4_NTD4_SU8_SUM0_SUS64_SPO1_SSO4_SVW4_VWA4_VWB4_WG64_4_1_WGM16_WGMXCC1_WGMXCCGn1
- - - [1024, 1024, 1, 1024, 1024, 1024, 1024, 1024]
    - [51, 216504.0]
  - - [1024, 1024, 1, 3072, 1024, 1024, 1024, 3072]
    - [12, 332418.0]
  - - [1024, 1024, 1, 4096, 1024, 1024, 1024, 4096]
    - [11, 356793.0]
  - - [1024, 1024, 1, 24576, 1024, 1024, 1024, 24576]
    - [16, 560556.0]
  - - [1024, 3072, 1, 1024, 1024, 1024, 1024, 1024]
    - [29, 388894.0]
  - - [1024, 3072, 1, 3072, 1024, 1024, 1024, 3072]
    - [35, 525877.0]
  - - [1024, 3072, 1, 4096, 1024, 1024, 1024, 4096]
    - [31, 539185.0]
  - - [1024, 3072, 1, 24576, 1024, 1024, 1024, 24576]
    - [14, 880294.0]
  - - [1024, 4096, 1, 1024, 1024, 1024, 1024, 1024]
    - [30, 433625.0]
  - - [1024, 4096, 1, 3072, 1024, 1024, 1024, 3072]
    - [63, 577815.0]
  - - [1024, 4096, 1, 4096, 1024, 1024, 1024, 4096]
    - [49, 612328.0]
  - - [1024, 4096, 1, 24576, 1024, 1024, 1024, 24576]
    - [24, 898778.0]
  - - [1024, 8192, 1, 1024, 1024, 1024, 1024, 1024]
    - [59, 521014.0]
  - - [1024, 8192, 1, 3072, 1024, 1024, 1024, 3072]
    - [49, 746052.0]
  - - [1024, 8192, 1, 4096, 1024, 1024, 1024, 4096]
    - [49, 794415.0]
  - - [1024, 8192, 1, 24576, 1024, 1024, 1024, 24576]
    - [64, 857422.0]
  - - [1024, 24576, 1, 1024, 1024, 1024, 1024, 1024]
    - [62, 641871.0]
  - - [1024, 24576, 1, 3072, 1024, 1024, 1024, 3072]
    - [52, 866586.0]
  - - [1024, 24576, 1, 4096, 1024, 1024, 1024, 4096]
    - [25, 914280.0]
  - - [1024, 24576, 1, 24576, 1024, 1024, 1024, 24576]
    - [45, 946136.0]
  - - [3072, 1024, 1, 1024, 3072, 3072, 3072, 1024]
    - [2, 390691.0]
  - - [3072, 1024, 1, 3072, 3072, 3072, 3072, 3072]
    - [32, 501216.0]
  - - [3072, 1024, 1, 4096, 3072, 3072, 3072, 4096]
    - [34, 526982.0]
  - - [3072, 1024, 1, 24576, 3072, 3072, 3072, 24576]
    - [15, 884432.0]
  - - [3072, 3072, 1, 1024, 3072, 3072, 3072, 1024]
    - [40, 564419.0]
  - - [3072, 3072, 1, 3072, 3072, 3072, 3072, 3072]
    - [49, 814951.0]
  - - [3072, 3072, 1, 4096, 3072, 3072, 3072, 4096]
    - [50, 872014.0]
  - - [3072, 3072, 1, 24576, 3072, 3072, 3072, 24576]
    - [65, 861649.0]
  - - [3072, 4096, 1, 1024, 3072, 3072, 3072, 1024]
    - [1, 575952.0]
  - - [3072, 4096, 1, 3072, 3072, 3072, 3072, 3072]
    - [18, 817468.0]
  - - [3072, 4096, 1, 4096, 3072, 3072, 3072, 4096]
    - [56, 891084.0]
  - - [3072, 4096, 1, 24576, 3072, 3072, 3072, 24576]
    - [38, 932490.0]
  - - [3072, 8192, 1, 1024, 3072, 3072, 3072, 1024]
    - [60, 649927.0]
  - - [3072, 8192, 1, 3072, 3072, 3072, 3072, 3072]
    - [36, 870931.0]
  - - [3072, 8192, 1, 4096, 3072, 3072, 3072, 4096]
    - [36, 924470.0]
  - - [3072, 8192, 1, 24576, 3072, 3072, 3072, 24576]
    - [44, 950766.0]
  - - [3072, 24576, 1, 1024, 3072, 3072, 3072, 1024]
    - [57, 770886.0]
  - - [3072, 24576, 1, 3072, 3072, 3072, 3072, 3072]
    - [0, 927751.0]
  - - [3072, 24576, 1, 4096, 3072, 3072, 3072, 4096]
    - [21, 926097.0]
  - - [3072, 24576, 1, 24576, 3072, 3072, 3072, 24576]
    - [22, 1082560.0]
  - - [4096, 1024, 1, 1024, 4096, 4096, 4096, 1024]
    - [33, 420434.0]
  - - [4096, 1024, 1, 3072, 4096, 4096, 4096, 3072]
    - [47, 576105.0]
  - - [4096, 1024, 1, 4096, 4096, 4096, 4096, 4096]
    - [46, 612142.0]
  - - [4096, 1024, 1, 24576, 4096, 4096, 4096, 24576]
    - [55, 880932.0]
  - - [4096, 3072, 1, 1024, 4096, 4096, 4096, 1024]
    - [39, 583401.0]
  - - [4096, 3072, 1, 3072, 4096, 4096, 4096, 3072]
    - [26, 878130.0]
  - - [4096, 3072, 1, 4096, 4096, 4096, 4096, 4096]
    - [27, 931336.0]
  - - [4096, 3072, 1, 24576, 4096, 4096, 4096, 24576]
    - [41, 911400.0]
  - - [4096, 4096, 1, 1024, 4096, 4096, 4096, 1024]
    - [60, 688891.0]
  - - [4096, 4096, 1, 3072, 4096, 4096, 4096, 3072]
    - [23, 943676.0]
  - - [4096, 4096, 1, 4096, 4096, 4096, 4096, 4096]
    - [53, 1022940.0]
  - - [4096, 4096, 1, 24576, 4096, 4096, 4096, 24576]
    - [6, 979810.0]
  - - [4096, 8192, 1, 1024, 4096, 4096, 4096, 1024]
    - [61, 713763.0]
  - - [4096, 8192, 1, 3072, 4096, 4096, 4096, 3072]
    - [21, 931758.0]
  - - [4096, 8192, 1, 4096, 4096, 4096, 4096, 4096]
    - [28, 988422.0]
  - - [4096, 8192, 1, 24576, 4096, 4096, 4096, 24576]
    - [5, 1037270.0]
  - - [4096, 24576, 1, 1024, 4096, 4096, 4096, 1024]
    - [42, 729491.0]
  - - [4096, 24576, 1, 3072, 4096, 4096, 4096, 3072]
    - [10, 871935.0]
  - - [4096, 24576, 1, 4096, 4096, 4096, 4096, 4096]
    - [28, 916426.0]
  - - [4096, 24576, 1, 24576, 4096, 4096, 4096, 24576]
    - [54, 1023700.0]
  - - [8192, 1024, 1, 1024, 8192, 8192, 8192, 1024]
    - [48, 529022.0]
  - - [8192, 1024, 1, 3072, 8192, 8192, 8192, 3072]
    - [47, 740040.0]
  - - [8192, 1024, 1, 4096, 8192, 8192, 8192, 4096]
    - [47, 789511.0]
  - - [8192, 1024, 1, 24576, 8192, 8192, 8192, 24576]
    - [13, 837604.0]
  - - [8192, 3072, 1, 1024, 8192, 8192, 8192, 1024]
    - [52, 645424.0]
  - - [8192, 3072, 1, 3072, 8192, 8192, 8192, 3072]
    - [37, 898193.0]
  - - [8192, 3072, 1, 4096, 8192, 8192, 8192, 4096]
    - [38, 934858.0]
  - - [8192, 3072, 1, 24576, 8192, 8192, 8192, 24576]
    - [43, 968905.0]
  - - [8192, 4096, 1, 1024, 8192, 8192, 8192, 1024]
    - [52, 683248.0]
  - - [8192, 4096, 1, 3072, 8192, 8192, 8192, 3072]
    - [19, 931673.0]
  - - [8192, 4096, 1, 4096, 8192, 8192, 8192, 4096]
    - [9, 979750.0]
  - - [8192, 4096, 1, 24576, 8192, 8192, 8192, 24576]
    - [3, 1033040.0]
  - - [8192, 8192, 1, 1024, 8192, 8192, 8192, 1024]
    - [58, 729809.0]
  - - [8192, 8192, 1, 3072, 8192, 8192, 8192, 3072]
    - [21, 913408.0]
  - - [8192, 8192, 1, 4096, 8192, 8192, 8192, 4096]
    - [4, 919863.0]
  - - [8192, 8192, 1, 24576, 8192, 8192, 8192, 24576]
    - [20, 1040940.0]
  - - [8192, 24576, 1, 1024, 8192, 8192, 8192, 1024]
    - [8, 703346.0]
  - - [8192, 24576, 1, 3072, 8192, 8192, 8192, 3072]
    - [17, 936276.0]
  - - [8192, 24576, 1, 4096, 8192, 8192, 8192, 4096]
    - [17, 999502.0]
  - - [8192, 24576, 1, 24576, 8192, 8192, 8192, 24576]
    - [7, 1048870.0]
- null
- null
- DeviceEfficiency
- Equality
