library/src/amd_detail/rocblaslt/src/Tensile/Logic/asm_full/aquavanjaram/gfx942/Equality/aquavanjaram_Cijk_Alik_Bljk_F8BS_BH_UserArgs.yaml
- {MinimumRequiredVersion: 4.33.0}
- aquavanjaram
- gfx942
- [Device 0049, Device 0050]
    SolutionIndex: 0
    SolutionNameMin: Cijk_Alik_Bljk_F8BS_BH_UserArgs_MT256x192x128_MI16x16x1_SN_GRVWA8_GRVWB8_GSU1_LBSPPA1024_LBSPPB128_LPA8_LPB8_LRVW8_MIWT8_6_SU8_SUM0_SUS256_SVW8_VWA8_WG32_8_1_WGM40
    SolutionIndex: 1
    SolutionNameMin: Cijk_Alik_Bljk_F8BS_BH_UserArgs_MT256x224x128_MI16x16x1_SN_GRVWA8_GRVWB8_GSU1_LBSPPA512_LBSPPB128_LPA8_LPB8_LRVW8_MIWT4_14_SU8_SUM0_SUS256_SVW4_VWA4_WG64_4_1_WGM40
    SolutionIndex: 2
    SolutionNameMin: Cijk_Alik_Bljk_F8BS_BH_UserArgs_MT224x256x128_MI16x16x1_SN_GRVWA8_GRVWB8_GSU1_LBSPPA256_LBSPPB128_LPA8_LPB8_LRVW8_MIWT14_4_SU0_SUM0_SUS0_SVW2_VWA2_WG16_16_1_WGM0
    SolutionIndex: 3
    SolutionNameMin: Cijk_Alik_Bljk_F8BS_BH_UserArgs_MT224x256x128_MI16x16x1_SN_GRVWA8_GRVWB8_GSU1_LBSPPA256_LBSPPB128_LPA8_LPB8_LRVW8_MIWT14_4_SU8_SUM0_SUS256_SVW2_VWA2_WG16_16_1_WGM0
    SolutionIndex: 4
    SolutionNameMin: Cijk_Alik_Bljk_F8BS_BH_UserArgs_MT256x224x128_MI16x16x1_SN_GRVWA8_GRVWB8_GSU1_LBSPPA512_LBSPPB128_LPA8_LPB8_LRVW8_MIWT4_14_SU0_SUM0_SUS0_SVW4_VWA4_WG64_4_1_WGM40
    SolutionIndex: 5
    SolutionNameMin: Cijk_Alik_Bljk_F8BS_BH_UserArgs_MT256x192x128_MI16x16x1_SN_GRVWA8_GRVWB8_GSU1_LBSPPA1024_LBSPPB128_LPA8_LPB8_LRVW8_MIWT8_6_SU0_SUM0_SUS0_SVW8_VWA8_WG32_8_1_WGM40
    SolutionIndex: 6
    SolutionNameMin: Cijk_Alik_Bljk_F8BS_BH_UserArgs_MT256x144x128_MI16x16x1_SN_GRVWA16_GRVWB8_GSU1_LBSPPA512_LBSPPB128_LPA32_LPB32_LRVW16_MIWT4_9_SU0_SUM0_SUS0_SVW4_VWA4_WG64_4_1_WGM40
    SolutionIndex: 7
    SolutionNameMin: Cijk_Alik_Bljk_F8BS_BH_UserArgs_MT160x192x128_MI16x16x1_SN_GRVWA16_GRVWB16_GSU1_LBSPPA256_LBSPPB128_LPA32_LPB32_LRVW16_MIWT10_3_SU0_SUM0_SUS0_SVW2_VWA2_WG16_16_1_WGM40
    SolutionIndex: 8
    SolutionNameMin: Cijk_Alik_Bljk_F8BS_BH_UserArgs_MT160x224x128_MI16x16x1_SN_GRVWA16_GRVWB16_GSU1_LBSPPA128_LBSPPB128_LPA32_LPB32_LRVW16_MIWT5_7_SU8_SUM0_SUS256_SVW1_VWA1_WG32_8_1_WGM40
    SolutionIndex: 9
    SolutionNameMin: Cijk_Alik_Bljk_F8BS_BH_UserArgs_MT64x16x256_MI16x16x1_SN_CLR1_GRVWA16_GRVWB16_GSU1_LBSPPA256_LBSPPB256_LPA32_LPB32_LRVW16_MIWT1_1_PLR1_SU0_SUM0_SUS0_SVW1_VWA1_WG64_4_1_WGM0
    SolutionIndex: 10
    SolutionNameMin: Cijk_Alik_Bljk_F8BS_BH_UserArgs_MT64x16x512_MI16x16x1_SN_CLR1_GRVWA16_GRVWB16_GSU1_LBSPPA512_LBSPPB512_LPA32_LPB32_LRVW16_MIWT1_1_PLR1_SU0_SUM0_SUS0_SVW1_VWA1_WG64_4_1_WGM0
    SolutionIndex: 11
    SolutionNameMin: Cijk_Alik_Bljk_F8BS_BH_UserArgs_MT32x16x256_MI16x16x1_SN_CLR1_GRVWA16_GRVWB16_GSU1_LBSPPA256_LBSPPB256_LPA32_LPB32_LRVW16_MIWT1_1_PLR1_SU0_SUM0_SUS0_SVW1_VWA1_WG32_4_1_WGM0
    SolutionIndex: 12
    SolutionNameMin: Cijk_Alik_Bljk_F8BS_BH_UserArgs_MT64x16x256_MI16x16x1_SN_CLR1_GRVWA16_GRVWB16_GSU8_LBSPPA256_LBSPPB256_LPA32_LPB32_LRVW16_MIWT1_1_PLR1_SU0_SUM0_SUS0_SVW1_VWA1_WG64_4_1_WGM0
    SolutionIndex: 13
    SolutionNameMin: Cijk_Alik_Bljk_F8BS_BH_UserArgs_MT32x32x256_MI16x16x1_SN_CLR1_GRVWA16_GRVWB16_GSU1_LBSPPA256_LBSPPB256_LPA32_LPB32_LRVW16_MIWT1_1_PLR1_SU8_SUM0_SUS256_SVW1_VWA1_WG32_8_1_WGM8
    SolutionIndex: 14
    SolutionNameMin: Cijk_Alik_Bljk_F8BS_BH_UserArgs_MT32x16x512_MI16x16x1_SN_CLR1_GRVWA16_GRVWB16_GSU1_LBSPPA512_LBSPPB512_LPA32_LPB32_LRVW16_MIWT1_1_PLR1_SU0_SUM0_SUS0_SVW1_VWA1_WG32_4_1_WGM0
    SolutionIndex: 15
    SolutionNameMin: Cijk_Alik_Bljk_F8BS_BH_UserArgs_MT64x16x256_MI16x16x1_SN_CLR1_GRVWA16_GRVWB16_GSU1_LBSPPA256_LBSPPB256_LPA32_LPB32_LRVW16_MIWT1_1_PLR1_SU4_SUM0_SUS256_SVW1_VWA1_WG64_4_1_WGM0
    SolutionIndex: 16
    SolutionNameMin: Cijk_Alik_Bljk_F8BS_BH_UserArgs_MT32x16x256_MI16x16x1_SN_CLR1_GRVWA16_GRVWB16_GSU1_LBSPPA256_LBSPPB256_LPA32_LPB32_LRVW16_MIWT1_1_PLR1_SU8_SUM0_SUS256_SVW1_VWA1_WG32_4_1_WGM0
    SolutionIndex: 17
    SolutionNameMin: Cijk_Alik_Bljk_F8BS_BH_UserArgs_MT16x16x256_MI16x16x1_SN_CLR1_GRVWA16_GRVWB16_GSU1_LBSPPA256_LBSPPB256_LPA32_LPB32_LRVW16_MIWT1_1_PLR1_SU0_SUM0_SUS0_SVW1_VWA1_WG16_4_1_WGM0
    SolutionIndex: 18
    SolutionNameMin: Cijk_Alik_Bljk_F8BS_BH_UserArgs_MT64x16x256_MI16x16x1_SN_CLR1_GRVWA16_GRVWB16_GSU1_LBSPPA256_LBSPPB256_LPA32_LPB32_LRVW16_MIWT1_1_PLR1_SU8_SUM0_SUS256_SVW1_VWA1_WG64_4_1_WGM40
    SolutionIndex: 19
    SolutionNameMin: Cijk_Alik_Bljk_F8BS_BH_UserArgs_MT32x16x256_MI16x16x1_SN_CLR1_GRVWA16_GRVWB16_GSU1_LBSPPA256_LBSPPB256_LPA32_LPB32_LRVW16_MIWT1_1_PLR1_SU4_SUM0_SUS256_SVW1_VWA1_WG32_4_1_WGM0
    SolutionIndex: 20
    SolutionNameMin: Cijk_Alik_Bljk_F8BS_BH_UserArgs_MT32x32x256_MI16x16x1_SN_CLR1_GRVWA16_GRVWB16_GSU1_LBSPPA256_LBSPPB256_LPA32_LPB32_LRVW16_MIWT1_1_PLR1_SU8_SUM0_SUS256_SVW1_VWA1_WG32_8_1_WGM0
    SolutionIndex: 21
    SolutionNameMin: Cijk_Alik_Bljk_F8BS_BH_UserArgs_MT32x16x512_MI16x16x1_SN_CLR1_GRVWA16_GRVWB16_GSU1_LBSPPA512_LBSPPB512_LPA32_LPB32_LRVW16_MIWT1_1_PLR1_SU0_SUM0_SUS0_SVW1_VWA1_WG32_4_1_WGM8
    SolutionIndex: 22
    SolutionNameMin: Cijk_Alik_Bljk_F8BS_BH_UserArgs_MT64x32x256_MI16x16x1_SN_CLR1_GRVWA16_GRVWB16_GSU1_LBSPPA512_LBSPPB256_LPA32_LPB32_LRVW16_MIWT2_1_PLR1_SU0_SUM0_SUS0_SVW2_VWA2_WG32_8_1_WGM0
    SolutionIndex: 23
    SolutionNameMin: Cijk_Alik_Bljk_F8BS_BH_UserArgs_MT64x64x256_MI16x16x1_SN_CLR1_GRVWA16_GRVWB16_GSU1_LBSPPA512_LBSPPB256_LPA32_LPB32_LRVW16_MIWT2_2_PLR1_SU4_SUM0_SUS256_SVW2_VWA2_WG32_8_1_WGM0
    SolutionIndex: 24
    SolutionNameMin: Cijk_Alik_Bljk_F8BS_BH_UserArgs_MT64x64x256_MI16x16x1_SN_CLR1_GRVWA16_GRVWB16_GSU1_LBSPPA512_LBSPPB256_LPA32_LPB32_LRVW16_MIWT2_2_PLR1_SU8_SUM0_SUS256_SVW2_VWA2_WG32_8_1_WGM0
    SolutionIndex: 25
    SolutionNameMin: Cijk_Alik_Bljk_F8BS_BH_UserArgs_MT64x64x256_MI16x16x1_SN_CLR1_GRVWA16_GRVWB16_GSU1_LBSPPA512_LBSPPB256_LPA32_LPB32_LRVW16_MIWT2_2_PLR1_SU0_SUM0_SUS0_SVW2_VWA2_WG32_8_1_WGM0
    SolutionIndex: 26
    SolutionNameMin: Cijk_Alik_Bljk_F8BS_BH_UserArgs_MT128x64x256_MI16x16x1_SN_CLR1_GRVWA16_GRVWB16_GSU1_LBSPPA1024_LBSPPB256_LPA32_LPB32_LRVW16_MIWT4_2_PLR1_SU0_SUM0_SUS0_SVW4_VWA4_WG32_8_1_WGM0
    SolutionIndex: 27
    SolutionNameMin: Cijk_Alik_Bljk_F8BS_BH_UserArgs_MT32x32x512_MI16x16x1_SN_CLR1_GRVWA16_GRVWB16_GSU1_LBSPPA512_LBSPPB512_LPA32_LPB32_LRVW16_MIWT1_1_PLR1_SU0_SUM0_SUS0_SVW1_VWA1_WG32_8_1_WGM0
- - - [7168, 2097152, 1, 8192]
    - [2, 0.0]
  - - [3584, 2097152, 1, 8192]
    - [3, 0.0]
  - - [1280, 2097152, 1, 8192]
    - [0, 0.0]
  - - [1024, 2097152, 1, 8192]
    - [1, 0.0]
  - - [7168, 1048576, 1, 8192]
    - [2, 0.0]
  - - [3584, 1048576, 1, 8192]
    - [3, 0.0]
  - - [1280, 1048576, 1, 8192]
    - [0, 0.0]
  - - [1024, 1048576, 1, 8192]
    - [1, 0.0]
  - - [7168, 524288, 1, 8192]
    - [2, 0.0]
  - - [3584, 524288, 1, 8192]
    - [3, 0.0]
  - - [1280, 524288, 1, 8192]
    - [0, 0.0]
  - - [1024, 524288, 1, 8192]
    - [1, 0.0]
  - - [7168, 262144, 1, 8192]
    - [2, 0.0]
  - - [3584, 262144, 1, 8192]
    - [3, 0.0]
  - - [1280, 262144, 1, 8192]
    - [0, 0.0]
  - - [1024, 262144, 1, 8192]
    - [1, 0.0]
  - - [7168, 131072, 1, 8192]
    - [2, 0.0]
  - - [3584, 131072, 1, 8192]
    - [3, 0.0]
  - - [1280, 131072, 1, 8192]
    - [4, 0.0]
  - - [1024, 131072, 1, 8192]
    - [5, 0.0]
  - - [7168, 8192, 1, 8192]
    - [0, 0.0]
  - - [3584, 8192, 1, 8192]
    - [0, 0.0]
  - - [1280, 8192, 1, 8192]
    - [6, 0.0]
  - - [1024, 8192, 1, 8192]
    - [7, 0.0]
  - - [7168, 16384, 1, 8192]
    - [3, 0.0]
  - - [3584, 16384, 1, 8192]
    - [5, 0.0]
  - - [1280, 16384, 1, 8192]
    - [8, 0.0]
  - - [1024, 16384, 1, 8192]
    - [1, 0.0]
  - - [7168, 32768, 1, 8192]
    - [3, 0.0]
  - - [3584, 32768, 1, 8192]
    - [3, 0.0]
  - - [1280, 32768, 1, 8192]
    - [5, 0.0]
  - - [1024, 32768, 1, 8192]
    - [1, 0.0]
  - - [7168, 65536, 1, 8192]
    - [2, 0.0]
  - - [3584, 65536, 1, 8192]
    - [0, 0.0]
  - - [1280, 65536, 1, 8192]
    - [4, 0.0]
  - - [1024, 65536, 1, 8192]
    - [1, 0.0]
  - - [7168, 1, 1, 8192]
    - [10, 0.0]
  - - [7168, 2, 1, 8192]
    - [10, 0.0]
  - - [7168, 4, 1, 8192]
    - [10, 0.0]
  - - [7168, 8, 1, 8192]
    - [10, 0.0]
  - - [7168, 16, 1, 8192]
    - [10, 0.0]
  - - [7168, 32, 1, 8192]
    - [9, 0.0]
  - - [8192, 64, 1, 1024]
    - [22, 0.0]
  - - [7168, 64, 1, 8192]
    - [23, 0.0]
  - - [8192, 64, 1, 3584]
    - [24, 0.0]
  - - [1280, 64, 1, 8192]
    - [14, 0.0]
  - - [8192, 128, 1, 1024]
    - [25, 0.0]
  - - [7168, 128, 1, 8192]
    - [26, 0.0]
  - - [8192, 128, 1, 3584]
    - [26, 0.0]
  - - [1280, 128, 1, 8192]
    - [27, 0.0]
- null
- null
- DeviceEfficiency
- Equality
