library/src/amd_detail/rocblaslt/src/Tensile/Logic/asm_full/aquavanjaram/gfx942/Equality/aquavanjaram_Cijk_Alik_Bljk_F8B8HS_BH_UserArgs.yaml
- {MinimumRequiredVersion: 4.33.0}
- aquavanjaram
- gfx942
- [Device 0049, Device 0050]
    SolutionIndex: 0
    SolutionNameMin: Cijk_Alik_Bljk_F8B8HS_BH_UserArgs_MT128x96x128_MI16x16x1_SN_CLR1_GRVWA16_GRVWB16_GSU1_GSUC0_GSUWGMRR0_GLS0_K1_LBSPPA512_LBSPPB128_LPA32_LPB32_LRVW16_MIAV1_MIWT4_3_NTC3_NTD3_SU0_SUM0_SUS0_SPO0_SSO0_SVW4_TLDS1_VWA4_VWB1_WG32_8_1_WGM1_WGMXCC1_WGMXCCGn1
    SolutionIndex: 1
    SolutionNameMin: Cijk_Alik_Bljk_F8B8HS_BH_UserArgs_MT128x96x128_MI16x16x1_SN_CLR1_GRVWA16_GRVWB16_GSU1_GSUC0_GSUWGMRR0_GLS0_K1_LBSPPA512_LBSPPB128_LPA64_LPB64_LRVW16_MIAV1_MIWT4_3_NTC3_NTD3_SU0_SUM0_SUS0_SPO0_SSO0_SVW4_TLDS1_VWA4_VWB1_WG32_8_1_WGM1_WGMXCC1_WGMXCCGn1
    SolutionIndex: 2
    SolutionNameMin: Cijk_Alik_Bljk_F8B8HS_BH_UserArgs_MT64x112x256_MI16x16x1_SN_CLR1_GRVWA16_GRVWB16_GSU1_GSUC0_GSUWGMRR0_GLS0_K1_LBSPPA512_LBSPPB256_LPA32_LPB32_LRVW16_MIAV1_MIWT2_7_NTC0_NTD0_SU0_SUM0_SUS0_SPO0_SSO0_SVW2_TLDS1_VWA2_VWB1_WG32_4_2_WGM1_WGMXCC1_WGMXCCGn1
    SolutionIndex: 3
    SolutionNameMin: Cijk_Alik_Bljk_F8B8HS_BH_UserArgs_MT256x192x128_MI16x16x1_SN_CLR1_GRVWA4_GRVWB16_GSU1_GSUC0_GSUWGMRR0_GLS0_K1_LBSPPA1024_LBSPPB256_LPA32_LPB32_LRVW16_MIAV0_MIWT8_6_NTC4_NTD4_SU8_SUM0_SUS256_SPO1_SSO4_SVW8_TLDS1_VWA8_VWB2_WG32_8_1_WGM48_WGMXCC1_WGMXCCGn1
    SolutionIndex: 4
    SolutionNameMin: Cijk_Alik_Bljk_F8B8HS_BH_UserArgs_MT256x160x64_MI16x16x1_SN_CLR1_GRVWA4_GRVWB4_GSU1_GSUC0_GSUWGMRR0_GLS0_K1_LBSPPA512_LBSPPB128_LPA8_LPB8_LRVW8_MIAV0_MIWT8_5_NTC4_NTD4_SU8_SUM0_SUS256_SPO1_SSO4_SVW8_TLDS1_VWA8_VWB1_WG32_8_1_WGM32_WGMXCC1_WGMXCCGn1
    SolutionIndex: 5
    SolutionNameMin: Cijk_Alik_Bljk_F8B8HS_BH_UserArgs_MT256x224x128_MI16x16x1_SN_CLR1_GRVWA4_GRVWB4_GSU2_GSUC0_GSUWGMRR0_GLS0_K1_LBSPPA1024_LBSPPB128_LPA8_LPB8_LRVW8_MIAV0_MIWT8_7_NTC4_NTD4_SU8_SUM0_SUS256_SPO1_SSO4_SVW8_TLDS1_VWA8_VWB1_WG32_8_1_WGM32_WGMXCC1_WGMXCCGn1
    SolutionIndex: 6
    SolutionNameMin: Cijk_Alik_Bljk_F8B8HS_BH_UserArgs_MT256x192x128_MI32x32x1_SN_CLR1_GRVWA16_GRVWB16_GSU1_GSUC0_GSUWGMRR0_GLS0_K1_LBSPPA512_LBSPPB128_LPA16_LPB16_LRVW16_MIAV0_MIWT4_3_NTC4_NTD4_SU8_SUM0_SUS256_SPO1_SSO4_SVW4_TLDS1_VWA4_VWB1_WG64_4_1_WGM48_WGMXCC1_WGMXCCGn1
    SolutionIndex: 7
    SolutionNameMin: Cijk_Alik_Bljk_F8B8HS_BH_UserArgs_MT256x224x128_MI16x16x1_SN_CLR1_GRVWA4_GRVWB4_GSU1_GSUC0_GSUWGMRR0_GLS0_K1_LBSPPA1024_LBSPPB128_LPA8_LPB8_LRVW8_MIAV0_MIWT8_7_NTC4_NTD4_SU8_SUM0_SUS256_SPO1_SSO4_SVW8_TLDS1_VWA8_VWB1_WG32_8_1_WGM48_WGMXCC1_WGMXCCGn1
    SolutionIndex: 8
    SolutionNameMin: Cijk_Alik_Bljk_F8B8HS_BH_UserArgs_MT64x96x256_MI16x16x1_SN_CLR1_GRVWA16_GRVWB16_GSU1_GSUC0_GSUWGMRR0_GLS0_K1_LBSPPA1024_LBSPPB256_LPA32_LPB16_LRVW16_MIAV1_MIWT4_3_NTC3_NTD3_SU0_SUM0_SUS0_SPO0_SSO0_SVW4_TLDS1_VWA4_VWB1_WG16_8_2_WGM1_WGMXCC1_WGMXCCGn1
    SolutionIndex: 9
    SolutionNameMin: Cijk_Alik_Bljk_F8B8HS_BH_UserArgs_MT256x224x128_MI16x16x1_SN_CLR1_GRVWA4_GRVWB16_GSU1_GSUC0_GSUWGMRR0_GLS0_K1_LBSPPA1024_LBSPPB128_LPA8_LPB16_LRVW8_MIAV0_MIWT8_7_NTC4_NTD4_SU8_SUM0_SUS256_SPO1_SSO4_SVW8_TLDS1_VWA8_VWB1_WG32_8_1_WGM1_WGMXCC1_WGMXCCGn1
    SolutionIndex: 10
    SolutionNameMin: Cijk_Alik_Bljk_F8B8HS_BH_UserArgs_MT256x224x128_MI16x16x1_SN_CLR1_GRVWA4_GRVWB16_GSU1_GSUC0_GSUWGMRR0_GLS0_K1_LBSPPA1024_LBSPPB128_LPA8_LPB8_LRVW8_MIAV0_MIWT8_7_NTC4_NTD4_SU8_SUM0_SUS256_SPO1_SSO4_SVW8_TLDS1_VWA8_VWB1_WG32_8_1_WGM1_WGMXCC1_WGMXCCGn1
    SolutionIndex: 11
    SolutionNameMin: Cijk_Alik_Bljk_F8B8HS_BH_UserArgs_MT96x160x128_MI16x16x1_SN_CLR1_GRVWA16_GRVWB16_GSU1_GSUC0_GSUWGMRR0_GLS0_K1_LBSPPA128_LBSPPB128_LPA32_LPB32_LRVW16_MIAV1_MIWT3_5_NTC4_NTD4_SU8_SUM0_SUS256_SPO1_SSO4_SVW1_TLDS1_VWA1_VWB1_WG32_8_1_WGMn16_WGMXCC1_WGMXCCGn1
    SolutionIndex: 12
    SolutionNameMin: Cijk_Alik_Bljk_F8B8HS_BH_UserArgs_MT192x256x128_MI32x32x1_SN_CLR1_GRVWA16_GRVWB16_GSU1_GSUC0_GSUWGMRR0_GLS0_K1_LBSPPA256_LBSPPB256_LPA16_LPB16_LRVW16_MIAV0_MIWT6_2_NTC4_NTD4_SU8_SUM0_SUS256_SPO1_SSO4_SVW2_TLDS1_VWA2_VWB2_WG32_8_1_WGM16_WGMXCC1_WGMXCCGn1
    SolutionIndex: 13
    SolutionNameMin: Cijk_Alik_Bljk_F8B8HS_BH_UserArgs_MT128x96x256_MI16x16x1_SN_CLR1_GRVWA16_GRVWB16_GSU1_GSUC0_GSUWGMRR0_GLS0_K1_LBSPPA1024_LBSPPB256_LPA32_LPB64_LRVW16_MIAV1_MIWT4_3_NTC3_NTD3_SU0_SUM0_SUS0_SPO0_SSO0_SVW4_TLDS1_VWA4_VWB1_WG32_8_1_WGM1_WGMXCC1_WGMXCCGn1
    SolutionIndex: 14
    SolutionNameMin: Cijk_Alik_Bljk_F8B8HS_BH_UserArgs_MT256x176x128_MI16x16x1_SN_CLR1_GRVWA16_GRVWB4_GSU1_GSUC0_GSUWGMRR0_GLS0_K1_LBSPPA512_LBSPPB128_LPA16_LPB32_LRVW16_MIAV0_MIWT4_11_NTC4_NTD4_SU8_SUM0_SUS256_SPO1_SSO4_SVW4_TLDS1_VWA4_VWB1_WG64_4_1_WGM1_WGMXCC1_WGMXCCGn1
    SolutionIndex: 15
    SolutionNameMin: Cijk_Alik_Bljk_F8B8HS_BH_UserArgs_MT192x224x128_MI16x16x1_SN_CLR1_GRVWA16_GRVWB16_GSU1_GSUC0_GSUWGMRR0_GLS0_K1_LBSPPA256_LBSPPB128_LPA32_LPB32_LRVW16_MIAV0_MIWT6_7_NTC4_NTD4_SU8_SUM0_SUS256_SPO1_SSO4_SVW2_TLDS1_VWA2_VWB1_WG32_8_1_WGM1_WGMXCC1_WGMXCCGn1
    SolutionIndex: 16
    SolutionNameMin: Cijk_Alik_Bljk_F8B8HS_BH_UserArgs_MT256x192x128_MI16x16x1_SN_CLR1_GRVWA16_GRVWB16_GSU1_GSUC0_GSUWGMRR0_GLS0_K1_LBSPPA1024_LBSPPB256_LPA32_LPB48_LRVW16_MIAV0_MIWT8_6_NTC4_NTD4_SU8_SUM0_SUS256_SPO1_SSO4_SVW8_TLDS1_VWA8_VWB2_WG32_8_1_WGM48_WGMXCC1_WGMXCCGn1
    SolutionIndex: 17
    SolutionNameMin: Cijk_Alik_Bljk_F8B8HS_BH_UserArgs_MT256x192x128_MI16x16x1_SN_CLR1_GRVWA16_GRVWB16_GSU1_GSUC0_GSUWGMRR0_GLS0_K1_LBSPPA1024_LBSPPB256_LPA32_LPB64_LRVW16_MIAV0_MIWT8_6_NTC4_NTD4_SU8_SUM0_SUS256_SPO1_SSO4_SVW8_TLDS1_VWA8_VWB2_WG32_8_1_WGM48_WGMXCC1_WGMXCCGn1
    SolutionIndex: 18
    SolutionNameMin: Cijk_Alik_Bljk_F8B8HS_BH_UserArgs_MT128x96x128_MI16x16x1_SN_CLR1_GRVWA16_GRVWB16_GSU3_GSUC0_GSUWGMRR0_GLS0_K1_LBSPPA512_LBSPPB128_LPA32_LPB32_LRVW16_MIAV1_MIWT4_3_NTC3_NTD3_SU0_SUM0_SUS0_SPO0_SSO0_SVW4_TLDS1_VWA4_VWB1_WG32_8_1_WGM1_WGMXCC1_WGMXCCGn1
    SolutionIndex: 19
    SolutionNameMin: Cijk_Alik_Bljk_F8B8HS_BH_UserArgs_MT224x192x128_MI16x16x1_SN_CLR1_GRVWA4_GRVWB16_GSU1_GSUC0_GSUWGMRR0_GLS1_K1_LBSPPA128_LBSPPB256_LPA32_LPB32_LRVW16_MIAV0_MIWT7_6_NTC4_NTD4_SU8_SUM0_SUS2048_SPO1_SSO4_SVW1_TLDS1_VWA1_VWB2_WG32_8_1_WGM48_WGMXCC1_WGMXCCGn1
    SolutionIndex: 20
    SolutionNameMin: Cijk_Alik_Bljk_F8B8HS_BH_UserArgs_MT256x128x128_MI16x16x1_SN_CLR1_GRVWA4_GRVWB16_GSU1_GSUC0_GSUWGMRR0_GLS0_K1_LBSPPA512_LBSPPB256_LPA32_LPB32_LRVW16_MIAV0_MIWT4_8_NTC4_NTD4_SU8_SUM0_SUS512_SPO1_SSO4_SVW4_TLDS1_VWA4_VWB2_WG64_4_1_WGM1_WGMXCC1_WGMXCCGn1
    SolutionIndex: 21
    SolutionNameMin: Cijk_Alik_Bljk_F8B8HS_BH_UserArgs_MT256x256x64_MI16x16x1_SN_CLR0_GRVWA4_GRVWB4_GSU1_GSUC0_GSUWGMRR0_GLS0_K1_LBSPPA512_LBSPPB128_LPA8_LPB8_LRVW8_MIAV0_MIWT8_8_NTC4_NTD4_SU8_SUM0_SUS128_SPO1_SSO4_SVW8_TLDS1_VWA8_VWB1_WG32_8_1_WGMn32_WGMXCC1_WGMXCCGn1
    SolutionIndex: 22
    SolutionNameMin: Cijk_Alik_Bljk_F8B8HS_BH_UserArgs_MT256x256x64_MI16x16x1_SN_CLR0_GRVWA4_GRVWB4_GSU1_GSUC0_GSUWGMRR0_GLS0_K1_LBSPPA512_LBSPPB128_LPA48_LPB8_LRVW8_MIAV0_MIWT8_8_NTC4_NTD4_SU8_SUM0_SUS128_SPO1_SSO4_SVW8_TLDS1_VWA8_VWB1_WG32_8_1_WGMn32_WGMXCC1_WGMXCCGn1
    SolutionIndex: 23
    SolutionNameMin: Cijk_Alik_Bljk_F8B8HS_BH_UserArgs_MT256x192x128_MI16x16x1_SN_CLR1_GRVWA4_GRVWB16_GSU1_GSUC0_GSUWGMRR0_GLS0_K1_LBSPPA512_LBSPPB256_LPA32_LPB32_LRVW16_MIAV0_MIWT8_6_NTC4_NTD4_SU8_SUM0_SUS2048_SPO1_SSO4_SVW4_TLDS2_VWA4_VWB2_WG32_8_1_WGM48_WGMXCC1_WGMXCCGn1
    SolutionIndex: 24
    SolutionNameMin: Cijk_Alik_Bljk_F8B8HS_BH_UserArgs_MT256x192x128_MI16x16x1_SN_CLR1_GRVWA4_GRVWB16_GSU1_GSUC0_GSUWGMRR0_GLS0_K1_LBSPPA1024_LBSPPB256_LPA32_LPB16_LRVW16_MIAV0_MIWT8_6_NTC4_NTD4_SU8_SUM0_SUS2048_SPO1_SSO4_SVW8_TLDS1_VWA8_VWB2_WG32_8_1_WGM48_WGMXCC1_WGMXCCGn1
    SolutionIndex: 25
    SolutionNameMin: Cijk_Alik_Bljk_F8B8HS_BH_UserArgs_MT256x192x128_MI16x16x1_SN_CLR1_GRVWA4_GRVWB16_GSU1_GSUC0_GSUWGMRR0_GLS0_K1_LBSPPA1024_LBSPPB256_LPA32_LPB32_LRVW16_MIAV0_MIWT8_6_NTC4_NTD4_SU8_SUM0_SUS512_SPO1_SSO4_SVW8_TLDS2_VWA8_VWB2_WG32_8_1_WGM48_WGMXCC1_WGMXCCGn1
    SolutionIndex: 26
    SolutionNameMin: Cijk_Alik_Bljk_F8B8HS_BH_UserArgs_MT256x224x128_MI16x16x1_SN_CLR1_GRVWA4_GRVWB4_GSU1_GSUC0_GSUWGMRR0_GLS0_K1_LBSPPA512_LBSPPB128_LPA8_LPB8_LRVW8_MIAV0_MIWT8_7_NTC4_NTD4_SU8_SUM0_SUS2048_SPO1_SSO4_SVW4_TLDS2_VWA4_VWB1_WG32_8_1_WGM32_WGMXCC1_WGMXCCGn1
    SolutionIndex: 27
    SolutionNameMin: Cijk_Alik_Bljk_F8B8HS_BH_UserArgs_MT256x224x128_MI16x16x1_SN_CLR1_GRVWA4_GRVWB4_GSU1_GSUC0_GSUWGMRR0_GLS0_K1_LBSPPA1024_LBSPPB128_LPA8_LPB8_LRVW8_MIAV0_MIWT8_7_NTC4_NTD4_SU8_SUM0_SUS512_SPO1_SSO4_SVW8_TLDS2_VWA8_VWB1_WG32_8_1_WGM32_WGMXCC1_WGMXCCGn1
    SolutionIndex: 28
    SolutionNameMin: Cijk_Alik_Bljk_F8B8HS_BH_UserArgs_MT256x160x64_MI16x16x1_SN_CLR1_GRVWA4_GRVWB4_GSU1_GSUC0_GSUWGMRR0_GLS0_K1_LBSPPA512_LBSPPB128_LPA8_LPB8_LRVW8_MIAV0_MIWT8_5_NTC4_NTD4_SU8_SUM0_SUS512_SPO1_SSO4_SVW8_TLDS2_VWA8_VWB1_WG32_8_1_WGM32_WGMXCC1_WGMXCCGn1
    SolutionIndex: 29
    SolutionNameMin: Cijk_Alik_Bljk_F8B8HS_BH_UserArgs_MT256x192x128_MI32x32x1_SN_CLR1_GRVWA16_GRVWB16_GSU1_GSUC0_GSUWGMRR0_GLS0_K1_LBSPPA512_LBSPPB128_LPA16_LPB16_LRVW16_MIAV0_MIWT4_3_NTC4_NTD4_SU8_SUM0_SUS1024_SPO1_SSO4_SVW4_TLDS1_VWA4_VWB1_WG64_4_1_WGM48_WGMXCC1_WGMXCCGn1
    SolutionIndex: 30
    SolutionNameMin: Cijk_Alik_Bljk_F8B8HS_BH_UserArgs_MT192x224x128_MI16x16x1_SN_CLR1_GRVWA4_GRVWB16_GSU1_GSUC0_GSUWGMRR0_GLS1_K1_LBSPPA256_LBSPPB128_LPA32_LPB32_LRVW16_MIAV0_MIWT6_7_NTC4_NTD4_SU8_SUM0_SUS512_SPO1_SSO4_SVW2_TLDS2_VWA2_VWB1_WG32_8_1_WGM1_WGMXCC1_WGMXCCGn1
    SolutionIndex: 31
    SolutionNameMin: Cijk_Alik_Bljk_F8B8HS_BH_UserArgs_MT192x224x128_MI16x16x1_SN_CLR1_GRVWA4_GRVWB16_GSU1_GSUC0_GSUWGMRR0_GLS1_K1_LBSPPA256_LBSPPB128_LPA32_LPB16_LRVW16_MIAV0_MIWT6_7_NTC4_NTD4_SU8_SUM0_SUS512_SPO1_SSO4_SVW2_TLDS2_VWA2_VWB1_WG32_8_1_WGM1_WGMXCC1_WGMXCCGn1
    SolutionIndex: 32
    SolutionNameMin: Cijk_Alik_Bljk_F8B8HS_BH_UserArgs_MT256x128x128_MI16x16x1_SN_CLR1_GRVWA16_GRVWB16_GSU1_GSUC0_GSUWGMRR0_GLS0_K1_LBSPPA1024_LBSPPB512_LPA32_LPB32_LRVW16_MIAV0_MIWT8_4_NTC4_NTD4_SU8_SUM0_SUS512_SPO1_SSO4_SVW8_TLDS1_VWA8_VWB4_WG32_8_1_WGM1_WGMXCC1_WGMXCCGn1
    SolutionIndex: 33
    SolutionNameMin: Cijk_Alik_Bljk_F8B8HS_BH_UserArgs_MT256x128x128_MI16x16x1_SN_CLR1_GRVWA16_GRVWB16_GSU1_GSUC0_GSUWGMRR0_GLS1_K1_LBSPPA1024_LBSPPB512_LPA32_LPB32_LRVW16_MIAV0_MIWT8_4_NTC4_NTD4_SU8_SUM0_SUS256_SPO1_SSO4_SVW8_TLDS2_VWA8_VWB4_WG32_8_1_WGM1_WGMXCC1_WGMXCCGn1
    SolutionIndex: 34
    SolutionNameMin: Cijk_Alik_Bljk_F8B8HS_BH_UserArgs_MT256x224x128_MI16x16x1_SN_CLR1_GRVWA4_GRVWB16_GSU1_GSUC0_GSUWGMRR0_GLS0_K1_LBSPPA1024_LBSPPB128_LPA8_LPB16_LRVW8_MIAV0_MIWT8_7_NTC4_NTD4_SU8_SUM0_SUS256_SPO1_SSO4_SVW8_TLDS2_VWA8_VWB1_WG32_8_1_WGM1_WGMXCC1_WGMXCCGn1
    SolutionIndex: 35
    SolutionNameMin: Cijk_Alik_Bljk_F8B8HS_BH_UserArgs_MT256x224x128_MI16x16x1_SN_CLR1_GRVWA4_GRVWB16_GSU1_GSUC0_GSUWGMRR0_GLS1_K1_LBSPPA1024_LBSPPB128_LPA8_LPB16_LRVW8_MIAV0_MIWT8_7_NTC4_NTD4_SU8_SUM0_SUS128_SPO1_SSO4_SVW8_TLDS2_VWA8_VWB1_WG32_8_1_WGM1_WGMXCC1_WGMXCCGn1
    SolutionIndex: 36
    SolutionNameMin: Cijk_Alik_Bljk_F8B8HS_BH_UserArgs_MT256x128x128_MI32x32x1_SN_CLR1_GRVWA16_GRVWB16_GSU3_GSUC0_GSUWGMRR0_GLS1_K1_LBSPPA512_LBSPPB256_LPA48_LPB16_LRVW16_MIAV0_MIWT4_2_NTC3_NTD3_SU0_SUM0_SUS0_SPO0_SSO0_SVW4_TLDS1_VWA4_VWB2_WG64_4_1_WGM1_WGMXCC1_WGMXCCGn1
    SolutionIndex: 37
    SolutionNameMin: Cijk_Alik_Bljk_F8B8HS_BH_UserArgs_MT256x128x128_MI32x32x1_SN_CLR1_GRVWA16_GRVWB16_GSU3_GSUC0_GSUWGMRR0_GLS1_K1_LBSPPA512_LBSPPB256_LPA16_LPB48_LRVW16_MIAV0_MIWT4_2_NTC3_NTD3_SU0_SUM0_SUS0_SPO0_SSO0_SVW4_TLDS1_VWA4_VWB2_WG64_4_1_WGM1_WGMXCC1_WGMXCCGn1
    SolutionIndex: 38
    SolutionNameMin: Cijk_Alik_Bljk_F8B8HS_BH_UserArgs_MT128x128x128_MI16x16x1_SN_CLR1_GRVWA16_GRVWB16_GSU1_GSUC0_GSUWGMRR0_GLS0_K1_LBSPPA512_LBSPPB128_LPA48_LPB32_LRVW16_MIAV1_MIWT4_4_NTC4_NTD4_SU8_SUM0_SUS1024_SPO1_SSO4_SVW4_TLDS1_VWA4_VWB1_WG32_8_1_WGMn32_WGMXCC1_WGMXCCGn1
    SolutionIndex: 39
    SolutionNameMin: Cijk_Alik_Bljk_F8B8HS_BH_UserArgs_MT128x128x128_MI16x16x1_SN_CLR1_GRVWA16_GRVWB16_GSU1_GSUC0_GSUWGMRR0_GLS0_K1_LBSPPA512_LBSPPB128_LPA32_LPB16_LRVW16_MIAV1_MIWT4_4_NTC4_NTD4_SU8_SUM0_SUS1024_SPO1_SSO4_SVW4_TLDS1_VWA4_VWB1_WG32_8_1_WGMn32_WGMXCC1_WGMXCCGn1
    SolutionIndex: 40
    SolutionNameMin: Cijk_Alik_Bljk_F8B8HS_BH_UserArgs_MT128x128x128_MI16x16x1_SN_CLR1_GRVWA16_GRVWB16_GSU1_GSUC0_GSUWGMRR0_GLS0_K1_LBSPPA512_LBSPPB128_LPA16_LPB16_LRVW16_MIAV1_MIWT4_4_NTC4_NTD4_SU8_SUM0_SUS1024_SPO1_SSO4_SVW4_TLDS1_VWA4_VWB1_WG32_8_1_WGMn32_WGMXCC1_WGMXCCGn1
    SolutionIndex: 41
    SolutionNameMin: Cijk_Alik_Bljk_F8B8HS_BH_UserArgs_MT128x128x128_MI16x16x1_SN_CLR1_GRVWA16_GRVWB16_GSU1_GSUC0_GSUWGMRR0_GLS0_K1_LBSPPA512_LBSPPB128_LPA32_LPB32_LRVW16_MIAV1_MIWT4_4_NTC4_NTD4_SU8_SUM0_SUS2048_SPO1_SSO4_SVW4_TLDS1_VWA4_VWB1_WG32_8_1_WGMn32_WGMXCC1_WGMXCCGn1
    SolutionIndex: 42
    SolutionNameMin: Cijk_Alik_Bljk_F8B8HS_BH_UserArgs_MT128x128x128_MI16x16x1_SN_CLR1_GRVWA16_GRVWB16_GSU1_GSUC0_GSUWGMRR0_GLS0_K1_LBSPPA512_LBSPPB128_LPA32_LPB64_LRVW16_MIAV1_MIWT4_4_NTC4_NTD4_SU8_SUM0_SUS2048_SPO1_SSO4_SVW4_TLDS1_VWA4_VWB1_WG32_8_1_WGMn32_WGMXCC1_WGMXCCGn1
    SolutionIndex: 43
    SolutionNameMin: Cijk_Alik_Bljk_F8B8HS_BH_UserArgs_MT128x128x128_MI16x16x1_SN_CLR1_GRVWA16_GRVWB16_GSU1_GSUC0_GSUWGMRR0_GLS1_K1_LBSPPA512_LBSPPB128_LPA32_LPB32_LRVW16_MIAV1_MIWT4_4_NTC4_NTD4_SU8_SUM0_SUS256_SPO1_SSO4_SVW4_TLDS2_VWA4_VWB1_WG32_8_1_WGMn32_WGMXCC1_WGMXCCGn1
    SolutionIndex: 44
    SolutionNameMin: Cijk_Alik_Bljk_F8B8HS_BH_UserArgs_MT128x128x128_MI16x16x1_SN_CLR1_GRVWA16_GRVWB16_GSU1_GSUC0_GSUWGMRR0_GLS0_K1_LBSPPA512_LBSPPB256_LPA32_LPB32_LRVW16_MIAV1_MIWT4_4_NTC4_NTD4_SU8_SUM0_SUS512_SPO1_SSO4_SVW4_TLDS2_VWA4_VWB2_WG32_8_1_WGMn32_WGMXCC1_WGMXCCGn1
    SolutionIndex: 45
    SolutionNameMin: Cijk_Alik_Bljk_F8B8HS_BH_UserArgs_MT128x128x128_MI16x16x1_SN_CLR1_GRVWA16_GRVWB16_GSU1_GSUC0_GSUWGMRR0_GLS0_K1_LBSPPA512_LBSPPB256_LPA16_LPB16_LRVW16_MIAV1_MIWT4_4_NTC4_NTD4_SU8_SUM0_SUS512_SPO1_SSO4_SVW4_TLDS2_VWA4_VWB2_WG32_8_1_WGMn32_WGMXCC1_WGMXCCGn1
    SolutionIndex: 46
    SolutionNameMin: Cijk_Alik_Bljk_F8B8HS_BH_UserArgs_MT128x128x128_MI16x16x1_SN_CLR1_GRVWA16_GRVWB16_GSU1_GSUC0_GSUWGMRR0_GLS0_K1_LBSPPA512_LBSPPB256_LPA32_LPB32_LRVW16_MIAV1_MIWT4_4_NTC4_NTD4_SU8_SUM0_SUS1024_SPO1_SSO4_SVW4_TLDS2_VWA4_VWB2_WG32_8_1_WGMn32_WGMXCC1_WGMXCCGn1
    SolutionIndex: 47
    SolutionNameMin: Cijk_Alik_Bljk_F8B8HS_BH_UserArgs_MT64x64x256_MI16x16x1_SN_CLR1_GRVWA16_GRVWB16_GSU1_GSUC0_GSUWGMRR0_GLS1_K1_LBSPPA1024_LBSPPB512_LPA32_LPB64_LRVW16_MIAV1_MIWT4_2_NTC3_NTD3_SU0_SUM0_SUS0_SPO0_SSO0_SVW4_TLDS2_VWA4_VWB2_WG16_8_2_WGM1_WGMXCC1_WGMXCCGn1
    SolutionIndex: 48
    SolutionNameMin: Cijk_Alik_Bljk_F8B8HS_BH_UserArgs_MT256x192x128_MI16x16x1_SN_CLR1_GRVWA16_GRVWB16_GSU1_GSUC0_GSUWGMRR0_GLS0_K1_LBSPPA1024_LBSPPB128_LPA32_LPB32_LRVW16_MIAV0_MIWT8_6_NTC4_NTD4_SU8_SUM0_SUS256_SPO1_SSO4_SVW8_TLDS1_VWA8_VWB1_WG32_8_1_WGM48_WGMXCC1_WGMXCCGn1
    SolutionIndex: 49
    SolutionNameMin: Cijk_Alik_Bljk_F8B8HS_BH_UserArgs_MT256x192x128_MI16x16x1_SN_CLR1_GRVWA16_GRVWB16_GSU1_GSUC0_GSUWGMRR0_GLS0_K1_LBSPPA1024_LBSPPB128_LPA16_LPB32_LRVW16_MIAV0_MIWT8_6_NTC4_NTD4_SU8_SUM0_SUS256_SPO1_SSO4_SVW8_TLDS1_VWA8_VWB1_WG32_8_1_WGM48_WGMXCC1_WGMXCCGn1
    SolutionIndex: 50
    SolutionNameMin: Cijk_Alik_Bljk_F8B8HS_BH_UserArgs_MT256x192x128_MI16x16x1_SN_CLR1_GRVWA16_GRVWB16_GSU1_GSUC0_GSUWGMRR0_GLS0_K1_LBSPPA1024_LBSPPB128_LPA32_LPB32_LRVW16_MIAV0_MIWT8_6_NTC4_NTD4_SU8_SUM0_SUS256_SPO1_SSO4_SVW8_TLDS2_VWA8_VWB1_WG32_8_1_WGM48_WGMXCC1_WGMXCCGn1
    SolutionIndex: 51
    SolutionNameMin: Cijk_Alik_Bljk_F8B8HS_BH_UserArgs_MT256x192x128_MI16x16x1_SN_CLR1_GRVWA16_GRVWB16_GSU1_GSUC0_GSUWGMRR0_GLS0_K1_LBSPPA1024_LBSPPB256_LPA32_LPB32_LRVW16_MIAV0_MIWT8_6_NTC4_NTD4_SU8_SUM0_SUS1024_SPO1_SSO4_SVW8_TLDS2_VWA8_VWB2_WG32_8_1_WGM48_WGMXCC1_WGMXCCGn1
    SolutionIndex: 52
    SolutionNameMin: Cijk_Alik_Bljk_F8B8HS_BH_UserArgs_MT128x224x128_MI16x16x1_SN_CLR1_GRVWA16_GRVWB16_GSU1_GSUC0_GSUWGMRR0_GLS0_K1_LBSPPA512_LBSPPB128_LPA32_LPB32_LRVW16_MIAV0_MIWT4_7_NTC4_NTD4_SU8_SUM0_SUS128_SPO1_SSO4_SVW4_TLDS2_VWA4_VWB1_WG32_8_1_WGMn16_WGMXCC1_WGMXCCGn1
    SolutionIndex: 53
    SolutionNameMin: Cijk_Alik_Bljk_F8B8HS_BH_UserArgs_MT128x224x128_MI16x16x1_SN_CLR1_GRVWA16_GRVWB16_GSU1_GSUC0_GSUWGMRR0_GLS1_K1_LBSPPA512_LBSPPB128_LPA32_LPB32_LRVW16_MIAV0_MIWT4_7_NTC4_NTD4_SU8_SUM0_SUS2048_SPO1_SSO4_SVW4_TLDS2_VWA4_VWB1_WG32_8_1_WGMn16_WGMXCC1_WGMXCCGn1
- - - [1024, 1024, 1, 1024, 1024, 1024, 1024, 1024]
    - [47, 267819.0]
  - - [1024, 1024, 1, 3072, 1024, 1024, 3072, 3072]
    - [2, 410868.0]
  - - [1024, 1024, 1, 4096, 1024, 1024, 4096, 4096]
    - [8, 438235.0]
  - - [1024, 1024, 1, 24576, 1024, 1024, 24576, 24576]
    - [18, 562635.0]
  - - [1024, 3072, 1, 1024, 1024, 1024, 1024, 1024]
    - [43, 441095.0]
  - - [1024, 3072, 1, 3072, 1024, 1024, 3072, 3072]
    - [38, 611766.0]
  - - [1024, 3072, 1, 4096, 1024, 1024, 4096, 4096]
    - [45, 620457.0]
  - - [1024, 3072, 1, 24576, 1024, 1024, 24576, 24576]
    - [36, 844544.0]
  - - [1024, 4096, 1, 1024, 1024, 1024, 1024, 1024]
    - [40, 467854.0]
  - - [1024, 4096, 1, 3072, 1024, 1024, 3072, 3072]
    - [42, 626092.0]
  - - [1024, 4096, 1, 4096, 1024, 1024, 4096, 4096]
    - [44, 699347.0]
  - - [1024, 4096, 1, 24576, 1024, 1024, 24576, 24576]
    - [41, 799628.0]
  - - [1024, 8192, 1, 1024, 1024, 1024, 1024, 1024]
    - [32, 528026.0]
  - - [1024, 8192, 1, 3072, 1024, 1024, 3072, 3072]
    - [53, 822103.0]
  - - [1024, 8192, 1, 4096, 1024, 1024, 4096, 4096]
    - [20, 855561.0]
  - - [1024, 8192, 1, 24576, 1024, 1024, 24576, 24576]
    - [5, 913609.0]
  - - [1024, 24576, 1, 1024, 1024, 1024, 1024, 1024]
    - [17, 659750.0]
  - - [1024, 24576, 1, 3072, 1024, 1024, 3072, 3072]
    - [50, 925569.0]
  - - [1024, 24576, 1, 4096, 1024, 1024, 4096, 4096]
    - [25, 981465.0]
  - - [1024, 24576, 1, 24576, 1024, 1024, 24576, 24576]
    - [23, 984924.0]
  - - [3072, 1024, 1, 1024, 3072, 3072, 1024, 1024]
    - [1, 470957.0]
  - - [3072, 1024, 1, 3072, 3072, 3072, 3072, 3072]
    - [13, 566177.0]
  - - [3072, 1024, 1, 4096, 3072, 3072, 4096, 4096]
    - [46, 604668.0]
  - - [3072, 1024, 1, 24576, 3072, 3072, 24576, 24576]
    - [37, 851278.0]
  - - [3072, 3072, 1, 1024, 3072, 3072, 1024, 1024]
    - [49, 579691.0]
  - - [3072, 3072, 1, 3072, 3072, 3072, 3072, 3072]
    - [32, 892779.0]
  - - [3072, 3072, 1, 4096, 3072, 3072, 4096, 4096]
    - [20, 951675.0]
  - - [3072, 3072, 1, 24576, 3072, 3072, 24576, 24576]
    - [33, 941629.0]
  - - [3072, 4096, 1, 1024, 3072, 3072, 1024, 1024]
    - [22, 563048.0]
  - - [3072, 4096, 1, 3072, 3072, 3072, 3072, 3072]
    - [15, 941637.0]
  - - [3072, 4096, 1, 4096, 3072, 3072, 4096, 4096]
    - [30, 996414.0]
  - - [3072, 4096, 1, 24576, 3072, 3072, 24576, 24576]
    - [3, 973149.0]
  - - [3072, 8192, 1, 1024, 3072, 3072, 1024, 1024]
    - [12, 651127.0]
  - - [3072, 8192, 1, 3072, 3072, 3072, 3072, 3072]
    - [15, 955352.0]
  - - [3072, 8192, 1, 4096, 3072, 3072, 4096, 4096]
    - [15, 1001110.0]
  - - [3072, 8192, 1, 24576, 3072, 3072, 24576, 24576]
    - [31, 1011280.0]
  - - [3072, 24576, 1, 1024, 3072, 3072, 1024, 1024]
    - [21, 783310.0]
  - - [3072, 24576, 1, 3072, 3072, 3072, 3072, 3072]
    - [50, 934871.0]
  - - [3072, 24576, 1, 4096, 3072, 3072, 4096, 4096]
    - [24, 942066.0]
  - - [3072, 24576, 1, 24576, 3072, 3072, 24576, 24576]
    - [30, 1043000.0]
  - - [4096, 1024, 1, 1024, 4096, 4096, 1024, 1024]
    - [39, 464155.0]
  - - [4096, 1024, 1, 3072, 4096, 4096, 3072, 3072]
    - [46, 635311.0]
  - - [4096, 1024, 1, 4096, 4096, 4096, 4096, 4096]
    - [44, 700205.0]
  - - [4096, 1024, 1, 24576, 4096, 4096, 24576, 24576]
    - [11, 794059.0]
  - - [4096, 3072, 1, 1024, 4096, 4096, 1024, 1024]
    - [16, 598962.0]
  - - [4096, 3072, 1, 3072, 4096, 4096, 3072, 3072]
    - [6, 930684.0]
  - - [4096, 3072, 1, 4096, 4096, 4096, 4096, 4096]
    - [29, 993794.0]
  - - [4096, 3072, 1, 24576, 4096, 4096, 24576, 24576]
    - [23, 986814.0]
  - - [4096, 4096, 1, 1024, 4096, 4096, 1024, 1024]
    - [9, 608211.0]
  - - [4096, 4096, 1, 3072, 4096, 4096, 3072, 3072]
    - [7, 1028130.0]
  - - [4096, 4096, 1, 4096, 4096, 4096, 4096, 4096]
    - [27, 1051950.0]
  - - [4096, 4096, 1, 24576, 4096, 4096, 24576, 24576]
    - [34, 1027650.0]
  - - [4096, 8192, 1, 1024, 4096, 4096, 1024, 1024]
    - [28, 690807.0]
  - - [4096, 8192, 1, 3072, 4096, 4096, 3072, 3072]
    - [27, 1010000.0]
  - - [4096, 8192, 1, 4096, 4096, 4096, 4096, 4096]
    - [35, 1061970.0]
  - - [4096, 8192, 1, 24576, 4096, 4096, 24576, 24576]
    - [34, 1078140.0]
  - - [4096, 24576, 1, 1024, 4096, 4096, 1024, 1024]
    - [48, 799296.0]
  - - [4096, 24576, 1, 3072, 4096, 4096, 3072, 3072]
    - [7, 942287.0]
  - - [4096, 24576, 1, 4096, 4096, 4096, 4096, 4096]
    - [51, 1001750.0]
  - - [4096, 24576, 1, 24576, 4096, 4096, 24576, 24576]
    - [9, 1111140.0]
  - - [8192, 1024, 1, 1024, 8192, 8192, 1024, 1024]
    - [14, 559410.0]
  - - [8192, 1024, 1, 3072, 8192, 8192, 3072, 3072]
    - [32, 799653.0]
  - - [8192, 1024, 1, 4096, 8192, 8192, 4096, 4096]
    - [20, 851099.0]
  - - [8192, 1024, 1, 24576, 8192, 8192, 24576, 24576]
    - [33, 888628.0]
  - - [8192, 3072, 1, 1024, 8192, 8192, 1024, 1024]
    - [0, 678447.0]
  - - [8192, 3072, 1, 3072, 8192, 8192, 3072, 3072]
    - [52, 930055.0]
  - - [8192, 3072, 1, 4096, 8192, 8192, 4096, 4096]
    - [25, 975118.0]
  - - [8192, 3072, 1, 24576, 8192, 8192, 24576, 24576]
    - [19, 1030610.0]
  - - [8192, 4096, 1, 1024, 8192, 8192, 1024, 1024]
    - [4, 692852.0]
  - - [8192, 4096, 1, 3072, 8192, 8192, 3072, 3072]
    - [27, 1023820.0]
  - - [8192, 4096, 1, 4096, 8192, 8192, 4096, 4096]
    - [9, 1079220.0]
  - - [8192, 4096, 1, 24576, 8192, 8192, 24576, 24576]
    - [35, 1068940.0]
  - - [8192, 8192, 1, 1024, 8192, 8192, 1024, 1024]
    - [4, 775136.0]
  - - [8192, 8192, 1, 3072, 8192, 8192, 3072, 3072]
    - [26, 984773.0]
  - - [8192, 8192, 1, 4096, 8192, 8192, 4096, 4096]
    - [35, 960840.0]
  - - [8192, 8192, 1, 24576, 8192, 8192, 24576, 24576]
    - [34, 1098510.0]
  - - [8192, 24576, 1, 1024, 8192, 8192, 1024, 1024]
    - [10, 737212.0]
  - - [8192, 24576, 1, 3072, 8192, 8192, 3072, 3072]
    - [9, 973094.0]
  - - [8192, 24576, 1, 4096, 8192, 8192, 4096, 4096]
    - [3, 1039020.0]
  - - [8192, 24576, 1, 24576, 8192, 8192, 24576, 24576]
    - [35, 1094460.0]
- null
- null
- DeviceEfficiency
- Equality
