library/src/amd_detail/rocblaslt/src/Tensile/Logic/asm_full/aquavanjaram/gfx942/Equality/aquavanjaram_Cijk_Ailk_Bljk_F8HS_BH_Bias_AS_SAV_UserArgs.yaml
- {MinimumRequiredVersion: 4.33.0}
- aquavanjaram
- gfx942
- [Device 0049, Device 0050]
    SolutionIndex: 0
    SolutionNameMin: Cijk_Ailk_Bljk_F8HS_BH_Bias_AS_SAV_UserArgs_MT16x64x64_MI16x16x1_SN_CLR1_GRVWA4_GRVWB8_GSU1_LBSPPA128_LBSPPB128_LPA16_LPB8_LRVW8_MIWT1_1_PLR1_SU4_SUM0_SUS256_SVW1_VWA1_WG16_16_1_WGM0
    SolutionIndex: 1
    SolutionNameMin: Cijk_Ailk_Bljk_F8HS_BH_Bias_AS_SAV_UserArgs_MT256x256x64_MI16x16x1_SN_CLR1_GRVWA16_GRVWB8_GSU1_LBSPPA2048_LBSPPB128_LPA0_LPB8_LRVW8_MIWT8_8_PLR1_SU4_SUM0_SUS256_SVW8_VWA8_WG32_8_1_WGM40
    SolutionIndex: 2
    SolutionNameMin: Cijk_Ailk_Bljk_F8HS_BH_Bias_AS_SAV_UserArgs_MT128x128x128_MI16x16x1_SN_CLR1_GRVWA16_GRVWB16_GSU1_LBSPPA2048_LBSPPB128_LPA64_LPB32_LRVW16_MIWT4_4_PLR1_SU8_SUM0_SUS256_SVW4_VWA4_WG32_8_1_WGM8
    SolutionIndex: 3
    SolutionNameMin: Cijk_Ailk_Bljk_F8HS_BH_Bias_AS_SAV_UserArgs_MT256x224x128_MI16x16x1_SN_CLR1_GRVWA16_GRVWB8_GSU1_LBSPPA2048_LBSPPB128_LPA64_LPB8_LRVW8_MIWT4_14_PLR1_SU0_SUM0_SUS0_SVW4_VWA4_WG64_4_1_WGM0
    SolutionIndex: 4
    SolutionNameMin: Cijk_Ailk_Bljk_F8HS_BH_Bias_AS_SAV_UserArgs_MT256x224x128_MI16x16x1_SN_CLR1_GRVWA16_GRVWB8_GSU1_LBSPPA2048_LBSPPB128_LPA64_LPB8_LRVW8_MIWT4_14_PLR1_SU0_SUM0_SUS0_SVW4_VWA4_WG64_4_1_WGM8
    SolutionIndex: 5
    SolutionNameMin: Cijk_Ailk_Bljk_F8HS_BH_Bias_AS_SAV_UserArgs_MT256x256x64_MI32x32x1_SN_GRVWB16_GSU1_GSUC0_GSUWGMRR0_K1_LBSPPA0_LBSPPB512_LPA0_LPB16_LRVW16_MIWT2_8_NLCA1_SU8_SUM0_SUS256_SVW2_VWA2_VWB8_WG128_2_1_WGM48_WGMXCC1_WGMXCCGn1
    SolutionIndex: 6
    SolutionNameMin: Cijk_Ailk_Bljk_F8HS_BH_Bias_AS_SAV_UserArgs_MT128x256x64_MI16x16x1_SN_GRVWB16_GSU1_GSUC0_GSUWGMRR0_K1_LBSPPA1024_LBSPPB512_LPA64_LPB16_LRVW8_MIAV0_MIWT4_8_NLCA1_SU8_SUM0_SUS256_SVW4_VWA4_VWB8_WG32_8_1_WGM16_WGMXCC1_WGMXCCGn1
    SolutionIndex: 7
    SolutionNameMin: Cijk_Ailk_Bljk_F8HS_BH_Bias_AS_SAV_UserArgs_MT256x176x64_MI16x16x1_SN_GRVWB4_GSU1_GSUC0_GSUWGMRR0_K1_LBSPPA2048_LBSPPB128_LPA64_LPB8_LRVW8_MIAV0_MIWT4_11_NLCA1_SU8_SUM0_SUS256_SVW4_VWA4_VWB1_WG64_4_1_WGM48_WGMXCC1_WGMXCCGn1
    SolutionIndex: 8
    SolutionNameMin: Cijk_Ailk_Bljk_F8HS_BH_Bias_AS_SAV_UserArgs_MT128x128x64_MI32x32x1_SN_GRVWB16_GSU1_GSUC0_GSUWGMRR0_K1_LBSPPA0_LBSPPB128_LPA0_LPB16_LRVW16_MIAV1_MIWT2_2_NLCA1_SU8_SUM0_SUS256_SVW2_VWA2_VWB2_WG64_4_1_WGM16_WGMXCC1_WGMXCCGn1
    SolutionIndex: 9
    SolutionNameMin: Cijk_Ailk_Bljk_F8HS_BH_Bias_AS_SAV_UserArgs_MT256x128x128_MI16x16x1_SN_GRVWB4_GSU1_GSUC0_GSUWGMRR0_K1_LBSPPA4096_LBSPPB1024_LPA64_LPB32_LRVW16_MIAV0_MIWT4_8_NLCA1_SU8_SUM0_SUS256_SVW4_VWA4_VWB8_WG64_4_1_WGM1_WGMXCC1_WGMXCCGn1
    SolutionIndex: 10
    SolutionNameMin: Cijk_Ailk_Bljk_F8HS_BH_Bias_AS_SAV_UserArgs_MT256x176x128_MI16x16x1_SN_GRVWB4_GSU1_GSUC0_GSUWGMRR0_K1_LBSPPA4096_LBSPPB128_LPA64_LPB32_LRVW16_MIAV0_MIWT4_11_NLCA1_SU8_SUM0_SUS256_SVW4_VWA4_VWB1_WG64_4_1_WGM16_WGMXCC1_WGMXCCGn1
    SolutionIndex: 11
    SolutionNameMin: Cijk_Ailk_Bljk_F8HS_BH_Bias_AS_SAV_UserArgs_MT128x224x128_MI16x16x1_SN_GRVWB16_GSU1_GSUC0_GSUWGMRR0_K1_LBSPPA2048_LBSPPB128_LPA64_LPB32_LRVW16_MIAV0_MIWT4_7_NLCA1_SU8_SUM0_SUS256_SVW4_VWA4_VWB1_WG32_8_1_WGM16_WGMXCC1_WGMXCCGn1
    SolutionIndex: 12
    SolutionNameMin: Cijk_Ailk_Bljk_F8HS_BH_Bias_AS_SAV_UserArgs_MT256x176x128_MI16x16x1_SN_GRVWB4_GSU3_GSUC0_GSUWGMRR0_K1_LBSPPA4096_LBSPPB128_LPA64_LPB32_LRVW16_MIAV0_MIWT4_11_NLCA1_SU8_SUM0_SUS256_SVW4_VWA4_VWB1_WG64_4_1_WGM16_WGMXCC1_WGMXCCGn1
    SolutionIndex: 13
    SolutionNameMin: Cijk_Ailk_Bljk_F8HS_BH_Bias_AS_SAV_UserArgs_MT256x224x128_MI16x16x1_SN_GRVWB16_GSU1_GSUC0_GSUWGMRR0_K1_LBSPPA2048_LBSPPB128_LPA0_LPB16_LRVW8_MIWT8_7_NLCA1_SU8_SUM0_SUS256_SVW8_VWA8_VWB1_WG32_8_1_WGM48_WGMXCC1_WGMXCCGn1
    SolutionIndex: 14
    SolutionNameMin: Cijk_Ailk_Bljk_F8HS_BH_Bias_AS_SAV_UserArgs_MT256x256x64_MI16x16x1_SN_GRVWB16_GSU1_GSUC0_GSUWGMRR0_K1_LBSPPA2048_LBSPPB512_LPA0_LPB16_LRVW8_MIWT8_8_NLCA1_SU8_SUM0_SUS256_SVW8_VWA8_VWB8_WG32_8_1_WGM48_WGMXCC1_WGMXCCGn1
    SolutionIndex: 15
    SolutionNameMin: Cijk_Ailk_Bljk_F8HS_BH_Bias_AS_SAV_UserArgs_MT256x112x128_MI16x16x1_SN_GRVWB4_GSU1_GSUC0_GSUWGMRR0_K1_LBSPPA4096_LBSPPB128_LPA64_LPB32_LRVW16_MIAV0_MIWT4_7_NLCA1_SU8_SUM0_SUS256_SVW4_VWA4_VWB1_WG64_4_1_WGM32_WGMXCC1_WGMXCCGn1
    SolutionIndex: 16
    SolutionNameMin: Cijk_Ailk_Bljk_F8HS_BH_Bias_AS_SAV_UserArgs_MT256x224x64_MI16x16x1_SN_GRVWB4_GSU1_GSUC0_GSUWGMRR0_K1_LBSPPA2048_LBSPPB128_LPA64_LPB8_LRVW8_MIAV0_MIWT4_14_NLCA1_SU8_SUM0_SUS256_SVW4_VWA4_VWB2_WG64_4_1_WGM16_WGMXCC1_WGMXCCGn1
    SolutionIndex: 17
    SolutionNameMin: Cijk_Ailk_Bljk_F8HS_BH_Bias_AS_SAV_UserArgs_MT128x48x128_MI16x16x1_SN_GRVWB4_GSU1_GSUC0_GSUWGMRR0_K1_LBSPPA2048_LBSPPB128_LPA32_LPB32_LRVW16_MIAV1_MIWT2_3_NTC0_NTD0_NLCA1_SU0_SUM0_SUS0_SVW2_VWA2_VWB1_WG64_4_1_WGM1_WGMXCC1_WGMXCCGn1
    SolutionIndex: 18
    SolutionNameMin: Cijk_Ailk_Bljk_F8HS_BH_Bias_AS_SAV_UserArgs_MT256x192x128_MI32x32x1_SN_GRVWB16_GSU1_GSUC0_GSUWGMRR0_K1_LBSPPA0_LBSPPB256_LPA0_LPB16_LRVW16_MIAV0_MIWT2_6_NLCA1_SU8_SUM0_SUS256_SVW2_VWA2_VWB2_WG128_2_1_WGM1_WGMXCC1_WGMXCCGn1
    SolutionIndex: 19
    SolutionNameMin: Cijk_Ailk_Bljk_F8HS_BH_Bias_AS_SAV_UserArgs_MT128x32x128_MI16x16x1_SN_CLR1_GRVWB16_GSU1_GSUC0_GSUWGMRR0_K1_LBSPPA2048_LBSPPB256_LPA64_LPB32_LRVW16_MIWT4_2_NTC3_NTD3_NLCA1_PLR1_SU0_SUM0_SUS0_SVW4_VWA4_VWB2_WG32_4_2_WGM1_WGMXCC1_WGMXCCGn1
    SolutionIndex: 20
    SolutionNameMin: Cijk_Ailk_Bljk_F8HS_BH_Bias_AS_SAV_UserArgs_MT64x64x128_MI16x16x1_SN_CLR1_GRVWB16_GSU1_GSUC0_GSUWGMRR0_K1_LBSPPA1024_LBSPPB512_LPA32_LPB32_LRVW16_MIAV1_MIWT2_4_NTC0_NTD0_NLCA1_PLR1_SU0_SUM0_SUS0_SVW2_VWA2_VWB4_WG32_4_2_WGM1_WGMXCC1_WGMXCCGn1
    SolutionIndex: 21
    SolutionNameMin: Cijk_Ailk_Bljk_F8HS_BH_Bias_AS_SAV_UserArgs_MT256x176x64_MI16x16x1_SN_GRVWB4_GSU1_GSUC0_GSUWGMRR0_K1_LBSPPA2048_LBSPPB128_LPA64_LPB8_LRVW8_MIAV0_MIWT4_11_NLCA1_SU8_SUM0_SUS256_SVW4_VWA4_VWB1_WG64_4_1_WGMn16_WGMXCC1_WGMXCCGn1
    SolutionIndex: 22
    SolutionNameMin: Cijk_Ailk_Bljk_F8HS_BH_Bias_AS_SAV_UserArgs_MT256x224x128_MI16x16x1_SN_GRVWB16_GSU1_GSUC0_GSUWGMRR0_K1_LBSPPA4096_LBSPPB256_LPA64_LPB32_LRVW16_MIAV0_MIWT4_14_NLCA1_SU8_SUM0_SUS256_SVW4_VWA4_VWB2_WG64_4_1_WGM1_WGMXCC1_WGMXCCGn1
    SolutionIndex: 23
    SolutionNameMin: Cijk_Ailk_Bljk_F8HS_BH_Bias_AS_SAV_UserArgs_MT256x224x64_MI16x16x1_SN_GRVWB4_GSU1_GSUC0_GSUWGMRR0_K1_LBSPPA2048_LBSPPB128_LPA64_LPB8_LRVW8_MIAV0_MIWT4_14_NLCA1_SU8_SUM0_SUS256_SVW4_VWA4_VWB2_WG64_4_1_WGM32_WGMXCC1_WGMXCCGn1
    SolutionIndex: 24
    SolutionNameMin: Cijk_Ailk_Bljk_F8HS_BH_Bias_AS_SAV_UserArgs_MT256x176x64_MI16x16x1_SN_GRVWB4_GSU1_GSUC0_GSUWGMRR0_K1_LBSPPA2048_LBSPPB128_LPA64_LPB8_LRVW8_MIAV0_MIWT4_11_NLCA1_SU8_SUM0_SUS256_SVW4_VWA4_VWB1_WG64_4_1_WGM16_WGMXCC1_WGMXCCGn1
    SolutionIndex: 25
    SolutionNameMin: Cijk_Ailk_Bljk_F8HS_BH_Bias_AS_SAV_UserArgs_MT256x128x128_MI16x16x1_SN_CLR1_GRVWB16_GSU9_GSUC0_GSUWGMRR0_K1_LBSPPA4096_LBSPPB1024_LPA64_LPB32_LRVW16_MIAV0_MIWT4_8_NTC3_NTD3_NLCA1_PLR1_SU0_SUM0_SUS0_SVW4_VWA4_VWB8_WG64_4_1_WGM1_WGMXCC1_WGMXCCGn1
    SolutionIndex: 26
    SolutionNameMin: Cijk_Ailk_Bljk_F8HS_BH_Bias_AS_SAV_UserArgs_MT128x64x128_MI16x16x1_SN_GRVWB16_GSU1_GSUC0_GSUWGMRR0_K1_LBSPPA2048_LBSPPB512_LPA32_LPB32_LRVW16_MIAV1_MIWT2_4_NLCA1_SU8_SUM0_SUS256_SVW2_VWA2_VWB4_WG64_4_1_WGM1_WGMXCC1_WGMXCCGn1
    SolutionIndex: 27
    SolutionNameMin: Cijk_Ailk_Bljk_F8HS_BH_Bias_AS_SAV_UserArgs_MT256x192x64_MI32x32x1_SN_GRVWB16_GSU1_GSUC0_GSUWGMRR0_K1_LBSPPA0_LBSPPB128_LPA0_LPB16_LRVW16_MIWT2_6_NLCA1_SU8_SUM0_SUS256_SVW2_VWA2_VWB2_WG128_2_1_WGM48_WGMXCC1_WGMXCCGn1
    SolutionIndex: 28
    SolutionNameMin: Cijk_Ailk_Bljk_F8HS_BH_Bias_AS_SAV_UserArgs_MT256x224x128_MI16x16x1_SN_GRVWB16_GSU1_GSUC0_GSUWGMRR0_K1_LBSPPA4096_LBSPPB256_LPA64_LPB32_LRVW16_MIWT4_14_NLCA1_SU8_SUM0_SUS256_SVW4_VWA4_VWB2_WG64_4_1_WGM48_WGMXCC1_WGMXCCGn1
    SolutionIndex: 29
    SolutionNameMin: Cijk_Ailk_Bljk_F8HS_BH_Bias_AS_SAV_UserArgs_MT128x96x256_MI16x16x1_SN_GRVWB16_GSU1_GSUC0_GSUWGMRR0_K1_LBSPPA2048_LBSPPB256_LPA64_LPB32_LRVW16_MIAV1_MIWT4_3_NTC0_NTD0_NLCA1_SU0_SUM0_SUS0_SVW4_VWA4_VWB1_WG32_8_1_WGM1_WGMXCC1_WGMXCCGn1
    SolutionIndex: 30
    SolutionNameMin: Cijk_Ailk_Bljk_F8HS_BH_Bias_AS_SAV_UserArgs_MT128x288x128_MI16x16x1_SN_GRVWB4_GSU1_GSUC0_GSUWGMRR0_K1_LBSPPA2048_LBSPPB128_LPA64_LPB32_LRVW16_MIAV0_MIWT4_9_NLCA1_SU8_SUM0_SUS256_SVW4_VWA4_VWB1_WG32_8_1_WGM1_WGMXCC1_WGMXCCGn1
    SolutionIndex: 31
    SolutionNameMin: Cijk_Ailk_Bljk_F8HS_BH_Bias_AS_SAV_UserArgs_MT128x64x64_MI32x32x1_SN_GRVWB16_GSU1_GSUC0_GSUWGMRR0_K1_LBSPPA0_LBSPPB128_LPA0_LPB16_LRVW16_MIAV1_MIWT2_1_NLCA1_SU8_SUM0_SUS256_SVW2_VWA2_VWB1_WG64_4_1_WGM1_WGMXCC1_WGMXCCGn1
    SolutionIndex: 32
    SolutionNameMin: Cijk_Ailk_Bljk_F8HS_BH_Bias_AS_SAV_UserArgs_MT128x64x128_MI16x16x1_SN_GRVWB16_GSU1_GSUC0_GSUWGMRR0_K1_LBSPPA2048_LBSPPB512_LPA32_LPB32_LRVW16_MIAV1_MIWT2_4_NLCA1_SU8_SUM0_SUS256_SVW2_VWA2_VWB4_WG64_4_1_WGM16_WGMXCC1_WGMXCCGn1
    SolutionIndex: 33
    SolutionNameMin: Cijk_Ailk_Bljk_F8HS_BH_Bias_AS_SAV_UserArgs_MT256x176x64_MI16x16x1_SN_GRVWB4_GSU1_GSUC0_GSUWGMRR0_K1_LBSPPA2048_LBSPPB128_LPA64_LPB8_LRVW8_MIAV0_MIWT4_11_NLCA1_SU8_SUM0_SUS256_SVW4_VWA4_VWB1_WG64_4_1_WGM1_WGMXCC1_WGMXCCGn1
    SolutionIndex: 34
    SolutionNameMin: Cijk_Ailk_Bljk_F8HS_BH_Bias_AS_SAV_UserArgs_MT256x128x128_MI16x16x1_SN_GRVWB16_GSU3_GSUC0_GSUWGMRR0_K1_LBSPPA4096_LBSPPB1024_LPA64_LPB32_LRVW16_MIAV0_MIWT4_8_NTC3_NTD3_NLCA1_SU0_SUM0_SUS0_SVW4_VWA4_VWB8_WG64_4_1_WGM1_WGMXCC1_WGMXCCGn1
    SolutionIndex: 35
    SolutionNameMin: Cijk_Ailk_Bljk_F8HS_BH_Bias_AS_SAV_UserArgs_MT128x352x128_MI16x16x1_SN_GRVWB4_GSU1_GSUC0_GSUWGMRR0_K1_LBSPPA1024_LBSPPB128_LPA64_LPB8_LRVW8_MIAV0_MIWT4_11_NLCA1_SU8_SUM0_SUS256_SVW4_VWA4_VWB1_WG32_8_1_WGM1_WGMXCC1_WGMXCCGn1
    SolutionIndex: 36
    SolutionNameMin: Cijk_Ailk_Bljk_F8HS_BH_Bias_AS_SAV_UserArgs_MT256x128x128_MI16x16x1_SN_GRVWB16_GSU1_GSUC0_GSUWGMRR0_K1_LBSPPA4096_LBSPPB1024_LPA64_LPB32_LRVW16_MIAV0_MIWT4_8_NLCA1_SU8_SUM0_SUS256_SVW4_VWA4_VWB8_WG64_4_1_WGM16_WGMXCC1_WGMXCCGn1
    SolutionIndex: 37
    SolutionNameMin: Cijk_Ailk_Bljk_F8HS_BH_Bias_AS_SAV_UserArgs_MT256x128x64_MI16x16x1_SN_GRVWB16_GSU1_GSUC0_GSUWGMRR0_K1_LBSPPA2048_LBSPPB512_LPA64_LPB16_LRVW8_MIAV0_MIWT4_8_NLCA1_SU8_SUM0_SUS256_SVW4_VWA4_VWB8_WG64_4_1_WGM32_WGMXCC1_WGMXCCGn1
    SolutionIndex: 38
    SolutionNameMin: Cijk_Ailk_Bljk_F8HS_BH_Bias_AS_SAV_UserArgs_MT128x64x64_MI16x16x1_SN_GRVWB16_GSU1_GSUC0_GSUWGMRR0_K1_LBSPPA1024_LBSPPB128_LPA64_LPB16_LRVW8_MIAV1_MIWT4_2_NLCA1_SU8_SUM0_SUS256_SVW4_VWA4_VWB2_WG32_8_1_WGMn16_WGMXCC1_WGMXCCGn1
    SolutionIndex: 39
    SolutionNameMin: Cijk_Ailk_Bljk_F8HS_BH_Bias_AS_SAV_UserArgs_MT256x224x128_MI16x16x1_SN_GRVWB4_GSU1_GSUC0_GSUWGMRR0_K1_LBSPPA4096_LBSPPB256_LPA64_LPB32_LRVW16_MIAV0_MIWT4_14_NLCA1_SU8_SUM0_SUS256_SVW4_VWA4_VWB2_WG64_4_1_WGM1_WGMXCC1_WGMXCCGn1
    SolutionIndex: 40
    SolutionNameMin: Cijk_Ailk_Bljk_F8HS_BH_Bias_AS_SAV_UserArgs_MT256x256x64_MI16x16x1_SN_GRVWB4_GSU1_GSUC0_GSUWGMRR0_K1_LBSPPA2048_LBSPPB1024_LPA64_LPB8_LRVW8_MIWT4_16_NLCA1_SU8_SUM0_SUS256_SVW4_VWA4_VWB16_WG64_4_1_WGM48_WGMXCC1_WGMXCCGn1
    SolutionIndex: 41
    SolutionNameMin: Cijk_Ailk_Bljk_F8HS_BH_Bias_AS_SAV_UserArgs_MT128x64x64_MI16x16x1_SN_GRVWB16_GSU1_GSUC0_GSUWGMRR0_K1_LBSPPA1024_LBSPPB128_LPA64_LPB16_LRVW8_MIAV1_MIWT4_2_NLCA1_SU8_SUM0_SUS256_SVW4_VWA4_VWB2_WG32_8_1_WGM16_WGMXCC1_WGMXCCGn1
    SolutionIndex: 42
    SolutionNameMin: Cijk_Ailk_Bljk_F8HS_BH_Bias_AS_SAV_UserArgs_MT256x224x64_MI16x16x1_SN_GRVWB4_GSU2_GSUC0_GSUWGMRR0_K1_LBSPPA2048_LBSPPB128_LPA64_LPB8_LRVW8_MIAV0_MIWT4_14_NLCA1_SU8_SUM0_SUS256_SVW4_VWA4_VWB2_WG64_4_1_WGM16_WGMXCC1_WGMXCCGn1
    SolutionIndex: 43
    SolutionNameMin: Cijk_Ailk_Bljk_F8HS_BH_Bias_AS_SAV_UserArgs_MT128x128x128_MI16x16x1_SN_GRVWB16_GSU1_GSUC0_GSUWGMRR0_K1_LBSPPA2048_LBSPPB1024_LPA32_LPB32_LRVW16_MIAV1_MIWT2_8_NLCA1_SU8_SUM0_SUS256_SVW2_VWA2_VWB8_WG64_4_1_WGM32_WGMXCC1_WGMXCCGn1
    SolutionIndex: 44
    SolutionNameMin: Cijk_Ailk_Bljk_F8HS_BH_Bias_AS_SAV_UserArgs_MT256x176x64_MI16x16x1_SN_GRVWB4_GSU3_GSUC0_GSUWGMRR0_K1_LBSPPA2048_LBSPPB128_LPA64_LPB8_LRVW8_MIAV0_MIWT4_11_NLCA1_SU8_SUM0_SUS256_SVW4_VWA4_VWB1_WG64_4_1_WGM1_WGMXCC1_WGMXCCGn1
    SolutionIndex: 45
    SolutionNameMin: Cijk_Ailk_Bljk_F8HS_BH_Bias_AS_SAV_UserArgs_MT128x96x128_MI16x16x1_SN_GRVWB4_GSU1_GSUC0_GSUWGMRR0_K1_LBSPPA2048_LBSPPB128_LPA64_LPB32_LRVW16_MIAV1_MIWT4_3_NTC3_NTD3_NLCA1_SU0_SUM0_SUS0_SVW4_VWA4_VWB1_WG32_8_1_WGM1_WGMXCC1_WGMXCCGn1
    SolutionIndex: 46
    SolutionNameMin: Cijk_Ailk_Bljk_F8HS_BH_Bias_AS_SAV_UserArgs_MT256x192x128_MI32x32x1_SN_GRVWB16_GSU1_GSUC0_GSUWGMRR0_K1_LBSPPA0_LBSPPB256_LPA0_LPB16_LRVW16_MIAV0_MIWT2_6_NLCA1_SU8_SUM0_SUS256_SVW2_VWA2_VWB2_WG128_2_1_WGM48_WGMXCC1_WGMXCCGn1
    SolutionIndex: 47
    SolutionNameMin: Cijk_Ailk_Bljk_F8HS_BH_Bias_AS_SAV_UserArgs_MT128x256x128_MI16x16x1_SN_GRVWB16_GSU1_GSUC0_GSUWGMRR0_K1_LBSPPA2048_LBSPPB1024_LPA64_LPB32_LRVW16_MIAV0_MIWT4_8_NLCA1_SU8_SUM0_SUS256_SVW4_VWA4_VWB8_WG32_8_1_WGM1_WGMXCC1_WGMXCCGn1
    SolutionIndex: 48
    SolutionNameMin: Cijk_Ailk_Bljk_F8HS_BH_Bias_AS_SAV_UserArgs_MT256x224x128_MI16x16x1_SN_GRVWB16_GSU1_GSUC0_GSUWGMRR0_K1_LBSPPA4096_LBSPPB256_LPA64_LPB32_LRVW16_MIAV0_MIWT4_14_NLCA1_SU8_SUM0_SUS256_SVW4_VWA4_VWB2_WG64_4_1_WGM32_WGMXCC1_WGMXCCGn1
    SolutionIndex: 49
    SolutionNameMin: Cijk_Ailk_Bljk_F8HS_BH_Bias_AS_SAV_UserArgs_MT128x64x128_MI16x16x1_SN_GRVWB16_GSU1_GSUC0_GSUWGMRR0_K1_LBSPPA2048_LBSPPB512_LPA32_LPB32_LRVW16_MIAV1_MIWT2_4_NTC0_NTD0_NLCA1_SU0_SUM0_SUS0_SVW2_VWA2_VWB4_WG64_4_1_WGM1_WGMXCC1_WGMXCCGn1
    SolutionIndex: 50
    SolutionNameMin: Cijk_Ailk_Bljk_F8HS_BH_Bias_AS_SAV_UserArgs_MT256x64x64_MI32x32x1_SN_GRVWB16_GSU1_GSUC0_GSUWGMRR0_K1_LBSPPA0_LBSPPB128_LPA0_LPB16_LRVW16_MIAV1_MIWT4_1_NLCA1_SU8_SUM0_SUS256_SVW4_VWA4_VWB1_WG64_4_1_WGM1_WGMXCC1_WGMXCCGn1
    SolutionIndex: 51
    SolutionNameMin: Cijk_Ailk_Bljk_F8HS_BH_Bias_AS_SAV_UserArgs_MT128x64x128_MI16x16x1_SN_GRVWB4_GSU1_GSUC0_GSUWGMRR0_K1_LBSPPA2048_LBSPPB512_LPA32_LPB32_LRVW16_MIAV1_MIWT2_4_NLCA1_SU8_SUM0_SUS256_SVW2_VWA2_VWB4_WG64_4_1_WGM16_WGMXCC1_WGMXCCGn1
    SolutionIndex: 52
    SolutionNameMin: Cijk_Ailk_Bljk_F8HS_BH_Bias_AS_SAV_UserArgs_MT256x256x64_MI16x16x1_SN_GRVWB4_GSU2_GSUC0_GSUWGMRR0_K1_LBSPPA2048_LBSPPB1024_LPA64_LPB8_LRVW8_MIAV0_MIWT4_16_NLCA1_SU8_SUM0_SUS256_SVW4_VWA4_VWB16_WG64_4_1_WGM1_WGMXCC1_WGMXCCGn1
    SolutionIndex: 53
    SolutionNameMin: Cijk_Ailk_Bljk_F8HS_BH_Bias_AS_SAV_UserArgs_MT128x96x128_MI16x16x1_SN_GRVWB16_GSU1_GSUC0_GSUWGMRR0_K1_LBSPPA2048_LBSPPB256_LPA32_LPB32_LRVW16_MIAV1_MIWT2_6_NTC3_NTD3_NLCA1_SU0_SUM0_SUS0_SVW2_VWA2_VWB2_WG64_4_1_WGM1_WGMXCC1_WGMXCCGn1
    SolutionIndex: 54
    SolutionNameMin: Cijk_Ailk_Bljk_F8HS_BH_Bias_AS_SAV_UserArgs_MT256x128x64_MI16x16x1_SN_GRVWB16_GSU1_GSUC0_GSUWGMRR0_K1_LBSPPA2048_LBSPPB512_LPA64_LPB16_LRVW8_MIAV0_MIWT4_8_NLCA1_SU8_SUM0_SUS256_SVW4_VWA4_VWB8_WG64_4_1_WGM48_WGMXCC1_WGMXCCGn1
    SolutionIndex: 55
    SolutionNameMin: Cijk_Ailk_Bljk_F8HS_BH_Bias_AS_SAV_UserArgs_MT64x64x128_MI16x16x1_SN_CLR1_GRVWB16_GSU1_GSUC0_GSUWGMRR0_K1_LBSPPA1024_LBSPPB512_LPA32_LPB32_LRVW16_MIAV1_MIWT2_4_NTC3_NTD3_NLCA1_PLR1_SU0_SUM0_SUS0_SVW2_VWA2_VWB4_WG32_4_2_WGM1_WGMXCC1_WGMXCCGn1
    SolutionIndex: 56
    SolutionNameMin: Cijk_Ailk_Bljk_F8HS_BH_Bias_AS_SAV_UserArgs_MT256x128x128_MI16x16x1_SN_GRVWB4_GSU3_GSUC0_GSUWGMRR0_K1_LBSPPA4096_LBSPPB1024_LPA64_LPB32_LRVW16_MIAV0_MIWT4_8_NTC0_NTD0_NLCA1_SU0_SUM0_SUS0_SVW4_VWA4_VWB8_WG64_4_1_WGM1_WGMXCC1_WGMXCCGn1
- - - [512, 512, 1, 512]
    - [0, 0.0]
  - - [1024, 1024, 1, 1024]
    - [19, 0.0]
  - - [2048, 2048, 1, 2048]
    - [2, 0.0]
  - - [4096, 4096, 1, 4096]
    - [39, 0.0]
  - - [4096, 4096, 1, 8192]
    - [4, 0.0]
  - - [4864, 4096, 1, 8192]
    - [1, 0.0]
  - - [8192, 8192, 1, 8192]
    - [3, 0.0]
  - - [3072, 24576, 1, 4096]
    - [5, 0.0]
  - - [4096, 4096, 1, 1024]
    - [6, 0.0]
  - - [1024, 24576, 1, 4096]
    - [7, 0.0]
  - - [3072, 4096, 1, 1024]
    - [8, 0.0]
  - - [3072, 3072, 1, 3072]
    - [9, 0.0]
  - - [3072, 4096, 1, 4096]
    - [10, 0.0]
  - - [1024, 8192, 1, 4096]
    - [11, 0.0]
  - - [1024, 4096, 1, 24576]
    - [12, 0.0]
  - - [4096, 24576, 1, 1024]
    - [13, 0.0]
  - - [3072, 24576, 1, 1024]
    - [14, 0.0]
  - - [1024, 8192, 1, 3072]
    - [15, 0.0]
  - - [4096, 4096, 1, 24576]
    - [16, 0.0]
  - - [1024, 3072, 1, 3072]
    - [17, 0.0]
  - - [3072, 4096, 1, 24576]
    - [18, 0.0]
  - - [1024, 1024, 1, 3072]
    - [20, 0.0]
  - - [4096, 3072, 1, 4096]
    - [21, 0.0]
  - - [4096, 4096, 1, 3072]
    - [22, 0.0]
  - - [4096, 8192, 1, 3072]
    - [23, 0.0]
  - - [3072, 8192, 1, 3072]
    - [24, 0.0]
  - - [3072, 8192, 1, 4096]
    - [24, 0.0]
  - - [1024, 1024, 1, 24576]
    - [25, 0.0]
  - - [4096, 1024, 1, 3072]
    - [26, 0.0]
  - - [4096, 24576, 1, 3072]
    - [27, 0.0]
  - - [4096, 24576, 1, 24576]
    - [28, 0.0]
  - - [3072, 1024, 1, 4096]
    - [29, 0.0]
  - - [3072, 3072, 1, 4096]
    - [30, 0.0]
  - - [4096, 1024, 1, 1024]
    - [31, 0.0]
  - - [1024, 4096, 1, 3072]
    - [32, 0.0]
  - - [4096, 3072, 1, 24576]
    - [33, 0.0]
  - - [1024, 3072, 1, 4096]
    - [34, 0.0]
  - - [3072, 4096, 1, 3072]
    - [35, 0.0]
  - - [3072, 8192, 1, 1024]
    - [36, 0.0]
  - - [4096, 8192, 1, 1024]
    - [37, 0.0]
  - - [4096, 1024, 1, 4096]
    - [38, 0.0]
  - - [3072, 24576, 1, 24576]
    - [40, 0.0]
  - - [1024, 4096, 1, 1024]
    - [41, 0.0]
  - - [1024, 8192, 1, 24576]
    - [42, 0.0]
  - - [4096, 3072, 1, 3072]
    - [21, 0.0]
  - - [3072, 8192, 1, 24576]
    - [10, 0.0]
  - - [1024, 8192, 1, 1024]
    - [43, 0.0]
  - - [4096, 1024, 1, 24576]
    - [44, 0.0]
  - - [3072, 24576, 1, 3072]
    - [40, 0.0]
  - - [3072, 1024, 1, 1024]
    - [45, 0.0]
  - - [1024, 24576, 1, 24576]
    - [46, 0.0]
  - - [3072, 3072, 1, 1024]
    - [47, 0.0]
  - - [1024, 24576, 1, 3072]
    - [46, 0.0]
  - - [4096, 8192, 1, 4096]
    - [48, 0.0]
  - - [1024, 3072, 1, 1024]
    - [49, 0.0]
  - - [4096, 3072, 1, 1024]
    - [50, 0.0]
  - - [1024, 4096, 1, 4096]
    - [51, 0.0]
  - - [3072, 3072, 1, 24576]
    - [52, 0.0]
  - - [3072, 1024, 1, 3072]
    - [53, 0.0]
  - - [1024, 24576, 1, 1024]
    - [54, 0.0]
  - - [4096, 24576, 1, 4096]
    - [27, 0.0]
  - - [1024, 1024, 1, 4096]
    - [55, 0.0]
  - - [1024, 3072, 1, 24576]
    - [56, 0.0]
  - - [4096, 8192, 1, 24576]
    - [16, 0.0]
  - - [3072, 1024, 1, 24576]
    - [56, 0.0]
- null
- null
- DeviceEfficiency
- Equality
