library/src/amd_detail/rocblaslt/src/Tensile/Logic/asm_full/aquavanjaram/gfx942/Equality/aquavanjaram_Cijk_Alik_Bljk_HHS_BH_Bias_HAS_SAV_UserArgs.yaml
- {MinimumRequiredVersion: 4.33.0}
- aquavanjaram
- gfx942
- [Device 0049, Device 0050]
    SolutionIndex: 0
    SolutionNameMin: Cijk_Alik_Bljk_HHS_BH_Bias_HAS_SAV_UserArgs_MT32x32x32_MI16x16x1_SN_GRVWA4_GRVWB4_GSU1_GSUC1_GSUWGMRR1_K1_LPA4_LPB4_LRVW4_MIWT1_1_SU0_SUM0_SUS0_WG32_8_1_WGM8_WGMXCC1_WGMXCCGn1
    SolutionIndex: 1
    SolutionNameMin: Cijk_Alik_Bljk_HHS_BH_Bias_HAS_SAV_UserArgs_MT256x224x64_MI16x16x1_SN_GSU1_GSUC1_GSUWGMRR1_K1_MIWT8_7_SU8_SUM0_SUS256_SSO0_WGM16_WGMXCC4_WGMXCCGn1
    SolutionIndex: 2
    SolutionNameMin: Cijk_Alik_Bljk_HHS_BH_Bias_HAS_SAV_UserArgs_MT128x96x64_MI16x16x1_SN_GSU1_GSUC0_GSUWGMRR1_K1_LBSPPA512_LBSPPB128_LPA16_LPB16_MIWT4_3_NTD4_NEPBS16_SS1_SU8_SUM1_SUS128_SPO0_SSO0_SVW4_VWA4_VWB1_WG32_8_1_WGM0_WGMXCC1_WGMXCCGn1
    SolutionIndex: 3
    SolutionNameMin: Cijk_Alik_Bljk_HHS_BH_Bias_HAS_SAV_UserArgs_MT16x256x32_MI16x16x1_SN_GSU1_GSUC0_GSUWGMRR1_K1_MIWT1_4_SU0_SUM0_SUS0_WGM8_WGMXCC1_WGMXCCGn1
    SolutionIndex: 4
    SolutionNameMin: Cijk_Alik_Bljk_HHS_BH_Bias_HAS_SAV_UserArgs_MT96x64x128_MI16x16x1_SN_GSU1_GSUC0_GSUWGMRR1_K1_LBSPPA512_LBSPPB256_MIWT6_1_NTA0_NTD4_NEPBS0_SU0_SUM0_SUS0_SPO1_SSO0_SVW2_VWA2_VWB1_WG16_16_1_WGM8_WGMXCC1_WGMXCCGn1
    SolutionIndex: 5
    SolutionNameMin: Cijk_Alik_Bljk_HHS_BH_Bias_HAS_SAV_UserArgs_MT32x256x32_MI16x16x1_SN_CLR0_GRVWB4_GSU1_GSUC0_GSUWGMRR1_K1_LBSPPB256_LPA4_LPB4_LRVW4_MIWT2_4_NEPBS16_SU0_SUM0_SUS0_SVW2_VWA2_VWB4_WG16_16_1_WGM8_WGMXCC1_WGMXCCGn1
    SolutionIndex: 6
    SolutionNameMin: Cijk_Alik_Bljk_HHS_BH_Bias_HAS_SAV_UserArgs_MT32x32x128_MI16x16x1_SN_GSU1_GSUC0_GSUWGMRR0_K1_LPA16_LPB16_MIWT1_1_NEPBS16_SU8_SUM1_SUS512_WG32_8_1_WGM8_WGMXCC1_WGMXCCGn1
    SolutionIndex: 7
    SolutionNameMin: Cijk_Alik_Bljk_HHS_BH_Bias_HAS_SAV_UserArgs_MT32x48x256_MI16x16x1_SN_GSU1_GSUC0_GSUWGMRR0_K1_MIWT2_3_NTD0_SU0_SUM0_SUS0_WGM1_WGMXCC1_WGMXCCGn1
    SolutionIndex: 8
    SolutionNameMin: Cijk_Alik_Bljk_HHS_BH_Bias_HAS_SAV_UserArgs_MT16x256x32_MI16x16x1_SN_GSU1_GSUC0_GSUWGMRR0_K1_MIWT1_4_SU0_SUM0_SUS0_WGM8_WGMXCC1_WGMXCCGn1
    SolutionIndex: 9
    SolutionNameMin: Cijk_Alik_Bljk_HHS_BH_Bias_HAS_SAV_UserArgs_MT128x96x64_MI16x16x1_SN_GSU1_GSUC0_GSUWGMRR1_K1_LBSPPA512_LBSPPB128_LPA16_LPB16_MIWT4_3_NTD4_SU8_SUM0_SUS512_SPO1_SSO0_SVW4_VWA4_VWB1_WG32_8_1_WGM0_WGMXCC1_WGMXCCGn1
    SolutionIndex: 10
    SolutionNameMin: Cijk_Alik_Bljk_HHS_BH_Bias_HAS_SAV_UserArgs_MT32x32x128_MI16x16x1_SN_GSU1_GSUC0_GSUWGMRR0_K1_LPA16_LPB16_MIWT1_1_NEPBS16_SU8_SUM1_SUS256_WG32_8_1_WGM1_WGMXCC1_WGMXCCGn1
    SolutionIndex: 11
    SolutionNameMin: Cijk_Alik_Bljk_HHS_BH_Bias_HAS_SAV_UserArgs_MT32x64x64_MI16x16x1_SN_GSU1_GSUC0_GSUWGMRR1_K1_MIWT2_1_NEPBS16_SU0_SUM0_SUS0_WGM8_WGMXCC1_WGMXCCGn1
    SolutionIndex: 12
    SolutionNameMin: Cijk_Alik_Bljk_HHS_BH_Bias_HAS_SAV_UserArgs_MT128x256x64_MI16x16x1_SN_GSU1_GSUC0_GSUWGMRR0_K1_LBSPPA1024_LBSPPB512_MIWT8_4_NTD4_NEPBS0_SU0_SUM0_SUS0_SSO0_SVW8_VWA8_VWB4_WG16_16_1_WGM16_WGMXCC4_WGMXCCGn1
    SolutionIndex: 13
    SolutionNameMin: Cijk_Alik_Bljk_HHS_BH_Bias_HAS_SAV_UserArgs_MT64x32x128_MI16x16x1_SN_GSU1_GSUC0_GSUWGMRR1_K1_LBSPPB256_LPA16_LPB16_MIWT2_1_NTD3_NEPBS0_SU8_SUM0_SUS256_VWB1_WG32_8_1_WGM8_WGMXCC1_WGMXCCGn1
    SolutionIndex: 14
    SolutionNameMin: Cijk_Alik_Bljk_HHS_BH_Bias_HAS_SAV_UserArgs_MT16x64x32_MI16x16x1_SN_GSU1_GSUC0_GSUWGMRR0_K1_MIWT1_1_SU0_SUM0_SUS0_WGM8_WGMXCC1_WGMXCCGn1
    SolutionIndex: 15
    SolutionNameMin: Cijk_Alik_Bljk_HHS_BH_Bias_HAS_SAV_UserArgs_MT128x64x64_MI16x16x1_SN_GSU4_GSUC1_GSUWGMRR0_K1_LPA16_LPB16_MIWT4_2_NTD3_NEPBS0_SU0_SUM0_SUS0_SPO0_WG32_8_1_WGM8_WGMXCC1_WGMXCCGn1
    SolutionIndex: 16
    SolutionNameMin: Cijk_Alik_Bljk_HHS_BH_Bias_HAS_SAV_UserArgs_MT48x128x128_MI16x16x1_SN_GSU1_GSUC0_GSUWGMRR0_K1_MIWT3_2_NEPBS0_SU0_SUM0_SUS0_WGM8_WGMXCC1_WGMXCCGn1
    SolutionIndex: 17
    SolutionNameMin: Cijk_Alik_Bljk_HHS_BH_Bias_HAS_SAV_UserArgs_MT64x64x128_MI16x16x1_SN_GSU1_GSUC0_GSUWGMRR1_K1_LBSPPA512_MIWT2_2_NTD3_NEPBS0_SU0_SUM0_SUS0_SPO0_SVW2_VWA2_WG32_8_1_WGM8_WGMXCC1_WGMXCCGn1
    SolutionIndex: 18
    SolutionNameMin: Cijk_Alik_Bljk_HHS_BH_Bias_HAS_SAV_UserArgs_MT16x256x32_MI16x16x1_SN_GSU1_GSUC1_GSUWGMRR0_K1_MIWT1_4_SU0_SUM0_SUS0_WGM8_WGMXCC1_WGMXCCGn1
    SolutionIndex: 19
    SolutionNameMin: Cijk_Alik_Bljk_HHS_BH_Bias_HAS_SAV_UserArgs_MT64x64x128_MI16x16x1_SN_GSU1_GSUC0_GSUWGMRR1_K1_LBSPPA512_MIWT2_2_NTD3_NEPBS0_SU8_SUM1_SUS512_SPO0_SVW2_VWA2_WG32_8_1_WGM8_WGMXCC1_WGMXCCGn1
    SolutionIndex: 20
    SolutionNameMin: Cijk_Alik_Bljk_HHS_BH_Bias_HAS_SAV_UserArgs_MT64x64x128_MI16x16x1_SN_GSU1_GSUC0_GSUWGMRR0_K1_LBSPPA512_MIWT2_2_NTD3_NEPBS16_SU8_SUM1_SUS512_SPO0_SVW2_VWA2_WG32_8_1_WGM8_WGMXCC1_WGMXCCGn1
    SolutionIndex: 21
    SolutionNameMin: Cijk_Alik_Bljk_HHS_BH_Bias_HAS_SAV_UserArgs_MT128x128x64_MI16x16x1_SN_GSU1_GSUC1_GSUWGMRR0_K1_MIWT4_4_NTD3_NEPBS16_SU8_SUM0_SUS128_SPO0_SSO0_WGM4_WGMXCC1_WGMXCCGn1
    SolutionIndex: 22
    SolutionNameMin: Cijk_Alik_Bljk_HHS_BH_Bias_HAS_SAV_UserArgs_MT256x128x64_MI16x16x1_SN_GSU1_GSUC1_GSUWGMRR1_K1_MIWT8_4_NTD4_NEPBS16_SU8_SUM0_SUS256_SSO0_WGM1_WGMXCC4_WGMXCCGn1
    SolutionIndex: 23
    SolutionNameMin: Cijk_Alik_Bljk_HHS_BH_Bias_HAS_SAV_UserArgs_MT128x128x64_MI16x16x1_SN_GSU1_GSUC0_GSUWGMRR1_K1_MIWT4_4_NTD0_NEPBS16_SU8_SUM0_SUS256_SPO0_SSO0_WGM4_WGMXCC1_WGMXCCGn1
    SolutionIndex: 24
    SolutionNameMin: Cijk_Alik_Bljk_HHS_BH_Bias_HAS_SAV_UserArgs_MT96x128x64_MI16x16x1_SN_GSU1_GSUC0_GSUWGMRR1_K1_LBSPPA128_LBSPPB512_LPA16_LPB16_MIWT3_4_NTA0_NTD4_NEPBS0_SU8_SUM0_SUS128_SPO0_SSO0_SVW1_VWA1_VWB4_WG32_8_1_WGM8_WGMXCC1_WGMXCCGn1
    SolutionIndex: 25
    SolutionNameMin: Cijk_Alik_Bljk_HHS_BH_Bias_HAS_SAV_UserArgs_MT32x64x128_MI16x16x1_SN_GSU1_GSUC0_GSUWGMRR0_K1_MIWT2_1_SU0_SUM0_SUS0_WGM8_WGMXCC1_WGMXCCGn1
    SolutionIndex: 26
    SolutionNameMin: Cijk_Alik_Bljk_HHS_BH_Bias_HAS_SAV_UserArgs_MT64x32x128_MI16x16x1_SN_GSU1_GSUC0_GSUWGMRR1_K1_LBSPPB256_LPA16_LPB16_MIWT2_1_NTD0_NEPBS16_SU8_SUM0_SUS256_VWB1_WG32_8_1_WGM8_WGMXCC1_WGMXCCGn1
    SolutionIndex: 27
    SolutionNameMin: Cijk_Alik_Bljk_HHS_BH_Bias_HAS_SAV_UserArgs_MT128x64x128_MI16x16x1_SN_GSU1_GSUC1_GSUWGMRR1_K1_LBSPPB512_MIWT4_2_NTD4_NEPBS0_SU8_SUM0_SUS256_SPO1_SSO0_VWB2_WG32_8_1_WGM1_WGMXCC1_WGMXCCGn1
    SolutionIndex: 28
    SolutionNameMin: Cijk_Alik_Bljk_HHS_BH_Bias_HAS_SAV_UserArgs_MT96x128x64_MI16x16x1_SN_GSU1_GSUC0_GSUWGMRR1_K1_LBSPPA256_LBSPPB256_LPA16_LPB16_MIWT6_2_NTD4_NEPBS0_SU0_SUM0_SUS0_SPO0_SVW2_VWA2_VWB2_WG16_16_1_WGM8_WGMXCC1_WGMXCCGn1
    SolutionIndex: 29
    SolutionNameMin: Cijk_Alik_Bljk_HHS_BH_Bias_HAS_SAV_UserArgs_MT64x16x128_MI16x16x1_SN_LDSB0_GSU1_GSUC0_GSUWGMRR1_K1_LBSPPA256_MIWT1_1_NTD0_NEPBS0_SS1_SU0_SUM0_SUS0_SPO0_SVW1_VWA1_WG64_4_1_WGM0_WGMXCC1_WGMXCCGn1
    SolutionIndex: 30
    SolutionNameMin: Cijk_Alik_Bljk_HHS_BH_Bias_HAS_SAV_UserArgs_MT256x160x64_MI16x16x1_SN_GSU1_GSUC1_GSUWGMRR1_K1_MIWT8_5_NTD4_NEPBS0_SU8_SUM0_SUS256_SSO4_WGM1_WGMXCC1_WGMXCCGn1
    SolutionIndex: 31
    SolutionNameMin: Cijk_Alik_Bljk_HHS_BH_Bias_HAS_SAV_UserArgs_MT128x256x64_MI16x16x1_SN_GSU1_GSUC0_GSUWGMRR0_K1_LBSPPA1024_LBSPPB512_MIWT8_4_NTD4_NEPBS16_SU8_SUM0_SUS256_SPO1_SSO0_SVW8_VWA8_VWB4_WG16_16_1_WGM0_WGMXCC1_WGMXCCGn1
    SolutionIndex: 32
    SolutionNameMin: Cijk_Alik_Bljk_HHS_BH_Bias_HAS_SAV_UserArgs_MT64x128x128_MI16x16x1_SN_GSU1_GSUC0_GSUWGMRR0_K1_LBSPPA1024_LBSPPB512_LPA16_LPB16_MIWT4_2_NTD4_SU0_SUM0_SUS0_SPO0_SVW4_VWA4_VWB2_WG16_16_1_WGM8_WGMXCC1_WGMXCCGn1
    SolutionIndex: 33
    SolutionNameMin: Cijk_Alik_Bljk_HHS_BH_Bias_HAS_SAV_UserArgs_MT64x64x128_MI16x16x1_SN_GSU1_GSUC0_GSUWGMRR0_K1_LBSPPA1024_MIWT4_2_NTD4_NEPBS16_SU8_SUM0_SUS256_SPO1_SSO4_SVW4_VWA4_WG16_8_1_WGM8_WGMXCC1_WGMXCCGn1
    SolutionIndex: 34
    SolutionNameMin: Cijk_Alik_Bljk_HHS_BH_Bias_HAS_SAV_UserArgs_MT80x128x64_MI16x16x1_SN_GSU11_GSUC0_GSUWGMRR1_K1_MIWT5_2_SU0_SUM0_SUS0_WGM8_WGMXCC1_WGMXCCGn1
    SolutionIndex: 35
    SolutionNameMin: Cijk_Alik_Bljk_HHS_BH_Bias_HAS_SAV_UserArgs_MT64x192x32_MI16x16x1_SN_CLR0_GRVWA4_GRVWB4_GSU1_GSUC0_GSUWGMRR0_K1_LPA4_LPB4_LRVW4_MIWT2_6_NEPBS16_SU0_SUM0_SUS0_SVW2_VWA2_VWB2_WG32_8_1_WGM8_WGMXCC1_WGMXCCGn1
    SolutionIndex: 36
    SolutionNameMin: Cijk_Alik_Bljk_HHS_BH_Bias_HAS_SAV_UserArgs_MT96x128x64_MI16x16x1_SN_GSU1_GSUC0_GSUWGMRR0_K1_LBSPPA256_LBSPPB256_LPA16_LPB16_MIWT6_2_NTD4_NEPBS0_SU8_SUM0_SUS128_SPO1_SVW2_VWA2_VWB2_WG16_16_1_WGM8_WGMXCC1_WGMXCCGn1
    SolutionIndex: 37
    SolutionNameMin: Cijk_Alik_Bljk_HHS_BH_Bias_HAS_SAV_UserArgs_MT128x128x64_MI16x16x1_SN_GSU1_GSUC1_GSUWGMRR1_K1_MIWT4_4_NTD0_NEPBS16_SU0_SUM0_SUS0_SPO0_WGM4_WGMXCC1_WGMXCCGn1
    SolutionIndex: 38
    SolutionNameMin: Cijk_Alik_Bljk_HHS_BH_Bias_HAS_SAV_UserArgs_MT48x256x32_MI16x16x1_SN_GSU1_GSUC0_GSUWGMRR0_K1_MIWT3_4_SU0_SUM0_SUS0_WGM8_WGMXCC1_WGMXCCGn1
    SolutionIndex: 39
    SolutionNameMin: Cijk_Alik_Bljk_HHS_BH_Bias_HAS_SAV_UserArgs_MT128x96x64_MI16x16x1_SN_GSU1_GSUC0_GSUWGMRR0_K1_LBSPPA512_LBSPPB128_LPA16_LPB16_MIWT4_3_NTD4_NEPBS16_SS1_SU0_SUM0_SUS0_SPO1_SSO4_SVW4_VWA4_VWB1_WG32_8_1_WGM0_WGMXCC1_WGMXCCGn1
    SolutionIndex: 40
    SolutionNameMin: Cijk_Alik_Bljk_HHS_BH_Bias_HAS_SAV_UserArgs_MT128x128x64_MI16x16x1_SN_GSU1_GSUC0_GSUWGMRR1_K1_MIWT4_4_NTD4_NEPBS16_SU8_SUM0_SUS128_SPO1_WGM1_WGMXCC1_WGMXCCGn1
    SolutionIndex: 41
    SolutionNameMin: Cijk_Alik_Bljk_HHS_BH_Bias_HAS_SAV_UserArgs_MT64x32x128_MI16x16x1_SN_GSU1_GSUC0_GSUWGMRR1_K1_LBSPPB256_LPA16_LPB16_MIWT2_1_NTD0_NEPBS16_SU8_SUM1_SUS512_VWB1_WG32_8_1_WGM8_WGMXCC1_WGMXCCGn1
    SolutionIndex: 42
    SolutionNameMin: Cijk_Alik_Bljk_HHS_BH_Bias_HAS_SAV_UserArgs_MT128x160x32_MI32x32x1_SN_CLR1_GRVWA8_GSU1_GSUC0_GSUWGMRR0_K1_LPA8_LPB8_LRVW8_MIWT1_5_NEPBS16_SU0_SUM0_SUS0_SVW1_VWA1_VWB1_WG128_2_1_WGM8_WGMXCC1_WGMXCCGn1
    SolutionIndex: 43
    SolutionNameMin: Cijk_Alik_Bljk_HHS_BH_Bias_HAS_SAV_UserArgs_MT128x128x64_MI16x16x1_SN_GSU3_GSUC0_GSUWGMRR1_K1_MIWT4_4_SU8_SUM1_SUS128_SPO1_SSO4_WGM8_WGMXCC1_WGMXCCGn1
    SolutionIndex: 44
    SolutionNameMin: Cijk_Alik_Bljk_HHS_BH_Bias_HAS_SAV_UserArgs_MT128x192x64_MI16x16x1_SN_GSU1_GSUC1_GSUWGMRR1_K1_LBSPPA512_LBSPPB256_MIWT4_6_NTD4_SU0_SUM0_SUS0_SPO1_SSO0_SVW4_VWA4_VWB2_WG32_8_1_WGM1_WGMXCC1_WGMXCCGn1
    SolutionIndex: 45
    SolutionNameMin: Cijk_Alik_Bljk_HHS_BH_Bias_HAS_SAV_UserArgs_MT144x128x32_MI16x16x1_SN_GSU1_GSUC0_GSUWGMRR0_K1_MIWT9_2_SU0_SUM0_SUS0_WGM8_WGMXCC1_WGMXCCGn1
    SolutionIndex: 46
    SolutionNameMin: Cijk_Alik_Bljk_HHS_BH_Bias_HAS_SAV_UserArgs_MT128x192x64_MI16x16x1_SN_GSU1_GSUC0_GSUWGMRR0_K1_MIWT4_6_NTD4_NEPBS16_SU8_SUM0_SUS128_SPO0_SSO0_WGM0_WGMXCC1_WGMXCCGn1
    SolutionIndex: 47
    SolutionNameMin: Cijk_Alik_Bljk_HHS_BH_Bias_HAS_SAV_UserArgs_MT64x64x128_MI16x16x1_SN_GSU1_GSUC0_GSUWGMRR1_K1_LBSPPA512_MIWT2_2_NTD3_NEPBS16_SU8_SUM0_SUS512_SPO1_SVW2_VWA2_WG32_8_1_WGM4_WGMXCC1_WGMXCCGn1
    SolutionIndex: 48
    SolutionNameMin: Cijk_Alik_Bljk_HHS_BH_Bias_HAS_SAV_UserArgs_MT208x192x64_MI16x16x1_SN_GSU1_GSUC0_GSUWGMRR1_K1_MIWT13_3_NEPBS0_SU8_SUM0_SUS128_SPO0_WGM1_WGMXCC1_WGMXCCGn1
    SolutionIndex: 49
    SolutionNameMin: Cijk_Alik_Bljk_HHS_BH_Bias_HAS_SAV_UserArgs_MT256x128x64_MI16x16x1_SN_GSU1_GSUC1_GSUWGMRR1_K1_MIWT8_4_NTD4_NEPBS0_SU8_SUM0_SUS256_SSO0_WGM16_WGMXCC1_WGMXCCGn1
    SolutionIndex: 50
    SolutionNameMin: Cijk_Alik_Bljk_HHS_BH_Bias_HAS_SAV_UserArgs_MT32x32x128_MI16x16x1_SN_GSU1_GSUC0_GSUWGMRR1_K1_LPA16_LPB16_MIWT1_1_NEPBS0_SU8_SUM0_SUS256_WG32_8_1_WGM8_WGMXCC1_WGMXCCGn1
    SolutionIndex: 51
    SolutionNameMin: Cijk_Alik_Bljk_HHS_BH_Bias_HAS_SAV_UserArgs_MT96x64x64_MI16x16x1_SN_GSU1_GSUC0_GSUWGMRR0_K1_MIWT6_1_NEPBS16_SU0_SUM0_SUS0_WGM8_WGMXCC1_WGMXCCGn1
    SolutionIndex: 52
    SolutionNameMin: Cijk_Alik_Bljk_HHS_BH_Bias_HAS_SAV_UserArgs_MT48x256x32_MI16x16x1_SN_GSU1_GSUC0_GSUWGMRR1_K1_MIWT3_4_SU0_SUM0_SUS0_WGM8_WGMXCC1_WGMXCCGn1
    SolutionIndex: 53
    SolutionNameMin: Cijk_Alik_Bljk_HHS_BH_Bias_HAS_SAV_UserArgs_MT16x64x32_MI16x16x1_SN_GSU1_GSUC0_GSUWGMRR1_K1_MIWT1_1_SU0_SUM0_SUS0_WGM8_WGMXCC1_WGMXCCGn1
    SolutionIndex: 54
    SolutionNameMin: Cijk_Alik_Bljk_HHS_BH_Bias_HAS_SAV_UserArgs_MT64x64x64_MI16x16x1_SN_LDSB1_GRVWA8_GRVWB8_GSU1_GSUC0_GSUWGMRR0_K1_LBSPPA512_LBSPPB128_LPA16_LPB16_MIWT4_1_NTD3_NEPBS0_SS1_SU0_SUM0_SUS0_SVW4_VWA4_VWB1_WG16_16_1_WGM0_WGMXCC1_WGMXCCGn1
    SolutionIndex: 55
    SolutionNameMin: Cijk_Alik_Bljk_HHS_BH_Bias_HAS_SAV_UserArgs_MT80x256x32_MI16x16x1_SN_GSU1_GSUC1_GSUWGMRR1_K1_MIWT5_4_SU0_SUM0_SUS0_WGM8_WGMXCC1_WGMXCCGn1
    SolutionIndex: 56
    SolutionNameMin: Cijk_Alik_Bljk_HHS_BH_Bias_HAS_SAV_UserArgs_MT32x64x128_MI16x16x1_SN_GSU1_GSUC0_GSUWGMRR1_K1_MIWT2_1_SU8_SUM1_SUS512_WGM8_WGMXCC1_WGMXCCGn1
    SolutionIndex: 57
    SolutionNameMin: Cijk_Alik_Bljk_HHS_BH_Bias_HAS_SAV_UserArgs_MT160x128x64_MI16x16x1_SN_GSU1_GSUC1_GSUWGMRR1_K1_LBSPPA256_LBSPPB256_MIWT10_2_NTD4_NEPBS0_SU0_SUM0_SUS0_SPO1_SSO0_SVW2_VWA2_VWB2_WG16_16_1_WGM1_WGMXCC1_WGMXCCGn1
    SolutionIndex: 58
    SolutionNameMin: Cijk_Alik_Bljk_HHS_BH_Bias_HAS_SAV_UserArgs_MT128x128x64_MI16x16x1_SN_GSU1_GSUC0_GSUWGMRR1_K1_LBSPPA512_LBSPPB512_MIWT4_4_NTD4_NEPBS0_SU0_SUM0_SUS0_SPO1_SSO0_SVW4_VWA4_VWB4_WG32_8_1_WGM8_WGMXCC1_WGMXCCGn1
    SolutionIndex: 59
    SolutionNameMin: Cijk_Alik_Bljk_HHS_BH_Bias_HAS_SAV_UserArgs_MT64x16x32_MI16x16x1_SN_GSU1_GSUC0_GSUWGMRR0_K1_MIWT1_1_SU0_SUM0_SUS0_WGM8_WGMXCC1_WGMXCCGn1
    SolutionIndex: 60
    SolutionNameMin: Cijk_Alik_Bljk_HHS_BH_Bias_HAS_SAV_UserArgs_MT112x256x32_MI16x16x1_SN_GSU1_GSUC0_GSUWGMRR0_K1_MIWT7_4_SU0_SUM0_SUS0_WGM8_WGMXCC1_WGMXCCGn1
    SolutionIndex: 61
    SolutionNameMin: Cijk_Alik_Bljk_HHS_BH_Bias_HAS_SAV_UserArgs_MT192x128x64_MI16x16x1_SN_GSU1_GSUC1_GSUWGMRR0_K1_LBSPPA256_LBSPPB512_MIWT6_4_NTA0_NTD4_NEPBS16_SU8_SUM0_SUS256_SPO0_SSO0_SVW2_VWA2_VWB4_WG32_8_1_WGM4_WGMXCC1_WGMXCCGn1
    SolutionIndex: 62
    SolutionNameMin: Cijk_Alik_Bljk_HHS_BH_Bias_HAS_SAV_UserArgs_MT128x64x128_MI16x16x1_SN_GSU4_GSUC1_GSUWGMRR0_K1_LBSPPB512_MIWT4_2_NTD3_NEPBS16_SU8_SUM0_SUS256_SPO1_VWB2_WG32_8_1_WGM40_WGMXCC1_WGMXCCGn1
    SolutionIndex: 63
    SolutionNameMin: Cijk_Alik_Bljk_HHS_BH_Bias_HAS_SAV_UserArgs_MT64x128x128_MI16x16x1_SN_GSU1_GSUC0_GSUWGMRR0_K1_LBSPPB512_MIWT4_2_NTD3_NEPBS0_SU8_SUM0_SUS512_SPO1_SSO0_VWB2_WG16_16_1_WGM8_WGMXCC1_WGMXCCGn1
    SolutionIndex: 64
    SolutionNameMin: Cijk_Alik_Bljk_HHS_BH_Bias_HAS_SAV_UserArgs_MT64x64x128_MI16x16x1_SN_GSU1_GSUC0_GSUWGMRR0_K1_LBSPPA512_MIWT2_2_NTD3_NEPBS16_SU8_SUM0_SUS512_SPO0_SSO0_SVW2_VWA2_WG32_8_1_WGM8_WGMXCC1_WGMXCCGn1
    SolutionIndex: 65
    SolutionNameMin: Cijk_Alik_Bljk_HHS_BH_Bias_HAS_SAV_UserArgs_MT32x32x128_MI16x16x1_SN_GSU1_GSUC0_GSUWGMRR1_K1_LPA16_LPB16_MIWT1_1_NEPBS16_SU8_SUM1_SUS256_WG32_8_1_WGM8_WGMXCC1_WGMXCCGn1
    SolutionIndex: 66
    SolutionNameMin: Cijk_Alik_Bljk_HHS_BH_Bias_HAS_SAV_UserArgs_MT32x16x128_MI16x16x1_SN_LDSB0_GSU1_GSUC0_GSUWGMRR0_K1_MIWT1_1_NTD0_NEPBS0_SU8_SUM1_SUS512_WGM8_WGMXCC1_WGMXCCGn1
    SolutionIndex: 67
    SolutionNameMin: Cijk_Alik_Bljk_HHS_BH_Bias_HAS_SAV_UserArgs_MT64x128x64_MI16x16x1_SN_GSU13_GSUC0_GSUWGMRR1_K1_MIWT4_2_SU0_SUM0_SUS0_WGM8_WGMXCC1_WGMXCCGn1
    SolutionIndex: 68
    SolutionNameMin: Cijk_Alik_Bljk_HHS_BH_Bias_HAS_SAV_UserArgs_MT192x192x64_MI16x16x1_SN_GSU1_GSUC0_GSUWGMRR0_K1_LBSPPA512_LBSPPB128_MIWT12_3_NTD4_NEPBS0_SU0_SUM0_SUS0_SPO0_SSO4_SVW4_VWA4_VWB1_WG16_16_1_WGM16_WGMXCC4_WGMXCCGn1
    SolutionIndex: 69
    SolutionNameMin: Cijk_Alik_Bljk_HHS_BH_Bias_HAS_SAV_UserArgs_MT128x128x64_MI16x16x1_SN_GSU1_GSUC0_GSUWGMRR0_K1_MIWT4_4_NTD4_NEPBS0_SU8_SUM1_SUS512_SPO1_SSO0_WGM8_WGMXCC1_WGMXCCGn1
    SolutionIndex: 70
    SolutionNameMin: Cijk_Alik_Bljk_HHS_BH_Bias_HAS_SAV_UserArgs_MT128x128x64_MI16x16x1_SN_GSU1_GSUC0_GSUWGMRR0_K1_MIWT4_4_NTD3_NEPBS16_SU8_SUM0_SUS128_SPO1_WGM1_WGMXCC1_WGMXCCGn1
    SolutionIndex: 71
    SolutionNameMin: Cijk_Alik_Bljk_HHS_BH_Bias_HAS_SAV_UserArgs_MT160x160x64_MI16x16x1_SN_GSU1_GSUC1_GSUWGMRR1_K1_MIWT5_5_NTD4_NEPBS0_SU0_SUM0_SUS0_SPO1_WGM1_WGMXCC1_WGMXCCGn1
    SolutionIndex: 72
    SolutionNameMin: Cijk_Alik_Bljk_HHS_BH_Bias_HAS_SAV_UserArgs_MT128x128x64_MI16x16x1_SN_GSU1_GSUC0_GSUWGMRR1_K1_MIWT4_4_NTD4_NEPBS16_SU8_SUM0_SUS128_SPO0_SSO0_WGM4_WGMXCC1_WGMXCCGn1
    SolutionIndex: 73
    SolutionNameMin: Cijk_Alik_Bljk_HHS_BH_Bias_HAS_SAV_UserArgs_MT64x224x32_MI16x16x1_SN_GRVWA4_GRVWB4_GSU1_GSUC0_GSUWGMRR1_K1_LPA4_LPB4_LRVW4_MIWT2_7_SU0_SUM0_SUS0_WG32_8_1_WGM8_WGMXCC1_WGMXCCGn1
    SolutionIndex: 74
    SolutionNameMin: Cijk_Alik_Bljk_HHS_BH_Bias_HAS_SAV_UserArgs_MT48x192x128_MI16x16x1_SN_CLR1_GSU1_GSUC0_GSUWGMRR1_K1_MIWT3_3_NEPBS0_SU0_SUM0_SUS0_WGM8_WGMXCC1_WGMXCCGn1
    SolutionIndex: 75
    SolutionNameMin: Cijk_Alik_Bljk_HHS_BH_Bias_HAS_SAV_UserArgs_MT192x224x32_MI16x16x1_SN_GSU1_GSUC1_GSUWGMRR0_K1_MIWT3_14_SU0_SUM0_SUS0_WGM8_WGMXCC1_WGMXCCGn1
    SolutionIndex: 76
    SolutionNameMin: Cijk_Alik_Bljk_HHS_BH_Bias_HAS_SAV_UserArgs_MT160x128x64_MI16x16x1_SN_GSU1_GSUC0_GSUWGMRR1_K1_MIWT5_4_NTD4_NEPBS0_SU0_SUM0_SUS0_SPO0_SSO4_WGM1_WGMXCC1_WGMXCCGn1
    SolutionIndex: 77
    SolutionNameMin: Cijk_Alik_Bljk_HHS_BH_Bias_HAS_SAV_UserArgs_MT64x128x128_MI16x16x1_SN_GSU1_GSUC1_GSUWGMRR0_K1_LBSPPB512_MIWT4_2_NTD4_NEPBS0_SU8_SUM0_SUS512_SPO0_SSO4_VWB2_WG16_16_1_WGM8_WGMXCC1_WGMXCCGn1
    SolutionIndex: 78
    SolutionNameMin: Cijk_Alik_Bljk_HHS_BH_Bias_HAS_SAV_UserArgs_MT128x96x64_MI16x16x1_SN_GSU1_GSUC0_GSUWGMRR1_K1_LBSPPA512_LBSPPB128_LPA16_LPB16_MIWT4_3_NTD4_SU8_SUM1_SUS128_SPO1_SSO0_SVW4_VWA4_VWB1_WG32_8_1_WGM0_WGMXCC1_WGMXCCG0
    SolutionIndex: 79
    SolutionNameMin: Cijk_Alik_Bljk_HHS_BH_Bias_HAS_SAV_UserArgs_MT32x32x128_MI16x16x1_SN_GSU1_GSUC0_GSUWGMRR0_K1_LPA16_LPB16_MIWT1_1_NEPBS0_SU8_SUM1_SUS512_WG32_8_1_WGM8_WGMXCC1_WGMXCCGn1
    SolutionIndex: 80
    SolutionNameMin: Cijk_Alik_Bljk_HHS_BH_Bias_HAS_SAV_UserArgs_MT192x256x64_MI16x16x1_SN_GSU4_GSUC1_GSUWGMRR1_K1_LBSPPA256_LBSPPB1024_MIWT6_8_NTD0_SU0_SUM0_SUS0_SPO1_SVW2_VWA2_VWB8_WG32_8_1_WGM8_WGMXCC4_WGMXCCGn1
    SolutionIndex: 81
    SolutionNameMin: Cijk_Alik_Bljk_HHS_BH_Bias_HAS_SAV_UserArgs_MT128x128x64_MI16x16x1_SN_GSU1_GSUC0_GSUWGMRR1_K1_MIWT4_4_NTD4_NEPBS0_SU8_SUM0_SUS256_SPO0_SSO0_WGM8_WGMXCC1_WGMXCCGn1
    SolutionIndex: 82
    SolutionNameMin: Cijk_Alik_Bljk_HHS_BH_Bias_HAS_SAV_UserArgs_MT64x32x128_MI16x16x1_SN_GSU1_GSUC0_GSUWGMRR1_K1_LBSPPB256_LPA16_LPB16_MIWT2_1_NTD0_NEPBS0_SU0_SUM0_SUS0_VWB1_WG32_8_1_WGM8_WGMXCC1_WGMXCCGn1
    SolutionIndex: 83
    SolutionNameMin: Cijk_Alik_Bljk_HHS_BH_Bias_HAS_SAV_UserArgs_MT64x64x128_MI16x16x1_SN_GSU1_GSUC0_GSUWGMRR0_K1_LBSPPA512_LBSPPB512_MIWT2_2_NTD4_NEPBS16_SU8_SUM1_SUS512_SPO1_SVW2_VWA2_VWB2_WG32_8_1_WGM8_WGMXCC1_WGMXCCGn1
    SolutionIndex: 84
    SolutionNameMin: Cijk_Alik_Bljk_HHS_BH_Bias_HAS_SAV_UserArgs_MT32x32x128_MI16x16x1_SN_GSU4_GSUC1_GSUWGMRR0_K1_LPA16_LPB16_MIWT1_1_SU8_SUM1_SUS256_WG32_8_1_WGM1_WGMXCC1_WGMXCCGn1
    SolutionIndex: 85
    SolutionNameMin: Cijk_Alik_Bljk_HHS_BH_Bias_HAS_SAV_UserArgs_MT32x192x32_MI16x16x1_SN_GSU1_GSUC0_GSUWGMRR1_K1_MIWT2_3_SU0_SUM0_SUS0_WGM8_WGMXCC1_WGMXCCGn1
    SolutionIndex: 86
    SolutionNameMin: Cijk_Alik_Bljk_HHS_BH_Bias_HAS_SAV_UserArgs_MT64x64x128_MI16x16x1_SN_GSU1_GSUC0_GSUWGMRR0_K1_LBSPPA512_MIWT2_2_NTD3_NEPBS16_SU8_SUM0_SUS256_SPO0_SSO0_SVW2_VWA2_WG32_8_1_WGM4_WGMXCC1_WGMXCCGn1
    SolutionIndex: 87
    SolutionNameMin: Cijk_Alik_Bljk_HHS_BH_Bias_HAS_SAV_UserArgs_MT160x256x64_MI16x16x1_SN_GSU1_GSUC0_GSUWGMRR0_K1_LBSPPA256_LBSPPB512_LPA16_LPB16_MIWT10_4_NTD4_NEPBS16_SU0_SUM0_SUS0_SPO1_SSO0_SVW2_VWA2_VWB4_WG16_16_1_WGM1_WGMXCC1_WGMXCCGn1
    SolutionIndex: 88
    SolutionNameMin: Cijk_Alik_Bljk_HHS_BH_Bias_HAS_SAV_UserArgs_MT128x224x64_MI16x16x1_SN_GSU1_GSUC0_GSUWGMRR0_K1_MIWT4_7_NTA0_NTD4_NEPBS0_SU8_SUM1_SUS256_SPO1_SSO0_WGM0_WGMXCC1_WGMXCCGn1
    SolutionIndex: 89
    SolutionNameMin: Cijk_Alik_Bljk_HHS_BH_Bias_HAS_SAV_UserArgs_MT64x32x64_MI16x16x1_SN_GSU1_GSUC0_GSUWGMRR1_K1_LPA16_LPB16_MIWT2_1_NEPBS16_SU0_SUM0_SUS0_WG32_8_1_WGM8_WGMXCC1_WGMXCCGn1
    SolutionIndex: 90
    SolutionNameMin: Cijk_Alik_Bljk_HHS_BH_Bias_HAS_SAV_UserArgs_MT128x96x64_MI16x16x1_SN_GSU1_GSUC0_GSUWGMRR0_K1_LBSPPA512_LBSPPB128_LPA16_LPB16_MIWT4_3_NTD4_NEPBS16_SS1_SU8_SUM0_SUS128_SPO0_SSO0_SVW4_VWA4_VWB1_WG32_8_1_WGM8_WGMXCC1_WGMXCCGn1
    SolutionIndex: 91
    SolutionNameMin: Cijk_Alik_Bljk_HHS_BH_Bias_HAS_SAV_UserArgs_MT32x32x32_MI16x16x1_SN_GRVWA4_GRVWB4_GSU1_GSUC0_GSUWGMRR1_K1_LPA4_LPB4_LRVW4_MIWT1_1_SU0_SUM0_SUS0_WG32_8_1_WGM8_WGMXCC1_WGMXCCGn1
    SolutionIndex: 92
    SolutionNameMin: Cijk_Alik_Bljk_HHS_BH_Bias_HAS_SAV_UserArgs_MT64x64x64_MI16x16x1_SN_LDSB0_GRVWA8_GRVWB8_GSU1_GSUC1_GSUWGMRR0_K1_LBSPPA256_LBSPPB256_LPA16_LPB16_MIWT2_2_NTD3_NEPBS16_SS1_SU8_SUM0_SUS128_SVW2_VWA2_VWB2_WG32_8_1_WGM8_WGMXCC1_WGMXCCGn1
    SolutionIndex: 93
    SolutionNameMin: Cijk_Alik_Bljk_HHS_BH_Bias_HAS_SAV_UserArgs_MT48x64x32_MI16x16x1_SN_GSU1_GSUC0_GSUWGMRR1_K1_MIWT3_1_SU0_SUM0_SUS0_WGM8_WGMXCC1_WGMXCCGn1
    SolutionIndex: 94
    SolutionNameMin: Cijk_Alik_Bljk_HHS_BH_Bias_HAS_SAV_UserArgs_MT256x128x64_MI16x16x1_SN_GSU1_GSUC0_GSUWGMRR0_K1_LBSPPA1024_LBSPPB512_LPA16_LPB16_MIWT8_4_NTD4_NEPBS16_SU0_SUM0_SUS0_SPO0_SSO0_SVW8_VWA8_VWB4_WG32_8_1_WGM24_WGMXCC4_WGMXCCGn1
    SolutionIndex: 95
    SolutionNameMin: Cijk_Alik_Bljk_HHS_BH_Bias_HAS_SAV_UserArgs_MT128x256x64_MI16x16x1_SN_GSU1_GSUC0_GSUWGMRR1_K1_LBSPPA1024_LBSPPB512_MIWT8_4_NTD4_NEPBS16_SU8_SUM2_SUS128_SPO1_SSO0_SVW8_VWA8_VWB4_WG16_16_1_WGM1_WGMXCC4_WGMXCCGn1
    SolutionIndex: 96
    SolutionNameMin: Cijk_Alik_Bljk_HHS_BH_Bias_HAS_SAV_UserArgs_MT64x32x64_MI16x16x1_SN_GSU1_GSUC0_GSUWGMRR1_K1_LPA16_LPB16_MIWT2_1_NEPBS2_SU0_SUM0_SUS0_WG32_8_1_WGM8_WGMXCC1_WGMXCCGn1
    SolutionIndex: 97
    SolutionNameMin: Cijk_Alik_Bljk_HHS_BH_Bias_HAS_SAV_UserArgs_MT128x128x64_MI16x16x1_SN_GSU1_GSUC0_GSUWGMRR1_K1_MIWT4_4_NTD3_NEPBS16_SU8_SUM0_SUS128_SPO1_SSO0_WGM4_WGMXCC1_WGMXCCGn1
    SolutionIndex: 98
    SolutionNameMin: Cijk_Alik_Bljk_HHS_BH_Bias_HAS_SAV_UserArgs_MT64x64x128_MI16x16x1_SN_GSU1_GSUC0_GSUWGMRR0_K1_LBSPPA512_LBSPPB512_MIWT2_2_NTD3_NEPBS16_SU8_SUM1_SUS512_SPO0_SVW2_VWA2_VWB2_WG32_8_1_WGM4_WGMXCC1_WGMXCCGn1
    SolutionIndex: 99
    SolutionNameMin: Cijk_Alik_Bljk_HHS_BH_Bias_HAS_SAV_UserArgs_MT128x160x64_MI16x16x1_SN_GSU1_GSUC0_GSUWGMRR1_K1_LBSPPA512_LBSPPB128_MIWT4_5_NTD0_NEPBS16_SU8_SUM0_SUS128_SPO0_SSO0_SVW4_VWA4_VWB1_WG32_8_1_WGM4_WGMXCC1_WGMXCCGn1
    SolutionIndex: 100
    SolutionNameMin: Cijk_Alik_Bljk_HHS_BH_Bias_HAS_SAV_UserArgs_MT64x16x32_MI16x16x1_SN_GSU1_GSUC0_GSUWGMRR1_K1_MIWT1_1_SU0_SUM0_SUS0_WGM8_WGMXCC1_WGMXCCGn1
    SolutionIndex: 101
    SolutionNameMin: Cijk_Alik_Bljk_HHS_BH_Bias_HAS_SAV_UserArgs_MT48x64x128_MI16x16x1_SN_GSU1_GSUC0_GSUWGMRR1_K1_MIWT3_1_SU8_SUM1_SUS512_WGM8_WGMXCC1_WGMXCCGn1
    SolutionIndex: 102
    SolutionNameMin: Cijk_Alik_Bljk_HHS_BH_Bias_HAS_SAV_UserArgs_MT128x128x64_MI16x16x1_SN_GSU1_GSUC0_GSUWGMRR0_K1_MIWT4_4_NTD3_NEPBS16_SU32_SUM0_SUS128_SPO1_WGM4_WGMXCC1_WGMXCCGn1
    SolutionIndex: 103
    SolutionNameMin: Cijk_Alik_Bljk_HHS_BH_Bias_HAS_SAV_UserArgs_MT64x64x128_MI16x16x1_SN_GSU1_GSUC0_GSUWGMRR0_K1_LBSPPA512_LBSPPB512_MIWT2_2_NTD4_NEPBS16_SU8_SUM1_SUS256_SPO0_SVW2_VWA2_VWB2_WG32_8_1_WGM8_WGMXCC1_WGMXCCGn1
    SolutionIndex: 104
    SolutionNameMin: Cijk_Alik_Bljk_HHS_BH_Bias_HAS_SAV_UserArgs_MT32x32x32_MI16x16x1_SN_GRVWA4_GRVWB4_GSU1_GSUC0_GSUWGMRR0_K1_LPA4_LPB4_LRVW4_MIWT1_1_SU0_SUM0_SUS0_WG32_8_1_WGM8_WGMXCC1_WGMXCCGn1
    SolutionIndex: 105
    SolutionNameMin: Cijk_Alik_Bljk_HHS_BH_Bias_HAS_SAV_UserArgs_MT128x128x64_MI16x16x1_SN_GSU1_GSUC0_GSUWGMRR1_K1_MIWT4_4_NTD3_NEPBS0_SU8_SUM0_SUS128_SPO1_SSO0_WGM1_WGMXCC1_WGMXCCGn1
    SolutionIndex: 106
    SolutionNameMin: Cijk_Alik_Bljk_HHS_BH_Bias_HAS_SAV_UserArgs_MT64x32x256_MI16x16x1_SN_GSU1_GSUC0_GSUWGMRR1_K1_MIWT2_1_NTA0_NTD3_NEPBS0_SU8_SUM0_SUS512_SPO0_WGM1_WGMXCC1_WGMXCCGn1
    SolutionIndex: 107
    SolutionNameMin: Cijk_Alik_Bljk_HHS_BH_Bias_HAS_SAV_UserArgs_MT128x256x64_MI16x16x1_SN_GSU1_GSUC1_GSUWGMRR1_K1_LBSPPA512_LBSPPB1024_MIWT4_8_NTD4_NEPBS16_SU8_SUM0_SUS256_SPO1_SSO0_SVW4_VWA4_VWB8_WG32_8_1_WGM16_WGMXCC4_WGMXCCGn1
    SolutionIndex: 108
    SolutionNameMin: Cijk_Alik_Bljk_HHS_BH_Bias_HAS_SAV_UserArgs_MT128x128x64_MI16x16x1_SN_GSU1_GSUC0_GSUWGMRR1_K1_MIWT4_4_NTD3_NEPBS0_SU8_SUM1_SUS128_SPO1_WGM8_WGMXCC1_WGMXCCGn1
    SolutionIndex: 109
    SolutionNameMin: Cijk_Alik_Bljk_HHS_BH_Bias_HAS_SAV_UserArgs_MT128x160x64_MI16x16x1_SN_GSU1_GSUC1_GSUWGMRR1_K1_MIWT4_5_NTD4_NEPBS16_SU8_SUM0_SUS256_SPO1_SSO4_WGM1_WGMXCC1_WGMXCCGn1
    SolutionIndex: 110
    SolutionNameMin: Cijk_Alik_Bljk_HHS_BH_Bias_HAS_SAV_UserArgs_MT64x32x64_MI16x16x1_SN_GSU1_GSUC0_GSUWGMRR0_K1_LPA16_LPB16_MIWT2_1_NEPBS16_SU0_SUM0_SUS0_WG32_8_1_WGM8_WGMXCC1_WGMXCCGn1
    SolutionIndex: 111
    SolutionNameMin: Cijk_Alik_Bljk_HHS_BH_Bias_HAS_SAV_UserArgs_MT128x128x64_MI16x16x1_SN_GSU1_GSUC0_GSUWGMRR1_K1_MIWT4_4_NTD4_NEPBS0_SU8_SUM0_SUS256_SPO1_WGM8_WGMXCC1_WGMXCCGn1
    SolutionIndex: 112
    SolutionNameMin: Cijk_Alik_Bljk_HHS_BH_Bias_HAS_SAV_UserArgs_MT64x64x128_MI16x16x1_SN_GSU1_GSUC0_GSUWGMRR1_K1_LBSPPA512_MIWT2_2_NTD0_NEPBS16_SU8_SUM0_SUS512_SPO0_SVW2_VWA2_WG32_8_1_WGM4_WGMXCC1_WGMXCCGn1
    SolutionIndex: 113
    SolutionNameMin: Cijk_Alik_Bljk_HHS_BH_Bias_HAS_SAV_UserArgs_MT128x128x64_MI16x16x1_SN_GSU1_GSUC0_GSUWGMRR0_K1_MIWT4_4_NTD3_NEPBS16_SU8_SUM0_SUS128_SPO0_WGM40_WGMXCC1_WGMXCCGn1
    SolutionIndex: 114
    SolutionNameMin: Cijk_Alik_Bljk_HHS_BH_Bias_HAS_SAV_UserArgs_MT64x128x64_MI16x16x1_SN_GSU1_GSUC0_GSUWGMRR1_K1_LBSPPA512_LBSPPB256_LPA16_LPB16_MIWT4_2_NTD3_NEPBS16_SS1_SU0_SUM0_SUS0_SPO1_SVW4_VWA4_VWB2_WG16_16_1_WGM1_WGMXCC1_WGMXCCGn1
    SolutionIndex: 115
    SolutionNameMin: Cijk_Alik_Bljk_HHS_BH_Bias_HAS_SAV_UserArgs_MT64x64x128_MI16x16x1_SN_GSU1_GSUC1_GSUWGMRR1_K1_MIWT2_2_SU8_SUM1_SUS512_WGM8_WGMXCC1_WGMXCCGn1
    SolutionIndex: 116
    SolutionNameMin: Cijk_Alik_Bljk_HHS_BH_Bias_HAS_SAV_UserArgs_MT96x128x64_MI16x16x1_SN_GSU1_GSUC0_GSUWGMRR0_K1_LBSPPA256_LBSPPB256_LPA16_LPB16_MIWT6_2_NTD4_NEPBS0_SU8_SUM1_SUS128_SPO0_SVW2_VWA2_VWB2_WG16_16_1_WGM8_WGMXCC1_WGMXCCGn1
    SolutionIndex: 117
    SolutionNameMin: Cijk_Alik_Bljk_HHS_BH_Bias_HAS_SAV_UserArgs_MT16x32x32_MI16x16x1_SN_GSU1_GSUC0_GSUWGMRR0_K1_MIWT1_1_SU0_SUM0_SUS0_WGM8_WGMXCC1_WGMXCCGn1
    SolutionIndex: 118
    SolutionNameMin: Cijk_Alik_Bljk_HHS_BH_Bias_HAS_SAV_UserArgs_MT256x256x32_MI16x16x1_SN_GSU1_GSUC0_GSUWGMRR0_K1_MIWT8_8_NTD4_NEPBS16_SU8_SUM0_SUS256_SSO4_WGM32_WGMXCC4_WGMXCCGn1
    SolutionIndex: 119
    SolutionNameMin: Cijk_Alik_Bljk_HHS_BH_Bias_HAS_SAV_UserArgs_MT64x128x128_MI16x16x1_SN_GSU1_GSUC0_GSUWGMRR0_K1_LBSPPA1024_LBSPPB512_LPA16_LPB16_MIWT4_2_NTD4_NEPBS16_SU8_SUM0_SUS256_SPO0_SVW4_VWA4_VWB2_WG16_16_1_WGM8_WGMXCC1_WGMXCCGn1
    SolutionIndex: 120
    SolutionNameMin: Cijk_Alik_Bljk_HHS_BH_Bias_HAS_SAV_UserArgs_MT128x48x128_MI16x16x1_SN_GSU1_GSUC0_GSUWGMRR0_K1_LBSPPA512_MIWT2_3_NTD3_SS1_SU8_SUM0_SUS512_SPO0_SVW2_VWA2_WG64_4_1_WGM8_WGMXCC1_WGMXCCGn1
    SolutionIndex: 121
    SolutionNameMin: Cijk_Alik_Bljk_HHS_BH_Bias_HAS_SAV_UserArgs_MT64x160x64_MI16x16x1_SN_GSU1_GSUC0_GSUWGMRR1_K1_LPA16_LPB16_MIWT2_5_NTD4_NEPBS16_SU8_SUM0_SUS128_SPO0_SSO0_WG32_8_1_WGM1_WGMXCC1_WGMXCCGn1
    SolutionIndex: 122
    SolutionNameMin: Cijk_Alik_Bljk_HHS_BH_Bias_HAS_SAV_UserArgs_MT256x128x64_MI16x16x1_SN_GSU1_GSUC1_GSUWGMRR1_K1_MIWT8_4_NTD4_NEPBS16_SU8_SUM0_SUS256_SPO1_SSO0_WGM16_WGMXCC4_WGMXCCGn1
    SolutionIndex: 123
    SolutionNameMin: Cijk_Alik_Bljk_HHS_BH_Bias_HAS_SAV_UserArgs_MT128x96x64_MI16x16x1_SN_GSU1_GSUC0_GSUWGMRR1_K1_LBSPPA512_LBSPPB128_LPA16_LPB16_MIWT4_3_NTD4_SS1_SU32_SUM0_SUS512_SPO1_SSO4_SVW4_VWA4_VWB1_WG32_8_1_WGM0_WGMXCC1_WGMXCCG0
    SolutionIndex: 124
    SolutionNameMin: Cijk_Alik_Bljk_HHS_BH_Bias_HAS_SAV_UserArgs_MT192x256x64_MI16x16x1_SN_GSU1_GSUC0_GSUWGMRR0_K1_LBSPPA256_LBSPPB1024_MIWT6_8_NEPBS0_SU8_SUM0_SUS256_SSO0_SVW2_VWA2_VWB8_WG32_8_1_WGM32_WGMXCC4_WGMXCCGn1
    SolutionIndex: 125
    SolutionNameMin: Cijk_Alik_Bljk_HHS_BH_Bias_HAS_SAV_UserArgs_MT96x32x64_MI16x16x1_SN_GSU1_GSUC0_GSUWGMRR0_K1_LPA16_LPB16_MIWT3_1_NEPBS16_SU0_SUM0_SUS0_WG32_8_1_WGM8_WGMXCC1_WGMXCCGn1
    SolutionIndex: 126
    SolutionNameMin: Cijk_Alik_Bljk_HHS_BH_Bias_HAS_SAV_UserArgs_MT96x224x32_MI16x16x1_SN_GRVWA4_GRVWB4_GSU1_GSUC0_GSUWGMRR0_K1_LPA4_LPB4_LRVW4_MIWT3_7_SU0_SUM0_SUS0_WG32_8_1_WGM8_WGMXCC1_WGMXCCGn1
    SolutionIndex: 127
    SolutionNameMin: Cijk_Alik_Bljk_HHS_BH_Bias_HAS_SAV_UserArgs_MT128x192x64_MI16x16x1_SN_GSU1_GSUC0_GSUWGMRR1_K1_MIWT4_6_NTD4_NEPBS16_SU4_SUM0_SUS1024_SPO0_WGM8_WGMXCC1_WGMXCCGn1
    SolutionIndex: 128
    SolutionNameMin: Cijk_Alik_Bljk_HHS_BH_Bias_HAS_SAV_UserArgs_MT64x64x64_MI16x16x1_SN_LDSB0_GRVWA8_GRVWB8_GSU1_GSUC0_GSUWGMRR0_K1_LBSPPA256_LBSPPB256_LPA16_LPB16_MIWT2_2_NTD3_NEPBS16_SS1_SU0_SUM0_SUS0_SVW2_VWA2_VWB2_WG32_8_1_WGM8_WGMXCC1_WGMXCCGn1
    SolutionIndex: 129
    SolutionNameMin: Cijk_Alik_Bljk_HHS_BH_Bias_HAS_SAV_UserArgs_MT128x128x64_MI16x16x1_SN_GSU1_GSUC0_GSUWGMRR0_K1_MIWT4_4_NTD3_NEPBS0_SU8_SUM0_SUS512_SPO1_WGM1_WGMXCC1_WGMXCCGn1
    SolutionIndex: 130
    SolutionNameMin: Cijk_Alik_Bljk_HHS_BH_Bias_HAS_SAV_UserArgs_MT128x128x64_MI16x16x1_SN_GSU1_GSUC0_GSUWGMRR0_K1_MIWT4_4_NTD4_NEPBS0_SU8_SUM0_SUS256_SPO0_SSO0_WGM4_WGMXCC1_WGMXCCGn1
    SolutionIndex: 131
    SolutionNameMin: Cijk_Alik_Bljk_HHS_BH_Bias_HAS_SAV_UserArgs_MT32x32x128_MI16x16x1_SN_GSU1_GSUC0_GSUWGMRR0_K1_LPA16_LPB16_MIWT1_1_NEPBS16_SU0_SUM0_SUS0_WG32_8_1_WGM1_WGMXCC1_WGMXCCGn1
    SolutionIndex: 132
    SolutionNameMin: Cijk_Alik_Bljk_HHS_BH_Bias_HAS_SAV_UserArgs_MT256x160x64_MI16x16x1_SN_GSU1_GSUC0_GSUWGMRR0_K1_MIWT8_5_NTD4_NEPBS16_SU8_SUM0_SUS256_SSO0_WGM16_WGMXCC4_WGMXCCGn1
    SolutionIndex: 133
    SolutionNameMin: Cijk_Alik_Bljk_HHS_BH_Bias_HAS_SAV_UserArgs_MT32x64x32_MI16x16x1_SN_GSU1_GSUC0_GSUWGMRR1_K1_MIWT2_1_SU0_SUM0_SUS0_WGM8_WGMXCC1_WGMXCCGn1
    SolutionIndex: 134
    SolutionNameMin: Cijk_Alik_Bljk_HHS_BH_Bias_HAS_SAV_UserArgs_MT128x128x64_MI16x16x1_SN_GSU1_GSUC0_GSUWGMRR0_K1_MIWT4_4_NTD4_NEPBS16_SU8_SUM0_SUS128_SPO1_SSO0_WGM16_WGMXCC1_WGMXCCG0
    SolutionIndex: 135
    SolutionNameMin: Cijk_Alik_Bljk_HHS_BH_Bias_HAS_SAV_UserArgs_MT192x256x64_MI16x16x1_SN_GSU4_GSUC1_GSUWGMRR1_K1_MIWT6_8_NTD0_SU0_SUM0_SUS0_SPO0_SSO0_WGM8_WGMXCC1_WGMXCCGn1
    SolutionIndex: 136
    SolutionNameMin: Cijk_Alik_Bljk_HHS_BH_Bias_HAS_SAV_UserArgs_MT32x256x32_MI32x32x1_SN_CLR1_GRVWB8_GSU1_GSUC0_GSUWGMRR0_K1_LBSPPB128_LPA8_LPB8_LRVW8_MIWT1_2_NEPBS16_SU0_SUM0_SUS0_SVW1_VWA1_VWB2_WG32_8_1_WGM8_WGMXCC1_WGMXCCGn1
    SolutionIndex: 137
    SolutionNameMin: Cijk_Alik_Bljk_HHS_BH_Bias_HAS_SAV_UserArgs_MT64x64x64_MI16x16x1_SN_GSU5_GSUC0_GSUWGMRR1_K1_LPA16_LPB16_MIWT2_2_SU0_SUM0_SUS0_WG32_8_1_WGM8_WGMXCC1_WGMXCCGn1
    SolutionIndex: 138
    SolutionNameMin: Cijk_Alik_Bljk_HHS_BH_Bias_HAS_SAV_UserArgs_MT64x64x128_MI16x16x1_SN_GSU1_GSUC0_GSUWGMRR0_K1_LBSPPA512_MIWT2_2_NTD0_NEPBS0_SU8_SUM0_SUS512_SPO0_SSO4_SVW2_VWA2_WG32_8_1_WGM4_WGMXCC1_WGMXCCGn1
    SolutionIndex: 139
    SolutionNameMin: Cijk_Alik_Bljk_HHS_BH_Bias_HAS_SAV_UserArgs_MT32x32x256_MI16x16x1_SN_GSU1_GSUC0_GSUWGMRR0_K1_MIWT1_1_NTD3_SU0_SUM0_SUS0_SPO1_WGM1_WGMXCC1_WGMXCCGn1
    SolutionIndex: 140
    SolutionNameMin: Cijk_Alik_Bljk_HHS_BH_Bias_HAS_SAV_UserArgs_MT16x16x512_MI16x16x1_SN_GSU1_GSUC0_GSUWGMRR1_K1_MIWT1_1_NTA0_NTD0_SS1_SU0_SUM0_SUS0_SPO1_WGM1_WGMXCC1_WGMXCCGn1
    SolutionIndex: 141
    SolutionNameMin: Cijk_Alik_Bljk_HHS_BH_Bias_HAS_SAV_UserArgs_MT128x256x64_MI16x16x1_SN_GSU1_GSUC0_GSUWGMRR0_K1_LBSPPA1024_LBSPPB512_MIWT8_4_SU8_SUM0_SUS256_SSO4_SVW8_VWA8_VWB4_WG16_16_1_WGM32_WGMXCC4_WGMXCCGn1
    SolutionIndex: 142
    SolutionNameMin: Cijk_Alik_Bljk_HHS_BH_Bias_HAS_SAV_UserArgs_MT32x16x64_MI16x16x1_SN_GSU1_GSUC0_GSUWGMRR1_K1_MIWT1_1_SU0_SUM0_SUS0_WGM8_WGMXCC1_WGMXCCGn1
    SolutionIndex: 143
    SolutionNameMin: Cijk_Alik_Bljk_HHS_BH_Bias_HAS_SAV_UserArgs_MT64x64x64_MI16x16x1_SN_LDSB1_GRVWA8_GRVWB8_GSU1_GSUC0_GSUWGMRR1_K1_LBSPPA256_LBSPPB256_LPA16_LPB16_MIWT2_2_NTD3_NEPBS0_SS1_SU8_SUM0_SUS128_SVW2_VWA2_VWB2_WG32_8_1_WGM8_WGMXCC1_WGMXCCGn1
    SolutionIndex: 144
    SolutionNameMin: Cijk_Alik_Bljk_HHS_BH_Bias_HAS_SAV_UserArgs_MT128x128x64_MI16x16x1_SN_GSU1_GSUC0_GSUWGMRR1_K1_MIWT4_4_NTD4_NEPBS0_SU8_SUM0_SUS256_SSO0_WGM1_WGMXCC1_WGMXCCGn1
    SolutionIndex: 145
    SolutionNameMin: Cijk_Alik_Bljk_HHS_BH_Bias_HAS_SAV_UserArgs_MT176x256x32_MI16x16x1_SN_GSU1_GSUC1_GSUWGMRR1_K1_MIWT11_4_SU0_SUM0_SUS0_WGM8_WGMXCC1_WGMXCCGn1
    SolutionIndex: 146
    SolutionNameMin: Cijk_Alik_Bljk_HHS_BH_Bias_HAS_SAV_UserArgs_MT64x32x128_MI16x16x1_SN_GSU1_GSUC0_GSUWGMRR0_K1_LBSPPB256_LPA16_LPB16_MIWT2_1_NTD3_NEPBS0_SU8_SUM1_SUS256_VWB1_WG32_8_1_WGM1_WGMXCC1_WGMXCCGn1
    SolutionIndex: 147
    SolutionNameMin: Cijk_Alik_Bljk_HHS_BH_Bias_HAS_SAV_UserArgs_MT48x64x128_MI16x16x1_SN_GSU1_GSUC0_GSUWGMRR0_K1_MIWT3_1_SU8_SUM1_SUS512_WGM8_WGMXCC1_WGMXCCGn1
    SolutionIndex: 148
    SolutionNameMin: Cijk_Alik_Bljk_HHS_BH_Bias_HAS_SAV_UserArgs_MT224x224x64_MI16x16x1_SN_CLR1_GSU1_GSUC0_GSUWGMRR1_K1_MIWT7_7_NTD4_NEPBS0_SU8_SUM0_SUS128_SPO1_SSO0_WGM1_WGMXCC1_WGMXCCGn1
    SolutionIndex: 149
    SolutionNameMin: Cijk_Alik_Bljk_HHS_BH_Bias_HAS_SAV_UserArgs_MT64x16x256_MI16x16x1_SN_GSU1_GSUC0_GSUWGMRR1_K1_LBSPPA512_MIWT1_1_NTD0_NEPBS16_SU0_SUM0_SUS0_SPO0_SVW1_VWA1_WG64_4_1_WGM1_WGMXCC1_WGMXCCGn1
    SolutionIndex: 150
    SolutionNameMin: Cijk_Alik_Bljk_HHS_BH_Bias_HAS_SAV_UserArgs_MT128x48x128_MI16x16x1_SN_GSU1_GSUC1_GSUWGMRR0_K1_LBSPPA512_MIWT2_3_NTD0_SS1_SU8_SUM0_SUS512_SPO1_SVW2_VWA2_WG64_4_1_WGM8_WGMXCC1_WGMXCCGn1
    SolutionIndex: 151
    SolutionNameMin: Cijk_Alik_Bljk_HHS_BH_Bias_HAS_SAV_UserArgs_MT64x64x128_MI16x16x1_SN_GSU1_GSUC1_GSUWGMRR0_K1_LBSPPA512_MIWT2_2_NTD0_NEPBS16_SU8_SUM0_SUS512_SPO0_SVW2_VWA2_WG32_8_1_WGM4_WGMXCC1_WGMXCCGn1
    SolutionIndex: 152
    SolutionNameMin: Cijk_Alik_Bljk_HHS_BH_Bias_HAS_SAV_UserArgs_MT128x128x64_MI16x16x1_SN_GSU1_GSUC0_GSUWGMRR0_K1_MIWT4_4_NEPBS16_SU8_SUM0_SUS256_SSO0_WGM1_WGMXCC1_WGMXCCGn1
    SolutionIndex: 153
    SolutionNameMin: Cijk_Alik_Bljk_HHS_BH_Bias_HAS_SAV_UserArgs_MT192x160x64_MI16x16x1_SN_GSU1_GSUC1_GSUWGMRR1_K1_MIWT6_5_NTD4_NEPBS16_SU8_SUM0_SUS256_SPO1_SSO4_WGM16_WGMXCC4_WGMXCCGn1
    SolutionIndex: 154
    SolutionNameMin: Cijk_Alik_Bljk_HHS_BH_Bias_HAS_SAV_UserArgs_MT128x48x128_MI16x16x1_SN_GSU1_GSUC0_GSUWGMRR1_K1_LBSPPA512_MIWT2_3_SS0_SU8_SUM0_SUS256_SVW8_VWA2_WG64_4_1_WGM8_WGMXCC1_WGMXCCGn1
    SolutionIndex: 155
    SolutionNameMin: Cijk_Alik_Bljk_HHS_BH_Bias_HAS_SAV_UserArgs_MT256x160x64_MI16x16x1_SN_GSU1_GSUC0_GSUWGMRR1_K1_MIWT8_5_NTD4_NEPBS16_SU8_SUM0_SUS128_SPO0_SSO0_WGM1_WGMXCC4_WGMXCCGn1
    SolutionIndex: 156
    SolutionNameMin: Cijk_Alik_Bljk_HHS_BH_Bias_HAS_SAV_UserArgs_MT128x128x64_MI16x16x1_SN_GSU1_GSUC0_GSUWGMRR0_K1_MIWT4_4_NTD4_NEPBS0_SU8_SUM0_SUS128_SSO0_WGM1_WGMXCC1_WGMXCCGn1
    SolutionIndex: 157
    SolutionNameMin: Cijk_Alik_Bljk_HHS_BH_Bias_HAS_SAV_UserArgs_MT64x128x128_MI16x16x1_SN_GSU1_GSUC0_GSUWGMRR0_K1_LBSPPB512_MIWT4_2_NTD4_NEPBS16_SU0_SUM0_SUS0_SPO0_SSO0_VWB2_WG16_16_1_WGM8_WGMXCC1_WGMXCCGn1
    SolutionIndex: 158
    SolutionNameMin: Cijk_Alik_Bljk_HHS_BH_Bias_HAS_SAV_UserArgs_MT128x128x64_MI16x16x1_SN_GSU1_GSUC0_GSUWGMRR1_K1_LBSPPA512_LBSPPB512_MIWT4_4_NTD4_NEPBS16_SU8_SUM0_SUS128_SPO1_SSO0_SVW4_VWA4_VWB4_WG32_8_1_WGM0_WGMXCC1_WGMXCCGn1
    SolutionIndex: 159
    SolutionNameMin: Cijk_Alik_Bljk_HHS_BH_Bias_HAS_SAV_UserArgs_MT128x48x128_MI16x16x1_SN_GSU7_GSUC0_GSUWGMRR0_K1_MIWT2_3_NTD3_NEPBS0_SU0_SUM0_SUS0_SPO0_WGM1_WGMXCC1_WGMXCCGn1
    SolutionIndex: 160
    SolutionNameMin: Cijk_Alik_Bljk_HHS_BH_Bias_HAS_SAV_UserArgs_MT128x64x64_MI16x16x1_SN_GSU5_GSUC0_GSUWGMRR1_K1_LPA16_LPB16_MIWT4_2_NTD3_NEPBS16_SU0_SUM0_SUS0_SPO0_WG32_8_1_WGM8_WGMXCC1_WGMXCCGn1
    SolutionIndex: 161
    SolutionNameMin: Cijk_Alik_Bljk_HHS_BH_Bias_HAS_SAV_UserArgs_MT64x32x128_MI16x16x1_SN_GSU1_GSUC0_GSUWGMRR0_K1_LBSPPB256_LPA16_LPB16_MIWT2_1_NTD3_NEPBS0_SU0_SUM0_SUS0_VWB1_WG32_8_1_WGM1_WGMXCC1_WGMXCCGn1
    SolutionIndex: 162
    SolutionNameMin: Cijk_Alik_Bljk_HHS_BH_Bias_HAS_SAV_UserArgs_MT16x32x128_MI16x16x1_SN_GSU1_GSUC0_GSUWGMRR0_K1_MIWT1_1_SU8_SUM1_SUS256_WGM8_WGMXCC1_WGMXCCGn1
    SolutionIndex: 163
    SolutionNameMin: Cijk_Alik_Bljk_HHS_BH_Bias_HAS_SAV_UserArgs_MT256x192x64_MI16x16x1_SN_GSU1_GSUC0_GSUWGMRR0_K1_LBSPPB256_MIWT8_6_NTD4_NEPBS16_SU8_SUM0_SUS256_SSO0_VWB2_WG32_8_1_WGM16_WGMXCC4_WGMXCCGn1
    SolutionIndex: 164
    SolutionNameMin: Cijk_Alik_Bljk_HHS_BH_Bias_HAS_SAV_UserArgs_MT256x128x64_MI16x16x1_SN_GSU1_GSUC0_GSUWGMRR0_K1_LBSPPA1024_LBSPPB512_LPA16_LPB16_MIWT8_4_NTD4_NEPBS0_SU8_SUM0_SUS256_SSO4_SVW8_VWA8_VWB4_WG32_8_1_WGM1_WGMXCC1_WGMXCCGn1
    SolutionIndex: 165
    SolutionNameMin: Cijk_Alik_Bljk_HHS_BH_Bias_HAS_SAV_UserArgs_MT64x96x128_MI16x16x1_SN_GSU1_GSUC1_GSUWGMRR1_K1_LBSPPA512_MIWT2_3_SU8_SUM0_SUS512_SVW2_VWA2_WG32_8_1_WGM8_WGMXCC1_WGMXCCGn1
    SolutionIndex: 166
    SolutionNameMin: Cijk_Alik_Bljk_HHS_BH_Bias_HAS_SAV_UserArgs_MT128x256x64_MI16x16x1_SN_GSU1_GSUC0_GSUWGMRR0_K1_LBSPPA1024_LBSPPB512_MIWT8_4_NTD4_NEPBS16_SU8_SUM0_SUS128_SSO0_SVW8_VWA8_VWB4_WG16_16_1_WGM16_WGMXCC4_WGMXCCGn1
    SolutionIndex: 167
    SolutionNameMin: Cijk_Alik_Bljk_HHS_BH_Bias_HAS_SAV_UserArgs_MT32x192x32_MI16x16x1_SN_GSU1_GSUC0_GSUWGMRR0_K1_MIWT2_3_SU0_SUM0_SUS0_WGM8_WGMXCC1_WGMXCCGn1
    SolutionIndex: 168
    SolutionNameMin: Cijk_Alik_Bljk_HHS_BH_Bias_HAS_SAV_UserArgs_MT32x256x32_MI16x16x1_SN_CLR1_GRVWB4_GSU1_GSUC0_GSUWGMRR1_K1_LBSPPB256_LPA4_LPB4_LRVW4_MIWT2_4_NEPBS16_SU0_SUM0_SUS0_SVW2_VWA2_VWB4_WG16_16_1_WGM8_WGMXCC1_WGMXCCGn1
    SolutionIndex: 169
    SolutionNameMin: Cijk_Alik_Bljk_HHS_BH_Bias_HAS_SAV_UserArgs_MT64x32x256_MI16x16x1_SN_GSU1_GSUC0_GSUWGMRR1_K1_MIWT4_2_NTD0_SU0_SUM0_SUS0_SPO1_WGM1_WGMXCC1_WGMXCCGn1
    SolutionIndex: 170
    SolutionNameMin: Cijk_Alik_Bljk_HHS_BH_Bias_HAS_SAV_UserArgs_MT16x32x64_MI16x16x1_SN_GSU1_GSUC1_GSUWGMRR1_K1_MIWT1_1_SU0_SUM0_SUS0_WGM8_WGMXCC1_WGMXCCGn1
    SolutionIndex: 171
    SolutionNameMin: Cijk_Alik_Bljk_HHS_BH_Bias_HAS_SAV_UserArgs_MT32x16x256_MI16x16x1_SN_LDSB0_GSU1_GSUC0_GSUWGMRR0_K1_LBSPPA512_MIWT1_1_NTD0_NEPBS16_SU0_SUM0_SUS0_SVW1_VWA1_WSGRA2_WSGRB0_WG32_4_1_WGM1_WGMXCC1_WGMXCCGn1
    SolutionIndex: 172
    SolutionNameMin: Cijk_Alik_Bljk_HHS_BH_Bias_HAS_SAV_UserArgs_MT64x64x128_MI16x16x1_SN_GSU1_GSUC1_GSUWGMRR1_K1_LBSPPA512_LBSPPB512_MIWT2_2_NTD4_NEPBS0_SU8_SUM0_SUS256_SPO0_SSO0_SVW2_VWA2_VWB2_WG32_8_1_WGM4_WGMXCC1_WGMXCCGn1
    SolutionIndex: 173
    SolutionNameMin: Cijk_Alik_Bljk_HHS_BH_Bias_HAS_SAV_UserArgs_MT64x128x64_MI16x16x1_SN_GSU1_GSUC0_GSUWGMRR0_K1_LBSPPA512_LBSPPB256_LPA16_LPB16_MIWT4_2_NTD3_NEPBS16_SS1_SU8_SUM0_SUS128_SPO0_SVW4_VWA4_VWB2_WG16_16_1_WGM40_WGMXCC1_WGMXCCGn1
    SolutionIndex: 174
    SolutionNameMin: Cijk_Alik_Bljk_HHS_BH_Bias_HAS_SAV_UserArgs_MT80x192x32_MI16x16x1_SN_GSU1_GSUC1_GSUWGMRR1_K1_MIWT5_3_SU0_SUM0_SUS0_WGM8_WGMXCC1_WGMXCCGn1
    SolutionIndex: 175
    SolutionNameMin: Cijk_Alik_Bljk_HHS_BH_Bias_HAS_SAV_UserArgs_MT144x128x32_MI16x16x1_SN_GSU1_GSUC0_GSUWGMRR1_K1_MIWT9_2_SU0_SUM0_SUS0_WGM8_WGMXCC1_WGMXCCGn1
    SolutionIndex: 176
    SolutionNameMin: Cijk_Alik_Bljk_HHS_BH_Bias_HAS_SAV_UserArgs_MT64x64x128_MI16x16x1_SN_GSU1_GSUC0_GSUWGMRR1_K1_LBSPPA512_LBSPPB512_MIWT2_2_NTD3_NEPBS16_SU8_SUM1_SUS256_SPO0_SSO4_SVW2_VWA2_VWB2_WG32_8_1_WGM4_WGMXCC1_WGMXCCGn1
    SolutionIndex: 177
    SolutionNameMin: Cijk_Alik_Bljk_HHS_BH_Bias_HAS_SAV_UserArgs_MT64x16x64_MI16x16x1_SN_GSU1_GSUC0_GSUWGMRR1_K1_MIWT1_1_SU8_SUM1_SUS128_WGM1_WGMXCC1_WGMXCCGn1
    SolutionIndex: 178
    SolutionNameMin: Cijk_Alik_Bljk_HHS_BH_Bias_HAS_SAV_UserArgs_MT64x64x128_MI16x16x1_SN_GSU1_GSUC0_GSUWGMRR1_K1_LBSPPA512_LBSPPB512_MIWT2_2_NTD4_NEPBS16_SU8_SUM0_SUS256_SPO1_SVW2_VWA2_VWB2_WG32_8_1_WGM4_WGMXCC1_WGMXCCGn1
    SolutionIndex: 179
    SolutionNameMin: Cijk_Alik_Bljk_HHS_BH_Bias_HAS_SAV_UserArgs_MT64x32x256_MI16x16x1_SN_GSU1_GSUC0_GSUWGMRR1_K1_MIWT2_1_NTD3_NEPBS0_SU8_SUM0_SUS512_SPO0_WGM1_WGMXCC1_WGMXCCGn1
    SolutionIndex: 180
    SolutionNameMin: Cijk_Alik_Bljk_HHS_BH_Bias_HAS_SAV_UserArgs_MT32x32x128_MI16x16x1_SN_GSU1_GSUC0_GSUWGMRR0_K1_LPA16_LPB16_MIWT1_1_NEPBS16_SU8_SUM1_SUS256_WG32_8_1_WGM8_WGMXCC1_WGMXCCGn1
    SolutionIndex: 181
    SolutionNameMin: Cijk_Alik_Bljk_HHS_BH_Bias_HAS_SAV_UserArgs_MT48x64x64_MI16x16x1_SN_LDSB0_GSU4_GSUC1_GSUWGMRR1_K1_MIWT3_1_NEPBS16_SU0_SUM0_SUS0_WGM8_WGMXCC1_WGMXCCGn1
    SolutionIndex: 182
    SolutionNameMin: Cijk_Alik_Bljk_HHS_BH_Bias_HAS_SAV_UserArgs_MT16x32x64_MI16x16x1_SN_GSU1_GSUC0_GSUWGMRR0_K1_MIWT1_1_SU0_SUM0_SUS0_WGM8_WGMXCC1_WGMXCCGn1
    SolutionIndex: 183
    SolutionNameMin: Cijk_Alik_Bljk_HHS_BH_Bias_HAS_SAV_UserArgs_MT48x64x64_MI16x16x1_SN_LDSB1_GSU1_GSUC0_GSUWGMRR0_K1_MIWT3_1_NEPBS16_SU0_SUM0_SUS0_WGM8_WGMXCC1_WGMXCCGn1
    SolutionIndex: 184
    SolutionNameMin: Cijk_Alik_Bljk_HHS_BH_Bias_HAS_SAV_UserArgs_MT64x64x64_MI16x16x1_SN_LDSB1_GRVWA8_GRVWB8_GSU1_GSUC0_GSUWGMRR0_K1_LBSPPA256_LBSPPB256_LPA16_LPB16_MIWT2_2_NTD3_NEPBS0_SS1_SU8_SUM0_SUS128_SVW2_VWA2_VWB2_WG32_8_1_WGM8_WGMXCC1_WGMXCCGn1
    SolutionIndex: 185
    SolutionNameMin: Cijk_Alik_Bljk_HHS_BH_Bias_HAS_SAV_UserArgs_MT64x64x32_MI16x16x1_SN_CLR1_GRVWA4_GRVWB4_GSU1_GSUC0_GSUWGMRR1_K1_LPA4_LPB4_LRVW4_MIWT2_2_NEPBS16_SU0_SUM0_SUS0_SVW2_VWA2_VWB2_WG32_8_1_WGM8_WGMXCC1_WGMXCCGn1
    SolutionIndex: 186
    SolutionNameMin: Cijk_Alik_Bljk_HHS_BH_Bias_HAS_SAV_UserArgs_MT32x64x64_MI16x16x1_SN_GSU1_GSUC0_GSUWGMRR1_K1_MIWT2_1_NEPBS2_SU0_SUM0_SUS0_WGM8_WGMXCC1_WGMXCCGn1
    SolutionIndex: 187
    SolutionNameMin: Cijk_Alik_Bljk_HHS_BH_Bias_HAS_SAV_UserArgs_MT192x256x64_MI16x16x1_SN_GSU1_GSUC0_GSUWGMRR0_K1_LBSPPA512_LBSPPB512_MIWT12_4_NEPBS16_SU8_SUM0_SUS256_SSO0_SVW4_VWA4_VWB4_WG16_16_1_WGM16_WGMXCC4_WGMXCCGn1
    SolutionIndex: 188
    SolutionNameMin: Cijk_Alik_Bljk_HHS_BH_Bias_HAS_SAV_UserArgs_MT192x256x64_MI16x16x1_SN_GSU1_GSUC0_GSUWGMRR0_K1_LBSPPA512_LBSPPB512_MIWT12_4_NTD0_NEPBS0_SU8_SUM0_SUS256_SPO1_SSO4_SVW4_VWA4_VWB4_WG16_16_1_WGM40_WGMXCC4_WGMXCCGn1
    SolutionIndex: 189
    SolutionNameMin: Cijk_Alik_Bljk_HHS_BH_Bias_HAS_SAV_UserArgs_MT64x64x64_MI16x16x1_SN_LDSB1_GRVWA8_GRVWB8_GSU1_GSUC0_GSUWGMRR0_K1_LBSPPA256_LBSPPB256_LPA16_LPB16_MIWT2_2_NTD3_NEPBS16_SS1_SU0_SUM0_SUS0_SVW2_VWA2_VWB2_WG32_8_1_WGM8_WGMXCC1_WGMXCCGn1
    SolutionIndex: 190
    SolutionNameMin: Cijk_Alik_Bljk_HHS_BH_Bias_HAS_SAV_UserArgs_MT128x224x64_MI16x16x1_SN_GSU1_GSUC0_GSUWGMRR0_K1_MIWT4_7_NTD3_NEPBS16_SU32_SUM1_SUS128_SPO0_WGM4_WGMXCC1_WGMXCCGn1
    SolutionIndex: 191
    SolutionNameMin: Cijk_Alik_Bljk_HHS_BH_Bias_HAS_SAV_UserArgs_MT48x64x32_MI16x16x1_SN_GSU1_GSUC0_GSUWGMRR0_K1_MIWT3_1_SU0_SUM0_SUS0_WGM8_WGMXCC1_WGMXCCGn1
    SolutionIndex: 192
    SolutionNameMin: Cijk_Alik_Bljk_HHS_BH_Bias_HAS_SAV_UserArgs_MT64x32x128_MI16x16x1_SN_GSU1_GSUC0_GSUWGMRR0_K1_LBSPPB256_LPA16_LPB16_MIWT2_1_NTD0_NEPBS16_SU8_SUM0_SUS256_VWB1_WG32_8_1_WGM8_WGMXCC1_WGMXCCGn1
    SolutionIndex: 193
    SolutionNameMin: Cijk_Alik_Bljk_HHS_BH_Bias_HAS_SAV_UserArgs_MT128x128x64_MI16x16x1_SN_GSU1_GSUC0_GSUWGMRR0_K1_MIWT4_4_NTD3_NEPBS0_SU0_SUM0_SUS0_SPO0_SSO0_WGM4_WGMXCC1_WGMXCCG0
    SolutionIndex: 194
    SolutionNameMin: Cijk_Alik_Bljk_HHS_BH_Bias_HAS_SAV_UserArgs_MT128x128x64_MI16x16x1_SN_GSU1_GSUC0_GSUWGMRR1_K1_MIWT4_4_NTD0_NEPBS16_SU0_SUM0_SUS0_SPO0_WGM4_WGMXCC1_WGMXCCGn1
    SolutionIndex: 195
    SolutionNameMin: Cijk_Alik_Bljk_HHS_BH_Bias_HAS_SAV_UserArgs_MT64x64x64_MI16x16x1_SN_LDSB1_GRVWA8_GRVWB8_GSU1_GSUC0_GSUWGMRR1_K1_LBSPPA256_LBSPPB256_LPA16_LPB16_MIWT2_2_NTD0_NEPBS16_SS1_SU8_SUM0_SUS128_SVW2_VWA2_VWB2_WG32_8_1_WGM8_WGMXCC1_WGMXCCGn1
    SolutionIndex: 196
    SolutionNameMin: Cijk_Alik_Bljk_HHS_BH_Bias_HAS_SAV_UserArgs_MT128x128x64_MI16x16x1_SN_GSU1_GSUC1_GSUWGMRR1_K1_MIWT4_4_NTD0_NEPBS0_SU8_SUM0_SUS128_SPO0_SSO0_WGM4_WGMXCC1_WGMXCCGn1
    SolutionIndex: 197
    SolutionNameMin: Cijk_Alik_Bljk_HHS_BH_Bias_HAS_SAV_UserArgs_MT128x96x64_MI16x16x1_SN_GSU1_GSUC0_GSUWGMRR1_K1_LBSPPA512_LBSPPB128_LPA16_LPB16_MIWT4_3_NTD4_NEPBS0_SS1_SU4_SUM1_SUS512_SPO0_SSO0_SVW4_VWA4_VWB1_WG32_8_1_WGM8_WGMXCC1_WGMXCCG0
    SolutionIndex: 198
    SolutionNameMin: Cijk_Alik_Bljk_HHS_BH_Bias_HAS_SAV_UserArgs_MT64x128x64_MI16x16x1_SN_GSU1_GSUC0_GSUWGMRR1_K1_LBSPPA512_LBSPPB256_LPA16_LPB16_MIWT4_2_NTD3_NEPBS0_SS1_SU0_SUM0_SUS0_SPO0_SVW4_VWA4_VWB2_WG16_16_1_WGM1_WGMXCC1_WGMXCCGn1
    SolutionIndex: 199
    SolutionNameMin: Cijk_Alik_Bljk_HHS_BH_Bias_HAS_SAV_UserArgs_MT32x32x64_MI16x16x1_SN_GSU1_GSUC0_GSUWGMRR1_K1_LPA16_LPB16_MIWT1_1_NEPBS16_SU0_SUM0_SUS0_WG32_8_1_WGM8_WGMXCC1_WGMXCCGn1
    SolutionIndex: 200
    SolutionNameMin: Cijk_Alik_Bljk_HHS_BH_Bias_HAS_SAV_UserArgs_MT96x128x64_MI16x16x1_SN_GSU1_GSUC1_GSUWGMRR0_K1_LBSPPA256_LBSPPB256_LPA16_LPB16_MIWT6_2_NTD4_NEPBS16_SU8_SUM0_SUS128_SPO1_SVW2_VWA2_VWB2_WG16_16_1_WGM8_WGMXCC1_WGMXCCGn1
    SolutionIndex: 201
    SolutionNameMin: Cijk_Alik_Bljk_HHS_BH_Bias_HAS_SAV_UserArgs_MT16x64x64_MI16x16x1_SN_GSU1_GSUC0_GSUWGMRR0_K1_MIWT1_1_NEPBS16_SU0_SUM0_SUS0_WGM8_WGMXCC1_WGMXCCGn1
    SolutionIndex: 202
    SolutionNameMin: Cijk_Alik_Bljk_HHS_BH_Bias_HAS_SAV_UserArgs_MT96x256x64_MI16x16x1_SN_GSU1_GSUC1_GSUWGMRR1_K1_LBSPPA256_LBSPPB512_LPA16_LPB16_MIWT6_4_NTA0_NTD4_NEPBS16_SU8_SUM0_SUS256_SPO0_SSO0_SVW2_VWA2_VWB4_WG16_16_1_WGM19_WGMXCC1_WGMXCCGn1
    SolutionIndex: 203
    SolutionNameMin: Cijk_Alik_Bljk_HHS_BH_Bias_HAS_SAV_UserArgs_MT32x32x128_MI16x16x1_SN_GSU1_GSUC0_GSUWGMRR1_K1_LPA16_LPB16_MIWT1_1_NEPBS16_SU8_SUM1_SUS512_WG32_8_1_WGM8_WGMXCC1_WGMXCCGn1
    SolutionIndex: 204
    SolutionNameMin: Cijk_Alik_Bljk_HHS_BH_Bias_HAS_SAV_UserArgs_MT128x128x64_MI16x16x1_SN_GSU1_GSUC0_GSUWGMRR0_K1_MIWT4_4_NTD4_NEPBS16_SU8_SUM0_SUS128_SPO0_WGM4_WGMXCC1_WGMXCCGn1
    SolutionIndex: 205
    SolutionNameMin: Cijk_Alik_Bljk_HHS_BH_Bias_HAS_SAV_UserArgs_MT128x192x64_MI16x16x1_SN_GSU6_GSUC1_GSUWGMRR0_K1_MIWT4_6_SU0_SUM0_SUS0_WGM2_WGMXCC1_WGMXCCGn1
    SolutionIndex: 206
    SolutionNameMin: Cijk_Alik_Bljk_HHS_BH_Bias_HAS_SAV_UserArgs_MT32x16x64_MI16x16x1_SN_GSU1_GSUC0_GSUWGMRR0_K1_MIWT1_1_SU0_SUM0_SUS0_WGM8_WGMXCC1_WGMXCCGn1
    SolutionIndex: 207
    SolutionNameMin: Cijk_Alik_Bljk_HHS_BH_Bias_HAS_SAV_UserArgs_MT16x64x16_MI16x16x1_SN_GSU1_GSUC1_GSUWGMRR0_K1_MIWT1_1_SU4_SUM0_SUS256_WGM8_WGMXCC1_WGMXCCGn1
    SolutionIndex: 208
    SolutionNameMin: Cijk_Alik_Bljk_HHS_BH_Bias_HAS_SAV_UserArgs_MT64x32x32_MI16x16x1_SN_GRVWA4_GRVWB4_GSU1_GSUC0_GSUWGMRR1_K1_LPA4_LPB4_LRVW4_MIWT2_1_SU0_SUM0_SUS0_WG32_8_1_WGM8_WGMXCC1_WGMXCCGn1
    SolutionIndex: 209
    SolutionNameMin: Cijk_Alik_Bljk_HHS_BH_Bias_HAS_SAV_UserArgs_MT64x32x128_MI16x16x1_SN_GSU1_GSUC0_GSUWGMRR1_K1_LPA16_LPB16_MIWT2_1_NTD3_NEPBS16_SU0_SUM0_SUS0_WG32_8_1_WGM1_WGMXCC1_WGMXCCGn1
    SolutionIndex: 210
    SolutionNameMin: Cijk_Alik_Bljk_HHS_BH_Bias_HAS_SAV_UserArgs_MT16x32x32_MI16x16x1_SN_GSU1_GSUC1_GSUWGMRR1_K1_MIWT1_1_SU0_SUM0_SUS0_WGM8_WGMXCC1_WGMXCCGn1
    SolutionIndex: 211
    SolutionNameMin: Cijk_Alik_Bljk_HHS_BH_Bias_HAS_SAV_UserArgs_MT256x128x64_MI32x32x1_SN_GSU1_GSUC0_GSUWGMRR1_K1_LBSPPA512_LBSPPB256_LPA8_LPB8_MIWT4_2_NTD4_NEPBS0_SU0_SUM0_SUS0_SPO0_SSO0_SVW4_VWA4_VWB2_WG64_4_1_WGM1_WGMXCC4_WGMXCCGn1
    SolutionIndex: 212
    SolutionNameMin: Cijk_Alik_Bljk_HHS_BH_Bias_HAS_SAV_UserArgs_MT128x256x64_MI16x16x1_SN_GSU1_GSUC0_GSUWGMRR0_K1_LBSPPA1024_LBSPPB512_MIWT8_4_NTD4_NEPBS16_SU8_SUM2_SUS256_SPO0_SSO0_SVW8_VWA8_VWB4_WG16_16_1_WGM32_WGMXCC4_WGMXCCGn1
    SolutionIndex: 213
    SolutionNameMin: Cijk_Alik_Bljk_HHS_BH_Bias_HAS_SAV_UserArgs_MT256x128x64_MI16x16x1_SN_GSU2_GSUC1_GSUWGMRR1_K1_MIWT8_4_NTD0_NEPBS16_SU8_SUM0_SUS128_SPO0_SSO0_WGM0_WGMXCC4_WGMXCCGn1
    SolutionIndex: 214
    SolutionNameMin: Cijk_Alik_Bljk_HHS_BH_Bias_HAS_SAV_UserArgs_MT32x16x128_MI16x16x1_SN_GSU1_GSUC0_GSUWGMRR0_K1_MIWT1_1_SU0_SUM0_SUS0_WGM1_WGMXCC1_WGMXCCGn1
    SolutionIndex: 215
    SolutionNameMin: Cijk_Alik_Bljk_HHS_BH_Bias_HAS_SAV_UserArgs_MT32x64x128_MI16x16x1_SN_GSU1_GSUC1_GSUWGMRR1_K1_MIWT2_1_SU8_SUM1_SUS512_WGM8_WGMXCC1_WGMXCCGn1
    SolutionIndex: 216
    SolutionNameMin: Cijk_Alik_Bljk_HHS_BH_Bias_HAS_SAV_UserArgs_MT96x128x64_MI16x16x1_SN_GSU1_GSUC0_GSUWGMRR0_K1_LBSPPA256_LBSPPB256_LPA16_LPB16_MIWT6_2_NTD4_NEPBS16_SU8_SUM1_SUS512_SPO0_SVW2_VWA2_VWB2_WG16_16_1_WGM8_WGMXCC1_WGMXCCGn1
    SolutionIndex: 217
    SolutionNameMin: Cijk_Alik_Bljk_HHS_BH_Bias_HAS_SAV_UserArgs_MT64x32x128_MI16x16x1_SN_GSU6_GSUC0_GSUWGMRR1_K1_LPA16_LPB16_MIWT2_1_SU0_SUM0_SUS0_WG32_8_1_WGM1_WGMXCC1_WGMXCCGn1
    SolutionIndex: 218
    SolutionNameMin: Cijk_Alik_Bljk_HHS_BH_Bias_HAS_SAV_UserArgs_MT256x128x64_MI16x16x1_SN_GSU1_GSUC0_GSUWGMRR1_K1_LBSPPA1024_LBSPPB512_LPA16_LPB16_MIWT8_4_NTD4_NEPBS16_SU0_SUM0_SUS0_SPO1_SSO0_SVW8_VWA8_VWB4_WG32_8_1_WGM16_WGMXCC4_WGMXCCGn1
    SolutionIndex: 219
    SolutionNameMin: Cijk_Alik_Bljk_HHS_BH_Bias_HAS_SAV_UserArgs_MT128x128x64_MI16x16x1_SN_GSU1_GSUC0_GSUWGMRR1_K1_MIWT4_4_NTD4_NEPBS0_SU8_SUM0_SUS128_SPO0_SSO0_WGM0_WGMXCC1_WGMXCCGn1
    SolutionIndex: 220
    SolutionNameMin: Cijk_Alik_Bljk_HHS_BH_Bias_HAS_SAV_UserArgs_MT32x64x32_MI16x16x1_SN_GSU1_GSUC0_GSUWGMRR0_K1_MIWT2_1_SU0_SUM0_SUS0_WGM8_WGMXCC1_WGMXCCGn1
    SolutionIndex: 221
    SolutionNameMin: Cijk_Alik_Bljk_HHS_BH_Bias_HAS_SAV_UserArgs_MT128x256x64_MI16x16x1_SN_GSU1_GSUC0_GSUWGMRR1_K1_LBSPPA1024_LBSPPB512_MIWT8_4_NTA0_SU8_SUM0_SUS256_SSO0_SVW8_VWA8_VWB4_WG16_16_1_WGM1_WGMXCC4_WGMXCCGn1
    SolutionIndex: 222
    SolutionNameMin: Cijk_Alik_Bljk_HHS_BH_Bias_HAS_SAV_UserArgs_MT128x128x64_MI16x16x1_SN_GSU1_GSUC0_GSUWGMRR0_K1_LBSPPA512_LBSPPB512_MIWT4_4_NTD4_NEPBS0_SU0_SUM0_SUS0_SPO0_SSO0_SVW4_VWA4_VWB4_WG32_8_1_WGM8_WGMXCC1_WGMXCCGn1
    SolutionIndex: 223
    SolutionNameMin: Cijk_Alik_Bljk_HHS_BH_Bias_HAS_SAV_UserArgs_MT16x32x32_MI16x16x1_SN_GSU1_GSUC0_GSUWGMRR1_K1_MIWT1_1_SU0_SUM0_SUS0_WGM8_WGMXCC1_WGMXCCGn1
    SolutionIndex: 224
    SolutionNameMin: Cijk_Alik_Bljk_HHS_BH_Bias_HAS_SAV_UserArgs_MT32x32x128_MI16x16x1_SN_GSU1_GSUC0_GSUWGMRR0_K1_LPA16_LPB16_MIWT1_1_NEPBS0_SU8_SUM1_SUS256_WG32_8_1_WGM1_WGMXCC1_WGMXCCGn1
    SolutionIndex: 225
    SolutionNameMin: Cijk_Alik_Bljk_HHS_BH_Bias_HAS_SAV_UserArgs_MT32x32x128_MI16x16x1_SN_GSU1_GSUC0_GSUWGMRR1_K1_LPA16_LPB16_MIWT1_1_NEPBS0_SU0_SUM0_SUS0_WG32_8_1_WGM1_WGMXCC1_WGMXCCGn1
    SolutionIndex: 226
    SolutionNameMin: Cijk_Alik_Bljk_HHS_BH_Bias_HAS_SAV_UserArgs_MT64x256x32_MI16x16x1_SN_CLR0_GRVWA4_GRVWB4_GSU1_GSUC0_GSUWGMRR1_K1_LBSPPA256_LBSPPB256_LPA4_LPB4_LRVW4_MIWT4_4_NEPBS16_SU0_SUM0_SUS0_SVW4_VWA4_VWB4_WG16_16_1_WGM1_WGMXCC1_WGMXCCGn1
    SolutionIndex: 227
    SolutionNameMin: Cijk_Alik_Bljk_HHS_BH_Bias_HAS_SAV_UserArgs_MT64x32x256_MI16x16x1_SN_GSU1_GSUC0_GSUWGMRR1_K1_MIWT2_1_NTD3_NEPBS0_SU8_SUM0_SUS512_SPO1_WGM1_WGMXCC1_WGMXCCGn1
    SolutionIndex: 228
    SolutionNameMin: Cijk_Alik_Bljk_HHS_BH_Bias_HAS_SAV_UserArgs_MT80x128x32_MI16x16x1_SN_GSU1_GSUC1_GSUWGMRR0_K1_MIWT5_2_SU0_SUM0_SUS0_WGM8_WGMXCC1_WGMXCCGn1
    SolutionIndex: 229
    SolutionNameMin: Cijk_Alik_Bljk_HHS_BH_Bias_HAS_SAV_UserArgs_MT256x128x64_MI16x16x1_SN_GSU1_GSUC0_GSUWGMRR1_K1_MIWT8_4_NTD4_NEPBS0_SU8_SUM0_SUS256_SSO0_WGM0_WGMXCC1_WGMXCCGn1
    SolutionIndex: 230
    SolutionNameMin: Cijk_Alik_Bljk_HHS_BH_Bias_HAS_SAV_UserArgs_MT80x128x64_MI16x16x1_SN_GSU8_GSUC1_GSUWGMRR0_K1_MIWT5_2_SU0_SUM0_SUS0_WGM8_WGMXCC1_WGMXCCGn1
    SolutionIndex: 231
    SolutionNameMin: Cijk_Alik_Bljk_HHS_BH_Bias_HAS_SAV_UserArgs_MT64x128x64_MI16x16x1_SN_GSU1_GSUC0_GSUWGMRR1_K1_LBSPPA512_LBSPPB256_LPA16_LPB16_MIWT4_2_NTD0_NEPBS16_SS1_SU0_SUM0_SUS0_SPO0_SVW4_VWA4_VWB2_WG16_16_1_WGM8_WGMXCC1_WGMXCCGn1
    SolutionIndex: 232
    SolutionNameMin: Cijk_Alik_Bljk_HHS_BH_Bias_HAS_SAV_UserArgs_MT32x64x128_MI16x16x1_SN_GSU1_GSUC0_GSUWGMRR1_K1_MIWT2_1_SU8_SUM0_SUS512_WGM8_WGMXCC1_WGMXCCGn1
    SolutionIndex: 233
    SolutionNameMin: Cijk_Alik_Bljk_HHS_BH_Bias_HAS_SAV_UserArgs_MT128x96x64_MI16x16x1_SN_GSU6_GSUC1_GSUWGMRR0_K1_LBSPPA512_LBSPPB128_LPA16_LPB16_MIWT4_3_SU8_SUM0_SUS128_SVW4_VWA4_VWB1_WG32_8_1_WGM0_WGMXCC1_WGMXCCGn1
    SolutionIndex: 234
    SolutionNameMin: Cijk_Alik_Bljk_HHS_BH_Bias_HAS_SAV_UserArgs_MT48x64x64_MI16x16x1_SN_LDSB1_GSU1_GSUC0_GSUWGMRR1_K1_MIWT3_1_NEPBS16_SU0_SUM0_SUS0_WGM8_WGMXCC1_WGMXCCGn1
    SolutionIndex: 235
    SolutionNameMin: Cijk_Alik_Bljk_HHS_BH_Bias_HAS_SAV_UserArgs_MT128x128x64_MI16x16x1_SN_GSU1_GSUC1_GSUWGMRR1_K1_LBSPPA512_LBSPPB512_MIWT4_4_NTA0_NTD4_NEPBS0_SU8_SUM0_SUS256_SSO0_SVW4_VWA4_VWB4_WG32_8_1_WGM1_WGMXCC1_WGMXCCGn1
    SolutionIndex: 236
    SolutionNameMin: Cijk_Alik_Bljk_HHS_BH_Bias_HAS_SAV_UserArgs_MT128x64x128_MI16x16x1_SN_GSU1_GSUC0_GSUWGMRR0_K1_LBSPPB512_MIWT4_2_NTD4_NEPBS16_SU8_SUM0_SUS512_SPO0_VWB2_WG32_8_1_WGM40_WGMXCC1_WGMXCCGn1
    SolutionIndex: 237
    SolutionNameMin: Cijk_Alik_Bljk_HHS_BH_Bias_HAS_SAV_UserArgs_MT64x64x32_MI16x16x1_SN_CLR0_GRVWA4_GRVWB4_GSU1_GSUC0_GSUWGMRR1_K1_LPA4_LPB4_LRVW4_MIWT2_2_NEPBS16_SU0_SUM0_SUS0_SVW2_VWA2_VWB2_WG32_8_1_WGM8_WGMXCC1_WGMXCCGn1
    SolutionIndex: 238
    SolutionNameMin: Cijk_Alik_Bljk_HHS_BH_Bias_HAS_SAV_UserArgs_MT16x64x64_MI16x16x1_SN_GSU1_GSUC0_GSUWGMRR1_K1_MIWT1_1_NEPBS16_SU0_SUM0_SUS0_WGM8_WGMXCC1_WGMXCCGn1
    SolutionIndex: 239
    SolutionNameMin: Cijk_Alik_Bljk_HHS_BH_Bias_HAS_SAV_UserArgs_MT128x128x64_MI16x16x1_SN_GSU1_GSUC0_GSUWGMRR0_K1_LBSPPA512_LBSPPB512_MIWT4_4_NTD0_NEPBS0_SU8_SUM1_SUS128_SPO1_SSO0_SVW4_VWA4_VWB4_WG32_8_1_WGM4_WGMXCC1_WGMXCCGn1
    SolutionIndex: 240
    SolutionNameMin: Cijk_Alik_Bljk_HHS_BH_Bias_HAS_SAV_UserArgs_MT32x64x64_MI16x16x1_SN_GSU1_GSUC0_GSUWGMRR0_K1_MIWT2_1_NEPBS16_SU0_SUM0_SUS0_WGM8_WGMXCC1_WGMXCCGn1
    SolutionIndex: 241
    SolutionNameMin: Cijk_Alik_Bljk_HHS_BH_Bias_HAS_SAV_UserArgs_MT128x128x64_MI16x16x1_SN_GSU1_GSUC0_GSUWGMRR0_K1_MIWT4_4_NTD4_NEPBS0_SU8_SUM0_SUS256_SSO0_WGM1_WGMXCC1_WGMXCCGn1
    SolutionIndex: 242
    SolutionNameMin: Cijk_Alik_Bljk_HHS_BH_Bias_HAS_SAV_UserArgs_MT128x128x64_MI16x16x1_SN_GSU3_GSUC0_GSUWGMRR1_K1_MIWT4_4_NTD3_NEPBS0_SU8_SUM0_SUS128_SPO1_SSO4_WGM8_WGMXCC1_WGMXCCG0
    SolutionIndex: 243
    SolutionNameMin: Cijk_Alik_Bljk_HHS_BH_Bias_HAS_SAV_UserArgs_MT32x16x128_MI16x16x1_SN_LDSB1_GSU5_GSUC0_GSUWGMRR1_K1_MIWT1_1_NTD3_NEPBS16_SU0_SUM0_SUS0_WGM1_WGMXCC1_WGMXCCGn1
    SolutionIndex: 244
    SolutionNameMin: Cijk_Alik_Bljk_HHS_BH_Bias_HAS_SAV_UserArgs_MT224x128x32_MI32x32x1_SN_CLR1_GRVWB8_GSU1_GSUC0_GSUWGMRR1_K1_LPA8_LPB8_LRVW8_MIWT7_1_NEPBS16_SU0_SUM0_SUS0_SVW1_VWA1_VWB1_WG32_8_1_WGM8_WGMXCC1_WGMXCCGn1
    SolutionIndex: 245
    SolutionNameMin: Cijk_Alik_Bljk_HHS_BH_Bias_HAS_SAV_UserArgs_MT128x64x128_MI16x16x1_SN_GSU1_GSUC0_GSUWGMRR1_K1_LBSPPB512_MIWT4_2_NTD4_NEPBS0_SU8_SUM0_SUS256_SPO0_SSO0_VWB2_WG32_8_1_WGM40_WGMXCC1_WGMXCCGn1
    SolutionIndex: 246
    SolutionNameMin: Cijk_Alik_Bljk_HHS_BH_Bias_HAS_SAV_UserArgs_MT128x96x64_MI16x16x1_SN_GSU5_GSUC1_GSUWGMRR0_K1_LBSPPA512_LBSPPB128_LPA16_LPB16_MIWT4_3_SU8_SUM0_SUS128_SVW4_VWA4_VWB1_WG32_8_1_WGM1_WGMXCC1_WGMXCCGn1
    SolutionIndex: 247
    SolutionNameMin: Cijk_Alik_Bljk_HHS_BH_Bias_HAS_SAV_UserArgs_MT256x128x64_MI16x16x1_SN_GSU1_GSUC0_GSUWGMRR1_K1_MIWT8_4_NTD4_NEPBS0_SU8_SUM1_SUS256_SPO0_SSO0_WGM16_WGMXCC4_WGMXCCGn1
    SolutionIndex: 248
    SolutionNameMin: Cijk_Alik_Bljk_HHS_BH_Bias_HAS_SAV_UserArgs_MT32x64x128_MI16x16x1_SN_GSU1_GSUC0_GSUWGMRR0_K1_MIWT2_1_SU8_SUM0_SUS256_WGM8_WGMXCC1_WGMXCCGn1
    SolutionIndex: 249
    SolutionNameMin: Cijk_Alik_Bljk_HHS_BH_Bias_HAS_SAV_UserArgs_MT32x32x64_MI16x16x1_SN_GSU1_GSUC0_GSUWGMRR1_K1_LPA16_LPB16_MIWT1_1_SU0_SUM0_SUS0_WG32_8_1_WGM8_WGMXCC1_WGMXCCGn1
    SolutionIndex: 250
    SolutionNameMin: Cijk_Alik_Bljk_HHS_BH_Bias_HAS_SAV_UserArgs_MT128x96x64_MI16x16x1_SN_GSU1_GSUC0_GSUWGMRR1_K1_LBSPPA512_LBSPPB128_LPA16_LPB16_MIWT4_3_NTD4_NEPBS16_SS1_SU8_SUM1_SUS256_SPO1_SSO0_SVW4_VWA4_VWB1_WG32_8_1_WGM0_WGMXCC1_WGMXCCGn1
    SolutionIndex: 251
    SolutionNameMin: Cijk_Alik_Bljk_HHS_BH_Bias_HAS_SAV_UserArgs_MT48x64x128_MI16x16x1_SN_GSU1_GSUC0_GSUWGMRR1_K1_MIWT3_1_SU8_SUM0_SUS256_WGM8_WGMXCC1_WGMXCCGn1
    SolutionIndex: 252
    SolutionNameMin: Cijk_Alik_Bljk_HHS_BH_Bias_HAS_SAV_UserArgs_MT128x144x32_MI16x16x1_SN_GSU1_GSUC1_GSUWGMRR1_K1_MIWT2_9_SU0_SUM0_SUS0_WGM8_WGMXCC1_WGMXCCGn1
    SolutionIndex: 253
    SolutionNameMin: Cijk_Alik_Bljk_HHS_BH_Bias_HAS_SAV_UserArgs_MT256x160x64_MI16x16x1_SN_GSU1_GSUC0_GSUWGMRR1_K1_MIWT8_5_NEPBS0_SU0_SUM0_SUS0_SSO0_WGM16_WGMXCC4_WGMXCCGn1
    SolutionIndex: 254
    SolutionNameMin: Cijk_Alik_Bljk_HHS_BH_Bias_HAS_SAV_UserArgs_MT128x128x64_MI16x16x1_SN_GSU1_GSUC1_GSUWGMRR1_K1_MIWT4_4_NTD4_NEPBS16_SU8_SUM0_SUS128_SPO1_SSO0_WGM1_WGMXCC1_WGMXCCGn1
    SolutionIndex: 255
    SolutionNameMin: Cijk_Alik_Bljk_HHS_BH_Bias_HAS_SAV_UserArgs_MT64x64x64_MI16x16x1_SN_LDSB0_GRVWA8_GRVWB8_GSU1_GSUC0_GSUWGMRR1_K1_LBSPPA512_LBSPPB128_LPA16_LPB16_MIWT4_1_NTD3_NEPBS16_SS1_SU8_SUM0_SUS128_SVW4_VWA4_VWB1_WG16_16_1_WGM0_WGMXCC1_WGMXCCGn1
    SolutionIndex: 256
    SolutionNameMin: Cijk_Alik_Bljk_HHS_BH_Bias_HAS_SAV_UserArgs_MT128x128x64_MI16x16x1_SN_GSU8_GSUC1_GSUWGMRR0_K1_MIWT4_4_SU0_SUM0_SUS0_WGM8_WGMXCC1_WGMXCCGn1
    SolutionIndex: 257
    SolutionNameMin: Cijk_Alik_Bljk_HHS_BH_Bias_HAS_SAV_UserArgs_MT64x64x64_MI16x16x1_SN_LDSB0_GRVWA8_GRVWB8_GSU1_GSUC0_GSUWGMRR0_K1_LBSPPA512_LBSPPB128_LPA16_LPB16_MIWT4_1_NTD3_NEPBS16_SS1_SU0_SUM0_SUS0_SVW4_VWA4_VWB1_WG16_16_1_WGM0_WGMXCC1_WGMXCCGn1
    SolutionIndex: 258
    SolutionNameMin: Cijk_Alik_Bljk_HHS_BH_Bias_HAS_SAV_UserArgs_MT64x32x128_MI16x16x1_SN_GSU1_GSUC0_GSUWGMRR1_K1_LBSPPB256_LPA16_LPB16_MIWT2_1_NTD3_NEPBS16_SU8_SUM0_SUS256_VWB1_WG32_8_1_WGM8_WGMXCC1_WGMXCCGn1
    SolutionIndex: 259
    SolutionNameMin: Cijk_Alik_Bljk_HHS_BH_Bias_HAS_SAV_UserArgs_MT128x128x64_MI16x16x1_SN_GSU1_GSUC0_GSUWGMRR0_K1_MIWT4_4_NTD4_NEPBS16_SU8_SUM0_SUS128_SPO0_SSO0_WGM4_WGMXCC1_WGMXCCGn1
    SolutionIndex: 260
    SolutionNameMin: Cijk_Alik_Bljk_HHS_BH_Bias_HAS_SAV_UserArgs_MT64x32x128_MI16x16x1_SN_GSU1_GSUC0_GSUWGMRR0_K1_LPA16_LPB16_MIWT2_1_NTD0_NEPBS16_SU8_SUM0_SUS256_WG32_8_1_WGM1_WGMXCC1_WGMXCCGn1
    SolutionIndex: 261
    SolutionNameMin: Cijk_Alik_Bljk_HHS_BH_Bias_HAS_SAV_UserArgs_MT64x64x128_MI16x16x1_SN_GSU1_GSUC0_GSUWGMRR0_K1_LBSPPA512_MIWT2_2_NTD0_NEPBS16_SU8_SUM0_SUS512_SPO0_SVW2_VWA2_WG32_8_1_WGM8_WGMXCC1_WGMXCCGn1
    SolutionIndex: 262
    SolutionNameMin: Cijk_Alik_Bljk_HHS_BH_Bias_HAS_SAV_UserArgs_MT64x64x128_MI16x16x1_SN_GSU1_GSUC0_GSUWGMRR1_K1_MIWT2_2_NTA0_NTD4_NEPBS16_SU8_SUM1_SUS256_SPO0_SSO0_WGM8_WGMXCC1_WGMXCCGn1
    SolutionIndex: 263
    SolutionNameMin: Cijk_Alik_Bljk_HHS_BH_Bias_HAS_SAV_UserArgs_MT32x16x256_MI16x16x1_SN_LDSB0_GSU1_GSUC0_GSUWGMRR0_K1_LBSPPA512_MIWT1_1_NTD0_NEPBS16_SU8_SUM0_SUS512_SVW1_VWA1_WSGRA2_WSGRB1_WG32_4_1_WGM40_WGMXCC1_WGMXCCGn1
    SolutionIndex: 264
    SolutionNameMin: Cijk_Alik_Bljk_HHS_BH_Bias_HAS_SAV_UserArgs_MT128x128x64_MI16x16x1_SN_GSU1_GSUC0_GSUWGMRR0_K1_MIWT4_4_NTD4_NEPBS16_SU0_SUM0_SUS0_SSO0_WGM16_WGMXCC1_WGMXCCGn1
    SolutionIndex: 265
    SolutionNameMin: Cijk_Alik_Bljk_HHS_BH_Bias_HAS_SAV_UserArgs_MT128x144x32_MI16x16x1_SN_GSU1_GSUC0_GSUWGMRR0_K1_MIWT2_9_SU0_SUM0_SUS0_WGM8_WGMXCC1_WGMXCCGn1
    SolutionIndex: 266
    SolutionNameMin: Cijk_Alik_Bljk_HHS_BH_Bias_HAS_SAV_UserArgs_MT64x128x128_MI16x16x1_SN_GSU1_GSUC0_GSUWGMRR1_K1_LBSPPA512_LBSPPB1024_MIWT2_4_NTD3_NEPBS16_SU8_SUM1_SUS512_SPO0_SVW2_VWA2_VWB4_WG32_8_1_WGM40_WGMXCC1_WGMXCCGn1
    SolutionIndex: 267
    SolutionNameMin: Cijk_Alik_Bljk_HHS_BH_Bias_HAS_SAV_UserArgs_MT160x160x64_MI16x16x1_SN_GSU1_GSUC1_GSUWGMRR1_K1_MIWT5_5_NTD4_NEPBS0_SU8_SUM0_SUS128_SPO1_WGM1_WGMXCC1_WGMXCCGn1
    SolutionIndex: 268
    SolutionNameMin: Cijk_Alik_Bljk_HHS_BH_Bias_HAS_SAV_UserArgs_MT32x32x64_MI16x16x1_SN_GSU1_GSUC0_GSUWGMRR0_K1_LPA16_LPB16_MIWT1_1_SU0_SUM0_SUS0_WG32_8_1_WGM8_WGMXCC1_WGMXCCGn1
    SolutionIndex: 269
    SolutionNameMin: Cijk_Alik_Bljk_HHS_BH_Bias_HAS_SAV_UserArgs_MT64x64x64_MI16x16x1_SN_LDSB0_GRVWA8_GRVWB8_GSU1_GSUC0_GSUWGMRR1_K1_LBSPPA256_LBSPPB256_LPA16_LPB16_MIWT2_2_NTD3_NEPBS16_SS1_SU8_SUM0_SUS128_SVW2_VWA2_VWB2_WG32_8_1_WGM8_WGMXCC1_WGMXCCGn1
    SolutionIndex: 270
    SolutionNameMin: Cijk_Alik_Bljk_HHS_BH_Bias_HAS_SAV_UserArgs_MT80x128x32_MI16x16x1_SN_GSU1_GSUC0_GSUWGMRR1_K1_MIWT5_2_SU0_SUM0_SUS0_WGM8_WGMXCC1_WGMXCCGn1
    SolutionIndex: 271
    SolutionNameMin: Cijk_Alik_Bljk_HHS_BH_Bias_HAS_SAV_UserArgs_MT128x64x128_MI16x16x1_SN_GSU1_GSUC0_GSUWGMRR0_K1_LBSPPB512_MIWT4_2_NTD4_NEPBS16_SU4_SUM1_SUS256_SPO1_VWB2_WG32_8_1_WGM1_WGMXCC1_WGMXCCGn1
    SolutionIndex: 272
    SolutionNameMin: Cijk_Alik_Bljk_HHS_BH_Bias_HAS_SAV_UserArgs_MT48x64x128_MI16x16x1_SN_GSU1_GSUC0_GSUWGMRR1_K1_MIWT3_1_SU8_SUM1_SUS256_WGM40_WGMXCC1_WGMXCCGn1
    SolutionIndex: 273
    SolutionNameMin: Cijk_Alik_Bljk_HHS_BH_Bias_HAS_SAV_UserArgs_MT32x32x128_MI16x16x1_SN_GSU1_GSUC0_GSUWGMRR1_K1_LPA16_LPB16_MIWT1_1_NEPBS0_SU0_SUM0_SUS0_WG32_8_1_WGM8_WGMXCC1_WGMXCCGn1
    SolutionIndex: 274
    SolutionNameMin: Cijk_Alik_Bljk_HHS_BH_Bias_HAS_SAV_UserArgs_MT128x128x64_MI16x16x1_SN_GSU1_GSUC0_GSUWGMRR0_K1_MIWT4_4_NTD4_NEPBS16_SU8_SUM1_SUS256_SPO1_SSO4_WGM8_WGMXCC1_WGMXCCGn1
    SolutionIndex: 275
    SolutionNameMin: Cijk_Alik_Bljk_HHS_BH_Bias_HAS_SAV_UserArgs_MT256x128x64_MI32x32x1_SN_GSU1_GSUC0_GSUWGMRR1_K1_LBSPPA512_LBSPPB256_LPA8_LPB8_MIWT4_2_NTD4_NEPBS0_SU0_SUM0_SUS0_SPO0_SSO0_SVW4_VWA4_VWB2_WG64_4_1_WGM24_WGMXCC4_WGMXCCGn1
    SolutionIndex: 276
    SolutionNameMin: Cijk_Alik_Bljk_HHS_BH_Bias_HAS_SAV_UserArgs_MT64x32x256_MI16x16x1_SN_GSU1_GSUC0_GSUWGMRR0_K1_MIWT2_1_NTA0_NTD4_SS1_SU0_SUM0_SUS0_SPO0_SVW2_WGM1_WGMXCC1_WGMXCCGn1
    SolutionIndex: 277
    SolutionNameMin: Cijk_Alik_Bljk_HHS_BH_Bias_HAS_SAV_UserArgs_MT160x96x64_MI16x16x1_SN_GSU12_GSUC1_GSUWGMRR0_K1_MIWT5_3_SU0_SUM0_SUS0_WGM23_WGMXCC1_WGMXCCGn1
    SolutionIndex: 278
    SolutionNameMin: Cijk_Alik_Bljk_HHS_BH_Bias_HAS_SAV_UserArgs_MT48x64x128_MI16x16x1_SN_GSU1_GSUC0_GSUWGMRR1_K1_MIWT3_1_SU8_SUM1_SUS256_WGM8_WGMXCC1_WGMXCCGn1
    SolutionIndex: 279
    SolutionNameMin: Cijk_Alik_Bljk_HHS_BH_Bias_HAS_SAV_UserArgs_MT32x256x32_MI16x16x1_SN_CLR0_GRVWB4_GSU1_GSUC0_GSUWGMRR0_K1_LBSPPB256_LPA4_LPB4_LRVW4_MIWT2_4_NEPBS16_SU0_SUM0_SUS0_SVW2_VWA2_VWB4_WG16_16_1_WGM8_WGMXCC1_WGMXCCGn1
    SolutionIndex: 280
    SolutionNameMin: Cijk_Alik_Bljk_HHS_BH_Bias_HAS_SAV_UserArgs_MT128x128x64_MI16x16x1_SN_GSU1_GSUC0_GSUWGMRR0_K1_MIWT4_4_NTD4_NEPBS0_SU32_SUM1_SUS256_SPO1_SSO4_WGM1_WGMXCC1_WGMXCCGn1
    SolutionIndex: 281
    SolutionNameMin: Cijk_Alik_Bljk_HHS_BH_Bias_HAS_SAV_UserArgs_MT96x128x64_MI16x16x1_SN_GSU1_GSUC0_GSUWGMRR0_K1_LBSPPA256_LBSPPB256_LPA16_LPB16_MIWT6_2_NTD4_NEPBS0_SU8_SUM0_SUS128_SPO0_SVW2_VWA2_VWB2_WG16_16_1_WGM8_WGMXCC1_WGMXCCGn1
    SolutionIndex: 282
    SolutionNameMin: Cijk_Alik_Bljk_HHS_BH_Bias_HAS_SAV_UserArgs_MT96x192x32_MI16x16x1_SN_GSU1_GSUC0_GSUWGMRR1_K1_MIWT6_3_SU0_SUM0_SUS0_WGM8_WGMXCC1_WGMXCCGn1
    SolutionIndex: 283
    SolutionNameMin: Cijk_Alik_Bljk_HHS_BH_Bias_HAS_SAV_UserArgs_MT64x64x64_MI16x16x1_SN_LDSB1_GRVWA8_GRVWB8_GSU1_GSUC0_GSUWGMRR1_K1_LBSPPA512_LBSPPB128_LPA16_LPB16_MIWT4_1_NTD0_NEPBS0_SS1_SU0_SUM0_SUS0_SVW4_VWA4_VWB1_WG16_16_1_WGM8_WGMXCC1_WGMXCCGn1
    SolutionIndex: 284
    SolutionNameMin: Cijk_Alik_Bljk_HHS_BH_Bias_HAS_SAV_UserArgs_MT256x128x64_MI16x16x1_SN_GSU1_GSUC0_GSUWGMRR0_K1_MIWT8_4_NTD4_NEPBS16_SU8_SUM0_SUS256_SSO4_WGM16_WGMXCC4_WGMXCCGn1
    SolutionIndex: 285
    SolutionNameMin: Cijk_Alik_Bljk_HHS_BH_Bias_HAS_SAV_UserArgs_MT64x128x128_MI16x16x1_SN_GSU1_GSUC1_GSUWGMRR1_K1_LBSPPA512_LBSPPB1024_MIWT2_4_NTD0_NEPBS16_SU8_SUM0_SUS512_SPO1_SSO0_SVW2_VWA2_VWB4_WG32_8_1_WGM8_WGMXCC1_WGMXCCGn1
    SolutionIndex: 286
    SolutionNameMin: Cijk_Alik_Bljk_HHS_BH_Bias_HAS_SAV_UserArgs_MT128x96x64_MI16x16x1_SN_GSU1_GSUC0_GSUWGMRR1_K1_LBSPPA512_LBSPPB128_LPA16_LPB16_MIWT4_3_NTD4_NEPBS16_SS1_SU4_SUM0_SUS128_SPO1_SSO0_SVW4_VWA4_VWB1_WG32_8_1_WGM0_WGMXCC1_WGMXCCGn1
    SolutionIndex: 287
    SolutionNameMin: Cijk_Alik_Bljk_HHS_BH_Bias_HAS_SAV_UserArgs_MT128x128x64_MI16x16x1_SN_GSU1_GSUC0_GSUWGMRR0_K1_MIWT4_4_SU8_SUM0_SUS256_WGM4_WGMXCC1_WGMXCCGn1
    SolutionIndex: 288
    SolutionNameMin: Cijk_Alik_Bljk_HHS_BH_Bias_HAS_SAV_UserArgs_MT32x32x16_MI16x16x1_SN_CLR0_GRVWA2_GRVWB2_GSU1_GSUC0_GSUWGMRR0_K1_MIWT1_1_PLR0_SU4_SUM0_SUS256_WG32_8_1_WGM1_WGMXCC8_WGMXCCG0
    SolutionIndex: 289
    SolutionNameMin: Cijk_Alik_Bljk_HHS_BH_Bias_HAS_SAV_UserArgs_MT32x16x256_MI16x16x1_SN_GSU1_GSUC0_GSUWGMRR0_K1_LWPM0p50_MIAV0_MIWT1_1_SU0_SUM0_SUS0_SVW1_VWA1_WG32_4_1_WGM1_WGMXCC1_WGMXCCGn1
    SolutionIndex: 290
    SolutionNameMin: Cijk_Alik_Bljk_HHS_BH_Bias_HAS_SAV_UserArgs_MT16x16x256_MI16x16x1_SN_GSU1_GSUC0_GSUWGMRR0_K1_LWPMn1_MIAV0_MIWT1_1_SU0_SUM0_SUS0_WG16_4_4_WGM1_WGMXCC1_WGMXCCGn1
    SolutionIndex: 291
    SolutionNameMin: Cijk_Alik_Bljk_HHS_BH_Bias_HAS_SAV_UserArgs_MT32x64x128_MI16x16x1_SN_CLR1_GRVWA8_GRVWB8_GSU1_GSUC0_GSUWGMRR1_K1_LBSPPA512_LBSPPB256_LPA16_LPB16_LRVW8_MIWT2_1_PLR1_SU0_SUM0_SUS0_WGM1_WGMXCC8_WGMXCCG304
- - - [1536, 2048, 1, 256]
    - [286, 0.0]
  - - [96, 2048, 1, 240]
    - [0, 0.0]
  - - [14912, 2048, 1, 512]
    - [1, 0.0]
  - - [7652, 2048, 1, 256]
    - [2, 0.0]
  - - [12, 196608, 1, 29]
    - [3, 0.0]
  - - [768, 2048, 1, 512]
    - [4, 0.0]
  - - [32, 196608, 1, 33]
    - [5, 0.0]
  - - [128, 2048, 1, 2191]
    - [6, 0.0]
  - - [15, 163840, 1, 90]
    - [8, 0.0]
  - - [3008, 2048, 1, 512]
    - [9, 0.0]
  - - [64, 2048, 1, 1723]
    - [10, 0.0]
  - - [435, 2048, 1, 128]
    - [11, 0.0]
  - - [7808, 2048, 1, 256]
    - [12, 0.0]
  - - [256, 2048, 1, 816]
    - [13, 0.0]
  - - [128, 2048, 1, 1920]
    - [6, 0.0]
  - - [144, 2048, 1, 252]
    - [14, 0.0]
  - - [256, 2048, 1, 7652]
    - [15, 0.0]
  - - [780, 2048, 1, 256]
    - [16, 0.0]
  - - [576, 2048, 1, 256]
    - [17, 0.0]
  - - [16, 327680, 1, 36]
    - [18, 0.0]
  - - [576, 2048, 1, 2048]
    - [19, 0.0]
  - - [512, 2048, 1, 2068]
    - [20, 0.0]
  - - [2048, 2048, 1, 14912]
    - [21, 0.0]
  - - [4096, 2048, 1, 5120]
    - [22, 0.0]
  - - [2048, 2048, 1, 4384]
    - [23, 0.0]
  - - [1648, 2048, 1, 256]
    - [24, 0.0]
  - - [495, 2048, 1, 256]
    - [25, 0.0]
  - - [256, 2048, 1, 2040]
    - [26, 0.0]
  - - [2048, 2048, 1, 2048]
    - [27, 0.0]
  - - [1440, 2048, 1, 128]
    - [28, 0.0]
  - - [64, 2048, 1, 256]
    - [29, 0.0]
  - - [10240, 2048, 1, 3200]
    - [30, 0.0]
  - - [16776, 2048, 1, 512]
    - [31, 0.0]
  - - [1024, 2048, 1, 256]
    - [32, 0.0]
  - - [512, 2048, 1, 3840]
    - [33, 0.0]
  - - [160, 2048, 1, 4580]
    - [34, 0.0]
  - - [49, 262144, 1, 699]
    - [35, 0.0]
  - - [1440, 2048, 1, 256]
    - [36, 0.0]
  - - [2048, 2048, 1, 19424]
    - [37, 0.0]
  - - [48, 327680, 1, 70]
    - [38, 0.0]
  - - [128, 49152, 1, 48]
    - [39, 0.0]
  - - [6105, 2048, 1, 256]
    - [40, 0.0]
  - - [256, 2048, 1, 2080]
    - [41, 0.0]
  - - [121, 327680, 1, 105]
    - [42, 0.0]
  - - [768, 2048, 1, 7393]
    - [43, 0.0]
  - - [3072, 2048, 1, 6144]
    - [44, 0.0]
  - - [10, 196608, 1, 29]
    - [8, 0.0]
  - - [134, 262144, 1, 94]
    - [45, 0.0]
  - - [10240, 2048, 1, 512]
    - [46, 0.0]
  - - [512, 2048, 1, 768]
    - [47, 0.0]
  - - [208, 327680, 1, 1060]
    - [48, 0.0]
  - - [64, 327680, 1, 99]
    - [35, 0.0]
  - - [4096, 2048, 1, 7936]
    - [49, 0.0]
  - - [128, 2048, 1, 1440]
    - [50, 0.0]
  - - [1783, 2048, 1, 64]
    - [51, 0.0]
  - - [48, 409600, 1, 48]
    - [52, 0.0]
  - - [8, 2048, 1, 32]
    - [53, 0.0]
  - - [512, 2048, 1, 128]
    - [54, 0.0]
  - - [65, 196608, 1, 623]
    - [55, 0.0]
  - - [288, 2048, 1, 1200]
    - [56, 0.0]
  - - [2240, 2048, 1, 512]
    - [57, 0.0]
  - - [2048, 2048, 1, 576]
    - [58, 0.0]
  - - [360, 2048, 1, 80]
    - [59, 0.0]
  - - [97, 262144, 1, 73]
    - [60, 0.0]
  - - [2560, 2048, 1, 2048]
    - [61, 0.0]
  - - [256, 2048, 1, 5888]
    - [62, 0.0]
  - - [1024, 2048, 1, 5248]
    - [63, 0.0]
  - - [512, 2048, 1, 4096]
    - [64, 0.0]
  - - [10, 196608, 1, 407]
    - [3, 0.0]
  - - [128, 2048, 1, 708]
    - [65, 0.0]
  - - [128, 2048, 1, 512]
    - [66, 0.0]
  - - [128, 2048, 1, 7084]
    - [67, 0.0]
  - - [32, 2048, 1, 2170]
    - [290, 0.0]
  - - [19936, 2048, 1, 512]
    - [68, 0.0]
  - - [1770, 2048, 1, 512]
    - [69, 0.0]
  - - [2048, 2048, 1, 7652]
    - [70, 0.0]
  - - [3104, 2048, 1, 512]
    - [71, 0.0]
  - - [1536, 2048, 1, 4580]
    - [72, 0.0]
  - - [49, 196608, 1, 407]
    - [73, 0.0]
  - - [48, 49152, 1, 128]
    - [74, 0.0]
  - - [184, 262144, 1, 607]
    - [75, 0.0]
  - - [2848, 2048, 1, 512]
    - [76, 0.0]
  - - [896, 2048, 1, 4864]
    - [77, 0.0]
  - - [4580, 2048, 1, 256]
    - [78, 0.0]
  - - [128, 2048, 1, 1152]
    - [79, 0.0]
  - - [1536, 2048, 1, 19604]
    - [80, 0.0]
  - - [1536, 2048, 1, 4200]
    - [81, 0.0]
  - - [360, 2048, 1, 128]
    - [82, 0.0]
  - - [512, 2048, 1, 3656]
    - [83, 0.0]
  - - [32, 2048, 1, 3200]
    - [84, 0.0]
  - - [32, 327680, 1, 105]
    - [85, 0.0]
  - - [512, 2048, 1, 1536]
    - [86, 0.0]
  - - [42400, 2048, 1, 256]
    - [87, 0.0]
  - - [3824, 2048, 1, 256]
    - [88, 0.0]
  - - [256, 2048, 1, 432]
    - [89, 0.0]
  - - [1024, 2048, 1, 2704]
    - [90, 0.0]
  - - [96, 2048, 1, 96]
    - [91, 0.0]
  - - [32, 2048, 1, 960]
    - [289, 0.0]
  - - [384, 2048, 1, 1959]
    - [92, 0.0]
  - - [720, 2048, 1, 288]
    - [93, 0.0]
  - - [3656, 2048, 1, 512]
    - [94, 0.0]
  - - [192, 2048, 1, 480]
    - [53, 0.0]
  - - [3072, 2048, 1, 256]
    - [95, 0.0]
  - - [256, 2048, 1, 578]
    - [96, 0.0]
  - - [2048, 2048, 1, 6552]
    - [97, 0.0]
  - - [512, 2048, 1, 2200]
    - [98, 0.0]
  - - [2688, 2048, 1, 4096]
    - [99, 0.0]
  - - [128, 2048, 1, 80]
    - [100, 0.0]
  - - [312, 2048, 1, 816]
    - [101, 0.0]
  - - [1280, 2048, 1, 960]
    - [102, 0.0]
  - - [576, 2048, 1, 512]
    - [103, 0.0]
  - - [256, 2048, 1, 132]
    - [104, 0.0]
  - - [48, 204800, 1, 48]
    - [52, 0.0]
  - - [180, 2048, 1, 96]
    - [53, 0.0]
  - - [128, 2048, 1, 1740]
    - [79, 0.0]
  - - [2048, 2048, 1, 3104]
    - [105, 0.0]
  - - [256, 2048, 1, 3072]
    - [106, 0.0]
  - - [19424, 2048, 1, 512]
    - [107, 0.0]
  - - [1792, 2048, 1, 2848]
    - [108, 0.0]
  - - [2560, 2048, 1, 512]
    - [109, 0.0]
  - - [256, 2048, 1, 320]
    - [110, 0.0]
  - - [1959, 2048, 1, 512]
    - [111, 0.0]
  - - [512, 2048, 1, 3072]
    - [112, 0.0]
  - - [1792, 2048, 1, 1944]
    - [113, 0.0]
  - - [64, 65536, 1, 64]
    - [114, 0.0]
  - - [128, 2048, 1, 28]
    - [104, 0.0]
  - - [512, 2048, 1, 2048]
    - [115, 0.0]
  - - [1056, 2048, 1, 512]
    - [116, 0.0]
  - - [180, 2048, 1, 32]
    - [117, 0.0]
  - - [81536, 2048, 1, 512]
    - [118, 0.0]
  - - [1024, 2048, 1, 512]
    - [119, 0.0]
  - - [768, 2048, 1, 1536]
    - [120, 0.0]
  - - [57, 327680, 1, 1060]
    - [121, 0.0]
  - - [3072, 2048, 1, 384]
    - [122, 0.0]
  - - [128, 2048, 1, 192]
    - [91, 0.0]
  - - [512, 2048, 1, 240]
    - [11, 0.0]
  - - [128, 2048, 1, 120]
    - [91, 0.0]
  - - [3072, 2048, 1, 1536]
    - [123, 0.0]
  - - [6552, 2048, 1, 768]
    - [124, 0.0]
  - - [360, 2048, 1, 708]
    - [125, 0.0]
  - - [70, 262144, 1, 607]
    - [126, 0.0]
  - - [3200, 2048, 1, 1536]
    - [127, 0.0]
  - - [512, 2048, 1, 144]
    - [128, 0.0]
  - - [2048, 2048, 1, 1959]
    - [129, 0.0]
  - - [2048, 2048, 1, 5248]
    - [130, 0.0]
  - - [96, 2048, 1, 128]
    - [131, 0.0]
  - - [5120, 2048, 1, 2048]
    - [132, 0.0]
  - - [512, 2048, 1, 72]
    - [133, 0.0]
  - - [1752, 2048, 1, 512]
    - [134, 0.0]
  - - [1536, 2048, 1, 42400]
    - [135, 0.0]
  - - [256, 2048, 1, 2304]
    - [101, 0.0]
  - - [20, 163840, 1, 39]
    - [136, 0.0]
  - - [128, 2048, 1, 5050]
    - [137, 0.0]
  - - [512, 2048, 1, 2944]
    - [138, 0.0]
  - - [160, 2048, 1, 64]
    - [288, 0.0]
  - - [96, 2048, 1, 1024]
    - [139, 0.0]
  - - [3072, 2048, 1, 512]
    - [141, 0.0]
  - - [128, 2048, 1, 960]
    - [142, 0.0]
  - - [512, 2048, 1, 1783]
    - [143, 0.0]
  - - [512, 2048, 1, 32]
    - [133, 0.0]
  - - [2048, 2048, 1, 256]
    - [144, 0.0]
  - - [256, 2048, 1, 840]
    - [110, 0.0]
  - - [168, 262144, 1, 699]
    - [145, 0.0]
  - - [512, 2048, 1, 256]
    - [146, 0.0]
  - - [312, 2048, 1, 136]
    - [104, 0.0]
  - - [320, 2048, 1, 780]
    - [147, 0.0]
  - - [195, 327680, 1, 1274]
    - [148, 0.0]
  - - [128, 2048, 1, 1536]
    - [149, 0.0]
  - - [768, 2048, 1, 5120]
    - [150, 0.0]
  - - [512, 2048, 1, 2560]
    - [151, 0.0]
  - - [2048, 2048, 1, 512]
    - [152, 0.0]
  - - [4096, 2048, 1, 9728]
    - [153, 0.0]
  - - [640, 2048, 1, 512]
    - [154, 0.0]
  - - [512, 2048, 1, 64]
    - [11, 0.0]
  - - [5120, 2048, 1, 512]
    - [155, 0.0]
  - - [128, 2048, 1, 72]
    - [59, 0.0]
  - - [1536, 2048, 1, 512]
    - [156, 0.0]
  - - [960, 2048, 1, 256]
    - [157, 0.0]
  - - [2048, 2048, 1, 1770]
    - [158, 0.0]
  - - [96, 2048, 1, 72]
    - [91, 0.0]
  - - [128, 2048, 1, 3200]
    - [159, 0.0]
  - - [256, 2048, 1, 4324]
    - [160, 0.0]
  - - [180, 2048, 1, 128]
    - [161, 0.0]
  - - [132, 2048, 1, 256]
    - [162, 0.0]
  - - [6400, 2048, 1, 256]
    - [163, 0.0]
  - - [4096, 2048, 1, 1024]
    - [164, 0.0]
  - - [768, 2048, 1, 4384]
    - [165, 0.0]
  - - [2944, 2048, 1, 256]
    - [166, 0.0]
  - - [19, 196608, 1, 407]
    - [167, 0.0]
  - - [32, 196608, 1, 81]
    - [168, 0.0]
  - - [160, 2048, 1, 240]
    - [104, 0.0]
  - - [256, 2048, 1, 64]
    - [170, 0.0]
  - - [24, 2048, 1, 256]
    - [171, 0.0]
  - - [512, 2048, 1, 3527]
    - [172, 0.0]
  - - [256, 2048, 1, 136]
    - [91, 0.0]
  - - [1024, 2048, 1, 3824]
    - [173, 0.0]
  - - [68, 327680, 1, 488]
    - [174, 0.0]
  - - [192, 2048, 1, 528]
    - [110, 0.0]
  - - [144, 196608, 1, 623]
    - [175, 0.0]
  - - [512, 2048, 1, 3104]
    - [176, 0.0]
  - - [100, 2048, 1, 200]
    - [177, 0.0]
  - - [512, 2048, 1, 1024]
    - [178, 0.0]
  - - [10, 196608, 1, 142]
    - [8, 0.0]
  - - [256, 2048, 1, 1536]
    - [179, 0.0]
  - - [128, 2048, 1, 552]
    - [180, 0.0]
  - - [64, 2048, 1, 1783]
    - [181, 0.0]
  - - [64, 2048, 1, 64]
    - [182, 0.0]
  - - [528, 2048, 1, 256]
    - [183, 0.0]
  - - [180, 2048, 1, 72]
    - [91, 0.0]
  - - [1152, 2048, 1, 128]
    - [184, 0.0]
  - - [512, 2048, 1, 160]
    - [185, 0.0]
  - - [256, 2048, 1, 1740]
    - [186, 0.0]
  - - [156, 2048, 1, 840]
    - [142, 0.0]
  - - [6336, 2048, 1, 512]
    - [187, 0.0]
  - - [19604, 2048, 1, 256]
    - [188, 0.0]
  - - [960, 2048, 1, 128]
    - [189, 0.0]
  - - [3840, 2048, 1, 2048]
    - [190, 0.0]
  - - [80, 24576, 1, 40]
    - [191, 0.0]
  - - [320, 2048, 1, 256]
    - [11, 0.0]
  - - [96, 2048, 1, 2048]
    - [139, 0.0]
  - - [256, 2048, 1, 3824]
    - [192, 0.0]
  - - [15, 196608, 1, 27]
    - [3, 0.0]
  - - [2048, 2048, 1, 7808]
    - [193, 0.0]
  - - [2048, 2048, 1, 19936]
    - [194, 0.0]
  - - [512, 2048, 1, 1959]
    - [195, 0.0]
  - - [2048, 2048, 1, 6336]
    - [196, 0.0]
  - - [1536, 2048, 1, 1024]
    - [197, 0.0]
  - - [64, 65536, 1, 128]
    - [198, 0.0]
  - - [128, 2048, 1, 612]
    - [199, 0.0]
  - - [1536, 2048, 1, 3200]
    - [200, 0.0]
  - - [320, 2048, 1, 612]
    - [186, 0.0]
  - - [96, 2048, 1, 64]
    - [201, 0.0]
  - - [2592, 2048, 1, 384]
    - [202, 0.0]
  - - [128, 2048, 1, 1810]
    - [203, 0.0]
  - - [2048, 2048, 1, 3527]
    - [204, 0.0]
  - - [512, 2048, 1, 10240]
    - [205, 0.0]
  - - [24, 262144, 1, 73]
    - [168, 0.0]
  - - [160, 2048, 1, 192]
    - [206, 0.0]
  - - [160, 2048, 1, 72]
    - [207, 0.0]
  - - [640, 2048, 1, 288]
    - [208, 0.0]
  - - [256, 2048, 1, 128]
    - [209, 0.0]
  - - [96, 2048, 1, 160]
    - [210, 0.0]
  - - [192, 2048, 1, 240]
    - [104, 0.0]
  - - [4382, 2048, 1, 256]
    - [211, 0.0]
  - - [7808, 2048, 1, 512]
    - [212, 0.0]
  - - [2048, 2048, 1, 81536]
    - [213, 0.0]
  - - [128, 2048, 1, 128]
    - [214, 0.0]
  - - [256, 2048, 1, 340]
    - [208, 0.0]
  - - [256, 2048, 1, 2048]
    - [215, 0.0]
  - - [1440, 2048, 1, 768]
    - [216, 0.0]
  - - [64, 2048, 1, 7393]
    - [217, 0.0]
  - - [256, 2048, 1, 72]
    - [91, 0.0]
  - - [4864, 2048, 1, 896]
    - [218, 0.0]
  - - [2040, 2048, 1, 256]
    - [219, 0.0]
  - - [320, 2048, 1, 252]
    - [133, 0.0]
  - - [512, 2048, 1, 120]
    - [220, 0.0]
  - - [10, 196608, 1, 33]
    - [8, 0.0]
  - - [128, 65536, 1, 64]
    - [221, 0.0]
  - - [96, 2048, 1, 144]
    - [104, 0.0]
  - - [2048, 2048, 1, 768]
    - [222, 0.0]
  - - [160, 2048, 1, 96]
    - [223, 0.0]
  - - [24, 81920, 1, 25]
    - [220, 0.0]
  - - [64, 2048, 1, 1920]
    - [224, 0.0]
  - - [128, 2048, 1, 256]
    - [225, 0.0]
  - - [64, 409600, 1, 64]
    - [226, 0.0]
  - - [256, 2048, 1, 768]
    - [227, 0.0]
  - - [2704, 2048, 1, 160]
    - [228, 0.0]
  - - [48, 49152, 1, 48]
    - [93, 0.0]
  - - [4096, 2048, 1, 512]
    - [229, 0.0]
  - - [1536, 2048, 1, 2592]
    - [287, 0.0]
  - - [150, 2048, 1, 8648]
    - [230, 0.0]
  - - [192, 2048, 1, 24]
    - [91, 0.0]
  - - [4382, 2048, 1, 128]
    - [231, 0.0]
  - - [128, 2048, 1, 32]
    - [91, 0.0]
  - - [256, 2048, 1, 2452]
    - [232, 0.0]
  - - [256, 2048, 1, 4580]
    - [233, 0.0]
  - - [614, 2048, 1, 128]
    - [234, 0.0]
  - - [1944, 2048, 1, 512]
    - [235, 0.0]
  - - [768, 2048, 1, 2048]
    - [236, 0.0]
  - - [16, 196608, 1, 33]
    - [8, 0.0]
  - - [128, 2048, 1, 160]
    - [117, 0.0]
  - - [1024, 2048, 1, 132]
    - [237, 0.0]
  - - [144, 2048, 1, 64]
    - [238, 0.0]
  - - [2048, 2048, 1, 3656]
    - [239, 0.0]
  - - [160, 2048, 1, 120]
    - [11, 0.0]
  - - [16, 327680, 1, 70]
    - [18, 0.0]
  - - [2304, 2048, 1, 512]
    - [241, 0.0]
  - - [320, 2048, 1, 24]
    - [133, 0.0]
  - - [128, 2048, 1, 492]
    - [199, 0.0]
  - - [768, 2048, 1, 6552]
    - [242, 0.0]
  - - [160, 2048, 1, 60]
    - [104, 0.0]
  - - [320, 2048, 1, 308]
    - [208, 0.0]
  - - [32, 2048, 1, 2049]
    - [243, 0.0]
  - - [512, 2048, 1, 129]
    - [11, 0.0]
  - - [270, 2048, 1, 128]
    - [206, 0.0]
  - - [7393, 2048, 1, 64]
    - [244, 0.0]
  - - [1024, 2048, 1, 1024]
    - [245, 0.0]
  - - [308, 2048, 1, 256]
    - [89, 0.0]
  - - [256, 2048, 1, 4382]
    - [246, 0.0]
  - - [256, 2048, 1, 24]
    - [208, 0.0]
  - - [4384, 2048, 1, 768]
    - [247, 0.0]
  - - [160, 2048, 1, 780]
    - [248, 0.0]
  - - [2048, 2048, 1, 1024]
    - [152, 0.0]
  - - [128, 2048, 1, 144]
    - [249, 0.0]
  - - [180, 2048, 1, 64]
    - [91, 0.0]
  - - [2592, 2048, 1, 256]
    - [250, 0.0]
  - - [384, 2048, 1, 3072]
    - [251, 0.0]
  - - [118, 327680, 1, 466]
    - [252, 0.0]
  - - [5248, 2048, 1, 1024]
    - [253, 0.0]
  - - [4324, 2048, 1, 256]
    - [254, 0.0]
  - - [512, 2048, 1, 320]
    - [255, 0.0]
  - - [256, 2048, 1, 19604]
    - [256, 0.0]
  - - [512, 2048, 1, 192]
    - [257, 0.0]
  - - [256, 2048, 1, 2170]
    - [258, 0.0]
  - - [2048, 2048, 1, 3008]
    - [259, 0.0]
  - - [256, 2048, 1, 256]
    - [260, 0.0]
  - - [256, 2048, 1, 2944]
    - [261, 0.0]
  - - [96, 2048, 1, 32]
    - [104, 0.0]
  - - [512, 2048, 1, 512]
    - [262, 0.0]
  - - [64, 2048, 1, 1536]
    - [263, 0.0]
  - - [1536, 2048, 1, 768]
    - [264, 0.0]
  - - [256, 2048, 1, 780]
    - [13, 0.0]
  - - [320, 2048, 1, 64]
    - [208, 0.0]
  - - [117, 196608, 1, 81]
    - [265, 0.0]
  - - [1024, 2048, 1, 2048]
    - [266, 0.0]
  - - [160, 2048, 1, 2704]
    - [192, 0.0]
  - - [128, 2048, 1, 240]
    - [249, 0.0]
  - - [3200, 2048, 1, 4992]
    - [267, 0.0]
  - - [160, 2048, 1, 512]
    - [291, 0.0]
  - - [320, 2048, 1, 492]
    - [110, 0.0]
  - - [117, 196608, 1, 89]
    - [175, 0.0]
  - - [128, 2048, 1, 64]
    - [206, 0.0]
  - - [96, 2048, 1, 120]
    - [268, 0.0]
  - - [512, 2048, 1, 1770]
    - [269, 0.0]
  - - [73, 196608, 1, 103]
    - [270, 0.0]
  - - [768, 2048, 1, 256]
    - [271, 0.0]
  - - [384, 2048, 1, 384]
    - [272, 0.0]
  - - [96, 2048, 1, 512]
    - [273, 0.0]
  - - [2048, 2048, 1, 2240]
    - [274, 0.0]
  - - [4200, 2048, 1, 256]
    - [275, 0.0]
  - - [128, 2048, 1, 3072]
    - [276, 0.0]
  - - [106, 2048, 1, 8648]
    - [277, 0.0]
  - - [128, 2048, 1, 96]
    - [100, 0.0]
  - - [160, 2048, 1, 144]
    - [91, 0.0]
  - - [256, 2048, 1, 1723]
    - [278, 0.0]
  - - [32, 262144, 1, 94]
    - [279, 0.0]
  - - [3527, 2048, 1, 512]
    - [280, 0.0]
  - - [1440, 2048, 1, 614]
    - [281, 0.0]
  - - [96, 327680, 1, 99]
    - [282, 0.0]
  - - [1723, 2048, 1, 64]
    - [283, 0.0]
  - - [512, 2048, 1, 96]
    - [220, 0.0]
  - - [192, 2048, 1, 72]
    - [91, 0.0]
  - - [4096, 2048, 1, 2048]
    - [284, 0.0]
  - - [256, 2048, 1, 308]
    - [91, 0.0]
  - - [32, 327680, 1, 36]
    - [5, 0.0]
  - - [1024, 2048, 1, 4096]
    - [285, 0.0]
  - - [192, 2048, 1, 120]
    - [91, 0.0]
  - - [128, 2048, 1, 2048]
    - [7, 0.0]
  - - [20, 2048, 1, 1024]
    - [140, 0.0]
  - - [160, 2048, 1, 2048]
    - [169, 0.0]
  - - [160, 2048, 1, 128]
    - [240, 0.0]
  - - [160, 2048, 1, 32]
    - [220, 0.0]
- null
- null
- DeviceEfficiency
- Equality
