library/src/amd_detail/rocblaslt/src/Tensile/Logic/asm_full/aquavanjaram/gfx942/Equality/aquavanjaram_Cijk_Alik_Bjlk_F8HS_BH_UserArgs.yaml
- {MinimumRequiredVersion: 4.33.0}
- aquavanjaram
- gfx942
- [Device 0049, Device 0050]
    SolutionIndex: 0
    SolutionNameMin: Cijk_Alik_Bjlk_F8HS_BH_UserArgs_MT128x256x64_MI16x16x1_SN_GRVWA4_GRVWB16_GSU1_GSUC0_GSUWGMRR0_K1_LBSPPA512_LBSPPB2048_LPA8_LPB64_LRVW8_MIAV0_MIWT8_4_NLCB1_SU8_SUM0_SUS256_SVW8_VWA8_VWB4_WG16_16_1_WGM48_WGMXCC1_WGMXCCGn1
    SolutionIndex: 1
    SolutionNameMin: Cijk_Alik_Bjlk_F8HS_BH_UserArgs_MT224x256x128_MI16x16x1_SN_GRVWA4_GRVWB16_GSU1_GSUC0_GSUWGMRR0_K1_LBSPPA128_LBSPPB2048_LPA8_LPB0_LRVW8_MIWT7_8_NLCB1_SU8_SUM0_SUS256_SVW1_VWA1_VWB8_WG32_8_1_WGM32_WGMXCC1_WGMXCCGn1
    SolutionIndex: 2
    SolutionNameMin: Cijk_Alik_Bjlk_F8HS_BH_UserArgs_MT128x128x64_MI32x32x1_SN_GRVWA4_GRVWB8_GSU3_GSUC0_GSUWGMRR0_K1_LBSPPA128_LBSPPB0_LPA16_LPB0_LRVW16_MIAV1_MIWT2_2_NTC3_NTD3_NLCB1_SU0_SUM0_SUS0_SVW2_VWA2_VWB2_WG64_4_1_WGM1_WGMXCC1_WGMXCCGn1
    SolutionIndex: 3
    SolutionNameMin: Cijk_Alik_Bjlk_F8HS_BH_UserArgs_MT128x256x64_MI16x16x1_SN_GRVWA16_GRVWB16_GSU1_GSUC0_GSUWGMRR0_K1_LBSPPA256_LBSPPB2048_LPA16_LPB0_LRVW8_MIAV0_MIWT4_8_NLCB1_SU8_SUM0_SUS256_SVW4_VWA4_VWB8_WG32_8_1_WGMn16_WGMXCC1_WGMXCCGn1
    SolutionIndex: 4
    SolutionNameMin: Cijk_Alik_Bjlk_F8HS_BH_UserArgs_MT160x192x64_MI16x16x1_SN_GRVWA4_GRVWB16_GSU1_GSUC0_GSUWGMRR0_K1_LBSPPA128_LBSPPB1536_LPA8_LPB16_LRVW8_MIWT10_3_NLCB3_SU8_SUM0_SUS256_SVW2_VWA2_VWB1_WG16_16_1_WGM48_WGMXCC1_WGMXCCGn1
    SolutionIndex: 5
    SolutionNameMin: Cijk_Alik_Bjlk_F8HS_BH_UserArgs_MT128x128x64_MI16x16x1_SN_GRVWA16_GRVWB16_GSU1_GSUC0_GSUWGMRR0_K1_LBSPPA256_LBSPPB1024_LPA16_LPB64_LRVW8_MIAV1_MIWT4_4_NLCB1_SU8_SUM0_SUS256_SVW4_VWA4_VWB4_WG32_8_1_WGM16_WGMXCC1_WGMXCCGn1
    SolutionIndex: 6
    SolutionNameMin: Cijk_Alik_Bjlk_F8HS_BH_UserArgs_MT256x128x64_MI32x32x1_SN_GRVWA16_GRVWB8_GSU1_GSUC0_GSUWGMRR0_K1_LBSPPA256_LBSPPB0_LPA16_LPB0_LRVW16_MIAV0_MIWT4_2_NLCB1_SU8_SUM0_SUS256_SVW4_VWA4_VWB2_WG64_4_1_WGM48_WGMXCC1_WGMXCCGn1
    SolutionIndex: 7
    SolutionNameMin: Cijk_Alik_Bjlk_F8HS_BH_UserArgs_MT176x256x64_MI16x16x1_SN_GRVWA4_GRVWB16_GSU1_GSUC0_GSUWGMRR0_K1_LBSPPA128_LBSPPB2048_LPA8_LPB64_LRVW8_MIAV0_MIWT11_4_NLCB1_SU8_SUM0_SUS256_SVW1_VWA1_VWB4_WG16_16_1_WGM1_WGMXCC1_WGMXCCGn1
    SolutionIndex: 8
    SolutionNameMin: Cijk_Alik_Bjlk_F8HS_BH_UserArgs_MT128x512x64_MI32x32x1_SN_GRVWA4_GRVWB8_GSU1_GSUC0_GSUWGMRR0_K1_LBSPPA256_LBSPPB0_LPA16_LPB0_LRVW16_MIWT4_4_NLCB1_SU8_SUM0_SUS256_SVW4_VWA4_VWB4_WG32_8_1_WGM48_WGMXCC1_WGMXCCGn1
    SolutionIndex: 9
    SolutionNameMin: Cijk_Alik_Bjlk_F8HS_BH_UserArgs_MT128x128x64_MI16x16x1_SN_GRVWA4_GRVWB16_GSU1_GSUC0_GSUWGMRR0_K1_LBSPPA512_LBSPPB1024_LPA8_LPB32_LRVW8_MIAV1_MIWT8_2_NLCB1_SU8_SUM0_SUS256_SVW8_VWA8_VWB2_WG16_16_1_WGM16_WGMXCC1_WGMXCCGn1
    SolutionIndex: 10
    SolutionNameMin: Cijk_Alik_Bjlk_F8HS_BH_UserArgs_MT256x256x64_MI16x16x1_SN_GRVWA4_GRVWB16_GSU1_GSUC0_GSUWGMRR0_K1_LBSPPA512_LBSPPB2048_LPA8_LPB0_LRVW8_MIAV0_MIWT8_8_NLCB1_SU8_SUM0_SUS256_SVW8_VWA8_VWB8_WG32_8_1_WGM32_WGMXCC1_WGMXCCGn1
    SolutionIndex: 11
    SolutionNameMin: Cijk_Alik_Bjlk_F8HS_BH_UserArgs_MT224x256x64_MI16x16x1_SN_GRVWA4_GRVWB16_GSU1_GSUC0_GSUWGMRR0_K1_LBSPPA128_LBSPPB2048_LPA8_LPB64_LRVW8_MIWT14_4_NLCB1_SU8_SUM0_SUS256_SVW2_VWA2_VWB4_WG16_16_1_WGM32_WGMXCC1_WGMXCCGn1
    SolutionIndex: 12
    SolutionNameMin: Cijk_Alik_Bjlk_F8HS_BH_UserArgs_MT256x128x128_MI16x16x1_SN_GRVWA16_GRVWB16_GSU3_GSUC0_GSUWGMRR0_K1_LBSPPA1024_LBSPPB2048_LPA32_LPB64_LRVW16_MIAV0_MIWT8_4_NTC0_NTD0_NLCB1_SU0_SUM0_SUS0_SVW8_VWA8_VWB4_WG32_8_1_WGM1_WGMXCC1_WGMXCCGn1
    SolutionIndex: 13
    SolutionNameMin: Cijk_Alik_Bjlk_F8HS_BH_UserArgs_MT128x256x64_MI16x16x1_SN_GRVWA4_GRVWB16_GSU1_GSUC0_GSUWGMRR0_K1_LBSPPA512_LBSPPB2048_LPA8_LPB64_LRVW8_MIAV0_MIWT8_4_NLCB1_SU8_SUM0_SUS256_SVW8_VWA8_VWB4_WG16_16_1_WGMn32_WGMXCC1_WGMXCCGn1
    SolutionIndex: 14
    SolutionNameMin: Cijk_Alik_Bjlk_F8HS_BH_UserArgs_MT112x256x128_MI16x16x1_SN_GRVWA4_GRVWB16_GSU1_GSUC0_GSUWGMRR0_K1_LBSPPA128_LBSPPB4096_LPA32_LPB64_LRVW16_MIAV0_MIWT7_4_NLCB1_SU8_SUM0_SUS256_SVW1_VWA1_VWB4_WG16_16_1_WGMn16_WGMXCC1_WGMXCCGn1
    SolutionIndex: 15
    SolutionNameMin: Cijk_Alik_Bjlk_F8HS_BH_UserArgs_MT64x64x256_MI16x16x1_SN_CLR1_GRVWA16_GRVWB16_GSU1_GSUC0_GSUWGMRR0_K1_LBSPPA1024_LBSPPB1024_LPA32_LPB32_LRVW16_MIAV1_MIWT4_2_NTC3_NTD3_NLCB1_PLR1_SU0_SUM0_SUS0_SVW4_VWA4_VWB2_WG16_8_2_WGM1_WGMXCC1_WGMXCCGn1
    SolutionIndex: 16
    SolutionNameMin: Cijk_Alik_Bjlk_F8HS_BH_UserArgs_MT256x256x64_MI16x16x1_SN_GRVWA16_GRVWB16_GSU1_GSUC0_GSUWGMRR0_K1_LBSPPA512_LBSPPB2048_LPA16_LPB0_LRVW8_MIWT8_8_NLCB1_SU8_SUM0_SUS256_SVW8_VWA8_VWB8_WG32_8_1_WGM48_WGMXCC1_WGMXCCGn1
    SolutionIndex: 17
    SolutionNameMin: Cijk_Alik_Bjlk_F8HS_BH_UserArgs_MT128x128x64_MI16x16x1_SN_GRVWA4_GRVWB16_GSU1_GSUC0_GSUWGMRR0_K1_LBSPPA512_LBSPPB1024_LPA8_LPB32_LRVW8_MIAV1_MIWT8_2_NLCB1_SU8_SUM0_SUS256_SVW8_VWA8_VWB2_WG16_16_1_WGMn32_WGMXCC1_WGMXCCGn1
    SolutionIndex: 18
    SolutionNameMin: Cijk_Alik_Bjlk_F8HS_BH_UserArgs_MT128x384x64_MI16x16x1_SN_GRVWA16_GRVWB16_GSU1_GSUC0_GSUWGMRR0_K1_LBSPPA512_LBSPPB3072_LPA16_LPB32_LRVW8_MIAV0_MIWT8_6_NLCB3_SU8_SUM0_SUS256_SVW8_VWA8_VWB2_WG16_16_1_WGMn32_WGMXCC1_WGMXCCGn1
    SolutionIndex: 19
    SolutionNameMin: Cijk_Alik_Bjlk_F8HS_BH_UserArgs_MT256x192x64_MI16x16x1_SN_GRVWA4_GRVWB16_GSU1_GSUC0_GSUWGMRR0_K1_LBSPPA512_LBSPPB1536_LPA8_LPB32_LRVW8_MIWT8_6_NLCB3_SU8_SUM0_SUS256_SVW8_VWA8_VWB2_WG32_8_1_WGM48_WGMXCC1_WGMXCCGn1
    SolutionIndex: 20
    SolutionNameMin: Cijk_Alik_Bjlk_F8HS_BH_UserArgs_MT256x128x64_MI16x16x1_SN_GRVWA16_GRVWB16_GSU9_GSUC0_GSUWGMRR0_K1_LBSPPA256_LBSPPB1024_LPA16_LPB0_LRVW8_MIAV0_MIWT4_8_NTC3_NTD3_NLCB1_SU0_SUM0_SUS0_SVW4_VWA4_VWB8_WG64_4_1_WGM1_WGMXCC1_WGMXCCGn1
    SolutionIndex: 21
    SolutionNameMin: Cijk_Alik_Bjlk_F8HS_BH_UserArgs_MT224x256x128_MI16x16x1_SN_GRVWA16_GRVWB16_GSU1_GSUC0_GSUWGMRR0_K1_LBSPPA256_LBSPPB4096_LPA32_LPB64_LRVW16_MIWT14_4_NLCB1_SU8_SUM0_SUS256_SVW2_VWA2_VWB4_WG16_16_1_WGM48_WGMXCC1_WGMXCCGn1
    SolutionIndex: 22
    SolutionNameMin: Cijk_Alik_Bjlk_F8HS_BH_UserArgs_MT176x256x64_MI16x16x1_SN_GRVWA4_GRVWB16_GSU1_GSUC0_GSUWGMRR0_K1_LBSPPA128_LBSPPB2048_LPA8_LPB64_LRVW8_MIAV0_MIWT11_4_NLCB1_SU8_SUM0_SUS256_SVW1_VWA1_VWB4_WG16_16_1_WGMn16_WGMXCC1_WGMXCCGn1
    SolutionIndex: 23
    SolutionNameMin: Cijk_Alik_Bjlk_F8HS_BH_UserArgs_MT64x128x64_MI16x16x1_SN_GRVWA4_GRVWB16_GSU1_GSUC0_GSUWGMRR0_K1_LBSPPA256_LBSPPB1024_LPA8_LPB32_LRVW8_MIAV1_MIWT4_2_NLCB1_SU8_SUM0_SUS256_SVW4_VWA4_VWB2_WG16_16_1_WGM1_WGMXCC1_WGMXCCGn1
    SolutionIndex: 24
    SolutionNameMin: Cijk_Alik_Bjlk_F8HS_BH_UserArgs_MT192x256x128_MI16x16x1_SN_GRVWA4_GRVWB16_GSU1_GSUC0_GSUWGMRR0_K1_LBSPPA512_LBSPPB4096_LPA32_LPB64_LRVW16_MIAV0_MIWT12_4_NLCB1_SU8_SUM0_SUS256_SVW4_VWA4_VWB4_WG16_16_1_WGMn32_WGMXCC1_WGMXCCGn1
    SolutionIndex: 25
    SolutionNameMin: Cijk_Alik_Bjlk_F8HS_BH_UserArgs_MT192x128x64_MI16x16x1_SN_GRVWA16_GRVWB16_GSU1_GSUC0_GSUWGMRR0_K1_LBSPPA128_LBSPPB1024_LPA16_LPB64_LRVW8_MIAV0_MIWT6_4_NLCB1_SU8_SUM0_SUS256_SVW2_VWA2_VWB4_WG32_8_1_WGM1_WGMXCC1_WGMXCCGn1
    SolutionIndex: 26
    SolutionNameMin: Cijk_Alik_Bjlk_F8HS_BH_UserArgs_MT256x256x64_MI16x16x1_SN_GRVWA4_GRVWB16_GSU1_GSUC0_GSUWGMRR0_K1_LBSPPA512_LBSPPB2048_LPA8_LPB0_LRVW8_MIAV0_MIWT8_8_NLCB1_SU8_SUM0_SUS256_SVW8_VWA8_VWB8_WG32_8_1_WGMn32_WGMXCC1_WGMXCCGn1
    SolutionIndex: 27
    SolutionNameMin: Cijk_Alik_Bjlk_F8HS_BH_UserArgs_MT256x256x64_MI16x16x1_SN_GRVWA4_GRVWB16_GSU1_GSUC0_GSUWGMRR0_K1_LBSPPA1024_LBSPPB2048_LPA8_LPB64_LRVW8_MIAV0_MIWT16_4_NLCB1_SU8_SUM0_SUS256_SVW16_VWA16_VWB4_WG16_16_1_WGMn16_WGMXCC1_WGMXCCGn1
    SolutionIndex: 28
    SolutionNameMin: Cijk_Alik_Bjlk_F8HS_BH_UserArgs_MT192x256x128_MI16x16x1_SN_GRVWA16_GRVWB16_GSU3_GSUC0_GSUWGMRR0_K1_LBSPPA256_LBSPPB4096_LPA32_LPB0_LRVW16_MIAV0_MIWT6_8_NLCB1_SU8_SUM0_SUS256_SVW2_VWA2_VWB8_WG32_8_1_WGM16_WGMXCC1_WGMXCCGn1
    SolutionIndex: 29
    SolutionNameMin: Cijk_Alik_Bjlk_F8HS_BH_UserArgs_MT224x256x64_MI16x16x1_SN_GRVWA4_GRVWB16_GSU1_GSUC0_GSUWGMRR0_K1_LBSPPA128_LBSPPB2048_LPA8_LPB64_LRVW8_MIAV0_MIWT14_4_NLCB1_SU8_SUM0_SUS256_SVW2_VWA2_VWB4_WG16_16_1_WGM16_WGMXCC1_WGMXCCGn1
    SolutionIndex: 30
    SolutionNameMin: Cijk_Alik_Bjlk_F8HS_BH_UserArgs_MT128x64x128_MI16x16x1_SN_GRVWA16_GRVWB16_GSU1_GSUC0_GSUWGMRR0_K1_LBSPPA512_LBSPPB1024_LPA32_LPB32_LRVW16_MIAV1_MIWT4_2_NLCB1_SU8_SUM0_SUS256_SVW4_VWA4_VWB2_WG32_8_1_WGM16_WGMXCC1_WGMXCCGn1
    SolutionIndex: 31
    SolutionNameMin: Cijk_Alik_Bjlk_F8HS_BH_UserArgs_MT256x128x128_MI16x16x1_SN_GRVWA16_GRVWB16_GSU1_GSUC0_GSUWGMRR0_K1_LBSPPA1024_LBSPPB2048_LPA32_LPB64_LRVW16_MIAV0_MIWT8_4_NLCB1_SU8_SUM0_SUS256_SVW8_VWA8_VWB4_WG32_8_1_WGM1_WGMXCC1_WGMXCCGn1
    SolutionIndex: 32
    SolutionNameMin: Cijk_Alik_Bjlk_F8HS_BH_UserArgs_MT128x64x128_MI16x16x1_SN_GRVWA16_GRVWB16_GSU1_GSUC0_GSUWGMRR0_K1_LBSPPA1024_LBSPPB1024_LPA32_LPB16_LRVW16_MIAV1_MIWT8_1_NLCB1_SU8_SUM0_SUS256_SVW8_VWA8_VWB1_WG16_16_1_WGMn16_WGMXCC1_WGMXCCGn1
    SolutionIndex: 33
    SolutionNameMin: Cijk_Alik_Bjlk_F8HS_BH_UserArgs_MT128x512x64_MI16x16x1_SN_GRVWA4_GRVWB16_GSU1_GSUC0_GSUWGMRR0_K1_LBSPPA512_LBSPPB4096_LPA8_LPB0_LRVW8_MIAV0_MIWT8_8_NLCB1_SU8_SUM0_SUS256_SVW8_VWA8_VWB8_WG16_16_1_WGMn32_WGMXCC1_WGMXCCGn1
    SolutionIndex: 34
    SolutionNameMin: Cijk_Alik_Bjlk_F8HS_BH_UserArgs_MT64x64x256_MI16x16x1_SN_CLR1_GRVWA16_GRVWB16_GSU1_GSUC0_GSUWGMRR0_K1_LBSPPA1024_LBSPPB1024_LPA32_LPB32_LRVW16_MIWT4_2_NTC3_NTD3_NLCB1_PLR1_SU0_SUM0_SUS0_SVW4_VWA4_VWB2_WG16_8_2_WGM1_WGMXCC1_WGMXCCGn1
    SolutionIndex: 35
    SolutionNameMin: Cijk_Alik_Bjlk_F8HS_BH_UserArgs_MT64x64x128_MI16x16x1_SN_GRVWA16_GRVWB16_GSU1_GSUC0_GSUWGMRR0_K1_LBSPPA256_LBSPPB1024_LPA32_LPB32_LRVW16_MIAV1_MIWT2_2_NTC0_NTD0_NLCB1_SU0_SUM0_SUS0_SVW2_VWA2_VWB2_WG32_8_1_WGM1_WGMXCC1_WGMXCCGn1
    SolutionIndex: 36
    SolutionNameMin: Cijk_Alik_Bjlk_F8HS_BH_UserArgs_MT64x128x64_MI16x16x1_SN_GRVWA4_GRVWB16_GSU1_GSUC0_GSUWGMRR0_K1_LBSPPA256_LBSPPB1024_LPA8_LPB32_LRVW8_MIAV1_MIWT4_2_NTC3_NTD3_NLCB1_SU0_SUM0_SUS0_SVW4_VWA4_VWB2_WG16_16_1_WGM1_WGMXCC1_WGMXCCGn1
    SolutionIndex: 37
    SolutionNameMin: Cijk_Alik_Bjlk_F8HS_BH_UserArgs_MT224x256x128_MI16x16x1_SN_GRVWA16_GRVWB16_GSU2_GSUC0_GSUWGMRR0_K1_LBSPPA128_LBSPPB2048_LPA16_LPB0_LRVW8_MIAV0_MIWT7_8_NLCB1_SU8_SUM0_SUS256_SVW1_VWA1_VWB8_WG32_8_1_WGMn32_WGMXCC1_WGMXCCGn1
    SolutionIndex: 38
    SolutionNameMin: Cijk_Alik_Bjlk_F8HS_BH_UserArgs_MT256x256x64_MI32x32x1_SN_GRVWA4_GRVWB8_GSU1_GSUC0_GSUWGMRR0_K1_LBSPPA256_LBSPPB0_LPA16_LPB0_LRVW16_MIWT4_4_NLCB1_SU8_SUM0_SUS256_SVW4_VWA4_VWB4_WG64_4_1_WGM48_WGMXCC1_WGMXCCGn1
    SolutionIndex: 39
    SolutionNameMin: Cijk_Alik_Bjlk_F8HS_BH_UserArgs_MT128x256x64_MI16x16x1_SN_GRVWA16_GRVWB16_GSU1_GSUC0_GSUWGMRR0_K1_LBSPPA512_LBSPPB2048_LPA16_LPB64_LRVW8_MIWT8_4_NLCB1_SU8_SUM0_SUS256_SVW8_VWA8_VWB4_WG16_16_1_WGM48_WGMXCC1_WGMXCCGn1
    SolutionIndex: 40
    SolutionNameMin: Cijk_Alik_Bjlk_F8HS_BH_UserArgs_MT128x384x64_MI16x16x1_SN_GRVWA16_GRVWB16_GSU1_GSUC0_GSUWGMRR0_K1_LBSPPA512_LBSPPB3072_LPA16_LPB32_LRVW8_MIAV0_MIWT8_6_NLCB3_SU8_SUM0_SUS256_SVW8_VWA8_VWB2_WG16_16_1_WGM48_WGMXCC1_WGMXCCGn1
    SolutionIndex: 41
    SolutionNameMin: Cijk_Alik_Bjlk_F8HS_BH_UserArgs_MT128x256x64_MI16x16x1_SN_GRVWA4_GRVWB16_GSU1_GSUC0_GSUWGMRR0_K1_LBSPPA512_LBSPPB2048_LPA8_LPB64_LRVW8_MIAV0_MIWT8_4_NLCB1_SU8_SUM0_SUS256_SVW8_VWA8_VWB4_WG16_16_1_WGM32_WGMXCC1_WGMXCCGn1
    SolutionIndex: 42
    SolutionNameMin: Cijk_Alik_Bjlk_F8HS_BH_UserArgs_MT64x128x128_MI16x16x1_SN_GRVWA16_GRVWB16_GSU1_GSUC0_GSUWGMRR0_K1_LBSPPA512_LBSPPB2048_LPA32_LPB32_LRVW16_MIAV1_MIWT4_2_NLCB1_SU8_SUM0_SUS256_SVW4_VWA4_VWB2_WG16_16_1_WGM1_WGMXCC1_WGMXCCGn1
    SolutionIndex: 43
    SolutionNameMin: Cijk_Alik_Bjlk_F8HS_BH_UserArgs_MT192x256x64_MI16x16x1_SN_GRVWA4_GRVWB16_GSU1_GSUC0_GSUWGMRR0_K1_LBSPPA256_LBSPPB2048_LPA8_LPB64_LRVW8_MIAV0_MIWT12_4_NLCB1_SU8_SUM0_SUS256_SVW4_VWA4_VWB4_WG16_16_1_WGM16_WGMXCC1_WGMXCCGn1
    SolutionIndex: 44
    SolutionNameMin: Cijk_Alik_Bjlk_F8HS_BH_UserArgs_MT128x256x64_MI16x16x1_SN_GRVWA4_GRVWB16_GSU1_GSUC0_GSUWGMRR0_K1_LBSPPA512_LBSPPB2048_LPA8_LPB64_LRVW8_MIAV0_MIWT8_4_NLCB1_SU8_SUM0_SUS256_SVW8_VWA8_VWB4_WG16_16_1_WGM16_WGMXCC1_WGMXCCGn1
    SolutionIndex: 45
    SolutionNameMin: Cijk_Alik_Bjlk_F8HS_BH_UserArgs_MT128x128x128_MI16x16x1_SN_GRVWA16_GRVWB16_GSU1_GSUC0_GSUWGMRR0_K1_LBSPPA1024_LBSPPB2048_LPA32_LPB32_LRVW16_MIAV1_MIWT8_2_NLCB1_SU8_SUM0_SUS256_SVW8_VWA8_VWB2_WG16_16_1_WGM16_WGMXCC1_WGMXCCGn1
    SolutionIndex: 46
    SolutionNameMin: Cijk_Alik_Bjlk_F8HS_BH_UserArgs_MT64x128x128_MI16x16x1_SN_GRVWA16_GRVWB16_GSU1_GSUC0_GSUWGMRR0_K1_LBSPPA512_LBSPPB2048_LPA32_LPB32_LRVW16_MIAV1_MIWT4_2_NLCB1_SU8_SUM0_SUS256_SVW4_VWA4_VWB2_WG16_16_1_WGM16_WGMXCC1_WGMXCCGn1
    SolutionIndex: 47
    SolutionNameMin: Cijk_Alik_Bjlk_F8HS_BH_UserArgs_MT224x256x128_MI16x16x1_SN_GRVWA4_GRVWB16_GSU1_GSUC0_GSUWGMRR0_K1_LBSPPA128_LBSPPB2048_LPA8_LPB0_LRVW8_MIAV0_MIWT7_8_NLCB1_SU8_SUM0_SUS256_SVW1_VWA1_VWB8_WG32_8_1_WGM16_WGMXCC1_WGMXCCGn1
    SolutionIndex: 48
    SolutionNameMin: Cijk_Alik_Bjlk_F8HS_BH_UserArgs_MT176x256x128_MI16x16x1_SN_GRVWA4_GRVWB16_GSU1_GSUC0_GSUWGMRR0_K1_LBSPPA128_LBSPPB4096_LPA32_LPB64_LRVW16_MIAV0_MIWT11_4_NLCB1_SU8_SUM0_SUS256_SVW1_VWA1_VWB4_WG16_16_1_WGM32_WGMXCC1_WGMXCCGn1
    SolutionIndex: 49
    SolutionNameMin: Cijk_Alik_Bjlk_F8HS_BH_UserArgs_MT256x256x64_MI16x16x1_SN_GRVWA4_GRVWB16_GSU1_GSUC0_GSUWGMRR0_K1_LBSPPA512_LBSPPB2048_LPA8_LPB0_LRVW8_MIWT8_8_NLCB1_SU8_SUM0_SUS256_SVW8_VWA8_VWB8_WG32_8_1_WGM48_WGMXCC1_WGMXCCGn1
    SolutionIndex: 50
    SolutionNameMin: Cijk_Alik_Bjlk_F8HS_BH_UserArgs_MT64x128x128_MI16x16x1_SN_GRVWA16_GRVWB16_GSU1_GSUC0_GSUWGMRR0_K1_LBSPPA512_LBSPPB2048_LPA32_LPB32_LRVW16_MIAV1_MIWT4_2_NTC3_NTD3_NLCB1_SU0_SUM0_SUS0_SVW4_VWA4_VWB2_WG16_16_1_WGM1_WGMXCC1_WGMXCCGn1
    SolutionIndex: 51
    SolutionNameMin: Cijk_Alik_Bjlk_F8HS_BH_UserArgs_MT64x256x64_MI16x16x1_SN_GRVWA16_GRVWB16_GSU1_GSUC0_GSUWGMRR0_K1_LBSPPA256_LBSPPB2048_LPA16_LPB64_LRVW8_MIAV1_MIWT4_4_NLCB1_SU8_SUM0_SUS256_SVW4_VWA4_VWB4_WG16_16_1_WGMn32_WGMXCC1_WGMXCCGn1
    SolutionIndex: 52
    SolutionNameMin: Cijk_Alik_Bjlk_F8HS_BH_UserArgs_MT128x128x64_MI32x32x1_SN_GRVWA16_GRVWB8_GSU3_GSUC0_GSUWGMRR0_K1_LBSPPA256_LBSPPB0_LPA16_LPB0_LRVW16_MIAV1_MIWT4_1_NTC0_NTD0_NLCB1_SU0_SUM0_SUS0_SVW4_VWA4_VWB1_WG32_8_1_WGM1_WGMXCC1_WGMXCCGn1
    SolutionIndex: 53
    SolutionNameMin: Cijk_Alik_Bjlk_F8HS_BH_UserArgs_MT128x256x128_MI16x16x1_SN_GRVWA16_GRVWB16_GSU1_GSUC0_GSUWGMRR0_K1_LBSPPA512_LBSPPB4096_LPA32_LPB0_LRVW16_MIAV0_MIWT4_8_NLCB1_SU8_SUM0_SUS256_SVW4_VWA4_VWB8_WG32_8_1_WGM1_WGMXCC1_WGMXCCGn1
    SolutionIndex: 54
    SolutionNameMin: Cijk_Alik_Bjlk_F8HS_BH_UserArgs_MT128x256x128_MI16x16x1_SN_GRVWA16_GRVWB16_GSU1_GSUC0_GSUWGMRR0_K1_LBSPPA1024_LBSPPB4096_LPA32_LPB64_LRVW16_MIAV0_MIWT8_4_NLCB1_SU8_SUM0_SUS256_SVW8_VWA8_VWB4_WG16_16_1_WGMn16_WGMXCC1_WGMXCCGn1
    SolutionIndex: 55
    SolutionNameMin: Cijk_Alik_Bjlk_F8HS_BH_UserArgs_MT128x256x64_MI16x16x1_SN_GRVWA16_GRVWB16_GSU1_GSUC0_GSUWGMRR0_K1_LBSPPA256_LBSPPB2048_LPA16_LPB0_LRVW8_MIAV0_MIWT4_8_NLCB1_SU8_SUM0_SUS256_SVW4_VWA4_VWB8_WG32_8_1_WGM32_WGMXCC1_WGMXCCGn1
    SolutionIndex: 56
    SolutionNameMin: Cijk_Alik_Bjlk_F8HS_BH_UserArgs_MT192x128x64_MI16x16x1_SN_GRVWA4_GRVWB16_GSU1_GSUC0_GSUWGMRR0_K1_LBSPPA256_LBSPPB1024_LPA8_LPB32_LRVW8_MIAV0_MIWT12_2_NLCB1_SU8_SUM0_SUS256_SVW4_VWA4_VWB2_WG16_16_1_WGM16_WGMXCC1_WGMXCCGn1
    SolutionIndex: 57
    SolutionNameMin: Cijk_Alik_Bjlk_F8HS_BH_UserArgs_MT64x128x64_MI16x16x1_SN_GRVWA4_GRVWB16_GSU1_GSUC0_GSUWGMRR0_K1_LBSPPA256_LBSPPB1024_LPA8_LPB32_LRVW8_MIAV1_MIWT4_2_NTC0_NTD0_NLCB1_SU0_SUM0_SUS0_SVW4_VWA4_VWB2_WG16_16_1_WGM1_WGMXCC1_WGMXCCGn1
    SolutionIndex: 58
    SolutionNameMin: Cijk_Alik_Bjlk_F8HS_BH_UserArgs_MT96x256x64_MI16x16x1_SN_GRVWA4_GRVWB16_GSU1_GSUC0_GSUWGMRR0_K1_LBSPPA128_LBSPPB2048_LPA8_LPB64_LRVW8_MIAV0_MIWT6_4_NLCB1_SU8_SUM0_SUS256_SVW2_VWA2_VWB4_WG16_16_1_WGM16_WGMXCC1_WGMXCCGn1
    SolutionIndex: 59
    SolutionNameMin: Cijk_Alik_Bjlk_F8HS_BH_UserArgs_MT256x256x64_MI16x16x1_SN_GRVWA16_GRVWB16_GSU1_GSUC0_GSUWGMRR0_K1_LBSPPA512_LBSPPB2048_LPA16_LPB0_LRVW8_MIAV0_MIWT8_8_NLCB1_SU8_SUM0_SUS256_SVW8_VWA8_VWB8_WG32_8_1_WGMn16_WGMXCC1_WGMXCCGn1
    SolutionIndex: 60
    SolutionNameMin: Cijk_Alik_Bjlk_F8HS_BH_UserArgs_MT128x256x64_MI16x16x1_SN_GRVWA4_GRVWB16_GSU2_GSUC0_GSUWGMRR0_K1_LBSPPA256_LBSPPB2048_LPA8_LPB0_LRVW8_MIAV0_MIWT4_8_NLCB1_SU8_SUM0_SUS256_SVW4_VWA4_VWB8_WG32_8_1_WGM16_WGMXCC1_WGMXCCGn1
    SolutionIndex: 61
    SolutionNameMin: Cijk_Alik_Bjlk_F8HS_BH_UserArgs_MT128x256x64_MI16x16x1_SN_GRVWA4_GRVWB16_GSU1_GSUC0_GSUWGMRR0_K1_LBSPPA256_LBSPPB2048_LPA8_LPB0_LRVW8_MIAV0_MIWT4_8_NLCB1_SU8_SUM0_SUS256_SVW4_VWA4_VWB8_WG32_8_1_WGM1_WGMXCC1_WGMXCCGn1
    SolutionIndex: 62
    SolutionNameMin: Cijk_Alik_Bjlk_F8HS_BH_UserArgs_MT176x256x64_MI16x16x1_SN_GRVWA4_GRVWB16_GSU1_GSUC0_GSUWGMRR0_K1_LBSPPA128_LBSPPB2048_LPA8_LPB64_LRVW8_MIAV0_MIWT11_4_NLCB1_SU8_SUM0_SUS256_SVW1_VWA1_VWB4_WG16_16_1_WGM48_WGMXCC1_WGMXCCGn1
    SolutionIndex: 63
    SolutionNameMin: Cijk_Alik_Bjlk_F8HS_BH_UserArgs_MT224x256x64_MI16x16x1_SN_GRVWA4_GRVWB16_GSU1_GSUC0_GSUWGMRR0_K1_LBSPPA128_LBSPPB2048_LPA8_LPB64_LRVW8_MIWT14_4_NLCB1_SU8_SUM0_SUS256_SVW2_VWA2_VWB4_WG16_16_1_WGM48_WGMXCC1_WGMXCCGn1
    SolutionIndex: 64
    SolutionNameMin: Cijk_Alik_Bjlk_F8HS_BH_UserArgs_MT176x256x64_MI16x16x1_SN_GRVWA4_GRVWB16_GSU3_GSUC0_GSUWGMRR0_K1_LBSPPA128_LBSPPB2048_LPA8_LPB64_LRVW8_MIAV0_MIWT11_4_NLCB1_SU8_SUM0_SUS256_SVW1_VWA1_VWB4_WG16_16_1_WGMn16_WGMXCC1_WGMXCCGn1
    SolutionIndex: 65
    SolutionNameMin: Cijk_Alik_Bjlk_F8HS_BH_UserArgs_MT224x256x128_MI16x16x1_SN_GRVWA4_GRVWB16_GSU1_GSUC0_GSUWGMRR0_K1_LBSPPA128_LBSPPB2048_LPA8_LPB0_LRVW8_MIAV0_MIWT7_8_NLCB1_SU8_SUM0_SUS256_SVW1_VWA1_VWB8_WG32_8_1_WGM32_WGMXCC1_WGMXCCGn1
    SolutionIndex: 66
    SolutionNameMin: Cijk_Alik_Bjlk_F8HS_BH_UserArgs_MT128x256x64_MI16x16x1_SN_GRVWA16_GRVWB16_GSU1_GSUC0_GSUWGMRR0_K1_LBSPPA512_LBSPPB2048_LPA16_LPB64_LRVW8_MIAV0_MIWT8_4_NLCB1_SU8_SUM0_SUS256_SVW8_VWA8_VWB4_WG16_16_1_WGM1_WGMXCC1_WGMXCCGn1
    SolutionIndex: 67
    SolutionNameMin: Cijk_Alik_Bjlk_F8HS_BH_UserArgs_MT256x256x64_MI16x16x1_SN_GRVWA4_GRVWB16_GSU1_GSUC0_GSUWGMRR0_K1_LBSPPA1024_LBSPPB2048_LPA8_LPB64_LRVW8_MIWT16_4_NLCB1_SU8_SUM0_SUS256_SVW16_VWA16_VWB4_WG16_16_1_WGM32_WGMXCC1_WGMXCCGn1
    SolutionIndex: 68
    SolutionNameMin: Cijk_Alik_Bjlk_F8HS_BH_UserArgs_MT256x256x64_MI16x16x1_SN_GRVWA4_GRVWB16_GSU1_GSUC0_GSUWGMRR0_K1_LBSPPA512_LBSPPB2048_LPA8_LPB0_LRVW8_MIWT8_8_NLCB1_SU8_SUM0_SUS256_SVW8_VWA8_VWB8_WG32_8_1_WGM16_WGMXCC1_WGMXCCGn1
    SolutionIndex: 69
    SolutionNameMin: Cijk_Alik_Bjlk_F8HS_BH_UserArgs_MT128x512x64_MI16x16x1_SN_GRVWA4_GRVWB16_GSU1_GSUC0_GSUWGMRR0_K1_LBSPPA512_LBSPPB4096_LPA8_LPB0_LRVW8_MIAV0_MIWT8_8_NLCB1_SU8_SUM0_SUS256_SVW8_VWA8_VWB8_WG16_16_1_WGM32_WGMXCC1_WGMXCCGn1
- - - [1024, 24576, 1, 3072]
    - [0, 839617.0]
  - - [8192, 8192, 1, 24576]
    - [1, 0.0]
  - - [3072, 1024, 1, 4096]
    - [2, 0.0]
  - - [4096, 3072, 1, 1024]
    - [3, 0.0]
  - - [8192, 24576, 1, 1024]
    - [4, 0.0]
  - - [1024, 8192, 1, 4096]
    - [5, 0.0]
  - - [1024, 24576, 1, 1024]
    - [6, 0.0]
  - - [3072, 4096, 1, 24576]
    - [7, 0.0]
  - - [3072, 24576, 1, 3072]
    - [8, 0.0]
  - - [1024, 8192, 1, 3072]
    - [9, 0.0]
  - - [4096, 8192, 1, 3072]
    - [10, 0.0]
  - - [8192, 8192, 1, 4096]
    - [11, 0.0]
  - - [3072, 1024, 1, 24576]
    - [12, 0.0]
  - - [4096, 3072, 1, 24576]
    - [7, 0.0]
  - - [8192, 3072, 1, 1024]
    - [13, 0.0]
  - - [8192, 1024, 1, 4096]
    - [14, 0.0]
  - - [1024, 1024, 1, 4096]
    - [15, 0.0]
  - - [3072, 24576, 1, 1024]
    - [16, 0.0]
  - - [1024, 3072, 1, 24576]
    - [12, 0.0]
  - - [8192, 1024, 1, 1024]
    - [17, 0.0]
  - - [8192, 3072, 1, 3072]
    - [18, 0.0]
  - - [4096, 24576, 1, 1024]
    - [19, 0.0]
  - - [1024, 1024, 1, 24576]
    - [20, 0.0]
  - - [4096, 24576, 1, 24576]
    - [21, 0.0]
  - - [4096, 3072, 1, 4096]
    - [22, 0.0]
  - - [4096, 1024, 1, 4096]
    - [23, 0.0]
  - - [8192, 3072, 1, 24576]
    - [24, 0.0]
  - - [3072, 4096, 1, 3072]
    - [25, 0.0]
  - - [8192, 4096, 1, 1024]
    - [26, 0.0]
  - - [8192, 4096, 1, 3072]
    - [27, 0.0]
  - - [1024, 4096, 1, 24576]
    - [28, 0.0]
  - - [4096, 4096, 1, 24576]
    - [29, 0.0]
  - - [1024, 4096, 1, 1024]
    - [30, 0.0]
  - - [3072, 3072, 1, 3072]
    - [31, 0.0]
  - - [4096, 1024, 1, 1024]
    - [32, 0.0]
  - - [8192, 4096, 1, 24576]
    - [33, 0.0]
  - - [1024, 1024, 1, 1024]
    - [34, 0.0]
  - - [3072, 1024, 1, 1024]
    - [35, 0.0]
  - - [1024, 3072, 1, 3072]
    - [36, 0.0]
  - - [8192, 1024, 1, 24576]
    - [37, 0.0]
  - - [8192, 24576, 1, 4096]
    - [38, 0.0]
  - - [4096, 24576, 1, 4096]
    - [39, 0.0]
  - - [1024, 24576, 1, 4096]
    - [40, 0.0]
  - - [3072, 8192, 1, 1024]
    - [41, 0.0]
  - - [4096, 1024, 1, 3072]
    - [42, 0.0]
  - - [3072, 8192, 1, 3072]
    - [43, 0.0]
  - - [4096, 4096, 1, 1024]
    - [44, 0.0]
  - - [1024, 8192, 1, 1024]
    - [45, 0.0]
  - - [1024, 4096, 1, 4096]
    - [46, 0.0]
  - - [3072, 24576, 1, 4096]
    - [38, 0.0]
  - - [4096, 4096, 1, 4096]
    - [47, 0.0]
  - - [3072, 8192, 1, 24576]
    - [48, 0.0]
  - - [3072, 24576, 1, 24576]
    - [49, 0.0]
  - - [3072, 1024, 1, 3072]
    - [50, 0.0]
  - - [8192, 1024, 1, 3072]
    - [51, 0.0]
  - - [1024, 4096, 1, 3072]
    - [46, 0.0]
  - - [1024, 3072, 1, 4096]
    - [52, 0.0]
  - - [4096, 24576, 1, 3072]
    - [38, 0.0]
  - - [3072, 3072, 1, 24576]
    - [53, 0.0]
  - - [3072, 3072, 1, 1024]
    - [31, 0.0]
  - - [8192, 3072, 1, 4096]
    - [54, 0.0]
  - - [4096, 8192, 1, 1024]
    - [55, 0.0]
  - - [3072, 4096, 1, 1024]
    - [56, 0.0]
  - - [1024, 3072, 1, 1024]
    - [57, 0.0]
  - - [3072, 4096, 1, 4096]
    - [58, 0.0]
  - - [8192, 4096, 1, 4096]
    - [59, 0.0]
  - - [1024, 8192, 1, 24576]
    - [60, 0.0]
  - - [3072, 8192, 1, 4096]
    - [43, 0.0]
  - - [3072, 3072, 1, 4096]
    - [61, 0.0]
  - - [1024, 24576, 1, 24576]
    - [62, 0.0]
  - - [8192, 24576, 1, 3072]
    - [38, 0.0]
  - - [8192, 24576, 1, 24576]
    - [63, 0.0]
  - - [4096, 1024, 1, 24576]
    - [64, 0.0]
  - - [1024, 1024, 1, 3072]
    - [15, 0.0]
  - - [4096, 8192, 1, 24576]
    - [65, 0.0]
  - - [4096, 4096, 1, 3072]
    - [66, 0.0]
  - - [4096, 3072, 1, 3072]
    - [22, 0.0]
  - - [8192, 8192, 1, 3072]
    - [67, 0.0]
  - - [8192, 8192, 1, 1024]
    - [68, 0.0]
  - - [4096, 8192, 1, 4096]
    - [69, 0.0]
- null
- null
- DeviceEfficiency
- Equality
