library/src/amd_detail/rocblaslt/src/Tensile/Logic/asm_full/aquavanjaram/gfx942/Equality/aquavanjaram_Cijk_Ailk_Bjlk_BBS_BH_Bias_HAS_SAV_UserArgs.yaml
- {MinimumRequiredVersion: 4.33.0}
- aquavanjaram
- gfx942
- [Device 0049, Device 0050]
    SolutionIndex: 0
    SolutionNameMin: Cijk_Ailk_Bjlk_BBS_BH_Bias_HAS_SAV_UserArgs_MT128x128x32_MI16x16x1_SN_GRVWA8_GRVWB8_GSU1_LBSPPA1024_LBSPPB1024_LPA0_LPB0_MIWT4_4_NLCA1_NLCB1_SU8_SUM0_SUS256_SVW4_VWA4_VWB4_WG32_8_1_WGM1_WGMXCC8_WGMXCCG0
    SolutionIndex: 1
    SolutionNameMin: Cijk_Ailk_Bjlk_BBS_BH_Bias_HAS_SAV_UserArgs_MT32x192x32_MI16x16x1_SN_GRVWA4_GRVWB8_GSU1_LBSPPA256_LBSPPB1536_LPA32_LPB16_MIWT2_3_NLCA1_NLCB3_SU8_SUM0_SUS256_SVW2_VWA2_VWB1_WG16_16_1_WGM38_WGMXCC4_WGMXCCG32
    SolutionIndex: 2
    SolutionNameMin: Cijk_Ailk_Bjlk_BBS_BH_Bias_HAS_SAV_UserArgs_MT256x224x32_MI16x16x1_SN_GRVWA8_GRVWB4_GSU2_LBSPPA2048_LBSPPB1792_LPA0_LPB32_MIWT4_14_NTC0_NTD0_NLCA1_NLCB7_SU8_SUM0_SUS256_SVW4_VWA4_VWB2_WSGRA0_WSGRB2_WG64_4_1_WGM304_WGMXCC8_WGMXCCG0
    SolutionIndex: 3
    SolutionNameMin: Cijk_Ailk_Bjlk_BBS_BH_Bias_HAS_SAV_UserArgs_MT128x192x64_MI16x16x1_SN_GRVWA8_GRVWB8_GSU32_LBSPPA1024_LBSPPB1536_LPA0_LPB32_MIWT4_6_NTC4_NTD4_NLCA1_NLCB3_SU8_SUM0_SUS256_SVW4_VWA4_VWB2_WSGRA0_WSGRB2_WG32_8_1_WGM32_WGMXCC32_WGMXCCG0
    SolutionIndex: 4
    SolutionNameMin: Cijk_Ailk_Bjlk_BBS_BH_Bias_HAS_SAV_UserArgs_MT128x128x64_MI16x16x1_SN_GRVWA8_GRVWB8_GSU32_LBSPPA1024_LBSPPB1024_LPA0_LPB0_MIWT4_4_NTC4_NTD0_NLCA1_NLCB1_SU8_SUM0_SUS256_SVW4_VWA4_VWB4_WSGRA2_WSGRB0_WG32_8_1_WGM4_WGMXCC8_WGMXCCG32
    SolutionIndex: 5
    SolutionNameMin: Cijk_Ailk_Bjlk_BBS_BH_Bias_HAS_SAV_UserArgs_MT128x128x64_MI16x16x1_SN_GRVWA8_GRVWB8_GSU38_LBSPPA1024_LBSPPB1024_LPA0_LPB0_MIWT4_4_NTC4_NTD0_NLCA1_NLCB1_SU8_SUM0_SUS256_SVW4_VWA4_VWB4_WSGRA0_WSGRB2_WG32_8_1_WGM8_WGMXCC8_WGMXCCG32
    SolutionIndex: 6
    SolutionNameMin: Cijk_Ailk_Bjlk_BBS_BH_Bias_HAS_SAV_UserArgs_MT128x128x64_MI16x16x1_SN_GRVWA8_GRVWB8_GSU38_LBSPPA1024_LBSPPB1024_LPA0_LPB0_MIWT4_4_NTC0_NTD0_NLCA1_NLCB1_SU8_SUM0_SUS256_SVW4_VWA4_VWB4_WSGRA2_WSGRB2_WG32_8_1_WGM1_WGMXCC4_WGMXCCG32
    SolutionIndex: 7
    SolutionNameMin: Cijk_Ailk_Bjlk_BBS_BH_Bias_HAS_SAV_UserArgs_MT192x192x64_MI16x16x1_SN_GSU1_MIWT6_6_NTA0_NTB0_NTC4_NTD4_SU8_SUM0_SUS256_ULSGRO0_WGM32_WGMXCC4_WGMXCCG0
    SolutionIndex: 8
    SolutionNameMin: Cijk_Ailk_Bjlk_BBS_BH_Bias_HAS_SAV_UserArgs_MT192x192x64_MI16x16x1_SN_GSU1_MIWT6_6_NTA0_NTB0_NTC0_NTD4_SU8_SUM0_SUS256_ULSGRO0_WGM8_WGMXCC1_WGMXCCG32
    SolutionIndex: 9
    SolutionNameMin: Cijk_Ailk_Bjlk_BBS_BH_Bias_HAS_SAV_UserArgs_MT192x192x32_MI16x16x1_SN_LDSB1_GRVWA8_GRVWB8_GSU1_K1_LBSPPA1536_LBSPPB1536_LPA32_LPB32_MIWT6_6_NTC4_NTD4_NLCA3_NLCB3_SU8_SUM0_SUS256_SVW2_ULSGRO1_VWA2_VWB2_WG32_8_1_WGM1_WGMXCC32_WGMXCCG0
    SolutionIndex: 10
    SolutionNameMin: Cijk_Ailk_Bjlk_BBS_BH_Bias_HAS_SAV_UserArgs_MT32x192x32_MI16x16x1_SN_LDSB0_GRVWA4_GRVWB8_GSU1_GSUC0_GSUWGMRR0_K1_LBSPPA256_LBSPPB1536_LPA32_LPB16_MIWT2_3_NTC0_NTD0_NEPBS0_NLCA1_NLCB3_SU8_SUM0_SUS256_SVW2_ULSGRO0_VWA2_VWB1_WSGRA0_WSGRB2_WG16_16_1_WGM8_WGMXCC8_WGMXCCG0
    SolutionIndex: 11
    SolutionNameMin: Cijk_Ailk_Bjlk_BBS_BH_Bias_HAS_SAV_UserArgs_MT128x128x32_MI16x16x1_SN_LDSB1_GRVWA8_GRVWB8_GSU1_GSUC0_GSUWGMRR0_K1_LBSPPA1024_LBSPPB1024_LPA0_LPB0_MIWT4_4_NTC0_NTD4_NEPBS0_NLCA1_NLCB1_SU8_SUM0_SUS256_SVW4_ULSGRO1_VWA4_VWB4_WSGRA0_WSGRB0_WG32_8_1_WGM8_WGMXCC8_WGMXCCG0
    SolutionIndex: 12
    SolutionNameMin: Cijk_Ailk_Bjlk_BBS_BH_Bias_HAS_SAV_UserArgs_MT128x128x32_MI16x16x1_SN_LDSB0_GRVWA8_GRVWB8_GSU32_GSUC1_GSUWGMRR1_K1_LBSPPA1024_LBSPPB1024_LPB0_MIWT4_4_NTC0_NTD4_NEPBS16_NLCB1_SU8_SUM0_SUS256_SVW4_ULSGRO1_VWA4_VWB4_WSGRA2_WG32_8_1_WGM4_WGMXCC8_WGMXCCG0
    SolutionIndex: 13
    SolutionNameMin: Cijk_Ailk_Bjlk_BBS_BH_Bias_HAS_SAV_UserArgs_MT192x192x64_MI16x16x1_SN_LDSB1_GRVWA8_GRVWB8_GSU1_GSUC0_GSUWGMRR0_K1_LBSPPA1536_LBSPPB1536_LPA32_LPB32_MIWT6_6_NTC4_NTD4_NEPBS0_NLCA3_NLCB3_SU8_SUM0_SUS256_SVW2_ULSGRO0_VWA2_VWB2_WSGRA0_WSGRB2_WG32_8_1_WGM8_WGMXCC8_WGMXCCG32
    SolutionIndex: 14
    SolutionNameMin: Cijk_Ailk_Bjlk_BBS_BH_Bias_HAS_SAV_UserArgs_MT192x192x32_MI16x16x1_SN_LDSB0_GRVWA8_GRVWB8_GSU1_GSUC0_GSUWGMRR0_K1_LBSPPA1536_LBSPPB1536_LPA32_LPB32_MIWT6_6_NTC0_NTD4_NEPBS0_NLCA3_NLCB3_SU8_SUM0_SUS256_SVW2_ULSGRO0_VWA2_VWB2_WSGRA2_WSGRB0_WG32_8_1_WGM8_WGMXCC8_WGMXCCG32
    SolutionIndex: 15
    SolutionNameMin: Cijk_Ailk_Bjlk_BBS_BH_Bias_HAS_SAV_UserArgs_MT256x256x32_MI16x16x1_SN_LDSB0_GRVWA8_GRVWB8_GSU1_GSUC0_GSUWGMRR0_K1_LBSPPA2048_LBSPPB2048_LPA0_LPB0_MIWT8_8_NTC0_NTD4_NEPBS0_NLCA1_NLCB1_SU8_SUM0_SUS256_SVW8_ULSGRO0_VWA8_VWB8_WSGRA0_WSGRB2_WG32_8_1_WGM8_WGMXCC8_WGMXCCG0
    SolutionIndex: 16
    SolutionNameMin: Cijk_Ailk_Bjlk_BBS_BH_Bias_HAS_SAV_UserArgs_MT256x256x32_MI16x16x1_SN_LDSB0_GRVWA8_GRVWB8_GSU1_GSUC0_GSUWGMRR0_K1_LBSPPA2048_LBSPPB2048_LPA0_LPB0_MIWT8_8_NTC4_NTD4_NEPBS0_NLCA1_NLCB1_SU8_SUM0_SUS256_SVW8_ULSGRO0_VWA8_VWB8_WSGRA2_WSGRB2_WG32_8_1_WGM8_WGMXCC8_WGMXCCG32
    SolutionIndex: 17
    SolutionNameMin: Cijk_Ailk_Bjlk_BBS_BH_Bias_AS_SAV_UserArgs_MT128x128x32_MI16x16x1_SN_LDSB0_GRVWA8_GRVWB8_GSU38_GSUC0_GSUWGMRR1_K1_LBSPPA1024_LBSPPB1024_LPA0_LPB0_MIWT4_4_NTC4_NEPBS16_NLCA1_NLCB1_SU8_SUM0_SUS256_SVW4_ULSGRO0_VWA4_VWB4_WSGRA0_WSGRB2_WG32_8_1_WGM8_WGMXCC8_WGMXCCG0
    SolutionIndex: 18
    SolutionNameMin: Cijk_Ailk_Bjlk_BBS_BH_Bias_AS_SAV_UserArgs_MT128x128x64_MI16x16x1_SN_GRVWA8_GRVWB8_GSU32_GSUC0_GSUWGMRR0_K1_LBSPPA1024_LBSPPB1024_LPA0_MIWT4_4_NTD4_NEPBS16_NLCA1_SU8_SUM0_SUS256_SVW4_ULSGRO1_VWA4_VWB4_WSGRA0_WG32_8_1_WGM4_WGMXCC8_WGMXCCG32
    SolutionIndex: 19
    SolutionNameMin: Cijk_Ailk_Bjlk_BBS_BH_Bias_AS_SAV_UserArgs_MT128x128x64_MI16x16x1_SN_LDSB1_GRVWA8_GRVWB8_GSU32_GSUC0_GSUWGMRR0_K1_LBSPPA1024_LBSPPB1024_LPA0_MIWT4_4_NTC0_NEPBS16_NLCA1_SU8_SUM0_SUS256_SVW4_ULSGRO1_VWA4_VWB4_WSGRA0_WSGRB0_WG32_8_1_WGM1_WGMXCC8_WGMXCCG32
    SolutionIndex: 20
    SolutionNameMin: Cijk_Ailk_Bjlk_BBS_BH_Bias_AS_SAV_UserArgs_MT128x128x64_MI16x16x1_SN_LDSB1_GRVWA8_GRVWB8_GSU32_GSUC0_GSUWGMRR0_K1_LBSPPA1024_LBSPPB1024_LPA0_MIWT4_4_NTC4_NEPBS0_NLCA1_SU8_SUM0_SUS256_SVW4_ULSGRO1_VWA4_VWB4_WSGRA0_WSGRB0_WG32_8_1_WGM8_WGMXCC8_WGMXCCG32
    SolutionIndex: 21
    SolutionNameMin: Cijk_Ailk_Bjlk_BBS_BH_Bias_AS_SAV_UserArgs_MT128x128x64_MI16x16x1_SN_GSU32_GSUC1_GSUWGMRR1_K1_MIWT4_4_SU8_SUM0_SUS256_ULSGRO1_WSGRA0_WSGRB2_WGM0_WGMXCC32_WGMXCCG0
    SolutionIndex: 22
    SolutionNameMin: Cijk_Ailk_Bjlk_BBS_BH_Bias_AS_SAV_UserArgs_MT128x128x32_MI16x16x1_SN_GRVWA8_GSU32_GSUC0_GSUWGMRR0_K1_LBSPPA1024_LBSPPB1024_LPA0_MIWT4_4_NEPBS16_NLCA1_SU8_SUM0_SUS256_SVW4_VWA4_VWB4_WG32_8_1_WGM4_WGMXCC8_WGMXCCG0
    SolutionIndex: 23
    SolutionNameMin: Cijk_Ailk_Bjlk_BBS_BH_Bias_AS_SAV_UserArgs_MT128x128x32_MI16x16x1_SN_LDSB0_GRVWA8_GRVWB8_GSU32_GSUC0_GSUWGMRR1_K1_LBSPPA1024_LBSPPB1024_LPA0_LPB0_MIWT4_4_NTC0_NEPBS0_NLCA1_NLCB1_SU8_SUM0_SUS256_SVW4_ULSGRO1_VWA4_VWB4_WSGRA0_WSGRB0_WG32_8_1_WGM4_WGMXCC8_WGMXCCG0
    SolutionIndex: 24
    SolutionNameMin: Cijk_Ailk_Bjlk_BBS_BH_Bias_AS_SAV_UserArgs_MT128x256x32_MI16x16x1_SN_LDSB1_GRVWA8_GRVWB8_GSU32_GSUC0_GSUWGMRR1_K1_LBSPPA1024_LBSPPB2048_LPA0_LPB0_MIWT4_8_NTC4_NEPBS16_NLCA1_NLCB1_SU8_SUM0_SUS256_SVW4_ULSGRO1_VWA4_VWB8_WSGRA0_WSGRB0_WG32_8_1_WGM4_WGMXCC8_WGMXCCG0
    SolutionIndex: 25
    SolutionNameMin: Cijk_Ailk_Bjlk_BBS_BH_Bias_AS_SAV_UserArgs_MT128x256x32_MI16x16x1_SN_LDSB1_GRVWA8_GRVWB8_GSU32_GSUC0_GSUWGMRR1_K1_LBSPPA1024_LBSPPB2048_LPA0_LPB0_MIWT4_8_NTC4_NEPBS16_NLCA1_NLCB1_SU8_SUM0_SUS256_SVW4_ULSGRO0_VWA4_VWB8_WSGRA2_WSGRB2_WG32_8_1_WGM4_WGMXCC8_WGMXCCG0
    SolutionIndex: 26
    SolutionNameMin: Cijk_Ailk_Bjlk_BBS_BH_Bias_AS_SAV_UserArgs_MT128x256x32_MI16x16x1_SN_LDSB0_GRVWA8_GRVWB8_GSU38_GSUC0_GSUWGMRR0_K1_LBSPPA1024_LBSPPB2048_LPA0_MIWT4_8_NTC4_NEPBS0_NLCA1_SU8_SUM0_SUS256_SVW4_ULSGRO1_VWA4_VWB8_WSGRA0_WG32_8_1_WGM8_WGMXCC8_WGMXCCG0
    SolutionIndex: 27
    SolutionNameMin: Cijk_Ailk_Bjlk_BBS_BH_Bias_AS_SAV_UserArgs_MT128x128x32_MI16x16x1_SN_GRVWA8_GRVWB8_GSU19_GSUC0_GSUWGMRR0_K1_LBSPPA1024_LBSPPB1024_LPA0_MIWT4_4_NTD0_NEPBS16_NLCA1_SU8_SUM0_SUS256_SVW4_ULSGRO1_VWA4_VWB4_WSGRA0_WG32_8_1_WGM4_WGMXCC8_WGMXCCG0
    SolutionIndex: 28
    SolutionNameMin: Cijk_Ailk_Bjlk_BBS_BH_Bias_AS_SAV_UserArgs_MT128x256x32_MI16x16x1_SN_LDSB1_GRVWA8_GRVWB8_GSU32_GSUC0_GSUWGMRR0_K1_LBSPPA1024_LBSPPB2048_LPA0_LPB0_MIWT4_8_NTC0_NEPBS0_NLCA1_NLCB1_SU8_SUM0_SUS256_SVW4_ULSGRO1_VWA4_VWB8_WSGRA2_WSGRB0_WG32_8_1_WGM4_WGMXCC8_WGMXCCG0
    SolutionIndex: 29
    SolutionNameMin: Cijk_Ailk_Bjlk_BBS_BH_Bias_AS_SAV_UserArgs_MT128x128x64_MI16x16x1_SN_LDSB1_GRVWA8_GSU12_GSUC0_GSUWGMRR1_K1_LBSPPA1024_LBSPPB1024_LPA0_MIWT4_4_NTC4_NEPBS0_NLCA1_SU8_SUM0_SUS256_SVW4_VWA4_VWB4_WG32_8_1_WGM8_WGMXCC8_WGMXCCG0
    SolutionIndex: 30
    SolutionNameMin: Cijk_Ailk_Bjlk_BBS_BH_Bias_AS_SAV_UserArgs_MT128x256x32_MI16x16x1_SN_LDSB1_GRVWA8_GRVWB8_GSU16_GSUC0_GSUWGMRR0_K1_LBSPPA1024_LBSPPB2048_LPA0_MIWT4_8_NTC0_NEPBS16_NLCA1_SU8_SUM0_SUS256_SVW4_ULSGRO1_VWA4_VWB8_WSGRA0_WSGRB2_WG32_8_1_WGM8_WGMXCC8_WGMXCCG0
    SolutionIndex: 31
    SolutionNameMin: Cijk_Ailk_Bjlk_BBS_BH_Bias_AS_SAV_UserArgs_MT128x256x32_MI16x16x1_SN_LDSB1_GRVWA8_GRVWB8_GSU16_GSUC0_GSUWGMRR0_K1_LBSPPA1024_LBSPPB2048_LPA0_MIWT4_8_NTC4_NEPBS16_NLCA1_SU8_SUM0_SUS256_SVW4_ULSGRO1_VWA4_VWB8_WSGRA0_WSGRB0_WG32_8_1_WGM4_WGMXCC8_WGMXCCG0
    SolutionIndex: 32
    SolutionNameMin: Cijk_Ailk_Bjlk_BBS_BH_Bias_AS_SAV_UserArgs_MT128x256x32_MI16x16x1_SN_LDSB0_GRVWA8_GRVWB8_GSU19_GSUC0_GSUWGMRR0_K1_LBSPPA1024_LBSPPB2048_LPA0_MIWT4_8_NTC4_NEPBS16_NLCA1_SU8_SUM0_SUS256_SVW4_ULSGRO1_VWA4_VWB8_WSGRA0_WSGRB0_WG32_8_1_WGM8_WGMXCC8_WGMXCCG0
    SolutionIndex: 33
    SolutionNameMin: Cijk_Ailk_Bjlk_BBS_BH_Bias_AS_SAV_UserArgs_MT128x128x64_MI16x16x1_SN_LDSB1_GRVWA8_GSU10_GSUC1_GSUWGMRR1_K1_LBSPPA1024_LBSPPB1024_LPA0_MIWT4_4_NTC0_NEPBS0_NLCA1_SU8_SUM0_SUS256_SVW4_VWA4_VWB4_WG32_8_1_WGM8_WGMXCC8_WGMXCCG304
    SolutionIndex: 34
    SolutionNameMin: Cijk_Ailk_Bjlk_BBS_BH_Bias_AS_SAV_UserArgs_MT128x128x64_MI16x16x1_SN_LDSB1_GRVWA8_GSU9_GSUC1_GSUWGMRR1_K1_LBSPPA1024_LBSPPB1024_LPA0_MIWT4_4_NTC0_NEPBS16_NLCA1_SU8_SUM0_SUS256_SVW4_VWA4_VWB4_WG32_8_1_WGM8_WGMXCC8_WGMXCCG0
    SolutionIndex: 35
    SolutionNameMin: Cijk_Ailk_Bjlk_BBS_BH_Bias_AS_SAV_UserArgs_MT256x256x32_MI16x16x1_SN_LDSB0_GRVWB8_GSU1_GSUC0_GSUWGMRR0_K1_LBSPPA2048_LBSPPB2048_LPB0_MIWT8_8_NTC0_NEPBS0_NLCB1_SU8_SUM0_SUS256_SVW8_VWA8_VWB8_WSGRA2_WG32_8_1_WGM4_WGMXCC1_WGMXCCG32
    SolutionIndex: 36
    SolutionNameMin: Cijk_Ailk_Bjlk_BBS_BH_Bias_HAS_SAV_UserArgs_MT192x192x64_MI16x16x1_SN_LDSB1_GRVWB8_GSU2_GSUC1_GSUWGMRR0_K1_LBSPPA1536_LBSPPB1536_LPA32_LPB32_MIWT6_6_NTC0_NEPBS16_NLCA3_NLCB3_SU8_SUM0_SUS256_SVW2_VWA2_VWB2_WSGRA0_WG32_8_1_WGM4_WGMXCC8_WGMXCCG304
    SolutionIndex: 37
    SolutionNameMin: Cijk_Ailk_Bjlk_BBS_BH_Bias_HAS_SAV_UserArgs_MT128x128x64_MI16x16x1_SN_LDSB0_GRVWA8_GSU38_GSUC1_GSUWGMRR1_K1_LBSPPA1024_LBSPPB1024_LPA0_LPB0_MIWT4_4_NTC4_NEPBS16_NLCA1_NLCB1_SU8_SUM0_SUS256_SVW4_VWA4_VWB4_WSGRA2_WSGRB2_WG32_8_1_WGM4_WGMXCC8_WGMXCCG0
    SolutionIndex: 38
    SolutionNameMin: Cijk_Ailk_Bjlk_BBS_BH_Bias_HAS_SAV_UserArgs_MT128x128x64_MI16x16x1_SN_GSU38_GSUC1_GSUWGMRR1_K1_LPA0_LPB0_MIWT4_4_NTD0_NEPBS16_SU8_SUM0_SUS256_SVW4_ULSGRO1_VWA4_VWB4_WSGRA2_WSGRB0_WGM4_WGMXCC8_WGMXCCG32
    SolutionIndex: 39
    SolutionNameMin: Cijk_Ailk_Bjlk_BBS_BH_Bias_HAS_SAV_UserArgs_MT128x128x64_MI16x16x1_SN_LDSB1_GSU38_GSUC1_GSUWGMRR1_K1_LPA0_LPB0_MIWT4_4_NTD0_NEPBS0_SU8_SUM0_SUS256_SVW4_ULSGRO1_VWA4_VWB4_WSGRA2_WSGRB0_WGM4_WGMXCC8_WGMXCCG0
    SolutionIndex: 40
    SolutionNameMin: Cijk_Ailk_Bjlk_BBS_BH_Bias_HAS_SAV_UserArgs_MT128x128x64_MI16x16x1_SN_GRVWA8_GRVWB8_GSU32_GSUC1_GSUWGMRR1_K1_LPA0_LPB0_MIWT4_4_SU8_SUM0_SUS256_SVW4_VWA4_VWB4_WGM8_WGMXCC8_WGMXCCG304
    SolutionIndex: 41
    SolutionNameMin: Cijk_Ailk_Bjlk_BBS_BH_Bias_HAS_SAV_UserArgs_MT128x128x64_MI16x16x1_SN_LDSB1_GSU38_GSUC1_GSUWGMRR1_K1_LBSPPA1024_LBSPPB1024_LPA0_LPB0_MIWT4_4_NTC4_NEPBS0_NLCA1_NLCB1_SU8_SUM0_SUS256_SVW4_VWA4_VWB4_WSGRA2_WSGRB0_WGM4_WGMXCC8_WGMXCCG304
    SolutionIndex: 42
    SolutionNameMin: Cijk_Ailk_Bjlk_BBS_BH_Bias_HAS_SAV_UserArgs_MT128x128x64_MI16x16x1_SN_LDSB0_GSU38_GSUC1_GSUWGMRR1_K1_LBSPPA1024_LBSPPB1024_LPA0_LPB0_MIWT4_4_NTC4_NEPBS16_NLCA1_NLCB1_SU8_SUM0_SUS256_SVW4_VWA4_VWB4_WSGRA0_WSGRB2_WGM8_WGMXCC8_WGMXCCG304
    SolutionIndex: 43
    SolutionNameMin: Cijk_Ailk_Bjlk_BBS_BH_Bias_HAS_SAV_UserArgs_MT128x128x64_MI16x16x1_SN_LDSB0_GSU38_GSUC1_GSUWGMRR1_K1_LBSPPA1024_LBSPPB1024_LPA0_LPB0_MIWT4_4_NTC4_NEPBS0_NLCA1_NLCB1_SU8_SUM0_SUS256_SVW4_VWA4_VWB4_WSGRA2_WSGRB0_WGM32_WGMXCC8_WGMXCCG304
    SolutionIndex: 44
    SolutionNameMin: Cijk_Ailk_Bjlk_BBS_BH_Bias_HAS_SAV_UserArgs_MT128x128x64_MI16x16x1_SN_GSU32_GSUC0_GSUWGMRR1_K1_LPA0_LPB0_MIWT4_4_NTD4_NEPBS16_SU8_SUM0_SUS256_SVW4_ULSGRO0_VWA4_VWB4_WSGRA2_WGM4_WGMXCC8_WGMXCCG0
    SolutionIndex: 45
    SolutionNameMin: Cijk_Ailk_Bjlk_BBS_BH_Bias_HAS_SAV_UserArgs_MT128x128x64_MI16x16x1_SN_LDSB1_GSU32_GSUC1_GSUWGMRR1_K1_LPA0_LPB0_MIWT4_4_NTD0_NEPBS16_SU8_SUM0_SUS256_SVW4_ULSGRO0_VWA4_VWB4_WSGRA2_WSGRB0_WGM1_WGMXCC8_WGMXCCG0
    SolutionIndex: 46
    SolutionNameMin: Cijk_Ailk_Bjlk_BBS_BH_Bias_HAS_SAV_UserArgs_MT128x128x64_MI16x16x1_SN_GSU32_GSUC0_GSUWGMRR0_K1_LPA0_LPB0_MIWT4_4_NTD4_NEPBS0_SU8_SUM0_SUS256_SVW4_ULSGRO0_VWA4_VWB4_WSGRA2_WSGRB0_WGM8_WGMXCC8_WGMXCCG32
    SolutionIndex: 47
    SolutionNameMin: Cijk_Ailk_Bjlk_BBS_BH_Bias_HAS_SAV_UserArgs_MT128x128x64_MI16x16x1_SN_GSU38_GSUC0_GSUWGMRR1_K1_LPA0_LPB0_MIWT4_4_NTD0_NEPBS16_SU8_SUM0_SUS256_SVW4_ULSGRO1_VWA4_VWB4_WSGRA2_WSGRB0_WGM1_WGMXCC8_WGMXCCG0
    SolutionIndex: 48
    SolutionNameMin: Cijk_Ailk_Bjlk_BBS_BH_Bias_HAS_SAV_UserArgs_MT128x128x64_MI16x16x1_SN_GSU32_GSUC1_GSUWGMRR1_K1_LPA0_LPB0_MIWT4_4_NTD4_NEPBS0_SU8_SUM0_SUS256_SVW4_ULSGRO0_VWA4_VWB4_WSGRA0_WSGRB2_WGM0_WGMXCC8_WGMXCCGn1
    SolutionIndex: 49
    SolutionNameMin: Cijk_Ailk_Bjlk_BBS_BH_Bias_HAS_SAV_UserArgs_MT128x128x64_MI16x16x1_SN_GSU38_GSUC1_GSUWGMRR1_K1_LPA0_LPB0_MIWT4_4_NTD0_NEPBS0_SU8_SUM0_SUS256_SVW4_ULSGRO0_VWA4_VWB4_WSGRA2_WSGRB2_WGM1_WGMXCC8_WGMXCCG0
    SolutionIndex: 50
    SolutionNameMin: Cijk_Ailk_Bjlk_BBS_BH_Bias_HAS_SAV_UserArgs_MT128x128x64_MI16x16x1_SN_LDSB1_GSU38_GSUC0_GSUWGMRR1_K1_LPA0_LPB0_MIWT4_4_NTD4_NEPBS0_SU8_SUM0_SUS256_SVW4_ULSGRO1_VWA4_VWB4_WSGRA0_WSGRB0_WGM1_WGMXCC8_WGMXCCG0
    SolutionIndex: 51
    SolutionNameMin: Cijk_Ailk_Bjlk_BBS_BH_Bias_HAS_SAV_UserArgs_MT128x128x64_MI16x16x1_SN_GSU38_GSUC1_GSUWGMRR1_K1_LPA0_LPB0_MIWT4_4_NTD4_NEPBS16_SU8_SUM0_SUS256_SVW4_ULSGRO1_VWA4_VWB4_WSGRA0_WGM8_WGMXCC8_WGMXCCG0
    SolutionIndex: 52
    SolutionNameMin: Cijk_Ailk_Bjlk_BBS_BH_Bias_HAS_SAV_UserArgs_MT128x128x64_MI16x16x1_SN_LDSB0_GSU38_GSUC1_GSUWGMRR1_K1_LPA0_LPB0_MIWT4_4_NTD0_NEPBS0_SU8_SUM0_SUS256_SVW4_ULSGRO0_VWA4_VWB4_WSGRA0_WSGRB2_WGM1_WGMXCC8_WGMXCCG304
    SolutionIndex: 53
    SolutionNameMin: Cijk_Ailk_Bjlk_BBS_BH_Bias_HAS_SAV_UserArgs_MT128x128x64_MI16x16x1_SN_GSU38_GSUC1_GSUWGMRR1_K1_LPA0_LPB0_MIWT4_4_NTD4_NEPBS16_SU8_SUM0_SUS256_SVW4_ULSGRO1_VWA4_VWB4_WSGRA2_WGM1_WGMXCC8_WGMXCCG304
    SolutionIndex: 54
    SolutionNameMin: Cijk_Ailk_Bjlk_BBS_BH_Bias_HAS_SAV_UserArgs_MT128x256x32_MI16x16x1_SN_GSU19_GSUC1_GSUWGMRR1_K1_LPA0_LPB0_MIWT4_8_NTD0_NEPBS16_SU8_SUM0_SUS256_SVW4_ULSGRO1_VWA4_VWB8_WSGRA2_WGM8_WGMXCC8_WGMXCCG0
    SolutionIndex: 55
    SolutionNameMin: Cijk_Ailk_Bjlk_BBS_BH_Bias_HAS_SAV_UserArgs_MT128x256x32_MI16x16x1_SN_GSU19_GSUC1_GSUWGMRR0_K1_LPA0_LPB0_MIWT4_8_NTD4_NEPBS0_SU8_SUM0_SUS256_SVW4_ULSGRO1_VWA4_VWB8_WSGRA2_WGM4_WGMXCC8_WGMXCCG304
- - - [32, 192, 1792, 6514]
    - [1, 0.0]
  - - [384, 200, 1792, 128]
    - [0, 0.0]
  - - [6514, 641, 1, 344064]
    - [2, 0.0]
  - - [384, 384, 1, 358400]
    - [3, 0.0]
  - - [264, 384, 1, 344064]
    - [4, 0.0]
  - - [384, 128, 1, 358400]
    - [5, 0.0]
  - - [128, 384, 1, 358400]
    - [6, 0.0]
  - - [4800, 2304, 1, 1024]
    - [7, 0.0]
  - - [2304, 4800, 1, 1024]
    - [8, 0.0]
  - - [4800, 24576, 1, 1024]
    - [9, 0.0]
  - - [32, 192, 2048, 6514]
    - [10, 0.0]
  - - [264, 384, 1, 393216]
    - [40, 0.0]
  - - [384, 200, 2048, 128]
    - [11, 0.0]
  - - [384, 384, 1, 409600]
    - [12, 0.0]
  - - [2304, 4800, 1, 2048]
    - [13, 0.0]
  - - [4800, 2304, 1, 2048]
    - [14, 0.0]
  - - [4800, 24576, 1, 2048]
    - [15, 0.0]
  - - [6514, 641, 1, 393216]
    - [36, 0.0]
  - - [49152, 256, 1, 2048]
    - [35, 0.0]
  - - [208448, 2048, 1, 2048]
    - [16, 0.0]
  - - [256, 256, 1, 180727]
    - [48, 0.0]
  - - [256, 256, 1, 181557]
    - [17, 0.0]
  - - [256, 256, 1, 331051]
    - [38, 0.0]
  - - [256, 256, 1, 365802]
    - [47, 0.0]
  - - [256, 256, 1, 395225]
    - [51, 0.0]
  - - [256, 256, 1, 401179]
    - [53, 0.0]
  - - [256, 384, 1, 120433]
    - [42, 0.0]
  - - [256, 384, 1, 133221]
    - [41, 0.0]
  - - [256, 384, 1, 141098]
    - [43, 0.0]
  - - [256, 384, 1, 180727]
    - [44, 0.0]
  - - [256, 384, 1, 181557]
    - [46, 0.0]
  - - [256, 384, 1, 331051]
    - [18, 0.0]
  - - [256, 384, 1, 365802]
    - [19, 0.0]
  - - [256, 384, 1, 395225]
    - [20, 0.0]
  - - [256, 384, 1, 401179]
    - [21, 0.0]
  - - [512, 256, 1, 133221]
    - [22, 0.0]
  - - [512, 256, 1, 141098]
    - [37, 0.0]
  - - [512, 256, 1, 180727]
    - [45, 0.0]
  - - [512, 256, 1, 181557]
    - [23, 0.0]
  - - [512, 256, 1, 331051]
    - [49, 0.0]
  - - [512, 256, 1, 365802]
    - [52, 0.0]
  - - [512, 256, 1, 395225]
    - [50, 0.0]
  - - [512, 256, 1, 401179]
    - [39, 0.0]
  - - [512, 512, 1, 365802]
    - [24, 0.0]
  - - [512, 512, 1, 401179]
    - [25, 0.0]
  - - [768, 256, 1, 133221]
    - [26, 0.0]
  - - [1024, 256, 1, 180727]
    - [27, 0.0]
  - - [1024, 256, 1, 395225]
    - [28, 0.0]
  - - [640, 512, 1, 181557]
    - [54, 0.0]
  - - [768, 512, 1, 133221]
    - [29, 0.0]
  - - [1024, 512, 1, 180727]
    - [30, 0.0]
  - - [1024, 512, 1, 395225]
    - [31, 0.0]
  - - [1536, 256, 1, 331051]
    - [55, 0.0]
  - - [1664, 256, 1, 141098]
    - [32, 0.0]
  - - [1536, 512, 1, 331051]
    - [33, 0.0]
  - - [1664, 512, 1, 141098]
    - [34, 0.0]
- null
- null
- DeviceEfficiency
- Equality
