library/src/amd_detail/rocblaslt/src/Tensile/Logic/asm_full/aquavanjaram/gfx942/Equality/aquavanjaram_Cijk_Ailk_Bjlk_F8B8HS_BH_UserArgs.yaml
- {MinimumRequiredVersion: 4.33.0}
- aquavanjaram
- gfx942
- [Device 0049, Device 0050]
    SolutionIndex: 0
    SolutionNameMin: Cijk_Ailk_Bjlk_F8B8HS_BH_UserArgs_MT256x256x128_MI16x16x1_SN_LDSB1_CLR1_GRVWB16_GSU1_GSUC0_GSUWGMRR0_GLS0_K1_LBSPPA2048_LBSPPB2048_LPA0_LPB0_MIAV0_MIWT8_8_NTC4_NTD4_NLCA1_NLCB1_PLR1_SU32_SUM0_SUS256_SPO1_SSO4_SVW8_VWA8_VWB8_WG32_8_1_WGM48_WGMXCC1_WGMXCCGn1
    SolutionIndex: 1
    SolutionNameMin: Cijk_Ailk_Bjlk_F8B8HS_BH_UserArgs_MT256x128x64_MI16x16x1_SN_LDSB1_CLR1_GRVWB16_GSU1_GSUC0_GSUWGMRR0_GLS0_K1_LBSPPA2048_LBSPPB1024_LPA0_LPB64_MIAV0_MIWT8_4_NTC4_NTD4_NLCA1_NLCB1_PLR1_SU32_SUM0_SUS256_SPO1_SSO4_SVW8_VWA8_VWB4_WG32_8_1_WGM32_WGMXCC1_WGMXCCGn1
    SolutionIndex: 2
    SolutionNameMin: Cijk_Ailk_Bjlk_F8B8HS_BH_UserArgs_MT128x256x64_MI16x16x1_SN_LDSB1_CLR1_GRVWB16_GSU1_GSUC0_GSUWGMRR0_GLS0_K1_LBSPPA1024_LBSPPB2048_LPA64_LPB0_MIAV0_MIWT4_8_NTC4_NTD4_NLCA1_NLCB1_PLR1_SU32_SUM0_SUS256_SPO1_SSO4_SVW4_VWA4_VWB8_WG32_8_1_WGM16_WGMXCC1_WGMXCCGn1
    SolutionIndex: 3
    SolutionNameMin: Cijk_Ailk_Bjlk_F8B8HS_BH_UserArgs_MT128x384x64_MI16x16x1_SN_LDSB1_CLR1_GRVWB16_GSU1_GSUC0_GSUWGMRR0_GLS0_K1_LBSPPA1024_LBSPPB3072_LPA0_LPB32_MIAV0_MIWT8_6_NTC4_NTD4_NLCA1_NLCB3_PLR1_SU32_SUM0_SUS256_SPO1_SSO4_SVW8_VWA8_VWB2_WG16_16_1_WGM48_WGMXCC1_WGMXCCGn1
    SolutionIndex: 4
    SolutionNameMin: Cijk_Ailk_Bjlk_F8B8HS_BH_UserArgs_MT128x256x64_MI16x16x1_SN_LDSB1_CLR1_GRVWB16_GSU1_GSUC0_GSUWGMRR0_GLS0_K1_LBSPPA1024_LBSPPB2048_LPA64_LPB0_MIAV0_MIWT4_8_NTC4_NTD4_NLCA1_NLCB1_PLR1_SU32_SUM0_SUS256_SPO1_SSO4_SVW4_VWA4_VWB8_WG32_8_1_WGM1_WGMXCC1_WGMXCCGn1
    SolutionIndex: 5
    SolutionNameMin: Cijk_Ailk_Bjlk_F8B8HS_BH_UserArgs_MT128x384x64_MI16x16x1_SN_LDSB1_CLR1_GRVWB16_GSU1_GSUC0_GSUWGMRR0_GLS0_K1_LBSPPA1024_LBSPPB3072_LPA0_LPB32_MIAV0_MIWT8_6_NTC4_NTD4_NLCA1_NLCB3_PLR1_SU32_SUM0_SUS256_SPO1_SSO4_SVW8_VWA8_VWB2_WG16_16_1_WGMn16_WGMXCC1_WGMXCCGn1
    SolutionIndex: 6
    SolutionNameMin: Cijk_Ailk_Bjlk_F8B8HS_BH_UserArgs_MT128x256x128_MI16x16x1_SN_LDSB1_CLR1_GRVWB16_GSU1_GSUC0_GSUWGMRR0_GLS0_K1_LBSPPA1024_LBSPPB2048_LPA64_LPB0_MIAV0_MIWT4_8_NTC4_NTD4_NLCA1_NLCB1_PLR1_SU32_SUM0_SUS256_SPO1_SSO4_SVW4_VWA4_VWB8_WG32_8_1_WGM1_WGMXCC1_WGMXCCGn1
    SolutionIndex: 7
    SolutionNameMin: Cijk_Ailk_Bjlk_F8B8HS_BH_UserArgs_MT256x128x64_MI16x16x1_SN_LDSB1_CLR1_GRVWB16_GSU1_GSUC0_GSUWGMRR0_GLS0_K1_LBSPPA2048_LBSPPB1024_LPA64_LPB0_MIAV0_MIWT4_8_NTC4_NTD4_NLCA1_NLCB1_PLR1_SU32_SUM0_SUS256_SPO1_SSO4_SVW4_VWA4_VWB8_WG64_4_1_WGMn16_WGMXCC1_WGMXCCGn1
    SolutionIndex: 8
    SolutionNameMin: Cijk_Ailk_Bjlk_F8B8HS_BH_UserArgs_MT256x128x64_MI16x16x1_SN_LDSB1_CLR1_GRVWB16_GSU1_GSUC0_GSUWGMRR0_GLS0_K1_LBSPPA2048_LBSPPB1024_LPA0_LPB64_MIAV0_MIWT8_4_NTC4_NTD4_NLCA1_NLCB1_PLR1_SU32_SUM0_SUS256_SPO1_SSO4_SVW8_VWA8_VWB4_WG32_8_1_WGM16_WGMXCC1_WGMXCCGn1
    SolutionIndex: 9
    SolutionNameMin: Cijk_Ailk_Bjlk_F8B8HS_BH_UserArgs_MT256x128x128_MI16x16x1_SN_LDSB1_CLR1_GRVWB16_GSU3_GSUC0_GSUWGMRR0_GLS0_K1_LBSPPA2048_LBSPPB1024_LPA64_LPB0_MIAV0_MIWT4_8_NTC3_NTD3_NLCA1_NLCB1_PLR1_SU0_SUM0_SUS0_SPO0_SSO0_SVW4_VWA4_VWB8_WG64_4_1_WGM1_WGMXCC1_WGMXCCGn1
    SolutionIndex: 10
    SolutionNameMin: Cijk_Ailk_Bjlk_F8B8HS_BH_UserArgs_MT128x256x64_MI16x16x1_SN_LDSB1_CLR1_GRVWB16_GSU1_GSUC0_GSUWGMRR0_GLS0_K1_LBSPPA1024_LBSPPB2048_LPA64_LPB0_MIAV0_MIWT4_8_NTC4_NTD4_NLCA1_NLCB1_PLR1_SU32_SUM0_SUS256_SPO1_SSO4_SVW4_VWA4_VWB8_WG32_8_1_WGM32_WGMXCC1_WGMXCCGn1
    SolutionIndex: 11
    SolutionNameMin: Cijk_Ailk_Bjlk_F8B8HS_BH_UserArgs_MT256x256x128_MI16x16x1_SN_LDSB1_CLR1_GRVWB16_GSU1_GSUC0_GSUWGMRR0_GLS0_K1_LBSPPA2048_LBSPPB2048_LPA0_LPB0_MIAV0_MIWT8_8_NTC4_NTD4_NLCA1_NLCB1_PLR1_SU32_SUM0_SUS256_SPO1_SSO4_SVW8_VWA8_VWB8_WG32_8_1_WGM16_WGMXCC1_WGMXCCGn1
    SolutionIndex: 12
    SolutionNameMin: Cijk_Ailk_Bjlk_F8B8HS_BH_UserArgs_MT256x128x64_MI16x16x1_SN_LDSB1_CLR1_GRVWB16_GSU1_GSUC0_GSUWGMRR0_GLS0_K1_LBSPPA2048_LBSPPB1024_LPA64_LPB0_MIAV0_MIWT4_8_NTC4_NTD4_NLCA1_NLCB1_PLR1_SU32_SUM0_SUS256_SPO1_SSO4_SVW4_VWA4_VWB8_WG64_4_1_WGM48_WGMXCC1_WGMXCCGn1
    SolutionIndex: 13
    SolutionNameMin: Cijk_Ailk_Bjlk_F8B8HS_BH_UserArgs_MT128x512x64_MI16x16x1_SN_LDSB1_CLR1_GRVWB16_GSU1_GSUC0_GSUWGMRR0_GLS0_K1_LBSPPA1024_LBSPPB4096_LPA0_LPB0_MIAV0_MIWT8_8_NTC4_NTD4_NLCA1_NLCB1_PLR1_SU32_SUM0_SUS256_SPO1_SSO4_SVW8_VWA8_VWB8_WG16_16_1_WGM16_WGMXCC1_WGMXCCGn1
    SolutionIndex: 14
    SolutionNameMin: Cijk_Ailk_Bjlk_F8B8HS_BH_UserArgs_MT128x512x64_MI16x16x1_SN_LDSB1_CLR1_GRVWB16_GSU1_GSUC0_GSUWGMRR0_GLS0_K1_LBSPPA1024_LBSPPB4096_LPA0_LPB0_MIAV0_MIWT8_8_NTC4_NTD4_NLCA1_NLCB1_PLR1_SU32_SUM0_SUS256_SPO1_SSO4_SVW8_VWA8_VWB8_WG16_16_1_WGMn16_WGMXCC1_WGMXCCGn1
    SolutionIndex: 15
    SolutionNameMin: Cijk_Ailk_Bjlk_F8B8HS_BH_UserArgs_MT128x256x64_MI16x16x1_SN_LDSB1_CLR1_GRVWB16_GSU1_GSUC0_GSUWGMRR0_GLS0_K1_LBSPPA1024_LBSPPB2048_LPA64_LPB0_MIAV0_MIWT4_8_NTC4_NTD4_NLCA1_NLCB1_PLR1_SU32_SUM0_SUS256_SPO1_SSO4_SVW4_VWA4_VWB8_WG32_8_1_WGMn16_WGMXCC1_WGMXCCGn1
    SolutionIndex: 16
    SolutionNameMin: Cijk_Ailk_Bjlk_F8B8HS_BH_UserArgs_MT256x128x128_MI16x16x1_SN_LDSB1_CLR1_GRVWB16_GSU3_GSUC0_GSUWGMRR0_GLS0_K1_LBSPPA2048_LBSPPB1024_LPA64_LPB0_MIAV0_MIWT4_8_NTC0_NTD0_NLCA1_NLCB1_PLR1_SU0_SUM0_SUS0_SPO0_SSO0_SVW4_VWA4_VWB8_WG64_4_1_WGM1_WGMXCC1_WGMXCCGn1
    SolutionIndex: 17
    SolutionNameMin: Cijk_Ailk_Bjlk_F8B8HS_BH_UserArgs_MT192x256x64_MI16x16x1_SN_LDSB1_CLR1_GRVWB16_GSU1_GSUC0_GSUWGMRR0_GLS0_K1_LBSPPA1536_LBSPPB2048_LPA32_LPB0_MIAV0_MIWT6_8_NTC4_NTD4_NLCA3_NLCB1_PLR1_SU32_SUM0_SUS256_SPO1_SSO4_SVW2_VWA2_VWB8_WG32_8_1_WGMn16_WGMXCC1_WGMXCCGn1
    SolutionIndex: 18
    SolutionNameMin: Cijk_Ailk_Bjlk_F8B8HS_BH_UserArgs_MT64x64x128_MI16x16x1_SN_LDSB1_CLR1_GRVWB16_GSU1_GSUC0_GSUWGMRR0_GLS0_K1_LBSPPA512_LBSPPB512_LPA64_LPB32_MIAV1_MIWT4_2_NTC3_NTD3_NLCA1_NLCB1_PLR1_SU0_SUM0_SUS0_SPO0_SSO0_SVW4_VWA4_VWB2_WG16_8_2_WGM1_WGMXCC1_WGMXCCGn1
    SolutionIndex: 19
    SolutionNameMin: Cijk_Ailk_Bjlk_F8B8HS_BH_UserArgs_MT128x256x64_MI16x16x1_SN_LDSB1_CLR1_GRVWB16_GSU4_GSUC0_GSUWGMRR0_GLS0_K1_LBSPPA1024_LBSPPB2048_LPA64_LPB0_MIAV0_MIWT4_8_NTC4_NTD4_NLCA1_NLCB1_PLR1_SU32_SUM0_SUS256_SPO1_SSO4_SVW4_VWA4_VWB8_WG32_8_1_WGM1_WGMXCC1_WGMXCCGn1
    SolutionIndex: 20
    SolutionNameMin: Cijk_Ailk_Bjlk_F8B8HS_BH_UserArgs_MT256x256x128_MI16x16x1_SN_LDSB1_CLR1_GRVWB16_GSU1_GSUC0_GSUWGMRR0_GLS0_K1_LBSPPA2048_LBSPPB2048_LPA0_LPB0_MIAV0_MIWT8_8_NTC4_NTD4_NLCA1_NLCB1_PLR1_SU32_SUM0_SUS256_SPO1_SSO4_SVW8_VWA8_VWB8_WG32_8_1_WGMn32_WGMXCC1_WGMXCCGn1
    SolutionIndex: 21
    SolutionNameMin: Cijk_Ailk_Bjlk_F8B8HS_BH_UserArgs_MT256x256x64_MI16x16x1_SN_LDSB1_CLR1_GRVWB16_GSU1_GSUC0_GSUWGMRR0_GLS0_K1_LBSPPA2048_LBSPPB2048_LPA0_LPB0_MIAV0_MIWT8_8_NTC4_NTD4_NLCA1_NLCB1_PLR1_SU32_SUM0_SUS256_SPO1_SSO4_SVW8_VWA8_VWB8_WG32_8_1_WGMn32_WGMXCC1_WGMXCCGn1
    SolutionIndex: 22
    SolutionNameMin: Cijk_Ailk_Bjlk_F8B8HS_BH_UserArgs_MT256x128x128_MI32x32x1_SN_LDSB1_CLR1_GRVWB8_GSU9_GSUC0_GSUWGMRR0_GLS0_K1_LBSPPA0_LBSPPB0_LPA0_LPB0_MIAV0_MIWT2_4_NTC0_NTD0_NLCA1_NLCB1_PLR1_SU0_SUM0_SUS0_SPO0_SSO0_SVW2_VWA2_VWB4_WG128_2_1_WGM1_WGMXCC1_WGMXCCGn1
    SolutionIndex: 23
    SolutionNameMin: Cijk_Ailk_Bjlk_F8B8HS_BH_UserArgs_MT128x128x64_MI16x16x1_SN_LDSB1_CLR0_GRVWB16_GSU1_GSUC0_GSUWGMRR0_GLS0_K1_LBSPPA1024_LBSPPB1024_LPA64_LPB64_MIAV1_MIWT4_4_NTC4_NTD4_NLCA1_NLCB1_PLR1_SU8_SUM0_SUS2048_SPO1_SSO4_SVW4_VWA4_VWB4_WG32_8_1_WGMn16_WGMXCC1_WGMXCCGn1
    SolutionIndex: 24
    SolutionNameMin: Cijk_Ailk_Bjlk_F8B8HS_BH_UserArgs_MT128x128x64_MI16x16x1_SN_LDSB0_CLR0_GRVWB16_GSU1_GSUC0_GSUWGMRR0_GLS0_K1_LBSPPA1024_LBSPPB1024_LPA64_LPB64_MIAV1_MIWT4_4_NTC4_NTD4_NLCA1_NLCB1_PLR1_SU8_SUM0_SUS256_SPO1_SSO4_SVW4_VWA4_VWB4_WG32_8_1_WGMn16_WGMXCC1_WGMXCCGn1
    SolutionIndex: 25
    SolutionNameMin: Cijk_Ailk_Bjlk_F8B8HS_BH_UserArgs_MT128x128x64_MI16x16x1_SN_LDSB0_CLR0_GRVWB16_GSU1_GSUC0_GSUWGMRR0_GLS1_K1_LBSPPA1024_LBSPPB1024_LPA64_LPB64_MIAV1_MIWT4_4_NTC4_NTD4_NLCA1_NLCB1_PLR1_SU8_SUM0_SUS512_SPO1_SSO4_SVW4_VWA4_VWB4_WG32_8_1_WGMn16_WGMXCC1_WGMXCCGn1
    SolutionIndex: 26
    SolutionNameMin: Cijk_Ailk_Bjlk_F8B8HS_BH_UserArgs_MT128x128x64_MI16x16x1_SN_LDSB0_CLR0_GRVWB16_GSU1_GSUC0_GSUWGMRR0_GLS1_K1_LBSPPA1024_LBSPPB1024_LPA64_LPB64_MIAV1_MIWT4_4_NTC4_NTD4_NLCA1_NLCB1_PLR1_SU8_SUM0_SUS1024_SPO1_SSO4_SVW4_VWA4_VWB4_WG32_8_1_WGMn16_WGMXCC1_WGMXCCGn1
    SolutionIndex: 27
    SolutionNameMin: Cijk_Ailk_Bjlk_F8B8HS_BH_UserArgs_MT128x128x64_MI16x16x1_SN_LDSB0_CLR1_GRVWB16_GSU1_GSUC0_GSUWGMRR0_GLS1_K1_LBSPPA1024_LBSPPB1024_LPA64_LPB64_MIAV1_MIWT4_4_NTC4_NTD4_NLCA1_NLCB1_PLR1_SU8_SUM0_SUS64_SPO1_SSO4_SVW4_VWA4_VWB4_WG32_8_1_WGMn16_WGMXCC1_WGMXCCGn1
    SolutionIndex: 28
    SolutionNameMin: Cijk_Ailk_Bjlk_F8B8HS_BH_UserArgs_MT128x128x64_MI16x16x1_SN_LDSB0_CLR1_GRVWB16_GSU1_GSUC0_GSUWGMRR0_GLS1_K1_LBSPPA1024_LBSPPB1024_LPA64_LPB64_MIAV1_MIWT4_4_NTC4_NTD4_NLCA1_NLCB1_PLR1_SU8_SUM0_SUS512_SPO1_SSO4_SVW4_VWA4_VWB4_WG32_8_1_WGMn16_WGMXCC1_WGMXCCGn1
    SolutionIndex: 29
    SolutionNameMin: Cijk_Ailk_Bjlk_F8B8HS_BH_UserArgs_MT128x128x64_MI16x16x1_SN_LDSB0_CLR1_GRVWB16_GSU1_GSUC0_GSUWGMRR0_GLS1_K1_LBSPPA1024_LBSPPB1024_LPA64_LPB64_MIAV1_MIWT4_4_NTC4_NTD4_NLCA1_NLCB1_PLR1_SU8_SUM0_SUS2048_SPO1_SSO4_SVW4_VWA4_VWB4_WG32_8_1_WGMn16_WGMXCC1_WGMXCCGn1
    SolutionIndex: 30
    SolutionNameMin: Cijk_Ailk_Bjlk_F8B8HS_BH_UserArgs_MT256x128x128_MI16x16x1_SN_LDSB1_CLR1_GRVWB16_GSU1_GSUC0_GSUWGMRR0_GLS0_K1_LBSPPA2048_LBSPPB1024_LPA64_LPB0_MIAV0_MIWT4_8_NTC4_NTD4_NLCA1_NLCB1_PLR1_SU8_SUM0_SUS2048_SPO1_SSO4_SVW4_VWA4_VWB8_WG64_4_1_WGM1_WGMXCC1_WGMXCCGn1
    SolutionIndex: 31
    SolutionNameMin: Cijk_Ailk_Bjlk_F8B8HS_BH_UserArgs_MT256x256x64_MI16x16x1_SN_LDSB1_CLR0_GRVWB4_GSU4_GSUC0_GSUWGMRR0_GLS1_K1_LBSPPA2048_LBSPPB2048_LPA64_LPB0_MIAV0_MIWT4_16_NTC4_NTD4_NLCA1_NLCB1_PLR1_SU8_SUM0_SUS2048_SPO1_SSO4_SVW4_VWA4_VWB8_WG64_4_1_WGMn32_WGMXCC1_WGMXCCGn1
    SolutionIndex: 32
    SolutionNameMin: Cijk_Ailk_Bjlk_F8B8HS_BH_UserArgs_MT256x128x64_MI16x16x1_SN_LDSB1_CLR0_GRVWB16_GSU1_GSUC0_GSUWGMRR0_GLS0_K1_LBSPPA2048_LBSPPB1024_LPA64_LPB0_MIAV0_MIWT4_8_NTC4_NTD4_NLCA1_NLCB1_PLR1_SU8_SUM0_SUS64_SPO1_SSO4_SVW4_VWA4_VWB8_WG64_4_1_WGM16_WGMXCC1_WGMXCCGn1
    SolutionIndex: 33
    SolutionNameMin: Cijk_Ailk_Bjlk_F8B8HS_BH_UserArgs_MT256x128x64_MI16x16x1_SN_LDSB1_CLR0_GRVWB16_GSU1_GSUC0_GSUWGMRR0_GLS0_K1_LBSPPA2048_LBSPPB1024_LPA64_LPB0_MIAV0_MIWT4_8_NTC4_NTD4_NLCA1_NLCB1_PLR1_SU8_SUM0_SUS128_SPO1_SSO4_SVW4_VWA4_VWB8_WG64_4_1_WGM16_WGMXCC1_WGMXCCGn1
    SolutionIndex: 34
    SolutionNameMin: Cijk_Ailk_Bjlk_F8B8HS_BH_UserArgs_MT256x128x64_MI16x16x1_SN_LDSB1_CLR0_GRVWB16_GSU1_GSUC0_GSUWGMRR0_GLS0_K1_LBSPPA2048_LBSPPB1024_LPA64_LPB0_MIAV0_MIWT4_8_NTC4_NTD4_NLCA1_NLCB1_PLR1_SU8_SUM0_SUS1024_SPO1_SSO4_SVW4_VWA4_VWB8_WG64_4_1_WGM16_WGMXCC1_WGMXCCGn1
    SolutionIndex: 35
    SolutionNameMin: Cijk_Ailk_Bjlk_F8B8HS_BH_UserArgs_MT256x128x64_MI16x16x1_SN_LDSB1_CLR0_GRVWB16_GSU1_GSUC0_GSUWGMRR0_GLS0_K1_LBSPPA2048_LBSPPB1024_LPA64_LPB0_MIAV0_MIWT4_8_NTC4_NTD4_NLCA1_NLCB1_PLR1_SU8_SUM0_SUS2048_SPO1_SSO4_SVW4_VWA4_VWB8_WG64_4_1_WGM16_WGMXCC1_WGMXCCGn1
    SolutionIndex: 36
    SolutionNameMin: Cijk_Ailk_Bjlk_F8B8HS_BH_UserArgs_MT256x128x64_MI16x16x1_SN_LDSB1_CLR0_GRVWB16_GSU1_GSUC0_GSUWGMRR0_GLS1_K1_LBSPPA2048_LBSPPB1024_LPA64_LPB0_MIAV0_MIWT4_8_NTC4_NTD4_NLCA1_NLCB1_PLR1_SU8_SUM0_SUS512_SPO1_SSO4_SVW4_VWA4_VWB8_WG64_4_1_WGM16_WGMXCC1_WGMXCCGn1
    SolutionIndex: 37
    SolutionNameMin: Cijk_Ailk_Bjlk_F8B8HS_BH_UserArgs_MT256x128x64_MI16x16x1_SN_LDSB1_CLR1_GRVWB16_GSU1_GSUC0_GSUWGMRR0_GLS0_K1_LBSPPA2048_LBSPPB1024_LPA64_LPB0_MIAV0_MIWT4_8_NTC4_NTD4_NLCA1_NLCB1_PLR1_SU8_SUM0_SUS64_SPO1_SSO4_SVW4_VWA4_VWB8_WG64_4_1_WGM16_WGMXCC1_WGMXCCGn1
    SolutionIndex: 38
    SolutionNameMin: Cijk_Ailk_Bjlk_F8B8HS_BH_UserArgs_MT256x128x64_MI16x16x1_SN_LDSB1_CLR1_GRVWB16_GSU1_GSUC0_GSUWGMRR0_GLS0_K1_LBSPPA2048_LBSPPB1024_LPA64_LPB0_MIAV0_MIWT4_8_NTC4_NTD4_NLCA1_NLCB1_PLR1_SU8_SUM0_SUS128_SPO1_SSO4_SVW4_VWA4_VWB8_WG64_4_1_WGM16_WGMXCC1_WGMXCCGn1
    SolutionIndex: 39
    SolutionNameMin: Cijk_Ailk_Bjlk_F8B8HS_BH_UserArgs_MT256x128x64_MI16x16x1_SN_LDSB1_CLR1_GRVWB16_GSU1_GSUC0_GSUWGMRR0_GLS0_K1_LBSPPA2048_LBSPPB1024_LPA64_LPB0_MIAV0_MIWT4_8_NTC4_NTD4_NLCA1_NLCB1_PLR1_SU8_SUM0_SUS256_SPO1_SSO4_SVW4_VWA4_VWB8_WG64_4_1_WGM16_WGMXCC1_WGMXCCGn1
    SolutionIndex: 40
    SolutionNameMin: Cijk_Ailk_Bjlk_F8B8HS_BH_UserArgs_MT256x128x64_MI16x16x1_SN_LDSB1_CLR1_GRVWB16_GSU1_GSUC0_GSUWGMRR0_GLS0_K1_LBSPPA2048_LBSPPB1024_LPA64_LPB0_MIAV0_MIWT4_8_NTC4_NTD4_NLCA1_NLCB1_PLR1_SU8_SUM0_SUS1024_SPO1_SSO4_SVW4_VWA4_VWB8_WG64_4_1_WGM16_WGMXCC1_WGMXCCGn1
    SolutionIndex: 41
    SolutionNameMin: Cijk_Ailk_Bjlk_F8B8HS_BH_UserArgs_MT256x128x64_MI16x16x1_SN_LDSB1_CLR1_GRVWB16_GSU1_GSUC0_GSUWGMRR0_GLS0_K1_LBSPPA2048_LBSPPB1024_LPA64_LPB0_MIAV0_MIWT4_8_NTC4_NTD4_NLCA1_NLCB1_PLR1_SU8_SUM0_SUS2048_SPO1_SSO4_SVW4_VWA4_VWB8_WG64_4_1_WGM16_WGMXCC1_WGMXCCGn1
- - - [1024, 1024, 1, 1024]
    - [18, 174884.0]
  - - [1024, 1024, 1, 3072]
    - [18, 230980.0]
  - - [1024, 1024, 1, 4096]
    - [19, 262778.0]
  - - [1024, 1024, 1, 24576]
    - [22, 490553.0]
  - - [1024, 3072, 1, 1024]
    - [28, 351305.0]
  - - [1024, 3072, 1, 3072]
    - [29, 416055.0]
  - - [1024, 3072, 1, 4096]
    - [29, 417839.0]
  - - [1024, 3072, 1, 24576]
    - [16, 704064.0]
  - - [1024, 4096, 1, 1024]
    - [28, 408025.0]
  - - [1024, 4096, 1, 3072]
    - [24, 502974.0]
  - - [1024, 4096, 1, 4096]
    - [24, 536274.0]
  - - [1024, 4096, 1, 24576]
    - [31, 707390.0]
  - - [1024, 8192, 1, 1024]
    - [37, 485017.0]
  - - [1024, 8192, 1, 3072]
    - [34, 647472.0]
  - - [1024, 8192, 1, 4096]
    - [41, 671397.0]
  - - [1024, 8192, 1, 24576]
    - [40, 764121.0]
  - - [1024, 24576, 1, 1024]
    - [8, 586181.0]
  - - [1024, 24576, 1, 3072]
    - [39, 746695.0]
  - - [1024, 24576, 1, 4096]
    - [15, 767429.0]
  - - [1024, 24576, 1, 24576]
    - [37, 804023.0]
  - - [3072, 1024, 1, 1024]
    - [27, 331936.0]
  - - [3072, 1024, 1, 3072]
    - [29, 402857.0]
  - - [3072, 1024, 1, 4096]
    - [26, 415247.0]
  - - [3072, 1024, 1, 24576]
    - [9, 691484.0]
  - - [3072, 3072, 1, 1024]
    - [1, 528871.0]
  - - [3072, 3072, 1, 3072]
    - [38, 675646.0]
  - - [3072, 3072, 1, 4096]
    - [35, 707572.0]
  - - [3072, 3072, 1, 24576]
    - [39, 799721.0]
  - - [3072, 4096, 1, 1024]
    - [5, 544441.0]
  - - [3072, 4096, 1, 3072]
    - [17, 693116.0]
  - - [3072, 4096, 1, 4096]
    - [5, 697645.0]
  - - [3072, 4096, 1, 24576]
    - [17, 798853.0]
  - - [3072, 8192, 1, 1024]
    - [2, 574175.0]
  - - [3072, 8192, 1, 3072]
    - [37, 760693.0]
  - - [3072, 8192, 1, 4096]
    - [36, 769174.0]
  - - [3072, 8192, 1, 24576]
    - [17, 809017.0]
  - - [3072, 24576, 1, 1024]
    - [33, 672765.0]
  - - [3072, 24576, 1, 3072]
    - [0, 861175.0]
  - - [3072, 24576, 1, 4096]
    - [0, 874073.0]
  - - [3072, 24576, 1, 24576]
    - [20, 922225.0]
  - - [4096, 1024, 1, 1024]
    - [25, 389573.0]
  - - [4096, 1024, 1, 3072]
    - [29, 510375.0]
  - - [4096, 1024, 1, 4096]
    - [23, 525615.0]
  - - [4096, 1024, 1, 24576]
    - [31, 701472.0]
  - - [4096, 3072, 1, 1024]
    - [5, 544796.0]
  - - [4096, 3072, 1, 3072]
    - [3, 681264.0]
  - - [4096, 3072, 1, 4096]
    - [3, 716168.0]
  - - [4096, 3072, 1, 24576]
    - [3, 805655.0]
  - - [4096, 4096, 1, 1024]
    - [21, 601102.0]
  - - [4096, 4096, 1, 3072]
    - [11, 770191.0]
  - - [4096, 4096, 1, 4096]
    - [14, 787142.0]
  - - [4096, 4096, 1, 24576]
    - [0, 881284.0]
  - - [4096, 8192, 1, 1024]
    - [35, 607963.0]
  - - [4096, 8192, 1, 3072]
    - [0, 807727.0]
  - - [4096, 8192, 1, 4096]
    - [0, 825932.0]
  - - [4096, 8192, 1, 24576]
    - [20, 877443.0]
  - - [4096, 24576, 1, 1024]
    - [7, 652967.0]
  - - [4096, 24576, 1, 3072]
    - [20, 816773.0]
  - - [4096, 24576, 1, 4096]
    - [20, 828115.0]
  - - [4096, 24576, 1, 24576]
    - [32, 830263.0]
  - - [8192, 1024, 1, 1024]
    - [41, 473024.0]
  - - [8192, 1024, 1, 3072]
    - [30, 626888.0]
  - - [8192, 1024, 1, 4096]
    - [6, 654197.0]
  - - [8192, 1024, 1, 24576]
    - [4, 748711.0]
  - - [8192, 3072, 1, 1024]
    - [1, 555347.0]
  - - [8192, 3072, 1, 3072]
    - [1, 743404.0]
  - - [8192, 3072, 1, 4096]
    - [4, 748434.0]
  - - [8192, 3072, 1, 24576]
    - [3, 806688.0]
  - - [8192, 4096, 1, 1024]
    - [7, 593858.0]
  - - [8192, 4096, 1, 3072]
    - [0, 797860.0]
  - - [8192, 4096, 1, 4096]
    - [13, 802897.0]
  - - [8192, 4096, 1, 24576]
    - [0, 880722.0]
  - - [8192, 8192, 1, 1024]
    - [10, 648569.0]
  - - [8192, 8192, 1, 3072]
    - [10, 825580.0]
  - - [8192, 8192, 1, 4096]
    - [0, 837972.0]
  - - [8192, 8192, 1, 24576]
    - [13, 848368.0]
  - - [8192, 24576, 1, 1024]
    - [12, 666411.0]
  - - [8192, 24576, 1, 3072]
    - [0, 855673.0]
  - - [8192, 24576, 1, 4096]
    - [0, 867632.0]
  - - [8192, 24576, 1, 24576]
    - [11, 850625.0]
- null
- null
- DeviceEfficiency
- Equality
