library/src/amd_detail/rocblaslt/src/Tensile/Logic/asm_full/aquavanjaram/gfx942/Equality/aquavanjaram_Cijk_Alik_Bljk_F8BS_BH_BiasSB_HAS_SAB_SAV_UserArgs.yaml
- {MinimumRequiredVersion: 4.33.0}
- aquavanjaram
- gfx942
- [Device 0049, Device 0050]
    SolutionIndex: 0
    SolutionNameMin: Cijk_Alik_Bljk_F8BS_BH_BiasSB_HAS_SAB_SAV_UserArgs_MT16x16x256_MI16x16x1_SN_GSU1_MIWT1_1_NEPBS0_SU0_SUM0_SUS0_WGM1
    SolutionIndex: 1
    SolutionNameMin: Cijk_Alik_Bljk_F8BS_BH_BiasSB_HAS_SAB_SAV_UserArgs_MT64x32x512_MI16x16x1_SN_GSU1_MIWT2_1_NEPBS0_SU16_SUM1_SUS1024_WGM0
    SolutionIndex: 2
    SolutionNameMin: Cijk_Alik_Bljk_F8BS_BH_BiasSB_HAS_SAB_SAV_UserArgs_MT64x16x256_MI16x16x1_SN_GSU5_MIWT1_1_NEPBS16_SU8_SUM1_SUS512_WGM0
    SolutionIndex: 3
    SolutionNameMin: Cijk_Alik_Bljk_F8BS_BH_BiasSB_HAS_SAB_SAV_UserArgs_MT64x16x256_MI16x16x1_SN_GSU16_MIWT1_1_NEPBS16_SU0_SUM0_SUS0_WGM0
    SolutionIndex: 4
    SolutionNameMin: Cijk_Alik_Bljk_F8BS_BH_BiasSB_HAS_SAB_SAV_UserArgs_MT192x256x128_MI16x16x1_SN_GSU1_MIWT6_8_NEPBS16_SU8_SUM1_SUS256_SVW2_WGM32
    SolutionIndex: 5
    SolutionNameMin: Cijk_Alik_Bljk_F8BS_BH_BiasSB_HAS_SAB_SAV_UserArgs_MT256x128x128_MI16x16x1_SN_GSU1_MIWT8_4_NEPBS16_SU4_SUM0_SUS256_SVW8_WGM4
    SolutionIndex: 6
    SolutionNameMin: Cijk_Alik_Bljk_F8BS_BH_BiasSB_HAS_SAB_SAV_UserArgs_MT160x256x128_MI16x16x1_SN_GSU1_MIWT5_8_NEPBS0_SU4_SUM0_SUS256_WGM16
    SolutionIndex: 7
    SolutionNameMin: Cijk_Alik_Bljk_F8BS_BH_BiasSB_HAS_SAB_SAV_UserArgs_MT160x224x128_MI16x16x1_SN_GSU1_MIWT5_7_NEPBS0_SU8_SUM1_SUS256_WGM32
    SolutionIndex: 8
    SolutionNameMin: Cijk_Alik_Bljk_F8BS_BH_BiasSB_HAS_SAB_SAV_UserArgs_MT256x224x128_MI16x16x1_SN_GSU1_MIWT8_7_NEPBS0_SU8_SUM1_SUS256_SVW8_WGM1
    SolutionIndex: 9
    SolutionNameMin: Cijk_Alik_Bljk_F8BS_BH_BiasSB_HAS_SAB_SAV_UserArgs_MT192x256x128_MI16x16x1_SN_GSU1_MIWT6_8_NEPBS0_SU4_SUM1_SUS256_SVW2_WGM32
    SolutionIndex: 10
    SolutionNameMin: Cijk_Alik_Bljk_F8BS_BH_BiasSB_HAS_SAB_SAV_UserArgs_MT160x224x128_MI16x16x1_SN_GSU1_MIWT5_7_NEPBS16_SU8_SUM1_SUS256_WGM8
    SolutionIndex: 11
    SolutionNameMin: Cijk_Alik_Bljk_F8BS_BH_BiasSB_HAS_SAB_SAV_UserArgs_MT128x256x128_MI16x16x1_SN_GSU1_MIWT4_8_NEPBS16_SU8_SUM0_SUS256_SVW4_WGM8
    SolutionIndex: 12
    SolutionNameMin: Cijk_Alik_Bljk_F8BS_BH_BiasSB_HAS_SAB_SAV_UserArgs_MT256x224x128_MI16x16x1_SN_GSU1_MIWT8_7_NEPBS16_SU8_SUM1_SUS256_SVW8_WGM1
    SolutionIndex: 13
    SolutionNameMin: Cijk_Alik_Bljk_F8BS_BH_BiasSB_HAS_SAB_SAV_UserArgs_MT256x224x128_MI16x16x1_SN_GSU1_MIWT8_7_NEPBS0_SU8_SUM1_SUS256_SVW8_WGM4
    SolutionIndex: 14
    SolutionNameMin: Cijk_Alik_Bljk_F8BS_BH_BiasSB_HAS_SAB_SAV_UserArgs_MT256x192x128_MI16x16x1_SN_GRVWA16_GRVWB16_GSU1_LPA32_LPB32_LRVW16_MIWT8_6_NEPBS0_SU8_SUM0_SUS256_SVW8_WGM32
    SolutionIndex: 15
    SolutionNameMin: Cijk_Alik_Bljk_F8BS_BH_BiasSB_HAS_SAB_SAV_UserArgs_MT128x224x128_MI16x16x1_SN_GSU1_MIWT2_14_NEPBS0_SU8_SUM1_SUS256_SVW2_WGM8
    SolutionIndex: 16
    SolutionNameMin: Cijk_Alik_Bljk_F8BS_BH_BiasSB_HAS_SAB_SAV_UserArgs_MT32x16x256_MI16x16x1_SN_GSU1_MIWT1_1_NEPBS16_SU32_SUM1_SUS512_WGM1
    SolutionIndex: 17
    SolutionNameMin: Cijk_Alik_Bljk_F8BS_BH_BiasSB_HAS_SAB_SAV_UserArgs_MT64x16x256_MI16x16x1_SN_GSU5_MIWT1_1_NEPBS16_SU8_SUM1_SUS512_WGM1
    SolutionIndex: 18
    SolutionNameMin: Cijk_Alik_Bljk_F8BS_BH_BiasSB_HAS_SAB_SAV_UserArgs_MT16x32x512_MI16x16x1_SN_GSU4_MIWT1_1_NEPBS16_SU0_SUM0_SUS0_WGM0
    SolutionIndex: 19
    SolutionNameMin: Cijk_Alik_Bljk_F8BS_BH_BiasSB_HAS_SAB_SAV_UserArgs_MT256x224x128_MI16x16x1_SN_GSU1_MIWT4_14_NEPBS0_SU8_SUM0_SUS256_SVW4_WGM32
    SolutionIndex: 20
    SolutionNameMin: Cijk_Alik_Bljk_F8BS_BH_BiasSB_HAS_SAB_SAV_UserArgs_MT256x192x128_MI16x16x1_SN_GRVWA16_GRVWB16_GSU1_LPA32_LPB32_LRVW16_MIWT4_12_NEPBS0_SU8_SUM0_SUS256_SVW4_WGM4
    SolutionIndex: 21
    SolutionNameMin: Cijk_Alik_Bljk_F8BS_BH_BiasSB_HAS_SAB_SAV_UserArgs_MT256x192x128_MI16x16x1_SN_GRVWA16_GRVWB16_GSU1_LPA32_LPB32_LRVW16_MIWT8_6_NEPBS16_SU8_SUM0_SUS256_SVW8_WGM32
    SolutionIndex: 22
    SolutionNameMin: Cijk_Alik_Bljk_F8BS_BH_BiasSB_HAS_SAB_SAV_UserArgs_MT256x176x128_MI16x16x1_SN_GSU1_MIWT4_11_NEPBS16_SU4_SUM1_SUS256_SVW4_WGM32
    SolutionIndex: 23
    SolutionNameMin: Cijk_Alik_Bljk_F8BS_BH_BiasSB_HAS_SAB_SAV_UserArgs_MT16x16x256_MI16x16x1_SN_GSU1_MIWT1_1_NEPBS16_SU0_SUM0_SUS0_WGM0
    SolutionIndex: 24
    SolutionNameMin: Cijk_Alik_Bljk_F8BS_BH_BiasSB_HAS_SAB_SAV_UserArgs_MT32x16x256_MI16x16x1_SN_GSU1_MIWT1_1_NEPBS0_SU16_SUM1_SUS512_WGM1
    SolutionIndex: 25
    SolutionNameMin: Cijk_Alik_Bljk_F8BS_BH_BiasSB_HAS_SAB_SAV_UserArgs_MT64x16x256_MI16x16x1_SN_GSU5_MIWT1_1_NEPBS16_SU4_SUM1_SUS512_WGM0
    SolutionIndex: 26
    SolutionNameMin: Cijk_Alik_Bljk_F8BS_BH_BiasSB_HAS_SAB_SAV_UserArgs_MT16x32x512_MI16x16x1_SN_GSU4_MIWT1_1_NEPBS0_SU4_SUM1_SUS1024_WGM0
    SolutionIndex: 27
    SolutionNameMin: Cijk_Alik_Bljk_F8BS_BH_BiasSB_HAS_SAB_SAV_UserArgs_MT256x224x128_MI16x16x1_SN_GSU1_MIWT8_7_NEPBS0_SU8_SUM0_SUS256_SVW8_WGM32
    SolutionIndex: 28
    SolutionNameMin: Cijk_Alik_Bljk_F8BS_BH_BiasSB_HAS_SAB_SAV_UserArgs_MT256x224x128_MI16x16x1_SN_GSU1_MIWT8_7_NEPBS0_SU0_SUM0_SUS0_SVW8_WGM32
    SolutionIndex: 29
    SolutionNameMin: Cijk_Alik_Bljk_F8BS_BH_BiasSB_HAS_SAB_SAV_UserArgs_MT256x224x128_MI16x16x1_SN_GSU1_MIWT8_7_NEPBS16_SU8_SUM0_SUS256_SVW8_WGM8
    SolutionIndex: 30
    SolutionNameMin: Cijk_Alik_Bljk_F8BS_BH_BiasSB_HAS_SAB_SAV_UserArgs_MT32x16x256_MI16x16x1_SN_GSU1_MIWT1_1_NEPBS16_SU16_SUM1_SUS512_WGM1
    SolutionIndex: 31
    SolutionNameMin: Cijk_Alik_Bljk_F8BS_BH_BiasSB_HAS_SAB_SAV_UserArgs_MT64x16x256_MI16x16x1_SN_GSU5_MIWT1_1_NEPBS16_SU4_SUM1_SUS512_WGM1
    SolutionIndex: 32
    SolutionNameMin: Cijk_Alik_Bljk_F8BS_BH_BiasSB_HAS_SAB_SAV_UserArgs_MT16x16x512_MI16x16x1_SN_GSU4_MIWT1_1_NEPBS16_SU0_SUM0_SUS0_WGM1
    SolutionIndex: 33
    SolutionNameMin: Cijk_Alik_Bljk_F8BS_BH_BiasSB_HAS_SAB_SAV_UserArgs_MT224x256x128_MI16x16x1_SN_GSU1_MIWT14_4_NEPBS0_SU4_SUM0_SUS256_SVW2_WGM1
    SolutionIndex: 34
    SolutionNameMin: Cijk_Alik_Bljk_F8BS_BH_BiasSB_HAS_SAB_SAV_UserArgs_MT256x224x128_MI16x16x1_SN_GSU1_MIWT8_7_NEPBS0_SU8_SUM0_SUS256_SVW8_WGM8
    SolutionIndex: 35
    SolutionNameMin: Cijk_Alik_Bljk_F8BS_BH_BiasSB_HAS_SAB_SAV_UserArgs_MT256x224x128_MI16x16x1_SN_GSU1_MIWT8_7_NEPBS16_SU8_SUM0_SUS256_SVW8_WGM32
    SolutionIndex: 36
    SolutionNameMin: Cijk_Alik_Bljk_F8BS_BH_BiasSB_HAS_SAB_SAV_UserArgs_MT64x32x128_MI16x16x1_SN_GSU2_MIWT2_1_NEPBS16_SU32_SUM1_SUS256_SVW2_WGM0
    SolutionIndex: 37
    SolutionNameMin: Cijk_Alik_Bljk_F8BS_BH_BiasSB_HAS_SAB_SAV_UserArgs_MT64x32x256_MI16x16x1_SN_GSU5_MIWT2_1_NEPBS16_SU4_SUM1_SUS512_SVW2_WGM0
    SolutionIndex: 38
    SolutionNameMin: Cijk_Alik_Bljk_F8BS_BH_BiasSB_HAS_SAB_SAV_UserArgs_MT16x32x512_MI16x16x1_SN_GSU3_MIWT1_1_NEPBS16_SU0_SUM0_SUS0_WGM1
    SolutionIndex: 39
    SolutionNameMin: Cijk_Alik_Bljk_F8BS_BH_BiasSB_HAS_SAB_SAV_UserArgs_MT256x224x128_MI16x16x1_SN_GSU1_MIWT8_7_NEPBS0_SU0_SUM0_SUS0_SVW8_WGM16
    SolutionIndex: 40
    SolutionNameMin: Cijk_Alik_Bljk_F8BS_BH_BiasSB_HAS_SAB_SAV_UserArgs_MT256x224x128_MI16x16x1_SN_GSU1_MIWT8_7_NEPBS0_SU4_SUM0_SUS256_SVW8_WGM0
    SolutionIndex: 41
    SolutionNameMin: Cijk_Alik_Bljk_F8BS_BH_BiasSB_HAS_SAB_SAV_UserArgs_MT256x192x128_MI16x16x1_SN_GRVWA16_GRVWB16_GSU1_LPA32_LPB32_LRVW16_MIWT8_6_NEPBS0_SU8_SUM0_SUS256_SVW8_WGM8
    SolutionIndex: 42
    SolutionNameMin: Cijk_Alik_Bljk_F8BS_BH_BiasSB_HAS_SAB_SAV_UserArgs_MT32x64x128_MI16x16x1_SN_GSU1_MIWT2_1_NEPBS16_SU8_SUM0_SUS256_SVW2_WGM0
    SolutionIndex: 43
    SolutionNameMin: Cijk_Alik_Bljk_F8BS_BH_BiasSB_HAS_SAB_SAV_UserArgs_MT32x64x512_MI16x16x1_SN_GSU6_MIWT2_1_NEPBS16_SU4_SUM0_SUS1024_WGM1
    SolutionIndex: 44
    SolutionNameMin: Cijk_Alik_Bljk_F8BS_BH_BiasSB_HAS_SAB_SAV_UserArgs_MT32x64x512_MI16x16x1_SN_GSU4_MIWT2_1_NEPBS16_SU4_SUM1_SUS1024_WGM0
    SolutionIndex: 45
    SolutionNameMin: Cijk_Alik_Bljk_F8BS_BH_BiasSB_HAS_SAB_SAV_UserArgs_MT320x160x128_MI16x16x1_SN_GSU1_MIWT10_5_NEPBS16_SU8_SUM0_SUS256_SVW2_WGM1
    SolutionIndex: 46
    SolutionNameMin: Cijk_Alik_Bljk_F8BS_BH_BiasSB_HAS_SAB_SAV_UserArgs_MT256x192x128_MI16x16x1_SN_GRVWA16_GRVWB16_GSU1_LPA32_LPB32_LRVW16_MIWT8_6_NEPBS0_SU8_SUM0_SUS256_SVW8_WGM16
    SolutionIndex: 47
    SolutionNameMin: Cijk_Alik_Bljk_F8BS_BH_BiasSB_HAS_SAB_SAV_UserArgs_MT32x128x128_MI16x16x1_SN_GSU1_MIWT2_2_NEPBS16_SU4_SUM0_SUS256_SVW2_WGM0
    SolutionIndex: 48
    SolutionNameMin: Cijk_Alik_Bljk_F8BS_BH_BiasSB_HAS_SAB_SAV_UserArgs_MT32x128x256_MI16x16x1_SN_GSU1_MIWT2_2_NEPBS16_SU8_SUM0_SUS512_SVW2_WGM8
    SolutionIndex: 49
    SolutionNameMin: Cijk_Alik_Bljk_F8BS_BH_BiasSB_HAS_SAB_SAV_UserArgs_MT32x128x256_MI16x16x1_SN_GSU1_MIWT2_2_NEPBS16_SU32_SUM1_SUS512_SVW2_WGM1
    SolutionIndex: 50
    SolutionNameMin: Cijk_Alik_Bljk_F8BS_BH_BiasSB_HAS_SAB_SAV_UserArgs_MT32x64x256_MI16x16x1_SN_GSU1_MIWT2_1_NEPBS0_SU32_SUM1_SUS512_SVW2_WGM1
    SolutionIndex: 51
    SolutionNameMin: Cijk_Alik_Bljk_F8BS_BH_BiasSB_HAS_SAB_SAV_UserArgs_MT64x64x256_MI16x16x1_SN_GSU5_MIWT4_1_NEPBS16_SU8_SUM0_SUS512_SVW4_WGM0
    SolutionIndex: 52
    SolutionNameMin: Cijk_Alik_Bljk_F8BS_BH_BiasSB_HAS_SAB_SAV_UserArgs_MT32x64x512_MI16x16x1_SN_GSU4_MIWT2_1_NEPBS0_SU32_SUM1_SUS1024_WGM0
    SolutionIndex: 53
    SolutionNameMin: Cijk_Alik_Bljk_F8BS_BH_BiasSB_HAS_SAB_SAV_UserArgs_MT256x224x128_MI16x16x1_SN_GSU1_MIWT8_7_NEPBS0_SU32_SUM1_SUS256_SVW8_WGM16
    SolutionIndex: 54
    SolutionNameMin: Cijk_Alik_Bljk_F8BS_BH_BiasSB_HAS_SAB_SAV_UserArgs_MT256x224x128_MI16x16x1_SN_GSU1_MIWT8_7_NEPBS0_SU32_SUM1_SUS256_SVW8_WGM32
    SolutionIndex: 55
    SolutionNameMin: Cijk_Alik_Bljk_F8BS_BH_BiasSB_HAS_SAB_SAV_UserArgs_MT320x160x128_MI16x16x1_SN_GSU1_MIWT10_5_NEPBS0_SU8_SUM0_SUS256_SVW2_WGM0
    SolutionIndex: 56
    SolutionNameMin: Cijk_Alik_Bljk_F8BS_BH_BiasSB_HAS_SAB_SAV_UserArgs_MT256x192x128_MI16x16x1_SN_GRVWA16_GRVWB16_GSU1_LPA32_LPB32_LRVW16_MIWT8_6_NEPBS0_SU4_SUM0_SUS256_SVW8_WGM4
    SolutionIndex: 57
    SolutionNameMin: Cijk_Alik_Bljk_F8BS_BH_BiasSB_HAS_SAB_SAV_UserArgs_MT16x16x256_MI16x16x1_SN_GSU1_MIWT1_1_NEPBS0_SU0_SUM0_SUS0_WGM1
    SolutionIndex: 58
    SolutionNameMin: Cijk_Alik_Bljk_F8BS_BH_BiasSB_HAS_SAB_SAV_UserArgs_MT16x16x128_MI16x16x1_SN_GSU1_MIWT1_1_NEPBS0_SU0_SUM0_SUS0_WGM1
    SolutionIndex: 59
    SolutionNameMin: Cijk_Alik_Bljk_F8BS_BH_BiasSB_HAS_SAB_SAV_UserArgs_MT32x16x256_MI16x16x1_SN_GSU1_MIWT1_1_NEPBS16_SU0_SUM0_SUS0_WGM1
    SolutionIndex: 60
    SolutionNameMin: Cijk_Alik_Bljk_F8BS_BH_BiasSB_HAS_SAB_SAV_UserArgs_MT16x32x128_MI16x16x1_SN_GSU1_MIWT1_1_NEPBS16_SU0_SUM0_SUS0_WGM0
    SolutionIndex: 61
    SolutionNameMin: Cijk_Alik_Bljk_F8BS_BH_BiasSB_HAS_SAB_SAV_UserArgs_MT64x32x256_MI16x16x1_SN_GSU1_MIWT2_1_NEPBS16_SU4_SUM1_SUS512_SVW2_WGM0
    SolutionIndex: 62
    SolutionNameMin: Cijk_Alik_Bljk_F8BS_BH_BiasSB_HAS_SAB_SAV_UserArgs_MT32x64x128_MI16x16x1_SN_GSU1_MIWT2_1_NEPBS16_SU4_SUM1_SUS256_SVW2_WGM1
    SolutionIndex: 63
    SolutionNameMin: Cijk_Alik_Bljk_F8BS_BH_BiasSB_HAS_SAB_SAV_UserArgs_MT32x64x256_MI16x16x1_SN_GSU1_MIWT2_1_NEPBS0_SU8_SUM1_SUS512_SVW2_WGM16
    SolutionIndex: 64
    SolutionNameMin: Cijk_Alik_Bljk_F8BS_BH_BiasSB_HAS_SAB_SAV_UserArgs_MT64x96x128_MI16x16x1_SN_GSU1_MIWT2_3_NEPBS16_SU4_SUM0_SUS256_SVW2_WGM1
    SolutionIndex: 65
    SolutionNameMin: Cijk_Alik_Bljk_F8BS_BH_BiasSB_HAS_SAB_SAV_UserArgs_MT64x128x256_MI16x16x1_SN_GSU1_MIWT4_2_NEPBS0_SU0_SUM0_SUS0_SVW4_WGM16
    SolutionIndex: 66
    SolutionNameMin: Cijk_Alik_Bljk_F8BS_BH_BiasSB_HAS_SAB_SAV_UserArgs_MT64x128x128_MI16x16x1_SN_GSU1_MIWT4_2_NEPBS0_SU32_SUM1_SUS256_SVW4_WGM8
    SolutionIndex: 67
    SolutionNameMin: Cijk_Alik_Bljk_F8BS_BH_BiasSB_HAS_SAB_SAV_UserArgs_MT128x64x128_MI16x16x1_SN_GSU1_MIWT4_2_NEPBS16_SU0_SUM0_SUS0_SVW4_WGM8
    SolutionIndex: 68
    SolutionNameMin: Cijk_Alik_Bljk_F8BS_BH_BiasSB_HAS_SAB_SAV_UserArgs_MT128x128x128_MI16x16x1_SN_GSU1_MIWT8_2_NEPBS16_SU0_SUM0_SUS0_SVW8_WGM4
    SolutionIndex: 69
    SolutionNameMin: Cijk_Alik_Bljk_F8BS_BH_BiasSB_HAS_SAB_SAV_UserArgs_MT256x64x128_MI16x16x1_SN_GSU1_MIWT4_4_NEPBS0_SU0_SUM0_SUS0_SVW4_WGM8
    SolutionIndex: 70
    SolutionNameMin: Cijk_Alik_Bljk_F8BS_BH_BiasSB_HAS_SAB_SAV_UserArgs_MT128x96x128_MI16x16x1_SN_GSU1_MIWT4_3_NEPBS16_SU8_SUM0_SUS256_SVW4_WGM8
    SolutionIndex: 71
    SolutionNameMin: Cijk_Alik_Bljk_F8BS_BH_BiasSB_HAS_SAB_SAV_UserArgs_MT128x128x128_MI16x16x1_SN_GSU1_MIWT8_2_NEPBS0_SU4_SUM1_SUS256_SVW8_WGM1
    SolutionIndex: 72
    SolutionNameMin: Cijk_Alik_Bljk_F8BS_BH_BiasSB_HAS_SAB_SAV_UserArgs_MT128x128x128_MI16x16x1_SN_GSU1_MIWT4_4_NEPBS0_SU4_SUM0_SUS256_SVW4_WGM16
    SolutionIndex: 73
    SolutionNameMin: Cijk_Alik_Bljk_F8BS_BH_BiasSB_HAS_SAB_SAV_UserArgs_MT96x192x128_MI16x16x1_SN_GSU1_MIWT6_3_NEPBS0_SU4_SUM0_SUS256_SVW2_WGM4
    SolutionIndex: 74
    SolutionNameMin: Cijk_Alik_Bljk_F8BS_BH_BiasSB_HAS_SAB_SAV_UserArgs_MT128x160x128_MI16x16x1_SN_GSU1_MIWT4_5_NEPBS16_SU8_SUM0_SUS256_SVW4_WGM8
    SolutionIndex: 75
    SolutionNameMin: Cijk_Alik_Bljk_F8BS_BH_BiasSB_HAS_SAB_SAV_UserArgs_MT256x128x128_MI16x16x1_SN_GSU1_MIWT16_2_NEPBS16_SU4_SUM0_SUS256_SVW8_WGM4
    SolutionIndex: 76
    SolutionNameMin: Cijk_Alik_Bljk_F8BS_BH_BiasSB_HAS_SAB_SAV_UserArgs_MT128x192x128_MI16x16x1_SN_GSU1_MIWT4_6_NEPBS16_SU4_SUM0_SUS256_SVW4_WGM8
    SolutionIndex: 77
    SolutionNameMin: Cijk_Alik_Bljk_F8BS_BH_BiasSB_HAS_SAB_SAV_UserArgs_MT192x160x128_MI16x16x1_SN_GSU1_MIWT3_10_NEPBS16_SU8_SUM1_SUS256_WGM0
    SolutionIndex: 78
    SolutionNameMin: Cijk_Alik_Bljk_F8BS_BH_BiasSB_HAS_SAB_SAV_UserArgs_MT128x256x128_MI16x16x1_SN_GSU1_MIWT8_4_NEPBS16_SU0_SUM0_SUS0_SVW8_WGM0
    SolutionIndex: 79
    SolutionNameMin: Cijk_Alik_Bljk_F8BS_BH_BiasSB_HAS_SAB_SAV_UserArgs_MT128x320x64_MI16x16x1_SN_LDSB0_GRVWA8_GRVWB8_GSU1_LPA8_LPB8_LRVW8_MIWT4_10_NEPBS16_SU4_SUM1_SUS128_SVW4_WGM4
    SolutionIndex: 80
    SolutionNameMin: Cijk_Alik_Bljk_F8BS_BH_BiasSB_HAS_SAB_SAV_UserArgs_MT256x208x128_MI16x16x1_SN_GSU1_MIWT4_13_NEPBS0_SU4_SUM0_SUS256_SVW4_WGM8
    SolutionIndex: 81
    SolutionNameMin: Cijk_Alik_Bljk_F8BS_BH_BiasSB_HAS_SAB_SAV_UserArgs_MT192x288x128_MI16x16x1_SN_GSU1_MIWT6_9_NEPBS0_SU8_SUM0_SUS256_SVW2_WGM8
    SolutionIndex: 82
    SolutionNameMin: Cijk_Alik_Bljk_F8BS_BH_BiasSB_HAS_SAB_SAV_UserArgs_MT256x224x128_MI16x16x1_SN_GSU1_MIWT8_7_NEPBS16_SU4_SUM0_SUS256_SVW8_WGM4
    SolutionIndex: 83
    SolutionNameMin: Cijk_Alik_Bljk_F8BS_BH_BiasSB_HAS_SAB_SAV_UserArgs_MT128x192x128_MI16x16x1_SN_GSU1_MIWT8_3_NEPBS0_SU4_SUM1_SUS256_SVW8_WGM16
    SolutionIndex: 84
    SolutionNameMin: Cijk_Alik_Bljk_F8BS_BH_BiasSB_HAS_SAB_SAV_UserArgs_MT128x192x128_MI16x16x1_SN_GSU1_MIWT4_6_NEPBS16_SU32_SUM1_SUS256_SVW4_WGM16
    SolutionIndex: 85
    SolutionNameMin: Cijk_Alik_Bljk_F8BS_BH_BiasSB_HAS_SAB_SAV_UserArgs_MT192x288x64_MI16x16x1_SN_GSU1_MIWT6_9_NEPBS0_SU4_SUM0_SUS128_SVW2_WGM4
    SolutionIndex: 86
    SolutionNameMin: Cijk_Alik_Bljk_F8BS_BH_BiasSB_HAS_SAB_SAV_UserArgs_MT128x256x128_MI16x16x1_SN_GSU1_MIWT8_4_NEPBS0_SU32_SUM0_SUS256_SVW8_WGM1
    SolutionIndex: 87
    SolutionNameMin: Cijk_Alik_Bljk_F8BS_BH_BiasSB_HAS_SAB_SAV_UserArgs_MT32x16x512_MI16x16x1_SN_GSU2_MIWT1_1_NEPBS16_SU8_SUM0_SUS1024_WGM0
    SolutionIndex: 88
    SolutionNameMin: Cijk_Alik_Bljk_F8BS_BH_BiasSB_HAS_SAB_SAV_UserArgs_MT224x256x128_MI16x16x1_SN_GSU1_MIWT14_4_NEPBS0_SU4_SUM0_SUS256_SVW2_WGM32
    SolutionIndex: 89
    SolutionNameMin: Cijk_Alik_Bljk_F8BS_BH_BiasSB_HAS_SAB_SAV_UserArgs_MT64x128x128_MI16x16x1_SN_GSU1_MIWT4_2_NEPBS0_SU16_SUM0_SUS256_SVW4_WGM1
    SolutionIndex: 90
    SolutionNameMin: Cijk_Alik_Bljk_F8BS_BH_BiasSB_HAS_SAB_SAV_UserArgs_MT16x16x512_MI16x16x1_SN_GSU1_MIWT1_1_NEPBS0_SU0_SUM0_SUS0_WGM1
    SolutionIndex: 91
    SolutionNameMin: Cijk_Alik_Bljk_F8BS_BH_BiasSB_HAS_SAB_SAV_UserArgs_MT16x16x256_MI16x16x1_SN_GSU1_MIWT1_1_NEPBS16_SU0_SUM0_SUS0_WGM0
    SolutionIndex: 92
    SolutionNameMin: Cijk_Alik_Bljk_F8BS_BH_BiasSB_HAS_SAB_SAV_UserArgs_MT128x16x256_MI16x16x1_SN_GSU1_MIWT2_1_NEPBS0_SU4_SUM1_SUS512_SVW2_WGM0
    SolutionIndex: 93
    SolutionNameMin: Cijk_Alik_Bljk_F8BS_BH_BiasSB_HAS_SAB_SAV_UserArgs_MT64x128x128_MI16x16x1_SN_GSU1_MIWT4_2_NEPBS0_SU0_SUM0_SUS0_SVW4_WGM32
    SolutionIndex: 94
    SolutionNameMin: Cijk_Alik_Bljk_F8BS_BH_BiasSB_HAS_SAB_SAV_UserArgs_MT256x224x128_MI16x16x1_SN_GSU1_MIWT8_7_NEPBS0_SU8_SUM0_SUS256_SVW8_WGM4
    SolutionIndex: 95
    SolutionNameMin: Cijk_Alik_Bljk_F8BS_BH_BiasSB_HAS_SAB_SAV_UserArgs_MT16x32x128_MI16x16x1_SN_GSU1_MIWT1_1_NEPBS16_SU0_SUM0_SUS0_WGM16
    SolutionIndex: 96
    SolutionNameMin: Cijk_Alik_Bljk_F8BS_BH_BiasSB_HAS_SAB_SAV_UserArgs_MT64x64x128_MI16x16x1_SN_GSU1_MIWT2_2_NEPBS16_SU4_SUM1_SUS256_SVW2_WGM1
    SolutionIndex: 97
    SolutionNameMin: Cijk_Alik_Bljk_F8BS_BH_BiasSB_HAS_SAB_SAV_UserArgs_MT256x224x128_MI16x16x1_SN_GSU1_MIWT8_7_NEPBS0_SU4_SUM0_SUS256_SVW8_WGM1
    SolutionIndex: 98
    SolutionNameMin: Cijk_Alik_Bljk_F8BS_BH_BiasSB_HAS_SAB_SAV_UserArgs_MT64x32x128_MI16x16x1_SN_GSU1_MIWT2_1_NEPBS16_SU0_SUM0_SUS0_SVW2_WGM1
    SolutionIndex: 99
    SolutionNameMin: Cijk_Alik_Bljk_F8BS_BH_BiasSB_HAS_SAB_SAV_UserArgs_MT64x128x256_MI16x16x1_SN_GSU1_MIWT2_4_NEPBS0_SU8_SUM1_SUS512_SVW2_WGM1
    SolutionIndex: 100
    SolutionNameMin: Cijk_Alik_Bljk_F8BS_BH_BiasSB_HAS_SAB_SAV_UserArgs_MT256x128x128_MI16x16x1_SN_GSU1_MIWT16_2_NEPBS0_SU16_SUM0_SUS256_SVW8_WGM4
    SolutionIndex: 101
    SolutionNameMin: Cijk_Alik_Bljk_F8BS_BH_BiasSB_HAS_SAB_SAV_UserArgs_MT80x128x256_MI16x16x1_SN_GRVWA16_GRVWB16_GSU1_LPA32_LPB32_LRVW16_MIWT5_2_NEPBS0_SU8_SUM1_SUS512_WGM1
    SolutionIndex: 102
    SolutionNameMin: Cijk_Alik_Bljk_F8BS_BH_BiasSB_HAS_SAB_SAV_UserArgs_MT16x32x512_MI16x16x1_SN_GSU1_MIWT1_1_NEPBS0_SU0_SUM0_SUS0_WGM1
    SolutionIndex: 103
    SolutionNameMin: Cijk_Alik_Bljk_F8BS_BH_BiasSB_HAS_SAB_SAV_UserArgs_MT64x32x128_MI16x16x1_SN_GSU1_MIWT2_1_NEPBS16_SU0_SUM0_SUS0_SVW2_WGM1
    SolutionIndex: 104
    SolutionNameMin: Cijk_Alik_Bljk_F8BS_BH_BiasSB_HAS_SAB_SAV_UserArgs_MT64x64x128_MI16x16x1_SN_GSU1_MIWT1_4_NEPBS16_SU0_SUM0_SUS0_WGM32
    SolutionIndex: 105
    SolutionNameMin: Cijk_Alik_Bljk_F8BS_BH_BiasSB_HAS_SAB_SAV_UserArgs_MT160x192x128_MI16x16x1_SN_GSU1_MIWT10_3_NEPBS0_SU0_SUM0_SUS0_SVW2_WGM16
    SolutionIndex: 106
    SolutionNameMin: Cijk_Alik_Bljk_F8BS_BH_BiasSB_HAS_SAB_SAV_UserArgs_MT32x64x128_MI16x16x1_SN_GSU1_MIWT2_1_NEPBS16_SU0_SUM0_SUS0_SVW2_WGM1
    SolutionIndex: 107
    SolutionNameMin: Cijk_Alik_Bljk_F8BS_BH_BiasSB_HAS_SAB_SAV_UserArgs_MT64x96x256_MI16x16x1_SN_GSU1_MIWT2_3_NEPBS16_SU16_SUM1_SUS512_SVW2_WGM0
    SolutionIndex: 108
    SolutionNameMin: Cijk_Alik_Bljk_F8BS_BH_BiasSB_HAS_SAB_SAV_UserArgs_MT128x128x128_MI16x16x1_SN_GSU1_MIWT4_4_NEPBS16_SU0_SUM0_SUS0_SVW4_WGM8
    SolutionIndex: 109
    SolutionNameMin: Cijk_Alik_Bljk_F8BS_BH_BiasSB_HAS_SAB_SAV_UserArgs_MT32x16x256_MI16x16x1_SN_GSU1_MIWT1_1_NEPBS16_SU8_SUM1_SUS512_WGM4
    SolutionIndex: 110
    SolutionNameMin: Cijk_Alik_Bljk_F8BS_BH_BiasSB_HAS_SAB_SAV_UserArgs_MT16x32x512_MI16x16x1_SN_GSU1_MIWT1_1_NEPBS16_SU0_SUM0_SUS0_WGM0
    SolutionIndex: 111
    SolutionNameMin: Cijk_Alik_Bljk_F8BS_BH_BiasSB_HAS_SAB_SAV_UserArgs_MT64x32x256_MI16x16x1_SN_GSU1_MIWT2_1_NEPBS16_SU16_SUM1_SUS512_SVW2_WGM1
    SolutionIndex: 112
    SolutionNameMin: Cijk_Alik_Bljk_F8BS_BH_BiasSB_HAS_SAB_SAV_UserArgs_MT224x256x128_MI16x16x1_SN_GSU1_MIWT14_4_NEPBS0_SU8_SUM1_SUS256_SVW2_WGM0
    SolutionIndex: 113
    SolutionNameMin: Cijk_Alik_Bljk_F8BS_BH_BiasSB_HAS_SAB_SAV_UserArgs_MT64x32x256_MI16x16x1_SN_GSU1_MIWT2_1_NEPBS16_SU4_SUM1_SUS512_SVW2_WGM0
    SolutionIndex: 114
    SolutionNameMin: Cijk_Alik_Bljk_F8BS_BH_BiasSB_HAS_SAB_SAV_UserArgs_MT96x96x256_MI16x16x1_SN_GSU1_MIWT3_3_NEPBS0_SU0_SUM0_SUS0_WGM8
    SolutionIndex: 115
    SolutionNameMin: Cijk_Alik_Bljk_F8BS_BH_BiasSB_HAS_SAB_SAV_UserArgs_MT64x48x256_MI16x16x1_SN_GSU1_MIWT1_3_NEPBS16_SU16_SUM1_SUS512_WGM0
    SolutionIndex: 116
    SolutionNameMin: Cijk_Alik_Bljk_F8BS_BH_BiasSB_HAS_SAB_SAV_UserArgs_MT96x64x256_MI16x16x1_SN_GSU2_MIWT3_2_NEPBS16_SU8_SUM0_SUS512_WGM32
    SolutionIndex: 117
    SolutionNameMin: Cijk_Alik_Bljk_F8BS_BH_BiasSB_HAS_SAB_SAV_UserArgs_MT128x96x128_MI16x16x1_SN_GSU1_MIWT4_3_NEPBS16_SU32_SUM1_SUS256_SVW4_WGM8
    SolutionIndex: 118
    SolutionNameMin: Cijk_Alik_Bljk_F8BS_BH_BiasSB_HAS_SAB_SAV_UserArgs_MT16x16x256_MI16x16x1_SN_GSU1_MIWT1_1_NEPBS16_SU4_SUM1_SUS512_WGM1
    SolutionIndex: 119
    SolutionNameMin: Cijk_Alik_Bljk_F8BS_BH_BiasSB_HAS_SAB_SAV_UserArgs_MT96x32x256_MI16x16x1_SN_GSU6_MIWT3_1_NEPBS16_SU4_SUM1_SUS512_WGM16
    SolutionIndex: 120
    SolutionNameMin: Cijk_Alik_Bljk_F8BS_BH_BiasSB_HAS_SAB_SAV_UserArgs_MT32x64x128_MI16x16x1_SN_GSU1_MIWT2_1_NEPBS0_SU16_SUM1_SUS256_SVW2_WGM32
    SolutionIndex: 121
    SolutionNameMin: Cijk_Alik_Bljk_F8BS_BH_BiasSB_HAS_SAB_SAV_UserArgs_MT256x176x32_MI16x16x1_SN_GSU1_MIWT4_11_NEPBS16_SU8_SUM1_SUS64_SVW4_WGM16
    SolutionIndex: 122
    SolutionNameMin: Cijk_Alik_Bljk_F8BS_BH_BiasSB_HAS_SAB_SAV_UserArgs_MT256x192x64_MI16x16x1_SN_GRVWA8_GRVWB8_GSU1_LPA8_LPB8_LRVW8_MIWT8_6_NEPBS16_SU4_SUM0_SUS128_SVW8_WGM4
    SolutionIndex: 123
    SolutionNameMin: Cijk_Alik_Bljk_F8BS_BH_BiasSB_HAS_SAB_SAV_UserArgs_MT128x240x64_MI16x16x1_SN_GSU1_MIWT2_15_NEPBS16_SU16_SUM1_SUS128_SVW2_WGM16
    SolutionIndex: 124
    SolutionNameMin: Cijk_Alik_Bljk_F8BS_BH_BiasSB_HAS_SAB_SAV_UserArgs_MT16x16x256_MI16x16x1_SN_GSU1_MIWT1_1_NEPBS16_SU0_SUM0_SUS0_WGM0
    SolutionIndex: 125
    SolutionNameMin: Cijk_Alik_Bljk_F8BS_BH_BiasSB_HAS_SAB_SAV_UserArgs_MT128x224x64_MI16x16x1_SN_GSU1_MIWT4_7_NEPBS16_SU4_SUM1_SUS128_SVW4_WGM16
    SolutionIndex: 126
    SolutionNameMin: Cijk_Alik_Bljk_F8BS_BH_BiasSB_HAS_SAB_SAV_UserArgs_MT256x224x128_MI16x16x1_SN_GSU1_MIWT8_7_NEPBS0_SU0_SUM0_SUS0_SVW8_WGM4
    SolutionIndex: 127
    SolutionNameMin: Cijk_Alik_Bljk_F8BS_BH_BiasSB_HAS_SAB_SAV_UserArgs_MT48x64x128_MI16x16x1_SN_GSU1_MIWT3_1_NEPBS16_SU0_SUM0_SUS0_WGM1
    SolutionIndex: 128
    SolutionNameMin: Cijk_Alik_Bljk_F8BS_BH_BiasSB_HAS_SAB_SAV_UserArgs_MT128x240x64_MI16x16x1_SN_GSU1_MIWT2_15_NEPBS0_SU0_SUM0_SUS0_SVW2_WGM4
    SolutionIndex: 129
    SolutionNameMin: Cijk_Alik_Bljk_F8BS_BH_BiasSB_HAS_SAB_SAV_UserArgs_MT128x16x128_MI16x16x1_SN_GSU1_MIWT2_1_NEPBS16_SU4_SUM0_SUS256_SVW2_WGM0
    SolutionIndex: 130
    SolutionNameMin: Cijk_Alik_Bljk_F8BS_BH_BiasSB_HAS_SAB_SAV_UserArgs_MT16x16x512_MI16x16x1_SN_GSU1_MIWT1_1_NEPBS16_SU4_SUM1_SUS1024_WGM1
    SolutionIndex: 131
    SolutionNameMin: Cijk_Alik_Bljk_F8BS_BH_BiasSB_HAS_SAB_SAV_UserArgs_MT128x16x128_MI16x16x1_SN_GSU1_MIWT2_1_NEPBS16_SU8_SUM1_SUS256_SVW2_WGM0
    SolutionIndex: 132
    SolutionNameMin: Cijk_Alik_Bljk_F8BS_BH_BiasSB_HAS_SAB_SAV_UserArgs_MT128x256x128_MI16x16x1_SN_GSU1_MIWT4_8_NEPBS16_SU8_SUM0_SUS256_SVW4_WGM0
    SolutionIndex: 133
    SolutionNameMin: Cijk_Alik_Bljk_F8BS_BH_BiasSB_HAS_SAB_SAV_UserArgs_MT16x16x256_MI16x16x1_SN_GSU1_MIWT1_1_NEPBS16_SU0_SUM0_SUS0_WGM1
    SolutionIndex: 134
    SolutionNameMin: Cijk_Alik_Bljk_F8BS_BH_BiasSB_HAS_SAB_SAV_UserArgs_MT128x128x128_MI16x16x1_SN_GSU1_MIWT4_4_NEPBS0_SU4_SUM0_SUS256_SVW4_WGM4
    SolutionIndex: 135
    SolutionNameMin: Cijk_Alik_Bljk_F8BS_BH_BiasSB_HAS_SAB_SAV_UserArgs_MT64x32x128_MI16x16x1_SN_GSU1_MIWT2_1_NEPBS0_SU4_SUM1_SUS256_SVW2_WGM16
    SolutionIndex: 136
    SolutionNameMin: Cijk_Alik_Bljk_F8BS_BH_BiasSB_HAS_SAB_SAV_UserArgs_MT32x64x128_MI16x16x1_SN_GSU8_MIWT2_1_NEPBS0_SU8_SUM0_SUS256_SVW2_WGM4
    SolutionIndex: 137
    SolutionNameMin: Cijk_Alik_Bljk_F8BS_BH_BiasSB_HAS_SAB_SAV_UserArgs_MT32x64x128_MI16x16x1_SN_GSU1_MIWT2_1_NEPBS0_SU8_SUM1_SUS256_SVW2_WGM8
    SolutionIndex: 138
    SolutionNameMin: Cijk_Alik_Bljk_F8BS_BH_BiasSB_HAS_SAB_SAV_UserArgs_MT64x64x128_MI16x16x1_SN_GSU1_MIWT4_1_NEPBS0_SU0_SUM0_SUS0_SVW4_WGM4
    SolutionIndex: 139
    SolutionNameMin: Cijk_Alik_Bljk_F8BS_BH_BiasSB_HAS_SAB_SAV_UserArgs_MT64x64x128_MI16x16x1_SN_GSU1_MIWT2_2_NEPBS16_SU4_SUM1_SUS256_SVW2_WGM8
    SolutionIndex: 140
    SolutionNameMin: Cijk_Alik_Bljk_F8BS_BH_BiasSB_HAS_SAB_SAV_UserArgs_MT160x64x128_MI16x16x1_SN_GSU1_MIWT5_2_NEPBS16_SU8_SUM1_SUS256_WGM1
    SolutionIndex: 141
    SolutionNameMin: Cijk_Alik_Bljk_F8BS_BH_BiasSB_HAS_SAB_SAV_UserArgs_MT32x32x128_MI16x16x1_SN_GSU1_MIWT1_1_NEPBS16_SU0_SUM0_SUS0_WGM1
    SolutionIndex: 142
    SolutionNameMin: Cijk_Alik_Bljk_F8BS_BH_BiasSB_HAS_SAB_SAV_UserArgs_MT64x32x128_MI16x16x1_SN_GSU4_MIWT2_1_NEPBS16_SU4_SUM1_SUS256_SVW2_WGM0
    SolutionIndex: 143
    SolutionNameMin: Cijk_Alik_Bljk_F8BS_BH_BiasSB_HAS_SAB_SAV_UserArgs_MT16x64x64_MI16x16x1_SN_GSU4_MIWT1_1_NEPBS16_SU16_SUM1_SUS128_WGM32
    SolutionIndex: 144
    SolutionNameMin: Cijk_Alik_Bljk_F8BS_BH_BiasSB_HAS_SAB_SAV_UserArgs_MT32x64x128_MI16x16x1_SN_GSU4_MIWT2_1_NEPBS16_SU4_SUM0_SUS256_SVW2_WGM1
    SolutionIndex: 145
    SolutionNameMin: Cijk_Alik_Bljk_F8BS_BH_BiasSB_HAS_SAB_SAV_UserArgs_MT32x64x128_MI16x16x1_SN_GSU1_MIWT2_1_NEPBS16_SU8_SUM0_SUS256_SVW2_WGM1
    SolutionIndex: 146
    SolutionNameMin: Cijk_Alik_Bljk_F8BS_BH_BiasSB_HAS_SAB_SAV_UserArgs_MT16x32x256_MI16x16x1_SN_GSU1_MIWT1_1_NEPBS16_SU4_SUM1_SUS512_WGM32
    SolutionIndex: 147
    SolutionNameMin: Cijk_Alik_Bljk_F8BS_BH_BiasSB_HAS_SAB_SAV_UserArgs_MT32x64x512_MI16x16x1_SN_GSU1_MIWT2_1_NEPBS16_SU32_SUM0_SUS1024_WGM16
    SolutionIndex: 148
    SolutionNameMin: Cijk_Alik_Bljk_F8BS_BH_BiasSB_HAS_SAB_SAV_UserArgs_MT80x256x128_MI16x16x1_SN_GSU1_MIWT5_4_NEPBS16_SU4_SUM1_SUS256_WGM16
    SolutionIndex: 149
    SolutionNameMin: Cijk_Alik_Bljk_F8BS_BH_BiasSB_HAS_SAB_SAV_UserArgs_MT80x256x128_MI16x16x1_SN_GSU1_MIWT5_4_NEPBS0_SU8_SUM0_SUS256_WGM32
    SolutionIndex: 150
    SolutionNameMin: Cijk_Alik_Bljk_F8BS_BH_BiasSB_HAS_SAB_SAV_UserArgs_MT16x16x256_MI16x16x1_SN_GSU1_MIWT1_1_NEPBS0_SU0_SUM0_SUS0_WGM0
    SolutionIndex: 151
    SolutionNameMin: Cijk_Alik_Bljk_F8BS_BH_BiasSB_HAS_SAB_SAV_UserArgs_MT256x160x128_MI16x16x1_SN_GRVWA16_GRVWB16_GSU1_LPA32_LPB32_LRVW16_MIWT8_5_NEPBS0_SU4_SUM0_SUS256_SVW8_WGM1
    SolutionIndex: 152
    SolutionNameMin: Cijk_Alik_Bljk_F8BS_BH_BiasSB_HAS_SAB_SAV_UserArgs_MT64x64x128_MI16x16x1_SN_GSU1_MIWT2_2_NEPBS16_SU4_SUM1_SUS256_SVW2_WGM1
    SolutionIndex: 153
    SolutionNameMin: Cijk_Alik_Bljk_F8BS_BH_BiasSB_HAS_SAB_SAV_UserArgs_MT256x224x64_MI16x16x1_SN_GSU1_MIWT4_14_NEPBS0_SU16_SUM0_SUS128_SVW4_WGM0
    SolutionIndex: 154
    SolutionNameMin: Cijk_Alik_Bljk_F8BS_BH_BiasSB_HAS_SAB_SAV_UserArgs_MT256x64x128_MI16x16x1_SN_GSU1_MIWT4_4_NEPBS16_SU4_SUM0_SUS256_SVW4_WGM8
    SolutionIndex: 155
    SolutionNameMin: Cijk_Alik_Bljk_F8BS_BH_BiasSB_HAS_SAB_SAV_UserArgs_MT128x16x128_MI16x16x1_SN_GSU1_MIWT2_1_NEPBS0_SU8_SUM1_SUS256_SVW2_WGM1
    SolutionIndex: 156
    SolutionNameMin: Cijk_Alik_Bljk_F8BS_BH_BiasSB_HAS_SAB_SAV_UserArgs_MT16x16x512_MI16x16x1_SN_GSU1_MIWT1_1_NEPBS16_SU4_SUM1_SUS1024_WGM1
    SolutionIndex: 157
    SolutionNameMin: Cijk_Alik_Bljk_F8BS_BH_BiasSB_HAS_SAB_SAV_UserArgs_MT448x32x64_MI16x16x1_SN_GSU1_MIWT14_1_NEPBS0_SU4_SUM0_SUS128_SVW2_WGM1
    SolutionIndex: 158
    SolutionNameMin: Cijk_Alik_Bljk_F8BS_BH_BiasSB_HAS_SAB_SAV_UserArgs_MT16x32x512_MI16x16x1_SN_GSU1_MIWT1_1_NEPBS16_SU4_SUM1_SUS1024_WGM0
    SolutionIndex: 159
    SolutionNameMin: Cijk_Alik_Bljk_F8BS_BH_BiasSB_HAS_SAB_SAV_UserArgs_MT16x16x256_MI16x16x1_SN_GSU1_MIWT1_1_NEPBS16_SU0_SUM0_SUS0_WGM1
    SolutionIndex: 160
    SolutionNameMin: Cijk_Alik_Bljk_F8BS_BH_BiasSB_HAS_SAB_SAV_UserArgs_MT160x128x128_MI16x16x1_SN_GSU1_MIWT5_4_NEPBS16_SU4_SUM0_SUS256_WGM4
    SolutionIndex: 161
    SolutionNameMin: Cijk_Alik_Bljk_F8BS_BH_BiasSB_HAS_SAB_SAV_UserArgs_MT16x16x256_MI16x16x1_SN_GSU1_MIWT1_1_NEPBS16_SU0_SUM0_SUS0_WGM1
    SolutionIndex: 162
    SolutionNameMin: Cijk_Alik_Bljk_F8BS_BH_BiasSB_HAS_SAB_SAV_UserArgs_MT64x64x128_MI16x16x1_SN_GSU1_MIWT2_2_NEPBS0_SU16_SUM0_SUS256_SVW2_WGM16
    SolutionIndex: 163
    SolutionNameMin: Cijk_Alik_Bljk_F8BS_BH_BiasSB_HAS_SAB_SAV_UserArgs_MT64x96x128_MI16x16x1_SN_GSU5_MIWT2_3_NEPBS0_SU16_SUM0_SUS256_SVW2_WGM16
    SolutionIndex: 164
    SolutionNameMin: Cijk_Alik_Bljk_F8BS_BH_BiasSB_HAS_SAB_SAV_UserArgs_MT64x64x128_MI16x16x1_SN_GSU1_MIWT2_2_NEPBS16_SU16_SUM0_SUS256_SVW2_WGM8
    SolutionIndex: 165
    SolutionNameMin: Cijk_Alik_Bljk_F8BS_BH_BiasSB_HAS_SAB_SAV_UserArgs_MT128x64x256_MI16x16x1_SN_GSU1_MIWT8_1_NEPBS16_SU32_SUM0_SUS512_SVW8_WGM4
    SolutionIndex: 166
    SolutionNameMin: Cijk_Alik_Bljk_F8BS_BH_BiasSB_HAS_SAB_SAV_UserArgs_MT64x128x128_MI16x16x1_SN_GSU1_MIWT4_2_NEPBS16_SU4_SUM1_SUS256_SVW4_WGM4
    SolutionIndex: 167
    SolutionNameMin: Cijk_Alik_Bljk_F8BS_BH_BiasSB_HAS_SAB_SAV_UserArgs_MT224x96x128_MI16x16x1_SN_GSU1_MIWT7_3_NEPBS0_SU4_SUM0_SUS256_WGM16
    SolutionIndex: 168
    SolutionNameMin: Cijk_Alik_Bljk_F8BS_BH_BiasSB_HAS_SAB_SAV_UserArgs_MT32x16x128_MI16x16x1_SN_GSU1_MIWT1_1_NEPBS0_SU0_SUM0_SUS0_WGM1
    SolutionIndex: 169
    SolutionNameMin: Cijk_Alik_Bljk_F8BS_BH_BiasSB_HAS_SAB_SAV_UserArgs_MT32x96x128_MI16x16x1_SN_GSU3_MIWT1_3_NEPBS16_SU4_SUM0_SUS256_WGM8
    SolutionIndex: 170
    SolutionNameMin: Cijk_Alik_Bljk_F8BS_BH_BiasSB_HAS_SAB_SAV_UserArgs_MT32x32x256_MI16x16x1_SN_GSU1_MIWT1_1_NEPBS16_SU8_SUM1_SUS512_WGM8
    SolutionIndex: 171
    SolutionNameMin: Cijk_Alik_Bljk_F8BS_BH_BiasSB_HAS_SAB_SAV_UserArgs_MT32x96x128_MI16x16x1_SN_GSU3_MIWT1_3_NEPBS16_SU8_SUM0_SUS256_WGM16
    SolutionIndex: 172
    SolutionNameMin: Cijk_Alik_Bljk_F8BS_BH_BiasSB_HAS_SAB_SAV_UserArgs_MT64x64x128_MI16x16x1_SN_GSU1_MIWT2_2_NEPBS0_SU8_SUM0_SUS256_SVW2_WGM16
    SolutionIndex: 173
    SolutionNameMin: Cijk_Alik_Bljk_F8BS_BH_BiasSB_HAS_SAB_SAV_UserArgs_MT64x32x256_MI16x16x1_SN_GSU1_MIWT2_1_NEPBS16_SU32_SUM0_SUS512_SVW2_WGM8
    SolutionIndex: 174
    SolutionNameMin: Cijk_Alik_Bljk_F8BS_BH_BiasSB_HAS_SAB_SAV_UserArgs_MT64x64x256_MI16x16x1_SN_GSU1_MIWT2_2_NEPBS0_SU4_SUM0_SUS512_SVW2_WGM16
    SolutionIndex: 175
    SolutionNameMin: Cijk_Alik_Bljk_F8BS_BH_BiasSB_HAS_SAB_SAV_UserArgs_MT256x128x64_MI16x16x1_SN_GRVWA8_GRVWB8_GSU1_LPA8_LPB8_LRVW8_MIWT4_8_NEPBS16_SU8_SUM0_SUS128_SVW4_WGM4
    SolutionIndex: 176
    SolutionNameMin: Cijk_Alik_Bljk_F8BS_BH_BiasSB_HAS_SAB_SAV_UserArgs_MT16x16x256_MI16x16x1_SN_GSU1_MIWT1_1_NEPBS0_SU0_SUM0_SUS0_WGM1
    SolutionIndex: 177
    SolutionNameMin: Cijk_Alik_Bljk_F8BS_BH_BiasSB_HAS_SAB_SAV_UserArgs_MT128x128x128_MI16x16x1_SN_GSU1_MIWT4_4_NEPBS0_SU0_SUM0_SUS0_SVW4_WGM32
    SolutionIndex: 178
    SolutionNameMin: Cijk_Alik_Bljk_F8BS_BH_BiasSB_HAS_SAB_SAV_UserArgs_MT128x128x128_MI16x16x1_SN_GSU4_MIWT4_4_NEPBS16_SU16_SUM1_SUS256_SVW4_WGM0
    SolutionIndex: 179
    SolutionNameMin: Cijk_Alik_Bljk_F8BS_BH_BiasSB_HAS_SAB_SAV_UserArgs_MT128x80x128_MI16x16x1_SN_GSU1_MIWT2_5_NEPBS16_SU0_SUM0_SUS0_SVW2_WGM8
    SolutionIndex: 180
    SolutionNameMin: Cijk_Alik_Bljk_F8BS_BH_BiasSB_HAS_SAB_SAV_UserArgs_MT128x128x128_MI16x16x1_SN_GSU1_MIWT4_4_NEPBS16_SU4_SUM0_SUS256_SVW4_WGM16
    SolutionIndex: 181
    SolutionNameMin: Cijk_Alik_Bljk_F8BS_BH_BiasSB_HAS_SAB_SAV_UserArgs_MT128x128x128_MI16x16x1_SN_GSU1_MIWT4_4_NEPBS16_SU32_SUM0_SUS256_SVW4_WGM32
    SolutionIndex: 182
    SolutionNameMin: Cijk_Alik_Bljk_F8BS_BH_BiasSB_HAS_SAB_SAV_UserArgs_MT128x160x64_MI16x16x1_SN_GSU1_MIWT2_10_NEPBS16_SU8_SUM0_SUS128_SVW2_WGM8
    SolutionIndex: 183
    SolutionNameMin: Cijk_Alik_Bljk_F8BS_BH_BiasSB_HAS_SAB_SAV_UserArgs_MT32x32x128_MI16x16x1_SN_GSU1_MIWT1_1_NEPBS0_SU0_SUM0_SUS0_WGM1
    SolutionIndex: 184
    SolutionNameMin: Cijk_Alik_Bljk_F8BS_BH_BiasSB_HAS_SAB_SAV_UserArgs_MT32x64x128_MI16x16x1_SN_GSU1_MIWT2_1_NEPBS16_SU16_SUM0_SUS256_SVW2_WGM8
    SolutionIndex: 185
    SolutionNameMin: Cijk_Alik_Bljk_F8BS_BH_BiasSB_HAS_SAB_SAV_UserArgs_MT32x64x128_MI16x16x1_SN_GSU1_MIWT2_1_NEPBS0_SU4_SUM1_SUS256_SVW2_WGM16
    SolutionIndex: 186
    SolutionNameMin: Cijk_Alik_Bljk_F8BS_BH_BiasSB_HAS_SAB_SAV_UserArgs_MT32x64x128_MI16x16x1_SN_GSU1_MIWT1_2_NEPBS16_SU4_SUM0_SUS256_WGM16
    SolutionIndex: 187
    SolutionNameMin: Cijk_Alik_Bljk_F8BS_BH_BiasSB_HAS_SAB_SAV_UserArgs_MT128x128x128_MI16x16x1_SN_GSU1_MIWT4_4_NEPBS0_SU4_SUM0_SUS256_SVW4_WGM32
    SolutionIndex: 188
    SolutionNameMin: Cijk_Alik_Bljk_F8BS_BH_BiasSB_HAS_SAB_SAV_UserArgs_MT64x64x256_MI16x16x1_SN_GSU1_MIWT2_2_NEPBS0_SU0_SUM0_SUS0_SVW2_WGM4
    SolutionIndex: 189
    SolutionNameMin: Cijk_Alik_Bljk_F8BS_BH_BiasSB_HAS_SAB_SAV_UserArgs_MT128x64x128_MI16x16x1_SN_GSU1_MIWT4_2_NEPBS0_SU16_SUM1_SUS256_SVW4_WGM8
    SolutionIndex: 190
    SolutionNameMin: Cijk_Alik_Bljk_F8BS_BH_BiasSB_HAS_SAB_SAV_UserArgs_MT256x144x128_MI16x16x1_SN_GSU1_MIWT4_9_NEPBS16_SU8_SUM0_SUS256_SVW4_WGM8
    SolutionIndex: 191
    SolutionNameMin: Cijk_Alik_Bljk_F8BS_BH_BiasSB_HAS_SAB_SAV_UserArgs_MT256x160x32_MI16x16x1_SN_GSU1_MIWT4_10_NEPBS0_SU16_SUM0_SUS64_SVW4_WGM32
    SolutionIndex: 192
    SolutionNameMin: Cijk_Alik_Bljk_F8BS_BH_BiasSB_HAS_SAB_SAV_UserArgs_MT64x64x256_MI16x16x1_SN_GSU5_MIWT4_1_NEPBS16_SU4_SUM0_SUS512_SVW4_WGM1
    SolutionIndex: 193
    SolutionNameMin: Cijk_Alik_Bljk_F8BS_BH_BiasSB_HAS_SAB_SAV_UserArgs_MT32x64x256_MI16x16x1_SN_GSU1_MIWT1_2_NEPBS0_SU32_SUM1_SUS512_WGM1
    SolutionIndex: 194
    SolutionNameMin: Cijk_Alik_Bljk_F8BS_BH_BiasSB_HAS_SAB_SAV_UserArgs_MT48x64x256_MI16x16x1_SN_GSU1_MIWT3_1_NEPBS0_SU16_SUM0_SUS512_WGM32
    SolutionIndex: 195
    SolutionNameMin: Cijk_Alik_Bljk_F8BS_BH_BiasSB_HAS_SAB_SAV_UserArgs_MT192x256x32_MI16x16x1_SN_GSU1_MIWT12_4_NEPBS0_SU32_SUM0_SUS64_SVW4_WGM16
    SolutionIndex: 196
    SolutionNameMin: Cijk_Alik_Bljk_F8BS_BH_BiasSB_HAS_SAB_SAV_UserArgs_MT256x224x128_MI16x16x1_SN_GSU1_MIWT4_14_NEPBS16_SU8_SUM0_SUS256_SVW4_WGM4
- - - [7168, 2, 1, 8192]
    - [1, 0.0]
  - - [3584, 2, 1, 8192]
    - [2, 0.0]
  - - [1024, 2, 1, 8192]
    - [3, 0.0]
  - - [7168, 8192, 1, 8192]
    - [4, 0.0]
  - - [3584, 8192, 1, 8192]
    - [5, 0.0]
  - - [1280, 8192, 1, 8192]
    - [6, 0.0]
  - - [1024, 8192, 1, 8192]
    - [7, 0.0]
  - - [7168, 16384, 1, 8192]
    - [8, 0.0]
  - - [3584, 16384, 1, 8192]
    - [9, 0.0]
  - - [1280, 16384, 1, 8192]
    - [10, 0.0]
  - - [1024, 16384, 1, 8192]
    - [11, 0.0]
  - - [7168, 32768, 1, 8192]
    - [12, 0.0]
  - - [3584, 32768, 1, 8192]
    - [13, 0.0]
  - - [1280, 32768, 1, 8192]
    - [14, 0.0]
  - - [1024, 32768, 1, 8192]
    - [15, 0.0]
  - - [7168, 4, 1, 8192]
    - [16, 0.0]
  - - [3584, 4, 1, 8192]
    - [17, 0.0]
  - - [1024, 4, 1, 8192]
    - [18, 0.0]
  - - [7168, 65536, 1, 8192]
    - [19, 0.0]
  - - [3584, 65536, 1, 8192]
    - [20, 0.0]
  - - [1280, 65536, 1, 8192]
    - [21, 0.0]
  - - [1024, 65536, 1, 8192]
    - [22, 0.0]
  - - [7168, 8, 1, 8192]
    - [24, 0.0]
  - - [3584, 8, 1, 8192]
    - [25, 0.0]
  - - [1024, 8, 1, 8192]
    - [26, 0.0]
  - - [7168, 131072, 1, 8192]
    - [27, 0.0]
  - - [3584, 131072, 1, 8192]
    - [28, 0.0]
  - - [1280, 131072, 1, 8192]
    - [29, 0.0]
  - - [1024, 131072, 1, 8192]
    - [27, 0.0]
  - - [7168, 16, 1, 8192]
    - [30, 0.0]
  - - [3584, 16, 1, 8192]
    - [31, 0.0]
  - - [1024, 16, 1, 8192]
    - [32, 0.0]
  - - [7168, 262144, 1, 8192]
    - [33, 0.0]
  - - [3584, 262144, 1, 8192]
    - [27, 0.0]
  - - [1280, 262144, 1, 8192]
    - [34, 0.0]
  - - [1024, 262144, 1, 8192]
    - [35, 0.0]
  - - [7168, 32, 1, 8192]
    - [36, 0.0]
  - - [3584, 32, 1, 8192]
    - [37, 0.0]
  - - [1024, 32, 1, 8192]
    - [38, 0.0]
  - - [7168, 524288, 1, 8192]
    - [39, 0.0]
  - - [3584, 524288, 1, 8192]
    - [40, 0.0]
  - - [1280, 524288, 1, 8192]
    - [41, 0.0]
  - - [1024, 524288, 1, 8192]
    - [35, 0.0]
  - - [8192, 64, 1, 1024]
    - [42, 0.0]
  - - [8192, 64, 1, 3584]
    - [194, 0.0]
  - - [7168, 64, 1, 8192]
    - [193, 0.0]
  - - [3584, 64, 1, 8192]
    - [192, 0.0]
  - - [1280, 64, 1, 8192]
    - [43, 0.0]
  - - [1024, 64, 1, 8192]
    - [44, 0.0]
  - - [7168, 1048576, 1, 8192]
    - [27, 0.0]
  - - [3584, 1048576, 1, 8192]
    - [40, 0.0]
  - - [1280, 1048576, 1, 8192]
    - [45, 0.0]
  - - [1024, 1048576, 1, 8192]
    - [46, 0.0]
  - - [8192, 128, 1, 1024]
    - [47, 0.0]
  - - [8192, 128, 1, 3584]
    - [48, 0.0]
  - - [7168, 128, 1, 8192]
    - [49, 0.0]
  - - [3584, 128, 1, 8192]
    - [50, 0.0]
  - - [1280, 128, 1, 8192]
    - [51, 0.0]
  - - [1024, 128, 1, 8192]
    - [52, 0.0]
  - - [7168, 2097152, 1, 8192]
    - [53, 0.0]
  - - [3584, 2097152, 1, 8192]
    - [54, 0.0]
  - - [1280, 2097152, 1, 8192]
    - [55, 0.0]
  - - [1024, 2097152, 1, 8192]
    - [56, 0.0]
  - - [256, 256, 1, 256]
    - [57, 0.0]
  - - [384, 384, 1, 384]
    - [58, 0.0]
  - - [512, 512, 1, 512]
    - [59, 0.0]
  - - [640, 640, 1, 640]
    - [60, 0.0]
  - - [768, 768, 1, 768]
    - [61, 0.0]
  - - [896, 896, 1, 896]
    - [62, 0.0]
  - - [1024, 1024, 1, 1024]
    - [63, 0.0]
  - - [1152, 1152, 1, 1152]
    - [64, 0.0]
  - - [1280, 1280, 1, 1280]
    - [65, 0.0]
  - - [1408, 1408, 1, 1408]
    - [66, 0.0]
  - - [1536, 1536, 1, 1536]
    - [67, 0.0]
  - - [1664, 1664, 1, 1664]
    - [68, 0.0]
  - - [1792, 1792, 1, 1792]
    - [69, 0.0]
  - - [1920, 1920, 1, 1920]
    - [70, 0.0]
  - - [2048, 2048, 1, 2048]
    - [71, 0.0]
  - - [2176, 2176, 1, 2176]
    - [72, 0.0]
  - - [2304, 2304, 1, 2304]
    - [73, 0.0]
  - - [2432, 2432, 1, 2432]
    - [74, 0.0]
  - - [2560, 2560, 1, 2560]
    - [75, 0.0]
  - - [2688, 2688, 1, 2688]
    - [76, 0.0]
  - - [2816, 2816, 1, 2816]
    - [190, 0.0]
  - - [2944, 2944, 1, 2944]
    - [77, 0.0]
  - - [3072, 3072, 1, 3072]
    - [78, 0.0]
  - - [3200, 3200, 1, 3200]
    - [79, 0.0]
  - - [3328, 3328, 1, 3328]
    - [80, 0.0]
  - - [3456, 3456, 1, 3456]
    - [81, 0.0]
  - - [3584, 3584, 1, 3584]
    - [82, 0.0]
  - - [3712, 3712, 1, 3712]
    - [83, 0.0]
  - - [3840, 3840, 1, 3840]
    - [84, 0.0]
  - - [3968, 3968, 1, 3968]
    - [85, 0.0]
  - - [4096, 4096, 1, 4096]
    - [86, 0.0]
  - - [4000, 2, 1, 8192]
    - [87, 0.0]
  - - [4000, 8192, 1, 8192]
    - [88, 0.0]
  - - [16384, 128, 1, 2304]
    - [89, 0.0]
  - - [6, 384, 1, 1536]
    - [90, 0.0]
  - - [6, 3072, 1, 768]
    - [91, 0.0]
  - - [16384, 2, 1, 2304]
    - [92, 0.0]
  - - [6144, 384, 1, 384]
    - [93, 0.0]
  - - [2048, 131072, 1, 16384]
    - [94, 0.0]
  - - [462, 768, 1, 384]
    - [95, 0.0]
  - - [462, 4096, 1, 384]
    - [96, 0.0]
  - - [16384, 32768, 1, 2304]
    - [97, 0.0]
  - - [462, 1472, 1, 384]
    - [98, 0.0]
  - - [6144, 384, 1, 3072]
    - [99, 0.0]
  - - [6144, 1536, 1, 384]
    - [100, 0.0]
  - - [16384, 128, 1, 13312]
    - [101, 0.0]
  - - [6, 3072, 1, 1536]
    - [102, 0.0]
  - - [2048, 65536, 1, 16384]
    - [94, 0.0]
  - - [1536, 768, 1, 768]
    - [103, 0.0]
  - - [462, 768, 1, 768]
    - [95, 0.0]
  - - [462, 4096, 1, 768]
    - [104, 0.0]
  - - [2048, 8192, 1, 16384]
    - [105, 0.0]
  - - [462, 1472, 1, 768]
    - [106, 0.0]
  - - [1536, 768, 1, 6144]
    - [107, 0.0]
  - - [1536, 3072, 1, 768]
    - [108, 0.0]
  - - [16384, 8, 1, 13312]
    - [109, 0.0]
  - - [6, 3072, 1, 3072]
    - [110, 0.0]
  - - [384, 1536, 1, 1536]
    - [111, 0.0]
  - - [16384, 4096, 1, 13312]
    - [112, 0.0]
  - - [462, 768, 1, 1536]
    - [113, 0.0]
  - - [462, 4096, 1, 1536]
    - [114, 0.0]
  - - [462, 1472, 1, 1536]
    - [115, 0.0]
  - - [384, 1536, 1, 12288]
    - [116, 0.0]
  - - [384, 6144, 1, 1536]
    - [117, 0.0]
  - - [96, 1536, 1, 1536]
    - [118, 0.0]
  - - [96, 1536, 1, 12288]
    - [119, 0.0]
  - - [96, 6144, 1, 1536]
    - [120, 0.0]
  - - [2048, 152710, 1, 512]
    - [121, 0.0]
  - - [2048, 64896, 1, 512]
    - [122, 0.0]
  - - [2048, 17556, 1, 512]
    - [123, 0.0]
  - - [512, 14, 1, 256]
    - [124, 0.0]
  - - [2048, 16302, 1, 512]
    - [125, 0.0]
  - - [512, 13, 1, 256]
    - [0, 0.0]
  - - [8192, 3500, 1, 2048]
    - [126, 0.0]
  - - [512, 3500, 1, 512]
    - [127, 0.0]
  - - [2048, 17052, 1, 512]
    - [128, 0.0]
  - - [262144, 13, 1, 256]
    - [129, 0.0]
  - - [256, 14, 1, 2560]
    - [130, 0.0]
  - - [262144, 14, 1, 256]
    - [131, 0.0]
  - - [8192, 3250, 1, 2048]
    - [132, 0.0]
  - - [256, 13, 1, 2560]
    - [130, 0.0]
  - - [512, 3250, 1, 512]
    - [127, 0.0]
  - - [256, 14, 1, 256]
    - [133, 0.0]
  - - [2048, 1024, 1, 5560]
    - [134, 0.0]
  - - [1, 1024, 1, 256]
    - [91, 0.0]
  - - [512, 1024, 1, 5744]
    - [135, 0.0]
  - - [128, 1024, 1, 10624]
    - [136, 0.0]
  - - [512, 1024, 1, 5560]
    - [137, 0.0]
  - - [1024, 1024, 1, 3840]
    - [138, 0.0]
  - - [1024, 1024, 1, 2872]
    - [139, 0.0]
  - - [2872, 1024, 1, 512]
    - [140, 0.0]
  - - [1, 1024, 1, 128]
    - [141, 0.0]
  - - [128, 1024, 1, 7040]
    - [142, 0.0]
  - - [128, 1024, 1, 4416]
    - [143, 0.0]
  - - [128, 1024, 1, 6784]
    - [144, 0.0]
  - - [512, 1024, 1, 2872]
    - [145, 0.0]
  - - [256, 1024, 1, 4608]
    - [146, 0.0]
  - - [512, 1024, 1, 3072]
    - [147, 0.0]
  - - [5560, 1024, 1, 2780]
    - [148, 0.0]
  - - [2780, 1024, 1, 5560]
    - [149, 0.0]
  - - [512, 16, 1, 256]
    - [150, 0.0]
  - - [512, 32, 1, 256]
    - [57, 0.0]
  - - [8192, 4000, 1, 2048]
    - [151, 0.0]
  - - [512, 4000, 1, 512]
    - [152, 0.0]
  - - [8192, 8000, 1, 2048]
    - [153, 0.0]
  - - [512, 8000, 1, 512]
    - [154, 0.0]
  - - [262144, 16, 1, 256]
    - [155, 0.0]
  - - [256, 16, 1, 2560]
    - [156, 0.0]
  - - [262144, 32, 1, 256]
    - [157, 0.0]
  - - [256, 32, 1, 2560]
    - [158, 0.0]
  - - [256, 13, 1, 256]
    - [0, 0.0]
  - - [256, 16, 1, 256]
    - [23, 0.0]
  - - [256, 32, 1, 256]
    - [159, 0.0]
  - - [2048, 2048, 1, 5560]
    - [160, 0.0]
  - - [1, 2048, 1, 256]
    - [161, 0.0]
  - - [512, 2048, 1, 5744]
    - [162, 0.0]
  - - [128, 2048, 1, 10624]
    - [163, 0.0]
  - - [512, 2048, 1, 5560]
    - [164, 0.0]
  - - [1024, 2048, 1, 3840]
    - [165, 0.0]
  - - [1024, 2048, 1, 2872]
    - [166, 0.0]
  - - [2872, 2048, 1, 512]
    - [167, 0.0]
  - - [1, 2048, 1, 128]
    - [168, 0.0]
  - - [128, 2048, 1, 7040]
    - [169, 0.0]
  - - [128, 2048, 1, 4416]
    - [170, 0.0]
  - - [128, 2048, 1, 6784]
    - [171, 0.0]
  - - [512, 2048, 1, 2872]
    - [172, 0.0]
  - - [256, 2048, 1, 4608]
    - [173, 0.0]
  - - [512, 2048, 1, 3072]
    - [174, 0.0]
  - - [2048, 4096, 1, 5560]
    - [175, 0.0]
  - - [1, 4096, 1, 256]
    - [176, 0.0]
  - - [512, 4096, 1, 5744]
    - [177, 0.0]
  - - [128, 4096, 1, 10624]
    - [178, 0.0]
  - - [512, 4096, 1, 5560]
    - [179, 0.0]
  - - [1024, 4096, 1, 3840]
    - [180, 0.0]
  - - [1024, 4096, 1, 2872]
    - [181, 0.0]
  - - [2872, 4096, 1, 512]
    - [182, 0.0]
  - - [1, 4096, 1, 128]
    - [183, 0.0]
  - - [128, 4096, 1, 7040]
    - [184, 0.0]
  - - [128, 4096, 1, 4416]
    - [185, 0.0]
  - - [128, 4096, 1, 6784]
    - [186, 0.0]
  - - [512, 4096, 1, 2872]
    - [187, 0.0]
  - - [256, 4096, 1, 4608]
    - [188, 0.0]
  - - [512, 4096, 1, 3072]
    - [189, 0.0]
  - - [152710, 2048, 1, 512]
    - [191, 0.0]
  - - [64896, 2048, 1, 512]
    - [195, 0.0]
  - - [2048, 32768, 1, 16384]
    - [196, 0.0]
- null
- null
- DeviceEfficiency
- Equality
