library/src/amd_detail/rocblaslt/src/Tensile/Logic/asm_full/aquavanjaram/gfx942/Equality/aquavanjaram_Cijk_Alik_Bljk_SB_Bias_HAS_SAV_UserArgs.yaml
- {MinimumRequiredVersion: 4.33.0}
- aquavanjaram
- gfx942
- [Device 0049, Device 0050]
    SolutionIndex: 0
    SolutionNameMin: Cijk_Alik_Bljk_SB_Bias_HAS_SAV_UserArgs_MT64x80x32_MI16x16x1_SN_LDSB1_GSU5_GSUC1_GSUWGMRR0_K1_MIWT1_5_NEPBS2_SU4_SUM0_SUS256_SPO0_WGM8_WGMXCC1_WGMXCCGn1
    SolutionIndex: 1
    SolutionNameMin: Cijk_Alik_Bljk_SB_Bias_HAS_SAV_UserArgs_MT128x128x16_MI16x16x1_SN_LDSB1_GRVWA2_GRVWB2_GSU1_GSUC0_GSUWGMRR0_K1_LPA2_LPB2_LRVW2_MIWT2_2_NEPBS0_SU4_SUM0_SUS256_SPO1_WG64_16_1_WGM8_WGMXCC1_WGMXCCGn1
    SolutionIndex: 2
    SolutionNameMin: Cijk_Alik_Bljk_SB_Bias_HAS_SAV_UserArgs_MT32x32x32_MI16x16x1_SN_GSU1_GSUC0_GSUWGMRR1_K1_LPA8_LPB8_MIWT1_1_SU4_SUM0_SUS256_WG32_8_1_WGM8_WGMXCC1_WGMXCCGn1
    SolutionIndex: 3
    SolutionNameMin: Cijk_Alik_Bljk_SB_Bias_HAS_SAV_UserArgs_MT32x96x32_MI16x16x1_SN_LDSB1_GSU7_GSUC1_GSUWGMRR1_K1_LPA8_LPB8_MIWT1_3_NEPBS2_SU4_SUM0_SUS256_SPO0_WG32_8_1_WGM8_WGMXCC1_WGMXCCGn1
    SolutionIndex: 4
    SolutionNameMin: Cijk_Alik_Bljk_SB_Bias_HAS_SAV_UserArgs_MT112x128x16_MI16x16x1_SN_GSU1_GSUC0_GSUWGMRR0_K1_MIWT7_2_NEPBS0_SU4_SUM0_SUS256_SPO0_WGM8_WGMXCC1_WGMXCCGn1
    SolutionIndex: 5
    SolutionNameMin: Cijk_Alik_Bljk_SB_Bias_HAS_SAV_UserArgs_MT32x32x32_MI16x16x1_SN_GSU1_GSUC0_GSUWGMRR0_K1_LPA8_LPB8_MIWT1_1_SU4_SUM0_SUS256_WG32_8_1_WGM8_WGMXCC1_WGMXCCGn1
    SolutionIndex: 6
    SolutionNameMin: Cijk_Alik_Bljk_SB_Bias_HAS_SAV_UserArgs_MT64x96x32_MI16x16x1_SN_LDSB1_GSU7_GSUC1_GSUWGMRR0_K1_LPA8_LPB8_MIWT2_3_NEPBS2_SU4_SUM0_SUS256_SPO0_WG32_8_1_WGM8_WGMXCC1_WGMXCCGn1
    SolutionIndex: 7
    SolutionNameMin: Cijk_Alik_Bljk_SB_Bias_HAS_SAV_UserArgs_MT32x64x64_MI16x16x1_SN_GSU1_GSUC0_GSUWGMRR1_K1_MIWT2_1_NEPBS16_SU0_SUM0_SUS0_WGM8_WGMXCC1_WGMXCCGn1
    SolutionIndex: 8
    SolutionNameMin: Cijk_Alik_Bljk_SB_Bias_HAS_SAV_UserArgs_MT64x32x16_MI16x16x1_SN_GRVWA2_GRVWB2_GSU1_GSUC1_GSUWGMRR0_K1_LPA2_LPB2_LRVW2_MIWT2_1_SU4_SUM0_SUS256_WG32_8_1_WGM8_WGMXCC1_WGMXCCGn1
    SolutionIndex: 9
    SolutionNameMin: Cijk_Alik_Bljk_SB_Bias_HAS_SAV_UserArgs_MT64x80x32_MI16x16x1_SN_LDSB1_GSU5_GSUC0_GSUWGMRR0_K1_MIWT1_5_NEPBS2_SU4_SUM0_SUS256_SPO0_WGM8_WGMXCC1_WGMXCCGn1
    SolutionIndex: 10
    SolutionNameMin: Cijk_Alik_Bljk_SB_Bias_HAS_SAV_UserArgs_MT16x128x32_MI16x16x1_SN_LDSB1_GSU1_GSUC0_GSUWGMRR1_K1_MIWT1_2_NEPBS0_SU4_SUM0_SUS256_SPO0_WGM8_WGMXCC1_WGMXCCGn1
    SolutionIndex: 11
    SolutionNameMin: Cijk_Alik_Bljk_SB_Bias_HAS_SAV_UserArgs_MT32x32x16_MI16x16x1_SN_GRVWA2_GRVWB2_GSU1_GSUC0_GSUWGMRR1_K1_LPA2_LPB2_LRVW2_MIWT1_1_SU4_SUM0_SUS256_WG32_8_1_WGM8_WGMXCC1_WGMXCCGn1
    SolutionIndex: 12
    SolutionNameMin: Cijk_Alik_Bljk_SB_Bias_HAS_SAV_UserArgs_MT16x128x32_MI16x16x1_SN_GSU1_GSUC0_GSUWGMRR1_K1_MIWT1_2_SU4_SUM0_SUS256_WGM8_WGMXCC1_WGMXCCGn1
    SolutionIndex: 13
    SolutionNameMin: Cijk_Alik_Bljk_SB_Bias_HAS_SAV_UserArgs_MT128x112x32_MI16x16x1_SN_GSU2_GSUC1_GSUWGMRR0_K1_MIWT2_7_SU4_SUM0_SUS256_WGM8_WGMXCC1_WGMXCCGn1
    SolutionIndex: 14
    SolutionNameMin: Cijk_Alik_Bljk_SB_Bias_HAS_SAV_UserArgs_MT32x96x32_MI16x16x1_SN_LDSB1_GSU1_GSUC0_GSUWGMRR1_K1_LPA8_LPB8_MIWT1_3_NEPBS0_SU4_SUM0_SUS256_SPO0_WG32_8_1_WGM8_WGMXCC1_WGMXCCGn1
    SolutionIndex: 15
    SolutionNameMin: Cijk_Alik_Bljk_SB_Bias_HAS_SAV_UserArgs_MT128x48x32_MI16x16x1_SN_LDSB1_GSU3_GSUC1_GSUWGMRR1_K1_MIWT2_3_NEPBS2_SU4_SUM0_SUS256_SPO1_WGM8_WGMXCC1_WGMXCCGn1
    SolutionIndex: 16
    SolutionNameMin: Cijk_Alik_Bljk_SB_Bias_HAS_SAV_UserArgs_MT128x32x16_MI32x32x1_SN_GSU1_GSUC0_GSUWGMRR1_K1_MIWT1_1_SU4_SUM0_SUS256_WGM8_WGMXCC1_WGMXCCGn1
    SolutionIndex: 17
    SolutionNameMin: Cijk_Alik_Bljk_SB_Bias_HAS_SAV_UserArgs_MT192x80x32_MI16x16x1_SN_GSU1_GSUC1_GSUWGMRR1_K1_MIWT3_5_SU4_SUM0_SUS256_WGM8_WGMXCC1_WGMXCCGn1
    SolutionIndex: 18
    SolutionNameMin: Cijk_Alik_Bljk_SB_Bias_HAS_SAV_UserArgs_MT224x32x16_MI16x16x1_SN_GRVWA2_GRVWB2_GSU1_GSUC0_GSUWGMRR0_K1_LPA2_LPB2_LRVW2_MIWT7_1_SU4_SUM0_SUS256_WG32_8_1_WGM8_WGMXCC1_WGMXCCGn1
    SolutionIndex: 19
    SolutionNameMin: Cijk_Alik_Bljk_SB_Bias_HAS_SAV_UserArgs_MT64x16x32_MI16x16x1_SN_GSU1_GSUC0_GSUWGMRR0_K1_MIWT1_1_SU4_SUM0_SUS256_WGM8_WGMXCC1_WGMXCCGn1
    SolutionIndex: 20
    SolutionNameMin: Cijk_Alik_Bljk_SB_Bias_HAS_SAV_UserArgs_MT64x112x32_MI16x16x1_SN_LDSB1_GSU2_GSUC0_GSUWGMRR0_K1_MIWT1_7_NEPBS2_SU4_SUM0_SUS256_SPO1_WGM8_WGMXCC1_WGMXCCGn1
    SolutionIndex: 21
    SolutionNameMin: Cijk_Alik_Bljk_SB_Bias_HAS_SAV_UserArgs_MT256x32x16_MI32x32x1_SN_GSU1_GSUC0_GSUWGMRR0_K1_MIWT2_1_SU4_SUM0_SUS256_WGM8_WGMXCC1_WGMXCCGn1
    SolutionIndex: 22
    SolutionNameMin: Cijk_Alik_Bljk_SB_Bias_HAS_SAV_UserArgs_MT32x32x16_MI16x16x1_SN_GRPM1_GRVWA2_GRVWB2_GSU1_GSUC0_GSUWGMRR0_K1_LBSPPB128_LPA2_LPB2_LRVW2_LWPM0p50_MIWT1_1_SU4_SUM0_SUS256_VWB1_WG32_8_1_WGM0_WGMXCC16_WGMXCCG0
    SolutionIndex: 23
    SolutionNameMin: Cijk_Alik_Bljk_SB_Bias_HAS_SAV_UserArgs_MT32x64x64_MI16x16x1_SN_GRPM0p50_GRVWA4_GRVWB4_GSU1_GSUC0_GSUWGMRR0_K1_LBSPPA256_LBSPPB512_LPA8_LPB8_LRVW4_LWPMn1_MIWT1_2_SU4_SUM0_SUS256_SVW1_VWA1_VWB2_WG32_8_1_WGM0_WGMXCC16_WGMXCCGn1
    SolutionIndex: 24
    SolutionNameMin: Cijk_Alik_Bljk_SB_Bias_HAS_SAV_UserArgs_MT32x32x16_MI16x16x1_SN_GRPM0p50_GRVWA2_GRVWB2_GSU1_GSUC0_GSUWGMRR0_K1_LBSPPA128_LBSPPB128_LPA2_LPB2_LRVW2_LWPM0p50_MIWT1_1_SU4_SUM0_SUS256_SVW1_VWA1_VWB1_WG32_8_1_WGM0_WGMXCC16_WGMXCCG0
    SolutionIndex: 25
    SolutionNameMin: Cijk_Alik_Bljk_SB_Bias_HAS_SAV_UserArgs_MT32x16x32_MI16x16x1_SN_GRPM1_GRVWA4_GRVWB4_GSU1_GSUC0_GSUWGMRR0_K1_LBSPPA128_LBSPPB128_LPA8_LPB8_LRVW4_LWPM0p50_MIWT1_1_SU4_SUM0_SUS256_SVW1_VWA1_VWB1_WG32_4_1_WGM0_WGMXCC16_WGMXCCG0
- - - [200, 24, 2048, 48]
    - [21, 0.0]
  - - [128, 2048, 1, 2853]
    - [0, 0.0]
  - - [4175, 2048, 1, 64]
    - [1, 0.0]
  - - [80, 2048, 1, 108]
    - [2, 0.0]
  - - [32, 2048, 1, 4560]
    - [3, 0.0]
  - - [3535, 2048, 1, 128]
    - [4, 0.0]
  - - [80, 2048, 1, 84]
    - [5, 0.0]
  - - [64, 2048, 1, 4175]
    - [6, 0.0]
  - - [160, 2048, 1, 128]
    - [7, 0.0]
  - - [160, 2048, 1, 32]
    - [22, 0.0]
  - - [320, 2048, 1, 80]
    - [8, 0.0]
  - - [128, 2048, 1, 2400]
    - [9, 0.0]
  - - [5, 327680, 1, 707]
    - [10, 0.0]
  - - [80, 2048, 1, 32]
    - [11, 0.0]
  - - [15, 327680, 1, 707]
    - [12, 0.0]
  - - [1024, 2048, 1, 4175]
    - [13, 0.0]
  - - [800, 2048, 1, 128]
    - [14, 0.0]
  - - [256, 2048, 1, 4106]
    - [15, 0.0]
  - - [100, 24, 2048, 48]
    - [16, 0.0]
  - - [2053, 2048, 1, 256]
    - [17, 0.0]
  - - [200, 32, 2048, 64]
    - [18, 0.0]
  - - [80, 2048, 1, 120]
    - [19, 0.0]
  - - [80, 2048, 1, 96]
    - [5, 0.0]
  - - [512, 2048, 1, 2053]
    - [20, 0.0]
  - - [160, 2048, 1, 512]
    - [23, 0.0]
  - - [160, 2048, 1, 72]
    - [24, 0.0]
  - - [160, 2048, 1, 64]
    - [25, 0.0]
- null
- null
- DeviceEfficiency
- Equality
