library/src/amd_detail/rocblaslt/src/Tensile/Logic/asm_full/aquavanjaram/gfx942/Equality/aquavanjaram_Cijk_Alik_Bljk_BBS_BH_UserArgs.yaml
- {MinimumRequiredVersion: 4.33.0}
- aquavanjaram
- gfx942
- [Device 0049, Device 0050]
    SolutionIndex: 0
    SolutionNameMin: Cijk_Alik_Bljk_BBS_BH_UserArgs_MT256x128x64_MI16x16x1_SN_GRVWA8_GRVWB8_GSU1_LBSPPA1024_LBSPPB128_LPA16_LPB16_LRVW8_MIWT8_4_SU0_SUM0_SUS0_SVW8_VWA8_WG32_8_1_WGM40
    SolutionIndex: 1
    SolutionNameMin: Cijk_Alik_Bljk_BBS_BH_UserArgs_MT256x128x64_MI16x16x1_SN_GRVWA8_GRVWB8_GSU1_LBSPPA1024_LBSPPB128_LPA16_LPB16_LRVW8_MIWT8_4_SU8_SUM0_SUS256_SVW8_VWA8_WG32_8_1_WGM40
    SolutionIndex: 2
    SolutionNameMin: Cijk_Alik_Bljk_BBS_BH_UserArgs_MT224x256x64_MI16x16x1_SN_GRVWA4_GRVWB4_GSU1_LBSPPA256_LBSPPB128_LPA4_LPB4_LRVW4_MIWT14_4_SU8_SUM0_SUS256_SVW2_VWA2_WG16_16_1_WGM0
    SolutionIndex: 3
    SolutionNameMin: Cijk_Alik_Bljk_BBS_BH_UserArgs_MT224x224x64_MI16x16x1_SN_GRVWA4_GRVWB4_GSU1_LBSPPA128_LBSPPB128_LPA4_LPB4_LRVW4_MIWT7_7_SU8_SUM0_SUS256_SVW1_VWA1_WG32_8_1_WGM0
    SolutionIndex: 4
    SolutionNameMin: Cijk_Alik_Bljk_BBS_BH_MT256x192x64_MI16x16x1_SN_LDSB1_GRVWA4_GRVWB4_GSU1_LBSPPA1024_LPA4_LPB4_LRVW4_MIWT8_6_SU4_SUS512_SVW8_VWA8_WSGRB0_WG32_8_1_WGM1
    SolutionIndex: 5
    SolutionNameMin: Cijk_Alik_Bljk_BBS_BH_MT256x192x64_MI16x16x1_SN_LDSB1_GRVWA4_GRVWB4_GSU1_LBSPPA1024_LPA4_LPB4_LRVW4_MIWT8_6_SU8_SUS256_SVW8_VWA8_WSGRB0_WG32_8_1_WGM40
    SolutionIndex: 6
    SolutionNameMin: Cijk_Alik_Bljk_BBS_BH_MT256x144x64_MI16x16x1_SN_LDSB1_GRVWA8_GRVWB4_GSU1_LBSPPA512_LPA16_LPB16_LRVW8_MIWT4_9_SU8_SUS512_SVW4_VWA4_WSGRB0_WG64_4_1_WGM40
    SolutionIndex: 7
    SolutionNameMin: Cijk_Alik_Bljk_BBS_BH_MT128x256x64_MI16x16x1_SN_LDSB1_GRVWA8_GRVWB8_GSU1_LBSPPA512_LPA16_LPB16_LRVW8_MIWT4_8_SU8_SUS256_SVW4_VWA4_WSGRB1_WG32_8_1_WGM40
    SolutionIndex: 8
    SolutionNameMin: Cijk_Alik_Bljk_BBS_BH_UserArgs_MT144x256x64_MI16x16x1_SN_GRVWA4_GRVWB8_GSU1_LBSPPA128_LBSPPB128_LPA16_LPB16_LRVW8_MIWT9_4_SU8_SUM0_SUS256_SVW1_VWA1_WG16_16_1_WGM40
    SolutionIndex: 9
    SolutionNameMin: Cijk_Alik_Bljk_BBS_BH_UserArgs_MT256x224x64_MI16x16x1_SN_GRVWA4_GRVWB4_GSU1_LBSPPA512_LBSPPB128_LPA4_LPB4_LRVW4_MIWT4_14_SU8_SUM0_SUS256_SVW4_VWA4_WG64_4_1_WGM40
    SolutionIndex: 10
    SolutionNameMin: Cijk_Alik_Bljk_BBS_BH_UserArgs_MT256x192x64_MI16x16x1_SN_GRVWA4_GRVWB4_GSU1_LBSPPA1024_LBSPPB128_LPA4_LPB4_LRVW4_MIWT8_6_SU8_SUM0_SUS256_SVW8_VWA8_WG32_8_1_WGM40
    SolutionIndex: 11
    SolutionNameMin: Cijk_Alik_Bljk_BBS_BH_UserArgs_MT64x16x256_MI16x16x1_SN_GRVWA8_GRVWB8_GSU1_LBSPPA512_LBSPPB512_LPA16_LPB16_LRVW8_MIWT1_1_SU0_SUM0_SUS0_SVW1_VWA1_WG64_4_1_WGM0
    SolutionIndex: 12
    SolutionNameMin: Cijk_Alik_Bljk_BBS_BH_UserArgs_MT32x32x128_MI16x16x1_SN_GRVWA8_GRVWB8_GSU1_LBSPPA256_LBSPPB256_LPA16_LPB16_LRVW8_MIWT1_1_SU0_SUM0_SUS0_SVW1_VWA1_WG32_8_1_WGM0
    SolutionIndex: 13
    SolutionNameMin: Cijk_Alik_Bljk_BBS_BH_UserArgs_MT16x16x128_MI16x16x1_SN_GRVWA8_GRVWB8_GSU1_LBSPPA256_LBSPPB256_LPA16_LPB16_LRVW8_MIWT1_1_SU0_SUM0_SUS0_SVW1_VWA1_WG16_4_1_WGM0
    SolutionIndex: 14
    SolutionNameMin: Cijk_Alik_Bljk_BBS_BH_UserArgs_MT96x32x128_MI16x16x1_SN_GRVWA8_GRVWB8_GSU8_LBSPPA256_LBSPPB256_LPA16_LPB16_LRVW8_MIWT3_1_SU8_SUM0_SUS256_SVW1_VWA1_WG32_8_1_WGM8
    SolutionIndex: 15
    SolutionNameMin: Cijk_Alik_Bljk_BBS_BH_MT64x16x128_MI16x16x1_SN_GRVWA8_GRVWB8_GSU1_LBSPPA256_LBSPPB256_LPA16_LPB16_LRVW8_MIWT1_1_PKA1_SU8_SUM0_SUS256_SVW1_VWA1_WG64_4_1_WGM0
    SolutionIndex: 16
    SolutionNameMin: Cijk_Alik_Bljk_BBS_BH_MT128x16x128_MI16x16x1_SN_GSU4_MIWT2_1_WGM1
    SolutionIndex: 17
    SolutionNameMin: Cijk_Alik_Bljk_BBS_BH_MT32x16x128_MI16x16x1_SN_GRVWA8_GRVWB8_GSU1_LBSPPA256_LBSPPB256_LPA16_LPB16_LRVW8_MIWT1_1_PKA1_SU8_SUM0_SUS256_SVW1_VWA1_WG32_4_1_WGM0
    SolutionIndex: 18
    SolutionNameMin: Cijk_Alik_Bljk_BBS_BH_MT16x16x128_MI16x16x1_SN_GSU7_MIWT1_1_WGM1
    SolutionIndex: 19
    SolutionNameMin: Cijk_Alik_Bljk_BBS_BH_UserArgs_MT32x16x256_MI16x16x1_SN_LDSB0_GSU1_LBSPPA512_LBSPPB512_LPA16_LPB16_LRVW8_MIWT1_1_SS1_SU32_SUM1_SUS512_SVW1_VWA1_WG32_4_1_WGM8
    SolutionIndex: 20
    SolutionNameMin: Cijk_Alik_Bljk_BBS_BH_UserArgs_MT32x32x128_MI16x16x1_SN_GRVWA8_GRVWB8_GSU1_LBSPPA256_LBSPPB256_LPA16_LPB16_LRVW8_MIWT1_1_SU8_SUM0_SUS256_SVW1_VWA1_WG32_8_1_WGM0
    SolutionIndex: 21
    SolutionNameMin: Cijk_Alik_Bljk_BBS_BH_UserArgs_MT16x16x128_MI16x16x1_SN_GRVWA8_GRVWB8_GSU8_LBSPPA256_LBSPPB256_LPA16_LPB16_LRVW8_MIWT1_1_SU4_SUM0_SUS256_SVW1_VWA1_WG16_4_1_WGM0
    SolutionIndex: 22
    SolutionNameMin: Cijk_Alik_Bljk_BBS_BH_UserArgs_MT96x32x128_MI16x16x1_SN_GRVWA8_GRVWB8_GSU8_LBSPPA256_LBSPPB256_LPA16_LPB16_LRVW8_MIWT3_1_SU8_SUM0_SUS256_SVW1_VWA1_WG32_8_1_WGM0
    SolutionIndex: 23
    SolutionNameMin: Cijk_Alik_Bljk_BBS_BH_UserArgs_MT16x16x128_MI16x16x1_SN_GRVWA8_GRVWB8_GSU8_LBSPPA256_LBSPPB256_LPA16_LPB16_LRVW8_MIWT1_1_SU0_SUM0_SUS0_SVW1_VWA1_WG16_4_1_WGM0
    SolutionIndex: 24
    SolutionNameMin: Cijk_Alik_Bljk_BBS_BH_UserArgs_MT64x32x256_MI16x16x1_SN_LDSB1_GSU1_LBSPPA512_LBSPPB512_LPA16_LPB16_LRVW8_MIWT1_2_SS0_SU32_SUM1_SUS512_SVW4_VWA1_WG64_4_1_WGM8
    SolutionIndex: 25
    SolutionNameMin: Cijk_Alik_Bljk_BBS_BH_UserArgs_MT32x32x128_MI16x16x1_SN_GRVWA8_GRVWB8_GSU1_LBSPPA256_LBSPPB256_LPA16_LPB16_LRVW8_MIWT1_1_SU0_SUM0_SUS0_SVW1_VWA1_WG32_8_1_WGM8
    SolutionIndex: 26
    SolutionNameMin: Cijk_Alik_Bljk_BBS_BH_UserArgs_MT96x32x128_MI16x16x1_SN_GRVWA8_GRVWB8_GSU8_LBSPPA256_LBSPPB256_LPA16_LPB16_LRVW8_MIWT3_1_SU0_SUM0_SUS0_SVW1_VWA1_WG32_8_1_WGM0
    SolutionIndex: 27
    SolutionNameMin: Cijk_Alik_Bljk_BBS_BH_UserArgs_MT64x32x256_MI16x16x1_SN_GRVWA8_GRVWB8_GSU1_LBSPPA1024_LBSPPB512_LPA16_LPB16_LRVW8_MIWT2_1_SU0_SUM0_SUS0_SVW2_VWA2_WG32_8_1_WGM0
    SolutionIndex: 28
    SolutionNameMin: Cijk_Alik_Bljk_BBS_BH_UserArgs_MT64x64x128_MI16x16x1_SN_GRVWA8_GRVWB8_GSU1_LBSPPA512_LBSPPB256_LPA16_LPB16_LRVW8_MIWT2_2_SU4_SUM0_SUS256_SVW2_VWA2_WG32_8_1_WGM0
    SolutionIndex: 29
    SolutionNameMin: Cijk_Alik_Bljk_BBS_BH_UserArgs_MT32x16x512_MI16x16x1_SN_GRVWA8_GRVWB8_GSU1_LBSPPA1024_LBSPPB1024_LPA16_LPB16_LRVW8_MIWT1_1_SU0_SUM0_SUS0_SVW1_VWA1_WG32_4_1_WGM0
    SolutionIndex: 30
    SolutionNameMin: Cijk_Alik_Bljk_BBS_BH_UserArgs_MT64x64x128_MI16x16x1_SN_GRVWA8_GRVWB8_GSU1_LBSPPA512_LBSPPB256_LPA16_LPB16_LRVW8_MIWT2_2_SU0_SUM0_SUS0_SVW2_VWA2_WG32_8_1_WGM0
    SolutionIndex: 31
    SolutionNameMin: Cijk_Alik_Bljk_BBS_BH_UserArgs_MT128x128x64_MI16x16x1_SN_GRVWA8_GRVWB8_GSU4_LBSPPA512_LBSPPB128_LPA16_LPB16_LRVW8_MIWT4_4_SU8_SUM0_SUS256_SVW4_VWA4_WG32_8_1_WGM40
    SolutionIndex: 32
    SolutionNameMin: Cijk_Alik_Bljk_BBS_BH_UserArgs_MT64x64x128_MI16x16x1_SN_GRVWA8_GRVWB8_GSU1_LBSPPA512_LBSPPB256_LPA16_LPB16_LRVW8_MIWT2_2_SU8_SUM0_SUS256_SVW2_VWA2_WG32_8_1_WGM0
    SolutionIndex: 33
    SolutionNameMin: Cijk_Alik_Bljk_BBS_BH_UserArgs_MT32x32x256_MI16x16x1_SN_GRVWA8_GRVWB8_GSU1_LBSPPA512_LBSPPB512_LPA16_LPB16_LRVW8_MIWT1_1_SU0_SUM0_SUS0_SVW1_VWA1_WG32_8_1_WGM0
    SolutionIndex: 34
    SolutionNameMin: Cijk_Alik_Bljk_BBS_BH_MT256x224x64_MI16x16x1_SN_LDSB1_GRVWB4_GSU1_LBSPPA512_LBSPPB128_LPA8_LPB4_LRVW4_MIWT4_14_SVW4_VWA4_WG64_4_1
    SolutionIndex: 35
    SolutionNameMin: Cijk_Alik_Bljk_BBS_BH_MT16x128x64_MI16x16x1_SN_LDSB1_GSU10_LBSPPA128_LBSPPB128_MIWT1_2_NTB0_NLCA1_SU0_SUM0_SUS0_SPO1_WG16_16_1
    SolutionIndex: 36
    SolutionNameMin: Cijk_Alik_Bljk_BBS_BH_MT16x32x64_MI16x16x1_SN_LDSB0_GSU8_LBSPPA128_LBSPPB128_MIWT1_1_NTB0_NLCA1_SU4_SUM2_SUS512_SPO1_WG16_8_1
    SolutionIndex: 37
    SolutionNameMin: Cijk_Alik_Bljk_BBS_BH_MT16x32x64_MI16x16x1_SN_LDSB0_GSU15_LBSPPA128_LBSPPB128_MIWT1_1_NTB1_NLCA1_SU4_SUM2_SUS256_SPO1_WG16_8_1
    SolutionIndex: 38
    SolutionNameMin: Cijk_Alik_Bljk_BBS_BH_MT256x224x64_MI16x16x1_SN_LDSB1_GRVWB4_GSU1_LBSPPA1024_LBSPPB128_MIWT8_7_SU0_SUM0_SUS0_SVW8_VWA8_WG32_8_1
    SolutionIndex: 39
    SolutionNameMin: Cijk_Alik_Bljk_BBS_BH_MT256x224x64_MI16x16x1_SN_LDSB1_GRVWB4_GSU1_LBSPPA1024_LBSPPB128_MIWT8_7_SU4_SUM2_SUS256_SVW8_VWA8_WG32_8_1
    SolutionIndex: 40
    SolutionNameMin: Cijk_Alik_Bljk_BBS_BH_MT256x144x64_MI16x16x1_SN_LDSB1_GRVWB4_GSU1_LBSPPA512_LBSPPB128_MIWT4_9_SU0_SUM0_SUS0_SVW4_VWA4_WG64_4_1
    SolutionIndex: 41
    SolutionNameMin: Cijk_Alik_Bljk_BBS_BH_MT16x16x128_MI16x16x1_SN_GSU7_MIWT1_1_WGM1
    SolutionIndex: 42
    SolutionNameMin: Cijk_Alik_Bljk_BBS_BH_UserArgs_MT128x64x128_MI16x16x1_SN_LDSB1_GRVWA8_GRVWB8_GSU1_LBSPPA1024_LBSPPB256_LPA16_LPB16_LRVW8_MIWT4_2_SU32_SUM1_SUS1024_SVW4_VWA4_WG32_8_1_WGM8
    SolutionIndex: 43
    SolutionNameMin: Cijk_Alik_Bljk_BBS_BH_UserArgs_MT64x64x128_MI16x16x1_SN_LDSB1_GRVWA8_GRVWB8_GSU1_LBSPPA512_LBSPPB256_LPA16_LPB16_LRVW8_MIWT2_2_SU32_SUM1_SUS256_SVW2_VWA2_WG32_8_1_WGM8
    SolutionIndex: 44
    SolutionNameMin: Cijk_Alik_Bljk_BBS_BH_UserArgs_MT128x64x128_MI16x16x1_SN_LDSB1_GRVWA8_GRVWB8_GSU1_LBSPPA1024_LBSPPB256_LPA16_LPB16_LRVW8_MIWT4_2_SU32_SUM1_SUS512_SVW4_VWA4_WG32_8_1_WGM8
    SolutionIndex: 45
    SolutionNameMin: Cijk_Alik_Bljk_BBS_BH_UserArgs_MT192x128x64_MI16x16x1_SN_GRVWA8_GRVWB8_GSU1_LBSPPA256_LPA16_LPB16_LRVW8_MIWT6_4_SU32_SUM1_SUS512_SVW2_VWA2_WG32_8_1_WGM8
    SolutionIndex: 46
    SolutionNameMin: Cijk_Alik_Bljk_BBS_BH_UserArgs_MT64x128x128_MI16x16x1_SN_LDSB1_GRVWA8_GRVWB8_GSU4_GSUAMB_LBSPPA512_LBSPPB256_LPA16_LPB16_LRVW8_MIWT2_4_SU32_SUM1_SUS512_WG32_8_1_WGM8
    SolutionIndex: 47
    SolutionNameMin: Cijk_Alik_Bljk_BBS_BH_UserArgs_MT64x128x128_MI16x16x1_SN_LDSB1_GRVWA8_GRVWB8_GSU1_LBSPPA1024_LBSPPB256_LPA16_LPB16_LRVW8_MIWT4_2_SU32_SUM1_SUS256_SVW4_VWA4_WG16_16_1_WGM8
    SolutionIndex: 48
    SolutionNameMin: Cijk_Alik_Bljk_BBS_BH_UserArgs_MT16x32x256_MI16x16x1_SN_LDSB0_GRVWA8_GRVWB8_GSU1_LBSPPA512_LBSPPB512_LPA16_LPB16_LRVW8_MIWT1_1_SU32_SUM1_SUS512_SVW1_VWA1_WG16_8_1_WGM8
    SolutionIndex: 49
    SolutionNameMin: Cijk_Alik_Bljk_BBS_BH_UserArgs_MT64x96x128_MI16x16x1_SN_LDSB1_GRVWA8_GRVWB8_GSU11_GSUAMB_LBSPPA512_LBSPPB256_LPA16_LPB16_LRVW8_MIWT2_3_SU32_SUM1_SUS512_SVW2_VWA2_WG32_8_1_WGM8
    SolutionIndex: 50
    SolutionNameMin: Cijk_Alik_Bljk_BBS_BH_UserArgs_MT32x96x128_MI16x16x1_SN_LDSB1_GRVWA8_GRVWB8_GSU1_LBSPPA256_LBSPPB256_LPA16_LPB16_LRVW8_MIWT1_3_SU32_SUM1_SUS256_SVW1_VWA1_WG32_8_1_WGM8
    SolutionIndex: 51
    SolutionNameMin: Cijk_Alik_Bljk_BBS_BH_UserArgs_MT128x64x128_MI16x16x1_SN_LDSB1_GRVWA8_GRVWB8_GSU1_LBSPPA512_LBSPPB256_LPA16_LPB16_LRVW8_MIWT2_4_SU32_SUM1_SUS512_SVW2_VWA2_WG64_4_1_WGM8
    SolutionIndex: 52
    SolutionNameMin: Cijk_Alik_Bljk_BBS_BH_UserArgs_MT128x256x64_MI16x16x1_SN_GRVWA8_GRVWB8_GSU1_LBSPPA1024_LPA16_LPB16_LRVW8_MIWT8_4_SU32_SUM1_SUS256_SVW8_VWA8_WG16_16_1_WGM8
    SolutionIndex: 53
    SolutionNameMin: Cijk_Alik_Bljk_BBS_BH_UserArgs_MT224x256x64_MI16x16x1_SN_LDSB1_GRVWA4_GRVWB4_GSU1_LBSPPA128_MIWT7_8_SU32_SUM1_SUS128_SVW1_VWA1_WG32_8_1_WGM8
    SolutionIndex: 54
    SolutionNameMin: Cijk_Alik_Bljk_BBS_BH_UserArgs_MT128x64x128_MI16x16x1_SN_LDSB1_GRVWA8_GRVWB8_GSU1_LBSPPA1024_LBSPPB256_LPA16_LPB16_LRVW8_MIWT4_2_SU32_SUM1_SUS256_SVW4_VWA4_WG32_8_1_WGM8
    SolutionIndex: 55
    SolutionNameMin: Cijk_Alik_Bljk_BBS_BH_UserArgs_MT128x192x64_MI16x16x1_SN_GRVWA8_GRVWB8_GSU1_LBSPPA512_LPA16_LPB16_LRVW8_MIWT4_6_SU32_SUM1_SUS512_SVW4_VWA4_WG32_8_1_WGM8
    SolutionIndex: 56
    SolutionNameMin: Cijk_Alik_Bljk_BBS_BH_UserArgs_MT256x192x64_MI16x16x1_SN_LDSB1_GSU1_LBSPPA1024_MIWT8_6_SU32_SUM1_SUS128_SVW8_VWA8_WG32_8_1_WGM8
    SolutionIndex: 57
    SolutionNameMin: Cijk_Alik_Bljk_BBS_BH_UserArgs_MT256x192x64_MI16x16x1_SN_LDSB1_GSU1_LBSPPA1024_MIWT8_6_SU32_SUM1_SUS1024_SVW8_VWA8_WG32_8_1_WGM8
    SolutionIndex: 58
    SolutionNameMin: Cijk_Alik_Bljk_BBS_BH_UserArgs_MT288x192x64_MI16x16x1_SN_LDSB1_GRVWA4_GRVWB4_GSU1_LBSPPA128_MIWT9_6_SU32_SUM1_SUS1024_SVW1_VWA1_WG32_8_1_WGM8
    SolutionIndex: 59
    SolutionNameMin: Cijk_Alik_Bljk_BBS_BH_UserArgs_MT224x256x64_MI16x16x1_SN_LDSB1_GRVWA4_GRVWB4_GSU1_LBSPPA128_LPA4_LPB4_LRVW4_MIWT7_8_SU32_SUM1_SUS1024_SVW1_VWA1_WG32_8_1_WGM8
    SolutionIndex: 60
    SolutionNameMin: Cijk_Alik_Bljk_BBS_BH_UserArgs_MT208x192x64_MI16x16x1_SN_LDSB1_GRVWA4_GRVWB8_GSU1_LBSPPA128_LPA16_LPB16_LRVW8_MIWT13_3_SU32_SUM1_SUS1024_SVW1_VWA1_WG16_16_1_WGM8
    SolutionIndex: 61
    SolutionNameMin: Cijk_Alik_Bljk_BBS_BH_UserArgs_MT256x224x64_MI16x16x1_SN_LDSB1_GSU1_LBSPPA1024_MIWT8_7_SU32_SUM1_SUS128_SVW8_VWA8_WG32_8_1_WGM8
    SolutionIndex: 62
    SolutionNameMin: Cijk_Alik_Bljk_BBS_BH_UserArgs_MT128x224x64_MI16x16x1_SN_LDSB1_GRVWA8_GRVWB8_GSU4_GSUAMB_LBSPPA512_LBSPPB128_LPA16_LPB16_LRVW8_MIWT4_7_SU32_SUM1_SUS128_SVW4_VWA4_WG32_8_1_WGM8
    SolutionIndex: 63
    SolutionNameMin: Cijk_Alik_Bljk_BBS_BH_UserArgs_MT128x64x128_MI16x16x1_SN_LDSB1_GRVWA8_GRVWB8_GSU1_LBSPPA2048_LBSPPB256_LPA16_LPB16_LRVW8_MIWT8_1_SU32_SUM1_SUS256_SVW8_VWA8_WG16_16_1_WGM8
    SolutionIndex: 64
    SolutionNameMin: Cijk_Alik_Bljk_BBS_BH_UserArgs_MT160x64x64_MI16x16x1_SN_LDSB1_GRVWA8_GRVWB8_GSU1_LBSPPA128_LBSPPB128_LPA16_LPB16_LRVW8_MIWT5_2_SU32_SUM1_SUS256_SVW1_VWA1_WG32_8_1_WGM8
    SolutionIndex: 65
    SolutionNameMin: Cijk_Alik_Bljk_BBS_BH_UserArgs_MT256x128x64_MI16x16x1_SN_GRVWA8_GRVWB8_GSU1_LBSPPA1024_LPA16_LPB16_LRVW8_MIWT8_4_SU32_SUM1_SUS1024_SVW8_VWA8_WG32_8_1_WGM8
    SolutionIndex: 66
    SolutionNameMin: Cijk_Alik_Bljk_BBS_BH_UserArgs_MT128x128x64_MI16x16x1_SN_GRVWA8_GRVWB8_GSU1_LBSPPA1024_LPA16_LPB16_LRVW8_MIWT8_2_SU32_SUM1_SUS512_SVW8_VWA8_WG16_16_1_WGM8
    SolutionIndex: 67
    SolutionNameMin: Cijk_Alik_Bljk_BBS_BH_UserArgs_MT16x128x128_MI16x16x1_SN_LDSB1_GRVWA8_GRVWB8_GSU1_LBSPPA256_LBSPPB256_LPA16_LPB16_LRVW8_MIWT1_2_SU32_SUM1_SUS512_SVW1_VWA1_WG16_16_1_WGM8
    SolutionIndex: 68
    SolutionNameMin: Cijk_Alik_Bljk_BBS_BH_UserArgs_MT256x224x64_MI16x16x1_SN_LDSB1_GRVWA4_GRVWB4_GSU1_LBSPPA1024_MIWT8_7_SU32_SUM1_SUS128_SVW8_VWA8_WG32_8_1_WGM8
    SolutionIndex: 69
    SolutionNameMin: Cijk_Alik_Bljk_BBS_BH_UserArgs_MT224x256x64_MI16x16x1_SN_LDSB1_GRVWA4_GRVWB4_GSU1_LBSPPA128_LPA4_LPB4_LRVW4_MIWT7_8_SU32_SUM1_SUS128_SVW1_VWA1_WG32_8_1_WGM8
    SolutionIndex: 70
    SolutionNameMin: Cijk_Alik_Bljk_BBS_BH_UserArgs_MT96x128x64_MI16x16x1_SN_LDSB1_GRVWA8_GRVWB8_GSU1_LBSPPA256_LBSPPB128_LPA16_LPB16_LRVW8_MIWT6_2_SU32_SUM1_SUS1024_SVW2_VWA2_WG16_16_1_WGM8
    SolutionIndex: 71
    SolutionNameMin: Cijk_Alik_Bljk_BBS_BH_UserArgs_MT128x96x64_MI16x16x1_SN_LDSB1_GRVWA8_GRVWB8_GSU1_LBSPPA512_LBSPPB128_LPA16_LPB16_LRVW8_MIWT4_3_SU32_SUM1_SUS512_SVW4_VWA4_WG32_8_1_WGM8
    SolutionIndex: 72
    SolutionNameMin: Cijk_Alik_Bljk_BBS_BH_UserArgs_MT192x160x64_MI16x16x1_SN_GRVWA8_GRVWB8_GSU1_LBSPPA256_LPA16_LPB16_LRVW8_MIWT6_5_SU32_SUM1_SUS512_SVW2_VWA2_WG32_8_1_WGM8
    SolutionIndex: 73
    SolutionNameMin: Cijk_Alik_Bljk_BBS_BH_UserArgs_MT16x32x128_MI16x16x1_SN_LDSB0_GRVWA8_GRVWB8_GSU1_LBSPPA256_LBSPPB256_LPA16_LPB16_LRVW8_MIWT1_1_SU32_SUM1_SUS1024_SVW1_VWA1_WG16_8_1_WGM8
    SolutionIndex: 74
    SolutionNameMin: Cijk_Alik_Bljk_BBS_BH_UserArgs_MT128x128x64_MI16x16x1_SN_GRVWA8_GRVWB8_GSU1_LBSPPA512_LPA16_LPB16_LRVW8_MIWT4_4_SU32_SUM1_SUS256_SVW4_VWA4_WG32_8_1_WGM8
    SolutionIndex: 75
    SolutionNameMin: Cijk_Alik_Bljk_BBS_BH_UserArgs_MT128x128x64_MI16x16x1_SN_GRVWA8_GRVWB8_GSU1_LBSPPA512_LPA16_LPB16_LRVW8_MIWT4_4_SU32_SUM1_SUS512_SVW4_VWA4_WG32_8_1_WGM8
    SolutionIndex: 76
    SolutionNameMin: Cijk_Alik_Bljk_BBS_BH_UserArgs_MT144x256x64_MI16x16x1_SN_LDSB1_GRVWA4_GRVWB8_GSU1_LBSPPA128_LPA16_LPB16_LRVW8_MIWT9_4_SU32_SUM1_SUS128_SVW1_VWA1_WG16_16_1_WGM8
    SolutionIndex: 77
    SolutionNameMin: Cijk_Alik_Bljk_BBS_BH_UserArgs_MT192x96x64_MI16x16x1_SN_GRVWA8_GRVWB8_GSU1_LBSPPA256_LPA16_LPB16_LRVW8_MIWT6_3_SU32_SUM1_SUS512_SVW2_VWA2_WG32_8_1_WGM8
    SolutionIndex: 78
    SolutionNameMin: Cijk_Alik_Bljk_BBS_BH_UserArgs_MT128x160x64_MI16x16x1_SN_GRVWA8_GRVWB8_GSU1_LBSPPA512_LPA16_LPB16_LRVW8_MIWT4_5_SU32_SUM1_SUS256_SVW4_VWA4_WG32_8_1_WGM8
    SolutionIndex: 79
    SolutionNameMin: Cijk_Alik_Bljk_BBS_BH_UserArgs_MT128x320x64_MI16x16x1_SN_LDSB1_GRVWB4_GSU1_LBSPPA1024_MIWT8_5_SU32_SUM1_SUS1024_SVW8_VWA8_WG16_16_1_WGM8
    SolutionIndex: 80
    SolutionNameMin: Cijk_Alik_Bljk_BBS_BH_UserArgs_MT16x16x128_MI16x16x1_SN_LDSB0_GRVWA8_GRVWB8_GSU1_LBSPPA256_LBSPPB256_LPA16_LPB16_LRVW8_MIWT1_1_SU32_SUM1_SUS256_SVW1_VWA1_WG16_4_1_WGM8
    SolutionIndex: 81
    SolutionNameMin: Cijk_Alik_Bljk_BBS_BH_UserArgs_MT16x32x128_MI16x16x1_SN_LDSB0_GRVWA8_GRVWB8_GSU1_LBSPPA256_LBSPPB256_LPA16_LPB16_LRVW8_MIWT1_1_SU32_SUM1_SUS256_SVW1_VWA1_WG16_8_1_WGM8
    SolutionIndex: 82
    SolutionNameMin: Cijk_Alik_Bljk_BBS_BH_UserArgs_MT16x32x128_MI16x16x1_SN_LDSB0_GRVWA8_GRVWB8_GSU1_LBSPPA256_LBSPPB256_LPA16_LPB16_LRVW8_MIWT1_1_SU32_SUM1_SUS256_WG16_8_1_WGM8
    SolutionIndex: 83
    SolutionNameMin: Cijk_Alik_Bljk_BBS_BH_UserArgs_MT32x64x128_MI16x16x1_SN_LDSB1_GRVWA8_GRVWB8_GSU1_LBSPPA512_LBSPPB256_LPA16_LPB16_LRVW8_MIWT2_1_SU32_SUM1_SUS256_SVW2_VWA2_WG16_16_1_WGM8
    SolutionIndex: 84
    SolutionNameMin: Cijk_Alik_Bljk_BBS_BH_UserArgs_MT64x32x128_MI16x16x1_SN_LDSB1_GRVWA8_GRVWB8_GSU1_LBSPPA512_LBSPPB256_LPA16_LPB16_LRVW8_MIWT2_1_SU32_SUM1_SUS256_SVW2_VWA2_WG32_8_1_WGM8
    SolutionIndex: 85
    SolutionNameMin: Cijk_Alik_Bljk_BBS_BH_UserArgs_MT64x48x128_MI16x16x1_SN_LDSB1_GRVWA8_GRVWB8_GSU1_LBSPPA256_LBSPPB256_LPA16_LPB16_LRVW8_MIWT1_3_SU32_SUM1_SUS256_SVW1_VWA1_WG64_4_1_WGM8
    SolutionIndex: 86
    SolutionNameMin: Cijk_Alik_Bljk_BBS_BH_UserArgs_MT224x192x64_MI16x16x1_SN_LDSB1_GSU1_LBSPPA128_MIWT7_6_SU32_SUM1_SUS128_SVW1_VWA1_WG32_8_1_WGM8
    SolutionIndex: 87
    SolutionNameMin: Cijk_Alik_Bljk_BBS_BH_UserArgs_MT192x224x64_MI16x16x1_SN_LDSB1_GRVWA4_GRVWB4_GSU1_LBSPPA256_MIWT6_7_SU32_SUM1_SUS1024_SVW2_VWA2_WG32_8_1_WGM8
    SolutionIndex: 88
    SolutionNameMin: Cijk_Alik_Bljk_BBS_BH_UserArgs_MT16x64x128_MI16x16x1_SN_LDSB0_GRVWA8_GRVWB8_GSU1_LBSPPA256_LBSPPB256_LPA16_LPB16_LRVW8_MIWT1_1_SU32_SUM1_SUS512_SVW1_VWA1_WG16_16_1_WGM8
    SolutionIndex: 89
    SolutionNameMin: Cijk_Alik_Bljk_BBS_BH_UserArgs_MT64x32x256_MI16x16x1_SN_LDSB1_GRVWA8_GRVWB8_GSU1_LBSPPA1024_LBSPPB512_LPA16_LPB16_LRVW8_MIWT2_1_SU32_SUM1_SUS1024_SVW2_VWA2_WG32_8_1_WGM8
    SolutionIndex: 90
    SolutionNameMin: Cijk_Alik_Bljk_BBS_BH_UserArgs_MT64x64x128_MI16x16x1_SN_LDSB1_GRVWA8_GRVWB8_GSU1_LBSPPA512_LBSPPB256_LPA16_LPB16_LRVW8_MIWT2_2_SU32_SUM1_SUS512_SVW2_VWA2_WG32_8_1_WGM8
    SolutionIndex: 91
    SolutionNameMin: Cijk_Alik_Bljk_BBS_BH_UserArgs_MT16x32x256_MI16x16x1_SN_LDSB0_GRVWA8_GRVWB8_GSU1_LBSPPA512_LBSPPB512_LPA16_LPB16_LRVW8_MIWT1_1_SU32_SUM1_SUS512_SVW1_VWA1_WG16_8_1_WGM8
    SolutionIndex: 92
    SolutionNameMin: Cijk_Alik_Bljk_BBS_BH_UserArgs_MT32x64x128_MI16x16x1_SN_LDSB1_GRVWA8_GRVWB8_GSU1_LBSPPA512_LBSPPB256_LPA16_LPB16_LRVW8_MIWT2_1_SU32_SUM1_SUS256_SVW2_VWA2_WG16_16_1_WGM8
    SolutionIndex: 93
    SolutionNameMin: Cijk_Alik_Bljk_BBS_BH_UserArgs_MT64x128x128_MI16x16x1_SN_LDSB1_GRVWA8_GRVWB8_GSU1_LBSPPA512_LBSPPB256_LPA16_LPB16_LRVW8_MIWT2_4_SU32_SUM1_SUS256_SVW2_VWA2_WG32_8_1_WGM8
    SolutionIndex: 94
    SolutionNameMin: Cijk_Alik_Bljk_BBS_BH_UserArgs_MT16x32x256_MI16x16x1_SN_LDSB0_GRVWA8_GRVWB8_GSU1_LBSPPA512_LBSPPB512_LPA16_LPB16_LRVW8_MIWT1_1_SU32_SUM1_SUS1024_SVW1_VWA1_WG16_8_1_WGM8
    SolutionIndex: 95
    SolutionNameMin: Cijk_Alik_Bljk_BBS_BH_UserArgs_MT32x64x256_MI16x16x1_SN_LDSB1_GRVWA8_GRVWB8_GSU1_LBSPPA1024_LBSPPB512_LPA16_LPB16_LRVW8_MIWT2_1_SU32_SUM1_SUS512_SVW2_VWA2_WG16_16_1_WGM8
    SolutionIndex: 96
    SolutionNameMin: Cijk_Alik_Bljk_BBS_BH_UserArgs_MT64x128x128_MI16x16x1_SN_LDSB1_GRVWA8_GRVWB8_GSU1_LBSPPA1024_LBSPPB256_LPA16_LPB16_LRVW8_MIWT4_2_SU32_SUM1_SUS1024_SVW4_VWA4_WG16_16_1_WGM8
    SolutionIndex: 97
    SolutionNameMin: Cijk_Alik_Bljk_BBS_BH_UserArgs_MT48x64x128_MI16x16x1_SN_LDSB1_GRVWA8_GRVWB8_GSU1_LBSPPA256_LBSPPB256_LPA16_LPB16_LRVW8_MIWT3_1_SU32_SUM1_SUS256_SVW1_VWA1_WG16_16_1_WGM8
    SolutionIndex: 98
    SolutionNameMin: Cijk_Alik_Bljk_BBS_BH_UserArgs_MT32x16x256_MI16x16x1_SN_LDSB0_GRVWA8_GRVWB8_GSU3_GSUAMBSK_LBSPPA512_LBSPPB512_LPA16_LPB16_LRVW8_MIWT1_1_SU32_SUM1_SUS512_SVW1_VWA1_WG32_4_1_WGM8
    SolutionIndex: 99
    SolutionNameMin: Cijk_Alik_Bljk_BBS_BH_UserArgs_MT32x256x64_MI16x16x1_SN_LDSB1_GRVWA8_GRVWB8_GSU1_LBSPPA256_LBSPPB128_LPA16_LPB16_LRVW8_MIWT2_4_SU32_SUM1_SUS128_SVW2_VWA2_WG16_16_1_WGM8
    SolutionIndex: 100
    SolutionNameMin: Cijk_Alik_Bljk_BBS_BH_UserArgs_MT32x96x128_MI16x16x1_SN_LDSB1_GRVWA8_GRVWB8_GSU1_LBSPPA256_LBSPPB256_LPA16_LPB16_LRVW8_MIWT1_3_SU32_SUM1_SUS512_SVW1_VWA1_WG32_8_1_WGM8
    SolutionIndex: 101
    SolutionNameMin: Cijk_Alik_Bljk_BBS_BH_UserArgs_MT32x64x256_MI16x16x1_SN_LDSB1_GRVWA8_GRVWB8_GSU1_LBSPPA1024_LBSPPB512_LPA16_LPB16_LRVW8_MIWT2_1_SU32_SUM1_SUS1024_SVW2_VWA2_WG16_16_1_WGM8
    SolutionIndex: 102
    SolutionNameMin: Cijk_Alik_Bljk_BBS_BH_UserArgs_MT96x64x128_MI16x16x1_SN_LDSB1_GRVWA8_GRVWB8_GSU6_GSUAMB_LBSPPA256_LBSPPB256_LPA16_LPB16_LRVW8_MIWT3_2_SU32_SUM1_SUS256_SVW1_VWA1_WG32_8_1_WGM8
    SolutionIndex: 103
    SolutionNameMin: Cijk_Alik_Bljk_BBS_BH_UserArgs_MT64x96x128_MI16x16x1_SN_LDSB1_GRVWA8_GRVWB8_GSU3_GSUAMB_LBSPPA256_LBSPPB256_LPA16_LPB16_LRVW8_MIWT1_6_SU32_SUM1_SUS256_WG64_4_1_WGM8
    SolutionIndex: 104
    SolutionNameMin: Cijk_Alik_Bljk_BBS_BH_UserArgs_MT64x32x128_MI16x16x1_SN_LDSB1_GRVWA8_GRVWB8_GSU1_LBSPPA512_LBSPPB256_LPA16_LPB16_LRVW8_MIWT2_1_SU32_SUM1_SUS256_SVW2_VWA2_WG32_8_1_WGM8
    SolutionIndex: 105
    SolutionNameMin: Cijk_Alik_Bljk_BBS_BH_UserArgs_MT128x64x128_MI16x16x1_SN_LDSB1_GRVWA8_GRVWB8_GSU1_LBSPPA2048_LBSPPB256_LPA16_LPB16_LRVW8_MIWT8_1_SU32_SUM1_SUS512_SVW8_VWA8_WG16_16_1_WGM8
    SolutionIndex: 106
    SolutionNameMin: Cijk_Alik_Bljk_BBS_BH_UserArgs_MT32x96x128_MI16x16x1_SN_LDSB1_GRVWA8_GRVWB8_GSU1_LBSPPA256_LBSPPB256_LPA16_LPB16_LRVW8_MIWT1_3_SU32_SUM1_SUS1024_SVW1_VWA1_WG32_8_1_WGM8
    SolutionIndex: 107
    SolutionNameMin: Cijk_Alik_Bljk_BBS_BH_UserArgs_MT64x32x128_MI16x16x1_SN_LDSB1_GRVWA8_GRVWB8_GSU1_LBSPPA256_LBSPPB256_LPA16_LPB16_LRVW8_MIWT1_2_SU32_SUM1_SUS256_SVW1_VWA1_WG64_4_1_WGM8
    SolutionIndex: 108
    SolutionNameMin: Cijk_Alik_Bljk_BBS_BH_UserArgs_MT128x64x128_MI16x16x1_SN_LDSB1_GRVWA8_GRVWB8_GSU1_LBSPPA1024_LBSPPB256_LPA16_LPB16_LRVW8_MIWT4_2_SU32_SUM1_SUS1024_SVW4_VWA4_WG32_8_1_WGM8
    SolutionIndex: 109
    SolutionNameMin: Cijk_Alik_Bljk_BBS_BH_UserArgs_MT32x96x128_MI16x16x1_SN_LDSB1_GRVWA8_GRVWB8_GSU1_LBSPPA256_LBSPPB256_LPA16_LPB16_LRVW8_MIWT1_3_SU32_SUM1_SUS256_SVW1_VWA1_WG32_8_1_WGM8
    SolutionIndex: 110
    SolutionNameMin: Cijk_Alik_Bljk_BBS_BH_UserArgs_MT16x32x256_MI16x16x1_SN_LDSB0_GRVWA8_GRVWB8_GSU2_GSUAMBSK_LBSPPA512_LBSPPB512_LPA16_LPB16_LRVW8_MIWT1_1_SU32_SUM1_SUS512_WG16_8_1_WGM8
    SolutionIndex: 111
    SolutionNameMin: Cijk_Alik_Bljk_BBS_BH_UserArgs_MT128x64x64_MI16x16x1_SN_LDSB1_GRVWA8_GRVWB8_GSU1_LBSPPA512_LBSPPB128_LPA16_LPB16_LRVW8_MIWT4_2_SU32_SUM1_SUS128_SVW4_VWA4_WG32_8_1_WGM8
    SolutionIndex: 112
    SolutionNameMin: Cijk_Alik_Bljk_BBS_BH_UserArgs_MT32x16x256_MI16x16x1_SN_LDSB0_GRVWA8_GRVWB8_GSU1_LBSPPA512_LBSPPB512_LPA16_LPB16_LRVW8_MIWT1_1_SU32_SUM1_SUS512_SVW1_VWA1_WG32_4_1_WGM8
    SolutionIndex: 113
    SolutionNameMin: Cijk_Alik_Bljk_BBS_BH_UserArgs_MT16x32x64_MI16x16x1_SN_LDSB0_GRVWA8_GRVWB8_GSU1_LBSPPA128_LBSPPB128_LPA16_LPB16_LRVW8_MIWT1_1_SU32_SUM1_SUS128_SVW1_VWA1_WG16_8_1_WGM8
    SolutionIndex: 114
    SolutionNameMin: Cijk_Alik_Bljk_BBS_BH_Bias_AS_SAV_UserArgs_MT256x224x64_MI16x16x1_SN_LDSB1_GRVWA4_GRVWB4_GSU1_LBSPPA1024_MIWT8_7_SU32_SUM1_SUS128_SVW8_VWA8_WG32_8_1_WGM8
    SolutionIndex: 115
    SolutionNameMin: Cijk_Alik_Bljk_BBS_BH_Bias_AS_SAV_UserArgs_MT256x192x64_MI16x16x1_SN_LDSB1_GRVWB4_GSU1_LBSPPA1024_MIWT8_6_SU32_SUM1_SUS128_SVW8_VWA8_WG32_8_1_WGM8
    SolutionIndex: 116
    SolutionNameMin: Cijk_Alik_Bljk_BBS_BH_Bias_AS_SAV_UserArgs_MT256x160x64_MI16x16x1_SN_LDSB1_GRVWA4_GRVWB4_GSU1_LBSPPA1024_MIWT8_5_SU32_SUM1_SUS128_SVW8_VWA8_WG32_8_1_WGM8
    SolutionIndex: 117
    SolutionNameMin: Cijk_Alik_Bljk_BBS_BH_Bias_AS_SAV_UserArgs_MT16x16x256_MI16x16x1_SN_LDSB0_GRVWA8_GRVWB8_GSU1_LBSPPA512_LBSPPB512_LPA16_LPB16_LRVW8_MIWT1_1_SU32_SUM1_SUS512_SVW1_VWA1_WG16_4_1_WGM8
    SolutionIndex: 118
    SolutionNameMin: Cijk_Alik_Bljk_BBS_BH_Bias_AS_SAV_UserArgs_MT256x144x64_MI16x16x1_SN_LDSB1_GRVWA8_GRVWB4_GSU1_LBSPPA512_LPA16_LPB16_LRVW8_MIWT4_9_SU32_SUM1_SUS256_SVW4_VWA4_WG64_4_1_WGM8
    SolutionIndex: 119
    SolutionNameMin: Cijk_Alik_Bljk_BBS_BH_Bias_AS_SAV_UserArgs_MT256x208x64_MI16x16x1_SN_LDSB1_GRVWA4_GRVWB4_GSU1_LBSPPA512_MIWT4_13_SU32_SUM1_SUS256_SVW4_VWA4_WG64_4_1_WGM8
    SolutionIndex: 120
    SolutionNameMin: Cijk_Alik_Bljk_BBS_BH_Bias_AS_SAV_UserArgs_MT64x96x128_MI16x16x1_SN_LDSB1_GRVWA8_GRVWB8_GSU1_LBSPPA512_LBSPPB256_LPA16_LPB16_LRVW8_MIWT2_3_SU32_SUM1_SUS1024_SVW2_VWA2_WG32_8_1_WGM8
    SolutionIndex: 121
    SolutionNameMin: Cijk_Alik_Bljk_BBS_BH_Bias_AS_SAV_UserArgs_MT128x320x64_MI16x16x1_SN_LDSB1_GRVWA4_GRVWB4_GSU1_LBSPPA1024_MIWT8_5_SU32_SUM1_SUS1024_SVW8_VWA8_WG16_16_1_WGM8
    SolutionIndex: 122
    SolutionNameMin: Cijk_Alik_Bljk_BBS_BH_Bias_AS_SAV_UserArgs_MT128x16x64_MI16x16x1_SN_LDSB1_GRVWA8_GRVWB4_GSU1_LBSPPA256_LBSPPB128_LPA16_LPB16_LRVW8_MIWT2_1_SU32_SUM1_SUS128_SVW2_VWA2_WG64_4_1_WGM8
    SolutionIndex: 123
    SolutionNameMin: Cijk_Alik_Bljk_BBS_BH_Bias_AS_SAV_UserArgs_MT16x16x256_MI16x16x1_SN_GRVWA8_GRVWB8_GSU6_GSUAMBSK_LBSPPA512_LBSPPB512_LPA16_LPB16_LRVW8_MIWT1_1_SU32_SUM1_SUS512_WG16_4_1_WGM8
    SolutionIndex: 124
    SolutionNameMin: Cijk_Alik_Bljk_BBS_BH_Bias_AS_SAV_UserArgs_MT128x16x64_MI16x16x1_SN_LDSB1_GRVWA8_GRVWB4_GSU1_LBSPPA256_LBSPPB128_LPA16_LPB16_LRVW8_MIWT2_1_SU32_SUM1_SUS256_SVW2_VWA2_WG64_4_1_WGM8
    SolutionIndex: 125
    SolutionNameMin: Cijk_Alik_Bljk_BBS_BH_Bias_AS_SAV_UserArgs_MT256x192x64_MI16x16x1_SN_LDSB1_GSU1_LBSPPA1024_MIWT8_6_SU32_SUM1_SUS256_SVW8_VWA8_WG32_8_1_WGM8
    SolutionIndex: 126
    SolutionNameMin: Cijk_Alik_Bljk_BBS_BH_Bias_AS_SAV_UserArgs_MT128x48x128_MI16x16x1_SN_LDSB1_GRVWA8_GRVWB8_GSU1_LBSPPA512_LBSPPB256_LPA16_LPB16_LRVW8_MIWT2_3_SU32_SUM1_SUS1024_SVW2_VWA2_WG64_4_1_WGM8
    SolutionIndex: 127
    SolutionNameMin: Cijk_Alik_Bljk_BBS_BH_Bias_AS_SAV_UserArgs_MT32x16x256_MI16x16x1_SN_LDSB0_GRVWA8_GRVWB8_GSU1_LBSPPA512_LBSPPB512_LPA16_LPB16_LRVW8_MIWT1_1_SU32_SUM1_SUS512_SVW1_VWA1_WG32_4_1_WGM8
    SolutionIndex: 128
    SolutionNameMin: Cijk_Alik_Bljk_BBS_BH_Bias_AS_SAV_UserArgs_MT128x64x64_MI16x16x1_SN_LDSB1_GRVWA8_GRVWB8_GSU1_LBSPPA512_LBSPPB128_LPA16_LPB16_LRVW8_MIWT4_2_SU32_SUM1_SUS1024_SVW4_VWA4_WG32_8_1_WGM8
    SolutionIndex: 129
    SolutionNameMin: Cijk_Alik_Bljk_BBS_BH_Bias_AS_SAV_UserArgs_MT32x16x128_MI16x16x1_SN_LDSB0_GRVWA8_GRVWB8_GSU1_LBSPPA256_LBSPPB256_LPA16_LPB16_LRVW8_MIWT1_1_SU32_SUM1_SUS256_SVW1_VWA1_WG32_4_1_WGM8
    SolutionIndex: 130
    SolutionNameMin: Cijk_Alik_Bljk_BBS_BH_Bias_AS_SAV_UserArgs_MT64x32x128_MI16x16x1_SN_LDSB1_GRVWA8_GRVWB8_GSU1_LBSPPA512_LBSPPB256_LPA16_LPB16_LRVW8_MIWT2_1_SU32_SUM1_SUS1024_SVW2_VWA2_WG32_8_1_WGM8
    SolutionIndex: 131
    SolutionNameMin: Cijk_Alik_Bljk_BBS_BH_Bias_AS_SAV_UserArgs_MT128x64x64_MI16x16x1_SN_LDSB1_GRVWA8_GRVWB8_GSU11_GSUAMB_LBSPPA512_LBSPPB128_LPA16_LPB16_LRVW8_MIWT4_2_SU32_SUM1_SUS1024_SVW4_VWA4_WG32_8_1_WGM8
    SolutionIndex: 132
    SolutionNameMin: Cijk_Alik_Bljk_BBS_BH_Bias_AS_SAV_UserArgs_MT64x64x128_MI16x16x1_SN_LDSB1_GRVWA8_GRVWB8_GSU1_LBSPPA512_LBSPPB256_LPA16_LPB16_LRVW8_MIWT2_2_SU32_SUM1_SUS1024_SVW2_VWA2_WG32_8_1_WGM8
    SolutionIndex: 133
    SolutionNameMin: Cijk_Alik_Bljk_BBS_BH_Bias_AS_SAV_UserArgs_MT64x64x64_MI16x16x1_SN_LDSB1_GRVWA8_GRVWB8_GSU1_LBSPPA256_LBSPPB128_LPA16_LPB16_LRVW8_MIWT2_2_SU32_SUM1_SUS128_SVW2_VWA2_WG32_8_1_WGM8
    SolutionIndex: 134
    SolutionNameMin: Cijk_Alik_Bljk_BBS_BH_Bias_AS_SAV_UserArgs_MT80x128x64_MI16x16x1_SN_LDSB1_GRVWA4_GRVWB8_GSU1_LBSPPA128_LBSPPB128_LPA16_LPB16_LRVW8_MIWT5_2_SU32_SUM1_SUS256_SVW1_VWA1_WG16_16_1_WGM8
    SolutionIndex: 135
    SolutionNameMin: Cijk_Alik_Bljk_BBS_BH_Bias_AS_SAV_UserArgs_MT64x64x64_MI16x16x1_SN_LDSB1_GRVWA8_GRVWB8_GSU9_GSUAMBSK_LBSPPA512_LBSPPB128_LPA16_LPB16_LRVW8_MIWT4_1_SU32_SUM1_SUS256_SVW4_VWA4_WG16_16_1_WGM8
    SolutionIndex: 136
    SolutionNameMin: Cijk_Alik_Bljk_BBS_BH_Bias_AS_SAV_UserArgs_MT64x64x64_MI16x16x1_SN_LDSB1_GRVWA8_GRVWB8_GSU9_GSUAMB_LBSPPA512_LBSPPB128_LPA16_LPB16_LRVW8_MIWT4_1_SU32_SUM1_SUS512_SVW4_VWA4_WG16_16_1_WGM8
    SolutionIndex: 137
    SolutionNameMin: Cijk_Alik_Bljk_BBS_BH_Bias_AS_SAV_UserArgs_MT64x64x64_MI16x16x1_SN_LDSB1_GRVWA8_GRVWB8_GSU9_GSUAMBSK_LBSPPA512_LBSPPB128_LPA16_LPB16_LRVW8_MIWT4_1_SU32_SUM1_SUS128_SVW4_VWA4_WG16_16_1_WGM8
    SolutionIndex: 138
    SolutionNameMin: Cijk_Alik_Bljk_BBS_BH_Bias_AS_SAV_UserArgs_MT64x32x64_MI16x16x1_SN_LDSB0_GRVWA8_GRVWB8_GSU1_LBSPPA256_LBSPPB128_LPA16_LPB16_LRVW8_MIWT2_1_SU32_SUM1_SUS512_SVW2_VWA2_WG32_8_1_WGM8
    SolutionIndex: 139
    SolutionNameMin: Cijk_Alik_Bljk_BBS_BH_Bias_AS_SAV_UserArgs_MT32x32x128_MI16x16x1_SN_LDSB0_GRVWA8_GRVWB8_GSU1_LBSPPA256_LBSPPB256_LPA16_LPB16_LRVW8_MIWT1_1_SU32_SUM1_SUS1024_SVW1_VWA1_WG32_8_1_WGM8
    SolutionIndex: 140
    SolutionNameMin: Cijk_Alik_Bljk_BBS_BH_Bias_AS_SAV_UserArgs_MT64x32x256_MI16x16x1_SN_LDSB1_GRVWA8_GRVWB8_GSU1_LBSPPA1024_LBSPPB512_LPA16_LPB16_LRVW8_MIWT2_1_SU32_SUM1_SUS512_SVW2_VWA2_WG32_8_1_WGM8
    SolutionIndex: 141
    SolutionNameMin: Cijk_Alik_Bljk_BBS_BH_Bias_AS_SAV_UserArgs_MT80x256x64_MI16x16x1_SN_GRVWA4_GRVWB8_GSU1_LBSPPA128_LPA16_LPB16_LRVW8_MIWT5_4_SU32_SUM1_SUS256_SVW1_VWA1_WG16_16_1_WGM8
    SolutionIndex: 142
    SolutionNameMin: Cijk_Alik_Bljk_BBS_BH_Bias_AS_SAV_UserArgs_MT128x96x64_MI16x16x1_SN_LDSB1_GRVWA8_GRVWB8_GSU1_LBSPPA256_LBSPPB128_LPA16_LPB16_LRVW8_MIWT2_6_SU32_SUM1_SUS512_SVW2_VWA2_WG64_4_1_WGM8
    SolutionIndex: 143
    SolutionNameMin: Cijk_Alik_Bljk_BBS_BH_Bias_AS_SAV_UserArgs_MT256x224x64_MI16x16x1_SN_LDSB1_GRVWA4_GRVWB4_GSU1_LBSPPA1024_LPA4_LPB4_LRVW4_MIWT8_7_SU32_SUM1_SUS512_SVW8_VWA8_WG32_8_1_WGM8
    SolutionIndex: 144
    SolutionNameMin: Cijk_Alik_Bljk_BBS_BH_Bias_AS_SAV_UserArgs_MT64x128x128_MI16x16x1_SN_LDSB1_GRVWA8_GRVWB8_GSU1_LBSPPA1024_LBSPPB256_LPA16_LPB16_LRVW8_MIWT4_2_SU32_SUM1_SUS1024_SVW4_VWA4_WG16_16_1_WGM8
    SolutionIndex: 145
    SolutionNameMin: Cijk_Alik_Bljk_BBS_BH_Bias_AS_SAV_UserArgs_MT256x64x64_MI16x16x1_SN_GRVWA8_GRVWB8_GSU1_LBSPPA1024_LPA16_LPB16_LRVW8_MIWT8_2_SU32_SUM1_SUS128_SVW8_VWA8_WG32_8_1_WGM8
    SolutionIndex: 146
    SolutionNameMin: Cijk_Alik_Bljk_BBS_BH_Bias_AS_SAV_UserArgs_MT16x16x256_MI16x16x1_SN_GRVWA8_GRVWB8_GSU6_GSUAMBSK_LBSPPA512_LBSPPB512_LPA16_LPB16_LRVW8_MIWT1_1_SU32_SUM1_SUS1024_WG16_4_1_WGM8
    SolutionIndex: 147
    SolutionNameMin: Cijk_Alik_Bljk_BBS_BH_Bias_AS_SAV_UserArgs_MT448x32x64_MI16x16x1_SN_GRVWA4_GRVWB4_GSU1_LBSPPA256_LPA4_LPB4_LRVW4_MIWT14_1_SU32_SUM1_SUS128_SVW2_VWA2_WG32_8_1_WGM8
    SolutionIndex: 148
    SolutionNameMin: Cijk_Alik_Bljk_BBS_BH_Bias_AS_SAV_UserArgs_MT16x32x256_MI16x16x1_SN_LDSB0_GRVWA8_GRVWB8_GSU1_LBSPPA512_LBSPPB512_LPA16_LPB16_LRVW8_MIWT1_1_SU32_SUM1_SUS512_SVW1_VWA1_WG16_8_1_WGM8
    SolutionIndex: 149
    SolutionNameMin: Cijk_Alik_Bljk_BBS_BH_Bias_AS_SAV_UserArgs_MT128x128x64_MI16x16x1_SN_GRVWA8_GRVWB8_GSU1_LBSPPA512_LPA16_LPB16_LRVW8_MIWT4_4_SU32_SUM1_SUS128_SVW4_VWA4_WG32_8_1_WGM8
    SolutionIndex: 150
    SolutionNameMin: Cijk_Alik_Bljk_BBS_BH_Bias_AS_SAV_UserArgs_MT64x64x64_MI16x16x1_SN_LDSB1_GRVWA8_GRVWB8_GSU1_LBSPPA256_LBSPPB128_LPA16_LPB16_LRVW8_MIWT2_2_SU32_SUM1_SUS1024_SVW2_VWA2_WG32_8_1_WGM8
    SolutionIndex: 151
    SolutionNameMin: Cijk_Alik_Bljk_BBS_BH_Bias_AS_SAV_UserArgs_MT128x64x64_MI16x16x1_SN_LDSB1_GRVWA8_GRVWB8_GSU9_GSUAMB_LBSPPA256_LBSPPB128_LPA16_LPB16_LRVW8_MIWT2_4_SU32_SUM1_SUS256_SVW2_VWA2_WG64_4_1_WGM8
    SolutionIndex: 152
    SolutionNameMin: Cijk_Alik_Bljk_BBS_BH_Bias_AS_SAV_UserArgs_MT128x64x128_MI16x16x1_SN_LDSB1_GRVWA8_GRVWB8_GSU1_LBSPPA512_LBSPPB256_LPA16_LPB16_LRVW8_MIWT2_4_SU32_SUM1_SUS1024_SVW2_VWA2_WG64_4_1_WGM8
    SolutionIndex: 153
    SolutionNameMin: Cijk_Alik_Bljk_BBS_BH_Bias_AS_SAV_UserArgs_MT128x64x64_MI16x16x1_SN_LDSB1_GRVWA8_GRVWB8_GSU1_LBSPPA1024_LBSPPB128_LPA16_LPB16_LRVW8_MIWT8_1_SU32_SUM1_SUS128_SVW8_VWA8_WG16_16_1_WGM8
    SolutionIndex: 154
    SolutionNameMin: Cijk_Alik_Bljk_BBS_BH_Bias_AS_SAV_UserArgs_MT160x128x64_MI16x16x1_SN_GRVWA8_GRVWB8_GSU1_LBSPPA128_LPA16_LPB16_LRVW8_MIWT5_4_SU32_SUM1_SUS512_SVW1_VWA1_WG32_8_1_WGM8
    SolutionIndex: 155
    SolutionNameMin: Cijk_Alik_Bljk_BBS_BH_Bias_AS_SAV_UserArgs_MT128x48x128_MI16x16x1_SN_LDSB1_GRVWA8_GRVWB8_GSU7_GSUAMB_LBSPPA512_LBSPPB256_LPA16_LPB16_LRVW8_MIWT2_3_SU32_SUM1_SUS256_SVW2_VWA2_WG64_4_1_WGM8
    SolutionIndex: 156
    SolutionNameMin: Cijk_Alik_Bljk_BBS_BH_Bias_AS_SAV_UserArgs_MT128x128x64_MI16x16x1_SN_LDSB1_GRVWA8_GRVWB8_GSU7_GSUAMB_LBSPPA512_LBSPPB128_LPA16_LPB16_LRVW8_MIWT4_4_SU32_SUM1_SUS128_SVW4_VWA4_WG32_8_1_WGM8
    SolutionIndex: 157
    SolutionNameMin: Cijk_Alik_Bljk_BBS_BH_Bias_AS_SAV_UserArgs_MT128x64x64_MI16x16x1_SN_LDSB1_GRVWA8_GRVWB8_GSU9_GSUAMB_LBSPPA256_LBSPPB128_LPA16_LPB16_LRVW8_MIWT2_4_SU32_SUM1_SUS128_SVW2_VWA2_WG64_4_1_WGM8
    SolutionIndex: 158
    SolutionNameMin: Cijk_Alik_Bljk_BBS_BH_Bias_AS_SAV_UserArgs_MT64x32x256_MI16x16x1_SN_LDSB1_GRVWA8_GRVWB8_GSU1_LBSPPA1024_LBSPPB512_LPA16_LPB16_LRVW8_MIWT2_1_SU32_SUM1_SUS1024_SVW2_VWA2_WG32_8_1_WGM8
    SolutionIndex: 159
    SolutionNameMin: Cijk_Alik_Bljk_BBS_BH_Bias_AS_SAV_UserArgs_MT64x64x128_MI16x16x1_SN_LDSB1_GRVWA8_GRVWB8_GSU1_LBSPPA512_LBSPPB256_LPA16_LPB16_LRVW8_MIWT2_2_SU32_SUM1_SUS512_SVW2_VWA2_WG32_8_1_WGM8
    SolutionIndex: 160
    SolutionNameMin: Cijk_Alik_Bljk_BBS_BH_Bias_AS_SAV_UserArgs_MT256x128x64_MI16x16x1_SN_GRVWA8_GRVWB8_GSU1_LBSPPA512_LPA16_LPB16_LRVW8_MIWT4_8_SU32_SUM1_SUS128_SVW4_VWA4_WG64_4_1_WGM8
    SolutionIndex: 161
    SolutionNameMin: Cijk_Alik_Bljk_BBS_BH_Bias_AS_SAV_UserArgs_MT128x64x64_MI16x16x1_SN_LDSB1_GRVWA8_GRVWB8_GSU1_LBSPPA512_LBSPPB128_LPA16_LPB16_LRVW8_MIWT4_2_SU32_SUM1_SUS128_SVW4_VWA4_WG32_8_1_WGM8
    SolutionIndex: 162
    SolutionNameMin: Cijk_Alik_Bljk_BBS_BH_Bias_AS_SAV_UserArgs_MT128x96x64_MI16x16x1_SN_LDSB1_GRVWA8_GRVWB8_GSU7_GSUAMB_LBSPPA256_LBSPPB128_LPA16_LPB16_LRVW8_MIWT2_6_SU32_SUM1_SUS128_SVW2_VWA2_WG64_4_1_WGM8
    SolutionIndex: 163
    SolutionNameMin: Cijk_Alik_Bljk_BBS_BH_Bias_AS_SAV_UserArgs_MT128x128x64_MI16x16x1_SN_GRVWA8_GRVWB8_GSU1_LBSPPA1024_LPA16_LPB16_LRVW8_MIWT8_2_SU32_SUM1_SUS512_SVW8_VWA8_WG16_16_1_WGM8
    SolutionIndex: 164
    SolutionNameMin: Cijk_Alik_Bljk_BBS_BH_Bias_AS_SAV_UserArgs_MT128x128x64_MI16x16x1_SN_GRVWA8_GRVWB8_GSU1_LBSPPA512_LPA16_LPB16_LRVW8_MIWT4_4_SU32_SUM1_SUS1024_SVW4_VWA4_WG32_8_1_WGM8
    SolutionIndex: 165
    SolutionNameMin: Cijk_Alik_Bljk_BBS_BH_Bias_AS_SAV_UserArgs_MT192x208x64_MI16x16x1_SN_LDSB1_GRVWA8_GRVWB4_GSU1_LBSPPA128_LPA16_LPB16_LRVW8_MIWT3_13_SU32_SUM1_SUS256_SVW1_VWA1_WG64_4_1_WGM8
    SolutionIndex: 166
    SolutionNameMin: Cijk_Alik_Bljk_BBS_BH_Bias_AS_SAV_UserArgs_MT128x128x64_MI16x16x1_SN_LDSB1_GRVWA8_GRVWB8_GSU5_GSUAMB_LBSPPA512_LPA16_LPB16_LRVW8_MIWT4_4_SU32_SUM1_SUS128_SVW4_VWA4_WG32_8_1_WGM8
    SolutionIndex: 167
    SolutionNameMin: Cijk_Alik_Bljk_BBS_BH_Bias_AS_SAV_UserArgs_MT64x32x128_MI16x16x1_SN_LDSB1_GRVWA8_GRVWB8_GSU1_LBSPPA256_LBSPPB256_LPA16_LPB16_LRVW8_MIWT1_2_SU32_SUM1_SUS512_SVW1_VWA1_WG64_4_1_WGM8
    SolutionIndex: 168
    SolutionNameMin: Cijk_Alik_Bljk_BBS_BH_Bias_AS_SAV_UserArgs_MT128x64x64_MI16x16x1_SN_LDSB1_GRVWA8_GRVWB8_GSU1_LBSPPA256_LBSPPB128_LPA16_LPB16_LRVW8_MIWT2_4_SU32_SUM1_SUS1024_SVW2_VWA2_WG64_4_1_WGM8
    SolutionIndex: 169
    SolutionNameMin: Cijk_Alik_Bljk_BBS_BH_Bias_AS_SAV_UserArgs_MT64x64x128_MI16x16x1_SN_LDSB1_GRVWA8_GRVWB8_GSU1_LBSPPA512_LBSPPB256_LPA16_LPB16_LRVW8_MIWT2_2_SU32_SUM1_SUS256_SVW2_VWA2_WG32_8_1_WGM8
    SolutionIndex: 170
    SolutionNameMin: Cijk_Alik_Bljk_BBS_BH_Bias_AS_SAV_UserArgs_MT128x64x128_MI16x16x1_SN_LDSB1_GRVWA8_GRVWB8_GSU1_LBSPPA512_LBSPPB256_LPA16_LPB16_LRVW8_MIWT2_4_SU32_SUM1_SUS512_SVW2_VWA2_WG64_4_1_WGM8
- - - [7168, 2097152, 1, 8192]
    - [2, 0.0]
  - - [3584, 2097152, 1, 8192]
    - [2, 0.0]
  - - [1280, 2097152, 1, 8192]
    - [0, 0.0]
  - - [1024, 2097152, 1, 8192]
    - [1, 0.0]
  - - [7168, 1048576, 1, 8192]
    - [2, 0.0]
  - - [3584, 1048576, 1, 8192]
    - [2, 0.0]
  - - [1280, 1048576, 1, 8192]
    - [0, 0.0]
  - - [1024, 1048576, 1, 8192]
    - [1, 0.0]
  - - [7168, 524288, 1, 8192]
    - [2, 0.0]
  - - [3584, 524288, 1, 8192]
    - [2, 0.0]
  - - [1280, 524288, 1, 8192]
    - [0, 0.0]
  - - [1024, 524288, 1, 8192]
    - [1, 0.0]
  - - [7168, 262144, 1, 8192]
    - [2, 0.0]
  - - [3584, 262144, 1, 8192]
    - [2, 0.0]
  - - [1280, 262144, 1, 8192]
    - [0, 0.0]
  - - [1024, 262144, 1, 8192]
    - [1, 0.0]
  - - [7168, 131072, 1, 8192]
    - [3, 0.0]
  - - [3584, 131072, 1, 8192]
    - [2, 0.0]
  - - [1280, 131072, 1, 8192]
    - [0, 0.0]
  - - [1024, 131072, 1, 8192]
    - [1, 0.0]
  - - [7168, 8192, 1, 8192]
    - [4, 0.0]
  - - [3584, 8192, 1, 8192]
    - [5, 0.0]
  - - [1280, 8192, 1, 8192]
    - [6, 0.0]
  - - [1024, 8192, 1, 8192]
    - [7, 0.0]
  - - [7168, 16384, 1, 8192]
    - [2, 0.0]
  - - [3584, 16384, 1, 8192]
    - [3, 0.0]
  - - [1280, 16384, 1, 8192]
    - [8, 0.0]
  - - [1024, 16384, 1, 8192]
    - [9, 0.0]
  - - [7168, 32768, 1, 8192]
    - [2, 0.0]
  - - [3584, 32768, 1, 8192]
    - [2, 0.0]
  - - [1280, 32768, 1, 8192]
    - [10, 0.0]
  - - [1024, 32768, 1, 8192]
    - [9, 0.0]
  - - [7168, 65536, 1, 8192]
    - [2, 0.0]
  - - [3584, 65536, 1, 8192]
    - [2, 0.0]
  - - [1280, 65536, 1, 8192]
    - [9, 0.0]
  - - [1024, 65536, 1, 8192]
    - [1, 0.0]
  - - [8192, 1, 1, 1024]
    - [11, 0.0]
  - - [7168, 1, 1, 8192]
    - [19, 0.0]
  - - [8192, 1, 1, 3584]
    - [13, 0.0]
  - - [1280, 1, 1, 8192]
    - [14, 0.0]
  - - [8192, 2, 1, 1024]
    - [15, 0.0]
  - - [7168, 2, 1, 8192]
    - [19, 0.0]
  - - [8192, 2, 1, 3584]
    - [17, 0.0]
  - - [1280, 2, 1, 8192]
    - [18, 0.0]
  - - [8192, 4, 1, 1024]
    - [11, 0.0]
  - - [7168, 4, 1, 8192]
    - [19, 0.0]
  - - [8192, 4, 1, 3584]
    - [20, 0.0]
  - - [1280, 4, 1, 8192]
    - [21, 0.0]
  - - [8192, 8, 1, 1024]
    - [11, 0.0]
  - - [7168, 8, 1, 8192]
    - [19, 0.0]
  - - [8192, 8, 1, 3584]
    - [12, 0.0]
  - - [1280, 8, 1, 8192]
    - [22, 0.0]
  - - [8192, 16, 1, 1024]
    - [11, 0.0]
  - - [7168, 16, 1, 8192]
    - [19, 0.0]
  - - [8192, 16, 1, 3584]
    - [12, 0.0]
  - - [1280, 16, 1, 8192]
    - [23, 0.0]
  - - [8192, 32, 1, 1024]
    - [11, 0.0]
  - - [7168, 32, 1, 8192]
    - [24, 0.0]
  - - [8192, 32, 1, 3584]
    - [25, 0.0]
  - - [1280, 32, 1, 8192]
    - [26, 0.0]
  - - [8192, 64, 1, 1024]
    - [27, 0.0]
  - - [7168, 64, 1, 8192]
    - [24, 0.0]
  - - [8192, 64, 1, 3584]
    - [28, 0.0]
  - - [1280, 64, 1, 8192]
    - [29, 0.0]
  - - [8192, 128, 1, 1024]
    - [30, 0.0]
  - - [7168, 128, 1, 8192]
    - [31, 0.0]
  - - [8192, 128, 1, 3584]
    - [32, 0.0]
  - - [1280, 128, 1, 8192]
    - [33, 0.0]
  - - [512, 512, 1, 512]
    - [82, 0.0]
  - - [1024, 1024, 1, 1024]
    - [43, 0.0]
  - - [2048, 2048, 1, 2048]
    - [74, 0.0]
  - - [4096, 4096, 1, 4096]
    - [59, 0.0]
  - - [4096, 4096, 1, 8192]
    - [34, 0.0]
  - - [8192, 8192, 1, 8192]
    - [34, 0.0]
  - - [2, 7168, 1, 8192]
    - [35, 0.0]
  - - [2, 3584, 1, 8192]
    - [36, 0.0]
  - - [2, 1280, 1, 8192]
    - [37, 0.0]
  - - [8192, 7168, 1, 8192]
    - [38, 0.0]
  - - [8192, 3584, 1, 8192]
    - [39, 0.0]
  - - [8192, 1280, 1, 8192]
    - [40, 0.0]
  - - [3584, 2, 1, 8192]
    - [16, 0.0]
  - - [1024, 2, 1, 8192]
    - [41, 0.0]
  - - [128, 16384, 1, 2304]
    - [42, 0.0]
  - - [1152, 1152, 1, 1152]
    - [44, 0.0]
  - - [2560, 2560, 1, 2560]
    - [45, 0.0]
  - - [1536, 384, 1, 12288]
    - [46, 0.0]
  - - [6144, 384, 1, 1536]
    - [47, 0.0]
  - - [1536, 96, 1, 1536]
    - [48, 0.0]
  - - [1536, 96, 1, 12288]
    - [49, 0.0]
  - - [6144, 96, 1, 1536]
    - [50, 0.0]
  - - [384, 6144, 1, 3072]
    - [51, 0.0]
  - - [1536, 6144, 1, 384]
    - [52, 0.0]
  - - [2048, 17556, 1, 512]
    - [116, 0.0]
  - - [512, 14, 1, 256]
    - [117, 0.0]
  - - [512, 13, 1, 256]
    - [117, 0.0]
  - - [512, 3500, 1, 512]
    - [120, 0.0]
  - - [512, 4000, 1, 512]
    - [144, 0.0]
  - - [8192, 4000, 1, 2048]
    - [143, 0.0]
  - - [512, 8000, 1, 512]
    - [145, 0.0]
  - - [131072, 2048, 1, 16384]
    - [53, 0.0]
  - - [1280, 1280, 1, 1280]
    - [54, 0.0]
  - - [1408, 1408, 1, 1408]
    - [44, 0.0]
  - - [2688, 2688, 1, 2688]
    - [55, 0.0]
  - - [3712, 3712, 1, 3712]
    - [56, 0.0]
  - - [3840, 3840, 1, 3840]
    - [57, 0.0]
  - - [3968, 3968, 1, 3968]
    - [58, 0.0]
  - - [3328, 3328, 1, 3328]
    - [60, 0.0]
  - - [8192, 4000, 1, 8192]
    - [53, 0.0]
  - - [2048, 64896, 1, 512]
    - [115, 0.0]
  - - [384, 6144, 1, 384]
    - [44, 0.0]
  - - [2048, 16302, 1, 512]
    - [118, 0.0]
  - - [262144, 13, 1, 256]
    - [122, 0.0]
  - - [256, 14, 1, 2560]
    - [123, 0.0]
  - - [256, 13, 1, 2560]
    - [123, 0.0]
  - - [262144, 14, 1, 256]
    - [124, 0.0]
  - - [512, 16, 1, 256]
    - [117, 0.0]
  - - [32768, 16384, 1, 2304]
    - [61, 0.0]
  - - [128, 16384, 1, 13312]
    - [62, 0.0]
  - - [1536, 1536, 1, 1536]
    - [63, 0.0]
  - - [1664, 1664, 1, 1664]
    - [64, 0.0]
  - - [2816, 2816, 1, 2816]
    - [65, 0.0]
  - - [768, 1536, 1, 768]
    - [43, 0.0]
  - - [768, 1536, 1, 6144]
    - [43, 0.0]
  - - [3072, 1536, 1, 768]
    - [66, 0.0]
  - - [1536, 384, 1, 1536]
    - [67, 0.0]
  - - [8192, 3500, 1, 2048]
    - [119, 0.0]
  - - [256, 13, 1, 256]
    - [148, 0.0]
  - - [512, 3250, 1, 512]
    - [126, 0.0]
  - - [256, 14, 1, 256]
    - [127, 0.0]
  - - [8192, 8000, 1, 2048]
    - [114, 0.0]
  - - [256, 16, 1, 2560]
    - [146, 0.0]
  - - [65536, 2048, 1, 16384]
    - [53, 0.0]
  - - [8192, 2048, 1, 16384]
    - [69, 0.0]
  - - [1792, 1792, 1, 1792]
    - [70, 0.0]
  - - [1920, 1920, 1, 1920]
    - [71, 0.0]
  - - [2944, 2944, 1, 2944]
    - [72, 0.0]
  - - [2048, 17052, 1, 512]
    - [121, 0.0]
  - - [1, 1024, 1, 256]
    - [129, 0.0]
  - - [512, 1024, 1, 5744]
    - [130, 0.0]
  - - [128, 1024, 1, 10624]
    - [131, 0.0]
  - - [1, 2048, 1, 256]
    - [129, 0.0]
  - - [512, 2048, 1, 5744]
    - [150, 0.0]
  - - [128, 2048, 1, 10624]
    - [151, 0.0]
  - - [1, 4096, 1, 256]
    - [129, 0.0]
  - - [512, 4096, 1, 5744]
    - [161, 0.0]
  - - [128, 4096, 1, 10624]
    - [162, 0.0]
  - - [128, 2048, 1, 7040]
    - [155, 0.0]
  - - [2872, 4096, 1, 512]
    - [165, 0.0]
  - - [1, 4096, 1, 128]
    - [129, 0.0]
  - - [128, 4096, 1, 7040]
    - [130, 0.0]
  - - [8, 16384, 1, 13312]
    - [73, 0.0]
  - - [4096, 16384, 1, 13312]
    - [68, 0.0]
  - - [2176, 2176, 1, 2176]
    - [75, 0.0]
  - - [3072, 3072, 1, 3072]
    - [65, 0.0]
  - - [8192, 3250, 1, 2048]
    - [125, 0.0]
  - - [512, 1024, 1, 5560]
    - [130, 0.0]
  - - [1024, 1024, 1, 3840]
    - [132, 0.0]
  - - [1024, 1024, 1, 2872]
    - [133, 0.0]
  - - [512, 2048, 1, 5560]
    - [150, 0.0]
  - - [1024, 2048, 1, 3840]
    - [152, 0.0]
  - - [1024, 2048, 1, 2872]
    - [153, 0.0]
  - - [512, 4096, 1, 5560]
    - [161, 0.0]
  - - [1024, 4096, 1, 3840]
    - [163, 0.0]
  - - [1024, 4096, 1, 2872]
    - [164, 0.0]
  - - [128, 2048, 1, 4416]
    - [156, 0.0]
  - - [128, 2048, 1, 6784]
    - [157, 0.0]
  - - [2048, 4096, 1, 5560]
    - [160, 0.0]
  - - [32768, 2048, 1, 16384]
    - [76, 0.0]
  - - [2304, 2304, 1, 2304]
    - [77, 0.0]
  - - [2432, 2432, 1, 2432]
    - [78, 0.0]
  - - [3200, 3200, 1, 3200]
    - [79, 0.0]
  - - [256, 256, 1, 256]
    - [80, 0.0]
  - - [384, 384, 1, 384]
    - [81, 0.0]
  - - [640, 640, 1, 640]
    - [83, 0.0]
  - - [768, 768, 1, 768]
    - [84, 0.0]
  - - [896, 896, 1, 896]
    - [85, 0.0]
  - - [3456, 3456, 1, 3456]
    - [86, 0.0]
  - - [3584, 3584, 1, 3584]
    - [87, 0.0]
  - - [5560, 1024, 1, 2780]
    - [141, 0.0]
  - - [2872, 1024, 1, 512]
    - [134, 0.0]
  - - [1, 1024, 1, 128]
    - [129, 0.0]
  - - [128, 1024, 1, 7040]
    - [135, 0.0]
  - - [2872, 2048, 1, 512]
    - [154, 0.0]
  - - [1, 2048, 1, 128]
    - [129, 0.0]
  - - [2, 16384, 1, 2304]
    - [88, 0.0]
  - - [2780, 1024, 1, 5560]
    - [142, 0.0]
  - - [512, 1024, 1, 2872]
    - [138, 0.0]
  - - [256, 1024, 1, 4608]
    - [139, 0.0]
  - - [512, 1024, 1, 3072]
    - [140, 0.0]
  - - [512, 2048, 1, 2872]
    - [133, 0.0]
  - - [256, 2048, 1, 4608]
    - [158, 0.0]
  - - [512, 2048, 1, 3072]
    - [159, 0.0]
  - - [512, 4096, 1, 2872]
    - [168, 0.0]
  - - [256, 4096, 1, 4608]
    - [169, 0.0]
  - - [512, 4096, 1, 3072]
    - [170, 0.0]
  - - [262144, 16, 1, 256]
    - [122, 0.0]
  - - [512, 32, 1, 256]
    - [117, 0.0]
  - - [256, 32, 1, 2560]
    - [123, 0.0]
  - - [262144, 32, 1, 256]
    - [147, 0.0]
  - - [128, 4096, 1, 4416]
    - [166, 0.0]
  - - [128, 4096, 1, 6784]
    - [167, 0.0]
  - - [2048, 152710, 1, 512]
    - [114, 0.0]
  - - [384, 6, 1, 1536]
    - [91, 0.0]
  - - [3072, 6, 1, 768]
    - [91, 0.0]
  - - [768, 462, 1, 384]
    - [92, 0.0]
  - - [4096, 462, 1, 384]
    - [93, 0.0]
  - - [1472, 462, 1, 384]
    - [92, 0.0]
  - - [3072, 6, 1, 1536]
    - [94, 0.0]
  - - [768, 462, 1, 768]
    - [95, 0.0]
  - - [4096, 462, 1, 768]
    - [96, 0.0]
  - - [1472, 462, 1, 768]
    - [97, 0.0]
  - - [3072, 6, 1, 3072]
    - [98, 0.0]
  - - [768, 462, 1, 1536]
    - [95, 0.0]
  - - [4096, 462, 1, 1536]
    - [99, 0.0]
  - - [1472, 462, 1, 1536]
    - [100, 0.0]
  - - [2048, 1024, 1, 5560]
    - [128, 0.0]
  - - [128, 1024, 1, 4416]
    - [136, 0.0]
  - - [128, 1024, 1, 6784]
    - [137, 0.0]
  - - [2048, 2048, 1, 5560]
    - [149, 0.0]
  - - [96, 1536, 1, 1536]
    - [48, 0.0]
  - - [96, 6144, 1, 1536]
    - [101, 0.0]
  - - [384, 6144, 1, 1536]
    - [42, 0.0]
  - - [384, 1536, 1, 1536]
    - [89, 0.0]
  - - [1536, 768, 1, 768]
    - [90, 0.0]
  - - [1536, 768, 1, 6144]
    - [90, 0.0]
  - - [1536, 3072, 1, 768]
    - [66, 0.0]
  - - [96, 1536, 1, 12288]
    - [102, 0.0]
  - - [384, 1536, 1, 12288]
    - [103, 0.0]
  - - [462, 768, 1, 1536]
    - [104, 0.0]
  - - [462, 4096, 1, 1536]
    - [105, 0.0]
  - - [462, 1472, 1, 1536]
    - [106, 0.0]
  - - [462, 768, 1, 768]
    - [107, 0.0]
  - - [462, 4096, 1, 768]
    - [108, 0.0]
  - - [462, 1472, 1, 768]
    - [109, 0.0]
  - - [6, 3072, 1, 3072]
    - [110, 0.0]
  - - [462, 4096, 1, 384]
    - [111, 0.0]
  - - [462, 1472, 1, 384]
    - [109, 0.0]
  - - [6, 3072, 1, 1536]
    - [112, 0.0]
  - - [6, 384, 1, 1536]
    - [112, 0.0]
  - - [6, 3072, 1, 768]
    - [112, 0.0]
  - - [462, 768, 1, 384]
    - [113, 0.0]
  - - [256, 16, 1, 256]
    - [127, 0.0]
  - - [256, 32, 1, 256]
    - [117, 0.0]
- null
- null
- DeviceEfficiency
- Equality
