library/src/amd_detail/rocblaslt/src/Tensile/Logic/asm_full/aquavanjaram/gfx942/Equality/aquavanjaram_Cijk_Alik_Bljk_HH_F8HS_BH_UserArgs.yaml
- {MinimumRequiredVersion: 4.33.0}
- aquavanjaram
- gfx942
- [Device 0049, Device 0050]
    SolutionIndex: 0
    SolutionNameMin: Cijk_Alik_Bljk_HH_F8HS_BH_UserArgs_MT256x192x128_MI16x16x1_SN_GRVWA8_GRVWB8_GSU1_GSUC0_GSUWGMRR0_K1_LBSPPA1024_LBSPPB256_LPA32_LPB32_LRVW16_MIWT8_6_SU8_SUM0_SUS256_SVW8_VWA8_VWB2_WG32_8_1_WGM48_WGMXCC1_WGMXCCGn1
    SolutionIndex: 1
    SolutionNameMin: Cijk_Alik_Bljk_HH_F8HS_BH_UserArgs_MT256x176x128_MI16x16x1_SN_GRVWA8_GRVWB8_GSU4_GSUC0_GSUWGMRR0_K1_LBSPPA512_LBSPPB128_LPA32_LPB32_LRVW16_MIAV0_MIWT4_11_NTC0_NTD0_SU0_SUM0_SUS0_SVW4_VWA4_VWB1_WG64_4_1_WGM1_WGMXCC1_WGMXCCGn1
    SolutionIndex: 2
    SolutionNameMin: Cijk_Alik_Bljk_HH_F8HS_BH_UserArgs_MT192x192x64_MI16x16x1_SN_GRVWA8_GRVWB8_GSU1_GSUC0_GSUWGMRR0_K1_LBSPPA128_LBSPPB128_LPA8_LPB8_LRVW8_MIWT6_6_SU8_SUM0_SUS256_SVW2_VWA2_VWB2_WG32_8_1_WGM48_WGMXCC1_WGMXCCGn1
    SolutionIndex: 3
    SolutionNameMin: Cijk_Alik_Bljk_HH_F8HS_BH_UserArgs_MT128x64x128_MI32x32x1_SN_GRVWA8_GRVWB2_GSU1_GSUC0_GSUWGMRR0_K1_LBSPPA256_LBSPPB128_LPA16_LPB16_LRVW16_MIAV1_MIWT2_1_SU8_SUM0_SUS256_SVW2_VWA2_VWB1_WG64_4_1_WGM1_WGMXCC1_WGMXCCGn1
    SolutionIndex: 4
    SolutionNameMin: Cijk_Alik_Bljk_HH_F8HS_BH_UserArgs_MT128x256x64_MI16x16x1_SN_GRVWA8_GRVWB8_GSU1_GSUC0_GSUWGMRR0_K1_LBSPPA512_LBSPPB256_LPA8_LPB8_LRVW8_MIAV0_MIWT8_4_SU8_SUM0_SUS256_SVW8_VWA8_VWB4_WG16_16_1_WGM16_WGMXCC1_WGMXCCGn1
    SolutionIndex: 5
    SolutionNameMin: Cijk_Alik_Bljk_HH_F8HS_BH_UserArgs_MT64x64x128_MI16x16x1_SN_CLR1_GRVWA8_GRVWB8_GSU1_GSUC0_GSUWGMRR0_K1_LBSPPA512_LBSPPB256_LPA32_LPB32_LRVW16_MIWT4_2_NTC3_NTD3_PLR1_SU0_SUM0_SUS0_SVW4_VWA4_VWB2_WG16_8_2_WGM1_WGMXCC1_WGMXCCGn1
    SolutionIndex: 6
    SolutionNameMin: Cijk_Alik_Bljk_HH_F8HS_BH_UserArgs_MT256x256x64_MI32x32x1_SN_GRVWA8_GRVWB8_GSU1_GSUC0_GSUWGMRR0_K1_LBSPPA512_LBSPPB128_LPA16_LPB16_LRVW16_MIAV0_MIWT8_2_SU8_SUM0_SUS256_SVW8_VWA8_VWB2_WG32_8_1_WGMn32_WGMXCC1_WGMXCCGn1
    SolutionIndex: 7
    SolutionNameMin: Cijk_Alik_Bljk_HH_F8HS_BH_UserArgs_MT128x224x64_MI16x16x1_SN_GRVWA8_GRVWB8_GSU1_GSUC0_GSUWGMRR0_K1_LBSPPA256_LBSPPB128_LPA8_LPB8_LRVW8_MIAV0_MIWT4_7_SU8_SUM0_SUS256_SVW4_VWA4_VWB1_WG32_8_1_WGM1_WGMXCC1_WGMXCCGn1
    SolutionIndex: 8
    SolutionNameMin: Cijk_Alik_Bljk_HH_F8HS_BH_UserArgs_MT192x256x128_MI16x16x1_SN_GRVWA8_GRVWB8_GSU1_GSUC0_GSUWGMRR0_K1_LBSPPA512_LBSPPB512_LPA32_LPB32_LRVW16_MIAV0_MIWT12_4_SU8_SUM0_SUS256_SVW4_VWA4_VWB4_WG16_16_1_WGM16_WGMXCC1_WGMXCCGn1
    SolutionIndex: 9
    SolutionNameMin: Cijk_Alik_Bljk_HH_F8HS_BH_UserArgs_MT288x128x64_MI32x32x1_SN_GRVWA8_GRVWB8_GSU3_GSUC0_GSUWGMRR0_K1_LBSPPA128_LBSPPB128_LPA16_LPB16_LRVW16_MIAV0_MIWT9_1_NTC3_NTD3_SU0_SUM0_SUS0_SVW1_VWA1_VWB1_WG32_8_1_WGM1_WGMXCC1_WGMXCCGn1
    SolutionIndex: 10
    SolutionNameMin: Cijk_Alik_Bljk_HH_F8HS_BH_UserArgs_MT96x160x64_MI16x16x1_SN_GRVWA8_GRVWB8_GSU1_GSUC0_GSUWGMRR0_K1_LBSPPA128_LBSPPB128_LPA8_LPB8_LRVW8_MIAV1_MIWT3_5_SU8_SUM0_SUS256_SVW1_VWA1_VWB1_WG32_8_1_WGM1_WGMXCC1_WGMXCCGn1
    SolutionIndex: 11
    SolutionNameMin: Cijk_Alik_Bljk_HH_F8HS_BH_UserArgs_MT256x128x128_MI32x32x1_SN_GRVWA8_GRVWB8_GSU9_GSUC0_GSUWGMRR0_K1_LBSPPA512_LBSPPB256_LPA16_LPB16_LRVW16_MIAV0_MIWT4_2_NTC0_NTD0_SU0_SUM0_SUS0_SVW4_VWA4_VWB2_WG64_4_1_WGM1_WGMXCC1_WGMXCCGn1
    SolutionIndex: 12
    SolutionNameMin: Cijk_Alik_Bljk_HH_F8HS_BH_UserArgs_MT128x128x64_MI16x16x1_SN_GRVWA8_GRVWB8_GSU1_GSUC0_GSUWGMRR0_K1_LBSPPA512_LBSPPB128_LPA8_LPB8_LRVW8_MIAV1_MIWT8_2_SU8_SUM0_SUS256_SVW8_VWA8_VWB2_WG16_16_1_WGMn32_WGMXCC1_WGMXCCGn1
    SolutionIndex: 13
    SolutionNameMin: Cijk_Alik_Bljk_HH_F8HS_BH_UserArgs_MT256x224x128_MI16x16x1_SN_GRVWA8_GRVWB8_GSU1_GSUC0_GSUWGMRR0_K1_LBSPPA1024_LBSPPB128_LPA8_LPB8_LRVW8_MIWT8_7_SU8_SUM0_SUS256_SVW8_VWA8_VWB1_WG32_8_1_WGM32_WGMXCC1_WGMXCCGn1
    SolutionIndex: 14
    SolutionNameMin: Cijk_Alik_Bljk_HH_F8HS_BH_UserArgs_MT256x176x128_MI16x16x1_SN_GRVWA8_GRVWB8_GSU1_GSUC0_GSUWGMRR0_K1_LBSPPA512_LBSPPB128_LPA32_LPB32_LRVW16_MIAV0_MIWT4_11_SU8_SUM0_SUS256_SVW4_VWA4_VWB1_WG64_4_1_WGM1_WGMXCC1_WGMXCCGn1
    SolutionIndex: 15
    SolutionNameMin: Cijk_Alik_Bljk_HH_F8HS_BH_UserArgs_MT128x112x128_MI16x16x1_SN_GRVWA8_GRVWB8_GSU1_GSUC0_GSUWGMRR0_K1_LBSPPA256_LBSPPB128_LPA32_LPB32_LRVW16_MIAV1_MIWT2_7_SU8_SUM0_SUS256_SVW2_VWA2_VWB1_WG64_4_1_WGM1_WGMXCC1_WGMXCCGn1
    SolutionIndex: 16
    SolutionNameMin: Cijk_Alik_Bljk_HH_F8HS_BH_UserArgs_MT256x192x128_MI16x16x1_SN_GRVWA8_GRVWB8_GSU1_GSUC0_GSUWGMRR0_K1_LBSPPA1024_LBSPPB256_LPA32_LPB32_LRVW16_MIAV0_MIWT8_6_SU8_SUM0_SUS256_SVW8_VWA8_VWB2_WG32_8_1_WGM48_WGMXCC1_WGMXCCGn1
    SolutionIndex: 17
    SolutionNameMin: Cijk_Alik_Bljk_HH_F8HS_BH_UserArgs_MT128x224x128_MI16x16x1_SN_GRVWA8_GRVWB8_GSU1_GSUC0_GSUWGMRR0_K1_LBSPPA512_LBSPPB128_LPA32_LPB32_LRVW16_MIAV0_MIWT4_7_SU8_SUM0_SUS256_SVW4_VWA4_VWB1_WG32_8_1_WGM32_WGMXCC1_WGMXCCGn1
    SolutionIndex: 18
    SolutionNameMin: Cijk_Alik_Bljk_HH_F8HS_BH_UserArgs_MT256x224x64_MI16x16x1_SN_GRVWA8_GRVWB8_GSU1_GSUC0_GSUWGMRR0_K1_LBSPPA512_LBSPPB128_LPA8_LPB8_LRVW8_MIAV0_MIWT8_7_SU8_SUM0_SUS256_SVW8_VWA8_VWB1_WG32_8_1_WGM32_WGMXCC1_WGMXCCGn1
    SolutionIndex: 19
    SolutionNameMin: Cijk_Alik_Bljk_HH_F8HS_BH_UserArgs_MT128x48x128_MI16x16x1_SN_GRVWA8_GRVWB2_GSU1_GSUC0_GSUWGMRR0_K1_LBSPPA256_LBSPPB128_LPA32_LPB32_LRVW16_MIAV1_MIWT2_3_NTC0_NTD0_SU0_SUM0_SUS0_SVW2_VWA2_VWB1_WG64_4_1_WGM1_WGMXCC1_WGMXCCGn1
    SolutionIndex: 20
    SolutionNameMin: Cijk_Alik_Bljk_HH_F8HS_BH_UserArgs_MT256x224x64_MI32x32x1_SN_GRVWA8_GRVWB8_GSU1_GSUC0_GSUWGMRR0_K1_LBSPPA128_LBSPPB128_LPA16_LPB16_LRVW16_MIWT2_7_SU8_SUM0_SUS256_SVW2_VWA2_VWB1_WG128_2_1_WGM16_WGMXCC1_WGMXCCGn1
    SolutionIndex: 21
    SolutionNameMin: Cijk_Alik_Bljk_HH_F8HS_BH_UserArgs_MT256x128x64_MI32x32x1_SN_GRVWA8_GRVWB8_GSU1_GSUC0_GSUWGMRR0_K1_LBSPPA128_LBSPPB256_LPA16_LPB16_LRVW16_MIAV0_MIWT2_4_SU8_SUM0_SUS256_SVW2_VWA2_VWB4_WG128_2_1_WGM1_WGMXCC1_WGMXCCGn1
    SolutionIndex: 22
    SolutionNameMin: Cijk_Alik_Bljk_HH_F8HS_BH_UserArgs_MT128x64x128_MI16x16x1_SN_GRVWA8_GRVWB2_GSU1_GSUC0_GSUWGMRR0_K1_LBSPPA512_LBSPPB256_LPA32_LPB32_LRVW16_MIAV1_MIWT4_2_SU8_SUM0_SUS256_SVW4_VWA4_VWB2_WG32_8_1_WGM16_WGMXCC1_WGMXCCGn1
    SolutionIndex: 23
    SolutionNameMin: Cijk_Alik_Bljk_HH_F8HS_BH_UserArgs_MT128x352x64_MI16x16x1_SN_GRVWA8_GRVWB8_GSU1_GSUC0_GSUWGMRR0_K1_LBSPPA256_LBSPPB128_LPA8_LPB8_LRVW8_MIAV0_MIWT4_11_SU8_SUM0_SUS256_SVW4_VWA4_VWB1_WG32_8_1_WGM16_WGMXCC1_WGMXCCGn1
    SolutionIndex: 24
    SolutionNameMin: Cijk_Alik_Bljk_HH_F8HS_BH_UserArgs_MT128x224x128_MI16x16x1_SN_GRVWA8_GRVWB8_GSU1_GSUC0_GSUWGMRR0_K1_LBSPPA512_LBSPPB128_LPA32_LPB32_LRVW16_MIAV0_MIWT4_7_SU8_SUM0_SUS256_SVW4_VWA4_VWB1_WG32_8_1_WGM16_WGMXCC1_WGMXCCGn1
    SolutionIndex: 25
    SolutionNameMin: Cijk_Alik_Bljk_HH_F8HS_BH_UserArgs_MT128x128x64_MI32x32x1_SN_GRVWA2_GRVWB8_GSU1_GSUC0_GSUWGMRR0_K1_LBSPPA256_LBSPPB128_LPA16_LPB16_LRVW16_MIAV1_MIWT4_1_SU8_SUM0_SUS256_SVW4_VWA4_VWB1_WG32_8_1_WGM1_WGMXCC1_WGMXCCGn1
    SolutionIndex: 26
    SolutionNameMin: Cijk_Alik_Bljk_HH_F8HS_BH_UserArgs_MT128x96x128_MI16x16x1_SN_GRVWA8_GRVWB8_GSU1_GSUC0_GSUWGMRR0_K1_LBSPPA512_LBSPPB128_LPA32_LPB32_LRVW16_MIAV1_MIWT4_3_NTC3_NTD3_SU0_SUM0_SUS0_SVW4_VWA4_VWB1_WG32_8_1_WGM1_WGMXCC1_WGMXCCGn1
    SolutionIndex: 27
    SolutionNameMin: Cijk_Alik_Bljk_HH_F8HS_BH_UserArgs_MT256x256x64_MI16x16x1_SN_GRVWA8_GRVWB8_GSU1_GSUC0_GSUWGMRR0_K1_LBSPPA256_LBSPPB1024_LPA8_LPB8_LRVW8_MIAV0_MIWT4_16_SU8_SUM0_SUS256_SVW4_VWA4_VWB16_WG64_4_1_WGMn16_WGMXCC1_WGMXCCGn1
    SolutionIndex: 28
    SolutionNameMin: Cijk_Alik_Bljk_HH_F8HS_BH_UserArgs_MT256x192x128_MI16x16x1_SN_GRVWA8_GRVWB8_GSU1_GSUC0_GSUWGMRR0_K1_LBSPPA1024_LBSPPB256_LPA32_LPB32_LRVW16_MIAV0_MIWT8_6_SU8_SUM0_SUS256_SVW8_VWA8_VWB2_WG32_8_1_WGMn16_WGMXCC1_WGMXCCGn1
    SolutionIndex: 29
    SolutionNameMin: Cijk_Alik_Bljk_HH_F8HS_BH_UserArgs_MT256x192x128_MI32x32x1_SN_GRVWA8_GRVWB8_GSU1_GSUC0_GSUWGMRR0_K1_LBSPPA512_LBSPPB128_LPA16_LPB16_LRVW16_MIWT4_3_SU8_SUM0_SUS256_SVW4_VWA4_VWB1_WG64_4_1_WGM48_WGMXCC1_WGMXCCGn1
    SolutionIndex: 30
    SolutionNameMin: Cijk_Alik_Bljk_HH_F8HS_BH_UserArgs_MT224x64x64_MI16x16x1_SN_GRVWA8_GRVWB8_GSU1_GSUC0_GSUWGMRR0_K1_LBSPPA128_LBSPPB128_LPA8_LPB8_LRVW8_MIAV1_MIWT7_2_SU8_SUM0_SUS256_SVW1_VWA1_VWB2_WG32_8_1_WGM1_WGMXCC1_WGMXCCGn1
    SolutionIndex: 31
    SolutionNameMin: Cijk_Alik_Bljk_HH_F8HS_BH_UserArgs_MT256x192x64_MI32x32x1_SN_GRVWA8_GRVWB8_GSU1_GSUC0_GSUWGMRR0_K1_LBSPPA128_LBSPPB128_LPA16_LPB16_LRVW16_MIWT2_6_SU8_SUM0_SUS256_SVW2_VWA2_VWB2_WG128_2_1_WGM48_WGMXCC1_WGMXCCGn1
    SolutionIndex: 32
    SolutionNameMin: Cijk_Alik_Bljk_HH_F8HS_BH_UserArgs_MT256x176x128_MI16x16x1_SN_GRVWA8_GRVWB8_GSU1_GSUC0_GSUWGMRR0_K1_LBSPPA512_LBSPPB128_LPA32_LPB32_LRVW16_MIAV0_MIWT4_11_SU8_SUM0_SUS256_SVW4_VWA4_VWB1_WG64_4_1_WGM48_WGMXCC1_WGMXCCGn1
    SolutionIndex: 33
    SolutionNameMin: Cijk_Alik_Bljk_HH_F8HS_BH_UserArgs_MT256x176x128_MI16x16x1_SN_GRVWA8_GRVWB8_GSU1_GSUC0_GSUWGMRR0_K1_LBSPPA512_LBSPPB128_LPA32_LPB32_LRVW16_MIAV0_MIWT4_11_SU8_SUM0_SUS256_SVW4_VWA4_VWB1_WG64_4_1_WGMn16_WGMXCC1_WGMXCCGn1
    SolutionIndex: 34
    SolutionNameMin: Cijk_Alik_Bljk_HH_F8HS_BH_UserArgs_MT128x192x64_MI32x32x1_SN_GRVWA2_GRVWB2_GSU1_GSUC0_GSUWGMRR0_K1_LBSPPA128_LBSPPB128_LPA16_LPB16_LRVW16_MIAV0_MIWT2_3_SU8_SUM0_SUS256_SVW2_VWA2_VWB1_WG64_4_1_WGM1_WGMXCC1_WGMXCCGn1
    SolutionIndex: 35
    SolutionNameMin: Cijk_Alik_Bljk_HH_F8HS_BH_UserArgs_MT256x256x64_MI16x16x1_SN_GRVWA8_GRVWB8_GSU1_GSUC0_GSUWGMRR0_K1_LBSPPA512_LBSPPB512_LPA8_LPB8_LRVW8_MIAV0_MIWT8_8_SU8_SUM0_SUS256_SVW8_VWA8_VWB8_WG32_8_1_WGM32_WGMXCC1_WGMXCCGn1
    SolutionIndex: 36
    SolutionNameMin: Cijk_Alik_Bljk_HH_F8HS_BH_UserArgs_MT128x96x128_MI16x16x1_SN_GRVWA8_GRVWB8_GSU1_GSUC0_GSUWGMRR0_K1_LBSPPA512_LBSPPB128_LPA32_LPB32_LRVW16_MIAV1_MIWT4_3_NTC0_NTD0_SU0_SUM0_SUS0_SVW4_VWA4_VWB1_WG32_8_1_WGM1_WGMXCC1_WGMXCCGn1
    SolutionIndex: 37
    SolutionNameMin: Cijk_Alik_Bljk_HH_F8HS_BH_UserArgs_MT128x192x64_MI16x16x1_SN_GRVWA8_GRVWB8_GSU1_GSUC0_GSUWGMRR0_K1_LBSPPA512_LBSPPB128_LPA8_LPB8_LRVW8_MIAV0_MIWT8_3_SU8_SUM0_SUS256_SVW8_VWA8_VWB1_WG16_16_1_WGM48_WGMXCC1_WGMXCCGn1
    SolutionIndex: 38
    SolutionNameMin: Cijk_Alik_Bljk_HH_F8HS_BH_UserArgs_MT256x176x128_MI16x16x1_SN_GRVWA8_GRVWB8_GSU3_GSUC0_GSUWGMRR0_K1_LBSPPA512_LBSPPB128_LPA32_LPB32_LRVW16_MIAV0_MIWT4_11_SU8_SUM0_SUS256_SVW4_VWA4_VWB1_WG64_4_1_WGM16_WGMXCC1_WGMXCCGn1
    SolutionIndex: 39
    SolutionNameMin: Cijk_Alik_Bljk_HH_F8HS_BH_UserArgs_MT128x256x128_MI32x32x1_SN_GRVWA8_GRVWB8_GSU3_GSUC0_GSUWGMRR0_K1_LBSPPA512_LBSPPB256_LPA16_LPB16_LRVW16_MIAV0_MIWT4_2_NTC0_NTD0_SU0_SUM0_SUS0_SVW4_VWA4_VWB2_WG32_8_1_WGM1_WGMXCC1_WGMXCCGn1
    SolutionIndex: 40
    SolutionNameMin: Cijk_Alik_Bljk_HH_F8HS_BH_UserArgs_MT256x192x128_MI16x16x1_SN_GRVWA8_GRVWB8_GSU1_GSUC0_GSUWGMRR0_K1_LBSPPA512_LBSPPB512_LPA32_LPB32_LRVW16_MIAV0_MIWT4_12_SU8_SUM0_SUS256_SVW4_VWA4_VWB4_WG64_4_1_WGM48_WGMXCC1_WGMXCCGn1
    SolutionIndex: 41
    SolutionNameMin: Cijk_Alik_Bljk_HH_F8HS_BH_UserArgs_MT256x256x64_MI16x16x1_SN_GRVWA8_GRVWB8_GSU1_GSUC0_GSUWGMRR0_K1_LBSPPA512_LBSPPB512_LPA8_LPB8_LRVW8_MIAV0_MIWT8_8_SU8_SUM0_SUS256_SVW8_VWA8_VWB8_WG32_8_1_WGMn32_WGMXCC1_WGMXCCGn1
    SolutionIndex: 42
    SolutionNameMin: Cijk_Alik_Bljk_HH_F8HS_BH_UserArgs_MT128x128x64_MI16x16x1_SN_GRVWA8_GRVWB8_GSU1_GSUC0_GSUWGMRR0_K1_LBSPPA512_LBSPPB128_LPA8_LPB8_LRVW8_MIAV1_MIWT8_2_SU8_SUM0_SUS256_SVW8_VWA8_VWB2_WG16_16_1_WGM16_WGMXCC1_WGMXCCGn1
    SolutionIndex: 43
    SolutionNameMin: Cijk_Alik_Bljk_HH_F8HS_BH_UserArgs_MT256x224x128_MI16x16x1_SN_GRVWA8_GRVWB8_GSU1_GSUC0_GSUWGMRR0_K1_LBSPPA1024_LBSPPB128_LPA8_LPB8_LRVW8_MIAV0_MIWT8_7_SU8_SUM0_SUS256_SVW8_VWA8_VWB1_WG32_8_1_WGM16_WGMXCC1_WGMXCCGn1
    SolutionIndex: 44
    SolutionNameMin: Cijk_Alik_Bljk_HH_F8HS_BH_UserArgs_MT224x128x64_MI16x16x1_SN_GRVWA8_GRVWB8_GSU1_GSUC0_GSUWGMRR0_K1_LBSPPA128_LBSPPB128_LPA8_LPB8_LRVW8_MIAV0_MIWT14_2_SU8_SUM0_SUS256_SVW2_VWA2_VWB2_WG16_16_1_WGMn16_WGMXCC1_WGMXCCGn1
    SolutionIndex: 45
    SolutionNameMin: Cijk_Alik_Bljk_HH_F8HS_BH_UserArgs_MT256x176x128_MI16x16x1_SN_GRVWA8_GRVWB8_GSU1_GSUC0_GSUWGMRR0_K1_LBSPPA512_LBSPPB128_LPA32_LPB32_LRVW16_MIAV0_MIWT4_11_SU8_SUM0_SUS256_SVW4_VWA4_VWB1_WG64_4_1_WGM16_WGMXCC1_WGMXCCGn1
    SolutionIndex: 46
    SolutionNameMin: Cijk_Alik_Bljk_HH_F8HS_BH_UserArgs_MT256x256x64_MI32x32x1_SN_GRVWA8_GRVWB8_GSU1_GSUC0_GSUWGMRR0_K1_LBSPPA256_LBSPPB256_LPA16_LPB16_LRVW16_MIWT4_4_SU8_SUM0_SUS256_SVW4_VWA4_VWB4_WG64_4_1_WGM48_WGMXCC1_WGMXCCGn1
    SolutionIndex: 47
    SolutionNameMin: Cijk_Alik_Bljk_HH_F8HS_BH_UserArgs_MT224x256x64_MI16x16x1_SN_GRVWA8_GRVWB8_GSU2_GSUC0_GSUWGMRR0_K1_LBSPPA128_LBSPPB512_LPA8_LPB8_LRVW8_MIAV0_MIWT7_8_SU8_SUM0_SUS256_SVW1_VWA1_VWB8_WG32_8_1_WGMn32_WGMXCC1_WGMXCCGn1
    SolutionIndex: 48
    SolutionNameMin: Cijk_Alik_Bljk_HH_F8HS_BH_UserArgs_MT192x64x64_MI16x16x1_SN_GRVWA8_GRVWB8_GSU1_GSUC0_GSUWGMRR0_K1_LBSPPA128_LBSPPB256_LPA8_LPB8_LRVW8_MIAV1_MIWT3_4_NTC0_NTD0_SU0_SUM0_SUS0_SVW1_VWA1_VWB4_WG64_4_1_WGM1_WGMXCC1_WGMXCCGn1
    SolutionIndex: 49
    SolutionNameMin: Cijk_Alik_Bljk_HH_F8HS_BH_UserArgs_MT256x224x64_MI16x16x1_SN_GRVWA8_GRVWB8_GSU1_GSUC0_GSUWGMRR0_K1_LBSPPA256_LBSPPB128_LPA8_LPB8_LRVW8_MIAV0_MIWT4_14_SU8_SUM0_SUS256_SVW4_VWA4_VWB2_WG64_4_1_WGM1_WGMXCC1_WGMXCCGn1
    SolutionIndex: 50
    SolutionNameMin: Cijk_Alik_Bljk_HH_F8HS_BH_UserArgs_MT128x256x128_MI16x16x1_SN_GRVWA8_GRVWB8_GSU1_GSUC0_GSUWGMRR0_K1_LBSPPA512_LBSPPB1024_LPA32_LPB32_LRVW16_MIAV0_MIWT4_8_SU8_SUM0_SUS256_SVW4_VWA4_VWB8_WG32_8_1_WGM1_WGMXCC1_WGMXCCGn1
    SolutionIndex: 51
    SolutionNameMin: Cijk_Alik_Bljk_HH_F8HS_BH_UserArgs_MT192x224x128_MI16x16x1_SN_GRVWA8_GRVWB8_GSU1_GSUC0_GSUWGMRR0_K1_LBSPPA256_LBSPPB128_LPA32_LPB32_LRVW16_MIAV0_MIWT6_7_SU8_SUM0_SUS256_SVW2_VWA2_VWB1_WG32_8_1_WGM1_WGMXCC1_WGMXCCGn1
    SolutionIndex: 52
    SolutionNameMin: Cijk_Alik_Bljk_HH_F8HS_BH_UserArgs_MT128x256x128_MI32x32x1_SN_GRVWA8_GRVWB8_GSU1_GSUC0_GSUWGMRR0_K1_LBSPPA512_LBSPPB256_LPA16_LPB16_LRVW16_MIAV0_MIWT4_2_SU8_SUM0_SUS256_SVW4_VWA4_VWB2_WG32_8_1_WGM1_WGMXCC1_WGMXCCGn1
    SolutionIndex: 53
    SolutionNameMin: Cijk_Alik_Bljk_HH_F8HS_BH_UserArgs_MT256x224x64_MI16x16x1_SN_GRVWA8_GRVWB8_GSU1_GSUC0_GSUWGMRR0_K1_LBSPPA512_LBSPPB128_LPA8_LPB8_LRVW8_MIAV0_MIWT8_7_SU8_SUM0_SUS256_SVW8_VWA8_VWB1_WG32_8_1_WGM16_WGMXCC1_WGMXCCGn1
    SolutionIndex: 54
    SolutionNameMin: Cijk_Alik_Bljk_HH_F8HS_BH_UserArgs_MT128x96x128_MI16x16x1_SN_CLR1_GRVWA8_GRVWB8_GSU3_GSUC0_GSUWGMRR0_K1_LBSPPA512_LBSPPB128_LPA32_LPB32_LRVW16_MIAV1_MIWT4_3_NTC0_NTD0_PLR1_SU0_SUM0_SUS0_SVW4_VWA4_VWB1_WG32_8_1_WGM1_WGMXCC1_WGMXCCGn1
    SolutionIndex: 55
    SolutionNameMin: Cijk_Alik_Bljk_HH_F8HS_BH_UserArgs_MT256x192x128_MI16x16x1_SN_GRVWA8_GRVWB8_GSU1_GSUC0_GSUWGMRR0_K1_LBSPPA1024_LBSPPB256_LPA32_LPB32_LRVW16_MIAV0_MIWT8_6_SU8_SUM0_SUS256_SVW8_VWA8_VWB2_WG32_8_1_WGM32_WGMXCC1_WGMXCCGn1
    SolutionIndex: 56
    SolutionNameMin: Cijk_Alik_Bljk_HH_F8HS_BH_UserArgs_MT256x256x64_MI16x16x1_SN_GRVWA8_GRVWB8_GSU6_GSUC0_GSUWGMRR0_K1_LBSPPA256_LBSPPB1024_LPA8_LPB8_LRVW8_MIAV0_MIWT4_16_NTC0_NTD0_SU0_SUM0_SUS0_SVW4_VWA4_VWB16_WG64_4_1_WGM1_WGMXCC1_WGMXCCGn1
    SolutionIndex: 57
    SolutionNameMin: Cijk_Alik_Bljk_HH_F8HS_BH_UserArgs_MT128x352x128_MI16x16x1_SN_GRVWA8_GRVWB8_GSU1_GSUC0_GSUWGMRR0_K1_LBSPPA512_LBSPPB128_LPA8_LPB8_LRVW8_MIAV0_MIWT4_11_SU8_SUM0_SUS256_SVW4_VWA4_VWB1_WG32_8_1_WGM16_WGMXCC1_WGMXCCGn1
    SolutionIndex: 58
    SolutionNameMin: Cijk_Alik_Bljk_HH_F8HS_BH_UserArgs_MT256x192x128_MI32x32x1_SN_GRVWA8_GRVWB8_GSU1_GSUC0_GSUWGMRR0_K1_LBSPPA256_LBSPPB256_LPA16_LPB16_LRVW16_MIAV0_MIWT2_6_SU8_SUM0_SUS256_SVW2_VWA2_VWB2_WG128_2_1_WGMn16_WGMXCC1_WGMXCCGn1
    SolutionIndex: 59
    SolutionNameMin: Cijk_Alik_Bljk_HH_F8HS_BH_UserArgs_MT256x256x64_MI16x16x1_SN_GRVWA2_GRVWB8_GSU1_GSUC0_GSUWGMRR0_K1_LBSPPA256_LBSPPB1024_LPA8_LPB8_LRVW8_MIWT4_16_SU8_SUM0_SUS256_SVW4_VWA4_VWB16_WG64_4_1_WGM48_WGMXCC1_WGMXCCGn1
    SolutionIndex: 60
    SolutionNameMin: Cijk_Alik_Bljk_HH_F8HS_BH_UserArgs_MT192x128x64_MI32x32x1_SN_GRVWA2_GRVWB8_GSU1_GSUC0_GSUWGMRR0_K1_LBSPPA128_LBSPPB128_LPA16_LPB16_LRVW16_MIAV0_MIWT6_1_SU8_SUM0_SUS256_SVW2_VWA2_VWB1_WG32_8_1_WGM16_WGMXCC1_WGMXCCGn1
    SolutionIndex: 61
    SolutionNameMin: Cijk_Alik_Bljk_HH_F8HS_BH_UserArgs_MT256x224x128_MI16x16x1_SN_GRVWA8_GRVWB8_GSU1_GSUC0_GSUWGMRR0_K1_LBSPPA1024_LBSPPB128_LPA8_LPB8_LRVW8_MIWT8_7_SU8_SUM0_SUS256_SVW8_VWA8_VWB1_WG32_8_1_WGM48_WGMXCC1_WGMXCCGn1
    SolutionIndex: 62
    SolutionNameMin: Cijk_Alik_Bljk_HH_F8HS_BH_UserArgs_MT256x192x64_MI16x16x1_SN_GRVWA8_GRVWB8_GSU1_GSUC0_GSUWGMRR0_K1_LBSPPA256_LBSPPB256_LPA8_LPB8_LRVW8_MIAV0_MIWT4_12_SU8_SUM0_SUS256_SVW4_VWA4_VWB4_WG64_4_1_WGMn16_WGMXCC1_WGMXCCGn1
    SolutionIndex: 63
    SolutionNameMin: Cijk_Alik_Bljk_HH_F8HS_BH_UserArgs_MT64x224x128_MI16x16x1_SN_GRVWA8_GRVWB8_GSU1_GSUC0_GSUWGMRR0_K1_LBSPPA256_LBSPPB128_LPA32_LPB32_LRVW16_MIAV1_MIWT2_7_SU8_SUM0_SUS256_SVW2_VWA2_VWB1_WG32_8_1_WGM16_WGMXCC1_WGMXCCGn1
    SolutionIndex: 64
    SolutionNameMin: Cijk_Alik_Bljk_HH_F8HS_BH_UserArgs_MT128x224x64_MI16x16x1_SN_GRVWA8_GRVWB8_GSU1_GSUC0_GSUWGMRR0_K1_LBSPPA256_LBSPPB128_LPA8_LPB8_LRVW8_MIAV0_MIWT4_7_SU8_SUM0_SUS256_SVW4_VWA4_VWB1_WG32_8_1_WGMn16_WGMXCC1_WGMXCCGn1
    SolutionIndex: 65
    SolutionNameMin: Cijk_Alik_Bljk_HH_F8HS_BH_UserArgs_MT256x256x64_MI16x16x1_SN_GRVWA8_GRVWB8_GSU1_GSUC0_GSUWGMRR0_K1_LBSPPA256_LBSPPB1024_LPA8_LPB8_LRVW8_MIAV0_MIWT4_16_SU8_SUM0_SUS256_SVW4_VWA4_VWB16_WG64_4_1_WGM32_WGMXCC1_WGMXCCGn1
    SolutionIndex: 66
    SolutionNameMin: Cijk_Alik_Bljk_HH_F8HS_BH_UserArgs_MT256x224x128_MI16x16x1_SN_GRVWA8_GRVWB8_GSU2_GSUC0_GSUWGMRR0_K1_LBSPPA1024_LBSPPB128_LPA8_LPB8_LRVW8_MIAV0_MIWT8_7_SU8_SUM0_SUS256_SVW8_VWA8_VWB1_WG32_8_1_WGM16_WGMXCC1_WGMXCCGn1
    SolutionIndex: 67
    SolutionNameMin: Cijk_Alik_Bljk_HH_F8HS_BH_UserArgs_MT256x224x64_MI32x32x1_SN_GRVWA8_GRVWB8_GSU1_GSUC0_GSUWGMRR0_K1_LBSPPA128_LBSPPB128_LPA16_LPB16_LRVW16_MIWT2_7_SU8_SUM0_SUS256_SVW2_VWA2_VWB1_WG128_2_1_WGM32_WGMXCC1_WGMXCCGn1
    SolutionIndex: 68
    SolutionNameMin: Cijk_Alik_Bljk_HH_F8HS_BH_UserArgs_MT256x256x64_MI16x16x1_SN_GRVWA8_GRVWB8_GSU1_GSUC0_GSUWGMRR0_K1_LBSPPA512_LBSPPB512_LPA8_LPB8_LRVW8_MIWT8_8_SU8_SUM0_SUS256_SVW8_VWA8_VWB8_WG32_8_1_WGM32_WGMXCC1_WGMXCCGn1
    SolutionIndex: 69
    SolutionNameMin: Cijk_Alik_Bljk_HH_F8HS_BH_UserArgs_MT64x112x256_MI16x16x1_SN_CLR1_GRVWA8_GRVWB8_GSU1_GSUC0_GSUWGMRR0_K1_LBSPPA512_LBSPPB256_LPA32_LPB32_LRVW16_MIAV1_MIWT2_7_NTC0_NTD0_PLR1_SU0_SUM0_SUS0_SVW2_VWA2_VWB1_WG32_4_2_WGM1_WGMXCC1_WGMXCCGn1
    SolutionIndex: 70
    SolutionNameMin: Cijk_Alik_Bljk_HH_F8HS_BH_UserArgs_MT128x352x128_MI16x16x1_SN_GRVWA8_GRVWB8_GSU3_GSUC0_GSUWGMRR0_K1_LBSPPA512_LBSPPB128_LPA8_LPB8_LRVW8_MIAV0_MIWT4_11_SU8_SUM0_SUS256_SVW4_VWA4_VWB1_WG32_8_1_WGMn16_WGMXCC1_WGMXCCGn1
    SolutionIndex: 71
    SolutionNameMin: Cijk_Alik_Bljk_HH_F8HS_BH_UserArgs_MT224x128x64_MI16x16x1_SN_GRVWA8_GRVWB8_GSU1_GSUC0_GSUWGMRR0_K1_LBSPPA128_LBSPPB256_LPA8_LPB8_LRVW8_MIAV0_MIWT7_4_SU8_SUM0_SUS256_SVW1_VWA1_VWB4_WG32_8_1_WGMn16_WGMXCC1_WGMXCCGn1
    SolutionIndex: 72
    SolutionNameMin: Cijk_Alik_Bljk_HH_F8HS_BH_UserArgs_MT256x256x64_MI16x16x1_SN_GRVWA2_GRVWB8_GSU1_GSUC0_GSUWGMRR0_K1_LBSPPA512_LBSPPB512_LPA8_LPB8_LRVW8_MIWT8_8_SU8_SUM0_SUS256_SVW8_VWA8_VWB8_WG32_8_1_WGM48_WGMXCC1_WGMXCCGn1
- - - [8192, 24576, 1, 24576]
    - [0, 760228.0]
  - - [1024, 3072, 1, 24576]
    - [1, 0.0]
  - - [8192, 24576, 1, 4096]
    - [2, 0.0]
  - - [4096, 1024, 1, 1024]
    - [3, 0.0]
  - - [3072, 8192, 1, 1024]
    - [4, 0.0]
  - - [1024, 1024, 1, 1024]
    - [5, 0.0]
  - - [8192, 4096, 1, 1024]
    - [6, 0.0]
  - - [4096, 4096, 1, 1024]
    - [7, 0.0]
  - - [3072, 8192, 1, 3072]
    - [8, 0.0]
  - - [1024, 3072, 1, 4096]
    - [9, 0.0]
  - - [4096, 1024, 1, 3072]
    - [10, 0.0]
  - - [1024, 1024, 1, 24576]
    - [11, 0.0]
  - - [8192, 1024, 1, 1024]
    - [12, 0.0]
  - - [8192, 8192, 1, 24576]
    - [13, 0.0]
  - - [4096, 3072, 1, 24576]
    - [14, 0.0]
  - - [1024, 4096, 1, 4096]
    - [15, 0.0]
  - - [1024, 24576, 1, 24576]
    - [16, 0.0]
  - - [1024, 8192, 1, 4096]
    - [17, 0.0]
  - - [4096, 8192, 1, 3072]
    - [18, 0.0]
  - - [1024, 3072, 1, 1024]
    - [19, 0.0]
  - - [8192, 8192, 1, 4096]
    - [20, 0.0]
  - - [3072, 3072, 1, 3072]
    - [21, 0.0]
  - - [1024, 4096, 1, 1024]
    - [22, 0.0]
  - - [3072, 8192, 1, 4096]
    - [23, 0.0]
  - - [1024, 8192, 1, 3072]
    - [24, 0.0]
  - - [3072, 3072, 1, 1024]
    - [25, 0.0]
  - - [3072, 1024, 1, 1024]
    - [26, 0.0]
  - - [8192, 4096, 1, 3072]
    - [27, 0.0]
  - - [8192, 3072, 1, 4096]
    - [28, 0.0]
  - - [4096, 24576, 1, 4096]
    - [29, 0.0]
  - - [4096, 1024, 1, 4096]
    - [30, 0.0]
  - - [8192, 24576, 1, 1024]
    - [31, 0.0]
  - - [1024, 24576, 1, 4096]
    - [32, 0.0]
  - - [4096, 3072, 1, 4096]
    - [33, 0.0]
  - - [4096, 3072, 1, 1024]
    - [34, 0.0]
  - - [4096, 8192, 1, 1024]
    - [35, 0.0]
  - - [3072, 1024, 1, 3072]
    - [36, 0.0]
  - - [1024, 24576, 1, 1024]
    - [37, 0.0]
  - - [1024, 4096, 1, 24576]
    - [38, 0.0]
  - - [3072, 1024, 1, 4096]
    - [39, 0.0]
  - - [1024, 24576, 1, 3072]
    - [40, 0.0]
  - - [8192, 4096, 1, 4096]
    - [41, 0.0]
  - - [1024, 8192, 1, 1024]
    - [42, 0.0]
  - - [4096, 4096, 1, 24576]
    - [43, 0.0]
  - - [8192, 1024, 1, 4096]
    - [44, 0.0]
  - - [3072, 4096, 1, 4096]
    - [45, 0.0]
  - - [8192, 24576, 1, 3072]
    - [46, 0.0]
  - - [8192, 1024, 1, 24576]
    - [47, 0.0]
  - - [1024, 3072, 1, 3072]
    - [48, 0.0]
  - - [4096, 4096, 1, 3072]
    - [49, 0.0]
  - - [3072, 3072, 1, 4096]
    - [50, 0.0]
  - - [4096, 24576, 1, 1024]
    - [29, 0.0]
  - - [4096, 8192, 1, 24576]
    - [43, 0.0]
  - - [3072, 4096, 1, 24576]
    - [51, 0.0]
  - - [3072, 24576, 1, 3072]
    - [46, 0.0]
  - - [3072, 3072, 1, 24576]
    - [52, 0.0]
  - - [4096, 24576, 1, 24576]
    - [0, 0.0]
  - - [4096, 4096, 1, 4096]
    - [53, 0.0]
  - - [1024, 1024, 1, 4096]
    - [54, 0.0]
  - - [8192, 4096, 1, 24576]
    - [27, 0.0]
  - - [3072, 8192, 1, 24576]
    - [55, 0.0]
  - - [3072, 1024, 1, 24576]
    - [56, 0.0]
  - - [3072, 4096, 1, 3072]
    - [57, 0.0]
  - - [8192, 3072, 1, 24576]
    - [58, 0.0]
  - - [3072, 24576, 1, 24576]
    - [59, 0.0]
  - - [3072, 4096, 1, 1024]
    - [60, 0.0]
  - - [4096, 24576, 1, 3072]
    - [61, 0.0]
  - - [8192, 3072, 1, 3072]
    - [62, 0.0]
  - - [1024, 4096, 1, 3072]
    - [63, 0.0]
  - - [4096, 3072, 1, 3072]
    - [14, 0.0]
  - - [8192, 3072, 1, 1024]
    - [64, 0.0]
  - - [4096, 8192, 1, 4096]
    - [65, 0.0]
  - - [1024, 8192, 1, 24576]
    - [66, 0.0]
  - - [8192, 8192, 1, 3072]
    - [67, 0.0]
  - - [8192, 8192, 1, 1024]
    - [68, 0.0]
  - - [1024, 1024, 1, 3072]
    - [69, 0.0]
  - - [4096, 1024, 1, 24576]
    - [70, 0.0]
  - - [8192, 1024, 1, 3072]
    - [71, 0.0]
  - - [3072, 24576, 1, 1024]
    - [72, 0.0]
  - - [3072, 24576, 1, 4096]
    - [2, 0.0]
- null
- null
- DeviceEfficiency
- GridBased
