library/src/amd_detail/rocblaslt/src/Tensile/Logic/asm_full/aquavanjaram/gfx942/Equality/aquavanjaram_Cijk_Ailk_Bjlk_HH_F8HS_BH_UserArgs.yaml
- {MinimumRequiredVersion: 4.33.0}
- aquavanjaram
- gfx942
- [Device 0049, Device 0050]
    SolutionIndex: 0
    SolutionNameMin: Cijk_Ailk_Bjlk_HH_F8HS_BH_UserArgs_MT256x256x64_MI16x16x1_SN_GSU1_GSUC0_GSUWGMRR0_K1_LBSPPA2048_LBSPPB2048_LPA0_LPB0_MIAV0_MIWT8_8_NLCA1_NLCB1_SU32_SUM0_SUS256_SVW8_VWA8_VWB8_WG32_8_1_WGM48_WGMXCC1_WGMXCCGn1
    SolutionIndex: 1
    SolutionNameMin: Cijk_Ailk_Bjlk_HH_F8HS_BH_UserArgs_MT256x256x64_MI32x32x1_SN_GSU1_GSUC0_GSUWGMRR0_K1_LBSPPA0_LBSPPB0_LPA0_LPB0_MIWT4_4_NLCA1_NLCB1_SU32_SUM0_SUS256_SVW4_VWA4_VWB4_WG64_4_1_WGM48_WGMXCC1_WGMXCCGn1
    SolutionIndex: 2
    SolutionNameMin: Cijk_Ailk_Bjlk_HH_F8HS_BH_UserArgs_MT256x256x64_MI16x16x1_SN_GSU2_GSUC0_GSUWGMRR0_K1_LBSPPA2048_LBSPPB2048_LPA0_LPB0_MIAV0_MIWT8_8_NLCA1_NLCB1_SU32_SUM0_SUS256_SVW8_VWA8_VWB8_WG32_8_1_WGM16_WGMXCC1_WGMXCCGn1
    SolutionIndex: 3
    SolutionNameMin: Cijk_Ailk_Bjlk_HH_F8HS_BH_UserArgs_MT256x256x64_MI16x16x1_SN_GSU1_GSUC0_GSUWGMRR0_K1_LBSPPA2048_LBSPPB2048_LPA0_LPB0_MIWT8_8_NLCA1_NLCB1_SU32_SUM0_SUS256_SVW8_VWA8_VWB8_WG32_8_1_WGM32_WGMXCC1_WGMXCCGn1
    SolutionIndex: 4
    SolutionNameMin: Cijk_Ailk_Bjlk_HH_F8HS_BH_UserArgs_MT128x384x64_MI32x32x1_SN_GSU3_GSUC0_GSUWGMRR0_K1_LBSPPA0_LBSPPB0_LPA0_LPB0_MIAV0_MIWT2_6_NLCA1_NLCB3_SU32_SUM0_SUS256_SVW2_VWA2_VWB2_WG64_4_1_WGMn16_WGMXCC1_WGMXCCGn1
    SolutionIndex: 5
    SolutionNameMin: Cijk_Ailk_Bjlk_HH_F8HS_BH_UserArgs_MT64x64x128_MI16x16x1_SN_CLR1_GSU1_GSUC0_GSUWGMRR0_K1_LBSPPA512_LBSPPB512_LPA32_LPB64_MIAV1_MIWT2_4_NTC0_NTD0_NLCA1_NLCB1_PLR1_SU0_SUM0_SUS0_SVW2_VWA2_VWB4_WG32_4_2_WGM1_WGMXCC1_WGMXCCGn1
    SolutionIndex: 6
    SolutionNameMin: Cijk_Ailk_Bjlk_HH_F8HS_BH_UserArgs_MT256x192x64_MI16x16x1_SN_GSU1_GSUC0_GSUWGMRR0_K1_LBSPPA2048_LBSPPB1536_LPA0_LPB32_MIAV0_MIWT8_6_NLCA1_NLCB3_SU32_SUM0_SUS256_SVW8_VWA8_VWB2_WG32_8_1_WGM48_WGMXCC1_WGMXCCGn1
    SolutionIndex: 7
    SolutionNameMin: Cijk_Ailk_Bjlk_HH_F8HS_BH_UserArgs_MT256x256x64_MI16x16x1_SN_GSU1_GSUC0_GSUWGMRR0_K1_LBSPPA2048_LBSPPB2048_LPA0_LPB0_MIAV0_MIWT8_8_NLCA1_NLCB1_SU32_SUM0_SUS256_SVW8_VWA8_VWB8_WG32_8_1_WGMn16_WGMXCC1_WGMXCCGn1
    SolutionIndex: 8
    SolutionNameMin: Cijk_Ailk_Bjlk_HH_F8HS_BH_UserArgs_MT128x128x64_MI16x16x1_SN_GSU1_GSUC0_GSUWGMRR0_K1_LBSPPA1024_LBSPPB1024_LPA64_LPB64_MIAV1_MIWT4_4_NLCA1_NLCB1_SU32_SUM0_SUS256_SVW4_VWA4_VWB4_WG32_8_1_WGM16_WGMXCC1_WGMXCCGn1
    SolutionIndex: 9
    SolutionNameMin: Cijk_Ailk_Bjlk_HH_F8HS_BH_UserArgs_MT256x256x64_MI16x16x1_SN_GSU1_GSUC0_GSUWGMRR0_K1_LBSPPA2048_LBSPPB2048_LPA0_LPB0_MIAV0_MIWT8_8_NLCA1_NLCB1_SU32_SUM0_SUS256_SVW8_VWA8_VWB8_WG32_8_1_WGMn32_WGMXCC1_WGMXCCGn1
    SolutionIndex: 10
    SolutionNameMin: Cijk_Ailk_Bjlk_HH_F8HS_BH_UserArgs_MT128x128x64_MI16x16x1_SN_GSU1_GSUC0_GSUWGMRR0_K1_LBSPPA1024_LBSPPB1024_LPA64_LPB64_MIAV1_MIWT4_4_NLCA1_NLCB1_SU32_SUM0_SUS256_SVW4_VWA4_VWB4_WG32_8_1_WGMn16_WGMXCC1_WGMXCCGn1
    SolutionIndex: 11
    SolutionNameMin: Cijk_Ailk_Bjlk_HH_F8HS_BH_UserArgs_MT256x256x64_MI32x32x1_SN_GSU1_GSUC0_GSUWGMRR0_K1_LBSPPA0_LBSPPB0_LPA0_LPB0_MIWT4_4_NLCA1_NLCB1_SU32_SUM0_SUS256_SVW4_VWA4_VWB4_WG64_4_1_WGM32_WGMXCC1_WGMXCCGn1
    SolutionIndex: 12
    SolutionNameMin: Cijk_Ailk_Bjlk_HH_F8HS_BH_UserArgs_MT256x256x64_MI32x32x1_SN_GSU1_GSUC0_GSUWGMRR0_K1_LBSPPA0_LBSPPB0_LPA0_LPB0_MIAV0_MIWT4_4_NLCA1_NLCB1_SU32_SUM0_SUS256_SVW4_VWA4_VWB4_WG64_4_1_WGM32_WGMXCC1_WGMXCCGn1
    SolutionIndex: 13
    SolutionNameMin: Cijk_Ailk_Bjlk_HH_F8HS_BH_UserArgs_MT128x128x64_MI32x32x1_SN_GSU1_GSUC0_GSUWGMRR0_K1_LBSPPA0_LBSPPB0_LPA0_LPB0_MIAV1_MIWT2_2_NLCA1_NLCB1_SU32_SUM0_SUS256_SVW2_VWA2_VWB2_WG64_4_1_WGMn32_WGMXCC1_WGMXCCGn1
    SolutionIndex: 14
    SolutionNameMin: Cijk_Ailk_Bjlk_HH_F8HS_BH_UserArgs_MT192x256x64_MI32x32x1_SN_GSU1_GSUC0_GSUWGMRR0_K1_LBSPPA0_LBSPPB0_LPA0_LPB0_MIAV0_MIWT6_2_NLCA3_NLCB1_SU32_SUM0_SUS256_SVW2_VWA2_VWB2_WG32_8_1_WGM16_WGMXCC1_WGMXCCGn1
    SolutionIndex: 15
    SolutionNameMin: Cijk_Ailk_Bjlk_HH_F8HS_BH_UserArgs_MT256x192x64_MI16x16x1_SN_GSU1_GSUC0_GSUWGMRR0_K1_LBSPPA2048_LBSPPB1536_LPA64_LPB64_MIAV0_MIWT4_12_NLCA1_NLCB3_SU32_SUM0_SUS256_SVW4_VWA4_VWB4_WG64_4_1_WGM48_WGMXCC1_WGMXCCGn1
    SolutionIndex: 16
    SolutionNameMin: Cijk_Ailk_Bjlk_HH_F8HS_BH_UserArgs_MT256x192x64_MI16x16x1_SN_GSU3_GSUC0_GSUWGMRR0_K1_LBSPPA2048_LBSPPB1536_LPA64_LPB64_MIAV0_MIWT4_12_NLCA1_NLCB3_SU32_SUM0_SUS256_SVW4_VWA4_VWB4_WG64_4_1_WGM16_WGMXCC1_WGMXCCGn1
    SolutionIndex: 17
    SolutionNameMin: Cijk_Ailk_Bjlk_HH_F8HS_BH_UserArgs_MT256x224x64_MI16x16x1_SN_GSU1_GSUC0_GSUWGMRR0_K1_LBSPPA2048_LBSPPB1792_LPA64_LPB32_MIWT4_14_NLCA1_NLCB7_SU32_SUM0_SUS256_SVW4_VWA4_VWB2_WG64_4_1_WGM48_WGMXCC1_WGMXCCGn1
    SolutionIndex: 18
    SolutionNameMin: Cijk_Ailk_Bjlk_HH_F8HS_BH_UserArgs_MT256x128x64_MI16x16x1_SN_GSU3_GSUC0_GSUWGMRR0_K1_LBSPPA2048_LBSPPB1024_LPA64_LPB0_MIAV0_MIWT4_8_NTC3_NTD3_NLCA1_NLCB1_SU0_SUM0_SUS0_SVW4_VWA4_VWB8_WG64_4_1_WGM1_WGMXCC1_WGMXCCGn1
    SolutionIndex: 19
    SolutionNameMin: Cijk_Ailk_Bjlk_HH_F8HS_BH_UserArgs_MT224x256x64_MI16x16x1_SN_GSU1_GSUC0_GSUWGMRR0_K1_LBSPPA1792_LBSPPB2048_LPA16_LPB0_MIAV0_MIWT7_8_NLCA7_NLCB1_SU32_SUM0_SUS256_SVW1_VWA1_VWB8_WG32_8_1_WGM16_WGMXCC1_WGMXCCGn1
    SolutionIndex: 20
    SolutionNameMin: Cijk_Ailk_Bjlk_HH_F8HS_BH_UserArgs_MT128x64x128_MI16x16x1_SN_GSU1_GSUC0_GSUWGMRR0_K1_LBSPPA1024_LBSPPB512_LPA64_LPB32_MIAV1_MIWT4_2_NLCA1_NLCB1_SU32_SUM0_SUS256_SVW4_VWA4_VWB2_WG32_8_1_WGM16_WGMXCC1_WGMXCCGn1
    SolutionIndex: 21
    SolutionNameMin: Cijk_Ailk_Bjlk_HH_F8HS_BH_UserArgs_MT128x96x64_MI16x16x1_SN_GSU1_GSUC0_GSUWGMRR0_K1_LBSPPA1024_LBSPPB768_LPA32_LPB32_MIAV1_MIWT2_6_NTC3_NTD3_NLCA1_NLCB3_SU0_SUM0_SUS0_SVW2_VWA2_VWB2_WG64_4_1_WGM1_WGMXCC1_WGMXCCGn1
    SolutionIndex: 22
    SolutionNameMin: Cijk_Ailk_Bjlk_HH_F8HS_BH_UserArgs_MT128x256x64_MI32x32x1_SN_GSU3_GSUC0_GSUWGMRR0_K1_LBSPPA0_LBSPPB0_LPA0_LPB0_MIAV0_MIWT2_4_NTC0_NTD0_NLCA1_NLCB1_SU0_SUM0_SUS0_SVW2_VWA2_VWB4_WG64_4_1_WGM1_WGMXCC1_WGMXCCGn1
    SolutionIndex: 23
    SolutionNameMin: Cijk_Ailk_Bjlk_HH_F8HS_BH_UserArgs_MT128x384x64_MI16x16x1_SN_GSU1_GSUC0_GSUWGMRR0_K1_LBSPPA1024_LBSPPB3072_LPA0_LPB32_MIAV0_MIWT8_6_NLCA1_NLCB3_SU32_SUM0_SUS256_SVW8_VWA8_VWB2_WG16_16_1_WGM1_WGMXCC1_WGMXCCGn1
    SolutionIndex: 24
    SolutionNameMin: Cijk_Ailk_Bjlk_HH_F8HS_BH_UserArgs_MT128x224x64_MI16x16x1_SN_GSU1_GSUC0_GSUWGMRR0_K1_LBSPPA1024_LBSPPB1792_LPA64_LPB16_MIAV0_MIWT4_7_NLCA1_NLCB7_SU32_SUM0_SUS256_SVW4_VWA4_VWB1_WG32_8_1_WGM32_WGMXCC1_WGMXCCGn1
    SolutionIndex: 25
    SolutionNameMin: Cijk_Ailk_Bjlk_HH_F8HS_BH_UserArgs_MT128x64x64_MI16x16x1_SN_GSU1_GSUC0_GSUWGMRR0_K1_LBSPPA1024_LBSPPB512_LPA64_LPB32_MIAV1_MIWT4_2_NLCA1_NLCB1_SU32_SUM0_SUS256_SVW4_VWA4_VWB2_WG32_8_1_WGMn16_WGMXCC1_WGMXCCGn1
    SolutionIndex: 26
    SolutionNameMin: Cijk_Ailk_Bjlk_HH_F8HS_BH_UserArgs_MT128x128x64_MI32x32x1_SN_GSU3_GSUC0_GSUWGMRR0_K1_LBSPPA0_LBSPPB0_LPA0_LPB0_MIAV1_MIWT2_2_NTC3_NTD3_NLCA1_NLCB1_SU0_SUM0_SUS0_SVW2_VWA2_VWB2_WG64_4_1_WGM1_WGMXCC1_WGMXCCGn1
    SolutionIndex: 27
    SolutionNameMin: Cijk_Ailk_Bjlk_HH_F8HS_BH_UserArgs_MT256x256x64_MI16x16x1_SN_GSU1_GSUC0_GSUWGMRR0_K1_LBSPPA2048_LBSPPB2048_LPA0_LPB0_MIWT8_8_NLCA1_NLCB1_SU32_SUM0_SUS256_SVW8_VWA8_VWB8_WG32_8_1_WGM48_WGMXCC1_WGMXCCGn1
    SolutionIndex: 28
    SolutionNameMin: Cijk_Ailk_Bjlk_HH_F8HS_BH_UserArgs_MT128x512x64_MI16x16x1_SN_GSU1_GSUC0_GSUWGMRR0_K1_LBSPPA1024_LBSPPB4096_LPA0_LPB0_MIAV0_MIWT8_8_NLCA1_NLCB1_SU32_SUM0_SUS256_SVW8_VWA8_VWB8_WG16_16_1_WGM16_WGMXCC1_WGMXCCGn1
    SolutionIndex: 29
    SolutionNameMin: Cijk_Ailk_Bjlk_HH_F8HS_BH_UserArgs_MT256x192x64_MI16x16x1_SN_GSU1_GSUC0_GSUWGMRR0_K1_LBSPPA2048_LBSPPB1536_LPA0_LPB32_MIAV0_MIWT8_6_NLCA1_NLCB3_SU32_SUM0_SUS256_SVW8_VWA8_VWB2_WG32_8_1_WGMn16_WGMXCC1_WGMXCCGn1
    SolutionIndex: 30
    SolutionNameMin: Cijk_Ailk_Bjlk_HH_F8HS_BH_UserArgs_MT256x96x64_MI16x16x1_SN_GSU1_GSUC0_GSUWGMRR0_K1_LBSPPA2048_LBSPPB768_LPA64_LPB32_MIAV0_MIWT4_6_NLCA1_NLCB3_SU32_SUM0_SUS256_SVW4_VWA4_VWB2_WG64_4_1_WGM1_WGMXCC1_WGMXCCGn1
    SolutionIndex: 31
    SolutionNameMin: Cijk_Ailk_Bjlk_HH_F8HS_BH_UserArgs_MT256x128x64_MI32x32x1_SN_GSU3_GSUC0_GSUWGMRR0_K1_LBSPPA0_LBSPPB0_LPA0_LPB0_MIAV0_MIWT2_4_NTC0_NTD0_NLCA1_NLCB1_SU0_SUM0_SUS0_SVW2_VWA2_VWB4_WG128_2_1_WGM1_WGMXCC1_WGMXCCGn1
    SolutionIndex: 32
    SolutionNameMin: Cijk_Ailk_Bjlk_HH_F8HS_BH_UserArgs_MT256x256x64_MI32x32x1_SN_GSU6_GSUC0_GSUWGMRR0_K1_LBSPPA0_LBSPPB0_LPA0_LPB0_MIAV0_MIWT4_4_NTC3_NTD3_NLCA1_NLCB1_SU0_SUM0_SUS0_SVW4_VWA4_VWB4_WG64_4_1_WGM1_WGMXCC1_WGMXCCGn1
    SolutionIndex: 33
    SolutionNameMin: Cijk_Ailk_Bjlk_HH_F8HS_BH_UserArgs_MT256x256x64_MI32x32x1_SN_GSU4_GSUC0_GSUWGMRR0_K1_LBSPPA0_LBSPPB0_LPA0_LPB0_MIAV0_MIWT2_8_NLCA1_NLCB1_SU32_SUM0_SUS256_SVW2_VWA2_VWB8_WG128_2_1_WGM32_WGMXCC1_WGMXCCGn1
    SolutionIndex: 34
    SolutionNameMin: Cijk_Ailk_Bjlk_HH_F8HS_BH_UserArgs_MT128x384x64_MI16x16x1_SN_GSU3_GSUC0_GSUWGMRR0_K1_LBSPPA1024_LBSPPB3072_LPA64_LPB64_MIAV0_MIWT4_12_NLCA1_NLCB3_SU32_SUM0_SUS256_SVW4_VWA4_VWB4_WG32_8_1_WGMn16_WGMXCC1_WGMXCCGn1
    SolutionIndex: 35
    SolutionNameMin: Cijk_Ailk_Bjlk_HH_F8HS_BH_UserArgs_MT128x256x64_MI16x16x1_SN_GSU1_GSUC0_GSUWGMRR0_K1_LBSPPA1024_LBSPPB2048_LPA64_LPB0_MIAV0_MIWT4_8_NLCA1_NLCB1_SU32_SUM0_SUS256_SVW4_VWA4_VWB8_WG32_8_1_WGM1_WGMXCC1_WGMXCCGn1
    SolutionIndex: 36
    SolutionNameMin: Cijk_Ailk_Bjlk_HH_F8HS_BH_UserArgs_MT128x192x64_MI16x16x1_SN_GSU1_GSUC0_GSUWGMRR0_K1_LBSPPA1024_LBSPPB1536_LPA64_LPB32_MIAV0_MIWT4_6_NLCA1_NLCB3_SU32_SUM0_SUS256_SVW4_VWA4_VWB2_WG32_8_1_WGMn16_WGMXCC1_WGMXCCGn1
    SolutionIndex: 37
    SolutionNameMin: Cijk_Ailk_Bjlk_HH_F8HS_BH_UserArgs_MT256x128x64_MI16x16x1_SN_GSU1_GSUC0_GSUWGMRR0_K1_LBSPPA2048_LBSPPB1024_LPA0_LPB64_MIAV0_MIWT8_4_NLCA1_NLCB1_SU32_SUM0_SUS256_SVW8_VWA8_VWB4_WG32_8_1_WGM1_WGMXCC1_WGMXCCGn1
    SolutionIndex: 38
    SolutionNameMin: Cijk_Ailk_Bjlk_HH_F8HS_BH_UserArgs_MT256x256x64_MI32x32x1_SN_GSU1_GSUC0_GSUWGMRR0_K1_LBSPPA0_LBSPPB0_LPA0_LPB0_MIWT2_8_NLCA1_NLCB1_SU32_SUM0_SUS256_SVW2_VWA2_VWB8_WG128_2_1_WGM48_WGMXCC1_WGMXCCGn1
    SolutionIndex: 39
    SolutionNameMin: Cijk_Ailk_Bjlk_HH_F8HS_BH_UserArgs_MT128x512x64_MI32x32x1_SN_GSU2_GSUC0_GSUWGMRR0_K1_LBSPPA0_LBSPPB0_LPA0_LPB0_MIAV0_MIWT4_4_NLCA1_NLCB1_SU32_SUM0_SUS256_SVW4_VWA4_VWB4_WG32_8_1_WGM1_WGMXCC1_WGMXCCGn1
    SolutionIndex: 40
    SolutionNameMin: Cijk_Ailk_Bjlk_HH_F8HS_BH_UserArgs_MT256x192x64_MI16x16x1_SN_GSU1_GSUC0_GSUWGMRR0_K1_LBSPPA2048_LBSPPB1536_LPA0_LPB32_MIAV0_MIWT8_6_NLCA1_NLCB3_SU32_SUM0_SUS256_SVW8_VWA8_VWB2_WG32_8_1_WGM16_WGMXCC1_WGMXCCGn1
    SolutionIndex: 41
    SolutionNameMin: Cijk_Ailk_Bjlk_HH_F8HS_BH_UserArgs_MT192x256x64_MI16x16x1_SN_GSU1_GSUC0_GSUWGMRR0_K1_LBSPPA1536_LBSPPB2048_LPA32_LPB0_MIAV0_MIWT6_8_NLCA3_NLCB1_SU32_SUM0_SUS256_SVW2_VWA2_VWB8_WG32_8_1_WGM32_WGMXCC1_WGMXCCGn1
    SolutionIndex: 42
    SolutionNameMin: Cijk_Ailk_Bjlk_HH_F8HS_BH_UserArgs_MT128x224x64_MI16x16x1_SN_GSU1_GSUC0_GSUWGMRR0_K1_LBSPPA1024_LBSPPB1792_LPA64_LPB16_MIAV0_MIWT4_7_NLCA1_NLCB7_SU32_SUM0_SUS256_SVW4_VWA4_VWB1_WG32_8_1_WGM16_WGMXCC1_WGMXCCGn1
    SolutionIndex: 43
    SolutionNameMin: Cijk_Ailk_Bjlk_HH_F8HS_BH_UserArgs_MT192x256x64_MI16x16x1_SN_GSU1_GSUC0_GSUWGMRR0_K1_LBSPPA1536_LBSPPB2048_LPA32_LPB0_MIAV0_MIWT6_8_NLCA3_NLCB1_SU32_SUM0_SUS256_SVW2_VWA2_VWB8_WG32_8_1_WGM16_WGMXCC1_WGMXCCGn1
    SolutionIndex: 44
    SolutionNameMin: Cijk_Ailk_Bjlk_HH_F8HS_BH_UserArgs_MT256x128x128_MI16x16x1_SN_CLR1_GSU9_GSUC0_GSUWGMRR0_K1_LBSPPA2048_LBSPPB1024_LPA64_LPB0_MIAV0_MIWT4_8_NTC0_NTD0_NLCA1_NLCB1_PLR1_SU0_SUM0_SUS0_SVW4_VWA4_VWB8_WG64_4_1_WGM1_WGMXCC1_WGMXCCGn1
    SolutionIndex: 45
    SolutionNameMin: Cijk_Ailk_Bjlk_HH_F8HS_BH_UserArgs_MT256x256x64_MI16x16x1_SN_GSU1_GSUC0_GSUWGMRR0_K1_LBSPPA2048_LBSPPB2048_LPA0_LPB0_MIWT8_8_NLCA1_NLCB1_SU32_SUM0_SUS256_SVW8_VWA8_VWB8_WG32_8_1_WGM16_WGMXCC1_WGMXCCGn1
    SolutionIndex: 46
    SolutionNameMin: Cijk_Ailk_Bjlk_HH_F8HS_BH_UserArgs_MT192x64x64_MI16x16x1_SN_GSU1_GSUC0_GSUWGMRR0_K1_LBSPPA1536_LBSPPB512_LPA32_LPB32_MIAV1_MIWT6_2_NTC3_NTD3_NLCA3_NLCB1_SU0_SUM0_SUS0_SVW2_VWA2_VWB2_WG32_8_1_WGM1_WGMXCC1_WGMXCCGn1
    SolutionIndex: 47
    SolutionNameMin: Cijk_Ailk_Bjlk_HH_F8HS_BH_UserArgs_MT128x128x64_MI32x32x1_SN_GSU1_GSUC0_GSUWGMRR0_K1_LBSPPA0_LBSPPB0_LPA0_LPB0_MIAV1_MIWT2_2_NLCA1_NLCB1_SU32_SUM0_SUS256_SVW2_VWA2_VWB2_WG64_4_1_WGM1_WGMXCC1_WGMXCCGn1
    SolutionIndex: 48
    SolutionNameMin: Cijk_Ailk_Bjlk_HH_F8HS_BH_UserArgs_MT192x256x64_MI16x16x1_SN_GSU1_GSUC0_GSUWGMRR0_K1_LBSPPA1536_LBSPPB2048_LPA32_LPB0_MIAV0_MIWT6_8_NLCA3_NLCB1_SU32_SUM0_SUS256_SVW2_VWA2_VWB8_WG32_8_1_WGM1_WGMXCC1_WGMXCCGn1
    SolutionIndex: 49
    SolutionNameMin: Cijk_Ailk_Bjlk_HH_F8HS_BH_UserArgs_MT128x384x64_MI16x16x1_SN_GSU1_GSUC0_GSUWGMRR0_K1_LBSPPA1024_LBSPPB3072_LPA0_LPB32_MIAV0_MIWT8_6_NLCA1_NLCB3_SU32_SUM0_SUS256_SVW8_VWA8_VWB2_WG16_16_1_WGMn16_WGMXCC1_WGMXCCGn1
    SolutionIndex: 50
    SolutionNameMin: Cijk_Ailk_Bjlk_HH_F8HS_BH_UserArgs_MT128x384x64_MI32x32x1_SN_GSU1_GSUC0_GSUWGMRR0_K1_LBSPPA0_LBSPPB0_LPA0_LPB0_MIAV0_MIWT4_3_NLCA1_NLCB3_SU32_SUM0_SUS256_SVW4_VWA4_VWB1_WG32_8_1_WGM1_WGMXCC1_WGMXCCGn1
    SolutionIndex: 51
    SolutionNameMin: Cijk_Ailk_Bjlk_HH_F8HS_BH_UserArgs_MT64x64x64_MI16x16x1_SN_CLR0_GSU1_GSUC0_GSUWGMRR0_K1_LBSPPA512_LBSPPB512_LPA64_LPB32_MIWT4_2_NTC0_NTD0_NLCA1_NLCB1_PLR0_SU0_SUM0_SUS0_SVW4_VWA4_VWB2_WG16_8_2_WGM1_WGMXCC1_WGMXCCGn1
    SolutionIndex: 52
    SolutionNameMin: Cijk_Ailk_Bjlk_HH_F8HS_BH_UserArgs_MT256x256x64_MI16x16x1_SN_GSU1_GSUC0_GSUWGMRR0_K1_LBSPPA2048_LBSPPB2048_LPA0_LPB0_MIAV0_MIWT8_8_NLCA1_NLCB1_SU32_SUM0_SUS256_SVW8_VWA8_VWB8_WG32_8_1_WGM32_WGMXCC1_WGMXCCGn1
    SolutionIndex: 53
    SolutionNameMin: Cijk_Ailk_Bjlk_HH_F8HS_BH_UserArgs_MT256x224x64_MI16x16x1_SN_GSU1_GSUC0_GSUWGMRR0_K1_LBSPPA2048_LBSPPB1792_LPA64_LPB32_MIAV0_MIWT4_14_NLCA1_NLCB7_SU32_SUM0_SUS256_SVW4_VWA4_VWB2_WG64_4_1_WGM1_WGMXCC1_WGMXCCGn1
    SolutionIndex: 54
    SolutionNameMin: Cijk_Ailk_Bjlk_HH_F8HS_BH_UserArgs_MT128x128x64_MI32x32x1_SN_GSU2_GSUC0_GSUWGMRR0_K1_LBSPPA0_LBSPPB0_LPA0_LPB0_MIAV1_MIWT2_2_NLCA1_NLCB1_SU32_SUM0_SUS256_SVW2_VWA2_VWB2_WG64_4_1_WGMn16_WGMXCC1_WGMXCCGn1
    SolutionIndex: 55
    SolutionNameMin: Cijk_Ailk_Bjlk_HH_F8HS_BH_UserArgs_MT256x96x64_MI16x16x1_SN_GSU1_GSUC0_GSUWGMRR0_K1_LBSPPA2048_LBSPPB768_LPA0_LPB16_MIAV0_MIWT8_3_NLCA1_NLCB3_SU32_SUM0_SUS256_SVW8_VWA8_VWB1_WG32_8_1_WGMn16_WGMXCC1_WGMXCCGn1
    SolutionIndex: 56
    SolutionNameMin: Cijk_Ailk_Bjlk_HH_F8HS_BH_UserArgs_MT128x512x64_MI32x32x1_SN_GSU4_GSUC0_GSUWGMRR0_K1_LBSPPA0_LBSPPB0_LPA0_LPB0_MIAV0_MIWT4_4_NLCA1_NLCB1_SU32_SUM0_SUS256_SVW4_VWA4_VWB4_WG32_8_1_WGMn32_WGMXCC1_WGMXCCGn1
    SolutionIndex: 57
    SolutionNameMin: Cijk_Ailk_Bjlk_HH_F8HS_BH_UserArgs_MT128x256x64_MI16x16x1_SN_GSU3_GSUC0_GSUWGMRR0_K1_LBSPPA1024_LBSPPB2048_LPA64_LPB0_MIAV0_MIWT4_8_NTC0_NTD0_NLCA1_NLCB1_SU0_SUM0_SUS0_SVW4_VWA4_VWB8_WG32_8_1_WGM1_WGMXCC1_WGMXCCGn1
    SolutionIndex: 58
    SolutionNameMin: Cijk_Ailk_Bjlk_HH_F8HS_BH_UserArgs_MT128x64x64_MI16x16x1_SN_GSU1_GSUC0_GSUWGMRR0_K1_LBSPPA1024_LBSPPB512_LPA32_LPB64_MIAV1_MIWT2_4_NLCA1_NLCB1_SU32_SUM0_SUS256_SVW2_VWA2_VWB4_WG64_4_1_WGM16_WGMXCC1_WGMXCCGn1
    SolutionIndex: 59
    SolutionNameMin: Cijk_Ailk_Bjlk_HH_F8HS_BH_UserArgs_MT64x64x64_MI16x16x1_SN_CLR0_GSU1_GSUC0_GSUWGMRR0_K1_LBSPPA512_LBSPPB512_LPA64_LPB32_MIAV1_MIWT4_2_NTC0_NTD0_NLCA1_NLCB1_PLR0_SU0_SUM0_SUS0_SVW4_VWA4_VWB2_WG16_8_2_WGM1_WGMXCC1_WGMXCCGn1
- - - [1024, 24576, 1, 24576]
    - [0, 0.0]
  - - [4096, 24576, 1, 3072]
    - [1, 0.0]
  - - [4096, 4096, 1, 24576]
    - [2, 0.0]
  - - [8192, 8192, 1, 1024]
    - [3, 0.0]
  - - [4096, 1024, 1, 4096]
    - [4, 0.0]
  - - [1024, 1024, 1, 3072]
    - [5, 0.0]
  - - [1024, 24576, 1, 4096]
    - [6, 0.0]
  - - [8192, 24576, 1, 4096]
    - [1, 0.0]
  - - [8192, 4096, 1, 3072]
    - [7, 0.0]
  - - [3072, 4096, 1, 1024]
    - [8, 0.0]
  - - [8192, 4096, 1, 4096]
    - [9, 0.0]
  - - [8192, 4096, 1, 1024]
    - [9, 0.0]
  - - [8192, 1024, 1, 1024]
    - [10, 0.0]
  - - [3072, 24576, 1, 4096]
    - [1, 0.0]
  - - [8192, 8192, 1, 3072]
    - [11, 0.0]
  - - [4096, 8192, 1, 1024]
    - [12, 0.0]
  - - [8192, 1024, 1, 3072]
    - [13, 0.0]
  - - [3072, 8192, 1, 1024]
    - [14, 0.0]
  - - [1024, 24576, 1, 1024]
    - [15, 0.0]
  - - [1024, 4096, 1, 4096]
    - [16, 0.0]
  - - [4096, 24576, 1, 1024]
    - [17, 0.0]
  - - [1024, 8192, 1, 1024]
    - [8, 0.0]
  - - [1024, 3072, 1, 24576]
    - [18, 0.0]
  - - [4096, 4096, 1, 4096]
    - [19, 0.0]
  - - [8192, 24576, 1, 3072]
    - [1, 0.0]
  - - [1024, 24576, 1, 3072]
    - [15, 0.0]
  - - [1024, 4096, 1, 1024]
    - [20, 0.0]
  - - [3072, 1024, 1, 1024]
    - [21, 0.0]
  - - [8192, 1024, 1, 4096]
    - [13, 0.0]
  - - [1024, 3072, 1, 3072]
    - [22, 0.0]
  - - [3072, 4096, 1, 4096]
    - [23, 0.0]
  - - [1024, 8192, 1, 3072]
    - [24, 0.0]
  - - [4096, 1024, 1, 1024]
    - [25, 0.0]
  - - [3072, 1024, 1, 3072]
    - [26, 0.0]
  - - [3072, 24576, 1, 24576]
    - [27, 0.0]
  - - [4096, 8192, 1, 24576]
    - [28, 0.0]
  - - [8192, 3072, 1, 3072]
    - [29, 0.0]
  - - [4096, 3072, 1, 1024]
    - [30, 0.0]
  - - [1024, 3072, 1, 4096]
    - [31, 0.0]
  - - [8192, 24576, 1, 24576]
    - [27, 0.0]
  - - [3072, 1024, 1, 24576]
    - [32, 0.0]
  - - [1024, 8192, 1, 24576]
    - [33, 0.0]
  - - [4096, 1024, 1, 24576]
    - [34, 0.0]
  - - [3072, 24576, 1, 3072]
    - [1, 0.0]
  - - [3072, 3072, 1, 4096]
    - [35, 0.0]
  - - [4096, 3072, 1, 4096]
    - [36, 0.0]
  - - [3072, 3072, 1, 3072]
    - [37, 0.0]
  - - [3072, 24576, 1, 1024]
    - [38, 0.0]
  - - [3072, 3072, 1, 24576]
    - [39, 0.0]
  - - [3072, 4096, 1, 24576]
    - [40, 0.0]
  - - [3072, 8192, 1, 4096]
    - [41, 0.0]
  - - [8192, 3072, 1, 4096]
    - [29, 0.0]
  - - [8192, 3072, 1, 1024]
    - [29, 0.0]
  - - [1024, 8192, 1, 4096]
    - [42, 0.0]
  - - [8192, 8192, 1, 4096]
    - [11, 0.0]
  - - [3072, 8192, 1, 24576]
    - [43, 0.0]
  - - [1024, 1024, 1, 24576]
    - [44, 0.0]
  - - [8192, 8192, 1, 24576]
    - [45, 0.0]
  - - [1024, 3072, 1, 1024]
    - [46, 0.0]
  - - [3072, 3072, 1, 1024]
    - [47, 0.0]
  - - [4096, 3072, 1, 24576]
    - [48, 0.0]
  - - [3072, 8192, 1, 3072]
    - [41, 0.0]
  - - [8192, 3072, 1, 24576]
    - [49, 0.0]
  - - [3072, 4096, 1, 3072]
    - [50, 0.0]
  - - [1024, 1024, 1, 1024]
    - [51, 0.0]
  - - [4096, 8192, 1, 4096]
    - [52, 0.0]
  - - [4096, 4096, 1, 1024]
    - [53, 0.0]
  - - [4096, 24576, 1, 24576]
    - [27, 0.0]
  - - [4096, 1024, 1, 3072]
    - [54, 0.0]
  - - [1024, 4096, 1, 24576]
    - [16, 0.0]
  - - [8192, 4096, 1, 24576]
    - [7, 0.0]
  - - [4096, 8192, 1, 3072]
    - [52, 0.0]
  - - [4096, 3072, 1, 3072]
    - [55, 0.0]
  - - [8192, 1024, 1, 24576]
    - [56, 0.0]
  - - [8192, 24576, 1, 1024]
    - [1, 0.0]
  - - [4096, 24576, 1, 4096]
    - [1, 0.0]
  - - [3072, 1024, 1, 4096]
    - [57, 0.0]
  - - [4096, 4096, 1, 3072]
    - [53, 0.0]
  - - [1024, 4096, 1, 3072]
    - [58, 0.0]
  - - [1024, 1024, 1, 4096]
    - [59, 0.0]
- null
- null
- DeviceEfficiency
- GridBased
