library/src/amd_detail/rocblaslt/src/Tensile/Logic/asm_full/aquavanjaram/gfx942/Equality/aquavanjaram_Cijk_Alik_Bljk_BBS_BH_Bias_AS_SAV_UserArgs.yaml
- {MinimumRequiredVersion: 4.33.0}
- aquavanjaram
- gfx942
- [Device 0049, Device 0050]
    SolutionIndex: 0
    SolutionNameMin: Cijk_Alik_Bljk_BBS_BH_UserArgs_MT256x192x64_MI16x16x1_SN_GSU1_MIWT8_6_SS1_SU8_SUM0_SUS128_SVW8_WGM0
    SolutionIndex: 1
    SolutionNameMin: Cijk_Alik_Bljk_BBS_BH_UserArgs_MT16x16x256_MI16x16x1_SN_GSU1_MIWT1_1_NEPBS0_SU0_SUM0_SUS0_WGM1
    SolutionIndex: 2
    SolutionNameMin: Cijk_Alik_Bljk_BBS_BH_UserArgs_MT16x16x256_MI16x16x1_SN_GSU1_MIWT1_1_NEPBS16_SU0_SUM0_SUS0_WGM0
    SolutionIndex: 3
    SolutionNameMin: Cijk_Alik_Bljk_BBS_BH_UserArgs_MT256x208x64_MI16x16x1_SN_GSU1_MIWT4_13_NEPBS0_SU32_SUM0_SUS256_WGM0
    SolutionIndex: 4
    SolutionNameMin: Cijk_Alik_Bljk_BBS_BH_UserArgs_MT64x96x128_MI16x16x1_SN_GSU1_MIWT2_3_NEPBS16_SU8_SUM1_SUS1024_WGM16
    SolutionIndex: 5
    SolutionNameMin: Cijk_Alik_Bljk_BBS_BH_UserArgs_MT128x16x64_MI16x16x1_SN_GSU1_MIWT2_1_NEPBS16_SU4_SUM1_SUS128_WGM0
    SolutionIndex: 6
    SolutionNameMin: Cijk_Alik_Bljk_BBS_BH_UserArgs_MT16x16x256_MI16x16x1_SN_GSU6_MIWT1_1_NEPBS16_SU0_SUM0_SUS0_WGM1
    SolutionIndex: 7
    SolutionNameMin: Cijk_Alik_Bljk_BBS_BH_UserArgs_MT128x16x64_MI16x16x1_SN_GSU1_MIWT2_1_NEPBS0_SU4_SUM1_SUS256_WGM1
    SolutionIndex: 8
    SolutionNameMin: Cijk_Alik_Bljk_BBS_BH_UserArgs_MT256x192x64_MI16x16x1_SN_GSU1_MIWT8_6_NEPBS0_SU8_SUM0_SUS256_WGM0
    SolutionIndex: 9
    SolutionNameMin: Cijk_Alik_Bljk_BBS_BH_UserArgs_MT16x16x256_MI16x16x1_SN_GSU6_MIWT1_1_NEPBS0_SU0_SUM0_SUS0_WGM1
    SolutionIndex: 10
    SolutionNameMin: Cijk_Alik_Bljk_BBS_BH_UserArgs_MT128x48x128_MI16x16x1_SN_GSU1_MIWT2_3_NEPBS16_SU0_SUM0_SUS0_WGM16
    SolutionIndex: 11
    SolutionNameMin: Cijk_Alik_Bljk_BBS_BH_UserArgs_MT32x16x256_MI16x16x1_SN_GSU1_MIWT1_1_NEPBS0_SU0_SUM0_SUS0_WGM1
    SolutionIndex: 12
    SolutionNameMin: Cijk_Alik_Bljk_BBS_BH_UserArgs_MT128x64x64_MI16x16x1_SN_GSU1_MIWT4_2_NEPBS16_SU32_SUM0_SUS1024_WGM0
    SolutionIndex: 13
    SolutionNameMin: Cijk_Alik_Bljk_BBS_BH_UserArgs_MT32x16x128_MI16x16x1_SN_GSU1_MIWT1_1_NEPBS16_SU0_SUM0_SUS0_WGM1
    SolutionIndex: 14
    SolutionNameMin: Cijk_Alik_Bljk_BBS_BH_UserArgs_MT64x32x128_MI16x16x1_SN_GSU1_MIWT2_1_NEPBS16_SU16_SUM1_SUS1024_WGM4
    SolutionIndex: 15
    SolutionNameMin: Cijk_Alik_Bljk_BBS_BH_UserArgs_MT128x64x64_MI16x16x1_SN_GSU11_MIWT4_2_NEPBS0_SU0_SUM0_SUS0_WGM1
    SolutionIndex: 16
    SolutionNameMin: Cijk_Alik_Bljk_BBS_BH_UserArgs_MT64x32x128_MI16x16x1_SN_GSU1_MIWT2_1_NEPBS0_SU32_SUM1_SUS1024_WGM4
    SolutionIndex: 17
    SolutionNameMin: Cijk_Alik_Bljk_BBS_BH_UserArgs_MT64x64x128_MI16x16x1_SN_GSU1_MIWT2_2_NEPBS16_SU16_SUM0_SUS1024_WGM32
    SolutionIndex: 18
    SolutionNameMin: Cijk_Alik_Bljk_BBS_BH_UserArgs_MT64x64x64_MI16x16x1_SN_GSU1_MIWT2_2_NEPBS0_SU8_SUM0_SUS128_WGM32
    SolutionIndex: 19
    SolutionNameMin: Cijk_Alik_Bljk_BBS_BH_UserArgs_MT80x128x64_MI16x16x1_SN_GSU1_MIWT5_2_NEPBS16_SU4_SUM1_SUS256_WGM32
    SolutionIndex: 20
    SolutionNameMin: Cijk_Alik_Bljk_BBS_BH_UserArgs_MT32x16x128_MI16x16x1_SN_GSU1_MIWT1_1_NEPBS0_SU0_SUM0_SUS0_WGM1
    SolutionIndex: 21
    SolutionNameMin: Cijk_Alik_Bljk_BBS_BH_UserArgs_MT64x64x64_MI16x16x1_SN_GSU9_MIWT4_1_NEPBS16_SU4_SUM1_SUS256_WGM16
    SolutionIndex: 22
    SolutionNameMin: Cijk_Alik_Bljk_BBS_BH_UserArgs_MT64x64x64_MI16x16x1_SN_GSU9_MIWT4_1_NEPBS0_SU4_SUM1_SUS512_WGM32
    SolutionIndex: 23
    SolutionNameMin: Cijk_Alik_Bljk_BBS_BH_UserArgs_MT64x64x64_MI16x16x1_SN_GSU9_MIWT4_1_NEPBS0_SU8_SUM1_SUS128_WGM32
    SolutionIndex: 24
    SolutionNameMin: Cijk_Alik_Bljk_BBS_BH_UserArgs_MT64x32x64_MI16x16x1_SN_GSU1_MIWT2_1_NEPBS16_SU8_SUM1_SUS512_WGM16
    SolutionIndex: 25
    SolutionNameMin: Cijk_Alik_Bljk_BBS_BH_UserArgs_MT32x32x128_MI16x16x1_SN_GSU1_MIWT1_1_NEPBS16_SU8_SUM1_SUS1024_WGM16
    SolutionIndex: 26
    SolutionNameMin: Cijk_Alik_Bljk_BBS_BH_UserArgs_MT64x32x256_MI16x16x1_SN_GSU1_MIWT2_1_NEPBS0_SU32_SUM0_SUS512_WGM8
    SolutionIndex: 27
    SolutionNameMin: Cijk_Alik_Bljk_BBS_BH_UserArgs_MT80x256x64_MI16x16x1_SN_GSU1_MIWT5_4_NEPBS0_SU32_SUM0_SUS256_WGM32
    SolutionIndex: 28
    SolutionNameMin: Cijk_Alik_Bljk_BBS_BH_UserArgs_MT128x96x64_MI16x16x1_SN_GSU1_MIWT2_6_NEPBS0_SU4_SUM0_SUS512_WGM0
    SolutionIndex: 29
    SolutionNameMin: Cijk_Alik_Bljk_BBS_BH_UserArgs_MT256x224x64_MI16x16x1_SN_GSU1_MIWT8_7_NEPBS16_SU4_SUM0_SUS512_WGM1
    SolutionIndex: 30
    SolutionNameMin: Cijk_Alik_Bljk_BBS_BH_UserArgs_MT64x128x128_MI16x16x1_SN_GSU1_MIWT4_2_NEPBS16_SU0_SUM0_SUS0_WGM8
    SolutionIndex: 31
    SolutionNameMin: Cijk_Alik_Bljk_BBS_BH_UserArgs_MT256x224x64_MI16x16x1_SN_GSU1_MIWT8_7_NEPBS0_SU8_SUM0_SUS128_WGM0
    SolutionIndex: 32
    SolutionNameMin: Cijk_Alik_Bljk_BBS_BH_UserArgs_MT256x64x64_MI16x16x1_SN_GSU1_MIWT8_2_NEPBS0_SU16_SUM0_SUS128_WGM0
    SolutionIndex: 33
    SolutionNameMin: Cijk_Alik_Bljk_BBS_BH_UserArgs_MT128x16x64_MI16x16x1_SN_GSU1_MIWT2_1_NEPBS0_SU4_SUM1_SUS128_WGM0
    SolutionIndex: 34
    SolutionNameMin: Cijk_Alik_Bljk_BBS_BH_UserArgs_MT448x32x64_MI16x16x1_SN_GSU1_MIWT14_1_NEPBS0_SU4_SUM1_SUS128_WGM1
    SolutionIndex: 35
    SolutionNameMin: Cijk_Alik_Bljk_BBS_BH_UserArgs_MT16x16x256_MI16x16x1_SN_GSU6_MIWT1_1_NEPBS16_SU0_SUM0_SUS0_WGM0
    SolutionIndex: 36
    SolutionNameMin: Cijk_Alik_Bljk_BBS_BH_UserArgs_MT16x32x256_MI16x16x1_SN_GSU1_MIWT1_1_NEPBS16_SU0_SUM0_SUS0_WGM1
    SolutionIndex: 37
    SolutionNameMin: Cijk_Alik_Bljk_BBS_BH_UserArgs_MT128x128x64_MI16x16x1_SN_GSU1_MIWT4_4_NEPBS0_SU8_SUM0_SUS128_WGM4
    SolutionIndex: 38
    SolutionNameMin: Cijk_Alik_Bljk_BBS_BH_UserArgs_MT64x64x64_MI16x16x1_SN_GSU1_MIWT2_2_NEPBS0_SU8_SUM1_SUS1024_WGM4
    SolutionIndex: 39
    SolutionNameMin: Cijk_Alik_Bljk_BBS_BH_UserArgs_MT128x64x64_MI16x16x1_SN_GSU9_MIWT2_4_NEPBS16_SU4_SUM0_SUS256_WGM0
    SolutionIndex: 40
    SolutionNameMin: Cijk_Alik_Bljk_BBS_BH_UserArgs_MT64x64x64_MI16x16x1_SN_GSU1_MIWT2_2_NEPBS16_SU32_SUM1_SUS1024_WGM16
    SolutionIndex: 41
    SolutionNameMin: Cijk_Alik_Bljk_BBS_BH_UserArgs_MT128x64x128_MI16x16x1_SN_GSU1_MIWT2_4_NEPBS16_SU0_SUM0_SUS0_WGM16
    SolutionIndex: 42
    SolutionNameMin: Cijk_Alik_Bljk_BBS_BH_UserArgs_MT128x64x64_MI16x16x1_SN_GSU1_MIWT8_1_NEPBS16_SU4_SUM0_SUS128_WGM8
    SolutionIndex: 43
    SolutionNameMin: Cijk_Alik_Bljk_BBS_BH_UserArgs_MT160x128x64_MI16x16x1_SN_GSU1_MIWT5_4_NEPBS16_SU16_SUM0_SUS512_WGM8
    SolutionIndex: 44
    SolutionNameMin: Cijk_Alik_Bljk_BBS_BH_UserArgs_MT32x16x128_MI16x16x1_SN_GSU1_MIWT1_1_NEPBS16_SU0_SUM0_SUS0_WGM0
    SolutionIndex: 45
    SolutionNameMin: Cijk_Alik_Bljk_BBS_BH_UserArgs_MT128x48x128_MI16x16x1_SN_GSU7_MIWT2_3_NEPBS16_SU4_SUM1_SUS256_WGM1
    SolutionIndex: 46
    SolutionNameMin: Cijk_Alik_Bljk_BBS_BH_UserArgs_MT128x128x64_MI16x16x1_SN_GSU7_MIWT4_4_NEPBS0_SU4_SUM0_SUS128_WGM0
    SolutionIndex: 47
    SolutionNameMin: Cijk_Alik_Bljk_BBS_BH_UserArgs_MT128x64x64_MI16x16x1_SN_GSU9_MIWT2_4_NEPBS0_SU4_SUM1_SUS128_WGM1
    SolutionIndex: 48
    SolutionNameMin: Cijk_Alik_Bljk_BBS_BH_UserArgs_MT64x64x64_MI16x16x1_SN_GSU1_MIWT2_2_NEPBS0_SU32_SUM0_SUS128_WGM8
    SolutionIndex: 49
    SolutionNameMin: Cijk_Alik_Bljk_BBS_BH_UserArgs_MT64x32x256_MI16x16x1_SN_GSU1_MIWT2_1_NEPBS0_SU0_SUM0_SUS0_WGM16
    SolutionIndex: 50
    SolutionNameMin: Cijk_Alik_Bljk_BBS_BH_UserArgs_MT64x64x128_MI16x16x1_SN_GSU1_MIWT2_2_NEPBS16_SU32_SUM0_SUS512_WGM16
    SolutionIndex: 51
    SolutionNameMin: Cijk_Alik_Bljk_BBS_BH_UserArgs_MT256x128x64_MI16x16x1_SN_GSU1_MIWT4_8_NEPBS0_SU4_SUM0_SUS128_WGM4
    SolutionIndex: 52
    SolutionNameMin: Cijk_Alik_Bljk_BBS_BH_UserArgs_MT128x64x64_MI16x16x1_SN_GSU1_MIWT4_2_NEPBS0_SU8_SUM1_SUS128_WGM16
    SolutionIndex: 53
    SolutionNameMin: Cijk_Alik_Bljk_BBS_BH_UserArgs_MT128x96x64_MI16x16x1_SN_GSU7_MIWT2_6_NEPBS16_SU4_SUM0_SUS128_WGM0
    SolutionIndex: 54
    SolutionNameMin: Cijk_Alik_Bljk_BBS_BH_UserArgs_MT128x128x64_MI16x16x1_SN_GSU1_MIWT8_2_NEPBS0_SU4_SUM1_SUS512_WGM4
    SolutionIndex: 55
    SolutionNameMin: Cijk_Alik_Bljk_BBS_BH_UserArgs_MT128x128x64_MI16x16x1_SN_GSU1_MIWT4_4_NEPBS0_SU4_SUM0_SUS1024_WGM8
    SolutionIndex: 56
    SolutionNameMin: Cijk_Alik_Bljk_BBS_BH_UserArgs_MT64x32x128_MI16x16x1_SN_GSU1_MIWT2_1_NEPBS0_SU4_SUM0_SUS1024_WGM8
    SolutionIndex: 57
    SolutionNameMin: Cijk_Alik_Bljk_BBS_BH_UserArgs_MT128x128x64_MI16x16x1_SN_GSU5_MIWT4_4_NEPBS0_SU8_SUM0_SUS128_WGM0
    SolutionIndex: 58
    SolutionNameMin: Cijk_Alik_Bljk_BBS_BH_UserArgs_MT64x32x128_MI16x16x1_SN_GSU1_MIWT1_2_NEPBS16_SU0_SUM0_SUS0_WGM8
    SolutionIndex: 59
    SolutionNameMin: Cijk_Alik_Bljk_BBS_BH_UserArgs_MT128x64x64_MI16x16x1_SN_GSU1_MIWT2_4_NEPBS0_SU16_SUM1_SUS1024_WGM8
    SolutionIndex: 60
    SolutionNameMin: Cijk_Alik_Bljk_BBS_BH_UserArgs_MT64x64x128_MI16x16x1_SN_GSU1_MIWT2_2_NEPBS0_SU0_SUM0_SUS0_WGM4
    SolutionIndex: 61
    SolutionNameMin: Cijk_Alik_Bljk_BBS_BH_UserArgs_MT128x64x128_MI16x16x1_SN_GSU1_MIWT2_4_NEPBS0_SU4_SUM0_SUS512_WGM32
    SolutionIndex: 62
    SolutionNameMin: Cijk_Alik_Bljk_BBS_BH_UserArgs_MT256x224x64_MI16x16x1_SN_GSU1_MIWT8_7_NEPBS16_SU4_SUM1_SUS128_WGM4
    SolutionIndex: 63
    SolutionNameMin: Cijk_Alik_Bljk_BBS_BH_UserArgs_MT32x16x256_MI16x16x1_SN_GSU1_MIWT1_1_NEPBS16_SU0_SUM0_SUS0_WGM0
    SolutionIndex: 64
    SolutionNameMin: Cijk_Alik_Bljk_BBS_BH_Bias_AS_SAV_UserArgs_MT64x128x64_MI16x16x1_SN_GSU1_LBSPPA512_LPA16_LPB16_LRVW8_MIWT4_2_SU32_SUM1_SUS128_SVW4_VWA4_WG16_16_1_WGM8
    SolutionIndex: 65
    SolutionNameMin: Cijk_Alik_Bljk_BBS_BH_Bias_AS_SAB_SAV_UserArgs_MT32x16x512_MI16x16x1_SN_LDSB1_GSU1_GSUAMB_LBSPPA1024_LBSPPB1024_MIWT1_1_NTA7_NTD0_NEPBS0_SS0_SU8_SUM0_SUS1024_SVW4_VWA1_WG32_4_1_WGM0
    SolutionIndex: 66
    SolutionNameMin: Cijk_Alik_Bljk_BBS_BH_Bias_AS_SAB_SAV_UserArgs_MT32x16x512_MI16x16x1_SN_LDSB1_GSU1_GSUAMBSK_LBSPPA1024_LBSPPB1024_MIWT1_1_NTA7_NTD0_NEPBS16_SS0_SU0_SUM0_SUS0_SVW4_VWA1_WG32_4_1_WGM1
    SolutionIndex: 67
    SolutionNameMin: Cijk_Alik_Bljk_BBS_BH_Bias_AS_SAB_SAV_UserArgs_MT32x16x512_MI16x16x1_SN_LDSB1_GSU1_GSUAMB_LBSPPA1024_LBSPPB1024_MIWT1_1_NTA7_NTD0_NEPBS0_SS0_SU0_SUM0_SUS0_SVW4_VWA1_WG32_4_1_WGM1
    SolutionIndex: 68
    SolutionNameMin: Cijk_Alik_Bljk_BBS_BH_Bias_AS_SAB_SAV_UserArgs_MT128x48x128_MI16x16x1_SN_LDSB1_GSU8_GSUAMB_LBSPPA512_LBSPPB256_MIWT2_3_NTA7_NTD7_NEPBS0_SS1_SU8_SUM1_SUS256_SVW2_VWA2_WG64_4_1_WGM0
    SolutionIndex: 69
    SolutionNameMin: Cijk_Alik_Bljk_BBS_BH_Bias_AS_SAB_SAV_UserArgs_MT128x64x128_MI16x16x1_SN_LDSB1_GSU8_GSUAMB_LBSPPA1024_LBSPPB256_MIWT4_2_NTA0_NTD7_NEPBS0_SS1_SU8_SUM1_SUS256_SVW4_VWA4_WG32_8_1_WGM0
    SolutionIndex: 70
    SolutionNameMin: Cijk_Alik_Bljk_BBS_BH_Bias_AS_SAB_SAV_UserArgs_MT128x96x128_MI16x16x1_SN_LDSB1_GSU8_GSUAMB_LBSPPA512_LBSPPB256_MIWT2_6_NTA0_NTD7_NEPBS0_SS1_SU0_SUM0_SUS0_SVW2_VWA2_WG64_4_1_WGM1
    SolutionIndex: 71
    SolutionNameMin: Cijk_Alik_Bljk_BBS_BH_Bias_AS_SAB_SAV_UserArgs_MT16x16x256_MI16x16x1_SN_LDSB1_GSU8_GSUAMBSK_LBSPPA512_LBSPPB512_MIWT1_1_NTA7_NTD0_NEPBS0_SS0_SU0_SUM0_SUS0_SVW4_VWA1_WG16_4_1_WGM0
    SolutionIndex: 72
    SolutionNameMin: Cijk_Alik_Bljk_BBS_BH_Bias_AS_SAB_SAV_UserArgs_MT64x16x256_MI16x16x1_SN_LDSB1_GSU8_GSUAMBSK_LBSPPA1024_LBSPPB512_MIWT2_1_NTA0_NTD0_NEPBS0_SS0_SU0_SUM0_SUS0_SVW8_VWA2_WG32_4_1_WGM1
    SolutionIndex: 73
    SolutionNameMin: Cijk_Alik_Bljk_BBS_BH_Bias_AS_SAB_SAV_UserArgs_MT64x32x256_MI16x16x1_SN_LDSB1_GSU8_GSUAMB_LBSPPA1024_LBSPPB512_MIWT2_2_NTA7_NTD7_NEPBS16_SS1_SU0_SUM0_SUS0_SVW2_VWA2_WG32_4_1_WGM0
    SolutionIndex: 74
    SolutionNameMin: Cijk_Alik_Bljk_BBS_BH_Bias_AS_SAB_SAV_UserArgs_MT64x64x128_MI16x16x1_SN_LDSB1_GSU8_GSUAMB_LBSPPA512_LBSPPB256_MIWT2_2_NTA7_NTD7_NEPBS0_SS1_SU8_SUM1_SUS256_SVW2_VWA2_WG32_8_1_WGM1
    SolutionIndex: 75
    SolutionNameMin: Cijk_Alik_Bljk_BBS_BH_Bias_AS_SAB_SAV_UserArgs_MT128x48x128_MI16x16x1_SN_LDSB1_GSU8_GSUAMB_LBSPPA512_LBSPPB256_MIWT2_3_NTA0_NTD7_NEPBS0_SS1_SU8_SUM1_SUS256_SVW2_VWA2_WG64_4_1_WGM0
    SolutionIndex: 76
    SolutionNameMin: Cijk_Alik_Bljk_BBS_BH_Bias_AS_SAB_SAV_UserArgs_MT32x16x512_MI16x16x1_SN_LDSB1_GSU1_GSUAMBSK_LBSPPA1024_LBSPPB1024_MIWT1_1_NTA7_NTD0_NEPBS16_SS1_SU8_SUM1_SUS1024_SVW1_VWA1_WG32_4_1_WGM0
    SolutionIndex: 77
    SolutionNameMin: Cijk_Alik_Bljk_BBS_BH_Bias_AS_SAB_SAV_UserArgs_MT32x16x512_MI16x16x1_SN_LDSB1_GSU1_GSUAMBSK_LBSPPA1024_LBSPPB1024_MIWT1_1_NTA7_NTD0_NEPBS16_SS0_SU8_SUM1_SUS1024_SVW4_VWA1_WG32_4_1_WGM1
    SolutionIndex: 78
    SolutionNameMin: Cijk_Alik_Bljk_BBS_BH_Bias_AS_SAB_SAV_UserArgs_MT32x16x512_MI16x16x1_SN_LDSB1_GSU1_GSUAMBSK_LBSPPA1024_LBSPPB1024_MIWT1_1_NTA7_NTD0_NEPBS0_SS0_SU8_SUM1_SUS1024_SVW4_VWA1_WG32_4_1_WGM1
    SolutionIndex: 79
    SolutionNameMin: Cijk_Alik_Bljk_BBS_BH_Bias_AS_SAB_SAV_UserArgs_MT32x16x512_MI16x16x1_SN_LDSB1_GSU1_GSUAMBSK_LBSPPA1024_LBSPPB1024_MIWT1_1_NTA7_NTD0_NEPBS16_SS1_SU0_SUM0_SUS0_SVW1_VWA1_WG32_4_1_WGM0
    SolutionIndex: 80
    SolutionNameMin: Cijk_Alik_Bljk_BBS_BH_Bias_AS_SAB_SAV_UserArgs_MT64x32x256_MI16x16x1_SN_LDSB1_GSU1_GSUAMBSK_LBSPPA1024_LBSPPB512_MIWT2_1_NTA7_NTD0_NEPBS16_SS1_SU8_SUM1_SUS512_SVW2_VWA2_WG32_8_1_WGM1
    SolutionIndex: 81
    SolutionNameMin: Cijk_Alik_Bljk_BBS_BH_Bias_AS_SAB_SAV_UserArgs_MT64x64x128_MI16x16x1_SN_LDSB1_GSU1_GSUAMBSK_LBSPPA1024_LBSPPB256_MIWT4_1_NTA0_NTD7_NEPBS0_SS1_SU8_SUM1_SUS256_SVW4_VWA4_WG16_16_1_WGM1
    SolutionIndex: 82
    SolutionNameMin: Cijk_Alik_Bljk_BBS_BH_Bias_AS_SAB_SAV_UserArgs_MT128x48x128_MI16x16x1_SN_LDSB1_GSU1_GSUAMBSK_LBSPPA512_LBSPPB256_MIWT2_3_NTA0_NTD7_NEPBS16_SS1_SU8_SUM0_SUS256_SVW2_VWA2_WG64_4_1_WGM1
    SolutionIndex: 83
    SolutionNameMin: Cijk_Alik_Bljk_BBS_BH_Bias_AS_SAB_SAV_UserArgs_MT64x32x256_MI16x16x1_SN_LDSB1_GSU1_GSUAMBSK_LBSPPA1024_LBSPPB512_MIWT2_2_NTA7_NTD0_NEPBS16_SS1_SU8_SUM1_SUS512_SVW2_VWA2_WG32_4_1_WGM0
    SolutionIndex: 84
    SolutionNameMin: Cijk_Alik_Bljk_BBS_BH_Bias_AS_SAB_SAV_UserArgs_MT32x16x512_MI16x16x1_SN_LDSB1_GSU1_GSUAMBSK_LBSPPA1024_LBSPPB1024_MIWT1_1_NTA7_NTD7_NEPBS0_SS0_SU8_SUM1_SUS1024_SVW4_VWA1_WG32_4_1_WGM0
    SolutionIndex: 85
    SolutionNameMin: Cijk_Alik_Bljk_BBS_BH_Bias_AS_SAB_SAV_UserArgs_MT32x16x512_MI16x16x1_SN_LDSB1_GSU1_GSUAMBSK_LBSPPA1024_LBSPPB1024_MIWT1_1_NTA7_NTD0_NEPBS0_SS0_SU8_SUM0_SUS1024_SVW4_VWA1_WG32_4_1_WGM0
    SolutionIndex: 86
    SolutionNameMin: Cijk_Alik_Bljk_BBS_BH_Bias_AS_SAB_SAV_UserArgs_MT32x16x512_MI16x16x1_SN_LDSB1_GSU1_GSUAMBSK_LBSPPA1024_LBSPPB1024_MIWT1_1_NTA7_NTD0_NEPBS0_SS0_SU0_SUM0_SUS0_SVW4_VWA1_WG32_4_1_WGM0
    SolutionIndex: 87
    SolutionNameMin: Cijk_Alik_Bljk_BBS_BH_Bias_AS_SAB_SAV_UserArgs_MT32x16x512_MI16x16x1_SN_LDSB1_GSU1_GSUAMBSK_LBSPPA1024_LBSPPB1024_MIWT1_1_NTA7_NTD0_NEPBS16_SS0_SU8_SUM0_SUS1024_SVW4_VWA1_WG32_4_1_WGM0
    SolutionIndex: 88
    SolutionNameMin: Cijk_Alik_Bljk_BBS_BH_Bias_AS_SAB_SAV_UserArgs_MT64x32x256_MI16x16x1_SN_LDSB1_GSU1_GSUAMBSK_LBSPPA1024_LBSPPB512_MIWT2_2_NTA7_NTD0_NEPBS0_SS0_SU8_SUM1_SUS512_SVW8_VWA2_WG32_4_1_WGM1
    SolutionIndex: 89
    SolutionNameMin: Cijk_Alik_Bljk_BBS_BH_Bias_AS_SAB_SAV_UserArgs_MT64x48x128_MI16x16x1_SN_LDSB0_GSU1_GSUAMB_LBSPPA512_LBSPPB256_MIWT2_3_NTA0_NTD7_NEPBS0_SS0_SU8_SUM0_SUS256_SVW8_VWA2_WG32_4_1_WGM0
    SolutionIndex: 90
    SolutionNameMin: Cijk_Alik_Bljk_BBS_BH_Bias_AS_SAV_UserArgs_MT16x16x256_MI16x16x1_SN_LDSB1_GRVWA8_GRVWB8_GSU6_GSUAMBSK_LBSPPA512_LBSPPB512_MIWT1_1_NTA7_SS0_SU8_SUM0_SUS512_SVW4_WG16_4_1_WGM8
    SolutionIndex: 91
    SolutionNameMin: Cijk_Alik_Bljk_BBS_BH_Bias_AS_SAV_UserArgs_MT32x16x256_MI16x16x1_SN_GSU1_MIWT1_1_NTA7_SU32_SUM1_SUS512_WGM8
    SolutionIndex: 92
    SolutionNameMin: Cijk_Alik_Bljk_BBS_BH_Bias_AS_SAV_UserArgs_MT32x16x256_MI16x16x1_SN_GSU1_MIWT1_1_NTA4_SU32_SUM1_SUS512_WGM8
    SolutionIndex: 93
    SolutionNameMin: Cijk_Alik_Bljk_BBS_BH_Bias_AS_SAV_UserArgs_MT128x64x128_MI16x16x1_SN_LDSB1_GSU5_GSUAMB_LBSPPA1024_LBSPPB256_MIWT4_2_NTA4_NEPBS16_SU0_SUM0_SUS0_SVW4_VWA4_WG32_8_1_WGM8
    SolutionIndex: 94
    SolutionNameMin: Cijk_Alik_Bljk_BBS_BH_Bias_AS_SAV_UserArgs_MT128x96x128_MI16x16x1_SN_LDSB1_GSU5_GSUAMB_LBSPPA512_LBSPPB256_MIWT2_6_NTA4_NEPBS16_SU0_SUM0_SUS0_SVW2_VWA2_WG64_4_1_WGM8
    SolutionIndex: 95
    SolutionNameMin: Cijk_Alik_Bljk_BBS_BH_Bias_AS_SAV_UserArgs_MT64x32x256_MI16x16x1_SN_LDSB1_GRVWA8_GRVWB8_GSU1_LBSPPA1024_LBSPPB512_LPA16_LPB16_LRVW8_MIWT2_2_NTA7_NTD7_SS1_SU8_SUM1_SUS512_SVW2_VWA2_WG32_4_2_WGM0
- - - [2048, 64896, 1, 512]
    - [0, 492142.0]
  - - [2048, 17556, 1, 512]
    - [64, 0.0]
  - - [512, 14, 1, 256]
    - [1, 0.0]
  - - [2048, 16302, 1, 512]
    - [64, 0.0]
  - - [512, 13, 1, 256]
    - [2, 0.0]
  - - [8192, 3500, 1, 2048]
    - [3, 0.0]
  - - [512, 3500, 1, 512]
    - [4, 0.0]
  - - [2048, 17052, 1, 512]
    - [64, 0.0]
  - - [262144, 13, 1, 256]
    - [5, 0.0]
  - - [256, 14, 1, 2560]
    - [6, 0.0]
  - - [262144, 14, 1, 256]
    - [7, 0.0]
  - - [8192, 3250, 1, 2048]
    - [8, 0.0]
  - - [256, 13, 1, 2560]
    - [9, 0.0]
  - - [512, 3250, 1, 512]
    - [10, 0.0]
  - - [256, 14, 1, 256]
    - [11, 0.0]
  - - [2048, 1024, 1, 5560]
    - [12, 0.0]
  - - [1, 1024, 1, 256]
    - [13, 0.0]
  - - [512, 1024, 1, 5744]
    - [14, 0.0]
  - - [128, 1024, 1, 10624]
    - [15, 0.0]
  - - [512, 1024, 1, 5560]
    - [16, 0.0]
  - - [1024, 1024, 1, 3840]
    - [17, 0.0]
  - - [1024, 1024, 1, 2872]
    - [18, 0.0]
  - - [2872, 1024, 1, 512]
    - [19, 0.0]
  - - [1, 1024, 1, 128]
    - [20, 0.0]
  - - [128, 1024, 1, 7040]
    - [21, 0.0]
  - - [128, 1024, 1, 4416]
    - [22, 0.0]
  - - [128, 1024, 1, 6784]
    - [23, 0.0]
  - - [512, 1024, 1, 2872]
    - [24, 0.0]
  - - [256, 1024, 1, 4608]
    - [25, 0.0]
  - - [512, 1024, 1, 3072]
    - [26, 0.0]
  - - [5560, 1024, 1, 2780]
    - [27, 0.0]
  - - [2780, 1024, 1, 5560]
    - [28, 0.0]
  - - [512, 16, 1, 256]
    - [1, 0.0]
  - - [512, 32, 1, 256]
    - [1, 0.0]
  - - [8192, 4000, 1, 2048]
    - [29, 0.0]
  - - [512, 4000, 1, 512]
    - [30, 0.0]
  - - [8192, 8000, 1, 2048]
    - [31, 0.0]
  - - [512, 8000, 1, 512]
    - [32, 0.0]
  - - [262144, 16, 1, 256]
    - [33, 0.0]
  - - [256, 16, 1, 2560]
    - [9, 0.0]
  - - [262144, 32, 1, 256]
    - [34, 0.0]
  - - [256, 32, 1, 2560]
    - [35, 0.0]
  - - [256, 13, 1, 256]
    - [36, 0.0]
  - - [2048, 2048, 1, 5560]
    - [37, 0.0]
  - - [1, 2048, 1, 256]
    - [20, 0.0]
  - - [512, 2048, 1, 5744]
    - [38, 0.0]
  - - [128, 2048, 1, 10624]
    - [39, 0.0]
  - - [512, 2048, 1, 5560]
    - [40, 0.0]
  - - [1024, 2048, 1, 3840]
    - [41, 0.0]
  - - [1024, 2048, 1, 2872]
    - [42, 0.0]
  - - [2872, 2048, 1, 512]
    - [43, 0.0]
  - - [1, 2048, 1, 128]
    - [44, 0.0]
  - - [128, 2048, 1, 7040]
    - [45, 0.0]
  - - [128, 2048, 1, 4416]
    - [46, 0.0]
  - - [128, 2048, 1, 6784]
    - [47, 0.0]
  - - [512, 2048, 1, 2872]
    - [48, 0.0]
  - - [256, 2048, 1, 4608]
    - [49, 0.0]
  - - [512, 2048, 1, 3072]
    - [50, 0.0]
  - - [2048, 4096, 1, 5560]
    - [51, 0.0]
  - - [1, 4096, 1, 256]
    - [20, 0.0]
  - - [512, 4096, 1, 5744]
    - [52, 0.0]
  - - [128, 4096, 1, 10624]
    - [53, 0.0]
  - - [512, 4096, 1, 5560]
    - [64, 0.0]
  - - [1024, 4096, 1, 3840]
    - [54, 0.0]
  - - [1024, 4096, 1, 2872]
    - [55, 0.0]
  - - [2872, 4096, 1, 512]
    - [64, 0.0]
  - - [1, 4096, 1, 128]
    - [13, 0.0]
  - - [128, 4096, 1, 7040]
    - [56, 0.0]
  - - [128, 4096, 1, 4416]
    - [57, 0.0]
  - - [128, 4096, 1, 6784]
    - [58, 0.0]
  - - [512, 4096, 1, 2872]
    - [59, 0.0]
  - - [256, 4096, 1, 4608]
    - [60, 0.0]
  - - [512, 4096, 1, 3072]
    - [61, 0.0]
  - - [2048, 152710, 1, 512]
    - [62, 0.0]
  - - [256, 16, 1, 256]
    - [63, 0.0]
  - - [256, 32, 1, 256]
    - [2, 0.0]
  - - [4000, 2, 1, 8192]
    - [65, 0.0]
  - - [4000, 4, 1, 8192]
    - [65, 0.0]
  - - [4000, 8, 1, 8192]
    - [66, 0.0]
  - - [4000, 16, 1, 8192]
    - [67, 0.0]
  - - [4000, 32, 1, 8192]
    - [68, 0.0]
  - - [4000, 64, 1, 8192]
    - [69, 0.0]
  - - [4000, 96, 1, 8192]
    - [70, 0.0]
  - - [1280, 2, 1, 8192]
    - [71, 0.0]
  - - [1280, 16, 1, 8192]
    - [72, 0.0]
  - - [1280, 32, 1, 8192]
    - [73, 0.0]
  - - [1280, 64, 1, 8192]
    - [74, 0.0]
  - - [1280, 96, 1, 8192]
    - [75, 0.0]
  - - [8192, 2, 1, 1024]
    - [76, 0.0]
  - - [8192, 4, 1, 1024]
    - [77, 0.0]
  - - [8192, 8, 1, 1024]
    - [78, 0.0]
  - - [8192, 16, 1, 1024]
    - [79, 0.0]
  - - [8192, 32, 1, 1024]
    - [80, 0.0]
  - - [8192, 64, 1, 1024]
    - [81, 0.0]
  - - [8192, 96, 1, 1024]
    - [82, 0.0]
  - - [7168, 32, 1, 8192]
    - [83, 0.0]
  - - [8192, 2, 1, 3584]
    - [84, 0.0]
  - - [8192, 4, 1, 3584]
    - [85, 0.0]
  - - [8192, 8, 1, 3584]
    - [86, 0.0]
  - - [8192, 16, 1, 3584]
    - [87, 0.0]
  - - [8192, 32, 1, 3584]
    - [88, 0.0]
  - - [8192, 96, 1, 3584]
    - [89, 0.0]
  - - [1280, 4, 1, 8192]
    - [90, 0.0]
  - - [1280, 8, 1, 8192]
    - [90, 0.0]
  - - [7168, 2, 1, 8192]
    - [91, 0.0]
  - - [7168, 4, 1, 8192]
    - [92, 0.0]
  - - [7168, 8, 1, 8192]
    - [92, 0.0]
  - - [7168, 16, 1, 8192]
    - [92, 0.0]
  - - [7168, 64, 1, 8192]
    - [93, 0.0]
  - - [7168, 96, 1, 8192]
    - [94, 0.0]
  - - [8192, 64, 1, 3584]
    - [95, 0.0]
- null
- null
- DeviceEfficiency
- Equality
