library/src/amd_detail/rocblaslt/src/Tensile/Logic/asm_full/aquavanjaram/gfx942/Equality/aquavanjaram_Cijk_Ailk_Bljk_SB_UserArgs.yaml
- {MinimumRequiredVersion: 4.33.0}
- aquavanjaram
- gfx942
- [Device 0049, Device 0050]
    SolutionIndex: 0
    SolutionNameMin: Cijk_Ailk_Bljk_SB_UserArgs_MT128x128x32_MI16x16x1_SN_GRVWA4_GRVWB4_GSU1_LBSPPA2048_LBSPPB128_LPA0_LPB8_LRVW4_MIWT4_4_NLCA1_SU4_SUM0_SUS256_SVW4_VWA4_WG32_8_1_WGM16
    SolutionIndex: 1
    SolutionNameMin: Cijk_Ailk_Bljk_SB_UserArgs_MT256x144x32_MI16x16x1_SN_GRVWA4_GRVWB2_GSU1_LBSPPA4096_LBSPPB128_LPA0_LPB8_LRVW4_MIWT4_9_NLCA1_SU0_SUM0_SUS0_SVW4_VWA4_WG64_4_1_WGM0
    SolutionIndex: 2
    SolutionNameMin: Cijk_Ailk_Bljk_SB_UserArgs_MT256x224x32_MI16x16x1_SN_GRVWA4_GRVWB2_GSU1_LBSPPA2048_LBSPPB128_LPA0_LPB2_LRVW2_MIWT4_14_NLCA1_SU4_SUM0_SUS256_SVW4_VWA4_WG64_4_1_WGM8
    SolutionIndex: 3
    SolutionNameMin: Cijk_Ailk_Bljk_SB_UserArgs_MT128x256x32_MI16x16x1_SN_GRVWA4_GRVWB4_GSU1_LBSPPA2048_LBSPPB128_LPA0_LPB8_LRVW4_MIWT4_8_NLCA1_SU0_SUM0_SUS0_SVW4_VWA4_WG32_8_1_WGM40
    SolutionIndex: 4
    SolutionNameMin: Cijk_Ailk_Bljk_SB_UserArgs_MT32x32x64_MI16x16x1_SN_GRVWA4_GRVWB4_GSU1_LBSPPA512_LBSPPB256_LPA16_LPB8_LRVW4_MIWT1_1_NLCA1_SU0_SUM0_SUS0_SVW1_VWA1_WG32_8_1_WGM0
    SolutionIndex: 5
    SolutionNameMin: Cijk_Ailk_Bljk_SB_UserArgs_MT64x64x64_MI16x16x1_SN_GRVWA4_GRVWB4_GSU1_LBSPPA1024_LBSPPB256_LPA0_LPB8_LRVW4_MIWT2_2_NLCA1_SU8_SUM0_SUS256_SVW2_VWA2_WG32_8_1_WGM0
    SolutionIndex: 6
    SolutionNameMin: Cijk_Ailk_Bljk_SB_UserArgs_MT64x32x16_MI16x16x1_SN_GRVWB2_GSU1_GSUC1_GSUWGMRR0_K1_LBSPPA512_LPB2_LRVW2_MIWT2_1_SU4_SUM0_SUS256_WG32_8_1_WGM8_WGMXCC1_WGMXCCGn1
    SolutionIndex: 7
    SolutionNameMin: Cijk_Ailk_Bljk_SB_UserArgs_MT48x64x16_MI16x16x1_SN_GSU1_GSUC0_GSUWGMRR0_K1_MIWT3_1_SU4_SUM0_SUS256_WGM8_WGMXCC1_WGMXCCGn1
    SolutionIndex: 8
    SolutionNameMin: Cijk_Ailk_Bljk_SB_UserArgs_MT64x32x16_MI16x16x1_SN_GRVWB2_GSU1_GSUC0_GSUWGMRR0_K1_LBSPPA512_LPB2_LRVW2_MIWT2_1_SU4_SUM0_SUS256_WG32_8_1_WGM8_WGMXCC1_WGMXCCGn1
    SolutionIndex: 9
    SolutionNameMin: Cijk_Ailk_Bljk_SB_UserArgs_MT16x64x16_MI16x16x1_SN_GSU1_GSUC0_GSUWGMRR0_K1_MIWT1_1_NTA0_NTB0_NTD0_NEPBS16_SU0_SUM0_SUS0_WGM1_WGMXCC1_WGMXCCG0
    SolutionIndex: 10
    SolutionNameMin: Cijk_Ailk_Bljk_SB_UserArgs_MT16x64x16_MI16x16x1_SN_GRVWA1_GRVWB2_GSU1_GSUC0_GSUWGMRR0_K1_LBSPPA128_LPB2_LRVW2_MIWT1_1_NTA0_NTB0_NTD0_NEPBS0_SU8_SUM0_SUS64_WGM1_WGMXCC8_WGMXCCG0
    SolutionIndex: 11
    SolutionNameMin: Cijk_Ailk_Bljk_SB_UserArgs_MT16x256x16_MI16x16x1_SN_GSU1_GSUC0_GSUWGMRR1_K1_MIWT1_4_SU4_SUM0_SUS256_WGM8_WGMXCC1_WGMXCCGn1
- - - [512, 512, 1, 512]
    - [4, 0.0]
  - - [1024, 1024, 1, 1024]
    - [5, 0.0]
  - - [2048, 2048, 1, 2048]
    - [0, 0.0]
  - - [4096, 4096, 1, 4096]
    - [2, 0.0]
  - - [4096, 4096, 1, 8192]
    - [2, 0.0]
  - - [4864, 4096, 1, 8192]
    - [3, 0.0]
  - - [8192, 8192, 1, 8192]
    - [1, 0.0]
  - - [64, 32, 2048, 200]
    - [6, 0.0]
  - - [48, 24, 2048, 200]
    - [7, 0.0]
  - - [48, 24, 2048, 100]
    - [8, 0.0]
  - - [1, 2048, 1, 2]
    - [9, 0.0]
  - - [1, 2048, 1, 33]
    - [10, 0.0]
  - - [5, 707, 2048, 160]
    - [11, 0.0]
- null
- null
- DeviceEfficiency
- Equality
