library/src/amd_detail/rocblaslt/src/Tensile/Logic/asm_full/aquavanjaram/gfx942/Equality/aquavanjaram_Cijk_Alik_Bljk_HHS_BH_UserArgs.yaml
- {MinimumRequiredVersion: 4.33.0}
- aquavanjaram
- gfx942
- [Device 0049, Device 0050]
    SolutionIndex: 0
    SolutionNameMin: Cijk_Alik_Bljk_HHS_BH_MT128x128x64_MI32x32x1_SN_LDSB1_GRVWB8_GSU1_LBSPPA256_LBSPPB128_LPA8_LPB8_LRVW8_MIWT2_2_SVW2_VWA2_WG64_4_1
    SolutionIndex: 1
    SolutionNameMin: Cijk_Alik_Bljk_HHS_BH_MT128x64x64_MI16x16x1_SN_LDSB1_GRVWB8_GSU1_LBSPPA256_LBSPPB128_LPA16_LPB16_LRVW8_MIWT2_4_SVW2_VWA2_WG64_4_1
    SolutionIndex: 2
    SolutionNameMin: Cijk_Alik_Bljk_HHS_BH_MT256x224x64_MI16x16x1_SN_LDSB1_GRVWB4_GSU1_LBSPPA512_LBSPPB128_LPA8_LPB4_LRVW4_MIWT4_14_SVW4_VWA4_WG64_4_1
    SolutionIndex: 3
    SolutionNameMin: Cijk_Alik_Bljk_HHS_BH_MT128x64x128_MI16x16x1_SN_LDSB1_GRVWB8_GSU1_LBSPPA512_LBSPPB256_LPA16_LPB16_LRVW8_MIWT2_4_SVW2_VWA2_WG64_4_1
    SolutionIndex: 4
    SolutionNameMin: Cijk_Alik_Bljk_HHS_BH_MT256x256x32_MI32x32x1_SN_GSU1_LBSPPA256_LBSPPB256_MIWT4_4_VWA4_VWB4_WSGRA1_WSGRB1_WG64_4_1_WGM8
    SolutionIndex: 5
    SolutionNameMin: Cijk_Alik_Bljk_HHS_BH_MT256x192x64_MI16x16x1_SN_GSU1_LBSPPA512_LBSPPB128_LPA16_LPB8_MIWT8_6_SVW4_VWA4_VWB2_WG32_8_1_WGM1
    SolutionIndex: 6
    SolutionNameMin: Cijk_Alik_Bljk_HHS_BH_MT192x256x64_MI16x16x1_SN_GSU1_LBSPPA256_LBSPPB256_LPA16_LPB8_MIWT6_8_SVW2_VWA2_VWB4_WG32_8_1_WGM8
    SolutionIndex: 7
    SolutionNameMin: Cijk_Alik_Bljk_HHS_BH_MT192x256x64_MI16x16x1_SN_GSU1_LBSPPA256_LBSPPB256_LPA16_LPB8_MIWT6_8_SVW2_VWA2_VWB4_WG32_8_1_WGM1
    SolutionIndex: 8
    SolutionNameMin: Cijk_Alik_Bljk_HHS_BH_MT192x256x64_MI16x16x1_SN_GSU1_LBSPPA128_LBSPPB512_LPA8_LPB16_MIWT6_8_SVW2_VWA2_VWB4_WG32_8_1_WGM8
    SolutionIndex: 9
    SolutionNameMin: Cijk_Alik_Bljk_HHS_BH_MT192x256x64_MI16x16x1_SN_GRVWA4_GRVWB8_GSU1_LBSPPA512_LBSPPB128_LPA4_LPB8_LRVW4_MIWT12_4_MO40_SVW4_VWA4_VWB1_WG16_16_1_WGM8
    SolutionIndex: 10
    SolutionNameMin: Cijk_Alik_Bljk_HHS_BH_UserArgs_MT256x224x64_MI16x16x1_SN_GRVWA8_GRVWB2_GSU1_LBSPPA1024_LPA8_LPB4_LRVW4_MIWT8_7_NTC4_NTD4_SU8_SUM0_SUS256_SSO0_SVW8_VWA8_WG32_8_1_WGM16_WGMXCC4
    SolutionIndex: 11
    SolutionNameMin: Cijk_Alik_Bljk_HHS_BH_UserArgs_MT256x224x64_MI16x16x1_SN_GRVWA2_GRVWB2_GSU1_LBSPPA256_LPA4_LPB4_LRVW4_MIWT8_7_SU8_SUM0_SUS256_SSO0_SVW2_VWA2_WG32_8_1_WGM32
    SolutionIndex: 12
    SolutionNameMin: Cijk_Alik_Bljk_HHS_BH_UserArgs_MT32x16x256_MI16x16x1_SN_GRVWA8_GRVWB8_GSU1_LBSPPA512_LBSPPB512_LPA16_LPB16_LRVW8_MIWT1_1_NTA4_NTC0_NTD0_SU0_SUM0_SUS0_SVW1_VWA1_WG32_4_1_WGM1
    SolutionIndex: 13
    SolutionNameMin: Cijk_Alik_Bljk_HHS_BH_UserArgs_MT16x16x256_MI16x16x1_SN_LDSB0_GRVWA8_GRVWB8_GSU26_LBSPPA512_LBSPPB512_MIWT1_1_NLCA1_NLCB1_SU0_SUM0_SUS0_WG16_4_4_WGM1
    SolutionIndex: 14
    SolutionNameMin: Cijk_Alik_Bljk_HHS_BH_UserArgs_MT112x128x64_MI16x16x1_SN_GRVWA2_GRVWB8_GSU1_GSUC1_LBSPPA128_LBSPPB256_LPA16_LPB16_LRVW8_MIWT7_2_NTA0_SU8_SUM0_SUS256_SVW1_VWA1_VWB2_WG16_16_1_WGM1
    SolutionIndex: 15
    SolutionNameMin: Cijk_Alik_Bljk_HHS_BH_UserArgs_MT16x192x128_MI16x16x1_SN_GRVWA8_GRVWB8_GSU7_LBSPPA256_LBSPPB256_LPA16_LPB16_LRVW8_MIWT1_3_NTB4_NLCA1_NLCB1_SU0_SUM0_SUS0_SVW1_VWA1_VWB1_WG16_16_1_WGM1
    SolutionIndex: 16
    SolutionNameMin: Cijk_Alik_Bljk_HHS_BH_UserArgs_MT32x96x128_MI16x16x1_SN_GRVWA8_GRVWB8_GSU1_LBSPPA256_LBSPPB256_LPA16_LPB16_LRVW8_MIWT1_3_NTA0_SS0_SU8_SUM0_SUS256_SVW4_VWA1_VWB1_WG32_8_1_WGM8
    SolutionIndex: 17
    SolutionNameMin: Cijk_Alik_Bljk_HHS_BH_UserArgs_MT128x256x64_MI16x16x1_SN_GRVWA8_GRVWB2_GSU1_LBSPPA512_LBSPPB512_LPA16_LPB16_LRVW8_MIAV0_MIWT8_4_SS1_SU8_SUM0_SUS256_SVW4_VWA4_VWB4_WG16_16_1_WGM32
    SolutionIndex: 18
    SolutionNameMin: Cijk_Alik_Bljk_HHS_BH_UserArgs_MT256x224x32_MI16x16x1_SN_GRVWA8_GRVWB2_GSU1_LBSPPA256_LBSPPB128_LPA8_LPB4_LRVW4_MIAV0_MIWT4_14_SS1_SU0_SUM0_SUS0_SVW4_VWA4_VWB2_WG64_4_1_WGM1
    SolutionIndex: 19
    SolutionNameMin: Cijk_Alik_Bljk_HHS_BH_UserArgs_MT128x256x64_MI16x16x1_SN_GRVWA8_GRVWB8_GSU1_LBSPPA512_LBSPPB256_LPA16_LPB16_LRVW8_MIAV0_MIWT8_4_SS1_SU8_SUM0_SUS256_SVW4_VWA4_VWB2_WG16_16_1_WGM32
    SolutionIndex: 20
    SolutionNameMin: Cijk_Alik_Bljk_HHS_BH_UserArgs_MT128x16x128_MI16x16x1_SN_GRVWA8_GRVWB8_GSU1_LBSPPA2048_LBSPPB256_MIWT8_1_NTA0_NLCA1_NLCB1_SS1_SU8_SUM0_SUS256_SVW8_VWA8_WG16_4_4_WGM8
    SolutionIndex: 21
    SolutionNameMin: Cijk_Alik_Bljk_HHS_BH_UserArgs_MT64x16x128_MI16x16x1_SN_GRVWA8_GRVWB8_GSU1_LBSPPA512_LBSPPB256_MIWT2_1_NTA0_NLCA1_NLCB1_SS1_SU0_SUM0_SUS0_SVW2_VWA2_WG32_4_2_WGM16
    SolutionIndex: 22
    SolutionNameMin: Cijk_Alik_Bljk_HHS_BH_UserArgs_MT128x16x128_MI16x16x1_SN_GRVWA8_GRVWB8_GSU1_LBSPPA2048_LBSPPB256_MIWT8_1_NTA0_NLCA1_NLCB1_SS1_SU0_SUM0_SUS0_SVW8_VWA8_WG16_4_4_WGM16
    SolutionIndex: 23
    SolutionNameMin: Cijk_Alik_Bljk_HHS_BH_UserArgs_MT64x16x128_MI16x16x1_SN_GRVWA8_GRVWB2_GSU1_LBSPPA512_LBSPPB256_MIWT2_1_NTA0_NLCA1_NLCB1_SS1_SU8_SUM0_SUS256_SVW2_VWA2_WG32_4_2_WGM1
    SolutionIndex: 24
    SolutionNameMin: Cijk_Alik_Bljk_HHS_BH_UserArgs_MT128x128x64_MI16x16x1_SN_GRVWA8_GRVWB8_GSU1_LBSPPA512_LBSPPB512_LPA16_LPB16_LRVW8_MIWT4_4_NTC3_NTD3_SU0_SUM0_SUS0_SVW4_VWA4_VWB4_WG32_8_1_WGM1
    SolutionIndex: 25
    SolutionNameMin: Cijk_Alik_Bljk_HHS_BH_UserArgs_MT256x192x64_MI16x16x1_SN_GRVWA8_GRVWB8_GSU1_GSUC0_GSUWGMRR0_K1_LBSPPA256_LBSPPB256_LPA16_LPB16_LRVW8_MIAV0_MIWT8_6_NTA1_NTB2_NTC6_NTD6_SS1_SU0_SUM0_SUS0_SPO0_SVW2_ULSGRO0_VWA2_VWB2_WSGRA1_WSGRB1_WG32_8_1_WGM1
    SolutionIndex: 26
    SolutionNameMin: Cijk_Alik_Bljk_HHS_BH_UserArgs_MT224x256x64_MI16x16x1_SN_GRVWA2_GRVWB2_GSU1_GSUC0_GSUWGMRR0_K1_LBSPPA128_LBSPPB256_LPA4_LPB4_LRVW4_MIAV0_MIWT7_8_NTA1_NTB1_NTC4_NTD4_SS1_SU32_SUM0_SUS2048_SPO0_SVW1_ULSGRO0_VWA1_VWB2_WSGRA2_WSGRB2_WG32_8_1_WGMn16
    SolutionIndex: 27
    SolutionNameMin: Cijk_Alik_Bljk_HHS_BH_UserArgs_MT224x128x64_MI16x16x1_SN_GRVWA8_GRVWB8_GSU1_GSUC0_GSUWGMRR0_K1_LBSPPA128_LBSPPB256_LPA16_LPB16_LRVW8_MIAV1_MIWT7_4_NTA1_NTB1_NTC0_NTD0_SS0_SU8_SUM0_SUS2048_SPO0_SVW4_ULSGRO0_VWA1_VWB2_WSGRA1_WSGRB1_WG32_8_1_WGM32
    SolutionIndex: 28
    SolutionNameMin: Cijk_Alik_Bljk_HHS_BH_UserArgs_MT256x192x64_MI16x16x1_SN_GRVWA8_GRVWB8_GSU1_GSUC0_GSUWGMRR0_K1_LBSPPA256_LBSPPB256_LPA16_LPB16_LRVW8_MIAV0_MIWT8_6_NTA3_NTB1_NTC4_NTD4_SS1_SU8_SUM0_SUS256_SPO0_SVW2_ULSGRO0_VWA2_VWB2_WSGRA1_WSGRB1_WG32_8_1_WGM0
    SolutionIndex: 29
    SolutionNameMin: Cijk_Alik_Bljk_HHS_BH_UserArgs_MT256x224x64_MI16x16x1_SN_GRVWA2_GRVWB2_GSU1_GSUC0_GSUWGMRR0_K1_LBSPPA1024_LBSPPB128_LPA4_LPB4_LRVW4_MIAV0_MIWT8_7_NTA0_NTB0_NTC0_NTD0_SS1_SU0_SUM0_SUS0_SPO0_SVW8_ULSGRO0_VWA8_VWB1_WSGRA0_WSGRB0_WG32_8_1_WGM1
    SolutionIndex: 30
    SolutionNameMin: Cijk_Alik_Bljk_HHS_BH_UserArgs_MT224x256x64_MI16x16x1_SN_GRVWA2_GRVWB8_GSU1_GSUC0_GSUWGMRR0_K1_LBSPPA256_LBSPPB256_LPA4_LPB8_LRVW4_MIAV0_MIWT14_4_NTA2_NTB2_NTC4_NTD4_SS1_SU8_SUM0_SUS1024_SPO1_SVW2_ULSGRO0_VWA2_VWB2_WSGRA1_WSGRB1_WG16_16_1_WGM32
    SolutionIndex: 31
    SolutionNameMin: Cijk_Alik_Bljk_HHS_BH_UserArgs_MT256x224x64_MI16x16x1_SN_GRVWA2_GRVWB2_GSU1_GSUC0_GSUWGMRR0_K1_LBSPPA1024_LBSPPB128_LPA4_LPB4_LRVW4_MIAV0_MIWT8_7_NTA0_NTB0_NTC0_NTD0_SS1_SU8_SUM0_SUS512_SPO1_SVW8_ULSGRO0_VWA8_VWB1_WSGRA0_WSGRB0_WG32_8_1_WGM1
    SolutionIndex: 32
    SolutionNameMin: Cijk_Alik_Bljk_HHS_BH_UserArgs_MT256x224x64_MI16x16x1_SN_GRVWA4_GRVWB8_GSU1_GSUC0_GSUWGMRR0_K1_LBSPPA1024_LBSPPB128_LPA4_LPB8_LRVW4_MIAV0_MIWT8_7_NTA0_NTB0_NTC0_NTD0_SS1_SU8_SUM0_SUS256_SPO0_SVW8_ULSGRO0_VWA8_VWB1_WSGRA0_WSGRB0_WG32_8_1_WGMn32
    SolutionIndex: 33
    SolutionNameMin: Cijk_Alik_Bljk_HHS_BH_UserArgs_MT64x256x32_MI16x16x1_SN_LDSB1_GRVWA8_GRVWB2_GSU1_GSUC0_GSUWGMRR0_K1_LBSPPA256_LBSPPB256_LPA8_LPB4_LRVW4_MIAV0_MIWT4_4_NEPBS16_SU0_SUM0_SUS0_SVW4_VWA4_VWB4_WG16_16_1_WGM1
    SolutionIndex: 34
    SolutionNameMin: Cijk_Alik_Bljk_HHS_BH_UserArgs_MT16x128x128_MI16x16x1_SN_GRVWA2_GRVWB8_GSU1_GSUC0_GSUWGMRR0_K1_MIWT1_2_PLR2_SU8_SUM0_SUS256_SPO0_SSO0_ULSGRO1_WGM1_WGMXCC1
    SolutionIndex: 35
    SolutionNameMin: Cijk_Alik_Bljk_HHS_BH_UserArgs_MT16x128x128_MI16x16x1_SN_GRVWA2_GRVWB8_GSU1_GSUC0_GSUWGMRR0_K1_MIWT1_2_PLR1_SU8_SUM0_SUS256_SPO1_SSO0_ULSGRO1_WGM1_WGMXCC1
    SolutionIndex: 36
    SolutionNameMin: Cijk_Alik_Bljk_HHS_BH_UserArgs_MT192x16x128_MI16x16x1_SN_GRVWB8_GSU1_GSUC0_GSUWGMRR0_K1_LBSPPA256_LBSPPB256_MIAV0_MIWT3_1_NTC3_NTD3_SU4_SUM0_SUS256_SSO0_SVW1_ULSGRO0_VWA1_WG64_4_1_WGM1
    SolutionIndex: 37
    SolutionNameMin: Cijk_Alik_Bljk_HHS_BH_UserArgs_MT128x16x128_MI16x16x1_SN_GRVWB2_GSU1_GSUC0_GSUWGMRR0_K1_LBSPPA512_LBSPPB256_MIAV1_MIWT2_1_NTC3_NTD3_SU8_SUM0_SUS256_SSO0_SVW2_ULSGRO1_VWA2_WG64_4_1_WGM1
    SolutionIndex: 38
    SolutionNameMin: Cijk_Alik_Bljk_HHS_BH_UserArgs_MT256x160x32_MI16x16x1_SN_GRVWA2_GRVWB2_GSU1_GSUC0_GSUWGMRR0_K1_LBSPPA512_LBSPPB128_LPA4_LPB4_LRVW4_MIWT8_5_SU8_SUM0_SUS256_SVW8_VWA8_VWB1_WG32_8_1_WGM16_WGMXCC1_WGMXCCGn1
    SolutionIndex: 39
    SolutionNameMin: Cijk_Alik_Bljk_HHS_BH_UserArgs_MT256x192x64_MI16x16x1_SN_GRVWA2_GRVWB2_GSU1_GSUC0_GSUWGMRR0_K1_LBSPPA1024_LBSPPB256_LPA16_LPB16_LRVW8_MIWT8_6_SU8_SUM0_SUS256_SVW8_VWA8_VWB2_WG32_8_1_WGM16_WGMXCC1_WGMXCCGn1
    SolutionIndex: 40
    SolutionNameMin: Cijk_Alik_Bljk_HHS_BH_UserArgs_MT192x256x64_MI16x16x1_SN_GRVWA8_GRVWB8_GSU1_GSUC0_GSUWGMRR0_K1_LBSPPA512_LBSPPB512_LPA16_LPB16_LRVW8_MIWT12_4_SU8_SUM0_SUS256_SVW4_VWA4_VWB4_WG16_16_1_WGM16_WGMXCC1_WGMXCCGn1
- - - [512, 512, 1, 512]
    - [1, 0.0]
  - - [1024, 1024, 1, 1024]
    - [3, 0.0]
  - - [2048, 2048, 1, 2048]
    - [0, 0.0]
  - - [4096, 4096, 1, 4096]
    - [2, 0.0]
  - - [4096, 4096, 1, 8192]
    - [10, 0.0]
  - - [8192, 8192, 1, 8192]
    - [11, 0.0]
  - - [4864, 4096, 1, 8192]
    - [4, 0.0]
  - - [7168, 65536, 1, 7168]
    - [5, 0.0]
  - - [7168, 65536, 1, 28672]
    - [6, 0.0]
  - - [21504, 65536, 1, 7168]
    - [7, 0.0]
  - - [28672, 65536, 1, 7168]
    - [8, 0.0]
  - - [50432, 65536, 1, 7168]
    - [9, 0.0]
  - - [16384, 8, 1, 6144]
    - [12, 0.0]
  - - [8, 8, 1, 6144]
    - [13, 0.0]
  - - [16384, 256, 1, 6144]
    - [14, 0.0]
  - - [8, 8192, 1, 6144]
    - [15, 0.0]
  - - [32, 7168, 1, 1152]
    - [16, 0.0]
  - - [1152, 7168, 1, 1152]
    - [17, 0.0]
  - - [4608, 7168, 1, 1152]
    - [18, 0.0]
  - - [512, 14336, 1, 512]
    - [19, 0.0]
  - - [6912, 28, 1, 1152]
    - [20, 0.0]
  - - [1152, 28, 1, 1152]
    - [21, 0.0]
  - - [1152, 28, 1, 256]
    - [22, 0.0]
  - - [2304, 28, 1, 1152]
    - [23, 0.0]
  - - [1024, 1024, 14, 512]
    - [24, 0.0]
  - - [12288, 2048, 1, 4096]
    - [25, 0.0]
  - - [22016, 2048, 1, 4096]
    - [26, 0.0]
  - - [32000, 2048, 1, 4096]
    - [26, 0.0]
  - - [4096, 2048, 1, 4096]
    - [27, 0.0]
  - - [4096, 65536, 1, 11008]
    - [28, 0.0]
  - - [4096, 65536, 1, 4096]
    - [28, 0.0]
  - - [8192, 32768, 1, 1024]
    - [28, 0.0]
  - - [4096, 49152, 1, 4096]
    - [29, 0.0]
  - - [4096, 49152, 1, 32000]
    - [30, 0.0]
  - - [8192, 57344, 1, 28672]
    - [29, 0.0]
  - - [8192, 57344, 1, 8192]
    - [29, 0.0]
  - - [8192, 57344, 1, 1024]
    - [31, 0.0]
  - - [8192, 57344, 1, 32000]
    - [32, 0.0]
  - - [64, 178, 5604, 178]
    - [33, 0.0]
  - - [64, 178, 6144, 178]
    - [33, 0.0]
  - - [16, 155648, 1, 8448]
    - [34, 0.0]
  - - [16, 77824, 1, 16640]
    - [35, 0.0]
  - - [155648, 16, 1, 8448]
    - [36, 0.0]
  - - [77824, 16, 1, 16640]
    - [37, 0.0]
  - - [3072, 91136, 1, 768]
    - [38, 0.0]
  - - [768, 91136, 1, 3072]
    - [39, 0.0]
  - - [768, 91136, 1, 768]
    - [40, 0.0]
- null
- null
- DeviceEfficiency
- Equality
