library/src/amd_detail/rocblaslt/src/Tensile/Logic/asm_full/aquavanjaram/gfx942/Equality/aquavanjaram_Cijk_Alik_Bljk_F8HS_BH_Bias_HAS_SAV_UserArgs.yaml
- {MinimumRequiredVersion: 4.33.0}
- aquavanjaram
- gfx942
- [Device 0049, Device 0050]
    SolutionIndex: 0
    SolutionNameMin: Cijk_Alik_Bljk_F8HS_BH_Bias_HAS_SAV_UserArgs_MT256x112x128_MI16x16x1_SN_GRVWA4_GRVWB4_GSU1_LBSPPA512_LBSPPB128_LPA32_LPB32_LRVW16_MIAV0_MIWT4_7_SU8_SUM0_SUS256_SVW4_VWA4_VWB1_WG64_4_1_WGM32
    SolutionIndex: 1
    SolutionNameMin: Cijk_Alik_Bljk_F8HS_BH_Bias_HAS_SAV_UserArgs_MT32x16x256_MI16x16x1_SN_GRVWA16_GRVWB16_GSU1_LBSPPA256_LBSPPB256_MIWT1_1_NTA0_NLCA1_NLCB1_SU0_SUM0_SUS0_SVW1_VWA1_WG32_4_2_WGM1
    SolutionIndex: 2
    SolutionNameMin: Cijk_Alik_Bljk_F8HS_BH_Bias_HAS_SAV_UserArgs_MT192x224x64_MI16x16x1_SN_CLR1_GRVWA16_GRVWB4_GSU1_LBSPPA128_LBSPPB128_LPA16_LPB8_LRVW8_MIWT6_7_PLR1_SU8_SUM0_SUS256_SVW2_VWA2_VWB1_WG32_8_1_WGM16
    SolutionIndex: 3
    SolutionNameMin: Cijk_Alik_Bljk_F8HS_BH_Bias_HAS_SAV_UserArgs_MT32x16x256_MI16x16x1_SN_CLR1_GRVWA16_GRVWB16_GSU16_LBSPPA256_LBSPPB256_LPA32_LPB32_LRVW16_MIWT1_1_NTA4_NLCA1_NLCB1_PLR1_SU0_SUM0_SUS0_SVW1_VWA1_WG32_4_1_WGM1
    SolutionIndex: 4
    SolutionNameMin: Cijk_Alik_Bljk_F8HS_BH_Bias_HAS_SAV_UserArgs_MT64x64x256_MI16x16x1_SN_CLR1_GRVWA16_GRVWB16_GSU1_GSUC0_GSUWGMRR0_K1_LBSPPA1024_LBSPPB512_LPA32_LPB64_LRVW16_MIAV1_MIWT4_2_NTC3_NTD3_SU0_SUM0_SUS0_SPO0_SSO0_SVW4_TLDS1_VWA4_VWB2_WG16_8_2_WGM1_WGMXCC1_WGMXCCGn1
    SolutionIndex: 5
    SolutionNameMin: Cijk_Alik_Bljk_F8HS_BH_Bias_HAS_SAV_UserArgs_MT64x64x256_MI16x16x1_SN_CLR1_GRVWA16_GRVWB16_GSU1_GSUC0_GSUWGMRR0_K1_LBSPPA512_LBSPPB256_LPA32_LPB32_LRVW16_MIAV1_MIWT4_2_NTC3_NTD3_SU0_SUM0_SUS0_SPO0_SSO0_SVW2_TLDS2_VWA2_VWB1_WG16_8_2_WGM1_WGMXCC1_WGMXCCGn1
    SolutionIndex: 6
    SolutionNameMin: Cijk_Alik_Bljk_F8HS_BH_Bias_HAS_SAV_UserArgs_MT128x96x256_MI16x16x1_SN_CLR1_GRVWA16_GRVWB16_GSU3_GSUC0_GSUWGMRR0_K1_LBSPPA256_LBSPPB256_LPA32_LPB32_LRVW16_MIAV1_MIWT4_3_NTC3_NTD3_SU0_SUM0_SUS0_SPO0_SSO0_SVW1_TLDS2_VWA1_VWB1_WG32_8_1_WGM1_WGMXCC1_WGMXCCGn1
    SolutionIndex: 7
    SolutionNameMin: Cijk_Alik_Bljk_F8HS_BH_Bias_HAS_SAV_UserArgs_MT128x128x128_MI16x16x1_SN_CLR1_GRVWA16_GRVWB16_GSU1_GSUC0_GSUWGMRR0_K1_LBSPPA1024_LBSPPB128_LPA32_LPB16_LRVW16_MIAV1_MIWT8_2_NTC4_NTD4_SU8_SUM0_SUS256_SPO1_SSO4_SVW8_TLDS2_VWA8_VWB1_WG16_16_1_WGM32_WGMXCC1_WGMXCCGn1
    SolutionIndex: 8
    SolutionNameMin: Cijk_Alik_Bljk_F8HS_BH_Bias_HAS_SAV_UserArgs_MT128x128x128_MI16x16x1_SN_CLR1_GRVWA16_GRVWB16_GSU1_GSUC0_GSUWGMRR0_K1_LBSPPA512_LBSPPB256_LPA32_LPB64_LRVW16_MIAV1_MIWT8_2_NTC4_NTD4_SU8_SUM0_SUS256_SPO1_SSO4_SVW4_TLDS1_VWA4_VWB2_WG16_16_1_WGM32_WGMXCC1_WGMXCCGn1
    SolutionIndex: 9
    SolutionNameMin: Cijk_Alik_Bljk_F8HS_BH_Bias_HAS_SAV_UserArgs_MT128x128x128_MI16x16x1_SN_CLR1_GRVWA16_GRVWB16_GSU1_GSUC0_GSUWGMRR0_K1_LBSPPA512_LBSPPB256_LPA32_LPB32_LRVW16_MIAV1_MIWT8_2_NTC4_NTD4_SU8_SUM0_SUS256_SPO1_SSO4_SVW4_TLDS2_VWA4_VWB2_WG16_16_1_WGM32_WGMXCC1_WGMXCCGn1
    SolutionIndex: 10
    SolutionNameMin: Cijk_Alik_Bljk_F8HS_BH_Bias_HAS_SAV_UserArgs_MT256x128x128_MI16x16x1_SN_CLR1_GRVWA16_GRVWB16_GSU3_GSUC0_GSUWGMRR0_K1_LBSPPA128_LBSPPB1024_LPA32_LPB32_LRVW16_MIAV0_MIWT4_8_NTC3_NTD3_SU0_SUM0_SUS0_SPO0_SSO0_SVW1_TLDS2_VWA1_VWB8_WG64_4_1_WGM1_WGMXCC1_WGMXCCGn1
    SolutionIndex: 11
    SolutionNameMin: Cijk_Alik_Bljk_F8HS_BH_Bias_HAS_SAV_UserArgs_MT128x128x128_MI16x16x1_SN_CLR1_GRVWA16_GRVWB16_GSU1_GSUC0_GSUWGMRR0_K1_LBSPPA512_LBSPPB256_LPA16_LPB64_LRVW16_MIAV1_MIWT8_2_NTC4_NTD4_SU8_SUM0_SUS256_SPO1_SSO4_SVW4_TLDS2_VWA4_VWB2_WG16_16_1_WGM32_WGMXCC1_WGMXCCGn1
    SolutionIndex: 12
    SolutionNameMin: Cijk_Alik_Bljk_F8HS_BH_Bias_HAS_SAV_UserArgs_MT128x128x128_MI16x16x1_SN_CLR1_GRVWA16_GRVWB16_GSU1_GSUC0_GSUWGMRR0_K1_LBSPPA512_LBSPPB128_LPA32_LPB48_LRVW16_MIAV1_MIWT8_2_NTC4_NTD4_SU8_SUM0_SUS256_SPO1_SSO4_SVW4_TLDS1_VWA4_VWB1_WG16_16_1_WGM32_WGMXCC1_WGMXCCGn1
    SolutionIndex: 13
    SolutionNameMin: Cijk_Alik_Bljk_F8HS_BH_Bias_HAS_SAV_UserArgs_MT160x96x128_MI16x16x1_SN_CLR1_GRVWA16_GRVWB16_GSU1_GSUC0_GSUWGMRR0_K1_LBSPPA128_LBSPPB128_LPA32_LPB32_LRVW16_MIAV1_MIWT5_3_NTC4_NTD4_SU8_SUM0_SUS256_SPO1_SSO4_SVW1_TLDS1_VWA1_VWB1_WG32_8_1_WGM16_WGMXCC1_WGMXCCGn1
    SolutionIndex: 14
    SolutionNameMin: Cijk_Alik_Bljk_F8HS_BH_Bias_HAS_SAV_UserArgs_MT256x128x128_MI16x16x1_SN_CLR1_GRVWA16_GRVWB16_GSU1_GSUC0_GSUWGMRR0_K1_LBSPPA1024_LBSPPB128_LPA32_LPB0_LRVW16_MIAV0_MIWT8_4_NTC4_NTD4_SU8_SUM0_SUS256_SPO1_SSO4_SVW8_TLDS1_VWA8_VWB1_WG32_8_1_WGM1_WGMXCC1_WGMXCCGn1
    SolutionIndex: 15
    SolutionNameMin: Cijk_Alik_Bljk_F8HS_BH_Bias_HAS_SAV_UserArgs_MT256x128x128_MI16x16x1_SN_CLR1_GRVWA16_GRVWB16_GSU1_GSUC0_GSUWGMRR0_K1_LBSPPA1024_LBSPPB512_LPA32_LPB32_LRVW16_MIAV0_MIWT8_4_NTC4_NTD4_SU8_SUM0_SUS256_SPO1_SSO4_SVW8_TLDS2_VWA8_VWB4_WG32_8_1_WGM1_WGMXCC1_WGMXCCGn1
    SolutionIndex: 16
    SolutionNameMin: Cijk_Alik_Bljk_F8HS_BH_Bias_HAS_SAV_UserArgs_MT256x128x128_MI16x16x1_SN_CLR1_GRVWA16_GRVWB16_GSU1_GSUC0_GSUWGMRR0_K1_LBSPPA1024_LBSPPB256_LPA32_LPB32_LRVW16_MIAV0_MIWT8_4_NTC4_NTD4_SU8_SUM0_SUS256_SPO1_SSO4_SVW8_TLDS1_VWA8_VWB2_WG32_8_1_WGM1_WGMXCC1_WGMXCCGn1
    SolutionIndex: 17
    SolutionNameMin: Cijk_Alik_Bljk_F8HS_BH_Bias_HAS_SAV_UserArgs_MT256x224x128_MI16x16x1_SN_CLR1_GRVWA4_GRVWB4_GSU2_GSUC0_GSUWGMRR0_K1_LBSPPA512_LBSPPB128_LPA8_LPB16_LRVW8_MIAV0_MIWT8_7_NTC4_NTD4_SU8_SUM0_SUS256_SPO1_SSO4_SVW4_TLDS1_VWA4_VWB1_WG32_8_1_WGM16_WGMXCC1_WGMXCCGn1
    SolutionIndex: 18
    SolutionNameMin: Cijk_Alik_Bljk_F8HS_BH_Bias_HAS_SAV_UserArgs_MT256x192x128_MI16x16x1_SN_CLR1_GRVWA16_GRVWB16_GSU1_GSUC0_GSUWGMRR0_K1_LBSPPA1024_LBSPPB256_LPA32_LPB32_LRVW16_MIAV0_MIWT8_6_NTC4_NTD4_SU8_SUM0_SUS256_SPO1_SSO4_SVW8_TLDS1_VWA8_VWB2_WG32_8_1_WGM48_WGMXCC1_WGMXCCGn1
    SolutionIndex: 19
    SolutionNameMin: Cijk_Alik_Bljk_F8HS_BH_Bias_HAS_SAV_UserArgs_MT256x192x128_MI16x16x1_SN_CLR1_GRVWA16_GRVWB16_GSU1_GSUC0_GSUWGMRR0_K1_LBSPPA1024_LBSPPB128_LPA32_LPB32_LRVW16_MIAV0_MIWT8_6_NTC4_NTD4_SU8_SUM0_SUS256_SPO1_SSO4_SVW8_TLDS2_VWA8_VWB1_WG32_8_1_WGM48_WGMXCC1_WGMXCCGn1
    SolutionIndex: 20
    SolutionNameMin: Cijk_Alik_Bljk_F8HS_BH_Bias_HAS_SAV_UserArgs_MT256x192x128_MI16x16x1_SN_CLR1_GRVWA16_GRVWB16_GSU1_GSUC0_GSUWGMRR0_K1_LBSPPA1024_LBSPPB256_LPA32_LPB32_LRVW16_MIAV0_MIWT8_6_NTC4_NTD4_SU8_SUM0_SUS256_SPO1_SSO4_SVW8_TLDS2_VWA8_VWB2_WG32_8_1_WGM48_WGMXCC1_WGMXCCGn1
    SolutionIndex: 21
    SolutionNameMin: Cijk_Alik_Bljk_F8HS_BH_Bias_HAS_SAV_UserArgs_MT256x192x128_MI16x16x1_SN_CLR1_GRVWA16_GRVWB16_GSU1_GSUC0_GSUWGMRR0_K1_LBSPPA512_LBSPPB256_LPA32_LPB32_LRVW16_MIAV0_MIWT8_6_NTC4_NTD4_SU8_SUM0_SUS256_SPO1_SSO4_SVW4_TLDS2_VWA4_VWB2_WG32_8_1_WGM48_WGMXCC1_WGMXCCGn1
    SolutionIndex: 22
    SolutionNameMin: Cijk_Alik_Bljk_F8HS_BH_Bias_HAS_SAV_UserArgs_MT128x96x256_MI16x16x1_SN_CLR1_GRVWA16_GRVWB16_GSU1_GSUC0_GSUWGMRR0_K1_LBSPPA1024_LBSPPB256_LPA16_LPB64_LRVW16_MIAV1_MIWT4_3_NTC3_NTD3_SU0_SUM0_SUS0_SPO0_SSO0_SVW4_TLDS1_VWA4_VWB1_WG32_8_1_WGM1_WGMXCC1_WGMXCCGn1
    SolutionIndex: 23
    SolutionNameMin: Cijk_Alik_Bljk_F8HS_BH_Bias_HAS_SAV_UserArgs_MT128x96x256_MI16x16x1_SN_CLR1_GRVWA16_GRVWB16_GSU1_GSUC0_GSUWGMRR0_K1_LBSPPA1024_LBSPPB256_LPA64_LPB16_LRVW16_MIAV1_MIWT4_3_NTC3_NTD3_SU0_SUM0_SUS0_SPO0_SSO0_SVW4_TLDS2_VWA4_VWB1_WG32_8_1_WGM1_WGMXCC1_WGMXCCGn1
    SolutionIndex: 24
    SolutionNameMin: Cijk_Alik_Bljk_F8HS_BH_Bias_HAS_SAV_UserArgs_MT128x128x128_MI16x16x1_SN_CLR1_GRVWA16_GRVWB16_GSU1_GSUC0_GSUWGMRR0_K1_LBSPPA1024_LBSPPB256_LPA32_LPB48_LRVW16_MIAV1_MIWT8_2_NTC4_NTD4_SU8_SUM0_SUS256_SPO1_SSO4_SVW8_TLDS2_VWA8_VWB2_WG16_16_1_WGM32_WGMXCC1_WGMXCCGn1
    SolutionIndex: 25
    SolutionNameMin: Cijk_Alik_Bljk_F8HS_BH_Bias_HAS_SAV_UserArgs_MT256x192x128_MI16x16x1_SN_CLR1_GRVWA16_GRVWB16_GSU1_GSUC0_GSUWGMRR0_K1_LBSPPA1024_LBSPPB128_LPA32_LPB16_LRVW16_MIAV0_MIWT8_6_NTC4_NTD4_SU8_SUM0_SUS256_SPO1_SSO4_SVW8_TLDS2_VWA8_VWB1_WG32_8_1_WGM48_WGMXCC1_WGMXCCGn1
    SolutionIndex: 26
    SolutionNameMin: Cijk_Alik_Bljk_F8HS_BH_Bias_HAS_SAV_UserArgs_MT256x128x128_MI16x16x1_SN_CLR1_GRVWA16_GRVWB16_GSU1_GSUC0_GSUWGMRR0_K1_LBSPPA256_LBSPPB1024_LPA32_LPB32_LRVW16_MIAV0_MIWT4_8_NTC4_NTD4_SU8_SUM0_SUS256_SPO1_SSO4_SVW2_TLDS1_VWA2_VWB8_WG64_4_1_WGM1_WGMXCC1_WGMXCCGn1
    SolutionIndex: 27
    SolutionNameMin: Cijk_Alik_Bljk_F8HS_BH_Bias_HAS_SAV_UserArgs_MT128x256x128_MI16x16x1_SN_CLR1_GRVWA4_GRVWB16_GSU1_GSUC0_GSUWGMRR0_K1_LBSPPA1024_LBSPPB128_LPA32_LPB32_LRVW16_MIAV0_MIWT8_4_NTC4_NTD4_SU8_SUM0_SUS256_SPO1_SSO4_SVW8_TLDS1_VWA8_VWB1_WG16_16_1_WGM1_WGMXCC1_WGMXCCGn1
    SolutionIndex: 28
    SolutionNameMin: Cijk_Alik_Bljk_F8HS_BH_Bias_HAS_SAV_UserArgs_MT192x256x128_MI16x16x1_SN_CLR1_GRVWA4_GRVWB16_GSU1_GSUC0_GSUWGMRR0_K1_LBSPPA512_LBSPPB256_LPA32_LPB48_LRVW16_MIAV0_MIWT12_4_NTC4_NTD4_SU8_SUM0_SUS256_SPO1_SSO4_SVW4_TLDS1_VWA4_VWB2_WG16_16_1_WGM32_WGMXCC1_WGMXCCGn1
    SolutionIndex: 29
    SolutionNameMin: Cijk_Alik_Bljk_F8HS_BH_Bias_HAS_SAV_UserArgs_MT192x224x128_MI16x16x1_SN_CLR1_GRVWA4_GRVWB16_GSU1_GSUC0_GSUWGMRR0_K1_LBSPPA256_LBSPPB128_LPA32_LPB32_LRVW16_MIAV0_MIWT6_7_NTC4_NTD4_SU8_SUM0_SUS256_SPO1_SSO4_SVW2_TLDS2_VWA2_VWB1_WG32_8_1_WGM16_WGMXCC1_WGMXCCGn1
    SolutionIndex: 30
    SolutionNameMin: Cijk_Alik_Bljk_F8HS_BH_Bias_HAS_SAV_UserArgs_MT192x224x128_MI16x16x1_SN_CLR1_GRVWA16_GRVWB16_GSU1_GSUC0_GSUWGMRR0_K1_LBSPPA256_LBSPPB128_LPA32_LPB32_LRVW16_MIAV0_MIWT6_7_NTC4_NTD4_SU8_SUM0_SUS256_SPO1_SSO4_SVW2_TLDS2_VWA2_VWB1_WG32_8_1_WGM1_WGMXCC1_WGMXCCGn1
    SolutionIndex: 31
    SolutionNameMin: Cijk_Alik_Bljk_F8HS_BH_Bias_HAS_SAV_UserArgs_MT256x128x64_MI16x16x1_SN_CLR1_GRVWA4_GRVWB16_GSU1_GSUC0_GSUWGMRR0_K1_LBSPPA512_LBSPPB128_LPA8_LPB16_LRVW8_MIAV0_MIWT8_4_NTC4_NTD4_SU8_SUM0_SUS256_SPO1_SSO4_SVW8_TLDS2_VWA8_VWB2_WG32_8_1_WGM16_WGMXCC1_WGMXCCGn1
    SolutionIndex: 32
    SolutionNameMin: Cijk_Alik_Bljk_F8HS_BH_Bias_HAS_SAV_UserArgs_MT192x224x128_MI16x16x1_SN_CLR1_GRVWA16_GRVWB16_GSU1_GSUC0_GSUWGMRR0_K1_LBSPPA256_LBSPPB128_LPA32_LPB32_LRVW16_MIAV0_MIWT6_7_NTC4_NTD4_SU8_SUM0_SUS256_SPO1_SSO4_SVW2_TLDS1_VWA2_VWB1_WG32_8_1_WGM1_WGMXCC1_WGMXCCGn1
    SolutionIndex: 33
    SolutionNameMin: Cijk_Alik_Bljk_F8HS_BH_Bias_HAS_SAV_UserArgs_MT192x256x128_MI16x16x1_SN_CLR1_GRVWA16_GRVWB16_GSU1_GSUC0_GSUWGMRR0_K1_LBSPPA256_LBSPPB256_LPA32_LPB32_LRVW16_MIAV0_MIWT12_4_NTC4_NTD4_SU8_SUM0_SUS256_SPO1_SSO4_SVW2_TLDS1_VWA2_VWB2_WG16_16_1_WGM16_WGMXCC1_WGMXCCGn1
    SolutionIndex: 34
    SolutionNameMin: Cijk_Alik_Bljk_F8HS_BH_Bias_HAS_SAV_UserArgs_MT256x128x64_MI16x16x1_SN_CLR1_GRVWA4_GRVWB16_GSU1_GSUC0_GSUWGMRR0_K1_LBSPPA512_LBSPPB128_LPA8_LPB48_LRVW8_MIAV0_MIWT8_4_NTC4_NTD4_SU8_SUM0_SUS256_SPO1_SSO4_SVW8_TLDS2_VWA8_VWB2_WG32_8_1_WGM16_WGMXCC1_WGMXCCGn1
    SolutionIndex: 35
    SolutionNameMin: Cijk_Alik_Bljk_F8HS_BH_Bias_HAS_SAV_UserArgs_MT256x224x128_MI16x16x1_SN_CLR1_GRVWA4_GRVWB4_GSU1_GSUC0_GSUWGMRR0_K1_LBSPPA1024_LBSPPB128_LPA8_LPB8_LRVW8_MIAV0_MIWT8_7_NTC4_NTD4_SU8_SUM0_SUS256_SPO1_SSO4_SVW8_TLDS1_VWA8_VWB1_WG32_8_1_WGM48_WGMXCC1_WGMXCCGn1
    SolutionIndex: 36
    SolutionNameMin: Cijk_Alik_Bljk_F8HS_BH_Bias_HAS_SAV_UserArgs_MT192x256x128_MI16x16x1_SN_CLR1_GRVWA16_GRVWB16_GSU1_GSUC0_GSUWGMRR0_K1_LBSPPA512_LBSPPB256_LPA32_LPB32_LRVW16_MIAV0_MIWT12_4_NTC4_NTD4_SU8_SUM0_SUS256_SPO1_SSO4_SVW4_TLDS2_VWA4_VWB2_WG16_16_1_WGM16_WGMXCC1_WGMXCCGn1
    SolutionIndex: 37
    SolutionNameMin: Cijk_Alik_Bljk_F8HS_BH_Bias_HAS_SAV_UserArgs_MT128x192x128_MI16x16x1_SN_CLR1_GRVWA4_GRVWB16_GSU1_GSUC0_GSUWGMRR0_K1_LBSPPA1024_LBSPPB128_LPA32_LPB32_LRVW16_MIAV0_MIWT8_3_NTC4_NTD4_SU8_SUM0_SUS256_SPO1_SSO4_SVW8_TLDS1_VWA8_VWB1_WG16_16_1_WGM1_WGMXCC1_WGMXCCGn1
    SolutionIndex: 38
    SolutionNameMin: Cijk_Alik_Bljk_F8HS_BH_Bias_HAS_SAV_UserArgs_MT128x192x128_MI16x16x1_SN_CLR1_GRVWA4_GRVWB16_GSU1_GSUC0_GSUWGMRR0_K1_LBSPPA1024_LBSPPB128_LPA32_LPB64_LRVW16_MIAV0_MIWT8_3_NTC4_NTD4_SU8_SUM0_SUS256_SPO1_SSO4_SVW8_TLDS2_VWA8_VWB1_WG16_16_1_WGM1_WGMXCC1_WGMXCCGn1
    SolutionIndex: 39
    SolutionNameMin: Cijk_Alik_Bljk_F8HS_BH_Bias_HAS_SAV_UserArgs_MT128x192x128_MI16x16x1_SN_CLR1_GRVWA4_GRVWB16_GSU1_GSUC0_GSUWGMRR0_K1_LBSPPA1024_LBSPPB128_LPA32_LPB64_LRVW16_MIAV0_MIWT8_3_NTC4_NTD4_SU8_SUM0_SUS256_SPO1_SSO4_SVW8_TLDS1_VWA8_VWB1_WG16_16_1_WGM1_WGMXCC1_WGMXCCGn1
    SolutionIndex: 40
    SolutionNameMin: Cijk_Alik_Bljk_F8HS_BH_Bias_HAS_SAV_UserArgs_MT112x128x128_MI16x16x1_SN_CLR1_GRVWA4_GRVWB16_GSU1_GSUC0_GSUWGMRR0_K1_LBSPPA128_LBSPPB256_LPA32_LPB32_LRVW16_MIAV1_MIWT7_2_NTC4_NTD4_SU8_SUM0_SUS256_SPO1_SSO4_SVW1_TLDS1_VWA1_VWB2_WG16_16_1_WGMn16_WGMXCC1_WGMXCCGn1
    SolutionIndex: 41
    SolutionNameMin: Cijk_Alik_Bljk_F8HS_BH_Bias_HAS_SAV_UserArgs_MT256x176x128_MI16x16x1_SN_CLR1_GRVWA4_GRVWB4_GSU1_GSUC0_GSUWGMRR0_K1_LBSPPA512_LBSPPB128_LPA32_LPB32_LRVW16_MIAV0_MIWT4_11_NTC4_NTD4_SU8_SUM0_SUS256_SPO1_SSO4_SVW4_TLDS1_VWA4_VWB1_WG64_4_1_WGM16_WGMXCC1_WGMXCCGn1
    SolutionIndex: 42
    SolutionNameMin: Cijk_Alik_Bljk_F8HS_BH_Bias_HAS_SAV_UserArgs_MT224x192x128_MI16x16x1_SN_CLR1_GRVWA4_GRVWB16_GSU1_GSUC0_GSUWGMRR0_K1_LBSPPA128_LBSPPB256_LPA32_LPB32_LRVW16_MIAV0_MIWT7_6_NTC4_NTD4_SU8_SUM0_SUS256_SPO1_SSO4_SVW1_TLDS1_VWA1_VWB2_WG32_8_1_WGM32_WGMXCC1_WGMXCCGn1
    SolutionIndex: 43
    SolutionNameMin: Cijk_Alik_Bljk_F8HS_BH_Bias_HAS_SAV_UserArgs_MT256x224x128_MI16x16x1_SN_CLR1_GRVWA4_GRVWB4_GSU1_GSUC0_GSUWGMRR0_K1_LBSPPA1024_LBSPPB128_LPA8_LPB8_LRVW8_MIAV0_MIWT8_7_NTC4_NTD4_SU8_SUM0_SUS256_SPO1_SSO4_SVW8_TLDS1_VWA8_VWB1_WG32_8_1_WGM1_WGMXCC1_WGMXCCGn1
    SolutionIndex: 44
    SolutionNameMin: Cijk_Alik_Bljk_F8HS_BH_Bias_HAS_SAV_UserArgs_MT256x224x128_MI16x16x1_SN_CLR1_GRVWA4_GRVWB4_GSU1_GSUC0_GSUWGMRR0_K1_LBSPPA1024_LBSPPB128_LPA8_LPB8_LRVW8_MIAV0_MIWT8_7_NTC4_NTD4_SU8_SUM0_SUS256_SPO1_SSO4_SVW8_TLDS2_VWA8_VWB1_WG32_8_1_WGM1_WGMXCC1_WGMXCCGn1
    SolutionIndex: 45
    SolutionNameMin: Cijk_Alik_Bljk_F8HS_BH_Bias_HAS_SAV_UserArgs_MT224x256x128_MI16x16x1_SN_CLR1_GRVWA4_GRVWB16_GSU1_GSUC0_GSUWGMRR0_K1_LBSPPA256_LBSPPB256_LPA8_LPB16_LRVW8_MIAV0_MIWT14_4_NTC4_NTD4_SU8_SUM0_SUS256_SPO1_SSO4_SVW2_TLDS1_VWA2_VWB2_WG16_16_1_WGM32_WGMXCC1_WGMXCCGn1
    SolutionIndex: 46
    SolutionNameMin: Cijk_Alik_Bljk_F8HS_BH_Bias_HAS_SAV_UserArgs_MT256x224x128_MI16x16x1_SN_CLR1_GRVWA4_GRVWB4_GSU1_GSUC0_GSUWGMRR0_K1_LBSPPA512_LBSPPB128_LPA8_LPB8_LRVW8_MIAV0_MIWT8_7_NTC4_NTD4_SU8_SUM0_SUS256_SPO1_SSO4_SVW4_TLDS2_VWA4_VWB1_WG32_8_1_WGM1_WGMXCC1_WGMXCCGn1
    SolutionIndex: 47
    SolutionNameMin: Cijk_Alik_Bljk_F8HS_BH_Bias_HAS_SAV_UserArgs_MT256x224x128_MI16x16x1_SN_CLR1_GRVWA4_GRVWB4_GSU1_GSUC0_GSUWGMRR0_K1_LBSPPA256_LBSPPB128_LPA8_LPB8_LRVW8_MIAV0_MIWT8_7_NTC4_NTD4_SU8_SUM0_SUS256_SPO1_SSO4_SVW2_TLDS2_VWA2_VWB1_WG32_8_1_WGM1_WGMXCC1_WGMXCCGn1
    SolutionIndex: 48
    SolutionNameMin: Cijk_Alik_Bljk_F8HS_BH_Bias_HAS_SAV_UserArgs_MT128x256x128_MI16x16x1_SN_CLR1_GRVWA4_GRVWB16_GSU1_GSUC0_GSUWGMRR0_K1_LBSPPA1024_LBSPPB128_LPA32_LPB0_LRVW16_MIAV0_MIWT8_4_NTC4_NTD4_SU8_SUM0_SUS256_SPO1_SSO4_SVW8_TLDS1_VWA8_VWB1_WG16_16_1_WGM1_WGMXCC1_WGMXCCGn1
    SolutionIndex: 49
    SolutionNameMin: Cijk_Alik_Bljk_F8HS_BH_Bias_HAS_SAV_UserArgs_MT256x128x128_MI16x16x1_SN_CLR1_GRVWA16_GRVWB16_GSU1_GSUC0_GSUWGMRR0_K1_LBSPPA512_LBSPPB256_LPA32_LPB32_LRVW16_MIAV0_MIWT4_8_NTC4_NTD4_SU8_SUM0_SUS256_SPO1_SSO4_SVW4_TLDS2_VWA4_VWB2_WG64_4_1_WGM1_WGMXCC1_WGMXCCGn1
    SolutionIndex: 50
    SolutionNameMin: Cijk_Alik_Bljk_F8HS_BH_Bias_HAS_SAV_UserArgs_MT256x128x128_MI16x16x1_SN_CLR1_GRVWA16_GRVWB16_GSU1_GSUC0_GSUWGMRR0_K1_LBSPPA1024_LBSPPB256_LPA32_LPB64_LRVW16_MIAV0_MIWT8_4_NTC4_NTD4_SU8_SUM0_SUS256_SPO1_SSO4_SVW8_TLDS1_VWA8_VWB2_WG32_8_1_WGM1_WGMXCC1_WGMXCCGn1
    SolutionIndex: 51
    SolutionNameMin: Cijk_Alik_Bljk_F8HS_BH_Bias_HAS_SAV_UserArgs_MT256x176x128_MI16x16x1_SN_CLR1_GRVWA4_GRVWB4_GSU1_GSUC0_GSUWGMRR0_K1_LBSPPA512_LBSPPB128_LPA32_LPB32_LRVW16_MIAV0_MIWT4_11_NTC4_NTD4_SU8_SUM0_SUS256_SPO1_SSO4_SVW4_TLDS2_VWA4_VWB1_WG64_4_1_WGMn16_WGMXCC1_WGMXCCGn1
    SolutionIndex: 52
    SolutionNameMin: Cijk_Alik_Bljk_F8HS_BH_Bias_HAS_SAV_UserArgs_MT224x192x128_MI16x16x1_SN_CLR1_GRVWA4_GRVWB16_GSU1_GSUC0_GSUWGMRR0_K1_LBSPPA128_LBSPPB256_LPA32_LPB16_LRVW16_MIAV0_MIWT7_6_NTC4_NTD4_SU8_SUM0_SUS256_SPO1_SSO4_SVW1_TLDS1_VWA1_VWB2_WG32_8_1_WGM32_WGMXCC1_WGMXCCGn1
    SolutionIndex: 53
    SolutionNameMin: Cijk_Alik_Bljk_F8HS_BH_Bias_HAS_SAV_UserArgs_MT224x256x128_MI16x16x1_SN_CLR1_GRVWA4_GRVWB16_GSU1_GSUC0_GSUWGMRR0_K1_LBSPPA256_LBSPPB256_LPA8_LPB8_LRVW8_MIAV0_MIWT14_4_NTC4_NTD4_SU8_SUM0_SUS256_SPO1_SSO4_SVW2_TLDS2_VWA2_VWB2_WG16_16_1_WGM32_WGMXCC1_WGMXCCGn1
    SolutionIndex: 54
    SolutionNameMin: Cijk_Alik_Bljk_F8HS_BH_Bias_HAS_SAV_UserArgs_MT256x224x128_MI16x16x1_SN_CLR1_GRVWA4_GRVWB4_GSU1_GSUC0_GSUWGMRR0_K1_LBSPPA1024_LBSPPB128_LPA8_LPB16_LRVW8_MIAV0_MIWT8_7_NTC4_NTD4_SU8_SUM0_SUS256_SPO1_SSO4_SVW8_TLDS2_VWA8_VWB1_WG32_8_1_WGM1_WGMXCC1_WGMXCCGn1
    SolutionIndex: 55
    SolutionNameMin: Cijk_Alik_Bljk_F8HS_BH_Bias_HAS_SAV_UserArgs_MT256x224x128_MI16x16x1_SN_CLR1_GRVWA16_GRVWB4_GSU1_GSUC0_GSUWGMRR0_K1_LBSPPA512_LBSPPB256_LPA16_LPB8_LRVW8_MIAV0_MIWT4_14_NTC4_NTD4_SU8_SUM0_SUS256_SPO1_SSO4_SVW4_TLDS2_VWA4_VWB2_WG64_4_1_WGM1_WGMXCC1_WGMXCCGn1
    SolutionIndex: 56
    SolutionNameMin: Cijk_Alik_Bljk_F8HS_BH_Bias_HAS_SAV_UserArgs_MT256x224x128_MI16x16x1_SN_CLR1_GRVWA16_GRVWB4_GSU1_GSUC0_GSUWGMRR0_K1_LBSPPA512_LBSPPB128_LPA16_LPB8_LRVW8_MIAV0_MIWT4_14_NTC4_NTD4_SU8_SUM0_SUS256_SPO1_SSO4_SVW4_TLDS2_VWA4_VWB1_WG64_4_1_WGM1_WGMXCC1_WGMXCCGn1
- - - [6144, 8192, 1, 768]
    - [2, 0.0]
  - - [1024, 8192, 1, 6400]
    - [0, 0.0]
  - - [1024, 8, 1, 6400]
    - [3, 0.0]
  - - [6144, 8, 1, 768]
    - [1, 0.0]
  - - [1024, 1024, 1, 1024]
    - [4, 0.0]
  - - [1024, 1024, 1, 3072]
    - [5, 0.0]
  - - [1024, 1024, 1, 4096]
    - [5, 0.0]
  - - [1024, 1024, 1, 24576]
    - [6, 0.0]
  - - [1024, 3072, 1, 1024]
    - [7, 0.0]
  - - [1024, 3072, 1, 3072]
    - [8, 0.0]
  - - [1024, 3072, 1, 4096]
    - [9, 0.0]
  - - [1024, 3072, 1, 24576]
    - [10, 0.0]
  - - [1024, 4096, 1, 1024]
    - [11, 0.0]
  - - [1024, 4096, 1, 3072]
    - [12, 0.0]
  - - [1024, 4096, 1, 4096]
    - [13, 0.0]
  - - [1024, 4096, 1, 24576]
    - [13, 0.0]
  - - [1024, 8192, 1, 1024]
    - [14, 0.0]
  - - [1024, 8192, 1, 3072]
    - [15, 0.0]
  - - [1024, 8192, 1, 4096]
    - [16, 0.0]
  - - [1024, 8192, 1, 24576]
    - [17, 0.0]
  - - [1024, 24576, 1, 1024]
    - [18, 0.0]
  - - [1024, 24576, 1, 3072]
    - [19, 0.0]
  - - [1024, 24576, 1, 4096]
    - [20, 0.0]
  - - [1024, 24576, 1, 24576]
    - [21, 0.0]
  - - [3072, 1024, 1, 1024]
    - [22, 0.0]
  - - [3072, 1024, 1, 3072]
    - [23, 0.0]
  - - [3072, 1024, 1, 4096]
    - [24, 0.0]
  - - [3072, 1024, 1, 24576]
    - [10, 0.0]
  - - [3072, 3072, 1, 1024]
    - [25, 0.0]
  - - [3072, 3072, 1, 3072]
    - [26, 0.0]
  - - [3072, 3072, 1, 4096]
    - [27, 0.0]
  - - [3072, 3072, 1, 24576]
    - [16, 0.0]
  - - [3072, 4096, 1, 1024]
    - [28, 0.0]
  - - [3072, 4096, 1, 3072]
    - [29, 0.0]
  - - [3072, 4096, 1, 4096]
    - [30, 0.0]
  - - [3072, 4096, 1, 24576]
    - [30, 0.0]
  - - [3072, 8192, 1, 1024]
    - [31, 0.0]
  - - [3072, 8192, 1, 3072]
    - [32, 0.0]
  - - [3072, 8192, 1, 4096]
    - [32, 0.0]
  - - [3072, 8192, 1, 24576]
    - [33, 0.0]
  - - [3072, 24576, 1, 1024]
    - [34, 0.0]
  - - [3072, 24576, 1, 3072]
    - [18, 0.0]
  - - [3072, 24576, 1, 4096]
    - [35, 0.0]
  - - [3072, 24576, 1, 24576]
    - [36, 0.0]
  - - [4096, 1024, 1, 1024]
    - [37, 0.0]
  - - [4096, 1024, 1, 3072]
    - [38, 0.0]
  - - [4096, 1024, 1, 4096]
    - [39, 0.0]
  - - [4096, 1024, 1, 24576]
    - [40, 0.0]
  - - [4096, 3072, 1, 1024]
    - [19, 0.0]
  - - [4096, 3072, 1, 3072]
    - [41, 0.0]
  - - [4096, 3072, 1, 4096]
    - [42, 0.0]
  - - [4096, 3072, 1, 24576]
    - [42, 0.0]
  - - [4096, 4096, 1, 1024]
    - [43, 0.0]
  - - [4096, 4096, 1, 3072]
    - [43, 0.0]
  - - [4096, 4096, 1, 4096]
    - [44, 0.0]
  - - [4096, 4096, 1, 24576]
    - [45, 0.0]
  - - [4096, 8192, 1, 1024]
    - [34, 0.0]
  - - [4096, 8192, 1, 3072]
    - [46, 0.0]
  - - [4096, 8192, 1, 4096]
    - [47, 0.0]
  - - [4096, 8192, 1, 24576]
    - [43, 0.0]
  - - [4096, 24576, 1, 1024]
    - [19, 0.0]
  - - [4096, 24576, 1, 3072]
    - [44, 0.0]
  - - [4096, 24576, 1, 4096]
    - [21, 0.0]
  - - [4096, 24576, 1, 24576]
    - [43, 0.0]
  - - [8192, 1024, 1, 1024]
    - [48, 0.0]
  - - [8192, 1024, 1, 3072]
    - [15, 0.0]
  - - [8192, 1024, 1, 4096]
    - [49, 0.0]
  - - [8192, 1024, 1, 24576]
    - [50, 0.0]
  - - [8192, 3072, 1, 1024]
    - [20, 0.0]
  - - [8192, 3072, 1, 3072]
    - [51, 0.0]
  - - [8192, 3072, 1, 4096]
    - [18, 0.0]
  - - [8192, 3072, 1, 24576]
    - [52, 0.0]
  - - [8192, 4096, 1, 1024]
    - [35, 0.0]
  - - [8192, 4096, 1, 3072]
    - [44, 0.0]
  - - [8192, 4096, 1, 4096]
    - [44, 0.0]
  - - [8192, 4096, 1, 24576]
    - [53, 0.0]
  - - [8192, 8192, 1, 1024]
    - [16, 0.0]
  - - [8192, 8192, 1, 3072]
    - [54, 0.0]
  - - [8192, 8192, 1, 4096]
    - [55, 0.0]
  - - [8192, 8192, 1, 24576]
    - [53, 0.0]
  - - [8192, 24576, 1, 1024]
    - [56, 0.0]
  - - [8192, 24576, 1, 3072]
    - [44, 0.0]
  - - [8192, 24576, 1, 4096]
    - [44, 0.0]
  - - [8192, 24576, 1, 24576]
    - [44, 0.0]
- null
- null
- DeviceEfficiency
- Equality
