library/src/amd_detail/rocblaslt/src/Tensile/Logic/asm_full/aquavanjaram/gfx942/Equality/aquavanjaram_Cijk_Ailk_Bljk_HHS_BH_Bias_HAS_SAV_UserArgs.yaml
- {MinimumRequiredVersion: 4.33.0}
- aquavanjaram
- gfx942
- [Device 0049, Device 0050]
    SolutionIndex: 0
    SolutionNameMin: Cijk_Ailk_Bljk_HHS_BH_Bias_HAS_SAV_UserArgs_MT16x64x32_MI16x16x1_SN_GSU1_GSUC0_GSUWGMRR0_K1_MIWT1_1_SU8_SUM0_SUS256_WGM1_WGMXCC1_WGMXCCGn1
    SolutionIndex: 1
    SolutionNameMin: Cijk_Ailk_Bljk_HHS_BH_Bias_HAS_SAV_UserArgs_MT48x256x32_MI16x16x1_SN_GSU1_GSUC1_GSUWGMRR1_K1_MIWT3_4_SU8_SUM0_SUS256_WGM8_WGMXCC1_WGMXCCGn1
    SolutionIndex: 2
    SolutionNameMin: Cijk_Ailk_Bljk_HHS_BH_Bias_HAS_SAV_UserArgs_MT16x128x16_MI16x16x1_SN_GSU1_GSUC1_GSUWGMRR0_K1_MIWT1_2_PLR0_SS0_SU0_SUM0_SUS0_SVW4_WGM8_WGMXCC1_WGMXCCGn1
    SolutionIndex: 3
    SolutionNameMin: Cijk_Ailk_Bljk_HHS_BH_Bias_HAS_SAV_UserArgs_MT32x128x64_MI16x16x1_SN_LDSB1_GSU1_GSUC1_GSUWGMRR1_K1_LBSPPA512_LBSPPB256_LPA32_LPB16_MIWT2_2_NEPBS16_SU8_SUM0_SUS128_SVW2_VWA2_VWB2_WG16_16_1_WGM1_WGMXCC1_WGMXCCGn1
    SolutionIndex: 4
    SolutionNameMin: Cijk_Ailk_Bljk_HHS_BH_Bias_HAS_SAV_UserArgs_MT16x128x16_MI16x16x1_SN_GSU1_GSUC0_GSUWGMRR0_K1_MIWT1_2_PLR0_SS0_SU0_SUM0_SUS0_SVW4_WGM8_WGMXCC1_WGMXCCGn1
    SolutionIndex: 5
    SolutionNameMin: Cijk_Ailk_Bljk_HHS_BH_Bias_HAS_SAV_UserArgs_MT32x128x32_MI32x32x1_SN_CLR1_GRVWB8_GSU1_GSUC0_GSUWGMRR1_K1_LBSPPA0_LPA0_LPB8_LRVW8_MIWT1_1_NEPBS16_SU0_SUM0_SUS0_SVW1_VWA1_VWB1_WG32_8_1_WGM8_WGMXCC1_WGMXCCGn1
    SolutionIndex: 6
    SolutionNameMin: Cijk_Ailk_Bljk_HHS_BH_Bias_HAS_SAV_UserArgs_MT16x256x32_MI16x16x1_SN_GSU1_GSUC0_GSUWGMRR0_K1_MIWT1_4_SU8_SUM0_SUS256_WGM8_WGMXCC1_WGMXCCGn1
    SolutionIndex: 7
    SolutionNameMin: Cijk_Ailk_Bljk_HHS_BH_Bias_HAS_SAV_UserArgs_MT32x256x32_MI16x16x1_SN_CLR1_GRVWB4_GSU1_GSUC0_GSUWGMRR0_K1_LBSPPA256_LBSPPB256_LPA32_LPB4_LRVW4_MIWT2_4_NEPBS16_SU0_SUM0_SUS0_SVW2_VWA2_VWB4_WG16_16_1_WGM8_WGMXCC1_WGMXCCGn1
    SolutionIndex: 8
    SolutionNameMin: Cijk_Ailk_Bljk_HHS_BH_Bias_HAS_SAV_UserArgs_MT48x128x32_MI16x16x1_SN_GSU1_GSUC0_GSUWGMRR0_K1_MIWT3_2_SU8_SUM0_SUS256_WGM8_WGMXCC1_WGMXCCGn1
    SolutionIndex: 9
    SolutionNameMin: Cijk_Ailk_Bljk_HHS_BH_Bias_HAS_SAV_UserArgs_MT64x192x32_MI32x32x1_SN_CLR1_GRVWA8_GRVWB8_GSU1_GSUC0_GSUWGMRR0_K1_LBSPPA0_LPA0_LPB8_LRVW8_MIWT1_3_NEPBS2_SU0_SUM0_SUS0_SVW1_VWA1_VWB1_WG64_4_1_WGM1_WGMXCC1_WGMXCCG0
    SolutionIndex: 10
    SolutionNameMin: Cijk_Ailk_Bljk_HHS_BH_Bias_HAS_SAV_UserArgs_MT32x128x32_MI16x16x1_SN_CLR0_GRVWB4_GSU1_GSUC0_GSUWGMRR0_K1_LBSPPA256_LPA32_LPB4_LRVW4_MIWT2_2_NEPBS16_SU0_SUM0_SUS0_SVW2_VWA2_VWB2_WG16_16_1_WGM8_WGMXCC1_WGMXCCGn1
    SolutionIndex: 11
    SolutionNameMin: Cijk_Ailk_Bljk_HHS_BH_Bias_HAS_SAV_UserArgs_MT64x192x32_MI16x16x1_SN_CLR1_GRVWA8_GRVWB4_GSU1_GSUC0_GSUWGMRR1_K1_LBSPPA512_LPA32_LPB4_LRVW4_MIWT2_6_NEPBS16_SU0_SUM0_SUS0_SVW2_VWA2_VWB2_WG32_8_1_WGM1_WGMXCC1_WGMXCCGn1
    SolutionIndex: 12
    SolutionNameMin: Cijk_Ailk_Bljk_HHS_BH_Bias_HAS_SAV_UserArgs_MT16x128x16_MI16x16x1_SN_GSU1_GSUC0_GSUWGMRR1_K1_MIWT1_2_PLR0_SS0_SU0_SUM0_SUS0_SVW4_WGM8_WGMXCC1_WGMXCCGn1
    SolutionIndex: 13
    SolutionNameMin: Cijk_Ailk_Bljk_HHS_BH_Bias_HAS_SAV_UserArgs_MT32x96x64_MI16x16x1_SN_GSU1_GSUC0_GSUWGMRR0_K1_LBSPPA512_LPA16_LPB16_MIWT1_3_NEPBS16_SU0_SUM0_SUS0_WG32_8_1_WGM1_WGMXCC1_WGMXCCGn1
    SolutionIndex: 14
    SolutionNameMin: Cijk_Ailk_Bljk_HHS_BH_Bias_HAS_SAV_UserArgs_MT32x128x32_MI16x16x1_SN_CLR1_GRVWB4_GSU1_GSUC1_GSUWGMRR1_K1_LBSPPA256_LPA32_LPB4_LRVW4_MIWT2_2_NEPBS16_SU8_SUM0_SUS256_SVW2_VWA2_VWB2_WG16_16_1_WGM8_WGMXCC1_WGMXCCGn1
    SolutionIndex: 15
    SolutionNameMin: Cijk_Ailk_Bljk_HHS_BH_Bias_HAS_SAV_UserArgs_MT32x128x32_MI16x16x1_SN_CLR1_GRVWB4_GSU1_GSUC0_GSUWGMRR1_K1_LBSPPA256_LPA32_LPB4_LRVW4_MIWT2_2_NEPBS16_SU0_SUM0_SUS0_SVW2_VWA2_VWB2_WG16_16_1_WGM8_WGMXCC1_WGMXCCGn1
    SolutionIndex: 16
    SolutionNameMin: Cijk_Ailk_Bljk_HHS_BH_Bias_HAS_SAV_UserArgs_MT16x16x32_MI16x16x1_SN_GSU1_GSUC0_GSUWGMRR0_K1_MIWT1_1_SU8_SUM0_SUS256_WGM1_WGMXCC1_WGMXCCGn1
    SolutionIndex: 17
    SolutionNameMin: Cijk_Ailk_Bljk_HHS_BH_Bias_HAS_SAV_UserArgs_MT64x192x32_MI16x16x1_SN_CLR1_GRVWA8_GRVWB4_GSU1_GSUC0_GSUWGMRR0_K1_LBSPPA512_LPA0_LPB4_LRVW4_MIWT4_3_NEPBS16_SU0_SUM0_SUS0_SVW4_VWA4_VWB1_WG16_16_1_WGM1_WGMXCC1_WGMXCCGn1
    SolutionIndex: 18
    SolutionNameMin: Cijk_Ailk_Bljk_HHS_BH_Bias_HAS_SAV_UserArgs_MT32x256x32_MI16x16x1_SN_CLR0_GRVWB4_GSU1_GSUC0_GSUWGMRR1_K1_LBSPPA256_LBSPPB256_LPA32_LPB4_LRVW4_MIWT2_4_NEPBS2_SU8_SUM0_SUS64_SVW2_VWA2_VWB4_WG16_16_1_WGM8_WGMXCC1_WGMXCCGn1
    SolutionIndex: 19
    SolutionNameMin: Cijk_Ailk_Bljk_HHS_BH_Bias_HAS_SAV_UserArgs_MT16x256x32_MI16x16x1_SN_GSU1_GSUC1_GSUWGMRR0_K1_MIWT1_4_SU8_SUM0_SUS256_WGM8_WGMXCC1_WGMXCCGn1
    SolutionIndex: 20
    SolutionNameMin: Cijk_Ailk_Bljk_HHS_BH_Bias_HAS_SAV_UserArgs_MT32x256x32_MI32x32x1_SN_CLR1_GRVWB8_GSU1_GSUC0_GSUWGMRR1_K1_LBSPPA0_LBSPPB128_LPA0_LPB8_LRVW8_MIWT1_2_NEPBS16_SU0_SUM0_SUS0_SVW1_VWA1_VWB2_WG32_8_1_WGM8_WGMXCC1_WGMXCCGn1
    SolutionIndex: 21
    SolutionNameMin: Cijk_Ailk_Bljk_HHS_BH_Bias_HAS_SAV_UserArgs_MT16x64x16_MI16x16x1_SN_GSU1_GSUC0_GSUWGMRR0_K1_MIWT1_1_NTA0_NTB0_NTD0_NEPBS16_SU0_SUM0_SUS0_WGM0_WGMXCC1_WGMXCCG8
    SolutionIndex: 22
    SolutionNameMin: Cijk_Ailk_Bljk_HHS_BH_Bias_HAS_SAV_UserArgs_MT16x64x16_MI16x16x1_SN_GSU1_GSUC0_GSUWGMRR0_K1_MIWT1_1_NTA0_NTB0_NTD0_NEPBS0_SU0_SUM0_SUS0_WSGRB0_WGM1_WGMXCC1_WGMXCCG38
    SolutionIndex: 23
    SolutionNameMin: Cijk_Ailk_Bljk_HHS_BH_Bias_HAS_SAV_UserArgs_MT16x64x16_MI16x16x1_SN_CLR0_GRVWA1_GSU1_GSUC0_GSUWGMRR1_K1_MIWT1_1_PLR0_SU0_SUM0_SUS0_WGM0_WGMXCC1_WGMXCCG4
    SolutionIndex: 24
    SolutionNameMin: Cijk_Ailk_Bljk_HHS_BH_Bias_HAS_SAV_UserArgs_MT16x64x16_MI16x16x1_SN_CLR0_GRVWA1_GRVWB4_GSU1_GSUC0_GSUWGMRR1_K1_LBSPPA128_LPB4_LRVW4_MIWT1_1_PLR0_SU0_SUM0_SUS0_WGM1_WGMXCC1_WGMXCCG304
    SolutionIndex: 25
    SolutionNameMin: Cijk_Ailk_Bljk_HHS_BH_Bias_HAS_SAV_UserArgs_MT16x64x16_MI16x16x1_SN_GSU1_GSUC0_GSUWGMRR1_K1_MIWT1_1_SU8_SUM0_SUS32_WGM1_WGMXCC8_WGMXCCG0
    SolutionIndex: 26
    SolutionNameMin: Cijk_Ailk_Bljk_HHS_BH_Bias_HAS_SAV_UserArgs_MT16x64x16_MI16x16x1_SN_CLR0_GRVWA1_GSU1_GSUC0_GSUWGMRR1_K1_MIWT1_1_PLR0_SU0_SUM0_SUS0_WGM1_WGMXCC1_WGMXCCG4
    SolutionIndex: 27
    SolutionNameMin: Cijk_Ailk_Bljk_HHS_BH_Bias_HAS_SAV_UserArgs_MT32x96x32_MI16x16x1_SN_GRVWA4_GRVWB4_GSU1_GSUC0_GSUWGMRR0_K1_LBSPPA256_LPB4_LRVW4_MIWT1_3_SU0_SUM0_SUS0_WGM0_WGMXCC1_WGMXCCGn1
    SolutionIndex: 28
    SolutionNameMin: Cijk_Ailk_Bljk_HHS_BH_Bias_HAS_SAV_UserArgs_MT16x64x16_MI16x16x1_SN_GRPM0p50_GRVWA1_GSU8_GSUAMB_GSUC0_GSUWGMRR0_K1_LWPM0p50_MIWT1_1_NTA0_NTB0_NTD0_SU0_SUM0_SUS0_VWB1_WG16_16_1_WGM1_WGMXCC16_WGMXCCG0
    SolutionIndex: 29
    SolutionNameMin: Cijk_Ailk_Bljk_HHS_BH_Bias_HAS_SAV_UserArgs_MT16x64x16_MI16x16x1_SN_CLR0_GRPM0p50_GRVWA1_GRVWB4_GSU16_GSUC0_GSUWGMRR1_K1_LBSPPA128_LBSPPB128_LPB4_LRVW4_LWPM0p50_MIWT1_1_NTA0_NTB0_NTD0_PLR0_SU0_SUM0_SUS0_WGM1_WGMXCC1_WGMXCCG4
- - - [1, 2048, 1, 1]
    - [21, 0.0]
  - - [32, 94, 2048, 128]
    - [27, 0.0]
  - - [15, 33, 2048, 96]
    - [0, 0.0]
  - - [40, 1060, 2048, 160]
    - [1, 0.0]
  - - [16, 36, 2048, 160]
    - [2, 0.0]
  - - [32, 607, 2048, 128]
    - [3, 0.0]
  - - [1, 2048, 1, 32]
    - [26, 0.0]
  - - [1, 2048, 1, 512]
    - [29, 0.0]
  - - [1, 2048, 1, 20]
    - [23, 0.0]
  - - [16, 33, 2048, 96]
    - [4, 0.0]
  - - [24, 81, 2048, 96]
    - [5, 0.0]
  - - [15, 407, 2048, 96]
    - [6, 0.0]
  - - [32, 466, 2048, 160]
    - [7, 0.0]
  - - [40, 105, 2048, 160]
    - [8, 0.0]
  - - [64, 1274, 2048, 160]
    - [9, 0.0]
  - - [32, 89, 2048, 96]
    - [10, 0.0]
  - - [18, 358, 2048, 180]
    - [11, 0.0]
  - - [1, 2048, 1, 128]
    - [25, 0.0]
  - - [16, 103, 2048, 96]
    - [12, 0.0]
  - - [1, 2048, 1, 256]
    - [28, 0.0]
  - - [24, 73, 2048, 128]
    - [13, 0.0]
  - - [1, 2048, 1, 64]
    - [24, 0.0]
  - - [32, 70, 2048, 160]
    - [14, 0.0]
  - - [32, 81, 2048, 96]
    - [15, 0.0]
  - - [15, 29, 2048, 96]
    - [16, 0.0]
  - - [64, 99, 2048, 160]
    - [17, 0.0]
  - - [32, 623, 2048, 96]
    - [18, 0.0]
  - - [16, 488, 2048, 160]
    - [19, 0.0]
  - - [24, 699, 2048, 128]
    - [20, 0.0]
  - - [1, 2048, 1, 2]
    - [22, 0.0]
- null
- null
- DeviceEfficiency
- Equality
