library/src/amd_detail/rocblaslt/src/Tensile/Logic/asm_full/aquavanjaram/gfx942/Equality/aquavanjaram_Cijk_Ailk_Bljk_BBS_BH_UserArgs.yaml
- {MinimumRequiredVersion: 4.33.0}
- aquavanjaram
- gfx942
- [Device 0049, Device 0050]
    SolutionIndex: 0
    SolutionNameMin: Cijk_Ailk_Bljk_BBS_BH_MT128x128x64_MI32x32x1_SN_LDSB1_GRVWB8_GSU1_LBSPPA0_LBSPPB128_LPA0_LPB8_LRVW8_MIWT2_2_SVW2_VWA2_WG64_4_1
    SolutionIndex: 1
    SolutionNameMin: Cijk_Ailk_Bljk_BBS_BH_MT128x32x64_MI16x16x1_SN_LDSB1_GRVWB8_GSU1_LBSPPA2048_LBSPPB128_LPA16_LPB16_LRVW8_MIWT2_2_SVW2_VWA2_WG64_4_1
    SolutionIndex: 2
    SolutionNameMin: Cijk_Ailk_Bljk_BBS_BH_MT256x224x64_MI16x16x1_SN_LDSB1_GRVWB4_GSU1_LBSPPA2048_LBSPPB128_LPA16_LPB4_LRVW4_MIWT4_14_SVW4_VWA4_WG64_4_1
    SolutionIndex: 3
    SolutionNameMin: Cijk_Ailk_Bljk_BBS_BH_MT16x256x64_MI16x16x1_SN_LDSB1_GSU8_LWPM0p30_MIWT1_4_NTB0_SU4_SUM2_SUS256_SPO0_WG16_16_1
    SolutionIndex: 4
    SolutionNameMin: Cijk_Ailk_Bljk_BBS_BH_MT16x32x64_MI16x16x1_SN_LDSB0_GSU8_LWPM0p35_MIWT1_1_NTB0_SU0_SUM0_SUS0_SPO1_WG16_8_1
    SolutionIndex: 5
    SolutionNameMin: Cijk_Ailk_Bljk_BBS_BH_MT16x32x64_MI16x16x1_SN_LDSB0_GSU20_LWPM0p30_MIWT1_1_NTB1_SU0_SUM0_SUS0_SPO1_WG16_8_1
    SolutionIndex: 6
    SolutionNameMin: Cijk_Ailk_Bljk_BBS_BH_MT256x128x32_MI16x16x1_SN_LDSB1_GRVWB4_GSU1_LBSPPA2048_LBSPPB128_LPA16_LWPMn1_MIWT4_8_SU4_SUM2_SUS256_SVW4_VWA4_WG64_4_1
    SolutionIndex: 7
    SolutionNameMin: Cijk_Ailk_Bljk_BBS_BH_MT256x144x64_MI16x16x1_SN_LDSB1_GRVWB4_GSU1_LBSPPA2048_LBSPPB128_LPA16_LWPMn1_MIWT4_9_SU0_SUM0_SUS0_SVW4_VWA4_WG64_4_1
    SolutionIndex: 8
    SolutionNameMin: Cijk_Ailk_Bljk_BBS_BH_UserArgs_MT256x240x64_MI16x16x1_SN_GRVWA8_GRVWB4_GSU1_LBSPPA2048_LBSPPB128_LPA0_LPB4_LRVW4_MIWT4_15_NTA2_NTB0_NTC6_NTD6_SS1_SU0_SUM0_SUS0_SPO0_SVW4_VWA4_VWB1_WGM32
    SolutionIndex: 9
    SolutionNameMin: Cijk_Ailk_Bljk_BBS_BH_UserArgs_MT256x160x64_MI16x16x1_SN_GRVWA8_GRVWB2_GSU1_LBSPPA2048_LBSPPB256_LPA0_LPB4_LRVW4_MIWT4_10_NTA1_NTB3_NTC7_NTD7_SS1_SU0_SUM0_SUS0_SPO0_SVW4_VWA4_VWB2_WGM1
    SolutionIndex: 10
    SolutionNameMin: Cijk_Ailk_Bljk_BBS_BH_UserArgs_MT256x240x64_MI16x16x1_SN_GRVWA8_GRVWB4_GSU1_LBSPPA2048_LBSPPB128_LPA0_LPB4_LRVW4_MIWT4_15_NTA2_NTB0_NTC4_NTD4_SS1_SU0_SUM0_SUS0_SPO0_SVW4_VWA4_VWB1_WGM32
    SolutionIndex: 11
    SolutionNameMin: Cijk_Ailk_Bljk_BBS_BH_UserArgs_MT256x240x64_MI16x16x1_SN_GRVWA8_GRVWB4_GSU1_LBSPPA2048_LBSPPB128_LPA0_LPB4_LRVW4_MIWT4_15_NTA1_NTB3_NTC5_NTD5_SS1_SU0_SUM0_SUS0_SPO1_SVW4_VWA4_VWB1_WGM32
    SolutionIndex: 12
    SolutionNameMin: Cijk_Ailk_Bljk_BBS_BH_UserArgs_MT256x240x64_MI16x16x1_SN_GRVWA8_GRVWB4_GSU1_LBSPPA2048_LBSPPB128_LPA0_LPB4_LRVW4_MIWT4_15_NTA1_NTB3_NTC7_NTD7_SS1_SU0_SUM0_SUS0_SPO1_SVW4_VWA4_VWB1_WGM32
    SolutionIndex: 13
    SolutionNameMin: Cijk_Ailk_Bljk_BBS_BH_UserArgs_MT256x160x64_MI16x16x1_SN_GRVWA8_GRVWB2_GSU1_LBSPPA2048_LBSPPB256_LPA0_LPB4_LRVW4_MIWT4_10_NTA5_NTB2_NTC0_NTD0_SS1_SU0_SUM0_SUS0_SPO0_SVW4_VWA4_VWB2_WGM1
    SolutionIndex: 14
    SolutionNameMin: Cijk_Ailk_Bljk_BBS_BH_UserArgs_MT256x160x64_MI16x16x1_SN_GRVWA8_GRVWB2_GSU1_LBSPPA2048_LBSPPB256_LPA0_LPB4_LRVW4_MIWT4_10_NTA1_NTB3_NTC4_NTD4_SS1_SU0_SUM0_SUS0_SPO0_SVW4_VWA4_VWB2_WGM1
    SolutionIndex: 15
    SolutionNameMin: Cijk_Ailk_Bljk_BBS_BH_UserArgs_MT256x240x64_MI16x16x1_SN_GRVWA8_GRVWB4_GSU1_LBSPPA2048_LBSPPB128_LPA0_LPB4_LRVW4_MIWT4_15_NTA2_NTB3_NTC5_NTD5_SS1_SU0_SUM0_SUS0_SPO0_SVW4_VWA4_VWB1_WGM32
    SolutionIndex: 16
    SolutionNameMin: Cijk_Ailk_Bljk_BBS_BH_UserArgs_MT256x240x64_MI16x16x1_SN_GRVWA8_GRVWB4_GSU1_LBSPPA2048_LBSPPB128_LPA0_LPB4_LRVW4_MIWT4_15_NTA1_NTB0_NTC5_NTD5_SS1_SU0_SUM0_SUS0_SPO0_SVW4_VWA4_VWB1_WGM32
    SolutionIndex: 17
    SolutionNameMin: Cijk_Ailk_Bljk_BBS_BH_UserArgs_MT256x240x64_MI16x16x1_SN_GRVWA8_GRVWB4_GSU1_LBSPPA2048_LBSPPB128_LPA0_LPB4_LRVW4_MIWT4_15_NTA0_NTB7_NTC6_NTD6_SS1_SU0_SUM0_SUS0_SPO0_SVW4_VWA4_VWB1_WGM8
- - - [512, 512, 1, 512]
    - [1, 0.0]
  - - [1024, 1024, 1, 1024]
    - [0, 0.0]
  - - [2048, 2048, 1, 2048]
    - [0, 0.0]
  - - [4096, 4096, 1, 4096]
    - [2, 0.0]
  - - [4096, 4096, 1, 8192]
    - [2, 0.0]
  - - [8192, 8192, 1, 8192]
    - [2, 0.0]
  - - [2, 7168, 1, 8192]
    - [3, 0.0]
  - - [2, 3584, 1, 8192]
    - [4, 0.0]
  - - [2, 1280, 1, 8192]
    - [5, 0.0]
  - - [8192, 7168, 1, 8192]
    - [6, 0.0]
  - - [8192, 3584, 1, 8192]
    - [6, 0.0]
  - - [8192, 1280, 1, 8192]
    - [7, 0.0]
  - - [1024, 32768, 1, 8192]
    - [8, 0.0]
  - - [11008, 2048, 1, 4096]
    - [9, 0.0]
  - - [11008, 65536, 1, 4096]
    - [10, 0.0]
  - - [28672, 32768, 1, 8192]
    - [11, 0.0]
  - - [32000, 32768, 1, 8192]
    - [12, 0.0]
  - - [32000, 65536, 1, 4096]
    - [12, 0.0]
  - - [4096, 2048, 1, 12288]
    - [9, 0.0]
  - - [4096, 2048, 1, 22016]
    - [9, 0.0]
  - - [4096, 2048, 1, 32000]
    - [13, 0.0]
  - - [4096, 2048, 1, 4096]
    - [14, 0.0]
  - - [4096, 65536, 1, 4096]
    - [15, 0.0]
  - - [8192, 32768, 1, 8192]
    - [15, 0.0]
  - - [11008, 49152, 1, 4096]
    - [16, 0.0]
  - - [4096, 49152, 1, 4096]
    - [16, 0.0]
  - - [32000, 49152, 1, 4096]
    - [15, 0.0]
  - - [28672, 57344, 1, 8192]
    - [15, 0.0]
  - - [8192, 57344, 1, 8192]
    - [14, 0.0]
  - - [1024, 57344, 1, 8192]
    - [17, 0.0]
  - - [32000, 57344, 1, 8192]
    - [10, 0.0]
- null
- null
- DeviceEfficiency
- Equality
